[I 2025-12-08 17:52:23,381] Trial 28 finished with value: 0.29494450382238807 and parameters: {'model_type': 'gcn', 'hidden_dims': '[256, 128]', 'dropout': 0.5323864797256077, 'batch_norm': True, 'lr': 2.376826597654839e-05, 'weight_decay': 0.00041114538193891926, 'epochs': 225, 'loss': 'mae', 'optimizer': 'adam', 'graph_mode': 'cutoff', 'cutoff': 0.6444364822155395, 'grm_norm': 'cosine_then_gcn', 'self_loops': False, 'use_snp_selection': True, 'num_snps': 22731}. Best is trial 28 with value: 0.29494450382238807.
[I 2025-12-08 17:53:03,263] Trial 29 finished with value: 0.20577828682672666 and parameters: {'model_type': 'gcn', 'hidden_dims': '[256, 128]', 'dropout': 0.5590025530664182, 'batch_norm': True, 'lr': 1.6735476121936112e-05, 'weight_decay': 0.0004288338167995702, 'epochs': 272, 'loss': 'mae', 'optimizer': 'adam', 'graph_mode': 'knn', 'knn_k': 1, 'weighted_edges': False, 'symmetrize_mode': 'union', 'self_loops': True, 'use_snp_selection': True, 'num_snps': 44698}. Best is trial 28 with value: 0.29494450382238807.
[I 2025-12-08 17:53:28,242] Trial 30 finished with value: 0.2586029175556546 and parameters: {'model_type': 'gcn', 'hidden_dims': '[256, 128]', 'dropout': 0.5991438892216123, 'batch_norm': True, 'lr': 2.084960697295493e-05, 'weight_decay': 0.0009697606166750815, 'epochs': 318, 'loss': 'mae', 'optimizer': 'adam', 'graph_mode': 'cutoff', 'cutoff': 0.5420987715086172, 'grm_norm': 'gcn', 'self_loops': False, 'use_snp_selection': True, 'num_snps': 18530}. Best is trial 28 with value: 0.29494450382238807.
[I 2025-12-08 17:53:52,117] Trial 31 finished with value: 0.2869933662773952 and parameters: {'model_type': 'gcn', 'hidden_dims': '[256, 128]', 'dropout': 0.5192515805129424, 'batch_norm': True, 'lr': 2.6645814066314104e-05, 'weight_decay': 0.0001891014745001165, 'epochs': 227, 'loss': 'mae', 'optimizer': 'adam', 'graph_mode': 'cutoff', 'cutoff': 0.6364252838180584, 'grm_norm': 'cosine_then_gcn', 'self_loops': False, 'use_snp_selection': True, 'num_snps': 24094}. Best is trial 28 with value: 0.29494450382238807.
[I 2025-12-08 17:54:29,673] Trial 32 finished with value: 0.29472128732655445 and parameters: {'model_type': 'gcn', 'hidden_dims': '[512, 128]', 'dropout': 0.5322782010688621, 'batch_norm': True, 'lr': 1.1067340633623507e-05, 'weight_decay': 0.00047218912368003705, 'epochs': 259, 'loss': 'mae', 'optimizer': 'adam', 'graph_mode': 'cutoff', 'cutoff': 0.6693373466918092, 'grm_norm': 'cosine_then_gcn', 'self_loops': False, 'use_snp_selection': True, 'num_snps': 24970}. Best is trial 28 with value: 0.29494450382238807.
[I 2025-12-08 17:55:05,238] Trial 33 finished with value: 0.258363501060667 and parameters: {'model_type': 'gcn', 'hidden_dims': '[512, 128]', 'dropout': 0.5547318659370026, 'batch_norm': True, 'lr': 1.0205774390833852e-05, 'weight_decay': 0.0004207792918929684, 'epochs': 203, 'loss': 'mae', 'optimizer': 'adam', 'graph_mode': 'cutoff', 'cutoff': 0.5706082813514567, 'grm_norm': 'cosine_then_gcn', 'self_loops': False, 'use_snp_selection': True, 'num_snps': 29075}. Best is trial 28 with value: 0.29494450382238807.
[I 2025-12-08 17:56:11,250] Trial 34 finished with value: 0.26014764315010824 and parameters: {'model_type': 'gcn', 'hidden_dims': '[512, 128]', 'dropout': 0.5362749819927638, 'batch_norm': True, 'lr': 1.5853402313116522e-05, 'weight_decay': 0.00046069149271362885, 'epochs': 262, 'loss': 'mae', 'optimizer': 'adam', 'graph_mode': 'cutoff', 'cutoff': 0.6679020715198802, 'grm_norm': 'cosine_then_gcn', 'self_loops': False, 'use_snp_selection': False}. Best is trial 28 with value: 0.29494450382238807.
[I 2025-12-08 17:56:28,511] Trial 35 finished with value: 0.2468174097471269 and parameters: {'model_type': 'gcn', 'hidden_dims': '[512, 128]', 'dropout': 0.4740048478267258, 'batch_norm': True, 'lr': 5.867659592217371e-05, 'weight_decay': 0.0005337568072615498, 'epochs': 213, 'loss': 'mae', 'optimizer': 'adam', 'graph_mode': 'knn', 'knn_k': 10, 'weighted_edges': True, 'symmetrize_mode': 'mutual', 'self_loops': True, 'use_snp_selection': True, 'num_snps': 6662}. Best is trial 28 with value: 0.29494450382238807.
[I 2025-12-08 17:57:01,740] Trial 36 finished with value: 0.2835931297017165 and parameters: {'model_type': 'gcn', 'hidden_dims': '[256, 128]', 'dropout': 0.5689186147231341, 'batch_norm': True, 'lr': 2.7920309346797927e-05, 'weight_decay': 0.00017159268708331958, 'epochs': 288, 'loss': 'mae', 'optimizer': 'adam', 'graph_mode': 'cutoff', 'cutoff': 0.7727529880613372, 'grm_norm': 'cosine_then_gcn', 'self_loops': False, 'use_snp_selection': True, 'num_snps': 32609}. Best is trial 28 with value: 0.29494450382238807.
[I 2025-12-08 17:57:27,188] Trial 37 finished with value: 0.2247279367960064 and parameters: {'model_type': 'gcn', 'hidden_dims': '[256, 128, 64]', 'dropout': 0.48910548126558484, 'batch_norm': True, 'lr': 1.3657307563870297e-05, 'weight_decay': 0.00029778114875945907, 'epochs': 192, 'loss': 'mae', 'optimizer': 'adam', 'graph_mode': 'cutoff', 'cutoff': 0.48093870235787967, 'grm_norm': 'cosine_then_gcn', 'self_loops': False, 'use_snp_selection': False}. Best is trial 28 with value: 0.29494450382238807.
[I 2025-12-08 17:58:02,292] Trial 38 finished with value: 0.26647675789956826 and parameters: {'model_type': 'gcn', 'hidden_dims': '[512, 64]', 'dropout': 0.4507655252480115, 'batch_norm': True, 'lr': 5.888071314348753e-05, 'weight_decay': 8.56032223704936e-05, 'epochs': 218, 'loss': 'mae', 'optimizer': 'adam', 'graph_mode': 'cutoff', 'cutoff': 0.6704491605993943, 'grm_norm': 'gcn', 'self_loops': True, 'use_snp_selection': True, 'num_snps': 26697}. Best is trial 28 with value: 0.29494450382238807.
[I 2025-12-08 17:58:48,592] Trial 39 finished with value: 0.2724981726036433 and parameters: {'model_type': 'gcn', 'hidden_dims': '[512, 128]', 'dropout': 0.5821340787489182, 'batch_norm': True, 'lr': 1.0209762826245713e-05, 'weight_decay': 3.303450050941413e-07, 'epochs': 304, 'loss': 'mae', 'optimizer': 'adam', 'graph_mode': 'knn', 'knn_k': 6, 'weighted_edges': False, 'symmetrize_mode': 'union', 'self_loops': False, 'use_snp_selection': True, 'num_snps': 26360}. Best is trial 28 with value: 0.29494450382238807.
[I 2025-12-08 17:59:12,454] Trial 40 finished with value: 0.2571550162562784 and parameters: {'model_type': 'gcn', 'hidden_dims': '[128, 64]', 'dropout': 0.49180013765986025, 'batch_norm': False, 'lr': 9.104312455622348e-05, 'weight_decay': 0.0005575667665048782, 'epochs': 330, 'loss': 'mae', 'optimizer': 'adam', 'graph_mode': 'cutoff', 'cutoff': 0.5771730445845187, 'grm_norm': 'cosine_then_gcn', 'self_loops': False, 'use_snp_selection': False}. Best is trial 28 with value: 0.29494450382238807.
[I 2025-12-08 17:59:45,129] Trial 41 finished with value: 0.2858742776939606 and parameters: {'model_type': 'gcn', 'hidden_dims': '[512, 256]', 'dropout': 0.5324868630080432, 'batch_norm': True, 'lr': 0.0002981631593097036, 'weight_decay': 6.04660749388519e-05, 'epochs': 241, 'loss': 'mae', 'optimizer': 'adam', 'graph_mode': 'cutoff', 'cutoff': 0.6483707667974192, 'grm_norm': 'cosine_then_gcn', 'self_loops': False, 'use_snp_selection': True, 'num_snps': 21905}. Best is trial 28 with value: 0.29494450382238807.
[I 2025-12-08 18:00:18,544] Trial 42 finished with value: 0.2870778149992145 and parameters: {'model_type': 'gcn', 'hidden_dims': '[512, 256]', 'dropout': 0.5315251587916389, 'batch_norm': True, 'lr': 0.0001458633324421091, 'weight_decay': 0.00032910588263879604, 'epochs': 229, 'loss': 'mae', 'optimizer': 'adam', 'graph_mode': 'cutoff', 'cutoff': 0.700357109513394, 'grm_norm': 'cosine_then_gcn', 'self_loops': False, 'use_snp_selection': True, 'num_snps': 23831}. Best is trial 28 with value: 0.29494450382238807.
[I 2025-12-08 18:01:07,044] Trial 43 finished with value: 0.2782507946132964 and parameters: {'model_type': 'gcn', 'hidden_dims': '[256, 128]', 'dropout': 0.560011350957703, 'batch_norm': True, 'lr': 3.190416143091448e-05, 'weight_decay': 0.00020223959457230532, 'epochs': 263, 'loss': 'mae', 'optimizer': 'adam', 'graph_mode': 'cutoff', 'cutoff': 0.7583325863758625, 'grm_norm': 'cosine_then_gcn', 'self_loops': False, 'use_snp_selection': True, 'num_snps': 59433}. Best is trial 28 with value: 0.29494450382238807.
[I 2025-12-08 18:01:38,604] Trial 44 finished with value: 0.26783418790143787 and parameters: {'model_type': 'gcn', 'hidden_dims': '[512, 256]', 'dropout': 0.487483583465228, 'batch_norm': True, 'lr': 0.000573156685565647, 'weight_decay': 0.00012611740988332292, 'epochs': 279, 'loss': 'mae', 'optimizer': 'adam', 'graph_mode': 'cutoff', 'cutoff': 0.6165951744443315, 'grm_norm': 'gcn', 'self_loops': False, 'use_snp_selection': True, 'num_snps': 17688}. Best is trial 28 with value: 0.29494450382238807.
[I 2025-12-08 18:02:00,982] Trial 45 finished with value: 0.29134995543392106 and parameters: {'model_type': 'gcn', 'hidden_dims': '[512, 128]', 'dropout': 0.5768299136362308, 'batch_norm': True, 'lr': 2.112345867928836e-05, 'weight_decay': 2.6312659167594485e-05, 'epochs': 238, 'loss': 'mae', 'optimizer': 'adam', 'graph_mode': 'cutoff', 'cutoff': 0.8245754309598473, 'grm_norm': 'cosine', 'self_loops': False, 'use_snp_selection': True, 'num_snps': 12150}. Best is trial 28 with value: 0.29494450382238807.
[I 2025-12-08 18:02:25,820] Trial 46 finished with value: 0.2765405706289411 and parameters: {'model_type': 'gcn', 'hidden_dims': '[512, 128]', 'dropout': 0.1435600910462052, 'batch_norm': True, 'lr': 2.0788262020285614e-05, 'weight_decay': 6.156028218851922e-06, 'epochs': 249, 'loss': 'mae', 'optimizer': 'adam', 'graph_mode': 'cutoff', 'cutoff': 0.804020190289216, 'grm_norm': 'cosine', 'self_loops': True, 'use_snp_selection': True, 'num_snps': 13991}. Best is trial 28 with value: 0.29494450382238807.
[I 2025-12-08 18:02:42,701] Trial 47 finished with value: 0.26813504157447204 and parameters: {'model_type': 'gcn', 'hidden_dims': '[512, 128]', 'dropout': 0.583901238380935, 'batch_norm': True, 'lr': 1.3901783044436309e-05, 'weight_decay': 3.165309608251734e-05, 'epochs': 257, 'loss': 'mae', 'optimizer': 'adam', 'graph_mode': 'cutoff', 'cutoff': 0.610085677796845, 'grm_norm': 'cosine', 'self_loops': False, 'use_snp_selection': True, 'num_snps': 5951}. Best is trial 28 with value: 0.29494450382238807.
[I 2025-12-08 18:03:34,292] Trial 48 finished with value: 0.2812264203780234 and parameters: {'model_type': 'gcn', 'hidden_dims': '[512, 128]', 'dropout': 0.5641952466989427, 'batch_norm': False, 'lr': 5.353585928486438e-05, 'weight_decay': 0.0009960534335771698, 'epochs': 203, 'loss': 'mae', 'optimizer': 'adam', 'graph_mode': 'cutoff', 'cutoff': 0.8378765637386525, 'grm_norm': 'cosine', 'self_loops': False, 'use_snp_selection': False}. Best is trial 28 with value: 0.29494450382238807.
[I 2025-12-08 18:03:56,231] Trial 49 finished with value: 0.27188467723885734 and parameters: {'model_type': 'gcn', 'hidden_dims': '[512, 128]', 'dropout': 0.4423856979171411, 'batch_norm': True, 'lr': 2.1032684412812226e-05, 'weight_decay': 3.417380512371446e-06, 'epochs': 224, 'loss': 'mse', 'optimizer': 'adam', 'graph_mode': 'cutoff', 'cutoff': 0.8216911738137151, 'grm_norm': 'cosine', 'self_loops': False, 'use_snp_selection': True, 'num_snps': 12548}. Best is trial 28 with value: 0.29494450382238807.
[I 2025-12-08 18:04:10,547] Trial 50 finished with value: 0.23044996230687054 and parameters: {'model_type': 'gcn', 'hidden_dims': '[128, 64]', 'dropout': 0.3986691126606004, 'batch_norm': True, 'lr': 8.239845159832866e-05, 'weight_decay': 1.9938850165462526e-05, 'epochs': 293, 'loss': 'mae', 'optimizer': 'adam', 'graph_mode': 'knn', 'knn_k': 4, 'weighted_edges': True, 'symmetrize_mode': 'mutual', 'self_loops': False, 'use_snp_selection': True, 'num_snps': 7766}. Best is trial 28 with value: 0.29494450382238807.
[I 2025-12-08 18:04:49,817] Trial 51 finished with value: 0.28803706545245805 and parameters: {'model_type': 'gcn', 'hidden_dims': '[512, 256]', 'dropout': 0.5213284705122934, 'batch_norm': True, 'lr': 0.0003104185356797557, 'weight_decay': 5.429208501926132e-05, 'epochs': 236, 'loss': 'mae', 'optimizer': 'adam', 'graph_mode': 'cutoff', 'cutoff': 0.6817696336933654, 'grm_norm': 'cosine', 'self_loops': False, 'use_snp_selection': True, 'num_snps': 28980}. Best is trial 28 with value: 0.29494450382238807.
[I 2025-12-08 18:05:29,351] Trial 52 finished with value: 0.2831560596351499 and parameters: {'model_type': 'gcn', 'hidden_dims': '[512, 64]', 'dropout': 0.5423361773535141, 'batch_norm': True, 'lr': 0.0009012324783333155, 'weight_decay': 4.268840587668842e-05, 'epochs': 242, 'loss': 'mae', 'optimizer': 'adam', 'graph_mode': 'cutoff', 'cutoff': 0.6933048594212603, 'grm_norm': 'cosine', 'self_loops': False, 'use_snp_selection': True, 'num_snps': 28730}. Best is trial 28 with value: 0.29494450382238807.
[I 2025-12-08 18:06:09,145] Trial 53 finished with value: 0.28236912848406187 and parameters: {'model_type': 'gcn', 'hidden_dims': '[512, 256]', 'dropout': 0.5789222599647735, 'batch_norm': True, 'lr': 0.000302382001611047, 'weight_decay': 9.970057908598362e-06, 'epochs': 180, 'loss': 'mae', 'optimizer': 'adam', 'graph_mode': 'cutoff', 'cutoff': 0.7527006257256542, 'grm_norm': 'cosine', 'self_loops': False, 'use_snp_selection': True, 'num_snps': 37341}. Best is trial 28 with value: 0.29494450382238807.
[I 2025-12-08 18:06:37,100] Trial 54 finished with value: 0.2986725876748172 and parameters: {'model_type': 'gcn', 'hidden_dims': '[512, 256]', 'dropout': 0.5996580646864292, 'batch_norm': True, 'lr': 2.6313976661659255e-05, 'weight_decay': 1.38053290321733e-05, 'epochs': 211, 'loss': 'mae', 'optimizer': 'adam', 'graph_mode': 'cutoff', 'cutoff': 0.6294108182771544, 'grm_norm': 'cosine', 'self_loops': False, 'use_snp_selection': True, 'num_snps': 19117}. Best is trial 54 with value: 0.2986725876748172.
[I 2025-12-08 18:06:57,968] Trial 55 finished with value: 0.2772564617793154 and parameters: {'model_type': 'gcn', 'hidden_dims': '[256, 128]', 'dropout': 0.597284693141756, 'batch_norm': True, 'lr': 2.69753403827765e-05, 'weight_decay': 1.1552451679979662e-05, 'epochs': 213, 'loss': 'mae', 'optimizer': 'adam', 'graph_mode': 'cutoff', 'cutoff': 0.5823297055592134, 'grm_norm': 'cosine', 'self_loops': False, 'use_snp_selection': True, 'num_snps': 19462}. Best is trial 54 with value: 0.2986725876748172.
[I 2025-12-08 18:07:22,813] Trial 56 finished with value: 0.28504026019258355 and parameters: {'model_type': 'gcn', 'hidden_dims': '[512, 128]', 'dropout': 0.5709245078747932, 'batch_norm': True, 'lr': 3.816308189890244e-05, 'weight_decay': 1.2028543345293332e-06, 'epochs': 273, 'loss': 'mse', 'optimizer': 'adam', 'graph_mode': 'cutoff', 'cutoff': 0.8978446605601647, 'grm_norm': 'cosine', 'self_loops': False, 'use_snp_selection': True, 'num_snps': 12779}. Best is trial 54 with value: 0.2986725876748172.
[I 2025-12-08 18:07:42,408] Trial 57 finished with value: 0.24003890654240392 and parameters: {'model_type': 'gcn', 'hidden_dims': '[256, 128, 64]', 'dropout': 0.5027262735617237, 'batch_norm': False, 'lr': 1.1839873186037849e-05, 'weight_decay': 0.0006630625118227437, 'epochs': 203, 'loss': 'mae', 'optimizer': 'adam', 'graph_mode': 'cutoff', 'cutoff': 0.6393970037169376, 'grm_norm': 'none', 'self_loops': False, 'use_snp_selection': True, 'num_snps': 15926}. Best is trial 54 with value: 0.2986725876748172.
[I 2025-12-08 18:08:08,586] Trial 58 finished with value: 0.22725840452644067 and parameters: {'model_type': 'gcn', 'hidden_dims': '[512, 256]', 'dropout': 0.31422107907394725, 'batch_norm': True, 'lr': 4.645047259280296e-05, 'weight_decay': 3.785118223033105e-06, 'epochs': 196, 'loss': 'mae', 'optimizer': 'adam', 'graph_mode': 'cutoff', 'cutoff': 0.5158405408236019, 'grm_norm': 'cosine', 'self_loops': False, 'use_snp_selection': True, 'num_snps': 18494}. Best is trial 54 with value: 0.2986725876748172.
[I 2025-12-08 18:08:20,543] Trial 59 finished with value: 0.2455345733306309 and parameters: {'model_type': 'gcn', 'hidden_dims': '[128, 64]', 'dropout': 0.5458862379183355, 'batch_norm': True, 'lr': 1.5946750051077924e-05, 'weight_decay': 0.00030924535416517964, 'epochs': 262, 'loss': 'mae', 'optimizer': 'adam', 'graph_mode': 'cutoff', 'cutoff': 0.7291556730716344, 'grm_norm': 'gcn', 'self_loops': True, 'use_snp_selection': True, 'num_snps': 3916}. Best is trial 54 with value: 0.2986725876748172.
[I 2025-12-08 18:08:43,737] Trial 60 finished with value: 0.2553543392481984 and parameters: {'model_type': 'gcn', 'hidden_dims': '[512, 256]', 'dropout': 0.578754289045972, 'batch_norm': True, 'lr': 3.089101673632151e-05, 'weight_decay': 0.00010435551667098002, 'epochs': 253, 'loss': 'mse', 'optimizer': 'adam', 'graph_mode': 'cutoff', 'cutoff': 0.3724356977484802, 'grm_norm': 'cosine_then_gcn', 'self_loops': False, 'use_snp_selection': True, 'num_snps': 11510}. Best is trial 54 with value: 0.2986725876748172.
[I 2025-12-08 18:09:22,609] Trial 61 finished with value: 0.2881784140415718 and parameters: {'model_type': 'gcn', 'hidden_dims': '[512, 256]', 'dropout': 0.5236401682461644, 'batch_norm': True, 'lr': 1.791135539406843e-05, 'weight_decay': 1.576133819650702e-05, 'epochs': 220, 'loss': 'mae', 'optimizer': 'adam', 'graph_mode': 'cutoff', 'cutoff': 0.6349212989652281, 'grm_norm': 'cosine', 'self_loops': False, 'use_snp_selection': True, 'num_snps': 30307}. Best is trial 54 with value: 0.2986725876748172.
[I 2025-12-08 18:10:02,730] Trial 62 finished with value: 0.2897278887164808 and parameters: {'model_type': 'gcn', 'hidden_dims': '[512, 256]', 'dropout': 0.5980742177819718, 'batch_norm': True, 'lr': 1.8844400142079554e-05, 'weight_decay': 1.78653633514064e-05, 'epochs': 218, 'loss': 'mae', 'optimizer': 'adam', 'graph_mode': 'cutoff', 'cutoff': 0.6007305624047701, 'grm_norm': 'cosine', 'self_loops': False, 'use_snp_selection': True, 'num_snps': 31919}. Best is trial 54 with value: 0.2986725876748172.
[I 2025-12-08 18:10:32,474] Trial 63 finished with value: 0.28633217239928505 and parameters: {'model_type': 'gcn', 'hidden_dims': '[512, 256]', 'dropout': 0.5975806480767241, 'batch_norm': True, 'lr': 2.393468547173576e-05, 'weight_decay': 8.685035794921486e-06, 'epochs': 167, 'loss': 'mae', 'optimizer': 'adam', 'graph_mode': 'cutoff', 'cutoff': 0.6075731649143133, 'grm_norm': 'cosine', 'self_loops': False, 'use_snp_selection': True, 'num_snps': 25997}. Best is trial 54 with value: 0.2986725876748172.
[I 2025-12-08 18:11:00,231] Trial 64 finished with value: 0.270722903987248 and parameters: {'model_type': 'gcn', 'hidden_dims': '[512, 256]', 'dropout': 0.5549070096494418, 'batch_norm': True, 'lr': 7.131794735141594e-05, 'weight_decay': 2.5630187825418308e-05, 'epochs': 187, 'loss': 'mae', 'optimizer': 'adam', 'graph_mode': 'cutoff', 'cutoff': 0.5489277047797726, 'grm_norm': 'cosine', 'self_loops': False, 'use_snp_selection': True, 'num_snps': 21115}. Best is trial 54 with value: 0.2986725876748172.
[I 2025-12-08 18:11:44,050] Trial 65 finished with value: 0.2781892828399525 and parameters: {'model_type': 'gcn', 'hidden_dims': '[512, 256]', 'dropout': 0.5737849951685289, 'batch_norm': True, 'lr': 3.3740148272004685e-05, 'weight_decay': 1.6498029170290336e-05, 'epochs': 246, 'loss': 'mae', 'optimizer': 'adam', 'graph_mode': 'cutoff', 'cutoff': 0.7184541128264113, 'grm_norm': 'none', 'self_loops': False, 'use_snp_selection': True, 'num_snps': 32660}. Best is trial 54 with value: 0.2986725876748172.
[I 2025-12-08 18:12:14,412] Trial 66 finished with value: 0.25378316945489904 and parameters: {'model_type': 'gcn', 'hidden_dims': '[256, 128]', 'dropout': 0.3702599170999101, 'batch_norm': True, 'lr': 1.3636519484468112e-05, 'weight_decay': 0.00024907755194796075, 'epochs': 235, 'loss': 'mae', 'optimizer': 'adam', 'graph_mode': 'knn', 'knn_k': 8, 'weighted_edges': True, 'symmetrize_mode': 'union', 'self_loops': False, 'use_snp_selection': False}. Best is trial 54 with value: 0.2986725876748172.
[I 2025-12-08 18:13:03,488] Trial 67 finished with value: 0.28086325089999464 and parameters: {'model_type': 'gcn', 'hidden_dims': '[512, 128]', 'dropout': 0.5998905719950172, 'batch_norm': False, 'lr': 1.874778515814362e-05, 'weight_decay': 0.0006378092304812717, 'epochs': 215, 'loss': 'mae', 'optimizer': 'adam', 'graph_mode': 'cutoff', 'cutoff': 0.5789445216465356, 'grm_norm': 'cosine_then_gcn', 'self_loops': False, 'use_snp_selection': True, 'num_snps': 42215}. Best is trial 54 with value: 0.2986725876748172.
[I 2025-12-08 18:13:22,339] Trial 68 finished with value: 0.28134025100980614 and parameters: {'model_type': 'gcn', 'hidden_dims': '[512, 64]', 'dropout': 0.42094621090729933, 'batch_norm': True, 'lr': 4.258368813646598e-05, 'weight_decay': 4.699420332143628e-06, 'epochs': 226, 'loss': 'mae', 'optimizer': 'adam', 'graph_mode': 'cutoff', 'cutoff': 0.6598407872440393, 'grm_norm': 'cosine_then_gcn', 'self_loops': False, 'use_snp_selection': True, 'num_snps': 8960}. Best is trial 54 with value: 0.2986725876748172.
[I 2025-12-08 18:13:45,596] Trial 69 finished with value: 0.2873045507436858 and parameters: {'model_type': 'gcn', 'hidden_dims': '[512, 256]', 'dropout': 0.2483225452974397, 'batch_norm': True, 'lr': 0.00010254233706729149, 'weight_decay': 0.0003604348115244021, 'epochs': 206, 'loss': 'mae', 'optimizer': 'adam', 'graph_mode': 'cutoff', 'cutoff': 0.8536018404149273, 'grm_norm': 'cosine', 'self_loops': False, 'use_snp_selection': True, 'num_snps': 14608}. Best is trial 54 with value: 0.2986725876748172.
[I 2025-12-08 18:14:06,394] Trial 70 finished with value: 0.2460268972194412 and parameters: {'model_type': 'gcn', 'hidden_dims': '[256, 128, 64]', 'dropout': 0.5453191036568122, 'batch_norm': True, 'lr': 0.0033484319814468034, 'weight_decay': 0.00014948638739181684, 'epochs': 179, 'loss': 'mse', 'optimizer': 'adam', 'graph_mode': 'cutoff', 'cutoff': 0.20732385001746928, 'grm_norm': 'cosine_then_gcn', 'self_loops': True, 'use_snp_selection': True, 'num_snps': 17808}. Best is trial 54 with value: 0.2986725876748172.
