[I 2025-12-08 20:05:29,840] Trial 65 finished with value: 0.3305750357095114 and parameters: {'model_type': 'gcn', 'hidden_dims': '[512, 256]', 'dropout': 0.5782621378426247, 'batch_norm': False, 'lr': 3.778867390845728e-05, 'weight_decay': 2.9052051042316767e-06, 'epochs': 290, 'loss': 'mae', 'optimizer': 'adam', 'graph_mode': 'knn', 'knn_k': 2, 'weighted_edges': True, 'symmetrize_mode': 'union', 'self_loops': False, 'use_snp_selection': True, 'num_snps': 23121}. Best is trial 44 with value: 0.3630728468105854.
[I 2025-12-08 20:06:09,129] Trial 66 finished with value: 0.357089176360916 and parameters: {'model_type': 'gcn', 'hidden_dims': '[512, 256]', 'dropout': 0.42337543159467356, 'batch_norm': False, 'lr': 0.00010399368871610351, 'weight_decay': 7.986436862064734e-07, 'epochs': 245, 'loss': 'mae', 'optimizer': 'adam', 'graph_mode': 'knn', 'knn_k': 5, 'weighted_edges': True, 'symmetrize_mode': 'union', 'self_loops': False, 'use_snp_selection': True, 'num_snps': 27191}. Best is trial 44 with value: 0.3630728468105854.
[I 2025-12-08 20:06:31,822] Trial 67 finished with value: 0.33225472029016556 and parameters: {'model_type': 'gcn', 'hidden_dims': '[512, 256]', 'dropout': 0.3958295211895995, 'batch_norm': False, 'lr': 1.2601314162878645e-05, 'weight_decay': 4.384770608760049e-07, 'epochs': 79, 'loss': 'mse', 'optimizer': 'adam', 'graph_mode': 'knn', 'knn_k': 6, 'weighted_edges': True, 'symmetrize_mode': 'union', 'self_loops': False, 'use_snp_selection': False}. Best is trial 44 with value: 0.3630728468105854.
[I 2025-12-08 20:07:02,988] Trial 68 finished with value: 0.359910800978507 and parameters: {'model_type': 'gcn', 'hidden_dims': '[256, 128]', 'dropout': 0.5384970982906812, 'batch_norm': False, 'lr': 2.8843711768407598e-05, 'weight_decay': 2.512401162855106e-06, 'epochs': 284, 'loss': 'mae', 'optimizer': 'adam', 'graph_mode': 'knn', 'knn_k': 4, 'weighted_edges': True, 'symmetrize_mode': 'union', 'self_loops': False, 'use_snp_selection': True, 'num_snps': 30255}. Best is trial 44 with value: 0.3630728468105854.
[I 2025-12-08 20:07:38,502] Trial 69 finished with value: 0.34784780064358156 and parameters: {'model_type': 'gcn', 'hidden_dims': '[512, 256]', 'dropout': 0.5073640263751261, 'batch_norm': False, 'lr': 1.7015172574844703e-05, 'weight_decay': 1.57742078515209e-05, 'epochs': 332, 'loss': 'mae', 'optimizer': 'adam', 'graph_mode': 'knn', 'knn_k': 3, 'weighted_edges': True, 'symmetrize_mode': 'union', 'self_loops': False, 'use_snp_selection': True, 'num_snps': 17292}. Best is trial 44 with value: 0.3630728468105854.
[I 2025-12-08 20:08:08,959] Trial 70 finished with value: 0.3384689096524668 and parameters: {'model_type': 'gcn', 'hidden_dims': '[512, 256]', 'dropout': 0.46922019004874876, 'batch_norm': True, 'lr': 2.4843108590137105e-05, 'weight_decay': 0.00010882705464563392, 'epochs': 117, 'loss': 'mae', 'optimizer': 'adam', 'graph_mode': 'cutoff', 'cutoff': 0.7217656932306119, 'grm_norm': 'gcn', 'self_loops': False, 'use_snp_selection': True, 'num_snps': 37456}. Best is trial 44 with value: 0.3630728468105854.
[I 2025-12-08 20:08:39,792] Trial 71 finished with value: 0.3548166844608153 and parameters: {'model_type': 'gcn', 'hidden_dims': '[256, 128]', 'dropout': 0.5350315662395185, 'batch_norm': False, 'lr': 3.0496869283398957e-05, 'weight_decay': 1.5503207575515195e-06, 'epochs': 279, 'loss': 'mae', 'optimizer': 'adam', 'graph_mode': 'knn', 'knn_k': 4, 'weighted_edges': True, 'symmetrize_mode': 'union', 'self_loops': False, 'use_snp_selection': True, 'num_snps': 30336}. Best is trial 44 with value: 0.3630728468105854.
[I 2025-12-08 20:09:07,145] Trial 72 finished with value: 0.2950804794317352 and parameters: {'model_type': 'gcn', 'hidden_dims': '[256, 128]', 'dropout': 0.5243376511613294, 'batch_norm': False, 'lr': 4.3542358435163383e-05, 'weight_decay': 3.7086245219700423e-06, 'epochs': 267, 'loss': 'mae', 'optimizer': 'adam', 'graph_mode': 'knn', 'knn_k': 1, 'weighted_edges': True, 'symmetrize_mode': 'union', 'self_loops': False, 'use_snp_selection': True, 'num_snps': 26652}. Best is trial 44 with value: 0.3630728468105854.
[I 2025-12-08 20:09:41,039] Trial 73 finished with value: 0.3523747840574693 and parameters: {'model_type': 'gcn', 'hidden_dims': '[256, 128]', 'dropout': 0.5495564048443385, 'batch_norm': False, 'lr': 6.967498299576902e-05, 'weight_decay': 2.6245411031823198e-06, 'epochs': 294, 'loss': 'mae', 'optimizer': 'adam', 'graph_mode': 'knn', 'knn_k': 4, 'weighted_edges': True, 'symmetrize_mode': 'union', 'self_loops': False, 'use_snp_selection': True, 'num_snps': 33167}. Best is trial 44 with value: 0.3630728468105854.
[I 2025-12-08 20:09:56,554] Trial 74 finished with value: 0.3627548858336194 and parameters: {'model_type': 'gcn', 'hidden_dims': '[256, 128]', 'dropout': 0.5678185040595698, 'batch_norm': False, 'lr': 2.090198197338034e-05, 'weight_decay': 7.814732351483343e-07, 'epochs': 302, 'loss': 'mae', 'optimizer': 'adam', 'graph_mode': 'knn', 'knn_k': 5, 'weighted_edges': True, 'symmetrize_mode': 'union', 'self_loops': False, 'use_snp_selection': True, 'num_snps': 6297}. Best is trial 44 with value: 0.3630728468105854.
[I 2025-12-08 20:10:11,061] Trial 75 finished with value: 0.35535398523332085 and parameters: {'model_type': 'gcn', 'hidden_dims': '[256, 128]', 'dropout': 0.5777995083343689, 'batch_norm': False, 'lr': 1.4415283318450459e-05, 'weight_decay': 7.0010316197838e-07, 'epochs': 301, 'loss': 'mae', 'optimizer': 'adam', 'graph_mode': 'knn', 'knn_k': 5, 'weighted_edges': True, 'symmetrize_mode': 'mutual', 'self_loops': False, 'use_snp_selection': True, 'num_snps': 5457}. Best is trial 44 with value: 0.3630728468105854.
[I 2025-12-08 20:10:29,023] Trial 76 finished with value: 0.3533560131889758 and parameters: {'model_type': 'gcn', 'hidden_dims': '[512, 64]', 'dropout': 0.5693461167193178, 'batch_norm': False, 'lr': 2.0869037436805876e-05, 'weight_decay': 4.5653069576720873e-07, 'epochs': 233, 'loss': 'mae', 'optimizer': 'adam', 'graph_mode': 'knn', 'knn_k': 6, 'weighted_edges': True, 'symmetrize_mode': 'union', 'self_loops': True, 'use_snp_selection': True, 'num_snps': 6959}. Best is trial 44 with value: 0.3630728468105854.
[I 2025-12-08 20:10:47,210] Trial 77 finished with value: 0.2736397267890814 and parameters: {'model_type': 'gcn', 'hidden_dims': '[128, 64]', 'dropout': 0.49576308991965395, 'batch_norm': False, 'lr': 0.0016864971432275146, 'weight_decay': 0.0005691553692122206, 'epochs': 329, 'loss': 'mae', 'optimizer': 'adam', 'graph_mode': 'knn', 'knn_k': 7, 'weighted_edges': True, 'symmetrize_mode': 'union', 'self_loops': False, 'use_snp_selection': True, 'num_snps': 13912}. Best is trial 44 with value: 0.3630728468105854.
[I 2025-12-08 20:12:16,222] Trial 78 finished with value: 0.35858292845331763 and parameters: {'model_type': 'gcn', 'hidden_dims': '[512, 128]', 'dropout': 0.3765397640341027, 'batch_norm': False, 'lr': 1.6852078664582905e-05, 'weight_decay': 1.5089536275295967e-06, 'epochs': 349, 'loss': 'mae', 'optimizer': 'adam', 'graph_mode': 'knn', 'knn_k': 7, 'weighted_edges': True, 'symmetrize_mode': 'union', 'self_loops': False, 'use_snp_selection': False}. Best is trial 44 with value: 0.3630728468105854.
[I 2025-12-08 20:12:40,406] Trial 79 finished with value: 0.3546181275724041 and parameters: {'model_type': 'gcn', 'hidden_dims': '[256, 128, 64]', 'dropout': 0.48004456766190273, 'batch_norm': False, 'lr': 3.725693772927098e-05, 'weight_decay': 5.735379238496081e-06, 'epochs': 216, 'loss': 'mse', 'optimizer': 'adam', 'graph_mode': 'knn', 'knn_k': 6, 'weighted_edges': True, 'symmetrize_mode': 'union', 'self_loops': False, 'use_snp_selection': True, 'num_snps': 23551}. Best is trial 44 with value: 0.3630728468105854.
[I 2025-12-08 20:13:04,425] Trial 80 finished with value: 0.3555679908395129 and parameters: {'model_type': 'gcn', 'hidden_dims': '[512, 128]', 'dropout': 0.5832093854734139, 'batch_norm': False, 'lr': 5.416469659270217e-05, 'weight_decay': 1.1932388297273654e-06, 'epochs': 308, 'loss': 'mae', 'optimizer': 'adam', 'graph_mode': 'knn', 'knn_k': 5, 'weighted_edges': False, 'symmetrize_mode': 'union', 'self_loops': False, 'use_snp_selection': True, 'num_snps': 9916}. Best is trial 44 with value: 0.3630728468105854.
[I 2025-12-08 20:13:35,316] Trial 81 finished with value: 0.3587129661692633 and parameters: {'model_type': 'gcn', 'hidden_dims': '[256, 128]', 'dropout': 0.540875496411901, 'batch_norm': False, 'lr': 2.714597206951041e-05, 'weight_decay': 8.220315627301661e-07, 'epochs': 280, 'loss': 'mae', 'optimizer': 'adam', 'graph_mode': 'knn', 'knn_k': 4, 'weighted_edges': True, 'symmetrize_mode': 'union', 'self_loops': False, 'use_snp_selection': True, 'num_snps': 30180}. Best is trial 44 with value: 0.3630728468105854.
[I 2025-12-08 20:14:01,493] Trial 82 finished with value: 0.37067180118989584 and parameters: {'model_type': 'gcn', 'hidden_dims': '[256, 128]', 'dropout': 0.5635619917484848, 'batch_norm': False, 'lr': 1.1947701149688933e-05, 'weight_decay': 2.523092807991748e-06, 'epochs': 295, 'loss': 'mae', 'optimizer': 'adam', 'graph_mode': 'knn', 'knn_k': 5, 'weighted_edges': True, 'symmetrize_mode': 'union', 'self_loops': False, 'use_snp_selection': True, 'num_snps': 21247}. Best is trial 82 with value: 0.37067180118989584.
[I 2025-12-08 20:14:26,287] Trial 83 finished with value: 0.366878948733434 and parameters: {'model_type': 'gcn', 'hidden_dims': '[256, 128]', 'dropout': 0.5625152290969135, 'batch_norm': False, 'lr': 1.2211760499171714e-05, 'weight_decay': 2.1210316135675577e-06, 'epochs': 296, 'loss': 'mae', 'optimizer': 'adam', 'graph_mode': 'knn', 'knn_k': 5, 'weighted_edges': True, 'symmetrize_mode': 'union', 'self_loops': False, 'use_snp_selection': True, 'num_snps': 19435}. Best is trial 82 with value: 0.37067180118989584.
[I 2025-12-08 20:14:52,667] Trial 84 finished with value: 0.3630212924282113 and parameters: {'model_type': 'gcn', 'hidden_dims': '[256, 128]', 'dropout': 0.5915027678469628, 'batch_norm': False, 'lr': 2.0123129791809794e-05, 'weight_decay': 1.837355537659018e-06, 'epochs': 296, 'loss': 'mae', 'optimizer': 'adam', 'graph_mode': 'knn', 'knn_k': 5, 'weighted_edges': True, 'symmetrize_mode': 'union', 'self_loops': False, 'use_snp_selection': True, 'num_snps': 21610}. Best is trial 82 with value: 0.37067180118989584.
[I 2025-12-08 20:15:18,991] Trial 85 finished with value: 0.3639761826473654 and parameters: {'model_type': 'gcn', 'hidden_dims': '[256, 128]', 'dropout': 0.5899504669642658, 'batch_norm': False, 'lr': 1.1648199316558698e-05, 'weight_decay': 1.818360648403881e-06, 'epochs': 297, 'loss': 'mae', 'optimizer': 'adam', 'graph_mode': 'knn', 'knn_k': 6, 'weighted_edges': True, 'symmetrize_mode': 'union', 'self_loops': False, 'use_snp_selection': True, 'num_snps': 21119}. Best is trial 82 with value: 0.37067180118989584.
[I 2025-12-08 20:15:44,979] Trial 86 finished with value: 0.31436200964876365 and parameters: {'model_type': 'gcn', 'hidden_dims': '[256, 128]', 'dropout': 0.5925108153048849, 'batch_norm': True, 'lr': 1.1969772137011913e-05, 'weight_decay': 1.8982059031436649e-06, 'epochs': 299, 'loss': 'mae', 'optimizer': 'adam', 'graph_mode': 'cutoff', 'cutoff': 0.4617740303208182, 'grm_norm': 'gcn', 'self_loops': False, 'use_snp_selection': True, 'num_snps': 21218}. Best is trial 82 with value: 0.37067180118989584.
[I 2025-12-08 20:16:06,401] Trial 87 finished with value: 0.3415971720897912 and parameters: {'model_type': 'gcn', 'hidden_dims': '[256, 128]', 'dropout': 0.5633719114379925, 'batch_norm': False, 'lr': 2.074217020885419e-05, 'weight_decay': 4.166065765337495e-06, 'epochs': 223, 'loss': 'mae', 'optimizer': 'adam', 'graph_mode': 'knn', 'knn_k': 6, 'weighted_edges': False, 'symmetrize_mode': 'union', 'self_loops': True, 'use_snp_selection': True, 'num_snps': 19034}. Best is trial 82 with value: 0.37067180118989584.
[I 2025-12-08 20:16:30,683] Trial 88 finished with value: 0.3530081861787821 and parameters: {'model_type': 'gcn', 'hidden_dims': '[256, 128]', 'dropout': 0.5610530902751109, 'batch_norm': False, 'lr': 1.7594960778431933e-05, 'weight_decay': 5.540702499983683e-07, 'epochs': 315, 'loss': 'mae', 'optimizer': 'adam', 'graph_mode': 'knn', 'knn_k': 6, 'weighted_edges': True, 'symmetrize_mode': 'mutual', 'self_loops': False, 'use_snp_selection': True, 'num_snps': 17699}. Best is trial 82 with value: 0.37067180118989584.
[I 2025-12-08 20:16:49,405] Trial 89 finished with value: 0.36446992492982777 and parameters: {'model_type': 'gcn', 'hidden_dims': '[256, 128]', 'dropout': 0.5863563897854728, 'batch_norm': False, 'lr': 1.5096778869494352e-05, 'weight_decay': 3.356895783740865e-07, 'epochs': 203, 'loss': 'mae', 'optimizer': 'adam', 'graph_mode': 'knn', 'knn_k': 6, 'weighted_edges': False, 'symmetrize_mode': 'union', 'self_loops': False, 'use_snp_selection': True, 'num_snps': 15930}. Best is trial 82 with value: 0.37067180118989584.
[I 2025-12-08 20:17:15,092] Trial 90 finished with value: 0.3542769530099189 and parameters: {'model_type': 'gcn', 'hidden_dims': '[256, 128]', 'dropout': 0.5915593819247591, 'batch_norm': False, 'lr': 1.0084958520899478e-05, 'weight_decay': 2.4752786411276854e-07, 'epochs': 197, 'loss': 'mse', 'optimizer': 'adam', 'graph_mode': 'knn', 'knn_k': 7, 'weighted_edges': False, 'symmetrize_mode': 'union', 'self_loops': False, 'use_snp_selection': False}. Best is trial 82 with value: 0.37067180118989584.
[I 2025-12-08 20:17:32,307] Trial 91 finished with value: 0.3596985672837371 and parameters: {'model_type': 'gcn', 'hidden_dims': '[256, 128]', 'dropout': 0.5817034693806596, 'batch_norm': False, 'lr': 1.4205512329038587e-05, 'weight_decay': 2.8471608614387216e-07, 'epochs': 169, 'loss': 'mae', 'optimizer': 'adam', 'graph_mode': 'knn', 'knn_k': 6, 'weighted_edges': False, 'symmetrize_mode': 'union', 'self_loops': False, 'use_snp_selection': True, 'num_snps': 15526}. Best is trial 82 with value: 0.37067180118989584.
[I 2025-12-08 20:17:47,242] Trial 92 finished with value: 0.3610804578132767 and parameters: {'model_type': 'gcn', 'hidden_dims': '[256, 128]', 'dropout': 0.572279146132716, 'batch_norm': False, 'lr': 2.2861238130961913e-05, 'weight_decay': 3.1235432977234026e-06, 'epochs': 150, 'loss': 'mae', 'optimizer': 'adam', 'graph_mode': 'knn', 'knn_k': 5, 'weighted_edges': False, 'symmetrize_mode': 'union', 'self_loops': False, 'use_snp_selection': True, 'num_snps': 13103}. Best is trial 82 with value: 0.37067180118989584.
[I 2025-12-08 20:18:08,238] Trial 93 finished with value: 0.3546575549492392 and parameters: {'model_type': 'gcn', 'hidden_dims': '[256, 128]', 'dropout': 0.5551614380373736, 'batch_norm': False, 'lr': 1.6296945851596953e-05, 'weight_decay': 1.2742385853731885e-07, 'epochs': 208, 'loss': 'mae', 'optimizer': 'adam', 'graph_mode': 'knn', 'knn_k': 6, 'weighted_edges': False, 'symmetrize_mode': 'union', 'self_loops': False, 'use_snp_selection': True, 'num_snps': 19973}. Best is trial 82 with value: 0.37067180118989584.
[I 2025-12-08 20:18:29,380] Trial 94 finished with value: 0.3610141812049424 and parameters: {'model_type': 'gcn', 'hidden_dims': '[256, 128]', 'dropout': 0.5867901132384359, 'batch_norm': False, 'lr': 1.9076872237595744e-05, 'weight_decay': 1.5479012724762972e-06, 'epochs': 190, 'loss': 'mae', 'optimizer': 'adam', 'graph_mode': 'knn', 'knn_k': 5, 'weighted_edges': False, 'symmetrize_mode': 'union', 'self_loops': False, 'use_snp_selection': True, 'num_snps': 22080}. Best is trial 82 with value: 0.37067180118989584.
[I 2025-12-08 20:18:51,857] Trial 95 finished with value: 0.3638428386835898 and parameters: {'model_type': 'gcn', 'hidden_dims': '[256, 128]', 'dropout': 0.5973090975361576, 'batch_norm': False, 'lr': 1.1712695179975633e-05, 'weight_decay': 3.816325755268855e-07, 'epochs': 293, 'loss': 'mae', 'optimizer': 'adam', 'graph_mode': 'knn', 'knn_k': 7, 'weighted_edges': True, 'symmetrize_mode': 'union', 'self_loops': False, 'use_snp_selection': True, 'num_snps': 15711}. Best is trial 82 with value: 0.37067180118989584.
[I 2025-12-08 20:19:14,618] Trial 96 finished with value: 0.3576351175189216 and parameters: {'model_type': 'gcn', 'hidden_dims': '[256, 128]', 'dropout': 0.5989394830043122, 'batch_norm': False, 'lr': 1.1283099254545457e-05, 'weight_decay': 4.957794097481975e-07, 'epochs': 296, 'loss': 'mae', 'optimizer': 'adam', 'graph_mode': 'knn', 'knn_k': 7, 'weighted_edges': False, 'symmetrize_mode': 'union', 'self_loops': False, 'use_snp_selection': True, 'num_snps': 16060}. Best is trial 82 with value: 0.37067180118989584.
[I 2025-12-08 20:19:33,884] Trial 97 finished with value: 0.3596888664045586 and parameters: {'model_type': 'gcn', 'hidden_dims': '[256, 128]', 'dropout': 0.30277128015511756, 'batch_norm': False, 'lr': 1.4786735032690387e-05, 'weight_decay': 3.5209748513179014e-07, 'epochs': 306, 'loss': 'mae', 'optimizer': 'adam', 'graph_mode': 'knn', 'knn_k': 5, 'weighted_edges': True, 'symmetrize_mode': 'union', 'self_loops': False, 'use_snp_selection': True, 'num_snps': 11616}. Best is trial 82 with value: 0.37067180118989584.
[I 2025-12-08 20:19:59,515] Trial 98 finished with value: 0.3591133711882112 and parameters: {'model_type': 'gcn', 'hidden_dims': '[256, 128]', 'dropout': 0.5704180188038079, 'batch_norm': False, 'lr': 1.1977057032189862e-05, 'weight_decay': 6.968854024308342e-07, 'epochs': 312, 'loss': 'mae', 'optimizer': 'adam', 'graph_mode': 'knn', 'knn_k': 10, 'weighted_edges': False, 'symmetrize_mode': 'union', 'self_loops': False, 'use_snp_selection': True, 'num_snps': 18466}. Best is trial 82 with value: 0.37067180118989584.
[I 2025-12-08 20:20:20,218] Trial 99 finished with value: 0.2830308448579382 and parameters: {'model_type': 'gcn', 'hidden_dims': '[256, 128]', 'dropout': 0.5456213026338227, 'batch_norm': True, 'lr': 0.00022356853508221684, 'weight_decay': 3.373129500156993e-07, 'epochs': 292, 'loss': 'mae', 'optimizer': 'adam', 'graph_mode': 'cutoff', 'cutoff': 0.3129050405452006, 'grm_norm': 'none', 'self_loops': False, 'use_snp_selection': True, 'num_snps': 14624}. Best is trial 82 with value: 0.37067180118989584.
[I 2025-12-08 20:20:44,239] Trial 100 finished with value: 0.3572309581948786 and parameters: {'model_type': 'gcn', 'hidden_dims': '[256, 128]', 'dropout': 0.5281172340814824, 'batch_norm': False, 'lr': 1.0217665476003468e-05, 'weight_decay': 9.31006723974709e-07, 'epochs': 269, 'loss': 'mae', 'optimizer': 'adam', 'graph_mode': 'knn', 'knn_k': 6, 'weighted_edges': True, 'symmetrize_mode': 'union', 'self_loops': False, 'use_snp_selection': True, 'num_snps': 20299}. Best is trial 82 with value: 0.37067180118989584.
[I 2025-12-08 20:21:09,502] Trial 101 finished with value: 0.36158648757989853 and parameters: {'model_type': 'gcn', 'hidden_dims': '[256, 128]', 'dropout': 0.5858392940503063, 'batch_norm': False, 'lr': 2.4537057267117727e-05, 'weight_decay': 2.1737547678715278e-07, 'epochs': 249, 'loss': 'mae', 'optimizer': 'adam', 'graph_mode': 'knn', 'knn_k': 6, 'weighted_edges': True, 'symmetrize_mode': 'union', 'self_loops': False, 'use_snp_selection': True, 'num_snps': 24063}. Best is trial 82 with value: 0.37067180118989584.
[I 2025-12-08 20:21:35,364] Trial 102 finished with value: 0.36391594554753914 and parameters: {'model_type': 'gcn', 'hidden_dims': '[256, 128]', 'dropout': 0.5587170660925821, 'batch_norm': False, 'lr': 1.5910148892702392e-05, 'weight_decay': 2.1872458652067782e-07, 'epochs': 262, 'loss': 'mae', 'optimizer': 'adam', 'graph_mode': 'knn', 'knn_k': 6, 'weighted_edges': True, 'symmetrize_mode': 'union', 'self_loops': False, 'use_snp_selection': True, 'num_snps': 23732}. Best is trial 82 with value: 0.37067180118989584.
[I 2025-12-08 20:21:56,642] Trial 103 finished with value: 0.3641509306652898 and parameters: {'model_type': 'gcn', 'hidden_dims': '[256, 128]', 'dropout': 0.5573623792516871, 'batch_norm': False, 'lr': 1.5281800936015137e-05, 'weight_decay': 5.838765432764945e-07, 'epochs': 258, 'loss': 'mae', 'optimizer': 'adam', 'graph_mode': 'knn', 'knn_k': 5, 'weighted_edges': True, 'symmetrize_mode': 'union', 'self_loops': False, 'use_snp_selection': True, 'num_snps': 16895}. Best is trial 82 with value: 0.37067180118989584.
[I 2025-12-08 20:22:21,224] Trial 104 finished with value: 0.3629906929579665 and parameters: {'model_type': 'gcn', 'hidden_dims': '[256, 128]', 'dropout': 0.5625208955885911, 'batch_norm': False, 'lr': 1.5462051610534147e-05, 'weight_decay': 1.5908529596280494e-07, 'epochs': 259, 'loss': 'mae', 'optimizer': 'adam', 'graph_mode': 'knn', 'knn_k': 5, 'weighted_edges': True, 'symmetrize_mode': 'union', 'self_loops': False, 'use_snp_selection': True, 'num_snps': 21835}. Best is trial 82 with value: 0.37067180118989584.
[I 2025-12-08 20:22:42,504] Trial 105 finished with value: 0.36477849121342754 and parameters: {'model_type': 'gcn', 'hidden_dims': '[256, 128]', 'dropout': 0.5642238664924769, 'batch_norm': False, 'lr': 1.6083854319303453e-05, 'weight_decay': 1.705740083353008e-07, 'epochs': 257, 'loss': 'mae', 'optimizer': 'adam', 'graph_mode': 'knn', 'knn_k': 5, 'weighted_edges': True, 'symmetrize_mode': 'union', 'self_loops': False, 'use_snp_selection': True, 'num_snps': 16931}. Best is trial 82 with value: 0.37067180118989584.
[I 2025-12-08 20:23:03,751] Trial 106 finished with value: 0.3621130088664758 and parameters: {'model_type': 'gcn', 'hidden_dims': '[256, 128]', 'dropout': 0.560557855291957, 'batch_norm': False, 'lr': 1.4588013805923398e-05, 'weight_decay': 1.2618852990048137e-07, 'epochs': 258, 'loss': 'mae', 'optimizer': 'adam', 'graph_mode': 'knn', 'knn_k': 5, 'weighted_edges': True, 'symmetrize_mode': 'union', 'self_loops': False, 'use_snp_selection': True, 'num_snps': 16354}. Best is trial 82 with value: 0.37067180118989584.
