[I 2025-12-08 17:43:25,771] Trial 66 finished with value: 0.3738442503699612 and parameters: {'model_type': 'gcn', 'hidden_dims': '[256, 128]', 'dropout': 0.22739281159432734, 'batch_norm': False, 'lr': 0.00014660588963820705, 'weight_decay': 6.1270360619609845e-06, 'epochs': 202, 'loss': 'mae', 'optimizer': 'adam', 'graph_mode': 'cutoff', 'cutoff': 0.542157623252977, 'grm_norm': 'cosine_then_gcn', 'self_loops': True, 'use_snp_selection': True, 'num_snps': 41843}. Best is trial 66 with value: 0.3738442503699612.
[I 2025-12-08 17:44:04,793] Trial 67 finished with value: 0.36918684173743993 and parameters: {'model_type': 'gcn', 'hidden_dims': '[512, 128]', 'dropout': 0.23456776844695953, 'batch_norm': False, 'lr': 0.00027482333709321976, 'weight_decay': 7.0417310214280104e-06, 'epochs': 157, 'loss': 'mae', 'optimizer': 'adam', 'graph_mode': 'cutoff', 'cutoff': 0.552012931577331, 'grm_norm': 'cosine_then_gcn', 'self_loops': True, 'use_snp_selection': True, 'num_snps': 40991}. Best is trial 66 with value: 0.3738442503699612.
[I 2025-12-08 17:44:42,581] Trial 68 finished with value: 0.30043997300189973 and parameters: {'model_type': 'gcn', 'hidden_dims': '[512, 128]', 'dropout': 0.2974117738475802, 'batch_norm': False, 'lr': 0.0002485896260694322, 'weight_decay': 2.754313140977222e-05, 'epochs': 158, 'loss': 'mse', 'optimizer': 'adam', 'graph_mode': 'cutoff', 'cutoff': 0.4551056231540144, 'grm_norm': 'none', 'self_loops': True, 'use_snp_selection': True, 'num_snps': 39529}. Best is trial 66 with value: 0.3738442503699612.
[I 2025-12-08 17:45:17,904] Trial 69 finished with value: 0.3585710291504528 and parameters: {'model_type': 'gcn', 'hidden_dims': '[512, 128]', 'dropout': 0.2579211443814051, 'batch_norm': False, 'lr': 0.00013683694787238737, 'weight_decay': 1.0918418907247496e-05, 'epochs': 112, 'loss': 'mae', 'optimizer': 'adam', 'graph_mode': 'cutoff', 'cutoff': 0.5437746252208604, 'grm_norm': 'gcn', 'self_loops': True, 'use_snp_selection': True, 'num_snps': 47083}. Best is trial 66 with value: 0.3738442503699612.
[I 2025-12-08 17:45:59,569] Trial 70 finished with value: 0.31622083101250065 and parameters: {'model_type': 'gcn', 'hidden_dims': '[512, 128]', 'dropout': 0.24456026201266423, 'batch_norm': False, 'lr': 0.0003391347869396832, 'weight_decay': 2.931743462973375e-06, 'epochs': 131, 'loss': 'mae', 'optimizer': 'adam', 'graph_mode': 'knn', 'knn_k': 5, 'weighted_edges': True, 'symmetrize_mode': 'mutual', 'self_loops': True, 'use_snp_selection': True, 'num_snps': 50151}. Best is trial 66 with value: 0.3738442503699612.
[I 2025-12-08 17:46:36,797] Trial 71 finished with value: 0.37458906862248736 and parameters: {'model_type': 'gcn', 'hidden_dims': '[512, 128]', 'dropout': 0.22508344991759136, 'batch_norm': False, 'lr': 0.00017485624820868156, 'weight_decay': 5.860125372253992e-06, 'epochs': 197, 'loss': 'mae', 'optimizer': 'adam', 'graph_mode': 'cutoff', 'cutoff': 0.536658995973599, 'grm_norm': 'cosine_then_gcn', 'self_loops': True, 'use_snp_selection': True, 'num_snps': 32099}. Best is trial 71 with value: 0.37458906862248736.
[I 2025-12-08 17:47:14,614] Trial 72 finished with value: 0.3676579403316711 and parameters: {'model_type': 'gcn', 'hidden_dims': '[512, 128]', 'dropout': 0.22173934917093824, 'batch_norm': False, 'lr': 0.00019061681261725837, 'weight_decay': 8.52218663269904e-06, 'epochs': 195, 'loss': 'mae', 'optimizer': 'adam', 'graph_mode': 'cutoff', 'cutoff': 0.5214961812835955, 'grm_norm': 'cosine_then_gcn', 'self_loops': True, 'use_snp_selection': True, 'num_snps': 32750}. Best is trial 71 with value: 0.37458906862248736.
[I 2025-12-08 17:47:54,882] Trial 73 finished with value: 0.35623896353125456 and parameters: {'model_type': 'gcn', 'hidden_dims': '[512, 128]', 'dropout': 0.23452102903860614, 'batch_norm': False, 'lr': 0.00010569373825925838, 'weight_decay': 3.692150576669643e-06, 'epochs': 174, 'loss': 'mae', 'optimizer': 'adam', 'graph_mode': 'cutoff', 'cutoff': 0.47060416560890295, 'grm_norm': 'cosine_then_gcn', 'self_loops': True, 'use_snp_selection': True, 'num_snps': 39312}. Best is trial 71 with value: 0.37458906862248736.
[I 2025-12-08 17:48:21,995] Trial 74 finished with value: 0.3719460939038653 and parameters: {'model_type': 'gcn', 'hidden_dims': '[512, 128]', 'dropout': 0.3146675617502111, 'batch_norm': False, 'lr': 0.00027387104174725704, 'weight_decay': 4.8141947969835e-06, 'epochs': 146, 'loss': 'mae', 'optimizer': 'adam', 'graph_mode': 'cutoff', 'cutoff': 0.6003912630566202, 'grm_norm': 'cosine_then_gcn', 'self_loops': True, 'use_snp_selection': True, 'num_snps': 26227}. Best is trial 71 with value: 0.37458906862248736.
[I 2025-12-08 17:48:50,297] Trial 75 finished with value: 0.370470693682251 and parameters: {'model_type': 'gcn', 'hidden_dims': '[512, 128]', 'dropout': 0.31169121766237057, 'batch_norm': False, 'lr': 0.0004297451514006488, 'weight_decay': 5.4672184763102805e-06, 'epochs': 170, 'loss': 'mae', 'optimizer': 'adam', 'graph_mode': 'cutoff', 'cutoff': 0.5965809715024368, 'grm_norm': 'cosine_then_gcn', 'self_loops': True, 'use_snp_selection': True, 'num_snps': 24216}. Best is trial 71 with value: 0.37458906862248736.
[I 2025-12-08 17:49:21,816] Trial 76 finished with value: 0.36372867350042226 and parameters: {'model_type': 'gcn', 'hidden_dims': '[512, 128]', 'dropout': 0.3153099644659981, 'batch_norm': False, 'lr': 0.00038748536996366487, 'weight_decay': 4.966447956346663e-06, 'epochs': 199, 'loss': 'mae', 'optimizer': 'adam', 'graph_mode': 'cutoff', 'cutoff': 0.6058606665277925, 'grm_norm': 'cosine_then_gcn', 'self_loops': True, 'use_snp_selection': True, 'num_snps': 25286}. Best is trial 71 with value: 0.37458906862248736.
[I 2025-12-08 17:49:49,752] Trial 77 finished with value: 0.3442626010600383 and parameters: {'model_type': 'gcn', 'hidden_dims': '[512, 128]', 'dropout': 0.34486047388221786, 'batch_norm': True, 'lr': 0.00045617046578841575, 'weight_decay': 5.363808962762413e-06, 'epochs': 146, 'loss': 'mae', 'optimizer': 'adam', 'graph_mode': 'cutoff', 'cutoff': 0.5837585546986398, 'grm_norm': 'cosine_then_gcn', 'self_loops': True, 'use_snp_selection': True, 'num_snps': 27623}. Best is trial 71 with value: 0.37458906862248736.
[I 2025-12-08 17:50:18,179] Trial 78 finished with value: 0.36879321614052335 and parameters: {'model_type': 'gcn', 'hidden_dims': '[512, 128]', 'dropout': 0.3887398950338349, 'batch_norm': False, 'lr': 0.00020576048591250254, 'weight_decay': 3.2374806864510056e-06, 'epochs': 168, 'loss': 'mae', 'optimizer': 'adam', 'graph_mode': 'cutoff', 'cutoff': 0.6551841290838308, 'grm_norm': 'cosine_then_gcn', 'self_loops': True, 'use_snp_selection': True, 'num_snps': 25220}. Best is trial 71 with value: 0.37458906862248736.
[I 2025-12-08 17:50:43,343] Trial 79 finished with value: 0.3559883030353451 and parameters: {'model_type': 'gcn', 'hidden_dims': '[512, 128]', 'dropout': 0.28415949200599416, 'batch_norm': False, 'lr': 0.0003154740876685808, 'weight_decay': 2.402811469892904e-06, 'epochs': 185, 'loss': 'mae', 'optimizer': 'adam', 'graph_mode': 'cutoff', 'cutoff': 0.4432689726683198, 'grm_norm': 'cosine_then_gcn', 'self_loops': True, 'use_snp_selection': True, 'num_snps': 18802}. Best is trial 71 with value: 0.37458906862248736.
[I 2025-12-08 17:51:07,145] Trial 80 finished with value: 0.3141500357478256 and parameters: {'model_type': 'gcn', 'hidden_dims': '[512, 128]', 'dropout': 0.3227629061564159, 'batch_norm': False, 'lr': 0.00015155277530970479, 'weight_decay': 1.1128766573164955e-05, 'epochs': 91, 'loss': 'mse', 'optimizer': 'adam', 'graph_mode': 'cutoff', 'cutoff': 0.5117096786875269, 'grm_norm': 'cosine_then_gcn', 'self_loops': True, 'use_snp_selection': True, 'num_snps': 30961}. Best is trial 71 with value: 0.37458906862248736.
[I 2025-12-08 17:51:33,082] Trial 81 finished with value: 0.3693987329143861 and parameters: {'model_type': 'gcn', 'hidden_dims': '[512, 128]', 'dropout': 0.30491147320743006, 'batch_norm': False, 'lr': 0.00029322348178589726, 'weight_decay': 7.854300140064232e-06, 'epochs': 159, 'loss': 'mae', 'optimizer': 'adam', 'graph_mode': 'cutoff', 'cutoff': 0.5569732161729707, 'grm_norm': 'cosine_then_gcn', 'self_loops': True, 'use_snp_selection': True, 'num_snps': 22692}. Best is trial 71 with value: 0.37458906862248736.
[I 2025-12-08 17:52:00,577] Trial 82 finished with value: 0.3637402393806361 and parameters: {'model_type': 'gcn', 'hidden_dims': '[512, 128]', 'dropout': 0.33389979407152753, 'batch_norm': False, 'lr': 0.0007006652809329223, 'weight_decay': 2.211448365940286e-05, 'epochs': 174, 'loss': 'mae', 'optimizer': 'adam', 'graph_mode': 'cutoff', 'cutoff': 0.5301247737128498, 'grm_norm': 'cosine_then_gcn', 'self_loops': True, 'use_snp_selection': True, 'num_snps': 23038}. Best is trial 71 with value: 0.37458906862248736.
[I 2025-12-08 17:52:26,186] Trial 83 finished with value: 0.36108174820529093 and parameters: {'model_type': 'gcn', 'hidden_dims': '[512, 128]', 'dropout': 0.3044351011726715, 'batch_norm': False, 'lr': 0.0009737644766371402, 'weight_decay': 8.586123809640529e-06, 'epochs': 148, 'loss': 'mae', 'optimizer': 'adam', 'graph_mode': 'cutoff', 'cutoff': 0.5613378134599741, 'grm_norm': 'cosine_then_gcn', 'self_loops': True, 'use_snp_selection': True, 'num_snps': 24150}. Best is trial 71 with value: 0.37458906862248736.
[I 2025-12-08 17:52:50,314] Trial 84 finished with value: 0.36289875813633987 and parameters: {'model_type': 'gcn', 'hidden_dims': '[512, 128]', 'dropout': 0.2697092655164434, 'batch_norm': False, 'lr': 0.00029333602171160853, 'weight_decay': 1.91369440054717e-06, 'epochs': 162, 'loss': 'mae', 'optimizer': 'adam', 'graph_mode': 'cutoff', 'cutoff': 0.6027811850202512, 'grm_norm': 'cosine_then_gcn', 'self_loops': True, 'use_snp_selection': True, 'num_snps': 20180}. Best is trial 71 with value: 0.37458906862248736.
[I 2025-12-08 17:53:11,188] Trial 85 finished with value: 0.32232002826187867 and parameters: {'model_type': 'gcn', 'hidden_dims': '[256, 128, 64]', 'dropout': 0.2887405814449239, 'batch_norm': False, 'lr': 0.00048802380953312394, 'weight_decay': 5.420409467900805e-06, 'epochs': 137, 'loss': 'mae', 'optimizer': 'adam', 'graph_mode': 'cutoff', 'cutoff': 0.21907341935974384, 'grm_norm': 'cosine_then_gcn', 'self_loops': True, 'use_snp_selection': True, 'num_snps': 25881}. Best is trial 71 with value: 0.37458906862248736.
[I 2025-12-08 17:53:43,149] Trial 86 finished with value: 0.3576643700562531 and parameters: {'model_type': 'gcn', 'hidden_dims': '[512, 128]', 'dropout': 0.2970081562962976, 'batch_norm': False, 'lr': 7.209566146293355e-05, 'weight_decay': 3.91047271487463e-06, 'epochs': 179, 'loss': 'mae', 'optimizer': 'adam', 'graph_mode': 'cutoff', 'cutoff': 0.49516922406268116, 'grm_norm': 'cosine_then_gcn', 'self_loops': True, 'use_snp_selection': True, 'num_snps': 27765}. Best is trial 71 with value: 0.37458906862248736.
[I 2025-12-08 17:54:10,680] Trial 87 finished with value: 0.3038018313670905 and parameters: {'model_type': 'gcn', 'hidden_dims': '[512, 64]', 'dropout': 0.2537159069625595, 'batch_norm': False, 'lr': 0.00021096559150182945, 'weight_decay': 2.7773890993160706e-06, 'epochs': 118, 'loss': 'mae', 'optimizer': 'adam', 'graph_mode': 'cutoff', 'cutoff': 0.6458902606261601, 'grm_norm': 'cosine', 'self_loops': True, 'use_snp_selection': True, 'num_snps': 32013}. Best is trial 71 with value: 0.37458906862248736.
[I 2025-12-08 17:54:35,236] Trial 88 finished with value: 0.05536184408878503 and parameters: {'model_type': 'gcn', 'hidden_dims': '[128, 64]', 'dropout': 0.3157874240927248, 'batch_norm': False, 'lr': 0.009577072853366163, 'weight_decay': 1.3504594079370341e-05, 'epochs': 190, 'loss': 'mae', 'optimizer': 'adam', 'graph_mode': 'cutoff', 'cutoff': 0.6165259293469796, 'grm_norm': 'cosine_then_gcn', 'self_loops': True, 'use_snp_selection': True, 'num_snps': 45458}. Best is trial 71 with value: 0.37458906862248736.
[I 2025-12-08 17:55:00,125] Trial 89 finished with value: 0.344381083888472 and parameters: {'model_type': 'gcn', 'hidden_dims': '[256, 128]', 'dropout': 0.3548182245007405, 'batch_norm': True, 'lr': 0.000368717739211848, 'weight_decay': 7.850602405218503e-06, 'epochs': 198, 'loss': 'mae', 'optimizer': 'adam', 'graph_mode': 'cutoff', 'cutoff': 0.5858144418670824, 'grm_norm': 'gcn', 'self_loops': True, 'use_snp_selection': True, 'num_snps': 29350}. Best is trial 71 with value: 0.37458906862248736.
[I 2025-12-08 17:55:32,482] Trial 90 finished with value: 0.27194683757467647 and parameters: {'model_type': 'gcn', 'hidden_dims': '[512, 128]', 'dropout': 0.3567367171659734, 'batch_norm': False, 'lr': 0.00023916784124725, 'weight_decay': 1.5352042612264894e-06, 'epochs': 102, 'loss': 'mae', 'optimizer': 'adam', 'graph_mode': 'knn', 'knn_k': 10, 'weighted_edges': False, 'symmetrize_mode': 'union', 'self_loops': True, 'use_snp_selection': True, 'num_snps': 42651}. Best is trial 71 with value: 0.37458906862248736.
[I 2025-12-08 17:56:08,694] Trial 91 finished with value: 0.3640834460657526 and parameters: {'model_type': 'gcn', 'hidden_dims': '[512, 128]', 'dropout': 0.27738794180317544, 'batch_norm': False, 'lr': 0.0002574346304146399, 'weight_decay': 6.960985561782666e-06, 'epochs': 157, 'loss': 'mae', 'optimizer': 'adam', 'graph_mode': 'cutoff', 'cutoff': 0.5576225340971056, 'grm_norm': 'cosine_then_gcn', 'self_loops': True, 'use_snp_selection': True, 'num_snps': 37720}. Best is trial 71 with value: 0.37458906862248736.
[I 2025-12-08 17:56:29,691] Trial 92 finished with value: 0.36665046529084294 and parameters: {'model_type': 'gcn', 'hidden_dims': '[512, 128]', 'dropout': 0.23717595344045844, 'batch_norm': False, 'lr': 0.00029016075223581436, 'weight_decay': 1.0506806384747591e-05, 'epochs': 152, 'loss': 'mae', 'optimizer': 'adam', 'graph_mode': 'cutoff', 'cutoff': 0.5410757545764833, 'grm_norm': 'cosine_then_gcn', 'self_loops': True, 'use_snp_selection': True, 'num_snps': 16920}. Best is trial 71 with value: 0.37458906862248736.
[I 2025-12-08 17:56:53,149] Trial 93 finished with value: 0.36535367652821427 and parameters: {'model_type': 'gcn', 'hidden_dims': '[512, 128]', 'dropout': 0.22435401597343513, 'batch_norm': False, 'lr': 0.0001289889927177058, 'weight_decay': 5.635781681099497e-06, 'epochs': 139, 'loss': 'mae', 'optimizer': 'adam', 'graph_mode': 'cutoff', 'cutoff': 0.5670128068244487, 'grm_norm': 'cosine_then_gcn', 'self_loops': True, 'use_snp_selection': True, 'num_snps': 22006}. Best is trial 71 with value: 0.37458906862248736.
[I 2025-12-08 17:57:36,931] Trial 94 finished with value: 0.3721850660279467 and parameters: {'model_type': 'gcn', 'hidden_dims': '[512, 128]', 'dropout': 0.2646832176900548, 'batch_norm': False, 'lr': 0.00018436646271741586, 'weight_decay': 3.585771109259986e-06, 'epochs': 166, 'loss': 'mae', 'optimizer': 'adam', 'graph_mode': 'cutoff', 'cutoff': 0.5940246977171011, 'grm_norm': 'cosine_then_gcn', 'self_loops': True, 'use_snp_selection': True, 'num_snps': 46100}. Best is trial 71 with value: 0.37458906862248736.
[I 2025-12-08 17:58:08,770] Trial 95 finished with value: 0.35819737258134926 and parameters: {'model_type': 'gcn', 'hidden_dims': '[256, 128]', 'dropout': 0.26735115051282193, 'batch_norm': False, 'lr': 0.00016439905869320787, 'weight_decay': 3.544033756539356e-06, 'epochs': 167, 'loss': 'mae', 'optimizer': 'adam', 'graph_mode': 'cutoff', 'cutoff': 0.6637946768045909, 'grm_norm': 'cosine_then_gcn', 'self_loops': True, 'use_snp_selection': True, 'num_snps': 48702}. Best is trial 71 with value: 0.37458906862248736.
[I 2025-12-08 17:58:40,831] Trial 96 finished with value: 0.36391625489116064 and parameters: {'model_type': 'gcn', 'hidden_dims': '[256, 128]', 'dropout': 0.21300216374281392, 'batch_norm': False, 'lr': 9.13450447352307e-05, 'weight_decay': 2.213214974804334e-06, 'epochs': 183, 'loss': 'mae', 'optimizer': 'adam', 'graph_mode': 'cutoff', 'cutoff': 0.6151947793644285, 'grm_norm': 'cosine_then_gcn', 'self_loops': True, 'use_snp_selection': True, 'num_snps': 46118}. Best is trial 71 with value: 0.37458906862248736.
[I 2025-12-08 17:59:25,631] Trial 97 finished with value: 0.31082475392230685 and parameters: {'model_type': 'gcn', 'hidden_dims': '[512, 128]', 'dropout': 0.25860121840940287, 'batch_norm': False, 'lr': 0.00020956121417061235, 'weight_decay': 4.071890650397639e-06, 'epochs': 146, 'loss': 'mse', 'optimizer': 'adam', 'graph_mode': 'cutoff', 'cutoff': 0.5948842185973808, 'grm_norm': 'none', 'self_loops': True, 'use_snp_selection': True, 'num_snps': 52848}. Best is trial 71 with value: 0.37458906862248736.
[I 2025-12-08 17:59:55,508] Trial 98 finished with value: 0.34884609452774973 and parameters: {'model_type': 'gcn', 'hidden_dims': '[256, 128]', 'dropout': 0.33319676802558823, 'batch_norm': False, 'lr': 0.00010969374447929888, 'weight_decay': 2.730650052872393e-06, 'epochs': 173, 'loss': 'mae', 'optimizer': 'adam', 'graph_mode': 'cutoff', 'cutoff': 0.3004701139719965, 'grm_norm': 'cosine_then_gcn', 'self_loops': True, 'use_snp_selection': True, 'num_snps': 42916}. Best is trial 71 with value: 0.37458906862248736.
[I 2025-12-08 18:00:26,131] Trial 99 finished with value: 0.36437522705709674 and parameters: {'model_type': 'gcn', 'hidden_dims': '[512, 128]', 'dropout': 0.4426156908571094, 'batch_norm': False, 'lr': 6.701553444170494e-05, 'weight_decay': 4.6152752985075985e-06, 'epochs': 205, 'loss': 'mae', 'optimizer': 'adam', 'graph_mode': 'cutoff', 'cutoff': 0.6915205373890083, 'grm_norm': 'cosine_then_gcn', 'self_loops': True, 'use_snp_selection': True, 'num_snps': 23742}. Best is trial 71 with value: 0.37458906862248736.
[I 2025-12-08 18:00:57,330] Trial 100 finished with value: 0.3247034036462254 and parameters: {'model_type': 'gcn', 'hidden_dims': '[512, 64]', 'dropout': 0.30944895086306534, 'batch_norm': False, 'lr': 4.844135768555094e-05, 'weight_decay': 1.802685356510969e-06, 'epochs': 77, 'loss': 'mae', 'optimizer': 'adam', 'graph_mode': 'cutoff', 'cutoff': 0.4785199616670394, 'grm_norm': 'cosine_then_gcn', 'self_loops': True, 'use_snp_selection': True, 'num_snps': 51450}. Best is trial 71 with value: 0.37458906862248736.
[I 2025-12-08 18:01:37,201] Trial 101 finished with value: 0.37915665729389936 and parameters: {'model_type': 'gcn', 'hidden_dims': '[512, 128]', 'dropout': 0.2404013594995914, 'batch_norm': False, 'lr': 0.0005019524775609302, 'weight_decay': 7.896924765308303e-06, 'epochs': 158, 'loss': 'mae', 'optimizer': 'adam', 'graph_mode': 'cutoff', 'cutoff': 0.5251654973259725, 'grm_norm': 'cosine_then_gcn', 'self_loops': True, 'use_snp_selection': True, 'num_snps': 42129}. Best is trial 101 with value: 0.37915665729389936.
[I 2025-12-08 18:02:19,771] Trial 102 finished with value: 0.3386346116378952 and parameters: {'model_type': 'gcn', 'hidden_dims': '[512, 128]', 'dropout': 0.2516120087991574, 'batch_norm': False, 'lr': 0.0004826699231524835, 'weight_decay': 9.022644138077368e-06, 'epochs': 166, 'loss': 'mae', 'optimizer': 'adam', 'graph_mode': 'cutoff', 'cutoff': 0.5298844670415799, 'grm_norm': 'cosine_then_gcn', 'self_loops': True, 'use_snp_selection': True, 'num_snps': 44275}. Best is trial 101 with value: 0.37915665729389936.
[I 2025-12-08 18:03:04,522] Trial 103 finished with value: 0.26954188133783286 and parameters: {'model_type': 'gcn', 'hidden_dims': '[512, 128]', 'dropout': 0.2950599019141216, 'batch_norm': False, 'lr': 0.000780970170325408, 'weight_decay': 1.2313052199520675e-05, 'epochs': 158, 'loss': 'mae', 'optimizer': 'adam', 'graph_mode': 'cutoff', 'cutoff': 0.5066520526924021, 'grm_norm': 'cosine_then_gcn', 'self_loops': True, 'use_snp_selection': True, 'num_snps': 48834}. Best is trial 101 with value: 0.37915665729389936.
[I 2025-12-08 18:03:37,248] Trial 104 finished with value: 0.3541572176184336 and parameters: {'model_type': 'gcn', 'hidden_dims': '[256, 128]', 'dropout': 0.2183095338944911, 'batch_norm': False, 'lr': 0.0004002945602227177, 'weight_decay': 1.9727956934389838e-05, 'epochs': 189, 'loss': 'mae', 'optimizer': 'adam', 'graph_mode': 'cutoff', 'cutoff': 0.6234400652460433, 'grm_norm': 'cosine_then_gcn', 'self_loops': True, 'use_snp_selection': True, 'num_snps': 46389}. Best is trial 101 with value: 0.37915665729389936.
[I 2025-12-08 18:04:07,772] Trial 105 finished with value: 0.36623837545948235 and parameters: {'model_type': 'gcn', 'hidden_dims': '[512, 128]', 'dropout': 0.2815166119239959, 'batch_norm': False, 'lr': 2.1790118552765545e-05, 'weight_decay': 5.8578585014731945e-06, 'epochs': 179, 'loss': 'mae', 'optimizer': 'adam', 'graph_mode': 'cutoff', 'cutoff': 0.5690359671101303, 'grm_norm': 'cosine_then_gcn', 'self_loops': False, 'use_snp_selection': True, 'num_snps': 26394}. Best is trial 101 with value: 0.37915665729389936.
[I 2025-12-08 18:04:33,006] Trial 106 finished with value: 0.3607984390307677 and parameters: {'model_type': 'gcn', 'hidden_dims': '[256, 128, 64]', 'dropout': 0.2693348290767126, 'batch_norm': False, 'lr': 3.7608675578795315e-05, 'weight_decay': 1.2957127053247496e-06, 'epochs': 121, 'loss': 'mae', 'optimizer': 'adam', 'graph_mode': 'cutoff', 'cutoff': 0.5279647896157297, 'grm_norm': 'cosine', 'self_loops': True, 'use_snp_selection': True, 'num_snps': 41494}. Best is trial 101 with value: 0.37915665729389936.
[I 2025-12-08 18:04:58,122] Trial 107 finished with value: 0.29520997238445706 and parameters: {'model_type': 'gcn', 'hidden_dims': '[128, 64]', 'dropout': 0.2068210757722001, 'batch_norm': False, 'lr': 0.0006563586458066686, 'weight_decay': 3.3834854273951723e-06, 'epochs': 151, 'loss': 'mae', 'optimizer': 'adam', 'graph_mode': 'cutoff', 'cutoff': 0.5916817439766668, 'grm_norm': 'cosine_then_gcn', 'self_loops': True, 'use_snp_selection': True, 'num_snps': 54435}. Best is trial 101 with value: 0.37915665729389936.
