[I 2025-12-08 11:45:24,663] Trial 62 finished with value: 0.35878089938775515 and parameters: {'model_type': 'gcn', 'hidden_dims': '[512, 64]', 'dropout': 0.471268428381374, 'batch_norm': False, 'lr': 0.00013477920084444003, 'weight_decay': 8.385921803948283e-07, 'epochs': 211, 'loss': 'mae', 'optimizer': 'adam', 'graph_mode': 'cutoff', 'cutoff': 0.6202110857038433, 'grm_norm': 'none', 'self_loops': True, 'use_snp_selection': False}. Best is trial 33 with value: 0.3719975991266678.
[I 2025-12-08 11:46:03,447] Trial 63 finished with value: 0.3621914406796719 and parameters: {'model_type': 'gcn', 'hidden_dims': '[512, 64]', 'dropout': 0.4887113865853039, 'batch_norm': False, 'lr': 5.304215717008463e-05, 'weight_decay': 4.053381265971423e-07, 'epochs': 150, 'loss': 'mae', 'optimizer': 'adam', 'graph_mode': 'cutoff', 'cutoff': 0.6948638864373127, 'grm_norm': 'none', 'self_loops': True, 'use_snp_selection': False}. Best is trial 33 with value: 0.3719975991266678.
[I 2025-12-08 11:46:50,301] Trial 64 finished with value: 0.334229248129417 and parameters: {'model_type': 'gcn', 'hidden_dims': '[512, 64]', 'dropout': 0.5770612600584858, 'batch_norm': False, 'lr': 2.4985091095078945e-05, 'weight_decay': 1.0131681199691878e-07, 'epochs': 183, 'loss': 'mae', 'optimizer': 'adam', 'graph_mode': 'cutoff', 'cutoff': 0.5112988424388467, 'grm_norm': 'none', 'self_loops': True, 'use_snp_selection': False}. Best is trial 33 with value: 0.3719975991266678.
[I 2025-12-08 11:47:11,871] Trial 65 finished with value: 0.3415363414187825 and parameters: {'model_type': 'gcn', 'hidden_dims': '[256, 128]', 'dropout': 0.4790581987523046, 'batch_norm': False, 'lr': 7.393725614617317e-05, 'weight_decay': 2.1669453849584474e-07, 'epochs': 169, 'loss': 'mae', 'optimizer': 'adam', 'graph_mode': 'cutoff', 'cutoff': 0.5976945754201551, 'grm_norm': 'none', 'self_loops': True, 'use_snp_selection': False}. Best is trial 33 with value: 0.3719975991266678.
[I 2025-12-08 11:47:47,473] Trial 66 finished with value: 0.3569548827551201 and parameters: {'model_type': 'gcn', 'hidden_dims': '[512, 64]', 'dropout': 0.5091691259277931, 'batch_norm': False, 'lr': 3.385994191716613e-05, 'weight_decay': 3.0496054387894206e-07, 'epochs': 136, 'loss': 'mae', 'optimizer': 'adam', 'graph_mode': 'cutoff', 'cutoff': 0.6381677862580785, 'grm_norm': 'cosine', 'self_loops': True, 'use_snp_selection': False}. Best is trial 33 with value: 0.3719975991266678.
[I 2025-12-08 11:48:38,543] Trial 67 finished with value: 0.3500650517814376 and parameters: {'model_type': 'gcn', 'hidden_dims': '[512, 128]', 'dropout': 0.5449804308809297, 'batch_norm': False, 'lr': 4.953959290511296e-05, 'weight_decay': 1.4146992033259838e-07, 'epochs': 201, 'loss': 'mae', 'optimizer': 'adam', 'graph_mode': 'cutoff', 'cutoff': 0.5470223066083139, 'grm_norm': 'none', 'self_loops': True, 'use_snp_selection': False}. Best is trial 33 with value: 0.3719975991266678.
[I 2025-12-08 11:49:37,587] Trial 68 finished with value: 0.34679120573362016 and parameters: {'model_type': 'gcn', 'hidden_dims': '[512, 64]', 'dropout': 0.5987881660288046, 'batch_norm': False, 'lr': 1.9935145992795654e-05, 'weight_decay': 5.055558198518155e-07, 'epochs': 233, 'loss': 'mse', 'optimizer': 'adam', 'graph_mode': 'cutoff', 'cutoff': 0.4891918110698147, 'grm_norm': 'cosine', 'self_loops': True, 'use_snp_selection': False}. Best is trial 33 with value: 0.3719975991266678.
[I 2025-12-08 11:50:44,248] Trial 69 finished with value: 0.2868037019343088 and parameters: {'model_type': 'gcn', 'hidden_dims': '[512, 64]', 'dropout': 0.43364300193399263, 'batch_norm': False, 'lr': 0.00031777039161096505, 'weight_decay': 1.0416978329381088e-06, 'epochs': 267, 'loss': 'mae', 'optimizer': 'adam', 'graph_mode': 'cutoff', 'cutoff': 0.6729727451773794, 'grm_norm': 'gcn', 'self_loops': True, 'use_snp_selection': False}. Best is trial 33 with value: 0.3719975991266678.
[I 2025-12-08 11:51:33,746] Trial 70 finished with value: 0.26463637522424566 and parameters: {'model_type': 'gcn', 'hidden_dims': '[512, 64]', 'dropout': 0.5230426276864871, 'batch_norm': True, 'lr': 0.0001653982765882313, 'weight_decay': 7.082912931682746e-07, 'epochs': 190, 'loss': 'mae', 'optimizer': 'adam', 'graph_mode': 'knn', 'knn_k': 8, 'weighted_edges': True, 'symmetrize_mode': 'mutual', 'self_loops': True, 'use_snp_selection': False}. Best is trial 33 with value: 0.3719975991266678.
[I 2025-12-08 11:52:16,411] Trial 71 finished with value: 0.36118417584846013 and parameters: {'model_type': 'gcn', 'hidden_dims': '[512, 64]', 'dropout': 0.33056924079446603, 'batch_norm': False, 'lr': 4.856565154700189e-05, 'weight_decay': 1.7164939869816584e-07, 'epochs': 174, 'loss': 'mae', 'optimizer': 'adam', 'graph_mode': 'cutoff', 'cutoff': 0.7291970818858152, 'grm_norm': 'cosine_then_gcn', 'self_loops': False, 'use_snp_selection': True, 'num_snps': 42772}. Best is trial 33 with value: 0.3719975991266678.
[I 2025-12-08 11:52:46,105] Trial 72 finished with value: 0.36971057345372565 and parameters: {'model_type': 'gcn', 'hidden_dims': '[512, 64]', 'dropout': 0.5666842488327714, 'batch_norm': False, 'lr': 5.487079486871421e-05, 'weight_decay': 2.8492127095969265e-05, 'epochs': 178, 'loss': 'mae', 'optimizer': 'adam', 'graph_mode': 'cutoff', 'cutoff': 0.6590013458982774, 'grm_norm': 'cosine_then_gcn', 'self_loops': True, 'use_snp_selection': True, 'num_snps': 25791}. Best is trial 33 with value: 0.3719975991266678.
[I 2025-12-08 11:53:22,346] Trial 73 finished with value: 0.3613829965713525 and parameters: {'model_type': 'gcn', 'hidden_dims': '[512, 64]', 'dropout': 0.567829870469788, 'batch_norm': False, 'lr': 0.00011002814408580402, 'weight_decay': 8.388567809521815e-05, 'epochs': 218, 'loss': 'mae', 'optimizer': 'adam', 'graph_mode': 'cutoff', 'cutoff': 0.579197030755671, 'grm_norm': 'cosine_then_gcn', 'self_loops': True, 'use_snp_selection': True, 'num_snps': 28229}. Best is trial 33 with value: 0.3719975991266678.
[I 2025-12-08 11:53:53,867] Trial 74 finished with value: 0.0 and parameters: {'model_type': 'gcn', 'hidden_dims': '[512, 64]', 'dropout': 0.5823836402858019, 'batch_norm': False, 'lr': 0.009725513114062423, 'weight_decay': 2.697769758732471e-07, 'epochs': 119, 'loss': 'mae', 'optimizer': 'adam', 'graph_mode': 'cutoff', 'cutoff': 0.7907801749790774, 'grm_norm': 'cosine_then_gcn', 'self_loops': True, 'use_snp_selection': False}. Best is trial 33 with value: 0.3719975991266678.
[I 2025-12-08 11:54:48,713] Trial 75 finished with value: 0.35872835827408744 and parameters: {'model_type': 'gcn', 'hidden_dims': '[512, 64]', 'dropout': 0.539131601956241, 'batch_norm': False, 'lr': 3.97416152549032e-05, 'weight_decay': 3.657155796817098e-05, 'epochs': 205, 'loss': 'mae', 'optimizer': 'adam', 'graph_mode': 'cutoff', 'cutoff': 0.6122987155817577, 'grm_norm': 'cosine_then_gcn', 'self_loops': True, 'use_snp_selection': True, 'num_snps': 50194}. Best is trial 33 with value: 0.3719975991266678.
[I 2025-12-08 11:55:30,620] Trial 76 finished with value: 0.36073372669915754 and parameters: {'model_type': 'gcn', 'hidden_dims': '[512, 64]', 'dropout': 0.510398388161045, 'batch_norm': False, 'lr': 8.325441553496643e-05, 'weight_decay': 2.3362838888610925e-05, 'epochs': 161, 'loss': 'mae', 'optimizer': 'adam', 'graph_mode': 'cutoff', 'cutoff': 0.7099736205181311, 'grm_norm': 'cosine_then_gcn', 'self_loops': True, 'use_snp_selection': False}. Best is trial 33 with value: 0.3719975991266678.
[I 2025-12-08 11:55:53,502] Trial 77 finished with value: 0.33130707380646907 and parameters: {'model_type': 'gcn', 'hidden_dims': '[256, 128, 64]', 'dropout': 0.5563707016858963, 'batch_norm': False, 'lr': 6.262510471703033e-05, 'weight_decay': 2.5740940734460902e-05, 'epochs': 179, 'loss': 'mae', 'optimizer': 'adam', 'graph_mode': 'cutoff', 'cutoff': 0.6608779201858918, 'grm_norm': 'cosine_then_gcn', 'self_loops': True, 'use_snp_selection': True, 'num_snps': 24937}. Best is trial 33 with value: 0.3719975991266678.
[I 2025-12-08 11:56:57,825] Trial 78 finished with value: 0.36363614973718866 and parameters: {'model_type': 'gcn', 'hidden_dims': '[512, 64]', 'dropout': 0.5893998279002661, 'batch_norm': False, 'lr': 2.9131433760455132e-05, 'weight_decay': 1.0843151372066897e-05, 'epochs': 254, 'loss': 'mae', 'optimizer': 'adam', 'graph_mode': 'cutoff', 'cutoff': 0.5283759182823322, 'grm_norm': 'cosine_then_gcn', 'self_loops': True, 'use_snp_selection': False}. Best is trial 33 with value: 0.3719975991266678.
[I 2025-12-08 11:57:19,514] Trial 79 finished with value: 0.35499649872490857 and parameters: {'model_type': 'gcn', 'hidden_dims': '[128, 64]', 'dropout': 0.5241728405296929, 'batch_norm': False, 'lr': 3.488479456062306e-05, 'weight_decay': 4.1771195912215275e-07, 'epochs': 227, 'loss': 'mse', 'optimizer': 'adam', 'graph_mode': 'cutoff', 'cutoff': 0.5660541998341704, 'grm_norm': 'cosine_then_gcn', 'self_loops': True, 'use_snp_selection': True, 'num_snps': 30385}. Best is trial 33 with value: 0.3719975991266678.
[I 2025-12-08 11:57:38,077] Trial 80 finished with value: 0.3413328572509952 and parameters: {'model_type': 'gcn', 'hidden_dims': '[256, 128]', 'dropout': 0.48045172531876873, 'batch_norm': False, 'lr': 1.263621222190099e-05, 'weight_decay': 1.2098437214939064e-07, 'epochs': 142, 'loss': 'mae', 'optimizer': 'adam', 'graph_mode': 'cutoff', 'cutoff': 0.6285968324697451, 'grm_norm': 'none', 'self_loops': True, 'use_snp_selection': False}. Best is trial 33 with value: 0.3719975991266678.
[I 2025-12-08 11:58:48,926] Trial 81 finished with value: 0.3597857585373312 and parameters: {'model_type': 'gcn', 'hidden_dims': '[512, 64]', 'dropout': 0.5886872718384045, 'batch_norm': False, 'lr': 2.871335488451412e-05, 'weight_decay': 1.2816810708825923e-05, 'epochs': 281, 'loss': 'mae', 'optimizer': 'adam', 'graph_mode': 'cutoff', 'cutoff': 0.5260490147357209, 'grm_norm': 'cosine_then_gcn', 'self_loops': True, 'use_snp_selection': False}. Best is trial 33 with value: 0.3719975991266678.
[I 2025-12-08 11:59:53,149] Trial 82 finished with value: 0.3504734342978314 and parameters: {'model_type': 'gcn', 'hidden_dims': '[512, 64]', 'dropout': 0.5638172708242107, 'batch_norm': False, 'lr': 1.8007411518484615e-05, 'weight_decay': 9.242246546700303e-06, 'epochs': 254, 'loss': 'mae', 'optimizer': 'adam', 'graph_mode': 'cutoff', 'cutoff': 0.4654516653341726, 'grm_norm': 'cosine_then_gcn', 'self_loops': True, 'use_snp_selection': False}. Best is trial 33 with value: 0.3719975991266678.
[I 2025-12-08 12:00:54,350] Trial 83 finished with value: 0.36372439914120935 and parameters: {'model_type': 'gcn', 'hidden_dims': '[512, 64]', 'dropout': 0.5471683091889222, 'batch_norm': False, 'lr': 2.517228077307309e-05, 'weight_decay': 4.923522762524047e-05, 'epochs': 243, 'loss': 'mae', 'optimizer': 'adam', 'graph_mode': 'cutoff', 'cutoff': 0.5797208424864394, 'grm_norm': 'cosine_then_gcn', 'self_loops': True, 'use_snp_selection': False}. Best is trial 33 with value: 0.3719975991266678.
[I 2025-12-08 12:01:54,305] Trial 84 finished with value: 0.3632048606170322 and parameters: {'model_type': 'gcn', 'hidden_dims': '[512, 64]', 'dropout': 0.5415777173058358, 'batch_norm': False, 'lr': 5.492119875244938e-05, 'weight_decay': 7.449984031138477e-05, 'epochs': 238, 'loss': 'mae', 'optimizer': 'adam', 'graph_mode': 'cutoff', 'cutoff': 0.5916677529717279, 'grm_norm': 'cosine_then_gcn', 'self_loops': True, 'use_snp_selection': False}. Best is trial 33 with value: 0.3719975991266678.
[I 2025-12-08 12:02:37,320] Trial 85 finished with value: 0.3567628715530394 and parameters: {'model_type': 'gcn', 'hidden_dims': '[512, 64]', 'dropout': 0.5003489915865278, 'batch_norm': False, 'lr': 2.4559953819772954e-05, 'weight_decay': 0.00014832364868181528, 'epochs': 167, 'loss': 'mae', 'optimizer': 'adam', 'graph_mode': 'cutoff', 'cutoff': 0.6937055967424604, 'grm_norm': 'cosine_then_gcn', 'self_loops': True, 'use_snp_selection': False}. Best is trial 33 with value: 0.3719975991266678.
[I 2025-12-08 12:03:24,846] Trial 86 finished with value: 0.3668439080544067 and parameters: {'model_type': 'gcn', 'hidden_dims': '[512, 64]', 'dropout': 0.5509902303191053, 'batch_norm': False, 'lr': 3.994147823926494e-05, 'weight_decay': 0.00011284997485765475, 'epochs': 186, 'loss': 'mae', 'optimizer': 'adam', 'graph_mode': 'cutoff', 'cutoff': 0.5595769552425388, 'grm_norm': 'cosine_then_gcn', 'self_loops': True, 'use_snp_selection': False}. Best is trial 33 with value: 0.3719975991266678.
[I 2025-12-08 12:03:49,374] Trial 87 finished with value: 0.35200288749470143 and parameters: {'model_type': 'gcn', 'hidden_dims': '[512, 128]', 'dropout': 0.5572215103124786, 'batch_norm': False, 'lr': 4.201769650204195e-05, 'weight_decay': 0.00025032349573944976, 'epochs': 189, 'loss': 'mae', 'optimizer': 'adam', 'graph_mode': 'cutoff', 'cutoff': 0.846360051589436, 'grm_norm': 'gcn', 'self_loops': True, 'use_snp_selection': True, 'num_snps': 18056}. Best is trial 33 with value: 0.3719975991266678.
[I 2025-12-08 12:04:40,491] Trial 88 finished with value: 0.24956089731769873 and parameters: {'model_type': 'gcn', 'hidden_dims': '[512, 64]', 'dropout': 0.572284043958328, 'batch_norm': True, 'lr': 7.380862696298e-05, 'weight_decay': 5.5945608741365354e-05, 'epochs': 200, 'loss': 'mae', 'optimizer': 'adam', 'graph_mode': 'cutoff', 'cutoff': 0.5696643129361744, 'grm_norm': 'cosine', 'self_loops': True, 'use_snp_selection': False}. Best is trial 33 with value: 0.3719975991266678.
[I 2025-12-08 12:05:20,617] Trial 89 finished with value: 0.33190887374916384 and parameters: {'model_type': 'gcn', 'hidden_dims': '[512, 64]', 'dropout': 0.5458133569063623, 'batch_norm': False, 'lr': 1.5307144960542286e-05, 'weight_decay': 0.0001245447762475209, 'epochs': 153, 'loss': 'mae', 'optimizer': 'adam', 'graph_mode': 'knn', 'knn_k': 5, 'weighted_edges': True, 'symmetrize_mode': 'mutual', 'self_loops': True, 'use_snp_selection': False}. Best is trial 33 with value: 0.3719975991266678.
[I 2025-12-08 12:06:21,743] Trial 90 finished with value: 0.3600089497229448 and parameters: {'model_type': 'gcn', 'hidden_dims': '[512, 64]', 'dropout': 0.5275554433675014, 'batch_norm': False, 'lr': 3.759099181085037e-05, 'weight_decay': 4.750944539911487e-05, 'epochs': 209, 'loss': 'mse', 'optimizer': 'adam', 'graph_mode': 'cutoff', 'cutoff': 0.6565094177001067, 'grm_norm': 'cosine_then_gcn', 'self_loops': True, 'use_snp_selection': True, 'num_snps': 57161}. Best is trial 33 with value: 0.3719975991266678.
[I 2025-12-08 12:07:09,115] Trial 91 finished with value: 0.36851236233241946 and parameters: {'model_type': 'gcn', 'hidden_dims': '[512, 64]', 'dropout': 0.5145050779637186, 'batch_norm': False, 'lr': 5.849431100009007e-05, 'weight_decay': 6.778304555501137e-05, 'epochs': 185, 'loss': 'mae', 'optimizer': 'adam', 'graph_mode': 'cutoff', 'cutoff': 0.5517636935568107, 'grm_norm': 'cosine_then_gcn', 'self_loops': True, 'use_snp_selection': False}. Best is trial 33 with value: 0.3719975991266678.
[I 2025-12-08 12:07:55,207] Trial 92 finished with value: 0.3584718312339404 and parameters: {'model_type': 'gcn', 'hidden_dims': '[512, 64]', 'dropout': 0.46080715488732854, 'batch_norm': False, 'lr': 4.449078742206097e-05, 'weight_decay': 7.446373605926797e-05, 'epochs': 179, 'loss': 'mae', 'optimizer': 'adam', 'graph_mode': 'cutoff', 'cutoff': 0.500120116529665, 'grm_norm': 'cosine_then_gcn', 'self_loops': True, 'use_snp_selection': False}. Best is trial 33 with value: 0.3719975991266678.
[I 2025-12-08 12:08:44,727] Trial 93 finished with value: 0.36005793964242 and parameters: {'model_type': 'gcn', 'hidden_dims': '[512, 64]', 'dropout': 0.5132357104448253, 'batch_norm': False, 'lr': 1.974541283221753e-05, 'weight_decay': 0.00011598215884100136, 'epochs': 194, 'loss': 'mae', 'optimizer': 'adam', 'graph_mode': 'cutoff', 'cutoff': 0.555568827382123, 'grm_norm': 'cosine_then_gcn', 'self_loops': True, 'use_snp_selection': False}. Best is trial 33 with value: 0.3719975991266678.
[I 2025-12-08 12:09:27,723] Trial 94 finished with value: 0.3616662453438971 and parameters: {'model_type': 'gcn', 'hidden_dims': '[512, 64]', 'dropout': 0.5516856722219238, 'batch_norm': False, 'lr': 2.5848507436430464e-05, 'weight_decay': 0.00021152646761333262, 'epochs': 167, 'loss': 'mae', 'optimizer': 'adam', 'graph_mode': 'cutoff', 'cutoff': 0.6036680191465381, 'grm_norm': 'cosine_then_gcn', 'self_loops': True, 'use_snp_selection': False}. Best is trial 33 with value: 0.3719975991266678.
[I 2025-12-08 12:10:15,541] Trial 95 finished with value: 0.3724566311165337 and parameters: {'model_type': 'gcn', 'hidden_dims': '[512, 64]', 'dropout': 0.5328755462530413, 'batch_norm': False, 'lr': 3.218275505478667e-05, 'weight_decay': 2.812584349127551e-05, 'epochs': 187, 'loss': 'mae', 'optimizer': 'adam', 'graph_mode': 'cutoff', 'cutoff': 0.5789463404258907, 'grm_norm': 'cosine_then_gcn', 'self_loops': True, 'use_snp_selection': False}. Best is trial 95 with value: 0.3724566311165337.
[I 2025-12-08 12:11:02,743] Trial 96 finished with value: 0.36715282852160397 and parameters: {'model_type': 'gcn', 'hidden_dims': '[512, 64]', 'dropout': 0.5348883122429916, 'batch_norm': False, 'lr': 6.743592215127195e-05, 'weight_decay': 6.733854599913374e-06, 'epochs': 185, 'loss': 'mae', 'optimizer': 'adam', 'graph_mode': 'cutoff', 'cutoff': 0.6379146032901225, 'grm_norm': 'cosine', 'self_loops': True, 'use_snp_selection': False}. Best is trial 95 with value: 0.3724566311165337.
[I 2025-12-08 12:11:50,264] Trial 97 finished with value: 0.36511084630250146 and parameters: {'model_type': 'gcn', 'hidden_dims': '[512, 64]', 'dropout': 0.5291390363813607, 'batch_norm': False, 'lr': 0.00019547347014340757, 'weight_decay': 0.00034602335985681594, 'epochs': 186, 'loss': 'mae', 'optimizer': 'adam', 'graph_mode': 'cutoff', 'cutoff': 0.6400577500214154, 'grm_norm': 'cosine', 'self_loops': True, 'use_snp_selection': False}. Best is trial 95 with value: 0.3724566311165337.
[I 2025-12-08 12:12:14,899] Trial 98 finished with value: 0.1133906757111411 and parameters: {'model_type': 'gcn', 'hidden_dims': '[256, 128, 64]', 'dropout': 0.5373587221415606, 'batch_norm': False, 'lr': 0.00020125112333649838, 'weight_decay': 2.0719829720330314e-05, 'epochs': 187, 'loss': 'mae', 'optimizer': 'adam', 'graph_mode': 'cutoff', 'cutoff': 0.6382541434453969, 'grm_norm': 'cosine', 'self_loops': True, 'use_snp_selection': False}. Best is trial 95 with value: 0.3724566311165337.
[I 2025-12-08 12:12:59,358] Trial 99 finished with value: 0.36344141146979514 and parameters: {'model_type': 'gcn', 'hidden_dims': '[512, 64]', 'dropout': 0.502088349113739, 'batch_norm': False, 'lr': 0.00014070058384609688, 'weight_decay': 2.968938088047944e-05, 'epochs': 196, 'loss': 'mae', 'optimizer': 'adam', 'graph_mode': 'cutoff', 'cutoff': 0.6133449707518803, 'grm_norm': 'cosine', 'self_loops': True, 'use_snp_selection': True, 'num_snps': 40629}. Best is trial 95 with value: 0.3724566311165337.
[I 2025-12-08 12:13:11,905] Trial 100 finished with value: 0.0600230863463934 and parameters: {'model_type': 'gcn', 'hidden_dims': '[128, 64]', 'dropout': 0.5194686869872153, 'batch_norm': False, 'lr': 0.000392210352630073, 'weight_decay': 0.0003891280262083972, 'epochs': 158, 'loss': 'mae', 'optimizer': 'adam', 'graph_mode': 'cutoff', 'cutoff': 0.5986036787236196, 'grm_norm': 'cosine', 'self_loops': True, 'use_snp_selection': False}. Best is trial 95 with value: 0.3724566311165337.
[I 2025-12-08 12:13:56,602] Trial 101 finished with value: 0.36324860709686335 and parameters: {'model_type': 'gcn', 'hidden_dims': '[512, 64]', 'dropout': 0.5252943453014897, 'batch_norm': False, 'lr': 6.95687833886291e-05, 'weight_decay': 6.297307566386988e-06, 'epochs': 174, 'loss': 'mae', 'optimizer': 'adam', 'graph_mode': 'cutoff', 'cutoff': 0.678228270845198, 'grm_norm': 'cosine', 'self_loops': True, 'use_snp_selection': False}. Best is trial 95 with value: 0.3724566311165337.
[I 2025-12-08 12:14:43,071] Trial 102 finished with value: 0.3697944141064189 and parameters: {'model_type': 'gcn', 'hidden_dims': '[512, 64]', 'dropout': 0.5090201092738521, 'batch_norm': False, 'lr': 9.138681156737503e-05, 'weight_decay': 0.00041454432505472286, 'epochs': 182, 'loss': 'mae', 'optimizer': 'adam', 'graph_mode': 'cutoff', 'cutoff': 0.6449666291399369, 'grm_norm': 'cosine', 'self_loops': True, 'use_snp_selection': False}. Best is trial 95 with value: 0.3724566311165337.
[I 2025-12-08 12:15:30,316] Trial 103 finished with value: 0.36363984416093825 and parameters: {'model_type': 'gcn', 'hidden_dims': '[512, 64]', 'dropout': 0.5654063404828105, 'batch_norm': False, 'lr': 9.10093196099889e-05, 'weight_decay': 0.000599621715522712, 'epochs': 185, 'loss': 'mae', 'optimizer': 'adam', 'graph_mode': 'cutoff', 'cutoff': 0.6456529583139838, 'grm_norm': 'cosine', 'self_loops': True, 'use_snp_selection': False}. Best is trial 95 with value: 0.3724566311165337.
[I 2025-12-08 12:16:16,445] Trial 104 finished with value: 0.3619222117954728 and parameters: {'model_type': 'gcn', 'hidden_dims': '[512, 64]', 'dropout': 0.5299087035879978, 'batch_norm': False, 'lr': 0.0002710108796341972, 'weight_decay': 0.000734545316781875, 'epochs': 180, 'loss': 'mae', 'optimizer': 'adam', 'graph_mode': 'cutoff', 'cutoff': 0.6286917674700764, 'grm_norm': 'cosine', 'self_loops': True, 'use_snp_selection': False}. Best is trial 95 with value: 0.3724566311165337.
[I 2025-12-08 12:17:08,809] Trial 105 finished with value: 0.36284009647017734 and parameters: {'model_type': 'gcn', 'hidden_dims': '[512, 64]', 'dropout': 0.5085701871331778, 'batch_norm': False, 'lr': 0.000106020134514881, 'weight_decay': 0.000322505882862885, 'epochs': 206, 'loss': 'mae', 'optimizer': 'adam', 'graph_mode': 'cutoff', 'cutoff': 0.5823241196046796, 'grm_norm': 'cosine', 'self_loops': True, 'use_snp_selection': False}. Best is trial 95 with value: 0.3724566311165337.
