[I 2025-12-08 20:57:14,189] Trial 42 finished with value: 0.35454844783447437 and parameters: {'model_type': 'gcn', 'hidden_dims': '[512, 256]', 'dropout': 0.5957565747488955, 'batch_norm': False, 'lr': 0.0005865534640981293, 'weight_decay': 4.218781471396888e-05, 'epochs': 96, 'loss': 'mae', 'optimizer': 'adam', 'graph_mode': 'knn', 'knn_k': 5, 'weighted_edges': False, 'symmetrize_mode': 'union', 'self_loops': False, 'use_snp_selection': True, 'num_snps': 14903}. Best is trial 4 with value: 0.3608752207970768.
[I 2025-12-08 20:57:31,912] Trial 43 finished with value: 0.35740934206662606 and parameters: {'model_type': 'gcn', 'hidden_dims': '[512, 256]', 'dropout': 0.5493502144806721, 'batch_norm': False, 'lr': 0.000599541925184624, 'weight_decay': 4.6409737415172466e-05, 'epochs': 125, 'loss': 'mae', 'optimizer': 'adam', 'graph_mode': 'knn', 'knn_k': 4, 'weighted_edges': False, 'symmetrize_mode': 'union', 'self_loops': False, 'use_snp_selection': True, 'num_snps': 13377}. Best is trial 4 with value: 0.3608752207970768.
[I 2025-12-08 20:57:58,465] Trial 44 finished with value: 0.34879681352548514 and parameters: {'model_type': 'gcn', 'hidden_dims': '[512, 256]', 'dropout': 0.5106078429809773, 'batch_norm': False, 'lr': 0.000164858365909058, 'weight_decay': 3.593242678379528e-05, 'epochs': 125, 'loss': 'mae', 'optimizer': 'adam', 'graph_mode': 'knn', 'knn_k': 3, 'weighted_edges': False, 'symmetrize_mode': 'union', 'self_loops': False, 'use_snp_selection': True, 'num_snps': 27647}. Best is trial 4 with value: 0.3608752207970768.
[I 2025-12-08 20:58:13,099] Trial 45 finished with value: 0.18860165869688314 and parameters: {'model_type': 'gcn', 'hidden_dims': '[512, 64]', 'dropout': 0.592831262146881, 'batch_norm': False, 'lr': 0.0005644937124298208, 'weight_decay': 1.733372150046134e-05, 'epochs': 69, 'loss': 'mae', 'optimizer': 'adam', 'graph_mode': 'knn', 'knn_k': 4, 'weighted_edges': True, 'symmetrize_mode': 'mutual', 'self_loops': False, 'use_snp_selection': True, 'num_snps': 14212}. Best is trial 4 with value: 0.3608752207970768.
[I 2025-12-08 20:58:54,877] Trial 46 finished with value: 0.34883874870007026 and parameters: {'model_type': 'gcn', 'hidden_dims': '[512, 128]', 'dropout': 0.5809307770197982, 'batch_norm': False, 'lr': 0.00032555994728841124, 'weight_decay': 5.338201485790921e-05, 'epochs': 111, 'loss': 'mae', 'optimizer': 'adam', 'graph_mode': 'knn', 'knn_k': 2, 'weighted_edges': False, 'symmetrize_mode': 'union', 'self_loops': False, 'use_snp_selection': True, 'num_snps': 57585}. Best is trial 4 with value: 0.3608752207970768.
[I 2025-12-08 20:59:19,036] Trial 47 finished with value: 0.06207362365580429 and parameters: {'model_type': 'gcn', 'hidden_dims': '[512, 256]', 'dropout': 0.5467819868131336, 'batch_norm': False, 'lr': 0.0012038097093222675, 'weight_decay': 2.4172266975695086e-05, 'epochs': 88, 'loss': 'mae', 'optimizer': 'adam', 'graph_mode': 'cutoff', 'cutoff': 0.5214873215299125, 'grm_norm': 'none', 'self_loops': False, 'use_snp_selection': False}. Best is trial 4 with value: 0.3608752207970768.
[I 2025-12-08 20:59:30,823] Trial 48 finished with value: 0.3610586318202967 and parameters: {'model_type': 'gcn', 'hidden_dims': '[128, 64]', 'dropout': 0.472160644807868, 'batch_norm': False, 'lr': 6.276216533025108e-05, 'weight_decay': 1.0976572314712746e-07, 'epochs': 181, 'loss': 'mse', 'optimizer': 'adam', 'graph_mode': 'knn', 'knn_k': 4, 'weighted_edges': True, 'symmetrize_mode': 'union', 'self_loops': False, 'use_snp_selection': True, 'num_snps': 6271}. Best is trial 48 with value: 0.3610586318202967.
[I 2025-12-08 20:59:44,547] Trial 49 finished with value: 0.28588496695313775 and parameters: {'model_type': 'gcn', 'hidden_dims': '[128, 64]', 'dropout': 0.48250920761929955, 'batch_norm': True, 'lr': 5.981056356074025e-05, 'weight_decay': 2.0095433277128814e-07, 'epochs': 318, 'loss': 'mse', 'optimizer': 'adam', 'graph_mode': 'knn', 'knn_k': 3, 'weighted_edges': True, 'symmetrize_mode': 'mutual', 'self_loops': False, 'use_snp_selection': True, 'num_snps': 5495}. Best is trial 48 with value: 0.3610586318202967.
[I 2025-12-08 20:59:55,585] Trial 50 finished with value: 0.30426485798261355 and parameters: {'model_type': 'gcn', 'hidden_dims': '[128, 64]', 'dropout': 0.44859536467206845, 'batch_norm': False, 'lr': 1.512807312086646e-05, 'weight_decay': 9.175556129185844e-07, 'epochs': 155, 'loss': 'mse', 'optimizer': 'adam', 'graph_mode': 'cutoff', 'cutoff': 0.2532530633487037, 'grm_norm': 'none', 'self_loops': False, 'use_snp_selection': True, 'num_snps': 5703}. Best is trial 48 with value: 0.3610586318202967.
[I 2025-12-08 21:00:08,231] Trial 51 finished with value: 0.3632935625190139 and parameters: {'model_type': 'gcn', 'hidden_dims': '[128, 64]', 'dropout': 0.5679367647513679, 'batch_norm': False, 'lr': 0.00011383941689627337, 'weight_decay': 5.125237374043114e-05, 'epochs': 181, 'loss': 'mse', 'optimizer': 'adam', 'graph_mode': 'knn', 'knn_k': 4, 'weighted_edges': True, 'symmetrize_mode': 'union', 'self_loops': False, 'use_snp_selection': True, 'num_snps': 8916}. Best is trial 51 with value: 0.3632935625190139.
[I 2025-12-08 21:00:20,391] Trial 52 finished with value: 0.34986114258032297 and parameters: {'model_type': 'gcn', 'hidden_dims': '[128, 64]', 'dropout': 0.5671294762491426, 'batch_norm': False, 'lr': 2.6346533312146372e-05, 'weight_decay': 4.358416612027561e-05, 'epochs': 180, 'loss': 'mse', 'optimizer': 'adam', 'graph_mode': 'knn', 'knn_k': 4, 'weighted_edges': True, 'symmetrize_mode': 'union', 'self_loops': False, 'use_snp_selection': True, 'num_snps': 7319}. Best is trial 51 with value: 0.3632935625190139.
[I 2025-12-08 21:00:35,017] Trial 53 finished with value: 0.37115293670241084 and parameters: {'model_type': 'gcn', 'hidden_dims': '[128, 64]', 'dropout': 0.5429307510402064, 'batch_norm': False, 'lr': 9.820560171876993e-05, 'weight_decay': 1.1898293185071494e-07, 'epochs': 177, 'loss': 'mse', 'optimizer': 'adam', 'graph_mode': 'knn', 'knn_k': 5, 'weighted_edges': True, 'symmetrize_mode': 'union', 'self_loops': False, 'use_snp_selection': True, 'num_snps': 14138}. Best is trial 53 with value: 0.37115293670241084.
[I 2025-12-08 21:00:52,869] Trial 54 finished with value: 0.3696039853700788 and parameters: {'model_type': 'gcn', 'hidden_dims': '[128, 64]', 'dropout': 0.5408391856312214, 'batch_norm': False, 'lr': 9.385567973238004e-05, 'weight_decay': 2.1974707835605155e-07, 'epochs': 203, 'loss': 'mse', 'optimizer': 'adam', 'graph_mode': 'knn', 'knn_k': 6, 'weighted_edges': True, 'symmetrize_mode': 'union', 'self_loops': False, 'use_snp_selection': True, 'num_snps': 21514}. Best is trial 53 with value: 0.37115293670241084.
[I 2025-12-08 21:01:11,508] Trial 55 finished with value: 0.36336123728669617 and parameters: {'model_type': 'gcn', 'hidden_dims': '[128, 64]', 'dropout': 0.5242340120150581, 'batch_norm': False, 'lr': 9.575098627737598e-05, 'weight_decay': 1.3294215529040578e-07, 'epochs': 214, 'loss': 'mse', 'optimizer': 'adam', 'graph_mode': 'knn', 'knn_k': 6, 'weighted_edges': True, 'symmetrize_mode': 'union', 'self_loops': False, 'use_snp_selection': True, 'num_snps': 23121}. Best is trial 53 with value: 0.37115293670241084.
[I 2025-12-08 21:01:31,408] Trial 56 finished with value: 0.3691667940204106 and parameters: {'model_type': 'gcn', 'hidden_dims': '[128, 64]', 'dropout': 0.5080169325056948, 'batch_norm': False, 'lr': 9.493993800919063e-05, 'weight_decay': 1.0976843101816263e-07, 'epochs': 246, 'loss': 'mse', 'optimizer': 'adam', 'graph_mode': 'knn', 'knn_k': 8, 'weighted_edges': True, 'symmetrize_mode': 'union', 'self_loops': False, 'use_snp_selection': True, 'num_snps': 23514}. Best is trial 53 with value: 0.37115293670241084.
[I 2025-12-08 21:01:54,290] Trial 57 finished with value: 0.3689561373512159 and parameters: {'model_type': 'gcn', 'hidden_dims': '[128, 64]', 'dropout': 0.5013603861628239, 'batch_norm': False, 'lr': 9.649468241533937e-05, 'weight_decay': 1.3717967844683424e-07, 'epochs': 251, 'loss': 'mse', 'optimizer': 'adam', 'graph_mode': 'knn', 'knn_k': 8, 'weighted_edges': True, 'symmetrize_mode': 'union', 'self_loops': False, 'use_snp_selection': True, 'num_snps': 30826}. Best is trial 53 with value: 0.37115293670241084.
[I 2025-12-08 21:02:15,168] Trial 58 finished with value: 0.36540880648442087 and parameters: {'model_type': 'gcn', 'hidden_dims': '[128, 64]', 'dropout': 0.50772565028866, 'batch_norm': False, 'lr': 0.00011757985779607776, 'weight_decay': 2.0917984290088037e-07, 'epochs': 260, 'loss': 'mse', 'optimizer': 'adam', 'graph_mode': 'knn', 'knn_k': 8, 'weighted_edges': True, 'symmetrize_mode': 'union', 'self_loops': False, 'use_snp_selection': True, 'num_snps': 24550}. Best is trial 53 with value: 0.37115293670241084.
[I 2025-12-08 21:02:38,580] Trial 59 finished with value: 0.3699574755937337 and parameters: {'model_type': 'gcn', 'hidden_dims': '[128, 64]', 'dropout': 0.5085500198363052, 'batch_norm': False, 'lr': 9.259485610385961e-05, 'weight_decay': 1.7127194400735043e-07, 'epochs': 267, 'loss': 'mse', 'optimizer': 'adam', 'graph_mode': 'knn', 'knn_k': 8, 'weighted_edges': True, 'symmetrize_mode': 'union', 'self_loops': False, 'use_snp_selection': True, 'num_snps': 30520}. Best is trial 53 with value: 0.37115293670241084.
[I 2025-12-08 21:03:02,186] Trial 60 finished with value: 0.3543546473296145 and parameters: {'model_type': 'gcn', 'hidden_dims': '[128, 64]', 'dropout': 0.496512620054576, 'batch_norm': False, 'lr': 4.493407341222349e-05, 'weight_decay': 3.850130616784936e-07, 'epochs': 265, 'loss': 'mse', 'optimizer': 'adam', 'graph_mode': 'knn', 'knn_k': 9, 'weighted_edges': True, 'symmetrize_mode': 'union', 'self_loops': True, 'use_snp_selection': True, 'num_snps': 30400}. Best is trial 53 with value: 0.37115293670241084.
[I 2025-12-08 21:03:23,250] Trial 61 finished with value: 0.36324776723183055 and parameters: {'model_type': 'gcn', 'hidden_dims': '[128, 64]', 'dropout': 0.533794760852758, 'batch_norm': False, 'lr': 0.00011347619260859591, 'weight_decay': 1.8924972273642852e-07, 'epochs': 260, 'loss': 'mse', 'optimizer': 'adam', 'graph_mode': 'knn', 'knn_k': 8, 'weighted_edges': True, 'symmetrize_mode': 'union', 'self_loops': False, 'use_snp_selection': True, 'num_snps': 24976}. Best is trial 53 with value: 0.37115293670241084.
[I 2025-12-08 21:03:45,835] Trial 62 finished with value: 0.37015697314589013 and parameters: {'model_type': 'gcn', 'hidden_dims': '[128, 64]', 'dropout': 0.4514798144340833, 'batch_norm': False, 'lr': 8.346543346967582e-05, 'weight_decay': 1.733525847908352e-07, 'epochs': 251, 'loss': 'mse', 'optimizer': 'adam', 'graph_mode': 'knn', 'knn_k': 8, 'weighted_edges': True, 'symmetrize_mode': 'union', 'self_loops': False, 'use_snp_selection': True, 'num_snps': 30370}. Best is trial 53 with value: 0.37115293670241084.
[I 2025-12-08 21:04:13,511] Trial 63 finished with value: 0.35753783230447844 and parameters: {'model_type': 'gcn', 'hidden_dims': '[128, 64]', 'dropout': 0.4382112743619988, 'batch_norm': False, 'lr': 0.00015340093559256882, 'weight_decay': 2.6450661741489965e-07, 'epochs': 284, 'loss': 'mse', 'optimizer': 'adam', 'graph_mode': 'knn', 'knn_k': 8, 'weighted_edges': True, 'symmetrize_mode': 'union', 'self_loops': False, 'use_snp_selection': True, 'num_snps': 39713}. Best is trial 53 with value: 0.37115293670241084.
[I 2025-12-08 21:04:35,949] Trial 64 finished with value: 0.3699886886763321 and parameters: {'model_type': 'gcn', 'hidden_dims': '[128, 64]', 'dropout': 0.5023026510685212, 'batch_norm': False, 'lr': 7.186580175789531e-05, 'weight_decay': 6.478192154434101e-07, 'epochs': 249, 'loss': 'mse', 'optimizer': 'adam', 'graph_mode': 'knn', 'knn_k': 9, 'weighted_edges': True, 'symmetrize_mode': 'union', 'self_loops': False, 'use_snp_selection': True, 'num_snps': 30030}. Best is trial 53 with value: 0.37115293670241084.
[I 2025-12-08 21:04:57,926] Trial 65 finished with value: 0.36577564351030023 and parameters: {'model_type': 'gcn', 'hidden_dims': '[128, 64]', 'dropout': 0.4557594445912584, 'batch_norm': False, 'lr': 6.842000160402328e-05, 'weight_decay': 5.938290853277524e-07, 'epochs': 240, 'loss': 'mse', 'optimizer': 'adam', 'graph_mode': 'knn', 'knn_k': 9, 'weighted_edges': True, 'symmetrize_mode': 'union', 'self_loops': False, 'use_snp_selection': True, 'num_snps': 29589}. Best is trial 53 with value: 0.37115293670241084.
[I 2025-12-08 21:05:21,356] Trial 66 finished with value: 0.36596703605710423 and parameters: {'model_type': 'gcn', 'hidden_dims': '[128, 64]', 'dropout': 0.42011133536789513, 'batch_norm': False, 'lr': 3.072289939560945e-05, 'weight_decay': 1.5792767743102767e-07, 'epochs': 251, 'loss': 'mse', 'optimizer': 'adam', 'graph_mode': 'knn', 'knn_k': 10, 'weighted_edges': True, 'symmetrize_mode': 'union', 'self_loops': False, 'use_snp_selection': True, 'num_snps': 32331}. Best is trial 53 with value: 0.37115293670241084.
[I 2025-12-08 21:05:46,461] Trial 67 finished with value: 0.3642275419065715 and parameters: {'model_type': 'gcn', 'hidden_dims': '[128, 64]', 'dropout': 0.4901893047293846, 'batch_norm': False, 'lr': 4.853352202741369e-05, 'weight_decay': 3.247857500369311e-07, 'epochs': 278, 'loss': 'mse', 'optimizer': 'adam', 'graph_mode': 'knn', 'knn_k': 7, 'weighted_edges': True, 'symmetrize_mode': 'union', 'self_loops': False, 'use_snp_selection': True, 'num_snps': 34526}. Best is trial 53 with value: 0.37115293670241084.
[I 2025-12-08 21:06:09,502] Trial 68 finished with value: 0.3010396615771252 and parameters: {'model_type': 'gcn', 'hidden_dims': '[128, 64]', 'dropout': 0.401424660375677, 'batch_norm': False, 'lr': 0.00022729606460292825, 'weight_decay': 5.771921184542911e-07, 'epochs': 306, 'loss': 'mse', 'optimizer': 'adam', 'graph_mode': 'knn', 'knn_k': 9, 'weighted_edges': True, 'symmetrize_mode': 'union', 'self_loops': False, 'use_snp_selection': False}. Best is trial 53 with value: 0.37115293670241084.
[I 2025-12-08 21:06:29,709] Trial 69 finished with value: 0.3587354991214894 and parameters: {'model_type': 'gcn', 'hidden_dims': '[128, 64]', 'dropout': 0.5109499526619977, 'batch_norm': False, 'lr': 8.692847408724462e-05, 'weight_decay': 1.014629882005434e-07, 'epochs': 226, 'loss': 'mse', 'optimizer': 'adam', 'graph_mode': 'knn', 'knn_k': 8, 'weighted_edges': True, 'symmetrize_mode': 'mutual', 'self_loops': False, 'use_snp_selection': True, 'num_snps': 27560}. Best is trial 53 with value: 0.37115293670241084.
[I 2025-12-08 21:06:48,250] Trial 70 finished with value: 0.3679439435273269 and parameters: {'model_type': 'gcn', 'hidden_dims': '[128, 64]', 'dropout': 0.5400056854490438, 'batch_norm': False, 'lr': 3.450853801006799e-05, 'weight_decay': 1.4738106077562036e-07, 'epochs': 250, 'loss': 'mse', 'optimizer': 'adam', 'graph_mode': 'knn', 'knn_k': 9, 'weighted_edges': True, 'symmetrize_mode': 'union', 'self_loops': False, 'use_snp_selection': True, 'num_snps': 20118}. Best is trial 53 with value: 0.37115293670241084.
[I 2025-12-08 21:07:07,307] Trial 71 finished with value: 0.36932193785753437 and parameters: {'model_type': 'gcn', 'hidden_dims': '[128, 64]', 'dropout': 0.5353112934926813, 'batch_norm': False, 'lr': 3.700397992357375e-05, 'weight_decay': 1.447116655880119e-07, 'epochs': 247, 'loss': 'mse', 'optimizer': 'adam', 'graph_mode': 'knn', 'knn_k': 9, 'weighted_edges': True, 'symmetrize_mode': 'union', 'self_loops': False, 'use_snp_selection': True, 'num_snps': 20854}. Best is trial 53 with value: 0.37115293670241084.
[I 2025-12-08 21:07:26,584] Trial 72 finished with value: 0.36412440305583493 and parameters: {'model_type': 'gcn', 'hidden_dims': '[128, 64]', 'dropout': 0.4760668487220357, 'batch_norm': False, 'lr': 7.177079849930127e-05, 'weight_decay': 2.5593272123975714e-07, 'epochs': 249, 'loss': 'mse', 'optimizer': 'adam', 'graph_mode': 'knn', 'knn_k': 10, 'weighted_edges': True, 'symmetrize_mode': 'union', 'self_loops': False, 'use_snp_selection': True, 'num_snps': 21161}. Best is trial 53 with value: 0.37115293670241084.
[I 2025-12-08 21:07:50,759] Trial 73 finished with value: 0.3738911700451141 and parameters: {'model_type': 'gcn', 'hidden_dims': '[128, 64]', 'dropout': 0.4984795638896023, 'batch_norm': False, 'lr': 5.7091856359840834e-05, 'weight_decay': 5.793514728511932e-07, 'epochs': 227, 'loss': 'mse', 'optimizer': 'adam', 'graph_mode': 'knn', 'knn_k': 8, 'weighted_edges': True, 'symmetrize_mode': 'union', 'self_loops': False, 'use_snp_selection': True, 'num_snps': 37180}. Best is trial 73 with value: 0.3738911700451141.
[I 2025-12-08 21:08:16,207] Trial 74 finished with value: 0.3641719410525002 and parameters: {'model_type': 'gcn', 'hidden_dims': '[128, 64]', 'dropout': 0.5198348673525292, 'batch_norm': False, 'lr': 5.449390764035229e-05, 'weight_decay': 1.5165352962361476e-06, 'epochs': 205, 'loss': 'mse', 'optimizer': 'adam', 'graph_mode': 'knn', 'knn_k': 7, 'weighted_edges': True, 'symmetrize_mode': 'union', 'self_loops': False, 'use_snp_selection': True, 'num_snps': 43933}. Best is trial 73 with value: 0.3738911700451141.
[I 2025-12-08 21:08:49,398] Trial 75 finished with value: 0.3616637714291352 and parameters: {'model_type': 'gcn', 'hidden_dims': '[256, 128, 64]', 'dropout': 0.46138972179678484, 'batch_norm': False, 'lr': 1.9279108135272187e-05, 'weight_decay': 5.623976395413948e-07, 'epochs': 224, 'loss': 'mse', 'optimizer': 'adam', 'graph_mode': 'knn', 'knn_k': 9, 'weighted_edges': True, 'symmetrize_mode': 'union', 'self_loops': False, 'use_snp_selection': True, 'num_snps': 37690}. Best is trial 73 with value: 0.3738911700451141.
[I 2025-12-08 21:09:09,731] Trial 76 finished with value: 0.3516022770207259 and parameters: {'model_type': 'gcn', 'hidden_dims': '[128, 64]', 'dropout': 0.558753295813527, 'batch_norm': False, 'lr': 1.0128588109209042e-05, 'weight_decay': 8.301264081676425e-07, 'epochs': 233, 'loss': 'mse', 'optimizer': 'adam', 'graph_mode': 'knn', 'knn_k': 8, 'weighted_edges': True, 'symmetrize_mode': 'union', 'self_loops': True, 'use_snp_selection': True, 'num_snps': 26239}. Best is trial 73 with value: 0.3738911700451141.
[I 2025-12-08 21:09:38,851] Trial 77 finished with value: 0.36821964870230883 and parameters: {'model_type': 'gcn', 'hidden_dims': '[256, 128]', 'dropout': 0.5321995825490304, 'batch_norm': False, 'lr': 3.793472433598527e-05, 'weight_decay': 3.4540889663606604e-07, 'epochs': 196, 'loss': 'mse', 'optimizer': 'adam', 'graph_mode': 'knn', 'knn_k': 10, 'weighted_edges': True, 'symmetrize_mode': 'union', 'self_loops': False, 'use_snp_selection': True, 'num_snps': 35393}. Best is trial 73 with value: 0.3738911700451141.
[I 2025-12-08 21:10:01,733] Trial 78 finished with value: 0.3542062775601628 and parameters: {'model_type': 'gcn', 'hidden_dims': '[128, 64]', 'dropout': 0.5734900985921105, 'batch_norm': False, 'lr': 0.00014821886476742613, 'weight_decay': 1.3248563349827586e-06, 'epochs': 271, 'loss': 'mse', 'optimizer': 'adam', 'graph_mode': 'knn', 'knn_k': 7, 'weighted_edges': True, 'symmetrize_mode': 'union', 'self_loops': False, 'use_snp_selection': True, 'num_snps': 28949}. Best is trial 73 with value: 0.3738911700451141.
[I 2025-12-08 21:10:18,792] Trial 79 finished with value: 0.36273728811453027 and parameters: {'model_type': 'gcn', 'hidden_dims': '[128, 64]', 'dropout': 0.4395534255661366, 'batch_norm': False, 'lr': 7.738775477439008e-05, 'weight_decay': 4.680057603610462e-07, 'epochs': 218, 'loss': 'mse', 'optimizer': 'adam', 'graph_mode': 'knn', 'knn_k': 9, 'weighted_edges': True, 'symmetrize_mode': 'union', 'self_loops': False, 'use_snp_selection': False}. Best is trial 73 with value: 0.3738911700451141.
[I 2025-12-08 21:10:53,032] Trial 80 finished with value: 0.34448554549540344 and parameters: {'model_type': 'gcn', 'hidden_dims': '[512, 128]', 'dropout': 0.5521583112240802, 'batch_norm': False, 'lr': 0.0002034159295451023, 'weight_decay': 2.6086761372932024e-06, 'epochs': 299, 'loss': 'mse', 'optimizer': 'adam', 'graph_mode': 'knn', 'knn_k': 8, 'weighted_edges': True, 'symmetrize_mode': 'mutual', 'self_loops': False, 'use_snp_selection': True, 'num_snps': 18349}. Best is trial 73 with value: 0.3738911700451141.
[I 2025-12-08 21:11:15,493] Trial 81 finished with value: 0.3667223692862904 and parameters: {'model_type': 'gcn', 'hidden_dims': '[128, 64]', 'dropout': 0.5026560026413268, 'batch_norm': False, 'lr': 9.686740903993926e-05, 'weight_decay': 1.7107358143201206e-07, 'epochs': 243, 'loss': 'mse', 'optimizer': 'adam', 'graph_mode': 'knn', 'knn_k': 8, 'weighted_edges': True, 'symmetrize_mode': 'union', 'self_loops': False, 'use_snp_selection': True, 'num_snps': 31053}. Best is trial 73 with value: 0.3738911700451141.
[I 2025-12-08 21:11:42,615] Trial 82 finished with value: 0.36520572383965116 and parameters: {'model_type': 'gcn', 'hidden_dims': '[128, 64]', 'dropout': 0.4947774709373405, 'batch_norm': False, 'lr': 5.236023431585291e-05, 'weight_decay': 2.3251153802368193e-07, 'epochs': 272, 'loss': 'mse', 'optimizer': 'adam', 'graph_mode': 'knn', 'knn_k': 6, 'weighted_edges': True, 'symmetrize_mode': 'union', 'self_loops': False, 'use_snp_selection': True, 'num_snps': 40173}. Best is trial 73 with value: 0.3738911700451141.
[I 2025-12-08 21:12:05,136] Trial 83 finished with value: 0.3605859160220203 and parameters: {'model_type': 'gcn', 'hidden_dims': '[128, 64]', 'dropout': 0.5156926101614552, 'batch_norm': False, 'lr': 0.00013267227176016238, 'weight_decay': 1.226777782729658e-07, 'epochs': 231, 'loss': 'mse', 'optimizer': 'adam', 'graph_mode': 'knn', 'knn_k': 8, 'weighted_edges': True, 'symmetrize_mode': 'union', 'self_loops': False, 'use_snp_selection': True, 'num_snps': 32281}. Best is trial 73 with value: 0.3738911700451141.
