Running from this directory: /cluster/work/simennes/Project_thesis/Project_thesis
Name of job: gcn_w
ID of job: 23696750
The job was run on these nodes: idun-06-05
[I 2025-12-08 10:18:13,949] Trial 0 finished with value: 0.24946327775817595 and parameters: {'model_type': 'gcn', 'hidden_dims': '[128, 64]', 'dropout': 0.199031432379812, 'batch_norm': True, 'lr': 1.8408544111075823e-05, 'weight_decay': 5.5136510071208614e-05, 'epochs': 336, 'loss': 'mae', 'optimizer': 'adam', 'graph_mode': 'knn', 'knn_k': 8, 'weighted_edges': True, 'symmetrize_mode': 'mutual', 'self_loops': True, 'use_snp_selection': True, 'num_snps': 27173}. Best is trial 0 with value: 0.24946327775817595.
[I 2025-12-08 10:18:52,741] Trial 1 finished with value: 0.21481123282371062 and parameters: {'model_type': 'gcn', 'hidden_dims': '[256, 128, 64]', 'dropout': 0.5543244404043342, 'batch_norm': True, 'lr': 7.981787657617978e-05, 'weight_decay': 2.8571789869344834e-07, 'epochs': 297, 'loss': 'mae', 'optimizer': 'adam', 'graph_mode': 'cutoff', 'cutoff': 0.3392632777751686, 'grm_norm': 'gcn', 'self_loops': False, 'use_snp_selection': False}. Best is trial 0 with value: 0.24946327775817595.
[I 2025-12-08 10:19:50,941] Trial 2 finished with value: 0.2003058239981624 and parameters: {'model_type': 'gcn', 'hidden_dims': '[512, 64]', 'dropout': 0.32815227354739207, 'batch_norm': True, 'lr': 0.000619605044204259, 'weight_decay': 0.0004086269831625786, 'epochs': 206, 'loss': 'mse', 'optimizer': 'adam', 'graph_mode': 'knn', 'knn_k': 4, 'weighted_edges': True, 'symmetrize_mode': 'union', 'self_loops': True, 'use_snp_selection': True, 'num_snps': 53035}. Best is trial 0 with value: 0.24946327775817595.
[I 2025-12-08 10:20:18,865] Trial 3 finished with value: 0.18243896754931216 and parameters: {'model_type': 'gcn', 'hidden_dims': '[256, 128]', 'dropout': 0.23110783056597514, 'batch_norm': True, 'lr': 8.11311593386298e-05, 'weight_decay': 9.296158109581328e-07, 'epochs': 213, 'loss': 'mse', 'optimizer': 'adam', 'graph_mode': 'knn', 'knn_k': 10, 'weighted_edges': True, 'symmetrize_mode': 'mutual', 'self_loops': True, 'use_snp_selection': False}. Best is trial 0 with value: 0.24946327775817595.
[I 2025-12-08 10:20:33,517] Trial 4 finished with value: 0.2988245679168323 and parameters: {'model_type': 'gcn', 'hidden_dims': '[512, 256]', 'dropout': 0.2753281956415665, 'batch_norm': True, 'lr': 0.00034435188114839693, 'weight_decay': 4.9416012835950194e-05, 'epochs': 89, 'loss': 'mae', 'optimizer': 'adam', 'graph_mode': 'cutoff', 'cutoff': 0.820078967317394, 'grm_norm': 'none', 'self_loops': False, 'use_snp_selection': True, 'num_snps': 12674}. Best is trial 4 with value: 0.2988245679168323.
[I 2025-12-08 10:20:58,860] Trial 5 finished with value: 0.2816530930727736 and parameters: {'model_type': 'gcn', 'hidden_dims': '[128, 64]', 'dropout': 0.5611163934517731, 'batch_norm': True, 'lr': 0.0003984856210762587, 'weight_decay': 1.1466743517565185e-07, 'epochs': 344, 'loss': 'mae', 'optimizer': 'adam', 'graph_mode': 'cutoff', 'cutoff': 0.6089370799714728, 'grm_norm': 'gcn', 'self_loops': True, 'use_snp_selection': False}. Best is trial 4 with value: 0.2988245679168323.
[I 2025-12-08 10:21:21,607] Trial 6 finished with value: 0.27718742888167813 and parameters: {'model_type': 'gcn', 'hidden_dims': '[128, 64]', 'dropout': 0.31805912766941713, 'batch_norm': True, 'lr': 1.2361026034262557e-05, 'weight_decay': 6.492620232791903e-06, 'epochs': 271, 'loss': 'mse', 'optimizer': 'adam', 'graph_mode': 'cutoff', 'cutoff': 0.6193362582230448, 'grm_norm': 'cosine', 'self_loops': False, 'use_snp_selection': True, 'num_snps': 28594}. Best is trial 4 with value: 0.2988245679168323.
[I 2025-12-08 10:21:41,723] Trial 7 finished with value: 0.25633040515089067 and parameters: {'model_type': 'gcn', 'hidden_dims': '[512, 64]', 'dropout': 0.471337288649717, 'batch_norm': True, 'lr': 2.239693207292708e-05, 'weight_decay': 2.263166635514082e-06, 'epochs': 69, 'loss': 'mse', 'optimizer': 'adam', 'graph_mode': 'cutoff', 'cutoff': 0.4056820886426376, 'grm_norm': 'cosine', 'self_loops': False, 'use_snp_selection': False}. Best is trial 4 with value: 0.2988245679168323.
[I 2025-12-08 10:22:19,491] Trial 8 finished with value: 0.27265483145184044 and parameters: {'model_type': 'gcn', 'hidden_dims': '[512, 256]', 'dropout': 0.20659328268932406, 'batch_norm': False, 'lr': 8.93315124361372e-05, 'weight_decay': 0.00028987480727919035, 'epochs': 136, 'loss': 'mae', 'optimizer': 'adam', 'graph_mode': 'knn', 'knn_k': 3, 'weighted_edges': False, 'symmetrize_mode': 'union', 'self_loops': False, 'use_snp_selection': True, 'num_snps': 43128}. Best is trial 4 with value: 0.2988245679168323.
[I 2025-12-08 10:23:01,999] Trial 9 finished with value: -0.028069557111423827 and parameters: {'model_type': 'gcn', 'hidden_dims': '[512, 256]', 'dropout': 0.2888209592870401, 'batch_norm': False, 'lr': 0.004734648143129892, 'weight_decay': 1.5879705591356368e-06, 'epochs': 163, 'loss': 'mse', 'optimizer': 'adam', 'graph_mode': 'cutoff', 'cutoff': 0.5984899797909019, 'grm_norm': 'cosine', 'self_loops': True, 'use_snp_selection': False}. Best is trial 4 with value: 0.2988245679168323.
[I 2025-12-08 10:23:11,237] Trial 10 finished with value: 0.2600340583168173 and parameters: {'model_type': 'gcn', 'hidden_dims': '[512, 128]', 'dropout': 0.11372025982957354, 'batch_norm': False, 'lr': 0.0023343012062770553, 'weight_decay': 4.14440562940608e-05, 'epochs': 41, 'loss': 'mae', 'optimizer': 'adam', 'graph_mode': 'cutoff', 'cutoff': 0.8740100033033124, 'grm_norm': 'none', 'self_loops': False, 'use_snp_selection': True, 'num_snps': 3859}. Best is trial 4 with value: 0.2988245679168323.
[I 2025-12-08 10:23:20,858] Trial 11 finished with value: 0.30293961144384285 and parameters: {'model_type': 'gcn', 'hidden_dims': '[128, 64]', 'dropout': 0.44863014119095845, 'batch_norm': True, 'lr': 0.0005943392021247852, 'weight_decay': 1.0655358607693621e-07, 'epochs': 110, 'loss': 'mae', 'optimizer': 'adam', 'graph_mode': 'cutoff', 'cutoff': 0.8568899271933978, 'grm_norm': 'cosine_then_gcn', 'self_loops': True, 'use_snp_selection': False}. Best is trial 11 with value: 0.30293961144384285.
[I 2025-12-08 10:23:33,022] Trial 12 finished with value: 0.2881030845170616 and parameters: {'model_type': 'gcn', 'hidden_dims': '[512, 256]', 'dropout': 0.42758862319180935, 'batch_norm': True, 'lr': 0.0012059085553112938, 'weight_decay': 3.482253699955131e-05, 'epochs': 103, 'loss': 'mae', 'optimizer': 'adam', 'graph_mode': 'cutoff', 'cutoff': 0.8919050080438428, 'grm_norm': 'cosine_then_gcn', 'self_loops': True, 'use_snp_selection': True, 'num_snps': 6176}. Best is trial 11 with value: 0.30293961144384285.
[I 2025-12-08 10:23:46,692] Trial 13 finished with value: 0.30467797752890124 and parameters: {'model_type': 'gcn', 'hidden_dims': '[256, 128]', 'dropout': 0.4452783958423849, 'batch_norm': True, 'lr': 0.00028764898471530923, 'weight_decay': 8.746795324277564e-06, 'epochs': 96, 'loss': 'mae', 'optimizer': 'adam', 'graph_mode': 'cutoff', 'cutoff': 0.7596101551526167, 'grm_norm': 'cosine_then_gcn', 'self_loops': False, 'use_snp_selection': False}. Best is trial 13 with value: 0.30467797752890124.
[I 2025-12-08 10:24:04,688] Trial 14 finished with value: 0.0 and parameters: {'model_type': 'gcn', 'hidden_dims': '[256, 128]', 'dropout': 0.4280653677930823, 'batch_norm': False, 'lr': 0.009430566714901507, 'weight_decay': 7.081154721639774e-06, 'epochs': 135, 'loss': 'mae', 'optimizer': 'adam', 'graph_mode': 'cutoff', 'cutoff': 0.7240625816402448, 'grm_norm': 'cosine_then_gcn', 'self_loops': True, 'use_snp_selection': False}. Best is trial 13 with value: 0.30467797752890124.
[I 2025-12-08 10:24:27,116] Trial 15 finished with value: 0.30001864551977614 and parameters: {'model_type': 'gcn', 'hidden_dims': '[256, 128]', 'dropout': 0.4827864904294467, 'batch_norm': True, 'lr': 0.000166827860779801, 'weight_decay': 4.104169171058631e-07, 'epochs': 172, 'loss': 'mae', 'optimizer': 'adam', 'graph_mode': 'cutoff', 'cutoff': 0.7416328481826706, 'grm_norm': 'cosine_then_gcn', 'self_loops': False, 'use_snp_selection': False}. Best is trial 13 with value: 0.30467797752890124.
[I 2025-12-08 10:25:00,321] Trial 16 finished with value: 0.30041925518579593 and parameters: {'model_type': 'gcn', 'hidden_dims': '[512, 128]', 'dropout': 0.3897927192620549, 'batch_norm': True, 'lr': 0.0013348907345225615, 'weight_decay': 1.3390115129704958e-07, 'epochs': 124, 'loss': 'mae', 'optimizer': 'adam', 'graph_mode': 'cutoff', 'cutoff': 0.741530364546869, 'grm_norm': 'cosine_then_gcn', 'self_loops': False, 'use_snp_selection': False}. Best is trial 13 with value: 0.30467797752890124.
[I 2025-12-08 10:25:08,639] Trial 17 finished with value: 0.25564139727491686 and parameters: {'model_type': 'gcn', 'hidden_dims': '[256, 128, 64]', 'dropout': 0.509435148660207, 'batch_norm': True, 'lr': 0.00018048831166245086, 'weight_decay': 0.00013973832650383044, 'epochs': 47, 'loss': 'mae', 'optimizer': 'adam', 'graph_mode': 'cutoff', 'cutoff': 0.4666500253747494, 'grm_norm': 'cosine_then_gcn', 'self_loops': True, 'use_snp_selection': False}. Best is trial 13 with value: 0.30467797752890124.
[I 2025-12-08 10:25:21,730] Trial 18 finished with value: 0.0 and parameters: {'model_type': 'gcn', 'hidden_dims': '[256, 128]', 'dropout': 0.5946862229490071, 'batch_norm': False, 'lr': 0.0007987282715004888, 'weight_decay': 3.622597276255499e-06, 'epochs': 89, 'loss': 'mae', 'optimizer': 'adam', 'graph_mode': 'knn', 'knn_k': 1, 'weighted_edges': False, 'symmetrize_mode': 'mutual', 'self_loops': False, 'use_snp_selection': False}. Best is trial 13 with value: 0.30467797752890124.
[I 2025-12-08 10:25:40,892] Trial 19 finished with value: 0.23989044155568373 and parameters: {'model_type': 'gcn', 'hidden_dims': '[128, 64]', 'dropout': 0.3835074020505049, 'batch_norm': True, 'lr': 0.00239594391463314, 'weight_decay': 1.5520423292998144e-05, 'epochs': 245, 'loss': 'mae', 'optimizer': 'adam', 'graph_mode': 'cutoff', 'cutoff': 0.25019712285855694, 'grm_norm': 'cosine_then_gcn', 'self_loops': True, 'use_snp_selection': False}. Best is trial 13 with value: 0.30467797752890124.
[I 2025-12-08 10:25:54,254] Trial 20 finished with value: 0.2916910767459469 and parameters: {'model_type': 'gcn', 'hidden_dims': '[128, 64]', 'dropout': 0.43104250243416836, 'batch_norm': True, 'lr': 0.00018355895633342717, 'weight_decay': 0.0009506528840190462, 'epochs': 165, 'loss': 'mae', 'optimizer': 'adam', 'graph_mode': 'cutoff', 'cutoff': 0.7944796083093779, 'grm_norm': 'cosine_then_gcn', 'self_loops': True, 'use_snp_selection': False}. Best is trial 13 with value: 0.30467797752890124.
[I 2025-12-08 10:26:25,101] Trial 21 finished with value: 0.30534514857383976 and parameters: {'model_type': 'gcn', 'hidden_dims': '[512, 128]', 'dropout': 0.368956354678059, 'batch_norm': True, 'lr': 0.001428956778083991, 'weight_decay': 1.1184311207850229e-07, 'epochs': 114, 'loss': 'mae', 'optimizer': 'adam', 'graph_mode': 'cutoff', 'cutoff': 0.6964089659179565, 'grm_norm': 'cosine_then_gcn', 'self_loops': False, 'use_snp_selection': False}. Best is trial 21 with value: 0.30534514857383976.
[I 2025-12-08 10:26:57,714] Trial 22 finished with value: 0.3019489764044534 and parameters: {'model_type': 'gcn', 'hidden_dims': '[512, 128]', 'dropout': 0.3764117164333534, 'batch_norm': True, 'lr': 0.0007425104855411437, 'weight_decay': 4.882502518934866e-07, 'epochs': 121, 'loss': 'mae', 'optimizer': 'adam', 'graph_mode': 'cutoff', 'cutoff': 0.6767847665226142, 'grm_norm': 'cosine_then_gcn', 'self_loops': False, 'use_snp_selection': False}. Best is trial 21 with value: 0.30534514857383976.
[I 2025-12-08 10:27:17,953] Trial 23 finished with value: 0.30401758290695785 and parameters: {'model_type': 'gcn', 'hidden_dims': '[512, 128]', 'dropout': 0.5103852425521513, 'batch_norm': True, 'lr': 0.002389152582266095, 'weight_decay': 2.173927890241602e-07, 'epochs': 70, 'loss': 'mae', 'optimizer': 'adam', 'graph_mode': 'cutoff', 'cutoff': 0.8159781481223454, 'grm_norm': 'cosine_then_gcn', 'self_loops': False, 'use_snp_selection': False}. Best is trial 21 with value: 0.30534514857383976.
[I 2025-12-08 10:27:38,565] Trial 24 finished with value: 0.28194089539898365 and parameters: {'model_type': 'gcn', 'hidden_dims': '[512, 128]', 'dropout': 0.532567851638772, 'batch_norm': True, 'lr': 0.005464042748502702, 'weight_decay': 2.42675360379176e-07, 'epochs': 71, 'loss': 'mae', 'optimizer': 'adam', 'graph_mode': 'cutoff', 'cutoff': 0.5150295327833323, 'grm_norm': 'cosine_then_gcn', 'self_loops': False, 'use_snp_selection': False}. Best is trial 21 with value: 0.30534514857383976.
[I 2025-12-08 10:27:57,437] Trial 25 finished with value: 0.303446174545764 and parameters: {'model_type': 'gcn', 'hidden_dims': '[512, 128]', 'dropout': 0.5078808164832684, 'batch_norm': True, 'lr': 0.0020111672604325678, 'weight_decay': 7.501771516674005e-07, 'epochs': 65, 'loss': 'mae', 'optimizer': 'adam', 'graph_mode': 'cutoff', 'cutoff': 0.7915465509137563, 'grm_norm': 'none', 'self_loops': False, 'use_snp_selection': False}. Best is trial 21 with value: 0.30534514857383976.
[I 2025-12-08 10:28:38,884] Trial 26 finished with value: 0.029991903397918344 and parameters: {'model_type': 'gcn', 'hidden_dims': '[512, 128]', 'dropout': 0.36753798325537773, 'batch_norm': False, 'lr': 0.004329572582029612, 'weight_decay': 1.3929802787024955e-05, 'epochs': 155, 'loss': 'mse', 'optimizer': 'adam', 'graph_mode': 'knn', 'knn_k': 6, 'weighted_edges': False, 'symmetrize_mode': 'union', 'self_loops': False, 'use_snp_selection': False}. Best is trial 21 with value: 0.30534514857383976.
[I 2025-12-08 10:29:03,078] Trial 27 finished with value: 0.29985544065945074 and parameters: {'model_type': 'gcn', 'hidden_dims': '[512, 128]', 'dropout': 0.472166656266068, 'batch_norm': True, 'lr': 0.0013563161537861496, 'weight_decay': 1.0826478187895006e-06, 'epochs': 87, 'loss': 'mae', 'optimizer': 'adam', 'graph_mode': 'cutoff', 'cutoff': 0.6730482286500563, 'grm_norm': 'gcn', 'self_loops': False, 'use_snp_selection': False}. Best is trial 21 with value: 0.30534514857383976.
[I 2025-12-08 10:29:26,705] Trial 28 finished with value: 0.28013765625940623 and parameters: {'model_type': 'gcn', 'hidden_dims': '[256, 128]', 'dropout': 0.40760875974414756, 'batch_norm': True, 'lr': 4.446294938689993e-05, 'weight_decay': 2.564903757326095e-07, 'epochs': 182, 'loss': 'mae', 'optimizer': 'adam', 'graph_mode': 'cutoff', 'cutoff': 0.6820034956787767, 'grm_norm': 'cosine_then_gcn', 'self_loops': False, 'use_snp_selection': False}. Best is trial 21 with value: 0.30534514857383976.
[I 2025-12-08 10:30:05,668] Trial 29 finished with value: 0.23596062076104066 and parameters: {'model_type': 'gcn', 'hidden_dims': '[512, 128]', 'dropout': 0.34913891308123446, 'batch_norm': True, 'lr': 0.009766388472779565, 'weight_decay': 4.041330211185174e-06, 'epochs': 144, 'loss': 'mae', 'optimizer': 'adam', 'graph_mode': 'knn', 'knn_k': 10, 'weighted_edges': False, 'symmetrize_mode': 'mutual', 'self_loops': False, 'use_snp_selection': False}. Best is trial 21 with value: 0.30534514857383976.
[I 2025-12-08 10:30:15,187] Trial 30 finished with value: 0.3069101685762659 and parameters: {'model_type': 'gcn', 'hidden_dims': '[256, 128, 64]', 'dropout': 0.502389898170692, 'batch_norm': True, 'lr': 0.0029818963396102856, 'weight_decay': 1.8324261012722518e-07, 'epochs': 56, 'loss': 'mae', 'optimizer': 'adam', 'graph_mode': 'cutoff', 'cutoff': 0.7683877654451163, 'grm_norm': 'cosine_then_gcn', 'self_loops': False, 'use_snp_selection': False}. Best is trial 30 with value: 0.3069101685762659.
[I 2025-12-08 10:30:24,359] Trial 31 finished with value: 0.3052304639608591 and parameters: {'model_type': 'gcn', 'hidden_dims': '[256, 128, 64]', 'dropout': 0.5090153367376424, 'batch_norm': True, 'lr': 0.0034098163998748897, 'weight_decay': 1.8246321891509552e-07, 'epochs': 55, 'loss': 'mae', 'optimizer': 'adam', 'graph_mode': 'cutoff', 'cutoff': 0.8003347899031956, 'grm_norm': 'cosine_then_gcn', 'self_loops': False, 'use_snp_selection': False}. Best is trial 30 with value: 0.3069101685762659.
[I 2025-12-08 10:30:33,290] Trial 32 finished with value: 0.3082230841041575 and parameters: {'model_type': 'gcn', 'hidden_dims': '[256, 128, 64]', 'dropout': 0.5893660105800396, 'batch_norm': True, 'lr': 0.003513322926757591, 'weight_decay': 4.819983218495638e-07, 'epochs': 52, 'loss': 'mae', 'optimizer': 'adam', 'graph_mode': 'cutoff', 'cutoff': 0.7488840740330607, 'grm_norm': 'cosine_then_gcn', 'self_loops': False, 'use_snp_selection': False}. Best is trial 32 with value: 0.3082230841041575.
[I 2025-12-08 10:30:40,727] Trial 33 finished with value: 0.30610360761808936 and parameters: {'model_type': 'gcn', 'hidden_dims': '[256, 128, 64]', 'dropout': 0.5871566062976477, 'batch_norm': True, 'lr': 0.0036848291619293607, 'weight_decay': 5.073800458164694e-07, 'epochs': 40, 'loss': 'mae', 'optimizer': 'adam', 'graph_mode': 'cutoff', 'cutoff': 0.7006385715270912, 'grm_norm': 'cosine_then_gcn', 'self_loops': False, 'use_snp_selection': False}. Best is trial 32 with value: 0.3082230841041575.
[I 2025-12-08 10:30:48,631] Trial 34 finished with value: 0.305399158855521 and parameters: {'model_type': 'gcn', 'hidden_dims': '[256, 128, 64]', 'dropout': 0.5972778170456521, 'batch_norm': True, 'lr': 0.005702290899772992, 'weight_decay': 4.61150960596121e-07, 'epochs': 44, 'loss': 'mae', 'optimizer': 'adam', 'graph_mode': 'cutoff', 'cutoff': 0.6560010468967623, 'grm_norm': 'cosine_then_gcn', 'self_loops': False, 'use_snp_selection': False}. Best is trial 32 with value: 0.3082230841041575.
[I 2025-12-08 10:30:56,388] Trial 35 finished with value: 0.23955260171623002 and parameters: {'model_type': 'gcn', 'hidden_dims': '[256, 128, 64]', 'dropout': 0.5959554743383672, 'batch_norm': True, 'lr': 0.00563198049136508, 'weight_decay': 5.374304146728071e-07, 'epochs': 42, 'loss': 'mse', 'optimizer': 'adam', 'graph_mode': 'knn', 'knn_k': 1, 'weighted_edges': True, 'symmetrize_mode': 'union', 'self_loops': False, 'use_snp_selection': False}. Best is trial 32 with value: 0.3082230841041575.
[I 2025-12-08 10:31:23,177] Trial 36 finished with value: 0.2935181146526427 and parameters: {'model_type': 'gcn', 'hidden_dims': '[256, 128, 64]', 'dropout': 0.5619338830997946, 'batch_norm': True, 'lr': 0.007769355516748119, 'weight_decay': 1.4281561792632084e-06, 'epochs': 79, 'loss': 'mae', 'optimizer': 'adam', 'graph_mode': 'cutoff', 'cutoff': 0.5430876265735347, 'grm_norm': 'cosine_then_gcn', 'self_loops': False, 'use_snp_selection': True, 'num_snps': 55695}. Best is trial 32 with value: 0.3082230841041575.
[I 2025-12-08 10:31:33,119] Trial 37 finished with value: 0.3028982081206837 and parameters: {'model_type': 'gcn', 'hidden_dims': '[256, 128, 64]', 'dropout': 0.5820306996743478, 'batch_norm': True, 'lr': 0.0036290952615825388, 'weight_decay': 4.214225008289949e-07, 'epochs': 61, 'loss': 'mae', 'optimizer': 'adam', 'graph_mode': 'cutoff', 'cutoff': 0.6374448180896439, 'grm_norm': 'cosine_then_gcn', 'self_loops': False, 'use_snp_selection': False}. Best is trial 32 with value: 0.3082230841041575.
[I 2025-12-08 10:31:42,048] Trial 38 finished with value: 0.29589467698997823 and parameters: {'model_type': 'gcn', 'hidden_dims': '[256, 128, 64]', 'dropout': 0.5469009566174133, 'batch_norm': True, 'lr': 0.006995947727298268, 'weight_decay': 8.28936409284714e-07, 'epochs': 52, 'loss': 'mse', 'optimizer': 'adam', 'graph_mode': 'cutoff', 'cutoff': 0.6420900075049388, 'grm_norm': 'gcn', 'self_loops': False, 'use_snp_selection': False}. Best is trial 32 with value: 0.3082230841041575.
[I 2025-12-08 10:32:21,151] Trial 39 finished with value: 0.23894153310838256 and parameters: {'model_type': 'gcn', 'hidden_dims': '[256, 128, 64]', 'dropout': 0.5696203306841175, 'batch_norm': True, 'lr': 0.003129119675720738, 'weight_decay': 2.2393021930386824e-06, 'epochs': 297, 'loss': 'mae', 'optimizer': 'adam', 'graph_mode': 'knn', 'knn_k': 7, 'weighted_edges': True, 'symmetrize_mode': 'mutual', 'self_loops': False, 'use_snp_selection': True, 'num_snps': 37740}. Best is trial 32 with value: 0.3082230841041575.
[I 2025-12-08 10:32:52,725] Trial 40 finished with value: 0.018633216421355042 and parameters: {'model_type': 'gcn', 'hidden_dims': '[256, 128, 64]', 'dropout': 0.5349233995882666, 'batch_norm': False, 'lr': 0.001807216320857183, 'weight_decay': 3.338763390597622e-07, 'epochs': 244, 'loss': 'mse', 'optimizer': 'adam', 'graph_mode': 'cutoff', 'cutoff': 0.5857173845751251, 'grm_norm': 'cosine', 'self_loops': False, 'use_snp_selection': False}. Best is trial 32 with value: 0.3082230841041575.
[I 2025-12-08 10:33:22,288] Trial 41 finished with value: 0.2978444163354358 and parameters: {'model_type': 'gcn', 'hidden_dims': '[512, 64]', 'dropout': 0.5714304899976572, 'batch_norm': True, 'lr': 0.00105508246934006, 'weight_decay': 1.6729658797854072e-07, 'epochs': 109, 'loss': 'mae', 'optimizer': 'adam', 'graph_mode': 'cutoff', 'cutoff': 0.7005921893338801, 'grm_norm': 'cosine_then_gcn', 'self_loops': False, 'use_snp_selection': False}. Best is trial 32 with value: 0.3082230841041575.
[I 2025-12-08 10:33:34,471] Trial 42 finished with value: 0.303491430916494 and parameters: {'model_type': 'gcn', 'hidden_dims': '[256, 128, 64]', 'dropout': 0.2501270943422687, 'batch_norm': True, 'lr': 0.0029158235342911184, 'weight_decay': 6.305470677657624e-07, 'epochs': 80, 'loss': 'mae', 'optimizer': 'adam', 'graph_mode': 'cutoff', 'cutoff': 0.7647389997332449, 'grm_norm': 'cosine_then_gcn', 'self_loops': False, 'use_snp_selection': False}. Best is trial 32 with value: 0.3082230841041575.
