[I 2025-12-08 15:08:31,333] Trial 133 finished with value: 0.2798149664452224 and parameters: {'model_type': 'gcn', 'hidden_dims': '[512, 128]', 'dropout': 0.4958058304156685, 'batch_norm': True, 'lr': 3.9417724151563345e-05, 'weight_decay': 0.0007115457297978978, 'epochs': 53, 'loss': 'mae', 'optimizer': 'adam', 'graph_mode': 'cutoff', 'cutoff': 0.6867517354473104, 'grm_norm': 'cosine_then_gcn', 'self_loops': False, 'use_snp_selection': True, 'num_snps': 41343}. Best is trial 121 with value: 0.29229824666895454.
[I 2025-12-08 15:08:53,679] Trial 134 finished with value: 0.2700372564691348 and parameters: {'model_type': 'gcn', 'hidden_dims': '[512, 128]', 'dropout': 0.5213663599726055, 'batch_norm': True, 'lr': 1.823475902929631e-05, 'weight_decay': 0.0003813666790534715, 'epochs': 80, 'loss': 'mse', 'optimizer': 'adam', 'graph_mode': 'cutoff', 'cutoff': 0.7311270206022965, 'grm_norm': 'cosine_then_gcn', 'self_loops': False, 'use_snp_selection': False}. Best is trial 121 with value: 0.29229824666895454.
[I 2025-12-08 15:09:14,155] Trial 135 finished with value: 0.267933151085597 and parameters: {'model_type': 'gcn', 'hidden_dims': '[512, 256]', 'dropout': 0.5744445421548675, 'batch_norm': True, 'lr': 4.684175793934581e-05, 'weight_decay': 0.0005004084770464377, 'epochs': 65, 'loss': 'mae', 'optimizer': 'adam', 'graph_mode': 'cutoff', 'cutoff': 0.75954143410061, 'grm_norm': 'gcn', 'self_loops': False, 'use_snp_selection': True, 'num_snps': 29850}. Best is trial 121 with value: 0.29229824666895454.
[I 2025-12-08 15:09:36,138] Trial 136 finished with value: 0.2678247609816535 and parameters: {'model_type': 'gcn', 'hidden_dims': '[512, 128]', 'dropout': 0.48297922633584595, 'batch_norm': True, 'lr': 0.0003549617107094014, 'weight_decay': 0.0008321156202789074, 'epochs': 56, 'loss': 'mae', 'optimizer': 'adam', 'graph_mode': 'knn', 'knn_k': 8, 'weighted_edges': True, 'symmetrize_mode': 'mutual', 'self_loops': True, 'use_snp_selection': True, 'num_snps': 35383}. Best is trial 121 with value: 0.29229824666895454.
[I 2025-12-08 15:09:55,651] Trial 137 finished with value: 0.2589909528468938 and parameters: {'model_type': 'gcn', 'hidden_dims': '[512, 256]', 'dropout': 0.5066508284427481, 'batch_norm': True, 'lr': 5.975093749676761e-05, 'weight_decay': 0.0006542056254255814, 'epochs': 68, 'loss': 'mse', 'optimizer': 'adam', 'graph_mode': 'cutoff', 'cutoff': 0.6171542058991567, 'grm_norm': 'cosine_then_gcn', 'self_loops': False, 'use_snp_selection': False}. Best is trial 121 with value: 0.29229824666895454.
[I 2025-12-08 15:10:16,096] Trial 138 finished with value: 0.2790706447517604 and parameters: {'model_type': 'gcn', 'hidden_dims': '[512, 128]', 'dropout': 0.5295386707093698, 'batch_norm': True, 'lr': 7.801512157559938e-05, 'weight_decay': 0.0003063486172115544, 'epochs': 76, 'loss': 'mae', 'optimizer': 'adam', 'graph_mode': 'cutoff', 'cutoff': 0.7757295776484078, 'grm_norm': 'cosine_then_gcn', 'self_loops': False, 'use_snp_selection': True, 'num_snps': 26543}. Best is trial 121 with value: 0.29229824666895454.
[I 2025-12-08 15:10:42,565] Trial 139 finished with value: 0.2516586343455839 and parameters: {'model_type': 'gcn', 'hidden_dims': '[512, 64]', 'dropout': 0.5580288518092547, 'batch_norm': True, 'lr': 5.020007284456955e-05, 'weight_decay': 0.0005869740512709749, 'epochs': 86, 'loss': 'mae', 'optimizer': 'adam', 'graph_mode': 'cutoff', 'cutoff': 0.6469555130531727, 'grm_norm': 'cosine_then_gcn', 'self_loops': False, 'use_snp_selection': True, 'num_snps': 37077}. Best is trial 121 with value: 0.29229824666895454.
[I 2025-12-08 15:10:57,181] Trial 140 finished with value: 0.13223554145112187 and parameters: {'model_type': 'gcn', 'hidden_dims': '[512, 256]', 'dropout': 0.5861345034436741, 'batch_norm': False, 'lr': 3.357427294136075e-05, 'weight_decay': 0.0004397720673169535, 'epochs': 48, 'loss': 'mse', 'optimizer': 'adam', 'graph_mode': 'cutoff', 'cutoff': 0.6979622203477933, 'grm_norm': 'cosine_then_gcn', 'self_loops': True, 'use_snp_selection': False}. Best is trial 121 with value: 0.29229824666895454.
[I 2025-12-08 15:11:15,915] Trial 141 finished with value: 0.2631297180423775 and parameters: {'model_type': 'gcn', 'hidden_dims': '[512, 128]', 'dropout': 0.5442019693353739, 'batch_norm': True, 'lr': 6.002953001512696e-05, 'weight_decay': 0.0007059427940108895, 'epochs': 40, 'loss': 'mae', 'optimizer': 'adam', 'graph_mode': 'cutoff', 'cutoff': 0.6340391454035437, 'grm_norm': 'cosine', 'self_loops': False, 'use_snp_selection': True, 'num_snps': 32890}. Best is trial 121 with value: 0.29229824666895454.
[I 2025-12-08 15:11:35,469] Trial 142 finished with value: 0.26671291695133414 and parameters: {'model_type': 'gcn', 'hidden_dims': '[512, 128]', 'dropout': 0.5514506448846451, 'batch_norm': True, 'lr': 4.029763966513501e-05, 'weight_decay': 0.0005985445902289793, 'epochs': 44, 'loss': 'mae', 'optimizer': 'adam', 'graph_mode': 'cutoff', 'cutoff': 0.5945588184248469, 'grm_norm': 'cosine', 'self_loops': False, 'use_snp_selection': True, 'num_snps': 34082}. Best is trial 121 with value: 0.29229824666895454.
[I 2025-12-08 15:11:56,183] Trial 143 finished with value: 0.26605654127861783 and parameters: {'model_type': 'gcn', 'hidden_dims': '[512, 128]', 'dropout': 0.10042182040355443, 'batch_norm': True, 'lr': 5.520513300028102e-05, 'weight_decay': 0.0008387178658950444, 'epochs': 61, 'loss': 'mae', 'optimizer': 'adam', 'graph_mode': 'cutoff', 'cutoff': 0.6323421384672759, 'grm_norm': 'cosine', 'self_loops': False, 'use_snp_selection': True, 'num_snps': 31309}. Best is trial 121 with value: 0.29229824666895454.
[I 2025-12-08 15:12:15,048] Trial 144 finished with value: 0.26855439930553027 and parameters: {'model_type': 'gcn', 'hidden_dims': '[512, 128]', 'dropout': 0.5162745776858091, 'batch_norm': True, 'lr': 4.576393749168364e-05, 'weight_decay': 0.0009875033898708843, 'epochs': 53, 'loss': 'mae', 'optimizer': 'adam', 'graph_mode': 'cutoff', 'cutoff': 0.6774842533379022, 'grm_norm': 'cosine', 'self_loops': False, 'use_snp_selection': True, 'num_snps': 28921}. Best is trial 121 with value: 0.29229824666895454.
[I 2025-12-08 15:12:30,216] Trial 145 finished with value: 0.250148382248679 and parameters: {'model_type': 'gcn', 'hidden_dims': '[256, 128]', 'dropout': 0.5674508995777318, 'batch_norm': True, 'lr': 2.7835454567947764e-05, 'weight_decay': 0.0005147504443053419, 'epochs': 65, 'loss': 'mae', 'optimizer': 'adam', 'graph_mode': 'cutoff', 'cutoff': 0.7181154945115352, 'grm_norm': 'cosine', 'self_loops': False, 'use_snp_selection': True, 'num_snps': 23931}. Best is trial 121 with value: 0.29229824666895454.
[I 2025-12-08 15:12:51,563] Trial 146 finished with value: 0.26252425440972604 and parameters: {'model_type': 'gcn', 'hidden_dims': '[512, 128]', 'dropout': 0.5414105627185288, 'batch_norm': True, 'lr': 3.659706812966996e-05, 'weight_decay': 0.0006702485316799477, 'epochs': 45, 'loss': 'mae', 'optimizer': 'adam', 'graph_mode': 'knn', 'knn_k': 9, 'weighted_edges': False, 'symmetrize_mode': 'mutual', 'self_loops': False, 'use_snp_selection': True, 'num_snps': 37978}. Best is trial 121 with value: 0.29229824666895454.
[I 2025-12-08 15:13:13,642] Trial 147 finished with value: 0.28336144559523596 and parameters: {'model_type': 'gcn', 'hidden_dims': '[512, 256]', 'dropout': 0.5005516610582078, 'batch_norm': True, 'lr': 5.5410905663338615e-05, 'weight_decay': 0.0008025063674825192, 'epochs': 58, 'loss': 'mae', 'optimizer': 'adam', 'graph_mode': 'cutoff', 'cutoff': 0.661423118466825, 'grm_norm': 'cosine_then_gcn', 'self_loops': False, 'use_snp_selection': True, 'num_snps': 35808}. Best is trial 121 with value: 0.29229824666895454.
[I 2025-12-08 15:13:33,865] Trial 148 finished with value: 0.2517274865805973 and parameters: {'model_type': 'gcn', 'hidden_dims': '[512, 256]', 'dropout': 0.4935057796074407, 'batch_norm': True, 'lr': 0.006090772589388572, 'weight_decay': 0.0008309517808750514, 'epochs': 71, 'loss': 'mse', 'optimizer': 'adam', 'graph_mode': 'cutoff', 'cutoff': 0.660926253172537, 'grm_norm': 'cosine_then_gcn', 'self_loops': False, 'use_snp_selection': False}. Best is trial 121 with value: 0.29229824666895454.
[I 2025-12-08 15:13:57,102] Trial 149 finished with value: 0.276957517015056 and parameters: {'model_type': 'gcn', 'hidden_dims': '[512, 256]', 'dropout': 0.4749877975930098, 'batch_norm': True, 'lr': 4.328154706442357e-05, 'weight_decay': 0.0003606273227889803, 'epochs': 57, 'loss': 'mae', 'optimizer': 'adam', 'graph_mode': 'cutoff', 'cutoff': 0.736551299127818, 'grm_norm': 'cosine_then_gcn', 'self_loops': False, 'use_snp_selection': True, 'num_snps': 39555}. Best is trial 121 with value: 0.29229824666895454.
[I 2025-12-08 15:14:26,887] Trial 0 finished with value: 0.24027701169275453 and parameters: {'model_type': 'gcn', 'hidden_dims': '[128, 64]', 'dropout': 0.199031432379812, 'batch_norm': True, 'lr': 1.8408544111075823e-05, 'weight_decay': 5.5136510071208614e-05, 'epochs': 336, 'loss': 'mae', 'optimizer': 'adam', 'graph_mode': 'knn', 'knn_k': 8, 'weighted_edges': True, 'symmetrize_mode': 'mutual', 'self_loops': True, 'use_snp_selection': True, 'num_snps': 27173}. Best is trial 0 with value: 0.24027701169275453.
[I 2025-12-08 15:15:05,209] Trial 1 finished with value: 0.21242375394962973 and parameters: {'model_type': 'gcn', 'hidden_dims': '[256, 128, 64]', 'dropout': 0.5543244404043342, 'batch_norm': True, 'lr': 7.981787657617978e-05, 'weight_decay': 2.8571789869344834e-07, 'epochs': 297, 'loss': 'mae', 'optimizer': 'adam', 'graph_mode': 'cutoff', 'cutoff': 0.3392632777751686, 'grm_norm': 'gcn', 'self_loops': False, 'use_snp_selection': False}. Best is trial 0 with value: 0.24027701169275453.
[I 2025-12-08 15:16:03,301] Trial 2 finished with value: 0.1996733255297964 and parameters: {'model_type': 'gcn', 'hidden_dims': '[512, 64]', 'dropout': 0.32815227354739207, 'batch_norm': True, 'lr': 0.000619605044204259, 'weight_decay': 0.0004086269831625786, 'epochs': 206, 'loss': 'mse', 'optimizer': 'adam', 'graph_mode': 'knn', 'knn_k': 4, 'weighted_edges': True, 'symmetrize_mode': 'union', 'self_loops': True, 'use_snp_selection': True, 'num_snps': 53035}. Best is trial 0 with value: 0.24027701169275453.
[I 2025-12-08 15:16:30,861] Trial 3 finished with value: 0.2055812399313366 and parameters: {'model_type': 'gcn', 'hidden_dims': '[256, 128]', 'dropout': 0.23110783056597514, 'batch_norm': True, 'lr': 8.11311593386298e-05, 'weight_decay': 9.296158109581328e-07, 'epochs': 213, 'loss': 'mse', 'optimizer': 'adam', 'graph_mode': 'knn', 'knn_k': 10, 'weighted_edges': True, 'symmetrize_mode': 'mutual', 'self_loops': True, 'use_snp_selection': False}. Best is trial 0 with value: 0.24027701169275453.
[I 2025-12-08 15:16:45,444] Trial 4 finished with value: 0.2891770893281805 and parameters: {'model_type': 'gcn', 'hidden_dims': '[512, 256]', 'dropout': 0.2753281956415665, 'batch_norm': True, 'lr': 0.00034435188114839693, 'weight_decay': 4.9416012835950194e-05, 'epochs': 89, 'loss': 'mae', 'optimizer': 'adam', 'graph_mode': 'cutoff', 'cutoff': 0.820078967317394, 'grm_norm': 'none', 'self_loops': False, 'use_snp_selection': True, 'num_snps': 12674}. Best is trial 4 with value: 0.2891770893281805.
[I 2025-12-08 15:17:10,442] Trial 5 finished with value: 0.27693890363872675 and parameters: {'model_type': 'gcn', 'hidden_dims': '[128, 64]', 'dropout': 0.5611163934517731, 'batch_norm': True, 'lr': 0.0003984856210762587, 'weight_decay': 1.1466743517565185e-07, 'epochs': 344, 'loss': 'mae', 'optimizer': 'adam', 'graph_mode': 'cutoff', 'cutoff': 0.6089370799714728, 'grm_norm': 'gcn', 'self_loops': True, 'use_snp_selection': False}. Best is trial 4 with value: 0.2891770893281805.
[I 2025-12-08 15:17:32,906] Trial 6 finished with value: 0.2595252056734331 and parameters: {'model_type': 'gcn', 'hidden_dims': '[128, 64]', 'dropout': 0.31805912766941713, 'batch_norm': True, 'lr': 1.2361026034262557e-05, 'weight_decay': 6.492620232791903e-06, 'epochs': 271, 'loss': 'mse', 'optimizer': 'adam', 'graph_mode': 'cutoff', 'cutoff': 0.6193362582230448, 'grm_norm': 'cosine', 'self_loops': False, 'use_snp_selection': True, 'num_snps': 28594}. Best is trial 4 with value: 0.2891770893281805.
[I 2025-12-08 15:17:52,729] Trial 7 finished with value: 0.23487764425040664 and parameters: {'model_type': 'gcn', 'hidden_dims': '[512, 64]', 'dropout': 0.471337288649717, 'batch_norm': True, 'lr': 2.239693207292708e-05, 'weight_decay': 2.263166635514082e-06, 'epochs': 69, 'loss': 'mse', 'optimizer': 'adam', 'graph_mode': 'cutoff', 'cutoff': 0.4056820886426376, 'grm_norm': 'cosine', 'self_loops': False, 'use_snp_selection': False}. Best is trial 4 with value: 0.2891770893281805.
[I 2025-12-08 15:18:30,432] Trial 8 finished with value: 0.2652328852660456 and parameters: {'model_type': 'gcn', 'hidden_dims': '[512, 256]', 'dropout': 0.20659328268932406, 'batch_norm': False, 'lr': 8.93315124361372e-05, 'weight_decay': 0.00028987480727919035, 'epochs': 136, 'loss': 'mae', 'optimizer': 'adam', 'graph_mode': 'knn', 'knn_k': 3, 'weighted_edges': False, 'symmetrize_mode': 'union', 'self_loops': False, 'use_snp_selection': True, 'num_snps': 43128}. Best is trial 4 with value: 0.2891770893281805.
[I 2025-12-08 15:19:12,649] Trial 9 finished with value: -0.013016065741638976 and parameters: {'model_type': 'gcn', 'hidden_dims': '[512, 256]', 'dropout': 0.2888209592870401, 'batch_norm': False, 'lr': 0.004734648143129892, 'weight_decay': 1.5879705591356368e-06, 'epochs': 163, 'loss': 'mse', 'optimizer': 'adam', 'graph_mode': 'cutoff', 'cutoff': 0.5984899797909019, 'grm_norm': 'cosine', 'self_loops': True, 'use_snp_selection': False}. Best is trial 4 with value: 0.2891770893281805.
[I 2025-12-08 15:19:21,756] Trial 10 finished with value: 0.25356028003344955 and parameters: {'model_type': 'gcn', 'hidden_dims': '[512, 128]', 'dropout': 0.11372025982957354, 'batch_norm': False, 'lr': 0.0023343012062770553, 'weight_decay': 4.14440562940608e-05, 'epochs': 41, 'loss': 'mae', 'optimizer': 'adam', 'graph_mode': 'cutoff', 'cutoff': 0.8740100033033124, 'grm_norm': 'none', 'self_loops': False, 'use_snp_selection': True, 'num_snps': 3859}. Best is trial 4 with value: 0.2891770893281805.
[I 2025-12-08 15:19:31,110] Trial 11 finished with value: 0.2947348986328392 and parameters: {'model_type': 'gcn', 'hidden_dims': '[128, 64]', 'dropout': 0.44863014119095845, 'batch_norm': True, 'lr': 0.0005943392021247852, 'weight_decay': 1.0655358607693621e-07, 'epochs': 110, 'loss': 'mae', 'optimizer': 'adam', 'graph_mode': 'cutoff', 'cutoff': 0.8568899271933978, 'grm_norm': 'cosine_then_gcn', 'self_loops': True, 'use_snp_selection': False}. Best is trial 11 with value: 0.2947348986328392.
[I 2025-12-08 15:19:43,174] Trial 12 finished with value: 0.2701897036390763 and parameters: {'model_type': 'gcn', 'hidden_dims': '[512, 256]', 'dropout': 0.42758862319180935, 'batch_norm': True, 'lr': 0.0012059085553112938, 'weight_decay': 3.482253699955131e-05, 'epochs': 103, 'loss': 'mae', 'optimizer': 'adam', 'graph_mode': 'cutoff', 'cutoff': 0.8919050080438428, 'grm_norm': 'cosine_then_gcn', 'self_loops': True, 'use_snp_selection': True, 'num_snps': 6176}. Best is trial 11 with value: 0.2947348986328392.
[I 2025-12-08 15:19:56,561] Trial 13 finished with value: 0.2909723387267388 and parameters: {'model_type': 'gcn', 'hidden_dims': '[256, 128]', 'dropout': 0.4452783958423849, 'batch_norm': True, 'lr': 0.00028764898471530923, 'weight_decay': 8.746795324277564e-06, 'epochs': 96, 'loss': 'mae', 'optimizer': 'adam', 'graph_mode': 'cutoff', 'cutoff': 0.7596101551526167, 'grm_norm': 'cosine_then_gcn', 'self_loops': False, 'use_snp_selection': False}. Best is trial 11 with value: 0.2947348986328392.
[I 2025-12-08 15:20:14,305] Trial 14 finished with value: 0.01120558438083467 and parameters: {'model_type': 'gcn', 'hidden_dims': '[256, 128]', 'dropout': 0.4280653677930823, 'batch_norm': False, 'lr': 0.009430566714901507, 'weight_decay': 7.081154721639774e-06, 'epochs': 135, 'loss': 'mae', 'optimizer': 'adam', 'graph_mode': 'cutoff', 'cutoff': 0.7240625816402448, 'grm_norm': 'cosine_then_gcn', 'self_loops': True, 'use_snp_selection': False}. Best is trial 11 with value: 0.2947348986328392.
[I 2025-12-08 15:20:36,441] Trial 15 finished with value: 0.27898810439302446 and parameters: {'model_type': 'gcn', 'hidden_dims': '[256, 128]', 'dropout': 0.4827864904294467, 'batch_norm': True, 'lr': 0.000166827860779801, 'weight_decay': 4.104169171058631e-07, 'epochs': 172, 'loss': 'mae', 'optimizer': 'adam', 'graph_mode': 'cutoff', 'cutoff': 0.7416328481826706, 'grm_norm': 'cosine_then_gcn', 'self_loops': False, 'use_snp_selection': False}. Best is trial 11 with value: 0.2947348986328392.
[I 2025-12-08 15:21:09,350] Trial 16 finished with value: 0.291288542677818 and parameters: {'model_type': 'gcn', 'hidden_dims': '[512, 128]', 'dropout': 0.3897927192620549, 'batch_norm': True, 'lr': 0.0013348907345225615, 'weight_decay': 1.3390115129704958e-07, 'epochs': 124, 'loss': 'mae', 'optimizer': 'adam', 'graph_mode': 'cutoff', 'cutoff': 0.741530364546869, 'grm_norm': 'cosine_then_gcn', 'self_loops': False, 'use_snp_selection': False}. Best is trial 11 with value: 0.2947348986328392.
[I 2025-12-08 15:22:12,352] Trial 17 finished with value: 0.23781090744271913 and parameters: {'model_type': 'gcn', 'hidden_dims': '[512, 128]', 'dropout': 0.38972932269140576, 'batch_norm': True, 'lr': 0.0011971268912287492, 'weight_decay': 1.0543952758275948e-07, 'epochs': 247, 'loss': 'mae', 'optimizer': 'adam', 'graph_mode': 'cutoff', 'cutoff': 0.4783946474822031, 'grm_norm': 'cosine_then_gcn', 'self_loops': True, 'use_snp_selection': False}. Best is trial 11 with value: 0.2947348986328392.
[I 2025-12-08 15:22:46,669] Trial 18 finished with value: 0.057391801861483974 and parameters: {'model_type': 'gcn', 'hidden_dims': '[512, 128]', 'dropout': 0.3736416722245185, 'batch_norm': False, 'lr': 0.0021029989821283067, 'weight_decay': 4.6872079487991683e-07, 'epochs': 130, 'loss': 'mae', 'optimizer': 'adam', 'graph_mode': 'knn', 'knn_k': 1, 'weighted_edges': False, 'symmetrize_mode': 'mutual', 'self_loops': False, 'use_snp_selection': False}. Best is trial 11 with value: 0.2947348986328392.
[I 2025-12-08 15:22:54,461] Trial 19 finished with value: 0.25052458808733913 and parameters: {'model_type': 'gcn', 'hidden_dims': '[256, 128, 64]', 'dropout': 0.5187603909737242, 'batch_norm': True, 'lr': 0.0009037872462634691, 'weight_decay': 2.0439181326924044e-07, 'epochs': 44, 'loss': 'mae', 'optimizer': 'adam', 'graph_mode': 'cutoff', 'cutoff': 0.25019712285855694, 'grm_norm': 'cosine_then_gcn', 'self_loops': True, 'use_snp_selection': False}. Best is trial 11 with value: 0.2947348986328392.
[I 2025-12-08 15:23:08,074] Trial 20 finished with value: 0.2837149659206141 and parameters: {'model_type': 'gcn', 'hidden_dims': '[128, 64]', 'dropout': 0.5941819326771511, 'batch_norm': True, 'lr': 0.0035918041162755956, 'weight_decay': 8.768281135366405e-07, 'epochs': 173, 'loss': 'mae', 'optimizer': 'adam', 'graph_mode': 'cutoff', 'cutoff': 0.6886465084954161, 'grm_norm': 'cosine_then_gcn', 'self_loops': True, 'use_snp_selection': False}. Best is trial 11 with value: 0.2947348986328392.
[I 2025-12-08 15:23:22,376] Trial 21 finished with value: 0.2872572226146141 and parameters: {'model_type': 'gcn', 'hidden_dims': '[256, 128]', 'dropout': 0.42577498040171435, 'batch_norm': True, 'lr': 0.00017079409553859328, 'weight_decay': 3.115700387357272e-06, 'epochs': 104, 'loss': 'mae', 'optimizer': 'adam', 'graph_mode': 'cutoff', 'cutoff': 0.7723037998128993, 'grm_norm': 'cosine_then_gcn', 'self_loops': False, 'use_snp_selection': False}. Best is trial 11 with value: 0.2947348986328392.
[I 2025-12-08 15:23:43,494] Trial 22 finished with value: 0.2939703271878898 and parameters: {'model_type': 'gcn', 'hidden_dims': '[512, 128]', 'dropout': 0.4738723588455617, 'batch_norm': True, 'lr': 0.00019703282942117959, 'weight_decay': 0.0001726075684594226, 'epochs': 75, 'loss': 'mae', 'optimizer': 'adam', 'graph_mode': 'cutoff', 'cutoff': 0.7901587766826845, 'grm_norm': 'cosine_then_gcn', 'self_loops': False, 'use_snp_selection': False}. Best is trial 11 with value: 0.2947348986328392.
[I 2025-12-08 15:24:03,413] Trial 23 finished with value: 0.2997949033109354 and parameters: {'model_type': 'gcn', 'hidden_dims': '[512, 128]', 'dropout': 0.5069694724007943, 'batch_norm': True, 'lr': 0.0005797428794132816, 'weight_decay': 0.00019999472357949162, 'epochs': 70, 'loss': 'mae', 'optimizer': 'adam', 'graph_mode': 'cutoff', 'cutoff': 0.8335203922595524, 'grm_norm': 'cosine_then_gcn', 'self_loops': False, 'use_snp_selection': False}. Best is trial 23 with value: 0.2997949033109354.
[I 2025-12-08 15:24:22,367] Trial 24 finished with value: 0.29310020359161776 and parameters: {'model_type': 'gcn', 'hidden_dims': '[512, 128]', 'dropout': 0.4923838081828843, 'batch_norm': True, 'lr': 0.0004906726162185601, 'weight_decay': 0.00014950473252395725, 'epochs': 66, 'loss': 'mae', 'optimizer': 'adam', 'graph_mode': 'cutoff', 'cutoff': 0.8399510020935778, 'grm_norm': 'cosine_then_gcn', 'self_loops': False, 'use_snp_selection': False}. Best is trial 23 with value: 0.2997949033109354.
[I 2025-12-08 15:24:42,589] Trial 25 finished with value: 0.2731958938026461 and parameters: {'model_type': 'gcn', 'hidden_dims': '[512, 128]', 'dropout': 0.5185759265310296, 'batch_norm': True, 'lr': 0.00022607085933371794, 'weight_decay': 9.99053886306663e-05, 'epochs': 72, 'loss': 'mae', 'optimizer': 'adam', 'graph_mode': 'cutoff', 'cutoff': 0.8990938998180498, 'grm_norm': 'none', 'self_loops': False, 'use_snp_selection': False}. Best is trial 23 with value: 0.2997949033109354.
