[I 2025-12-08 16:37:37,719] Trial 132 finished with value: 0.31220710196198426 and parameters: {'model_type': 'gcn', 'hidden_dims': '[512, 64]', 'dropout': 0.14287186502798457, 'batch_norm': True, 'lr': 0.0002186262929270516, 'weight_decay': 7.067279973302872e-05, 'epochs': 165, 'loss': 'mae', 'optimizer': 'adam', 'graph_mode': 'cutoff', 'cutoff': 0.8214003868721316, 'grm_norm': 'cosine', 'self_loops': False, 'use_snp_selection': True, 'num_snps': 42703}. Best is trial 21 with value: 0.3153339696847911.
[I 2025-12-08 16:38:22,265] Trial 133 finished with value: 0.30698166887477435 and parameters: {'model_type': 'gcn', 'hidden_dims': '[512, 64]', 'dropout': 0.13512078806012884, 'batch_norm': True, 'lr': 0.00022006333495744944, 'weight_decay': 6.89032572236349e-05, 'epochs': 174, 'loss': 'mae', 'optimizer': 'adam', 'graph_mode': 'cutoff', 'cutoff': 0.8101612759359473, 'grm_norm': 'cosine', 'self_loops': False, 'use_snp_selection': True, 'num_snps': 42280}. Best is trial 21 with value: 0.3153339696847911.
[I 2025-12-08 16:39:06,873] Trial 134 finished with value: 0.3162509929377426 and parameters: {'model_type': 'gcn', 'hidden_dims': '[512, 64]', 'dropout': 0.2149966383818279, 'batch_norm': True, 'lr': 0.00028714592820692857, 'weight_decay': 4.654058477157167e-05, 'epochs': 167, 'loss': 'mae', 'optimizer': 'adam', 'graph_mode': 'cutoff', 'cutoff': 0.837459697486938, 'grm_norm': 'cosine', 'self_loops': False, 'use_snp_selection': True, 'num_snps': 44117}. Best is trial 134 with value: 0.3162509929377426.
[I 2025-12-08 16:39:50,645] Trial 135 finished with value: 0.31411054624237955 and parameters: {'model_type': 'gcn', 'hidden_dims': '[512, 64]', 'dropout': 0.2131296279665273, 'batch_norm': True, 'lr': 0.0002864551951501123, 'weight_decay': 5.1515829928661084e-05, 'epochs': 161, 'loss': 'mae', 'optimizer': 'adam', 'graph_mode': 'cutoff', 'cutoff': 0.8420169403531456, 'grm_norm': 'cosine', 'self_loops': False, 'use_snp_selection': True, 'num_snps': 44792}. Best is trial 134 with value: 0.3162509929377426.
[I 2025-12-08 16:40:35,415] Trial 136 finished with value: 0.30588743990314815 and parameters: {'model_type': 'gcn', 'hidden_dims': '[512, 64]', 'dropout': 0.20907606924834368, 'batch_norm': True, 'lr': 0.0003216268983244069, 'weight_decay': 5.2446668992226374e-05, 'epochs': 165, 'loss': 'mae', 'optimizer': 'adam', 'graph_mode': 'cutoff', 'cutoff': 0.8424251408697118, 'grm_norm': 'cosine', 'self_loops': False, 'use_snp_selection': True, 'num_snps': 45184}. Best is trial 134 with value: 0.3162509929377426.
[I 2025-12-08 16:41:14,093] Trial 137 finished with value: 0.23598239800524437 and parameters: {'model_type': 'gcn', 'hidden_dims': '[512, 64]', 'dropout': 0.1856592290866138, 'batch_norm': False, 'lr': 0.0002676536139531285, 'weight_decay': 3.8830944794226875e-05, 'epochs': 146, 'loss': 'mae', 'optimizer': 'adam', 'graph_mode': 'cutoff', 'cutoff': 0.7848713608241802, 'grm_norm': 'cosine', 'self_loops': False, 'use_snp_selection': True, 'num_snps': 41056}. Best is trial 134 with value: 0.3162509929377426.
[I 2025-12-08 16:42:00,350] Trial 138 finished with value: 0.3003888356622745 and parameters: {'model_type': 'gcn', 'hidden_dims': '[512, 64]', 'dropout': 0.2398886592954818, 'batch_norm': True, 'lr': 0.00037138384875709193, 'weight_decay': 8.140208436375217e-05, 'epochs': 180, 'loss': 'mae', 'optimizer': 'adam', 'graph_mode': 'cutoff', 'cutoff': 0.8235724839836343, 'grm_norm': 'cosine', 'self_loops': False, 'use_snp_selection': True, 'num_snps': 43669}. Best is trial 134 with value: 0.3162509929377426.
[I 2025-12-08 16:42:40,677] Trial 139 finished with value: 0.30492269951823003 and parameters: {'model_type': 'gcn', 'hidden_dims': '[512, 64]', 'dropout': 0.13940853252817617, 'batch_norm': True, 'lr': 0.0001568578586576505, 'weight_decay': 4.530013270656323e-05, 'epochs': 126, 'loss': 'mae', 'optimizer': 'adam', 'graph_mode': 'cutoff', 'cutoff': 0.725770627180378, 'grm_norm': 'cosine', 'self_loops': False, 'use_snp_selection': True, 'num_snps': 48934}. Best is trial 134 with value: 0.3162509929377426.
[I 2025-12-08 16:43:25,560] Trial 140 finished with value: 0.31371284744994365 and parameters: {'model_type': 'gcn', 'hidden_dims': '[512, 64]', 'dropout': 0.17619277119752427, 'batch_norm': True, 'lr': 0.0001946874216375676, 'weight_decay': 6.248991546409275e-05, 'epochs': 162, 'loss': 'mae', 'optimizer': 'adam', 'graph_mode': 'cutoff', 'cutoff': 0.768586705529158, 'grm_norm': 'cosine', 'self_loops': False, 'use_snp_selection': True, 'num_snps': 45839}. Best is trial 134 with value: 0.3162509929377426.
[I 2025-12-08 16:44:40,559] Trial 141 finished with value: 0.31226304742437544 and parameters: {'model_type': 'gcn', 'hidden_dims': '[512, 64]', 'dropout': 0.171279117656414, 'batch_norm': True, 'lr': 0.00020040664061086625, 'weight_decay': 6.458754294077186e-05, 'epochs': 339, 'loss': 'mae', 'optimizer': 'adam', 'graph_mode': 'cutoff', 'cutoff': 0.7707010914105482, 'grm_norm': 'cosine', 'self_loops': False, 'use_snp_selection': True, 'num_snps': 46059}. Best is trial 134 with value: 0.3162509929377426.
[I 2025-12-08 16:45:56,251] Trial 142 finished with value: 0.3076800667806536 and parameters: {'model_type': 'gcn', 'hidden_dims': '[512, 64]', 'dropout': 0.17019863828189083, 'batch_norm': True, 'lr': 0.0002976775601554402, 'weight_decay': 3.4106467114431996e-05, 'epochs': 346, 'loss': 'mae', 'optimizer': 'adam', 'graph_mode': 'cutoff', 'cutoff': 0.7554793301858903, 'grm_norm': 'cosine', 'self_loops': False, 'use_snp_selection': True, 'num_snps': 45597}. Best is trial 134 with value: 0.3162509929377426.
[I 2025-12-08 16:46:42,341] Trial 143 finished with value: 0.2922385814279327 and parameters: {'model_type': 'gcn', 'hidden_dims': '[512, 64]', 'dropout': 0.1775077514647611, 'batch_norm': True, 'lr': 0.00020783521673909026, 'weight_decay': 0.0001026669631552151, 'epochs': 162, 'loss': 'mae', 'optimizer': 'adam', 'graph_mode': 'cutoff', 'cutoff': 0.8036284395784307, 'grm_norm': 'cosine', 'self_loops': False, 'use_snp_selection': True, 'num_snps': 47371}. Best is trial 134 with value: 0.3162509929377426.
[I 2025-12-08 16:47:27,468] Trial 144 finished with value: 0.30494085173499297 and parameters: {'model_type': 'gcn', 'hidden_dims': '[512, 64]', 'dropout': 0.1647548628347059, 'batch_norm': True, 'lr': 0.0002526028156032238, 'weight_decay': 6.275140173501695e-05, 'epochs': 171, 'loss': 'mae', 'optimizer': 'adam', 'graph_mode': 'cutoff', 'cutoff': 0.773254611630959, 'grm_norm': 'cosine', 'self_loops': False, 'use_snp_selection': True, 'num_snps': 43576}. Best is trial 134 with value: 0.3162509929377426.
[I 2025-12-08 16:48:45,986] Trial 145 finished with value: 0.3092122789107166 and parameters: {'model_type': 'gcn', 'hidden_dims': '[512, 64]', 'dropout': 0.19646909950146285, 'batch_norm': True, 'lr': 0.00018462855455565356, 'weight_decay': 9.369858193054887e-05, 'epochs': 324, 'loss': 'mae', 'optimizer': 'adam', 'graph_mode': 'cutoff', 'cutoff': 0.7463608456995277, 'grm_norm': 'cosine', 'self_loops': False, 'use_snp_selection': True, 'num_snps': 50975}. Best is trial 134 with value: 0.3162509929377426.
[I 2025-12-08 16:49:45,497] Trial 146 finished with value: 0.3071251720942978 and parameters: {'model_type': 'gcn', 'hidden_dims': '[512, 64]', 'dropout': 0.10782591664864861, 'batch_norm': True, 'lr': 0.00013239361098573853, 'weight_decay': 7.482523858689841e-05, 'epochs': 299, 'loss': 'mae', 'optimizer': 'adam', 'graph_mode': 'cutoff', 'cutoff': 0.790406813652727, 'grm_norm': 'cosine', 'self_loops': True, 'use_snp_selection': True, 'num_snps': 39353}. Best is trial 134 with value: 0.3162509929377426.
[I 2025-12-08 16:50:11,021] Trial 147 finished with value: 0.31088403316623253 and parameters: {'model_type': 'gcn', 'hidden_dims': '[512, 64]', 'dropout': 0.21435751490942193, 'batch_norm': True, 'lr': 0.00028796536687713387, 'weight_decay': 4.6132631116399346e-05, 'epochs': 56, 'loss': 'mae', 'optimizer': 'adam', 'graph_mode': 'cutoff', 'cutoff': 0.8294718012174136, 'grm_norm': 'cosine', 'self_loops': False, 'use_snp_selection': True, 'num_snps': 42287}. Best is trial 134 with value: 0.3162509929377426.
[I 2025-12-08 16:51:20,453] Trial 148 finished with value: 0.3014231967287941 and parameters: {'model_type': 'gcn', 'hidden_dims': '[512, 64]', 'dropout': 0.21768275325469208, 'batch_norm': True, 'lr': 0.0002897906581727111, 'weight_decay': 3.0362880220641172e-05, 'epochs': 331, 'loss': 'mae', 'optimizer': 'adam', 'graph_mode': 'cutoff', 'cutoff': 0.8387643922351553, 'grm_norm': 'cosine', 'self_loops': False, 'use_snp_selection': True, 'num_snps': 42835}. Best is trial 134 with value: 0.3162509929377426.
[I 2025-12-08 16:51:47,059] Trial 149 finished with value: 0.2969053542368325 and parameters: {'model_type': 'gcn', 'hidden_dims': '[512, 64]', 'dropout': 0.20847908047087416, 'batch_norm': True, 'lr': 0.0003901285391064875, 'weight_decay': 1.7819910110052178e-05, 'epochs': 54, 'loss': 'mae', 'optimizer': 'adam', 'graph_mode': 'cutoff', 'cutoff': 0.7043669770947325, 'grm_norm': 'cosine', 'self_loops': False, 'use_snp_selection': True, 'num_snps': 45632}. Best is trial 134 with value: 0.3162509929377426.
[I 2025-12-08 16:52:22,400] Trial 0 finished with value: 0.23697567979462203 and parameters: {'model_type': 'gcn', 'hidden_dims': '[128, 64]', 'dropout': 0.199031432379812, 'batch_norm': True, 'lr': 1.8408544111075823e-05, 'weight_decay': 5.5136510071208614e-05, 'epochs': 336, 'loss': 'mae', 'optimizer': 'adam', 'graph_mode': 'knn', 'knn_k': 8, 'weighted_edges': True, 'symmetrize_mode': 'mutual', 'self_loops': True, 'use_snp_selection': True, 'num_snps': 27173}. Best is trial 0 with value: 0.23697567979462203.
[I 2025-12-08 16:53:01,893] Trial 1 finished with value: 0.22342113696324845 and parameters: {'model_type': 'gcn', 'hidden_dims': '[256, 128, 64]', 'dropout': 0.5543244404043342, 'batch_norm': True, 'lr': 7.981787657617978e-05, 'weight_decay': 2.8571789869344834e-07, 'epochs': 297, 'loss': 'mae', 'optimizer': 'adam', 'graph_mode': 'cutoff', 'cutoff': 0.3392632777751686, 'grm_norm': 'gcn', 'self_loops': False, 'use_snp_selection': False}. Best is trial 0 with value: 0.23697567979462203.
[I 2025-12-08 16:54:01,600] Trial 2 finished with value: 0.20071329218234676 and parameters: {'model_type': 'gcn', 'hidden_dims': '[512, 64]', 'dropout': 0.32815227354739207, 'batch_norm': True, 'lr': 0.000619605044204259, 'weight_decay': 0.0004086269831625786, 'epochs': 206, 'loss': 'mse', 'optimizer': 'adam', 'graph_mode': 'knn', 'knn_k': 4, 'weighted_edges': True, 'symmetrize_mode': 'union', 'self_loops': True, 'use_snp_selection': True, 'num_snps': 53035}. Best is trial 0 with value: 0.23697567979462203.
[I 2025-12-08 16:54:30,360] Trial 3 finished with value: 0.2265738418676629 and parameters: {'model_type': 'gcn', 'hidden_dims': '[256, 128]', 'dropout': 0.23110783056597514, 'batch_norm': True, 'lr': 8.11311593386298e-05, 'weight_decay': 9.296158109581328e-07, 'epochs': 213, 'loss': 'mse', 'optimizer': 'adam', 'graph_mode': 'knn', 'knn_k': 10, 'weighted_edges': True, 'symmetrize_mode': 'mutual', 'self_loops': True, 'use_snp_selection': False}. Best is trial 0 with value: 0.23697567979462203.
[I 2025-12-08 16:54:45,690] Trial 4 finished with value: 0.3063165826886829 and parameters: {'model_type': 'gcn', 'hidden_dims': '[512, 256]', 'dropout': 0.2753281956415665, 'batch_norm': True, 'lr': 0.00034435188114839693, 'weight_decay': 4.9416012835950194e-05, 'epochs': 89, 'loss': 'mae', 'optimizer': 'adam', 'graph_mode': 'cutoff', 'cutoff': 0.820078967317394, 'grm_norm': 'none', 'self_loops': False, 'use_snp_selection': True, 'num_snps': 12674}. Best is trial 4 with value: 0.3063165826886829.
[I 2025-12-08 16:55:11,952] Trial 5 finished with value: 0.28787246043206627 and parameters: {'model_type': 'gcn', 'hidden_dims': '[128, 64]', 'dropout': 0.5611163934517731, 'batch_norm': True, 'lr': 0.0003984856210762587, 'weight_decay': 1.1466743517565185e-07, 'epochs': 344, 'loss': 'mae', 'optimizer': 'adam', 'graph_mode': 'cutoff', 'cutoff': 0.6089370799714728, 'grm_norm': 'gcn', 'self_loops': True, 'use_snp_selection': False}. Best is trial 4 with value: 0.3063165826886829.
[I 2025-12-08 16:55:35,665] Trial 6 finished with value: 0.2847796041422976 and parameters: {'model_type': 'gcn', 'hidden_dims': '[128, 64]', 'dropout': 0.31805912766941713, 'batch_norm': True, 'lr': 1.2361026034262557e-05, 'weight_decay': 6.492620232791903e-06, 'epochs': 271, 'loss': 'mse', 'optimizer': 'adam', 'graph_mode': 'cutoff', 'cutoff': 0.6193362582230448, 'grm_norm': 'cosine', 'self_loops': False, 'use_snp_selection': True, 'num_snps': 28594}. Best is trial 4 with value: 0.3063165826886829.
[I 2025-12-08 16:55:56,918] Trial 7 finished with value: 0.21478646493872797 and parameters: {'model_type': 'gcn', 'hidden_dims': '[512, 64]', 'dropout': 0.471337288649717, 'batch_norm': True, 'lr': 2.239693207292708e-05, 'weight_decay': 2.263166635514082e-06, 'epochs': 69, 'loss': 'mse', 'optimizer': 'adam', 'graph_mode': 'cutoff', 'cutoff': 0.4056820886426376, 'grm_norm': 'cosine', 'self_loops': False, 'use_snp_selection': False}. Best is trial 4 with value: 0.3063165826886829.
[I 2025-12-08 16:56:36,219] Trial 8 finished with value: 0.26359460551133085 and parameters: {'model_type': 'gcn', 'hidden_dims': '[512, 256]', 'dropout': 0.20659328268932406, 'batch_norm': False, 'lr': 8.93315124361372e-05, 'weight_decay': 0.00028987480727919035, 'epochs': 136, 'loss': 'mae', 'optimizer': 'adam', 'graph_mode': 'knn', 'knn_k': 3, 'weighted_edges': False, 'symmetrize_mode': 'union', 'self_loops': False, 'use_snp_selection': True, 'num_snps': 43128}. Best is trial 4 with value: 0.3063165826886829.
[I 2025-12-08 16:57:20,034] Trial 9 finished with value: 0.0023797070695308746 and parameters: {'model_type': 'gcn', 'hidden_dims': '[512, 256]', 'dropout': 0.2888209592870401, 'batch_norm': False, 'lr': 0.004734648143129892, 'weight_decay': 1.5879705591356368e-06, 'epochs': 163, 'loss': 'mse', 'optimizer': 'adam', 'graph_mode': 'cutoff', 'cutoff': 0.5984899797909019, 'grm_norm': 'cosine', 'self_loops': True, 'use_snp_selection': False}. Best is trial 4 with value: 0.3063165826886829.
[I 2025-12-08 16:57:29,663] Trial 10 finished with value: 0.26828388617926585 and parameters: {'model_type': 'gcn', 'hidden_dims': '[512, 128]', 'dropout': 0.11372025982957354, 'batch_norm': False, 'lr': 0.0023343012062770553, 'weight_decay': 4.14440562940608e-05, 'epochs': 41, 'loss': 'mae', 'optimizer': 'adam', 'graph_mode': 'cutoff', 'cutoff': 0.8740100033033124, 'grm_norm': 'none', 'self_loops': False, 'use_snp_selection': True, 'num_snps': 3859}. Best is trial 4 with value: 0.3063165826886829.
[I 2025-12-08 16:57:40,421] Trial 11 finished with value: 0.2949000651076232 and parameters: {'model_type': 'gcn', 'hidden_dims': '[128, 64]', 'dropout': 0.44863014119095845, 'batch_norm': True, 'lr': 0.0005943392021247852, 'weight_decay': 1.0655358607693621e-07, 'epochs': 110, 'loss': 'mae', 'optimizer': 'adam', 'graph_mode': 'cutoff', 'cutoff': 0.8568899271933978, 'grm_norm': 'cosine_then_gcn', 'self_loops': True, 'use_snp_selection': False}. Best is trial 4 with value: 0.3063165826886829.
[I 2025-12-08 16:57:53,343] Trial 12 finished with value: 0.2885798604133779 and parameters: {'model_type': 'gcn', 'hidden_dims': '[512, 256]', 'dropout': 0.42758862319180935, 'batch_norm': True, 'lr': 0.0012059085553112938, 'weight_decay': 3.482253699955131e-05, 'epochs': 103, 'loss': 'mae', 'optimizer': 'adam', 'graph_mode': 'cutoff', 'cutoff': 0.8919050080438428, 'grm_norm': 'cosine_then_gcn', 'self_loops': True, 'use_snp_selection': True, 'num_snps': 6176}. Best is trial 4 with value: 0.3063165826886829.
[I 2025-12-08 16:58:08,119] Trial 13 finished with value: 0.3003009195424732 and parameters: {'model_type': 'gcn', 'hidden_dims': '[256, 128]', 'dropout': 0.4452783958423849, 'batch_norm': True, 'lr': 0.00028764898471530923, 'weight_decay': 8.746795324277564e-06, 'epochs': 96, 'loss': 'mae', 'optimizer': 'adam', 'graph_mode': 'cutoff', 'cutoff': 0.7596101551526167, 'grm_norm': 'cosine_then_gcn', 'self_loops': False, 'use_snp_selection': False}. Best is trial 4 with value: 0.3063165826886829.
[I 2025-12-08 16:58:22,378] Trial 14 finished with value: 0.29523423848112507 and parameters: {'model_type': 'gcn', 'hidden_dims': '[256, 128]', 'dropout': 0.39299544085603144, 'batch_norm': False, 'lr': 0.00022405607028575474, 'weight_decay': 1.1320027041313357e-05, 'epochs': 80, 'loss': 'mae', 'optimizer': 'adam', 'graph_mode': 'cutoff', 'cutoff': 0.7531033351051849, 'grm_norm': 'none', 'self_loops': False, 'use_snp_selection': True, 'num_snps': 16639}. Best is trial 4 with value: 0.3063165826886829.
[I 2025-12-08 16:58:45,224] Trial 15 finished with value: 0.298926127908981 and parameters: {'model_type': 'gcn', 'hidden_dims': '[256, 128]', 'dropout': 0.49413637725410897, 'batch_norm': True, 'lr': 0.00018483836341752578, 'weight_decay': 0.0009750094345805517, 'epochs': 165, 'loss': 'mae', 'optimizer': 'adam', 'graph_mode': 'cutoff', 'cutoff': 0.7370325069980869, 'grm_norm': 'cosine_then_gcn', 'self_loops': False, 'use_snp_selection': False}. Best is trial 4 with value: 0.3063165826886829.
[I 2025-12-08 16:59:22,009] Trial 16 finished with value: 0.3062103940449823 and parameters: {'model_type': 'gcn', 'hidden_dims': '[512, 128]', 'dropout': 0.3867589196960127, 'batch_norm': True, 'lr': 0.0012603283321779282, 'weight_decay': 0.00012090388667123787, 'epochs': 135, 'loss': 'mae', 'optimizer': 'adam', 'graph_mode': 'cutoff', 'cutoff': 0.7493987499516714, 'grm_norm': 'none', 'self_loops': False, 'use_snp_selection': False}. Best is trial 4 with value: 0.3063165826886829.
[I 2025-12-08 16:59:44,550] Trial 17 finished with value: 0.25859068354913506 and parameters: {'model_type': 'gcn', 'hidden_dims': '[512, 128]', 'dropout': 0.37526706473388166, 'batch_norm': True, 'lr': 0.00760617054498344, 'weight_decay': 0.0001376010810530687, 'epochs': 143, 'loss': 'mae', 'optimizer': 'adam', 'graph_mode': 'cutoff', 'cutoff': 0.5062556644593699, 'grm_norm': 'none', 'self_loops': False, 'use_snp_selection': True, 'num_snps': 18293}. Best is trial 4 with value: 0.3063165826886829.
[I 2025-12-08 17:00:34,246] Trial 18 finished with value: 0.19412518546532745 and parameters: {'model_type': 'gcn', 'hidden_dims': '[512, 128]', 'dropout': 0.2478701895191911, 'batch_norm': False, 'lr': 0.0017043973328785833, 'weight_decay': 0.00010569729892231985, 'epochs': 243, 'loss': 'mae', 'optimizer': 'adam', 'graph_mode': 'knn', 'knn_k': 1, 'weighted_edges': False, 'symmetrize_mode': 'mutual', 'self_loops': False, 'use_snp_selection': True, 'num_snps': 37464}. Best is trial 4 with value: 0.3063165826886829.
[I 2025-12-08 17:00:45,338] Trial 19 finished with value: 0.2305609793755247 and parameters: {'model_type': 'gcn', 'hidden_dims': '[256, 128, 64]', 'dropout': 0.1422273950546733, 'batch_norm': True, 'lr': 0.0009698130370303778, 'weight_decay': 2.1338116255850742e-05, 'epochs': 62, 'loss': 'mae', 'optimizer': 'adam', 'graph_mode': 'cutoff', 'cutoff': 0.2219358891087448, 'grm_norm': 'none', 'self_loops': False, 'use_snp_selection': False}. Best is trial 4 with value: 0.3063165826886829.
[I 2025-12-08 17:01:20,399] Trial 20 finished with value: 0.29565998540752625 and parameters: {'model_type': 'gcn', 'hidden_dims': '[512, 256]', 'dropout': 0.3739699747118607, 'batch_norm': True, 'lr': 0.003920946775875325, 'weight_decay': 0.0001499560361104215, 'epochs': 129, 'loss': 'mae', 'optimizer': 'adam', 'graph_mode': 'cutoff', 'cutoff': 0.7033546788689287, 'grm_norm': 'none', 'self_loops': False, 'use_snp_selection': False}. Best is trial 4 with value: 0.3063165826886829.
[I 2025-12-08 17:01:35,066] Trial 21 finished with value: 0.3097702740749075 and parameters: {'model_type': 'gcn', 'hidden_dims': '[256, 128]', 'dropout': 0.27430478170210126, 'batch_norm': True, 'lr': 0.0001541418577792863, 'weight_decay': 6.613382114245445e-06, 'epochs': 98, 'loss': 'mae', 'optimizer': 'adam', 'graph_mode': 'cutoff', 'cutoff': 0.7939855828748571, 'grm_norm': 'cosine_then_gcn', 'self_loops': False, 'use_snp_selection': False}. Best is trial 21 with value: 0.3097702740749075.
[I 2025-12-08 17:02:21,664] Trial 22 finished with value: 0.3127836410194685 and parameters: {'model_type': 'gcn', 'hidden_dims': '[512, 128]', 'dropout': 0.26952931240786543, 'batch_norm': True, 'lr': 0.00013791437603644034, 'weight_decay': 4.316277343437136e-06, 'epochs': 178, 'loss': 'mae', 'optimizer': 'adam', 'graph_mode': 'cutoff', 'cutoff': 0.8055126776331679, 'grm_norm': 'none', 'self_loops': False, 'use_snp_selection': False}. Best is trial 22 with value: 0.3127836410194685.
[I 2025-12-08 17:03:08,793] Trial 23 finished with value: 0.3010099889126078 and parameters: {'model_type': 'gcn', 'hidden_dims': '[512, 256]', 'dropout': 0.2741569540402562, 'batch_norm': True, 'lr': 0.00013131508288559662, 'weight_decay': 3.258714301365984e-06, 'epochs': 179, 'loss': 'mae', 'optimizer': 'adam', 'graph_mode': 'cutoff', 'cutoff': 0.8206023084952957, 'grm_norm': 'none', 'self_loops': False, 'use_snp_selection': False}. Best is trial 22 with value: 0.3127836410194685.
[I 2025-12-08 17:03:17,737] Trial 24 finished with value: 0.29486574051759 and parameters: {'model_type': 'gcn', 'hidden_dims': '[256, 128]', 'dropout': 0.1866897045685078, 'batch_norm': True, 'lr': 3.8378471010451396e-05, 'weight_decay': 7.366926162520627e-07, 'epochs': 48, 'loss': 'mae', 'optimizer': 'adam', 'graph_mode': 'cutoff', 'cutoff': 0.8132294769402486, 'grm_norm': 'cosine_then_gcn', 'self_loops': False, 'use_snp_selection': False}. Best is trial 22 with value: 0.3127836410194685.
