[I 2025-12-08 14:22:38,689] Trial 23 finished with value: 0.3576522589130828 and parameters: {'model_type': 'gcn', 'hidden_dims': '[512, 256]', 'dropout': 0.3557319859649986, 'batch_norm': False, 'lr': 0.00023044144595281416, 'weight_decay': 3.90666642494886e-06, 'epochs': 65, 'loss': 'mae', 'optimizer': 'adam', 'graph_mode': 'cutoff', 'cutoff': 0.7444647125279281, 'grm_norm': 'cosine_then_gcn', 'self_loops': False, 'use_snp_selection': True, 'num_snps': 10516}. Best is trial 23 with value: 0.3576522589130828.
[I 2025-12-08 14:22:55,134] Trial 24 finished with value: 0.35705879782441935 and parameters: {'model_type': 'gcn', 'hidden_dims': '[512, 256]', 'dropout': 0.3682233245401061, 'batch_norm': False, 'lr': 0.00016760899639774754, 'weight_decay': 4.076075300932442e-06, 'epochs': 60, 'loss': 'mae', 'optimizer': 'adam', 'graph_mode': 'cutoff', 'cutoff': 0.7221944772335787, 'grm_norm': 'cosine_then_gcn', 'self_loops': False, 'use_snp_selection': True, 'num_snps': 21194}. Best is trial 23 with value: 0.3576522589130828.
[I 2025-12-08 14:23:12,138] Trial 25 finished with value: 0.33160766366659455 and parameters: {'model_type': 'gcn', 'hidden_dims': '[512, 128]', 'dropout': 0.37871600844588693, 'batch_norm': False, 'lr': 0.00017626331676064342, 'weight_decay': 3.56466325539028e-06, 'epochs': 66, 'loss': 'mae', 'optimizer': 'adam', 'graph_mode': 'cutoff', 'cutoff': 0.6773848313161432, 'grm_norm': 'cosine_then_gcn', 'self_loops': False, 'use_snp_selection': True, 'num_snps': 21668}. Best is trial 23 with value: 0.3576522589130828.
[I 2025-12-08 14:23:19,733] Trial 26 finished with value: 0.21460436767413232 and parameters: {'model_type': 'gcn', 'hidden_dims': '[256, 128, 64]', 'dropout': 0.483458308574255, 'batch_norm': False, 'lr': 3.184183822845939e-05, 'weight_decay': 7.026349024016814e-07, 'epochs': 44, 'loss': 'mse', 'optimizer': 'adam', 'graph_mode': 'cutoff', 'cutoff': 0.4940367267437375, 'grm_norm': 'cosine_then_gcn', 'self_loops': True, 'use_snp_selection': False}. Best is trial 23 with value: 0.3576522589130828.
[I 2025-12-08 14:23:37,953] Trial 27 finished with value: 0.3214619366853526 and parameters: {'model_type': 'gcn', 'hidden_dims': '[256, 128]', 'dropout': 0.4501984173336824, 'batch_norm': False, 'lr': 4.738896667427635e-05, 'weight_decay': 4.797601541642166e-06, 'epochs': 66, 'loss': 'mae', 'optimizer': 'adam', 'graph_mode': 'cutoff', 'cutoff': 0.7012083836212005, 'grm_norm': 'cosine_then_gcn', 'self_loops': False, 'use_snp_selection': True, 'num_snps': 35060}. Best is trial 23 with value: 0.3576522589130828.
[I 2025-12-08 14:23:59,548] Trial 28 finished with value: 0.35294198719045966 and parameters: {'model_type': 'gcn', 'hidden_dims': '[512, 64]', 'dropout': 0.32431673591824317, 'batch_norm': False, 'lr': 0.00017240916282046945, 'weight_decay': 2.553345467353784e-06, 'epochs': 150, 'loss': 'mae', 'optimizer': 'adam', 'graph_mode': 'cutoff', 'cutoff': 0.8139038451019864, 'grm_norm': 'cosine_then_gcn', 'self_loops': False, 'use_snp_selection': True, 'num_snps': 17906}. Best is trial 23 with value: 0.3576522589130828.
[I 2025-12-08 14:24:23,856] Trial 29 finished with value: 0.35629925070229423 and parameters: {'model_type': 'gcn', 'hidden_dims': '[512, 64]', 'dropout': 0.3428927837829086, 'batch_norm': False, 'lr': 4.8884135579294375e-05, 'weight_decay': 7.942795629714105e-07, 'epochs': 184, 'loss': 'mae', 'optimizer': 'adam', 'graph_mode': 'cutoff', 'cutoff': 0.8203585328969234, 'grm_norm': 'cosine_then_gcn', 'self_loops': True, 'use_snp_selection': True, 'num_snps': 18288}. Best is trial 23 with value: 0.3576522589130828.
[I 2025-12-08 14:24:53,898] Trial 30 finished with value: 0.3621334385605361 and parameters: {'model_type': 'gcn', 'hidden_dims': '[512, 64]', 'dropout': 0.5175531082892659, 'batch_norm': False, 'lr': 4.324653142445367e-05, 'weight_decay': 4.0791280698302834e-07, 'epochs': 185, 'loss': 'mae', 'optimizer': 'adam', 'graph_mode': 'cutoff', 'cutoff': 0.5342679168309392, 'grm_norm': 'cosine_then_gcn', 'self_loops': True, 'use_snp_selection': True, 'num_snps': 25195}. Best is trial 30 with value: 0.3621334385605361.
[I 2025-12-08 14:25:27,289] Trial 31 finished with value: 0.35936637849208786 and parameters: {'model_type': 'gcn', 'hidden_dims': '[512, 64]', 'dropout': 0.4988563107407209, 'batch_norm': False, 'lr': 4.326478043164744e-05, 'weight_decay': 3.371843830764538e-07, 'epochs': 240, 'loss': 'mae', 'optimizer': 'adam', 'graph_mode': 'cutoff', 'cutoff': 0.5179310274996628, 'grm_norm': 'cosine_then_gcn', 'self_loops': True, 'use_snp_selection': True, 'num_snps': 23017}. Best is trial 30 with value: 0.3621334385605361.
[I 2025-12-08 14:26:09,006] Trial 32 finished with value: 0.33752415630035576 and parameters: {'model_type': 'gcn', 'hidden_dims': '[512, 64]', 'dropout': 0.596471010412038, 'batch_norm': False, 'lr': 4.1875028836777355e-05, 'weight_decay': 2.846900562216183e-07, 'epochs': 299, 'loss': 'mae', 'optimizer': 'adam', 'graph_mode': 'cutoff', 'cutoff': 0.46232942211586037, 'grm_norm': 'cosine_then_gcn', 'self_loops': True, 'use_snp_selection': True, 'num_snps': 25399}. Best is trial 30 with value: 0.3621334385605361.
[I 2025-12-08 14:26:51,431] Trial 33 finished with value: 0.3562592135905941 and parameters: {'model_type': 'gcn', 'hidden_dims': '[512, 64]', 'dropout': 0.5100288814872523, 'batch_norm': False, 'lr': 1.0724867552248105e-05, 'weight_decay': 3.054425382587032e-07, 'epochs': 239, 'loss': 'mae', 'optimizer': 'adam', 'graph_mode': 'cutoff', 'cutoff': 0.5196305266852678, 'grm_norm': 'cosine_then_gcn', 'self_loops': True, 'use_snp_selection': True, 'num_snps': 32436}. Best is trial 30 with value: 0.3621334385605361.
[I 2025-12-08 14:28:09,686] Trial 34 finished with value: 0.36058610305065175 and parameters: {'model_type': 'gcn', 'hidden_dims': '[512, 64]', 'dropout': 0.5310269245122331, 'batch_norm': False, 'lr': 2.062669495027762e-05, 'weight_decay': 1.0034258887867075e-07, 'epochs': 313, 'loss': 'mae', 'optimizer': 'adam', 'graph_mode': 'cutoff', 'cutoff': 0.5615762497479193, 'grm_norm': 'cosine_then_gcn', 'self_loops': True, 'use_snp_selection': False}. Best is trial 30 with value: 0.3621334385605361.
[I 2025-12-08 14:29:25,818] Trial 35 finished with value: 0.34701668583463763 and parameters: {'model_type': 'gcn', 'hidden_dims': '[512, 64]', 'dropout': 0.5319823254510484, 'batch_norm': False, 'lr': 1.9769615331858228e-05, 'weight_decay': 1.0509786512826045e-07, 'epochs': 303, 'loss': 'mse', 'optimizer': 'adam', 'graph_mode': 'cutoff', 'cutoff': 0.42199376262777016, 'grm_norm': 'cosine_then_gcn', 'self_loops': True, 'use_snp_selection': False}. Best is trial 30 with value: 0.3621334385605361.
[I 2025-12-08 14:30:45,645] Trial 36 finished with value: 0.3574015386931316 and parameters: {'model_type': 'gcn', 'hidden_dims': '[512, 64]', 'dropout': 0.5877846509641144, 'batch_norm': False, 'lr': 7.360638754830901e-05, 'weight_decay': 2.200940495616997e-07, 'epochs': 321, 'loss': 'mae', 'optimizer': 'adam', 'graph_mode': 'cutoff', 'cutoff': 0.566887003544749, 'grm_norm': 'gcn', 'self_loops': True, 'use_snp_selection': False}. Best is trial 30 with value: 0.3621334385605361.
[I 2025-12-08 14:31:51,976] Trial 37 finished with value: 0.3653283038272238 and parameters: {'model_type': 'gcn', 'hidden_dims': '[512, 64]', 'dropout': 0.513127523666663, 'batch_norm': False, 'lr': 2.7108531684581506e-05, 'weight_decay': 4.2783155615701166e-07, 'epochs': 265, 'loss': 'mae', 'optimizer': 'adam', 'graph_mode': 'cutoff', 'cutoff': 0.6627324727191743, 'grm_norm': 'cosine_then_gcn', 'self_loops': True, 'use_snp_selection': False}. Best is trial 37 with value: 0.3653283038272238.
[I 2025-12-08 14:32:57,253] Trial 38 finished with value: 0.3539721382297023 and parameters: {'model_type': 'gcn', 'hidden_dims': '[512, 64]', 'dropout': 0.5551891468502822, 'batch_norm': False, 'lr': 2.1758046395241507e-05, 'weight_decay': 4.898448288916012e-07, 'epochs': 261, 'loss': 'mse', 'optimizer': 'adam', 'graph_mode': 'cutoff', 'cutoff': 0.6520846593556568, 'grm_norm': 'cosine_then_gcn', 'self_loops': True, 'use_snp_selection': False}. Best is trial 37 with value: 0.3653283038272238.
[I 2025-12-08 14:34:06,200] Trial 39 finished with value: 0.30077608283994367 and parameters: {'model_type': 'gcn', 'hidden_dims': '[512, 64]', 'dropout': 0.5176772810336195, 'batch_norm': True, 'lr': 1.4751310605799764e-05, 'weight_decay': 1.9218145558053036e-07, 'epochs': 274, 'loss': 'mae', 'optimizer': 'adam', 'graph_mode': 'cutoff', 'cutoff': 0.524249127459814, 'grm_norm': 'cosine_then_gcn', 'self_loops': True, 'use_snp_selection': False}. Best is trial 37 with value: 0.3653283038272238.
[I 2025-12-08 14:34:22,545] Trial 40 finished with value: 0.3429715484844399 and parameters: {'model_type': 'gcn', 'hidden_dims': '[128, 64]', 'dropout': 0.4775975065707754, 'batch_norm': False, 'lr': 2.4875754379219867e-05, 'weight_decay': 4.497370931731079e-07, 'epochs': 219, 'loss': 'mse', 'optimizer': 'adam', 'graph_mode': 'cutoff', 'cutoff': 0.34867958113183695, 'grm_norm': 'gcn', 'self_loops': True, 'use_snp_selection': False}. Best is trial 37 with value: 0.3653283038272238.
[I 2025-12-08 14:35:43,191] Trial 41 finished with value: 0.35268267483742566 and parameters: {'model_type': 'gcn', 'hidden_dims': '[512, 64]', 'dropout': 0.4977894475993483, 'batch_norm': False, 'lr': 3.444731025402742e-05, 'weight_decay': 1.3336712954602948e-06, 'epochs': 325, 'loss': 'mae', 'optimizer': 'adam', 'graph_mode': 'cutoff', 'cutoff': 0.6533822654252391, 'grm_norm': 'cosine_then_gcn', 'self_loops': True, 'use_snp_selection': False}. Best is trial 37 with value: 0.3653283038272238.
[I 2025-12-08 14:36:53,668] Trial 42 finished with value: 0.35342864654086603 and parameters: {'model_type': 'gcn', 'hidden_dims': '[512, 64]', 'dropout': 0.534099859176702, 'batch_norm': False, 'lr': 6.312717810123856e-05, 'weight_decay': 1.742155692676198e-07, 'epochs': 282, 'loss': 'mae', 'optimizer': 'adam', 'graph_mode': 'cutoff', 'cutoff': 0.5602947042626997, 'grm_norm': 'cosine_then_gcn', 'self_loops': True, 'use_snp_selection': False}. Best is trial 37 with value: 0.3653283038272238.
[I 2025-12-08 14:37:57,833] Trial 43 finished with value: 0.33363491495293585 and parameters: {'model_type': 'gcn', 'hidden_dims': '[512, 64]', 'dropout': 0.44536470394586347, 'batch_norm': False, 'lr': 1.4637839165806309e-05, 'weight_decay': 4.1606725750139787e-07, 'epochs': 254, 'loss': 'mae', 'optimizer': 'adam', 'graph_mode': 'cutoff', 'cutoff': 0.4724714000763224, 'grm_norm': 'cosine_then_gcn', 'self_loops': True, 'use_snp_selection': False}. Best is trial 37 with value: 0.3653283038272238.
[I 2025-12-08 14:38:48,390] Trial 44 finished with value: 0.3599373009282037 and parameters: {'model_type': 'gcn', 'hidden_dims': '[512, 64]', 'dropout': 0.5527501318602184, 'batch_norm': False, 'lr': 0.00010627368134783424, 'weight_decay': 1.3250096890679863e-07, 'epochs': 199, 'loss': 'mae', 'optimizer': 'adam', 'graph_mode': 'cutoff', 'cutoff': 0.5817120428953764, 'grm_norm': 'cosine_then_gcn', 'self_loops': True, 'use_snp_selection': False}. Best is trial 37 with value: 0.3653283038272238.
[I 2025-12-08 14:39:39,703] Trial 45 finished with value: 0.2854930399271713 and parameters: {'model_type': 'gcn', 'hidden_dims': '[512, 64]', 'dropout': 0.5794835928163622, 'batch_norm': True, 'lr': 0.0001217973748473163, 'weight_decay': 1.7197303312278972e-07, 'epochs': 202, 'loss': 'mae', 'optimizer': 'adam', 'graph_mode': 'cutoff', 'cutoff': 0.5873723611624841, 'grm_norm': 'gcn', 'self_loops': True, 'use_snp_selection': False}. Best is trial 37 with value: 0.3653283038272238.
[I 2025-12-08 14:40:27,066] Trial 46 finished with value: 0.3636374105987377 and parameters: {'model_type': 'gcn', 'hidden_dims': '[512, 64]', 'dropout': 0.5684689738289319, 'batch_norm': False, 'lr': 5.887515339533707e-05, 'weight_decay': 1.0201873264051824e-07, 'epochs': 185, 'loss': 'mae', 'optimizer': 'adam', 'graph_mode': 'cutoff', 'cutoff': 0.5354531952723426, 'grm_norm': 'cosine', 'self_loops': True, 'use_snp_selection': False}. Best is trial 37 with value: 0.3653283038272238.
[I 2025-12-08 14:40:41,474] Trial 47 finished with value: 0.16811904654989268 and parameters: {'model_type': 'gcn', 'hidden_dims': '[128, 64]', 'dropout': 0.5629358047019211, 'batch_norm': False, 'lr': 0.00011435401818934709, 'weight_decay': 1.2947574790190395e-07, 'epochs': 186, 'loss': 'mae', 'optimizer': 'adam', 'graph_mode': 'cutoff', 'cutoff': 0.631721643393396, 'grm_norm': 'cosine', 'self_loops': True, 'use_snp_selection': False}. Best is trial 37 with value: 0.3653283038272238.
[I 2025-12-08 14:41:36,556] Trial 48 finished with value: 0.36674939557874003 and parameters: {'model_type': 'gcn', 'hidden_dims': '[512, 64]', 'dropout': 0.527148425201092, 'batch_norm': False, 'lr': 2.803681488656106e-05, 'weight_decay': 1.0936015520839452e-07, 'epochs': 218, 'loss': 'mae', 'optimizer': 'adam', 'graph_mode': 'cutoff', 'cutoff': 0.6014413720114191, 'grm_norm': 'cosine', 'self_loops': True, 'use_snp_selection': False}. Best is trial 48 with value: 0.36674939557874003.
[I 2025-12-08 14:42:20,893] Trial 49 finished with value: 0.2477981177815176 and parameters: {'model_type': 'gcn', 'hidden_dims': '[256, 128, 64]', 'dropout': 0.44909410262882055, 'batch_norm': True, 'lr': 2.7091549463531215e-05, 'weight_decay': 1.2417962684906073e-06, 'epochs': 349, 'loss': 'mse', 'optimizer': 'adam', 'graph_mode': 'knn', 'knn_k': 1, 'weighted_edges': True, 'symmetrize_mode': 'mutual', 'self_loops': True, 'use_snp_selection': False}. Best is trial 48 with value: 0.36674939557874003.
[I 2025-12-08 14:43:15,802] Trial 50 finished with value: 0.35189890031327203 and parameters: {'model_type': 'gcn', 'hidden_dims': '[512, 64]', 'dropout': 0.5246933919834966, 'batch_norm': False, 'lr': 1.527832945534675e-05, 'weight_decay': 5.753652752789586e-07, 'epochs': 217, 'loss': 'mae', 'optimizer': 'adam', 'graph_mode': 'cutoff', 'cutoff': 0.6190845108164745, 'grm_norm': 'cosine', 'self_loops': True, 'use_snp_selection': False}. Best is trial 48 with value: 0.36674939557874003.
[I 2025-12-08 14:44:06,151] Trial 51 finished with value: 0.35956375623463543 and parameters: {'model_type': 'gcn', 'hidden_dims': '[512, 64]', 'dropout': 0.540573442144083, 'batch_norm': False, 'lr': 6.081495205496686e-05, 'weight_decay': 1.0010195176198496e-07, 'epochs': 198, 'loss': 'mae', 'optimizer': 'adam', 'graph_mode': 'cutoff', 'cutoff': 0.5525937964381237, 'grm_norm': 'cosine', 'self_loops': True, 'use_snp_selection': False}. Best is trial 48 with value: 0.36674939557874003.
[I 2025-12-08 14:44:50,837] Trial 52 finished with value: 0.36401765127258595 and parameters: {'model_type': 'gcn', 'hidden_dims': '[512, 64]', 'dropout': 0.5665319451429593, 'batch_norm': False, 'lr': 8.87853328757047e-05, 'weight_decay': 1.4500465623768728e-07, 'epochs': 174, 'loss': 'mae', 'optimizer': 'adam', 'graph_mode': 'cutoff', 'cutoff': 0.5866253711982878, 'grm_norm': 'cosine', 'self_loops': True, 'use_snp_selection': False}. Best is trial 48 with value: 0.36674939557874003.
[I 2025-12-08 14:45:37,435] Trial 53 finished with value: 0.3391702960999773 and parameters: {'model_type': 'gcn', 'hidden_dims': '[512, 64]', 'dropout': 0.5632071270398816, 'batch_norm': False, 'lr': 3.288547532229159e-05, 'weight_decay': 2.384462334658323e-07, 'epochs': 181, 'loss': 'mae', 'optimizer': 'adam', 'graph_mode': 'cutoff', 'cutoff': 0.43606529016314877, 'grm_norm': 'cosine', 'self_loops': True, 'use_snp_selection': False}. Best is trial 48 with value: 0.36674939557874003.
[I 2025-12-08 14:46:34,419] Trial 54 finished with value: 0.35654612337287866 and parameters: {'model_type': 'gcn', 'hidden_dims': '[512, 64]', 'dropout': 0.572148954183067, 'batch_norm': False, 'lr': 8.618158691696526e-05, 'weight_decay': 1.4785174999695893e-07, 'epochs': 226, 'loss': 'mae', 'optimizer': 'adam', 'graph_mode': 'cutoff', 'cutoff': 0.6054201108165624, 'grm_norm': 'cosine', 'self_loops': True, 'use_snp_selection': False}. Best is trial 48 with value: 0.36674939557874003.
[I 2025-12-08 14:46:54,805] Trial 55 finished with value: 0.3360139567095703 and parameters: {'model_type': 'gcn', 'hidden_dims': '[256, 128]', 'dropout': 0.5984868563942456, 'batch_norm': False, 'lr': 5.964773921473117e-05, 'weight_decay': 2.4935093401070183e-07, 'epochs': 153, 'loss': 'mae', 'optimizer': 'adam', 'graph_mode': 'cutoff', 'cutoff': 0.5378231865565314, 'grm_norm': 'cosine', 'self_loops': True, 'use_snp_selection': False}. Best is trial 48 with value: 0.36674939557874003.
[I 2025-12-08 14:47:37,580] Trial 56 finished with value: 0.3154729451922922 and parameters: {'model_type': 'gcn', 'hidden_dims': '[512, 128]', 'dropout': 0.5015376417404325, 'batch_norm': False, 'lr': 1.793922180363998e-05, 'weight_decay': 3.555651469286447e-07, 'epochs': 164, 'loss': 'mae', 'optimizer': 'adam', 'graph_mode': 'knn', 'knn_k': 4, 'weighted_edges': True, 'symmetrize_mode': 'mutual', 'self_loops': True, 'use_snp_selection': False}. Best is trial 48 with value: 0.36674939557874003.
[I 2025-12-08 14:48:21,951] Trial 57 finished with value: 0.3587616364539787 and parameters: {'model_type': 'gcn', 'hidden_dims': '[512, 64]', 'dropout': 0.46316493203615344, 'batch_norm': False, 'lr': 2.6432138449230078e-05, 'weight_decay': 1.0049222859910359e-07, 'epochs': 173, 'loss': 'mae', 'optimizer': 'adam', 'graph_mode': 'cutoff', 'cutoff': 0.6540289512151162, 'grm_norm': 'cosine', 'self_loops': True, 'use_snp_selection': False}. Best is trial 48 with value: 0.36674939557874003.
[I 2025-12-08 14:49:34,436] Trial 58 finished with value: 0.21129944652565635 and parameters: {'model_type': 'gcn', 'hidden_dims': '[512, 64]', 'dropout': 0.4106038279749708, 'batch_norm': True, 'lr': 3.521630790051886e-05, 'weight_decay': 1.757336897863698e-07, 'epochs': 287, 'loss': 'mae', 'optimizer': 'adam', 'graph_mode': 'cutoff', 'cutoff': 0.48128554658656275, 'grm_norm': 'cosine', 'self_loops': True, 'use_snp_selection': False}. Best is trial 48 with value: 0.36674939557874003.
[I 2025-12-08 14:49:50,288] Trial 59 finished with value: 0.3291218290953818 and parameters: {'model_type': 'gcn', 'hidden_dims': '[128, 64]', 'dropout': 0.5454700220759052, 'batch_norm': False, 'lr': 1.0874663086803376e-05, 'weight_decay': 5.750582202202545e-07, 'epochs': 209, 'loss': 'mae', 'optimizer': 'adam', 'graph_mode': 'cutoff', 'cutoff': 0.3768181795430742, 'grm_norm': 'none', 'self_loops': True, 'use_snp_selection': False}. Best is trial 48 with value: 0.36674939557874003.
[I 2025-12-08 14:50:10,518] Trial 60 finished with value: 0.31178999597326895 and parameters: {'model_type': 'gcn', 'hidden_dims': '[256, 128, 64]', 'dropout': 0.48279439335318936, 'batch_norm': False, 'lr': 8.28547660535266e-05, 'weight_decay': 1.32816603000655e-07, 'epochs': 146, 'loss': 'mae', 'optimizer': 'adam', 'graph_mode': 'knn', 'knn_k': 10, 'weighted_edges': True, 'symmetrize_mode': 'mutual', 'self_loops': True, 'use_snp_selection': False}. Best is trial 48 with value: 0.36674939557874003.
[I 2025-12-08 14:51:01,403] Trial 61 finished with value: 0.36304033820871384 and parameters: {'model_type': 'gcn', 'hidden_dims': '[512, 64]', 'dropout': 0.5765596456484648, 'batch_norm': False, 'lr': 9.773279926241808e-05, 'weight_decay': 1.4768343523278295e-07, 'epochs': 200, 'loss': 'mae', 'optimizer': 'adam', 'graph_mode': 'cutoff', 'cutoff': 0.5841479412990108, 'grm_norm': 'cosine', 'self_loops': True, 'use_snp_selection': False}. Best is trial 48 with value: 0.36674939557874003.
[I 2025-12-08 14:52:05,002] Trial 62 finished with value: 0.3599421972455507 and parameters: {'model_type': 'gcn', 'hidden_dims': '[512, 64]', 'dropout': 0.5757685244200008, 'batch_norm': False, 'lr': 3.883486924157075e-05, 'weight_decay': 2.3954698932462186e-07, 'epochs': 253, 'loss': 'mae', 'optimizer': 'adam', 'graph_mode': 'cutoff', 'cutoff': 0.5929664488237272, 'grm_norm': 'cosine', 'self_loops': True, 'use_snp_selection': False}. Best is trial 48 with value: 0.36674939557874003.
[I 2025-12-08 14:53:02,608] Trial 63 finished with value: 0.36337701698109337 and parameters: {'model_type': 'gcn', 'hidden_dims': '[512, 64]', 'dropout': 0.2995632417818122, 'batch_norm': False, 'lr': 4.911880552197488e-05, 'weight_decay': 1.5886747959693128e-07, 'epochs': 228, 'loss': 'mae', 'optimizer': 'adam', 'graph_mode': 'cutoff', 'cutoff': 0.6862262245149636, 'grm_norm': 'cosine', 'self_loops': True, 'use_snp_selection': False}. Best is trial 48 with value: 0.36674939557874003.
[I 2025-12-08 14:54:00,928] Trial 64 finished with value: 0.35701331033403183 and parameters: {'model_type': 'gcn', 'hidden_dims': '[512, 64]', 'dropout': 0.29230368642457494, 'batch_norm': False, 'lr': 5.305672086963416e-05, 'weight_decay': 1.0545221187441756e-06, 'epochs': 231, 'loss': 'mae', 'optimizer': 'adam', 'graph_mode': 'cutoff', 'cutoff': 0.6717073193557638, 'grm_norm': 'cosine', 'self_loops': True, 'use_snp_selection': False}. Best is trial 48 with value: 0.36674939557874003.
[I 2025-12-08 14:54:25,283] Trial 65 finished with value: 0.3363658617174747 and parameters: {'model_type': 'gcn', 'hidden_dims': '[256, 128]', 'dropout': 0.30717224371229557, 'batch_norm': False, 'lr': 0.00032619689354039733, 'weight_decay': 3.241319747517006e-07, 'epochs': 192, 'loss': 'mae', 'optimizer': 'adam', 'graph_mode': 'cutoff', 'cutoff': 0.701831538754348, 'grm_norm': 'cosine', 'self_loops': True, 'use_snp_selection': False}. Best is trial 48 with value: 0.36674939557874003.
[I 2025-12-08 14:55:19,550] Trial 66 finished with value: 0.364731060615647 and parameters: {'model_type': 'gcn', 'hidden_dims': '[512, 64]', 'dropout': 0.5156855620962739, 'batch_norm': False, 'lr': 7.306661364694994e-05, 'weight_decay': 1.881646193030149e-07, 'epochs': 214, 'loss': 'mae', 'optimizer': 'adam', 'graph_mode': 'cutoff', 'cutoff': 0.6267256229030447, 'grm_norm': 'cosine', 'self_loops': True, 'use_snp_selection': False}. Best is trial 48 with value: 0.36674939557874003.
