[I 2025-12-08 10:59:27,341] Trial 130 finished with value: 0.30681549052366697 and parameters: {'model_type': 'gcn', 'hidden_dims': '[512, 256]', 'dropout': 0.5800552410579912, 'batch_norm': True, 'lr': 0.000507806548340301, 'weight_decay': 4.3830556834617975e-07, 'epochs': 51, 'loss': 'mae', 'optimizer': 'adam', 'graph_mode': 'cutoff', 'cutoff': 0.685123686319528, 'grm_norm': 'cosine_then_gcn', 'self_loops': False, 'use_snp_selection': True, 'num_snps': 52730}. Best is trial 121 with value: 0.31335727417865833.
[I 2025-12-08 10:59:54,904] Trial 131 finished with value: 0.30536129279975294 and parameters: {'model_type': 'gcn', 'hidden_dims': '[512, 256]', 'dropout': 0.5591644808378678, 'batch_norm': True, 'lr': 0.0007703124106550498, 'weight_decay': 6.889607891982117e-07, 'epochs': 61, 'loss': 'mae', 'optimizer': 'adam', 'graph_mode': 'cutoff', 'cutoff': 0.7523434757197957, 'grm_norm': 'cosine_then_gcn', 'self_loops': False, 'use_snp_selection': True, 'num_snps': 48394}. Best is trial 121 with value: 0.31335727417865833.
[I 2025-12-08 11:00:20,415] Trial 132 finished with value: 0.307910673679465 and parameters: {'model_type': 'gcn', 'hidden_dims': '[512, 256]', 'dropout': 0.5973645108185004, 'batch_norm': True, 'lr': 0.001080199319915671, 'weight_decay': 1.0365236531619011e-06, 'epochs': 52, 'loss': 'mae', 'optimizer': 'adam', 'graph_mode': 'cutoff', 'cutoff': 0.7322651051537291, 'grm_norm': 'cosine_then_gcn', 'self_loops': False, 'use_snp_selection': True, 'num_snps': 47555}. Best is trial 121 with value: 0.31335727417865833.
[I 2025-12-08 11:00:52,056] Trial 133 finished with value: 0.31110675786771497 and parameters: {'model_type': 'gcn', 'hidden_dims': '[512, 256]', 'dropout': 0.5833658323748261, 'batch_norm': True, 'lr': 0.000872161835511516, 'weight_decay': 4.0679628370608045e-07, 'epochs': 71, 'loss': 'mae', 'optimizer': 'adam', 'graph_mode': 'cutoff', 'cutoff': 0.7687514995452137, 'grm_norm': 'cosine_then_gcn', 'self_loops': False, 'use_snp_selection': True, 'num_snps': 52959}. Best is trial 121 with value: 0.31335727417865833.
[I 2025-12-08 11:01:23,770] Trial 134 finished with value: 0.3048227830263522 and parameters: {'model_type': 'gcn', 'hidden_dims': '[512, 256]', 'dropout': 0.5839359641325812, 'batch_norm': True, 'lr': 0.0008370876679535237, 'weight_decay': 3.619656563263053e-07, 'epochs': 72, 'loss': 'mae', 'optimizer': 'adam', 'graph_mode': 'cutoff', 'cutoff': 0.7680598115276822, 'grm_norm': 'cosine_then_gcn', 'self_loops': False, 'use_snp_selection': True, 'num_snps': 53309}. Best is trial 121 with value: 0.31335727417865833.
[I 2025-12-08 11:01:55,857] Trial 135 finished with value: 0.30624343577363206 and parameters: {'model_type': 'gcn', 'hidden_dims': '[512, 256]', 'dropout': 0.5399600846229747, 'batch_norm': True, 'lr': 0.0013248464089340216, 'weight_decay': 4.131915561348566e-07, 'epochs': 68, 'loss': 'mae', 'optimizer': 'adam', 'graph_mode': 'cutoff', 'cutoff': 0.714937424634563, 'grm_norm': 'cosine_then_gcn', 'self_loops': False, 'use_snp_selection': True, 'num_snps': 55753}. Best is trial 121 with value: 0.31335727417865833.
[I 2025-12-08 11:02:20,625] Trial 136 finished with value: 0.3078819208948326 and parameters: {'model_type': 'gcn', 'hidden_dims': '[512, 256]', 'dropout': 0.598405606754531, 'batch_norm': True, 'lr': 0.0009224250380945099, 'weight_decay': 5.192698628591585e-07, 'epochs': 60, 'loss': 'mae', 'optimizer': 'adam', 'graph_mode': 'cutoff', 'cutoff': 0.7388723101499673, 'grm_norm': 'cosine_then_gcn', 'self_loops': False, 'use_snp_selection': True, 'num_snps': 41673}. Best is trial 121 with value: 0.31335727417865833.
[I 2025-12-08 11:02:42,495] Trial 137 finished with value: 0.2759244267010392 and parameters: {'model_type': 'gcn', 'hidden_dims': '[512, 256]', 'dropout': 0.5774632889036138, 'batch_norm': True, 'lr': 0.0011502262009878749, 'weight_decay': 6.203714563102116e-07, 'epochs': 52, 'loss': 'mae', 'optimizer': 'adam', 'graph_mode': 'knn', 'knn_k': 6, 'weighted_edges': True, 'symmetrize_mode': 'union', 'self_loops': False, 'use_snp_selection': True, 'num_snps': 34598}. Best is trial 121 with value: 0.31335727417865833.
[I 2025-12-08 11:03:07,769] Trial 138 finished with value: 0.30506439340717895 and parameters: {'model_type': 'gcn', 'hidden_dims': '[512, 256]', 'dropout': 0.5861492720412813, 'batch_norm': True, 'lr': 0.0004138653572784094, 'weight_decay': 4.937384764378367e-07, 'epochs': 40, 'loss': 'mse', 'optimizer': 'adam', 'graph_mode': 'cutoff', 'cutoff': 0.6620457005773946, 'grm_norm': 'cosine_then_gcn', 'self_loops': False, 'use_snp_selection': True, 'num_snps': 51182}. Best is trial 121 with value: 0.31335727417865833.
[I 2025-12-08 11:03:38,955] Trial 139 finished with value: 0.3096427600061316 and parameters: {'model_type': 'gcn', 'hidden_dims': '[512, 256]', 'dropout': 0.5705464662555327, 'batch_norm': True, 'lr': 0.0014831516611206869, 'weight_decay': 3.387041714185893e-07, 'epochs': 72, 'loss': 'mae', 'optimizer': 'adam', 'graph_mode': 'cutoff', 'cutoff': 0.7952524737404468, 'grm_norm': 'cosine_then_gcn', 'self_loops': True, 'use_snp_selection': True, 'num_snps': 52100}. Best is trial 121 with value: 0.31335727417865833.
[I 2025-12-08 11:04:10,044] Trial 140 finished with value: 0.012502754055097806 and parameters: {'model_type': 'gcn', 'hidden_dims': '[512, 256]', 'dropout': 0.553548856658072, 'batch_norm': False, 'lr': 0.001447449760520551, 'weight_decay': 3.469659718250047e-07, 'epochs': 70, 'loss': 'mae', 'optimizer': 'adam', 'graph_mode': 'cutoff', 'cutoff': 0.79806515991096, 'grm_norm': 'cosine_then_gcn', 'self_loops': True, 'use_snp_selection': True, 'num_snps': 51982}. Best is trial 121 with value: 0.31335727417865833.
[I 2025-12-08 11:04:40,464] Trial 141 finished with value: 0.3071051459316255 and parameters: {'model_type': 'gcn', 'hidden_dims': '[512, 256]', 'dropout': 0.5739136475879718, 'batch_norm': True, 'lr': 0.0010566613834773993, 'weight_decay': 4.146225445439381e-07, 'epochs': 61, 'loss': 'mae', 'optimizer': 'adam', 'graph_mode': 'cutoff', 'cutoff': 0.756828784719253, 'grm_norm': 'cosine_then_gcn', 'self_loops': True, 'use_snp_selection': True, 'num_snps': 54874}. Best is trial 121 with value: 0.31335727417865833.
[I 2025-12-08 11:05:10,953] Trial 142 finished with value: 0.30628910007898774 and parameters: {'model_type': 'gcn', 'hidden_dims': '[512, 256]', 'dropout': 0.5865948410939589, 'batch_norm': True, 'lr': 0.00165265972188099, 'weight_decay': 6.103688288332326e-07, 'epochs': 81, 'loss': 'mae', 'optimizer': 'adam', 'graph_mode': 'cutoff', 'cutoff': 0.7720405717411449, 'grm_norm': 'cosine_then_gcn', 'self_loops': True, 'use_snp_selection': True, 'num_snps': 45768}. Best is trial 121 with value: 0.31335727417865833.
[I 2025-12-08 11:05:39,123] Trial 143 finished with value: 0.30859124566416185 and parameters: {'model_type': 'gcn', 'hidden_dims': '[512, 256]', 'dropout': 0.5988381115708202, 'batch_norm': True, 'lr': 0.0005850612783348223, 'weight_decay': 9.867360665622307e-06, 'epochs': 55, 'loss': 'mae', 'optimizer': 'adam', 'graph_mode': 'cutoff', 'cutoff': 0.8049981563363441, 'grm_norm': 'cosine_then_gcn', 'self_loops': True, 'use_snp_selection': True, 'num_snps': 51945}. Best is trial 121 with value: 0.31335727417865833.
[I 2025-12-08 11:06:10,494] Trial 144 finished with value: 0.3079030260030631 and parameters: {'model_type': 'gcn', 'hidden_dims': '[512, 256]', 'dropout': 0.5682821929083369, 'batch_norm': True, 'lr': 0.0007502453232367554, 'weight_decay': 1.2896808917266402e-05, 'epochs': 75, 'loss': 'mae', 'optimizer': 'adam', 'graph_mode': 'cutoff', 'cutoff': 0.7973921375791975, 'grm_norm': 'cosine_then_gcn', 'self_loops': True, 'use_snp_selection': True, 'num_snps': 50527}. Best is trial 121 with value: 0.31335727417865833.
[I 2025-12-08 11:06:40,911] Trial 145 finished with value: 0.3037068872610738 and parameters: {'model_type': 'gcn', 'hidden_dims': '[512, 256]', 'dropout': 0.5396729883477412, 'batch_norm': True, 'lr': 0.0005519568377582977, 'weight_decay': 2.0830902322089445e-05, 'epochs': 56, 'loss': 'mae', 'optimizer': 'adam', 'graph_mode': 'cutoff', 'cutoff': 0.7971906083691761, 'grm_norm': 'cosine_then_gcn', 'self_loops': True, 'use_snp_selection': True, 'num_snps': 58105}. Best is trial 121 with value: 0.31335727417865833.
[I 2025-12-08 11:07:28,458] Trial 146 finished with value: 0.23946416649538937 and parameters: {'model_type': 'gcn', 'hidden_dims': '[512, 256]', 'dropout': 0.5991078065773251, 'batch_norm': True, 'lr': 0.0008817947014275076, 'weight_decay': 9.295715576978784e-05, 'epochs': 151, 'loss': 'mae', 'optimizer': 'adam', 'graph_mode': 'cutoff', 'cutoff': 0.2963959061707833, 'grm_norm': 'cosine_then_gcn', 'self_loops': True, 'use_snp_selection': True, 'num_snps': 52893}. Best is trial 121 with value: 0.31335727417865833.
[I 2025-12-08 11:07:54,473] Trial 147 finished with value: 0.30785245772621395 and parameters: {'model_type': 'gcn', 'hidden_dims': '[512, 256]', 'dropout': 0.5226130709873782, 'batch_norm': True, 'lr': 0.0012827263364633798, 'weight_decay': 7.436697759150444e-07, 'epochs': 65, 'loss': 'mae', 'optimizer': 'adam', 'graph_mode': 'cutoff', 'cutoff': 0.809522279550493, 'grm_norm': 'cosine_then_gcn', 'self_loops': True, 'use_snp_selection': True, 'num_snps': 41532}. Best is trial 121 with value: 0.31335727417865833.
[I 2025-12-08 11:08:18,880] Trial 148 finished with value: 0.3079415507373126 and parameters: {'model_type': 'gcn', 'hidden_dims': '[512, 256]', 'dropout': 0.5629666835702941, 'batch_norm': True, 'lr': 0.0013530349981675663, 'weight_decay': 1.6388346231727077e-06, 'epochs': 46, 'loss': 'mae', 'optimizer': 'adam', 'graph_mode': 'cutoff', 'cutoff': 0.7724093792740372, 'grm_norm': 'cosine_then_gcn', 'self_loops': True, 'use_snp_selection': True, 'num_snps': 46585}. Best is trial 121 with value: 0.31335727417865833.
[I 2025-12-08 11:08:45,747] Trial 149 finished with value: 0.3065847577156515 and parameters: {'model_type': 'gcn', 'hidden_dims': '[512, 256]', 'dropout': 0.5817504011465774, 'batch_norm': True, 'lr': 0.0006322597907077712, 'weight_decay': 9.353431300263631e-06, 'epochs': 51, 'loss': 'mae', 'optimizer': 'adam', 'graph_mode': 'cutoff', 'cutoff': 0.7515636505860416, 'grm_norm': 'cosine_then_gcn', 'self_loops': True, 'use_snp_selection': True, 'num_snps': 50461}. Best is trial 121 with value: 0.31335727417865833.
[I 2025-12-08 11:09:16,259] Trial 0 finished with value: 0.22784456164779013 and parameters: {'model_type': 'gcn', 'hidden_dims': '[128, 64]', 'dropout': 0.199031432379812, 'batch_norm': True, 'lr': 1.8408544111075823e-05, 'weight_decay': 5.5136510071208614e-05, 'epochs': 336, 'loss': 'mae', 'optimizer': 'adam', 'graph_mode': 'knn', 'knn_k': 8, 'weighted_edges': True, 'symmetrize_mode': 'mutual', 'self_loops': True, 'use_snp_selection': True, 'num_snps': 27173}. Best is trial 0 with value: 0.22784456164779013.
[I 2025-12-08 11:09:55,072] Trial 1 finished with value: 0.2295852468850721 and parameters: {'model_type': 'gcn', 'hidden_dims': '[256, 128, 64]', 'dropout': 0.5543244404043342, 'batch_norm': True, 'lr': 7.981787657617978e-05, 'weight_decay': 2.8571789869344834e-07, 'epochs': 297, 'loss': 'mae', 'optimizer': 'adam', 'graph_mode': 'cutoff', 'cutoff': 0.3392632777751686, 'grm_norm': 'gcn', 'self_loops': False, 'use_snp_selection': False}. Best is trial 1 with value: 0.2295852468850721.
[I 2025-12-08 11:10:53,329] Trial 2 finished with value: 0.19209705106222213 and parameters: {'model_type': 'gcn', 'hidden_dims': '[512, 64]', 'dropout': 0.32815227354739207, 'batch_norm': True, 'lr': 0.000619605044204259, 'weight_decay': 0.0004086269831625786, 'epochs': 206, 'loss': 'mse', 'optimizer': 'adam', 'graph_mode': 'knn', 'knn_k': 4, 'weighted_edges': True, 'symmetrize_mode': 'union', 'self_loops': True, 'use_snp_selection': True, 'num_snps': 53035}. Best is trial 1 with value: 0.2295852468850721.
[I 2025-12-08 11:11:21,334] Trial 3 finished with value: 0.20276780015830673 and parameters: {'model_type': 'gcn', 'hidden_dims': '[256, 128]', 'dropout': 0.23110783056597514, 'batch_norm': True, 'lr': 8.11311593386298e-05, 'weight_decay': 9.296158109581328e-07, 'epochs': 213, 'loss': 'mse', 'optimizer': 'adam', 'graph_mode': 'knn', 'knn_k': 10, 'weighted_edges': True, 'symmetrize_mode': 'mutual', 'self_loops': True, 'use_snp_selection': False}. Best is trial 1 with value: 0.2295852468850721.
[I 2025-12-08 11:11:36,253] Trial 4 finished with value: 0.3030962777731697 and parameters: {'model_type': 'gcn', 'hidden_dims': '[512, 256]', 'dropout': 0.2753281956415665, 'batch_norm': True, 'lr': 0.00034435188114839693, 'weight_decay': 4.9416012835950194e-05, 'epochs': 89, 'loss': 'mae', 'optimizer': 'adam', 'graph_mode': 'cutoff', 'cutoff': 0.820078967317394, 'grm_norm': 'none', 'self_loops': False, 'use_snp_selection': True, 'num_snps': 12674}. Best is trial 4 with value: 0.3030962777731697.
[I 2025-12-08 11:12:01,667] Trial 5 finished with value: 0.287270953552619 and parameters: {'model_type': 'gcn', 'hidden_dims': '[128, 64]', 'dropout': 0.5611163934517731, 'batch_norm': True, 'lr': 0.0003984856210762587, 'weight_decay': 1.1466743517565185e-07, 'epochs': 344, 'loss': 'mae', 'optimizer': 'adam', 'graph_mode': 'cutoff', 'cutoff': 0.6089370799714728, 'grm_norm': 'gcn', 'self_loops': True, 'use_snp_selection': False}. Best is trial 4 with value: 0.3030962777731697.
[I 2025-12-08 11:12:24,742] Trial 6 finished with value: 0.2794863549625376 and parameters: {'model_type': 'gcn', 'hidden_dims': '[128, 64]', 'dropout': 0.31805912766941713, 'batch_norm': True, 'lr': 1.2361026034262557e-05, 'weight_decay': 6.492620232791903e-06, 'epochs': 271, 'loss': 'mse', 'optimizer': 'adam', 'graph_mode': 'cutoff', 'cutoff': 0.6193362582230448, 'grm_norm': 'cosine', 'self_loops': False, 'use_snp_selection': True, 'num_snps': 28594}. Best is trial 4 with value: 0.3030962777731697.
[I 2025-12-08 11:12:45,169] Trial 7 finished with value: 0.25114290690002083 and parameters: {'model_type': 'gcn', 'hidden_dims': '[512, 64]', 'dropout': 0.471337288649717, 'batch_norm': True, 'lr': 2.239693207292708e-05, 'weight_decay': 2.263166635514082e-06, 'epochs': 69, 'loss': 'mse', 'optimizer': 'adam', 'graph_mode': 'cutoff', 'cutoff': 0.4056820886426376, 'grm_norm': 'cosine', 'self_loops': False, 'use_snp_selection': False}. Best is trial 4 with value: 0.3030962777731697.
[I 2025-12-08 11:13:23,374] Trial 8 finished with value: 0.26632191574784364 and parameters: {'model_type': 'gcn', 'hidden_dims': '[512, 256]', 'dropout': 0.20659328268932406, 'batch_norm': False, 'lr': 8.93315124361372e-05, 'weight_decay': 0.00028987480727919035, 'epochs': 136, 'loss': 'mae', 'optimizer': 'adam', 'graph_mode': 'knn', 'knn_k': 3, 'weighted_edges': False, 'symmetrize_mode': 'union', 'self_loops': False, 'use_snp_selection': True, 'num_snps': 43128}. Best is trial 4 with value: 0.3030962777731697.
[I 2025-12-08 11:14:05,908] Trial 9 finished with value: -0.016050987381066736 and parameters: {'model_type': 'gcn', 'hidden_dims': '[512, 256]', 'dropout': 0.2888209592870401, 'batch_norm': False, 'lr': 0.004734648143129892, 'weight_decay': 1.5879705591356368e-06, 'epochs': 163, 'loss': 'mse', 'optimizer': 'adam', 'graph_mode': 'cutoff', 'cutoff': 0.5984899797909019, 'grm_norm': 'cosine', 'self_loops': True, 'use_snp_selection': False}. Best is trial 4 with value: 0.3030962777731697.
[I 2025-12-08 11:14:15,198] Trial 10 finished with value: 0.2643093194978568 and parameters: {'model_type': 'gcn', 'hidden_dims': '[512, 128]', 'dropout': 0.11372025982957354, 'batch_norm': False, 'lr': 0.0023343012062770553, 'weight_decay': 4.14440562940608e-05, 'epochs': 41, 'loss': 'mae', 'optimizer': 'adam', 'graph_mode': 'cutoff', 'cutoff': 0.8740100033033124, 'grm_norm': 'none', 'self_loops': False, 'use_snp_selection': True, 'num_snps': 3859}. Best is trial 4 with value: 0.3030962777731697.
[I 2025-12-08 11:14:24,789] Trial 11 finished with value: 0.3036637915359532 and parameters: {'model_type': 'gcn', 'hidden_dims': '[128, 64]', 'dropout': 0.44863014119095845, 'batch_norm': True, 'lr': 0.0005943392021247852, 'weight_decay': 1.0655358607693621e-07, 'epochs': 110, 'loss': 'mae', 'optimizer': 'adam', 'graph_mode': 'cutoff', 'cutoff': 0.8568899271933978, 'grm_norm': 'cosine_then_gcn', 'self_loops': True, 'use_snp_selection': False}. Best is trial 11 with value: 0.3036637915359532.
[I 2025-12-08 11:14:37,043] Trial 12 finished with value: 0.2829836077313247 and parameters: {'model_type': 'gcn', 'hidden_dims': '[512, 256]', 'dropout': 0.42758862319180935, 'batch_norm': True, 'lr': 0.0012059085553112938, 'weight_decay': 3.482253699955131e-05, 'epochs': 103, 'loss': 'mae', 'optimizer': 'adam', 'graph_mode': 'cutoff', 'cutoff': 0.8919050080438428, 'grm_norm': 'cosine_then_gcn', 'self_loops': True, 'use_snp_selection': True, 'num_snps': 6176}. Best is trial 11 with value: 0.3036637915359532.
[I 2025-12-08 11:14:50,951] Trial 13 finished with value: 0.3095610240919141 and parameters: {'model_type': 'gcn', 'hidden_dims': '[256, 128]', 'dropout': 0.4452783958423849, 'batch_norm': True, 'lr': 0.00028764898471530923, 'weight_decay': 8.746795324277564e-06, 'epochs': 96, 'loss': 'mae', 'optimizer': 'adam', 'graph_mode': 'cutoff', 'cutoff': 0.7596101551526167, 'grm_norm': 'cosine_then_gcn', 'self_loops': False, 'use_snp_selection': False}. Best is trial 13 with value: 0.3095610240919141.
[I 2025-12-08 11:15:09,084] Trial 14 finished with value: 0.04600272732122963 and parameters: {'model_type': 'gcn', 'hidden_dims': '[256, 128]', 'dropout': 0.4280653677930823, 'batch_norm': False, 'lr': 0.009430566714901507, 'weight_decay': 7.081154721639774e-06, 'epochs': 135, 'loss': 'mae', 'optimizer': 'adam', 'graph_mode': 'cutoff', 'cutoff': 0.7240625816402448, 'grm_norm': 'cosine_then_gcn', 'self_loops': True, 'use_snp_selection': False}. Best is trial 13 with value: 0.3095610240919141.
[I 2025-12-08 11:15:31,938] Trial 15 finished with value: 0.3023159839437549 and parameters: {'model_type': 'gcn', 'hidden_dims': '[256, 128]', 'dropout': 0.4827864904294467, 'batch_norm': True, 'lr': 0.000166827860779801, 'weight_decay': 4.104169171058631e-07, 'epochs': 172, 'loss': 'mae', 'optimizer': 'adam', 'graph_mode': 'cutoff', 'cutoff': 0.7416328481826706, 'grm_norm': 'cosine_then_gcn', 'self_loops': False, 'use_snp_selection': False}. Best is trial 13 with value: 0.3095610240919141.
[I 2025-12-08 11:16:05,647] Trial 16 finished with value: 0.3042072064756815 and parameters: {'model_type': 'gcn', 'hidden_dims': '[512, 128]', 'dropout': 0.3897927192620549, 'batch_norm': True, 'lr': 0.0013348907345225615, 'weight_decay': 1.3390115129704958e-07, 'epochs': 124, 'loss': 'mae', 'optimizer': 'adam', 'graph_mode': 'cutoff', 'cutoff': 0.741530364546869, 'grm_norm': 'cosine_then_gcn', 'self_loops': False, 'use_snp_selection': False}. Best is trial 13 with value: 0.3095610240919141.
[I 2025-12-08 11:16:20,605] Trial 17 finished with value: 0.26975284254074694 and parameters: {'model_type': 'gcn', 'hidden_dims': '[512, 128]', 'dropout': 0.38972932269140576, 'batch_norm': True, 'lr': 0.001656981930289787, 'weight_decay': 1.6325588042830853e-05, 'epochs': 47, 'loss': 'mae', 'optimizer': 'adam', 'graph_mode': 'cutoff', 'cutoff': 0.4783946474822031, 'grm_norm': 'cosine_then_gcn', 'self_loops': False, 'use_snp_selection': False}. Best is trial 13 with value: 0.3095610240919141.
[I 2025-12-08 11:17:20,449] Trial 18 finished with value: 0.2737366484335267 and parameters: {'model_type': 'gcn', 'hidden_dims': '[512, 128]', 'dropout': 0.3736416722245185, 'batch_norm': False, 'lr': 0.00018536284099115796, 'weight_decay': 2.9324006723615776e-06, 'epochs': 235, 'loss': 'mae', 'optimizer': 'adam', 'graph_mode': 'knn', 'knn_k': 1, 'weighted_edges': False, 'symmetrize_mode': 'mutual', 'self_loops': False, 'use_snp_selection': False}. Best is trial 13 with value: 0.3095610240919141.
[I 2025-12-08 11:17:39,548] Trial 19 finished with value: 0.30677314816821816 and parameters: {'model_type': 'gcn', 'hidden_dims': '[256, 128, 64]', 'dropout': 0.5169185582297925, 'batch_norm': True, 'lr': 0.0009530190599969149, 'weight_decay': 0.0001704449447850723, 'epochs': 137, 'loss': 'mae', 'optimizer': 'adam', 'graph_mode': 'cutoff', 'cutoff': 0.7252731474860397, 'grm_norm': 'cosine_then_gcn', 'self_loops': False, 'use_snp_selection': False}. Best is trial 13 with value: 0.3095610240919141.
[I 2025-12-08 11:18:02,608] Trial 20 finished with value: 0.23012370868570936 and parameters: {'model_type': 'gcn', 'hidden_dims': '[256, 128, 64]', 'dropout': 0.5985539862625942, 'batch_norm': True, 'lr': 0.00343525119399262, 'weight_decay': 0.000956358261404014, 'epochs': 163, 'loss': 'mae', 'optimizer': 'adam', 'graph_mode': 'cutoff', 'cutoff': 0.2386548621641688, 'grm_norm': 'cosine_then_gcn', 'self_loops': False, 'use_snp_selection': False}. Best is trial 13 with value: 0.3095610240919141.
[I 2025-12-08 11:18:21,058] Trial 21 finished with value: 0.30685545644738454 and parameters: {'model_type': 'gcn', 'hidden_dims': '[256, 128, 64]', 'dropout': 0.5013725835119869, 'batch_norm': True, 'lr': 0.0009362896808502127, 'weight_decay': 0.00014573176680738985, 'epochs': 130, 'loss': 'mae', 'optimizer': 'adam', 'graph_mode': 'cutoff', 'cutoff': 0.719299448974299, 'grm_norm': 'cosine_then_gcn', 'self_loops': False, 'use_snp_selection': False}. Best is trial 13 with value: 0.3095610240919141.
[I 2025-12-08 11:18:32,693] Trial 22 finished with value: 0.3066989357396065 and parameters: {'model_type': 'gcn', 'hidden_dims': '[256, 128]', 'dropout': 0.5202581931572783, 'batch_norm': True, 'lr': 0.0009872935170749443, 'weight_decay': 0.00013385326063968572, 'epochs': 78, 'loss': 'mae', 'optimizer': 'adam', 'graph_mode': 'cutoff', 'cutoff': 0.6956258088555951, 'grm_norm': 'cosine_then_gcn', 'self_loops': False, 'use_snp_selection': False}. Best is trial 13 with value: 0.3095610240919141.
