[I 2025-12-08 21:47:22,762] Trial 116 finished with value: 0.2719235468283843 and parameters: {'model_type': 'gcn', 'hidden_dims': '[512, 64]', 'dropout': 0.1334983910881599, 'batch_norm': True, 'lr': 6.075626441215175e-05, 'weight_decay': 7.624795095910567e-05, 'epochs': 231, 'loss': 'mae', 'optimizer': 'adam', 'graph_mode': 'cutoff', 'cutoff': 0.781061904899452, 'grm_norm': 'gcn', 'self_loops': True, 'use_snp_selection': True, 'num_snps': 57995}. Best is trial 97 with value: 0.2971112464959694.
[I 2025-12-08 21:48:20,050] Trial 117 finished with value: 0.2704452169407551 and parameters: {'model_type': 'gcn', 'hidden_dims': '[512, 128]', 'dropout': 0.1818988545097849, 'batch_norm': True, 'lr': 4.470967165620848e-05, 'weight_decay': 2.963430238032044e-05, 'epochs': 215, 'loss': 'mae', 'optimizer': 'adam', 'graph_mode': 'cutoff', 'cutoff': 0.73678250005438, 'grm_norm': 'gcn', 'self_loops': True, 'use_snp_selection': True, 'num_snps': 51403}. Best is trial 97 with value: 0.2971112464959694.
[I 2025-12-08 21:49:10,247] Trial 118 finished with value: 0.27914186627072624 and parameters: {'model_type': 'gcn', 'hidden_dims': '[512, 128]', 'dropout': 0.12391767444017353, 'batch_norm': True, 'lr': 0.00023472048774587315, 'weight_decay': 0.00013683765107614014, 'epochs': 187, 'loss': 'mae', 'optimizer': 'adam', 'graph_mode': 'cutoff', 'cutoff': 0.6749042996504898, 'grm_norm': 'gcn', 'self_loops': True, 'use_snp_selection': True, 'num_snps': 48958}. Best is trial 97 with value: 0.2971112464959694.
[I 2025-12-08 21:49:37,195] Trial 119 finished with value: 0.27158319971516737 and parameters: {'model_type': 'gcn', 'hidden_dims': '[128, 64]', 'dropout': 0.10979447644026216, 'batch_norm': True, 'lr': 0.00010834347253476121, 'weight_decay': 4.783157264469522e-05, 'epochs': 247, 'loss': 'mae', 'optimizer': 'adam', 'graph_mode': 'cutoff', 'cutoff': 0.7843851311411426, 'grm_norm': 'gcn', 'self_loops': True, 'use_snp_selection': True, 'num_snps': 42671}. Best is trial 97 with value: 0.2971112464959694.
[I 2025-12-08 21:50:10,592] Trial 120 finished with value: 0.20118655638272234 and parameters: {'model_type': 'gcn', 'hidden_dims': '[256, 128, 64]', 'dropout': 0.10002980447612164, 'batch_norm': True, 'lr': 0.0003438382547114225, 'weight_decay': 9.372071593573294e-05, 'epochs': 193, 'loss': 'mae', 'optimizer': 'adam', 'graph_mode': 'cutoff', 'cutoff': 0.47485718486115003, 'grm_norm': 'gcn', 'self_loops': True, 'use_snp_selection': True, 'num_snps': 44459}. Best is trial 97 with value: 0.2971112464959694.
[I 2025-12-08 21:51:01,573] Trial 121 finished with value: 0.2846189504836109 and parameters: {'model_type': 'gcn', 'hidden_dims': '[512, 128]', 'dropout': 0.16516070173075134, 'batch_norm': True, 'lr': 5.44510727561145e-05, 'weight_decay': 3.525077321958291e-05, 'epochs': 174, 'loss': 'mae', 'optimizer': 'adam', 'graph_mode': 'cutoff', 'cutoff': 0.7635962870436304, 'grm_norm': 'gcn', 'self_loops': True, 'use_snp_selection': True, 'num_snps': 53234}. Best is trial 97 with value: 0.2971112464959694.
[I 2025-12-08 21:52:13,017] Trial 122 finished with value: 0.28226061076390735 and parameters: {'model_type': 'gcn', 'hidden_dims': '[512, 128]', 'dropout': 0.14841703361326755, 'batch_norm': False, 'lr': 0.00015153810423923988, 'weight_decay': 5.9311351860522925e-05, 'epochs': 325, 'loss': 'mae', 'optimizer': 'adam', 'graph_mode': 'cutoff', 'cutoff': 0.7156921361391757, 'grm_norm': 'cosine', 'self_loops': True, 'use_snp_selection': True, 'num_snps': 46630}. Best is trial 97 with value: 0.2971112464959694.
[I 2025-12-08 21:53:13,992] Trial 123 finished with value: 0.28190411718613345 and parameters: {'model_type': 'gcn', 'hidden_dims': '[512, 128]', 'dropout': 0.3284563304244899, 'batch_norm': True, 'lr': 0.00019039735387581036, 'weight_decay': 4.34800921629619e-05, 'epochs': 206, 'loss': 'mae', 'optimizer': 'adam', 'graph_mode': 'cutoff', 'cutoff': 0.8188404756538096, 'grm_norm': 'gcn', 'self_loops': True, 'use_snp_selection': True, 'num_snps': 57344}. Best is trial 97 with value: 0.2971112464959694.
[I 2025-12-08 21:53:59,871] Trial 124 finished with value: 0.2782108258138078 and parameters: {'model_type': 'gcn', 'hidden_dims': '[512, 256]', 'dropout': 0.1368071048773609, 'batch_norm': True, 'lr': 7.21190791663345e-05, 'weight_decay': 2.3921310395512072e-05, 'epochs': 202, 'loss': 'mae', 'optimizer': 'adam', 'graph_mode': 'cutoff', 'cutoff': 0.7883212816131403, 'grm_norm': 'gcn', 'self_loops': True, 'use_snp_selection': True, 'num_snps': 40814}. Best is trial 97 with value: 0.2971112464959694.
[I 2025-12-08 21:54:42,393] Trial 125 finished with value: 0.24897284386806798 and parameters: {'model_type': 'gcn', 'hidden_dims': '[512, 128]', 'dropout': 0.12641580118625056, 'batch_norm': True, 'lr': 3.1089507476630644e-05, 'weight_decay': 2.933488213401934e-05, 'epochs': 165, 'loss': 'mae', 'optimizer': 'adam', 'graph_mode': 'cutoff', 'cutoff': 0.759134543997425, 'grm_norm': 'gcn', 'self_loops': True, 'use_snp_selection': True, 'num_snps': 43245}. Best is trial 97 with value: 0.2971112464959694.
[I 2025-12-08 21:55:16,163] Trial 126 finished with value: 0.28275805074936466 and parameters: {'model_type': 'gcn', 'hidden_dims': '[512, 256]', 'dropout': 0.536744616555489, 'batch_norm': True, 'lr': 2.014537685335583e-05, 'weight_decay': 7.08776938570715e-05, 'epochs': 177, 'loss': 'mae', 'optimizer': 'adam', 'graph_mode': 'cutoff', 'cutoff': 0.8840844869341771, 'grm_norm': 'gcn', 'self_loops': True, 'use_snp_selection': True, 'num_snps': 30316}. Best is trial 97 with value: 0.2971112464959694.
[I 2025-12-08 21:56:11,041] Trial 127 finished with value: 0.28625092490062765 and parameters: {'model_type': 'gcn', 'hidden_dims': '[512, 128]', 'dropout': 0.11558187194138729, 'batch_norm': True, 'lr': 0.00010042850166207277, 'weight_decay': 5.531439815821018e-05, 'epochs': 217, 'loss': 'mae', 'optimizer': 'adam', 'graph_mode': 'cutoff', 'cutoff': 0.8371323710758294, 'grm_norm': 'cosine', 'self_loops': True, 'use_snp_selection': True, 'num_snps': 48344}. Best is trial 97 with value: 0.2971112464959694.
[I 2025-12-08 21:56:55,803] Trial 128 finished with value: 0.2856924079916042 and parameters: {'model_type': 'gcn', 'hidden_dims': '[512, 128]', 'dropout': 0.5554153986453281, 'batch_norm': False, 'lr': 8.756373201244727e-05, 'weight_decay': 3.920724239551565e-05, 'epochs': 235, 'loss': 'mae', 'optimizer': 'adam', 'graph_mode': 'cutoff', 'cutoff': 0.80366333894213, 'grm_norm': 'gcn', 'self_loops': True, 'use_snp_selection': True, 'num_snps': 34970}. Best is trial 97 with value: 0.2971112464959694.
[I 2025-12-08 21:57:44,053] Trial 129 finished with value: 0.22007997233043156 and parameters: {'model_type': 'gcn', 'hidden_dims': '[512, 64]', 'dropout': 0.3075515394400536, 'batch_norm': True, 'lr': 7.012365048565214e-05, 'weight_decay': 9.273065954305502e-05, 'epochs': 225, 'loss': 'mae', 'optimizer': 'adam', 'graph_mode': 'knn', 'knn_k': 5, 'weighted_edges': False, 'symmetrize_mode': 'mutual', 'self_loops': True, 'use_snp_selection': True, 'num_snps': 39000}. Best is trial 97 with value: 0.2971112464959694.
[I 2025-12-08 21:58:31,779] Trial 130 finished with value: 0.28284922144670555 and parameters: {'model_type': 'gcn', 'hidden_dims': '[512, 256]', 'dropout': 0.35394181387080853, 'batch_norm': True, 'lr': 4.0470459538118e-05, 'weight_decay': 1.8568454076866584e-05, 'epochs': 160, 'loss': 'mae', 'optimizer': 'adam', 'graph_mode': 'cutoff', 'cutoff': 0.657444642295829, 'grm_norm': 'none', 'self_loops': True, 'use_snp_selection': True, 'num_snps': 52002}. Best is trial 97 with value: 0.2971112464959694.
[I 2025-12-08 21:59:04,097] Trial 131 finished with value: 0.27778250916873654 and parameters: {'model_type': 'gcn', 'hidden_dims': '[512, 128]', 'dropout': 0.15367789806778898, 'batch_norm': True, 'lr': 0.0001036071082546598, 'weight_decay': 4.5388318217014296e-05, 'epochs': 83, 'loss': 'mae', 'optimizer': 'adam', 'graph_mode': 'cutoff', 'cutoff': 0.8533590105246137, 'grm_norm': 'gcn', 'self_loops': True, 'use_snp_selection': True, 'num_snps': 50505}. Best is trial 97 with value: 0.2971112464959694.
[I 2025-12-08 21:59:53,528] Trial 132 finished with value: 0.2517570003757842 and parameters: {'model_type': 'gcn', 'hidden_dims': '[512, 128]', 'dropout': 0.397536674222296, 'batch_norm': True, 'lr': 0.0006942794104135965, 'weight_decay': 6.340337851763593e-05, 'epochs': 187, 'loss': 'mae', 'optimizer': 'adam', 'graph_mode': 'cutoff', 'cutoff': 0.2177248886393195, 'grm_norm': 'gcn', 'self_loops': True, 'use_snp_selection': True, 'num_snps': 46012}. Best is trial 97 with value: 0.2971112464959694.
[I 2025-12-08 22:00:28,099] Trial 133 finished with value: 0.28374741011177707 and parameters: {'model_type': 'gcn', 'hidden_dims': '[512, 128]', 'dropout': 0.36429796822311283, 'batch_norm': True, 'lr': 0.00012221047399182662, 'weight_decay': 3.2441812012845754e-05, 'epochs': 171, 'loss': 'mae', 'optimizer': 'adam', 'graph_mode': 'cutoff', 'cutoff': 0.8261087866801102, 'grm_norm': 'none', 'self_loops': True, 'use_snp_selection': True, 'num_snps': 32732}. Best is trial 97 with value: 0.2971112464959694.
[I 2025-12-08 22:01:33,946] Trial 134 finished with value: 0.26111161267357474 and parameters: {'model_type': 'gcn', 'hidden_dims': '[512, 128]', 'dropout': 0.49401509365109547, 'batch_norm': True, 'lr': 0.009284899210665106, 'weight_decay': 0.00011597708109324597, 'epochs': 242, 'loss': 'mae', 'optimizer': 'adam', 'graph_mode': 'cutoff', 'cutoff': 0.7716963763339634, 'grm_norm': 'cosine', 'self_loops': True, 'use_snp_selection': True, 'num_snps': 54846}. Best is trial 97 with value: 0.2971112464959694.
[I 2025-12-08 22:01:52,049] Trial 135 finished with value: 0.27044417242088675 and parameters: {'model_type': 'gcn', 'hidden_dims': '[128, 64]', 'dropout': 0.17478891213094241, 'batch_norm': True, 'lr': 6.439839483942413e-05, 'weight_decay': 8.087022600737004e-05, 'epochs': 73, 'loss': 'mae', 'optimizer': 'adam', 'graph_mode': 'cutoff', 'cutoff': 0.8177361882583866, 'grm_norm': 'gcn', 'self_loops': True, 'use_snp_selection': True, 'num_snps': 41707}. Best is trial 97 with value: 0.2971112464959694.
[I 2025-12-08 22:02:45,178] Trial 136 finished with value: 0.28275738317351473 and parameters: {'model_type': 'gcn', 'hidden_dims': '[512, 256]', 'dropout': 0.4573214636161956, 'batch_norm': True, 'lr': 5.0154401879045526e-05, 'weight_decay': 5.326289403295307e-05, 'epochs': 209, 'loss': 'mae', 'optimizer': 'adam', 'graph_mode': 'cutoff', 'cutoff': 0.7394119674098069, 'grm_norm': 'gcn', 'self_loops': False, 'use_snp_selection': True, 'num_snps': 47768}. Best is trial 97 with value: 0.2971112464959694.
[I 2025-12-08 22:03:02,505] Trial 137 finished with value: 0.2452784583861835 and parameters: {'model_type': 'gcn', 'hidden_dims': '[256, 128, 64]', 'dropout': 0.12217438609335468, 'batch_norm': True, 'lr': 1.5319308387782057e-05, 'weight_decay': 0.0001647620735811406, 'epochs': 154, 'loss': 'mae', 'optimizer': 'adam', 'graph_mode': 'cutoff', 'cutoff': 0.698402575690392, 'grm_norm': 'none', 'self_loops': True, 'use_snp_selection': True, 'num_snps': 16355}. Best is trial 97 with value: 0.2971112464959694.
[I 2025-12-08 22:03:23,214] Trial 138 finished with value: 0.2778842385525343 and parameters: {'model_type': 'gcn', 'hidden_dims': '[512, 128]', 'dropout': 0.4727969676519459, 'batch_norm': False, 'lr': 0.00013900846993768017, 'weight_decay': 2.5732797122260404e-05, 'epochs': 194, 'loss': 'mae', 'optimizer': 'adam', 'graph_mode': 'cutoff', 'cutoff': 0.7980322988965391, 'grm_norm': 'gcn', 'self_loops': False, 'use_snp_selection': True, 'num_snps': 13786}. Best is trial 97 with value: 0.2971112464959694.
[I 2025-12-08 22:04:09,316] Trial 139 finished with value: 0.2745120666191446 and parameters: {'model_type': 'gcn', 'hidden_dims': '[512, 128]', 'dropout': 0.14290407038705571, 'batch_norm': True, 'lr': 8.14406719950716e-05, 'weight_decay': 1.1514344170805445e-06, 'epochs': 180, 'loss': 'mse', 'optimizer': 'adam', 'graph_mode': 'cutoff', 'cutoff': 0.8594831759254016, 'grm_norm': 'gcn', 'self_loops': True, 'use_snp_selection': False}. Best is trial 97 with value: 0.2971112464959694.
[I 2025-12-08 22:04:27,510] Trial 140 finished with value: 0.28621979855341523 and parameters: {'model_type': 'gcn', 'hidden_dims': '[512, 256]', 'dropout': 0.2772777876620546, 'batch_norm': True, 'lr': 0.00016598801700943414, 'weight_decay': 3.7448511547938914e-05, 'epochs': 61, 'loss': 'mae', 'optimizer': 'adam', 'graph_mode': 'cutoff', 'cutoff': 0.8379095197516981, 'grm_norm': 'cosine', 'self_loops': True, 'use_snp_selection': True, 'num_snps': 24611}. Best is trial 97 with value: 0.2971112464959694.
[I 2025-12-08 22:05:16,168] Trial 141 finished with value: 0.2868680906447939 and parameters: {'model_type': 'gcn', 'hidden_dims': '[512, 128]', 'dropout': 0.13709115289749002, 'batch_norm': True, 'lr': 0.0001148577218614579, 'weight_decay': 4.5516647548069456e-05, 'epochs': 202, 'loss': 'mae', 'optimizer': 'adam', 'graph_mode': 'cutoff', 'cutoff': 0.7112357345006479, 'grm_norm': 'gcn', 'self_loops': True, 'use_snp_selection': True, 'num_snps': 44048}. Best is trial 97 with value: 0.2971112464959694.
[I 2025-12-08 22:06:10,931] Trial 142 finished with value: 0.2859301542878801 and parameters: {'model_type': 'gcn', 'hidden_dims': '[512, 128]', 'dropout': 0.16120377363613694, 'batch_norm': True, 'lr': 0.00011987169922923578, 'weight_decay': 4.454144088152191e-05, 'epochs': 231, 'loss': 'mae', 'optimizer': 'adam', 'graph_mode': 'cutoff', 'cutoff': 0.7188424715923685, 'grm_norm': 'gcn', 'self_loops': True, 'use_snp_selection': True, 'num_snps': 45037}. Best is trial 97 with value: 0.2971112464959694.
[I 2025-12-08 22:07:00,924] Trial 143 finished with value: 0.2703703765124728 and parameters: {'model_type': 'gcn', 'hidden_dims': '[512, 128]', 'dropout': 0.14469533201812057, 'batch_norm': True, 'lr': 9.13162370709446e-05, 'weight_decay': 3.146476771416714e-05, 'epochs': 219, 'loss': 'mae', 'optimizer': 'adam', 'graph_mode': 'cutoff', 'cutoff': 0.724224640147209, 'grm_norm': 'gcn', 'self_loops': True, 'use_snp_selection': True, 'num_snps': 42446}. Best is trial 97 with value: 0.2971112464959694.
[I 2025-12-08 22:07:57,419] Trial 144 finished with value: 0.27484295679314275 and parameters: {'model_type': 'gcn', 'hidden_dims': '[512, 128]', 'dropout': 0.1978046064815976, 'batch_norm': True, 'lr': 0.00010976868624321401, 'weight_decay': 6.73779283678496e-05, 'epochs': 241, 'loss': 'mae', 'optimizer': 'adam', 'graph_mode': 'cutoff', 'cutoff': 0.7758410161428891, 'grm_norm': 'gcn', 'self_loops': True, 'use_snp_selection': True, 'num_snps': 44965}. Best is trial 97 with value: 0.2971112464959694.
[I 2025-12-08 22:08:59,755] Trial 145 finished with value: 0.28442454591338073 and parameters: {'model_type': 'gcn', 'hidden_dims': '[512, 128]', 'dropout': 0.5092611461942826, 'batch_norm': True, 'lr': 0.00019549433751584686, 'weight_decay': 2.1436918950687026e-05, 'epochs': 251, 'loss': 'mae', 'optimizer': 'adam', 'graph_mode': 'cutoff', 'cutoff': 0.7579517761709667, 'grm_norm': 'gcn', 'self_loops': False, 'use_snp_selection': True, 'num_snps': 49795}. Best is trial 97 with value: 0.2971112464959694.
[I 2025-12-08 22:09:24,176] Trial 146 finished with value: 0.2709777691072547 and parameters: {'model_type': 'gcn', 'hidden_dims': '[512, 128]', 'dropout': 0.1318329756401266, 'batch_norm': True, 'lr': 0.0005201530871792811, 'weight_decay': 3.9405058764111435e-05, 'epochs': 47, 'loss': 'mae', 'optimizer': 'adam', 'graph_mode': 'cutoff', 'cutoff': 0.5828134838538206, 'grm_norm': 'none', 'self_loops': True, 'use_snp_selection': True, 'num_snps': 46766}. Best is trial 97 with value: 0.2971112464959694.
[I 2025-12-08 22:10:32,959] Trial 147 finished with value: 0.2837156276816719 and parameters: {'model_type': 'gcn', 'hidden_dims': '[512, 256]', 'dropout': 0.5792273057053675, 'batch_norm': True, 'lr': 0.00014238334211788182, 'weight_decay': 5.4425730514608475e-05, 'epochs': 267, 'loss': 'mae', 'optimizer': 'adam', 'graph_mode': 'cutoff', 'cutoff': 0.8112392288810779, 'grm_norm': 'gcn', 'self_loops': True, 'use_snp_selection': True, 'num_snps': 52666}. Best is trial 97 with value: 0.2971112464959694.
[I 2025-12-08 22:11:09,516] Trial 148 finished with value: 0.28739865740039533 and parameters: {'model_type': 'gcn', 'hidden_dims': '[512, 128]', 'dropout': 0.11304401650259734, 'batch_norm': True, 'lr': 7.775351566211686e-05, 'weight_decay': 0.00013697660134968418, 'epochs': 228, 'loss': 'mae', 'optimizer': 'adam', 'graph_mode': 'cutoff', 'cutoff': 0.7907239610051559, 'grm_norm': 'gcn', 'self_loops': False, 'use_snp_selection': True, 'num_snps': 27464}. Best is trial 97 with value: 0.2971112464959694.
[I 2025-12-08 22:11:45,990] Trial 149 finished with value: 0.29396843716941007 and parameters: {'model_type': 'gcn', 'hidden_dims': '[512, 128]', 'dropout': 0.10042048916629946, 'batch_norm': True, 'lr': 9.86806882148786e-05, 'weight_decay': 9.838034026516636e-05, 'epochs': 95, 'loss': 'mae', 'optimizer': 'adam', 'graph_mode': 'cutoff', 'cutoff': 0.7488250981917983, 'grm_norm': 'gcn', 'self_loops': True, 'use_snp_selection': True, 'num_snps': 54737}. Best is trial 97 with value: 0.2971112464959694.
