[I 2025-12-08 12:46:46,709] Trial 149 finished with value: 0.2896091006801192 and parameters: {'model_type': 'gcn', 'hidden_dims': '[512, 64]', 'dropout': 0.5999781051162819, 'batch_norm': True, 'lr': 4.689383762754568e-05, 'weight_decay': 2.4732838037814433e-05, 'epochs': 190, 'loss': 'mae', 'optimizer': 'adam', 'graph_mode': 'cutoff', 'cutoff': 0.544424331039529, 'grm_norm': 'gcn', 'self_loops': True, 'use_snp_selection': True, 'num_snps': 23217}. Best is trial 95 with value: 0.3724566311165337.
[I 2025-12-08 12:47:20,866] Trial 0 finished with value: 0.2787581967851451 and parameters: {'model_type': 'gcn', 'hidden_dims': '[128, 64]', 'dropout': 0.199031432379812, 'batch_norm': True, 'lr': 1.8408544111075823e-05, 'weight_decay': 5.5136510071208614e-05, 'epochs': 336, 'loss': 'mae', 'optimizer': 'adam', 'graph_mode': 'knn', 'knn_k': 8, 'weighted_edges': True, 'symmetrize_mode': 'mutual', 'self_loops': True, 'use_snp_selection': True, 'num_snps': 27173}. Best is trial 0 with value: 0.2787581967851451.
[I 2025-12-08 12:47:59,280] Trial 1 finished with value: 0.15898121847577754 and parameters: {'model_type': 'gcn', 'hidden_dims': '[256, 128, 64]', 'dropout': 0.5543244404043342, 'batch_norm': True, 'lr': 7.981787657617978e-05, 'weight_decay': 2.8571789869344834e-07, 'epochs': 297, 'loss': 'mae', 'optimizer': 'adam', 'graph_mode': 'cutoff', 'cutoff': 0.3392632777751686, 'grm_norm': 'gcn', 'self_loops': False, 'use_snp_selection': False}. Best is trial 0 with value: 0.2787581967851451.
[I 2025-12-08 12:48:57,154] Trial 2 finished with value: 0.2568898876294191 and parameters: {'model_type': 'gcn', 'hidden_dims': '[512, 64]', 'dropout': 0.32815227354739207, 'batch_norm': True, 'lr': 0.000619605044204259, 'weight_decay': 0.0004086269831625786, 'epochs': 206, 'loss': 'mse', 'optimizer': 'adam', 'graph_mode': 'knn', 'knn_k': 4, 'weighted_edges': True, 'symmetrize_mode': 'union', 'self_loops': True, 'use_snp_selection': True, 'num_snps': 53035}. Best is trial 0 with value: 0.2787581967851451.
[I 2025-12-08 12:49:24,706] Trial 3 finished with value: 0.240324269385429 and parameters: {'model_type': 'gcn', 'hidden_dims': '[256, 128]', 'dropout': 0.23110783056597514, 'batch_norm': True, 'lr': 8.11311593386298e-05, 'weight_decay': 9.296158109581328e-07, 'epochs': 213, 'loss': 'mse', 'optimizer': 'adam', 'graph_mode': 'knn', 'knn_k': 10, 'weighted_edges': True, 'symmetrize_mode': 'mutual', 'self_loops': True, 'use_snp_selection': False}. Best is trial 0 with value: 0.2787581967851451.
[I 2025-12-08 12:49:39,230] Trial 4 finished with value: 0.3553605164711059 and parameters: {'model_type': 'gcn', 'hidden_dims': '[512, 256]', 'dropout': 0.2753281956415665, 'batch_norm': True, 'lr': 0.00034435188114839693, 'weight_decay': 4.9416012835950194e-05, 'epochs': 89, 'loss': 'mae', 'optimizer': 'adam', 'graph_mode': 'cutoff', 'cutoff': 0.820078967317394, 'grm_norm': 'none', 'self_loops': False, 'use_snp_selection': True, 'num_snps': 12674}. Best is trial 4 with value: 0.3553605164711059.
[I 2025-12-08 12:50:04,356] Trial 5 finished with value: 0.32636973775630984 and parameters: {'model_type': 'gcn', 'hidden_dims': '[128, 64]', 'dropout': 0.5611163934517731, 'batch_norm': True, 'lr': 0.0003984856210762587, 'weight_decay': 1.1466743517565185e-07, 'epochs': 344, 'loss': 'mae', 'optimizer': 'adam', 'graph_mode': 'cutoff', 'cutoff': 0.6089370799714728, 'grm_norm': 'gcn', 'self_loops': True, 'use_snp_selection': False}. Best is trial 4 with value: 0.3553605164711059.
[I 2025-12-08 12:50:26,778] Trial 6 finished with value: 0.30502617327875725 and parameters: {'model_type': 'gcn', 'hidden_dims': '[128, 64]', 'dropout': 0.31805912766941713, 'batch_norm': True, 'lr': 1.2361026034262557e-05, 'weight_decay': 6.492620232791903e-06, 'epochs': 271, 'loss': 'mse', 'optimizer': 'adam', 'graph_mode': 'cutoff', 'cutoff': 0.6193362582230448, 'grm_norm': 'cosine', 'self_loops': False, 'use_snp_selection': True, 'num_snps': 28594}. Best is trial 4 with value: 0.3553605164711059.
[I 2025-12-08 12:50:46,512] Trial 7 finished with value: 0.2421780223473399 and parameters: {'model_type': 'gcn', 'hidden_dims': '[512, 64]', 'dropout': 0.471337288649717, 'batch_norm': True, 'lr': 2.239693207292708e-05, 'weight_decay': 2.263166635514082e-06, 'epochs': 69, 'loss': 'mse', 'optimizer': 'adam', 'graph_mode': 'cutoff', 'cutoff': 0.4056820886426376, 'grm_norm': 'cosine', 'self_loops': False, 'use_snp_selection': False}. Best is trial 4 with value: 0.3553605164711059.
[I 2025-12-08 12:51:24,030] Trial 8 finished with value: 0.34091544650113265 and parameters: {'model_type': 'gcn', 'hidden_dims': '[512, 256]', 'dropout': 0.20659328268932406, 'batch_norm': False, 'lr': 8.93315124361372e-05, 'weight_decay': 0.00028987480727919035, 'epochs': 136, 'loss': 'mae', 'optimizer': 'adam', 'graph_mode': 'knn', 'knn_k': 3, 'weighted_edges': False, 'symmetrize_mode': 'union', 'self_loops': False, 'use_snp_selection': True, 'num_snps': 43128}. Best is trial 4 with value: 0.3553605164711059.
[I 2025-12-08 12:52:06,141] Trial 9 finished with value: -0.0027805356123113967 and parameters: {'model_type': 'gcn', 'hidden_dims': '[512, 256]', 'dropout': 0.2888209592870401, 'batch_norm': False, 'lr': 0.004734648143129892, 'weight_decay': 1.5879705591356368e-06, 'epochs': 163, 'loss': 'mse', 'optimizer': 'adam', 'graph_mode': 'cutoff', 'cutoff': 0.5984899797909019, 'grm_norm': 'cosine', 'self_loops': True, 'use_snp_selection': False}. Best is trial 4 with value: 0.3553605164711059.
[I 2025-12-08 12:52:15,367] Trial 10 finished with value: 0.3341655136203662 and parameters: {'model_type': 'gcn', 'hidden_dims': '[512, 128]', 'dropout': 0.11372025982957354, 'batch_norm': False, 'lr': 0.0023343012062770553, 'weight_decay': 4.14440562940608e-05, 'epochs': 41, 'loss': 'mae', 'optimizer': 'adam', 'graph_mode': 'cutoff', 'cutoff': 0.8740100033033124, 'grm_norm': 'none', 'self_loops': False, 'use_snp_selection': True, 'num_snps': 3859}. Best is trial 4 with value: 0.3553605164711059.
[I 2025-12-08 12:52:51,580] Trial 11 finished with value: 0.3361540984986937 and parameters: {'model_type': 'gcn', 'hidden_dims': '[512, 256]', 'dropout': 0.42220860806405436, 'batch_norm': False, 'lr': 0.00012587284186352953, 'weight_decay': 0.0006590033092812647, 'epochs': 114, 'loss': 'mae', 'optimizer': 'adam', 'graph_mode': 'knn', 'knn_k': 1, 'weighted_edges': False, 'symmetrize_mode': 'union', 'self_loops': False, 'use_snp_selection': True, 'num_snps': 47068}. Best is trial 4 with value: 0.3553605164711059.
[I 2025-12-08 12:53:06,172] Trial 12 finished with value: 0.3418568186812013 and parameters: {'model_type': 'gcn', 'hidden_dims': '[512, 256]', 'dropout': 0.14142767069304862, 'batch_norm': False, 'lr': 0.0011798598123878552, 'weight_decay': 9.414718277089941e-05, 'epochs': 124, 'loss': 'mae', 'optimizer': 'adam', 'graph_mode': 'knn', 'knn_k': 3, 'weighted_edges': False, 'symmetrize_mode': 'union', 'self_loops': False, 'use_snp_selection': True, 'num_snps': 8584}. Best is trial 4 with value: 0.3553605164711059.
[I 2025-12-08 12:53:18,905] Trial 13 finished with value: 0.34010762949229606 and parameters: {'model_type': 'gcn', 'hidden_dims': '[512, 256]', 'dropout': 0.13529665206282515, 'batch_norm': False, 'lr': 0.0013143362382724787, 'weight_decay': 5.2475435102613655e-05, 'epochs': 101, 'loss': 'mae', 'optimizer': 'adam', 'graph_mode': 'knn', 'knn_k': 6, 'weighted_edges': False, 'symmetrize_mode': 'union', 'self_loops': False, 'use_snp_selection': True, 'num_snps': 5870}. Best is trial 4 with value: 0.3553605164711059.
[I 2025-12-08 12:53:40,418] Trial 14 finished with value: 0.3554978132300685 and parameters: {'model_type': 'gcn', 'hidden_dims': '[512, 256]', 'dropout': 0.25632205209505254, 'batch_norm': False, 'lr': 0.0009612459132665168, 'weight_decay': 2.2203297076850073e-05, 'epochs': 165, 'loss': 'mae', 'optimizer': 'adam', 'graph_mode': 'cutoff', 'cutoff': 0.8944237199027842, 'grm_norm': 'none', 'self_loops': False, 'use_snp_selection': True, 'num_snps': 15654}. Best is trial 14 with value: 0.3554978132300685.
[I 2025-12-08 12:53:59,152] Trial 15 finished with value: 0.17452160003751388 and parameters: {'model_type': 'gcn', 'hidden_dims': '[256, 128, 64]', 'dropout': 0.400283527263757, 'batch_norm': False, 'lr': 0.008017119310501081, 'weight_decay': 1.3728672854267767e-05, 'epochs': 164, 'loss': 'mae', 'optimizer': 'adam', 'graph_mode': 'cutoff', 'cutoff': 0.8872255416714164, 'grm_norm': 'none', 'self_loops': False, 'use_snp_selection': True, 'num_snps': 18030}. Best is trial 14 with value: 0.3554978132300685.
[I 2025-12-08 12:54:27,001] Trial 16 finished with value: 0.3490863596464301 and parameters: {'model_type': 'gcn', 'hidden_dims': '[512, 128]', 'dropout': 0.26504450412433567, 'batch_norm': True, 'lr': 0.0002698949967223157, 'weight_decay': 1.535136061044636e-05, 'epochs': 243, 'loss': 'mae', 'optimizer': 'adam', 'graph_mode': 'cutoff', 'cutoff': 0.7714575519927706, 'grm_norm': 'none', 'self_loops': False, 'use_snp_selection': True, 'num_snps': 16805}. Best is trial 14 with value: 0.3554978132300685.
[I 2025-12-08 12:54:43,486] Trial 17 finished with value: 0.35854154197451216 and parameters: {'model_type': 'gcn', 'hidden_dims': '[512, 256]', 'dropout': 0.40340011562026795, 'batch_norm': False, 'lr': 0.00020720022527164094, 'weight_decay': 0.00016580623989172948, 'epochs': 79, 'loss': 'mae', 'optimizer': 'adam', 'graph_mode': 'cutoff', 'cutoff': 0.7430449078328386, 'grm_norm': 'cosine_then_gcn', 'self_loops': False, 'use_snp_selection': True, 'num_snps': 17161}. Best is trial 17 with value: 0.35854154197451216.
[I 2025-12-08 12:55:02,598] Trial 18 finished with value: 0.3453796834379983 and parameters: {'model_type': 'gcn', 'hidden_dims': '[256, 128]', 'dropout': 0.38002237069221595, 'batch_norm': False, 'lr': 0.0001802713188812398, 'weight_decay': 0.00016545001671180887, 'epochs': 164, 'loss': 'mae', 'optimizer': 'adam', 'graph_mode': 'cutoff', 'cutoff': 0.7266216791720945, 'grm_norm': 'cosine_then_gcn', 'self_loops': False, 'use_snp_selection': True, 'num_snps': 20576}. Best is trial 17 with value: 0.35854154197451216.
[I 2025-12-08 12:55:22,879] Trial 19 finished with value: 0.2611265153976792 and parameters: {'model_type': 'gcn', 'hidden_dims': '[512, 256]', 'dropout': 0.46201114806835597, 'batch_norm': False, 'lr': 3.631841990198277e-05, 'weight_decay': 0.0009701619377086421, 'epochs': 43, 'loss': 'mae', 'optimizer': 'adam', 'graph_mode': 'cutoff', 'cutoff': 0.7032102712821022, 'grm_norm': 'cosine_then_gcn', 'self_loops': False, 'use_snp_selection': True, 'num_snps': 36236}. Best is trial 17 with value: 0.35854154197451216.
[I 2025-12-08 12:55:42,096] Trial 20 finished with value: 0.335445239308963 and parameters: {'model_type': 'gcn', 'hidden_dims': '[512, 256]', 'dropout': 0.3616577749921118, 'batch_norm': False, 'lr': 0.0008210667135244359, 'weight_decay': 6.522820629852517e-06, 'epochs': 73, 'loss': 'mae', 'optimizer': 'adam', 'graph_mode': 'cutoff', 'cutoff': 0.45643619734504937, 'grm_norm': 'cosine_then_gcn', 'self_loops': False, 'use_snp_selection': True, 'num_snps': 23977}. Best is trial 17 with value: 0.35854154197451216.
[I 2025-12-08 12:55:56,351] Trial 21 finished with value: 0.363823997997021 and parameters: {'model_type': 'gcn', 'hidden_dims': '[512, 256]', 'dropout': 0.2667359562450607, 'batch_norm': False, 'lr': 0.00031979241818908785, 'weight_decay': 2.7806336869384446e-05, 'epochs': 87, 'loss': 'mae', 'optimizer': 'adam', 'graph_mode': 'cutoff', 'cutoff': 0.7990457618079614, 'grm_norm': 'none', 'self_loops': False, 'use_snp_selection': True, 'num_snps': 12031}. Best is trial 21 with value: 0.363823997997021.
[I 2025-12-08 12:56:15,016] Trial 22 finished with value: 0.32253869503389154 and parameters: {'model_type': 'gcn', 'hidden_dims': '[512, 256]', 'dropout': 0.23200037137786328, 'batch_norm': False, 'lr': 0.00045432497087776727, 'weight_decay': 2.2482314481484666e-05, 'epochs': 136, 'loss': 'mae', 'optimizer': 'adam', 'graph_mode': 'cutoff', 'cutoff': 0.22741233013859558, 'grm_norm': 'none', 'self_loops': False, 'use_snp_selection': True, 'num_snps': 12920}. Best is trial 21 with value: 0.363823997997021.
[I 2025-12-08 12:56:28,841] Trial 23 finished with value: 0.2596065520249226 and parameters: {'model_type': 'gcn', 'hidden_dims': '[512, 256]', 'dropout': 0.506389430534995, 'batch_norm': False, 'lr': 0.002724576203998551, 'weight_decay': 0.0001623256129185234, 'epochs': 65, 'loss': 'mae', 'optimizer': 'adam', 'graph_mode': 'cutoff', 'cutoff': 0.7964442894859359, 'grm_norm': 'cosine_then_gcn', 'self_loops': False, 'use_snp_selection': True, 'num_snps': 13316}. Best is trial 21 with value: 0.363823997997021.
[I 2025-12-08 12:56:48,652] Trial 24 finished with value: 0.3608780716666412 and parameters: {'model_type': 'gcn', 'hidden_dims': '[512, 256]', 'dropout': 0.17347596721102898, 'batch_norm': False, 'lr': 0.00023234389242534638, 'weight_decay': 4.021426955268786e-06, 'epochs': 97, 'loss': 'mae', 'optimizer': 'adam', 'graph_mode': 'cutoff', 'cutoff': 0.8993430062107975, 'grm_norm': 'none', 'self_loops': False, 'use_snp_selection': True, 'num_snps': 21198}. Best is trial 21 with value: 0.363823997997021.
[I 2025-12-08 12:57:08,041] Trial 25 finished with value: 0.334867372032382 and parameters: {'model_type': 'gcn', 'hidden_dims': '[512, 64]', 'dropout': 0.1774398983370731, 'batch_norm': False, 'lr': 0.0001995157834181454, 'weight_decay': 4.20571862521783e-06, 'epochs': 90, 'loss': 'mae', 'optimizer': 'adam', 'graph_mode': 'cutoff', 'cutoff': 0.6915644483726264, 'grm_norm': 'none', 'self_loops': False, 'use_snp_selection': True, 'num_snps': 21787}. Best is trial 21 with value: 0.363823997997021.
[I 2025-12-08 12:57:36,957] Trial 26 finished with value: 0.3613271059904407 and parameters: {'model_type': 'gcn', 'hidden_dims': '[512, 128]', 'dropout': 0.16025545886866022, 'batch_norm': False, 'lr': 5.764161313333884e-05, 'weight_decay': 5.839605599746252e-07, 'epochs': 108, 'loss': 'mse', 'optimizer': 'adam', 'graph_mode': 'cutoff', 'cutoff': 0.8124301727246825, 'grm_norm': 'cosine_then_gcn', 'self_loops': True, 'use_snp_selection': False}. Best is trial 21 with value: 0.363823997997021.
[I 2025-12-08 12:58:07,121] Trial 27 finished with value: 0.3645751345926536 and parameters: {'model_type': 'gcn', 'hidden_dims': '[512, 128]', 'dropout': 0.1526951340603662, 'batch_norm': False, 'lr': 4.171246286983719e-05, 'weight_decay': 5.775034867692897e-07, 'epochs': 114, 'loss': 'mse', 'optimizer': 'adam', 'graph_mode': 'cutoff', 'cutoff': 0.8219181005061634, 'grm_norm': 'none', 'self_loops': True, 'use_snp_selection': False}. Best is trial 27 with value: 0.3645751345926536.
[I 2025-12-08 12:58:53,966] Trial 28 finished with value: 0.3626733466619399 and parameters: {'model_type': 'gcn', 'hidden_dims': '[512, 128]', 'dropout': 0.15540319451813603, 'batch_norm': False, 'lr': 4.6891670461520086e-05, 'weight_decay': 6.085476084463971e-07, 'epochs': 184, 'loss': 'mse', 'optimizer': 'adam', 'graph_mode': 'cutoff', 'cutoff': 0.6628559720343925, 'grm_norm': 'gcn', 'self_loops': True, 'use_snp_selection': False}. Best is trial 27 with value: 0.3645751345926536.
[I 2025-12-08 12:59:41,515] Trial 29 finished with value: 0.36519233280734376 and parameters: {'model_type': 'gcn', 'hidden_dims': '[512, 128]', 'dropout': 0.2085154370637811, 'batch_norm': False, 'lr': 3.0916650627944025e-05, 'weight_decay': 2.868962006890503e-07, 'epochs': 186, 'loss': 'mse', 'optimizer': 'adam', 'graph_mode': 'cutoff', 'cutoff': 0.522639007616601, 'grm_norm': 'gcn', 'self_loops': True, 'use_snp_selection': False}. Best is trial 29 with value: 0.36519233280734376.
[I 2025-12-08 13:00:43,533] Trial 30 finished with value: 0.3512267140146284 and parameters: {'model_type': 'gcn', 'hidden_dims': '[512, 128]', 'dropout': 0.103587206375201, 'batch_norm': False, 'lr': 2.9461416812523167e-05, 'weight_decay': 1.6830405984018627e-07, 'epochs': 246, 'loss': 'mse', 'optimizer': 'adam', 'graph_mode': 'cutoff', 'cutoff': 0.5145876862876084, 'grm_norm': 'gcn', 'self_loops': True, 'use_snp_selection': False}. Best is trial 29 with value: 0.36519233280734376.
[I 2025-12-08 13:01:32,530] Trial 31 finished with value: 0.3605253911551346 and parameters: {'model_type': 'gcn', 'hidden_dims': '[512, 128]', 'dropout': 0.19441711632297018, 'batch_norm': False, 'lr': 1.4119122210423921e-05, 'weight_decay': 4.0707202749690965e-07, 'epochs': 193, 'loss': 'mse', 'optimizer': 'adam', 'graph_mode': 'cutoff', 'cutoff': 0.6622536427930914, 'grm_norm': 'gcn', 'self_loops': True, 'use_snp_selection': False}. Best is trial 29 with value: 0.36519233280734376.
[I 2025-12-08 13:02:49,746] Trial 32 finished with value: 0.3517588073926614 and parameters: {'model_type': 'gcn', 'hidden_dims': '[512, 128]', 'dropout': 0.21940167339509242, 'batch_norm': False, 'lr': 4.3049794802356844e-05, 'weight_decay': 2.223879540850679e-07, 'epochs': 310, 'loss': 'mse', 'optimizer': 'adam', 'graph_mode': 'cutoff', 'cutoff': 0.538349575333289, 'grm_norm': 'gcn', 'self_loops': True, 'use_snp_selection': False}. Best is trial 29 with value: 0.36519233280734376.
[I 2025-12-08 13:03:48,337] Trial 33 finished with value: 0.3538209109132019 and parameters: {'model_type': 'gcn', 'hidden_dims': '[512, 128]', 'dropout': 0.1430529898909661, 'batch_norm': False, 'lr': 2.2198285424330584e-05, 'weight_decay': 8.574016410211165e-07, 'epochs': 233, 'loss': 'mse', 'optimizer': 'adam', 'graph_mode': 'cutoff', 'cutoff': 0.645277872441429, 'grm_norm': 'gcn', 'self_loops': True, 'use_snp_selection': False}. Best is trial 29 with value: 0.36519233280734376.
[I 2025-12-08 13:04:36,297] Trial 34 finished with value: 0.3690149973398856 and parameters: {'model_type': 'gcn', 'hidden_dims': '[512, 128]', 'dropout': 0.30810496434457424, 'batch_norm': False, 'lr': 5.543859545866953e-05, 'weight_decay': 4.381833465996547e-07, 'epochs': 187, 'loss': 'mse', 'optimizer': 'adam', 'graph_mode': 'cutoff', 'cutoff': 0.46635547323692406, 'grm_norm': 'gcn', 'self_loops': True, 'use_snp_selection': False}. Best is trial 34 with value: 0.3690149973398856.
[I 2025-12-08 13:05:05,282] Trial 35 finished with value: 0.32948785828298854 and parameters: {'model_type': 'gcn', 'hidden_dims': '[256, 128, 64]', 'dropout': 0.3163029738218464, 'batch_norm': False, 'lr': 0.00010490343207872883, 'weight_decay': 2.8932537619780323e-07, 'epochs': 219, 'loss': 'mse', 'optimizer': 'adam', 'graph_mode': 'knn', 'knn_k': 10, 'weighted_edges': True, 'symmetrize_mode': 'mutual', 'self_loops': True, 'use_snp_selection': False}. Best is trial 34 with value: 0.3690149973398856.
[I 2025-12-08 13:05:43,307] Trial 36 finished with value: 0.35434128379246277 and parameters: {'model_type': 'gcn', 'hidden_dims': '[512, 128]', 'dropout': 0.2903441933122856, 'batch_norm': False, 'lr': 6.401520112347039e-05, 'weight_decay': 1.611834840048448e-06, 'epochs': 146, 'loss': 'mse', 'optimizer': 'adam', 'graph_mode': 'cutoff', 'cutoff': 0.4674803831610417, 'grm_norm': 'gcn', 'self_loops': True, 'use_snp_selection': False}. Best is trial 34 with value: 0.3690149973398856.
[I 2025-12-08 13:06:07,501] Trial 37 finished with value: 0.2681260828974065 and parameters: {'model_type': 'gcn', 'hidden_dims': '[256, 128]', 'dropout': 0.24671963296055846, 'batch_norm': True, 'lr': 0.00012064412470982236, 'weight_decay': 1.3484851568467344e-07, 'epochs': 189, 'loss': 'mse', 'optimizer': 'adam', 'graph_mode': 'cutoff', 'cutoff': 0.37042208835042656, 'grm_norm': 'none', 'self_loops': True, 'use_snp_selection': False}. Best is trial 34 with value: 0.3690149973398856.
[I 2025-12-08 13:07:16,275] Trial 38 finished with value: 0.3490689764444667 and parameters: {'model_type': 'gcn', 'hidden_dims': '[512, 128]', 'dropout': 0.32699189509905563, 'batch_norm': False, 'lr': 1.5226270341474138e-05, 'weight_decay': 3.241301896098372e-07, 'epochs': 271, 'loss': 'mse', 'optimizer': 'adam', 'graph_mode': 'cutoff', 'cutoff': 0.30770989666646803, 'grm_norm': 'gcn', 'self_loops': True, 'use_snp_selection': False}. Best is trial 34 with value: 0.3690149973398856.
[I 2025-12-08 13:07:32,260] Trial 39 finished with value: 0.32006659412206084 and parameters: {'model_type': 'gcn', 'hidden_dims': '[128, 64]', 'dropout': 0.5963156493058649, 'batch_norm': True, 'lr': 1.0579705559789613e-05, 'weight_decay': 1.0426395186918756e-07, 'epochs': 204, 'loss': 'mse', 'optimizer': 'adam', 'graph_mode': 'knn', 'knn_k': 7, 'weighted_edges': True, 'symmetrize_mode': 'mutual', 'self_loops': True, 'use_snp_selection': False}. Best is trial 34 with value: 0.3690149973398856.
[I 2025-12-08 13:08:09,855] Trial 40 finished with value: 0.35570440422421284 and parameters: {'model_type': 'gcn', 'hidden_dims': '[512, 64]', 'dropout': 0.30148966502423363, 'batch_norm': False, 'lr': 2.7891908829074773e-05, 'weight_decay': 1.0588110221493625e-06, 'epochs': 144, 'loss': 'mse', 'optimizer': 'adam', 'graph_mode': 'cutoff', 'cutoff': 0.4684036997222145, 'grm_norm': 'gcn', 'self_loops': True, 'use_snp_selection': False}. Best is trial 34 with value: 0.3690149973398856.
[I 2025-12-08 13:08:56,311] Trial 41 finished with value: 0.36530058286001194 and parameters: {'model_type': 'gcn', 'hidden_dims': '[512, 128]', 'dropout': 0.19572339018421261, 'batch_norm': False, 'lr': 5.152965040795007e-05, 'weight_decay': 5.894066017729954e-07, 'epochs': 182, 'loss': 'mse', 'optimizer': 'adam', 'graph_mode': 'cutoff', 'cutoff': 0.5731380263727025, 'grm_norm': 'gcn', 'self_loops': True, 'use_snp_selection': False}. Best is trial 34 with value: 0.3690149973398856.
