[I 2025-12-08 13:31:35,743] Trial 24 finished with value: 0.2943464739571664 and parameters: {'model_type': 'gcn', 'hidden_dims': '[512, 128]', 'dropout': 0.15533715099470383, 'batch_norm': True, 'lr': 0.0001464355443482705, 'weight_decay': 3.854724750267785e-06, 'epochs': 318, 'loss': 'mae', 'optimizer': 'adam', 'graph_mode': 'cutoff', 'cutoff': 0.7154771654348546, 'grm_norm': 'cosine_then_gcn', 'self_loops': False, 'use_snp_selection': True, 'num_snps': 20108}. Best is trial 21 with value: 0.3081373243723945.
[I 2025-12-08 13:31:58,914] Trial 25 finished with value: 0.30145884519592675 and parameters: {'model_type': 'gcn', 'hidden_dims': '[512, 128]', 'dropout': 0.24106386732875923, 'batch_norm': True, 'lr': 0.00043524510290280223, 'weight_decay': 9.310311360593536e-06, 'epochs': 233, 'loss': 'mae', 'optimizer': 'adam', 'graph_mode': 'cutoff', 'cutoff': 0.8034648239646804, 'grm_norm': 'cosine_then_gcn', 'self_loops': False, 'use_snp_selection': True, 'num_snps': 12315}. Best is trial 21 with value: 0.3081373243723945.
[I 2025-12-08 13:32:52,621] Trial 26 finished with value: 0.22779815132869388 and parameters: {'model_type': 'gcn', 'hidden_dims': '[512, 128]', 'dropout': 0.10275420490137308, 'batch_norm': False, 'lr': 0.00014274053399240504, 'weight_decay': 2.396489708231334e-05, 'epochs': 190, 'loss': 'mae', 'optimizer': 'adam', 'graph_mode': 'knn', 'knn_k': 7, 'weighted_edges': False, 'symmetrize_mode': 'union', 'self_loops': True, 'use_snp_selection': False}. Best is trial 21 with value: 0.3081373243723945.
[I 2025-12-08 13:33:40,178] Trial 27 finished with value: 0.3020828489089033 and parameters: {'model_type': 'gcn', 'hidden_dims': '[512, 128]', 'dropout': 0.49760459041141525, 'batch_norm': True, 'lr': 6.0947069373533764e-05, 'weight_decay': 0.00013421542253229035, 'epochs': 268, 'loss': 'mae', 'optimizer': 'adam', 'graph_mode': 'cutoff', 'cutoff': 0.6806886388124656, 'grm_norm': 'cosine_then_gcn', 'self_loops': False, 'use_snp_selection': True, 'num_snps': 31963}. Best is trial 21 with value: 0.3081373243723945.
[I 2025-12-08 13:33:56,064] Trial 28 finished with value: 0.2726311008856581 and parameters: {'model_type': 'gcn', 'hidden_dims': '[512, 128]', 'dropout': 0.18936798174700822, 'batch_norm': True, 'lr': 2.8353091394705607e-05, 'weight_decay': 3.94940390931485e-06, 'epochs': 194, 'loss': 'mae', 'optimizer': 'adam', 'graph_mode': 'cutoff', 'cutoff': 0.545735187367836, 'grm_norm': 'cosine_then_gcn', 'self_loops': False, 'use_snp_selection': True, 'num_snps': 6612}. Best is trial 21 with value: 0.3081373243723945.
[I 2025-12-08 13:34:23,188] Trial 29 finished with value: 0.19456582851444065 and parameters: {'model_type': 'gcn', 'hidden_dims': '[512, 64]', 'dropout': 0.22485787403253407, 'batch_norm': True, 'lr': 1.2927951201196095e-05, 'weight_decay': 1.1258736169994225e-06, 'epochs': 267, 'loss': 'mae', 'optimizer': 'adam', 'graph_mode': 'knn', 'knn_k': 1, 'weighted_edges': False, 'symmetrize_mode': 'union', 'self_loops': True, 'use_snp_selection': True, 'num_snps': 14031}. Best is trial 21 with value: 0.3081373243723945.
[I 2025-12-08 13:35:06,996] Trial 30 finished with value: 0.276603957072974 and parameters: {'model_type': 'gcn', 'hidden_dims': '[256, 128, 64]', 'dropout': 0.3922198903365881, 'batch_norm': True, 'lr': 0.0001113973697024694, 'weight_decay': 4.254851313707592e-07, 'epochs': 322, 'loss': 'mae', 'optimizer': 'adam', 'graph_mode': 'cutoff', 'cutoff': 0.8205388821720695, 'grm_norm': 'gcn', 'self_loops': False, 'use_snp_selection': True, 'num_snps': 38670}. Best is trial 21 with value: 0.3081373243723945.
[I 2025-12-08 13:35:53,707] Trial 31 finished with value: 0.28511935574429553 and parameters: {'model_type': 'gcn', 'hidden_dims': '[512, 128]', 'dropout': 0.4959518958500686, 'batch_norm': True, 'lr': 7.108139794652646e-05, 'weight_decay': 0.0001520101713829303, 'epochs': 272, 'loss': 'mae', 'optimizer': 'adam', 'graph_mode': 'cutoff', 'cutoff': 0.6985998900505153, 'grm_norm': 'cosine_then_gcn', 'self_loops': False, 'use_snp_selection': True, 'num_snps': 30763}. Best is trial 21 with value: 0.3081373243723945.
[I 2025-12-08 13:36:28,098] Trial 32 finished with value: 0.2926322002470618 and parameters: {'model_type': 'gcn', 'hidden_dims': '[512, 128]', 'dropout': 0.5850611317114954, 'batch_norm': True, 'lr': 6.842805674986387e-05, 'weight_decay': 2.5260392851870543e-05, 'epochs': 228, 'loss': 'mae', 'optimizer': 'adam', 'graph_mode': 'cutoff', 'cutoff': 0.6661201586022462, 'grm_norm': 'cosine_then_gcn', 'self_loops': False, 'use_snp_selection': True, 'num_snps': 23696}. Best is trial 21 with value: 0.3081373243723945.
[I 2025-12-08 13:37:34,747] Trial 33 finished with value: 0.30314354248238645 and parameters: {'model_type': 'gcn', 'hidden_dims': '[512, 128]', 'dropout': 0.4382542841200747, 'batch_norm': True, 'lr': 0.00021925199471542267, 'weight_decay': 0.0002031840669228527, 'epochs': 302, 'loss': 'mae', 'optimizer': 'adam', 'graph_mode': 'cutoff', 'cutoff': 0.7836042258740322, 'grm_norm': 'cosine_then_gcn', 'self_loops': False, 'use_snp_selection': True, 'num_snps': 44146}. Best is trial 21 with value: 0.3081373243723945.
[I 2025-12-08 13:38:14,128] Trial 34 finished with value: 0.2947815998598603 and parameters: {'model_type': 'gcn', 'hidden_dims': '[256, 128]', 'dropout': 0.4392000839113428, 'batch_norm': True, 'lr': 0.0005252738194800469, 'weight_decay': 0.00032204298367734767, 'epochs': 305, 'loss': 'mae', 'optimizer': 'adam', 'graph_mode': 'cutoff', 'cutoff': 0.7867552573690556, 'grm_norm': 'cosine_then_gcn', 'self_loops': False, 'use_snp_selection': False}. Best is trial 21 with value: 0.3081373243723945.
[I 2025-12-08 13:39:30,536] Trial 35 finished with value: 0.20853545895164705 and parameters: {'model_type': 'gcn', 'hidden_dims': '[512, 128]', 'dropout': 0.3405481830489085, 'batch_norm': True, 'lr': 0.0002420485019707669, 'weight_decay': 6.587518907972634e-05, 'epochs': 328, 'loss': 'mae', 'optimizer': 'adam', 'graph_mode': 'knn', 'knn_k': 10, 'weighted_edges': True, 'symmetrize_mode': 'mutual', 'self_loops': True, 'use_snp_selection': True, 'num_snps': 47868}. Best is trial 21 with value: 0.3081373243723945.
[I 2025-12-08 13:40:51,083] Trial 36 finished with value: 0.29716182335953467 and parameters: {'model_type': 'gcn', 'hidden_dims': '[512, 128]', 'dropout': 0.5383574974893076, 'batch_norm': True, 'lr': 0.00032290910456825176, 'weight_decay': 0.0007978166347006443, 'epochs': 293, 'loss': 'mae', 'optimizer': 'adam', 'graph_mode': 'cutoff', 'cutoff': 0.8384871712780727, 'grm_norm': 'cosine_then_gcn', 'self_loops': False, 'use_snp_selection': True, 'num_snps': 58106}. Best is trial 21 with value: 0.3081373243723945.
[I 2025-12-08 13:41:36,402] Trial 37 finished with value: 0.2949832158869892 and parameters: {'model_type': 'gcn', 'hidden_dims': '[256, 128, 64]', 'dropout': 0.13736620527035226, 'batch_norm': True, 'lr': 0.0007237275041517925, 'weight_decay': 2.7821925587335777e-06, 'epochs': 348, 'loss': 'mae', 'optimizer': 'adam', 'graph_mode': 'cutoff', 'cutoff': 0.7743403130378418, 'grm_norm': 'cosine_then_gcn', 'self_loops': False, 'use_snp_selection': False}. Best is trial 21 with value: 0.3081373243723945.
[I 2025-12-08 13:42:26,790] Trial 38 finished with value: 0.2985950746209929 and parameters: {'model_type': 'gcn', 'hidden_dims': '[512, 64]', 'dropout': 0.42199141603516926, 'batch_norm': True, 'lr': 0.00010242459529507473, 'weight_decay': 5.131425153526057e-06, 'epochs': 209, 'loss': 'mse', 'optimizer': 'adam', 'graph_mode': 'cutoff', 'cutoff': 0.8612904298737266, 'grm_norm': 'gcn', 'self_loops': True, 'use_snp_selection': True, 'num_snps': 44033}. Best is trial 21 with value: 0.3081373243723945.
[I 2025-12-08 13:42:54,902] Trial 39 finished with value: 0.24335092851824708 and parameters: {'model_type': 'gcn', 'hidden_dims': '[256, 128]', 'dropout': 0.30858881655182624, 'batch_norm': True, 'lr': 0.00017589101541962786, 'weight_decay': 1.0904175637065233e-05, 'epochs': 253, 'loss': 'mae', 'optimizer': 'adam', 'graph_mode': 'knn', 'knn_k': 6, 'weighted_edges': False, 'symmetrize_mode': 'union', 'self_loops': False, 'use_snp_selection': True, 'num_snps': 25627}. Best is trial 21 with value: 0.3081373243723945.
[I 2025-12-08 13:43:17,371] Trial 40 finished with value: 0.29801195385104595 and parameters: {'model_type': 'gcn', 'hidden_dims': '[128, 64]', 'dropout': 0.18946394474099967, 'batch_norm': False, 'lr': 3.2655178996553404e-05, 'weight_decay': 1.3299380887938076e-07, 'epochs': 282, 'loss': 'mse', 'optimizer': 'adam', 'graph_mode': 'cutoff', 'cutoff': 0.7608955891113078, 'grm_norm': 'cosine_then_gcn', 'self_loops': False, 'use_snp_selection': False}. Best is trial 21 with value: 0.3081373243723945.
[I 2025-12-08 13:43:52,481] Trial 41 finished with value: 0.30442865279292 and parameters: {'model_type': 'gcn', 'hidden_dims': '[512, 128]', 'dropout': 0.4782504120287208, 'batch_norm': True, 'lr': 6.875260885267351e-05, 'weight_decay': 0.00018588290367643694, 'epochs': 268, 'loss': 'mae', 'optimizer': 'adam', 'graph_mode': 'cutoff', 'cutoff': 0.6747868907477931, 'grm_norm': 'cosine_then_gcn', 'self_loops': False, 'use_snp_selection': True, 'num_snps': 21006}. Best is trial 21 with value: 0.3081373243723945.
[I 2025-12-08 13:44:24,119] Trial 42 finished with value: 0.29740688911521973 and parameters: {'model_type': 'gcn', 'hidden_dims': '[512, 128]', 'dropout': 0.47587429443751883, 'batch_norm': True, 'lr': 9.281723217063275e-05, 'weight_decay': 0.00020166629779477666, 'epochs': 223, 'loss': 'mae', 'optimizer': 'adam', 'graph_mode': 'cutoff', 'cutoff': 0.8193552004025711, 'grm_norm': 'cosine_then_gcn', 'self_loops': False, 'use_snp_selection': True, 'num_snps': 21800}. Best is trial 21 with value: 0.3081373243723945.
[I 2025-12-08 13:44:52,232] Trial 43 finished with value: 0.2948425974077654 and parameters: {'model_type': 'gcn', 'hidden_dims': '[512, 128]', 'dropout': 0.4674426100631777, 'batch_norm': True, 'lr': 0.0003094807765866941, 'weight_decay': 6.938213959634041e-05, 'epochs': 247, 'loss': 'mae', 'optimizer': 'adam', 'graph_mode': 'cutoff', 'cutoff': 0.6427290094325331, 'grm_norm': 'cosine_then_gcn', 'self_loops': False, 'use_snp_selection': True, 'num_snps': 16488}. Best is trial 21 with value: 0.3081373243723945.
[I 2025-12-08 13:45:38,689] Trial 44 finished with value: 0.295565343153458 and parameters: {'model_type': 'gcn', 'hidden_dims': '[512, 128]', 'dropout': 0.5405190342518387, 'batch_norm': True, 'lr': 1.7577337653482774e-05, 'weight_decay': 0.0004501982191698794, 'epochs': 305, 'loss': 'mae', 'optimizer': 'adam', 'graph_mode': 'cutoff', 'cutoff': 0.7243874629258151, 'grm_norm': 'gcn', 'self_loops': False, 'use_snp_selection': True, 'num_snps': 28142}. Best is trial 21 with value: 0.3081373243723945.
[I 2025-12-08 13:46:00,925] Trial 45 finished with value: 0.2760286137229338 and parameters: {'model_type': 'gcn', 'hidden_dims': '[512, 128]', 'dropout': 0.36175212817560054, 'batch_norm': True, 'lr': 0.00016299539801128117, 'weight_decay': 3.1107817070896536e-05, 'epochs': 183, 'loss': 'mae', 'optimizer': 'adam', 'graph_mode': 'cutoff', 'cutoff': 0.5517386693039592, 'grm_norm': 'cosine', 'self_loops': False, 'use_snp_selection': True, 'num_snps': 14903}. Best is trial 21 with value: 0.3081373243723945.
[I 2025-12-08 13:46:33,496] Trial 46 finished with value: 0.29582055892680453 and parameters: {'model_type': 'gcn', 'hidden_dims': '[128, 64]', 'dropout': 0.4409306146521891, 'batch_norm': True, 'lr': 8.159843644669122e-05, 'weight_decay': 1.8261444163162736e-06, 'epochs': 262, 'loss': 'mae', 'optimizer': 'adam', 'graph_mode': 'cutoff', 'cutoff': 0.7980917500037835, 'grm_norm': 'cosine_then_gcn', 'self_loops': True, 'use_snp_selection': True, 'num_snps': 53728}. Best is trial 21 with value: 0.3081373243723945.
[I 2025-12-08 13:46:53,765] Trial 47 finished with value: 0.3003025401650345 and parameters: {'model_type': 'gcn', 'hidden_dims': '[512, 64]', 'dropout': 0.40824727770649005, 'batch_norm': True, 'lr': 0.00011124613807702598, 'weight_decay': 0.000194465185683829, 'epochs': 278, 'loss': 'mse', 'optimizer': 'adam', 'graph_mode': 'cutoff', 'cutoff': 0.6959923098336314, 'grm_norm': 'cosine', 'self_loops': False, 'use_snp_selection': True, 'num_snps': 8510}. Best is trial 21 with value: 0.3081373243723945.
[I 2025-12-08 13:47:45,559] Trial 48 finished with value: 0.3025220499585578 and parameters: {'model_type': 'gcn', 'hidden_dims': '[512, 128]', 'dropout': 0.3855960008723432, 'batch_norm': False, 'lr': 0.00022818423675324733, 'weight_decay': 0.00044017657596699607, 'epochs': 203, 'loss': 'mae', 'optimizer': 'adam', 'graph_mode': 'cutoff', 'cutoff': 0.8987793203523139, 'grm_norm': 'cosine_then_gcn', 'self_loops': False, 'use_snp_selection': False}. Best is trial 21 with value: 0.3081373243723945.
[I 2025-12-08 13:48:23,066] Trial 49 finished with value: 0.28605117015159703 and parameters: {'model_type': 'gcn', 'hidden_dims': '[512, 256]', 'dropout': 0.5090583634433267, 'batch_norm': True, 'lr': 0.00917072323969965, 'weight_decay': 9.117382732369865e-05, 'epochs': 240, 'loss': 'mae', 'optimizer': 'adam', 'graph_mode': 'cutoff', 'cutoff': 0.5775136625483352, 'grm_norm': 'cosine_then_gcn', 'self_loops': False, 'use_snp_selection': True, 'num_snps': 26662}. Best is trial 21 with value: 0.3081373243723945.
[I 2025-12-08 13:48:55,053] Trial 50 finished with value: 0.2179044415617546 and parameters: {'model_type': 'gcn', 'hidden_dims': '[512, 128]', 'dropout': 0.45824222073143067, 'batch_norm': True, 'lr': 4.973425883331912e-05, 'weight_decay': 5.063271748118348e-05, 'epochs': 260, 'loss': 'mse', 'optimizer': 'adam', 'graph_mode': 'knn', 'knn_k': 4, 'weighted_edges': True, 'symmetrize_mode': 'mutual', 'self_loops': False, 'use_snp_selection': True, 'num_snps': 19138}. Best is trial 21 with value: 0.3081373243723945.
[I 2025-12-08 13:49:47,239] Trial 51 finished with value: 0.2990008963497568 and parameters: {'model_type': 'gcn', 'hidden_dims': '[512, 128]', 'dropout': 0.38706366916448987, 'batch_norm': False, 'lr': 0.00027748172231641734, 'weight_decay': 0.0004762586446864117, 'epochs': 205, 'loss': 'mae', 'optimizer': 'adam', 'graph_mode': 'cutoff', 'cutoff': 0.8661519209188827, 'grm_norm': 'cosine_then_gcn', 'self_loops': False, 'use_snp_selection': False}. Best is trial 21 with value: 0.3081373243723945.
[I 2025-12-08 13:50:42,622] Trial 52 finished with value: 0.3006613242761066 and parameters: {'model_type': 'gcn', 'hidden_dims': '[512, 128]', 'dropout': 0.4259473680496177, 'batch_norm': False, 'lr': 0.00022397939081532606, 'weight_decay': 0.0009480732268665236, 'epochs': 217, 'loss': 'mae', 'optimizer': 'adam', 'graph_mode': 'cutoff', 'cutoff': 0.8921029895887314, 'grm_norm': 'cosine_then_gcn', 'self_loops': False, 'use_snp_selection': False}. Best is trial 21 with value: 0.3081373243723945.
[I 2025-12-08 13:51:29,441] Trial 53 finished with value: 0.3000003070585014 and parameters: {'model_type': 'gcn', 'hidden_dims': '[512, 128]', 'dropout': 0.3323721319823884, 'batch_norm': False, 'lr': 0.00017626524183629783, 'weight_decay': 0.0002437642500467419, 'epochs': 181, 'loss': 'mae', 'optimizer': 'adam', 'graph_mode': 'cutoff', 'cutoff': 0.8485111257091519, 'grm_norm': 'cosine_then_gcn', 'self_loops': False, 'use_snp_selection': False}. Best is trial 21 with value: 0.3081373243723945.
[I 2025-12-08 13:52:07,610] Trial 54 finished with value: 0.16349328889485745 and parameters: {'model_type': 'gcn', 'hidden_dims': '[512, 128]', 'dropout': 0.3630581793583056, 'batch_norm': False, 'lr': 0.0011762945382439796, 'weight_decay': 0.0003614963326385219, 'epochs': 145, 'loss': 'mae', 'optimizer': 'adam', 'graph_mode': 'cutoff', 'cutoff': 0.8287214096360009, 'grm_norm': 'cosine_then_gcn', 'self_loops': False, 'use_snp_selection': False}. Best is trial 21 with value: 0.3081373243723945.
[I 2025-12-08 13:52:38,507] Trial 55 finished with value: 0.14451164797968213 and parameters: {'model_type': 'gcn', 'hidden_dims': '[256, 128, 64]', 'dropout': 0.3958618799857371, 'batch_norm': False, 'lr': 0.00040337012939819724, 'weight_decay': 0.0005567239003754099, 'epochs': 237, 'loss': 'mae', 'optimizer': 'adam', 'graph_mode': 'cutoff', 'cutoff': 0.7627581655114178, 'grm_norm': 'cosine', 'self_loops': False, 'use_snp_selection': False}. Best is trial 21 with value: 0.3081373243723945.
[I 2025-12-08 13:53:15,654] Trial 56 finished with value: 0.2802992632699503 and parameters: {'model_type': 'gcn', 'hidden_dims': '[512, 128]', 'dropout': 0.13109018817527343, 'batch_norm': False, 'lr': 0.0005319520811538446, 'weight_decay': 7.321803848914079e-06, 'epochs': 310, 'loss': 'mae', 'optimizer': 'adam', 'graph_mode': 'cutoff', 'cutoff': 0.6253534485151382, 'grm_norm': 'none', 'self_loops': False, 'use_snp_selection': True, 'num_snps': 20760}. Best is trial 21 with value: 0.3081373243723945.
[I 2025-12-08 13:53:42,110] Trial 57 finished with value: 0.2186566586838674 and parameters: {'model_type': 'gcn', 'hidden_dims': '[256, 128]', 'dropout': 0.30554197454374066, 'batch_norm': True, 'lr': 0.00013526422780143224, 'weight_decay': 1.316963680276107e-05, 'epochs': 204, 'loss': 'mae', 'optimizer': 'adam', 'graph_mode': 'cutoff', 'cutoff': 0.31080859581623815, 'grm_norm': 'cosine_then_gcn', 'self_loops': False, 'use_snp_selection': False}. Best is trial 21 with value: 0.3081373243723945.
[I 2025-12-08 13:53:59,921] Trial 58 finished with value: 0.2987181832553652 and parameters: {'model_type': 'gcn', 'hidden_dims': '[512, 128]', 'dropout': 0.41714679995752446, 'batch_norm': False, 'lr': 6.189697522721019e-05, 'weight_decay': 1.8636243838033307e-05, 'epochs': 285, 'loss': 'mae', 'optimizer': 'adam', 'graph_mode': 'cutoff', 'cutoff': 0.7539330654447906, 'grm_norm': 'cosine_then_gcn', 'self_loops': False, 'use_snp_selection': True, 'num_snps': 6331}. Best is trial 21 with value: 0.3081373243723945.
[I 2025-12-08 13:54:19,190] Trial 59 finished with value: 0.29969269362796874 and parameters: {'model_type': 'gcn', 'hidden_dims': '[128, 64]', 'dropout': 0.5210818684022522, 'batch_norm': True, 'lr': 0.0002250757421026027, 'weight_decay': 9.255014718829294e-05, 'epochs': 337, 'loss': 'mae', 'optimizer': 'adam', 'graph_mode': 'cutoff', 'cutoff': 0.8963490862163677, 'grm_norm': 'gcn', 'self_loops': True, 'use_snp_selection': True, 'num_snps': 15854}. Best is trial 21 with value: 0.3081373243723945.
[I 2025-12-08 13:54:42,318] Trial 60 finished with value: 0.29792223789199457 and parameters: {'model_type': 'gcn', 'hidden_dims': '[512, 256]', 'dropout': 0.25213002451315664, 'batch_norm': True, 'lr': 0.00012065355990358409, 'weight_decay': 0.0005821775911734826, 'epochs': 249, 'loss': 'mae', 'optimizer': 'adam', 'graph_mode': 'cutoff', 'cutoff': 0.8010993275105446, 'grm_norm': 'cosine_then_gcn', 'self_loops': False, 'use_snp_selection': True, 'num_snps': 12226}. Best is trial 21 with value: 0.3081373243723945.
[I 2025-12-08 13:55:25,751] Trial 61 finished with value: 0.28676959496829996 and parameters: {'model_type': 'gcn', 'hidden_dims': '[512, 128]', 'dropout': 0.49686660276140737, 'batch_norm': True, 'lr': 6.138850869161912e-05, 'weight_decay': 0.00014016139811349516, 'epochs': 261, 'loss': 'mae', 'optimizer': 'adam', 'graph_mode': 'cutoff', 'cutoff': 0.6692328738425661, 'grm_norm': 'cosine_then_gcn', 'self_loops': False, 'use_snp_selection': True, 'num_snps': 30353}. Best is trial 21 with value: 0.3081373243723945.
[I 2025-12-08 13:56:14,445] Trial 62 finished with value: 0.29550093656807597 and parameters: {'model_type': 'gcn', 'hidden_dims': '[512, 128]', 'dropout': 0.4833138151497339, 'batch_norm': True, 'lr': 3.6401936710866736e-05, 'weight_decay': 0.00021263396885467023, 'epochs': 273, 'loss': 'mae', 'optimizer': 'adam', 'graph_mode': 'cutoff', 'cutoff': 0.7063591791284435, 'grm_norm': 'cosine_then_gcn', 'self_loops': False, 'use_snp_selection': True, 'num_snps': 33311}. Best is trial 21 with value: 0.3081373243723945.
[I 2025-12-08 13:57:14,490] Trial 63 finished with value: 0.30386021236786076 and parameters: {'model_type': 'gcn', 'hidden_dims': '[512, 128]', 'dropout': 0.45013525126979576, 'batch_norm': True, 'lr': 7.605493702651477e-05, 'weight_decay': 0.0002861589441198383, 'epochs': 295, 'loss': 'mae', 'optimizer': 'adam', 'graph_mode': 'cutoff', 'cutoff': 0.7375785353873645, 'grm_norm': 'cosine_then_gcn', 'self_loops': False, 'use_snp_selection': True, 'num_snps': 40208}. Best is trial 21 with value: 0.3081373243723945.
[I 2025-12-08 13:58:25,926] Trial 64 finished with value: 0.3070352962661403 and parameters: {'model_type': 'gcn', 'hidden_dims': '[512, 128]', 'dropout': 0.44477283233308523, 'batch_norm': True, 'lr': 8.651534532534056e-05, 'weight_decay': 0.00031459804701521125, 'epochs': 313, 'loss': 'mae', 'optimizer': 'adam', 'graph_mode': 'cutoff', 'cutoff': 0.7399786746560553, 'grm_norm': 'none', 'self_loops': False, 'use_snp_selection': True, 'num_snps': 46986}. Best is trial 21 with value: 0.3081373243723945.
[I 2025-12-08 13:59:32,441] Trial 65 finished with value: 0.30261789112749343 and parameters: {'model_type': 'gcn', 'hidden_dims': '[512, 128]', 'dropout': 0.44429269923705583, 'batch_norm': True, 'lr': 8.621603965414384e-05, 'weight_decay': 9.592112851612367e-06, 'epochs': 296, 'loss': 'mae', 'optimizer': 'adam', 'graph_mode': 'cutoff', 'cutoff': 0.7365834680819978, 'grm_norm': 'none', 'self_loops': False, 'use_snp_selection': True, 'num_snps': 46051}. Best is trial 21 with value: 0.3081373243723945.
[I 2025-12-08 14:00:38,292] Trial 66 finished with value: 0.22998775366316898 and parameters: {'model_type': 'gcn', 'hidden_dims': '[512, 128]', 'dropout': 0.4636502110394658, 'batch_norm': True, 'lr': 4.8274715280867196e-05, 'weight_decay': 5.5442269834012475e-06, 'epochs': 323, 'loss': 'mae', 'optimizer': 'adam', 'graph_mode': 'knn', 'knn_k': 8, 'weighted_edges': False, 'symmetrize_mode': 'mutual', 'self_loops': False, 'use_snp_selection': True, 'num_snps': 40192}. Best is trial 21 with value: 0.3081373243723945.
