[I 2025-12-08 12:09:45,732] Trial 6 finished with value: 0.26839225658184684 and parameters: {'model_type': 'gcn', 'hidden_dims': '[128, 64]', 'dropout': 0.31805912766941713, 'batch_norm': True, 'lr': 1.2361026034262557e-05, 'weight_decay': 6.492620232791903e-06, 'epochs': 271, 'loss': 'mse', 'optimizer': 'adam', 'graph_mode': 'cutoff', 'cutoff': 0.6193362582230448, 'grm_norm': 'cosine', 'self_loops': False, 'use_snp_selection': True, 'num_snps': 28594}. Best is trial 4 with value: 0.2865102678357604.
[I 2025-12-08 12:10:05,594] Trial 7 finished with value: 0.2694974563667661 and parameters: {'model_type': 'gcn', 'hidden_dims': '[512, 64]', 'dropout': 0.471337288649717, 'batch_norm': True, 'lr': 2.239693207292708e-05, 'weight_decay': 2.263166635514082e-06, 'epochs': 69, 'loss': 'mse', 'optimizer': 'adam', 'graph_mode': 'cutoff', 'cutoff': 0.4056820886426376, 'grm_norm': 'cosine', 'self_loops': False, 'use_snp_selection': False}. Best is trial 4 with value: 0.2865102678357604.
[I 2025-12-08 12:10:43,340] Trial 8 finished with value: 0.2642014198841699 and parameters: {'model_type': 'gcn', 'hidden_dims': '[512, 256]', 'dropout': 0.20659328268932406, 'batch_norm': False, 'lr': 8.93315124361372e-05, 'weight_decay': 0.00028987480727919035, 'epochs': 136, 'loss': 'mae', 'optimizer': 'adam', 'graph_mode': 'knn', 'knn_k': 3, 'weighted_edges': False, 'symmetrize_mode': 'union', 'self_loops': False, 'use_snp_selection': True, 'num_snps': 43128}. Best is trial 4 with value: 0.2865102678357604.
[I 2025-12-08 12:11:25,616] Trial 9 finished with value: 0.06772606924920468 and parameters: {'model_type': 'gcn', 'hidden_dims': '[512, 256]', 'dropout': 0.2888209592870401, 'batch_norm': False, 'lr': 0.004734648143129892, 'weight_decay': 1.5879705591356368e-06, 'epochs': 163, 'loss': 'mse', 'optimizer': 'adam', 'graph_mode': 'cutoff', 'cutoff': 0.5984899797909019, 'grm_norm': 'cosine', 'self_loops': True, 'use_snp_selection': False}. Best is trial 4 with value: 0.2865102678357604.
[I 2025-12-08 12:11:34,838] Trial 10 finished with value: 0.27845156188066345 and parameters: {'model_type': 'gcn', 'hidden_dims': '[512, 128]', 'dropout': 0.11372025982957354, 'batch_norm': False, 'lr': 0.0023343012062770553, 'weight_decay': 4.14440562940608e-05, 'epochs': 41, 'loss': 'mae', 'optimizer': 'adam', 'graph_mode': 'cutoff', 'cutoff': 0.8740100033033124, 'grm_norm': 'none', 'self_loops': False, 'use_snp_selection': True, 'num_snps': 3859}. Best is trial 4 with value: 0.2865102678357604.
[I 2025-12-08 12:11:44,468] Trial 11 finished with value: 0.2817684616222869 and parameters: {'model_type': 'gcn', 'hidden_dims': '[512, 128]', 'dropout': 0.11010512794988106, 'batch_norm': False, 'lr': 0.002840927000804915, 'weight_decay': 4.4403613143528146e-05, 'epochs': 62, 'loss': 'mae', 'optimizer': 'adam', 'graph_mode': 'cutoff', 'cutoff': 0.8806120701085718, 'grm_norm': 'none', 'self_loops': False, 'use_snp_selection': True, 'num_snps': 3687}. Best is trial 4 with value: 0.2865102678357604.
[I 2025-12-08 12:11:54,707] Trial 12 finished with value: 0.24526733122636007 and parameters: {'model_type': 'gcn', 'hidden_dims': '[512, 128]', 'dropout': 0.10171873442767976, 'batch_norm': False, 'lr': 0.0013879246710499806, 'weight_decay': 4.384487985620295e-05, 'epochs': 104, 'loss': 'mae', 'optimizer': 'adam', 'graph_mode': 'cutoff', 'cutoff': 0.8997334580241522, 'grm_norm': 'none', 'self_loops': False, 'use_snp_selection': True, 'num_snps': 3065}. Best is trial 4 with value: 0.2865102678357604.
[I 2025-12-08 12:12:11,618] Trial 13 finished with value: 0.0 and parameters: {'model_type': 'gcn', 'hidden_dims': '[512, 128]', 'dropout': 0.4122265282662683, 'batch_norm': False, 'lr': 0.007502125895476449, 'weight_decay': 1.5194385293282207e-05, 'epochs': 94, 'loss': 'mae', 'optimizer': 'adam', 'graph_mode': 'cutoff', 'cutoff': 0.779337861629708, 'grm_norm': 'none', 'self_loops': False, 'use_snp_selection': True, 'num_snps': 16498}. Best is trial 4 with value: 0.2865102678357604.
[I 2025-12-08 12:12:24,990] Trial 14 finished with value: 0.22070383798700632 and parameters: {'model_type': 'gcn', 'hidden_dims': '[512, 256]', 'dropout': 0.3951614896111736, 'batch_norm': False, 'lr': 0.0009716920078194036, 'weight_decay': 0.00012014795738940992, 'epochs': 41, 'loss': 'mae', 'optimizer': 'adam', 'graph_mode': 'cutoff', 'cutoff': 0.7669380163895438, 'grm_norm': 'cosine_then_gcn', 'self_loops': False, 'use_snp_selection': True, 'num_snps': 15706}. Best is trial 4 with value: 0.2865102678357604.
[I 2025-12-08 12:12:39,627] Trial 15 finished with value: 0.2631553107891419 and parameters: {'model_type': 'gcn', 'hidden_dims': '[256, 128]', 'dropout': 0.15877848590911114, 'batch_norm': False, 'lr': 0.00019946804531991192, 'weight_decay': 0.0008123085288536146, 'epochs': 137, 'loss': 'mae', 'optimizer': 'adam', 'graph_mode': 'cutoff', 'cutoff': 0.7648924806053673, 'grm_norm': 'none', 'self_loops': False, 'use_snp_selection': True, 'num_snps': 14178}. Best is trial 4 with value: 0.2865102678357604.
[I 2025-12-08 12:12:52,104] Trial 16 finished with value: 0.1262351811702354 and parameters: {'model_type': 'gcn', 'hidden_dims': '[256, 128, 64]', 'dropout': 0.23851311427445726, 'batch_norm': False, 'lr': 0.003044025208710986, 'weight_decay': 9.413973801568206e-06, 'epochs': 86, 'loss': 'mae', 'optimizer': 'adam', 'graph_mode': 'cutoff', 'cutoff': 0.20792938025503954, 'grm_norm': 'none', 'self_loops': False, 'use_snp_selection': True, 'num_snps': 10099}. Best is trial 4 with value: 0.2865102678357604.
[I 2025-12-08 12:13:18,269] Trial 17 finished with value: 0.2959834476894283 and parameters: {'model_type': 'gcn', 'hidden_dims': '[512, 128]', 'dropout': 0.2702037781903839, 'batch_norm': True, 'lr': 0.00014347037541254156, 'weight_decay': 0.0001172775091180384, 'epochs': 164, 'loss': 'mae', 'optimizer': 'adam', 'graph_mode': 'cutoff', 'cutoff': 0.7319972073873633, 'grm_norm': 'cosine_then_gcn', 'self_loops': False, 'use_snp_selection': True, 'num_snps': 22350}. Best is trial 17 with value: 0.2959834476894283.
[I 2025-12-08 12:13:47,079] Trial 18 finished with value: 0.2535874571300082 and parameters: {'model_type': 'gcn', 'hidden_dims': '[512, 256]', 'dropout': 0.2707973244178221, 'batch_norm': True, 'lr': 0.00019769001121672117, 'weight_decay': 0.00020227181773653023, 'epochs': 179, 'loss': 'mae', 'optimizer': 'adam', 'graph_mode': 'knn', 'knn_k': 1, 'weighted_edges': False, 'symmetrize_mode': 'mutual', 'self_loops': False, 'use_snp_selection': True, 'num_snps': 23574}. Best is trial 17 with value: 0.2959834476894283.
[I 2025-12-08 12:14:35,533] Trial 19 finished with value: 0.28427660432556723 and parameters: {'model_type': 'gcn', 'hidden_dims': '[512, 128]', 'dropout': 0.38028324672676805, 'batch_norm': True, 'lr': 4.1467343143060856e-05, 'weight_decay': 0.0009491326053320723, 'epochs': 242, 'loss': 'mae', 'optimizer': 'adam', 'graph_mode': 'cutoff', 'cutoff': 0.7116211207669326, 'grm_norm': 'cosine_then_gcn', 'self_loops': False, 'use_snp_selection': True, 'num_snps': 37500}. Best is trial 17 with value: 0.2959834476894283.
[I 2025-12-08 12:14:57,919] Trial 20 finished with value: 0.2537342613050232 and parameters: {'model_type': 'gcn', 'hidden_dims': '[512, 256]', 'dropout': 0.4600447442050442, 'batch_norm': True, 'lr': 0.00026257889930770596, 'weight_decay': 9.915262654636106e-05, 'epochs': 134, 'loss': 'mae', 'optimizer': 'adam', 'graph_mode': 'cutoff', 'cutoff': 0.4961466545451624, 'grm_norm': 'cosine_then_gcn', 'self_loops': False, 'use_snp_selection': True, 'num_snps': 19988}. Best is trial 17 with value: 0.2959834476894283.
[I 2025-12-08 12:15:45,448] Trial 21 finished with value: 0.2778163864374479 and parameters: {'model_type': 'gcn', 'hidden_dims': '[512, 128]', 'dropout': 0.37759930673103337, 'batch_norm': True, 'lr': 3.7771384404803075e-05, 'weight_decay': 0.00048184125220597686, 'epochs': 237, 'loss': 'mae', 'optimizer': 'adam', 'graph_mode': 'cutoff', 'cutoff': 0.7117557717366555, 'grm_norm': 'cosine_then_gcn', 'self_loops': False, 'use_snp_selection': True, 'num_snps': 37211}. Best is trial 17 with value: 0.2959834476894283.
[I 2025-12-08 12:16:34,730] Trial 22 finished with value: 0.2788817097702291 and parameters: {'model_type': 'gcn', 'hidden_dims': '[512, 128]', 'dropout': 0.3544997008657477, 'batch_norm': True, 'lr': 4.6263960275592666e-05, 'weight_decay': 0.0007878972419946744, 'epochs': 247, 'loss': 'mae', 'optimizer': 'adam', 'graph_mode': 'cutoff', 'cutoff': 0.6765364056601709, 'grm_norm': 'cosine_then_gcn', 'self_loops': False, 'use_snp_selection': True, 'num_snps': 37743}. Best is trial 17 with value: 0.2959834476894283.
[I 2025-12-08 12:17:12,176] Trial 23 finished with value: 0.29019283019087716 and parameters: {'model_type': 'gcn', 'hidden_dims': '[512, 128]', 'dropout': 0.28176167439430083, 'batch_norm': True, 'lr': 0.00013256607502279337, 'weight_decay': 2.159642050941216e-05, 'epochs': 177, 'loss': 'mae', 'optimizer': 'adam', 'graph_mode': 'cutoff', 'cutoff': 0.8062300475529234, 'grm_norm': 'cosine_then_gcn', 'self_loops': False, 'use_snp_selection': True, 'num_snps': 34786}. Best is trial 17 with value: 0.2959834476894283.
[I 2025-12-08 12:17:44,905] Trial 24 finished with value: 0.2797942963061576 and parameters: {'model_type': 'gcn', 'hidden_dims': '[512, 128]', 'dropout': 0.2789722067190633, 'batch_norm': True, 'lr': 0.00012941256694202848, 'weight_decay': 1.648665959189506e-05, 'epochs': 161, 'loss': 'mae', 'optimizer': 'adam', 'graph_mode': 'cutoff', 'cutoff': 0.8207282024163979, 'grm_norm': 'cosine_then_gcn', 'self_loops': False, 'use_snp_selection': True, 'num_snps': 31260}. Best is trial 17 with value: 0.2959834476894283.
[I 2025-12-08 12:18:12,536] Trial 25 finished with value: 0.2856178570694382 and parameters: {'model_type': 'gcn', 'hidden_dims': '[256, 128]', 'dropout': 0.18837075515941823, 'batch_norm': True, 'lr': 0.00043297294921320847, 'weight_decay': 2.1904741637003267e-05, 'epochs': 123, 'loss': 'mae', 'optimizer': 'adam', 'graph_mode': 'cutoff', 'cutoff': 0.8210387225786214, 'grm_norm': 'cosine_then_gcn', 'self_loops': False, 'use_snp_selection': True, 'num_snps': 48174}. Best is trial 17 with value: 0.2959834476894283.
[I 2025-12-08 12:19:02,479] Trial 26 finished with value: 0.18849403151752564 and parameters: {'model_type': 'gcn', 'hidden_dims': '[512, 64]', 'dropout': 0.252446297506696, 'batch_norm': True, 'lr': 0.00014201778570178546, 'weight_decay': 5.001314478505071e-06, 'epochs': 189, 'loss': 'mse', 'optimizer': 'adam', 'graph_mode': 'knn', 'knn_k': 7, 'weighted_edges': False, 'symmetrize_mode': 'union', 'self_loops': True, 'use_snp_selection': False}. Best is trial 17 with value: 0.2959834476894283.
[I 2025-12-08 12:19:17,156] Trial 27 finished with value: 0.2618098444871381 and parameters: {'model_type': 'gcn', 'hidden_dims': '[256, 128, 64]', 'dropout': 0.3156786335445918, 'batch_norm': True, 'lr': 0.0006995565189741716, 'weight_decay': 0.00012486134194382328, 'epochs': 162, 'loss': 'mae', 'optimizer': 'adam', 'graph_mode': 'cutoff', 'cutoff': 0.6927279503355386, 'grm_norm': 'cosine_then_gcn', 'self_loops': False, 'use_snp_selection': True, 'num_snps': 10260}. Best is trial 17 with value: 0.2959834476894283.
[I 2025-12-08 12:19:39,317] Trial 28 finished with value: 0.23094116134340686 and parameters: {'model_type': 'gcn', 'hidden_dims': '[512, 256]', 'dropout': 0.17468495557294214, 'batch_norm': True, 'lr': 0.0003034276044889161, 'weight_decay': 7.746901920868786e-05, 'epochs': 116, 'loss': 'mae', 'optimizer': 'adam', 'graph_mode': 'cutoff', 'cutoff': 0.4837430533662186, 'grm_norm': 'gcn', 'self_loops': False, 'use_snp_selection': True, 'num_snps': 22297}. Best is trial 17 with value: 0.2959834476894283.
[I 2025-12-08 12:20:03,881] Trial 29 finished with value: 0.17949863216936482 and parameters: {'model_type': 'gcn', 'hidden_dims': '[128, 64]', 'dropout': 0.22641025100809156, 'batch_norm': True, 'lr': 0.0001468629564203001, 'weight_decay': 2.6694232194881512e-05, 'epochs': 283, 'loss': 'mae', 'optimizer': 'adam', 'graph_mode': 'knn', 'knn_k': 1, 'weighted_edges': False, 'symmetrize_mode': 'union', 'self_loops': True, 'use_snp_selection': True, 'num_snps': 32398}. Best is trial 17 with value: 0.2959834476894283.
[I 2025-12-08 12:20:23,675] Trial 30 finished with value: 0.26666244440617126 and parameters: {'model_type': 'gcn', 'hidden_dims': '[512, 128]', 'dropout': 0.4386190517499208, 'batch_norm': True, 'lr': 0.0012173642156322118, 'weight_decay': 0.00020625161651264865, 'epochs': 217, 'loss': 'mae', 'optimizer': 'adam', 'graph_mode': 'cutoff', 'cutoff': 0.813326787479123, 'grm_norm': 'cosine_then_gcn', 'self_loops': False, 'use_snp_selection': True, 'num_snps': 10442}. Best is trial 17 with value: 0.2959834476894283.
[I 2025-12-08 12:20:54,305] Trial 31 finished with value: 0.2903223866814778 and parameters: {'model_type': 'gcn', 'hidden_dims': '[256, 128]', 'dropout': 0.16781522129828882, 'batch_norm': True, 'lr': 0.000445304691591932, 'weight_decay': 2.2869509914753966e-05, 'epochs': 114, 'loss': 'mae', 'optimizer': 'adam', 'graph_mode': 'cutoff', 'cutoff': 0.823113318445917, 'grm_norm': 'cosine_then_gcn', 'self_loops': False, 'use_snp_selection': True, 'num_snps': 58334}. Best is trial 17 with value: 0.2959834476894283.
[I 2025-12-08 12:21:28,783] Trial 32 finished with value: 0.28904780467801927 and parameters: {'model_type': 'gcn', 'hidden_dims': '[256, 128]', 'dropout': 0.1512869080496027, 'batch_norm': True, 'lr': 0.0004851448088908456, 'weight_decay': 4.661630467334711e-06, 'epochs': 152, 'loss': 'mae', 'optimizer': 'adam', 'graph_mode': 'cutoff', 'cutoff': 0.8436935422574016, 'grm_norm': 'cosine_then_gcn', 'self_loops': False, 'use_snp_selection': True, 'num_snps': 57119}. Best is trial 17 with value: 0.2959834476894283.
[I 2025-12-08 12:22:03,756] Trial 33 finished with value: 0.2910569418309251 and parameters: {'model_type': 'gcn', 'hidden_dims': '[256, 128]', 'dropout': 0.13412716867350283, 'batch_norm': True, 'lr': 0.0005557569108687263, 'weight_decay': 4.518060493775488e-06, 'epochs': 152, 'loss': 'mae', 'optimizer': 'adam', 'graph_mode': 'cutoff', 'cutoff': 0.7506879221743632, 'grm_norm': 'cosine_then_gcn', 'self_loops': False, 'use_snp_selection': True, 'num_snps': 58410}. Best is trial 17 with value: 0.2959834476894283.
[I 2025-12-08 12:22:26,890] Trial 34 finished with value: 0.2819317652548452 and parameters: {'model_type': 'gcn', 'hidden_dims': '[256, 128]', 'dropout': 0.14065601055681393, 'batch_norm': True, 'lr': 6.044528226286362e-05, 'weight_decay': 2.5544420261531497e-06, 'epochs': 180, 'loss': 'mae', 'optimizer': 'adam', 'graph_mode': 'cutoff', 'cutoff': 0.737906109863263, 'grm_norm': 'cosine_then_gcn', 'self_loops': False, 'use_snp_selection': False}. Best is trial 17 with value: 0.2959834476894283.
[I 2025-12-08 12:23:06,816] Trial 35 finished with value: 0.22475301893001345 and parameters: {'model_type': 'gcn', 'hidden_dims': '[256, 128]', 'dropout': 0.20863555901988137, 'batch_norm': True, 'lr': 0.0006767680085705335, 'weight_decay': 6.466832157255608e-07, 'epochs': 197, 'loss': 'mse', 'optimizer': 'adam', 'graph_mode': 'knn', 'knn_k': 10, 'weighted_edges': True, 'symmetrize_mode': 'mutual', 'self_loops': True, 'use_snp_selection': True, 'num_snps': 56058}. Best is trial 17 with value: 0.2959834476894283.
[I 2025-12-08 12:23:38,085] Trial 36 finished with value: 0.2956160346079419 and parameters: {'model_type': 'gcn', 'hidden_dims': '[256, 128]', 'dropout': 0.13461597802609382, 'batch_norm': True, 'lr': 0.00011469898431292756, 'weight_decay': 9.517379936794293e-06, 'epochs': 115, 'loss': 'mae', 'optimizer': 'adam', 'graph_mode': 'cutoff', 'cutoff': 0.6473583076062379, 'grm_norm': 'cosine_then_gcn', 'self_loops': False, 'use_snp_selection': True, 'num_snps': 59528}. Best is trial 17 with value: 0.2959834476894283.
[I 2025-12-08 12:23:53,254] Trial 37 finished with value: 0.27531078512593865 and parameters: {'model_type': 'gcn', 'hidden_dims': '[256, 128]', 'dropout': 0.13642387664197472, 'batch_norm': True, 'lr': 9.046164871317815e-05, 'weight_decay': 1.0942195674741961e-05, 'epochs': 111, 'loss': 'mae', 'optimizer': 'adam', 'graph_mode': 'cutoff', 'cutoff': 0.6409028681092956, 'grm_norm': 'cosine_then_gcn', 'self_loops': False, 'use_snp_selection': False}. Best is trial 17 with value: 0.2959834476894283.
[I 2025-12-08 12:24:19,501] Trial 38 finished with value: 0.25765848319830315 and parameters: {'model_type': 'gcn', 'hidden_dims': '[256, 128]', 'dropout': 0.17858187160558617, 'batch_norm': True, 'lr': 2.4618705126071993e-05, 'weight_decay': 2.9432813358562825e-06, 'epochs': 73, 'loss': 'mse', 'optimizer': 'adam', 'graph_mode': 'cutoff', 'cutoff': 0.5685542114766049, 'grm_norm': 'gcn', 'self_loops': True, 'use_snp_selection': True, 'num_snps': 59519}. Best is trial 17 with value: 0.2959834476894283.
[I 2025-12-08 12:24:51,778] Trial 39 finished with value: 0.2728200952047056 and parameters: {'model_type': 'gcn', 'hidden_dims': '[256, 128]', 'dropout': 0.1376438552041566, 'batch_norm': True, 'lr': 0.0002521768723854647, 'weight_decay': 5.511705006508667e-07, 'epochs': 151, 'loss': 'mae', 'optimizer': 'adam', 'graph_mode': 'knn', 'knn_k': 6, 'weighted_edges': False, 'symmetrize_mode': 'union', 'self_loops': False, 'use_snp_selection': True, 'num_snps': 50834}. Best is trial 17 with value: 0.2959834476894283.
[I 2025-12-08 12:25:30,235] Trial 40 finished with value: 0.28025001795099225 and parameters: {'model_type': 'gcn', 'hidden_dims': '[256, 128]', 'dropout': 0.5990729612712298, 'batch_norm': True, 'lr': 0.0008739929276290199, 'weight_decay': 7.86933797588762e-06, 'epochs': 312, 'loss': 'mse', 'optimizer': 'adam', 'graph_mode': 'cutoff', 'cutoff': 0.6769164111100178, 'grm_norm': 'cosine_then_gcn', 'self_loops': False, 'use_snp_selection': False}. Best is trial 17 with value: 0.2959834476894283.
[I 2025-12-08 12:25:57,881] Trial 41 finished with value: 0.2818534523166763 and parameters: {'model_type': 'gcn', 'hidden_dims': '[256, 128]', 'dropout': 0.21711989051936748, 'batch_norm': True, 'lr': 0.0001179343462410429, 'weight_decay': 2.8397653939429526e-05, 'epochs': 127, 'loss': 'mae', 'optimizer': 'adam', 'graph_mode': 'cutoff', 'cutoff': 0.7515460428887454, 'grm_norm': 'cosine_then_gcn', 'self_loops': False, 'use_snp_selection': True, 'num_snps': 46102}. Best is trial 17 with value: 0.2959834476894283.
[I 2025-12-08 12:26:44,716] Trial 42 finished with value: 0.2818630739819338 and parameters: {'model_type': 'gcn', 'hidden_dims': '[512, 64]', 'dropout': 0.31577485931748356, 'batch_norm': True, 'lr': 0.0001903730707618149, 'weight_decay': 1.3053752090679416e-06, 'epochs': 147, 'loss': 'mae', 'optimizer': 'adam', 'graph_mode': 'cutoff', 'cutoff': 0.7939743451599949, 'grm_norm': 'cosine_then_gcn', 'self_loops': False, 'use_snp_selection': True, 'num_snps': 54666}. Best is trial 17 with value: 0.2959834476894283.
[I 2025-12-08 12:27:13,384] Trial 43 finished with value: 0.286284553190325 and parameters: {'model_type': 'gcn', 'hidden_dims': '[128, 64]', 'dropout': 0.2478156013437741, 'batch_norm': True, 'lr': 6.569115059219729e-05, 'weight_decay': 3.3995315621338724e-06, 'epochs': 173, 'loss': 'mae', 'optimizer': 'adam', 'graph_mode': 'cutoff', 'cutoff': 0.6666978648543034, 'grm_norm': 'cosine_then_gcn', 'self_loops': False, 'use_snp_selection': True, 'num_snps': 59433}. Best is trial 17 with value: 0.2959834476894283.
[I 2025-12-08 12:27:51,815] Trial 44 finished with value: 0.2821816912668399 and parameters: {'model_type': 'gcn', 'hidden_dims': '[256, 128, 64]', 'dropout': 0.1678333110053425, 'batch_norm': True, 'lr': 0.0005079548212617269, 'weight_decay': 1.4211194675009935e-05, 'epochs': 207, 'loss': 'mae', 'optimizer': 'adam', 'graph_mode': 'cutoff', 'cutoff': 0.7391245445599256, 'grm_norm': 'cosine_then_gcn', 'self_loops': False, 'use_snp_selection': True, 'num_snps': 50964}. Best is trial 17 with value: 0.2959834476894283.
[I 2025-12-08 12:28:19,300] Trial 45 finished with value: 0.29729996560538824 and parameters: {'model_type': 'gcn', 'hidden_dims': '[256, 128]', 'dropout': 0.12448651177243279, 'batch_norm': True, 'lr': 0.00035143666645192116, 'weight_decay': 5.907975001691935e-06, 'epochs': 100, 'loss': 'mae', 'optimizer': 'adam', 'graph_mode': 'cutoff', 'cutoff': 0.8417282288059255, 'grm_norm': 'cosine', 'self_loops': False, 'use_snp_selection': True, 'num_snps': 52927}. Best is trial 45 with value: 0.29729996560538824.
[I 2025-12-08 12:28:47,146] Trial 46 finished with value: 0.292619315009223 and parameters: {'model_type': 'gcn', 'hidden_dims': '[256, 128]', 'dropout': 0.12401501013848981, 'batch_norm': True, 'lr': 0.00033453975566558145, 'weight_decay': 6.00310947466e-06, 'epochs': 103, 'loss': 'mae', 'optimizer': 'adam', 'graph_mode': 'cutoff', 'cutoff': 0.8552827066600528, 'grm_norm': 'cosine', 'self_loops': True, 'use_snp_selection': True, 'num_snps': 53728}. Best is trial 45 with value: 0.29729996560538824.
[I 2025-12-08 12:29:14,488] Trial 47 finished with value: 0.2889671848850665 and parameters: {'model_type': 'gcn', 'hidden_dims': '[256, 128]', 'dropout': 0.11237523880791493, 'batch_norm': True, 'lr': 0.0016965438373588073, 'weight_decay': 5.7968942133419705e-06, 'epochs': 100, 'loss': 'mae', 'optimizer': 'adam', 'graph_mode': 'cutoff', 'cutoff': 0.8442326809967413, 'grm_norm': 'cosine', 'self_loops': True, 'use_snp_selection': True, 'num_snps': 52999}. Best is trial 45 with value: 0.29729996560538824.
[I 2025-12-08 12:29:25,837] Trial 48 finished with value: 0.2880297836737413 and parameters: {'model_type': 'gcn', 'hidden_dims': '[256, 128]', 'dropout': 0.11994818114471269, 'batch_norm': True, 'lr': 0.0003653014356168584, 'weight_decay': 1.6559584524609553e-06, 'epochs': 78, 'loss': 'mae', 'optimizer': 'adam', 'graph_mode': 'cutoff', 'cutoff': 0.628057090143985, 'grm_norm': 'cosine', 'self_loops': True, 'use_snp_selection': False}. Best is trial 45 with value: 0.29729996560538824.
