[I 2025-12-08 10:56:38,675] Trial 86 finished with value: 0.2725833605971605 and parameters: {'model_type': 'gcn', 'hidden_dims': '[256, 128]', 'dropout': 0.45894778155795196, 'batch_norm': True, 'lr': 0.00021233029171620322, 'weight_decay': 1.0830591032052158e-06, 'epochs': 61, 'loss': 'mae', 'optimizer': 'adam', 'graph_mode': 'cutoff', 'cutoff': 0.7105619664642594, 'grm_norm': 'cosine', 'self_loops': False, 'use_snp_selection': False}. Best is trial 82 with value: 0.28004719065847616.
[I 2025-12-08 10:56:48,799] Trial 87 finished with value: 0.2596442018813771 and parameters: {'model_type': 'gcn', 'hidden_dims': '[256, 128]', 'dropout': 0.4872170295147742, 'batch_norm': True, 'lr': 0.00017653073030179684, 'weight_decay': 3.2911588460536563e-07, 'epochs': 69, 'loss': 'mae', 'optimizer': 'adam', 'graph_mode': 'cutoff', 'cutoff': 0.6183327530834577, 'grm_norm': 'none', 'self_loops': False, 'use_snp_selection': False}. Best is trial 82 with value: 0.28004719065847616.
[I 2025-12-08 10:57:02,853] Trial 88 finished with value: 0.25664155536799904 and parameters: {'model_type': 'gcn', 'hidden_dims': '[256, 128]', 'dropout': 0.5984365601876925, 'batch_norm': True, 'lr': 0.00010250826160416916, 'weight_decay': 4.139348366934038e-07, 'epochs': 101, 'loss': 'mae', 'optimizer': 'adam', 'graph_mode': 'cutoff', 'cutoff': 0.5039455313667175, 'grm_norm': 'cosine', 'self_loops': False, 'use_snp_selection': False}. Best is trial 82 with value: 0.28004719065847616.
[I 2025-12-08 10:57:11,327] Trial 89 finished with value: 0.2768213509014442 and parameters: {'model_type': 'gcn', 'hidden_dims': '[128, 64]', 'dropout': 0.506496962972671, 'batch_norm': True, 'lr': 0.0002820617194327535, 'weight_decay': 2.3139172436991897e-07, 'epochs': 92, 'loss': 'mae', 'optimizer': 'adam', 'graph_mode': 'knn', 'knn_k': 5, 'weighted_edges': True, 'symmetrize_mode': 'union', 'self_loops': False, 'use_snp_selection': False}. Best is trial 82 with value: 0.28004719065847616.
[I 2025-12-08 10:57:19,906] Trial 90 finished with value: 0.2524164112181136 and parameters: {'model_type': 'gcn', 'hidden_dims': '[128, 64]', 'dropout': 0.5095715507102059, 'batch_norm': True, 'lr': 0.0007103304338273476, 'weight_decay': 1.997707556291885e-07, 'epochs': 93, 'loss': 'mae', 'optimizer': 'adam', 'graph_mode': 'knn', 'knn_k': 5, 'weighted_edges': True, 'symmetrize_mode': 'union', 'self_loops': True, 'use_snp_selection': False}. Best is trial 82 with value: 0.28004719065847616.
[I 2025-12-08 10:57:30,197] Trial 91 finished with value: 0.2683474412195842 and parameters: {'model_type': 'gcn', 'hidden_dims': '[128, 64]', 'dropout': 0.5252640495702235, 'batch_norm': True, 'lr': 0.00029286197846112695, 'weight_decay': 5.050329410084289e-07, 'epochs': 118, 'loss': 'mae', 'optimizer': 'adam', 'graph_mode': 'knn', 'knn_k': 7, 'weighted_edges': True, 'symmetrize_mode': 'union', 'self_loops': False, 'use_snp_selection': False}. Best is trial 82 with value: 0.28004719065847616.
[I 2025-12-08 10:57:37,214] Trial 92 finished with value: 0.25499858760976873 and parameters: {'model_type': 'gcn', 'hidden_dims': '[128, 64]', 'dropout': 0.4383818514301677, 'batch_norm': True, 'lr': 0.0003804209975174664, 'weight_decay': 8.581254289542903e-07, 'epochs': 72, 'loss': 'mae', 'optimizer': 'adam', 'graph_mode': 'knn', 'knn_k': 3, 'weighted_edges': True, 'symmetrize_mode': 'union', 'self_loops': False, 'use_snp_selection': False}. Best is trial 82 with value: 0.28004719065847616.
[I 2025-12-08 10:57:47,248] Trial 93 finished with value: 0.26345498589230576 and parameters: {'model_type': 'gcn', 'hidden_dims': '[128, 64]', 'dropout': 0.49583550781540336, 'batch_norm': True, 'lr': 9.22512099657172e-05, 'weight_decay': 2.490160224707781e-07, 'epochs': 115, 'loss': 'mae', 'optimizer': 'adam', 'graph_mode': 'knn', 'knn_k': 5, 'weighted_edges': True, 'symmetrize_mode': 'union', 'self_loops': False, 'use_snp_selection': False}. Best is trial 82 with value: 0.28004719065847616.
[I 2025-12-08 10:57:59,890] Trial 94 finished with value: 0.2332194690715803 and parameters: {'model_type': 'gcn', 'hidden_dims': '[256, 128]', 'dropout': 0.4730194286714344, 'batch_norm': True, 'lr': 0.0004753642929709677, 'weight_decay': 5.157485853242016e-05, 'epochs': 87, 'loss': 'mae', 'optimizer': 'adam', 'graph_mode': 'knn', 'knn_k': 2, 'weighted_edges': True, 'symmetrize_mode': 'union', 'self_loops': False, 'use_snp_selection': False}. Best is trial 82 with value: 0.28004719065847616.
[I 2025-12-08 10:58:28,133] Trial 95 finished with value: 0.27971761223262054 and parameters: {'model_type': 'gcn', 'hidden_dims': '[512, 128]', 'dropout': 0.5088277141256221, 'batch_norm': True, 'lr': 0.0002258515469383073, 'weight_decay': 6.973316041042196e-07, 'epochs': 105, 'loss': 'mae', 'optimizer': 'adam', 'graph_mode': 'cutoff', 'cutoff': 0.7359120144729822, 'grm_norm': 'gcn', 'self_loops': False, 'use_snp_selection': False}. Best is trial 82 with value: 0.28004719065847616.
[I 2025-12-08 10:59:02,639] Trial 96 finished with value: 0.26690790701248124 and parameters: {'model_type': 'gcn', 'hidden_dims': '[512, 128]', 'dropout': 0.5838035751502807, 'batch_norm': True, 'lr': 0.0001993336465006278, 'weight_decay': 6.806203375534483e-07, 'epochs': 131, 'loss': 'mse', 'optimizer': 'adam', 'graph_mode': 'cutoff', 'cutoff': 0.7428362982654607, 'grm_norm': 'gcn', 'self_loops': False, 'use_snp_selection': False}. Best is trial 82 with value: 0.28004719065847616.
[I 2025-12-08 10:59:30,643] Trial 97 finished with value: 0.2840562757484524 and parameters: {'model_type': 'gcn', 'hidden_dims': '[512, 128]', 'dropout': 0.5358326090030332, 'batch_norm': True, 'lr': 0.0001493097732834319, 'weight_decay': 4.3010745045540736e-07, 'epochs': 104, 'loss': 'mae', 'optimizer': 'adam', 'graph_mode': 'cutoff', 'cutoff': 0.6975628181699862, 'grm_norm': 'gcn', 'self_loops': False, 'use_snp_selection': False}. Best is trial 97 with value: 0.2840562757484524.
[I 2025-12-08 10:59:58,779] Trial 98 finished with value: 0.262520785230034 and parameters: {'model_type': 'gcn', 'hidden_dims': '[512, 128]', 'dropout': 0.5531459847667524, 'batch_norm': False, 'lr': 0.0001425537287274544, 'weight_decay': 1.2203892447655013e-06, 'epochs': 105, 'loss': 'mae', 'optimizer': 'adam', 'graph_mode': 'cutoff', 'cutoff': 0.6996761967312509, 'grm_norm': 'gcn', 'self_loops': False, 'use_snp_selection': False}. Best is trial 97 with value: 0.2840562757484524.
[I 2025-12-08 11:00:30,900] Trial 99 finished with value: 0.2673927305623836 and parameters: {'model_type': 'gcn', 'hidden_dims': '[512, 128]', 'dropout': 0.573417683197216, 'batch_norm': True, 'lr': 0.00023230414756804005, 'weight_decay': 1.6593662642172154e-06, 'epochs': 121, 'loss': 'mae', 'optimizer': 'adam', 'graph_mode': 'cutoff', 'cutoff': 0.6567732226099315, 'grm_norm': 'gcn', 'self_loops': False, 'use_snp_selection': False}. Best is trial 97 with value: 0.2840562757484524.
[I 2025-12-08 11:00:59,475] Trial 100 finished with value: 0.2651950581658352 and parameters: {'model_type': 'gcn', 'hidden_dims': '[512, 128]', 'dropout': 0.5350122687496368, 'batch_norm': True, 'lr': 9.44217189881245e-05, 'weight_decay': 4.5100506934122417e-07, 'epochs': 106, 'loss': 'mae', 'optimizer': 'adam', 'graph_mode': 'cutoff', 'cutoff': 0.7678925381117602, 'grm_norm': 'gcn', 'self_loops': True, 'use_snp_selection': False}. Best is trial 97 with value: 0.2840562757484524.
[I 2025-12-08 11:01:25,185] Trial 101 finished with value: 0.27269545603455325 and parameters: {'model_type': 'gcn', 'hidden_dims': '[512, 128]', 'dropout': 0.5117712563114256, 'batch_norm': True, 'lr': 0.00026453713304209255, 'weight_decay': 1.5779062846572777e-07, 'epochs': 94, 'loss': 'mae', 'optimizer': 'adam', 'graph_mode': 'cutoff', 'cutoff': 0.7324406615484051, 'grm_norm': 'gcn', 'self_loops': False, 'use_snp_selection': False}. Best is trial 97 with value: 0.2840562757484524.
[I 2025-12-08 11:01:48,477] Trial 102 finished with value: 0.28069731204405973 and parameters: {'model_type': 'gcn', 'hidden_dims': '[512, 128]', 'dropout': 0.526825473345837, 'batch_norm': True, 'lr': 0.0005320927106551476, 'weight_decay': 3.2885212500789225e-07, 'epochs': 84, 'loss': 'mae', 'optimizer': 'adam', 'graph_mode': 'cutoff', 'cutoff': 0.7216688847373482, 'grm_norm': 'gcn', 'self_loops': False, 'use_snp_selection': False}. Best is trial 97 with value: 0.2840562757484524.
[I 2025-12-08 11:02:10,027] Trial 103 finished with value: 0.27300215472001205 and parameters: {'model_type': 'gcn', 'hidden_dims': '[512, 128]', 'dropout': 0.5256792241444451, 'batch_norm': True, 'lr': 0.0005641149640198544, 'weight_decay': 4.030344043100299e-05, 'epochs': 77, 'loss': 'mae', 'optimizer': 'adam', 'graph_mode': 'cutoff', 'cutoff': 0.7223236956089426, 'grm_norm': 'gcn', 'self_loops': False, 'use_snp_selection': False}. Best is trial 97 with value: 0.2840562757484524.
[I 2025-12-08 11:02:40,214] Trial 104 finished with value: 0.2659288799084291 and parameters: {'model_type': 'gcn', 'hidden_dims': '[512, 128]', 'dropout': 0.5465644571034809, 'batch_norm': True, 'lr': 0.0003343053764950358, 'weight_decay': 6.553422749744256e-07, 'epochs': 113, 'loss': 'mae', 'optimizer': 'adam', 'graph_mode': 'cutoff', 'cutoff': 0.7066639903354431, 'grm_norm': 'gcn', 'self_loops': False, 'use_snp_selection': False}. Best is trial 97 with value: 0.2840562757484524.
[I 2025-12-08 11:03:16,387] Trial 105 finished with value: 0.2791610828866268 and parameters: {'model_type': 'gcn', 'hidden_dims': '[512, 128]', 'dropout': 0.48645327889613876, 'batch_norm': True, 'lr': 5.5154762356852594e-05, 'weight_decay': 7.861646966646961e-07, 'epochs': 138, 'loss': 'mae', 'optimizer': 'adam', 'graph_mode': 'cutoff', 'cutoff': 0.752146404403887, 'grm_norm': 'gcn', 'self_loops': False, 'use_snp_selection': False}. Best is trial 97 with value: 0.2840562757484524.
[I 2025-12-08 11:03:52,828] Trial 106 finished with value: 0.2783252823859974 and parameters: {'model_type': 'gcn', 'hidden_dims': '[512, 128]', 'dropout': 0.4803637459948396, 'batch_norm': True, 'lr': 5.896723173108666e-05, 'weight_decay': 3.751236082679237e-07, 'epochs': 139, 'loss': 'mae', 'optimizer': 'adam', 'graph_mode': 'cutoff', 'cutoff': 0.7573859835014164, 'grm_norm': 'gcn', 'self_loops': False, 'use_snp_selection': False}. Best is trial 97 with value: 0.2840562757484524.
[I 2025-12-08 11:04:26,111] Trial 107 finished with value: 0.26956256322092087 and parameters: {'model_type': 'gcn', 'hidden_dims': '[512, 128]', 'dropout': 0.46212060825844914, 'batch_norm': True, 'lr': 5.097026523418744e-05, 'weight_decay': 3.927926095502911e-07, 'epochs': 126, 'loss': 'mae', 'optimizer': 'adam', 'graph_mode': 'cutoff', 'cutoff': 0.782522514053159, 'grm_norm': 'gcn', 'self_loops': False, 'use_snp_selection': False}. Best is trial 97 with value: 0.2840562757484524.
[I 2025-12-08 11:05:03,000] Trial 108 finished with value: 0.2778163453795643 and parameters: {'model_type': 'gcn', 'hidden_dims': '[512, 128]', 'dropout': 0.48170159511054544, 'batch_norm': True, 'lr': 5.8726383067623107e-05, 'weight_decay': 7.397627408821261e-07, 'epochs': 141, 'loss': 'mae', 'optimizer': 'adam', 'graph_mode': 'cutoff', 'cutoff': 0.8333838276181704, 'grm_norm': 'gcn', 'self_loops': False, 'use_snp_selection': False}. Best is trial 97 with value: 0.2840562757484524.
[I 2025-12-08 11:05:39,411] Trial 109 finished with value: 0.2656249810608583 and parameters: {'model_type': 'gcn', 'hidden_dims': '[512, 128]', 'dropout': 0.45539829903873086, 'batch_norm': True, 'lr': 3.201769699531324e-05, 'weight_decay': 5.022412163851417e-07, 'epochs': 139, 'loss': 'mae', 'optimizer': 'adam', 'graph_mode': 'cutoff', 'cutoff': 0.8254661873797238, 'grm_norm': 'gcn', 'self_loops': False, 'use_snp_selection': False}. Best is trial 97 with value: 0.2840562757484524.
[I 2025-12-08 11:05:52,217] Trial 110 finished with value: 0.2637444119102539 and parameters: {'model_type': 'gcn', 'hidden_dims': '[512, 128]', 'dropout': 0.4801039839929285, 'batch_norm': True, 'lr': 5.8398368969346537e-05, 'weight_decay': 2.860406132550879e-07, 'epochs': 41, 'loss': 'mse', 'optimizer': 'adam', 'graph_mode': 'cutoff', 'cutoff': 0.7578753536436117, 'grm_norm': 'gcn', 'self_loops': True, 'use_snp_selection': False}. Best is trial 97 with value: 0.2840562757484524.
[I 2025-12-08 11:06:30,315] Trial 111 finished with value: 0.2727703275317827 and parameters: {'model_type': 'gcn', 'hidden_dims': '[512, 128]', 'dropout': 0.4405190632733062, 'batch_norm': True, 'lr': 7.616514102877641e-05, 'weight_decay': 7.454050675819246e-07, 'epochs': 146, 'loss': 'mae', 'optimizer': 'adam', 'graph_mode': 'cutoff', 'cutoff': 0.8008489712824507, 'grm_norm': 'gcn', 'self_loops': False, 'use_snp_selection': False}. Best is trial 97 with value: 0.2840562757484524.
[I 2025-12-08 11:07:04,087] Trial 112 finished with value: 0.27746670529516815 and parameters: {'model_type': 'gcn', 'hidden_dims': '[512, 128]', 'dropout': 0.467977116196524, 'batch_norm': True, 'lr': 4.4743726558719426e-05, 'weight_decay': 8.187878238923768e-07, 'epochs': 128, 'loss': 'mae', 'optimizer': 'adam', 'graph_mode': 'cutoff', 'cutoff': 0.8417594827407828, 'grm_norm': 'gcn', 'self_loops': False, 'use_snp_selection': False}. Best is trial 97 with value: 0.2840562757484524.
[I 2025-12-08 11:07:34,745] Trial 113 finished with value: 0.25765617849253253 and parameters: {'model_type': 'gcn', 'hidden_dims': '[512, 128]', 'dropout': 0.4855010434389841, 'batch_norm': True, 'lr': 4.169766193873094e-05, 'weight_decay': 2.0872168398844134e-05, 'epochs': 115, 'loss': 'mae', 'optimizer': 'adam', 'graph_mode': 'cutoff', 'cutoff': 0.7784535687476632, 'grm_norm': 'gcn', 'self_loops': False, 'use_snp_selection': False}. Best is trial 97 with value: 0.2840562757484524.
[I 2025-12-08 11:07:58,164] Trial 114 finished with value: 0.2700749222272107 and parameters: {'model_type': 'gcn', 'hidden_dims': '[512, 128]', 'dropout': 0.5301799528425181, 'batch_norm': True, 'lr': 6.321430813820994e-05, 'weight_decay': 5.840105748812941e-07, 'epochs': 85, 'loss': 'mae', 'optimizer': 'adam', 'graph_mode': 'cutoff', 'cutoff': 0.754217492729043, 'grm_norm': 'gcn', 'self_loops': False, 'use_snp_selection': False}. Best is trial 97 with value: 0.2840562757484524.
[I 2025-12-08 11:08:42,284] Trial 115 finished with value: 0.2651318240204953 and parameters: {'model_type': 'gcn', 'hidden_dims': '[512, 128]', 'dropout': 0.5036781470045406, 'batch_norm': True, 'lr': 2.641687112628992e-05, 'weight_decay': 1.4809050108517673e-06, 'epochs': 171, 'loss': 'mae', 'optimizer': 'adam', 'graph_mode': 'cutoff', 'cutoff': 0.867630925458324, 'grm_norm': 'gcn', 'self_loops': False, 'use_snp_selection': False}. Best is trial 97 with value: 0.2840562757484524.
[I 2025-12-08 11:09:30,973] Trial 116 finished with value: 0.21538537531967994 and parameters: {'model_type': 'gcn', 'hidden_dims': '[512, 128]', 'dropout': 0.4732151027872414, 'batch_norm': True, 'lr': 7.873356351750766e-05, 'weight_decay': 0.0005883012147239129, 'epochs': 188, 'loss': 'mae', 'optimizer': 'adam', 'graph_mode': 'cutoff', 'cutoff': 0.4202487803903035, 'grm_norm': 'gcn', 'self_loops': False, 'use_snp_selection': False}. Best is trial 97 with value: 0.2840562757484524.
[I 2025-12-08 11:09:57,415] Trial 117 finished with value: 0.23674357612807123 and parameters: {'model_type': 'gcn', 'hidden_dims': '[512, 128]', 'dropout': 0.48890119352991285, 'batch_norm': False, 'lr': 0.0001181117565365559, 'weight_decay': 1.1454682561942392e-06, 'epochs': 98, 'loss': 'mae', 'optimizer': 'adam', 'graph_mode': 'cutoff', 'cutoff': 0.7253277179848125, 'grm_norm': 'gcn', 'self_loops': False, 'use_snp_selection': False}. Best is trial 97 with value: 0.2840562757484524.
[I 2025-12-08 11:10:31,917] Trial 118 finished with value: 0.2627666305671095 and parameters: {'model_type': 'gcn', 'hidden_dims': '[512, 128]', 'dropout': 0.5194268466778736, 'batch_norm': True, 'lr': 2.1551456161410163e-05, 'weight_decay': 3.772405887968172e-07, 'epochs': 131, 'loss': 'mae', 'optimizer': 'adam', 'graph_mode': 'cutoff', 'cutoff': 0.8170995305409531, 'grm_norm': 'none', 'self_loops': False, 'use_snp_selection': False}. Best is trial 97 with value: 0.2840562757484524.
[I 2025-12-08 11:11:11,964] Trial 119 finished with value: 0.27399740835492803 and parameters: {'model_type': 'gcn', 'hidden_dims': '[512, 128]', 'dropout': 0.4994314364785997, 'batch_norm': True, 'lr': 4.785018878096237e-05, 'weight_decay': 9.486270596759831e-07, 'epochs': 154, 'loss': 'mae', 'optimizer': 'adam', 'graph_mode': 'cutoff', 'cutoff': 0.6908197293338593, 'grm_norm': 'gcn', 'self_loops': False, 'use_snp_selection': False}. Best is trial 97 with value: 0.2840562757484524.
[I 2025-12-08 11:11:49,662] Trial 120 finished with value: 0.27488344132418846 and parameters: {'model_type': 'gcn', 'hidden_dims': '[512, 256]', 'dropout': 0.42948458585540183, 'batch_norm': True, 'lr': 0.007735560842738993, 'weight_decay': 5.702397063752352e-07, 'epochs': 144, 'loss': 'mae', 'optimizer': 'adam', 'graph_mode': 'cutoff', 'cutoff': 0.7923470919853456, 'grm_norm': 'gcn', 'self_loops': True, 'use_snp_selection': False}. Best is trial 97 with value: 0.2840562757484524.
[I 2025-12-08 11:12:08,266] Trial 121 finished with value: 0.2665058014500921 and parameters: {'model_type': 'gcn', 'hidden_dims': '[256, 128, 64]', 'dropout': 0.5401867982398534, 'batch_norm': True, 'lr': 0.0001486773314032058, 'weight_decay': 1.2197903839640114e-05, 'epochs': 136, 'loss': 'mae', 'optimizer': 'adam', 'graph_mode': 'cutoff', 'cutoff': 0.643886925020712, 'grm_norm': 'gcn', 'self_loops': False, 'use_snp_selection': False}. Best is trial 97 with value: 0.2840562757484524.
[I 2025-12-08 11:12:41,276] Trial 122 finished with value: 0.2728571261713166 and parameters: {'model_type': 'gcn', 'hidden_dims': '[512, 128]', 'dropout': 0.5121128743956203, 'batch_norm': True, 'lr': 5.824923392242023e-05, 'weight_decay': 3.084358624980092e-07, 'epochs': 124, 'loss': 'mae', 'optimizer': 'adam', 'graph_mode': 'cutoff', 'cutoff': 0.7143249649625895, 'grm_norm': 'none', 'self_loops': False, 'use_snp_selection': False}. Best is trial 97 with value: 0.2840562757484524.
[I 2025-12-08 11:13:22,945] Trial 123 finished with value: 0.2683215351245903 and parameters: {'model_type': 'gcn', 'hidden_dims': '[512, 128]', 'dropout': 0.1999105658449516, 'batch_norm': True, 'lr': 7.000377770712303e-05, 'weight_decay': 3.415195950992696e-07, 'epochs': 160, 'loss': 'mae', 'optimizer': 'adam', 'graph_mode': 'cutoff', 'cutoff': 0.6677890191997087, 'grm_norm': 'gcn', 'self_loops': False, 'use_snp_selection': False}. Best is trial 97 with value: 0.2840562757484524.
[I 2025-12-08 11:13:52,696] Trial 124 finished with value: 0.26026485952515593 and parameters: {'model_type': 'gcn', 'hidden_dims': '[512, 128]', 'dropout': 0.5192395400123602, 'batch_norm': True, 'lr': 8.823020981230016e-05, 'weight_decay': 4.4663556516290814e-07, 'epochs': 111, 'loss': 'mae', 'optimizer': 'adam', 'graph_mode': 'cutoff', 'cutoff': 0.7332690293123865, 'grm_norm': 'gcn', 'self_loops': False, 'use_snp_selection': False}. Best is trial 97 with value: 0.2840562757484524.
[I 2025-12-08 11:14:11,116] Trial 125 finished with value: 0.2548315358415397 and parameters: {'model_type': 'gcn', 'hidden_dims': '[256, 128]', 'dropout': 0.23571317948014592, 'batch_norm': True, 'lr': 3.406757435251693e-05, 'weight_decay': 7.126605925258927e-07, 'epochs': 139, 'loss': 'mae', 'optimizer': 'adam', 'graph_mode': 'cutoff', 'cutoff': 0.6902205939472075, 'grm_norm': 'cosine', 'self_loops': False, 'use_snp_selection': False}. Best is trial 97 with value: 0.2840562757484524.
[I 2025-12-08 11:14:28,106] Trial 126 finished with value: 0.25420996975979093 and parameters: {'model_type': 'gcn', 'hidden_dims': '[256, 128]', 'dropout': 0.566916918200225, 'batch_norm': True, 'lr': 3.822410519829883e-05, 'weight_decay': 4.901283646867106e-07, 'epochs': 118, 'loss': 'mae', 'optimizer': 'adam', 'graph_mode': 'cutoff', 'cutoff': 0.2471833395212069, 'grm_norm': 'gcn', 'self_loops': False, 'use_snp_selection': True, 'num_snps': 20008}. Best is trial 97 with value: 0.2840562757484524.
[I 2025-12-08 11:15:07,286] Trial 127 finished with value: 0.26762484949857945 and parameters: {'model_type': 'gcn', 'hidden_dims': '[512, 256]', 'dropout': 0.4826484273334495, 'batch_norm': True, 'lr': 6.74740343200569e-05, 'weight_decay': 1.9382403833676345e-07, 'epochs': 150, 'loss': 'mae', 'optimizer': 'adam', 'graph_mode': 'cutoff', 'cutoff': 0.7573396372195746, 'grm_norm': 'none', 'self_loops': False, 'use_snp_selection': False}. Best is trial 97 with value: 0.2840562757484524.
[I 2025-12-08 11:15:41,783] Trial 128 finished with value: 0.2742030377183663 and parameters: {'model_type': 'gcn', 'hidden_dims': '[512, 128]', 'dropout': 0.5549869151395109, 'batch_norm': True, 'lr': 0.00018102643948141985, 'weight_decay': 8.708312002526824e-07, 'epochs': 130, 'loss': 'mae', 'optimizer': 'adam', 'graph_mode': 'cutoff', 'cutoff': 0.7774427987599508, 'grm_norm': 'cosine', 'self_loops': False, 'use_snp_selection': False}. Best is trial 97 with value: 0.2840562757484524.
[I 2025-12-08 11:16:03,251] Trial 129 finished with value: 0.273772784077397 and parameters: {'model_type': 'gcn', 'hidden_dims': '[256, 128]', 'dropout': 0.3361558821903332, 'batch_norm': True, 'lr': 0.0001254001178583584, 'weight_decay': 2.7249493917820493e-07, 'epochs': 166, 'loss': 'mae', 'optimizer': 'adam', 'graph_mode': 'cutoff', 'cutoff': 0.8398109164339994, 'grm_norm': 'gcn', 'self_loops': False, 'use_snp_selection': False}. Best is trial 97 with value: 0.2840562757484524.
