[I 2025-12-08 22:59:17,418] Trial 146 finished with value: 0.3638192513463285 and parameters: {'model_type': 'gcn', 'hidden_dims': '[512, 128]', 'dropout': 0.4895370549941066, 'batch_norm': False, 'lr': 9.776321693119437e-05, 'weight_decay': 4.1528868608159425e-05, 'epochs': 126, 'loss': 'mae', 'optimizer': 'adam', 'graph_mode': 'cutoff', 'cutoff': 0.6416134588840837, 'grm_norm': 'cosine', 'self_loops': False, 'use_snp_selection': True, 'num_snps': 44123}. Best is trial 114 with value: 0.37435876783182165.
[I 2025-12-08 22:59:49,646] Trial 147 finished with value: 0.3541443699136564 and parameters: {'model_type': 'gcn', 'hidden_dims': '[512, 128]', 'dropout': 0.515523055132763, 'batch_norm': False, 'lr': 7.192569299827942e-05, 'weight_decay': 2.9908635521387867e-05, 'epochs': 110, 'loss': 'mae', 'optimizer': 'adam', 'graph_mode': 'cutoff', 'cutoff': 0.5550961261017181, 'grm_norm': 'gcn', 'self_loops': False, 'use_snp_selection': True, 'num_snps': 41542}. Best is trial 114 with value: 0.37435876783182165.
[I 2025-12-08 23:00:27,311] Trial 148 finished with value: 0.35838501162495584 and parameters: {'model_type': 'gcn', 'hidden_dims': '[512, 128]', 'dropout': 0.49503142777191333, 'batch_norm': False, 'lr': 0.00011662188401232431, 'weight_decay': 3.54500149392643e-05, 'epochs': 140, 'loss': 'mae', 'optimizer': 'adam', 'graph_mode': 'cutoff', 'cutoff': 0.6610289563242815, 'grm_norm': 'cosine', 'self_loops': True, 'use_snp_selection': True, 'num_snps': 43144}. Best is trial 114 with value: 0.37435876783182165.
[I 2025-12-08 23:00:48,972] Trial 149 finished with value: 0.20138914393030688 and parameters: {'model_type': 'gcn', 'hidden_dims': '[128, 64]', 'dropout': 0.4825188466867357, 'batch_norm': False, 'lr': 0.00016407820302515575, 'weight_decay': 0.00011787287687840752, 'epochs': 121, 'loss': 'mae', 'optimizer': 'adam', 'graph_mode': 'cutoff', 'cutoff': 0.6190211425893422, 'grm_norm': 'cosine', 'self_loops': False, 'use_snp_selection': True, 'num_snps': 46550}. Best is trial 114 with value: 0.37435876783182165.
