[I 2025-12-08 20:32:14,750] Trial 137 finished with value: 0.2950614936452539 and parameters: {'model_type': 'gcn', 'hidden_dims': '[256, 128, 64]', 'dropout': 0.5822009922462255, 'batch_norm': True, 'lr': 0.008972781103706199, 'weight_decay': 7.860446022301389e-07, 'epochs': 206, 'loss': 'mse', 'optimizer': 'adam', 'graph_mode': 'cutoff', 'cutoff': 0.7752831892789533, 'grm_norm': 'cosine_then_gcn', 'self_loops': True, 'use_snp_selection': False}. Best is trial 91 with value: 0.30501010443916743.
[I 2025-12-08 20:33:01,672] Trial 138 finished with value: 0.2996693035443495 and parameters: {'model_type': 'gcn', 'hidden_dims': '[512, 64]', 'dropout': 0.5653946580630822, 'batch_norm': True, 'lr': 0.00992523720352407, 'weight_decay': 4.84426433742067e-07, 'epochs': 183, 'loss': 'mse', 'optimizer': 'adam', 'graph_mode': 'cutoff', 'cutoff': 0.7531513299111486, 'grm_norm': 'cosine_then_gcn', 'self_loops': True, 'use_snp_selection': False}. Best is trial 91 with value: 0.30501010443916743.
[I 2025-12-08 20:33:49,434] Trial 139 finished with value: 0.18771334914612356 and parameters: {'model_type': 'gcn', 'hidden_dims': '[512, 64]', 'dropout': 0.11266063474237117, 'batch_norm': True, 'lr': 0.009194638202633564, 'weight_decay': 5.183074596777371e-07, 'epochs': 184, 'loss': 'mse', 'optimizer': 'adam', 'graph_mode': 'knn', 'knn_k': 5, 'weighted_edges': False, 'symmetrize_mode': 'mutual', 'self_loops': True, 'use_snp_selection': False}. Best is trial 91 with value: 0.30501010443916743.
[I 2025-12-08 20:34:39,730] Trial 140 finished with value: 0.2942955999823039 and parameters: {'model_type': 'gcn', 'hidden_dims': '[512, 64]', 'dropout': 0.5687823967385557, 'batch_norm': True, 'lr': 0.006269356697056225, 'weight_decay': 4.5076846431509e-07, 'epochs': 197, 'loss': 'mse', 'optimizer': 'adam', 'graph_mode': 'cutoff', 'cutoff': 0.6996664520181918, 'grm_norm': 'cosine_then_gcn', 'self_loops': False, 'use_snp_selection': False}. Best is trial 91 with value: 0.30501010443916743.
[I 2025-12-08 20:35:31,231] Trial 141 finished with value: 0.29895996226814087 and parameters: {'model_type': 'gcn', 'hidden_dims': '[512, 64]', 'dropout': 0.5883617219127136, 'batch_norm': True, 'lr': 0.009780018014832808, 'weight_decay': 9.046024307472274e-07, 'epochs': 202, 'loss': 'mse', 'optimizer': 'adam', 'graph_mode': 'cutoff', 'cutoff': 0.7495079604945929, 'grm_norm': 'cosine_then_gcn', 'self_loops': True, 'use_snp_selection': False}. Best is trial 91 with value: 0.30501010443916743.
[I 2025-12-08 20:36:27,060] Trial 142 finished with value: 0.29341466330163896 and parameters: {'model_type': 'gcn', 'hidden_dims': '[512, 64]', 'dropout': 0.5762673737121344, 'batch_norm': True, 'lr': 0.007964381879206886, 'weight_decay': 1.5554886738859813e-06, 'epochs': 220, 'loss': 'mse', 'optimizer': 'adam', 'graph_mode': 'cutoff', 'cutoff': 0.7286697274414419, 'grm_norm': 'cosine_then_gcn', 'self_loops': True, 'use_snp_selection': False}. Best is trial 91 with value: 0.30501010443916743.
[I 2025-12-08 20:37:14,356] Trial 143 finished with value: 0.30438356911288483 and parameters: {'model_type': 'gcn', 'hidden_dims': '[512, 256]', 'dropout': 0.5648648397384742, 'batch_norm': True, 'lr': 0.0075037778491678095, 'weight_decay': 2.342855127146881e-06, 'epochs': 184, 'loss': 'mse', 'optimizer': 'adam', 'graph_mode': 'cutoff', 'cutoff': 0.763394094838804, 'grm_norm': 'cosine_then_gcn', 'self_loops': True, 'use_snp_selection': False}. Best is trial 91 with value: 0.30501010443916743.
[I 2025-12-08 20:38:04,052] Trial 144 finished with value: 0.29970476235445237 and parameters: {'model_type': 'gcn', 'hidden_dims': '[512, 256]', 'dropout': 0.5629140524910533, 'batch_norm': True, 'lr': 0.0072721012254746715, 'weight_decay': 2.306955667168425e-06, 'epochs': 194, 'loss': 'mse', 'optimizer': 'adam', 'graph_mode': 'cutoff', 'cutoff': 0.7615361409319796, 'grm_norm': 'cosine_then_gcn', 'self_loops': True, 'use_snp_selection': False}. Best is trial 91 with value: 0.30501010443916743.
[I 2025-12-08 20:38:52,308] Trial 145 finished with value: 0.2999495259069871 and parameters: {'model_type': 'gcn', 'hidden_dims': '[512, 256]', 'dropout': 0.5497582797539632, 'batch_norm': True, 'lr': 0.005121142290370951, 'weight_decay': 2.2202483110820296e-06, 'epochs': 188, 'loss': 'mse', 'optimizer': 'adam', 'graph_mode': 'cutoff', 'cutoff': 0.7639128728233819, 'grm_norm': 'cosine_then_gcn', 'self_loops': True, 'use_snp_selection': False}. Best is trial 91 with value: 0.30501010443916743.
[I 2025-12-08 20:39:40,798] Trial 146 finished with value: 0.30047114814972714 and parameters: {'model_type': 'gcn', 'hidden_dims': '[512, 256]', 'dropout': 0.5551222370968026, 'batch_norm': True, 'lr': 0.005154368820689854, 'weight_decay': 4.603773861078513e-06, 'epochs': 189, 'loss': 'mse', 'optimizer': 'adam', 'graph_mode': 'cutoff', 'cutoff': 0.7375610658432687, 'grm_norm': 'cosine_then_gcn', 'self_loops': True, 'use_snp_selection': False}. Best is trial 91 with value: 0.30501010443916743.
[I 2025-12-08 20:40:35,896] Trial 147 finished with value: 0.2194795503701379 and parameters: {'model_type': 'gcn', 'hidden_dims': '[512, 256]', 'dropout': 0.5465049072666337, 'batch_norm': True, 'lr': 8.753698387478131e-05, 'weight_decay': 4.7581984602227014e-06, 'epochs': 213, 'loss': 'mse', 'optimizer': 'adam', 'graph_mode': 'cutoff', 'cutoff': 0.3251656426009607, 'grm_norm': 'cosine_then_gcn', 'self_loops': True, 'use_snp_selection': False}. Best is trial 91 with value: 0.30501010443916743.
[I 2025-12-08 20:41:28,620] Trial 148 finished with value: 0.249679325258546 and parameters: {'model_type': 'gcn', 'hidden_dims': '[512, 256]', 'dropout': 0.5532572429559652, 'batch_norm': True, 'lr': 0.005004805644165414, 'weight_decay': 2.1933285105462047e-06, 'epochs': 175, 'loss': 'mae', 'optimizer': 'adam', 'graph_mode': 'cutoff', 'cutoff': 0.22101837186668266, 'grm_norm': 'cosine_then_gcn', 'self_loops': True, 'use_snp_selection': True, 'num_snps': 52541}. Best is trial 91 with value: 0.30501010443916743.
[I 2025-12-08 20:42:17,037] Trial 149 finished with value: 0.0 and parameters: {'model_type': 'gcn', 'hidden_dims': '[512, 64]', 'dropout': 0.5987253078044961, 'batch_norm': False, 'lr': 0.005951278474636057, 'weight_decay': 1.4454628887250443e-05, 'epochs': 190, 'loss': 'mse', 'optimizer': 'adam', 'graph_mode': 'cutoff', 'cutoff': 0.733986846635593, 'grm_norm': 'cosine_then_gcn', 'self_loops': True, 'use_snp_selection': False}. Best is trial 91 with value: 0.30501010443916743.
[I 2025-12-08 20:42:52,143] Trial 0 finished with value: 0.25189869508577856 and parameters: {'model_type': 'gcn', 'hidden_dims': '[128, 64]', 'dropout': 0.199031432379812, 'batch_norm': True, 'lr': 1.8408544111075823e-05, 'weight_decay': 5.5136510071208614e-05, 'epochs': 336, 'loss': 'mae', 'optimizer': 'adam', 'graph_mode': 'knn', 'knn_k': 8, 'weighted_edges': True, 'symmetrize_mode': 'mutual', 'self_loops': True, 'use_snp_selection': True, 'num_snps': 27173}. Best is trial 0 with value: 0.25189869508577856.
[I 2025-12-08 20:43:31,255] Trial 1 finished with value: 0.2216079772268853 and parameters: {'model_type': 'gcn', 'hidden_dims': '[256, 128, 64]', 'dropout': 0.5543244404043342, 'batch_norm': True, 'lr': 7.981787657617978e-05, 'weight_decay': 2.8571789869344834e-07, 'epochs': 297, 'loss': 'mae', 'optimizer': 'adam', 'graph_mode': 'cutoff', 'cutoff': 0.3392632777751686, 'grm_norm': 'gcn', 'self_loops': False, 'use_snp_selection': False}. Best is trial 0 with value: 0.25189869508577856.
[I 2025-12-08 20:44:29,328] Trial 2 finished with value: 0.21883169391494772 and parameters: {'model_type': 'gcn', 'hidden_dims': '[512, 64]', 'dropout': 0.32815227354739207, 'batch_norm': True, 'lr': 0.000619605044204259, 'weight_decay': 0.0004086269831625786, 'epochs': 206, 'loss': 'mse', 'optimizer': 'adam', 'graph_mode': 'knn', 'knn_k': 4, 'weighted_edges': True, 'symmetrize_mode': 'union', 'self_loops': True, 'use_snp_selection': True, 'num_snps': 53035}. Best is trial 0 with value: 0.25189869508577856.
[I 2025-12-08 20:44:56,721] Trial 3 finished with value: 0.20340620956123176 and parameters: {'model_type': 'gcn', 'hidden_dims': '[256, 128]', 'dropout': 0.23110783056597514, 'batch_norm': True, 'lr': 8.11311593386298e-05, 'weight_decay': 9.296158109581328e-07, 'epochs': 213, 'loss': 'mse', 'optimizer': 'adam', 'graph_mode': 'knn', 'knn_k': 10, 'weighted_edges': True, 'symmetrize_mode': 'mutual', 'self_loops': True, 'use_snp_selection': False}. Best is trial 0 with value: 0.25189869508577856.
[I 2025-12-08 20:45:11,392] Trial 4 finished with value: 0.29441346525531686 and parameters: {'model_type': 'gcn', 'hidden_dims': '[512, 256]', 'dropout': 0.2753281956415665, 'batch_norm': True, 'lr': 0.00034435188114839693, 'weight_decay': 4.9416012835950194e-05, 'epochs': 89, 'loss': 'mae', 'optimizer': 'adam', 'graph_mode': 'cutoff', 'cutoff': 0.820078967317394, 'grm_norm': 'none', 'self_loops': False, 'use_snp_selection': True, 'num_snps': 12674}. Best is trial 4 with value: 0.29441346525531686.
[I 2025-12-08 20:45:36,331] Trial 5 finished with value: 0.2610694883218531 and parameters: {'model_type': 'gcn', 'hidden_dims': '[128, 64]', 'dropout': 0.5611163934517731, 'batch_norm': True, 'lr': 0.0003984856210762587, 'weight_decay': 1.1466743517565185e-07, 'epochs': 344, 'loss': 'mae', 'optimizer': 'adam', 'graph_mode': 'cutoff', 'cutoff': 0.6089370799714728, 'grm_norm': 'gcn', 'self_loops': True, 'use_snp_selection': False}. Best is trial 4 with value: 0.29441346525531686.
[I 2025-12-08 20:45:58,914] Trial 6 finished with value: 0.26801746402032806 and parameters: {'model_type': 'gcn', 'hidden_dims': '[128, 64]', 'dropout': 0.31805912766941713, 'batch_norm': True, 'lr': 1.2361026034262557e-05, 'weight_decay': 6.492620232791903e-06, 'epochs': 271, 'loss': 'mse', 'optimizer': 'adam', 'graph_mode': 'cutoff', 'cutoff': 0.6193362582230448, 'grm_norm': 'cosine', 'self_loops': False, 'use_snp_selection': True, 'num_snps': 28594}. Best is trial 4 with value: 0.29441346525531686.
[I 2025-12-08 20:46:18,575] Trial 7 finished with value: 0.2569262652502716 and parameters: {'model_type': 'gcn', 'hidden_dims': '[512, 64]', 'dropout': 0.471337288649717, 'batch_norm': True, 'lr': 2.239693207292708e-05, 'weight_decay': 2.263166635514082e-06, 'epochs': 69, 'loss': 'mse', 'optimizer': 'adam', 'graph_mode': 'cutoff', 'cutoff': 0.4056820886426376, 'grm_norm': 'cosine', 'self_loops': False, 'use_snp_selection': False}. Best is trial 4 with value: 0.29441346525531686.
[I 2025-12-08 20:46:56,349] Trial 8 finished with value: 0.27198627869055136 and parameters: {'model_type': 'gcn', 'hidden_dims': '[512, 256]', 'dropout': 0.20659328268932406, 'batch_norm': False, 'lr': 8.93315124361372e-05, 'weight_decay': 0.00028987480727919035, 'epochs': 136, 'loss': 'mae', 'optimizer': 'adam', 'graph_mode': 'knn', 'knn_k': 3, 'weighted_edges': False, 'symmetrize_mode': 'union', 'self_loops': False, 'use_snp_selection': True, 'num_snps': 43128}. Best is trial 4 with value: 0.29441346525531686.
[I 2025-12-08 20:47:38,465] Trial 9 finished with value: -0.04918718202923439 and parameters: {'model_type': 'gcn', 'hidden_dims': '[512, 256]', 'dropout': 0.2888209592870401, 'batch_norm': False, 'lr': 0.004734648143129892, 'weight_decay': 1.5879705591356368e-06, 'epochs': 163, 'loss': 'mse', 'optimizer': 'adam', 'graph_mode': 'cutoff', 'cutoff': 0.5984899797909019, 'grm_norm': 'cosine', 'self_loops': True, 'use_snp_selection': False}. Best is trial 4 with value: 0.29441346525531686.
[I 2025-12-08 20:47:47,667] Trial 10 finished with value: 0.26904846240989955 and parameters: {'model_type': 'gcn', 'hidden_dims': '[512, 128]', 'dropout': 0.11372025982957354, 'batch_norm': False, 'lr': 0.0023343012062770553, 'weight_decay': 4.14440562940608e-05, 'epochs': 41, 'loss': 'mae', 'optimizer': 'adam', 'graph_mode': 'cutoff', 'cutoff': 0.8740100033033124, 'grm_norm': 'none', 'self_loops': False, 'use_snp_selection': True, 'num_snps': 3859}. Best is trial 4 with value: 0.29441346525531686.
[I 2025-12-08 20:48:24,171] Trial 11 finished with value: 0.24998220524296716 and parameters: {'model_type': 'gcn', 'hidden_dims': '[512, 256]', 'dropout': 0.42220860806405436, 'batch_norm': False, 'lr': 0.00012587284186352953, 'weight_decay': 0.0006590033092812647, 'epochs': 114, 'loss': 'mae', 'optimizer': 'adam', 'graph_mode': 'knn', 'knn_k': 1, 'weighted_edges': False, 'symmetrize_mode': 'union', 'self_loops': False, 'use_snp_selection': True, 'num_snps': 47068}. Best is trial 4 with value: 0.29441346525531686.
[I 2025-12-08 20:48:38,992] Trial 12 finished with value: 0.26654614497653706 and parameters: {'model_type': 'gcn', 'hidden_dims': '[512, 256]', 'dropout': 0.14142767069304862, 'batch_norm': False, 'lr': 0.0011798598123878552, 'weight_decay': 9.414718277089941e-05, 'epochs': 124, 'loss': 'mae', 'optimizer': 'adam', 'graph_mode': 'knn', 'knn_k': 3, 'weighted_edges': False, 'symmetrize_mode': 'union', 'self_loops': False, 'use_snp_selection': True, 'num_snps': 8584}. Best is trial 4 with value: 0.29441346525531686.
[I 2025-12-08 20:49:09,984] Trial 13 finished with value: 0.2485547812844945 and parameters: {'model_type': 'gcn', 'hidden_dims': '[512, 256]', 'dropout': 0.23483876358445724, 'batch_norm': False, 'lr': 0.00018005512155234809, 'weight_decay': 0.00018148625050029915, 'epochs': 101, 'loss': 'mae', 'optimizer': 'adam', 'graph_mode': 'knn', 'knn_k': 6, 'weighted_edges': False, 'symmetrize_mode': 'union', 'self_loops': False, 'use_snp_selection': True, 'num_snps': 39863}. Best is trial 4 with value: 0.29441346525531686.
[I 2025-12-08 20:49:32,016] Trial 14 finished with value: 0.2866499324285045 and parameters: {'model_type': 'gcn', 'hidden_dims': '[512, 256]', 'dropout': 0.4067858367430304, 'batch_norm': False, 'lr': 4.4123569663419664e-05, 'weight_decay': 2.2203297076850073e-05, 'epochs': 165, 'loss': 'mae', 'optimizer': 'adam', 'graph_mode': 'cutoff', 'cutoff': 0.8944237199027842, 'grm_norm': 'none', 'self_loops': False, 'use_snp_selection': True, 'num_snps': 17117}. Best is trial 4 with value: 0.29441346525531686.
[I 2025-12-08 20:49:50,280] Trial 15 finished with value: 0.28407669116724055 and parameters: {'model_type': 'gcn', 'hidden_dims': '[256, 128, 64]', 'dropout': 0.4038548841002544, 'batch_norm': False, 'lr': 3.7746842564691134e-05, 'weight_decay': 1.3728672854267767e-05, 'epochs': 164, 'loss': 'mae', 'optimizer': 'adam', 'graph_mode': 'cutoff', 'cutoff': 0.8872255416714164, 'grm_norm': 'none', 'self_loops': False, 'use_snp_selection': True, 'num_snps': 17749}. Best is trial 4 with value: 0.29441346525531686.
[I 2025-12-08 20:50:18,732] Trial 16 finished with value: 0.27669986575368677 and parameters: {'model_type': 'gcn', 'hidden_dims': '[512, 128]', 'dropout': 0.38217627986383895, 'batch_norm': True, 'lr': 0.0007859314805152761, 'weight_decay': 1.585184858108273e-05, 'epochs': 243, 'loss': 'mae', 'optimizer': 'adam', 'graph_mode': 'cutoff', 'cutoff': 0.7714575519927706, 'grm_norm': 'none', 'self_loops': False, 'use_snp_selection': True, 'num_snps': 17408}. Best is trial 4 with value: 0.29441346525531686.
[I 2025-12-08 20:50:34,671] Trial 17 finished with value: 0.27579363904504983 and parameters: {'model_type': 'gcn', 'hidden_dims': '[512, 256]', 'dropout': 0.4790101376152853, 'batch_norm': False, 'lr': 0.00023701675117024075, 'weight_decay': 5.633813841868188e-06, 'epochs': 79, 'loss': 'mae', 'optimizer': 'adam', 'graph_mode': 'cutoff', 'cutoff': 0.7430449078328386, 'grm_norm': 'cosine_then_gcn', 'self_loops': False, 'use_snp_selection': True, 'num_snps': 15971}. Best is trial 4 with value: 0.29441346525531686.
[I 2025-12-08 20:50:50,291] Trial 18 finished with value: 0.215567495481578 and parameters: {'model_type': 'gcn', 'hidden_dims': '[256, 128]', 'dropout': 0.2802852368181955, 'batch_norm': False, 'lr': 0.009001403382035356, 'weight_decay': 2.9935088137514655e-05, 'epochs': 171, 'loss': 'mae', 'optimizer': 'adam', 'graph_mode': 'cutoff', 'cutoff': 0.2071604959820907, 'grm_norm': 'none', 'self_loops': False, 'use_snp_selection': True, 'num_snps': 12022}. Best is trial 4 with value: 0.29441346525531686.
[I 2025-12-08 20:51:05,919] Trial 19 finished with value: 0.26321424249398356 and parameters: {'model_type': 'gcn', 'hidden_dims': '[512, 256]', 'dropout': 0.46201114806835597, 'batch_norm': True, 'lr': 3.631841990198277e-05, 'weight_decay': 0.00013429792469499315, 'epochs': 41, 'loss': 'mae', 'optimizer': 'adam', 'graph_mode': 'cutoff', 'cutoff': 0.75565169836058, 'grm_norm': 'none', 'self_loops': False, 'use_snp_selection': True, 'num_snps': 23457}. Best is trial 4 with value: 0.29441346525531686.
[I 2025-12-08 20:51:39,862] Trial 20 finished with value: 0.2846521308727935 and parameters: {'model_type': 'gcn', 'hidden_dims': '[512, 256]', 'dropout': 0.3645207238087206, 'batch_norm': True, 'lr': 0.0003487737485618607, 'weight_decay': 2.436140887713321e-05, 'epochs': 147, 'loss': 'mae', 'optimizer': 'adam', 'graph_mode': 'cutoff', 'cutoff': 0.8899291235748714, 'grm_norm': 'cosine_then_gcn', 'self_loops': False, 'use_snp_selection': True, 'num_snps': 35605}. Best is trial 4 with value: 0.29441346525531686.
[I 2025-12-08 20:52:14,485] Trial 21 finished with value: 0.29032843208087283 and parameters: {'model_type': 'gcn', 'hidden_dims': '[512, 256]', 'dropout': 0.36382867978313665, 'batch_norm': True, 'lr': 0.00033599835902046283, 'weight_decay': 2.7629224929573078e-05, 'epochs': 144, 'loss': 'mae', 'optimizer': 'adam', 'graph_mode': 'cutoff', 'cutoff': 0.8764597488659485, 'grm_norm': 'cosine_then_gcn', 'self_loops': False, 'use_snp_selection': True, 'num_snps': 36875}. Best is trial 4 with value: 0.29441346525531686.
[I 2025-12-08 20:52:52,661] Trial 22 finished with value: 0.2778759215815154 and parameters: {'model_type': 'gcn', 'hidden_dims': '[512, 256]', 'dropout': 0.28493436797562194, 'batch_norm': True, 'lr': 0.0014841457880870443, 'weight_decay': 6.968340077898914e-05, 'epochs': 188, 'loss': 'mae', 'optimizer': 'adam', 'graph_mode': 'cutoff', 'cutoff': 0.7900642566861793, 'grm_norm': 'cosine_then_gcn', 'self_loops': False, 'use_snp_selection': True, 'num_snps': 34205}. Best is trial 4 with value: 0.29441346525531686.
[I 2025-12-08 20:53:12,804] Trial 23 finished with value: 0.287020447715426 and parameters: {'model_type': 'gcn', 'hidden_dims': '[512, 256]', 'dropout': 0.4347374838506445, 'batch_norm': True, 'lr': 0.000538627427354592, 'weight_decay': 4.966703946795189e-06, 'epochs': 90, 'loss': 'mae', 'optimizer': 'adam', 'graph_mode': 'cutoff', 'cutoff': 0.6979784659533177, 'grm_norm': 'cosine_then_gcn', 'self_loops': False, 'use_snp_selection': True, 'num_snps': 22600}. Best is trial 4 with value: 0.29441346525531686.
[I 2025-12-08 20:53:33,725] Trial 24 finished with value: 0.282927917055197 and parameters: {'model_type': 'gcn', 'hidden_dims': '[512, 256]', 'dropout': 0.5103041099119673, 'batch_norm': True, 'lr': 0.0005301473121392408, 'weight_decay': 6.4947025849248735e-06, 'epochs': 97, 'loss': 'mae', 'optimizer': 'adam', 'graph_mode': 'cutoff', 'cutoff': 0.6874816954180176, 'grm_norm': 'cosine_then_gcn', 'self_loops': False, 'use_snp_selection': True, 'num_snps': 22981}. Best is trial 4 with value: 0.29441346525531686.
[I 2025-12-08 20:53:43,470] Trial 25 finished with value: 0.25544571653012105 and parameters: {'model_type': 'gcn', 'hidden_dims': '[512, 64]', 'dropout': 0.34689938403161613, 'batch_norm': True, 'lr': 0.00021078840671356384, 'weight_decay': 2.711242102957457e-06, 'epochs': 71, 'loss': 'mae', 'optimizer': 'adam', 'graph_mode': 'cutoff', 'cutoff': 0.6877520682243774, 'grm_norm': 'cosine_then_gcn', 'self_loops': False, 'use_snp_selection': True, 'num_snps': 2824}. Best is trial 4 with value: 0.29441346525531686.
[I 2025-12-08 20:54:08,063] Trial 26 finished with value: 0.2892010152605888 and parameters: {'model_type': 'gcn', 'hidden_dims': '[512, 128]', 'dropout': 0.42590612286366447, 'batch_norm': True, 'lr': 0.001833689078069898, 'weight_decay': 5.839605599746252e-07, 'epochs': 90, 'loss': 'mse', 'optimizer': 'adam', 'graph_mode': 'cutoff', 'cutoff': 0.8231906989426868, 'grm_norm': 'cosine_then_gcn', 'self_loops': True, 'use_snp_selection': False}. Best is trial 4 with value: 0.29441346525531686.
[I 2025-12-08 20:54:40,571] Trial 27 finished with value: 0.2841738046326348 and parameters: {'model_type': 'gcn', 'hidden_dims': '[512, 128]', 'dropout': 0.5194707752780742, 'batch_norm': True, 'lr': 0.0028654710437192904, 'weight_decay': 6.058573035040818e-07, 'epochs': 123, 'loss': 'mse', 'optimizer': 'adam', 'graph_mode': 'cutoff', 'cutoff': 0.8219181005061634, 'grm_norm': 'cosine_then_gcn', 'self_loops': True, 'use_snp_selection': False}. Best is trial 4 with value: 0.29441346525531686.
[I 2025-12-08 20:54:58,463] Trial 28 finished with value: 0.26808305052956644 and parameters: {'model_type': 'gcn', 'hidden_dims': '[512, 128]', 'dropout': 0.37059233030997024, 'batch_norm': True, 'lr': 0.001107774897239435, 'weight_decay': 2.2440100171659422e-07, 'epochs': 62, 'loss': 'mse', 'optimizer': 'adam', 'graph_mode': 'cutoff', 'cutoff': 0.5242315849856041, 'grm_norm': 'cosine_then_gcn', 'self_loops': True, 'use_snp_selection': False}. Best is trial 4 with value: 0.29441346525531686.
[I 2025-12-08 20:55:34,889] Trial 29 finished with value: 0.2828793372066268 and parameters: {'model_type': 'gcn', 'hidden_dims': '[512, 128]', 'dropout': 0.3126907223882488, 'batch_norm': True, 'lr': 0.0022745455109933715, 'weight_decay': 4.415005578552845e-05, 'epochs': 140, 'loss': 'mse', 'optimizer': 'adam', 'graph_mode': 'cutoff', 'cutoff': 0.8272527435668324, 'grm_norm': 'gcn', 'self_loops': True, 'use_snp_selection': False}. Best is trial 4 with value: 0.29441346525531686.
