[I 2025-12-08 20:23:27,215] Trial 107 finished with value: 0.3637595616945928 and parameters: {'model_type': 'gcn', 'hidden_dims': '[256, 128]', 'dropout': 0.556163394511876, 'batch_norm': False, 'lr': 1.1743944826413799e-05, 'weight_decay': 1.380815546199761e-07, 'epochs': 236, 'loss': 'mae', 'optimizer': 'adam', 'graph_mode': 'knn', 'knn_k': 5, 'weighted_edges': True, 'symmetrize_mode': 'union', 'self_loops': False, 'use_snp_selection': True, 'num_snps': 21583}. Best is trial 82 with value: 0.37067180118989584.
[I 2025-12-08 20:23:48,809] Trial 108 finished with value: 0.3522977144441285 and parameters: {'model_type': 'gcn', 'hidden_dims': '[256, 128]', 'dropout': 0.5274387619337756, 'batch_norm': False, 'lr': 1.2439080081335908e-05, 'weight_decay': 1.5165100166353855e-07, 'epochs': 236, 'loss': 'mae', 'optimizer': 'adam', 'graph_mode': 'knn', 'knn_k': 7, 'weighted_edges': True, 'symmetrize_mode': 'mutual', 'self_loops': True, 'use_snp_selection': True, 'num_snps': 18922}. Best is trial 82 with value: 0.37067180118989584.
[I 2025-12-08 20:24:10,320] Trial 109 finished with value: 0.36810693917599435 and parameters: {'model_type': 'gcn', 'hidden_dims': '[256, 128]', 'dropout': 0.5505886137312206, 'batch_norm': False, 'lr': 1.1529845623945236e-05, 'weight_decay': 2.413625529572483e-07, 'epochs': 243, 'loss': 'mae', 'optimizer': 'adam', 'graph_mode': 'knn', 'knn_k': 5, 'weighted_edges': True, 'symmetrize_mode': 'union', 'self_loops': False, 'use_snp_selection': True, 'num_snps': 17540}. Best is trial 82 with value: 0.37067180118989584.
[I 2025-12-08 20:24:28,114] Trial 110 finished with value: 0.3538320714073685 and parameters: {'model_type': 'gcn', 'hidden_dims': '[256, 128]', 'dropout': 0.5540154909233529, 'batch_norm': False, 'lr': 1.1468783593663529e-05, 'weight_decay': 2.410391587518995e-07, 'epochs': 227, 'loss': 'mae', 'optimizer': 'adam', 'graph_mode': 'knn', 'knn_k': 6, 'weighted_edges': True, 'symmetrize_mode': 'union', 'self_loops': False, 'use_snp_selection': True, 'num_snps': 13221}. Best is trial 82 with value: 0.37067180118989584.
[I 2025-12-08 20:24:49,936] Trial 111 finished with value: 0.36941421837027455 and parameters: {'model_type': 'gcn', 'hidden_dims': '[256, 128]', 'dropout': 0.5760562621525178, 'batch_norm': False, 'lr': 1.830783399000031e-05, 'weight_decay': 1.0079433726281437e-07, 'epochs': 247, 'loss': 'mae', 'optimizer': 'adam', 'graph_mode': 'knn', 'knn_k': 5, 'weighted_edges': True, 'symmetrize_mode': 'union', 'self_loops': False, 'use_snp_selection': True, 'num_snps': 17845}. Best is trial 82 with value: 0.37067180118989584.
[I 2025-12-08 20:25:12,418] Trial 112 finished with value: 0.3675892555828879 and parameters: {'model_type': 'gcn', 'hidden_dims': '[256, 128]', 'dropout': 0.5426196689018025, 'batch_norm': False, 'lr': 1.3153897937054892e-05, 'weight_decay': 1.0442479897692667e-07, 'epochs': 240, 'loss': 'mae', 'optimizer': 'adam', 'graph_mode': 'knn', 'knn_k': 5, 'weighted_edges': True, 'symmetrize_mode': 'union', 'self_loops': False, 'use_snp_selection': True, 'num_snps': 19684}. Best is trial 82 with value: 0.37067180118989584.
[I 2025-12-08 20:25:33,324] Trial 113 finished with value: 0.36130778437353356 and parameters: {'model_type': 'gcn', 'hidden_dims': '[256, 128]', 'dropout': 0.546147614224486, 'batch_norm': False, 'lr': 1.3034577915953688e-05, 'weight_decay': 1.1225367280980018e-07, 'epochs': 242, 'loss': 'mae', 'optimizer': 'adam', 'graph_mode': 'knn', 'knn_k': 5, 'weighted_edges': True, 'symmetrize_mode': 'union', 'self_loops': False, 'use_snp_selection': True, 'num_snps': 17093}. Best is trial 82 with value: 0.37067180118989584.
[I 2025-12-08 20:25:53,431] Trial 114 finished with value: 0.3621383206965432 and parameters: {'model_type': 'gcn', 'hidden_dims': '[256, 128]', 'dropout': 0.5359360216459084, 'batch_norm': False, 'lr': 1.8219388455413414e-05, 'weight_decay': 1.5253455445764532e-07, 'epochs': 250, 'loss': 'mae', 'optimizer': 'adam', 'graph_mode': 'knn', 'knn_k': 5, 'weighted_edges': True, 'symmetrize_mode': 'union', 'self_loops': False, 'use_snp_selection': True, 'num_snps': 14957}. Best is trial 82 with value: 0.37067180118989584.
[I 2025-12-08 20:26:17,179] Trial 115 finished with value: 0.3666234685496525 and parameters: {'model_type': 'gcn', 'hidden_dims': '[256, 128]', 'dropout': 0.5746896193063158, 'batch_norm': False, 'lr': 1.609052872422025e-05, 'weight_decay': 1.0037952493658599e-07, 'epochs': 263, 'loss': 'mae', 'optimizer': 'adam', 'graph_mode': 'knn', 'knn_k': 5, 'weighted_edges': True, 'symmetrize_mode': 'union', 'self_loops': False, 'use_snp_selection': True, 'num_snps': 20093}. Best is trial 82 with value: 0.37067180118989584.
[I 2025-12-08 20:26:39,936] Trial 116 finished with value: 0.36313858782507424 and parameters: {'model_type': 'gcn', 'hidden_dims': '[256, 128]', 'dropout': 0.17266404708799288, 'batch_norm': False, 'lr': 1.5624715593969166e-05, 'weight_decay': 1.0523513590100478e-07, 'epochs': 265, 'loss': 'mae', 'optimizer': 'adam', 'graph_mode': 'knn', 'knn_k': 5, 'weighted_edges': True, 'symmetrize_mode': 'union', 'self_loops': False, 'use_snp_selection': True, 'num_snps': 18006}. Best is trial 82 with value: 0.37067180118989584.
[I 2025-12-08 20:27:14,420] Trial 117 finished with value: 0.35536626524092846 and parameters: {'model_type': 'gcn', 'hidden_dims': '[256, 128]', 'dropout': 0.5728201812203183, 'batch_norm': False, 'lr': 1.0131072617154354e-05, 'weight_decay': 1.8881565718483991e-07, 'epochs': 273, 'loss': 'mae', 'optimizer': 'adam', 'graph_mode': 'knn', 'knn_k': 6, 'weighted_edges': True, 'symmetrize_mode': 'union', 'self_loops': False, 'use_snp_selection': False}. Best is trial 82 with value: 0.37067180118989584.
[I 2025-12-08 20:27:37,463] Trial 118 finished with value: 0.37102117876598095 and parameters: {'model_type': 'gcn', 'hidden_dims': '[256, 128]', 'dropout': 0.5795954909945503, 'batch_norm': False, 'lr': 1.3672229212612075e-05, 'weight_decay': 2.8845058548099303e-07, 'epochs': 255, 'loss': 'mse', 'optimizer': 'adam', 'graph_mode': 'knn', 'knn_k': 5, 'weighted_edges': True, 'symmetrize_mode': 'union', 'self_loops': False, 'use_snp_selection': True, 'num_snps': 19689}. Best is trial 118 with value: 0.37102117876598095.
[I 2025-12-08 20:28:00,414] Trial 119 finished with value: 0.36434726211319635 and parameters: {'model_type': 'gcn', 'hidden_dims': '[256, 128]', 'dropout': 0.5827311145035196, 'batch_norm': False, 'lr': 1.69778905403076e-05, 'weight_decay': 2.8779984639049743e-07, 'epochs': 252, 'loss': 'mse', 'optimizer': 'adam', 'graph_mode': 'knn', 'knn_k': 5, 'weighted_edges': True, 'symmetrize_mode': 'union', 'self_loops': False, 'use_snp_selection': True, 'num_snps': 19826}. Best is trial 118 with value: 0.37102117876598095.
[I 2025-12-08 20:28:23,297] Trial 120 finished with value: 0.37109741871696855 and parameters: {'model_type': 'gcn', 'hidden_dims': '[256, 128]', 'dropout': 0.5769583124530756, 'batch_norm': False, 'lr': 1.3428920081334042e-05, 'weight_decay': 1.6528449847690959e-07, 'epochs': 254, 'loss': 'mse', 'optimizer': 'adam', 'graph_mode': 'knn', 'knn_k': 5, 'weighted_edges': True, 'symmetrize_mode': 'union', 'self_loops': False, 'use_snp_selection': True, 'num_snps': 19446}. Best is trial 120 with value: 0.37109741871696855.
[I 2025-12-08 20:28:46,312] Trial 121 finished with value: 0.3696970245842547 and parameters: {'model_type': 'gcn', 'hidden_dims': '[256, 128]', 'dropout': 0.57777239147744, 'batch_norm': False, 'lr': 1.374530756383113e-05, 'weight_decay': 1.7403425561901843e-07, 'epochs': 253, 'loss': 'mse', 'optimizer': 'adam', 'graph_mode': 'knn', 'knn_k': 5, 'weighted_edges': True, 'symmetrize_mode': 'union', 'self_loops': False, 'use_snp_selection': True, 'num_snps': 19830}. Best is trial 120 with value: 0.37109741871696855.
[I 2025-12-08 20:29:09,253] Trial 122 finished with value: 0.37133370374993757 and parameters: {'model_type': 'gcn', 'hidden_dims': '[256, 128]', 'dropout': 0.5782837766304786, 'batch_norm': False, 'lr': 1.3527748629538157e-05, 'weight_decay': 2.79352909046315e-07, 'epochs': 255, 'loss': 'mse', 'optimizer': 'adam', 'graph_mode': 'knn', 'knn_k': 5, 'weighted_edges': True, 'symmetrize_mode': 'union', 'self_loops': False, 'use_snp_selection': True, 'num_snps': 19419}. Best is trial 122 with value: 0.37133370374993757.
[I 2025-12-08 20:29:31,270] Trial 123 finished with value: 0.3673919308969308 and parameters: {'model_type': 'gcn', 'hidden_dims': '[256, 128]', 'dropout': 0.5745025710413654, 'batch_norm': False, 'lr': 1.8569658575370048e-05, 'weight_decay': 2.8634331092856415e-07, 'epochs': 245, 'loss': 'mse', 'optimizer': 'adam', 'graph_mode': 'knn', 'knn_k': 5, 'weighted_edges': True, 'symmetrize_mode': 'union', 'self_loops': False, 'use_snp_selection': True, 'num_snps': 18829}. Best is trial 122 with value: 0.37133370374993757.
[I 2025-12-08 20:29:53,746] Trial 124 finished with value: 0.3702185041978606 and parameters: {'model_type': 'gcn', 'hidden_dims': '[256, 128]', 'dropout': 0.5749352841682644, 'batch_norm': False, 'lr': 1.3838317801091353e-05, 'weight_decay': 1.7707212038245703e-07, 'epochs': 245, 'loss': 'mse', 'optimizer': 'adam', 'graph_mode': 'knn', 'knn_k': 5, 'weighted_edges': True, 'symmetrize_mode': 'union', 'self_loops': False, 'use_snp_selection': True, 'num_snps': 19405}. Best is trial 122 with value: 0.37133370374993757.
[I 2025-12-08 20:30:16,162] Trial 125 finished with value: 0.37123618191509333 and parameters: {'model_type': 'gcn', 'hidden_dims': '[256, 128]', 'dropout': 0.5695029868647341, 'batch_norm': False, 'lr': 1.3575880625548914e-05, 'weight_decay': 1.751236912112856e-07, 'epochs': 246, 'loss': 'mse', 'optimizer': 'adam', 'graph_mode': 'knn', 'knn_k': 5, 'weighted_edges': True, 'symmetrize_mode': 'union', 'self_loops': False, 'use_snp_selection': True, 'num_snps': 19212}. Best is trial 122 with value: 0.37133370374993757.
[I 2025-12-08 20:30:46,782] Trial 126 finished with value: 0.32027170270127964 and parameters: {'model_type': 'gcn', 'hidden_dims': '[512, 64]', 'dropout': 0.5760337287244991, 'batch_norm': True, 'lr': 1.8355592779349352e-05, 'weight_decay': 1.0386790065359959e-07, 'epochs': 243, 'loss': 'mse', 'optimizer': 'adam', 'graph_mode': 'cutoff', 'cutoff': 0.514235322620397, 'grm_norm': 'cosine', 'self_loops': False, 'use_snp_selection': True, 'num_snps': 19613}. Best is trial 122 with value: 0.37133370374993757.
[I 2025-12-08 20:31:07,997] Trial 127 finished with value: 0.3727583944850618 and parameters: {'model_type': 'gcn', 'hidden_dims': '[256, 128]', 'dropout': 0.5445006759369856, 'batch_norm': False, 'lr': 1.3248798147432497e-05, 'weight_decay': 1.281785534153204e-07, 'epochs': 238, 'loss': 'mse', 'optimizer': 'adam', 'graph_mode': 'knn', 'knn_k': 4, 'weighted_edges': True, 'symmetrize_mode': 'union', 'self_loops': False, 'use_snp_selection': True, 'num_snps': 18284}. Best is trial 127 with value: 0.3727583944850618.
[I 2025-12-08 20:31:25,167] Trial 128 finished with value: 0.3620683050849074 and parameters: {'model_type': 'gcn', 'hidden_dims': '[128, 64]', 'dropout': 0.5216539112660943, 'batch_norm': False, 'lr': 1.358784406865097e-05, 'weight_decay': 2.4971963645427086e-07, 'epochs': 230, 'loss': 'mse', 'optimizer': 'adam', 'graph_mode': 'knn', 'knn_k': 4, 'weighted_edges': True, 'symmetrize_mode': 'union', 'self_loops': False, 'use_snp_selection': True, 'num_snps': 18328}. Best is trial 127 with value: 0.3727583944850618.
[I 2025-12-08 20:31:49,498] Trial 129 finished with value: 0.36182365563195606 and parameters: {'model_type': 'gcn', 'hidden_dims': '[256, 128]', 'dropout': 0.5436828066651972, 'batch_norm': False, 'lr': 1.3308282881756546e-05, 'weight_decay': 1.956320050027556e-07, 'epochs': 245, 'loss': 'mse', 'optimizer': 'adam', 'graph_mode': 'knn', 'knn_k': 4, 'weighted_edges': True, 'symmetrize_mode': 'union', 'self_loops': True, 'use_snp_selection': True, 'num_snps': 22929}. Best is trial 127 with value: 0.3727583944850618.
[I 2025-12-08 20:32:10,398] Trial 130 finished with value: 0.33097230387523435 and parameters: {'model_type': 'gcn', 'hidden_dims': '[256, 128]', 'dropout': 0.5322264683641571, 'batch_norm': False, 'lr': 2.1983242990846783e-05, 'weight_decay': 1.4555061250945908e-07, 'epochs': 238, 'loss': 'mse', 'optimizer': 'adam', 'graph_mode': 'knn', 'knn_k': 4, 'weighted_edges': True, 'symmetrize_mode': 'mutual', 'self_loops': False, 'use_snp_selection': True, 'num_snps': 18077}. Best is trial 127 with value: 0.3727583944850618.
[I 2025-12-08 20:32:33,351] Trial 131 finished with value: 0.36834618071756225 and parameters: {'model_type': 'gcn', 'hidden_dims': '[256, 128]', 'dropout': 0.5738809677177447, 'batch_norm': False, 'lr': 1.0108227903168805e-05, 'weight_decay': 1.1698174613381894e-07, 'epochs': 247, 'loss': 'mse', 'optimizer': 'adam', 'graph_mode': 'knn', 'knn_k': 5, 'weighted_edges': True, 'symmetrize_mode': 'union', 'self_loops': False, 'use_snp_selection': True, 'num_snps': 20609}. Best is trial 127 with value: 0.3727583944850618.
[I 2025-12-08 20:32:56,913] Trial 132 finished with value: 0.36538908709817275 and parameters: {'model_type': 'gcn', 'hidden_dims': '[256, 128]', 'dropout': 0.5694547202574486, 'batch_norm': False, 'lr': 1.0103299095107852e-05, 'weight_decay': 1.2738343207900994e-07, 'epochs': 248, 'loss': 'mse', 'optimizer': 'adam', 'graph_mode': 'knn', 'knn_k': 5, 'weighted_edges': True, 'symmetrize_mode': 'union', 'self_loops': False, 'use_snp_selection': True, 'num_snps': 20888}. Best is trial 127 with value: 0.3727583944850618.
[I 2025-12-08 20:33:18,249] Trial 133 finished with value: 0.36494103198046296 and parameters: {'model_type': 'gcn', 'hidden_dims': '[256, 128]', 'dropout': 0.5442684516161277, 'batch_norm': False, 'lr': 1.3110581327627173e-05, 'weight_decay': 2.757764548358179e-07, 'epochs': 232, 'loss': 'mse', 'optimizer': 'adam', 'graph_mode': 'knn', 'knn_k': 5, 'weighted_edges': True, 'symmetrize_mode': 'union', 'self_loops': False, 'use_snp_selection': True, 'num_snps': 18864}. Best is trial 127 with value: 0.3727583944850618.
[I 2025-12-08 20:33:39,693] Trial 134 finished with value: 0.3688143431352137 and parameters: {'model_type': 'gcn', 'hidden_dims': '[256, 128]', 'dropout': 0.251816891323582, 'batch_norm': False, 'lr': 1.1346775280386879e-05, 'weight_decay': 1.7922136201538048e-07, 'epochs': 215, 'loss': 'mse', 'optimizer': 'adam', 'graph_mode': 'knn', 'knn_k': 5, 'weighted_edges': True, 'symmetrize_mode': 'union', 'self_loops': False, 'use_snp_selection': True, 'num_snps': 20649}. Best is trial 127 with value: 0.3727583944850618.
[I 2025-12-08 20:34:02,181] Trial 135 finished with value: 0.3630691067846764 and parameters: {'model_type': 'gcn', 'hidden_dims': '[256, 128]', 'dropout': 0.24029810068319493, 'batch_norm': False, 'lr': 1.1052657517678823e-05, 'weight_decay': 1.760603688263039e-07, 'epochs': 215, 'loss': 'mse', 'optimizer': 'adam', 'graph_mode': 'knn', 'knn_k': 5, 'weighted_edges': True, 'symmetrize_mode': 'union', 'self_loops': False, 'use_snp_selection': True, 'num_snps': 22341}. Best is trial 127 with value: 0.3727583944850618.
[I 2025-12-08 20:34:26,379] Trial 136 finished with value: 0.3496170120593488 and parameters: {'model_type': 'gcn', 'hidden_dims': '[256, 128, 64]', 'dropout': 0.2678529045948824, 'batch_norm': False, 'lr': 1.8507755813859105e-05, 'weight_decay': 2.2084261576379062e-07, 'epochs': 254, 'loss': 'mse', 'optimizer': 'adam', 'graph_mode': 'knn', 'knn_k': 4, 'weighted_edges': True, 'symmetrize_mode': 'union', 'self_loops': False, 'use_snp_selection': True, 'num_snps': 20628}. Best is trial 127 with value: 0.3727583944850618.
[I 2025-12-08 20:34:55,344] Trial 137 finished with value: 0.3592991900700905 and parameters: {'model_type': 'gcn', 'hidden_dims': '[256, 128]', 'dropout': 0.1403213826191558, 'batch_norm': False, 'lr': 1.0058745388402991e-05, 'weight_decay': 1.3639536638118712e-07, 'epochs': 227, 'loss': 'mse', 'optimizer': 'adam', 'graph_mode': 'knn', 'knn_k': 5, 'weighted_edges': True, 'symmetrize_mode': 'union', 'self_loops': False, 'use_snp_selection': False}. Best is trial 127 with value: 0.3727583944850618.
[I 2025-12-08 20:35:35,357] Trial 138 finished with value: 0.36585078510829955 and parameters: {'model_type': 'gcn', 'hidden_dims': '[256, 128]', 'dropout': 0.5993673087361526, 'batch_norm': False, 'lr': 1.3615250862566056e-05, 'weight_decay': 1.7645012523408383e-07, 'epochs': 241, 'loss': 'mse', 'optimizer': 'adam', 'graph_mode': 'knn', 'knn_k': 5, 'weighted_edges': True, 'symmetrize_mode': 'union', 'self_loops': False, 'use_snp_selection': True, 'num_snps': 49580}. Best is trial 127 with value: 0.3727583944850618.
[I 2025-12-08 20:35:55,546] Trial 139 finished with value: 0.3596636305055111 and parameters: {'model_type': 'gcn', 'hidden_dims': '[256, 128]', 'dropout': 0.3274776494644175, 'batch_norm': False, 'lr': 1.8694690033807035e-05, 'weight_decay': 2.0696975605661123e-07, 'epochs': 220, 'loss': 'mse', 'optimizer': 'adam', 'graph_mode': 'knn', 'knn_k': 4, 'weighted_edges': True, 'symmetrize_mode': 'union', 'self_loops': False, 'use_snp_selection': True, 'num_snps': 17587}. Best is trial 127 with value: 0.3727583944850618.
[I 2025-12-08 20:36:14,839] Trial 140 finished with value: 0.36393786316077953 and parameters: {'model_type': 'gcn', 'hidden_dims': '[256, 128]', 'dropout': 0.21911901792249971, 'batch_norm': False, 'lr': 1.3770111101345075e-05, 'weight_decay': 1.2278110294382715e-07, 'epochs': 252, 'loss': 'mse', 'optimizer': 'adam', 'graph_mode': 'knn', 'knn_k': 5, 'weighted_edges': True, 'symmetrize_mode': 'union', 'self_loops': False, 'use_snp_selection': True, 'num_snps': 14548}. Best is trial 127 with value: 0.3727583944850618.
[I 2025-12-08 20:36:36,835] Trial 141 finished with value: 0.3668554092747989 and parameters: {'model_type': 'gcn', 'hidden_dims': '[256, 128]', 'dropout': 0.5788061350473206, 'batch_norm': False, 'lr': 1.1882595393213286e-05, 'weight_decay': 1.5874673629233048e-07, 'epochs': 238, 'loss': 'mse', 'optimizer': 'adam', 'graph_mode': 'knn', 'knn_k': 5, 'weighted_edges': True, 'symmetrize_mode': 'union', 'self_loops': False, 'use_snp_selection': True, 'num_snps': 19379}. Best is trial 127 with value: 0.3727583944850618.
[I 2025-12-08 20:37:02,517] Trial 142 finished with value: 0.37215909249939655 and parameters: {'model_type': 'gcn', 'hidden_dims': '[256, 128]', 'dropout': 0.5499902086053894, 'batch_norm': False, 'lr': 1.2597146466885847e-05, 'weight_decay': 2.4068490952908587e-07, 'epochs': 269, 'loss': 'mse', 'optimizer': 'adam', 'graph_mode': 'knn', 'knn_k': 5, 'weighted_edges': True, 'symmetrize_mode': 'union', 'self_loops': False, 'use_snp_selection': True, 'num_snps': 22659}. Best is trial 127 with value: 0.3727583944850618.
[I 2025-12-08 20:37:28,084] Trial 143 finished with value: 0.36933484530796085 and parameters: {'model_type': 'gcn', 'hidden_dims': '[256, 128]', 'dropout': 0.5517163086751441, 'batch_norm': False, 'lr': 1.3338522704219221e-05, 'weight_decay': 2.9881346129353987e-07, 'epochs': 269, 'loss': 'mse', 'optimizer': 'adam', 'graph_mode': 'knn', 'knn_k': 5, 'weighted_edges': True, 'symmetrize_mode': 'union', 'self_loops': False, 'use_snp_selection': True, 'num_snps': 22478}. Best is trial 127 with value: 0.3727583944850618.
[I 2025-12-08 20:37:53,948] Trial 144 finished with value: 0.3723435154265032 and parameters: {'model_type': 'gcn', 'hidden_dims': '[256, 128]', 'dropout': 0.5532258259638905, 'batch_norm': False, 'lr': 1.0001239617951953e-05, 'weight_decay': 2.501076826823258e-07, 'epochs': 272, 'loss': 'mse', 'optimizer': 'adam', 'graph_mode': 'knn', 'knn_k': 5, 'weighted_edges': True, 'symmetrize_mode': 'union', 'self_loops': False, 'use_snp_selection': True, 'num_snps': 22834}. Best is trial 127 with value: 0.3727583944850618.
[I 2025-12-08 20:38:20,771] Trial 145 finished with value: 0.3664354544088065 and parameters: {'model_type': 'gcn', 'hidden_dims': '[256, 128]', 'dropout': 0.5135543524671826, 'batch_norm': False, 'lr': 1.1275346586293786e-05, 'weight_decay': 4.045969885343383e-07, 'epochs': 271, 'loss': 'mse', 'optimizer': 'adam', 'graph_mode': 'knn', 'knn_k': 4, 'weighted_edges': True, 'symmetrize_mode': 'union', 'self_loops': False, 'use_snp_selection': True, 'num_snps': 24532}. Best is trial 127 with value: 0.3727583944850618.
[I 2025-12-08 20:38:46,876] Trial 146 finished with value: 0.3653371288774851 and parameters: {'model_type': 'gcn', 'hidden_dims': '[256, 128]', 'dropout': 0.5522877395525669, 'batch_norm': False, 'lr': 1.4385373310937098e-05, 'weight_decay': 2.2936173086623803e-07, 'epochs': 276, 'loss': 'mse', 'optimizer': 'adam', 'graph_mode': 'knn', 'knn_k': 5, 'weighted_edges': True, 'symmetrize_mode': 'union', 'self_loops': False, 'use_snp_selection': True, 'num_snps': 23060}. Best is trial 127 with value: 0.3727583944850618.
[I 2025-12-08 20:39:14,351] Trial 147 finished with value: 0.36121397320261794 and parameters: {'model_type': 'gcn', 'hidden_dims': '[256, 128]', 'dropout': 0.1908253737524854, 'batch_norm': False, 'lr': 1.1017779883000776e-05, 'weight_decay': 3.1560957591548946e-07, 'epochs': 271, 'loss': 'mse', 'optimizer': 'adam', 'graph_mode': 'knn', 'knn_k': 5, 'weighted_edges': True, 'symmetrize_mode': 'union', 'self_loops': False, 'use_snp_selection': True, 'num_snps': 25504}. Best is trial 127 with value: 0.3727583944850618.
[I 2025-12-08 20:39:39,255] Trial 148 finished with value: 0.3309179375927034 and parameters: {'model_type': 'gcn', 'hidden_dims': '[256, 128]', 'dropout': 0.5852404172928085, 'batch_norm': True, 'lr': 1.0208570825954675e-05, 'weight_decay': 2.5969273272137437e-07, 'epochs': 265, 'loss': 'mse', 'optimizer': 'adam', 'graph_mode': 'cutoff', 'cutoff': 0.6639390350741132, 'grm_norm': 'cosine_then_gcn', 'self_loops': False, 'use_snp_selection': True, 'num_snps': 22606}. Best is trial 127 with value: 0.3727583944850618.
