[I 2025-12-08 13:15:11,316] Trial 134 finished with value: 0.28150479711411 and parameters: {'model_type': 'gcn', 'hidden_dims': '[512, 256]', 'dropout': 0.14750473872620573, 'batch_norm': True, 'lr': 7.491241771085332e-05, 'weight_decay': 0.00078179007412677, 'epochs': 113, 'loss': 'mae', 'optimizer': 'adam', 'graph_mode': 'cutoff', 'cutoff': 0.6767005126744743, 'grm_norm': 'gcn', 'self_loops': True, 'use_snp_selection': True, 'num_snps': 50434}. Best is trial 125 with value: 0.2985981018923512.
[I 2025-12-08 13:15:54,250] Trial 135 finished with value: 0.27438437324628256 and parameters: {'model_type': 'gcn', 'hidden_dims': '[512, 64]', 'dropout': 0.4955894855360661, 'batch_norm': True, 'lr': 0.00023633485347163616, 'weight_decay': 0.0009800063147851737, 'epochs': 130, 'loss': 'mae', 'optimizer': 'adam', 'graph_mode': 'cutoff', 'cutoff': 0.767124886895023, 'grm_norm': 'cosine_then_gcn', 'self_loops': True, 'use_snp_selection': True, 'num_snps': 53545}. Best is trial 125 with value: 0.2985981018923512.
[I 2025-12-08 13:16:11,862] Trial 136 finished with value: 0.2760253582492454 and parameters: {'model_type': 'gcn', 'hidden_dims': '[128, 64]', 'dropout': 0.16011954481024207, 'batch_norm': True, 'lr': 0.0005080003378682087, 'weight_decay': 9.686385522610861e-05, 'epochs': 55, 'loss': 'mse', 'optimizer': 'adam', 'graph_mode': 'cutoff', 'cutoff': 0.7058083375356177, 'grm_norm': 'gcn', 'self_loops': True, 'use_snp_selection': True, 'num_snps': 44435}. Best is trial 125 with value: 0.2985981018923512.
[I 2025-12-08 13:16:46,041] Trial 137 finished with value: 0.2865557925947605 and parameters: {'model_type': 'gcn', 'hidden_dims': '[512, 256]', 'dropout': 0.4169372764978833, 'batch_norm': True, 'lr': 0.000734799630651877, 'weight_decay': 0.00032482050168928416, 'epochs': 101, 'loss': 'mae', 'optimizer': 'adam', 'graph_mode': 'cutoff', 'cutoff': 0.807217816068938, 'grm_norm': 'cosine_then_gcn', 'self_loops': True, 'use_snp_selection': True, 'num_snps': 47410}. Best is trial 125 with value: 0.2985981018923512.
[I 2025-12-08 13:17:13,471] Trial 138 finished with value: 0.2812900404374853 and parameters: {'model_type': 'gcn', 'hidden_dims': '[256, 128, 64]', 'dropout': 0.13777480939304906, 'batch_norm': True, 'lr': 0.0008620177533571473, 'weight_decay': 2.7192227808052397e-05, 'epochs': 108, 'loss': 'mae', 'optimizer': 'adam', 'graph_mode': 'cutoff', 'cutoff': 0.7803539015932774, 'grm_norm': 'cosine', 'self_loops': True, 'use_snp_selection': True, 'num_snps': 49665}. Best is trial 125 with value: 0.2985981018923512.
[I 2025-12-08 13:17:40,189] Trial 139 finished with value: 0.2909081071744462 and parameters: {'model_type': 'gcn', 'hidden_dims': '[512, 64]', 'dropout': 0.12429807132258332, 'batch_norm': True, 'lr': 0.0003020213358788402, 'weight_decay': 0.00044308810906013544, 'epochs': 118, 'loss': 'mae', 'optimizer': 'adam', 'graph_mode': 'cutoff', 'cutoff': 0.8282778533483399, 'grm_norm': 'cosine_then_gcn', 'self_loops': True, 'use_snp_selection': True, 'num_snps': 29854}. Best is trial 125 with value: 0.2985981018923512.
[I 2025-12-08 13:18:10,018] Trial 140 finished with value: 0.293502977587516 and parameters: {'model_type': 'gcn', 'hidden_dims': '[512, 256]', 'dropout': 0.11394767554074352, 'batch_norm': True, 'lr': 0.00014076299686402075, 'weight_decay': 6.0570145427643585e-06, 'epochs': 65, 'loss': 'mae', 'optimizer': 'adam', 'graph_mode': 'cutoff', 'cutoff': 0.7248959833296971, 'grm_norm': 'cosine', 'self_loops': True, 'use_snp_selection': True, 'num_snps': 52550}. Best is trial 125 with value: 0.2985981018923512.
[I 2025-12-08 13:18:29,970] Trial 141 finished with value: 0.29160202231001325 and parameters: {'model_type': 'gcn', 'hidden_dims': '[512, 128]', 'dropout': 0.19399809224715614, 'batch_norm': True, 'lr': 0.00011793064806067658, 'weight_decay': 0.00016776840010906586, 'epochs': 77, 'loss': 'mae', 'optimizer': 'adam', 'graph_mode': 'cutoff', 'cutoff': 0.8520924016224581, 'grm_norm': 'cosine_then_gcn', 'self_loops': False, 'use_snp_selection': True, 'num_snps': 25449}. Best is trial 125 with value: 0.2985981018923512.
[I 2025-12-08 13:18:57,931] Trial 142 finished with value: 0.2875408132381124 and parameters: {'model_type': 'gcn', 'hidden_dims': '[512, 128]', 'dropout': 0.22738114616888838, 'batch_norm': True, 'lr': 9.45067702394981e-05, 'weight_decay': 0.00011069208187212608, 'epochs': 48, 'loss': 'mae', 'optimizer': 'adam', 'graph_mode': 'cutoff', 'cutoff': 0.6878167427364185, 'grm_norm': 'cosine_then_gcn', 'self_loops': False, 'use_snp_selection': True, 'num_snps': 56679}. Best is trial 125 with value: 0.2985981018923512.
[I 2025-12-08 13:19:21,757] Trial 143 finished with value: 0.2886169773619942 and parameters: {'model_type': 'gcn', 'hidden_dims': '[512, 128]', 'dropout': 0.17048371916130617, 'batch_norm': True, 'lr': 0.00020376449278138964, 'weight_decay': 0.0006467414311812069, 'epochs': 71, 'loss': 'mae', 'optimizer': 'adam', 'graph_mode': 'cutoff', 'cutoff': 0.878330507192273, 'grm_norm': 'cosine_then_gcn', 'self_loops': False, 'use_snp_selection': True, 'num_snps': 36129}. Best is trial 125 with value: 0.2985981018923512.
[I 2025-12-08 13:20:00,000] Trial 144 finished with value: 0.2955598615667632 and parameters: {'model_type': 'gcn', 'hidden_dims': '[512, 128]', 'dropout': 0.1855321125004657, 'batch_norm': True, 'lr': 0.0001131631987306235, 'weight_decay': 0.0002484125213227564, 'epochs': 92, 'loss': 'mae', 'optimizer': 'adam', 'graph_mode': 'cutoff', 'cutoff': 0.8996235157332875, 'grm_norm': 'cosine_then_gcn', 'self_loops': False, 'use_snp_selection': True, 'num_snps': 58791}. Best is trial 125 with value: 0.2985981018923512.
[I 2025-12-08 13:20:38,720] Trial 145 finished with value: 0.2885581538887461 and parameters: {'model_type': 'gcn', 'hidden_dims': '[512, 128]', 'dropout': 0.18063099086795106, 'batch_norm': True, 'lr': 0.00045309915432024565, 'weight_decay': 0.00023309144023410714, 'epochs': 94, 'loss': 'mae', 'optimizer': 'adam', 'graph_mode': 'cutoff', 'cutoff': 0.8981828167170529, 'grm_norm': 'cosine_then_gcn', 'self_loops': False, 'use_snp_selection': True, 'num_snps': 58967}. Best is trial 125 with value: 0.2985981018923512.
[I 2025-12-08 13:21:13,151] Trial 146 finished with value: 0.28515834906872994 and parameters: {'model_type': 'gcn', 'hidden_dims': '[512, 128]', 'dropout': 0.15619788838527252, 'batch_norm': True, 'lr': 0.00015072130614760023, 'weight_decay': 0.0003753828263992167, 'epochs': 85, 'loss': 'mae', 'optimizer': 'adam', 'graph_mode': 'cutoff', 'cutoff': 0.8872808364609999, 'grm_norm': 'gcn', 'self_loops': False, 'use_snp_selection': True, 'num_snps': 54969}. Best is trial 125 with value: 0.2985981018923512.
[I 2025-12-08 13:21:53,468] Trial 147 finished with value: 0.2895396733989132 and parameters: {'model_type': 'gcn', 'hidden_dims': '[512, 64]', 'dropout': 0.14867262101299508, 'batch_norm': True, 'lr': 6.747847078559906e-05, 'weight_decay': 1.024505823874457e-07, 'epochs': 106, 'loss': 'mae', 'optimizer': 'adam', 'graph_mode': 'cutoff', 'cutoff': 0.8159450951226057, 'grm_norm': 'cosine', 'self_loops': False, 'use_snp_selection': True, 'num_snps': 57582}. Best is trial 125 with value: 0.2985981018923512.
[I 2025-12-08 13:22:34,092] Trial 148 finished with value: 0.2970247254784078 and parameters: {'model_type': 'gcn', 'hidden_dims': '[512, 256]', 'dropout': 0.16473826204657754, 'batch_norm': True, 'lr': 8.368759452599673e-05, 'weight_decay': 0.00026798906863458407, 'epochs': 125, 'loss': 'mae', 'optimizer': 'adam', 'graph_mode': 'cutoff', 'cutoff': 0.7393320718476832, 'grm_norm': 'cosine_then_gcn', 'self_loops': False, 'use_snp_selection': True, 'num_snps': 51574}. Best is trial 125 with value: 0.2985981018923512.
[I 2025-12-08 13:23:14,672] Trial 149 finished with value: 0.28373811580131314 and parameters: {'model_type': 'gcn', 'hidden_dims': '[512, 256]', 'dropout': 0.16705520957380748, 'batch_norm': True, 'lr': 8.261820751958283e-05, 'weight_decay': 0.0005239150786360399, 'epochs': 126, 'loss': 'mae', 'optimizer': 'adam', 'graph_mode': 'cutoff', 'cutoff': 0.740784739378426, 'grm_norm': 'none', 'self_loops': True, 'use_snp_selection': True, 'num_snps': 51353}. Best is trial 125 with value: 0.2985981018923512.
[I 2025-12-08 13:23:45,439] Trial 0 finished with value: 0.23851041403090906 and parameters: {'model_type': 'gcn', 'hidden_dims': '[128, 64]', 'dropout': 0.199031432379812, 'batch_norm': True, 'lr': 1.8408544111075823e-05, 'weight_decay': 5.5136510071208614e-05, 'epochs': 336, 'loss': 'mae', 'optimizer': 'adam', 'graph_mode': 'knn', 'knn_k': 8, 'weighted_edges': True, 'symmetrize_mode': 'mutual', 'self_loops': True, 'use_snp_selection': True, 'num_snps': 27173}. Best is trial 0 with value: 0.23851041403090906.
[I 2025-12-08 13:24:23,700] Trial 1 finished with value: 0.20558661876155745 and parameters: {'model_type': 'gcn', 'hidden_dims': '[256, 128, 64]', 'dropout': 0.5543244404043342, 'batch_norm': True, 'lr': 7.981787657617978e-05, 'weight_decay': 2.8571789869344834e-07, 'epochs': 297, 'loss': 'mae', 'optimizer': 'adam', 'graph_mode': 'cutoff', 'cutoff': 0.3392632777751686, 'grm_norm': 'gcn', 'self_loops': False, 'use_snp_selection': False}. Best is trial 0 with value: 0.23851041403090906.
[I 2025-12-08 13:25:21,739] Trial 2 finished with value: 0.2170010239386654 and parameters: {'model_type': 'gcn', 'hidden_dims': '[512, 64]', 'dropout': 0.32815227354739207, 'batch_norm': True, 'lr': 0.000619605044204259, 'weight_decay': 0.0004086269831625786, 'epochs': 206, 'loss': 'mse', 'optimizer': 'adam', 'graph_mode': 'knn', 'knn_k': 4, 'weighted_edges': True, 'symmetrize_mode': 'union', 'self_loops': True, 'use_snp_selection': True, 'num_snps': 53035}. Best is trial 0 with value: 0.23851041403090906.
[I 2025-12-08 13:25:49,287] Trial 3 finished with value: 0.20078591042343086 and parameters: {'model_type': 'gcn', 'hidden_dims': '[256, 128]', 'dropout': 0.23110783056597514, 'batch_norm': True, 'lr': 8.11311593386298e-05, 'weight_decay': 9.296158109581328e-07, 'epochs': 213, 'loss': 'mse', 'optimizer': 'adam', 'graph_mode': 'knn', 'knn_k': 10, 'weighted_edges': True, 'symmetrize_mode': 'mutual', 'self_loops': True, 'use_snp_selection': False}. Best is trial 0 with value: 0.23851041403090906.
[I 2025-12-08 13:26:03,875] Trial 4 finished with value: 0.27820080694436267 and parameters: {'model_type': 'gcn', 'hidden_dims': '[512, 256]', 'dropout': 0.2753281956415665, 'batch_norm': True, 'lr': 0.00034435188114839693, 'weight_decay': 4.9416012835950194e-05, 'epochs': 89, 'loss': 'mae', 'optimizer': 'adam', 'graph_mode': 'cutoff', 'cutoff': 0.820078967317394, 'grm_norm': 'none', 'self_loops': False, 'use_snp_selection': True, 'num_snps': 12674}. Best is trial 4 with value: 0.27820080694436267.
[I 2025-12-08 13:26:28,865] Trial 5 finished with value: 0.2643436530093016 and parameters: {'model_type': 'gcn', 'hidden_dims': '[128, 64]', 'dropout': 0.5611163934517731, 'batch_norm': True, 'lr': 0.0003984856210762587, 'weight_decay': 1.1466743517565185e-07, 'epochs': 344, 'loss': 'mae', 'optimizer': 'adam', 'graph_mode': 'cutoff', 'cutoff': 0.6089370799714728, 'grm_norm': 'gcn', 'self_loops': True, 'use_snp_selection': False}. Best is trial 4 with value: 0.27820080694436267.
[I 2025-12-08 13:26:51,286] Trial 6 finished with value: 0.25896807820225565 and parameters: {'model_type': 'gcn', 'hidden_dims': '[128, 64]', 'dropout': 0.31805912766941713, 'batch_norm': True, 'lr': 1.2361026034262557e-05, 'weight_decay': 6.492620232791903e-06, 'epochs': 271, 'loss': 'mse', 'optimizer': 'adam', 'graph_mode': 'cutoff', 'cutoff': 0.6193362582230448, 'grm_norm': 'cosine', 'self_loops': False, 'use_snp_selection': True, 'num_snps': 28594}. Best is trial 4 with value: 0.27820080694436267.
[I 2025-12-08 13:27:11,122] Trial 7 finished with value: 0.2536613809927118 and parameters: {'model_type': 'gcn', 'hidden_dims': '[512, 64]', 'dropout': 0.471337288649717, 'batch_norm': True, 'lr': 2.239693207292708e-05, 'weight_decay': 2.263166635514082e-06, 'epochs': 69, 'loss': 'mse', 'optimizer': 'adam', 'graph_mode': 'cutoff', 'cutoff': 0.4056820886426376, 'grm_norm': 'cosine', 'self_loops': False, 'use_snp_selection': False}. Best is trial 4 with value: 0.27820080694436267.
[I 2025-12-08 13:27:48,804] Trial 8 finished with value: 0.26103045920488516 and parameters: {'model_type': 'gcn', 'hidden_dims': '[512, 256]', 'dropout': 0.20659328268932406, 'batch_norm': False, 'lr': 8.93315124361372e-05, 'weight_decay': 0.00028987480727919035, 'epochs': 136, 'loss': 'mae', 'optimizer': 'adam', 'graph_mode': 'knn', 'knn_k': 3, 'weighted_edges': False, 'symmetrize_mode': 'union', 'self_loops': False, 'use_snp_selection': True, 'num_snps': 43128}. Best is trial 4 with value: 0.27820080694436267.
[I 2025-12-08 13:28:31,035] Trial 9 finished with value: 0.05239156495831961 and parameters: {'model_type': 'gcn', 'hidden_dims': '[512, 256]', 'dropout': 0.2888209592870401, 'batch_norm': False, 'lr': 0.004734648143129892, 'weight_decay': 1.5879705591356368e-06, 'epochs': 163, 'loss': 'mse', 'optimizer': 'adam', 'graph_mode': 'cutoff', 'cutoff': 0.5984899797909019, 'grm_norm': 'cosine', 'self_loops': True, 'use_snp_selection': False}. Best is trial 4 with value: 0.27820080694436267.
[I 2025-12-08 13:28:40,191] Trial 10 finished with value: 0.24056530693730518 and parameters: {'model_type': 'gcn', 'hidden_dims': '[512, 128]', 'dropout': 0.11372025982957354, 'batch_norm': False, 'lr': 0.0023343012062770553, 'weight_decay': 4.14440562940608e-05, 'epochs': 41, 'loss': 'mae', 'optimizer': 'adam', 'graph_mode': 'cutoff', 'cutoff': 0.8740100033033124, 'grm_norm': 'none', 'self_loops': False, 'use_snp_selection': True, 'num_snps': 3859}. Best is trial 4 with value: 0.27820080694436267.
[I 2025-12-08 13:28:49,539] Trial 11 finished with value: 0.28083848152661217 and parameters: {'model_type': 'gcn', 'hidden_dims': '[128, 64]', 'dropout': 0.44863014119095845, 'batch_norm': True, 'lr': 0.0005943392021247852, 'weight_decay': 1.0655358607693621e-07, 'epochs': 110, 'loss': 'mae', 'optimizer': 'adam', 'graph_mode': 'cutoff', 'cutoff': 0.8568899271933978, 'grm_norm': 'cosine_then_gcn', 'self_loops': True, 'use_snp_selection': False}. Best is trial 11 with value: 0.28083848152661217.
[I 2025-12-08 13:29:01,666] Trial 12 finished with value: 0.262771290339476 and parameters: {'model_type': 'gcn', 'hidden_dims': '[512, 256]', 'dropout': 0.42758862319180935, 'batch_norm': True, 'lr': 0.0012059085553112938, 'weight_decay': 3.482253699955131e-05, 'epochs': 103, 'loss': 'mae', 'optimizer': 'adam', 'graph_mode': 'cutoff', 'cutoff': 0.8919050080438428, 'grm_norm': 'cosine_then_gcn', 'self_loops': True, 'use_snp_selection': True, 'num_snps': 6176}. Best is trial 11 with value: 0.28083848152661217.
[I 2025-12-08 13:29:15,053] Trial 13 finished with value: 0.2851459856916462 and parameters: {'model_type': 'gcn', 'hidden_dims': '[256, 128]', 'dropout': 0.4452783958423849, 'batch_norm': True, 'lr': 0.00028764898471530923, 'weight_decay': 8.746795324277564e-06, 'epochs': 96, 'loss': 'mae', 'optimizer': 'adam', 'graph_mode': 'cutoff', 'cutoff': 0.7596101551526167, 'grm_norm': 'cosine_then_gcn', 'self_loops': False, 'use_snp_selection': False}. Best is trial 13 with value: 0.2851459856916462.
[I 2025-12-08 13:29:32,791] Trial 14 finished with value: 0.0285232003692173 and parameters: {'model_type': 'gcn', 'hidden_dims': '[256, 128]', 'dropout': 0.4280653677930823, 'batch_norm': False, 'lr': 0.009430566714901507, 'weight_decay': 7.081154721639774e-06, 'epochs': 135, 'loss': 'mae', 'optimizer': 'adam', 'graph_mode': 'cutoff', 'cutoff': 0.7240625816402448, 'grm_norm': 'cosine_then_gcn', 'self_loops': True, 'use_snp_selection': False}. Best is trial 13 with value: 0.2851459856916462.
[I 2025-12-08 13:29:54,997] Trial 15 finished with value: 0.282314796305181 and parameters: {'model_type': 'gcn', 'hidden_dims': '[256, 128]', 'dropout': 0.4827864904294467, 'batch_norm': True, 'lr': 0.000166827860779801, 'weight_decay': 4.104169171058631e-07, 'epochs': 172, 'loss': 'mae', 'optimizer': 'adam', 'graph_mode': 'cutoff', 'cutoff': 0.7416328481826706, 'grm_norm': 'cosine_then_gcn', 'self_loops': False, 'use_snp_selection': False}. Best is trial 13 with value: 0.2851459856916462.
[I 2025-12-08 13:30:17,825] Trial 16 finished with value: 0.28189512575724224 and parameters: {'model_type': 'gcn', 'hidden_dims': '[256, 128]', 'dropout': 0.4988064344225382, 'batch_norm': True, 'lr': 0.00013435944502646522, 'weight_decay': 5.765994922406727e-07, 'epochs': 178, 'loss': 'mae', 'optimizer': 'adam', 'graph_mode': 'cutoff', 'cutoff': 0.7325220926026036, 'grm_norm': 'cosine_then_gcn', 'self_loops': False, 'use_snp_selection': False}. Best is trial 13 with value: 0.2851459856916462.
[I 2025-12-08 13:30:49,162] Trial 17 finished with value: 0.20914092035706183 and parameters: {'model_type': 'gcn', 'hidden_dims': '[256, 128]', 'dropout': 0.38972932269140576, 'batch_norm': True, 'lr': 0.00017715261025448825, 'weight_decay': 1.416090489833381e-05, 'epochs': 247, 'loss': 'mae', 'optimizer': 'adam', 'graph_mode': 'cutoff', 'cutoff': 0.478328769620374, 'grm_norm': 'cosine_then_gcn', 'self_loops': False, 'use_snp_selection': False}. Best is trial 13 with value: 0.2851459856916462.
[I 2025-12-08 13:31:08,573] Trial 18 finished with value: 0.24236651614719787 and parameters: {'model_type': 'gcn', 'hidden_dims': '[256, 128]', 'dropout': 0.5944874186944343, 'batch_norm': False, 'lr': 3.997746938164808e-05, 'weight_decay': 3.2907984051544873e-06, 'epochs': 149, 'loss': 'mae', 'optimizer': 'adam', 'graph_mode': 'knn', 'knn_k': 1, 'weighted_edges': False, 'symmetrize_mode': 'mutual', 'self_loops': False, 'use_snp_selection': False}. Best is trial 13 with value: 0.2851459856916462.
[I 2025-12-08 13:31:22,255] Trial 19 finished with value: 0.2893692195093963 and parameters: {'model_type': 'gcn', 'hidden_dims': '[512, 128]', 'dropout': 0.5169185582297925, 'batch_norm': True, 'lr': 0.0013386793687315585, 'weight_decay': 0.0001256926535172191, 'epochs': 44, 'loss': 'mae', 'optimizer': 'adam', 'graph_mode': 'cutoff', 'cutoff': 0.7252731474860397, 'grm_norm': 'cosine_then_gcn', 'self_loops': False, 'use_snp_selection': False}. Best is trial 19 with value: 0.2893692195093963.
[I 2025-12-08 13:31:36,542] Trial 20 finished with value: 0.2190433107273153 and parameters: {'model_type': 'gcn', 'hidden_dims': '[512, 128]', 'dropout': 0.5268947259583334, 'batch_norm': True, 'lr': 0.001455645352047296, 'weight_decay': 0.0009516054736026081, 'epochs': 45, 'loss': 'mae', 'optimizer': 'adam', 'graph_mode': 'cutoff', 'cutoff': 0.2386548621641688, 'grm_norm': 'cosine_then_gcn', 'self_loops': False, 'use_snp_selection': False}. Best is trial 19 with value: 0.2893692195093963.
[I 2025-12-08 13:31:56,722] Trial 21 finished with value: 0.2774695623948497 and parameters: {'model_type': 'gcn', 'hidden_dims': '[512, 128]', 'dropout': 0.3766189332126363, 'batch_norm': True, 'lr': 0.00021749770176620242, 'weight_decay': 0.00013937761772357505, 'epochs': 71, 'loss': 'mae', 'optimizer': 'adam', 'graph_mode': 'cutoff', 'cutoff': 0.719299448974299, 'grm_norm': 'cosine_then_gcn', 'self_loops': False, 'use_snp_selection': False}. Best is trial 19 with value: 0.2893692195093963.
[I 2025-12-08 13:32:29,056] Trial 22 finished with value: 0.2834846166057753 and parameters: {'model_type': 'gcn', 'hidden_dims': '[512, 128]', 'dropout': 0.4977052341356766, 'batch_norm': True, 'lr': 0.0007919879480076257, 'weight_decay': 1.816175244165104e-05, 'epochs': 121, 'loss': 'mae', 'optimizer': 'adam', 'graph_mode': 'cutoff', 'cutoff': 0.7816592109013584, 'grm_norm': 'cosine_then_gcn', 'self_loops': False, 'use_snp_selection': False}. Best is trial 19 with value: 0.2893692195093963.
[I 2025-12-08 13:32:59,392] Trial 23 finished with value: 0.2875573993919788 and parameters: {'model_type': 'gcn', 'hidden_dims': '[512, 128]', 'dropout': 0.5200722155529953, 'batch_norm': True, 'lr': 0.0009654998731251003, 'weight_decay': 1.5712081908312277e-05, 'epochs': 113, 'loss': 'mae', 'optimizer': 'adam', 'graph_mode': 'cutoff', 'cutoff': 0.7908004342377689, 'grm_norm': 'cosine_then_gcn', 'self_loops': False, 'use_snp_selection': False}. Best is trial 19 with value: 0.2893692195093963.
[I 2025-12-08 13:33:20,832] Trial 24 finished with value: 0.2855703897854133 and parameters: {'model_type': 'gcn', 'hidden_dims': '[512, 128]', 'dropout': 0.5922305881238027, 'batch_norm': True, 'lr': 0.003327593604821771, 'weight_decay': 0.0001235509314571855, 'epochs': 76, 'loss': 'mae', 'optimizer': 'adam', 'graph_mode': 'cutoff', 'cutoff': 0.642896383277676, 'grm_norm': 'cosine_then_gcn', 'self_loops': False, 'use_snp_selection': False}. Best is trial 19 with value: 0.2893692195093963.
[I 2025-12-08 13:33:37,945] Trial 25 finished with value: 0.2818444554448428 and parameters: {'model_type': 'gcn', 'hidden_dims': '[512, 128]', 'dropout': 0.590417074965789, 'batch_norm': True, 'lr': 0.0026399102382440014, 'weight_decay': 0.0001479482402667128, 'epochs': 59, 'loss': 'mae', 'optimizer': 'adam', 'graph_mode': 'cutoff', 'cutoff': 0.6452210014029826, 'grm_norm': 'none', 'self_loops': False, 'use_snp_selection': False}. Best is trial 19 with value: 0.2893692195093963.
[I 2025-12-08 13:34:00,600] Trial 26 finished with value: 0.0 and parameters: {'model_type': 'gcn', 'hidden_dims': '[512, 128]', 'dropout': 0.5396287082649128, 'batch_norm': False, 'lr': 0.005096579256012966, 'weight_decay': 0.00012591295986508766, 'epochs': 79, 'loss': 'mse', 'optimizer': 'adam', 'graph_mode': 'knn', 'knn_k': 6, 'weighted_edges': False, 'symmetrize_mode': 'union', 'self_loops': False, 'use_snp_selection': False}. Best is trial 19 with value: 0.2893692195093963.
