[I 2025-12-08 18:51:10,961] Trial 44 finished with value: 0.3476552797028148 and parameters: {'model_type': 'gcn', 'hidden_dims': '[256, 128]', 'dropout': 0.471399485611687, 'batch_norm': False, 'lr': 0.00012142182185710111, 'weight_decay': 4.5725071862054115e-05, 'epochs': 105, 'loss': 'mae', 'optimizer': 'adam', 'graph_mode': 'cutoff', 'cutoff': 0.8409580421541615, 'grm_norm': 'gcn', 'self_loops': True, 'use_snp_selection': True, 'num_snps': 11167}. Best is trial 25 with value: 0.36126225089020203.
[I 2025-12-08 18:51:24,113] Trial 45 finished with value: 0.3405864437919109 and parameters: {'model_type': 'gcn', 'hidden_dims': '[256, 128]', 'dropout': 0.20192001253823466, 'batch_norm': True, 'lr': 0.0012862379032038556, 'weight_decay': 0.00011379262456207487, 'epochs': 50, 'loss': 'mae', 'optimizer': 'adam', 'graph_mode': 'cutoff', 'cutoff': 0.7820073698034133, 'grm_norm': 'none', 'self_loops': False, 'use_snp_selection': True, 'num_snps': 19969}. Best is trial 25 with value: 0.36126225089020203.
[I 2025-12-08 18:51:51,948] Trial 46 finished with value: 0.33379718153260235 and parameters: {'model_type': 'gcn', 'hidden_dims': '[512, 128]', 'dropout': 0.3459726490234595, 'batch_norm': False, 'lr': 0.00025177391933719714, 'weight_decay': 3.7486114690334134e-05, 'epochs': 128, 'loss': 'mse', 'optimizer': 'adam', 'graph_mode': 'cutoff', 'cutoff': 0.6348836953269904, 'grm_norm': 'cosine', 'self_loops': False, 'use_snp_selection': True, 'num_snps': 30376}. Best is trial 25 with value: 0.36126225089020203.
[I 2025-12-08 18:52:21,317] Trial 47 finished with value: 0.31660567036866755 and parameters: {'model_type': 'gcn', 'hidden_dims': '[512, 64]', 'dropout': 0.5616918273570278, 'batch_norm': False, 'lr': 7.71047874325408e-05, 'weight_decay': 0.00020087486079867477, 'epochs': 76, 'loss': 'mae', 'optimizer': 'adam', 'graph_mode': 'cutoff', 'cutoff': 0.559572180004337, 'grm_norm': 'none', 'self_loops': False, 'use_snp_selection': True, 'num_snps': 45996}. Best is trial 25 with value: 0.36126225089020203.
[I 2025-12-08 18:52:34,467] Trial 48 finished with value: 0.1555081428033867 and parameters: {'model_type': 'gcn', 'hidden_dims': '[256, 128]', 'dropout': 0.38856983933336076, 'batch_norm': False, 'lr': 0.00040050503372969417, 'weight_decay': 3.5017510791069648e-06, 'epochs': 94, 'loss': 'mae', 'optimizer': 'adam', 'graph_mode': 'cutoff', 'cutoff': 0.8996197682769913, 'grm_norm': 'cosine', 'self_loops': False, 'use_snp_selection': False}. Best is trial 25 with value: 0.36126225089020203.
[I 2025-12-08 18:52:43,638] Trial 49 finished with value: 0.288952885521277 and parameters: {'model_type': 'gcn', 'hidden_dims': '[128, 64]', 'dropout': 0.1713943487684764, 'batch_norm': True, 'lr': 0.0001413416002088848, 'weight_decay': 7.763083220758677e-06, 'epochs': 40, 'loss': 'mae', 'optimizer': 'adam', 'graph_mode': 'cutoff', 'cutoff': 0.8474782403505561, 'grm_norm': 'cosine_then_gcn', 'self_loops': True, 'use_snp_selection': True, 'num_snps': 4676}. Best is trial 25 with value: 0.36126225089020203.
[I 2025-12-08 18:53:11,758] Trial 50 finished with value: -0.03352570242890078 and parameters: {'model_type': 'gcn', 'hidden_dims': '[512, 256]', 'dropout': 0.4923722600712233, 'batch_norm': False, 'lr': 0.0026367395059560595, 'weight_decay': 1.8876001521351663e-07, 'epochs': 149, 'loss': 'mse', 'optimizer': 'adam', 'graph_mode': 'knn', 'knn_k': 1, 'weighted_edges': True, 'symmetrize_mode': 'mutual', 'self_loops': False, 'use_snp_selection': True, 'num_snps': 27009}. Best is trial 25 with value: 0.36126225089020203.
[I 2025-12-08 18:53:23,026] Trial 51 finished with value: 0.3489443284627182 and parameters: {'model_type': 'gcn', 'hidden_dims': '[256, 128]', 'dropout': 0.29642617163362067, 'batch_norm': False, 'lr': 0.0003357673741588233, 'weight_decay': 7.697777954886157e-05, 'epochs': 79, 'loss': 'mae', 'optimizer': 'adam', 'graph_mode': 'cutoff', 'cutoff': 0.812993426560184, 'grm_norm': 'none', 'self_loops': False, 'use_snp_selection': True, 'num_snps': 10131}. Best is trial 25 with value: 0.36126225089020203.
[I 2025-12-08 18:53:34,844] Trial 52 finished with value: 0.35351775176514055 and parameters: {'model_type': 'gcn', 'hidden_dims': '[256, 128]', 'dropout': 0.2635740625319457, 'batch_norm': False, 'lr': 0.0006599381916943039, 'weight_decay': 4.9570439635998445e-05, 'epochs': 66, 'loss': 'mae', 'optimizer': 'adam', 'graph_mode': 'cutoff', 'cutoff': 0.7451442794889489, 'grm_norm': 'none', 'self_loops': False, 'use_snp_selection': True, 'num_snps': 13537}. Best is trial 25 with value: 0.36126225089020203.
[I 2025-12-08 18:53:46,671] Trial 53 finished with value: 0.3287082299168824 and parameters: {'model_type': 'gcn', 'hidden_dims': '[256, 128]', 'dropout': 0.22575306504249582, 'batch_norm': False, 'lr': 0.0006977871573130087, 'weight_decay': 2.3597336159192396e-05, 'epochs': 59, 'loss': 'mae', 'optimizer': 'adam', 'graph_mode': 'cutoff', 'cutoff': 0.7386233296108224, 'grm_norm': 'none', 'self_loops': False, 'use_snp_selection': True, 'num_snps': 14443}. Best is trial 25 with value: 0.36126225089020203.
[I 2025-12-08 18:54:06,549] Trial 54 finished with value: 0.31980824989066614 and parameters: {'model_type': 'gcn', 'hidden_dims': '[256, 128]', 'dropout': 0.27080719020803745, 'batch_norm': False, 'lr': 0.0012214479385426853, 'weight_decay': 1.2169014927546326e-05, 'epochs': 270, 'loss': 'mae', 'optimizer': 'adam', 'graph_mode': 'cutoff', 'cutoff': 0.8568143814955296, 'grm_norm': 'none', 'self_loops': False, 'use_snp_selection': True, 'num_snps': 15158}. Best is trial 25 with value: 0.36126225089020203.
[I 2025-12-08 18:54:26,160] Trial 55 finished with value: 0.35539990380562203 and parameters: {'model_type': 'gcn', 'hidden_dims': '[512, 256]', 'dropout': 0.3362016502001779, 'batch_norm': False, 'lr': 0.0004922478732358203, 'weight_decay': 1.781860143025469e-05, 'epochs': 96, 'loss': 'mae', 'optimizer': 'adam', 'graph_mode': 'cutoff', 'cutoff': 0.7619339128917504, 'grm_norm': 'none', 'self_loops': False, 'use_snp_selection': True, 'num_snps': 21957}. Best is trial 25 with value: 0.36126225089020203.
[I 2025-12-08 18:54:47,422] Trial 56 finished with value: 0.3558759812340203 and parameters: {'model_type': 'gcn', 'hidden_dims': '[512, 256]', 'dropout': 0.32756975176819353, 'batch_norm': False, 'lr': 0.0005401532699408421, 'weight_decay': 2.023419925698034e-05, 'epochs': 117, 'loss': 'mae', 'optimizer': 'adam', 'graph_mode': 'cutoff', 'cutoff': 0.6348453591649591, 'grm_norm': 'none', 'self_loops': False, 'use_snp_selection': True, 'num_snps': 21579}. Best is trial 25 with value: 0.36126225089020203.
[I 2025-12-08 18:55:16,393] Trial 57 finished with value: 0.33779790425309975 and parameters: {'model_type': 'gcn', 'hidden_dims': '[512, 256]', 'dropout': 0.3223166665863244, 'batch_norm': True, 'lr': 0.0004629985532073668, 'weight_decay': 1.852877741300345e-05, 'epochs': 170, 'loss': 'mae', 'optimizer': 'adam', 'graph_mode': 'cutoff', 'cutoff': 0.6395085927157436, 'grm_norm': 'none', 'self_loops': False, 'use_snp_selection': True, 'num_snps': 25846}. Best is trial 25 with value: 0.36126225089020203.
[I 2025-12-08 18:55:38,268] Trial 58 finished with value: 0.3481534181856094 and parameters: {'model_type': 'gcn', 'hidden_dims': '[512, 256]', 'dropout': 0.3367772649476954, 'batch_norm': False, 'lr': 0.0010482480330312877, 'weight_decay': 1.1395707863562625e-05, 'epochs': 115, 'loss': 'mae', 'optimizer': 'adam', 'graph_mode': 'knn', 'knn_k': 8, 'weighted_edges': True, 'symmetrize_mode': 'mutual', 'self_loops': False, 'use_snp_selection': True, 'num_snps': 21646}. Best is trial 25 with value: 0.36126225089020203.
[I 2025-12-08 18:56:04,221] Trial 59 finished with value: 0.354209957500917 and parameters: {'model_type': 'gcn', 'hidden_dims': '[512, 256]', 'dropout': 0.2204409448747074, 'batch_norm': False, 'lr': 0.0016888802838945622, 'weight_decay': 5.568090507468534e-06, 'epochs': 97, 'loss': 'mae', 'optimizer': 'adam', 'graph_mode': 'cutoff', 'cutoff': 0.6970588872070466, 'grm_norm': 'none', 'self_loops': False, 'use_snp_selection': True, 'num_snps': 34370}. Best is trial 25 with value: 0.36126225089020203.
[I 2025-12-08 18:56:21,807] Trial 60 finished with value: 0.3515632026233076 and parameters: {'model_type': 'gcn', 'hidden_dims': '[512, 256]', 'dropout': 0.17762411438506645, 'batch_norm': False, 'lr': 0.0023326461670361786, 'weight_decay': 5.688178836911538e-06, 'epochs': 103, 'loss': 'mae', 'optimizer': 'adam', 'graph_mode': 'cutoff', 'cutoff': 0.5852307592400374, 'grm_norm': 'none', 'self_loops': False, 'use_snp_selection': True, 'num_snps': 17122}. Best is trial 25 with value: 0.36126225089020203.
[I 2025-12-08 18:56:47,960] Trial 61 finished with value: 0.1566907979985004 and parameters: {'model_type': 'gcn', 'hidden_dims': '[512, 256]', 'dropout': 0.22298856060147196, 'batch_norm': False, 'lr': 0.005532149701332442, 'weight_decay': 1.4901170071244934e-06, 'epochs': 95, 'loss': 'mae', 'optimizer': 'adam', 'graph_mode': 'cutoff', 'cutoff': 0.7027768742629522, 'grm_norm': 'none', 'self_loops': False, 'use_snp_selection': True, 'num_snps': 34952}. Best is trial 25 with value: 0.36126225089020203.
[I 2025-12-08 18:57:16,641] Trial 62 finished with value: 0.2190931135774014 and parameters: {'model_type': 'gcn', 'hidden_dims': '[512, 256]', 'dropout': 0.359144595306138, 'batch_norm': False, 'lr': 0.0016035653534266423, 'weight_decay': 4.381454119463933e-06, 'epochs': 123, 'loss': 'mae', 'optimizer': 'adam', 'graph_mode': 'cutoff', 'cutoff': 0.663002824517694, 'grm_norm': 'none', 'self_loops': False, 'use_snp_selection': True, 'num_snps': 32993}. Best is trial 25 with value: 0.36126225089020203.
[I 2025-12-08 18:57:46,011] Trial 63 finished with value: 0.3507587586889822 and parameters: {'model_type': 'gcn', 'hidden_dims': '[512, 256]', 'dropout': 0.23490655755661474, 'batch_norm': False, 'lr': 0.0008309069134237792, 'weight_decay': 1.5624046464158965e-05, 'epochs': 99, 'loss': 'mae', 'optimizer': 'adam', 'graph_mode': 'cutoff', 'cutoff': 0.7649668632488922, 'grm_norm': 'none', 'self_loops': False, 'use_snp_selection': True, 'num_snps': 40209}. Best is trial 25 with value: 0.36126225089020203.
[I 2025-12-08 18:58:22,436] Trial 64 finished with value: 0.3196017178011232 and parameters: {'model_type': 'gcn', 'hidden_dims': '[512, 256]', 'dropout': 0.3041505895774691, 'batch_norm': False, 'lr': 0.0004043707874156193, 'weight_decay': 7.122088596448947e-06, 'epochs': 140, 'loss': 'mae', 'optimizer': 'adam', 'graph_mode': 'cutoff', 'cutoff': 0.2506874697895121, 'grm_norm': 'none', 'self_loops': False, 'use_snp_selection': True, 'num_snps': 39796}. Best is trial 25 with value: 0.36126225089020203.
[I 2025-12-08 18:58:53,898] Trial 65 finished with value: 0.3303629154031836 and parameters: {'model_type': 'gcn', 'hidden_dims': '[512, 256]', 'dropout': 0.2524891614058796, 'batch_norm': False, 'lr': 0.0018958518670580203, 'weight_decay': 1.9408112806649948e-05, 'epochs': 202, 'loss': 'mae', 'optimizer': 'adam', 'graph_mode': 'cutoff', 'cutoff': 0.7159015073230179, 'grm_norm': 'none', 'self_loops': False, 'use_snp_selection': True, 'num_snps': 25153}. Best is trial 25 with value: 0.36126225089020203.
[I 2025-12-08 18:59:25,050] Trial 66 finished with value: 0.35114136592519324 and parameters: {'model_type': 'gcn', 'hidden_dims': '[512, 256]', 'dropout': 0.28871223775660815, 'batch_norm': False, 'lr': 0.0005357581933353507, 'weight_decay': 2.567725052352678e-06, 'epochs': 117, 'loss': 'mae', 'optimizer': 'adam', 'graph_mode': 'cutoff', 'cutoff': 0.6105078297662339, 'grm_norm': 'cosine', 'self_loops': False, 'use_snp_selection': False}. Best is trial 25 with value: 0.36126225089020203.
[I 2025-12-08 18:59:47,634] Trial 67 finished with value: 0.2667233868043712 and parameters: {'model_type': 'gcn', 'hidden_dims': '[512, 256]', 'dropout': 0.418761795976499, 'batch_norm': True, 'lr': 0.00024221282712852293, 'weight_decay': 1.026839262593657e-05, 'epochs': 87, 'loss': 'mae', 'optimizer': 'adam', 'graph_mode': 'knn', 'knn_k': 4, 'weighted_edges': True, 'symmetrize_mode': 'mutual', 'self_loops': False, 'use_snp_selection': True, 'num_snps': 28667}. Best is trial 25 with value: 0.36126225089020203.
[I 2025-12-08 19:00:02,643] Trial 68 finished with value: 0.347677672471682 and parameters: {'model_type': 'gcn', 'hidden_dims': '[256, 128, 64]', 'dropout': 0.10989189687296735, 'batch_norm': False, 'lr': 0.0008127190594248763, 'weight_decay': 0.0006700344038691186, 'epochs': 72, 'loss': 'mae', 'optimizer': 'adam', 'graph_mode': 'cutoff', 'cutoff': 0.791626353287381, 'grm_norm': 'none', 'self_loops': False, 'use_snp_selection': True, 'num_snps': 22426}. Best is trial 25 with value: 0.36126225089020203.
[I 2025-12-08 19:00:17,954] Trial 69 finished with value: 0.02666786036221224 and parameters: {'model_type': 'gcn', 'hidden_dims': '[512, 128]', 'dropout': 0.14616184561643064, 'batch_norm': False, 'lr': 0.003973003771569786, 'weight_decay': 2.7447471624554206e-05, 'epochs': 53, 'loss': 'mae', 'optimizer': 'adam', 'graph_mode': 'cutoff', 'cutoff': 0.6977372848569962, 'grm_norm': 'cosine_then_gcn', 'self_loops': False, 'use_snp_selection': True, 'num_snps': 19982}. Best is trial 25 with value: 0.36126225089020203.
[I 2025-12-08 19:00:46,495] Trial 70 finished with value: 0.3414844137860085 and parameters: {'model_type': 'gcn', 'hidden_dims': '[512, 256]', 'dropout': 0.43548363235829374, 'batch_norm': False, 'lr': 1.0918509902512733e-05, 'weight_decay': 0.00014280806097836577, 'epochs': 105, 'loss': 'mae', 'optimizer': 'adam', 'graph_mode': 'cutoff', 'cutoff': 0.7523934731871424, 'grm_norm': 'none', 'self_loops': False, 'use_snp_selection': True, 'num_snps': 37125}. Best is trial 25 with value: 0.36126225089020203.
[I 2025-12-08 19:00:59,869] Trial 71 finished with value: 0.3539317321207788 and parameters: {'model_type': 'gcn', 'hidden_dims': '[512, 256]', 'dropout': 0.26156717881626573, 'batch_norm': False, 'lr': 0.0006163179102596463, 'weight_decay': 4.324520597115685e-05, 'epochs': 69, 'loss': 'mae', 'optimizer': 'adam', 'graph_mode': 'cutoff', 'cutoff': 0.744646350359282, 'grm_norm': 'none', 'self_loops': False, 'use_snp_selection': True, 'num_snps': 13103}. Best is trial 25 with value: 0.36126225089020203.
[I 2025-12-08 19:01:15,041] Trial 72 finished with value: 0.35555866015866006 and parameters: {'model_type': 'gcn', 'hidden_dims': '[512, 256]', 'dropout': 0.18548666695797433, 'batch_norm': False, 'lr': 0.00030620761819309043, 'weight_decay': 3.707325847883577e-05, 'epochs': 64, 'loss': 'mae', 'optimizer': 'adam', 'graph_mode': 'cutoff', 'cutoff': 0.6511471366117151, 'grm_norm': 'none', 'self_loops': False, 'use_snp_selection': True, 'num_snps': 17676}. Best is trial 25 with value: 0.36126225089020203.
[I 2025-12-08 19:01:30,232] Trial 73 finished with value: 0.36806197678801444 and parameters: {'model_type': 'gcn', 'hidden_dims': '[512, 256]', 'dropout': 0.19354931191888478, 'batch_norm': False, 'lr': 0.00018375458105385803, 'weight_decay': 3.952631945498605e-05, 'epochs': 61, 'loss': 'mae', 'optimizer': 'adam', 'graph_mode': 'cutoff', 'cutoff': 0.6349805501085073, 'grm_norm': 'none', 'self_loops': False, 'use_snp_selection': True, 'num_snps': 18398}. Best is trial 73 with value: 0.36806197678801444.
[I 2025-12-08 19:01:45,158] Trial 74 finished with value: 0.35221493670514825 and parameters: {'model_type': 'gcn', 'hidden_dims': '[512, 256]', 'dropout': 0.18730239725185327, 'batch_norm': False, 'lr': 0.0001951734562460604, 'weight_decay': 3.488394241209367e-05, 'epochs': 58, 'loss': 'mae', 'optimizer': 'adam', 'graph_mode': 'cutoff', 'cutoff': 0.6460037718451737, 'grm_norm': 'none', 'self_loops': False, 'use_snp_selection': True, 'num_snps': 18248}. Best is trial 73 with value: 0.36806197678801444.
[I 2025-12-08 19:02:03,311] Trial 75 finished with value: 0.36143761501308797 and parameters: {'model_type': 'gcn', 'hidden_dims': '[512, 256]', 'dropout': 0.14297031505292068, 'batch_norm': False, 'lr': 0.0003021914374346004, 'weight_decay': 5.8274520291327774e-05, 'epochs': 90, 'loss': 'mae', 'optimizer': 'adam', 'graph_mode': 'cutoff', 'cutoff': 0.5769281115918046, 'grm_norm': 'none', 'self_loops': False, 'use_snp_selection': True, 'num_snps': 19972}. Best is trial 73 with value: 0.36806197678801444.
[I 2025-12-08 19:02:17,559] Trial 76 finished with value: 0.3183388522671163 and parameters: {'model_type': 'gcn', 'hidden_dims': '[512, 128]', 'dropout': 0.14218726009641974, 'batch_norm': False, 'lr': 0.00017062496171480696, 'weight_decay': 6.502920744951556e-05, 'epochs': 41, 'loss': 'mae', 'optimizer': 'adam', 'graph_mode': 'cutoff', 'cutoff': 0.5138977479844264, 'grm_norm': 'none', 'self_loops': False, 'use_snp_selection': True, 'num_snps': 20031}. Best is trial 73 with value: 0.36806197678801444.
[I 2025-12-08 19:02:32,381] Trial 77 finished with value: 0.3518949525588429 and parameters: {'model_type': 'gcn', 'hidden_dims': '[512, 256]', 'dropout': 0.1577359413108491, 'batch_norm': False, 'lr': 0.0002962751131101991, 'weight_decay': 9.425901991580912e-05, 'epochs': 66, 'loss': 'mae', 'optimizer': 'adam', 'graph_mode': 'cutoff', 'cutoff': 0.5764542138021483, 'grm_norm': 'none', 'self_loops': False, 'use_snp_selection': True, 'num_snps': 16555}. Best is trial 73 with value: 0.36806197678801444.
[I 2025-12-08 19:02:54,978] Trial 78 finished with value: 0.33321929053121646 and parameters: {'model_type': 'gcn', 'hidden_dims': '[512, 256]', 'dropout': 0.12198120222520281, 'batch_norm': False, 'lr': 0.0002199318144335678, 'weight_decay': 2.2070698358614715e-05, 'epochs': 79, 'loss': 'mae', 'optimizer': 'adam', 'graph_mode': 'knn', 'knn_k': 9, 'weighted_edges': True, 'symmetrize_mode': 'mutual', 'self_loops': False, 'use_snp_selection': False}. Best is trial 73 with value: 0.36806197678801444.
[I 2025-12-08 19:03:14,443] Trial 79 finished with value: 0.35660719519022177 and parameters: {'model_type': 'gcn', 'hidden_dims': '[512, 64]', 'dropout': 0.1281519854612375, 'batch_norm': False, 'lr': 0.0003485026273059954, 'weight_decay': 1.4751014349558224e-05, 'epochs': 88, 'loss': 'mae', 'optimizer': 'adam', 'graph_mode': 'cutoff', 'cutoff': 0.5373553916905512, 'grm_norm': 'none', 'self_loops': False, 'use_snp_selection': True, 'num_snps': 22572}. Best is trial 73 with value: 0.36806197678801444.
[I 2025-12-08 19:03:34,459] Trial 80 finished with value: 0.34494652504363754 and parameters: {'model_type': 'gcn', 'hidden_dims': '[512, 64]', 'dropout': 0.12760045561805522, 'batch_norm': False, 'lr': 0.00010596677638709491, 'weight_decay': 1.6779500265278817e-05, 'epochs': 92, 'loss': 'mae', 'optimizer': 'adam', 'graph_mode': 'cutoff', 'cutoff': 0.4442700953664359, 'grm_norm': 'none', 'self_loops': False, 'use_snp_selection': True, 'num_snps': 22835}. Best is trial 73 with value: 0.36806197678801444.
[I 2025-12-08 19:03:53,078] Trial 81 finished with value: 0.3396328060815782 and parameters: {'model_type': 'gcn', 'hidden_dims': '[512, 64]', 'dropout': 0.13035686937889343, 'batch_norm': False, 'lr': 0.0003603394828822477, 'weight_decay': 5.692570777945833e-05, 'epochs': 87, 'loss': 'mae', 'optimizer': 'adam', 'graph_mode': 'cutoff', 'cutoff': 0.5335736069619927, 'grm_norm': 'none', 'self_loops': False, 'use_snp_selection': True, 'num_snps': 21138}. Best is trial 73 with value: 0.36806197678801444.
[I 2025-12-08 19:04:07,518] Trial 82 finished with value: 0.2464892848649463 and parameters: {'model_type': 'gcn', 'hidden_dims': '[512, 64]', 'dropout': 0.1861817126370015, 'batch_norm': False, 'lr': 0.00029641396653206866, 'weight_decay': 2.8602436376221197e-05, 'epochs': 48, 'loss': 'mae', 'optimizer': 'adam', 'graph_mode': 'cutoff', 'cutoff': 0.5536273383692668, 'grm_norm': 'none', 'self_loops': False, 'use_snp_selection': True, 'num_snps': 18793}. Best is trial 73 with value: 0.36806197678801444.
[I 2025-12-08 19:04:26,552] Trial 83 finished with value: 0.27187160152655493 and parameters: {'model_type': 'gcn', 'hidden_dims': '[512, 64]', 'dropout': 0.20652071623799206, 'batch_norm': False, 'lr': 0.00041727050092484774, 'weight_decay': 1.4223995913693237e-05, 'epochs': 75, 'loss': 'mae', 'optimizer': 'adam', 'graph_mode': 'cutoff', 'cutoff': 0.6088617659442279, 'grm_norm': 'none', 'self_loops': False, 'use_snp_selection': True, 'num_snps': 24551}. Best is trial 73 with value: 0.36806197678801444.
[I 2025-12-08 19:04:39,555] Trial 84 finished with value: 0.3604665637024624 and parameters: {'model_type': 'gcn', 'hidden_dims': '[256, 128, 64]', 'dropout': 0.15549839141417215, 'batch_norm': False, 'lr': 0.0005599269428178533, 'weight_decay': 4.378983555233432e-05, 'epochs': 64, 'loss': 'mae', 'optimizer': 'adam', 'graph_mode': 'cutoff', 'cutoff': 0.5873205988982683, 'grm_norm': 'none', 'self_loops': False, 'use_snp_selection': True, 'num_snps': 16519}. Best is trial 73 with value: 0.36806197678801444.
[I 2025-12-08 19:04:53,961] Trial 85 finished with value: 0.3158450178873309 and parameters: {'model_type': 'gcn', 'hidden_dims': '[512, 128]', 'dropout': 0.15555581915097663, 'batch_norm': False, 'lr': 0.0005683024638509487, 'weight_decay': 3.517066029323467e-05, 'epochs': 62, 'loss': 'mae', 'optimizer': 'adam', 'graph_mode': 'cutoff', 'cutoff': 0.5822874730715805, 'grm_norm': 'none', 'self_loops': False, 'use_snp_selection': True, 'num_snps': 16014}. Best is trial 73 with value: 0.36806197678801444.
[I 2025-12-08 19:05:07,154] Trial 86 finished with value: 0.27702612805240295 and parameters: {'model_type': 'gcn', 'hidden_dims': '[256, 128, 64]', 'dropout': 0.10463379372706694, 'batch_norm': True, 'lr': 0.0004570899006642523, 'weight_decay': 2.62056549480248e-05, 'epochs': 49, 'loss': 'mae', 'optimizer': 'adam', 'graph_mode': 'cutoff', 'cutoff': 0.4669197865339773, 'grm_norm': 'cosine_then_gcn', 'self_loops': False, 'use_snp_selection': True, 'num_snps': 18496}. Best is trial 73 with value: 0.36806197678801444.
