[I 2025-12-08 19:29:24,326] Trial 49 finished with value: 0.2519545366206096 and parameters: {'model_type': 'gcn', 'hidden_dims': '[512, 256]', 'dropout': 0.4992465041141705, 'batch_norm': True, 'lr': 0.009517371274111484, 'weight_decay': 6.016909204429554e-07, 'epochs': 144, 'loss': 'mse', 'optimizer': 'adam', 'graph_mode': 'knn', 'knn_k': 8, 'weighted_edges': True, 'symmetrize_mode': 'mutual', 'self_loops': True, 'use_snp_selection': False}. Best is trial 44 with value: 0.29538274010699583.
[I 2025-12-08 19:29:35,719] Trial 50 finished with value: 0.011856687284848228 and parameters: {'model_type': 'gcn', 'hidden_dims': '[256, 128]', 'dropout': 0.5512208207048082, 'batch_norm': False, 'lr': 0.00556554253189362, 'weight_decay': 8.575741129488853e-07, 'epochs': 81, 'loss': 'mse', 'optimizer': 'adam', 'graph_mode': 'cutoff', 'cutoff': 0.8882684145649691, 'grm_norm': 'cosine', 'self_loops': True, 'use_snp_selection': False}. Best is trial 44 with value: 0.29538274010699583.
[I 2025-12-08 19:30:17,211] Trial 51 finished with value: 0.29383301049622046 and parameters: {'model_type': 'gcn', 'hidden_dims': '[256, 128]', 'dropout': 0.598971901914007, 'batch_norm': True, 'lr': 0.0034824972340263102, 'weight_decay': 3.3618977738985865e-07, 'epochs': 341, 'loss': 'mse', 'optimizer': 'adam', 'graph_mode': 'cutoff', 'cutoff': 0.8877079810258761, 'grm_norm': 'cosine', 'self_loops': True, 'use_snp_selection': False}. Best is trial 44 with value: 0.29538274010699583.
[I 2025-12-08 19:30:58,126] Trial 52 finished with value: 0.293634870152555 and parameters: {'model_type': 'gcn', 'hidden_dims': '[256, 128]', 'dropout': 0.5753456192219533, 'batch_norm': True, 'lr': 0.0037976829344080615, 'weight_decay': 1.0232858639639297e-07, 'epochs': 336, 'loss': 'mse', 'optimizer': 'adam', 'graph_mode': 'cutoff', 'cutoff': 0.882425440897041, 'grm_norm': 'cosine', 'self_loops': True, 'use_snp_selection': False}. Best is trial 44 with value: 0.29538274010699583.
[I 2025-12-08 19:31:40,652] Trial 53 finished with value: 0.2981977208455473 and parameters: {'model_type': 'gcn', 'hidden_dims': '[256, 128]', 'dropout': 0.5832661872196038, 'batch_norm': True, 'lr': 0.003071617130879779, 'weight_decay': 1.0767014501320242e-07, 'epochs': 350, 'loss': 'mse', 'optimizer': 'adam', 'graph_mode': 'cutoff', 'cutoff': 0.8922503274258703, 'grm_norm': 'cosine', 'self_loops': True, 'use_snp_selection': False}. Best is trial 53 with value: 0.2981977208455473.
[I 2025-12-08 19:32:20,404] Trial 54 finished with value: 0.291627911162466 and parameters: {'model_type': 'gcn', 'hidden_dims': '[256, 128]', 'dropout': 0.5789781307764676, 'batch_norm': True, 'lr': 0.0035463095990871754, 'weight_decay': 1.8409730290360537e-07, 'epochs': 326, 'loss': 'mse', 'optimizer': 'adam', 'graph_mode': 'cutoff', 'cutoff': 0.8986095384826649, 'grm_norm': 'cosine', 'self_loops': True, 'use_snp_selection': False}. Best is trial 53 with value: 0.2981977208455473.
[I 2025-12-08 19:32:57,971] Trial 55 finished with value: 0.2977585244824394 and parameters: {'model_type': 'gcn', 'hidden_dims': '[256, 128]', 'dropout': 0.5331896013903135, 'batch_norm': True, 'lr': 0.00566310265035846, 'weight_decay': 1.63608808459396e-07, 'epochs': 307, 'loss': 'mse', 'optimizer': 'adam', 'graph_mode': 'cutoff', 'cutoff': 0.8918070947084098, 'grm_norm': 'cosine', 'self_loops': True, 'use_snp_selection': False}. Best is trial 53 with value: 0.2981977208455473.
[I 2025-12-08 19:33:35,434] Trial 56 finished with value: 0.2962747144988477 and parameters: {'model_type': 'gcn', 'hidden_dims': '[256, 128]', 'dropout': 0.5358838436610002, 'batch_norm': True, 'lr': 0.005826504016067247, 'weight_decay': 4.290853815459972e-07, 'epochs': 306, 'loss': 'mse', 'optimizer': 'adam', 'graph_mode': 'cutoff', 'cutoff': 0.8924146623225636, 'grm_norm': 'cosine', 'self_loops': True, 'use_snp_selection': False}. Best is trial 53 with value: 0.2981977208455473.
[I 2025-12-08 19:34:13,123] Trial 57 finished with value: 0.2948329290578714 and parameters: {'model_type': 'gcn', 'hidden_dims': '[256, 128]', 'dropout': 0.4510967067085673, 'batch_norm': True, 'lr': 0.006440168843460232, 'weight_decay': 1.4686029056008952e-07, 'epochs': 308, 'loss': 'mse', 'optimizer': 'adam', 'graph_mode': 'cutoff', 'cutoff': 0.8896235143433427, 'grm_norm': 'cosine', 'self_loops': True, 'use_snp_selection': False}. Best is trial 53 with value: 0.2981977208455473.
[I 2025-12-08 19:34:50,879] Trial 58 finished with value: -0.026511199276242643 and parameters: {'model_type': 'gcn', 'hidden_dims': '[256, 128]', 'dropout': 0.4551068059888984, 'batch_norm': False, 'lr': 0.006556220359464826, 'weight_decay': 1.5827624573094231e-07, 'epochs': 307, 'loss': 'mse', 'optimizer': 'adam', 'graph_mode': 'cutoff', 'cutoff': 0.3168087641392716, 'grm_norm': 'cosine', 'self_loops': True, 'use_snp_selection': False}. Best is trial 53 with value: 0.2981977208455473.
[I 2025-12-08 19:35:28,932] Trial 59 finished with value: 0.29591402922922416 and parameters: {'model_type': 'gcn', 'hidden_dims': '[256, 128]', 'dropout': 0.5046909514308199, 'batch_norm': True, 'lr': 0.004775524258636086, 'weight_decay': 2.2789783789661244e-07, 'epochs': 311, 'loss': 'mse', 'optimizer': 'adam', 'graph_mode': 'cutoff', 'cutoff': 0.8992487225325791, 'grm_norm': 'cosine', 'self_loops': True, 'use_snp_selection': False}. Best is trial 53 with value: 0.2981977208455473.
[I 2025-12-08 19:36:49,766] Trial 60 finished with value: 0.2930029170674411 and parameters: {'model_type': 'gcn', 'hidden_dims': '[512, 64]', 'dropout': 0.5062517846177608, 'batch_norm': True, 'lr': 0.002736176190450822, 'weight_decay': 2.2546261000251084e-07, 'epochs': 324, 'loss': 'mse', 'optimizer': 'adam', 'graph_mode': 'cutoff', 'cutoff': 0.8681767478148429, 'grm_norm': 'cosine', 'self_loops': True, 'use_snp_selection': False}. Best is trial 53 with value: 0.2981977208455473.
[I 2025-12-08 19:37:23,892] Trial 61 finished with value: 0.2906124938757383 and parameters: {'model_type': 'gcn', 'hidden_dims': '[256, 128]', 'dropout': 0.5435411060665108, 'batch_norm': True, 'lr': 0.005250431741525748, 'weight_decay': 1.2288701974981868e-07, 'epochs': 277, 'loss': 'mse', 'optimizer': 'adam', 'graph_mode': 'cutoff', 'cutoff': 0.8948119925136604, 'grm_norm': 'cosine', 'self_loops': True, 'use_snp_selection': False}. Best is trial 53 with value: 0.2981977208455473.
[I 2025-12-08 19:38:01,813] Trial 62 finished with value: 0.2943080526115983 and parameters: {'model_type': 'gcn', 'hidden_dims': '[256, 128]', 'dropout': 0.4872045683972669, 'batch_norm': True, 'lr': 0.0065315945177172935, 'weight_decay': 2.3278649255519202e-07, 'epochs': 310, 'loss': 'mse', 'optimizer': 'adam', 'graph_mode': 'cutoff', 'cutoff': 0.8982196899193328, 'grm_norm': 'cosine', 'self_loops': True, 'use_snp_selection': False}. Best is trial 53 with value: 0.2981977208455473.
[I 2025-12-08 19:38:38,812] Trial 63 finished with value: 0.29428893907625275 and parameters: {'model_type': 'gcn', 'hidden_dims': '[256, 128]', 'dropout': 0.4430478526741938, 'batch_norm': True, 'lr': 0.004322793299134628, 'weight_decay': 5.247374279130155e-07, 'epochs': 302, 'loss': 'mse', 'optimizer': 'adam', 'graph_mode': 'cutoff', 'cutoff': 0.8597624062392014, 'grm_norm': 'cosine', 'self_loops': True, 'use_snp_selection': False}. Best is trial 53 with value: 0.2981977208455473.
[I 2025-12-08 19:39:10,635] Trial 64 finished with value: 0.2976804446981579 and parameters: {'model_type': 'gcn', 'hidden_dims': '[256, 128]', 'dropout': 0.5153378902692728, 'batch_norm': True, 'lr': 0.008706556519121599, 'weight_decay': 9.125060647510268e-07, 'epochs': 257, 'loss': 'mse', 'optimizer': 'adam', 'graph_mode': 'cutoff', 'cutoff': 0.781959082562747, 'grm_norm': 'cosine', 'self_loops': True, 'use_snp_selection': False}. Best is trial 53 with value: 0.2981977208455473.
[I 2025-12-08 19:39:29,747] Trial 65 finished with value: 0.29964368968056465 and parameters: {'model_type': 'gcn', 'hidden_dims': '[128, 64]', 'dropout': 0.5179911434906375, 'batch_norm': True, 'lr': 0.008034557359121133, 'weight_decay': 1.877489581229677e-06, 'epochs': 256, 'loss': 'mse', 'optimizer': 'adam', 'graph_mode': 'cutoff', 'cutoff': 0.7838663793623177, 'grm_norm': 'cosine', 'self_loops': True, 'use_snp_selection': False}. Best is trial 65 with value: 0.29964368968056465.
[I 2025-12-08 19:39:49,145] Trial 66 finished with value: 0.2968647869589611 and parameters: {'model_type': 'gcn', 'hidden_dims': '[128, 64]', 'dropout': 0.5196857145269921, 'batch_norm': True, 'lr': 0.00860078308703762, 'weight_decay': 1.8554057246538083e-06, 'epochs': 256, 'loss': 'mse', 'optimizer': 'adam', 'graph_mode': 'cutoff', 'cutoff': 0.780878123170746, 'grm_norm': 'cosine', 'self_loops': True, 'use_snp_selection': False}. Best is trial 65 with value: 0.29964368968056465.
[I 2025-12-08 19:40:08,735] Trial 67 finished with value: 0.21625263841587686 and parameters: {'model_type': 'gcn', 'hidden_dims': '[128, 64]', 'dropout': 0.5207328378056856, 'batch_norm': True, 'lr': 0.009583144164333717, 'weight_decay': 2.7027254520618524e-06, 'epochs': 257, 'loss': 'mse', 'optimizer': 'adam', 'graph_mode': 'knn', 'knn_k': 5, 'weighted_edges': False, 'symmetrize_mode': 'union', 'self_loops': True, 'use_snp_selection': False}. Best is trial 65 with value: 0.29964368968056465.
[I 2025-12-08 19:40:29,074] Trial 68 finished with value: 0.29487653168791694 and parameters: {'model_type': 'gcn', 'hidden_dims': '[128, 64]', 'dropout': 0.4824206740857088, 'batch_norm': True, 'lr': 0.007821797233864192, 'weight_decay': 1.4945801765491011e-06, 'epochs': 274, 'loss': 'mse', 'optimizer': 'adam', 'graph_mode': 'cutoff', 'cutoff': 0.762508982631335, 'grm_norm': 'cosine', 'self_loops': True, 'use_snp_selection': False}. Best is trial 65 with value: 0.29964368968056465.
[I 2025-12-08 19:40:47,537] Trial 69 finished with value: 0.0 and parameters: {'model_type': 'gcn', 'hidden_dims': '[128, 64]', 'dropout': 0.5159372608198093, 'batch_norm': False, 'lr': 0.007929973815933784, 'weight_decay': 9.326748274411201e-07, 'epochs': 250, 'loss': 'mse', 'optimizer': 'adam', 'graph_mode': 'cutoff', 'cutoff': 0.7899759869416643, 'grm_norm': 'cosine', 'self_loops': True, 'use_snp_selection': False}. Best is trial 65 with value: 0.29964368968056465.
[I 2025-12-08 19:41:04,193] Trial 70 finished with value: 0.2888367482194097 and parameters: {'model_type': 'gcn', 'hidden_dims': '[128, 64]', 'dropout': 0.4638335318460606, 'batch_norm': True, 'lr': 0.0049000306600640794, 'weight_decay': 3.699001608474635e-06, 'epochs': 219, 'loss': 'mse', 'optimizer': 'adam', 'graph_mode': 'cutoff', 'cutoff': 0.6415658635395054, 'grm_norm': 'cosine', 'self_loops': True, 'use_snp_selection': False}. Best is trial 65 with value: 0.29964368968056465.
[I 2025-12-08 19:41:25,953] Trial 71 finished with value: 0.29086028981178674 and parameters: {'model_type': 'gcn', 'hidden_dims': '[128, 64]', 'dropout': 0.5457469311920611, 'batch_norm': True, 'lr': 0.002751256684586656, 'weight_decay': 4.530698265959256e-07, 'epochs': 295, 'loss': 'mse', 'optimizer': 'adam', 'graph_mode': 'cutoff', 'cutoff': 0.7924347525534376, 'grm_norm': 'cosine', 'self_loops': True, 'use_snp_selection': False}. Best is trial 65 with value: 0.29964368968056465.
[I 2025-12-08 19:41:47,024] Trial 72 finished with value: 0.2989033725622958 and parameters: {'model_type': 'gcn', 'hidden_dims': '[128, 64]', 'dropout': 0.4966915093472167, 'batch_norm': True, 'lr': 0.009908306265931767, 'weight_decay': 1.7332205223686326e-06, 'epochs': 285, 'loss': 'mse', 'optimizer': 'adam', 'graph_mode': 'cutoff', 'cutoff': 0.7066807208758195, 'grm_norm': 'cosine', 'self_loops': True, 'use_snp_selection': False}. Best is trial 65 with value: 0.29964368968056465.
[I 2025-12-08 19:42:07,771] Trial 73 finished with value: 0.29381774633498614 and parameters: {'model_type': 'gcn', 'hidden_dims': '[128, 64]', 'dropout': 0.49316650790069105, 'batch_norm': True, 'lr': 0.009985485210716962, 'weight_decay': 1.9277048270625238e-06, 'epochs': 280, 'loss': 'mse', 'optimizer': 'adam', 'graph_mode': 'cutoff', 'cutoff': 0.7108995499785233, 'grm_norm': 'cosine', 'self_loops': True, 'use_snp_selection': False}. Best is trial 65 with value: 0.29964368968056465.
[I 2025-12-08 19:42:27,490] Trial 74 finished with value: 0.2948977370271385 and parameters: {'model_type': 'gcn', 'hidden_dims': '[128, 64]', 'dropout': 0.5292624687371299, 'batch_norm': True, 'lr': 0.0060994815071628945, 'weight_decay': 8.789631862648596e-07, 'epochs': 265, 'loss': 'mse', 'optimizer': 'adam', 'graph_mode': 'cutoff', 'cutoff': 0.7281839403987564, 'grm_norm': 'cosine', 'self_loops': True, 'use_snp_selection': False}. Best is trial 65 with value: 0.29964368968056465.
[I 2025-12-08 19:42:46,333] Trial 75 finished with value: 0.2793796005555158 and parameters: {'model_type': 'gcn', 'hidden_dims': '[128, 64]', 'dropout': 0.5098873428344731, 'batch_norm': True, 'lr': 0.007690332034543299, 'weight_decay': 7.938529682088774e-06, 'epochs': 252, 'loss': 'mse', 'optimizer': 'adam', 'graph_mode': 'cutoff', 'cutoff': 0.592992361429558, 'grm_norm': 'cosine', 'self_loops': True, 'use_snp_selection': False}. Best is trial 65 with value: 0.29964368968056465.
[I 2025-12-08 19:43:16,756] Trial 76 finished with value: 0.2896531839616744 and parameters: {'model_type': 'gcn', 'hidden_dims': '[256, 128, 64]', 'dropout': 0.47609544501680545, 'batch_norm': True, 'lr': 0.005103109120486459, 'weight_decay': 1.336646271636189e-06, 'epochs': 235, 'loss': 'mse', 'optimizer': 'adam', 'graph_mode': 'cutoff', 'cutoff': 0.7673782638769961, 'grm_norm': 'cosine', 'self_loops': True, 'use_snp_selection': False}. Best is trial 65 with value: 0.29964368968056465.
[I 2025-12-08 19:43:38,547] Trial 77 finished with value: 0.2917322052606483 and parameters: {'model_type': 'gcn', 'hidden_dims': '[128, 64]', 'dropout': 0.40052145344547596, 'batch_norm': True, 'lr': 0.00758986080055853, 'weight_decay': 4.281908191176857e-06, 'epochs': 296, 'loss': 'mse', 'optimizer': 'adam', 'graph_mode': 'cutoff', 'cutoff': 0.8296888547499345, 'grm_norm': 'cosine_then_gcn', 'self_loops': True, 'use_snp_selection': False}. Best is trial 65 with value: 0.29964368968056465.
[I 2025-12-08 19:43:59,969] Trial 78 finished with value: 0.29219384974099405 and parameters: {'model_type': 'gcn', 'hidden_dims': '[128, 64]', 'dropout': 0.5631607865280005, 'batch_norm': True, 'lr': 0.004788879646444606, 'weight_decay': 1.9196085390138807e-06, 'epochs': 288, 'loss': 'mse', 'optimizer': 'adam', 'graph_mode': 'cutoff', 'cutoff': 0.8058319662256805, 'grm_norm': 'cosine', 'self_loops': True, 'use_snp_selection': False}. Best is trial 65 with value: 0.29964368968056465.
[I 2025-12-08 19:45:07,654] Trial 79 finished with value: 0.29946478974746243 and parameters: {'model_type': 'gcn', 'hidden_dims': '[512, 64]', 'dropout': 0.5326066550617806, 'batch_norm': True, 'lr': 0.004394300473079591, 'weight_decay': 2.4583716591968383e-07, 'epochs': 268, 'loss': 'mse', 'optimizer': 'adam', 'graph_mode': 'cutoff', 'cutoff': 0.7416369533015423, 'grm_norm': 'cosine', 'self_loops': True, 'use_snp_selection': False}. Best is trial 65 with value: 0.29964368968056465.
[I 2025-12-08 19:46:15,302] Trial 80 finished with value: 0.20138254841484288 and parameters: {'model_type': 'gcn', 'hidden_dims': '[512, 64]', 'dropout': 0.5316539182786219, 'batch_norm': True, 'lr': 0.006626847039548975, 'weight_decay': 1.2094403047093243e-06, 'epochs': 266, 'loss': 'mse', 'optimizer': 'adam', 'graph_mode': 'knn', 'knn_k': 2, 'weighted_edges': False, 'symmetrize_mode': 'union', 'self_loops': True, 'use_snp_selection': False}. Best is trial 65 with value: 0.29964368968056465.
[I 2025-12-08 19:47:24,657] Trial 81 finished with value: 0.2955294459593418 and parameters: {'model_type': 'gcn', 'hidden_dims': '[512, 64]', 'dropout': 0.49729842501021465, 'batch_norm': True, 'lr': 0.004163663801696873, 'weight_decay': 2.492300936564405e-07, 'epochs': 276, 'loss': 'mse', 'optimizer': 'adam', 'graph_mode': 'cutoff', 'cutoff': 0.6887978923007986, 'grm_norm': 'cosine', 'self_loops': True, 'use_snp_selection': False}. Best is trial 65 with value: 0.29964368968056465.
[I 2025-12-08 19:48:30,366] Trial 82 finished with value: 0.296802613683407 and parameters: {'model_type': 'gcn', 'hidden_dims': '[512, 64]', 'dropout': 0.5466487624880434, 'batch_norm': True, 'lr': 0.009207351028264739, 'weight_decay': 7.542109199145365e-07, 'epochs': 261, 'loss': 'mse', 'optimizer': 'adam', 'graph_mode': 'cutoff', 'cutoff': 0.7264085442214404, 'grm_norm': 'cosine', 'self_loops': True, 'use_snp_selection': False}. Best is trial 65 with value: 0.29964368968056465.
[I 2025-12-08 19:49:35,364] Trial 83 finished with value: 0.3018088094810738 and parameters: {'model_type': 'gcn', 'hidden_dims': '[512, 64]', 'dropout': 0.5475545197553392, 'batch_norm': True, 'lr': 0.009171788897327025, 'weight_decay': 7.132794784962245e-07, 'epochs': 258, 'loss': 'mse', 'optimizer': 'adam', 'graph_mode': 'cutoff', 'cutoff': 0.7383375456807892, 'grm_norm': 'cosine', 'self_loops': True, 'use_snp_selection': False}. Best is trial 83 with value: 0.3018088094810738.
[I 2025-12-08 19:50:39,862] Trial 84 finished with value: 0.29777450553535945 and parameters: {'model_type': 'gcn', 'hidden_dims': '[512, 64]', 'dropout': 0.5698520354768748, 'batch_norm': True, 'lr': 0.008508828360468937, 'weight_decay': 2.5769422546667145e-06, 'epochs': 256, 'loss': 'mse', 'optimizer': 'adam', 'graph_mode': 'cutoff', 'cutoff': 0.7432187354183627, 'grm_norm': 'cosine', 'self_loops': True, 'use_snp_selection': False}. Best is trial 83 with value: 0.3018088094810738.
[I 2025-12-08 19:51:39,560] Trial 85 finished with value: 0.2968323332928993 and parameters: {'model_type': 'gcn', 'hidden_dims': '[512, 64]', 'dropout': 0.5674547450183494, 'batch_norm': True, 'lr': 0.00833363509581727, 'weight_decay': 3.2741106248785003e-06, 'epochs': 236, 'loss': 'mse', 'optimizer': 'adam', 'graph_mode': 'cutoff', 'cutoff': 0.7439865202705279, 'grm_norm': 'cosine', 'self_loops': True, 'use_snp_selection': False}. Best is trial 83 with value: 0.3018088094810738.
[I 2025-12-08 19:52:40,950] Trial 86 finished with value: 0.2941998591853746 and parameters: {'model_type': 'gcn', 'hidden_dims': '[512, 64]', 'dropout': 0.5525680977264172, 'batch_norm': True, 'lr': 0.00712420354005865, 'weight_decay': 1.9793825439838177e-06, 'epochs': 243, 'loss': 'mse', 'optimizer': 'adam', 'graph_mode': 'cutoff', 'cutoff': 0.6778332632878633, 'grm_norm': 'cosine', 'self_loops': True, 'use_snp_selection': False}. Best is trial 83 with value: 0.3018088094810738.
[I 2025-12-08 19:53:30,779] Trial 87 finished with value: 0.2988990016417249 and parameters: {'model_type': 'gcn', 'hidden_dims': '[512, 64]', 'dropout': 0.574703360927476, 'batch_norm': True, 'lr': 0.00879673923233417, 'weight_decay': 2.5266501698197338e-06, 'epochs': 195, 'loss': 'mse', 'optimizer': 'adam', 'graph_mode': 'cutoff', 'cutoff': 0.7461607494625705, 'grm_norm': 'cosine_then_gcn', 'self_loops': True, 'use_snp_selection': False}. Best is trial 83 with value: 0.3018088094810738.
[I 2025-12-08 19:54:16,316] Trial 88 finished with value: 0.0 and parameters: {'model_type': 'gcn', 'hidden_dims': '[512, 64]', 'dropout': 0.5762398518702893, 'batch_norm': False, 'lr': 0.006909070954560855, 'weight_decay': 2.560976502060893e-06, 'epochs': 178, 'loss': 'mse', 'optimizer': 'adam', 'graph_mode': 'cutoff', 'cutoff': 0.6566496265327171, 'grm_norm': 'cosine_then_gcn', 'self_loops': True, 'use_snp_selection': False}. Best is trial 83 with value: 0.3018088094810738.
[I 2025-12-08 19:55:09,774] Trial 89 finished with value: 0.27198657356752315 and parameters: {'model_type': 'gcn', 'hidden_dims': '[512, 64]', 'dropout': 0.5707363628383523, 'batch_norm': True, 'lr': 1.172953608585998e-05, 'weight_decay': 4.1926336298760635e-06, 'epochs': 210, 'loss': 'mse', 'optimizer': 'adam', 'graph_mode': 'cutoff', 'cutoff': 0.7072044006797178, 'grm_norm': 'cosine_then_gcn', 'self_loops': True, 'use_snp_selection': False}. Best is trial 83 with value: 0.3018088094810738.
[I 2025-12-08 19:56:12,359] Trial 90 finished with value: 0.294317687809816 and parameters: {'model_type': 'gcn', 'hidden_dims': '[512, 64]', 'dropout': 0.5529289963905131, 'batch_norm': True, 'lr': 0.009943320419471508, 'weight_decay': 5.702547611113995e-06, 'epochs': 248, 'loss': 'mse', 'optimizer': 'adam', 'graph_mode': 'cutoff', 'cutoff': 0.7504571749161204, 'grm_norm': 'cosine_then_gcn', 'self_loops': True, 'use_snp_selection': False}. Best is trial 83 with value: 0.3018088094810738.
[I 2025-12-08 19:57:02,190] Trial 91 finished with value: 0.30501010443916743 and parameters: {'model_type': 'gcn', 'hidden_dims': '[512, 64]', 'dropout': 0.589061465945563, 'batch_norm': True, 'lr': 0.008268829363995709, 'weight_decay': 1.0353909045180503e-06, 'epochs': 195, 'loss': 'mse', 'optimizer': 'adam', 'graph_mode': 'cutoff', 'cutoff': 0.7727394126128153, 'grm_norm': 'cosine', 'self_loops': True, 'use_snp_selection': False}. Best is trial 91 with value: 0.30501010443916743.
[I 2025-12-08 19:57:53,954] Trial 92 finished with value: 0.3014807119835844 and parameters: {'model_type': 'gcn', 'hidden_dims': '[512, 64]', 'dropout': 0.5393775729591048, 'batch_norm': True, 'lr': 0.005735687391294678, 'weight_decay': 1.1716544080441428e-06, 'epochs': 203, 'loss': 'mse', 'optimizer': 'adam', 'graph_mode': 'cutoff', 'cutoff': 0.7601196918312249, 'grm_norm': 'cosine_then_gcn', 'self_loops': True, 'use_snp_selection': False}. Best is trial 91 with value: 0.30501010443916743.
