[I 2025-12-08 19:37:26,574] Trial 23 finished with value: 0.3624900666247296 and parameters: {'model_type': 'gcn', 'hidden_dims': '[512, 128]', 'dropout': 0.5984005703393165, 'batch_norm': False, 'lr': 0.00018488335706361904, 'weight_decay': 8.35466007513373e-07, 'epochs': 249, 'loss': 'mae', 'optimizer': 'adam', 'graph_mode': 'knn', 'knn_k': 10, 'weighted_edges': False, 'symmetrize_mode': 'union', 'self_loops': False, 'use_snp_selection': True, 'num_snps': 23914}. Best is trial 23 with value: 0.3624900666247296.
[I 2025-12-08 19:37:50,652] Trial 24 finished with value: 0.3493202472467213 and parameters: {'model_type': 'gcn', 'hidden_dims': '[256, 128]', 'dropout': 0.37523054107961884, 'batch_norm': False, 'lr': 0.00019325235775553292, 'weight_decay': 5.556117379324376e-07, 'epochs': 233, 'loss': 'mae', 'optimizer': 'adam', 'graph_mode': 'knn', 'knn_k': 10, 'weighted_edges': False, 'symmetrize_mode': 'union', 'self_loops': False, 'use_snp_selection': True, 'num_snps': 22380}. Best is trial 23 with value: 0.3624900666247296.
[I 2025-12-08 19:38:20,049] Trial 25 finished with value: 0.3419532326609571 and parameters: {'model_type': 'gcn', 'hidden_dims': '[256, 128, 64]', 'dropout': 0.4553934890419155, 'batch_norm': False, 'lr': 0.00018784195374932735, 'weight_decay': 2.965057360188948e-07, 'epochs': 275, 'loss': 'mae', 'optimizer': 'adam', 'graph_mode': 'knn', 'knn_k': 9, 'weighted_edges': False, 'symmetrize_mode': 'union', 'self_loops': False, 'use_snp_selection': True, 'num_snps': 24788}. Best is trial 23 with value: 0.3624900666247296.
[I 2025-12-08 19:39:20,983] Trial 26 finished with value: 0.10648010448773237 and parameters: {'model_type': 'gcn', 'hidden_dims': '[512, 128]', 'dropout': 0.5191128969787661, 'batch_norm': False, 'lr': 0.0008589923914196243, 'weight_decay': 2.333614984474187e-05, 'epochs': 233, 'loss': 'mse', 'optimizer': 'adam', 'graph_mode': 'knn', 'knn_k': 9, 'weighted_edges': False, 'symmetrize_mode': 'union', 'self_loops': True, 'use_snp_selection': False}. Best is trial 23 with value: 0.3624900666247296.
[I 2025-12-08 19:39:47,569] Trial 27 finished with value: 0.3506564364057685 and parameters: {'model_type': 'gcn', 'hidden_dims': '[512, 128]', 'dropout': 0.45136088563715226, 'batch_norm': False, 'lr': 5.404308713579679e-05, 'weight_decay': 1.0435198887196738e-07, 'epochs': 300, 'loss': 'mae', 'optimizer': 'adam', 'graph_mode': 'knn', 'knn_k': 9, 'weighted_edges': False, 'symmetrize_mode': 'union', 'self_loops': False, 'use_snp_selection': True, 'num_snps': 11425}. Best is trial 23 with value: 0.3624900666247296.
[I 2025-12-08 19:40:20,742] Trial 28 finished with value: 0.3496209051159672 and parameters: {'model_type': 'gcn', 'hidden_dims': '[512, 128]', 'dropout': 0.3714858195952754, 'batch_norm': False, 'lr': 0.00015715259765683193, 'weight_decay': 1.0544324399682216e-06, 'epochs': 155, 'loss': 'mae', 'optimizer': 'adam', 'graph_mode': 'knn', 'knn_k': 10, 'weighted_edges': True, 'symmetrize_mode': 'mutual', 'self_loops': False, 'use_snp_selection': True, 'num_snps': 32715}. Best is trial 23 with value: 0.3624900666247296.
[I 2025-12-08 19:40:45,620] Trial 29 finished with value: 0.33944505565778116 and parameters: {'model_type': 'gcn', 'hidden_dims': '[512, 128]', 'dropout': 0.5668934523838977, 'batch_norm': False, 'lr': 2.1087442807785193e-05, 'weight_decay': 0.00019281105889391297, 'epochs': 302, 'loss': 'mae', 'optimizer': 'adam', 'graph_mode': 'knn', 'knn_k': 8, 'weighted_edges': False, 'symmetrize_mode': 'union', 'self_loops': True, 'use_snp_selection': True, 'num_snps': 10228}. Best is trial 23 with value: 0.3624900666247296.
[I 2025-12-08 19:41:08,757] Trial 30 finished with value: 0.35227470925790205 and parameters: {'model_type': 'gcn', 'hidden_dims': '[256, 128]', 'dropout': 0.5276329313743442, 'batch_norm': False, 'lr': 0.00027894928310450025, 'weight_decay': 3.341652065178506e-07, 'epochs': 225, 'loss': 'mae', 'optimizer': 'adam', 'graph_mode': 'knn', 'knn_k': 8, 'weighted_edges': False, 'symmetrize_mode': 'union', 'self_loops': False, 'use_snp_selection': True, 'num_snps': 21608}. Best is trial 23 with value: 0.3624900666247296.
[I 2025-12-08 19:42:09,756] Trial 31 finished with value: 0.35510107676409686 and parameters: {'model_type': 'gcn', 'hidden_dims': '[512, 128]', 'dropout': 0.5986367218110078, 'batch_norm': False, 'lr': 1.5505802670767128e-05, 'weight_decay': 3.0674057755506395e-06, 'epochs': 253, 'loss': 'mae', 'optimizer': 'adam', 'graph_mode': 'knn', 'knn_k': 6, 'weighted_edges': False, 'symmetrize_mode': 'union', 'self_loops': False, 'use_snp_selection': True, 'num_snps': 46700}. Best is trial 23 with value: 0.3624900666247296.
[I 2025-12-08 19:42:37,029] Trial 32 finished with value: 0.34627732325662997 and parameters: {'model_type': 'gcn', 'hidden_dims': '[256, 128, 64]', 'dropout': 0.5995510747291257, 'batch_norm': False, 'lr': 2.3105036137302386e-05, 'weight_decay': 5.809396999537979e-07, 'epochs': 193, 'loss': 'mae', 'optimizer': 'adam', 'graph_mode': 'knn', 'knn_k': 6, 'weighted_edges': False, 'symmetrize_mode': 'union', 'self_loops': False, 'use_snp_selection': True, 'num_snps': 31707}. Best is trial 23 with value: 0.3624900666247296.
[I 2025-12-08 19:43:17,006] Trial 33 finished with value: 0.3550144779534222 and parameters: {'model_type': 'gcn', 'hidden_dims': '[512, 128]', 'dropout': 0.5601726272694667, 'batch_norm': False, 'lr': 6.106750687761904e-05, 'weight_decay': 1.5525054854614145e-06, 'epochs': 167, 'loss': 'mae', 'optimizer': 'adam', 'graph_mode': 'knn', 'knn_k': 6, 'weighted_edges': False, 'symmetrize_mode': 'union', 'self_loops': False, 'use_snp_selection': True, 'num_snps': 39724}. Best is trial 23 with value: 0.3624900666247296.
[I 2025-12-08 19:44:12,080] Trial 34 finished with value: 0.34772633796745367 and parameters: {'model_type': 'gcn', 'hidden_dims': '[512, 64]', 'dropout': 0.535472174270392, 'batch_norm': False, 'lr': 1.66595227814221e-05, 'weight_decay': 6.323885898133943e-07, 'epochs': 210, 'loss': 'mae', 'optimizer': 'adam', 'graph_mode': 'knn', 'knn_k': 9, 'weighted_edges': False, 'symmetrize_mode': 'union', 'self_loops': False, 'use_snp_selection': False}. Best is trial 23 with value: 0.3624900666247296.
[I 2025-12-08 19:44:57,957] Trial 35 finished with value: 0.33950215120249055 and parameters: {'model_type': 'gcn', 'hidden_dims': '[512, 128]', 'dropout': 0.477147501709948, 'batch_norm': True, 'lr': 5.822711306371635e-05, 'weight_decay': 2.724218271466351e-06, 'epochs': 321, 'loss': 'mse', 'optimizer': 'adam', 'graph_mode': 'cutoff', 'cutoff': 0.8863551959725584, 'grm_norm': 'cosine_then_gcn', 'self_loops': True, 'use_snp_selection': True, 'num_snps': 27277}. Best is trial 23 with value: 0.3624900666247296.
[I 2025-12-08 19:45:13,054] Trial 36 finished with value: 0.28004180324440225 and parameters: {'model_type': 'gcn', 'hidden_dims': '[128, 64]', 'dropout': 0.5759021544340163, 'batch_norm': False, 'lr': 0.0016447062560800518, 'weight_decay': 1.9223894088571294e-07, 'epochs': 204, 'loss': 'mae', 'optimizer': 'adam', 'graph_mode': 'knn', 'knn_k': 5, 'weighted_edges': False, 'symmetrize_mode': 'union', 'self_loops': False, 'use_snp_selection': True, 'num_snps': 14305}. Best is trial 23 with value: 0.3624900666247296.
[I 2025-12-08 19:45:51,152] Trial 37 finished with value: 0.29145739120290204 and parameters: {'model_type': 'gcn', 'hidden_dims': '[512, 128]', 'dropout': 0.3308456156777141, 'batch_norm': True, 'lr': 0.000553040169048438, 'weight_decay': 2.1858534746643995e-05, 'epochs': 141, 'loss': 'mae', 'optimizer': 'adam', 'graph_mode': 'cutoff', 'cutoff': 0.22456674910531654, 'grm_norm': 'cosine_then_gcn', 'self_loops': False, 'use_snp_selection': False}. Best is trial 23 with value: 0.3624900666247296.
[I 2025-12-08 19:46:07,834] Trial 38 finished with value: 0.3293229899615287 and parameters: {'model_type': 'gcn', 'hidden_dims': '[256, 128, 64]', 'dropout': 0.5514413521820889, 'batch_norm': False, 'lr': 0.00025115873560980584, 'weight_decay': 7.226511808652375e-06, 'epochs': 250, 'loss': 'mse', 'optimizer': 'adam', 'graph_mode': 'knn', 'knn_k': 8, 'weighted_edges': True, 'symmetrize_mode': 'mutual', 'self_loops': True, 'use_snp_selection': True, 'num_snps': 8649}. Best is trial 23 with value: 0.3624900666247296.
[I 2025-12-08 19:46:43,733] Trial 39 finished with value: 0.3052381149290634 and parameters: {'model_type': 'gcn', 'hidden_dims': '[512, 64]', 'dropout': 0.13812964220754878, 'batch_norm': True, 'lr': 3.0194416475200988e-05, 'weight_decay': 8.883254000410722e-07, 'epochs': 272, 'loss': 'mae', 'optimizer': 'adam', 'graph_mode': 'cutoff', 'cutoff': 0.7473710403695043, 'grm_norm': 'none', 'self_loops': False, 'use_snp_selection': True, 'num_snps': 22560}. Best is trial 23 with value: 0.3624900666247296.
[I 2025-12-08 19:46:52,246] Trial 40 finished with value: 0.34036221578114617 and parameters: {'model_type': 'gcn', 'hidden_dims': '[128, 64]', 'dropout': 0.26200242926712863, 'batch_norm': False, 'lr': 1.0564777319524592e-05, 'weight_decay': 1.8467769070658236e-07, 'epochs': 95, 'loss': 'mse', 'optimizer': 'adam', 'graph_mode': 'knn', 'knn_k': 4, 'weighted_edges': False, 'symmetrize_mode': 'union', 'self_loops': False, 'use_snp_selection': False}. Best is trial 23 with value: 0.3624900666247296.
[I 2025-12-08 19:47:15,931] Trial 41 finished with value: 0.3556133757085368 and parameters: {'model_type': 'gcn', 'hidden_dims': '[512, 128]', 'dropout': 0.49101583423818324, 'batch_norm': False, 'lr': 4.937419372912982e-05, 'weight_decay': 4.423206774369038e-06, 'epochs': 191, 'loss': 'mae', 'optimizer': 'adam', 'graph_mode': 'knn', 'knn_k': 7, 'weighted_edges': False, 'symmetrize_mode': 'union', 'self_loops': False, 'use_snp_selection': True, 'num_snps': 15470}. Best is trial 23 with value: 0.3624900666247296.
[I 2025-12-08 19:47:42,484] Trial 42 finished with value: 0.3559666960707608 and parameters: {'model_type': 'gcn', 'hidden_dims': '[512, 128]', 'dropout': 0.51499764528314, 'batch_norm': False, 'lr': 7.079824735392653e-05, 'weight_decay': 1.690669765309201e-06, 'epochs': 182, 'loss': 'mae', 'optimizer': 'adam', 'graph_mode': 'knn', 'knn_k': 8, 'weighted_edges': False, 'symmetrize_mode': 'union', 'self_loops': False, 'use_snp_selection': True, 'num_snps': 19075}. Best is trial 23 with value: 0.3624900666247296.
[I 2025-12-08 19:48:17,340] Trial 43 finished with value: 0.36137867985506544 and parameters: {'model_type': 'gcn', 'hidden_dims': '[512, 128]', 'dropout': 0.45671064007204587, 'batch_norm': False, 'lr': 2.602219515143706e-05, 'weight_decay': 5.1688990196248025e-06, 'epochs': 221, 'loss': 'mae', 'optimizer': 'adam', 'graph_mode': 'knn', 'knn_k': 6, 'weighted_edges': True, 'symmetrize_mode': 'union', 'self_loops': False, 'use_snp_selection': True, 'num_snps': 25266}. Best is trial 23 with value: 0.3624900666247296.
[I 2025-12-08 19:48:55,112] Trial 44 finished with value: 0.3630728468105854 and parameters: {'model_type': 'gcn', 'hidden_dims': '[512, 128]', 'dropout': 0.44876842385853066, 'batch_norm': False, 'lr': 2.451050708338831e-05, 'weight_decay': 1.1207303217913963e-06, 'epochs': 221, 'loss': 'mae', 'optimizer': 'adam', 'graph_mode': 'knn', 'knn_k': 4, 'weighted_edges': True, 'symmetrize_mode': 'union', 'self_loops': False, 'use_snp_selection': True, 'num_snps': 28874}. Best is trial 44 with value: 0.3630728468105854.
[I 2025-12-08 19:49:22,477] Trial 45 finished with value: 0.34278871428970836 and parameters: {'model_type': 'gcn', 'hidden_dims': '[256, 128]', 'dropout': 0.4061218132456962, 'batch_norm': True, 'lr': 2.4469978695118636e-05, 'weight_decay': 4.254666079977e-07, 'epochs': 222, 'loss': 'mae', 'optimizer': 'adam', 'graph_mode': 'knn', 'knn_k': 10, 'weighted_edges': True, 'symmetrize_mode': 'union', 'self_loops': False, 'use_snp_selection': True, 'num_snps': 28747}. Best is trial 44 with value: 0.3630728468105854.
[I 2025-12-08 19:49:58,247] Trial 46 finished with value: 0.3494605354037947 and parameters: {'model_type': 'gcn', 'hidden_dims': '[512, 128]', 'dropout': 0.45190022741608904, 'batch_norm': False, 'lr': 0.00012448583976673502, 'weight_decay': 4.211751904895634e-05, 'epochs': 242, 'loss': 'mae', 'optimizer': 'adam', 'graph_mode': 'cutoff', 'cutoff': 0.4308760345957434, 'grm_norm': 'cosine_then_gcn', 'self_loops': True, 'use_snp_selection': True, 'num_snps': 24500}. Best is trial 44 with value: 0.3630728468105854.
[I 2025-12-08 19:50:42,490] Trial 47 finished with value: 0.3124308760830846 and parameters: {'model_type': 'gcn', 'hidden_dims': '[512, 128]', 'dropout': 0.3536450601796286, 'batch_norm': False, 'lr': 2.8163691617340707e-05, 'weight_decay': 1.038233134040877e-06, 'epochs': 285, 'loss': 'mae', 'optimizer': 'adam', 'graph_mode': 'knn', 'knn_k': 4, 'weighted_edges': True, 'symmetrize_mode': 'mutual', 'self_loops': False, 'use_snp_selection': True, 'num_snps': 28523}. Best is trial 44 with value: 0.3630728468105854.
[I 2025-12-08 19:51:34,979] Trial 48 finished with value: 0.3538272023829612 and parameters: {'model_type': 'gcn', 'hidden_dims': '[512, 64]', 'dropout': 0.4657043059678506, 'batch_norm': False, 'lr': 1.5010148164671374e-05, 'weight_decay': 1.9415426802579755e-06, 'epochs': 203, 'loss': 'mae', 'optimizer': 'adam', 'graph_mode': 'knn', 'knn_k': 4, 'weighted_edges': True, 'symmetrize_mode': 'union', 'self_loops': False, 'use_snp_selection': False}. Best is trial 44 with value: 0.3630728468105854.
[I 2025-12-08 19:51:53,905] Trial 49 finished with value: 0.32770016251003936 and parameters: {'model_type': 'gcn', 'hidden_dims': '[128, 64]', 'dropout': 0.41140996013345404, 'batch_norm': False, 'lr': 8.009757492345231e-05, 'weight_decay': 1.8634884455411613e-07, 'epochs': 216, 'loss': 'mse', 'optimizer': 'adam', 'graph_mode': 'knn', 'knn_k': 2, 'weighted_edges': True, 'symmetrize_mode': 'union', 'self_loops': False, 'use_snp_selection': True, 'num_snps': 25420}. Best is trial 44 with value: 0.3630728468105854.
[I 2025-12-08 19:52:26,899] Trial 50 finished with value: 0.28294100536991873 and parameters: {'model_type': 'gcn', 'hidden_dims': '[512, 128]', 'dropout': 0.4342247077992022, 'batch_norm': True, 'lr': 0.00040443136775002625, 'weight_decay': 0.00018711598652354348, 'epochs': 240, 'loss': 'mae', 'optimizer': 'adam', 'graph_mode': 'cutoff', 'cutoff': 0.20296928094917988, 'grm_norm': 'none', 'self_loops': False, 'use_snp_selection': True, 'num_snps': 20527}. Best is trial 44 with value: 0.3630728468105854.
[I 2025-12-08 19:53:16,395] Trial 51 finished with value: 0.35833713419207774 and parameters: {'model_type': 'gcn', 'hidden_dims': '[512, 128]', 'dropout': 0.4380434766395285, 'batch_norm': False, 'lr': 1.7849236269655846e-05, 'weight_decay': 6.9024521741032244e-06, 'epochs': 259, 'loss': 'mae', 'optimizer': 'adam', 'graph_mode': 'knn', 'knn_k': 6, 'weighted_edges': True, 'symmetrize_mode': 'union', 'self_loops': False, 'use_snp_selection': True, 'num_snps': 35248}. Best is trial 44 with value: 0.3630728468105854.
[I 2025-12-08 19:54:06,376] Trial 52 finished with value: 0.3575989326353021 and parameters: {'model_type': 'gcn', 'hidden_dims': '[512, 128]', 'dropout': 0.438570324387125, 'batch_norm': False, 'lr': 4.413634705224002e-05, 'weight_decay': 7.59959593171927e-06, 'epochs': 260, 'loss': 'mae', 'optimizer': 'adam', 'graph_mode': 'knn', 'knn_k': 5, 'weighted_edges': True, 'symmetrize_mode': 'union', 'self_loops': False, 'use_snp_selection': True, 'num_snps': 35579}. Best is trial 44 with value: 0.3630728468105854.
[I 2025-12-08 19:54:52,689] Trial 53 finished with value: 0.3404842282695785 and parameters: {'model_type': 'gcn', 'hidden_dims': '[512, 128]', 'dropout': 0.39346641876152266, 'batch_norm': False, 'lr': 1.9446361430907223e-05, 'weight_decay': 2.9719572984822805e-05, 'epochs': 264, 'loss': 'mae', 'optimizer': 'adam', 'graph_mode': 'knn', 'knn_k': 3, 'weighted_edges': True, 'symmetrize_mode': 'union', 'self_loops': False, 'use_snp_selection': True, 'num_snps': 32346}. Best is trial 44 with value: 0.3630728468105854.
[I 2025-12-08 19:55:39,341] Trial 54 finished with value: 0.3609351073521806 and parameters: {'model_type': 'gcn', 'hidden_dims': '[512, 128]', 'dropout': 0.5069302797797516, 'batch_norm': False, 'lr': 1.3616560584177531e-05, 'weight_decay': 1.2064683054716272e-06, 'epochs': 280, 'loss': 'mae', 'optimizer': 'adam', 'graph_mode': 'knn', 'knn_k': 5, 'weighted_edges': True, 'symmetrize_mode': 'union', 'self_loops': False, 'use_snp_selection': True, 'num_snps': 30502}. Best is trial 44 with value: 0.3630728468105854.
[I 2025-12-08 19:56:48,499] Trial 55 finished with value: 0.35881022946993896 and parameters: {'model_type': 'gcn', 'hidden_dims': '[512, 128]', 'dropout': 0.4797892557073108, 'batch_norm': False, 'lr': 1.3492742880484947e-05, 'weight_decay': 1.2039666020111258e-06, 'epochs': 320, 'loss': 'mae', 'optimizer': 'adam', 'graph_mode': 'knn', 'knn_k': 5, 'weighted_edges': True, 'symmetrize_mode': 'union', 'self_loops': False, 'use_snp_selection': True, 'num_snps': 44413}. Best is trial 44 with value: 0.3630728468105854.
[I 2025-12-08 19:58:04,633] Trial 56 finished with value: 0.0 and parameters: {'model_type': 'gcn', 'hidden_dims': '[512, 128]', 'dropout': 0.5034969218570842, 'batch_norm': False, 'lr': 0.008067577185273789, 'weight_decay': 9.765561653768774e-07, 'epochs': 344, 'loss': 'mae', 'optimizer': 'adam', 'graph_mode': 'knn', 'knn_k': 5, 'weighted_edges': True, 'symmetrize_mode': 'union', 'self_loops': False, 'use_snp_selection': True, 'num_snps': 45087}. Best is trial 44 with value: 0.3630728468105854.
[I 2025-12-08 19:59:32,611] Trial 57 finished with value: 0.35741897971542264 and parameters: {'model_type': 'gcn', 'hidden_dims': '[512, 128]', 'dropout': 0.49042036858036886, 'batch_norm': False, 'lr': 1.318351032342512e-05, 'weight_decay': 1.3068333882268275e-06, 'epochs': 320, 'loss': 'mae', 'optimizer': 'adam', 'graph_mode': 'knn', 'knn_k': 4, 'weighted_edges': True, 'symmetrize_mode': 'union', 'self_loops': False, 'use_snp_selection': True, 'num_snps': 58989}. Best is trial 44 with value: 0.3630728468105854.
[I 2025-12-08 20:00:19,767] Trial 58 finished with value: 0.3607309667006631 and parameters: {'model_type': 'gcn', 'hidden_dims': '[512, 256]', 'dropout': 0.472488795082779, 'batch_norm': False, 'lr': 2.9793433521745436e-05, 'weight_decay': 2.3922644764765296e-06, 'epochs': 287, 'loss': 'mae', 'optimizer': 'adam', 'graph_mode': 'knn', 'knn_k': 5, 'weighted_edges': True, 'symmetrize_mode': 'union', 'self_loops': False, 'use_snp_selection': True, 'num_snps': 29588}. Best is trial 44 with value: 0.3630728468105854.
[I 2025-12-08 20:00:52,437] Trial 59 finished with value: 0.3225231601641344 and parameters: {'model_type': 'gcn', 'hidden_dims': '[256, 128, 64]', 'dropout': 0.5492941769779197, 'batch_norm': False, 'lr': 2.8359126518326906e-05, 'weight_decay': 2.1574423030941936e-06, 'epochs': 288, 'loss': 'mae', 'optimizer': 'adam', 'graph_mode': 'knn', 'knn_k': 3, 'weighted_edges': True, 'symmetrize_mode': 'mutual', 'self_loops': True, 'use_snp_selection': True, 'num_snps': 30853}. Best is trial 44 with value: 0.3630728468105854.
[I 2025-12-08 20:01:38,029] Trial 60 finished with value: 0.35789433810434645 and parameters: {'model_type': 'gcn', 'hidden_dims': '[512, 256]', 'dropout': 0.5130543259152028, 'batch_norm': False, 'lr': 3.534728190399287e-05, 'weight_decay': 3.619668038983851e-06, 'epochs': 275, 'loss': 'mae', 'optimizer': 'adam', 'graph_mode': 'knn', 'knn_k': 5, 'weighted_edges': True, 'symmetrize_mode': 'union', 'self_loops': False, 'use_snp_selection': True, 'num_snps': 29514}. Best is trial 44 with value: 0.3630728468105854.
[I 2025-12-08 20:02:24,084] Trial 61 finished with value: 0.3606575665470312 and parameters: {'model_type': 'gcn', 'hidden_dims': '[512, 256]', 'dropout': 0.47813718307857195, 'batch_norm': False, 'lr': 1.2244353784231872e-05, 'weight_decay': 2.3922400337607127e-06, 'epochs': 328, 'loss': 'mae', 'optimizer': 'adam', 'graph_mode': 'knn', 'knn_k': 4, 'weighted_edges': True, 'symmetrize_mode': 'union', 'self_loops': False, 'use_snp_selection': True, 'num_snps': 25901}. Best is trial 44 with value: 0.3630728468105854.
[I 2025-12-08 20:03:07,147] Trial 62 finished with value: 0.3450379412534351 and parameters: {'model_type': 'gcn', 'hidden_dims': '[512, 256]', 'dropout': 0.4613146011408797, 'batch_norm': False, 'lr': 2.3730179000435376e-05, 'weight_decay': 2.118115054951592e-06, 'epochs': 308, 'loss': 'mae', 'optimizer': 'adam', 'graph_mode': 'knn', 'knn_k': 3, 'weighted_edges': True, 'symmetrize_mode': 'union', 'self_loops': False, 'use_snp_selection': True, 'num_snps': 25085}. Best is trial 44 with value: 0.3630728468105854.
[I 2025-12-08 20:03:53,366] Trial 63 finished with value: 0.35724655190239946 and parameters: {'model_type': 'gcn', 'hidden_dims': '[512, 256]', 'dropout': 0.482647835539818, 'batch_norm': False, 'lr': 1.0160329027496339e-05, 'weight_decay': 9.670774312423327e-06, 'epochs': 313, 'loss': 'mae', 'optimizer': 'adam', 'graph_mode': 'knn', 'knn_k': 4, 'weighted_edges': True, 'symmetrize_mode': 'union', 'self_loops': False, 'use_snp_selection': True, 'num_snps': 27055}. Best is trial 44 with value: 0.3630728468105854.
[I 2025-12-08 20:04:51,075] Trial 64 finished with value: 0.35001155475874884 and parameters: {'model_type': 'gcn', 'hidden_dims': '[512, 256]', 'dropout': 0.4460981972808397, 'batch_norm': False, 'lr': 1.9778732726688653e-05, 'weight_decay': 5.0482836520949854e-06, 'epochs': 335, 'loss': 'mae', 'optimizer': 'adam', 'graph_mode': 'knn', 'knn_k': 4, 'weighted_edges': True, 'symmetrize_mode': 'union', 'self_loops': False, 'use_snp_selection': True, 'num_snps': 33921}. Best is trial 44 with value: 0.3630728468105854.
