[I 2025-12-08 12:17:59,189] Trial 106 finished with value: 0.364143049215368 and parameters: {'model_type': 'gcn', 'hidden_dims': '[512, 64]', 'dropout': 0.4833703491686989, 'batch_norm': False, 'lr': 0.00011900804518166797, 'weight_decay': 0.0004540548137480474, 'epochs': 198, 'loss': 'mae', 'optimizer': 'adam', 'graph_mode': 'cutoff', 'cutoff': 0.5540883934697282, 'grm_norm': 'cosine', 'self_loops': True, 'use_snp_selection': False}. Best is trial 95 with value: 0.3724566311165337.
[I 2025-12-08 12:18:42,745] Trial 107 finished with value: 0.3460599623676171 and parameters: {'model_type': 'gcn', 'hidden_dims': '[512, 256]', 'dropout': 0.4931104031042884, 'batch_norm': True, 'lr': 0.00014625440724134396, 'weight_decay': 0.00016371438913378642, 'epochs': 168, 'loss': 'mae', 'optimizer': 'adam', 'graph_mode': 'cutoff', 'cutoff': 0.7175868122447119, 'grm_norm': 'cosine', 'self_loops': True, 'use_snp_selection': False}. Best is trial 95 with value: 0.3724566311165337.
[I 2025-12-08 12:19:31,471] Trial 108 finished with value: 0.12012313408765914 and parameters: {'model_type': 'gcn', 'hidden_dims': '[512, 64]', 'dropout': 0.536522840406914, 'batch_norm': False, 'lr': 0.00020778925520261577, 'weight_decay': 0.00019073873807787792, 'epochs': 189, 'loss': 'mae', 'optimizer': 'adam', 'graph_mode': 'knn', 'knn_k': 2, 'weighted_edges': False, 'symmetrize_mode': 'union', 'self_loops': True, 'use_snp_selection': False}. Best is trial 95 with value: 0.3724566311165337.
[I 2025-12-08 12:19:55,414] Trial 109 finished with value: 0.3547203003973938 and parameters: {'model_type': 'gcn', 'hidden_dims': '[256, 128]', 'dropout': 0.5580644318051577, 'batch_norm': False, 'lr': 8.068478919136787e-05, 'weight_decay': 6.718782160769643e-05, 'epochs': 218, 'loss': 'mae', 'optimizer': 'adam', 'graph_mode': 'cutoff', 'cutoff': 0.6649956363655083, 'grm_norm': 'cosine', 'self_loops': True, 'use_snp_selection': True, 'num_snps': 25238}. Best is trial 95 with value: 0.3724566311165337.
[I 2025-12-08 12:20:34,144] Trial 110 finished with value: 0.35622229443664655 and parameters: {'model_type': 'gcn', 'hidden_dims': '[512, 128]', 'dropout': 0.5146499585455844, 'batch_norm': False, 'lr': 5.7267685715030045e-05, 'weight_decay': 0.00010149080080759988, 'epochs': 149, 'loss': 'mse', 'optimizer': 'adam', 'graph_mode': 'cutoff', 'cutoff': 0.6118664616747159, 'grm_norm': 'cosine', 'self_loops': True, 'use_snp_selection': False}. Best is trial 95 with value: 0.3724566311165337.
[I 2025-12-08 12:21:24,110] Trial 111 finished with value: 0.36369543962492534 and parameters: {'model_type': 'gcn', 'hidden_dims': '[512, 64]', 'dropout': 0.48015437413297735, 'batch_norm': False, 'lr': 0.00011123496676819428, 'weight_decay': 0.0005019633883079545, 'epochs': 196, 'loss': 'mae', 'optimizer': 'adam', 'graph_mode': 'cutoff', 'cutoff': 0.5599629095195882, 'grm_norm': 'cosine', 'self_loops': True, 'use_snp_selection': False}. Best is trial 95 with value: 0.3724566311165337.
[I 2025-12-08 12:22:15,234] Trial 112 finished with value: 0.36063594450611725 and parameters: {'model_type': 'gcn', 'hidden_dims': '[512, 64]', 'dropout': 0.4852210646772638, 'batch_norm': False, 'lr': 0.0001222139405012561, 'weight_decay': 0.00031273865851668016, 'epochs': 201, 'loss': 'mae', 'optimizer': 'adam', 'graph_mode': 'cutoff', 'cutoff': 0.5477637712757466, 'grm_norm': 'cosine', 'self_loops': True, 'use_snp_selection': False}. Best is trial 95 with value: 0.3724566311165337.
[I 2025-12-08 12:23:01,946] Trial 113 finished with value: 0.36378599690374047 and parameters: {'model_type': 'gcn', 'hidden_dims': '[512, 64]', 'dropout': 0.501841503904147, 'batch_norm': False, 'lr': 6.765618229925283e-05, 'weight_decay': 0.0004855659622588421, 'epochs': 182, 'loss': 'mae', 'optimizer': 'adam', 'graph_mode': 'cutoff', 'cutoff': 0.5212867275099916, 'grm_norm': 'cosine', 'self_loops': True, 'use_snp_selection': False}. Best is trial 95 with value: 0.3724566311165337.
[I 2025-12-08 12:23:47,480] Trial 114 finished with value: 0.2856522475521689 and parameters: {'model_type': 'gcn', 'hidden_dims': '[512, 64]', 'dropout': 0.3816982252882267, 'batch_norm': False, 'lr': 8.468877932274185e-05, 'weight_decay': 0.0004210452311024893, 'epochs': 173, 'loss': 'mae', 'optimizer': 'adam', 'graph_mode': 'cutoff', 'cutoff': 0.23990562620341938, 'grm_norm': 'cosine', 'self_loops': True, 'use_snp_selection': False}. Best is trial 95 with value: 0.3724566311165337.
[I 2025-12-08 12:24:41,220] Trial 115 finished with value: 0.35480574072226284 and parameters: {'model_type': 'gcn', 'hidden_dims': '[512, 64]', 'dropout': 0.5336389818872116, 'batch_norm': False, 'lr': 9.058736237519363e-05, 'weight_decay': 0.000742763811227118, 'epochs': 212, 'loss': 'mae', 'optimizer': 'adam', 'graph_mode': 'cutoff', 'cutoff': 0.5701522283504328, 'grm_norm': 'cosine', 'self_loops': True, 'use_snp_selection': False}. Best is trial 95 with value: 0.3724566311165337.
[I 2025-12-08 12:25:29,974] Trial 116 finished with value: 0.3605716424247745 and parameters: {'model_type': 'gcn', 'hidden_dims': '[512, 64]', 'dropout': 0.5766198088122391, 'batch_norm': False, 'lr': 3.7291479186976224e-05, 'weight_decay': 2.375582871202777e-06, 'epochs': 191, 'loss': 'mae', 'optimizer': 'adam', 'graph_mode': 'cutoff', 'cutoff': 0.6293144394165227, 'grm_norm': 'cosine', 'self_loops': True, 'use_snp_selection': False}. Best is trial 95 with value: 0.3724566311165337.
[I 2025-12-08 12:26:11,912] Trial 117 finished with value: 0.3616726834036322 and parameters: {'model_type': 'gcn', 'hidden_dims': '[512, 64]', 'dropout': 0.29706225098882305, 'batch_norm': False, 'lr': 3.2935337905227916e-05, 'weight_decay': 1.314348002819838e-06, 'epochs': 162, 'loss': 'mae', 'optimizer': 'adam', 'graph_mode': 'cutoff', 'cutoff': 0.5929016494268267, 'grm_norm': 'gcn', 'self_loops': False, 'use_snp_selection': False}. Best is trial 95 with value: 0.3724566311165337.
[I 2025-12-08 12:27:00,167] Trial 118 finished with value: 0.3629397976325861 and parameters: {'model_type': 'gcn', 'hidden_dims': '[512, 64]', 'dropout': 0.5189126992476392, 'batch_norm': False, 'lr': 0.00017709969417655506, 'weight_decay': 3.463672118930554e-05, 'epochs': 180, 'loss': 'mae', 'optimizer': 'adam', 'graph_mode': 'cutoff', 'cutoff': 0.5019229203577754, 'grm_norm': 'cosine_then_gcn', 'self_loops': True, 'use_snp_selection': True, 'num_snps': 47656}. Best is trial 95 with value: 0.3724566311165337.
[I 2025-12-08 12:27:51,336] Trial 119 finished with value: 0.3618278997173606 and parameters: {'model_type': 'gcn', 'hidden_dims': '[512, 64]', 'dropout': 0.4439827254737488, 'batch_norm': False, 'lr': 5.3418214366766026e-05, 'weight_decay': 0.0009521676044327385, 'epochs': 198, 'loss': 'mae', 'optimizer': 'adam', 'graph_mode': 'cutoff', 'cutoff': 0.5425709716113022, 'grm_norm': 'cosine', 'self_loops': True, 'use_snp_selection': False}. Best is trial 95 with value: 0.3724566311165337.
[I 2025-12-08 12:28:44,034] Trial 120 finished with value: 0.36484461154292375 and parameters: {'model_type': 'gcn', 'hidden_dims': '[512, 64]', 'dropout': 0.5486985496946756, 'batch_norm': False, 'lr': 0.00014603417860091207, 'weight_decay': 0.0002717092649603065, 'epochs': 207, 'loss': 'mae', 'optimizer': 'adam', 'graph_mode': 'cutoff', 'cutoff': 0.5776626540081841, 'grm_norm': 'cosine_then_gcn', 'self_loops': True, 'use_snp_selection': False}. Best is trial 95 with value: 0.3724566311165337.
[I 2025-12-08 12:29:38,781] Trial 121 finished with value: 0.34953350398062255 and parameters: {'model_type': 'gcn', 'hidden_dims': '[512, 64]', 'dropout': 0.1981955914114659, 'batch_norm': False, 'lr': 0.00015756714342107702, 'weight_decay': 0.00018759788422156772, 'epochs': 216, 'loss': 'mae', 'optimizer': 'adam', 'graph_mode': 'cutoff', 'cutoff': 0.6423184655357251, 'grm_norm': 'cosine_then_gcn', 'self_loops': True, 'use_snp_selection': False}. Best is trial 95 with value: 0.3724566311165337.
[I 2025-12-08 12:30:31,100] Trial 122 finished with value: 0.3657637048495232 and parameters: {'model_type': 'gcn', 'hidden_dims': '[512, 64]', 'dropout': 0.5482717991859712, 'batch_norm': False, 'lr': 0.00011338460163860006, 'weight_decay': 0.000262165610083435, 'epochs': 206, 'loss': 'mae', 'optimizer': 'adam', 'graph_mode': 'cutoff', 'cutoff': 0.5776162711484996, 'grm_norm': 'cosine_then_gcn', 'self_loops': True, 'use_snp_selection': False}. Best is trial 95 with value: 0.3724566311165337.
[I 2025-12-08 12:31:23,230] Trial 123 finished with value: 0.36118144558031545 and parameters: {'model_type': 'gcn', 'hidden_dims': '[512, 64]', 'dropout': 0.5623406557352244, 'batch_norm': False, 'lr': 0.00025403836333539605, 'weight_decay': 0.00037069984012207477, 'epochs': 205, 'loss': 'mae', 'optimizer': 'adam', 'graph_mode': 'cutoff', 'cutoff': 0.5756649477854101, 'grm_norm': 'cosine_then_gcn', 'self_loops': True, 'use_snp_selection': False}. Best is trial 95 with value: 0.3724566311165337.
[I 2025-12-08 12:32:19,870] Trial 124 finished with value: 0.3660213501811782 and parameters: {'model_type': 'gcn', 'hidden_dims': '[512, 64]', 'dropout': 0.5459591035827225, 'batch_norm': False, 'lr': 7.379474970743039e-05, 'weight_decay': 0.0002601100388666146, 'epochs': 224, 'loss': 'mae', 'optimizer': 'adam', 'graph_mode': 'cutoff', 'cutoff': 0.602853380326652, 'grm_norm': 'cosine_then_gcn', 'self_loops': True, 'use_snp_selection': False}. Best is trial 95 with value: 0.3724566311165337.
[I 2025-12-08 12:33:17,422] Trial 125 finished with value: 0.36445839713810174 and parameters: {'model_type': 'gcn', 'hidden_dims': '[512, 64]', 'dropout': 0.5416991659641357, 'batch_norm': False, 'lr': 6.330365918061057e-05, 'weight_decay': 9.666351188270522e-05, 'epochs': 228, 'loss': 'mae', 'optimizer': 'adam', 'graph_mode': 'cutoff', 'cutoff': 0.6030007968202633, 'grm_norm': 'cosine_then_gcn', 'self_loops': True, 'use_snp_selection': False}. Best is trial 95 with value: 0.3724566311165337.
[I 2025-12-08 12:34:13,577] Trial 126 finished with value: 0.3227569414558282 and parameters: {'model_type': 'gcn', 'hidden_dims': '[512, 64]', 'dropout': 0.5285567919318571, 'batch_norm': True, 'lr': 9.960478703007866e-05, 'weight_decay': 0.00022122086503392337, 'epochs': 221, 'loss': 'mae', 'optimizer': 'adam', 'graph_mode': 'cutoff', 'cutoff': 0.6214257330737984, 'grm_norm': 'cosine_then_gcn', 'self_loops': True, 'use_snp_selection': False}. Best is trial 95 with value: 0.3724566311165337.
[I 2025-12-08 12:34:38,916] Trial 127 finished with value: 0.3239585027439131 and parameters: {'model_type': 'gcn', 'hidden_dims': '[256, 128, 64]', 'dropout': 0.5710981098749855, 'batch_norm': False, 'lr': 4.4236223944736915e-05, 'weight_decay': 4.277486138780263e-05, 'epochs': 184, 'loss': 'mae', 'optimizer': 'adam', 'graph_mode': 'cutoff', 'cutoff': 0.6556504245061702, 'grm_norm': 'cosine_then_gcn', 'self_loops': True, 'use_snp_selection': True, 'num_snps': 30710}. Best is trial 95 with value: 0.3724566311165337.
[I 2025-12-08 12:35:22,994] Trial 128 finished with value: 0.36755085943146615 and parameters: {'model_type': 'gcn', 'hidden_dims': '[512, 64]', 'dropout': 0.5520758882187552, 'batch_norm': False, 'lr': 7.825984933083052e-05, 'weight_decay': 0.0002469387129687706, 'epochs': 171, 'loss': 'mae', 'optimizer': 'adam', 'graph_mode': 'cutoff', 'cutoff': 0.5330417883108827, 'grm_norm': 'cosine_then_gcn', 'self_loops': True, 'use_snp_selection': False}. Best is trial 95 with value: 0.3724566311165337.
[I 2025-12-08 12:36:09,065] Trial 129 finished with value: 0.321345993902029 and parameters: {'model_type': 'gcn', 'hidden_dims': '[512, 256]', 'dropout': 0.5542803388771629, 'batch_norm': False, 'lr': 7.659081275555375e-05, 'weight_decay': 0.0003377834588746253, 'epochs': 176, 'loss': 'mae', 'optimizer': 'adam', 'graph_mode': 'knn', 'knn_k': 7, 'weighted_edges': False, 'symmetrize_mode': 'mutual', 'self_loops': True, 'use_snp_selection': False}. Best is trial 95 with value: 0.3724566311165337.
[I 2025-12-08 12:36:52,418] Trial 130 finished with value: 0.3681403889152907 and parameters: {'model_type': 'gcn', 'hidden_dims': '[512, 64]', 'dropout': 0.5806385641286859, 'batch_norm': False, 'lr': 6.94873701585506e-05, 'weight_decay': 0.00023427234227005038, 'epochs': 168, 'loss': 'mae', 'optimizer': 'adam', 'graph_mode': 'cutoff', 'cutoff': 0.5328646969045391, 'grm_norm': 'cosine_then_gcn', 'self_loops': True, 'use_snp_selection': False}. Best is trial 95 with value: 0.3724566311165337.
[I 2025-12-08 12:37:35,873] Trial 131 finished with value: 0.3685663529234179 and parameters: {'model_type': 'gcn', 'hidden_dims': '[512, 64]', 'dropout': 0.5992168814396838, 'batch_norm': False, 'lr': 5.707988103183579e-05, 'weight_decay': 0.0002594318048035946, 'epochs': 169, 'loss': 'mae', 'optimizer': 'adam', 'graph_mode': 'cutoff', 'cutoff': 0.591902186340111, 'grm_norm': 'cosine_then_gcn', 'self_loops': True, 'use_snp_selection': False}. Best is trial 95 with value: 0.3724566311165337.
[I 2025-12-08 12:38:19,485] Trial 132 finished with value: 0.3657233647921571 and parameters: {'model_type': 'gcn', 'hidden_dims': '[512, 64]', 'dropout': 0.5832472407087205, 'batch_norm': False, 'lr': 5.72251621417648e-05, 'weight_decay': 0.0002464557136320696, 'epochs': 169, 'loss': 'mae', 'optimizer': 'adam', 'graph_mode': 'cutoff', 'cutoff': 0.5127388811146826, 'grm_norm': 'cosine_then_gcn', 'self_loops': True, 'use_snp_selection': False}. Best is trial 95 with value: 0.3724566311165337.
[I 2025-12-08 12:39:02,551] Trial 133 finished with value: 0.3512349553364328 and parameters: {'model_type': 'gcn', 'hidden_dims': '[512, 64]', 'dropout': 0.5931936668340275, 'batch_norm': False, 'lr': 4.9976157895312165e-05, 'weight_decay': 0.00012047360138672469, 'epochs': 166, 'loss': 'mae', 'optimizer': 'adam', 'graph_mode': 'cutoff', 'cutoff': 0.4788617355288117, 'grm_norm': 'cosine_then_gcn', 'self_loops': True, 'use_snp_selection': False}. Best is trial 95 with value: 0.3724566311165337.
[I 2025-12-08 12:39:43,257] Trial 134 finished with value: 0.36597628384399417 and parameters: {'model_type': 'gcn', 'hidden_dims': '[512, 64]', 'dropout': 0.5977796158055559, 'batch_norm': False, 'lr': 7.320372247305955e-05, 'weight_decay': 0.0001491487039448246, 'epochs': 157, 'loss': 'mae', 'optimizer': 'adam', 'graph_mode': 'cutoff', 'cutoff': 0.5354535927697766, 'grm_norm': 'cosine_then_gcn', 'self_loops': True, 'use_snp_selection': False}. Best is trial 95 with value: 0.3724566311165337.
[I 2025-12-08 12:39:55,834] Trial 135 finished with value: 0.24763307812635088 and parameters: {'model_type': 'gcn', 'hidden_dims': '[128, 64]', 'dropout': 0.5774168735668677, 'batch_norm': False, 'lr': 7.341763611985363e-05, 'weight_decay': 0.00016351316889381474, 'epochs': 158, 'loss': 'mae', 'optimizer': 'adam', 'graph_mode': 'cutoff', 'cutoff': 0.5354282753407269, 'grm_norm': 'cosine_then_gcn', 'self_loops': True, 'use_snp_selection': False}. Best is trial 95 with value: 0.3724566311165337.
[I 2025-12-08 12:40:26,906] Trial 136 finished with value: 0.37085977278138565 and parameters: {'model_type': 'gcn', 'hidden_dims': '[512, 64]', 'dropout': 0.5973861714969867, 'batch_norm': False, 'lr': 6.574021895300033e-05, 'weight_decay': 0.00014264165104322643, 'epochs': 145, 'loss': 'mae', 'optimizer': 'adam', 'graph_mode': 'cutoff', 'cutoff': 0.5275109540310414, 'grm_norm': 'cosine_then_gcn', 'self_loops': True, 'use_snp_selection': True, 'num_snps': 32190}. Best is trial 95 with value: 0.3724566311165337.
[I 2025-12-08 12:40:56,009] Trial 137 finished with value: 0.36093783008179015 and parameters: {'model_type': 'gcn', 'hidden_dims': '[512, 64]', 'dropout': 0.5839808417754413, 'batch_norm': False, 'lr': 6.22844092401701e-05, 'weight_decay': 0.00017879396401205446, 'epochs': 173, 'loss': 'mse', 'optimizer': 'adam', 'graph_mode': 'cutoff', 'cutoff': 0.5906572134635161, 'grm_norm': 'cosine_then_gcn', 'self_loops': False, 'use_snp_selection': True, 'num_snps': 25525}. Best is trial 95 with value: 0.3724566311165337.
[I 2025-12-08 12:41:20,749] Trial 138 finished with value: 0.35824752389169856 and parameters: {'model_type': 'gcn', 'hidden_dims': '[256, 128]', 'dropout': 0.5668869846948147, 'batch_norm': False, 'lr': 4.1540272796867485e-05, 'weight_decay': 0.000130467336872953, 'epochs': 127, 'loss': 'mae', 'optimizer': 'adam', 'graph_mode': 'cutoff', 'cutoff': 0.5230499634367552, 'grm_norm': 'cosine_then_gcn', 'self_loops': True, 'use_snp_selection': True, 'num_snps': 40075}. Best is trial 95 with value: 0.3724566311165337.
[I 2025-12-08 12:41:51,249] Trial 139 finished with value: 0.3667947490799427 and parameters: {'model_type': 'gcn', 'hidden_dims': '[512, 64]', 'dropout': 0.5866003213738565, 'batch_norm': False, 'lr': 4.773664493546713e-05, 'weight_decay': 6.34440969119223e-05, 'epochs': 141, 'loss': 'mae', 'optimizer': 'adam', 'graph_mode': 'cutoff', 'cutoff': 0.5573379671394082, 'grm_norm': 'cosine_then_gcn', 'self_loops': True, 'use_snp_selection': True, 'num_snps': 31965}. Best is trial 95 with value: 0.3724566311165337.
[I 2025-12-08 12:42:21,707] Trial 140 finished with value: 0.36323459693092475 and parameters: {'model_type': 'gcn', 'hidden_dims': '[512, 128]', 'dropout': 0.5896681529370464, 'batch_norm': False, 'lr': 4.71557500368288e-05, 'weight_decay': 6.896253428875124e-05, 'epochs': 139, 'loss': 'mae', 'optimizer': 'adam', 'graph_mode': 'cutoff', 'cutoff': 0.5537536689816634, 'grm_norm': 'cosine_then_gcn', 'self_loops': True, 'use_snp_selection': True, 'num_snps': 32475}. Best is trial 95 with value: 0.3724566311165337.
[I 2025-12-08 12:42:50,189] Trial 141 finished with value: 0.36361860831253645 and parameters: {'model_type': 'gcn', 'hidden_dims': '[512, 64]', 'dropout': 0.5991455719823994, 'batch_norm': False, 'lr': 5.334430199885796e-05, 'weight_decay': 6.057468169095709e-05, 'epochs': 153, 'loss': 'mae', 'optimizer': 'adam', 'graph_mode': 'cutoff', 'cutoff': 0.5638757826666627, 'grm_norm': 'cosine_then_gcn', 'self_loops': True, 'use_snp_selection': True, 'num_snps': 27486}. Best is trial 95 with value: 0.3724566311165337.
[I 2025-12-08 12:43:21,384] Trial 142 finished with value: 0.36430476869531314 and parameters: {'model_type': 'gcn', 'hidden_dims': '[512, 64]', 'dropout': 0.5750462549465415, 'batch_norm': False, 'lr': 9.226505874230738e-05, 'weight_decay': 9.716869604098971e-05, 'epochs': 147, 'loss': 'mae', 'optimizer': 'adam', 'graph_mode': 'cutoff', 'cutoff': 0.6020862457726951, 'grm_norm': 'cosine_then_gcn', 'self_loops': True, 'use_snp_selection': True, 'num_snps': 32080}. Best is trial 95 with value: 0.3724566311165337.
[I 2025-12-08 12:43:43,738] Trial 143 finished with value: 0.3615452503603579 and parameters: {'model_type': 'gcn', 'hidden_dims': '[512, 64]', 'dropout': 0.5641223160338448, 'batch_norm': False, 'lr': 6.61016698725687e-05, 'weight_decay': 0.00022963663007933793, 'epochs': 126, 'loss': 'mae', 'optimizer': 'adam', 'graph_mode': 'cutoff', 'cutoff': 0.5071759895144231, 'grm_norm': 'cosine_then_gcn', 'self_loops': True, 'use_snp_selection': True, 'num_snps': 21596}. Best is trial 95 with value: 0.3724566311165337.
[I 2025-12-08 12:44:11,084] Trial 144 finished with value: 0.3647290906650098 and parameters: {'model_type': 'gcn', 'hidden_dims': '[512, 64]', 'dropout': 0.5825190871102249, 'batch_norm': False, 'lr': 3.1340448138276455e-05, 'weight_decay': 1.4287082933214472e-05, 'epochs': 132, 'loss': 'mae', 'optimizer': 'adam', 'graph_mode': 'cutoff', 'cutoff': 0.533666482477749, 'grm_norm': 'cosine_then_gcn', 'self_loops': True, 'use_snp_selection': True, 'num_snps': 29030}. Best is trial 95 with value: 0.3724566311165337.
[I 2025-12-08 12:44:30,006] Trial 145 finished with value: 0.3485564919637459 and parameters: {'model_type': 'gcn', 'hidden_dims': '[512, 64]', 'dropout': 0.5554100078572002, 'batch_norm': False, 'lr': 3.6275351146921294e-05, 'weight_decay': 8.827098895097453e-05, 'epochs': 111, 'loss': 'mae', 'optimizer': 'adam', 'graph_mode': 'cutoff', 'cutoff': 0.6158647364757011, 'grm_norm': 'cosine_then_gcn', 'self_loops': True, 'use_snp_selection': True, 'num_snps': 17920}. Best is trial 95 with value: 0.3724566311165337.
[I 2025-12-08 12:45:12,115] Trial 146 finished with value: 0.0 and parameters: {'model_type': 'gcn', 'hidden_dims': '[512, 64]', 'dropout': 0.5399537103341149, 'batch_norm': False, 'lr': 0.002330583708105966, 'weight_decay': 0.00010948383742244216, 'epochs': 162, 'loss': 'mae', 'optimizer': 'adam', 'graph_mode': 'cutoff', 'cutoff': 0.5910472211788527, 'grm_norm': 'cosine_then_gcn', 'self_loops': True, 'use_snp_selection': True, 'num_snps': 44543}. Best is trial 95 with value: 0.3724566311165337.
[I 2025-12-08 12:45:48,171] Trial 147 finished with value: 0.34977944334299255 and parameters: {'model_type': 'gcn', 'hidden_dims': '[512, 64]', 'dropout': 0.5688830687169567, 'batch_norm': False, 'lr': 5.928808991614928e-05, 'weight_decay': 0.00014240292418601726, 'epochs': 144, 'loss': 'mae', 'optimizer': 'adam', 'graph_mode': 'cutoff', 'cutoff': 0.4801116236502346, 'grm_norm': 'cosine_then_gcn', 'self_loops': True, 'use_snp_selection': True, 'num_snps': 39652}. Best is trial 95 with value: 0.3724566311165337.
[I 2025-12-08 12:46:17,557] Trial 148 finished with value: 0.3712930171162225 and parameters: {'model_type': 'gcn', 'hidden_dims': '[512, 64]', 'dropout': 0.5578491841622222, 'batch_norm': False, 'lr': 8.145192410827779e-05, 'weight_decay': 2.9076390198651585e-05, 'epochs': 190, 'loss': 'mae', 'optimizer': 'adam', 'graph_mode': 'cutoff', 'cutoff': 0.5515578250887869, 'grm_norm': 'cosine_then_gcn', 'self_loops': True, 'use_snp_selection': True, 'num_snps': 23752}. Best is trial 95 with value: 0.3724566311165337.
