[I 2025-12-08 21:30:46,701] Trial 120 finished with value: 0.3054691982646986 and parameters: {'model_type': 'gcn', 'hidden_dims': '[256, 128, 64]', 'dropout': 0.5990523587414579, 'batch_norm': True, 'lr': 0.0017700411083155742, 'weight_decay': 1.1734342152534288e-07, 'epochs': 264, 'loss': 'mae', 'optimizer': 'adam', 'graph_mode': 'cutoff', 'cutoff': 0.7012984396794321, 'grm_norm': 'gcn', 'self_loops': False, 'use_snp_selection': False}. Best is trial 82 with value: 0.3209301661797187.
[I 2025-12-08 21:31:39,360] Trial 121 finished with value: 0.31511820058308115 and parameters: {'model_type': 'gcn', 'hidden_dims': '[512, 256]', 'dropout': 0.42005815323864815, 'batch_norm': True, 'lr': 0.00029956980706162176, 'weight_decay': 2.1562867645695575e-06, 'epochs': 194, 'loss': 'mae', 'optimizer': 'adam', 'graph_mode': 'cutoff', 'cutoff': 0.8980987916189204, 'grm_norm': 'gcn', 'self_loops': False, 'use_snp_selection': False}. Best is trial 82 with value: 0.3209301661797187.
[I 2025-12-08 21:32:35,459] Trial 122 finished with value: 0.31403262178300617 and parameters: {'model_type': 'gcn', 'hidden_dims': '[512, 256]', 'dropout': 0.4559857044755638, 'batch_norm': True, 'lr': 0.0003407541771232356, 'weight_decay': 1.0788718971965938e-06, 'epochs': 208, 'loss': 'mae', 'optimizer': 'adam', 'graph_mode': 'cutoff', 'cutoff': 0.8986121381203777, 'grm_norm': 'gcn', 'self_loops': False, 'use_snp_selection': False}. Best is trial 82 with value: 0.3209301661797187.
[I 2025-12-08 21:33:34,404] Trial 123 finished with value: 0.2401324362516938 and parameters: {'model_type': 'gcn', 'hidden_dims': '[512, 256]', 'dropout': 0.4381492017852361, 'batch_norm': True, 'lr': 0.0001507008826687425, 'weight_decay': 1.7210202468252562e-06, 'epochs': 218, 'loss': 'mae', 'optimizer': 'adam', 'graph_mode': 'cutoff', 'cutoff': 0.4657519288404509, 'grm_norm': 'gcn', 'self_loops': False, 'use_snp_selection': False}. Best is trial 82 with value: 0.3209301661797187.
[I 2025-12-08 21:34:29,215] Trial 124 finished with value: 0.3106454844511576 and parameters: {'model_type': 'gcn', 'hidden_dims': '[512, 256]', 'dropout': 0.5728005539816269, 'batch_norm': True, 'lr': 0.0027335497074834117, 'weight_decay': 1.7583430341725226e-06, 'epochs': 200, 'loss': 'mae', 'optimizer': 'adam', 'graph_mode': 'cutoff', 'cutoff': 0.8686572742476693, 'grm_norm': 'gcn', 'self_loops': False, 'use_snp_selection': False}. Best is trial 82 with value: 0.3209301661797187.
[I 2025-12-08 21:35:18,528] Trial 125 finished with value: 0.3129172211254077 and parameters: {'model_type': 'gcn', 'hidden_dims': '[512, 256]', 'dropout': 0.3783156840170782, 'batch_norm': True, 'lr': 0.00017703262911620413, 'weight_decay': 2.3440786001190816e-07, 'epochs': 179, 'loss': 'mae', 'optimizer': 'adam', 'graph_mode': 'cutoff', 'cutoff': 0.8215985877206852, 'grm_norm': 'none', 'self_loops': False, 'use_snp_selection': False}. Best is trial 82 with value: 0.3209301661797187.
[I 2025-12-08 21:35:51,962] Trial 126 finished with value: 0.3155780291232461 and parameters: {'model_type': 'gcn', 'hidden_dims': '[512, 256]', 'dropout': 0.4059734015247151, 'batch_norm': True, 'lr': 0.0015906610089302462, 'weight_decay': 7.02448045023476e-07, 'epochs': 109, 'loss': 'mae', 'optimizer': 'adam', 'graph_mode': 'cutoff', 'cutoff': 0.8467217000886053, 'grm_norm': 'gcn', 'self_loops': True, 'use_snp_selection': False}. Best is trial 82 with value: 0.3209301661797187.
[I 2025-12-08 21:36:11,617] Trial 127 finished with value: 0.30789027461187235 and parameters: {'model_type': 'gcn', 'hidden_dims': '[128, 64]', 'dropout': 0.5349106821556718, 'batch_norm': True, 'lr': 0.00020303216816908816, 'weight_decay': 2.8070032734737306e-06, 'epochs': 210, 'loss': 'mae', 'optimizer': 'adam', 'graph_mode': 'cutoff', 'cutoff': 0.801649230134543, 'grm_norm': 'gcn', 'self_loops': False, 'use_snp_selection': False}. Best is trial 82 with value: 0.3209301661797187.
[I 2025-12-08 21:36:31,223] Trial 128 finished with value: 0.25578186152164106 and parameters: {'model_type': 'gcn', 'hidden_dims': '[512, 256]', 'dropout': 0.5628547209766573, 'batch_norm': True, 'lr': 7.394378478118162e-05, 'weight_decay': 3.843455127955427e-06, 'epochs': 62, 'loss': 'mae', 'optimizer': 'adam', 'graph_mode': 'knn', 'knn_k': 2, 'weighted_edges': False, 'symmetrize_mode': 'union', 'self_loops': False, 'use_snp_selection': True, 'num_snps': 23852}. Best is trial 82 with value: 0.3209301661797187.
[I 2025-12-08 21:37:09,603] Trial 129 finished with value: 0.30915369125021874 and parameters: {'model_type': 'gcn', 'hidden_dims': '[512, 256]', 'dropout': 0.5871186076127702, 'batch_norm': True, 'lr': 8.916805960004735e-05, 'weight_decay': 1.3851052500219086e-06, 'epochs': 132, 'loss': 'mse', 'optimizer': 'adam', 'graph_mode': 'cutoff', 'cutoff': 0.879373521077882, 'grm_norm': 'cosine', 'self_loops': False, 'use_snp_selection': False}. Best is trial 82 with value: 0.3209301661797187.
[I 2025-12-08 21:38:23,231] Trial 130 finished with value: 0.29199321942082335 and parameters: {'model_type': 'gcn', 'hidden_dims': '[512, 256]', 'dropout': 0.5548237289080925, 'batch_norm': True, 'lr': 0.0012266038883595588, 'weight_decay': 1.6169951599404567e-07, 'epochs': 279, 'loss': 'mae', 'optimizer': 'adam', 'graph_mode': 'cutoff', 'cutoff': 0.6240888362519135, 'grm_norm': 'gcn', 'self_loops': False, 'use_snp_selection': False}. Best is trial 82 with value: 0.3209301661797187.
[I 2025-12-08 21:38:43,896] Trial 131 finished with value: 0.31725499664989837 and parameters: {'model_type': 'gcn', 'hidden_dims': '[512, 256]', 'dropout': 0.48052775724587504, 'batch_norm': True, 'lr': 0.0008210142087374355, 'weight_decay': 5.302187514973653e-06, 'epochs': 65, 'loss': 'mae', 'optimizer': 'adam', 'graph_mode': 'cutoff', 'cutoff': 0.7653220374370141, 'grm_norm': 'gcn', 'self_loops': False, 'use_snp_selection': False}. Best is trial 82 with value: 0.3209301661797187.
[I 2025-12-08 21:39:42,396] Trial 132 finished with value: 0.3144230808266263 and parameters: {'model_type': 'gcn', 'hidden_dims': '[512, 256]', 'dropout': 0.47803060121055363, 'batch_norm': True, 'lr': 0.000763248743870149, 'weight_decay': 1.2849508436541477e-05, 'epochs': 222, 'loss': 'mae', 'optimizer': 'adam', 'graph_mode': 'cutoff', 'cutoff': 0.7922451827728655, 'grm_norm': 'gcn', 'self_loops': False, 'use_snp_selection': False}. Best is trial 82 with value: 0.3209301661797187.
[I 2025-12-08 21:40:07,956] Trial 133 finished with value: 0.31707401685997577 and parameters: {'model_type': 'gcn', 'hidden_dims': '[512, 256]', 'dropout': 0.5126724455013854, 'batch_norm': True, 'lr': 0.0010347941479639116, 'weight_decay': 7.121712622634564e-06, 'epochs': 84, 'loss': 'mae', 'optimizer': 'adam', 'graph_mode': 'cutoff', 'cutoff': 0.7639187986723932, 'grm_norm': 'gcn', 'self_loops': False, 'use_snp_selection': False}. Best is trial 82 with value: 0.3209301661797187.
[I 2025-12-08 21:40:36,085] Trial 134 finished with value: 0.3141539277768393 and parameters: {'model_type': 'gcn', 'hidden_dims': '[512, 256]', 'dropout': 0.5087001979199318, 'batch_norm': True, 'lr': 0.0009515399551041881, 'weight_decay': 7.043823228093758e-06, 'epochs': 96, 'loss': 'mae', 'optimizer': 'adam', 'graph_mode': 'cutoff', 'cutoff': 0.7679961325380649, 'grm_norm': 'gcn', 'self_loops': False, 'use_snp_selection': False}. Best is trial 82 with value: 0.3209301661797187.
[I 2025-12-08 21:41:00,696] Trial 135 finished with value: 0.3158575549156453 and parameters: {'model_type': 'gcn', 'hidden_dims': '[512, 128]', 'dropout': 0.5180962120456236, 'batch_norm': True, 'lr': 0.0011504696346002201, 'weight_decay': 5.368324688339337e-06, 'epochs': 84, 'loss': 'mae', 'optimizer': 'adam', 'graph_mode': 'cutoff', 'cutoff': 0.7292628939775452, 'grm_norm': 'gcn', 'self_loops': False, 'use_snp_selection': False}. Best is trial 82 with value: 0.3209301661797187.
[I 2025-12-08 21:41:22,593] Trial 136 finished with value: 0.006807942507225601 and parameters: {'model_type': 'gcn', 'hidden_dims': '[512, 256]', 'dropout': 0.46970580512515625, 'batch_norm': False, 'lr': 0.0010113578635343422, 'weight_decay': 9.437265252281106e-06, 'epochs': 75, 'loss': 'mae', 'optimizer': 'adam', 'graph_mode': 'cutoff', 'cutoff': 0.7585088598941226, 'grm_norm': 'none', 'self_loops': False, 'use_snp_selection': False}. Best is trial 82 with value: 0.3209301661797187.
[I 2025-12-08 21:41:42,425] Trial 137 finished with value: 0.3148320388962542 and parameters: {'model_type': 'gcn', 'hidden_dims': '[512, 256]', 'dropout': 0.48771906902370227, 'batch_norm': True, 'lr': 0.0014098074956415641, 'weight_decay': 4.4083404533225255e-06, 'epochs': 66, 'loss': 'mae', 'optimizer': 'adam', 'graph_mode': 'cutoff', 'cutoff': 0.7751323326702276, 'grm_norm': 'gcn', 'self_loops': False, 'use_snp_selection': False}. Best is trial 82 with value: 0.3209301661797187.
[I 2025-12-08 21:41:58,944] Trial 138 finished with value: 0.3152052718216218 and parameters: {'model_type': 'gcn', 'hidden_dims': '[512, 256]', 'dropout': 0.5360280971718427, 'batch_norm': True, 'lr': 0.0006423401583604667, 'weight_decay': 1.1245940172098458e-05, 'epochs': 51, 'loss': 'mae', 'optimizer': 'adam', 'graph_mode': 'cutoff', 'cutoff': 0.829495880003096, 'grm_norm': 'cosine_then_gcn', 'self_loops': False, 'use_snp_selection': False}. Best is trial 82 with value: 0.3209301661797187.
[I 2025-12-08 21:42:06,598] Trial 139 finished with value: 0.31428938224591396 and parameters: {'model_type': 'gcn', 'hidden_dims': '[128, 64]', 'dropout': 0.5701892480974501, 'batch_norm': True, 'lr': 0.0008607543064159324, 'weight_decay': 4.832963876816859e-07, 'epochs': 72, 'loss': 'mae', 'optimizer': 'adam', 'graph_mode': 'cutoff', 'cutoff': 0.8111144592895821, 'grm_norm': 'gcn', 'self_loops': False, 'use_snp_selection': False}. Best is trial 82 with value: 0.3209301661797187.
[I 2025-12-08 21:42:19,948] Trial 140 finished with value: 0.3191238388642483 and parameters: {'model_type': 'gcn', 'hidden_dims': '[256, 128]', 'dropout': 0.5031882014156874, 'batch_norm': True, 'lr': 0.00190538720795826, 'weight_decay': 1.5818115498200403e-05, 'epochs': 87, 'loss': 'mae', 'optimizer': 'adam', 'graph_mode': 'cutoff', 'cutoff': 0.7404391690826196, 'grm_norm': 'gcn', 'self_loops': False, 'use_snp_selection': False}. Best is trial 82 with value: 0.3209301661797187.
[I 2025-12-08 21:42:33,802] Trial 141 finished with value: 0.31576982460442815 and parameters: {'model_type': 'gcn', 'hidden_dims': '[256, 128]', 'dropout': 0.5067759457641811, 'batch_norm': True, 'lr': 0.0023143214492457, 'weight_decay': 1.578746866564481e-05, 'epochs': 91, 'loss': 'mae', 'optimizer': 'adam', 'graph_mode': 'cutoff', 'cutoff': 0.7436676540675199, 'grm_norm': 'gcn', 'self_loops': False, 'use_snp_selection': False}. Best is trial 82 with value: 0.3209301661797187.
[I 2025-12-08 21:42:46,608] Trial 142 finished with value: 0.31293372038960493 and parameters: {'model_type': 'gcn', 'hidden_dims': '[256, 128]', 'dropout': 0.5000273981591228, 'batch_norm': True, 'lr': 0.002057198055038522, 'weight_decay': 7.893752976225812e-06, 'epochs': 82, 'loss': 'mae', 'optimizer': 'adam', 'graph_mode': 'cutoff', 'cutoff': 0.7235004422486307, 'grm_norm': 'gcn', 'self_loops': False, 'use_snp_selection': False}. Best is trial 82 with value: 0.3209301661797187.
[I 2025-12-08 21:42:56,504] Trial 143 finished with value: 0.31270448562774744 and parameters: {'model_type': 'gcn', 'hidden_dims': '[256, 128]', 'dropout': 0.46155591151916403, 'batch_norm': True, 'lr': 0.0016668911282850755, 'weight_decay': 1.992177087289558e-05, 'epochs': 58, 'loss': 'mae', 'optimizer': 'adam', 'graph_mode': 'cutoff', 'cutoff': 0.7528847065243347, 'grm_norm': 'gcn', 'self_loops': False, 'use_snp_selection': False}. Best is trial 82 with value: 0.3209301661797187.
[I 2025-12-08 21:43:11,227] Trial 144 finished with value: 0.3182841950315626 and parameters: {'model_type': 'gcn', 'hidden_dims': '[256, 128]', 'dropout': 0.5426575287026849, 'batch_norm': True, 'lr': 0.0013010943449581712, 'weight_decay': 2.4813385994359134e-05, 'epochs': 102, 'loss': 'mae', 'optimizer': 'adam', 'graph_mode': 'cutoff', 'cutoff': 0.7103186185710463, 'grm_norm': 'gcn', 'self_loops': False, 'use_snp_selection': False}. Best is trial 82 with value: 0.3209301661797187.
[I 2025-12-08 21:43:27,804] Trial 145 finished with value: 0.3117415892908801 and parameters: {'model_type': 'gcn', 'hidden_dims': '[256, 128]', 'dropout': 0.5276387559974902, 'batch_norm': True, 'lr': 0.0011735976449906693, 'weight_decay': 2.2396321654142076e-05, 'epochs': 116, 'loss': 'mae', 'optimizer': 'adam', 'graph_mode': 'cutoff', 'cutoff': 0.6796873593595488, 'grm_norm': 'gcn', 'self_loops': False, 'use_snp_selection': False}. Best is trial 82 with value: 0.3209301661797187.
[I 2025-12-08 21:43:41,442] Trial 146 finished with value: 0.3148354486935623 and parameters: {'model_type': 'gcn', 'hidden_dims': '[256, 128]', 'dropout': 0.5437539702454729, 'batch_norm': True, 'lr': 0.0017900427087028253, 'weight_decay': 1.4215033070609622e-05, 'epochs': 89, 'loss': 'mae', 'optimizer': 'adam', 'graph_mode': 'cutoff', 'cutoff': 0.6948747221956469, 'grm_norm': 'none', 'self_loops': False, 'use_snp_selection': False}. Best is trial 82 with value: 0.3209301661797187.
[I 2025-12-08 21:43:56,398] Trial 147 finished with value: 0.3124300775383054 and parameters: {'model_type': 'gcn', 'hidden_dims': '[256, 128]', 'dropout': 0.5218102479284203, 'batch_norm': True, 'lr': 0.0014132651309756673, 'weight_decay': 3.0099918665668332e-05, 'epochs': 102, 'loss': 'mae', 'optimizer': 'adam', 'graph_mode': 'cutoff', 'cutoff': 0.7160687298444806, 'grm_norm': 'gcn', 'self_loops': False, 'use_snp_selection': False}. Best is trial 82 with value: 0.3209301661797187.
[I 2025-12-08 21:44:11,095] Trial 148 finished with value: 0.31622776000871344 and parameters: {'model_type': 'gcn', 'hidden_dims': '[256, 128]', 'dropout': 0.493632255468001, 'batch_norm': True, 'lr': 0.0031630704692178074, 'weight_decay': 1.1029405651161615e-05, 'epochs': 96, 'loss': 'mae', 'optimizer': 'adam', 'graph_mode': 'cutoff', 'cutoff': 0.7909970120015873, 'grm_norm': 'gcn', 'self_loops': True, 'use_snp_selection': False}. Best is trial 82 with value: 0.3209301661797187.
[I 2025-12-08 21:44:25,398] Trial 149 finished with value: 0.3076505604842329 and parameters: {'model_type': 'gcn', 'hidden_dims': '[256, 128]', 'dropout': 0.4915321025694023, 'batch_norm': True, 'lr': 0.003625442550149958, 'weight_decay': 1.1717007332213934e-05, 'epochs': 97, 'loss': 'mae', 'optimizer': 'adam', 'graph_mode': 'cutoff', 'cutoff': 0.6538090500781418, 'grm_norm': 'gcn', 'self_loops': True, 'use_snp_selection': False}. Best is trial 82 with value: 0.3209301661797187.
[I 2025-12-08 21:45:02,815] Trial 0 finished with value: 0.25437109530860413 and parameters: {'model_type': 'gcn', 'hidden_dims': '[128, 64]', 'dropout': 0.199031432379812, 'batch_norm': True, 'lr': 1.8408544111075823e-05, 'weight_decay': 5.5136510071208614e-05, 'epochs': 336, 'loss': 'mae', 'optimizer': 'adam', 'graph_mode': 'knn', 'knn_k': 8, 'weighted_edges': True, 'symmetrize_mode': 'mutual', 'self_loops': True, 'use_snp_selection': True, 'num_snps': 27173}. Best is trial 0 with value: 0.25437109530860413.
[I 2025-12-08 21:45:42,558] Trial 1 finished with value: 0.2314808953549376 and parameters: {'model_type': 'gcn', 'hidden_dims': '[256, 128, 64]', 'dropout': 0.5543244404043342, 'batch_norm': True, 'lr': 7.981787657617978e-05, 'weight_decay': 2.8571789869344834e-07, 'epochs': 297, 'loss': 'mae', 'optimizer': 'adam', 'graph_mode': 'cutoff', 'cutoff': 0.3392632777751686, 'grm_norm': 'gcn', 'self_loops': False, 'use_snp_selection': False}. Best is trial 0 with value: 0.25437109530860413.
[I 2025-12-08 21:46:41,406] Trial 2 finished with value: 0.1971414706108311 and parameters: {'model_type': 'gcn', 'hidden_dims': '[512, 64]', 'dropout': 0.32815227354739207, 'batch_norm': True, 'lr': 0.000619605044204259, 'weight_decay': 0.0004086269831625786, 'epochs': 206, 'loss': 'mse', 'optimizer': 'adam', 'graph_mode': 'knn', 'knn_k': 4, 'weighted_edges': True, 'symmetrize_mode': 'union', 'self_loops': True, 'use_snp_selection': True, 'num_snps': 53035}. Best is trial 0 with value: 0.25437109530860413.
[I 2025-12-08 21:47:10,092] Trial 3 finished with value: 0.22232713033771434 and parameters: {'model_type': 'gcn', 'hidden_dims': '[256, 128]', 'dropout': 0.23110783056597514, 'batch_norm': True, 'lr': 8.11311593386298e-05, 'weight_decay': 9.296158109581328e-07, 'epochs': 213, 'loss': 'mse', 'optimizer': 'adam', 'graph_mode': 'knn', 'knn_k': 10, 'weighted_edges': True, 'symmetrize_mode': 'mutual', 'self_loops': True, 'use_snp_selection': False}. Best is trial 0 with value: 0.25437109530860413.
[I 2025-12-08 21:47:24,932] Trial 4 finished with value: 0.3076642426483153 and parameters: {'model_type': 'gcn', 'hidden_dims': '[512, 256]', 'dropout': 0.2753281956415665, 'batch_norm': True, 'lr': 0.00034435188114839693, 'weight_decay': 4.9416012835950194e-05, 'epochs': 89, 'loss': 'mae', 'optimizer': 'adam', 'graph_mode': 'cutoff', 'cutoff': 0.820078967317394, 'grm_norm': 'none', 'self_loops': False, 'use_snp_selection': True, 'num_snps': 12674}. Best is trial 4 with value: 0.3076642426483153.
[I 2025-12-08 21:47:51,080] Trial 5 finished with value: 0.28681970762182823 and parameters: {'model_type': 'gcn', 'hidden_dims': '[128, 64]', 'dropout': 0.5611163934517731, 'batch_norm': True, 'lr': 0.0003984856210762587, 'weight_decay': 1.1466743517565185e-07, 'epochs': 344, 'loss': 'mae', 'optimizer': 'adam', 'graph_mode': 'cutoff', 'cutoff': 0.6089370799714728, 'grm_norm': 'gcn', 'self_loops': True, 'use_snp_selection': False}. Best is trial 4 with value: 0.3076642426483153.
[I 2025-12-08 21:48:14,128] Trial 6 finished with value: 0.26998013941607374 and parameters: {'model_type': 'gcn', 'hidden_dims': '[128, 64]', 'dropout': 0.31805912766941713, 'batch_norm': True, 'lr': 1.2361026034262557e-05, 'weight_decay': 6.492620232791903e-06, 'epochs': 271, 'loss': 'mse', 'optimizer': 'adam', 'graph_mode': 'cutoff', 'cutoff': 0.6193362582230448, 'grm_norm': 'cosine', 'self_loops': False, 'use_snp_selection': True, 'num_snps': 28594}. Best is trial 4 with value: 0.3076642426483153.
[I 2025-12-08 21:48:34,914] Trial 7 finished with value: 0.24066418567022213 and parameters: {'model_type': 'gcn', 'hidden_dims': '[512, 64]', 'dropout': 0.471337288649717, 'batch_norm': True, 'lr': 2.239693207292708e-05, 'weight_decay': 2.263166635514082e-06, 'epochs': 69, 'loss': 'mse', 'optimizer': 'adam', 'graph_mode': 'cutoff', 'cutoff': 0.4056820886426376, 'grm_norm': 'cosine', 'self_loops': False, 'use_snp_selection': False}. Best is trial 4 with value: 0.3076642426483153.
[I 2025-12-08 21:49:13,344] Trial 8 finished with value: 0.2591053465382398 and parameters: {'model_type': 'gcn', 'hidden_dims': '[512, 256]', 'dropout': 0.20659328268932406, 'batch_norm': False, 'lr': 8.93315124361372e-05, 'weight_decay': 0.00028987480727919035, 'epochs': 136, 'loss': 'mae', 'optimizer': 'adam', 'graph_mode': 'knn', 'knn_k': 3, 'weighted_edges': False, 'symmetrize_mode': 'union', 'self_loops': False, 'use_snp_selection': True, 'num_snps': 43128}. Best is trial 4 with value: 0.3076642426483153.
[I 2025-12-08 21:49:56,610] Trial 9 finished with value: 0.008907167588197056 and parameters: {'model_type': 'gcn', 'hidden_dims': '[512, 256]', 'dropout': 0.2888209592870401, 'batch_norm': False, 'lr': 0.004734648143129892, 'weight_decay': 1.5879705591356368e-06, 'epochs': 163, 'loss': 'mse', 'optimizer': 'adam', 'graph_mode': 'cutoff', 'cutoff': 0.5984899797909019, 'grm_norm': 'cosine', 'self_loops': True, 'use_snp_selection': False}. Best is trial 4 with value: 0.3076642426483153.
[I 2025-12-08 21:50:06,007] Trial 10 finished with value: 0.25336385667837424 and parameters: {'model_type': 'gcn', 'hidden_dims': '[512, 128]', 'dropout': 0.11372025982957354, 'batch_norm': False, 'lr': 0.0023343012062770553, 'weight_decay': 4.14440562940608e-05, 'epochs': 41, 'loss': 'mae', 'optimizer': 'adam', 'graph_mode': 'cutoff', 'cutoff': 0.8740100033033124, 'grm_norm': 'none', 'self_loops': False, 'use_snp_selection': True, 'num_snps': 3859}. Best is trial 4 with value: 0.3076642426483153.
[I 2025-12-08 21:50:16,626] Trial 11 finished with value: 0.30837093707329977 and parameters: {'model_type': 'gcn', 'hidden_dims': '[128, 64]', 'dropout': 0.44863014119095845, 'batch_norm': True, 'lr': 0.0005943392021247852, 'weight_decay': 1.0655358607693621e-07, 'epochs': 110, 'loss': 'mae', 'optimizer': 'adam', 'graph_mode': 'cutoff', 'cutoff': 0.8568899271933978, 'grm_norm': 'cosine_then_gcn', 'self_loops': True, 'use_snp_selection': False}. Best is trial 11 with value: 0.30837093707329977.
[I 2025-12-08 21:50:28,977] Trial 12 finished with value: 0.28992660685937915 and parameters: {'model_type': 'gcn', 'hidden_dims': '[512, 256]', 'dropout': 0.42758862319180935, 'batch_norm': True, 'lr': 0.0012059085553112938, 'weight_decay': 3.482253699955131e-05, 'epochs': 103, 'loss': 'mae', 'optimizer': 'adam', 'graph_mode': 'cutoff', 'cutoff': 0.8919050080438428, 'grm_norm': 'cosine_then_gcn', 'self_loops': True, 'use_snp_selection': True, 'num_snps': 6176}. Best is trial 11 with value: 0.30837093707329977.
[I 2025-12-08 21:50:43,609] Trial 13 finished with value: 0.30773372061710236 and parameters: {'model_type': 'gcn', 'hidden_dims': '[256, 128]', 'dropout': 0.4452783958423849, 'batch_norm': True, 'lr': 0.00028764898471530923, 'weight_decay': 8.746795324277564e-06, 'epochs': 96, 'loss': 'mae', 'optimizer': 'adam', 'graph_mode': 'cutoff', 'cutoff': 0.7596101551526167, 'grm_norm': 'cosine_then_gcn', 'self_loops': False, 'use_snp_selection': False}. Best is trial 11 with value: 0.30837093707329977.
