[I 2025-12-08 17:28:44,610] Trial 69 finished with value: 0.2288395613650757 and parameters: {'model_type': 'gcn', 'hidden_dims': '[256, 128]', 'dropout': 0.24803990166100692, 'batch_norm': True, 'lr': 0.0009069179695469909, 'weight_decay': 0.00024187959108497054, 'epochs': 141, 'loss': 'mae', 'optimizer': 'adam', 'graph_mode': 'cutoff', 'cutoff': 0.21863612783109893, 'grm_norm': 'cosine_then_gcn', 'self_loops': False, 'use_snp_selection': True, 'num_snps': 46783}. Best is trial 32 with value: 0.32261396288913385.
[I 2025-12-08 17:29:11,904] Trial 70 finished with value: 0.2557809639574493 and parameters: {'model_type': 'gcn', 'hidden_dims': '[512, 256]', 'dropout': 0.36411651285511437, 'batch_norm': True, 'lr': 1.9331271857189363e-05, 'weight_decay': 0.00033697001490352126, 'epochs': 155, 'loss': 'mae', 'optimizer': 'adam', 'graph_mode': 'cutoff', 'cutoff': 0.5222129423583157, 'grm_norm': 'none', 'self_loops': False, 'use_snp_selection': True, 'num_snps': 23690}. Best is trial 32 with value: 0.32261396288913385.
[I 2025-12-08 17:30:03,534] Trial 71 finished with value: 0.3045674894777198 and parameters: {'model_type': 'gcn', 'hidden_dims': '[512, 128]', 'dropout': 0.26750535942030695, 'batch_norm': True, 'lr': 0.0016025933786037352, 'weight_decay': 7.96502253446126e-05, 'epochs': 200, 'loss': 'mae', 'optimizer': 'adam', 'graph_mode': 'cutoff', 'cutoff': 0.7971807410960825, 'grm_norm': 'none', 'self_loops': False, 'use_snp_selection': False}. Best is trial 32 with value: 0.32261396288913385.
[I 2025-12-08 17:30:52,143] Trial 72 finished with value: 0.3055885056174571 and parameters: {'model_type': 'gcn', 'hidden_dims': '[512, 128]', 'dropout': 0.29578754972386523, 'batch_norm': True, 'lr': 0.0006087297530468233, 'weight_decay': 0.00015593230643210396, 'epochs': 188, 'loss': 'mae', 'optimizer': 'adam', 'graph_mode': 'cutoff', 'cutoff': 0.7490955335670842, 'grm_norm': 'none', 'self_loops': False, 'use_snp_selection': False}. Best is trial 32 with value: 0.32261396288913385.
[I 2025-12-08 17:31:15,622] Trial 73 finished with value: 0.3068710224142939 and parameters: {'model_type': 'gcn', 'hidden_dims': '[512, 64]', 'dropout': 0.18558116576176786, 'batch_norm': True, 'lr': 0.0002680598475167963, 'weight_decay': 3.9312762445580256e-05, 'epochs': 62, 'loss': 'mae', 'optimizer': 'adam', 'graph_mode': 'cutoff', 'cutoff': 0.840526172565644, 'grm_norm': 'none', 'self_loops': False, 'use_snp_selection': True, 'num_snps': 36316}. Best is trial 32 with value: 0.32261396288913385.
[I 2025-12-08 17:31:39,286] Trial 74 finished with value: 0.3055728202482964 and parameters: {'model_type': 'gcn', 'hidden_dims': '[256, 128]', 'dropout': 0.31101777204779935, 'batch_norm': True, 'lr': 0.00034146312545945085, 'weight_decay': 7.404849786953715e-05, 'epochs': 178, 'loss': 'mae', 'optimizer': 'adam', 'graph_mode': 'cutoff', 'cutoff': 0.690976113739574, 'grm_norm': 'none', 'self_loops': False, 'use_snp_selection': False}. Best is trial 32 with value: 0.32261396288913385.
[I 2025-12-08 17:32:23,605] Trial 75 finished with value: 0.3030576279510041 and parameters: {'model_type': 'gcn', 'hidden_dims': '[512, 128]', 'dropout': 0.21706616085852184, 'batch_norm': True, 'lr': 0.0007598768914744373, 'weight_decay': 0.00010140767539781127, 'epochs': 170, 'loss': 'mae', 'optimizer': 'adam', 'graph_mode': 'cutoff', 'cutoff': 0.7355189916835075, 'grm_norm': 'none', 'self_loops': False, 'use_snp_selection': False}. Best is trial 32 with value: 0.32261396288913385.
[I 2025-12-08 17:32:39,578] Trial 76 finished with value: 0.2161825012782425 and parameters: {'model_type': 'gcn', 'hidden_dims': '[256, 128, 64]', 'dropout': 0.2410761967295555, 'batch_norm': True, 'lr': 0.00012082576064761808, 'weight_decay': 0.0005888673275966622, 'epochs': 108, 'loss': 'mae', 'optimizer': 'adam', 'graph_mode': 'cutoff', 'cutoff': 0.4669306108961828, 'grm_norm': 'cosine_then_gcn', 'self_loops': False, 'use_snp_selection': False}. Best is trial 32 with value: 0.32261396288913385.
[I 2025-12-08 17:33:22,192] Trial 77 finished with value: 0.2233006761149583 and parameters: {'model_type': 'gcn', 'hidden_dims': '[512, 128]', 'dropout': 0.3370130633617644, 'batch_norm': True, 'lr': 0.0005212955645758749, 'weight_decay': 3.596581670733579e-06, 'epochs': 130, 'loss': 'mse', 'optimizer': 'adam', 'graph_mode': 'knn', 'knn_k': 8, 'weighted_edges': False, 'symmetrize_mode': 'mutual', 'self_loops': True, 'use_snp_selection': True, 'num_snps': 50920}. Best is trial 32 with value: 0.32261396288913385.
[I 2025-12-08 17:34:19,421] Trial 78 finished with value: 0.2912640183024366 and parameters: {'model_type': 'gcn', 'hidden_dims': '[512, 128]', 'dropout': 0.2911754889832057, 'batch_norm': True, 'lr': 0.00015699204795760027, 'weight_decay': 4.5817431256182226e-05, 'epochs': 224, 'loss': 'mae', 'optimizer': 'adam', 'graph_mode': 'cutoff', 'cutoff': 0.805041046466276, 'grm_norm': 'none', 'self_loops': False, 'use_snp_selection': False}. Best is trial 32 with value: 0.32261396288913385.
[I 2025-12-08 17:34:56,525] Trial 79 finished with value: 0.29980750786100296 and parameters: {'model_type': 'gcn', 'hidden_dims': '[256, 128]', 'dropout': 0.2564604189127602, 'batch_norm': False, 'lr': 0.0002134578947316414, 'weight_decay': 1.8247851463817668e-06, 'epochs': 297, 'loss': 'mae', 'optimizer': 'adam', 'graph_mode': 'cutoff', 'cutoff': 0.8764486126240311, 'grm_norm': 'cosine', 'self_loops': False, 'use_snp_selection': False}. Best is trial 32 with value: 0.32261396288913385.
[I 2025-12-08 17:35:22,772] Trial 80 finished with value: 0.3083685956636659 and parameters: {'model_type': 'gcn', 'hidden_dims': '[512, 128]', 'dropout': 0.15810484811358771, 'batch_norm': True, 'lr': 0.000417570480869886, 'weight_decay': 2.7879149486207198e-06, 'epochs': 95, 'loss': 'mae', 'optimizer': 'adam', 'graph_mode': 'cutoff', 'cutoff': 0.6572238358758513, 'grm_norm': 'gcn', 'self_loops': False, 'use_snp_selection': False}. Best is trial 32 with value: 0.32261396288913385.
[I 2025-12-08 17:36:16,920] Trial 81 finished with value: 0.3109082150350061 and parameters: {'model_type': 'gcn', 'hidden_dims': '[512, 128]', 'dropout': 0.3222803967066076, 'batch_norm': True, 'lr': 0.0003233079492074067, 'weight_decay': 5.584097753584906e-05, 'epochs': 212, 'loss': 'mae', 'optimizer': 'adam', 'graph_mode': 'cutoff', 'cutoff': 0.6803931012369028, 'grm_norm': 'none', 'self_loops': False, 'use_snp_selection': False}. Best is trial 32 with value: 0.32261396288913385.
[I 2025-12-08 17:37:11,276] Trial 82 finished with value: 0.3053412509097801 and parameters: {'model_type': 'gcn', 'hidden_dims': '[512, 128]', 'dropout': 0.31741934375391767, 'batch_norm': True, 'lr': 0.0003279281162105212, 'weight_decay': 0.0001817545011411004, 'epochs': 212, 'loss': 'mae', 'optimizer': 'adam', 'graph_mode': 'cutoff', 'cutoff': 0.774643994517954, 'grm_norm': 'none', 'self_loops': False, 'use_snp_selection': False}. Best is trial 32 with value: 0.32261396288913385.
[I 2025-12-08 17:38:04,390] Trial 83 finished with value: 0.3096369316617163 and parameters: {'model_type': 'gcn', 'hidden_dims': '[512, 128]', 'dropout': 0.2776759505206509, 'batch_norm': True, 'lr': 0.00024860161167450303, 'weight_decay': 2.583332551531227e-05, 'epochs': 208, 'loss': 'mae', 'optimizer': 'adam', 'graph_mode': 'cutoff', 'cutoff': 0.7471947853940779, 'grm_norm': 'none', 'self_loops': False, 'use_snp_selection': False}. Best is trial 32 with value: 0.32261396288913385.
[I 2025-12-08 17:39:04,202] Trial 84 finished with value: 0.30089065114242397 and parameters: {'model_type': 'gcn', 'hidden_dims': '[512, 128]', 'dropout': 0.30105154701422115, 'batch_norm': True, 'lr': 0.00020784696408484663, 'weight_decay': 1.0902529418673355e-06, 'epochs': 234, 'loss': 'mae', 'optimizer': 'adam', 'graph_mode': 'cutoff', 'cutoff': 0.7884598839609622, 'grm_norm': 'none', 'self_loops': False, 'use_snp_selection': False}. Best is trial 32 with value: 0.32261396288913385.
[I 2025-12-08 17:39:11,897] Trial 85 finished with value: 0.24529530264229069 and parameters: {'model_type': 'gcn', 'hidden_dims': '[128, 64]', 'dropout': 0.33977886501763754, 'batch_norm': True, 'lr': 0.0002914692305022652, 'weight_decay': 2.0361805735899262e-05, 'epochs': 75, 'loss': 'mae', 'optimizer': 'adam', 'graph_mode': 'cutoff', 'cutoff': 0.2563693907308391, 'grm_norm': 'cosine_then_gcn', 'self_loops': False, 'use_snp_selection': False}. Best is trial 32 with value: 0.32261396288913385.
[I 2025-12-08 17:40:00,328] Trial 86 finished with value: 0.2929952360045554 and parameters: {'model_type': 'gcn', 'hidden_dims': '[512, 128]', 'dropout': 0.19622703312473616, 'batch_norm': True, 'lr': 0.00014552872408286446, 'weight_decay': 2.6072785998603304e-05, 'epochs': 185, 'loss': 'mae', 'optimizer': 'adam', 'graph_mode': 'cutoff', 'cutoff': 0.6224092439518166, 'grm_norm': 'none', 'self_loops': False, 'use_snp_selection': False}. Best is trial 32 with value: 0.32261396288913385.
[I 2025-12-08 17:41:03,590] Trial 87 finished with value: 0.3050747413572079 and parameters: {'model_type': 'gcn', 'hidden_dims': '[512, 64]', 'dropout': 0.3260798663865113, 'batch_norm': True, 'lr': 0.00010783371246336094, 'weight_decay': 1.4522803468931093e-05, 'epochs': 246, 'loss': 'mae', 'optimizer': 'adam', 'graph_mode': 'cutoff', 'cutoff': 0.8313002879429278, 'grm_norm': 'none', 'self_loops': False, 'use_snp_selection': False}. Best is trial 32 with value: 0.32261396288913385.
[I 2025-12-08 17:41:29,481] Trial 88 finished with value: 0.3098046226771086 and parameters: {'model_type': 'gcn', 'hidden_dims': '[512, 256]', 'dropout': 0.3671842421598369, 'batch_norm': True, 'lr': 0.00026619588430349615, 'weight_decay': 3.62781875253704e-05, 'epochs': 89, 'loss': 'mae', 'optimizer': 'adam', 'graph_mode': 'cutoff', 'cutoff': 0.7547167157326611, 'grm_norm': 'none', 'self_loops': True, 'use_snp_selection': False}. Best is trial 32 with value: 0.32261396288913385.
[I 2025-12-08 17:42:04,397] Trial 89 finished with value: 0.2202793519814843 and parameters: {'model_type': 'gcn', 'hidden_dims': '[512, 256]', 'dropout': 0.35744067517336453, 'batch_norm': True, 'lr': 0.00017338642966444593, 'weight_decay': 3.5232850784826207e-05, 'epochs': 113, 'loss': 'mse', 'optimizer': 'adam', 'graph_mode': 'knn', 'knn_k': 6, 'weighted_edges': False, 'symmetrize_mode': 'union', 'self_loops': True, 'use_snp_selection': True, 'num_snps': 42271}. Best is trial 32 with value: 0.32261396288913385.
[I 2025-12-08 17:42:25,373] Trial 90 finished with value: 0.3073636248080326 and parameters: {'model_type': 'gcn', 'hidden_dims': '[512, 256]', 'dropout': 0.3949626745300236, 'batch_norm': True, 'lr': 0.00044329701984504243, 'weight_decay': 5.822125428897026e-06, 'epochs': 69, 'loss': 'mae', 'optimizer': 'adam', 'graph_mode': 'cutoff', 'cutoff': 0.7761079859720604, 'grm_norm': 'cosine_then_gcn', 'self_loops': True, 'use_snp_selection': False}. Best is trial 32 with value: 0.32261396288913385.
[I 2025-12-08 17:42:49,757] Trial 91 finished with value: 0.3101835990675844 and parameters: {'model_type': 'gcn', 'hidden_dims': '[512, 256]', 'dropout': 0.41476058320939735, 'batch_norm': True, 'lr': 0.000246553825023454, 'weight_decay': 6.36098122682722e-05, 'epochs': 84, 'loss': 'mae', 'optimizer': 'adam', 'graph_mode': 'cutoff', 'cutoff': 0.7564995576181519, 'grm_norm': 'none', 'self_loops': True, 'use_snp_selection': False}. Best is trial 32 with value: 0.32261396288913385.
[I 2025-12-08 17:43:14,653] Trial 92 finished with value: 0.31239911811324905 and parameters: {'model_type': 'gcn', 'hidden_dims': '[512, 256]', 'dropout': 0.44861046205268895, 'batch_norm': True, 'lr': 0.0003906233398473198, 'weight_decay': 6.686665320873571e-05, 'epochs': 85, 'loss': 'mae', 'optimizer': 'adam', 'graph_mode': 'cutoff', 'cutoff': 0.8114214729558767, 'grm_norm': 'none', 'self_loops': True, 'use_snp_selection': False}. Best is trial 32 with value: 0.32261396288913385.
[I 2025-12-08 17:43:39,368] Trial 93 finished with value: 0.31364467547737834 and parameters: {'model_type': 'gcn', 'hidden_dims': '[512, 256]', 'dropout': 0.42726103499067924, 'batch_norm': True, 'lr': 0.0006700814892781598, 'weight_decay': 6.700962568430246e-05, 'epochs': 85, 'loss': 'mae', 'optimizer': 'adam', 'graph_mode': 'cutoff', 'cutoff': 0.8092313047857794, 'grm_norm': 'none', 'self_loops': True, 'use_snp_selection': False}. Best is trial 32 with value: 0.32261396288913385.
[I 2025-12-08 17:43:57,581] Trial 94 finished with value: 0.3158086540173979 and parameters: {'model_type': 'gcn', 'hidden_dims': '[512, 256]', 'dropout': 0.48158561345945317, 'batch_norm': True, 'lr': 0.0003838669708825495, 'weight_decay': 6.563467515753214e-05, 'epochs': 58, 'loss': 'mae', 'optimizer': 'adam', 'graph_mode': 'cutoff', 'cutoff': 0.8592428929246094, 'grm_norm': 'none', 'self_loops': True, 'use_snp_selection': False}. Best is trial 32 with value: 0.32261396288913385.
[I 2025-12-08 17:44:15,019] Trial 95 finished with value: 0.3085181226681927 and parameters: {'model_type': 'gcn', 'hidden_dims': '[512, 256]', 'dropout': 0.474945985505482, 'batch_norm': True, 'lr': 0.0006561606105076207, 'weight_decay': 6.466631952432473e-05, 'epochs': 55, 'loss': 'mae', 'optimizer': 'adam', 'graph_mode': 'cutoff', 'cutoff': 0.8481503927569868, 'grm_norm': 'none', 'self_loops': True, 'use_snp_selection': False}. Best is trial 32 with value: 0.32261396288913385.
[I 2025-12-08 17:44:38,427] Trial 96 finished with value: 0.3055026713465707 and parameters: {'model_type': 'gcn', 'hidden_dims': '[512, 256]', 'dropout': 0.4425752631214266, 'batch_norm': True, 'lr': 0.0007799371634178254, 'weight_decay': 0.00011663642035561193, 'epochs': 80, 'loss': 'mae', 'optimizer': 'adam', 'graph_mode': 'cutoff', 'cutoff': 0.8701113047346347, 'grm_norm': 'none', 'self_loops': True, 'use_snp_selection': False}. Best is trial 32 with value: 0.32261396288913385.
[I 2025-12-08 17:44:52,185] Trial 97 finished with value: 0.311380551903418 and parameters: {'model_type': 'gcn', 'hidden_dims': '[512, 256]', 'dropout': 0.47886866733834343, 'batch_norm': True, 'lr': 0.00039764860619037135, 'weight_decay': 4.820593045280458e-05, 'epochs': 40, 'loss': 'mae', 'optimizer': 'adam', 'graph_mode': 'cutoff', 'cutoff': 0.8135196962893935, 'grm_norm': 'none', 'self_loops': True, 'use_snp_selection': False}. Best is trial 32 with value: 0.32261396288913385.
[I 2025-12-08 17:45:11,163] Trial 98 finished with value: 0.0 and parameters: {'model_type': 'gcn', 'hidden_dims': '[512, 256]', 'dropout': 0.5049557292267848, 'batch_norm': False, 'lr': 0.0014188892600741152, 'weight_decay': 4.6922687607202685e-05, 'epochs': 62, 'loss': 'mae', 'optimizer': 'adam', 'graph_mode': 'cutoff', 'cutoff': 0.814746294185553, 'grm_norm': 'none', 'self_loops': True, 'use_snp_selection': False}. Best is trial 32 with value: 0.32261396288913385.
[I 2025-12-08 17:45:24,913] Trial 99 finished with value: 0.30891613864887923 and parameters: {'model_type': 'gcn', 'hidden_dims': '[512, 256]', 'dropout': 0.4800641828613086, 'batch_norm': True, 'lr': 0.001067713118247815, 'weight_decay': 5.111944039644993e-05, 'epochs': 40, 'loss': 'mae', 'optimizer': 'adam', 'graph_mode': 'cutoff', 'cutoff': 0.8308357362308295, 'grm_norm': 'none', 'self_loops': True, 'use_snp_selection': False}. Best is trial 32 with value: 0.32261396288913385.
[I 2025-12-08 17:45:40,780] Trial 100 finished with value: 0.31333075423798507 and parameters: {'model_type': 'gcn', 'hidden_dims': '[512, 256]', 'dropout': 0.4509387634344219, 'batch_norm': True, 'lr': 0.0003909034751876986, 'weight_decay': 9.656873696052773e-05, 'epochs': 48, 'loss': 'mae', 'optimizer': 'adam', 'graph_mode': 'cutoff', 'cutoff': 0.851262387194643, 'grm_norm': 'none', 'self_loops': True, 'use_snp_selection': False}. Best is trial 32 with value: 0.32261396288913385.
[I 2025-12-08 17:45:58,133] Trial 101 finished with value: 0.310752937463073 and parameters: {'model_type': 'gcn', 'hidden_dims': '[512, 256]', 'dropout': 0.458396354218469, 'batch_norm': True, 'lr': 0.0003950521759888547, 'weight_decay': 0.0001005256911959609, 'epochs': 54, 'loss': 'mae', 'optimizer': 'adam', 'graph_mode': 'cutoff', 'cutoff': 0.858948376040599, 'grm_norm': 'none', 'self_loops': True, 'use_snp_selection': False}. Best is trial 32 with value: 0.32261396288913385.
[I 2025-12-08 17:46:13,512] Trial 102 finished with value: 0.2977437917714289 and parameters: {'model_type': 'gcn', 'hidden_dims': '[512, 256]', 'dropout': 0.5139844273046603, 'batch_norm': True, 'lr': 0.00048601421878681944, 'weight_decay': 7.409455884671662e-05, 'epochs': 47, 'loss': 'mae', 'optimizer': 'adam', 'graph_mode': 'cutoff', 'cutoff': 0.8837668978131248, 'grm_norm': 'none', 'self_loops': True, 'use_snp_selection': False}. Best is trial 32 with value: 0.32261396288913385.
[I 2025-12-08 17:46:34,936] Trial 103 finished with value: 0.3134551470726099 and parameters: {'model_type': 'gcn', 'hidden_dims': '[512, 256]', 'dropout': 0.4561163660732833, 'batch_norm': True, 'lr': 0.0005992506332230471, 'weight_decay': 0.0001257022453597666, 'epochs': 72, 'loss': 'mae', 'optimizer': 'adam', 'graph_mode': 'cutoff', 'cutoff': 0.8112648154139374, 'grm_norm': 'none', 'self_loops': True, 'use_snp_selection': False}. Best is trial 32 with value: 0.32261396288913385.
[I 2025-12-08 17:46:57,102] Trial 104 finished with value: 0.30880111326093 and parameters: {'model_type': 'gcn', 'hidden_dims': '[512, 256]', 'dropout': 0.4554870951301898, 'batch_norm': True, 'lr': 0.0006671779846493313, 'weight_decay': 0.00013238263924255132, 'epochs': 73, 'loss': 'mae', 'optimizer': 'adam', 'graph_mode': 'cutoff', 'cutoff': 0.8109935510686397, 'grm_norm': 'none', 'self_loops': True, 'use_snp_selection': False}. Best is trial 32 with value: 0.32261396288913385.
[I 2025-12-08 17:47:12,920] Trial 105 finished with value: 0.3087776322624191 and parameters: {'model_type': 'gcn', 'hidden_dims': '[512, 256]', 'dropout': 0.4316437863440759, 'batch_norm': True, 'lr': 0.0008980835756581425, 'weight_decay': 0.00013454127404377344, 'epochs': 47, 'loss': 'mae', 'optimizer': 'adam', 'graph_mode': 'cutoff', 'cutoff': 0.8386540346609305, 'grm_norm': 'none', 'self_loops': True, 'use_snp_selection': False}. Best is trial 32 with value: 0.32261396288913385.
[I 2025-12-08 17:47:34,063] Trial 106 finished with value: 0.30905367872561745 and parameters: {'model_type': 'gcn', 'hidden_dims': '[512, 256]', 'dropout': 0.4833307133282566, 'batch_norm': True, 'lr': 0.0005846700301164984, 'weight_decay': 0.00017956711686134915, 'epochs': 66, 'loss': 'mae', 'optimizer': 'adam', 'graph_mode': 'cutoff', 'cutoff': 0.8517355998696527, 'grm_norm': 'cosine', 'self_loops': True, 'use_snp_selection': False}. Best is trial 32 with value: 0.32261396288913385.
[I 2025-12-08 17:47:55,693] Trial 107 finished with value: 0.30794028297127357 and parameters: {'model_type': 'gcn', 'hidden_dims': '[512, 256]', 'dropout': 0.46485554034357135, 'batch_norm': True, 'lr': 0.00038855695206890974, 'weight_decay': 0.0002567379795179568, 'epochs': 58, 'loss': 'mae', 'optimizer': 'adam', 'graph_mode': 'cutoff', 'cutoff': 0.7895466855839451, 'grm_norm': 'gcn', 'self_loops': True, 'use_snp_selection': True, 'num_snps': 31892}. Best is trial 32 with value: 0.32261396288913385.
[I 2025-12-08 17:48:17,650] Trial 108 finished with value: 0.30963762740582357 and parameters: {'model_type': 'gcn', 'hidden_dims': '[512, 256]', 'dropout': 0.5326409891198273, 'batch_norm': True, 'lr': 0.0007978395002255543, 'weight_decay': 9.015932624174118e-05, 'epochs': 71, 'loss': 'mae', 'optimizer': 'adam', 'graph_mode': 'cutoff', 'cutoff': 0.8667108988307451, 'grm_norm': 'none', 'self_loops': True, 'use_snp_selection': False}. Best is trial 32 with value: 0.32261396288913385.
[I 2025-12-08 17:48:34,742] Trial 109 finished with value: 0.2522292608083065 and parameters: {'model_type': 'gcn', 'hidden_dims': '[512, 256]', 'dropout': 0.4899423626880636, 'batch_norm': True, 'lr': 0.0010446230221105974, 'weight_decay': 4.59945404935882e-05, 'epochs': 49, 'loss': 'mse', 'optimizer': 'adam', 'graph_mode': 'knn', 'knn_k': 2, 'weighted_edges': True, 'symmetrize_mode': 'mutual', 'self_loops': True, 'use_snp_selection': False}. Best is trial 32 with value: 0.32261396288913385.
[I 2025-12-08 17:49:01,157] Trial 110 finished with value: 0.3095395511602635 and parameters: {'model_type': 'gcn', 'hidden_dims': '[512, 256]', 'dropout': 0.43542786257328686, 'batch_norm': True, 'lr': 0.0004468437351795961, 'weight_decay': 3.212095363230368e-05, 'epochs': 90, 'loss': 'mae', 'optimizer': 'adam', 'graph_mode': 'cutoff', 'cutoff': 0.8198733787713671, 'grm_norm': 'none', 'self_loops': True, 'use_snp_selection': False}. Best is trial 32 with value: 0.32261396288913385.
[I 2025-12-08 17:49:20,997] Trial 111 finished with value: 0.30803349969720883 and parameters: {'model_type': 'gcn', 'hidden_dims': '[512, 256]', 'dropout': 0.5010756020573527, 'batch_norm': True, 'lr': 0.0003116419629428732, 'weight_decay': 5.8676013431955315e-05, 'epochs': 64, 'loss': 'mae', 'optimizer': 'adam', 'graph_mode': 'cutoff', 'cutoff': 0.8027068136769011, 'grm_norm': 'none', 'self_loops': True, 'use_snp_selection': False}. Best is trial 32 with value: 0.32261396288913385.
[I 2025-12-08 17:49:49,353] Trial 112 finished with value: 0.30981235021041537 and parameters: {'model_type': 'gcn', 'hidden_dims': '[512, 256]', 'dropout': 0.46673182085393594, 'batch_norm': True, 'lr': 0.0005881201849412, 'weight_decay': 6.873811692794685e-05, 'epochs': 99, 'loss': 'mae', 'optimizer': 'adam', 'graph_mode': 'cutoff', 'cutoff': 0.8370095575077748, 'grm_norm': 'none', 'self_loops': True, 'use_snp_selection': False}. Best is trial 32 with value: 0.32261396288913385.
