[I 2025-12-08 10:33:41,945] Trial 43 finished with value: 0.3027367800597879 and parameters: {'model_type': 'gcn', 'hidden_dims': '[256, 128, 64]', 'dropout': 0.5960156460675545, 'batch_norm': True, 'lr': 0.006112985896177604, 'weight_decay': 1.0353942887557732e-07, 'epochs': 42, 'loss': 'mae', 'optimizer': 'adam', 'graph_mode': 'cutoff', 'cutoff': 0.713722296577438, 'grm_norm': 'none', 'self_loops': False, 'use_snp_selection': False}. Best is trial 32 with value: 0.3082230841041575.
[I 2025-12-08 10:33:51,704] Trial 44 finished with value: 0.301595095593444 and parameters: {'model_type': 'gcn', 'hidden_dims': '[256, 128, 64]', 'dropout': 0.5383750380119017, 'batch_norm': True, 'lr': 0.0017687088228620163, 'weight_decay': 3.258140507990569e-07, 'epochs': 60, 'loss': 'mae', 'optimizer': 'adam', 'graph_mode': 'cutoff', 'cutoff': 0.6504326336626358, 'grm_norm': 'gcn', 'self_loops': False, 'use_snp_selection': False}. Best is trial 32 with value: 0.3082230841041575.
[I 2025-12-08 10:34:21,272] Trial 45 finished with value: 0.2999155214503354 and parameters: {'model_type': 'gcn', 'hidden_dims': '[512, 64]', 'dropout': 0.140540255332374, 'batch_norm': True, 'lr': 0.00392277205244254, 'weight_decay': 1.5939628189786323e-07, 'epochs': 204, 'loss': 'mae', 'optimizer': 'adam', 'graph_mode': 'cutoff', 'cutoff': 0.8438155991688908, 'grm_norm': 'cosine_then_gcn', 'self_loops': False, 'use_snp_selection': True, 'num_snps': 21630}. Best is trial 32 with value: 0.3082230841041575.
[I 2025-12-08 10:34:35,791] Trial 46 finished with value: 0.2918304574915681 and parameters: {'model_type': 'gcn', 'hidden_dims': '[256, 128, 64]', 'dropout': 0.32794806262193266, 'batch_norm': True, 'lr': 0.0004524916106949332, 'weight_decay': 1.2496529003623055e-06, 'epochs': 98, 'loss': 'mae', 'optimizer': 'adam', 'graph_mode': 'cutoff', 'cutoff': 0.5935340987220982, 'grm_norm': 'cosine_then_gcn', 'self_loops': False, 'use_snp_selection': False}. Best is trial 32 with value: 0.3082230841041575.
[I 2025-12-08 10:34:47,524] Trial 47 finished with value: 0.3065977407770176 and parameters: {'model_type': 'gcn', 'hidden_dims': '[256, 128, 64]', 'dropout': 0.2973928525705658, 'batch_norm': True, 'lr': 0.004880809511863244, 'weight_decay': 2.907531194219063e-07, 'epochs': 75, 'loss': 'mae', 'optimizer': 'adam', 'graph_mode': 'cutoff', 'cutoff': 0.7043061516576062, 'grm_norm': 'cosine', 'self_loops': False, 'use_snp_selection': False}. Best is trial 32 with value: 0.3082230841041575.
[I 2025-12-08 10:35:10,408] Trial 48 finished with value: 0.04095154406002646 and parameters: {'model_type': 'gcn', 'hidden_dims': '[256, 128, 64]', 'dropout': 0.26133399088890097, 'batch_norm': False, 'lr': 0.007351144053353062, 'weight_decay': 1.738640453255499e-06, 'epochs': 77, 'loss': 'mae', 'optimizer': 'adam', 'graph_mode': 'cutoff', 'cutoff': 0.8348823240255435, 'grm_norm': 'cosine', 'self_loops': False, 'use_snp_selection': True, 'num_snps': 44439}. Best is trial 32 with value: 0.3082230841041575.
[I 2025-12-08 10:35:52,371] Trial 49 finished with value: 0.29848915164927725 and parameters: {'model_type': 'gcn', 'hidden_dims': '[256, 128, 64]', 'dropout': 0.3073752187396073, 'batch_norm': True, 'lr': 0.0028950012974265373, 'weight_decay': 7.667932799444727e-07, 'epochs': 327, 'loss': 'mse', 'optimizer': 'adam', 'graph_mode': 'cutoff', 'cutoff': 0.7677490579878247, 'grm_norm': 'cosine', 'self_loops': False, 'use_snp_selection': False}. Best is trial 32 with value: 0.3082230841041575.
[I 2025-12-08 10:36:09,512] Trial 50 finished with value: 0.2530709238042113 and parameters: {'model_type': 'gcn', 'hidden_dims': '[512, 256]', 'dropout': 0.18289640113290792, 'batch_norm': True, 'lr': 0.004523575034415625, 'weight_decay': 3.4698772104095905e-06, 'epochs': 55, 'loss': 'mae', 'optimizer': 'adam', 'graph_mode': 'knn', 'knn_k': 3, 'weighted_edges': False, 'symmetrize_mode': 'union', 'self_loops': False, 'use_snp_selection': False}. Best is trial 32 with value: 0.3082230841041575.
[I 2025-12-08 10:36:23,190] Trial 51 finished with value: 0.3019960468961237 and parameters: {'model_type': 'gcn', 'hidden_dims': '[256, 128, 64]', 'dropout': 0.29471736924486747, 'batch_norm': True, 'lr': 0.001568157522141837, 'weight_decay': 2.9736331313759554e-07, 'epochs': 92, 'loss': 'mae', 'optimizer': 'adam', 'graph_mode': 'cutoff', 'cutoff': 0.6976153955366826, 'grm_norm': 'cosine', 'self_loops': False, 'use_snp_selection': False}. Best is trial 32 with value: 0.3082230841041575.
[I 2025-12-08 10:36:39,998] Trial 52 finished with value: 0.30551599137716207 and parameters: {'model_type': 'gcn', 'hidden_dims': '[256, 128, 64]', 'dropout': 0.4866699680238282, 'batch_norm': True, 'lr': 0.0010040122665204742, 'weight_decay': 1.0047212748964382e-07, 'epochs': 118, 'loss': 'mae', 'optimizer': 'adam', 'graph_mode': 'cutoff', 'cutoff': 0.7235671110151642, 'grm_norm': 'cosine', 'self_loops': False, 'use_snp_selection': False}. Best is trial 32 with value: 0.3082230841041575.
[I 2025-12-08 10:36:47,534] Trial 53 finished with value: 0.30527858619510156 and parameters: {'model_type': 'gcn', 'hidden_dims': '[256, 128, 64]', 'dropout': 0.5540218212120668, 'batch_norm': True, 'lr': 0.0009830672803636295, 'weight_decay': 1.7808677801779154e-07, 'epochs': 41, 'loss': 'mae', 'optimizer': 'adam', 'graph_mode': 'cutoff', 'cutoff': 0.7456760955838669, 'grm_norm': 'cosine', 'self_loops': False, 'use_snp_selection': False}. Best is trial 32 with value: 0.3082230841041575.
[I 2025-12-08 10:36:57,920] Trial 54 finished with value: 0.29903499829277713 and parameters: {'model_type': 'gcn', 'hidden_dims': '[256, 128, 64]', 'dropout': 0.49050013783239405, 'batch_norm': True, 'lr': 0.004546208417621192, 'weight_decay': 3.7403866010560943e-07, 'epochs': 65, 'loss': 'mae', 'optimizer': 'adam', 'graph_mode': 'cutoff', 'cutoff': 0.6161819382465841, 'grm_norm': 'cosine', 'self_loops': True, 'use_snp_selection': False}. Best is trial 32 with value: 0.3082230841041575.
[I 2025-12-08 10:37:10,251] Trial 55 finished with value: 0.3051065412614842 and parameters: {'model_type': 'gcn', 'hidden_dims': '[256, 128, 64]', 'dropout': 0.46130726987104337, 'batch_norm': True, 'lr': 0.002845005892586483, 'weight_decay': 5.560554829427814e-07, 'epochs': 81, 'loss': 'mae', 'optimizer': 'adam', 'graph_mode': 'cutoff', 'cutoff': 0.7240689458966374, 'grm_norm': 'cosine', 'self_loops': False, 'use_snp_selection': False}. Best is trial 32 with value: 0.3082230841041575.
[I 2025-12-08 10:37:19,473] Trial 56 finished with value: 0.3094738320869709 and parameters: {'model_type': 'gcn', 'hidden_dims': '[256, 128, 64]', 'dropout': 0.5763676638227344, 'batch_norm': True, 'lr': 0.0022248833584978217, 'weight_decay': 1.4106503277018126e-07, 'epochs': 55, 'loss': 'mae', 'optimizer': 'adam', 'graph_mode': 'cutoff', 'cutoff': 0.7731818004736171, 'grm_norm': 'cosine', 'self_loops': False, 'use_snp_selection': False}. Best is trial 56 with value: 0.3094738320869709.
[I 2025-12-08 10:37:37,216] Trial 57 finished with value: 0.0 and parameters: {'model_type': 'gcn', 'hidden_dims': '[256, 128, 64]', 'dropout': 0.525921696867337, 'batch_norm': False, 'lr': 0.0022610987945902946, 'weight_decay': 1.3878805819644431e-07, 'epochs': 126, 'loss': 'mae', 'optimizer': 'adam', 'graph_mode': 'cutoff', 'cutoff': 0.8747113195496689, 'grm_norm': 'cosine', 'self_loops': False, 'use_snp_selection': False}. Best is trial 56 with value: 0.3094738320869709.
[I 2025-12-08 10:38:05,735] Trial 58 finished with value: 0.3041696279872169 and parameters: {'model_type': 'gcn', 'hidden_dims': '[512, 256]', 'dropout': 0.5800550302210838, 'batch_norm': True, 'lr': 0.0008543953670272611, 'weight_decay': 2.1972807267473037e-07, 'epochs': 104, 'loss': 'mae', 'optimizer': 'adam', 'graph_mode': 'cutoff', 'cutoff': 0.7864422465511478, 'grm_norm': 'cosine', 'self_loops': True, 'use_snp_selection': False}. Best is trial 56 with value: 0.3094738320869709.
[I 2025-12-08 10:38:18,573] Trial 59 finished with value: 0.2566850030004872 and parameters: {'model_type': 'gcn', 'hidden_dims': '[128, 64]', 'dropout': 0.4923757848293242, 'batch_norm': True, 'lr': 0.0005591903282634971, 'weight_decay': 2.5164566021241886e-07, 'epochs': 69, 'loss': 'mae', 'optimizer': 'adam', 'graph_mode': 'cutoff', 'cutoff': 0.36622772469969717, 'grm_norm': 'cosine', 'self_loops': False, 'use_snp_selection': True, 'num_snps': 17832}. Best is trial 56 with value: 0.3094738320869709.
[I 2025-12-08 10:38:34,948] Trial 60 finished with value: 0.3056443016061773 and parameters: {'model_type': 'gcn', 'hidden_dims': '[512, 64]', 'dropout': 0.21306096151184672, 'batch_norm': True, 'lr': 0.0021339176381143894, 'weight_decay': 1.2901383210188765e-07, 'epochs': 54, 'loss': 'mae', 'optimizer': 'adam', 'graph_mode': 'cutoff', 'cutoff': 0.7280487467256027, 'grm_norm': 'cosine', 'self_loops': False, 'use_snp_selection': False}. Best is trial 56 with value: 0.3094738320869709.
[I 2025-12-08 10:38:51,195] Trial 61 finished with value: 0.3055383712304031 and parameters: {'model_type': 'gcn', 'hidden_dims': '[512, 64]', 'dropout': 0.2156787072109448, 'batch_norm': True, 'lr': 0.0021126776080504913, 'weight_decay': 1.0271589728451278e-07, 'epochs': 52, 'loss': 'mae', 'optimizer': 'adam', 'graph_mode': 'cutoff', 'cutoff': 0.7320772757311114, 'grm_norm': 'cosine', 'self_loops': False, 'use_snp_selection': False}. Best is trial 56 with value: 0.3094738320869709.
[I 2025-12-08 10:39:07,516] Trial 62 finished with value: 0.3035079591097841 and parameters: {'model_type': 'gcn', 'hidden_dims': '[512, 64]', 'dropout': 0.20516497411436674, 'batch_norm': True, 'lr': 0.0021672008550345885, 'weight_decay': 1.9485144881311384e-07, 'epochs': 54, 'loss': 'mae', 'optimizer': 'adam', 'graph_mode': 'cutoff', 'cutoff': 0.7587601296628153, 'grm_norm': 'cosine', 'self_loops': False, 'use_snp_selection': False}. Best is trial 56 with value: 0.3094738320869709.
[I 2025-12-08 10:39:23,478] Trial 63 finished with value: 0.24888505392316024 and parameters: {'model_type': 'gcn', 'hidden_dims': '[512, 64]', 'dropout': 0.18330739957587053, 'batch_norm': True, 'lr': 1.000351240215956e-05, 'weight_decay': 1.4584261252674736e-07, 'epochs': 52, 'loss': 'mae', 'optimizer': 'adam', 'graph_mode': 'cutoff', 'cutoff': 0.8185675622366724, 'grm_norm': 'cosine', 'self_loops': False, 'use_snp_selection': False}. Best is trial 56 with value: 0.3094738320869709.
[I 2025-12-08 10:39:44,305] Trial 64 finished with value: 0.3005899849434075 and parameters: {'model_type': 'gcn', 'hidden_dims': '[512, 64]', 'dropout': 0.22597146181895697, 'batch_norm': True, 'lr': 0.0027749773899322506, 'weight_decay': 0.00010011049411981347, 'epochs': 73, 'loss': 'mae', 'optimizer': 'adam', 'graph_mode': 'cutoff', 'cutoff': 0.7768179540928719, 'grm_norm': 'none', 'self_loops': False, 'use_snp_selection': False}. Best is trial 56 with value: 0.3094738320869709.
[I 2025-12-08 10:40:08,359] Trial 65 finished with value: 0.3029823054946402 and parameters: {'model_type': 'gcn', 'hidden_dims': '[512, 64]', 'dropout': 0.23274320565377807, 'batch_norm': True, 'lr': 0.003801554415224821, 'weight_decay': 1.3514487065641699e-07, 'epochs': 86, 'loss': 'mae', 'optimizer': 'adam', 'graph_mode': 'cutoff', 'cutoff': 0.7380871378866222, 'grm_norm': 'cosine', 'self_loops': False, 'use_snp_selection': False}. Best is trial 56 with value: 0.3094738320869709.
[I 2025-12-08 10:40:26,914] Trial 66 finished with value: 0.2543014846774239 and parameters: {'model_type': 'gcn', 'hidden_dims': '[512, 64]', 'dropout': 0.152823552086255, 'batch_norm': True, 'lr': 0.005016730853456486, 'weight_decay': 2.943773499323376e-07, 'epochs': 61, 'loss': 'mae', 'optimizer': 'adam', 'graph_mode': 'cutoff', 'cutoff': 0.22314290638029333, 'grm_norm': 'cosine', 'self_loops': False, 'use_snp_selection': False}. Best is trial 56 with value: 0.3094738320869709.
[I 2025-12-08 10:40:42,737] Trial 67 finished with value: 0.006189875572354854 and parameters: {'model_type': 'gcn', 'hidden_dims': '[512, 64]', 'dropout': 0.2813786379050909, 'batch_norm': False, 'lr': 0.0015865391958358192, 'weight_decay': 2.1097011595336992e-07, 'epochs': 50, 'loss': 'mae', 'optimizer': 'adam', 'graph_mode': 'knn', 'knn_k': 5, 'weighted_edges': False, 'symmetrize_mode': 'union', 'self_loops': True, 'use_snp_selection': False}. Best is trial 56 with value: 0.3094738320869709.
[I 2025-12-08 10:41:09,466] Trial 68 finished with value: 0.29428158417533207 and parameters: {'model_type': 'gcn', 'hidden_dims': '[512, 64]', 'dropout': 0.18197815897282205, 'batch_norm': True, 'lr': 0.0011725774744145029, 'weight_decay': 1.0204013716371873e-06, 'epochs': 96, 'loss': 'mse', 'optimizer': 'adam', 'graph_mode': 'cutoff', 'cutoff': 0.8943580751480499, 'grm_norm': 'cosine', 'self_loops': False, 'use_snp_selection': False}. Best is trial 56 with value: 0.3094738320869709.
[I 2025-12-08 10:41:19,841] Trial 69 finished with value: 0.30653329114260086 and parameters: {'model_type': 'gcn', 'hidden_dims': '[256, 128]', 'dropout': 0.2329647550574259, 'batch_norm': True, 'lr': 0.0024687284844150345, 'weight_decay': 3.8004111068471476e-07, 'epochs': 69, 'loss': 'mae', 'optimizer': 'adam', 'graph_mode': 'cutoff', 'cutoff': 0.8114591028662257, 'grm_norm': 'gcn', 'self_loops': False, 'use_snp_selection': False}. Best is trial 56 with value: 0.3094738320869709.
[I 2025-12-08 10:41:26,871] Trial 70 finished with value: 0.3063905038484831 and parameters: {'model_type': 'gcn', 'hidden_dims': '[256, 128]', 'dropout': 0.26186463820454825, 'batch_norm': True, 'lr': 0.009334663005573889, 'weight_decay': 6.40263161422384e-07, 'epochs': 40, 'loss': 'mae', 'optimizer': 'adam', 'graph_mode': 'cutoff', 'cutoff': 0.8579267306162985, 'grm_norm': 'gcn', 'self_loops': False, 'use_snp_selection': False}. Best is trial 56 with value: 0.3094738320869709.
[I 2025-12-08 10:41:37,061] Trial 71 finished with value: 0.307748822218337 and parameters: {'model_type': 'gcn', 'hidden_dims': '[256, 128]', 'dropout': 0.2569233959455831, 'batch_norm': True, 'lr': 0.00852702109556081, 'weight_decay': 6.092021595263439e-07, 'epochs': 67, 'loss': 'mae', 'optimizer': 'adam', 'graph_mode': 'cutoff', 'cutoff': 0.8497604925075553, 'grm_norm': 'gcn', 'self_loops': False, 'use_snp_selection': False}. Best is trial 56 with value: 0.3094738320869709.
[I 2025-12-08 10:41:47,837] Trial 72 finished with value: 0.30481911494174485 and parameters: {'model_type': 'gcn', 'hidden_dims': '[256, 128]', 'dropout': 0.2550561342214331, 'batch_norm': True, 'lr': 0.00872819695726036, 'weight_decay': 6.941206269484066e-07, 'epochs': 71, 'loss': 'mae', 'optimizer': 'adam', 'graph_mode': 'cutoff', 'cutoff': 0.8621876920295704, 'grm_norm': 'gcn', 'self_loops': False, 'use_snp_selection': False}. Best is trial 56 with value: 0.3094738320869709.
[I 2025-12-08 10:41:55,151] Trial 73 finished with value: 0.2998651032529869 and parameters: {'model_type': 'gcn', 'hidden_dims': '[256, 128]', 'dropout': 0.2699201226219319, 'batch_norm': True, 'lr': 0.0061682534589275785, 'weight_decay': 4.697985482342144e-07, 'epochs': 41, 'loss': 'mae', 'optimizer': 'adam', 'graph_mode': 'cutoff', 'cutoff': 0.8207540403711334, 'grm_norm': 'gcn', 'self_loops': False, 'use_snp_selection': False}. Best is trial 56 with value: 0.3094738320869709.
[I 2025-12-08 10:42:04,882] Trial 74 finished with value: 0.30371639516195703 and parameters: {'model_type': 'gcn', 'hidden_dims': '[256, 128]', 'dropout': 0.3493850645220016, 'batch_norm': True, 'lr': 0.007003767615601373, 'weight_decay': 9.770010263114265e-07, 'epochs': 62, 'loss': 'mae', 'optimizer': 'adam', 'graph_mode': 'cutoff', 'cutoff': 0.8564269268358147, 'grm_norm': 'gcn', 'self_loops': False, 'use_snp_selection': False}. Best is trial 56 with value: 0.3094738320869709.
[I 2025-12-08 10:42:17,294] Trial 75 finished with value: 0.3057807734592304 and parameters: {'model_type': 'gcn', 'hidden_dims': '[256, 128]', 'dropout': 0.2914572859688436, 'batch_norm': True, 'lr': 0.009124822502250838, 'weight_decay': 3.9243465938706874e-07, 'epochs': 86, 'loss': 'mae', 'optimizer': 'adam', 'graph_mode': 'cutoff', 'cutoff': 0.8149604784248581, 'grm_norm': 'gcn', 'self_loops': False, 'use_snp_selection': False}. Best is trial 56 with value: 0.3094738320869709.
[I 2025-12-08 10:42:28,415] Trial 76 finished with value: 0.3026246343162361 and parameters: {'model_type': 'gcn', 'hidden_dims': '[256, 128]', 'dropout': 0.24654214065707064, 'batch_norm': True, 'lr': 0.003567194682379759, 'weight_decay': 5.903470989792549e-07, 'epochs': 75, 'loss': 'mae', 'optimizer': 'adam', 'graph_mode': 'cutoff', 'cutoff': 0.7996009448915008, 'grm_norm': 'gcn', 'self_loops': False, 'use_snp_selection': False}. Best is trial 56 with value: 0.3094738320869709.
[I 2025-12-08 10:42:38,220] Trial 77 finished with value: 0.30702179295523224 and parameters: {'model_type': 'gcn', 'hidden_dims': '[256, 128]', 'dropout': 0.32245511525872933, 'batch_norm': True, 'lr': 0.005022193188892969, 'weight_decay': 2.4585867211729096e-06, 'epochs': 64, 'loss': 'mae', 'optimizer': 'adam', 'graph_mode': 'cutoff', 'cutoff': 0.8694281992282775, 'grm_norm': 'gcn', 'self_loops': False, 'use_snp_selection': False}. Best is trial 56 with value: 0.3094738320869709.
[I 2025-12-08 10:43:08,646] Trial 78 finished with value: 0.2606187133093065 and parameters: {'model_type': 'gcn', 'hidden_dims': '[256, 128]', 'dropout': 0.30581132151844104, 'batch_norm': True, 'lr': 0.005010306505840068, 'weight_decay': 2.6694751743201915e-06, 'epochs': 104, 'loss': 'mae', 'optimizer': 'adam', 'graph_mode': 'knn', 'knn_k': 8, 'weighted_edges': True, 'symmetrize_mode': 'mutual', 'self_loops': False, 'use_snp_selection': True, 'num_snps': 59447}. Best is trial 56 with value: 0.3094738320869709.
[I 2025-12-08 10:43:18,568] Trial 79 finished with value: 0.28388366345249144 and parameters: {'model_type': 'gcn', 'hidden_dims': '[256, 128]', 'dropout': 0.3358653624677353, 'batch_norm': True, 'lr': 2.882576729384121e-05, 'weight_decay': 5.5857303842866985e-06, 'epochs': 65, 'loss': 'mse', 'optimizer': 'adam', 'graph_mode': 'cutoff', 'cutoff': 0.8978836336704401, 'grm_norm': 'gcn', 'self_loops': True, 'use_snp_selection': False}. Best is trial 56 with value: 0.3094738320869709.
[I 2025-12-08 10:43:49,032] Trial 80 finished with value: 0.0013798936720699675 and parameters: {'model_type': 'gcn', 'hidden_dims': '[256, 128]', 'dropout': 0.31263919646681576, 'batch_norm': False, 'lr': 0.007462120655706662, 'weight_decay': 2.0373778536663792e-06, 'epochs': 245, 'loss': 'mae', 'optimizer': 'adam', 'graph_mode': 'cutoff', 'cutoff': 0.8785568932659471, 'grm_norm': 'gcn', 'self_loops': False, 'use_snp_selection': False}. Best is trial 56 with value: 0.3094738320869709.
[I 2025-12-08 10:43:56,532] Trial 81 finished with value: 0.3079204161905824 and parameters: {'model_type': 'gcn', 'hidden_dims': '[256, 128]', 'dropout': 0.2351210103618315, 'batch_norm': True, 'lr': 0.004154449237369171, 'weight_decay': 1.3431678566158344e-06, 'epochs': 44, 'loss': 'mae', 'optimizer': 'adam', 'graph_mode': 'cutoff', 'cutoff': 0.8380165195778908, 'grm_norm': 'gcn', 'self_loops': False, 'use_snp_selection': False}. Best is trial 56 with value: 0.3094738320869709.
[I 2025-12-08 10:44:04,504] Trial 82 finished with value: 0.301898755679731 and parameters: {'model_type': 'gcn', 'hidden_dims': '[256, 128]', 'dropout': 0.23071950239681466, 'batch_norm': True, 'lr': 0.009864527267273887, 'weight_decay': 2.3693267033781008e-05, 'epochs': 48, 'loss': 'mae', 'optimizer': 'adam', 'graph_mode': 'cutoff', 'cutoff': 0.8443571693053105, 'grm_norm': 'gcn', 'self_loops': False, 'use_snp_selection': False}. Best is trial 56 with value: 0.3094738320869709.
[I 2025-12-08 10:44:33,631] Trial 83 finished with value: 0.30055064472259574 and parameters: {'model_type': 'gcn', 'hidden_dims': '[256, 128]', 'dropout': 0.2738254970958497, 'batch_norm': True, 'lr': 0.004305531418680248, 'weight_decay': 8.833450211871939e-07, 'epochs': 231, 'loss': 'mae', 'optimizer': 'adam', 'graph_mode': 'cutoff', 'cutoff': 0.8332822723418538, 'grm_norm': 'gcn', 'self_loops': False, 'use_snp_selection': False}. Best is trial 56 with value: 0.3094738320869709.
[I 2025-12-08 10:44:42,950] Trial 84 finished with value: 0.30370369800683317 and parameters: {'model_type': 'gcn', 'hidden_dims': '[256, 128]', 'dropout': 0.23881675945870068, 'batch_norm': True, 'lr': 0.006148339146868582, 'weight_decay': 1.2507752100310487e-06, 'epochs': 60, 'loss': 'mae', 'optimizer': 'adam', 'graph_mode': 'cutoff', 'cutoff': 0.8649818459906159, 'grm_norm': 'gcn', 'self_loops': False, 'use_snp_selection': False}. Best is trial 56 with value: 0.3094738320869709.
[I 2025-12-08 10:44:54,467] Trial 85 finished with value: 0.3057229256775168 and parameters: {'model_type': 'gcn', 'hidden_dims': '[256, 128]', 'dropout': 0.26260422302850794, 'batch_norm': True, 'lr': 0.00012999905564468482, 'weight_decay': 6.816572176590413e-07, 'epochs': 77, 'loss': 'mae', 'optimizer': 'adam', 'graph_mode': 'cutoff', 'cutoff': 0.8070314541157921, 'grm_norm': 'gcn', 'self_loops': False, 'use_snp_selection': False}. Best is trial 56 with value: 0.3094738320869709.
[I 2025-12-08 10:45:06,709] Trial 86 finished with value: 0.3065640018048745 and parameters: {'model_type': 'gcn', 'hidden_dims': '[256, 128]', 'dropout': 0.3319921591589288, 'batch_norm': True, 'lr': 0.002541879643562198, 'weight_decay': 3.493682107271463e-07, 'epochs': 84, 'loss': 'mae', 'optimizer': 'adam', 'graph_mode': 'cutoff', 'cutoff': 0.781470265152296, 'grm_norm': 'gcn', 'self_loops': False, 'use_snp_selection': False}. Best is trial 56 with value: 0.3094738320869709.
