[I 2025-12-08 20:11:03,648] Trial 138 finished with value: 0.3149165780082922 and parameters: {'model_type': 'gcn', 'hidden_dims': '[512, 128]', 'dropout': 0.3726684922336013, 'batch_norm': True, 'lr': 0.0027111320632959733, 'weight_decay': 5.084903182575242e-07, 'epochs': 206, 'loss': 'mse', 'optimizer': 'adam', 'graph_mode': 'cutoff', 'cutoff': 0.8162031950071191, 'grm_norm': 'cosine_then_gcn', 'self_loops': True, 'use_snp_selection': False}. Best is trial 121 with value: 0.31961821300847115.
[I 2025-12-08 20:12:10,358] Trial 139 finished with value: -0.0315947075001652 and parameters: {'model_type': 'gcn', 'hidden_dims': '[512, 128]', 'dropout': 0.3086862224062092, 'batch_norm': False, 'lr': 0.0034540288756919313, 'weight_decay': 0.00029278479349435885, 'epochs': 263, 'loss': 'mse', 'optimizer': 'adam', 'graph_mode': 'cutoff', 'cutoff': 0.864405158958837, 'grm_norm': 'none', 'self_loops': True, 'use_snp_selection': False}. Best is trial 121 with value: 0.31961821300847115.
[I 2025-12-08 20:13:21,130] Trial 140 finished with value: 0.31374887553934033 and parameters: {'model_type': 'gcn', 'hidden_dims': '[512, 256]', 'dropout': 0.41800146480107925, 'batch_norm': True, 'lr': 0.0020985745189056612, 'weight_decay': 1.1180621843087193e-06, 'epochs': 276, 'loss': 'mse', 'optimizer': 'adam', 'graph_mode': 'cutoff', 'cutoff': 0.8798762518248908, 'grm_norm': 'cosine_then_gcn', 'self_loops': True, 'use_snp_selection': False}. Best is trial 121 with value: 0.31961821300847115.
[I 2025-12-08 20:14:29,873] Trial 141 finished with value: 0.31260025524879687 and parameters: {'model_type': 'gcn', 'hidden_dims': '[512, 128]', 'dropout': 0.406805045429577, 'batch_norm': True, 'lr': 0.008537579045023386, 'weight_decay': 2.3840688249029938e-07, 'epochs': 269, 'loss': 'mse', 'optimizer': 'adam', 'graph_mode': 'cutoff', 'cutoff': 0.8437768123132475, 'grm_norm': 'cosine_then_gcn', 'self_loops': True, 'use_snp_selection': False}. Best is trial 121 with value: 0.31961821300847115.
[I 2025-12-08 20:15:51,154] Trial 142 finished with value: 0.3148877603949344 and parameters: {'model_type': 'gcn', 'hidden_dims': '[512, 128]', 'dropout': 0.38326723780642435, 'batch_norm': True, 'lr': 0.009007391150578857, 'weight_decay': 1.6749864992510133e-07, 'epochs': 322, 'loss': 'mse', 'optimizer': 'adam', 'graph_mode': 'cutoff', 'cutoff': 0.8006916332619886, 'grm_norm': 'cosine_then_gcn', 'self_loops': True, 'use_snp_selection': False}. Best is trial 121 with value: 0.31961821300847115.
[I 2025-12-08 20:17:08,805] Trial 143 finished with value: 0.3127721746839773 and parameters: {'model_type': 'gcn', 'hidden_dims': '[512, 128]', 'dropout': 0.5418129672194537, 'batch_norm': True, 'lr': 0.007205624258588272, 'weight_decay': 1.2693505365350548e-07, 'epochs': 306, 'loss': 'mse', 'optimizer': 'adam', 'graph_mode': 'cutoff', 'cutoff': 0.8155953338476625, 'grm_norm': 'cosine_then_gcn', 'self_loops': True, 'use_snp_selection': False}. Best is trial 121 with value: 0.31961821300847115.
[I 2025-12-08 20:18:19,849] Trial 144 finished with value: 0.3169646898349802 and parameters: {'model_type': 'gcn', 'hidden_dims': '[512, 128]', 'dropout': 0.35878678795422125, 'batch_norm': True, 'lr': 0.005492834047867607, 'weight_decay': 3.614128907442392e-07, 'epochs': 278, 'loss': 'mse', 'optimizer': 'adam', 'graph_mode': 'cutoff', 'cutoff': 0.8269654429775659, 'grm_norm': 'cosine_then_gcn', 'self_loops': True, 'use_snp_selection': False}. Best is trial 121 with value: 0.31961821300847115.
[I 2025-12-08 20:19:21,949] Trial 145 finished with value: 0.31504840877959783 and parameters: {'model_type': 'gcn', 'hidden_dims': '[512, 128]', 'dropout': 0.34542412989665155, 'batch_norm': True, 'lr': 0.005998996220044847, 'weight_decay': 2.0737163803695824e-07, 'epochs': 241, 'loss': 'mse', 'optimizer': 'adam', 'graph_mode': 'cutoff', 'cutoff': 0.85412609232062, 'grm_norm': 'cosine_then_gcn', 'self_loops': True, 'use_snp_selection': False}. Best is trial 121 with value: 0.31961821300847115.
[I 2025-12-08 20:20:28,110] Trial 146 finished with value: 0.312897511524521 and parameters: {'model_type': 'gcn', 'hidden_dims': '[512, 128]', 'dropout': 0.49321656186732954, 'batch_norm': True, 'lr': 0.001082079097777919, 'weight_decay': 1.1134333153625373e-05, 'epochs': 259, 'loss': 'mse', 'optimizer': 'adam', 'graph_mode': 'cutoff', 'cutoff': 0.7470725656425729, 'grm_norm': 'cosine_then_gcn', 'self_loops': True, 'use_snp_selection': False}. Best is trial 121 with value: 0.31961821300847115.
[I 2025-12-08 20:21:41,608] Trial 147 finished with value: 0.3091287255288316 and parameters: {'model_type': 'gcn', 'hidden_dims': '[512, 256]', 'dropout': 0.5110173731070496, 'batch_norm': True, 'lr': 0.008304837583123103, 'weight_decay': 4.787673076530432e-06, 'epochs': 285, 'loss': 'mse', 'optimizer': 'adam', 'graph_mode': 'cutoff', 'cutoff': 0.770089248989557, 'grm_norm': 'cosine', 'self_loops': True, 'use_snp_selection': False}. Best is trial 121 with value: 0.31961821300847115.
[I 2025-12-08 20:22:07,325] Trial 148 finished with value: 0.3142070714754534 and parameters: {'model_type': 'gcn', 'hidden_dims': '[256, 128]', 'dropout': 0.4345906635463817, 'batch_norm': True, 'lr': 0.009838575679474697, 'weight_decay': 3.033615792489106e-07, 'epochs': 194, 'loss': 'mse', 'optimizer': 'adam', 'graph_mode': 'cutoff', 'cutoff': 0.7898611506121462, 'grm_norm': 'cosine_then_gcn', 'self_loops': True, 'use_snp_selection': False}. Best is trial 121 with value: 0.31961821300847115.
[I 2025-12-08 20:23:16,152] Trial 149 finished with value: 0.3145887762620434 and parameters: {'model_type': 'gcn', 'hidden_dims': '[512, 128]', 'dropout': 0.5298549407190731, 'batch_norm': True, 'lr': 0.004247214485980342, 'weight_decay': 1.6010300757972816e-07, 'epochs': 270, 'loss': 'mse', 'optimizer': 'adam', 'graph_mode': 'cutoff', 'cutoff': 0.8720995337611668, 'grm_norm': 'cosine_then_gcn', 'self_loops': True, 'use_snp_selection': False}. Best is trial 121 with value: 0.31961821300847115.
[I 2025-12-08 20:23:53,654] Trial 0 finished with value: 0.262383273546849 and parameters: {'model_type': 'gcn', 'hidden_dims': '[128, 64]', 'dropout': 0.199031432379812, 'batch_norm': True, 'lr': 1.8408544111075823e-05, 'weight_decay': 5.5136510071208614e-05, 'epochs': 336, 'loss': 'mae', 'optimizer': 'adam', 'graph_mode': 'knn', 'knn_k': 8, 'weighted_edges': True, 'symmetrize_mode': 'mutual', 'self_loops': True, 'use_snp_selection': True, 'num_snps': 27173}. Best is trial 0 with value: 0.262383273546849.
[I 2025-12-08 20:24:33,212] Trial 1 finished with value: 0.18347246051212346 and parameters: {'model_type': 'gcn', 'hidden_dims': '[256, 128, 64]', 'dropout': 0.5543244404043342, 'batch_norm': True, 'lr': 7.981787657617978e-05, 'weight_decay': 2.8571789869344834e-07, 'epochs': 297, 'loss': 'mae', 'optimizer': 'adam', 'graph_mode': 'cutoff', 'cutoff': 0.3392632777751686, 'grm_norm': 'gcn', 'self_loops': False, 'use_snp_selection': False}. Best is trial 0 with value: 0.262383273546849.
[I 2025-12-08 20:25:32,477] Trial 2 finished with value: 0.22626133647228558 and parameters: {'model_type': 'gcn', 'hidden_dims': '[512, 64]', 'dropout': 0.32815227354739207, 'batch_norm': True, 'lr': 0.000619605044204259, 'weight_decay': 0.0004086269831625786, 'epochs': 206, 'loss': 'mse', 'optimizer': 'adam', 'graph_mode': 'knn', 'knn_k': 4, 'weighted_edges': True, 'symmetrize_mode': 'union', 'self_loops': True, 'use_snp_selection': True, 'num_snps': 53035}. Best is trial 0 with value: 0.262383273546849.
[I 2025-12-08 20:26:01,503] Trial 3 finished with value: 0.21147566663003356 and parameters: {'model_type': 'gcn', 'hidden_dims': '[256, 128]', 'dropout': 0.23110783056597514, 'batch_norm': True, 'lr': 8.11311593386298e-05, 'weight_decay': 9.296158109581328e-07, 'epochs': 213, 'loss': 'mse', 'optimizer': 'adam', 'graph_mode': 'knn', 'knn_k': 10, 'weighted_edges': True, 'symmetrize_mode': 'mutual', 'self_loops': True, 'use_snp_selection': False}. Best is trial 0 with value: 0.262383273546849.
[I 2025-12-08 20:26:16,671] Trial 4 finished with value: 0.3142850301877206 and parameters: {'model_type': 'gcn', 'hidden_dims': '[512, 256]', 'dropout': 0.2753281956415665, 'batch_norm': True, 'lr': 0.00034435188114839693, 'weight_decay': 4.9416012835950194e-05, 'epochs': 89, 'loss': 'mae', 'optimizer': 'adam', 'graph_mode': 'cutoff', 'cutoff': 0.820078967317394, 'grm_norm': 'none', 'self_loops': False, 'use_snp_selection': True, 'num_snps': 12674}. Best is trial 4 with value: 0.3142850301877206.
[I 2025-12-08 20:26:42,737] Trial 5 finished with value: 0.292249964635045 and parameters: {'model_type': 'gcn', 'hidden_dims': '[128, 64]', 'dropout': 0.5611163934517731, 'batch_norm': True, 'lr': 0.0003984856210762587, 'weight_decay': 1.1466743517565185e-07, 'epochs': 344, 'loss': 'mae', 'optimizer': 'adam', 'graph_mode': 'cutoff', 'cutoff': 0.6089370799714728, 'grm_norm': 'gcn', 'self_loops': True, 'use_snp_selection': False}. Best is trial 4 with value: 0.3142850301877206.
[I 2025-12-08 20:27:05,961] Trial 6 finished with value: 0.2851429109861192 and parameters: {'model_type': 'gcn', 'hidden_dims': '[128, 64]', 'dropout': 0.31805912766941713, 'batch_norm': True, 'lr': 1.2361026034262557e-05, 'weight_decay': 6.492620232791903e-06, 'epochs': 271, 'loss': 'mse', 'optimizer': 'adam', 'graph_mode': 'cutoff', 'cutoff': 0.6193362582230448, 'grm_norm': 'cosine', 'self_loops': False, 'use_snp_selection': True, 'num_snps': 28594}. Best is trial 4 with value: 0.3142850301877206.
[I 2025-12-08 20:27:26,646] Trial 7 finished with value: 0.2367419023587444 and parameters: {'model_type': 'gcn', 'hidden_dims': '[512, 64]', 'dropout': 0.471337288649717, 'batch_norm': True, 'lr': 2.239693207292708e-05, 'weight_decay': 2.263166635514082e-06, 'epochs': 69, 'loss': 'mse', 'optimizer': 'adam', 'graph_mode': 'cutoff', 'cutoff': 0.4056820886426376, 'grm_norm': 'cosine', 'self_loops': False, 'use_snp_selection': False}. Best is trial 4 with value: 0.3142850301877206.
[I 2025-12-08 20:28:05,693] Trial 8 finished with value: 0.25837487894594136 and parameters: {'model_type': 'gcn', 'hidden_dims': '[512, 256]', 'dropout': 0.20659328268932406, 'batch_norm': False, 'lr': 8.93315124361372e-05, 'weight_decay': 0.00028987480727919035, 'epochs': 136, 'loss': 'mae', 'optimizer': 'adam', 'graph_mode': 'knn', 'knn_k': 3, 'weighted_edges': False, 'symmetrize_mode': 'union', 'self_loops': False, 'use_snp_selection': True, 'num_snps': 43128}. Best is trial 4 with value: 0.3142850301877206.
[I 2025-12-08 20:28:48,930] Trial 9 finished with value: -0.0008530384812977132 and parameters: {'model_type': 'gcn', 'hidden_dims': '[512, 256]', 'dropout': 0.2888209592870401, 'batch_norm': False, 'lr': 0.004734648143129892, 'weight_decay': 1.5879705591356368e-06, 'epochs': 163, 'loss': 'mse', 'optimizer': 'adam', 'graph_mode': 'cutoff', 'cutoff': 0.5984899797909019, 'grm_norm': 'cosine', 'self_loops': True, 'use_snp_selection': False}. Best is trial 4 with value: 0.3142850301877206.
[I 2025-12-08 20:28:58,586] Trial 10 finished with value: 0.25258605662656725 and parameters: {'model_type': 'gcn', 'hidden_dims': '[512, 128]', 'dropout': 0.11372025982957354, 'batch_norm': False, 'lr': 0.0023343012062770553, 'weight_decay': 4.14440562940608e-05, 'epochs': 41, 'loss': 'mae', 'optimizer': 'adam', 'graph_mode': 'cutoff', 'cutoff': 0.8740100033033124, 'grm_norm': 'none', 'self_loops': False, 'use_snp_selection': True, 'num_snps': 3859}. Best is trial 4 with value: 0.3142850301877206.
[I 2025-12-08 20:29:09,133] Trial 11 finished with value: 0.30206540759845396 and parameters: {'model_type': 'gcn', 'hidden_dims': '[128, 64]', 'dropout': 0.44863014119095845, 'batch_norm': True, 'lr': 0.0005943392021247852, 'weight_decay': 1.0655358607693621e-07, 'epochs': 110, 'loss': 'mae', 'optimizer': 'adam', 'graph_mode': 'cutoff', 'cutoff': 0.8568899271933978, 'grm_norm': 'cosine_then_gcn', 'self_loops': True, 'use_snp_selection': False}. Best is trial 4 with value: 0.3142850301877206.
[I 2025-12-08 20:29:21,689] Trial 12 finished with value: 0.29002887987339443 and parameters: {'model_type': 'gcn', 'hidden_dims': '[512, 256]', 'dropout': 0.42758862319180935, 'batch_norm': True, 'lr': 0.0012059085553112938, 'weight_decay': 3.482253699955131e-05, 'epochs': 103, 'loss': 'mae', 'optimizer': 'adam', 'graph_mode': 'cutoff', 'cutoff': 0.8919050080438428, 'grm_norm': 'cosine_then_gcn', 'self_loops': True, 'use_snp_selection': True, 'num_snps': 6176}. Best is trial 4 with value: 0.3142850301877206.
[I 2025-12-08 20:29:36,087] Trial 13 finished with value: 0.3089239534747182 and parameters: {'model_type': 'gcn', 'hidden_dims': '[256, 128]', 'dropout': 0.4452783958423849, 'batch_norm': True, 'lr': 0.00028764898471530923, 'weight_decay': 8.746795324277564e-06, 'epochs': 96, 'loss': 'mae', 'optimizer': 'adam', 'graph_mode': 'cutoff', 'cutoff': 0.7596101551526167, 'grm_norm': 'cosine_then_gcn', 'self_loops': False, 'use_snp_selection': False}. Best is trial 4 with value: 0.3142850301877206.
[I 2025-12-08 20:29:50,293] Trial 14 finished with value: 0.2948926788362184 and parameters: {'model_type': 'gcn', 'hidden_dims': '[256, 128]', 'dropout': 0.39299544085603144, 'batch_norm': False, 'lr': 0.00022405607028575474, 'weight_decay': 1.1320027041313357e-05, 'epochs': 80, 'loss': 'mae', 'optimizer': 'adam', 'graph_mode': 'cutoff', 'cutoff': 0.7531033351051849, 'grm_norm': 'none', 'self_loops': False, 'use_snp_selection': True, 'num_snps': 16639}. Best is trial 4 with value: 0.3142850301877206.
[I 2025-12-08 20:30:12,885] Trial 15 finished with value: 0.3090730639821442 and parameters: {'model_type': 'gcn', 'hidden_dims': '[256, 128]', 'dropout': 0.49413637725410897, 'batch_norm': True, 'lr': 0.00018483836341752578, 'weight_decay': 0.0009750094345805517, 'epochs': 165, 'loss': 'mae', 'optimizer': 'adam', 'graph_mode': 'cutoff', 'cutoff': 0.7370325069980869, 'grm_norm': 'cosine_then_gcn', 'self_loops': False, 'use_snp_selection': False}. Best is trial 4 with value: 0.3142850301877206.
[I 2025-12-08 20:30:56,060] Trial 16 finished with value: 0.3039546798670564 and parameters: {'model_type': 'gcn', 'hidden_dims': '[512, 128]', 'dropout': 0.5065564400563585, 'batch_norm': True, 'lr': 0.00014113473149325123, 'weight_decay': 0.000759056720664848, 'epochs': 162, 'loss': 'mae', 'optimizer': 'adam', 'graph_mode': 'cutoff', 'cutoff': 0.7493987499516714, 'grm_norm': 'none', 'self_loops': False, 'use_snp_selection': False}. Best is trial 4 with value: 0.3142850301877206.
[I 2025-12-08 20:31:19,506] Trial 17 finished with value: 0.262060008707912 and parameters: {'model_type': 'gcn', 'hidden_dims': '[256, 128, 64]', 'dropout': 0.37526706473388166, 'batch_norm': True, 'lr': 3.8661066828267564e-05, 'weight_decay': 0.00017718199243863008, 'epochs': 236, 'loss': 'mae', 'optimizer': 'adam', 'graph_mode': 'cutoff', 'cutoff': 0.5062556644593699, 'grm_norm': 'cosine_then_gcn', 'self_loops': False, 'use_snp_selection': True, 'num_snps': 18293}. Best is trial 4 with value: 0.3142850301877206.
[I 2025-12-08 20:31:46,308] Trial 18 finished with value: 0.28938334736163196 and parameters: {'model_type': 'gcn', 'hidden_dims': '[256, 128]', 'dropout': 0.11399899071862205, 'batch_norm': False, 'lr': 0.0017043973328785833, 'weight_decay': 9.871028913016058e-05, 'epochs': 156, 'loss': 'mae', 'optimizer': 'adam', 'graph_mode': 'knn', 'knn_k': 1, 'weighted_edges': False, 'symmetrize_mode': 'mutual', 'self_loops': False, 'use_snp_selection': True, 'num_snps': 37464}. Best is trial 4 with value: 0.3142850301877206.
[I 2025-12-08 20:32:22,533] Trial 19 finished with value: 0.2573809614303154 and parameters: {'model_type': 'gcn', 'hidden_dims': '[512, 256]', 'dropout': 0.27069887381936375, 'batch_norm': True, 'lr': 4.3090025338759115e-05, 'weight_decay': 0.0009695257262267141, 'epochs': 127, 'loss': 'mae', 'optimizer': 'adam', 'graph_mode': 'cutoff', 'cutoff': 0.2219358891087448, 'grm_norm': 'none', 'self_loops': False, 'use_snp_selection': False}. Best is trial 4 with value: 0.3142850301877206.
[I 2025-12-08 20:32:40,399] Trial 20 finished with value: 0.30990873462475277 and parameters: {'model_type': 'gcn', 'hidden_dims': '[512, 256]', 'dropout': 0.5974378051552097, 'batch_norm': True, 'lr': 0.0007664770650342675, 'weight_decay': 0.0001499560361104215, 'epochs': 57, 'loss': 'mae', 'optimizer': 'adam', 'graph_mode': 'cutoff', 'cutoff': 0.7020177797247076, 'grm_norm': 'none', 'self_loops': False, 'use_snp_selection': False}. Best is trial 4 with value: 0.3142850301877206.
[I 2025-12-08 20:32:55,514] Trial 21 finished with value: 0.31751353329443455 and parameters: {'model_type': 'gcn', 'hidden_dims': '[512, 256]', 'dropout': 0.5916123333422962, 'batch_norm': True, 'lr': 0.0008567606591408752, 'weight_decay': 0.00012392537541808173, 'epochs': 44, 'loss': 'mae', 'optimizer': 'adam', 'graph_mode': 'cutoff', 'cutoff': 0.719196624079298, 'grm_norm': 'none', 'self_loops': False, 'use_snp_selection': False}. Best is trial 21 with value: 0.31751353329443455.
[I 2025-12-08 20:33:09,648] Trial 22 finished with value: 0.313532906972644 and parameters: {'model_type': 'gcn', 'hidden_dims': '[512, 256]', 'dropout': 0.587082503480965, 'batch_norm': True, 'lr': 0.0009218789784853673, 'weight_decay': 0.00011117973581542534, 'epochs': 42, 'loss': 'mae', 'optimizer': 'adam', 'graph_mode': 'cutoff', 'cutoff': 0.6798766464147573, 'grm_norm': 'none', 'self_loops': False, 'use_snp_selection': False}. Best is trial 21 with value: 0.31751353329443455.
[I 2025-12-08 20:33:24,395] Trial 23 finished with value: 0.3076098853578998 and parameters: {'model_type': 'gcn', 'hidden_dims': '[512, 256]', 'dropout': 0.5551776758995971, 'batch_norm': True, 'lr': 0.0038436633055846823, 'weight_decay': 1.8311596091821517e-05, 'epochs': 45, 'loss': 'mae', 'optimizer': 'adam', 'graph_mode': 'cutoff', 'cutoff': 0.6774925719639979, 'grm_norm': 'none', 'self_loops': False, 'use_snp_selection': False}. Best is trial 21 with value: 0.31751353329443455.
[I 2025-12-08 20:33:46,632] Trial 24 finished with value: 0.3161097865604646 and parameters: {'model_type': 'gcn', 'hidden_dims': '[512, 256]', 'dropout': 0.5925100138457364, 'batch_norm': True, 'lr': 0.0013537561620181335, 'weight_decay': 8.53521105077768e-05, 'epochs': 76, 'loss': 'mae', 'optimizer': 'adam', 'graph_mode': 'cutoff', 'cutoff': 0.8219182722740115, 'grm_norm': 'none', 'self_loops': False, 'use_snp_selection': False}. Best is trial 21 with value: 0.31751353329443455.
[I 2025-12-08 20:34:08,060] Trial 25 finished with value: 0.3134816147061101 and parameters: {'model_type': 'gcn', 'hidden_dims': '[512, 256]', 'dropout': 0.5190648908498735, 'batch_norm': True, 'lr': 0.007859169786054061, 'weight_decay': 6.26189744282241e-05, 'epochs': 73, 'loss': 'mae', 'optimizer': 'adam', 'graph_mode': 'cutoff', 'cutoff': 0.8155410079661437, 'grm_norm': 'none', 'self_loops': False, 'use_snp_selection': False}. Best is trial 21 with value: 0.31751353329443455.
[I 2025-12-08 20:34:28,813] Trial 26 finished with value: 0.25093118795298536 and parameters: {'model_type': 'gcn', 'hidden_dims': '[512, 256]', 'dropout': 0.39959883404578056, 'batch_norm': False, 'lr': 0.00040345817281852857, 'weight_decay': 0.0002905689891941444, 'epochs': 128, 'loss': 'mse', 'optimizer': 'adam', 'graph_mode': 'knn', 'knn_k': 7, 'weighted_edges': False, 'symmetrize_mode': 'union', 'self_loops': False, 'use_snp_selection': True, 'num_snps': 15636}. Best is trial 21 with value: 0.31751353329443455.
[I 2025-12-08 20:34:53,940] Trial 27 finished with value: 0.31517255898985985 and parameters: {'model_type': 'gcn', 'hidden_dims': '[512, 256]', 'dropout': 0.17061104538794186, 'batch_norm': True, 'lr': 0.002290691783922565, 'weight_decay': 2.4540459149692465e-05, 'epochs': 88, 'loss': 'mae', 'optimizer': 'adam', 'graph_mode': 'cutoff', 'cutoff': 0.8304878893409929, 'grm_norm': 'none', 'self_loops': False, 'use_snp_selection': False}. Best is trial 21 with value: 0.31751353329443455.
[I 2025-12-08 20:35:25,084] Trial 28 finished with value: 0.3124248249980026 and parameters: {'model_type': 'gcn', 'hidden_dims': '[512, 256]', 'dropout': 0.16502445598549395, 'batch_norm': True, 'lr': 0.0026825790457334297, 'weight_decay': 2.2460966108452148e-05, 'epochs': 112, 'loss': 'mae', 'optimizer': 'adam', 'graph_mode': 'cutoff', 'cutoff': 0.8117554553003916, 'grm_norm': 'none', 'self_loops': False, 'use_snp_selection': False}. Best is trial 21 with value: 0.31751353329443455.
[I 2025-12-08 20:35:47,851] Trial 29 finished with value: 0.21838892444054792 and parameters: {'model_type': 'gcn', 'hidden_dims': '[512, 128]', 'dropout': 0.5327633304178353, 'batch_norm': True, 'lr': 0.001355805336039062, 'weight_decay': 3.6442545505451962e-06, 'epochs': 77, 'loss': 'mae', 'optimizer': 'adam', 'graph_mode': 'knn', 'knn_k': 1, 'weighted_edges': False, 'symmetrize_mode': 'union', 'self_loops': False, 'use_snp_selection': False}. Best is trial 21 with value: 0.31751353329443455.
[I 2025-12-08 20:35:58,337] Trial 30 finished with value: 0.2549155344178918 and parameters: {'model_type': 'gcn', 'hidden_dims': '[256, 128, 64]', 'dropout': 0.15626347122444334, 'batch_norm': True, 'lr': 0.00869291612270892, 'weight_decay': 1.860402622254334e-05, 'epochs': 60, 'loss': 'mae', 'optimizer': 'adam', 'graph_mode': 'cutoff', 'cutoff': 0.5080103962958555, 'grm_norm': 'gcn', 'self_loops': False, 'use_snp_selection': False}. Best is trial 21 with value: 0.31751353329443455.
[I 2025-12-08 20:36:24,259] Trial 31 finished with value: 0.3125216592994113 and parameters: {'model_type': 'gcn', 'hidden_dims': '[512, 256]', 'dropout': 0.2601466390341904, 'batch_norm': True, 'lr': 0.002146479088247346, 'weight_decay': 5.760564245384868e-05, 'epochs': 90, 'loss': 'mae', 'optimizer': 'adam', 'graph_mode': 'cutoff', 'cutoff': 0.8115027828100972, 'grm_norm': 'none', 'self_loops': False, 'use_snp_selection': False}. Best is trial 21 with value: 0.31751353329443455.
