[I 2025-12-08 14:01:57,457] Trial 67 finished with value: 0.2788543280898119 and parameters: {'model_type': 'gcn', 'hidden_dims': '[512, 128]', 'dropout': 0.47913904361129556, 'batch_norm': True, 'lr': 8.303499421280616e-05, 'weight_decay': 0.0003209592905893389, 'epochs': 336, 'loss': 'mse', 'optimizer': 'adam', 'graph_mode': 'cutoff', 'cutoff': 0.7404656885848229, 'grm_norm': 'none', 'self_loops': False, 'use_snp_selection': True, 'num_snps': 48946}. Best is trial 21 with value: 0.3081373243723945.
[I 2025-12-08 14:03:13,017] Trial 68 finished with value: 0.3002977913368773 and parameters: {'model_type': 'gcn', 'hidden_dims': '[512, 64]', 'dropout': 0.1705306626261249, 'batch_norm': True, 'lr': 2.1127915384344685e-05, 'weight_decay': 3.895306685525013e-05, 'epochs': 310, 'loss': 'mae', 'optimizer': 'adam', 'graph_mode': 'cutoff', 'cutoff': 0.778815003933266, 'grm_norm': 'none', 'self_loops': False, 'use_snp_selection': True, 'num_snps': 51191}. Best is trial 21 with value: 0.3081373243723945.
[I 2025-12-08 14:04:15,308] Trial 69 finished with value: 0.23160106647892312 and parameters: {'model_type': 'gcn', 'hidden_dims': '[512, 128]', 'dropout': 0.4351004665337735, 'batch_norm': True, 'lr': 0.00014952895504708613, 'weight_decay': 0.0002724284569779994, 'epochs': 290, 'loss': 'mae', 'optimizer': 'adam', 'graph_mode': 'cutoff', 'cutoff': 0.45206796234457236, 'grm_norm': 'none', 'self_loops': False, 'use_snp_selection': True, 'num_snps': 42158}. Best is trial 21 with value: 0.3081373243723945.
[I 2025-12-08 14:05:13,646] Trial 70 finished with value: 0.307503782252884 and parameters: {'model_type': 'gcn', 'hidden_dims': '[512, 128]', 'dropout': 0.20408400111518762, 'batch_norm': True, 'lr': 2.6701725706348592e-05, 'weight_decay': 1.2011047804022985e-06, 'epochs': 279, 'loss': 'mae', 'optimizer': 'adam', 'graph_mode': 'cutoff', 'cutoff': 0.8118236837807162, 'grm_norm': 'none', 'self_loops': True, 'use_snp_selection': True, 'num_snps': 39998}. Best is trial 21 with value: 0.3081373243723945.
[I 2025-12-08 14:06:14,194] Trial 71 finished with value: 0.29122156776589003 and parameters: {'model_type': 'gcn', 'hidden_dims': '[512, 128]', 'dropout': 0.21004854829103742, 'batch_norm': True, 'lr': 3.0301223062578042e-05, 'weight_decay': 1.0412125790937762e-06, 'epochs': 298, 'loss': 'mae', 'optimizer': 'adam', 'graph_mode': 'cutoff', 'cutoff': 0.8136947576761727, 'grm_norm': 'none', 'self_loops': True, 'use_snp_selection': True, 'num_snps': 39778}. Best is trial 21 with value: 0.3081373243723945.
[I 2025-12-08 14:07:11,255] Trial 72 finished with value: 0.28691101430442484 and parameters: {'model_type': 'gcn', 'hidden_dims': '[512, 128]', 'dropout': 0.45023110576024916, 'batch_norm': True, 'lr': 4.255460750056067e-05, 'weight_decay': 6.071025973715047e-07, 'epochs': 316, 'loss': 'mae', 'optimizer': 'adam', 'graph_mode': 'cutoff', 'cutoff': 0.7778225374732489, 'grm_norm': 'none', 'self_loops': True, 'use_snp_selection': True, 'num_snps': 35437}. Best is trial 21 with value: 0.3081373243723945.
[I 2025-12-08 14:08:15,385] Trial 73 finished with value: 0.30474478032404656 and parameters: {'model_type': 'gcn', 'hidden_dims': '[512, 128]', 'dropout': 0.1389665138889049, 'batch_norm': True, 'lr': 2.611093189041245e-05, 'weight_decay': 2.28008069667465e-06, 'epochs': 274, 'loss': 'mae', 'optimizer': 'adam', 'graph_mode': 'cutoff', 'cutoff': 0.8382095034300378, 'grm_norm': 'none', 'self_loops': True, 'use_snp_selection': True, 'num_snps': 43422}. Best is trial 21 with value: 0.3081373243723945.
[I 2025-12-08 14:09:11,293] Trial 74 finished with value: 0.27520611433109876 and parameters: {'model_type': 'gcn', 'hidden_dims': '[512, 128]', 'dropout': 0.14519024338043365, 'batch_norm': True, 'lr': 1.750588195402037e-05, 'weight_decay': 2.2463525884135212e-06, 'epochs': 277, 'loss': 'mae', 'optimizer': 'adam', 'graph_mode': 'cutoff', 'cutoff': 0.8324110233488194, 'grm_norm': 'none', 'self_loops': True, 'use_snp_selection': True, 'num_snps': 38475}. Best is trial 21 with value: 0.3081373243723945.
[I 2025-12-08 14:09:48,199] Trial 75 finished with value: 0.2641025064203353 and parameters: {'model_type': 'gcn', 'hidden_dims': '[256, 128, 64]', 'dropout': 0.11950356833989909, 'batch_norm': True, 'lr': 2.5398337300104768e-05, 'weight_decay': 3.0668757271448824e-06, 'epochs': 226, 'loss': 'mae', 'optimizer': 'adam', 'graph_mode': 'cutoff', 'cutoff': 0.7226687835198009, 'grm_norm': 'none', 'self_loops': True, 'use_snp_selection': True, 'num_snps': 41663}. Best is trial 21 with value: 0.3081373243723945.
[I 2025-12-08 14:10:18,335] Trial 76 finished with value: 0.29412096946102595 and parameters: {'model_type': 'gcn', 'hidden_dims': '[512, 128]', 'dropout': 0.17867548328487115, 'batch_norm': True, 'lr': 6.964658510864196e-05, 'weight_decay': 1.5527587085026036e-06, 'epochs': 255, 'loss': 'mae', 'optimizer': 'adam', 'graph_mode': 'cutoff', 'cutoff': 0.7557334270941795, 'grm_norm': 'none', 'self_loops': True, 'use_snp_selection': True, 'num_snps': 17784}. Best is trial 21 with value: 0.3081373243723945.
[I 2025-12-08 14:11:25,141] Trial 77 finished with value: 0.2698958165211138 and parameters: {'model_type': 'gcn', 'hidden_dims': '[512, 128]', 'dropout': 0.10684521815788817, 'batch_norm': True, 'lr': 1.1084675229163636e-05, 'weight_decay': 4.2015486243068315e-06, 'epochs': 269, 'loss': 'mae', 'optimizer': 'adam', 'graph_mode': 'cutoff', 'cutoff': 0.8476229283605115, 'grm_norm': 'none', 'self_loops': True, 'use_snp_selection': True, 'num_snps': 49199}. Best is trial 21 with value: 0.3081373243723945.
[I 2025-12-08 14:12:09,367] Trial 78 finished with value: 0.22063870479681857 and parameters: {'model_type': 'gcn', 'hidden_dims': '[256, 128]', 'dropout': 0.14347705425337862, 'batch_norm': True, 'lr': 0.00010457378703031451, 'weight_decay': 7.8683907061142e-07, 'epochs': 284, 'loss': 'mae', 'optimizer': 'adam', 'graph_mode': 'knn', 'knn_k': 3, 'weighted_edges': True, 'symmetrize_mode': 'union', 'self_loops': True, 'use_snp_selection': True, 'num_snps': 45804}. Best is trial 21 with value: 0.3081373243723945.
[I 2025-12-08 14:12:59,175] Trial 79 finished with value: 0.2784961309434133 and parameters: {'model_type': 'gcn', 'hidden_dims': '[512, 128]', 'dropout': 0.21383540310848612, 'batch_norm': True, 'lr': 1.588405711426564e-05, 'weight_decay': 1.7504917884717413e-06, 'epochs': 242, 'loss': 'mae', 'optimizer': 'adam', 'graph_mode': 'cutoff', 'cutoff': 0.6863089300399448, 'grm_norm': 'none', 'self_loops': True, 'use_snp_selection': True, 'num_snps': 37909}. Best is trial 21 with value: 0.3081373243723945.
[I 2025-12-08 14:13:31,331] Trial 80 finished with value: 0.27665974942292326 and parameters: {'model_type': 'gcn', 'hidden_dims': '[512, 256]', 'dropout': 0.1543474476213648, 'batch_norm': True, 'lr': 2.5992358279994334e-05, 'weight_decay': 2.9038543852024797e-07, 'epochs': 230, 'loss': 'mse', 'optimizer': 'adam', 'graph_mode': 'cutoff', 'cutoff': 0.7984211891182157, 'grm_norm': 'none', 'self_loops': True, 'use_snp_selection': True, 'num_snps': 21754}. Best is trial 21 with value: 0.3081373243723945.
[I 2025-12-08 14:14:37,556] Trial 81 finished with value: 0.3049575453676983 and parameters: {'model_type': 'gcn', 'hidden_dims': '[512, 128]', 'dropout': 0.19582770027854154, 'batch_norm': True, 'lr': 0.0001927196868167896, 'weight_decay': 1.4092464508963185e-06, 'epochs': 290, 'loss': 'mae', 'optimizer': 'adam', 'graph_mode': 'cutoff', 'cutoff': 0.7866335368543398, 'grm_norm': 'cosine_then_gcn', 'self_loops': False, 'use_snp_selection': True, 'num_snps': 45362}. Best is trial 21 with value: 0.3081373243723945.
[I 2025-12-08 14:15:44,606] Trial 82 finished with value: 0.2992592174914216 and parameters: {'model_type': 'gcn', 'hidden_dims': '[512, 128]', 'dropout': 0.18395979753598943, 'batch_norm': True, 'lr': 0.0001808347703725879, 'weight_decay': 1.1789567367451474e-06, 'epochs': 292, 'loss': 'mae', 'optimizer': 'adam', 'graph_mode': 'cutoff', 'cutoff': 0.8123994967704725, 'grm_norm': 'cosine_then_gcn', 'self_loops': True, 'use_snp_selection': True, 'num_snps': 46177}. Best is trial 21 with value: 0.3081373243723945.
[I 2025-12-08 14:16:55,613] Trial 83 finished with value: 0.29158241196490337 and parameters: {'model_type': 'gcn', 'hidden_dims': '[512, 128]', 'dropout': 0.1988695615737967, 'batch_norm': True, 'lr': 0.00012814618020050953, 'weight_decay': 2.6214639192147473e-06, 'epochs': 263, 'loss': 'mae', 'optimizer': 'adam', 'graph_mode': 'cutoff', 'cutoff': 0.7143677274183416, 'grm_norm': 'cosine_then_gcn', 'self_loops': False, 'use_snp_selection': True, 'num_snps': 53889}. Best is trial 21 with value: 0.3081373243723945.
[I 2025-12-08 14:17:56,792] Trial 84 finished with value: 0.288768423907367 and parameters: {'model_type': 'gcn', 'hidden_dims': '[512, 128]', 'dropout': 0.22992611617969905, 'batch_norm': True, 'lr': 5.476076151947877e-05, 'weight_decay': 5.048423821298067e-07, 'epochs': 279, 'loss': 'mae', 'optimizer': 'adam', 'graph_mode': 'cutoff', 'cutoff': 0.7643705708819798, 'grm_norm': 'cosine', 'self_loops': False, 'use_snp_selection': True, 'num_snps': 42945}. Best is trial 21 with value: 0.3081373243723945.
[I 2025-12-08 14:19:02,976] Trial 85 finished with value: 0.28634534241192294 and parameters: {'model_type': 'gcn', 'hidden_dims': '[512, 128]', 'dropout': 0.26190946110541813, 'batch_norm': True, 'lr': 3.786476373802391e-05, 'weight_decay': 1.439141761047167e-06, 'epochs': 255, 'loss': 'mae', 'optimizer': 'adam', 'graph_mode': 'cutoff', 'cutoff': 0.7951577808350052, 'grm_norm': 'gcn', 'self_loops': False, 'use_snp_selection': True, 'num_snps': 51102}. Best is trial 21 with value: 0.3081373243723945.
[I 2025-12-08 14:19:18,614] Trial 86 finished with value: 0.26983999713170237 and parameters: {'model_type': 'gcn', 'hidden_dims': '[128, 64]', 'dropout': 0.13271024180572336, 'batch_norm': True, 'lr': 1.3487390251974573e-05, 'weight_decay': 7.187014385043036e-06, 'epochs': 272, 'loss': 'mae', 'optimizer': 'adam', 'graph_mode': 'cutoff', 'cutoff': 0.6479241871013726, 'grm_norm': 'cosine_then_gcn', 'self_loops': False, 'use_snp_selection': True, 'num_snps': 10844}. Best is trial 21 with value: 0.3081373243723945.
[I 2025-12-08 14:19:47,277] Trial 87 finished with value: 0.27449656234693587 and parameters: {'model_type': 'gcn', 'hidden_dims': '[512, 128]', 'dropout': 0.16942789401614655, 'batch_norm': True, 'lr': 2.2099512881613244e-05, 'weight_decay': 2.0991945811645356e-06, 'epochs': 328, 'loss': 'mae', 'optimizer': 'adam', 'graph_mode': 'cutoff', 'cutoff': 0.8673018012894208, 'grm_norm': 'cosine_then_gcn', 'self_loops': True, 'use_snp_selection': True, 'num_snps': 13689}. Best is trial 21 with value: 0.3081373243723945.
[I 2025-12-08 14:20:07,113] Trial 88 finished with value: 0.2990378399998611 and parameters: {'model_type': 'gcn', 'hidden_dims': '[512, 64]', 'dropout': 0.14792157366781164, 'batch_norm': True, 'lr': 9.53111190731267e-05, 'weight_decay': 3.1175924333280224e-06, 'epochs': 72, 'loss': 'mae', 'optimizer': 'adam', 'graph_mode': 'cutoff', 'cutoff': 0.7370044047963091, 'grm_norm': 'cosine_then_gcn', 'self_loops': False, 'use_snp_selection': True, 'num_snps': 24628}. Best is trial 21 with value: 0.3081373243723945.
[I 2025-12-08 14:20:37,689] Trial 89 finished with value: 0.2389247105324081 and parameters: {'model_type': 'gcn', 'hidden_dims': '[512, 128]', 'dropout': 0.12363537036435183, 'batch_norm': True, 'lr': 7.443736761262268e-05, 'weight_decay': 4.791903275377455e-06, 'epochs': 247, 'loss': 'mae', 'optimizer': 'adam', 'graph_mode': 'knn', 'knn_k': 5, 'weighted_edges': False, 'symmetrize_mode': 'union', 'self_loops': False, 'use_snp_selection': True, 'num_snps': 17317}. Best is trial 21 with value: 0.3081373243723945.
[I 2025-12-08 14:21:45,699] Trial 90 finished with value: 0.3027805695582314 and parameters: {'model_type': 'gcn', 'hidden_dims': '[512, 128]', 'dropout': 0.15929827687338524, 'batch_norm': True, 'lr': 0.0002854521371790125, 'weight_decay': 6.215490328544507e-06, 'epochs': 310, 'loss': 'mae', 'optimizer': 'adam', 'graph_mode': 'cutoff', 'cutoff': 0.8314153536300147, 'grm_norm': 'none', 'self_loops': False, 'use_snp_selection': True, 'num_snps': 44746}. Best is trial 21 with value: 0.3081373243723945.
[I 2025-12-08 14:22:48,225] Trial 91 finished with value: 0.3062152104653879 and parameters: {'model_type': 'gcn', 'hidden_dims': '[512, 128]', 'dropout': 0.4079117121764491, 'batch_norm': True, 'lr': 0.00019744066007141924, 'weight_decay': 0.00017402914037851602, 'epochs': 302, 'loss': 'mae', 'optimizer': 'adam', 'graph_mode': 'cutoff', 'cutoff': 0.7904359725897656, 'grm_norm': 'cosine_then_gcn', 'self_loops': False, 'use_snp_selection': True, 'num_snps': 41057}. Best is trial 21 with value: 0.3081373243723945.
[I 2025-12-08 14:23:45,440] Trial 92 finished with value: 0.3047291566563028 and parameters: {'model_type': 'gcn', 'hidden_dims': '[512, 128]', 'dropout': 0.4147720880116543, 'batch_norm': True, 'lr': 0.00015404097170014286, 'weight_decay': 0.00011023061515233617, 'epochs': 302, 'loss': 'mae', 'optimizer': 'adam', 'graph_mode': 'cutoff', 'cutoff': 0.7813273307076622, 'grm_norm': 'cosine_then_gcn', 'self_loops': False, 'use_snp_selection': True, 'num_snps': 36343}. Best is trial 21 with value: 0.3081373243723945.
[I 2025-12-08 14:24:42,499] Trial 93 finished with value: 0.3016627343701712 and parameters: {'model_type': 'gcn', 'hidden_dims': '[512, 128]', 'dropout': 0.40010166139019776, 'batch_norm': True, 'lr': 0.00035570075258231214, 'weight_decay': 0.0001587050246489255, 'epochs': 302, 'loss': 'mae', 'optimizer': 'adam', 'graph_mode': 'cutoff', 'cutoff': 0.8158500840621025, 'grm_norm': 'cosine_then_gcn', 'self_loops': False, 'use_snp_selection': True, 'num_snps': 36504}. Best is trial 21 with value: 0.3081373243723945.
[I 2025-12-08 14:25:43,327] Trial 94 finished with value: 0.3050741243443143 and parameters: {'model_type': 'gcn', 'hidden_dims': '[512, 128]', 'dropout': 0.408861536096312, 'batch_norm': True, 'lr': 0.00014754080353907598, 'weight_decay': 1.330669656745745e-06, 'epochs': 285, 'loss': 'mae', 'optimizer': 'adam', 'graph_mode': 'cutoff', 'cutoff': 0.7824391935531546, 'grm_norm': 'cosine_then_gcn', 'self_loops': False, 'use_snp_selection': True, 'num_snps': 41743}. Best is trial 21 with value: 0.3081373243723945.
[I 2025-12-08 14:26:47,648] Trial 95 finished with value: 0.30027269966485004 and parameters: {'model_type': 'gcn', 'hidden_dims': '[512, 128]', 'dropout': 0.2872860629083307, 'batch_norm': True, 'lr': 0.0001964745093226887, 'weight_decay': 7.968976222525886e-07, 'epochs': 315, 'loss': 'mae', 'optimizer': 'adam', 'graph_mode': 'cutoff', 'cutoff': 0.7873186683781346, 'grm_norm': 'cosine_then_gcn', 'self_loops': False, 'use_snp_selection': True, 'num_snps': 41218}. Best is trial 21 with value: 0.3081373243723945.
[I 2025-12-08 14:27:41,986] Trial 96 finished with value: 0.30164619660312797 and parameters: {'model_type': 'gcn', 'hidden_dims': '[512, 128]', 'dropout': 0.41347447668596576, 'batch_norm': True, 'lr': 0.0001513261158065392, 'weight_decay': 0.00011017473949665825, 'epochs': 280, 'loss': 'mae', 'optimizer': 'adam', 'graph_mode': 'cutoff', 'cutoff': 0.7750263015046421, 'grm_norm': 'cosine_then_gcn', 'self_loops': False, 'use_snp_selection': True, 'num_snps': 36796}. Best is trial 21 with value: 0.3081373243723945.
[I 2025-12-08 14:28:18,494] Trial 97 finished with value: 0.2813823270254837 and parameters: {'model_type': 'gcn', 'hidden_dims': '[256, 128, 64]', 'dropout': 0.43023903533533414, 'batch_norm': True, 'lr': 0.0001180882735431865, 'weight_decay': 1.3234950038386576e-06, 'epochs': 290, 'loss': 'mse', 'optimizer': 'adam', 'graph_mode': 'cutoff', 'cutoff': 0.8337228677270497, 'grm_norm': 'cosine_then_gcn', 'self_loops': False, 'use_snp_selection': True, 'num_snps': 34507}. Best is trial 21 with value: 0.3081373243723945.
[I 2025-12-08 14:29:26,416] Trial 98 finished with value: 0.2914999303694749 and parameters: {'model_type': 'gcn', 'hidden_dims': '[512, 128]', 'dropout': 0.36958939418236153, 'batch_norm': True, 'lr': 0.00019446251367250054, 'weight_decay': 6.650189929267133e-05, 'epochs': 287, 'loss': 'mae', 'optimizer': 'adam', 'graph_mode': 'cutoff', 'cutoff': 0.8559151887490836, 'grm_norm': 'cosine_then_gcn', 'self_loops': False, 'use_snp_selection': True, 'num_snps': 47259}. Best is trial 21 with value: 0.3081373243723945.
[I 2025-12-08 14:30:09,646] Trial 99 finished with value: 0.2977819316204425 and parameters: {'model_type': 'gcn', 'hidden_dims': '[256, 128]', 'dropout': 0.19781826165427296, 'batch_norm': True, 'lr': 0.0002690421568632874, 'weight_decay': 9.891076250998377e-07, 'epochs': 305, 'loss': 'mae', 'optimizer': 'adam', 'graph_mode': 'cutoff', 'cutoff': 0.8735416411208722, 'grm_norm': 'cosine', 'self_loops': True, 'use_snp_selection': True, 'num_snps': 44158}. Best is trial 21 with value: 0.3081373243723945.
[I 2025-12-08 14:30:56,433] Trial 100 finished with value: 0.3087689470278421 and parameters: {'model_type': 'gcn', 'hidden_dims': '[512, 128]', 'dropout': 0.10302441850091236, 'batch_norm': True, 'lr': 0.00013519629782909146, 'weight_decay': 2.4384557166049182e-06, 'epochs': 265, 'loss': 'mae', 'optimizer': 'adam', 'graph_mode': 'cutoff', 'cutoff': 0.806716850770844, 'grm_norm': 'cosine_then_gcn', 'self_loops': False, 'use_snp_selection': True, 'num_snps': 32541}. Best is trial 100 with value: 0.3087689470278421.
[I 2025-12-08 14:31:45,283] Trial 101 finished with value: 0.31016855248954933 and parameters: {'model_type': 'gcn', 'hidden_dims': '[512, 128]', 'dropout': 0.11508517047900929, 'batch_norm': True, 'lr': 0.00013746183192430694, 'weight_decay': 2.083955378949643e-06, 'epochs': 268, 'loss': 'mae', 'optimizer': 'adam', 'graph_mode': 'cutoff', 'cutoff': 0.8060912090108845, 'grm_norm': 'cosine_then_gcn', 'self_loops': False, 'use_snp_selection': True, 'num_snps': 33609}. Best is trial 101 with value: 0.31016855248954933.
[I 2025-12-08 14:32:33,236] Trial 102 finished with value: 0.29969282343404646 and parameters: {'model_type': 'gcn', 'hidden_dims': '[512, 128]', 'dropout': 0.10072779904668804, 'batch_norm': True, 'lr': 0.00015508283263846934, 'weight_decay': 1.9964154480344177e-06, 'epochs': 275, 'loss': 'mae', 'optimizer': 'adam', 'graph_mode': 'cutoff', 'cutoff': 0.8078289937088693, 'grm_norm': 'cosine_then_gcn', 'self_loops': False, 'use_snp_selection': True, 'num_snps': 32652}. Best is trial 101 with value: 0.31016855248954933.
[I 2025-12-08 14:33:15,542] Trial 103 finished with value: 0.29691541944289435 and parameters: {'model_type': 'gcn', 'hidden_dims': '[512, 128]', 'dropout': 0.12782047546735653, 'batch_norm': True, 'lr': 0.0001317055775942822, 'weight_decay': 2.614103000015288e-06, 'epochs': 264, 'loss': 'mae', 'optimizer': 'adam', 'graph_mode': 'cutoff', 'cutoff': 0.8473708624213112, 'grm_norm': 'cosine_then_gcn', 'self_loops': False, 'use_snp_selection': True, 'num_snps': 28567}. Best is trial 101 with value: 0.31016855248954933.
[I 2025-12-08 14:34:03,521] Trial 104 finished with value: 0.3095869421519566 and parameters: {'model_type': 'gcn', 'hidden_dims': '[512, 128]', 'dropout': 0.11501878338515828, 'batch_norm': True, 'lr': 0.0001684674586352692, 'weight_decay': 3.320274223822406e-06, 'epochs': 296, 'loss': 'mae', 'optimizer': 'adam', 'graph_mode': 'cutoff', 'cutoff': 0.8815691702409815, 'grm_norm': 'cosine_then_gcn', 'self_loops': False, 'use_snp_selection': True, 'num_snps': 30252}. Best is trial 101 with value: 0.31016855248954933.
[I 2025-12-08 14:34:47,224] Trial 105 finished with value: 0.29494655961422117 and parameters: {'model_type': 'gcn', 'hidden_dims': '[512, 128]', 'dropout': 0.11026187015971045, 'batch_norm': True, 'lr': 9.958101021985778e-05, 'weight_decay': 3.856207074479839e-06, 'epochs': 257, 'loss': 'mae', 'optimizer': 'adam', 'graph_mode': 'cutoff', 'cutoff': 0.8887570661988341, 'grm_norm': 'cosine_then_gcn', 'self_loops': False, 'use_snp_selection': True, 'num_snps': 30618}. Best is trial 101 with value: 0.31016855248954933.
[I 2025-12-08 14:35:35,326] Trial 106 finished with value: 0.3025310801489803 and parameters: {'model_type': 'gcn', 'hidden_dims': '[512, 128]', 'dropout': 0.11239705337703948, 'batch_norm': True, 'lr': 0.00025312404811081896, 'weight_decay': 1.681033674438726e-06, 'epochs': 282, 'loss': 'mae', 'optimizer': 'adam', 'graph_mode': 'cutoff', 'cutoff': 0.8245534434654971, 'grm_norm': 'gcn', 'self_loops': False, 'use_snp_selection': True, 'num_snps': 31898}. Best is trial 101 with value: 0.31016855248954933.
[I 2025-12-08 14:36:43,297] Trial 107 finished with value: 0.30261057073448133 and parameters: {'model_type': 'gcn', 'hidden_dims': '[512, 256]', 'dropout': 0.14106617523854267, 'batch_norm': True, 'lr': 0.00017511569142354618, 'weight_decay': 3.266589787960924e-06, 'epochs': 325, 'loss': 'mae', 'optimizer': 'adam', 'graph_mode': 'cutoff', 'cutoff': 0.876050571990008, 'grm_norm': 'cosine_then_gcn', 'self_loops': False, 'use_snp_selection': True, 'num_snps': 42868}. Best is trial 101 with value: 0.31016855248954933.
[I 2025-12-08 14:37:08,114] Trial 108 finished with value: 0.2821102335813236 and parameters: {'model_type': 'gcn', 'hidden_dims': '[128, 64]', 'dropout': 0.12202211899834664, 'batch_norm': True, 'lr': 0.000200857783563196, 'weight_decay': 8.408732097896631e-07, 'epochs': 268, 'loss': 'mae', 'optimizer': 'adam', 'graph_mode': 'cutoff', 'cutoff': 0.8436779599141357, 'grm_norm': 'none', 'self_loops': False, 'use_snp_selection': True, 'num_snps': 34132}. Best is trial 101 with value: 0.31016855248954933.
