[I 2025-12-08 18:14:45,285] Trial 71 finished with value: 0.2939662932348027 and parameters: {'model_type': 'gcn', 'hidden_dims': '[512, 256]', 'dropout': 0.5288234391838783, 'batch_norm': True, 'lr': 1.7891482785603255e-05, 'weight_decay': 1.3616651849944896e-05, 'epochs': 220, 'loss': 'mae', 'optimizer': 'adam', 'graph_mode': 'cutoff', 'cutoff': 0.6354932372765993, 'grm_norm': 'cosine', 'self_loops': False, 'use_snp_selection': True, 'num_snps': 29885}. Best is trial 54 with value: 0.2986725876748172.
[I 2025-12-08 18:15:27,094] Trial 72 finished with value: 0.2910114530267721 and parameters: {'model_type': 'gcn', 'hidden_dims': '[512, 256]', 'dropout': 0.5630932654375789, 'batch_norm': True, 'lr': 2.3241090324518376e-05, 'weight_decay': 3.005767932166693e-05, 'epochs': 210, 'loss': 'mae', 'optimizer': 'adam', 'graph_mode': 'cutoff', 'cutoff': 0.6214840555916746, 'grm_norm': 'cosine', 'self_loops': False, 'use_snp_selection': True, 'num_snps': 34575}. Best is trial 54 with value: 0.2986725876748172.
[I 2025-12-08 18:16:06,348] Trial 73 finished with value: 0.28079429594351885 and parameters: {'model_type': 'gcn', 'hidden_dims': '[512, 256]', 'dropout': 0.5048548848936179, 'batch_norm': True, 'lr': 2.3761257784273676e-05, 'weight_decay': 7.805246359759025e-06, 'epochs': 195, 'loss': 'mae', 'optimizer': 'adam', 'graph_mode': 'cutoff', 'cutoff': 0.6314306765364217, 'grm_norm': 'cosine', 'self_loops': False, 'use_snp_selection': True, 'num_snps': 34443}. Best is trial 54 with value: 0.2986725876748172.
[I 2025-12-08 18:16:41,453] Trial 74 finished with value: 0.29153966956934024 and parameters: {'model_type': 'gcn', 'hidden_dims': '[512, 256]', 'dropout': 0.552653975407431, 'batch_norm': True, 'lr': 1.1933918683441376e-05, 'weight_decay': 3.2479491760978034e-05, 'epochs': 235, 'loss': 'mae', 'optimizer': 'adam', 'graph_mode': 'cutoff', 'cutoff': 0.6989992647461537, 'grm_norm': 'cosine', 'self_loops': False, 'use_snp_selection': True, 'num_snps': 24547}. Best is trial 54 with value: 0.2986725876748172.
[I 2025-12-08 18:17:15,130] Trial 75 finished with value: 0.2785818654993364 and parameters: {'model_type': 'gcn', 'hidden_dims': '[512, 256]', 'dropout': 0.46672458730835875, 'batch_norm': True, 'lr': 1.1460208387267574e-05, 'weight_decay': 2.155496739246575e-06, 'epochs': 237, 'loss': 'mae', 'optimizer': 'adam', 'graph_mode': 'cutoff', 'cutoff': 0.6886274026889265, 'grm_norm': 'cosine_then_gcn', 'self_loops': False, 'use_snp_selection': True, 'num_snps': 22765}. Best is trial 54 with value: 0.2986725876748172.
[I 2025-12-08 18:17:41,568] Trial 76 finished with value: 0.28850466705355104 and parameters: {'model_type': 'gcn', 'hidden_dims': '[256, 128]', 'dropout': 0.4826829282044435, 'batch_norm': True, 'lr': 1.3889161049851988e-05, 'weight_decay': 1.4263700728232533e-05, 'epochs': 254, 'loss': 'mae', 'optimizer': 'adam', 'graph_mode': 'cutoff', 'cutoff': 0.7417583170709984, 'grm_norm': 'cosine_then_gcn', 'self_loops': False, 'use_snp_selection': True, 'num_snps': 24467}. Best is trial 54 with value: 0.2986725876748172.
[I 2025-12-08 18:18:49,985] Trial 77 finished with value: 0.1966736199642931 and parameters: {'model_type': 'gcn', 'hidden_dims': '[512, 128]', 'dropout': 0.5160162428284576, 'batch_norm': True, 'lr': 1.0278140176390332e-05, 'weight_decay': 0.00046412387367578654, 'epochs': 268, 'loss': 'mae', 'optimizer': 'adam', 'graph_mode': 'knn', 'knn_k': 3, 'weighted_edges': False, 'symmetrize_mode': 'mutual', 'self_loops': False, 'use_snp_selection': False}. Best is trial 54 with value: 0.2986725876748172.
[I 2025-12-08 18:19:16,745] Trial 78 finished with value: 0.27792469658271235 and parameters: {'model_type': 'gcn', 'hidden_dims': '[512, 256]', 'dropout': 0.5338713406596501, 'batch_norm': True, 'lr': 1.4920134520127369e-05, 'weight_decay': 5.861799944426894e-07, 'epochs': 145, 'loss': 'mae', 'optimizer': 'adam', 'graph_mode': 'cutoff', 'cutoff': 0.7084780175300064, 'grm_norm': 'none', 'self_loops': False, 'use_snp_selection': True, 'num_snps': 25456}. Best is trial 54 with value: 0.2986725876748172.
[I 2025-12-08 18:19:46,975] Trial 79 finished with value: 0.2860651548069931 and parameters: {'model_type': 'gcn', 'hidden_dims': '[512, 128]', 'dropout': 0.5504283277221175, 'batch_norm': False, 'lr': 2.7958637100065855e-05, 'weight_decay': 3.918695809396743e-05, 'epochs': 231, 'loss': 'mae', 'optimizer': 'adam', 'graph_mode': 'cutoff', 'cutoff': 0.7900911836291998, 'grm_norm': 'cosine_then_gcn', 'self_loops': False, 'use_snp_selection': True, 'num_snps': 20285}. Best is trial 54 with value: 0.2986725876748172.
[I 2025-12-08 18:20:27,091] Trial 80 finished with value: 0.28135332168383986 and parameters: {'model_type': 'gcn', 'hidden_dims': '[512, 256]', 'dropout': 0.5826438092380839, 'batch_norm': True, 'lr': 1.2632527430700525e-05, 'weight_decay': 2.1136855597327185e-05, 'epochs': 248, 'loss': 'mae', 'optimizer': 'adam', 'graph_mode': 'cutoff', 'cutoff': 0.6580518415332196, 'grm_norm': 'gcn', 'self_loops': False, 'use_snp_selection': True, 'num_snps': 28030}. Best is trial 54 with value: 0.2986725876748172.
[I 2025-12-08 18:21:00,386] Trial 81 finished with value: 0.24416198143109832 and parameters: {'model_type': 'gcn', 'hidden_dims': '[512, 256]', 'dropout': 0.5647376376137874, 'batch_norm': True, 'lr': 2.2703567569410398e-05, 'weight_decay': 2.5479544761326406e-05, 'epochs': 223, 'loss': 'mae', 'optimizer': 'adam', 'graph_mode': 'cutoff', 'cutoff': 0.2563693907308391, 'grm_norm': 'cosine', 'self_loops': False, 'use_snp_selection': True, 'num_snps': 22160}. Best is trial 54 with value: 0.2986725876748172.
[I 2025-12-08 18:21:38,126] Trial 82 finished with value: 0.28143005981510116 and parameters: {'model_type': 'gcn', 'hidden_dims': '[512, 256]', 'dropout': 0.5582610860308226, 'batch_norm': True, 'lr': 1.7612393782640756e-05, 'weight_decay': 2.749306527705411e-05, 'epochs': 209, 'loss': 'mae', 'optimizer': 'adam', 'graph_mode': 'cutoff', 'cutoff': 0.6224418221761223, 'grm_norm': 'cosine', 'self_loops': False, 'use_snp_selection': True, 'num_snps': 30162}. Best is trial 54 with value: 0.2986725876748172.
[I 2025-12-08 18:22:27,281] Trial 83 finished with value: 0.2834459909006101 and parameters: {'model_type': 'gcn', 'hidden_dims': '[512, 256]', 'dropout': 0.5320574724100622, 'batch_norm': True, 'lr': 3.362791907979404e-05, 'weight_decay': 3.297138906373015e-05, 'epochs': 237, 'loss': 'mae', 'optimizer': 'adam', 'graph_mode': 'cutoff', 'cutoff': 0.6544752410315101, 'grm_norm': 'cosine', 'self_loops': False, 'use_snp_selection': True, 'num_snps': 38487}. Best is trial 54 with value: 0.2986725876748172.
[I 2025-12-08 18:23:08,768] Trial 84 finished with value: 0.28386371238578956 and parameters: {'model_type': 'gcn', 'hidden_dims': '[512, 256]', 'dropout': 0.5734093809721199, 'batch_norm': True, 'lr': 4.9258951980437794e-05, 'weight_decay': 1.173518676904306e-05, 'epochs': 277, 'loss': 'mae', 'optimizer': 'adam', 'graph_mode': 'cutoff', 'cutoff': 0.694156424860563, 'grm_norm': 'cosine', 'self_loops': False, 'use_snp_selection': True, 'num_snps': 26459}. Best is trial 54 with value: 0.2986725876748172.
[I 2025-12-08 18:23:31,595] Trial 85 finished with value: 0.2808389383770396 and parameters: {'model_type': 'gcn', 'hidden_dims': '[256, 128]', 'dropout': 0.5867683791316275, 'batch_norm': True, 'lr': 2.6732042467418824e-05, 'weight_decay': 4.991120550314298e-05, 'epochs': 196, 'loss': 'mae', 'optimizer': 'adam', 'graph_mode': 'cutoff', 'cutoff': 0.5930124097535685, 'grm_norm': 'cosine', 'self_loops': False, 'use_snp_selection': True, 'num_snps': 24387}. Best is trial 54 with value: 0.2986725876748172.
[I 2025-12-08 18:23:55,817] Trial 86 finished with value: 0.2848369690332262 and parameters: {'model_type': 'gcn', 'hidden_dims': '[128, 64]', 'dropout': 0.5127945159080273, 'batch_norm': True, 'lr': 1.622760657801643e-05, 'weight_decay': 8.457553774355984e-05, 'epochs': 243, 'loss': 'mae', 'optimizer': 'adam', 'graph_mode': 'cutoff', 'cutoff': 0.762528744922591, 'grm_norm': 'cosine_then_gcn', 'self_loops': True, 'use_snp_selection': True, 'num_snps': 35312}. Best is trial 54 with value: 0.2986725876748172.
[I 2025-12-08 18:24:24,493] Trial 87 finished with value: 0.2516743540791779 and parameters: {'model_type': 'gcn', 'hidden_dims': '[512, 256]', 'dropout': 0.18635852225257743, 'batch_norm': True, 'lr': 2.0645995531322773e-05, 'weight_decay': 6.28032580208101e-05, 'epochs': 259, 'loss': 'mae', 'optimizer': 'adam', 'graph_mode': 'cutoff', 'cutoff': 0.5563928553114086, 'grm_norm': 'cosine', 'self_loops': False, 'use_snp_selection': True, 'num_snps': 16441}. Best is trial 54 with value: 0.2986725876748172.
[I 2025-12-08 18:24:54,162] Trial 88 finished with value: 0.2877550571970555 and parameters: {'model_type': 'gcn', 'hidden_dims': '[512, 128]', 'dropout': 0.4947827346385633, 'batch_norm': True, 'lr': 3.819350947975458e-05, 'weight_decay': 0.0005613523614232781, 'epochs': 228, 'loss': 'mae', 'optimizer': 'adam', 'graph_mode': 'cutoff', 'cutoff': 0.6754753322159137, 'grm_norm': 'cosine_then_gcn', 'self_loops': False, 'use_snp_selection': True, 'num_snps': 19882}. Best is trial 54 with value: 0.2986725876748172.
[I 2025-12-08 18:25:30,523] Trial 89 finished with value: 0.24042391112480396 and parameters: {'model_type': 'gcn', 'hidden_dims': '[512, 64]', 'dropout': 0.5422331980825829, 'batch_norm': True, 'lr': 0.00786053491102219, 'weight_decay': 0.0008526817717645923, 'epochs': 212, 'loss': 'mse', 'optimizer': 'adam', 'graph_mode': 'knn', 'knn_k': 5, 'weighted_edges': False, 'symmetrize_mode': 'mutual', 'self_loops': False, 'use_snp_selection': True, 'num_snps': 27845}. Best is trial 54 with value: 0.2986725876748172.
[I 2025-12-08 18:26:22,457] Trial 90 finished with value: 0.28376547770032723 and parameters: {'model_type': 'gcn', 'hidden_dims': '[512, 256]', 'dropout': 0.5246046364877228, 'batch_norm': True, 'lr': 0.00017178454053728273, 'weight_decay': 0.00038653654065263924, 'epochs': 203, 'loss': 'mae', 'optimizer': 'adam', 'graph_mode': 'cutoff', 'cutoff': 0.7363980500569245, 'grm_norm': 'cosine', 'self_loops': False, 'use_snp_selection': False}. Best is trial 54 with value: 0.2986725876748172.
[I 2025-12-08 18:27:03,014] Trial 91 finished with value: 0.28088211945347447 and parameters: {'model_type': 'gcn', 'hidden_dims': '[512, 256]', 'dropout': 0.5648751564375751, 'batch_norm': True, 'lr': 1.9328986690114103e-05, 'weight_decay': 2.0035339256888933e-05, 'epochs': 222, 'loss': 'mae', 'optimizer': 'adam', 'graph_mode': 'cutoff', 'cutoff': 0.5964887844227147, 'grm_norm': 'cosine', 'self_loops': False, 'use_snp_selection': True, 'num_snps': 31861}. Best is trial 54 with value: 0.2986725876748172.
[I 2025-12-08 18:27:41,910] Trial 92 finished with value: 0.2911496217757774 and parameters: {'model_type': 'gcn', 'hidden_dims': '[512, 256]', 'dropout': 0.5873776668960692, 'batch_norm': True, 'lr': 7.056231890410331e-05, 'weight_decay': 1.3291609467857755e-05, 'epochs': 218, 'loss': 'mae', 'optimizer': 'adam', 'graph_mode': 'cutoff', 'cutoff': 0.6288436642620514, 'grm_norm': 'cosine', 'self_loops': False, 'use_snp_selection': True, 'num_snps': 30760}. Best is trial 54 with value: 0.2986725876748172.
[I 2025-12-08 18:28:22,120] Trial 93 finished with value: 0.2894246451732892 and parameters: {'model_type': 'gcn', 'hidden_dims': '[512, 256]', 'dropout': 0.5883949035436433, 'batch_norm': True, 'lr': 6.295600452100922e-05, 'weight_decay': 7.703897504027461e-06, 'epochs': 232, 'loss': 'mae', 'optimizer': 'adam', 'graph_mode': 'cutoff', 'cutoff': 0.6435071893304746, 'grm_norm': 'cosine', 'self_loops': False, 'use_snp_selection': True, 'num_snps': 30304}. Best is trial 54 with value: 0.2986725876748172.
[I 2025-12-08 18:29:08,310] Trial 94 finished with value: 0.28977832287927824 and parameters: {'model_type': 'gcn', 'hidden_dims': '[512, 256]', 'dropout': 0.5546881026326478, 'batch_norm': True, 'lr': 0.00010500056020029497, 'weight_decay': 9.70603425841729e-06, 'epochs': 249, 'loss': 'mae', 'optimizer': 'adam', 'graph_mode': 'cutoff', 'cutoff': 0.6215520645488426, 'grm_norm': 'cosine', 'self_loops': False, 'use_snp_selection': True, 'num_snps': 34299}. Best is trial 54 with value: 0.2986725876748172.
[I 2025-12-08 18:29:31,763] Trial 95 finished with value: 0.283180446913821 and parameters: {'model_type': 'gcn', 'hidden_dims': '[256, 128, 64]', 'dropout': 0.5758871857373421, 'batch_norm': True, 'lr': 0.00023202922102222426, 'weight_decay': 1.2886129912851373e-05, 'epochs': 210, 'loss': 'mae', 'optimizer': 'adam', 'graph_mode': 'cutoff', 'cutoff': 0.6776082065607434, 'grm_norm': 'cosine_then_gcn', 'self_loops': False, 'use_snp_selection': True, 'num_snps': 22512}. Best is trial 54 with value: 0.2986725876748172.
[I 2025-12-08 18:30:10,348] Trial 96 finished with value: 0.293718818245828 and parameters: {'model_type': 'gcn', 'hidden_dims': '[512, 256]', 'dropout': 0.5390811457788265, 'batch_norm': True, 'lr': 7.448850759818509e-05, 'weight_decay': 3.140207778247045e-05, 'epochs': 266, 'loss': 'mae', 'optimizer': 'adam', 'graph_mode': 'cutoff', 'cutoff': 0.710659551547282, 'grm_norm': 'cosine', 'self_loops': False, 'use_snp_selection': True, 'num_snps': 25194}. Best is trial 54 with value: 0.2986725876748172.
[I 2025-12-08 18:30:37,325] Trial 97 finished with value: 0.28335546138187484 and parameters: {'model_type': 'gcn', 'hidden_dims': '[256, 128]', 'dropout': 0.4966852123353545, 'batch_norm': False, 'lr': 6.511666696377867e-05, 'weight_decay': 0.0002196493178175444, 'epochs': 268, 'loss': 'mae', 'optimizer': 'adam', 'graph_mode': 'cutoff', 'cutoff': 0.7769798894924977, 'grm_norm': 'cosine_then_gcn', 'self_loops': False, 'use_snp_selection': True, 'num_snps': 25369}. Best is trial 54 with value: 0.2986725876748172.
[I 2025-12-08 18:31:21,757] Trial 98 finished with value: 0.2904970499867969 and parameters: {'model_type': 'gcn', 'hidden_dims': '[512, 128]', 'dropout': 0.5385924938223465, 'batch_norm': True, 'lr': 0.00012007538816452359, 'weight_decay': 3.655675963878563e-05, 'epochs': 302, 'loss': 'mae', 'optimizer': 'adam', 'graph_mode': 'cutoff', 'cutoff': 0.696042314758848, 'grm_norm': 'cosine', 'self_loops': False, 'use_snp_selection': True, 'num_snps': 27401}. Best is trial 54 with value: 0.2986725876748172.
[I 2025-12-08 18:31:49,248] Trial 99 finished with value: 0.28282260619359023 and parameters: {'model_type': 'gcn', 'hidden_dims': '[512, 256]', 'dropout': 0.5892900993320185, 'batch_norm': True, 'lr': 5.184179889717882e-05, 'weight_decay': 1.250434768804068e-07, 'epochs': 242, 'loss': 'mae', 'optimizer': 'adam', 'graph_mode': 'cutoff', 'cutoff': 0.7223157406198266, 'grm_norm': 'gcn', 'self_loops': True, 'use_snp_selection': True, 'num_snps': 16823}. Best is trial 54 with value: 0.2986725876748172.
[I 2025-12-08 18:32:25,122] Trial 100 finished with value: 0.2232110403355878 and parameters: {'model_type': 'gcn', 'hidden_dims': '[512, 256]', 'dropout': 0.4810771351020419, 'batch_norm': True, 'lr': 8.20226126160071e-05, 'weight_decay': 2.2026933527065754e-05, 'epochs': 281, 'loss': 'mae', 'optimizer': 'adam', 'graph_mode': 'cutoff', 'cutoff': 0.520534357626458, 'grm_norm': 'cosine', 'self_loops': False, 'use_snp_selection': True, 'num_snps': 21118}. Best is trial 54 with value: 0.2986725876748172.
[I 2025-12-08 18:32:46,003] Trial 101 finished with value: 0.27717051977730733 and parameters: {'model_type': 'gcn', 'hidden_dims': '[512, 256]', 'dropout': 0.5645084360476189, 'batch_norm': True, 'lr': 2.421724391168939e-05, 'weight_decay': 2.8802466460348744e-05, 'epochs': 45, 'loss': 'mae', 'optimizer': 'adam', 'graph_mode': 'cutoff', 'cutoff': 0.6469893374444068, 'grm_norm': 'cosine', 'self_loops': False, 'use_snp_selection': True, 'num_snps': 37359}. Best is trial 54 with value: 0.2986725876748172.
[I 2025-12-08 18:33:18,737] Trial 102 finished with value: 0.2877576840345758 and parameters: {'model_type': 'gcn', 'hidden_dims': '[512, 256]', 'dropout': 0.5502548429444281, 'batch_norm': True, 'lr': 4.199842859096609e-05, 'weight_decay': 1.6520947872437293e-05, 'epochs': 221, 'loss': 'mae', 'optimizer': 'adam', 'graph_mode': 'cutoff', 'cutoff': 0.7125406666996889, 'grm_norm': 'cosine', 'self_loops': False, 'use_snp_selection': True, 'num_snps': 23749}. Best is trial 54 with value: 0.2986725876748172.
[I 2025-12-08 18:33:43,275] Trial 103 finished with value: 0.2857133514186476 and parameters: {'model_type': 'gcn', 'hidden_dims': '[512, 256]', 'dropout': 0.5723867159272865, 'batch_norm': True, 'lr': 1.5106657538996908e-05, 'weight_decay': 1.2722362208856574e-05, 'epochs': 255, 'loss': 'mae', 'optimizer': 'adam', 'graph_mode': 'cutoff', 'cutoff': 0.6635787337377225, 'grm_norm': 'cosine', 'self_loops': False, 'use_snp_selection': True, 'num_snps': 13661}. Best is trial 54 with value: 0.2986725876748172.
[I 2025-12-08 18:34:22,641] Trial 104 finished with value: 0.26499310191987374 and parameters: {'model_type': 'gcn', 'hidden_dims': '[512, 256]', 'dropout': 0.5333754678692917, 'batch_norm': True, 'lr': 2.8583241619315054e-05, 'weight_decay': 5.6377860385490535e-06, 'epochs': 238, 'loss': 'mae', 'optimizer': 'adam', 'graph_mode': 'cutoff', 'cutoff': 0.5608101575538276, 'grm_norm': 'cosine', 'self_loops': False, 'use_snp_selection': True, 'num_snps': 28744}. Best is trial 54 with value: 0.2986725876748172.
[I 2025-12-08 18:34:41,240] Trial 105 finished with value: 0.2735112678370184 and parameters: {'model_type': 'gcn', 'hidden_dims': '[512, 256]', 'dropout': 0.5114038505342096, 'batch_norm': True, 'lr': 1.22739257124857e-05, 'weight_decay': 0.0002780768882210268, 'epochs': 217, 'loss': 'mae', 'optimizer': 'adam', 'graph_mode': 'cutoff', 'cutoff': 0.6233154942060457, 'grm_norm': 'cosine_then_gcn', 'self_loops': False, 'use_snp_selection': True, 'num_snps': 8635}. Best is trial 54 with value: 0.2986725876748172.
[I 2025-12-08 18:35:00,119] Trial 106 finished with value: 0.28594093924630115 and parameters: {'model_type': 'gcn', 'hidden_dims': '[512, 128]', 'dropout': 0.5255145565158358, 'batch_norm': True, 'lr': 0.00015869238228410527, 'weight_decay': 0.0005178754697165391, 'epochs': 187, 'loss': 'mae', 'optimizer': 'adam', 'graph_mode': 'cutoff', 'cutoff': 0.7486186618809729, 'grm_norm': 'none', 'self_loops': False, 'use_snp_selection': True, 'num_snps': 10847}. Best is trial 54 with value: 0.2986725876748172.
[I 2025-12-08 18:35:25,248] Trial 107 finished with value: 0.263942103515579 and parameters: {'model_type': 'gcn', 'hidden_dims': '[128, 64]', 'dropout': 0.5531396060279249, 'batch_norm': True, 'lr': 3.192767155343621e-05, 'weight_decay': 4.3918253785398914e-05, 'epochs': 290, 'loss': 'mse', 'optimizer': 'adam', 'graph_mode': 'cutoff', 'cutoff': 0.6769267391204251, 'grm_norm': 'cosine', 'self_loops': False, 'use_snp_selection': True, 'num_snps': 33446}. Best is trial 54 with value: 0.2986725876748172.
[I 2025-12-08 18:36:18,335] Trial 108 finished with value: 0.2653907268637476 and parameters: {'model_type': 'gcn', 'hidden_dims': '[512, 256]', 'dropout': 0.5851814302032442, 'batch_norm': True, 'lr': 1.0121643295833628e-05, 'weight_decay': 0.0007695158435474117, 'epochs': 200, 'loss': 'mae', 'optimizer': 'adam', 'graph_mode': 'knn', 'knn_k': 8, 'weighted_edges': True, 'symmetrize_mode': 'union', 'self_loops': False, 'use_snp_selection': False}. Best is trial 54 with value: 0.2986725876748172.
[I 2025-12-08 18:36:32,529] Trial 109 finished with value: 0.27645996810074347 and parameters: {'model_type': 'gcn', 'hidden_dims': '[256, 128]', 'dropout': 0.5654057270119179, 'batch_norm': True, 'lr': 3.616344538647195e-05, 'weight_decay': 6.780995340594371e-05, 'epochs': 262, 'loss': 'mae', 'optimizer': 'adam', 'graph_mode': 'cutoff', 'cutoff': 0.6422118564946655, 'grm_norm': 'cosine_then_gcn', 'self_loops': False, 'use_snp_selection': True, 'num_snps': 5988}. Best is trial 54 with value: 0.2986725876748172.
[I 2025-12-08 18:37:07,239] Trial 110 finished with value: 0.2877674608567381 and parameters: {'model_type': 'gcn', 'hidden_dims': '[512, 256]', 'dropout': 0.5423959742120523, 'batch_norm': False, 'lr': 2.3834560463967065e-05, 'weight_decay': 0.00018012520335741733, 'epochs': 230, 'loss': 'mae', 'optimizer': 'adam', 'graph_mode': 'cutoff', 'cutoff': 0.8110599679939623, 'grm_norm': 'cosine', 'self_loops': False, 'use_snp_selection': True, 'num_snps': 25035}. Best is trial 54 with value: 0.2986725876748172.
[I 2025-12-08 18:37:51,694] Trial 111 finished with value: 0.28748975819122313 and parameters: {'model_type': 'gcn', 'hidden_dims': '[512, 128]', 'dropout': 0.5257222086136137, 'batch_norm': True, 'lr': 0.00010942189779305333, 'weight_decay': 3.6765584921768747e-05, 'epochs': 306, 'loss': 'mae', 'optimizer': 'adam', 'graph_mode': 'cutoff', 'cutoff': 0.7021057978684202, 'grm_norm': 'cosine', 'self_loops': False, 'use_snp_selection': True, 'num_snps': 26863}. Best is trial 54 with value: 0.2986725876748172.
[I 2025-12-08 18:38:30,512] Trial 112 finished with value: 0.27589480525832705 and parameters: {'model_type': 'gcn', 'hidden_dims': '[512, 128]', 'dropout': 0.5389722018949759, 'batch_norm': True, 'lr': 7.344655055120761e-05, 'weight_decay': 3.4249605675720966e-05, 'epochs': 249, 'loss': 'mae', 'optimizer': 'adam', 'graph_mode': 'cutoff', 'cutoff': 0.6689126186213915, 'grm_norm': 'cosine', 'self_loops': False, 'use_snp_selection': True, 'num_snps': 27322}. Best is trial 54 with value: 0.2986725876748172.
[I 2025-12-08 18:39:21,645] Trial 113 finished with value: 0.2850445100960221 and parameters: {'model_type': 'gcn', 'hidden_dims': '[512, 128]', 'dropout': 0.5759742385910603, 'batch_norm': True, 'lr': 0.0001267966600340222, 'weight_decay': 1.4744058715683237e-05, 'epochs': 322, 'loss': 'mae', 'optimizer': 'adam', 'graph_mode': 'cutoff', 'cutoff': 0.7294100933964545, 'grm_norm': 'cosine', 'self_loops': False, 'use_snp_selection': True, 'num_snps': 31035}. Best is trial 54 with value: 0.2986725876748172.
