[I 2025-12-08 11:16:21,104] Trial 130 finished with value: 0.2710979725921273 and parameters: {'model_type': 'gcn', 'hidden_dims': '[256, 128]', 'dropout': 0.45251542813541457, 'batch_norm': True, 'lr': 9.751261832030813e-05, 'weight_decay': 1.4317842387563718e-06, 'epochs': 100, 'loss': 'mae', 'optimizer': 'adam', 'graph_mode': 'cutoff', 'cutoff': 0.8770651505010418, 'grm_norm': 'cosine', 'self_loops': False, 'use_snp_selection': True, 'num_snps': 25425}. Best is trial 97 with value: 0.2840562757484524.
[I 2025-12-08 11:16:53,513] Trial 131 finished with value: 0.2681782422072735 and parameters: {'model_type': 'gcn', 'hidden_dims': '[512, 128]', 'dropout': 0.4654889410542006, 'batch_norm': True, 'lr': 5.408193280571101e-05, 'weight_decay': 6.308789108781184e-07, 'epochs': 122, 'loss': 'mae', 'optimizer': 'adam', 'graph_mode': 'cutoff', 'cutoff': 0.847843617252351, 'grm_norm': 'gcn', 'self_loops': False, 'use_snp_selection': False}. Best is trial 97 with value: 0.2840562757484524.
[I 2025-12-08 11:17:27,585] Trial 132 finished with value: 0.2768455648819504 and parameters: {'model_type': 'gcn', 'hidden_dims': '[512, 128]', 'dropout': 0.4692788914518533, 'batch_norm': True, 'lr': 4.509638311722453e-05, 'weight_decay': 7.696216746822344e-07, 'epochs': 129, 'loss': 'mae', 'optimizer': 'adam', 'graph_mode': 'cutoff', 'cutoff': 0.8125126015642326, 'grm_norm': 'gcn', 'self_loops': False, 'use_snp_selection': False}. Best is trial 97 with value: 0.2840562757484524.
[I 2025-12-08 11:18:04,529] Trial 133 finished with value: 0.27411970295897164 and parameters: {'model_type': 'gcn', 'hidden_dims': '[512, 128]', 'dropout': 0.4970792536463871, 'batch_norm': True, 'lr': 4.0075867041698256e-05, 'weight_decay': 1.0630576767337165e-06, 'epochs': 141, 'loss': 'mae', 'optimizer': 'adam', 'graph_mode': 'cutoff', 'cutoff': 0.8383411037363137, 'grm_norm': 'gcn', 'self_loops': False, 'use_snp_selection': False}. Best is trial 97 with value: 0.2840562757484524.
[I 2025-12-08 11:19:27,009] Trial 134 finished with value: 0.26670425263763303 and parameters: {'model_type': 'gcn', 'hidden_dims': '[512, 128]', 'dropout': 0.50689873105005, 'batch_norm': True, 'lr': 8.145653384082743e-05, 'weight_decay': 1.7198929412603377e-05, 'epochs': 330, 'loss': 'mae', 'optimizer': 'adam', 'graph_mode': 'cutoff', 'cutoff': 0.745452934449339, 'grm_norm': 'gcn', 'self_loops': False, 'use_snp_selection': False}. Best is trial 97 with value: 0.2840562757484524.
[I 2025-12-08 11:19:42,358] Trial 135 finished with value: 0.27056269517589404 and parameters: {'model_type': 'gcn', 'hidden_dims': '[256, 128, 64]', 'dropout': 0.47642073102575677, 'batch_norm': True, 'lr': 6.407180796002049e-05, 'weight_decay': 2.056440637684545e-06, 'epochs': 109, 'loss': 'mae', 'optimizer': 'adam', 'graph_mode': 'cutoff', 'cutoff': 0.798295565217463, 'grm_norm': 'gcn', 'self_loops': False, 'use_snp_selection': False}. Best is trial 97 with value: 0.2840562757484524.
[I 2025-12-08 11:20:21,117] Trial 136 finished with value: 0.2594684586082215 and parameters: {'model_type': 'gcn', 'hidden_dims': '[512, 128]', 'dropout': 0.533592616200657, 'batch_norm': True, 'lr': 4.8404509442250706e-05, 'weight_decay': 4.091673337776684e-07, 'epochs': 148, 'loss': 'mse', 'optimizer': 'adam', 'graph_mode': 'cutoff', 'cutoff': 0.7201396239826681, 'grm_norm': 'cosine', 'self_loops': False, 'use_snp_selection': False}. Best is trial 97 with value: 0.2840562757484524.
[I 2025-12-08 11:20:44,258] Trial 137 finished with value: 0.27515278947341937 and parameters: {'model_type': 'gcn', 'hidden_dims': '[256, 128]', 'dropout': 0.49202511195194715, 'batch_norm': True, 'lr': 0.0001642316772789652, 'weight_decay': 8.046155850881609e-06, 'epochs': 180, 'loss': 'mae', 'optimizer': 'adam', 'graph_mode': 'cutoff', 'cutoff': 0.7022211358176629, 'grm_norm': 'cosine_then_gcn', 'self_loops': True, 'use_snp_selection': False}. Best is trial 97 with value: 0.2840562757484524.
[I 2025-12-08 11:21:05,794] Trial 138 finished with value: 0.27697856613653943 and parameters: {'model_type': 'gcn', 'hidden_dims': '[256, 128]', 'dropout': 0.16281678250760695, 'batch_norm': False, 'lr': 5.4351249283630713e-05, 'weight_decay': 2.7212407511524617e-06, 'epochs': 125, 'loss': 'mae', 'optimizer': 'adam', 'graph_mode': 'cutoff', 'cutoff': 0.6763371819046227, 'grm_norm': 'none', 'self_loops': False, 'use_snp_selection': True, 'num_snps': 32248}. Best is trial 97 with value: 0.2840562757484524.
[I 2025-12-08 11:21:41,748] Trial 139 finished with value: 0.2760766838724141 and parameters: {'model_type': 'gcn', 'hidden_dims': '[512, 128]', 'dropout': 0.4441725620353362, 'batch_norm': True, 'lr': 0.00021497556537870924, 'weight_decay': 8.529559846036328e-07, 'epochs': 137, 'loss': 'mae', 'optimizer': 'adam', 'graph_mode': 'cutoff', 'cutoff': 0.7742587521692177, 'grm_norm': 'gcn', 'self_loops': False, 'use_snp_selection': False}. Best is trial 97 with value: 0.2840562757484524.
[I 2025-12-08 11:22:07,206] Trial 140 finished with value: 0.2615323268622908 and parameters: {'model_type': 'gcn', 'hidden_dims': '[256, 128]', 'dropout': 0.5241070872253543, 'batch_norm': True, 'lr': 7.595507447375641e-05, 'weight_decay': 5.521841560188514e-07, 'epochs': 200, 'loss': 'mae', 'optimizer': 'adam', 'graph_mode': 'cutoff', 'cutoff': 0.7366018138518813, 'grm_norm': 'cosine', 'self_loops': False, 'use_snp_selection': False}. Best is trial 97 with value: 0.2840562757484524.
[I 2025-12-08 11:22:22,008] Trial 141 finished with value: 0.2743337523980019 and parameters: {'model_type': 'gcn', 'hidden_dims': '[256, 128]', 'dropout': 0.4921243013587185, 'batch_norm': True, 'lr': 0.00041482102142981707, 'weight_decay': 1.0054490778529185e-06, 'epochs': 105, 'loss': 'mae', 'optimizer': 'adam', 'graph_mode': 'cutoff', 'cutoff': 0.7499972510440787, 'grm_norm': 'cosine', 'self_loops': False, 'use_snp_selection': False}. Best is trial 97 with value: 0.2840562757484524.
[I 2025-12-08 11:22:36,170] Trial 142 finished with value: 0.2734052844802656 and parameters: {'model_type': 'gcn', 'hidden_dims': '[256, 128]', 'dropout': 0.46323836388413425, 'batch_norm': True, 'lr': 0.000579362723995487, 'weight_decay': 3.396898279628354e-07, 'epochs': 90, 'loss': 'mae', 'optimizer': 'adam', 'graph_mode': 'cutoff', 'cutoff': 0.8234123515051588, 'grm_norm': 'cosine', 'self_loops': False, 'use_snp_selection': False}. Best is trial 97 with value: 0.2840562757484524.
[I 2025-12-08 11:22:52,029] Trial 143 finished with value: 0.2685555597097709 and parameters: {'model_type': 'gcn', 'hidden_dims': '[256, 128]', 'dropout': 0.3932131230619692, 'batch_norm': True, 'lr': 0.0004913787712098678, 'weight_decay': 1.2861633964093266e-06, 'epochs': 117, 'loss': 'mae', 'optimizer': 'adam', 'graph_mode': 'cutoff', 'cutoff': 0.7646452849648615, 'grm_norm': 'cosine', 'self_loops': False, 'use_snp_selection': False}. Best is trial 97 with value: 0.2840562757484524.
[I 2025-12-08 11:23:06,148] Trial 144 finished with value: 0.27258663999096916 and parameters: {'model_type': 'gcn', 'hidden_dims': '[256, 128]', 'dropout': 0.4813222155026895, 'batch_norm': True, 'lr': 0.0006874159566649773, 'weight_decay': 7.070139280958099e-07, 'epochs': 102, 'loss': 'mae', 'optimizer': 'adam', 'graph_mode': 'cutoff', 'cutoff': 0.7121807230676062, 'grm_norm': 'cosine', 'self_loops': False, 'use_snp_selection': False}. Best is trial 97 with value: 0.2840562757484524.
[I 2025-12-08 11:24:19,636] Trial 145 finished with value: 0.27534461493752016 and parameters: {'model_type': 'gcn', 'hidden_dims': '[512, 128]', 'dropout': 0.5112433498282809, 'batch_norm': True, 'lr': 0.0008294089972765589, 'weight_decay': 1.7641681103761925e-06, 'epochs': 292, 'loss': 'mae', 'optimizer': 'adam', 'graph_mode': 'cutoff', 'cutoff': 0.7334227819276025, 'grm_norm': 'cosine_then_gcn', 'self_loops': False, 'use_snp_selection': False}. Best is trial 97 with value: 0.2840562757484524.
[I 2025-12-08 11:24:31,339] Trial 146 finished with value: 0.28125706317599986 and parameters: {'model_type': 'gcn', 'hidden_dims': '[256, 128]', 'dropout': 0.49737379195912906, 'batch_norm': True, 'lr': 0.0003659302752008027, 'weight_decay': 0.00018862503600042586, 'epochs': 81, 'loss': 'mae', 'optimizer': 'adam', 'graph_mode': 'cutoff', 'cutoff': 0.859714622788855, 'grm_norm': 'cosine', 'self_loops': False, 'use_snp_selection': False}. Best is trial 97 with value: 0.2840562757484524.
[I 2025-12-08 11:24:42,872] Trial 147 finished with value: 0.2699758768431848 and parameters: {'model_type': 'gcn', 'hidden_dims': '[256, 128]', 'dropout': 0.5427410374756247, 'batch_norm': True, 'lr': 0.00034659383201367797, 'weight_decay': 0.00029800407053757084, 'epochs': 81, 'loss': 'mae', 'optimizer': 'adam', 'graph_mode': 'cutoff', 'cutoff': 0.8580605308950403, 'grm_norm': 'gcn', 'self_loops': False, 'use_snp_selection': False}. Best is trial 97 with value: 0.2840562757484524.
[I 2025-12-08 11:24:57,028] Trial 148 finished with value: 0.26893316030923536 and parameters: {'model_type': 'gcn', 'hidden_dims': '[512, 128]', 'dropout': 0.505871981027807, 'batch_norm': True, 'lr': 0.00023852567935424184, 'weight_decay': 0.00010079473373971705, 'epochs': 65, 'loss': 'mae', 'optimizer': 'adam', 'graph_mode': 'cutoff', 'cutoff': 0.8911552263500517, 'grm_norm': 'cosine', 'self_loops': True, 'use_snp_selection': True, 'num_snps': 13975}. Best is trial 97 with value: 0.2840562757484524.
[I 2025-12-08 11:25:07,639] Trial 149 finished with value: 0.2603167614773258 and parameters: {'model_type': 'gcn', 'hidden_dims': '[256, 128]', 'dropout': 0.40746400130993693, 'batch_norm': True, 'lr': 2.8606044616993423e-05, 'weight_decay': 0.000770249032463119, 'epochs': 73, 'loss': 'mae', 'optimizer': 'adam', 'graph_mode': 'cutoff', 'cutoff': 0.8671906770166042, 'grm_norm': 'gcn', 'self_loops': False, 'use_snp_selection': False}. Best is trial 97 with value: 0.2840562757484524.
[I 2025-12-08 11:25:38,026] Trial 0 finished with value: 0.23544178279587408 and parameters: {'model_type': 'gcn', 'hidden_dims': '[128, 64]', 'dropout': 0.199031432379812, 'batch_norm': True, 'lr': 1.8408544111075823e-05, 'weight_decay': 5.5136510071208614e-05, 'epochs': 336, 'loss': 'mae', 'optimizer': 'adam', 'graph_mode': 'knn', 'knn_k': 8, 'weighted_edges': True, 'symmetrize_mode': 'mutual', 'self_loops': True, 'use_snp_selection': True, 'num_snps': 27173}. Best is trial 0 with value: 0.23544178279587408.
[I 2025-12-08 11:26:16,595] Trial 1 finished with value: 0.21955713019864284 and parameters: {'model_type': 'gcn', 'hidden_dims': '[256, 128, 64]', 'dropout': 0.5543244404043342, 'batch_norm': True, 'lr': 7.981787657617978e-05, 'weight_decay': 2.8571789869344834e-07, 'epochs': 297, 'loss': 'mae', 'optimizer': 'adam', 'graph_mode': 'cutoff', 'cutoff': 0.3392632777751686, 'grm_norm': 'gcn', 'self_loops': False, 'use_snp_selection': False}. Best is trial 0 with value: 0.23544178279587408.
[I 2025-12-08 11:27:14,763] Trial 2 finished with value: 0.2199516140830558 and parameters: {'model_type': 'gcn', 'hidden_dims': '[512, 64]', 'dropout': 0.32815227354739207, 'batch_norm': True, 'lr': 0.000619605044204259, 'weight_decay': 0.0004086269831625786, 'epochs': 206, 'loss': 'mse', 'optimizer': 'adam', 'graph_mode': 'knn', 'knn_k': 4, 'weighted_edges': True, 'symmetrize_mode': 'union', 'self_loops': True, 'use_snp_selection': True, 'num_snps': 53035}. Best is trial 0 with value: 0.23544178279587408.
[I 2025-12-08 11:27:42,448] Trial 3 finished with value: 0.2125362886940582 and parameters: {'model_type': 'gcn', 'hidden_dims': '[256, 128]', 'dropout': 0.23110783056597514, 'batch_norm': True, 'lr': 8.11311593386298e-05, 'weight_decay': 9.296158109581328e-07, 'epochs': 213, 'loss': 'mse', 'optimizer': 'adam', 'graph_mode': 'knn', 'knn_k': 10, 'weighted_edges': True, 'symmetrize_mode': 'mutual', 'self_loops': True, 'use_snp_selection': False}. Best is trial 0 with value: 0.23544178279587408.
[I 2025-12-08 11:27:57,166] Trial 4 finished with value: 0.28906858736205815 and parameters: {'model_type': 'gcn', 'hidden_dims': '[512, 256]', 'dropout': 0.2753281956415665, 'batch_norm': True, 'lr': 0.00034435188114839693, 'weight_decay': 4.9416012835950194e-05, 'epochs': 89, 'loss': 'mae', 'optimizer': 'adam', 'graph_mode': 'cutoff', 'cutoff': 0.820078967317394, 'grm_norm': 'none', 'self_loops': False, 'use_snp_selection': True, 'num_snps': 12674}. Best is trial 4 with value: 0.28906858736205815.
[I 2025-12-08 11:28:22,395] Trial 5 finished with value: 0.2706119905206549 and parameters: {'model_type': 'gcn', 'hidden_dims': '[128, 64]', 'dropout': 0.5611163934517731, 'batch_norm': True, 'lr': 0.0003984856210762587, 'weight_decay': 1.1466743517565185e-07, 'epochs': 344, 'loss': 'mae', 'optimizer': 'adam', 'graph_mode': 'cutoff', 'cutoff': 0.6089370799714728, 'grm_norm': 'gcn', 'self_loops': True, 'use_snp_selection': False}. Best is trial 4 with value: 0.28906858736205815.
[I 2025-12-08 11:28:45,005] Trial 6 finished with value: 0.2676516944641446 and parameters: {'model_type': 'gcn', 'hidden_dims': '[128, 64]', 'dropout': 0.31805912766941713, 'batch_norm': True, 'lr': 1.2361026034262557e-05, 'weight_decay': 6.492620232791903e-06, 'epochs': 271, 'loss': 'mse', 'optimizer': 'adam', 'graph_mode': 'cutoff', 'cutoff': 0.6193362582230448, 'grm_norm': 'cosine', 'self_loops': False, 'use_snp_selection': True, 'num_snps': 28594}. Best is trial 4 with value: 0.28906858736205815.
[I 2025-12-08 11:29:04,948] Trial 7 finished with value: 0.21785789940459707 and parameters: {'model_type': 'gcn', 'hidden_dims': '[512, 64]', 'dropout': 0.471337288649717, 'batch_norm': True, 'lr': 2.239693207292708e-05, 'weight_decay': 2.263166635514082e-06, 'epochs': 69, 'loss': 'mse', 'optimizer': 'adam', 'graph_mode': 'cutoff', 'cutoff': 0.4056820886426376, 'grm_norm': 'cosine', 'self_loops': False, 'use_snp_selection': False}. Best is trial 4 with value: 0.28906858736205815.
[I 2025-12-08 11:29:42,880] Trial 8 finished with value: 0.2653829870513604 and parameters: {'model_type': 'gcn', 'hidden_dims': '[512, 256]', 'dropout': 0.20659328268932406, 'batch_norm': False, 'lr': 8.93315124361372e-05, 'weight_decay': 0.00028987480727919035, 'epochs': 136, 'loss': 'mae', 'optimizer': 'adam', 'graph_mode': 'knn', 'knn_k': 3, 'weighted_edges': False, 'symmetrize_mode': 'union', 'self_loops': False, 'use_snp_selection': True, 'num_snps': 43128}. Best is trial 4 with value: 0.28906858736205815.
[I 2025-12-08 11:30:25,190] Trial 9 finished with value: 0.1315140335787165 and parameters: {'model_type': 'gcn', 'hidden_dims': '[512, 256]', 'dropout': 0.2888209592870401, 'batch_norm': False, 'lr': 0.004734648143129892, 'weight_decay': 1.5879705591356368e-06, 'epochs': 163, 'loss': 'mse', 'optimizer': 'adam', 'graph_mode': 'cutoff', 'cutoff': 0.5984899797909019, 'grm_norm': 'cosine', 'self_loops': True, 'use_snp_selection': False}. Best is trial 4 with value: 0.28906858736205815.
[I 2025-12-08 11:30:34,429] Trial 10 finished with value: 0.25085796988962394 and parameters: {'model_type': 'gcn', 'hidden_dims': '[512, 128]', 'dropout': 0.11372025982957354, 'batch_norm': False, 'lr': 0.0023343012062770553, 'weight_decay': 4.14440562940608e-05, 'epochs': 41, 'loss': 'mae', 'optimizer': 'adam', 'graph_mode': 'cutoff', 'cutoff': 0.8740100033033124, 'grm_norm': 'none', 'self_loops': False, 'use_snp_selection': True, 'num_snps': 3859}. Best is trial 4 with value: 0.28906858736205815.
[I 2025-12-08 11:30:43,821] Trial 11 finished with value: 0.2887133491680707 and parameters: {'model_type': 'gcn', 'hidden_dims': '[128, 64]', 'dropout': 0.44863014119095845, 'batch_norm': True, 'lr': 0.0005943392021247852, 'weight_decay': 1.0655358607693621e-07, 'epochs': 110, 'loss': 'mae', 'optimizer': 'adam', 'graph_mode': 'cutoff', 'cutoff': 0.8568899271933978, 'grm_norm': 'cosine_then_gcn', 'self_loops': True, 'use_snp_selection': False}. Best is trial 4 with value: 0.28906858736205815.
[I 2025-12-08 11:30:56,008] Trial 12 finished with value: 0.27546779821770384 and parameters: {'model_type': 'gcn', 'hidden_dims': '[512, 256]', 'dropout': 0.42758862319180935, 'batch_norm': True, 'lr': 0.0012059085553112938, 'weight_decay': 3.482253699955131e-05, 'epochs': 103, 'loss': 'mae', 'optimizer': 'adam', 'graph_mode': 'cutoff', 'cutoff': 0.8919050080438428, 'grm_norm': 'cosine_then_gcn', 'self_loops': True, 'use_snp_selection': True, 'num_snps': 6176}. Best is trial 4 with value: 0.28906858736205815.
[I 2025-12-08 11:31:09,447] Trial 13 finished with value: 0.2886931628811563 and parameters: {'model_type': 'gcn', 'hidden_dims': '[256, 128]', 'dropout': 0.4452783958423849, 'batch_norm': True, 'lr': 0.00028764898471530923, 'weight_decay': 8.746795324277564e-06, 'epochs': 96, 'loss': 'mae', 'optimizer': 'adam', 'graph_mode': 'cutoff', 'cutoff': 0.7596101551526167, 'grm_norm': 'cosine_then_gcn', 'self_loops': False, 'use_snp_selection': False}. Best is trial 4 with value: 0.28906858736205815.
[I 2025-12-08 11:31:26,292] Trial 14 finished with value: 0.06906395110730779 and parameters: {'model_type': 'gcn', 'hidden_dims': '[256, 128, 64]', 'dropout': 0.39299544085603144, 'batch_norm': False, 'lr': 0.00903200857050876, 'weight_decay': 0.00014121513384232615, 'epochs': 149, 'loss': 'mae', 'optimizer': 'adam', 'graph_mode': 'cutoff', 'cutoff': 0.7597613116543563, 'grm_norm': 'none', 'self_loops': True, 'use_snp_selection': True, 'num_snps': 16639}. Best is trial 4 with value: 0.28906858736205815.
[I 2025-12-08 11:31:54,679] Trial 15 finished with value: 0.2871024295064825 and parameters: {'model_type': 'gcn', 'hidden_dims': '[512, 128]', 'dropout': 0.49413637725410897, 'batch_norm': True, 'lr': 0.000196808428342167, 'weight_decay': 0.0009750094345805517, 'epochs': 105, 'loss': 'mae', 'optimizer': 'adam', 'graph_mode': 'cutoff', 'cutoff': 0.7577997856891925, 'grm_norm': 'cosine_then_gcn', 'self_loops': False, 'use_snp_selection': False}. Best is trial 4 with value: 0.28906858736205815.
[I 2025-12-08 11:32:12,756] Trial 16 finished with value: 0.267314214755981 and parameters: {'model_type': 'gcn', 'hidden_dims': '[512, 256]', 'dropout': 0.38942865760620465, 'batch_norm': True, 'lr': 0.0008928367148976389, 'weight_decay': 1.5457433294324714e-05, 'epochs': 62, 'loss': 'mae', 'optimizer': 'adam', 'graph_mode': 'cutoff', 'cutoff': 0.47312083257208304, 'grm_norm': 'none', 'self_loops': True, 'use_snp_selection': False}. Best is trial 4 with value: 0.28906858736205815.
[I 2025-12-08 11:32:28,944] Trial 17 finished with value: 0.2446183501315355 and parameters: {'model_type': 'gcn', 'hidden_dims': '[128, 64]', 'dropout': 0.26569157169733837, 'batch_norm': True, 'lr': 0.0018946688370414467, 'weight_decay': 3.960783944293831e-06, 'epochs': 183, 'loss': 'mae', 'optimizer': 'adam', 'graph_mode': 'cutoff', 'cutoff': 0.24434998106921457, 'grm_norm': 'cosine_then_gcn', 'self_loops': False, 'use_snp_selection': True, 'num_snps': 18293}. Best is trial 4 with value: 0.28906858736205815.
[I 2025-12-08 11:32:53,372] Trial 18 finished with value: 0.25277690418011983 and parameters: {'model_type': 'gcn', 'hidden_dims': '[128, 64]', 'dropout': 0.14179314941450072, 'batch_norm': False, 'lr': 0.0001663976206254486, 'weight_decay': 3.019156654015594e-07, 'epochs': 241, 'loss': 'mae', 'optimizer': 'adam', 'graph_mode': 'knn', 'knn_k': 1, 'weighted_edges': False, 'symmetrize_mode': 'mutual', 'self_loops': False, 'use_snp_selection': True, 'num_snps': 37464}. Best is trial 4 with value: 0.28906858736205815.
[I 2025-12-08 11:33:27,013] Trial 19 finished with value: 0.2718886982069547 and parameters: {'model_type': 'gcn', 'hidden_dims': '[512, 256]', 'dropout': 0.5205388824297985, 'batch_norm': True, 'lr': 4.3090025338759115e-05, 'weight_decay': 9.043848591947361e-05, 'epochs': 127, 'loss': 'mae', 'optimizer': 'adam', 'graph_mode': 'cutoff', 'cutoff': 0.7019576735608881, 'grm_norm': 'none', 'self_loops': True, 'use_snp_selection': False}. Best is trial 4 with value: 0.28906858736205815.
[I 2025-12-08 11:33:38,143] Trial 20 finished with value: 0.29170097592558114 and parameters: {'model_type': 'gcn', 'hidden_dims': '[256, 128, 64]', 'dropout': 0.5972527462583626, 'batch_norm': True, 'lr': 0.0004217087501867552, 'weight_decay': 1.9534206105170314e-05, 'epochs': 73, 'loss': 'mae', 'optimizer': 'adam', 'graph_mode': 'cutoff', 'cutoff': 0.8382869403211903, 'grm_norm': 'cosine_then_gcn', 'self_loops': False, 'use_snp_selection': False}. Best is trial 20 with value: 0.29170097592558114.
[I 2025-12-08 11:33:50,249] Trial 21 finished with value: 0.30229010457691874 and parameters: {'model_type': 'gcn', 'hidden_dims': '[256, 128, 64]', 'dropout': 0.5916123333422962, 'batch_norm': True, 'lr': 0.0005207778480196576, 'weight_decay': 2.6086871179536294e-05, 'epochs': 81, 'loss': 'mae', 'optimizer': 'adam', 'graph_mode': 'cutoff', 'cutoff': 0.8374395230692492, 'grm_norm': 'cosine_then_gcn', 'self_loops': False, 'use_snp_selection': False}. Best is trial 21 with value: 0.30229010457691874.
[I 2025-12-08 11:34:01,015] Trial 22 finished with value: 0.29020445085032726 and parameters: {'model_type': 'gcn', 'hidden_dims': '[256, 128, 64]', 'dropout': 0.587082503480965, 'batch_norm': True, 'lr': 0.0003227546293779025, 'weight_decay': 1.7511333359835744e-05, 'epochs': 70, 'loss': 'mae', 'optimizer': 'adam', 'graph_mode': 'cutoff', 'cutoff': 0.8159132959529396, 'grm_norm': 'cosine_then_gcn', 'self_loops': False, 'use_snp_selection': False}. Best is trial 21 with value: 0.30229010457691874.
[I 2025-12-08 11:34:08,753] Trial 23 finished with value: 0.26835917916867835 and parameters: {'model_type': 'gcn', 'hidden_dims': '[256, 128, 64]', 'dropout': 0.599074230972851, 'batch_norm': True, 'lr': 0.00019174801601637564, 'weight_decay': 2.0110064183673762e-05, 'epochs': 44, 'loss': 'mae', 'optimizer': 'adam', 'graph_mode': 'cutoff', 'cutoff': 0.6897780447454863, 'grm_norm': 'cosine_then_gcn', 'self_loops': False, 'use_snp_selection': False}. Best is trial 21 with value: 0.30229010457691874.
