[I 2025-12-08 18:05:37,644] Trial 108 finished with value: 0.26640183571055526 and parameters: {'model_type': 'gcn', 'hidden_dims': '[512, 256]', 'dropout': 0.2418552422728201, 'batch_norm': True, 'lr': 8.020163891944993e-05, 'weight_decay': 4.4666789558094526e-06, 'epochs': 132, 'loss': 'mae', 'optimizer': 'adam', 'graph_mode': 'knn', 'knn_k': 2, 'weighted_edges': True, 'symmetrize_mode': 'mutual', 'self_loops': True, 'use_snp_selection': True, 'num_snps': 47680}. Best is trial 101 with value: 0.37915665729389936.
[I 2025-12-08 18:06:01,448] Trial 109 finished with value: 0.3590382075734448 and parameters: {'model_type': 'gcn', 'hidden_dims': '[256, 128]', 'dropout': 0.1872565280583712, 'batch_norm': False, 'lr': 0.0005276969280993864, 'weight_decay': 7.576563905169875e-06, 'epochs': 142, 'loss': 'mae', 'optimizer': 'adam', 'graph_mode': 'cutoff', 'cutoff': 0.718687501469573, 'grm_norm': 'cosine_then_gcn', 'self_loops': True, 'use_snp_selection': True, 'num_snps': 35131}. Best is trial 101 with value: 0.37915665729389936.
[I 2025-12-08 18:06:30,747] Trial 110 finished with value: 0.355017662669493 and parameters: {'model_type': 'gcn', 'hidden_dims': '[512, 128]', 'dropout': 0.2637610136490918, 'batch_norm': False, 'lr': 0.0003327015646137962, 'weight_decay': 2.018622503355975e-06, 'epochs': 224, 'loss': 'mae', 'optimizer': 'adam', 'graph_mode': 'cutoff', 'cutoff': 0.6388514981401586, 'grm_norm': 'cosine_then_gcn', 'self_loops': True, 'use_snp_selection': True, 'num_snps': 20622}. Best is trial 101 with value: 0.37915665729389936.
[I 2025-12-08 18:07:08,411] Trial 111 finished with value: 0.37153475385691104 and parameters: {'model_type': 'gcn', 'hidden_dims': '[512, 128]', 'dropout': 0.23795351382096333, 'batch_norm': False, 'lr': 0.0002546023022986858, 'weight_decay': 7.6213460681953885e-06, 'epochs': 163, 'loss': 'mae', 'optimizer': 'adam', 'graph_mode': 'cutoff', 'cutoff': 0.5540662106873884, 'grm_norm': 'cosine_then_gcn', 'self_loops': True, 'use_snp_selection': True, 'num_snps': 38206}. Best is trial 101 with value: 0.37915665729389936.
[I 2025-12-08 18:07:44,294] Trial 112 finished with value: 0.37697178356194916 and parameters: {'model_type': 'gcn', 'hidden_dims': '[512, 128]', 'dropout': 0.24890908520798466, 'batch_norm': False, 'lr': 0.0001855617582020665, 'weight_decay': 9.412267609045472e-06, 'epochs': 163, 'loss': 'mae', 'optimizer': 'adam', 'graph_mode': 'cutoff', 'cutoff': 0.5494485518354489, 'grm_norm': 'cosine_then_gcn', 'self_loops': True, 'use_snp_selection': True, 'num_snps': 36141}. Best is trial 101 with value: 0.37915665729389936.
[I 2025-12-08 18:08:21,058] Trial 113 finished with value: 0.35692516494787674 and parameters: {'model_type': 'gcn', 'hidden_dims': '[512, 128]', 'dropout': 0.24176979503698476, 'batch_norm': False, 'lr': 0.0001829261229118776, 'weight_decay': 1.4969466706382394e-05, 'epochs': 163, 'loss': 'mae', 'optimizer': 'adam', 'graph_mode': 'cutoff', 'cutoff': 0.4900607114709442, 'grm_norm': 'cosine_then_gcn', 'self_loops': True, 'use_snp_selection': True, 'num_snps': 36567}. Best is trial 101 with value: 0.37915665729389936.
[I 2025-12-08 18:08:59,870] Trial 114 finished with value: 0.36934591943665995 and parameters: {'model_type': 'gcn', 'hidden_dims': '[512, 128]', 'dropout': 0.24959693416597187, 'batch_norm': False, 'lr': 0.00014316889273950027, 'weight_decay': 9.911162980691614e-06, 'epochs': 168, 'loss': 'mae', 'optimizer': 'adam', 'graph_mode': 'cutoff', 'cutoff': 0.5752418771678023, 'grm_norm': 'cosine_then_gcn', 'self_loops': True, 'use_snp_selection': True, 'num_snps': 38997}. Best is trial 101 with value: 0.37915665729389936.
[I 2025-12-08 18:09:33,011] Trial 115 finished with value: 0.36970768857391606 and parameters: {'model_type': 'gcn', 'hidden_dims': '[512, 128]', 'dropout': 0.277672861313408, 'batch_norm': False, 'lr': 0.00022241101797428682, 'weight_decay': 6.462015197580617e-06, 'epochs': 176, 'loss': 'mae', 'optimizer': 'adam', 'graph_mode': 'cutoff', 'cutoff': 0.5354705346188348, 'grm_norm': 'gcn', 'self_loops': True, 'use_snp_selection': True, 'num_snps': 30223}. Best is trial 101 with value: 0.37915665729389936.
[I 2025-12-08 18:10:10,931] Trial 116 finished with value: 0.3511062356036126 and parameters: {'model_type': 'gcn', 'hidden_dims': '[512, 128]', 'dropout': 0.28010693085392635, 'batch_norm': False, 'lr': 0.00022137246476634627, 'weight_decay': 6.061310424691228e-06, 'epochs': 193, 'loss': 'mse', 'optimizer': 'adam', 'graph_mode': 'cutoff', 'cutoff': 0.519019656364083, 'grm_norm': 'gcn', 'self_loops': True, 'use_snp_selection': True, 'num_snps': 33559}. Best is trial 101 with value: 0.37915665729389936.
[I 2025-12-08 18:10:44,617] Trial 117 finished with value: 0.3537517433914887 and parameters: {'model_type': 'gcn', 'hidden_dims': '[512, 128]', 'dropout': 0.2630511196532217, 'batch_norm': False, 'lr': 0.00017526732890302615, 'weight_decay': 9.549057962146435e-05, 'epochs': 176, 'loss': 'mae', 'optimizer': 'adam', 'graph_mode': 'cutoff', 'cutoff': 0.4571212366467745, 'grm_norm': 'gcn', 'self_loops': True, 'use_snp_selection': True, 'num_snps': 30892}. Best is trial 101 with value: 0.37915665729389936.
[I 2025-12-08 18:11:28,905] Trial 118 finished with value: 0.36507737584563604 and parameters: {'model_type': 'gcn', 'hidden_dims': '[512, 128]', 'dropout': 0.25460138881424127, 'batch_norm': False, 'lr': 0.00040014551799576886, 'weight_decay': 4.812428295746695e-06, 'epochs': 210, 'loss': 'mae', 'optimizer': 'adam', 'graph_mode': 'cutoff', 'cutoff': 0.8739092080978028, 'grm_norm': 'gcn', 'self_loops': False, 'use_snp_selection': True, 'num_snps': 38374}. Best is trial 101 with value: 0.37915665729389936.
[I 2025-12-08 18:12:16,712] Trial 119 finished with value: 0.37085008421182397 and parameters: {'model_type': 'gcn', 'hidden_dims': '[512, 128]', 'dropout': 0.20341609212803158, 'batch_norm': False, 'lr': 0.00023796733058917564, 'weight_decay': 2.462691892626061e-06, 'epochs': 187, 'loss': 'mae', 'optimizer': 'adam', 'graph_mode': 'cutoff', 'cutoff': 0.5411003836118636, 'grm_norm': 'gcn', 'self_loops': True, 'use_snp_selection': False}. Best is trial 101 with value: 0.37915665729389936.
[I 2025-12-08 18:13:11,613] Trial 120 finished with value: 0.36671523752044355 and parameters: {'model_type': 'gcn', 'hidden_dims': '[512, 128]', 'dropout': 0.1749142461657233, 'batch_norm': False, 'lr': 0.0003485870371308915, 'weight_decay': 2.919859396800778e-06, 'epochs': 217, 'loss': 'mae', 'optimizer': 'adam', 'graph_mode': 'cutoff', 'cutoff': 0.6003497664229683, 'grm_norm': 'none', 'self_loops': True, 'use_snp_selection': False}. Best is trial 101 with value: 0.37915665729389936.
[I 2025-12-08 18:13:59,676] Trial 121 finished with value: 0.3736160274582899 and parameters: {'model_type': 'gcn', 'hidden_dims': '[512, 128]', 'dropout': 0.22532472535695064, 'batch_norm': False, 'lr': 0.00012044287107608696, 'weight_decay': 1.6582045071948244e-06, 'epochs': 188, 'loss': 'mae', 'optimizer': 'adam', 'graph_mode': 'cutoff', 'cutoff': 0.5385210439490782, 'grm_norm': 'gcn', 'self_loops': True, 'use_snp_selection': False}. Best is trial 101 with value: 0.37915665729389936.
[I 2025-12-08 18:14:47,682] Trial 122 finished with value: 0.36539429790578976 and parameters: {'model_type': 'gcn', 'hidden_dims': '[512, 128]', 'dropout': 0.21035166482010767, 'batch_norm': False, 'lr': 0.00011953041588298906, 'weight_decay': 1.6567343852835022e-06, 'epochs': 188, 'loss': 'mae', 'optimizer': 'adam', 'graph_mode': 'cutoff', 'cutoff': 0.5454100369392706, 'grm_norm': 'gcn', 'self_loops': True, 'use_snp_selection': False}. Best is trial 101 with value: 0.37915665729389936.
[I 2025-12-08 18:15:38,668] Trial 123 finished with value: 0.35682422315233636 and parameters: {'model_type': 'gcn', 'hidden_dims': '[512, 128]', 'dropout': 0.2215181453336457, 'batch_norm': False, 'lr': 0.00018431817376868655, 'weight_decay': 1.171125621488768e-06, 'epochs': 200, 'loss': 'mae', 'optimizer': 'adam', 'graph_mode': 'cutoff', 'cutoff': 0.5106366653646522, 'grm_norm': 'gcn', 'self_loops': True, 'use_snp_selection': False}. Best is trial 101 with value: 0.37915665729389936.
[I 2025-12-08 18:16:25,372] Trial 124 finished with value: 0.3650130677929858 and parameters: {'model_type': 'gcn', 'hidden_dims': '[512, 128]', 'dropout': 0.20288852740401095, 'batch_norm': False, 'lr': 9.764117068316573e-05, 'weight_decay': 8.844676244865683e-07, 'epochs': 183, 'loss': 'mae', 'optimizer': 'adam', 'graph_mode': 'cutoff', 'cutoff': 0.7654608189298124, 'grm_norm': 'gcn', 'self_loops': True, 'use_snp_selection': False}. Best is trial 101 with value: 0.37915665729389936.
[I 2025-12-08 18:17:09,477] Trial 125 finished with value: 0.3482084926950042 and parameters: {'model_type': 'gcn', 'hidden_dims': '[512, 128]', 'dropout': 0.2331022261358336, 'batch_norm': False, 'lr': 0.00025902901010295653, 'weight_decay': 2.3007606873548313e-06, 'epochs': 171, 'loss': 'mae', 'optimizer': 'adam', 'graph_mode': 'cutoff', 'cutoff': 0.5015623546432333, 'grm_norm': 'gcn', 'self_loops': True, 'use_snp_selection': False}. Best is trial 101 with value: 0.37915665729389936.
[I 2025-12-08 18:17:59,771] Trial 126 finished with value: 0.3699687810112766 and parameters: {'model_type': 'gcn', 'hidden_dims': '[512, 128]', 'dropout': 0.18360123659080957, 'batch_norm': False, 'lr': 0.00015670396631658877, 'weight_decay': 2.4670211806647455e-06, 'epochs': 197, 'loss': 'mae', 'optimizer': 'adam', 'graph_mode': 'cutoff', 'cutoff': 0.585210422731615, 'grm_norm': 'cosine_then_gcn', 'self_loops': True, 'use_snp_selection': False}. Best is trial 101 with value: 0.37915665729389936.
[I 2025-12-08 18:18:47,342] Trial 127 finished with value: 0.3726319618858198 and parameters: {'model_type': 'gcn', 'hidden_dims': '[512, 128]', 'dropout': 0.22601663470961114, 'batch_norm': False, 'lr': 0.00012268994147711886, 'weight_decay': 0.00037532364818766863, 'epochs': 180, 'loss': 'mae', 'optimizer': 'adam', 'graph_mode': 'cutoff', 'cutoff': 0.5674500574053285, 'grm_norm': 'cosine_then_gcn', 'self_loops': True, 'use_snp_selection': False}. Best is trial 101 with value: 0.37915665729389936.
[I 2025-12-08 18:19:40,902] Trial 128 finished with value: 0.26890851544315025 and parameters: {'model_type': 'gcn', 'hidden_dims': '[512, 128]', 'dropout': 0.23895484824909516, 'batch_norm': True, 'lr': 0.00013501474769964108, 'weight_decay': 0.00024188451396717125, 'epochs': 205, 'loss': 'mae', 'optimizer': 'adam', 'graph_mode': 'knn', 'knn_k': 7, 'weighted_edges': True, 'symmetrize_mode': 'mutual', 'self_loops': True, 'use_snp_selection': False}. Best is trial 101 with value: 0.37915665729389936.
[I 2025-12-08 18:20:28,368] Trial 129 finished with value: 0.3694645234368141 and parameters: {'model_type': 'gcn', 'hidden_dims': '[512, 256]', 'dropout': 0.22597949190401115, 'batch_norm': False, 'lr': 0.00012497634647496423, 'weight_decay': 0.0009692155484329878, 'epochs': 185, 'loss': 'mae', 'optimizer': 'adam', 'graph_mode': 'cutoff', 'cutoff': 0.5665926433523916, 'grm_norm': 'cosine_then_gcn', 'self_loops': True, 'use_snp_selection': False}. Best is trial 101 with value: 0.37915665729389936.
[I 2025-12-08 18:21:17,190] Trial 130 finished with value: 0.3306350370339794 and parameters: {'model_type': 'gcn', 'hidden_dims': '[512, 64]', 'dropout': 0.2133231509949862, 'batch_norm': False, 'lr': 0.00016649890053784528, 'weight_decay': 1.4811735444988212e-06, 'epochs': 191, 'loss': 'mae', 'optimizer': 'adam', 'graph_mode': 'cutoff', 'cutoff': 0.5167283565722451, 'grm_norm': 'gcn', 'self_loops': True, 'use_snp_selection': False}. Best is trial 101 with value: 0.37915665729389936.
[I 2025-12-08 18:21:59,855] Trial 131 finished with value: 0.3731579628192776 and parameters: {'model_type': 'gcn', 'hidden_dims': '[512, 128]', 'dropout': 0.24672327905128688, 'batch_norm': False, 'lr': 0.00019711366719647692, 'weight_decay': 3.7145771229566807e-06, 'epochs': 165, 'loss': 'mae', 'optimizer': 'adam', 'graph_mode': 'cutoff', 'cutoff': 0.5473581283753258, 'grm_norm': 'cosine_then_gcn', 'self_loops': True, 'use_snp_selection': False}. Best is trial 101 with value: 0.37915665729389936.
[I 2025-12-08 18:22:42,503] Trial 132 finished with value: 0.36776995588424854 and parameters: {'model_type': 'gcn', 'hidden_dims': '[512, 128]', 'dropout': 0.2301636965980265, 'batch_norm': False, 'lr': 0.00020477261683193745, 'weight_decay': 0.00046387471889391935, 'epochs': 165, 'loss': 'mae', 'optimizer': 'adam', 'graph_mode': 'cutoff', 'cutoff': 0.5517163479543089, 'grm_norm': 'cosine_then_gcn', 'self_loops': True, 'use_snp_selection': False}. Best is trial 101 with value: 0.37915665729389936.
[I 2025-12-08 18:23:28,052] Trial 133 finished with value: 0.372408583277194 and parameters: {'model_type': 'gcn', 'hidden_dims': '[512, 128]', 'dropout': 0.24769237328670865, 'batch_norm': False, 'lr': 0.00015157241390003484, 'weight_decay': 4.0241576043766e-06, 'epochs': 177, 'loss': 'mae', 'optimizer': 'adam', 'graph_mode': 'cutoff', 'cutoff': 0.5371200549531124, 'grm_norm': 'cosine_then_gcn', 'self_loops': True, 'use_snp_selection': False}. Best is trial 101 with value: 0.37915665729389936.
[I 2025-12-08 18:24:15,016] Trial 134 finished with value: 0.3715287949923792 and parameters: {'model_type': 'gcn', 'hidden_dims': '[512, 128]', 'dropout': 0.24947376349308198, 'batch_norm': False, 'lr': 0.00014879418520772684, 'weight_decay': 3.442171482328968e-06, 'epochs': 183, 'loss': 'mae', 'optimizer': 'adam', 'graph_mode': 'cutoff', 'cutoff': 0.52792102037456, 'grm_norm': 'cosine_then_gcn', 'self_loops': True, 'use_snp_selection': False}. Best is trial 101 with value: 0.37915665729389936.
[I 2025-12-08 18:24:59,824] Trial 135 finished with value: 0.35416794741186736 and parameters: {'model_type': 'gcn', 'hidden_dims': '[512, 128]', 'dropout': 0.2470332300755386, 'batch_norm': False, 'lr': 0.00014521283470526585, 'weight_decay': 3.78542528345302e-06, 'epochs': 173, 'loss': 'mae', 'optimizer': 'adam', 'graph_mode': 'cutoff', 'cutoff': 0.485179862652919, 'grm_norm': 'cosine_then_gcn', 'self_loops': True, 'use_snp_selection': False}. Best is trial 101 with value: 0.37915665729389936.
[I 2025-12-08 18:25:46,113] Trial 136 finished with value: 0.37085092332476866 and parameters: {'model_type': 'gcn', 'hidden_dims': '[512, 128]', 'dropout': 0.21875514864608808, 'batch_norm': False, 'lr': 0.00011392499624487792, 'weight_decay': 4.941104178580043e-06, 'epochs': 180, 'loss': 'mae', 'optimizer': 'adam', 'graph_mode': 'cutoff', 'cutoff': 0.5270623303313885, 'grm_norm': 'cosine_then_gcn', 'self_loops': True, 'use_snp_selection': False}. Best is trial 101 with value: 0.37915665729389936.
[I 2025-12-08 18:26:26,587] Trial 137 finished with value: 0.37188360664689435 and parameters: {'model_type': 'gcn', 'hidden_dims': '[512, 128]', 'dropout': 0.2548141672843176, 'batch_norm': False, 'lr': 0.0001818267227949834, 'weight_decay': 3.055799720014477e-06, 'epochs': 156, 'loss': 'mae', 'optimizer': 'adam', 'graph_mode': 'cutoff', 'cutoff': 0.5598009441978242, 'grm_norm': 'cosine_then_gcn', 'self_loops': True, 'use_snp_selection': False}. Best is trial 101 with value: 0.37915665729389936.
[I 2025-12-08 18:27:06,902] Trial 138 finished with value: 0.33141325950019 and parameters: {'model_type': 'gcn', 'hidden_dims': '[512, 128]', 'dropout': 0.23747519398535452, 'batch_norm': False, 'lr': 0.00018339949561179352, 'weight_decay': 3.4684887847178076e-05, 'epochs': 155, 'loss': 'mse', 'optimizer': 'adam', 'graph_mode': 'cutoff', 'cutoff': 0.5589961250595742, 'grm_norm': 'cosine_then_gcn', 'self_loops': True, 'use_snp_selection': False}. Best is trial 101 with value: 0.37915665729389936.
[I 2025-12-08 18:27:44,977] Trial 139 finished with value: 0.36783597113604305 and parameters: {'model_type': 'gcn', 'hidden_dims': '[512, 128]', 'dropout': 0.26260758646502885, 'batch_norm': False, 'lr': 9.615221662506904e-05, 'weight_decay': 9.936648217029992e-06, 'epochs': 146, 'loss': 'mae', 'optimizer': 'adam', 'graph_mode': 'cutoff', 'cutoff': 0.5703159832709459, 'grm_norm': 'cosine_then_gcn', 'self_loops': True, 'use_snp_selection': False}. Best is trial 101 with value: 0.37915665729389936.
[I 2025-12-08 18:28:06,500] Trial 140 finished with value: 0.3549363198365693 and parameters: {'model_type': 'gcn', 'hidden_dims': '[256, 128, 64]', 'dropout': 0.22580769619639096, 'batch_norm': False, 'lr': 0.0002828833791206057, 'weight_decay': 4.145131848111164e-06, 'epochs': 161, 'loss': 'mae', 'optimizer': 'adam', 'graph_mode': 'cutoff', 'cutoff': 0.5412219972287249, 'grm_norm': 'cosine_then_gcn', 'self_loops': False, 'use_snp_selection': False}. Best is trial 101 with value: 0.37915665729389936.
[I 2025-12-08 18:29:33,366] Trial 141 finished with value: 0.35980407378626456 and parameters: {'model_type': 'gcn', 'hidden_dims': '[512, 128]', 'dropout': 0.25703192978796674, 'batch_norm': False, 'lr': 0.00015501742391090076, 'weight_decay': 3.086697758930471e-06, 'epochs': 349, 'loss': 'mae', 'optimizer': 'adam', 'graph_mode': 'cutoff', 'cutoff': 0.5198031792859938, 'grm_norm': 'cosine_then_gcn', 'self_loops': True, 'use_snp_selection': False}. Best is trial 101 with value: 0.37915665729389936.
[I 2025-12-08 18:30:19,707] Trial 142 finished with value: 0.3680006791269717 and parameters: {'model_type': 'gcn', 'hidden_dims': '[512, 128]', 'dropout': 0.2506851218225617, 'batch_norm': False, 'lr': 0.00020355786878092417, 'weight_decay': 7.084013382502009e-06, 'epochs': 181, 'loss': 'mae', 'optimizer': 'adam', 'graph_mode': 'cutoff', 'cutoff': 0.5553689026325528, 'grm_norm': 'cosine_then_gcn', 'self_loops': True, 'use_snp_selection': False}. Best is trial 101 with value: 0.37915665729389936.
[I 2025-12-08 18:31:04,137] Trial 143 finished with value: 0.36353815009613694 and parameters: {'model_type': 'gcn', 'hidden_dims': '[512, 128]', 'dropout': 0.24151550056860618, 'batch_norm': False, 'lr': 0.00012851855585315996, 'weight_decay': 3.1727659896442407e-06, 'epochs': 172, 'loss': 'mae', 'optimizer': 'adam', 'graph_mode': 'cutoff', 'cutoff': 0.5039503645322659, 'grm_norm': 'cosine_then_gcn', 'self_loops': True, 'use_snp_selection': False}. Best is trial 101 with value: 0.37915665729389936.
[I 2025-12-08 18:31:44,326] Trial 144 finished with value: 0.37272402813815353 and parameters: {'model_type': 'gcn', 'hidden_dims': '[512, 128]', 'dropout': 0.5073031777194708, 'batch_norm': False, 'lr': 0.00016148994168729846, 'weight_decay': 4.252788412418922e-06, 'epochs': 155, 'loss': 'mae', 'optimizer': 'adam', 'graph_mode': 'cutoff', 'cutoff': 0.5316875894123665, 'grm_norm': 'cosine_then_gcn', 'self_loops': True, 'use_snp_selection': False}. Best is trial 101 with value: 0.37915665729389936.
[I 2025-12-08 18:32:20,585] Trial 145 finished with value: 0.3471013979210585 and parameters: {'model_type': 'gcn', 'hidden_dims': '[512, 128]', 'dropout': 0.5165911091372724, 'batch_norm': False, 'lr': 0.00023693477033258698, 'weight_decay': 4.8582039667096846e-06, 'epochs': 138, 'loss': 'mae', 'optimizer': 'adam', 'graph_mode': 'cutoff', 'cutoff': 0.6107213264116085, 'grm_norm': 'cosine', 'self_loops': True, 'use_snp_selection': False}. Best is trial 101 with value: 0.37915665729389936.
[I 2025-12-08 18:32:32,499] Trial 146 finished with value: 0.25485167342514037 and parameters: {'model_type': 'gcn', 'hidden_dims': '[128, 64]', 'dropout': 0.5989614814241819, 'batch_norm': False, 'lr': 8.047695740768947e-05, 'weight_decay': 5.982204116768434e-05, 'epochs': 148, 'loss': 'mae', 'optimizer': 'adam', 'graph_mode': 'cutoff', 'cutoff': 0.46809815242735475, 'grm_norm': 'cosine_then_gcn', 'self_loops': True, 'use_snp_selection': False}. Best is trial 101 with value: 0.37915665729389936.
[I 2025-12-08 18:33:14,708] Trial 147 finished with value: 0.27345056210135166 and parameters: {'model_type': 'gcn', 'hidden_dims': '[512, 128]', 'dropout': 0.5428777085739565, 'batch_norm': False, 'lr': 0.00017734877015281858, 'weight_decay': 8.59762854076089e-06, 'epochs': 163, 'loss': 'mae', 'optimizer': 'adam', 'graph_mode': 'cutoff', 'cutoff': 0.5816770656867425, 'grm_norm': 'cosine_then_gcn', 'self_loops': True, 'use_snp_selection': False}. Best is trial 101 with value: 0.37915665729389936.
[I 2025-12-08 18:33:54,517] Trial 148 finished with value: 0.3667855644160062 and parameters: {'model_type': 'gcn', 'hidden_dims': '[512, 128]', 'dropout': 0.2321562140527099, 'batch_norm': False, 'lr': 0.00011216348817909096, 'weight_decay': 4.243277527507227e-06, 'epochs': 153, 'loss': 'mae', 'optimizer': 'adam', 'graph_mode': 'cutoff', 'cutoff': 0.5640775236684727, 'grm_norm': 'cosine_then_gcn', 'self_loops': True, 'use_snp_selection': False}. Best is trial 101 with value: 0.37915665729389936.
[I 2025-12-08 18:34:28,107] Trial 149 finished with value: 0.3683611554531311 and parameters: {'model_type': 'gcn', 'hidden_dims': '[512, 128]', 'dropout': 0.4743499239455731, 'batch_norm': False, 'lr': 0.00019334564622262854, 'weight_decay': 5.921777988234976e-06, 'epochs': 127, 'loss': 'mae', 'optimizer': 'adam', 'graph_mode': 'cutoff', 'cutoff': 0.5404141779345301, 'grm_norm': 'cosine_then_gcn', 'self_loops': True, 'use_snp_selection': False}. Best is trial 101 with value: 0.37915665729389936.
[I 2025-12-08 18:35:01,947] Trial 0 finished with value: 0.274934529396374 and parameters: {'model_type': 'gcn', 'hidden_dims': '[128, 64]', 'dropout': 0.199031432379812, 'batch_norm': True, 'lr': 1.8408544111075823e-05, 'weight_decay': 5.5136510071208614e-05, 'epochs': 336, 'loss': 'mae', 'optimizer': 'adam', 'graph_mode': 'knn', 'knn_k': 8, 'weighted_edges': True, 'symmetrize_mode': 'mutual', 'self_loops': True, 'use_snp_selection': True, 'num_snps': 27173}. Best is trial 0 with value: 0.274934529396374.
