[I 2025-12-08 16:06:01,987] Trial 88 finished with value: 0.22611902488105562 and parameters: {'model_type': 'gcn', 'hidden_dims': '[512, 128]', 'dropout': 0.16582708838777452, 'batch_norm': True, 'lr': 7.380862696298e-05, 'weight_decay': 0.0007726359497610251, 'epochs': 40, 'loss': 'mae', 'optimizer': 'adam', 'graph_mode': 'cutoff', 'cutoff': 0.5045013348858449, 'grm_norm': 'gcn', 'self_loops': False, 'use_snp_selection': False}. Best is trial 21 with value: 0.3153339696847911.
[I 2025-12-08 16:06:39,428] Trial 89 finished with value: 0.2360630166530162 and parameters: {'model_type': 'gcn', 'hidden_dims': '[512, 64]', 'dropout': 0.44213675382188145, 'batch_norm': True, 'lr': 0.0004951487559051199, 'weight_decay': 0.0005705091244181295, 'epochs': 138, 'loss': 'mae', 'optimizer': 'adam', 'graph_mode': 'knn', 'knn_k': 6, 'weighted_edges': True, 'symmetrize_mode': 'mutual', 'self_loops': False, 'use_snp_selection': False}. Best is trial 21 with value: 0.3153339696847911.
[I 2025-12-08 16:07:01,389] Trial 90 finished with value: 0.3066624253195189 and parameters: {'model_type': 'gcn', 'hidden_dims': '[512, 128]', 'dropout': 0.3046285973632738, 'batch_norm': True, 'lr': 0.00011969684800253745, 'weight_decay': 0.0009910523904930457, 'epochs': 115, 'loss': 'mse', 'optimizer': 'adam', 'graph_mode': 'cutoff', 'cutoff': 0.768346876074172, 'grm_norm': 'gcn', 'self_loops': False, 'use_snp_selection': True, 'num_snps': 21847}. Best is trial 21 with value: 0.3153339696847911.
[I 2025-12-08 16:07:43,315] Trial 91 finished with value: 0.3089612640038951 and parameters: {'model_type': 'gcn', 'hidden_dims': '[512, 128]', 'dropout': 0.36994784949586956, 'batch_norm': True, 'lr': 0.0019425992698570223, 'weight_decay': 3.962123913546828e-05, 'epochs': 159, 'loss': 'mae', 'optimizer': 'adam', 'graph_mode': 'cutoff', 'cutoff': 0.7887340124500577, 'grm_norm': 'cosine_then_gcn', 'self_loops': False, 'use_snp_selection': False}. Best is trial 21 with value: 0.3153339696847911.
[I 2025-12-08 16:08:36,034] Trial 92 finished with value: 0.29916815222838006 and parameters: {'model_type': 'gcn', 'hidden_dims': '[512, 128]', 'dropout': 0.34161643206594383, 'batch_norm': True, 'lr': 0.002842812361780689, 'weight_decay': 0.00030919278886071695, 'epochs': 204, 'loss': 'mae', 'optimizer': 'adam', 'graph_mode': 'cutoff', 'cutoff': 0.8146264615580888, 'grm_norm': 'none', 'self_loops': False, 'use_snp_selection': False}. Best is trial 21 with value: 0.3153339696847911.
[I 2025-12-08 16:09:10,271] Trial 93 finished with value: 0.30545897692816815 and parameters: {'model_type': 'gcn', 'hidden_dims': '[512, 128]', 'dropout': 0.22655032272753, 'batch_norm': True, 'lr': 0.0013362596926497078, 'weight_decay': 0.0002182704595889571, 'epochs': 128, 'loss': 'mae', 'optimizer': 'adam', 'graph_mode': 'cutoff', 'cutoff': 0.8746506228379772, 'grm_norm': 'none', 'self_loops': False, 'use_snp_selection': False}. Best is trial 21 with value: 0.3153339696847911.
[I 2025-12-08 16:09:38,904] Trial 94 finished with value: 0.3107049636577017 and parameters: {'model_type': 'gcn', 'hidden_dims': '[512, 128]', 'dropout': 0.5393380171728804, 'batch_norm': True, 'lr': 0.000199044475455476, 'weight_decay': 0.0004214884560806075, 'epochs': 103, 'loss': 'mae', 'optimizer': 'adam', 'graph_mode': 'cutoff', 'cutoff': 0.7976001591576176, 'grm_norm': 'cosine', 'self_loops': False, 'use_snp_selection': False}. Best is trial 21 with value: 0.3153339696847911.
[I 2025-12-08 16:09:53,945] Trial 95 finished with value: 0.30659671447162445 and parameters: {'model_type': 'gcn', 'hidden_dims': '[256, 128, 64]', 'dropout': 0.5842681796631755, 'batch_norm': True, 'lr': 0.0002034839893778614, 'weight_decay': 0.000387786876928202, 'epochs': 100, 'loss': 'mae', 'optimizer': 'adam', 'graph_mode': 'cutoff', 'cutoff': 0.8269169393850907, 'grm_norm': 'cosine', 'self_loops': False, 'use_snp_selection': False}. Best is trial 21 with value: 0.3153339696847911.
[I 2025-12-08 16:10:20,250] Trial 96 finished with value: 0.30128852823131425 and parameters: {'model_type': 'gcn', 'hidden_dims': '[512, 128]', 'dropout': 0.5396675154981835, 'batch_norm': True, 'lr': 0.00027806081993685176, 'weight_decay': 0.0006469033258214411, 'epochs': 94, 'loss': 'mae', 'optimizer': 'adam', 'graph_mode': 'cutoff', 'cutoff': 0.7584002176945692, 'grm_norm': 'cosine', 'self_loops': False, 'use_snp_selection': False}. Best is trial 21 with value: 0.3153339696847911.
[I 2025-12-08 16:10:50,173] Trial 97 finished with value: 0.08931290824922389 and parameters: {'model_type': 'gcn', 'hidden_dims': '[512, 256]', 'dropout': 0.5593248551415194, 'batch_norm': False, 'lr': 0.00035860423555893553, 'weight_decay': 0.00032743575382765844, 'epochs': 108, 'loss': 'mae', 'optimizer': 'adam', 'graph_mode': 'cutoff', 'cutoff': 0.8563489272533582, 'grm_norm': 'cosine', 'self_loops': False, 'use_snp_selection': False}. Best is trial 21 with value: 0.3153339696847911.
[I 2025-12-08 16:11:28,733] Trial 98 finished with value: 0.29983768475291156 and parameters: {'model_type': 'gcn', 'hidden_dims': '[512, 128]', 'dropout': 0.5154473412397491, 'batch_norm': True, 'lr': 0.00013482907075208257, 'weight_decay': 0.00044948836167837004, 'epochs': 146, 'loss': 'mae', 'optimizer': 'adam', 'graph_mode': 'cutoff', 'cutoff': 0.7438383887270202, 'grm_norm': 'cosine', 'self_loops': False, 'use_snp_selection': False}. Best is trial 21 with value: 0.3153339696847911.
[I 2025-12-08 16:11:48,337] Trial 99 finished with value: 0.2980449757249435 and parameters: {'model_type': 'gcn', 'hidden_dims': '[256, 128]', 'dropout': 0.5698269981153141, 'batch_norm': True, 'lr': 9.263092951492788e-05, 'weight_decay': 0.0001852942440584773, 'epochs': 82, 'loss': 'mae', 'optimizer': 'adam', 'graph_mode': 'cutoff', 'cutoff': 0.6865953577791007, 'grm_norm': 'cosine_then_gcn', 'self_loops': False, 'use_snp_selection': True, 'num_snps': 31109}. Best is trial 21 with value: 0.3153339696847911.
[I 2025-12-08 16:12:06,500] Trial 100 finished with value: 0.30881360777935724 and parameters: {'model_type': 'gcn', 'hidden_dims': '[512, 128]', 'dropout': 0.4777280898802459, 'batch_norm': True, 'lr': 0.0001598369297862599, 'weight_decay': 0.0008434912479331124, 'epochs': 61, 'loss': 'mae', 'optimizer': 'adam', 'graph_mode': 'cutoff', 'cutoff': 0.8020347407552202, 'grm_norm': 'cosine', 'self_loops': True, 'use_snp_selection': False}. Best is trial 21 with value: 0.3153339696847911.
[I 2025-12-08 16:12:39,305] Trial 101 finished with value: 0.308707762425228 and parameters: {'model_type': 'gcn', 'hidden_dims': '[512, 128]', 'dropout': 0.5333518817192239, 'batch_norm': True, 'lr': 0.0016310318992627945, 'weight_decay': 9.169390970879152e-05, 'epochs': 123, 'loss': 'mae', 'optimizer': 'adam', 'graph_mode': 'cutoff', 'cutoff': 0.8017061348625099, 'grm_norm': 'none', 'self_loops': False, 'use_snp_selection': False}. Best is trial 21 with value: 0.3153339696847911.
[I 2025-12-08 16:13:49,108] Trial 102 finished with value: 0.30282112833320846 and parameters: {'model_type': 'gcn', 'hidden_dims': '[512, 128]', 'dropout': 0.500841430684923, 'batch_norm': True, 'lr': 0.0010256042220076283, 'weight_decay': 0.0006210846526511907, 'epochs': 278, 'loss': 'mae', 'optimizer': 'adam', 'graph_mode': 'cutoff', 'cutoff': 0.7775172411110018, 'grm_norm': 'none', 'self_loops': False, 'use_snp_selection': False}. Best is trial 21 with value: 0.3153339696847911.
[I 2025-12-08 16:14:25,397] Trial 103 finished with value: 0.2965095349810899 and parameters: {'model_type': 'gcn', 'hidden_dims': '[512, 128]', 'dropout': 0.5455751710698722, 'batch_norm': True, 'lr': 0.00019571340731097995, 'weight_decay': 0.00012584541002526203, 'epochs': 137, 'loss': 'mae', 'optimizer': 'adam', 'graph_mode': 'cutoff', 'cutoff': 0.7182443111289828, 'grm_norm': 'gcn', 'self_loops': False, 'use_snp_selection': False}. Best is trial 21 with value: 0.3153339696847911.
[I 2025-12-08 16:15:06,874] Trial 104 finished with value: 0.30375976632439317 and parameters: {'model_type': 'gcn', 'hidden_dims': '[512, 256]', 'dropout': 0.5136904077735355, 'batch_norm': True, 'lr': 0.0002393653781677919, 'weight_decay': 5.6788370054207016e-05, 'epochs': 156, 'loss': 'mae', 'optimizer': 'adam', 'graph_mode': 'cutoff', 'cutoff': 0.8439028699298196, 'grm_norm': 'cosine', 'self_loops': False, 'use_snp_selection': False}. Best is trial 21 with value: 0.3153339696847911.
[I 2025-12-08 16:15:50,405] Trial 105 finished with value: 0.3028520003523076 and parameters: {'model_type': 'gcn', 'hidden_dims': '[512, 128]', 'dropout': 0.529062189088004, 'batch_norm': True, 'lr': 0.00030609631361020606, 'weight_decay': 0.0002380600303195077, 'epochs': 166, 'loss': 'mae', 'optimizer': 'adam', 'graph_mode': 'cutoff', 'cutoff': 0.7812964065241776, 'grm_norm': 'none', 'self_loops': False, 'use_snp_selection': True, 'num_snps': 44728}. Best is trial 21 with value: 0.3153339696847911.
[I 2025-12-08 16:16:28,155] Trial 106 finished with value: 0.3089244763323724 and parameters: {'model_type': 'gcn', 'hidden_dims': '[512, 128]', 'dropout': 0.26497915123896326, 'batch_norm': True, 'lr': 0.000694632451093866, 'weight_decay': 3.213935990200887e-05, 'epochs': 143, 'loss': 'mae', 'optimizer': 'adam', 'graph_mode': 'cutoff', 'cutoff': 0.7477345702255966, 'grm_norm': 'cosine', 'self_loops': False, 'use_snp_selection': False}. Best is trial 21 with value: 0.3153339696847911.
[I 2025-12-08 16:16:56,546] Trial 107 finished with value: 0.3080159614760249 and parameters: {'model_type': 'gcn', 'hidden_dims': '[512, 256]', 'dropout': 0.5911595300298488, 'batch_norm': True, 'lr': 0.00042269773376770576, 'weight_decay': 0.0005272249795940262, 'epochs': 105, 'loss': 'mae', 'optimizer': 'adam', 'graph_mode': 'cutoff', 'cutoff': 0.8837865230970555, 'grm_norm': 'none', 'self_loops': False, 'use_snp_selection': False}. Best is trial 21 with value: 0.3153339696847911.
[I 2025-12-08 16:17:26,044] Trial 108 finished with value: 0.22443280752406092 and parameters: {'model_type': 'gcn', 'hidden_dims': '[512, 128]', 'dropout': 0.5783400538181235, 'batch_norm': True, 'lr': 0.00016781271934111566, 'weight_decay': 6.946141434341345e-05, 'epochs': 90, 'loss': 'mse', 'optimizer': 'adam', 'graph_mode': 'knn', 'knn_k': 2, 'weighted_edges': False, 'symmetrize_mode': 'union', 'self_loops': False, 'use_snp_selection': True, 'num_snps': 40508}. Best is trial 21 with value: 0.3153339696847911.
[I 2025-12-08 16:18:14,307] Trial 109 finished with value: 0.3080940385938672 and parameters: {'model_type': 'gcn', 'hidden_dims': '[512, 128]', 'dropout': 0.4892116443903723, 'batch_norm': True, 'lr': 0.0009156097076994304, 'weight_decay': 1.0874360330005183e-06, 'epochs': 187, 'loss': 'mae', 'optimizer': 'adam', 'graph_mode': 'cutoff', 'cutoff': 0.8304870539786782, 'grm_norm': 'cosine_then_gcn', 'self_loops': False, 'use_snp_selection': False}. Best is trial 21 with value: 0.3153339696847911.
[I 2025-12-08 16:18:31,980] Trial 110 finished with value: 0.19756866836236114 and parameters: {'model_type': 'gcn', 'hidden_dims': '[128, 64]', 'dropout': 0.5539226541528006, 'batch_norm': False, 'lr': 0.0001298963958952179, 'weight_decay': 0.00041991018178347435, 'epochs': 70, 'loss': 'mae', 'optimizer': 'adam', 'graph_mode': 'cutoff', 'cutoff': 0.6485009121361791, 'grm_norm': 'cosine', 'self_loops': False, 'use_snp_selection': True, 'num_snps': 36862}. Best is trial 21 with value: 0.3153339696847911.
[I 2025-12-08 16:19:33,458] Trial 111 finished with value: 0.3078502615808906 and parameters: {'model_type': 'gcn', 'hidden_dims': '[512, 128]', 'dropout': 0.5670566690297788, 'batch_norm': True, 'lr': 0.0007676900607176297, 'weight_decay': 0.00019895505864439753, 'epochs': 239, 'loss': 'mae', 'optimizer': 'adam', 'graph_mode': 'cutoff', 'cutoff': 0.860932239302703, 'grm_norm': 'none', 'self_loops': False, 'use_snp_selection': False}. Best is trial 21 with value: 0.3153339696847911.
[I 2025-12-08 16:20:48,187] Trial 112 finished with value: 0.3017954877137453 and parameters: {'model_type': 'gcn', 'hidden_dims': '[512, 128]', 'dropout': 0.5046669168624625, 'batch_norm': True, 'lr': 0.0006150605407629076, 'weight_decay': 0.0002938450617906577, 'epochs': 297, 'loss': 'mae', 'optimizer': 'adam', 'graph_mode': 'cutoff', 'cutoff': 0.8845744691022699, 'grm_norm': 'none', 'self_loops': False, 'use_snp_selection': False}. Best is trial 21 with value: 0.3153339696847911.
[I 2025-12-08 16:21:51,254] Trial 113 finished with value: 0.30368754565101086 and parameters: {'model_type': 'gcn', 'hidden_dims': '[512, 128]', 'dropout': 0.4597176800879334, 'batch_norm': True, 'lr': 0.0012239228809380414, 'weight_decay': 0.0002572353050117127, 'epochs': 248, 'loss': 'mae', 'optimizer': 'adam', 'graph_mode': 'cutoff', 'cutoff': 0.8982705420709256, 'grm_norm': 'none', 'self_loops': False, 'use_snp_selection': False}. Best is trial 21 with value: 0.3153339696847911.
[I 2025-12-08 16:22:27,271] Trial 114 finished with value: 0.30907409946853226 and parameters: {'model_type': 'gcn', 'hidden_dims': '[512, 256]', 'dropout': 0.5226400082725876, 'batch_norm': True, 'lr': 0.00022406767457984583, 'weight_decay': 0.00011671688939585027, 'epochs': 134, 'loss': 'mae', 'optimizer': 'adam', 'graph_mode': 'cutoff', 'cutoff': 0.8156361021687094, 'grm_norm': 'none', 'self_loops': False, 'use_snp_selection': False}. Best is trial 21 with value: 0.3153339696847911.
[I 2025-12-08 16:23:31,732] Trial 115 finished with value: 0.3046309420961112 and parameters: {'model_type': 'gcn', 'hidden_dims': '[512, 128]', 'dropout': 0.4052600818733358, 'batch_norm': True, 'lr': 0.0009715577133205799, 'weight_decay': 0.0003633863721412345, 'epochs': 254, 'loss': 'mae', 'optimizer': 'adam', 'graph_mode': 'cutoff', 'cutoff': 0.7960110920590591, 'grm_norm': 'none', 'self_loops': False, 'use_snp_selection': False}. Best is trial 21 with value: 0.3153339696847911.
[I 2025-12-08 16:24:28,252] Trial 116 finished with value: 0.3123595405541257 and parameters: {'model_type': 'gcn', 'hidden_dims': '[512, 64]', 'dropout': 0.190085731636507, 'batch_norm': True, 'lr': 0.0002584362780982512, 'weight_decay': 0.0001736110156580326, 'epochs': 219, 'loss': 'mae', 'optimizer': 'adam', 'graph_mode': 'cutoff', 'cutoff': 0.7698354898473132, 'grm_norm': 'gcn', 'self_loops': False, 'use_snp_selection': True, 'num_snps': 49041}. Best is trial 21 with value: 0.3153339696847911.
[I 2025-12-08 16:25:07,977] Trial 117 finished with value: 0.30848783085059145 and parameters: {'model_type': 'gcn', 'hidden_dims': '[256, 128, 64]', 'dropout': 0.18528128309673897, 'batch_norm': True, 'lr': 0.000252941658499813, 'weight_decay': 4.7187520873120576e-05, 'epochs': 219, 'loss': 'mae', 'optimizer': 'adam', 'graph_mode': 'cutoff', 'cutoff': 0.7674442678039953, 'grm_norm': 'gcn', 'self_loops': False, 'use_snp_selection': True, 'num_snps': 49598}. Best is trial 21 with value: 0.3153339696847911.
[I 2025-12-08 16:26:04,975] Trial 118 finished with value: 0.3004327425033141 and parameters: {'model_type': 'gcn', 'hidden_dims': '[512, 64]', 'dropout': 0.20591996434978982, 'batch_norm': True, 'lr': 0.00019010296480422543, 'weight_decay': 0.0001471483768577343, 'epochs': 228, 'loss': 'mae', 'optimizer': 'adam', 'graph_mode': 'cutoff', 'cutoff': 0.7351611482476885, 'grm_norm': 'gcn', 'self_loops': True, 'use_snp_selection': True, 'num_snps': 47539}. Best is trial 21 with value: 0.3153339696847911.
[I 2025-12-08 16:26:59,773] Trial 119 finished with value: 0.31350347067609496 and parameters: {'model_type': 'gcn', 'hidden_dims': '[512, 64]', 'dropout': 0.190661889877436, 'batch_norm': True, 'lr': 9.753947340916044e-05, 'weight_decay': 9.226195074128274e-05, 'epochs': 174, 'loss': 'mae', 'optimizer': 'adam', 'graph_mode': 'cutoff', 'cutoff': 0.7530667561840011, 'grm_norm': 'gcn', 'self_loops': False, 'use_snp_selection': True, 'num_snps': 57281}. Best is trial 21 with value: 0.3153339696847911.
[I 2025-12-08 16:27:51,508] Trial 120 finished with value: 0.315112454702296 and parameters: {'model_type': 'gcn', 'hidden_dims': '[512, 256]', 'dropout': 0.23177982695680782, 'batch_norm': True, 'lr': 6.21966581718626e-05, 'weight_decay': 9.061449155945698e-05, 'epochs': 176, 'loss': 'mae', 'optimizer': 'adam', 'graph_mode': 'cutoff', 'cutoff': 0.755290958841458, 'grm_norm': 'gcn', 'self_loops': False, 'use_snp_selection': True, 'num_snps': 52586}. Best is trial 21 with value: 0.3153339696847911.
[I 2025-12-08 16:28:46,944] Trial 121 finished with value: 0.29818469530781516 and parameters: {'model_type': 'gcn', 'hidden_dims': '[512, 64]', 'dropout': 0.18283131188538618, 'batch_norm': True, 'lr': 5.345342738067422e-05, 'weight_decay': 9.252221171175325e-05, 'epochs': 176, 'loss': 'mae', 'optimizer': 'adam', 'graph_mode': 'cutoff', 'cutoff': 0.7568092986269269, 'grm_norm': 'gcn', 'self_loops': False, 'use_snp_selection': True, 'num_snps': 57390}. Best is trial 21 with value: 0.3153339696847911.
[I 2025-12-08 16:29:42,492] Trial 122 finished with value: 0.2950504818815314 and parameters: {'model_type': 'gcn', 'hidden_dims': '[512, 64]', 'dropout': 0.22297124411671598, 'batch_norm': True, 'lr': 3.9761558164845e-05, 'weight_decay': 8.217269243435493e-05, 'epochs': 199, 'loss': 'mae', 'optimizer': 'adam', 'graph_mode': 'cutoff', 'cutoff': 0.6957531819207846, 'grm_norm': 'gcn', 'self_loops': False, 'use_snp_selection': True, 'num_snps': 51863}. Best is trial 21 with value: 0.3153339696847911.
[I 2025-12-08 16:30:37,713] Trial 123 finished with value: 0.2960976732757213 and parameters: {'model_type': 'gcn', 'hidden_dims': '[512, 64]', 'dropout': 0.24602031629649318, 'batch_norm': True, 'lr': 6.47047592473184e-05, 'weight_decay': 0.0001691312153691374, 'epochs': 190, 'loss': 'mae', 'optimizer': 'adam', 'graph_mode': 'cutoff', 'cutoff': 0.7305459446627982, 'grm_norm': 'gcn', 'self_loops': False, 'use_snp_selection': True, 'num_snps': 53437}. Best is trial 21 with value: 0.3153339696847911.
[I 2025-12-08 16:31:40,520] Trial 124 finished with value: 0.25294531087691274 and parameters: {'model_type': 'gcn', 'hidden_dims': '[512, 64]', 'dropout': 0.1961281698824971, 'batch_norm': True, 'lr': 3.1276609343834176e-05, 'weight_decay': 0.00010831114640999906, 'epochs': 211, 'loss': 'mae', 'optimizer': 'adam', 'graph_mode': 'cutoff', 'cutoff': 0.7148933873072221, 'grm_norm': 'gcn', 'self_loops': False, 'use_snp_selection': True, 'num_snps': 57512}. Best is trial 21 with value: 0.3153339696847911.
[I 2025-12-08 16:32:26,796] Trial 125 finished with value: 0.28976037691800977 and parameters: {'model_type': 'gcn', 'hidden_dims': '[512, 64]', 'dropout': 0.15724948106412603, 'batch_norm': True, 'lr': 0.0001059406313068503, 'weight_decay': 5.679858419424784e-05, 'epochs': 181, 'loss': 'mae', 'optimizer': 'adam', 'graph_mode': 'cutoff', 'cutoff': 0.7744418228286076, 'grm_norm': 'gcn', 'self_loops': False, 'use_snp_selection': True, 'num_snps': 44845}. Best is trial 21 with value: 0.3153339696847911.
[I 2025-12-08 16:33:11,636] Trial 126 finished with value: 0.30548149220759646 and parameters: {'model_type': 'gcn', 'hidden_dims': '[512, 256]', 'dropout': 0.1724786320080698, 'batch_norm': True, 'lr': 0.00014532766202800696, 'weight_decay': 0.0007971208749811818, 'epochs': 151, 'loss': 'mae', 'optimizer': 'adam', 'graph_mode': 'cutoff', 'cutoff': 0.7429161650039594, 'grm_norm': 'gcn', 'self_loops': False, 'use_snp_selection': True, 'num_snps': 50087}. Best is trial 21 with value: 0.3153339696847911.
[I 2025-12-08 16:34:03,304] Trial 127 finished with value: 0.3047474689357476 and parameters: {'model_type': 'gcn', 'hidden_dims': '[512, 256]', 'dropout': 0.19580616232730122, 'batch_norm': True, 'lr': 9.316966084285325e-05, 'weight_decay': 0.0006803138286916585, 'epochs': 171, 'loss': 'mae', 'optimizer': 'adam', 'graph_mode': 'cutoff', 'cutoff': 0.7896843658244342, 'grm_norm': 'gcn', 'self_loops': False, 'use_snp_selection': True, 'num_snps': 52633}. Best is trial 21 with value: 0.3153339696847911.
[I 2025-12-08 16:34:47,762] Trial 128 finished with value: 0.23586301940184842 and parameters: {'model_type': 'gcn', 'hidden_dims': '[512, 64]', 'dropout': 0.1473540569987133, 'batch_norm': True, 'lr': 6.342865599604332e-05, 'weight_decay': 1.2521812050822108e-05, 'epochs': 156, 'loss': 'mse', 'optimizer': 'adam', 'graph_mode': 'knn', 'knn_k': 9, 'weighted_edges': False, 'symmetrize_mode': 'mutual', 'self_loops': False, 'use_snp_selection': True, 'num_snps': 46461}. Best is trial 21 with value: 0.3153339696847911.
[I 2025-12-08 16:35:32,538] Trial 129 finished with value: 0.30618202171643705 and parameters: {'model_type': 'gcn', 'hidden_dims': '[512, 256]', 'dropout': 0.24885966785373423, 'batch_norm': True, 'lr': 0.00017295727037290758, 'weight_decay': 3.7140309519933185e-07, 'epochs': 117, 'loss': 'mae', 'optimizer': 'adam', 'graph_mode': 'cutoff', 'cutoff': 0.7590363396616436, 'grm_norm': 'gcn', 'self_loops': False, 'use_snp_selection': True, 'num_snps': 59452}. Best is trial 21 with value: 0.3153339696847911.
[I 2025-12-08 16:35:57,597] Trial 130 finished with value: 0.2462897016002386 and parameters: {'model_type': 'gcn', 'hidden_dims': '[512, 256]', 'dropout': 0.21752492256154565, 'batch_norm': True, 'lr': 0.00011544966321716824, 'weight_decay': 2.246778440667318e-05, 'epochs': 48, 'loss': 'mae', 'optimizer': 'adam', 'graph_mode': 'cutoff', 'cutoff': 0.5417399194891591, 'grm_norm': 'gcn', 'self_loops': False, 'use_snp_selection': True, 'num_snps': 47636}. Best is trial 21 with value: 0.3153339696847911.
[I 2025-12-08 16:36:54,877] Trial 131 finished with value: 0.3116859674867594 and parameters: {'model_type': 'gcn', 'hidden_dims': '[512, 64]', 'dropout': 0.1870400324898737, 'batch_norm': True, 'lr': 0.00021029059834728176, 'weight_decay': 0.00014713204925515, 'epochs': 262, 'loss': 'mae', 'optimizer': 'adam', 'graph_mode': 'cutoff', 'cutoff': 0.8164238526800189, 'grm_norm': 'cosine', 'self_loops': False, 'use_snp_selection': True, 'num_snps': 41533}. Best is trial 21 with value: 0.3153339696847911.
