[I 2025-12-08 12:50:59,998] Trial 88 finished with value: 0.2983705615921017 and parameters: {'model_type': 'gcn', 'hidden_dims': '[512, 64]', 'dropout': 0.28245849671963313, 'batch_norm': True, 'lr': 0.0003129618576960578, 'weight_decay': 2.8709013804038126e-06, 'epochs': 225, 'loss': 'mae', 'optimizer': 'adam', 'graph_mode': 'cutoff', 'cutoff': 0.8103793775197167, 'grm_norm': 'gcn', 'self_loops': False, 'use_snp_selection': True, 'num_snps': 46732}. Best is trial 67 with value: 0.3066518037274824.
[I 2025-12-08 12:51:57,747] Trial 89 finished with value: 0.2103563493844637 and parameters: {'model_type': 'gcn', 'hidden_dims': '[512, 128]', 'dropout': 0.3034151139652619, 'batch_norm': True, 'lr': 0.000159807428579966, 'weight_decay': 1.7979359447175457e-06, 'epochs': 215, 'loss': 'mae', 'optimizer': 'adam', 'graph_mode': 'knn', 'knn_k': 5, 'weighted_edges': False, 'symmetrize_mode': 'mutual', 'self_loops': False, 'use_snp_selection': True, 'num_snps': 50765}. Best is trial 67 with value: 0.3066518037274824.
[I 2025-12-08 12:52:24,245] Trial 90 finished with value: 0.2900344216158557 and parameters: {'model_type': 'gcn', 'hidden_dims': '[256, 128, 64]', 'dropout': 0.25918586717913217, 'batch_norm': True, 'lr': 0.0002370374914568554, 'weight_decay': 5.063628299323887e-06, 'epochs': 203, 'loss': 'mae', 'optimizer': 'adam', 'graph_mode': 'cutoff', 'cutoff': 0.8501417189278027, 'grm_norm': 'gcn', 'self_loops': False, 'use_snp_selection': False}. Best is trial 67 with value: 0.3066518037274824.
[I 2025-12-08 12:53:10,117] Trial 91 finished with value: 0.2953939119529464 and parameters: {'model_type': 'gcn', 'hidden_dims': '[512, 128]', 'dropout': 0.39797883359663877, 'batch_norm': True, 'lr': 0.000178258795012072, 'weight_decay': 3.7136035477670037e-06, 'epochs': 155, 'loss': 'mae', 'optimizer': 'adam', 'graph_mode': 'cutoff', 'cutoff': 0.7594565986334192, 'grm_norm': 'gcn', 'self_loops': False, 'use_snp_selection': True, 'num_snps': 51821}. Best is trial 67 with value: 0.3066518037274824.
[I 2025-12-08 12:54:05,254] Trial 92 finished with value: 0.28924539714115577 and parameters: {'model_type': 'gcn', 'hidden_dims': '[512, 128]', 'dropout': 0.43831014738635465, 'batch_norm': True, 'lr': 9.386462646574216e-05, 'weight_decay': 7.294882742063728e-06, 'epochs': 183, 'loss': 'mae', 'optimizer': 'adam', 'graph_mode': 'cutoff', 'cutoff': 0.7176781800705936, 'grm_norm': 'cosine_then_gcn', 'self_loops': False, 'use_snp_selection': True, 'num_snps': 56393}. Best is trial 67 with value: 0.3066518037274824.
[I 2025-12-08 12:54:33,390] Trial 93 finished with value: 0.30334878952285954 and parameters: {'model_type': 'gcn', 'hidden_dims': '[512, 128]', 'dropout': 0.33796409956621787, 'batch_norm': True, 'lr': 0.0002197076739463379, 'weight_decay': 1.2318839704166817e-05, 'epochs': 193, 'loss': 'mae', 'optimizer': 'adam', 'graph_mode': 'cutoff', 'cutoff': 0.8992600245603727, 'grm_norm': 'gcn', 'self_loops': False, 'use_snp_selection': True, 'num_snps': 22143}. Best is trial 67 with value: 0.3066518037274824.
[I 2025-12-08 12:55:13,888] Trial 94 finished with value: 0.29282398645660307 and parameters: {'model_type': 'gcn', 'hidden_dims': '[512, 128]', 'dropout': 0.33949510790065784, 'batch_norm': True, 'lr': 0.00040631689111847387, 'weight_decay': 1.5228156671654439e-05, 'epochs': 236, 'loss': 'mae', 'optimizer': 'adam', 'graph_mode': 'cutoff', 'cutoff': 0.8809432149566425, 'grm_norm': 'gcn', 'self_loops': False, 'use_snp_selection': True, 'num_snps': 30908}. Best is trial 67 with value: 0.3066518037274824.
[I 2025-12-08 12:55:41,680] Trial 95 finished with value: 0.2957475819772121 and parameters: {'model_type': 'gcn', 'hidden_dims': '[512, 128]', 'dropout': 0.3243991123850165, 'batch_norm': True, 'lr': 0.00013338474372689727, 'weight_decay': 1.1917711364506153e-05, 'epochs': 192, 'loss': 'mse', 'optimizer': 'adam', 'graph_mode': 'cutoff', 'cutoff': 0.8903875839115135, 'grm_norm': 'gcn', 'self_loops': False, 'use_snp_selection': True, 'num_snps': 21702}. Best is trial 67 with value: 0.3066518037274824.
[I 2025-12-08 12:56:25,500] Trial 96 finished with value: 0.2922632835159875 and parameters: {'model_type': 'gcn', 'hidden_dims': '[512, 256]', 'dropout': 0.24318263539096252, 'batch_norm': False, 'lr': 0.00022707782004539518, 'weight_decay': 5.6581726234582676e-05, 'epochs': 119, 'loss': 'mae', 'optimizer': 'adam', 'graph_mode': 'cutoff', 'cutoff': 0.8267182166672631, 'grm_norm': 'gcn', 'self_loops': False, 'use_snp_selection': True, 'num_snps': 59779}. Best is trial 67 with value: 0.3066518037274824.
[I 2025-12-08 12:56:47,487] Trial 97 finished with value: 0.2996118333592346 and parameters: {'model_type': 'gcn', 'hidden_dims': '[256, 128]', 'dropout': 0.21730156769967798, 'batch_norm': True, 'lr': 7.385301067494777e-05, 'weight_decay': 3.2692943111636155e-05, 'epochs': 175, 'loss': 'mae', 'optimizer': 'adam', 'graph_mode': 'cutoff', 'cutoff': 0.8661417292288734, 'grm_norm': 'gcn', 'self_loops': False, 'use_snp_selection': True, 'num_snps': 26379}. Best is trial 67 with value: 0.3066518037274824.
[I 2025-12-08 12:57:13,184] Trial 98 finished with value: 0.25895246194951876 and parameters: {'model_type': 'gcn', 'hidden_dims': '[256, 128]', 'dropout': 0.21353570081283105, 'batch_norm': True, 'lr': 5.736537501201103e-05, 'weight_decay': 1.128705607495457e-06, 'epochs': 217, 'loss': 'mae', 'optimizer': 'adam', 'graph_mode': 'cutoff', 'cutoff': 0.8659359368654939, 'grm_norm': 'gcn', 'self_loops': False, 'use_snp_selection': True, 'num_snps': 28236}. Best is trial 67 with value: 0.3066518037274824.
[I 2025-12-08 12:57:45,400] Trial 99 finished with value: 0.2955313275362431 and parameters: {'model_type': 'gcn', 'hidden_dims': '[256, 128]', 'dropout': 0.2208052376521988, 'batch_norm': True, 'lr': 8.494160541215469e-05, 'weight_decay': 0.0004155024161902615, 'epochs': 178, 'loss': 'mae', 'optimizer': 'adam', 'graph_mode': 'cutoff', 'cutoff': 0.8431962098771747, 'grm_norm': 'gcn', 'self_loops': False, 'use_snp_selection': True, 'num_snps': 47502}. Best is trial 67 with value: 0.3066518037274824.
[I 2025-12-08 12:58:08,730] Trial 100 finished with value: 0.301660260252358 and parameters: {'model_type': 'gcn', 'hidden_dims': '[256, 128]', 'dropout': 0.16684617489733972, 'batch_norm': True, 'lr': 4.411293398427418e-05, 'weight_decay': 4.125685201308245e-06, 'epochs': 209, 'loss': 'mae', 'optimizer': 'adam', 'graph_mode': 'cutoff', 'cutoff': 0.860998143208104, 'grm_norm': 'gcn', 'self_loops': False, 'use_snp_selection': True, 'num_snps': 24744}. Best is trial 67 with value: 0.3066518037274824.
[I 2025-12-08 12:58:32,484] Trial 101 finished with value: 0.2943361206883897 and parameters: {'model_type': 'gcn', 'hidden_dims': '[256, 128]', 'dropout': 0.16262822500611587, 'batch_norm': True, 'lr': 7.109747523382453e-05, 'weight_decay': 3.887175887504406e-06, 'epochs': 211, 'loss': 'mae', 'optimizer': 'adam', 'graph_mode': 'cutoff', 'cutoff': 0.8960485567345341, 'grm_norm': 'gcn', 'self_loops': False, 'use_snp_selection': True, 'num_snps': 25473}. Best is trial 67 with value: 0.3066518037274824.
[I 2025-12-08 12:58:55,742] Trial 102 finished with value: 0.28802034240150687 and parameters: {'model_type': 'gcn', 'hidden_dims': '[256, 128]', 'dropout': 0.16993238526543178, 'batch_norm': True, 'lr': 4.882325579157596e-05, 'weight_decay': 4.957330281912439e-06, 'epochs': 228, 'loss': 'mae', 'optimizer': 'adam', 'graph_mode': 'cutoff', 'cutoff': 0.8714795310505874, 'grm_norm': 'gcn', 'self_loops': False, 'use_snp_selection': True, 'num_snps': 23214}. Best is trial 67 with value: 0.3066518037274824.
[I 2025-12-08 12:59:20,759] Trial 103 finished with value: 0.2653871525785501 and parameters: {'model_type': 'gcn', 'hidden_dims': '[256, 128]', 'dropout': 0.13651511302417724, 'batch_norm': True, 'lr': 3.559927568694521e-05, 'weight_decay': 4.740953387511474e-05, 'epochs': 198, 'loss': 'mae', 'optimizer': 'adam', 'graph_mode': 'cutoff', 'cutoff': 0.8233389916533285, 'grm_norm': 'gcn', 'self_loops': False, 'use_snp_selection': True, 'num_snps': 29380}. Best is trial 67 with value: 0.3066518037274824.
[I 2025-12-08 12:59:44,790] Trial 104 finished with value: 0.2759302957346831 and parameters: {'model_type': 'gcn', 'hidden_dims': '[256, 128]', 'dropout': 0.1371456553614337, 'batch_norm': True, 'lr': 2.9597687685817286e-05, 'weight_decay': 1.9364238903378173e-06, 'epochs': 208, 'loss': 'mae', 'optimizer': 'adam', 'graph_mode': 'cutoff', 'cutoff': 0.7928693818385163, 'grm_norm': 'gcn', 'self_loops': False, 'use_snp_selection': True, 'num_snps': 26340}. Best is trial 67 with value: 0.3066518037274824.
[I 2025-12-08 13:00:04,183] Trial 105 finished with value: 0.2916311860115518 and parameters: {'model_type': 'gcn', 'hidden_dims': '[256, 128]', 'dropout': 0.18243013266271504, 'batch_norm': True, 'lr': 0.00011363469443251516, 'weight_decay': 8.183612785809838e-05, 'epochs': 171, 'loss': 'mae', 'optimizer': 'adam', 'graph_mode': 'cutoff', 'cutoff': 0.8996850644919449, 'grm_norm': 'gcn', 'self_loops': True, 'use_snp_selection': True, 'num_snps': 19584}. Best is trial 67 with value: 0.3066518037274824.
[I 2025-12-08 13:00:30,858] Trial 106 finished with value: 0.2930903291665598 and parameters: {'model_type': 'gcn', 'hidden_dims': '[256, 128]', 'dropout': 0.10716018593129137, 'batch_norm': True, 'lr': 6.078794973697653e-05, 'weight_decay': 2.8435808120523263e-06, 'epochs': 255, 'loss': 'mae', 'optimizer': 'adam', 'graph_mode': 'cutoff', 'cutoff': 0.861965816083411, 'grm_norm': 'none', 'self_loops': False, 'use_snp_selection': True, 'num_snps': 24968}. Best is trial 67 with value: 0.3066518037274824.
[I 2025-12-08 13:00:42,823] Trial 107 finished with value: 0.2793642985415444 and parameters: {'model_type': 'gcn', 'hidden_dims': '[128, 64]', 'dropout': 0.3076200423724077, 'batch_norm': True, 'lr': 7.846953266519538e-05, 'weight_decay': 5.770096701548363e-06, 'epochs': 78, 'loss': 'mae', 'optimizer': 'adam', 'graph_mode': 'cutoff', 'cutoff': 0.8068610436535233, 'grm_norm': 'gcn', 'self_loops': False, 'use_snp_selection': True, 'num_snps': 13757}. Best is trial 67 with value: 0.3066518037274824.
[I 2025-12-08 13:01:46,876] Trial 108 finished with value: 0.20697662443260761 and parameters: {'model_type': 'gcn', 'hidden_dims': '[512, 64]', 'dropout': 0.28587283261505747, 'batch_norm': True, 'lr': 1.9821781709393666e-05, 'weight_decay': 9.950625595604144e-06, 'epochs': 246, 'loss': 'mae', 'optimizer': 'adam', 'graph_mode': 'cutoff', 'cutoff': 0.3662592165438915, 'grm_norm': 'none', 'self_loops': False, 'use_snp_selection': False}. Best is trial 67 with value: 0.3066518037274824.
[I 2025-12-08 13:02:13,999] Trial 109 finished with value: 0.2684212444218927 and parameters: {'model_type': 'gcn', 'hidden_dims': '[512, 256]', 'dropout': 0.46441856347490873, 'batch_norm': True, 'lr': 0.00016944178979853042, 'weight_decay': 3.248523539892687e-05, 'epochs': 188, 'loss': 'mae', 'optimizer': 'adam', 'graph_mode': 'knn', 'knn_k': 9, 'weighted_edges': True, 'symmetrize_mode': 'union', 'self_loops': False, 'use_snp_selection': True, 'num_snps': 17378}. Best is trial 67 with value: 0.3066518037274824.
[I 2025-12-08 13:02:41,290] Trial 110 finished with value: 0.24857942779162556 and parameters: {'model_type': 'gcn', 'hidden_dims': '[512, 128]', 'dropout': 0.19547321493065836, 'batch_norm': False, 'lr': 4.17080331131032e-05, 'weight_decay': 0.00018012520335741733, 'epochs': 94, 'loss': 'mse', 'optimizer': 'adam', 'graph_mode': 'cutoff', 'cutoff': 0.20998552031457457, 'grm_norm': 'none', 'self_loops': False, 'use_snp_selection': True, 'num_snps': 33391}. Best is trial 67 with value: 0.3066518037274824.
[I 2025-12-08 13:03:10,751] Trial 111 finished with value: 0.2968329461455612 and parameters: {'model_type': 'gcn', 'hidden_dims': '[512, 128]', 'dropout': 0.35491400960568636, 'batch_norm': True, 'lr': 0.0002746429553839547, 'weight_decay': 2.225479932558381e-05, 'epochs': 195, 'loss': 'mae', 'optimizer': 'adam', 'graph_mode': 'cutoff', 'cutoff': 0.8403893182778344, 'grm_norm': 'cosine', 'self_loops': False, 'use_snp_selection': True, 'num_snps': 22204}. Best is trial 67 with value: 0.3066518037274824.
[I 2025-12-08 13:03:39,983] Trial 112 finished with value: 0.3045057952104023 and parameters: {'model_type': 'gcn', 'hidden_dims': '[512, 128]', 'dropout': 0.3715650037431965, 'batch_norm': True, 'lr': 0.00033402121252346404, 'weight_decay': 1.8156789145435295e-05, 'epochs': 204, 'loss': 'mae', 'optimizer': 'adam', 'graph_mode': 'cutoff', 'cutoff': 0.772972073646804, 'grm_norm': 'gcn', 'self_loops': False, 'use_snp_selection': True, 'num_snps': 20858}. Best is trial 67 with value: 0.3066518037274824.
[I 2025-12-08 13:04:11,174] Trial 113 finished with value: 0.29515828835621105 and parameters: {'model_type': 'gcn', 'hidden_dims': '[512, 128]', 'dropout': 0.3693167483117413, 'batch_norm': True, 'lr': 0.0003286383973358671, 'weight_decay': 1.704803862104798e-05, 'epochs': 221, 'loss': 'mae', 'optimizer': 'adam', 'graph_mode': 'cutoff', 'cutoff': 0.7747307739982592, 'grm_norm': 'gcn', 'self_loops': False, 'use_snp_selection': True, 'num_snps': 21136}. Best is trial 67 with value: 0.3066518037274824.
[I 2025-12-08 13:04:39,034] Trial 114 finished with value: 0.2907257185263075 and parameters: {'model_type': 'gcn', 'hidden_dims': '[512, 128]', 'dropout': 0.37982761873652887, 'batch_norm': True, 'lr': 0.00020547131746562455, 'weight_decay': 2.3081552510594293e-06, 'epochs': 205, 'loss': 'mae', 'optimizer': 'adam', 'graph_mode': 'cutoff', 'cutoff': 0.7526197407858679, 'grm_norm': 'gcn', 'self_loops': False, 'use_snp_selection': True, 'num_snps': 19380}. Best is trial 67 with value: 0.3066518037274824.
[I 2025-12-08 13:05:13,234] Trial 115 finished with value: 0.2930815016194833 and parameters: {'model_type': 'gcn', 'hidden_dims': '[512, 64]', 'dropout': 0.14417737560457666, 'batch_norm': True, 'lr': 0.00045244955797507045, 'weight_decay': 1.351354922267404e-05, 'epochs': 231, 'loss': 'mae', 'optimizer': 'adam', 'graph_mode': 'cutoff', 'cutoff': 0.7881168053315825, 'grm_norm': 'gcn', 'self_loops': False, 'use_snp_selection': True, 'num_snps': 24071}. Best is trial 67 with value: 0.3066518037274824.
[I 2025-12-08 13:05:44,877] Trial 116 finished with value: 0.3031542410518055 and parameters: {'model_type': 'gcn', 'hidden_dims': '[512, 128]', 'dropout': 0.3387727093847104, 'batch_norm': True, 'lr': 0.00013979100502461132, 'weight_decay': 7.761997845473307e-06, 'epochs': 175, 'loss': 'mae', 'optimizer': 'adam', 'graph_mode': 'cutoff', 'cutoff': 0.8199769719563725, 'grm_norm': 'gcn', 'self_loops': False, 'use_snp_selection': True, 'num_snps': 27488}. Best is trial 67 with value: 0.3066518037274824.
[I 2025-12-08 13:05:55,234] Trial 117 finished with value: 0.260438545089383 and parameters: {'model_type': 'gcn', 'hidden_dims': '[256, 128]', 'dropout': 0.3366929775825899, 'batch_norm': True, 'lr': 0.0001020415962881607, 'weight_decay': 7.899176063648803e-06, 'epochs': 160, 'loss': 'mae', 'optimizer': 'adam', 'graph_mode': 'cutoff', 'cutoff': 0.8163592292561308, 'grm_norm': 'none', 'self_loops': False, 'use_snp_selection': True, 'num_snps': 2011}. Best is trial 67 with value: 0.3066518037274824.
[I 2025-12-08 13:06:22,472] Trial 118 finished with value: 0.28806582546018666 and parameters: {'model_type': 'gcn', 'hidden_dims': '[512, 128]', 'dropout': 0.3611218717131518, 'batch_norm': True, 'lr': 0.00014188324964948003, 'weight_decay': 9.808034674844244e-06, 'epochs': 130, 'loss': 'mae', 'optimizer': 'adam', 'graph_mode': 'cutoff', 'cutoff': 0.8564487106679863, 'grm_norm': 'gcn', 'self_loops': False, 'use_snp_selection': True, 'num_snps': 27792}. Best is trial 67 with value: 0.3066518037274824.
[I 2025-12-08 13:06:44,147] Trial 119 finished with value: 0.2909058014675209 and parameters: {'model_type': 'gcn', 'hidden_dims': '[256, 128, 64]', 'dropout': 0.4062066996568134, 'batch_norm': True, 'lr': 0.0001222432832503892, 'weight_decay': 6.195181220083243e-06, 'epochs': 240, 'loss': 'mae', 'optimizer': 'adam', 'graph_mode': 'cutoff', 'cutoff': 0.8342615106798353, 'grm_norm': 'none', 'self_loops': True, 'use_snp_selection': True, 'num_snps': 16671}. Best is trial 67 with value: 0.3066518037274824.
[I 2025-12-08 13:07:19,575] Trial 120 finished with value: 0.296981332942359 and parameters: {'model_type': 'gcn', 'hidden_dims': '[512, 128]', 'dropout': 0.34533004273688944, 'batch_norm': True, 'lr': 9.403855921483931e-05, 'weight_decay': 1.981259260514542e-05, 'epochs': 177, 'loss': 'mae', 'optimizer': 'adam', 'graph_mode': 'cutoff', 'cutoff': 0.8762610946058487, 'grm_norm': 'gcn', 'self_loops': False, 'use_snp_selection': True, 'num_snps': 32055}. Best is trial 67 with value: 0.3066518037274824.
[I 2025-12-08 13:07:54,792] Trial 121 finished with value: 0.28606435672448666 and parameters: {'model_type': 'gcn', 'hidden_dims': '[512, 128]', 'dropout': 0.31435396205466587, 'batch_norm': True, 'lr': 0.0002559196046038002, 'weight_decay': 3.4827024943490073e-06, 'epochs': 186, 'loss': 'mae', 'optimizer': 'adam', 'graph_mode': 'cutoff', 'cutoff': 0.734038166382211, 'grm_norm': 'gcn', 'self_loops': False, 'use_snp_selection': True, 'num_snps': 29917}. Best is trial 67 with value: 0.3066518037274824.
[I 2025-12-08 13:08:28,127] Trial 122 finished with value: 0.29430311783039015 and parameters: {'model_type': 'gcn', 'hidden_dims': '[512, 128]', 'dropout': 0.3278640241795314, 'batch_norm': True, 'lr': 0.00015147985886672534, 'weight_decay': 4.171441237542209e-06, 'epochs': 199, 'loss': 'mae', 'optimizer': 'adam', 'graph_mode': 'cutoff', 'cutoff': 0.7982205747733525, 'grm_norm': 'gcn', 'self_loops': False, 'use_snp_selection': True, 'num_snps': 25988}. Best is trial 67 with value: 0.3066518037274824.
[I 2025-12-08 13:08:45,549] Trial 123 finished with value: 0.2905243495308068 and parameters: {'model_type': 'gcn', 'hidden_dims': '[512, 128]', 'dropout': 0.29786917175785715, 'batch_norm': True, 'lr': 0.00019904733021651217, 'weight_decay': 7.108863459305175e-06, 'epochs': 151, 'loss': 'mae', 'optimizer': 'adam', 'graph_mode': 'cutoff', 'cutoff': 0.7684240228988046, 'grm_norm': 'gcn', 'self_loops': False, 'use_snp_selection': True, 'num_snps': 11484}. Best is trial 67 with value: 0.3066518037274824.
[I 2025-12-08 13:09:16,020] Trial 124 finished with value: 0.294286267124846 and parameters: {'model_type': 'gcn', 'hidden_dims': '[512, 128]', 'dropout': 0.2682597206853376, 'batch_norm': True, 'lr': 0.0002991203362817896, 'weight_decay': 5.101101719508909e-06, 'epochs': 166, 'loss': 'mae', 'optimizer': 'adam', 'graph_mode': 'cutoff', 'cutoff': 0.7000864836153843, 'grm_norm': 'gcn', 'self_loops': False, 'use_snp_selection': True, 'num_snps': 27238}. Best is trial 67 with value: 0.3066518037274824.
[I 2025-12-08 13:09:46,971] Trial 125 finished with value: 0.29448485754100606 and parameters: {'model_type': 'gcn', 'hidden_dims': '[512, 64]', 'dropout': 0.38900976447936725, 'batch_norm': True, 'lr': 0.0001764646987210281, 'weight_decay': 2.4272959909276835e-05, 'epochs': 215, 'loss': 'mae', 'optimizer': 'adam', 'graph_mode': 'cutoff', 'cutoff': 0.7786494477565855, 'grm_norm': 'none', 'self_loops': False, 'use_snp_selection': True, 'num_snps': 22421}. Best is trial 67 with value: 0.3066518037274824.
[I 2025-12-08 13:10:30,616] Trial 126 finished with value: 0.29787237549023604 and parameters: {'model_type': 'gcn', 'hidden_dims': '[512, 128]', 'dropout': 0.3769672369837695, 'batch_norm': True, 'lr': 0.009991852113601903, 'weight_decay': 3.0119652247995646e-05, 'epochs': 174, 'loss': 'mae', 'optimizer': 'adam', 'graph_mode': 'cutoff', 'cutoff': 0.75469579982753, 'grm_norm': 'gcn', 'self_loops': False, 'use_snp_selection': True, 'num_snps': 41895}. Best is trial 67 with value: 0.3066518037274824.
[I 2025-12-08 13:11:02,799] Trial 127 finished with value: 0.2930375781959728 and parameters: {'model_type': 'gcn', 'hidden_dims': '[512, 256]', 'dropout': 0.35049699109157784, 'batch_norm': True, 'lr': 6.879833823901672e-05, 'weight_decay': 8.184590022191391e-06, 'epochs': 207, 'loss': 'mae', 'optimizer': 'adam', 'graph_mode': 'cutoff', 'cutoff': 0.8155783258793909, 'grm_norm': 'cosine', 'self_loops': False, 'use_snp_selection': True, 'num_snps': 23995}. Best is trial 67 with value: 0.3066518037274824.
[I 2025-12-08 13:11:53,988] Trial 128 finished with value: 0.29466353132276935 and parameters: {'model_type': 'gcn', 'hidden_dims': '[512, 128]', 'dropout': 0.320037869038196, 'batch_norm': True, 'lr': 0.0005250575321423961, 'weight_decay': 1.1040162670394625e-05, 'epochs': 192, 'loss': 'mae', 'optimizer': 'adam', 'graph_mode': 'cutoff', 'cutoff': 0.830776083593845, 'grm_norm': 'none', 'self_loops': False, 'use_snp_selection': False}. Best is trial 67 with value: 0.3066518037274824.
[I 2025-12-08 13:12:07,608] Trial 129 finished with value: 0.2186866366152222 and parameters: {'model_type': 'gcn', 'hidden_dims': '[128, 64]', 'dropout': 0.3336652593760534, 'batch_norm': True, 'lr': 0.00022557342128516386, 'weight_decay': 2.656590341144958e-06, 'epochs': 222, 'loss': 'mae', 'optimizer': 'adam', 'graph_mode': 'knn', 'knn_k': 2, 'weighted_edges': False, 'symmetrize_mode': 'mutual', 'self_loops': False, 'use_snp_selection': True, 'num_snps': 8596}. Best is trial 67 with value: 0.3066518037274824.
[I 2025-12-08 13:12:46,307] Trial 130 finished with value: 0.29207974730024666 and parameters: {'model_type': 'gcn', 'hidden_dims': '[512, 128]', 'dropout': 0.35804291412130906, 'batch_norm': False, 'lr': 0.00013040706820576745, 'weight_decay': 1.3315694346174458e-05, 'epochs': 180, 'loss': 'mse', 'optimizer': 'adam', 'graph_mode': 'cutoff', 'cutoff': 0.8498250258972911, 'grm_norm': 'gcn', 'self_loops': False, 'use_snp_selection': True, 'num_snps': 35242}. Best is trial 67 with value: 0.3066518037274824.
