[I 2025-12-08 23:29:56,591] Trial 36 finished with value: 0.317666540095387 and parameters: {'model_type': 'gcn', 'hidden_dims': '[256, 128, 64]', 'dropout': 0.5668844321392298, 'batch_norm': True, 'lr': 0.00027450417374151896, 'weight_decay': 0.0005119976341073515, 'epochs': 88, 'loss': 'mae', 'optimizer': 'adam', 'graph_mode': 'cutoff', 'cutoff': 0.8460657818570345, 'grm_norm': 'cosine_then_gcn', 'self_loops': True, 'use_snp_selection': True, 'num_snps': 55695}. Best is trial 36 with value: 0.317666540095387.
[I 2025-12-08 23:30:21,787] Trial 37 finished with value: 0.30669238351901323 and parameters: {'model_type': 'gcn', 'hidden_dims': '[256, 128, 64]', 'dropout': 0.5712854531307521, 'batch_norm': True, 'lr': 0.0002730494943201061, 'weight_decay': 0.0005789141297121112, 'epochs': 57, 'loss': 'mae', 'optimizer': 'adam', 'graph_mode': 'cutoff', 'cutoff': 0.8400400918531424, 'grm_norm': 'cosine_then_gcn', 'self_loops': True, 'use_snp_selection': True, 'num_snps': 58690}. Best is trial 36 with value: 0.317666540095387.
[I 2025-12-08 23:31:05,846] Trial 38 finished with value: 0.306295454776913 and parameters: {'model_type': 'gcn', 'hidden_dims': '[256, 128, 64]', 'dropout': 0.5481259581023915, 'batch_norm': True, 'lr': 0.0005275134348309018, 'weight_decay': 0.00025463124125625164, 'epochs': 304, 'loss': 'mse', 'optimizer': 'adam', 'graph_mode': 'cutoff', 'cutoff': 0.8925728306821861, 'grm_norm': 'gcn', 'self_loops': True, 'use_snp_selection': True, 'num_snps': 42466}. Best is trial 36 with value: 0.317666540095387.
[I 2025-12-08 23:31:30,043] Trial 39 finished with value: 0.2562052964158377 and parameters: {'model_type': 'gcn', 'hidden_dims': '[256, 128, 64]', 'dropout': 0.5967276297313581, 'batch_norm': True, 'lr': 0.00013252209066068904, 'weight_decay': 0.0005721026436925144, 'epochs': 86, 'loss': 'mae', 'optimizer': 'adam', 'graph_mode': 'knn', 'knn_k': 6, 'weighted_edges': True, 'symmetrize_mode': 'union', 'self_loops': True, 'use_snp_selection': True, 'num_snps': 44445}. Best is trial 36 with value: 0.317666540095387.
[I 2025-12-08 23:31:58,182] Trial 40 finished with value: 0.1437348938445893 and parameters: {'model_type': 'gcn', 'hidden_dims': '[512, 64]', 'dropout': 0.5714221488408117, 'batch_norm': False, 'lr': 0.0007188489677203981, 'weight_decay': 0.00022272383520206384, 'epochs': 202, 'loss': 'mse', 'optimizer': 'adam', 'graph_mode': 'cutoff', 'cutoff': 0.808133600608026, 'grm_norm': 'cosine', 'self_loops': True, 'use_snp_selection': True, 'num_snps': 20466}. Best is trial 36 with value: 0.317666540095387.
[I 2025-12-08 23:32:26,368] Trial 41 finished with value: 0.3109809043411621 and parameters: {'model_type': 'gcn', 'hidden_dims': '[256, 128, 64]', 'dropout': 0.5399180230964643, 'batch_norm': True, 'lr': 0.00035593778872998726, 'weight_decay': 0.0006282537112427106, 'epochs': 91, 'loss': 'mae', 'optimizer': 'adam', 'graph_mode': 'cutoff', 'cutoff': 0.8470704285791026, 'grm_norm': 'cosine_then_gcn', 'self_loops': True, 'use_snp_selection': True, 'num_snps': 53608}. Best is trial 36 with value: 0.317666540095387.
[I 2025-12-08 23:32:43,116] Trial 42 finished with value: 0.310033070214366 and parameters: {'model_type': 'gcn', 'hidden_dims': '[128, 64]', 'dropout': 0.528165467563602, 'batch_norm': True, 'lr': 0.00011343876456545348, 'weight_decay': 0.0003668863382610463, 'epochs': 56, 'loss': 'mae', 'optimizer': 'adam', 'graph_mode': 'cutoff', 'cutoff': 0.7786231932242687, 'grm_norm': 'cosine_then_gcn', 'self_loops': False, 'use_snp_selection': True, 'num_snps': 36062}. Best is trial 36 with value: 0.317666540095387.
[I 2025-12-08 23:33:00,519] Trial 43 finished with value: 0.3120831256889081 and parameters: {'model_type': 'gcn', 'hidden_dims': '[256, 128]', 'dropout': 0.5588911579654564, 'batch_norm': True, 'lr': 5.276239507200165e-05, 'weight_decay': 0.0007708565035803001, 'epochs': 125, 'loss': 'mae', 'optimizer': 'adam', 'graph_mode': 'cutoff', 'cutoff': 0.8243669837276628, 'grm_norm': 'none', 'self_loops': True, 'use_snp_selection': False}. Best is trial 36 with value: 0.317666540095387.
[I 2025-12-08 23:33:28,440] Trial 44 finished with value: 0.31562609532575553 and parameters: {'model_type': 'gcn', 'hidden_dims': '[512, 256]', 'dropout': 0.12301381709222109, 'batch_norm': True, 'lr': 0.0010946333171982135, 'weight_decay': 0.000384283792143026, 'epochs': 97, 'loss': 'mae', 'optimizer': 'adam', 'graph_mode': 'cutoff', 'cutoff': 0.8582202606825712, 'grm_norm': 'gcn', 'self_loops': False, 'use_snp_selection': True, 'num_snps': 36430}. Best is trial 36 with value: 0.317666540095387.
[I 2025-12-08 23:33:55,860] Trial 45 finished with value: 0.3107163041927118 and parameters: {'model_type': 'gcn', 'hidden_dims': '[512, 256]', 'dropout': 0.12522436256202493, 'batch_norm': True, 'lr': 0.0010314055716675184, 'weight_decay': 0.00030478647308698536, 'epochs': 97, 'loss': 'mae', 'optimizer': 'adam', 'graph_mode': 'cutoff', 'cutoff': 0.8635988124473535, 'grm_norm': 'gcn', 'self_loops': False, 'use_snp_selection': True, 'num_snps': 34913}. Best is trial 36 with value: 0.317666540095387.
[I 2025-12-08 23:34:27,286] Trial 46 finished with value: 0.314776294171478 and parameters: {'model_type': 'gcn', 'hidden_dims': '[512, 256]', 'dropout': 0.15428487282551162, 'batch_norm': True, 'lr': 0.00046226576313392515, 'weight_decay': 7.511868908286181e-05, 'epochs': 80, 'loss': 'mae', 'optimizer': 'adam', 'graph_mode': 'cutoff', 'cutoff': 0.8959464299064002, 'grm_norm': 'gcn', 'self_loops': True, 'use_snp_selection': True, 'num_snps': 49818}. Best is trial 36 with value: 0.317666540095387.
[I 2025-12-08 23:34:42,457] Trial 47 finished with value: 0.3134149203099974 and parameters: {'model_type': 'gcn', 'hidden_dims': '[512, 256]', 'dropout': 0.25841470140363354, 'batch_norm': True, 'lr': 0.0002301039749320767, 'weight_decay': 0.00044278068547857775, 'epochs': 46, 'loss': 'mae', 'optimizer': 'adam', 'graph_mode': 'cutoff', 'cutoff': 0.8077574193505249, 'grm_norm': 'gcn', 'self_loops': False, 'use_snp_selection': True, 'num_snps': 20426}. Best is trial 36 with value: 0.317666540095387.
[I 2025-12-08 23:35:33,591] Trial 48 finished with value: 0.3038298863071818 and parameters: {'model_type': 'gcn', 'hidden_dims': '[512, 256]', 'dropout': 0.18239053429980828, 'batch_norm': False, 'lr': 0.0012931731702417158, 'weight_decay': 3.003998917383099e-06, 'epochs': 149, 'loss': 'mae', 'optimizer': 'adam', 'graph_mode': 'cutoff', 'cutoff': 0.8560207106112593, 'grm_norm': 'gcn', 'self_loops': True, 'use_snp_selection': True, 'num_snps': 59955}. Best is trial 36 with value: 0.317666540095387.
[I 2025-12-08 23:36:02,250] Trial 49 finished with value: 0.30723109058939385 and parameters: {'model_type': 'gcn', 'hidden_dims': '[512, 128]', 'dropout': 0.3565250523534964, 'batch_norm': True, 'lr': 0.0003092215088585381, 'weight_decay': 0.00021087606806872124, 'epochs': 100, 'loss': 'mse', 'optimizer': 'adam', 'graph_mode': 'cutoff', 'cutoff': 0.7661056791965282, 'grm_norm': 'cosine', 'self_loops': False, 'use_snp_selection': True, 'num_snps': 36729}. Best is trial 36 with value: 0.317666540095387.
[I 2025-12-08 23:36:30,304] Trial 50 finished with value: 0.23581664370456 and parameters: {'model_type': 'gcn', 'hidden_dims': '[512, 64]', 'dropout': 0.30220621079122995, 'batch_norm': True, 'lr': 0.0006001157587820205, 'weight_decay': 1.4317957694100288e-05, 'epochs': 60, 'loss': 'mae', 'optimizer': 'adam', 'graph_mode': 'knn', 'knn_k': 8, 'weighted_edges': False, 'symmetrize_mode': 'mutual', 'self_loops': True, 'use_snp_selection': True, 'num_snps': 47469}. Best is trial 36 with value: 0.317666540095387.
[I 2025-12-08 23:36:41,583] Trial 51 finished with value: 0.32000048673782483 and parameters: {'model_type': 'gcn', 'hidden_dims': '[256, 128]', 'dropout': 0.5984760164748781, 'batch_norm': True, 'lr': 0.001430229084656218, 'weight_decay': 0.00015859778414618544, 'epochs': 71, 'loss': 'mae', 'optimizer': 'adam', 'graph_mode': 'cutoff', 'cutoff': 0.8182205115810341, 'grm_norm': 'cosine_then_gcn', 'self_loops': False, 'use_snp_selection': False}. Best is trial 51 with value: 0.32000048673782483.
[I 2025-12-08 23:36:49,695] Trial 52 finished with value: 0.3154670780949892 and parameters: {'model_type': 'gcn', 'hidden_dims': '[128, 64]', 'dropout': 0.5969114166277004, 'batch_norm': True, 'lr': 0.0007226597229866762, 'weight_decay': 6.028863817979069e-05, 'epochs': 78, 'loss': 'mae', 'optimizer': 'adam', 'graph_mode': 'cutoff', 'cutoff': 0.8164939360595238, 'grm_norm': 'none', 'self_loops': False, 'use_snp_selection': False}. Best is trial 51 with value: 0.32000048673782483.
[I 2025-12-08 23:37:09,515] Trial 53 finished with value: 0.3138765760535528 and parameters: {'model_type': 'gcn', 'hidden_dims': '[512, 256]', 'dropout': 0.3283908268917882, 'batch_norm': True, 'lr': 0.001588467204490385, 'weight_decay': 0.0004566655344598656, 'epochs': 67, 'loss': 'mae', 'optimizer': 'adam', 'graph_mode': 'cutoff', 'cutoff': 0.8675910858422371, 'grm_norm': 'cosine_then_gcn', 'self_loops': False, 'use_snp_selection': False}. Best is trial 51 with value: 0.32000048673782483.
[I 2025-12-08 23:37:26,052] Trial 54 finished with value: 0.3033691231558917 and parameters: {'model_type': 'gcn', 'hidden_dims': '[256, 128]', 'dropout': 0.2315416573440518, 'batch_norm': True, 'lr': 0.000888924012783596, 'weight_decay': 0.0006503355758010306, 'epochs': 89, 'loss': 'mae', 'optimizer': 'adam', 'graph_mode': 'cutoff', 'cutoff': 0.7539330681912723, 'grm_norm': 'cosine_then_gcn', 'self_loops': False, 'use_snp_selection': True, 'num_snps': 22525}. Best is trial 51 with value: 0.32000048673782483.
[I 2025-12-08 23:37:41,542] Trial 55 finished with value: 0.31152931109429416 and parameters: {'model_type': 'gcn', 'hidden_dims': '[256, 128, 64]', 'dropout': 0.5779066108823518, 'batch_norm': True, 'lr': 0.00037379824252800517, 'weight_decay': 0.00034033544909485206, 'epochs': 101, 'loss': 'mae', 'optimizer': 'adam', 'graph_mode': 'cutoff', 'cutoff': 0.8992279839528744, 'grm_norm': 'gcn', 'self_loops': False, 'use_snp_selection': False}. Best is trial 51 with value: 0.32000048673782483.
[I 2025-12-08 23:37:50,695] Trial 56 finished with value: 0.0 and parameters: {'model_type': 'gcn', 'hidden_dims': '[256, 128]', 'dropout': 0.49128301769491756, 'batch_norm': False, 'lr': 0.001132003072243508, 'weight_decay': 0.00018305070798171408, 'epochs': 53, 'loss': 'mae', 'optimizer': 'adam', 'graph_mode': 'cutoff', 'cutoff': 0.8215057107101738, 'grm_norm': 'cosine', 'self_loops': False, 'use_snp_selection': False}. Best is trial 51 with value: 0.32000048673782483.
[I 2025-12-08 23:37:58,397] Trial 57 finished with value: 0.3123666427640902 and parameters: {'model_type': 'gcn', 'hidden_dims': '[128, 64]', 'dropout': 0.45245604238614506, 'batch_norm': True, 'lr': 0.000252732647686846, 'weight_decay': 0.0008135659040827189, 'epochs': 70, 'loss': 'mae', 'optimizer': 'adam', 'graph_mode': 'cutoff', 'cutoff': 0.7879266051930538, 'grm_norm': 'cosine_then_gcn', 'self_loops': False, 'use_snp_selection': False}. Best is trial 51 with value: 0.32000048673782483.
[I 2025-12-08 23:38:13,329] Trial 58 finished with value: 0.3058473488657324 and parameters: {'model_type': 'gcn', 'hidden_dims': '[256, 128]', 'dropout': 0.582073460319145, 'batch_norm': True, 'lr': 0.0005553132280392461, 'weight_decay': 3.547158391522854e-05, 'epochs': 108, 'loss': 'mae', 'optimizer': 'adam', 'graph_mode': 'cutoff', 'cutoff': 0.7074077879248071, 'grm_norm': 'cosine_then_gcn', 'self_loops': False, 'use_snp_selection': True, 'num_snps': 15019}. Best is trial 51 with value: 0.32000048673782483.
[I 2025-12-08 23:38:37,823] Trial 59 finished with value: 0.2694161971255021 and parameters: {'model_type': 'gcn', 'hidden_dims': '[512, 128]', 'dropout': 0.5490030701495864, 'batch_norm': True, 'lr': 0.0014180273192244232, 'weight_decay': 1.0123382345224607e-06, 'epochs': 85, 'loss': 'mae', 'optimizer': 'adam', 'graph_mode': 'cutoff', 'cutoff': 0.3289538069299782, 'grm_norm': 'cosine_then_gcn', 'self_loops': True, 'use_snp_selection': False}. Best is trial 51 with value: 0.32000048673782483.
[I 2025-12-08 23:39:35,169] Trial 60 finished with value: 0.3116935287754873 and parameters: {'model_type': 'gcn', 'hidden_dims': '[512, 256]', 'dropout': 0.4185686761450209, 'batch_norm': True, 'lr': 0.001996120058661847, 'weight_decay': 0.00016273712346387423, 'epochs': 223, 'loss': 'mae', 'optimizer': 'adam', 'graph_mode': 'cutoff', 'cutoff': 0.7468280436533876, 'grm_norm': 'cosine_then_gcn', 'self_loops': False, 'use_snp_selection': False}. Best is trial 51 with value: 0.32000048673782483.
[I 2025-12-08 23:39:42,520] Trial 61 finished with value: 0.314184266502381 and parameters: {'model_type': 'gcn', 'hidden_dims': '[128, 64]', 'dropout': 0.5953360647014645, 'batch_norm': True, 'lr': 0.0008015051339428487, 'weight_decay': 5.614963364665394e-05, 'epochs': 76, 'loss': 'mae', 'optimizer': 'adam', 'graph_mode': 'cutoff', 'cutoff': 0.8193978961310687, 'grm_norm': 'none', 'self_loops': False, 'use_snp_selection': False}. Best is trial 51 with value: 0.32000048673782483.
[I 2025-12-08 23:39:49,677] Trial 62 finished with value: 0.31781899866549485 and parameters: {'model_type': 'gcn', 'hidden_dims': '[128, 64]', 'dropout': 0.5569683511536534, 'batch_norm': True, 'lr': 0.0004332434590156954, 'weight_decay': 6.824758742477084e-05, 'epochs': 71, 'loss': 'mae', 'optimizer': 'adam', 'graph_mode': 'cutoff', 'cutoff': 0.8695939930880017, 'grm_norm': 'none', 'self_loops': False, 'use_snp_selection': False}. Best is trial 51 with value: 0.32000048673782483.
[I 2025-12-08 23:40:00,189] Trial 63 finished with value: 0.3104011721909778 and parameters: {'model_type': 'gcn', 'hidden_dims': '[128, 64]', 'dropout': 0.5160717111457432, 'batch_norm': True, 'lr': 0.00043779900496457937, 'weight_decay': 0.0002825268924174123, 'epochs': 118, 'loss': 'mae', 'optimizer': 'adam', 'graph_mode': 'cutoff', 'cutoff': 0.8710461855356544, 'grm_norm': 'none', 'self_loops': False, 'use_snp_selection': False}. Best is trial 51 with value: 0.32000048673782483.
[I 2025-12-08 23:40:09,356] Trial 64 finished with value: 0.30414283785232815 and parameters: {'model_type': 'gcn', 'hidden_dims': '[128, 64]', 'dropout': 0.5176107603389506, 'batch_norm': True, 'lr': 0.0001778452004959904, 'weight_decay': 4.976803426741936e-06, 'epochs': 96, 'loss': 'mae', 'optimizer': 'adam', 'graph_mode': 'cutoff', 'cutoff': 0.85139757731783, 'grm_norm': 'none', 'self_loops': False, 'use_snp_selection': False}. Best is trial 51 with value: 0.32000048673782483.
[I 2025-12-08 23:40:17,423] Trial 65 finished with value: 0.31424348189234025 and parameters: {'model_type': 'gcn', 'hidden_dims': '[256, 128]', 'dropout': 0.5549827951142567, 'batch_norm': True, 'lr': 0.000331945115188304, 'weight_decay': 0.0005184890275182903, 'epochs': 46, 'loss': 'mae', 'optimizer': 'adam', 'graph_mode': 'cutoff', 'cutoff': 0.7930648027218694, 'grm_norm': 'none', 'self_loops': False, 'use_snp_selection': False}. Best is trial 51 with value: 0.32000048673782483.
[I 2025-12-08 23:40:25,021] Trial 66 finished with value: 0.3146261634687424 and parameters: {'model_type': 'gcn', 'hidden_dims': '[128, 64]', 'dropout': 0.5722542169810546, 'batch_norm': True, 'lr': 0.0006228682480738796, 'weight_decay': 0.00014159188086078456, 'epochs': 66, 'loss': 'mae', 'optimizer': 'adam', 'graph_mode': 'cutoff', 'cutoff': 0.8760570501854194, 'grm_norm': 'cosine_then_gcn', 'self_loops': False, 'use_snp_selection': False}. Best is trial 51 with value: 0.32000048673782483.
[I 2025-12-08 23:40:45,226] Trial 67 finished with value: 0.014815353672931394 and parameters: {'model_type': 'gcn', 'hidden_dims': '[256, 128]', 'dropout': 0.10245589983633813, 'batch_norm': False, 'lr': 0.002927808594252238, 'weight_decay': 2.7443034454918253e-05, 'epochs': 149, 'loss': 'mse', 'optimizer': 'adam', 'graph_mode': 'knn', 'knn_k': 3, 'weighted_edges': True, 'symmetrize_mode': 'mutual', 'self_loops': True, 'use_snp_selection': False}. Best is trial 51 with value: 0.32000048673782483.
[I 2025-12-08 23:41:00,337] Trial 68 finished with value: 0.31107160824965124 and parameters: {'model_type': 'gcn', 'hidden_dims': '[256, 128, 64]', 'dropout': 0.484552675234583, 'batch_norm': True, 'lr': 0.0009411802372688829, 'weight_decay': 0.00032539706204165827, 'epochs': 104, 'loss': 'mae', 'optimizer': 'adam', 'graph_mode': 'cutoff', 'cutoff': 0.8355041930178838, 'grm_norm': 'cosine_then_gcn', 'self_loops': False, 'use_snp_selection': False}. Best is trial 51 with value: 0.32000048673782483.
[I 2025-12-08 23:42:09,011] Trial 69 finished with value: 0.21789074070166153 and parameters: {'model_type': 'gcn', 'hidden_dims': '[512, 64]', 'dropout': 0.4107099612228908, 'batch_norm': True, 'lr': 1.774525245415692e-05, 'weight_decay': 0.000756093988238309, 'epochs': 267, 'loss': 'mae', 'optimizer': 'adam', 'graph_mode': 'cutoff', 'cutoff': 0.4042264836060672, 'grm_norm': 'cosine_then_gcn', 'self_loops': False, 'use_snp_selection': False}. Best is trial 51 with value: 0.32000048673782483.
[I 2025-12-08 23:42:31,051] Trial 70 finished with value: 0.2932122563299 and parameters: {'model_type': 'gcn', 'hidden_dims': '[256, 128]', 'dropout': 0.46511889539486195, 'batch_norm': True, 'lr': 0.0004870652023878949, 'weight_decay': 7.399727672252834e-05, 'epochs': 86, 'loss': 'mae', 'optimizer': 'adam', 'graph_mode': 'cutoff', 'cutoff': 0.6191733370392958, 'grm_norm': 'gcn', 'self_loops': True, 'use_snp_selection': True, 'num_snps': 39253}. Best is trial 51 with value: 0.32000048673782483.
[I 2025-12-08 23:42:39,161] Trial 71 finished with value: 0.3153526316648464 and parameters: {'model_type': 'gcn', 'hidden_dims': '[128, 64]', 'dropout': 0.5871023109165245, 'batch_norm': True, 'lr': 0.0007618577106535159, 'weight_decay': 5.402048802956742e-05, 'epochs': 73, 'loss': 'mae', 'optimizer': 'adam', 'graph_mode': 'cutoff', 'cutoff': 0.8137185182233884, 'grm_norm': 'none', 'self_loops': False, 'use_snp_selection': False}. Best is trial 51 with value: 0.32000048673782483.
[I 2025-12-08 23:42:46,373] Trial 72 finished with value: 0.3167488783389061 and parameters: {'model_type': 'gcn', 'hidden_dims': '[128, 64]', 'dropout': 0.565667558513895, 'batch_norm': True, 'lr': 0.0006834762967782453, 'weight_decay': 7.079677235758337e-05, 'epochs': 79, 'loss': 'mae', 'optimizer': 'adam', 'graph_mode': 'cutoff', 'cutoff': 0.877517895968354, 'grm_norm': 'none', 'self_loops': False, 'use_snp_selection': False}. Best is trial 51 with value: 0.32000048673782483.
[I 2025-12-08 23:42:52,128] Trial 73 finished with value: 0.3128569777249154 and parameters: {'model_type': 'gcn', 'hidden_dims': '[128, 64]', 'dropout': 0.5646271670274821, 'batch_norm': True, 'lr': 0.0003799293399311322, 'weight_decay': 0.00023595662711907773, 'epochs': 55, 'loss': 'mae', 'optimizer': 'adam', 'graph_mode': 'cutoff', 'cutoff': 0.8773231054955644, 'grm_norm': 'none', 'self_loops': False, 'use_snp_selection': False}. Best is trial 51 with value: 0.32000048673782483.
[I 2025-12-08 23:43:01,835] Trial 74 finished with value: 0.31024176995854486 and parameters: {'model_type': 'gcn', 'hidden_dims': '[128, 64]', 'dropout': 0.5393821365289201, 'batch_norm': True, 'lr': 0.0002194374788769483, 'weight_decay': 0.00041985305601924147, 'epochs': 92, 'loss': 'mae', 'optimizer': 'adam', 'graph_mode': 'cutoff', 'cutoff': 0.8449552600386353, 'grm_norm': 'none', 'self_loops': False, 'use_snp_selection': False}. Best is trial 51 with value: 0.32000048673782483.
[I 2025-12-08 23:43:07,539] Trial 75 finished with value: 0.3175897102397431 and parameters: {'model_type': 'gcn', 'hidden_dims': '[128, 64]', 'dropout': 0.531678421472038, 'batch_norm': True, 'lr': 0.0011260137349083715, 'weight_decay': 0.0009464408627064736, 'epochs': 40, 'loss': 'mae', 'optimizer': 'adam', 'graph_mode': 'cutoff', 'cutoff': 0.7768861468439838, 'grm_norm': 'cosine_then_gcn', 'self_loops': False, 'use_snp_selection': False}. Best is trial 51 with value: 0.32000048673782483.
[I 2025-12-08 23:43:14,811] Trial 76 finished with value: 0.312313023210628 and parameters: {'model_type': 'gcn', 'hidden_dims': '[128, 64]', 'dropout': 0.5279038437126399, 'batch_norm': True, 'lr': 0.0006570016267722504, 'weight_decay': 0.0008763258556112676, 'epochs': 51, 'loss': 'mae', 'optimizer': 'adam', 'graph_mode': 'cutoff', 'cutoff': 0.7323850918362635, 'grm_norm': 'cosine_then_gcn', 'self_loops': False, 'use_snp_selection': False}. Best is trial 51 with value: 0.32000048673782483.
[I 2025-12-08 23:43:22,922] Trial 77 finished with value: 0.2505729598604288 and parameters: {'model_type': 'gcn', 'hidden_dims': '[128, 64]', 'dropout': 0.5065785175576595, 'batch_norm': True, 'lr': 0.0013696538870127599, 'weight_decay': 8.501073207127707e-05, 'epochs': 64, 'loss': 'mae', 'optimizer': 'adam', 'graph_mode': 'knn', 'knn_k': 8, 'weighted_edges': False, 'symmetrize_mode': 'union', 'self_loops': True, 'use_snp_selection': False}. Best is trial 51 with value: 0.32000048673782483.
[I 2025-12-08 23:43:29,421] Trial 78 finished with value: 0.31196069211162664 and parameters: {'model_type': 'gcn', 'hidden_dims': '[128, 64]', 'dropout': 0.5503192623820893, 'batch_norm': True, 'lr': 0.0004657145499335778, 'weight_decay': 0.0001212044994740949, 'epochs': 44, 'loss': 'mse', 'optimizer': 'adam', 'graph_mode': 'cutoff', 'cutoff': 0.7770670778406689, 'grm_norm': 'cosine_then_gcn', 'self_loops': False, 'use_snp_selection': False}. Best is trial 51 with value: 0.32000048673782483.
[I 2025-12-08 23:43:55,081] Trial 79 finished with value: 0.0 and parameters: {'model_type': 'gcn', 'hidden_dims': '[128, 64]', 'dropout': 0.5814774920104184, 'batch_norm': False, 'lr': 0.0019570075042166252, 'weight_decay': 0.0006618615305991205, 'epochs': 328, 'loss': 'mae', 'optimizer': 'adam', 'graph_mode': 'cutoff', 'cutoff': 0.7922125657633035, 'grm_norm': 'cosine_then_gcn', 'self_loops': False, 'use_snp_selection': False}. Best is trial 51 with value: 0.32000048673782483.
