[I 2025-12-08 18:13:43,459] Trial 6 finished with value: 0.28633761640935634 and parameters: {'model_type': 'gcn', 'hidden_dims': '[128, 64]', 'dropout': 0.31805912766941713, 'batch_norm': True, 'lr': 1.2361026034262557e-05, 'weight_decay': 6.492620232791903e-06, 'epochs': 271, 'loss': 'mse', 'optimizer': 'adam', 'graph_mode': 'cutoff', 'cutoff': 0.6193362582230448, 'grm_norm': 'cosine', 'self_loops': False, 'use_snp_selection': True, 'num_snps': 28594}. Best is trial 4 with value: 0.3072771672763547.
[I 2025-12-08 18:14:04,355] Trial 7 finished with value: 0.24633687227689163 and parameters: {'model_type': 'gcn', 'hidden_dims': '[512, 64]', 'dropout': 0.471337288649717, 'batch_norm': True, 'lr': 2.239693207292708e-05, 'weight_decay': 2.263166635514082e-06, 'epochs': 69, 'loss': 'mse', 'optimizer': 'adam', 'graph_mode': 'cutoff', 'cutoff': 0.4056820886426376, 'grm_norm': 'cosine', 'self_loops': False, 'use_snp_selection': False}. Best is trial 4 with value: 0.3072771672763547.
[I 2025-12-08 18:14:42,847] Trial 8 finished with value: 0.27293185022177086 and parameters: {'model_type': 'gcn', 'hidden_dims': '[512, 256]', 'dropout': 0.20659328268932406, 'batch_norm': False, 'lr': 8.93315124361372e-05, 'weight_decay': 0.00028987480727919035, 'epochs': 136, 'loss': 'mae', 'optimizer': 'adam', 'graph_mode': 'knn', 'knn_k': 3, 'weighted_edges': False, 'symmetrize_mode': 'union', 'self_loops': False, 'use_snp_selection': True, 'num_snps': 43128}. Best is trial 4 with value: 0.3072771672763547.
[I 2025-12-08 18:15:26,012] Trial 9 finished with value: 0.013560910602620968 and parameters: {'model_type': 'gcn', 'hidden_dims': '[512, 256]', 'dropout': 0.2888209592870401, 'batch_norm': False, 'lr': 0.004734648143129892, 'weight_decay': 1.5879705591356368e-06, 'epochs': 163, 'loss': 'mse', 'optimizer': 'adam', 'graph_mode': 'cutoff', 'cutoff': 0.5984899797909019, 'grm_norm': 'cosine', 'self_loops': True, 'use_snp_selection': False}. Best is trial 4 with value: 0.3072771672763547.
[I 2025-12-08 18:15:35,426] Trial 10 finished with value: 0.2705059262760948 and parameters: {'model_type': 'gcn', 'hidden_dims': '[512, 128]', 'dropout': 0.11372025982957354, 'batch_norm': False, 'lr': 0.0023343012062770553, 'weight_decay': 4.14440562940608e-05, 'epochs': 41, 'loss': 'mae', 'optimizer': 'adam', 'graph_mode': 'cutoff', 'cutoff': 0.8740100033033124, 'grm_norm': 'none', 'self_loops': False, 'use_snp_selection': True, 'num_snps': 3859}. Best is trial 4 with value: 0.3072771672763547.
[I 2025-12-08 18:15:45,627] Trial 11 finished with value: 0.31185855800288664 and parameters: {'model_type': 'gcn', 'hidden_dims': '[128, 64]', 'dropout': 0.44863014119095845, 'batch_norm': True, 'lr': 0.0005943392021247852, 'weight_decay': 1.0655358607693621e-07, 'epochs': 110, 'loss': 'mae', 'optimizer': 'adam', 'graph_mode': 'cutoff', 'cutoff': 0.8568899271933978, 'grm_norm': 'cosine_then_gcn', 'self_loops': True, 'use_snp_selection': False}. Best is trial 11 with value: 0.31185855800288664.
[I 2025-12-08 18:15:58,254] Trial 12 finished with value: 0.30033918238475604 and parameters: {'model_type': 'gcn', 'hidden_dims': '[512, 256]', 'dropout': 0.42758862319180935, 'batch_norm': True, 'lr': 0.0012059085553112938, 'weight_decay': 3.482253699955131e-05, 'epochs': 103, 'loss': 'mae', 'optimizer': 'adam', 'graph_mode': 'cutoff', 'cutoff': 0.8919050080438428, 'grm_norm': 'cosine_then_gcn', 'self_loops': True, 'use_snp_selection': True, 'num_snps': 6176}. Best is trial 11 with value: 0.31185855800288664.
[I 2025-12-08 18:16:12,350] Trial 13 finished with value: 0.31050722822326404 and parameters: {'model_type': 'gcn', 'hidden_dims': '[256, 128]', 'dropout': 0.4452783958423849, 'batch_norm': True, 'lr': 0.00028764898471530923, 'weight_decay': 8.746795324277564e-06, 'epochs': 96, 'loss': 'mae', 'optimizer': 'adam', 'graph_mode': 'cutoff', 'cutoff': 0.7596101551526167, 'grm_norm': 'cosine_then_gcn', 'self_loops': False, 'use_snp_selection': False}. Best is trial 11 with value: 0.31185855800288664.
[I 2025-12-08 18:16:31,228] Trial 14 finished with value: 0.024298260008657476 and parameters: {'model_type': 'gcn', 'hidden_dims': '[256, 128]', 'dropout': 0.4280653677930823, 'batch_norm': False, 'lr': 0.009430566714901507, 'weight_decay': 7.081154721639774e-06, 'epochs': 135, 'loss': 'mae', 'optimizer': 'adam', 'graph_mode': 'cutoff', 'cutoff': 0.7240625816402448, 'grm_norm': 'cosine_then_gcn', 'self_loops': True, 'use_snp_selection': False}. Best is trial 11 with value: 0.31185855800288664.
[I 2025-12-08 18:16:54,193] Trial 15 finished with value: 0.3156970156122701 and parameters: {'model_type': 'gcn', 'hidden_dims': '[256, 128]', 'dropout': 0.4827864904294467, 'batch_norm': True, 'lr': 0.000166827860779801, 'weight_decay': 4.104169171058631e-07, 'epochs': 172, 'loss': 'mae', 'optimizer': 'adam', 'graph_mode': 'cutoff', 'cutoff': 0.7416328481826706, 'grm_norm': 'cosine_then_gcn', 'self_loops': False, 'use_snp_selection': False}. Best is trial 15 with value: 0.3156970156122701.
[I 2025-12-08 18:17:41,007] Trial 16 finished with value: 0.3160547299612374 and parameters: {'model_type': 'gcn', 'hidden_dims': '[512, 128]', 'dropout': 0.4988064344225382, 'batch_norm': True, 'lr': 0.00018610916715297834, 'weight_decay': 3.7717055221981746e-07, 'epochs': 178, 'loss': 'mae', 'optimizer': 'adam', 'graph_mode': 'cutoff', 'cutoff': 0.7162710405524246, 'grm_norm': 'cosine_then_gcn', 'self_loops': False, 'use_snp_selection': False}. Best is trial 16 with value: 0.3160547299612374.
[I 2025-12-08 18:18:43,033] Trial 17 finished with value: 0.2267967745911179 and parameters: {'model_type': 'gcn', 'hidden_dims': '[512, 128]', 'dropout': 0.5101604050085489, 'batch_norm': True, 'lr': 0.00014056876271838377, 'weight_decay': 4.5817280187175797e-07, 'epochs': 240, 'loss': 'mae', 'optimizer': 'adam', 'graph_mode': 'cutoff', 'cutoff': 0.48163207916794326, 'grm_norm': 'cosine_then_gcn', 'self_loops': False, 'use_snp_selection': False}. Best is trial 16 with value: 0.3160547299612374.
[I 2025-12-08 18:19:29,537] Trial 18 finished with value: 0.27317236191011396 and parameters: {'model_type': 'gcn', 'hidden_dims': '[512, 128]', 'dropout': 0.38212844504793647, 'batch_norm': False, 'lr': 3.997746938164808e-05, 'weight_decay': 4.771905199375472e-07, 'epochs': 178, 'loss': 'mae', 'optimizer': 'adam', 'graph_mode': 'knn', 'knn_k': 1, 'weighted_edges': False, 'symmetrize_mode': 'mutual', 'self_loops': False, 'use_snp_selection': False}. Best is trial 16 with value: 0.3160547299612374.
[I 2025-12-08 18:20:00,172] Trial 19 finished with value: 0.3097875097285713 and parameters: {'model_type': 'gcn', 'hidden_dims': '[256, 128, 64]', 'dropout': 0.5972327215560366, 'batch_norm': True, 'lr': 0.00015649218402835204, 'weight_decay': 2.500117190559781e-06, 'epochs': 229, 'loss': 'mae', 'optimizer': 'adam', 'graph_mode': 'cutoff', 'cutoff': 0.7141405811516445, 'grm_norm': 'cosine_then_gcn', 'self_loops': False, 'use_snp_selection': False}. Best is trial 16 with value: 0.3160547299612374.
[I 2025-12-08 18:20:22,127] Trial 20 finished with value: 0.24280237723112125 and parameters: {'model_type': 'gcn', 'hidden_dims': '[256, 128]', 'dropout': 0.38284547527628443, 'batch_norm': True, 'lr': 0.0012172908831772238, 'weight_decay': 1.9800037260488955e-07, 'epochs': 158, 'loss': 'mae', 'optimizer': 'adam', 'graph_mode': 'cutoff', 'cutoff': 0.2386548621641688, 'grm_norm': 'cosine_then_gcn', 'self_loops': False, 'use_snp_selection': False}. Best is trial 16 with value: 0.3160547299612374.
[I 2025-12-08 18:20:34,504] Trial 21 finished with value: 0.31175667075313573 and parameters: {'model_type': 'gcn', 'hidden_dims': '[128, 64]', 'dropout': 0.4995923992730177, 'batch_norm': True, 'lr': 0.00021749770176620242, 'weight_decay': 1.1184311207850229e-07, 'epochs': 140, 'loss': 'mae', 'optimizer': 'adam', 'graph_mode': 'cutoff', 'cutoff': 0.7723037998128993, 'grm_norm': 'cosine_then_gcn', 'self_loops': True, 'use_snp_selection': False}. Best is trial 16 with value: 0.3160547299612374.
[I 2025-12-08 18:21:23,391] Trial 22 finished with value: 0.31314489340745294 and parameters: {'model_type': 'gcn', 'hidden_dims': '[512, 128]', 'dropout': 0.5187814043485741, 'batch_norm': True, 'lr': 0.0007919879480076257, 'weight_decay': 9.432275226683418e-07, 'epochs': 186, 'loss': 'mae', 'optimizer': 'adam', 'graph_mode': 'cutoff', 'cutoff': 0.6693963729191204, 'grm_norm': 'cosine_then_gcn', 'self_loops': False, 'use_snp_selection': False}. Best is trial 16 with value: 0.3160547299612374.
[I 2025-12-08 18:22:11,614] Trial 23 finished with value: 0.3136849914260106 and parameters: {'model_type': 'gcn', 'hidden_dims': '[512, 128]', 'dropout': 0.5286856527300646, 'batch_norm': True, 'lr': 0.0009654998731251003, 'weight_decay': 7.763156352689287e-07, 'epochs': 185, 'loss': 'mae', 'optimizer': 'adam', 'graph_mode': 'cutoff', 'cutoff': 0.6680346800363531, 'grm_norm': 'cosine_then_gcn', 'self_loops': False, 'use_snp_selection': False}. Best is trial 16 with value: 0.3160547299612374.
[I 2025-12-08 18:23:15,740] Trial 24 finished with value: 0.2581172124898144 and parameters: {'model_type': 'gcn', 'hidden_dims': '[512, 128]', 'dropout': 0.5922305881238027, 'batch_norm': True, 'lr': 4.246453947630832e-05, 'weight_decay': 6.255576608395386e-07, 'epochs': 250, 'loss': 'mae', 'optimizer': 'adam', 'graph_mode': 'cutoff', 'cutoff': 0.5383268922785961, 'grm_norm': 'cosine_then_gcn', 'self_loops': False, 'use_snp_selection': False}. Best is trial 16 with value: 0.3160547299612374.
[I 2025-12-08 18:24:05,638] Trial 25 finished with value: 0.3054949369990712 and parameters: {'model_type': 'gcn', 'hidden_dims': '[512, 128]', 'dropout': 0.5473785408671414, 'batch_norm': True, 'lr': 0.002783186641237166, 'weight_decay': 3.7378707682405905e-06, 'epochs': 193, 'loss': 'mae', 'optimizer': 'adam', 'graph_mode': 'cutoff', 'cutoff': 0.6674270678501394, 'grm_norm': 'none', 'self_loops': False, 'use_snp_selection': False}. Best is trial 16 with value: 0.3160547299612374.
[I 2025-12-08 18:24:48,867] Trial 26 finished with value: 0.19912725509175588 and parameters: {'model_type': 'gcn', 'hidden_dims': '[512, 128]', 'dropout': 0.3858876445538639, 'batch_norm': False, 'lr': 0.0001528285028044423, 'weight_decay': 2.238755926365831e-07, 'epochs': 159, 'loss': 'mse', 'optimizer': 'adam', 'graph_mode': 'knn', 'knn_k': 6, 'weighted_edges': False, 'symmetrize_mode': 'union', 'self_loops': False, 'use_snp_selection': False}. Best is trial 16 with value: 0.3160547299612374.
[I 2025-12-08 18:25:16,925] Trial 27 finished with value: 0.3130368972057155 and parameters: {'model_type': 'gcn', 'hidden_dims': '[256, 128]', 'dropout': 0.48166145566188373, 'batch_norm': True, 'lr': 0.0013563161537861496, 'weight_decay': 1.2498463933889284e-06, 'epochs': 218, 'loss': 'mae', 'optimizer': 'adam', 'graph_mode': 'cutoff', 'cutoff': 0.7988424043254788, 'grm_norm': 'gcn', 'self_loops': False, 'use_snp_selection': False}. Best is trial 16 with value: 0.3160547299612374.
[I 2025-12-08 18:26:22,858] Trial 28 finished with value: 0.22943749157436616 and parameters: {'model_type': 'gcn', 'hidden_dims': '[512, 128]', 'dropout': 0.5307639631456355, 'batch_norm': True, 'lr': 4.446294938689993e-05, 'weight_decay': 1.728830978217974e-05, 'epochs': 258, 'loss': 'mae', 'optimizer': 'adam', 'graph_mode': 'cutoff', 'cutoff': 0.5230684218326024, 'grm_norm': 'cosine_then_gcn', 'self_loops': False, 'use_snp_selection': False}. Best is trial 16 with value: 0.3160547299612374.
[I 2025-12-08 18:27:00,041] Trial 29 finished with value: 0.2246182846427735 and parameters: {'model_type': 'gcn', 'hidden_dims': '[256, 128, 64]', 'dropout': 0.4128473809275458, 'batch_norm': True, 'lr': 0.00044534174941250273, 'weight_decay': 3.3434864624444136e-07, 'epochs': 277, 'loss': 'mae', 'optimizer': 'adam', 'graph_mode': 'knn', 'knn_k': 10, 'weighted_edges': False, 'symmetrize_mode': 'mutual', 'self_loops': False, 'use_snp_selection': False}. Best is trial 16 with value: 0.3160547299612374.
[I 2025-12-08 18:27:33,728] Trial 30 finished with value: 0.3115265045138894 and parameters: {'model_type': 'gcn', 'hidden_dims': '[512, 64]', 'dropout': 0.47777860395425936, 'batch_norm': True, 'lr': 0.00018886189123368328, 'weight_decay': 3.8620354887537005e-06, 'epochs': 124, 'loss': 'mae', 'optimizer': 'adam', 'graph_mode': 'cutoff', 'cutoff': 0.7030269450512381, 'grm_norm': 'cosine_then_gcn', 'self_loops': False, 'use_snp_selection': False}. Best is trial 16 with value: 0.3160547299612374.
[I 2025-12-08 18:28:22,804] Trial 31 finished with value: 0.3115894884332014 and parameters: {'model_type': 'gcn', 'hidden_dims': '[512, 128]', 'dropout': 0.511302888589551, 'batch_norm': True, 'lr': 0.0008090741193170544, 'weight_decay': 7.885310483754193e-07, 'epochs': 187, 'loss': 'mae', 'optimizer': 'adam', 'graph_mode': 'cutoff', 'cutoff': 0.646325795774205, 'grm_norm': 'cosine_then_gcn', 'self_loops': False, 'use_snp_selection': False}. Best is trial 16 with value: 0.3160547299612374.
[I 2025-12-08 18:29:08,406] Trial 32 finished with value: 0.31473017803394127 and parameters: {'model_type': 'gcn', 'hidden_dims': '[512, 128]', 'dropout': 0.5584368744773827, 'batch_norm': True, 'lr': 0.0008161729873608939, 'weight_decay': 2.484734872917861e-07, 'epochs': 174, 'loss': 'mae', 'optimizer': 'adam', 'graph_mode': 'cutoff', 'cutoff': 0.683717518265824, 'grm_norm': 'cosine_then_gcn', 'self_loops': False, 'use_snp_selection': False}. Best is trial 16 with value: 0.3160547299612374.
[I 2025-12-08 18:29:53,824] Trial 33 finished with value: 0.31430463223765537 and parameters: {'model_type': 'gcn', 'hidden_dims': '[512, 128]', 'dropout': 0.5658452795668538, 'batch_norm': True, 'lr': 0.001773269510401312, 'weight_decay': 2.396644358533342e-07, 'epochs': 172, 'loss': 'mae', 'optimizer': 'adam', 'graph_mode': 'cutoff', 'cutoff': 0.7420996486291113, 'grm_norm': 'cosine_then_gcn', 'self_loops': False, 'use_snp_selection': False}. Best is trial 16 with value: 0.3160547299612374.
[I 2025-12-08 18:31:10,588] Trial 34 finished with value: 0.31349451978564613 and parameters: {'model_type': 'gcn', 'hidden_dims': '[512, 128]', 'dropout': 0.5704513394775197, 'batch_norm': True, 'lr': 0.0020702843841951487, 'weight_decay': 2.077334908620108e-07, 'epochs': 304, 'loss': 'mae', 'optimizer': 'adam', 'graph_mode': 'cutoff', 'cutoff': 0.7470366522209739, 'grm_norm': 'cosine_then_gcn', 'self_loops': False, 'use_snp_selection': False}. Best is trial 16 with value: 0.3160547299612374.
[I 2025-12-08 18:31:37,551] Trial 35 finished with value: 0.20113188259661224 and parameters: {'model_type': 'gcn', 'hidden_dims': '[256, 128]', 'dropout': 0.5728729303502911, 'batch_norm': True, 'lr': 0.004425012156147235, 'weight_decay': 0.00012394914838370497, 'epochs': 206, 'loss': 'mse', 'optimizer': 'adam', 'graph_mode': 'knn', 'knn_k': 1, 'weighted_edges': True, 'symmetrize_mode': 'union', 'self_loops': False, 'use_snp_selection': False}. Best is trial 16 with value: 0.3160547299612374.
[I 2025-12-08 18:32:15,023] Trial 36 finished with value: 0.31346998614367516 and parameters: {'model_type': 'gcn', 'hidden_dims': '[256, 128, 64]', 'dropout': 0.5514213508298625, 'batch_norm': True, 'lr': 0.0005425837308220017, 'weight_decay': 3.158642211104891e-07, 'epochs': 168, 'loss': 'mae', 'optimizer': 'adam', 'graph_mode': 'cutoff', 'cutoff': 0.810701211250846, 'grm_norm': 'cosine_then_gcn', 'self_loops': False, 'use_snp_selection': True, 'num_snps': 55695}. Best is trial 16 with value: 0.3160547299612374.
[I 2025-12-08 18:32:55,090] Trial 37 finished with value: 0.2854751960015927 and parameters: {'model_type': 'gcn', 'hidden_dims': '[512, 64]', 'dropout': 0.5972473602935422, 'batch_norm': True, 'lr': 0.00010998022808816393, 'weight_decay': 1.842980529373013e-07, 'epochs': 149, 'loss': 'mae', 'optimizer': 'adam', 'graph_mode': 'cutoff', 'cutoff': 0.5712336501051173, 'grm_norm': 'cosine_then_gcn', 'self_loops': False, 'use_snp_selection': False}. Best is trial 16 with value: 0.3160547299612374.
[I 2025-12-08 18:33:48,232] Trial 38 finished with value: 0.31307180956688596 and parameters: {'model_type': 'gcn', 'hidden_dims': '[512, 128]', 'dropout': 0.48277219575914343, 'batch_norm': True, 'lr': 0.00029923128893555236, 'weight_decay': 4.627347289390175e-07, 'epochs': 206, 'loss': 'mse', 'optimizer': 'adam', 'graph_mode': 'cutoff', 'cutoff': 0.7164317021096263, 'grm_norm': 'gcn', 'self_loops': False, 'use_snp_selection': False}. Best is trial 16 with value: 0.3160547299612374.
[I 2025-12-08 18:34:12,709] Trial 39 finished with value: 0.2646055476758987 and parameters: {'model_type': 'gcn', 'hidden_dims': '[256, 128]', 'dropout': 0.45304182759878514, 'batch_norm': True, 'lr': 6.252955352236542e-05, 'weight_decay': 1.5054560347758864e-06, 'epochs': 120, 'loss': 'mae', 'optimizer': 'adam', 'graph_mode': 'knn', 'knn_k': 7, 'weighted_edges': True, 'symmetrize_mode': 'mutual', 'self_loops': False, 'use_snp_selection': True, 'num_snps': 37740}. Best is trial 16 with value: 0.3160547299612374.
[I 2025-12-08 18:35:09,672] Trial 40 finished with value: 0.28766284988269863 and parameters: {'model_type': 'gcn', 'hidden_dims': '[512, 128]', 'dropout': 0.5607161518410916, 'batch_norm': False, 'lr': 0.0002491831078694867, 'weight_decay': 1.5912315912808468e-07, 'epochs': 222, 'loss': 'mse', 'optimizer': 'adam', 'graph_mode': 'cutoff', 'cutoff': 0.83567967646835, 'grm_norm': 'cosine', 'self_loops': False, 'use_snp_selection': False}. Best is trial 16 with value: 0.3160547299612374.
[I 2025-12-08 18:35:55,321] Trial 41 finished with value: 0.31606475813714086 and parameters: {'model_type': 'gcn', 'hidden_dims': '[512, 128]', 'dropout': 0.527946559389498, 'batch_norm': True, 'lr': 0.0008626799181013179, 'weight_decay': 3.702569388726492e-07, 'epochs': 174, 'loss': 'mae', 'optimizer': 'adam', 'graph_mode': 'cutoff', 'cutoff': 0.6722425215237735, 'grm_norm': 'cosine_then_gcn', 'self_loops': False, 'use_snp_selection': False}. Best is trial 41 with value: 0.31606475813714086.
[I 2025-12-08 18:36:40,419] Trial 42 finished with value: 0.3138113407344839 and parameters: {'model_type': 'gcn', 'hidden_dims': '[512, 128]', 'dropout': 0.5386735676544933, 'batch_norm': True, 'lr': 0.00158730100024637, 'weight_decay': 3.5317042884437644e-07, 'epochs': 172, 'loss': 'mae', 'optimizer': 'adam', 'graph_mode': 'cutoff', 'cutoff': 0.7684551242842238, 'grm_norm': 'cosine_then_gcn', 'self_loops': False, 'use_snp_selection': False}. Best is trial 41 with value: 0.31606475813714086.
[I 2025-12-08 18:37:20,717] Trial 43 finished with value: 0.31344882536555113 and parameters: {'model_type': 'gcn', 'hidden_dims': '[512, 128]', 'dropout': 0.5776002358947455, 'batch_norm': True, 'lr': 0.00040701681627321954, 'weight_decay': 0.0006630986319331192, 'epochs': 152, 'loss': 'mae', 'optimizer': 'adam', 'graph_mode': 'cutoff', 'cutoff': 0.6961304769761512, 'grm_norm': 'none', 'self_loops': False, 'use_snp_selection': False}. Best is trial 41 with value: 0.31606475813714086.
[I 2025-12-08 18:38:13,785] Trial 44 finished with value: 0.29739665504090584 and parameters: {'model_type': 'gcn', 'hidden_dims': '[512, 128]', 'dropout': 0.49453621594180075, 'batch_norm': True, 'lr': 0.0029063874110907334, 'weight_decay': 1.4801429845205562e-07, 'epochs': 206, 'loss': 'mae', 'optimizer': 'adam', 'graph_mode': 'cutoff', 'cutoff': 0.6022531836405646, 'grm_norm': 'gcn', 'self_loops': False, 'use_snp_selection': False}. Best is trial 41 with value: 0.31606475813714086.
[I 2025-12-08 18:38:32,633] Trial 45 finished with value: 0.30744840962984243 and parameters: {'model_type': 'gcn', 'hidden_dims': '[512, 256]', 'dropout': 0.1351383420975328, 'batch_norm': True, 'lr': 0.0006994654554108738, 'weight_decay': 5.680407449943265e-07, 'epochs': 79, 'loss': 'mae', 'optimizer': 'adam', 'graph_mode': 'cutoff', 'cutoff': 0.8104325495182876, 'grm_norm': 'cosine_then_gcn', 'self_loops': True, 'use_snp_selection': True, 'num_snps': 21630}. Best is trial 41 with value: 0.31606475813714086.
[I 2025-12-08 18:38:47,260] Trial 46 finished with value: 0.31059794048766143 and parameters: {'model_type': 'gcn', 'hidden_dims': '[128, 64]', 'dropout': 0.4587787871419649, 'batch_norm': True, 'lr': 0.0004524916106949332, 'weight_decay': 2.955904662316517e-07, 'epochs': 176, 'loss': 'mae', 'optimizer': 'adam', 'graph_mode': 'cutoff', 'cutoff': 0.6372783728010704, 'grm_norm': 'cosine_then_gcn', 'self_loops': False, 'use_snp_selection': False}. Best is trial 41 with value: 0.31606475813714086.
[I 2025-12-08 18:39:25,358] Trial 47 finished with value: 0.31218449664772485 and parameters: {'model_type': 'gcn', 'hidden_dims': '[512, 64]', 'dropout': 0.3529057224178117, 'batch_norm': True, 'lr': 0.0016576698900313347, 'weight_decay': 9.394264494058685e-07, 'epochs': 143, 'loss': 'mae', 'optimizer': 'adam', 'graph_mode': 'cutoff', 'cutoff': 0.7412674221743365, 'grm_norm': 'cosine', 'self_loops': False, 'use_snp_selection': False}. Best is trial 41 with value: 0.31606475813714086.
[I 2025-12-08 18:39:52,903] Trial 48 finished with value: 0.26066072579850974 and parameters: {'model_type': 'gcn', 'hidden_dims': '[256, 128]', 'dropout': 0.5443743533004455, 'batch_norm': False, 'lr': 0.00010522893883869529, 'weight_decay': 2.05386539484674e-06, 'epochs': 130, 'loss': 'mae', 'optimizer': 'adam', 'graph_mode': 'cutoff', 'cutoff': 0.4797854427600242, 'grm_norm': 'none', 'self_loops': True, 'use_snp_selection': True, 'num_snps': 44439}. Best is trial 41 with value: 0.31606475813714086.
[I 2025-12-08 18:40:44,470] Trial 49 finished with value: 0.3153595260729058 and parameters: {'model_type': 'gcn', 'hidden_dims': '[512, 128]', 'dropout': 0.5139802513977633, 'batch_norm': True, 'lr': 0.0034119546649156994, 'weight_decay': 1.031775503178514e-07, 'epochs': 200, 'loss': 'mse', 'optimizer': 'adam', 'graph_mode': 'cutoff', 'cutoff': 0.7854675154100069, 'grm_norm': 'cosine_then_gcn', 'self_loops': False, 'use_snp_selection': False}. Best is trial 41 with value: 0.31606475813714086.
