[I 2025-12-08 12:31:16,144] Trial 45 finished with value: 0.29463285364085445 and parameters: {'model_type': 'gcn', 'hidden_dims': '[512, 128]', 'dropout': 0.3983528531552498, 'batch_norm': True, 'lr': 0.00075568491887319, 'weight_decay': 1.427212294829805e-06, 'epochs': 215, 'loss': 'mae', 'optimizer': 'adam', 'graph_mode': 'cutoff', 'cutoff': 0.7295163507342893, 'grm_norm': 'gcn', 'self_loops': False, 'use_snp_selection': True, 'num_snps': 58387}. Best is trial 43 with value: 0.30228818287114556.
[I 2025-12-08 12:32:36,796] Trial 46 finished with value: 0.29094912085867863 and parameters: {'model_type': 'gcn', 'hidden_dims': '[512, 64]', 'dropout': 0.48680545113082574, 'batch_norm': True, 'lr': 0.0004439924762439095, 'weight_decay': 2.380015420778561e-06, 'epochs': 324, 'loss': 'mse', 'optimizer': 'adam', 'graph_mode': 'cutoff', 'cutoff': 0.6345689528159651, 'grm_norm': 'cosine', 'self_loops': False, 'use_snp_selection': True, 'num_snps': 53728}. Best is trial 43 with value: 0.30228818287114556.
[I 2025-12-08 12:33:20,324] Trial 47 finished with value: 0.28474095932027255 and parameters: {'model_type': 'gcn', 'hidden_dims': '[512, 256]', 'dropout': 0.4668245417738335, 'batch_norm': False, 'lr': 1.1589703477213023e-05, 'weight_decay': 3.165309608251734e-05, 'epochs': 170, 'loss': 'mae', 'optimizer': 'adam', 'graph_mode': 'cutoff', 'cutoff': 0.6935743733623275, 'grm_norm': 'gcn', 'self_loops': False, 'use_snp_selection': False}. Best is trial 43 with value: 0.30228818287114556.
[I 2025-12-08 12:34:02,255] Trial 48 finished with value: 0.29492685316115513 and parameters: {'model_type': 'gcn', 'hidden_dims': '[512, 128]', 'dropout': 0.2295803977075656, 'batch_norm': True, 'lr': 0.0001971743987007868, 'weight_decay': 1.4287311791290452e-05, 'epochs': 148, 'loss': 'mae', 'optimizer': 'adam', 'graph_mode': 'cutoff', 'cutoff': 0.8850170028567375, 'grm_norm': 'cosine', 'self_loops': False, 'use_snp_selection': True, 'num_snps': 46815}. Best is trial 43 with value: 0.30228818287114556.
[I 2025-12-08 12:34:22,525] Trial 49 finished with value: 0.23763548262699752 and parameters: {'model_type': 'gcn', 'hidden_dims': '[512, 128]', 'dropout': 0.4042599867996832, 'batch_norm': True, 'lr': 0.00029538234793345273, 'weight_decay': 5.5108123171692824e-06, 'epochs': 65, 'loss': 'mse', 'optimizer': 'adam', 'graph_mode': 'knn', 'knn_k': 4, 'weighted_edges': True, 'symmetrize_mode': 'mutual', 'self_loops': False, 'use_snp_selection': True, 'num_snps': 28951}. Best is trial 43 with value: 0.30228818287114556.
[I 2025-12-08 12:34:39,206] Trial 50 finished with value: 0.25853644895027716 and parameters: {'model_type': 'gcn', 'hidden_dims': '[256, 128, 64]', 'dropout': 0.3089893644935789, 'batch_norm': True, 'lr': 9.293437543772273e-05, 'weight_decay': 2.173241290424149e-05, 'epochs': 115, 'loss': 'mae', 'optimizer': 'adam', 'graph_mode': 'cutoff', 'cutoff': 0.5681003724142943, 'grm_norm': 'gcn', 'self_loops': False, 'use_snp_selection': True, 'num_snps': 19777}. Best is trial 43 with value: 0.30228818287114556.
[I 2025-12-08 12:35:10,076] Trial 51 finished with value: 0.2970745664087756 and parameters: {'model_type': 'gcn', 'hidden_dims': '[512, 128]', 'dropout': 0.3802797402708257, 'batch_norm': True, 'lr': 0.00015290683193349252, 'weight_decay': 8.732167585203654e-06, 'epochs': 241, 'loss': 'mae', 'optimizer': 'adam', 'graph_mode': 'cutoff', 'cutoff': 0.7519467289582586, 'grm_norm': 'cosine_then_gcn', 'self_loops': False, 'use_snp_selection': True, 'num_snps': 20482}. Best is trial 43 with value: 0.30228818287114556.
[I 2025-12-08 12:35:47,749] Trial 52 finished with value: 0.2982069427457307 and parameters: {'model_type': 'gcn', 'hidden_dims': '[512, 128]', 'dropout': 0.3521014637383869, 'batch_norm': True, 'lr': 0.00017469340666924856, 'weight_decay': 2.9161360044437822e-06, 'epochs': 263, 'loss': 'mae', 'optimizer': 'adam', 'graph_mode': 'cutoff', 'cutoff': 0.7842569063649263, 'grm_norm': 'cosine_then_gcn', 'self_loops': False, 'use_snp_selection': True, 'num_snps': 24874}. Best is trial 43 with value: 0.30228818287114556.
[I 2025-12-08 12:36:03,381] Trial 53 finished with value: 0.28448415270511296 and parameters: {'model_type': 'gcn', 'hidden_dims': '[512, 128]', 'dropout': 0.4209277613445106, 'batch_norm': True, 'lr': 6.46831871880579e-05, 'weight_decay': 5.65358078434596e-05, 'epochs': 202, 'loss': 'mae', 'optimizer': 'adam', 'graph_mode': 'cutoff', 'cutoff': 0.8503892808009139, 'grm_norm': 'cosine', 'self_loops': False, 'use_snp_selection': True, 'num_snps': 6799}. Best is trial 43 with value: 0.30228818287114556.
[I 2025-12-08 12:36:24,853] Trial 54 finished with value: 0.2994265435645017 and parameters: {'model_type': 'gcn', 'hidden_dims': '[512, 128]', 'dropout': 0.3245045987594661, 'batch_norm': True, 'lr': 0.00010966404843586189, 'weight_decay': 6.510377024969121e-06, 'epochs': 219, 'loss': 'mae', 'optimizer': 'adam', 'graph_mode': 'cutoff', 'cutoff': 0.7818590033005935, 'grm_norm': 'none', 'self_loops': False, 'use_snp_selection': True, 'num_snps': 12718}. Best is trial 43 with value: 0.30228818287114556.
[I 2025-12-08 12:36:43,682] Trial 55 finished with value: 0.2886319394116292 and parameters: {'model_type': 'gcn', 'hidden_dims': '[512, 256]', 'dropout': 0.2926625767295488, 'batch_norm': False, 'lr': 0.0002379774931225725, 'weight_decay': 5.449804416136315e-06, 'epochs': 177, 'loss': 'mae', 'optimizer': 'adam', 'graph_mode': 'cutoff', 'cutoff': 0.7286141934465414, 'grm_norm': 'none', 'self_loops': False, 'use_snp_selection': True, 'num_snps': 12097}. Best is trial 43 with value: 0.30228818287114556.
[I 2025-12-08 12:37:09,823] Trial 56 finished with value: 0.2951166222628322 and parameters: {'model_type': 'gcn', 'hidden_dims': '[512, 128]', 'dropout': 0.3174260795491193, 'batch_norm': True, 'lr': 0.0003482128407075061, 'weight_decay': 1.336978911053695e-07, 'epochs': 223, 'loss': 'mae', 'optimizer': 'adam', 'graph_mode': 'cutoff', 'cutoff': 0.8372458533450392, 'grm_norm': 'none', 'self_loops': False, 'use_snp_selection': True, 'num_snps': 17272}. Best is trial 43 with value: 0.30228818287114556.
[I 2025-12-08 12:37:29,443] Trial 57 finished with value: 0.2293486599678233 and parameters: {'model_type': 'gcn', 'hidden_dims': '[256, 128]', 'dropout': 0.3861248082919754, 'batch_norm': True, 'lr': 0.00010479548112611771, 'weight_decay': 1.3152808840641776e-05, 'epochs': 195, 'loss': 'mae', 'optimizer': 'adam', 'graph_mode': 'cutoff', 'cutoff': 0.3289538069299782, 'grm_norm': 'none', 'self_loops': False, 'use_snp_selection': True, 'num_snps': 18465}. Best is trial 43 with value: 0.30228818287114556.
[I 2025-12-08 12:37:40,496] Trial 58 finished with value: 0.26471698151981893 and parameters: {'model_type': 'gcn', 'hidden_dims': '[128, 64]', 'dropout': 0.44540560098370285, 'batch_norm': True, 'lr': 5.226147301495863e-05, 'weight_decay': 9.302359843796864e-07, 'epochs': 210, 'loss': 'mae', 'optimizer': 'adam', 'graph_mode': 'cutoff', 'cutoff': 0.8748119052210649, 'grm_norm': 'none', 'self_loops': True, 'use_snp_selection': True, 'num_snps': 3656}. Best is trial 43 with value: 0.30228818287114556.
[I 2025-12-08 12:38:11,235] Trial 59 finished with value: 0.2764957477280993 and parameters: {'model_type': 'gcn', 'hidden_dims': '[512, 128]', 'dropout': 0.33050120004863315, 'batch_norm': True, 'lr': 3.316177500851435e-05, 'weight_decay': 2.042602733082908e-06, 'epochs': 165, 'loss': 'mae', 'optimizer': 'adam', 'graph_mode': 'cutoff', 'cutoff': 0.625433039170849, 'grm_norm': 'none', 'self_loops': False, 'use_snp_selection': True, 'num_snps': 28684}. Best is trial 43 with value: 0.30228818287114556.
[I 2025-12-08 12:38:27,460] Trial 60 finished with value: 0.23904513420910498 and parameters: {'model_type': 'gcn', 'hidden_dims': '[512, 256]', 'dropout': 0.2685121117518031, 'batch_norm': False, 'lr': 1.5917006800388445e-05, 'weight_decay': 6.677227706037439e-06, 'epochs': 56, 'loss': 'mse', 'optimizer': 'adam', 'graph_mode': 'cutoff', 'cutoff': 0.7682293979160489, 'grm_norm': 'gcn', 'self_loops': False, 'use_snp_selection': False}. Best is trial 43 with value: 0.30228818287114556.
[I 2025-12-08 12:38:50,639] Trial 61 finished with value: 0.30275342884030554 and parameters: {'model_type': 'gcn', 'hidden_dims': '[512, 128]', 'dropout': 0.35906652824654495, 'batch_norm': True, 'lr': 0.00014469813503363566, 'weight_decay': 3.441499415782501e-06, 'epochs': 240, 'loss': 'mae', 'optimizer': 'adam', 'graph_mode': 'cutoff', 'cutoff': 0.7199373236253265, 'grm_norm': 'cosine_then_gcn', 'self_loops': False, 'use_snp_selection': True, 'num_snps': 13349}. Best is trial 61 with value: 0.30275342884030554.
[I 2025-12-08 12:39:14,834] Trial 62 finished with value: 0.2948219733760324 and parameters: {'model_type': 'gcn', 'hidden_dims': '[512, 128]', 'dropout': 0.36278989750676166, 'batch_norm': True, 'lr': 0.0001580474932386941, 'weight_decay': 3.3853077875883817e-06, 'epochs': 262, 'loss': 'mae', 'optimizer': 'adam', 'graph_mode': 'cutoff', 'cutoff': 0.7146221448560499, 'grm_norm': 'cosine_then_gcn', 'self_loops': False, 'use_snp_selection': True, 'num_snps': 13082}. Best is trial 61 with value: 0.30275342884030554.
[I 2025-12-08 12:39:26,208] Trial 63 finished with value: 0.2780080227883276 and parameters: {'model_type': 'gcn', 'hidden_dims': '[512, 128]', 'dropout': 0.4111640415997591, 'batch_norm': True, 'lr': 7.774429407931599e-05, 'weight_decay': 1.0303690711305587e-05, 'epochs': 92, 'loss': 'mae', 'optimizer': 'adam', 'graph_mode': 'cutoff', 'cutoff': 0.7376808738897639, 'grm_norm': 'cosine_then_gcn', 'self_loops': False, 'use_snp_selection': True, 'num_snps': 5496}. Best is trial 61 with value: 0.30275342884030554.
[I 2025-12-08 12:39:46,625] Trial 64 finished with value: 0.2936730188747109 and parameters: {'model_type': 'gcn', 'hidden_dims': '[512, 128]', 'dropout': 0.3008326809879657, 'batch_norm': True, 'lr': 0.00021265566145044714, 'weight_decay': 2.0456211086398156e-05, 'epochs': 233, 'loss': 'mae', 'optimizer': 'adam', 'graph_mode': 'cutoff', 'cutoff': 0.6798167499745509, 'grm_norm': 'none', 'self_loops': False, 'use_snp_selection': True, 'num_snps': 10440}. Best is trial 61 with value: 0.30275342884030554.
[I 2025-12-08 12:40:04,156] Trial 65 finished with value: 0.2862550530076803 and parameters: {'model_type': 'gcn', 'hidden_dims': '[512, 128]', 'dropout': 0.22956472783439602, 'batch_norm': True, 'lr': 0.0005103356209361159, 'weight_decay': 3.64458322387857e-05, 'epochs': 194, 'loss': 'mae', 'optimizer': 'adam', 'graph_mode': 'cutoff', 'cutoff': 0.8209633194009781, 'grm_norm': 'cosine_then_gcn', 'self_loops': False, 'use_snp_selection': True, 'num_snps': 9305}. Best is trial 61 with value: 0.30275342884030554.
[I 2025-12-08 12:40:35,597] Trial 66 finished with value: 0.2516616416538867 and parameters: {'model_type': 'gcn', 'hidden_dims': '[512, 128]', 'dropout': 0.34363537704418506, 'batch_norm': True, 'lr': 0.00029114043071036983, 'weight_decay': 1.7566405521796775e-06, 'epochs': 274, 'loss': 'mae', 'optimizer': 'adam', 'graph_mode': 'knn', 'knn_k': 8, 'weighted_edges': True, 'symmetrize_mode': 'union', 'self_loops': False, 'use_snp_selection': True, 'num_snps': 16428}. Best is trial 61 with value: 0.30275342884030554.
[I 2025-12-08 12:40:55,584] Trial 67 finished with value: 0.3066518037274824 and parameters: {'model_type': 'gcn', 'hidden_dims': '[512, 64]', 'dropout': 0.2848635878893811, 'batch_norm': True, 'lr': 0.0001483012139987193, 'weight_decay': 0.00011391380001823191, 'epochs': 104, 'loss': 'mae', 'optimizer': 'adam', 'graph_mode': 'cutoff', 'cutoff': 0.7845502471080095, 'grm_norm': 'none', 'self_loops': False, 'use_snp_selection': True, 'num_snps': 20750}. Best is trial 67 with value: 0.3066518037274824.
[I 2025-12-08 12:41:16,955] Trial 68 finished with value: 0.29010772221452336 and parameters: {'model_type': 'gcn', 'hidden_dims': '[512, 64]', 'dropout': 0.280982388501454, 'batch_norm': True, 'lr': 0.00010533795480575212, 'weight_decay': 0.00026114999651594964, 'epochs': 103, 'loss': 'mae', 'optimizer': 'adam', 'graph_mode': 'cutoff', 'cutoff': 0.779944506652188, 'grm_norm': 'none', 'self_loops': False, 'use_snp_selection': True, 'num_snps': 23962}. Best is trial 67 with value: 0.3066518037274824.
[I 2025-12-08 12:41:40,154] Trial 69 finished with value: 0.2981408269395323 and parameters: {'model_type': 'gcn', 'hidden_dims': '[512, 64]', 'dropout': 0.3284836589523772, 'batch_norm': True, 'lr': 0.00014671613077521108, 'weight_decay': 0.00010049001783103086, 'epochs': 76, 'loss': 'mae', 'optimizer': 'adam', 'graph_mode': 'cutoff', 'cutoff': 0.7951403546135593, 'grm_norm': 'none', 'self_loops': False, 'use_snp_selection': True, 'num_snps': 33354}. Best is trial 67 with value: 0.3066518037274824.
[I 2025-12-08 12:42:10,445] Trial 70 finished with value: 0.29019138355399876 and parameters: {'model_type': 'gcn', 'hidden_dims': '[512, 64]', 'dropout': 0.2924073893246506, 'batch_norm': True, 'lr': 0.00038507429610768336, 'weight_decay': 6.579987500507897e-05, 'epochs': 240, 'loss': 'mae', 'optimizer': 'adam', 'graph_mode': 'cutoff', 'cutoff': 0.8572110260005867, 'grm_norm': 'none', 'self_loops': True, 'use_snp_selection': True, 'num_snps': 20076}. Best is trial 67 with value: 0.3066518037274824.
[I 2025-12-08 12:42:35,458] Trial 71 finished with value: 0.2991681309056256 and parameters: {'model_type': 'gcn', 'hidden_dims': '[512, 64]', 'dropout': 0.37737864217352485, 'batch_norm': True, 'lr': 0.00025728575893017993, 'weight_decay': 6.229978915262494e-06, 'epochs': 158, 'loss': 'mae', 'optimizer': 'adam', 'graph_mode': 'cutoff', 'cutoff': 0.7532331475074254, 'grm_norm': 'none', 'self_loops': False, 'use_snp_selection': True, 'num_snps': 21870}. Best is trial 67 with value: 0.3066518037274824.
[I 2025-12-08 12:42:52,309] Trial 72 finished with value: 0.29688781974757383 and parameters: {'model_type': 'gcn', 'hidden_dims': '[512, 64]', 'dropout': 0.3743979291193686, 'batch_norm': True, 'lr': 0.0002651452442605776, 'weight_decay': 1.1586642427152983e-06, 'epochs': 125, 'loss': 'mae', 'optimizer': 'adam', 'graph_mode': 'cutoff', 'cutoff': 0.7569612044346423, 'grm_norm': 'none', 'self_loops': False, 'use_snp_selection': True, 'num_snps': 13793}. Best is trial 67 with value: 0.3066518037274824.
[I 2025-12-08 12:43:15,677] Trial 73 finished with value: 0.2876959505740775 and parameters: {'model_type': 'gcn', 'hidden_dims': '[512, 64]', 'dropout': 0.31290958306718114, 'batch_norm': True, 'lr': 0.0007321733855585747, 'weight_decay': 0.00015315821336586052, 'epochs': 139, 'loss': 'mae', 'optimizer': 'adam', 'graph_mode': 'cutoff', 'cutoff': 0.7090204937943824, 'grm_norm': 'none', 'self_loops': False, 'use_snp_selection': True, 'num_snps': 21740}. Best is trial 67 with value: 0.3066518037274824.
[I 2025-12-08 12:43:32,555] Trial 74 finished with value: 0.27915395819742084 and parameters: {'model_type': 'gcn', 'hidden_dims': '[512, 64]', 'dropout': 0.35166392601831503, 'batch_norm': True, 'lr': 8.299362540370796e-05, 'weight_decay': 4.261460124480755e-06, 'epochs': 86, 'loss': 'mae', 'optimizer': 'adam', 'graph_mode': 'cutoff', 'cutoff': 0.7890492275401689, 'grm_norm': 'none', 'self_loops': False, 'use_snp_selection': True, 'num_snps': 17482}. Best is trial 67 with value: 0.3066518037274824.
[I 2025-12-08 12:44:04,089] Trial 75 finished with value: 0.29289589141155153 and parameters: {'model_type': 'gcn', 'hidden_dims': '[512, 64]', 'dropout': 0.24535453843590987, 'batch_norm': True, 'lr': 0.00011784273333799573, 'weight_decay': 9.130645962811062e-05, 'epochs': 220, 'loss': 'mae', 'optimizer': 'adam', 'graph_mode': 'cutoff', 'cutoff': 0.743123084546219, 'grm_norm': 'none', 'self_loops': False, 'use_snp_selection': True, 'num_snps': 22935}. Best is trial 67 with value: 0.3066518037274824.
[I 2025-12-08 12:44:17,335] Trial 76 finished with value: 0.28503106525622635 and parameters: {'model_type': 'gcn', 'hidden_dims': '[256, 128, 64]', 'dropout': 0.1858063503748276, 'batch_norm': True, 'lr': 0.00033868339125131894, 'weight_decay': 1.615070412786234e-05, 'epochs': 107, 'loss': 'mae', 'optimizer': 'adam', 'graph_mode': 'cutoff', 'cutoff': 0.822590870839238, 'grm_norm': 'none', 'self_loops': False, 'use_snp_selection': True, 'num_snps': 11551}. Best is trial 67 with value: 0.3066518037274824.
[I 2025-12-08 12:44:58,460] Trial 77 finished with value: 0.20680053499659215 and parameters: {'model_type': 'gcn', 'hidden_dims': '[512, 256]', 'dropout': 0.3328712850457777, 'batch_norm': True, 'lr': 0.00019145112320685423, 'weight_decay': 4.144201961209709e-05, 'epochs': 157, 'loss': 'mae', 'optimizer': 'adam', 'graph_mode': 'knn', 'knn_k': 3, 'weighted_edges': False, 'symmetrize_mode': 'mutual', 'self_loops': False, 'use_snp_selection': False}. Best is trial 67 with value: 0.3066518037274824.
[I 2025-12-08 12:45:27,137] Trial 78 finished with value: 0.2952575367479717 and parameters: {'model_type': 'gcn', 'hidden_dims': '[256, 128]', 'dropout': 0.27148816155160493, 'batch_norm': False, 'lr': 5.494624049981364e-05, 'weight_decay': 6.035256435936117e-06, 'epochs': 183, 'loss': 'mae', 'optimizer': 'adam', 'graph_mode': 'cutoff', 'cutoff': 0.6902868432466416, 'grm_norm': 'gcn', 'self_loops': False, 'use_snp_selection': True, 'num_snps': 39069}. Best is trial 67 with value: 0.3066518037274824.
[I 2025-12-08 12:46:06,038] Trial 79 finished with value: 0.20038073672681417 and parameters: {'model_type': 'gcn', 'hidden_dims': '[512, 64]', 'dropout': 0.3864389396373577, 'batch_norm': True, 'lr': 0.0001410357619754672, 'weight_decay': 3.1789523408904716e-06, 'epochs': 252, 'loss': 'mse', 'optimizer': 'adam', 'graph_mode': 'cutoff', 'cutoff': 0.4844475562863825, 'grm_norm': 'none', 'self_loops': False, 'use_snp_selection': True, 'num_snps': 27000}. Best is trial 67 with value: 0.3066518037274824.
[I 2025-12-08 12:46:18,844] Trial 80 finished with value: 0.29622039238440967 and parameters: {'model_type': 'gcn', 'hidden_dims': '[128, 64]', 'dropout': 0.42825563498254854, 'batch_norm': True, 'lr': 0.0004983438255747681, 'weight_decay': 2.5199551991313e-05, 'epochs': 57, 'loss': 'mae', 'optimizer': 'adam', 'graph_mode': 'cutoff', 'cutoff': 0.7673652501296471, 'grm_norm': 'cosine', 'self_loops': False, 'use_snp_selection': True, 'num_snps': 20741}. Best is trial 67 with value: 0.3066518037274824.
[I 2025-12-08 12:46:42,598] Trial 81 finished with value: 0.29844032209155785 and parameters: {'model_type': 'gcn', 'hidden_dims': '[512, 128]', 'dropout': 0.3697768934632189, 'batch_norm': True, 'lr': 0.0002112079763837764, 'weight_decay': 1.0845793204048033e-05, 'epochs': 210, 'loss': 'mae', 'optimizer': 'adam', 'graph_mode': 'cutoff', 'cutoff': 0.721823509089328, 'grm_norm': 'cosine_then_gcn', 'self_loops': False, 'use_snp_selection': True, 'num_snps': 15368}. Best is trial 67 with value: 0.3066518037274824.
[I 2025-12-08 12:47:06,564] Trial 82 finished with value: 0.29311016518933786 and parameters: {'model_type': 'gcn', 'hidden_dims': '[512, 128]', 'dropout': 0.4140699284982994, 'batch_norm': True, 'lr': 0.00018117409753302418, 'weight_decay': 6.706757035402323e-06, 'epochs': 173, 'loss': 'mae', 'optimizer': 'adam', 'graph_mode': 'cutoff', 'cutoff': 0.8066438959233108, 'grm_norm': 'cosine_then_gcn', 'self_loops': False, 'use_snp_selection': True, 'num_snps': 18635}. Best is trial 67 with value: 0.3066518037274824.
[I 2025-12-08 12:47:36,854] Trial 83 finished with value: 0.293774331150877 and parameters: {'model_type': 'gcn', 'hidden_dims': '[512, 128]', 'dropout': 0.39264267694409105, 'batch_norm': True, 'lr': 0.0002601304389981799, 'weight_decay': 4.2781643552090235e-06, 'epochs': 188, 'loss': 'mae', 'optimizer': 'adam', 'graph_mode': 'cutoff', 'cutoff': 0.6719861789448558, 'grm_norm': 'cosine_then_gcn', 'self_loops': False, 'use_snp_selection': True, 'num_snps': 24663}. Best is trial 67 with value: 0.3066518037274824.
[I 2025-12-08 12:47:56,969] Trial 84 finished with value: 0.28964319082822654 and parameters: {'model_type': 'gcn', 'hidden_dims': '[512, 128]', 'dropout': 0.3611052420333865, 'batch_norm': True, 'lr': 0.00011542905074028267, 'weight_decay': 8.455376505903064e-06, 'epochs': 144, 'loss': 'mae', 'optimizer': 'adam', 'graph_mode': 'cutoff', 'cutoff': 0.7436460642208332, 'grm_norm': 'cosine_then_gcn', 'self_loops': False, 'use_snp_selection': True, 'num_snps': 15692}. Best is trial 67 with value: 0.3066518037274824.
[I 2025-12-08 12:48:13,549] Trial 85 finished with value: 0.28755019196495973 and parameters: {'model_type': 'gcn', 'hidden_dims': '[512, 256]', 'dropout': 0.34739048830307423, 'batch_norm': True, 'lr': 0.00038199250926201943, 'weight_decay': 0.00012873636325552165, 'epochs': 164, 'loss': 'mae', 'optimizer': 'adam', 'graph_mode': 'cutoff', 'cutoff': 0.6435062535695423, 'grm_norm': 'cosine_then_gcn', 'self_loops': True, 'use_snp_selection': True, 'num_snps': 9627}. Best is trial 67 with value: 0.3066518037274824.
[I 2025-12-08 12:49:06,402] Trial 86 finished with value: 0.29911652215419066 and parameters: {'model_type': 'gcn', 'hidden_dims': '[512, 128]', 'dropout': 0.32060669199678543, 'batch_norm': True, 'lr': 0.00031445097212237086, 'weight_decay': 2.638976263988664e-06, 'epochs': 200, 'loss': 'mae', 'optimizer': 'adam', 'graph_mode': 'cutoff', 'cutoff': 0.7743109103812975, 'grm_norm': 'gcn', 'self_loops': False, 'use_snp_selection': True, 'num_snps': 50061}. Best is trial 67 with value: 0.3066518037274824.
[I 2025-12-08 12:50:04,887] Trial 87 finished with value: 0.2976323358419764 and parameters: {'model_type': 'gcn', 'hidden_dims': '[512, 128]', 'dropout': 0.3220949967447879, 'batch_norm': True, 'lr': 0.0006079339686735117, 'weight_decay': 2.4471961012930228e-06, 'epochs': 200, 'loss': 'mae', 'optimizer': 'adam', 'graph_mode': 'cutoff', 'cutoff': 0.7798334677259083, 'grm_norm': 'gcn', 'self_loops': False, 'use_snp_selection': True, 'num_snps': 56303}. Best is trial 67 with value: 0.3066518037274824.
