[I 2025-12-08 10:33:18,794] Trial 42 finished with value: 0.3303251179918775 and parameters: {'model_type': 'gcn', 'hidden_dims': '[512, 64]', 'dropout': 0.18897101360304921, 'batch_norm': False, 'lr': 8.829421973634466e-05, 'weight_decay': 6.5264178974619225e-06, 'epochs': 75, 'loss': 'mse', 'optimizer': 'adam', 'graph_mode': 'cutoff', 'cutoff': 0.7041770780175624, 'grm_norm': 'cosine_then_gcn', 'self_loops': True, 'use_snp_selection': True, 'num_snps': 33160}. Best is trial 27 with value: 0.3517598284332952.
[I 2025-12-08 10:33:30,373] Trial 43 finished with value: 0.2741511623877368 and parameters: {'model_type': 'gcn', 'hidden_dims': '[128, 64]', 'dropout': 0.2974805864244609, 'batch_norm': False, 'lr': 0.0008452870939728526, 'weight_decay': 3.025850739055878e-05, 'epochs': 53, 'loss': 'mse', 'optimizer': 'adam', 'graph_mode': 'cutoff', 'cutoff': 0.7899424871012473, 'grm_norm': 'cosine_then_gcn', 'self_loops': True, 'use_snp_selection': True, 'num_snps': 15360}. Best is trial 27 with value: 0.3517598284332952.
[I 2025-12-08 10:33:48,282] Trial 44 finished with value: 0.3343643868370972 and parameters: {'model_type': 'gcn', 'hidden_dims': '[256, 128, 64]', 'dropout': 0.1301118686423113, 'batch_norm': False, 'lr': 0.00017925694646318265, 'weight_decay': 1.708774930049306e-05, 'epochs': 97, 'loss': 'mse', 'optimizer': 'adam', 'graph_mode': 'cutoff', 'cutoff': 0.8494416984488784, 'grm_norm': 'cosine_then_gcn', 'self_loops': True, 'use_snp_selection': True, 'num_snps': 25688}. Best is trial 27 with value: 0.3517598284332952.
[I 2025-12-08 10:34:05,553] Trial 45 finished with value: 0.28432787873245663 and parameters: {'model_type': 'gcn', 'hidden_dims': '[256, 128]', 'dropout': 0.16261352623883252, 'batch_norm': True, 'lr': 3.280815099390847e-05, 'weight_decay': 7.958015797138175e-05, 'epochs': 73, 'loss': 'mae', 'optimizer': 'adam', 'graph_mode': 'cutoff', 'cutoff': 0.6265871461429314, 'grm_norm': 'gcn', 'self_loops': False, 'use_snp_selection': True, 'num_snps': 29795}. Best is trial 27 with value: 0.3517598284332952.
[I 2025-12-08 10:34:17,694] Trial 46 finished with value: 0.2781704444907501 and parameters: {'model_type': 'gcn', 'hidden_dims': '[512, 64]', 'dropout': 0.10044695750242554, 'batch_norm': False, 'lr': 0.0004297024273683473, 'weight_decay': 2.6962823925494398e-06, 'epochs': 42, 'loss': 'mse', 'optimizer': 'adam', 'graph_mode': 'cutoff', 'cutoff': 0.44572177861400314, 'grm_norm': 'cosine', 'self_loops': False, 'use_snp_selection': True, 'num_snps': 12131}. Best is trial 27 with value: 0.3517598284332952.
[I 2025-12-08 10:34:53,079] Trial 47 finished with value: 0.330815107965456 and parameters: {'model_type': 'gcn', 'hidden_dims': '[512, 128]', 'dropout': 0.21629121591110617, 'batch_norm': False, 'lr': 6.83519407536307e-05, 'weight_decay': 5.558619161206501e-06, 'epochs': 280, 'loss': 'mae', 'optimizer': 'adam', 'graph_mode': 'cutoff', 'cutoff': 0.6492963862687662, 'grm_norm': 'cosine_then_gcn', 'self_loops': False, 'use_snp_selection': True, 'num_snps': 21177}. Best is trial 27 with value: 0.3517598284332952.
[I 2025-12-08 10:35:06,873] Trial 48 finished with value: 0.3463702523794588 and parameters: {'model_type': 'gcn', 'hidden_dims': '[256, 128, 64]', 'dropout': 0.25743869741196523, 'batch_norm': False, 'lr': 0.00026595444306203736, 'weight_decay': 1.5126399829273627e-06, 'epochs': 95, 'loss': 'mae', 'optimizer': 'adam', 'graph_mode': 'cutoff', 'cutoff': 0.5898321429759031, 'grm_norm': 'cosine', 'self_loops': False, 'use_snp_selection': False}. Best is trial 27 with value: 0.3517598284332952.
[I 2025-12-08 10:35:26,969] Trial 49 finished with value: 0.28008576153858106 and parameters: {'model_type': 'gcn', 'hidden_dims': '[256, 128, 64]', 'dropout': 0.2440803905113658, 'batch_norm': True, 'lr': 0.0002787636103114294, 'weight_decay': 2.110515740152481e-07, 'epochs': 144, 'loss': 'mae', 'optimizer': 'adam', 'graph_mode': 'knn', 'knn_k': 1, 'weighted_edges': True, 'symmetrize_mode': 'mutual', 'self_loops': True, 'use_snp_selection': False}. Best is trial 27 with value: 0.3517598284332952.
[I 2025-12-08 10:35:44,713] Trial 50 finished with value: -0.025129490627576755 and parameters: {'model_type': 'gcn', 'hidden_dims': '[256, 128, 64]', 'dropout': 0.5273579241745686, 'batch_norm': False, 'lr': 0.0019714191268547752, 'weight_decay': 1.8132864942375434e-06, 'epochs': 128, 'loss': 'mse', 'optimizer': 'adam', 'graph_mode': 'cutoff', 'cutoff': 0.5280271296831892, 'grm_norm': 'cosine', 'self_loops': False, 'use_snp_selection': False}. Best is trial 27 with value: 0.3517598284332952.
[I 2025-12-08 10:35:57,656] Trial 51 finished with value: 0.34535626259278845 and parameters: {'model_type': 'gcn', 'hidden_dims': '[256, 128, 64]', 'dropout': 0.20025913617288582, 'batch_norm': False, 'lr': 0.00012450442874552934, 'weight_decay': 1.3363656693282046e-06, 'epochs': 88, 'loss': 'mae', 'optimizer': 'adam', 'graph_mode': 'cutoff', 'cutoff': 0.601934282685196, 'grm_norm': 'cosine', 'self_loops': False, 'use_snp_selection': False}. Best is trial 27 with value: 0.3517598284332952.
[I 2025-12-08 10:36:27,322] Trial 52 finished with value: 0.3117968293033244 and parameters: {'model_type': 'gcn', 'hidden_dims': '[512, 256]', 'dropout': 0.2788819739286449, 'batch_norm': False, 'lr': 0.0004695659632965033, 'weight_decay': 3.195935197784602e-06, 'epochs': 110, 'loss': 'mae', 'optimizer': 'adam', 'graph_mode': 'cutoff', 'cutoff': 0.7200445400314222, 'grm_norm': 'cosine', 'self_loops': False, 'use_snp_selection': False}. Best is trial 27 with value: 0.3517598284332952.
[I 2025-12-08 10:36:32,841] Trial 53 finished with value: 0.17645351926566052 and parameters: {'model_type': 'gcn', 'hidden_dims': '[128, 64]', 'dropout': 0.15874190508537261, 'batch_norm': False, 'lr': 0.0011923173040994763, 'weight_decay': 4.3789374609383076e-07, 'epochs': 54, 'loss': 'mae', 'optimizer': 'adam', 'graph_mode': 'cutoff', 'cutoff': 0.5835952158946708, 'grm_norm': 'none', 'self_loops': False, 'use_snp_selection': False}. Best is trial 27 with value: 0.3517598284332952.
[I 2025-12-08 10:36:43,698] Trial 54 finished with value: 0.31001493886650316 and parameters: {'model_type': 'gcn', 'hidden_dims': '[256, 128, 64]', 'dropout': 0.252025945642767, 'batch_norm': False, 'lr': 0.00028145878822884233, 'weight_decay': 8.389248085150186e-06, 'epochs': 95, 'loss': 'mae', 'optimizer': 'adam', 'graph_mode': 'cutoff', 'cutoff': 0.3384636755268901, 'grm_norm': 'cosine', 'self_loops': False, 'use_snp_selection': True, 'num_snps': 4791}. Best is trial 27 with value: 0.3517598284332952.
[I 2025-12-08 10:37:07,316] Trial 55 finished with value: 0.315157983394793 and parameters: {'model_type': 'gcn', 'hidden_dims': '[512, 256]', 'dropout': 0.33817912540635253, 'batch_norm': False, 'lr': 2.8127036489455053e-05, 'weight_decay': 1.0993313057306917e-06, 'epochs': 73, 'loss': 'mae', 'optimizer': 'adam', 'graph_mode': 'cutoff', 'cutoff': 0.7748804698801838, 'grm_norm': 'cosine', 'self_loops': False, 'use_snp_selection': True, 'num_snps': 34577}. Best is trial 27 with value: 0.3517598284332952.
[I 2025-12-08 10:37:24,498] Trial 56 finished with value: 0.3293028072030529 and parameters: {'model_type': 'gcn', 'hidden_dims': '[256, 128]', 'dropout': 0.1283570229963649, 'batch_norm': False, 'lr': 0.00016464427636352368, 'weight_decay': 1.756964480806388e-05, 'epochs': 83, 'loss': 'mae', 'optimizer': 'adam', 'graph_mode': 'knn', 'knn_k': 4, 'weighted_edges': True, 'symmetrize_mode': 'mutual', 'self_loops': False, 'use_snp_selection': True, 'num_snps': 26371}. Best is trial 27 with value: 0.3517598284332952.
[I 2025-12-08 10:37:37,055] Trial 57 finished with value: 0.1250246308972133 and parameters: {'model_type': 'gcn', 'hidden_dims': '[512, 256]', 'dropout': 0.30327445179253193, 'batch_norm': False, 'lr': 0.0007597850774746344, 'weight_decay': 1.10505302239562e-05, 'epochs': 40, 'loss': 'mae', 'optimizer': 'adam', 'graph_mode': 'cutoff', 'cutoff': 0.640897291709799, 'grm_norm': 'none', 'self_loops': False, 'use_snp_selection': False}. Best is trial 27 with value: 0.3517598284332952.
[I 2025-12-08 10:37:47,901] Trial 58 finished with value: 0.2964839793180955 and parameters: {'model_type': 'gcn', 'hidden_dims': '[512, 128]', 'dropout': 0.14954568792159298, 'batch_norm': True, 'lr': 0.00011031895708441385, 'weight_decay': 0.00012106820666572011, 'epochs': 59, 'loss': 'mae', 'optimizer': 'adam', 'graph_mode': 'cutoff', 'cutoff': 0.5419534751149533, 'grm_norm': 'cosine_then_gcn', 'self_loops': False, 'use_snp_selection': True, 'num_snps': 6271}. Best is trial 27 with value: 0.3517598284332952.
[I 2025-12-08 10:38:05,514] Trial 59 finished with value: 0.3509177085059313 and parameters: {'model_type': 'gcn', 'hidden_dims': '[512, 256]', 'dropout': 0.17656196201543045, 'batch_norm': False, 'lr': 0.00019929732370686071, 'weight_decay': 4.60944764701692e-06, 'epochs': 104, 'loss': 'mae', 'optimizer': 'adam', 'graph_mode': 'cutoff', 'cutoff': 0.6045258541285697, 'grm_norm': 'cosine_then_gcn', 'self_loops': False, 'use_snp_selection': True, 'num_snps': 15899}. Best is trial 27 with value: 0.3517598284332952.
[I 2025-12-08 10:38:22,593] Trial 60 finished with value: 0.339109224797235 and parameters: {'model_type': 'gcn', 'hidden_dims': '[512, 256]', 'dropout': 0.17644558387583567, 'batch_norm': False, 'lr': 0.0005161772146789108, 'weight_decay': 2.6069739902326166e-05, 'epochs': 104, 'loss': 'mae', 'optimizer': 'adam', 'graph_mode': 'knn', 'knn_k': 8, 'weighted_edges': True, 'symmetrize_mode': 'mutual', 'self_loops': False, 'use_snp_selection': True, 'num_snps': 14377}. Best is trial 27 with value: 0.3517598284332952.
[I 2025-12-08 10:38:35,534] Trial 61 finished with value: 0.3532420955957651 and parameters: {'model_type': 'gcn', 'hidden_dims': '[512, 256]', 'dropout': 0.12413538719775398, 'batch_norm': False, 'lr': 0.00019818005119608728, 'weight_decay': 3.970223486090744e-06, 'epochs': 68, 'loss': 'mae', 'optimizer': 'adam', 'graph_mode': 'cutoff', 'cutoff': 0.6058468053120252, 'grm_norm': 'cosine_then_gcn', 'self_loops': False, 'use_snp_selection': True, 'num_snps': 10890}. Best is trial 61 with value: 0.3532420955957651.
[I 2025-12-08 10:38:48,104] Trial 62 finished with value: 0.3025847840596236 and parameters: {'model_type': 'gcn', 'hidden_dims': '[512, 256]', 'dropout': 0.11939600748961925, 'batch_norm': False, 'lr': 1.3705597504545764e-05, 'weight_decay': 4.190268362579652e-06, 'epochs': 70, 'loss': 'mae', 'optimizer': 'adam', 'graph_mode': 'cutoff', 'cutoff': 0.6109173234222655, 'grm_norm': 'cosine_then_gcn', 'self_loops': False, 'use_snp_selection': True, 'num_snps': 9937}. Best is trial 61 with value: 0.3532420955957651.
[I 2025-12-08 10:39:02,023] Trial 63 finished with value: 0.34179235966497845 and parameters: {'model_type': 'gcn', 'hidden_dims': '[512, 256]', 'dropout': 0.17005829664909866, 'batch_norm': False, 'lr': 0.0003495578467979338, 'weight_decay': 3.979754255534715e-05, 'epochs': 89, 'loss': 'mae', 'optimizer': 'adam', 'graph_mode': 'cutoff', 'cutoff': 0.5531452915252081, 'grm_norm': 'cosine_then_gcn', 'self_loops': False, 'use_snp_selection': True, 'num_snps': 10713}. Best is trial 61 with value: 0.3532420955957651.
[I 2025-12-08 10:39:22,288] Trial 64 finished with value: 0.33284511462330707 and parameters: {'model_type': 'gcn', 'hidden_dims': '[512, 256]', 'dropout': 0.12192421336279166, 'batch_norm': False, 'lr': 0.0002137831051841718, 'weight_decay': 7.1129824449541155e-06, 'epochs': 141, 'loss': 'mae', 'optimizer': 'adam', 'graph_mode': 'cutoff', 'cutoff': 0.7425538801303128, 'grm_norm': 'cosine_then_gcn', 'self_loops': False, 'use_snp_selection': True, 'num_snps': 16221}. Best is trial 61 with value: 0.3532420955957651.
[I 2025-12-08 10:39:32,496] Trial 65 finished with value: 0.31558478788783667 and parameters: {'model_type': 'gcn', 'hidden_dims': '[512, 256]', 'dropout': 0.19392650080521948, 'batch_norm': False, 'lr': 0.001128946960811603, 'weight_decay': 1.8953786785127379e-06, 'epochs': 109, 'loss': 'mae', 'optimizer': 'adam', 'graph_mode': 'cutoff', 'cutoff': 0.46501109439188226, 'grm_norm': 'cosine_then_gcn', 'self_loops': False, 'use_snp_selection': True, 'num_snps': 2034}. Best is trial 61 with value: 0.3532420955957651.
[I 2025-12-08 10:39:44,351] Trial 66 finished with value: 0.3452810247821605 and parameters: {'model_type': 'gcn', 'hidden_dims': '[512, 256]', 'dropout': 0.14409653321150628, 'batch_norm': False, 'lr': 0.0007361497170024512, 'weight_decay': 1.2656101341547891e-05, 'epochs': 91, 'loss': 'mae', 'optimizer': 'adam', 'graph_mode': 'cutoff', 'cutoff': 0.5955605891632751, 'grm_norm': 'cosine_then_gcn', 'self_loops': False, 'use_snp_selection': True, 'num_snps': 6893}. Best is trial 61 with value: 0.3532420955957651.
[I 2025-12-08 10:40:05,218] Trial 67 finished with value: 0.34597859651701596 and parameters: {'model_type': 'gcn', 'hidden_dims': '[512, 256]', 'dropout': 0.1064297710470831, 'batch_norm': False, 'lr': 0.00028652040070641923, 'weight_decay': 0.0003037545552224554, 'epochs': 120, 'loss': 'mae', 'optimizer': 'adam', 'graph_mode': 'cutoff', 'cutoff': 0.5099573090880849, 'grm_norm': 'gcn', 'self_loops': True, 'use_snp_selection': True, 'num_snps': 20085}. Best is trial 61 with value: 0.3532420955957651.
[I 2025-12-08 10:40:24,273] Trial 68 finished with value: 0.3342513054188111 and parameters: {'model_type': 'gcn', 'hidden_dims': '[512, 256]', 'dropout': 0.15293710941612532, 'batch_norm': False, 'lr': 0.00042593665410604247, 'weight_decay': 4.933232274150552e-06, 'epochs': 155, 'loss': 'mae', 'optimizer': 'adam', 'graph_mode': 'cutoff', 'cutoff': 0.7011159565685293, 'grm_norm': 'cosine_then_gcn', 'self_loops': False, 'use_snp_selection': True, 'num_snps': 13857}. Best is trial 61 with value: 0.3532420955957651.
[I 2025-12-08 10:40:32,464] Trial 69 finished with value: 0.24282213666329677 and parameters: {'model_type': 'gcn', 'hidden_dims': '[256, 128, 64]', 'dropout': 0.36751074616520213, 'batch_norm': False, 'lr': 0.0002226439729814042, 'weight_decay': 2.6510924139397236e-06, 'epochs': 51, 'loss': 'mae', 'optimizer': 'adam', 'graph_mode': 'cutoff', 'cutoff': 0.6269707670150553, 'grm_norm': 'none', 'self_loops': False, 'use_snp_selection': False}. Best is trial 61 with value: 0.3532420955957651.
[I 2025-12-08 10:40:56,953] Trial 70 finished with value: 0.2364537328257088 and parameters: {'model_type': 'gcn', 'hidden_dims': '[512, 256]', 'dropout': 0.21942710612466837, 'batch_norm': True, 'lr': 0.0003578558192343218, 'weight_decay': 1.907214770696725e-05, 'epochs': 178, 'loss': 'mse', 'optimizer': 'adam', 'graph_mode': 'knn', 'knn_k': 5, 'weighted_edges': True, 'symmetrize_mode': 'mutual', 'self_loops': False, 'use_snp_selection': True, 'num_snps': 17526}. Best is trial 61 with value: 0.3532420955957651.
[I 2025-12-08 10:41:17,892] Trial 71 finished with value: 0.3361977937028885 and parameters: {'model_type': 'gcn', 'hidden_dims': '[512, 256]', 'dropout': 0.11816468310061909, 'batch_norm': False, 'lr': 0.0002852740259453665, 'weight_decay': 0.0003802052585498561, 'epochs': 123, 'loss': 'mae', 'optimizer': 'adam', 'graph_mode': 'cutoff', 'cutoff': 0.48440789580396926, 'grm_norm': 'gcn', 'self_loops': True, 'use_snp_selection': True, 'num_snps': 19384}. Best is trial 61 with value: 0.3532420955957651.
[I 2025-12-08 10:41:34,369] Trial 72 finished with value: 0.3430463057918995 and parameters: {'model_type': 'gcn', 'hidden_dims': '[512, 256]', 'dropout': 0.10468043341493558, 'batch_norm': False, 'lr': 0.0009896089747871096, 'weight_decay': 0.0006869237042176277, 'epochs': 66, 'loss': 'mae', 'optimizer': 'adam', 'graph_mode': 'cutoff', 'cutoff': 0.5111249573897618, 'grm_norm': 'gcn', 'self_loops': True, 'use_snp_selection': True, 'num_snps': 20008}. Best is trial 61 with value: 0.3532420955957651.
[I 2025-12-08 10:41:53,813] Trial 73 finished with value: 0.34577764025536606 and parameters: {'model_type': 'gcn', 'hidden_dims': '[512, 256]', 'dropout': 0.13271713566769944, 'batch_norm': False, 'lr': 0.0006570976829367008, 'weight_decay': 3.653866655731373e-06, 'epochs': 81, 'loss': 'mae', 'optimizer': 'adam', 'graph_mode': 'cutoff', 'cutoff': 0.5620513199137812, 'grm_norm': 'gcn', 'self_loops': True, 'use_snp_selection': True, 'num_snps': 24179}. Best is trial 61 with value: 0.3532420955957651.
[I 2025-12-08 10:42:12,867] Trial 74 finished with value: 0.3259396175363646 and parameters: {'model_type': 'gcn', 'hidden_dims': '[512, 256]', 'dropout': 0.17813735996118435, 'batch_norm': False, 'lr': 0.0001846258207483374, 'weight_decay': 7.038016756023694e-07, 'epochs': 205, 'loss': 'mae', 'optimizer': 'adam', 'graph_mode': 'cutoff', 'cutoff': 0.7876178006616781, 'grm_norm': 'gcn', 'self_loops': True, 'use_snp_selection': True, 'num_snps': 10759}. Best is trial 61 with value: 0.3532420955957651.
[I 2025-12-08 10:42:31,433] Trial 75 finished with value: 0.3067680557475355 and parameters: {'model_type': 'gcn', 'hidden_dims': '[512, 64]', 'dropout': 0.42562617524100305, 'batch_norm': False, 'lr': 0.0003105314505179013, 'weight_decay': 7.899967964886886e-06, 'epochs': 114, 'loss': 'mae', 'optimizer': 'adam', 'graph_mode': 'cutoff', 'cutoff': 0.4663965679281702, 'grm_norm': 'cosine_then_gcn', 'self_loops': True, 'use_snp_selection': True, 'num_snps': 16602}. Best is trial 61 with value: 0.3532420955957651.
[I 2025-12-08 10:42:48,877] Trial 76 finished with value: 0.3489864564879719 and parameters: {'model_type': 'gcn', 'hidden_dims': '[512, 256]', 'dropout': 0.11457430135003002, 'batch_norm': False, 'lr': 0.0014886206291382627, 'weight_decay': 0.0002530312956808543, 'epochs': 131, 'loss': 'mae', 'optimizer': 'adam', 'graph_mode': 'cutoff', 'cutoff': 0.5293853643712175, 'grm_norm': 'cosine_then_gcn', 'self_loops': True, 'use_snp_selection': True, 'num_snps': 13739}. Best is trial 61 with value: 0.3532420955957651.
[I 2025-12-08 10:43:01,288] Trial 77 finished with value: 0.3390548103591109 and parameters: {'model_type': 'gcn', 'hidden_dims': '[256, 128, 64]', 'dropout': 0.14695743927387594, 'batch_norm': False, 'lr': 0.0013511813252799249, 'weight_decay': 1.3860100313874838e-05, 'epochs': 102, 'loss': 'mae', 'optimizer': 'adam', 'graph_mode': 'cutoff', 'cutoff': 0.6611311365413575, 'grm_norm': 'cosine_then_gcn', 'self_loops': False, 'use_snp_selection': True, 'num_snps': 9730}. Best is trial 61 with value: 0.3532420955957651.
[I 2025-12-08 10:43:13,839] Trial 78 finished with value: 0.34445189744813914 and parameters: {'model_type': 'gcn', 'hidden_dims': '[512, 256]', 'dropout': 0.13126729423951936, 'batch_norm': False, 'lr': 0.0031498673896903848, 'weight_decay': 0.00022002635224561165, 'epochs': 134, 'loss': 'mse', 'optimizer': 'adam', 'graph_mode': 'cutoff', 'cutoff': 0.5428513955038803, 'grm_norm': 'cosine_then_gcn', 'self_loops': True, 'use_snp_selection': True, 'num_snps': 5398}. Best is trial 61 with value: 0.3532420955957651.
[I 2025-12-08 10:43:33,536] Trial 79 finished with value: 0.34087949313419486 and parameters: {'model_type': 'gcn', 'hidden_dims': '[128, 64]', 'dropout': 0.19450858639997382, 'batch_norm': False, 'lr': 0.0005447741843634864, 'weight_decay': 0.00011141635810845332, 'epochs': 66, 'loss': 'mae', 'optimizer': 'adam', 'graph_mode': 'cutoff', 'cutoff': 0.5873261247245802, 'grm_norm': 'cosine_then_gcn', 'self_loops': False, 'use_snp_selection': True, 'num_snps': 51227}. Best is trial 61 with value: 0.3532420955957651.
[I 2025-12-08 10:43:48,324] Trial 80 finished with value: -0.020929093933451964 and parameters: {'model_type': 'gcn', 'hidden_dims': '[512, 128]', 'dropout': 0.16893747766450268, 'batch_norm': False, 'lr': 0.002315997647808686, 'weight_decay': 5.428300980536063e-05, 'epochs': 49, 'loss': 'mae', 'optimizer': 'adam', 'graph_mode': 'cutoff', 'cutoff': 0.8457266131127907, 'grm_norm': 'cosine_then_gcn', 'self_loops': False, 'use_snp_selection': False}. Best is trial 61 with value: 0.3532420955957651.
[I 2025-12-08 10:44:04,991] Trial 81 finished with value: 0.3472132109804612 and parameters: {'model_type': 'gcn', 'hidden_dims': '[512, 256]', 'dropout': 0.10263584458154361, 'batch_norm': False, 'lr': 0.001564237945745013, 'weight_decay': 0.00028573269238985543, 'epochs': 121, 'loss': 'mae', 'optimizer': 'adam', 'graph_mode': 'cutoff', 'cutoff': 0.5134309049223499, 'grm_norm': 'cosine_then_gcn', 'self_loops': True, 'use_snp_selection': True, 'num_snps': 12965}. Best is trial 61 with value: 0.3532420955957651.
[I 2025-12-08 10:44:19,455] Trial 82 finished with value: 0.34533054777314953 and parameters: {'model_type': 'gcn', 'hidden_dims': '[512, 256]', 'dropout': 0.11540451130044516, 'batch_norm': False, 'lr': 0.0009286717503271258, 'weight_decay': 0.000509110398094245, 'epochs': 81, 'loss': 'mae', 'optimizer': 'adam', 'graph_mode': 'cutoff', 'cutoff': 0.41235064660865, 'grm_norm': 'cosine_then_gcn', 'self_loops': True, 'use_snp_selection': True, 'num_snps': 12756}. Best is trial 61 with value: 0.3532420955957651.
[I 2025-12-08 10:44:31,670] Trial 83 finished with value: 0.3365823474060332 and parameters: {'model_type': 'gcn', 'hidden_dims': '[512, 256]', 'dropout': 0.13664380781174973, 'batch_norm': False, 'lr': 0.0015459591471943194, 'weight_decay': 0.00021573179599476884, 'epochs': 92, 'loss': 'mae', 'optimizer': 'adam', 'graph_mode': 'cutoff', 'cutoff': 0.7560839417556634, 'grm_norm': 'cosine_then_gcn', 'self_loops': True, 'use_snp_selection': True, 'num_snps': 7289}. Best is trial 61 with value: 0.3532420955957651.
[I 2025-12-08 10:44:46,190] Trial 84 finished with value: 0.3325465049799726 and parameters: {'model_type': 'gcn', 'hidden_dims': '[512, 256]', 'dropout': 0.1007259185664568, 'batch_norm': False, 'lr': 9.954888219049289e-05, 'weight_decay': 1.001261214699265e-05, 'epochs': 75, 'loss': 'mae', 'optimizer': 'adam', 'graph_mode': 'cutoff', 'cutoff': 0.7198924334922114, 'grm_norm': 'cosine_then_gcn', 'self_loops': True, 'use_snp_selection': True, 'num_snps': 13907}. Best is trial 61 with value: 0.3532420955957651.
