[I 2025-12-08 11:51:32,375] Trial 109 finished with value: 0.2941037115583367 and parameters: {'model_type': 'gcn', 'hidden_dims': '[256, 128, 64]', 'dropout': 0.5738878637295076, 'batch_norm': True, 'lr': 0.0007031385400667905, 'weight_decay': 5.5045877813339194e-05, 'epochs': 75, 'loss': 'mse', 'optimizer': 'adam', 'graph_mode': 'cutoff', 'cutoff': 0.6068481915462984, 'grm_norm': 'gcn', 'self_loops': False, 'use_snp_selection': False}. Best is trial 27 with value: 0.3149905766649259.
[I 2025-12-08 11:52:02,426] Trial 110 finished with value: 0.021045630331630264 and parameters: {'model_type': 'gcn', 'hidden_dims': '[256, 128, 64]', 'dropout': 0.40353196143596576, 'batch_norm': False, 'lr': 0.003032823677044342, 'weight_decay': 7.929467165130134e-06, 'epochs': 213, 'loss': 'mae', 'optimizer': 'adam', 'graph_mode': 'cutoff', 'cutoff': 0.8574000557273295, 'grm_norm': 'gcn', 'self_loops': False, 'use_snp_selection': True, 'num_snps': 35515}. Best is trial 27 with value: 0.3149905766649259.
[I 2025-12-08 11:52:26,665] Trial 111 finished with value: 0.3003457301520519 and parameters: {'model_type': 'gcn', 'hidden_dims': '[256, 128, 64]', 'dropout': 0.4624368002990077, 'batch_norm': True, 'lr': 0.0003114001098068981, 'weight_decay': 2.0606492687346743e-05, 'epochs': 94, 'loss': 'mae', 'optimizer': 'adam', 'graph_mode': 'cutoff', 'cutoff': 0.8797672755720369, 'grm_norm': 'gcn', 'self_loops': False, 'use_snp_selection': True, 'num_snps': 45329}. Best is trial 27 with value: 0.3149905766649259.
[I 2025-12-08 11:52:52,468] Trial 112 finished with value: 0.30089096212716987 and parameters: {'model_type': 'gcn', 'hidden_dims': '[256, 128, 64]', 'dropout': 0.5001038426641115, 'batch_norm': True, 'lr': 0.00028479933485950126, 'weight_decay': 1.6992852591122847e-05, 'epochs': 99, 'loss': 'mae', 'optimizer': 'adam', 'graph_mode': 'cutoff', 'cutoff': 0.8757597296617117, 'grm_norm': 'gcn', 'self_loops': False, 'use_snp_selection': True, 'num_snps': 48435}. Best is trial 27 with value: 0.3149905766649259.
[I 2025-12-08 11:53:18,471] Trial 113 finished with value: 0.31187134738885447 and parameters: {'model_type': 'gcn', 'hidden_dims': '[256, 128, 64]', 'dropout': 0.590632385431577, 'batch_norm': True, 'lr': 0.00038624555191489113, 'weight_decay': 1.0351783275192765e-05, 'epochs': 84, 'loss': 'mae', 'optimizer': 'adam', 'graph_mode': 'cutoff', 'cutoff': 0.8927126596707743, 'grm_norm': 'gcn', 'self_loops': False, 'use_snp_selection': True, 'num_snps': 54787}. Best is trial 27 with value: 0.3149905766649259.
[I 2025-12-08 11:53:45,008] Trial 114 finished with value: 0.3135789393947653 and parameters: {'model_type': 'gcn', 'hidden_dims': '[256, 128, 64]', 'dropout': 0.5900494307672828, 'batch_norm': True, 'lr': 0.0003492792521899376, 'weight_decay': 3.849517954041999e-06, 'epochs': 84, 'loss': 'mae', 'optimizer': 'adam', 'graph_mode': 'cutoff', 'cutoff': 0.8986053554174663, 'grm_norm': 'gcn', 'self_loops': False, 'use_snp_selection': True, 'num_snps': 55792}. Best is trial 27 with value: 0.3149905766649259.
[I 2025-12-08 11:54:11,168] Trial 115 finished with value: 0.30966964263319136 and parameters: {'model_type': 'gcn', 'hidden_dims': '[256, 128, 64]', 'dropout': 0.5857279654799376, 'batch_norm': True, 'lr': 0.0005244723947090813, 'weight_decay': 1.0817057535056343e-05, 'epochs': 85, 'loss': 'mae', 'optimizer': 'adam', 'graph_mode': 'cutoff', 'cutoff': 0.8982397254702164, 'grm_norm': 'gcn', 'self_loops': False, 'use_snp_selection': True, 'num_snps': 54983}. Best is trial 27 with value: 0.3149905766649259.
[I 2025-12-08 11:54:34,764] Trial 116 finished with value: 0.31153746712760844 and parameters: {'model_type': 'gcn', 'hidden_dims': '[256, 128, 64]', 'dropout': 0.5873943557076138, 'batch_norm': True, 'lr': 0.0004612098750558187, 'weight_decay': 9.976256023863142e-06, 'epochs': 63, 'loss': 'mae', 'optimizer': 'adam', 'graph_mode': 'cutoff', 'cutoff': 0.8935832930688314, 'grm_norm': 'gcn', 'self_loops': False, 'use_snp_selection': True, 'num_snps': 54583}. Best is trial 27 with value: 0.3149905766649259.
[I 2025-12-08 11:54:59,225] Trial 117 finished with value: 0.3035755888067614 and parameters: {'model_type': 'gcn', 'hidden_dims': '[256, 128, 64]', 'dropout': 0.5953231454253068, 'batch_norm': True, 'lr': 0.00038689087657675837, 'weight_decay': 7.963056453967248e-07, 'epochs': 64, 'loss': 'mae', 'optimizer': 'adam', 'graph_mode': 'cutoff', 'cutoff': 0.8876149566518655, 'grm_norm': 'gcn', 'self_loops': False, 'use_snp_selection': True, 'num_snps': 56968}. Best is trial 27 with value: 0.3149905766649259.
[I 2025-12-08 11:55:24,253] Trial 118 finished with value: 0.3052826790878215 and parameters: {'model_type': 'gcn', 'hidden_dims': '[256, 128, 64]', 'dropout': 0.56502663014538, 'batch_norm': True, 'lr': 0.0006054889923381841, 'weight_decay': 3.6207027996481166e-06, 'epochs': 76, 'loss': 'mae', 'optimizer': 'adam', 'graph_mode': 'cutoff', 'cutoff': 0.8487172913334119, 'grm_norm': 'gcn', 'self_loops': False, 'use_snp_selection': True, 'num_snps': 54542}. Best is trial 27 with value: 0.3149905766649259.
[I 2025-12-08 11:55:49,440] Trial 119 finished with value: 0.30281327565431176 and parameters: {'model_type': 'gcn', 'hidden_dims': '[256, 128, 64]', 'dropout': 0.5540125598940379, 'batch_norm': True, 'lr': 0.001166141612633714, 'weight_decay': 2.4225440968287328e-06, 'epochs': 67, 'loss': 'mae', 'optimizer': 'adam', 'graph_mode': 'cutoff', 'cutoff': 0.8646462897902194, 'grm_norm': 'gcn', 'self_loops': True, 'use_snp_selection': True, 'num_snps': 58653}. Best is trial 27 with value: 0.3149905766649259.
[I 2025-12-08 11:56:17,835] Trial 120 finished with value: 0.30345524084925823 and parameters: {'model_type': 'gcn', 'hidden_dims': '[512, 64]', 'dropout': 0.5924094512514962, 'batch_norm': True, 'lr': 0.0004458967148110437, 'weight_decay': 4.376313900220464e-06, 'epochs': 59, 'loss': 'mae', 'optimizer': 'adam', 'graph_mode': 'cutoff', 'cutoff': 0.8350354880035606, 'grm_norm': 'none', 'self_loops': False, 'use_snp_selection': True, 'num_snps': 53142}. Best is trial 27 with value: 0.3149905766649259.
[I 2025-12-08 11:56:44,002] Trial 121 finished with value: 0.3066589208693859 and parameters: {'model_type': 'gcn', 'hidden_dims': '[256, 128, 64]', 'dropout': 0.5848442805636922, 'batch_norm': True, 'lr': 0.0004967760596090498, 'weight_decay': 9.730481397611542e-06, 'epochs': 85, 'loss': 'mae', 'optimizer': 'adam', 'graph_mode': 'cutoff', 'cutoff': 0.8936441303364828, 'grm_norm': 'gcn', 'self_loops': False, 'use_snp_selection': True, 'num_snps': 54881}. Best is trial 27 with value: 0.3149905766649259.
[I 2025-12-08 11:57:11,257] Trial 122 finished with value: 0.31458831291784434 and parameters: {'model_type': 'gcn', 'hidden_dims': '[256, 128, 64]', 'dropout': 0.5986839613572424, 'batch_norm': True, 'lr': 0.0003569460389361919, 'weight_decay': 6.213165616844602e-06, 'epochs': 80, 'loss': 'mae', 'optimizer': 'adam', 'graph_mode': 'cutoff', 'cutoff': 0.8994322878307677, 'grm_norm': 'gcn', 'self_loops': False, 'use_snp_selection': True, 'num_snps': 59970}. Best is trial 27 with value: 0.3149905766649259.
[I 2025-12-08 11:57:38,287] Trial 123 finished with value: 0.30890961804147626 and parameters: {'model_type': 'gcn', 'hidden_dims': '[256, 128, 64]', 'dropout': 0.5784247922839436, 'batch_norm': True, 'lr': 0.0003251480007234001, 'weight_decay': 5.873459713644145e-06, 'epochs': 80, 'loss': 'mae', 'optimizer': 'adam', 'graph_mode': 'cutoff', 'cutoff': 0.8862930117158528, 'grm_norm': 'gcn', 'self_loops': False, 'use_snp_selection': True, 'num_snps': 59175}. Best is trial 27 with value: 0.3149905766649259.
[I 2025-12-08 11:58:05,637] Trial 124 finished with value: 0.3057535262428484 and parameters: {'model_type': 'gcn', 'hidden_dims': '[256, 128, 64]', 'dropout': 0.5587855332367792, 'batch_norm': True, 'lr': 0.0003678241018441318, 'weight_decay': 2.651576494452418e-06, 'epochs': 88, 'loss': 'mae', 'optimizer': 'adam', 'graph_mode': 'cutoff', 'cutoff': 0.8500773944637747, 'grm_norm': 'gcn', 'self_loops': False, 'use_snp_selection': True, 'num_snps': 57151}. Best is trial 27 with value: 0.3149905766649259.
[I 2025-12-08 11:58:27,388] Trial 125 finished with value: 0.2858794377009384 and parameters: {'model_type': 'gcn', 'hidden_dims': '[256, 128, 64]', 'dropout': 0.5990298112206767, 'batch_norm': True, 'lr': 0.0002531965054128199, 'weight_decay': 7.775850839030217e-06, 'epochs': 51, 'loss': 'mae', 'optimizer': 'adam', 'graph_mode': 'cutoff', 'cutoff': 0.5737942744425444, 'grm_norm': 'gcn', 'self_loops': False, 'use_snp_selection': True, 'num_snps': 51886}. Best is trial 27 with value: 0.3149905766649259.
[I 2025-12-08 11:59:00,975] Trial 126 finished with value: 0.30702047286203404 and parameters: {'model_type': 'gcn', 'hidden_dims': '[512, 256]', 'dropout': 0.5731107776476282, 'batch_norm': True, 'lr': 0.00042706745489060294, 'weight_decay': 4.756291481462144e-06, 'epochs': 75, 'loss': 'mae', 'optimizer': 'adam', 'graph_mode': 'cutoff', 'cutoff': 0.8680836642053427, 'grm_norm': 'gcn', 'self_loops': False, 'use_snp_selection': True, 'num_snps': 57898}. Best is trial 27 with value: 0.3149905766649259.
[I 2025-12-08 11:59:26,028] Trial 127 finished with value: 0.3077957983730492 and parameters: {'model_type': 'gcn', 'hidden_dims': '[256, 128, 64]', 'dropout': 0.539398263740755, 'batch_norm': True, 'lr': 0.00034648502652875765, 'weight_decay': 2.111134455430108e-06, 'epochs': 71, 'loss': 'mae', 'optimizer': 'adam', 'graph_mode': 'cutoff', 'cutoff': 0.8262280121110819, 'grm_norm': 'gcn', 'self_loops': False, 'use_snp_selection': True, 'num_snps': 55844}. Best is trial 27 with value: 0.3149905766649259.
[I 2025-12-08 11:59:52,978] Trial 128 finished with value: 0.3166792656108621 and parameters: {'model_type': 'gcn', 'hidden_dims': '[256, 128, 64]', 'dropout': 0.5999081943680996, 'batch_norm': True, 'lr': 0.00024968401810903886, 'weight_decay': 6.785829071288778e-06, 'epochs': 97, 'loss': 'mae', 'optimizer': 'adam', 'graph_mode': 'cutoff', 'cutoff': 0.8622942981406208, 'grm_norm': 'gcn', 'self_loops': False, 'use_snp_selection': True, 'num_snps': 52724}. Best is trial 128 with value: 0.3166792656108621.
[I 2025-12-08 12:00:30,633] Trial 129 finished with value: 0.24286064403886787 and parameters: {'model_type': 'gcn', 'hidden_dims': '[256, 128, 64]', 'dropout': 0.5889575358255014, 'batch_norm': True, 'lr': 0.00025081620293597863, 'weight_decay': 3.4214276982312924e-06, 'epochs': 345, 'loss': 'mae', 'optimizer': 'adam', 'graph_mode': 'knn', 'knn_k': 7, 'weighted_edges': False, 'symmetrize_mode': 'union', 'self_loops': False, 'use_snp_selection': True, 'num_snps': 29989}. Best is trial 128 with value: 0.3166792656108621.
[I 2025-12-08 12:00:51,749] Trial 130 finished with value: 0.30541235150266954 and parameters: {'model_type': 'gcn', 'hidden_dims': '[256, 128, 64]', 'dropout': 0.5760304207850792, 'batch_norm': True, 'lr': 0.00021543706389844027, 'weight_decay': 9.042458116179122e-06, 'epochs': 44, 'loss': 'mse', 'optimizer': 'adam', 'graph_mode': 'cutoff', 'cutoff': 0.8614273049812855, 'grm_norm': 'gcn', 'self_loops': False, 'use_snp_selection': True, 'num_snps': 52637}. Best is trial 128 with value: 0.3166792656108621.
[I 2025-12-08 12:01:17,740] Trial 131 finished with value: 0.31398573375253624 and parameters: {'model_type': 'gcn', 'hidden_dims': '[256, 128, 64]', 'dropout': 0.5509985230137128, 'batch_norm': True, 'lr': 0.0003507865696442031, 'weight_decay': 6.660329073391273e-06, 'epochs': 96, 'loss': 'mae', 'optimizer': 'adam', 'graph_mode': 'cutoff', 'cutoff': 0.8981873460038314, 'grm_norm': 'gcn', 'self_loops': False, 'use_snp_selection': True, 'num_snps': 50326}. Best is trial 128 with value: 0.3166792656108621.
[I 2025-12-08 12:01:46,119] Trial 132 finished with value: 0.30894510245365003 and parameters: {'model_type': 'gcn', 'hidden_dims': '[256, 128, 64]', 'dropout': 0.5538581024251709, 'batch_norm': True, 'lr': 0.00036873389659974773, 'weight_decay': 1.4223797185425484e-05, 'epochs': 90, 'loss': 'mae', 'optimizer': 'adam', 'graph_mode': 'cutoff', 'cutoff': 0.8958235515935716, 'grm_norm': 'gcn', 'self_loops': False, 'use_snp_selection': True, 'num_snps': 59768}. Best is trial 128 with value: 0.3166792656108621.
[I 2025-12-08 12:02:12,861] Trial 133 finished with value: 0.3134785009514074 and parameters: {'model_type': 'gcn', 'hidden_dims': '[256, 128, 64]', 'dropout': 0.5984699967389377, 'batch_norm': True, 'lr': 0.0004640968027554889, 'weight_decay': 6.315525520910286e-06, 'epochs': 103, 'loss': 'mae', 'optimizer': 'adam', 'graph_mode': 'cutoff', 'cutoff': 0.8817112466455844, 'grm_norm': 'gcn', 'self_loops': False, 'use_snp_selection': True, 'num_snps': 50523}. Best is trial 128 with value: 0.3166792656108621.
[I 2025-12-08 12:02:39,701] Trial 134 finished with value: 0.3107580164094 and parameters: {'model_type': 'gcn', 'hidden_dims': '[256, 128, 64]', 'dropout': 0.5993669801805528, 'batch_norm': True, 'lr': 0.0005900182886239145, 'weight_decay': 7.2454577887383985e-06, 'epochs': 105, 'loss': 'mae', 'optimizer': 'adam', 'graph_mode': 'cutoff', 'cutoff': 0.8814413620475282, 'grm_norm': 'gcn', 'self_loops': False, 'use_snp_selection': True, 'num_snps': 50128}. Best is trial 128 with value: 0.3166792656108621.
[I 2025-12-08 12:03:06,806] Trial 135 finished with value: 0.3099196674002219 and parameters: {'model_type': 'gcn', 'hidden_dims': '[256, 128, 64]', 'dropout': 0.5990857319070513, 'batch_norm': True, 'lr': 0.000563152580526519, 'weight_decay': 7.232129089697928e-06, 'epochs': 107, 'loss': 'mae', 'optimizer': 'adam', 'graph_mode': 'cutoff', 'cutoff': 0.8999903547682074, 'grm_norm': 'gcn', 'self_loops': False, 'use_snp_selection': True, 'num_snps': 50290}. Best is trial 128 with value: 0.3166792656108621.
[I 2025-12-08 12:03:33,444] Trial 136 finished with value: 0.31085486219359487 and parameters: {'model_type': 'gcn', 'hidden_dims': '[256, 128, 64]', 'dropout': 0.5804535818394079, 'batch_norm': True, 'lr': 0.0005037651976931274, 'weight_decay': 6.418769268190744e-06, 'epochs': 101, 'loss': 'mae', 'optimizer': 'adam', 'graph_mode': 'cutoff', 'cutoff': 0.8801733844507719, 'grm_norm': 'cosine', 'self_loops': False, 'use_snp_selection': True, 'num_snps': 50016}. Best is trial 128 with value: 0.3166792656108621.
[I 2025-12-08 12:04:01,108] Trial 137 finished with value: 0.3080351065727804 and parameters: {'model_type': 'gcn', 'hidden_dims': '[256, 128, 64]', 'dropout': 0.5804505800238626, 'batch_norm': True, 'lr': 0.00048427992833656724, 'weight_decay': 4.0033268294128024e-06, 'epochs': 99, 'loss': 'mae', 'optimizer': 'adam', 'graph_mode': 'cutoff', 'cutoff': 0.8714749676033735, 'grm_norm': 'cosine', 'self_loops': False, 'use_snp_selection': True, 'num_snps': 54190}. Best is trial 128 with value: 0.3166792656108621.
[I 2025-12-08 12:04:27,787] Trial 138 finished with value: 0.0 and parameters: {'model_type': 'gcn', 'hidden_dims': '[256, 128, 64]', 'dropout': 0.5652707104639323, 'batch_norm': False, 'lr': 0.0007495184726769599, 'weight_decay': 6.211652176289119e-06, 'epochs': 113, 'loss': 'mae', 'optimizer': 'adam', 'graph_mode': 'cutoff', 'cutoff': 0.8837147843995019, 'grm_norm': 'cosine', 'self_loops': False, 'use_snp_selection': True, 'num_snps': 47903}. Best is trial 128 with value: 0.3166792656108621.
[I 2025-12-08 12:04:58,998] Trial 139 finished with value: 0.3038226950498236 and parameters: {'model_type': 'gcn', 'hidden_dims': '[256, 128, 64]', 'dropout': 0.5871862709560338, 'batch_norm': True, 'lr': 0.0004107718184920096, 'weight_decay': 5.0797226301120285e-06, 'epochs': 122, 'loss': 'mae', 'optimizer': 'adam', 'graph_mode': 'cutoff', 'cutoff': 0.8622856903561649, 'grm_norm': 'cosine', 'self_loops': False, 'use_snp_selection': True, 'num_snps': 56016}. Best is trial 128 with value: 0.3166792656108621.
[I 2025-12-08 12:05:20,523] Trial 140 finished with value: 0.30799527310719743 and parameters: {'model_type': 'gcn', 'hidden_dims': '[128, 64]', 'dropout': 0.5452408317289408, 'batch_norm': True, 'lr': 0.0006561567180435768, 'weight_decay': 9.634989680556812e-06, 'epochs': 95, 'loss': 'mae', 'optimizer': 'adam', 'graph_mode': 'cutoff', 'cutoff': 0.883006614518928, 'grm_norm': 'cosine', 'self_loops': True, 'use_snp_selection': True, 'num_snps': 52022}. Best is trial 128 with value: 0.3166792656108621.
[I 2025-12-08 12:05:47,471] Trial 141 finished with value: 0.31120157174579244 and parameters: {'model_type': 'gcn', 'hidden_dims': '[256, 128, 64]', 'dropout': 0.5991435997409588, 'batch_norm': True, 'lr': 0.0005524575630966547, 'weight_decay': 6.657539473838434e-06, 'epochs': 104, 'loss': 'mae', 'optimizer': 'adam', 'graph_mode': 'cutoff', 'cutoff': 0.8987980171655016, 'grm_norm': 'gcn', 'self_loops': False, 'use_snp_selection': True, 'num_snps': 50727}. Best is trial 128 with value: 0.3166792656108621.
[I 2025-12-08 12:06:14,217] Trial 142 finished with value: 0.30847422892360155 and parameters: {'model_type': 'gcn', 'hidden_dims': '[256, 128, 64]', 'dropout': 0.571402021855967, 'batch_norm': True, 'lr': 0.0004649833624660668, 'weight_decay': 6.43437682096734e-06, 'epochs': 102, 'loss': 'mae', 'optimizer': 'adam', 'graph_mode': 'cutoff', 'cutoff': 0.8477846549390364, 'grm_norm': 'gcn', 'self_loops': False, 'use_snp_selection': True, 'num_snps': 50751}. Best is trial 128 with value: 0.3166792656108621.
[I 2025-12-08 12:06:40,591] Trial 143 finished with value: 0.29890251908103205 and parameters: {'model_type': 'gcn', 'hidden_dims': '[256, 128, 64]', 'dropout': 0.5892203899678929, 'batch_norm': True, 'lr': 0.0002582612618709021, 'weight_decay': 2.9591495812046062e-06, 'epochs': 112, 'loss': 'mae', 'optimizer': 'adam', 'graph_mode': 'cutoff', 'cutoff': 0.8986575380066399, 'grm_norm': 'gcn', 'self_loops': False, 'use_snp_selection': True, 'num_snps': 46798}. Best is trial 128 with value: 0.3166792656108621.
[I 2025-12-08 12:07:07,131] Trial 144 finished with value: 0.3038839293374743 and parameters: {'model_type': 'gcn', 'hidden_dims': '[256, 128, 64]', 'dropout': 0.5804971208762094, 'batch_norm': True, 'lr': 0.00033256033402853164, 'weight_decay': 5.313537908926979e-06, 'epochs': 91, 'loss': 'mae', 'optimizer': 'adam', 'graph_mode': 'cutoff', 'cutoff': 0.8694373708412474, 'grm_norm': 'gcn', 'self_loops': False, 'use_snp_selection': True, 'num_snps': 53572}. Best is trial 128 with value: 0.3166792656108621.
[I 2025-12-08 12:07:31,645] Trial 145 finished with value: 0.3116838932767532 and parameters: {'model_type': 'gcn', 'hidden_dims': '[256, 128, 64]', 'dropout': 0.599413516404027, 'batch_norm': True, 'lr': 0.0005357446963548446, 'weight_decay': 1.1448649014406472e-05, 'epochs': 83, 'loss': 'mae', 'optimizer': 'adam', 'graph_mode': 'cutoff', 'cutoff': 0.8827177313946274, 'grm_norm': 'gcn', 'self_loops': False, 'use_snp_selection': True, 'num_snps': 49503}. Best is trial 128 with value: 0.3166792656108621.
[I 2025-12-08 12:08:05,211] Trial 146 finished with value: 0.30598838409197365 and parameters: {'model_type': 'gcn', 'hidden_dims': '[512, 128]', 'dropout': 0.5667922807571909, 'batch_norm': True, 'lr': 0.0008995650740891086, 'weight_decay': 1.0784219370957127e-05, 'epochs': 87, 'loss': 'mae', 'optimizer': 'adam', 'graph_mode': 'cutoff', 'cutoff': 0.8988908985429183, 'grm_norm': 'gcn', 'self_loops': False, 'use_snp_selection': True, 'num_snps': 52368}. Best is trial 128 with value: 0.3166792656108621.
[I 2025-12-08 12:08:29,392] Trial 147 finished with value: 0.3109911906281503 and parameters: {'model_type': 'gcn', 'hidden_dims': '[256, 128, 64]', 'dropout': 0.5932360588640738, 'batch_norm': True, 'lr': 0.0004137713667467189, 'weight_decay': 0.0004041877138617252, 'epochs': 81, 'loss': 'mae', 'optimizer': 'adam', 'graph_mode': 'cutoff', 'cutoff': 0.8560888230316178, 'grm_norm': 'gcn', 'self_loops': False, 'use_snp_selection': True, 'num_snps': 49053}. Best is trial 128 with value: 0.3166792656108621.
[I 2025-12-08 12:08:57,506] Trial 148 finished with value: 0.30339858891096777 and parameters: {'model_type': 'gcn', 'hidden_dims': '[256, 128, 64]', 'dropout': 0.5998301888518613, 'batch_norm': True, 'lr': 0.00028106291943552283, 'weight_decay': 1.2548592045494036e-05, 'epochs': 96, 'loss': 'mae', 'optimizer': 'adam', 'graph_mode': 'cutoff', 'cutoff': 0.833279748429634, 'grm_norm': 'gcn', 'self_loops': False, 'use_snp_selection': True, 'num_snps': 56143}. Best is trial 128 with value: 0.3166792656108621.
[I 2025-12-08 12:09:20,669] Trial 149 finished with value: 0.3036327057752306 and parameters: {'model_type': 'gcn', 'hidden_dims': '[256, 128, 64]', 'dropout': 0.5601184950555772, 'batch_norm': True, 'lr': 0.0003523834437456918, 'weight_decay': 8.503411896996138e-06, 'epochs': 81, 'loss': 'mae', 'optimizer': 'adam', 'graph_mode': 'cutoff', 'cutoff': 0.8702804069314626, 'grm_norm': 'gcn', 'self_loops': False, 'use_snp_selection': True, 'num_snps': 45883}. Best is trial 128 with value: 0.3166792656108621.
[I 2025-12-08 12:09:50,972] Trial 0 finished with value: 0.2555495213347082 and parameters: {'model_type': 'gcn', 'hidden_dims': '[128, 64]', 'dropout': 0.199031432379812, 'batch_norm': True, 'lr': 1.8408544111075823e-05, 'weight_decay': 5.5136510071208614e-05, 'epochs': 336, 'loss': 'mae', 'optimizer': 'adam', 'graph_mode': 'knn', 'knn_k': 8, 'weighted_edges': True, 'symmetrize_mode': 'mutual', 'self_loops': True, 'use_snp_selection': True, 'num_snps': 27173}. Best is trial 0 with value: 0.2555495213347082.
[I 2025-12-08 12:10:29,340] Trial 1 finished with value: 0.2184046630268492 and parameters: {'model_type': 'gcn', 'hidden_dims': '[256, 128, 64]', 'dropout': 0.5543244404043342, 'batch_norm': True, 'lr': 7.981787657617978e-05, 'weight_decay': 2.8571789869344834e-07, 'epochs': 297, 'loss': 'mae', 'optimizer': 'adam', 'graph_mode': 'cutoff', 'cutoff': 0.3392632777751686, 'grm_norm': 'gcn', 'self_loops': False, 'use_snp_selection': False}. Best is trial 0 with value: 0.2555495213347082.
