[I 2025-12-08 13:32:54,545] Trial 86 finished with value: 0.3726455608872671 and parameters: {'model_type': 'gcn', 'hidden_dims': '[512, 128]', 'dropout': 0.185234727315808, 'batch_norm': False, 'lr': 6.241598314780963e-05, 'weight_decay': 1.7516514064155996e-07, 'epochs': 162, 'loss': 'mse', 'optimizer': 'adam', 'graph_mode': 'cutoff', 'cutoff': 0.6552106872749881, 'grm_norm': 'cosine_then_gcn', 'self_loops': True, 'use_snp_selection': False}. Best is trial 56 with value: 0.3735020582781594.
[I 2025-12-08 13:33:36,500] Trial 87 finished with value: 0.34910189957720517 and parameters: {'model_type': 'gcn', 'hidden_dims': '[512, 128]', 'dropout': 0.20383429194727523, 'batch_norm': False, 'lr': 9.70366381505524e-05, 'weight_decay': 1.6506985987057459e-07, 'epochs': 162, 'loss': 'mse', 'optimizer': 'adam', 'graph_mode': 'cutoff', 'cutoff': 0.6571575459244102, 'grm_norm': 'cosine_then_gcn', 'self_loops': True, 'use_snp_selection': False}. Best is trial 56 with value: 0.3735020582781594.
[I 2025-12-08 13:34:08,446] Trial 88 finished with value: 0.3631075575203156 and parameters: {'model_type': 'gcn', 'hidden_dims': '[512, 128]', 'dropout': 0.18585874567607202, 'batch_norm': False, 'lr': 6.407180779085088e-05, 'weight_decay': 1.3627896706928095e-07, 'epochs': 121, 'loss': 'mse', 'optimizer': 'adam', 'graph_mode': 'cutoff', 'cutoff': 0.6091962275838068, 'grm_norm': 'cosine_then_gcn', 'self_loops': True, 'use_snp_selection': False}. Best is trial 56 with value: 0.3735020582781594.
[I 2025-12-08 13:34:28,233] Trial 89 finished with value: 0.3671049470189516 and parameters: {'model_type': 'gcn', 'hidden_dims': '[256, 128, 64]', 'dropout': 0.25334973089232604, 'batch_norm': False, 'lr': 6.877043611331856e-05, 'weight_decay': 3.637296351999538e-07, 'epochs': 147, 'loss': 'mae', 'optimizer': 'adam', 'graph_mode': 'cutoff', 'cutoff': 0.7532439558322892, 'grm_norm': 'cosine_then_gcn', 'self_loops': True, 'use_snp_selection': False}. Best is trial 56 with value: 0.3735020582781594.
[I 2025-12-08 13:35:13,905] Trial 90 finished with value: 0.035833914013848 and parameters: {'model_type': 'gcn', 'hidden_dims': '[512, 128]', 'dropout': 0.2138674386712585, 'batch_norm': False, 'lr': 0.001784801145969303, 'weight_decay': 2.3121651093443316e-07, 'epochs': 128, 'loss': 'mse', 'optimizer': 'adam', 'graph_mode': 'cutoff', 'cutoff': 0.6834888484671047, 'grm_norm': 'cosine_then_gcn', 'self_loops': False, 'use_snp_selection': True, 'num_snps': 59551}. Best is trial 56 with value: 0.3735020582781594.
[I 2025-12-08 13:35:59,873] Trial 91 finished with value: 0.35542920944452094 and parameters: {'model_type': 'gcn', 'hidden_dims': '[512, 128]', 'dropout': 0.1542324041672452, 'batch_norm': False, 'lr': 2.362293640682634e-05, 'weight_decay': 2.8682655121902045e-07, 'epochs': 180, 'loss': 'mse', 'optimizer': 'adam', 'graph_mode': 'cutoff', 'cutoff': 0.6483612864995347, 'grm_norm': 'cosine', 'self_loops': True, 'use_snp_selection': False}. Best is trial 56 with value: 0.3735020582781594.
[I 2025-12-08 13:36:39,886] Trial 92 finished with value: 0.3591818274448354 and parameters: {'model_type': 'gcn', 'hidden_dims': '[512, 128]', 'dropout': 0.1709628336822819, 'batch_norm': False, 'lr': 2.975464006222117e-05, 'weight_decay': 4.6090451896679206e-07, 'epochs': 155, 'loss': 'mse', 'optimizer': 'adam', 'graph_mode': 'cutoff', 'cutoff': 0.7059103605055385, 'grm_norm': 'gcn', 'self_loops': True, 'use_snp_selection': False}. Best is trial 56 with value: 0.3735020582781594.
[I 2025-12-08 13:37:30,315] Trial 93 finished with value: 0.36619278017951606 and parameters: {'model_type': 'gcn', 'hidden_dims': '[512, 128]', 'dropout': 0.19730978259643298, 'batch_norm': False, 'lr': 5.710713184902449e-05, 'weight_decay': 9.507567321432027e-06, 'epochs': 199, 'loss': 'mse', 'optimizer': 'adam', 'graph_mode': 'cutoff', 'cutoff': 0.630066667770382, 'grm_norm': 'gcn', 'self_loops': True, 'use_snp_selection': False}. Best is trial 56 with value: 0.3735020582781594.
[I 2025-12-08 13:38:13,651] Trial 94 finished with value: 0.3625539302509787 and parameters: {'model_type': 'gcn', 'hidden_dims': '[512, 128]', 'dropout': 0.1391204458781223, 'batch_norm': False, 'lr': 4.093194811774384e-05, 'weight_decay': 1.8921191200225796e-07, 'epochs': 169, 'loss': 'mse', 'optimizer': 'adam', 'graph_mode': 'cutoff', 'cutoff': 0.5837546475701108, 'grm_norm': 'gcn', 'self_loops': True, 'use_snp_selection': False}. Best is trial 56 with value: 0.3735020582781594.
[I 2025-12-08 13:38:37,355] Trial 95 finished with value: 0.3587834722302971 and parameters: {'model_type': 'gcn', 'hidden_dims': '[256, 128]', 'dropout': 0.12420823920695653, 'batch_norm': False, 'lr': 8.847340049323614e-05, 'weight_decay': 1.257304550816474e-07, 'epochs': 188, 'loss': 'mse', 'optimizer': 'adam', 'graph_mode': 'cutoff', 'cutoff': 0.5475828847214163, 'grm_norm': 'gcn', 'self_loops': True, 'use_snp_selection': False}. Best is trial 56 with value: 0.3735020582781594.
[I 2025-12-08 13:39:19,610] Trial 96 finished with value: 0.2585421732605443 and parameters: {'model_type': 'gcn', 'hidden_dims': '[512, 128]', 'dropout': 0.16718569831091362, 'batch_norm': True, 'lr': 4.510866249772543e-05, 'weight_decay': 2.8609593737008683e-07, 'epochs': 163, 'loss': 'mse', 'optimizer': 'adam', 'graph_mode': 'cutoff', 'cutoff': 0.5157431316186883, 'grm_norm': 'cosine_then_gcn', 'self_loops': True, 'use_snp_selection': False}. Best is trial 56 with value: 0.3735020582781594.
[I 2025-12-08 13:40:12,455] Trial 97 finished with value: 0.3519270649609413 and parameters: {'model_type': 'gcn', 'hidden_dims': '[512, 128]', 'dropout': 0.28887277403241873, 'batch_norm': False, 'lr': 0.00014115594704998492, 'weight_decay': 1.7166147043860274e-07, 'epochs': 207, 'loss': 'mse', 'optimizer': 'adam', 'graph_mode': 'cutoff', 'cutoff': 0.3872552056896817, 'grm_norm': 'gcn', 'self_loops': True, 'use_snp_selection': False}. Best is trial 56 with value: 0.3735020582781594.
[I 2025-12-08 13:40:58,431] Trial 98 finished with value: 0.3422119735511315 and parameters: {'model_type': 'gcn', 'hidden_dims': '[512, 128]', 'dropout': 0.14935617660702358, 'batch_norm': False, 'lr': 2.889857586264359e-05, 'weight_decay': 5.267214803680075e-07, 'epochs': 176, 'loss': 'mse', 'optimizer': 'adam', 'graph_mode': 'knn', 'knn_k': 9, 'weighted_edges': True, 'symmetrize_mode': 'mutual', 'self_loops': True, 'use_snp_selection': False}. Best is trial 56 with value: 0.3735020582781594.
[I 2025-12-08 13:42:21,377] Trial 99 finished with value: 0.3524043520584163 and parameters: {'model_type': 'gcn', 'hidden_dims': '[512, 64]', 'dropout': 0.22505190580658999, 'batch_norm': False, 'lr': 1.9692156265592067e-05, 'weight_decay': 2.2457843863548487e-07, 'epochs': 334, 'loss': 'mse', 'optimizer': 'adam', 'graph_mode': 'cutoff', 'cutoff': 0.610240951075798, 'grm_norm': 'gcn', 'self_loops': True, 'use_snp_selection': False}. Best is trial 56 with value: 0.3735020582781594.
[I 2025-12-08 13:42:57,787] Trial 100 finished with value: 0.37101647393393533 and parameters: {'model_type': 'gcn', 'hidden_dims': '[512, 128]', 'dropout': 0.187985037732641, 'batch_norm': False, 'lr': 5.2169029675584664e-05, 'weight_decay': 6.934303637690731e-07, 'epochs': 140, 'loss': 'mse', 'optimizer': 'adam', 'graph_mode': 'cutoff', 'cutoff': 0.5724893595913964, 'grm_norm': 'gcn', 'self_loops': True, 'use_snp_selection': False}. Best is trial 56 with value: 0.3735020582781594.
[I 2025-12-08 13:43:34,131] Trial 101 finished with value: 0.3617139969930637 and parameters: {'model_type': 'gcn', 'hidden_dims': '[512, 128]', 'dropout': 0.1745073981161247, 'batch_norm': False, 'lr': 5.3814542396928434e-05, 'weight_decay': 3.5282176271602124e-07, 'epochs': 140, 'loss': 'mse', 'optimizer': 'adam', 'graph_mode': 'cutoff', 'cutoff': 0.572883172953929, 'grm_norm': 'gcn', 'self_loops': True, 'use_snp_selection': False}. Best is trial 56 with value: 0.3735020582781594.
[I 2025-12-08 13:44:12,836] Trial 102 finished with value: 0.36585722157457123 and parameters: {'model_type': 'gcn', 'hidden_dims': '[512, 128]', 'dropout': 0.1318843447693824, 'batch_norm': False, 'lr': 3.5817623635475325e-05, 'weight_decay': 0.0004033230509989316, 'epochs': 150, 'loss': 'mse', 'optimizer': 'adam', 'graph_mode': 'cutoff', 'cutoff': 0.6711883136861644, 'grm_norm': 'gcn', 'self_loops': True, 'use_snp_selection': False}. Best is trial 56 with value: 0.3735020582781594.
[I 2025-12-08 13:44:46,327] Trial 103 finished with value: 0.35779743106472944 and parameters: {'model_type': 'gcn', 'hidden_dims': '[512, 128]', 'dropout': 0.1843720522005525, 'batch_norm': False, 'lr': 7.751225429335325e-05, 'weight_decay': 6.960596136403361e-07, 'epochs': 128, 'loss': 'mse', 'optimizer': 'adam', 'graph_mode': 'cutoff', 'cutoff': 0.6344070421183583, 'grm_norm': 'gcn', 'self_loops': True, 'use_snp_selection': False}. Best is trial 56 with value: 0.3735020582781594.
[I 2025-12-08 13:45:26,231] Trial 104 finished with value: 0.3718039975696755 and parameters: {'model_type': 'gcn', 'hidden_dims': '[512, 128]', 'dropout': 0.20555534699079142, 'batch_norm': False, 'lr': 4.2371769910497265e-05, 'weight_decay': 4.1834241321129495e-07, 'epochs': 155, 'loss': 'mse', 'optimizer': 'adam', 'graph_mode': 'cutoff', 'cutoff': 0.6082393892020894, 'grm_norm': 'gcn', 'self_loops': True, 'use_snp_selection': False}. Best is trial 56 with value: 0.3735020582781594.
[I 2025-12-08 13:46:07,068] Trial 105 finished with value: 0.37008983646007887 and parameters: {'model_type': 'gcn', 'hidden_dims': '[512, 128]', 'dropout': 0.2321790141302841, 'batch_norm': False, 'lr': 6.696282001455397e-05, 'weight_decay': 1.2352835910734954e-07, 'epochs': 159, 'loss': 'mse', 'optimizer': 'adam', 'graph_mode': 'cutoff', 'cutoff': 0.6062360850359062, 'grm_norm': 'none', 'self_loops': True, 'use_snp_selection': False}. Best is trial 56 with value: 0.3735020582781594.
[I 2025-12-08 13:46:42,349] Trial 106 finished with value: 0.3559427370198306 and parameters: {'model_type': 'gcn', 'hidden_dims': '[512, 128]', 'dropout': 0.21264762028859413, 'batch_norm': False, 'lr': 7.008952819243936e-05, 'weight_decay': 4.062109460433276e-07, 'epochs': 137, 'loss': 'mae', 'optimizer': 'adam', 'graph_mode': 'cutoff', 'cutoff': 0.5406360618121995, 'grm_norm': 'none', 'self_loops': True, 'use_snp_selection': True, 'num_snps': 40149}. Best is trial 56 with value: 0.3735020582781594.
[I 2025-12-08 13:47:20,180] Trial 107 finished with value: 0.352634963235355 and parameters: {'model_type': 'gcn', 'hidden_dims': '[512, 128]', 'dropout': 0.23961834892463674, 'batch_norm': False, 'lr': 0.00012560854093074942, 'weight_decay': 1.2125201959514705e-07, 'epochs': 146, 'loss': 'mse', 'optimizer': 'adam', 'graph_mode': 'cutoff', 'cutoff': 0.5982831941538668, 'grm_norm': 'none', 'self_loops': False, 'use_snp_selection': False}. Best is trial 56 with value: 0.3735020582781594.
[I 2025-12-08 13:47:50,389] Trial 108 finished with value: 0.36444347258921395 and parameters: {'model_type': 'gcn', 'hidden_dims': '[512, 256]', 'dropout': 0.20398229339377744, 'batch_norm': False, 'lr': 9.508626832611083e-05, 'weight_decay': 2.9527933563603164e-07, 'epochs': 114, 'loss': 'mse', 'optimizer': 'adam', 'graph_mode': 'cutoff', 'cutoff': 0.6538270927133729, 'grm_norm': 'none', 'self_loops': True, 'use_snp_selection': False}. Best is trial 56 with value: 0.3735020582781594.
[I 2025-12-08 13:48:31,259] Trial 109 finished with value: -0.01965065320888786 and parameters: {'model_type': 'gcn', 'hidden_dims': '[512, 128]', 'dropout': 0.2290800983136012, 'batch_norm': False, 'lr': 0.004102827831784547, 'weight_decay': 1.9880683318249067e-07, 'epochs': 159, 'loss': 'mse', 'optimizer': 'adam', 'graph_mode': 'cutoff', 'cutoff': 0.6169910937292893, 'grm_norm': 'none', 'self_loops': True, 'use_snp_selection': False}. Best is trial 56 with value: 0.3735020582781594.
[I 2025-12-08 13:48:55,813] Trial 110 finished with value: 0.2869153052492593 and parameters: {'model_type': 'gcn', 'hidden_dims': '[256, 128, 64]', 'dropout': 0.19444339273124334, 'batch_norm': True, 'lr': 6.131409952140372e-05, 'weight_decay': 9.770367362209278e-07, 'epochs': 184, 'loss': 'mse', 'optimizer': 'adam', 'graph_mode': 'cutoff', 'cutoff': 0.5809635568804068, 'grm_norm': 'cosine', 'self_loops': True, 'use_snp_selection': False}. Best is trial 56 with value: 0.3735020582781594.
[I 2025-12-08 13:49:35,936] Trial 111 finished with value: 0.3730684479083118 and parameters: {'model_type': 'gcn', 'hidden_dims': '[512, 128]', 'dropout': 0.33028165508577795, 'batch_norm': False, 'lr': 4.030609766168928e-05, 'weight_decay': 1.6462973169406638e-07, 'epochs': 156, 'loss': 'mse', 'optimizer': 'adam', 'graph_mode': 'cutoff', 'cutoff': 0.6057734561939808, 'grm_norm': 'gcn', 'self_loops': True, 'use_snp_selection': False}. Best is trial 56 with value: 0.3735020582781594.
[I 2025-12-08 13:50:18,972] Trial 112 finished with value: 0.36743730820205006 and parameters: {'model_type': 'gcn', 'hidden_dims': '[512, 128]', 'dropout': 0.33934708149585263, 'batch_norm': False, 'lr': 4.981284790618109e-05, 'weight_decay': 1.6579528077257933e-07, 'epochs': 168, 'loss': 'mse', 'optimizer': 'adam', 'graph_mode': 'cutoff', 'cutoff': 0.6083076027202404, 'grm_norm': 'gcn', 'self_loops': True, 'use_snp_selection': False}. Best is trial 56 with value: 0.3735020582781594.
[I 2025-12-08 13:50:58,656] Trial 113 finished with value: 0.3726786995921363 and parameters: {'model_type': 'gcn', 'hidden_dims': '[512, 128]', 'dropout': 0.3258285238444455, 'batch_norm': False, 'lr': 3.0547925781538253e-05, 'weight_decay': 2.453034977865342e-07, 'epochs': 154, 'loss': 'mse', 'optimizer': 'adam', 'graph_mode': 'cutoff', 'cutoff': 0.6384187693967428, 'grm_norm': 'gcn', 'self_loops': True, 'use_snp_selection': False}. Best is trial 56 with value: 0.3735020582781594.
[I 2025-12-08 13:51:37,392] Trial 114 finished with value: 0.36841646445170384 and parameters: {'model_type': 'gcn', 'hidden_dims': '[512, 128]', 'dropout': 0.36772555091841175, 'batch_norm': False, 'lr': 3.11334629530178e-05, 'weight_decay': 2.496674243666082e-07, 'epochs': 150, 'loss': 'mse', 'optimizer': 'adam', 'graph_mode': 'cutoff', 'cutoff': 0.6413425743722831, 'grm_norm': 'gcn', 'self_loops': True, 'use_snp_selection': False}. Best is trial 56 with value: 0.3735020582781594.
[I 2025-12-08 13:52:11,494] Trial 115 finished with value: 0.3626014563391854 and parameters: {'model_type': 'gcn', 'hidden_dims': '[512, 128]', 'dropout': 0.27709967426741156, 'batch_norm': False, 'lr': 2.592821496425272e-05, 'weight_decay': 1.2746063708878222e-07, 'epochs': 131, 'loss': 'mse', 'optimizer': 'adam', 'graph_mode': 'cutoff', 'cutoff': 0.595976428139177, 'grm_norm': 'none', 'self_loops': True, 'use_snp_selection': False}. Best is trial 56 with value: 0.3735020582781594.
[I 2025-12-08 13:52:51,696] Trial 116 finished with value: 0.37020047313304927 and parameters: {'model_type': 'gcn', 'hidden_dims': '[512, 128]', 'dropout': 0.34197622210393785, 'batch_norm': False, 'lr': 3.982300337095203e-05, 'weight_decay': 2.0972476541093756e-07, 'epochs': 156, 'loss': 'mse', 'optimizer': 'adam', 'graph_mode': 'cutoff', 'cutoff': 0.69318351081359, 'grm_norm': 'gcn', 'self_loops': True, 'use_snp_selection': False}. Best is trial 56 with value: 0.3735020582781594.
[I 2025-12-08 13:53:11,962] Trial 117 finished with value: 0.3348611260846672 and parameters: {'model_type': 'gcn', 'hidden_dims': '[256, 128]', 'dropout': 0.33418646736429297, 'batch_norm': False, 'lr': 3.943656177886029e-05, 'weight_decay': 1.507044044792201e-07, 'epochs': 155, 'loss': 'mse', 'optimizer': 'adam', 'graph_mode': 'knn', 'knn_k': 2, 'weighted_edges': False, 'symmetrize_mode': 'union', 'self_loops': True, 'use_snp_selection': False}. Best is trial 56 with value: 0.3735020582781594.
[I 2025-12-08 13:53:49,187] Trial 118 finished with value: 0.35393834923253875 and parameters: {'model_type': 'gcn', 'hidden_dims': '[512, 128]', 'dropout': 0.35117949445142543, 'batch_norm': False, 'lr': 1.5248635665609538e-05, 'weight_decay': 2.3787195774461706e-07, 'epochs': 144, 'loss': 'mse', 'optimizer': 'adam', 'graph_mode': 'cutoff', 'cutoff': 0.6975962022896536, 'grm_norm': 'gcn', 'self_loops': True, 'use_snp_selection': False}. Best is trial 56 with value: 0.3735020582781594.
[I 2025-12-08 13:54:29,260] Trial 119 finished with value: 0.37476439791585225 and parameters: {'model_type': 'gcn', 'hidden_dims': '[512, 128]', 'dropout': 0.40294597831783185, 'batch_norm': False, 'lr': 3.280220196928355e-05, 'weight_decay': 1.1511654691939355e-07, 'epochs': 155, 'loss': 'mse', 'optimizer': 'adam', 'graph_mode': 'cutoff', 'cutoff': 0.671391388679624, 'grm_norm': 'cosine_then_gcn', 'self_loops': True, 'use_snp_selection': False}. Best is trial 119 with value: 0.37476439791585225.
[I 2025-12-08 13:54:58,629] Trial 120 finished with value: 0.34271176207415116 and parameters: {'model_type': 'gcn', 'hidden_dims': '[512, 128]', 'dropout': 0.4139474014360009, 'batch_norm': False, 'lr': 3.3214084308613006e-05, 'weight_decay': 3.863325829821153e-06, 'epochs': 110, 'loss': 'mse', 'optimizer': 'adam', 'graph_mode': 'cutoff', 'cutoff': 0.7356142877180089, 'grm_norm': 'cosine_then_gcn', 'self_loops': True, 'use_snp_selection': False}. Best is trial 119 with value: 0.37476439791585225.
[I 2025-12-08 13:55:33,912] Trial 121 finished with value: 0.35731676176545957 and parameters: {'model_type': 'gcn', 'hidden_dims': '[512, 128]', 'dropout': 0.3948496865283468, 'batch_norm': False, 'lr': 2.359867908152627e-05, 'weight_decay': 1.2120189851003875e-07, 'epochs': 135, 'loss': 'mse', 'optimizer': 'adam', 'graph_mode': 'cutoff', 'cutoff': 0.6683405552342612, 'grm_norm': 'cosine_then_gcn', 'self_loops': True, 'use_snp_selection': False}. Best is trial 119 with value: 0.37476439791585225.
[I 2025-12-08 13:56:14,395] Trial 122 finished with value: 0.36709391589543355 and parameters: {'model_type': 'gcn', 'hidden_dims': '[512, 128]', 'dropout': 0.3212873117639718, 'batch_norm': False, 'lr': 4.188541249745442e-05, 'weight_decay': 1.0021798752791766e-07, 'epochs': 157, 'loss': 'mse', 'optimizer': 'adam', 'graph_mode': 'cutoff', 'cutoff': 0.6924167296381993, 'grm_norm': 'cosine_then_gcn', 'self_loops': True, 'use_snp_selection': False}. Best is trial 119 with value: 0.37476439791585225.
[I 2025-12-08 13:56:51,459] Trial 123 finished with value: 0.3601740895269182 and parameters: {'model_type': 'gcn', 'hidden_dims': '[512, 128]', 'dropout': 0.4371577160874637, 'batch_norm': False, 'lr': 2.784254083546835e-05, 'weight_decay': 1.8824422252758714e-07, 'epochs': 142, 'loss': 'mse', 'optimizer': 'adam', 'graph_mode': 'cutoff', 'cutoff': 0.6371043231320809, 'grm_norm': 'cosine_then_gcn', 'self_loops': True, 'use_snp_selection': False}. Best is trial 119 with value: 0.37476439791585225.
[I 2025-12-08 13:57:17,244] Trial 124 finished with value: 0.3378517893626161 and parameters: {'model_type': 'gcn', 'hidden_dims': '[512, 128]', 'dropout': 0.3611729468321108, 'batch_norm': False, 'lr': 4.701741107710527e-05, 'weight_decay': 1.501300247163107e-07, 'epochs': 96, 'loss': 'mse', 'optimizer': 'adam', 'graph_mode': 'cutoff', 'cutoff': 0.7140829436099059, 'grm_norm': 'gcn', 'self_loops': True, 'use_snp_selection': False}. Best is trial 119 with value: 0.37476439791585225.
[I 2025-12-08 13:57:50,066] Trial 125 finished with value: 0.35944840098349956 and parameters: {'model_type': 'gcn', 'hidden_dims': '[512, 128]', 'dropout': 0.3707046871241467, 'batch_norm': False, 'lr': 3.3711513918443225e-05, 'weight_decay': 3.155842226454577e-07, 'epochs': 125, 'loss': 'mse', 'optimizer': 'adam', 'graph_mode': 'cutoff', 'cutoff': 0.6221575721509337, 'grm_norm': 'gcn', 'self_loops': True, 'use_snp_selection': False}. Best is trial 119 with value: 0.37476439791585225.
[I 2025-12-08 13:58:22,344] Trial 126 finished with value: 0.0 and parameters: {'model_type': 'gcn', 'hidden_dims': '[512, 64]', 'dropout': 0.3487839010851216, 'batch_norm': False, 'lr': 0.0095515539799851, 'weight_decay': 2.586882330532652e-07, 'epochs': 151, 'loss': 'mae', 'optimizer': 'adam', 'graph_mode': 'cutoff', 'cutoff': 0.6670095894519258, 'grm_norm': 'gcn', 'self_loops': True, 'use_snp_selection': True, 'num_snps': 33304}. Best is trial 119 with value: 0.37476439791585225.
[I 2025-12-08 13:59:05,152] Trial 127 finished with value: 0.35244472286385264 and parameters: {'model_type': 'gcn', 'hidden_dims': '[512, 128]', 'dropout': 0.1883967311345149, 'batch_norm': False, 'lr': 1.955300116132316e-05, 'weight_decay': 1.709084114116796e-07, 'epochs': 166, 'loss': 'mse', 'optimizer': 'adam', 'graph_mode': 'cutoff', 'cutoff': 0.563244592333359, 'grm_norm': 'cosine_then_gcn', 'self_loops': False, 'use_snp_selection': False}. Best is trial 119 with value: 0.37476439791585225.
[I 2025-12-08 13:59:49,338] Trial 128 finished with value: 0.031093009980623955 and parameters: {'model_type': 'gcn', 'hidden_dims': '[512, 128]', 'dropout': 0.30092771683010683, 'batch_norm': False, 'lr': 0.0007649411486182028, 'weight_decay': 1.1597042730708527e-07, 'epochs': 173, 'loss': 'mse', 'optimizer': 'adam', 'graph_mode': 'cutoff', 'cutoff': 0.6502631090284838, 'grm_norm': 'gcn', 'self_loops': True, 'use_snp_selection': False}. Best is trial 119 with value: 0.37476439791585225.
[I 2025-12-08 14:00:30,141] Trial 129 finished with value: 0.3728419258147069 and parameters: {'model_type': 'gcn', 'hidden_dims': '[512, 128]', 'dropout': 0.3834444566889593, 'batch_norm': False, 'lr': 3.779740971371099e-05, 'weight_decay': 3.805996577349145e-07, 'epochs': 159, 'loss': 'mse', 'optimizer': 'adam', 'graph_mode': 'cutoff', 'cutoff': 0.6826330796899054, 'grm_norm': 'gcn', 'self_loops': True, 'use_snp_selection': False}. Best is trial 119 with value: 0.37476439791585225.
