[I 2025-12-08 13:13:06,367] Trial 131 finished with value: 0.2910409378493986 and parameters: {'model_type': 'gcn', 'hidden_dims': '[512, 128]', 'dropout': 0.3639635696966098, 'batch_norm': True, 'lr': 0.00038005792849992825, 'weight_decay': 4.0178352712535225e-05, 'epochs': 100, 'loss': 'mae', 'optimizer': 'adam', 'graph_mode': 'cutoff', 'cutoff': 0.729823715414344, 'grm_norm': 'cosine_then_gcn', 'self_loops': False, 'use_snp_selection': True, 'num_snps': 20138}. Best is trial 67 with value: 0.3066518037274824.
[I 2025-12-08 13:13:31,971] Trial 132 finished with value: 0.2964581234857966 and parameters: {'model_type': 'gcn', 'hidden_dims': '[512, 128]', 'dropout': 0.3462297514081454, 'batch_norm': True, 'lr': 0.00033296132411954343, 'weight_decay': 3.0965860549149774e-05, 'epochs': 188, 'loss': 'mae', 'optimizer': 'adam', 'graph_mode': 'cutoff', 'cutoff': 0.795221994587271, 'grm_norm': 'cosine_then_gcn', 'self_loops': False, 'use_snp_selection': True, 'num_snps': 18158}. Best is trial 67 with value: 0.3066518037274824.
[I 2025-12-08 13:14:03,361] Trial 133 finished with value: 0.2983067372805773 and parameters: {'model_type': 'gcn', 'hidden_dims': '[512, 128]', 'dropout': 0.3742621529094211, 'batch_norm': True, 'lr': 0.00028755515421493585, 'weight_decay': 4.763720616058321e-05, 'epochs': 201, 'loss': 'mae', 'optimizer': 'adam', 'graph_mode': 'cutoff', 'cutoff': 0.7048317602201386, 'grm_norm': 'cosine_then_gcn', 'self_loops': False, 'use_snp_selection': True, 'num_snps': 23435}. Best is trial 67 with value: 0.3066518037274824.
[I 2025-12-08 13:14:18,175] Trial 134 finished with value: 0.288872293124261 and parameters: {'model_type': 'gcn', 'hidden_dims': '[512, 64]', 'dropout': 0.3370092166805942, 'batch_norm': True, 'lr': 0.0002275710651500807, 'weight_decay': 1.802130509036365e-05, 'epochs': 182, 'loss': 'mae', 'optimizer': 'adam', 'graph_mode': 'cutoff', 'cutoff': 0.7397683943671434, 'grm_norm': 'none', 'self_loops': False, 'use_snp_selection': True, 'num_snps': 6175}. Best is trial 67 with value: 0.3066518037274824.
[I 2025-12-08 13:14:38,995] Trial 135 finished with value: 0.3025032191643292 and parameters: {'model_type': 'gcn', 'hidden_dims': '[512, 128]', 'dropout': 0.23907201981241902, 'batch_norm': True, 'lr': 0.00025035502486108526, 'weight_decay': 3.239848801513525e-06, 'epochs': 195, 'loss': 'mae', 'optimizer': 'adam', 'graph_mode': 'cutoff', 'cutoff': 0.7608676376171528, 'grm_norm': 'gcn', 'self_loops': False, 'use_snp_selection': True, 'num_snps': 12750}. Best is trial 67 with value: 0.3066518037274824.
[I 2025-12-08 13:14:59,948] Trial 136 finished with value: 0.2993443366687182 and parameters: {'model_type': 'gcn', 'hidden_dims': '[512, 128]', 'dropout': 0.23348649229764823, 'batch_norm': True, 'lr': 0.0001639948053339954, 'weight_decay': 3.3054303074891256e-06, 'epochs': 194, 'loss': 'mae', 'optimizer': 'adam', 'graph_mode': 'cutoff', 'cutoff': 0.7656629052994722, 'grm_norm': 'gcn', 'self_loops': False, 'use_snp_selection': True, 'num_snps': 13206}. Best is trial 67 with value: 0.3066518037274824.
[I 2025-12-08 13:15:17,359] Trial 137 finished with value: 0.2952984699297109 and parameters: {'model_type': 'gcn', 'hidden_dims': '[256, 128]', 'dropout': 0.22536106131542438, 'batch_norm': True, 'lr': 0.00016762401093283055, 'weight_decay': 4.721400165833813e-06, 'epochs': 213, 'loss': 'mae', 'optimizer': 'adam', 'graph_mode': 'cutoff', 'cutoff': 0.7674646610635968, 'grm_norm': 'gcn', 'self_loops': False, 'use_snp_selection': True, 'num_snps': 13819}. Best is trial 67 with value: 0.3066518037274824.
[I 2025-12-08 13:15:36,490] Trial 138 finished with value: 0.29441141049042024 and parameters: {'model_type': 'gcn', 'hidden_dims': '[512, 128]', 'dropout': 0.26028990969865806, 'batch_norm': True, 'lr': 0.00010937732345756254, 'weight_decay': 3.2096995569511664e-06, 'epochs': 169, 'loss': 'mae', 'optimizer': 'adam', 'graph_mode': 'cutoff', 'cutoff': 0.799702481499802, 'grm_norm': 'gcn', 'self_loops': False, 'use_snp_selection': True, 'num_snps': 12111}. Best is trial 67 with value: 0.3066518037274824.
[I 2025-12-08 13:15:50,346] Trial 139 finished with value: 0.2909399406400165 and parameters: {'model_type': 'gcn', 'hidden_dims': '[512, 256]', 'dropout': 0.2128821585275681, 'batch_norm': True, 'lr': 0.00014069903919388998, 'weight_decay': 3.6150319953507392e-06, 'epochs': 88, 'loss': 'mae', 'optimizer': 'adam', 'graph_mode': 'cutoff', 'cutoff': 0.8838685925219019, 'grm_norm': 'gcn', 'self_loops': False, 'use_snp_selection': True, 'num_snps': 10373}. Best is trial 67 with value: 0.3066518037274824.
[I 2025-12-08 13:16:13,205] Trial 140 finished with value: 0.2923510536825915 and parameters: {'model_type': 'gcn', 'hidden_dims': '[512, 128]', 'dropout': 0.24974199780086875, 'batch_norm': True, 'lr': 0.00018566114379071468, 'weight_decay': 6.020346205369096e-06, 'epochs': 194, 'loss': 'mae', 'optimizer': 'adam', 'graph_mode': 'cutoff', 'cutoff': 0.7493757402194412, 'grm_norm': 'gcn', 'self_loops': True, 'use_snp_selection': True, 'num_snps': 14775}. Best is trial 67 with value: 0.3066518037274824.
[I 2025-12-08 13:16:42,535] Trial 141 finished with value: 0.30066549241880275 and parameters: {'model_type': 'gcn', 'hidden_dims': '[512, 128]', 'dropout': 0.24138886112780833, 'batch_norm': True, 'lr': 0.00025959307725474017, 'weight_decay': 2.294435189889597e-06, 'epochs': 205, 'loss': 'mae', 'optimizer': 'adam', 'graph_mode': 'cutoff', 'cutoff': 0.7835223043207327, 'grm_norm': 'gcn', 'self_loops': False, 'use_snp_selection': True, 'num_snps': 20958}. Best is trial 67 with value: 0.3066518037274824.
[I 2025-12-08 13:17:04,056] Trial 142 finished with value: 0.3001867655347829 and parameters: {'model_type': 'gcn', 'hidden_dims': '[512, 128]', 'dropout': 0.20108548836716808, 'batch_norm': True, 'lr': 0.0002607057656552142, 'weight_decay': 2.046148194893618e-06, 'epochs': 206, 'loss': 'mae', 'optimizer': 'adam', 'graph_mode': 'cutoff', 'cutoff': 0.7813041031813786, 'grm_norm': 'gcn', 'self_loops': False, 'use_snp_selection': True, 'num_snps': 13124}. Best is trial 67 with value: 0.3066518037274824.
[I 2025-12-08 13:17:26,002] Trial 143 finished with value: 0.2926607615053899 and parameters: {'model_type': 'gcn', 'hidden_dims': '[512, 128]', 'dropout': 0.244153555148866, 'batch_norm': True, 'lr': 0.0001545458438418888, 'weight_decay': 1.4192488933400843e-06, 'epochs': 216, 'loss': 'mae', 'optimizer': 'adam', 'graph_mode': 'cutoff', 'cutoff': 0.7855598696983708, 'grm_norm': 'gcn', 'self_loops': False, 'use_snp_selection': True, 'num_snps': 13081}. Best is trial 67 with value: 0.3066518037274824.
[I 2025-12-08 13:17:49,990] Trial 144 finished with value: 0.2866657587063842 and parameters: {'model_type': 'gcn', 'hidden_dims': '[512, 128]', 'dropout': 0.23240354771846192, 'batch_norm': True, 'lr': 0.0028547420827157314, 'weight_decay': 2.1508769771682142e-06, 'epochs': 209, 'loss': 'mae', 'optimizer': 'adam', 'graph_mode': 'cutoff', 'cutoff': 0.8117214611771126, 'grm_norm': 'gcn', 'self_loops': False, 'use_snp_selection': True, 'num_snps': 15429}. Best is trial 67 with value: 0.3066518037274824.
[I 2025-12-08 13:18:10,648] Trial 145 finished with value: 0.29468316783857323 and parameters: {'model_type': 'gcn', 'hidden_dims': '[512, 128]', 'dropout': 0.20173801271112285, 'batch_norm': True, 'lr': 0.00020048747755105876, 'weight_decay': 1.552619959887403e-06, 'epochs': 226, 'loss': 'mae', 'optimizer': 'adam', 'graph_mode': 'cutoff', 'cutoff': 0.764681008113439, 'grm_norm': 'gcn', 'self_loops': False, 'use_snp_selection': True, 'num_snps': 11043}. Best is trial 67 with value: 0.3066518037274824.
[I 2025-12-08 13:18:33,207] Trial 146 finished with value: 0.2401333874189271 and parameters: {'model_type': 'gcn', 'hidden_dims': '[512, 128]', 'dropout': 0.23411548497860157, 'batch_norm': True, 'lr': 0.0002481883530159759, 'weight_decay': 3.0317528624482704e-06, 'epochs': 207, 'loss': 'mae', 'optimizer': 'adam', 'graph_mode': 'cutoff', 'cutoff': 0.26320736997796773, 'grm_norm': 'gcn', 'self_loops': False, 'use_snp_selection': True, 'num_snps': 12811}. Best is trial 67 with value: 0.3066518037274824.
[I 2025-12-08 13:18:57,112] Trial 147 finished with value: 0.28795709497203703 and parameters: {'model_type': 'gcn', 'hidden_dims': '[512, 128]', 'dropout': 0.18240173305961752, 'batch_norm': True, 'lr': 8.65560949182458e-05, 'weight_decay': 1.2837963265780573e-06, 'epochs': 193, 'loss': 'mae', 'optimizer': 'adam', 'graph_mode': 'cutoff', 'cutoff': 0.8294111159471742, 'grm_norm': 'gcn', 'self_loops': False, 'use_snp_selection': True, 'num_snps': 16203}. Best is trial 67 with value: 0.3066518037274824.
[I 2025-12-08 13:19:16,836] Trial 148 finished with value: 0.3007400179338315 and parameters: {'model_type': 'gcn', 'hidden_dims': '[512, 128]', 'dropout': 0.24102471202367262, 'batch_norm': True, 'lr': 0.0001232186164018109, 'weight_decay': 1.9604828575395126e-06, 'epochs': 234, 'loss': 'mae', 'optimizer': 'adam', 'graph_mode': 'cutoff', 'cutoff': 0.8651280262868922, 'grm_norm': 'gcn', 'self_loops': False, 'use_snp_selection': True, 'num_snps': 9798}. Best is trial 67 with value: 0.3066518037274824.
[I 2025-12-08 13:19:34,762] Trial 149 finished with value: 0.290232769384077 and parameters: {'model_type': 'gcn', 'hidden_dims': '[512, 128]', 'dropout': 0.19283059679703451, 'batch_norm': True, 'lr': 0.00012699473251468393, 'weight_decay': 1.740891736500242e-06, 'epochs': 234, 'loss': 'mae', 'optimizer': 'adam', 'graph_mode': 'cutoff', 'cutoff': 0.8611897524426751, 'grm_norm': 'gcn', 'self_loops': False, 'use_snp_selection': True, 'num_snps': 7844}. Best is trial 67 with value: 0.3066518037274824.
[I 2025-12-08 13:20:04,360] Trial 0 finished with value: 0.25824820967648254 and parameters: {'model_type': 'gcn', 'hidden_dims': '[128, 64]', 'dropout': 0.199031432379812, 'batch_norm': True, 'lr': 1.8408544111075823e-05, 'weight_decay': 5.5136510071208614e-05, 'epochs': 336, 'loss': 'mae', 'optimizer': 'adam', 'graph_mode': 'knn', 'knn_k': 8, 'weighted_edges': True, 'symmetrize_mode': 'mutual', 'self_loops': True, 'use_snp_selection': True, 'num_snps': 27173}. Best is trial 0 with value: 0.25824820967648254.
[I 2025-12-08 13:20:44,481] Trial 1 finished with value: 0.22782792506871585 and parameters: {'model_type': 'gcn', 'hidden_dims': '[256, 128, 64]', 'dropout': 0.5543244404043342, 'batch_norm': True, 'lr': 7.981787657617978e-05, 'weight_decay': 2.8571789869344834e-07, 'epochs': 297, 'loss': 'mae', 'optimizer': 'adam', 'graph_mode': 'cutoff', 'cutoff': 0.3392632777751686, 'grm_norm': 'gcn', 'self_loops': False, 'use_snp_selection': False}. Best is trial 0 with value: 0.25824820967648254.
[I 2025-12-08 13:21:43,901] Trial 2 finished with value: 0.18203997871561417 and parameters: {'model_type': 'gcn', 'hidden_dims': '[512, 64]', 'dropout': 0.32815227354739207, 'batch_norm': True, 'lr': 0.000619605044204259, 'weight_decay': 0.0004086269831625786, 'epochs': 206, 'loss': 'mse', 'optimizer': 'adam', 'graph_mode': 'knn', 'knn_k': 4, 'weighted_edges': True, 'symmetrize_mode': 'union', 'self_loops': True, 'use_snp_selection': True, 'num_snps': 53035}. Best is trial 0 with value: 0.25824820967648254.
[I 2025-12-08 13:22:13,296] Trial 3 finished with value: 0.21737843474193616 and parameters: {'model_type': 'gcn', 'hidden_dims': '[256, 128]', 'dropout': 0.23110783056597514, 'batch_norm': True, 'lr': 8.11311593386298e-05, 'weight_decay': 9.296158109581328e-07, 'epochs': 213, 'loss': 'mse', 'optimizer': 'adam', 'graph_mode': 'knn', 'knn_k': 10, 'weighted_edges': True, 'symmetrize_mode': 'mutual', 'self_loops': True, 'use_snp_selection': False}. Best is trial 0 with value: 0.25824820967648254.
[I 2025-12-08 13:22:28,267] Trial 4 finished with value: 0.3017054903092073 and parameters: {'model_type': 'gcn', 'hidden_dims': '[512, 256]', 'dropout': 0.2753281956415665, 'batch_norm': True, 'lr': 0.00034435188114839693, 'weight_decay': 4.9416012835950194e-05, 'epochs': 89, 'loss': 'mae', 'optimizer': 'adam', 'graph_mode': 'cutoff', 'cutoff': 0.820078967317394, 'grm_norm': 'none', 'self_loops': False, 'use_snp_selection': True, 'num_snps': 12674}. Best is trial 4 with value: 0.3017054903092073.
[I 2025-12-08 13:22:55,047] Trial 5 finished with value: 0.27280691214906727 and parameters: {'model_type': 'gcn', 'hidden_dims': '[128, 64]', 'dropout': 0.5611163934517731, 'batch_norm': True, 'lr': 0.0003984856210762587, 'weight_decay': 1.1466743517565185e-07, 'epochs': 344, 'loss': 'mae', 'optimizer': 'adam', 'graph_mode': 'cutoff', 'cutoff': 0.6089370799714728, 'grm_norm': 'gcn', 'self_loops': True, 'use_snp_selection': False}. Best is trial 4 with value: 0.3017054903092073.
[I 2025-12-08 13:23:18,424] Trial 6 finished with value: 0.27683813928971 and parameters: {'model_type': 'gcn', 'hidden_dims': '[128, 64]', 'dropout': 0.31805912766941713, 'batch_norm': True, 'lr': 1.2361026034262557e-05, 'weight_decay': 6.492620232791903e-06, 'epochs': 271, 'loss': 'mse', 'optimizer': 'adam', 'graph_mode': 'cutoff', 'cutoff': 0.6193362582230448, 'grm_norm': 'cosine', 'self_loops': False, 'use_snp_selection': True, 'num_snps': 28594}. Best is trial 4 with value: 0.3017054903092073.
[I 2025-12-08 13:23:39,973] Trial 7 finished with value: 0.22848516567637 and parameters: {'model_type': 'gcn', 'hidden_dims': '[512, 64]', 'dropout': 0.471337288649717, 'batch_norm': True, 'lr': 2.239693207292708e-05, 'weight_decay': 2.263166635514082e-06, 'epochs': 69, 'loss': 'mse', 'optimizer': 'adam', 'graph_mode': 'cutoff', 'cutoff': 0.4056820886426376, 'grm_norm': 'cosine', 'self_loops': False, 'use_snp_selection': False}. Best is trial 4 with value: 0.3017054903092073.
[I 2025-12-08 13:24:18,753] Trial 8 finished with value: 0.2669836971677334 and parameters: {'model_type': 'gcn', 'hidden_dims': '[512, 256]', 'dropout': 0.20659328268932406, 'batch_norm': False, 'lr': 8.93315124361372e-05, 'weight_decay': 0.00028987480727919035, 'epochs': 136, 'loss': 'mae', 'optimizer': 'adam', 'graph_mode': 'knn', 'knn_k': 3, 'weighted_edges': False, 'symmetrize_mode': 'union', 'self_loops': False, 'use_snp_selection': True, 'num_snps': 43128}. Best is trial 4 with value: 0.3017054903092073.
[I 2025-12-08 13:25:02,735] Trial 9 finished with value: -0.1002020805598601 and parameters: {'model_type': 'gcn', 'hidden_dims': '[512, 256]', 'dropout': 0.2888209592870401, 'batch_norm': False, 'lr': 0.004734648143129892, 'weight_decay': 1.5879705591356368e-06, 'epochs': 163, 'loss': 'mse', 'optimizer': 'adam', 'graph_mode': 'cutoff', 'cutoff': 0.5984899797909019, 'grm_norm': 'cosine', 'self_loops': True, 'use_snp_selection': False}. Best is trial 4 with value: 0.3017054903092073.
[I 2025-12-08 13:25:12,078] Trial 10 finished with value: 0.25524441602406756 and parameters: {'model_type': 'gcn', 'hidden_dims': '[512, 128]', 'dropout': 0.11372025982957354, 'batch_norm': False, 'lr': 0.0023343012062770553, 'weight_decay': 4.14440562940608e-05, 'epochs': 41, 'loss': 'mae', 'optimizer': 'adam', 'graph_mode': 'cutoff', 'cutoff': 0.8740100033033124, 'grm_norm': 'none', 'self_loops': False, 'use_snp_selection': True, 'num_snps': 3859}. Best is trial 4 with value: 0.3017054903092073.
[I 2025-12-08 13:25:30,028] Trial 11 finished with value: 0.29277741621151876 and parameters: {'model_type': 'gcn', 'hidden_dims': '[128, 64]', 'dropout': 0.40483337339263037, 'batch_norm': True, 'lr': 0.0008716651983952945, 'weight_decay': 1.6792768777147005e-05, 'epochs': 253, 'loss': 'mse', 'optimizer': 'adam', 'graph_mode': 'cutoff', 'cutoff': 0.8576830859783061, 'grm_norm': 'cosine_then_gcn', 'self_loops': False, 'use_snp_selection': True, 'num_snps': 16385}. Best is trial 4 with value: 0.3017054903092073.
[I 2025-12-08 13:25:44,521] Trial 12 finished with value: 0.2907096169864176 and parameters: {'model_type': 'gcn', 'hidden_dims': '[512, 256]', 'dropout': 0.42058772746038836, 'batch_norm': True, 'lr': 0.0011839894135894482, 'weight_decay': 3.769314426796163e-05, 'epochs': 111, 'loss': 'mse', 'optimizer': 'adam', 'graph_mode': 'cutoff', 'cutoff': 0.8997334580241522, 'grm_norm': 'cosine_then_gcn', 'self_loops': False, 'use_snp_selection': True, 'num_snps': 9404}. Best is trial 4 with value: 0.3017054903092073.
[I 2025-12-08 13:26:14,655] Trial 13 finished with value: 0.3043406026011245 and parameters: {'model_type': 'gcn', 'hidden_dims': '[512, 128]', 'dropout': 0.42169375384010027, 'batch_norm': True, 'lr': 0.00015760028577826093, 'weight_decay': 1.0957653494853036e-05, 'epochs': 259, 'loss': 'mae', 'optimizer': 'adam', 'graph_mode': 'cutoff', 'cutoff': 0.7699179571762822, 'grm_norm': 'cosine_then_gcn', 'self_loops': False, 'use_snp_selection': True, 'num_snps': 17287}. Best is trial 13 with value: 0.3043406026011245.
[I 2025-12-08 13:26:33,230] Trial 14 finished with value: 0.29420062656353735 and parameters: {'model_type': 'gcn', 'hidden_dims': '[512, 128]', 'dropout': 0.4506894495718366, 'batch_norm': False, 'lr': 0.0002008596430296155, 'weight_decay': 0.00012014795738940992, 'epochs': 98, 'loss': 'mae', 'optimizer': 'adam', 'graph_mode': 'cutoff', 'cutoff': 0.7448878090285934, 'grm_norm': 'none', 'self_loops': False, 'use_snp_selection': True, 'num_snps': 18149}. Best is trial 13 with value: 0.3043406026011245.
[I 2025-12-08 13:26:57,449] Trial 15 finished with value: 0.29791196712381507 and parameters: {'model_type': 'gcn', 'hidden_dims': '[512, 128]', 'dropout': 0.37821646043415796, 'batch_norm': True, 'lr': 0.00019946804531991192, 'weight_decay': 7.311129231034126e-06, 'epochs': 168, 'loss': 'mae', 'optimizer': 'adam', 'graph_mode': 'cutoff', 'cutoff': 0.7389935703830977, 'grm_norm': 'cosine_then_gcn', 'self_loops': False, 'use_snp_selection': True, 'num_snps': 18426}. Best is trial 13 with value: 0.3043406026011245.
[I 2025-12-08 13:27:33,545] Trial 16 finished with value: 0.2072414986131826 and parameters: {'model_type': 'gcn', 'hidden_dims': '[256, 128, 64]', 'dropout': 0.5074606042461072, 'batch_norm': True, 'lr': 3.837553030630782e-05, 'weight_decay': 0.0007024082238618747, 'epochs': 248, 'loss': 'mae', 'optimizer': 'adam', 'graph_mode': 'cutoff', 'cutoff': 0.20792938025503954, 'grm_norm': 'none', 'self_loops': False, 'use_snp_selection': True, 'num_snps': 36329}. Best is trial 13 with value: 0.3043406026011245.
[I 2025-12-08 13:27:52,372] Trial 17 finished with value: 0.30007533235335354 and parameters: {'model_type': 'gcn', 'hidden_dims': '[256, 128]', 'dropout': 0.2702037781903839, 'batch_norm': True, 'lr': 0.0002565433251945642, 'weight_decay': 1.4655112984344072e-05, 'epochs': 298, 'loss': 'mae', 'optimizer': 'adam', 'graph_mode': 'cutoff', 'cutoff': 0.7342337590576546, 'grm_norm': 'none', 'self_loops': False, 'use_snp_selection': True, 'num_snps': 10785}. Best is trial 13 with value: 0.3043406026011245.
[I 2025-12-08 13:28:04,312] Trial 18 finished with value: 0.25977137760478336 and parameters: {'model_type': 'gcn', 'hidden_dims': '[512, 256]', 'dropout': 0.3621395789694052, 'batch_norm': False, 'lr': 0.002420120270320009, 'weight_decay': 9.436304121139692e-05, 'epochs': 166, 'loss': 'mae', 'optimizer': 'adam', 'graph_mode': 'knn', 'knn_k': 1, 'weighted_edges': False, 'symmetrize_mode': 'mutual', 'self_loops': False, 'use_snp_selection': True, 'num_snps': 3039}. Best is trial 13 with value: 0.3043406026011245.
[I 2025-12-08 13:28:37,216] Trial 19 finished with value: 0.30720657667897483 and parameters: {'model_type': 'gcn', 'hidden_dims': '[512, 128]', 'dropout': 0.1358550877561121, 'batch_norm': True, 'lr': 0.00014426812691287574, 'weight_decay': 4.351571294965493e-06, 'epochs': 228, 'loss': 'mae', 'optimizer': 'adam', 'graph_mode': 'cutoff', 'cutoff': 0.7962396168924546, 'grm_norm': 'cosine_then_gcn', 'self_loops': False, 'use_snp_selection': True, 'num_snps': 22544}. Best is trial 19 with value: 0.30720657667897483.
[I 2025-12-08 13:29:09,849] Trial 20 finished with value: 0.2431115715175678 and parameters: {'model_type': 'gcn', 'hidden_dims': '[512, 128]', 'dropout': 0.11824572080479222, 'batch_norm': True, 'lr': 4.50719318489454e-05, 'weight_decay': 3.762440886499229e-06, 'epochs': 217, 'loss': 'mae', 'optimizer': 'adam', 'graph_mode': 'cutoff', 'cutoff': 0.4886361018220657, 'grm_norm': 'cosine_then_gcn', 'self_loops': False, 'use_snp_selection': True, 'num_snps': 23208}. Best is trial 19 with value: 0.30720657667897483.
[I 2025-12-08 13:29:33,622] Trial 21 finished with value: 0.3081373243723945 and parameters: {'model_type': 'gcn', 'hidden_dims': '[512, 128]', 'dropout': 0.15994749302805278, 'batch_norm': True, 'lr': 0.00011583376263671933, 'weight_decay': 2.1034647506502184e-05, 'epochs': 247, 'loss': 'mae', 'optimizer': 'adam', 'graph_mode': 'cutoff', 'cutoff': 0.7892132506044031, 'grm_norm': 'cosine_then_gcn', 'self_loops': False, 'use_snp_selection': True, 'num_snps': 13253}. Best is trial 21 with value: 0.3081373243723945.
[I 2025-12-08 13:30:18,499] Trial 22 finished with value: 0.29356417419565106 and parameters: {'model_type': 'gcn', 'hidden_dims': '[512, 128]', 'dropout': 0.15971478811586962, 'batch_norm': True, 'lr': 0.00012976017641965837, 'weight_decay': 1.7122054726570433e-05, 'epochs': 238, 'loss': 'mae', 'optimizer': 'adam', 'graph_mode': 'cutoff', 'cutoff': 0.7813726489532006, 'grm_norm': 'cosine_then_gcn', 'self_loops': False, 'use_snp_selection': True, 'num_snps': 33979}. Best is trial 21 with value: 0.3081373243723945.
[I 2025-12-08 13:30:57,914] Trial 23 finished with value: 0.2941827734199906 and parameters: {'model_type': 'gcn', 'hidden_dims': '[512, 128]', 'dropout': 0.16510108584510688, 'batch_norm': True, 'lr': 5.054315646126359e-05, 'weight_decay': 6.788977455713312e-07, 'epochs': 287, 'loss': 'mae', 'optimizer': 'adam', 'graph_mode': 'cutoff', 'cutoff': 0.6656309440875677, 'grm_norm': 'cosine_then_gcn', 'self_loops': False, 'use_snp_selection': True, 'num_snps': 24095}. Best is trial 21 with value: 0.3081373243723945.
