[I 2025-12-08 17:23:00,698] Trial 24 finished with value: 0.35715139201021345 and parameters: {'model_type': 'gcn', 'hidden_dims': '[512, 256]', 'dropout': 0.15441207851839706, 'batch_norm': False, 'lr': 0.00016760899639774754, 'weight_decay': 1.4848966441416182e-05, 'epochs': 64, 'loss': 'mae', 'optimizer': 'adam', 'graph_mode': 'cutoff', 'cutoff': 0.5087531030257637, 'grm_norm': 'cosine_then_gcn', 'self_loops': False, 'use_snp_selection': True, 'num_snps': 9788}. Best is trial 21 with value: 0.3593220778560176.
[I 2025-12-08 17:23:17,953] Trial 25 finished with value: 0.3507412511342075 and parameters: {'model_type': 'gcn', 'hidden_dims': '[512, 128]', 'dropout': 0.29913257487906847, 'batch_norm': False, 'lr': 0.00018151712342154107, 'weight_decay': 1.776654470357894e-05, 'epochs': 67, 'loss': 'mae', 'optimizer': 'adam', 'graph_mode': 'cutoff', 'cutoff': 0.4867615950258789, 'grm_norm': 'cosine_then_gcn', 'self_loops': False, 'use_snp_selection': True, 'num_snps': 21483}. Best is trial 21 with value: 0.3593220778560176.
[I 2025-12-08 17:23:26,007] Trial 26 finished with value: 0.30101315160689174 and parameters: {'model_type': 'gcn', 'hidden_dims': '[256, 128, 64]', 'dropout': 0.22448130770652225, 'batch_norm': False, 'lr': 3.184183822845939e-05, 'weight_decay': 4.53832433075109e-06, 'epochs': 48, 'loss': 'mse', 'optimizer': 'adam', 'graph_mode': 'cutoff', 'cutoff': 0.5001344230457669, 'grm_norm': 'cosine_then_gcn', 'self_loops': True, 'use_snp_selection': False}. Best is trial 21 with value: 0.3593220778560176.
[I 2025-12-08 17:23:37,766] Trial 27 finished with value: 0.3581050295231681 and parameters: {'model_type': 'gcn', 'hidden_dims': '[256, 128]', 'dropout': 0.17921421760752196, 'batch_norm': False, 'lr': 0.0004326882761581242, 'weight_decay': 7.888961518642956e-07, 'epochs': 67, 'loss': 'mae', 'optimizer': 'adam', 'graph_mode': 'cutoff', 'cutoff': 0.6707262705736593, 'grm_norm': 'cosine_then_gcn', 'self_loops': False, 'use_snp_selection': True, 'num_snps': 12393}. Best is trial 21 with value: 0.3593220778560176.
[I 2025-12-08 17:23:54,958] Trial 28 finished with value: 0.35250037455318883 and parameters: {'model_type': 'gcn', 'hidden_dims': '[256, 128]', 'dropout': 0.18577463555400153, 'batch_norm': False, 'lr': 0.0005861690381454305, 'weight_decay': 5.368909581423481e-07, 'epochs': 176, 'loss': 'mae', 'optimizer': 'adam', 'graph_mode': 'cutoff', 'cutoff': 0.67799663752896, 'grm_norm': 'cosine_then_gcn', 'self_loops': False, 'use_snp_selection': True, 'num_snps': 16286}. Best is trial 21 with value: 0.3593220778560176.
[I 2025-12-08 17:24:18,224] Trial 29 finished with value: 0.3631071597253156 and parameters: {'model_type': 'gcn', 'hidden_dims': '[256, 128]', 'dropout': 0.20752430699196536, 'batch_norm': False, 'lr': 4.489867147235872e-05, 'weight_decay': 2.463307652916298e-06, 'epochs': 141, 'loss': 'mae', 'optimizer': 'adam', 'graph_mode': 'cutoff', 'cutoff': 0.8016174172831436, 'grm_norm': 'cosine_then_gcn', 'self_loops': True, 'use_snp_selection': True, 'num_snps': 34475}. Best is trial 29 with value: 0.3631071597253156.
[I 2025-12-08 17:24:42,360] Trial 30 finished with value: 0.36308437140784916 and parameters: {'model_type': 'gcn', 'hidden_dims': '[256, 128]', 'dropout': 0.19986618202238177, 'batch_norm': False, 'lr': 4.324653142445367e-05, 'weight_decay': 4.0791280698302834e-07, 'epochs': 141, 'loss': 'mae', 'optimizer': 'adam', 'graph_mode': 'cutoff', 'cutoff': 0.811369690092108, 'grm_norm': 'cosine_then_gcn', 'self_loops': True, 'use_snp_selection': True, 'num_snps': 36228}. Best is trial 29 with value: 0.3631071597253156.
[I 2025-12-08 17:25:07,082] Trial 31 finished with value: 0.3645970575448865 and parameters: {'model_type': 'gcn', 'hidden_dims': '[256, 128]', 'dropout': 0.1983137901791637, 'batch_norm': False, 'lr': 3.916149818090063e-05, 'weight_decay': 2.7448573827621063e-07, 'epochs': 144, 'loss': 'mae', 'optimizer': 'adam', 'graph_mode': 'cutoff', 'cutoff': 0.8105530900239702, 'grm_norm': 'cosine_then_gcn', 'self_loops': True, 'use_snp_selection': True, 'num_snps': 37516}. Best is trial 31 with value: 0.3645970575448865.
[I 2025-12-08 17:25:32,065] Trial 32 finished with value: 0.36289639498454523 and parameters: {'model_type': 'gcn', 'hidden_dims': '[256, 128]', 'dropout': 0.2145828884298103, 'batch_norm': False, 'lr': 4.2996141396840796e-05, 'weight_decay': 2.1412334243930793e-07, 'epochs': 151, 'loss': 'mae', 'optimizer': 'adam', 'graph_mode': 'cutoff', 'cutoff': 0.8151933284981537, 'grm_norm': 'cosine_then_gcn', 'self_loops': True, 'use_snp_selection': True, 'num_snps': 36648}. Best is trial 31 with value: 0.3645970575448865.
[I 2025-12-08 17:25:59,076] Trial 33 finished with value: 0.3644301398724112 and parameters: {'model_type': 'gcn', 'hidden_dims': '[256, 128]', 'dropout': 0.21441551804532352, 'batch_norm': False, 'lr': 4.1563798563346e-05, 'weight_decay': 2.1471572503011735e-07, 'epochs': 185, 'loss': 'mae', 'optimizer': 'adam', 'graph_mode': 'cutoff', 'cutoff': 0.8253484528968922, 'grm_norm': 'cosine_then_gcn', 'self_loops': True, 'use_snp_selection': True, 'num_snps': 35399}. Best is trial 31 with value: 0.3645970575448865.
[I 2025-12-08 17:26:22,733] Trial 34 finished with value: 0.36486732131434496 and parameters: {'model_type': 'gcn', 'hidden_dims': '[256, 128]', 'dropout': 0.19889250300380326, 'batch_norm': False, 'lr': 5.135522437120553e-05, 'weight_decay': 2.926583889977937e-07, 'epochs': 186, 'loss': 'mae', 'optimizer': 'adam', 'graph_mode': 'cutoff', 'cutoff': 0.822111649150699, 'grm_norm': 'cosine_then_gcn', 'self_loops': True, 'use_snp_selection': False}. Best is trial 34 with value: 0.36486732131434496.
[I 2025-12-08 17:26:46,921] Trial 35 finished with value: 0.36022022875076043 and parameters: {'model_type': 'gcn', 'hidden_dims': '[256, 128]', 'dropout': 0.3270438862136622, 'batch_norm': False, 'lr': 1.2560795852895306e-05, 'weight_decay': 1.0509786512826045e-07, 'epochs': 191, 'loss': 'mse', 'optimizer': 'adam', 'graph_mode': 'cutoff', 'cutoff': 0.8381918228048424, 'grm_norm': 'cosine_then_gcn', 'self_loops': True, 'use_snp_selection': False}. Best is trial 34 with value: 0.36486732131434496.
[I 2025-12-08 17:27:14,947] Trial 36 finished with value: 0.35716191088352695 and parameters: {'model_type': 'gcn', 'hidden_dims': '[256, 128]', 'dropout': 0.1708837989559736, 'batch_norm': False, 'lr': 5.598824359427859e-05, 'weight_decay': 1.8711634627208144e-07, 'epochs': 226, 'loss': 'mae', 'optimizer': 'adam', 'graph_mode': 'cutoff', 'cutoff': 0.8992684789518126, 'grm_norm': 'gcn', 'self_loops': True, 'use_snp_selection': False}. Best is trial 34 with value: 0.36486732131434496.
[I 2025-12-08 17:27:39,212] Trial 37 finished with value: 0.346085396967928 and parameters: {'model_type': 'gcn', 'hidden_dims': '[256, 128]', 'dropout': 0.5870053296534858, 'batch_norm': False, 'lr': 2.520122086245753e-05, 'weight_decay': 3.40943884830279e-07, 'epochs': 192, 'loss': 'mae', 'optimizer': 'adam', 'graph_mode': 'cutoff', 'cutoff': 0.7883606309254991, 'grm_norm': 'cosine_then_gcn', 'self_loops': True, 'use_snp_selection': False}. Best is trial 34 with value: 0.36486732131434496.
[I 2025-12-08 17:28:10,446] Trial 38 finished with value: 0.34645410165763585 and parameters: {'model_type': 'gcn', 'hidden_dims': '[256, 128]', 'dropout': 0.1287552714121502, 'batch_norm': False, 'lr': 7.156000897813048e-05, 'weight_decay': 1.133067021912795e-06, 'epochs': 253, 'loss': 'mse', 'optimizer': 'adam', 'graph_mode': 'cutoff', 'cutoff': 0.6822229574511367, 'grm_norm': 'cosine_then_gcn', 'self_loops': True, 'use_snp_selection': False}. Best is trial 34 with value: 0.36486732131434496.
[I 2025-12-08 17:29:30,756] Trial 39 finished with value: 0.2817919816044907 and parameters: {'model_type': 'gcn', 'hidden_dims': '[512, 64]', 'dropout': 0.2328993274483136, 'batch_norm': True, 'lr': 1.881636980072328e-05, 'weight_decay': 1.8478906513049035e-07, 'epochs': 322, 'loss': 'mae', 'optimizer': 'adam', 'graph_mode': 'cutoff', 'cutoff': 0.8561769561658638, 'grm_norm': 'cosine_then_gcn', 'self_loops': True, 'use_snp_selection': False}. Best is trial 34 with value: 0.36486732131434496.
[I 2025-12-08 17:29:46,189] Trial 40 finished with value: 0.18872707404229577 and parameters: {'model_type': 'gcn', 'hidden_dims': '[128, 64]', 'dropout': 0.5122414005363922, 'batch_norm': False, 'lr': 0.00010387631912677053, 'weight_decay': 5.789917267750209e-07, 'epochs': 205, 'loss': 'mse', 'optimizer': 'adam', 'graph_mode': 'cutoff', 'cutoff': 0.7798909168673667, 'grm_norm': 'gcn', 'self_loops': True, 'use_snp_selection': False}. Best is trial 34 with value: 0.36486732131434496.
[I 2025-12-08 17:30:12,032] Trial 41 finished with value: 0.3614724788792857 and parameters: {'model_type': 'gcn', 'hidden_dims': '[256, 128]', 'dropout': 0.21206726338552806, 'batch_norm': False, 'lr': 3.9061978509492635e-05, 'weight_decay': 3.5836089158394646e-07, 'epochs': 182, 'loss': 'mae', 'optimizer': 'adam', 'graph_mode': 'cutoff', 'cutoff': 0.8147900533843253, 'grm_norm': 'cosine_then_gcn', 'self_loops': True, 'use_snp_selection': True, 'num_snps': 33830}. Best is trial 34 with value: 0.36486732131434496.
[I 2025-12-08 17:30:36,856] Trial 42 finished with value: 0.36913436005647104 and parameters: {'model_type': 'gcn', 'hidden_dims': '[256, 128]', 'dropout': 0.19801913362020718, 'batch_norm': False, 'lr': 5.677398081971205e-05, 'weight_decay': 5.275247087604765e-07, 'epochs': 131, 'loss': 'mae', 'optimizer': 'adam', 'graph_mode': 'cutoff', 'cutoff': 0.8480262870901736, 'grm_norm': 'cosine_then_gcn', 'self_loops': True, 'use_snp_selection': True, 'num_snps': 40084}. Best is trial 42 with value: 0.36913436005647104.
[I 2025-12-08 17:30:53,319] Trial 43 finished with value: 0.3627291588731657 and parameters: {'model_type': 'gcn', 'hidden_dims': '[256, 128]', 'dropout': 0.28987040158874744, 'batch_norm': False, 'lr': 6.088923314803618e-05, 'weight_decay': 2.2269452081262383e-06, 'epochs': 124, 'loss': 'mae', 'optimizer': 'adam', 'graph_mode': 'cutoff', 'cutoff': 0.8530624654376036, 'grm_norm': 'cosine_then_gcn', 'self_loops': True, 'use_snp_selection': False}. Best is trial 42 with value: 0.36913436005647104.
[I 2025-12-08 17:31:27,169] Trial 44 finished with value: 0.3665128525708247 and parameters: {'model_type': 'gcn', 'hidden_dims': '[256, 128]', 'dropout': 0.19364449737903158, 'batch_norm': False, 'lr': 2.929294065632187e-05, 'weight_decay': 1.1289760412707479e-06, 'epochs': 216, 'loss': 'mae', 'optimizer': 'adam', 'graph_mode': 'cutoff', 'cutoff': 0.7832606844050636, 'grm_norm': 'cosine_then_gcn', 'self_loops': True, 'use_snp_selection': True, 'num_snps': 44164}. Best is trial 42 with value: 0.36913436005647104.
[I 2025-12-08 17:31:59,331] Trial 45 finished with value: 0.24315675955273114 and parameters: {'model_type': 'gcn', 'hidden_dims': '[256, 128]', 'dropout': 0.1602031346918059, 'batch_norm': True, 'lr': 1.032572686161417e-05, 'weight_decay': 2.4442866426463024e-07, 'epochs': 214, 'loss': 'mae', 'optimizer': 'adam', 'graph_mode': 'cutoff', 'cutoff': 0.8579840149266144, 'grm_norm': 'gcn', 'self_loops': True, 'use_snp_selection': True, 'num_snps': 41401}. Best is trial 42 with value: 0.36913436005647104.
[I 2025-12-08 17:32:31,326] Trial 46 finished with value: 0.3572923805542764 and parameters: {'model_type': 'gcn', 'hidden_dims': '[256, 128]', 'dropout': 0.2694144424445759, 'batch_norm': False, 'lr': 2.800293814659823e-05, 'weight_decay': 9.803616646673603e-07, 'epochs': 259, 'loss': 'mae', 'optimizer': 'adam', 'graph_mode': 'cutoff', 'cutoff': 0.774830388804598, 'grm_norm': 'cosine', 'self_loops': True, 'use_snp_selection': False}. Best is trial 42 with value: 0.36913436005647104.
[I 2025-12-08 17:33:32,549] Trial 47 finished with value: 0.3539814714116288 and parameters: {'model_type': 'gcn', 'hidden_dims': '[512, 64]', 'dropout': 0.1173313175196221, 'batch_norm': False, 'lr': 1.978816293786219e-05, 'weight_decay': 1.3940313410702818e-07, 'epochs': 233, 'loss': 'mae', 'optimizer': 'adam', 'graph_mode': 'cutoff', 'cutoff': 0.6997041611677677, 'grm_norm': 'cosine_then_gcn', 'self_loops': True, 'use_snp_selection': True, 'num_snps': 52187}. Best is trial 42 with value: 0.36913436005647104.
[I 2025-12-08 17:34:08,359] Trial 48 finished with value: 0.3491252199598548 and parameters: {'model_type': 'gcn', 'hidden_dims': '[128, 64]', 'dropout': 0.19129896934845145, 'batch_norm': False, 'lr': 0.0001354195628198602, 'weight_decay': 6.818423774037464e-07, 'epochs': 294, 'loss': 'mae', 'optimizer': 'adam', 'graph_mode': 'cutoff', 'cutoff': 0.6384486579308132, 'grm_norm': 'cosine', 'self_loops': True, 'use_snp_selection': True, 'num_snps': 59503}. Best is trial 42 with value: 0.36913436005647104.
[I 2025-12-08 17:34:33,848] Trial 49 finished with value: 0.29057753518029666 and parameters: {'model_type': 'gcn', 'hidden_dims': '[256, 128]', 'dropout': 0.3088657945347329, 'batch_norm': True, 'lr': 1.575052424166175e-05, 'weight_decay': 1.4001422271592154e-06, 'epochs': 202, 'loss': 'mse', 'optimizer': 'adam', 'graph_mode': 'knn', 'knn_k': 1, 'weighted_edges': True, 'symmetrize_mode': 'mutual', 'self_loops': True, 'use_snp_selection': True, 'num_snps': 29689}. Best is trial 42 with value: 0.36913436005647104.
[I 2025-12-08 17:34:54,275] Trial 50 finished with value: 0.35672491259056166 and parameters: {'model_type': 'gcn', 'hidden_dims': '[256, 128, 64]', 'dropout': 0.14793167072614932, 'batch_norm': False, 'lr': 9.316636462406686e-05, 'weight_decay': 4.461335143334265e-07, 'epochs': 154, 'loss': 'mae', 'optimizer': 'adam', 'graph_mode': 'cutoff', 'cutoff': 0.8372159429655006, 'grm_norm': 'none', 'self_loops': True, 'use_snp_selection': False}. Best is trial 42 with value: 0.36913436005647104.
[I 2025-12-08 17:35:19,466] Trial 51 finished with value: 0.37326597478568413 and parameters: {'model_type': 'gcn', 'hidden_dims': '[256, 128]', 'dropout': 0.2331269390552719, 'batch_norm': False, 'lr': 3.662435641931285e-05, 'weight_decay': 2.521741196120147e-06, 'epochs': 122, 'loss': 'mae', 'optimizer': 'adam', 'graph_mode': 'cutoff', 'cutoff': 0.7977122602584275, 'grm_norm': 'cosine_then_gcn', 'self_loops': True, 'use_snp_selection': True, 'num_snps': 42885}. Best is trial 51 with value: 0.37326597478568413.
[I 2025-12-08 17:35:45,966] Trial 52 finished with value: 0.3613801842338967 and parameters: {'model_type': 'gcn', 'hidden_dims': '[256, 128]', 'dropout': 0.23139543032471066, 'batch_norm': False, 'lr': 3.285844694718646e-05, 'weight_decay': 1.4647417677603356e-07, 'epochs': 124, 'loss': 'mae', 'optimizer': 'adam', 'graph_mode': 'cutoff', 'cutoff': 0.8993625136686867, 'grm_norm': 'cosine_then_gcn', 'self_loops': True, 'use_snp_selection': True, 'num_snps': 45750}. Best is trial 51 with value: 0.37326597478568413.
[I 2025-12-08 17:36:15,054] Trial 53 finished with value: 0.36453378965998323 and parameters: {'model_type': 'gcn', 'hidden_dims': '[256, 128]', 'dropout': 0.24444373419287133, 'batch_norm': False, 'lr': 7.470761631521673e-05, 'weight_decay': 3.018625900617145e-07, 'epochs': 179, 'loss': 'mae', 'optimizer': 'adam', 'graph_mode': 'cutoff', 'cutoff': 0.7811132204907455, 'grm_norm': 'cosine_then_gcn', 'self_loops': True, 'use_snp_selection': True, 'num_snps': 41099}. Best is trial 51 with value: 0.37326597478568413.
[I 2025-12-08 17:36:43,645] Trial 54 finished with value: 0.37234052220080094 and parameters: {'model_type': 'gcn', 'hidden_dims': '[256, 128]', 'dropout': 0.24668410695180054, 'batch_norm': False, 'lr': 6.242179313578164e-05, 'weight_decay': 1.5136602518804663e-06, 'epochs': 173, 'loss': 'mae', 'optimizer': 'adam', 'graph_mode': 'cutoff', 'cutoff': 0.7104585820872129, 'grm_norm': 'cosine_then_gcn', 'self_loops': True, 'use_snp_selection': True, 'num_snps': 41057}. Best is trial 51 with value: 0.37326597478568413.
[I 2025-12-08 17:37:15,225] Trial 55 finished with value: 0.3706952043939814 and parameters: {'model_type': 'gcn', 'hidden_dims': '[256, 128]', 'dropout': 0.27321027997248953, 'batch_norm': False, 'lr': 5.502231945349241e-05, 'weight_decay': 1.7351728305875756e-06, 'epochs': 162, 'loss': 'mae', 'optimizer': 'adam', 'graph_mode': 'cutoff', 'cutoff': 0.5795420093002278, 'grm_norm': 'cosine_then_gcn', 'self_loops': True, 'use_snp_selection': True, 'num_snps': 49178}. Best is trial 51 with value: 0.37326597478568413.
[I 2025-12-08 17:38:02,943] Trial 56 finished with value: 0.3416541318814504 and parameters: {'model_type': 'gcn', 'hidden_dims': '[512, 128]', 'dropout': 0.28184481251167165, 'batch_norm': False, 'lr': 5.4439910121219543e-05, 'weight_decay': 1.8526107572998315e-06, 'epochs': 166, 'loss': 'mae', 'optimizer': 'adam', 'graph_mode': 'knn', 'knn_k': 4, 'weighted_edges': True, 'symmetrize_mode': 'mutual', 'self_loops': True, 'use_snp_selection': True, 'num_snps': 50473}. Best is trial 51 with value: 0.37326597478568413.
[I 2025-12-08 17:38:30,304] Trial 57 finished with value: 0.344783370525019 and parameters: {'model_type': 'gcn', 'hidden_dims': '[256, 128]', 'dropout': 0.2601283384993184, 'batch_norm': False, 'lr': 0.00011435796732476204, 'weight_decay': 3.0387897683813865e-06, 'epochs': 127, 'loss': 'mae', 'optimizer': 'adam', 'graph_mode': 'cutoff', 'cutoff': 0.3993269850209142, 'grm_norm': 'none', 'self_loops': True, 'use_snp_selection': True, 'num_snps': 47683}. Best is trial 51 with value: 0.37326597478568413.
[I 2025-12-08 17:39:33,590] Trial 58 finished with value: 0.30818364874008025 and parameters: {'model_type': 'gcn', 'hidden_dims': '[512, 64]', 'dropout': 0.16883478509620564, 'batch_norm': True, 'lr': 2.55309275507523e-05, 'weight_decay': 6.458977920828452e-06, 'epochs': 223, 'loss': 'mae', 'optimizer': 'adam', 'graph_mode': 'cutoff', 'cutoff': 0.5776670311508023, 'grm_norm': 'cosine', 'self_loops': True, 'use_snp_selection': True, 'num_snps': 56431}. Best is trial 51 with value: 0.37326597478568413.
[I 2025-12-08 17:40:03,489] Trial 59 finished with value: 0.3565572073905649 and parameters: {'model_type': 'gcn', 'hidden_dims': '[256, 128]', 'dropout': 0.24787893296463048, 'batch_norm': False, 'lr': 1.4079513753441287e-05, 'weight_decay': 1.318907614159428e-06, 'epochs': 171, 'loss': 'mae', 'optimizer': 'adam', 'graph_mode': 'cutoff', 'cutoff': 0.715009135731253, 'grm_norm': 'cosine_then_gcn', 'self_loops': True, 'use_snp_selection': True, 'num_snps': 43944}. Best is trial 51 with value: 0.37326597478568413.
[I 2025-12-08 17:40:28,031] Trial 60 finished with value: 0.33795997032177316 and parameters: {'model_type': 'gcn', 'hidden_dims': '[128, 64]', 'dropout': 0.368029246828452, 'batch_norm': False, 'lr': 6.252512109492115e-05, 'weight_decay': 8.200397274408539e-07, 'epochs': 161, 'loss': 'mae', 'optimizer': 'adam', 'graph_mode': 'knn', 'knn_k': 8, 'weighted_edges': True, 'symmetrize_mode': 'mutual', 'self_loops': True, 'use_snp_selection': True, 'num_snps': 48944}. Best is trial 51 with value: 0.37326597478568413.
[I 2025-12-08 17:40:51,243] Trial 61 finished with value: 0.35402233393355725 and parameters: {'model_type': 'gcn', 'hidden_dims': '[256, 128]', 'dropout': 0.3409447088912842, 'batch_norm': False, 'lr': 3.418862199682842e-05, 'weight_decay': 1.861315886523702e-06, 'epochs': 113, 'loss': 'mae', 'optimizer': 'adam', 'graph_mode': 'cutoff', 'cutoff': 0.7472146838235051, 'grm_norm': 'cosine_then_gcn', 'self_loops': True, 'use_snp_selection': True, 'num_snps': 39592}. Best is trial 51 with value: 0.37326597478568413.
[I 2025-12-08 17:41:19,529] Trial 62 finished with value: 0.36486679739937344 and parameters: {'model_type': 'gcn', 'hidden_dims': '[256, 128]', 'dropout': 0.19631123803769185, 'batch_norm': False, 'lr': 8.745183857950307e-05, 'weight_decay': 1.0500900883039626e-06, 'epochs': 151, 'loss': 'mae', 'optimizer': 'adam', 'graph_mode': 'cutoff', 'cutoff': 0.629181967857182, 'grm_norm': 'cosine_then_gcn', 'self_loops': True, 'use_snp_selection': True, 'num_snps': 44580}. Best is trial 51 with value: 0.37326597478568413.
[I 2025-12-08 17:41:48,546] Trial 63 finished with value: 0.3692489473917757 and parameters: {'model_type': 'gcn', 'hidden_dims': '[256, 128]', 'dropout': 0.22920658542518055, 'batch_norm': False, 'lr': 5.092929614636951e-05, 'weight_decay': 3.4997581932281697e-06, 'epochs': 152, 'loss': 'mae', 'optimizer': 'adam', 'graph_mode': 'cutoff', 'cutoff': 0.5531452915252081, 'grm_norm': 'cosine_then_gcn', 'self_loops': True, 'use_snp_selection': True, 'num_snps': 45365}. Best is trial 51 with value: 0.37326597478568413.
[I 2025-12-08 17:42:19,920] Trial 64 finished with value: 0.3602912493612746 and parameters: {'model_type': 'gcn', 'hidden_dims': '[256, 128, 64]', 'dropout': 0.2736813386133203, 'batch_norm': False, 'lr': 5.220047970485326e-05, 'weight_decay': 4.332277917825535e-06, 'epochs': 134, 'loss': 'mae', 'optimizer': 'adam', 'graph_mode': 'cutoff', 'cutoff': 0.5752527593515886, 'grm_norm': 'cosine_then_gcn', 'self_loops': True, 'use_snp_selection': True, 'num_snps': 54625}. Best is trial 51 with value: 0.37326597478568413.
[I 2025-12-08 17:42:53,744] Trial 65 finished with value: 0.36834312145473774 and parameters: {'model_type': 'gcn', 'hidden_dims': '[256, 128]', 'dropout': 0.22648491001531573, 'batch_norm': False, 'lr': 0.0001586588646205189, 'weight_decay': 6.327429070265634e-06, 'epochs': 210, 'loss': 'mae', 'optimizer': 'adam', 'graph_mode': 'cutoff', 'cutoff': 0.5451147507362869, 'grm_norm': 'cosine_then_gcn', 'self_loops': True, 'use_snp_selection': True, 'num_snps': 42474}. Best is trial 51 with value: 0.37326597478568413.
