[I 2025-12-08 13:34:14,384] Trial 27 finished with value: 0.26072016745870796 and parameters: {'model_type': 'gcn', 'hidden_dims': '[512, 128]', 'dropout': 0.5200739532278197, 'batch_norm': True, 'lr': 0.0025313061698075453, 'weight_decay': 0.0003438998719755054, 'epochs': 45, 'loss': 'mae', 'optimizer': 'adam', 'graph_mode': 'cutoff', 'cutoff': 0.5129232309840985, 'grm_norm': 'gcn', 'self_loops': False, 'use_snp_selection': False}. Best is trial 19 with value: 0.2893692195093963.
[I 2025-12-08 13:34:31,104] Trial 28 finished with value: 0.27803631444163546 and parameters: {'model_type': 'gcn', 'hidden_dims': '[256, 128, 64]', 'dropout': 0.5970451338406008, 'batch_norm': True, 'lr': 0.0012269698810246153, 'weight_decay': 0.0009123041907217333, 'epochs': 120, 'loss': 'mae', 'optimizer': 'adam', 'graph_mode': 'cutoff', 'cutoff': 0.68132052379732, 'grm_norm': 'cosine_then_gcn', 'self_loops': False, 'use_snp_selection': False}. Best is trial 19 with value: 0.2893692195093963.
[I 2025-12-08 13:34:56,476] Trial 29 finished with value: 0.21991575004434397 and parameters: {'model_type': 'gcn', 'hidden_dims': '[512, 128]', 'dropout': 0.5600743447653701, 'batch_norm': True, 'lr': 0.005698913698881787, 'weight_decay': 8.652269962387698e-05, 'epochs': 90, 'loss': 'mae', 'optimizer': 'adam', 'graph_mode': 'knn', 'knn_k': 10, 'weighted_edges': False, 'symmetrize_mode': 'mutual', 'self_loops': False, 'use_snp_selection': False}. Best is trial 19 with value: 0.2893692195093963.
[I 2025-12-08 13:35:14,742] Trial 30 finished with value: 0.27584258737585454 and parameters: {'model_type': 'gcn', 'hidden_dims': '[512, 128]', 'dropout': 0.39697708164207746, 'batch_norm': True, 'lr': 0.003199092406424833, 'weight_decay': 2.633447163361346e-05, 'epochs': 63, 'loss': 'mae', 'optimizer': 'adam', 'graph_mode': 'cutoff', 'cutoff': 0.5521192447504151, 'grm_norm': 'cosine_then_gcn', 'self_loops': False, 'use_snp_selection': False}. Best is trial 19 with value: 0.2893692195093963.
[I 2025-12-08 13:35:39,995] Trial 31 finished with value: 0.28597522837587813 and parameters: {'model_type': 'gcn', 'hidden_dims': '[512, 128]', 'dropout': 0.45895951736683505, 'batch_norm': True, 'lr': 0.0016593118914336798, 'weight_decay': 4.635155783726252e-06, 'epochs': 92, 'loss': 'mae', 'optimizer': 'adam', 'graph_mode': 'cutoff', 'cutoff': 0.7856389840789013, 'grm_norm': 'cosine_then_gcn', 'self_loops': False, 'use_snp_selection': False}. Best is trial 19 with value: 0.2893692195093963.
[I 2025-12-08 13:36:03,283] Trial 32 finished with value: 0.28338065434505244 and parameters: {'model_type': 'gcn', 'hidden_dims': '[512, 128]', 'dropout': 0.5261024434318643, 'batch_norm': True, 'lr': 0.0017331963957686, 'weight_decay': 3.7309025564990092e-06, 'epochs': 84, 'loss': 'mae', 'optimizer': 'adam', 'graph_mode': 'cutoff', 'cutoff': 0.8109364915504936, 'grm_norm': 'cosine_then_gcn', 'self_loops': False, 'use_snp_selection': False}. Best is trial 19 with value: 0.2893692195093963.
[I 2025-12-08 13:36:12,815] Trial 33 finished with value: 0.2922858784489335 and parameters: {'model_type': 'gcn', 'hidden_dims': '[256, 128, 64]', 'dropout': 0.5639941816843133, 'batch_norm': True, 'lr': 0.0007306216008880344, 'weight_decay': 8.796638363349573e-05, 'epochs': 60, 'loss': 'mae', 'optimizer': 'adam', 'graph_mode': 'cutoff', 'cutoff': 0.6891284429462864, 'grm_norm': 'cosine_then_gcn', 'self_loops': False, 'use_snp_selection': False}. Best is trial 33 with value: 0.2922858784489335.
[I 2025-12-08 13:36:21,402] Trial 34 finished with value: 0.2890742963424414 and parameters: {'model_type': 'gcn', 'hidden_dims': '[256, 128, 64]', 'dropout': 0.4665321747295245, 'batch_norm': True, 'lr': 0.0007304744953794151, 'weight_decay': 1.6125225576233906e-05, 'epochs': 52, 'loss': 'mae', 'optimizer': 'adam', 'graph_mode': 'cutoff', 'cutoff': 0.8111108517820917, 'grm_norm': 'cosine_then_gcn', 'self_loops': False, 'use_snp_selection': False}. Best is trial 33 with value: 0.2922858784489335.
[I 2025-12-08 13:36:30,416] Trial 35 finished with value: 0.21609539440108066 and parameters: {'model_type': 'gcn', 'hidden_dims': '[256, 128, 64]', 'dropout': 0.5596632349161417, 'batch_norm': True, 'lr': 0.0006340074548823901, 'weight_decay': 6.763096204193806e-05, 'epochs': 55, 'loss': 'mse', 'optimizer': 'adam', 'graph_mode': 'knn', 'knn_k': 1, 'weighted_edges': True, 'symmetrize_mode': 'union', 'self_loops': False, 'use_snp_selection': False}. Best is trial 33 with value: 0.2922858784489335.
[I 2025-12-08 13:36:52,247] Trial 36 finished with value: 0.294359031032711 and parameters: {'model_type': 'gcn', 'hidden_dims': '[256, 128, 64]', 'dropout': 0.48774604403056276, 'batch_norm': True, 'lr': 0.0008225291991045457, 'weight_decay': 1.6411177466631755e-05, 'epochs': 40, 'loss': 'mae', 'optimizer': 'adam', 'graph_mode': 'cutoff', 'cutoff': 0.8300770647698679, 'grm_norm': 'cosine_then_gcn', 'self_loops': False, 'use_snp_selection': True, 'num_snps': 55695}. Best is trial 36 with value: 0.294359031032711.
[I 2025-12-08 13:37:14,801] Trial 37 finished with value: 0.2880743097916083 and parameters: {'model_type': 'gcn', 'hidden_dims': '[256, 128, 64]', 'dropout': 0.4121741249824308, 'batch_norm': True, 'lr': 0.0004641880871922775, 'weight_decay': 0.00022992326967248488, 'epochs': 41, 'loss': 'mae', 'optimizer': 'adam', 'graph_mode': 'cutoff', 'cutoff': 0.6945482839084796, 'grm_norm': 'cosine_then_gcn', 'self_loops': False, 'use_snp_selection': True, 'num_snps': 58690}. Best is trial 36 with value: 0.294359031032711.
[I 2025-12-08 13:37:57,412] Trial 38 finished with value: 0.2782896257117248 and parameters: {'model_type': 'gcn', 'hidden_dims': '[256, 128, 64]', 'dropout': 0.3473102116244625, 'batch_norm': True, 'lr': 0.0008950211959589097, 'weight_decay': 2.383502268938942e-05, 'epochs': 304, 'loss': 'mse', 'optimizer': 'adam', 'graph_mode': 'cutoff', 'cutoff': 0.8421120035974203, 'grm_norm': 'gcn', 'self_loops': True, 'use_snp_selection': True, 'num_snps': 42466}. Best is trial 36 with value: 0.294359031032711.
[I 2025-12-08 13:38:18,540] Trial 39 finished with value: 0.2614509824525605 and parameters: {'model_type': 'gcn', 'hidden_dims': '[256, 128, 64]', 'dropout': 0.49274826752640866, 'batch_norm': True, 'lr': 0.0002827987977509644, 'weight_decay': 6.865911687502509e-05, 'epochs': 59, 'loss': 'mae', 'optimizer': 'adam', 'graph_mode': 'knn', 'knn_k': 6, 'weighted_edges': True, 'symmetrize_mode': 'union', 'self_loops': False, 'use_snp_selection': True, 'num_snps': 44445}. Best is trial 36 with value: 0.294359031032711.
[I 2025-12-08 13:38:33,066] Trial 40 finished with value: 0.26479879326414396 and parameters: {'model_type': 'gcn', 'hidden_dims': '[256, 128, 64]', 'dropout': 0.4669328732041379, 'batch_norm': False, 'lr': 0.000584499347606322, 'weight_decay': 0.000492872150456735, 'epochs': 68, 'loss': 'mse', 'optimizer': 'adam', 'graph_mode': 'cutoff', 'cutoff': 0.6689587089835388, 'grm_norm': 'cosine', 'self_loops': False, 'use_snp_selection': True, 'num_snps': 20466}. Best is trial 36 with value: 0.294359031032711.
[I 2025-12-08 13:38:55,618] Trial 41 finished with value: 0.280581056747344 and parameters: {'model_type': 'gcn', 'hidden_dims': '[256, 128, 64]', 'dropout': 0.4205726902365808, 'batch_norm': True, 'lr': 0.0004183780811305077, 'weight_decay': 0.00022112725129658684, 'epochs': 42, 'loss': 'mae', 'optimizer': 'adam', 'graph_mode': 'cutoff', 'cutoff': 0.6879351128204026, 'grm_norm': 'cosine_then_gcn', 'self_loops': False, 'use_snp_selection': True, 'num_snps': 58281}. Best is trial 36 with value: 0.294359031032711.
[I 2025-12-08 13:39:39,871] Trial 42 finished with value: 0.27564570590310583 and parameters: {'model_type': 'gcn', 'hidden_dims': '[256, 128, 64]', 'dropout': 0.4084537455842188, 'batch_norm': True, 'lr': 0.00042529948037366464, 'weight_decay': 0.0005440104059430164, 'epochs': 220, 'loss': 'mae', 'optimizer': 'adam', 'graph_mode': 'cutoff', 'cutoff': 0.8231001604791642, 'grm_norm': 'cosine_then_gcn', 'self_loops': False, 'use_snp_selection': True, 'num_snps': 59022}. Best is trial 36 with value: 0.294359031032711.
[I 2025-12-08 13:40:05,595] Trial 43 finished with value: 0.28127374387453496 and parameters: {'model_type': 'gcn', 'hidden_dims': '[512, 64]', 'dropout': 0.3704403152797009, 'batch_norm': True, 'lr': 0.0005482376952559148, 'weight_decay': 3.589474339966426e-05, 'epochs': 51, 'loss': 'mae', 'optimizer': 'adam', 'graph_mode': 'cutoff', 'cutoff': 0.6943089079353265, 'grm_norm': 'none', 'self_loops': False, 'use_snp_selection': True, 'num_snps': 49009}. Best is trial 36 with value: 0.294359031032711.
[I 2025-12-08 13:40:22,442] Trial 44 finished with value: 0.2978012528173976 and parameters: {'model_type': 'gcn', 'hidden_dims': '[256, 128, 64]', 'dropout': 0.504882811930969, 'batch_norm': True, 'lr': 0.0008438870582780945, 'weight_decay': 0.0002087779091911122, 'epochs': 40, 'loss': 'mae', 'optimizer': 'adam', 'graph_mode': 'cutoff', 'cutoff': 0.8996783862371694, 'grm_norm': 'gcn', 'self_loops': False, 'use_snp_selection': True, 'num_snps': 35882}. Best is trial 44 with value: 0.2978012528173976.
[I 2025-12-08 13:40:42,001] Trial 45 finished with value: 0.2854196540746815 and parameters: {'model_type': 'gcn', 'hidden_dims': '[256, 128, 64]', 'dropout': 0.5446436625236393, 'batch_norm': True, 'lr': 0.0008151358851349872, 'weight_decay': 5.6024816180503897e-05, 'epochs': 75, 'loss': 'mae', 'optimizer': 'adam', 'graph_mode': 'cutoff', 'cutoff': 0.8957994654164303, 'grm_norm': 'gcn', 'self_loops': True, 'use_snp_selection': True, 'num_snps': 35863}. Best is trial 44 with value: 0.2978012528173976.
[I 2025-12-08 13:41:00,205] Trial 46 finished with value: 0.28392755842279355 and parameters: {'model_type': 'gcn', 'hidden_dims': '[256, 128, 64]', 'dropout': 0.14712992067053976, 'batch_norm': True, 'lr': 0.0011670489088507882, 'weight_decay': 1.1509704781839559e-05, 'epochs': 59, 'loss': 'mae', 'optimizer': 'adam', 'graph_mode': 'cutoff', 'cutoff': 0.8419313646846138, 'grm_norm': 'gcn', 'self_loops': False, 'use_snp_selection': True, 'num_snps': 35327}. Best is trial 44 with value: 0.2978012528173976.
[I 2025-12-08 13:41:20,284] Trial 47 finished with value: 0.27192169753377715 and parameters: {'model_type': 'gcn', 'hidden_dims': '[128, 64]', 'dropout': 0.5741404908448988, 'batch_norm': True, 'lr': 0.001904234247538353, 'weight_decay': 1.2932308844574897e-06, 'epochs': 317, 'loss': 'mae', 'optimizer': 'adam', 'graph_mode': 'cutoff', 'cutoff': 0.7687007110378711, 'grm_norm': 'gcn', 'self_loops': False, 'use_snp_selection': True, 'num_snps': 20562}. Best is trial 44 with value: 0.2978012528173976.
[I 2025-12-08 13:41:41,706] Trial 48 finished with value: 0.24659906406830578 and parameters: {'model_type': 'gcn', 'hidden_dims': '[256, 128, 64]', 'dropout': 0.509579306865838, 'batch_norm': False, 'lr': 0.0003192531085710737, 'weight_decay': 8.752753128391819e-05, 'epochs': 98, 'loss': 'mae', 'optimizer': 'adam', 'graph_mode': 'cutoff', 'cutoff': 0.8585095713693176, 'grm_norm': 'gcn', 'self_loops': True, 'use_snp_selection': True, 'num_snps': 36588}. Best is trial 44 with value: 0.2978012528173976.
[I 2025-12-08 13:42:06,335] Trial 49 finished with value: 0.28802515202265494 and parameters: {'model_type': 'gcn', 'hidden_dims': '[512, 64]', 'dropout': 0.44450958790988643, 'batch_norm': True, 'lr': 0.0007071270585421081, 'weight_decay': 0.0002090938414273655, 'epochs': 40, 'loss': 'mse', 'optimizer': 'adam', 'graph_mode': 'cutoff', 'cutoff': 0.8082801656301116, 'grm_norm': 'cosine', 'self_loops': False, 'use_snp_selection': True, 'num_snps': 51454}. Best is trial 44 with value: 0.2978012528173976.
[I 2025-12-08 13:42:29,100] Trial 50 finished with value: 0.19739214230768415 and parameters: {'model_type': 'gcn', 'hidden_dims': '[256, 128, 64]', 'dropout': 0.26974992091801375, 'batch_norm': True, 'lr': 0.0011181352057326303, 'weight_decay': 2.4772815734476318e-05, 'epochs': 197, 'loss': 'mae', 'optimizer': 'adam', 'graph_mode': 'knn', 'knn_k': 8, 'weighted_edges': False, 'symmetrize_mode': 'mutual', 'self_loops': False, 'use_snp_selection': True, 'num_snps': 21998}. Best is trial 44 with value: 0.2978012528173976.
[I 2025-12-08 13:42:50,525] Trial 51 finished with value: 0.2866502555957024 and parameters: {'model_type': 'gcn', 'hidden_dims': '[256, 128, 64]', 'dropout': 0.4747498742286008, 'batch_norm': True, 'lr': 0.0004935015928629813, 'weight_decay': 0.0002488214732597378, 'epochs': 40, 'loss': 'mae', 'optimizer': 'adam', 'graph_mode': 'cutoff', 'cutoff': 0.8943506855460363, 'grm_norm': 'cosine_then_gcn', 'self_loops': False, 'use_snp_selection': True, 'num_snps': 54451}. Best is trial 44 with value: 0.2978012528173976.
[I 2025-12-08 13:43:11,614] Trial 52 finished with value: 0.29055701888481394 and parameters: {'model_type': 'gcn', 'hidden_dims': '[256, 128, 64]', 'dropout': 0.4841049025569996, 'batch_norm': True, 'lr': 0.00037965938181521813, 'weight_decay': 4.648031977086602e-05, 'epochs': 55, 'loss': 'mae', 'optimizer': 'adam', 'graph_mode': 'cutoff', 'cutoff': 0.8274007992619778, 'grm_norm': 'none', 'self_loops': False, 'use_snp_selection': True, 'num_snps': 47634}. Best is trial 44 with value: 0.2978012528173976.
[I 2025-12-08 13:43:39,562] Trial 53 finished with value: 0.2944588318401288 and parameters: {'model_type': 'gcn', 'hidden_dims': '[512, 256]', 'dropout': 0.5426132221323984, 'batch_norm': True, 'lr': 0.0002634945771605167, 'weight_decay': 4.45210158628871e-05, 'epochs': 67, 'loss': 'mae', 'optimizer': 'adam', 'graph_mode': 'cutoff', 'cutoff': 0.832077133970913, 'grm_norm': 'none', 'self_loops': False, 'use_snp_selection': True, 'num_snps': 47173}. Best is trial 44 with value: 0.2978012528173976.
[I 2025-12-08 13:44:10,414] Trial 54 finished with value: 0.2885116275627622 and parameters: {'model_type': 'gcn', 'hidden_dims': '[512, 256]', 'dropout': 0.5391344164760886, 'batch_norm': True, 'lr': 0.0002678314507563646, 'weight_decay': 4.6296057223001936e-05, 'epochs': 84, 'loss': 'mae', 'optimizer': 'adam', 'graph_mode': 'cutoff', 'cutoff': 0.8557544678386964, 'grm_norm': 'none', 'self_loops': False, 'use_snp_selection': True, 'num_snps': 46816}. Best is trial 44 with value: 0.2978012528173976.
[I 2025-12-08 13:44:35,415] Trial 55 finished with value: 0.27608482308098087 and parameters: {'model_type': 'gcn', 'hidden_dims': '[512, 256]', 'dropout': 0.5672886507570654, 'batch_norm': True, 'lr': 0.00016460716593510042, 'weight_decay': 8.781425773976413e-05, 'epochs': 67, 'loss': 'mae', 'optimizer': 'adam', 'graph_mode': 'cutoff', 'cutoff': 0.5961926980415333, 'grm_norm': 'none', 'self_loops': False, 'use_snp_selection': True, 'num_snps': 40048}. Best is trial 44 with value: 0.2978012528173976.
[I 2025-12-08 13:45:15,747] Trial 56 finished with value: 0.28738613674709323 and parameters: {'model_type': 'gcn', 'hidden_dims': '[512, 256]', 'dropout': 0.5064879437135313, 'batch_norm': True, 'lr': 0.00010540118584320159, 'weight_decay': 3.619066427718789e-05, 'epochs': 133, 'loss': 'mae', 'optimizer': 'adam', 'graph_mode': 'cutoff', 'cutoff': 0.7450915254913152, 'grm_norm': 'none', 'self_loops': True, 'use_snp_selection': True, 'num_snps': 48573}. Best is trial 44 with value: 0.2978012528173976.
[I 2025-12-08 13:46:25,756] Trial 57 finished with value: 0.2875912273921621 and parameters: {'model_type': 'gcn', 'hidden_dims': '[512, 256]', 'dropout': 0.4837180001169594, 'batch_norm': False, 'lr': 4.8080535757719344e-05, 'weight_decay': 0.0001619683322603309, 'epochs': 265, 'loss': 'mae', 'optimizer': 'adam', 'graph_mode': 'cutoff', 'cutoff': 0.8655590900902195, 'grm_norm': 'none', 'self_loops': False, 'use_snp_selection': True, 'num_snps': 54790}. Best is trial 44 with value: 0.2978012528173976.
[I 2025-12-08 13:46:45,088] Trial 58 finished with value: 0.28337270746572757 and parameters: {'model_type': 'gcn', 'hidden_dims': '[128, 64]', 'dropout': 0.5442106167685408, 'batch_norm': True, 'lr': 0.00034721006982949974, 'weight_decay': 1.6355469527326642e-07, 'epochs': 110, 'loss': 'mae', 'optimizer': 'adam', 'graph_mode': 'cutoff', 'cutoff': 0.8339914496832957, 'grm_norm': 'none', 'self_loops': False, 'use_snp_selection': True, 'num_snps': 40620}. Best is trial 44 with value: 0.2978012528173976.
[I 2025-12-08 13:47:07,504] Trial 59 finished with value: 0.24370033686915438 and parameters: {'model_type': 'gcn', 'hidden_dims': '[512, 64]', 'dropout': 0.5742257204012431, 'batch_norm': True, 'lr': 0.0002426237523984657, 'weight_decay': 1.0331262747220131e-05, 'epochs': 73, 'loss': 'mae', 'optimizer': 'adam', 'graph_mode': 'cutoff', 'cutoff': 0.35462231802142963, 'grm_norm': 'none', 'self_loops': False, 'use_snp_selection': True, 'num_snps': 31720}. Best is trial 44 with value: 0.2978012528173976.
[I 2025-12-08 13:47:32,772] Trial 60 finished with value: 0.2880944478781119 and parameters: {'model_type': 'gcn', 'hidden_dims': '[512, 256]', 'dropout': 0.4478171450849334, 'batch_norm': True, 'lr': 0.0009748101646509478, 'weight_decay': 0.00010781589719606498, 'epochs': 56, 'loss': 'mae', 'optimizer': 'adam', 'graph_mode': 'cutoff', 'cutoff': 0.7640248220827626, 'grm_norm': 'none', 'self_loops': False, 'use_snp_selection': True, 'num_snps': 45249}. Best is trial 44 with value: 0.2978012528173976.
[I 2025-12-08 13:47:41,921] Trial 61 finished with value: 0.2934040524973004 and parameters: {'model_type': 'gcn', 'hidden_dims': '[256, 128, 64]', 'dropout': 0.5050321688344767, 'batch_norm': True, 'lr': 0.0007153997765517323, 'weight_decay': 2.03652395080158e-05, 'epochs': 57, 'loss': 'mae', 'optimizer': 'adam', 'graph_mode': 'cutoff', 'cutoff': 0.8030929709966047, 'grm_norm': 'cosine', 'self_loops': False, 'use_snp_selection': False}. Best is trial 44 with value: 0.2978012528173976.
[I 2025-12-08 13:47:50,352] Trial 62 finished with value: 0.2877494990714219 and parameters: {'model_type': 'gcn', 'hidden_dims': '[256, 128, 64]', 'dropout': 0.5134198217564917, 'batch_norm': True, 'lr': 0.0013994158546383837, 'weight_decay': 5.5875657879085846e-05, 'epochs': 51, 'loss': 'mae', 'optimizer': 'adam', 'graph_mode': 'cutoff', 'cutoff': 0.8683250290128571, 'grm_norm': 'cosine', 'self_loops': False, 'use_snp_selection': False}. Best is trial 44 with value: 0.2978012528173976.
[I 2025-12-08 13:48:15,311] Trial 63 finished with value: 0.2801255416582863 and parameters: {'model_type': 'gcn', 'hidden_dims': '[256, 128, 64]', 'dropout': 0.49412211849186294, 'batch_norm': True, 'lr': 0.00019923898928978046, 'weight_decay': 6.426656138797824e-06, 'epochs': 82, 'loss': 'mae', 'optimizer': 'adam', 'graph_mode': 'cutoff', 'cutoff': 0.7925703647953453, 'grm_norm': 'cosine', 'self_loops': False, 'use_snp_selection': True, 'num_snps': 50877}. Best is trial 44 with value: 0.2978012528173976.
[I 2025-12-08 13:48:25,318] Trial 64 finished with value: 0.29263418927805523 and parameters: {'model_type': 'gcn', 'hidden_dims': '[256, 128, 64]', 'dropout': 0.5296935689397463, 'batch_norm': True, 'lr': 0.00035220042215324687, 'weight_decay': 3.0111193011349677e-05, 'epochs': 64, 'loss': 'mae', 'optimizer': 'adam', 'graph_mode': 'cutoff', 'cutoff': 0.730055438559885, 'grm_norm': 'cosine', 'self_loops': False, 'use_snp_selection': False}. Best is trial 44 with value: 0.2978012528173976.
[I 2025-12-08 13:48:39,410] Trial 65 finished with value: 0.2876004354267404 and parameters: {'model_type': 'gcn', 'hidden_dims': '[256, 128, 64]', 'dropout': 0.5321021477627911, 'batch_norm': True, 'lr': 0.0003629107439633149, 'weight_decay': 2.783161783511588e-05, 'epochs': 98, 'loss': 'mae', 'optimizer': 'adam', 'graph_mode': 'cutoff', 'cutoff': 0.7539382813817974, 'grm_norm': 'cosine', 'self_loops': False, 'use_snp_selection': False}. Best is trial 44 with value: 0.2978012528173976.
[I 2025-12-08 13:49:03,810] Trial 66 finished with value: 0.2908250221305851 and parameters: {'model_type': 'gcn', 'hidden_dims': '[256, 128, 64]', 'dropout': 0.5780405257515735, 'batch_norm': True, 'lr': 0.0006496166400585922, 'weight_decay': 2.042127229092253e-05, 'epochs': 66, 'loss': 'mae', 'optimizer': 'adam', 'graph_mode': 'cutoff', 'cutoff': 0.8784049234728557, 'grm_norm': 'cosine', 'self_loops': False, 'use_snp_selection': True, 'num_snps': 54876}. Best is trial 44 with value: 0.2978012528173976.
[I 2025-12-08 13:49:14,326] Trial 67 finished with value: 0.0 and parameters: {'model_type': 'gcn', 'hidden_dims': '[256, 128, 64]', 'dropout': 0.5796512007533923, 'batch_norm': False, 'lr': 0.0005417086114312217, 'weight_decay': 1.9875406337905345e-05, 'epochs': 69, 'loss': 'mae', 'optimizer': 'adam', 'graph_mode': 'cutoff', 'cutoff': 0.8998884600837569, 'grm_norm': 'cosine', 'self_loops': False, 'use_snp_selection': False}. Best is trial 44 with value: 0.2978012528173976.
[I 2025-12-08 13:49:27,649] Trial 68 finished with value: 0.21434766248332626 and parameters: {'model_type': 'gcn', 'hidden_dims': '[256, 128, 64]', 'dropout': 0.5531666281217773, 'batch_norm': True, 'lr': 0.0001340240653905379, 'weight_decay': 1.2614179958821585e-05, 'epochs': 90, 'loss': 'mse', 'optimizer': 'adam', 'graph_mode': 'knn', 'knn_k': 3, 'weighted_edges': True, 'symmetrize_mode': 'mutual', 'self_loops': False, 'use_snp_selection': False}. Best is trial 44 with value: 0.2978012528173976.
[I 2025-12-08 13:49:37,798] Trial 69 finished with value: 0.1774201320186387 and parameters: {'model_type': 'gcn', 'hidden_dims': '[256, 128, 64]', 'dropout': 0.5826632236708684, 'batch_norm': True, 'lr': 1.2359740001114269e-05, 'weight_decay': 7.687552478158155e-06, 'epochs': 65, 'loss': 'mae', 'optimizer': 'adam', 'graph_mode': 'cutoff', 'cutoff': 0.8698496748621279, 'grm_norm': 'cosine', 'self_loops': True, 'use_snp_selection': False}. Best is trial 44 with value: 0.2978012528173976.
