[I 2025-12-08 19:20:25,839] Trial 130 finished with value: 0.34684732229183296 and parameters: {'model_type': 'gcn', 'hidden_dims': '[512, 128]', 'dropout': 0.5512472095058233, 'batch_norm': False, 'lr': 7.834973181701471e-05, 'weight_decay': 2.3950748425669115e-05, 'epochs': 67, 'loss': 'mae', 'optimizer': 'adam', 'graph_mode': 'cutoff', 'cutoff': 0.5709332023010073, 'grm_norm': 'cosine', 'self_loops': False, 'use_snp_selection': True, 'num_snps': 28511}. Best is trial 73 with value: 0.36806197678801444.
[I 2025-12-08 19:20:43,737] Trial 131 finished with value: 0.36309384330406014 and parameters: {'model_type': 'gcn', 'hidden_dims': '[512, 128]', 'dropout': 0.46215227218196175, 'batch_norm': False, 'lr': 0.00011430828156936463, 'weight_decay': 4.9447755289811904e-05, 'epochs': 77, 'loss': 'mae', 'optimizer': 'adam', 'graph_mode': 'cutoff', 'cutoff': 0.8982318081582654, 'grm_norm': 'cosine', 'self_loops': False, 'use_snp_selection': True, 'num_snps': 21367}. Best is trial 73 with value: 0.36806197678801444.
[I 2025-12-08 19:20:59,904] Trial 132 finished with value: 0.3477573523125136 and parameters: {'model_type': 'gcn', 'hidden_dims': '[512, 128]', 'dropout': 0.45894482000511183, 'batch_norm': False, 'lr': 0.0001094159032522151, 'weight_decay': 3.5361541477405003e-05, 'epochs': 57, 'loss': 'mae', 'optimizer': 'adam', 'graph_mode': 'cutoff', 'cutoff': 0.8951569565881777, 'grm_norm': 'cosine', 'self_loops': False, 'use_snp_selection': True, 'num_snps': 21200}. Best is trial 73 with value: 0.36806197678801444.
[I 2025-12-08 19:21:19,442] Trial 133 finished with value: 0.3545122190440441 and parameters: {'model_type': 'gcn', 'hidden_dims': '[512, 128]', 'dropout': 0.48680819302037953, 'batch_norm': False, 'lr': 4.024228549264286e-05, 'weight_decay': 4.6862539907544826e-05, 'epochs': 85, 'loss': 'mae', 'optimizer': 'adam', 'graph_mode': 'cutoff', 'cutoff': 0.8465072183709635, 'grm_norm': 'cosine', 'self_loops': False, 'use_snp_selection': True, 'num_snps': 23604}. Best is trial 73 with value: 0.36806197678801444.
[I 2025-12-08 19:21:39,167] Trial 134 finished with value: 0.3494954663666746 and parameters: {'model_type': 'gcn', 'hidden_dims': '[512, 128]', 'dropout': 0.45722074955730213, 'batch_norm': False, 'lr': 5.969467132154092e-05, 'weight_decay': 6.378754683754767e-05, 'epochs': 77, 'loss': 'mae', 'optimizer': 'adam', 'graph_mode': 'cutoff', 'cutoff': 0.7713073329792314, 'grm_norm': 'cosine', 'self_loops': False, 'use_snp_selection': True, 'num_snps': 25760}. Best is trial 73 with value: 0.36806197678801444.
[I 2025-12-08 19:21:55,538] Trial 135 finished with value: 0.34965103999093833 and parameters: {'model_type': 'gcn', 'hidden_dims': '[512, 128]', 'dropout': 0.5366280503652757, 'batch_norm': False, 'lr': 0.00012835482745881605, 'weight_decay': 5.132289099588038e-05, 'epochs': 64, 'loss': 'mae', 'optimizer': 'adam', 'graph_mode': 'cutoff', 'cutoff': 0.8573668837941848, 'grm_norm': 'cosine', 'self_loops': False, 'use_snp_selection': True, 'num_snps': 20426}. Best is trial 73 with value: 0.36806197678801444.
[I 2025-12-08 19:22:19,135] Trial 136 finished with value: 0.3454616333049375 and parameters: {'model_type': 'gcn', 'hidden_dims': '[512, 128]', 'dropout': 0.5176410620197656, 'batch_norm': False, 'lr': 6.787865044255903e-05, 'weight_decay': 3.019678707101764e-05, 'epochs': 93, 'loss': 'mae', 'optimizer': 'adam', 'graph_mode': 'cutoff', 'cutoff': 0.8824344813608742, 'grm_norm': 'cosine', 'self_loops': False, 'use_snp_selection': True, 'num_snps': 30145}. Best is trial 73 with value: 0.36806197678801444.
[I 2025-12-08 19:22:35,415] Trial 137 finished with value: 0.31954356248807264 and parameters: {'model_type': 'gcn', 'hidden_dims': '[512, 128]', 'dropout': 0.49991564502203906, 'batch_norm': False, 'lr': 0.00015276191377125117, 'weight_decay': 0.00014209192368662643, 'epochs': 52, 'loss': 'mae', 'optimizer': 'adam', 'graph_mode': 'cutoff', 'cutoff': 0.8177493210225303, 'grm_norm': 'cosine', 'self_loops': False, 'use_snp_selection': True, 'num_snps': 22620}. Best is trial 73 with value: 0.36806197678801444.
[I 2025-12-08 19:22:55,139] Trial 138 finished with value: 0.3461642182945461 and parameters: {'model_type': 'gcn', 'hidden_dims': '[512, 128]', 'dropout': 0.4971610227726102, 'batch_norm': False, 'lr': 9.972457606366846e-05, 'weight_decay': 9.252784788385344e-05, 'epochs': 70, 'loss': 'mse', 'optimizer': 'adam', 'graph_mode': 'cutoff', 'cutoff': 0.8597563380353521, 'grm_norm': 'cosine', 'self_loops': False, 'use_snp_selection': True, 'num_snps': 27418}. Best is trial 73 with value: 0.36806197678801444.
[I 2025-12-08 19:23:11,100] Trial 139 finished with value: 0.33074038311585074 and parameters: {'model_type': 'gcn', 'hidden_dims': '[256, 128, 64]', 'dropout': 0.46437359553537283, 'batch_norm': False, 'lr': 0.00012551374485400994, 'weight_decay': 3.8315803567258004e-05, 'epochs': 75, 'loss': 'mae', 'optimizer': 'adam', 'graph_mode': 'knn', 'knn_k': 5, 'weighted_edges': True, 'symmetrize_mode': 'mutual', 'self_loops': False, 'use_snp_selection': True, 'num_snps': 23966}. Best is trial 73 with value: 0.36806197678801444.
[I 2025-12-08 19:23:37,720] Trial 140 finished with value: 0.3050472265985225 and parameters: {'model_type': 'gcn', 'hidden_dims': '[512, 128]', 'dropout': 0.5458053662225594, 'batch_norm': False, 'lr': 8.555920758123964e-05, 'weight_decay': 7.056797341996294e-05, 'epochs': 99, 'loss': 'mae', 'optimizer': 'adam', 'graph_mode': 'cutoff', 'cutoff': 0.8398454316936922, 'grm_norm': 'gcn', 'self_loops': True, 'use_snp_selection': False}. Best is trial 73 with value: 0.36806197678801444.
[I 2025-12-08 19:23:54,914] Trial 141 finished with value: 0.3572383268354489 and parameters: {'model_type': 'gcn', 'hidden_dims': '[512, 128]', 'dropout': 0.44871848387746754, 'batch_norm': False, 'lr': 0.00020934275907722502, 'weight_decay': 2.5336524412745663e-05, 'epochs': 84, 'loss': 'mae', 'optimizer': 'adam', 'graph_mode': 'cutoff', 'cutoff': 0.8681880728876059, 'grm_norm': 'cosine_then_gcn', 'self_loops': False, 'use_snp_selection': True, 'num_snps': 18827}. Best is trial 73 with value: 0.36806197678801444.
[I 2025-12-08 19:24:10,792] Trial 142 finished with value: 0.3472068299788824 and parameters: {'model_type': 'gcn', 'hidden_dims': '[512, 128]', 'dropout': 0.47738671327954335, 'batch_norm': False, 'lr': 0.000752758931089219, 'weight_decay': 5.736571878814317e-05, 'epochs': 64, 'loss': 'mae', 'optimizer': 'adam', 'graph_mode': 'cutoff', 'cutoff': 0.8783696764983254, 'grm_norm': 'none', 'self_loops': False, 'use_snp_selection': True, 'num_snps': 19504}. Best is trial 73 with value: 0.36806197678801444.
[I 2025-12-08 19:24:24,888] Trial 143 finished with value: 0.3461000836441377 and parameters: {'model_type': 'gcn', 'hidden_dims': '[256, 128, 64]', 'dropout': 0.4240257577814698, 'batch_norm': False, 'lr': 0.00011487538220846518, 'weight_decay': 4.512573786087583e-05, 'epochs': 89, 'loss': 'mae', 'optimizer': 'adam', 'graph_mode': 'cutoff', 'cutoff': 0.8955881491312356, 'grm_norm': 'cosine', 'self_loops': False, 'use_snp_selection': True, 'num_snps': 16233}. Best is trial 73 with value: 0.36806197678801444.
[I 2025-12-08 19:24:38,958] Trial 144 finished with value: 0.3555958335340178 and parameters: {'model_type': 'gcn', 'hidden_dims': '[512, 128]', 'dropout': 0.48062444730291226, 'batch_norm': False, 'lr': 0.00015149326200945596, 'weight_decay': 2.240505059833433e-05, 'epochs': 74, 'loss': 'mae', 'optimizer': 'adam', 'graph_mode': 'cutoff', 'cutoff': 0.8998140303093424, 'grm_norm': 'none', 'self_loops': False, 'use_snp_selection': True, 'num_snps': 13936}. Best is trial 73 with value: 0.36806197678801444.
[I 2025-12-08 19:24:51,620] Trial 145 finished with value: 0.2917627491052815 and parameters: {'model_type': 'gcn', 'hidden_dims': '[128, 64]', 'dropout': 0.527327333774944, 'batch_norm': True, 'lr': 0.0004101559456565293, 'weight_decay': 3.098192924318132e-05, 'epochs': 56, 'loss': 'mae', 'optimizer': 'adam', 'graph_mode': 'cutoff', 'cutoff': 0.2791213523481835, 'grm_norm': 'none', 'self_loops': False, 'use_snp_selection': True, 'num_snps': 21477}. Best is trial 73 with value: 0.36806197678801444.
[I 2025-12-08 19:25:05,899] Trial 146 finished with value: 0.3287023279401428 and parameters: {'model_type': 'gcn', 'hidden_dims': '[256, 128, 64]', 'dropout': 0.5099489398703574, 'batch_norm': False, 'lr': 0.000266808160975729, 'weight_decay': 3.932578594544046e-05, 'epochs': 83, 'loss': 'mae', 'optimizer': 'adam', 'graph_mode': 'cutoff', 'cutoff': 0.8214327474093939, 'grm_norm': 'cosine', 'self_loops': False, 'use_snp_selection': True, 'num_snps': 17346}. Best is trial 73 with value: 0.36806197678801444.
[I 2025-12-08 19:25:28,745] Trial 147 finished with value: 0.3467964476892583 and parameters: {'model_type': 'gcn', 'hidden_dims': '[512, 256]', 'dropout': 0.5140276835962323, 'batch_norm': False, 'lr': 0.0001959368969196419, 'weight_decay': 5.2697659039174e-05, 'epochs': 113, 'loss': 'mae', 'optimizer': 'adam', 'graph_mode': 'cutoff', 'cutoff': 0.8017875264721266, 'grm_norm': 'none', 'self_loops': False, 'use_snp_selection': True, 'num_snps': 24974}. Best is trial 73 with value: 0.36806197678801444.
[I 2025-12-08 19:25:48,916] Trial 148 finished with value: 0.35697455590279553 and parameters: {'model_type': 'gcn', 'hidden_dims': '[512, 128]', 'dropout': 0.1307777916513834, 'batch_norm': False, 'lr': 0.0002221155863559721, 'weight_decay': 6.555937698734852e-05, 'epochs': 69, 'loss': 'mae', 'optimizer': 'adam', 'graph_mode': 'cutoff', 'cutoff': 0.8422330205584785, 'grm_norm': 'none', 'self_loops': False, 'use_snp_selection': True, 'num_snps': 29121}. Best is trial 73 with value: 0.36806197678801444.
[I 2025-12-08 19:26:11,331] Trial 149 finished with value: 0.3492546226629499 and parameters: {'model_type': 'gcn', 'hidden_dims': '[512, 256]', 'dropout': 0.1227868277855645, 'batch_norm': False, 'lr': 0.00013085005374671865, 'weight_decay': 3.3883732898397665e-05, 'epochs': 77, 'loss': 'mae', 'optimizer': 'adam', 'graph_mode': 'cutoff', 'cutoff': 0.6809299395823265, 'grm_norm': 'cosine', 'self_loops': False, 'use_snp_selection': True, 'num_snps': 31360}. Best is trial 73 with value: 0.36806197678801444.
[I 2025-12-08 19:26:38,990] Trial 0 finished with value: 0.30300875894457935 and parameters: {'model_type': 'gcn', 'hidden_dims': '[128, 64]', 'dropout': 0.199031432379812, 'batch_norm': True, 'lr': 1.8408544111075823e-05, 'weight_decay': 5.5136510071208614e-05, 'epochs': 336, 'loss': 'mae', 'optimizer': 'adam', 'graph_mode': 'knn', 'knn_k': 8, 'weighted_edges': True, 'symmetrize_mode': 'mutual', 'self_loops': True, 'use_snp_selection': True, 'num_snps': 27173}. Best is trial 0 with value: 0.30300875894457935.
[I 2025-12-08 19:27:17,417] Trial 1 finished with value: 0.22849472968594492 and parameters: {'model_type': 'gcn', 'hidden_dims': '[256, 128, 64]', 'dropout': 0.5543244404043342, 'batch_norm': True, 'lr': 7.981787657617978e-05, 'weight_decay': 2.8571789869344834e-07, 'epochs': 297, 'loss': 'mae', 'optimizer': 'adam', 'graph_mode': 'cutoff', 'cutoff': 0.3392632777751686, 'grm_norm': 'gcn', 'self_loops': False, 'use_snp_selection': False}. Best is trial 0 with value: 0.30300875894457935.
[I 2025-12-08 19:28:15,057] Trial 2 finished with value: 0.25862849977308855 and parameters: {'model_type': 'gcn', 'hidden_dims': '[512, 64]', 'dropout': 0.32815227354739207, 'batch_norm': True, 'lr': 0.000619605044204259, 'weight_decay': 0.0004086269831625786, 'epochs': 206, 'loss': 'mse', 'optimizer': 'adam', 'graph_mode': 'knn', 'knn_k': 4, 'weighted_edges': True, 'symmetrize_mode': 'union', 'self_loops': True, 'use_snp_selection': True, 'num_snps': 53035}. Best is trial 0 with value: 0.30300875894457935.
[I 2025-12-08 19:28:42,642] Trial 3 finished with value: 0.2584005734056895 and parameters: {'model_type': 'gcn', 'hidden_dims': '[256, 128]', 'dropout': 0.23110783056597514, 'batch_norm': True, 'lr': 8.11311593386298e-05, 'weight_decay': 9.296158109581328e-07, 'epochs': 213, 'loss': 'mse', 'optimizer': 'adam', 'graph_mode': 'knn', 'knn_k': 10, 'weighted_edges': True, 'symmetrize_mode': 'mutual', 'self_loops': True, 'use_snp_selection': False}. Best is trial 0 with value: 0.30300875894457935.
[I 2025-12-08 19:28:57,054] Trial 4 finished with value: 0.33997610083378726 and parameters: {'model_type': 'gcn', 'hidden_dims': '[512, 256]', 'dropout': 0.2753281956415665, 'batch_norm': True, 'lr': 0.00034435188114839693, 'weight_decay': 4.9416012835950194e-05, 'epochs': 89, 'loss': 'mae', 'optimizer': 'adam', 'graph_mode': 'cutoff', 'cutoff': 0.820078967317394, 'grm_norm': 'none', 'self_loops': False, 'use_snp_selection': True, 'num_snps': 12674}. Best is trial 4 with value: 0.33997610083378726.
[I 2025-12-08 19:29:22,228] Trial 5 finished with value: 0.3081565151180479 and parameters: {'model_type': 'gcn', 'hidden_dims': '[128, 64]', 'dropout': 0.5611163934517731, 'batch_norm': True, 'lr': 0.0003984856210762587, 'weight_decay': 1.1466743517565185e-07, 'epochs': 344, 'loss': 'mae', 'optimizer': 'adam', 'graph_mode': 'cutoff', 'cutoff': 0.6089370799714728, 'grm_norm': 'gcn', 'self_loops': True, 'use_snp_selection': False}. Best is trial 4 with value: 0.33997610083378726.
[I 2025-12-08 19:29:44,503] Trial 6 finished with value: 0.31140908878380713 and parameters: {'model_type': 'gcn', 'hidden_dims': '[128, 64]', 'dropout': 0.31805912766941713, 'batch_norm': True, 'lr': 1.2361026034262557e-05, 'weight_decay': 6.492620232791903e-06, 'epochs': 271, 'loss': 'mse', 'optimizer': 'adam', 'graph_mode': 'cutoff', 'cutoff': 0.6193362582230448, 'grm_norm': 'cosine', 'self_loops': False, 'use_snp_selection': True, 'num_snps': 28594}. Best is trial 4 with value: 0.33997610083378726.
[I 2025-12-08 19:30:04,275] Trial 7 finished with value: 0.284023392035939 and parameters: {'model_type': 'gcn', 'hidden_dims': '[512, 64]', 'dropout': 0.471337288649717, 'batch_norm': True, 'lr': 2.239693207292708e-05, 'weight_decay': 2.263166635514082e-06, 'epochs': 69, 'loss': 'mse', 'optimizer': 'adam', 'graph_mode': 'cutoff', 'cutoff': 0.4056820886426376, 'grm_norm': 'cosine', 'self_loops': False, 'use_snp_selection': False}. Best is trial 4 with value: 0.33997610083378726.
[I 2025-12-08 19:30:41,633] Trial 8 finished with value: 0.34853520398222443 and parameters: {'model_type': 'gcn', 'hidden_dims': '[512, 256]', 'dropout': 0.20659328268932406, 'batch_norm': False, 'lr': 8.93315124361372e-05, 'weight_decay': 0.00028987480727919035, 'epochs': 136, 'loss': 'mae', 'optimizer': 'adam', 'graph_mode': 'knn', 'knn_k': 3, 'weighted_edges': False, 'symmetrize_mode': 'union', 'self_loops': False, 'use_snp_selection': True, 'num_snps': 43128}. Best is trial 8 with value: 0.34853520398222443.
[I 2025-12-08 19:31:23,799] Trial 9 finished with value: 0.004190674517297549 and parameters: {'model_type': 'gcn', 'hidden_dims': '[512, 256]', 'dropout': 0.2888209592870401, 'batch_norm': False, 'lr': 0.004734648143129892, 'weight_decay': 1.5879705591356368e-06, 'epochs': 163, 'loss': 'mse', 'optimizer': 'adam', 'graph_mode': 'cutoff', 'cutoff': 0.5984899797909019, 'grm_norm': 'cosine', 'self_loops': True, 'use_snp_selection': False}. Best is trial 8 with value: 0.34853520398222443.
[I 2025-12-08 19:32:07,430] Trial 10 finished with value: 0.19764089164353824 and parameters: {'model_type': 'gcn', 'hidden_dims': '[512, 128]', 'dropout': 0.11372025982957354, 'batch_norm': False, 'lr': 0.003103244461089801, 'weight_decay': 0.0005470336746827727, 'epochs': 132, 'loss': 'mae', 'optimizer': 'adam', 'graph_mode': 'knn', 'knn_k': 1, 'weighted_edges': False, 'symmetrize_mode': 'union', 'self_loops': False, 'use_snp_selection': True, 'num_snps': 54954}. Best is trial 8 with value: 0.34853520398222443.
[I 2025-12-08 19:32:16,723] Trial 11 finished with value: 0.34994458039917264 and parameters: {'model_type': 'gcn', 'hidden_dims': '[512, 256]', 'dropout': 0.42375068792780446, 'batch_norm': False, 'lr': 0.00010033123508823038, 'weight_decay': 7.216460907874714e-05, 'epochs': 58, 'loss': 'mae', 'optimizer': 'adam', 'graph_mode': 'knn', 'knn_k': 3, 'weighted_edges': False, 'symmetrize_mode': 'union', 'self_loops': False, 'use_snp_selection': True, 'num_snps': 2111}. Best is trial 11 with value: 0.34994458039917264.
[I 2025-12-08 19:32:26,767] Trial 12 finished with value: 0.3491396560754029 and parameters: {'model_type': 'gcn', 'hidden_dims': '[512, 256]', 'dropout': 0.41797846692127566, 'batch_norm': False, 'lr': 9.706079753625655e-05, 'weight_decay': 8.919843417327887e-05, 'epochs': 56, 'loss': 'mae', 'optimizer': 'adam', 'graph_mode': 'knn', 'knn_k': 3, 'weighted_edges': False, 'symmetrize_mode': 'union', 'self_loops': False, 'use_snp_selection': True, 'num_snps': 4371}. Best is trial 11 with value: 0.34994458039917264.
[I 2025-12-08 19:32:36,090] Trial 13 finished with value: 0.34565311619883 and parameters: {'model_type': 'gcn', 'hidden_dims': '[512, 256]', 'dropout': 0.42766815921350765, 'batch_norm': False, 'lr': 0.0001318472862910559, 'weight_decay': 6.137151088293401e-05, 'epochs': 53, 'loss': 'mae', 'optimizer': 'adam', 'graph_mode': 'knn', 'knn_k': 2, 'weighted_edges': False, 'symmetrize_mode': 'union', 'self_loops': False, 'use_snp_selection': True, 'num_snps': 2604}. Best is trial 11 with value: 0.34994458039917264.
[I 2025-12-08 19:32:45,434] Trial 14 finished with value: 0.3183469098440641 and parameters: {'model_type': 'gcn', 'hidden_dims': '[512, 256]', 'dropout': 0.39025590022985424, 'batch_norm': False, 'lr': 0.0011211060956895814, 'weight_decay': 1.5987943852564768e-05, 'epochs': 43, 'loss': 'mae', 'optimizer': 'adam', 'graph_mode': 'knn', 'knn_k': 5, 'weighted_edges': False, 'symmetrize_mode': 'union', 'self_loops': False, 'use_snp_selection': True, 'num_snps': 2897}. Best is trial 11 with value: 0.34994458039917264.
[I 2025-12-08 19:33:03,892] Trial 15 finished with value: 0.3619146601312601 and parameters: {'model_type': 'gcn', 'hidden_dims': '[512, 128]', 'dropout': 0.46689080254430715, 'batch_norm': False, 'lr': 4.6436270466763265e-05, 'weight_decay': 0.00011587449827120337, 'epochs': 109, 'loss': 'mae', 'optimizer': 'adam', 'graph_mode': 'knn', 'knn_k': 6, 'weighted_edges': False, 'symmetrize_mode': 'union', 'self_loops': False, 'use_snp_selection': True, 'num_snps': 16325}. Best is trial 15 with value: 0.3619146601312601.
[I 2025-12-08 19:33:23,590] Trial 16 finished with value: 0.35255103473878024 and parameters: {'model_type': 'gcn', 'hidden_dims': '[512, 128]', 'dropout': 0.4948661716505008, 'batch_norm': False, 'lr': 3.365884843283151e-05, 'weight_decay': 1.206598344911284e-05, 'epochs': 112, 'loss': 'mae', 'optimizer': 'adam', 'graph_mode': 'knn', 'knn_k': 7, 'weighted_edges': False, 'symmetrize_mode': 'union', 'self_loops': False, 'use_snp_selection': True, 'num_snps': 17771}. Best is trial 15 with value: 0.3619146601312601.
[I 2025-12-08 19:33:43,017] Trial 17 finished with value: 0.34485526218667656 and parameters: {'model_type': 'gcn', 'hidden_dims': '[512, 128]', 'dropout': 0.5012600234775284, 'batch_norm': False, 'lr': 3.5048403772179016e-05, 'weight_decay': 1.171264460263239e-05, 'epochs': 108, 'loss': 'mae', 'optimizer': 'adam', 'graph_mode': 'knn', 'knn_k': 7, 'weighted_edges': False, 'symmetrize_mode': 'mutual', 'self_loops': False, 'use_snp_selection': True, 'num_snps': 18744}. Best is trial 15 with value: 0.3619146601312601.
[I 2025-12-08 19:34:07,276] Trial 18 finished with value: 0.35627861479197864 and parameters: {'model_type': 'gcn', 'hidden_dims': '[512, 128]', 'dropout': 0.49329408958869886, 'batch_norm': False, 'lr': 4.0270002212631986e-05, 'weight_decay': 4.737402151711997e-06, 'epochs': 184, 'loss': 'mae', 'optimizer': 'adam', 'graph_mode': 'knn', 'knn_k': 7, 'weighted_edges': False, 'symmetrize_mode': 'union', 'self_loops': False, 'use_snp_selection': True, 'num_snps': 16549}. Best is trial 15 with value: 0.3619146601312601.
[I 2025-12-08 19:34:48,290] Trial 19 finished with value: 0.35764522133690263 and parameters: {'model_type': 'gcn', 'hidden_dims': '[512, 128]', 'dropout': 0.5974450262611403, 'batch_norm': False, 'lr': 1.0657529983256715e-05, 'weight_decay': 3.48244839851461e-06, 'epochs': 175, 'loss': 'mae', 'optimizer': 'adam', 'graph_mode': 'knn', 'knn_k': 6, 'weighted_edges': False, 'symmetrize_mode': 'union', 'self_loops': False, 'use_snp_selection': True, 'num_snps': 39347}. Best is trial 15 with value: 0.3619146601312601.
[I 2025-12-08 19:35:36,678] Trial 20 finished with value: 0.3510822148512818 and parameters: {'model_type': 'gcn', 'hidden_dims': '[512, 128]', 'dropout': 0.5894596399686717, 'batch_norm': False, 'lr': 1.094150593781111e-05, 'weight_decay': 0.0009779251420613847, 'epochs': 254, 'loss': 'mae', 'optimizer': 'adam', 'graph_mode': 'knn', 'knn_k': 5, 'weighted_edges': True, 'symmetrize_mode': 'mutual', 'self_loops': False, 'use_snp_selection': True, 'num_snps': 35522}. Best is trial 15 with value: 0.3619146601312601.
[I 2025-12-08 19:36:17,815] Trial 21 finished with value: 0.3559141120708963 and parameters: {'model_type': 'gcn', 'hidden_dims': '[512, 128]', 'dropout': 0.5369249985050563, 'batch_norm': False, 'lr': 3.998271784897639e-05, 'weight_decay': 4.686275707053296e-06, 'epochs': 179, 'loss': 'mae', 'optimizer': 'adam', 'graph_mode': 'knn', 'knn_k': 7, 'weighted_edges': False, 'symmetrize_mode': 'union', 'self_loops': False, 'use_snp_selection': True, 'num_snps': 38078}. Best is trial 15 with value: 0.3619146601312601.
[I 2025-12-08 19:36:49,087] Trial 22 finished with value: 0.3580883271224589 and parameters: {'model_type': 'gcn', 'hidden_dims': '[512, 128]', 'dropout': 0.46707363732307583, 'batch_norm': False, 'lr': 4.6596939478832713e-05, 'weight_decay': 6.594441795460936e-07, 'epochs': 229, 'loss': 'mae', 'optimizer': 'adam', 'graph_mode': 'knn', 'knn_k': 9, 'weighted_edges': False, 'symmetrize_mode': 'union', 'self_loops': False, 'use_snp_selection': True, 'num_snps': 19991}. Best is trial 15 with value: 0.3619146601312601.
