[I 2025-12-08 11:34:19,652] Trial 24 finished with value: 0.2974586150143663 and parameters: {'model_type': 'gcn', 'hidden_dims': '[256, 128, 64]', 'dropout': 0.5925100138457364, 'batch_norm': True, 'lr': 0.0013749550604149519, 'weight_decay': 2.1890548124447657e-05, 'epochs': 70, 'loss': 'mae', 'optimizer': 'adam', 'graph_mode': 'cutoff', 'cutoff': 0.8074375297203191, 'grm_norm': 'cosine_then_gcn', 'self_loops': False, 'use_snp_selection': False}. Best is trial 21 with value: 0.30229010457691874.
[I 2025-12-08 11:34:42,195] Trial 25 finished with value: 0.28687334833141603 and parameters: {'model_type': 'gcn', 'hidden_dims': '[256, 128, 64]', 'dropout': 0.5223623282287204, 'batch_norm': True, 'lr': 0.0025613414353606962, 'weight_decay': 0.00017136504274960982, 'epochs': 166, 'loss': 'mae', 'optimizer': 'adam', 'graph_mode': 'cutoff', 'cutoff': 0.7005296579713898, 'grm_norm': 'cosine_then_gcn', 'self_loops': False, 'use_snp_selection': False}. Best is trial 21 with value: 0.30229010457691874.
[I 2025-12-08 11:34:54,468] Trial 26 finished with value: -0.0049433405434013925 and parameters: {'model_type': 'gcn', 'hidden_dims': '[256, 128, 64]', 'dropout': 0.5445786838209645, 'batch_norm': False, 'lr': 0.0010319532656663537, 'weight_decay': 5.365400659331467e-06, 'epochs': 79, 'loss': 'mse', 'optimizer': 'adam', 'graph_mode': 'knn', 'knn_k': 7, 'weighted_edges': False, 'symmetrize_mode': 'union', 'self_loops': False, 'use_snp_selection': False}. Best is trial 21 with value: 0.30229010457691874.
[I 2025-12-08 11:35:12,298] Trial 27 finished with value: 0.2946302563258861 and parameters: {'model_type': 'gcn', 'hidden_dims': '[256, 128, 64]', 'dropout': 0.49699687812339594, 'batch_norm': True, 'lr': 0.0006532032266723396, 'weight_decay': 2.3078953847344823e-05, 'epochs': 128, 'loss': 'mae', 'optimizer': 'adam', 'graph_mode': 'cutoff', 'cutoff': 0.800652106930048, 'grm_norm': 'cosine_then_gcn', 'self_loops': False, 'use_snp_selection': False}. Best is trial 21 with value: 0.30229010457691874.
[I 2025-12-08 11:35:29,528] Trial 28 finished with value: 0.2648376703828961 and parameters: {'model_type': 'gcn', 'hidden_dims': '[256, 128, 64]', 'dropout': 0.5138472588666859, 'batch_norm': True, 'lr': 0.0015837376605507794, 'weight_decay': 8.748859305653402e-05, 'epochs': 123, 'loss': 'mae', 'optimizer': 'adam', 'graph_mode': 'cutoff', 'cutoff': 0.524753544805934, 'grm_norm': 'cosine_then_gcn', 'self_loops': False, 'use_snp_selection': False}. Best is trial 21 with value: 0.30229010457691874.
[I 2025-12-08 11:35:48,960] Trial 29 finished with value: 0.2175124288771167 and parameters: {'model_type': 'gcn', 'hidden_dims': '[256, 128, 64]', 'dropout': 0.4871928108987933, 'batch_norm': True, 'lr': 0.003701497494153351, 'weight_decay': 3.213688350551779e-05, 'epochs': 137, 'loss': 'mae', 'optimizer': 'adam', 'graph_mode': 'knn', 'knn_k': 10, 'weighted_edges': True, 'symmetrize_mode': 'mutual', 'self_loops': False, 'use_snp_selection': False}. Best is trial 21 with value: 0.30229010457691874.
[I 2025-12-08 11:35:57,155] Trial 30 finished with value: 0.2959546219842804 and parameters: {'model_type': 'gcn', 'hidden_dims': '[256, 128, 64]', 'dropout': 0.5607181127746199, 'batch_norm': True, 'lr': 0.006155743993020579, 'weight_decay': 1.2175832902599447e-05, 'epochs': 50, 'loss': 'mae', 'optimizer': 'adam', 'graph_mode': 'cutoff', 'cutoff': 0.7834801649151693, 'grm_norm': 'gcn', 'self_loops': False, 'use_snp_selection': False}. Best is trial 21 with value: 0.30229010457691874.
[I 2025-12-08 11:36:05,954] Trial 31 finished with value: 0.3024739777675074 and parameters: {'model_type': 'gcn', 'hidden_dims': '[256, 128, 64]', 'dropout': 0.5664102281105131, 'batch_norm': True, 'lr': 0.00991035568128284, 'weight_decay': 1.0928102861726113e-05, 'epochs': 55, 'loss': 'mae', 'optimizer': 'adam', 'graph_mode': 'cutoff', 'cutoff': 0.7962113078905978, 'grm_norm': 'gcn', 'self_loops': False, 'use_snp_selection': False}. Best is trial 31 with value: 0.3024739777675074.
[I 2025-12-08 11:36:12,960] Trial 32 finished with value: 0.29060289157117 and parameters: {'model_type': 'gcn', 'hidden_dims': '[256, 128, 64]', 'dropout': 0.5637889957352337, 'batch_norm': True, 'lr': 0.00986442876910954, 'weight_decay': 9.557432185798056e-06, 'epochs': 40, 'loss': 'mae', 'optimizer': 'adam', 'graph_mode': 'cutoff', 'cutoff': 0.7523530474900844, 'grm_norm': 'gcn', 'self_loops': False, 'use_snp_selection': False}. Best is trial 31 with value: 0.3024739777675074.
[I 2025-12-08 11:36:22,244] Trial 33 finished with value: 0.29161038240244785 and parameters: {'model_type': 'gcn', 'hidden_dims': '[256, 128, 64]', 'dropout': 0.5470807074867103, 'batch_norm': True, 'lr': 0.005592695999291657, 'weight_decay': 3.320295438272802e-06, 'epochs': 59, 'loss': 'mae', 'optimizer': 'adam', 'graph_mode': 'cutoff', 'cutoff': 0.8943114190604959, 'grm_norm': 'gcn', 'self_loops': False, 'use_snp_selection': False}. Best is trial 31 with value: 0.3024739777675074.
[I 2025-12-08 11:36:45,655] Trial 34 finished with value: 0.29510563352429564 and parameters: {'model_type': 'gcn', 'hidden_dims': '[512, 64]', 'dropout': 0.5758182694890316, 'batch_norm': True, 'lr': 0.006836431571988994, 'weight_decay': 1.0808350047357386e-05, 'epochs': 85, 'loss': 'mae', 'optimizer': 'adam', 'graph_mode': 'cutoff', 'cutoff': 0.6906506293462504, 'grm_norm': 'gcn', 'self_loops': False, 'use_snp_selection': False}. Best is trial 31 with value: 0.3024739777675074.
[I 2025-12-08 11:36:54,572] Trial 35 finished with value: 0.2314400678504994 and parameters: {'model_type': 'gcn', 'hidden_dims': '[256, 128]', 'dropout': 0.5331101875245938, 'batch_norm': True, 'lr': 0.003725178976347418, 'weight_decay': 7.318503813595372e-05, 'epochs': 56, 'loss': 'mse', 'optimizer': 'adam', 'graph_mode': 'knn', 'knn_k': 1, 'weighted_edges': False, 'symmetrize_mode': 'union', 'self_loops': False, 'use_snp_selection': False}. Best is trial 31 with value: 0.3024739777675074.
[I 2025-12-08 11:37:33,796] Trial 36 finished with value: 0.28530898184574705 and parameters: {'model_type': 'gcn', 'hidden_dims': '[256, 128, 64]', 'dropout': 0.5614505129363234, 'batch_norm': True, 'lr': 0.003078836597057658, 'weight_decay': 9.92606364629176e-07, 'epochs': 307, 'loss': 'mae', 'optimizer': 'adam', 'graph_mode': 'cutoff', 'cutoff': 0.7964617760874498, 'grm_norm': 'gcn', 'self_loops': False, 'use_snp_selection': False}. Best is trial 31 with value: 0.3024739777675074.
[I 2025-12-08 11:37:46,209] Trial 37 finished with value: 0.2973238955663057 and parameters: {'model_type': 'gcn', 'hidden_dims': '[256, 128, 64]', 'dropout': 0.5737174468931984, 'batch_norm': True, 'lr': 0.0065977864675239185, 'weight_decay': 1.1705251029259036e-05, 'epochs': 85, 'loss': 'mae', 'optimizer': 'adam', 'graph_mode': 'cutoff', 'cutoff': 0.6503151736348052, 'grm_norm': 'gcn', 'self_loops': False, 'use_snp_selection': False}. Best is trial 31 with value: 0.3024739777675074.
[I 2025-12-08 11:38:10,371] Trial 38 finished with value: 0.2896458369828366 and parameters: {'model_type': 'gcn', 'hidden_dims': '[512, 128]', 'dropout': 0.5923540691416376, 'batch_norm': True, 'lr': 0.0013996075748022154, 'weight_decay': 5.1675272661735965e-05, 'epochs': 88, 'loss': 'mse', 'optimizer': 'adam', 'graph_mode': 'cutoff', 'cutoff': 0.6449880673769751, 'grm_norm': 'gcn', 'self_loops': False, 'use_snp_selection': False}. Best is trial 31 with value: 0.3024739777675074.
[I 2025-12-08 11:38:25,929] Trial 39 finished with value: 0.2690035161718155 and parameters: {'model_type': 'gcn', 'hidden_dims': '[256, 128, 64]', 'dropout': 0.46258170580347857, 'batch_norm': True, 'lr': 0.0006953792299814445, 'weight_decay': 6.425323237644857e-06, 'epochs': 106, 'loss': 'mae', 'optimizer': 'adam', 'graph_mode': 'knn', 'knn_k': 5, 'weighted_edges': True, 'symmetrize_mode': 'union', 'self_loops': False, 'use_snp_selection': False}. Best is trial 31 with value: 0.3024739777675074.
[I 2025-12-08 11:39:23,313] Trial 40 finished with value: 0.0 and parameters: {'model_type': 'gcn', 'hidden_dims': '[512, 64]', 'dropout': 0.4052080165846593, 'batch_norm': False, 'lr': 0.004741187777819914, 'weight_decay': 1.8834522514958012e-06, 'epochs': 227, 'loss': 'mse', 'optimizer': 'adam', 'graph_mode': 'cutoff', 'cutoff': 0.7287086854163473, 'grm_norm': 'gcn', 'self_loops': False, 'use_snp_selection': False}. Best is trial 31 with value: 0.3024739777675074.
[I 2025-12-08 11:39:32,116] Trial 41 finished with value: 0.2940112001173991 and parameters: {'model_type': 'gcn', 'hidden_dims': '[256, 128, 64]', 'dropout': 0.5668654472862867, 'batch_norm': True, 'lr': 0.006744222314802107, 'weight_decay': 1.2663511933574653e-05, 'epochs': 55, 'loss': 'mae', 'optimizer': 'adam', 'graph_mode': 'cutoff', 'cutoff': 0.8016216482239683, 'grm_norm': 'gcn', 'self_loops': False, 'use_snp_selection': False}. Best is trial 31 with value: 0.3024739777675074.
[I 2025-12-08 11:39:43,912] Trial 42 finished with value: 0.29563718680093193 and parameters: {'model_type': 'gcn', 'hidden_dims': '[256, 128, 64]', 'dropout': 0.5366037074088948, 'batch_norm': True, 'lr': 0.008157958573663197, 'weight_decay': 3.4970647778680855e-06, 'epochs': 80, 'loss': 'mae', 'optimizer': 'adam', 'graph_mode': 'cutoff', 'cutoff': 0.8426354294342242, 'grm_norm': 'gcn', 'self_loops': False, 'use_snp_selection': False}. Best is trial 31 with value: 0.3024739777675074.
[I 2025-12-08 11:39:52,577] Trial 43 finished with value: 0.2958876504891016 and parameters: {'model_type': 'gcn', 'hidden_dims': '[256, 128, 64]', 'dropout': 0.5725076744243949, 'batch_norm': True, 'lr': 0.002087437371978836, 'weight_decay': 2.6551783032500792e-05, 'epochs': 54, 'loss': 'mae', 'optimizer': 'adam', 'graph_mode': 'cutoff', 'cutoff': 0.6588335476322413, 'grm_norm': 'gcn', 'self_loops': False, 'use_snp_selection': False}. Best is trial 31 with value: 0.3024739777675074.
[I 2025-12-08 11:40:05,242] Trial 44 finished with value: 0.2904388962467154 and parameters: {'model_type': 'gcn', 'hidden_dims': '[256, 128, 64]', 'dropout': 0.3561197205496971, 'batch_norm': True, 'lr': 0.004999772177522323, 'weight_decay': 7.112489995989308e-06, 'epochs': 87, 'loss': 'mae', 'optimizer': 'adam', 'graph_mode': 'cutoff', 'cutoff': 0.7732296254248604, 'grm_norm': 'gcn', 'self_loops': False, 'use_snp_selection': False}. Best is trial 31 with value: 0.3024739777675074.
[I 2025-12-08 11:40:21,199] Trial 45 finished with value: 0.27531476480122874 and parameters: {'model_type': 'gcn', 'hidden_dims': '[256, 128]', 'dropout': 0.5480466838728077, 'batch_norm': True, 'lr': 0.0034730235965226143, 'weight_decay': 1.2440276952327662e-05, 'epochs': 119, 'loss': 'mae', 'optimizer': 'adam', 'graph_mode': 'cutoff', 'cutoff': 0.5651461659512312, 'grm_norm': 'gcn', 'self_loops': False, 'use_snp_selection': False}. Best is trial 31 with value: 0.3024739777675074.
[I 2025-12-08 11:40:32,198] Trial 46 finished with value: 0.29576453409739506 and parameters: {'model_type': 'gcn', 'hidden_dims': '[256, 128, 64]', 'dropout': 0.5012503347893598, 'batch_norm': True, 'lr': 0.007347263922296827, 'weight_decay': 3.698665481705115e-05, 'epochs': 72, 'loss': 'mae', 'optimizer': 'adam', 'graph_mode': 'cutoff', 'cutoff': 0.8393425713116506, 'grm_norm': 'cosine', 'self_loops': False, 'use_snp_selection': False}. Best is trial 31 with value: 0.3024739777675074.
[I 2025-12-08 11:40:58,274] Trial 47 finished with value: 0.29397392527607646 and parameters: {'model_type': 'gcn', 'hidden_dims': '[512, 128]', 'dropout': 0.4753374910592513, 'batch_norm': True, 'lr': 0.0027393907316041882, 'weight_decay': 4.40219799858742e-06, 'epochs': 96, 'loss': 'mae', 'optimizer': 'adam', 'graph_mode': 'cutoff', 'cutoff': 0.7216878488426108, 'grm_norm': 'gcn', 'self_loops': False, 'use_snp_selection': False}. Best is trial 31 with value: 0.3024739777675074.
[I 2025-12-08 11:41:24,012] Trial 48 finished with value: 0.12262315552326183 and parameters: {'model_type': 'gcn', 'hidden_dims': '[512, 64]', 'dropout': 0.599021131471111, 'batch_norm': False, 'lr': 0.0001240914434092251, 'weight_decay': 7.64698585127999e-06, 'epochs': 40, 'loss': 'mae', 'optimizer': 'adam', 'graph_mode': 'cutoff', 'cutoff': 0.6365929253004432, 'grm_norm': 'cosine', 'self_loops': True, 'use_snp_selection': True, 'num_snps': 55272}. Best is trial 31 with value: 0.3024739777675074.
[I 2025-12-08 11:42:05,563] Trial 49 finished with value: 0.28859680921647013 and parameters: {'model_type': 'gcn', 'hidden_dims': '[256, 128, 64]', 'dropout': 0.5775962410125333, 'batch_norm': True, 'lr': 0.0004803555477824645, 'weight_decay': 1.1141054843305034e-06, 'epochs': 327, 'loss': 'mse', 'optimizer': 'adam', 'graph_mode': 'cutoff', 'cutoff': 0.8683081359135923, 'grm_norm': 'gcn', 'self_loops': False, 'use_snp_selection': False}. Best is trial 31 with value: 0.3024739777675074.
[I 2025-12-08 11:42:26,370] Trial 50 finished with value: 0.22708103532236365 and parameters: {'model_type': 'gcn', 'hidden_dims': '[256, 128, 64]', 'dropout': 0.5150426551821349, 'batch_norm': True, 'lr': 0.0008374743646057932, 'weight_decay': 5.6378330537730346e-05, 'epochs': 149, 'loss': 'mae', 'optimizer': 'adam', 'graph_mode': 'knn', 'knn_k': 7, 'weighted_edges': False, 'symmetrize_mode': 'mutual', 'self_loops': False, 'use_snp_selection': False}. Best is trial 31 with value: 0.3024739777675074.
[I 2025-12-08 11:42:34,917] Trial 51 finished with value: 0.3077853407165048 and parameters: {'model_type': 'gcn', 'hidden_dims': '[256, 128, 64]', 'dropout': 0.5702752805089428, 'batch_norm': True, 'lr': 0.001921162005674319, 'weight_decay': 2.7884880357421598e-05, 'epochs': 52, 'loss': 'mae', 'optimizer': 'adam', 'graph_mode': 'cutoff', 'cutoff': 0.6503250294480852, 'grm_norm': 'gcn', 'self_loops': False, 'use_snp_selection': False}. Best is trial 51 with value: 0.3077853407165048.
[I 2025-12-08 11:42:43,427] Trial 52 finished with value: 0.29220484145836084 and parameters: {'model_type': 'gcn', 'hidden_dims': '[256, 128, 64]', 'dropout': 0.5521265173998569, 'batch_norm': True, 'lr': 0.0016912390814873856, 'weight_decay': 2.7339725631626906e-05, 'epochs': 52, 'loss': 'mae', 'optimizer': 'adam', 'graph_mode': 'cutoff', 'cutoff': 0.5819170643205767, 'grm_norm': 'gcn', 'self_loops': False, 'use_snp_selection': False}. Best is trial 51 with value: 0.3077853407165048.
[I 2025-12-08 11:42:53,390] Trial 53 finished with value: 0.2654293766967828 and parameters: {'model_type': 'gcn', 'hidden_dims': '[256, 128, 64]', 'dropout': 0.5350369604556546, 'batch_norm': True, 'lr': 0.004395918623072554, 'weight_decay': 1.4531471081562705e-05, 'epochs': 64, 'loss': 'mae', 'optimizer': 'adam', 'graph_mode': 'cutoff', 'cutoff': 0.5398560776698695, 'grm_norm': 'gcn', 'self_loops': False, 'use_snp_selection': False}. Best is trial 51 with value: 0.3077853407165048.
[I 2025-12-08 11:43:22,210] Trial 54 finished with value: 0.2404154349754032 and parameters: {'model_type': 'gcn', 'hidden_dims': '[128, 64]', 'dropout': 0.582373603109256, 'batch_norm': True, 'lr': 0.0011647967095282377, 'weight_decay': 4.1466825084206055e-05, 'epochs': 261, 'loss': 'mae', 'optimizer': 'adam', 'graph_mode': 'cutoff', 'cutoff': 0.4905543650589981, 'grm_norm': 'gcn', 'self_loops': True, 'use_snp_selection': True, 'num_snps': 45615}. Best is trial 51 with value: 0.3077853407165048.
[I 2025-12-08 11:43:36,256] Trial 55 finished with value: 0.28595670283369107 and parameters: {'model_type': 'gcn', 'hidden_dims': '[256, 128, 64]', 'dropout': 0.56261201350336, 'batch_norm': True, 'lr': 0.005721965723481095, 'weight_decay': 0.00012106064043124927, 'epochs': 97, 'loss': 'mae', 'optimizer': 'adam', 'graph_mode': 'cutoff', 'cutoff': 0.66433948070809, 'grm_norm': 'cosine', 'self_loops': False, 'use_snp_selection': False}. Best is trial 51 with value: 0.3077853407165048.
[I 2025-12-08 11:43:46,357] Trial 56 finished with value: 0.2886131882585135 and parameters: {'model_type': 'gcn', 'hidden_dims': '[256, 128]', 'dropout': 0.18060836292393753, 'batch_norm': True, 'lr': 0.009631125629060489, 'weight_decay': 2.6931478411777947e-06, 'epochs': 67, 'loss': 'mae', 'optimizer': 'adam', 'graph_mode': 'cutoff', 'cutoff': 0.6174616166111728, 'grm_norm': 'cosine_then_gcn', 'self_loops': False, 'use_snp_selection': False}. Best is trial 51 with value: 0.3077853407165048.
[I 2025-12-08 11:44:16,242] Trial 57 finished with value: 0.0 and parameters: {'model_type': 'gcn', 'hidden_dims': '[512, 256]', 'dropout': 0.5219409117424286, 'batch_norm': False, 'lr': 0.0025612464857703026, 'weight_decay': 1.9706518048302197e-05, 'epochs': 112, 'loss': 'mae', 'optimizer': 'adam', 'graph_mode': 'cutoff', 'cutoff': 0.7866969393173718, 'grm_norm': 'none', 'self_loops': False, 'use_snp_selection': False}. Best is trial 51 with value: 0.3077853407165048.
[I 2025-12-08 11:44:36,031] Trial 58 finished with value: 0.2949808923558536 and parameters: {'model_type': 'gcn', 'hidden_dims': '[256, 128, 64]', 'dropout': 0.5818918345322747, 'batch_norm': True, 'lr': 0.0005175320147804684, 'weight_decay': 5.029007175921104e-07, 'epochs': 77, 'loss': 'mae', 'optimizer': 'adam', 'graph_mode': 'cutoff', 'cutoff': 0.7268494208714101, 'grm_norm': 'gcn', 'self_loops': True, 'use_snp_selection': True, 'num_snps': 35618}. Best is trial 51 with value: 0.3077853407165048.
[I 2025-12-08 11:45:02,537] Trial 59 finished with value: 0.29440292265809787 and parameters: {'model_type': 'gcn', 'hidden_dims': '[256, 128, 64]', 'dropout': 0.43340823854431243, 'batch_norm': True, 'lr': 0.00025038641052050036, 'weight_decay': 6.655825179501036e-05, 'epochs': 200, 'loss': 'mae', 'optimizer': 'adam', 'graph_mode': 'cutoff', 'cutoff': 0.8225232381845371, 'grm_norm': 'cosine_then_gcn', 'self_loops': False, 'use_snp_selection': False}. Best is trial 51 with value: 0.3077853407165048.
[I 2025-12-08 11:45:17,402] Trial 60 finished with value: 0.29703315324345353 and parameters: {'model_type': 'gcn', 'hidden_dims': '[512, 128]', 'dropout': 0.2506721701637967, 'batch_norm': True, 'lr': 0.0021574640331039757, 'weight_decay': 0.00021344563524793999, 'epochs': 49, 'loss': 'mae', 'optimizer': 'adam', 'graph_mode': 'cutoff', 'cutoff': 0.8751678679322367, 'grm_norm': 'gcn', 'self_loops': False, 'use_snp_selection': False}. Best is trial 51 with value: 0.3077853407165048.
[I 2025-12-08 11:45:32,210] Trial 61 finished with value: 0.28546772946461874 and parameters: {'model_type': 'gcn', 'hidden_dims': '[512, 128]', 'dropout': 0.2724879900957224, 'batch_norm': True, 'lr': 0.002050684157645184, 'weight_decay': 0.0005553433615842974, 'epochs': 49, 'loss': 'mae', 'optimizer': 'adam', 'graph_mode': 'cutoff', 'cutoff': 0.8671091127700951, 'grm_norm': 'gcn', 'self_loops': False, 'use_snp_selection': False}. Best is trial 51 with value: 0.3077853407165048.
[I 2025-12-08 11:45:50,332] Trial 62 finished with value: 0.26045035700282476 and parameters: {'model_type': 'gcn', 'hidden_dims': '[512, 128]', 'dropout': 0.24797102974807184, 'batch_norm': True, 'lr': 0.0012168460089177421, 'weight_decay': 0.000220191628872321, 'epochs': 62, 'loss': 'mae', 'optimizer': 'adam', 'graph_mode': 'cutoff', 'cutoff': 0.41298203431841923, 'grm_norm': 'gcn', 'self_loops': False, 'use_snp_selection': False}. Best is trial 51 with value: 0.3077853407165048.
[I 2025-12-08 11:46:04,861] Trial 63 finished with value: 0.28841587940015884 and parameters: {'model_type': 'gcn', 'hidden_dims': '[512, 128]', 'dropout': 0.306504609204701, 'batch_norm': True, 'lr': 0.004077850585571069, 'weight_decay': 0.0004204528793076823, 'epochs': 48, 'loss': 'mae', 'optimizer': 'adam', 'graph_mode': 'cutoff', 'cutoff': 0.8925689137359757, 'grm_norm': 'gcn', 'self_loops': False, 'use_snp_selection': False}. Best is trial 51 with value: 0.3077853407165048.
[I 2025-12-08 11:46:24,870] Trial 64 finished with value: 0.2958643517625703 and parameters: {'model_type': 'gcn', 'hidden_dims': '[512, 128]', 'dropout': 0.19397969886684302, 'batch_norm': True, 'lr': 0.006422711806234095, 'weight_decay': 5.35266391498502e-06, 'epochs': 70, 'loss': 'mae', 'optimizer': 'adam', 'graph_mode': 'cutoff', 'cutoff': 0.8518845691033723, 'grm_norm': 'cosine_then_gcn', 'self_loops': False, 'use_snp_selection': False}. Best is trial 51 with value: 0.3077853407165048.
[I 2025-12-08 11:46:33,019] Trial 65 finished with value: 0.28716126877343684 and parameters: {'model_type': 'gcn', 'hidden_dims': '[128, 64]', 'dropout': 0.15414359815740242, 'batch_norm': True, 'lr': 0.003153766407337503, 'weight_decay': 1.5106498373581562e-05, 'epochs': 94, 'loss': 'mae', 'optimizer': 'adam', 'graph_mode': 'cutoff', 'cutoff': 0.8223900121631327, 'grm_norm': 'gcn', 'self_loops': False, 'use_snp_selection': False}. Best is trial 51 with value: 0.3077853407165048.
[I 2025-12-08 11:46:45,049] Trial 66 finished with value: 0.2909688483683205 and parameters: {'model_type': 'gcn', 'hidden_dims': '[256, 128, 64]', 'dropout': 0.33780893013020075, 'batch_norm': True, 'lr': 0.0007789851617351842, 'weight_decay': 8.854838347177171e-06, 'epochs': 82, 'loss': 'mae', 'optimizer': 'adam', 'graph_mode': 'cutoff', 'cutoff': 0.7808205177575682, 'grm_norm': 'none', 'self_loops': False, 'use_snp_selection': False}. Best is trial 51 with value: 0.3077853407165048.
[I 2025-12-08 11:46:52,313] Trial 67 finished with value: 0.08775986232337832 and parameters: {'model_type': 'gcn', 'hidden_dims': '[256, 128, 64]', 'dropout': 0.21670764331834053, 'batch_norm': False, 'lr': 0.0009805087691900564, 'weight_decay': 2.7996266763073116e-05, 'epochs': 40, 'loss': 'mse', 'optimizer': 'adam', 'graph_mode': 'knn', 'knn_k': 3, 'weighted_edges': True, 'symmetrize_mode': 'mutual', 'self_loops': False, 'use_snp_selection': False}. Best is trial 51 with value: 0.3077853407165048.
