[I 2025-12-08 13:09:52,584] Trial 42 finished with value: 0.3534990137414109 and parameters: {'model_type': 'gcn', 'hidden_dims': '[512, 128]', 'dropout': 0.19578953041053188, 'batch_norm': False, 'lr': 6.872536702023208e-05, 'weight_decay': 5.411224766082342e-07, 'epochs': 223, 'loss': 'mse', 'optimizer': 'adam', 'graph_mode': 'cutoff', 'cutoff': 0.5729795625682385, 'grm_norm': 'gcn', 'self_loops': True, 'use_snp_selection': False}. Best is trial 34 with value: 0.3690149973398856.
[I 2025-12-08 13:10:39,831] Trial 43 finished with value: 0.3581468981161577 and parameters: {'model_type': 'gcn', 'hidden_dims': '[512, 128]', 'dropout': 0.2325911157438389, 'batch_norm': False, 'lr': 1.9977090951228542e-05, 'weight_decay': 2.0310967844436184e-07, 'epochs': 184, 'loss': 'mse', 'optimizer': 'adam', 'graph_mode': 'cutoff', 'cutoff': 0.4177891331492202, 'grm_norm': 'gcn', 'self_loops': True, 'use_snp_selection': False}. Best is trial 34 with value: 0.3690149973398856.
[I 2025-12-08 13:11:11,068] Trial 44 finished with value: 0.2915165327018941 and parameters: {'model_type': 'gcn', 'hidden_dims': '[512, 128]', 'dropout': 0.273655049407579, 'batch_norm': False, 'lr': 0.00014691705862816413, 'weight_decay': 2.446051444758894e-06, 'epochs': 118, 'loss': 'mse', 'optimizer': 'adam', 'graph_mode': 'cutoff', 'cutoff': 0.5306050061157066, 'grm_norm': 'gcn', 'self_loops': True, 'use_snp_selection': False}. Best is trial 34 with value: 0.3690149973398856.
[I 2025-12-08 13:11:24,998] Trial 45 finished with value: 0.2613403837747714 and parameters: {'model_type': 'gcn', 'hidden_dims': '[128, 64]', 'dropout': 0.21142419155277462, 'batch_norm': True, 'lr': 0.0005070369487706769, 'weight_decay': 1.0599179332437684e-06, 'epochs': 176, 'loss': 'mse', 'optimizer': 'adam', 'graph_mode': 'cutoff', 'cutoff': 0.500283429146442, 'grm_norm': 'cosine', 'self_loops': True, 'use_snp_selection': False}. Best is trial 34 with value: 0.3690149973398856.
[I 2025-12-08 13:11:51,856] Trial 46 finished with value: 0.3165388858045004 and parameters: {'model_type': 'gcn', 'hidden_dims': '[256, 128, 64]', 'dropout': 0.18918684878469377, 'batch_norm': False, 'lr': 3.2862528741972424e-05, 'weight_decay': 4.0002758548925697e-07, 'epochs': 206, 'loss': 'mse', 'optimizer': 'adam', 'graph_mode': 'knn', 'knn_k': 1, 'weighted_edges': False, 'symmetrize_mode': 'mutual', 'self_loops': True, 'use_snp_selection': False}. Best is trial 34 with value: 0.3690149973398856.
[I 2025-12-08 13:12:59,098] Trial 47 finished with value: 0.36007514213802955 and parameters: {'model_type': 'gcn', 'hidden_dims': '[512, 128]', 'dropout': 0.35207000747199296, 'batch_norm': False, 'lr': 8.499985383088924e-05, 'weight_decay': 3.242771705787058e-05, 'epochs': 269, 'loss': 'mse', 'optimizer': 'adam', 'graph_mode': 'cutoff', 'cutoff': 0.8396255918536135, 'grm_norm': 'none', 'self_loops': True, 'use_snp_selection': False}. Best is trial 34 with value: 0.3690149973398856.
[I 2025-12-08 13:13:18,434] Trial 48 finished with value: 0.3494064043398358 and parameters: {'model_type': 'gcn', 'hidden_dims': '[256, 128]', 'dropout': 0.2406716137389976, 'batch_norm': False, 'lr': 0.0003035908534222512, 'weight_decay': 1.8340910471699023e-06, 'epochs': 150, 'loss': 'mse', 'optimizer': 'adam', 'graph_mode': 'cutoff', 'cutoff': 0.5874305375512126, 'grm_norm': 'gcn', 'self_loops': True, 'use_snp_selection': False}. Best is trial 34 with value: 0.3690149973398856.
[I 2025-12-08 13:13:52,726] Trial 49 finished with value: 0.22850150647754663 and parameters: {'model_type': 'gcn', 'hidden_dims': '[512, 128]', 'dropout': 0.11620690256925845, 'batch_norm': True, 'lr': 5.196984594261973e-05, 'weight_decay': 7.908714671211745e-05, 'epochs': 128, 'loss': 'mse', 'optimizer': 'adam', 'graph_mode': 'cutoff', 'cutoff': 0.3144981084593754, 'grm_norm': 'cosine', 'self_loops': True, 'use_snp_selection': False}. Best is trial 34 with value: 0.3690149973398856.
[I 2025-12-08 13:14:08,857] Trial 50 finished with value: 0.2888177011001523 and parameters: {'model_type': 'gcn', 'hidden_dims': '[512, 64]', 'dropout': 0.2684934142695406, 'batch_norm': False, 'lr': 1.6902281622693703e-05, 'weight_decay': 8.126185974764386e-07, 'epochs': 53, 'loss': 'mse', 'optimizer': 'adam', 'graph_mode': 'knn', 'knn_k': 4, 'weighted_edges': True, 'symmetrize_mode': 'union', 'self_loops': True, 'use_snp_selection': False}. Best is trial 34 with value: 0.3690149973398856.
[I 2025-12-08 13:14:53,110] Trial 51 finished with value: 0.3678033810961378 and parameters: {'model_type': 'gcn', 'hidden_dims': '[512, 128]', 'dropout': 0.15808385156145138, 'batch_norm': False, 'lr': 4.407207651114896e-05, 'weight_decay': 7.442307125202669e-07, 'epochs': 173, 'loss': 'mse', 'optimizer': 'adam', 'graph_mode': 'cutoff', 'cutoff': 0.569269557494698, 'grm_norm': 'gcn', 'self_loops': True, 'use_snp_selection': False}. Best is trial 34 with value: 0.3690149973398856.
[I 2025-12-08 13:15:37,393] Trial 52 finished with value: 0.36073538659740834 and parameters: {'model_type': 'gcn', 'hidden_dims': '[512, 128]', 'dropout': 0.12394254816152536, 'batch_norm': False, 'lr': 2.5716399902794035e-05, 'weight_decay': 4.2906158760717576e-07, 'epochs': 173, 'loss': 'mse', 'optimizer': 'adam', 'graph_mode': 'cutoff', 'cutoff': 0.5636480471193277, 'grm_norm': 'gcn', 'self_loops': True, 'use_snp_selection': False}. Best is trial 34 with value: 0.3690149973398856.
[I 2025-12-08 13:16:16,644] Trial 53 finished with value: 0.37303527711780937 and parameters: {'model_type': 'gcn', 'hidden_dims': '[512, 128]', 'dropout': 0.16361923645900184, 'batch_norm': False, 'lr': 4.49186346375194e-05, 'weight_decay': 2.3866883114017495e-07, 'epochs': 152, 'loss': 'mse', 'optimizer': 'adam', 'graph_mode': 'cutoff', 'cutoff': 0.6193261001155765, 'grm_norm': 'gcn', 'self_loops': True, 'use_snp_selection': False}. Best is trial 53 with value: 0.37303527711780937.
[I 2025-12-08 13:16:56,874] Trial 54 finished with value: 0.3671946564351559 and parameters: {'model_type': 'gcn', 'hidden_dims': '[512, 128]', 'dropout': 0.16501928603551053, 'batch_norm': False, 'lr': 4.03210906706375e-05, 'weight_decay': 2.664762323145558e-07, 'epochs': 156, 'loss': 'mse', 'optimizer': 'adam', 'graph_mode': 'cutoff', 'cutoff': 0.6187001177116904, 'grm_norm': 'gcn', 'self_loops': True, 'use_snp_selection': False}. Best is trial 53 with value: 0.37303527711780937.
[I 2025-12-08 13:17:36,438] Trial 55 finished with value: 0.35918411284477364 and parameters: {'model_type': 'gcn', 'hidden_dims': '[512, 128]', 'dropout': 0.169768859797077, 'batch_norm': False, 'lr': 7.922714347191201e-05, 'weight_decay': 2.3849931477501744e-07, 'epochs': 153, 'loss': 'mse', 'optimizer': 'adam', 'graph_mode': 'cutoff', 'cutoff': 0.6274794752588444, 'grm_norm': 'gcn', 'self_loops': True, 'use_snp_selection': False}. Best is trial 53 with value: 0.37303527711780937.
[I 2025-12-08 13:18:17,344] Trial 56 finished with value: 0.3735020582781594 and parameters: {'model_type': 'gcn', 'hidden_dims': '[512, 128]', 'dropout': 0.13220437701394494, 'batch_norm': False, 'lr': 3.4633747405302354e-05, 'weight_decay': 3.1325978849447397e-07, 'epochs': 159, 'loss': 'mse', 'optimizer': 'adam', 'graph_mode': 'cutoff', 'cutoff': 0.6057810797858897, 'grm_norm': 'gcn', 'self_loops': True, 'use_snp_selection': False}. Best is trial 56 with value: 0.3735020582781594.
[I 2025-12-08 13:18:57,824] Trial 57 finished with value: 0.37052320702232844 and parameters: {'model_type': 'gcn', 'hidden_dims': '[512, 128]', 'dropout': 0.1271281564973431, 'batch_norm': False, 'lr': 3.949942448186941e-05, 'weight_decay': 1.0003797756629468e-07, 'epochs': 157, 'loss': 'mse', 'optimizer': 'adam', 'graph_mode': 'cutoff', 'cutoff': 0.6126389066101697, 'grm_norm': 'gcn', 'self_loops': True, 'use_snp_selection': False}. Best is trial 56 with value: 0.3735020582781594.
[I 2025-12-08 13:19:38,578] Trial 58 finished with value: 0.3679597546549144 and parameters: {'model_type': 'gcn', 'hidden_dims': '[512, 128]', 'dropout': 0.1293258051606126, 'batch_norm': False, 'lr': 3.7456464282248235e-05, 'weight_decay': 1.4769992740651693e-07, 'epochs': 158, 'loss': 'mse', 'optimizer': 'adam', 'graph_mode': 'cutoff', 'cutoff': 0.6186832434509778, 'grm_norm': 'gcn', 'self_loops': True, 'use_snp_selection': False}. Best is trial 56 with value: 0.3735020582781594.
[I 2025-12-08 13:19:49,171] Trial 59 finished with value: 0.37244520326460234 and parameters: {'model_type': 'gcn', 'hidden_dims': '[128, 64]', 'dropout': 0.1293872923425054, 'batch_norm': False, 'lr': 2.2261233425098867e-05, 'weight_decay': 1.6025541834600495e-07, 'epochs': 132, 'loss': 'mse', 'optimizer': 'adam', 'graph_mode': 'cutoff', 'cutoff': 0.6050196358930547, 'grm_norm': 'gcn', 'self_loops': True, 'use_snp_selection': False}. Best is trial 56 with value: 0.3735020582781594.
[I 2025-12-08 13:19:59,975] Trial 60 finished with value: 0.244782896051596 and parameters: {'model_type': 'gcn', 'hidden_dims': '[128, 64]', 'dropout': 0.13127507590273876, 'batch_norm': True, 'lr': 2.0783130663669657e-05, 'weight_decay': 1.4283329115977573e-07, 'epochs': 133, 'loss': 'mse', 'optimizer': 'adam', 'graph_mode': 'cutoff', 'cutoff': 0.6125437083955912, 'grm_norm': 'gcn', 'self_loops': True, 'use_snp_selection': False}. Best is trial 56 with value: 0.3735020582781594.
[I 2025-12-08 13:20:12,870] Trial 61 finished with value: 0.36772990145126194 and parameters: {'model_type': 'gcn', 'hidden_dims': '[128, 64]', 'dropout': 0.1121699461645102, 'batch_norm': False, 'lr': 3.677455769698206e-05, 'weight_decay': 1.0497803680747276e-07, 'epochs': 167, 'loss': 'mse', 'optimizer': 'adam', 'graph_mode': 'cutoff', 'cutoff': 0.5960087028814028, 'grm_norm': 'gcn', 'self_loops': True, 'use_snp_selection': False}. Best is trial 56 with value: 0.3735020582781594.
[I 2025-12-08 13:20:24,072] Trial 62 finished with value: 0.3562098836998704 and parameters: {'model_type': 'gcn', 'hidden_dims': '[128, 64]', 'dropout': 0.1382368405957356, 'batch_norm': False, 'lr': 2.63484506792377e-05, 'weight_decay': 1.6603819017511111e-07, 'epochs': 141, 'loss': 'mse', 'optimizer': 'adam', 'graph_mode': 'cutoff', 'cutoff': 0.680863690949814, 'grm_norm': 'gcn', 'self_loops': True, 'use_snp_selection': False}. Best is trial 56 with value: 0.3735020582781594.
[I 2025-12-08 13:21:05,182] Trial 63 finished with value: 0.3546031877034275 and parameters: {'model_type': 'gcn', 'hidden_dims': '[512, 128]', 'dropout': 0.1074568012115403, 'batch_norm': False, 'lr': 1.1781511307780845e-05, 'weight_decay': 1.8609062840915106e-07, 'epochs': 160, 'loss': 'mse', 'optimizer': 'adam', 'graph_mode': 'cutoff', 'cutoff': 0.6424658799895195, 'grm_norm': 'gcn', 'self_loops': True, 'use_snp_selection': False}. Best is trial 56 with value: 0.3735020582781594.
[I 2025-12-08 13:21:15,218] Trial 64 finished with value: 0.3595438822614588 and parameters: {'model_type': 'gcn', 'hidden_dims': '[128, 64]', 'dropout': 0.1458267413962156, 'batch_norm': False, 'lr': 7.107782656859453e-05, 'weight_decay': 1.2556869815593497e-07, 'epochs': 123, 'loss': 'mse', 'optimizer': 'adam', 'graph_mode': 'cutoff', 'cutoff': 0.5516371974786867, 'grm_norm': 'gcn', 'self_loops': True, 'use_snp_selection': False}. Best is trial 56 with value: 0.3735020582781594.
[I 2025-12-08 13:21:59,777] Trial 65 finished with value: 0.3635588123387019 and parameters: {'model_type': 'gcn', 'hidden_dims': '[512, 128]', 'dropout': 0.1002502207351688, 'batch_norm': False, 'lr': 0.0001012307896409099, 'weight_decay': 3.4011807662941733e-07, 'epochs': 173, 'loss': 'mse', 'optimizer': 'adam', 'graph_mode': 'cutoff', 'cutoff': 0.4912252300857388, 'grm_norm': 'gcn', 'self_loops': True, 'use_snp_selection': False}. Best is trial 56 with value: 0.3735020582781594.
[I 2025-12-08 13:22:20,619] Trial 66 finished with value: 0.34463951318448915 and parameters: {'model_type': 'gcn', 'hidden_dims': '[256, 128, 64]', 'dropout': 0.12703355249721457, 'batch_norm': False, 'lr': 5.079817564003569e-05, 'weight_decay': 1.9389810799902215e-07, 'epochs': 156, 'loss': 'mse', 'optimizer': 'adam', 'graph_mode': 'cutoff', 'cutoff': 0.7280705208083009, 'grm_norm': 'cosine', 'self_loops': True, 'use_snp_selection': False}. Best is trial 56 with value: 0.3735020582781594.
[I 2025-12-08 13:23:12,381] Trial 67 finished with value: 0.3351568127482958 and parameters: {'model_type': 'gcn', 'hidden_dims': '[512, 128]', 'dropout': 0.1793115500553037, 'batch_norm': False, 'lr': 1.707617370661037e-05, 'weight_decay': 1.469680590927067e-07, 'epochs': 200, 'loss': 'mse', 'optimizer': 'adam', 'graph_mode': 'knn', 'knn_k': 8, 'weighted_edges': False, 'symmetrize_mode': 'mutual', 'self_loops': True, 'use_snp_selection': False}. Best is trial 56 with value: 0.3735020582781594.
[I 2025-12-08 13:23:29,537] Trial 68 finished with value: 0.36577098729134183 and parameters: {'model_type': 'gcn', 'hidden_dims': '[256, 128]', 'dropout': 0.15446111726057413, 'batch_norm': False, 'lr': 5.866994110391822e-05, 'weight_decay': 4.3122533182157096e-07, 'epochs': 132, 'loss': 'mse', 'optimizer': 'adam', 'graph_mode': 'cutoff', 'cutoff': 0.5985463782300667, 'grm_norm': 'gcn', 'self_loops': True, 'use_snp_selection': False}. Best is trial 56 with value: 0.3735020582781594.
[I 2025-12-08 13:23:57,564] Trial 69 finished with value: 0.3568657656196761 and parameters: {'model_type': 'gcn', 'hidden_dims': '[512, 128]', 'dropout': 0.4541296058732597, 'batch_norm': False, 'lr': 3.488112789259453e-05, 'weight_decay': 1.0411148439771865e-07, 'epochs': 105, 'loss': 'mse', 'optimizer': 'adam', 'graph_mode': 'cutoff', 'cutoff': 0.6428939178031049, 'grm_norm': 'gcn', 'self_loops': True, 'use_snp_selection': False}. Best is trial 56 with value: 0.3735020582781594.
[I 2025-12-08 13:24:40,783] Trial 70 finished with value: 0.36478947875854206 and parameters: {'model_type': 'gcn', 'hidden_dims': '[512, 128]', 'dropout': 0.13435841029395806, 'batch_norm': False, 'lr': 2.5324833098301943e-05, 'weight_decay': 2.013055714865914e-07, 'epochs': 167, 'loss': 'mse', 'optimizer': 'adam', 'graph_mode': 'cutoff', 'cutoff': 0.43262479584427493, 'grm_norm': 'gcn', 'self_loops': True, 'use_snp_selection': False}. Best is trial 56 with value: 0.3735020582781594.
[I 2025-12-08 13:24:53,902] Trial 71 finished with value: 0.3576474838185316 and parameters: {'model_type': 'gcn', 'hidden_dims': '[128, 64]', 'dropout': 0.11740450629929859, 'batch_norm': False, 'lr': 4.228736221291176e-05, 'weight_decay': 1.1366629686319212e-07, 'epochs': 170, 'loss': 'mse', 'optimizer': 'adam', 'graph_mode': 'cutoff', 'cutoff': 0.5864167178547347, 'grm_norm': 'gcn', 'self_loops': True, 'use_snp_selection': False}. Best is trial 56 with value: 0.3735020582781594.
[I 2025-12-08 13:25:04,980] Trial 72 finished with value: 0.3578362944033925 and parameters: {'model_type': 'gcn', 'hidden_dims': '[128, 64]', 'dropout': 0.11735077567768648, 'batch_norm': False, 'lr': 3.4122673967729305e-05, 'weight_decay': 2.657931943776825e-07, 'epochs': 141, 'loss': 'mse', 'optimizer': 'adam', 'graph_mode': 'cutoff', 'cutoff': 0.6004698390751045, 'grm_norm': 'gcn', 'self_loops': True, 'use_snp_selection': False}. Best is trial 56 with value: 0.3735020582781594.
[I 2025-12-08 13:25:19,796] Trial 73 finished with value: 0.34720823456593064 and parameters: {'model_type': 'gcn', 'hidden_dims': '[128, 64]', 'dropout': 0.15816633912102745, 'batch_norm': False, 'lr': 1.3635035705177805e-05, 'weight_decay': 1.6179443960713702e-07, 'epochs': 195, 'loss': 'mse', 'optimizer': 'adam', 'graph_mode': 'cutoff', 'cutoff': 0.6786898951694753, 'grm_norm': 'gcn', 'self_loops': True, 'use_snp_selection': False}. Best is trial 56 with value: 0.3735020582781594.
[I 2025-12-08 13:25:32,270] Trial 74 finished with value: 0.36560103726311843 and parameters: {'model_type': 'gcn', 'hidden_dims': '[128, 64]', 'dropout': 0.14581281118887968, 'batch_norm': False, 'lr': 2.247997555585354e-05, 'weight_decay': 1.0004799366985243e-07, 'epochs': 161, 'loss': 'mse', 'optimizer': 'adam', 'graph_mode': 'cutoff', 'cutoff': 0.5619789825427535, 'grm_norm': 'gcn', 'self_loops': True, 'use_snp_selection': False}. Best is trial 56 with value: 0.3735020582781594.
[I 2025-12-08 13:26:10,717] Trial 75 finished with value: 0.3635594046320025 and parameters: {'model_type': 'gcn', 'hidden_dims': '[512, 64]', 'dropout': 0.17667102993325068, 'batch_norm': False, 'lr': 3.7422396931561474e-05, 'weight_decay': 2.4981997554790793e-07, 'epochs': 148, 'loss': 'mse', 'optimizer': 'adam', 'graph_mode': 'cutoff', 'cutoff': 0.7081135836109363, 'grm_norm': 'cosine_then_gcn', 'self_loops': True, 'use_snp_selection': False}. Best is trial 56 with value: 0.3735020582781594.
[I 2025-12-08 13:26:26,701] Trial 76 finished with value: 0.35614391050153105 and parameters: {'model_type': 'gcn', 'hidden_dims': '[128, 64]', 'dropout': 0.10167096458693875, 'batch_norm': False, 'lr': 5.886000040932938e-05, 'weight_decay': 3.423275128995406e-07, 'epochs': 214, 'loss': 'mse', 'optimizer': 'adam', 'graph_mode': 'cutoff', 'cutoff': 0.6285904266857145, 'grm_norm': 'gcn', 'self_loops': True, 'use_snp_selection': False}. Best is trial 56 with value: 0.3735020582781594.
[I 2025-12-08 13:27:11,676] Trial 77 finished with value: 0.3668769421729252 and parameters: {'model_type': 'gcn', 'hidden_dims': '[512, 128]', 'dropout': 0.12690364551663402, 'batch_norm': False, 'lr': 4.643997294579731e-05, 'weight_decay': 1.3801180146041455e-07, 'epochs': 176, 'loss': 'mse', 'optimizer': 'adam', 'graph_mode': 'cutoff', 'cutoff': 0.659742281839182, 'grm_norm': 'gcn', 'self_loops': True, 'use_snp_selection': False}. Best is trial 56 with value: 0.3735020582781594.
[I 2025-12-08 13:27:57,655] Trial 78 finished with value: 0.36522091902259907 and parameters: {'model_type': 'gcn', 'hidden_dims': '[512, 128]', 'dropout': 0.49970603823069915, 'batch_norm': False, 'lr': 3.060990362111147e-05, 'weight_decay': 7.737948118950123e-07, 'epochs': 180, 'loss': 'mse', 'optimizer': 'adam', 'graph_mode': 'cutoff', 'cutoff': 0.5320912765068745, 'grm_norm': 'gcn', 'self_loops': True, 'use_snp_selection': False}. Best is trial 56 with value: 0.3735020582781594.
[I 2025-12-08 13:28:47,524] Trial 79 finished with value: 0.24075584004276043 and parameters: {'model_type': 'gcn', 'hidden_dims': '[512, 128]', 'dropout': 0.18161310507074477, 'batch_norm': True, 'lr': 1.8114119424269203e-05, 'weight_decay': 4.893226511153116e-07, 'epochs': 192, 'loss': 'mse', 'optimizer': 'adam', 'graph_mode': 'cutoff', 'cutoff': 0.4937302635433427, 'grm_norm': 'gcn', 'self_loops': True, 'use_snp_selection': False}. Best is trial 56 with value: 0.3735020582781594.
[I 2025-12-08 13:28:57,495] Trial 80 finished with value: 0.3286498690991103 and parameters: {'model_type': 'gcn', 'hidden_dims': '[128, 64]', 'dropout': 0.3786311834359919, 'batch_norm': False, 'lr': 0.00015551030988911072, 'weight_decay': 1.28388262152575e-06, 'epochs': 117, 'loss': 'mse', 'optimizer': 'adam', 'graph_mode': 'knn', 'knn_k': 5, 'weighted_edges': False, 'symmetrize_mode': 'union', 'self_loops': True, 'use_snp_selection': False}. Best is trial 56 with value: 0.3735020582781594.
[I 2025-12-08 13:29:39,085] Trial 81 finished with value: 0.3716357800853068 and parameters: {'model_type': 'gcn', 'hidden_dims': '[512, 128]', 'dropout': 0.16522084648545127, 'batch_norm': False, 'lr': 3.9927238496597064e-05, 'weight_decay': 2.384012630741229e-07, 'epochs': 162, 'loss': 'mse', 'optimizer': 'adam', 'graph_mode': 'cutoff', 'cutoff': 0.6147123227808156, 'grm_norm': 'gcn', 'self_loops': True, 'use_snp_selection': False}. Best is trial 56 with value: 0.3735020582781594.
[I 2025-12-08 13:30:20,983] Trial 82 finished with value: 0.36927947270961653 and parameters: {'model_type': 'gcn', 'hidden_dims': '[512, 128]', 'dropout': 0.21736629558507586, 'batch_norm': False, 'lr': 7.380348546990665e-05, 'weight_decay': 2.0043117247032245e-07, 'epochs': 163, 'loss': 'mse', 'optimizer': 'adam', 'graph_mode': 'cutoff', 'cutoff': 0.6048594151596809, 'grm_norm': 'gcn', 'self_loops': True, 'use_snp_selection': False}. Best is trial 56 with value: 0.3735020582781594.
[I 2025-12-08 13:30:56,214] Trial 83 finished with value: 0.3445247599356321 and parameters: {'model_type': 'gcn', 'hidden_dims': '[512, 128]', 'dropout': 0.2219372192077423, 'batch_norm': False, 'lr': 7.851716006958357e-05, 'weight_decay': 6.874492795257376e-07, 'epochs': 135, 'loss': 'mse', 'optimizer': 'adam', 'graph_mode': 'cutoff', 'cutoff': 0.5547568147536039, 'grm_norm': 'gcn', 'self_loops': True, 'use_snp_selection': False}. Best is trial 56 with value: 0.3735020582781594.
[I 2025-12-08 13:31:35,406] Trial 84 finished with value: 0.36241095991222166 and parameters: {'model_type': 'gcn', 'hidden_dims': '[512, 128]', 'dropout': 0.16249272330115042, 'batch_norm': False, 'lr': 4.863366636469521e-05, 'weight_decay': 3.3033346372138306e-07, 'epochs': 152, 'loss': 'mse', 'optimizer': 'adam', 'graph_mode': 'cutoff', 'cutoff': 0.6252778998848073, 'grm_norm': 'gcn', 'self_loops': True, 'use_snp_selection': False}. Best is trial 56 with value: 0.3735020582781594.
[I 2025-12-08 13:32:12,024] Trial 85 finished with value: 0.3636035702002407 and parameters: {'model_type': 'gcn', 'hidden_dims': '[512, 128]', 'dropout': 0.14373261765301282, 'batch_norm': False, 'lr': 0.00011163491750097528, 'weight_decay': 2.2057152305014095e-07, 'epochs': 141, 'loss': 'mse', 'optimizer': 'adam', 'graph_mode': 'cutoff', 'cutoff': 0.5833728655609425, 'grm_norm': 'gcn', 'self_loops': True, 'use_snp_selection': False}. Best is trial 56 with value: 0.3735020582781594.
