[I 2025-12-08 20:57:25,555] Trial 76 finished with value: 0.3057782806670871 and parameters: {'model_type': 'gcn', 'hidden_dims': '[512, 256]', 'dropout': 0.5996869329012833, 'batch_norm': True, 'lr': 6.227158869808896e-05, 'weight_decay': 1.0659217875174435e-07, 'epochs': 254, 'loss': 'mae', 'optimizer': 'adam', 'graph_mode': 'cutoff', 'cutoff': 0.8022911204198497, 'grm_norm': 'cosine_then_gcn', 'self_loops': False, 'use_snp_selection': False}. Best is trial 71 with value: 0.31968992992405665.
[I 2025-12-08 20:57:41,713] Trial 77 finished with value: 0.3012340548345019 and parameters: {'model_type': 'gcn', 'hidden_dims': '[128, 64]', 'dropout': 0.5523314814605349, 'batch_norm': True, 'lr': 0.00014928683728078764, 'weight_decay': 2.955328147306266e-07, 'epochs': 198, 'loss': 'mae', 'optimizer': 'adam', 'graph_mode': 'cutoff', 'cutoff': 0.8252143369024231, 'grm_norm': 'gcn', 'self_loops': True, 'use_snp_selection': False}. Best is trial 71 with value: 0.31968992992405665.
[I 2025-12-08 20:58:50,430] Trial 78 finished with value: 0.22079558644607866 and parameters: {'model_type': 'gcn', 'hidden_dims': '[512, 256]', 'dropout': 0.5785788737201439, 'batch_norm': True, 'lr': 0.00010475853559700841, 'weight_decay': 1.3268978538669576e-07, 'epochs': 267, 'loss': 'mse', 'optimizer': 'adam', 'graph_mode': 'knn', 'knn_k': 3, 'weighted_edges': False, 'symmetrize_mode': 'mutual', 'self_loops': False, 'use_snp_selection': False}. Best is trial 71 with value: 0.31968992992405665.
[I 2025-12-08 20:59:38,064] Trial 79 finished with value: 0.24347079051101833 and parameters: {'model_type': 'gcn', 'hidden_dims': '[512, 256]', 'dropout': 0.5239146548465325, 'batch_norm': False, 'lr': 3.4610107443003254e-05, 'weight_decay': 1.821023322065334e-07, 'epochs': 173, 'loss': 'mae', 'optimizer': 'adam', 'graph_mode': 'cutoff', 'cutoff': 0.20219566086699486, 'grm_norm': 'gcn', 'self_loops': False, 'use_snp_selection': False}. Best is trial 71 with value: 0.31968992992405665.
[I 2025-12-08 21:00:38,870] Trial 80 finished with value: 0.30631118176351313 and parameters: {'model_type': 'gcn', 'hidden_dims': '[512, 128]', 'dropout': 0.5466613010413802, 'batch_norm': True, 'lr': 0.0001521531290584956, 'weight_decay': 0.0002246588283789432, 'epochs': 224, 'loss': 'mae', 'optimizer': 'adam', 'graph_mode': 'cutoff', 'cutoff': 0.7689205835808595, 'grm_norm': 'gcn', 'self_loops': False, 'use_snp_selection': True, 'num_snps': 51959}. Best is trial 71 with value: 0.31968992992405665.
[I 2025-12-08 21:01:36,502] Trial 81 finished with value: 0.3154211100593094 and parameters: {'model_type': 'gcn', 'hidden_dims': '[512, 256]', 'dropout': 0.585759511230511, 'batch_norm': True, 'lr': 0.00011136671182263345, 'weight_decay': 3.85153538500101e-07, 'epochs': 222, 'loss': 'mae', 'optimizer': 'adam', 'graph_mode': 'cutoff', 'cutoff': 0.8724818088403796, 'grm_norm': 'gcn', 'self_loops': False, 'use_snp_selection': False}. Best is trial 71 with value: 0.31968992992405665.
[I 2025-12-08 21:02:38,215] Trial 82 finished with value: 0.3209301661797187 and parameters: {'model_type': 'gcn', 'hidden_dims': '[512, 256]', 'dropout': 0.5862570816688698, 'batch_norm': True, 'lr': 8.467233154647021e-05, 'weight_decay': 1.8970379661715876e-07, 'epochs': 239, 'loss': 'mae', 'optimizer': 'adam', 'graph_mode': 'cutoff', 'cutoff': 0.8459185346951985, 'grm_norm': 'gcn', 'self_loops': False, 'use_snp_selection': False}. Best is trial 82 with value: 0.3209301661797187.
[I 2025-12-08 21:03:37,957] Trial 83 finished with value: 0.3144720388786957 and parameters: {'model_type': 'gcn', 'hidden_dims': '[512, 256]', 'dropout': 0.5600019208650082, 'batch_norm': True, 'lr': 7.07085301631072e-05, 'weight_decay': 1.9152248615326026e-07, 'epochs': 232, 'loss': 'mae', 'optimizer': 'adam', 'graph_mode': 'cutoff', 'cutoff': 0.8025632441914129, 'grm_norm': 'gcn', 'self_loops': False, 'use_snp_selection': False}. Best is trial 82 with value: 0.3209301661797187.
[I 2025-12-08 21:04:43,443] Trial 84 finished with value: 0.31303686477821285 and parameters: {'model_type': 'gcn', 'hidden_dims': '[512, 256]', 'dropout': 0.5373006159936454, 'batch_norm': True, 'lr': 8.112791978560566e-05, 'weight_decay': 1.8418667813159917e-07, 'epochs': 256, 'loss': 'mae', 'optimizer': 'adam', 'graph_mode': 'cutoff', 'cutoff': 0.844767473604093, 'grm_norm': 'gcn', 'self_loops': False, 'use_snp_selection': False}. Best is trial 82 with value: 0.3209301661797187.
[I 2025-12-08 21:05:55,965] Trial 85 finished with value: 0.3167895335896842 and parameters: {'model_type': 'gcn', 'hidden_dims': '[512, 256]', 'dropout': 0.5713326647632989, 'batch_norm': True, 'lr': 0.00018625168172542423, 'weight_decay': 5.482380528948913e-07, 'epochs': 285, 'loss': 'mae', 'optimizer': 'adam', 'graph_mode': 'cutoff', 'cutoff': 0.8276807694940034, 'grm_norm': 'gcn', 'self_loops': False, 'use_snp_selection': False}. Best is trial 82 with value: 0.3209301661797187.
[I 2025-12-08 21:07:15,605] Trial 86 finished with value: 0.2285802226351476 and parameters: {'model_type': 'gcn', 'hidden_dims': '[512, 256]', 'dropout': 0.5707247878043097, 'batch_norm': True, 'lr': 0.00019090163498920346, 'weight_decay': 4.865319849923659e-07, 'epochs': 306, 'loss': 'mae', 'optimizer': 'adam', 'graph_mode': 'cutoff', 'cutoff': 0.27833149744664215, 'grm_norm': 'gcn', 'self_loops': False, 'use_snp_selection': False}. Best is trial 82 with value: 0.3209301661797187.
[I 2025-12-08 21:08:24,560] Trial 87 finished with value: 0.31126406187080136 and parameters: {'model_type': 'gcn', 'hidden_dims': '[512, 256]', 'dropout': 0.5175498599716354, 'batch_norm': True, 'lr': 0.00019512195095047877, 'weight_decay': 6.01440896158954e-07, 'epochs': 271, 'loss': 'mae', 'optimizer': 'adam', 'graph_mode': 'cutoff', 'cutoff': 0.7615655953576582, 'grm_norm': 'gcn', 'self_loops': False, 'use_snp_selection': False}. Best is trial 82 with value: 0.3209301661797187.
[I 2025-12-08 21:08:47,405] Trial 88 finished with value: 0.30763999990757174 and parameters: {'model_type': 'gcn', 'hidden_dims': '[128, 64]', 'dropout': 0.5849092200969156, 'batch_norm': True, 'lr': 0.0003590669329951962, 'weight_decay': 8.035633924660152e-07, 'epochs': 293, 'loss': 'mae', 'optimizer': 'adam', 'graph_mode': 'cutoff', 'cutoff': 0.8317888003312286, 'grm_norm': 'gcn', 'self_loops': False, 'use_snp_selection': False}. Best is trial 82 with value: 0.3209301661797187.
[I 2025-12-08 21:09:23,359] Trial 89 finished with value: 0.30118319558907614 and parameters: {'model_type': 'gcn', 'hidden_dims': '[256, 128]', 'dropout': 0.5573234460684445, 'batch_norm': True, 'lr': 5.3589809584868414e-05, 'weight_decay': 2.517636824003956e-07, 'epochs': 285, 'loss': 'mae', 'optimizer': 'adam', 'graph_mode': 'cutoff', 'cutoff': 0.8591416307325007, 'grm_norm': 'gcn', 'self_loops': True, 'use_snp_selection': False}. Best is trial 82 with value: 0.3209301661797187.
[I 2025-12-08 21:10:26,679] Trial 90 finished with value: 0.2694798115728417 and parameters: {'model_type': 'gcn', 'hidden_dims': '[512, 256]', 'dropout': 0.5340867825452079, 'batch_norm': True, 'lr': 1.827211707827091e-05, 'weight_decay': 1.4649723114614954e-07, 'epochs': 241, 'loss': 'mae', 'optimizer': 'adam', 'graph_mode': 'knn', 'knn_k': 5, 'weighted_edges': True, 'symmetrize_mode': 'union', 'self_loops': False, 'use_snp_selection': False}. Best is trial 82 with value: 0.3209301661797187.
[I 2025-12-08 21:11:50,998] Trial 91 finished with value: 0.30346793992018506 and parameters: {'model_type': 'gcn', 'hidden_dims': '[512, 256]', 'dropout': 0.5916361148521107, 'batch_norm': True, 'lr': 0.0010995208307154978, 'weight_decay': 0.00013527688667353647, 'epochs': 332, 'loss': 'mae', 'optimizer': 'adam', 'graph_mode': 'cutoff', 'cutoff': 0.8162877761942288, 'grm_norm': 'cosine', 'self_loops': False, 'use_snp_selection': False}. Best is trial 82 with value: 0.3209301661797187.
[I 2025-12-08 21:12:58,210] Trial 92 finished with value: 0.3131388775456868 and parameters: {'model_type': 'gcn', 'hidden_dims': '[512, 256]', 'dropout': 0.5722084540421738, 'batch_norm': True, 'lr': 0.003006226648131832, 'weight_decay': 1.2913578093830653e-06, 'epochs': 260, 'loss': 'mae', 'optimizer': 'adam', 'graph_mode': 'cutoff', 'cutoff': 0.7862496370464783, 'grm_norm': 'gcn', 'self_loops': False, 'use_snp_selection': False}. Best is trial 82 with value: 0.3209301661797187.
[I 2025-12-08 21:14:02,126] Trial 93 finished with value: 0.3122148102822619 and parameters: {'model_type': 'gcn', 'hidden_dims': '[512, 256]', 'dropout': 0.5997641480111295, 'batch_norm': True, 'lr': 0.001537168730252806, 'weight_decay': 2.425877936141149e-07, 'epochs': 247, 'loss': 'mae', 'optimizer': 'adam', 'graph_mode': 'cutoff', 'cutoff': 0.7958882533318881, 'grm_norm': 'cosine_then_gcn', 'self_loops': False, 'use_snp_selection': False}. Best is trial 82 with value: 0.3209301661797187.
[I 2025-12-08 21:14:54,893] Trial 94 finished with value: 0.2481898602683335 and parameters: {'model_type': 'gcn', 'hidden_dims': '[512, 256]', 'dropout': 0.5472190733311544, 'batch_norm': True, 'lr': 0.00023478526781396566, 'weight_decay': 2.690561720090726e-05, 'epochs': 200, 'loss': 'mae', 'optimizer': 'adam', 'graph_mode': 'cutoff', 'cutoff': 0.5046824704592207, 'grm_norm': 'gcn', 'self_loops': False, 'use_snp_selection': False}. Best is trial 82 with value: 0.3209301661797187.
[I 2025-12-08 21:15:20,691] Trial 95 finished with value: 0.3041252223464098 and parameters: {'model_type': 'gcn', 'hidden_dims': '[512, 256]', 'dropout': 0.563094390534377, 'batch_norm': True, 'lr': 0.00017068229787406465, 'weight_decay': 0.00012683103162154497, 'epochs': 51, 'loss': 'mae', 'optimizer': 'adam', 'graph_mode': 'cutoff', 'cutoff': 0.8255114101925289, 'grm_norm': 'gcn', 'self_loops': False, 'use_snp_selection': True, 'num_snps': 47545}. Best is trial 82 with value: 0.3209301661797187.
[I 2025-12-08 21:15:47,232] Trial 96 finished with value: 0.31343709544392945 and parameters: {'model_type': 'gcn', 'hidden_dims': '[512, 64]', 'dropout': 0.5848106593683925, 'batch_norm': True, 'lr': 0.0017422752508393926, 'weight_decay': 1.8558952072719827e-05, 'epochs': 94, 'loss': 'mse', 'optimizer': 'adam', 'graph_mode': 'cutoff', 'cutoff': 0.8512128081221478, 'grm_norm': 'none', 'self_loops': False, 'use_snp_selection': False}. Best is trial 82 with value: 0.3209301661797187.
[I 2025-12-08 21:15:58,662] Trial 97 finished with value: 0.2901869274561751 and parameters: {'model_type': 'gcn', 'hidden_dims': '[256, 128, 64]', 'dropout': 0.5397014584803952, 'batch_norm': True, 'lr': 9.06654024564376e-05, 'weight_decay': 8.679653649798024e-05, 'epochs': 70, 'loss': 'mae', 'optimizer': 'adam', 'graph_mode': 'cutoff', 'cutoff': 0.7700808513198161, 'grm_norm': 'gcn', 'self_loops': False, 'use_snp_selection': False}. Best is trial 82 with value: 0.3209301661797187.
[I 2025-12-08 21:16:16,034] Trial 98 finished with value: 0.0 and parameters: {'model_type': 'gcn', 'hidden_dims': '[128, 64]', 'dropout': 0.3595289180800808, 'batch_norm': False, 'lr': 0.0012933467271700398, 'weight_decay': 0.00038593304116040455, 'epochs': 215, 'loss': 'mae', 'optimizer': 'adam', 'graph_mode': 'cutoff', 'cutoff': 0.7979498167559962, 'grm_norm': 'gcn', 'self_loops': False, 'use_snp_selection': False}. Best is trial 82 with value: 0.3209301661797187.
[I 2025-12-08 21:16:33,321] Trial 99 finished with value: 0.3143505138452742 and parameters: {'model_type': 'gcn', 'hidden_dims': '[512, 256]', 'dropout': 0.5251627878954016, 'batch_norm': True, 'lr': 0.0022135154746744357, 'weight_decay': 4.911562136975202e-05, 'epochs': 55, 'loss': 'mae', 'optimizer': 'adam', 'graph_mode': 'cutoff', 'cutoff': 0.8788700585947176, 'grm_norm': 'none', 'self_loops': False, 'use_snp_selection': False}. Best is trial 82 with value: 0.3209301661797187.
[I 2025-12-08 21:17:13,842] Trial 100 finished with value: 0.3154362232535231 and parameters: {'model_type': 'gcn', 'hidden_dims': '[512, 256]', 'dropout': 0.5702166497113631, 'batch_norm': True, 'lr': 0.0010405636574362996, 'weight_decay': 3.164353519386463e-06, 'epochs': 152, 'loss': 'mae', 'optimizer': 'adam', 'graph_mode': 'cutoff', 'cutoff': 0.8217802100859319, 'grm_norm': 'cosine', 'self_loops': False, 'use_snp_selection': False}. Best is trial 82 with value: 0.3209301661797187.
[I 2025-12-08 21:18:11,581] Trial 101 finished with value: 0.3114867583888305 and parameters: {'model_type': 'gcn', 'hidden_dims': '[512, 256]', 'dropout': 0.5883802560315731, 'batch_norm': True, 'lr': 0.0001270370794721944, 'weight_decay': 3.6713931879092824e-07, 'epochs': 226, 'loss': 'mae', 'optimizer': 'adam', 'graph_mode': 'cutoff', 'cutoff': 0.8769445177634405, 'grm_norm': 'gcn', 'self_loops': False, 'use_snp_selection': False}. Best is trial 82 with value: 0.3209301661797187.
[I 2025-12-08 21:18:59,828] Trial 102 finished with value: 0.3144005878844924 and parameters: {'model_type': 'gcn', 'hidden_dims': '[512, 256]', 'dropout': 0.5794912541203069, 'batch_norm': True, 'lr': 0.0002434616870972744, 'weight_decay': 3.275387633319904e-07, 'epochs': 189, 'loss': 'mae', 'optimizer': 'adam', 'graph_mode': 'cutoff', 'cutoff': 0.8451198898193185, 'grm_norm': 'gcn', 'self_loops': False, 'use_snp_selection': False}. Best is trial 82 with value: 0.3209301661797187.
[I 2025-12-08 21:19:59,392] Trial 103 finished with value: 0.3144266006063411 and parameters: {'model_type': 'gcn', 'hidden_dims': '[512, 256]', 'dropout': 0.5531637890535841, 'batch_norm': True, 'lr': 0.0001270412680706216, 'weight_decay': 2.046381894254709e-07, 'epochs': 235, 'loss': 'mae', 'optimizer': 'adam', 'graph_mode': 'cutoff', 'cutoff': 0.8678419459676879, 'grm_norm': 'gcn', 'self_loops': False, 'use_snp_selection': False}. Best is trial 82 with value: 0.3209301661797187.
[I 2025-12-08 21:20:54,797] Trial 104 finished with value: 0.31314439631964053 and parameters: {'model_type': 'gcn', 'hidden_dims': '[512, 256]', 'dropout': 0.5931271291131646, 'batch_norm': True, 'lr': 0.00012987002881868168, 'weight_decay': 1.437268018277096e-07, 'epochs': 218, 'loss': 'mae', 'optimizer': 'adam', 'graph_mode': 'cutoff', 'cutoff': 0.8136231767719442, 'grm_norm': 'gcn', 'self_loops': False, 'use_snp_selection': False}. Best is trial 82 with value: 0.3209301661797187.
[I 2025-12-08 21:21:17,283] Trial 105 finished with value: 0.30192595347202694 and parameters: {'model_type': 'gcn', 'hidden_dims': '[512, 256]', 'dropout': 0.5621517793424577, 'batch_norm': True, 'lr': 7.117216932690507e-05, 'weight_decay': 1.5870657098177417e-05, 'epochs': 80, 'loss': 'mae', 'optimizer': 'adam', 'graph_mode': 'cutoff', 'cutoff': 0.8392748171739233, 'grm_norm': 'gcn', 'self_loops': False, 'use_snp_selection': False}. Best is trial 82 with value: 0.3209301661797187.
[I 2025-12-08 21:22:09,854] Trial 106 finished with value: 0.3100088780732647 and parameters: {'model_type': 'gcn', 'hidden_dims': '[512, 128]', 'dropout': 0.5791948695578437, 'batch_norm': True, 'lr': 9.768174078755006e-05, 'weight_decay': 4.658017882466904e-07, 'epochs': 206, 'loss': 'mae', 'optimizer': 'adam', 'graph_mode': 'cutoff', 'cutoff': 0.78964686612566, 'grm_norm': 'gcn', 'self_loops': False, 'use_snp_selection': False}. Best is trial 82 with value: 0.3209301661797187.
[I 2025-12-08 21:22:24,966] Trial 107 finished with value: 0.3001018406617818 and parameters: {'model_type': 'gcn', 'hidden_dims': '[512, 256]', 'dropout': 0.4827741289409795, 'batch_norm': True, 'lr': 0.00016519069331515576, 'weight_decay': 6.617682898637745e-07, 'epochs': 48, 'loss': 'mae', 'optimizer': 'adam', 'graph_mode': 'cutoff', 'cutoff': 0.7594590132367258, 'grm_norm': 'none', 'self_loops': True, 'use_snp_selection': False}. Best is trial 82 with value: 0.3209301661797187.
[I 2025-12-08 21:23:08,360] Trial 108 finished with value: 0.3135141522108989 and parameters: {'model_type': 'gcn', 'hidden_dims': '[512, 256]', 'dropout': 0.5696336130080824, 'batch_norm': True, 'lr': 0.00011675286218766304, 'weight_decay': 2.6629597552478864e-07, 'epochs': 229, 'loss': 'mae', 'optimizer': 'adam', 'graph_mode': 'cutoff', 'cutoff': 0.7358872725115054, 'grm_norm': 'gcn', 'self_loops': False, 'use_snp_selection': True, 'num_snps': 33177}. Best is trial 82 with value: 0.3209301661797187.
[I 2025-12-08 21:23:31,877] Trial 109 finished with value: 0.2422259086025353 and parameters: {'model_type': 'gcn', 'hidden_dims': '[128, 64]', 'dropout': 0.5447808266107919, 'batch_norm': True, 'lr': 4.68540358806106e-05, 'weight_decay': 1.1292881896315382e-05, 'epochs': 308, 'loss': 'mse', 'optimizer': 'adam', 'graph_mode': 'knn', 'knn_k': 9, 'weighted_edges': False, 'symmetrize_mode': 'mutual', 'self_loops': False, 'use_snp_selection': False}. Best is trial 82 with value: 0.3209301661797187.
[I 2025-12-08 21:24:33,221] Trial 110 finished with value: 0.30663503602209335 and parameters: {'model_type': 'gcn', 'hidden_dims': '[512, 256]', 'dropout': 0.5108984617199289, 'batch_norm': True, 'lr': 0.0020525168515140306, 'weight_decay': 2.9449094846840223e-05, 'epochs': 240, 'loss': 'mae', 'optimizer': 'adam', 'graph_mode': 'cutoff', 'cutoff': 0.8580374933425603, 'grm_norm': 'cosine_then_gcn', 'self_loops': False, 'use_snp_selection': False}. Best is trial 82 with value: 0.3209301661797187.
[I 2025-12-08 21:25:19,204] Trial 111 finished with value: 0.31686013226040355 and parameters: {'model_type': 'gcn', 'hidden_dims': '[512, 256]', 'dropout': 0.46188623633917086, 'batch_norm': True, 'lr': 0.00031410035151669037, 'weight_decay': 2.0246479095523236e-06, 'epochs': 175, 'loss': 'mae', 'optimizer': 'adam', 'graph_mode': 'cutoff', 'cutoff': 0.8960520933041808, 'grm_norm': 'gcn', 'self_loops': False, 'use_snp_selection': False}. Best is trial 82 with value: 0.3209301661797187.
[I 2025-12-08 21:25:43,628] Trial 112 finished with value: 0.3157710060405449 and parameters: {'model_type': 'gcn', 'hidden_dims': '[512, 256]', 'dropout': 0.4974021908027695, 'batch_norm': True, 'lr': 0.00036884470849056207, 'weight_decay': 1.525398102959955e-06, 'epochs': 87, 'loss': 'mae', 'optimizer': 'adam', 'graph_mode': 'cutoff', 'cutoff': 0.8866610962549782, 'grm_norm': 'gcn', 'self_loops': False, 'use_snp_selection': False}. Best is trial 82 with value: 0.3209301661797187.
[I 2025-12-08 21:27:10,756] Trial 113 finished with value: 0.31298328566606826 and parameters: {'model_type': 'gcn', 'hidden_dims': '[512, 256]', 'dropout': 0.45433870091472434, 'batch_norm': True, 'lr': 0.00043862904824610357, 'weight_decay': 6.269190159353959e-05, 'epochs': 348, 'loss': 'mae', 'optimizer': 'adam', 'graph_mode': 'cutoff', 'cutoff': 0.8678864107012436, 'grm_norm': 'gcn', 'self_loops': False, 'use_snp_selection': False}. Best is trial 82 with value: 0.3209301661797187.
[I 2025-12-08 21:27:55,957] Trial 114 finished with value: 0.3150039219847945 and parameters: {'model_type': 'gcn', 'hidden_dims': '[512, 256]', 'dropout': 0.5918279209456783, 'batch_norm': True, 'lr': 0.00029745959902363514, 'weight_decay': 3.907769475325082e-05, 'epochs': 174, 'loss': 'mae', 'optimizer': 'adam', 'graph_mode': 'cutoff', 'cutoff': 0.8859006603949364, 'grm_norm': 'gcn', 'self_loops': False, 'use_snp_selection': False}. Best is trial 82 with value: 0.3209301661797187.
[I 2025-12-08 21:28:05,922] Trial 115 finished with value: 0.3122385711521485 and parameters: {'model_type': 'gcn', 'hidden_dims': '[256, 128]', 'dropout': 0.558440193378962, 'batch_norm': True, 'lr': 0.000265085018008418, 'weight_decay': 7.915125289444738e-06, 'epochs': 58, 'loss': 'mae', 'optimizer': 'adam', 'graph_mode': 'cutoff', 'cutoff': 0.8339703612011855, 'grm_norm': 'gcn', 'self_loops': False, 'use_snp_selection': False}. Best is trial 82 with value: 0.3209301661797187.
[I 2025-12-08 21:28:28,598] Trial 116 finished with value: 0.10691696011986881 and parameters: {'model_type': 'gcn', 'hidden_dims': '[512, 256]', 'dropout': 0.526248188578776, 'batch_norm': False, 'lr': 0.0005613223711558889, 'weight_decay': 2.0858956995109666e-05, 'epochs': 76, 'loss': 'mae', 'optimizer': 'adam', 'graph_mode': 'cutoff', 'cutoff': 0.5279569157770619, 'grm_norm': 'none', 'self_loops': False, 'use_snp_selection': False}. Best is trial 82 with value: 0.3209301661797187.
[I 2025-12-08 21:28:49,372] Trial 117 finished with value: 0.31399180649427616 and parameters: {'model_type': 'gcn', 'hidden_dims': '[512, 256]', 'dropout': 0.581229283586602, 'batch_norm': True, 'lr': 0.001407544261058243, 'weight_decay': 9.939887065109398e-07, 'epochs': 68, 'loss': 'mae', 'optimizer': 'adam', 'graph_mode': 'cutoff', 'cutoff': 0.8532575143103038, 'grm_norm': 'gcn', 'self_loops': False, 'use_snp_selection': False}. Best is trial 82 with value: 0.3209301661797187.
[I 2025-12-08 21:29:54,187] Trial 118 finished with value: 0.30936166515507507 and parameters: {'model_type': 'gcn', 'hidden_dims': '[512, 64]', 'dropout': 0.3271009273094385, 'batch_norm': True, 'lr': 0.00021307091338214332, 'weight_decay': 0.00021561854259405396, 'epochs': 251, 'loss': 'mae', 'optimizer': 'adam', 'graph_mode': 'cutoff', 'cutoff': 0.8103864128006529, 'grm_norm': 'gcn', 'self_loops': False, 'use_snp_selection': False}. Best is trial 82 with value: 0.3209301661797187.
[I 2025-12-08 21:30:09,800] Trial 119 finished with value: 0.3126100166901117 and parameters: {'model_type': 'gcn', 'hidden_dims': '[512, 256]', 'dropout': 0.5490198688259275, 'batch_norm': True, 'lr': 0.0006939552092027613, 'weight_decay': 2.40127596574443e-06, 'epochs': 41, 'loss': 'mae', 'optimizer': 'adam', 'graph_mode': 'cutoff', 'cutoff': 0.7799612241307735, 'grm_norm': 'gcn', 'self_loops': False, 'use_snp_selection': False}. Best is trial 82 with value: 0.3209301661797187.
