[I 2025-12-08 21:14:59,348] Trial 73 finished with value: 0.2724479716327716 and parameters: {'model_type': 'gcn', 'hidden_dims': '[128, 64]', 'dropout': 0.2666112583271094, 'batch_norm': True, 'lr': 0.000497366447766617, 'weight_decay': 3.568050804711054e-05, 'epochs': 92, 'loss': 'mae', 'optimizer': 'adam', 'graph_mode': 'cutoff', 'cutoff': 0.7141910487834231, 'grm_norm': 'cosine_then_gcn', 'self_loops': False, 'use_snp_selection': True, 'num_snps': 38972}. Best is trial 56 with value: 0.29526868984015453.
[I 2025-12-08 21:15:08,984] Trial 74 finished with value: 0.2838714176421922 and parameters: {'model_type': 'gcn', 'hidden_dims': '[256, 128, 64]', 'dropout': 0.41488555711587494, 'batch_norm': True, 'lr': 0.00032982251668016617, 'weight_decay': 1.4547337698059576e-07, 'epochs': 62, 'loss': 'mae', 'optimizer': 'adam', 'graph_mode': 'cutoff', 'cutoff': 0.6759525747808541, 'grm_norm': 'cosine_then_gcn', 'self_loops': False, 'use_snp_selection': False}. Best is trial 56 with value: 0.29526868984015453.
[I 2025-12-08 21:15:56,766] Trial 75 finished with value: 0.28516352333539585 and parameters: {'model_type': 'gcn', 'hidden_dims': '[512, 256]', 'dropout': 0.4372306515657531, 'batch_norm': True, 'lr': 0.004870905952732771, 'weight_decay': 1.6198037343033715e-05, 'epochs': 159, 'loss': 'mse', 'optimizer': 'adam', 'graph_mode': 'cutoff', 'cutoff': 0.8365692679882089, 'grm_norm': 'cosine_then_gcn', 'self_loops': True, 'use_snp_selection': True, 'num_snps': 52063}. Best is trial 56 with value: 0.29526868984015453.
[I 2025-12-08 21:16:14,415] Trial 76 finished with value: 0.28816999259873727 and parameters: {'model_type': 'gcn', 'hidden_dims': '[256, 128]', 'dropout': 0.17417479549382706, 'batch_norm': True, 'lr': 0.0001639868057370219, 'weight_decay': 6.435420334661093e-05, 'epochs': 140, 'loss': 'mae', 'optimizer': 'adam', 'graph_mode': 'cutoff', 'cutoff': 0.8081882712349636, 'grm_norm': 'cosine_then_gcn', 'self_loops': False, 'use_snp_selection': True, 'num_snps': 19991}. Best is trial 56 with value: 0.29526868984015453.
[I 2025-12-08 21:16:25,490] Trial 77 finished with value: 0.26272411078601876 and parameters: {'model_type': 'gcn', 'hidden_dims': '[256, 128]', 'dropout': 0.17423155416450803, 'batch_norm': False, 'lr': 4.447290715604501e-05, 'weight_decay': 5.3635314884837054e-05, 'epochs': 136, 'loss': 'mae', 'optimizer': 'adam', 'graph_mode': 'cutoff', 'cutoff': 0.8089532824632419, 'grm_norm': 'none', 'self_loops': False, 'use_snp_selection': True, 'num_snps': 5357}. Best is trial 56 with value: 0.29526868984015453.
[I 2025-12-08 21:16:42,376] Trial 78 finished with value: 0.18774431468060276 and parameters: {'model_type': 'gcn', 'hidden_dims': '[256, 128]', 'dropout': 0.16182877449225078, 'batch_norm': True, 'lr': 0.00014592351012742834, 'weight_decay': 6.642000292545902e-05, 'epochs': 125, 'loss': 'mse', 'optimizer': 'adam', 'graph_mode': 'knn', 'knn_k': 2, 'weighted_edges': False, 'symmetrize_mode': 'union', 'self_loops': False, 'use_snp_selection': False}. Best is trial 56 with value: 0.29526868984015453.
[I 2025-12-08 21:17:09,872] Trial 79 finished with value: 0.28725837626213524 and parameters: {'model_type': 'gcn', 'hidden_dims': '[256, 128]', 'dropout': 0.21596057936520605, 'batch_norm': True, 'lr': 0.00020180465092062806, 'weight_decay': 8.986733649856348e-05, 'epochs': 147, 'loss': 'mae', 'optimizer': 'adam', 'graph_mode': 'cutoff', 'cutoff': 0.8736238693274633, 'grm_norm': 'cosine_then_gcn', 'self_loops': True, 'use_snp_selection': True, 'num_snps': 41690}. Best is trial 56 with value: 0.29526868984015453.
[I 2025-12-08 21:17:37,850] Trial 80 finished with value: 0.28223609138500183 and parameters: {'model_type': 'gcn', 'hidden_dims': '[256, 128]', 'dropout': 0.2191358141486271, 'batch_norm': True, 'lr': 0.0001759205642678237, 'weight_decay': 0.00029212001012094704, 'epochs': 146, 'loss': 'mae', 'optimizer': 'adam', 'graph_mode': 'cutoff', 'cutoff': 0.7866474037346849, 'grm_norm': 'cosine_then_gcn', 'self_loops': True, 'use_snp_selection': True, 'num_snps': 43539}. Best is trial 56 with value: 0.29526868984015453.
[I 2025-12-08 21:18:09,261] Trial 81 finished with value: 0.28222573161371767 and parameters: {'model_type': 'gcn', 'hidden_dims': '[256, 128]', 'dropout': 0.20958604540424688, 'batch_norm': True, 'lr': 7.27784709900632e-05, 'weight_decay': 9.894036850648242e-05, 'epochs': 191, 'loss': 'mae', 'optimizer': 'adam', 'graph_mode': 'cutoff', 'cutoff': 0.8746445015454128, 'grm_norm': 'cosine_then_gcn', 'self_loops': True, 'use_snp_selection': True, 'num_snps': 41977}. Best is trial 56 with value: 0.29526868984015453.
[I 2025-12-08 21:18:33,910] Trial 82 finished with value: 0.281374188656495 and parameters: {'model_type': 'gcn', 'hidden_dims': '[256, 128]', 'dropout': 0.19263598766717488, 'batch_norm': True, 'lr': 0.00021660570544806368, 'weight_decay': 0.00014882568786394413, 'epochs': 138, 'loss': 'mae', 'optimizer': 'adam', 'graph_mode': 'cutoff', 'cutoff': 0.8981011737113875, 'grm_norm': 'cosine_then_gcn', 'self_loops': True, 'use_snp_selection': True, 'num_snps': 37449}. Best is trial 56 with value: 0.29526868984015453.
[I 2025-12-08 21:19:05,030] Trial 83 finished with value: 0.2705308109794522 and parameters: {'model_type': 'gcn', 'hidden_dims': '[256, 128]', 'dropout': 0.15595106960474434, 'batch_norm': True, 'lr': 0.00010414995223831044, 'weight_decay': 2.7156799236475164e-05, 'epochs': 168, 'loss': 'mae', 'optimizer': 'adam', 'graph_mode': 'cutoff', 'cutoff': 0.8294071863792805, 'grm_norm': 'cosine_then_gcn', 'self_loops': True, 'use_snp_selection': True, 'num_snps': 45657}. Best is trial 56 with value: 0.29526868984015453.
[I 2025-12-08 21:19:39,135] Trial 84 finished with value: 0.2881714112440539 and parameters: {'model_type': 'gcn', 'hidden_dims': '[256, 128]', 'dropout': 0.10392941954674804, 'batch_norm': True, 'lr': 0.0002774231804542923, 'weight_decay': 0.00020489571363838268, 'epochs': 179, 'loss': 'mae', 'optimizer': 'adam', 'graph_mode': 'cutoff', 'cutoff': 0.8668020484048656, 'grm_norm': 'cosine_then_gcn', 'self_loops': True, 'use_snp_selection': True, 'num_snps': 49847}. Best is trial 56 with value: 0.29526868984015453.
[I 2025-12-08 21:20:16,879] Trial 85 finished with value: 0.2849856238655939 and parameters: {'model_type': 'gcn', 'hidden_dims': '[256, 128]', 'dropout': 0.11941347504336676, 'batch_norm': True, 'lr': 0.0003747127503051668, 'weight_decay': 0.00022231790296879718, 'epochs': 221, 'loss': 'mae', 'optimizer': 'adam', 'graph_mode': 'cutoff', 'cutoff': 0.8630234706261475, 'grm_norm': 'cosine_then_gcn', 'self_loops': True, 'use_snp_selection': True, 'num_snps': 48507}. Best is trial 56 with value: 0.29526868984015453.
[I 2025-12-08 21:20:48,706] Trial 86 finished with value: 0.2839142614225973 and parameters: {'model_type': 'gcn', 'hidden_dims': '[256, 128]', 'dropout': 0.10914490683221414, 'batch_norm': True, 'lr': 0.0002952037153547343, 'weight_decay': 0.0003044619929074338, 'epochs': 208, 'loss': 'mae', 'optimizer': 'adam', 'graph_mode': 'cutoff', 'cutoff': 0.8418967237937511, 'grm_norm': 'cosine_then_gcn', 'self_loops': True, 'use_snp_selection': True, 'num_snps': 40734}. Best is trial 56 with value: 0.29526868984015453.
[I 2025-12-08 21:21:09,119] Trial 87 finished with value: 0.27912852540069555 and parameters: {'model_type': 'gcn', 'hidden_dims': '[256, 128]', 'dropout': 0.25462221095881926, 'batch_norm': True, 'lr': 0.0020627697657888476, 'weight_decay': 0.00019590505127810713, 'epochs': 158, 'loss': 'mse', 'optimizer': 'adam', 'graph_mode': 'cutoff', 'cutoff': 0.8167328612224655, 'grm_norm': 'cosine_then_gcn', 'self_loops': True, 'use_snp_selection': False}. Best is trial 56 with value: 0.29526868984015453.
[I 2025-12-08 21:21:43,299] Trial 88 finished with value: 0.28356538844993734 and parameters: {'model_type': 'gcn', 'hidden_dims': '[256, 128]', 'dropout': 0.24029507969931244, 'batch_norm': True, 'lr': 0.00017061883676560243, 'weight_decay': 8.213311906290028e-05, 'epochs': 151, 'loss': 'mae', 'optimizer': 'adam', 'graph_mode': 'cutoff', 'cutoff': 0.7710141848233041, 'grm_norm': 'cosine_then_gcn', 'self_loops': True, 'use_snp_selection': True, 'num_snps': 56303}. Best is trial 56 with value: 0.29526868984015453.
[I 2025-12-08 21:22:36,237] Trial 89 finished with value: 0.29082241711849643 and parameters: {'model_type': 'gcn', 'hidden_dims': '[512, 128]', 'dropout': 0.13954688731269577, 'batch_norm': True, 'lr': 0.00012046020518835019, 'weight_decay': 0.00012823165374023344, 'epochs': 178, 'loss': 'mae', 'optimizer': 'adam', 'graph_mode': 'cutoff', 'cutoff': 0.7322479665987587, 'grm_norm': 'gcn', 'self_loops': True, 'use_snp_selection': True, 'num_snps': 54844}. Best is trial 56 with value: 0.29526868984015453.
[I 2025-12-08 21:23:33,253] Trial 90 finished with value: 0.2211860739861095 and parameters: {'model_type': 'gcn', 'hidden_dims': '[512, 128]', 'dropout': 0.10137993569319408, 'batch_norm': True, 'lr': 0.00012555854454620536, 'weight_decay': 0.0008206889710318204, 'epochs': 196, 'loss': 'mae', 'optimizer': 'adam', 'graph_mode': 'knn', 'knn_k': 9, 'weighted_edges': True, 'symmetrize_mode': 'mutual', 'self_loops': True, 'use_snp_selection': True, 'num_snps': 53618}. Best is trial 56 with value: 0.29526868984015453.
[I 2025-12-08 21:24:26,405] Trial 91 finished with value: 0.2860633646689455 and parameters: {'model_type': 'gcn', 'hidden_dims': '[512, 128]', 'dropout': 0.12877083710118323, 'batch_norm': True, 'lr': 0.000218073539177471, 'weight_decay': 0.00012701145651340526, 'epochs': 181, 'loss': 'mae', 'optimizer': 'adam', 'graph_mode': 'cutoff', 'cutoff': 0.7300122391648878, 'grm_norm': 'gcn', 'self_loops': True, 'use_snp_selection': True, 'num_snps': 54107}. Best is trial 56 with value: 0.29526868984015453.
[I 2025-12-08 21:25:10,804] Trial 92 finished with value: 0.290245842754444 and parameters: {'model_type': 'gcn', 'hidden_dims': '[512, 128]', 'dropout': 0.14074931025617407, 'batch_norm': True, 'lr': 0.0002724568539802654, 'weight_decay': 0.00011141733320538479, 'epochs': 174, 'loss': 'mae', 'optimizer': 'adam', 'graph_mode': 'cutoff', 'cutoff': 0.7925142565909417, 'grm_norm': 'gcn', 'self_loops': True, 'use_snp_selection': True, 'num_snps': 44840}. Best is trial 56 with value: 0.29526868984015453.
[I 2025-12-08 21:25:59,107] Trial 93 finished with value: 0.2856996585523127 and parameters: {'model_type': 'gcn', 'hidden_dims': '[512, 128]', 'dropout': 0.14438334145022103, 'batch_norm': True, 'lr': 0.0002640433082884053, 'weight_decay': 0.00015994555510739523, 'epochs': 174, 'loss': 'mae', 'optimizer': 'adam', 'graph_mode': 'cutoff', 'cutoff': 0.794835454032191, 'grm_norm': 'gcn', 'self_loops': True, 'use_snp_selection': True, 'num_snps': 49398}. Best is trial 56 with value: 0.29526868984015453.
[I 2025-12-08 21:26:50,581] Trial 94 finished with value: 0.2801271690612424 and parameters: {'model_type': 'gcn', 'hidden_dims': '[512, 128]', 'dropout': 0.15034834941963574, 'batch_norm': True, 'lr': 0.0004194403924480958, 'weight_decay': 0.0004460880355617215, 'epochs': 184, 'loss': 'mae', 'optimizer': 'adam', 'graph_mode': 'cutoff', 'cutoff': 0.7495431350452051, 'grm_norm': 'gcn', 'self_loops': True, 'use_snp_selection': True, 'num_snps': 50915}. Best is trial 56 with value: 0.29526868984015453.
[I 2025-12-08 21:27:40,927] Trial 95 finished with value: 0.2900110736461724 and parameters: {'model_type': 'gcn', 'hidden_dims': '[512, 128]', 'dropout': 0.1229477704664477, 'batch_norm': True, 'lr': 8.424979877519783e-05, 'weight_decay': 4.181394508031243e-05, 'epochs': 164, 'loss': 'mae', 'optimizer': 'adam', 'graph_mode': 'cutoff', 'cutoff': 0.8417466455258099, 'grm_norm': 'gcn', 'self_loops': True, 'use_snp_selection': True, 'num_snps': 55023}. Best is trial 56 with value: 0.29526868984015453.
[I 2025-12-08 21:28:32,169] Trial 96 finished with value: 0.2865376160648306 and parameters: {'model_type': 'gcn', 'hidden_dims': '[512, 128]', 'dropout': 0.11813408923787248, 'batch_norm': True, 'lr': 8.23212878080767e-05, 'weight_decay': 6.63730183720244e-05, 'epochs': 164, 'loss': 'mae', 'optimizer': 'adam', 'graph_mode': 'cutoff', 'cutoff': 0.797475584986745, 'grm_norm': 'gcn', 'self_loops': True, 'use_snp_selection': True, 'num_snps': 55896}. Best is trial 56 with value: 0.29526868984015453.
[I 2025-12-08 21:29:20,866] Trial 97 finished with value: 0.2971112464959694 and parameters: {'model_type': 'gcn', 'hidden_dims': '[512, 128]', 'dropout': 0.1327699466964669, 'batch_norm': True, 'lr': 9.725182133606797e-05, 'weight_decay': 0.0001123301007763376, 'epochs': 200, 'loss': 'mae', 'optimizer': 'adam', 'graph_mode': 'cutoff', 'cutoff': 0.8542703520320456, 'grm_norm': 'gcn', 'self_loops': True, 'use_snp_selection': True, 'num_snps': 44816}. Best is trial 97 with value: 0.2971112464959694.
[I 2025-12-08 21:30:25,962] Trial 98 finished with value: 0.2147072956250097 and parameters: {'model_type': 'gcn', 'hidden_dims': '[512, 128]', 'dropout': 0.13278953629297707, 'batch_norm': True, 'lr': 9.494381504941037e-05, 'weight_decay': 0.00010620108669935726, 'epochs': 212, 'loss': 'mae', 'optimizer': 'adam', 'graph_mode': 'cutoff', 'cutoff': 0.3525481521787551, 'grm_norm': 'gcn', 'self_loops': True, 'use_snp_selection': True, 'num_snps': 59743}. Best is trial 97 with value: 0.2971112464959694.
[I 2025-12-08 21:31:15,208] Trial 99 finished with value: 0.26904383133631854 and parameters: {'model_type': 'gcn', 'hidden_dims': '[512, 128]', 'dropout': 0.1230015463697551, 'batch_norm': True, 'lr': 5.576338986591971e-05, 'weight_decay': 0.0003470045071373653, 'epochs': 198, 'loss': 'mae', 'optimizer': 'adam', 'graph_mode': 'cutoff', 'cutoff': 0.8502679730880965, 'grm_norm': 'gcn', 'self_loops': True, 'use_snp_selection': True, 'num_snps': 45387}. Best is trial 97 with value: 0.2971112464959694.
[I 2025-12-08 21:32:01,679] Trial 100 finished with value: 0.2894650491463519 and parameters: {'model_type': 'gcn', 'hidden_dims': '[512, 128]', 'dropout': 0.10803691801353466, 'batch_norm': True, 'lr': 0.00012295239958159815, 'weight_decay': 4.030344043100299e-05, 'epochs': 189, 'loss': 'mae', 'optimizer': 'adam', 'graph_mode': 'cutoff', 'cutoff': 0.7655094222475147, 'grm_norm': 'gcn', 'self_loops': True, 'use_snp_selection': True, 'num_snps': 44064}. Best is trial 97 with value: 0.2971112464959694.
[I 2025-12-08 21:32:53,484] Trial 101 finished with value: 0.2895542187652347 and parameters: {'model_type': 'gcn', 'hidden_dims': '[512, 128]', 'dropout': 0.14168809695546009, 'batch_norm': True, 'lr': 0.00013904945937329632, 'weight_decay': 4.602115008203166e-05, 'epochs': 221, 'loss': 'mae', 'optimizer': 'adam', 'graph_mode': 'cutoff', 'cutoff': 0.7196703429111824, 'grm_norm': 'gcn', 'self_loops': True, 'use_snp_selection': True, 'num_snps': 44149}. Best is trial 97 with value: 0.2971112464959694.
[I 2025-12-08 21:33:47,548] Trial 102 finished with value: 0.2894727641982154 and parameters: {'model_type': 'gcn', 'hidden_dims': '[512, 128]', 'dropout': 0.16347825770132612, 'batch_norm': True, 'lr': 0.00012360513098864066, 'weight_decay': 4.595554270142151e-05, 'epochs': 234, 'loss': 'mae', 'optimizer': 'adam', 'graph_mode': 'cutoff', 'cutoff': 0.7331455627053421, 'grm_norm': 'gcn', 'self_loops': True, 'use_snp_selection': True, 'num_snps': 44373}. Best is trial 97 with value: 0.2971112464959694.
[I 2025-12-08 21:34:43,103] Trial 103 finished with value: 0.28888776937232236 and parameters: {'model_type': 'gcn', 'hidden_dims': '[512, 128]', 'dropout': 0.1407887840279275, 'batch_norm': True, 'lr': 0.00011503590566925095, 'weight_decay': 4.30203842143305e-05, 'epochs': 237, 'loss': 'mae', 'optimizer': 'adam', 'graph_mode': 'cutoff', 'cutoff': 0.7215427831107708, 'grm_norm': 'gcn', 'self_loops': True, 'use_snp_selection': True, 'num_snps': 44945}. Best is trial 97 with value: 0.2971112464959694.
[I 2025-12-08 21:35:40,048] Trial 104 finished with value: 0.28487328413919133 and parameters: {'model_type': 'gcn', 'hidden_dims': '[512, 128]', 'dropout': 0.16205722321949928, 'batch_norm': True, 'lr': 0.00012953969069267788, 'weight_decay': 3.5784302530834824e-05, 'epochs': 253, 'loss': 'mae', 'optimizer': 'adam', 'graph_mode': 'cutoff', 'cutoff': 0.6729984226745593, 'grm_norm': 'gcn', 'self_loops': True, 'use_snp_selection': True, 'num_snps': 44049}. Best is trial 97 with value: 0.2971112464959694.
[I 2025-12-08 21:36:23,230] Trial 105 finished with value: 0.27226869962124967 and parameters: {'model_type': 'gcn', 'hidden_dims': '[512, 128]', 'dropout': 0.14182411541556939, 'batch_norm': True, 'lr': 7.451836452605105e-05, 'weight_decay': 4.996283465108862e-05, 'epochs': 206, 'loss': 'mae', 'optimizer': 'adam', 'graph_mode': 'cutoff', 'cutoff': 0.6322118412034639, 'grm_norm': 'gcn', 'self_loops': True, 'use_snp_selection': True, 'num_snps': 37046}. Best is trial 97 with value: 0.2971112464959694.
[I 2025-12-08 21:37:18,379] Trial 106 finished with value: 0.2885283464299574 and parameters: {'model_type': 'gcn', 'hidden_dims': '[512, 128]', 'dropout': 0.18949687279288532, 'batch_norm': True, 'lr': 9.18887624035064e-05, 'weight_decay': 3.269369370409312e-05, 'epochs': 221, 'loss': 'mae', 'optimizer': 'adam', 'graph_mode': 'cutoff', 'cutoff': 0.7462134534203478, 'grm_norm': 'gcn', 'self_loops': True, 'use_snp_selection': True, 'num_snps': 47834}. Best is trial 97 with value: 0.2971112464959694.
[I 2025-12-08 21:38:15,609] Trial 107 finished with value: 0.28124581743546456 and parameters: {'model_type': 'gcn', 'hidden_dims': '[512, 128]', 'dropout': 0.16722799704723354, 'batch_norm': True, 'lr': 0.00013124049237798585, 'weight_decay': 7.537968754086968e-05, 'epochs': 280, 'loss': 'mae', 'optimizer': 'adam', 'graph_mode': 'cutoff', 'cutoff': 0.704908975032402, 'grm_norm': 'gcn', 'self_loops': True, 'use_snp_selection': True, 'num_snps': 40042}. Best is trial 97 with value: 0.2971112464959694.
[I 2025-12-08 21:39:15,404] Trial 108 finished with value: 0.29068809201678464 and parameters: {'model_type': 'gcn', 'hidden_dims': '[512, 128]', 'dropout': 0.11462597125696, 'batch_norm': True, 'lr': 0.00010289670852301993, 'weight_decay': 4.680878496726356e-05, 'epochs': 221, 'loss': 'mae', 'optimizer': 'adam', 'graph_mode': 'cutoff', 'cutoff': 0.7633606510365072, 'grm_norm': 'gcn', 'self_loops': True, 'use_snp_selection': True, 'num_snps': 52629}. Best is trial 97 with value: 0.2971112464959694.
[I 2025-12-08 21:40:17,897] Trial 109 finished with value: 0.28550235848255073 and parameters: {'model_type': 'gcn', 'hidden_dims': '[512, 128]', 'dropout': 0.1121801615544991, 'batch_norm': True, 'lr': 0.00015776877426558648, 'weight_decay': 4.86028137017672e-05, 'epochs': 236, 'loss': 'mae', 'optimizer': 'adam', 'graph_mode': 'cutoff', 'cutoff': 0.6919862813484196, 'grm_norm': 'gcn', 'self_loops': True, 'use_snp_selection': True, 'num_snps': 52287}. Best is trial 97 with value: 0.2971112464959694.
[I 2025-12-08 21:41:14,082] Trial 110 finished with value: 0.22968372480048563 and parameters: {'model_type': 'gcn', 'hidden_dims': '[512, 128]', 'dropout': 0.1274311317864715, 'batch_norm': True, 'lr': 9.708032342285669e-05, 'weight_decay': 0.00011330191762898829, 'epochs': 225, 'loss': 'mae', 'optimizer': 'adam', 'graph_mode': 'knn', 'knn_k': 6, 'weighted_edges': True, 'symmetrize_mode': 'union', 'self_loops': True, 'use_snp_selection': True, 'num_snps': 46642}. Best is trial 97 with value: 0.2971112464959694.
[I 2025-12-08 21:42:11,526] Trial 111 finished with value: 0.29663720427943296 and parameters: {'model_type': 'gcn', 'hidden_dims': '[512, 128]', 'dropout': 0.15422011406445446, 'batch_norm': True, 'lr': 7.843963117026735e-05, 'weight_decay': 3.925383489972933e-05, 'epochs': 201, 'loss': 'mae', 'optimizer': 'adam', 'graph_mode': 'cutoff', 'cutoff': 0.7670418388358929, 'grm_norm': 'gcn', 'self_loops': True, 'use_snp_selection': True, 'num_snps': 54784}. Best is trial 97 with value: 0.2971112464959694.
[I 2025-12-08 21:43:11,370] Trial 112 finished with value: 0.2715620620719816 and parameters: {'model_type': 'gcn', 'hidden_dims': '[512, 128]', 'dropout': 0.15147886028731816, 'batch_norm': True, 'lr': 8.441079968960944e-05, 'weight_decay': 1.8274596294311073e-05, 'epochs': 215, 'loss': 'mae', 'optimizer': 'adam', 'graph_mode': 'cutoff', 'cutoff': 0.7676603328006041, 'grm_norm': 'gcn', 'self_loops': True, 'use_snp_selection': True, 'num_snps': 53967}. Best is trial 97 with value: 0.2971112464959694.
[I 2025-12-08 21:44:09,534] Trial 113 finished with value: 0.2840890374564321 and parameters: {'model_type': 'gcn', 'hidden_dims': '[512, 128]', 'dropout': 0.11376349435765783, 'batch_norm': True, 'lr': 0.00011811482790811107, 'weight_decay': 2.5436226250243802e-05, 'epochs': 190, 'loss': 'mae', 'optimizer': 'adam', 'graph_mode': 'cutoff', 'cutoff': 0.7446855151211816, 'grm_norm': 'gcn', 'self_loops': True, 'use_snp_selection': True, 'num_snps': 58239}. Best is trial 97 with value: 0.2971112464959694.
[I 2025-12-08 21:45:08,044] Trial 114 finished with value: 0.28279913561042724 and parameters: {'model_type': 'gcn', 'hidden_dims': '[512, 128]', 'dropout': 0.1395047058757641, 'batch_norm': True, 'lr': 0.0001358230000343099, 'weight_decay': 5.8236421246407435e-05, 'epochs': 200, 'loss': 'mae', 'optimizer': 'adam', 'graph_mode': 'cutoff', 'cutoff': 0.7288923501359835, 'grm_norm': 'gcn', 'self_loops': True, 'use_snp_selection': True, 'num_snps': 55749}. Best is trial 97 with value: 0.2971112464959694.
[I 2025-12-08 21:46:16,186] Trial 115 finished with value: 0.28815885566678534 and parameters: {'model_type': 'gcn', 'hidden_dims': '[512, 128]', 'dropout': 0.154547373368553, 'batch_norm': True, 'lr': 7.838227171307136e-05, 'weight_decay': 3.948379868508583e-05, 'epochs': 254, 'loss': 'mae', 'optimizer': 'adam', 'graph_mode': 'cutoff', 'cutoff': 0.7595408036787175, 'grm_norm': 'gcn', 'self_loops': True, 'use_snp_selection': True, 'num_snps': 54966}. Best is trial 97 with value: 0.2971112464959694.
