[I 2025-12-08 21:46:47,677] Trial 18 finished with value: 0.10088878607891996 and parameters: {'model_type': 'gcn', 'hidden_dims': '[256, 128]', 'dropout': 0.2802852368181955, 'batch_norm': False, 'lr': 0.009001403382035356, 'weight_decay': 2.9935088137514655e-05, 'epochs': 92, 'loss': 'mae', 'optimizer': 'adam', 'graph_mode': 'cutoff', 'cutoff': 0.2071604959820907, 'grm_norm': 'none', 'self_loops': False, 'use_snp_selection': True, 'num_snps': 12022}. Best is trial 14 with value: 0.36156912815813697.
[I 2025-12-08 21:47:14,208] Trial 19 finished with value: 0.3475396878194984 and parameters: {'model_type': 'gcn', 'hidden_dims': '[512, 256]', 'dropout': 0.3699065019632123, 'batch_norm': True, 'lr': 0.00038332305559555277, 'weight_decay': 0.00013429792469499315, 'epochs': 157, 'loss': 'mae', 'optimizer': 'adam', 'graph_mode': 'cutoff', 'cutoff': 0.75565169836058, 'grm_norm': 'none', 'self_loops': False, 'use_snp_selection': True, 'num_snps': 23457}. Best is trial 14 with value: 0.36156912815813697.
[I 2025-12-08 21:47:48,755] Trial 20 finished with value: 0.3649142115175917 and parameters: {'model_type': 'gcn', 'hidden_dims': '[512, 256]', 'dropout': 0.4638536823965651, 'batch_norm': False, 'lr': 4.7542775824251976e-05, 'weight_decay': 0.00012875324623784108, 'epochs': 152, 'loss': 'mae', 'optimizer': 'adam', 'graph_mode': 'cutoff', 'cutoff': 0.7202665079190451, 'grm_norm': 'cosine_then_gcn', 'self_loops': False, 'use_snp_selection': True, 'num_snps': 35605}. Best is trial 20 with value: 0.3649142115175917.
[I 2025-12-08 21:48:20,899] Trial 21 finished with value: 0.3623470147390077 and parameters: {'model_type': 'gcn', 'hidden_dims': '[512, 256]', 'dropout': 0.49339423936239957, 'batch_norm': False, 'lr': 4.015373560593206e-05, 'weight_decay': 0.0001490857026702516, 'epochs': 150, 'loss': 'mae', 'optimizer': 'adam', 'graph_mode': 'cutoff', 'cutoff': 0.7064455836731192, 'grm_norm': 'cosine_then_gcn', 'self_loops': False, 'use_snp_selection': True, 'num_snps': 32557}. Best is trial 20 with value: 0.3649142115175917.
[I 2025-12-08 21:49:09,223] Trial 22 finished with value: 0.3612533323753525 and parameters: {'model_type': 'gcn', 'hidden_dims': '[512, 256]', 'dropout': 0.4931965806818451, 'batch_norm': False, 'lr': 3.9611424157759836e-05, 'weight_decay': 0.000785430261129422, 'epochs': 235, 'loss': 'mae', 'optimizer': 'adam', 'graph_mode': 'cutoff', 'cutoff': 0.676067287657246, 'grm_norm': 'cosine_then_gcn', 'self_loops': False, 'use_snp_selection': True, 'num_snps': 38069}. Best is trial 20 with value: 0.3649142115175917.
[I 2025-12-08 21:49:40,768] Trial 23 finished with value: 0.3566728096056449 and parameters: {'model_type': 'gcn', 'hidden_dims': '[512, 256]', 'dropout': 0.5999197535253702, 'batch_norm': False, 'lr': 4.683186859157406e-05, 'weight_decay': 0.00011635502715071135, 'epochs': 144, 'loss': 'mae', 'optimizer': 'adam', 'graph_mode': 'cutoff', 'cutoff': 0.5161285425297095, 'grm_norm': 'cosine_then_gcn', 'self_loops': False, 'use_snp_selection': True, 'num_snps': 32812}. Best is trial 20 with value: 0.3649142115175917.
[I 2025-12-08 21:50:18,992] Trial 24 finished with value: 0.3626980720369349 and parameters: {'model_type': 'gcn', 'hidden_dims': '[512, 256]', 'dropout': 0.5170109882252932, 'batch_norm': False, 'lr': 5.374660988090078e-05, 'weight_decay': 1.8281316489053304e-05, 'epochs': 184, 'loss': 'mae', 'optimizer': 'adam', 'graph_mode': 'cutoff', 'cutoff': 0.6924305620474986, 'grm_norm': 'cosine_then_gcn', 'self_loops': False, 'use_snp_selection': True, 'num_snps': 34628}. Best is trial 20 with value: 0.3649142115175917.
[I 2025-12-08 21:50:56,689] Trial 25 finished with value: 0.3422548559479667 and parameters: {'model_type': 'gcn', 'hidden_dims': '[512, 64]', 'dropout': 0.5290289537373335, 'batch_norm': False, 'lr': 1.0693095775852588e-05, 'weight_decay': 0.00029176460943073886, 'epochs': 186, 'loss': 'mae', 'optimizer': 'adam', 'graph_mode': 'cutoff', 'cutoff': 0.6877520682243774, 'grm_norm': 'cosine_then_gcn', 'self_loops': False, 'use_snp_selection': True, 'num_snps': 34187}. Best is trial 20 with value: 0.3649142115175917.
[I 2025-12-08 21:51:56,338] Trial 26 finished with value: 0.3459024926794318 and parameters: {'model_type': 'gcn', 'hidden_dims': '[512, 128]', 'dropout': 0.5128565172573342, 'batch_norm': False, 'lr': 4.306453354056674e-05, 'weight_decay': 7.418792968858619e-05, 'epochs': 237, 'loss': 'mse', 'optimizer': 'adam', 'graph_mode': 'cutoff', 'cutoff': 0.6876447038431496, 'grm_norm': 'cosine_then_gcn', 'self_loops': True, 'use_snp_selection': False}. Best is trial 20 with value: 0.3649142115175917.
[I 2025-12-08 21:52:33,191] Trial 27 finished with value: 0.35018117634926893 and parameters: {'model_type': 'gcn', 'hidden_dims': '[256, 128]', 'dropout': 0.4545661128149482, 'batch_norm': False, 'lr': 2.2165181635985883e-05, 'weight_decay': 5.161930867201548e-06, 'epochs': 169, 'loss': 'mae', 'optimizer': 'adam', 'graph_mode': 'cutoff', 'cutoff': 0.5301080261802914, 'grm_norm': 'cosine_then_gcn', 'self_loops': False, 'use_snp_selection': True, 'num_snps': 58692}. Best is trial 20 with value: 0.3649142115175917.
[I 2025-12-08 21:53:10,410] Trial 28 finished with value: 0.29800079732244 and parameters: {'model_type': 'gcn', 'hidden_dims': '[256, 128, 64]', 'dropout': 0.5798773798634216, 'batch_norm': False, 'lr': 5.6474392040953414e-05, 'weight_decay': 0.00017703823386701537, 'epochs': 225, 'loss': 'mae', 'optimizer': 'adam', 'graph_mode': 'cutoff', 'cutoff': 0.7878824300268895, 'grm_norm': 'cosine_then_gcn', 'self_loops': False, 'use_snp_selection': True, 'num_snps': 45963}. Best is trial 20 with value: 0.3649142115175917.
[I 2025-12-08 21:53:35,399] Trial 29 finished with value: 0.34221170693100333 and parameters: {'model_type': 'gcn', 'hidden_dims': '[128, 64]', 'dropout': 0.4591213899925705, 'batch_norm': False, 'lr': 2.0204664298628884e-05, 'weight_decay': 7.216367944318404e-05, 'epochs': 267, 'loss': 'mae', 'optimizer': 'adam', 'graph_mode': 'cutoff', 'cutoff': 0.4492027230593692, 'grm_norm': 'cosine_then_gcn', 'self_loops': True, 'use_snp_selection': True, 'num_snps': 35110}. Best is trial 20 with value: 0.3649142115175917.
[I 2025-12-08 21:54:05,477] Trial 30 finished with value: 0.3556546819480202 and parameters: {'model_type': 'gcn', 'hidden_dims': '[512, 256]', 'dropout': 0.5318568033909246, 'batch_norm': False, 'lr': 0.0001113973697024694, 'weight_decay': 9.914281038060084e-06, 'epochs': 194, 'loss': 'mae', 'optimizer': 'adam', 'graph_mode': 'cutoff', 'cutoff': 0.6696605608600303, 'grm_norm': 'cosine_then_gcn', 'self_loops': False, 'use_snp_selection': True, 'num_snps': 23907}. Best is trial 20 with value: 0.3649142115175917.
[I 2025-12-08 21:54:34,421] Trial 31 finished with value: 0.3612981829184484 and parameters: {'model_type': 'gcn', 'hidden_dims': '[512, 256]', 'dropout': 0.4390962809668691, 'batch_norm': False, 'lr': 0.00018823907240251802, 'weight_decay': 2.3004193876892753e-05, 'epochs': 145, 'loss': 'mae', 'optimizer': 'adam', 'graph_mode': 'cutoff', 'cutoff': 0.8469714428340476, 'grm_norm': 'cosine_then_gcn', 'self_loops': False, 'use_snp_selection': True, 'num_snps': 28743}. Best is trial 20 with value: 0.3649142115175917.
[I 2025-12-08 21:55:05,957] Trial 32 finished with value: 0.35850287677967574 and parameters: {'model_type': 'gcn', 'hidden_dims': '[512, 256]', 'dropout': 0.36256534495474335, 'batch_norm': False, 'lr': 2.9336392948654245e-05, 'weight_decay': 2.7900238062632725e-05, 'epochs': 115, 'loss': 'mae', 'optimizer': 'adam', 'graph_mode': 'cutoff', 'cutoff': 0.7268514711004552, 'grm_norm': 'gcn', 'self_loops': False, 'use_snp_selection': True, 'num_snps': 39405}. Best is trial 20 with value: 0.3649142115175917.
[I 2025-12-08 21:55:29,627] Trial 33 finished with value: 0.3505028363655804 and parameters: {'model_type': 'gcn', 'hidden_dims': '[512, 256]', 'dropout': 0.49871766418623836, 'batch_norm': False, 'lr': 5.813057531182535e-05, 'weight_decay': 3.75947838675181e-05, 'epochs': 130, 'loss': 'mae', 'optimizer': 'adam', 'graph_mode': 'cutoff', 'cutoff': 0.8144921401677985, 'grm_norm': 'cosine_then_gcn', 'self_loops': False, 'use_snp_selection': True, 'num_snps': 22719}. Best is trial 20 with value: 0.3649142115175917.
[I 2025-12-08 21:56:09,256] Trial 34 finished with value: 0.10369737191956929 and parameters: {'model_type': 'gcn', 'hidden_dims': '[256, 128, 64]', 'dropout': 0.5443811218205801, 'batch_norm': False, 'lr': 0.00014130024229723262, 'weight_decay': 2.5544420261531497e-06, 'epochs': 315, 'loss': 'mae', 'optimizer': 'adam', 'graph_mode': 'cutoff', 'cutoff': 0.8980926417567675, 'grm_norm': 'cosine_then_gcn', 'self_loops': False, 'use_snp_selection': False}. Best is trial 20 with value: 0.3649142115175917.
[I 2025-12-08 21:56:48,043] Trial 35 finished with value: 0.3358633204761362 and parameters: {'model_type': 'gcn', 'hidden_dims': '[512, 256]', 'dropout': 0.4339762181504073, 'batch_norm': False, 'lr': 7.080968038806762e-05, 'weight_decay': 4.830936308591571e-07, 'epochs': 208, 'loss': 'mse', 'optimizer': 'adam', 'graph_mode': 'knn', 'knn_k': 10, 'weighted_edges': True, 'symmetrize_mode': 'mutual', 'self_loops': True, 'use_snp_selection': True, 'num_snps': 30747}. Best is trial 20 with value: 0.3649142115175917.
[I 2025-12-08 21:57:11,071] Trial 36 finished with value: 0.2184367574013209 and parameters: {'model_type': 'gcn', 'hidden_dims': '[512, 64]', 'dropout': 0.38927213519856213, 'batch_norm': False, 'lr': 0.00026483924273018475, 'weight_decay': 5.626198787026597e-05, 'epochs': 65, 'loss': 'mae', 'optimizer': 'adam', 'graph_mode': 'cutoff', 'cutoff': 0.5675072015869423, 'grm_norm': 'cosine_then_gcn', 'self_loops': False, 'use_snp_selection': True, 'num_snps': 35960}. Best is trial 20 with value: 0.3649142115175917.
[I 2025-12-08 21:57:30,621] Trial 37 finished with value: 0.0 and parameters: {'model_type': 'gcn', 'hidden_dims': '[256, 128]', 'dropout': 0.5645034195326366, 'batch_norm': False, 'lr': 0.0005249432308819703, 'weight_decay': 1.7808579302189897e-05, 'epochs': 152, 'loss': 'mae', 'optimizer': 'adam', 'graph_mode': 'cutoff', 'cutoff': 0.6402956794072165, 'grm_norm': 'none', 'self_loops': False, 'use_snp_selection': False}. Best is trial 20 with value: 0.3649142115175917.
[I 2025-12-08 21:57:48,316] Trial 38 finished with value: 0.31851759898975257 and parameters: {'model_type': 'gcn', 'hidden_dims': '[128, 64]', 'dropout': 0.5059899141822739, 'batch_norm': False, 'lr': 1.4910619020553201e-05, 'weight_decay': 0.0003733979600895169, 'epochs': 177, 'loss': 'mse', 'optimizer': 'adam', 'graph_mode': 'cutoff', 'cutoff': 0.7200087376033822, 'grm_norm': 'gcn', 'self_loops': True, 'use_snp_selection': True, 'num_snps': 25721}. Best is trial 20 with value: 0.3649142115175917.
[I 2025-12-08 21:58:20,466] Trial 39 finished with value: 0.2933992004885912 and parameters: {'model_type': 'gcn', 'hidden_dims': '[512, 256]', 'dropout': 0.4703811145469891, 'batch_norm': True, 'lr': 9.705336676567116e-05, 'weight_decay': 1.0904175637065233e-05, 'epochs': 102, 'loss': 'mae', 'optimizer': 'adam', 'graph_mode': 'knn', 'knn_k': 7, 'weighted_edges': False, 'symmetrize_mode': 'mutual', 'self_loops': False, 'use_snp_selection': True, 'num_snps': 42224}. Best is trial 20 with value: 0.3649142115175917.
[I 2025-12-08 21:59:26,122] Trial 40 finished with value: 0.3231027730874233 and parameters: {'model_type': 'gcn', 'hidden_dims': '[512, 256]', 'dropout': 0.32596708987758605, 'batch_norm': False, 'lr': 2.924090869860566e-05, 'weight_decay': 3.4766968249835603e-06, 'epochs': 259, 'loss': 'mse', 'optimizer': 'adam', 'graph_mode': 'cutoff', 'cutoff': 0.47657688646491514, 'grm_norm': 'cosine_then_gcn', 'self_loops': False, 'use_snp_selection': False}. Best is trial 20 with value: 0.3649142115175917.
[I 2025-12-08 21:59:57,399] Trial 41 finished with value: 0.356873609728521 and parameters: {'model_type': 'gcn', 'hidden_dims': '[512, 256]', 'dropout': 0.43877086236783763, 'batch_norm': False, 'lr': 0.00017945580680832807, 'weight_decay': 2.574060060036178e-05, 'epochs': 144, 'loss': 'mae', 'optimizer': 'adam', 'graph_mode': 'cutoff', 'cutoff': 0.827357112053011, 'grm_norm': 'cosine_then_gcn', 'self_loops': False, 'use_snp_selection': True, 'num_snps': 32408}. Best is trial 20 with value: 0.3649142115175917.
[I 2025-12-08 22:00:33,314] Trial 42 finished with value: 0.34589607123655797 and parameters: {'model_type': 'gcn', 'hidden_dims': '[512, 256]', 'dropout': 0.4430082528541876, 'batch_norm': False, 'lr': 0.00027545856483009493, 'weight_decay': 0.00020034942213358138, 'epochs': 199, 'loss': 'mae', 'optimizer': 'adam', 'graph_mode': 'cutoff', 'cutoff': 0.8429602227811902, 'grm_norm': 'cosine_then_gcn', 'self_loops': False, 'use_snp_selection': True, 'num_snps': 29682}. Best is trial 20 with value: 0.3649142115175917.
[I 2025-12-08 22:00:59,171] Trial 43 finished with value: 0.36201796963571903 and parameters: {'model_type': 'gcn', 'hidden_dims': '[512, 256]', 'dropout': 0.40749341495157276, 'batch_norm': False, 'lr': 7.440093242287664e-05, 'weight_decay': 8.343250494484169e-06, 'epochs': 167, 'loss': 'mae', 'optimizer': 'adam', 'graph_mode': 'cutoff', 'cutoff': 0.7941102010038901, 'grm_norm': 'cosine_then_gcn', 'self_loops': False, 'use_snp_selection': True, 'num_snps': 21095}. Best is trial 20 with value: 0.3649142115175917.
[I 2025-12-08 22:01:29,060] Trial 44 finished with value: 0.35152557030331216 and parameters: {'model_type': 'gcn', 'hidden_dims': '[512, 256]', 'dropout': 0.4151281830632267, 'batch_norm': False, 'lr': 7.244569374241126e-05, 'weight_decay': 8.38253512739965e-06, 'epochs': 218, 'loss': 'mae', 'optimizer': 'adam', 'graph_mode': 'cutoff', 'cutoff': 0.8086986098667494, 'grm_norm': 'gcn', 'self_loops': False, 'use_snp_selection': True, 'num_snps': 20874}. Best is trial 20 with value: 0.3649142115175917.
[I 2025-12-08 22:01:58,995] Trial 45 finished with value: 0.32527472432056 and parameters: {'model_type': 'gcn', 'hidden_dims': '[512, 256]', 'dropout': 0.34434236316231626, 'batch_norm': True, 'lr': 1.599602138451479e-05, 'weight_decay': 4.871523239256223e-05, 'epochs': 165, 'loss': 'mae', 'optimizer': 'adam', 'graph_mode': 'cutoff', 'cutoff': 0.7638781985036536, 'grm_norm': 'cosine', 'self_loops': False, 'use_snp_selection': True, 'num_snps': 26491}. Best is trial 20 with value: 0.3649142115175917.
[I 2025-12-08 22:02:18,191] Trial 46 finished with value: 0.34088514101384226 and parameters: {'model_type': 'gcn', 'hidden_dims': '[512, 64]', 'dropout': 0.38414328955987376, 'batch_norm': False, 'lr': 5.9048016135823595e-05, 'weight_decay': 7.425844927931001e-07, 'epochs': 120, 'loss': 'mae', 'optimizer': 'adam', 'graph_mode': 'knn', 'knn_k': 1, 'weighted_edges': True, 'symmetrize_mode': 'mutual', 'self_loops': True, 'use_snp_selection': True, 'num_snps': 16634}. Best is trial 20 with value: 0.3649142115175917.
[I 2025-12-08 22:03:09,869] Trial 47 finished with value: 0.3619569960198975 and parameters: {'model_type': 'gcn', 'hidden_dims': '[512, 128]', 'dropout': 0.46993596450675845, 'batch_norm': False, 'lr': 0.00012345732628838565, 'weight_decay': 1.977174657032247e-07, 'epochs': 192, 'loss': 'mae', 'optimizer': 'adam', 'graph_mode': 'cutoff', 'cutoff': 0.713011082503339, 'grm_norm': 'none', 'self_loops': False, 'use_snp_selection': True, 'num_snps': 50080}. Best is trial 20 with value: 0.3649142115175917.
[I 2025-12-08 22:03:58,216] Trial 48 finished with value: 0.35608704030207416 and parameters: {'model_type': 'gcn', 'hidden_dims': '[512, 128]', 'dropout': 0.47823241410544404, 'batch_norm': False, 'lr': 0.00013074766783191215, 'weight_decay': 1.0361089606178755e-07, 'epochs': 189, 'loss': 'mae', 'optimizer': 'adam', 'graph_mode': 'cutoff', 'cutoff': 0.6444178119588341, 'grm_norm': 'cosine', 'self_loops': False, 'use_snp_selection': False}. Best is trial 20 with value: 0.3649142115175917.
[I 2025-12-08 22:04:46,010] Trial 49 finished with value: 0.3018048177361032 and parameters: {'model_type': 'gcn', 'hidden_dims': '[512, 128]', 'dropout': 0.5101444554670155, 'batch_norm': True, 'lr': 7.809273028629709e-05, 'weight_decay': 2.110515740152481e-07, 'epochs': 171, 'loss': 'mse', 'optimizer': 'adam', 'graph_mode': 'cutoff', 'cutoff': 0.5896951299858874, 'grm_norm': 'cosine_then_gcn', 'self_loops': False, 'use_snp_selection': True, 'num_snps': 49330}. Best is trial 20 with value: 0.3649142115175917.
[I 2025-12-08 22:05:47,630] Trial 50 finished with value: 0.34377522083340983 and parameters: {'model_type': 'gcn', 'hidden_dims': '[512, 128]', 'dropout': 0.5273579241745686, 'batch_norm': False, 'lr': 3.160500038612227e-05, 'weight_decay': 0.0004951127989263795, 'epochs': 204, 'loss': 'mae', 'optimizer': 'adam', 'graph_mode': 'knn', 'knn_k': 8, 'weighted_edges': False, 'symmetrize_mode': 'union', 'self_loops': False, 'use_snp_selection': True, 'num_snps': 55054}. Best is trial 20 with value: 0.3649142115175917.
[I 2025-12-08 22:06:04,449] Trial 51 finished with value: 0.354491080257169 and parameters: {'model_type': 'gcn', 'hidden_dims': '[512, 128]', 'dropout': 0.4700787200691922, 'batch_norm': False, 'lr': 0.00014905344138965053, 'weight_decay': 1.3207899074931121e-06, 'epochs': 133, 'loss': 'mae', 'optimizer': 'adam', 'graph_mode': 'cutoff', 'cutoff': 0.7041959247847773, 'grm_norm': 'none', 'self_loops': False, 'use_snp_selection': True, 'num_snps': 12350}. Best is trial 20 with value: 0.3649142115175917.
[I 2025-12-08 22:06:51,522] Trial 52 finished with value: 0.3615879887239562 and parameters: {'model_type': 'gcn', 'hidden_dims': '[512, 256]', 'dropout': 0.4234386685532348, 'batch_norm': False, 'lr': 5.092305225277743e-05, 'weight_decay': 1.870293485702146e-07, 'epochs': 161, 'loss': 'mae', 'optimizer': 'adam', 'graph_mode': 'cutoff', 'cutoff': 0.784377811725535, 'grm_norm': 'none', 'self_loops': False, 'use_snp_selection': True, 'num_snps': 51199}. Best is trial 20 with value: 0.3649142115175917.
[I 2025-12-08 22:07:18,202] Trial 53 finished with value: 0.32378754740250315 and parameters: {'model_type': 'gcn', 'hidden_dims': '[128, 64]', 'dropout': 0.42078884111967396, 'batch_norm': False, 'lr': 9.417734601139863e-05, 'weight_decay': 1.911172098822074e-07, 'epochs': 181, 'loss': 'mae', 'optimizer': 'adam', 'graph_mode': 'cutoff', 'cutoff': 0.7949297346534532, 'grm_norm': 'none', 'self_loops': False, 'use_snp_selection': True, 'num_snps': 52285}. Best is trial 20 with value: 0.3649142115175917.
[I 2025-12-08 22:07:59,551] Trial 54 finished with value: 0.35882290134462247 and parameters: {'model_type': 'gcn', 'hidden_dims': '[512, 256]', 'dropout': 0.48636512125930886, 'batch_norm': False, 'lr': 4.3069840839511215e-05, 'weight_decay': 3.2841096998389524e-07, 'epochs': 158, 'loss': 'mae', 'optimizer': 'adam', 'graph_mode': 'cutoff', 'cutoff': 0.7331575344250078, 'grm_norm': 'none', 'self_loops': False, 'use_snp_selection': True, 'num_snps': 43722}. Best is trial 20 with value: 0.3649142115175917.
[I 2025-12-08 22:08:32,161] Trial 55 finished with value: 0.3560051098787462 and parameters: {'model_type': 'gcn', 'hidden_dims': '[256, 128, 64]', 'dropout': 0.40686783315518427, 'batch_norm': False, 'lr': 5.728363989195488e-05, 'weight_decay': 1.7035501004258342e-07, 'epochs': 160, 'loss': 'mae', 'optimizer': 'adam', 'graph_mode': 'cutoff', 'cutoff': 0.6406691026261048, 'grm_norm': 'none', 'self_loops': False, 'use_snp_selection': True, 'num_snps': 50180}. Best is trial 20 with value: 0.3649142115175917.
[I 2025-12-08 22:09:17,886] Trial 56 finished with value: 0.3540325900335493 and parameters: {'model_type': 'gcn', 'hidden_dims': '[512, 256]', 'dropout': 0.4502350349458643, 'batch_norm': False, 'lr': 2.5605101004091233e-05, 'weight_decay': 4.732635290633824e-07, 'epochs': 137, 'loss': 'mae', 'optimizer': 'adam', 'graph_mode': 'cutoff', 'cutoff': 0.7684087221488705, 'grm_norm': 'none', 'self_loops': False, 'use_snp_selection': True, 'num_snps': 56257}. Best is trial 20 with value: 0.3649142115175917.
[I 2025-12-08 22:09:59,040] Trial 57 finished with value: 0.3580370798764446 and parameters: {'model_type': 'gcn', 'hidden_dims': '[512, 128]', 'dropout': 0.31006877013447887, 'batch_norm': False, 'lr': 3.609082073307759e-05, 'weight_decay': 7.67886304611687e-07, 'epochs': 192, 'loss': 'mae', 'optimizer': 'adam', 'graph_mode': 'cutoff', 'cutoff': 0.7120629713811155, 'grm_norm': 'cosine', 'self_loops': False, 'use_snp_selection': True, 'num_snps': 37423}. Best is trial 20 with value: 0.3649142115175917.
[I 2025-12-08 22:10:33,727] Trial 58 finished with value: 0.34344399807080006 and parameters: {'model_type': 'gcn', 'hidden_dims': '[256, 128]', 'dropout': 0.38126657137484143, 'batch_norm': True, 'lr': 4.715602398824914e-05, 'weight_decay': 3.0162718519988743e-07, 'epochs': 243, 'loss': 'mae', 'optimizer': 'adam', 'graph_mode': 'cutoff', 'cutoff': 0.8528308258601385, 'grm_norm': 'none', 'self_loops': False, 'use_snp_selection': True, 'num_snps': 41107}. Best is trial 20 with value: 0.3649142115175917.
[I 2025-12-08 22:11:19,286] Trial 59 finished with value: 0.34662149764840616 and parameters: {'model_type': 'gcn', 'hidden_dims': '[512, 256]', 'dropout': 0.5502551102824752, 'batch_norm': False, 'lr': 0.00010670088983570616, 'weight_decay': 1.4812254366692377e-07, 'epochs': 172, 'loss': 'mae', 'optimizer': 'adam', 'graph_mode': 'cutoff', 'cutoff': 0.3570240891518441, 'grm_norm': 'cosine_then_gcn', 'self_loops': True, 'use_snp_selection': True, 'num_snps': 45703}. Best is trial 20 with value: 0.3649142115175917.
[I 2025-12-08 22:11:57,905] Trial 60 finished with value: 0.36002369020757424 and parameters: {'model_type': 'gcn', 'hidden_dims': '[512, 256]', 'dropout': 0.46191805954916265, 'batch_norm': False, 'lr': 7.309085517241737e-05, 'weight_decay': 9.76669961493259e-05, 'epochs': 149, 'loss': 'mae', 'optimizer': 'adam', 'graph_mode': 'cutoff', 'cutoff': 0.7426060775764498, 'grm_norm': 'gcn', 'self_loops': False, 'use_snp_selection': False}. Best is trial 20 with value: 0.3649142115175917.
