[I 2025-12-08 17:04:16,278] Trial 25 finished with value: 0.2976805267313271 and parameters: {'model_type': 'gcn', 'hidden_dims': '[512, 128]', 'dropout': 0.29657803527072746, 'batch_norm': True, 'lr': 3.7747680829149645e-05, 'weight_decay': 4.4177020190698555e-06, 'epochs': 228, 'loss': 'mae', 'optimizer': 'adam', 'graph_mode': 'cutoff', 'cutoff': 0.6807426642114425, 'grm_norm': 'none', 'self_loops': False, 'use_snp_selection': False}. Best is trial 22 with value: 0.3127836410194685.
[I 2025-12-08 17:04:40,935] Trial 26 finished with value: 0.2510636855779115 and parameters: {'model_type': 'gcn', 'hidden_dims': '[512, 64]', 'dropout': 0.2528356136116987, 'batch_norm': False, 'lr': 0.0004259130149374333, 'weight_decay': 1.5663763433014223e-05, 'epochs': 188, 'loss': 'mse', 'optimizer': 'adam', 'graph_mode': 'knn', 'knn_k': 7, 'weighted_edges': False, 'symmetrize_mode': 'union', 'self_loops': False, 'use_snp_selection': True, 'num_snps': 15636}. Best is trial 22 with value: 0.3127836410194685.
[I 2025-12-08 17:04:54,061] Trial 27 finished with value: 0.21475441700694547 and parameters: {'model_type': 'gcn', 'hidden_dims': '[256, 128, 64]', 'dropout': 0.17061104538794186, 'batch_norm': True, 'lr': 0.00014865932976877561, 'weight_decay': 2.4540459149692465e-05, 'epochs': 83, 'loss': 'mae', 'optimizer': 'adam', 'graph_mode': 'cutoff', 'cutoff': 0.49906073495186587, 'grm_norm': 'gcn', 'self_loops': False, 'use_snp_selection': False}. Best is trial 22 with value: 0.3127836410194685.
[I 2025-12-08 17:05:25,468] Trial 28 finished with value: 0.2847869625059277 and parameters: {'model_type': 'gcn', 'hidden_dims': '[256, 128]', 'dropout': 0.3460488475227773, 'batch_norm': True, 'lr': 5.119253406179877e-05, 'weight_decay': 5.387688656828868e-06, 'epochs': 118, 'loss': 'mae', 'optimizer': 'adam', 'graph_mode': 'cutoff', 'cutoff': 0.8058588097848624, 'grm_norm': 'cosine_then_gcn', 'self_loops': False, 'use_snp_selection': True, 'num_snps': 55304}. Best is trial 22 with value: 0.3127836410194685.
[I 2025-12-08 17:05:44,105] Trial 29 finished with value: 0.2509994830471909 and parameters: {'model_type': 'gcn', 'hidden_dims': '[512, 256]', 'dropout': 0.21199090901273326, 'batch_norm': True, 'lr': 0.00012912319682997477, 'weight_decay': 1.3231241377351078e-06, 'epochs': 162, 'loss': 'mae', 'optimizer': 'adam', 'graph_mode': 'knn', 'knn_k': 1, 'weighted_edges': True, 'symmetrize_mode': 'mutual', 'self_loops': False, 'use_snp_selection': True, 'num_snps': 11420}. Best is trial 22 with value: 0.3127836410194685.
[I 2025-12-08 17:07:05,206] Trial 30 finished with value: 0.3021971404400593 and parameters: {'model_type': 'gcn', 'hidden_dims': '[512, 128]', 'dropout': 0.16006693633215793, 'batch_norm': True, 'lr': 0.0006556954898629198, 'weight_decay': 6.583401032945895e-05, 'epochs': 320, 'loss': 'mae', 'optimizer': 'adam', 'graph_mode': 'cutoff', 'cutoff': 0.6637491073641655, 'grm_norm': 'none', 'self_loops': False, 'use_snp_selection': False}. Best is trial 22 with value: 0.3127836410194685.
[I 2025-12-08 17:07:44,173] Trial 31 finished with value: 0.3126537712740256 and parameters: {'model_type': 'gcn', 'hidden_dims': '[512, 128]', 'dropout': 0.3139810112314682, 'batch_norm': True, 'lr': 0.00035500456305585933, 'weight_decay': 6.928434190298604e-05, 'epochs': 145, 'loss': 'mae', 'optimizer': 'adam', 'graph_mode': 'cutoff', 'cutoff': 0.7830441787737913, 'grm_norm': 'none', 'self_loops': False, 'use_snp_selection': False}. Best is trial 22 with value: 0.3127836410194685.
[I 2025-12-08 17:08:10,267] Trial 32 finished with value: 0.32261396288913385 and parameters: {'model_type': 'gcn', 'hidden_dims': '[512, 128]', 'dropout': 0.30736554720831905, 'batch_norm': True, 'lr': 0.00022880062452923993, 'weight_decay': 5.111457843033184e-05, 'epochs': 92, 'loss': 'mae', 'optimizer': 'adam', 'graph_mode': 'cutoff', 'cutoff': 0.8137449638836042, 'grm_norm': 'none', 'self_loops': False, 'use_snp_selection': False}. Best is trial 32 with value: 0.32261396288913385.
[I 2025-12-08 17:08:50,429] Trial 33 finished with value: 0.30605718320063385 and parameters: {'model_type': 'gcn', 'hidden_dims': '[512, 128]', 'dropout': 0.32327598554938153, 'batch_norm': True, 'lr': 0.000218269142552156, 'weight_decay': 4.1996099135898416e-07, 'epochs': 151, 'loss': 'mae', 'optimizer': 'adam', 'graph_mode': 'cutoff', 'cutoff': 0.7887640212690497, 'grm_norm': 'none', 'self_loops': False, 'use_snp_selection': False}. Best is trial 32 with value: 0.32261396288913385.
[I 2025-12-08 17:09:22,524] Trial 34 finished with value: 0.27371376665083746 and parameters: {'model_type': 'gcn', 'hidden_dims': '[512, 128]', 'dropout': 0.2349103393251299, 'batch_norm': True, 'lr': 5.847321008960903e-05, 'weight_decay': 1.5073834272334553e-05, 'epochs': 117, 'loss': 'mae', 'optimizer': 'adam', 'graph_mode': 'cutoff', 'cutoff': 0.8913905135099611, 'grm_norm': 'none', 'self_loops': False, 'use_snp_selection': False}. Best is trial 32 with value: 0.32261396288913385.
[I 2025-12-08 17:10:18,822] Trial 35 finished with value: 0.23054144052652056 and parameters: {'model_type': 'gcn', 'hidden_dims': '[512, 128]', 'dropout': 0.30762997553460414, 'batch_norm': True, 'lr': 9.835347584483856e-05, 'weight_decay': 0.0004894367111628768, 'epochs': 209, 'loss': 'mse', 'optimizer': 'adam', 'graph_mode': 'knn', 'knn_k': 10, 'weighted_edges': False, 'symmetrize_mode': 'union', 'self_loops': True, 'use_snp_selection': False}. Best is trial 32 with value: 0.32261396288913385.
[I 2025-12-08 17:11:06,962] Trial 36 finished with value: 0.308585462900638 and parameters: {'model_type': 'gcn', 'hidden_dims': '[512, 128]', 'dropout': 0.3479902433375728, 'batch_norm': True, 'lr': 0.00032516633469161605, 'weight_decay': 7.815131676582768e-05, 'epochs': 183, 'loss': 'mae', 'optimizer': 'adam', 'graph_mode': 'cutoff', 'cutoff': 0.7124186033725468, 'grm_norm': 'none', 'self_loops': False, 'use_snp_selection': False}. Best is trial 32 with value: 0.32261396288913385.
[I 2025-12-08 17:11:26,685] Trial 37 finished with value: 0.314028546829261 and parameters: {'model_type': 'gcn', 'hidden_dims': '[512, 128]', 'dropout': 0.2529168652864921, 'batch_norm': True, 'lr': 0.0006205869404563372, 'weight_decay': 3.061970752488406e-06, 'epochs': 64, 'loss': 'mae', 'optimizer': 'adam', 'graph_mode': 'cutoff', 'cutoff': 0.841533852679911, 'grm_norm': 'cosine_then_gcn', 'self_loops': False, 'use_snp_selection': False}. Best is trial 32 with value: 0.32261396288913385.
[I 2025-12-08 17:11:44,042] Trial 38 finished with value: 0.30327043239394935 and parameters: {'model_type': 'gcn', 'hidden_dims': '[512, 128]', 'dropout': 0.524998461062822, 'batch_norm': True, 'lr': 0.00054864649704657, 'weight_decay': 0.00023339410734387911, 'epochs': 56, 'loss': 'mse', 'optimizer': 'adam', 'graph_mode': 'cutoff', 'cutoff': 0.8475328202376111, 'grm_norm': 'gcn', 'self_loops': True, 'use_snp_selection': False}. Best is trial 32 with value: 0.32261396288913385.
[I 2025-12-08 17:12:53,209] Trial 39 finished with value: 0.21406132074481019 and parameters: {'model_type': 'gcn', 'hidden_dims': '[512, 128]', 'dropout': 0.22519677362259538, 'batch_norm': True, 'lr': 0.0008769806565719524, 'weight_decay': 2.502957397296238e-06, 'epochs': 266, 'loss': 'mae', 'optimizer': 'adam', 'graph_mode': 'knn', 'knn_k': 5, 'weighted_edges': False, 'symmetrize_mode': 'mutual', 'self_loops': False, 'use_snp_selection': False}. Best is trial 32 with value: 0.32261396288913385.
[I 2025-12-08 17:13:13,213] Trial 40 finished with value: 0.1350743183410528 and parameters: {'model_type': 'gcn', 'hidden_dims': '[512, 128]', 'dropout': 0.2614705737855883, 'batch_norm': False, 'lr': 0.00027690299561763753, 'weight_decay': 2.8480768361008802e-05, 'epochs': 67, 'loss': 'mse', 'optimizer': 'adam', 'graph_mode': 'cutoff', 'cutoff': 0.6563280269041207, 'grm_norm': 'none', 'self_loops': False, 'use_snp_selection': False}. Best is trial 32 with value: 0.32261396288913385.
[I 2025-12-08 17:13:39,356] Trial 41 finished with value: 0.30431330625351627 and parameters: {'model_type': 'gcn', 'hidden_dims': '[512, 64]', 'dropout': 0.2845231551286255, 'batch_norm': True, 'lr': 0.0004246117471516703, 'weight_decay': 4.022444045661004e-06, 'epochs': 91, 'loss': 'mae', 'optimizer': 'adam', 'graph_mode': 'cutoff', 'cutoff': 0.779973940110559, 'grm_norm': 'cosine_then_gcn', 'self_loops': False, 'use_snp_selection': False}. Best is trial 32 with value: 0.32261396288913385.
[I 2025-12-08 17:13:47,389] Trial 42 finished with value: 0.2842681243950745 and parameters: {'model_type': 'gcn', 'hidden_dims': '[128, 64]', 'dropout': 0.33202757607433236, 'batch_norm': True, 'lr': 0.0001156817801208075, 'weight_decay': 1.0685573695135014e-05, 'epochs': 77, 'loss': 'mae', 'optimizer': 'adam', 'graph_mode': 'cutoff', 'cutoff': 0.8429442782531369, 'grm_norm': 'cosine_then_gcn', 'self_loops': False, 'use_snp_selection': False}. Best is trial 32 with value: 0.32261396288913385.
[I 2025-12-08 17:14:04,774] Trial 43 finished with value: 0.30803842675974813 and parameters: {'model_type': 'gcn', 'hidden_dims': '[256, 128, 64]', 'dropout': 0.2937905250621317, 'batch_norm': True, 'lr': 0.00018327793847157858, 'weight_decay': 7.190541526647866e-06, 'epochs': 115, 'loss': 'mae', 'optimizer': 'adam', 'graph_mode': 'cutoff', 'cutoff': 0.7900672896215105, 'grm_norm': 'cosine_then_gcn', 'self_loops': False, 'use_snp_selection': False}. Best is trial 32 with value: 0.32261396288913385.
[I 2025-12-08 17:14:31,734] Trial 44 finished with value: 0.30396720710619074 and parameters: {'model_type': 'gcn', 'hidden_dims': '[512, 128]', 'dropout': 0.5919877970367443, 'batch_norm': True, 'lr': 7.514128232154459e-05, 'weight_decay': 8.13162239495143e-07, 'epochs': 96, 'loss': 'mae', 'optimizer': 'adam', 'graph_mode': 'cutoff', 'cutoff': 0.8303250734264349, 'grm_norm': 'gcn', 'self_loops': False, 'use_snp_selection': False}. Best is trial 32 with value: 0.32261396288913385.
[I 2025-12-08 17:14:52,804] Trial 45 finished with value: 0.3041742304241488 and parameters: {'model_type': 'gcn', 'hidden_dims': '[256, 128]', 'dropout': 0.2611224711461613, 'batch_norm': True, 'lr': 0.0004549025686593419, 'weight_decay': 2.224509084478811e-06, 'epochs': 152, 'loss': 'mae', 'optimizer': 'adam', 'graph_mode': 'cutoff', 'cutoff': 0.7369972324497257, 'grm_norm': 'cosine', 'self_loops': True, 'use_snp_selection': False}. Best is trial 32 with value: 0.32261396288913385.
[I 2025-12-08 17:15:27,398] Trial 46 finished with value: 0.3075872289170504 and parameters: {'model_type': 'gcn', 'hidden_dims': '[512, 128]', 'dropout': 0.309490604537742, 'batch_norm': True, 'lr': 0.0007677993435065368, 'weight_decay': 1.4262043116291884e-06, 'epochs': 126, 'loss': 'mae', 'optimizer': 'adam', 'graph_mode': 'cutoff', 'cutoff': 0.8645551833071925, 'grm_norm': 'cosine_then_gcn', 'self_loops': False, 'use_snp_selection': False}. Best is trial 32 with value: 0.32261396288913385.
[I 2025-12-08 17:15:37,332] Trial 47 finished with value: 0.23799198476990205 and parameters: {'model_type': 'gcn', 'hidden_dims': '[128, 64]', 'dropout': 0.2027164300912213, 'batch_norm': True, 'lr': 0.0002485282680620453, 'weight_decay': 3.973797323710833e-05, 'epochs': 102, 'loss': 'mae', 'optimizer': 'adam', 'graph_mode': 'cutoff', 'cutoff': 0.3836184102472195, 'grm_norm': 'cosine', 'self_loops': False, 'use_snp_selection': False}. Best is trial 32 with value: 0.32261396288913385.
[I 2025-12-08 17:15:51,657] Trial 48 finished with value: 0.1944342208595608 and parameters: {'model_type': 'gcn', 'hidden_dims': '[512, 128]', 'dropout': 0.23171466108975625, 'batch_norm': False, 'lr': 0.00015374010811249663, 'weight_decay': 7.791320739376302e-06, 'epochs': 43, 'loss': 'mae', 'optimizer': 'adam', 'graph_mode': 'cutoff', 'cutoff': 0.6346838828639654, 'grm_norm': 'none', 'self_loops': True, 'use_snp_selection': False}. Best is trial 32 with value: 0.32261396288913385.
[I 2025-12-08 17:16:14,065] Trial 49 finished with value: 0.2726342138100622 and parameters: {'model_type': 'gcn', 'hidden_dims': '[512, 64]', 'dropout': 0.40168682838353736, 'batch_norm': True, 'lr': 6.2000283997652e-05, 'weight_decay': 1.5832059789406275e-05, 'epochs': 76, 'loss': 'mse', 'optimizer': 'adam', 'graph_mode': 'cutoff', 'cutoff': 0.578419166336942, 'grm_norm': 'cosine_then_gcn', 'self_loops': False, 'use_snp_selection': False}. Best is trial 32 with value: 0.32261396288913385.
[I 2025-12-08 17:16:38,219] Trial 50 finished with value: 0.2556422992400501 and parameters: {'model_type': 'gcn', 'hidden_dims': '[256, 128]', 'dropout': 0.35753093672573993, 'batch_norm': True, 'lr': 0.0022515137583494316, 'weight_decay': 1.9284925734719488e-07, 'epochs': 171, 'loss': 'mae', 'optimizer': 'adam', 'graph_mode': 'knn', 'knn_k': 7, 'weighted_edges': True, 'symmetrize_mode': 'union', 'self_loops': False, 'use_snp_selection': False}. Best is trial 32 with value: 0.32261396288913385.
[I 2025-12-08 17:17:29,716] Trial 51 finished with value: 0.30986647520242805 and parameters: {'model_type': 'gcn', 'hidden_dims': '[512, 128]', 'dropout': 0.3444499900105742, 'batch_norm': True, 'lr': 0.000349913446798324, 'weight_decay': 8.09205663697072e-05, 'epochs': 197, 'loss': 'mae', 'optimizer': 'adam', 'graph_mode': 'cutoff', 'cutoff': 0.7209490439532439, 'grm_norm': 'none', 'self_loops': False, 'use_snp_selection': False}. Best is trial 32 with value: 0.32261396288913385.
[I 2025-12-08 17:18:20,921] Trial 52 finished with value: 0.30856241346437796 and parameters: {'model_type': 'gcn', 'hidden_dims': '[512, 128]', 'dropout': 0.3281173936007947, 'batch_norm': True, 'lr': 0.00035533922673479113, 'weight_decay': 5.5691790438450024e-05, 'epochs': 197, 'loss': 'mae', 'optimizer': 'adam', 'graph_mode': 'cutoff', 'cutoff': 0.779098443271006, 'grm_norm': 'none', 'self_loops': False, 'use_snp_selection': False}. Best is trial 32 with value: 0.32261396288913385.
[I 2025-12-08 17:19:17,647] Trial 53 finished with value: 0.3028119362021262 and parameters: {'model_type': 'gcn', 'hidden_dims': '[512, 128]', 'dropout': 0.4195110766361489, 'batch_norm': True, 'lr': 0.00019039146354781592, 'weight_decay': 0.00019779698998385577, 'epochs': 220, 'loss': 'mae', 'optimizer': 'adam', 'graph_mode': 'cutoff', 'cutoff': 0.8995189011751815, 'grm_norm': 'none', 'self_loops': False, 'use_snp_selection': False}. Best is trial 32 with value: 0.32261396288913385.
[I 2025-12-08 17:20:08,952] Trial 54 finished with value: 0.3088241932510747 and parameters: {'model_type': 'gcn', 'hidden_dims': '[512, 128]', 'dropout': 0.27224279703033244, 'batch_norm': True, 'lr': 0.0005343049535647805, 'weight_decay': 9.076984266932218e-05, 'epochs': 197, 'loss': 'mae', 'optimizer': 'adam', 'graph_mode': 'cutoff', 'cutoff': 0.7219655138776517, 'grm_norm': 'none', 'self_loops': False, 'use_snp_selection': False}. Best is trial 32 with value: 0.32261396288913385.
[I 2025-12-08 17:20:47,789] Trial 55 finished with value: 0.30366829071111534 and parameters: {'model_type': 'gcn', 'hidden_dims': '[512, 128]', 'dropout': 0.30456512442205025, 'batch_norm': True, 'lr': 0.0002978330080462464, 'weight_decay': 0.0004584262916372936, 'epochs': 146, 'loss': 'mae', 'optimizer': 'adam', 'graph_mode': 'cutoff', 'cutoff': 0.8225040943056615, 'grm_norm': 'cosine', 'self_loops': False, 'use_snp_selection': False}. Best is trial 32 with value: 0.32261396288913385.
[I 2025-12-08 17:21:18,328] Trial 56 finished with value: 0.29906976742811 and parameters: {'model_type': 'gcn', 'hidden_dims': '[256, 128]', 'dropout': 0.24434511660716907, 'batch_norm': True, 'lr': 8.006905294310946e-05, 'weight_decay': 5.1364092827936796e-05, 'epochs': 237, 'loss': 'mae', 'optimizer': 'adam', 'graph_mode': 'cutoff', 'cutoff': 0.7614201055330425, 'grm_norm': 'none', 'self_loops': False, 'use_snp_selection': False}. Best is trial 32 with value: 0.32261396288913385.
[I 2025-12-08 17:21:34,974] Trial 57 finished with value: 0.23558958355838605 and parameters: {'model_type': 'gcn', 'hidden_dims': '[512, 128]', 'dropout': 0.28212332845031957, 'batch_norm': False, 'lr': 9.869651443683759e-05, 'weight_decay': 3.3131509646789603e-06, 'epochs': 53, 'loss': 'mae', 'optimizer': 'adam', 'graph_mode': 'cutoff', 'cutoff': 0.7030597477931307, 'grm_norm': 'cosine_then_gcn', 'self_loops': False, 'use_snp_selection': False}. Best is trial 32 with value: 0.32261396288913385.
[I 2025-12-08 17:22:09,160] Trial 58 finished with value: 0.30139900746145465 and parameters: {'model_type': 'gcn', 'hidden_dims': '[256, 128, 64]', 'dropout': 0.3499675912719074, 'batch_norm': True, 'lr': 0.0012491952855422776, 'weight_decay': 3.1305847498503314e-05, 'epochs': 258, 'loss': 'mae', 'optimizer': 'adam', 'graph_mode': 'cutoff', 'cutoff': 0.8538602077568026, 'grm_norm': 'none', 'self_loops': False, 'use_snp_selection': False}. Best is trial 32 with value: 0.32261396288913385.
[I 2025-12-08 17:22:18,795] Trial 59 finished with value: 0.28437357113391243 and parameters: {'model_type': 'gcn', 'hidden_dims': '[128, 64]', 'dropout': 0.3752907872909865, 'batch_norm': True, 'lr': 1.1347387927857633e-05, 'weight_decay': 1.1057746386179012e-05, 'epochs': 105, 'loss': 'mae', 'optimizer': 'adam', 'graph_mode': 'cutoff', 'cutoff': 0.7591454113239491, 'grm_norm': 'gcn', 'self_loops': True, 'use_snp_selection': False}. Best is trial 32 with value: 0.32261396288913385.
[I 2025-12-08 17:23:04,485] Trial 60 finished with value: 0.30348746231305 and parameters: {'model_type': 'gcn', 'hidden_dims': '[512, 128]', 'dropout': 0.22175967712546807, 'batch_norm': True, 'lr': 0.00017689834635440676, 'weight_decay': 6.312257171371422e-06, 'epochs': 174, 'loss': 'mae', 'optimizer': 'adam', 'graph_mode': 'cutoff', 'cutoff': 0.8776277157159499, 'grm_norm': 'cosine_then_gcn', 'self_loops': False, 'use_snp_selection': False}. Best is trial 32 with value: 0.32261396288913385.
[I 2025-12-08 17:23:54,785] Trial 61 finished with value: 0.3049469367385682 and parameters: {'model_type': 'gcn', 'hidden_dims': '[512, 128]', 'dropout': 0.2686117981435842, 'batch_norm': True, 'lr': 0.0005529487112311752, 'weight_decay': 9.1250936604835e-05, 'epochs': 193, 'loss': 'mae', 'optimizer': 'adam', 'graph_mode': 'cutoff', 'cutoff': 0.7197445410919063, 'grm_norm': 'none', 'self_loops': False, 'use_snp_selection': False}. Best is trial 32 with value: 0.32261396288913385.
[I 2025-12-08 17:24:47,285] Trial 62 finished with value: 0.307320275494609 and parameters: {'model_type': 'gcn', 'hidden_dims': '[512, 128]', 'dropout': 0.2798228916623102, 'batch_norm': True, 'lr': 0.0007114510262675363, 'weight_decay': 0.0001544047703030732, 'epochs': 204, 'loss': 'mae', 'optimizer': 'adam', 'graph_mode': 'cutoff', 'cutoff': 0.8021597468783898, 'grm_norm': 'none', 'self_loops': False, 'use_snp_selection': False}. Best is trial 32 with value: 0.32261396288913385.
[I 2025-12-08 17:25:29,496] Trial 63 finished with value: 0.3087070194130269 and parameters: {'model_type': 'gcn', 'hidden_dims': '[512, 128]', 'dropout': 0.3183531435150494, 'batch_norm': True, 'lr': 0.000486734371975424, 'weight_decay': 6.120280010852532e-05, 'epochs': 161, 'loss': 'mae', 'optimizer': 'adam', 'graph_mode': 'cutoff', 'cutoff': 0.6847784682664704, 'grm_norm': 'none', 'self_loops': False, 'use_snp_selection': False}. Best is trial 32 with value: 0.32261396288913385.
[I 2025-12-08 17:26:25,304] Trial 64 finished with value: 0.30309750133977686 and parameters: {'model_type': 'gcn', 'hidden_dims': '[512, 128]', 'dropout': 0.3355447242958117, 'batch_norm': True, 'lr': 0.00037468471328378313, 'weight_decay': 2.0613399044969554e-05, 'epochs': 217, 'loss': 'mae', 'optimizer': 'adam', 'graph_mode': 'cutoff', 'cutoff': 0.7270589989603651, 'grm_norm': 'none', 'self_loops': False, 'use_snp_selection': False}. Best is trial 32 with value: 0.32261396288913385.
[I 2025-12-08 17:26:53,965] Trial 65 finished with value: 0.3135473811653113 and parameters: {'model_type': 'gcn', 'hidden_dims': '[256, 128]', 'dropout': 0.18519579345424184, 'batch_norm': True, 'lr': 0.001040942067757542, 'weight_decay': 8.536618315203852e-05, 'epochs': 134, 'loss': 'mae', 'optimizer': 'adam', 'graph_mode': 'cutoff', 'cutoff': 0.7692652536760851, 'grm_norm': 'none', 'self_loops': False, 'use_snp_selection': True, 'num_snps': 46221}. Best is trial 32 with value: 0.32261396288913385.
[I 2025-12-08 17:27:22,393] Trial 66 finished with value: 0.30640624933328897 and parameters: {'model_type': 'gcn', 'hidden_dims': '[256, 128]', 'dropout': 0.18297389410604384, 'batch_norm': True, 'lr': 0.0017268035398523033, 'weight_decay': 2.1708635683987037e-06, 'epochs': 135, 'loss': 'mae', 'optimizer': 'adam', 'graph_mode': 'cutoff', 'cutoff': 0.767485419926204, 'grm_norm': 'none', 'self_loops': False, 'use_snp_selection': True, 'num_snps': 46033}. Best is trial 32 with value: 0.32261396288913385.
[I 2025-12-08 17:27:46,317] Trial 67 finished with value: 0.18711467160700046 and parameters: {'model_type': 'gcn', 'hidden_dims': '[256, 128]', 'dropout': 0.12102558094427095, 'batch_norm': False, 'lr': 0.0010868932849005626, 'weight_decay': 4.954347784114934e-06, 'epochs': 121, 'loss': 'mse', 'optimizer': 'adam', 'graph_mode': 'knn', 'knn_k': 3, 'weighted_edges': True, 'symmetrize_mode': 'union', 'self_loops': False, 'use_snp_selection': True, 'num_snps': 36761}. Best is trial 32 with value: 0.32261396288913385.
[I 2025-12-08 17:28:14,094] Trial 68 finished with value: 0.28312401155312 and parameters: {'model_type': 'gcn', 'hidden_dims': '[256, 128]', 'dropout': 0.1369159449252528, 'batch_norm': True, 'lr': 0.00023200083505937657, 'weight_decay': 0.00011646387775473364, 'epochs': 84, 'loss': 'mae', 'optimizer': 'adam', 'graph_mode': 'cutoff', 'cutoff': 0.8217177599045983, 'grm_norm': 'none', 'self_loops': False, 'use_snp_selection': True, 'num_snps': 59068}. Best is trial 32 with value: 0.32261396288913385.
