[I 2025-12-08 20:37:03,195] Trial 32 finished with value: 0.309332154616415 and parameters: {'model_type': 'gcn', 'hidden_dims': '[512, 256]', 'dropout': 0.1710767254423757, 'batch_norm': True, 'lr': 0.003607369432391545, 'weight_decay': 7.982466470869136e-05, 'epochs': 88, 'loss': 'mae', 'optimizer': 'adam', 'graph_mode': 'cutoff', 'cutoff': 0.8082907576948896, 'grm_norm': 'none', 'self_loops': False, 'use_snp_selection': True, 'num_snps': 59571}. Best is trial 21 with value: 0.31751353329443455.
[I 2025-12-08 20:38:24,003] Trial 33 finished with value: 0.30773944936670034 and parameters: {'model_type': 'gcn', 'hidden_dims': '[512, 64]', 'dropout': 0.22431169798430317, 'batch_norm': True, 'lr': 0.0005207524184215012, 'weight_decay': 2.5936396254494024e-05, 'epochs': 318, 'loss': 'mae', 'optimizer': 'adam', 'graph_mode': 'cutoff', 'cutoff': 0.8948047245939399, 'grm_norm': 'none', 'self_loops': False, 'use_snp_selection': False}. Best is trial 21 with value: 0.31751353329443455.
[I 2025-12-08 20:39:03,120] Trial 34 finished with value: 0.31325607619713386 and parameters: {'model_type': 'gcn', 'hidden_dims': '[512, 256]', 'dropout': 0.31689360002942885, 'batch_norm': True, 'lr': 0.0010016779703224587, 'weight_decay': 0.00019684723032684597, 'epochs': 145, 'loss': 'mae', 'optimizer': 'adam', 'graph_mode': 'cutoff', 'cutoff': 0.8394248346008087, 'grm_norm': 'none', 'self_loops': False, 'use_snp_selection': False}. Best is trial 21 with value: 0.31751353329443455.
[I 2025-12-08 20:39:22,927] Trial 35 finished with value: 0.2357577036495735 and parameters: {'model_type': 'gcn', 'hidden_dims': '[512, 256]', 'dropout': 0.24615657798245544, 'batch_norm': True, 'lr': 0.0015134827354355053, 'weight_decay': 0.00042479102504091443, 'epochs': 183, 'loss': 'mse', 'optimizer': 'adam', 'graph_mode': 'knn', 'knn_k': 6, 'weighted_edges': True, 'symmetrize_mode': 'mutual', 'self_loops': True, 'use_snp_selection': True, 'num_snps': 11117}. Best is trial 21 with value: 0.31751353329443455.
[I 2025-12-08 20:39:39,816] Trial 36 finished with value: 0.303782620402521 and parameters: {'model_type': 'gcn', 'hidden_dims': '[256, 128, 64]', 'dropout': 0.3501738419996399, 'batch_norm': True, 'lr': 0.006012636058407544, 'weight_decay': 4.523152454496928e-05, 'epochs': 113, 'loss': 'mae', 'optimizer': 'adam', 'graph_mode': 'cutoff', 'cutoff': 0.7105182065560179, 'grm_norm': 'none', 'self_loops': False, 'use_snp_selection': False}. Best is trial 21 with value: 0.31751353329443455.
[I 2025-12-08 20:39:47,412] Trial 37 finished with value: 0.31154273206627225 and parameters: {'model_type': 'gcn', 'hidden_dims': '[128, 64]', 'dropout': 0.5752262887394397, 'batch_norm': True, 'lr': 0.0004486728866957873, 'weight_decay': 6.7949247866991265e-06, 'epochs': 62, 'loss': 'mse', 'optimizer': 'adam', 'graph_mode': 'cutoff', 'cutoff': 0.7809584736123751, 'grm_norm': 'none', 'self_loops': True, 'use_snp_selection': False}. Best is trial 21 with value: 0.31751353329443455.
[I 2025-12-08 20:40:23,200] Trial 38 finished with value: 0.3016835653090369 and parameters: {'model_type': 'gcn', 'hidden_dims': '[512, 64]', 'dropout': 0.20743290037360573, 'batch_norm': True, 'lr': 0.0007094782369628852, 'weight_decay': 4.1366060026717973e-07, 'epochs': 278, 'loss': 'mae', 'optimizer': 'adam', 'graph_mode': 'cutoff', 'cutoff': 0.8504373219741918, 'grm_norm': 'gcn', 'self_loops': False, 'use_snp_selection': True, 'num_snps': 21122}. Best is trial 21 with value: 0.31751353329443455.
[I 2025-12-08 20:41:24,896] Trial 39 finished with value: 0.26755929527805267 and parameters: {'model_type': 'gcn', 'hidden_dims': '[512, 256]', 'dropout': 0.2926558471637651, 'batch_norm': False, 'lr': 0.00027628852295234145, 'weight_decay': 1.2236767343405774e-05, 'epochs': 233, 'loss': 'mae', 'optimizer': 'adam', 'graph_mode': 'knn', 'knn_k': 10, 'weighted_edges': False, 'symmetrize_mode': 'mutual', 'self_loops': False, 'use_snp_selection': False}. Best is trial 21 with value: 0.31751353329443455.
[I 2025-12-08 20:41:49,225] Trial 40 finished with value: 0.30824379174536876 and parameters: {'model_type': 'gcn', 'hidden_dims': '[512, 256]', 'dropout': 0.13712542939630928, 'batch_norm': True, 'lr': 0.002922281639374606, 'weight_decay': 0.00010451241769311187, 'epochs': 57, 'loss': 'mse', 'optimizer': 'adam', 'graph_mode': 'cutoff', 'cutoff': 0.6673012531998225, 'grm_norm': 'none', 'self_loops': True, 'use_snp_selection': True, 'num_snps': 39788}. Best is trial 21 with value: 0.31751353329443455.
[I 2025-12-08 20:42:04,390] Trial 41 finished with value: 0.30474301215181376 and parameters: {'model_type': 'gcn', 'hidden_dims': '[512, 256]', 'dropout': 0.582976780282542, 'batch_norm': True, 'lr': 0.0009029116258387584, 'weight_decay': 9.804545907399326e-05, 'epochs': 46, 'loss': 'mae', 'optimizer': 'adam', 'graph_mode': 'cutoff', 'cutoff': 0.6530185142764475, 'grm_norm': 'none', 'self_loops': False, 'use_snp_selection': False}. Best is trial 21 with value: 0.31751353329443455.
[I 2025-12-08 20:42:18,893] Trial 42 finished with value: 0.31518184906625757 and parameters: {'model_type': 'gcn', 'hidden_dims': '[512, 256]', 'dropout': 0.5396559631635683, 'batch_norm': True, 'lr': 0.0018932835160246945, 'weight_decay': 3.46558003282469e-05, 'epochs': 44, 'loss': 'mae', 'optimizer': 'adam', 'graph_mode': 'cutoff', 'cutoff': 0.7799466908945106, 'grm_norm': 'none', 'self_loops': False, 'use_snp_selection': False}. Best is trial 21 with value: 0.31751353329443455.
[I 2025-12-08 20:42:41,322] Trial 43 finished with value: 0.3149345988610004 and parameters: {'model_type': 'gcn', 'hidden_dims': '[512, 256]', 'dropout': 0.5412788811720946, 'batch_norm': True, 'lr': 0.0020569214386852537, 'weight_decay': 3.203751585941967e-05, 'epochs': 77, 'loss': 'mae', 'optimizer': 'adam', 'graph_mode': 'cutoff', 'cutoff': 0.7940003069359968, 'grm_norm': 'gcn', 'self_loops': False, 'use_snp_selection': False}. Best is trial 21 with value: 0.31751353329443455.
[I 2025-12-08 20:43:03,042] Trial 44 finished with value: 0.3165713773495303 and parameters: {'model_type': 'gcn', 'hidden_dims': '[512, 256]', 'dropout': 0.5397655234780745, 'batch_norm': True, 'lr': 0.0020143877557015607, 'weight_decay': 2.9004573004170332e-05, 'epochs': 72, 'loss': 'mae', 'optimizer': 'adam', 'graph_mode': 'cutoff', 'cutoff': 0.7786627282957459, 'grm_norm': 'gcn', 'self_loops': False, 'use_snp_selection': False}. Best is trial 21 with value: 0.31751353329443455.
[I 2025-12-08 20:43:22,643] Trial 45 finished with value: 0.3133769329649169 and parameters: {'model_type': 'gcn', 'hidden_dims': '[512, 256]', 'dropout': 0.4860728112092784, 'batch_norm': True, 'lr': 0.004833684139436141, 'weight_decay': 4.20670821069886e-06, 'epochs': 64, 'loss': 'mae', 'optimizer': 'adam', 'graph_mode': 'cutoff', 'cutoff': 0.7162994496914372, 'grm_norm': 'gcn', 'self_loops': False, 'use_snp_selection': False}. Best is trial 21 with value: 0.31751353329443455.
[I 2025-12-08 20:43:33,055] Trial 46 finished with value: 0.3161155368688102 and parameters: {'model_type': 'gcn', 'hidden_dims': '[128, 64]', 'dropout': 0.5669610899945932, 'batch_norm': True, 'lr': 0.0012203736043946273, 'weight_decay': 1.4606719533120306e-05, 'epochs': 101, 'loss': 'mae', 'optimizer': 'adam', 'graph_mode': 'cutoff', 'cutoff': 0.7748403696265249, 'grm_norm': 'gcn', 'self_loops': False, 'use_snp_selection': False}. Best is trial 21 with value: 0.31751353329443455.
[I 2025-12-08 20:43:42,983] Trial 47 finished with value: 0.3047754378600481 and parameters: {'model_type': 'gcn', 'hidden_dims': '[128, 64]', 'dropout': 0.562680277145483, 'batch_norm': True, 'lr': 0.0012163251719894076, 'weight_decay': 1.448026932660625e-05, 'epochs': 99, 'loss': 'mae', 'optimizer': 'adam', 'graph_mode': 'cutoff', 'cutoff': 0.622324709724862, 'grm_norm': 'gcn', 'self_loops': False, 'use_snp_selection': False}. Best is trial 21 with value: 0.31751353329443455.
[I 2025-12-08 20:43:53,727] Trial 48 finished with value: 0.0 and parameters: {'model_type': 'gcn', 'hidden_dims': '[128, 64]', 'dropout': 0.5297900142307244, 'batch_norm': False, 'lr': 0.001767273077012277, 'weight_decay': 4.805493330225854e-05, 'epochs': 120, 'loss': 'mae', 'optimizer': 'adam', 'graph_mode': 'cutoff', 'cutoff': 0.5721037723478013, 'grm_norm': 'gcn', 'self_loops': True, 'use_snp_selection': False}. Best is trial 21 with value: 0.31751353329443455.
[I 2025-12-08 20:44:00,290] Trial 49 finished with value: 0.3052082070510024 and parameters: {'model_type': 'gcn', 'hidden_dims': '[128, 64]', 'dropout': 0.4696673597506834, 'batch_norm': True, 'lr': 0.0006086110775248614, 'weight_decay': 0.00029959630173065653, 'epochs': 55, 'loss': 'mse', 'optimizer': 'adam', 'graph_mode': 'cutoff', 'cutoff': 0.7547231947574455, 'grm_norm': 'cosine', 'self_loops': False, 'use_snp_selection': False}. Best is trial 21 with value: 0.31751353329443455.
[I 2025-12-08 20:44:08,612] Trial 50 finished with value: 0.2724152593654208 and parameters: {'model_type': 'gcn', 'hidden_dims': '[128, 64]', 'dropout': 0.5638484873970588, 'batch_norm': True, 'lr': 0.003313373924653924, 'weight_decay': 7.898605652754162e-06, 'epochs': 71, 'loss': 'mae', 'optimizer': 'adam', 'graph_mode': 'knn', 'knn_k': 4, 'weighted_edges': True, 'symmetrize_mode': 'union', 'self_loops': False, 'use_snp_selection': False}. Best is trial 21 with value: 0.31751353329443455.
[I 2025-12-08 20:44:33,473] Trial 51 finished with value: 0.31278245020575335 and parameters: {'model_type': 'gcn', 'hidden_dims': '[512, 128]', 'dropout': 0.54646853147338, 'batch_norm': True, 'lr': 0.0010943418687523008, 'weight_decay': 2.3956227944646356e-05, 'epochs': 86, 'loss': 'mae', 'optimizer': 'adam', 'graph_mode': 'cutoff', 'cutoff': 0.8489449364808233, 'grm_norm': 'gcn', 'self_loops': False, 'use_snp_selection': False}. Best is trial 21 with value: 0.31751353329443455.
[I 2025-12-08 20:45:02,466] Trial 52 finished with value: 0.3139279381993171 and parameters: {'model_type': 'gcn', 'hidden_dims': '[512, 256]', 'dropout': 0.5152206448815797, 'batch_norm': True, 'lr': 0.002451601805664534, 'weight_decay': 3.368838372616862e-05, 'epochs': 103, 'loss': 'mae', 'optimizer': 'adam', 'graph_mode': 'cutoff', 'cutoff': 0.7809328580208271, 'grm_norm': 'gcn', 'self_loops': False, 'use_snp_selection': False}. Best is trial 21 with value: 0.31751353329443455.
[I 2025-12-08 20:45:18,865] Trial 53 finished with value: 0.31246013457882393 and parameters: {'model_type': 'gcn', 'hidden_dims': '[512, 64]', 'dropout': 0.59339376676079, 'batch_norm': True, 'lr': 0.0015618535078227075, 'weight_decay': 6.457699565155603e-05, 'epochs': 52, 'loss': 'mae', 'optimizer': 'adam', 'graph_mode': 'cutoff', 'cutoff': 0.8593448976333473, 'grm_norm': 'cosine', 'self_loops': False, 'use_snp_selection': False}. Best is trial 21 with value: 0.31751353329443455.
[I 2025-12-08 20:45:32,605] Trial 54 finished with value: 0.3134758084383655 and parameters: {'model_type': 'gcn', 'hidden_dims': '[512, 256]', 'dropout': 0.49155682463167905, 'batch_norm': True, 'lr': 0.004768359996100825, 'weight_decay': 4.650407242963875e-06, 'epochs': 40, 'loss': 'mae', 'optimizer': 'adam', 'graph_mode': 'cutoff', 'cutoff': 0.7723301461691828, 'grm_norm': 'gcn', 'self_loops': False, 'use_snp_selection': False}. Best is trial 21 with value: 0.31751353329443455.
[I 2025-12-08 20:45:52,023] Trial 55 finished with value: 0.2568719297754243 and parameters: {'model_type': 'gcn', 'hidden_dims': '[256, 128]', 'dropout': 0.5651567207622917, 'batch_norm': True, 'lr': 0.0019332070411691867, 'weight_decay': 0.00015767314042238172, 'epochs': 140, 'loss': 'mae', 'optimizer': 'adam', 'graph_mode': 'cutoff', 'cutoff': 0.3954996361085065, 'grm_norm': 'gcn', 'self_loops': False, 'use_snp_selection': False}. Best is trial 21 with value: 0.31751353329443455.
[I 2025-12-08 20:45:59,478] Trial 56 finished with value: 0.3108589397587328 and parameters: {'model_type': 'gcn', 'hidden_dims': '[128, 64]', 'dropout': 0.5999912848869922, 'batch_norm': True, 'lr': 0.0007918436440980974, 'weight_decay': 1.3245747170603125e-05, 'epochs': 68, 'loss': 'mae', 'optimizer': 'adam', 'graph_mode': 'cutoff', 'cutoff': 0.7199605859676955, 'grm_norm': 'cosine', 'self_loops': False, 'use_snp_selection': False}. Best is trial 21 with value: 0.31751353329443455.
[I 2025-12-08 20:46:13,796] Trial 57 finished with value: -0.0028840241493293005 and parameters: {'model_type': 'gcn', 'hidden_dims': '[256, 128, 64]', 'dropout': 0.4499093926480514, 'batch_norm': False, 'lr': 0.0012285704191610848, 'weight_decay': 2.1228423660530327e-06, 'epochs': 92, 'loss': 'mae', 'optimizer': 'adam', 'graph_mode': 'cutoff', 'cutoff': 0.8809384077979012, 'grm_norm': 'none', 'self_loops': False, 'use_snp_selection': False}. Best is trial 21 with value: 0.31751353329443455.
[I 2025-12-08 20:46:37,615] Trial 58 finished with value: 0.3133929990452489 and parameters: {'model_type': 'gcn', 'hidden_dims': '[512, 256]', 'dropout': 0.5783039130232663, 'batch_norm': True, 'lr': 0.002539936455194241, 'weight_decay': 3.5887506778178684e-05, 'epochs': 82, 'loss': 'mae', 'optimizer': 'adam', 'graph_mode': 'cutoff', 'cutoff': 0.7429935929323578, 'grm_norm': 'cosine_then_gcn', 'self_loops': False, 'use_snp_selection': False}. Best is trial 21 with value: 0.31751353329443455.
[I 2025-12-08 20:47:05,412] Trial 59 finished with value: 0.3136904559715403 and parameters: {'model_type': 'gcn', 'hidden_dims': '[512, 256]', 'dropout': 0.548983401587546, 'batch_norm': True, 'lr': 0.0038814722117421594, 'weight_decay': 7.55504233979419e-05, 'epochs': 100, 'loss': 'mae', 'optimizer': 'adam', 'graph_mode': 'cutoff', 'cutoff': 0.83036377398244, 'grm_norm': 'none', 'self_loops': True, 'use_snp_selection': False}. Best is trial 21 with value: 0.31751353329443455.
[I 2025-12-08 20:47:26,892] Trial 60 finished with value: 0.31168314644273043 and parameters: {'model_type': 'gcn', 'hidden_dims': '[512, 128]', 'dropout': 0.5100566975140776, 'batch_norm': True, 'lr': 0.006451493649575263, 'weight_decay': 1.7615345896224566e-05, 'epochs': 72, 'loss': 'mae', 'optimizer': 'adam', 'graph_mode': 'cutoff', 'cutoff': 0.7833726061441515, 'grm_norm': 'gcn', 'self_loops': False, 'use_snp_selection': False}. Best is trial 21 with value: 0.31751353329443455.
[I 2025-12-08 20:47:50,740] Trial 61 finished with value: 0.31725457522115413 and parameters: {'model_type': 'gcn', 'hidden_dims': '[512, 256]', 'dropout': 0.5376853426455116, 'batch_norm': True, 'lr': 0.0018954870339959083, 'weight_decay': 3.0025260166680806e-05, 'epochs': 82, 'loss': 'mae', 'optimizer': 'adam', 'graph_mode': 'cutoff', 'cutoff': 0.7987234016751696, 'grm_norm': 'gcn', 'self_loops': False, 'use_snp_selection': False}. Best is trial 21 with value: 0.31751353329443455.
[I 2025-12-08 20:48:07,502] Trial 62 finished with value: 0.3173044162103874 and parameters: {'model_type': 'gcn', 'hidden_dims': '[512, 256]', 'dropout': 0.5366084299222045, 'batch_norm': True, 'lr': 0.0014905940990322505, 'weight_decay': 9.479318075452057e-06, 'epochs': 53, 'loss': 'mae', 'optimizer': 'adam', 'graph_mode': 'cutoff', 'cutoff': 0.8368959491416187, 'grm_norm': 'gcn', 'self_loops': False, 'use_snp_selection': False}. Best is trial 21 with value: 0.31751353329443455.
[I 2025-12-08 20:48:23,725] Trial 63 finished with value: 0.3135294282677282 and parameters: {'model_type': 'gcn', 'hidden_dims': '[512, 256]', 'dropout': 0.5332698239688973, 'batch_norm': True, 'lr': 0.0014316215024713101, 'weight_decay': 9.37936115176638e-06, 'epochs': 50, 'loss': 'mae', 'optimizer': 'adam', 'graph_mode': 'cutoff', 'cutoff': 0.865797241901874, 'grm_norm': 'gcn', 'self_loops': False, 'use_snp_selection': False}. Best is trial 21 with value: 0.31751353329443455.
[I 2025-12-08 20:48:43,314] Trial 64 finished with value: 0.3156912238531089 and parameters: {'model_type': 'gcn', 'hidden_dims': '[512, 256]', 'dropout': 0.4750599506182892, 'batch_norm': True, 'lr': 0.0009202770802225412, 'weight_decay': 5.932142114967513e-06, 'epochs': 64, 'loss': 'mae', 'optimizer': 'adam', 'graph_mode': 'cutoff', 'cutoff': 0.7285761744995466, 'grm_norm': 'gcn', 'self_loops': False, 'use_snp_selection': False}. Best is trial 21 with value: 0.31751353329443455.
[I 2025-12-08 20:49:02,339] Trial 65 finished with value: 0.3158871940203801 and parameters: {'model_type': 'gcn', 'hidden_dims': '[512, 256]', 'dropout': 0.5034419870727616, 'batch_norm': True, 'lr': 0.0008405383059359596, 'weight_decay': 5.3716914462263995e-06, 'epochs': 63, 'loss': 'mae', 'optimizer': 'adam', 'graph_mode': 'cutoff', 'cutoff': 0.7398452980571784, 'grm_norm': 'gcn', 'self_loops': False, 'use_snp_selection': False}. Best is trial 21 with value: 0.31751353329443455.
[I 2025-12-08 20:49:25,350] Trial 66 finished with value: 0.30946597110850993 and parameters: {'model_type': 'gcn', 'hidden_dims': '[512, 256]', 'dropout': 0.5014928584125087, 'batch_norm': True, 'lr': 0.00050556394586764, 'weight_decay': 2.9192237812232285e-06, 'epochs': 79, 'loss': 'mae', 'optimizer': 'adam', 'graph_mode': 'cutoff', 'cutoff': 0.6933257238589489, 'grm_norm': 'gcn', 'self_loops': False, 'use_snp_selection': False}. Best is trial 21 with value: 0.31751353329443455.
[I 2025-12-08 20:49:43,733] Trial 67 finished with value: 0.11271822984660376 and parameters: {'model_type': 'gcn', 'hidden_dims': '[256, 128]', 'dropout': 0.5745182231151494, 'batch_norm': False, 'lr': 0.0006823674061980365, 'weight_decay': 9.630010816690592e-06, 'epochs': 123, 'loss': 'mse', 'optimizer': 'adam', 'graph_mode': 'knn', 'knn_k': 8, 'weighted_edges': True, 'symmetrize_mode': 'union', 'self_loops': False, 'use_snp_selection': False}. Best is trial 21 with value: 0.31751353329443455.
[I 2025-12-08 20:50:13,032] Trial 68 finished with value: 0.29641521603413057 and parameters: {'model_type': 'gcn', 'hidden_dims': '[512, 256]', 'dropout': 0.5231412585823157, 'batch_norm': True, 'lr': 1.0079507573984855e-05, 'weight_decay': 6.080191279267852e-06, 'epochs': 105, 'loss': 'mae', 'optimizer': 'adam', 'graph_mode': 'cutoff', 'cutoff': 0.7502525306938562, 'grm_norm': 'gcn', 'self_loops': False, 'use_snp_selection': False}. Best is trial 21 with value: 0.31751353329443455.
[I 2025-12-08 20:51:07,155] Trial 69 finished with value: 0.3160105800119466 and parameters: {'model_type': 'gcn', 'hidden_dims': '[512, 256]', 'dropout': 0.4309615984587404, 'batch_norm': True, 'lr': 0.0003119510691027396, 'weight_decay': 1.8918711976039955e-06, 'epochs': 208, 'loss': 'mae', 'optimizer': 'adam', 'graph_mode': 'cutoff', 'cutoff': 0.8999240234381866, 'grm_norm': 'gcn', 'self_loops': False, 'use_snp_selection': False}. Best is trial 21 with value: 0.31751353329443455.
[I 2025-12-08 20:51:55,960] Trial 70 finished with value: 0.30066016260171996 and parameters: {'model_type': 'gcn', 'hidden_dims': '[512, 64]', 'dropout': 0.41819615141640176, 'batch_norm': True, 'lr': 0.0002220994444860758, 'weight_decay': 1.2296509534111395e-06, 'epochs': 187, 'loss': 'mae', 'optimizer': 'adam', 'graph_mode': 'cutoff', 'cutoff': 0.8956059343492374, 'grm_norm': 'gcn', 'self_loops': False, 'use_snp_selection': False}. Best is trial 21 with value: 0.31751353329443455.
[I 2025-12-08 20:52:52,430] Trial 71 finished with value: 0.31968992992405665 and parameters: {'model_type': 'gcn', 'hidden_dims': '[512, 256]', 'dropout': 0.5549855488258632, 'batch_norm': True, 'lr': 0.0001182895875101428, 'weight_decay': 1.3564003439016305e-06, 'epochs': 218, 'loss': 'mae', 'optimizer': 'adam', 'graph_mode': 'cutoff', 'cutoff': 0.8078690367816177, 'grm_norm': 'gcn', 'self_loops': False, 'use_snp_selection': False}. Best is trial 71 with value: 0.31968992992405665.
[I 2025-12-08 20:53:47,414] Trial 72 finished with value: 0.31332441327652505 and parameters: {'model_type': 'gcn', 'hidden_dims': '[512, 256]', 'dropout': 0.5561257905676993, 'batch_norm': True, 'lr': 0.00010095433391420134, 'weight_decay': 8.931147604095594e-07, 'epochs': 212, 'loss': 'mae', 'optimizer': 'adam', 'graph_mode': 'cutoff', 'cutoff': 0.8093730453015036, 'grm_norm': 'gcn', 'self_loops': False, 'use_snp_selection': False}. Best is trial 71 with value: 0.31968992992405665.
[I 2025-12-08 20:54:45,376] Trial 73 finished with value: 0.3160774662476685 and parameters: {'model_type': 'gcn', 'hidden_dims': '[512, 256]', 'dropout': 0.5882512852105289, 'batch_norm': True, 'lr': 0.00012547052768839835, 'weight_decay': 2.8842570691328134e-07, 'epochs': 225, 'loss': 'mae', 'optimizer': 'adam', 'graph_mode': 'cutoff', 'cutoff': 0.8745523172593644, 'grm_norm': 'gcn', 'self_loops': False, 'use_snp_selection': False}. Best is trial 71 with value: 0.31968992992405665.
[I 2025-12-08 20:55:47,444] Trial 74 finished with value: 0.3170451911480464 and parameters: {'model_type': 'gcn', 'hidden_dims': '[512, 256]', 'dropout': 0.5794120736302129, 'batch_norm': True, 'lr': 0.00013128445615411533, 'weight_decay': 1.8410744465807585e-07, 'epochs': 242, 'loss': 'mae', 'optimizer': 'adam', 'graph_mode': 'cutoff', 'cutoff': 0.8308191216299851, 'grm_norm': 'gcn', 'self_loops': False, 'use_snp_selection': False}. Best is trial 71 with value: 0.31968992992405665.
[I 2025-12-08 20:56:20,211] Trial 75 finished with value: 0.3043868553399459 and parameters: {'model_type': 'gcn', 'hidden_dims': '[256, 128, 64]', 'dropout': 0.5702322110473625, 'batch_norm': True, 'lr': 5.7142633493074996e-05, 'weight_decay': 5.840730902647535e-07, 'epochs': 245, 'loss': 'mae', 'optimizer': 'adam', 'graph_mode': 'cutoff', 'cutoff': 0.8364029716127734, 'grm_norm': 'gcn', 'self_loops': False, 'use_snp_selection': False}. Best is trial 71 with value: 0.31968992992405665.
