[I 2025-12-08 11:57:22,575] Trial 112 finished with value: 0.2846091486658947 and parameters: {'model_type': 'gcn', 'hidden_dims': '[256, 128, 64]', 'dropout': 0.5662669018978902, 'batch_norm': True, 'lr': 0.003286111103433324, 'weight_decay': 4.0434783477517577e-05, 'epochs': 220, 'loss': 'mae', 'optimizer': 'adam', 'graph_mode': 'cutoff', 'cutoff': 0.7875365390825311, 'grm_norm': 'cosine_then_gcn', 'self_loops': True, 'use_snp_selection': True, 'num_snps': 41923}. Best is trial 51 with value: 0.3077853407165048.
[I 2025-12-08 11:57:32,976] Trial 113 finished with value: 0.2919911617727372 and parameters: {'model_type': 'gcn', 'hidden_dims': '[256, 128, 64]', 'dropout': 0.5793568092801692, 'batch_norm': True, 'lr': 0.001942725222657517, 'weight_decay': 2.6237972071518172e-05, 'epochs': 67, 'loss': 'mae', 'optimizer': 'adam', 'graph_mode': 'cutoff', 'cutoff': 0.6753855234224413, 'grm_norm': 'cosine_then_gcn', 'self_loops': False, 'use_snp_selection': False}. Best is trial 51 with value: 0.3077853407165048.
[I 2025-12-08 11:57:41,823] Trial 114 finished with value: 0.29309742849344433 and parameters: {'model_type': 'gcn', 'hidden_dims': '[256, 128, 64]', 'dropout': 0.5977690010756049, 'batch_norm': True, 'lr': 0.00018509848078836, 'weight_decay': 4.884987648984625e-05, 'epochs': 54, 'loss': 'mae', 'optimizer': 'adam', 'graph_mode': 'cutoff', 'cutoff': 0.7598841958846614, 'grm_norm': 'cosine_then_gcn', 'self_loops': False, 'use_snp_selection': False}. Best is trial 51 with value: 0.3077853407165048.
[I 2025-12-08 11:57:49,468] Trial 115 finished with value: 0.2952858027601172 and parameters: {'model_type': 'gcn', 'hidden_dims': '[256, 128]', 'dropout': 0.5615071293223348, 'batch_norm': True, 'lr': 0.0009009336579103776, 'weight_decay': 3.255842961740341e-05, 'epochs': 46, 'loss': 'mse', 'optimizer': 'adam', 'graph_mode': 'cutoff', 'cutoff': 0.8286608730332078, 'grm_norm': 'cosine_then_gcn', 'self_loops': False, 'use_snp_selection': False}. Best is trial 51 with value: 0.3077853407165048.
[I 2025-12-08 11:58:08,992] Trial 116 finished with value: 0.2905024423189896 and parameters: {'model_type': 'gcn', 'hidden_dims': '[256, 128, 64]', 'dropout': 0.5489954101793358, 'batch_norm': True, 'lr': 0.0011440823281433515, 'weight_decay': 7.277409384575366e-05, 'epochs': 82, 'loss': 'mae', 'optimizer': 'adam', 'graph_mode': 'cutoff', 'cutoff': 0.7730821477708831, 'grm_norm': 'cosine_then_gcn', 'self_loops': True, 'use_snp_selection': True, 'num_snps': 33168}. Best is trial 51 with value: 0.3077853407165048.
[I 2025-12-08 11:58:18,388] Trial 117 finished with value: 0.0060495547880319075 and parameters: {'model_type': 'gcn', 'hidden_dims': '[256, 128, 64]', 'dropout': 0.5378493673293814, 'batch_norm': False, 'lr': 0.004015309148460622, 'weight_decay': 8.65655400496575e-06, 'epochs': 61, 'loss': 'mae', 'optimizer': 'adam', 'graph_mode': 'cutoff', 'cutoff': 0.8058944834491005, 'grm_norm': 'gcn', 'self_loops': False, 'use_snp_selection': False}. Best is trial 51 with value: 0.3077853407165048.
[I 2025-12-08 11:58:29,166] Trial 118 finished with value: 0.2973336841414789 and parameters: {'model_type': 'gcn', 'hidden_dims': '[256, 128, 64]', 'dropout': 0.5163299273202071, 'batch_norm': True, 'lr': 0.0026854620220748866, 'weight_decay': 1.9275028758281303e-05, 'epochs': 70, 'loss': 'mae', 'optimizer': 'adam', 'graph_mode': 'cutoff', 'cutoff': 0.7226284063544164, 'grm_norm': 'cosine_then_gcn', 'self_loops': False, 'use_snp_selection': False}. Best is trial 51 with value: 0.3077853407165048.
[I 2025-12-08 11:58:36,509] Trial 119 finished with value: 0.2920642068145594 and parameters: {'model_type': 'gcn', 'hidden_dims': '[256, 128, 64]', 'dropout': 0.5747991962064317, 'batch_norm': True, 'lr': 0.002248744381388173, 'weight_decay': 2.5831202440415485e-05, 'epochs': 43, 'loss': 'mae', 'optimizer': 'adam', 'graph_mode': 'cutoff', 'cutoff': 0.8431916189440625, 'grm_norm': 'gcn', 'self_loops': False, 'use_snp_selection': False}. Best is trial 51 with value: 0.3077853407165048.
[I 2025-12-08 11:59:20,830] Trial 120 finished with value: 0.2835249871065141 and parameters: {'model_type': 'gcn', 'hidden_dims': '[256, 128, 64]', 'dropout': 0.5541496353624613, 'batch_norm': True, 'lr': 0.001749858759766336, 'weight_decay': 1.397310227343752e-05, 'epochs': 349, 'loss': 'mae', 'optimizer': 'adam', 'graph_mode': 'cutoff', 'cutoff': 0.6937911887905965, 'grm_norm': 'cosine', 'self_loops': False, 'use_snp_selection': False}. Best is trial 51 with value: 0.3077853407165048.
[I 2025-12-08 11:59:30,854] Trial 121 finished with value: 0.2835804740144159 and parameters: {'model_type': 'gcn', 'hidden_dims': '[256, 128, 64]', 'dropout': 0.5434263959950062, 'batch_norm': True, 'lr': 0.00010347578342154722, 'weight_decay': 4.189797262637509e-05, 'epochs': 64, 'loss': 'mae', 'optimizer': 'adam', 'graph_mode': 'cutoff', 'cutoff': 0.7910997547122866, 'grm_norm': 'cosine_then_gcn', 'self_loops': False, 'use_snp_selection': False}. Best is trial 51 with value: 0.3077853407165048.
[I 2025-12-08 11:59:39,557] Trial 122 finished with value: 0.2601289431580456 and parameters: {'model_type': 'gcn', 'hidden_dims': '[256, 128, 64]', 'dropout': 0.5541387691652939, 'batch_norm': True, 'lr': 9.589049432962039e-05, 'weight_decay': 3.8703955561052857e-05, 'epochs': 53, 'loss': 'mae', 'optimizer': 'adam', 'graph_mode': 'cutoff', 'cutoff': 0.7970169002492722, 'grm_norm': 'cosine_then_gcn', 'self_loops': False, 'use_snp_selection': False}. Best is trial 51 with value: 0.3077853407165048.
[I 2025-12-08 12:00:14,353] Trial 123 finished with value: 0.28300083576301904 and parameters: {'model_type': 'gcn', 'hidden_dims': '[256, 128, 64]', 'dropout': 0.5035648593432831, 'batch_norm': True, 'lr': 0.00017212367764897433, 'weight_decay': 5.47035735188102e-05, 'epochs': 270, 'loss': 'mae', 'optimizer': 'adam', 'graph_mode': 'cutoff', 'cutoff': 0.7413255262075806, 'grm_norm': 'cosine_then_gcn', 'self_loops': False, 'use_snp_selection': False}. Best is trial 51 with value: 0.3077853407165048.
[I 2025-12-08 12:00:26,193] Trial 124 finished with value: 0.27708159470740645 and parameters: {'model_type': 'gcn', 'hidden_dims': '[256, 128, 64]', 'dropout': 0.5298417766172504, 'batch_norm': True, 'lr': 0.00015442384274395407, 'weight_decay': 3.0244011821426556e-05, 'epochs': 79, 'loss': 'mae', 'optimizer': 'adam', 'graph_mode': 'cutoff', 'cutoff': 0.6670217550274193, 'grm_norm': 'cosine_then_gcn', 'self_loops': False, 'use_snp_selection': False}. Best is trial 51 with value: 0.3077853407165048.
[I 2025-12-08 12:00:35,697] Trial 125 finished with value: 0.29867306359272167 and parameters: {'model_type': 'gcn', 'hidden_dims': '[256, 128, 64]', 'dropout': 0.5893849766774991, 'batch_norm': True, 'lr': 0.001533551965313943, 'weight_decay': 3.5305881661380894e-05, 'epochs': 61, 'loss': 'mae', 'optimizer': 'adam', 'graph_mode': 'cutoff', 'cutoff': 0.8159489586872704, 'grm_norm': 'gcn', 'self_loops': False, 'use_snp_selection': False}. Best is trial 51 with value: 0.3077853407165048.
[I 2025-12-08 12:00:52,862] Trial 126 finished with value: 0.2932624508612487 and parameters: {'model_type': 'gcn', 'hidden_dims': '[512, 256]', 'dropout': 0.5895962744018942, 'batch_norm': True, 'lr': 0.0013074657001218748, 'weight_decay': 2.3541546242980258e-05, 'epochs': 59, 'loss': 'mae', 'optimizer': 'adam', 'graph_mode': 'cutoff', 'cutoff': 0.8268445189711537, 'grm_norm': 'gcn', 'self_loops': False, 'use_snp_selection': False}. Best is trial 51 with value: 0.3077853407165048.
[I 2025-12-08 12:01:01,034] Trial 127 finished with value: 0.29400542881710245 and parameters: {'model_type': 'gcn', 'hidden_dims': '[256, 128, 64]', 'dropout': 0.5985576284071609, 'batch_norm': True, 'lr': 0.0015379975114871102, 'weight_decay': 1.0803969439467853e-05, 'epochs': 50, 'loss': 'mae', 'optimizer': 'adam', 'graph_mode': 'cutoff', 'cutoff': 0.7606835530400939, 'grm_norm': 'gcn', 'self_loops': False, 'use_snp_selection': False}. Best is trial 51 with value: 0.3077853407165048.
[I 2025-12-08 12:01:21,536] Trial 128 finished with value: 0.2938334243366085 and parameters: {'model_type': 'gcn', 'hidden_dims': '[512, 64]', 'dropout': 0.5692342335558549, 'batch_norm': True, 'lr': 0.0020419373457916602, 'weight_decay': 3.4618519539894795e-05, 'epochs': 73, 'loss': 'mae', 'optimizer': 'adam', 'graph_mode': 'cutoff', 'cutoff': 0.8102947037546043, 'grm_norm': 'gcn', 'self_loops': False, 'use_snp_selection': False}. Best is trial 51 with value: 0.3077853407165048.
[I 2025-12-08 12:01:28,976] Trial 129 finished with value: 0.26953934409189506 and parameters: {'model_type': 'gcn', 'hidden_dims': '[256, 128, 64]', 'dropout': 0.5813037394418251, 'batch_norm': True, 'lr': 0.0005755939333969174, 'weight_decay': 6.916385295122154e-05, 'epochs': 40, 'loss': 'mse', 'optimizer': 'adam', 'graph_mode': 'knn', 'knn_k': 9, 'weighted_edges': True, 'symmetrize_mode': 'mutual', 'self_loops': False, 'use_snp_selection': False}. Best is trial 51 with value: 0.3077853407165048.
[I 2025-12-08 12:01:55,589] Trial 130 finished with value: 0.28890773171008943 and parameters: {'model_type': 'gcn', 'hidden_dims': '[256, 128, 64]', 'dropout': 0.5658321585415106, 'batch_norm': True, 'lr': 0.0010592682317538285, 'weight_decay': 1.7928030479392307e-05, 'epochs': 92, 'loss': 'mae', 'optimizer': 'adam', 'graph_mode': 'cutoff', 'cutoff': 0.7113214097852797, 'grm_norm': 'gcn', 'self_loops': True, 'use_snp_selection': True, 'num_snps': 52160}. Best is trial 51 with value: 0.3077853407165048.
[I 2025-12-08 12:02:05,221] Trial 131 finished with value: 0.2667331821130931 and parameters: {'model_type': 'gcn', 'hidden_dims': '[256, 128, 64]', 'dropout': 0.5499420363766571, 'batch_norm': True, 'lr': 5.208866567361502e-05, 'weight_decay': 4.638194881324021e-05, 'epochs': 62, 'loss': 'mae', 'optimizer': 'adam', 'graph_mode': 'cutoff', 'cutoff': 0.7779245588987512, 'grm_norm': 'gcn', 'self_loops': False, 'use_snp_selection': False}. Best is trial 51 with value: 0.3077853407165048.
[I 2025-12-08 12:02:15,385] Trial 132 finished with value: 0.2799533191573232 and parameters: {'model_type': 'gcn', 'hidden_dims': '[256, 128, 64]', 'dropout': 0.5753732195709554, 'batch_norm': True, 'lr': 7.638546277975101e-05, 'weight_decay': 3.6498115237120914e-05, 'epochs': 65, 'loss': 'mae', 'optimizer': 'adam', 'graph_mode': 'cutoff', 'cutoff': 0.8461918817174439, 'grm_norm': 'cosine_then_gcn', 'self_loops': False, 'use_snp_selection': False}. Best is trial 51 with value: 0.3077853407165048.
[I 2025-12-08 12:02:27,649] Trial 133 finished with value: 0.29339473901839613 and parameters: {'model_type': 'gcn', 'hidden_dims': '[256, 128, 64]', 'dropout': 0.5892435993326139, 'batch_norm': True, 'lr': 0.00012738157084367792, 'weight_decay': 2.7827847978909428e-05, 'epochs': 84, 'loss': 'mae', 'optimizer': 'adam', 'graph_mode': 'cutoff', 'cutoff': 0.7951096394930098, 'grm_norm': 'gcn', 'self_loops': False, 'use_snp_selection': False}. Best is trial 51 with value: 0.3077853407165048.
[I 2025-12-08 12:02:36,730] Trial 134 finished with value: 0.29331075913905547 and parameters: {'model_type': 'gcn', 'hidden_dims': '[256, 128, 64]', 'dropout': 0.5592953128582454, 'batch_norm': True, 'lr': 0.000218932124020773, 'weight_decay': 5.873365332426591e-05, 'epochs': 56, 'loss': 'mae', 'optimizer': 'adam', 'graph_mode': 'cutoff', 'cutoff': 0.8198402214184947, 'grm_norm': 'cosine_then_gcn', 'self_loops': False, 'use_snp_selection': False}. Best is trial 51 with value: 0.3077853407165048.
[I 2025-12-08 12:02:47,059] Trial 135 finished with value: 0.2947218788821103 and parameters: {'model_type': 'gcn', 'hidden_dims': '[256, 128, 64]', 'dropout': 0.5434450015713561, 'batch_norm': True, 'lr': 0.002445187161418012, 'weight_decay': 2.0741248488671693e-05, 'epochs': 68, 'loss': 'mae', 'optimizer': 'adam', 'graph_mode': 'cutoff', 'cutoff': 0.7704004585852823, 'grm_norm': 'none', 'self_loops': False, 'use_snp_selection': False}. Best is trial 51 with value: 0.3077853407165048.
[I 2025-12-08 12:03:25,054] Trial 136 finished with value: 0.2791525380524586 and parameters: {'model_type': 'gcn', 'hidden_dims': '[256, 128, 64]', 'dropout': 0.5272383539964949, 'batch_norm': True, 'lr': 0.0016477813012306197, 'weight_decay': 4.240445689224192e-05, 'epochs': 298, 'loss': 'mae', 'optimizer': 'adam', 'graph_mode': 'cutoff', 'cutoff': 0.862657378336815, 'grm_norm': 'gcn', 'self_loops': False, 'use_snp_selection': False}. Best is trial 51 with value: 0.3077853407165048.
[I 2025-12-08 12:03:55,633] Trial 137 finished with value: 0.0 and parameters: {'model_type': 'gcn', 'hidden_dims': '[256, 128]', 'dropout': 0.5999301470117414, 'batch_norm': False, 'lr': 0.0012354067491553238, 'weight_decay': 5.397108376723535e-05, 'epochs': 247, 'loss': 'mae', 'optimizer': 'adam', 'graph_mode': 'cutoff', 'cutoff': 0.7908741117680405, 'grm_norm': 'cosine_then_gcn', 'self_loops': False, 'use_snp_selection': False}. Best is trial 51 with value: 0.3077853407165048.
[I 2025-12-08 12:04:07,230] Trial 138 finished with value: 0.293736837023297 and parameters: {'model_type': 'gcn', 'hidden_dims': '[256, 128, 64]', 'dropout': 0.5846765673295199, 'batch_norm': True, 'lr': 0.0009306459167175802, 'weight_decay': 3.407549043397186e-05, 'epochs': 77, 'loss': 'mae', 'optimizer': 'adam', 'graph_mode': 'cutoff', 'cutoff': 0.745923994743299, 'grm_norm': 'cosine_then_gcn', 'self_loops': False, 'use_snp_selection': False}. Best is trial 51 with value: 0.3077853407165048.
[I 2025-12-08 12:04:15,436] Trial 139 finished with value: 0.2141575010019777 and parameters: {'model_type': 'gcn', 'hidden_dims': '[256, 128, 64]', 'dropout': 0.3711051019366206, 'batch_norm': True, 'lr': 0.002838277122781057, 'weight_decay': 8.189863334621947e-05, 'epochs': 48, 'loss': 'mae', 'optimizer': 'adam', 'graph_mode': 'cutoff', 'cutoff': 0.2177248886393195, 'grm_norm': 'gcn', 'self_loops': False, 'use_snp_selection': False}. Best is trial 51 with value: 0.3077853407165048.
[I 2025-12-08 12:04:24,881] Trial 140 finished with value: 0.18227023210827192 and parameters: {'model_type': 'gcn', 'hidden_dims': '[256, 128, 64]', 'dropout': 0.5718023136827828, 'batch_norm': True, 'lr': 1.624982040319008e-05, 'weight_decay': 2.5174576355375128e-05, 'epochs': 59, 'loss': 'mae', 'optimizer': 'adam', 'graph_mode': 'cutoff', 'cutoff': 0.6543118613614649, 'grm_norm': 'cosine_then_gcn', 'self_loops': False, 'use_snp_selection': False}. Best is trial 51 with value: 0.3077853407165048.
[I 2025-12-08 12:04:35,041] Trial 141 finished with value: 0.29606255294581957 and parameters: {'model_type': 'gcn', 'hidden_dims': '[256, 128, 64]', 'dropout': 0.5432022356014136, 'batch_norm': True, 'lr': 0.001471924653700981, 'weight_decay': 4.7571515016108986e-05, 'epochs': 65, 'loss': 'mae', 'optimizer': 'adam', 'graph_mode': 'cutoff', 'cutoff': 0.7527172954610497, 'grm_norm': 'cosine_then_gcn', 'self_loops': False, 'use_snp_selection': False}. Best is trial 51 with value: 0.3077853407165048.
[I 2025-12-08 12:04:45,686] Trial 142 finished with value: 0.3010225972979502 and parameters: {'model_type': 'gcn', 'hidden_dims': '[256, 128, 64]', 'dropout': 0.5536484927635724, 'batch_norm': True, 'lr': 0.0012925488712653497, 'weight_decay': 3.923675490987806e-05, 'epochs': 69, 'loss': 'mae', 'optimizer': 'adam', 'graph_mode': 'cutoff', 'cutoff': 0.7220557845363994, 'grm_norm': 'cosine_then_gcn', 'self_loops': False, 'use_snp_selection': False}. Best is trial 51 with value: 0.3077853407165048.
[I 2025-12-08 12:04:56,685] Trial 143 finished with value: 0.30032584507157284 and parameters: {'model_type': 'gcn', 'hidden_dims': '[256, 128, 64]', 'dropout': 0.5565741427959136, 'batch_norm': True, 'lr': 0.001789484361460369, 'weight_decay': 3.737459319822817e-05, 'epochs': 72, 'loss': 'mae', 'optimizer': 'adam', 'graph_mode': 'cutoff', 'cutoff': 0.6808507095048145, 'grm_norm': 'cosine_then_gcn', 'self_loops': False, 'use_snp_selection': False}. Best is trial 51 with value: 0.3077853407165048.
[I 2025-12-08 12:05:07,814] Trial 144 finished with value: 0.2957548552598032 and parameters: {'model_type': 'gcn', 'hidden_dims': '[256, 128, 64]', 'dropout': 0.5652544811754746, 'batch_norm': True, 'lr': 0.0018337469015082747, 'weight_decay': 1.5993228041637512e-05, 'epochs': 73, 'loss': 'mae', 'optimizer': 'adam', 'graph_mode': 'cutoff', 'cutoff': 0.6880587654632648, 'grm_norm': 'cosine_then_gcn', 'self_loops': False, 'use_snp_selection': False}. Best is trial 51 with value: 0.3077853407165048.
[I 2025-12-08 12:05:22,187] Trial 145 finished with value: 0.2926602009796889 and parameters: {'model_type': 'gcn', 'hidden_dims': '[256, 128, 64]', 'dropout': 0.5788793068140526, 'batch_norm': True, 'lr': 0.0013610061069957123, 'weight_decay': 3.0633718452460945e-05, 'epochs': 100, 'loss': 'mae', 'optimizer': 'adam', 'graph_mode': 'cutoff', 'cutoff': 0.6746604351936739, 'grm_norm': 'cosine_then_gcn', 'self_loops': False, 'use_snp_selection': False}. Best is trial 51 with value: 0.3077853407165048.
[I 2025-12-08 12:05:34,572] Trial 146 finished with value: 0.29711659587672284 and parameters: {'model_type': 'gcn', 'hidden_dims': '[256, 128, 64]', 'dropout': 0.5350897894992035, 'batch_norm': True, 'lr': 0.002215889596741111, 'weight_decay': 2.290201708339413e-05, 'epochs': 85, 'loss': 'mae', 'optimizer': 'adam', 'graph_mode': 'cutoff', 'cutoff': 0.7186487607343205, 'grm_norm': 'gcn', 'self_loops': False, 'use_snp_selection': False}. Best is trial 51 with value: 0.3077853407165048.
[I 2025-12-08 12:05:42,931] Trial 147 finished with value: 0.29786931827685953 and parameters: {'model_type': 'gcn', 'hidden_dims': '[256, 128, 64]', 'dropout': 0.5559696306647082, 'batch_norm': True, 'lr': 0.0011822867658351495, 'weight_decay': 6.45478229360203e-05, 'epochs': 50, 'loss': 'mae', 'optimizer': 'adam', 'graph_mode': 'cutoff', 'cutoff': 0.6392673341344319, 'grm_norm': 'cosine_then_gcn', 'self_loops': False, 'use_snp_selection': False}. Best is trial 51 with value: 0.3077853407165048.
[I 2025-12-08 12:05:51,648] Trial 148 finished with value: 0.29605682956462714 and parameters: {'model_type': 'gcn', 'hidden_dims': '[256, 128, 64]', 'dropout': 0.5189002100242436, 'batch_norm': True, 'lr': 0.0007956311731844643, 'weight_decay': 0.00011648366081816001, 'epochs': 53, 'loss': 'mae', 'optimizer': 'adam', 'graph_mode': 'cutoff', 'cutoff': 0.6433575307583098, 'grm_norm': 'cosine_then_gcn', 'self_loops': False, 'use_snp_selection': False}. Best is trial 51 with value: 0.3077853407165048.
[I 2025-12-08 12:06:13,100] Trial 149 finished with value: 0.28392663124203227 and parameters: {'model_type': 'gcn', 'hidden_dims': '[256, 128, 64]', 'dropout': 0.5583848706392086, 'batch_norm': True, 'lr': 0.0019949821977201195, 'weight_decay': 6.34996442866166e-05, 'epochs': 169, 'loss': 'mae', 'optimizer': 'adam', 'graph_mode': 'cutoff', 'cutoff': 0.6999268705608752, 'grm_norm': 'gcn', 'self_loops': True, 'use_snp_selection': True, 'num_snps': 24109}. Best is trial 51 with value: 0.3077853407165048.
[I 2025-12-08 12:06:39,355] Trial 0 finished with value: 0.2595611143524696 and parameters: {'model_type': 'gcn', 'hidden_dims': '[128, 64]', 'dropout': 0.199031432379812, 'batch_norm': True, 'lr': 1.8408544111075823e-05, 'weight_decay': 5.5136510071208614e-05, 'epochs': 336, 'loss': 'mae', 'optimizer': 'adam', 'graph_mode': 'knn', 'knn_k': 8, 'weighted_edges': True, 'symmetrize_mode': 'mutual', 'self_loops': True, 'use_snp_selection': True, 'num_snps': 27173}. Best is trial 0 with value: 0.2595611143524696.
[I 2025-12-08 12:07:17,724] Trial 1 finished with value: 0.23156452751087486 and parameters: {'model_type': 'gcn', 'hidden_dims': '[256, 128, 64]', 'dropout': 0.5543244404043342, 'batch_norm': True, 'lr': 7.981787657617978e-05, 'weight_decay': 2.8571789869344834e-07, 'epochs': 297, 'loss': 'mae', 'optimizer': 'adam', 'graph_mode': 'cutoff', 'cutoff': 0.3392632777751686, 'grm_norm': 'gcn', 'self_loops': False, 'use_snp_selection': False}. Best is trial 0 with value: 0.2595611143524696.
[I 2025-12-08 12:08:15,775] Trial 2 finished with value: 0.21527103421834978 and parameters: {'model_type': 'gcn', 'hidden_dims': '[512, 64]', 'dropout': 0.32815227354739207, 'batch_norm': True, 'lr': 0.000619605044204259, 'weight_decay': 0.0004086269831625786, 'epochs': 206, 'loss': 'mse', 'optimizer': 'adam', 'graph_mode': 'knn', 'knn_k': 4, 'weighted_edges': True, 'symmetrize_mode': 'union', 'self_loops': True, 'use_snp_selection': True, 'num_snps': 53035}. Best is trial 0 with value: 0.2595611143524696.
[I 2025-12-08 12:08:43,398] Trial 3 finished with value: 0.21872604261714113 and parameters: {'model_type': 'gcn', 'hidden_dims': '[256, 128]', 'dropout': 0.23110783056597514, 'batch_norm': True, 'lr': 8.11311593386298e-05, 'weight_decay': 9.296158109581328e-07, 'epochs': 213, 'loss': 'mse', 'optimizer': 'adam', 'graph_mode': 'knn', 'knn_k': 10, 'weighted_edges': True, 'symmetrize_mode': 'mutual', 'self_loops': True, 'use_snp_selection': False}. Best is trial 0 with value: 0.2595611143524696.
[I 2025-12-08 12:08:58,068] Trial 4 finished with value: 0.2865102678357604 and parameters: {'model_type': 'gcn', 'hidden_dims': '[512, 256]', 'dropout': 0.2753281956415665, 'batch_norm': True, 'lr': 0.00034435188114839693, 'weight_decay': 4.9416012835950194e-05, 'epochs': 89, 'loss': 'mae', 'optimizer': 'adam', 'graph_mode': 'cutoff', 'cutoff': 0.820078967317394, 'grm_norm': 'none', 'self_loops': False, 'use_snp_selection': True, 'num_snps': 12674}. Best is trial 4 with value: 0.2865102678357604.
[I 2025-12-08 12:09:23,154] Trial 5 finished with value: 0.26212612663648804 and parameters: {'model_type': 'gcn', 'hidden_dims': '[128, 64]', 'dropout': 0.5611163934517731, 'batch_norm': True, 'lr': 0.0003984856210762587, 'weight_decay': 1.1466743517565185e-07, 'epochs': 344, 'loss': 'mae', 'optimizer': 'adam', 'graph_mode': 'cutoff', 'cutoff': 0.6089370799714728, 'grm_norm': 'gcn', 'self_loops': True, 'use_snp_selection': False}. Best is trial 4 with value: 0.2865102678357604.
