[I 2025-12-08 22:12:09,624] Trial 61 finished with value: 0.3446246599979193 and parameters: {'model_type': 'gcn', 'hidden_dims': '[512, 256]', 'dropout': 0.4153587072489117, 'batch_norm': False, 'lr': 0.0005130069656761816, 'weight_decay': 1.8144320989899477e-05, 'epochs': 105, 'loss': 'mae', 'optimizer': 'adam', 'graph_mode': 'cutoff', 'cutoff': 0.7907475578722901, 'grm_norm': 'none', 'self_loops': False, 'use_snp_selection': True, 'num_snps': 5740}. Best is trial 20 with value: 0.3649142115175917.
[I 2025-12-08 22:12:39,197] Trial 62 finished with value: 0.33468493892625717 and parameters: {'model_type': 'gcn', 'hidden_dims': '[512, 256]', 'dropout': 0.5184366602902982, 'batch_norm': False, 'lr': 0.00024281847371037199, 'weight_decay': 3.454852347851564e-06, 'epochs': 218, 'loss': 'mae', 'optimizer': 'adam', 'graph_mode': 'cutoff', 'cutoff': 0.8802639257371985, 'grm_norm': 'none', 'self_loops': False, 'use_snp_selection': True, 'num_snps': 20786}. Best is trial 20 with value: 0.3649142115175917.
[I 2025-12-08 22:13:09,617] Trial 63 finished with value: 0.12562243873535256 and parameters: {'model_type': 'gcn', 'hidden_dims': '[512, 256]', 'dropout': 0.4945677821354003, 'batch_norm': False, 'lr': 0.001139260177002485, 'weight_decay': 0.0002146857180597703, 'epochs': 81, 'loss': 'mae', 'optimizer': 'adam', 'graph_mode': 'cutoff', 'cutoff': 0.6799282702711482, 'grm_norm': 'none', 'self_loops': False, 'use_snp_selection': True, 'num_snps': 48000}. Best is trial 20 with value: 0.3649142115175917.
[I 2025-12-08 22:14:01,812] Trial 64 finished with value: 0.33082163674324283 and parameters: {'model_type': 'gcn', 'hidden_dims': '[512, 256]', 'dropout': 0.4259892167508979, 'batch_norm': False, 'lr': 0.0003585827004207608, 'weight_decay': 0.000130252598299505, 'epochs': 183, 'loss': 'mae', 'optimizer': 'adam', 'graph_mode': 'cutoff', 'cutoff': 0.7641038038695256, 'grm_norm': 'none', 'self_loops': False, 'use_snp_selection': True, 'num_snps': 52656}. Best is trial 20 with value: 0.3649142115175917.
[I 2025-12-08 22:14:28,420] Trial 65 finished with value: 0.35375194860685 and parameters: {'model_type': 'gcn', 'hidden_dims': '[512, 256]', 'dropout': 0.3960025304210315, 'batch_norm': False, 'lr': 0.00015620654904468782, 'weight_decay': 7.208081073645138e-05, 'epochs': 128, 'loss': 'mae', 'optimizer': 'adam', 'graph_mode': 'cutoff', 'cutoff': 0.8634676493122371, 'grm_norm': 'cosine_then_gcn', 'self_loops': False, 'use_snp_selection': True, 'num_snps': 27807}. Best is trial 20 with value: 0.3649142115175917.
[I 2025-12-08 22:14:49,414] Trial 66 finished with value: 0.36216433650113294 and parameters: {'model_type': 'gcn', 'hidden_dims': '[512, 64]', 'dropout': 0.37025991709991, 'batch_norm': False, 'lr': 5.2907079609346195e-05, 'weight_decay': 0.0009754632423859023, 'epochs': 201, 'loss': 'mae', 'optimizer': 'adam', 'graph_mode': 'cutoff', 'cutoff': 0.6621240096793178, 'grm_norm': 'cosine_then_gcn', 'self_loops': False, 'use_snp_selection': True, 'num_snps': 13497}. Best is trial 20 with value: 0.3649142115175917.
[I 2025-12-08 22:15:08,723] Trial 67 finished with value: 0.33381023822684186 and parameters: {'model_type': 'gcn', 'hidden_dims': '[512, 64]', 'dropout': 0.34944907701171457, 'batch_norm': False, 'lr': 2.4708825474031467e-05, 'weight_decay': 0.0005955476303656508, 'epochs': 200, 'loss': 'mse', 'optimizer': 'adam', 'graph_mode': 'knn', 'knn_k': 5, 'weighted_edges': True, 'symmetrize_mode': 'mutual', 'self_loops': False, 'use_snp_selection': True, 'num_snps': 10452}. Best is trial 20 with value: 0.3649142115175917.
[I 2025-12-08 22:15:21,029] Trial 68 finished with value: 0.32742384196822927 and parameters: {'model_type': 'gcn', 'hidden_dims': '[512, 64]', 'dropout': 0.36632690665341416, 'batch_norm': False, 'lr': 3.8399996595279794e-05, 'weight_decay': 0.00028089377472821896, 'epochs': 225, 'loss': 'mae', 'optimizer': 'adam', 'graph_mode': 'cutoff', 'cutoff': 0.6072857529834293, 'grm_norm': 'cosine_then_gcn', 'self_loops': False, 'use_snp_selection': True, 'num_snps': 2428}. Best is trial 20 with value: 0.3649142115175917.
[I 2025-12-08 22:16:15,139] Trial 69 finished with value: 0.3680033444187648 and parameters: {'model_type': 'gcn', 'hidden_dims': '[512, 64]', 'dropout': 0.30748836622125136, 'batch_norm': False, 'lr': 4.965859876316109e-05, 'weight_decay': 0.0007132189709654711, 'epochs': 166, 'loss': 'mae', 'optimizer': 'adam', 'graph_mode': 'cutoff', 'cutoff': 0.6604583732756262, 'grm_norm': 'cosine_then_gcn', 'self_loops': False, 'use_snp_selection': True, 'num_snps': 59389}. Best is trial 69 with value: 0.3680033444187648.
[I 2025-12-08 22:17:19,406] Trial 70 finished with value: 0.3581208531430264 and parameters: {'model_type': 'gcn', 'hidden_dims': '[512, 64]', 'dropout': 0.2557099823510138, 'batch_norm': False, 'lr': 1.9057526711082312e-05, 'weight_decay': 0.0004313288877624341, 'epochs': 213, 'loss': 'mae', 'optimizer': 'adam', 'graph_mode': 'cutoff', 'cutoff': 0.6571062005965745, 'grm_norm': 'cosine_then_gcn', 'self_loops': True, 'use_snp_selection': True, 'num_snps': 59500}. Best is trial 69 with value: 0.3680033444187648.
[I 2025-12-08 22:17:54,090] Trial 71 finished with value: 0.3629267524620851 and parameters: {'model_type': 'gcn', 'hidden_dims': '[512, 64]', 'dropout': 0.31315365618074065, 'batch_norm': False, 'lr': 4.919976036126974e-05, 'weight_decay': 0.0008569833566677204, 'epochs': 168, 'loss': 'mae', 'optimizer': 'adam', 'graph_mode': 'cutoff', 'cutoff': 0.6891348793724602, 'grm_norm': 'cosine_then_gcn', 'self_loops': False, 'use_snp_selection': True, 'num_snps': 32958}. Best is trial 69 with value: 0.3680033444187648.
[I 2025-12-08 22:18:14,639] Trial 72 finished with value: 0.35397795670293836 and parameters: {'model_type': 'gcn', 'hidden_dims': '[512, 64]', 'dropout': 0.29046722483779436, 'batch_norm': False, 'lr': 8.502844566762555e-05, 'weight_decay': 0.00088791580918805, 'epochs': 177, 'loss': 'mae', 'optimizer': 'adam', 'graph_mode': 'cutoff', 'cutoff': 0.700878562004746, 'grm_norm': 'cosine_then_gcn', 'self_loops': False, 'use_snp_selection': True, 'num_snps': 14379}. Best is trial 69 with value: 0.3680033444187648.
[I 2025-12-08 22:18:47,462] Trial 73 finished with value: 0.3615006367849302 and parameters: {'model_type': 'gcn', 'hidden_dims': '[512, 64]', 'dropout': 0.3017612793577292, 'batch_norm': False, 'lr': 6.410895794570201e-05, 'weight_decay': 0.0006198574234677773, 'epochs': 152, 'loss': 'mae', 'optimizer': 'adam', 'graph_mode': 'cutoff', 'cutoff': 0.6212970463400165, 'grm_norm': 'cosine_then_gcn', 'self_loops': False, 'use_snp_selection': True, 'num_snps': 33162}. Best is trial 69 with value: 0.3680033444187648.
[I 2025-12-08 22:19:22,265] Trial 74 finished with value: 0.32182687427513823 and parameters: {'model_type': 'gcn', 'hidden_dims': '[512, 64]', 'dropout': 0.2631276456179976, 'batch_norm': False, 'lr': 3.74919473666762e-05, 'weight_decay': 0.0007568956620133219, 'epochs': 140, 'loss': 'mae', 'optimizer': 'adam', 'graph_mode': 'cutoff', 'cutoff': 0.21479938489652323, 'grm_norm': 'cosine_then_gcn', 'self_loops': False, 'use_snp_selection': True, 'num_snps': 36761}. Best is trial 69 with value: 0.3680033444187648.
[I 2025-12-08 22:19:55,090] Trial 75 finished with value: 0.35672194462046675 and parameters: {'model_type': 'gcn', 'hidden_dims': '[512, 64]', 'dropout': 0.32963705832583184, 'batch_norm': False, 'lr': 2.8030870289530987e-05, 'weight_decay': 0.0008469774043151716, 'epochs': 170, 'loss': 'mae', 'optimizer': 'adam', 'graph_mode': 'cutoff', 'cutoff': 0.6684612664312913, 'grm_norm': 'cosine_then_gcn', 'self_loops': False, 'use_snp_selection': True, 'num_snps': 30494}. Best is trial 69 with value: 0.3680033444187648.
[I 2025-12-08 22:20:38,100] Trial 76 finished with value: 0.29098820979225737 and parameters: {'model_type': 'gcn', 'hidden_dims': '[512, 64]', 'dropout': 0.19651657479202564, 'batch_norm': True, 'lr': 5.0516301307276827e-05, 'weight_decay': 0.00032037641452360585, 'epochs': 194, 'loss': 'mae', 'optimizer': 'adam', 'graph_mode': 'cutoff', 'cutoff': 0.5807967522490167, 'grm_norm': 'cosine_then_gcn', 'self_loops': False, 'use_snp_selection': True, 'num_snps': 39065}. Best is trial 69 with value: 0.3680033444187648.
[I 2025-12-08 22:21:25,645] Trial 77 finished with value: 0.3271182498155626 and parameters: {'model_type': 'gcn', 'hidden_dims': '[512, 64]', 'dropout': 0.337928889260041, 'batch_norm': False, 'lr': 0.00011169098236761146, 'weight_decay': 0.0004985885520820856, 'epochs': 186, 'loss': 'mae', 'optimizer': 'adam', 'graph_mode': 'cutoff', 'cutoff': 0.6928750891560077, 'grm_norm': 'cosine_then_gcn', 'self_loops': False, 'use_snp_selection': False}. Best is trial 69 with value: 0.3680033444187648.
[I 2025-12-08 22:22:15,048] Trial 78 finished with value: 0.3115039216497779 and parameters: {'model_type': 'gcn', 'hidden_dims': '[512, 64]', 'dropout': 0.31497153995438193, 'batch_norm': False, 'lr': 8.56875564095826e-05, 'weight_decay': 0.0009342698657764709, 'epochs': 154, 'loss': 'mse', 'optimizer': 'adam', 'graph_mode': 'cutoff', 'cutoff': 0.7423834247137768, 'grm_norm': 'cosine_then_gcn', 'self_loops': False, 'use_snp_selection': True, 'num_snps': 56676}. Best is trial 69 with value: 0.3680033444187648.
[I 2025-12-08 22:22:37,172] Trial 79 finished with value: 0.3520708132136786 and parameters: {'model_type': 'gcn', 'hidden_dims': '[128, 64]', 'dropout': 0.3621028502571733, 'batch_norm': False, 'lr': 6.810206492662043e-05, 'weight_decay': 0.000238762680717402, 'epochs': 206, 'loss': 'mae', 'optimizer': 'adam', 'graph_mode': 'knn', 'knn_k': 9, 'weighted_edges': True, 'symmetrize_mode': 'union', 'self_loops': False, 'use_snp_selection': True, 'num_snps': 34153}. Best is trial 69 with value: 0.3680033444187648.
[I 2025-12-08 22:22:50,615] Trial 80 finished with value: 0.2691349614783397 and parameters: {'model_type': 'gcn', 'hidden_dims': '[256, 128, 64]', 'dropout': 0.5773921758153642, 'batch_norm': False, 'lr': 3.320427297921022e-05, 'weight_decay': 0.00014817460864769566, 'epochs': 165, 'loss': 'mae', 'optimizer': 'adam', 'graph_mode': 'cutoff', 'cutoff': 0.6321305701791491, 'grm_norm': 'cosine_then_gcn', 'self_loops': False, 'use_snp_selection': True, 'num_snps': 7578}. Best is trial 69 with value: 0.3680033444187648.
[I 2025-12-08 22:23:18,685] Trial 81 finished with value: 0.3535729756936392 and parameters: {'model_type': 'gcn', 'hidden_dims': '[512, 128]', 'dropout': 0.3784083832034656, 'batch_norm': False, 'lr': 5.045792033577506e-05, 'weight_decay': 0.00036093392966391944, 'epochs': 162, 'loss': 'mae', 'optimizer': 'adam', 'graph_mode': 'cutoff', 'cutoff': 0.714417158938522, 'grm_norm': 'cosine_then_gcn', 'self_loops': False, 'use_snp_selection': True, 'num_snps': 25217}. Best is trial 69 with value: 0.3680033444187648.
[I 2025-12-08 22:23:43,672] Trial 82 finished with value: 0.3542765999914087 and parameters: {'model_type': 'gcn', 'hidden_dims': '[256, 128]', 'dropout': 0.4560692336365099, 'batch_norm': False, 'lr': 4.403790559501187e-05, 'weight_decay': 3.61270656669898e-05, 'epochs': 176, 'loss': 'mae', 'optimizer': 'adam', 'graph_mode': 'cutoff', 'cutoff': 0.6661321654016081, 'grm_norm': 'cosine_then_gcn', 'self_loops': False, 'use_snp_selection': True, 'num_snps': 31867}. Best is trial 69 with value: 0.3680033444187648.
[I 2025-12-08 22:24:37,538] Trial 83 finished with value: 0.3606059675526567 and parameters: {'model_type': 'gcn', 'hidden_dims': '[512, 64]', 'dropout': 0.49682097147801413, 'batch_norm': False, 'lr': 5.149429770596057e-05, 'weight_decay': 0.000606537970166716, 'epochs': 185, 'loss': 'mae', 'optimizer': 'adam', 'graph_mode': 'cutoff', 'cutoff': 0.7834420413102756, 'grm_norm': 'cosine_then_gcn', 'self_loops': False, 'use_snp_selection': True, 'num_snps': 54265}. Best is trial 69 with value: 0.3680033444187648.
[I 2025-12-08 22:25:17,183] Trial 84 finished with value: 0.35764124403715464 and parameters: {'model_type': 'gcn', 'hidden_dims': '[512, 256]', 'dropout': 0.4057672224691043, 'batch_norm': False, 'lr': 6.329726325514632e-05, 'weight_decay': 1.3639511006331106e-06, 'epochs': 146, 'loss': 'mae', 'optimizer': 'adam', 'graph_mode': 'cutoff', 'cutoff': 0.7436092677961544, 'grm_norm': 'cosine_then_gcn', 'self_loops': False, 'use_snp_selection': True, 'num_snps': 44335}. Best is trial 69 with value: 0.3680033444187648.
[I 2025-12-08 22:26:48,152] Trial 85 finished with value: 0.3619902870464201 and parameters: {'model_type': 'gcn', 'hidden_dims': '[512, 64]', 'dropout': 0.481955767338685, 'batch_norm': False, 'lr': 1.5603322485891204e-05, 'weight_decay': 4.621553354396668e-07, 'epochs': 349, 'loss': 'mae', 'optimizer': 'adam', 'graph_mode': 'cutoff', 'cutoff': 0.7235154697375012, 'grm_norm': 'cosine_then_gcn', 'self_loops': False, 'use_snp_selection': True, 'num_snps': 57958}. Best is trial 69 with value: 0.3680033444187648.
[I 2025-12-08 22:28:19,444] Trial 86 finished with value: 0.361650387446091 and parameters: {'model_type': 'gcn', 'hidden_dims': '[512, 64]', 'dropout': 0.534171290005989, 'batch_norm': False, 'lr': 1.3378978347516229e-05, 'weight_decay': 0.00045002706881203146, 'epochs': 350, 'loss': 'mae', 'optimizer': 'adam', 'graph_mode': 'cutoff', 'cutoff': 0.6898772073022666, 'grm_norm': 'cosine_then_gcn', 'self_loops': False, 'use_snp_selection': True, 'num_snps': 58074}. Best is trial 69 with value: 0.3680033444187648.
[I 2025-12-08 22:29:03,847] Trial 87 finished with value: 0.35547481774109924 and parameters: {'model_type': 'gcn', 'hidden_dims': '[512, 64]', 'dropout': 0.4827342191569349, 'batch_norm': False, 'lr': 2.2323036149639607e-05, 'weight_decay': 6.626549301845056e-06, 'epochs': 293, 'loss': 'mae', 'optimizer': 'adam', 'graph_mode': 'cutoff', 'cutoff': 0.5438144886326481, 'grm_norm': 'cosine_then_gcn', 'self_loops': True, 'use_snp_selection': True, 'num_snps': 28080}. Best is trial 69 with value: 0.3680033444187648.
[I 2025-12-08 22:30:31,717] Trial 88 finished with value: 0.32064530971046634 and parameters: {'model_type': 'gcn', 'hidden_dims': '[512, 64]', 'dropout': 0.5162029274596528, 'batch_norm': True, 'lr': 1.639409984676994e-05, 'weight_decay': 4.22969933568416e-07, 'epochs': 320, 'loss': 'mae', 'optimizer': 'adam', 'graph_mode': 'cutoff', 'cutoff': 0.7283983031262269, 'grm_norm': 'cosine_then_gcn', 'self_loops': False, 'use_snp_selection': True, 'num_snps': 59935}. Best is trial 69 with value: 0.3680033444187648.
[I 2025-12-08 22:31:02,133] Trial 89 finished with value: 0.36613460584462415 and parameters: {'model_type': 'gcn', 'hidden_dims': '[512, 128]', 'dropout': 0.4723184905114594, 'batch_norm': False, 'lr': 0.00012614323967412866, 'weight_decay': 9.646697079459484e-05, 'epochs': 124, 'loss': 'mae', 'optimizer': 'adam', 'graph_mode': 'cutoff', 'cutoff': 0.6502216211762869, 'grm_norm': 'cosine', 'self_loops': False, 'use_snp_selection': True, 'num_snps': 34952}. Best is trial 69 with value: 0.3680033444187648.
[I 2025-12-08 22:31:35,234] Trial 90 finished with value: 0.3106513876432518 and parameters: {'model_type': 'gcn', 'hidden_dims': '[512, 64]', 'dropout': 0.540514403824583, 'batch_norm': False, 'lr': 1.1296327217350502e-05, 'weight_decay': 0.00010526990917830356, 'epochs': 126, 'loss': 'mse', 'optimizer': 'adam', 'graph_mode': 'cutoff', 'cutoff': 0.6442849040935266, 'grm_norm': 'cosine', 'self_loops': False, 'use_snp_selection': False}. Best is trial 69 with value: 0.3680033444187648.
[I 2025-12-08 22:32:04,206] Trial 91 finished with value: 0.360173517022593 and parameters: {'model_type': 'gcn', 'hidden_dims': '[512, 128]', 'dropout': 0.47808531686781885, 'batch_norm': False, 'lr': 0.0001264924358707196, 'weight_decay': 0.00017024615705283884, 'epochs': 112, 'loss': 'mae', 'optimizer': 'adam', 'graph_mode': 'cutoff', 'cutoff': 0.6629154696311845, 'grm_norm': 'cosine', 'self_loops': False, 'use_snp_selection': True, 'num_snps': 35325}. Best is trial 69 with value: 0.3680033444187648.
[I 2025-12-08 22:32:54,912] Trial 92 finished with value: 0.34226742399180565 and parameters: {'model_type': 'gcn', 'hidden_dims': '[512, 128]', 'dropout': 0.4659601373328594, 'batch_norm': False, 'lr': 0.00010874680305509026, 'weight_decay': 7.472477172058305e-05, 'epochs': 293, 'loss': 'mae', 'optimizer': 'adam', 'graph_mode': 'cutoff', 'cutoff': 0.6202682409636809, 'grm_norm': 'cosine', 'self_loops': False, 'use_snp_selection': True, 'num_snps': 33619}. Best is trial 69 with value: 0.3680033444187648.
[I 2025-12-08 22:33:23,832] Trial 93 finished with value: 0.3637412557335702 and parameters: {'model_type': 'gcn', 'hidden_dims': '[512, 128]', 'dropout': 0.44538694462949524, 'batch_norm': False, 'lr': 8.105901908628135e-05, 'weight_decay': 1.1929672617290919e-05, 'epochs': 136, 'loss': 'mae', 'optimizer': 'adam', 'graph_mode': 'cutoff', 'cutoff': 0.7107838078537866, 'grm_norm': 'cosine', 'self_loops': False, 'use_snp_selection': True, 'num_snps': 30494}. Best is trial 69 with value: 0.3680033444187648.
[I 2025-12-08 22:33:52,025] Trial 94 finished with value: 0.36230342304337226 and parameters: {'model_type': 'gcn', 'hidden_dims': '[512, 128]', 'dropout': 0.4469123943162118, 'batch_norm': False, 'lr': 8.585553229902009e-05, 'weight_decay': 1.2421662483130391e-05, 'epochs': 138, 'loss': 'mae', 'optimizer': 'adam', 'graph_mode': 'cutoff', 'cutoff': 0.6908442893579781, 'grm_norm': 'cosine', 'self_loops': False, 'use_snp_selection': True, 'num_snps': 29249}. Best is trial 69 with value: 0.3680033444187648.
[I 2025-12-08 22:34:18,754] Trial 95 finished with value: 0.36303121981158587 and parameters: {'model_type': 'gcn', 'hidden_dims': '[512, 128]', 'dropout': 0.4504293898388837, 'batch_norm': False, 'lr': 8.603083391421413e-05, 'weight_decay': 1.2042721946733336e-05, 'epochs': 121, 'loss': 'mae', 'optimizer': 'adam', 'graph_mode': 'cutoff', 'cutoff': 0.6832326176288419, 'grm_norm': 'cosine', 'self_loops': False, 'use_snp_selection': True, 'num_snps': 29432}. Best is trial 69 with value: 0.3680033444187648.
[I 2025-12-08 22:34:45,154] Trial 96 finished with value: 0.33214165695501124 and parameters: {'model_type': 'gcn', 'hidden_dims': '[512, 128]', 'dropout': 0.4354870153347651, 'batch_norm': False, 'lr': 8.892242950698785e-05, 'weight_decay': 1.2562417219830983e-05, 'epochs': 110, 'loss': 'mae', 'optimizer': 'adam', 'graph_mode': 'knn', 'knn_k': 2, 'weighted_edges': False, 'symmetrize_mode': 'mutual', 'self_loops': False, 'use_snp_selection': True, 'num_snps': 31042}. Best is trial 69 with value: 0.3680033444187648.
[I 2025-12-08 22:35:11,440] Trial 97 finished with value: 0.36412619826246695 and parameters: {'model_type': 'gcn', 'hidden_dims': '[512, 128]', 'dropout': 0.4491443523970218, 'batch_norm': False, 'lr': 0.0001612351105275115, 'weight_decay': 1.4239615107963181e-05, 'epochs': 121, 'loss': 'mae', 'optimizer': 'adam', 'graph_mode': 'cutoff', 'cutoff': 0.6767496233218575, 'grm_norm': 'cosine', 'self_loops': False, 'use_snp_selection': True, 'num_snps': 29102}. Best is trial 69 with value: 0.3680033444187648.
[I 2025-12-08 22:35:37,609] Trial 98 finished with value: 0.3629805160584514 and parameters: {'model_type': 'gcn', 'hidden_dims': '[512, 128]', 'dropout': 0.4481666554797304, 'batch_norm': False, 'lr': 0.00020408208897329264, 'weight_decay': 1.4875109797787115e-05, 'epochs': 119, 'loss': 'mae', 'optimizer': 'adam', 'graph_mode': 'cutoff', 'cutoff': 0.6852091053712674, 'grm_norm': 'cosine', 'self_loops': False, 'use_snp_selection': True, 'num_snps': 29372}. Best is trial 69 with value: 0.3680033444187648.
[I 2025-12-08 22:35:59,456] Trial 99 finished with value: 0.3616153517418768 and parameters: {'model_type': 'gcn', 'hidden_dims': '[512, 128]', 'dropout': 0.5071812300352502, 'batch_norm': False, 'lr': 0.00020038470429706846, 'weight_decay': 1.941046698045267e-05, 'epochs': 91, 'loss': 'mae', 'optimizer': 'adam', 'graph_mode': 'cutoff', 'cutoff': 0.6762425814976313, 'grm_norm': 'cosine', 'self_loops': False, 'use_snp_selection': True, 'num_snps': 26505}. Best is trial 69 with value: 0.3680033444187648.
[I 2025-12-08 22:36:27,400] Trial 100 finished with value: 0.3568357847982385 and parameters: {'model_type': 'gcn', 'hidden_dims': '[512, 128]', 'dropout': 0.4542071407351988, 'batch_norm': False, 'lr': 0.0001790793613174166, 'weight_decay': 1.5501195931165196e-05, 'epochs': 120, 'loss': 'mae', 'optimizer': 'adam', 'graph_mode': 'cutoff', 'cutoff': 0.7065875831684724, 'grm_norm': 'cosine', 'self_loops': True, 'use_snp_selection': True, 'num_snps': 31903}. Best is trial 69 with value: 0.3680033444187648.
[I 2025-12-08 22:36:54,818] Trial 101 finished with value: 0.35562262929505345 and parameters: {'model_type': 'gcn', 'hidden_dims': '[512, 128]', 'dropout': 0.44278928270703144, 'batch_norm': False, 'lr': 0.00031223391057373184, 'weight_decay': 1.0743205185092404e-05, 'epochs': 134, 'loss': 'mae', 'optimizer': 'adam', 'graph_mode': 'cutoff', 'cutoff': 0.6894388640307334, 'grm_norm': 'cosine', 'self_loops': False, 'use_snp_selection': True, 'num_snps': 28466}. Best is trial 69 with value: 0.3680033444187648.
[I 2025-12-08 22:37:23,423] Trial 102 finished with value: 0.35550106007647964 and parameters: {'model_type': 'gcn', 'hidden_dims': '[512, 128]', 'dropout': 0.4318166378221232, 'batch_norm': False, 'lr': 0.00010205825103965164, 'weight_decay': 8.207963997670236e-06, 'epochs': 141, 'loss': 'mae', 'optimizer': 'adam', 'graph_mode': 'cutoff', 'cutoff': 0.6941946177649827, 'grm_norm': 'cosine', 'self_loops': False, 'use_snp_selection': True, 'num_snps': 29342}. Best is trial 69 with value: 0.3680033444187648.
