[I 2025-12-08 23:53:18,864] Trial 124 finished with value: 0.3113910482814034 and parameters: {'model_type': 'gcn', 'hidden_dims': '[256, 128]', 'dropout': 0.5986402939542312, 'batch_norm': True, 'lr': 0.0005968804631126561, 'weight_decay': 6.386728731639187e-06, 'epochs': 40, 'loss': 'mae', 'optimizer': 'adam', 'graph_mode': 'cutoff', 'cutoff': 0.8187612677557204, 'grm_norm': 'cosine_then_gcn', 'self_loops': True, 'use_snp_selection': False}. Best is trial 120 with value: 0.3210667504663244.
[I 2025-12-08 23:53:27,498] Trial 125 finished with value: 0.3170093250973756 and parameters: {'model_type': 'gcn', 'hidden_dims': '[128, 64]', 'dropout': 0.5724131863692371, 'batch_norm': True, 'lr': 0.0014749476628311813, 'weight_decay': 0.0004597631256322696, 'epochs': 77, 'loss': 'mae', 'optimizer': 'adam', 'graph_mode': 'cutoff', 'cutoff': 0.7877552600152742, 'grm_norm': 'cosine_then_gcn', 'self_loops': True, 'use_snp_selection': False}. Best is trial 120 with value: 0.3210667504663244.
[I 2025-12-08 23:53:40,280] Trial 126 finished with value: 0.31715206595619166 and parameters: {'model_type': 'gcn', 'hidden_dims': '[256, 128]', 'dropout': 0.5359138435022712, 'batch_norm': True, 'lr': 0.0013181106514512377, 'weight_decay': 0.0005365818288549476, 'epochs': 78, 'loss': 'mae', 'optimizer': 'adam', 'graph_mode': 'cutoff', 'cutoff': 0.7887753132048392, 'grm_norm': 'cosine_then_gcn', 'self_loops': True, 'use_snp_selection': False}. Best is trial 120 with value: 0.3210667504663244.
[I 2025-12-08 23:53:53,003] Trial 127 finished with value: 0.315390352472173 and parameters: {'model_type': 'gcn', 'hidden_dims': '[256, 128]', 'dropout': 0.5350172913637662, 'batch_norm': True, 'lr': 0.0015024871381623874, 'weight_decay': 0.0004756278687134771, 'epochs': 76, 'loss': 'mae', 'optimizer': 'adam', 'graph_mode': 'cutoff', 'cutoff': 0.7102028636421995, 'grm_norm': 'cosine_then_gcn', 'self_loops': True, 'use_snp_selection': False}. Best is trial 120 with value: 0.3210667504663244.
[I 2025-12-08 23:54:03,295] Trial 128 finished with value: 0.31950936312406086 and parameters: {'model_type': 'gcn', 'hidden_dims': '[256, 128]', 'dropout': 0.5701157914992429, 'batch_norm': True, 'lr': 0.0013798040739663477, 'weight_decay': 0.0005710594687606027, 'epochs': 55, 'loss': 'mae', 'optimizer': 'adam', 'graph_mode': 'cutoff', 'cutoff': 0.7893981650839037, 'grm_norm': 'cosine_then_gcn', 'self_loops': True, 'use_snp_selection': False}. Best is trial 120 with value: 0.3210667504663244.
[I 2025-12-08 23:54:12,643] Trial 129 finished with value: 0.314175290077664 and parameters: {'model_type': 'gcn', 'hidden_dims': '[256, 128]', 'dropout': 0.571409389416391, 'batch_norm': True, 'lr': 0.00169584744825983, 'weight_decay': 0.00026456972669927723, 'epochs': 46, 'loss': 'mae', 'optimizer': 'adam', 'graph_mode': 'cutoff', 'cutoff': 0.7898464874846145, 'grm_norm': 'cosine_then_gcn', 'self_loops': True, 'use_snp_selection': False}. Best is trial 120 with value: 0.3210667504663244.
[I 2025-12-08 23:54:23,049] Trial 130 finished with value: 0.2517279680291235 and parameters: {'model_type': 'gcn', 'hidden_dims': '[256, 128]', 'dropout': 0.550517219805705, 'batch_norm': True, 'lr': 0.002678321685110417, 'weight_decay': 0.00019486203710993944, 'epochs': 54, 'loss': 'mse', 'optimizer': 'adam', 'graph_mode': 'knn', 'knn_k': 2, 'weighted_edges': True, 'symmetrize_mode': 'mutual', 'self_loops': True, 'use_snp_selection': False}. Best is trial 120 with value: 0.3210667504663244.
[I 2025-12-08 23:54:34,620] Trial 131 finished with value: 0.3103468627970772 and parameters: {'model_type': 'gcn', 'hidden_dims': '[256, 128]', 'dropout': 0.5635637959895037, 'batch_norm': True, 'lr': 0.0013752045390060816, 'weight_decay': 0.0005368708338023538, 'epochs': 68, 'loss': 'mae', 'optimizer': 'adam', 'graph_mode': 'cutoff', 'cutoff': 0.7447325824042343, 'grm_norm': 'cosine_then_gcn', 'self_loops': True, 'use_snp_selection': False}. Best is trial 120 with value: 0.3210667504663244.
[I 2025-12-08 23:54:45,787] Trial 132 finished with value: 0.3237245808684047 and parameters: {'model_type': 'gcn', 'hidden_dims': '[256, 128]', 'dropout': 0.5781786472924946, 'batch_norm': True, 'lr': 0.0011200689643474679, 'weight_decay': 0.0006212022291221379, 'epochs': 62, 'loss': 'mae', 'optimizer': 'adam', 'graph_mode': 'cutoff', 'cutoff': 0.7555993483055746, 'grm_norm': 'cosine_then_gcn', 'self_loops': True, 'use_snp_selection': False}. Best is trial 132 with value: 0.3237245808684047.
[I 2025-12-08 23:54:56,443] Trial 133 finished with value: 0.313454128418538 and parameters: {'model_type': 'gcn', 'hidden_dims': '[256, 128]', 'dropout': 0.5798898340342048, 'batch_norm': True, 'lr': 0.0011005428880218812, 'weight_decay': 0.0006136652873620183, 'epochs': 59, 'loss': 'mae', 'optimizer': 'adam', 'graph_mode': 'cutoff', 'cutoff': 0.7818357242766241, 'grm_norm': 'cosine_then_gcn', 'self_loops': True, 'use_snp_selection': False}. Best is trial 132 with value: 0.3237245808684047.
[I 2025-12-08 23:55:06,029] Trial 134 finished with value: 0.3137694095564655 and parameters: {'model_type': 'gcn', 'hidden_dims': '[256, 128]', 'dropout': 0.5431094884434291, 'batch_norm': True, 'lr': 0.001894314279098415, 'weight_decay': 0.00043085287411832824, 'epochs': 49, 'loss': 'mae', 'optimizer': 'adam', 'graph_mode': 'cutoff', 'cutoff': 0.7983382058872366, 'grm_norm': 'cosine_then_gcn', 'self_loops': True, 'use_snp_selection': False}. Best is trial 132 with value: 0.3237245808684047.
[I 2025-12-08 23:55:17,132] Trial 135 finished with value: 0.31553614036400635 and parameters: {'model_type': 'gcn', 'hidden_dims': '[256, 128]', 'dropout': 0.5675403139285276, 'batch_norm': True, 'lr': 0.001254341588644979, 'weight_decay': 0.0007795346055435786, 'epochs': 63, 'loss': 'mae', 'optimizer': 'adam', 'graph_mode': 'cutoff', 'cutoff': 0.7612056248841735, 'grm_norm': 'cosine_then_gcn', 'self_loops': True, 'use_snp_selection': False}. Best is trial 132 with value: 0.3237245808684047.
[I 2025-12-08 23:55:28,761] Trial 136 finished with value: 0.29804169144135784 and parameters: {'model_type': 'gcn', 'hidden_dims': '[256, 128]', 'dropout': 0.5788986200303499, 'batch_norm': True, 'lr': 0.0021479769800167156, 'weight_decay': 0.0003256811161069491, 'epochs': 70, 'loss': 'mae', 'optimizer': 'adam', 'graph_mode': 'cutoff', 'cutoff': 0.8334084777431385, 'grm_norm': 'cosine_then_gcn', 'self_loops': True, 'use_snp_selection': True, 'num_snps': 9353}. Best is trial 132 with value: 0.3237245808684047.
[I 2025-12-08 23:55:41,876] Trial 137 finished with value: 0.3094554146759767 and parameters: {'model_type': 'gcn', 'hidden_dims': '[256, 128, 64]', 'dropout': 0.5983191497687914, 'batch_norm': True, 'lr': 0.0010089926657410844, 'weight_decay': 0.0005484382136474016, 'epochs': 78, 'loss': 'mae', 'optimizer': 'adam', 'graph_mode': 'cutoff', 'cutoff': 0.8455996368020269, 'grm_norm': 'cosine', 'self_loops': True, 'use_snp_selection': False}. Best is trial 132 with value: 0.3237245808684047.
[I 2025-12-08 23:55:51,654] Trial 138 finished with value: 0.002025582695975781 and parameters: {'model_type': 'gcn', 'hidden_dims': '[256, 128]', 'dropout': 0.5277043987723381, 'batch_norm': False, 'lr': 0.0015120454553845333, 'weight_decay': 0.000682393664361671, 'epochs': 55, 'loss': 'mae', 'optimizer': 'adam', 'graph_mode': 'cutoff', 'cutoff': 0.7905248371231673, 'grm_norm': 'cosine_then_gcn', 'self_loops': True, 'use_snp_selection': False}. Best is trial 132 with value: 0.3237245808684047.
[I 2025-12-08 23:56:07,624] Trial 139 finished with value: 0.3163386992728412 and parameters: {'model_type': 'gcn', 'hidden_dims': '[512, 128]', 'dropout': 0.5553290466693572, 'batch_norm': True, 'lr': 0.0011352137796724663, 'weight_decay': 0.00043677914630235276, 'epochs': 48, 'loss': 'mae', 'optimizer': 'adam', 'graph_mode': 'cutoff', 'cutoff': 0.7311303101576115, 'grm_norm': 'cosine_then_gcn', 'self_loops': True, 'use_snp_selection': False}. Best is trial 132 with value: 0.3237245808684047.
[I 2025-12-08 23:56:19,807] Trial 140 finished with value: 0.316537629575686 and parameters: {'model_type': 'gcn', 'hidden_dims': '[256, 128]', 'dropout': 0.5383998192007535, 'batch_norm': True, 'lr': 0.0008798197275776435, 'weight_decay': 0.0009720856829661276, 'epochs': 68, 'loss': 'mae', 'optimizer': 'adam', 'graph_mode': 'cutoff', 'cutoff': 0.7499357216138819, 'grm_norm': 'cosine_then_gcn', 'self_loops': True, 'use_snp_selection': False}. Best is trial 132 with value: 0.3237245808684047.
[I 2025-12-08 23:56:33,455] Trial 141 finished with value: 0.3159029622479369 and parameters: {'model_type': 'gcn', 'hidden_dims': '[256, 128]', 'dropout': 0.5749242679541302, 'batch_norm': True, 'lr': 0.0012553030629268206, 'weight_decay': 0.0008345486327017446, 'epochs': 83, 'loss': 'mae', 'optimizer': 'adam', 'graph_mode': 'cutoff', 'cutoff': 0.7601127080377206, 'grm_norm': 'cosine_then_gcn', 'self_loops': False, 'use_snp_selection': False}. Best is trial 132 with value: 0.3237245808684047.
[I 2025-12-08 23:56:46,631] Trial 142 finished with value: 0.3159776748084462 and parameters: {'model_type': 'gcn', 'hidden_dims': '[256, 128]', 'dropout': 0.5860258691406286, 'batch_norm': True, 'lr': 0.0009811795928808147, 'weight_decay': 0.0006188039892588536, 'epochs': 76, 'loss': 'mae', 'optimizer': 'adam', 'graph_mode': 'cutoff', 'cutoff': 0.7697133677660973, 'grm_norm': 'cosine_then_gcn', 'self_loops': False, 'use_snp_selection': False}. Best is trial 132 with value: 0.3237245808684047.
[I 2025-12-08 23:56:56,879] Trial 143 finished with value: 0.311422414971323 and parameters: {'model_type': 'gcn', 'hidden_dims': '[256, 128]', 'dropout': 0.5579297321703363, 'batch_norm': True, 'lr': 0.0013663455772169675, 'weight_decay': 0.0004926179683386093, 'epochs': 59, 'loss': 'mae', 'optimizer': 'adam', 'graph_mode': 'cutoff', 'cutoff': 0.8248938461033866, 'grm_norm': 'cosine_then_gcn', 'self_loops': False, 'use_snp_selection': False}. Best is trial 132 with value: 0.3237245808684047.
[I 2025-12-08 23:57:30,092] Trial 144 finished with value: 0.3121759882700454 and parameters: {'model_type': 'gcn', 'hidden_dims': '[256, 128]', 'dropout': 0.5164835232905545, 'batch_norm': True, 'lr': 0.0008407939204352948, 'weight_decay': 0.0007248767033022704, 'epochs': 256, 'loss': 'mae', 'optimizer': 'adam', 'graph_mode': 'cutoff', 'cutoff': 0.7788188286052156, 'grm_norm': 'cosine_then_gcn', 'self_loops': False, 'use_snp_selection': False}. Best is trial 132 with value: 0.3237245808684047.
[I 2025-12-08 23:57:39,558] Trial 145 finished with value: 0.313539383905865 and parameters: {'model_type': 'gcn', 'hidden_dims': '[128, 64]', 'dropout': 0.5656746090117349, 'batch_norm': True, 'lr': 0.0016952464397824306, 'weight_decay': 0.000918793984403793, 'epochs': 87, 'loss': 'mae', 'optimizer': 'adam', 'graph_mode': 'cutoff', 'cutoff': 0.8065193873147034, 'grm_norm': 'cosine_then_gcn', 'self_loops': False, 'use_snp_selection': False}. Best is trial 132 with value: 0.3237245808684047.
[I 2025-12-08 23:57:51,153] Trial 146 finished with value: 0.3148780939817293 and parameters: {'model_type': 'gcn', 'hidden_dims': '[256, 128, 64]', 'dropout': 0.5889091122816679, 'batch_norm': True, 'lr': 0.00026081936147248906, 'weight_decay': 0.0003945961963942976, 'epochs': 65, 'loss': 'mae', 'optimizer': 'adam', 'graph_mode': 'cutoff', 'cutoff': 0.8682065787622265, 'grm_norm': 'cosine_then_gcn', 'self_loops': True, 'use_snp_selection': False}. Best is trial 132 with value: 0.3237245808684047.
[I 2025-12-08 23:58:32,755] Trial 147 finished with value: 0.3043407509659427 and parameters: {'model_type': 'gcn', 'hidden_dims': '[512, 256]', 'dropout': 0.5474834151830166, 'batch_norm': True, 'lr': 0.0007422464967037808, 'weight_decay': 0.000540078115389365, 'epochs': 294, 'loss': 'mae', 'optimizer': 'adam', 'graph_mode': 'cutoff', 'cutoff': 0.8477435992690687, 'grm_norm': 'gcn', 'self_loops': False, 'use_snp_selection': True, 'num_snps': 24714}. Best is trial 132 with value: 0.3237245808684047.
[I 2025-12-08 23:58:44,740] Trial 148 finished with value: 0.3156428806789543 and parameters: {'model_type': 'gcn', 'hidden_dims': '[256, 128]', 'dropout': 0.2747962181167746, 'batch_norm': True, 'lr': 0.002429652996482286, 'weight_decay': 2.712350871304288e-06, 'epochs': 74, 'loss': 'mae', 'optimizer': 'adam', 'graph_mode': 'cutoff', 'cutoff': 0.6961154546766176, 'grm_norm': 'cosine_then_gcn', 'self_loops': True, 'use_snp_selection': False}. Best is trial 132 with value: 0.3237245808684047.
[I 2025-12-08 23:59:02,158] Trial 149 finished with value: 0.31531123285474266 and parameters: {'model_type': 'gcn', 'hidden_dims': '[512, 64]', 'dropout': 0.5715995071528276, 'batch_norm': True, 'lr': 0.0004966284360647423, 'weight_decay': 0.00022304709530317394, 'epochs': 53, 'loss': 'mae', 'optimizer': 'adam', 'graph_mode': 'cutoff', 'cutoff': 0.7931484126662766, 'grm_norm': 'cosine_then_gcn', 'self_loops': False, 'use_snp_selection': False}. Best is trial 132 with value: 0.3237245808684047.
