[I 2025-12-08 18:40:12,869] Trial 114 finished with value: 0.28964769292665693 and parameters: {'model_type': 'gcn', 'hidden_dims': '[512, 128]', 'dropout': 0.3411424911942967, 'batch_norm': True, 'lr': 9.236021741576209e-05, 'weight_decay': 2.3803639359022454e-05, 'epochs': 344, 'loss': 'mae', 'optimizer': 'adam', 'graph_mode': 'cutoff', 'cutoff': 0.7002725567363881, 'grm_norm': 'cosine', 'self_loops': False, 'use_snp_selection': True, 'num_snps': 29221}. Best is trial 54 with value: 0.2986725876748172.
[I 2025-12-08 18:40:45,891] Trial 115 finished with value: 0.2824347409913801 and parameters: {'model_type': 'gcn', 'hidden_dims': '[512, 128]', 'dropout': 0.5927283910562883, 'batch_norm': True, 'lr': 0.00011626399984838625, 'weight_decay': 0.0001101217016711086, 'epochs': 227, 'loss': 'mae', 'optimizer': 'adam', 'graph_mode': 'cutoff', 'cutoff': 0.6065636902513895, 'grm_norm': 'cosine', 'self_loops': False, 'use_snp_selection': True, 'num_snps': 23533}. Best is trial 54 with value: 0.2986725876748172.
[I 2025-12-08 18:41:15,589] Trial 116 finished with value: 0.29969653756334846 and parameters: {'model_type': 'gcn', 'hidden_dims': '[512, 64]', 'dropout': 0.5516107270383143, 'batch_norm': True, 'lr': 1.7438930839187022e-05, 'weight_decay': 4.9244042170003314e-05, 'epochs': 209, 'loss': 'mae', 'optimizer': 'adam', 'graph_mode': 'cutoff', 'cutoff': 0.6338920332964021, 'grm_norm': 'cosine_then_gcn', 'self_loops': False, 'use_snp_selection': True, 'num_snps': 21603}. Best is trial 116 with value: 0.29969653756334846.
[I 2025-12-08 18:41:42,180] Trial 117 finished with value: 0.2822392464803062 and parameters: {'model_type': 'gcn', 'hidden_dims': '[512, 64]', 'dropout': 0.5560796690719179, 'batch_norm': True, 'lr': 1.691948767700549e-05, 'weight_decay': 4.986481418140427e-05, 'epochs': 209, 'loss': 'mae', 'optimizer': 'adam', 'graph_mode': 'cutoff', 'cutoff': 0.6299485560946241, 'grm_norm': 'cosine_then_gcn', 'self_loops': False, 'use_snp_selection': True, 'num_snps': 18061}. Best is trial 116 with value: 0.29969653756334846.
[I 2025-12-08 18:42:10,300] Trial 118 finished with value: 0.2905065574248348 and parameters: {'model_type': 'gcn', 'hidden_dims': '[512, 64]', 'dropout': 0.5020298985269573, 'batch_norm': True, 'lr': 2.0545521877453403e-05, 'weight_decay': 2.9092743219654188e-05, 'epochs': 215, 'loss': 'mae', 'optimizer': 'adam', 'graph_mode': 'cutoff', 'cutoff': 0.6526634194001388, 'grm_norm': 'cosine_then_gcn', 'self_loops': False, 'use_snp_selection': True, 'num_snps': 19086}. Best is trial 116 with value: 0.29969653756334846.
[I 2025-12-08 18:42:41,965] Trial 119 finished with value: 0.2855873638274454 and parameters: {'model_type': 'gcn', 'hidden_dims': '[512, 64]', 'dropout': 0.5815287761046773, 'batch_norm': True, 'lr': 1.1327199542959069e-05, 'weight_decay': 1.1004490612745398e-05, 'epochs': 233, 'loss': 'mae', 'optimizer': 'adam', 'graph_mode': 'cutoff', 'cutoff': 0.6137835186614293, 'grm_norm': 'cosine_then_gcn', 'self_loops': True, 'use_snp_selection': True, 'num_snps': 21596}. Best is trial 116 with value: 0.29969653756334846.
[I 2025-12-08 18:43:14,412] Trial 120 finished with value: 0.2885257948656232 and parameters: {'model_type': 'gcn', 'hidden_dims': '[512, 64]', 'dropout': 0.5989354776125088, 'batch_norm': True, 'lr': 1.3843802627939524e-05, 'weight_decay': 1.856305701527697e-05, 'epochs': 223, 'loss': 'mae', 'optimizer': 'adam', 'graph_mode': 'cutoff', 'cutoff': 0.5869155311812728, 'grm_norm': 'cosine_then_gcn', 'self_loops': False, 'use_snp_selection': True, 'num_snps': 22977}. Best is trial 116 with value: 0.29969653756334846.
[I 2025-12-08 18:43:41,763] Trial 121 finished with value: 0.28389405084221464 and parameters: {'model_type': 'gcn', 'hidden_dims': '[512, 64]', 'dropout': 0.5029864713803938, 'batch_norm': True, 'lr': 1.9630760071612515e-05, 'weight_decay': 2.8215879442763493e-05, 'epochs': 199, 'loss': 'mae', 'optimizer': 'adam', 'graph_mode': 'cutoff', 'cutoff': 0.6489197223659559, 'grm_norm': 'cosine_then_gcn', 'self_loops': False, 'use_snp_selection': True, 'num_snps': 19907}. Best is trial 116 with value: 0.29969653756334846.
[I 2025-12-08 18:44:09,316] Trial 122 finished with value: 0.28282885756947457 and parameters: {'model_type': 'gcn', 'hidden_dims': '[512, 64]', 'dropout': 0.5175725496495617, 'batch_norm': True, 'lr': 2.1714128291740305e-05, 'weight_decay': 5.612060926798573e-05, 'epochs': 217, 'loss': 'mae', 'optimizer': 'adam', 'graph_mode': 'cutoff', 'cutoff': 0.6853841529932162, 'grm_norm': 'cosine_then_gcn', 'self_loops': False, 'use_snp_selection': True, 'num_snps': 18844}. Best is trial 116 with value: 0.29969653756334846.
[I 2025-12-08 18:44:28,806] Trial 123 finished with value: 0.2791158270255501 and parameters: {'model_type': 'gcn', 'hidden_dims': '[512, 64]', 'dropout': 0.5498770442624874, 'batch_norm': True, 'lr': 0.0003724586652102786, 'weight_decay': 2.3050410233107254e-05, 'epochs': 191, 'loss': 'mae', 'optimizer': 'adam', 'graph_mode': 'cutoff', 'cutoff': 0.6542608815706927, 'grm_norm': 'cosine_then_gcn', 'self_loops': False, 'use_snp_selection': True, 'num_snps': 12056}. Best is trial 116 with value: 0.29969653756334846.
[I 2025-12-08 18:44:57,927] Trial 124 finished with value: 0.276076637342139 and parameters: {'model_type': 'gcn', 'hidden_dims': '[512, 64]', 'dropout': 0.5667661163301949, 'batch_norm': True, 'lr': 2.5074105723456236e-05, 'weight_decay': 8.282219512922508e-05, 'epochs': 207, 'loss': 'mae', 'optimizer': 'adam', 'graph_mode': 'cutoff', 'cutoff': 0.6635477477213282, 'grm_norm': 'cosine_then_gcn', 'self_loops': False, 'use_snp_selection': True, 'num_snps': 20910}. Best is trial 116 with value: 0.29969653756334846.
[I 2025-12-08 18:45:34,318] Trial 125 finished with value: 0.2858573765496752 and parameters: {'model_type': 'gcn', 'hidden_dims': '[512, 256]', 'dropout': 0.5309271524338941, 'batch_norm': True, 'lr': 2.9838483298785626e-05, 'weight_decay': 2.90213051944573e-05, 'epochs': 241, 'loss': 'mae', 'optimizer': 'adam', 'graph_mode': 'cutoff', 'cutoff': 0.8828363037887091, 'grm_norm': 'cosine_then_gcn', 'self_loops': False, 'use_snp_selection': True, 'num_snps': 25658}. Best is trial 116 with value: 0.29969653756334846.
[I 2025-12-08 18:46:29,291] Trial 126 finished with value: 0.27179903127198324 and parameters: {'model_type': 'gcn', 'hidden_dims': '[512, 64]', 'dropout': 0.5123205092556896, 'batch_norm': True, 'lr': 1.7733305899696457e-05, 'weight_decay': 0.0003445481756532804, 'epochs': 213, 'loss': 'mse', 'optimizer': 'adam', 'graph_mode': 'cutoff', 'cutoff': 0.6373085812795949, 'grm_norm': 'cosine_then_gcn', 'self_loops': False, 'use_snp_selection': True, 'num_snps': 48899}. Best is trial 116 with value: 0.29969653756334846.
[I 2025-12-08 18:46:49,493] Trial 127 finished with value: 0.2257984287915787 and parameters: {'model_type': 'gcn', 'hidden_dims': '[256, 128, 64]', 'dropout': 0.4565739786781761, 'batch_norm': True, 'lr': 4.356490193466396e-05, 'weight_decay': 7.4155447243936505e-06, 'epochs': 227, 'loss': 'mae', 'optimizer': 'adam', 'graph_mode': 'knn', 'knn_k': 2, 'weighted_edges': False, 'symmetrize_mode': 'mutual', 'self_loops': False, 'use_snp_selection': True, 'num_snps': 14858}. Best is trial 116 with value: 0.29969653756334846.
[I 2025-12-08 18:47:51,858] Trial 128 finished with value: 0.2255820663787962 and parameters: {'model_type': 'gcn', 'hidden_dims': '[512, 256]', 'dropout': 0.5605968372977058, 'batch_norm': True, 'lr': 1.5594204900710416e-05, 'weight_decay': 4.627859945637107e-05, 'epochs': 246, 'loss': 'mae', 'optimizer': 'adam', 'graph_mode': 'cutoff', 'cutoff': 0.532328579648508, 'grm_norm': 'gcn', 'self_loops': False, 'use_snp_selection': False}. Best is trial 116 with value: 0.29969653756334846.
[I 2025-12-08 18:48:14,368] Trial 129 finished with value: 0.26322909791091653 and parameters: {'model_type': 'gcn', 'hidden_dims': '[256, 128]', 'dropout': 0.5891930808323285, 'batch_norm': True, 'lr': 0.00024636224372319166, 'weight_decay': 1.845044684757824e-05, 'epochs': 217, 'loss': 'mae', 'optimizer': 'adam', 'graph_mode': 'cutoff', 'cutoff': 0.5646575759148211, 'grm_norm': 'cosine_then_gcn', 'self_loops': False, 'use_snp_selection': True, 'num_snps': 21979}. Best is trial 116 with value: 0.29969653756334846.
[I 2025-12-08 18:48:43,931] Trial 130 finished with value: 0.27199771320845006 and parameters: {'model_type': 'gcn', 'hidden_dims': '[512, 256]', 'dropout': 0.5743772277837675, 'batch_norm': False, 'lr': 1.2269299699124801e-05, 'weight_decay': 0.000453396882493684, 'epochs': 254, 'loss': 'mae', 'optimizer': 'adam', 'graph_mode': 'cutoff', 'cutoff': 0.49477639534231743, 'grm_norm': 'none', 'self_loops': False, 'use_snp_selection': True, 'num_snps': 17340}. Best is trial 116 with value: 0.29969653756334846.
[I 2025-12-08 18:49:28,690] Trial 131 finished with value: 0.22764549073778984 and parameters: {'model_type': 'gcn', 'hidden_dims': '[512, 128]', 'dropout': 0.5219501960760554, 'batch_norm': True, 'lr': 2.1330027102132734e-05, 'weight_decay': 3.8591929559602764e-05, 'epochs': 301, 'loss': 'mae', 'optimizer': 'adam', 'graph_mode': 'cutoff', 'cutoff': 0.44892607514888744, 'grm_norm': 'cosine', 'self_loops': False, 'use_snp_selection': True, 'num_snps': 27086}. Best is trial 116 with value: 0.29969653756334846.
[I 2025-12-08 18:50:04,034] Trial 132 finished with value: 0.2890326113332658 and parameters: {'model_type': 'gcn', 'hidden_dims': '[512, 256]', 'dropout': 0.547946477630902, 'batch_norm': True, 'lr': 0.0001329910195024011, 'weight_decay': 3.126155952468086e-05, 'epochs': 237, 'loss': 'mae', 'optimizer': 'adam', 'graph_mode': 'cutoff', 'cutoff': 0.6986395504838975, 'grm_norm': 'cosine', 'self_loops': False, 'use_snp_selection': True, 'num_snps': 24640}. Best is trial 116 with value: 0.29969653756334846.
[I 2025-12-08 18:50:48,354] Trial 133 finished with value: 0.2840594444929389 and parameters: {'model_type': 'gcn', 'hidden_dims': '[512, 128]', 'dropout': 0.5397861273147578, 'batch_norm': True, 'lr': 5.735699741173913e-05, 'weight_decay': 1.3551651228259686e-05, 'epochs': 268, 'loss': 'mae', 'optimizer': 'adam', 'graph_mode': 'cutoff', 'cutoff': 0.6878718724624739, 'grm_norm': 'cosine', 'self_loops': False, 'use_snp_selection': True, 'num_snps': 30093}. Best is trial 116 with value: 0.29969653756334846.
[I 2025-12-08 18:51:23,581] Trial 134 finished with value: 0.28884549237122403 and parameters: {'model_type': 'gcn', 'hidden_dims': '[512, 256]', 'dropout': 0.29992368098858885, 'batch_norm': True, 'lr': 9.351414501446558e-05, 'weight_decay': 4.027543818835048e-05, 'epochs': 179, 'loss': 'mae', 'optimizer': 'adam', 'graph_mode': 'cutoff', 'cutoff': 0.6309463253982179, 'grm_norm': 'cosine', 'self_loops': False, 'use_snp_selection': True, 'num_snps': 31479}. Best is trial 116 with value: 0.29969653756334846.
[I 2025-12-08 18:51:56,105] Trial 135 finished with value: 0.28347235004679183 and parameters: {'model_type': 'gcn', 'hidden_dims': '[512, 64]', 'dropout': 0.498016868106045, 'batch_norm': True, 'lr': 7.412564207515484e-05, 'weight_decay': 2.171096578408639e-05, 'epochs': 222, 'loss': 'mae', 'optimizer': 'adam', 'graph_mode': 'cutoff', 'cutoff': 0.7172868561123347, 'grm_norm': 'cosine_then_gcn', 'self_loops': False, 'use_snp_selection': True, 'num_snps': 23549}. Best is trial 116 with value: 0.29969653756334846.
[I 2025-12-08 18:52:12,787] Trial 136 finished with value: 0.28030407025108367 and parameters: {'model_type': 'gcn', 'hidden_dims': '[128, 64]', 'dropout': 0.5352723070013932, 'batch_norm': True, 'lr': 0.00018907966312712438, 'weight_decay': 8.918666859527305e-06, 'epochs': 205, 'loss': 'mae', 'optimizer': 'adam', 'graph_mode': 'cutoff', 'cutoff': 0.5999297596472379, 'grm_norm': 'cosine', 'self_loops': False, 'use_snp_selection': True, 'num_snps': 18955}. Best is trial 116 with value: 0.29969653756334846.
[I 2025-12-08 18:52:50,836] Trial 137 finished with value: 0.27134683834122264 and parameters: {'model_type': 'gcn', 'hidden_dims': '[512, 256]', 'dropout': 0.4774101141047032, 'batch_norm': True, 'lr': 1.8253017633684738e-05, 'weight_decay': 0.0006646200321565775, 'epochs': 231, 'loss': 'mae', 'optimizer': 'adam', 'graph_mode': 'cutoff', 'cutoff': 0.6721337524529475, 'grm_norm': 'cosine_then_gcn', 'self_loops': False, 'use_snp_selection': True, 'num_snps': 27898}. Best is trial 116 with value: 0.29969653756334846.
[I 2025-12-08 18:53:25,379] Trial 138 finished with value: 0.28382219510509377 and parameters: {'model_type': 'gcn', 'hidden_dims': '[512, 256]', 'dropout': 0.5585093939308028, 'batch_norm': True, 'lr': 2.6784925651967697e-05, 'weight_decay': 3.3396346696702275e-05, 'epochs': 213, 'loss': 'mae', 'optimizer': 'adam', 'graph_mode': 'cutoff', 'cutoff': 0.6180840378877358, 'grm_norm': 'cosine', 'self_loops': False, 'use_snp_selection': True, 'num_snps': 26029}. Best is trial 116 with value: 0.29969653756334846.
[I 2025-12-08 18:53:37,783] Trial 139 finished with value: 0.21119365636091372 and parameters: {'model_type': 'gcn', 'hidden_dims': '[256, 128]', 'dropout': 0.579161478642827, 'batch_norm': True, 'lr': 1.4494787635939995e-05, 'weight_decay': 0.0001452268865008447, 'epochs': 285, 'loss': 'mae', 'optimizer': 'adam', 'graph_mode': 'cutoff', 'cutoff': 0.6879641175808249, 'grm_norm': 'cosine', 'self_loops': True, 'use_snp_selection': True, 'num_snps': 2342}. Best is trial 116 with value: 0.29969653756334846.
[I 2025-12-08 18:54:16,009] Trial 140 finished with value: 0.28997074991181915 and parameters: {'model_type': 'gcn', 'hidden_dims': '[512, 128]', 'dropout': 0.5434676588692596, 'batch_norm': True, 'lr': 3.125170328025628e-05, 'weight_decay': 1.592815721957791e-05, 'epochs': 192, 'loss': 'mae', 'optimizer': 'adam', 'graph_mode': 'cutoff', 'cutoff': 0.6557291856003686, 'grm_norm': 'cosine_then_gcn', 'self_loops': False, 'use_snp_selection': True, 'num_snps': 33148}. Best is trial 116 with value: 0.29969653756334846.
[I 2025-12-08 18:54:56,666] Trial 141 finished with value: 0.291468606472136 and parameters: {'model_type': 'gcn', 'hidden_dims': '[512, 128]', 'dropout': 0.5427981747028847, 'batch_norm': True, 'lr': 3.5019720958873755e-05, 'weight_decay': 1.6170574533519067e-05, 'epochs': 190, 'loss': 'mae', 'optimizer': 'adam', 'graph_mode': 'cutoff', 'cutoff': 0.6565293434961752, 'grm_norm': 'cosine_then_gcn', 'self_loops': False, 'use_snp_selection': True, 'num_snps': 36334}. Best is trial 116 with value: 0.29969653756334846.
[I 2025-12-08 18:55:37,137] Trial 142 finished with value: 0.2865214202064627 and parameters: {'model_type': 'gcn', 'hidden_dims': '[512, 128]', 'dropout': 0.5258179787205614, 'batch_norm': True, 'lr': 5.031009836207736e-05, 'weight_decay': 2.4697185987202487e-05, 'epochs': 186, 'loss': 'mae', 'optimizer': 'adam', 'graph_mode': 'cutoff', 'cutoff': 0.6397076914099039, 'grm_norm': 'cosine_then_gcn', 'self_loops': False, 'use_snp_selection': True, 'num_snps': 36779}. Best is trial 116 with value: 0.29969653756334846.
[I 2025-12-08 18:56:17,252] Trial 143 finished with value: 0.2629255359789622 and parameters: {'model_type': 'gcn', 'hidden_dims': '[512, 128]', 'dropout': 0.5068661064470933, 'batch_norm': True, 'lr': 3.7569231918487594e-05, 'weight_decay': 1.998507383252104e-05, 'epochs': 198, 'loss': 'mae', 'optimizer': 'adam', 'graph_mode': 'cutoff', 'cutoff': 0.8327298866899171, 'grm_norm': 'cosine_then_gcn', 'self_loops': False, 'use_snp_selection': True, 'num_snps': 34565}. Best is trial 116 with value: 0.29969653756334846.
[I 2025-12-08 18:56:59,011] Trial 144 finished with value: 0.29052633717856585 and parameters: {'model_type': 'gcn', 'hidden_dims': '[512, 128]', 'dropout': 0.5686409836498716, 'batch_norm': True, 'lr': 2.5380275993216875e-05, 'weight_decay': 1.000257449744942e-05, 'epochs': 207, 'loss': 'mae', 'optimizer': 'adam', 'graph_mode': 'cutoff', 'cutoff': 0.7079289819547396, 'grm_norm': 'cosine_then_gcn', 'self_loops': False, 'use_snp_selection': True, 'num_snps': 35498}. Best is trial 116 with value: 0.29969653756334846.
[I 2025-12-08 18:57:36,197] Trial 145 finished with value: 0.28989753108393135 and parameters: {'model_type': 'gcn', 'hidden_dims': '[512, 128]', 'dropout': 0.5687895684877909, 'batch_norm': True, 'lr': 2.376548050477342e-05, 'weight_decay': 1.34722959875849e-05, 'epochs': 171, 'loss': 'mae', 'optimizer': 'adam', 'graph_mode': 'cutoff', 'cutoff': 0.7102504176427663, 'grm_norm': 'cosine_then_gcn', 'self_loops': False, 'use_snp_selection': True, 'num_snps': 35896}. Best is trial 116 with value: 0.29969653756334846.
[I 2025-12-08 18:58:20,059] Trial 146 finished with value: 0.290185169640928 and parameters: {'model_type': 'gcn', 'hidden_dims': '[512, 256]', 'dropout': 0.5859516678405847, 'batch_norm': True, 'lr': 3.4282151527761694e-05, 'weight_decay': 9.71479189116497e-06, 'epochs': 206, 'loss': 'mae', 'optimizer': 'adam', 'graph_mode': 'cutoff', 'cutoff': 0.6712623836169072, 'grm_norm': 'cosine_then_gcn', 'self_loops': False, 'use_snp_selection': True, 'num_snps': 38016}. Best is trial 116 with value: 0.29969653756334846.
[I 2025-12-08 18:59:08,604] Trial 147 finished with value: 0.2759714404616912 and parameters: {'model_type': 'gcn', 'hidden_dims': '[512, 256]', 'dropout': 0.5569276248914606, 'batch_norm': True, 'lr': 2.0362708092241735e-05, 'weight_decay': 1.078890790156374e-05, 'epochs': 219, 'loss': 'mae', 'optimizer': 'adam', 'graph_mode': 'cutoff', 'cutoff': 0.7685510934012001, 'grm_norm': 'cosine_then_gcn', 'self_loops': False, 'use_snp_selection': True, 'num_snps': 40579}. Best is trial 116 with value: 0.29969653756334846.
[I 2025-12-08 18:59:28,072] Trial 148 finished with value: 0.279352235976486 and parameters: {'model_type': 'gcn', 'hidden_dims': '[512, 128]', 'dropout': 0.5714792866270231, 'batch_norm': True, 'lr': 2.846521702548528e-05, 'weight_decay': 4.6909294408209345e-06, 'epochs': 225, 'loss': 'mse', 'optimizer': 'adam', 'graph_mode': 'cutoff', 'cutoff': 0.7366770391131011, 'grm_norm': 'cosine_then_gcn', 'self_loops': False, 'use_snp_selection': True, 'num_snps': 10056}. Best is trial 116 with value: 0.29969653756334846.
[I 2025-12-08 19:00:29,381] Trial 149 finished with value: 0.26539651226810346 and parameters: {'model_type': 'gcn', 'hidden_dims': '[512, 256]', 'dropout': 0.5994536088164327, 'batch_norm': True, 'lr': 1.5861989414769823e-05, 'weight_decay': 0.0008455995109385205, 'epochs': 235, 'loss': 'mae', 'optimizer': 'adam', 'graph_mode': 'knn', 'knn_k': 6, 'weighted_edges': True, 'symmetrize_mode': 'union', 'self_loops': False, 'use_snp_selection': False}. Best is trial 116 with value: 0.29969653756334846.
[I 2025-12-08 19:01:00,411] Trial 0 finished with value: 0.25014861114600156 and parameters: {'model_type': 'gcn', 'hidden_dims': '[128, 64]', 'dropout': 0.199031432379812, 'batch_norm': True, 'lr': 1.8408544111075823e-05, 'weight_decay': 5.5136510071208614e-05, 'epochs': 336, 'loss': 'mae', 'optimizer': 'adam', 'graph_mode': 'knn', 'knn_k': 8, 'weighted_edges': True, 'symmetrize_mode': 'mutual', 'self_loops': True, 'use_snp_selection': True, 'num_snps': 27173}. Best is trial 0 with value: 0.25014861114600156.
[I 2025-12-08 19:01:38,640] Trial 1 finished with value: 0.21947720154483058 and parameters: {'model_type': 'gcn', 'hidden_dims': '[256, 128, 64]', 'dropout': 0.5543244404043342, 'batch_norm': True, 'lr': 7.981787657617978e-05, 'weight_decay': 2.8571789869344834e-07, 'epochs': 297, 'loss': 'mae', 'optimizer': 'adam', 'graph_mode': 'cutoff', 'cutoff': 0.3392632777751686, 'grm_norm': 'gcn', 'self_loops': False, 'use_snp_selection': False}. Best is trial 0 with value: 0.25014861114600156.
[I 2025-12-08 19:02:36,698] Trial 2 finished with value: 0.22196249141192353 and parameters: {'model_type': 'gcn', 'hidden_dims': '[512, 64]', 'dropout': 0.32815227354739207, 'batch_norm': True, 'lr': 0.000619605044204259, 'weight_decay': 0.0004086269831625786, 'epochs': 206, 'loss': 'mse', 'optimizer': 'adam', 'graph_mode': 'knn', 'knn_k': 4, 'weighted_edges': True, 'symmetrize_mode': 'union', 'self_loops': True, 'use_snp_selection': True, 'num_snps': 53035}. Best is trial 0 with value: 0.25014861114600156.
[I 2025-12-08 19:03:04,082] Trial 3 finished with value: 0.21751283878227742 and parameters: {'model_type': 'gcn', 'hidden_dims': '[256, 128]', 'dropout': 0.23110783056597514, 'batch_norm': True, 'lr': 8.11311593386298e-05, 'weight_decay': 9.296158109581328e-07, 'epochs': 213, 'loss': 'mse', 'optimizer': 'adam', 'graph_mode': 'knn', 'knn_k': 10, 'weighted_edges': True, 'symmetrize_mode': 'mutual', 'self_loops': True, 'use_snp_selection': False}. Best is trial 0 with value: 0.25014861114600156.
[I 2025-12-08 19:03:18,838] Trial 4 finished with value: 0.29317730181956575 and parameters: {'model_type': 'gcn', 'hidden_dims': '[512, 256]', 'dropout': 0.2753281956415665, 'batch_norm': True, 'lr': 0.00034435188114839693, 'weight_decay': 4.9416012835950194e-05, 'epochs': 89, 'loss': 'mae', 'optimizer': 'adam', 'graph_mode': 'cutoff', 'cutoff': 0.820078967317394, 'grm_norm': 'none', 'self_loops': False, 'use_snp_selection': True, 'num_snps': 12674}. Best is trial 4 with value: 0.29317730181956575.
[I 2025-12-08 19:03:43,802] Trial 5 finished with value: 0.27246303148082046 and parameters: {'model_type': 'gcn', 'hidden_dims': '[128, 64]', 'dropout': 0.5611163934517731, 'batch_norm': True, 'lr': 0.0003984856210762587, 'weight_decay': 1.1466743517565185e-07, 'epochs': 344, 'loss': 'mae', 'optimizer': 'adam', 'graph_mode': 'cutoff', 'cutoff': 0.6089370799714728, 'grm_norm': 'gcn', 'self_loops': True, 'use_snp_selection': False}. Best is trial 4 with value: 0.29317730181956575.
