[I 2025-12-08 16:01:28,688] Trial 5 finished with value: 0.3288481775671841 and parameters: {'model_type': 'gcn', 'hidden_dims': '[128, 64]', 'dropout': 0.5611163934517731, 'batch_norm': True, 'lr': 0.0003984856210762587, 'weight_decay': 1.1466743517565185e-07, 'epochs': 344, 'loss': 'mae', 'optimizer': 'adam', 'graph_mode': 'cutoff', 'cutoff': 0.6089370799714728, 'grm_norm': 'gcn', 'self_loops': True, 'use_snp_selection': False}. Best is trial 4 with value: 0.3552760730340412.
[I 2025-12-08 16:01:50,945] Trial 6 finished with value: 0.31234674070345514 and parameters: {'model_type': 'gcn', 'hidden_dims': '[128, 64]', 'dropout': 0.31805912766941713, 'batch_norm': True, 'lr': 1.2361026034262557e-05, 'weight_decay': 6.492620232791903e-06, 'epochs': 271, 'loss': 'mse', 'optimizer': 'adam', 'graph_mode': 'cutoff', 'cutoff': 0.6193362582230448, 'grm_norm': 'cosine', 'self_loops': False, 'use_snp_selection': True, 'num_snps': 28594}. Best is trial 4 with value: 0.3552760730340412.
[I 2025-12-08 16:02:10,734] Trial 7 finished with value: 0.2843356046946517 and parameters: {'model_type': 'gcn', 'hidden_dims': '[512, 64]', 'dropout': 0.471337288649717, 'batch_norm': True, 'lr': 2.239693207292708e-05, 'weight_decay': 2.263166635514082e-06, 'epochs': 69, 'loss': 'mse', 'optimizer': 'adam', 'graph_mode': 'cutoff', 'cutoff': 0.4056820886426376, 'grm_norm': 'cosine', 'self_loops': False, 'use_snp_selection': False}. Best is trial 4 with value: 0.3552760730340412.
[I 2025-12-08 16:02:48,068] Trial 8 finished with value: 0.3545976941135624 and parameters: {'model_type': 'gcn', 'hidden_dims': '[512, 256]', 'dropout': 0.20659328268932406, 'batch_norm': False, 'lr': 8.93315124361372e-05, 'weight_decay': 0.00028987480727919035, 'epochs': 136, 'loss': 'mae', 'optimizer': 'adam', 'graph_mode': 'knn', 'knn_k': 3, 'weighted_edges': False, 'symmetrize_mode': 'union', 'self_loops': False, 'use_snp_selection': True, 'num_snps': 43128}. Best is trial 4 with value: 0.3552760730340412.
[I 2025-12-08 16:03:30,232] Trial 9 finished with value: -0.0018372855287621254 and parameters: {'model_type': 'gcn', 'hidden_dims': '[512, 256]', 'dropout': 0.2888209592870401, 'batch_norm': False, 'lr': 0.004734648143129892, 'weight_decay': 1.5879705591356368e-06, 'epochs': 163, 'loss': 'mse', 'optimizer': 'adam', 'graph_mode': 'cutoff', 'cutoff': 0.5984899797909019, 'grm_norm': 'cosine', 'self_loops': True, 'use_snp_selection': False}. Best is trial 4 with value: 0.3552760730340412.
[I 2025-12-08 16:03:39,189] Trial 10 finished with value: 0.3370410675637687 and parameters: {'model_type': 'gcn', 'hidden_dims': '[512, 128]', 'dropout': 0.11372025982957354, 'batch_norm': False, 'lr': 0.0023343012062770553, 'weight_decay': 4.14440562940608e-05, 'epochs': 41, 'loss': 'mae', 'optimizer': 'adam', 'graph_mode': 'cutoff', 'cutoff': 0.8740100033033124, 'grm_norm': 'none', 'self_loops': False, 'use_snp_selection': True, 'num_snps': 3859}. Best is trial 4 with value: 0.3552760730340412.
[I 2025-12-08 16:04:15,116] Trial 11 finished with value: 0.33584408076216954 and parameters: {'model_type': 'gcn', 'hidden_dims': '[512, 256]', 'dropout': 0.42220860806405436, 'batch_norm': False, 'lr': 0.00012587284186352953, 'weight_decay': 0.0006590033092812647, 'epochs': 114, 'loss': 'mae', 'optimizer': 'adam', 'graph_mode': 'knn', 'knn_k': 1, 'weighted_edges': False, 'symmetrize_mode': 'union', 'self_loops': False, 'use_snp_selection': True, 'num_snps': 47068}. Best is trial 4 with value: 0.3552760730340412.
[I 2025-12-08 16:04:29,601] Trial 12 finished with value: 0.35911425740418995 and parameters: {'model_type': 'gcn', 'hidden_dims': '[512, 256]', 'dropout': 0.14142767069304862, 'batch_norm': False, 'lr': 0.0011798598123878552, 'weight_decay': 9.414718277089941e-05, 'epochs': 124, 'loss': 'mae', 'optimizer': 'adam', 'graph_mode': 'knn', 'knn_k': 3, 'weighted_edges': False, 'symmetrize_mode': 'union', 'self_loops': False, 'use_snp_selection': True, 'num_snps': 8584}. Best is trial 12 with value: 0.35911425740418995.
[I 2025-12-08 16:04:42,000] Trial 13 finished with value: 0.3525230459614285 and parameters: {'model_type': 'gcn', 'hidden_dims': '[512, 256]', 'dropout': 0.13529665206282515, 'batch_norm': False, 'lr': 0.0013143362382724787, 'weight_decay': 5.2475435102613655e-05, 'epochs': 101, 'loss': 'mae', 'optimizer': 'adam', 'graph_mode': 'knn', 'knn_k': 6, 'weighted_edges': False, 'symmetrize_mode': 'union', 'self_loops': False, 'use_snp_selection': True, 'num_snps': 5870}. Best is trial 12 with value: 0.35911425740418995.
[I 2025-12-08 16:05:03,004] Trial 14 finished with value: 0.3568004928696925 and parameters: {'model_type': 'gcn', 'hidden_dims': '[512, 256]', 'dropout': 0.25632205209505254, 'batch_norm': False, 'lr': 0.0009612459132665168, 'weight_decay': 2.2203297076850073e-05, 'epochs': 165, 'loss': 'mae', 'optimizer': 'adam', 'graph_mode': 'cutoff', 'cutoff': 0.8944237199027842, 'grm_norm': 'none', 'self_loops': False, 'use_snp_selection': True, 'num_snps': 15654}. Best is trial 12 with value: 0.35911425740418995.
[I 2025-12-08 16:05:21,732] Trial 15 finished with value: 0.19619455613793657 and parameters: {'model_type': 'gcn', 'hidden_dims': '[256, 128, 64]', 'dropout': 0.16384595882983435, 'batch_norm': False, 'lr': 0.008017119310501081, 'weight_decay': 1.3728672854267767e-05, 'epochs': 169, 'loss': 'mae', 'optimizer': 'adam', 'graph_mode': 'knn', 'knn_k': 1, 'weighted_edges': False, 'symmetrize_mode': 'union', 'self_loops': False, 'use_snp_selection': True, 'num_snps': 18624}. Best is trial 12 with value: 0.35911425740418995.
[I 2025-12-08 16:05:50,768] Trial 16 finished with value: 0.3493098892481661 and parameters: {'model_type': 'gcn', 'hidden_dims': '[512, 128]', 'dropout': 0.39450008095533734, 'batch_norm': False, 'lr': 0.0011968396890835167, 'weight_decay': 0.00017680016161656075, 'epochs': 248, 'loss': 'mae', 'optimizer': 'adam', 'graph_mode': 'knn', 'knn_k': 5, 'weighted_edges': False, 'symmetrize_mode': 'mutual', 'self_loops': False, 'use_snp_selection': True, 'num_snps': 17422}. Best is trial 12 with value: 0.35911425740418995.
[I 2025-12-08 16:06:05,232] Trial 17 finished with value: 0.2802449645494367 and parameters: {'model_type': 'gcn', 'hidden_dims': '[256, 128]', 'dropout': 0.24559905997941672, 'batch_norm': False, 'lr': 0.0021551458957869097, 'weight_decay': 1.149794103944637e-05, 'epochs': 154, 'loss': 'mae', 'optimizer': 'adam', 'graph_mode': 'cutoff', 'cutoff': 0.7696559902509157, 'grm_norm': 'cosine_then_gcn', 'self_loops': False, 'use_snp_selection': True, 'num_snps': 12767}. Best is trial 12 with value: 0.35911425740418995.
[I 2025-12-08 16:06:34,128] Trial 18 finished with value: 0.35425272323040735 and parameters: {'model_type': 'gcn', 'hidden_dims': '[512, 256]', 'dropout': 0.10093752871871903, 'batch_norm': False, 'lr': 0.0008226361598612257, 'weight_decay': 0.00012100525095001081, 'epochs': 188, 'loss': 'mae', 'optimizer': 'adam', 'graph_mode': 'cutoff', 'cutoff': 0.45602322877564483, 'grm_norm': 'none', 'self_loops': False, 'use_snp_selection': True, 'num_snps': 22859}. Best is trial 12 with value: 0.35911425740418995.
[I 2025-12-08 16:07:09,184] Trial 19 finished with value: 0.3632965506724733 and parameters: {'model_type': 'gcn', 'hidden_dims': '[512, 256]', 'dropout': 0.15361641121251954, 'batch_norm': False, 'lr': 0.00020480202850549, 'weight_decay': 3.879015118339199e-06, 'epochs': 128, 'loss': 'mae', 'optimizer': 'adam', 'graph_mode': 'knn', 'knn_k': 7, 'weighted_edges': False, 'symmetrize_mode': 'union', 'self_loops': False, 'use_snp_selection': True, 'num_snps': 40267}. Best is trial 19 with value: 0.3632965506724733.
[I 2025-12-08 16:07:41,781] Trial 20 finished with value: 0.3520416423970171 and parameters: {'model_type': 'gcn', 'hidden_dims': '[512, 256]', 'dropout': 0.16197658307326462, 'batch_norm': False, 'lr': 0.00016296528815670506, 'weight_decay': 4.256637476124558e-06, 'epochs': 118, 'loss': 'mae', 'optimizer': 'adam', 'graph_mode': 'knn', 'knn_k': 7, 'weighted_edges': False, 'symmetrize_mode': 'union', 'self_loops': False, 'use_snp_selection': True, 'num_snps': 38975}. Best is trial 19 with value: 0.3632965506724733.
[I 2025-12-08 16:08:16,304] Trial 21 finished with value: 0.35846276255300114 and parameters: {'model_type': 'gcn', 'hidden_dims': '[512, 256]', 'dropout': 0.1855035322296888, 'batch_norm': False, 'lr': 0.00024069556743025288, 'weight_decay': 2.285815474806986e-05, 'epochs': 140, 'loss': 'mae', 'optimizer': 'adam', 'graph_mode': 'knn', 'knn_k': 3, 'weighted_edges': False, 'symmetrize_mode': 'union', 'self_loops': False, 'use_snp_selection': True, 'num_snps': 37861}. Best is trial 19 with value: 0.3632965506724733.
[I 2025-12-08 16:08:40,331] Trial 22 finished with value: 0.3471196839667477 and parameters: {'model_type': 'gcn', 'hidden_dims': '[512, 256]', 'dropout': 0.16691273628573366, 'batch_norm': False, 'lr': 0.0002229017992397451, 'weight_decay': 2.1108913256516535e-05, 'epochs': 72, 'loss': 'mae', 'optimizer': 'adam', 'graph_mode': 'knn', 'knn_k': 3, 'weighted_edges': False, 'symmetrize_mode': 'union', 'self_loops': False, 'use_snp_selection': True, 'num_snps': 36022}. Best is trial 19 with value: 0.3632965506724733.
[I 2025-12-08 16:09:27,571] Trial 23 finished with value: 0.35643922331788735 and parameters: {'model_type': 'gcn', 'hidden_dims': '[512, 256]', 'dropout': 0.18393124716087547, 'batch_norm': False, 'lr': 5.4006317020012425e-05, 'weight_decay': 4.126662077288799e-06, 'epochs': 132, 'loss': 'mae', 'optimizer': 'adam', 'graph_mode': 'knn', 'knn_k': 3, 'weighted_edges': False, 'symmetrize_mode': 'union', 'self_loops': False, 'use_snp_selection': True, 'num_snps': 59765}. Best is trial 19 with value: 0.3632965506724733.
[I 2025-12-08 16:10:02,102] Trial 24 finished with value: 0.35473676582299424 and parameters: {'model_type': 'gcn', 'hidden_dims': '[512, 256]', 'dropout': 0.1408895967603796, 'batch_norm': False, 'lr': 0.0003794815576817366, 'weight_decay': 0.0001081544749720337, 'epochs': 139, 'loss': 'mae', 'optimizer': 'adam', 'graph_mode': 'knn', 'knn_k': 8, 'weighted_edges': False, 'symmetrize_mode': 'union', 'self_loops': False, 'use_snp_selection': True, 'num_snps': 36527}. Best is trial 19 with value: 0.3632965506724733.
[I 2025-12-08 16:10:40,361] Trial 25 finished with value: 0.3429401133887323 and parameters: {'model_type': 'gcn', 'hidden_dims': '[256, 128, 64]', 'dropout': 0.21076125616293123, 'batch_norm': False, 'lr': 0.0001923003039028667, 'weight_decay': 5.027545204896379e-07, 'epochs': 225, 'loss': 'mae', 'optimizer': 'adam', 'graph_mode': 'knn', 'knn_k': 5, 'weighted_edges': False, 'symmetrize_mode': 'union', 'self_loops': False, 'use_snp_selection': True, 'num_snps': 47968}. Best is trial 19 with value: 0.3632965506724733.
[I 2025-12-08 16:11:28,902] Trial 26 finished with value: 0.3499291392522327 and parameters: {'model_type': 'gcn', 'hidden_dims': '[512, 128]', 'dropout': 0.11279574803979343, 'batch_norm': False, 'lr': 4.446294938689993e-05, 'weight_decay': 2.242327501127954e-05, 'epochs': 188, 'loss': 'mse', 'optimizer': 'adam', 'graph_mode': 'knn', 'knn_k': 2, 'weighted_edges': False, 'symmetrize_mode': 'union', 'self_loops': True, 'use_snp_selection': False}. Best is trial 19 with value: 0.3632965506724733.
[I 2025-12-08 16:11:47,682] Trial 27 finished with value: 0.08760636239593267 and parameters: {'model_type': 'gcn', 'hidden_dims': '[512, 64]', 'dropout': 0.3769054319060063, 'batch_norm': False, 'lr': 0.0005329062012763497, 'weight_decay': 7.688937901293283e-06, 'epochs': 44, 'loss': 'mae', 'optimizer': 'adam', 'graph_mode': 'knn', 'knn_k': 6, 'weighted_edges': False, 'symmetrize_mode': 'union', 'self_loops': False, 'use_snp_selection': True, 'num_snps': 31383}. Best is trial 19 with value: 0.3632965506724733.
[I 2025-12-08 16:12:09,293] Trial 28 finished with value: 0.2508631802012852 and parameters: {'model_type': 'gcn', 'hidden_dims': '[256, 128]', 'dropout': 0.29459067122714744, 'batch_norm': False, 'lr': 0.0022745455109933715, 'weight_decay': 2.8328917419081633e-06, 'epochs': 86, 'loss': 'mae', 'optimizer': 'adam', 'graph_mode': 'knn', 'knn_k': 4, 'weighted_edges': True, 'symmetrize_mode': 'mutual', 'self_loops': False, 'use_snp_selection': True, 'num_snps': 41147}. Best is trial 19 with value: 0.3632965506724733.
[I 2025-12-08 16:12:26,787] Trial 29 finished with value: 0.31579128131616685 and parameters: {'model_type': 'gcn', 'hidden_dims': '[128, 64]', 'dropout': 0.20582759479642115, 'batch_norm': False, 'lr': 0.0002706535555612372, 'weight_decay': 9.347009550275257e-05, 'epochs': 109, 'loss': 'mae', 'optimizer': 'adam', 'graph_mode': 'knn', 'knn_k': 10, 'weighted_edges': False, 'symmetrize_mode': 'union', 'self_loops': True, 'use_snp_selection': True, 'num_snps': 32657}. Best is trial 19 with value: 0.3632965506724733.
[I 2025-12-08 16:12:54,223] Trial 30 finished with value: 0.36530669828242174 and parameters: {'model_type': 'gcn', 'hidden_dims': '[512, 256]', 'dropout': 0.14155819940293413, 'batch_norm': False, 'lr': 2.6645814066314104e-05, 'weight_decay': 3.294162008784943e-05, 'epochs': 148, 'loss': 'mae', 'optimizer': 'adam', 'graph_mode': 'knn', 'knn_k': 8, 'weighted_edges': False, 'symmetrize_mode': 'union', 'self_loops': False, 'use_snp_selection': True, 'num_snps': 24255}. Best is trial 30 with value: 0.36530669828242174.
[I 2025-12-08 16:13:22,086] Trial 31 finished with value: 0.3599574400724132 and parameters: {'model_type': 'gcn', 'hidden_dims': '[512, 256]', 'dropout': 0.18267626144463706, 'batch_norm': False, 'lr': 2.4058047782164234e-05, 'weight_decay': 3.1956315789895336e-05, 'epochs': 147, 'loss': 'mae', 'optimizer': 'adam', 'graph_mode': 'knn', 'knn_k': 8, 'weighted_edges': False, 'symmetrize_mode': 'union', 'self_loops': False, 'use_snp_selection': True, 'num_snps': 25262}. Best is trial 30 with value: 0.36530669828242174.
[I 2025-12-08 16:13:51,779] Trial 32 finished with value: 0.36449246714474354 and parameters: {'model_type': 'gcn', 'hidden_dims': '[512, 256]', 'dropout': 0.1344568991799801, 'batch_norm': False, 'lr': 2.527779426627045e-05, 'weight_decay': 3.6261422764609836e-05, 'epochs': 178, 'loss': 'mae', 'optimizer': 'adam', 'graph_mode': 'knn', 'knn_k': 8, 'weighted_edges': False, 'symmetrize_mode': 'union', 'self_loops': False, 'use_snp_selection': True, 'num_snps': 23411}. Best is trial 30 with value: 0.36530669828242174.
[I 2025-12-08 16:14:34,587] Trial 33 finished with value: 0.362157527522506 and parameters: {'model_type': 'gcn', 'hidden_dims': '[512, 256]', 'dropout': 0.10008392603236074, 'batch_norm': False, 'lr': 2.7263851329197506e-05, 'weight_decay': 3.3427161228998235e-05, 'epochs': 313, 'loss': 'mae', 'optimizer': 'adam', 'graph_mode': 'knn', 'knn_k': 8, 'weighted_edges': False, 'symmetrize_mode': 'union', 'self_loops': False, 'use_snp_selection': True, 'num_snps': 23068}. Best is trial 30 with value: 0.36530669828242174.
[I 2025-12-08 16:15:05,659] Trial 34 finished with value: 0.34123472785912473 and parameters: {'model_type': 'gcn', 'hidden_dims': '[256, 128, 64]', 'dropout': 0.13212959324966012, 'batch_norm': False, 'lr': 3.7645262940497523e-05, 'weight_decay': 1.1964230728447657e-05, 'epochs': 232, 'loss': 'mae', 'optimizer': 'adam', 'graph_mode': 'knn', 'knn_k': 9, 'weighted_edges': False, 'symmetrize_mode': 'union', 'self_loops': False, 'use_snp_selection': False}. Best is trial 30 with value: 0.36530669828242174.
[I 2025-12-08 16:15:47,130] Trial 35 finished with value: 0.33396616218806546 and parameters: {'model_type': 'gcn', 'hidden_dims': '[512, 256]', 'dropout': 0.22592720512277245, 'batch_norm': True, 'lr': 1.2629984569150286e-05, 'weight_decay': 8.369688834988889e-07, 'epochs': 319, 'loss': 'mse', 'optimizer': 'adam', 'graph_mode': 'knn', 'knn_k': 7, 'weighted_edges': False, 'symmetrize_mode': 'union', 'self_loops': True, 'use_snp_selection': True, 'num_snps': 21728}. Best is trial 30 with value: 0.36530669828242174.
[I 2025-12-08 16:16:24,827] Trial 36 finished with value: 0.36377094445493297 and parameters: {'model_type': 'gcn', 'hidden_dims': '[512, 64]', 'dropout': 0.5304462730639691, 'batch_norm': False, 'lr': 3.4982293856016755e-05, 'weight_decay': 5.532089705092464e-06, 'epochs': 288, 'loss': 'mae', 'optimizer': 'adam', 'graph_mode': 'knn', 'knn_k': 9, 'weighted_edges': False, 'symmetrize_mode': 'union', 'self_loops': False, 'use_snp_selection': True, 'num_snps': 20987}. Best is trial 30 with value: 0.36530669828242174.
[I 2025-12-08 16:17:32,735] Trial 37 finished with value: 0.2745661481491998 and parameters: {'model_type': 'gcn', 'hidden_dims': '[512, 64]', 'dropout': 0.5264045353556555, 'batch_norm': True, 'lr': 5.83907853611949e-05, 'weight_decay': 6.098254583124953e-06, 'epochs': 265, 'loss': 'mae', 'optimizer': 'adam', 'graph_mode': 'knn', 'knn_k': 9, 'weighted_edges': True, 'symmetrize_mode': 'mutual', 'self_loops': False, 'use_snp_selection': False}. Best is trial 30 with value: 0.36530669828242174.
[I 2025-12-08 16:18:07,254] Trial 38 finished with value: 0.3535380739127953 and parameters: {'model_type': 'gcn', 'hidden_dims': '[512, 64]', 'dropout': 0.47185557431835906, 'batch_norm': False, 'lr': 1.3985590346214371e-05, 'weight_decay': 1.4921678228960004e-06, 'epochs': 196, 'loss': 'mse', 'optimizer': 'adam', 'graph_mode': 'knn', 'knn_k': 9, 'weighted_edges': False, 'symmetrize_mode': 'union', 'self_loops': True, 'use_snp_selection': True, 'num_snps': 27647}. Best is trial 30 with value: 0.36530669828242174.
[I 2025-12-08 16:18:48,901] Trial 39 finished with value: 0.3510708540094906 and parameters: {'model_type': 'gcn', 'hidden_dims': '[512, 64]', 'dropout': 0.5802467286651363, 'batch_norm': True, 'lr': 1.7871488834859505e-05, 'weight_decay': 2.0699097707025977e-07, 'epochs': 209, 'loss': 'mae', 'optimizer': 'adam', 'graph_mode': 'knn', 'knn_k': 9, 'weighted_edges': False, 'symmetrize_mode': 'union', 'self_loops': False, 'use_snp_selection': True, 'num_snps': 33281}. Best is trial 30 with value: 0.36530669828242174.
[I 2025-12-08 16:19:10,353] Trial 40 finished with value: 0.3566529527507454 and parameters: {'model_type': 'gcn', 'hidden_dims': '[128, 64]', 'dropout': 0.3268556972383166, 'batch_norm': False, 'lr': 3.251427668932872e-05, 'weight_decay': 4.164144083140998e-06, 'epochs': 288, 'loss': 'mse', 'optimizer': 'adam', 'graph_mode': 'knn', 'knn_k': 7, 'weighted_edges': True, 'symmetrize_mode': 'mutual', 'self_loops': False, 'use_snp_selection': False}. Best is trial 30 with value: 0.36530669828242174.
[I 2025-12-08 16:19:53,731] Trial 41 finished with value: 0.3603862551220752 and parameters: {'model_type': 'gcn', 'hidden_dims': '[512, 64]', 'dropout': 0.10025105113378989, 'batch_norm': False, 'lr': 2.9432678728040573e-05, 'weight_decay': 6.747196591846731e-05, 'epochs': 326, 'loss': 'mae', 'optimizer': 'adam', 'graph_mode': 'knn', 'knn_k': 8, 'weighted_edges': False, 'symmetrize_mode': 'union', 'self_loops': False, 'use_snp_selection': True, 'num_snps': 23108}. Best is trial 30 with value: 0.36530669828242174.
[I 2025-12-08 16:20:20,170] Trial 42 finished with value: 0.35420282225372063 and parameters: {'model_type': 'gcn', 'hidden_dims': '[256, 128]', 'dropout': 0.47514863871935115, 'batch_norm': False, 'lr': 8.136985312521004e-05, 'weight_decay': 3.2241629063684686e-05, 'epochs': 309, 'loss': 'mae', 'optimizer': 'adam', 'graph_mode': 'knn', 'knn_k': 8, 'weighted_edges': False, 'symmetrize_mode': 'union', 'self_loops': False, 'use_snp_selection': True, 'num_snps': 20616}. Best is trial 30 with value: 0.36530669828242174.
[I 2025-12-08 16:21:11,545] Trial 43 finished with value: 0.3637984528343011 and parameters: {'model_type': 'gcn', 'hidden_dims': '[512, 256]', 'dropout': 0.15132230283658854, 'batch_norm': False, 'lr': 2.066594524714111e-05, 'weight_decay': 0.0002193798281169574, 'epochs': 347, 'loss': 'mae', 'optimizer': 'adam', 'graph_mode': 'knn', 'knn_k': 7, 'weighted_edges': False, 'symmetrize_mode': 'union', 'self_loops': False, 'use_snp_selection': True, 'num_snps': 27553}. Best is trial 30 with value: 0.36530669828242174.
[I 2025-12-08 16:22:04,210] Trial 44 finished with value: 0.3695676652276214 and parameters: {'model_type': 'gcn', 'hidden_dims': '[512, 256]', 'dropout': 0.4269685625913169, 'batch_norm': False, 'lr': 1.0108739038833523e-05, 'weight_decay': 0.00029552015783927655, 'epochs': 341, 'loss': 'mae', 'optimizer': 'adam', 'graph_mode': 'knn', 'knn_k': 7, 'weighted_edges': True, 'symmetrize_mode': 'union', 'self_loops': False, 'use_snp_selection': True, 'num_snps': 28864}. Best is trial 44 with value: 0.3695676652276214.
[I 2025-12-08 16:22:54,129] Trial 45 finished with value: 0.34548394027228374 and parameters: {'model_type': 'gcn', 'hidden_dims': '[512, 64]', 'dropout': 0.5205594442379905, 'batch_norm': True, 'lr': 1.6892875018043916e-05, 'weight_decay': 0.0009969922184144876, 'epochs': 340, 'loss': 'mae', 'optimizer': 'adam', 'graph_mode': 'knn', 'knn_k': 6, 'weighted_edges': True, 'symmetrize_mode': 'union', 'self_loops': False, 'use_snp_selection': True, 'num_snps': 27434}. Best is trial 44 with value: 0.3695676652276214.
[I 2025-12-08 16:23:42,275] Trial 46 finished with value: 0.35105295589164826 and parameters: {'model_type': 'gcn', 'hidden_dims': '[512, 256]', 'dropout': 0.43716821025399255, 'batch_norm': False, 'lr': 1.9762936398243862e-05, 'weight_decay': 0.0003087564488998166, 'epochs': 294, 'loss': 'mae', 'optimizer': 'adam', 'graph_mode': 'knn', 'knn_k': 10, 'weighted_edges': True, 'symmetrize_mode': 'union', 'self_loops': True, 'use_snp_selection': True, 'num_snps': 28641}. Best is trial 44 with value: 0.3695676652276214.
