[I 2025-12-08 10:45:18,842] Trial 87 finished with value: 0.3049394431112722 and parameters: {'model_type': 'gcn', 'hidden_dims': '[256, 128]', 'dropout': 0.36645933784070317, 'batch_norm': True, 'lr': 0.002538135078045469, 'weight_decay': 3.6736996549845906e-07, 'epochs': 84, 'loss': 'mae', 'optimizer': 'adam', 'graph_mode': 'cutoff', 'cutoff': 0.7559574332960122, 'grm_norm': 'gcn', 'self_loops': False, 'use_snp_selection': False}. Best is trial 56 with value: 0.3094738320869709.
[I 2025-12-08 10:45:27,301] Trial 88 finished with value: 0.307499226029098 and parameters: {'model_type': 'gcn', 'hidden_dims': '[128, 64]', 'dropout': 0.33048035411302057, 'batch_norm': True, 'lr': 0.0018169626955128345, 'weight_decay': 2.7610490187030034e-07, 'epochs': 94, 'loss': 'mae', 'optimizer': 'adam', 'graph_mode': 'cutoff', 'cutoff': 0.7829931184568639, 'grm_norm': 'gcn', 'self_loops': False, 'use_snp_selection': False}. Best is trial 56 with value: 0.3094738320869709.
[I 2025-12-08 10:45:35,535] Trial 89 finished with value: 0.305015450999094 and parameters: {'model_type': 'gcn', 'hidden_dims': '[128, 64]', 'dropout': 0.3329116494482477, 'batch_norm': True, 'lr': 0.0033853230719420135, 'weight_decay': 2.528812545451454e-07, 'epochs': 92, 'loss': 'mae', 'optimizer': 'adam', 'graph_mode': 'cutoff', 'cutoff': 0.7807175738494574, 'grm_norm': 'none', 'self_loops': False, 'use_snp_selection': False}. Best is trial 56 with value: 0.3094738320869709.
[I 2025-12-08 10:45:56,739] Trial 90 finished with value: 0.2801892849979696 and parameters: {'model_type': 'gcn', 'hidden_dims': '[128, 64]', 'dropout': 0.3224921235266627, 'batch_norm': True, 'lr': 0.001722412132220694, 'weight_decay': 2.9256982705173454e-07, 'epochs': 139, 'loss': 'mae', 'optimizer': 'adam', 'graph_mode': 'knn', 'knn_k': 9, 'weighted_edges': True, 'symmetrize_mode': 'union', 'self_loops': False, 'use_snp_selection': True, 'num_snps': 38717}. Best is trial 56 with value: 0.3094738320869709.
[I 2025-12-08 10:46:03,890] Trial 91 finished with value: 0.30405455038517976 and parameters: {'model_type': 'gcn', 'hidden_dims': '[128, 64]', 'dropout': 0.29854143087408447, 'batch_norm': True, 'lr': 0.003142434705825987, 'weight_decay': 4.593666767529891e-07, 'epochs': 70, 'loss': 'mae', 'optimizer': 'adam', 'graph_mode': 'cutoff', 'cutoff': 0.8313834779104188, 'grm_norm': 'gcn', 'self_loops': False, 'use_snp_selection': False}. Best is trial 56 with value: 0.3094738320869709.
[I 2025-12-08 10:46:13,228] Trial 92 finished with value: 0.30923191917084325 and parameters: {'model_type': 'gcn', 'hidden_dims': '[256, 128]', 'dropout': 0.39696051725642245, 'batch_norm': True, 'lr': 0.0026252682788058205, 'weight_decay': 3.4730371583473485e-07, 'epochs': 59, 'loss': 'mae', 'optimizer': 'adam', 'graph_mode': 'cutoff', 'cutoff': 0.7967912343865884, 'grm_norm': 'gcn', 'self_loops': False, 'use_snp_selection': False}. Best is trial 56 with value: 0.3094738320869709.
[I 2025-12-08 10:46:19,221] Trial 93 finished with value: 0.3065353047508824 and parameters: {'model_type': 'gcn', 'hidden_dims': '[128, 64]', 'dropout': 0.4049768787349451, 'batch_norm': True, 'lr': 0.004157713245748684, 'weight_decay': 1.4813474672912125e-06, 'epochs': 59, 'loss': 'mae', 'optimizer': 'adam', 'graph_mode': 'cutoff', 'cutoff': 0.7865131387749119, 'grm_norm': 'gcn', 'self_loops': False, 'use_snp_selection': False}. Best is trial 56 with value: 0.3094738320869709.
[I 2025-12-08 10:46:33,779] Trial 94 finished with value: 0.3063506305118526 and parameters: {'model_type': 'gcn', 'hidden_dims': '[512, 256]', 'dropout': 0.3375561239440014, 'batch_norm': True, 'lr': 0.005206327092902295, 'weight_decay': 1.761944038812348e-07, 'epochs': 47, 'loss': 'mae', 'optimizer': 'adam', 'graph_mode': 'cutoff', 'cutoff': 0.7701070113059298, 'grm_norm': 'gcn', 'self_loops': False, 'use_snp_selection': False}. Best is trial 56 with value: 0.3094738320869709.
[I 2025-12-08 10:46:57,771] Trial 95 finished with value: 0.22668278900743713 and parameters: {'model_type': 'gcn', 'hidden_dims': '[256, 128]', 'dropout': 0.40120513218898357, 'batch_norm': True, 'lr': 0.0018806378425388457, 'weight_decay': 2.2181702610654853e-07, 'epochs': 185, 'loss': 'mae', 'optimizer': 'adam', 'graph_mode': 'cutoff', 'cutoff': 0.4758435291926655, 'grm_norm': 'gcn', 'self_loops': False, 'use_snp_selection': False}. Best is trial 56 with value: 0.3094738320869709.
[I 2025-12-08 10:47:09,261] Trial 96 finished with value: 0.30362213497943474 and parameters: {'model_type': 'gcn', 'hidden_dims': '[256, 128]', 'dropout': 0.35417611411757816, 'batch_norm': True, 'lr': 0.0013848853630644728, 'weight_decay': 3.127875833566584e-07, 'epochs': 79, 'loss': 'mse', 'optimizer': 'adam', 'graph_mode': 'cutoff', 'cutoff': 0.8010681688312137, 'grm_norm': 'gcn', 'self_loops': False, 'use_snp_selection': False}. Best is trial 56 with value: 0.3094738320869709.
[I 2025-12-08 10:47:25,176] Trial 97 finished with value: 0.3057363954854718 and parameters: {'model_type': 'gcn', 'hidden_dims': '[256, 128, 64]', 'dropout': 0.44291181589512346, 'batch_norm': True, 'lr': 0.0026886558779186127, 'weight_decay': 5.285615003452214e-07, 'epochs': 112, 'loss': 'mae', 'optimizer': 'adam', 'graph_mode': 'cutoff', 'cutoff': 0.7517920556941026, 'grm_norm': 'gcn', 'self_loops': False, 'use_snp_selection': False}. Best is trial 56 with value: 0.3094738320869709.
[I 2025-12-08 10:47:34,056] Trial 98 finished with value: 0.059937836139182785 and parameters: {'model_type': 'gcn', 'hidden_dims': '[128, 64]', 'dropout': 0.282405065140668, 'batch_norm': False, 'lr': 0.0032700724437069494, 'weight_decay': 1.8263524698165834e-06, 'epochs': 100, 'loss': 'mae', 'optimizer': 'adam', 'graph_mode': 'cutoff', 'cutoff': 0.8486899089348523, 'grm_norm': 'gcn', 'self_loops': True, 'use_snp_selection': False}. Best is trial 56 with value: 0.3094738320869709.
[I 2025-12-08 10:47:47,854] Trial 99 finished with value: 0.30028878071241105 and parameters: {'model_type': 'gcn', 'hidden_dims': '[256, 128, 64]', 'dropout': 0.35773609214791163, 'batch_norm': True, 'lr': 0.006399669171957335, 'weight_decay': 2.749165203455838e-06, 'epochs': 91, 'loss': 'mae', 'optimizer': 'adam', 'graph_mode': 'cutoff', 'cutoff': 0.8825891597163453, 'grm_norm': 'cosine_then_gcn', 'self_loops': False, 'use_snp_selection': False}. Best is trial 56 with value: 0.3094738320869709.
[I 2025-12-08 10:47:56,847] Trial 100 finished with value: 0.3038003137753352 and parameters: {'model_type': 'gcn', 'hidden_dims': '[256, 128]', 'dropout': 0.3179355649987818, 'batch_norm': True, 'lr': 0.00813825790635649, 'weight_decay': 1.2376004393729505e-06, 'epochs': 57, 'loss': 'mae', 'optimizer': 'adam', 'graph_mode': 'cutoff', 'cutoff': 0.8273162888409064, 'grm_norm': 'gcn', 'self_loops': False, 'use_snp_selection': False}. Best is trial 56 with value: 0.3094738320869709.
[I 2025-12-08 10:48:03,366] Trial 101 finished with value: 0.3072824715127016 and parameters: {'model_type': 'gcn', 'hidden_dims': '[128, 64]', 'dropout': 0.3947070295018384, 'batch_norm': True, 'lr': 0.004260004413952118, 'weight_decay': 1.5599553523547062e-06, 'epochs': 66, 'loss': 'mae', 'optimizer': 'adam', 'graph_mode': 'cutoff', 'cutoff': 0.7804990591210357, 'grm_norm': 'gcn', 'self_loops': False, 'use_snp_selection': False}. Best is trial 56 with value: 0.3094738320869709.
[I 2025-12-08 10:48:09,597] Trial 102 finished with value: 0.29655653324052367 and parameters: {'model_type': 'gcn', 'hidden_dims': '[128, 64]', 'dropout': 0.39520713697750487, 'batch_norm': True, 'lr': 0.000244887939937474, 'weight_decay': 5.469114513658856e-06, 'epochs': 63, 'loss': 'mae', 'optimizer': 'adam', 'graph_mode': 'cutoff', 'cutoff': 0.7829731493370534, 'grm_norm': 'gcn', 'self_loops': False, 'use_snp_selection': False}. Best is trial 56 with value: 0.3094738320869709.
[I 2025-12-08 10:48:15,042] Trial 103 finished with value: 0.3019746503264389 and parameters: {'model_type': 'gcn', 'hidden_dims': '[128, 64]', 'dropout': 0.37364958588066854, 'batch_norm': True, 'lr': 0.004018878958372787, 'weight_decay': 7.951954585654909e-07, 'epochs': 50, 'loss': 'mae', 'optimizer': 'adam', 'graph_mode': 'cutoff', 'cutoff': 0.7059436542909168, 'grm_norm': 'gcn', 'self_loops': False, 'use_snp_selection': False}. Best is trial 56 with value: 0.3094738320869709.
[I 2025-12-08 10:48:21,870] Trial 104 finished with value: 0.3014096522690414 and parameters: {'model_type': 'gcn', 'hidden_dims': '[128, 64]', 'dropout': 0.34358480064313207, 'batch_norm': True, 'lr': 0.004785022504932509, 'weight_decay': 2.5614259430622454e-07, 'epochs': 66, 'loss': 'mae', 'optimizer': 'adam', 'graph_mode': 'cutoff', 'cutoff': 0.7457076941029244, 'grm_norm': 'cosine_then_gcn', 'self_loops': False, 'use_snp_selection': False}. Best is trial 56 with value: 0.3094738320869709.
[I 2025-12-08 10:48:33,325] Trial 105 finished with value: 0.28461844196927755 and parameters: {'model_type': 'gcn', 'hidden_dims': '[256, 128, 64]', 'dropout': 0.38538678907625573, 'batch_norm': True, 'lr': 0.005472290963319806, 'weight_decay': 0.0004155024161902615, 'epochs': 75, 'loss': 'mae', 'optimizer': 'adam', 'graph_mode': 'cutoff', 'cutoff': 0.7875901844525199, 'grm_norm': 'none', 'self_loops': False, 'use_snp_selection': False}. Best is trial 56 with value: 0.3094738320869709.
[I 2025-12-08 10:48:41,419] Trial 106 finished with value: 0.298934103373827 and parameters: {'model_type': 'gcn', 'hidden_dims': '[256, 128, 64]', 'dropout': 0.522644557808963, 'batch_norm': True, 'lr': 0.0036631547105288966, 'weight_decay': 1.634949334449152e-07, 'epochs': 47, 'loss': 'mae', 'optimizer': 'adam', 'graph_mode': 'cutoff', 'cutoff': 0.6759815965211493, 'grm_norm': 'gcn', 'self_loops': False, 'use_snp_selection': False}. Best is trial 56 with value: 0.3094738320869709.
[I 2025-12-08 10:48:58,076] Trial 107 finished with value: 0.3071920076084797 and parameters: {'model_type': 'gcn', 'hidden_dims': '[512, 256]', 'dropout': 0.5671616527826475, 'batch_norm': True, 'lr': 0.002409607699858144, 'weight_decay': 4.486615110889664e-07, 'epochs': 56, 'loss': 'mae', 'optimizer': 'adam', 'graph_mode': 'cutoff', 'cutoff': 0.7974301127518242, 'grm_norm': 'gcn', 'self_loops': False, 'use_snp_selection': False}. Best is trial 56 with value: 0.3094738320869709.
[I 2025-12-08 10:49:14,986] Trial 108 finished with value: 0.3087825400427863 and parameters: {'model_type': 'gcn', 'hidden_dims': '[512, 256]', 'dropout': 0.5676550250918291, 'batch_norm': True, 'lr': 0.0030954796369380235, 'weight_decay': 4.3669829104392425e-07, 'epochs': 56, 'loss': 'mae', 'optimizer': 'adam', 'graph_mode': 'cutoff', 'cutoff': 0.7643695943039102, 'grm_norm': 'cosine_then_gcn', 'self_loops': False, 'use_snp_selection': False}. Best is trial 56 with value: 0.3094738320869709.
[I 2025-12-08 10:49:42,098] Trial 109 finished with value: 0.3097883496378 and parameters: {'model_type': 'gcn', 'hidden_dims': '[512, 256]', 'dropout': 0.4150764496040188, 'batch_norm': True, 'lr': 0.003072431884842228, 'weight_decay': 1.1432928293129328e-06, 'epochs': 56, 'loss': 'mae', 'optimizer': 'adam', 'graph_mode': 'cutoff', 'cutoff': 0.7652543569567427, 'grm_norm': 'cosine_then_gcn', 'self_loops': False, 'use_snp_selection': True, 'num_snps': 49273}. Best is trial 109 with value: 0.3097883496378.
[I 2025-12-08 10:50:06,782] Trial 110 finished with value: 0.30804200474924404 and parameters: {'model_type': 'gcn', 'hidden_dims': '[512, 256]', 'dropout': 0.5639872935566492, 'batch_norm': True, 'lr': 0.003121590910352095, 'weight_decay': 8.941254249001555e-07, 'epochs': 45, 'loss': 'mae', 'optimizer': 'adam', 'graph_mode': 'cutoff', 'cutoff': 0.8367208318003977, 'grm_norm': 'cosine_then_gcn', 'self_loops': False, 'use_snp_selection': True, 'num_snps': 47846}. Best is trial 109 with value: 0.3097883496378.
[I 2025-12-08 10:50:34,674] Trial 111 finished with value: 0.3085369154446549 and parameters: {'model_type': 'gcn', 'hidden_dims': '[512, 256]', 'dropout': 0.4191437585273605, 'batch_norm': True, 'lr': 0.002069877532015972, 'weight_decay': 1.1568703703882843e-06, 'epochs': 56, 'loss': 'mae', 'optimizer': 'adam', 'graph_mode': 'cutoff', 'cutoff': 0.8090534507938412, 'grm_norm': 'cosine_then_gcn', 'self_loops': False, 'use_snp_selection': True, 'num_snps': 51036}. Best is trial 109 with value: 0.3097883496378.
[I 2025-12-08 10:51:00,532] Trial 112 finished with value: 0.3074956918783523 and parameters: {'model_type': 'gcn', 'hidden_dims': '[512, 256]', 'dropout': 0.41407289833325406, 'batch_norm': True, 'lr': 0.0020062240463444713, 'weight_decay': 1.2138313495662166e-06, 'epochs': 48, 'loss': 'mae', 'optimizer': 'adam', 'graph_mode': 'cutoff', 'cutoff': 0.8414011490695218, 'grm_norm': 'cosine_then_gcn', 'self_loops': False, 'use_snp_selection': True, 'num_snps': 48924}. Best is trial 109 with value: 0.3097883496378.
[I 2025-12-08 10:51:26,123] Trial 113 finished with value: 0.3062473087739739 and parameters: {'model_type': 'gcn', 'hidden_dims': '[512, 256]', 'dropout': 0.43210484020261986, 'batch_norm': True, 'lr': 0.0020557219940982785, 'weight_decay': 1.2444239223965004e-06, 'epochs': 47, 'loss': 'mae', 'optimizer': 'adam', 'graph_mode': 'cutoff', 'cutoff': 0.8434149352034768, 'grm_norm': 'cosine_then_gcn', 'self_loops': False, 'use_snp_selection': True, 'num_snps': 50031}. Best is trial 109 with value: 0.3097883496378.
[I 2025-12-08 10:51:50,642] Trial 114 finished with value: 0.3090868385209248 and parameters: {'model_type': 'gcn', 'hidden_dims': '[512, 256]', 'dropout': 0.5490521006057757, 'batch_norm': True, 'lr': 0.0016550100546128914, 'weight_decay': 9.134520984292619e-07, 'epochs': 40, 'loss': 'mae', 'optimizer': 'adam', 'graph_mode': 'cutoff', 'cutoff': 0.8209867800357489, 'grm_norm': 'cosine_then_gcn', 'self_loops': False, 'use_snp_selection': True, 'num_snps': 49417}. Best is trial 109 with value: 0.3097883496378.
[I 2025-12-08 10:52:15,436] Trial 115 finished with value: 0.30509012897379906 and parameters: {'model_type': 'gcn', 'hidden_dims': '[512, 256]', 'dropout': 0.42103107106324034, 'batch_norm': True, 'lr': 0.0012332498764435406, 'weight_decay': 9.739449311905042e-07, 'epochs': 45, 'loss': 'mae', 'optimizer': 'adam', 'graph_mode': 'cutoff', 'cutoff': 0.8230824136777025, 'grm_norm': 'cosine_then_gcn', 'self_loops': False, 'use_snp_selection': True, 'num_snps': 47809}. Best is trial 109 with value: 0.3097883496378.
[I 2025-12-08 10:52:39,846] Trial 116 finished with value: 0.2454813349952397 and parameters: {'model_type': 'gcn', 'hidden_dims': '[512, 256]', 'dropout': 0.5510922426602543, 'batch_norm': True, 'lr': 0.0015859746627906208, 'weight_decay': 7.750570406246829e-07, 'epochs': 40, 'loss': 'mae', 'optimizer': 'adam', 'graph_mode': 'knn', 'knn_k': 2, 'weighted_edges': False, 'symmetrize_mode': 'mutual', 'self_loops': False, 'use_snp_selection': True, 'num_snps': 49354}. Best is trial 109 with value: 0.3097883496378.
[I 2025-12-08 10:53:09,287] Trial 117 finished with value: 0.3029893800194504 and parameters: {'model_type': 'gcn', 'hidden_dims': '[512, 256]', 'dropout': 0.5761803009816067, 'batch_norm': True, 'lr': 0.0017588158401801084, 'weight_decay': 1.110806077004536e-06, 'epochs': 53, 'loss': 'mse', 'optimizer': 'adam', 'graph_mode': 'cutoff', 'cutoff': 0.8129338138901042, 'grm_norm': 'cosine_then_gcn', 'self_loops': False, 'use_snp_selection': True, 'num_snps': 56168}. Best is trial 109 with value: 0.3097883496378.
[I 2025-12-08 10:53:31,393] Trial 118 finished with value: 0.0 and parameters: {'model_type': 'gcn', 'hidden_dims': '[512, 256]', 'dropout': 0.4646934939485061, 'batch_norm': False, 'lr': 0.0029772248342933233, 'weight_decay': 9.072337992120948e-07, 'epochs': 46, 'loss': 'mae', 'optimizer': 'adam', 'graph_mode': 'cutoff', 'cutoff': 0.8387041722881242, 'grm_norm': 'cosine_then_gcn', 'self_loops': True, 'use_snp_selection': True, 'num_snps': 39589}. Best is trial 109 with value: 0.3097883496378.
[I 2025-12-08 10:53:57,013] Trial 119 finished with value: 0.30781875973137895 and parameters: {'model_type': 'gcn', 'hidden_dims': '[512, 256]', 'dropout': 0.5900714954349406, 'batch_norm': True, 'lr': 0.0014892460855436987, 'weight_decay': 5.301915139270303e-07, 'epochs': 56, 'loss': 'mae', 'optimizer': 'adam', 'graph_mode': 'cutoff', 'cutoff': 0.7655971316489985, 'grm_norm': 'cosine_then_gcn', 'self_loops': False, 'use_snp_selection': True, 'num_snps': 44904}. Best is trial 109 with value: 0.3097883496378.
[I 2025-12-08 10:54:23,073] Trial 120 finished with value: 0.30995014290531187 and parameters: {'model_type': 'gcn', 'hidden_dims': '[512, 256]', 'dropout': 0.5893838113927664, 'batch_norm': True, 'lr': 0.001469328432746009, 'weight_decay': 5.978490111955094e-07, 'epochs': 59, 'loss': 'mae', 'optimizer': 'adam', 'graph_mode': 'cutoff', 'cutoff': 0.7602466554445483, 'grm_norm': 'cosine_then_gcn', 'self_loops': False, 'use_snp_selection': True, 'num_snps': 45275}. Best is trial 120 with value: 0.30995014290531187.
[I 2025-12-08 10:54:49,697] Trial 121 finished with value: 0.31335727417865833 and parameters: {'model_type': 'gcn', 'hidden_dims': '[512, 256]', 'dropout': 0.5839930059741004, 'batch_norm': True, 'lr': 0.0012046840664219865, 'weight_decay': 6.039316271016291e-07, 'epochs': 57, 'loss': 'mae', 'optimizer': 'adam', 'graph_mode': 'cutoff', 'cutoff': 0.7642654875946018, 'grm_norm': 'cosine_then_gcn', 'self_loops': False, 'use_snp_selection': True, 'num_snps': 45467}. Best is trial 121 with value: 0.31335727417865833.
[I 2025-12-08 10:55:14,779] Trial 122 finished with value: 0.3098270218466948 and parameters: {'model_type': 'gcn', 'hidden_dims': '[512, 256]', 'dropout': 0.5899035748281689, 'batch_norm': True, 'lr': 0.0008593362410014066, 'weight_decay': 5.51235066233438e-07, 'epochs': 55, 'loss': 'mae', 'optimizer': 'adam', 'graph_mode': 'cutoff', 'cutoff': 0.7616483856499586, 'grm_norm': 'cosine_then_gcn', 'self_loops': False, 'use_snp_selection': True, 'num_snps': 44528}. Best is trial 121 with value: 0.31335727417865833.
[I 2025-12-08 10:55:40,282] Trial 123 finished with value: 0.30634494812673274 and parameters: {'model_type': 'gcn', 'hidden_dims': '[512, 256]', 'dropout': 0.5899024563306782, 'batch_norm': True, 'lr': 0.0011744162799418474, 'weight_decay': 5.551519145089403e-07, 'epochs': 56, 'loss': 'mae', 'optimizer': 'adam', 'graph_mode': 'cutoff', 'cutoff': 0.7631987600363728, 'grm_norm': 'cosine_then_gcn', 'self_loops': False, 'use_snp_selection': True, 'num_snps': 44026}. Best is trial 121 with value: 0.31335727417865833.
[I 2025-12-08 10:56:07,097] Trial 124 finished with value: 0.3058922065399835 and parameters: {'model_type': 'gcn', 'hidden_dims': '[512, 256]', 'dropout': 0.56040438809948, 'batch_norm': True, 'lr': 0.0009309793770105862, 'weight_decay': 7.599335683173296e-07, 'epochs': 59, 'loss': 'mae', 'optimizer': 'adam', 'graph_mode': 'cutoff', 'cutoff': 0.7261523683039064, 'grm_norm': 'cosine_then_gcn', 'self_loops': False, 'use_snp_selection': True, 'num_snps': 45831}. Best is trial 121 with value: 0.31335727417865833.
[I 2025-12-08 10:56:32,298] Trial 125 finished with value: 0.3094241108488899 and parameters: {'model_type': 'gcn', 'hidden_dims': '[512, 256]', 'dropout': 0.5879277432711427, 'batch_norm': True, 'lr': 0.001421679577035158, 'weight_decay': 6.320357904058746e-07, 'epochs': 40, 'loss': 'mae', 'optimizer': 'adam', 'graph_mode': 'cutoff', 'cutoff': 0.7411875921226961, 'grm_norm': 'cosine_then_gcn', 'self_loops': False, 'use_snp_selection': True, 'num_snps': 49806}. Best is trial 121 with value: 0.31335727417865833.
[I 2025-12-08 10:57:43,398] Trial 126 finished with value: 0.3039244782634607 and parameters: {'model_type': 'gcn', 'hidden_dims': '[512, 256]', 'dropout': 0.5466061993006187, 'batch_norm': True, 'lr': 0.0006515821305937698, 'weight_decay': 6.542131958240514e-07, 'epochs': 275, 'loss': 'mae', 'optimizer': 'adam', 'graph_mode': 'cutoff', 'cutoff': 0.7424481852550214, 'grm_norm': 'cosine_then_gcn', 'self_loops': False, 'use_snp_selection': True, 'num_snps': 53236}. Best is trial 121 with value: 0.31335727417865833.
[I 2025-12-08 10:58:08,476] Trial 127 finished with value: 0.3083629715518619 and parameters: {'model_type': 'gcn', 'hidden_dims': '[512, 256]', 'dropout': 0.5821145038904858, 'batch_norm': True, 'lr': 0.00131288472986116, 'weight_decay': 9.85980712637899e-07, 'epochs': 41, 'loss': 'mae', 'optimizer': 'adam', 'graph_mode': 'cutoff', 'cutoff': 0.7566826546963962, 'grm_norm': 'cosine_then_gcn', 'self_loops': False, 'use_snp_selection': True, 'num_snps': 51506}. Best is trial 121 with value: 0.31335727417865833.
[I 2025-12-08 10:58:33,326] Trial 128 finished with value: 0.3077484053936516 and parameters: {'model_type': 'gcn', 'hidden_dims': '[512, 256]', 'dropout': 0.5706436641359498, 'batch_norm': True, 'lr': 0.0006932174012364681, 'weight_decay': 8.501654320947019e-07, 'epochs': 40, 'loss': 'mae', 'optimizer': 'adam', 'graph_mode': 'cutoff', 'cutoff': 0.7155344232254531, 'grm_norm': 'cosine_then_gcn', 'self_loops': False, 'use_snp_selection': True, 'num_snps': 51231}. Best is trial 121 with value: 0.31335727417865833.
[I 2025-12-08 10:58:59,734] Trial 129 finished with value: 0.3083266095329646 and parameters: {'model_type': 'gcn', 'hidden_dims': '[512, 256]', 'dropout': 0.5811986254681272, 'batch_norm': True, 'lr': 0.0008522170806589377, 'weight_decay': 4.319509513430514e-07, 'epochs': 52, 'loss': 'mae', 'optimizer': 'adam', 'graph_mode': 'cutoff', 'cutoff': 0.6838060547584104, 'grm_norm': 'cosine_then_gcn', 'self_loops': False, 'use_snp_selection': True, 'num_snps': 48852}. Best is trial 121 with value: 0.31335727417865833.
