[I 2025-12-08 14:56:12,659] Trial 67 finished with value: 0.3430186525380158 and parameters: {'model_type': 'gcn', 'hidden_dims': '[512, 128]', 'dropout': 0.5803500767203407, 'batch_norm': False, 'lr': 0.00010644093865769076, 'weight_decay': 1.761669126839359e-07, 'epochs': 209, 'loss': 'mae', 'optimizer': 'adam', 'graph_mode': 'cutoff', 'cutoff': 0.6360024837823931, 'grm_norm': 'cosine', 'self_loops': True, 'use_snp_selection': False}. Best is trial 48 with value: 0.36674939557874003.
[I 2025-12-08 14:57:14,996] Trial 68 finished with value: 0.1799504401304805 and parameters: {'model_type': 'gcn', 'hidden_dims': '[512, 64]', 'dropout': 0.212149938938537, 'batch_norm': False, 'lr': 0.00014080273221818532, 'weight_decay': 1.3822063860384813e-07, 'epochs': 248, 'loss': 'mse', 'optimizer': 'adam', 'graph_mode': 'cutoff', 'cutoff': 0.6920849559922152, 'grm_norm': 'cosine', 'self_loops': True, 'use_snp_selection': False}. Best is trial 48 with value: 0.36674939557874003.
[I 2025-12-08 14:58:13,972] Trial 69 finished with value: 0.31266135434266173 and parameters: {'model_type': 'gcn', 'hidden_dims': '[512, 64]', 'dropout': 0.5480723602860673, 'batch_norm': False, 'lr': 7.181126842268639e-05, 'weight_decay': 2.16601768006782e-07, 'epochs': 228, 'loss': 'mae', 'optimizer': 'adam', 'graph_mode': 'cutoff', 'cutoff': 0.25167960439948406, 'grm_norm': 'cosine', 'self_loops': True, 'use_snp_selection': False}. Best is trial 48 with value: 0.36674939557874003.
[I 2025-12-08 14:59:10,338] Trial 70 finished with value: 0.31994150982285086 and parameters: {'model_type': 'gcn', 'hidden_dims': '[512, 64]', 'dropout': 0.49401506863684136, 'batch_norm': False, 'lr': 5.304688004024415e-05, 'weight_decay': 6.844506985524855e-07, 'epochs': 219, 'loss': 'mae', 'optimizer': 'adam', 'graph_mode': 'knn', 'knn_k': 8, 'weighted_edges': True, 'symmetrize_mode': 'mutual', 'self_loops': True, 'use_snp_selection': False}. Best is trial 48 with value: 0.36674939557874003.
[I 2025-12-08 14:59:55,526] Trial 71 finished with value: 0.3562929825497381 and parameters: {'model_type': 'gcn', 'hidden_dims': '[512, 64]', 'dropout': 0.5212133288323693, 'batch_norm': False, 'lr': 9.248554643827533e-05, 'weight_decay': 3.967202751164177e-07, 'epochs': 176, 'loss': 'mae', 'optimizer': 'adam', 'graph_mode': 'cutoff', 'cutoff': 0.6104237474425179, 'grm_norm': 'cosine', 'self_loops': True, 'use_snp_selection': False}. Best is trial 48 with value: 0.36674939557874003.
[I 2025-12-08 15:00:45,439] Trial 72 finished with value: 0.3418695513543886 and parameters: {'model_type': 'gcn', 'hidden_dims': '[512, 64]', 'dropout': 0.5122584785908684, 'batch_norm': False, 'lr': 4.577421815766317e-05, 'weight_decay': 1.4812326216231693e-07, 'epochs': 195, 'loss': 'mae', 'optimizer': 'adam', 'graph_mode': 'cutoff', 'cutoff': 0.506443235496347, 'grm_norm': 'cosine', 'self_loops': True, 'use_snp_selection': False}. Best is trial 48 with value: 0.36674939557874003.
[I 2025-12-08 15:01:33,931] Trial 73 finished with value: 0.3470218023475393 and parameters: {'model_type': 'gcn', 'hidden_dims': '[512, 64]', 'dropout': 0.5644382357293669, 'batch_norm': False, 'lr': 2.976955155439236e-05, 'weight_decay': 2.825088267904596e-07, 'epochs': 190, 'loss': 'mae', 'optimizer': 'adam', 'graph_mode': 'cutoff', 'cutoff': 0.5412847851088944, 'grm_norm': 'none', 'self_loops': True, 'use_snp_selection': False}. Best is trial 48 with value: 0.36674939557874003.
[I 2025-12-08 15:02:14,785] Trial 74 finished with value: 0.3398049062618721 and parameters: {'model_type': 'gcn', 'hidden_dims': '[512, 64]', 'dropout': 0.3872819898358877, 'batch_norm': False, 'lr': 7.038560077841071e-05, 'weight_decay': 8.958440603201406e-07, 'epochs': 158, 'loss': 'mae', 'optimizer': 'adam', 'graph_mode': 'cutoff', 'cutoff': 0.7281839403987564, 'grm_norm': 'cosine', 'self_loops': True, 'use_snp_selection': False}. Best is trial 48 with value: 0.36674939557874003.
[I 2025-12-08 15:02:58,832] Trial 75 finished with value: 0.36046087681198935 and parameters: {'model_type': 'gcn', 'hidden_dims': '[512, 64]', 'dropout': 0.4619266989822887, 'batch_norm': False, 'lr': 3.994485569497829e-05, 'weight_decay': 2.018128095786558e-06, 'epochs': 171, 'loss': 'mae', 'optimizer': 'adam', 'graph_mode': 'cutoff', 'cutoff': 0.578156566233528, 'grm_norm': 'cosine', 'self_loops': True, 'use_snp_selection': False}. Best is trial 48 with value: 0.36674939557874003.
[I 2025-12-08 15:03:35,176] Trial 76 finished with value: 0.33623423100356725 and parameters: {'model_type': 'gcn', 'hidden_dims': '[512, 64]', 'dropout': 0.42995297074488276, 'batch_norm': False, 'lr': 0.00014478058078920938, 'weight_decay': 2.1921861608392837e-07, 'epochs': 139, 'loss': 'mae', 'optimizer': 'adam', 'graph_mode': 'cutoff', 'cutoff': 0.6284289340196333, 'grm_norm': 'cosine', 'self_loops': True, 'use_snp_selection': False}. Best is trial 48 with value: 0.36674939557874003.
[I 2025-12-08 15:04:42,154] Trial 77 finished with value: 0.34915565238766916 and parameters: {'model_type': 'gcn', 'hidden_dims': '[512, 64]', 'dropout': 0.23611580428360987, 'batch_norm': True, 'lr': 0.00021075747491600567, 'weight_decay': 5.606899491207639e-07, 'epochs': 266, 'loss': 'mae', 'optimizer': 'adam', 'graph_mode': 'cutoff', 'cutoff': 0.7794279399963292, 'grm_norm': 'cosine', 'self_loops': True, 'use_snp_selection': False}. Best is trial 48 with value: 0.36674939557874003.
[I 2025-12-08 15:05:08,887] Trial 78 finished with value: 0.3461643477061373 and parameters: {'model_type': 'gcn', 'hidden_dims': '[256, 128, 64]', 'dropout': 0.33966891369187263, 'batch_norm': False, 'lr': 5.9320562115494506e-05, 'weight_decay': 1.2119781740311827e-07, 'epochs': 205, 'loss': 'mae', 'optimizer': 'adam', 'graph_mode': 'cutoff', 'cutoff': 0.6801340160161873, 'grm_norm': 'cosine', 'self_loops': True, 'use_snp_selection': False}. Best is trial 48 with value: 0.36674939557874003.
[I 2025-12-08 15:05:39,004] Trial 79 finished with value: 0.16437910273027928 and parameters: {'model_type': 'gcn', 'hidden_dims': '[256, 128]', 'dropout': 0.5900222653046409, 'batch_norm': False, 'lr': 9.376120629795298e-05, 'weight_decay': 2.2978823173534446e-05, 'epochs': 244, 'loss': 'mse', 'optimizer': 'adam', 'graph_mode': 'cutoff', 'cutoff': 0.6041184474559033, 'grm_norm': 'none', 'self_loops': True, 'use_snp_selection': False}. Best is trial 48 with value: 0.36674939557874003.
[I 2025-12-08 15:06:11,097] Trial 80 finished with value: 0.3421744051018477 and parameters: {'model_type': 'gcn', 'hidden_dims': '[512, 64]', 'dropout': 0.5413865552681832, 'batch_norm': False, 'lr': 2.4118083328022977e-05, 'weight_decay': 0.00010133384767786238, 'epochs': 122, 'loss': 'mae', 'optimizer': 'adam', 'graph_mode': 'cutoff', 'cutoff': 0.649351265796011, 'grm_norm': 'gcn', 'self_loops': True, 'use_snp_selection': False}. Best is trial 48 with value: 0.36674939557874003.
[I 2025-12-08 15:07:28,612] Trial 81 finished with value: 0.355565989242124 and parameters: {'model_type': 'gcn', 'hidden_dims': '[512, 64]', 'dropout': 0.52974423039406, 'batch_norm': False, 'lr': 1.735549275303523e-05, 'weight_decay': 1.6823589142961037e-07, 'epochs': 311, 'loss': 'mae', 'optimizer': 'adam', 'graph_mode': 'cutoff', 'cutoff': 0.5649429981434895, 'grm_norm': 'cosine', 'self_loops': True, 'use_snp_selection': False}. Best is trial 48 with value: 0.36674939557874003.
[I 2025-12-08 15:08:57,086] Trial 82 finished with value: 0.3514532959049014 and parameters: {'model_type': 'gcn', 'hidden_dims': '[512, 64]', 'dropout': 0.5121982905987589, 'batch_norm': False, 'lr': 2.0594545981258288e-05, 'weight_decay': 1.0371086005144954e-07, 'epochs': 334, 'loss': 'mae', 'optimizer': 'adam', 'graph_mode': 'cutoff', 'cutoff': 0.5324862654263334, 'grm_norm': 'cosine_then_gcn', 'self_loops': True, 'use_snp_selection': False}. Best is trial 48 with value: 0.36674939557874003.
[I 2025-12-08 15:09:43,553] Trial 83 finished with value: 0.33100526385496126 and parameters: {'model_type': 'gcn', 'hidden_dims': '[512, 64]', 'dropout': 0.5534745405402303, 'batch_norm': False, 'lr': 2.9838616716391677e-05, 'weight_decay': 2.797017951683292e-07, 'epochs': 180, 'loss': 'mae', 'optimizer': 'adam', 'graph_mode': 'cutoff', 'cutoff': 0.49449935895439195, 'grm_norm': 'cosine', 'self_loops': True, 'use_snp_selection': False}. Best is trial 48 with value: 0.36674939557874003.
[I 2025-12-08 15:09:59,816] Trial 84 finished with value: 0.32890756320698367 and parameters: {'model_type': 'gcn', 'hidden_dims': '[128, 64]', 'dropout': 0.5329087206161962, 'batch_norm': False, 'lr': 4.9480802593476726e-05, 'weight_decay': 1.2738611883161748e-07, 'epochs': 213, 'loss': 'mae', 'optimizer': 'adam', 'graph_mode': 'cutoff', 'cutoff': 0.5573726113701133, 'grm_norm': 'cosine_then_gcn', 'self_loops': True, 'use_snp_selection': False}. Best is trial 48 with value: 0.36674939557874003.
[I 2025-12-08 15:11:05,917] Trial 85 finished with value: 0.3239607651625135 and parameters: {'model_type': 'gcn', 'hidden_dims': '[512, 64]', 'dropout': 0.49082788069525124, 'batch_norm': False, 'lr': 3.838537465038469e-05, 'weight_decay': 2.133891691593793e-07, 'epochs': 219, 'loss': 'mae', 'optimizer': 'adam', 'graph_mode': 'cutoff', 'cutoff': 0.4550390438994023, 'grm_norm': 'cosine', 'self_loops': True, 'use_snp_selection': True, 'num_snps': 59961}. Best is trial 48 with value: 0.36674939557874003.
[I 2025-12-08 15:12:04,168] Trial 86 finished with value: 0.35982389435911283 and parameters: {'model_type': 'gcn', 'hidden_dims': '[512, 64]', 'dropout': 0.5756187843423007, 'batch_norm': False, 'lr': 2.2695992093849024e-05, 'weight_decay': 3.708168132438841e-07, 'epochs': 231, 'loss': 'mae', 'optimizer': 'adam', 'graph_mode': 'cutoff', 'cutoff': 0.7095746772098714, 'grm_norm': 'cosine_then_gcn', 'self_loops': True, 'use_snp_selection': False}. Best is trial 48 with value: 0.36674939557874003.
[I 2025-12-08 15:13:12,896] Trial 87 finished with value: 0.3559529385402288 and parameters: {'model_type': 'gcn', 'hidden_dims': '[512, 64]', 'dropout': 0.5643954724985216, 'batch_norm': False, 'lr': 7.1874396370266e-05, 'weight_decay': 1.5757886342080797e-07, 'epochs': 275, 'loss': 'mae', 'optimizer': 'adam', 'graph_mode': 'cutoff', 'cutoff': 0.5785873446423906, 'grm_norm': 'gcn', 'self_loops': True, 'use_snp_selection': False}. Best is trial 48 with value: 0.36674939557874003.
[I 2025-12-08 15:14:00,579] Trial 88 finished with value: 0.3261211411804844 and parameters: {'model_type': 'gcn', 'hidden_dims': '[512, 128]', 'dropout': 0.504924703187902, 'batch_norm': True, 'lr': 1.3268771782649686e-05, 'weight_decay': 1.9454299741984343e-07, 'epochs': 185, 'loss': 'mae', 'optimizer': 'adam', 'graph_mode': 'cutoff', 'cutoff': 0.6749573663901645, 'grm_norm': 'cosine', 'self_loops': True, 'use_snp_selection': False}. Best is trial 48 with value: 0.36674939557874003.
[I 2025-12-08 15:14:59,601] Trial 89 finished with value: 0.33821680507064567 and parameters: {'model_type': 'gcn', 'hidden_dims': '[512, 64]', 'dropout': 0.5228663856419834, 'batch_norm': False, 'lr': 3.0232550529641885e-05, 'weight_decay': 2.854634708264302e-07, 'epochs': 288, 'loss': 'mae', 'optimizer': 'adam', 'graph_mode': 'knn', 'knn_k': 5, 'weighted_edges': True, 'symmetrize_mode': 'union', 'self_loops': True, 'use_snp_selection': True, 'num_snps': 40077}. Best is trial 48 with value: 0.36674939557874003.
[I 2025-12-08 15:15:51,969] Trial 90 finished with value: 0.3574390849900316 and parameters: {'model_type': 'gcn', 'hidden_dims': '[512, 64]', 'dropout': 0.5379349926245773, 'batch_norm': False, 'lr': 4.7114598606348046e-05, 'weight_decay': 4.5719161998802336e-07, 'epochs': 205, 'loss': 'mse', 'optimizer': 'adam', 'graph_mode': 'cutoff', 'cutoff': 0.5072594765432913, 'grm_norm': 'cosine_then_gcn', 'self_loops': True, 'use_snp_selection': False}. Best is trial 48 with value: 0.36674939557874003.
[I 2025-12-08 15:16:34,269] Trial 91 finished with value: 0.36565458898596487 and parameters: {'model_type': 'gcn', 'hidden_dims': '[512, 64]', 'dropout': 0.45918291456513943, 'batch_norm': False, 'lr': 3.9328128783715144e-05, 'weight_decay': 6.895546589973092e-06, 'epochs': 164, 'loss': 'mae', 'optimizer': 'adam', 'graph_mode': 'cutoff', 'cutoff': 0.5777686129272499, 'grm_norm': 'cosine', 'self_loops': True, 'use_snp_selection': False}. Best is trial 48 with value: 0.36674939557874003.
[I 2025-12-08 15:17:16,584] Trial 92 finished with value: 0.3646514108382532 and parameters: {'model_type': 'gcn', 'hidden_dims': '[512, 64]', 'dropout': 0.47486949135235157, 'batch_norm': False, 'lr': 5.8435183328091984e-05, 'weight_decay': 1.0044265406228087e-07, 'epochs': 164, 'loss': 'mae', 'optimizer': 'adam', 'graph_mode': 'cutoff', 'cutoff': 0.6224980148721272, 'grm_norm': 'cosine', 'self_loops': True, 'use_snp_selection': False}. Best is trial 48 with value: 0.36674939557874003.
[I 2025-12-08 15:17:58,897] Trial 93 finished with value: 0.3632888093816952 and parameters: {'model_type': 'gcn', 'hidden_dims': '[512, 64]', 'dropout': 0.46873110161401377, 'batch_norm': False, 'lr': 6.226552115014245e-05, 'weight_decay': 9.004975776491238e-06, 'epochs': 164, 'loss': 'mae', 'optimizer': 'adam', 'graph_mode': 'cutoff', 'cutoff': 0.6205346638138054, 'grm_norm': 'cosine', 'self_loops': True, 'use_snp_selection': False}. Best is trial 48 with value: 0.36674939557874003.
[I 2025-12-08 15:18:40,028] Trial 94 finished with value: 0.357051468699918 and parameters: {'model_type': 'gcn', 'hidden_dims': '[512, 64]', 'dropout': 0.4396235260591351, 'batch_norm': False, 'lr': 6.1488376387925e-05, 'weight_decay': 7.519901461765591e-06, 'epochs': 159, 'loss': 'mae', 'optimizer': 'adam', 'graph_mode': 'cutoff', 'cutoff': 0.6194803383311133, 'grm_norm': 'cosine', 'self_loops': True, 'use_snp_selection': False}. Best is trial 48 with value: 0.36674939557874003.
[I 2025-12-08 15:19:17,255] Trial 95 finished with value: 0.35445033519991276 and parameters: {'model_type': 'gcn', 'hidden_dims': '[512, 64]', 'dropout': 0.4686620672086759, 'batch_norm': False, 'lr': 8.8387425493869e-05, 'weight_decay': 1.1903575296919951e-05, 'epochs': 143, 'loss': 'mae', 'optimizer': 'adam', 'graph_mode': 'cutoff', 'cutoff': 0.6574296225835934, 'grm_norm': 'cosine', 'self_loops': True, 'use_snp_selection': False}. Best is trial 48 with value: 0.36674939557874003.
[I 2025-12-08 15:20:00,310] Trial 96 finished with value: 0.36726476889190185 and parameters: {'model_type': 'gcn', 'hidden_dims': '[512, 64]', 'dropout': 0.4871617200341089, 'batch_norm': False, 'lr': 0.00013349073619752365, 'weight_decay': 5.458740584829599e-06, 'epochs': 167, 'loss': 'mae', 'optimizer': 'adam', 'graph_mode': 'cutoff', 'cutoff': 0.595595400251212, 'grm_norm': 'cosine', 'self_loops': True, 'use_snp_selection': False}. Best is trial 96 with value: 0.36726476889190185.
[I 2025-12-08 15:20:42,901] Trial 97 finished with value: 0.3669959388903523 and parameters: {'model_type': 'gcn', 'hidden_dims': '[512, 64]', 'dropout': 0.4738302862430229, 'batch_norm': False, 'lr': 0.00012692379478610846, 'weight_decay': 8.950667247373054e-06, 'epochs': 165, 'loss': 'mae', 'optimizer': 'adam', 'graph_mode': 'cutoff', 'cutoff': 0.5968842145055195, 'grm_norm': 'cosine', 'self_loops': True, 'use_snp_selection': False}. Best is trial 96 with value: 0.36726476889190185.
[I 2025-12-08 15:21:22,605] Trial 98 finished with value: 0.3412355872122207 and parameters: {'model_type': 'gcn', 'hidden_dims': '[512, 64]', 'dropout': 0.4845051746434477, 'batch_norm': False, 'lr': 0.0002737180143459639, 'weight_decay': 5.481403447737967e-06, 'epochs': 153, 'loss': 'mae', 'optimizer': 'adam', 'graph_mode': 'cutoff', 'cutoff': 0.6432842870711246, 'grm_norm': 'cosine', 'self_loops': True, 'use_snp_selection': False}. Best is trial 96 with value: 0.36726476889190185.
[I 2025-12-08 15:21:40,935] Trial 99 finished with value: 0.14777818681226423 and parameters: {'model_type': 'gcn', 'hidden_dims': '[256, 128, 64]', 'dropout': 0.45690703424328794, 'batch_norm': False, 'lr': 0.00039147299394178475, 'weight_decay': 2.645504112620922e-06, 'epochs': 134, 'loss': 'mae', 'optimizer': 'adam', 'graph_mode': 'cutoff', 'cutoff': 0.5972313315384504, 'grm_norm': 'cosine', 'self_loops': True, 'use_snp_selection': False}. Best is trial 96 with value: 0.36726476889190185.
[I 2025-12-08 15:21:51,293] Trial 100 finished with value: 0.16985432369308504 and parameters: {'model_type': 'gcn', 'hidden_dims': '[128, 64]', 'dropout': 0.47742942107962516, 'batch_norm': False, 'lr': 0.00019127599576678416, 'weight_decay': 2.0653861569582595e-05, 'epochs': 126, 'loss': 'mae', 'optimizer': 'adam', 'graph_mode': 'cutoff', 'cutoff': 0.5987910065627537, 'grm_norm': 'cosine', 'self_loops': True, 'use_snp_selection': False}. Best is trial 96 with value: 0.36726476889190185.
[I 2025-12-08 15:22:33,457] Trial 101 finished with value: 0.3508468207720295 and parameters: {'model_type': 'gcn', 'hidden_dims': '[512, 64]', 'dropout': 0.42464523952169253, 'batch_norm': False, 'lr': 0.00014981070663482848, 'weight_decay': 1.0359250242125575e-05, 'epochs': 164, 'loss': 'mae', 'optimizer': 'adam', 'graph_mode': 'cutoff', 'cutoff': 0.6260526176473631, 'grm_norm': 'cosine', 'self_loops': True, 'use_snp_selection': False}. Best is trial 96 with value: 0.36726476889190185.
[I 2025-12-08 15:23:16,423] Trial 102 finished with value: 0.3575074105318749 and parameters: {'model_type': 'gcn', 'hidden_dims': '[512, 64]', 'dropout': 0.46953734262929897, 'batch_norm': False, 'lr': 5.5332768433956364e-05, 'weight_decay': 8.284825599045916e-06, 'epochs': 167, 'loss': 'mae', 'optimizer': 'adam', 'graph_mode': 'cutoff', 'cutoff': 0.6645676980461855, 'grm_norm': 'cosine', 'self_loops': True, 'use_snp_selection': False}. Best is trial 96 with value: 0.36726476889190185.
[I 2025-12-08 15:24:00,431] Trial 103 finished with value: 0.3551024191996215 and parameters: {'model_type': 'gcn', 'hidden_dims': '[512, 64]', 'dropout': 0.4917234255957848, 'batch_norm': False, 'lr': 0.00012583279562575154, 'weight_decay': 5.895475419265891e-06, 'epochs': 171, 'loss': 'mae', 'optimizer': 'adam', 'graph_mode': 'cutoff', 'cutoff': 0.5712968208363771, 'grm_norm': 'cosine', 'self_loops': True, 'use_snp_selection': False}. Best is trial 96 with value: 0.36726476889190185.
[I 2025-12-08 15:24:45,619] Trial 104 finished with value: 0.36033132288430647 and parameters: {'model_type': 'gcn', 'hidden_dims': '[512, 64]', 'dropout': 0.4573823120412942, 'batch_norm': False, 'lr': 7.968358193741236e-05, 'weight_decay': 4.3645218761898815e-06, 'epochs': 176, 'loss': 'mae', 'optimizer': 'adam', 'graph_mode': 'cutoff', 'cutoff': 0.6158269553321339, 'grm_norm': 'cosine', 'self_loops': True, 'use_snp_selection': False}. Best is trial 96 with value: 0.36726476889190185.
[I 2025-12-08 15:25:26,456] Trial 105 finished with value: 0.3556364880945547 and parameters: {'model_type': 'gcn', 'hidden_dims': '[512, 64]', 'dropout': 0.4365726146048172, 'batch_norm': False, 'lr': 6.892277636704249e-05, 'weight_decay': 7.06884865892105e-06, 'epochs': 158, 'loss': 'mae', 'optimizer': 'adam', 'graph_mode': 'cutoff', 'cutoff': 0.6381953548851647, 'grm_norm': 'cosine', 'self_loops': False, 'use_snp_selection': False}. Best is trial 96 with value: 0.36726476889190185.
[I 2025-12-08 15:26:05,798] Trial 106 finished with value: 0.36410467241218675 and parameters: {'model_type': 'gcn', 'hidden_dims': '[512, 256]', 'dropout': 0.4065177920760279, 'batch_norm': False, 'lr': 3.631009225932766e-05, 'weight_decay': 3.2023931575313142e-06, 'epochs': 151, 'loss': 'mae', 'optimizer': 'adam', 'graph_mode': 'cutoff', 'cutoff': 0.5461360955392354, 'grm_norm': 'cosine', 'self_loops': True, 'use_snp_selection': False}. Best is trial 96 with value: 0.36726476889190185.
[I 2025-12-08 15:26:54,795] Trial 107 finished with value: 0.24168494170540833 and parameters: {'model_type': 'gcn', 'hidden_dims': '[512, 256]', 'dropout': 0.4025722233299758, 'batch_norm': True, 'lr': 3.510902668163342e-05, 'weight_decay': 1.4557716248787617e-05, 'epochs': 189, 'loss': 'mae', 'optimizer': 'adam', 'graph_mode': 'knn', 'knn_k': 2, 'weighted_edges': False, 'symmetrize_mode': 'mutual', 'self_loops': True, 'use_snp_selection': False}. Best is trial 96 with value: 0.36726476889190185.
[I 2025-12-08 15:27:33,652] Trial 108 finished with value: 0.35208893559856774 and parameters: {'model_type': 'gcn', 'hidden_dims': '[512, 256]', 'dropout': 0.5019083172438534, 'batch_norm': False, 'lr': 4.135913698561521e-05, 'weight_decay': 4.2460304788856856e-05, 'epochs': 149, 'loss': 'mae', 'optimizer': 'adam', 'graph_mode': 'cutoff', 'cutoff': 0.6902764712007314, 'grm_norm': 'cosine', 'self_loops': True, 'use_snp_selection': False}. Best is trial 96 with value: 0.36726476889190185.
[I 2025-12-08 15:28:19,499] Trial 109 finished with value: 0.3582504526908702 and parameters: {'model_type': 'gcn', 'hidden_dims': '[512, 256]', 'dropout': 0.4131533308155314, 'batch_norm': False, 'lr': 2.647452311891863e-05, 'weight_decay': 2.704252693925083e-06, 'epochs': 178, 'loss': 'mae', 'optimizer': 'adam', 'graph_mode': 'cutoff', 'cutoff': 0.5472522754978775, 'grm_norm': 'cosine', 'self_loops': True, 'use_snp_selection': False}. Best is trial 96 with value: 0.36726476889190185.
[I 2025-12-08 15:28:56,476] Trial 110 finished with value: 0.35287324747555165 and parameters: {'model_type': 'gcn', 'hidden_dims': '[512, 256]', 'dropout': 0.35608416424250844, 'batch_norm': False, 'lr': 0.00011119669948076297, 'weight_decay': 1.2350604273471965e-07, 'epochs': 140, 'loss': 'mae', 'optimizer': 'adam', 'graph_mode': 'cutoff', 'cutoff': 0.5198264399128806, 'grm_norm': 'cosine', 'self_loops': True, 'use_snp_selection': False}. Best is trial 96 with value: 0.36726476889190185.
