[I 2025-12-08 23:44:03,792] Trial 80 finished with value: 0.3029129565047186 and parameters: {'model_type': 'gcn', 'hidden_dims': '[256, 128, 64]', 'dropout': 0.5633466901059253, 'batch_norm': True, 'lr': 0.00027045187460126495, 'weight_decay': 2.4327443917251848e-05, 'epochs': 41, 'loss': 'mae', 'optimizer': 'adam', 'graph_mode': 'cutoff', 'cutoff': 0.5705982998451637, 'grm_norm': 'cosine_then_gcn', 'self_loops': True, 'use_snp_selection': False}. Best is trial 51 with value: 0.32000048673782483.
[I 2025-12-08 23:44:20,786] Trial 81 finished with value: 0.30953661757478934 and parameters: {'model_type': 'gcn', 'hidden_dims': '[256, 128]', 'dropout': 0.527765101506583, 'batch_norm': True, 'lr': 0.0011210165137513727, 'weight_decay': 0.0009819778765850636, 'epochs': 111, 'loss': 'mae', 'optimizer': 'adam', 'graph_mode': 'cutoff', 'cutoff': 0.8768201403336816, 'grm_norm': 'cosine_then_gcn', 'self_loops': False, 'use_snp_selection': False}. Best is trial 51 with value: 0.32000048673782483.
[I 2025-12-08 23:44:28,177] Trial 82 finished with value: 0.31752761277350555 and parameters: {'model_type': 'gcn', 'hidden_dims': '[128, 64]', 'dropout': 0.5567602661291898, 'batch_norm': True, 'lr': 0.0008807867711187519, 'weight_decay': 0.0005636958210980526, 'epochs': 83, 'loss': 'mae', 'optimizer': 'adam', 'graph_mode': 'cutoff', 'cutoff': 0.8357662300670451, 'grm_norm': 'none', 'self_loops': False, 'use_snp_selection': False}. Best is trial 51 with value: 0.32000048673782483.
[I 2025-12-08 23:44:37,025] Trial 83 finished with value: 0.3074894991164255 and parameters: {'model_type': 'gcn', 'hidden_dims': '[128, 64]', 'dropout': 0.5442930199664988, 'batch_norm': True, 'lr': 0.0007604119911348965, 'weight_decay': 0.0005228098411798771, 'epochs': 80, 'loss': 'mae', 'optimizer': 'adam', 'graph_mode': 'cutoff', 'cutoff': 0.8400168222881524, 'grm_norm': 'none', 'self_loops': False, 'use_snp_selection': False}. Best is trial 51 with value: 0.32000048673782483.
[I 2025-12-08 23:44:44,027] Trial 84 finished with value: 0.3091544868290275 and parameters: {'model_type': 'gcn', 'hidden_dims': '[128, 64]', 'dropout': 0.5618205806364113, 'batch_norm': True, 'lr': 0.0005932518638792002, 'weight_decay': 1.4517960816299914e-07, 'epochs': 61, 'loss': 'mae', 'optimizer': 'adam', 'graph_mode': 'cutoff', 'cutoff': 0.7972875865247061, 'grm_norm': 'none', 'self_loops': False, 'use_snp_selection': False}. Best is trial 51 with value: 0.32000048673782483.
[I 2025-12-08 23:44:51,524] Trial 85 finished with value: 0.316264593743428 and parameters: {'model_type': 'gcn', 'hidden_dims': '[128, 64]', 'dropout': 0.5770599910843363, 'batch_norm': True, 'lr': 0.0008985946093847092, 'weight_decay': 5.403523043117508e-07, 'epochs': 72, 'loss': 'mae', 'optimizer': 'adam', 'graph_mode': 'cutoff', 'cutoff': 0.7621599676069485, 'grm_norm': 'none', 'self_loops': False, 'use_snp_selection': False}. Best is trial 51 with value: 0.32000048673782483.
[I 2025-12-08 23:45:00,622] Trial 86 finished with value: 0.31141477064738765 and parameters: {'model_type': 'gcn', 'hidden_dims': '[128, 64]', 'dropout': 0.5984054789312598, 'batch_norm': True, 'lr': 0.00033237933307666325, 'weight_decay': 1.3074514405181475e-05, 'epochs': 82, 'loss': 'mae', 'optimizer': 'adam', 'graph_mode': 'cutoff', 'cutoff': 0.6974203675392596, 'grm_norm': 'cosine', 'self_loops': False, 'use_snp_selection': False}. Best is trial 51 with value: 0.32000048673782483.
[I 2025-12-08 23:45:34,412] Trial 87 finished with value: 0.3157091044029645 and parameters: {'model_type': 'gcn', 'hidden_dims': '[512, 128]', 'dropout': 0.5058476792212916, 'batch_norm': True, 'lr': 0.0005115369761367233, 'weight_decay': 4.1095707802180357e-05, 'epochs': 125, 'loss': 'mae', 'optimizer': 'adam', 'graph_mode': 'cutoff', 'cutoff': 0.8292160391186164, 'grm_norm': 'none', 'self_loops': False, 'use_snp_selection': False}. Best is trial 51 with value: 0.32000048673782483.
[I 2025-12-08 23:45:48,449] Trial 88 finished with value: 0.3095908319979981 and parameters: {'model_type': 'gcn', 'hidden_dims': '[256, 128]', 'dropout': 0.5342614821244202, 'batch_norm': True, 'lr': 0.00041598733895658317, 'weight_decay': 0.000702513380638442, 'epochs': 89, 'loss': 'mae', 'optimizer': 'adam', 'graph_mode': 'cutoff', 'cutoff': 0.8993044324386112, 'grm_norm': 'cosine_then_gcn', 'self_loops': True, 'use_snp_selection': False}. Best is trial 51 with value: 0.32000048673782483.
[I 2025-12-08 23:45:58,403] Trial 89 finished with value: 0.2619353360485332 and parameters: {'model_type': 'gcn', 'hidden_dims': '[256, 128, 64]', 'dropout': 0.5864668597956084, 'batch_norm': True, 'lr': 0.0008888135327465073, 'weight_decay': 0.0004934658199008532, 'epochs': 50, 'loss': 'mae', 'optimizer': 'adam', 'graph_mode': 'knn', 'knn_k': 4, 'weighted_edges': False, 'symmetrize_mode': 'union', 'self_loops': False, 'use_snp_selection': False}. Best is trial 51 with value: 0.32000048673782483.
[I 2025-12-08 23:46:05,914] Trial 90 finished with value: 0.3063123282590236 and parameters: {'model_type': 'gcn', 'hidden_dims': '[128, 64]', 'dropout': 0.5693896581708121, 'batch_norm': True, 'lr': 0.0014741841769174131, 'weight_decay': 0.00020311620860859043, 'epochs': 67, 'loss': 'mse', 'optimizer': 'adam', 'graph_mode': 'cutoff', 'cutoff': 0.8795518151824611, 'grm_norm': 'cosine_then_gcn', 'self_loops': False, 'use_snp_selection': False}. Best is trial 51 with value: 0.32000048673782483.
[I 2025-12-08 23:46:13,359] Trial 91 finished with value: 0.30664600471774894 and parameters: {'model_type': 'gcn', 'hidden_dims': '[128, 64]', 'dropout': 0.554838793459282, 'batch_norm': True, 'lr': 0.0010290155391967954, 'weight_decay': 1.597996370349188e-06, 'epochs': 59, 'loss': 'mae', 'optimizer': 'adam', 'graph_mode': 'cutoff', 'cutoff': 0.7669504523041135, 'grm_norm': 'none', 'self_loops': False, 'use_snp_selection': False}. Best is trial 51 with value: 0.32000048673782483.
[I 2025-12-08 23:46:21,399] Trial 92 finished with value: 0.3124048685815978 and parameters: {'model_type': 'gcn', 'hidden_dims': '[128, 64]', 'dropout': 0.578321474850805, 'batch_norm': True, 'lr': 0.0008352887527439687, 'weight_decay': 2.6110363498560984e-07, 'epochs': 73, 'loss': 'mae', 'optimizer': 'adam', 'graph_mode': 'cutoff', 'cutoff': 0.7418154235900687, 'grm_norm': 'none', 'self_loops': False, 'use_snp_selection': False}. Best is trial 51 with value: 0.32000048673782483.
[I 2025-12-08 23:46:29,811] Trial 93 finished with value: 0.3085494977229312 and parameters: {'model_type': 'gcn', 'hidden_dims': '[128, 64]', 'dropout': 0.5482792790566476, 'batch_norm': True, 'lr': 0.001215910290481769, 'weight_decay': 5.866801482870128e-07, 'epochs': 75, 'loss': 'mae', 'optimizer': 'adam', 'graph_mode': 'cutoff', 'cutoff': 0.6417786854892694, 'grm_norm': 'none', 'self_loops': False, 'use_snp_selection': False}. Best is trial 51 with value: 0.32000048673782483.
[I 2025-12-08 23:46:40,166] Trial 94 finished with value: 0.3151653815464055 and parameters: {'model_type': 'gcn', 'hidden_dims': '[128, 64]', 'dropout': 0.5226705039195568, 'batch_norm': True, 'lr': 0.0006415504192677824, 'weight_decay': 1.3129077743995513e-07, 'epochs': 106, 'loss': 'mae', 'optimizer': 'adam', 'graph_mode': 'cutoff', 'cutoff': 0.7688554562499633, 'grm_norm': 'none', 'self_loops': False, 'use_snp_selection': False}. Best is trial 51 with value: 0.32000048673782483.
[I 2025-12-08 23:46:52,523] Trial 95 finished with value: 0.31043028503688364 and parameters: {'model_type': 'gcn', 'hidden_dims': '[256, 128]', 'dropout': 0.5885622825887767, 'batch_norm': True, 'lr': 0.0005519320894788355, 'weight_decay': 0.00099979802548857, 'epochs': 83, 'loss': 'mae', 'optimizer': 'adam', 'graph_mode': 'cutoff', 'cutoff': 0.8012919390920674, 'grm_norm': 'none', 'self_loops': False, 'use_snp_selection': False}. Best is trial 51 with value: 0.32000048673782483.
[I 2025-12-08 23:47:25,473] Trial 96 finished with value: 0.316176103440425 and parameters: {'model_type': 'gcn', 'hidden_dims': '[512, 64]', 'dropout': 0.5746350104735941, 'batch_norm': True, 'lr': 0.0009841091129824669, 'weight_decay': 5.883158482179824e-07, 'epochs': 118, 'loss': 'mae', 'optimizer': 'adam', 'graph_mode': 'cutoff', 'cutoff': 0.8590571854772363, 'grm_norm': 'cosine_then_gcn', 'self_loops': True, 'use_snp_selection': False}. Best is trial 51 with value: 0.32000048673782483.
[I 2025-12-08 23:47:33,596] Trial 97 finished with value: 0.0 and parameters: {'model_type': 'gcn', 'hidden_dims': '[128, 64]', 'dropout': 0.5393863082048254, 'batch_norm': False, 'lr': 0.001850199211905567, 'weight_decay': 2.5625495838459184e-07, 'epochs': 67, 'loss': 'mae', 'optimizer': 'adam', 'graph_mode': 'cutoff', 'cutoff': 0.8358585195245635, 'grm_norm': 'cosine_then_gcn', 'self_loops': False, 'use_snp_selection': False}. Best is trial 51 with value: 0.32000048673782483.
[I 2025-12-08 23:47:47,931] Trial 98 finished with value: 0.30358297662045697 and parameters: {'model_type': 'gcn', 'hidden_dims': '[256, 128]', 'dropout': 0.5559635974857852, 'batch_norm': True, 'lr': 0.002708737037145326, 'weight_decay': 0.00029076877541881944, 'epochs': 98, 'loss': 'mae', 'optimizer': 'adam', 'graph_mode': 'cutoff', 'cutoff': 0.8125940557388679, 'grm_norm': 'none', 'self_loops': False, 'use_snp_selection': False}. Best is trial 51 with value: 0.32000048673782483.
[I 2025-12-08 23:47:58,059] Trial 99 finished with value: 0.31748859070298685 and parameters: {'model_type': 'gcn', 'hidden_dims': '[128, 64]', 'dropout': 0.5985733025283421, 'batch_norm': True, 'lr': 0.0003057659082753891, 'weight_decay': 5.013799540555256e-06, 'epochs': 95, 'loss': 'mae', 'optimizer': 'adam', 'graph_mode': 'cutoff', 'cutoff': 0.8566382323066609, 'grm_norm': 'cosine_then_gcn', 'self_loops': True, 'use_snp_selection': False}. Best is trial 51 with value: 0.32000048673782483.
[I 2025-12-08 23:48:19,143] Trial 100 finished with value: 0.3117770065377986 and parameters: {'model_type': 'gcn', 'hidden_dims': '[256, 128, 64]', 'dropout': 0.5906804882435812, 'batch_norm': True, 'lr': 0.00020100537065459556, 'weight_decay': 3.967980059959945e-06, 'epochs': 137, 'loss': 'mae', 'optimizer': 'adam', 'graph_mode': 'cutoff', 'cutoff': 0.8551792150574145, 'grm_norm': 'cosine_then_gcn', 'self_loops': True, 'use_snp_selection': False}. Best is trial 51 with value: 0.32000048673782483.
[I 2025-12-08 23:48:28,899] Trial 101 finished with value: 0.31378515557822106 and parameters: {'model_type': 'gcn', 'hidden_dims': '[128, 64]', 'dropout': 0.3766294799593256, 'batch_norm': True, 'lr': 0.00029038783188950945, 'weight_decay': 9.326566867852368e-06, 'epochs': 93, 'loss': 'mae', 'optimizer': 'adam', 'graph_mode': 'cutoff', 'cutoff': 0.8275674348656863, 'grm_norm': 'cosine_then_gcn', 'self_loops': True, 'use_snp_selection': False}. Best is trial 51 with value: 0.32000048673782483.
[I 2025-12-08 23:48:38,069] Trial 102 finished with value: 0.3060579600603074 and parameters: {'model_type': 'gcn', 'hidden_dims': '[128, 64]', 'dropout': 0.5990047481288672, 'batch_norm': True, 'lr': 0.0001551303229236019, 'weight_decay': 1.1758650996736266e-06, 'epochs': 73, 'loss': 'mae', 'optimizer': 'adam', 'graph_mode': 'cutoff', 'cutoff': 0.8606476345927486, 'grm_norm': 'cosine_then_gcn', 'self_loops': True, 'use_snp_selection': False}. Best is trial 51 with value: 0.32000048673782483.
[I 2025-12-08 23:48:48,632] Trial 103 finished with value: 0.31528523659274443 and parameters: {'model_type': 'gcn', 'hidden_dims': '[128, 64]', 'dropout': 0.5744596242656546, 'batch_norm': True, 'lr': 0.0003951226411726189, 'weight_decay': 1.9413883536950674e-06, 'epochs': 87, 'loss': 'mae', 'optimizer': 'adam', 'graph_mode': 'cutoff', 'cutoff': 0.8842623012026065, 'grm_norm': 'cosine_then_gcn', 'self_loops': True, 'use_snp_selection': False}. Best is trial 51 with value: 0.32000048673782483.
[I 2025-12-08 23:48:59,227] Trial 104 finished with value: 0.31286345767515106 and parameters: {'model_type': 'gcn', 'hidden_dims': '[128, 64]', 'dropout': 0.565928028018867, 'batch_norm': True, 'lr': 0.00024622696080668855, 'weight_decay': 4.1746232661861384e-07, 'epochs': 101, 'loss': 'mae', 'optimizer': 'adam', 'graph_mode': 'cutoff', 'cutoff': 0.754306272369538, 'grm_norm': 'cosine', 'self_loops': True, 'use_snp_selection': False}. Best is trial 51 with value: 0.32000048673782483.
[I 2025-12-08 23:49:07,118] Trial 105 finished with value: 0.31757072797905705 and parameters: {'model_type': 'gcn', 'hidden_dims': '[128, 64]', 'dropout': 0.5580801433646699, 'batch_norm': True, 'lr': 0.0006753829695986472, 'weight_decay': 0.0005995512767773244, 'epochs': 60, 'loss': 'mae', 'optimizer': 'adam', 'graph_mode': 'cutoff', 'cutoff': 0.7803135907587206, 'grm_norm': 'cosine_then_gcn', 'self_loops': False, 'use_snp_selection': False}. Best is trial 51 with value: 0.32000048673782483.
[I 2025-12-08 23:49:16,407] Trial 106 finished with value: 0.31763569401382225 and parameters: {'model_type': 'gcn', 'hidden_dims': '[256, 128]', 'dropout': 0.5448297687580547, 'batch_norm': True, 'lr': 0.00043303218461376256, 'weight_decay': 0.000567944403016228, 'epochs': 49, 'loss': 'mae', 'optimizer': 'adam', 'graph_mode': 'cutoff', 'cutoff': 0.8049021864784516, 'grm_norm': 'cosine_then_gcn', 'self_loops': True, 'use_snp_selection': False}. Best is trial 51 with value: 0.32000048673782483.
[I 2025-12-08 23:49:25,562] Trial 107 finished with value: 0.30462553408327986 and parameters: {'model_type': 'gcn', 'hidden_dims': '[256, 128]', 'dropout': 0.5084952422286245, 'batch_norm': True, 'lr': 0.0003553608479897566, 'weight_decay': 0.0005751382126359547, 'epochs': 50, 'loss': 'mae', 'optimizer': 'adam', 'graph_mode': 'cutoff', 'cutoff': 0.7813326270871871, 'grm_norm': 'cosine_then_gcn', 'self_loops': True, 'use_snp_selection': False}. Best is trial 51 with value: 0.32000048673782483.
[I 2025-12-08 23:49:34,694] Trial 108 finished with value: 0.26067624733731876 and parameters: {'model_type': 'gcn', 'hidden_dims': '[256, 128]', 'dropout': 0.5392741557935546, 'batch_norm': True, 'lr': 0.0001160032956266116, 'weight_decay': 0.0007465934616931562, 'epochs': 40, 'loss': 'mae', 'optimizer': 'adam', 'graph_mode': 'knn', 'knn_k': 7, 'weighted_edges': True, 'symmetrize_mode': 'mutual', 'self_loops': True, 'use_snp_selection': False}. Best is trial 51 with value: 0.32000048673782483.
[I 2025-12-08 23:49:46,188] Trial 109 finished with value: 0.30038276299154537 and parameters: {'model_type': 'gcn', 'hidden_dims': '[256, 128]', 'dropout': 0.4951388475909726, 'batch_norm': True, 'lr': 0.00030570222644885303, 'weight_decay': 0.0003733973939866223, 'epochs': 61, 'loss': 'mse', 'optimizer': 'adam', 'graph_mode': 'cutoff', 'cutoff': 0.8059732137594418, 'grm_norm': 'cosine_then_gcn', 'self_loops': True, 'use_snp_selection': False}. Best is trial 51 with value: 0.32000048673782483.
[I 2025-12-08 23:50:08,522] Trial 110 finished with value: 0.2692042882415743 and parameters: {'model_type': 'gcn', 'hidden_dims': '[256, 128]', 'dropout': 0.5201375917234354, 'batch_norm': True, 'lr': 0.00047110466289260205, 'weight_decay': 0.00045562829439073555, 'epochs': 49, 'loss': 'mae', 'optimizer': 'adam', 'graph_mode': 'cutoff', 'cutoff': 0.4775780607316816, 'grm_norm': 'cosine_then_gcn', 'self_loops': True, 'use_snp_selection': True, 'num_snps': 50494}. Best is trial 51 with value: 0.32000048673782483.
[I 2025-12-08 23:50:27,318] Trial 111 finished with value: 0.2625040979845334 and parameters: {'model_type': 'gcn', 'hidden_dims': '[512, 128]', 'dropout': 0.5549905218434219, 'batch_norm': True, 'lr': 0.00069982732388656, 'weight_decay': 0.0006014052107236335, 'epochs': 56, 'loss': 'mae', 'optimizer': 'adam', 'graph_mode': 'cutoff', 'cutoff': 0.21002426030380783, 'grm_norm': 'cosine_then_gcn', 'self_loops': True, 'use_snp_selection': False}. Best is trial 51 with value: 0.32000048673782483.
[I 2025-12-08 23:50:38,516] Trial 112 finished with value: 0.31420177317995124 and parameters: {'model_type': 'gcn', 'hidden_dims': '[256, 128]', 'dropout': 0.562988663691075, 'batch_norm': True, 'lr': 0.00042829688921956413, 'weight_decay': 0.0008289402732526778, 'epochs': 64, 'loss': 'mae', 'optimizer': 'adam', 'graph_mode': 'cutoff', 'cutoff': 0.8268553665721493, 'grm_norm': 'cosine_then_gcn', 'self_loops': False, 'use_snp_selection': False}. Best is trial 51 with value: 0.32000048673782483.
[I 2025-12-08 23:50:47,243] Trial 113 finished with value: 0.3146176069428107 and parameters: {'model_type': 'gcn', 'hidden_dims': '[128, 64]', 'dropout': 0.5465671203959396, 'batch_norm': True, 'lr': 0.0005730930691791511, 'weight_decay': 0.00025031368857135266, 'epochs': 81, 'loss': 'mae', 'optimizer': 'adam', 'graph_mode': 'cutoff', 'cutoff': 0.8461489050691939, 'grm_norm': 'cosine_then_gcn', 'self_loops': False, 'use_snp_selection': False}. Best is trial 51 with value: 0.32000048673782483.
[I 2025-12-08 23:50:56,705] Trial 114 finished with value: 0.3168301541115155 and parameters: {'model_type': 'gcn', 'hidden_dims': '[128, 64]', 'dropout': 0.585337259721637, 'batch_norm': True, 'lr': 0.0006728581362113253, 'weight_decay': 0.0003633952006710247, 'epochs': 91, 'loss': 'mae', 'optimizer': 'adam', 'graph_mode': 'cutoff', 'cutoff': 0.8131029522834392, 'grm_norm': 'cosine_then_gcn', 'self_loops': True, 'use_snp_selection': False}. Best is trial 51 with value: 0.32000048673782483.
[I 2025-12-08 23:51:14,581] Trial 115 finished with value: 0.31287234114906004 and parameters: {'model_type': 'gcn', 'hidden_dims': '[256, 128, 64]', 'dropout': 0.5848835711211934, 'batch_norm': True, 'lr': 0.0005246524645987733, 'weight_decay': 0.00036123869311783006, 'epochs': 114, 'loss': 'mae', 'optimizer': 'adam', 'graph_mode': 'cutoff', 'cutoff': 0.7825461655528525, 'grm_norm': 'cosine_then_gcn', 'self_loops': True, 'use_snp_selection': False}. Best is trial 51 with value: 0.32000048673782483.
[I 2025-12-08 23:51:29,141] Trial 116 finished with value: 0.04506255689756903 and parameters: {'model_type': 'gcn', 'hidden_dims': '[256, 128]', 'dropout': 0.33425493984075855, 'batch_norm': False, 'lr': 0.001247812572656221, 'weight_decay': 0.0006448499171287958, 'epochs': 93, 'loss': 'mae', 'optimizer': 'adam', 'graph_mode': 'cutoff', 'cutoff': 0.727077724719573, 'grm_norm': 'cosine_then_gcn', 'self_loops': True, 'use_snp_selection': False}. Best is trial 51 with value: 0.32000048673782483.
[I 2025-12-08 23:51:39,790] Trial 117 finished with value: 0.3143626605843825 and parameters: {'model_type': 'gcn', 'hidden_dims': '[128, 64]', 'dropout': 0.5921282780063515, 'batch_norm': True, 'lr': 0.0007957617236104495, 'weight_decay': 0.00051185653516334, 'epochs': 105, 'loss': 'mae', 'optimizer': 'adam', 'graph_mode': 'cutoff', 'cutoff': 0.8004252590605532, 'grm_norm': 'cosine_then_gcn', 'self_loops': True, 'use_snp_selection': False}. Best is trial 51 with value: 0.32000048673782483.
[I 2025-12-08 23:52:16,577] Trial 118 finished with value: 0.30612928632410535 and parameters: {'model_type': 'gcn', 'hidden_dims': '[512, 64]', 'dropout': 0.5299877211138457, 'batch_norm': True, 'lr': 0.0003324548783647589, 'weight_decay': 0.0004047615013765277, 'epochs': 187, 'loss': 'mae', 'optimizer': 'adam', 'graph_mode': 'cutoff', 'cutoff': 0.8214081803650028, 'grm_norm': 'cosine_then_gcn', 'self_loops': True, 'use_snp_selection': True, 'num_snps': 31432}. Best is trial 51 with value: 0.32000048673782483.
[I 2025-12-08 23:52:24,658] Trial 119 finished with value: 0.31396750192479 and parameters: {'model_type': 'gcn', 'hidden_dims': '[128, 64]', 'dropout': 0.5718197213063301, 'batch_norm': True, 'lr': 0.00040838958912532204, 'weight_decay': 0.0008269031919986896, 'epochs': 70, 'loss': 'mae', 'optimizer': 'adam', 'graph_mode': 'cutoff', 'cutoff': 0.8401364283084151, 'grm_norm': 'cosine_then_gcn', 'self_loops': True, 'use_snp_selection': False}. Best is trial 51 with value: 0.32000048673782483.
[I 2025-12-08 23:52:35,042] Trial 120 finished with value: 0.3210667504663244 and parameters: {'model_type': 'gcn', 'hidden_dims': '[256, 128]', 'dropout': 0.5841533009646996, 'batch_norm': True, 'lr': 0.0016491697922250512, 'weight_decay': 0.00032719949539695867, 'epochs': 58, 'loss': 'mae', 'optimizer': 'adam', 'graph_mode': 'cutoff', 'cutoff': 0.8109517794770468, 'grm_norm': 'cosine_then_gcn', 'self_loops': True, 'use_snp_selection': False}. Best is trial 120 with value: 0.3210667504663244.
[I 2025-12-08 23:52:45,937] Trial 121 finished with value: 0.3140618400345544 and parameters: {'model_type': 'gcn', 'hidden_dims': '[256, 128]', 'dropout': 0.5839930059741004, 'batch_norm': True, 'lr': 0.0016517746071034961, 'weight_decay': 0.0003059073093150047, 'epochs': 56, 'loss': 'mae', 'optimizer': 'adam', 'graph_mode': 'cutoff', 'cutoff': 0.8057629072162963, 'grm_norm': 'cosine_then_gcn', 'self_loops': True, 'use_snp_selection': False}. Best is trial 120 with value: 0.3210667504663244.
[I 2025-12-08 23:52:59,603] Trial 122 finished with value: 0.3139491686129904 and parameters: {'model_type': 'gcn', 'hidden_dims': '[256, 128]', 'dropout': 0.5504338982892197, 'batch_norm': True, 'lr': 0.00417351075164699, 'weight_decay': 0.00014526642587106036, 'epochs': 85, 'loss': 'mae', 'optimizer': 'adam', 'graph_mode': 'cutoff', 'cutoff': 0.8623486240729875, 'grm_norm': 'cosine_then_gcn', 'self_loops': True, 'use_snp_selection': False}. Best is trial 120 with value: 0.3210667504663244.
[I 2025-12-08 23:53:10,826] Trial 123 finished with value: 0.3102352050262121 and parameters: {'model_type': 'gcn', 'hidden_dims': '[256, 128]', 'dropout': 0.5585291982629627, 'batch_norm': True, 'lr': 0.0022271547128240297, 'weight_decay': 0.0007010013756841022, 'epochs': 62, 'loss': 'mae', 'optimizer': 'adam', 'graph_mode': 'cutoff', 'cutoff': 0.7746665824633109, 'grm_norm': 'cosine_then_gcn', 'self_loops': True, 'use_snp_selection': False}. Best is trial 120 with value: 0.3210667504663244.
