[I 2025-12-08 16:45:50,957] Trial 89 finished with value: 0.3461784088458571 and parameters: {'model_type': 'gcn', 'hidden_dims': '[256, 128]', 'dropout': 0.3069146842301544, 'batch_norm': False, 'lr': 0.00012193227824374591, 'weight_decay': 7.674161064248879e-05, 'epochs': 331, 'loss': 'mse', 'optimizer': 'adam', 'graph_mode': 'cutoff', 'cutoff': 0.3228337970006704, 'grm_norm': 'gcn', 'self_loops': True, 'use_snp_selection': True, 'num_snps': 35224}. Best is trial 64 with value: 0.3748934160983876.
[I 2025-12-08 16:47:04,542] Trial 90 finished with value: 0.2467282325421894 and parameters: {'model_type': 'gcn', 'hidden_dims': '[512, 128]', 'dropout': 0.36581319503084403, 'batch_norm': False, 'lr': 0.00021006525883010847, 'weight_decay': 0.0002120505722890855, 'epochs': 247, 'loss': 'mse', 'optimizer': 'adam', 'graph_mode': 'knn', 'knn_k': 10, 'weighted_edges': True, 'symmetrize_mode': 'union', 'self_loops': False, 'use_snp_selection': True, 'num_snps': 59431}. Best is trial 64 with value: 0.3748934160983876.
[I 2025-12-08 16:47:35,891] Trial 91 finished with value: 0.36546154347932563 and parameters: {'model_type': 'gcn', 'hidden_dims': '[128, 64]', 'dropout': 0.42020883220473426, 'batch_norm': False, 'lr': 0.00010265830645413605, 'weight_decay': 6.0914678697334613e-05, 'epochs': 273, 'loss': 'mse', 'optimizer': 'adam', 'graph_mode': 'knn', 'knn_k': 10, 'weighted_edges': True, 'symmetrize_mode': 'union', 'self_loops': False, 'use_snp_selection': True, 'num_snps': 50023}. Best is trial 64 with value: 0.3748934160983876.
[I 2025-12-08 16:48:06,317] Trial 92 finished with value: 0.3633774279629073 and parameters: {'model_type': 'gcn', 'hidden_dims': '[128, 64]', 'dropout': 0.469388775738747, 'batch_norm': False, 'lr': 7.568197151433294e-05, 'weight_decay': 0.00018104561756813008, 'epochs': 295, 'loss': 'mse', 'optimizer': 'adam', 'graph_mode': 'knn', 'knn_k': 4, 'weighted_edges': True, 'symmetrize_mode': 'union', 'self_loops': False, 'use_snp_selection': True, 'num_snps': 46238}. Best is trial 64 with value: 0.3748934160983876.
[I 2025-12-08 16:48:36,871] Trial 93 finished with value: 0.36678725639550935 and parameters: {'model_type': 'gcn', 'hidden_dims': '[128, 64]', 'dropout': 0.4555714400711908, 'batch_norm': False, 'lr': 9.750430663594959e-05, 'weight_decay': 0.00026315281754609956, 'epochs': 266, 'loss': 'mse', 'optimizer': 'adam', 'graph_mode': 'knn', 'knn_k': 10, 'weighted_edges': True, 'symmetrize_mode': 'union', 'self_loops': False, 'use_snp_selection': True, 'num_snps': 48824}. Best is trial 64 with value: 0.3748934160983876.
[I 2025-12-08 16:49:08,125] Trial 94 finished with value: 0.36492084432741667 and parameters: {'model_type': 'gcn', 'hidden_dims': '[128, 64]', 'dropout': 0.4849672169730708, 'batch_norm': False, 'lr': 0.0002555577860839617, 'weight_decay': 9.594801908047462e-05, 'epochs': 253, 'loss': 'mse', 'optimizer': 'adam', 'graph_mode': 'knn', 'knn_k': 9, 'weighted_edges': True, 'symmetrize_mode': 'union', 'self_loops': False, 'use_snp_selection': True, 'num_snps': 53268}. Best is trial 64 with value: 0.3748934160983876.
[I 2025-12-08 16:49:32,442] Trial 95 finished with value: 0.3670469114558118 and parameters: {'model_type': 'gcn', 'hidden_dims': '[128, 64]', 'dropout': 0.5134390152898439, 'batch_norm': False, 'lr': 6.138755676391709e-05, 'weight_decay': 2.574046855288295e-05, 'epochs': 281, 'loss': 'mse', 'optimizer': 'adam', 'graph_mode': 'knn', 'knn_k': 10, 'weighted_edges': True, 'symmetrize_mode': 'union', 'self_loops': False, 'use_snp_selection': True, 'num_snps': 31903}. Best is trial 64 with value: 0.3748934160983876.
[I 2025-12-08 16:50:04,369] Trial 96 finished with value: 0.28982441797678365 and parameters: {'model_type': 'gcn', 'hidden_dims': '[128, 64]', 'dropout': 0.436284438256833, 'batch_norm': False, 'lr': 0.00017137946282556142, 'weight_decay': 4.701608433974503e-05, 'epochs': 342, 'loss': 'mse', 'optimizer': 'adam', 'graph_mode': 'knn', 'knn_k': 10, 'weighted_edges': True, 'symmetrize_mode': 'union', 'self_loops': False, 'use_snp_selection': True, 'num_snps': 42687}. Best is trial 64 with value: 0.3748934160983876.
[I 2025-12-08 16:50:22,639] Trial 97 finished with value: 0.3668344194885113 and parameters: {'model_type': 'gcn', 'hidden_dims': '[128, 64]', 'dropout': 0.5364995216356576, 'batch_norm': False, 'lr': 4.3655196686236635e-05, 'weight_decay': 0.00018959052549346288, 'epochs': 236, 'loss': 'mse', 'optimizer': 'adam', 'graph_mode': 'knn', 'knn_k': 9, 'weighted_edges': True, 'symmetrize_mode': 'union', 'self_loops': False, 'use_snp_selection': False}. Best is trial 64 with value: 0.3748934160983876.
[I 2025-12-08 16:50:51,058] Trial 98 finished with value: 0.08617996997757224 and parameters: {'model_type': 'gcn', 'hidden_dims': '[128, 64]', 'dropout': 0.45914700457394325, 'batch_norm': False, 'lr': 0.0046930244990553505, 'weight_decay': 0.0001440211463634015, 'epochs': 308, 'loss': 'mse', 'optimizer': 'adam', 'graph_mode': 'knn', 'knn_k': 8, 'weighted_edges': True, 'symmetrize_mode': 'mutual', 'self_loops': False, 'use_snp_selection': True, 'num_snps': 40278}. Best is trial 64 with value: 0.3748934160983876.
[I 2025-12-08 16:51:37,278] Trial 99 finished with value: 0.3574858323303461 and parameters: {'model_type': 'gcn', 'hidden_dims': '[256, 128, 64]', 'dropout': 0.4057577704864064, 'batch_norm': False, 'lr': 7.674242929361303e-05, 'weight_decay': 0.00037332309736165834, 'epochs': 323, 'loss': 'mse', 'optimizer': 'adam', 'graph_mode': 'knn', 'knn_k': 10, 'weighted_edges': True, 'symmetrize_mode': 'union', 'self_loops': False, 'use_snp_selection': True, 'num_snps': 43944}. Best is trial 64 with value: 0.3748934160983876.
[I 2025-12-08 16:51:51,307] Trial 100 finished with value: 0.2990343371988365 and parameters: {'model_type': 'gcn', 'hidden_dims': '[128, 64]', 'dropout': 0.5696132458088567, 'batch_norm': True, 'lr': 5.424361305123609e-05, 'weight_decay': 0.0005520076865471293, 'epochs': 259, 'loss': 'mse', 'optimizer': 'adam', 'graph_mode': 'knn', 'knn_k': 1, 'weighted_edges': True, 'symmetrize_mode': 'union', 'self_loops': False, 'use_snp_selection': True, 'num_snps': 8073}. Best is trial 64 with value: 0.3748934160983876.
[I 2025-12-08 16:52:20,807] Trial 101 finished with value: 0.36684198000042006 and parameters: {'model_type': 'gcn', 'hidden_dims': '[128, 64]', 'dropout': 0.4359408559387443, 'batch_norm': False, 'lr': 2.4835858819222334e-05, 'weight_decay': 0.00010247458653884364, 'epochs': 335, 'loss': 'mse', 'optimizer': 'adam', 'graph_mode': 'knn', 'knn_k': 10, 'weighted_edges': True, 'symmetrize_mode': 'union', 'self_loops': False, 'use_snp_selection': True, 'num_snps': 38373}. Best is trial 64 with value: 0.3748934160983876.
[I 2025-12-08 16:52:49,506] Trial 102 finished with value: 0.37389223484763145 and parameters: {'model_type': 'gcn', 'hidden_dims': '[128, 64]', 'dropout': 0.42921890289546993, 'batch_norm': False, 'lr': 3.1314724178606925e-05, 'weight_decay': 0.00012686451707558883, 'epochs': 337, 'loss': 'mse', 'optimizer': 'adam', 'graph_mode': 'knn', 'knn_k': 10, 'weighted_edges': True, 'symmetrize_mode': 'union', 'self_loops': False, 'use_snp_selection': True, 'num_snps': 36361}. Best is trial 64 with value: 0.3748934160983876.
[I 2025-12-08 16:53:13,784] Trial 103 finished with value: 0.36373070001658697 and parameters: {'model_type': 'gcn', 'hidden_dims': '[128, 64]', 'dropout': 0.422809388265473, 'batch_norm': False, 'lr': 3.107679902361955e-05, 'weight_decay': 0.0001246186852866734, 'epochs': 316, 'loss': 'mse', 'optimizer': 'adam', 'graph_mode': 'knn', 'knn_k': 9, 'weighted_edges': True, 'symmetrize_mode': 'union', 'self_loops': False, 'use_snp_selection': True, 'num_snps': 28403}. Best is trial 64 with value: 0.3748934160983876.
[I 2025-12-08 16:53:39,458] Trial 104 finished with value: 0.37006574673802817 and parameters: {'model_type': 'gcn', 'hidden_dims': '[128, 64]', 'dropout': 0.44804288236919776, 'batch_norm': False, 'lr': 3.6599900131539055e-05, 'weight_decay': 0.0007671659567218814, 'epochs': 271, 'loss': 'mse', 'optimizer': 'adam', 'graph_mode': 'knn', 'knn_k': 10, 'weighted_edges': True, 'symmetrize_mode': 'union', 'self_loops': False, 'use_snp_selection': True, 'num_snps': 36120}. Best is trial 64 with value: 0.3748934160983876.
[I 2025-12-08 16:54:06,570] Trial 105 finished with value: 0.3673056756661757 and parameters: {'model_type': 'gcn', 'hidden_dims': '[128, 64]', 'dropout': 0.38696522508316533, 'batch_norm': False, 'lr': 3.6758674166465006e-05, 'weight_decay': 0.00043916151649027414, 'epochs': 300, 'loss': 'mse', 'optimizer': 'adam', 'graph_mode': 'knn', 'knn_k': 9, 'weighted_edges': True, 'symmetrize_mode': 'union', 'self_loops': False, 'use_snp_selection': True, 'num_snps': 36598}. Best is trial 64 with value: 0.3748934160983876.
[I 2025-12-08 16:54:33,171] Trial 106 finished with value: 0.35358104802614465 and parameters: {'model_type': 'gcn', 'hidden_dims': '[128, 64]', 'dropout': 0.47632992431208243, 'batch_norm': False, 'lr': 2.0100669265750357e-05, 'weight_decay': 0.0008350861723107862, 'epochs': 347, 'loss': 'mse', 'optimizer': 'adam', 'graph_mode': 'cutoff', 'cutoff': 0.675914506892759, 'grm_norm': 'cosine', 'self_loops': False, 'use_snp_selection': True, 'num_snps': 32456}. Best is trial 64 with value: 0.3748934160983876.
[I 2025-12-08 16:55:12,417] Trial 107 finished with value: 0.3556798212950979 and parameters: {'model_type': 'gcn', 'hidden_dims': '[256, 128]', 'dropout': 0.41457590183449955, 'batch_norm': False, 'lr': 4.403992191188187e-05, 'weight_decay': 0.0007690059227009982, 'epochs': 286, 'loss': 'mse', 'optimizer': 'adam', 'graph_mode': 'knn', 'knn_k': 10, 'weighted_edges': True, 'symmetrize_mode': 'union', 'self_loops': True, 'use_snp_selection': True, 'num_snps': 40487}. Best is trial 64 with value: 0.3748934160983876.
[I 2025-12-08 16:55:37,623] Trial 108 finished with value: 0.3545809908065435 and parameters: {'model_type': 'gcn', 'hidden_dims': '[128, 64]', 'dropout': 0.44777191571641767, 'batch_norm': False, 'lr': 1.487536371382648e-05, 'weight_decay': 0.00026003163871464143, 'epochs': 274, 'loss': 'mse', 'optimizer': 'adam', 'graph_mode': 'knn', 'knn_k': 2, 'weighted_edges': True, 'symmetrize_mode': 'union', 'self_loops': False, 'use_snp_selection': True, 'num_snps': 35424}. Best is trial 64 with value: 0.3748934160983876.
[I 2025-12-08 16:55:59,191] Trial 109 finished with value: 0.3734708448997806 and parameters: {'model_type': 'gcn', 'hidden_dims': '[128, 64]', 'dropout': 0.4915828475197284, 'batch_norm': False, 'lr': 1.2900054359977527e-05, 'weight_decay': 0.0007151874492300982, 'epochs': 227, 'loss': 'mse', 'optimizer': 'adam', 'graph_mode': 'knn', 'knn_k': 10, 'weighted_edges': True, 'symmetrize_mode': 'union', 'self_loops': False, 'use_snp_selection': True, 'num_snps': 29054}. Best is trial 64 with value: 0.3748934160983876.
[I 2025-12-08 16:56:16,371] Trial 110 finished with value: 0.3703704756704533 and parameters: {'model_type': 'gcn', 'hidden_dims': '[128, 64]', 'dropout': 0.49751415195155735, 'batch_norm': False, 'lr': 2.8232850143859444e-05, 'weight_decay': 0.0007068924519397888, 'epochs': 211, 'loss': 'mse', 'optimizer': 'adam', 'graph_mode': 'knn', 'knn_k': 10, 'weighted_edges': True, 'symmetrize_mode': 'union', 'self_loops': False, 'use_snp_selection': False}. Best is trial 64 with value: 0.3748934160983876.
[I 2025-12-08 16:56:32,792] Trial 111 finished with value: 0.3690569158535785 and parameters: {'model_type': 'gcn', 'hidden_dims': '[128, 64]', 'dropout': 0.5066213563540439, 'batch_norm': False, 'lr': 2.656828537751472e-05, 'weight_decay': 0.0006932425153910438, 'epochs': 207, 'loss': 'mse', 'optimizer': 'adam', 'graph_mode': 'knn', 'knn_k': 10, 'weighted_edges': True, 'symmetrize_mode': 'union', 'self_loops': False, 'use_snp_selection': False}. Best is trial 64 with value: 0.3748934160983876.
[I 2025-12-08 16:56:47,766] Trial 112 finished with value: 0.36302573360662077 and parameters: {'model_type': 'gcn', 'hidden_dims': '[128, 64]', 'dropout': 0.522073664375803, 'batch_norm': False, 'lr': 1.2067294373202197e-05, 'weight_decay': 0.0009954531962253338, 'epochs': 186, 'loss': 'mse', 'optimizer': 'adam', 'graph_mode': 'knn', 'knn_k': 10, 'weighted_edges': True, 'symmetrize_mode': 'union', 'self_loops': False, 'use_snp_selection': False}. Best is trial 64 with value: 0.3748934160983876.
[I 2025-12-08 16:57:05,112] Trial 113 finished with value: 0.3738135949220753 and parameters: {'model_type': 'gcn', 'hidden_dims': '[128, 64]', 'dropout': 0.4985329408364422, 'batch_norm': False, 'lr': 3.356578367351781e-05, 'weight_decay': 0.000740537135935722, 'epochs': 223, 'loss': 'mse', 'optimizer': 'adam', 'graph_mode': 'knn', 'knn_k': 10, 'weighted_edges': True, 'symmetrize_mode': 'union', 'self_loops': False, 'use_snp_selection': False}. Best is trial 64 with value: 0.3748934160983876.
[I 2025-12-08 16:57:22,022] Trial 114 finished with value: 0.37214071533311144 and parameters: {'model_type': 'gcn', 'hidden_dims': '[128, 64]', 'dropout': 0.4938892978755928, 'batch_norm': False, 'lr': 3.207731357829433e-05, 'weight_decay': 0.0005140106337087157, 'epochs': 215, 'loss': 'mse', 'optimizer': 'adam', 'graph_mode': 'knn', 'knn_k': 10, 'weighted_edges': True, 'symmetrize_mode': 'union', 'self_loops': False, 'use_snp_selection': False}. Best is trial 64 with value: 0.3748934160983876.
[I 2025-12-08 16:57:39,640] Trial 115 finished with value: 0.37414375245161435 and parameters: {'model_type': 'gcn', 'hidden_dims': '[128, 64]', 'dropout': 0.4920453889257279, 'batch_norm': False, 'lr': 5.006829516324381e-05, 'weight_decay': 0.0005355885763980254, 'epochs': 226, 'loss': 'mse', 'optimizer': 'adam', 'graph_mode': 'knn', 'knn_k': 9, 'weighted_edges': True, 'symmetrize_mode': 'union', 'self_loops': False, 'use_snp_selection': False}. Best is trial 64 with value: 0.3748934160983876.
[I 2025-12-08 16:57:57,308] Trial 116 finished with value: 0.36076039066582016 and parameters: {'model_type': 'gcn', 'hidden_dims': '[128, 64]', 'dropout': 0.4921387069142201, 'batch_norm': False, 'lr': 4.69722907275512e-05, 'weight_decay': 0.0005364539841134693, 'epochs': 227, 'loss': 'mse', 'optimizer': 'adam', 'graph_mode': 'knn', 'knn_k': 10, 'weighted_edges': True, 'symmetrize_mode': 'union', 'self_loops': False, 'use_snp_selection': False}. Best is trial 64 with value: 0.3748934160983876.
[I 2025-12-08 16:58:12,794] Trial 117 finished with value: 0.36475634174366767 and parameters: {'model_type': 'gcn', 'hidden_dims': '[128, 64]', 'dropout': 0.5297977274634008, 'batch_norm': False, 'lr': 3.206326110986498e-05, 'weight_decay': 0.0005945441286078708, 'epochs': 199, 'loss': 'mse', 'optimizer': 'adam', 'graph_mode': 'knn', 'knn_k': 10, 'weighted_edges': True, 'symmetrize_mode': 'mutual', 'self_loops': False, 'use_snp_selection': False}. Best is trial 64 with value: 0.3748934160983876.
[I 2025-12-08 16:58:29,502] Trial 118 finished with value: 0.35569915757654513 and parameters: {'model_type': 'gcn', 'hidden_dims': '[128, 64]', 'dropout': 0.5097289911812947, 'batch_norm': False, 'lr': 6.394778172153568e-05, 'weight_decay': 0.00045830066386604495, 'epochs': 214, 'loss': 'mse', 'optimizer': 'adam', 'graph_mode': 'knn', 'knn_k': 9, 'weighted_edges': True, 'symmetrize_mode': 'union', 'self_loops': False, 'use_snp_selection': False}. Best is trial 64 with value: 0.3748934160983876.
[I 2025-12-08 16:59:28,615] Trial 119 finished with value: 0.37614484737654263 and parameters: {'model_type': 'gcn', 'hidden_dims': '[512, 128]', 'dropout': 0.488829808764762, 'batch_norm': False, 'lr': 2.1621156606488772e-05, 'weight_decay': 0.0004142630797726363, 'epochs': 225, 'loss': 'mse', 'optimizer': 'adam', 'graph_mode': 'knn', 'knn_k': 10, 'weighted_edges': True, 'symmetrize_mode': 'union', 'self_loops': False, 'use_snp_selection': False}. Best is trial 119 with value: 0.37614484737654263.
[I 2025-12-08 17:00:25,806] Trial 120 finished with value: 0.3692129386812064 and parameters: {'model_type': 'gcn', 'hidden_dims': '[512, 128]', 'dropout': 0.4907980448836735, 'batch_norm': False, 'lr': 2.1972518831646857e-05, 'weight_decay': 0.00034702187838319516, 'epochs': 218, 'loss': 'mse', 'optimizer': 'adam', 'graph_mode': 'knn', 'knn_k': 9, 'weighted_edges': True, 'symmetrize_mode': 'union', 'self_loops': False, 'use_snp_selection': False}. Best is trial 119 with value: 0.37614484737654263.
[I 2025-12-08 17:01:25,582] Trial 121 finished with value: 0.36496004960933653 and parameters: {'model_type': 'gcn', 'hidden_dims': '[512, 128]', 'dropout': 0.46937116017645086, 'batch_norm': False, 'lr': 4.2118711731238424e-05, 'weight_decay': 0.0003930264396474237, 'epochs': 228, 'loss': 'mse', 'optimizer': 'adam', 'graph_mode': 'knn', 'knn_k': 10, 'weighted_edges': True, 'symmetrize_mode': 'union', 'self_loops': False, 'use_snp_selection': False}. Best is trial 119 with value: 0.37614484737654263.
[I 2025-12-08 17:02:16,724] Trial 122 finished with value: 0.34761278661388795 and parameters: {'model_type': 'gcn', 'hidden_dims': '[512, 128]', 'dropout': 0.5179701967744019, 'batch_norm': False, 'lr': 5.175195201934721e-05, 'weight_decay': 0.0005216140988221131, 'epochs': 193, 'loss': 'mse', 'optimizer': 'adam', 'graph_mode': 'knn', 'knn_k': 10, 'weighted_edges': True, 'symmetrize_mode': 'union', 'self_loops': False, 'use_snp_selection': False}. Best is trial 119 with value: 0.37614484737654263.
[I 2025-12-08 17:03:19,952] Trial 123 finished with value: 0.36901035395429715 and parameters: {'model_type': 'gcn', 'hidden_dims': '[512, 128]', 'dropout': 0.482031740164955, 'batch_norm': False, 'lr': 1.810746726596659e-05, 'weight_decay': 0.00030703205655636717, 'epochs': 242, 'loss': 'mse', 'optimizer': 'adam', 'graph_mode': 'knn', 'knn_k': 10, 'weighted_edges': True, 'symmetrize_mode': 'union', 'self_loops': False, 'use_snp_selection': False}. Best is trial 119 with value: 0.37614484737654263.
[I 2025-12-08 17:03:38,500] Trial 124 finished with value: 0.36870384979782483 and parameters: {'model_type': 'gcn', 'hidden_dims': '[128, 64]', 'dropout': 0.5022942497094691, 'batch_norm': False, 'lr': 3.48673010192075e-05, 'weight_decay': 0.00019305437917617504, 'epochs': 222, 'loss': 'mse', 'optimizer': 'adam', 'graph_mode': 'knn', 'knn_k': 10, 'weighted_edges': True, 'symmetrize_mode': 'union', 'self_loops': False, 'use_snp_selection': False}. Best is trial 119 with value: 0.37614484737654263.
[I 2025-12-08 17:04:39,891] Trial 125 finished with value: 0.3239547609163401 and parameters: {'model_type': 'gcn', 'hidden_dims': '[512, 64]', 'dropout': 0.47593177688302635, 'batch_norm': True, 'lr': 2.2874888791129688e-05, 'weight_decay': 0.0006206813622361306, 'epochs': 235, 'loss': 'mse', 'optimizer': 'adam', 'graph_mode': 'knn', 'knn_k': 9, 'weighted_edges': True, 'symmetrize_mode': 'union', 'self_loops': False, 'use_snp_selection': False}. Best is trial 119 with value: 0.37614484737654263.
[I 2025-12-08 17:04:57,025] Trial 126 finished with value: 0.36966062909355907 and parameters: {'model_type': 'gcn', 'hidden_dims': '[128, 64]', 'dropout': 0.5322480785764746, 'batch_norm': False, 'lr': 2.9724766146137535e-05, 'weight_decay': 0.0002214538647178534, 'epochs': 213, 'loss': 'mse', 'optimizer': 'adam', 'graph_mode': 'knn', 'knn_k': 10, 'weighted_edges': True, 'symmetrize_mode': 'union', 'self_loops': False, 'use_snp_selection': False}. Best is trial 119 with value: 0.37614484737654263.
[I 2025-12-08 17:05:12,779] Trial 127 finished with value: 0.35301827685659865 and parameters: {'model_type': 'gcn', 'hidden_dims': '[128, 64]', 'dropout': 0.4916775266442744, 'batch_norm': False, 'lr': 5.49527843554024e-05, 'weight_decay': 0.00044933707801746495, 'epochs': 206, 'loss': 'mse', 'optimizer': 'adam', 'graph_mode': 'cutoff', 'cutoff': 0.4822968615337413, 'grm_norm': 'cosine_then_gcn', 'self_loops': True, 'use_snp_selection': False}. Best is trial 119 with value: 0.37614484737654263.
[I 2025-12-08 17:05:31,831] Trial 128 finished with value: 0.3632574340519998 and parameters: {'model_type': 'gcn', 'hidden_dims': '[128, 64]', 'dropout': 0.5432388733513566, 'batch_norm': False, 'lr': 4.094432545132785e-05, 'weight_decay': 0.00016128558641713325, 'epochs': 247, 'loss': 'mse', 'optimizer': 'adam', 'graph_mode': 'knn', 'knn_k': 10, 'weighted_edges': True, 'symmetrize_mode': 'union', 'self_loops': False, 'use_snp_selection': False}. Best is trial 119 with value: 0.37614484737654263.
[I 2025-12-08 17:05:50,088] Trial 129 finished with value: 0.36871560756322264 and parameters: {'model_type': 'gcn', 'hidden_dims': '[128, 64]', 'dropout': 0.4642553128197616, 'batch_norm': False, 'lr': 1.3101037731866089e-05, 'weight_decay': 0.00025506198531206426, 'epochs': 237, 'loss': 'mse', 'optimizer': 'adam', 'graph_mode': 'knn', 'knn_k': 9, 'weighted_edges': True, 'symmetrize_mode': 'union', 'self_loops': False, 'use_snp_selection': False}. Best is trial 119 with value: 0.37614484737654263.
[I 2025-12-08 17:06:50,430] Trial 130 finished with value: 0.3677034648555265 and parameters: {'model_type': 'gcn', 'hidden_dims': '[512, 128]', 'dropout': 0.5031701729903864, 'batch_norm': False, 'lr': 1.7610358550631174e-05, 'weight_decay': 0.0003308721462023279, 'epochs': 230, 'loss': 'mse', 'optimizer': 'adam', 'graph_mode': 'knn', 'knn_k': 10, 'weighted_edges': True, 'symmetrize_mode': 'union', 'self_loops': False, 'use_snp_selection': False}. Best is trial 119 with value: 0.37614484737654263.
[I 2025-12-08 17:07:09,929] Trial 131 finished with value: 0.368018180056325 and parameters: {'model_type': 'gcn', 'hidden_dims': '[128, 64]', 'dropout': 0.4008145345200246, 'batch_norm': False, 'lr': 7.467898442936246e-05, 'weight_decay': 0.00013220684860398927, 'epochs': 255, 'loss': 'mse', 'optimizer': 'adam', 'graph_mode': 'knn', 'knn_k': 9, 'weighted_edges': True, 'symmetrize_mode': 'union', 'self_loops': False, 'use_snp_selection': False}. Best is trial 119 with value: 0.37614484737654263.
