[I 2025-12-08 18:35:40,385] Trial 1 finished with value: 0.2179590972564538 and parameters: {'model_type': 'gcn', 'hidden_dims': '[256, 128, 64]', 'dropout': 0.5543244404043342, 'batch_norm': True, 'lr': 7.981787657617978e-05, 'weight_decay': 2.8571789869344834e-07, 'epochs': 297, 'loss': 'mae', 'optimizer': 'adam', 'graph_mode': 'cutoff', 'cutoff': 0.3392632777751686, 'grm_norm': 'gcn', 'self_loops': False, 'use_snp_selection': False}. Best is trial 0 with value: 0.274934529396374.
[I 2025-12-08 18:36:38,157] Trial 2 finished with value: 0.2643193405275343 and parameters: {'model_type': 'gcn', 'hidden_dims': '[512, 64]', 'dropout': 0.32815227354739207, 'batch_norm': True, 'lr': 0.000619605044204259, 'weight_decay': 0.0004086269831625786, 'epochs': 206, 'loss': 'mse', 'optimizer': 'adam', 'graph_mode': 'knn', 'knn_k': 4, 'weighted_edges': True, 'symmetrize_mode': 'union', 'self_loops': True, 'use_snp_selection': True, 'num_snps': 53035}. Best is trial 0 with value: 0.274934529396374.
[I 2025-12-08 18:37:05,713] Trial 3 finished with value: 0.2567251503225095 and parameters: {'model_type': 'gcn', 'hidden_dims': '[256, 128]', 'dropout': 0.23110783056597514, 'batch_norm': True, 'lr': 8.11311593386298e-05, 'weight_decay': 9.296158109581328e-07, 'epochs': 213, 'loss': 'mse', 'optimizer': 'adam', 'graph_mode': 'knn', 'knn_k': 10, 'weighted_edges': True, 'symmetrize_mode': 'mutual', 'self_loops': True, 'use_snp_selection': False}. Best is trial 0 with value: 0.274934529396374.
[I 2025-12-08 18:37:20,168] Trial 4 finished with value: 0.3483617631392498 and parameters: {'model_type': 'gcn', 'hidden_dims': '[512, 256]', 'dropout': 0.2753281956415665, 'batch_norm': True, 'lr': 0.00034435188114839693, 'weight_decay': 4.9416012835950194e-05, 'epochs': 89, 'loss': 'mae', 'optimizer': 'adam', 'graph_mode': 'cutoff', 'cutoff': 0.820078967317394, 'grm_norm': 'none', 'self_loops': False, 'use_snp_selection': True, 'num_snps': 12674}. Best is trial 4 with value: 0.3483617631392498.
[I 2025-12-08 18:37:45,356] Trial 5 finished with value: 0.32454025102263523 and parameters: {'model_type': 'gcn', 'hidden_dims': '[128, 64]', 'dropout': 0.5611163934517731, 'batch_norm': True, 'lr': 0.0003984856210762587, 'weight_decay': 1.1466743517565185e-07, 'epochs': 344, 'loss': 'mae', 'optimizer': 'adam', 'graph_mode': 'cutoff', 'cutoff': 0.6089370799714728, 'grm_norm': 'gcn', 'self_loops': True, 'use_snp_selection': False}. Best is trial 4 with value: 0.3483617631392498.
[I 2025-12-08 18:38:07,727] Trial 6 finished with value: 0.2974684406228381 and parameters: {'model_type': 'gcn', 'hidden_dims': '[128, 64]', 'dropout': 0.31805912766941713, 'batch_norm': True, 'lr': 1.2361026034262557e-05, 'weight_decay': 6.492620232791903e-06, 'epochs': 271, 'loss': 'mse', 'optimizer': 'adam', 'graph_mode': 'cutoff', 'cutoff': 0.6193362582230448, 'grm_norm': 'cosine', 'self_loops': False, 'use_snp_selection': True, 'num_snps': 28594}. Best is trial 4 with value: 0.3483617631392498.
[I 2025-12-08 18:38:27,516] Trial 7 finished with value: 0.23329752271171333 and parameters: {'model_type': 'gcn', 'hidden_dims': '[512, 64]', 'dropout': 0.471337288649717, 'batch_norm': True, 'lr': 2.239693207292708e-05, 'weight_decay': 2.263166635514082e-06, 'epochs': 69, 'loss': 'mse', 'optimizer': 'adam', 'graph_mode': 'cutoff', 'cutoff': 0.4056820886426376, 'grm_norm': 'cosine', 'self_loops': False, 'use_snp_selection': False}. Best is trial 4 with value: 0.3483617631392498.
[I 2025-12-08 18:39:04,833] Trial 8 finished with value: 0.343181241803513 and parameters: {'model_type': 'gcn', 'hidden_dims': '[512, 256]', 'dropout': 0.20659328268932406, 'batch_norm': False, 'lr': 8.93315124361372e-05, 'weight_decay': 0.00028987480727919035, 'epochs': 136, 'loss': 'mae', 'optimizer': 'adam', 'graph_mode': 'knn', 'knn_k': 3, 'weighted_edges': False, 'symmetrize_mode': 'union', 'self_loops': False, 'use_snp_selection': True, 'num_snps': 43128}. Best is trial 4 with value: 0.3483617631392498.
[I 2025-12-08 18:39:46,942] Trial 9 finished with value: -0.023339578255136724 and parameters: {'model_type': 'gcn', 'hidden_dims': '[512, 256]', 'dropout': 0.2888209592870401, 'batch_norm': False, 'lr': 0.004734648143129892, 'weight_decay': 1.5879705591356368e-06, 'epochs': 163, 'loss': 'mse', 'optimizer': 'adam', 'graph_mode': 'cutoff', 'cutoff': 0.5984899797909019, 'grm_norm': 'cosine', 'self_loops': True, 'use_snp_selection': False}. Best is trial 4 with value: 0.3483617631392498.
[I 2025-12-08 18:39:55,984] Trial 10 finished with value: 0.3146087807973556 and parameters: {'model_type': 'gcn', 'hidden_dims': '[512, 128]', 'dropout': 0.11372025982957354, 'batch_norm': False, 'lr': 0.0023343012062770553, 'weight_decay': 4.14440562940608e-05, 'epochs': 41, 'loss': 'mae', 'optimizer': 'adam', 'graph_mode': 'cutoff', 'cutoff': 0.8740100033033124, 'grm_norm': 'none', 'self_loops': False, 'use_snp_selection': True, 'num_snps': 3859}. Best is trial 4 with value: 0.3483617631392498.
[I 2025-12-08 18:40:32,059] Trial 11 finished with value: 0.33551376532697696 and parameters: {'model_type': 'gcn', 'hidden_dims': '[512, 256]', 'dropout': 0.42220860806405436, 'batch_norm': False, 'lr': 0.00012587284186352953, 'weight_decay': 0.0006590033092812647, 'epochs': 114, 'loss': 'mae', 'optimizer': 'adam', 'graph_mode': 'knn', 'knn_k': 1, 'weighted_edges': False, 'symmetrize_mode': 'union', 'self_loops': False, 'use_snp_selection': True, 'num_snps': 47068}. Best is trial 4 with value: 0.3483617631392498.
[I 2025-12-08 18:40:46,617] Trial 12 finished with value: 0.3407926594910843 and parameters: {'model_type': 'gcn', 'hidden_dims': '[512, 256]', 'dropout': 0.14142767069304862, 'batch_norm': False, 'lr': 0.0011798598123878552, 'weight_decay': 9.414718277089941e-05, 'epochs': 124, 'loss': 'mae', 'optimizer': 'adam', 'graph_mode': 'knn', 'knn_k': 3, 'weighted_edges': False, 'symmetrize_mode': 'union', 'self_loops': False, 'use_snp_selection': True, 'num_snps': 8584}. Best is trial 4 with value: 0.3483617631392498.
[I 2025-12-08 18:41:17,281] Trial 13 finished with value: 0.34769674852985244 and parameters: {'model_type': 'gcn', 'hidden_dims': '[512, 256]', 'dropout': 0.23483876358445724, 'batch_norm': False, 'lr': 0.00018005512155234809, 'weight_decay': 0.00018148625050029915, 'epochs': 101, 'loss': 'mae', 'optimizer': 'adam', 'graph_mode': 'knn', 'knn_k': 6, 'weighted_edges': False, 'symmetrize_mode': 'union', 'self_loops': False, 'use_snp_selection': True, 'num_snps': 39863}. Best is trial 4 with value: 0.3483617631392498.
[I 2025-12-08 18:41:34,036] Trial 14 finished with value: 0.35885668038259805 and parameters: {'model_type': 'gcn', 'hidden_dims': '[512, 256]', 'dropout': 0.4254746032272495, 'batch_norm': False, 'lr': 0.0002379532657617651, 'weight_decay': 2.2203297076850073e-05, 'epochs': 82, 'loss': 'mae', 'optimizer': 'adam', 'graph_mode': 'cutoff', 'cutoff': 0.8944237199027842, 'grm_norm': 'none', 'self_loops': False, 'use_snp_selection': True, 'num_snps': 18062}. Best is trial 14 with value: 0.35885668038259805.
[I 2025-12-08 18:41:47,066] Trial 15 finished with value: 0.32383869964616513 and parameters: {'model_type': 'gcn', 'hidden_dims': '[256, 128, 64]', 'dropout': 0.4038548841002544, 'batch_norm': False, 'lr': 0.0009999216920007895, 'weight_decay': 1.3728672854267767e-05, 'epochs': 70, 'loss': 'mae', 'optimizer': 'adam', 'graph_mode': 'cutoff', 'cutoff': 0.8872255416714164, 'grm_norm': 'none', 'self_loops': False, 'use_snp_selection': True, 'num_snps': 15581}. Best is trial 14 with value: 0.35885668038259805.
[I 2025-12-08 18:42:10,923] Trial 16 finished with value: 0.3442150335072163 and parameters: {'model_type': 'gcn', 'hidden_dims': '[512, 128]', 'dropout': 0.4816899998625315, 'batch_norm': True, 'lr': 3.324514570871406e-05, 'weight_decay': 1.585184858108273e-05, 'epochs': 179, 'loss': 'mae', 'optimizer': 'adam', 'graph_mode': 'cutoff', 'cutoff': 0.7714575519927706, 'grm_norm': 'none', 'self_loops': False, 'use_snp_selection': True, 'num_snps': 18042}. Best is trial 14 with value: 0.35885668038259805.
[I 2025-12-08 18:42:25,700] Trial 17 finished with value: 0.31260396299787213 and parameters: {'model_type': 'gcn', 'hidden_dims': '[512, 256]', 'dropout': 0.39676531083157673, 'batch_norm': False, 'lr': 0.00021158082341882003, 'weight_decay': 5.633813841868188e-06, 'epochs': 47, 'loss': 'mae', 'optimizer': 'adam', 'graph_mode': 'cutoff', 'cutoff': 0.7430449078328386, 'grm_norm': 'cosine_then_gcn', 'self_loops': False, 'use_snp_selection': True, 'num_snps': 19181}. Best is trial 14 with value: 0.35885668038259805.
[I 2025-12-08 18:42:38,361] Trial 18 finished with value: 0.2295322229241596 and parameters: {'model_type': 'gcn', 'hidden_dims': '[256, 128]', 'dropout': 0.2802852368181955, 'batch_norm': False, 'lr': 0.009001403382035356, 'weight_decay': 2.9935088137514655e-05, 'epochs': 92, 'loss': 'mae', 'optimizer': 'adam', 'graph_mode': 'cutoff', 'cutoff': 0.2071604959820907, 'grm_norm': 'none', 'self_loops': False, 'use_snp_selection': True, 'num_snps': 12022}. Best is trial 14 with value: 0.35885668038259805.
[I 2025-12-08 18:43:04,579] Trial 19 finished with value: 0.3421487854333519 and parameters: {'model_type': 'gcn', 'hidden_dims': '[512, 256]', 'dropout': 0.3699065019632123, 'batch_norm': True, 'lr': 0.00038332305559555277, 'weight_decay': 0.00013429792469499315, 'epochs': 157, 'loss': 'mae', 'optimizer': 'adam', 'graph_mode': 'cutoff', 'cutoff': 0.75565169836058, 'grm_norm': 'none', 'self_loops': False, 'use_snp_selection': True, 'num_snps': 23457}. Best is trial 14 with value: 0.35885668038259805.
[I 2025-12-08 18:43:50,242] Trial 20 finished with value: 0.3347802156502181 and parameters: {'model_type': 'gcn', 'hidden_dims': '[512, 256]', 'dropout': 0.3496105237243312, 'batch_norm': True, 'lr': 0.0016194321539259127, 'weight_decay': 2.436140887713321e-05, 'epochs': 236, 'loss': 'mae', 'optimizer': 'adam', 'graph_mode': 'cutoff', 'cutoff': 0.8899291235748714, 'grm_norm': 'cosine_then_gcn', 'self_loops': False, 'use_snp_selection': True, 'num_snps': 35605}. Best is trial 14 with value: 0.35885668038259805.
[I 2025-12-08 18:44:18,782] Trial 21 finished with value: 0.3439881548158922 and parameters: {'model_type': 'gcn', 'hidden_dims': '[512, 256]', 'dropout': 0.25030480949044603, 'batch_norm': False, 'lr': 0.00018930453896711866, 'weight_decay': 0.00018050109945499818, 'epochs': 97, 'loss': 'mae', 'optimizer': 'adam', 'graph_mode': 'knn', 'knn_k': 7, 'weighted_edges': False, 'symmetrize_mode': 'union', 'self_loops': False, 'use_snp_selection': True, 'num_snps': 36936}. Best is trial 14 with value: 0.35885668038259805.
[I 2025-12-08 18:44:56,045] Trial 22 finished with value: 0.33925153547304865 and parameters: {'model_type': 'gcn', 'hidden_dims': '[512, 256]', 'dropout': 0.16717393036001535, 'batch_norm': False, 'lr': 0.0005297449947852019, 'weight_decay': 6.157914889162165e-05, 'epochs': 85, 'loss': 'mae', 'optimizer': 'adam', 'graph_mode': 'knn', 'knn_k': 6, 'weighted_edges': False, 'symmetrize_mode': 'mutual', 'self_loops': False, 'use_snp_selection': True, 'num_snps': 59991}. Best is trial 14 with value: 0.35885668038259805.
[I 2025-12-08 18:45:08,517] Trial 23 finished with value: 0.34570339444497183 and parameters: {'model_type': 'gcn', 'hidden_dims': '[512, 256]', 'dropout': 0.45853014304910344, 'batch_norm': False, 'lr': 0.00020254699847515527, 'weight_decay': 0.0009049812308445456, 'epochs': 138, 'loss': 'mae', 'optimizer': 'adam', 'graph_mode': 'knn', 'knn_k': 10, 'weighted_edges': False, 'symmetrize_mode': 'union', 'self_loops': False, 'use_snp_selection': True, 'num_snps': 2649}. Best is trial 14 with value: 0.35885668038259805.
[I 2025-12-08 18:45:36,665] Trial 24 finished with value: 0.3536050180896081 and parameters: {'model_type': 'gcn', 'hidden_dims': '[512, 256]', 'dropout': 0.3065975568309981, 'batch_norm': False, 'lr': 0.0007219558911690228, 'weight_decay': 0.00021366700973591836, 'epochs': 109, 'loss': 'mae', 'optimizer': 'adam', 'graph_mode': 'cutoff', 'cutoff': 0.7287094068830681, 'grm_norm': 'none', 'self_loops': False, 'use_snp_selection': True, 'num_snps': 35432}. Best is trial 14 with value: 0.35885668038259805.
[I 2025-12-08 18:45:54,985] Trial 25 finished with value: 0.36126225089020203 and parameters: {'model_type': 'gcn', 'hidden_dims': '[512, 128]', 'dropout': 0.5089338218585711, 'batch_norm': False, 'lr': 0.00072086003720805, 'weight_decay': 7.967243125538394e-06, 'epochs': 73, 'loss': 'mae', 'optimizer': 'adam', 'graph_mode': 'cutoff', 'cutoff': 0.7881035345189473, 'grm_norm': 'none', 'self_loops': False, 'use_snp_selection': True, 'num_snps': 23848}. Best is trial 25 with value: 0.36126225089020203.
[I 2025-12-08 18:46:09,875] Trial 26 finished with value: 0.001298069566481915 and parameters: {'model_type': 'gcn', 'hidden_dims': '[512, 128]', 'dropout': 0.5108497442909126, 'batch_norm': False, 'lr': 0.0033519725191226857, 'weight_decay': 2.2059403258543174e-06, 'epochs': 50, 'loss': 'mse', 'optimizer': 'adam', 'graph_mode': 'cutoff', 'cutoff': 0.6869484681786342, 'grm_norm': 'none', 'self_loops': True, 'use_snp_selection': False}. Best is trial 25 with value: 0.36126225089020203.
[I 2025-12-08 18:46:28,014] Trial 27 finished with value: 0.15693294887603423 and parameters: {'model_type': 'gcn', 'hidden_dims': '[512, 128]', 'dropout': 0.5202479085381649, 'batch_norm': False, 'lr': 0.0008389913510242628, 'weight_decay': 4.797601541642166e-06, 'epochs': 70, 'loss': 'mae', 'optimizer': 'adam', 'graph_mode': 'cutoff', 'cutoff': 0.4787395190645723, 'grm_norm': 'none', 'self_loops': False, 'use_snp_selection': True, 'num_snps': 23759}. Best is trial 25 with value: 0.36126225089020203.
[I 2025-12-08 18:46:59,921] Trial 28 finished with value: 0.2079382918276373 and parameters: {'model_type': 'gcn', 'hidden_dims': '[512, 128]', 'dropout': 0.5856179029264696, 'batch_norm': False, 'lr': 0.0015724799793057139, 'weight_decay': 8.584763130309437e-06, 'epochs': 150, 'loss': 'mae', 'optimizer': 'adam', 'graph_mode': 'cutoff', 'cutoff': 0.709748962396111, 'grm_norm': 'none', 'self_loops': False, 'use_snp_selection': True, 'num_snps': 32886}. Best is trial 25 with value: 0.36126225089020203.
[I 2025-12-08 18:47:18,129] Trial 29 finished with value: 0.3409009637582222 and parameters: {'model_type': 'gcn', 'hidden_dims': '[256, 128, 64]', 'dropout': 0.4427449238265445, 'batch_norm': False, 'lr': 4.351467565735652e-05, 'weight_decay': 5.710594765332296e-07, 'epochs': 122, 'loss': 'mae', 'optimizer': 'adam', 'graph_mode': 'cutoff', 'cutoff': 0.8063776898825832, 'grm_norm': 'none', 'self_loops': True, 'use_snp_selection': True, 'num_snps': 24143}. Best is trial 25 with value: 0.36126225089020203.
[I 2025-12-08 18:47:44,111] Trial 30 finished with value: 0.12952458978357917 and parameters: {'model_type': 'gcn', 'hidden_dims': '[512, 64]', 'dropout': 0.5060988927327585, 'batch_norm': False, 'lr': 0.0008734380877731189, 'weight_decay': 3.4211565554026058e-06, 'epochs': 112, 'loss': 'mae', 'optimizer': 'adam', 'graph_mode': 'cutoff', 'cutoff': 0.6710923727215625, 'grm_norm': 'cosine_then_gcn', 'self_loops': False, 'use_snp_selection': True, 'num_snps': 30869}. Best is trial 25 with value: 0.36126225089020203.
[I 2025-12-08 18:47:55,671] Trial 31 finished with value: 0.351313804661037 and parameters: {'model_type': 'gcn', 'hidden_dims': '[256, 128]', 'dropout': 0.2803204701513345, 'batch_norm': False, 'lr': 0.0003295720328085025, 'weight_decay': 5.40660190769421e-05, 'epochs': 77, 'loss': 'mae', 'optimizer': 'adam', 'graph_mode': 'cutoff', 'cutoff': 0.8168084606260532, 'grm_norm': 'none', 'self_loops': False, 'use_snp_selection': True, 'num_snps': 11776}. Best is trial 25 with value: 0.36126225089020203.
[I 2025-12-08 18:48:09,762] Trial 32 finished with value: 0.34635045995695923 and parameters: {'model_type': 'gcn', 'hidden_dims': '[256, 128]', 'dropout': 0.36464689077910595, 'batch_norm': False, 'lr': 0.000509312925089908, 'weight_decay': 1.786386586227129e-05, 'epochs': 66, 'loss': 'mae', 'optimizer': 'adam', 'graph_mode': 'cutoff', 'cutoff': 0.824000008313533, 'grm_norm': 'none', 'self_loops': False, 'use_snp_selection': True, 'num_snps': 21309}. Best is trial 25 with value: 0.36126225089020203.
[I 2025-12-08 18:48:30,260] Trial 33 finished with value: 0.3156900469365933 and parameters: {'model_type': 'gcn', 'hidden_dims': '[256, 128]', 'dropout': 0.3146231663912239, 'batch_norm': False, 'lr': 0.000706165268685362, 'weight_decay': 9.084828264205323e-05, 'epochs': 315, 'loss': 'mae', 'optimizer': 'adam', 'graph_mode': 'cutoff', 'cutoff': 0.8260909958463297, 'grm_norm': 'none', 'self_loops': False, 'use_snp_selection': True, 'num_snps': 14302}. Best is trial 25 with value: 0.36126225089020203.
[I 2025-12-08 18:48:39,200] Trial 34 finished with value: 0.039666440559668316 and parameters: {'model_type': 'gcn', 'hidden_dims': '[256, 128]', 'dropout': 0.5378293790699463, 'batch_norm': False, 'lr': 0.0002919454528699734, 'weight_decay': 0.000287191443674494, 'epochs': 59, 'loss': 'mae', 'optimizer': 'adam', 'graph_mode': 'cutoff', 'cutoff': 0.7858402428686729, 'grm_norm': 'none', 'self_loops': False, 'use_snp_selection': False}. Best is trial 25 with value: 0.36126225089020203.
[I 2025-12-08 18:48:49,888] Trial 35 finished with value: 0.35147891719463903 and parameters: {'model_type': 'gcn', 'hidden_dims': '[256, 128]', 'dropout': 0.3869583630425557, 'batch_norm': False, 'lr': 0.00013805869328049027, 'weight_decay': 3.233405834971516e-05, 'epochs': 83, 'loss': 'mse', 'optimizer': 'adam', 'graph_mode': 'cutoff', 'cutoff': 0.8460738511497918, 'grm_norm': 'gcn', 'self_loops': True, 'use_snp_selection': True, 'num_snps': 8375}. Best is trial 25 with value: 0.36126225089020203.
[I 2025-12-08 18:49:01,635] Trial 36 finished with value: 0.35046334457878137 and parameters: {'model_type': 'gcn', 'hidden_dims': '[128, 64]', 'dropout': 0.4383333034458614, 'batch_norm': False, 'lr': 5.262196456209887e-05, 'weight_decay': 1.2869736825333554e-05, 'epochs': 186, 'loss': 'mse', 'optimizer': 'adam', 'graph_mode': 'cutoff', 'cutoff': 0.8951869452872045, 'grm_norm': 'gcn', 'self_loops': True, 'use_snp_selection': True, 'num_snps': 7910}. Best is trial 25 with value: 0.36126225089020203.
[I 2025-12-08 18:49:31,076] Trial 37 finished with value: 0.18780511799987792 and parameters: {'model_type': 'gcn', 'hidden_dims': '[256, 128, 64]', 'dropout': 0.41186325898634857, 'batch_norm': False, 'lr': 0.00015551352778304223, 'weight_decay': 3.194390578708338e-05, 'epochs': 230, 'loss': 'mse', 'optimizer': 'adam', 'graph_mode': 'cutoff', 'cutoff': 0.7251050868610649, 'grm_norm': 'gcn', 'self_loops': True, 'use_snp_selection': False}. Best is trial 25 with value: 0.36126225089020203.
[I 2025-12-08 18:49:54,950] Trial 38 finished with value: 0.3468901581951085 and parameters: {'model_type': 'gcn', 'hidden_dims': '[512, 64]', 'dropout': 0.38039828061038916, 'batch_norm': False, 'lr': 0.00010744842751033744, 'weight_decay': 9.38033119095264e-06, 'epochs': 109, 'loss': 'mse', 'optimizer': 'adam', 'graph_mode': 'cutoff', 'cutoff': 0.850052147200031, 'grm_norm': 'gcn', 'self_loops': True, 'use_snp_selection': True, 'num_snps': 27661}. Best is trial 25 with value: 0.36126225089020203.
[I 2025-12-08 18:50:06,928] Trial 39 finished with value: 0.350290891864211 and parameters: {'model_type': 'gcn', 'hidden_dims': '[512, 128]', 'dropout': 0.5995922549251111, 'batch_norm': False, 'lr': 6.575362059798039e-05, 'weight_decay': 0.0003992931519180015, 'epochs': 87, 'loss': 'mse', 'optimizer': 'adam', 'graph_mode': 'cutoff', 'cutoff': 0.5027123857283922, 'grm_norm': 'gcn', 'self_loops': True, 'use_snp_selection': True, 'num_snps': 7749}. Best is trial 25 with value: 0.36126225089020203.
[I 2025-12-08 18:50:24,432] Trial 40 finished with value: 0.27293675558619657 and parameters: {'model_type': 'gcn', 'hidden_dims': '[256, 128]', 'dropout': 0.3310978515682992, 'batch_norm': False, 'lr': 0.00026421267525863167, 'weight_decay': 7.072901442972214e-07, 'epochs': 134, 'loss': 'mse', 'optimizer': 'adam', 'graph_mode': 'cutoff', 'cutoff': 0.6744233905351348, 'grm_norm': 'gcn', 'self_loops': True, 'use_snp_selection': False}. Best is trial 25 with value: 0.36126225089020203.
[I 2025-12-08 18:50:37,876] Trial 41 finished with value: 0.34991149103155655 and parameters: {'model_type': 'gcn', 'hidden_dims': '[256, 128]', 'dropout': 0.304631822609248, 'batch_norm': False, 'lr': 0.00046696520735352493, 'weight_decay': 6.91695151065812e-05, 'epochs': 83, 'loss': 'mse', 'optimizer': 'adam', 'graph_mode': 'cutoff', 'cutoff': 0.7821587970972393, 'grm_norm': 'none', 'self_loops': True, 'use_snp_selection': True, 'num_snps': 16849}. Best is trial 25 with value: 0.36126225089020203.
[I 2025-12-08 18:50:49,200] Trial 42 finished with value: 0.35521394515919985 and parameters: {'model_type': 'gcn', 'hidden_dims': '[256, 128]', 'dropout': 0.2520308450375488, 'batch_norm': False, 'lr': 0.0003172102096207478, 'weight_decay': 4.750375153446515e-05, 'epochs': 76, 'loss': 'mae', 'optimizer': 'adam', 'graph_mode': 'cutoff', 'cutoff': 0.8380362779360407, 'grm_norm': 'none', 'self_loops': False, 'use_snp_selection': True, 'num_snps': 9901}. Best is trial 25 with value: 0.36126225089020203.
[I 2025-12-08 18:50:58,587] Trial 43 finished with value: 0.34168286494471845 and parameters: {'model_type': 'gcn', 'hidden_dims': '[128, 64]', 'dropout': 0.25219782709562494, 'batch_norm': False, 'lr': 0.0006363114121778616, 'weight_decay': 2.288910554508745e-05, 'epochs': 59, 'loss': 'mse', 'optimizer': 'adam', 'graph_mode': 'cutoff', 'cutoff': 0.8549654031674329, 'grm_norm': 'none', 'self_loops': False, 'use_snp_selection': True, 'num_snps': 6173}. Best is trial 25 with value: 0.36126225089020203.
