[I 2025-12-08 12:51:33,405] Trial 92 finished with value: 0.29131015167665525 and parameters: {'model_type': 'gcn', 'hidden_dims': '[256, 128]', 'dropout': 0.11966998674457151, 'batch_norm': True, 'lr': 0.0005403623720936358, 'weight_decay': 8.901382375002706e-06, 'epochs': 135, 'loss': 'mae', 'optimizer': 'adam', 'graph_mode': 'cutoff', 'cutoff': 0.8742235545111758, 'grm_norm': 'cosine', 'self_loops': False, 'use_snp_selection': True, 'num_snps': 51545}. Best is trial 45 with value: 0.29729996560538824.
[I 2025-12-08 12:51:59,351] Trial 93 finished with value: 0.2953033087397046 and parameters: {'model_type': 'gcn', 'hidden_dims': '[256, 128]', 'dropout': 0.17449257951336747, 'batch_norm': True, 'lr': 0.0004486254271676829, 'weight_decay': 5.959217234015442e-06, 'epochs': 108, 'loss': 'mae', 'optimizer': 'adam', 'graph_mode': 'cutoff', 'cutoff': 0.8335105071148996, 'grm_norm': 'cosine', 'self_loops': False, 'use_snp_selection': True, 'num_snps': 47292}. Best is trial 45 with value: 0.29729996560538824.
[I 2025-12-08 12:52:24,817] Trial 94 finished with value: 0.28540840236606363 and parameters: {'model_type': 'gcn', 'hidden_dims': '[256, 128]', 'dropout': 0.17153917551933195, 'batch_norm': True, 'lr': 0.0003781229544243092, 'weight_decay': 1.2475116190919106e-05, 'epochs': 103, 'loss': 'mae', 'optimizer': 'adam', 'graph_mode': 'cutoff', 'cutoff': 0.6069099510044424, 'grm_norm': 'cosine', 'self_loops': False, 'use_snp_selection': True, 'num_snps': 47096}. Best is trial 45 with value: 0.29729996560538824.
[I 2025-12-08 12:52:50,277] Trial 95 finished with value: 0.2827232213905404 and parameters: {'model_type': 'gcn', 'hidden_dims': '[256, 128]', 'dropout': 0.1514291258084072, 'batch_norm': True, 'lr': 0.00027188667307744295, 'weight_decay': 6.711985200594506e-06, 'epochs': 72, 'loss': 'mae', 'optimizer': 'adam', 'graph_mode': 'cutoff', 'cutoff': 0.7424057370925715, 'grm_norm': 'cosine_then_gcn', 'self_loops': False, 'use_snp_selection': True, 'num_snps': 56485}. Best is trial 45 with value: 0.29729996560538824.
[I 2025-12-08 12:53:20,662] Trial 96 finished with value: 0.2881629867370935 and parameters: {'model_type': 'gcn', 'hidden_dims': '[512, 64]', 'dropout': 0.11107763867624934, 'batch_norm': False, 'lr': 0.00045713549857874644, 'weight_decay': 1.2906857614934866e-06, 'epochs': 161, 'loss': 'mse', 'optimizer': 'adam', 'graph_mode': 'cutoff', 'cutoff': 0.6347916591241787, 'grm_norm': 'cosine', 'self_loops': False, 'use_snp_selection': True, 'num_snps': 28619}. Best is trial 45 with value: 0.29729996560538824.
[I 2025-12-08 12:53:41,348] Trial 97 finished with value: 0.24680986908953545 and parameters: {'model_type': 'gcn', 'hidden_dims': '[128, 64]', 'dropout': 0.18640111902008985, 'batch_norm': True, 'lr': 1.5121716817572094e-05, 'weight_decay': 2.6768889653008566e-06, 'epochs': 108, 'loss': 'mae', 'optimizer': 'adam', 'graph_mode': 'cutoff', 'cutoff': 0.8994464199031019, 'grm_norm': 'cosine', 'self_loops': False, 'use_snp_selection': True, 'num_snps': 44993}. Best is trial 45 with value: 0.29729996560538824.
[I 2025-12-08 12:54:08,548] Trial 98 finished with value: 0.28700224197561863 and parameters: {'model_type': 'gcn', 'hidden_dims': '[256, 128]', 'dropout': 0.29701795493599586, 'batch_norm': True, 'lr': 0.00031229568304581335, 'weight_decay': 4.843210548955563e-06, 'epochs': 95, 'loss': 'mae', 'optimizer': 'adam', 'graph_mode': 'cutoff', 'cutoff': 0.8088138749377989, 'grm_norm': 'cosine_then_gcn', 'self_loops': False, 'use_snp_selection': True, 'num_snps': 54804}. Best is trial 45 with value: 0.29729996560538824.
[I 2025-12-08 12:54:34,050] Trial 99 finished with value: 0.2829082979512662 and parameters: {'model_type': 'gcn', 'hidden_dims': '[256, 128, 64]', 'dropout': 0.13648509114153232, 'batch_norm': True, 'lr': 0.001253260697804547, 'weight_decay': 1.5416260191253386e-05, 'epochs': 80, 'loss': 'mae', 'optimizer': 'adam', 'graph_mode': 'cutoff', 'cutoff': 0.8670722415874195, 'grm_norm': 'cosine', 'self_loops': False, 'use_snp_selection': True, 'num_snps': 52668}. Best is trial 45 with value: 0.29729996560538824.
[I 2025-12-08 12:55:10,789] Trial 100 finished with value: 0.2944333920717713 and parameters: {'model_type': 'gcn', 'hidden_dims': '[512, 128]', 'dropout': 0.21202247916862849, 'batch_norm': True, 'lr': 0.00010341876656432114, 'weight_decay': 0.00014558508443790477, 'epochs': 87, 'loss': 'mae', 'optimizer': 'adam', 'graph_mode': 'cutoff', 'cutoff': 0.7936103745038366, 'grm_norm': 'cosine_then_gcn', 'self_loops': False, 'use_snp_selection': True, 'num_snps': 58472}. Best is trial 45 with value: 0.29729996560538824.
[I 2025-12-08 12:55:42,173] Trial 101 finished with value: 0.2871229540986085 and parameters: {'model_type': 'gcn', 'hidden_dims': '[512, 128]', 'dropout': 0.21555376486925298, 'batch_norm': True, 'lr': 0.009598086012782812, 'weight_decay': 3.845033486550661e-06, 'epochs': 60, 'loss': 'mae', 'optimizer': 'adam', 'graph_mode': 'cutoff', 'cutoff': 0.758734058136069, 'grm_norm': 'cosine_then_gcn', 'self_loops': False, 'use_snp_selection': True, 'num_snps': 58791}. Best is trial 45 with value: 0.29729996560538824.
[I 2025-12-08 12:56:18,422] Trial 102 finished with value: 0.29165508923705896 and parameters: {'model_type': 'gcn', 'hidden_dims': '[512, 128]', 'dropout': 0.2423894745248903, 'batch_norm': True, 'lr': 0.00010481821794960532, 'weight_decay': 1.0186923176348926e-05, 'epochs': 87, 'loss': 'mae', 'optimizer': 'adam', 'graph_mode': 'cutoff', 'cutoff': 0.8374774397384933, 'grm_norm': 'cosine_then_gcn', 'self_loops': False, 'use_snp_selection': True, 'num_snps': 57103}. Best is trial 45 with value: 0.29729996560538824.
[I 2025-12-08 12:57:05,324] Trial 103 finished with value: 0.28789497408835424 and parameters: {'model_type': 'gcn', 'hidden_dims': '[512, 128]', 'dropout': 0.1774304941192765, 'batch_norm': True, 'lr': 0.00014430493084213158, 'weight_decay': 7.387487273674805e-06, 'epochs': 130, 'loss': 'mae', 'optimizer': 'adam', 'graph_mode': 'cutoff', 'cutoff': 0.7294238852670412, 'grm_norm': 'cosine_then_gcn', 'self_loops': False, 'use_snp_selection': True, 'num_snps': 59918}. Best is trial 45 with value: 0.29729996560538824.
[I 2025-12-08 12:57:43,258] Trial 104 finished with value: 0.26032817214262005 and parameters: {'model_type': 'gcn', 'hidden_dims': '[512, 128]', 'dropout': 0.15614564094614636, 'batch_norm': True, 'lr': 6.914134270729037e-05, 'weight_decay': 0.0002969381010544963, 'epochs': 104, 'loss': 'mae', 'optimizer': 'adam', 'graph_mode': 'cutoff', 'cutoff': 0.7957247844738129, 'grm_norm': 'cosine_then_gcn', 'self_loops': False, 'use_snp_selection': True, 'num_snps': 53682}. Best is trial 45 with value: 0.29729996560538824.
[I 2025-12-08 12:58:16,025] Trial 105 finished with value: 0.2906636125121328 and parameters: {'model_type': 'gcn', 'hidden_dims': '[256, 128]', 'dropout': 0.1440104676390988, 'batch_norm': True, 'lr': 8.764109512101616e-05, 'weight_decay': 0.0001857216056684652, 'epochs': 225, 'loss': 'mae', 'optimizer': 'adam', 'graph_mode': 'cutoff', 'cutoff': 0.7898665050752447, 'grm_norm': 'cosine', 'self_loops': False, 'use_snp_selection': True, 'num_snps': 39703}. Best is trial 45 with value: 0.29729996560538824.
[I 2025-12-08 12:58:48,222] Trial 106 finished with value: 0.2935708968794711 and parameters: {'model_type': 'gcn', 'hidden_dims': '[512, 128]', 'dropout': 0.20258475300179346, 'batch_norm': True, 'lr': 0.00011471108618989263, 'weight_decay': 0.00014885131668958504, 'epochs': 69, 'loss': 'mae', 'optimizer': 'adam', 'graph_mode': 'cutoff', 'cutoff': 0.8532015174891245, 'grm_norm': 'cosine_then_gcn', 'self_loops': False, 'use_snp_selection': True, 'num_snps': 56506}. Best is trial 45 with value: 0.29729996560538824.
[I 2025-12-08 12:59:15,547] Trial 107 finished with value: 0.2804739014347369 and parameters: {'model_type': 'gcn', 'hidden_dims': '[512, 128]', 'dropout': 0.2323911635656134, 'batch_norm': True, 'lr': 0.0001169915096734624, 'weight_decay': 0.00014035713333544178, 'epochs': 48, 'loss': 'mae', 'optimizer': 'adam', 'graph_mode': 'cutoff', 'cutoff': 0.8492027557235757, 'grm_norm': 'cosine_then_gcn', 'self_loops': True, 'use_snp_selection': True, 'num_snps': 55127}. Best is trial 45 with value: 0.29729996560538824.
[I 2025-12-08 12:59:33,349] Trial 108 finished with value: 0.2904151270078087 and parameters: {'model_type': 'gcn', 'hidden_dims': '[512, 128]', 'dropout': 0.20291655458494914, 'batch_norm': True, 'lr': 0.0002098486981167076, 'weight_decay': 0.0001375908495836426, 'epochs': 71, 'loss': 'mae', 'optimizer': 'adam', 'graph_mode': 'cutoff', 'cutoff': 0.885691994150383, 'grm_norm': 'cosine_then_gcn', 'self_loops': False, 'use_snp_selection': True, 'num_snps': 21741}. Best is trial 45 with value: 0.29729996560538824.
[I 2025-12-08 12:59:51,359] Trial 109 finished with value: 0.2636837822291908 and parameters: {'model_type': 'gcn', 'hidden_dims': '[512, 128]', 'dropout': 0.2622343512132004, 'batch_norm': True, 'lr': 5.569247400897034e-05, 'weight_decay': 8.76308106944376e-05, 'epochs': 59, 'loss': 'mae', 'optimizer': 'adam', 'graph_mode': 'knn', 'knn_k': 9, 'weighted_edges': True, 'symmetrize_mode': 'union', 'self_loops': True, 'use_snp_selection': False}. Best is trial 45 with value: 0.29729996560538824.
[I 2025-12-08 13:00:22,880] Trial 110 finished with value: 0.24672006678460487 and parameters: {'model_type': 'gcn', 'hidden_dims': '[512, 128]', 'dropout': 0.1907014201824288, 'batch_norm': False, 'lr': 0.0001783710545671332, 'weight_decay': 0.00018012520335741733, 'epochs': 66, 'loss': 'mse', 'optimizer': 'adam', 'graph_mode': 'cutoff', 'cutoff': 0.8579179854030081, 'grm_norm': 'cosine_then_gcn', 'self_loops': False, 'use_snp_selection': True, 'num_snps': 56791}. Best is trial 45 with value: 0.29729996560538824.
[I 2025-12-08 13:00:49,518] Trial 111 finished with value: 0.282898527171084 and parameters: {'model_type': 'gcn', 'hidden_dims': '[256, 128]', 'dropout': 0.16194128526196763, 'batch_norm': True, 'lr': 0.00010294322878993122, 'weight_decay': 0.0002669879549612537, 'epochs': 79, 'loss': 'mae', 'optimizer': 'adam', 'graph_mode': 'cutoff', 'cutoff': 0.8175606318256256, 'grm_norm': 'cosine_then_gcn', 'self_loops': False, 'use_snp_selection': True, 'num_snps': 58596}. Best is trial 45 with value: 0.29729996560538824.
[I 2025-12-08 13:01:26,815] Trial 112 finished with value: 0.29654014199992523 and parameters: {'model_type': 'gcn', 'hidden_dims': '[512, 64]', 'dropout': 0.1735327972537504, 'batch_norm': True, 'lr': 0.00040420203354418717, 'weight_decay': 0.00010599844685944587, 'epochs': 96, 'loss': 'mae', 'optimizer': 'adam', 'graph_mode': 'cutoff', 'cutoff': 0.7768647662314618, 'grm_norm': 'cosine', 'self_loops': False, 'use_snp_selection': True, 'num_snps': 55447}. Best is trial 45 with value: 0.29729996560538824.
[I 2025-12-08 13:02:03,003] Trial 113 finished with value: 0.28519879752301225 and parameters: {'model_type': 'gcn', 'hidden_dims': '[512, 64]', 'dropout': 0.21784065047066667, 'batch_norm': True, 'lr': 0.00039746161328217905, 'weight_decay': 6.995321273601285e-05, 'epochs': 97, 'loss': 'mae', 'optimizer': 'adam', 'graph_mode': 'cutoff', 'cutoff': 0.8646217100586129, 'grm_norm': 'cosine_then_gcn', 'self_loops': False, 'use_snp_selection': True, 'num_snps': 53311}. Best is trial 45 with value: 0.29729996560538824.
[I 2025-12-08 13:02:37,781] Trial 114 finished with value: 0.2754875330080753 and parameters: {'model_type': 'gcn', 'hidden_dims': '[512, 64]', 'dropout': 0.17327504160647472, 'batch_norm': True, 'lr': 0.00025410855124754616, 'weight_decay': 6.187169837255583e-05, 'epochs': 83, 'loss': 'mae', 'optimizer': 'adam', 'graph_mode': 'cutoff', 'cutoff': 0.8071839024818197, 'grm_norm': 'cosine', 'self_loops': False, 'use_snp_selection': True, 'num_snps': 55844}. Best is trial 45 with value: 0.29729996560538824.
[I 2025-12-08 13:02:50,404] Trial 115 finished with value: 0.27425761624804074 and parameters: {'model_type': 'gcn', 'hidden_dims': '[512, 64]', 'dropout': 0.179541864657798, 'batch_norm': True, 'lr': 0.00012751152906751483, 'weight_decay': 0.00022510746182528068, 'epochs': 89, 'loss': 'mae', 'optimizer': 'adam', 'graph_mode': 'cutoff', 'cutoff': 0.699749809991295, 'grm_norm': 'gcn', 'self_loops': False, 'use_snp_selection': True, 'num_snps': 8585}. Best is trial 45 with value: 0.29729996560538824.
[I 2025-12-08 13:03:34,919] Trial 116 finished with value: 0.2830283866280798 and parameters: {'model_type': 'gcn', 'hidden_dims': '[512, 64]', 'dropout': 0.12032038995168104, 'batch_norm': True, 'lr': 0.00035050053187622856, 'weight_decay': 0.00010841312893057975, 'epochs': 148, 'loss': 'mae', 'optimizer': 'adam', 'graph_mode': 'cutoff', 'cutoff': 0.8375514551698828, 'grm_norm': 'cosine', 'self_loops': False, 'use_snp_selection': True, 'num_snps': 50984}. Best is trial 45 with value: 0.29729996560538824.
[I 2025-12-08 13:04:12,028] Trial 117 finished with value: 0.29763762946919264 and parameters: {'model_type': 'gcn', 'hidden_dims': '[512, 256]', 'dropout': 0.20641524704272224, 'batch_norm': True, 'lr': 7.692282845553214e-05, 'weight_decay': 0.0003594069353030654, 'epochs': 114, 'loss': 'mae', 'optimizer': 'adam', 'graph_mode': 'cutoff', 'cutoff': 0.7851701472915847, 'grm_norm': 'cosine_then_gcn', 'self_loops': True, 'use_snp_selection': True, 'num_snps': 48770}. Best is trial 117 with value: 0.29763762946919264.
[I 2025-12-08 13:04:49,165] Trial 118 finished with value: 0.28241374750473325 and parameters: {'model_type': 'gcn', 'hidden_dims': '[512, 256]', 'dropout': 0.2056507151344669, 'batch_norm': True, 'lr': 7.807496321628441e-05, 'weight_decay': 0.00015298286005432427, 'epochs': 114, 'loss': 'mae', 'optimizer': 'adam', 'graph_mode': 'cutoff', 'cutoff': 0.7806494498606705, 'grm_norm': 'cosine_then_gcn', 'self_loops': False, 'use_snp_selection': True, 'num_snps': 48836}. Best is trial 117 with value: 0.29763762946919264.
[I 2025-12-08 13:05:17,189] Trial 119 finished with value: 0.28339147902165707 and parameters: {'model_type': 'gcn', 'hidden_dims': '[512, 256]', 'dropout': 0.21951587253053742, 'batch_norm': True, 'lr': 4.846986812670025e-05, 'weight_decay': 0.00036366714004900947, 'epochs': 76, 'loss': 'mae', 'optimizer': 'adam', 'graph_mode': 'cutoff', 'cutoff': 0.7508576534404864, 'grm_norm': 'cosine_then_gcn', 'self_loops': True, 'use_snp_selection': True, 'num_snps': 43397}. Best is trial 117 with value: 0.29763762946919264.
[I 2025-12-08 13:05:59,369] Trial 120 finished with value: 0.28315619899428124 and parameters: {'model_type': 'gcn', 'hidden_dims': '[512, 256]', 'dropout': 0.23605186053679705, 'batch_norm': True, 'lr': 6.133973670877394e-05, 'weight_decay': 4.5769557971602246e-05, 'epochs': 124, 'loss': 'mae', 'optimizer': 'adam', 'graph_mode': 'cutoff', 'cutoff': 0.7758845797532944, 'grm_norm': 'cosine_then_gcn', 'self_loops': False, 'use_snp_selection': True, 'num_snps': 54379}. Best is trial 117 with value: 0.29763762946919264.
[I 2025-12-08 13:06:34,598] Trial 121 finished with value: 0.2946334420325756 and parameters: {'model_type': 'gcn', 'hidden_dims': '[512, 256]', 'dropout': 0.1985918746225251, 'batch_norm': True, 'lr': 0.00015360894950736296, 'weight_decay': 0.0005897108047087274, 'epochs': 94, 'loss': 'mae', 'optimizer': 'adam', 'graph_mode': 'cutoff', 'cutoff': 0.8253137430438401, 'grm_norm': 'cosine_then_gcn', 'self_loops': True, 'use_snp_selection': True, 'num_snps': 52109}. Best is trial 117 with value: 0.29763762946919264.
[I 2025-12-08 13:07:10,009] Trial 122 finished with value: 0.2919388291639521 and parameters: {'model_type': 'gcn', 'hidden_dims': '[512, 256]', 'dropout': 0.2108952958193697, 'batch_norm': True, 'lr': 0.00015633412480648226, 'weight_decay': 0.0009159459522362206, 'epochs': 94, 'loss': 'mae', 'optimizer': 'adam', 'graph_mode': 'cutoff', 'cutoff': 0.8249082762862299, 'grm_norm': 'cosine_then_gcn', 'self_loops': True, 'use_snp_selection': True, 'num_snps': 52592}. Best is trial 117 with value: 0.29763762946919264.
[I 2025-12-08 13:08:28,390] Trial 123 finished with value: 0.2412656717220807 and parameters: {'model_type': 'gcn', 'hidden_dims': '[512, 256]', 'dropout': 0.19923504768909886, 'batch_norm': True, 'lr': 0.00010168649815544355, 'weight_decay': 0.0005124093348936812, 'epochs': 324, 'loss': 'mae', 'optimizer': 'adam', 'graph_mode': 'cutoff', 'cutoff': 0.5410963041372854, 'grm_norm': 'cosine_then_gcn', 'self_loops': True, 'use_snp_selection': True, 'num_snps': 50942}. Best is trial 117 with value: 0.29763762946919264.
[I 2025-12-08 13:09:09,944] Trial 124 finished with value: 0.29049266070554114 and parameters: {'model_type': 'gcn', 'hidden_dims': '[512, 256]', 'dropout': 0.19004262872274605, 'batch_norm': True, 'lr': 8.589387020295539e-05, 'weight_decay': 0.0005953736276216951, 'epochs': 119, 'loss': 'mae', 'optimizer': 'adam', 'graph_mode': 'cutoff', 'cutoff': 0.7269995988973185, 'grm_norm': 'cosine_then_gcn', 'self_loops': True, 'use_snp_selection': True, 'num_snps': 55007}. Best is trial 117 with value: 0.29763762946919264.
[I 2025-12-08 13:09:39,086] Trial 125 finished with value: 0.2985981018923512 and parameters: {'model_type': 'gcn', 'hidden_dims': '[512, 256]', 'dropout': 0.16221865213700454, 'batch_norm': True, 'lr': 0.00012276420476110258, 'weight_decay': 0.0003737854250301636, 'epochs': 68, 'loss': 'mae', 'optimizer': 'adam', 'graph_mode': 'cutoff', 'cutoff': 0.7954644894165629, 'grm_norm': 'cosine_then_gcn', 'self_loops': True, 'use_snp_selection': True, 'num_snps': 49544}. Best is trial 125 with value: 0.2985981018923512.
[I 2025-12-08 13:10:11,147] Trial 126 finished with value: 0.28534016138788193 and parameters: {'model_type': 'gcn', 'hidden_dims': '[512, 256]', 'dropout': 0.16270481214102836, 'batch_norm': True, 'lr': 0.0001316566150307566, 'weight_decay': 0.00037248859398328853, 'epochs': 90, 'loss': 'mae', 'optimizer': 'adam', 'graph_mode': 'cutoff', 'cutoff': 0.7938502146118384, 'grm_norm': 'none', 'self_loops': True, 'use_snp_selection': True, 'num_snps': 47608}. Best is trial 125 with value: 0.2985981018923512.
[I 2025-12-08 13:10:45,988] Trial 127 finished with value: 0.29647840516366303 and parameters: {'model_type': 'gcn', 'hidden_dims': '[512, 256]', 'dropout': 0.1464620253401403, 'batch_norm': True, 'lr': 0.00014497842057320707, 'weight_decay': 0.0005548799345921058, 'epochs': 100, 'loss': 'mae', 'optimizer': 'adam', 'graph_mode': 'cutoff', 'cutoff': 0.6490028107494544, 'grm_norm': 'gcn', 'self_loops': True, 'use_snp_selection': True, 'num_snps': 49745}. Best is trial 125 with value: 0.2985981018923512.
[I 2025-12-08 13:11:31,187] Trial 128 finished with value: 0.28088301966102913 and parameters: {'model_type': 'gcn', 'hidden_dims': '[512, 256]', 'dropout': 0.15336655424228413, 'batch_norm': True, 'lr': 0.00015941496674242757, 'weight_decay': 0.0006875920060568945, 'epochs': 157, 'loss': 'mae', 'optimizer': 'adam', 'graph_mode': 'cutoff', 'cutoff': 0.619571279980295, 'grm_norm': 'gcn', 'self_loops': True, 'use_snp_selection': True, 'num_snps': 49549}. Best is trial 125 with value: 0.2985981018923512.
[I 2025-12-08 13:12:07,891] Trial 129 finished with value: 0.21529254854377727 and parameters: {'model_type': 'gcn', 'hidden_dims': '[512, 256]', 'dropout': 0.14442436252811902, 'batch_norm': True, 'lr': 0.0001751668264136227, 'weight_decay': 0.00068424487924977, 'epochs': 138, 'loss': 'mae', 'optimizer': 'adam', 'graph_mode': 'knn', 'knn_k': 2, 'weighted_edges': False, 'symmetrize_mode': 'mutual', 'self_loops': True, 'use_snp_selection': False}. Best is trial 125 with value: 0.2985981018923512.
[I 2025-12-08 13:13:07,401] Trial 130 finished with value: 0.279297356563171 and parameters: {'model_type': 'gcn', 'hidden_dims': '[512, 256]', 'dropout': 0.36732800472948224, 'batch_norm': False, 'lr': 0.0001939091471135081, 'weight_decay': 0.0004259057157891266, 'epochs': 257, 'loss': 'mae', 'optimizer': 'adam', 'graph_mode': 'cutoff', 'cutoff': 0.7478982463467284, 'grm_norm': 'gcn', 'self_loops': True, 'use_snp_selection': True, 'num_snps': 46117}. Best is trial 125 with value: 0.2985981018923512.
[I 2025-12-08 13:13:25,305] Trial 131 finished with value: 0.2567231618579538 and parameters: {'model_type': 'gcn', 'hidden_dims': '[512, 256]', 'dropout': 0.18267499842052404, 'batch_norm': True, 'lr': 0.00014005636379223763, 'weight_decay': 0.00023378325716016075, 'epochs': 98, 'loss': 'mae', 'optimizer': 'adam', 'graph_mode': 'cutoff', 'cutoff': 0.44892607514888744, 'grm_norm': 'gcn', 'self_loops': True, 'use_snp_selection': True, 'num_snps': 16977}. Best is trial 125 with value: 0.2985981018923512.
[I 2025-12-08 13:14:01,552] Trial 132 finished with value: 0.2798972299055121 and parameters: {'model_type': 'gcn', 'hidden_dims': '[512, 256]', 'dropout': 0.17269221748457259, 'batch_norm': True, 'lr': 0.00011894763921623669, 'weight_decay': 0.00032033229541558115, 'epochs': 102, 'loss': 'mae', 'optimizer': 'adam', 'graph_mode': 'cutoff', 'cutoff': 0.652784378218072, 'grm_norm': 'gcn', 'self_loops': True, 'use_snp_selection': True, 'num_snps': 51735}. Best is trial 125 with value: 0.2985981018923512.
[I 2025-12-08 13:14:33,313] Trial 133 finished with value: 0.2868676905471107 and parameters: {'model_type': 'gcn', 'hidden_dims': '[512, 256]', 'dropout': 0.13157449944334126, 'batch_norm': True, 'lr': 9.457308961858696e-05, 'weight_decay': 0.0005062931630765761, 'epochs': 84, 'loss': 'mae', 'optimizer': 'adam', 'graph_mode': 'cutoff', 'cutoff': 0.5872104366047742, 'grm_norm': 'cosine_then_gcn', 'self_loops': True, 'use_snp_selection': True, 'num_snps': 48556}. Best is trial 125 with value: 0.2985981018923512.
