[I 2025-12-08 11:18:52,742] Trial 23 finished with value: 0.3065193739070928 and parameters: {'model_type': 'gcn', 'hidden_dims': '[256, 128, 64]', 'dropout': 0.5083284851070052, 'batch_norm': True, 'lr': 0.0006252518558614371, 'weight_decay': 0.00018590287726873096, 'epochs': 145, 'loss': 'mae', 'optimizer': 'adam', 'graph_mode': 'cutoff', 'cutoff': 0.7908004342377689, 'grm_norm': 'cosine_then_gcn', 'self_loops': False, 'use_snp_selection': False}. Best is trial 13 with value: 0.3095610240919141.
[I 2025-12-08 11:19:17,807] Trial 24 finished with value: 0.2906964144950927 and parameters: {'model_type': 'gcn', 'hidden_dims': '[256, 128, 64]', 'dropout': 0.532567851638772, 'batch_norm': True, 'lr': 0.00020371944581396817, 'weight_decay': 9.217714725471998e-05, 'epochs': 185, 'loss': 'mae', 'optimizer': 'adam', 'graph_mode': 'cutoff', 'cutoff': 0.6627546272934105, 'grm_norm': 'cosine_then_gcn', 'self_loops': False, 'use_snp_selection': False}. Best is trial 13 with value: 0.3095610240919141.
[I 2025-12-08 11:19:33,540] Trial 25 finished with value: 0.2652485594042913 and parameters: {'model_type': 'gcn', 'hidden_dims': '[256, 128, 64]', 'dropout': 0.5799430081040117, 'batch_norm': True, 'lr': 0.0008066624847217271, 'weight_decay': 1.6699927944632945e-05, 'epochs': 110, 'loss': 'mae', 'optimizer': 'adam', 'graph_mode': 'cutoff', 'cutoff': 0.5190724095598998, 'grm_norm': 'none', 'self_loops': False, 'use_snp_selection': False}. Best is trial 13 with value: 0.3095610240919141.
[I 2025-12-08 11:19:44,116] Trial 26 finished with value: -0.012763853400345419 and parameters: {'model_type': 'gcn', 'hidden_dims': '[256, 128, 64]', 'dropout': 0.49072481275719426, 'batch_norm': False, 'lr': 0.0023363071067724612, 'weight_decay': 0.0009422211166401505, 'epochs': 64, 'loss': 'mse', 'optimizer': 'adam', 'graph_mode': 'knn', 'knn_k': 6, 'weighted_edges': False, 'symmetrize_mode': 'union', 'self_loops': False, 'use_snp_selection': False}. Best is trial 13 with value: 0.3095610240919141.
[I 2025-12-08 11:19:57,895] Trial 27 finished with value: 0.3149905766649259 and parameters: {'model_type': 'gcn', 'hidden_dims': '[256, 128, 64]', 'dropout': 0.42740552225705813, 'batch_norm': True, 'lr': 0.00032440385879854374, 'weight_decay': 2.0964181892187084e-05, 'epochs': 94, 'loss': 'mae', 'optimizer': 'adam', 'graph_mode': 'cutoff', 'cutoff': 0.7811907323855992, 'grm_norm': 'gcn', 'self_loops': False, 'use_snp_selection': False}. Best is trial 27 with value: 0.3149905766649259.
[I 2025-12-08 11:20:10,889] Trial 28 finished with value: 0.2939564076596332 and parameters: {'model_type': 'gcn', 'hidden_dims': '[256, 128]', 'dropout': 0.4230019836822775, 'batch_norm': True, 'lr': 4.446294938689993e-05, 'weight_decay': 2.0459280694612666e-05, 'epochs': 91, 'loss': 'mae', 'optimizer': 'adam', 'graph_mode': 'cutoff', 'cutoff': 0.7929537308335879, 'grm_norm': 'gcn', 'self_loops': False, 'use_snp_selection': False}. Best is trial 27 with value: 0.3149905766649259.
[I 2025-12-08 11:20:20,863] Trial 29 finished with value: 0.23469276644010764 and parameters: {'model_type': 'gcn', 'hidden_dims': '[256, 128, 64]', 'dropout': 0.3554848480631517, 'batch_norm': True, 'lr': 0.00024780356926181515, 'weight_decay': 5.2064723715420925e-06, 'epochs': 58, 'loss': 'mae', 'optimizer': 'adam', 'graph_mode': 'knn', 'knn_k': 10, 'weighted_edges': False, 'symmetrize_mode': 'mutual', 'self_loops': False, 'use_snp_selection': False}. Best is trial 27 with value: 0.3149905766649259.
[I 2025-12-08 11:20:51,058] Trial 30 finished with value: 0.2834456428165875 and parameters: {'model_type': 'gcn', 'hidden_dims': '[512, 64]', 'dropout': 0.4556816365003011, 'batch_norm': True, 'lr': 0.0001150933439396738, 'weight_decay': 7.947222129793207e-05, 'epochs': 111, 'loss': 'mae', 'optimizer': 'adam', 'graph_mode': 'cutoff', 'cutoff': 0.6528975258309669, 'grm_norm': 'gcn', 'self_loops': False, 'use_snp_selection': False}. Best is trial 27 with value: 0.3149905766649259.
[I 2025-12-08 11:21:11,522] Trial 31 finished with value: 0.30467204871764164 and parameters: {'model_type': 'gcn', 'hidden_dims': '[256, 128, 64]', 'dropout': 0.521492974912155, 'batch_norm': True, 'lr': 0.0004161893567861835, 'weight_decay': 0.00040232972466135267, 'epochs': 149, 'loss': 'mae', 'optimizer': 'adam', 'graph_mode': 'cutoff', 'cutoff': 0.7687435720812297, 'grm_norm': 'gcn', 'self_loops': False, 'use_snp_selection': False}. Best is trial 27 with value: 0.3149905766649259.
[I 2025-12-08 11:21:24,388] Trial 32 finished with value: 0.30464700549062373 and parameters: {'model_type': 'gcn', 'hidden_dims': '[256, 128, 64]', 'dropout': 0.5501905420781102, 'batch_norm': True, 'lr': 0.0004586456833551687, 'weight_decay': 2.7656528729506413e-05, 'epochs': 85, 'loss': 'mae', 'optimizer': 'adam', 'graph_mode': 'cutoff', 'cutoff': 0.6943902373091161, 'grm_norm': 'cosine_then_gcn', 'self_loops': False, 'use_snp_selection': False}. Best is trial 27 with value: 0.3149905766649259.
[I 2025-12-08 11:21:41,682] Trial 33 finished with value: 0.31335555414855054 and parameters: {'model_type': 'gcn', 'hidden_dims': '[256, 128, 64]', 'dropout': 0.48961501569131094, 'batch_norm': True, 'lr': 0.00026441986147966083, 'weight_decay': 1.2299675541147278e-05, 'epochs': 123, 'loss': 'mae', 'optimizer': 'adam', 'graph_mode': 'cutoff', 'cutoff': 0.8178026826617649, 'grm_norm': 'gcn', 'self_loops': False, 'use_snp_selection': False}. Best is trial 27 with value: 0.3149905766649259.
[I 2025-12-08 11:21:58,585] Trial 34 finished with value: 0.28567600543542715 and parameters: {'model_type': 'gcn', 'hidden_dims': '[256, 128, 64]', 'dropout': 0.4037536689328503, 'batch_norm': True, 'lr': 0.0001364093613921672, 'weight_decay': 1.0787189358038839e-05, 'epochs': 120, 'loss': 'mae', 'optimizer': 'adam', 'graph_mode': 'cutoff', 'cutoff': 0.8311248130224824, 'grm_norm': 'gcn', 'self_loops': False, 'use_snp_selection': False}. Best is trial 27 with value: 0.3149905766649259.
[I 2025-12-08 11:22:26,785] Trial 35 finished with value: 0.19751279534767333 and parameters: {'model_type': 'gcn', 'hidden_dims': '[256, 128]', 'dropout': 0.456053083330298, 'batch_norm': True, 'lr': 0.0002854571807648382, 'weight_decay': 4.130639743436628e-06, 'epochs': 221, 'loss': 'mse', 'optimizer': 'adam', 'graph_mode': 'knn', 'knn_k': 1, 'weighted_edges': True, 'symmetrize_mode': 'union', 'self_loops': False, 'use_snp_selection': False}. Best is trial 27 with value: 0.3149905766649259.
[I 2025-12-08 11:23:07,426] Trial 36 finished with value: 0.30700438741572944 and parameters: {'model_type': 'gcn', 'hidden_dims': '[256, 128, 64]', 'dropout': 0.48843106515385215, 'batch_norm': True, 'lr': 0.0002801340756828625, 'weight_decay': 1.2617320411966913e-05, 'epochs': 195, 'loss': 'mae', 'optimizer': 'adam', 'graph_mode': 'cutoff', 'cutoff': 0.8177116096654691, 'grm_norm': 'gcn', 'self_loops': False, 'use_snp_selection': True, 'num_snps': 55695}. Best is trial 27 with value: 0.3149905766649259.
[I 2025-12-08 11:24:07,583] Trial 37 finished with value: 0.28706646938446356 and parameters: {'model_type': 'gcn', 'hidden_dims': '[512, 64]', 'dropout': 0.34567429391245263, 'batch_norm': True, 'lr': 5.3620777587623006e-05, 'weight_decay': 9.402289247296503e-06, 'epochs': 197, 'loss': 'mae', 'optimizer': 'adam', 'graph_mode': 'cutoff', 'cutoff': 0.8282267571222139, 'grm_norm': 'gcn', 'self_loops': False, 'use_snp_selection': True, 'num_snps': 58690}. Best is trial 27 with value: 0.3149905766649259.
[I 2025-12-08 11:24:52,973] Trial 38 finished with value: 0.3044502213836777 and parameters: {'model_type': 'gcn', 'hidden_dims': '[256, 128, 64]', 'dropout': 0.47518830506026, 'batch_norm': True, 'lr': 5.4238983179818786e-05, 'weight_decay': 8.369688834988875e-07, 'epochs': 319, 'loss': 'mse', 'optimizer': 'adam', 'graph_mode': 'cutoff', 'cutoff': 0.8905392018494471, 'grm_norm': 'gcn', 'self_loops': True, 'use_snp_selection': True, 'num_snps': 42466}. Best is trial 27 with value: 0.3149905766649259.
[I 2025-12-08 11:25:22,238] Trial 39 finished with value: 0.24693427533600182 and parameters: {'model_type': 'gcn', 'hidden_dims': '[128, 64]', 'dropout': 0.412318737750114, 'batch_norm': True, 'lr': 0.0002623396777099589, 'weight_decay': 1.039290325770415e-05, 'epochs': 263, 'loss': 'mae', 'optimizer': 'adam', 'graph_mode': 'knn', 'knn_k': 6, 'weighted_edges': True, 'symmetrize_mode': 'union', 'self_loops': False, 'use_snp_selection': True, 'num_snps': 44445}. Best is trial 27 with value: 0.3149905766649259.
[I 2025-12-08 11:25:44,698] Trial 40 finished with value: 0.29979643240632603 and parameters: {'model_type': 'gcn', 'hidden_dims': '[256, 128]', 'dropout': 0.30995901700270595, 'batch_norm': False, 'lr': 3.246727206807558e-05, 'weight_decay': 6.287554808686227e-05, 'epochs': 250, 'loss': 'mse', 'optimizer': 'adam', 'graph_mode': 'cutoff', 'cutoff': 0.7829182749984565, 'grm_norm': 'gcn', 'self_loops': False, 'use_snp_selection': True, 'num_snps': 20466}. Best is trial 27 with value: 0.3149905766649259.
[I 2025-12-08 11:26:11,873] Trial 41 finished with value: 0.30901542511068014 and parameters: {'model_type': 'gcn', 'hidden_dims': '[256, 128, 64]', 'dropout': 0.497214677384703, 'batch_norm': True, 'lr': 0.0005398725530771776, 'weight_decay': 2.7393522959850022e-05, 'epochs': 96, 'loss': 'mae', 'optimizer': 'adam', 'graph_mode': 'cutoff', 'cutoff': 0.8302489224685354, 'grm_norm': 'gcn', 'self_loops': False, 'use_snp_selection': True, 'num_snps': 53608}. Best is trial 27 with value: 0.3149905766649259.
[I 2025-12-08 11:26:37,442] Trial 42 finished with value: 0.312188817798963 and parameters: {'model_type': 'gcn', 'hidden_dims': '[256, 128, 64]', 'dropout': 0.5553529156689502, 'batch_norm': True, 'lr': 0.0003352053371178909, 'weight_decay': 2.9221183793267193e-05, 'epochs': 88, 'loss': 'mae', 'optimizer': 'adam', 'graph_mode': 'cutoff', 'cutoff': 0.8266480233559425, 'grm_norm': 'gcn', 'self_loops': False, 'use_snp_selection': True, 'num_snps': 51392}. Best is trial 27 with value: 0.3149905766649259.
[I 2025-12-08 11:27:02,307] Trial 43 finished with value: 0.3146659132184773 and parameters: {'model_type': 'gcn', 'hidden_dims': '[256, 128, 64]', 'dropout': 0.5666267113352685, 'batch_norm': True, 'lr': 0.0004609989658371726, 'weight_decay': 2.7415980783426246e-05, 'epochs': 94, 'loss': 'mae', 'optimizer': 'adam', 'graph_mode': 'cutoff', 'cutoff': 0.8462070455761672, 'grm_norm': 'gcn', 'self_loops': False, 'use_snp_selection': True, 'num_snps': 47640}. Best is trial 27 with value: 0.3149905766649259.
[I 2025-12-08 11:27:22,593] Trial 44 finished with value: 0.3103297289022378 and parameters: {'model_type': 'gcn', 'hidden_dims': '[256, 128, 64]', 'dropout': 0.5555627591478971, 'batch_norm': True, 'lr': 0.000380737813935273, 'weight_decay': 4.469597231599302e-05, 'epochs': 79, 'loss': 'mae', 'optimizer': 'adam', 'graph_mode': 'cutoff', 'cutoff': 0.8541836620054772, 'grm_norm': 'gcn', 'self_loops': False, 'use_snp_selection': True, 'num_snps': 36478}. Best is trial 27 with value: 0.3149905766649259.
[I 2025-12-08 11:27:41,605] Trial 45 finished with value: 0.29788017792816446 and parameters: {'model_type': 'gcn', 'hidden_dims': '[256, 128, 64]', 'dropout': 0.5550934853115174, 'batch_norm': True, 'lr': 9.3771096230792e-05, 'weight_decay': 3.9898636075135315e-05, 'epochs': 65, 'loss': 'mae', 'optimizer': 'adam', 'graph_mode': 'cutoff', 'cutoff': 0.8964799895995232, 'grm_norm': 'gcn', 'self_loops': True, 'use_snp_selection': True, 'num_snps': 36761}. Best is trial 27 with value: 0.3149905766649259.
[I 2025-12-08 11:28:01,293] Trial 46 finished with value: 0.30841822354902765 and parameters: {'model_type': 'gcn', 'hidden_dims': '[256, 128, 64]', 'dropout': 0.5779426420595518, 'batch_norm': True, 'lr': 0.00038374884863327823, 'weight_decay': 2.08324292412138e-05, 'epochs': 75, 'loss': 'mae', 'optimizer': 'adam', 'graph_mode': 'cutoff', 'cutoff': 0.8528368263926654, 'grm_norm': 'gcn', 'self_loops': False, 'use_snp_selection': True, 'num_snps': 36247}. Best is trial 27 with value: 0.3149905766649259.
[I 2025-12-08 11:28:24,938] Trial 47 finished with value: 0.3055347132485054 and parameters: {'model_type': 'gcn', 'hidden_dims': '[512, 256]', 'dropout': 0.5424235853883485, 'batch_norm': True, 'lr': 0.0006852408954254215, 'weight_decay': 6.233262189100102e-05, 'epochs': 40, 'loss': 'mae', 'optimizer': 'adam', 'graph_mode': 'cutoff', 'cutoff': 0.8019002320274202, 'grm_norm': 'gcn', 'self_loops': False, 'use_snp_selection': True, 'num_snps': 49399}. Best is trial 27 with value: 0.3149905766649259.
[I 2025-12-08 11:28:48,561] Trial 48 finished with value: 0.24277768683571294 and parameters: {'model_type': 'gcn', 'hidden_dims': '[256, 128, 64]', 'dropout': 0.5769980358563352, 'batch_norm': False, 'lr': 0.00012834018185576675, 'weight_decay': 4.8328332342126714e-05, 'epochs': 83, 'loss': 'mae', 'optimizer': 'adam', 'graph_mode': 'cutoff', 'cutoff': 0.8483815664583201, 'grm_norm': 'cosine', 'self_loops': True, 'use_snp_selection': True, 'num_snps': 46823}. Best is trial 27 with value: 0.3149905766649259.
[I 2025-12-08 11:29:04,118] Trial 49 finished with value: 0.2842272097639257 and parameters: {'model_type': 'gcn', 'hidden_dims': '[128, 64]', 'dropout': 0.5872020003972442, 'batch_norm': True, 'lr': 0.0003475550703016173, 'weight_decay': 9.931528260271633e-05, 'epochs': 55, 'loss': 'mse', 'optimizer': 'adam', 'graph_mode': 'cutoff', 'cutoff': 0.5679340499104627, 'grm_norm': 'gcn', 'self_loops': False, 'use_snp_selection': True, 'num_snps': 35415}. Best is trial 27 with value: 0.3149905766649259.
[I 2025-12-08 11:29:27,663] Trial 50 finished with value: 0.23979957333047172 and parameters: {'model_type': 'gcn', 'hidden_dims': '[256, 128, 64]', 'dropout': 0.5601012259158076, 'batch_norm': True, 'lr': 0.0002011483004973518, 'weight_decay': 3.2843668268784816e-05, 'epochs': 102, 'loss': 'mae', 'optimizer': 'adam', 'graph_mode': 'knn', 'knn_k': 8, 'weighted_edges': False, 'symmetrize_mode': 'mutual', 'self_loops': False, 'use_snp_selection': True, 'num_snps': 40144}. Best is trial 27 with value: 0.3149905766649259.
[I 2025-12-08 11:30:00,723] Trial 51 finished with value: 0.3013903241516339 and parameters: {'model_type': 'gcn', 'hidden_dims': '[512, 64]', 'dropout': 0.44355101525882723, 'batch_norm': True, 'lr': 0.0005080055776984057, 'weight_decay': 8.280714049746152e-06, 'epochs': 94, 'loss': 'mae', 'optimizer': 'adam', 'graph_mode': 'cutoff', 'cutoff': 0.763114471591694, 'grm_norm': 'gcn', 'self_loops': False, 'use_snp_selection': True, 'num_snps': 48659}. Best is trial 27 with value: 0.3149905766649259.
[I 2025-12-08 11:30:22,100] Trial 52 finished with value: 0.3077254387317597 and parameters: {'model_type': 'gcn', 'hidden_dims': '[256, 128]', 'dropout': 0.5389659579679741, 'batch_norm': True, 'lr': 0.0001549054395508573, 'weight_decay': 5.644750337326252e-06, 'epochs': 122, 'loss': 'mae', 'optimizer': 'adam', 'graph_mode': 'cutoff', 'cutoff': 0.8602581762026508, 'grm_norm': 'none', 'self_loops': False, 'use_snp_selection': True, 'num_snps': 31899}. Best is trial 27 with value: 0.3149905766649259.
[I 2025-12-08 11:30:49,990] Trial 53 finished with value: 0.3025988874489419 and parameters: {'model_type': 'gcn', 'hidden_dims': '[256, 128, 64]', 'dropout': 0.46514883700772724, 'batch_norm': True, 'lr': 0.0003357105545857017, 'weight_decay': 1.4505167155191136e-05, 'epochs': 86, 'loss': 'mae', 'optimizer': 'adam', 'graph_mode': 'cutoff', 'cutoff': 0.7682062416503777, 'grm_norm': 'gcn', 'self_loops': False, 'use_snp_selection': True, 'num_snps': 59585}. Best is trial 27 with value: 0.3149905766649259.
[I 2025-12-08 11:31:07,367] Trial 54 finished with value: 0.29774966980677 and parameters: {'model_type': 'gcn', 'hidden_dims': '[512, 256]', 'dropout': 0.2502505841176442, 'batch_norm': True, 'lr': 0.00022234748702164536, 'weight_decay': 3.2833191883050095e-06, 'epochs': 70, 'loss': 'mae', 'optimizer': 'adam', 'graph_mode': 'cutoff', 'cutoff': 0.8089397588299606, 'grm_norm': 'cosine', 'self_loops': False, 'use_snp_selection': True, 'num_snps': 20994}. Best is trial 27 with value: 0.3149905766649259.
[I 2025-12-08 11:31:45,217] Trial 55 finished with value: 0.305388812295648 and parameters: {'model_type': 'gcn', 'hidden_dims': '[512, 128]', 'dropout': 0.4387471607946913, 'batch_norm': True, 'lr': 0.0003540213810123722, 'weight_decay': 2.0500082983949153e-05, 'epochs': 114, 'loss': 'mae', 'optimizer': 'adam', 'graph_mode': 'cutoff', 'cutoff': 0.8687792740633302, 'grm_norm': 'gcn', 'self_loops': False, 'use_snp_selection': True, 'num_snps': 50342}. Best is trial 27 with value: 0.3149905766649259.
[I 2025-12-08 11:32:12,538] Trial 56 finished with value: 0.13511835774401423 and parameters: {'model_type': 'gcn', 'hidden_dims': '[256, 128, 64]', 'dropout': 0.5663636096355309, 'batch_norm': False, 'lr': 0.0007184028738437975, 'weight_decay': 1.6233310259607941e-06, 'epochs': 152, 'loss': 'mae', 'optimizer': 'adam', 'graph_mode': 'cutoff', 'cutoff': 0.3930185938421627, 'grm_norm': 'gcn', 'self_loops': True, 'use_snp_selection': True, 'num_snps': 39637}. Best is trial 27 with value: 0.3149905766649259.
[I 2025-12-08 11:32:20,532] Trial 57 finished with value: 0.3054273279054868 and parameters: {'model_type': 'gcn', 'hidden_dims': '[256, 128]', 'dropout': 0.5992394026665285, 'batch_norm': True, 'lr': 0.0005043822280464729, 'weight_decay': 2.7549663869055923e-05, 'epochs': 51, 'loss': 'mae', 'optimizer': 'adam', 'graph_mode': 'cutoff', 'cutoff': 0.7493260987610537, 'grm_norm': 'none', 'self_loops': False, 'use_snp_selection': False}. Best is trial 27 with value: 0.3149905766649259.
[I 2025-12-08 11:32:35,172] Trial 58 finished with value: 0.305143124765898 and parameters: {'model_type': 'gcn', 'hidden_dims': '[256, 128, 64]', 'dropout': 0.5277904650100043, 'batch_norm': True, 'lr': 9.876046848645531e-05, 'weight_decay': 7.029812880416251e-06, 'epochs': 104, 'loss': 'mae', 'optimizer': 'adam', 'graph_mode': 'cutoff', 'cutoff': 0.8661905029845257, 'grm_norm': 'gcn', 'self_loops': False, 'use_snp_selection': False}. Best is trial 27 with value: 0.3149905766649259.
[I 2025-12-08 11:32:41,805] Trial 59 finished with value: 0.29350771243095186 and parameters: {'model_type': 'gcn', 'hidden_dims': '[128, 64]', 'dropout': 0.5004519186614026, 'batch_norm': True, 'lr': 0.00016973890528892838, 'weight_decay': 4.724800781634766e-05, 'epochs': 70, 'loss': 'mae', 'optimizer': 'adam', 'graph_mode': 'cutoff', 'cutoff': 0.6459961466030293, 'grm_norm': 'cosine', 'self_loops': False, 'use_snp_selection': False}. Best is trial 27 with value: 0.3149905766649259.
[I 2025-12-08 11:33:01,027] Trial 60 finished with value: 0.2551831499508427 and parameters: {'model_type': 'gcn', 'hidden_dims': '[256, 128, 64]', 'dropout': 0.13744024472126992, 'batch_norm': True, 'lr': 1.1490260535373481e-05, 'weight_decay': 1.5719963492684585e-05, 'epochs': 126, 'loss': 'mae', 'optimizer': 'adam', 'graph_mode': 'cutoff', 'cutoff': 0.8391211044966648, 'grm_norm': 'gcn', 'self_loops': False, 'use_snp_selection': True, 'num_snps': 24485}. Best is trial 27 with value: 0.3149905766649259.
[I 2025-12-08 11:33:28,103] Trial 61 finished with value: 0.3098571175979086 and parameters: {'model_type': 'gcn', 'hidden_dims': '[256, 128, 64]', 'dropout': 0.5005563728792443, 'batch_norm': True, 'lr': 0.0013652702773605935, 'weight_decay': 2.4570826464849398e-05, 'epochs': 96, 'loss': 'mae', 'optimizer': 'adam', 'graph_mode': 'cutoff', 'cutoff': 0.8121098549632012, 'grm_norm': 'gcn', 'self_loops': False, 'use_snp_selection': True, 'num_snps': 53717}. Best is trial 27 with value: 0.3149905766649259.
[I 2025-12-08 11:33:56,439] Trial 62 finished with value: 0.3083965596698532 and parameters: {'model_type': 'gcn', 'hidden_dims': '[256, 128, 64]', 'dropout': 0.4707544262110541, 'batch_norm': True, 'lr': 0.0014060868324699677, 'weight_decay': 2.2493074545413733e-05, 'epochs': 100, 'loss': 'mae', 'optimizer': 'adam', 'graph_mode': 'cutoff', 'cutoff': 0.7989231543395389, 'grm_norm': 'gcn', 'self_loops': False, 'use_snp_selection': True, 'num_snps': 55379}. Best is trial 27 with value: 0.3149905766649259.
[I 2025-12-08 11:34:20,761] Trial 63 finished with value: 0.30107151725643677 and parameters: {'model_type': 'gcn', 'hidden_dims': '[256, 128, 64]', 'dropout': 0.5097636316571393, 'batch_norm': True, 'lr': 0.004995978185448094, 'weight_decay': 3.210000019251862e-05, 'epochs': 78, 'loss': 'mae', 'optimizer': 'adam', 'graph_mode': 'cutoff', 'cutoff': 0.7036421594978005, 'grm_norm': 'gcn', 'self_loops': False, 'use_snp_selection': True, 'num_snps': 51202}. Best is trial 27 with value: 0.3149905766649259.
[I 2025-12-08 11:34:49,767] Trial 64 finished with value: 0.30647708574672416 and parameters: {'model_type': 'gcn', 'hidden_dims': '[256, 128, 64]', 'dropout': 0.5401197191883879, 'batch_norm': True, 'lr': 0.0010528695570254836, 'weight_decay': 1.2186396125757758e-05, 'epochs': 137, 'loss': 'mae', 'optimizer': 'adam', 'graph_mode': 'cutoff', 'cutoff': 0.8917013416705756, 'grm_norm': 'gcn', 'self_loops': False, 'use_snp_selection': True, 'num_snps': 47185}. Best is trial 27 with value: 0.3149905766649259.
[I 2025-12-08 11:35:14,721] Trial 65 finished with value: 0.3053471872162926 and parameters: {'model_type': 'gcn', 'hidden_dims': '[512, 128]', 'dropout': 0.48123323002109386, 'batch_norm': True, 'lr': 0.0016834392178811377, 'weight_decay': 6.544330395600002e-05, 'epochs': 92, 'loss': 'mae', 'optimizer': 'adam', 'graph_mode': 'cutoff', 'cutoff': 0.7420007266730011, 'grm_norm': 'gcn', 'self_loops': False, 'use_snp_selection': False}. Best is trial 27 with value: 0.3149905766649259.
