[I 2025-12-08 11:47:10,242] Trial 68 finished with value: 0.25658497984648687 and parameters: {'model_type': 'gcn', 'hidden_dims': '[512, 256]', 'dropout': 0.10870196300512489, 'batch_norm': True, 'lr': 0.0014531620232408522, 'weight_decay': 0.00011732563678063334, 'epochs': 60, 'loss': 'mae', 'optimizer': 'adam', 'graph_mode': 'cutoff', 'cutoff': 0.3010072963496919, 'grm_norm': 'cosine_then_gcn', 'self_loops': False, 'use_snp_selection': False}. Best is trial 51 with value: 0.3077853407165048.
[I 2025-12-08 11:47:26,189] Trial 69 finished with value: 0.28628672466003613 and parameters: {'model_type': 'gcn', 'hidden_dims': '[256, 128, 64]', 'dropout': 0.36461302203323614, 'batch_norm': True, 'lr': 0.007878964535265227, 'weight_decay': 2.036418381952567e-05, 'epochs': 76, 'loss': 'mae', 'optimizer': 'adam', 'graph_mode': 'cutoff', 'cutoff': 0.7444750197738846, 'grm_norm': 'cosine_then_gcn', 'self_loops': True, 'use_snp_selection': True, 'num_snps': 22792}. Best is trial 51 with value: 0.3077853407165048.
[I 2025-12-08 11:47:54,162] Trial 70 finished with value: 0.2819769119981985 and parameters: {'model_type': 'gcn', 'hidden_dims': '[512, 64]', 'dropout': 0.5555060048259682, 'batch_norm': True, 'lr': 0.005725484586207393, 'weight_decay': 0.0002527265652028316, 'epochs': 104, 'loss': 'mae', 'optimizer': 'adam', 'graph_mode': 'cutoff', 'cutoff': 0.8796574002090366, 'grm_norm': 'gcn', 'self_loops': False, 'use_snp_selection': False}. Best is trial 51 with value: 0.3077853407165048.
[I 2025-12-08 11:48:02,473] Trial 71 finished with value: 0.2967908048067716 and parameters: {'model_type': 'gcn', 'hidden_dims': '[256, 128, 64]', 'dropout': 0.5792926308854262, 'batch_norm': True, 'lr': 0.002134302227528301, 'weight_decay': 2.400329382481514e-05, 'epochs': 51, 'loss': 'mae', 'optimizer': 'adam', 'graph_mode': 'cutoff', 'cutoff': 0.6670638255506467, 'grm_norm': 'gcn', 'self_loops': False, 'use_snp_selection': False}. Best is trial 51 with value: 0.3077853407165048.
[I 2025-12-08 11:48:10,562] Trial 72 finished with value: 0.2937931790170311 and parameters: {'model_type': 'gcn', 'hidden_dims': '[256, 128, 64]', 'dropout': 0.5868922232030866, 'batch_norm': True, 'lr': 0.0018299936434415871, 'weight_decay': 1.0262746972534062e-05, 'epochs': 49, 'loss': 'mae', 'optimizer': 'adam', 'graph_mode': 'cutoff', 'cutoff': 0.5979353324467911, 'grm_norm': 'gcn', 'self_loops': False, 'use_snp_selection': False}. Best is trial 51 with value: 0.3077853407165048.
[I 2025-12-08 11:48:20,543] Trial 73 finished with value: 0.3017680789275042 and parameters: {'model_type': 'gcn', 'hidden_dims': '[256, 128, 64]', 'dropout': 0.5731837557717901, 'batch_norm': True, 'lr': 0.0024230325112761316, 'weight_decay': 4.307758119216191e-05, 'epochs': 65, 'loss': 'mae', 'optimizer': 'adam', 'graph_mode': 'cutoff', 'cutoff': 0.6753321017985661, 'grm_norm': 'gcn', 'self_loops': False, 'use_snp_selection': False}. Best is trial 51 with value: 0.3077853407165048.
[I 2025-12-08 11:48:30,777] Trial 74 finished with value: 0.29873537940485484 and parameters: {'model_type': 'gcn', 'hidden_dims': '[256, 128, 64]', 'dropout': 0.5358604532610657, 'batch_norm': True, 'lr': 0.002126439726538639, 'weight_decay': 4.399996855563826e-05, 'epochs': 67, 'loss': 'mae', 'optimizer': 'adam', 'graph_mode': 'cutoff', 'cutoff': 0.6978607785268176, 'grm_norm': 'gcn', 'self_loops': False, 'use_snp_selection': False}. Best is trial 51 with value: 0.3077853407165048.
[I 2025-12-08 11:48:43,757] Trial 75 finished with value: 0.2986714649662566 and parameters: {'model_type': 'gcn', 'hidden_dims': '[256, 128, 64]', 'dropout': 0.5322502646000805, 'batch_norm': True, 'lr': 0.0024548233158185255, 'weight_decay': 4.371644143821421e-05, 'epochs': 90, 'loss': 'mae', 'optimizer': 'adam', 'graph_mode': 'cutoff', 'cutoff': 0.6867666938767296, 'grm_norm': 'gcn', 'self_loops': False, 'use_snp_selection': False}. Best is trial 51 with value: 0.3077853407165048.
[I 2025-12-08 11:48:57,286] Trial 76 finished with value: 0.2643829925111844 and parameters: {'model_type': 'gcn', 'hidden_dims': '[256, 128, 64]', 'dropout': 0.5313078191799043, 'batch_norm': True, 'lr': 3.64882535819324e-05, 'weight_decay': 4.258832147866296e-05, 'epochs': 93, 'loss': 'mae', 'optimizer': 'adam', 'graph_mode': 'cutoff', 'cutoff': 0.686053635509149, 'grm_norm': 'cosine_then_gcn', 'self_loops': False, 'use_snp_selection': False}. Best is trial 51 with value: 0.3077853407165048.
[I 2025-12-08 11:49:09,683] Trial 77 finished with value: 0.29336477323110016 and parameters: {'model_type': 'gcn', 'hidden_dims': '[256, 128, 64]', 'dropout': 0.5992253764761897, 'batch_norm': True, 'lr': 0.0029417687402182686, 'weight_decay': 9.418266296016536e-05, 'epochs': 85, 'loss': 'mae', 'optimizer': 'adam', 'graph_mode': 'cutoff', 'cutoff': 0.6308671326679804, 'grm_norm': 'gcn', 'self_loops': False, 'use_snp_selection': False}. Best is trial 51 with value: 0.3077853407165048.
[I 2025-12-08 11:49:20,666] Trial 78 finished with value: 0.26796970220558064 and parameters: {'model_type': 'gcn', 'hidden_dims': '[256, 128, 64]', 'dropout': 0.503350900172105, 'batch_norm': True, 'lr': 0.001335250601995751, 'weight_decay': 3.392129985229564e-05, 'epochs': 68, 'loss': 'mse', 'optimizer': 'adam', 'graph_mode': 'knn', 'knn_k': 8, 'weighted_edges': False, 'symmetrize_mode': 'union', 'self_loops': False, 'use_snp_selection': False}. Best is trial 51 with value: 0.3077853407165048.
[I 2025-12-08 11:49:36,579] Trial 79 finished with value: 0.03370794161870815 and parameters: {'model_type': 'gcn', 'hidden_dims': '[256, 128, 64]', 'dropout': 0.541228320457671, 'batch_norm': False, 'lr': 0.0016522269462610768, 'weight_decay': 5.5304445755544006e-05, 'epochs': 116, 'loss': 'mae', 'optimizer': 'adam', 'graph_mode': 'cutoff', 'cutoff': 0.7076342636115678, 'grm_norm': 'none', 'self_loops': False, 'use_snp_selection': False}. Best is trial 51 with value: 0.3077853407165048.
[I 2025-12-08 11:49:55,642] Trial 80 finished with value: 0.2931971799917581 and parameters: {'model_type': 'gcn', 'hidden_dims': '[256, 128, 64]', 'dropout': 0.5690071543271352, 'batch_norm': True, 'lr': 0.0010687867170986374, 'weight_decay': 7.815420004962015e-05, 'epochs': 139, 'loss': 'mae', 'optimizer': 'adam', 'graph_mode': 'cutoff', 'cutoff': 0.7442220342918509, 'grm_norm': 'cosine', 'self_loops': False, 'use_snp_selection': False}. Best is trial 51 with value: 0.3077853407165048.
[I 2025-12-08 11:50:18,821] Trial 81 finished with value: 0.28866033617306075 and parameters: {'model_type': 'gcn', 'hidden_dims': '[256, 128]', 'dropout': 0.48511710090673815, 'batch_norm': True, 'lr': 0.00223450647155944, 'weight_decay': 4.699095917170986e-05, 'epochs': 182, 'loss': 'mae', 'optimizer': 'adam', 'graph_mode': 'cutoff', 'cutoff': 0.6756480056689891, 'grm_norm': 'gcn', 'self_loops': False, 'use_snp_selection': False}. Best is trial 51 with value: 0.3077853407165048.
[I 2025-12-08 11:50:28,321] Trial 82 finished with value: 0.2927475540247667 and parameters: {'model_type': 'gcn', 'hidden_dims': '[256, 128, 64]', 'dropout': 0.5531392479823105, 'batch_norm': True, 'lr': 0.002526643940925688, 'weight_decay': 0.00016475441714638146, 'epochs': 61, 'loss': 'mae', 'optimizer': 'adam', 'graph_mode': 'cutoff', 'cutoff': 0.6450857735010924, 'grm_norm': 'gcn', 'self_loops': False, 'use_snp_selection': False}. Best is trial 51 with value: 0.3077853407165048.
[I 2025-12-08 11:50:48,822] Trial 83 finished with value: 0.2920031115306924 and parameters: {'model_type': 'gcn', 'hidden_dims': '[512, 128]', 'dropout': 0.5889637563471345, 'batch_norm': True, 'lr': 0.0036071872024668137, 'weight_decay': 1.6361974166303124e-05, 'epochs': 73, 'loss': 'mae', 'optimizer': 'adam', 'graph_mode': 'cutoff', 'cutoff': 0.8156799031843569, 'grm_norm': 'gcn', 'self_loops': False, 'use_snp_selection': False}. Best is trial 51 with value: 0.3077853407165048.
[I 2025-12-08 11:51:03,009] Trial 84 finished with value: 0.25686273634966716 and parameters: {'model_type': 'gcn', 'hidden_dims': '[256, 128, 64]', 'dropout': 0.5094484923320348, 'batch_norm': True, 'lr': 0.004626429377722416, 'weight_decay': 0.0008452407838369545, 'epochs': 100, 'loss': 'mae', 'optimizer': 'adam', 'graph_mode': 'cutoff', 'cutoff': 0.7657144871972056, 'grm_norm': 'gcn', 'self_loops': False, 'use_snp_selection': False}. Best is trial 51 with value: 0.3077853407165048.
[I 2025-12-08 11:51:14,909] Trial 85 finished with value: 0.29467024937306785 and parameters: {'model_type': 'gcn', 'hidden_dims': '[256, 128, 64]', 'dropout': 0.5710149411145534, 'batch_norm': True, 'lr': 0.00039177282869221633, 'weight_decay': 2.9291055436915015e-05, 'epochs': 81, 'loss': 'mae', 'optimizer': 'adam', 'graph_mode': 'cutoff', 'cutoff': 0.6029787846239227, 'grm_norm': 'gcn', 'self_loops': False, 'use_snp_selection': False}. Best is trial 51 with value: 0.3077853407165048.
[I 2025-12-08 11:51:20,798] Trial 86 finished with value: 0.2972976150836241 and parameters: {'model_type': 'gcn', 'hidden_dims': '[128, 64]', 'dropout': 0.52423468473297, 'batch_norm': True, 'lr': 0.0015509247944241044, 'weight_decay': 6.339295511135454e-05, 'epochs': 58, 'loss': 'mae', 'optimizer': 'adam', 'graph_mode': 'cutoff', 'cutoff': 0.7286548750490057, 'grm_norm': 'cosine_then_gcn', 'self_loops': False, 'use_snp_selection': False}. Best is trial 51 with value: 0.3077853407165048.
[I 2025-12-08 11:51:28,775] Trial 87 finished with value: 0.29213109555023253 and parameters: {'model_type': 'gcn', 'hidden_dims': '[128, 64]', 'dropout': 0.5413745903492322, 'batch_norm': True, 'lr': 0.000571000324141017, 'weight_decay': 6.374799463880126e-05, 'epochs': 89, 'loss': 'mae', 'optimizer': 'adam', 'graph_mode': 'cutoff', 'cutoff': 0.7270533334492311, 'grm_norm': 'cosine_then_gcn', 'self_loops': False, 'use_snp_selection': False}. Best is trial 51 with value: 0.3077853407165048.
[I 2025-12-08 11:51:50,544] Trial 88 finished with value: 0.28592325087813686 and parameters: {'model_type': 'gcn', 'hidden_dims': '[128, 64]', 'dropout': 0.5212094319357289, 'batch_norm': True, 'lr': 0.0007156370211135824, 'weight_decay': 3.7854971238228027e-05, 'epochs': 68, 'loss': 'mae', 'optimizer': 'adam', 'graph_mode': 'cutoff', 'cutoff': 0.7071610664871334, 'grm_norm': 'cosine_then_gcn', 'self_loops': True, 'use_snp_selection': True, 'num_snps': 58833}. Best is trial 51 with value: 0.3077853407165048.
[I 2025-12-08 11:51:56,699] Trial 89 finished with value: 0.2789437581858202 and parameters: {'model_type': 'gcn', 'hidden_dims': '[128, 64]', 'dropout': 0.5278585900581152, 'batch_norm': True, 'lr': 0.0009159209211916549, 'weight_decay': 2.1375677551767067e-05, 'epochs': 58, 'loss': 'mae', 'optimizer': 'adam', 'graph_mode': 'knn', 'knn_k': 6, 'weighted_edges': True, 'symmetrize_mode': 'union', 'self_loops': False, 'use_snp_selection': False}. Best is trial 51 with value: 0.3077853407165048.
[I 2025-12-08 11:52:05,951] Trial 90 finished with value: 0.2624778706204556 and parameters: {'model_type': 'gcn', 'hidden_dims': '[128, 64]', 'dropout': 0.5583799063691806, 'batch_norm': True, 'lr': 1.207099933028454e-05, 'weight_decay': 9.579124068869177e-05, 'epochs': 108, 'loss': 'mse', 'optimizer': 'adam', 'graph_mode': 'cutoff', 'cutoff': 0.6532423913970191, 'grm_norm': 'cosine_then_gcn', 'self_loops': False, 'use_snp_selection': False}. Best is trial 51 with value: 0.3077853407165048.
[I 2025-12-08 11:52:13,711] Trial 91 finished with value: 0.2978900775581962 and parameters: {'model_type': 'gcn', 'hidden_dims': '[256, 128, 64]', 'dropout': 0.5742131028431112, 'batch_norm': True, 'lr': 0.0014508103384851772, 'weight_decay': 3.187245331503008e-05, 'epochs': 45, 'loss': 'mae', 'optimizer': 'adam', 'graph_mode': 'cutoff', 'cutoff': 0.6849327703406499, 'grm_norm': 'cosine_then_gcn', 'self_loops': False, 'use_snp_selection': False}. Best is trial 51 with value: 0.3077853407165048.
[I 2025-12-08 11:52:25,431] Trial 92 finished with value: 0.29541201096563874 and parameters: {'model_type': 'gcn', 'hidden_dims': '[256, 128, 64]', 'dropout': 0.5882248181827788, 'batch_norm': True, 'lr': 0.0017539405849539044, 'weight_decay': 3.3414045467258805e-05, 'epochs': 78, 'loss': 'mae', 'optimizer': 'adam', 'graph_mode': 'cutoff', 'cutoff': 0.6827941671056297, 'grm_norm': 'cosine_then_gcn', 'self_loops': False, 'use_snp_selection': False}. Best is trial 51 with value: 0.3077853407165048.
[I 2025-12-08 11:52:33,057] Trial 93 finished with value: 0.289519466053138 and parameters: {'model_type': 'gcn', 'hidden_dims': '[256, 128, 64]', 'dropout': 0.5716111230951271, 'batch_norm': True, 'lr': 0.0014900767088769679, 'weight_decay': 1.265002270077792e-05, 'epochs': 44, 'loss': 'mae', 'optimizer': 'adam', 'graph_mode': 'cutoff', 'cutoff': 0.7050817706707183, 'grm_norm': 'cosine_then_gcn', 'self_loops': False, 'use_snp_selection': False}. Best is trial 51 with value: 0.3077853407165048.
[I 2025-12-08 11:52:43,208] Trial 94 finished with value: 0.30278698304315077 and parameters: {'model_type': 'gcn', 'hidden_dims': '[256, 128, 64]', 'dropout': 0.5435991892902428, 'batch_norm': True, 'lr': 0.0011862372498854007, 'weight_decay': 4.531502462455673e-05, 'epochs': 65, 'loss': 'mae', 'optimizer': 'adam', 'graph_mode': 'cutoff', 'cutoff': 0.7442384804316579, 'grm_norm': 'cosine_then_gcn', 'self_loops': False, 'use_snp_selection': False}. Best is trial 51 with value: 0.3077853407165048.
[I 2025-12-08 11:52:53,241] Trial 95 finished with value: 0.2988830426194635 and parameters: {'model_type': 'gcn', 'hidden_dims': '[256, 128, 64]', 'dropout': 0.5493316003413012, 'batch_norm': True, 'lr': 0.0012205247789065917, 'weight_decay': 1.7046740090296887e-05, 'epochs': 64, 'loss': 'mae', 'optimizer': 'adam', 'graph_mode': 'cutoff', 'cutoff': 0.7524179474061279, 'grm_norm': 'cosine_then_gcn', 'self_loops': False, 'use_snp_selection': False}. Best is trial 51 with value: 0.3077853407165048.
[I 2025-12-08 11:53:03,394] Trial 96 finished with value: 0.297388567253125 and parameters: {'model_type': 'gcn', 'hidden_dims': '[256, 128, 64]', 'dropout': 0.5468028390382208, 'batch_norm': True, 'lr': 0.0012503027890008833, 'weight_decay': 4.7097066539168516e-05, 'epochs': 65, 'loss': 'mae', 'optimizer': 'adam', 'graph_mode': 'cutoff', 'cutoff': 0.7472888162155213, 'grm_norm': 'cosine_then_gcn', 'self_loops': False, 'use_snp_selection': False}. Best is trial 51 with value: 0.3077853407165048.
[I 2025-12-08 11:53:14,742] Trial 97 finished with value: 0.29499201649637546 and parameters: {'model_type': 'gcn', 'hidden_dims': '[256, 128, 64]', 'dropout': 0.5644206869073973, 'batch_norm': True, 'lr': 0.001072515310916159, 'weight_decay': 1.752432070062471e-05, 'epochs': 75, 'loss': 'mae', 'optimizer': 'adam', 'graph_mode': 'cutoff', 'cutoff': 0.802438823925107, 'grm_norm': 'cosine_then_gcn', 'self_loops': False, 'use_snp_selection': False}. Best is trial 51 with value: 0.3077853407165048.
[I 2025-12-08 11:53:23,486] Trial 98 finished with value: 0.01674179631216568 and parameters: {'model_type': 'gcn', 'hidden_dims': '[256, 128, 64]', 'dropout': 0.49078538897925605, 'batch_norm': False, 'lr': 0.0007891287714238155, 'weight_decay': 2.3074268541254026e-05, 'epochs': 54, 'loss': 'mae', 'optimizer': 'adam', 'graph_mode': 'cutoff', 'cutoff': 0.7540975844288534, 'grm_norm': 'cosine_then_gcn', 'self_loops': False, 'use_snp_selection': False}. Best is trial 51 with value: 0.3077853407165048.
[I 2025-12-08 11:53:31,229] Trial 99 finished with value: 0.29952917903004583 and parameters: {'model_type': 'gcn', 'hidden_dims': '[256, 128, 64]', 'dropout': 0.4629030970047564, 'batch_norm': True, 'lr': 0.0002687242345041775, 'weight_decay': 3.0227536342260427e-05, 'epochs': 45, 'loss': 'mae', 'optimizer': 'adam', 'graph_mode': 'cutoff', 'cutoff': 0.772062679119, 'grm_norm': 'cosine_then_gcn', 'self_loops': False, 'use_snp_selection': False}. Best is trial 51 with value: 0.3077853407165048.
[I 2025-12-08 11:53:39,102] Trial 100 finished with value: 0.295601280734474 and parameters: {'model_type': 'gcn', 'hidden_dims': '[256, 128, 64]', 'dropout': 0.4546697540669836, 'batch_norm': True, 'lr': 0.00027206271989384354, 'weight_decay': 2.8387415590168237e-05, 'epochs': 46, 'loss': 'mae', 'optimizer': 'adam', 'graph_mode': 'cutoff', 'cutoff': 0.7671250476094656, 'grm_norm': 'cosine_then_gcn', 'self_loops': False, 'use_snp_selection': False}. Best is trial 51 with value: 0.3077853407165048.
[I 2025-12-08 11:53:49,241] Trial 101 finished with value: 0.29739235079618787 and parameters: {'model_type': 'gcn', 'hidden_dims': '[256, 128, 64]', 'dropout': 0.5509323306908365, 'batch_norm': True, 'lr': 0.00014228564205956987, 'weight_decay': 3.8939600896169026e-05, 'epochs': 65, 'loss': 'mae', 'optimizer': 'adam', 'graph_mode': 'cutoff', 'cutoff': 0.7943167499030056, 'grm_norm': 'cosine_then_gcn', 'self_loops': False, 'use_snp_selection': False}. Best is trial 51 with value: 0.3077853407165048.
[I 2025-12-08 11:53:56,379] Trial 102 finished with value: 0.29240314715559523 and parameters: {'model_type': 'gcn', 'hidden_dims': '[256, 128, 64]', 'dropout': 0.5399968130339825, 'batch_norm': True, 'lr': 0.0003644903583356354, 'weight_decay': 4.9468995269406056e-05, 'epochs': 40, 'loss': 'mae', 'optimizer': 'adam', 'graph_mode': 'cutoff', 'cutoff': 0.8325340680730434, 'grm_norm': 'cosine_then_gcn', 'self_loops': False, 'use_snp_selection': False}. Best is trial 51 with value: 0.3077853407165048.
[I 2025-12-08 11:54:05,452] Trial 103 finished with value: 0.29404351398395767 and parameters: {'model_type': 'gcn', 'hidden_dims': '[256, 128, 64]', 'dropout': 0.5923054605373087, 'batch_norm': True, 'lr': 0.00022431933789587944, 'weight_decay': 1.7783405348753978e-05, 'epochs': 56, 'loss': 'mae', 'optimizer': 'adam', 'graph_mode': 'cutoff', 'cutoff': 0.6938489155795111, 'grm_norm': 'cosine_then_gcn', 'self_loops': False, 'use_snp_selection': False}. Best is trial 51 with value: 0.3077853407165048.
[I 2025-12-08 11:54:16,688] Trial 104 finished with value: 0.29334649648569583 and parameters: {'model_type': 'gcn', 'hidden_dims': '[256, 128, 64]', 'dropout': 0.47813966913790806, 'batch_norm': True, 'lr': 0.0004521933937882, 'weight_decay': 3.1484748420905266e-05, 'epochs': 74, 'loss': 'mae', 'optimizer': 'adam', 'graph_mode': 'cutoff', 'cutoff': 0.7126529042741009, 'grm_norm': 'cosine_then_gcn', 'self_loops': False, 'use_snp_selection': False}. Best is trial 51 with value: 0.3077853407165048.
[I 2025-12-08 11:54:35,007] Trial 105 finished with value: 0.2917369822780636 and parameters: {'model_type': 'gcn', 'hidden_dims': '[512, 256]', 'dropout': 0.5103113735001625, 'batch_norm': True, 'lr': 0.00032496443804283254, 'weight_decay': 1.4359879750342844e-07, 'epochs': 63, 'loss': 'mae', 'optimizer': 'adam', 'graph_mode': 'cutoff', 'cutoff': 0.7790039282910779, 'grm_norm': 'cosine_then_gcn', 'self_loops': False, 'use_snp_selection': False}. Best is trial 51 with value: 0.3077853407165048.
[I 2025-12-08 11:54:59,530] Trial 106 finished with value: 0.29626062352327487 and parameters: {'model_type': 'gcn', 'hidden_dims': '[512, 64]', 'dropout': 0.5780499499540335, 'batch_norm': True, 'lr': 0.0018434506894665476, 'weight_decay': 2.281233412052517e-05, 'epochs': 89, 'loss': 'mae', 'optimizer': 'adam', 'graph_mode': 'cutoff', 'cutoff': 0.7366629986595594, 'grm_norm': 'cosine', 'self_loops': False, 'use_snp_selection': False}. Best is trial 51 with value: 0.3077853407165048.
[I 2025-12-08 11:55:20,257] Trial 107 finished with value: 0.29854935045286235 and parameters: {'model_type': 'gcn', 'hidden_dims': '[256, 128, 64]', 'dropout': 0.5580261831638348, 'batch_norm': True, 'lr': 0.0024170659442301437, 'weight_decay': 5.891055435855002e-05, 'epochs': 46, 'loss': 'mae', 'optimizer': 'adam', 'graph_mode': 'cutoff', 'cutoff': 0.8108952813266063, 'grm_norm': 'cosine_then_gcn', 'self_loops': True, 'use_snp_selection': True, 'num_snps': 48434}. Best is trial 51 with value: 0.3077853407165048.
[I 2025-12-08 11:55:40,771] Trial 108 finished with value: 0.2901603262305337 and parameters: {'model_type': 'gcn', 'hidden_dims': '[256, 128, 64]', 'dropout': 0.412039837378222, 'batch_norm': True, 'lr': 0.002939137078013282, 'weight_decay': 8.064320345938936e-05, 'epochs': 45, 'loss': 'mae', 'optimizer': 'adam', 'graph_mode': 'cutoff', 'cutoff': 0.8520954946002988, 'grm_norm': 'cosine_then_gcn', 'self_loops': True, 'use_snp_selection': True, 'num_snps': 48324}. Best is trial 51 with value: 0.3077853407165048.
[I 2025-12-08 11:55:59,318] Trial 109 finished with value: 0.2882188879931686 and parameters: {'model_type': 'gcn', 'hidden_dims': '[256, 128, 64]', 'dropout': 0.5322622584761285, 'batch_norm': True, 'lr': 0.000643667770878442, 'weight_decay': 5.9854847841205384e-05, 'epochs': 56, 'loss': 'mae', 'optimizer': 'adam', 'graph_mode': 'cutoff', 'cutoff': 0.6283108409296119, 'grm_norm': 'none', 'self_loops': True, 'use_snp_selection': True, 'num_snps': 37416}. Best is trial 51 with value: 0.3077853407165048.
[I 2025-12-08 11:56:20,971] Trial 110 finished with value: 0.23930845510657534 and parameters: {'model_type': 'gcn', 'hidden_dims': '[256, 128, 64]', 'dropout': 0.5583858307479229, 'batch_norm': True, 'lr': 0.0024243916657532595, 'weight_decay': 0.00010467717286707069, 'epochs': 50, 'loss': 'mae', 'optimizer': 'adam', 'graph_mode': 'knn', 'knn_k': 2, 'weighted_edges': False, 'symmetrize_mode': 'mutual', 'self_loops': True, 'use_snp_selection': True, 'num_snps': 49490}. Best is trial 51 with value: 0.3077853407165048.
[I 2025-12-08 11:56:47,638] Trial 111 finished with value: 0.29698709999796324 and parameters: {'model_type': 'gcn', 'hidden_dims': '[256, 128, 64]', 'dropout': 0.5853277727564872, 'batch_norm': True, 'lr': 0.0013947852798472332, 'weight_decay': 1.4629951734944067e-05, 'epochs': 72, 'loss': 'mae', 'optimizer': 'adam', 'graph_mode': 'cutoff', 'cutoff': 0.8112796494208844, 'grm_norm': 'cosine_then_gcn', 'self_loops': True, 'use_snp_selection': True, 'num_snps': 59744}. Best is trial 51 with value: 0.3077853407165048.
