[I 2025-12-08 22:41:39,574] Trial 100 finished with value: 0.3069725546781857 and parameters: {'model_type': 'gcn', 'hidden_dims': '[512, 128]', 'dropout': 0.4722590921091528, 'batch_norm': True, 'lr': 9.184660060837554e-05, 'weight_decay': 6.241277181956397e-07, 'epochs': 59, 'loss': 'mae', 'optimizer': 'adam', 'graph_mode': 'cutoff', 'cutoff': 0.8370719171200125, 'grm_norm': 'cosine_then_gcn', 'self_loops': True, 'use_snp_selection': False}. Best is trial 88 with value: 0.3161096373420557.
[I 2025-12-08 22:42:35,609] Trial 101 finished with value: 0.30591764094542906 and parameters: {'model_type': 'gcn', 'hidden_dims': '[512, 64]', 'dropout': 0.5907561593765162, 'batch_norm': True, 'lr': 0.00019403131229342552, 'weight_decay': 0.00020332714219367337, 'epochs': 205, 'loss': 'mse', 'optimizer': 'adam', 'graph_mode': 'cutoff', 'cutoff': 0.736356214980248, 'grm_norm': 'cosine_then_gcn', 'self_loops': False, 'use_snp_selection': True, 'num_snps': 48739}. Best is trial 88 with value: 0.3161096373420557.
[I 2025-12-08 22:43:31,494] Trial 102 finished with value: 0.3107201864174821 and parameters: {'model_type': 'gcn', 'hidden_dims': '[512, 64]', 'dropout': 0.5481792166127052, 'batch_norm': True, 'lr': 0.00017703487945253688, 'weight_decay': 0.0005616519722760064, 'epochs': 231, 'loss': 'mse', 'optimizer': 'adam', 'graph_mode': 'cutoff', 'cutoff': 0.7461133614952531, 'grm_norm': 'cosine_then_gcn', 'self_loops': False, 'use_snp_selection': True, 'num_snps': 43957}. Best is trial 88 with value: 0.3161096373420557.
[I 2025-12-08 22:44:30,577] Trial 103 finished with value: 0.3012021131056735 and parameters: {'model_type': 'gcn', 'hidden_dims': '[512, 64]', 'dropout': 0.5733513762198765, 'batch_norm': True, 'lr': 0.00022770525276482389, 'weight_decay': 0.0006355919984342238, 'epochs': 253, 'loss': 'mse', 'optimizer': 'adam', 'graph_mode': 'cutoff', 'cutoff': 0.7112358094687133, 'grm_norm': 'cosine_then_gcn', 'self_loops': False, 'use_snp_selection': True, 'num_snps': 43595}. Best is trial 88 with value: 0.3161096373420557.
[I 2025-12-08 22:45:18,507] Trial 104 finished with value: 0.3057052159269162 and parameters: {'model_type': 'gcn', 'hidden_dims': '[512, 64]', 'dropout': 0.515859743044039, 'batch_norm': True, 'lr': 0.00013292597407825742, 'weight_decay': 2.0181357411681736e-07, 'epochs': 245, 'loss': 'mse', 'optimizer': 'adam', 'graph_mode': 'cutoff', 'cutoff': 0.796762399835025, 'grm_norm': 'cosine_then_gcn', 'self_loops': False, 'use_snp_selection': True, 'num_snps': 35157}. Best is trial 88 with value: 0.3161096373420557.
[I 2025-12-08 22:46:06,867] Trial 105 finished with value: 0.30497912294261004 and parameters: {'model_type': 'gcn', 'hidden_dims': '[512, 256]', 'dropout': 0.5055498054297242, 'batch_norm': True, 'lr': 0.0004165701260140491, 'weight_decay': 0.0001101629104387714, 'epochs': 223, 'loss': 'mse', 'optimizer': 'adam', 'graph_mode': 'cutoff', 'cutoff': 0.7589002457218714, 'grm_norm': 'cosine_then_gcn', 'self_loops': False, 'use_snp_selection': True, 'num_snps': 38388}. Best is trial 88 with value: 0.3161096373420557.
[I 2025-12-08 22:46:40,401] Trial 106 finished with value: 0.30015374776851644 and parameters: {'model_type': 'gcn', 'hidden_dims': '[256, 128]', 'dropout': 0.5469839220617442, 'batch_norm': True, 'lr': 0.00015067768135111495, 'weight_decay': 1.5194324161104278e-06, 'epochs': 265, 'loss': 'mse', 'optimizer': 'adam', 'graph_mode': 'cutoff', 'cutoff': 0.774245186793722, 'grm_norm': 'cosine_then_gcn', 'self_loops': False, 'use_snp_selection': True, 'num_snps': 33662}. Best is trial 88 with value: 0.3161096373420557.
[I 2025-12-08 22:47:15,608] Trial 107 finished with value: 0.2921918036244855 and parameters: {'model_type': 'gcn', 'hidden_dims': '[128, 64]', 'dropout': 0.5254143730943597, 'batch_norm': True, 'lr': 0.0038741929561874194, 'weight_decay': 0.0004365663008533026, 'epochs': 289, 'loss': 'mae', 'optimizer': 'adam', 'graph_mode': 'cutoff', 'cutoff': 0.7148928525645615, 'grm_norm': 'cosine_then_gcn', 'self_loops': False, 'use_snp_selection': True, 'num_snps': 50690}. Best is trial 88 with value: 0.3161096373420557.
[I 2025-12-08 22:47:53,837] Trial 108 finished with value: 0.21922159695510768 and parameters: {'model_type': 'gcn', 'hidden_dims': '[512, 256]', 'dropout': 0.1920006428060484, 'batch_norm': True, 'lr': 0.000273156545852302, 'weight_decay': 2.546285157907551e-07, 'epochs': 80, 'loss': 'mae', 'optimizer': 'adam', 'graph_mode': 'knn', 'knn_k': 2, 'weighted_edges': True, 'symmetrize_mode': 'union', 'self_loops': False, 'use_snp_selection': True, 'num_snps': 57691}. Best is trial 88 with value: 0.3161096373420557.
[I 2025-12-08 22:48:06,975] Trial 109 finished with value: 0.309748160969578 and parameters: {'model_type': 'gcn', 'hidden_dims': '[256, 128]', 'dropout': 0.4866989108561991, 'batch_norm': True, 'lr': 0.0055468047013979066, 'weight_decay': 1.3245641429644382e-07, 'epochs': 64, 'loss': 'mae', 'optimizer': 'adam', 'graph_mode': 'cutoff', 'cutoff': 0.6753841335625357, 'grm_norm': 'gcn', 'self_loops': False, 'use_snp_selection': False}. Best is trial 88 with value: 0.3161096373420557.
[I 2025-12-08 22:49:13,827] Trial 110 finished with value: 0.0 and parameters: {'model_type': 'gcn', 'hidden_dims': '[512, 64]', 'dropout': 0.5620842627773618, 'batch_norm': False, 'lr': 0.007664387792556558, 'weight_decay': 6.277054063672439e-05, 'epochs': 236, 'loss': 'mae', 'optimizer': 'adam', 'graph_mode': 'cutoff', 'cutoff': 0.8047764559481159, 'grm_norm': 'cosine_then_gcn', 'self_loops': False, 'use_snp_selection': True, 'num_snps': 54004}. Best is trial 88 with value: 0.3161096373420557.
[I 2025-12-08 22:50:05,493] Trial 111 finished with value: 0.3058652476334673 and parameters: {'model_type': 'gcn', 'hidden_dims': '[512, 64]', 'dropout': 0.5424262182796351, 'batch_norm': True, 'lr': 0.0001793064970609463, 'weight_decay': 0.00024429620089668955, 'epochs': 198, 'loss': 'mse', 'optimizer': 'adam', 'graph_mode': 'cutoff', 'cutoff': 0.7310038413451392, 'grm_norm': 'cosine_then_gcn', 'self_loops': False, 'use_snp_selection': True, 'num_snps': 45087}. Best is trial 88 with value: 0.3161096373420557.
[I 2025-12-08 22:50:56,768] Trial 112 finished with value: 0.3089985577498192 and parameters: {'model_type': 'gcn', 'hidden_dims': '[512, 64]', 'dropout': 0.5508113924075586, 'batch_norm': True, 'lr': 0.0002094749485675932, 'weight_decay': 0.0001552883744261054, 'epochs': 181, 'loss': 'mse', 'optimizer': 'adam', 'graph_mode': 'cutoff', 'cutoff': 0.7502333921700417, 'grm_norm': 'cosine_then_gcn', 'self_loops': False, 'use_snp_selection': True, 'num_snps': 46920}. Best is trial 88 with value: 0.3161096373420557.
[I 2025-12-08 22:51:22,364] Trial 113 finished with value: 0.3054948559727693 and parameters: {'model_type': 'gcn', 'hidden_dims': '[512, 64]', 'dropout': 0.5345342397873105, 'batch_norm': True, 'lr': 6.629734771437181e-05, 'weight_decay': 0.0005209592052032549, 'epochs': 45, 'loss': 'mse', 'optimizer': 'adam', 'graph_mode': 'cutoff', 'cutoff': 0.7408238788918751, 'grm_norm': 'cosine_then_gcn', 'self_loops': False, 'use_snp_selection': True, 'num_snps': 42706}. Best is trial 88 with value: 0.3161096373420557.
[I 2025-12-08 22:52:11,325] Trial 114 finished with value: 0.29578542846271094 and parameters: {'model_type': 'gcn', 'hidden_dims': '[512, 64]', 'dropout': 0.5876085861596305, 'batch_norm': True, 'lr': 5.4912103457015895e-05, 'weight_decay': 0.000279536563175768, 'epochs': 217, 'loss': 'mse', 'optimizer': 'adam', 'graph_mode': 'cutoff', 'cutoff': 0.6961135405591539, 'grm_norm': 'cosine_then_gcn', 'self_loops': False, 'use_snp_selection': True, 'num_snps': 39286}. Best is trial 88 with value: 0.3161096373420557.
[I 2025-12-08 22:53:16,447] Trial 115 finished with value: 0.3061715604793143 and parameters: {'model_type': 'gcn', 'hidden_dims': '[512, 128]', 'dropout': 0.3720802758344703, 'batch_norm': True, 'lr': 0.00016885114825567052, 'weight_decay': 0.00036662723116217145, 'epochs': 196, 'loss': 'mse', 'optimizer': 'adam', 'graph_mode': 'cutoff', 'cutoff': 0.7430504737810644, 'grm_norm': 'cosine_then_gcn', 'self_loops': False, 'use_snp_selection': True, 'num_snps': 59593}. Best is trial 88 with value: 0.3161096373420557.
[I 2025-12-08 22:54:14,447] Trial 116 finished with value: 0.3100045823741355 and parameters: {'model_type': 'gcn', 'hidden_dims': '[512, 256]', 'dropout': 0.573752052193295, 'batch_norm': True, 'lr': 0.00011831202464700159, 'weight_decay': 3.040793931865814e-07, 'epochs': 211, 'loss': 'mse', 'optimizer': 'adam', 'graph_mode': 'cutoff', 'cutoff': 0.7809966511398573, 'grm_norm': 'none', 'self_loops': False, 'use_snp_selection': False}. Best is trial 88 with value: 0.3161096373420557.
[I 2025-12-08 22:54:56,192] Trial 117 finished with value: 0.2951366495890672 and parameters: {'model_type': 'gcn', 'hidden_dims': '[256, 128]', 'dropout': 0.44807224944853685, 'batch_norm': True, 'lr': 0.00024132524131581008, 'weight_decay': 1.0001168073031828e-07, 'epochs': 227, 'loss': 'mae', 'optimizer': 'adam', 'graph_mode': 'cutoff', 'cutoff': 0.6125523793384687, 'grm_norm': 'cosine_then_gcn', 'self_loops': False, 'use_snp_selection': True, 'num_snps': 49993}. Best is trial 88 with value: 0.3161096373420557.
[I 2025-12-08 22:55:23,564] Trial 118 finished with value: 0.2910487993503806 and parameters: {'model_type': 'gcn', 'hidden_dims': '[512, 64]', 'dropout': 0.5054371939670628, 'batch_norm': True, 'lr': 4.169522128874677e-05, 'weight_decay': 0.000686581768548952, 'epochs': 85, 'loss': 'mae', 'optimizer': 'adam', 'graph_mode': 'cutoff', 'cutoff': 0.7220349587228917, 'grm_norm': 'cosine_then_gcn', 'self_loops': False, 'use_snp_selection': False}. Best is trial 88 with value: 0.3161096373420557.
[I 2025-12-08 22:56:19,982] Trial 119 finished with value: 0.2733636360335968 and parameters: {'model_type': 'gcn', 'hidden_dims': '[512, 256]', 'dropout': 0.5499184437066389, 'batch_norm': True, 'lr': 0.00033358896040196944, 'weight_decay': 0.00018304263626930085, 'epochs': 175, 'loss': 'mae', 'optimizer': 'adam', 'graph_mode': 'cutoff', 'cutoff': 0.5426548955746225, 'grm_norm': 'gcn', 'self_loops': False, 'use_snp_selection': True, 'num_snps': 55187}. Best is trial 88 with value: 0.3161096373420557.
[I 2025-12-08 22:57:11,864] Trial 120 finished with value: 0.30760546815284606 and parameters: {'model_type': 'gcn', 'hidden_dims': '[512, 128]', 'dropout': 0.518773295579634, 'batch_norm': True, 'lr': 0.0005209506078747956, 'weight_decay': 1.1699555477873767e-06, 'epochs': 168, 'loss': 'mae', 'optimizer': 'adam', 'graph_mode': 'cutoff', 'cutoff': 0.7629360868573714, 'grm_norm': 'cosine_then_gcn', 'self_loops': True, 'use_snp_selection': True, 'num_snps': 51557}. Best is trial 88 with value: 0.3161096373420557.
[I 2025-12-08 22:58:17,375] Trial 121 finished with value: 0.30259138298635435 and parameters: {'model_type': 'gcn', 'hidden_dims': '[512, 256]', 'dropout': 0.5741563807022503, 'batch_norm': True, 'lr': 0.00011712335303236083, 'weight_decay': 3.527066697381794e-07, 'epochs': 243, 'loss': 'mse', 'optimizer': 'adam', 'graph_mode': 'cutoff', 'cutoff': 0.7812225357898881, 'grm_norm': 'none', 'self_loops': False, 'use_snp_selection': False}. Best is trial 88 with value: 0.3161096373420557.
[I 2025-12-08 22:59:14,367] Trial 122 finished with value: 0.3087513553187406 and parameters: {'model_type': 'gcn', 'hidden_dims': '[512, 256]', 'dropout': 0.5616245441827946, 'batch_norm': True, 'lr': 8.922865309806125e-05, 'weight_decay': 2.999568685263481e-07, 'epochs': 208, 'loss': 'mse', 'optimizer': 'adam', 'graph_mode': 'cutoff', 'cutoff': 0.8178235297648355, 'grm_norm': 'none', 'self_loops': False, 'use_snp_selection': False}. Best is trial 88 with value: 0.3161096373420557.
[I 2025-12-08 23:00:11,952] Trial 123 finished with value: 0.309190864883788 and parameters: {'model_type': 'gcn', 'hidden_dims': '[512, 256]', 'dropout': 0.5783057260639081, 'batch_norm': True, 'lr': 0.0001261914725567973, 'weight_decay': 4.3992410223391004e-07, 'epochs': 213, 'loss': 'mse', 'optimizer': 'adam', 'graph_mode': 'cutoff', 'cutoff': 0.7420511705292834, 'grm_norm': 'none', 'self_loops': False, 'use_snp_selection': False}. Best is trial 88 with value: 0.3161096373420557.
[I 2025-12-08 23:01:00,942] Trial 124 finished with value: 0.29674399900984183 and parameters: {'model_type': 'gcn', 'hidden_dims': '[512, 256]', 'dropout': 0.5670783352469592, 'batch_norm': True, 'lr': 0.00014542028373544782, 'weight_decay': 6.71959838844542e-07, 'epochs': 185, 'loss': 'mse', 'optimizer': 'adam', 'graph_mode': 'cutoff', 'cutoff': 0.7001510919858612, 'grm_norm': 'none', 'self_loops': False, 'use_snp_selection': False}. Best is trial 88 with value: 0.3161096373420557.
[I 2025-12-08 23:01:54,405] Trial 125 finished with value: 0.30586417680339995 and parameters: {'model_type': 'gcn', 'hidden_dims': '[512, 256]', 'dropout': 0.5937713844381074, 'batch_norm': True, 'lr': 0.000183226868861305, 'weight_decay': 5.430021141565949e-07, 'epochs': 203, 'loss': 'mse', 'optimizer': 'adam', 'graph_mode': 'cutoff', 'cutoff': 0.7173660606819658, 'grm_norm': 'none', 'self_loops': False, 'use_snp_selection': False}. Best is trial 88 with value: 0.3161096373420557.
[I 2025-12-08 23:02:09,551] Trial 126 finished with value: 0.3026956745292889 and parameters: {'model_type': 'gcn', 'hidden_dims': '[256, 128, 64]', 'dropout': 0.5346573773160462, 'batch_norm': True, 'lr': 0.00010171335491942456, 'weight_decay': 2.177394354142796e-07, 'epochs': 89, 'loss': 'mse', 'optimizer': 'adam', 'graph_mode': 'cutoff', 'cutoff': 0.681257697814597, 'grm_norm': 'cosine', 'self_loops': False, 'use_snp_selection': False}. Best is trial 88 with value: 0.3161096373420557.
[I 2025-12-08 23:02:22,396] Trial 127 finished with value: 0.26509065037149787 and parameters: {'model_type': 'gcn', 'hidden_dims': '[256, 128]', 'dropout': 0.49434185581531387, 'batch_norm': True, 'lr': 0.00488155265894416, 'weight_decay': 1.5882385089430488e-07, 'epochs': 72, 'loss': 'mae', 'optimizer': 'adam', 'graph_mode': 'knn', 'knn_k': 7, 'weighted_edges': True, 'symmetrize_mode': 'union', 'self_loops': False, 'use_snp_selection': False}. Best is trial 88 with value: 0.3161096373420557.
[I 2025-12-08 23:03:25,289] Trial 128 finished with value: 0.3052576157023134 and parameters: {'model_type': 'gcn', 'hidden_dims': '[512, 256]', 'dropout': 0.5544165007397994, 'batch_norm': True, 'lr': 7.937922498739772e-05, 'weight_decay': 7.3872959754086475e-06, 'epochs': 279, 'loss': 'mae', 'optimizer': 'adam', 'graph_mode': 'cutoff', 'cutoff': 0.8527926252409155, 'grm_norm': 'cosine_then_gcn', 'self_loops': False, 'use_snp_selection': True, 'num_snps': 44607}. Best is trial 88 with value: 0.3161096373420557.
[I 2025-12-08 23:04:16,463] Trial 129 finished with value: 0.30844190706204594 and parameters: {'model_type': 'gcn', 'hidden_dims': '[512, 128]', 'dropout': 0.5837133734736526, 'batch_norm': True, 'lr': 0.00029738061272236186, 'weight_decay': 2.68686940032163e-07, 'epochs': 192, 'loss': 'mae', 'optimizer': 'adam', 'graph_mode': 'cutoff', 'cutoff': 0.6591384668983999, 'grm_norm': 'cosine_then_gcn', 'self_loops': False, 'use_snp_selection': False}. Best is trial 88 with value: 0.3161096373420557.
[I 2025-12-08 23:05:00,083] Trial 130 finished with value: -0.006664423233697821 and parameters: {'model_type': 'gcn', 'hidden_dims': '[512, 64]', 'dropout': 0.5411253860013086, 'batch_norm': False, 'lr': 0.0009895280973559076, 'weight_decay': 9.505416502597447e-07, 'epochs': 113, 'loss': 'mae', 'optimizer': 'adam', 'graph_mode': 'cutoff', 'cutoff': 0.7758772978126733, 'grm_norm': 'cosine_then_gcn', 'self_loops': False, 'use_snp_selection': True, 'num_snps': 58033}. Best is trial 88 with value: 0.3161096373420557.
[I 2025-12-08 23:05:11,189] Trial 131 finished with value: 0.30920456041093974 and parameters: {'model_type': 'gcn', 'hidden_dims': '[256, 128]', 'dropout': 0.4803376581202742, 'batch_norm': True, 'lr': 0.005639404135895532, 'weight_decay': 1.260391991539968e-07, 'epochs': 63, 'loss': 'mae', 'optimizer': 'adam', 'graph_mode': 'cutoff', 'cutoff': 0.6771379014769964, 'grm_norm': 'gcn', 'self_loops': False, 'use_snp_selection': False}. Best is trial 88 with value: 0.3161096373420557.
[I 2025-12-08 23:05:23,013] Trial 132 finished with value: 0.2959875501339654 and parameters: {'model_type': 'gcn', 'hidden_dims': '[256, 128]', 'dropout': 0.46774050841547254, 'batch_norm': True, 'lr': 0.0063115355747213235, 'weight_decay': 1.6362290390328046e-07, 'epochs': 68, 'loss': 'mae', 'optimizer': 'adam', 'graph_mode': 'cutoff', 'cutoff': 0.6323564076480853, 'grm_norm': 'gcn', 'self_loops': False, 'use_snp_selection': False}. Best is trial 88 with value: 0.3161096373420557.
[I 2025-12-08 23:05:39,023] Trial 133 finished with value: 0.3047925775201894 and parameters: {'model_type': 'gcn', 'hidden_dims': '[256, 128]', 'dropout': 0.48657480938128683, 'batch_norm': True, 'lr': 0.0033078517187371957, 'weight_decay': 3.701029216014258e-07, 'epochs': 97, 'loss': 'mae', 'optimizer': 'adam', 'graph_mode': 'cutoff', 'cutoff': 0.6707274499261021, 'grm_norm': 'gcn', 'self_loops': False, 'use_snp_selection': False}. Best is trial 88 with value: 0.3161096373420557.
[I 2025-12-08 23:05:48,378] Trial 134 finished with value: 0.30789178359987146 and parameters: {'model_type': 'gcn', 'hidden_dims': '[256, 128]', 'dropout': 0.4238674821323414, 'batch_norm': True, 'lr': 0.00020069846953549793, 'weight_decay': 1.3568953129929175e-07, 'epochs': 48, 'loss': 'mae', 'optimizer': 'adam', 'graph_mode': 'cutoff', 'cutoff': 0.6894499479797203, 'grm_norm': 'gcn', 'self_loops': False, 'use_snp_selection': False}. Best is trial 88 with value: 0.3161096373420557.
[I 2025-12-08 23:06:01,656] Trial 135 finished with value: 0.3114238020477439 and parameters: {'model_type': 'gcn', 'hidden_dims': '[256, 128]', 'dropout': 0.5279454368213186, 'batch_norm': True, 'lr': 0.003999033045941695, 'weight_decay': 2.3778209035631625e-07, 'epochs': 80, 'loss': 'mae', 'optimizer': 'adam', 'graph_mode': 'cutoff', 'cutoff': 0.7562830181026187, 'grm_norm': 'gcn', 'self_loops': False, 'use_snp_selection': False}. Best is trial 88 with value: 0.3161096373420557.
[I 2025-12-08 23:06:11,000] Trial 136 finished with value: 0.3084151768321598 and parameters: {'model_type': 'gcn', 'hidden_dims': '[128, 64]', 'dropout': 0.528600425615801, 'batch_norm': True, 'lr': 0.003954089787658172, 'weight_decay': 2.2520031010723894e-07, 'epochs': 80, 'loss': 'mae', 'optimizer': 'adam', 'graph_mode': 'cutoff', 'cutoff': 0.7640321677547361, 'grm_norm': 'cosine_then_gcn', 'self_loops': False, 'use_snp_selection': False}. Best is trial 88 with value: 0.3161096373420557.
[I 2025-12-08 23:07:14,087] Trial 137 finished with value: 0.3107869289574319 and parameters: {'model_type': 'gcn', 'hidden_dims': '[512, 256]', 'dropout': 0.5179904625490335, 'batch_norm': True, 'lr': 1.6470877605836787e-05, 'weight_decay': 4.6631040744940015e-07, 'epochs': 258, 'loss': 'mae', 'optimizer': 'adam', 'graph_mode': 'cutoff', 'cutoff': 0.7522044721196303, 'grm_norm': 'cosine_then_gcn', 'self_loops': False, 'use_snp_selection': True, 'num_snps': 47111}. Best is trial 88 with value: 0.3161096373420557.
[I 2025-12-08 23:07:56,001] Trial 138 finished with value: 0.3058494000193076 and parameters: {'model_type': 'gcn', 'hidden_dims': '[256, 128]', 'dropout': 0.5127026704186979, 'batch_norm': True, 'lr': 0.002847812065752442, 'weight_decay': 4.4495563931805493e-07, 'epochs': 261, 'loss': 'mae', 'optimizer': 'adam', 'graph_mode': 'cutoff', 'cutoff': 0.7535676994636922, 'grm_norm': 'cosine_then_gcn', 'self_loops': False, 'use_snp_selection': True, 'num_snps': 47258}. Best is trial 88 with value: 0.3161096373420557.
[I 2025-12-08 23:09:02,898] Trial 139 finished with value: 0.3049529007540911 and parameters: {'model_type': 'gcn', 'hidden_dims': '[512, 256]', 'dropout': 0.52374644071318, 'batch_norm': True, 'lr': 0.0022456038708831114, 'weight_decay': 7.733466849047954e-07, 'epochs': 252, 'loss': 'mae', 'optimizer': 'adam', 'graph_mode': 'cutoff', 'cutoff': 0.7333892364191766, 'grm_norm': 'cosine_then_gcn', 'self_loops': False, 'use_snp_selection': True, 'num_snps': 52358}. Best is trial 88 with value: 0.3161096373420557.
[I 2025-12-08 23:09:28,132] Trial 140 finished with value: 0.2901307270470038 and parameters: {'model_type': 'gcn', 'hidden_dims': '[512, 128]', 'dropout': 0.5063315283910111, 'batch_norm': True, 'lr': 1.7610358550631174e-05, 'weight_decay': 5.576299153843239e-07, 'epochs': 54, 'loss': 'mae', 'optimizer': 'adam', 'graph_mode': 'cutoff', 'cutoff': 0.7061594998068029, 'grm_norm': 'cosine_then_gcn', 'self_loops': True, 'use_snp_selection': True, 'num_snps': 42788}. Best is trial 88 with value: 0.3161096373420557.
[I 2025-12-08 23:10:36,234] Trial 141 finished with value: 0.30956830114201606 and parameters: {'model_type': 'gcn', 'hidden_dims': '[512, 256]', 'dropout': 0.5575716338322216, 'batch_norm': True, 'lr': 2.945994128136398e-05, 'weight_decay': 3.060478395173695e-07, 'epochs': 238, 'loss': 'mae', 'optimizer': 'adam', 'graph_mode': 'cutoff', 'cutoff': 0.7495341337208262, 'grm_norm': 'cosine_then_gcn', 'self_loops': False, 'use_snp_selection': True, 'num_snps': 56236}. Best is trial 88 with value: 0.3161096373420557.
[I 2025-12-08 23:11:07,831] Trial 142 finished with value: 0.30477528707536716 and parameters: {'model_type': 'gcn', 'hidden_dims': '[512, 256]', 'dropout': 0.5709738301958561, 'batch_norm': True, 'lr': 0.0002269013560975949, 'weight_decay': 4.012916930520674e-07, 'epochs': 76, 'loss': 'mae', 'optimizer': 'adam', 'graph_mode': 'cutoff', 'cutoff': 0.7845719948628949, 'grm_norm': 'cosine_then_gcn', 'self_loops': False, 'use_snp_selection': True, 'num_snps': 49301}. Best is trial 88 with value: 0.3161096373420557.
