[I 2025-12-08 20:40:02,399] Trial 149 finished with value: 0.3684864117260743 and parameters: {'model_type': 'gcn', 'hidden_dims': '[256, 128]', 'dropout': 0.5507169384398287, 'batch_norm': False, 'lr': 1.2720787044705923e-05, 'weight_decay': 1.927027136684622e-07, 'epochs': 252, 'loss': 'mse', 'optimizer': 'adam', 'graph_mode': 'knn', 'knn_k': 5, 'weighted_edges': True, 'symmetrize_mode': 'union', 'self_loops': False, 'use_snp_selection': True, 'num_snps': 20463}. Best is trial 127 with value: 0.3727583944850618.
[I 2025-12-08 20:40:31,560] Trial 0 finished with value: 0.2690058946309287 and parameters: {'model_type': 'gcn', 'hidden_dims': '[128, 64]', 'dropout': 0.199031432379812, 'batch_norm': True, 'lr': 1.8408544111075823e-05, 'weight_decay': 5.5136510071208614e-05, 'epochs': 336, 'loss': 'mae', 'optimizer': 'adam', 'graph_mode': 'knn', 'knn_k': 8, 'weighted_edges': True, 'symmetrize_mode': 'mutual', 'self_loops': True, 'use_snp_selection': True, 'num_snps': 27173}. Best is trial 0 with value: 0.2690058946309287.
[I 2025-12-08 20:41:09,960] Trial 1 finished with value: 0.21595838456019897 and parameters: {'model_type': 'gcn', 'hidden_dims': '[256, 128, 64]', 'dropout': 0.5543244404043342, 'batch_norm': True, 'lr': 7.981787657617978e-05, 'weight_decay': 2.8571789869344834e-07, 'epochs': 297, 'loss': 'mae', 'optimizer': 'adam', 'graph_mode': 'cutoff', 'cutoff': 0.3392632777751686, 'grm_norm': 'gcn', 'self_loops': False, 'use_snp_selection': False}. Best is trial 0 with value: 0.2690058946309287.
[I 2025-12-08 20:42:07,637] Trial 2 finished with value: 0.27155210583832884 and parameters: {'model_type': 'gcn', 'hidden_dims': '[512, 64]', 'dropout': 0.32815227354739207, 'batch_norm': True, 'lr': 0.000619605044204259, 'weight_decay': 0.0004086269831625786, 'epochs': 206, 'loss': 'mse', 'optimizer': 'adam', 'graph_mode': 'knn', 'knn_k': 4, 'weighted_edges': True, 'symmetrize_mode': 'union', 'self_loops': True, 'use_snp_selection': True, 'num_snps': 53035}. Best is trial 2 with value: 0.27155210583832884.
[I 2025-12-08 20:42:35,213] Trial 3 finished with value: 0.2590672712882675 and parameters: {'model_type': 'gcn', 'hidden_dims': '[256, 128]', 'dropout': 0.23110783056597514, 'batch_norm': True, 'lr': 8.11311593386298e-05, 'weight_decay': 9.296158109581328e-07, 'epochs': 213, 'loss': 'mse', 'optimizer': 'adam', 'graph_mode': 'knn', 'knn_k': 10, 'weighted_edges': True, 'symmetrize_mode': 'mutual', 'self_loops': True, 'use_snp_selection': False}. Best is trial 2 with value: 0.27155210583832884.
[I 2025-12-08 20:42:49,615] Trial 4 finished with value: 0.3608752207970768 and parameters: {'model_type': 'gcn', 'hidden_dims': '[512, 256]', 'dropout': 0.2753281956415665, 'batch_norm': True, 'lr': 0.00034435188114839693, 'weight_decay': 4.9416012835950194e-05, 'epochs': 89, 'loss': 'mae', 'optimizer': 'adam', 'graph_mode': 'cutoff', 'cutoff': 0.820078967317394, 'grm_norm': 'none', 'self_loops': False, 'use_snp_selection': True, 'num_snps': 12674}. Best is trial 4 with value: 0.3608752207970768.
[I 2025-12-08 20:43:14,769] Trial 5 finished with value: 0.3267923443932674 and parameters: {'model_type': 'gcn', 'hidden_dims': '[128, 64]', 'dropout': 0.5611163934517731, 'batch_norm': True, 'lr': 0.0003984856210762587, 'weight_decay': 1.1466743517565185e-07, 'epochs': 344, 'loss': 'mae', 'optimizer': 'adam', 'graph_mode': 'cutoff', 'cutoff': 0.6089370799714728, 'grm_norm': 'gcn', 'self_loops': True, 'use_snp_selection': False}. Best is trial 4 with value: 0.3608752207970768.
[I 2025-12-08 20:43:37,172] Trial 6 finished with value: 0.3031058828835367 and parameters: {'model_type': 'gcn', 'hidden_dims': '[128, 64]', 'dropout': 0.31805912766941713, 'batch_norm': True, 'lr': 1.2361026034262557e-05, 'weight_decay': 6.492620232791903e-06, 'epochs': 271, 'loss': 'mse', 'optimizer': 'adam', 'graph_mode': 'cutoff', 'cutoff': 0.6193362582230448, 'grm_norm': 'cosine', 'self_loops': False, 'use_snp_selection': True, 'num_snps': 28594}. Best is trial 4 with value: 0.3608752207970768.
[I 2025-12-08 20:43:56,955] Trial 7 finished with value: 0.26060405414406895 and parameters: {'model_type': 'gcn', 'hidden_dims': '[512, 64]', 'dropout': 0.471337288649717, 'batch_norm': True, 'lr': 2.239693207292708e-05, 'weight_decay': 2.263166635514082e-06, 'epochs': 69, 'loss': 'mse', 'optimizer': 'adam', 'graph_mode': 'cutoff', 'cutoff': 0.4056820886426376, 'grm_norm': 'cosine', 'self_loops': False, 'use_snp_selection': False}. Best is trial 4 with value: 0.3608752207970768.
[I 2025-12-08 20:44:34,406] Trial 8 finished with value: 0.34510949036330485 and parameters: {'model_type': 'gcn', 'hidden_dims': '[512, 256]', 'dropout': 0.20659328268932406, 'batch_norm': False, 'lr': 8.93315124361372e-05, 'weight_decay': 0.00028987480727919035, 'epochs': 136, 'loss': 'mae', 'optimizer': 'adam', 'graph_mode': 'knn', 'knn_k': 3, 'weighted_edges': False, 'symmetrize_mode': 'union', 'self_loops': False, 'use_snp_selection': True, 'num_snps': 43128}. Best is trial 4 with value: 0.3608752207970768.
[I 2025-12-08 20:45:16,475] Trial 9 finished with value: 0.004921163760434824 and parameters: {'model_type': 'gcn', 'hidden_dims': '[512, 256]', 'dropout': 0.2888209592870401, 'batch_norm': False, 'lr': 0.004734648143129892, 'weight_decay': 1.5879705591356368e-06, 'epochs': 163, 'loss': 'mse', 'optimizer': 'adam', 'graph_mode': 'cutoff', 'cutoff': 0.5984899797909019, 'grm_norm': 'cosine', 'self_loops': True, 'use_snp_selection': False}. Best is trial 4 with value: 0.3608752207970768.
[I 2025-12-08 20:45:25,610] Trial 10 finished with value: 0.30997142125266264 and parameters: {'model_type': 'gcn', 'hidden_dims': '[512, 128]', 'dropout': 0.11372025982957354, 'batch_norm': False, 'lr': 0.0023343012062770553, 'weight_decay': 4.14440562940608e-05, 'epochs': 41, 'loss': 'mae', 'optimizer': 'adam', 'graph_mode': 'cutoff', 'cutoff': 0.8740100033033124, 'grm_norm': 'none', 'self_loops': False, 'use_snp_selection': True, 'num_snps': 3859}. Best is trial 4 with value: 0.3608752207970768.
[I 2025-12-08 20:46:01,907] Trial 11 finished with value: 0.33814305560468483 and parameters: {'model_type': 'gcn', 'hidden_dims': '[512, 256]', 'dropout': 0.42220860806405436, 'batch_norm': False, 'lr': 0.00012587284186352953, 'weight_decay': 0.0006590033092812647, 'epochs': 114, 'loss': 'mae', 'optimizer': 'adam', 'graph_mode': 'knn', 'knn_k': 1, 'weighted_edges': False, 'symmetrize_mode': 'union', 'self_loops': False, 'use_snp_selection': True, 'num_snps': 47068}. Best is trial 4 with value: 0.3608752207970768.
[I 2025-12-08 20:46:16,585] Trial 12 finished with value: 0.34603818288231764 and parameters: {'model_type': 'gcn', 'hidden_dims': '[512, 256]', 'dropout': 0.14142767069304862, 'batch_norm': False, 'lr': 0.0011798598123878552, 'weight_decay': 9.414718277089941e-05, 'epochs': 124, 'loss': 'mae', 'optimizer': 'adam', 'graph_mode': 'knn', 'knn_k': 3, 'weighted_edges': False, 'symmetrize_mode': 'union', 'self_loops': False, 'use_snp_selection': True, 'num_snps': 8584}. Best is trial 4 with value: 0.3608752207970768.
[I 2025-12-08 20:46:29,231] Trial 13 finished with value: 0.35095482758083363 and parameters: {'model_type': 'gcn', 'hidden_dims': '[512, 256]', 'dropout': 0.13529665206282515, 'batch_norm': False, 'lr': 0.0013143362382724787, 'weight_decay': 5.2475435102613655e-05, 'epochs': 101, 'loss': 'mae', 'optimizer': 'adam', 'graph_mode': 'knn', 'knn_k': 6, 'weighted_edges': False, 'symmetrize_mode': 'union', 'self_loops': False, 'use_snp_selection': True, 'num_snps': 5870}. Best is trial 4 with value: 0.3608752207970768.
[I 2025-12-08 20:46:45,041] Trial 14 finished with value: 0.21300006369066243 and parameters: {'model_type': 'gcn', 'hidden_dims': '[512, 256]', 'dropout': 0.25632205209505254, 'batch_norm': False, 'lr': 0.00687208991084213, 'weight_decay': 1.8542303090238745e-05, 'epochs': 82, 'loss': 'mae', 'optimizer': 'adam', 'graph_mode': 'cutoff', 'cutoff': 0.8944237199027842, 'grm_norm': 'none', 'self_loops': False, 'use_snp_selection': True, 'num_snps': 15654}. Best is trial 4 with value: 0.3608752207970768.
[I 2025-12-08 20:46:59,138] Trial 15 finished with value: 0.2553061425075608 and parameters: {'model_type': 'gcn', 'hidden_dims': '[256, 128, 64]', 'dropout': 0.40991201822777057, 'batch_norm': False, 'lr': 0.0015315707618607853, 'weight_decay': 8.602279249719694e-06, 'epochs': 88, 'loss': 'mae', 'optimizer': 'adam', 'graph_mode': 'knn', 'knn_k': 7, 'weighted_edges': False, 'symmetrize_mode': 'union', 'self_loops': False, 'use_snp_selection': True, 'num_snps': 14623}. Best is trial 4 with value: 0.3608752207970768.
[I 2025-12-08 20:47:24,508] Trial 16 finished with value: 0.25700012718592313 and parameters: {'model_type': 'gcn', 'hidden_dims': '[512, 128]', 'dropout': 0.1573538820129295, 'batch_norm': True, 'lr': 0.0002351737822521291, 'weight_decay': 0.00013965361036408488, 'epochs': 168, 'loss': 'mae', 'optimizer': 'adam', 'graph_mode': 'knn', 'knn_k': 6, 'weighted_edges': False, 'symmetrize_mode': 'mutual', 'self_loops': False, 'use_snp_selection': True, 'num_snps': 19782}. Best is trial 4 with value: 0.3608752207970768.
[I 2025-12-08 20:47:33,336] Trial 17 finished with value: 0.337272221256136 and parameters: {'model_type': 'gcn', 'hidden_dims': '[256, 128]', 'dropout': 0.36694829928621503, 'batch_norm': False, 'lr': 0.0008407831391711085, 'weight_decay': 3.2193607048083006e-05, 'epochs': 45, 'loss': 'mae', 'optimizer': 'adam', 'graph_mode': 'cutoff', 'cutoff': 0.7365908344247583, 'grm_norm': 'cosine_then_gcn', 'self_loops': False, 'use_snp_selection': True, 'num_snps': 2778}. Best is trial 4 with value: 0.3608752207970768.
[I 2025-12-08 20:48:00,932] Trial 18 finished with value: 0.3370828759005101 and parameters: {'model_type': 'gcn', 'hidden_dims': '[512, 256]', 'dropout': 0.10093752871871903, 'batch_norm': True, 'lr': 0.00025458792542160157, 'weight_decay': 0.00021038576568746655, 'epochs': 162, 'loss': 'mae', 'optimizer': 'adam', 'graph_mode': 'knn', 'knn_k': 9, 'weighted_edges': False, 'symmetrize_mode': 'union', 'self_loops': False, 'use_snp_selection': True, 'num_snps': 22119}. Best is trial 4 with value: 0.3608752207970768.
[I 2025-12-08 20:48:50,511] Trial 19 finished with value: 0.2768338525034604 and parameters: {'model_type': 'gcn', 'hidden_dims': '[512, 256]', 'dropout': 0.17960265661255337, 'batch_norm': False, 'lr': 0.0029751110466155147, 'weight_decay': 0.0009506528840190462, 'epochs': 236, 'loss': 'mae', 'optimizer': 'adam', 'graph_mode': 'cutoff', 'cutoff': 0.2386548621641688, 'grm_norm': 'none', 'self_loops': False, 'use_snp_selection': True, 'num_snps': 37947}. Best is trial 4 with value: 0.3608752207970768.
[I 2025-12-08 20:49:03,562] Trial 20 finished with value: 0.3429080372362324 and parameters: {'model_type': 'gcn', 'hidden_dims': '[512, 256]', 'dropout': 0.2663159678862425, 'batch_norm': False, 'lr': 0.0005731795743213937, 'weight_decay': 1.3683815410345108e-05, 'epochs': 102, 'loss': 'mae', 'optimizer': 'adam', 'graph_mode': 'cutoff', 'cutoff': 0.7550233606026814, 'grm_norm': 'cosine_then_gcn', 'self_loops': False, 'use_snp_selection': True, 'num_snps': 8231}. Best is trial 4 with value: 0.3608752207970768.
[I 2025-12-08 20:49:19,846] Trial 21 finished with value: 0.35437675217052206 and parameters: {'model_type': 'gcn', 'hidden_dims': '[512, 256]', 'dropout': 0.14816933161539422, 'batch_norm': False, 'lr': 0.0013537347336362662, 'weight_decay': 7.99918651323841e-05, 'epochs': 127, 'loss': 'mae', 'optimizer': 'adam', 'graph_mode': 'knn', 'knn_k': 4, 'weighted_edges': False, 'symmetrize_mode': 'union', 'self_loops': False, 'use_snp_selection': True, 'num_snps': 10694}. Best is trial 4 with value: 0.3608752207970768.
[I 2025-12-08 20:49:36,279] Trial 22 finished with value: 0.3513554294763001 and parameters: {'model_type': 'gcn', 'hidden_dims': '[512, 256]', 'dropout': 0.14862402119463486, 'batch_norm': False, 'lr': 0.0017871558238094253, 'weight_decay': 8.58970861149538e-05, 'epochs': 137, 'loss': 'mae', 'optimizer': 'adam', 'graph_mode': 'knn', 'knn_k': 5, 'weighted_edges': False, 'symmetrize_mode': 'union', 'self_loops': False, 'use_snp_selection': True, 'num_snps': 9985}. Best is trial 4 with value: 0.3608752207970768.
[I 2025-12-08 20:49:55,060] Trial 23 finished with value: 0.3544545133427196 and parameters: {'model_type': 'gcn', 'hidden_dims': '[512, 256]', 'dropout': 0.2269626021187881, 'batch_norm': False, 'lr': 0.002888885298628879, 'weight_decay': 8.478361384762104e-05, 'epochs': 143, 'loss': 'mae', 'optimizer': 'adam', 'graph_mode': 'knn', 'knn_k': 4, 'weighted_edges': False, 'symmetrize_mode': 'union', 'self_loops': False, 'use_snp_selection': True, 'num_snps': 13392}. Best is trial 4 with value: 0.3608752207970768.
[I 2025-12-08 20:50:16,549] Trial 24 finished with value: 0.3334773644407738 and parameters: {'model_type': 'gcn', 'hidden_dims': '[512, 256]', 'dropout': 0.218992907733481, 'batch_norm': False, 'lr': 0.008911729923885699, 'weight_decay': 2.2820729421811944e-05, 'epochs': 150, 'loss': 'mae', 'optimizer': 'adam', 'graph_mode': 'knn', 'knn_k': 2, 'weighted_edges': False, 'symmetrize_mode': 'union', 'self_loops': False, 'use_snp_selection': True, 'num_snps': 16384}. Best is trial 4 with value: 0.3608752207970768.
[I 2025-12-08 20:50:32,116] Trial 25 finished with value: 0.22661830633205757 and parameters: {'model_type': 'gcn', 'hidden_dims': '[256, 128]', 'dropout': 0.2795346064592858, 'batch_norm': False, 'lr': 0.004166415497278944, 'weight_decay': 0.00021204739014888503, 'epochs': 69, 'loss': 'mae', 'optimizer': 'adam', 'graph_mode': 'knn', 'knn_k': 4, 'weighted_edges': True, 'symmetrize_mode': 'mutual', 'self_loops': False, 'use_snp_selection': True, 'num_snps': 23308}. Best is trial 4 with value: 0.3608752207970768.
[I 2025-12-08 20:51:22,292] Trial 26 finished with value: 0.2965987696878451 and parameters: {'model_type': 'gcn', 'hidden_dims': '[512, 128]', 'dropout': 0.24848276047057077, 'batch_norm': True, 'lr': 0.00018203604880502494, 'weight_decay': 3.815403381971014e-06, 'epochs': 192, 'loss': 'mse', 'optimizer': 'adam', 'graph_mode': 'knn', 'knn_k': 5, 'weighted_edges': False, 'symmetrize_mode': 'union', 'self_loops': True, 'use_snp_selection': False}. Best is trial 4 with value: 0.3608752207970768.
[I 2025-12-08 20:51:38,864] Trial 27 finished with value: 0.30641687860366157 and parameters: {'model_type': 'gcn', 'hidden_dims': '[256, 128, 64]', 'dropout': 0.31502635663371314, 'batch_norm': False, 'lr': 0.00044534174941250273, 'weight_decay': 0.0001322256081630224, 'epochs': 186, 'loss': 'mae', 'optimizer': 'adam', 'graph_mode': 'knn', 'knn_k': 1, 'weighted_edges': False, 'symmetrize_mode': 'union', 'self_loops': False, 'use_snp_selection': True, 'num_snps': 12425}. Best is trial 4 with value: 0.3608752207970768.
[I 2025-12-08 20:52:09,500] Trial 28 finished with value: 0.2897920993599016 and parameters: {'model_type': 'gcn', 'hidden_dims': '[512, 64]', 'dropout': 0.18367507169695763, 'batch_norm': True, 'lr': 0.000988349309914803, 'weight_decay': 7.237340129456459e-05, 'epochs': 122, 'loss': 'mae', 'optimizer': 'adam', 'graph_mode': 'cutoff', 'cutoff': 0.4665998502173344, 'grm_norm': 'none', 'self_loops': False, 'use_snp_selection': True, 'num_snps': 35311}. Best is trial 4 with value: 0.3608752207970768.
[I 2025-12-08 20:52:27,725] Trial 29 finished with value: 0.3068318727684467 and parameters: {'model_type': 'gcn', 'hidden_dims': '[128, 64]', 'dropout': 0.3674776600517156, 'batch_norm': True, 'lr': 4.1971329570623e-05, 'weight_decay': 3.494247901454111e-05, 'epochs': 239, 'loss': 'mae', 'optimizer': 'adam', 'graph_mode': 'knn', 'knn_k': 3, 'weighted_edges': False, 'symmetrize_mode': 'union', 'self_loops': True, 'use_snp_selection': True, 'num_snps': 19705}. Best is trial 4 with value: 0.3608752207970768.
[I 2025-12-08 20:52:46,290] Trial 30 finished with value: 0.336331580778377 and parameters: {'model_type': 'gcn', 'hidden_dims': '[512, 256]', 'dropout': 0.19123891041754157, 'batch_norm': False, 'lr': 0.002434914913071493, 'weight_decay': 0.0004857755286912348, 'epochs': 58, 'loss': 'mae', 'optimizer': 'adam', 'graph_mode': 'knn', 'knn_k': 4, 'weighted_edges': True, 'symmetrize_mode': 'mutual', 'self_loops': False, 'use_snp_selection': True, 'num_snps': 25573}. Best is trial 4 with value: 0.3608752207970768.
[I 2025-12-08 20:53:04,044] Trial 31 finished with value: 0.35251052926750787 and parameters: {'model_type': 'gcn', 'hidden_dims': '[512, 256]', 'dropout': 0.168359763109899, 'batch_norm': False, 'lr': 0.002279903143667238, 'weight_decay': 7.972372056890784e-05, 'epochs': 141, 'loss': 'mae', 'optimizer': 'adam', 'graph_mode': 'knn', 'knn_k': 5, 'weighted_edges': False, 'symmetrize_mode': 'union', 'self_loops': False, 'use_snp_selection': True, 'num_snps': 11594}. Best is trial 4 with value: 0.3608752207970768.
[I 2025-12-08 20:53:22,333] Trial 32 finished with value: 0.3390843714571321 and parameters: {'model_type': 'gcn', 'hidden_dims': '[512, 256]', 'dropout': 0.2211077681906026, 'batch_norm': False, 'lr': 0.004580985142652502, 'weight_decay': 5.816646127828982e-05, 'epochs': 144, 'loss': 'mae', 'optimizer': 'adam', 'graph_mode': 'knn', 'knn_k': 7, 'weighted_edges': False, 'symmetrize_mode': 'union', 'self_loops': False, 'use_snp_selection': True, 'num_snps': 11776}. Best is trial 4 with value: 0.3608752207970768.
[I 2025-12-08 20:53:40,729] Trial 33 finished with value: 0.3524505937046973 and parameters: {'model_type': 'gcn', 'hidden_dims': '[512, 256]', 'dropout': 0.17440780561885286, 'batch_norm': False, 'lr': 0.0008213915183251561, 'weight_decay': 0.00012839490517899268, 'epochs': 98, 'loss': 'mae', 'optimizer': 'adam', 'graph_mode': 'knn', 'knn_k': 5, 'weighted_edges': False, 'symmetrize_mode': 'union', 'self_loops': False, 'use_snp_selection': True, 'num_snps': 17071}. Best is trial 4 with value: 0.3608752207970768.
[I 2025-12-08 20:53:57,379] Trial 34 finished with value: 0.06253689836930462 and parameters: {'model_type': 'gcn', 'hidden_dims': '[256, 128, 64]', 'dropout': 0.2959293498203551, 'batch_norm': False, 'lr': 0.003957269972759954, 'weight_decay': 2.340397625905286e-05, 'epochs': 117, 'loss': 'mae', 'optimizer': 'adam', 'graph_mode': 'knn', 'knn_k': 4, 'weighted_edges': False, 'symmetrize_mode': 'union', 'self_loops': False, 'use_snp_selection': False}. Best is trial 4 with value: 0.3608752207970768.
[I 2025-12-08 20:54:09,457] Trial 35 finished with value: 0.260544967040529 and parameters: {'model_type': 'gcn', 'hidden_dims': '[512, 256]', 'dropout': 0.23621266477618597, 'batch_norm': True, 'lr': 0.001854808399290852, 'weight_decay': 0.0002733010300313192, 'epochs': 172, 'loss': 'mse', 'optimizer': 'adam', 'graph_mode': 'knn', 'knn_k': 2, 'weighted_edges': False, 'symmetrize_mode': 'union', 'self_loops': True, 'use_snp_selection': True, 'num_snps': 2194}. Best is trial 4 with value: 0.3608752207970768.
[I 2025-12-08 20:54:24,204] Trial 36 finished with value: 0.35181584188570475 and parameters: {'model_type': 'gcn', 'hidden_dims': '[512, 64]', 'dropout': 0.1170427319795625, 'batch_norm': True, 'lr': 0.0004790832806575043, 'weight_decay': 1.1405318136834657e-05, 'epochs': 148, 'loss': 'mae', 'optimizer': 'adam', 'graph_mode': 'cutoff', 'cutoff': 0.7351285364937507, 'grm_norm': 'none', 'self_loops': False, 'use_snp_selection': True, 'num_snps': 8263}. Best is trial 4 with value: 0.3608752207970768.
[I 2025-12-08 20:54:40,277] Trial 37 finished with value: 0.018637065696448265 and parameters: {'model_type': 'gcn', 'hidden_dims': '[128, 64]', 'dropout': 0.34351286695442756, 'batch_norm': False, 'lr': 0.006889282298883264, 'weight_decay': 5.342487051228569e-06, 'epochs': 205, 'loss': 'mse', 'optimizer': 'adam', 'graph_mode': 'knn', 'knn_k': 6, 'weighted_edges': False, 'symmetrize_mode': 'union', 'self_loops': True, 'use_snp_selection': False}. Best is trial 4 with value: 0.3608752207970768.
[I 2025-12-08 20:55:08,938] Trial 38 finished with value: 0.3518288825022432 and parameters: {'model_type': 'gcn', 'hidden_dims': '[256, 128]', 'dropout': 0.5258194955309446, 'batch_norm': True, 'lr': 0.00033899475229011243, 'weight_decay': 0.00039534301477023043, 'epochs': 223, 'loss': 'mae', 'optimizer': 'adam', 'graph_mode': 'cutoff', 'cutoff': 0.8056746653647534, 'grm_norm': 'gcn', 'self_loops': False, 'use_snp_selection': True, 'num_snps': 32919}. Best is trial 4 with value: 0.3608752207970768.
[I 2025-12-08 20:56:23,509] Trial 39 finished with value: 0.2719523083643318 and parameters: {'model_type': 'gcn', 'hidden_dims': '[512, 256]', 'dropout': 0.16284798691382887, 'batch_norm': False, 'lr': 0.000703534631817749, 'weight_decay': 4.144387967913756e-07, 'epochs': 289, 'loss': 'mae', 'optimizer': 'adam', 'graph_mode': 'knn', 'knn_k': 7, 'weighted_edges': False, 'symmetrize_mode': 'union', 'self_loops': False, 'use_snp_selection': False}. Best is trial 4 with value: 0.3608752207970768.
[I 2025-12-08 20:56:37,747] Trial 40 finished with value: 0.3375968298992752 and parameters: {'model_type': 'gcn', 'hidden_dims': '[512, 256]', 'dropout': 0.20472646518840387, 'batch_norm': True, 'lr': 0.002681264684602585, 'weight_decay': 0.00015598502112189715, 'epochs': 79, 'loss': 'mse', 'optimizer': 'adam', 'graph_mode': 'cutoff', 'cutoff': 0.685668372374435, 'grm_norm': 'cosine_then_gcn', 'self_loops': True, 'use_snp_selection': True, 'num_snps': 12204}. Best is trial 4 with value: 0.3608752207970768.
[I 2025-12-08 20:56:57,032] Trial 41 finished with value: 0.3497473647556433 and parameters: {'model_type': 'gcn', 'hidden_dims': '[512, 256]', 'dropout': 0.1791560428318725, 'batch_norm': False, 'lr': 0.0009393716016936861, 'weight_decay': 9.660780227689478e-05, 'epochs': 101, 'loss': 'mae', 'optimizer': 'adam', 'graph_mode': 'knn', 'knn_k': 5, 'weighted_edges': False, 'symmetrize_mode': 'union', 'self_loops': False, 'use_snp_selection': True, 'num_snps': 18124}. Best is trial 4 with value: 0.3608752207970768.
