[I 2025-12-08 12:29:47,290] Trial 49 finished with value: 0.2828373320263924 and parameters: {'model_type': 'gcn', 'hidden_dims': '[256, 128]', 'dropout': 0.19323410133580338, 'batch_norm': True, 'lr': 9.574181062929038e-05, 'weight_decay': 4.279400325533747e-06, 'epochs': 65, 'loss': 'mse', 'optimizer': 'adam', 'graph_mode': 'cutoff', 'cutoff': 0.86083917341904, 'grm_norm': 'cosine', 'self_loops': True, 'use_snp_selection': True, 'num_snps': 45155}. Best is trial 45 with value: 0.29729996560538824.
[I 2025-12-08 12:30:09,375] Trial 50 finished with value: 0.2666414249194134 and parameters: {'model_type': 'gcn', 'hidden_dims': '[256, 128]', 'dropout': 0.12492557455307572, 'batch_norm': False, 'lr': 0.00020514823514034483, 'weight_decay': 1.6594455244262465e-07, 'epochs': 86, 'loss': 'mae', 'optimizer': 'adam', 'graph_mode': 'knn', 'knn_k': 4, 'weighted_edges': True, 'symmetrize_mode': 'mutual', 'self_loops': True, 'use_snp_selection': True, 'num_snps': 41219}. Best is trial 45 with value: 0.29729996560538824.
[I 2025-12-08 12:30:39,057] Trial 51 finished with value: 0.29352676544255446 and parameters: {'model_type': 'gcn', 'hidden_dims': '[256, 128]', 'dropout': 0.10178142371668208, 'batch_norm': True, 'lr': 0.0003371357655794158, 'weight_decay': 7.606308322644896e-06, 'epochs': 110, 'loss': 'mae', 'optimizer': 'adam', 'graph_mode': 'cutoff', 'cutoff': 0.8636044939628463, 'grm_norm': 'cosine', 'self_loops': True, 'use_snp_selection': True, 'num_snps': 56319}. Best is trial 45 with value: 0.29729996560538824.
[I 2025-12-08 12:31:06,698] Trial 52 finished with value: 0.28572178999215236 and parameters: {'model_type': 'gcn', 'hidden_dims': '[256, 128]', 'dropout': 0.1044792859256847, 'batch_norm': True, 'lr': 0.0002787556084865715, 'weight_decay': 7.024406804666963e-06, 'epochs': 103, 'loss': 'mae', 'optimizer': 'adam', 'graph_mode': 'cutoff', 'cutoff': 0.879078035966297, 'grm_norm': 'cosine', 'self_loops': True, 'use_snp_selection': True, 'num_snps': 52506}. Best is trial 45 with value: 0.29729996560538824.
[I 2025-12-08 12:31:29,555] Trial 53 finished with value: 0.29514962633824915 and parameters: {'model_type': 'gcn', 'hidden_dims': '[256, 128]', 'dropout': 0.14977525794519134, 'batch_norm': True, 'lr': 0.0005900446413521374, 'weight_decay': 1.0575816976130027e-05, 'epochs': 53, 'loss': 'mae', 'optimizer': 'adam', 'graph_mode': 'cutoff', 'cutoff': 0.8957857488182468, 'grm_norm': 'cosine', 'self_loops': True, 'use_snp_selection': True, 'num_snps': 55234}. Best is trial 45 with value: 0.29729996560538824.
[I 2025-12-08 12:31:51,033] Trial 54 finished with value: 0.2873411345715814 and parameters: {'model_type': 'gcn', 'hidden_dims': '[256, 128]', 'dropout': 0.10135235636851467, 'batch_norm': True, 'lr': 0.00034982272942120753, 'weight_decay': 1.2984467683726625e-05, 'epochs': 55, 'loss': 'mae', 'optimizer': 'adam', 'graph_mode': 'cutoff', 'cutoff': 0.8916131226616808, 'grm_norm': 'cosine', 'self_loops': True, 'use_snp_selection': True, 'num_snps': 48690}. Best is trial 45 with value: 0.29729996560538824.
[I 2025-12-08 12:32:20,303] Trial 55 finished with value: 0.29453072578313694 and parameters: {'model_type': 'gcn', 'hidden_dims': '[512, 64]', 'dropout': 0.15320032735589917, 'batch_norm': True, 'lr': 0.0008453758720277974, 'weight_decay': 8.137451638898536e-06, 'epochs': 58, 'loss': 'mae', 'optimizer': 'adam', 'graph_mode': 'cutoff', 'cutoff': 0.8990524570609104, 'grm_norm': 'cosine', 'self_loops': True, 'use_snp_selection': True, 'num_snps': 55035}. Best is trial 45 with value: 0.29729996560538824.
[I 2025-12-08 12:32:54,482] Trial 56 finished with value: 0.28986369158442216 and parameters: {'model_type': 'gcn', 'hidden_dims': '[512, 64]', 'dropout': 0.15571645680797805, 'batch_norm': True, 'lr': 0.0007934262580418844, 'weight_decay': 1.738323359960336e-06, 'epochs': 79, 'loss': 'mae', 'optimizer': 'adam', 'graph_mode': 'cutoff', 'cutoff': 0.8978446605601647, 'grm_norm': 'cosine', 'self_loops': True, 'use_snp_selection': True, 'num_snps': 56368}. Best is trial 45 with value: 0.29729996560538824.
[I 2025-12-08 12:33:12,985] Trial 57 finished with value: -0.0029169762501572993 and parameters: {'model_type': 'gcn', 'hidden_dims': '[512, 64]', 'dropout': 0.19375095967731662, 'batch_norm': False, 'lr': 0.0019349963306628626, 'weight_decay': 9.374404938524929e-06, 'epochs': 55, 'loss': 'mae', 'optimizer': 'adam', 'graph_mode': 'cutoff', 'cutoff': 0.8562701796638092, 'grm_norm': 'cosine', 'self_loops': True, 'use_snp_selection': True, 'num_snps': 27372}. Best is trial 45 with value: 0.29729996560538824.
[I 2025-12-08 12:33:39,979] Trial 58 finished with value: 0.2823207466296715 and parameters: {'model_type': 'gcn', 'hidden_dims': '[512, 64]', 'dropout': 0.5259554517736127, 'batch_norm': True, 'lr': 0.0010397138000657166, 'weight_decay': 5.468373380535187e-05, 'epochs': 53, 'loss': 'mae', 'optimizer': 'adam', 'graph_mode': 'cutoff', 'cutoff': 0.5804095567689542, 'grm_norm': 'cosine', 'self_loops': True, 'use_snp_selection': True, 'num_snps': 50559}. Best is trial 45 with value: 0.29729996560538824.
[I 2025-12-08 12:34:02,423] Trial 59 finished with value: 0.28437657584164366 and parameters: {'model_type': 'gcn', 'hidden_dims': '[512, 64]', 'dropout': 0.14919936347942758, 'batch_norm': True, 'lr': 0.00016715647972543034, 'weight_decay': 3.3677455936763655e-05, 'epochs': 44, 'loss': 'mae', 'optimizer': 'adam', 'graph_mode': 'cutoff', 'cutoff': 0.7848188905225947, 'grm_norm': 'cosine', 'self_loops': True, 'use_snp_selection': True, 'num_snps': 42395}. Best is trial 45 with value: 0.29729996560538824.
[I 2025-12-08 12:34:24,679] Trial 60 finished with value: 0.24696204413735517 and parameters: {'model_type': 'gcn', 'hidden_dims': '[128, 64]', 'dropout': 0.26068914284715455, 'batch_norm': True, 'lr': 0.00022319477212578607, 'weight_decay': 1.73350062048936e-05, 'epochs': 92, 'loss': 'mae', 'optimizer': 'adam', 'graph_mode': 'cutoff', 'cutoff': 0.5195819104364899, 'grm_norm': 'cosine', 'self_loops': True, 'use_snp_selection': True, 'num_snps': 55234}. Best is trial 45 with value: 0.29729996560538824.
[I 2025-12-08 12:34:56,270] Trial 61 finished with value: 0.2836046694236864 and parameters: {'model_type': 'gcn', 'hidden_dims': '[256, 128, 64]', 'dropout': 0.11977825945458706, 'batch_norm': True, 'lr': 0.0003165105276063983, 'weight_decay': 6.622086187787003e-06, 'epochs': 133, 'loss': 'mae', 'optimizer': 'adam', 'graph_mode': 'cutoff', 'cutoff': 0.8603902102575269, 'grm_norm': 'cosine', 'self_loops': True, 'use_snp_selection': True, 'num_snps': 54136}. Best is trial 45 with value: 0.29729996560538824.
[I 2025-12-08 12:35:19,927] Trial 62 finished with value: 0.29008548772924986 and parameters: {'model_type': 'gcn', 'hidden_dims': '[256, 128]', 'dropout': 0.12778739607152081, 'batch_norm': True, 'lr': 0.0005741076955763673, 'weight_decay': 3.454852347851564e-06, 'epochs': 66, 'loss': 'mae', 'optimizer': 'adam', 'graph_mode': 'cutoff', 'cutoff': 0.8460888301237889, 'grm_norm': 'cosine', 'self_loops': True, 'use_snp_selection': True, 'num_snps': 52599}. Best is trial 45 with value: 0.29729996560538824.
[I 2025-12-08 12:35:45,246] Trial 63 finished with value: 0.2908705142707332 and parameters: {'model_type': 'gcn', 'hidden_dims': '[256, 128]', 'dropout': 0.1563552348207616, 'batch_norm': True, 'lr': 0.001139260177002485, 'weight_decay': 1.0851085716062212e-05, 'epochs': 99, 'loss': 'mae', 'optimizer': 'adam', 'graph_mode': 'cutoff', 'cutoff': 0.8814419937066061, 'grm_norm': 'cosine', 'self_loops': True, 'use_snp_selection': True, 'num_snps': 48061}. Best is trial 45 with value: 0.29729996560538824.
[I 2025-12-08 12:36:10,211] Trial 64 finished with value: 0.23713864308216479 and parameters: {'model_type': 'gcn', 'hidden_dims': '[512, 128]', 'dropout': 0.17844904732414882, 'batch_norm': True, 'lr': 0.00010460132313968016, 'weight_decay': 2.0514745298303587e-06, 'epochs': 123, 'loss': 'mae', 'optimizer': 'adam', 'graph_mode': 'cutoff', 'cutoff': 0.26066545760818777, 'grm_norm': 'cosine', 'self_loops': True, 'use_snp_selection': True, 'num_snps': 24741}. Best is trial 45 with value: 0.29729996560538824.
[I 2025-12-08 12:36:44,538] Trial 65 finished with value: 0.28466322484864565 and parameters: {'model_type': 'gcn', 'hidden_dims': '[512, 64]', 'dropout': 0.2952707868568926, 'batch_norm': True, 'lr': 0.0007227966238953133, 'weight_decay': 1.021023637790004e-06, 'epochs': 81, 'loss': 'mae', 'optimizer': 'adam', 'graph_mode': 'cutoff', 'cutoff': 0.7845332114224622, 'grm_norm': 'gcn', 'self_loops': True, 'use_snp_selection': True, 'num_snps': 56030}. Best is trial 45 with value: 0.29729996560538824.
[I 2025-12-08 12:37:14,597] Trial 66 finished with value: 0.26114551810565917 and parameters: {'model_type': 'gcn', 'hidden_dims': '[256, 128]', 'dropout': 0.10130027317005463, 'batch_norm': False, 'lr': 0.0014879444613200988, 'weight_decay': 8.26596518815611e-06, 'epochs': 113, 'loss': 'mae', 'optimizer': 'adam', 'graph_mode': 'cutoff', 'cutoff': 0.8254914694383244, 'grm_norm': 'cosine', 'self_loops': True, 'use_snp_selection': True, 'num_snps': 57440}. Best is trial 45 with value: 0.29729996560538824.
[I 2025-12-08 12:37:52,555] Trial 67 finished with value: 0.22719744780514795 and parameters: {'model_type': 'gcn', 'hidden_dims': '[512, 256]', 'dropout': 0.20806616634454267, 'batch_norm': True, 'lr': 0.00043481512484453224, 'weight_decay': 0.00044895801322180034, 'epochs': 141, 'loss': 'mae', 'optimizer': 'adam', 'graph_mode': 'knn', 'knn_k': 8, 'weighted_edges': True, 'symmetrize_mode': 'mutual', 'self_loops': True, 'use_snp_selection': False}. Best is trial 45 with value: 0.29729996560538824.
[I 2025-12-08 12:38:10,642] Trial 68 finished with value: 0.2715166311882427 and parameters: {'model_type': 'gcn', 'hidden_dims': '[512, 128]', 'dropout': 0.14806785217768342, 'batch_norm': True, 'lr': 1.1464401340513385e-05, 'weight_decay': 1.9600207316844612e-05, 'epochs': 92, 'loss': 'mse', 'optimizer': 'adam', 'graph_mode': 'cutoff', 'cutoff': 0.7170959704939591, 'grm_norm': 'cosine', 'self_loops': True, 'use_snp_selection': True, 'num_snps': 18825}. Best is trial 45 with value: 0.29729996560538824.
[I 2025-12-08 12:38:36,886] Trial 69 finished with value: 0.2903595298358377 and parameters: {'model_type': 'gcn', 'hidden_dims': '[256, 128]', 'dropout': 0.35075797134066955, 'batch_norm': True, 'lr': 0.0038657490724539473, 'weight_decay': 3.6182350122109704e-05, 'epochs': 73, 'loss': 'mae', 'optimizer': 'adam', 'graph_mode': 'cutoff', 'cutoff': 0.8915958586542891, 'grm_norm': 'none', 'self_loops': True, 'use_snp_selection': True, 'num_snps': 59854}. Best is trial 45 with value: 0.29729996560538824.
[I 2025-12-08 12:38:56,415] Trial 70 finished with value: 0.25476235237969846 and parameters: {'model_type': 'gcn', 'hidden_dims': '[128, 64]', 'dropout': 0.16431317074681606, 'batch_norm': True, 'lr': 0.0001658639804757339, 'weight_decay': 7.858115448310899e-05, 'epochs': 50, 'loss': 'mae', 'optimizer': 'adam', 'graph_mode': 'cutoff', 'cutoff': 0.38450338558246494, 'grm_norm': 'cosine', 'self_loops': True, 'use_snp_selection': True, 'num_snps': 53800}. Best is trial 45 with value: 0.29729996560538824.
[I 2025-12-08 12:39:26,112] Trial 71 finished with value: 0.2933917379794003 and parameters: {'model_type': 'gcn', 'hidden_dims': '[256, 128]', 'dropout': 0.13403176138217576, 'batch_norm': True, 'lr': 0.0006099990521401292, 'weight_decay': 4.042533640571855e-06, 'epochs': 107, 'loss': 'mae', 'optimizer': 'adam', 'graph_mode': 'cutoff', 'cutoff': 0.7637988170847978, 'grm_norm': 'cosine', 'self_loops': False, 'use_snp_selection': True, 'num_snps': 57975}. Best is trial 45 with value: 0.29729996560538824.
[I 2025-12-08 12:39:53,961] Trial 72 finished with value: 0.2928170380039611 and parameters: {'model_type': 'gcn', 'hidden_dims': '[256, 128]', 'dropout': 0.12703092748948008, 'batch_norm': True, 'lr': 0.0006277431197189848, 'weight_decay': 5.623109879881686e-06, 'epochs': 116, 'loss': 'mae', 'optimizer': 'adam', 'graph_mode': 'cutoff', 'cutoff': 0.8324636560391343, 'grm_norm': 'cosine', 'self_loops': False, 'use_snp_selection': True, 'num_snps': 49836}. Best is trial 45 with value: 0.29729996560538824.
[I 2025-12-08 12:40:21,100] Trial 73 finished with value: 0.28810319872766155 and parameters: {'model_type': 'gcn', 'hidden_dims': '[256, 128]', 'dropout': 0.14099722320740404, 'batch_norm': True, 'lr': 0.0009690941613377746, 'weight_decay': 3.794636707303466e-06, 'epochs': 110, 'loss': 'mae', 'optimizer': 'adam', 'graph_mode': 'cutoff', 'cutoff': 0.8051458200343413, 'grm_norm': 'cosine', 'self_loops': False, 'use_snp_selection': True, 'num_snps': 49364}. Best is trial 45 with value: 0.29729996560538824.
[I 2025-12-08 12:40:52,306] Trial 74 finished with value: 0.2912161811233844 and parameters: {'model_type': 'gcn', 'hidden_dims': '[256, 128]', 'dropout': 0.18382480150082747, 'batch_norm': True, 'lr': 0.0006019274238710875, 'weight_decay': 2.514703275180558e-06, 'epochs': 123, 'loss': 'mae', 'optimizer': 'adam', 'graph_mode': 'cutoff', 'cutoff': 0.8404588560991221, 'grm_norm': 'cosine', 'self_loops': False, 'use_snp_selection': True, 'num_snps': 56673}. Best is trial 45 with value: 0.29729996560538824.
[I 2025-12-08 12:41:21,020] Trial 75 finished with value: 0.2870809257707772 and parameters: {'model_type': 'gcn', 'hidden_dims': '[256, 128]', 'dropout': 0.22705533250324622, 'batch_norm': True, 'lr': 0.0004016663775355478, 'weight_decay': 1.1482848084312305e-05, 'epochs': 140, 'loss': 'mae', 'optimizer': 'adam', 'graph_mode': 'cutoff', 'cutoff': 0.7718028958700436, 'grm_norm': 'cosine', 'self_loops': False, 'use_snp_selection': True, 'num_snps': 46343}. Best is trial 45 with value: 0.29729996560538824.
[I 2025-12-08 12:42:02,490] Trial 76 finished with value: 0.2963146486787517 and parameters: {'model_type': 'gcn', 'hidden_dims': '[512, 128]', 'dropout': 0.11519804060509369, 'batch_norm': True, 'lr': 0.0002443074427386903, 'weight_decay': 5.4025062492736345e-06, 'epochs': 131, 'loss': 'mae', 'optimizer': 'adam', 'graph_mode': 'cutoff', 'cutoff': 0.7158753135210231, 'grm_norm': 'gcn', 'self_loops': False, 'use_snp_selection': True, 'num_snps': 51276}. Best is trial 45 with value: 0.29729996560538824.
[I 2025-12-08 12:42:51,253] Trial 77 finished with value: 0.28214252009712376 and parameters: {'model_type': 'gcn', 'hidden_dims': '[512, 128]', 'dropout': 0.1093298514448786, 'batch_norm': True, 'lr': 7.287220840504554e-05, 'weight_decay': 8.034716466312605e-06, 'epochs': 166, 'loss': 'mae', 'optimizer': 'adam', 'graph_mode': 'cutoff', 'cutoff': 0.7134588510600632, 'grm_norm': 'gcn', 'self_loops': False, 'use_snp_selection': True, 'num_snps': 51921}. Best is trial 45 with value: 0.29729996560538824.
[I 2025-12-08 12:43:15,636] Trial 78 finished with value: 0.21950141955417815 and parameters: {'model_type': 'gcn', 'hidden_dims': '[512, 128]', 'dropout': 0.16628328148229907, 'batch_norm': False, 'lr': 0.0002830919013875601, 'weight_decay': 2.94712581832038e-06, 'epochs': 87, 'loss': 'mae', 'optimizer': 'adam', 'graph_mode': 'knn', 'knn_k': 3, 'weighted_edges': False, 'symmetrize_mode': 'union', 'self_loops': False, 'use_snp_selection': False}. Best is trial 45 with value: 0.29729996560538824.
[I 2025-12-08 12:44:00,151] Trial 79 finished with value: 0.2820640620795161 and parameters: {'model_type': 'gcn', 'hidden_dims': '[512, 128]', 'dropout': 0.1411122728403445, 'batch_norm': True, 'lr': 0.00022357521933542702, 'weight_decay': 0.0002794656949026854, 'epochs': 126, 'loss': 'mse', 'optimizer': 'adam', 'graph_mode': 'cutoff', 'cutoff': 0.6624516937306113, 'grm_norm': 'gcn', 'self_loops': False, 'use_snp_selection': True, 'num_snps': 57861}. Best is trial 45 with value: 0.29729996560538824.
[I 2025-12-08 12:44:44,246] Trial 80 finished with value: 0.29556600691607127 and parameters: {'model_type': 'gcn', 'hidden_dims': '[512, 128]', 'dropout': 0.11518855500966538, 'batch_norm': True, 'lr': 0.00011786426878073738, 'weight_decay': 5.097453350166535e-06, 'epochs': 133, 'loss': 'mae', 'optimizer': 'adam', 'graph_mode': 'cutoff', 'cutoff': 0.731813502897068, 'grm_norm': 'gcn', 'self_loops': False, 'use_snp_selection': True, 'num_snps': 55126}. Best is trial 45 with value: 0.29729996560538824.
[I 2025-12-08 12:45:33,340] Trial 81 finished with value: 0.2853234024687149 and parameters: {'model_type': 'gcn', 'hidden_dims': '[512, 128]', 'dropout': 0.11443607915546147, 'batch_norm': True, 'lr': 5.278656612492238e-05, 'weight_decay': 4.73893581159064e-06, 'epochs': 154, 'loss': 'mae', 'optimizer': 'adam', 'graph_mode': 'cutoff', 'cutoff': 0.7210759214407378, 'grm_norm': 'gcn', 'self_loops': False, 'use_snp_selection': True, 'num_snps': 55713}. Best is trial 45 with value: 0.29729996560538824.
[I 2025-12-08 12:46:19,107] Trial 82 finished with value: 0.2797734326504277 and parameters: {'model_type': 'gcn', 'hidden_dims': '[512, 128]', 'dropout': 0.1317511941995121, 'batch_norm': True, 'lr': 0.00011482755062330563, 'weight_decay': 1.3617454067306162e-05, 'epochs': 131, 'loss': 'mae', 'optimizer': 'adam', 'graph_mode': 'cutoff', 'cutoff': 0.7609654698609775, 'grm_norm': 'gcn', 'self_loops': False, 'use_snp_selection': True, 'num_snps': 58231}. Best is trial 45 with value: 0.29729996560538824.
[I 2025-12-08 12:47:05,403] Trial 83 finished with value: 0.2917019331698051 and parameters: {'model_type': 'gcn', 'hidden_dims': '[512, 128]', 'dropout': 0.15416195907881192, 'batch_norm': True, 'lr': 0.00015742523608769927, 'weight_decay': 9.757670434266668e-06, 'epochs': 144, 'loss': 'mae', 'optimizer': 'adam', 'graph_mode': 'cutoff', 'cutoff': 0.6881001469349473, 'grm_norm': 'gcn', 'self_loops': False, 'use_snp_selection': True, 'num_snps': 55165}. Best is trial 45 with value: 0.29729996560538824.
[I 2025-12-08 12:47:47,238] Trial 84 finished with value: 0.2868184449872074 and parameters: {'model_type': 'gcn', 'hidden_dims': '[512, 128]', 'dropout': 0.11526362727584541, 'batch_norm': True, 'lr': 3.228938284457924e-05, 'weight_decay': 2.109280939481375e-06, 'epochs': 108, 'loss': 'mae', 'optimizer': 'adam', 'graph_mode': 'cutoff', 'cutoff': 0.7376894830998894, 'grm_norm': 'gcn', 'self_loops': False, 'use_snp_selection': True, 'num_snps': 59588}. Best is trial 45 with value: 0.29729996560538824.
[I 2025-12-08 12:48:14,124] Trial 85 finished with value: 0.2776125208299428 and parameters: {'model_type': 'gcn', 'hidden_dims': '[256, 128, 64]', 'dropout': 0.1972069985515881, 'batch_norm': True, 'lr': 0.0004981347900014416, 'weight_decay': 7.006033602621985e-06, 'epochs': 96, 'loss': 'mae', 'optimizer': 'adam', 'graph_mode': 'cutoff', 'cutoff': 0.8001288823127575, 'grm_norm': 'gcn', 'self_loops': False, 'use_snp_selection': True, 'num_snps': 51975}. Best is trial 45 with value: 0.29729996560538824.
[I 2025-12-08 12:49:08,453] Trial 86 finished with value: 0.2832045415154506 and parameters: {'model_type': 'gcn', 'hidden_dims': '[512, 128]', 'dropout': 0.14326978311331914, 'batch_norm': True, 'lr': 8.089944629015616e-05, 'weight_decay': 3.852863533826134e-06, 'epochs': 187, 'loss': 'mae', 'optimizer': 'adam', 'graph_mode': 'cutoff', 'cutoff': 0.6579738116592277, 'grm_norm': 'gcn', 'self_loops': False, 'use_snp_selection': True, 'num_snps': 54100}. Best is trial 45 with value: 0.29729996560538824.
[I 2025-12-08 12:49:39,497] Trial 87 finished with value: 0.28253625721015524 and parameters: {'model_type': 'gcn', 'hidden_dims': '[512, 256]', 'dropout': 0.33648207409967423, 'batch_norm': True, 'lr': 0.0002378855854751991, 'weight_decay': 5.174027960473447e-06, 'epochs': 61, 'loss': 'mae', 'optimizer': 'adam', 'graph_mode': 'cutoff', 'cutoff': 0.697359170766507, 'grm_norm': 'none', 'self_loops': False, 'use_snp_selection': True, 'num_snps': 57913}. Best is trial 45 with value: 0.29729996560538824.
[I 2025-12-08 12:49:58,675] Trial 88 finished with value: 0.2805227536224639 and parameters: {'model_type': 'gcn', 'hidden_dims': '[512, 64]', 'dropout': 0.10019763231094017, 'batch_norm': True, 'lr': 0.00018229498144289828, 'weight_decay': 3.258137148019983e-06, 'epochs': 170, 'loss': 'mae', 'optimizer': 'adam', 'graph_mode': 'cutoff', 'cutoff': 0.8739679194566444, 'grm_norm': 'gcn', 'self_loops': False, 'use_snp_selection': True, 'num_snps': 13328}. Best is trial 45 with value: 0.29729996560538824.
[I 2025-12-08 12:50:27,723] Trial 89 finished with value: 0.28434543935147305 and parameters: {'model_type': 'gcn', 'hidden_dims': '[512, 128]', 'dropout': 0.16530242227707914, 'batch_norm': True, 'lr': 0.0008208084519461241, 'weight_decay': 0.0005840983989585939, 'epochs': 120, 'loss': 'mae', 'optimizer': 'adam', 'graph_mode': 'cutoff', 'cutoff': 0.7720564042118115, 'grm_norm': 'none', 'self_loops': False, 'use_snp_selection': True, 'num_snps': 33479}. Best is trial 45 with value: 0.29729996560538824.
[I 2025-12-08 12:50:35,234] Trial 90 finished with value: 0.2611956437970675 and parameters: {'model_type': 'gcn', 'hidden_dims': '[256, 128]', 'dropout': 0.1256399395431029, 'batch_norm': True, 'lr': 0.00013336740068816717, 'weight_decay': 4.157681433024091e-07, 'epochs': 43, 'loss': 'mae', 'optimizer': 'adam', 'graph_mode': 'knn', 'knn_k': 5, 'weighted_edges': False, 'symmetrize_mode': 'mutual', 'self_loops': False, 'use_snp_selection': False}. Best is trial 45 with value: 0.29729996560538824.
[I 2025-12-08 12:51:03,229] Trial 91 finished with value: 0.29208154662341845 and parameters: {'model_type': 'gcn', 'hidden_dims': '[256, 128]', 'dropout': 0.13169105552933175, 'batch_norm': True, 'lr': 0.0006785265947147081, 'weight_decay': 5.704701438395911e-06, 'epochs': 118, 'loss': 'mae', 'optimizer': 'adam', 'graph_mode': 'cutoff', 'cutoff': 0.8230914816021513, 'grm_norm': 'cosine', 'self_loops': False, 'use_snp_selection': True, 'num_snps': 50077}. Best is trial 45 with value: 0.29729996560538824.
