[I 2025-12-08 19:58:44,023] Trial 93 finished with value: 0.301091552225038 and parameters: {'model_type': 'gcn', 'hidden_dims': '[512, 64]', 'dropout': 0.5868113217939623, 'batch_norm': True, 'lr': 0.005687632172062806, 'weight_decay': 1.1063653004529774e-06, 'epochs': 196, 'loss': 'mse', 'optimizer': 'adam', 'graph_mode': 'cutoff', 'cutoff': 0.7370910844365904, 'grm_norm': 'cosine_then_gcn', 'self_loops': True, 'use_snp_selection': False}. Best is trial 91 with value: 0.30501010443916743.
[I 2025-12-08 19:59:29,995] Trial 94 finished with value: 0.295651295697891 and parameters: {'model_type': 'gcn', 'hidden_dims': '[512, 64]', 'dropout': 0.588349489889588, 'batch_norm': True, 'lr': 0.004200470424588301, 'weight_decay': 1.112225308443411e-06, 'epochs': 179, 'loss': 'mse', 'optimizer': 'adam', 'graph_mode': 'cutoff', 'cutoff': 0.7279851751032004, 'grm_norm': 'cosine_then_gcn', 'self_loops': True, 'use_snp_selection': False}. Best is trial 91 with value: 0.30501010443916743.
[I 2025-12-08 20:00:20,857] Trial 95 finished with value: 0.29977691801525125 and parameters: {'model_type': 'gcn', 'hidden_dims': '[512, 64]', 'dropout': 0.5707909405097239, 'batch_norm': True, 'lr': 0.0031421883980868926, 'weight_decay': 1.4694883098852067e-06, 'epochs': 199, 'loss': 'mse', 'optimizer': 'adam', 'graph_mode': 'cutoff', 'cutoff': 0.7576728351324654, 'grm_norm': 'cosine_then_gcn', 'self_loops': True, 'use_snp_selection': False}. Best is trial 91 with value: 0.30501010443916743.
[I 2025-12-08 20:01:11,513] Trial 96 finished with value: 0.29430695760683434 and parameters: {'model_type': 'gcn', 'hidden_dims': '[512, 64]', 'dropout': 0.558735514289603, 'batch_norm': True, 'lr': 0.0030089805945313565, 'weight_decay': 1.5490960730065422e-06, 'epochs': 198, 'loss': 'mse', 'optimizer': 'adam', 'graph_mode': 'cutoff', 'cutoff': 0.7616976263484269, 'grm_norm': 'cosine_then_gcn', 'self_loops': True, 'use_snp_selection': False}. Best is trial 91 with value: 0.30501010443916743.
[I 2025-12-08 20:02:02,797] Trial 97 finished with value: 0.27245159056401513 and parameters: {'model_type': 'gcn', 'hidden_dims': '[512, 64]', 'dropout': 0.5836240866019272, 'batch_norm': True, 'lr': 2.2392006338298852e-05, 'weight_decay': 7.268691469259071e-07, 'epochs': 201, 'loss': 'mse', 'optimizer': 'adam', 'graph_mode': 'cutoff', 'cutoff': 0.6965175481398135, 'grm_norm': 'cosine_then_gcn', 'self_loops': True, 'use_snp_selection': False}. Best is trial 91 with value: 0.30501010443916743.
[I 2025-12-08 20:02:51,422] Trial 98 finished with value: 0.2942663305950963 and parameters: {'model_type': 'gcn', 'hidden_dims': '[512, 64]', 'dropout': 0.5877321059797079, 'batch_norm': True, 'lr': 0.0020278276844324515, 'weight_decay': 1.0829569676082145e-06, 'epochs': 190, 'loss': 'mse', 'optimizer': 'adam', 'graph_mode': 'cutoff', 'cutoff': 0.708867366453902, 'grm_norm': 'cosine_then_gcn', 'self_loops': True, 'use_snp_selection': False}. Best is trial 91 with value: 0.30501010443916743.
[I 2025-12-08 20:03:32,471] Trial 99 finished with value: 0.23370066598193215 and parameters: {'model_type': 'gcn', 'hidden_dims': '[512, 64]', 'dropout': 0.5405528586120459, 'batch_norm': True, 'lr': 0.003227024191242675, 'weight_decay': 1.5127173462074957e-06, 'epochs': 155, 'loss': 'mse', 'optimizer': 'adam', 'graph_mode': 'knn', 'knn_k': 9, 'weighted_edges': True, 'symmetrize_mode': 'mutual', 'self_loops': True, 'use_snp_selection': False}. Best is trial 91 with value: 0.30501010443916743.
[I 2025-12-08 20:04:27,895] Trial 100 finished with value: 0.29233674358558925 and parameters: {'model_type': 'gcn', 'hidden_dims': '[512, 64]', 'dropout': 0.5736971164342525, 'batch_norm': True, 'lr': 0.0023759053395520347, 'weight_decay': 1.0813686796913016e-06, 'epochs': 218, 'loss': 'mse', 'optimizer': 'adam', 'graph_mode': 'cutoff', 'cutoff': 0.6326280098359797, 'grm_norm': 'cosine_then_gcn', 'self_loops': True, 'use_snp_selection': False}. Best is trial 91 with value: 0.30501010443916743.
[I 2025-12-08 20:05:11,466] Trial 101 finished with value: 0.29463314047651123 and parameters: {'model_type': 'gcn', 'hidden_dims': '[512, 64]', 'dropout': 0.5882714905890498, 'batch_norm': True, 'lr': 0.006019275169507738, 'weight_decay': 3.207361804588904e-06, 'epochs': 169, 'loss': 'mse', 'optimizer': 'adam', 'graph_mode': 'cutoff', 'cutoff': 0.740362321570697, 'grm_norm': 'cosine_then_gcn', 'self_loops': True, 'use_snp_selection': False}. Best is trial 91 with value: 0.30501010443916743.
[I 2025-12-08 20:06:01,547] Trial 102 finished with value: 0.30002324476096476 and parameters: {'model_type': 'gcn', 'hidden_dims': '[512, 64]', 'dropout': 0.5667993103840856, 'batch_norm': True, 'lr': 0.00543746839409517, 'weight_decay': 2.2594828861252335e-06, 'epochs': 196, 'loss': 'mse', 'optimizer': 'adam', 'graph_mode': 'cutoff', 'cutoff': 0.7585223151251478, 'grm_norm': 'cosine_then_gcn', 'self_loops': True, 'use_snp_selection': False}. Best is trial 91 with value: 0.30501010443916743.
[I 2025-12-08 20:06:50,684] Trial 103 finished with value: 0.29743816752642677 and parameters: {'model_type': 'gcn', 'hidden_dims': '[512, 64]', 'dropout': 0.5605575260539462, 'batch_norm': True, 'lr': 0.004143941250112787, 'weight_decay': 2.23363337183221e-06, 'epochs': 192, 'loss': 'mse', 'optimizer': 'adam', 'graph_mode': 'cutoff', 'cutoff': 0.7610257929123928, 'grm_norm': 'cosine_then_gcn', 'self_loops': True, 'use_snp_selection': False}. Best is trial 91 with value: 0.30501010443916743.
[I 2025-12-08 20:07:43,136] Trial 104 finished with value: 0.2945686054517843 and parameters: {'model_type': 'gcn', 'hidden_dims': '[512, 64]', 'dropout': 0.5529234472144268, 'batch_norm': True, 'lr': 0.005576559147938894, 'weight_decay': 1.6624228027509348e-06, 'epochs': 206, 'loss': 'mse', 'optimizer': 'adam', 'graph_mode': 'cutoff', 'cutoff': 0.8009561068172749, 'grm_norm': 'cosine_then_gcn', 'self_loops': True, 'use_snp_selection': False}. Best is trial 91 with value: 0.30501010443916743.
[I 2025-12-08 20:08:29,866] Trial 105 finished with value: 0.3001851531508729 and parameters: {'model_type': 'gcn', 'hidden_dims': '[512, 64]', 'dropout': 0.5264360348828605, 'batch_norm': True, 'lr': 0.007454567415882324, 'weight_decay': 5.930153230100047e-07, 'epochs': 182, 'loss': 'mse', 'optimizer': 'adam', 'graph_mode': 'cutoff', 'cutoff': 0.7737211374911716, 'grm_norm': 'cosine_then_gcn', 'self_loops': True, 'use_snp_selection': False}. Best is trial 91 with value: 0.30501010443916743.
[I 2025-12-08 20:09:16,352] Trial 106 finished with value: 0.29945078633316113 and parameters: {'model_type': 'gcn', 'hidden_dims': '[512, 64]', 'dropout': 0.5277347535534631, 'batch_norm': True, 'lr': 0.007263121573794209, 'weight_decay': 5.579039696457895e-07, 'epochs': 181, 'loss': 'mse', 'optimizer': 'adam', 'graph_mode': 'cutoff', 'cutoff': 0.7738288711223077, 'grm_norm': 'cosine_then_gcn', 'self_loops': True, 'use_snp_selection': False}. Best is trial 91 with value: 0.30501010443916743.
[I 2025-12-08 20:10:03,329] Trial 107 finished with value: 0.0 and parameters: {'model_type': 'gcn', 'hidden_dims': '[512, 64]', 'dropout': 0.5255194200779281, 'batch_norm': False, 'lr': 0.007261358017672992, 'weight_decay': 5.394244402984897e-07, 'epochs': 184, 'loss': 'mse', 'optimizer': 'adam', 'graph_mode': 'cutoff', 'cutoff': 0.7686247297278138, 'grm_norm': 'cosine_then_gcn', 'self_loops': True, 'use_snp_selection': False}. Best is trial 91 with value: 0.30501010443916743.
[I 2025-12-08 20:10:43,995] Trial 108 finished with value: 0.29790046722199287 and parameters: {'model_type': 'gcn', 'hidden_dims': '[512, 64]', 'dropout': 0.5403445757189264, 'batch_norm': True, 'lr': 0.004448880795295952, 'weight_decay': 7.12111203810971e-07, 'epochs': 157, 'loss': 'mse', 'optimizer': 'adam', 'graph_mode': 'cutoff', 'cutoff': 0.8172024513973254, 'grm_norm': 'cosine_then_gcn', 'self_loops': True, 'use_snp_selection': False}. Best is trial 91 with value: 0.30501010443916743.
[I 2025-12-08 20:11:27,571] Trial 109 finished with value: 0.2935835929761353 and parameters: {'model_type': 'gcn', 'hidden_dims': '[512, 64]', 'dropout': 0.5101113828931357, 'batch_norm': True, 'lr': 0.005475754283757193, 'weight_decay': 4.1519835262902283e-07, 'epochs': 169, 'loss': 'mse', 'optimizer': 'adam', 'graph_mode': 'cutoff', 'cutoff': 0.6649265011879317, 'grm_norm': 'cosine_then_gcn', 'self_loops': True, 'use_snp_selection': False}. Best is trial 91 with value: 0.30501010443916743.
[I 2025-12-08 20:12:22,176] Trial 110 finished with value: 0.29727043803245745 and parameters: {'model_type': 'gcn', 'hidden_dims': '[512, 64]', 'dropout': 0.5251525653138278, 'batch_norm': True, 'lr': 0.006663808053798949, 'weight_decay': 5.772609674364529e-07, 'epochs': 215, 'loss': 'mse', 'optimizer': 'adam', 'graph_mode': 'cutoff', 'cutoff': 0.7984635645287947, 'grm_norm': 'cosine_then_gcn', 'self_loops': True, 'use_snp_selection': False}. Best is trial 91 with value: 0.30501010443916743.
[I 2025-12-08 20:13:13,928] Trial 111 finished with value: 0.2985242494809882 and parameters: {'model_type': 'gcn', 'hidden_dims': '[512, 64]', 'dropout': 0.547285033912459, 'batch_norm': True, 'lr': 0.007480864356828495, 'weight_decay': 1.2592016014515676e-06, 'epochs': 203, 'loss': 'mse', 'optimizer': 'adam', 'graph_mode': 'cutoff', 'cutoff': 0.7785362963971073, 'grm_norm': 'cosine_then_gcn', 'self_loops': True, 'use_snp_selection': False}. Best is trial 91 with value: 0.30501010443916743.
[I 2025-12-08 20:13:58,941] Trial 112 finished with value: 0.3014782117359121 and parameters: {'model_type': 'gcn', 'hidden_dims': '[512, 64]', 'dropout': 0.5685475748222109, 'batch_norm': True, 'lr': 0.008340999653278903, 'weight_decay': 9.620926775005036e-07, 'epochs': 175, 'loss': 'mse', 'optimizer': 'adam', 'graph_mode': 'cutoff', 'cutoff': 0.7205626777223969, 'grm_norm': 'cosine_then_gcn', 'self_loops': True, 'use_snp_selection': False}. Best is trial 91 with value: 0.30501010443916743.
[I 2025-12-08 20:14:43,714] Trial 113 finished with value: 0.30070255303771937 and parameters: {'model_type': 'gcn', 'hidden_dims': '[512, 64]', 'dropout': 0.5626059355196216, 'batch_norm': True, 'lr': 0.004965485030548275, 'weight_decay': 8.448552650432303e-07, 'epochs': 174, 'loss': 'mse', 'optimizer': 'adam', 'graph_mode': 'cutoff', 'cutoff': 0.7217497508331019, 'grm_norm': 'cosine_then_gcn', 'self_loops': True, 'use_snp_selection': False}. Best is trial 91 with value: 0.30501010443916743.
[I 2025-12-08 20:15:30,337] Trial 114 finished with value: 0.26461911020698475 and parameters: {'model_type': 'gcn', 'hidden_dims': '[512, 64]', 'dropout': 0.5640471019767898, 'batch_norm': True, 'lr': 0.005256958522161967, 'weight_decay': 8.055219807271047e-07, 'epochs': 180, 'loss': 'mse', 'optimizer': 'adam', 'graph_mode': 'cutoff', 'cutoff': 0.44167248197501585, 'grm_norm': 'cosine_then_gcn', 'self_loops': True, 'use_snp_selection': False}. Best is trial 91 with value: 0.30501010443916743.
[I 2025-12-08 20:16:14,868] Trial 115 finished with value: 0.2913070519101769 and parameters: {'model_type': 'gcn', 'hidden_dims': '[512, 64]', 'dropout': 0.5943329819353272, 'batch_norm': True, 'lr': 0.0037492471149697198, 'weight_decay': 8.646178729989925e-07, 'epochs': 173, 'loss': 'mse', 'optimizer': 'adam', 'graph_mode': 'cutoff', 'cutoff': 0.7267364453330729, 'grm_norm': 'cosine_then_gcn', 'self_loops': True, 'use_snp_selection': False}. Best is trial 91 with value: 0.30501010443916743.
[I 2025-12-08 20:16:51,712] Trial 116 finished with value: 0.29804739611859327 and parameters: {'model_type': 'gcn', 'hidden_dims': '[512, 64]', 'dropout': 0.5371536107851806, 'batch_norm': True, 'lr': 0.006085562794557704, 'weight_decay': 6.423319014788679e-07, 'epochs': 141, 'loss': 'mse', 'optimizer': 'adam', 'graph_mode': 'cutoff', 'cutoff': 0.760331663398704, 'grm_norm': 'cosine_then_gcn', 'self_loops': True, 'use_snp_selection': False}. Best is trial 91 with value: 0.30501010443916743.
[I 2025-12-08 20:17:16,354] Trial 117 finished with value: 0.29071073676182835 and parameters: {'model_type': 'gcn', 'hidden_dims': '[256, 128, 64]', 'dropout': 0.5560334846612524, 'batch_norm': True, 'lr': 0.004963770540918556, 'weight_decay': 1.0045351512967332e-06, 'epochs': 187, 'loss': 'mse', 'optimizer': 'adam', 'graph_mode': 'cutoff', 'cutoff': 0.7744885057182297, 'grm_norm': 'cosine_then_gcn', 'self_loops': True, 'use_snp_selection': False}. Best is trial 91 with value: 0.30501010443916743.
[I 2025-12-08 20:17:59,028] Trial 118 finished with value: 0.25121155535302647 and parameters: {'model_type': 'gcn', 'hidden_dims': '[512, 64]', 'dropout': 0.5692545771157604, 'batch_norm': True, 'lr': 0.0072186031873159385, 'weight_decay': 3.772810700860456e-07, 'epochs': 161, 'loss': 'mse', 'optimizer': 'adam', 'graph_mode': 'knn', 'knn_k': 6, 'weighted_edges': True, 'symmetrize_mode': 'union', 'self_loops': True, 'use_snp_selection': False}. Best is trial 91 with value: 0.30501010443916743.
[I 2025-12-08 20:18:56,079] Trial 119 finished with value: 0.29780452733887997 and parameters: {'model_type': 'gcn', 'hidden_dims': '[512, 64]', 'dropout': 0.5780903808239803, 'batch_norm': True, 'lr': 0.0047482461549337735, 'weight_decay': 1.338156169472467e-06, 'epochs': 225, 'loss': 'mse', 'optimizer': 'adam', 'graph_mode': 'cutoff', 'cutoff': 0.7188056800411817, 'grm_norm': 'cosine_then_gcn', 'self_loops': True, 'use_snp_selection': False}. Best is trial 91 with value: 0.30501010443916743.
[I 2025-12-08 20:19:28,194] Trial 120 finished with value: 0.2976111696329812 and parameters: {'model_type': 'gcn', 'hidden_dims': '[512, 256]', 'dropout': 0.5277344992167612, 'batch_norm': True, 'lr': 0.005986913629169825, 'weight_decay': 2.961387398492207e-07, 'epochs': 121, 'loss': 'mse', 'optimizer': 'adam', 'graph_mode': 'cutoff', 'cutoff': 0.6821012100641735, 'grm_norm': 'cosine_then_gcn', 'self_loops': True, 'use_snp_selection': False}. Best is trial 91 with value: 0.30501010443916743.
[I 2025-12-08 20:20:17,789] Trial 121 finished with value: 0.30011878491613925 and parameters: {'model_type': 'gcn', 'hidden_dims': '[512, 64]', 'dropout': 0.5454788280157777, 'batch_norm': True, 'lr': 0.008315368980597135, 'weight_decay': 1.709753365386435e-06, 'epochs': 194, 'loss': 'mse', 'optimizer': 'adam', 'graph_mode': 'cutoff', 'cutoff': 0.735532908839488, 'grm_norm': 'cosine_then_gcn', 'self_loops': True, 'use_snp_selection': False}. Best is trial 91 with value: 0.30501010443916743.
[I 2025-12-08 20:21:03,194] Trial 122 finished with value: 0.3009479576113233 and parameters: {'model_type': 'gcn', 'hidden_dims': '[512, 64]', 'dropout': 0.5539492865645358, 'batch_norm': True, 'lr': 0.008227576317500294, 'weight_decay': 1.3306118693877374e-06, 'epochs': 174, 'loss': 'mse', 'optimizer': 'adam', 'graph_mode': 'cutoff', 'cutoff': 0.7536889091459958, 'grm_norm': 'cosine_then_gcn', 'self_loops': True, 'use_snp_selection': False}. Best is trial 91 with value: 0.30501010443916743.
[I 2025-12-08 20:21:47,759] Trial 123 finished with value: 0.29992176257607644 and parameters: {'model_type': 'gcn', 'hidden_dims': '[512, 64]', 'dropout': 0.5436541149529803, 'batch_norm': True, 'lr': 0.008361315270844442, 'weight_decay': 1.3525599825212235e-06, 'epochs': 173, 'loss': 'mse', 'optimizer': 'adam', 'graph_mode': 'cutoff', 'cutoff': 0.7326763459898331, 'grm_norm': 'cosine_then_gcn', 'self_loops': True, 'use_snp_selection': False}. Best is trial 91 with value: 0.30501010443916743.
[I 2025-12-08 20:22:27,706] Trial 124 finished with value: 0.2977089179291967 and parameters: {'model_type': 'gcn', 'hidden_dims': '[512, 64]', 'dropout': 0.5465057351982754, 'batch_norm': True, 'lr': 0.00829136680912227, 'weight_decay': 2.1459127224227654e-06, 'epochs': 154, 'loss': 'mse', 'optimizer': 'adam', 'graph_mode': 'cutoff', 'cutoff': 0.6966444501833281, 'grm_norm': 'cosine_then_gcn', 'self_loops': True, 'use_snp_selection': False}. Best is trial 91 with value: 0.30501010443916743.
[I 2025-12-08 20:23:12,416] Trial 125 finished with value: 0.2979518544419014 and parameters: {'model_type': 'gcn', 'hidden_dims': '[512, 64]', 'dropout': 0.5597458582264353, 'batch_norm': True, 'lr': 0.008650321783778645, 'weight_decay': 1.3466183824484056e-06, 'epochs': 173, 'loss': 'mse', 'optimizer': 'adam', 'graph_mode': 'cutoff', 'cutoff': 0.7174985801746605, 'grm_norm': 'cosine_then_gcn', 'self_loops': True, 'use_snp_selection': False}. Best is trial 91 with value: 0.30501010443916743.
[I 2025-12-08 20:24:02,928] Trial 126 finished with value: 0.2976183867728271 and parameters: {'model_type': 'gcn', 'hidden_dims': '[512, 64]', 'dropout': 0.5904874887542242, 'batch_norm': True, 'lr': 0.006381212958662081, 'weight_decay': 1.090010667362231e-06, 'epochs': 198, 'loss': 'mse', 'optimizer': 'adam', 'graph_mode': 'cutoff', 'cutoff': 0.7895250829781687, 'grm_norm': 'cosine_then_gcn', 'self_loops': True, 'use_snp_selection': False}. Best is trial 91 with value: 0.30501010443916743.
[I 2025-12-08 20:24:50,842] Trial 127 finished with value: 0.0 and parameters: {'model_type': 'gcn', 'hidden_dims': '[512, 64]', 'dropout': 0.577838353847393, 'batch_norm': False, 'lr': 0.008064719314986287, 'weight_decay': 1.6004573463258053e-06, 'epochs': 188, 'loss': 'mse', 'optimizer': 'adam', 'graph_mode': 'cutoff', 'cutoff': 0.7528461225899599, 'grm_norm': 'cosine_then_gcn', 'self_loops': True, 'use_snp_selection': False}. Best is trial 91 with value: 0.30501010443916743.
[I 2025-12-08 20:25:29,114] Trial 128 finished with value: 0.2947150462166335 and parameters: {'model_type': 'gcn', 'hidden_dims': '[512, 64]', 'dropout': 0.5516197231649276, 'batch_norm': True, 'lr': 0.009737906698085507, 'weight_decay': 7.512053272792089e-07, 'epochs': 147, 'loss': 'mse', 'optimizer': 'adam', 'graph_mode': 'cutoff', 'cutoff': 0.7366108615826898, 'grm_norm': 'cosine_then_gcn', 'self_loops': True, 'use_snp_selection': False}. Best is trial 91 with value: 0.30501010443916743.
[I 2025-12-08 20:26:13,616] Trial 129 finished with value: 0.29929575827516686 and parameters: {'model_type': 'gcn', 'hidden_dims': '[512, 64]', 'dropout': 0.5666936495069849, 'batch_norm': True, 'lr': 0.005641409303295784, 'weight_decay': 9.396397671321649e-07, 'epochs': 173, 'loss': 'mse', 'optimizer': 'adam', 'graph_mode': 'cutoff', 'cutoff': 0.8363492575133591, 'grm_norm': 'cosine_then_gcn', 'self_loops': True, 'use_snp_selection': False}. Best is trial 91 with value: 0.30501010443916743.
[I 2025-12-08 20:27:07,061] Trial 130 finished with value: 0.29778893917100746 and parameters: {'model_type': 'gcn', 'hidden_dims': '[512, 128]', 'dropout': 0.5971475885441693, 'batch_norm': True, 'lr': 0.0067526555155486365, 'weight_decay': 1.3777659631606068e-06, 'epochs': 210, 'loss': 'mse', 'optimizer': 'adam', 'graph_mode': 'cutoff', 'cutoff': 0.7346027090954126, 'grm_norm': 'cosine_then_gcn', 'self_loops': True, 'use_snp_selection': False}. Best is trial 91 with value: 0.30501010443916743.
[I 2025-12-08 20:27:57,109] Trial 131 finished with value: 0.2956499427969377 and parameters: {'model_type': 'gcn', 'hidden_dims': '[512, 64]', 'dropout': 0.5383690050202585, 'batch_norm': True, 'lr': 0.00441431444657613, 'weight_decay': 1.8630259504406995e-06, 'epochs': 196, 'loss': 'mse', 'optimizer': 'adam', 'graph_mode': 'cutoff', 'cutoff': 0.7569507496425387, 'grm_norm': 'cosine_then_gcn', 'self_loops': True, 'use_snp_selection': False}. Best is trial 91 with value: 0.30501010443916743.
[I 2025-12-08 20:28:38,961] Trial 132 finished with value: 0.2981052546565841 and parameters: {'model_type': 'gcn', 'hidden_dims': '[512, 64]', 'dropout': 0.5177533019615513, 'batch_norm': True, 'lr': 0.008056144235975409, 'weight_decay': 9.91244706685505e-07, 'epochs': 162, 'loss': 'mse', 'optimizer': 'adam', 'graph_mode': 'cutoff', 'cutoff': 0.8121832713912855, 'grm_norm': 'cosine_then_gcn', 'self_loops': True, 'use_snp_selection': False}. Best is trial 91 with value: 0.30501010443916743.
[I 2025-12-08 20:29:22,177] Trial 133 finished with value: 0.2547481391956993 and parameters: {'model_type': 'gcn', 'hidden_dims': '[512, 64]', 'dropout': 0.37346978983348544, 'batch_norm': True, 'lr': 0.0037780223593164163, 'weight_decay': 6.62311548155896e-07, 'epochs': 167, 'loss': 'mse', 'optimizer': 'adam', 'graph_mode': 'cutoff', 'cutoff': 0.5127388811146826, 'grm_norm': 'cosine_then_gcn', 'self_loops': True, 'use_snp_selection': False}. Best is trial 91 with value: 0.30501010443916743.
[I 2025-12-08 20:30:10,378] Trial 134 finished with value: 0.2953819022082546 and parameters: {'model_type': 'gcn', 'hidden_dims': '[512, 64]', 'dropout': 0.5415502756070799, 'batch_norm': True, 'lr': 0.005580647300168456, 'weight_decay': 1.1835897734307915e-06, 'epochs': 189, 'loss': 'mse', 'optimizer': 'adam', 'graph_mode': 'cutoff', 'cutoff': 0.7195194735374137, 'grm_norm': 'none', 'self_loops': True, 'use_snp_selection': False}. Best is trial 91 with value: 0.30501010443916743.
[I 2025-12-08 20:30:55,603] Trial 135 finished with value: 0.29568909109771396 and parameters: {'model_type': 'gcn', 'hidden_dims': '[512, 64]', 'dropout': 0.555352883347872, 'batch_norm': True, 'lr': 0.007007815278975619, 'weight_decay': 3.0177130123517886e-06, 'epochs': 176, 'loss': 'mse', 'optimizer': 'adam', 'graph_mode': 'cutoff', 'cutoff': 0.7910043767825732, 'grm_norm': 'cosine_then_gcn', 'self_loops': True, 'use_snp_selection': False}. Best is trial 91 with value: 0.30501010443916743.
[I 2025-12-08 20:31:47,828] Trial 136 finished with value: 0.30071005877833434 and parameters: {'model_type': 'gcn', 'hidden_dims': '[512, 64]', 'dropout': 0.5838042160462089, 'batch_norm': True, 'lr': 0.00889531131843736, 'weight_decay': 8.16103166409848e-07, 'epochs': 205, 'loss': 'mse', 'optimizer': 'adam', 'graph_mode': 'cutoff', 'cutoff': 0.7477890602894669, 'grm_norm': 'cosine_then_gcn', 'self_loops': True, 'use_snp_selection': False}. Best is trial 91 with value: 0.30501010443916743.
