[I 2025-12-08 17:50:13,567] Trial 113 finished with value: 0.31041370467442947 and parameters: {'model_type': 'gcn', 'hidden_dims': '[512, 256]', 'dropout': 0.444250137711551, 'batch_norm': True, 'lr': 0.0003670865601019239, 'weight_decay': 8.67969581138325e-05, 'epochs': 82, 'loss': 'mae', 'optimizer': 'adam', 'graph_mode': 'cutoff', 'cutoff': 0.8899182804440967, 'grm_norm': 'none', 'self_loops': True, 'use_snp_selection': False}. Best is trial 32 with value: 0.32261396288913385.
[I 2025-12-08 17:50:31,708] Trial 114 finished with value: 0.31046269168595053 and parameters: {'model_type': 'gcn', 'hidden_dims': '[512, 256]', 'dropout': 0.41578758165954777, 'batch_norm': True, 'lr': 0.0005287788552947783, 'weight_decay': 0.00011067974895891626, 'epochs': 57, 'loss': 'mae', 'optimizer': 'adam', 'graph_mode': 'cutoff', 'cutoff': 0.8155057192912237, 'grm_norm': 'none', 'self_loops': True, 'use_snp_selection': False}. Best is trial 32 with value: 0.32261396288913385.
[I 2025-12-08 17:50:40,290] Trial 115 finished with value: 0.3077092777776064 and parameters: {'model_type': 'gcn', 'hidden_dims': '[256, 128, 64]', 'dropout': 0.552811763912808, 'batch_norm': True, 'lr': 0.0004835292274863263, 'weight_decay': 0.00019911329226634402, 'epochs': 41, 'loss': 'mae', 'optimizer': 'adam', 'graph_mode': 'cutoff', 'cutoff': 0.8588425386951464, 'grm_norm': 'none', 'self_loops': True, 'use_snp_selection': False}. Best is trial 32 with value: 0.32261396288913385.
[I 2025-12-08 17:51:14,381] Trial 116 finished with value: 0.31455877349943584 and parameters: {'model_type': 'gcn', 'hidden_dims': '[512, 256]', 'dropout': 0.49361720586453534, 'batch_norm': True, 'lr': 0.0003066170480828821, 'weight_decay': 4.134863240280605e-05, 'epochs': 123, 'loss': 'mae', 'optimizer': 'adam', 'graph_mode': 'cutoff', 'cutoff': 0.7773529452232985, 'grm_norm': 'none', 'self_loops': True, 'use_snp_selection': False}. Best is trial 32 with value: 0.32261396288913385.
[I 2025-12-08 17:51:37,940] Trial 117 finished with value: 0.23347550981609685 and parameters: {'model_type': 'gcn', 'hidden_dims': '[512, 256]', 'dropout': 0.45399172786817976, 'batch_norm': False, 'lr': 0.000714452585110908, 'weight_decay': 4.2226086128666053e-05, 'epochs': 127, 'loss': 'mae', 'optimizer': 'adam', 'graph_mode': 'cutoff', 'cutoff': 0.7832072519660592, 'grm_norm': 'none', 'self_loops': True, 'use_snp_selection': True, 'num_snps': 22989}. Best is trial 32 with value: 0.32261396288913385.
[I 2025-12-08 17:52:15,827] Trial 118 finished with value: 0.30939992417142814 and parameters: {'model_type': 'gcn', 'hidden_dims': '[512, 256]', 'dropout': 0.4921694002554634, 'batch_norm': True, 'lr': 0.00020279004693903545, 'weight_decay': 0.00015510265187246704, 'epochs': 142, 'loss': 'mae', 'optimizer': 'adam', 'graph_mode': 'cutoff', 'cutoff': 0.8009733381702617, 'grm_norm': 'none', 'self_loops': True, 'use_snp_selection': False}. Best is trial 32 with value: 0.32261396288913385.
[I 2025-12-08 17:52:48,709] Trial 119 finished with value: 0.3096222917325359 and parameters: {'model_type': 'gcn', 'hidden_dims': '[512, 256]', 'dropout': 0.46891359268928556, 'batch_norm': True, 'lr': 0.00041966081055659784, 'weight_decay': 7.927643348887218e-05, 'epochs': 121, 'loss': 'mae', 'optimizer': 'adam', 'graph_mode': 'cutoff', 'cutoff': 0.7724988255640016, 'grm_norm': 'none', 'self_loops': True, 'use_snp_selection': False}. Best is trial 32 with value: 0.32261396288913385.
[I 2025-12-08 17:53:19,246] Trial 120 finished with value: 0.30217802877418354 and parameters: {'model_type': 'gcn', 'hidden_dims': '[512, 256]', 'dropout': 0.5163288333524595, 'batch_norm': True, 'lr': 0.009642450965986695, 'weight_decay': 0.00010557946764149485, 'epochs': 110, 'loss': 'mae', 'optimizer': 'adam', 'graph_mode': 'cutoff', 'cutoff': 0.8284235608503702, 'grm_norm': 'none', 'self_loops': True, 'use_snp_selection': False}. Best is trial 32 with value: 0.32261396288913385.
[I 2025-12-08 17:53:34,742] Trial 121 finished with value: 0.30647054832199794 and parameters: {'model_type': 'gcn', 'hidden_dims': '[512, 256]', 'dropout': 0.4836319043389078, 'batch_norm': True, 'lr': 0.0003109770563637436, 'weight_decay': 5.83302639690843e-05, 'epochs': 49, 'loss': 'mae', 'optimizer': 'adam', 'graph_mode': 'cutoff', 'cutoff': 0.8437109996337916, 'grm_norm': 'none', 'self_loops': True, 'use_snp_selection': False}. Best is trial 32 with value: 0.32261396288913385.
[I 2025-12-08 17:53:48,008] Trial 122 finished with value: 0.27253348222820867 and parameters: {'model_type': 'gcn', 'hidden_dims': '[128, 64]', 'dropout': 0.40367586723733556, 'batch_norm': True, 'lr': 0.0002781706475436945, 'weight_decay': 5.360660984929515e-05, 'epochs': 157, 'loss': 'mae', 'optimizer': 'adam', 'graph_mode': 'cutoff', 'cutoff': 0.7870923301840524, 'grm_norm': 'none', 'self_loops': True, 'use_snp_selection': False}. Best is trial 32 with value: 0.32261396288913385.
[I 2025-12-08 17:54:16,421] Trial 123 finished with value: 0.31190929159477193 and parameters: {'model_type': 'gcn', 'hidden_dims': '[512, 256]', 'dropout': 0.44101189232799165, 'batch_norm': True, 'lr': 0.00035263307860268245, 'weight_decay': 3.0166930708894518e-05, 'epochs': 103, 'loss': 'mae', 'optimizer': 'adam', 'graph_mode': 'cutoff', 'cutoff': 0.8099915398080741, 'grm_norm': 'none', 'self_loops': True, 'use_snp_selection': False}. Best is trial 32 with value: 0.32261396288913385.
[I 2025-12-08 17:54:42,774] Trial 124 finished with value: 0.30905955863720314 and parameters: {'model_type': 'gcn', 'hidden_dims': '[512, 256]', 'dropout': 0.42707444371762865, 'batch_norm': True, 'lr': 0.0003622230006251253, 'weight_decay': 3.0429465499780066e-05, 'epochs': 94, 'loss': 'mae', 'optimizer': 'adam', 'graph_mode': 'cutoff', 'cutoff': 0.81132430211677, 'grm_norm': 'none', 'self_loops': True, 'use_snp_selection': False}. Best is trial 32 with value: 0.32261396288913385.
[I 2025-12-08 17:55:11,134] Trial 125 finished with value: 0.3079475180385413 and parameters: {'model_type': 'gcn', 'hidden_dims': '[512, 256]', 'dropout': 0.44596226178112325, 'batch_norm': True, 'lr': 0.0006328963248749624, 'weight_decay': 3.8981091171364375e-05, 'epochs': 102, 'loss': 'mae', 'optimizer': 'adam', 'graph_mode': 'cutoff', 'cutoff': 0.7685908261103506, 'grm_norm': 'cosine', 'self_loops': True, 'use_snp_selection': False}. Best is trial 32 with value: 0.32261396288913385.
[I 2025-12-08 17:55:50,262] Trial 126 finished with value: 0.3073234044350549 and parameters: {'model_type': 'gcn', 'hidden_dims': '[512, 64]', 'dropout': 0.4592223742709698, 'batch_norm': True, 'lr': 0.0004888724919007634, 'weight_decay': 2.1103336152030322e-05, 'epochs': 148, 'loss': 'mae', 'optimizer': 'adam', 'graph_mode': 'cutoff', 'cutoff': 0.7956500248870844, 'grm_norm': 'none', 'self_loops': True, 'use_snp_selection': False}. Best is trial 32 with value: 0.32261396288913385.
[I 2025-12-08 17:56:26,914] Trial 127 finished with value: 0.31149061119198 and parameters: {'model_type': 'gcn', 'hidden_dims': '[512, 256]', 'dropout': 0.5045651141049495, 'batch_norm': True, 'lr': 0.0008830712798300937, 'weight_decay': 6.974441493667575e-05, 'epochs': 137, 'loss': 'mae', 'optimizer': 'adam', 'graph_mode': 'cutoff', 'cutoff': 0.8318837452206813, 'grm_norm': 'gcn', 'self_loops': True, 'use_snp_selection': False}. Best is trial 32 with value: 0.32261396288913385.
[I 2025-12-08 17:57:13,991] Trial 128 finished with value: 0.31198979963806944 and parameters: {'model_type': 'gcn', 'hidden_dims': '[512, 256]', 'dropout': 0.10186690068297088, 'batch_norm': True, 'lr': 0.0008630330610080355, 'weight_decay': 6.696244199580729e-05, 'epochs': 133, 'loss': 'mae', 'optimizer': 'adam', 'graph_mode': 'cutoff', 'cutoff': 0.8708431442000644, 'grm_norm': 'cosine_then_gcn', 'self_loops': True, 'use_snp_selection': True, 'num_snps': 58010}. Best is trial 32 with value: 0.32261396288913385.
[I 2025-12-08 17:58:01,718] Trial 129 finished with value: 0.22206690899260978 and parameters: {'model_type': 'gcn', 'hidden_dims': '[512, 256]', 'dropout': 0.15927430507506848, 'batch_norm': True, 'lr': 0.000990205936733416, 'weight_decay': 8.409851651914122e-06, 'epochs': 130, 'loss': 'mse', 'optimizer': 'adam', 'graph_mode': 'knn', 'knn_k': 9, 'weighted_edges': False, 'symmetrize_mode': 'mutual', 'self_loops': True, 'use_snp_selection': True, 'num_snps': 58609}. Best is trial 32 with value: 0.32261396288913385.
[I 2025-12-08 17:58:27,952] Trial 130 finished with value: 0.2893220273850486 and parameters: {'model_type': 'gcn', 'hidden_dims': '[256, 128, 64]', 'dropout': 0.13659574804079036, 'batch_norm': True, 'lr': 0.00022026589544640816, 'weight_decay': 4.35213936068953e-06, 'epochs': 88, 'loss': 'mae', 'optimizer': 'adam', 'graph_mode': 'cutoff', 'cutoff': 0.8775468370092077, 'grm_norm': 'cosine_then_gcn', 'self_loops': True, 'use_snp_selection': True, 'num_snps': 50199}. Best is trial 32 with value: 0.32261396288913385.
[I 2025-12-08 17:59:14,978] Trial 131 finished with value: 0.3137329497197848 and parameters: {'model_type': 'gcn', 'hidden_dims': '[512, 256]', 'dropout': 0.10185483545144562, 'batch_norm': True, 'lr': 0.0012420195249994994, 'weight_decay': 7.062883126222742e-05, 'epochs': 140, 'loss': 'mae', 'optimizer': 'adam', 'graph_mode': 'cutoff', 'cutoff': 0.8604017837498926, 'grm_norm': 'gcn', 'self_loops': True, 'use_snp_selection': True, 'num_snps': 55829}. Best is trial 32 with value: 0.32261396288913385.
[I 2025-12-08 17:59:57,786] Trial 132 finished with value: 0.3102866177906718 and parameters: {'model_type': 'gcn', 'hidden_dims': '[512, 256]', 'dropout': 0.11314382609474026, 'batch_norm': True, 'lr': 0.0012546296970797517, 'weight_decay': 8.962348687692656e-05, 'epochs': 121, 'loss': 'mae', 'optimizer': 'adam', 'graph_mode': 'cutoff', 'cutoff': 0.8997134504926649, 'grm_norm': 'gcn', 'self_loops': True, 'use_snp_selection': True, 'num_snps': 55409}. Best is trial 32 with value: 0.32261396288913385.
[I 2025-12-08 18:00:38,483] Trial 133 finished with value: 0.3142099556275948 and parameters: {'model_type': 'gcn', 'hidden_dims': '[512, 256]', 'dropout': 0.10357080287126905, 'batch_norm': True, 'lr': 0.0014474105935964462, 'weight_decay': 0.00011814088861846432, 'epochs': 136, 'loss': 'mae', 'optimizer': 'adam', 'graph_mode': 'cutoff', 'cutoff': 0.8701902221863277, 'grm_norm': 'gcn', 'self_loops': True, 'use_snp_selection': True, 'num_snps': 47572}. Best is trial 32 with value: 0.32261396288913385.
[I 2025-12-08 18:01:19,581] Trial 134 finished with value: 0.31182969754461576 and parameters: {'model_type': 'gcn', 'hidden_dims': '[512, 256]', 'dropout': 0.10186263276140427, 'batch_norm': True, 'lr': 0.0022366509899969826, 'weight_decay': 0.00012580201739358717, 'epochs': 135, 'loss': 'mae', 'optimizer': 'adam', 'graph_mode': 'cutoff', 'cutoff': 0.8613124361102082, 'grm_norm': 'gcn', 'self_loops': True, 'use_snp_selection': True, 'num_snps': 48483}. Best is trial 32 with value: 0.32261396288913385.
[I 2025-12-08 18:02:07,535] Trial 135 finished with value: 0.31002369213268965 and parameters: {'model_type': 'gcn', 'hidden_dims': '[512, 256]', 'dropout': 0.10332129089580476, 'batch_norm': True, 'lr': 0.0013460564410244116, 'weight_decay': 0.00010488558946085358, 'epochs': 150, 'loss': 'mae', 'optimizer': 'adam', 'graph_mode': 'cutoff', 'cutoff': 0.8821621618569979, 'grm_norm': 'gcn', 'self_loops': True, 'use_snp_selection': True, 'num_snps': 54623}. Best is trial 32 with value: 0.32261396288913385.
[I 2025-12-08 18:02:34,982] Trial 136 finished with value: 0.31199739893990586 and parameters: {'model_type': 'gcn', 'hidden_dims': '[256, 128]', 'dropout': 0.12440867406358624, 'batch_norm': True, 'lr': 0.0015849304650065355, 'weight_decay': 7.038129542866987e-05, 'epochs': 138, 'loss': 'mae', 'optimizer': 'adam', 'graph_mode': 'cutoff', 'cutoff': 0.8509826907279372, 'grm_norm': 'gcn', 'self_loops': True, 'use_snp_selection': True, 'num_snps': 43249}. Best is trial 32 with value: 0.32261396288913385.
[I 2025-12-08 18:03:04,112] Trial 137 finished with value: 0.29575294186655743 and parameters: {'model_type': 'gcn', 'hidden_dims': '[256, 128]', 'dropout': 0.14398726046846083, 'batch_norm': False, 'lr': 0.0029623869581927456, 'weight_decay': 0.0001405851162339895, 'epochs': 165, 'loss': 'mae', 'optimizer': 'adam', 'graph_mode': 'cutoff', 'cutoff': 0.8523984354883881, 'grm_norm': 'gcn', 'self_loops': True, 'use_snp_selection': True, 'num_snps': 41846}. Best is trial 32 with value: 0.32261396288913385.
[I 2025-12-08 18:03:35,909] Trial 138 finished with value: 0.30975368920055874 and parameters: {'model_type': 'gcn', 'hidden_dims': '[256, 128]', 'dropout': 0.12008801073901645, 'batch_norm': True, 'lr': 0.0015170211296308658, 'weight_decay': 8.167715744544629e-05, 'epochs': 142, 'loss': 'mae', 'optimizer': 'adam', 'graph_mode': 'cutoff', 'cutoff': 0.8449477664223624, 'grm_norm': 'gcn', 'self_loops': True, 'use_snp_selection': True, 'num_snps': 51994}. Best is trial 32 with value: 0.32261396288913385.
[I 2025-12-08 18:04:02,772] Trial 139 finished with value: 0.3076600061304157 and parameters: {'model_type': 'gcn', 'hidden_dims': '[256, 128]', 'dropout': 0.12791040972948292, 'batch_norm': True, 'lr': 0.002716319217929541, 'weight_decay': 0.00017216432171568424, 'epochs': 125, 'loss': 'mae', 'optimizer': 'adam', 'graph_mode': 'cutoff', 'cutoff': 0.8223370232055657, 'grm_norm': 'gcn', 'self_loops': True, 'use_snp_selection': True, 'num_snps': 44334}. Best is trial 32 with value: 0.32261396288913385.
[I 2025-12-08 18:04:27,608] Trial 140 finished with value: 0.2815268533190657 and parameters: {'model_type': 'gcn', 'hidden_dims': '[256, 128]', 'dropout': 0.11470739141908276, 'batch_norm': True, 'lr': 0.001803724792895105, 'weight_decay': 9.821510089572277e-05, 'epochs': 158, 'loss': 'mae', 'optimizer': 'adam', 'graph_mode': 'cutoff', 'cutoff': 0.5704607045348471, 'grm_norm': 'gcn', 'self_loops': True, 'use_snp_selection': True, 'num_snps': 33589}. Best is trial 32 with value: 0.32261396288913385.
[I 2025-12-08 18:05:14,859] Trial 141 finished with value: 0.3132634522166561 and parameters: {'model_type': 'gcn', 'hidden_dims': '[512, 256]', 'dropout': 0.1710359593592743, 'batch_norm': True, 'lr': 0.0010560851576314656, 'weight_decay': 6.834318673527714e-05, 'epochs': 137, 'loss': 'mae', 'optimizer': 'adam', 'graph_mode': 'cutoff', 'cutoff': 0.8785942612906122, 'grm_norm': 'cosine_then_gcn', 'self_loops': True, 'use_snp_selection': True, 'num_snps': 57018}. Best is trial 32 with value: 0.32261396288913385.
[I 2025-12-08 18:05:40,258] Trial 142 finished with value: 0.31017476447659537 and parameters: {'model_type': 'gcn', 'hidden_dims': '[256, 128]', 'dropout': 0.20725236172065575, 'batch_norm': True, 'lr': 0.001760973301843486, 'weight_decay': 7.517574033713206e-05, 'epochs': 76, 'loss': 'mae', 'optimizer': 'adam', 'graph_mode': 'cutoff', 'cutoff': 0.890111454070793, 'grm_norm': 'gcn', 'self_loops': True, 'use_snp_selection': True, 'num_snps': 53305}. Best is trial 32 with value: 0.32261396288913385.
[I 2025-12-08 18:06:18,035] Trial 143 finished with value: 0.30985396759895395 and parameters: {'model_type': 'gcn', 'hidden_dims': '[512, 256]', 'dropout': 0.1751399550838776, 'batch_norm': True, 'lr': 0.001162074093996734, 'weight_decay': 5.707539033021746e-05, 'epochs': 147, 'loss': 'mae', 'optimizer': 'adam', 'graph_mode': 'cutoff', 'cutoff': 0.8557981485628146, 'grm_norm': 'cosine_then_gcn', 'self_loops': True, 'use_snp_selection': True, 'num_snps': 39972}. Best is trial 32 with value: 0.32261396288913385.
[I 2025-12-08 18:06:40,932] Trial 144 finished with value: 0.30512311757784116 and parameters: {'model_type': 'gcn', 'hidden_dims': '[128, 64]', 'dropout': 0.15297825535767579, 'batch_norm': True, 'lr': 0.0022024084539742713, 'weight_decay': 5.738732384783411e-07, 'epochs': 116, 'loss': 'mae', 'optimizer': 'adam', 'graph_mode': 'cutoff', 'cutoff': 0.8665422045417084, 'grm_norm': 'gcn', 'self_loops': True, 'use_snp_selection': True, 'num_snps': 48505}. Best is trial 32 with value: 0.32261396288913385.
[I 2025-12-08 18:07:21,377] Trial 145 finished with value: 0.3107665010507991 and parameters: {'model_type': 'gcn', 'hidden_dims': '[512, 256]', 'dropout': 0.12512394884705336, 'batch_norm': True, 'lr': 0.0019044574202785281, 'weight_decay': 2.916618279213218e-06, 'epochs': 141, 'loss': 'mae', 'optimizer': 'adam', 'graph_mode': 'cutoff', 'cutoff': 0.8353879265317941, 'grm_norm': 'cosine_then_gcn', 'self_loops': True, 'use_snp_selection': True, 'num_snps': 45890}. Best is trial 32 with value: 0.32261396288913385.
[I 2025-12-08 18:08:07,895] Trial 146 finished with value: 0.3067946424296749 and parameters: {'model_type': 'gcn', 'hidden_dims': '[512, 128]', 'dropout': 0.19350417753742188, 'batch_norm': True, 'lr': 0.0014200882608907833, 'weight_decay': 1.8040785309051429e-06, 'epochs': 137, 'loss': 'mae', 'optimizer': 'adam', 'graph_mode': 'cutoff', 'cutoff': 0.8994906046061486, 'grm_norm': 'gcn', 'self_loops': True, 'use_snp_selection': True, 'num_snps': 56178}. Best is trial 32 with value: 0.32261396288913385.
[I 2025-12-08 18:08:39,762] Trial 147 finished with value: 0.3016476796044931 and parameters: {'model_type': 'gcn', 'hidden_dims': '[512, 64]', 'dropout': 0.17374344157539964, 'batch_norm': True, 'lr': 0.0011569682392673696, 'weight_decay': 0.00012306349012490228, 'epochs': 109, 'loss': 'mae', 'optimizer': 'adam', 'graph_mode': 'cutoff', 'cutoff': 0.8466177754332721, 'grm_norm': 'gcn', 'self_loops': True, 'use_snp_selection': True, 'num_snps': 39784}. Best is trial 32 with value: 0.32261396288913385.
[I 2025-12-08 18:09:10,563] Trial 148 finished with value: 0.3083921164604274 and parameters: {'model_type': 'gcn', 'hidden_dims': '[512, 256]', 'dropout': 0.14229369989599325, 'batch_norm': True, 'lr': 0.0009817358962819684, 'weight_decay': 0.00021913561101628495, 'epochs': 69, 'loss': 'mae', 'optimizer': 'adam', 'graph_mode': 'cutoff', 'cutoff': 0.8732067367418225, 'grm_norm': 'cosine_then_gcn', 'self_loops': True, 'use_snp_selection': True, 'num_snps': 50644}. Best is trial 32 with value: 0.32261396288913385.
[I 2025-12-08 18:10:02,410] Trial 149 finished with value: 0.30759332812601425 and parameters: {'model_type': 'gcn', 'hidden_dims': '[512, 128]', 'dropout': 0.23481535674399764, 'batch_norm': True, 'lr': 0.0007543231280247273, 'weight_decay': 4.412881671071107e-05, 'epochs': 152, 'loss': 'mae', 'optimizer': 'adam', 'graph_mode': 'cutoff', 'cutoff': 0.8268117216986772, 'grm_norm': 'gcn', 'self_loops': True, 'use_snp_selection': True, 'num_snps': 59844}. Best is trial 32 with value: 0.32261396288913385.
[I 2025-12-08 18:10:32,548] Trial 0 finished with value: 0.24441422763029044 and parameters: {'model_type': 'gcn', 'hidden_dims': '[128, 64]', 'dropout': 0.199031432379812, 'batch_norm': True, 'lr': 1.8408544111075823e-05, 'weight_decay': 5.5136510071208614e-05, 'epochs': 336, 'loss': 'mae', 'optimizer': 'adam', 'graph_mode': 'knn', 'knn_k': 8, 'weighted_edges': True, 'symmetrize_mode': 'mutual', 'self_loops': True, 'use_snp_selection': True, 'num_snps': 27173}. Best is trial 0 with value: 0.24441422763029044.
[I 2025-12-08 18:11:12,000] Trial 1 finished with value: 0.21698687006869388 and parameters: {'model_type': 'gcn', 'hidden_dims': '[256, 128, 64]', 'dropout': 0.5543244404043342, 'batch_norm': True, 'lr': 7.981787657617978e-05, 'weight_decay': 2.8571789869344834e-07, 'epochs': 297, 'loss': 'mae', 'optimizer': 'adam', 'graph_mode': 'cutoff', 'cutoff': 0.3392632777751686, 'grm_norm': 'gcn', 'self_loops': False, 'use_snp_selection': False}. Best is trial 0 with value: 0.24441422763029044.
[I 2025-12-08 18:12:10,784] Trial 2 finished with value: 0.2210200844118674 and parameters: {'model_type': 'gcn', 'hidden_dims': '[512, 64]', 'dropout': 0.32815227354739207, 'batch_norm': True, 'lr': 0.000619605044204259, 'weight_decay': 0.0004086269831625786, 'epochs': 206, 'loss': 'mse', 'optimizer': 'adam', 'graph_mode': 'knn', 'knn_k': 4, 'weighted_edges': True, 'symmetrize_mode': 'union', 'self_loops': True, 'use_snp_selection': True, 'num_snps': 53035}. Best is trial 0 with value: 0.24441422763029044.
[I 2025-12-08 18:12:39,073] Trial 3 finished with value: 0.21611467228544204 and parameters: {'model_type': 'gcn', 'hidden_dims': '[256, 128]', 'dropout': 0.23110783056597514, 'batch_norm': True, 'lr': 8.11311593386298e-05, 'weight_decay': 9.296158109581328e-07, 'epochs': 213, 'loss': 'mse', 'optimizer': 'adam', 'graph_mode': 'knn', 'knn_k': 10, 'weighted_edges': True, 'symmetrize_mode': 'mutual', 'self_loops': True, 'use_snp_selection': False}. Best is trial 0 with value: 0.24441422763029044.
[I 2025-12-08 18:12:54,056] Trial 4 finished with value: 0.3072771672763547 and parameters: {'model_type': 'gcn', 'hidden_dims': '[512, 256]', 'dropout': 0.2753281956415665, 'batch_norm': True, 'lr': 0.00034435188114839693, 'weight_decay': 4.9416012835950194e-05, 'epochs': 89, 'loss': 'mae', 'optimizer': 'adam', 'graph_mode': 'cutoff', 'cutoff': 0.820078967317394, 'grm_norm': 'none', 'self_loops': False, 'use_snp_selection': True, 'num_snps': 12674}. Best is trial 4 with value: 0.3072771672763547.
[I 2025-12-08 18:13:20,335] Trial 5 finished with value: 0.2976229515780767 and parameters: {'model_type': 'gcn', 'hidden_dims': '[128, 64]', 'dropout': 0.5611163934517731, 'batch_norm': True, 'lr': 0.0003984856210762587, 'weight_decay': 1.1466743517565185e-07, 'epochs': 344, 'loss': 'mae', 'optimizer': 'adam', 'graph_mode': 'cutoff', 'cutoff': 0.6089370799714728, 'grm_norm': 'gcn', 'self_loops': True, 'use_snp_selection': False}. Best is trial 4 with value: 0.3072771672763547.
