[I 2025-12-08 14:03:35,111] Trial 113 finished with value: 0.2892405295035887 and parameters: {'model_type': 'gcn', 'hidden_dims': '[256, 128, 64]', 'dropout': 0.5714022630195025, 'batch_norm': True, 'lr': 0.0010691271727906503, 'weight_decay': 7.318574796090442e-07, 'epochs': 48, 'loss': 'mae', 'optimizer': 'adam', 'graph_mode': 'cutoff', 'cutoff': 0.662078352513518, 'grm_norm': 'cosine_then_gcn', 'self_loops': False, 'use_snp_selection': True, 'num_snps': 50454}. Best is trial 44 with value: 0.2978012528173976.
[I 2025-12-08 14:03:56,424] Trial 114 finished with value: 0.2958786203656406 and parameters: {'model_type': 'gcn', 'hidden_dims': '[256, 128, 64]', 'dropout': 0.5931019395125724, 'batch_norm': True, 'lr': 0.0017311704526495157, 'weight_decay': 3.7905725760554584e-06, 'epochs': 40, 'loss': 'mae', 'optimizer': 'adam', 'graph_mode': 'cutoff', 'cutoff': 0.6773474925689243, 'grm_norm': 'cosine_then_gcn', 'self_loops': False, 'use_snp_selection': True, 'num_snps': 53593}. Best is trial 44 with value: 0.2978012528173976.
[I 2025-12-08 14:04:15,565] Trial 115 finished with value: 0.29258823224961106 and parameters: {'model_type': 'gcn', 'hidden_dims': '[256, 128, 64]', 'dropout': 0.5860537254605905, 'batch_norm': True, 'lr': 0.0015575481188379264, 'weight_decay': 3.771360151013515e-06, 'epochs': 41, 'loss': 'mae', 'optimizer': 'adam', 'graph_mode': 'cutoff', 'cutoff': 0.5754765166797455, 'grm_norm': 'cosine_then_gcn', 'self_loops': False, 'use_snp_selection': True, 'num_snps': 44405}. Best is trial 44 with value: 0.2978012528173976.
[I 2025-12-08 14:04:41,098] Trial 116 finished with value: 0.2884195627883861 and parameters: {'model_type': 'gcn', 'hidden_dims': '[512, 256]', 'dropout': 0.5930838121197206, 'batch_norm': True, 'lr': 0.0016324802266241582, 'weight_decay': 2.6731095545727616e-06, 'epochs': 59, 'loss': 'mae', 'optimizer': 'adam', 'graph_mode': 'cutoff', 'cutoff': 0.5914235672679368, 'grm_norm': 'cosine_then_gcn', 'self_loops': False, 'use_snp_selection': True, 'num_snps': 44370}. Best is trial 44 with value: 0.2978012528173976.
[I 2025-12-08 14:05:02,499] Trial 117 finished with value: -0.03453220495339811 and parameters: {'model_type': 'gcn', 'hidden_dims': '[256, 128, 64]', 'dropout': 0.5876968609437443, 'batch_norm': False, 'lr': 0.0031829122488281824, 'weight_decay': 3.654148199555886e-06, 'epochs': 51, 'loss': 'mae', 'optimizer': 'adam', 'graph_mode': 'cutoff', 'cutoff': 0.49788055174729595, 'grm_norm': 'cosine_then_gcn', 'self_loops': False, 'use_snp_selection': True, 'num_snps': 49196}. Best is trial 44 with value: 0.2978012528173976.
[I 2025-12-08 14:05:24,661] Trial 118 finished with value: 0.28288846422373204 and parameters: {'model_type': 'gcn', 'hidden_dims': '[256, 128, 64]', 'dropout': 0.5963430754044539, 'batch_norm': True, 'lr': 0.0023821695450046703, 'weight_decay': 2.3261433797941853e-06, 'epochs': 69, 'loss': 'mae', 'optimizer': 'adam', 'graph_mode': 'cutoff', 'cutoff': 0.5808573412156796, 'grm_norm': 'cosine_then_gcn', 'self_loops': False, 'use_snp_selection': True, 'num_snps': 45330}. Best is trial 44 with value: 0.2978012528173976.
[I 2025-12-08 14:05:44,806] Trial 119 finished with value: 0.2792176630012678 and parameters: {'model_type': 'gcn', 'hidden_dims': '[128, 64]', 'dropout': 0.5994013737212992, 'batch_norm': True, 'lr': 0.0017893850827920361, 'weight_decay': 4.081428967622725e-06, 'epochs': 62, 'loss': 'mae', 'optimizer': 'adam', 'graph_mode': 'cutoff', 'cutoff': 0.6216142023943025, 'grm_norm': 'cosine_then_gcn', 'self_loops': True, 'use_snp_selection': True, 'num_snps': 53450}. Best is trial 44 with value: 0.2978012528173976.
[I 2025-12-08 14:06:09,091] Trial 120 finished with value: 0.2619484451716003 and parameters: {'model_type': 'gcn', 'hidden_dims': '[256, 128, 64]', 'dropout': 0.570670582002749, 'batch_norm': True, 'lr': 0.0015726759524950977, 'weight_decay': 1.728226865893226e-06, 'epochs': 78, 'loss': 'mae', 'optimizer': 'adam', 'graph_mode': 'cutoff', 'cutoff': 0.5398355508049505, 'grm_norm': 'gcn', 'self_loops': False, 'use_snp_selection': True, 'num_snps': 49895}. Best is trial 44 with value: 0.2978012528173976.
[I 2025-12-08 14:06:31,215] Trial 121 finished with value: 0.2892646984772885 and parameters: {'model_type': 'gcn', 'hidden_dims': '[256, 128, 64]', 'dropout': 0.5400834983477991, 'batch_norm': True, 'lr': 0.00114192699011108, 'weight_decay': 1.151689123716185e-05, 'epochs': 40, 'loss': 'mae', 'optimizer': 'adam', 'graph_mode': 'cutoff', 'cutoff': 0.6962070307091145, 'grm_norm': 'cosine_then_gcn', 'self_loops': False, 'use_snp_selection': True, 'num_snps': 57145}. Best is trial 44 with value: 0.2978012528173976.
[I 2025-12-08 14:06:50,754] Trial 122 finished with value: 0.2853727329700611 and parameters: {'model_type': 'gcn', 'hidden_dims': '[256, 128, 64]', 'dropout': 0.5837960149747242, 'batch_norm': True, 'lr': 0.0009428799038137003, 'weight_decay': 6.636201367238104e-06, 'epochs': 40, 'loss': 'mae', 'optimizer': 'adam', 'graph_mode': 'cutoff', 'cutoff': 0.7214689870866227, 'grm_norm': 'cosine_then_gcn', 'self_loops': False, 'use_snp_selection': True, 'num_snps': 46226}. Best is trial 44 with value: 0.2978012528173976.
[I 2025-12-08 14:07:13,245] Trial 123 finished with value: 0.28514738653542526 and parameters: {'model_type': 'gcn', 'hidden_dims': '[256, 128, 64]', 'dropout': 0.5507019138378141, 'batch_norm': True, 'lr': 0.0014611180819082794, 'weight_decay': 2.84540178000366e-06, 'epochs': 50, 'loss': 'mae', 'optimizer': 'adam', 'graph_mode': 'cutoff', 'cutoff': 0.6438206485274667, 'grm_norm': 'cosine_then_gcn', 'self_loops': False, 'use_snp_selection': True, 'num_snps': 54010}. Best is trial 44 with value: 0.2978012528173976.
[I 2025-12-08 14:07:32,461] Trial 124 finished with value: 0.10336993953087178 and parameters: {'model_type': 'gcn', 'hidden_dims': '[256, 128, 64]', 'dropout': 0.5692344849139401, 'batch_norm': True, 'lr': 1.0261276827149295e-05, 'weight_decay': 9.647417052366726e-06, 'epochs': 45, 'loss': 'mae', 'optimizer': 'adam', 'graph_mode': 'cutoff', 'cutoff': 0.7025812457712546, 'grm_norm': 'cosine_then_gcn', 'self_loops': False, 'use_snp_selection': True, 'num_snps': 42639}. Best is trial 44 with value: 0.2978012528173976.
[I 2025-12-08 14:07:54,800] Trial 125 finished with value: 0.2899645074974534 and parameters: {'model_type': 'gcn', 'hidden_dims': '[256, 128, 64]', 'dropout': 0.5327197252401541, 'batch_norm': True, 'lr': 0.0007795118507004804, 'weight_decay': 7.940762349641507e-06, 'epochs': 54, 'loss': 'mae', 'optimizer': 'adam', 'graph_mode': 'cutoff', 'cutoff': 0.7379176248636306, 'grm_norm': 'cosine_then_gcn', 'self_loops': False, 'use_snp_selection': True, 'num_snps': 51501}. Best is trial 44 with value: 0.2978012528173976.
[I 2025-12-08 14:08:19,440] Trial 126 finished with value: 0.28228562058532736 and parameters: {'model_type': 'gcn', 'hidden_dims': '[256, 128, 64]', 'dropout': 0.5114484694140727, 'batch_norm': True, 'lr': 0.0011385141490665512, 'weight_decay': 0.0005190866678534357, 'epochs': 64, 'loss': 'mae', 'optimizer': 'adam', 'graph_mode': 'cutoff', 'cutoff': 0.723620514384108, 'grm_norm': 'cosine_then_gcn', 'self_loops': False, 'use_snp_selection': True, 'num_snps': 55624}. Best is trial 44 with value: 0.2978012528173976.
[I 2025-12-08 14:08:41,076] Trial 127 finished with value: 0.2930992537541085 and parameters: {'model_type': 'gcn', 'hidden_dims': '[256, 128, 64]', 'dropout': 0.581260811779023, 'batch_norm': True, 'lr': 0.0009689790550953154, 'weight_decay': 4.470162968954714e-06, 'epochs': 58, 'loss': 'mae', 'optimizer': 'adam', 'graph_mode': 'cutoff', 'cutoff': 0.6858212900624397, 'grm_norm': 'cosine_then_gcn', 'self_loops': False, 'use_snp_selection': True, 'num_snps': 47737}. Best is trial 44 with value: 0.2978012528173976.
[I 2025-12-08 14:09:55,618] Trial 128 finished with value: 0.2742103573017037 and parameters: {'model_type': 'gcn', 'hidden_dims': '[512, 256]', 'dropout': 0.5855369311157312, 'batch_norm': True, 'lr': 0.0009952002605180406, 'weight_decay': 3.034848793674925e-06, 'epochs': 330, 'loss': 'mae', 'optimizer': 'adam', 'graph_mode': 'cutoff', 'cutoff': 0.6790668474028723, 'grm_norm': 'gcn', 'self_loops': False, 'use_snp_selection': True, 'num_snps': 47980}. Best is trial 44 with value: 0.2978012528173976.
[I 2025-12-08 14:10:16,281] Trial 129 finished with value: 0.2878018913529581 and parameters: {'model_type': 'gcn', 'hidden_dims': '[256, 128, 64]', 'dropout': 0.5770671801483318, 'batch_norm': True, 'lr': 0.0020035844431615063, 'weight_decay': 4.334370647832698e-06, 'epochs': 70, 'loss': 'mae', 'optimizer': 'adam', 'graph_mode': 'cutoff', 'cutoff': 0.6856399439423373, 'grm_norm': 'cosine_then_gcn', 'self_loops': False, 'use_snp_selection': True, 'num_snps': 40274}. Best is trial 44 with value: 0.2978012528173976.
[I 2025-12-08 14:10:54,394] Trial 130 finished with value: 0.2036984041107503 and parameters: {'model_type': 'gcn', 'hidden_dims': '[256, 128, 64]', 'dropout': 0.5900122556714489, 'batch_norm': True, 'lr': 0.001211423479734262, 'weight_decay': 3.4935453973505013e-06, 'epochs': 280, 'loss': 'mae', 'optimizer': 'adam', 'graph_mode': 'knn', 'knn_k': 2, 'weighted_edges': True, 'symmetrize_mode': 'mutual', 'self_loops': False, 'use_snp_selection': True, 'num_snps': 38191}. Best is trial 44 with value: 0.2978012528173976.
[I 2025-12-08 14:11:17,359] Trial 131 finished with value: 0.2923438625722611 and parameters: {'model_type': 'gcn', 'hidden_dims': '[256, 128, 64]', 'dropout': 0.5595176648012159, 'batch_norm': True, 'lr': 0.0008514426902374785, 'weight_decay': 1.0348451965759623e-05, 'epochs': 58, 'loss': 'mae', 'optimizer': 'adam', 'graph_mode': 'cutoff', 'cutoff': 0.6342939274674807, 'grm_norm': 'cosine_then_gcn', 'self_loops': False, 'use_snp_selection': True, 'num_snps': 51986}. Best is trial 44 with value: 0.2978012528173976.
[I 2025-12-08 14:11:40,044] Trial 132 finished with value: 0.28834501021182535 and parameters: {'model_type': 'gcn', 'hidden_dims': '[256, 128, 64]', 'dropout': 0.5432339449866239, 'batch_norm': True, 'lr': 0.0008794415418347679, 'weight_decay': 1.1349539567236942e-05, 'epochs': 58, 'loss': 'mae', 'optimizer': 'adam', 'graph_mode': 'cutoff', 'cutoff': 0.6054308158301087, 'grm_norm': 'cosine_then_gcn', 'self_loops': False, 'use_snp_selection': True, 'num_snps': 51711}. Best is trial 44 with value: 0.2978012528173976.
[I 2025-12-08 14:12:01,367] Trial 133 finished with value: 0.29045389838206215 and parameters: {'model_type': 'gcn', 'hidden_dims': '[256, 128, 64]', 'dropout': 0.5228821974647515, 'batch_norm': True, 'lr': 0.0013055894192292995, 'weight_decay': 6.837486228601974e-06, 'epochs': 50, 'loss': 'mae', 'optimizer': 'adam', 'graph_mode': 'cutoff', 'cutoff': 0.6560916038812429, 'grm_norm': 'cosine_then_gcn', 'self_loops': False, 'use_snp_selection': True, 'num_snps': 49109}. Best is trial 44 with value: 0.2978012528173976.
[I 2025-12-08 14:12:19,844] Trial 134 finished with value: 0.29049058087873536 and parameters: {'model_type': 'gcn', 'hidden_dims': '[256, 128, 64]', 'dropout': 0.5680060866027247, 'batch_norm': True, 'lr': 0.0009887184865376318, 'weight_decay': 4.956942126871705e-06, 'epochs': 65, 'loss': 'mae', 'optimizer': 'adam', 'graph_mode': 'cutoff', 'cutoff': 0.639257676802036, 'grm_norm': 'cosine_then_gcn', 'self_loops': False, 'use_snp_selection': True, 'num_snps': 34304}. Best is trial 44 with value: 0.2978012528173976.
[I 2025-12-08 14:12:43,822] Trial 135 finished with value: 0.28414843153313907 and parameters: {'model_type': 'gcn', 'hidden_dims': '[512, 64]', 'dropout': 0.5623655989422575, 'batch_norm': True, 'lr': 0.0007003879891023434, 'weight_decay': 1.8021929138662501e-06, 'epochs': 46, 'loss': 'mae', 'optimizer': 'adam', 'graph_mode': 'cutoff', 'cutoff': 0.678005694330235, 'grm_norm': 'cosine_then_gcn', 'self_loops': False, 'use_snp_selection': True, 'num_snps': 46233}. Best is trial 44 with value: 0.2978012528173976.
[I 2025-12-08 14:12:53,112] Trial 136 finished with value: 0.28360398266139003 and parameters: {'model_type': 'gcn', 'hidden_dims': '[256, 128, 64]', 'dropout': 0.5338723763367352, 'batch_norm': True, 'lr': 0.0007780406063540559, 'weight_decay': 1.2937799157770399e-05, 'epochs': 58, 'loss': 'mse', 'optimizer': 'adam', 'graph_mode': 'cutoff', 'cutoff': 0.5684095109550135, 'grm_norm': 'cosine', 'self_loops': False, 'use_snp_selection': False}. Best is trial 44 with value: 0.2978012528173976.
[I 2025-12-08 14:13:13,211] Trial 137 finished with value: 0.2813276580752754 and parameters: {'model_type': 'gcn', 'hidden_dims': '[256, 128, 64]', 'dropout': 0.5782023148297326, 'batch_norm': True, 'lr': 0.00015541083030856816, 'weight_decay': 0.00031831807643166877, 'epochs': 52, 'loss': 'mae', 'optimizer': 'adam', 'graph_mode': 'cutoff', 'cutoff': 0.6294749880028958, 'grm_norm': 'cosine_then_gcn', 'self_loops': False, 'use_snp_selection': True, 'num_snps': 44164}. Best is trial 44 with value: 0.2978012528173976.
[I 2025-12-08 14:13:46,412] Trial 138 finished with value: 0.12265020357054972 and parameters: {'model_type': 'gcn', 'hidden_dims': '[512, 128]', 'dropout': 0.5985511967431113, 'batch_norm': False, 'lr': 0.0017200415353787705, 'weight_decay': 2.1184371510398622e-05, 'epochs': 79, 'loss': 'mae', 'optimizer': 'adam', 'graph_mode': 'cutoff', 'cutoff': 0.7093752550898832, 'grm_norm': 'cosine', 'self_loops': False, 'use_snp_selection': True, 'num_snps': 54326}. Best is trial 44 with value: 0.2978012528173976.
[I 2025-12-08 14:13:55,889] Trial 139 finished with value: 0.2897105071578303 and parameters: {'model_type': 'gcn', 'hidden_dims': '[256, 128]', 'dropout': 0.5525709704786703, 'batch_norm': True, 'lr': 0.001365183054597851, 'weight_decay': 9.226976693647174e-06, 'epochs': 62, 'loss': 'mae', 'optimizer': 'adam', 'graph_mode': 'cutoff', 'cutoff': 0.6663115460694272, 'grm_norm': 'cosine_then_gcn', 'self_loops': False, 'use_snp_selection': False}. Best is trial 44 with value: 0.2978012528173976.
[I 2025-12-08 14:14:20,150] Trial 140 finished with value: 0.2844906332935857 and parameters: {'model_type': 'gcn', 'hidden_dims': '[256, 128, 64]', 'dropout': 0.5449988403246311, 'batch_norm': True, 'lr': 0.0005124858667431593, 'weight_decay': 0.00041719094564284805, 'epochs': 71, 'loss': 'mae', 'optimizer': 'adam', 'graph_mode': 'cutoff', 'cutoff': 0.7445644837372553, 'grm_norm': 'gcn', 'self_loops': True, 'use_snp_selection': True, 'num_snps': 52351}. Best is trial 44 with value: 0.2978012528173976.
[I 2025-12-08 14:14:42,653] Trial 141 finished with value: 0.272683092153337 and parameters: {'model_type': 'gcn', 'hidden_dims': '[256, 128, 64]', 'dropout': 0.2525979497816876, 'batch_norm': True, 'lr': 0.0010892904936541208, 'weight_decay': 1.757728900045332e-05, 'epochs': 41, 'loss': 'mae', 'optimizer': 'adam', 'graph_mode': 'cutoff', 'cutoff': 0.6882576443995373, 'grm_norm': 'cosine_then_gcn', 'self_loops': False, 'use_snp_selection': True, 'num_snps': 58392}. Best is trial 44 with value: 0.2978012528173976.
[I 2025-12-08 14:15:04,531] Trial 142 finished with value: 0.2913780093489464 and parameters: {'model_type': 'gcn', 'hidden_dims': '[256, 128, 64]', 'dropout': 0.5591489736153448, 'batch_norm': True, 'lr': 0.0006587491859404128, 'weight_decay': 1.3823702235072702e-05, 'epochs': 40, 'loss': 'mae', 'optimizer': 'adam', 'graph_mode': 'cutoff', 'cutoff': 0.8092632553315163, 'grm_norm': 'cosine_then_gcn', 'self_loops': False, 'use_snp_selection': True, 'num_snps': 55958}. Best is trial 44 with value: 0.2978012528173976.
[I 2025-12-08 14:15:27,956] Trial 143 finished with value: 0.2877388987414942 and parameters: {'model_type': 'gcn', 'hidden_dims': '[256, 128, 64]', 'dropout': 0.10295410542184735, 'batch_norm': True, 'lr': 0.000857836065481714, 'weight_decay': 2.6728417881204475e-05, 'epochs': 49, 'loss': 'mae', 'optimizer': 'adam', 'graph_mode': 'cutoff', 'cutoff': 0.7978549181014943, 'grm_norm': 'cosine_then_gcn', 'self_loops': False, 'use_snp_selection': True, 'num_snps': 58034}. Best is trial 44 with value: 0.2978012528173976.
[I 2025-12-08 14:15:50,066] Trial 144 finished with value: 0.2886545739166837 and parameters: {'model_type': 'gcn', 'hidden_dims': '[256, 128, 64]', 'dropout': 0.5735016054252282, 'batch_norm': True, 'lr': 0.00043358828558011993, 'weight_decay': 6.0659993666582975e-06, 'epochs': 55, 'loss': 'mae', 'optimizer': 'adam', 'graph_mode': 'cutoff', 'cutoff': 0.5424061898031187, 'grm_norm': 'cosine_then_gcn', 'self_loops': False, 'use_snp_selection': True, 'num_snps': 50451}. Best is trial 44 with value: 0.2978012528173976.
[I 2025-12-08 14:16:10,375] Trial 145 finished with value: 0.28682657532333267 and parameters: {'model_type': 'gcn', 'hidden_dims': '[256, 128, 64]', 'dropout': 0.35617121866224827, 'batch_norm': True, 'lr': 0.0006193075552078633, 'weight_decay': 8.017013066537105e-06, 'epochs': 46, 'loss': 'mae', 'optimizer': 'adam', 'graph_mode': 'cutoff', 'cutoff': 0.7225454395817482, 'grm_norm': 'cosine_then_gcn', 'self_loops': False, 'use_snp_selection': True, 'num_snps': 47087}. Best is trial 44 with value: 0.2978012528173976.
[I 2025-12-08 14:16:19,657] Trial 146 finished with value: 0.2968127143888342 and parameters: {'model_type': 'gcn', 'hidden_dims': '[256, 128, 64]', 'dropout': 0.5863349067633097, 'batch_norm': True, 'lr': 0.0009048397176769502, 'weight_decay': 1.0415856894887925e-05, 'epochs': 58, 'loss': 'mae', 'optimizer': 'adam', 'graph_mode': 'cutoff', 'cutoff': 0.7483336207670422, 'grm_norm': 'cosine', 'self_loops': False, 'use_snp_selection': False}. Best is trial 44 with value: 0.2978012528173976.
[I 2025-12-08 14:16:38,909] Trial 147 finished with value: 0.28769838153270516 and parameters: {'model_type': 'gcn', 'hidden_dims': '[512, 256]', 'dropout': 0.5876086023297864, 'batch_norm': True, 'lr': 0.000919446965685143, 'weight_decay': 0.000714747833899103, 'epochs': 67, 'loss': 'mae', 'optimizer': 'adam', 'graph_mode': 'cutoff', 'cutoff': 0.656530787007581, 'grm_norm': 'cosine', 'self_loops': False, 'use_snp_selection': False}. Best is trial 44 with value: 0.2978012528173976.
[I 2025-12-08 14:17:00,761] Trial 148 finished with value: 0.22370394117523365 and parameters: {'model_type': 'gcn', 'hidden_dims': '[256, 128, 64]', 'dropout': 0.5819001080880478, 'batch_norm': True, 'lr': 0.0022962233228797924, 'weight_decay': 1.1449642532985117e-05, 'epochs': 159, 'loss': 'mae', 'optimizer': 'adam', 'graph_mode': 'cutoff', 'cutoff': 0.2791213523481835, 'grm_norm': 'cosine', 'self_loops': False, 'use_snp_selection': False}. Best is trial 44 with value: 0.2978012528173976.
[I 2025-12-08 14:17:10,043] Trial 149 finished with value: 0.28957323232075227 and parameters: {'model_type': 'gcn', 'hidden_dims': '[256, 128, 64]', 'dropout': 0.5192251350810329, 'batch_norm': True, 'lr': 0.0007742007783446506, 'weight_decay': 4.632345729753383e-06, 'epochs': 58, 'loss': 'mae', 'optimizer': 'adam', 'graph_mode': 'cutoff', 'cutoff': 0.7003100342656174, 'grm_norm': 'cosine', 'self_loops': False, 'use_snp_selection': False}. Best is trial 44 with value: 0.2978012528173976.
[I 2025-12-08 14:17:38,209] Trial 0 finished with value: 0.2335782799433362 and parameters: {'model_type': 'gcn', 'hidden_dims': '[128, 64]', 'dropout': 0.199031432379812, 'batch_norm': True, 'lr': 1.8408544111075823e-05, 'weight_decay': 5.5136510071208614e-05, 'epochs': 336, 'loss': 'mae', 'optimizer': 'adam', 'graph_mode': 'knn', 'knn_k': 8, 'weighted_edges': True, 'symmetrize_mode': 'mutual', 'self_loops': True, 'use_snp_selection': True, 'num_snps': 27173}. Best is trial 0 with value: 0.2335782799433362.
[I 2025-12-08 14:18:16,482] Trial 1 finished with value: 0.19108217333344552 and parameters: {'model_type': 'gcn', 'hidden_dims': '[256, 128, 64]', 'dropout': 0.5543244404043342, 'batch_norm': True, 'lr': 7.981787657617978e-05, 'weight_decay': 2.8571789869344834e-07, 'epochs': 297, 'loss': 'mae', 'optimizer': 'adam', 'graph_mode': 'cutoff', 'cutoff': 0.3392632777751686, 'grm_norm': 'gcn', 'self_loops': False, 'use_snp_selection': False}. Best is trial 0 with value: 0.2335782799433362.
[I 2025-12-08 14:19:14,460] Trial 2 finished with value: 0.21032103837773022 and parameters: {'model_type': 'gcn', 'hidden_dims': '[512, 64]', 'dropout': 0.32815227354739207, 'batch_norm': True, 'lr': 0.000619605044204259, 'weight_decay': 0.0004086269831625786, 'epochs': 206, 'loss': 'mse', 'optimizer': 'adam', 'graph_mode': 'knn', 'knn_k': 4, 'weighted_edges': True, 'symmetrize_mode': 'union', 'self_loops': True, 'use_snp_selection': True, 'num_snps': 53035}. Best is trial 0 with value: 0.2335782799433362.
[I 2025-12-08 14:19:41,998] Trial 3 finished with value: 0.1933130891858553 and parameters: {'model_type': 'gcn', 'hidden_dims': '[256, 128]', 'dropout': 0.23110783056597514, 'batch_norm': True, 'lr': 8.11311593386298e-05, 'weight_decay': 9.296158109581328e-07, 'epochs': 213, 'loss': 'mse', 'optimizer': 'adam', 'graph_mode': 'knn', 'knn_k': 10, 'weighted_edges': True, 'symmetrize_mode': 'mutual', 'self_loops': True, 'use_snp_selection': False}. Best is trial 0 with value: 0.2335782799433362.
[I 2025-12-08 14:19:56,639] Trial 4 finished with value: 0.2729382015736053 and parameters: {'model_type': 'gcn', 'hidden_dims': '[512, 256]', 'dropout': 0.2753281956415665, 'batch_norm': True, 'lr': 0.00034435188114839693, 'weight_decay': 4.9416012835950194e-05, 'epochs': 89, 'loss': 'mae', 'optimizer': 'adam', 'graph_mode': 'cutoff', 'cutoff': 0.820078967317394, 'grm_norm': 'none', 'self_loops': False, 'use_snp_selection': True, 'num_snps': 12674}. Best is trial 4 with value: 0.2729382015736053.
