[I 2025-12-08 14:52:17,999] Trial 91 finished with value: 0.24285693348420426 and parameters: {'model_type': 'gcn', 'hidden_dims': '[256, 128]', 'dropout': 0.49190319877479477, 'batch_norm': True, 'lr': 4.8436027455081525e-05, 'weight_decay': 0.0008982521996345039, 'epochs': 68, 'loss': 'mse', 'optimizer': 'adam', 'graph_mode': 'cutoff', 'cutoff': 0.2688679833868638, 'grm_norm': 'cosine_then_gcn', 'self_loops': False, 'use_snp_selection': False}. Best is trial 53 with value: 0.28546478285669324.
[I 2025-12-08 14:52:41,831] Trial 92 finished with value: 0.2637308016098738 and parameters: {'model_type': 'gcn', 'hidden_dims': '[512, 128]', 'dropout': 0.3445972828849667, 'batch_norm': True, 'lr': 4.2075123533520035e-05, 'weight_decay': 0.0005178241781878581, 'epochs': 87, 'loss': 'mse', 'optimizer': 'adam', 'graph_mode': 'cutoff', 'cutoff': 0.7180283232154467, 'grm_norm': 'gcn', 'self_loops': False, 'use_snp_selection': False}. Best is trial 53 with value: 0.28546478285669324.
[I 2025-12-08 14:52:59,097] Trial 93 finished with value: 0.27392346473210466 and parameters: {'model_type': 'gcn', 'hidden_dims': '[512, 64]', 'dropout': 0.5329451815376589, 'batch_norm': True, 'lr': 1.9705300732652497e-05, 'weight_decay': 0.0009763707384775079, 'epochs': 59, 'loss': 'mse', 'optimizer': 'adam', 'graph_mode': 'cutoff', 'cutoff': 0.6815995020331942, 'grm_norm': 'cosine', 'self_loops': False, 'use_snp_selection': False}. Best is trial 53 with value: 0.28546478285669324.
[I 2025-12-08 14:53:04,071] Trial 94 finished with value: 0.2718746917826569 and parameters: {'model_type': 'gcn', 'hidden_dims': '[128, 64]', 'dropout': 0.47386023208698574, 'batch_norm': True, 'lr': 7.620702050356317e-05, 'weight_decay': 0.000644666398944526, 'epochs': 45, 'loss': 'mse', 'optimizer': 'adam', 'graph_mode': 'cutoff', 'cutoff': 0.6231026076736144, 'grm_norm': 'cosine_then_gcn', 'self_loops': False, 'use_snp_selection': False}. Best is trial 53 with value: 0.28546478285669324.
[I 2025-12-08 14:53:47,632] Trial 95 finished with value: 0.26517745025307815 and parameters: {'model_type': 'gcn', 'hidden_dims': '[512, 128]', 'dropout': 0.5699021305950124, 'batch_norm': True, 'lr': 2.6804881955913906e-05, 'weight_decay': 0.0007794114283713509, 'epochs': 319, 'loss': 'mae', 'optimizer': 'adam', 'graph_mode': 'cutoff', 'cutoff': 0.5513806254273348, 'grm_norm': 'cosine_then_gcn', 'self_loops': True, 'use_snp_selection': True, 'num_snps': 25200}. Best is trial 53 with value: 0.28546478285669324.
[I 2025-12-08 14:53:57,185] Trial 96 finished with value: 0.20211830295246144 and parameters: {'model_type': 'gcn', 'hidden_dims': '[256, 128, 64]', 'dropout': 0.5106465526942578, 'batch_norm': True, 'lr': 5.5616134189690187e-05, 'weight_decay': 6.375160816902655e-07, 'epochs': 73, 'loss': 'mae', 'optimizer': 'adam', 'graph_mode': 'cutoff', 'cutoff': 0.6534084828868412, 'grm_norm': 'cosine_then_gcn', 'self_loops': False, 'use_snp_selection': True, 'num_snps': 2590}. Best is trial 53 with value: 0.28546478285669324.
[I 2025-12-08 14:54:05,961] Trial 97 finished with value: 0.24554060558015456 and parameters: {'model_type': 'gcn', 'hidden_dims': '[256, 128]', 'dropout': 0.5253934557891649, 'batch_norm': True, 'lr': 1.2206902431560199e-05, 'weight_decay': 0.00030350520357107425, 'epochs': 56, 'loss': 'mse', 'optimizer': 'adam', 'graph_mode': 'cutoff', 'cutoff': 0.6941259122251862, 'grm_norm': 'cosine_then_gcn', 'self_loops': False, 'use_snp_selection': False}. Best is trial 53 with value: 0.28546478285669324.
[I 2025-12-08 14:54:35,742] Trial 98 finished with value: 0.27175666196277903 and parameters: {'model_type': 'gcn', 'hidden_dims': '[512, 256]', 'dropout': 0.4480609340865531, 'batch_norm': True, 'lr': 0.0008119191241497994, 'weight_decay': 0.00019332772578692253, 'epochs': 104, 'loss': 'mae', 'optimizer': 'adam', 'graph_mode': 'cutoff', 'cutoff': 0.7890154100833522, 'grm_norm': 'cosine_then_gcn', 'self_loops': False, 'use_snp_selection': True, 'num_snps': 38561}. Best is trial 53 with value: 0.28546478285669324.
[I 2025-12-08 14:55:03,175] Trial 99 finished with value: 0.2339470193823555 and parameters: {'model_type': 'gcn', 'hidden_dims': '[512, 256]', 'dropout': 0.5529327160492972, 'batch_norm': False, 'lr': 3.854900631241018e-05, 'weight_decay': 0.0004734044404800018, 'epochs': 78, 'loss': 'mae', 'optimizer': 'adam', 'graph_mode': 'cutoff', 'cutoff': 0.7327414874751816, 'grm_norm': 'none', 'self_loops': True, 'use_snp_selection': True, 'num_snps': 42256}. Best is trial 53 with value: 0.28546478285669324.
[I 2025-12-08 14:55:21,658] Trial 100 finished with value: 0.2748698992530154 and parameters: {'model_type': 'gcn', 'hidden_dims': '[512, 128]', 'dropout': 0.49745562971591334, 'batch_norm': True, 'lr': 6.611382088802328e-05, 'weight_decay': 1.8453798789849462e-05, 'epochs': 64, 'loss': 'mse', 'optimizer': 'adam', 'graph_mode': 'cutoff', 'cutoff': 0.7641432168875686, 'grm_norm': 'cosine_then_gcn', 'self_loops': False, 'use_snp_selection': False}. Best is trial 53 with value: 0.28546478285669324.
[I 2025-12-08 14:55:44,686] Trial 101 finished with value: 0.2832247398823355 and parameters: {'model_type': 'gcn', 'hidden_dims': '[512, 256]', 'dropout': 0.5066676997591154, 'batch_norm': True, 'lr': 9.527963700184151e-05, 'weight_decay': 0.0006865762734645032, 'epochs': 70, 'loss': 'mae', 'optimizer': 'adam', 'graph_mode': 'cutoff', 'cutoff': 0.8256003397222577, 'grm_norm': 'cosine_then_gcn', 'self_loops': False, 'use_snp_selection': True, 'num_snps': 34544}. Best is trial 53 with value: 0.28546478285669324.
[I 2025-12-08 14:56:11,002] Trial 102 finished with value: 0.2822556564444346 and parameters: {'model_type': 'gcn', 'hidden_dims': '[512, 256]', 'dropout': 0.5379148743767499, 'batch_norm': True, 'lr': 4.660757305576991e-05, 'weight_decay': 0.0008394258091817217, 'epochs': 93, 'loss': 'mae', 'optimizer': 'adam', 'graph_mode': 'cutoff', 'cutoff': 0.8343789784824572, 'grm_norm': 'cosine_then_gcn', 'self_loops': False, 'use_snp_selection': True, 'num_snps': 34727}. Best is trial 53 with value: 0.28546478285669324.
[I 2025-12-08 14:56:36,675] Trial 103 finished with value: 0.2732845536479073 and parameters: {'model_type': 'gcn', 'hidden_dims': '[512, 256]', 'dropout': 0.5412809102827582, 'batch_norm': True, 'lr': 4.916016857933495e-05, 'weight_decay': 0.0006642722143768397, 'epochs': 91, 'loss': 'mae', 'optimizer': 'adam', 'graph_mode': 'cutoff', 'cutoff': 0.8762306183182688, 'grm_norm': 'cosine_then_gcn', 'self_loops': False, 'use_snp_selection': True, 'num_snps': 34282}. Best is trial 53 with value: 0.28546478285669324.
[I 2025-12-08 14:57:07,425] Trial 104 finished with value: 0.27971922133058724 and parameters: {'model_type': 'gcn', 'hidden_dims': '[512, 256]', 'dropout': 0.5645606646868273, 'batch_norm': True, 'lr': 8.962297239708153e-05, 'weight_decay': 0.0008373022173031725, 'epochs': 117, 'loss': 'mae', 'optimizer': 'adam', 'graph_mode': 'cutoff', 'cutoff': 0.8279384922280821, 'grm_norm': 'cosine_then_gcn', 'self_loops': False, 'use_snp_selection': True, 'num_snps': 36885}. Best is trial 53 with value: 0.28546478285669324.
[I 2025-12-08 14:57:30,331] Trial 105 finished with value: 0.27869442713951786 and parameters: {'model_type': 'gcn', 'hidden_dims': '[512, 256]', 'dropout': 0.5168582341341507, 'batch_norm': True, 'lr': 3.201857286145546e-05, 'weight_decay': 0.0005331256995957896, 'epochs': 51, 'loss': 'mae', 'optimizer': 'adam', 'graph_mode': 'cutoff', 'cutoff': 0.5914694273526625, 'grm_norm': 'cosine_then_gcn', 'self_loops': False, 'use_snp_selection': True, 'num_snps': 40747}. Best is trial 53 with value: 0.28546478285669324.
[I 2025-12-08 14:57:59,786] Trial 106 finished with value: 0.27512119441371347 and parameters: {'model_type': 'gcn', 'hidden_dims': '[512, 256]', 'dropout': 0.5355871096480647, 'batch_norm': True, 'lr': 0.0001007946323781072, 'weight_decay': 0.0004084437591452741, 'epochs': 83, 'loss': 'mae', 'optimizer': 'adam', 'graph_mode': 'cutoff', 'cutoff': 0.8381243901843558, 'grm_norm': 'cosine', 'self_loops': False, 'use_snp_selection': True, 'num_snps': 44616}. Best is trial 53 with value: 0.28546478285669324.
[I 2025-12-08 14:58:20,921] Trial 107 finished with value: 0.2680361972021945 and parameters: {'model_type': 'gcn', 'hidden_dims': '[512, 256]', 'dropout': 0.5918505549964388, 'batch_norm': True, 'lr': 2.4207980676080995e-05, 'weight_decay': 3.896186724372643e-05, 'epochs': 46, 'loss': 'mae', 'optimizer': 'adam', 'graph_mode': 'cutoff', 'cutoff': 0.7429179860419352, 'grm_norm': 'gcn', 'self_loops': False, 'use_snp_selection': True, 'num_snps': 38301}. Best is trial 53 with value: 0.28546478285669324.
[I 2025-12-08 14:58:45,869] Trial 108 finished with value: 0.2668869715535598 and parameters: {'model_type': 'gcn', 'hidden_dims': '[256, 128]', 'dropout': 0.5770472184265508, 'batch_norm': True, 'lr': 0.0016929482183251885, 'weight_decay': 0.0007284356586555252, 'epochs': 173, 'loss': 'mae', 'optimizer': 'adam', 'graph_mode': 'cutoff', 'cutoff': 0.8635891017988586, 'grm_norm': 'cosine_then_gcn', 'self_loops': True, 'use_snp_selection': True, 'num_snps': 32073}. Best is trial 53 with value: 0.28546478285669324.
[I 2025-12-08 14:59:20,319] Trial 109 finished with value: 0.26709026472761976 and parameters: {'model_type': 'gcn', 'hidden_dims': '[512, 64]', 'dropout': 0.46437242479575336, 'batch_norm': True, 'lr': 0.008637164777463933, 'weight_decay': 0.0005908231712158133, 'epochs': 94, 'loss': 'mae', 'optimizer': 'adam', 'graph_mode': 'knn', 'knn_k': 7, 'weighted_edges': False, 'symmetrize_mode': 'union', 'self_loops': False, 'use_snp_selection': True, 'num_snps': 49326}. Best is trial 53 with value: 0.28546478285669324.
[I 2025-12-08 14:59:43,706] Trial 110 finished with value: 0.2761876247859124 and parameters: {'model_type': 'gcn', 'hidden_dims': '[512, 256]', 'dropout': 0.4871684713482176, 'batch_norm': True, 'lr': 7.255899662192957e-05, 'weight_decay': 0.0008645275875013122, 'epochs': 69, 'loss': 'mae', 'optimizer': 'adam', 'graph_mode': 'cutoff', 'cutoff': 0.791010317837988, 'grm_norm': 'cosine_then_gcn', 'self_loops': False, 'use_snp_selection': True, 'num_snps': 35220}. Best is trial 53 with value: 0.28546478285669324.
[I 2025-12-08 15:00:15,244] Trial 111 finished with value: 0.2718787778762997 and parameters: {'model_type': 'gcn', 'hidden_dims': '[512, 256]', 'dropout': 0.5608587177711384, 'batch_norm': True, 'lr': 8.966452100220026e-05, 'weight_decay': 0.0008475232607507898, 'epochs': 122, 'loss': 'mae', 'optimizer': 'adam', 'graph_mode': 'cutoff', 'cutoff': 0.8314778316903132, 'grm_norm': 'cosine_then_gcn', 'self_loops': False, 'use_snp_selection': True, 'num_snps': 37156}. Best is trial 53 with value: 0.28546478285669324.
[I 2025-12-08 15:00:39,572] Trial 112 finished with value: 0.27271539010978696 and parameters: {'model_type': 'gcn', 'hidden_dims': '[512, 256]', 'dropout': 0.5510615939226376, 'batch_norm': True, 'lr': 5.6825495908280375e-05, 'weight_decay': 0.0009725035279891516, 'epochs': 75, 'loss': 'mae', 'optimizer': 'adam', 'graph_mode': 'cutoff', 'cutoff': 0.8210646541530304, 'grm_norm': 'cosine_then_gcn', 'self_loops': False, 'use_snp_selection': True, 'num_snps': 35915}. Best is trial 53 with value: 0.28546478285669324.
[I 2025-12-08 15:01:06,515] Trial 113 finished with value: 0.24612821680608246 and parameters: {'model_type': 'gcn', 'hidden_dims': '[512, 256]', 'dropout': 0.5266147126007333, 'batch_norm': True, 'lr': 0.0001521855807495805, 'weight_decay': 0.0006666444645131108, 'epochs': 100, 'loss': 'mae', 'optimizer': 'adam', 'graph_mode': 'cutoff', 'cutoff': 0.4415773629598964, 'grm_norm': 'cosine_then_gcn', 'self_loops': False, 'use_snp_selection': True, 'num_snps': 33843}. Best is trial 53 with value: 0.28546478285669324.
[I 2025-12-08 15:01:27,407] Trial 114 finished with value: 0.28146249554909486 and parameters: {'model_type': 'gcn', 'hidden_dims': '[512, 256]', 'dropout': 0.5618089748344193, 'batch_norm': True, 'lr': 4.177651192385332e-05, 'weight_decay': 0.0004881515279131151, 'epochs': 61, 'loss': 'mae', 'optimizer': 'adam', 'graph_mode': 'cutoff', 'cutoff': 0.7742966888925189, 'grm_norm': 'cosine_then_gcn', 'self_loops': False, 'use_snp_selection': True, 'num_snps': 31662}. Best is trial 53 with value: 0.28546478285669324.
[I 2025-12-08 15:01:44,756] Trial 115 finished with value: 0.26715999838877086 and parameters: {'model_type': 'gcn', 'hidden_dims': '[512, 128]', 'dropout': 0.5039693527176861, 'batch_norm': True, 'lr': 4.3139150746111525e-05, 'weight_decay': 0.0004810534541723727, 'epochs': 40, 'loss': 'mae', 'optimizer': 'adam', 'graph_mode': 'cutoff', 'cutoff': 0.7716440095189706, 'grm_norm': 'cosine_then_gcn', 'self_loops': False, 'use_snp_selection': True, 'num_snps': 28660}. Best is trial 53 with value: 0.28546478285669324.
[I 2025-12-08 15:02:05,814] Trial 116 finished with value: 0.28052839754915515 and parameters: {'model_type': 'gcn', 'hidden_dims': '[512, 256]', 'dropout': 0.5824395375252472, 'batch_norm': True, 'lr': 3.496938786377895e-05, 'weight_decay': 0.0002537083776656747, 'epochs': 62, 'loss': 'mae', 'optimizer': 'adam', 'graph_mode': 'cutoff', 'cutoff': 0.7226147313154139, 'grm_norm': 'cosine_then_gcn', 'self_loops': False, 'use_snp_selection': True, 'num_snps': 31795}. Best is trial 53 with value: 0.28546478285669324.
[I 2025-12-08 15:02:21,936] Trial 117 finished with value: 0.2799258387365945 and parameters: {'model_type': 'gcn', 'hidden_dims': '[512, 256]', 'dropout': 0.5387366361974838, 'batch_norm': True, 'lr': 4.831381013398388e-05, 'weight_decay': 0.00033403270754994675, 'epochs': 54, 'loss': 'mse', 'optimizer': 'adam', 'graph_mode': 'cutoff', 'cutoff': 0.66223084718603, 'grm_norm': 'cosine_then_gcn', 'self_loops': True, 'use_snp_selection': False}. Best is trial 53 with value: 0.28546478285669324.
[I 2025-12-08 15:02:38,488] Trial 118 finished with value: 0.2218160342661438 and parameters: {'model_type': 'gcn', 'hidden_dims': '[256, 128, 64]', 'dropout': 0.5974355622068688, 'batch_norm': True, 'lr': 3.032591571751846e-05, 'weight_decay': 0.0003956212949765622, 'epochs': 66, 'loss': 'mae', 'optimizer': 'adam', 'graph_mode': 'cutoff', 'cutoff': 0.7969981318765375, 'grm_norm': 'cosine_then_gcn', 'self_loops': False, 'use_snp_selection': True, 'num_snps': 27278}. Best is trial 53 with value: 0.28546478285669324.
[I 2025-12-08 15:02:45,901] Trial 119 finished with value: 0.2199830516798083 and parameters: {'model_type': 'gcn', 'hidden_dims': '[128, 64]', 'dropout': 0.5128205217416204, 'batch_norm': False, 'lr': 6.337758041468723e-05, 'weight_decay': 0.0005930089680623721, 'epochs': 78, 'loss': 'mse', 'optimizer': 'adam', 'graph_mode': 'knn', 'knn_k': 6, 'weighted_edges': True, 'symmetrize_mode': 'union', 'self_loops': False, 'use_snp_selection': False}. Best is trial 53 with value: 0.28546478285669324.
[I 2025-12-08 15:03:09,811] Trial 120 finished with value: 0.2883673021167713 and parameters: {'model_type': 'gcn', 'hidden_dims': '[512, 128]', 'dropout': 0.5690611887519034, 'batch_norm': True, 'lr': 3.9580370237454075e-05, 'weight_decay': 0.0007197814090180362, 'epochs': 58, 'loss': 'mae', 'optimizer': 'adam', 'graph_mode': 'cutoff', 'cutoff': 0.691355891748671, 'grm_norm': 'cosine_then_gcn', 'self_loops': False, 'use_snp_selection': True, 'num_snps': 40568}. Best is trial 120 with value: 0.2883673021167713.
[I 2025-12-08 15:03:33,880] Trial 121 finished with value: 0.29229824666895454 and parameters: {'model_type': 'gcn', 'hidden_dims': '[512, 128]', 'dropout': 0.5677989622642371, 'batch_norm': True, 'lr': 3.968471939098054e-05, 'weight_decay': 0.0007345569056708979, 'epochs': 59, 'loss': 'mae', 'optimizer': 'adam', 'graph_mode': 'cutoff', 'cutoff': 0.6883194584241635, 'grm_norm': 'cosine_then_gcn', 'self_loops': False, 'use_snp_selection': True, 'num_snps': 40461}. Best is trial 121 with value: 0.29229824666895454.
[I 2025-12-08 15:03:57,909] Trial 122 finished with value: 0.2733963218294923 and parameters: {'model_type': 'gcn', 'hidden_dims': '[512, 128]', 'dropout': 0.5753856071395298, 'batch_norm': True, 'lr': 3.7623799247978404e-05, 'weight_decay': 0.000999305965337158, 'epochs': 59, 'loss': 'mae', 'optimizer': 'adam', 'graph_mode': 'cutoff', 'cutoff': 0.6914055324235654, 'grm_norm': 'cosine_then_gcn', 'self_loops': False, 'use_snp_selection': True, 'num_snps': 40215}. Best is trial 121 with value: 0.29229824666895454.
[I 2025-12-08 15:04:17,807] Trial 123 finished with value: 0.2753794416828025 and parameters: {'model_type': 'gcn', 'hidden_dims': '[512, 128]', 'dropout': 0.5693268839440855, 'batch_norm': True, 'lr': 4.42032306993025e-05, 'weight_decay': 0.0007246884915095427, 'epochs': 47, 'loss': 'mae', 'optimizer': 'adam', 'graph_mode': 'cutoff', 'cutoff': 0.7109028878019672, 'grm_norm': 'cosine_then_gcn', 'self_loops': False, 'use_snp_selection': True, 'num_snps': 33640}. Best is trial 121 with value: 0.29229824666895454.
[I 2025-12-08 15:04:41,493] Trial 124 finished with value: 0.265194669662127 and parameters: {'model_type': 'gcn', 'hidden_dims': '[512, 128]', 'dropout': 0.555832867461517, 'batch_norm': True, 'lr': 5.177120134192981e-05, 'weight_decay': 3.2503771637651224e-06, 'epochs': 53, 'loss': 'mae', 'optimizer': 'adam', 'graph_mode': 'cutoff', 'cutoff': 0.7482861611236364, 'grm_norm': 'cosine_then_gcn', 'self_loops': False, 'use_snp_selection': True, 'num_snps': 41989}. Best is trial 121 with value: 0.29229824666895454.
[I 2025-12-08 15:05:06,312] Trial 125 finished with value: 0.2626041150983654 and parameters: {'model_type': 'gcn', 'hidden_dims': '[512, 128]', 'dropout': 0.5455417252775574, 'batch_norm': True, 'lr': 2.864924541668827e-05, 'weight_decay': 0.0006757244144094212, 'epochs': 70, 'loss': 'mae', 'optimizer': 'adam', 'graph_mode': 'cutoff', 'cutoff': 0.6491161105348034, 'grm_norm': 'cosine_then_gcn', 'self_loops': False, 'use_snp_selection': True, 'num_snps': 38616}. Best is trial 121 with value: 0.29229824666895454.
[I 2025-12-08 15:05:31,686] Trial 126 finished with value: 0.2709163094962526 and parameters: {'model_type': 'gcn', 'hidden_dims': '[512, 256]', 'dropout': 0.5269060209993184, 'batch_norm': True, 'lr': 2.1776194153019328e-05, 'weight_decay': 0.0005300389103562509, 'epochs': 86, 'loss': 'mae', 'optimizer': 'adam', 'graph_mode': 'cutoff', 'cutoff': 0.7061362946596652, 'grm_norm': 'none', 'self_loops': False, 'use_snp_selection': True, 'num_snps': 35144}. Best is trial 121 with value: 0.29229824666895454.
[I 2025-12-08 15:05:51,908] Trial 127 finished with value: 0.2732416956520625 and parameters: {'model_type': 'gcn', 'hidden_dims': '[512, 128]', 'dropout': 0.5864267085486429, 'batch_norm': True, 'lr': 4.194764366427504e-05, 'weight_decay': 0.00045242579682479474, 'epochs': 59, 'loss': 'mae', 'optimizer': 'adam', 'graph_mode': 'cutoff', 'cutoff': 0.8482399839375262, 'grm_norm': 'cosine_then_gcn', 'self_loops': False, 'use_snp_selection': True, 'num_snps': 30889}. Best is trial 121 with value: 0.29229824666895454.
[I 2025-12-08 15:06:40,270] Trial 128 finished with value: 0.2709733150995737 and parameters: {'model_type': 'gcn', 'hidden_dims': '[512, 256]', 'dropout': 0.5625598760978215, 'batch_norm': True, 'lr': 3.6319170696687615e-05, 'weight_decay': 0.0008078792709988431, 'epochs': 212, 'loss': 'mae', 'optimizer': 'adam', 'graph_mode': 'knn', 'knn_k': 10, 'weighted_edges': True, 'symmetrize_mode': 'union', 'self_loops': False, 'use_snp_selection': True, 'num_snps': 39496}. Best is trial 121 with value: 0.29229824666895454.
[I 2025-12-08 15:06:59,812] Trial 129 finished with value: 0.2619457129937593 and parameters: {'model_type': 'gcn', 'hidden_dims': '[256, 128]', 'dropout': 0.5361747413597343, 'batch_norm': True, 'lr': 2.5055833850202946e-05, 'weight_decay': 0.0007996527981089356, 'epochs': 48, 'loss': 'mae', 'optimizer': 'adam', 'graph_mode': 'cutoff', 'cutoff': 0.8816456349598869, 'grm_norm': 'cosine_then_gcn', 'self_loops': False, 'use_snp_selection': True, 'num_snps': 44512}. Best is trial 121 with value: 0.29229824666895454.
[I 2025-12-08 15:07:18,563] Trial 130 finished with value: 0.2809751218441626 and parameters: {'model_type': 'gcn', 'hidden_dims': '[512, 128]', 'dropout': 0.5486285886473794, 'batch_norm': True, 'lr': 5.533297998930637e-05, 'weight_decay': 0.0006088391511921843, 'epochs': 40, 'loss': 'mae', 'optimizer': 'adam', 'graph_mode': 'cutoff', 'cutoff': 0.6357924171065154, 'grm_norm': 'cosine', 'self_loops': False, 'use_snp_selection': True, 'num_snps': 32885}. Best is trial 121 with value: 0.29229824666895454.
[I 2025-12-08 15:07:47,552] Trial 131 finished with value: 0.25385321809128775 and parameters: {'model_type': 'gcn', 'hidden_dims': '[512, 128]', 'dropout': 0.28699743363544566, 'batch_norm': True, 'lr': 3.09576190682529e-05, 'weight_decay': 0.000993285491481071, 'epochs': 62, 'loss': 'mae', 'optimizer': 'adam', 'graph_mode': 'cutoff', 'cutoff': 0.6662947936629144, 'grm_norm': 'cosine_then_gcn', 'self_loops': True, 'use_snp_selection': True, 'num_snps': 51926}. Best is trial 121 with value: 0.29229824666895454.
[I 2025-12-08 15:08:07,964] Trial 132 finished with value: 0.26669805822237125 and parameters: {'model_type': 'gcn', 'hidden_dims': '[512, 128]', 'dropout': 0.5993283153344364, 'batch_norm': True, 'lr': 6.992492165747577e-05, 'weight_decay': 0.0005438707283770188, 'epochs': 72, 'loss': 'mse', 'optimizer': 'adam', 'graph_mode': 'cutoff', 'cutoff': 0.6764663316602578, 'grm_norm': 'cosine_then_gcn', 'self_loops': False, 'use_snp_selection': False}. Best is trial 121 with value: 0.29229824666895454.
