[I 2025-12-08 15:29:35,889] Trial 111 finished with value: 0.3554046441179135 and parameters: {'model_type': 'gcn', 'hidden_dims': '[512, 64]', 'dropout': 0.47627456726297746, 'batch_norm': False, 'lr': 5.358378988903685e-05, 'weight_decay': 3.486224461437496e-06, 'epochs': 152, 'loss': 'mae', 'optimizer': 'adam', 'graph_mode': 'cutoff', 'cutoff': 0.5872629247272609, 'grm_norm': 'cosine', 'self_loops': True, 'use_snp_selection': False}. Best is trial 96 with value: 0.36726476889190185.
[I 2025-12-08 15:29:57,310] Trial 112 finished with value: 0.3558151115348259 and parameters: {'model_type': 'gcn', 'hidden_dims': '[256, 128]', 'dropout': 0.45091902036015497, 'batch_norm': False, 'lr': 3.31637598715405e-05, 'weight_decay': 8.922479859196798e-06, 'epochs': 166, 'loss': 'mae', 'optimizer': 'adam', 'graph_mode': 'cutoff', 'cutoff': 0.6152882977940191, 'grm_norm': 'cosine', 'self_loops': True, 'use_snp_selection': False}. Best is trial 96 with value: 0.36726476889190185.
[I 2025-12-08 15:30:31,330] Trial 113 finished with value: 0.0 and parameters: {'model_type': 'gcn', 'hidden_dims': '[512, 128]', 'dropout': 0.3108752320797852, 'batch_norm': False, 'lr': 0.0074131998813711355, 'weight_decay': 9.84709885597203e-06, 'epochs': 129, 'loss': 'mae', 'optimizer': 'adam', 'graph_mode': 'cutoff', 'cutoff': 0.5481110836546285, 'grm_norm': 'cosine', 'self_loops': True, 'use_snp_selection': False}. Best is trial 96 with value: 0.36726476889190185.
[I 2025-12-08 15:31:20,344] Trial 114 finished with value: 0.362316752448918 and parameters: {'model_type': 'gcn', 'hidden_dims': '[512, 64]', 'dropout': 0.5051960537404201, 'batch_norm': False, 'lr': 7.85705132774589e-05, 'weight_decay': 5.807038640100577e-06, 'epochs': 192, 'loss': 'mae', 'optimizer': 'adam', 'graph_mode': 'cutoff', 'cutoff': 0.5987970908020454, 'grm_norm': 'cosine', 'self_loops': True, 'use_snp_selection': False}. Best is trial 96 with value: 0.36726476889190185.
[I 2025-12-08 15:32:01,105] Trial 115 finished with value: 0.356798283494841 and parameters: {'model_type': 'gcn', 'hidden_dims': '[512, 64]', 'dropout': 0.4865953174482803, 'batch_norm': False, 'lr': 4.737634624588014e-05, 'weight_decay': 1.2917616724397427e-05, 'epochs': 158, 'loss': 'mae', 'optimizer': 'adam', 'graph_mode': 'cutoff', 'cutoff': 0.5720036034647491, 'grm_norm': 'none', 'self_loops': True, 'use_snp_selection': False}. Best is trial 96 with value: 0.36726476889190185.
[I 2025-12-08 15:32:31,380] Trial 116 finished with value: 0.3143736491933506 and parameters: {'model_type': 'gcn', 'hidden_dims': '[512, 64]', 'dropout': 0.516494525558322, 'batch_norm': False, 'lr': 6.424080671050498e-05, 'weight_decay': 1.7001247437599082e-05, 'epochs': 113, 'loss': 'mse', 'optimizer': 'adam', 'graph_mode': 'cutoff', 'cutoff': 0.6377335721123488, 'grm_norm': 'cosine', 'self_loops': True, 'use_snp_selection': False}. Best is trial 96 with value: 0.36726476889190185.
[I 2025-12-08 15:33:15,739] Trial 117 finished with value: 0.0 and parameters: {'model_type': 'gcn', 'hidden_dims': '[512, 256]', 'dropout': 0.3847488541603206, 'batch_norm': False, 'lr': 0.0038927181895043366, 'weight_decay': 3.2783037710298336e-06, 'epochs': 172, 'loss': 'mae', 'optimizer': 'adam', 'graph_mode': 'cutoff', 'cutoff': 0.7134406298398716, 'grm_norm': 'cosine', 'self_loops': True, 'use_snp_selection': False}. Best is trial 96 with value: 0.36726476889190185.
[I 2025-12-08 15:34:12,628] Trial 118 finished with value: 0.3573667108081886 and parameters: {'model_type': 'gcn', 'hidden_dims': '[512, 64]', 'dropout': 0.2621797678085707, 'batch_norm': False, 'lr': 0.00010285200238634554, 'weight_decay': 0.00029040317532099677, 'epochs': 225, 'loss': 'mae', 'optimizer': 'adam', 'graph_mode': 'cutoff', 'cutoff': 0.6640149769810293, 'grm_norm': 'cosine', 'self_loops': False, 'use_snp_selection': False}. Best is trial 96 with value: 0.36726476889190185.
[I 2025-12-08 15:34:50,642] Trial 119 finished with value: 0.3587838919914654 and parameters: {'model_type': 'gcn', 'hidden_dims': '[512, 64]', 'dropout': 0.27997356449053046, 'batch_norm': False, 'lr': 3.88332728827658e-05, 'weight_decay': 4.5794493664182245e-06, 'epochs': 146, 'loss': 'mae', 'optimizer': 'adam', 'graph_mode': 'cutoff', 'cutoff': 0.6064338552843321, 'grm_norm': 'cosine', 'self_loops': True, 'use_snp_selection': False}. Best is trial 96 with value: 0.36726476889190185.
[I 2025-12-08 15:35:36,801] Trial 120 finished with value: 0.3129424346906933 and parameters: {'model_type': 'gcn', 'hidden_dims': '[512, 64]', 'dropout': 0.4006846143789757, 'batch_norm': False, 'lr': 0.00016536811375476488, 'weight_decay': 2.4932987082097792e-05, 'epochs': 181, 'loss': 'mae', 'optimizer': 'adam', 'graph_mode': 'cutoff', 'cutoff': 0.7421012502020741, 'grm_norm': 'gcn', 'self_loops': True, 'use_snp_selection': False}. Best is trial 96 with value: 0.36726476889190185.
[I 2025-12-08 15:36:30,815] Trial 121 finished with value: 0.3615389958126337 and parameters: {'model_type': 'gcn', 'hidden_dims': '[512, 64]', 'dropout': 0.5866417548829351, 'batch_norm': False, 'lr': 0.00013187273656750724, 'weight_decay': 1.1402666535959458e-07, 'epochs': 213, 'loss': 'mae', 'optimizer': 'adam', 'graph_mode': 'cutoff', 'cutoff': 0.585440884563388, 'grm_norm': 'cosine', 'self_loops': True, 'use_snp_selection': False}. Best is trial 96 with value: 0.36726476889190185.
[I 2025-12-08 15:37:21,319] Trial 122 finished with value: 0.36325882671121484 and parameters: {'model_type': 'gcn', 'hidden_dims': '[512, 64]', 'dropout': 0.5555530284690069, 'batch_norm': False, 'lr': 0.00010150484307245183, 'weight_decay': 1.570448343388763e-07, 'epochs': 198, 'loss': 'mae', 'optimizer': 'adam', 'graph_mode': 'cutoff', 'cutoff': 0.566282998920377, 'grm_norm': 'cosine', 'self_loops': True, 'use_snp_selection': False}. Best is trial 96 with value: 0.36726476889190185.
[I 2025-12-08 15:38:12,279] Trial 123 finished with value: 0.35827667889367126 and parameters: {'model_type': 'gcn', 'hidden_dims': '[512, 64]', 'dropout': 0.5526552373626094, 'batch_norm': False, 'lr': 8.34926633569315e-05, 'weight_decay': 1.898120648055601e-07, 'epochs': 200, 'loss': 'mae', 'optimizer': 'adam', 'graph_mode': 'cutoff', 'cutoff': 0.5588531070053157, 'grm_norm': 'cosine', 'self_loops': True, 'use_snp_selection': False}. Best is trial 96 with value: 0.36726476889190185.
[I 2025-12-08 15:39:11,798] Trial 124 finished with value: 0.11318037343854437 and parameters: {'model_type': 'gcn', 'hidden_dims': '[512, 64]', 'dropout': 0.46983809591536535, 'batch_norm': False, 'lr': 0.0008281365991035639, 'weight_decay': 2.0678207411787973e-06, 'epochs': 236, 'loss': 'mae', 'optimizer': 'adam', 'graph_mode': 'cutoff', 'cutoff': 0.6327642903038971, 'grm_norm': 'cosine', 'self_loops': True, 'use_snp_selection': False}. Best is trial 96 with value: 0.36726476889190185.
[I 2025-12-08 15:39:54,180] Trial 125 finished with value: 0.3630200000283351 and parameters: {'model_type': 'gcn', 'hidden_dims': '[512, 64]', 'dropout': 0.5253978553695839, 'batch_norm': False, 'lr': 6.425435702893688e-05, 'weight_decay': 1.0000036588189859e-07, 'epochs': 164, 'loss': 'mae', 'optimizer': 'adam', 'graph_mode': 'cutoff', 'cutoff': 0.5342074961824709, 'grm_norm': 'cosine', 'self_loops': True, 'use_snp_selection': False}. Best is trial 96 with value: 0.36726476889190185.
[I 2025-12-08 15:40:41,980] Trial 126 finished with value: 0.3604729909309904 and parameters: {'model_type': 'gcn', 'hidden_dims': '[512, 64]', 'dropout': 0.5458181947645486, 'batch_norm': False, 'lr': 5.452273531150543e-05, 'weight_decay': 1.4429098072314685e-07, 'epochs': 187, 'loss': 'mae', 'optimizer': 'adam', 'graph_mode': 'cutoff', 'cutoff': 0.6857461759467772, 'grm_norm': 'cosine', 'self_loops': True, 'use_snp_selection': False}. Best is trial 96 with value: 0.36726476889190185.
[I 2025-12-08 15:41:08,760] Trial 127 finished with value: 0.3157705603872731 and parameters: {'model_type': 'gcn', 'hidden_dims': '[256, 128, 64]', 'dropout': 0.4422108613315074, 'batch_norm': True, 'lr': 4.380407646630544e-05, 'weight_decay': 7.0281311653747765e-06, 'epochs': 196, 'loss': 'mae', 'optimizer': 'adam', 'graph_mode': 'knn', 'knn_k': 7, 'weighted_edges': False, 'symmetrize_mode': 'union', 'self_loops': True, 'use_snp_selection': False}. Best is trial 96 with value: 0.36726476889190185.
[I 2025-12-08 15:41:48,659] Trial 128 finished with value: 0.3561230574561013 and parameters: {'model_type': 'gcn', 'hidden_dims': '[512, 64]', 'dropout': 0.5102218730248473, 'batch_norm': False, 'lr': 9.805531529014555e-05, 'weight_decay': 1.137182331111764e-05, 'epochs': 154, 'loss': 'mae', 'optimizer': 'adam', 'graph_mode': 'cutoff', 'cutoff': 0.6232690139734411, 'grm_norm': 'cosine', 'self_loops': True, 'use_snp_selection': False}. Best is trial 96 with value: 0.36726476889190185.
[I 2025-12-08 15:42:33,390] Trial 129 finished with value: 0.3600613394253388 and parameters: {'model_type': 'gcn', 'hidden_dims': '[512, 64]', 'dropout': 0.49873603165031144, 'batch_norm': False, 'lr': 0.0001225271730739708, 'weight_decay': 2.4912743226999785e-07, 'epochs': 174, 'loss': 'mae', 'optimizer': 'adam', 'graph_mode': 'cutoff', 'cutoff': 0.5737942744425444, 'grm_norm': 'cosine', 'self_loops': True, 'use_snp_selection': False}. Best is trial 96 with value: 0.36726476889190185.
[I 2025-12-08 15:42:46,475] Trial 130 finished with value: 0.3101451775138465 and parameters: {'model_type': 'gcn', 'hidden_dims': '[128, 64]', 'dropout': 0.5673285449503858, 'batch_norm': False, 'lr': 3.714158522802966e-05, 'weight_decay': 1.6021558534668938e-07, 'epochs': 169, 'loss': 'mse', 'optimizer': 'adam', 'graph_mode': 'cutoff', 'cutoff': 0.5061471290121892, 'grm_norm': 'none', 'self_loops': True, 'use_snp_selection': False}. Best is trial 96 with value: 0.36726476889190185.
[I 2025-12-08 15:43:38,606] Trial 131 finished with value: 0.3661454100920284 and parameters: {'model_type': 'gcn', 'hidden_dims': '[512, 64]', 'dropout': 0.5798461863114786, 'batch_norm': False, 'lr': 9.580948461612771e-05, 'weight_decay': 1.302893728133371e-07, 'epochs': 205, 'loss': 'mae', 'optimizer': 'adam', 'graph_mode': 'cutoff', 'cutoff': 0.5873149677686661, 'grm_norm': 'cosine', 'self_loops': True, 'use_snp_selection': False}. Best is trial 96 with value: 0.36726476889190185.
[I 2025-12-08 15:44:31,682] Trial 132 finished with value: 0.36280976809671756 and parameters: {'model_type': 'gcn', 'hidden_dims': '[512, 64]', 'dropout': 0.5391246476071566, 'batch_norm': False, 'lr': 7.717851958865617e-05, 'weight_decay': 1.2005893246419771e-07, 'epochs': 209, 'loss': 'mae', 'optimizer': 'adam', 'graph_mode': 'cutoff', 'cutoff': 0.5917566377044782, 'grm_norm': 'cosine', 'self_loops': True, 'use_snp_selection': False}. Best is trial 96 with value: 0.36726476889190185.
[I 2025-12-08 15:45:18,340] Trial 133 finished with value: 0.35910936751283856 and parameters: {'model_type': 'gcn', 'hidden_dims': '[512, 64]', 'dropout': 0.5994052382038507, 'batch_norm': False, 'lr': 2.7762702657863426e-05, 'weight_decay': 1.8846501772649674e-07, 'epochs': 182, 'loss': 'mae', 'optimizer': 'adam', 'graph_mode': 'cutoff', 'cutoff': 0.5548460384963385, 'grm_norm': 'cosine', 'self_loops': True, 'use_snp_selection': False}. Best is trial 96 with value: 0.36726476889190185.
[I 2025-12-08 15:46:10,210] Trial 134 finished with value: 0.3578147605067109 and parameters: {'model_type': 'gcn', 'hidden_dims': '[512, 64]', 'dropout': 0.5604146367629901, 'batch_norm': False, 'lr': 0.00011103521840471173, 'weight_decay': 1.3172280750317498e-07, 'epochs': 204, 'loss': 'mae', 'optimizer': 'adam', 'graph_mode': 'cutoff', 'cutoff': 0.6083140831971081, 'grm_norm': 'cosine', 'self_loops': True, 'use_snp_selection': False}. Best is trial 96 with value: 0.36726476889190185.
[I 2025-12-08 15:47:06,374] Trial 135 finished with value: 0.35697024261777915 and parameters: {'model_type': 'gcn', 'hidden_dims': '[512, 64]', 'dropout': 0.589230562563029, 'batch_norm': False, 'lr': 0.00015064090331950365, 'weight_decay': 1.5109561771036982e-06, 'epochs': 222, 'loss': 'mae', 'optimizer': 'adam', 'graph_mode': 'cutoff', 'cutoff': 0.6516876953645409, 'grm_norm': 'cosine', 'self_loops': True, 'use_snp_selection': False}. Best is trial 96 with value: 0.36726476889190185.
[I 2025-12-08 15:48:11,428] Trial 136 finished with value: 0.3531990649739548 and parameters: {'model_type': 'gcn', 'hidden_dims': '[512, 64]', 'dropout': 0.4826734850456244, 'batch_norm': False, 'lr': 6.738252840020525e-05, 'weight_decay': 1.4412920189767739e-07, 'epochs': 259, 'loss': 'mae', 'optimizer': 'adam', 'graph_mode': 'cutoff', 'cutoff': 0.5786691746334355, 'grm_norm': 'cosine', 'self_loops': True, 'use_snp_selection': False}. Best is trial 96 with value: 0.36726476889190185.
[I 2025-12-08 15:48:38,202] Trial 137 finished with value: 0.35689013258358965 and parameters: {'model_type': 'gcn', 'hidden_dims': '[256, 128]', 'dropout': 0.333830089439052, 'batch_norm': False, 'lr': 4.878710540790659e-05, 'weight_decay': 5.301876133245147e-06, 'epochs': 213, 'loss': 'mae', 'optimizer': 'adam', 'graph_mode': 'cutoff', 'cutoff': 0.533381402254423, 'grm_norm': 'cosine', 'self_loops': True, 'use_snp_selection': False}. Best is trial 96 with value: 0.36726476889190185.
[I 2025-12-08 15:49:27,404] Trial 138 finished with value: 0.36425656966042114 and parameters: {'model_type': 'gcn', 'hidden_dims': '[512, 64]', 'dropout': 0.52957365663441, 'batch_norm': False, 'lr': 9.6425460719396e-05, 'weight_decay': 2.293799089160392e-07, 'epochs': 193, 'loss': 'mae', 'optimizer': 'adam', 'graph_mode': 'cutoff', 'cutoff': 0.5949334453525101, 'grm_norm': 'cosine', 'self_loops': True, 'use_snp_selection': False}. Best is trial 96 with value: 0.36726476889190185.
[I 2025-12-08 15:50:16,445] Trial 139 finished with value: 0.36091888751368 and parameters: {'model_type': 'gcn', 'hidden_dims': '[512, 128]', 'dropout': 0.5182089014508325, 'batch_norm': False, 'lr': 9.095358798800383e-05, 'weight_decay': 2.0925941577928043e-07, 'epochs': 192, 'loss': 'mae', 'optimizer': 'adam', 'graph_mode': 'cutoff', 'cutoff': 0.6228419801573633, 'grm_norm': 'cosine', 'self_loops': True, 'use_snp_selection': False}. Best is trial 96 with value: 0.36726476889190185.
[I 2025-12-08 15:50:57,937] Trial 140 finished with value: 0.3535348745147381 and parameters: {'model_type': 'gcn', 'hidden_dims': '[512, 256]', 'dropout': 0.4904870854046852, 'batch_norm': False, 'lr': 5.7043595794990386e-05, 'weight_decay': 3.201552851848531e-07, 'epochs': 160, 'loss': 'mae', 'optimizer': 'adam', 'graph_mode': 'cutoff', 'cutoff': 0.5938750632332415, 'grm_norm': 'cosine', 'self_loops': False, 'use_snp_selection': False}. Best is trial 96 with value: 0.36726476889190185.
[I 2025-12-08 15:51:48,390] Trial 141 finished with value: 0.35955389082030964 and parameters: {'model_type': 'gcn', 'hidden_dims': '[512, 64]', 'dropout': 0.5550779867288933, 'batch_norm': False, 'lr': 8.230878982545391e-05, 'weight_decay': 1.6593772601601723e-07, 'epochs': 198, 'loss': 'mae', 'optimizer': 'adam', 'graph_mode': 'cutoff', 'cutoff': 0.6077824537259672, 'grm_norm': 'cosine', 'self_loops': True, 'use_snp_selection': False}. Best is trial 96 with value: 0.36726476889190185.
[I 2025-12-08 15:52:34,075] Trial 142 finished with value: 0.3622493155208181 and parameters: {'model_type': 'gcn', 'hidden_dims': '[512, 64]', 'dropout': 0.5291271676562703, 'batch_norm': False, 'lr': 7.186056036071767e-05, 'weight_decay': 1.1522187075252974e-07, 'epochs': 178, 'loss': 'mae', 'optimizer': 'adam', 'graph_mode': 'cutoff', 'cutoff': 0.5716186541181754, 'grm_norm': 'cosine', 'self_loops': True, 'use_snp_selection': False}. Best is trial 96 with value: 0.36726476889190185.
[I 2025-12-08 15:53:17,094] Trial 143 finished with value: 0.3604010758745234 and parameters: {'model_type': 'gcn', 'hidden_dims': '[512, 64]', 'dropout': 0.546652696914331, 'batch_norm': False, 'lr': 9.963910085430452e-05, 'weight_decay': 1.013172735149287e-07, 'epochs': 167, 'loss': 'mae', 'optimizer': 'adam', 'graph_mode': 'cutoff', 'cutoff': 0.6439399378109508, 'grm_norm': 'cosine', 'self_loops': True, 'use_snp_selection': False}. Best is trial 96 with value: 0.36726476889190185.
[I 2025-12-08 15:54:05,910] Trial 144 finished with value: 0.3633551354331092 and parameters: {'model_type': 'gcn', 'hidden_dims': '[512, 64]', 'dropout': 0.5679205854292582, 'batch_norm': False, 'lr': 0.00018512065418867013, 'weight_decay': 2.402392717007677e-07, 'epochs': 191, 'loss': 'mae', 'optimizer': 'adam', 'graph_mode': 'cutoff', 'cutoff': 0.5489444234653768, 'grm_norm': 'cosine', 'self_loops': True, 'use_snp_selection': False}. Best is trial 96 with value: 0.36726476889190185.
[I 2025-12-08 15:54:53,528] Trial 145 finished with value: 0.353195720336101 and parameters: {'model_type': 'gcn', 'hidden_dims': '[512, 64]', 'dropout': 0.5731971682640823, 'batch_norm': False, 'lr': 0.00019527852950094535, 'weight_decay': 2.5213515562502136e-07, 'epochs': 186, 'loss': 'mae', 'optimizer': 'adam', 'graph_mode': 'cutoff', 'cutoff': 0.5503311473488042, 'grm_norm': 'cosine', 'self_loops': True, 'use_snp_selection': False}. Best is trial 96 with value: 0.36726476889190185.
[I 2025-12-08 15:55:49,140] Trial 146 finished with value: 0.14321730426380236 and parameters: {'model_type': 'gcn', 'hidden_dims': '[512, 64]', 'dropout': 0.46525962064604065, 'batch_norm': False, 'lr': 0.000281220070983231, 'weight_decay': 1.847687769689088e-07, 'epochs': 216, 'loss': 'mae', 'optimizer': 'adam', 'graph_mode': 'cutoff', 'cutoff': 0.2844704256866928, 'grm_norm': 'gcn', 'self_loops': True, 'use_snp_selection': False}. Best is trial 96 with value: 0.36726476889190185.
[I 2025-12-08 15:56:33,591] Trial 147 finished with value: 0.35899207245452563 and parameters: {'model_type': 'gcn', 'hidden_dims': '[512, 64]', 'dropout': 0.45068217221483514, 'batch_norm': False, 'lr': 0.0001330099880651663, 'weight_decay': 2.357729563632026e-07, 'epochs': 173, 'loss': 'mae', 'optimizer': 'adam', 'graph_mode': 'cutoff', 'cutoff': 0.5940750504439851, 'grm_norm': 'cosine', 'self_loops': True, 'use_snp_selection': False}. Best is trial 96 with value: 0.36726476889190185.
[I 2025-12-08 15:57:33,566] Trial 148 finished with value: 0.32240958518492363 and parameters: {'model_type': 'gcn', 'hidden_dims': '[512, 64]', 'dropout': 0.2967441686734535, 'batch_norm': True, 'lr': 0.00022316188292759143, 'weight_decay': 8.338283569989127e-06, 'epochs': 237, 'loss': 'mae', 'optimizer': 'adam', 'graph_mode': 'cutoff', 'cutoff': 0.6160852443967253, 'grm_norm': 'cosine', 'self_loops': True, 'use_snp_selection': False}. Best is trial 96 with value: 0.36726476889190185.
[I 2025-12-08 15:58:12,537] Trial 149 finished with value: 0.27966634966637355 and parameters: {'model_type': 'gcn', 'hidden_dims': '[512, 64]', 'dropout': 0.4323352990175637, 'batch_norm': False, 'lr': 0.0001681420773683962, 'weight_decay': 6.817485673160509e-06, 'epochs': 148, 'loss': 'mae', 'optimizer': 'adam', 'graph_mode': 'knn', 'knn_k': 5, 'weighted_edges': True, 'symmetrize_mode': 'mutual', 'self_loops': True, 'use_snp_selection': False}. Best is trial 96 with value: 0.36726476889190185.
[I 2025-12-08 15:58:45,626] Trial 0 finished with value: 0.29357821020993224 and parameters: {'model_type': 'gcn', 'hidden_dims': '[128, 64]', 'dropout': 0.199031432379812, 'batch_norm': True, 'lr': 1.8408544111075823e-05, 'weight_decay': 5.5136510071208614e-05, 'epochs': 336, 'loss': 'mae', 'optimizer': 'adam', 'graph_mode': 'knn', 'knn_k': 8, 'weighted_edges': True, 'symmetrize_mode': 'mutual', 'self_loops': True, 'use_snp_selection': True, 'num_snps': 27173}. Best is trial 0 with value: 0.29357821020993224.
[I 2025-12-08 15:59:23,988] Trial 1 finished with value: 0.2472369321222981 and parameters: {'model_type': 'gcn', 'hidden_dims': '[256, 128, 64]', 'dropout': 0.5543244404043342, 'batch_norm': True, 'lr': 7.981787657617978e-05, 'weight_decay': 2.8571789869344834e-07, 'epochs': 297, 'loss': 'mae', 'optimizer': 'adam', 'graph_mode': 'cutoff', 'cutoff': 0.3392632777751686, 'grm_norm': 'gcn', 'self_loops': False, 'use_snp_selection': False}. Best is trial 0 with value: 0.29357821020993224.
[I 2025-12-08 16:00:21,617] Trial 2 finished with value: 0.2652185523536129 and parameters: {'model_type': 'gcn', 'hidden_dims': '[512, 64]', 'dropout': 0.32815227354739207, 'batch_norm': True, 'lr': 0.000619605044204259, 'weight_decay': 0.0004086269831625786, 'epochs': 206, 'loss': 'mse', 'optimizer': 'adam', 'graph_mode': 'knn', 'knn_k': 4, 'weighted_edges': True, 'symmetrize_mode': 'union', 'self_loops': True, 'use_snp_selection': True, 'num_snps': 53035}. Best is trial 0 with value: 0.29357821020993224.
[I 2025-12-08 16:00:49,184] Trial 3 finished with value: 0.26163994986176176 and parameters: {'model_type': 'gcn', 'hidden_dims': '[256, 128]', 'dropout': 0.23110783056597514, 'batch_norm': True, 'lr': 8.11311593386298e-05, 'weight_decay': 9.296158109581328e-07, 'epochs': 213, 'loss': 'mse', 'optimizer': 'adam', 'graph_mode': 'knn', 'knn_k': 10, 'weighted_edges': True, 'symmetrize_mode': 'mutual', 'self_loops': True, 'use_snp_selection': False}. Best is trial 0 with value: 0.29357821020993224.
[I 2025-12-08 16:01:03,532] Trial 4 finished with value: 0.3552760730340412 and parameters: {'model_type': 'gcn', 'hidden_dims': '[512, 256]', 'dropout': 0.2753281956415665, 'batch_norm': True, 'lr': 0.00034435188114839693, 'weight_decay': 4.9416012835950194e-05, 'epochs': 89, 'loss': 'mae', 'optimizer': 'adam', 'graph_mode': 'cutoff', 'cutoff': 0.820078967317394, 'grm_norm': 'none', 'self_loops': False, 'use_snp_selection': True, 'num_snps': 12674}. Best is trial 4 with value: 0.3552760730340412.
