[I 2025-12-08 15:59:58,189] Trial 114 finished with value: 0.29395788154857627 and parameters: {'model_type': 'gcn', 'hidden_dims': '[512, 128]', 'dropout': 0.4184704081347618, 'batch_norm': True, 'lr': 0.0006175367857075867, 'weight_decay': 7.594646845965919e-05, 'epochs': 94, 'loss': 'mae', 'optimizer': 'adam', 'graph_mode': 'cutoff', 'cutoff': 0.7222745567335367, 'grm_norm': 'cosine_then_gcn', 'self_loops': True, 'use_snp_selection': False}. Best is trial 23 with value: 0.2997949033109354.
[I 2025-12-08 16:00:17,711] Trial 115 finished with value: -0.004014405497768327 and parameters: {'model_type': 'gcn', 'hidden_dims': '[512, 64]', 'dropout': 0.45320901717814427, 'batch_norm': False, 'lr': 0.0015053966820795014, 'weight_decay': 0.0001450398694487633, 'epochs': 68, 'loss': 'mae', 'optimizer': 'adam', 'graph_mode': 'cutoff', 'cutoff': 0.422034502983175, 'grm_norm': 'cosine_then_gcn', 'self_loops': True, 'use_snp_selection': False}. Best is trial 23 with value: 0.2997949033109354.
[I 2025-12-08 16:00:35,259] Trial 116 finished with value: 0.29419509867596155 and parameters: {'model_type': 'gcn', 'hidden_dims': '[512, 256]', 'dropout': 0.4824466960075764, 'batch_norm': True, 'lr': 0.000505043648518982, 'weight_decay': 1.4254422228390038e-05, 'epochs': 60, 'loss': 'mae', 'optimizer': 'adam', 'graph_mode': 'cutoff', 'cutoff': 0.8554793161095474, 'grm_norm': 'cosine_then_gcn', 'self_loops': False, 'use_snp_selection': False}. Best is trial 23 with value: 0.2997949033109354.
[I 2025-12-08 16:01:39,747] Trial 117 finished with value: 0.28440701198710605 and parameters: {'model_type': 'gcn', 'hidden_dims': '[512, 128]', 'dropout': 0.5069468105164124, 'batch_norm': True, 'lr': 0.001012478433074814, 'weight_decay': 5.826585788320444e-05, 'epochs': 256, 'loss': 'mae', 'optimizer': 'adam', 'graph_mode': 'cutoff', 'cutoff': 0.7827740059873772, 'grm_norm': 'none', 'self_loops': False, 'use_snp_selection': False}. Best is trial 23 with value: 0.2997949033109354.
[I 2025-12-08 16:01:47,332] Trial 118 finished with value: 0.29008407556118393 and parameters: {'model_type': 'gcn', 'hidden_dims': '[128, 64]', 'dropout': 0.49269231443969835, 'batch_norm': True, 'lr': 0.0007134272009626093, 'weight_decay': 2.6109076171370186e-05, 'epochs': 84, 'loss': 'mae', 'optimizer': 'adam', 'graph_mode': 'cutoff', 'cutoff': 0.883206195555681, 'grm_norm': 'cosine_then_gcn', 'self_loops': False, 'use_snp_selection': False}. Best is trial 23 with value: 0.2997949033109354.
[I 2025-12-08 16:02:42,944] Trial 119 finished with value: 0.2884968111822267 and parameters: {'model_type': 'gcn', 'hidden_dims': '[512, 128]', 'dropout': 0.4686705228084153, 'batch_norm': True, 'lr': 0.0003418403679994171, 'weight_decay': 0.00018617021140275594, 'epochs': 219, 'loss': 'mae', 'optimizer': 'adam', 'graph_mode': 'cutoff', 'cutoff': 0.7633414236626874, 'grm_norm': 'gcn', 'self_loops': True, 'use_snp_selection': False}. Best is trial 23 with value: 0.2997949033109354.
[I 2025-12-08 16:02:50,216] Trial 120 finished with value: 0.24979154644301196 and parameters: {'model_type': 'gcn', 'hidden_dims': '[256, 128]', 'dropout': 0.43668484449589834, 'batch_norm': True, 'lr': 1.8367509079805494e-05, 'weight_decay': 3.4295441440297784e-05, 'epochs': 43, 'loss': 'mae', 'optimizer': 'adam', 'graph_mode': 'cutoff', 'cutoff': 0.6471561941308324, 'grm_norm': 'cosine_then_gcn', 'self_loops': False, 'use_snp_selection': False}. Best is trial 23 with value: 0.2997949033109354.
[I 2025-12-08 16:03:06,540] Trial 121 finished with value: 0.2784047959603207 and parameters: {'model_type': 'gcn', 'hidden_dims': '[512, 128]', 'dropout': 0.43021425636624583, 'batch_norm': True, 'lr': 4.028993721221399e-05, 'weight_decay': 0.00010692605584104536, 'epochs': 55, 'loss': 'mae', 'optimizer': 'adam', 'graph_mode': 'cutoff', 'cutoff': 0.6951908571937557, 'grm_norm': 'cosine_then_gcn', 'self_loops': True, 'use_snp_selection': False}. Best is trial 23 with value: 0.2997949033109354.
[I 2025-12-08 16:03:21,905] Trial 122 finished with value: 0.2909698583922524 and parameters: {'model_type': 'gcn', 'hidden_dims': '[512, 128]', 'dropout': 0.42213921574531404, 'batch_norm': True, 'lr': 0.0007880466429938306, 'weight_decay': 9.05771706669837e-05, 'epochs': 51, 'loss': 'mae', 'optimizer': 'adam', 'graph_mode': 'cutoff', 'cutoff': 0.7100935784417322, 'grm_norm': 'cosine_then_gcn', 'self_loops': True, 'use_snp_selection': False}. Best is trial 23 with value: 0.2997949033109354.
[I 2025-12-08 16:03:39,688] Trial 123 finished with value: 0.28946402079231903 and parameters: {'model_type': 'gcn', 'hidden_dims': '[512, 128]', 'dropout': 0.4056467702127593, 'batch_norm': True, 'lr': 0.00039342094280377365, 'weight_decay': 4.085477207380511e-05, 'epochs': 61, 'loss': 'mae', 'optimizer': 'adam', 'graph_mode': 'cutoff', 'cutoff': 0.8033038836263336, 'grm_norm': 'cosine_then_gcn', 'self_loops': True, 'use_snp_selection': False}. Best is trial 23 with value: 0.2997949033109354.
[I 2025-12-08 16:04:07,564] Trial 124 finished with value: 0.2914145973001073 and parameters: {'model_type': 'gcn', 'hidden_dims': '[512, 128]', 'dropout': 0.44910229964778503, 'batch_norm': True, 'lr': 0.0008825593541183666, 'weight_decay': 1.0248310815793378e-06, 'epochs': 103, 'loss': 'mae', 'optimizer': 'adam', 'graph_mode': 'cutoff', 'cutoff': 0.6596851414373279, 'grm_norm': 'cosine_then_gcn', 'self_loops': True, 'use_snp_selection': False}. Best is trial 23 with value: 0.2997949033109354.
[I 2025-12-08 16:04:28,947] Trial 125 finished with value: 0.2937411722985376 and parameters: {'model_type': 'gcn', 'hidden_dims': '[512, 128]', 'dropout': 0.45955577187656443, 'batch_norm': True, 'lr': 0.0005765899332861921, 'weight_decay': 0.0002670758784799595, 'epochs': 76, 'loss': 'mae', 'optimizer': 'adam', 'graph_mode': 'cutoff', 'cutoff': 0.7504172842284913, 'grm_norm': 'cosine', 'self_loops': True, 'use_snp_selection': False}. Best is trial 23 with value: 0.2997949033109354.
[I 2025-12-08 16:04:39,294] Trial 126 finished with value: 0.2905390008638909 and parameters: {'model_type': 'gcn', 'hidden_dims': '[256, 128, 64]', 'dropout': 0.47456603841075334, 'batch_norm': True, 'lr': 0.0007544068022627341, 'weight_decay': 6.558746385618672e-05, 'epochs': 67, 'loss': 'mae', 'optimizer': 'adam', 'graph_mode': 'cutoff', 'cutoff': 0.7336745477579659, 'grm_norm': 'cosine_then_gcn', 'self_loops': False, 'use_snp_selection': False}. Best is trial 23 with value: 0.2997949033109354.
[I 2025-12-08 16:04:52,009] Trial 127 finished with value: 0.23442420314142387 and parameters: {'model_type': 'gcn', 'hidden_dims': '[512, 128]', 'dropout': 0.42662143183347784, 'batch_norm': True, 'lr': 0.0011250878277665704, 'weight_decay': 0.0005089179501141679, 'epochs': 52, 'loss': 'mae', 'optimizer': 'adam', 'graph_mode': 'knn', 'knn_k': 2, 'weighted_edges': True, 'symmetrize_mode': 'mutual', 'self_loops': True, 'use_snp_selection': True, 'num_snps': 11715}. Best is trial 23 with value: 0.2997949033109354.
[I 2025-12-08 16:04:59,277] Trial 128 finished with value: 0.2874630978372642 and parameters: {'model_type': 'gcn', 'hidden_dims': '[128, 64]', 'dropout': 0.49453812114818074, 'batch_norm': True, 'lr': 0.0004482899089291879, 'weight_decay': 5.05237274944909e-05, 'epochs': 79, 'loss': 'mse', 'optimizer': 'adam', 'graph_mode': 'cutoff', 'cutoff': 0.6279199125417089, 'grm_norm': 'cosine_then_gcn', 'self_loops': False, 'use_snp_selection': False}. Best is trial 23 with value: 0.2997949033109354.
[I 2025-12-08 16:05:12,183] Trial 129 finished with value: 0.25347186647869324 and parameters: {'model_type': 'gcn', 'hidden_dims': '[512, 128]', 'dropout': 0.44533198117555545, 'batch_norm': True, 'lr': 0.0006316017378038227, 'weight_decay': 0.00012508372050019855, 'epochs': 40, 'loss': 'mae', 'optimizer': 'adam', 'graph_mode': 'cutoff', 'cutoff': 0.3042648927970664, 'grm_norm': 'cosine_then_gcn', 'self_loops': False, 'use_snp_selection': False}. Best is trial 23 with value: 0.2997949033109354.
[I 2025-12-08 16:05:36,934] Trial 130 finished with value: 0.008033692687457062 and parameters: {'model_type': 'gcn', 'hidden_dims': '[512, 128]', 'dropout': 0.41196551200666276, 'batch_norm': False, 'lr': 0.0012938104977691153, 'weight_decay': 1.9317916998910353e-05, 'epochs': 91, 'loss': 'mae', 'optimizer': 'adam', 'graph_mode': 'cutoff', 'cutoff': 0.5776571464360641, 'grm_norm': 'none', 'self_loops': True, 'use_snp_selection': False}. Best is trial 23 with value: 0.2997949033109354.
[I 2025-12-08 16:05:54,500] Trial 131 finished with value: 0.2942644958598729 and parameters: {'model_type': 'gcn', 'hidden_dims': '[512, 256]', 'dropout': 0.4821446478544946, 'batch_norm': True, 'lr': 0.0004890742647144983, 'weight_decay': 1.3620208524545968e-05, 'epochs': 60, 'loss': 'mae', 'optimizer': 'adam', 'graph_mode': 'cutoff', 'cutoff': 0.8543518051117135, 'grm_norm': 'cosine_then_gcn', 'self_loops': False, 'use_snp_selection': False}. Best is trial 23 with value: 0.2997949033109354.
[I 2025-12-08 16:06:10,867] Trial 132 finished with value: 0.2952074843782972 and parameters: {'model_type': 'gcn', 'hidden_dims': '[512, 256]', 'dropout': 0.48302440678695163, 'batch_norm': True, 'lr': 0.0007035677280732867, 'weight_decay': 2.179889124665135e-05, 'epochs': 55, 'loss': 'mae', 'optimizer': 'adam', 'graph_mode': 'cutoff', 'cutoff': 0.8290929204149889, 'grm_norm': 'cosine_then_gcn', 'self_loops': False, 'use_snp_selection': False}. Best is trial 23 with value: 0.2997949033109354.
[I 2025-12-08 16:06:31,554] Trial 133 finished with value: 0.2933654435102485 and parameters: {'model_type': 'gcn', 'hidden_dims': '[512, 256]', 'dropout': 0.4602252227039778, 'batch_norm': True, 'lr': 0.0009557675028504128, 'weight_decay': 8.973837808704683e-06, 'epochs': 73, 'loss': 'mae', 'optimizer': 'adam', 'graph_mode': 'cutoff', 'cutoff': 0.8193638195211959, 'grm_norm': 'cosine_then_gcn', 'self_loops': False, 'use_snp_selection': False}. Best is trial 23 with value: 0.2997949033109354.
[I 2025-12-08 16:06:46,474] Trial 134 finished with value: 0.29479237688183535 and parameters: {'model_type': 'gcn', 'hidden_dims': '[512, 256]', 'dropout': 0.5128954943588796, 'batch_norm': True, 'lr': 0.0006724810238934162, 'weight_decay': 2.3907575256026387e-05, 'epochs': 49, 'loss': 'mae', 'optimizer': 'adam', 'graph_mode': 'cutoff', 'cutoff': 0.8286873717337548, 'grm_norm': 'cosine_then_gcn', 'self_loops': False, 'use_snp_selection': False}. Best is trial 23 with value: 0.2997949033109354.
[I 2025-12-08 16:07:01,379] Trial 135 finished with value: 0.2984022710732152 and parameters: {'model_type': 'gcn', 'hidden_dims': '[512, 256]', 'dropout': 0.5138796003947732, 'batch_norm': True, 'lr': 0.0006667145446278474, 'weight_decay': 2.3271909736749133e-05, 'epochs': 49, 'loss': 'mae', 'optimizer': 'adam', 'graph_mode': 'cutoff', 'cutoff': 0.8381344091334134, 'grm_norm': 'cosine_then_gcn', 'self_loops': False, 'use_snp_selection': False}. Best is trial 23 with value: 0.2997949033109354.
[I 2025-12-08 16:07:15,811] Trial 136 finished with value: 0.2972461372164029 and parameters: {'model_type': 'gcn', 'hidden_dims': '[512, 256]', 'dropout': 0.5162071997460274, 'batch_norm': True, 'lr': 0.0008441071624561602, 'weight_decay': 2.3525800838617388e-05, 'epochs': 47, 'loss': 'mae', 'optimizer': 'adam', 'graph_mode': 'cutoff', 'cutoff': 0.8336104895993063, 'grm_norm': 'cosine_then_gcn', 'self_loops': False, 'use_snp_selection': False}. Best is trial 23 with value: 0.2997949033109354.
[I 2025-12-08 16:07:29,991] Trial 137 finished with value: 0.2971163582870977 and parameters: {'model_type': 'gcn', 'hidden_dims': '[512, 256]', 'dropout': 0.5340588620041852, 'batch_norm': True, 'lr': 0.0008323714251496042, 'weight_decay': 2.204925323004973e-05, 'epochs': 46, 'loss': 'mae', 'optimizer': 'adam', 'graph_mode': 'cutoff', 'cutoff': 0.8346347346743035, 'grm_norm': 'cosine_then_gcn', 'self_loops': False, 'use_snp_selection': False}. Best is trial 23 with value: 0.2997949033109354.
[I 2025-12-08 16:07:44,173] Trial 138 finished with value: 0.29057028116398936 and parameters: {'model_type': 'gcn', 'hidden_dims': '[512, 256]', 'dropout': 0.5364046410348018, 'batch_norm': True, 'lr': 0.0008373455982658675, 'weight_decay': 1.9713877795357068e-05, 'epochs': 46, 'loss': 'mae', 'optimizer': 'adam', 'graph_mode': 'cutoff', 'cutoff': 0.8395164764830669, 'grm_norm': 'cosine_then_gcn', 'self_loops': False, 'use_snp_selection': False}. Best is trial 23 with value: 0.2997949033109354.
[I 2025-12-08 16:08:00,779] Trial 139 finished with value: 0.2975869175564359 and parameters: {'model_type': 'gcn', 'hidden_dims': '[512, 256]', 'dropout': 0.5239440191521085, 'batch_norm': True, 'lr': 0.0005762975132171797, 'weight_decay': 1.6269672726173395e-05, 'epochs': 56, 'loss': 'mae', 'optimizer': 'adam', 'graph_mode': 'cutoff', 'cutoff': 0.7963354309123828, 'grm_norm': 'cosine_then_gcn', 'self_loops': False, 'use_snp_selection': False}. Best is trial 23 with value: 0.2997949033109354.
[I 2025-12-08 16:08:13,529] Trial 140 finished with value: 0.2952907574172399 and parameters: {'model_type': 'gcn', 'hidden_dims': '[512, 256]', 'dropout': 0.5551464016979262, 'batch_norm': True, 'lr': 0.000946087644085907, 'weight_decay': 1.576929470586947e-05, 'epochs': 40, 'loss': 'mae', 'optimizer': 'adam', 'graph_mode': 'cutoff', 'cutoff': 0.7880379747674685, 'grm_norm': 'cosine_then_gcn', 'self_loops': False, 'use_snp_selection': False}. Best is trial 23 with value: 0.2997949033109354.
[I 2025-12-08 16:08:26,992] Trial 141 finished with value: 0.2992205710463508 and parameters: {'model_type': 'gcn', 'hidden_dims': '[512, 256]', 'dropout': 0.554941309791999, 'batch_norm': True, 'lr': 0.000960885527049313, 'weight_decay': 1.148522806673821e-05, 'epochs': 43, 'loss': 'mae', 'optimizer': 'adam', 'graph_mode': 'cutoff', 'cutoff': 0.7971694368046554, 'grm_norm': 'cosine_then_gcn', 'self_loops': False, 'use_snp_selection': False}. Best is trial 23 with value: 0.2997949033109354.
[I 2025-12-08 16:08:39,721] Trial 142 finished with value: 0.2994969695021085 and parameters: {'model_type': 'gcn', 'hidden_dims': '[512, 256]', 'dropout': 0.5595975041177652, 'batch_norm': True, 'lr': 0.0009155389138291344, 'weight_decay': 1.4997439859281614e-05, 'epochs': 40, 'loss': 'mae', 'optimizer': 'adam', 'graph_mode': 'cutoff', 'cutoff': 0.7976532889883977, 'grm_norm': 'cosine_then_gcn', 'self_loops': False, 'use_snp_selection': False}. Best is trial 23 with value: 0.2997949033109354.
[I 2025-12-08 16:08:52,468] Trial 143 finished with value: 0.29619121698879686 and parameters: {'model_type': 'gcn', 'hidden_dims': '[512, 256]', 'dropout': 0.5511766455253917, 'batch_norm': True, 'lr': 0.0016937705475278985, 'weight_decay': 1.204499009774248e-05, 'epochs': 40, 'loss': 'mae', 'optimizer': 'adam', 'graph_mode': 'cutoff', 'cutoff': 0.795373488843596, 'grm_norm': 'cosine_then_gcn', 'self_loops': False, 'use_snp_selection': False}. Best is trial 23 with value: 0.2997949033109354.
[I 2025-12-08 16:09:06,413] Trial 144 finished with value: 0.29633100438832355 and parameters: {'model_type': 'gcn', 'hidden_dims': '[512, 256]', 'dropout': 0.5771005475999726, 'batch_norm': True, 'lr': 0.0012340180753510508, 'weight_decay': 1.078746618000966e-05, 'epochs': 45, 'loss': 'mae', 'optimizer': 'adam', 'graph_mode': 'cutoff', 'cutoff': 0.8033110418288542, 'grm_norm': 'cosine_then_gcn', 'self_loops': False, 'use_snp_selection': False}. Best is trial 23 with value: 0.2997949033109354.
[I 2025-12-08 16:09:20,847] Trial 145 finished with value: 0.29746885287531954 and parameters: {'model_type': 'gcn', 'hidden_dims': '[512, 256]', 'dropout': 0.5747192172675968, 'batch_norm': True, 'lr': 0.0021511725822906127, 'weight_decay': 6.482396735852674e-06, 'epochs': 47, 'loss': 'mae', 'optimizer': 'adam', 'graph_mode': 'cutoff', 'cutoff': 0.7752179054001819, 'grm_norm': 'cosine_then_gcn', 'self_loops': False, 'use_snp_selection': False}. Best is trial 23 with value: 0.2997949033109354.
[I 2025-12-08 16:09:35,284] Trial 146 finished with value: 0.29309689276448825 and parameters: {'model_type': 'gcn', 'hidden_dims': '[512, 256]', 'dropout': 0.575388776062749, 'batch_norm': True, 'lr': 0.00219847605442509, 'weight_decay': 1.1134333153625373e-05, 'epochs': 47, 'loss': 'mae', 'optimizer': 'adam', 'graph_mode': 'cutoff', 'cutoff': 0.7723682340526314, 'grm_norm': 'cosine_then_gcn', 'self_loops': False, 'use_snp_selection': False}. Best is trial 23 with value: 0.2997949033109354.
[I 2025-12-08 16:09:47,853] Trial 147 finished with value: 0.2958533414332068 and parameters: {'model_type': 'gcn', 'hidden_dims': '[512, 256]', 'dropout': 0.5886348567615723, 'batch_norm': True, 'lr': 0.0016317595359481773, 'weight_decay': 6.593780042946748e-06, 'epochs': 40, 'loss': 'mae', 'optimizer': 'adam', 'graph_mode': 'cutoff', 'cutoff': 0.809377751693654, 'grm_norm': 'gcn', 'self_loops': False, 'use_snp_selection': False}. Best is trial 23 with value: 0.2997949033109354.
[I 2025-12-08 16:10:01,790] Trial 148 finished with value: 0.29641464420721353 and parameters: {'model_type': 'gcn', 'hidden_dims': '[512, 256]', 'dropout': 0.5636837700383796, 'batch_norm': True, 'lr': 0.0027878925464938174, 'weight_decay': 7.447142399712541e-06, 'epochs': 45, 'loss': 'mae', 'optimizer': 'adam', 'graph_mode': 'cutoff', 'cutoff': 0.79164856136481, 'grm_norm': 'cosine_then_gcn', 'self_loops': False, 'use_snp_selection': False}. Best is trial 23 with value: 0.2997949033109354.
[I 2025-12-08 16:10:15,731] Trial 149 finished with value: 0.29691076163158325 and parameters: {'model_type': 'gcn', 'hidden_dims': '[512, 256]', 'dropout': 0.5625546991278061, 'batch_norm': True, 'lr': 0.004347111663757429, 'weight_decay': 7.574665185208437e-06, 'epochs': 45, 'loss': 'mae', 'optimizer': 'adam', 'graph_mode': 'cutoff', 'cutoff': 0.7919652666299501, 'grm_norm': 'cosine_then_gcn', 'self_loops': False, 'use_snp_selection': False}. Best is trial 23 with value: 0.2997949033109354.
[I 2025-12-08 16:10:44,320] Trial 0 finished with value: 0.23199955770478561 and parameters: {'model_type': 'gcn', 'hidden_dims': '[128, 64]', 'dropout': 0.199031432379812, 'batch_norm': True, 'lr': 1.8408544111075823e-05, 'weight_decay': 5.5136510071208614e-05, 'epochs': 336, 'loss': 'mae', 'optimizer': 'adam', 'graph_mode': 'knn', 'knn_k': 8, 'weighted_edges': True, 'symmetrize_mode': 'mutual', 'self_loops': True, 'use_snp_selection': True, 'num_snps': 27173}. Best is trial 0 with value: 0.23199955770478561.
[I 2025-12-08 16:11:22,580] Trial 1 finished with value: 0.20988594903359914 and parameters: {'model_type': 'gcn', 'hidden_dims': '[256, 128, 64]', 'dropout': 0.5543244404043342, 'batch_norm': True, 'lr': 7.981787657617978e-05, 'weight_decay': 2.8571789869344834e-07, 'epochs': 297, 'loss': 'mae', 'optimizer': 'adam', 'graph_mode': 'cutoff', 'cutoff': 0.3392632777751686, 'grm_norm': 'gcn', 'self_loops': False, 'use_snp_selection': False}. Best is trial 0 with value: 0.23199955770478561.
[I 2025-12-08 16:12:20,603] Trial 2 finished with value: 0.21580455860361752 and parameters: {'model_type': 'gcn', 'hidden_dims': '[512, 64]', 'dropout': 0.32815227354739207, 'batch_norm': True, 'lr': 0.000619605044204259, 'weight_decay': 0.0004086269831625786, 'epochs': 206, 'loss': 'mse', 'optimizer': 'adam', 'graph_mode': 'knn', 'knn_k': 4, 'weighted_edges': True, 'symmetrize_mode': 'union', 'self_loops': True, 'use_snp_selection': True, 'num_snps': 53035}. Best is trial 0 with value: 0.23199955770478561.
[I 2025-12-08 16:12:48,147] Trial 3 finished with value: 0.2023247013691714 and parameters: {'model_type': 'gcn', 'hidden_dims': '[256, 128]', 'dropout': 0.23110783056597514, 'batch_norm': True, 'lr': 8.11311593386298e-05, 'weight_decay': 9.296158109581328e-07, 'epochs': 213, 'loss': 'mse', 'optimizer': 'adam', 'graph_mode': 'knn', 'knn_k': 10, 'weighted_edges': True, 'symmetrize_mode': 'mutual', 'self_loops': True, 'use_snp_selection': False}. Best is trial 0 with value: 0.23199955770478561.
[I 2025-12-08 16:13:02,760] Trial 4 finished with value: 0.2846439443519822 and parameters: {'model_type': 'gcn', 'hidden_dims': '[512, 256]', 'dropout': 0.2753281956415665, 'batch_norm': True, 'lr': 0.00034435188114839693, 'weight_decay': 4.9416012835950194e-05, 'epochs': 89, 'loss': 'mae', 'optimizer': 'adam', 'graph_mode': 'cutoff', 'cutoff': 0.820078967317394, 'grm_norm': 'none', 'self_loops': False, 'use_snp_selection': True, 'num_snps': 12674}. Best is trial 4 with value: 0.2846439443519822.
[I 2025-12-08 16:13:27,757] Trial 5 finished with value: 0.2576002624752594 and parameters: {'model_type': 'gcn', 'hidden_dims': '[128, 64]', 'dropout': 0.5611163934517731, 'batch_norm': True, 'lr': 0.0003984856210762587, 'weight_decay': 1.1466743517565185e-07, 'epochs': 344, 'loss': 'mae', 'optimizer': 'adam', 'graph_mode': 'cutoff', 'cutoff': 0.6089370799714728, 'grm_norm': 'gcn', 'self_loops': True, 'use_snp_selection': False}. Best is trial 4 with value: 0.2846439443519822.
[I 2025-12-08 16:13:50,286] Trial 6 finished with value: 0.2602415458697531 and parameters: {'model_type': 'gcn', 'hidden_dims': '[128, 64]', 'dropout': 0.31805912766941713, 'batch_norm': True, 'lr': 1.2361026034262557e-05, 'weight_decay': 6.492620232791903e-06, 'epochs': 271, 'loss': 'mse', 'optimizer': 'adam', 'graph_mode': 'cutoff', 'cutoff': 0.6193362582230448, 'grm_norm': 'cosine', 'self_loops': False, 'use_snp_selection': True, 'num_snps': 28594}. Best is trial 4 with value: 0.2846439443519822.
[I 2025-12-08 16:14:10,130] Trial 7 finished with value: 0.2571422345184251 and parameters: {'model_type': 'gcn', 'hidden_dims': '[512, 64]', 'dropout': 0.471337288649717, 'batch_norm': True, 'lr': 2.239693207292708e-05, 'weight_decay': 2.263166635514082e-06, 'epochs': 69, 'loss': 'mse', 'optimizer': 'adam', 'graph_mode': 'cutoff', 'cutoff': 0.4056820886426376, 'grm_norm': 'cosine', 'self_loops': False, 'use_snp_selection': False}. Best is trial 4 with value: 0.2846439443519822.
