[I 2025-12-08 21:51:02,450] Trial 14 finished with value: 0.04604827414627195 and parameters: {'model_type': 'gcn', 'hidden_dims': '[256, 128]', 'dropout': 0.4280653677930823, 'batch_norm': False, 'lr': 0.009430566714901507, 'weight_decay': 7.081154721639774e-06, 'epochs': 135, 'loss': 'mae', 'optimizer': 'adam', 'graph_mode': 'cutoff', 'cutoff': 0.7240625816402448, 'grm_norm': 'cosine_then_gcn', 'self_loops': True, 'use_snp_selection': False}. Best is trial 11 with value: 0.30837093707329977.
[I 2025-12-08 21:51:25,428] Trial 15 finished with value: 0.3135668235684893 and parameters: {'model_type': 'gcn', 'hidden_dims': '[256, 128]', 'dropout': 0.4827864904294467, 'batch_norm': True, 'lr': 0.000166827860779801, 'weight_decay': 4.104169171058631e-07, 'epochs': 172, 'loss': 'mae', 'optimizer': 'adam', 'graph_mode': 'cutoff', 'cutoff': 0.7416328481826706, 'grm_norm': 'cosine_then_gcn', 'self_loops': False, 'use_snp_selection': False}. Best is trial 15 with value: 0.3135668235684893.
[I 2025-12-08 21:52:12,167] Trial 16 finished with value: 0.31153273937679793 and parameters: {'model_type': 'gcn', 'hidden_dims': '[512, 128]', 'dropout': 0.4988064344225382, 'batch_norm': True, 'lr': 0.00018610916715297834, 'weight_decay': 3.7717055221981746e-07, 'epochs': 178, 'loss': 'mae', 'optimizer': 'adam', 'graph_mode': 'cutoff', 'cutoff': 0.7162710405524246, 'grm_norm': 'cosine_then_gcn', 'self_loops': False, 'use_snp_selection': False}. Best is trial 15 with value: 0.3135668235684893.
[I 2025-12-08 21:53:14,078] Trial 17 finished with value: 0.20406239100312495 and parameters: {'model_type': 'gcn', 'hidden_dims': '[512, 128]', 'dropout': 0.5101604050085489, 'batch_norm': True, 'lr': 0.00014056876271838377, 'weight_decay': 4.5817280187175797e-07, 'epochs': 240, 'loss': 'mae', 'optimizer': 'adam', 'graph_mode': 'cutoff', 'cutoff': 0.48163207916794326, 'grm_norm': 'cosine_then_gcn', 'self_loops': False, 'use_snp_selection': False}. Best is trial 15 with value: 0.3135668235684893.
[I 2025-12-08 21:54:00,417] Trial 18 finished with value: 0.26323977498468 and parameters: {'model_type': 'gcn', 'hidden_dims': '[512, 128]', 'dropout': 0.38212844504793647, 'batch_norm': False, 'lr': 3.997746938164808e-05, 'weight_decay': 4.771905199375472e-07, 'epochs': 178, 'loss': 'mae', 'optimizer': 'adam', 'graph_mode': 'knn', 'knn_k': 1, 'weighted_edges': False, 'symmetrize_mode': 'mutual', 'self_loops': False, 'use_snp_selection': False}. Best is trial 15 with value: 0.3135668235684893.
[I 2025-12-08 21:54:30,944] Trial 19 finished with value: 0.29661347417187545 and parameters: {'model_type': 'gcn', 'hidden_dims': '[256, 128, 64]', 'dropout': 0.5972327215560366, 'batch_norm': True, 'lr': 0.00015649218402835204, 'weight_decay': 2.500117190559781e-06, 'epochs': 229, 'loss': 'mae', 'optimizer': 'adam', 'graph_mode': 'cutoff', 'cutoff': 0.7141405811516445, 'grm_norm': 'cosine_then_gcn', 'self_loops': False, 'use_snp_selection': False}. Best is trial 15 with value: 0.3135668235684893.
[I 2025-12-08 21:54:52,727] Trial 20 finished with value: 0.24951139672791706 and parameters: {'model_type': 'gcn', 'hidden_dims': '[256, 128]', 'dropout': 0.38284547527628443, 'batch_norm': True, 'lr': 0.0012172908831772238, 'weight_decay': 1.9800037260488955e-07, 'epochs': 158, 'loss': 'mae', 'optimizer': 'adam', 'graph_mode': 'cutoff', 'cutoff': 0.2386548621641688, 'grm_norm': 'cosine_then_gcn', 'self_loops': False, 'use_snp_selection': False}. Best is trial 15 with value: 0.3135668235684893.
[I 2025-12-08 21:55:05,026] Trial 21 finished with value: 0.3006619379589365 and parameters: {'model_type': 'gcn', 'hidden_dims': '[128, 64]', 'dropout': 0.4995923992730177, 'batch_norm': True, 'lr': 0.00021749770176620242, 'weight_decay': 1.1184311207850229e-07, 'epochs': 140, 'loss': 'mae', 'optimizer': 'adam', 'graph_mode': 'cutoff', 'cutoff': 0.7723037998128993, 'grm_norm': 'cosine_then_gcn', 'self_loops': True, 'use_snp_selection': False}. Best is trial 15 with value: 0.3135668235684893.
[I 2025-12-08 21:55:53,409] Trial 22 finished with value: 0.3060587173693554 and parameters: {'model_type': 'gcn', 'hidden_dims': '[512, 128]', 'dropout': 0.5187814043485741, 'batch_norm': True, 'lr': 0.0007919879480076257, 'weight_decay': 9.432275226683418e-07, 'epochs': 186, 'loss': 'mae', 'optimizer': 'adam', 'graph_mode': 'cutoff', 'cutoff': 0.6693963729191204, 'grm_norm': 'cosine_then_gcn', 'self_loops': False, 'use_snp_selection': False}. Best is trial 15 with value: 0.3135668235684893.
[I 2025-12-08 21:56:05,102] Trial 23 finished with value: 0.29975294617222886 and parameters: {'model_type': 'gcn', 'hidden_dims': '[128, 64]', 'dropout': 0.3905710881414786, 'batch_norm': True, 'lr': 3.922862780890766e-05, 'weight_decay': 2.8072217869726794e-07, 'epochs': 131, 'loss': 'mae', 'optimizer': 'adam', 'graph_mode': 'cutoff', 'cutoff': 0.8296269164520467, 'grm_norm': 'cosine_then_gcn', 'self_loops': True, 'use_snp_selection': False}. Best is trial 15 with value: 0.3135668235684893.
[I 2025-12-08 21:56:20,801] Trial 24 finished with value: 0.3065087001182793 and parameters: {'model_type': 'gcn', 'hidden_dims': '[256, 128]', 'dropout': 0.4661560939141018, 'batch_norm': True, 'lr': 0.0004906726162185601, 'weight_decay': 1.0070899919857008e-07, 'epochs': 111, 'loss': 'mae', 'optimizer': 'adam', 'graph_mode': 'cutoff', 'cutoff': 0.7848213961218918, 'grm_norm': 'cosine_then_gcn', 'self_loops': False, 'use_snp_selection': False}. Best is trial 15 with value: 0.3135668235684893.
[I 2025-12-08 21:57:23,960] Trial 25 finished with value: 0.2294027159659467 and parameters: {'model_type': 'gcn', 'hidden_dims': '[512, 128]', 'dropout': 0.5473785408671414, 'batch_norm': True, 'lr': 0.00017259824114244858, 'weight_decay': 6.96383574879354e-07, 'epochs': 248, 'loss': 'mae', 'optimizer': 'adam', 'graph_mode': 'cutoff', 'cutoff': 0.5335045786871289, 'grm_norm': 'none', 'self_loops': False, 'use_snp_selection': False}. Best is trial 15 with value: 0.3135668235684893.
[I 2025-12-08 21:57:47,380] Trial 26 finished with value: 0.02041170218790881 and parameters: {'model_type': 'gcn', 'hidden_dims': '[256, 128, 64]', 'dropout': 0.48376990993340724, 'batch_norm': False, 'lr': 0.0008030084542038695, 'weight_decay': 2.2325288931924753e-07, 'epochs': 167, 'loss': 'mse', 'optimizer': 'adam', 'graph_mode': 'knn', 'knn_k': 6, 'weighted_edges': False, 'symmetrize_mode': 'union', 'self_loops': True, 'use_snp_selection': False}. Best is trial 15 with value: 0.3135668235684893.
[I 2025-12-08 21:57:54,104] Trial 27 finished with value: 0.2831321237480289 and parameters: {'model_type': 'gcn', 'hidden_dims': '[128, 64]', 'dropout': 0.40612053944233784, 'batch_norm': True, 'lr': 5.136073077262061e-05, 'weight_decay': 4.298619282161268e-06, 'epochs': 64, 'loss': 'mae', 'optimizer': 'adam', 'graph_mode': 'cutoff', 'cutoff': 0.6732650936169071, 'grm_norm': 'gcn', 'self_loops': False, 'use_snp_selection': False}. Best is trial 15 with value: 0.3135668235684893.
[I 2025-12-08 21:58:46,696] Trial 28 finished with value: 0.3078300896095508 and parameters: {'model_type': 'gcn', 'hidden_dims': '[512, 64]', 'dropout': 0.5935725731648722, 'batch_norm': True, 'lr': 0.0021369870162353134, 'weight_decay': 1.6358611639575476e-06, 'epochs': 204, 'loss': 'mae', 'optimizer': 'adam', 'graph_mode': 'cutoff', 'cutoff': 0.839553757729729, 'grm_norm': 'cosine_then_gcn', 'self_loops': True, 'use_snp_selection': False}. Best is trial 15 with value: 0.3135668235684893.
[I 2025-12-08 21:59:57,391] Trial 29 finished with value: 0.2000839100751705 and parameters: {'model_type': 'gcn', 'hidden_dims': '[512, 128]', 'dropout': 0.3574875507322215, 'batch_norm': True, 'lr': 0.000258800311873924, 'weight_decay': 1.4923074845381194e-05, 'epochs': 272, 'loss': 'mae', 'optimizer': 'adam', 'graph_mode': 'knn', 'knn_k': 10, 'weighted_edges': False, 'symmetrize_mode': 'mutual', 'self_loops': True, 'use_snp_selection': False}. Best is trial 15 with value: 0.3135668235684893.
[I 2025-12-08 22:00:14,266] Trial 30 finished with value: 0.3089513993071254 and parameters: {'model_type': 'gcn', 'hidden_dims': '[256, 128]', 'dropout': 0.5258780707439435, 'batch_norm': True, 'lr': 0.0017079331345115675, 'weight_decay': 4.0889126628503245e-07, 'epochs': 118, 'loss': 'mae', 'optimizer': 'adam', 'graph_mode': 'cutoff', 'cutoff': 0.6903306975514459, 'grm_norm': 'cosine_then_gcn', 'self_loops': False, 'use_snp_selection': False}. Best is trial 15 with value: 0.3135668235684893.
[I 2025-12-08 22:00:30,952] Trial 31 finished with value: 0.3084551736155257 and parameters: {'model_type': 'gcn', 'hidden_dims': '[256, 128]', 'dropout': 0.5161383614829491, 'batch_norm': True, 'lr': 0.0020956072849757554, 'weight_decay': 4.316116971907243e-07, 'epochs': 118, 'loss': 'mae', 'optimizer': 'adam', 'graph_mode': 'cutoff', 'cutoff': 0.692343720459735, 'grm_norm': 'cosine_then_gcn', 'self_loops': False, 'use_snp_selection': False}. Best is trial 15 with value: 0.3135668235684893.
[I 2025-12-08 22:00:51,882] Trial 32 finished with value: 0.30391192951228446 and parameters: {'model_type': 'gcn', 'hidden_dims': '[256, 128]', 'dropout': 0.5385262641389116, 'batch_norm': True, 'lr': 0.003758391221574808, 'weight_decay': 4.7563524045368263e-07, 'epochs': 156, 'loss': 'mae', 'optimizer': 'adam', 'graph_mode': 'cutoff', 'cutoff': 0.68660200753194, 'grm_norm': 'cosine_then_gcn', 'self_loops': False, 'use_snp_selection': False}. Best is trial 15 with value: 0.3135668235684893.
[I 2025-12-08 22:01:17,320] Trial 33 finished with value: 0.29784042907622277 and parameters: {'model_type': 'gcn', 'hidden_dims': '[256, 128]', 'dropout': 0.5658452795668538, 'batch_norm': True, 'lr': 0.0015281458454112372, 'weight_decay': 0.0009340306411883499, 'epochs': 193, 'loss': 'mae', 'optimizer': 'adam', 'graph_mode': 'cutoff', 'cutoff': 0.6472463015570903, 'grm_norm': 'cosine_then_gcn', 'self_loops': False, 'use_snp_selection': False}. Best is trial 15 with value: 0.3135668235684893.
[I 2025-12-08 22:01:34,708] Trial 34 finished with value: 0.28796005541735803 and parameters: {'model_type': 'gcn', 'hidden_dims': '[256, 128]', 'dropout': 0.5289089305953241, 'batch_norm': True, 'lr': 0.006973751572924732, 'weight_decay': 9.926890376287335e-07, 'epochs': 124, 'loss': 'mae', 'optimizer': 'adam', 'graph_mode': 'cutoff', 'cutoff': 0.5573376296172071, 'grm_norm': 'cosine_then_gcn', 'self_loops': False, 'use_snp_selection': False}. Best is trial 15 with value: 0.3135668235684893.
[I 2025-12-08 22:02:03,430] Trial 35 finished with value: 0.19659716364374483 and parameters: {'model_type': 'gcn', 'hidden_dims': '[256, 128]', 'dropout': 0.48955162635154126, 'batch_norm': True, 'lr': 0.00011010031408037672, 'weight_decay': 3.698198343118483e-07, 'epochs': 221, 'loss': 'mse', 'optimizer': 'adam', 'graph_mode': 'knn', 'knn_k': 1, 'weighted_edges': True, 'symmetrize_mode': 'union', 'self_loops': False, 'use_snp_selection': False}. Best is trial 15 with value: 0.3135668235684893.
[I 2025-12-08 22:02:30,043] Trial 36 finished with value: 0.31115895264874704 and parameters: {'model_type': 'gcn', 'hidden_dims': '[256, 128]', 'dropout': 0.5749234212191181, 'batch_norm': True, 'lr': 0.003336457892785549, 'weight_decay': 1.9765129554772783e-07, 'epochs': 79, 'loss': 'mae', 'optimizer': 'adam', 'graph_mode': 'cutoff', 'cutoff': 0.712603107766186, 'grm_norm': 'cosine_then_gcn', 'self_loops': False, 'use_snp_selection': True, 'num_snps': 55695}. Best is trial 15 with value: 0.3135668235684893.
[I 2025-12-08 22:02:57,211] Trial 37 finished with value: 0.31152436158703595 and parameters: {'model_type': 'gcn', 'hidden_dims': '[256, 128]', 'dropout': 0.5848681513750411, 'batch_norm': True, 'lr': 0.003659502567442231, 'weight_decay': 2.067013225570204e-07, 'epochs': 75, 'loss': 'mae', 'optimizer': 'adam', 'graph_mode': 'cutoff', 'cutoff': 0.7473149043956389, 'grm_norm': 'cosine_then_gcn', 'self_loops': False, 'use_snp_selection': True, 'num_snps': 58690}. Best is trial 15 with value: 0.3135668235684893.
[I 2025-12-08 22:03:32,677] Trial 38 finished with value: 0.3077796206440989 and parameters: {'model_type': 'gcn', 'hidden_dims': '[512, 64]', 'dropout': 0.5699410113710115, 'batch_norm': True, 'lr': 0.0035880097460113977, 'weight_decay': 1.8838030171965365e-07, 'epochs': 77, 'loss': 'mse', 'optimizer': 'adam', 'graph_mode': 'cutoff', 'cutoff': 0.7488790880301633, 'grm_norm': 'gcn', 'self_loops': False, 'use_snp_selection': True, 'num_snps': 59296}. Best is trial 15 with value: 0.3135668235684893.
[I 2025-12-08 22:04:21,510] Trial 39 finished with value: 0.26031839770548354 and parameters: {'model_type': 'gcn', 'hidden_dims': '[256, 128, 64]', 'dropout': 0.5783276888102343, 'batch_norm': True, 'lr': 7.092017717051566e-05, 'weight_decay': 1.6806825440493404e-07, 'epochs': 327, 'loss': 'mae', 'optimizer': 'adam', 'graph_mode': 'knn', 'knn_k': 6, 'weighted_edges': True, 'symmetrize_mode': 'union', 'self_loops': False, 'use_snp_selection': True, 'num_snps': 45353}. Best is trial 15 with value: 0.3135668235684893.
[I 2025-12-08 22:04:41,296] Trial 40 finished with value: 0.013672596753922 and parameters: {'model_type': 'gcn', 'hidden_dims': '[256, 128]', 'dropout': 0.555016966844849, 'batch_norm': False, 'lr': 0.0003798437756947384, 'weight_decay': 7.322506670017737e-07, 'epochs': 45, 'loss': 'mse', 'optimizer': 'adam', 'graph_mode': 'cutoff', 'cutoff': 0.7825811417627592, 'grm_norm': 'cosine', 'self_loops': False, 'use_snp_selection': True, 'num_snps': 44178}. Best is trial 15 with value: 0.3135668235684893.
[I 2025-12-08 22:05:08,895] Trial 41 finished with value: 0.30894199815765566 and parameters: {'model_type': 'gcn', 'hidden_dims': '[256, 128]', 'dropout': 0.5998989117336117, 'batch_norm': True, 'lr': 0.004960778984198406, 'weight_decay': 2.526475275313711e-07, 'epochs': 82, 'loss': 'mae', 'optimizer': 'adam', 'graph_mode': 'cutoff', 'cutoff': 0.7266581143556368, 'grm_norm': 'cosine_then_gcn', 'self_loops': False, 'use_snp_selection': True, 'num_snps': 58281}. Best is trial 15 with value: 0.3135668235684893.
[I 2025-12-08 22:05:28,021] Trial 42 finished with value: 0.30884237281518806 and parameters: {'model_type': 'gcn', 'hidden_dims': '[256, 128]', 'dropout': 0.5373381499868795, 'batch_norm': True, 'lr': 0.002870163453777633, 'weight_decay': 1.4000420512241125e-06, 'epochs': 60, 'loss': 'mae', 'optimizer': 'adam', 'graph_mode': 'cutoff', 'cutoff': 0.648660724576198, 'grm_norm': 'cosine_then_gcn', 'self_loops': False, 'use_snp_selection': True, 'num_snps': 36902}. Best is trial 15 with value: 0.3135668235684893.
[I 2025-12-08 22:05:55,485] Trial 43 finished with value: 0.3093789094715932 and parameters: {'model_type': 'gcn', 'hidden_dims': '[256, 128]', 'dropout': 0.4619567413347097, 'batch_norm': True, 'lr': 0.0062717700792992844, 'weight_decay': 1.6930412366726986e-07, 'epochs': 97, 'loss': 'mae', 'optimizer': 'adam', 'graph_mode': 'cutoff', 'cutoff': 0.8062795598353419, 'grm_norm': 'none', 'self_loops': False, 'use_snp_selection': True, 'num_snps': 52443}. Best is trial 15 with value: 0.3135668235684893.
[I 2025-12-08 22:06:21,868] Trial 44 finished with value: 0.30734133054556934 and parameters: {'model_type': 'gcn', 'hidden_dims': '[256, 128]', 'dropout': 0.465863412783329, 'batch_norm': True, 'lr': 0.008493464981077852, 'weight_decay': 1.5164641038511468e-07, 'epochs': 94, 'loss': 'mae', 'optimizer': 'adam', 'graph_mode': 'cutoff', 'cutoff': 0.795806612605386, 'grm_norm': 'none', 'self_loops': False, 'use_snp_selection': True, 'num_snps': 51664}. Best is trial 15 with value: 0.3135668235684893.
[I 2025-12-08 22:06:50,050] Trial 45 finished with value: 0.30578534131541735 and parameters: {'model_type': 'gcn', 'hidden_dims': '[512, 256]', 'dropout': 0.4921967433272097, 'batch_norm': True, 'lr': 0.005723347020134586, 'weight_decay': 0.00013672952338682784, 'epochs': 56, 'loss': 'mae', 'optimizer': 'adam', 'graph_mode': 'cutoff', 'cutoff': 0.8167266479525739, 'grm_norm': 'none', 'self_loops': False, 'use_snp_selection': True, 'num_snps': 50750}. Best is trial 15 with value: 0.3135668235684893.
[I 2025-12-08 22:07:16,782] Trial 46 finished with value: 0.2955335529148492 and parameters: {'model_type': 'gcn', 'hidden_dims': '[256, 128]', 'dropout': 0.43202566494831596, 'batch_norm': True, 'lr': 0.0036069805394902425, 'weight_decay': 3.021060714996313e-07, 'epochs': 74, 'loss': 'mae', 'optimizer': 'adam', 'graph_mode': 'cutoff', 'cutoff': 0.6142991189745672, 'grm_norm': 'none', 'self_loops': False, 'use_snp_selection': True, 'num_snps': 58999}. Best is trial 15 with value: 0.3135668235684893.
[I 2025-12-08 22:07:51,236] Trial 47 finished with value: 0.29872993232556755 and parameters: {'model_type': 'gcn', 'hidden_dims': '[512, 128]', 'dropout': 0.3121760001936176, 'batch_norm': True, 'lr': 0.005704385967340678, 'weight_decay': 1.665461965829978e-05, 'epochs': 144, 'loss': 'mae', 'optimizer': 'adam', 'graph_mode': 'cutoff', 'cutoff': 0.7418585340615546, 'grm_norm': 'none', 'self_loops': False, 'use_snp_selection': True, 'num_snps': 35876}. Best is trial 15 with value: 0.3135668235684893.
[I 2025-12-08 22:08:25,755] Trial 48 finished with value: 0.007415559303110905 and parameters: {'model_type': 'gcn', 'hidden_dims': '[512, 64]', 'dropout': 0.5811085308166092, 'batch_norm': False, 'lr': 0.0009383310035626463, 'weight_decay': 1.5160920055960884e-07, 'epochs': 91, 'loss': 'mae', 'optimizer': 'adam', 'graph_mode': 'cutoff', 'cutoff': 0.5632086483708868, 'grm_norm': 'gcn', 'self_loops': False, 'use_snp_selection': True, 'num_snps': 50828}. Best is trial 15 with value: 0.3135668235684893.
[I 2025-12-08 22:08:45,286] Trial 49 finished with value: 0.24208667450665441 and parameters: {'model_type': 'gcn', 'hidden_dims': '[256, 128]', 'dropout': 0.3493026266368327, 'batch_norm': True, 'lr': 0.00011780305072990825, 'weight_decay': 5.525038115203539e-07, 'epochs': 173, 'loss': 'mse', 'optimizer': 'adam', 'graph_mode': 'knn', 'knn_k': 8, 'weighted_edges': False, 'symmetrize_mode': 'mutual', 'self_loops': False, 'use_snp_selection': True, 'num_snps': 19021}. Best is trial 15 with value: 0.3135668235684893.
[I 2025-12-08 22:09:08,352] Trial 50 finished with value: 0.2821153669550804 and parameters: {'model_type': 'gcn', 'hidden_dims': '[256, 128]', 'dropout': 0.25150225197584863, 'batch_norm': True, 'lr': 0.00020359478123155135, 'weight_decay': 1.2162266112047067e-06, 'epochs': 52, 'loss': 'mae', 'optimizer': 'adam', 'graph_mode': 'cutoff', 'cutoff': 0.8974365066166108, 'grm_norm': 'cosine', 'self_loops': False, 'use_snp_selection': True, 'num_snps': 54732}. Best is trial 15 with value: 0.3135668235684893.
[I 2025-12-08 22:09:34,582] Trial 51 finished with value: 0.30870034158596027 and parameters: {'model_type': 'gcn', 'hidden_dims': '[256, 128]', 'dropout': 0.13332678957229122, 'batch_norm': True, 'lr': 0.0016010047716428723, 'weight_decay': 3.3941760741211976e-07, 'epochs': 102, 'loss': 'mae', 'optimizer': 'adam', 'graph_mode': 'cutoff', 'cutoff': 0.81659973093787, 'grm_norm': 'cosine_then_gcn', 'self_loops': False, 'use_snp_selection': True, 'num_snps': 46908}. Best is trial 15 with value: 0.3135668235684893.
[I 2025-12-08 22:09:59,522] Trial 52 finished with value: 0.3019057866495372 and parameters: {'model_type': 'gcn', 'hidden_dims': '[256, 128]', 'dropout': 0.4535709126080453, 'batch_norm': True, 'lr': 0.007129943755897344, 'weight_decay': 2.848811615604602e-06, 'epochs': 115, 'loss': 'mae', 'optimizer': 'adam', 'graph_mode': 'cutoff', 'cutoff': 0.7103133080286372, 'grm_norm': 'none', 'self_loops': False, 'use_snp_selection': True, 'num_snps': 40210}. Best is trial 15 with value: 0.3135668235684893.
[I 2025-12-08 22:10:31,627] Trial 53 finished with value: 0.30675409725326885 and parameters: {'model_type': 'gcn', 'hidden_dims': '[256, 128]', 'dropout': 0.5110013305797226, 'batch_norm': True, 'lr': 0.002974820638853052, 'weight_decay': 2.584538696467671e-07, 'epochs': 150, 'loss': 'mae', 'optimizer': 'adam', 'graph_mode': 'cutoff', 'cutoff': 0.7498282314059431, 'grm_norm': 'cosine_then_gcn', 'self_loops': False, 'use_snp_selection': True, 'num_snps': 48389}. Best is trial 15 with value: 0.3135668235684893.
[I 2025-12-08 22:11:07,821] Trial 54 finished with value: 0.31036453218702476 and parameters: {'model_type': 'gcn', 'hidden_dims': '[512, 256]', 'dropout': 0.5504289847912414, 'batch_norm': True, 'lr': 0.004478688625688944, 'weight_decay': 7.080538782983557e-07, 'epochs': 87, 'loss': 'mae', 'optimizer': 'adam', 'graph_mode': 'cutoff', 'cutoff': 0.6396069690553533, 'grm_norm': 'cosine_then_gcn', 'self_loops': False, 'use_snp_selection': True, 'num_snps': 54414}. Best is trial 15 with value: 0.3135668235684893.
[I 2025-12-08 22:11:41,048] Trial 55 finished with value: 0.3069838328815838 and parameters: {'model_type': 'gcn', 'hidden_dims': '[512, 256]', 'dropout': 0.5461117398255064, 'batch_norm': True, 'lr': 0.00946616323132761, 'weight_decay': 6.109375212227499e-07, 'epochs': 68, 'loss': 'mae', 'optimizer': 'adam', 'graph_mode': 'cutoff', 'cutoff': 0.6432732261423069, 'grm_norm': 'cosine', 'self_loops': False, 'use_snp_selection': True, 'num_snps': 55285}. Best is trial 15 with value: 0.3135668235684893.
[I 2025-12-08 22:12:17,887] Trial 56 finished with value: 0.009569974543549907 and parameters: {'model_type': 'gcn', 'hidden_dims': '[512, 256]', 'dropout': 0.5662050402352716, 'batch_norm': False, 'lr': 0.004365654327932949, 'weight_decay': 1.392051237904261e-07, 'epochs': 85, 'loss': 'mae', 'optimizer': 'adam', 'graph_mode': 'cutoff', 'cutoff': 0.8583470401444756, 'grm_norm': 'cosine_then_gcn', 'self_loops': False, 'use_snp_selection': True, 'num_snps': 55609}. Best is trial 15 with value: 0.3135668235684893.
