[I 2025-12-08 21:12:23,246] Trial 84 finished with value: 0.3675260296271506 and parameters: {'model_type': 'gcn', 'hidden_dims': '[128, 64]', 'dropout': 0.48765856099561605, 'batch_norm': False, 'lr': 8.296268254496205e-05, 'weight_decay': 2.827940635250781e-07, 'epochs': 199, 'loss': 'mse', 'optimizer': 'adam', 'graph_mode': 'knn', 'knn_k': 9, 'weighted_edges': True, 'symmetrize_mode': 'union', 'self_loops': False, 'use_snp_selection': True, 'num_snps': 22951}. Best is trial 73 with value: 0.3738911700451141.
[I 2025-12-08 21:12:47,310] Trial 85 finished with value: 0.36311502907865834 and parameters: {'model_type': 'gcn', 'hidden_dims': '[128, 64]', 'dropout': 0.46873110161401377, 'batch_norm': False, 'lr': 0.00027571178579717683, 'weight_decay': 1.0114000052675686e-07, 'epochs': 256, 'loss': 'mse', 'optimizer': 'adam', 'graph_mode': 'knn', 'knn_k': 8, 'weighted_edges': True, 'symmetrize_mode': 'union', 'self_loops': False, 'use_snp_selection': True, 'num_snps': 33866}. Best is trial 73 with value: 0.3738911700451141.
[I 2025-12-08 21:13:32,315] Trial 86 finished with value: 0.3660419205832954 and parameters: {'model_type': 'gcn', 'hidden_dims': '[512, 64]', 'dropout': 0.5426019525268769, 'batch_norm': False, 'lr': 2.3510357990784786e-05, 'weight_decay': 1.3783573537493033e-07, 'epochs': 209, 'loss': 'mse', 'optimizer': 'adam', 'graph_mode': 'knn', 'knn_k': 7, 'weighted_edges': True, 'symmetrize_mode': 'union', 'self_loops': False, 'use_snp_selection': True, 'num_snps': 37533}. Best is trial 73 with value: 0.3738911700451141.
[I 2025-12-08 21:13:54,162] Trial 87 finished with value: 0.367965204459877 and parameters: {'model_type': 'gcn', 'hidden_dims': '[128, 64]', 'dropout': 0.5834931227012204, 'batch_norm': False, 'lr': 6.209773276016885e-05, 'weight_decay': 1.7387341762351738e-07, 'epochs': 245, 'loss': 'mse', 'optimizer': 'adam', 'graph_mode': 'knn', 'knn_k': 9, 'weighted_edges': True, 'symmetrize_mode': 'union', 'self_loops': False, 'use_snp_selection': True, 'num_snps': 28616}. Best is trial 73 with value: 0.3738911700451141.
[I 2025-12-08 21:14:15,553] Trial 88 finished with value: 0.3535920561056686 and parameters: {'model_type': 'gcn', 'hidden_dims': '[128, 64]', 'dropout': 0.5276669506884101, 'batch_norm': False, 'lr': 9.295099046906962e-05, 'weight_decay': 7.224567052887123e-07, 'epochs': 266, 'loss': 'mse', 'optimizer': 'adam', 'graph_mode': 'knn', 'knn_k': 6, 'weighted_edges': True, 'symmetrize_mode': 'union', 'self_loops': True, 'use_snp_selection': True, 'num_snps': 26404}. Best is trial 73 with value: 0.3738911700451141.
[I 2025-12-08 21:14:40,281] Trial 89 finished with value: 0.35932043491244575 and parameters: {'model_type': 'gcn', 'hidden_dims': '[256, 128, 64]', 'dropout': 0.502987297136088, 'batch_norm': False, 'lr': 3.266902921579979e-05, 'weight_decay': 2.269885584166872e-07, 'epochs': 233, 'loss': 'mse', 'optimizer': 'adam', 'graph_mode': 'knn', 'knn_k': 10, 'weighted_edges': True, 'symmetrize_mode': 'union', 'self_loops': False, 'use_snp_selection': True, 'num_snps': 20882}. Best is trial 73 with value: 0.3738911700451141.
[I 2025-12-08 21:15:16,500] Trial 90 finished with value: 0.3676582941032952 and parameters: {'model_type': 'gcn', 'hidden_dims': '[256, 128]', 'dropout': 0.38557982510311317, 'batch_norm': False, 'lr': 4.229462260431446e-05, 'weight_decay': 4.364465839858393e-07, 'epochs': 280, 'loss': 'mse', 'optimizer': 'adam', 'graph_mode': 'knn', 'knn_k': 7, 'weighted_edges': True, 'symmetrize_mode': 'union', 'self_loops': False, 'use_snp_selection': True, 'num_snps': 36508}. Best is trial 73 with value: 0.3738911700451141.
[I 2025-12-08 21:15:43,626] Trial 91 finished with value: 0.36724589671067115 and parameters: {'model_type': 'gcn', 'hidden_dims': '[256, 128]', 'dropout': 0.5190748412551032, 'batch_norm': False, 'lr': 4.2102415359839985e-05, 'weight_decay': 3.394351103021117e-07, 'epochs': 192, 'loss': 'mse', 'optimizer': 'adam', 'graph_mode': 'knn', 'knn_k': 10, 'weighted_edges': True, 'symmetrize_mode': 'union', 'self_loops': False, 'use_snp_selection': True, 'num_snps': 31584}. Best is trial 73 with value: 0.3738911700451141.
[I 2025-12-08 21:16:10,574] Trial 92 finished with value: 0.36883986147674036 and parameters: {'model_type': 'gcn', 'hidden_dims': '[256, 128]', 'dropout': 0.5362883632806372, 'batch_norm': False, 'lr': 7.265537748459679e-05, 'weight_decay': 1.1580495685125585e-06, 'epochs': 167, 'loss': 'mse', 'optimizer': 'adam', 'graph_mode': 'knn', 'knn_k': 10, 'weighted_edges': True, 'symmetrize_mode': 'union', 'self_loops': False, 'use_snp_selection': True, 'num_snps': 35665}. Best is trial 73 with value: 0.3738911700451141.
[I 2025-12-08 21:16:36,685] Trial 93 finished with value: 0.3675189493514236 and parameters: {'model_type': 'gcn', 'hidden_dims': '[256, 128]', 'dropout': 0.4785164135127453, 'batch_norm': False, 'lr': 0.00010734488145848482, 'weight_decay': 1.2234110129710122e-07, 'epochs': 172, 'loss': 'mse', 'optimizer': 'adam', 'graph_mode': 'knn', 'knn_k': 8, 'weighted_edges': True, 'symmetrize_mode': 'union', 'self_loops': False, 'use_snp_selection': True, 'num_snps': 33376}. Best is trial 73 with value: 0.3738911700451141.
[I 2025-12-08 21:16:58,783] Trial 94 finished with value: 0.19927491512957213 and parameters: {'model_type': 'gcn', 'hidden_dims': '[128, 64]', 'dropout': 0.5382817661715998, 'batch_norm': False, 'lr': 0.00013933440539939002, 'weight_decay': 1.294389186921734e-06, 'epochs': 160, 'loss': 'mse', 'optimizer': 'adam', 'graph_mode': 'knn', 'knn_k': 9, 'weighted_edges': True, 'symmetrize_mode': 'union', 'self_loops': False, 'use_snp_selection': True, 'num_snps': 40008}. Best is trial 73 with value: 0.3738911700451141.
[I 2025-12-08 21:17:37,405] Trial 95 finished with value: 0.36760991134996707 and parameters: {'model_type': 'gcn', 'hidden_dims': '[256, 128]', 'dropout': 0.559793181298231, 'batch_norm': False, 'lr': 7.526866797640292e-05, 'weight_decay': 2.154366870318183e-06, 'epochs': 258, 'loss': 'mse', 'optimizer': 'adam', 'graph_mode': 'knn', 'knn_k': 9, 'weighted_edges': True, 'symmetrize_mode': 'union', 'self_loops': False, 'use_snp_selection': True, 'num_snps': 43226}. Best is trial 73 with value: 0.3738911700451141.
[I 2025-12-08 21:17:55,675] Trial 96 finished with value: 0.17798611766482533 and parameters: {'model_type': 'gcn', 'hidden_dims': '[128, 64]', 'dropout': 0.5798939503428301, 'batch_norm': False, 'lr': 0.0001710150596003182, 'weight_decay': 1.49622431478198e-07, 'epochs': 238, 'loss': 'mse', 'optimizer': 'adam', 'graph_mode': 'knn', 'knn_k': 10, 'weighted_edges': True, 'symmetrize_mode': 'mutual', 'self_loops': False, 'use_snp_selection': False}. Best is trial 73 with value: 0.3738911700451141.
[I 2025-12-08 21:18:14,774] Trial 97 finished with value: 0.3657230158146429 and parameters: {'model_type': 'gcn', 'hidden_dims': '[128, 64]', 'dropout': 0.50157487458459, 'batch_norm': False, 'lr': 5.5836837571634227e-05, 'weight_decay': 2.971756237115114e-07, 'epochs': 220, 'loss': 'mse', 'optimizer': 'adam', 'graph_mode': 'knn', 'knn_k': 8, 'weighted_edges': True, 'symmetrize_mode': 'union', 'self_loops': False, 'use_snp_selection': True, 'num_snps': 24040}. Best is trial 73 with value: 0.3738911700451141.
[I 2025-12-08 21:18:54,339] Trial 98 finished with value: 0.30766195124206414 and parameters: {'model_type': 'gcn', 'hidden_dims': '[512, 128]', 'dropout': 0.5481566198046208, 'batch_norm': True, 'lr': 9.815443998119858e-05, 'weight_decay': 1.8912802359646827e-07, 'epochs': 212, 'loss': 'mse', 'optimizer': 'adam', 'graph_mode': 'knn', 'knn_k': 7, 'weighted_edges': True, 'symmetrize_mode': 'union', 'self_loops': False, 'use_snp_selection': True, 'num_snps': 30615}. Best is trial 73 with value: 0.3738911700451141.
[I 2025-12-08 21:19:11,457] Trial 99 finished with value: 0.35056931103907557 and parameters: {'model_type': 'gcn', 'hidden_dims': '[128, 64]', 'dropout': 0.4867210278010869, 'batch_norm': False, 'lr': 6.570404861740161e-05, 'weight_decay': 1.0358315134159855e-06, 'epochs': 229, 'loss': 'mse', 'optimizer': 'adam', 'graph_mode': 'cutoff', 'cutoff': 0.33212772771924043, 'grm_norm': 'cosine', 'self_loops': False, 'use_snp_selection': True, 'num_snps': 18020}. Best is trial 73 with value: 0.3738911700451141.
[I 2025-12-08 21:19:38,009] Trial 100 finished with value: 0.36489610817706364 and parameters: {'model_type': 'gcn', 'hidden_dims': '[128, 64]', 'dropout': 0.4645146472582875, 'batch_norm': False, 'lr': 2.774460855798086e-05, 'weight_decay': 2.2993840944462827e-07, 'epochs': 291, 'loss': 'mse', 'optimizer': 'adam', 'graph_mode': 'knn', 'knn_k': 5, 'weighted_edges': True, 'symmetrize_mode': 'union', 'self_loops': False, 'use_snp_selection': True, 'num_snps': 35754}. Best is trial 73 with value: 0.3738911700451141.
[I 2025-12-08 21:20:07,845] Trial 101 finished with value: 0.36214026411530287 and parameters: {'model_type': 'gcn', 'hidden_dims': '[256, 128]', 'dropout': 0.530891635235411, 'batch_norm': False, 'lr': 3.777289577197014e-05, 'weight_decay': 4.1423681319963753e-07, 'epochs': 204, 'loss': 'mse', 'optimizer': 'adam', 'graph_mode': 'knn', 'knn_k': 10, 'weighted_edges': True, 'symmetrize_mode': 'union', 'self_loops': False, 'use_snp_selection': True, 'num_snps': 35161}. Best is trial 73 with value: 0.3738911700451141.
[I 2025-12-08 21:20:37,816] Trial 102 finished with value: 0.36899593634546485 and parameters: {'model_type': 'gcn', 'hidden_dims': '[256, 128]', 'dropout': 0.5318973046556071, 'batch_norm': False, 'lr': 4.966144447859214e-05, 'weight_decay': 3.5211968744552724e-07, 'epochs': 198, 'loss': 'mse', 'optimizer': 'adam', 'graph_mode': 'knn', 'knn_k': 10, 'weighted_edges': True, 'symmetrize_mode': 'union', 'self_loops': False, 'use_snp_selection': True, 'num_snps': 36529}. Best is trial 73 with value: 0.3738911700451141.
[I 2025-12-08 21:21:06,535] Trial 103 finished with value: 0.36501343909682893 and parameters: {'model_type': 'gcn', 'hidden_dims': '[256, 128]', 'dropout': 0.5147364684006422, 'batch_norm': False, 'lr': 7.992675435755988e-05, 'weight_decay': 6.899230700064258e-07, 'epochs': 167, 'loss': 'mse', 'optimizer': 'adam', 'graph_mode': 'knn', 'knn_k': 10, 'weighted_edges': True, 'symmetrize_mode': 'union', 'self_loops': False, 'use_snp_selection': True, 'num_snps': 39068}. Best is trial 73 with value: 0.3738911700451141.
[I 2025-12-08 21:21:37,757] Trial 104 finished with value: 0.37144953545723486 and parameters: {'model_type': 'gcn', 'hidden_dims': '[256, 128]', 'dropout': 0.5553054166905508, 'batch_norm': False, 'lr': 0.00012716558683657209, 'weight_decay': 1.221870404416887e-07, 'epochs': 188, 'loss': 'mse', 'optimizer': 'adam', 'graph_mode': 'knn', 'knn_k': 9, 'weighted_edges': True, 'symmetrize_mode': 'union', 'self_loops': False, 'use_snp_selection': True, 'num_snps': 41192}. Best is trial 73 with value: 0.3738911700451141.
[I 2025-12-08 21:22:06,306] Trial 105 finished with value: 0.27659880875053816 and parameters: {'model_type': 'gcn', 'hidden_dims': '[128, 64]', 'dropout': 0.5655395013670854, 'batch_norm': False, 'lr': 0.0001301447920257642, 'weight_decay': 1.2048841854371801e-07, 'epochs': 245, 'loss': 'mse', 'optimizer': 'adam', 'graph_mode': 'knn', 'knn_k': 9, 'weighted_edges': True, 'symmetrize_mode': 'union', 'self_loops': False, 'use_snp_selection': True, 'num_snps': 46006}. Best is trial 73 with value: 0.3738911700451141.
[I 2025-12-08 21:22:51,742] Trial 106 finished with value: 0.3096329920644271 and parameters: {'model_type': 'gcn', 'hidden_dims': '[512, 64]', 'dropout': 0.5992186662933375, 'batch_norm': False, 'lr': 4.68474192611781e-05, 'weight_decay': 1.4958299397568682e-07, 'epochs': 188, 'loss': 'mse', 'optimizer': 'adam', 'graph_mode': 'knn', 'knn_k': 8, 'weighted_edges': True, 'symmetrize_mode': 'union', 'self_loops': True, 'use_snp_selection': True, 'num_snps': 41453}. Best is trial 73 with value: 0.3738911700451141.
[I 2025-12-08 21:23:20,886] Trial 107 finished with value: 0.3632386294492539 and parameters: {'model_type': 'gcn', 'hidden_dims': '[256, 128]', 'dropout': 0.5517756199817838, 'batch_norm': False, 'lr': 0.0001977524673924739, 'weight_decay': 1.8458635385241594e-07, 'epochs': 266, 'loss': 'mse', 'optimizer': 'adam', 'graph_mode': 'knn', 'knn_k': 9, 'weighted_edges': True, 'symmetrize_mode': 'union', 'self_loops': False, 'use_snp_selection': True, 'num_snps': 27406}. Best is trial 73 with value: 0.3738911700451141.
[I 2025-12-08 21:23:48,424] Trial 108 finished with value: 0.35346752451719576 and parameters: {'model_type': 'gcn', 'hidden_dims': '[128, 64]', 'dropout': 0.5226453502277811, 'batch_norm': False, 'lr': 0.0001038780300149437, 'weight_decay': 2.772322580814723e-07, 'epochs': 253, 'loss': 'mse', 'optimizer': 'adam', 'graph_mode': 'knn', 'knn_k': 8, 'weighted_edges': True, 'symmetrize_mode': 'union', 'self_loops': False, 'use_snp_selection': True, 'num_snps': 41903}. Best is trial 73 with value: 0.3738911700451141.
[I 2025-12-08 21:24:16,773] Trial 109 finished with value: 0.3664445117605462 and parameters: {'model_type': 'gcn', 'hidden_dims': '[128, 64]', 'dropout': 0.4533696403594683, 'batch_norm': False, 'lr': 0.00012019232677245551, 'weight_decay': 4.869544254427038e-07, 'epochs': 217, 'loss': 'mse', 'optimizer': 'adam', 'graph_mode': 'knn', 'knn_k': 9, 'weighted_edges': True, 'symmetrize_mode': 'union', 'self_loops': False, 'use_snp_selection': True, 'num_snps': 49115}. Best is trial 73 with value: 0.3738911700451141.
[I 2025-12-08 21:24:31,022] Trial 110 finished with value: 0.35783419958561846 and parameters: {'model_type': 'gcn', 'hidden_dims': '[128, 64]', 'dropout': 0.4957137096976459, 'batch_norm': False, 'lr': 5.1904818589996504e-05, 'weight_decay': 1.1101910078931885e-07, 'epochs': 177, 'loss': 'mse', 'optimizer': 'adam', 'graph_mode': 'knn', 'knn_k': 8, 'weighted_edges': True, 'symmetrize_mode': 'union', 'self_loops': False, 'use_snp_selection': False}. Best is trial 73 with value: 0.3738911700451141.
[I 2025-12-08 21:25:00,196] Trial 111 finished with value: 0.3685332218765014 and parameters: {'model_type': 'gcn', 'hidden_dims': '[256, 128]', 'dropout': 0.5409907597234308, 'batch_norm': False, 'lr': 6.703870360281374e-05, 'weight_decay': 2.2157019628277995e-07, 'epochs': 188, 'loss': 'mse', 'optimizer': 'adam', 'graph_mode': 'knn', 'knn_k': 10, 'weighted_edges': True, 'symmetrize_mode': 'union', 'self_loops': False, 'use_snp_selection': True, 'num_snps': 36568}. Best is trial 73 with value: 0.3738911700451141.
[I 2025-12-08 21:25:26,721] Trial 112 finished with value: 0.36563715115644335 and parameters: {'model_type': 'gcn', 'hidden_dims': '[256, 128]', 'dropout': 0.507325865976119, 'batch_norm': False, 'lr': 7.3360631068168e-05, 'weight_decay': 3.5809459215927976e-07, 'epochs': 199, 'loss': 'mse', 'optimizer': 'adam', 'graph_mode': 'knn', 'knn_k': 9, 'weighted_edges': True, 'symmetrize_mode': 'union', 'self_loops': False, 'use_snp_selection': True, 'num_snps': 30062}. Best is trial 73 with value: 0.3738911700451141.
[I 2025-12-08 21:25:55,806] Trial 113 finished with value: 0.3664445083787586 and parameters: {'model_type': 'gcn', 'hidden_dims': '[256, 128]', 'dropout': 0.5344614572463635, 'batch_norm': False, 'lr': 8.171987643266914e-05, 'weight_decay': 1.37237018691085e-07, 'epochs': 175, 'loss': 'mse', 'optimizer': 'adam', 'graph_mode': 'knn', 'knn_k': 10, 'weighted_edges': True, 'symmetrize_mode': 'union', 'self_loops': False, 'use_snp_selection': True, 'num_snps': 38151}. Best is trial 73 with value: 0.3738911700451141.
[I 2025-12-08 21:26:22,939] Trial 114 finished with value: 0.3708770291347161 and parameters: {'model_type': 'gcn', 'hidden_dims': '[256, 128]', 'dropout': 0.5575959239631291, 'batch_norm': False, 'lr': 5.7555991949932324e-05, 'weight_decay': 2.655936404871943e-07, 'epochs': 185, 'loss': 'mse', 'optimizer': 'adam', 'graph_mode': 'knn', 'knn_k': 9, 'weighted_edges': True, 'symmetrize_mode': 'union', 'self_loops': False, 'use_snp_selection': True, 'num_snps': 33014}. Best is trial 73 with value: 0.3738911700451141.
[I 2025-12-08 21:26:54,641] Trial 115 finished with value: 0.34590110293641657 and parameters: {'model_type': 'gcn', 'hidden_dims': '[256, 128, 64]', 'dropout': 0.55692412234909, 'batch_norm': False, 'lr': 5.662492769473007e-05, 'weight_decay': 1.6670851353436103e-07, 'epochs': 238, 'loss': 'mse', 'optimizer': 'adam', 'graph_mode': 'knn', 'knn_k': 9, 'weighted_edges': True, 'symmetrize_mode': 'mutual', 'self_loops': False, 'use_snp_selection': True, 'num_snps': 33724}. Best is trial 73 with value: 0.3738911700451141.
[I 2025-12-08 21:27:12,355] Trial 116 finished with value: 0.3274371244957778 and parameters: {'model_type': 'gcn', 'hidden_dims': '[128, 64]', 'dropout': 0.5745044283353474, 'batch_norm': True, 'lr': 0.0001054732078878489, 'weight_decay': 2.4559948377348365e-07, 'epochs': 185, 'loss': 'mse', 'optimizer': 'adam', 'graph_mode': 'knn', 'knn_k': 8, 'weighted_edges': True, 'symmetrize_mode': 'union', 'self_loops': False, 'use_snp_selection': True, 'num_snps': 22021}. Best is trial 73 with value: 0.3738911700451141.
[I 2025-12-08 21:27:31,712] Trial 117 finished with value: 0.34000104122675434 and parameters: {'model_type': 'gcn', 'hidden_dims': '[256, 128]', 'dropout': 0.5251387952060914, 'batch_norm': False, 'lr': 8.792118460675152e-05, 'weight_decay': 1.0173264081590546e-07, 'epochs': 225, 'loss': 'mse', 'optimizer': 'adam', 'graph_mode': 'cutoff', 'cutoff': 0.47005047243090015, 'grm_norm': 'gcn', 'self_loops': False, 'use_snp_selection': True, 'num_snps': 16229}. Best is trial 73 with value: 0.3738911700451141.
[I 2025-12-08 21:27:52,249] Trial 118 finished with value: 0.36961609441022103 and parameters: {'model_type': 'gcn', 'hidden_dims': '[128, 64]', 'dropout': 0.5150420886385081, 'batch_norm': False, 'lr': 3.692041199516672e-05, 'weight_decay': 1.8188351452420728e-07, 'epochs': 204, 'loss': 'mse', 'optimizer': 'adam', 'graph_mode': 'knn', 'knn_k': 9, 'weighted_edges': True, 'symmetrize_mode': 'union', 'self_loops': False, 'use_snp_selection': True, 'num_snps': 28728}. Best is trial 73 with value: 0.3738911700451141.
[I 2025-12-08 21:28:29,887] Trial 119 finished with value: 0.36661130740558207 and parameters: {'model_type': 'gcn', 'hidden_dims': '[512, 128]', 'dropout': 0.5849480108735072, 'batch_norm': False, 'lr': 3.755615349314849e-05, 'weight_decay': 1.98282451936121e-07, 'epochs': 208, 'loss': 'mse', 'optimizer': 'adam', 'graph_mode': 'knn', 'knn_k': 9, 'weighted_edges': True, 'symmetrize_mode': 'union', 'self_loops': False, 'use_snp_selection': True, 'num_snps': 28628}. Best is trial 73 with value: 0.3738911700451141.
[I 2025-12-08 21:28:48,917] Trial 120 finished with value: 0.37079142453348946 and parameters: {'model_type': 'gcn', 'hidden_dims': '[128, 64]', 'dropout': 0.5120181680481118, 'batch_norm': False, 'lr': 2.748483791603242e-05, 'weight_decay': 2.845834694381454e-07, 'epochs': 201, 'loss': 'mse', 'optimizer': 'adam', 'graph_mode': 'knn', 'knn_k': 5, 'weighted_edges': True, 'symmetrize_mode': 'union', 'self_loops': False, 'use_snp_selection': True, 'num_snps': 25452}. Best is trial 73 with value: 0.3738911700451141.
[I 2025-12-08 21:29:07,965] Trial 121 finished with value: 0.37058236911971687 and parameters: {'model_type': 'gcn', 'hidden_dims': '[128, 64]', 'dropout': 0.5135302109874731, 'batch_norm': False, 'lr': 2.275566192209213e-05, 'weight_decay': 3.000671083770023e-07, 'epochs': 201, 'loss': 'mse', 'optimizer': 'adam', 'graph_mode': 'knn', 'knn_k': 5, 'weighted_edges': True, 'symmetrize_mode': 'union', 'self_loops': False, 'use_snp_selection': True, 'num_snps': 25629}. Best is trial 73 with value: 0.3738911700451141.
[I 2025-12-08 21:29:26,826] Trial 122 finished with value: 0.36546345758108917 and parameters: {'model_type': 'gcn', 'hidden_dims': '[128, 64]', 'dropout': 0.5117961936617366, 'batch_norm': False, 'lr': 2.1643251166995828e-05, 'weight_decay': 2.957469021315469e-07, 'epochs': 192, 'loss': 'mse', 'optimizer': 'adam', 'graph_mode': 'knn', 'knn_k': 5, 'weighted_edges': True, 'symmetrize_mode': 'union', 'self_loops': False, 'use_snp_selection': True, 'num_snps': 26011}. Best is trial 73 with value: 0.3738911700451141.
[I 2025-12-08 21:29:45,592] Trial 123 finished with value: 0.3708052258178217 and parameters: {'model_type': 'gcn', 'hidden_dims': '[128, 64]', 'dropout': 0.4818449871220245, 'batch_norm': False, 'lr': 2.6844817384838605e-05, 'weight_decay': 1.645378349366451e-07, 'epochs': 201, 'loss': 'mse', 'optimizer': 'adam', 'graph_mode': 'knn', 'knn_k': 5, 'weighted_edges': True, 'symmetrize_mode': 'union', 'self_loops': False, 'use_snp_selection': True, 'num_snps': 24674}. Best is trial 73 with value: 0.3738911700451141.
[I 2025-12-08 21:30:04,499] Trial 124 finished with value: 0.3755487195179888 and parameters: {'model_type': 'gcn', 'hidden_dims': '[128, 64]', 'dropout': 0.48176693963239586, 'batch_norm': False, 'lr': 1.782079491020563e-05, 'weight_decay': 1.6510875602752837e-07, 'epochs': 203, 'loss': 'mse', 'optimizer': 'adam', 'graph_mode': 'knn', 'knn_k': 5, 'weighted_edges': True, 'symmetrize_mode': 'union', 'self_loops': False, 'use_snp_selection': True, 'num_snps': 24972}. Best is trial 124 with value: 0.3755487195179888.
[I 2025-12-08 21:30:23,407] Trial 125 finished with value: 0.36982986423730513 and parameters: {'model_type': 'gcn', 'hidden_dims': '[128, 64]', 'dropout': 0.4813061847602971, 'batch_norm': False, 'lr': 1.561386142908057e-05, 'weight_decay': 5.090103343014439e-07, 'epochs': 203, 'loss': 'mse', 'optimizer': 'adam', 'graph_mode': 'knn', 'knn_k': 5, 'weighted_edges': True, 'symmetrize_mode': 'union', 'self_loops': False, 'use_snp_selection': True, 'num_snps': 24960}. Best is trial 124 with value: 0.3755487195179888.
