[I 2025-12-08 17:07:27,306] Trial 132 finished with value: 0.35776036109779996 and parameters: {'model_type': 'gcn', 'hidden_dims': '[128, 64]', 'dropout': 0.5202608296445674, 'batch_norm': False, 'lr': 6.454478017838626e-05, 'weight_decay': 7.7309327423247e-05, 'epochs': 223, 'loss': 'mse', 'optimizer': 'adam', 'graph_mode': 'knn', 'knn_k': 9, 'weighted_edges': True, 'symmetrize_mode': 'union', 'self_loops': False, 'use_snp_selection': False}. Best is trial 119 with value: 0.37614484737654263.
[I 2025-12-08 17:07:47,687] Trial 133 finished with value: 0.3711178339692543 and parameters: {'model_type': 'gcn', 'hidden_dims': '[128, 64]', 'dropout': 0.4773904426106102, 'batch_norm': False, 'lr': 4.855967026290207e-05, 'weight_decay': 0.0009345681131793947, 'epochs': 247, 'loss': 'mse', 'optimizer': 'adam', 'graph_mode': 'knn', 'knn_k': 8, 'weighted_edges': True, 'symmetrize_mode': 'union', 'self_loops': False, 'use_snp_selection': True, 'num_snps': 25751}. Best is trial 119 with value: 0.37614484737654263.
[I 2025-12-08 17:08:08,291] Trial 134 finished with value: 0.3687593252162379 and parameters: {'model_type': 'gcn', 'hidden_dims': '[128, 64]', 'dropout': 0.4743863000967831, 'batch_norm': False, 'lr': 4.779273458681692e-05, 'weight_decay': 0.0006453318054852081, 'epochs': 249, 'loss': 'mse', 'optimizer': 'adam', 'graph_mode': 'knn', 'knn_k': 8, 'weighted_edges': True, 'symmetrize_mode': 'union', 'self_loops': False, 'use_snp_selection': True, 'num_snps': 26301}. Best is trial 119 with value: 0.37614484737654263.
[I 2025-12-08 17:08:28,358] Trial 135 finished with value: 0.37030302205964083 and parameters: {'model_type': 'gcn', 'hidden_dims': '[128, 64]', 'dropout': 0.48355152013501923, 'batch_norm': False, 'lr': 3.8994262492273604e-05, 'weight_decay': 0.0009232645984585995, 'epochs': 242, 'loss': 'mse', 'optimizer': 'adam', 'graph_mode': 'knn', 'knn_k': 10, 'weighted_edges': True, 'symmetrize_mode': 'union', 'self_loops': False, 'use_snp_selection': True, 'num_snps': 24708}. Best is trial 119 with value: 0.37614484737654263.
[I 2025-12-08 17:09:00,235] Trial 136 finished with value: 0.3577352360582915 and parameters: {'model_type': 'gcn', 'hidden_dims': '[256, 128, 64]', 'dropout': 0.4988119324529474, 'batch_norm': False, 'lr': 2.6394684462707353e-05, 'weight_decay': 0.0007910061219126339, 'epochs': 263, 'loss': 'mse', 'optimizer': 'adam', 'graph_mode': 'knn', 'knn_k': 10, 'weighted_edges': True, 'symmetrize_mode': 'union', 'self_loops': False, 'use_snp_selection': True, 'num_snps': 30280}. Best is trial 119 with value: 0.37614484737654263.
[I 2025-12-08 17:09:17,860] Trial 137 finished with value: 0.36221862662946813 and parameters: {'model_type': 'gcn', 'hidden_dims': '[128, 64]', 'dropout': 0.4602958924649485, 'batch_norm': False, 'lr': 3.343674573716125e-05, 'weight_decay': 0.0005237566982334199, 'epochs': 229, 'loss': 'mse', 'optimizer': 'adam', 'graph_mode': 'knn', 'knn_k': 10, 'weighted_edges': True, 'symmetrize_mode': 'mutual', 'self_loops': False, 'use_snp_selection': False}. Best is trial 119 with value: 0.37614484737654263.
[I 2025-12-08 17:09:38,200] Trial 138 finished with value: 0.3722433530493305 and parameters: {'model_type': 'gcn', 'hidden_dims': '[128, 64]', 'dropout': 0.48700331065906716, 'batch_norm': False, 'lr': 5.457906146544565e-05, 'weight_decay': 0.00039193646601617477, 'epochs': 217, 'loss': 'mse', 'optimizer': 'adam', 'graph_mode': 'knn', 'knn_k': 9, 'weighted_edges': True, 'symmetrize_mode': 'union', 'self_loops': False, 'use_snp_selection': True, 'num_snps': 26822}. Best is trial 119 with value: 0.37614484737654263.
[I 2025-12-08 17:09:59,465] Trial 139 finished with value: 0.37336341092669534 and parameters: {'model_type': 'gcn', 'hidden_dims': '[128, 64]', 'dropout': 0.5519306699268132, 'batch_norm': False, 'lr': 5.519768490209315e-05, 'weight_decay': 0.0003809522391414693, 'epochs': 218, 'loss': 'mse', 'optimizer': 'adam', 'graph_mode': 'knn', 'knn_k': 8, 'weighted_edges': True, 'symmetrize_mode': 'union', 'self_loops': False, 'use_snp_selection': True, 'num_snps': 28841}. Best is trial 119 with value: 0.37614484737654263.
[I 2025-12-08 17:10:18,309] Trial 140 finished with value: 0.364850598708041 and parameters: {'model_type': 'gcn', 'hidden_dims': '[128, 64]', 'dropout': 0.5966230992214094, 'batch_norm': False, 'lr': 5.587338478965426e-05, 'weight_decay': 0.0004257445654272404, 'epochs': 216, 'loss': 'mse', 'optimizer': 'adam', 'graph_mode': 'knn', 'knn_k': 9, 'weighted_edges': True, 'symmetrize_mode': 'union', 'self_loops': False, 'use_snp_selection': True, 'num_snps': 22129}. Best is trial 119 with value: 0.37614484737654263.
[I 2025-12-08 17:10:38,170] Trial 141 finished with value: 0.3732156820309135 and parameters: {'model_type': 'gcn', 'hidden_dims': '[128, 64]', 'dropout': 0.5502466306148557, 'batch_norm': False, 'lr': 4.81722959339958e-05, 'weight_decay': 0.0003902691766154208, 'epochs': 209, 'loss': 'mse', 'optimizer': 'adam', 'graph_mode': 'knn', 'knn_k': 8, 'weighted_edges': True, 'symmetrize_mode': 'union', 'self_loops': False, 'use_snp_selection': True, 'num_snps': 26404}. Best is trial 119 with value: 0.37614484737654263.
[I 2025-12-08 17:10:58,066] Trial 142 finished with value: 0.37181473149751443 and parameters: {'model_type': 'gcn', 'hidden_dims': '[128, 64]', 'dropout': 0.5607633207316842, 'batch_norm': False, 'lr': 3.919525366571636e-05, 'weight_decay': 0.0002863056935092602, 'epochs': 206, 'loss': 'mse', 'optimizer': 'adam', 'graph_mode': 'knn', 'knn_k': 8, 'weighted_edges': True, 'symmetrize_mode': 'union', 'self_loops': False, 'use_snp_selection': True, 'num_snps': 26921}. Best is trial 119 with value: 0.37614484737654263.
[I 2025-12-08 17:11:15,486] Trial 143 finished with value: 0.3726849983023978 and parameters: {'model_type': 'gcn', 'hidden_dims': '[128, 64]', 'dropout': 0.5718758410406923, 'batch_norm': False, 'lr': 3.957624946030704e-05, 'weight_decay': 0.0003877908897643764, 'epochs': 203, 'loss': 'mse', 'optimizer': 'adam', 'graph_mode': 'knn', 'knn_k': 8, 'weighted_edges': True, 'symmetrize_mode': 'union', 'self_loops': False, 'use_snp_selection': True, 'num_snps': 20010}. Best is trial 119 with value: 0.37614484737654263.
[I 2025-12-08 17:11:33,639] Trial 144 finished with value: 0.37372999897775977 and parameters: {'model_type': 'gcn', 'hidden_dims': '[128, 64]', 'dropout': 0.5705421639544531, 'batch_norm': False, 'lr': 3.9642550540180594e-05, 'weight_decay': 0.00035044301635086893, 'epochs': 182, 'loss': 'mse', 'optimizer': 'adam', 'graph_mode': 'knn', 'knn_k': 8, 'weighted_edges': True, 'symmetrize_mode': 'union', 'self_loops': False, 'use_snp_selection': True, 'num_snps': 24023}. Best is trial 119 with value: 0.37614484737654263.
[I 2025-12-08 17:11:53,779] Trial 145 finished with value: 0.37660669034446326 and parameters: {'model_type': 'gcn', 'hidden_dims': '[256, 128]', 'dropout': 0.5811745175018128, 'batch_norm': False, 'lr': 3.332627515981768e-05, 'weight_decay': 0.00037361085590792003, 'epochs': 175, 'loss': 'mse', 'optimizer': 'adam', 'graph_mode': 'knn', 'knn_k': 8, 'weighted_edges': True, 'symmetrize_mode': 'union', 'self_loops': False, 'use_snp_selection': True, 'num_snps': 20218}. Best is trial 145 with value: 0.37660669034446326.
[I 2025-12-08 17:12:12,022] Trial 146 finished with value: 0.3716767510630331 and parameters: {'model_type': 'gcn', 'hidden_dims': '[256, 128]', 'dropout': 0.5776683043368279, 'batch_norm': False, 'lr': 4.3834062424029054e-05, 'weight_decay': 0.00037471039528523753, 'epochs': 179, 'loss': 'mse', 'optimizer': 'adam', 'graph_mode': 'knn', 'knn_k': 7, 'weighted_edges': True, 'symmetrize_mode': 'union', 'self_loops': False, 'use_snp_selection': True, 'num_snps': 15825}. Best is trial 145 with value: 0.37660669034446326.
[I 2025-12-08 17:12:32,337] Trial 147 finished with value: 0.35552963813058874 and parameters: {'model_type': 'gcn', 'hidden_dims': '[256, 128]', 'dropout': 0.5892516938876716, 'batch_norm': True, 'lr': 2.4997613442103905e-05, 'weight_decay': 0.0003864590797643927, 'epochs': 181, 'loss': 'mse', 'optimizer': 'adam', 'graph_mode': 'knn', 'knn_k': 7, 'weighted_edges': True, 'symmetrize_mode': 'union', 'self_loops': False, 'use_snp_selection': True, 'num_snps': 19329}. Best is trial 145 with value: 0.37660669034446326.
[I 2025-12-08 17:12:52,653] Trial 148 finished with value: 0.37303880995064065 and parameters: {'model_type': 'gcn', 'hidden_dims': '[256, 128]', 'dropout': 0.5897151205092886, 'batch_norm': False, 'lr': 3.567702128945512e-05, 'weight_decay': 0.0003165171736640625, 'epochs': 168, 'loss': 'mse', 'optimizer': 'adam', 'graph_mode': 'knn', 'knn_k': 8, 'weighted_edges': True, 'symmetrize_mode': 'union', 'self_loops': False, 'use_snp_selection': True, 'num_snps': 20837}. Best is trial 145 with value: 0.37660669034446326.
[I 2025-12-08 17:13:11,404] Trial 149 finished with value: 0.3647289922709924 and parameters: {'model_type': 'gcn', 'hidden_dims': '[256, 128]', 'dropout': 0.5705399627663744, 'batch_norm': False, 'lr': 3.544608309943713e-05, 'weight_decay': 0.00031886232129742286, 'epochs': 165, 'loss': 'mse', 'optimizer': 'adam', 'graph_mode': 'cutoff', 'cutoff': 0.3277042834688746, 'grm_norm': 'none', 'self_loops': False, 'use_snp_selection': True, 'num_snps': 19406}. Best is trial 145 with value: 0.37660669034446326.
[I 2025-12-08 17:13:41,085] Trial 0 finished with value: 0.2994125735124434 and parameters: {'model_type': 'gcn', 'hidden_dims': '[128, 64]', 'dropout': 0.199031432379812, 'batch_norm': True, 'lr': 1.8408544111075823e-05, 'weight_decay': 5.5136510071208614e-05, 'epochs': 336, 'loss': 'mae', 'optimizer': 'adam', 'graph_mode': 'knn', 'knn_k': 8, 'weighted_edges': True, 'symmetrize_mode': 'mutual', 'self_loops': True, 'use_snp_selection': True, 'num_snps': 27173}. Best is trial 0 with value: 0.2994125735124434.
[I 2025-12-08 17:14:19,392] Trial 1 finished with value: 0.23377180532421718 and parameters: {'model_type': 'gcn', 'hidden_dims': '[256, 128, 64]', 'dropout': 0.5543244404043342, 'batch_norm': True, 'lr': 7.981787657617978e-05, 'weight_decay': 2.8571789869344834e-07, 'epochs': 297, 'loss': 'mae', 'optimizer': 'adam', 'graph_mode': 'cutoff', 'cutoff': 0.3392632777751686, 'grm_norm': 'gcn', 'self_loops': False, 'use_snp_selection': False}. Best is trial 0 with value: 0.2994125735124434.
[I 2025-12-08 17:15:17,240] Trial 2 finished with value: 0.26859450787331474 and parameters: {'model_type': 'gcn', 'hidden_dims': '[512, 64]', 'dropout': 0.32815227354739207, 'batch_norm': True, 'lr': 0.000619605044204259, 'weight_decay': 0.0004086269831625786, 'epochs': 206, 'loss': 'mse', 'optimizer': 'adam', 'graph_mode': 'knn', 'knn_k': 4, 'weighted_edges': True, 'symmetrize_mode': 'union', 'self_loops': True, 'use_snp_selection': True, 'num_snps': 53035}. Best is trial 0 with value: 0.2994125735124434.
[I 2025-12-08 17:15:44,804] Trial 3 finished with value: 0.26609376167423826 and parameters: {'model_type': 'gcn', 'hidden_dims': '[256, 128]', 'dropout': 0.23110783056597514, 'batch_norm': True, 'lr': 8.11311593386298e-05, 'weight_decay': 9.296158109581328e-07, 'epochs': 213, 'loss': 'mse', 'optimizer': 'adam', 'graph_mode': 'knn', 'knn_k': 10, 'weighted_edges': True, 'symmetrize_mode': 'mutual', 'self_loops': True, 'use_snp_selection': False}. Best is trial 0 with value: 0.2994125735124434.
[I 2025-12-08 17:15:59,332] Trial 4 finished with value: 0.34939864466128157 and parameters: {'model_type': 'gcn', 'hidden_dims': '[512, 256]', 'dropout': 0.2753281956415665, 'batch_norm': True, 'lr': 0.00034435188114839693, 'weight_decay': 4.9416012835950194e-05, 'epochs': 89, 'loss': 'mae', 'optimizer': 'adam', 'graph_mode': 'cutoff', 'cutoff': 0.820078967317394, 'grm_norm': 'none', 'self_loops': False, 'use_snp_selection': True, 'num_snps': 12674}. Best is trial 4 with value: 0.34939864466128157.
[I 2025-12-08 17:16:24,383] Trial 5 finished with value: 0.3394357860831689 and parameters: {'model_type': 'gcn', 'hidden_dims': '[128, 64]', 'dropout': 0.5611163934517731, 'batch_norm': True, 'lr': 0.0003984856210762587, 'weight_decay': 1.1466743517565185e-07, 'epochs': 344, 'loss': 'mae', 'optimizer': 'adam', 'graph_mode': 'cutoff', 'cutoff': 0.6089370799714728, 'grm_norm': 'gcn', 'self_loops': True, 'use_snp_selection': False}. Best is trial 4 with value: 0.34939864466128157.
[I 2025-12-08 17:16:46,707] Trial 6 finished with value: 0.32162764903452123 and parameters: {'model_type': 'gcn', 'hidden_dims': '[128, 64]', 'dropout': 0.31805912766941713, 'batch_norm': True, 'lr': 1.2361026034262557e-05, 'weight_decay': 6.492620232791903e-06, 'epochs': 271, 'loss': 'mse', 'optimizer': 'adam', 'graph_mode': 'cutoff', 'cutoff': 0.6193362582230448, 'grm_norm': 'cosine', 'self_loops': False, 'use_snp_selection': True, 'num_snps': 28594}. Best is trial 4 with value: 0.34939864466128157.
[I 2025-12-08 17:17:06,427] Trial 7 finished with value: 0.2642167879913618 and parameters: {'model_type': 'gcn', 'hidden_dims': '[512, 64]', 'dropout': 0.471337288649717, 'batch_norm': True, 'lr': 2.239693207292708e-05, 'weight_decay': 2.263166635514082e-06, 'epochs': 69, 'loss': 'mse', 'optimizer': 'adam', 'graph_mode': 'cutoff', 'cutoff': 0.4056820886426376, 'grm_norm': 'cosine', 'self_loops': False, 'use_snp_selection': False}. Best is trial 4 with value: 0.34939864466128157.
[I 2025-12-08 17:17:43,825] Trial 8 finished with value: 0.3467212288196144 and parameters: {'model_type': 'gcn', 'hidden_dims': '[512, 256]', 'dropout': 0.20659328268932406, 'batch_norm': False, 'lr': 8.93315124361372e-05, 'weight_decay': 0.00028987480727919035, 'epochs': 136, 'loss': 'mae', 'optimizer': 'adam', 'graph_mode': 'knn', 'knn_k': 3, 'weighted_edges': False, 'symmetrize_mode': 'union', 'self_loops': False, 'use_snp_selection': True, 'num_snps': 43128}. Best is trial 4 with value: 0.34939864466128157.
[I 2025-12-08 17:18:25,991] Trial 9 finished with value: 0.007364581185681765 and parameters: {'model_type': 'gcn', 'hidden_dims': '[512, 256]', 'dropout': 0.2888209592870401, 'batch_norm': False, 'lr': 0.004734648143129892, 'weight_decay': 1.5879705591356368e-06, 'epochs': 163, 'loss': 'mse', 'optimizer': 'adam', 'graph_mode': 'cutoff', 'cutoff': 0.5984899797909019, 'grm_norm': 'cosine', 'self_loops': True, 'use_snp_selection': False}. Best is trial 4 with value: 0.34939864466128157.
[I 2025-12-08 17:18:35,009] Trial 10 finished with value: 0.3163290854008839 and parameters: {'model_type': 'gcn', 'hidden_dims': '[512, 128]', 'dropout': 0.11372025982957354, 'batch_norm': False, 'lr': 0.0023343012062770553, 'weight_decay': 4.14440562940608e-05, 'epochs': 41, 'loss': 'mae', 'optimizer': 'adam', 'graph_mode': 'cutoff', 'cutoff': 0.8740100033033124, 'grm_norm': 'none', 'self_loops': False, 'use_snp_selection': True, 'num_snps': 3859}. Best is trial 4 with value: 0.34939864466128157.
[I 2025-12-08 17:19:11,012] Trial 11 finished with value: 0.3390796546113189 and parameters: {'model_type': 'gcn', 'hidden_dims': '[512, 256]', 'dropout': 0.42220860806405436, 'batch_norm': False, 'lr': 0.00012587284186352953, 'weight_decay': 0.0006590033092812647, 'epochs': 114, 'loss': 'mae', 'optimizer': 'adam', 'graph_mode': 'knn', 'knn_k': 1, 'weighted_edges': False, 'symmetrize_mode': 'union', 'self_loops': False, 'use_snp_selection': True, 'num_snps': 47068}. Best is trial 4 with value: 0.34939864466128157.
[I 2025-12-08 17:19:25,541] Trial 12 finished with value: 0.34891713380170775 and parameters: {'model_type': 'gcn', 'hidden_dims': '[512, 256]', 'dropout': 0.14142767069304862, 'batch_norm': False, 'lr': 0.0011798598123878552, 'weight_decay': 9.414718277089941e-05, 'epochs': 124, 'loss': 'mae', 'optimizer': 'adam', 'graph_mode': 'knn', 'knn_k': 3, 'weighted_edges': False, 'symmetrize_mode': 'union', 'self_loops': False, 'use_snp_selection': True, 'num_snps': 8584}. Best is trial 4 with value: 0.34939864466128157.
[I 2025-12-08 17:19:38,043] Trial 13 finished with value: 0.35199076898604503 and parameters: {'model_type': 'gcn', 'hidden_dims': '[512, 256]', 'dropout': 0.13529665206282515, 'batch_norm': False, 'lr': 0.0013143362382724787, 'weight_decay': 5.2475435102613655e-05, 'epochs': 101, 'loss': 'mae', 'optimizer': 'adam', 'graph_mode': 'knn', 'knn_k': 6, 'weighted_edges': False, 'symmetrize_mode': 'union', 'self_loops': False, 'use_snp_selection': True, 'num_snps': 5870}. Best is trial 13 with value: 0.35199076898604503.
[I 2025-12-08 17:19:53,669] Trial 14 finished with value: 0.2874542676619355 and parameters: {'model_type': 'gcn', 'hidden_dims': '[512, 256]', 'dropout': 0.25632205209505254, 'batch_norm': False, 'lr': 0.00687208991084213, 'weight_decay': 1.8542303090238745e-05, 'epochs': 82, 'loss': 'mae', 'optimizer': 'adam', 'graph_mode': 'cutoff', 'cutoff': 0.8944237199027842, 'grm_norm': 'none', 'self_loops': False, 'use_snp_selection': True, 'num_snps': 15654}. Best is trial 13 with value: 0.35199076898604503.
[I 2025-12-08 17:20:07,558] Trial 15 finished with value: 0.2880977605293776 and parameters: {'model_type': 'gcn', 'hidden_dims': '[256, 128, 64]', 'dropout': 0.40991201822777057, 'batch_norm': False, 'lr': 0.0015315707618607853, 'weight_decay': 8.602279249719694e-06, 'epochs': 88, 'loss': 'mae', 'optimizer': 'adam', 'graph_mode': 'knn', 'knn_k': 7, 'weighted_edges': False, 'symmetrize_mode': 'union', 'self_loops': False, 'use_snp_selection': True, 'num_snps': 14623}. Best is trial 13 with value: 0.35199076898604503.
[I 2025-12-08 17:20:32,724] Trial 16 finished with value: 0.2639910272820478 and parameters: {'model_type': 'gcn', 'hidden_dims': '[512, 128]', 'dropout': 0.1573538820129295, 'batch_norm': True, 'lr': 0.0002351737822521291, 'weight_decay': 0.00013965361036408488, 'epochs': 168, 'loss': 'mae', 'optimizer': 'adam', 'graph_mode': 'knn', 'knn_k': 6, 'weighted_edges': False, 'symmetrize_mode': 'mutual', 'self_loops': False, 'use_snp_selection': True, 'num_snps': 19782}. Best is trial 13 with value: 0.35199076898604503.
[I 2025-12-08 17:20:41,440] Trial 17 finished with value: 0.33987916082594294 and parameters: {'model_type': 'gcn', 'hidden_dims': '[256, 128]', 'dropout': 0.36694829928621503, 'batch_norm': False, 'lr': 0.0008407831391711085, 'weight_decay': 3.2193607048083006e-05, 'epochs': 45, 'loss': 'mae', 'optimizer': 'adam', 'graph_mode': 'cutoff', 'cutoff': 0.7365908344247583, 'grm_norm': 'cosine_then_gcn', 'self_loops': False, 'use_snp_selection': True, 'num_snps': 2778}. Best is trial 13 with value: 0.35199076898604503.
[I 2025-12-08 17:21:08,873] Trial 18 finished with value: 0.32684291738359406 and parameters: {'model_type': 'gcn', 'hidden_dims': '[512, 256]', 'dropout': 0.10093752871871903, 'batch_norm': True, 'lr': 0.00025458792542160157, 'weight_decay': 0.00021038576568746655, 'epochs': 162, 'loss': 'mae', 'optimizer': 'adam', 'graph_mode': 'knn', 'knn_k': 9, 'weighted_edges': False, 'symmetrize_mode': 'union', 'self_loops': False, 'use_snp_selection': True, 'num_snps': 22119}. Best is trial 13 with value: 0.35199076898604503.
[I 2025-12-08 17:21:58,249] Trial 19 finished with value: 0.3150316381791337 and parameters: {'model_type': 'gcn', 'hidden_dims': '[512, 256]', 'dropout': 0.17960265661255337, 'batch_norm': False, 'lr': 0.0029751110466155147, 'weight_decay': 0.0009506528840190462, 'epochs': 236, 'loss': 'mae', 'optimizer': 'adam', 'graph_mode': 'cutoff', 'cutoff': 0.2386548621641688, 'grm_norm': 'none', 'self_loops': False, 'use_snp_selection': True, 'num_snps': 37947}. Best is trial 13 with value: 0.35199076898604503.
[I 2025-12-08 17:22:11,144] Trial 20 finished with value: 0.3571550078439519 and parameters: {'model_type': 'gcn', 'hidden_dims': '[512, 256]', 'dropout': 0.2663159678862425, 'batch_norm': False, 'lr': 0.0005731795743213937, 'weight_decay': 1.3683815410345108e-05, 'epochs': 102, 'loss': 'mae', 'optimizer': 'adam', 'graph_mode': 'cutoff', 'cutoff': 0.7550233606026814, 'grm_norm': 'cosine_then_gcn', 'self_loops': False, 'use_snp_selection': True, 'num_snps': 8231}. Best is trial 20 with value: 0.3571550078439519.
[I 2025-12-08 17:22:24,626] Trial 21 finished with value: 0.3593220778560176 and parameters: {'model_type': 'gcn', 'hidden_dims': '[512, 256]', 'dropout': 0.2462334917012407, 'batch_norm': False, 'lr': 0.0005436100252487031, 'weight_decay': 1.6206393908885257e-05, 'epochs': 96, 'loss': 'mae', 'optimizer': 'adam', 'graph_mode': 'cutoff', 'cutoff': 0.7559354342028177, 'grm_norm': 'cosine_then_gcn', 'self_loops': False, 'use_snp_selection': True, 'num_snps': 9792}. Best is trial 21 with value: 0.3593220778560176.
[I 2025-12-08 17:22:37,823] Trial 22 finished with value: 0.3508417566196472 and parameters: {'model_type': 'gcn', 'hidden_dims': '[512, 256]', 'dropout': 0.2451826058709842, 'batch_norm': False, 'lr': 0.0006202073722672737, 'weight_decay': 1.539286867407512e-05, 'epochs': 107, 'loss': 'mae', 'optimizer': 'adam', 'graph_mode': 'cutoff', 'cutoff': 0.7333304076486623, 'grm_norm': 'cosine_then_gcn', 'self_loops': False, 'use_snp_selection': True, 'num_snps': 8398}. Best is trial 21 with value: 0.3593220778560176.
[I 2025-12-08 17:22:48,525] Trial 23 finished with value: 0.31050979256843947 and parameters: {'model_type': 'gcn', 'hidden_dims': '[512, 256]', 'dropout': 0.3691284194562767, 'batch_norm': False, 'lr': 0.0018135848164344919, 'weight_decay': 3.90666642494886e-06, 'epochs': 141, 'loss': 'mae', 'optimizer': 'adam', 'graph_mode': 'cutoff', 'cutoff': 0.7295794810011167, 'grm_norm': 'cosine_then_gcn', 'self_loops': False, 'use_snp_selection': True, 'num_snps': 2385}. Best is trial 21 with value: 0.3593220778560176.
