[I 2025-12-08 10:37:18,799] Trial 43 finished with value: 0.2564134931343332 and parameters: {'model_type': 'gcn', 'hidden_dims': '[256, 128]', 'dropout': 0.35573816103687006, 'batch_norm': True, 'lr': 1.3478619528186756e-05, 'weight_decay': 1.9224589578313218e-07, 'epochs': 129, 'loss': 'mae', 'optimizer': 'adam', 'graph_mode': 'cutoff', 'cutoff': 0.8462070455761672, 'grm_norm': 'cosine_then_gcn', 'self_loops': False, 'use_snp_selection': True, 'num_snps': 59071}. Best is trial 25 with value: 0.27876768099714916.
[I 2025-12-08 10:37:40,381] Trial 44 finished with value: 0.2749592336338912 and parameters: {'model_type': 'gcn', 'hidden_dims': '[512, 256]', 'dropout': 0.40847866530878796, 'batch_norm': True, 'lr': 8.8931052905204e-05, 'weight_decay': 7.056888085682766e-07, 'epochs': 55, 'loss': 'mae', 'optimizer': 'adam', 'graph_mode': 'cutoff', 'cutoff': 0.7723806107252026, 'grm_norm': 'gcn', 'self_loops': False, 'use_snp_selection': True, 'num_snps': 35958}. Best is trial 25 with value: 0.27876768099714916.
[I 2025-12-08 10:38:09,265] Trial 45 finished with value: 0.24641339213175098 and parameters: {'model_type': 'gcn', 'hidden_dims': '[128, 64]', 'dropout': 0.45030063219233923, 'batch_norm': True, 'lr': 0.00010856419651175422, 'weight_decay': 2.2645598589266195e-06, 'epochs': 210, 'loss': 'mae', 'optimizer': 'adam', 'graph_mode': 'cutoff', 'cutoff': 0.597842575286766, 'grm_norm': 'cosine', 'self_loops': True, 'use_snp_selection': True, 'num_snps': 53469}. Best is trial 25 with value: 0.27876768099714916.
[I 2025-12-08 10:38:36,890] Trial 46 finished with value: 0.27432652794075535 and parameters: {'model_type': 'gcn', 'hidden_dims': '[256, 128]', 'dropout': 0.4660729153958968, 'batch_norm': True, 'lr': 0.0006527514639352918, 'weight_decay': 5.759113074174903e-06, 'epochs': 183, 'loss': 'mae', 'optimizer': 'adam', 'graph_mode': 'cutoff', 'cutoff': 0.7130134436135674, 'grm_norm': 'none', 'self_loops': False, 'use_snp_selection': True, 'num_snps': 36247}. Best is trial 25 with value: 0.27876768099714916.
[I 2025-12-08 10:39:19,908] Trial 47 finished with value: 0.27650315390241065 and parameters: {'model_type': 'gcn', 'hidden_dims': '[512, 64]', 'dropout': 0.5154668731919607, 'batch_norm': True, 'lr': 6.927085445172722e-05, 'weight_decay': 1.2932308844574897e-06, 'epochs': 150, 'loss': 'mae', 'optimizer': 'adam', 'graph_mode': 'cutoff', 'cutoff': 0.8028736857608004, 'grm_norm': 'cosine', 'self_loops': False, 'use_snp_selection': True, 'num_snps': 48095}. Best is trial 25 with value: 0.27876768099714916.
[I 2025-12-08 10:40:00,299] Trial 48 finished with value: 0.26884030187774915 and parameters: {'model_type': 'gcn', 'hidden_dims': '[512, 64]', 'dropout': 0.5174455241179641, 'batch_norm': False, 'lr': 6.067522602465267e-05, 'weight_decay': 1.3140659444767427e-06, 'epochs': 143, 'loss': 'mae', 'optimizer': 'adam', 'graph_mode': 'cutoff', 'cutoff': 0.8854673771360787, 'grm_norm': 'cosine', 'self_loops': True, 'use_snp_selection': True, 'num_snps': 46063}. Best is trial 25 with value: 0.27876768099714916.
[I 2025-12-08 10:40:28,175] Trial 49 finished with value: 0.27337096205471767 and parameters: {'model_type': 'gcn', 'hidden_dims': '[512, 64]', 'dropout': 0.5689408657929111, 'batch_norm': True, 'lr': 0.00036935767530864115, 'weight_decay': 2.9366359677339063e-05, 'epochs': 99, 'loss': 'mse', 'optimizer': 'adam', 'graph_mode': 'cutoff', 'cutoff': 0.806253505172527, 'grm_norm': 'cosine', 'self_loops': False, 'use_snp_selection': True, 'num_snps': 36250}. Best is trial 25 with value: 0.27876768099714916.
[I 2025-12-08 10:41:01,889] Trial 50 finished with value: 0.24135297222034943 and parameters: {'model_type': 'gcn', 'hidden_dims': '[512, 64]', 'dropout': 0.26974992091801375, 'batch_norm': True, 'lr': 2.8294186215356412e-05, 'weight_decay': 1.1463690105415672e-05, 'epochs': 92, 'loss': 'mae', 'optimizer': 'adam', 'graph_mode': 'knn', 'knn_k': 8, 'weighted_edges': False, 'symmetrize_mode': 'mutual', 'self_loops': False, 'use_snp_selection': True, 'num_snps': 48559}. Best is trial 25 with value: 0.27876768099714916.
[I 2025-12-08 10:41:57,637] Trial 51 finished with value: 0.25326332783788447 and parameters: {'model_type': 'gcn', 'hidden_dims': '[512, 128]', 'dropout': 0.13332678957229122, 'batch_norm': True, 'lr': 1.7771449858185964e-05, 'weight_decay': 2.0337375118582065e-06, 'epochs': 170, 'loss': 'mae', 'optimizer': 'adam', 'graph_mode': 'cutoff', 'cutoff': 0.7441573892741016, 'grm_norm': 'cosine', 'self_loops': False, 'use_snp_selection': True, 'num_snps': 59903}. Best is trial 25 with value: 0.27876768099714916.
[I 2025-12-08 10:42:46,563] Trial 52 finished with value: 0.27294700076535006 and parameters: {'model_type': 'gcn', 'hidden_dims': '[512, 64]', 'dropout': 0.4183430755526401, 'batch_norm': True, 'lr': 7.13571051916544e-05, 'weight_decay': 5.971760329143895e-07, 'epochs': 158, 'loss': 'mae', 'optimizer': 'adam', 'graph_mode': 'cutoff', 'cutoff': 0.8629458046771723, 'grm_norm': 'cosine', 'self_loops': False, 'use_snp_selection': True, 'num_snps': 54109}. Best is trial 25 with value: 0.27876768099714916.
[I 2025-12-08 10:43:17,624] Trial 53 finished with value: 0.26968782387998047 and parameters: {'model_type': 'gcn', 'hidden_dims': '[256, 128]', 'dropout': 0.43682199542533207, 'batch_norm': True, 'lr': 0.0001036706776955421, 'weight_decay': 2.6948724067403865e-07, 'epochs': 150, 'loss': 'mae', 'optimizer': 'adam', 'graph_mode': 'cutoff', 'cutoff': 0.7637075287252204, 'grm_norm': 'cosine_then_gcn', 'self_loops': False, 'use_snp_selection': True, 'num_snps': 49281}. Best is trial 25 with value: 0.27876768099714916.
[I 2025-12-08 10:43:50,387] Trial 54 finished with value: 0.27410794457528465 and parameters: {'model_type': 'gcn', 'hidden_dims': '[512, 256]', 'dropout': 0.5013147244187458, 'batch_norm': True, 'lr': 0.00020016741542888138, 'weight_decay': 2.928762355217279e-06, 'epochs': 111, 'loss': 'mae', 'optimizer': 'adam', 'graph_mode': 'cutoff', 'cutoff': 0.6428351574491453, 'grm_norm': 'cosine', 'self_loops': False, 'use_snp_selection': True, 'num_snps': 41498}. Best is trial 25 with value: 0.27876768099714916.
[I 2025-12-08 10:44:23,144] Trial 55 finished with value: 0.2609616020843425 and parameters: {'model_type': 'gcn', 'hidden_dims': '[256, 128]', 'dropout': 0.37186843043847573, 'batch_norm': True, 'lr': 3.565622587383381e-05, 'weight_decay': 1.0796079292193105e-06, 'epochs': 136, 'loss': 'mae', 'optimizer': 'adam', 'graph_mode': 'cutoff', 'cutoff': 0.6947826234723737, 'grm_norm': 'cosine_then_gcn', 'self_loops': False, 'use_snp_selection': True, 'num_snps': 56971}. Best is trial 25 with value: 0.27876768099714916.
[I 2025-12-08 10:44:56,180] Trial 56 finished with value: 0.2799013330479883 and parameters: {'model_type': 'gcn', 'hidden_dims': '[256, 128]', 'dropout': 0.4706323934280969, 'batch_norm': True, 'lr': 5.252337432789314e-05, 'weight_decay': 8.712005971372838e-06, 'epochs': 180, 'loss': 'mae', 'optimizer': 'adam', 'graph_mode': 'cutoff', 'cutoff': 0.8108610203117059, 'grm_norm': 'cosine_then_gcn', 'self_loops': True, 'use_snp_selection': True, 'num_snps': 48015}. Best is trial 56 with value: 0.2799013330479883.
[I 2025-12-08 10:45:25,133] Trial 57 finished with value: 0.24839410422075608 and parameters: {'model_type': 'gcn', 'hidden_dims': '[256, 128, 64]', 'dropout': 0.47102412876547917, 'batch_norm': False, 'lr': 5.256164481402846e-05, 'weight_decay': 7.711281831325143e-06, 'epochs': 226, 'loss': 'mae', 'optimizer': 'adam', 'graph_mode': 'cutoff', 'cutoff': 0.8328891333597163, 'grm_norm': 'none', 'self_loops': True, 'use_snp_selection': False}. Best is trial 56 with value: 0.2799013330479883.
[I 2025-12-08 10:45:50,719] Trial 58 finished with value: 0.23273104972082947 and parameters: {'model_type': 'gcn', 'hidden_dims': '[256, 128]', 'dropout': 0.5230441290705117, 'batch_norm': True, 'lr': 0.001368777083212048, 'weight_decay': 4.576430166267019e-06, 'epochs': 199, 'loss': 'mae', 'optimizer': 'adam', 'graph_mode': 'cutoff', 'cutoff': 0.3384942934327709, 'grm_norm': 'cosine_then_gcn', 'self_loops': True, 'use_snp_selection': False}. Best is trial 56 with value: 0.2799013330479883.
[I 2025-12-08 10:46:03,908] Trial 59 finished with value: 0.265629703347523 and parameters: {'model_type': 'gcn', 'hidden_dims': '[128, 64]', 'dropout': 0.4922595494933301, 'batch_norm': True, 'lr': 0.00012742452185059207, 'weight_decay': 6.29595483982752e-05, 'epochs': 169, 'loss': 'mae', 'optimizer': 'adam', 'graph_mode': 'cutoff', 'cutoff': 0.8957438435447607, 'grm_norm': 'gcn', 'self_loops': True, 'use_snp_selection': False}. Best is trial 56 with value: 0.2799013330479883.
[I 2025-12-08 10:46:38,282] Trial 60 finished with value: 0.2742932958638017 and parameters: {'model_type': 'gcn', 'hidden_dims': '[512, 128]', 'dropout': 0.5445513534244283, 'batch_norm': True, 'lr': 0.0005623662220354081, 'weight_decay': 2.5014537904970258e-06, 'epochs': 127, 'loss': 'mae', 'optimizer': 'adam', 'graph_mode': 'cutoff', 'cutoff': 0.8004206613634269, 'grm_norm': 'cosine_then_gcn', 'self_loops': True, 'use_snp_selection': True, 'num_snps': 40311}. Best is trial 56 with value: 0.2799013330479883.
[I 2025-12-08 10:47:12,771] Trial 61 finished with value: 0.254659864823741 and parameters: {'model_type': 'gcn', 'hidden_dims': '[256, 128]', 'dropout': 0.4504751988048632, 'batch_norm': True, 'lr': 8.304466985268555e-05, 'weight_decay': 2.4416861198074995e-05, 'epochs': 184, 'loss': 'mae', 'optimizer': 'adam', 'graph_mode': 'cutoff', 'cutoff': 0.7380883639264741, 'grm_norm': 'cosine_then_gcn', 'self_loops': True, 'use_snp_selection': True, 'num_snps': 49414}. Best is trial 56 with value: 0.2799013330479883.
[I 2025-12-08 10:47:50,150] Trial 62 finished with value: 0.27136506796606824 and parameters: {'model_type': 'gcn', 'hidden_dims': '[256, 128]', 'dropout': 0.42484680562082155, 'batch_norm': True, 'lr': 0.0007955668529021574, 'weight_decay': 5.449291575469882e-07, 'epochs': 191, 'loss': 'mae', 'optimizer': 'adam', 'graph_mode': 'cutoff', 'cutoff': 0.7546134180744083, 'grm_norm': 'cosine_then_gcn', 'self_loops': False, 'use_snp_selection': True, 'num_snps': 54752}. Best is trial 56 with value: 0.2799013330479883.
[I 2025-12-08 10:48:22,944] Trial 63 finished with value: 0.27156525998868386 and parameters: {'model_type': 'gcn', 'hidden_dims': '[256, 128]', 'dropout': 0.502355358160556, 'batch_norm': True, 'lr': 4.592411903130173e-05, 'weight_decay': 1.4262310817897887e-05, 'epochs': 176, 'loss': 'mae', 'optimizer': 'adam', 'graph_mode': 'cutoff', 'cutoff': 0.8545319890300466, 'grm_norm': 'cosine_then_gcn', 'self_loops': False, 'use_snp_selection': True, 'num_snps': 48122}. Best is trial 56 with value: 0.2799013330479883.
[I 2025-12-08 10:48:57,430] Trial 64 finished with value: 0.2696314095657872 and parameters: {'model_type': 'gcn', 'hidden_dims': '[256, 128]', 'dropout': 0.47176512532543724, 'batch_norm': True, 'lr': 6.197565305219761e-05, 'weight_decay': 2.97610622611001e-07, 'epochs': 161, 'loss': 'mae', 'optimizer': 'adam', 'graph_mode': 'cutoff', 'cutoff': 0.7221786489392361, 'grm_norm': 'cosine_then_gcn', 'self_loops': False, 'use_snp_selection': True, 'num_snps': 55196}. Best is trial 56 with value: 0.2799013330479883.
[I 2025-12-08 10:49:28,001] Trial 65 finished with value: 0.2698278420009248 and parameters: {'model_type': 'gcn', 'hidden_dims': '[256, 128]', 'dropout': 0.5264945846689416, 'batch_norm': True, 'lr': 0.0002489788984681725, 'weight_decay': 1.3094430106290616e-06, 'epochs': 244, 'loss': 'mae', 'optimizer': 'adam', 'graph_mode': 'cutoff', 'cutoff': 0.7852290936390042, 'grm_norm': 'cosine_then_gcn', 'self_loops': False, 'use_snp_selection': False}. Best is trial 56 with value: 0.2799013330479883.
[I 2025-12-08 10:50:07,610] Trial 66 finished with value: 0.269641586536316 and parameters: {'model_type': 'gcn', 'hidden_dims': '[256, 128]', 'dropout': 0.37640230849680706, 'batch_norm': True, 'lr': 0.00033348265491521626, 'weight_decay': 9.368303159816536e-06, 'epochs': 220, 'loss': 'mae', 'optimizer': 'adam', 'graph_mode': 'cutoff', 'cutoff': 0.8140439648703722, 'grm_norm': 'cosine_then_gcn', 'self_loops': True, 'use_snp_selection': True, 'num_snps': 51849}. Best is trial 56 with value: 0.2799013330479883.
[I 2025-12-08 10:51:00,132] Trial 67 finished with value: -0.01974404515836902 and parameters: {'model_type': 'gcn', 'hidden_dims': '[512, 64]', 'dropout': 0.5834614359301891, 'batch_norm': False, 'lr': 0.0017898863188763664, 'weight_decay': 5.960834368245796e-06, 'epochs': 204, 'loss': 'mse', 'optimizer': 'adam', 'graph_mode': 'knn', 'knn_k': 3, 'weighted_edges': True, 'symmetrize_mode': 'mutual', 'self_loops': False, 'use_snp_selection': False}. Best is trial 56 with value: 0.2799013330479883.
[I 2025-12-08 10:51:16,154] Trial 68 finished with value: 0.27771617278446464 and parameters: {'model_type': 'gcn', 'hidden_dims': '[256, 128]', 'dropout': 0.48235368946182017, 'batch_norm': True, 'lr': 0.00016355415618271363, 'weight_decay': 7.894002364399898e-07, 'epochs': 118, 'loss': 'mae', 'optimizer': 'adam', 'graph_mode': 'cutoff', 'cutoff': 0.6740460891813668, 'grm_norm': 'cosine', 'self_loops': False, 'use_snp_selection': False}. Best is trial 56 with value: 0.2799013330479883.
[I 2025-12-08 10:51:45,676] Trial 69 finished with value: 0.26642380259789555 and parameters: {'model_type': 'gcn', 'hidden_dims': '[512, 256]', 'dropout': 0.48289574869219315, 'batch_norm': True, 'lr': 0.0001353767494975695, 'weight_decay': 3.6403930821301195e-06, 'epochs': 109, 'loss': 'mae', 'optimizer': 'adam', 'graph_mode': 'cutoff', 'cutoff': 0.5914119928513373, 'grm_norm': 'cosine', 'self_loops': False, 'use_snp_selection': False}. Best is trial 56 with value: 0.2799013330479883.
[I 2025-12-08 10:52:02,384] Trial 70 finished with value: 0.2723571900195702 and parameters: {'model_type': 'gcn', 'hidden_dims': '[256, 128]', 'dropout': 0.5467223596957203, 'batch_norm': True, 'lr': 0.00111841972624871, 'weight_decay': 1.8797050604780685e-06, 'epochs': 124, 'loss': 'mae', 'optimizer': 'adam', 'graph_mode': 'cutoff', 'cutoff': 0.6810388719544455, 'grm_norm': 'cosine', 'self_loops': False, 'use_snp_selection': False}. Best is trial 56 with value: 0.2799013330479883.
[I 2025-12-08 10:52:22,065] Trial 71 finished with value: 0.26850098131558975 and parameters: {'model_type': 'gcn', 'hidden_dims': '[256, 128]', 'dropout': 0.4460791355714693, 'batch_norm': True, 'lr': 0.0001703156476931199, 'weight_decay': 7.834060733453253e-07, 'epochs': 150, 'loss': 'mae', 'optimizer': 'adam', 'graph_mode': 'cutoff', 'cutoff': 0.7669453783498074, 'grm_norm': 'cosine', 'self_loops': False, 'use_snp_selection': False}. Best is trial 56 with value: 0.2799013330479883.
[I 2025-12-08 10:52:40,356] Trial 72 finished with value: 0.27837374943985804 and parameters: {'model_type': 'gcn', 'hidden_dims': '[256, 128]', 'dropout': 0.5117854378397579, 'batch_norm': True, 'lr': 7.635756260533236e-05, 'weight_decay': 3.645260969814421e-07, 'epochs': 138, 'loss': 'mae', 'optimizer': 'adam', 'graph_mode': 'cutoff', 'cutoff': 0.7370294909356511, 'grm_norm': 'cosine', 'self_loops': False, 'use_snp_selection': False}. Best is trial 56 with value: 0.2799013330479883.
[I 2025-12-08 10:52:58,521] Trial 73 finished with value: 0.2777086394272331 and parameters: {'model_type': 'gcn', 'hidden_dims': '[256, 128]', 'dropout': 0.5139290796572461, 'batch_norm': True, 'lr': 0.0002274087852866212, 'weight_decay': 3.21548822980318e-07, 'epochs': 137, 'loss': 'mae', 'optimizer': 'adam', 'graph_mode': 'cutoff', 'cutoff': 0.6998308733461162, 'grm_norm': 'cosine', 'self_loops': False, 'use_snp_selection': False}. Best is trial 56 with value: 0.2799013330479883.
[I 2025-12-08 10:53:17,508] Trial 74 finished with value: 0.2673483144561656 and parameters: {'model_type': 'gcn', 'hidden_dims': '[256, 128]', 'dropout': 0.5072941372166954, 'batch_norm': True, 'lr': 0.0002357737632238947, 'weight_decay': 1.477187169211194e-07, 'epochs': 144, 'loss': 'mae', 'optimizer': 'adam', 'graph_mode': 'cutoff', 'cutoff': 0.7054397310718971, 'grm_norm': 'cosine', 'self_loops': False, 'use_snp_selection': False}. Best is trial 56 with value: 0.2799013330479883.
[I 2025-12-08 10:53:35,496] Trial 75 finished with value: 0.2683548134545231 and parameters: {'model_type': 'gcn', 'hidden_dims': '[256, 128]', 'dropout': 0.5325393661313335, 'batch_norm': True, 'lr': 0.00010730691699121903, 'weight_decay': 3.550226446282204e-07, 'epochs': 135, 'loss': 'mae', 'optimizer': 'adam', 'graph_mode': 'cutoff', 'cutoff': 0.7290655908657263, 'grm_norm': 'cosine', 'self_loops': False, 'use_snp_selection': False}. Best is trial 56 with value: 0.2799013330479883.
[I 2025-12-08 10:53:57,760] Trial 76 finished with value: 0.2702641246738954 and parameters: {'model_type': 'gcn', 'hidden_dims': '[256, 128, 64]', 'dropout': 0.4881943380523908, 'batch_norm': True, 'lr': 0.00015899905485428713, 'weight_decay': 2.4925184085889606e-07, 'epochs': 164, 'loss': 'mae', 'optimizer': 'adam', 'graph_mode': 'cutoff', 'cutoff': 0.6563675670734538, 'grm_norm': 'cosine', 'self_loops': False, 'use_snp_selection': False}. Best is trial 56 with value: 0.2799013330479883.
[I 2025-12-08 10:54:16,354] Trial 77 finished with value: 0.24634993381109188 and parameters: {'model_type': 'gcn', 'hidden_dims': '[256, 128]', 'dropout': 0.5634307092889195, 'batch_norm': True, 'lr': 7.352993670857235e-05, 'weight_decay': 2.1296083016568114e-07, 'epochs': 134, 'loss': 'mae', 'optimizer': 'adam', 'graph_mode': 'knn', 'knn_k': 8, 'weighted_edges': False, 'symmetrize_mode': 'union', 'self_loops': False, 'use_snp_selection': False}. Best is trial 56 with value: 0.2799013330479883.
[I 2025-12-08 10:54:27,979] Trial 78 finished with value: 0.2667154933492843 and parameters: {'model_type': 'gcn', 'hidden_dims': '[256, 128]', 'dropout': 0.4608355263484351, 'batch_norm': True, 'lr': 3.686680743898848e-05, 'weight_decay': 3.6792942731373134e-07, 'epochs': 80, 'loss': 'mse', 'optimizer': 'adam', 'graph_mode': 'cutoff', 'cutoff': 0.6308183989851384, 'grm_norm': 'cosine', 'self_loops': True, 'use_snp_selection': False}. Best is trial 56 with value: 0.2799013330479883.
[I 2025-12-08 10:54:59,999] Trial 79 finished with value: 0.24489149856694686 and parameters: {'model_type': 'gcn', 'hidden_dims': '[512, 64]', 'dropout': 0.5156228516182326, 'batch_norm': False, 'lr': 5.213303022113347e-05, 'weight_decay': 1.0994352668687885e-07, 'epochs': 120, 'loss': 'mae', 'optimizer': 'adam', 'graph_mode': 'cutoff', 'cutoff': 0.6879448784295062, 'grm_norm': 'cosine', 'self_loops': False, 'use_snp_selection': False}. Best is trial 56 with value: 0.2799013330479883.
[I 2025-12-08 10:55:20,129] Trial 80 finished with value: 0.2677793478326434 and parameters: {'model_type': 'gcn', 'hidden_dims': '[256, 128]', 'dropout': 0.5396137861512901, 'batch_norm': True, 'lr': 0.0003139724389697704, 'weight_decay': 5.03723739883085e-07, 'epochs': 155, 'loss': 'mae', 'optimizer': 'adam', 'graph_mode': 'cutoff', 'cutoff': 0.7895538776017926, 'grm_norm': 'none', 'self_loops': False, 'use_snp_selection': False}. Best is trial 56 with value: 0.2799013330479883.
[I 2025-12-08 10:55:34,496] Trial 81 finished with value: 0.27725762958144473 and parameters: {'model_type': 'gcn', 'hidden_dims': '[256, 128]', 'dropout': 0.4944299883165861, 'batch_norm': True, 'lr': 0.0004518161969345307, 'weight_decay': 9.876803520878428e-07, 'epochs': 104, 'loss': 'mae', 'optimizer': 'adam', 'graph_mode': 'cutoff', 'cutoff': 0.7439268404232705, 'grm_norm': 'cosine', 'self_loops': False, 'use_snp_selection': False}. Best is trial 56 with value: 0.2799013330479883.
[I 2025-12-08 10:55:48,509] Trial 82 finished with value: 0.28004719065847616 and parameters: {'model_type': 'gcn', 'hidden_dims': '[256, 128]', 'dropout': 0.47940207263907714, 'batch_norm': True, 'lr': 9.283635931122828e-05, 'weight_decay': 9.378216258835543e-07, 'epochs': 101, 'loss': 'mae', 'optimizer': 'adam', 'graph_mode': 'cutoff', 'cutoff': 0.6638471269575614, 'grm_norm': 'cosine', 'self_loops': False, 'use_snp_selection': False}. Best is trial 82 with value: 0.28004719065847616.
[I 2025-12-08 10:56:03,126] Trial 83 finished with value: 0.2661623055804659 and parameters: {'model_type': 'gcn', 'hidden_dims': '[256, 128]', 'dropout': 0.47753967865295277, 'batch_norm': True, 'lr': 0.00041059158762714933, 'weight_decay': 8.954680785939543e-07, 'epochs': 106, 'loss': 'mae', 'optimizer': 'adam', 'graph_mode': 'cutoff', 'cutoff': 0.5792095590792248, 'grm_norm': 'cosine', 'self_loops': False, 'use_snp_selection': False}. Best is trial 82 with value: 0.28004719065847616.
[I 2025-12-08 10:56:15,519] Trial 84 finished with value: 0.26911699516546933 and parameters: {'model_type': 'gcn', 'hidden_dims': '[256, 128]', 'dropout': 0.4982845617625308, 'batch_norm': True, 'lr': 0.00012407880942194891, 'weight_decay': 6.077976494505055e-07, 'epochs': 87, 'loss': 'mae', 'optimizer': 'adam', 'graph_mode': 'cutoff', 'cutoff': 0.6755706840584993, 'grm_norm': 'cosine', 'self_loops': False, 'use_snp_selection': False}. Best is trial 82 with value: 0.28004719065847616.
[I 2025-12-08 10:56:29,290] Trial 85 finished with value: 0.2732795246032881 and parameters: {'model_type': 'gcn', 'hidden_dims': '[256, 128]', 'dropout': 0.5551679075961823, 'batch_norm': True, 'lr': 0.000499103830365412, 'weight_decay': 1.361865629416829e-07, 'epochs': 99, 'loss': 'mae', 'optimizer': 'adam', 'graph_mode': 'cutoff', 'cutoff': 0.6675319335737574, 'grm_norm': 'cosine', 'self_loops': False, 'use_snp_selection': False}. Best is trial 82 with value: 0.28004719065847616.
