[I 2025-12-08 18:41:36,805] Trial 50 finished with value: 0.2365883006120127 and parameters: {'model_type': 'gcn', 'hidden_dims': '[512, 256]', 'dropout': 0.23964503172291612, 'batch_norm': True, 'lr': 0.005828187528831845, 'weight_decay': 1.1134504222297364e-07, 'epochs': 198, 'loss': 'mse', 'optimizer': 'adam', 'graph_mode': 'knn', 'knn_k': 3, 'weighted_edges': False, 'symmetrize_mode': 'union', 'self_loops': False, 'use_snp_selection': False}. Best is trial 41 with value: 0.31606475813714086.
[I 2025-12-08 18:42:20,255] Trial 51 finished with value: 0.3184676325043802 and parameters: {'model_type': 'gcn', 'hidden_dims': '[512, 128]', 'dropout': 0.5195039330205966, 'batch_norm': True, 'lr': 0.0033417987082625306, 'weight_decay': 2.469998179127257e-07, 'epochs': 165, 'loss': 'mse', 'optimizer': 'adam', 'graph_mode': 'cutoff', 'cutoff': 0.7936368690614609, 'grm_norm': 'cosine_then_gcn', 'self_loops': False, 'use_snp_selection': False}. Best is trial 51 with value: 0.3184676325043802.
[I 2025-12-08 18:43:19,992] Trial 52 finished with value: 0.3161875574722646 and parameters: {'model_type': 'gcn', 'hidden_dims': '[512, 128]', 'dropout': 0.49930421494325544, 'batch_norm': True, 'lr': 0.00900098237069368, 'weight_decay': 1.5296543650529696e-07, 'epochs': 234, 'loss': 'mse', 'optimizer': 'adam', 'graph_mode': 'cutoff', 'cutoff': 0.8563711560904954, 'grm_norm': 'cosine_then_gcn', 'self_loops': False, 'use_snp_selection': False}. Best is trial 51 with value: 0.3184676325043802.
[I 2025-12-08 18:44:18,651] Trial 53 finished with value: 0.31627031339028616 and parameters: {'model_type': 'gcn', 'hidden_dims': '[512, 128]', 'dropout': 0.5033712001373788, 'batch_norm': True, 'lr': 0.0090495230852952, 'weight_decay': 1.0015418574951199e-07, 'epochs': 229, 'loss': 'mse', 'optimizer': 'adam', 'graph_mode': 'cutoff', 'cutoff': 0.8274007992619778, 'grm_norm': 'cosine_then_gcn', 'self_loops': False, 'use_snp_selection': False}. Best is trial 51 with value: 0.3184676325043802.
[I 2025-12-08 18:45:18,944] Trial 54 finished with value: 0.31276813570757367 and parameters: {'model_type': 'gcn', 'hidden_dims': '[512, 128]', 'dropout': 0.4168481561921631, 'batch_norm': True, 'lr': 0.008532275190396897, 'weight_decay': 3.9600092273733345e-07, 'epochs': 236, 'loss': 'mse', 'optimizer': 'adam', 'graph_mode': 'cutoff', 'cutoff': 0.8917706665050246, 'grm_norm': 'cosine_then_gcn', 'self_loops': False, 'use_snp_selection': False}. Best is trial 51 with value: 0.3184676325043802.
[I 2025-12-08 18:46:29,177] Trial 55 finished with value: 0.31461326661408223 and parameters: {'model_type': 'gcn', 'hidden_dims': '[512, 128]', 'dropout': 0.46629110313862043, 'batch_norm': True, 'lr': 0.0069462039405492485, 'weight_decay': 1.3679439462336916e-07, 'epochs': 276, 'loss': 'mse', 'optimizer': 'adam', 'graph_mode': 'cutoff', 'cutoff': 0.8530902451949477, 'grm_norm': 'cosine_then_gcn', 'self_loops': False, 'use_snp_selection': False}. Best is trial 51 with value: 0.3184676325043802.
[I 2025-12-08 18:46:48,608] Trial 56 finished with value: -0.016927248500886637 and parameters: {'model_type': 'gcn', 'hidden_dims': '[128, 64]', 'dropout': 0.497932653410851, 'batch_norm': False, 'lr': 0.004461818060116907, 'weight_decay': 1.5651809586566767e-07, 'epochs': 251, 'loss': 'mse', 'optimizer': 'adam', 'graph_mode': 'cutoff', 'cutoff': 0.8443058366268487, 'grm_norm': 'cosine', 'self_loops': True, 'use_snp_selection': False}. Best is trial 51 with value: 0.3184676325043802.
[I 2025-12-08 18:47:19,481] Trial 57 finished with value: 0.3126531115804 and parameters: {'model_type': 'gcn', 'hidden_dims': '[256, 128, 64]', 'dropout': 0.43671167803070227, 'batch_norm': True, 'lr': 0.00697095585603018, 'weight_decay': 1.5936386996895583e-05, 'epochs': 229, 'loss': 'mse', 'optimizer': 'adam', 'graph_mode': 'cutoff', 'cutoff': 0.8188312150005539, 'grm_norm': 'cosine_then_gcn', 'self_loops': False, 'use_snp_selection': False}. Best is trial 51 with value: 0.3184676325043802.
[I 2025-12-08 18:47:47,652] Trial 58 finished with value: 0.3155557202910023 and parameters: {'model_type': 'gcn', 'hidden_dims': '[256, 128]', 'dropout': 0.5226940590137039, 'batch_norm': True, 'lr': 0.009617401979717874, 'weight_decay': 6.288237169145739e-07, 'epochs': 215, 'loss': 'mse', 'optimizer': 'adam', 'graph_mode': 'cutoff', 'cutoff': 0.7782864286491377, 'grm_norm': 'cosine_then_gcn', 'self_loops': False, 'use_snp_selection': False}. Best is trial 51 with value: 0.3184676325043802.
[I 2025-12-08 18:48:12,977] Trial 59 finished with value: 0.30192722504055214 and parameters: {'model_type': 'gcn', 'hidden_dims': '[512, 128]', 'dropout': 0.4938102378263207, 'batch_norm': True, 'lr': 0.0036264087283449996, 'weight_decay': 4.328350981185942e-07, 'epochs': 191, 'loss': 'mse', 'optimizer': 'adam', 'graph_mode': 'cutoff', 'cutoff': 0.8712200485701999, 'grm_norm': 'gcn', 'self_loops': False, 'use_snp_selection': True, 'num_snps': 17832}. Best is trial 51 with value: 0.3184676325043802.
[I 2025-12-08 18:49:19,762] Trial 60 finished with value: 0.3171914081489469 and parameters: {'model_type': 'gcn', 'hidden_dims': '[512, 128]', 'dropout': 0.4022073067468505, 'batch_norm': True, 'lr': 0.006789491180017207, 'weight_decay': 1.237750986195085e-06, 'epochs': 262, 'loss': 'mse', 'optimizer': 'adam', 'graph_mode': 'cutoff', 'cutoff': 0.8959651613888567, 'grm_norm': 'cosine_then_gcn', 'self_loops': True, 'use_snp_selection': False}. Best is trial 51 with value: 0.3184676325043802.
[I 2025-12-08 18:50:40,162] Trial 61 finished with value: 0.31468600052684553 and parameters: {'model_type': 'gcn', 'hidden_dims': '[512, 128]', 'dropout': 0.40261208480381555, 'batch_norm': True, 'lr': 0.005735552299816115, 'weight_decay': 1.3104418439440178e-06, 'epochs': 316, 'loss': 'mse', 'optimizer': 'adam', 'graph_mode': 'cutoff', 'cutoff': 0.8972076118402853, 'grm_norm': 'cosine_then_gcn', 'self_loops': True, 'use_snp_selection': False}. Best is trial 51 with value: 0.3184676325043802.
[I 2025-12-08 18:51:48,323] Trial 62 finished with value: 0.31323337712363974 and parameters: {'model_type': 'gcn', 'hidden_dims': '[512, 128]', 'dropout': 0.30795611084114755, 'batch_norm': True, 'lr': 0.007507994268577725, 'weight_decay': 2.567497005255463e-07, 'epochs': 267, 'loss': 'mse', 'optimizer': 'adam', 'graph_mode': 'cutoff', 'cutoff': 0.8364579720775726, 'grm_norm': 'cosine_then_gcn', 'self_loops': True, 'use_snp_selection': False}. Best is trial 51 with value: 0.3184676325043802.
[I 2025-12-08 18:53:01,057] Trial 63 finished with value: 0.31724434966665827 and parameters: {'model_type': 'gcn', 'hidden_dims': '[512, 128]', 'dropout': 0.3524587782086149, 'batch_norm': True, 'lr': 0.005462355301792992, 'weight_decay': 6.013752096406125e-07, 'epochs': 286, 'loss': 'mse', 'optimizer': 'adam', 'graph_mode': 'cutoff', 'cutoff': 0.8688006935288248, 'grm_norm': 'cosine_then_gcn', 'self_loops': True, 'use_snp_selection': False}. Best is trial 51 with value: 0.3184676325043802.
[I 2025-12-08 18:54:25,573] Trial 64 finished with value: 0.3173672876689252 and parameters: {'model_type': 'gcn', 'hidden_dims': '[512, 128]', 'dropout': 0.3409447088912842, 'batch_norm': True, 'lr': 0.005462952323967064, 'weight_decay': 5.768678804548785e-07, 'epochs': 335, 'loss': 'mse', 'optimizer': 'adam', 'graph_mode': 'cutoff', 'cutoff': 0.8699846375511494, 'grm_norm': 'cosine_then_gcn', 'self_loops': True, 'use_snp_selection': False}. Best is trial 51 with value: 0.3184676325043802.
[I 2025-12-08 18:55:48,666] Trial 65 finished with value: 0.3131808935134558 and parameters: {'model_type': 'gcn', 'hidden_dims': '[512, 128]', 'dropout': 0.3475324426235934, 'batch_norm': True, 'lr': 0.005508044381894556, 'weight_decay': 6.514128862277439e-07, 'epochs': 330, 'loss': 'mse', 'optimizer': 'adam', 'graph_mode': 'cutoff', 'cutoff': 0.8763974631579444, 'grm_norm': 'cosine_then_gcn', 'self_loops': True, 'use_snp_selection': False}. Best is trial 51 with value: 0.3184676325043802.
[I 2025-12-08 18:57:03,053] Trial 66 finished with value: 0.31362932831214463 and parameters: {'model_type': 'gcn', 'hidden_dims': '[512, 128]', 'dropout': 0.36218162915746144, 'batch_norm': True, 'lr': 0.009945066215262826, 'weight_decay': 1.0430876120322457e-06, 'epochs': 294, 'loss': 'mse', 'optimizer': 'adam', 'graph_mode': 'cutoff', 'cutoff': 0.8634176025638712, 'grm_norm': 'cosine_then_gcn', 'self_loops': True, 'use_snp_selection': False}. Best is trial 51 with value: 0.3184676325043802.
[I 2025-12-08 18:58:15,893] Trial 67 finished with value: 0.004231390744997699 and parameters: {'model_type': 'gcn', 'hidden_dims': '[512, 128]', 'dropout': 0.3002791739885764, 'batch_norm': False, 'lr': 0.003753346812975867, 'weight_decay': 2.735415788756717e-06, 'epochs': 290, 'loss': 'mse', 'optimizer': 'adam', 'graph_mode': 'cutoff', 'cutoff': 0.8415768846757816, 'grm_norm': 'none', 'self_loops': True, 'use_snp_selection': False}. Best is trial 51 with value: 0.3184676325043802.
[I 2025-12-08 18:59:42,843] Trial 68 finished with value: 0.2112822691313636 and parameters: {'model_type': 'gcn', 'hidden_dims': '[512, 128]', 'dropout': 0.327061070604221, 'batch_norm': True, 'lr': 0.002346559412016029, 'weight_decay': 1.8600370823072733e-07, 'epochs': 340, 'loss': 'mse', 'optimizer': 'adam', 'graph_mode': 'knn', 'knn_k': 8, 'weighted_edges': False, 'symmetrize_mode': 'mutual', 'self_loops': True, 'use_snp_selection': False}. Best is trial 51 with value: 0.3184676325043802.
[I 2025-12-08 19:00:45,369] Trial 69 finished with value: 0.3160493984123775 and parameters: {'model_type': 'gcn', 'hidden_dims': '[512, 128]', 'dropout': 0.2801384476031909, 'batch_norm': True, 'lr': 0.005072593024053009, 'weight_decay': 1.3480066945651265e-07, 'epochs': 244, 'loss': 'mse', 'optimizer': 'adam', 'graph_mode': 'cutoff', 'cutoff': 0.8991465029852421, 'grm_norm': 'cosine_then_gcn', 'self_loops': True, 'use_snp_selection': False}. Best is trial 51 with value: 0.3184676325043802.
[I 2025-12-08 19:02:06,596] Trial 70 finished with value: 0.3114922950787439 and parameters: {'model_type': 'gcn', 'hidden_dims': '[512, 128]', 'dropout': 0.366469136754604, 'batch_norm': True, 'lr': 0.0075480016064247025, 'weight_decay': 1.778792264437182e-06, 'epochs': 322, 'loss': 'mse', 'optimizer': 'adam', 'graph_mode': 'cutoff', 'cutoff': 0.7968576503672372, 'grm_norm': 'cosine_then_gcn', 'self_loops': True, 'use_snp_selection': False}. Best is trial 51 with value: 0.3184676325043802.
[I 2025-12-08 19:03:14,658] Trial 71 finished with value: 0.3171883839252826 and parameters: {'model_type': 'gcn', 'hidden_dims': '[512, 128]', 'dropout': 0.33014298706710143, 'batch_norm': True, 'lr': 0.0068318585477121704, 'weight_decay': 2.8475723813873325e-07, 'epochs': 267, 'loss': 'mse', 'optimizer': 'adam', 'graph_mode': 'cutoff', 'cutoff': 0.8300288378943296, 'grm_norm': 'cosine_then_gcn', 'self_loops': True, 'use_snp_selection': False}. Best is trial 51 with value: 0.3184676325043802.
[I 2025-12-08 19:04:21,468] Trial 72 finished with value: 0.3127854718936203 and parameters: {'model_type': 'gcn', 'hidden_dims': '[512, 128]', 'dropout': 0.2550561342214331, 'batch_norm': True, 'lr': 0.00618246234634896, 'weight_decay': 2.886209153095427e-07, 'epochs': 261, 'loss': 'mse', 'optimizer': 'adam', 'graph_mode': 'cutoff', 'cutoff': 0.8710431894615945, 'grm_norm': 'cosine_then_gcn', 'self_loops': True, 'use_snp_selection': False}. Best is trial 51 with value: 0.3184676325043802.
[I 2025-12-08 19:05:39,939] Trial 73 finished with value: 0.31497901296263653 and parameters: {'model_type': 'gcn', 'hidden_dims': '[512, 128]', 'dropout': 0.3418315765170295, 'batch_norm': True, 'lr': 0.004247211759272641, 'weight_decay': 5.16192775209923e-07, 'epochs': 303, 'loss': 'mse', 'optimizer': 'adam', 'graph_mode': 'cutoff', 'cutoff': 0.8294904459961154, 'grm_norm': 'cosine_then_gcn', 'self_loops': True, 'use_snp_selection': False}. Best is trial 51 with value: 0.3184676325043802.
[I 2025-12-08 19:06:54,017] Trial 74 finished with value: 0.2190900211921883 and parameters: {'model_type': 'gcn', 'hidden_dims': '[512, 128]', 'dropout': 0.332206785580421, 'batch_norm': True, 'lr': 0.002915779259764628, 'weight_decay': 8.320077049592093e-07, 'epochs': 286, 'loss': 'mse', 'optimizer': 'adam', 'graph_mode': 'cutoff', 'cutoff': 0.3540679676074523, 'grm_norm': 'cosine_then_gcn', 'self_loops': True, 'use_snp_selection': False}. Best is trial 51 with value: 0.3184676325043802.
[I 2025-12-08 19:08:05,265] Trial 75 finished with value: 0.31537623674685367 and parameters: {'model_type': 'gcn', 'hidden_dims': '[512, 128]', 'dropout': 0.37205096081490807, 'batch_norm': True, 'lr': 0.0071808822035912614, 'weight_decay': 2.1185649313478902e-07, 'epochs': 280, 'loss': 'mse', 'optimizer': 'adam', 'graph_mode': 'cutoff', 'cutoff': 0.8179085014119382, 'grm_norm': 'cosine_then_gcn', 'self_loops': True, 'use_snp_selection': False}. Best is trial 51 with value: 0.3184676325043802.
[I 2025-12-08 19:09:13,358] Trial 76 finished with value: 0.31772226540080617 and parameters: {'model_type': 'gcn', 'hidden_dims': '[512, 256]', 'dropout': 0.3967145191448358, 'batch_norm': True, 'lr': 0.008107640610577328, 'weight_decay': 3.430062222706255e-07, 'epochs': 266, 'loss': 'mse', 'optimizer': 'adam', 'graph_mode': 'cutoff', 'cutoff': 0.8641088759314431, 'grm_norm': 'cosine_then_gcn', 'self_loops': True, 'use_snp_selection': False}. Best is trial 51 with value: 0.3184676325043802.
[I 2025-12-08 19:10:18,747] Trial 77 finished with value: 0.315250777635794 and parameters: {'model_type': 'gcn', 'hidden_dims': '[512, 256]', 'dropout': 0.3969256428690573, 'batch_norm': True, 'lr': 0.008159967428484557, 'weight_decay': 2.6313740762688583e-07, 'epochs': 255, 'loss': 'mse', 'optimizer': 'adam', 'graph_mode': 'cutoff', 'cutoff': 0.8580445322860559, 'grm_norm': 'cosine_then_gcn', 'self_loops': True, 'use_snp_selection': False}. Best is trial 51 with value: 0.3184676325043802.
[I 2025-12-08 19:11:26,425] Trial 78 finished with value: 0.3179901760195733 and parameters: {'model_type': 'gcn', 'hidden_dims': '[512, 256]', 'dropout': 0.39464995853716756, 'batch_norm': True, 'lr': 0.004861690992683323, 'weight_decay': 5.162322944906732e-06, 'epochs': 265, 'loss': 'mse', 'optimizer': 'adam', 'graph_mode': 'cutoff', 'cutoff': 0.87459196531463, 'grm_norm': 'cosine', 'self_loops': True, 'use_snp_selection': False}. Best is trial 51 with value: 0.3184676325043802.
[I 2025-12-08 19:12:28,715] Trial 79 finished with value: 0.22330300639902986 and parameters: {'model_type': 'gcn', 'hidden_dims': '[512, 256]', 'dropout': 0.38825407109385257, 'batch_norm': True, 'lr': 0.005150476530431116, 'weight_decay': 5.10481560972617e-06, 'epochs': 310, 'loss': 'mse', 'optimizer': 'adam', 'graph_mode': 'knn', 'knn_k': 5, 'weighted_edges': True, 'symmetrize_mode': 'union', 'self_loops': True, 'use_snp_selection': True, 'num_snps': 38681}. Best is trial 51 with value: 0.3184676325043802.
[I 2025-12-08 19:13:37,249] Trial 80 finished with value: -0.03319147238569037 and parameters: {'model_type': 'gcn', 'hidden_dims': '[512, 256]', 'dropout': 0.4352994432307866, 'batch_norm': False, 'lr': 0.004173965027739662, 'weight_decay': 1.191199000533535e-05, 'epochs': 269, 'loss': 'mse', 'optimizer': 'adam', 'graph_mode': 'cutoff', 'cutoff': 0.8820611429566575, 'grm_norm': 'cosine', 'self_loops': True, 'use_snp_selection': False}. Best is trial 51 with value: 0.3184676325043802.
[I 2025-12-08 19:14:38,001] Trial 81 finished with value: 0.31173808569382505 and parameters: {'model_type': 'gcn', 'hidden_dims': '[512, 256]', 'dropout': 0.3216369690429603, 'batch_norm': True, 'lr': 0.0062665313153467805, 'weight_decay': 1.1970142856772246e-06, 'epochs': 236, 'loss': 'mse', 'optimizer': 'adam', 'graph_mode': 'cutoff', 'cutoff': 0.8529507370931433, 'grm_norm': 'cosine', 'self_loops': True, 'use_snp_selection': False}. Best is trial 51 with value: 0.3184676325043802.
[I 2025-12-08 19:16:05,768] Trial 82 finished with value: 0.30919868252950083 and parameters: {'model_type': 'gcn', 'hidden_dims': '[512, 256]', 'dropout': 0.309779522215609, 'batch_norm': True, 'lr': 0.008813256158258672, 'weight_decay': 9.442722804233805e-05, 'epochs': 348, 'loss': 'mse', 'optimizer': 'adam', 'graph_mode': 'cutoff', 'cutoff': 0.7961212694632949, 'grm_norm': 'cosine', 'self_loops': True, 'use_snp_selection': False}. Best is trial 51 with value: 0.3184676325043802.
[I 2025-12-08 19:17:12,506] Trial 83 finished with value: 0.318887468710363 and parameters: {'model_type': 'gcn', 'hidden_dims': '[512, 256]', 'dropout': 0.41349001913029954, 'batch_norm': True, 'lr': 0.0099231106432935, 'weight_decay': 1.8311293589874638e-07, 'epochs': 261, 'loss': 'mse', 'optimizer': 'adam', 'graph_mode': 'cutoff', 'cutoff': 0.8757776350940846, 'grm_norm': 'cosine', 'self_loops': True, 'use_snp_selection': False}. Best is trial 83 with value: 0.318887468710363.
[I 2025-12-08 19:18:19,729] Trial 84 finished with value: 0.31504572589909896 and parameters: {'model_type': 'gcn', 'hidden_dims': '[512, 256]', 'dropout': 0.4183874009083283, 'batch_norm': True, 'lr': 0.0034308460323102335, 'weight_decay': 6.951094873417312e-07, 'epochs': 263, 'loss': 'mse', 'optimizer': 'adam', 'graph_mode': 'cutoff', 'cutoff': 0.8800852292707415, 'grm_norm': 'cosine', 'self_loops': True, 'use_snp_selection': False}. Best is trial 83 with value: 0.318887468710363.
[I 2025-12-08 19:19:31,175] Trial 85 finished with value: 0.27394229337593995 and parameters: {'model_type': 'gcn', 'hidden_dims': '[512, 256]', 'dropout': 0.3745949267030325, 'batch_norm': True, 'lr': 1.3226021213331012e-05, 'weight_decay': 4.905653154142548e-07, 'epochs': 282, 'loss': 'mse', 'optimizer': 'adam', 'graph_mode': 'cutoff', 'cutoff': 0.8294967936506988, 'grm_norm': 'cosine', 'self_loops': True, 'use_snp_selection': False}. Best is trial 83 with value: 0.318887468710363.
[I 2025-12-08 19:20:33,897] Trial 86 finished with value: 0.3159828589143413 and parameters: {'model_type': 'gcn', 'hidden_dims': '[512, 256]', 'dropout': 0.40109799530073376, 'batch_norm': True, 'lr': 0.004830270874626884, 'weight_decay': 3.5896064287864017e-07, 'epochs': 244, 'loss': 'mse', 'optimizer': 'adam', 'graph_mode': 'cutoff', 'cutoff': 0.8115246677835994, 'grm_norm': 'cosine', 'self_loops': True, 'use_snp_selection': False}. Best is trial 83 with value: 0.318887468710363.
[I 2025-12-08 19:21:43,084] Trial 87 finished with value: 0.313576489083834 and parameters: {'model_type': 'gcn', 'hidden_dims': '[512, 256]', 'dropout': 0.35632310415839713, 'batch_norm': True, 'lr': 0.0024100854864260754, 'weight_decay': 2.9307515421154994e-06, 'epochs': 272, 'loss': 'mse', 'optimizer': 'adam', 'graph_mode': 'cutoff', 'cutoff': 0.8975084973392707, 'grm_norm': 'cosine', 'self_loops': True, 'use_snp_selection': False}. Best is trial 83 with value: 0.318887468710363.
[I 2025-12-08 19:22:58,512] Trial 88 finished with value: 0.3135480183645647 and parameters: {'model_type': 'gcn', 'hidden_dims': '[512, 64]', 'dropout': 0.3358651956437431, 'batch_norm': True, 'lr': 0.006349674557084279, 'weight_decay': 2.7756545454124752e-05, 'epochs': 298, 'loss': 'mse', 'optimizer': 'adam', 'graph_mode': 'cutoff', 'cutoff': 0.872136283430149, 'grm_norm': 'gcn', 'self_loops': True, 'use_snp_selection': False}. Best is trial 83 with value: 0.318887468710363.
[I 2025-12-08 19:23:56,690] Trial 89 finished with value: 0.31575647768643667 and parameters: {'model_type': 'gcn', 'hidden_dims': '[512, 256]', 'dropout': 0.38982535846993277, 'batch_norm': True, 'lr': 0.003012645004596037, 'weight_decay': 6.362644665113011e-06, 'epochs': 223, 'loss': 'mse', 'optimizer': 'adam', 'graph_mode': 'cutoff', 'cutoff': 0.7608221620117314, 'grm_norm': 'cosine', 'self_loops': True, 'use_snp_selection': False}. Best is trial 83 with value: 0.318887468710363.
[I 2025-12-08 19:24:31,616] Trial 90 finished with value: 0.23207012741961086 and parameters: {'model_type': 'gcn', 'hidden_dims': '[256, 128, 64]', 'dropout': 0.4065067511609691, 'batch_norm': True, 'lr': 0.007778911257999999, 'weight_decay': 1.809767476975113e-07, 'epochs': 251, 'loss': 'mse', 'optimizer': 'adam', 'graph_mode': 'cutoff', 'cutoff': 0.264004649358472, 'grm_norm': 'none', 'self_loops': True, 'use_snp_selection': False}. Best is trial 83 with value: 0.318887468710363.
[I 2025-12-08 19:24:52,740] Trial 91 finished with value: 0.31263991295322424 and parameters: {'model_type': 'gcn', 'hidden_dims': '[128, 64]', 'dropout': 0.3784810877195622, 'batch_norm': True, 'lr': 0.00955174685886714, 'weight_decay': 1.1982185855877685e-07, 'epochs': 259, 'loss': 'mse', 'optimizer': 'adam', 'graph_mode': 'cutoff', 'cutoff': 0.8477123375409762, 'grm_norm': 'cosine_then_gcn', 'self_loops': True, 'use_snp_selection': False}. Best is trial 83 with value: 0.318887468710363.
[I 2025-12-08 19:25:54,277] Trial 92 finished with value: 0.31694708413399925 and parameters: {'model_type': 'gcn', 'hidden_dims': '[512, 256]', 'dropout': 0.42578783737428144, 'batch_norm': True, 'lr': 0.005439118962907001, 'weight_decay': 1.0069273320233742e-07, 'epochs': 230, 'loss': 'mse', 'optimizer': 'adam', 'graph_mode': 'cutoff', 'cutoff': 0.863932453877467, 'grm_norm': 'cosine_then_gcn', 'self_loops': True, 'use_snp_selection': False}. Best is trial 83 with value: 0.318887468710363.
[I 2025-12-08 19:27:08,340] Trial 93 finished with value: 0.31532791486607675 and parameters: {'model_type': 'gcn', 'hidden_dims': '[512, 256]', 'dropout': 0.45078245214022417, 'batch_norm': True, 'lr': 0.005289277828976306, 'weight_decay': 1.001613771704359e-07, 'epochs': 275, 'loss': 'mse', 'optimizer': 'adam', 'graph_mode': 'cutoff', 'cutoff': 0.8335161340489049, 'grm_norm': 'cosine_then_gcn', 'self_loops': True, 'use_snp_selection': False}. Best is trial 83 with value: 0.318887468710363.
