[I 2025-12-08 10:45:00,480] Trial 85 finished with value: 0.1769469869310897 and parameters: {'model_type': 'gcn', 'hidden_dims': '[256, 128, 64]', 'dropout': 0.15560955583531852, 'batch_norm': False, 'lr': 0.00799696119695686, 'weight_decay': 5.672016319949866e-06, 'epochs': 131, 'loss': 'mae', 'optimizer': 'adam', 'graph_mode': 'cutoff', 'cutoff': 0.5323154354428526, 'grm_norm': 'cosine_then_gcn', 'self_loops': True, 'use_snp_selection': True, 'num_snps': 12091}. Best is trial 61 with value: 0.3532420955957651.
[I 2025-12-08 10:45:13,779] Trial 86 finished with value: 0.30913429364721484 and parameters: {'model_type': 'gcn', 'hidden_dims': '[512, 256]', 'dropout': 0.12241017884401412, 'batch_norm': False, 'lr': 0.001784801145969303, 'weight_decay': 2.603819956226838e-06, 'epochs': 102, 'loss': 'mse', 'optimizer': 'adam', 'graph_mode': 'cutoff', 'cutoff': 0.5749900833222087, 'grm_norm': 'cosine_then_gcn', 'self_loops': True, 'use_snp_selection': True, 'num_snps': 8637}. Best is trial 61 with value: 0.3532420955957651.
[I 2025-12-08 10:45:28,318] Trial 87 finished with value: 0.3341309444483979 and parameters: {'model_type': 'gcn', 'hidden_dims': '[256, 128]', 'dropout': 0.270990775311607, 'batch_norm': False, 'lr': 6.846014583954643e-05, 'weight_decay': 7.363051056458133e-05, 'epochs': 115, 'loss': 'mae', 'optimizer': 'adam', 'graph_mode': 'cutoff', 'cutoff': 0.6994907692881539, 'grm_norm': 'cosine', 'self_loops': False, 'use_snp_selection': True, 'num_snps': 15209}. Best is trial 61 with value: 0.3532420955957651.
[I 2025-12-08 10:46:03,297] Trial 88 finished with value: 0.26518164845918096 and parameters: {'model_type': 'gcn', 'hidden_dims': '[256, 128, 64]', 'dropout': 0.18352187773698933, 'batch_norm': True, 'lr': 0.0034184253016016526, 'weight_decay': 0.000983328205437154, 'epochs': 349, 'loss': 'mae', 'optimizer': 'adam', 'graph_mode': 'cutoff', 'cutoff': 0.3592030480062627, 'grm_norm': 'cosine_then_gcn', 'self_loops': True, 'use_snp_selection': True, 'num_snps': 27343}. Best is trial 61 with value: 0.3532420955957651.
[I 2025-12-08 10:46:21,107] Trial 89 finished with value: 0.25990284214734205 and parameters: {'model_type': 'gcn', 'hidden_dims': '[512, 256]', 'dropout': 0.11292528942788457, 'batch_norm': False, 'lr': 0.000722415825049461, 'weight_decay': 0.0002763778705549083, 'epochs': 58, 'loss': 'mae', 'optimizer': 'adam', 'graph_mode': 'knn', 'knn_k': 10, 'weighted_edges': False, 'symmetrize_mode': 'union', 'self_loops': False, 'use_snp_selection': False}. Best is trial 61 with value: 0.3532420955957651.
[I 2025-12-08 10:47:04,368] Trial 90 finished with value: 0.32877729445319365 and parameters: {'model_type': 'gcn', 'hidden_dims': '[512, 64]', 'dropout': 0.14307854085149252, 'batch_norm': False, 'lr': 0.00013155990585150248, 'weight_decay': 0.0004640268398852315, 'epochs': 242, 'loss': 'mse', 'optimizer': 'adam', 'graph_mode': 'cutoff', 'cutoff': 0.44164453832399675, 'grm_norm': 'cosine_then_gcn', 'self_loops': False, 'use_snp_selection': True, 'num_snps': 32406}. Best is trial 61 with value: 0.3532420955957651.
[I 2025-12-08 10:47:25,708] Trial 91 finished with value: 0.34546366571426995 and parameters: {'model_type': 'gcn', 'hidden_dims': '[512, 256]', 'dropout': 0.10776551885073904, 'batch_norm': False, 'lr': 0.0004049697977683847, 'weight_decay': 0.0002804186438683231, 'epochs': 123, 'loss': 'mae', 'optimizer': 'adam', 'graph_mode': 'cutoff', 'cutoff': 0.506599666305232, 'grm_norm': 'gcn', 'self_loops': True, 'use_snp_selection': True, 'num_snps': 20638}. Best is trial 61 with value: 0.3532420955957651.
[I 2025-12-08 10:47:44,652] Trial 92 finished with value: 0.3476284046654223 and parameters: {'model_type': 'gcn', 'hidden_dims': '[512, 256]', 'dropout': 0.13137659009366962, 'batch_norm': False, 'lr': 0.00019771281395344185, 'weight_decay': 0.00016022998853428385, 'epochs': 107, 'loss': 'mae', 'optimizer': 'adam', 'graph_mode': 'cutoff', 'cutoff': 0.5235717220467092, 'grm_norm': 'cosine_then_gcn', 'self_loops': True, 'use_snp_selection': True, 'num_snps': 18281}. Best is trial 61 with value: 0.3532420955957651.
[I 2025-12-08 10:48:02,465] Trial 93 finished with value: 0.34100698767308135 and parameters: {'model_type': 'gcn', 'hidden_dims': '[512, 256]', 'dropout': 0.1290886232161509, 'batch_norm': False, 'lr': 0.00020882411289867522, 'weight_decay': 0.00013482443877282138, 'epochs': 95, 'loss': 'mae', 'optimizer': 'adam', 'graph_mode': 'cutoff', 'cutoff': 0.6197583157808166, 'grm_norm': 'cosine_then_gcn', 'self_loops': True, 'use_snp_selection': True, 'num_snps': 17857}. Best is trial 61 with value: 0.3532420955957651.
[I 2025-12-08 10:48:19,056] Trial 94 finished with value: 0.3397420866347788 and parameters: {'model_type': 'gcn', 'hidden_dims': '[512, 256]', 'dropout': 0.16616494170856264, 'batch_norm': False, 'lr': 0.00024665243202944963, 'weight_decay': 0.00018713203005447875, 'epochs': 107, 'loss': 'mae', 'optimizer': 'adam', 'graph_mode': 'cutoff', 'cutoff': 0.48333518273345005, 'grm_norm': 'cosine_then_gcn', 'self_loops': True, 'use_snp_selection': True, 'num_snps': 13996}. Best is trial 61 with value: 0.3532420955957651.
[I 2025-12-08 10:48:44,189] Trial 95 finished with value: 0.344576528559655 and parameters: {'model_type': 'gcn', 'hidden_dims': '[512, 256]', 'dropout': 0.15490802043409185, 'batch_norm': False, 'lr': 0.00014290692172243296, 'weight_decay': 0.0006780150711496946, 'epochs': 142, 'loss': 'mae', 'optimizer': 'adam', 'graph_mode': 'cutoff', 'cutoff': 0.530884180295018, 'grm_norm': 'cosine_then_gcn', 'self_loops': True, 'use_snp_selection': True, 'num_snps': 23832}. Best is trial 61 with value: 0.3532420955957651.
[I 2025-12-08 10:48:56,937] Trial 96 finished with value: 0.34835104841694114 and parameters: {'model_type': 'gcn', 'hidden_dims': '[128, 64]', 'dropout': 0.1406307035879568, 'batch_norm': False, 'lr': 0.0004897031423706689, 'weight_decay': 0.00010217905593458781, 'epochs': 87, 'loss': 'mae', 'optimizer': 'adam', 'graph_mode': 'cutoff', 'cutoff': 0.564653666471883, 'grm_norm': 'cosine', 'self_loops': True, 'use_snp_selection': True, 'num_snps': 17022}. Best is trial 61 with value: 0.3532420955957651.
[I 2025-12-08 10:49:12,135] Trial 97 finished with value: 0.3486571024411098 and parameters: {'model_type': 'gcn', 'hidden_dims': '[128, 64]', 'dropout': 0.13634396189458198, 'batch_norm': False, 'lr': 0.0005117262504978226, 'weight_decay': 8.81462907230345e-05, 'epochs': 78, 'loss': 'mae', 'optimizer': 'adam', 'graph_mode': 'cutoff', 'cutoff': 0.5438184732819561, 'grm_norm': 'cosine_then_gcn', 'self_loops': True, 'use_snp_selection': True, 'num_snps': 28823}. Best is trial 61 with value: 0.3532420955957651.
[I 2025-12-08 10:49:23,423] Trial 98 finished with value: 0.34426245253851456 and parameters: {'model_type': 'gcn', 'hidden_dims': '[128, 64]', 'dropout': 0.1370288419688017, 'batch_norm': False, 'lr': 0.00048057411799593073, 'weight_decay': 0.00010167076424016403, 'epochs': 85, 'loss': 'mae', 'optimizer': 'adam', 'graph_mode': 'cutoff', 'cutoff': 0.5475974124470899, 'grm_norm': 'cosine_then_gcn', 'self_loops': True, 'use_snp_selection': True, 'num_snps': 11535}. Best is trial 61 with value: 0.3532420955957651.
[I 2025-12-08 10:49:40,071] Trial 99 finished with value: 0.31475950400376884 and parameters: {'model_type': 'gcn', 'hidden_dims': '[128, 64]', 'dropout': 0.12509626478334213, 'batch_norm': False, 'lr': 0.0010873732251472522, 'weight_decay': 8.833578850322699e-05, 'epochs': 62, 'loss': 'mae', 'optimizer': 'adam', 'graph_mode': 'cutoff', 'cutoff': 0.21698568215727276, 'grm_norm': 'cosine_then_gcn', 'self_loops': True, 'use_snp_selection': True, 'num_snps': 38003}. Best is trial 61 with value: 0.3532420955957651.
[I 2025-12-08 10:49:52,220] Trial 100 finished with value: 0.34731727651954125 and parameters: {'model_type': 'gcn', 'hidden_dims': '[128, 64]', 'dropout': 0.11441972954494317, 'batch_norm': False, 'lr': 0.001355711319911733, 'weight_decay': 6.550484199451438e-05, 'epochs': 71, 'loss': 'mae', 'optimizer': 'adam', 'graph_mode': 'cutoff', 'cutoff': 0.5648941401549425, 'grm_norm': 'cosine_then_gcn', 'self_loops': True, 'use_snp_selection': True, 'num_snps': 16122}. Best is trial 61 with value: 0.3532420955957651.
[I 2025-12-08 10:50:04,589] Trial 101 finished with value: 0.34175953355705724 and parameters: {'model_type': 'gcn', 'hidden_dims': '[128, 64]', 'dropout': 0.11811370093882177, 'batch_norm': False, 'lr': 0.001312379213849876, 'weight_decay': 0.00016098614927718976, 'epochs': 69, 'loss': 'mae', 'optimizer': 'adam', 'graph_mode': 'cutoff', 'cutoff': 0.5635499160423506, 'grm_norm': 'cosine_then_gcn', 'self_loops': True, 'use_snp_selection': True, 'num_snps': 17617}. Best is trial 61 with value: 0.3532420955957651.
[I 2025-12-08 10:50:18,686] Trial 102 finished with value: 0.3154766394764591 and parameters: {'model_type': 'gcn', 'hidden_dims': '[128, 64]', 'dropout': 0.14461425420538832, 'batch_norm': False, 'lr': 0.0020832078156948737, 'weight_decay': 4.4740240160089496e-05, 'epochs': 49, 'loss': 'mae', 'optimizer': 'adam', 'graph_mode': 'cutoff', 'cutoff': 0.5166309231529751, 'grm_norm': 'cosine_then_gcn', 'self_loops': True, 'use_snp_selection': True, 'num_snps': 28623}. Best is trial 61 with value: 0.3532420955957651.
[I 2025-12-08 10:50:30,950] Trial 103 finished with value: 0.344988324019346 and parameters: {'model_type': 'gcn', 'hidden_dims': '[128, 64]', 'dropout': 0.11194879164174257, 'batch_norm': False, 'lr': 0.001569912319469207, 'weight_decay': 6.640661666579932e-05, 'epochs': 78, 'loss': 'mae', 'optimizer': 'adam', 'graph_mode': 'cutoff', 'cutoff': 0.5547230241116009, 'grm_norm': 'cosine_then_gcn', 'self_loops': True, 'use_snp_selection': True, 'num_snps': 15756}. Best is trial 61 with value: 0.3532420955957651.
[I 2025-12-08 10:50:42,107] Trial 104 finished with value: 0.34153420053586114 and parameters: {'model_type': 'gcn', 'hidden_dims': '[128, 64]', 'dropout': 0.1311486489300973, 'batch_norm': False, 'lr': 0.0008285856199313057, 'weight_decay': 3.0760758986311487e-05, 'epochs': 74, 'loss': 'mae', 'optimizer': 'adam', 'graph_mode': 'cutoff', 'cutoff': 0.49658937003685116, 'grm_norm': 'none', 'self_loops': True, 'use_snp_selection': True, 'num_snps': 12911}. Best is trial 61 with value: 0.3532420955957651.
[I 2025-12-08 10:50:52,032] Trial 105 finished with value: 0.3314878358690928 and parameters: {'model_type': 'gcn', 'hidden_dims': '[128, 64]', 'dropout': 0.10051258337059736, 'batch_norm': False, 'lr': 0.0009634131189146656, 'weight_decay': 5.9164593610369855e-05, 'epochs': 47, 'loss': 'mae', 'optimizer': 'adam', 'graph_mode': 'cutoff', 'cutoff': 0.5270902685846407, 'grm_norm': 'cosine_then_gcn', 'self_loops': True, 'use_snp_selection': True, 'num_snps': 9030}. Best is trial 61 with value: 0.3532420955957651.
[I 2025-12-08 10:51:04,207] Trial 106 finished with value: 0.3105154799351034 and parameters: {'model_type': 'gcn', 'hidden_dims': '[128, 64]', 'dropout': 0.17436108369035613, 'batch_norm': True, 'lr': 0.0006505134003592899, 'weight_decay': 0.00021635970565381073, 'epochs': 86, 'loss': 'mse', 'optimizer': 'adam', 'graph_mode': 'cutoff', 'cutoff': 0.578562013796196, 'grm_norm': 'cosine', 'self_loops': True, 'use_snp_selection': True, 'num_snps': 14430}. Best is trial 61 with value: 0.3532420955957651.
[I 2025-12-08 10:51:16,207] Trial 107 finished with value: 0.24613746752851448 and parameters: {'model_type': 'gcn', 'hidden_dims': '[128, 64]', 'dropout': 0.1564136036463799, 'batch_norm': False, 'lr': 0.0026474970609683918, 'weight_decay': 0.00013608015497541703, 'epochs': 59, 'loss': 'mae', 'optimizer': 'adam', 'graph_mode': 'cutoff', 'cutoff': 0.47217682305138325, 'grm_norm': 'cosine_then_gcn', 'self_loops': True, 'use_snp_selection': True, 'num_snps': 16794}. Best is trial 61 with value: 0.3532420955957651.
[I 2025-12-08 10:51:29,718] Trial 108 finished with value: 0.34898976189428854 and parameters: {'model_type': 'gcn', 'hidden_dims': '[128, 64]', 'dropout': 0.138041283352564, 'batch_norm': False, 'lr': 0.0005421497348678743, 'weight_decay': 8.28081193584148e-05, 'epochs': 69, 'loss': 'mae', 'optimizer': 'adam', 'graph_mode': 'knn', 'knn_k': 2, 'weighted_edges': True, 'symmetrize_mode': 'mutual', 'self_loops': True, 'use_snp_selection': True, 'num_snps': 21916}. Best is trial 61 with value: 0.3532420955957651.
[I 2025-12-08 10:51:43,908] Trial 109 finished with value: 0.3302203863522972 and parameters: {'model_type': 'gcn', 'hidden_dims': '[128, 64]', 'dropout': 0.149723403203581, 'batch_norm': False, 'lr': 0.0003717709079244682, 'weight_decay': 9.419028041320885e-05, 'epochs': 67, 'loss': 'mae', 'optimizer': 'adam', 'graph_mode': 'knn', 'knn_k': 2, 'weighted_edges': True, 'symmetrize_mode': 'mutual', 'self_loops': True, 'use_snp_selection': True, 'num_snps': 25363}. Best is trial 61 with value: 0.3532420955957651.
[I 2025-12-08 10:51:56,474] Trial 110 finished with value: 0.27463746423410834 and parameters: {'model_type': 'gcn', 'hidden_dims': '[128, 64]', 'dropout': 0.16534085458844325, 'batch_norm': False, 'lr': 0.0005519524188166702, 'weight_decay': 4.5524119892030074e-05, 'epochs': 40, 'loss': 'mae', 'optimizer': 'adam', 'graph_mode': 'knn', 'knn_k': 2, 'weighted_edges': True, 'symmetrize_mode': 'mutual', 'self_loops': True, 'use_snp_selection': True, 'num_snps': 21647}. Best is trial 61 with value: 0.3532420955957651.
[I 2025-12-08 10:52:09,512] Trial 111 finished with value: 0.3343048956067654 and parameters: {'model_type': 'gcn', 'hidden_dims': '[128, 64]', 'dropout': 0.11869131514854409, 'batch_norm': False, 'lr': 0.0004670280450342327, 'weight_decay': 7.879534830512656e-05, 'epochs': 79, 'loss': 'mae', 'optimizer': 'adam', 'graph_mode': 'knn', 'knn_k': 5, 'weighted_edges': True, 'symmetrize_mode': 'mutual', 'self_loops': True, 'use_snp_selection': True, 'num_snps': 18568}. Best is trial 61 with value: 0.3532420955957651.
[I 2025-12-08 10:52:20,400] Trial 112 finished with value: 0.32090728567143123 and parameters: {'model_type': 'gcn', 'hidden_dims': '[128, 64]', 'dropout': 0.1377677643393318, 'batch_norm': False, 'lr': 0.0006236978685706048, 'weight_decay': 0.000351806724414741, 'epochs': 63, 'loss': 'mae', 'optimizer': 'adam', 'graph_mode': 'knn', 'knn_k': 3, 'weighted_edges': True, 'symmetrize_mode': 'mutual', 'self_loops': True, 'use_snp_selection': True, 'num_snps': 10993}. Best is trial 61 with value: 0.3532420955957651.
[I 2025-12-08 10:52:37,805] Trial 113 finished with value: 0.3393527588311006 and parameters: {'model_type': 'gcn', 'hidden_dims': '[256, 128]', 'dropout': 0.12579832098011076, 'batch_norm': False, 'lr': 0.00018853043724101923, 'weight_decay': 0.00016531582102928774, 'epochs': 73, 'loss': 'mae', 'optimizer': 'adam', 'graph_mode': 'knn', 'knn_k': 2, 'weighted_edges': True, 'symmetrize_mode': 'mutual', 'self_loops': True, 'use_snp_selection': True, 'num_snps': 29615}. Best is trial 61 with value: 0.3532420955957651.
[I 2025-12-08 10:52:50,019] Trial 114 finished with value: 0.317886142259611 and parameters: {'model_type': 'gcn', 'hidden_dims': '[128, 64]', 'dropout': 0.11348732190145788, 'batch_norm': False, 'lr': 0.00032093594849615765, 'weight_decay': 0.00012280423408202572, 'epochs': 53, 'loss': 'mae', 'optimizer': 'adam', 'graph_mode': 'cutoff', 'cutoff': 0.4482822652549955, 'grm_norm': 'cosine_then_gcn', 'self_loops': True, 'use_snp_selection': True, 'num_snps': 18934}. Best is trial 61 with value: 0.3532420955957651.
[I 2025-12-08 10:53:02,351] Trial 115 finished with value: 0.2829262296266132 and parameters: {'model_type': 'gcn', 'hidden_dims': '[128, 64]', 'dropout': 0.10018182958850676, 'batch_norm': False, 'lr': 1.0368446966680422e-05, 'weight_decay': 6.678732873889098e-05, 'epochs': 89, 'loss': 'mae', 'optimizer': 'adam', 'graph_mode': 'cutoff', 'cutoff': 0.6069449610477586, 'grm_norm': 'cosine_then_gcn', 'self_loops': True, 'use_snp_selection': True, 'num_snps': 14914}. Best is trial 61 with value: 0.3532420955957651.
[I 2025-12-08 10:53:15,498] Trial 116 finished with value: 0.3275063063329429 and parameters: {'model_type': 'gcn', 'hidden_dims': '[256, 128]', 'dropout': 0.1330821454291438, 'batch_norm': False, 'lr': 0.001122626989746414, 'weight_decay': 3.3460654314433637e-05, 'epochs': 106, 'loss': 'mse', 'optimizer': 'adam', 'graph_mode': 'cutoff', 'cutoff': 0.6339495119203007, 'grm_norm': 'cosine_then_gcn', 'self_loops': True, 'use_snp_selection': True, 'num_snps': 13019}. Best is trial 61 with value: 0.3532420955957651.
[I 2025-12-08 10:53:33,088] Trial 117 finished with value: 0.32637279053922236 and parameters: {'model_type': 'gcn', 'hidden_dims': '[512, 128]', 'dropout': 0.14788662152897858, 'batch_norm': False, 'lr': 0.0008066386488147383, 'weight_decay': 9.336400003397981e-05, 'epochs': 100, 'loss': 'mae', 'optimizer': 'adam', 'graph_mode': 'knn', 'knn_k': 4, 'weighted_edges': True, 'symmetrize_mode': 'mutual', 'self_loops': True, 'use_snp_selection': True, 'num_snps': 16232}. Best is trial 61 with value: 0.3532420955957651.
[I 2025-12-08 10:53:56,716] Trial 118 finished with value: 0.31585427983173553 and parameters: {'model_type': 'gcn', 'hidden_dims': '[512, 256]', 'dropout': 0.18468943026567944, 'batch_norm': False, 'lr': 0.001566232095357498, 'weight_decay': 2.5127661734789633e-05, 'epochs': 314, 'loss': 'mae', 'optimizer': 'adam', 'graph_mode': 'cutoff', 'cutoff': 0.49724970245558936, 'grm_norm': 'cosine', 'self_loops': True, 'use_snp_selection': True, 'num_snps': 9997}. Best is trial 61 with value: 0.3532420955957651.
[I 2025-12-08 10:54:10,220] Trial 119 finished with value: 0.3478336699530518 and parameters: {'model_type': 'gcn', 'hidden_dims': '[128, 64]', 'dropout': 0.13978620351909227, 'batch_norm': False, 'lr': 0.0019507903119726294, 'weight_decay': 0.0002450194043465679, 'epochs': 70, 'loss': 'mae', 'optimizer': 'adam', 'graph_mode': 'cutoff', 'cutoff': 0.6648688497592664, 'grm_norm': 'cosine_then_gcn', 'self_loops': True, 'use_snp_selection': True, 'num_snps': 22462}. Best is trial 61 with value: 0.3532420955957651.
[I 2025-12-08 10:54:23,563] Trial 120 finished with value: 0.2435394108901447 and parameters: {'model_type': 'gcn', 'hidden_dims': '[128, 64]', 'dropout': 0.20129716893186805, 'batch_norm': False, 'lr': 0.005000539770029166, 'weight_decay': 0.00018898439523929196, 'epochs': 68, 'loss': 'mae', 'optimizer': 'adam', 'graph_mode': 'cutoff', 'cutoff': 0.6603377922566843, 'grm_norm': 'cosine_then_gcn', 'self_loops': True, 'use_snp_selection': True, 'num_snps': 21974}. Best is trial 61 with value: 0.3532420955957651.
[I 2025-12-08 10:54:38,181] Trial 121 finished with value: 0.2115691312890557 and parameters: {'model_type': 'gcn', 'hidden_dims': '[128, 64]', 'dropout': 0.13935579635907416, 'batch_norm': False, 'lr': 0.0017923558732806611, 'weight_decay': 0.00033581468473881923, 'epochs': 82, 'loss': 'mae', 'optimizer': 'adam', 'graph_mode': 'cutoff', 'cutoff': 0.6955848694399831, 'grm_norm': 'cosine_then_gcn', 'self_loops': True, 'use_snp_selection': True, 'num_snps': 26020}. Best is trial 61 with value: 0.3532420955957651.
[I 2025-12-08 10:54:51,550] Trial 122 finished with value: 0.26036206375681387 and parameters: {'model_type': 'gcn', 'hidden_dims': '[128, 64]', 'dropout': 0.11082791929883257, 'batch_norm': False, 'lr': 0.002656919085465259, 'weight_decay': 0.00011527563700769312, 'epochs': 61, 'loss': 'mae', 'optimizer': 'adam', 'graph_mode': 'cutoff', 'cutoff': 0.5974142091467833, 'grm_norm': 'cosine_then_gcn', 'self_loops': True, 'use_snp_selection': True, 'num_snps': 23370}. Best is trial 61 with value: 0.3532420955957651.
[I 2025-12-08 10:55:05,606] Trial 123 finished with value: 0.10626023726729908 and parameters: {'model_type': 'gcn', 'hidden_dims': '[128, 64]', 'dropout': 0.49422091875086943, 'batch_norm': False, 'lr': 0.0007077241780586499, 'weight_decay': 0.0002392319082093087, 'epochs': 72, 'loss': 'mae', 'optimizer': 'adam', 'graph_mode': 'cutoff', 'cutoff': 0.5716488277748796, 'grm_norm': 'cosine_then_gcn', 'self_loops': True, 'use_snp_selection': True, 'num_snps': 24710}. Best is trial 61 with value: 0.3532420955957651.
[I 2025-12-08 10:55:49,029] Trial 124 finished with value: 0.35741966317924095 and parameters: {'model_type': 'gcn', 'hidden_dims': '[512, 256]', 'dropout': 0.1253516279722533, 'batch_norm': False, 'lr': 0.0013751998626117179, 'weight_decay': 0.0001500835193370077, 'epochs': 117, 'loss': 'mae', 'optimizer': 'adam', 'graph_mode': 'cutoff', 'cutoff': 0.6845027743352855, 'grm_norm': 'cosine_then_gcn', 'self_loops': True, 'use_snp_selection': True, 'num_snps': 59199}. Best is trial 124 with value: 0.35741966317924095.
[I 2025-12-08 10:56:16,612] Trial 125 finished with value: 0.02137652820886412 and parameters: {'model_type': 'gcn', 'hidden_dims': '[512, 64]', 'dropout': 0.15943255555074468, 'batch_norm': False, 'lr': 0.0013422010571298066, 'weight_decay': 0.00014393288570853079, 'epochs': 54, 'loss': 'mae', 'optimizer': 'adam', 'graph_mode': 'cutoff', 'cutoff': 0.6818328343037241, 'grm_norm': 'cosine_then_gcn', 'self_loops': True, 'use_snp_selection': True, 'num_snps': 53115}. Best is trial 124 with value: 0.35741966317924095.
[I 2025-12-08 10:56:47,285] Trial 126 finished with value: 0.3197359639708292 and parameters: {'model_type': 'gcn', 'hidden_dims': '[512, 256]', 'dropout': 0.17205769051661252, 'batch_norm': False, 'lr': 0.0020221303907836424, 'weight_decay': 5.502348089288594e-05, 'epochs': 90, 'loss': 'mae', 'optimizer': 'adam', 'graph_mode': 'cutoff', 'cutoff': 0.7313052289386672, 'grm_norm': 'none', 'self_loops': True, 'use_snp_selection': True, 'num_snps': 45179}. Best is trial 124 with value: 0.35741966317924095.
