[I 2025-12-08 11:35:35,943] Trial 66 finished with value: 0.30849627630415766 and parameters: {'model_type': 'gcn', 'hidden_dims': '[256, 128, 64]', 'dropout': 0.5195185044545179, 'batch_norm': True, 'lr': 0.0008235201548430669, 'weight_decay': 0.00010497712555665383, 'epochs': 116, 'loss': 'mae', 'optimizer': 'adam', 'graph_mode': 'cutoff', 'cutoff': 0.7804046733793902, 'grm_norm': 'gcn', 'self_loops': False, 'use_snp_selection': True, 'num_snps': 31510}. Best is trial 27 with value: 0.3149905766649259.
[I 2025-12-08 11:35:44,892] Trial 67 finished with value: 0.12559424880657039 and parameters: {'model_type': 'gcn', 'hidden_dims': '[256, 128]', 'dropout': 0.37642959320391023, 'batch_norm': False, 'lr': 0.00044133476972730635, 'weight_decay': 0.00021964963555576883, 'epochs': 57, 'loss': 'mse', 'optimizer': 'adam', 'graph_mode': 'knn', 'knn_k': 3, 'weighted_edges': True, 'symmetrize_mode': 'mutual', 'self_loops': False, 'use_snp_selection': False}. Best is trial 27 with value: 0.3149905766649259.
[I 2025-12-08 11:35:59,519] Trial 68 finished with value: 0.30391258482467676 and parameters: {'model_type': 'gcn', 'hidden_dims': '[256, 128, 64]', 'dropout': 0.5652852304769845, 'batch_norm': True, 'lr': 0.000248976921489241, 'weight_decay': 4.054712164630863e-05, 'epochs': 104, 'loss': 'mae', 'optimizer': 'adam', 'graph_mode': 'cutoff', 'cutoff': 0.8208278726349443, 'grm_norm': 'none', 'self_loops': False, 'use_snp_selection': False}. Best is trial 27 with value: 0.3149905766649259.
[I 2025-12-08 11:36:51,265] Trial 69 finished with value: 0.24234397391792123 and parameters: {'model_type': 'gcn', 'hidden_dims': '[512, 256]', 'dropout': 0.43905640060871476, 'batch_norm': True, 'lr': 7.232928680343368e-05, 'weight_decay': 4.449359475874763e-06, 'epochs': 161, 'loss': 'mae', 'optimizer': 'adam', 'graph_mode': 'cutoff', 'cutoff': 0.25378921805568944, 'grm_norm': 'gcn', 'self_loops': True, 'use_snp_selection': True, 'num_snps': 56152}. Best is trial 27 with value: 0.3149905766649259.
[I 2025-12-08 11:37:37,715] Trial 70 finished with value: 0.3070086709353449 and parameters: {'model_type': 'gcn', 'hidden_dims': '[512, 64]', 'dropout': 0.40778964129480666, 'batch_norm': True, 'lr': 0.002337702383080139, 'weight_decay': 1.582744270210844e-05, 'epochs': 181, 'loss': 'mae', 'optimizer': 'adam', 'graph_mode': 'cutoff', 'cutoff': 0.7200056298934044, 'grm_norm': 'cosine_then_gcn', 'self_loops': False, 'use_snp_selection': False}. Best is trial 27 with value: 0.3149905766649259.
[I 2025-12-08 11:38:04,422] Trial 71 finished with value: 0.3059701625532554 and parameters: {'model_type': 'gcn', 'hidden_dims': '[256, 128, 64]', 'dropout': 0.4929070775745368, 'batch_norm': True, 'lr': 0.000524890943767089, 'weight_decay': 2.7151021057147147e-05, 'epochs': 94, 'loss': 'mae', 'optimizer': 'adam', 'graph_mode': 'cutoff', 'cutoff': 0.843604925469533, 'grm_norm': 'gcn', 'self_loops': False, 'use_snp_selection': True, 'num_snps': 53194}. Best is trial 27 with value: 0.3149905766649259.
[I 2025-12-08 11:38:29,364] Trial 72 finished with value: 0.30721829551070934 and parameters: {'model_type': 'gcn', 'hidden_dims': '[256, 128, 64]', 'dropout': 0.5017838544507607, 'batch_norm': True, 'lr': 0.0005855230418987758, 'weight_decay': 8.078176875877166e-06, 'epochs': 78, 'loss': 'mae', 'optimizer': 'adam', 'graph_mode': 'cutoff', 'cutoff': 0.8152154065437162, 'grm_norm': 'gcn', 'self_loops': False, 'use_snp_selection': True, 'num_snps': 53160}. Best is trial 27 with value: 0.3149905766649259.
[I 2025-12-08 11:38:53,752] Trial 73 finished with value: 0.3094350379637046 and parameters: {'model_type': 'gcn', 'hidden_dims': '[256, 128, 64]', 'dropout': 0.4651076103749798, 'batch_norm': True, 'lr': 0.0002877146100052552, 'weight_decay': 1.7678412752997534e-05, 'epochs': 96, 'loss': 'mae', 'optimizer': 'adam', 'graph_mode': 'cutoff', 'cutoff': 0.8756818211966529, 'grm_norm': 'gcn', 'self_loops': False, 'use_snp_selection': True, 'num_snps': 45172}. Best is trial 27 with value: 0.3149905766649259.
[I 2025-12-08 11:39:21,082] Trial 74 finished with value: 0.3096488085094308 and parameters: {'model_type': 'gcn', 'hidden_dims': '[256, 128, 64]', 'dropout': 0.4588914756112109, 'batch_norm': True, 'lr': 0.0002978657136408892, 'weight_decay': 1.9611816361483153e-05, 'epochs': 131, 'loss': 'mae', 'optimizer': 'adam', 'graph_mode': 'cutoff', 'cutoff': 0.8748795583445289, 'grm_norm': 'gcn', 'self_loops': False, 'use_snp_selection': True, 'num_snps': 44829}. Best is trial 27 with value: 0.3149905766649259.
[I 2025-12-08 11:39:48,295] Trial 75 finished with value: 0.29259394722655874 and parameters: {'model_type': 'gcn', 'hidden_dims': '[256, 128, 64]', 'dropout': 0.45239789383410617, 'batch_norm': True, 'lr': 0.0002058821254806336, 'weight_decay': 1.0606801323357768e-05, 'epochs': 139, 'loss': 'mae', 'optimizer': 'adam', 'graph_mode': 'cutoff', 'cutoff': 0.8714972724396848, 'grm_norm': 'gcn', 'self_loops': False, 'use_snp_selection': True, 'num_snps': 41844}. Best is trial 27 with value: 0.3149905766649259.
[I 2025-12-08 11:40:05,867] Trial 76 finished with value: 0.3021987309745359 and parameters: {'model_type': 'gcn', 'hidden_dims': '[256, 128, 64]', 'dropout': 0.42230877702182273, 'batch_norm': True, 'lr': 0.00031222213595056176, 'weight_decay': 2.1718845864069398e-05, 'epochs': 127, 'loss': 'mae', 'optimizer': 'adam', 'graph_mode': 'cutoff', 'cutoff': 0.7879342340084909, 'grm_norm': 'cosine_then_gcn', 'self_loops': False, 'use_snp_selection': False}. Best is trial 27 with value: 0.3149905766649259.
[I 2025-12-08 11:40:32,251] Trial 77 finished with value: 0.30654125698479406 and parameters: {'model_type': 'gcn', 'hidden_dims': '[256, 128, 64]', 'dropout': 0.5287675894116831, 'batch_norm': True, 'lr': 0.00041370921718810713, 'weight_decay': 5.110279631584044e-05, 'epochs': 110, 'loss': 'mae', 'optimizer': 'adam', 'graph_mode': 'cutoff', 'cutoff': 0.7615752199572404, 'grm_norm': 'gcn', 'self_loops': False, 'use_snp_selection': True, 'num_snps': 47477}. Best is trial 27 with value: 0.3149905766649259.
[I 2025-12-08 11:40:44,552] Trial 78 finished with value: 0.2621012692003353 and parameters: {'model_type': 'gcn', 'hidden_dims': '[256, 128]', 'dropout': 0.4823277383407155, 'batch_norm': True, 'lr': 0.00023507233922313007, 'weight_decay': 1.322426136140016e-05, 'epochs': 83, 'loss': 'mse', 'optimizer': 'adam', 'graph_mode': 'knn', 'knn_k': 8, 'weighted_edges': False, 'symmetrize_mode': 'union', 'self_loops': False, 'use_snp_selection': False}. Best is trial 27 with value: 0.3149905766649259.
[I 2025-12-08 11:41:03,558] Trial 79 finished with value: 0.24458859020028148 and parameters: {'model_type': 'gcn', 'hidden_dims': '[256, 128, 64]', 'dropout': 0.5135264565828094, 'batch_norm': True, 'lr': 0.00014750260877271527, 'weight_decay': 3.8139631249278837e-05, 'epochs': 63, 'loss': 'mae', 'optimizer': 'adam', 'graph_mode': 'cutoff', 'cutoff': 0.4661814574696252, 'grm_norm': 'gcn', 'self_loops': False, 'use_snp_selection': True, 'num_snps': 37639}. Best is trial 27 with value: 0.3149905766649259.
[I 2025-12-08 11:41:23,804] Trial 80 finished with value: 0.2653726551396722 and parameters: {'model_type': 'gcn', 'hidden_dims': '[128, 64]', 'dropout': 0.3930556695493097, 'batch_norm': False, 'lr': 0.00017139348241681336, 'weight_decay': 2.4948507383409954e-05, 'epochs': 107, 'loss': 'mae', 'optimizer': 'adam', 'graph_mode': 'cutoff', 'cutoff': 0.8458270155030297, 'grm_norm': 'cosine', 'self_loops': False, 'use_snp_selection': True, 'num_snps': 44795}. Best is trial 27 with value: 0.3149905766649259.
[I 2025-12-08 11:41:49,885] Trial 81 finished with value: 0.30288125805760663 and parameters: {'model_type': 'gcn', 'hidden_dims': '[256, 128, 64]', 'dropout': 0.4600052076122318, 'batch_norm': True, 'lr': 0.00031587218124919304, 'weight_decay': 2.024073350330782e-05, 'epochs': 118, 'loss': 'mae', 'optimizer': 'adam', 'graph_mode': 'cutoff', 'cutoff': 0.8834623993209233, 'grm_norm': 'gcn', 'self_loops': False, 'use_snp_selection': True, 'num_snps': 44684}. Best is trial 27 with value: 0.3149905766649259.
[I 2025-12-08 11:42:15,246] Trial 82 finished with value: 0.3062842008237573 and parameters: {'model_type': 'gcn', 'hidden_dims': '[256, 128, 64]', 'dropout': 0.5511430378178164, 'batch_norm': True, 'lr': 0.00039747400199246705, 'weight_decay': 1.6712507059129553e-05, 'epochs': 87, 'loss': 'mae', 'optimizer': 'adam', 'graph_mode': 'cutoff', 'cutoff': 0.8699901638573366, 'grm_norm': 'gcn', 'self_loops': False, 'use_snp_selection': True, 'num_snps': 51592}. Best is trial 27 with value: 0.3149905766649259.
[I 2025-12-08 11:42:35,613] Trial 83 finished with value: 0.3111266773609207 and parameters: {'model_type': 'gcn', 'hidden_dims': '[256, 128, 64]', 'dropout': 0.431187295033004, 'batch_norm': True, 'lr': 0.000290562333817044, 'weight_decay': 7.743205665589578e-05, 'epochs': 97, 'loss': 'mae', 'optimizer': 'adam', 'graph_mode': 'cutoff', 'cutoff': 0.8135859955896676, 'grm_norm': 'gcn', 'self_loops': False, 'use_snp_selection': True, 'num_snps': 33444}. Best is trial 27 with value: 0.3149905766649259.
[I 2025-12-08 11:42:52,934] Trial 84 finished with value: 0.30527238251137195 and parameters: {'model_type': 'gcn', 'hidden_dims': '[256, 128, 64]', 'dropout': 0.428662083723694, 'batch_norm': True, 'lr': 0.0006568862054922342, 'weight_decay': 8.069801757356847e-05, 'epochs': 75, 'loss': 'mae', 'optimizer': 'adam', 'graph_mode': 'cutoff', 'cutoff': 0.8082868147475991, 'grm_norm': 'gcn', 'self_loops': False, 'use_snp_selection': True, 'num_snps': 28372}. Best is trial 27 with value: 0.3149905766649259.
[I 2025-12-08 11:43:16,168] Trial 85 finished with value: 0.30310550240698025 and parameters: {'model_type': 'gcn', 'hidden_dims': '[256, 128, 64]', 'dropout': 0.5868883722426979, 'batch_norm': True, 'lr': 0.0001121328140537718, 'weight_decay': 0.00011813950263762113, 'epochs': 132, 'loss': 'mae', 'optimizer': 'adam', 'graph_mode': 'cutoff', 'cutoff': 0.8371181711696658, 'grm_norm': 'gcn', 'self_loops': False, 'use_snp_selection': True, 'num_snps': 34176}. Best is trial 27 with value: 0.3149905766649259.
[I 2025-12-08 11:43:54,254] Trial 86 finished with value: 0.3019531372271589 and parameters: {'model_type': 'gcn', 'hidden_dims': '[512, 128]', 'dropout': 0.430965748165826, 'batch_norm': True, 'lr': 0.00018836385063668618, 'weight_decay': 6.365875293229783e-05, 'epochs': 146, 'loss': 'mae', 'optimizer': 'adam', 'graph_mode': 'cutoff', 'cutoff': 0.8991032391271566, 'grm_norm': 'cosine_then_gcn', 'self_loops': True, 'use_snp_selection': False}. Best is trial 27 with value: 0.3149905766649259.
[I 2025-12-08 11:44:16,392] Trial 87 finished with value: 0.3031188679590294 and parameters: {'model_type': 'gcn', 'hidden_dims': '[256, 128, 64]', 'dropout': 0.5686846854454399, 'batch_norm': True, 'lr': 0.00025855023895137173, 'weight_decay': 3.404933296090935e-05, 'epochs': 90, 'loss': 'mae', 'optimizer': 'adam', 'graph_mode': 'cutoff', 'cutoff': 0.7917735344611637, 'grm_norm': 'gcn', 'self_loops': False, 'use_snp_selection': True, 'num_snps': 40496}. Best is trial 27 with value: 0.3149905766649259.
[I 2025-12-08 11:44:23,689] Trial 88 finished with value: 0.3045148905483721 and parameters: {'model_type': 'gcn', 'hidden_dims': '[256, 128]', 'dropout': 0.36162338678722683, 'batch_norm': True, 'lr': 0.0003782405025632788, 'weight_decay': 8.856687057490525e-06, 'epochs': 45, 'loss': 'mae', 'optimizer': 'adam', 'graph_mode': 'cutoff', 'cutoff': 0.8231055961472353, 'grm_norm': 'gcn', 'self_loops': False, 'use_snp_selection': False}. Best is trial 27 with value: 0.3149905766649259.
[I 2025-12-08 11:45:02,817] Trial 89 finished with value: 0.23376896054622312 and parameters: {'model_type': 'gcn', 'hidden_dims': '[512, 64]', 'dropout': 0.5461408126508122, 'batch_norm': True, 'lr': 0.00046310228239226545, 'weight_decay': 7.885149198209881e-05, 'epochs': 100, 'loss': 'mae', 'optimizer': 'adam', 'graph_mode': 'knn', 'knn_k': 5, 'weighted_edges': True, 'symmetrize_mode': 'mutual', 'self_loops': False, 'use_snp_selection': True, 'num_snps': 57448}. Best is trial 27 with value: 0.3149905766649259.
[I 2025-12-08 11:45:13,861] Trial 90 finished with value: 0.2901195593821916 and parameters: {'model_type': 'gcn', 'hidden_dims': '[256, 128, 64]', 'dropout': 0.39564175391484846, 'batch_norm': True, 'lr': 0.0008362759904375534, 'weight_decay': 4.3576712886378006e-05, 'epochs': 64, 'loss': 'mse', 'optimizer': 'adam', 'graph_mode': 'cutoff', 'cutoff': 0.7734639835641421, 'grm_norm': 'none', 'self_loops': False, 'use_snp_selection': True, 'num_snps': 9199}. Best is trial 27 with value: 0.3149905766649259.
[I 2025-12-08 11:45:38,530] Trial 91 finished with value: 0.3116075168678417 and parameters: {'model_type': 'gcn', 'hidden_dims': '[256, 128, 64]', 'dropout': 0.4738966033337083, 'batch_norm': True, 'lr': 0.000281418182399597, 'weight_decay': 1.9426975877499168e-05, 'epochs': 97, 'loss': 'mae', 'optimizer': 'adam', 'graph_mode': 'cutoff', 'cutoff': 0.8487474216431129, 'grm_norm': 'gcn', 'self_loops': False, 'use_snp_selection': True, 'num_snps': 45796}. Best is trial 27 with value: 0.3149905766649259.
[I 2025-12-08 11:45:59,979] Trial 92 finished with value: 0.3023701550707366 and parameters: {'model_type': 'gcn', 'hidden_dims': '[256, 128, 64]', 'dropout': 0.44927276770345864, 'batch_norm': True, 'lr': 0.00022734364576477886, 'weight_decay': 2.9539058650515782e-05, 'epochs': 111, 'loss': 'mae', 'optimizer': 'adam', 'graph_mode': 'cutoff', 'cutoff': 0.8551409910988643, 'grm_norm': 'gcn', 'self_loops': False, 'use_snp_selection': True, 'num_snps': 33594}. Best is trial 27 with value: 0.3149905766649259.
[I 2025-12-08 11:46:20,797] Trial 93 finished with value: 0.29533640547288553 and parameters: {'model_type': 'gcn', 'hidden_dims': '[256, 128, 64]', 'dropout': 0.41573993865169034, 'batch_norm': True, 'lr': 0.00027630382493966957, 'weight_decay': 1.1370321714483156e-05, 'epochs': 80, 'loss': 'mae', 'optimizer': 'adam', 'graph_mode': 'cutoff', 'cutoff': 0.8082693096399574, 'grm_norm': 'gcn', 'self_loops': False, 'use_snp_selection': True, 'num_snps': 38708}. Best is trial 27 with value: 0.3149905766649259.
[I 2025-12-08 11:46:37,004] Trial 94 finished with value: 0.31031957493607165 and parameters: {'model_type': 'gcn', 'hidden_dims': '[256, 128, 64]', 'dropout': 0.466880439680882, 'batch_norm': True, 'lr': 0.00031766014105506714, 'weight_decay': 5.48112327996537e-05, 'epochs': 72, 'loss': 'mae', 'optimizer': 'adam', 'graph_mode': 'cutoff', 'cutoff': 0.8393730696284379, 'grm_norm': 'gcn', 'self_loops': False, 'use_snp_selection': True, 'num_snps': 25522}. Best is trial 27 with value: 0.3149905766649259.
[I 2025-12-08 11:46:56,239] Trial 95 finished with value: 0.30233691737437995 and parameters: {'model_type': 'gcn', 'hidden_dims': '[256, 128, 64]', 'dropout': 0.4773563381133669, 'batch_norm': True, 'lr': 0.0003394877318135919, 'weight_decay': 5.443862161931763e-05, 'epochs': 120, 'loss': 'mae', 'optimizer': 'adam', 'graph_mode': 'cutoff', 'cutoff': 0.8312384004369042, 'grm_norm': 'gcn', 'self_loops': False, 'use_snp_selection': True, 'num_snps': 25791}. Best is trial 27 with value: 0.3149905766649259.
[I 2025-12-08 11:47:12,617] Trial 96 finished with value: 0.30375895499441236 and parameters: {'model_type': 'gcn', 'hidden_dims': '[256, 128, 64]', 'dropout': 0.49121186264509886, 'batch_norm': True, 'lr': 0.0005772440564221659, 'weight_decay': 3.5854241403525316e-05, 'epochs': 88, 'loss': 'mae', 'optimizer': 'adam', 'graph_mode': 'cutoff', 'cutoff': 0.8545501649949173, 'grm_norm': 'gcn', 'self_loops': False, 'use_snp_selection': True, 'num_snps': 23231}. Best is trial 27 with value: 0.3149905766649259.
[I 2025-12-08 11:47:29,633] Trial 97 finished with value: 0.2476159041387044 and parameters: {'model_type': 'gcn', 'hidden_dims': '[256, 128, 64]', 'dropout': 0.47216381698401755, 'batch_norm': True, 'lr': 1.7783281953065596e-05, 'weight_decay': 7.682265161642067e-05, 'epochs': 71, 'loss': 'mae', 'optimizer': 'adam', 'graph_mode': 'cutoff', 'cutoff': 0.8798826297532046, 'grm_norm': 'gcn', 'self_loops': False, 'use_snp_selection': True, 'num_snps': 28447}. Best is trial 27 with value: 0.3149905766649259.
[I 2025-12-08 11:47:53,290] Trial 98 finished with value: 0.2852627803211874 and parameters: {'model_type': 'gcn', 'hidden_dims': '[256, 128, 64]', 'dropout': 0.5309635073432791, 'batch_norm': True, 'lr': 0.008570863261013044, 'weight_decay': 0.00014110155545302085, 'epochs': 294, 'loss': 'mae', 'optimizer': 'adam', 'graph_mode': 'cutoff', 'cutoff': 0.8346736277795254, 'grm_norm': 'gcn', 'self_loops': False, 'use_snp_selection': True, 'num_snps': 16833}. Best is trial 27 with value: 0.3149905766649259.
[I 2025-12-08 11:48:17,654] Trial 99 finished with value: 0.09422224157181794 and parameters: {'model_type': 'gcn', 'hidden_dims': '[512, 256]', 'dropout': 0.5075119583369719, 'batch_norm': False, 'lr': 0.0004709976501835178, 'weight_decay': 1.7356739062925283e-07, 'epochs': 58, 'loss': 'mae', 'optimizer': 'adam', 'graph_mode': 'cutoff', 'cutoff': 0.8052994835575374, 'grm_norm': 'gcn', 'self_loops': False, 'use_snp_selection': True, 'num_snps': 43043}. Best is trial 27 with value: 0.3149905766649259.
[I 2025-12-08 11:48:43,564] Trial 100 finished with value: 0.29867766928004597 and parameters: {'model_type': 'gcn', 'hidden_dims': '[256, 128, 64]', 'dropout': 0.33319676802558823, 'batch_norm': True, 'lr': 0.0003128593346382619, 'weight_decay': 2.49054042370821e-05, 'epochs': 99, 'loss': 'mae', 'optimizer': 'adam', 'graph_mode': 'cutoff', 'cutoff': 0.8604163005142107, 'grm_norm': 'gcn', 'self_loops': True, 'use_snp_selection': True, 'num_snps': 48833}. Best is trial 27 with value: 0.3149905766649259.
[I 2025-12-08 11:48:55,814] Trial 101 finished with value: 0.30219904025903593 and parameters: {'model_type': 'gcn', 'hidden_dims': '[256, 128, 64]', 'dropout': 0.4426156908571094, 'batch_norm': True, 'lr': 0.0002103325264514864, 'weight_decay': 1.844584725734019e-05, 'epochs': 83, 'loss': 'mae', 'optimizer': 'adam', 'graph_mode': 'cutoff', 'cutoff': 0.7620599398937625, 'grm_norm': 'cosine_then_gcn', 'self_loops': False, 'use_snp_selection': False}. Best is trial 27 with value: 0.3149905766649259.
[I 2025-12-08 11:49:15,739] Trial 102 finished with value: 0.3046850128575507 and parameters: {'model_type': 'gcn', 'hidden_dims': '[256, 128, 64]', 'dropout': 0.43428164200522346, 'batch_norm': True, 'lr': 0.000377557605903503, 'weight_decay': 4.302794150780478e-05, 'epochs': 104, 'loss': 'mae', 'optimizer': 'adam', 'graph_mode': 'cutoff', 'cutoff': 0.7904778578900973, 'grm_norm': 'gcn', 'self_loops': False, 'use_snp_selection': True, 'num_snps': 30833}. Best is trial 27 with value: 0.3149905766649259.
[I 2025-12-08 11:49:39,562] Trial 103 finished with value: 0.30507261824299287 and parameters: {'model_type': 'gcn', 'hidden_dims': '[256, 128]', 'dropout': 0.4583367381857127, 'batch_norm': True, 'lr': 0.0002823525679820863, 'weight_decay': 1.3001525102106367e-05, 'epochs': 92, 'loss': 'mae', 'optimizer': 'adam', 'graph_mode': 'cutoff', 'cutoff': 0.8205949161320468, 'grm_norm': 'gcn', 'self_loops': False, 'use_snp_selection': True, 'num_snps': 46368}. Best is trial 27 with value: 0.3149905766649259.
[I 2025-12-08 11:49:50,366] Trial 104 finished with value: 0.2985659579620715 and parameters: {'model_type': 'gcn', 'hidden_dims': '[256, 128, 64]', 'dropout': 0.4702989752867081, 'batch_norm': True, 'lr': 0.00016402841706722926, 'weight_decay': 5.443340950898129e-06, 'epochs': 71, 'loss': 'mae', 'optimizer': 'adam', 'graph_mode': 'cutoff', 'cutoff': 0.7401912655609562, 'grm_norm': 'cosine', 'self_loops': False, 'use_snp_selection': False}. Best is trial 27 with value: 0.3149905766649259.
[I 2025-12-08 11:50:18,551] Trial 105 finished with value: 0.2972234151381441 and parameters: {'model_type': 'gcn', 'hidden_dims': '[256, 128, 64]', 'dropout': 0.4178493572728964, 'batch_norm': True, 'lr': 0.000137446575790041, 'weight_decay': 6.3310343980078635e-06, 'epochs': 115, 'loss': 'mae', 'optimizer': 'adam', 'graph_mode': 'cutoff', 'cutoff': 0.8419280019102049, 'grm_norm': 'gcn', 'self_loops': False, 'use_snp_selection': True, 'num_snps': 51253}. Best is trial 27 with value: 0.3149905766649259.
[I 2025-12-08 11:50:42,861] Trial 106 finished with value: 0.3031877206297567 and parameters: {'model_type': 'gcn', 'hidden_dims': '[256, 128, 64]', 'dropout': 0.4836414362612911, 'batch_norm': True, 'lr': 0.00023269680928555178, 'weight_decay': 3.094335069616739e-05, 'epochs': 107, 'loss': 'mae', 'optimizer': 'adam', 'graph_mode': 'cutoff', 'cutoff': 0.782963472130893, 'grm_norm': 'gcn', 'self_loops': False, 'use_snp_selection': True, 'num_snps': 42053}. Best is trial 27 with value: 0.3149905766649259.
[I 2025-12-08 11:50:55,295] Trial 107 finished with value: 0.28792828621953587 and parameters: {'model_type': 'gcn', 'hidden_dims': '[128, 64]', 'dropout': 0.3835328691033047, 'batch_norm': True, 'lr': 0.0001906861297250936, 'weight_decay': 2.4260412593433104e-05, 'epochs': 156, 'loss': 'mae', 'optimizer': 'adam', 'graph_mode': 'cutoff', 'cutoff': 0.816897588375649, 'grm_norm': 'cosine_then_gcn', 'self_loops': False, 'use_snp_selection': False}. Best is trial 27 with value: 0.3149905766649259.
[I 2025-12-08 11:51:21,264] Trial 108 finished with value: 0.22858376828583665 and parameters: {'model_type': 'gcn', 'hidden_dims': '[512, 128]', 'dropout': 0.4510307650330293, 'batch_norm': True, 'lr': 0.0004272419344465048, 'weight_decay': 1.3636908423827436e-05, 'epochs': 51, 'loss': 'mae', 'optimizer': 'adam', 'graph_mode': 'knn', 'knn_k': 2, 'weighted_edges': False, 'symmetrize_mode': 'union', 'self_loops': False, 'use_snp_selection': True, 'num_snps': 49493}. Best is trial 27 with value: 0.3149905766649259.
