Running from this directory: /cluster/work/simennes/Project_thesis/Project_thesis
Name of job: gcn_m
ID of job: 23696748
The job was run on these nodes: idun-06-04
[I 2025-12-08 10:17:43,697] Trial 0 finished with value: 0.24221516049015382 and parameters: {'model_type': 'gcn', 'hidden_dims': '[128, 64]', 'dropout': 0.199031432379812, 'batch_norm': True, 'lr': 1.8408544111075823e-05, 'weight_decay': 5.5136510071208614e-05, 'epochs': 336, 'loss': 'mae', 'optimizer': 'adam', 'graph_mode': 'knn', 'knn_k': 8, 'weighted_edges': True, 'symmetrize_mode': 'mutual', 'self_loops': True, 'use_snp_selection': True, 'num_snps': 27173}. Best is trial 0 with value: 0.24221516049015382.
[I 2025-12-08 10:18:22,331] Trial 1 finished with value: 0.2081261628358771 and parameters: {'model_type': 'gcn', 'hidden_dims': '[256, 128, 64]', 'dropout': 0.5543244404043342, 'batch_norm': True, 'lr': 7.981787657617978e-05, 'weight_decay': 2.8571789869344834e-07, 'epochs': 297, 'loss': 'mae', 'optimizer': 'adam', 'graph_mode': 'cutoff', 'cutoff': 0.3392632777751686, 'grm_norm': 'gcn', 'self_loops': False, 'use_snp_selection': False}. Best is trial 0 with value: 0.24221516049015382.
[I 2025-12-08 10:19:20,692] Trial 2 finished with value: 0.20940931228253423 and parameters: {'model_type': 'gcn', 'hidden_dims': '[512, 64]', 'dropout': 0.32815227354739207, 'batch_norm': True, 'lr': 0.000619605044204259, 'weight_decay': 0.0004086269831625786, 'epochs': 206, 'loss': 'mse', 'optimizer': 'adam', 'graph_mode': 'knn', 'knn_k': 4, 'weighted_edges': True, 'symmetrize_mode': 'union', 'self_loops': True, 'use_snp_selection': True, 'num_snps': 53035}. Best is trial 0 with value: 0.24221516049015382.
[I 2025-12-08 10:19:48,391] Trial 3 finished with value: 0.20554637751440774 and parameters: {'model_type': 'gcn', 'hidden_dims': '[256, 128]', 'dropout': 0.23110783056597514, 'batch_norm': True, 'lr': 8.11311593386298e-05, 'weight_decay': 9.296158109581328e-07, 'epochs': 213, 'loss': 'mse', 'optimizer': 'adam', 'graph_mode': 'knn', 'knn_k': 10, 'weighted_edges': True, 'symmetrize_mode': 'mutual', 'self_loops': True, 'use_snp_selection': False}. Best is trial 0 with value: 0.24221516049015382.
[I 2025-12-08 10:20:03,251] Trial 4 finished with value: 0.2696322837812085 and parameters: {'model_type': 'gcn', 'hidden_dims': '[512, 256]', 'dropout': 0.2753281956415665, 'batch_norm': True, 'lr': 0.00034435188114839693, 'weight_decay': 4.9416012835950194e-05, 'epochs': 89, 'loss': 'mae', 'optimizer': 'adam', 'graph_mode': 'cutoff', 'cutoff': 0.820078967317394, 'grm_norm': 'none', 'self_loops': False, 'use_snp_selection': True, 'num_snps': 12674}. Best is trial 4 with value: 0.2696322837812085.
[I 2025-12-08 10:20:28,510] Trial 5 finished with value: 0.2564024407180069 and parameters: {'model_type': 'gcn', 'hidden_dims': '[128, 64]', 'dropout': 0.5611163934517731, 'batch_norm': True, 'lr': 0.0003984856210762587, 'weight_decay': 1.1466743517565185e-07, 'epochs': 344, 'loss': 'mae', 'optimizer': 'adam', 'graph_mode': 'cutoff', 'cutoff': 0.6089370799714728, 'grm_norm': 'gcn', 'self_loops': True, 'use_snp_selection': False}. Best is trial 4 with value: 0.2696322837812085.
[I 2025-12-08 10:20:51,130] Trial 6 finished with value: 0.238679528080548 and parameters: {'model_type': 'gcn', 'hidden_dims': '[128, 64]', 'dropout': 0.31805912766941713, 'batch_norm': True, 'lr': 1.2361026034262557e-05, 'weight_decay': 6.492620232791903e-06, 'epochs': 271, 'loss': 'mse', 'optimizer': 'adam', 'graph_mode': 'cutoff', 'cutoff': 0.6193362582230448, 'grm_norm': 'cosine', 'self_loops': False, 'use_snp_selection': True, 'num_snps': 28594}. Best is trial 4 with value: 0.2696322837812085.
[I 2025-12-08 10:21:11,043] Trial 7 finished with value: 0.24577622758943232 and parameters: {'model_type': 'gcn', 'hidden_dims': '[512, 64]', 'dropout': 0.471337288649717, 'batch_norm': True, 'lr': 2.239693207292708e-05, 'weight_decay': 2.263166635514082e-06, 'epochs': 69, 'loss': 'mse', 'optimizer': 'adam', 'graph_mode': 'cutoff', 'cutoff': 0.4056820886426376, 'grm_norm': 'cosine', 'self_loops': False, 'use_snp_selection': False}. Best is trial 4 with value: 0.2696322837812085.
[I 2025-12-08 10:21:48,870] Trial 8 finished with value: 0.25622261131407864 and parameters: {'model_type': 'gcn', 'hidden_dims': '[512, 256]', 'dropout': 0.20659328268932406, 'batch_norm': False, 'lr': 8.93315124361372e-05, 'weight_decay': 0.00028987480727919035, 'epochs': 136, 'loss': 'mae', 'optimizer': 'adam', 'graph_mode': 'knn', 'knn_k': 3, 'weighted_edges': False, 'symmetrize_mode': 'union', 'self_loops': False, 'use_snp_selection': True, 'num_snps': 43128}. Best is trial 4 with value: 0.2696322837812085.
[I 2025-12-08 10:22:31,199] Trial 9 finished with value: 0.12953331113433073 and parameters: {'model_type': 'gcn', 'hidden_dims': '[512, 256]', 'dropout': 0.2888209592870401, 'batch_norm': False, 'lr': 0.004734648143129892, 'weight_decay': 1.5879705591356368e-06, 'epochs': 163, 'loss': 'mse', 'optimizer': 'adam', 'graph_mode': 'cutoff', 'cutoff': 0.5984899797909019, 'grm_norm': 'cosine', 'self_loops': True, 'use_snp_selection': False}. Best is trial 4 with value: 0.2696322837812085.
[I 2025-12-08 10:22:40,935] Trial 10 finished with value: 0.23804722091213332 and parameters: {'model_type': 'gcn', 'hidden_dims': '[512, 128]', 'dropout': 0.11372025982957354, 'batch_norm': False, 'lr': 0.0023343012062770553, 'weight_decay': 4.14440562940608e-05, 'epochs': 41, 'loss': 'mae', 'optimizer': 'adam', 'graph_mode': 'cutoff', 'cutoff': 0.8740100033033124, 'grm_norm': 'none', 'self_loops': False, 'use_snp_selection': True, 'num_snps': 3859}. Best is trial 4 with value: 0.2696322837812085.
[I 2025-12-08 10:22:50,320] Trial 11 finished with value: 0.27148752670297127 and parameters: {'model_type': 'gcn', 'hidden_dims': '[128, 64]', 'dropout': 0.44863014119095845, 'batch_norm': True, 'lr': 0.0005943392021247852, 'weight_decay': 1.0655358607693621e-07, 'epochs': 110, 'loss': 'mae', 'optimizer': 'adam', 'graph_mode': 'cutoff', 'cutoff': 0.8568899271933978, 'grm_norm': 'cosine_then_gcn', 'self_loops': True, 'use_snp_selection': False}. Best is trial 11 with value: 0.27148752670297127.
[I 2025-12-08 10:23:02,470] Trial 12 finished with value: 0.24777156176547405 and parameters: {'model_type': 'gcn', 'hidden_dims': '[512, 256]', 'dropout': 0.42758862319180935, 'batch_norm': True, 'lr': 0.0012059085553112938, 'weight_decay': 3.482253699955131e-05, 'epochs': 103, 'loss': 'mae', 'optimizer': 'adam', 'graph_mode': 'cutoff', 'cutoff': 0.8919050080438428, 'grm_norm': 'cosine_then_gcn', 'self_loops': True, 'use_snp_selection': True, 'num_snps': 6176}. Best is trial 11 with value: 0.27148752670297127.
[I 2025-12-08 10:23:15,897] Trial 13 finished with value: 0.2738035487514342 and parameters: {'model_type': 'gcn', 'hidden_dims': '[256, 128]', 'dropout': 0.4452783958423849, 'batch_norm': True, 'lr': 0.00028764898471530923, 'weight_decay': 8.746795324277564e-06, 'epochs': 96, 'loss': 'mae', 'optimizer': 'adam', 'graph_mode': 'cutoff', 'cutoff': 0.7596101551526167, 'grm_norm': 'cosine_then_gcn', 'self_loops': False, 'use_snp_selection': False}. Best is trial 13 with value: 0.2738035487514342.
[I 2025-12-08 10:23:33,730] Trial 14 finished with value: 0.025381449013415852 and parameters: {'model_type': 'gcn', 'hidden_dims': '[256, 128]', 'dropout': 0.4280653677930823, 'batch_norm': False, 'lr': 0.009430566714901507, 'weight_decay': 7.081154721639774e-06, 'epochs': 135, 'loss': 'mae', 'optimizer': 'adam', 'graph_mode': 'cutoff', 'cutoff': 0.7240625816402448, 'grm_norm': 'cosine_then_gcn', 'self_loops': True, 'use_snp_selection': False}. Best is trial 13 with value: 0.2738035487514342.
[I 2025-12-08 10:23:56,002] Trial 15 finished with value: 0.27452945165141396 and parameters: {'model_type': 'gcn', 'hidden_dims': '[256, 128]', 'dropout': 0.4827864904294467, 'batch_norm': True, 'lr': 0.000166827860779801, 'weight_decay': 4.104169171058631e-07, 'epochs': 172, 'loss': 'mae', 'optimizer': 'adam', 'graph_mode': 'cutoff', 'cutoff': 0.7416328481826706, 'grm_norm': 'cosine_then_gcn', 'self_loops': False, 'use_snp_selection': False}. Best is trial 15 with value: 0.27452945165141396.
[I 2025-12-08 10:24:18,936] Trial 16 finished with value: 0.2765782793070864 and parameters: {'model_type': 'gcn', 'hidden_dims': '[256, 128]', 'dropout': 0.4988064344225382, 'batch_norm': True, 'lr': 0.00013435944502646522, 'weight_decay': 5.765994922406727e-07, 'epochs': 178, 'loss': 'mae', 'optimizer': 'adam', 'graph_mode': 'cutoff', 'cutoff': 0.7325220926026036, 'grm_norm': 'cosine_then_gcn', 'self_loops': False, 'use_snp_selection': False}. Best is trial 16 with value: 0.2765782793070864.
[I 2025-12-08 10:24:49,244] Trial 17 finished with value: 0.2361341088400061 and parameters: {'model_type': 'gcn', 'hidden_dims': '[256, 128]', 'dropout': 0.5101604050085489, 'batch_norm': True, 'lr': 0.00014056876271838377, 'weight_decay': 4.5817280187175797e-07, 'epochs': 240, 'loss': 'mae', 'optimizer': 'adam', 'graph_mode': 'cutoff', 'cutoff': 0.47124703497060155, 'grm_norm': 'cosine_then_gcn', 'self_loops': False, 'use_snp_selection': False}. Best is trial 16 with value: 0.2765782793070864.
[I 2025-12-08 10:25:12,008] Trial 18 finished with value: 0.24290912814818957 and parameters: {'model_type': 'gcn', 'hidden_dims': '[256, 128]', 'dropout': 0.38212844504793647, 'batch_norm': False, 'lr': 3.997746938164808e-05, 'weight_decay': 4.3670466594028547e-07, 'epochs': 178, 'loss': 'mae', 'optimizer': 'adam', 'graph_mode': 'knn', 'knn_k': 1, 'weighted_edges': False, 'symmetrize_mode': 'mutual', 'self_loops': False, 'use_snp_selection': False}. Best is trial 16 with value: 0.2765782793070864.
[I 2025-12-08 10:26:10,282] Trial 19 finished with value: 0.2674681196977719 and parameters: {'model_type': 'gcn', 'hidden_dims': '[512, 128]', 'dropout': 0.5972327215560366, 'batch_norm': True, 'lr': 0.00015649218402835204, 'weight_decay': 2.8530306652714535e-06, 'epochs': 229, 'loss': 'mae', 'optimizer': 'adam', 'graph_mode': 'cutoff', 'cutoff': 0.7005048718600966, 'grm_norm': 'cosine_then_gcn', 'self_loops': False, 'use_snp_selection': False}. Best is trial 16 with value: 0.2765782793070864.
[I 2025-12-08 10:26:32,293] Trial 20 finished with value: 0.20907085874311973 and parameters: {'model_type': 'gcn', 'hidden_dims': '[256, 128, 64]', 'dropout': 0.38284547527628443, 'batch_norm': True, 'lr': 0.001349917624742507, 'weight_decay': 2.925360556149358e-07, 'epochs': 158, 'loss': 'mae', 'optimizer': 'adam', 'graph_mode': 'cutoff', 'cutoff': 0.2386548621641688, 'grm_norm': 'cosine_then_gcn', 'self_loops': False, 'use_snp_selection': False}. Best is trial 16 with value: 0.2765782793070864.
[I 2025-12-08 10:26:50,903] Trial 21 finished with value: 0.2688939518370589 and parameters: {'model_type': 'gcn', 'hidden_dims': '[256, 128]', 'dropout': 0.4995923992730177, 'batch_norm': True, 'lr': 0.00021749770176620242, 'weight_decay': 9.742563207497613e-07, 'epochs': 141, 'loss': 'mae', 'optimizer': 'adam', 'graph_mode': 'cutoff', 'cutoff': 0.7453625319650883, 'grm_norm': 'cosine_then_gcn', 'self_loops': False, 'use_snp_selection': False}. Best is trial 16 with value: 0.2765782793070864.
[I 2025-12-08 10:27:14,614] Trial 22 finished with value: 0.27048362428574785 and parameters: {'model_type': 'gcn', 'hidden_dims': '[256, 128]', 'dropout': 0.5187814043485741, 'batch_norm': True, 'lr': 4.330915799594463e-05, 'weight_decay': 1.7143144585263563e-05, 'epochs': 185, 'loss': 'mae', 'optimizer': 'adam', 'graph_mode': 'cutoff', 'cutoff': 0.7816592109013584, 'grm_norm': 'cosine_then_gcn', 'self_loops': False, 'use_snp_selection': False}. Best is trial 16 with value: 0.2765782793070864.
[I 2025-12-08 10:27:46,499] Trial 23 finished with value: 0.27299191848945364 and parameters: {'model_type': 'gcn', 'hidden_dims': '[256, 128]', 'dropout': 0.3905710881414786, 'batch_norm': True, 'lr': 0.0002706416480374768, 'weight_decay': 3.4674185201620555e-06, 'epochs': 256, 'loss': 'mae', 'optimizer': 'adam', 'graph_mode': 'cutoff', 'cutoff': 0.6814387775640732, 'grm_norm': 'cosine_then_gcn', 'self_loops': False, 'use_snp_selection': False}. Best is trial 16 with value: 0.2765782793070864.
[I 2025-12-08 10:27:55,894] Trial 24 finished with value: 0.2552283041650393 and parameters: {'model_type': 'gcn', 'hidden_dims': '[256, 128]', 'dropout': 0.480119646714641, 'batch_norm': True, 'lr': 0.00014091076752885713, 'weight_decay': 0.00019043976967177378, 'epochs': 61, 'loss': 'mae', 'optimizer': 'adam', 'graph_mode': 'cutoff', 'cutoff': 0.5463911477101597, 'grm_norm': 'cosine_then_gcn', 'self_loops': False, 'use_snp_selection': False}. Best is trial 16 with value: 0.2765782793070864.
[I 2025-12-08 10:28:11,316] Trial 25 finished with value: 0.27876768099714916 and parameters: {'model_type': 'gcn', 'hidden_dims': '[256, 128]', 'dropout': 0.5473785408671414, 'batch_norm': True, 'lr': 0.0005495017432705478, 'weight_decay': 1.648665959189506e-05, 'epochs': 115, 'loss': 'mae', 'optimizer': 'adam', 'graph_mode': 'cutoff', 'cutoff': 0.7915465509137563, 'grm_norm': 'none', 'self_loops': False, 'use_snp_selection': False}. Best is trial 25 with value: 0.27876768099714916.
[I 2025-12-08 10:28:28,370] Trial 26 finished with value: 0.05600359385802206 and parameters: {'model_type': 'gcn', 'hidden_dims': '[256, 128]', 'dropout': 0.545514460990332, 'batch_norm': False, 'lr': 0.0008030084542038695, 'weight_decay': 0.0009422211166401505, 'epochs': 124, 'loss': 'mse', 'optimizer': 'adam', 'graph_mode': 'knn', 'knn_k': 6, 'weighted_edges': False, 'symmetrize_mode': 'union', 'self_loops': False, 'use_snp_selection': False}. Best is trial 25 with value: 0.27876768099714916.
[I 2025-12-08 10:28:49,568] Trial 27 finished with value: 0.2725853722270299 and parameters: {'model_type': 'gcn', 'hidden_dims': '[256, 128]', 'dropout': 0.5866195118297565, 'batch_norm': True, 'lr': 0.0018942752845603574, 'weight_decay': 2.0964181892187084e-05, 'epochs': 165, 'loss': 'mae', 'optimizer': 'adam', 'graph_mode': 'cutoff', 'cutoff': 0.6773122776925794, 'grm_norm': 'none', 'self_loops': False, 'use_snp_selection': False}. Best is trial 25 with value: 0.27876768099714916.
[I 2025-12-08 10:29:38,968] Trial 28 finished with value: 0.2575270709261031 and parameters: {'model_type': 'gcn', 'hidden_dims': '[512, 128]', 'dropout': 0.5346551021378813, 'batch_norm': True, 'lr': 4.446294938689993e-05, 'weight_decay': 0.00011090291108731557, 'epochs': 193, 'loss': 'mae', 'optimizer': 'adam', 'graph_mode': 'cutoff', 'cutoff': 0.7824153175601855, 'grm_norm': 'none', 'self_loops': False, 'use_snp_selection': False}. Best is trial 25 with value: 0.27876768099714916.
[I 2025-12-08 10:30:08,187] Trial 29 finished with value: 0.2055083986031503 and parameters: {'model_type': 'gcn', 'hidden_dims': '[256, 128, 64]', 'dropout': 0.4895303325860637, 'batch_norm': True, 'lr': 0.0004910967271690505, 'weight_decay': 1.746533585856546e-07, 'epochs': 218, 'loss': 'mae', 'optimizer': 'adam', 'graph_mode': 'knn', 'knn_k': 10, 'weighted_edges': False, 'symmetrize_mode': 'mutual', 'self_loops': False, 'use_snp_selection': False}. Best is trial 25 with value: 0.27876768099714916.
[I 2025-12-08 10:31:21,442] Trial 30 finished with value: 0.21528728472366548 and parameters: {'model_type': 'gcn', 'hidden_dims': '[512, 64]', 'dropout': 0.5731807032075448, 'batch_norm': True, 'lr': 0.00018992414494164658, 'weight_decay': 1.0263181471142744e-06, 'epochs': 291, 'loss': 'mae', 'optimizer': 'adam', 'graph_mode': 'cutoff', 'cutoff': 0.5295640719489217, 'grm_norm': 'none', 'self_loops': False, 'use_snp_selection': False}. Best is trial 25 with value: 0.27876768099714916.
[I 2025-12-08 10:31:33,181] Trial 31 finished with value: 0.26641160203809944 and parameters: {'model_type': 'gcn', 'hidden_dims': '[256, 128]', 'dropout': 0.45895951736683505, 'batch_norm': True, 'lr': 0.0002795284951992744, 'weight_decay': 1.1444663928934185e-05, 'epochs': 83, 'loss': 'mae', 'optimizer': 'adam', 'graph_mode': 'cutoff', 'cutoff': 0.8123247449068061, 'grm_norm': 'gcn', 'self_loops': False, 'use_snp_selection': False}. Best is trial 25 with value: 0.27876768099714916.
[I 2025-12-08 10:31:48,679] Trial 32 finished with value: 0.2760201983495424 and parameters: {'model_type': 'gcn', 'hidden_dims': '[256, 128]', 'dropout': 0.4187637786164813, 'batch_norm': True, 'lr': 0.0009598730311731108, 'weight_decay': 4.509501695378453e-06, 'epochs': 114, 'loss': 'mae', 'optimizer': 'adam', 'graph_mode': 'cutoff', 'cutoff': 0.7488840740330607, 'grm_norm': 'cosine_then_gcn', 'self_loops': False, 'use_snp_selection': False}. Best is trial 25 with value: 0.27876768099714916.
[I 2025-12-08 10:32:03,761] Trial 33 finished with value: 0.271817621290395 and parameters: {'model_type': 'gcn', 'hidden_dims': '[256, 128]', 'dropout': 0.3984173703588947, 'batch_norm': True, 'lr': 0.0009653401668603164, 'weight_decay': 4.852641239864643e-06, 'epochs': 112, 'loss': 'mae', 'optimizer': 'adam', 'graph_mode': 'cutoff', 'cutoff': 0.6588427658299062, 'grm_norm': 'none', 'self_loops': False, 'use_snp_selection': False}. Best is trial 25 with value: 0.27876768099714916.
[I 2025-12-08 10:32:23,875] Trial 34 finished with value: 0.27214875069757516 and parameters: {'model_type': 'gcn', 'hidden_dims': '[256, 128]', 'dropout': 0.35651527252642895, 'batch_norm': True, 'lr': 0.0030111677157779577, 'weight_decay': 7.985921180056327e-07, 'epochs': 154, 'loss': 'mae', 'optimizer': 'adam', 'graph_mode': 'cutoff', 'cutoff': 0.8298923808720116, 'grm_norm': 'cosine_then_gcn', 'self_loops': False, 'use_snp_selection': False}. Best is trial 25 with value: 0.27876768099714916.
[I 2025-12-08 10:32:51,076] Trial 35 finished with value: 0.19879816140601064 and parameters: {'model_type': 'gcn', 'hidden_dims': '[256, 128, 64]', 'dropout': 0.5351059669870684, 'batch_norm': True, 'lr': 0.00011010031408037672, 'weight_decay': 4.4451966823121323e-07, 'epochs': 206, 'loss': 'mse', 'optimizer': 'adam', 'graph_mode': 'knn', 'knn_k': 1, 'weighted_edges': True, 'symmetrize_mode': 'union', 'self_loops': False, 'use_snp_selection': False}. Best is trial 25 with value: 0.27876768099714916.
[I 2025-12-08 10:33:28,086] Trial 36 finished with value: 0.2778421801697297 and parameters: {'model_type': 'gcn', 'hidden_dims': '[256, 128]', 'dropout': 0.41303306450493443, 'batch_norm': True, 'lr': 5.8749072071413896e-05, 'weight_decay': 1.5108064916502688e-06, 'epochs': 178, 'loss': 'mae', 'optimizer': 'adam', 'graph_mode': 'cutoff', 'cutoff': 0.7399604644227653, 'grm_norm': 'cosine_then_gcn', 'self_loops': False, 'use_snp_selection': True, 'num_snps': 55695}. Best is trial 25 with value: 0.27876768099714916.
[I 2025-12-08 10:34:11,541] Trial 37 finished with value: 0.2586174259415245 and parameters: {'model_type': 'gcn', 'hidden_dims': '[512, 64]', 'dropout': 0.43010304404414956, 'batch_norm': True, 'lr': 5.40963862897248e-05, 'weight_decay': 1.7316320682200136e-06, 'epochs': 119, 'loss': 'mae', 'optimizer': 'adam', 'graph_mode': 'cutoff', 'cutoff': 0.6399509701428335, 'grm_norm': 'none', 'self_loops': False, 'use_snp_selection': True, 'num_snps': 58690}. Best is trial 25 with value: 0.27876768099714916.
[I 2025-12-08 10:34:33,350] Trial 38 finished with value: 0.2561155366249259 and parameters: {'model_type': 'gcn', 'hidden_dims': '[128, 64]', 'dropout': 0.3473102116244625, 'batch_norm': True, 'lr': 3.1549978772963224e-05, 'weight_decay': 3.825910438029842e-06, 'epochs': 146, 'loss': 'mse', 'optimizer': 'adam', 'graph_mode': 'cutoff', 'cutoff': 0.7912857687462628, 'grm_norm': 'gcn', 'self_loops': True, 'use_snp_selection': True, 'num_snps': 42466}. Best is trial 25 with value: 0.27876768099714916.
[I 2025-12-08 10:35:18,848] Trial 39 finished with value: 0.25677038544106917 and parameters: {'model_type': 'gcn', 'hidden_dims': '[256, 128]', 'dropout': 0.5576603598981896, 'batch_norm': True, 'lr': 6.588519687165054e-05, 'weight_decay': 9.486956234322586e-05, 'epochs': 327, 'loss': 'mae', 'optimizer': 'adam', 'graph_mode': 'knn', 'knn_k': 6, 'weighted_edges': True, 'symmetrize_mode': 'union', 'self_loops': False, 'use_snp_selection': True, 'num_snps': 44445}. Best is trial 25 with value: 0.27876768099714916.
[I 2025-12-08 10:35:33,603] Trial 40 finished with value: 0.25716887984090386 and parameters: {'model_type': 'gcn', 'hidden_dims': '[256, 128]', 'dropout': 0.30995901700270595, 'batch_norm': False, 'lr': 0.0004407921996853279, 'weight_decay': 1.6185264382401898e-05, 'epochs': 77, 'loss': 'mse', 'optimizer': 'adam', 'graph_mode': 'cutoff', 'cutoff': 0.7170340603561789, 'grm_norm': 'cosine_then_gcn', 'self_loops': False, 'use_snp_selection': True, 'num_snps': 20466}. Best is trial 25 with value: 0.27876768099714916.
[I 2025-12-08 10:36:09,438] Trial 41 finished with value: 0.27548919797460386 and parameters: {'model_type': 'gcn', 'hidden_dims': '[256, 128]', 'dropout': 0.4169091788039798, 'batch_norm': True, 'lr': 8.306509418881116e-05, 'weight_decay': 6.825988624435297e-07, 'epochs': 178, 'loss': 'mae', 'optimizer': 'adam', 'graph_mode': 'cutoff', 'cutoff': 0.7667410977306188, 'grm_norm': 'cosine_then_gcn', 'self_loops': False, 'use_snp_selection': True, 'num_snps': 53608}. Best is trial 25 with value: 0.27876768099714916.
[I 2025-12-08 10:36:45,831] Trial 42 finished with value: 0.25470593693204496 and parameters: {'model_type': 'gcn', 'hidden_dims': '[256, 128]', 'dropout': 0.40446989264803185, 'batch_norm': True, 'lr': 2.4294923227098247e-05, 'weight_decay': 1.5050257552030394e-06, 'epochs': 195, 'loss': 'mae', 'optimizer': 'adam', 'graph_mode': 'cutoff', 'cutoff': 0.8261168027539186, 'grm_norm': 'cosine_then_gcn', 'self_loops': False, 'use_snp_selection': True, 'num_snps': 51392}. Best is trial 25 with value: 0.27876768099714916.
