[I 2025-12-08 16:14:47,823] Trial 8 finished with value: 0.27124878929564356 and parameters: {'model_type': 'gcn', 'hidden_dims': '[512, 256]', 'dropout': 0.20659328268932406, 'batch_norm': False, 'lr': 8.93315124361372e-05, 'weight_decay': 0.00028987480727919035, 'epochs': 136, 'loss': 'mae', 'optimizer': 'adam', 'graph_mode': 'knn', 'knn_k': 3, 'weighted_edges': False, 'symmetrize_mode': 'union', 'self_loops': False, 'use_snp_selection': True, 'num_snps': 43128}. Best is trial 4 with value: 0.2846439443519822.
[I 2025-12-08 16:15:30,034] Trial 9 finished with value: 0.007938232562780386 and parameters: {'model_type': 'gcn', 'hidden_dims': '[512, 256]', 'dropout': 0.2888209592870401, 'batch_norm': False, 'lr': 0.004734648143129892, 'weight_decay': 1.5879705591356368e-06, 'epochs': 163, 'loss': 'mse', 'optimizer': 'adam', 'graph_mode': 'cutoff', 'cutoff': 0.5984899797909019, 'grm_norm': 'cosine', 'self_loops': True, 'use_snp_selection': False}. Best is trial 4 with value: 0.2846439443519822.
[I 2025-12-08 16:15:39,218] Trial 10 finished with value: 0.2610682330576332 and parameters: {'model_type': 'gcn', 'hidden_dims': '[512, 128]', 'dropout': 0.11372025982957354, 'batch_norm': False, 'lr': 0.0023343012062770553, 'weight_decay': 4.14440562940608e-05, 'epochs': 41, 'loss': 'mae', 'optimizer': 'adam', 'graph_mode': 'cutoff', 'cutoff': 0.8740100033033124, 'grm_norm': 'none', 'self_loops': False, 'use_snp_selection': True, 'num_snps': 3859}. Best is trial 4 with value: 0.2846439443519822.
[I 2025-12-08 16:16:15,669] Trial 11 finished with value: 0.2515074836833239 and parameters: {'model_type': 'gcn', 'hidden_dims': '[512, 256]', 'dropout': 0.42220860806405436, 'batch_norm': False, 'lr': 0.00012587284186352953, 'weight_decay': 0.0006590033092812647, 'epochs': 114, 'loss': 'mae', 'optimizer': 'adam', 'graph_mode': 'knn', 'knn_k': 1, 'weighted_edges': False, 'symmetrize_mode': 'union', 'self_loops': False, 'use_snp_selection': True, 'num_snps': 47068}. Best is trial 4 with value: 0.2846439443519822.
[I 2025-12-08 16:16:30,400] Trial 12 finished with value: 0.27065038037558253 and parameters: {'model_type': 'gcn', 'hidden_dims': '[512, 256]', 'dropout': 0.14142767069304862, 'batch_norm': False, 'lr': 0.0011798598123878552, 'weight_decay': 9.414718277089941e-05, 'epochs': 124, 'loss': 'mae', 'optimizer': 'adam', 'graph_mode': 'knn', 'knn_k': 3, 'weighted_edges': False, 'symmetrize_mode': 'union', 'self_loops': False, 'use_snp_selection': True, 'num_snps': 8584}. Best is trial 4 with value: 0.2846439443519822.
[I 2025-12-08 16:17:01,340] Trial 13 finished with value: 0.2605630410501295 and parameters: {'model_type': 'gcn', 'hidden_dims': '[512, 256]', 'dropout': 0.23483876358445724, 'batch_norm': False, 'lr': 0.00018005512155234809, 'weight_decay': 0.00018148625050029915, 'epochs': 101, 'loss': 'mae', 'optimizer': 'adam', 'graph_mode': 'knn', 'knn_k': 6, 'weighted_edges': False, 'symmetrize_mode': 'union', 'self_loops': False, 'use_snp_selection': True, 'num_snps': 39863}. Best is trial 4 with value: 0.2846439443519822.
[I 2025-12-08 16:17:23,383] Trial 14 finished with value: 0.2867309967808293 and parameters: {'model_type': 'gcn', 'hidden_dims': '[512, 256]', 'dropout': 0.4067858367430304, 'batch_norm': False, 'lr': 4.4123569663419664e-05, 'weight_decay': 2.2203297076850073e-05, 'epochs': 165, 'loss': 'mae', 'optimizer': 'adam', 'graph_mode': 'cutoff', 'cutoff': 0.8944237199027842, 'grm_norm': 'none', 'self_loops': False, 'use_snp_selection': True, 'num_snps': 17117}. Best is trial 14 with value: 0.2867309967808293.
[I 2025-12-08 16:17:41,584] Trial 15 finished with value: 0.2712791893255085 and parameters: {'model_type': 'gcn', 'hidden_dims': '[256, 128, 64]', 'dropout': 0.4038548841002544, 'batch_norm': False, 'lr': 3.7746842564691134e-05, 'weight_decay': 1.3728672854267767e-05, 'epochs': 164, 'loss': 'mae', 'optimizer': 'adam', 'graph_mode': 'cutoff', 'cutoff': 0.8872255416714164, 'grm_norm': 'none', 'self_loops': False, 'use_snp_selection': True, 'num_snps': 17749}. Best is trial 14 with value: 0.2867309967808293.
[I 2025-12-08 16:18:09,984] Trial 16 finished with value: 0.27377820819232795 and parameters: {'model_type': 'gcn', 'hidden_dims': '[512, 128]', 'dropout': 0.38217627986383895, 'batch_norm': True, 'lr': 0.0007859314805152761, 'weight_decay': 1.585184858108273e-05, 'epochs': 243, 'loss': 'mae', 'optimizer': 'adam', 'graph_mode': 'cutoff', 'cutoff': 0.7714575519927706, 'grm_norm': 'none', 'self_loops': False, 'use_snp_selection': True, 'num_snps': 17408}. Best is trial 14 with value: 0.2867309967808293.
[I 2025-12-08 16:18:25,912] Trial 17 finished with value: 0.2774717290240642 and parameters: {'model_type': 'gcn', 'hidden_dims': '[512, 256]', 'dropout': 0.4790101376152853, 'batch_norm': False, 'lr': 0.00023701675117024075, 'weight_decay': 5.633813841868188e-06, 'epochs': 79, 'loss': 'mae', 'optimizer': 'adam', 'graph_mode': 'cutoff', 'cutoff': 0.7430449078328386, 'grm_norm': 'cosine_then_gcn', 'self_loops': False, 'use_snp_selection': True, 'num_snps': 15971}. Best is trial 14 with value: 0.2867309967808293.
[I 2025-12-08 16:18:41,458] Trial 18 finished with value: 0.2561579296951261 and parameters: {'model_type': 'gcn', 'hidden_dims': '[256, 128]', 'dropout': 0.2802852368181955, 'batch_norm': False, 'lr': 0.009001403382035356, 'weight_decay': 2.9935088137514655e-05, 'epochs': 171, 'loss': 'mae', 'optimizer': 'adam', 'graph_mode': 'cutoff', 'cutoff': 0.2071604959820907, 'grm_norm': 'none', 'self_loops': False, 'use_snp_selection': True, 'num_snps': 12022}. Best is trial 14 with value: 0.2867309967808293.
[I 2025-12-08 16:18:57,071] Trial 19 finished with value: 0.27858001625931667 and parameters: {'model_type': 'gcn', 'hidden_dims': '[512, 256]', 'dropout': 0.46201114806835597, 'batch_norm': True, 'lr': 3.631841990198277e-05, 'weight_decay': 0.00013429792469499315, 'epochs': 41, 'loss': 'mae', 'optimizer': 'adam', 'graph_mode': 'cutoff', 'cutoff': 0.75565169836058, 'grm_norm': 'none', 'self_loops': False, 'use_snp_selection': True, 'num_snps': 23457}. Best is trial 14 with value: 0.2867309967808293.
[I 2025-12-08 16:19:30,889] Trial 20 finished with value: 0.28832991814468983 and parameters: {'model_type': 'gcn', 'hidden_dims': '[512, 256]', 'dropout': 0.3645207238087206, 'batch_norm': True, 'lr': 0.0003487737485618607, 'weight_decay': 2.436140887713321e-05, 'epochs': 147, 'loss': 'mae', 'optimizer': 'adam', 'graph_mode': 'cutoff', 'cutoff': 0.8899291235748714, 'grm_norm': 'cosine_then_gcn', 'self_loops': False, 'use_snp_selection': True, 'num_snps': 35605}. Best is trial 20 with value: 0.28832991814468983.
[I 2025-12-08 16:20:05,443] Trial 21 finished with value: 0.28222643917954415 and parameters: {'model_type': 'gcn', 'hidden_dims': '[512, 256]', 'dropout': 0.36382867978313665, 'batch_norm': True, 'lr': 0.00033599835902046283, 'weight_decay': 2.7629224929573078e-05, 'epochs': 144, 'loss': 'mae', 'optimizer': 'adam', 'graph_mode': 'cutoff', 'cutoff': 0.8764597488659485, 'grm_norm': 'cosine_then_gcn', 'self_loops': False, 'use_snp_selection': True, 'num_snps': 36875}. Best is trial 20 with value: 0.28832991814468983.
[I 2025-12-08 16:20:43,056] Trial 22 finished with value: 0.2794756826857057 and parameters: {'model_type': 'gcn', 'hidden_dims': '[512, 256]', 'dropout': 0.28493436797562194, 'batch_norm': True, 'lr': 0.0014841457880870443, 'weight_decay': 4.22509329210585e-06, 'epochs': 188, 'loss': 'mae', 'optimizer': 'adam', 'graph_mode': 'cutoff', 'cutoff': 0.7957337076733078, 'grm_norm': 'cosine_then_gcn', 'self_loops': False, 'use_snp_selection': True, 'num_snps': 33011}. Best is trial 20 with value: 0.28832991814468983.
[I 2025-12-08 16:21:03,259] Trial 23 finished with value: 0.28261903105387615 and parameters: {'model_type': 'gcn', 'hidden_dims': '[512, 256]', 'dropout': 0.4347374838506445, 'batch_norm': True, 'lr': 0.0004560850548276421, 'weight_decay': 8.310029917979047e-05, 'epochs': 92, 'loss': 'mae', 'optimizer': 'adam', 'graph_mode': 'cutoff', 'cutoff': 0.6947990636904449, 'grm_norm': 'cosine_then_gcn', 'self_loops': False, 'use_snp_selection': True, 'num_snps': 22600}. Best is trial 20 with value: 0.28832991814468983.
[I 2025-12-08 16:21:18,458] Trial 24 finished with value: 0.2684757494311909 and parameters: {'model_type': 'gcn', 'hidden_dims': '[512, 256]', 'dropout': 0.3564619021728382, 'batch_norm': True, 'lr': 4.766115685403152e-05, 'weight_decay': 1.713813430176355e-05, 'epochs': 223, 'loss': 'mae', 'optimizer': 'adam', 'graph_mode': 'cutoff', 'cutoff': 0.8996482477078509, 'grm_norm': 'none', 'self_loops': False, 'use_snp_selection': True, 'num_snps': 5547}. Best is trial 20 with value: 0.28832991814468983.
[I 2025-12-08 16:21:36,048] Trial 25 finished with value: 0.26134502210972044 and parameters: {'model_type': 'gcn', 'hidden_dims': '[512, 64]', 'dropout': 0.3311526683489576, 'batch_norm': True, 'lr': 0.0001661438207350424, 'weight_decay': 1.0823481768810114e-05, 'epochs': 151, 'loss': 'mae', 'optimizer': 'adam', 'graph_mode': 'cutoff', 'cutoff': 0.8183246620362243, 'grm_norm': 'none', 'self_loops': False, 'use_snp_selection': True, 'num_snps': 12169}. Best is trial 20 with value: 0.28832991814468983.
[I 2025-12-08 16:22:23,185] Trial 26 finished with value: 0.27667167559337047 and parameters: {'model_type': 'gcn', 'hidden_dims': '[512, 128]', 'dropout': 0.5128228820960642, 'batch_norm': False, 'lr': 0.0002805086902011678, 'weight_decay': 6.452922917239863e-05, 'epochs': 184, 'loss': 'mse', 'optimizer': 'adam', 'graph_mode': 'cutoff', 'cutoff': 0.8231906989426868, 'grm_norm': 'cosine_then_gcn', 'self_loops': True, 'use_snp_selection': False}. Best is trial 20 with value: 0.28832991814468983.
[I 2025-12-08 16:22:54,217] Trial 27 finished with value: 0.2788826629320026 and parameters: {'model_type': 'gcn', 'hidden_dims': '[256, 128]', 'dropout': 0.3881525239418872, 'batch_norm': True, 'lr': 0.0007557375854122691, 'weight_decay': 2.3421119469612403e-05, 'epochs': 117, 'loss': 'mae', 'optimizer': 'adam', 'graph_mode': 'cutoff', 'cutoff': 0.6930058799459387, 'grm_norm': 'none', 'self_loops': False, 'use_snp_selection': True, 'num_snps': 58887}. Best is trial 20 with value: 0.28832991814468983.
[I 2025-12-08 16:23:09,328] Trial 28 finished with value: 0.05619107402630665 and parameters: {'model_type': 'gcn', 'hidden_dims': '[256, 128, 64]', 'dropout': 0.2460816979903604, 'batch_norm': False, 'lr': 0.003043781063494649, 'weight_decay': 0.00020431382152855262, 'epochs': 63, 'loss': 'mae', 'optimizer': 'adam', 'graph_mode': 'cutoff', 'cutoff': 0.4483825980053032, 'grm_norm': 'gcn', 'self_loops': False, 'use_snp_selection': True, 'num_snps': 23428}. Best is trial 20 with value: 0.28832991814468983.
[I 2025-12-08 16:23:32,240] Trial 29 finished with value: 0.2911632131291752 and parameters: {'model_type': 'gcn', 'hidden_dims': '[128, 64]', 'dropout': 0.5990057272264879, 'batch_norm': True, 'lr': 2.2362341576448757e-05, 'weight_decay': 6.589809959481931e-05, 'epochs': 242, 'loss': 'mae', 'optimizer': 'adam', 'graph_mode': 'cutoff', 'cutoff': 0.6892780843215627, 'grm_norm': 'cosine_then_gcn', 'self_loops': True, 'use_snp_selection': True, 'num_snps': 33173}. Best is trial 29 with value: 0.2911632131291752.
[I 2025-12-08 16:23:55,154] Trial 30 finished with value: 0.26775309016250837 and parameters: {'model_type': 'gcn', 'hidden_dims': '[128, 64]', 'dropout': 0.599129812245674, 'batch_norm': True, 'lr': 1.7831697620634284e-05, 'weight_decay': 0.0009320472547048893, 'epochs': 247, 'loss': 'mae', 'optimizer': 'adam', 'graph_mode': 'cutoff', 'cutoff': 0.4847174617865131, 'grm_norm': 'cosine_then_gcn', 'self_loops': True, 'use_snp_selection': True, 'num_snps': 32381}. Best is trial 29 with value: 0.2911632131291752.
[I 2025-12-08 16:24:20,840] Trial 31 finished with value: 0.24219169875156915 and parameters: {'model_type': 'gcn', 'hidden_dims': '[128, 64]', 'dropout': 0.16781522129828882, 'batch_norm': True, 'lr': 1.0915080230160858e-05, 'weight_decay': 4.988258495580822e-05, 'epochs': 275, 'loss': 'mae', 'optimizer': 'adam', 'graph_mode': 'cutoff', 'cutoff': 0.6985998900505153, 'grm_norm': 'cosine_then_gcn', 'self_loops': True, 'use_snp_selection': True, 'num_snps': 36163}. Best is trial 29 with value: 0.2911632131291752.
[I 2025-12-08 16:24:48,315] Trial 32 finished with value: 0.27676633394716765 and parameters: {'model_type': 'gcn', 'hidden_dims': '[128, 64]', 'dropout': 0.5181011213825323, 'batch_norm': True, 'lr': 5.8672564383834694e-05, 'weight_decay': 3.727435608110388e-05, 'epochs': 241, 'loss': 'mae', 'optimizer': 'adam', 'graph_mode': 'cutoff', 'cutoff': 0.8351431601492676, 'grm_norm': 'cosine_then_gcn', 'self_loops': True, 'use_snp_selection': True, 'num_snps': 45047}. Best is trial 29 with value: 0.2911632131291752.
[I 2025-12-08 16:25:07,753] Trial 33 finished with value: 0.2697070852113369 and parameters: {'model_type': 'gcn', 'hidden_dims': '[128, 64]', 'dropout': 0.30332609163898794, 'batch_norm': True, 'lr': 2.429617101080127e-05, 'weight_decay': 0.00010943450853994248, 'epochs': 196, 'loss': 'mae', 'optimizer': 'adam', 'graph_mode': 'cutoff', 'cutoff': 0.8195635830502941, 'grm_norm': 'none', 'self_loops': True, 'use_snp_selection': True, 'num_snps': 28070}. Best is trial 29 with value: 0.2911632131291752.
[I 2025-12-08 16:25:47,872] Trial 34 finished with value: 0.27401063136017373 and parameters: {'model_type': 'gcn', 'hidden_dims': '[256, 128, 64]', 'dropout': 0.2572745790445453, 'batch_norm': True, 'lr': 0.00012263500305739584, 'weight_decay': 9.293095099363337e-06, 'epochs': 315, 'loss': 'mae', 'optimizer': 'adam', 'graph_mode': 'cutoff', 'cutoff': 0.7282720543116195, 'grm_norm': 'cosine_then_gcn', 'self_loops': True, 'use_snp_selection': False}. Best is trial 29 with value: 0.2911632131291752.
[I 2025-12-08 16:26:19,652] Trial 35 finished with value: 0.20102969605520662 and parameters: {'model_type': 'gcn', 'hidden_dims': '[512, 256]', 'dropout': 0.5991584100615114, 'batch_norm': True, 'lr': 0.0005189394330933223, 'weight_decay': 5.867102819822796e-05, 'epochs': 221, 'loss': 'mse', 'optimizer': 'adam', 'graph_mode': 'knn', 'knn_k': 10, 'weighted_edges': True, 'symmetrize_mode': 'mutual', 'self_loops': True, 'use_snp_selection': True, 'num_snps': 21088}. Best is trial 29 with value: 0.2911632131291752.
[I 2025-12-08 16:26:42,235] Trial 36 finished with value: 0.2838810884778139 and parameters: {'model_type': 'gcn', 'hidden_dims': '[512, 64]', 'dropout': 0.2012744910266418, 'batch_norm': True, 'lr': 6.565623708493218e-05, 'weight_decay': 3.985861787808546e-06, 'epochs': 273, 'loss': 'mae', 'optimizer': 'adam', 'graph_mode': 'cutoff', 'cutoff': 0.8451873758660017, 'grm_norm': 'cosine_then_gcn', 'self_loops': True, 'use_snp_selection': True, 'num_snps': 10941}. Best is trial 29 with value: 0.2911632131291752.
[I 2025-12-08 16:26:52,823] Trial 37 finished with value: 0.25884424326908345 and parameters: {'model_type': 'gcn', 'hidden_dims': '[128, 64]', 'dropout': 0.5508585629960029, 'batch_norm': True, 'lr': 1.6436477763292903e-05, 'weight_decay': 5.074842791883337e-07, 'epochs': 131, 'loss': 'mse', 'optimizer': 'adam', 'graph_mode': 'cutoff', 'cutoff': 0.7858474382259162, 'grm_norm': 'none', 'self_loops': False, 'use_snp_selection': False}. Best is trial 29 with value: 0.2911632131291752.
[I 2025-12-08 16:27:21,621] Trial 38 finished with value: 0.2211917222364415 and parameters: {'model_type': 'gcn', 'hidden_dims': '[256, 128]', 'dropout': 0.32148924618739505, 'batch_norm': True, 'lr': 4.078456410525794e-05, 'weight_decay': 0.0003739113094790875, 'epochs': 202, 'loss': 'mae', 'optimizer': 'adam', 'graph_mode': 'cutoff', 'cutoff': 0.5456883823732808, 'grm_norm': 'gcn', 'self_loops': False, 'use_snp_selection': True, 'num_snps': 35890}. Best is trial 29 with value: 0.2911632131291752.
[I 2025-12-08 16:28:39,440] Trial 39 finished with value: 0.21824692466083584 and parameters: {'model_type': 'gcn', 'hidden_dims': '[512, 256]', 'dropout': 0.43497050641681356, 'batch_norm': True, 'lr': 9.975079606903274e-05, 'weight_decay': 1.8824125766884616e-05, 'epochs': 304, 'loss': 'mae', 'optimizer': 'adam', 'graph_mode': 'knn', 'knn_k': 7, 'weighted_edges': False, 'symmetrize_mode': 'mutual', 'self_loops': True, 'use_snp_selection': False}. Best is trial 29 with value: 0.2911632131291752.
[I 2025-12-08 16:28:54,919] Trial 40 finished with value: 0.2779288914916066 and parameters: {'model_type': 'gcn', 'hidden_dims': '[128, 64]', 'dropout': 0.3447852950964657, 'batch_norm': False, 'lr': 2.8139496194220514e-05, 'weight_decay': 8.703903991781016e-06, 'epochs': 102, 'loss': 'mse', 'optimizer': 'adam', 'graph_mode': 'cutoff', 'cutoff': 0.6798107123568725, 'grm_norm': 'cosine', 'self_loops': False, 'use_snp_selection': True, 'num_snps': 26798}. Best is trial 29 with value: 0.2911632131291752.
[I 2025-12-08 16:29:16,370] Trial 41 finished with value: 0.2836484315963305 and parameters: {'model_type': 'gcn', 'hidden_dims': '[512, 64]', 'dropout': 0.2001455244128881, 'batch_norm': True, 'lr': 7.025935390465273e-05, 'weight_decay': 4.465779020756646e-06, 'epochs': 272, 'loss': 'mae', 'optimizer': 'adam', 'graph_mode': 'cutoff', 'cutoff': 0.8475257881651184, 'grm_norm': 'cosine_then_gcn', 'self_loops': True, 'use_snp_selection': True, 'num_snps': 10167}. Best is trial 29 with value: 0.2911632131291752.
[I 2025-12-08 16:29:43,869] Trial 42 finished with value: 0.28635428794791323 and parameters: {'model_type': 'gcn', 'hidden_dims': '[512, 64]', 'dropout': 0.21081996586976462, 'batch_norm': True, 'lr': 0.0002017566514217449, 'weight_decay': 2.100302214923668e-06, 'epochs': 292, 'loss': 'mae', 'optimizer': 'adam', 'graph_mode': 'cutoff', 'cutoff': 0.850661102229228, 'grm_norm': 'cosine_then_gcn', 'self_loops': True, 'use_snp_selection': True, 'num_snps': 14491}. Best is trial 29 with value: 0.2911632131291752.
[I 2025-12-08 16:30:16,222] Trial 43 finished with value: 0.2832488188083825 and parameters: {'model_type': 'gcn', 'hidden_dims': '[512, 64]', 'dropout': 0.16190034186351335, 'batch_norm': True, 'lr': 0.00022317926912463317, 'weight_decay': 2.369901613011709e-06, 'epochs': 350, 'loss': 'mae', 'optimizer': 'adam', 'graph_mode': 'cutoff', 'cutoff': 0.8961823729684795, 'grm_norm': 'gcn', 'self_loops': True, 'use_snp_selection': True, 'num_snps': 15322}. Best is trial 29 with value: 0.2911632131291752.
[I 2025-12-08 16:31:22,253] Trial 44 finished with value: 0.2803947653800201 and parameters: {'model_type': 'gcn', 'hidden_dims': '[512, 64]', 'dropout': 0.22899563276653206, 'batch_norm': True, 'lr': 0.0011422803362764141, 'weight_decay': 2.1681487871626236e-06, 'epochs': 332, 'loss': 'mae', 'optimizer': 'adam', 'graph_mode': 'cutoff', 'cutoff': 0.7923249664716077, 'grm_norm': 'cosine_then_gcn', 'self_loops': True, 'use_snp_selection': True, 'num_snps': 41469}. Best is trial 29 with value: 0.2911632131291752.
[I 2025-12-08 16:32:08,980] Trial 45 finished with value: 0.2711100616306409 and parameters: {'model_type': 'gcn', 'hidden_dims': '[512, 256]', 'dropout': 0.2626354645557889, 'batch_norm': True, 'lr': 0.0003966979482505713, 'weight_decay': 8.56068385194468e-07, 'epochs': 292, 'loss': 'mae', 'optimizer': 'adam', 'graph_mode': 'cutoff', 'cutoff': 0.6095027281167393, 'grm_norm': 'cosine_then_gcn', 'self_loops': True, 'use_snp_selection': True, 'num_snps': 29529}. Best is trial 29 with value: 0.2911632131291752.
[I 2025-12-08 16:32:26,727] Trial 46 finished with value: 0.24673948791436154 and parameters: {'model_type': 'gcn', 'hidden_dims': '[512, 128]', 'dropout': 0.22287373264375274, 'batch_norm': False, 'lr': 0.00015618692568806288, 'weight_decay': 3.639233701003667e-05, 'epochs': 257, 'loss': 'mae', 'optimizer': 'adam', 'graph_mode': 'knn', 'knn_k': 1, 'weighted_edges': True, 'symmetrize_mode': 'mutual', 'self_loops': True, 'use_snp_selection': True, 'num_snps': 6940}. Best is trial 29 with value: 0.2911632131291752.
[I 2025-12-08 16:33:06,562] Trial 47 finished with value: 0.28464268380357394 and parameters: {'model_type': 'gcn', 'hidden_dims': '[512, 64]', 'dropout': 0.1747289236050192, 'batch_norm': True, 'lr': 0.0007504333858782752, 'weight_decay': 1.977174657032247e-07, 'epochs': 153, 'loss': 'mae', 'optimizer': 'adam', 'graph_mode': 'cutoff', 'cutoff': 0.857786831394403, 'grm_norm': 'cosine', 'self_loops': False, 'use_snp_selection': False}. Best is trial 29 with value: 0.2911632131291752.
[I 2025-12-08 16:33:54,274] Trial 48 finished with value: 0.28784954758235587 and parameters: {'model_type': 'gcn', 'hidden_dims': '[512, 256]', 'dropout': 0.3075005124055996, 'batch_norm': False, 'lr': 2.99316691785376e-05, 'weight_decay': 0.00019726879019309253, 'epochs': 180, 'loss': 'mse', 'optimizer': 'adam', 'graph_mode': 'cutoff', 'cutoff': 0.6508130213887059, 'grm_norm': 'none', 'self_loops': False, 'use_snp_selection': True, 'num_snps': 47769}. Best is trial 29 with value: 0.2911632131291752.
[I 2025-12-08 16:34:42,741] Trial 49 finished with value: 0.29193782419144687 and parameters: {'model_type': 'gcn', 'hidden_dims': '[512, 256]', 'dropout': 0.412261912788936, 'batch_norm': False, 'lr': 1.5212761319335303e-05, 'weight_decay': 0.0002382608350072162, 'epochs': 175, 'loss': 'mse', 'optimizer': 'adam', 'graph_mode': 'cutoff', 'cutoff': 0.661261465474827, 'grm_norm': 'cosine_then_gcn', 'self_loops': False, 'use_snp_selection': True, 'num_snps': 49640}. Best is trial 49 with value: 0.29193782419144687.
[I 2025-12-08 16:35:40,354] Trial 50 finished with value: 0.28430289394942515 and parameters: {'model_type': 'gcn', 'hidden_dims': '[512, 256]', 'dropout': 0.4076728148352202, 'batch_norm': False, 'lr': 1.4620837494547303e-05, 'weight_decay': 0.00025667506932361563, 'epochs': 214, 'loss': 'mse', 'optimizer': 'adam', 'graph_mode': 'knn', 'knn_k': 8, 'weighted_edges': False, 'symmetrize_mode': 'union', 'self_loops': False, 'use_snp_selection': True, 'num_snps': 49913}. Best is trial 49 with value: 0.29193782419144687.
