[I 2025-12-08 19:04:06,343] Trial 6 finished with value: 0.27185932502412885 and parameters: {'model_type': 'gcn', 'hidden_dims': '[128, 64]', 'dropout': 0.31805912766941713, 'batch_norm': True, 'lr': 1.2361026034262557e-05, 'weight_decay': 6.492620232791903e-06, 'epochs': 271, 'loss': 'mse', 'optimizer': 'adam', 'graph_mode': 'cutoff', 'cutoff': 0.6193362582230448, 'grm_norm': 'cosine', 'self_loops': False, 'use_snp_selection': True, 'num_snps': 28594}. Best is trial 4 with value: 0.29317730181956575.
[I 2025-12-08 19:04:26,014] Trial 7 finished with value: 0.26421887220017404 and parameters: {'model_type': 'gcn', 'hidden_dims': '[512, 64]', 'dropout': 0.471337288649717, 'batch_norm': True, 'lr': 2.239693207292708e-05, 'weight_decay': 2.263166635514082e-06, 'epochs': 69, 'loss': 'mse', 'optimizer': 'adam', 'graph_mode': 'cutoff', 'cutoff': 0.4056820886426376, 'grm_norm': 'cosine', 'self_loops': False, 'use_snp_selection': False}. Best is trial 4 with value: 0.29317730181956575.
[I 2025-12-08 19:05:03,752] Trial 8 finished with value: 0.2736356515528836 and parameters: {'model_type': 'gcn', 'hidden_dims': '[512, 256]', 'dropout': 0.20659328268932406, 'batch_norm': False, 'lr': 8.93315124361372e-05, 'weight_decay': 0.00028987480727919035, 'epochs': 136, 'loss': 'mae', 'optimizer': 'adam', 'graph_mode': 'knn', 'knn_k': 3, 'weighted_edges': False, 'symmetrize_mode': 'union', 'self_loops': False, 'use_snp_selection': True, 'num_snps': 43128}. Best is trial 4 with value: 0.29317730181956575.
[I 2025-12-08 19:05:45,813] Trial 9 finished with value: 0.044183039380258055 and parameters: {'model_type': 'gcn', 'hidden_dims': '[512, 256]', 'dropout': 0.2888209592870401, 'batch_norm': False, 'lr': 0.004734648143129892, 'weight_decay': 1.5879705591356368e-06, 'epochs': 163, 'loss': 'mse', 'optimizer': 'adam', 'graph_mode': 'cutoff', 'cutoff': 0.5984899797909019, 'grm_norm': 'cosine', 'self_loops': True, 'use_snp_selection': False}. Best is trial 4 with value: 0.29317730181956575.
[I 2025-12-08 19:05:55,015] Trial 10 finished with value: 0.2706623960098454 and parameters: {'model_type': 'gcn', 'hidden_dims': '[512, 128]', 'dropout': 0.11372025982957354, 'batch_norm': False, 'lr': 0.0023343012062770553, 'weight_decay': 4.14440562940608e-05, 'epochs': 41, 'loss': 'mae', 'optimizer': 'adam', 'graph_mode': 'cutoff', 'cutoff': 0.8740100033033124, 'grm_norm': 'none', 'self_loops': False, 'use_snp_selection': True, 'num_snps': 3859}. Best is trial 4 with value: 0.29317730181956575.
[I 2025-12-08 19:06:31,506] Trial 11 finished with value: 0.2673605626330559 and parameters: {'model_type': 'gcn', 'hidden_dims': '[512, 256]', 'dropout': 0.42220860806405436, 'batch_norm': False, 'lr': 0.00012587284186352953, 'weight_decay': 0.0006590033092812647, 'epochs': 114, 'loss': 'mae', 'optimizer': 'adam', 'graph_mode': 'knn', 'knn_k': 1, 'weighted_edges': False, 'symmetrize_mode': 'union', 'self_loops': False, 'use_snp_selection': True, 'num_snps': 47068}. Best is trial 4 with value: 0.29317730181956575.
[I 2025-12-08 19:06:46,305] Trial 12 finished with value: 0.27749245154790625 and parameters: {'model_type': 'gcn', 'hidden_dims': '[512, 256]', 'dropout': 0.14142767069304862, 'batch_norm': False, 'lr': 0.0011798598123878552, 'weight_decay': 9.414718277089941e-05, 'epochs': 124, 'loss': 'mae', 'optimizer': 'adam', 'graph_mode': 'knn', 'knn_k': 3, 'weighted_edges': False, 'symmetrize_mode': 'union', 'self_loops': False, 'use_snp_selection': True, 'num_snps': 8584}. Best is trial 4 with value: 0.29317730181956575.
[I 2025-12-08 19:06:58,989] Trial 13 finished with value: 0.27441780630362805 and parameters: {'model_type': 'gcn', 'hidden_dims': '[512, 256]', 'dropout': 0.13529665206282515, 'batch_norm': False, 'lr': 0.0013143362382724787, 'weight_decay': 5.2475435102613655e-05, 'epochs': 101, 'loss': 'mae', 'optimizer': 'adam', 'graph_mode': 'knn', 'knn_k': 6, 'weighted_edges': False, 'symmetrize_mode': 'union', 'self_loops': False, 'use_snp_selection': True, 'num_snps': 5870}. Best is trial 4 with value: 0.29317730181956575.
[I 2025-12-08 19:07:20,382] Trial 14 finished with value: 0.2796480744695315 and parameters: {'model_type': 'gcn', 'hidden_dims': '[512, 256]', 'dropout': 0.25632205209505254, 'batch_norm': False, 'lr': 0.0009612459132665168, 'weight_decay': 2.2203297076850073e-05, 'epochs': 165, 'loss': 'mae', 'optimizer': 'adam', 'graph_mode': 'cutoff', 'cutoff': 0.8944237199027842, 'grm_norm': 'none', 'self_loops': False, 'use_snp_selection': True, 'num_snps': 15654}. Best is trial 4 with value: 0.29317730181956575.
[I 2025-12-08 19:07:38,671] Trial 15 finished with value: 0.04208287500078832 and parameters: {'model_type': 'gcn', 'hidden_dims': '[256, 128, 64]', 'dropout': 0.400283527263757, 'batch_norm': False, 'lr': 0.008017119310501081, 'weight_decay': 1.3728672854267767e-05, 'epochs': 164, 'loss': 'mae', 'optimizer': 'adam', 'graph_mode': 'cutoff', 'cutoff': 0.8872255416714164, 'grm_norm': 'none', 'self_loops': False, 'use_snp_selection': True, 'num_snps': 18030}. Best is trial 4 with value: 0.29317730181956575.
[I 2025-12-08 19:08:06,063] Trial 16 finished with value: 0.288305681329267 and parameters: {'model_type': 'gcn', 'hidden_dims': '[512, 128]', 'dropout': 0.26504450412433567, 'batch_norm': True, 'lr': 0.0002698949967223157, 'weight_decay': 1.535136061044636e-05, 'epochs': 243, 'loss': 'mae', 'optimizer': 'adam', 'graph_mode': 'cutoff', 'cutoff': 0.7714575519927706, 'grm_norm': 'none', 'self_loops': False, 'use_snp_selection': True, 'num_snps': 16805}. Best is trial 4 with value: 0.29317730181956575.
[I 2025-12-08 19:08:38,083] Trial 17 finished with value: 0.286329333223042 and parameters: {'model_type': 'gcn', 'hidden_dims': '[512, 128]', 'dropout': 0.41075184903418993, 'batch_norm': True, 'lr': 0.00020720022527164094, 'weight_decay': 5.705752010254917e-06, 'epochs': 265, 'loss': 'mae', 'optimizer': 'adam', 'graph_mode': 'cutoff', 'cutoff': 0.744153457419521, 'grm_norm': 'cosine_then_gcn', 'self_loops': False, 'use_snp_selection': True, 'num_snps': 19081}. Best is trial 4 with value: 0.29317730181956575.
[I 2025-12-08 19:09:23,929] Trial 18 finished with value: 0.2908095162189522 and parameters: {'model_type': 'gcn', 'hidden_dims': '[512, 128]', 'dropout': 0.2802852368181955, 'batch_norm': True, 'lr': 0.0002434436941493592, 'weight_decay': 0.00016354049737141843, 'epochs': 226, 'loss': 'mae', 'optimizer': 'adam', 'graph_mode': 'cutoff', 'cutoff': 0.7196250301499015, 'grm_norm': 'none', 'self_loops': False, 'use_snp_selection': True, 'num_snps': 37299}. Best is trial 4 with value: 0.29317730181956575.
[I 2025-12-08 19:09:56,100] Trial 19 finished with value: 0.2807505126044508 and parameters: {'model_type': 'gcn', 'hidden_dims': '[256, 128]', 'dropout': 0.3699065019632123, 'batch_norm': True, 'lr': 3.743769066265027e-05, 'weight_decay': 0.00015564981699712466, 'epochs': 224, 'loss': 'mae', 'optimizer': 'adam', 'graph_mode': 'cutoff', 'cutoff': 0.7299598277380559, 'grm_norm': 'none', 'self_loops': False, 'use_snp_selection': True, 'num_snps': 38652}. Best is trial 4 with value: 0.29317730181956575.
[I 2025-12-08 19:10:20,327] Trial 20 finished with value: 0.2542223901789623 and parameters: {'model_type': 'gcn', 'hidden_dims': '[512, 128]', 'dropout': 0.1795400053705768, 'batch_norm': True, 'lr': 0.00046429964527740155, 'weight_decay': 0.00017706542347724458, 'epochs': 74, 'loss': 'mae', 'optimizer': 'adam', 'graph_mode': 'cutoff', 'cutoff': 0.4642572787104977, 'grm_norm': 'cosine_then_gcn', 'self_loops': False, 'use_snp_selection': True, 'num_snps': 35605}. Best is trial 4 with value: 0.29317730181956575.
[I 2025-12-08 19:10:52,533] Trial 21 finished with value: 0.28629860302690247 and parameters: {'model_type': 'gcn', 'hidden_dims': '[512, 128]', 'dropout': 0.2667359562450607, 'batch_norm': True, 'lr': 0.00021557391877617628, 'weight_decay': 1.967237601208659e-05, 'epochs': 245, 'loss': 'mae', 'optimizer': 'adam', 'graph_mode': 'cutoff', 'cutoff': 0.7514177000999241, 'grm_norm': 'none', 'self_loops': False, 'use_snp_selection': True, 'num_snps': 21117}. Best is trial 4 with value: 0.29317730181956575.
[I 2025-12-08 19:11:23,016] Trial 22 finished with value: 0.2794384558446422 and parameters: {'model_type': 'gcn', 'hidden_dims': '[512, 128]', 'dropout': 0.3055407608706086, 'batch_norm': True, 'lr': 0.00021698433314854218, 'weight_decay': 0.0008921781180722003, 'epochs': 184, 'loss': 'mae', 'optimizer': 'adam', 'graph_mode': 'cutoff', 'cutoff': 0.7770397908215557, 'grm_norm': 'none', 'self_loops': False, 'use_snp_selection': True, 'num_snps': 25730}. Best is trial 4 with value: 0.29317730181956575.
[I 2025-12-08 19:11:45,983] Trial 23 finished with value: 0.27970714214935727 and parameters: {'model_type': 'gcn', 'hidden_dims': '[512, 128]', 'dropout': 0.3542021022133396, 'batch_norm': True, 'lr': 0.00031370437644755503, 'weight_decay': 9.81496172702062e-05, 'epochs': 245, 'loss': 'mae', 'optimizer': 'adam', 'graph_mode': 'cutoff', 'cutoff': 0.6868179595163091, 'grm_norm': 'none', 'self_loops': False, 'use_snp_selection': True, 'num_snps': 12658}. Best is trial 4 with value: 0.29317730181956575.
[I 2025-12-08 19:12:37,589] Trial 24 finished with value: 0.28176923384789315 and parameters: {'model_type': 'gcn', 'hidden_dims': '[512, 128]', 'dropout': 0.2558088749322909, 'batch_norm': True, 'lr': 4.766115685403152e-05, 'weight_decay': 3.4576177983916026e-05, 'epochs': 295, 'loss': 'mae', 'optimizer': 'adam', 'graph_mode': 'cutoff', 'cutoff': 0.6710732572820935, 'grm_norm': 'none', 'self_loops': False, 'use_snp_selection': True, 'num_snps': 34229}. Best is trial 4 with value: 0.29317730181956575.
[I 2025-12-08 19:12:56,381] Trial 25 finished with value: 0.28547679096232814 and parameters: {'model_type': 'gcn', 'hidden_dims': '[512, 128]', 'dropout': 0.17918373713795563, 'batch_norm': True, 'lr': 0.0007343776120036983, 'weight_decay': 5.365400659331467e-06, 'epochs': 188, 'loss': 'mae', 'optimizer': 'adam', 'graph_mode': 'cutoff', 'cutoff': 0.8166783620808465, 'grm_norm': 'none', 'self_loops': False, 'use_snp_selection': True, 'num_snps': 11220}. Best is trial 4 with value: 0.29317730181956575.
[I 2025-12-08 19:13:56,152] Trial 26 finished with value: 0.2327237372258729 and parameters: {'model_type': 'gcn', 'hidden_dims': '[512, 64]', 'dropout': 0.2205804179737341, 'batch_norm': True, 'lr': 0.0019035245608086436, 'weight_decay': 1.0687295154404784e-05, 'epochs': 236, 'loss': 'mse', 'optimizer': 'adam', 'graph_mode': 'cutoff', 'cutoff': 0.5212047675502296, 'grm_norm': 'none', 'self_loops': True, 'use_snp_selection': False}. Best is trial 4 with value: 0.29317730181956575.
[I 2025-12-08 19:14:49,155] Trial 27 finished with value: 0.290313982841797 and parameters: {'model_type': 'gcn', 'hidden_dims': '[256, 128]', 'dropout': 0.4698617895329616, 'batch_norm': True, 'lr': 0.0001402855787622287, 'weight_decay': 0.00021327716046843232, 'epochs': 305, 'loss': 'mae', 'optimizer': 'adam', 'graph_mode': 'cutoff', 'cutoff': 0.8219181005061634, 'grm_norm': 'gcn', 'self_loops': False, 'use_snp_selection': True, 'num_snps': 59153}. Best is trial 4 with value: 0.29317730181956575.
[I 2025-12-08 19:15:41,939] Trial 28 finished with value: 0.22115192010617785 and parameters: {'model_type': 'gcn', 'hidden_dims': '[256, 128]', 'dropout': 0.4819937411812413, 'batch_norm': True, 'lr': 0.00012824128158145037, 'weight_decay': 0.0003243722152237588, 'epochs': 299, 'loss': 'mae', 'optimizer': 'adam', 'graph_mode': 'cutoff', 'cutoff': 0.22630422630951502, 'grm_norm': 'gcn', 'self_loops': False, 'use_snp_selection': True, 'num_snps': 58061}. Best is trial 4 with value: 0.29317730181956575.
[I 2025-12-08 19:16:31,058] Trial 29 finished with value: 0.2847932242701646 and parameters: {'model_type': 'gcn', 'hidden_dims': '[256, 128]', 'dropout': 0.5035784343679626, 'batch_norm': True, 'lr': 4.107035021860172e-05, 'weight_decay': 0.00013370579040142307, 'epochs': 330, 'loss': 'mae', 'optimizer': 'adam', 'graph_mode': 'cutoff', 'cutoff': 0.8530299966090658, 'grm_norm': 'gcn', 'self_loops': True, 'use_snp_selection': True, 'num_snps': 49994}. Best is trial 4 with value: 0.29317730181956575.
[I 2025-12-08 19:17:23,714] Trial 30 finished with value: 0.2837668927541107 and parameters: {'model_type': 'gcn', 'hidden_dims': '[256, 128]', 'dropout': 0.5983207684801546, 'batch_norm': True, 'lr': 0.00011921260216487448, 'weight_decay': 8.3594278210525e-05, 'epochs': 315, 'loss': 'mae', 'optimizer': 'adam', 'graph_mode': 'cutoff', 'cutoff': 0.8087434345939175, 'grm_norm': 'gcn', 'self_loops': False, 'use_snp_selection': True, 'num_snps': 56887}. Best is trial 4 with value: 0.29317730181956575.
[I 2025-12-08 19:18:03,063] Trial 31 finished with value: 0.28595970162778406 and parameters: {'model_type': 'gcn', 'hidden_dims': '[256, 128, 64]', 'dropout': 0.28537524604424996, 'batch_norm': True, 'lr': 0.00021677270252829861, 'weight_decay': 0.00022670370643772177, 'epochs': 269, 'loss': 'mae', 'optimizer': 'adam', 'graph_mode': 'cutoff', 'cutoff': 0.6985998900505153, 'grm_norm': 'cosine_then_gcn', 'self_loops': False, 'use_snp_selection': True, 'num_snps': 41748}. Best is trial 4 with value: 0.29317730181956575.
[I 2025-12-08 19:18:23,866] Trial 32 finished with value: 0.2741146937398377 and parameters: {'model_type': 'gcn', 'hidden_dims': '[128, 64]', 'dropout': 0.3735523264198174, 'batch_norm': True, 'lr': 0.00032506775566363525, 'weight_decay': 3.1304058031277893e-05, 'epochs': 287, 'loss': 'mae', 'optimizer': 'adam', 'graph_mode': 'cutoff', 'cutoff': 0.8054009327524504, 'grm_norm': 'none', 'self_loops': False, 'use_snp_selection': True, 'num_snps': 23667}. Best is trial 4 with value: 0.29317730181956575.
[I 2025-12-08 19:18:59,016] Trial 33 finished with value: 0.2851060866575639 and parameters: {'model_type': 'gcn', 'hidden_dims': '[256, 128]', 'dropout': 0.3368827383178462, 'batch_norm': True, 'lr': 0.0005222783547679153, 'weight_decay': 6.457891023286608e-05, 'epochs': 324, 'loss': 'mae', 'optimizer': 'adam', 'graph_mode': 'cutoff', 'cutoff': 0.8195635830502941, 'grm_norm': 'gcn', 'self_loops': False, 'use_snp_selection': True, 'num_snps': 31849}. Best is trial 4 with value: 0.29317730181956575.
[I 2025-12-08 19:19:51,629] Trial 34 finished with value: 0.27359014023851186 and parameters: {'model_type': 'gcn', 'hidden_dims': '[512, 128]', 'dropout': 0.2964287432898014, 'batch_norm': True, 'lr': 5.518330439695865e-05, 'weight_decay': 0.00047864882607976034, 'epochs': 207, 'loss': 'mae', 'optimizer': 'adam', 'graph_mode': 'cutoff', 'cutoff': 0.652367750566543, 'grm_norm': 'none', 'self_loops': False, 'use_snp_selection': False}. Best is trial 4 with value: 0.29317730181956575.
[I 2025-12-08 19:20:12,451] Trial 35 finished with value: 0.2247645710305123 and parameters: {'model_type': 'gcn', 'hidden_dims': '[256, 128, 64]', 'dropout': 0.24602167172563985, 'batch_norm': True, 'lr': 0.00017486429609236463, 'weight_decay': 1.975453923099614e-05, 'epochs': 230, 'loss': 'mse', 'optimizer': 'adam', 'graph_mode': 'knn', 'knn_k': 10, 'weighted_edges': True, 'symmetrize_mode': 'mutual', 'self_loops': True, 'use_snp_selection': True, 'num_snps': 14865}. Best is trial 4 with value: 0.29317730181956575.
[I 2025-12-08 19:20:25,698] Trial 36 finished with value: 0.2667431875830447 and parameters: {'model_type': 'gcn', 'hidden_dims': '[512, 64]', 'dropout': 0.4314492316988743, 'batch_norm': True, 'lr': 0.00032290910456825176, 'weight_decay': 2.7697430834061515e-06, 'epochs': 260, 'loss': 'mae', 'optimizer': 'adam', 'graph_mode': 'cutoff', 'cutoff': 0.746187413295098, 'grm_norm': 'none', 'self_loops': False, 'use_snp_selection': True, 'num_snps': 2626}. Best is trial 4 with value: 0.29317730181956575.
[I 2025-12-08 19:21:07,853] Trial 37 finished with value: 0.29381443175859767 and parameters: {'model_type': 'gcn', 'hidden_dims': '[256, 128]', 'dropout': 0.5281411963932661, 'batch_norm': True, 'lr': 0.0007309477215341312, 'weight_decay': 3.5987260643739334e-07, 'epochs': 348, 'loss': 'mse', 'optimizer': 'adam', 'graph_mode': 'cutoff', 'cutoff': 0.8296575935006247, 'grm_norm': 'gcn', 'self_loops': True, 'use_snp_selection': False}. Best is trial 37 with value: 0.29381443175859767.
[I 2025-12-08 19:21:48,852] Trial 38 finished with value: 0.2931347254866302 and parameters: {'model_type': 'gcn', 'hidden_dims': '[256, 128]', 'dropout': 0.5615952202696944, 'batch_norm': True, 'lr': 0.0007398594925745192, 'weight_decay': 3.3678732640219674e-07, 'epochs': 338, 'loss': 'mse', 'optimizer': 'adam', 'graph_mode': 'cutoff', 'cutoff': 0.8336498229176652, 'grm_norm': 'gcn', 'self_loops': True, 'use_snp_selection': False}. Best is trial 37 with value: 0.29381443175859767.
[I 2025-12-08 19:22:30,695] Trial 39 finished with value: 0.20812147594663202 and parameters: {'model_type': 'gcn', 'hidden_dims': '[256, 128]', 'dropout': 0.5332385749655579, 'batch_norm': True, 'lr': 0.0007753248547855877, 'weight_decay': 6.003503295052737e-07, 'epochs': 338, 'loss': 'mse', 'optimizer': 'adam', 'graph_mode': 'knn', 'knn_k': 7, 'weighted_edges': True, 'symmetrize_mode': 'mutual', 'self_loops': True, 'use_snp_selection': False}. Best is trial 37 with value: 0.29381443175859767.
[I 2025-12-08 19:22:55,880] Trial 40 finished with value: 0.2512400381924952 and parameters: {'model_type': 'gcn', 'hidden_dims': '[128, 64]', 'dropout': 0.5394257172207344, 'batch_norm': True, 'lr': 0.0005876467566290488, 'weight_decay': 1.2754163436580096e-07, 'epochs': 348, 'loss': 'mse', 'optimizer': 'adam', 'graph_mode': 'cutoff', 'cutoff': 0.5547896237564862, 'grm_norm': 'gcn', 'self_loops': True, 'use_snp_selection': False}. Best is trial 37 with value: 0.29381443175859767.
[I 2025-12-08 19:23:34,340] Trial 41 finished with value: 0.29258644086995583 and parameters: {'model_type': 'gcn', 'hidden_dims': '[256, 128]', 'dropout': 0.5634701737006023, 'batch_norm': True, 'lr': 0.00041582032702117095, 'weight_decay': 1.6880401366053768e-07, 'epochs': 316, 'loss': 'mse', 'optimizer': 'adam', 'graph_mode': 'cutoff', 'cutoff': 0.8554451531175784, 'grm_norm': 'gcn', 'self_loops': True, 'use_snp_selection': False}. Best is trial 37 with value: 0.29381443175859767.
[I 2025-12-08 19:24:09,220] Trial 42 finished with value: 0.2930961160000096 and parameters: {'model_type': 'gcn', 'hidden_dims': '[256, 128]', 'dropout': 0.5968172063617612, 'batch_norm': True, 'lr': 0.0017197906367814127, 'weight_decay': 3.108612098244644e-07, 'epochs': 285, 'loss': 'mse', 'optimizer': 'adam', 'graph_mode': 'cutoff', 'cutoff': 0.8492592174433554, 'grm_norm': 'gcn', 'self_loops': True, 'use_snp_selection': False}. Best is trial 37 with value: 0.29381443175859767.
[I 2025-12-08 19:24:51,598] Trial 43 finished with value: 0.2928923821840655 and parameters: {'model_type': 'gcn', 'hidden_dims': '[256, 128]', 'dropout': 0.5835794106807383, 'batch_norm': True, 'lr': 0.002339250640019482, 'weight_decay': 3.2455015706444234e-07, 'epochs': 350, 'loss': 'mse', 'optimizer': 'adam', 'graph_mode': 'cutoff', 'cutoff': 0.8591757758467049, 'grm_norm': 'gcn', 'self_loops': True, 'use_snp_selection': False}. Best is trial 37 with value: 0.29381443175859767.
[I 2025-12-08 19:25:33,744] Trial 44 finished with value: 0.29538274010699583 and parameters: {'model_type': 'gcn', 'hidden_dims': '[256, 128]', 'dropout': 0.59592289897852, 'batch_norm': True, 'lr': 0.0029848995684302825, 'weight_decay': 4.491964770550474e-07, 'epochs': 348, 'loss': 'mse', 'optimizer': 'adam', 'graph_mode': 'cutoff', 'cutoff': 0.8542147176200631, 'grm_norm': 'gcn', 'self_loops': True, 'use_snp_selection': False}. Best is trial 44 with value: 0.29538274010699583.
[I 2025-12-08 19:26:14,274] Trial 45 finished with value: 0.2906541014419276 and parameters: {'model_type': 'gcn', 'hidden_dims': '[256, 128]', 'dropout': 0.5177562151862343, 'batch_norm': True, 'lr': 0.0019476812134079499, 'weight_decay': 4.816149983914468e-07, 'epochs': 334, 'loss': 'mse', 'optimizer': 'adam', 'graph_mode': 'cutoff', 'cutoff': 0.7861739933518154, 'grm_norm': 'gcn', 'self_loops': True, 'use_snp_selection': False}. Best is trial 44 with value: 0.29538274010699583.
[I 2025-12-08 19:26:53,146] Trial 46 finished with value: 0.2510154458185564 and parameters: {'model_type': 'gcn', 'hidden_dims': '[256, 128]', 'dropout': 0.5593906182591754, 'batch_norm': True, 'lr': 0.003527940113205097, 'weight_decay': 1.1988900955306323e-06, 'epochs': 317, 'loss': 'mse', 'optimizer': 'adam', 'graph_mode': 'knn', 'knn_k': 1, 'weighted_edges': False, 'symmetrize_mode': 'mutual', 'self_loops': True, 'use_snp_selection': False}. Best is trial 44 with value: 0.29538274010699583.
[I 2025-12-08 19:28:04,822] Trial 47 finished with value: 0.05257941788206912 and parameters: {'model_type': 'gcn', 'hidden_dims': '[512, 256]', 'dropout': 0.5832670311779751, 'batch_norm': False, 'lr': 0.0013235018770089311, 'weight_decay': 2.3033803492066687e-07, 'epochs': 287, 'loss': 'mse', 'optimizer': 'adam', 'graph_mode': 'cutoff', 'cutoff': 0.8461243144485546, 'grm_norm': 'gcn', 'self_loops': True, 'use_snp_selection': False}. Best is trial 44 with value: 0.29538274010699583.
[I 2025-12-08 19:28:45,851] Trial 48 finished with value: 0.29485644310202436 and parameters: {'model_type': 'gcn', 'hidden_dims': '[256, 128]', 'dropout': 0.5999675469759597, 'batch_norm': True, 'lr': 0.003822585889589606, 'weight_decay': 6.555390446531759e-07, 'epochs': 337, 'loss': 'mse', 'optimizer': 'adam', 'graph_mode': 'cutoff', 'cutoff': 0.8975595747094994, 'grm_norm': 'cosine', 'self_loops': True, 'use_snp_selection': False}. Best is trial 44 with value: 0.29538274010699583.
