[I 2025-12-08 13:50:07,063] Trial 70 finished with value: 0.2816816443278064 and parameters: {'model_type': 'gcn', 'hidden_dims': '[256, 128, 64]', 'dropout': 0.5545435038925096, 'batch_norm': True, 'lr': 0.0008884653617551475, 'weight_decay': 2.0533904555939715e-05, 'epochs': 105, 'loss': 'mae', 'optimizer': 'adam', 'graph_mode': 'cutoff', 'cutoff': 0.7147086218794402, 'grm_norm': 'cosine', 'self_loops': False, 'use_snp_selection': True, 'num_snps': 55316}. Best is trial 44 with value: 0.2978012528173976.
[I 2025-12-08 13:50:31,631] Trial 71 finished with value: 0.2890399411721537 and parameters: {'model_type': 'gcn', 'hidden_dims': '[256, 128, 64]', 'dropout': 0.5305912988455382, 'batch_norm': True, 'lr': 0.0006291777231054741, 'weight_decay': 3.069064086962708e-05, 'epochs': 77, 'loss': 'mae', 'optimizer': 'adam', 'graph_mode': 'cutoff', 'cutoff': 0.831888416766492, 'grm_norm': 'cosine', 'self_loops': False, 'use_snp_selection': True, 'num_snps': 51374}. Best is trial 44 with value: 0.2978012528173976.
[I 2025-12-08 13:50:52,511] Trial 72 finished with value: 0.28674898145551414 and parameters: {'model_type': 'gcn', 'hidden_dims': '[256, 128, 64]', 'dropout': 0.48918884376555866, 'batch_norm': True, 'lr': 0.0003844644269484526, 'weight_decay': 3.9138159503175266e-05, 'epochs': 51, 'loss': 'mae', 'optimizer': 'adam', 'graph_mode': 'cutoff', 'cutoff': 0.7981797757425017, 'grm_norm': 'cosine', 'self_loops': False, 'use_snp_selection': True, 'num_snps': 47668}. Best is trial 44 with value: 0.2978012528173976.
[I 2025-12-08 13:51:08,228] Trial 73 finished with value: 0.28691357206629087 and parameters: {'model_type': 'gcn', 'hidden_dims': '[256, 128, 64]', 'dropout': 0.5989326540799209, 'batch_norm': True, 'lr': 0.0007294206328590387, 'weight_decay': 4.878852714063446e-05, 'epochs': 61, 'loss': 'mae', 'optimizer': 'adam', 'graph_mode': 'cutoff', 'cutoff': 0.8768282561912577, 'grm_norm': 'cosine', 'self_loops': False, 'use_snp_selection': True, 'num_snps': 25045}. Best is trial 44 with value: 0.2978012528173976.
[I 2025-12-08 13:51:30,868] Trial 74 finished with value: 0.28395640999748417 and parameters: {'model_type': 'gcn', 'hidden_dims': '[256, 128]', 'dropout': 0.5055079566730628, 'batch_norm': True, 'lr': 0.0004884400353057592, 'weight_decay': 6.60625933080304e-05, 'epochs': 49, 'loss': 'mae', 'optimizer': 'adam', 'graph_mode': 'cutoff', 'cutoff': 0.8225773125190193, 'grm_norm': 'cosine', 'self_loops': False, 'use_snp_selection': True, 'num_snps': 55582}. Best is trial 44 with value: 0.2978012528173976.
[I 2025-12-08 13:51:42,990] Trial 75 finished with value: 0.28384260776681797 and parameters: {'model_type': 'gcn', 'hidden_dims': '[256, 128, 64]', 'dropout': 0.4331926417520957, 'batch_norm': True, 'lr': 0.0002331855421916517, 'weight_decay': 1.3363348480218917e-05, 'epochs': 83, 'loss': 'mae', 'optimizer': 'adam', 'graph_mode': 'cutoff', 'cutoff': 0.7737844248754637, 'grm_norm': 'gcn', 'self_loops': False, 'use_snp_selection': False}. Best is trial 44 with value: 0.2978012528173976.
[I 2025-12-08 13:52:07,197] Trial 76 finished with value: 0.28012015135682533 and parameters: {'model_type': 'gcn', 'hidden_dims': '[128, 64]', 'dropout': 0.5479117579119772, 'batch_norm': True, 'lr': 0.0010595554954829188, 'weight_decay': 5.8918820083385415e-06, 'epochs': 226, 'loss': 'mae', 'optimizer': 'adam', 'graph_mode': 'cutoff', 'cutoff': 0.8406893878801983, 'grm_norm': 'none', 'self_loops': False, 'use_snp_selection': True, 'num_snps': 38513}. Best is trial 44 with value: 0.2978012528173976.
[I 2025-12-08 13:52:17,599] Trial 77 finished with value: 0.21643804600762953 and parameters: {'model_type': 'gcn', 'hidden_dims': '[256, 128, 64]', 'dropout': 0.4766794642524631, 'batch_norm': True, 'lr': 0.00031160725407028986, 'weight_decay': 9.658000659906806e-06, 'epochs': 64, 'loss': 'mae', 'optimizer': 'adam', 'graph_mode': 'cutoff', 'cutoff': 0.20219566086699486, 'grm_norm': 'cosine', 'self_loops': False, 'use_snp_selection': False}. Best is trial 44 with value: 0.2978012528173976.
[I 2025-12-08 13:52:50,079] Trial 78 finished with value: 0.249409815697188 and parameters: {'model_type': 'gcn', 'hidden_dims': '[512, 256]', 'dropout': 0.5271817033415638, 'batch_norm': True, 'lr': 0.0006318716335062635, 'weight_decay': 0.000181767472860506, 'epochs': 74, 'loss': 'mae', 'optimizer': 'adam', 'graph_mode': 'knn', 'knn_k': 8, 'weighted_edges': False, 'symmetrize_mode': 'union', 'self_loops': False, 'use_snp_selection': True, 'num_snps': 52510}. Best is trial 44 with value: 0.2978012528173976.
[I 2025-12-08 13:52:58,907] Trial 79 finished with value: 0.26105511729220515 and parameters: {'model_type': 'gcn', 'hidden_dims': '[256, 128, 64]', 'dropout': 0.5648896613677584, 'batch_norm': True, 'lr': 0.002072362550679959, 'weight_decay': 1.835989466796458e-05, 'epochs': 55, 'loss': 'mse', 'optimizer': 'adam', 'graph_mode': 'cutoff', 'cutoff': 0.4661814574696252, 'grm_norm': 'none', 'self_loops': False, 'use_snp_selection': False}. Best is trial 44 with value: 0.2978012528173976.
[I 2025-12-08 13:53:22,999] Trial 80 finished with value: 0.2802286813421833 and parameters: {'model_type': 'gcn', 'hidden_dims': '[256, 128, 64]', 'dropout': 0.5163820450422874, 'batch_norm': True, 'lr': 0.0015377625897300845, 'weight_decay': 9.756814430201185e-05, 'epochs': 147, 'loss': 'mae', 'optimizer': 'adam', 'graph_mode': 'cutoff', 'cutoff': 0.8791957188039361, 'grm_norm': 'gcn', 'self_loops': False, 'use_snp_selection': True, 'num_snps': 32814}. Best is trial 44 with value: 0.2978012528173976.
[I 2025-12-08 13:53:30,859] Trial 81 finished with value: 0.2900084944189231 and parameters: {'model_type': 'gcn', 'hidden_dims': '[256, 128, 64]', 'dropout': 0.5000542312941482, 'batch_norm': True, 'lr': 0.0012969622026995878, 'weight_decay': 7.350392864453537e-05, 'epochs': 46, 'loss': 'mae', 'optimizer': 'adam', 'graph_mode': 'cutoff', 'cutoff': 0.7331258998909557, 'grm_norm': 'cosine_then_gcn', 'self_loops': False, 'use_snp_selection': False}. Best is trial 44 with value: 0.2978012528173976.
[I 2025-12-08 13:53:39,071] Trial 82 finished with value: 0.28501449782650534 and parameters: {'model_type': 'gcn', 'hidden_dims': '[256, 128, 64]', 'dropout': 0.4637867230538891, 'batch_norm': True, 'lr': 0.0008534755309770436, 'weight_decay': 3.301732370475805e-05, 'epochs': 49, 'loss': 'mae', 'optimizer': 'adam', 'graph_mode': 'cutoff', 'cutoff': 0.7333229417594965, 'grm_norm': 'cosine_then_gcn', 'self_loops': False, 'use_snp_selection': False}. Best is trial 44 with value: 0.2978012528173976.
[I 2025-12-08 13:53:48,729] Trial 83 finished with value: 0.2865753961825686 and parameters: {'model_type': 'gcn', 'hidden_dims': '[256, 128, 64]', 'dropout': 0.5018460016590868, 'batch_norm': True, 'lr': 0.0004594854447623303, 'weight_decay': 7.02249839542548e-05, 'epochs': 61, 'loss': 'mae', 'optimizer': 'adam', 'graph_mode': 'cutoff', 'cutoff': 0.6619030905242622, 'grm_norm': 'cosine_then_gcn', 'self_loops': False, 'use_snp_selection': False}. Best is trial 44 with value: 0.2978012528173976.
[I 2025-12-08 13:53:56,702] Trial 84 finished with value: 0.2919926856338913 and parameters: {'model_type': 'gcn', 'hidden_dims': '[256, 128, 64]', 'dropout': 0.5375415084221098, 'batch_norm': True, 'lr': 0.001130385574193125, 'weight_decay': 0.0003390946868596168, 'epochs': 47, 'loss': 'mae', 'optimizer': 'adam', 'graph_mode': 'cutoff', 'cutoff': 0.7880281571795643, 'grm_norm': 'cosine', 'self_loops': False, 'use_snp_selection': False}. Best is trial 44 with value: 0.2978012528173976.
[I 2025-12-08 13:54:09,696] Trial 85 finished with value: 0.0 and parameters: {'model_type': 'gcn', 'hidden_dims': '[256, 128, 64]', 'dropout': 0.5396510027830526, 'batch_norm': False, 'lr': 0.0007027719260179053, 'weight_decay': 0.0003353767141158925, 'epochs': 90, 'loss': 'mae', 'optimizer': 'adam', 'graph_mode': 'cutoff', 'cutoff': 0.80565680568612, 'grm_norm': 'cosine', 'self_loops': False, 'use_snp_selection': False}. Best is trial 44 with value: 0.2978012528173976.
[I 2025-12-08 13:54:22,405] Trial 86 finished with value: 0.28684952745363557 and parameters: {'model_type': 'gcn', 'hidden_dims': '[512, 64]', 'dropout': 0.5874304181081462, 'batch_norm': True, 'lr': 0.00040530856807404804, 'weight_decay': 0.0006929509990119542, 'epochs': 40, 'loss': 'mae', 'optimizer': 'adam', 'graph_mode': 'cutoff', 'cutoff': 0.7744742910405803, 'grm_norm': 'cosine', 'self_loops': False, 'use_snp_selection': False}. Best is trial 44 with value: 0.2978012528173976.
[I 2025-12-08 13:54:43,525] Trial 87 finished with value: 0.286203233386622 and parameters: {'model_type': 'gcn', 'hidden_dims': '[256, 128, 64]', 'dropout': 0.5629003179032522, 'batch_norm': True, 'lr': 0.0005366740193671482, 'weight_decay': 2.3821633840749067e-05, 'epochs': 68, 'loss': 'mae', 'optimizer': 'adam', 'graph_mode': 'cutoff', 'cutoff': 0.8473324273290508, 'grm_norm': 'cosine', 'self_loops': True, 'use_snp_selection': True, 'num_snps': 42338}. Best is trial 44 with value: 0.2978012528173976.
[I 2025-12-08 13:54:52,411] Trial 88 finished with value: 0.28379663599312 and parameters: {'model_type': 'gcn', 'hidden_dims': '[256, 128]', 'dropout': 0.5253560716572238, 'batch_norm': True, 'lr': 0.001030811739451501, 'weight_decay': 0.0003862835716170342, 'epochs': 57, 'loss': 'mae', 'optimizer': 'adam', 'graph_mode': 'cutoff', 'cutoff': 0.8150745199980421, 'grm_norm': 'cosine', 'self_loops': False, 'use_snp_selection': False}. Best is trial 44 with value: 0.2978012528173976.
[I 2025-12-08 13:55:05,929] Trial 89 finished with value: 0.2711075800423945 and parameters: {'model_type': 'gcn', 'hidden_dims': '[256, 128, 64]', 'dropout': 0.4844191990595376, 'batch_norm': True, 'lr': 0.00019570158729422828, 'weight_decay': 4.41195335680741e-05, 'epochs': 119, 'loss': 'mae', 'optimizer': 'adam', 'graph_mode': 'cutoff', 'cutoff': 0.7111882969472489, 'grm_norm': 'gcn', 'self_loops': False, 'use_snp_selection': True, 'num_snps': 11211}. Best is trial 44 with value: 0.2978012528173976.
[I 2025-12-08 13:55:28,347] Trial 90 finished with value: 0.26693389799815803 and parameters: {'model_type': 'gcn', 'hidden_dims': '[512, 256]', 'dropout': 0.569631479181947, 'batch_norm': True, 'lr': 2.040987533101825e-05, 'weight_decay': 0.00011415450405089925, 'epochs': 78, 'loss': 'mae', 'optimizer': 'adam', 'graph_mode': 'knn', 'knn_k': 4, 'weighted_edges': True, 'symmetrize_mode': 'union', 'self_loops': False, 'use_snp_selection': False}. Best is trial 44 with value: 0.2978012528173976.
[I 2025-12-08 13:55:36,185] Trial 91 finished with value: 0.28858580663832545 and parameters: {'model_type': 'gcn', 'hidden_dims': '[256, 128, 64]', 'dropout': 0.456589138853933, 'batch_norm': True, 'lr': 0.0014075542011030293, 'weight_decay': 1.4774649451765447e-05, 'epochs': 46, 'loss': 'mae', 'optimizer': 'adam', 'graph_mode': 'cutoff', 'cutoff': 0.7539572321426942, 'grm_norm': 'cosine_then_gcn', 'self_loops': False, 'use_snp_selection': False}. Best is trial 44 with value: 0.2978012528173976.
[I 2025-12-08 13:55:44,141] Trial 92 finished with value: 0.28913039553944997 and parameters: {'model_type': 'gcn', 'hidden_dims': '[256, 128, 64]', 'dropout': 0.5153450688657759, 'batch_norm': True, 'lr': 0.0012206556407064256, 'weight_decay': 7.746016247082093e-05, 'epochs': 47, 'loss': 'mae', 'optimizer': 'adam', 'graph_mode': 'cutoff', 'cutoff': 0.7849099738944976, 'grm_norm': 'cosine_then_gcn', 'self_loops': False, 'use_snp_selection': False}. Best is trial 44 with value: 0.2978012528173976.
[I 2025-12-08 13:55:52,995] Trial 93 finished with value: 0.2818488068701792 and parameters: {'model_type': 'gcn', 'hidden_dims': '[256, 128, 64]', 'dropout': 0.30547628385467224, 'batch_norm': True, 'lr': 0.0008475552210166843, 'weight_decay': 0.00026689445520891255, 'epochs': 56, 'loss': 'mae', 'optimizer': 'adam', 'graph_mode': 'cutoff', 'cutoff': 0.8250359390599759, 'grm_norm': 'none', 'self_loops': False, 'use_snp_selection': False}. Best is trial 44 with value: 0.2978012528173976.
[I 2025-12-08 13:56:03,956] Trial 94 finished with value: 0.2872119694962583 and parameters: {'model_type': 'gcn', 'hidden_dims': '[256, 128, 64]', 'dropout': 0.5376865772881884, 'batch_norm': True, 'lr': 0.00195350810082909, 'weight_decay': 5.288480433747001e-05, 'epochs': 72, 'loss': 'mae', 'optimizer': 'adam', 'graph_mode': 'cutoff', 'cutoff': 0.6213875514669335, 'grm_norm': 'cosine_then_gcn', 'self_loops': False, 'use_snp_selection': False}. Best is trial 44 with value: 0.2978012528173976.
[I 2025-12-08 13:56:13,715] Trial 95 finished with value: 0.2857041237599838 and parameters: {'model_type': 'gcn', 'hidden_dims': '[256, 128, 64]', 'dropout': 0.5489982272329965, 'batch_norm': True, 'lr': 0.0007256385794749151, 'weight_decay': 0.00014289091783678353, 'epochs': 62, 'loss': 'mae', 'optimizer': 'adam', 'graph_mode': 'cutoff', 'cutoff': 0.7374566885531973, 'grm_norm': 'cosine', 'self_loops': False, 'use_snp_selection': False}. Best is trial 44 with value: 0.2978012528173976.
[I 2025-12-08 13:56:41,916] Trial 96 finished with value: 0.2777737699205222 and parameters: {'model_type': 'gcn', 'hidden_dims': '[128, 64]', 'dropout': 0.5010985324500695, 'batch_norm': True, 'lr': 0.001271727323227437, 'weight_decay': 2.9685029099261803e-05, 'epochs': 178, 'loss': 'mse', 'optimizer': 'adam', 'graph_mode': 'cutoff', 'cutoff': 0.8851466492530223, 'grm_norm': 'cosine_then_gcn', 'self_loops': False, 'use_snp_selection': True, 'num_snps': 56972}. Best is trial 44 with value: 0.2978012528173976.
[I 2025-12-08 13:56:49,698] Trial 97 finished with value: 0.2861796606939315 and parameters: {'model_type': 'gcn', 'hidden_dims': '[256, 128, 64]', 'dropout': 0.20762556572708943, 'batch_norm': True, 'lr': 0.0027800633809860176, 'weight_decay': 0.00019023635938192134, 'epochs': 47, 'loss': 'mae', 'optimizer': 'adam', 'graph_mode': 'cutoff', 'cutoff': 0.8515218588939453, 'grm_norm': 'none', 'self_loops': False, 'use_snp_selection': False}. Best is trial 44 with value: 0.2978012528173976.
[I 2025-12-08 13:57:07,736] Trial 98 finished with value: 0.25711693736899 and parameters: {'model_type': 'gcn', 'hidden_dims': '[256, 128, 64]', 'dropout': 0.4796511714903277, 'batch_norm': False, 'lr': 0.0002682327717766331, 'weight_decay': 2.3551450373048167e-05, 'epochs': 85, 'loss': 'mae', 'optimizer': 'adam', 'graph_mode': 'cutoff', 'cutoff': 0.7987779105952169, 'grm_norm': 'gcn', 'self_loops': False, 'use_snp_selection': True, 'num_snps': 28945}. Best is trial 44 with value: 0.2978012528173976.
[I 2025-12-08 13:57:26,748] Trial 99 finished with value: 0.2845396522865557 and parameters: {'model_type': 'gcn', 'hidden_dims': '[512, 256]', 'dropout': 0.4942032505628185, 'batch_norm': True, 'lr': 0.0009744189091864839, 'weight_decay': 3.9128009416423284e-05, 'epochs': 66, 'loss': 'mae', 'optimizer': 'adam', 'graph_mode': 'cutoff', 'cutoff': 0.7101001204227883, 'grm_norm': 'cosine', 'self_loops': True, 'use_snp_selection': False}. Best is trial 44 with value: 0.2978012528173976.
[I 2025-12-08 13:57:49,526] Trial 100 finished with value: 0.2918224425753888 and parameters: {'model_type': 'gcn', 'hidden_dims': '[256, 128, 64]', 'dropout': 0.5562338283503584, 'batch_norm': True, 'lr': 0.0006229589116948711, 'weight_decay': 1.6753767318737822e-05, 'epochs': 40, 'loss': 'mae', 'optimizer': 'adam', 'graph_mode': 'cutoff', 'cutoff': 0.760277634814213, 'grm_norm': 'cosine_then_gcn', 'self_loops': False, 'use_snp_selection': True, 'num_snps': 59814}. Best is trial 44 with value: 0.2978012528173976.
[I 2025-12-08 13:58:14,125] Trial 101 finished with value: 0.29133786882452956 and parameters: {'model_type': 'gcn', 'hidden_dims': '[256, 128, 64]', 'dropout': 0.5539743861292015, 'batch_norm': True, 'lr': 0.0005903869446758001, 'weight_decay': 1.6094441668293615e-05, 'epochs': 55, 'loss': 'mae', 'optimizer': 'adam', 'graph_mode': 'cutoff', 'cutoff': 0.7575211630762133, 'grm_norm': 'cosine_then_gcn', 'self_loops': False, 'use_snp_selection': True, 'num_snps': 59668}. Best is trial 44 with value: 0.2978012528173976.
[I 2025-12-08 13:58:38,767] Trial 102 finished with value: 0.2919793060612113 and parameters: {'model_type': 'gcn', 'hidden_dims': '[256, 128, 64]', 'dropout': 0.5557285339074172, 'batch_norm': True, 'lr': 0.0006011489504588128, 'weight_decay': 1.1493763026483327e-05, 'epochs': 55, 'loss': 'mae', 'optimizer': 'adam', 'graph_mode': 'cutoff', 'cutoff': 0.7641776855836453, 'grm_norm': 'cosine_then_gcn', 'self_loops': False, 'use_snp_selection': True, 'num_snps': 59671}. Best is trial 44 with value: 0.2978012528173976.
[I 2025-12-08 13:59:01,473] Trial 103 finished with value: 0.2842858396400424 and parameters: {'model_type': 'gcn', 'hidden_dims': '[256, 128, 64]', 'dropout': 0.5565207465953392, 'batch_norm': True, 'lr': 0.0006051001864153747, 'weight_decay': 1.5851717622061727e-05, 'epochs': 40, 'loss': 'mae', 'optimizer': 'adam', 'graph_mode': 'cutoff', 'cutoff': 0.7549244126038792, 'grm_norm': 'cosine_then_gcn', 'self_loops': False, 'use_snp_selection': True, 'num_snps': 59260}. Best is trial 44 with value: 0.2978012528173976.
[I 2025-12-08 13:59:59,791] Trial 104 finished with value: 0.2785964640135 and parameters: {'model_type': 'gcn', 'hidden_dims': '[256, 128, 64]', 'dropout': 0.5823212928831194, 'batch_norm': True, 'lr': 0.0004932140606672186, 'weight_decay': 8.444050536687298e-06, 'epochs': 349, 'loss': 'mae', 'optimizer': 'adam', 'graph_mode': 'cutoff', 'cutoff': 0.7845879779965917, 'grm_norm': 'cosine_then_gcn', 'self_loops': False, 'use_snp_selection': True, 'num_snps': 57448}. Best is trial 44 with value: 0.2978012528173976.
[I 2025-12-08 14:00:23,944] Trial 105 finished with value: 0.2908275287717519 and parameters: {'model_type': 'gcn', 'hidden_dims': '[256, 128, 64]', 'dropout': 0.5774460267524079, 'batch_norm': True, 'lr': 0.0007229889952064352, 'weight_decay': 5.34016910150859e-06, 'epochs': 53, 'loss': 'mae', 'optimizer': 'adam', 'graph_mode': 'cutoff', 'cutoff': 0.7706026624791475, 'grm_norm': 'cosine_then_gcn', 'self_loops': False, 'use_snp_selection': True, 'num_snps': 58910}. Best is trial 44 with value: 0.2978012528173976.
[I 2025-12-08 14:00:48,447] Trial 106 finished with value: 0.287028228347177 and parameters: {'model_type': 'gcn', 'hidden_dims': '[256, 128, 64]', 'dropout': 0.5327219133178573, 'batch_norm': True, 'lr': 0.0003238684400141946, 'weight_decay': 5.17240897573132e-06, 'epochs': 54, 'loss': 'mae', 'optimizer': 'adam', 'graph_mode': 'cutoff', 'cutoff': 0.7727435521957277, 'grm_norm': 'cosine_then_gcn', 'self_loops': False, 'use_snp_selection': True, 'num_snps': 59720}. Best is trial 44 with value: 0.2978012528173976.
[I 2025-12-08 14:01:11,981] Trial 107 finished with value: 0.2944271776200937 and parameters: {'model_type': 'gcn', 'hidden_dims': '[256, 128, 64]', 'dropout': 0.570478351492963, 'batch_norm': True, 'lr': 0.000801024996530781, 'weight_decay': 3.141484934233707e-06, 'epochs': 51, 'loss': 'mae', 'optimizer': 'adam', 'graph_mode': 'cutoff', 'cutoff': 0.6965963151863046, 'grm_norm': 'cosine_then_gcn', 'self_loops': False, 'use_snp_selection': True, 'num_snps': 57502}. Best is trial 44 with value: 0.2978012528173976.
[I 2025-12-08 14:01:45,347] Trial 108 finished with value: 0.288956876498058 and parameters: {'model_type': 'gcn', 'hidden_dims': '[512, 64]', 'dropout': 0.5473031587377877, 'batch_norm': True, 'lr': 0.00043918857492765076, 'weight_decay': 2.1772913153643536e-06, 'epochs': 73, 'loss': 'mae', 'optimizer': 'adam', 'graph_mode': 'cutoff', 'cutoff': 0.6990096496444489, 'grm_norm': 'cosine_then_gcn', 'self_loops': False, 'use_snp_selection': True, 'num_snps': 57182}. Best is trial 44 with value: 0.2978012528173976.
[I 2025-12-08 14:02:07,253] Trial 109 finished with value: 0.2918133732299254 and parameters: {'model_type': 'gcn', 'hidden_dims': '[256, 128, 64]', 'dropout': 0.5611398431059337, 'batch_norm': True, 'lr': 0.0007858743070624206, 'weight_decay': 6.192255794006676e-07, 'epochs': 46, 'loss': 'mae', 'optimizer': 'adam', 'graph_mode': 'cutoff', 'cutoff': 0.6752215395174579, 'grm_norm': 'cosine_then_gcn', 'self_loops': False, 'use_snp_selection': True, 'num_snps': 53411}. Best is trial 44 with value: 0.2978012528173976.
[I 2025-12-08 14:02:28,926] Trial 110 finished with value: 0.2630512449482944 and parameters: {'model_type': 'gcn', 'hidden_dims': '[256, 128]', 'dropout': 0.5217409716547093, 'batch_norm': True, 'lr': 0.0008720671253213573, 'weight_decay': 1.192940095788458e-06, 'epochs': 44, 'loss': 'mse', 'optimizer': 'adam', 'graph_mode': 'knn', 'knn_k': 7, 'weighted_edges': False, 'symmetrize_mode': 'mutual', 'self_loops': False, 'use_snp_selection': True, 'num_snps': 52724}. Best is trial 44 with value: 0.2978012528173976.
[I 2025-12-08 14:02:53,249] Trial 111 finished with value: 0.29061433645779583 and parameters: {'model_type': 'gcn', 'hidden_dims': '[256, 128, 64]', 'dropout': 0.5619020492358057, 'batch_norm': True, 'lr': 0.0005437379945395972, 'weight_decay': 2.4899478550670337e-07, 'epochs': 60, 'loss': 'mae', 'optimizer': 'adam', 'graph_mode': 'cutoff', 'cutoff': 0.6463346940370681, 'grm_norm': 'cosine_then_gcn', 'self_loops': False, 'use_snp_selection': True, 'num_snps': 56367}. Best is trial 44 with value: 0.2978012528173976.
[I 2025-12-08 14:03:13,723] Trial 112 finished with value: 0.29636471946227194 and parameters: {'model_type': 'gcn', 'hidden_dims': '[256, 128, 64]', 'dropout': 0.5932570651784995, 'batch_norm': True, 'lr': 0.0011325033055827453, 'weight_decay': 1.1343167944377566e-05, 'epochs': 40, 'loss': 'mae', 'optimizer': 'adam', 'graph_mode': 'cutoff', 'cutoff': 0.6726298956399588, 'grm_norm': 'cosine_then_gcn', 'self_loops': False, 'use_snp_selection': True, 'num_snps': 50295}. Best is trial 44 with value: 0.2978012528173976.
