[I 2025-12-08 22:37:44,389] Trial 103 finished with value: 0.35695994409028525 and parameters: {'model_type': 'gcn', 'hidden_dims': '[512, 128]', 'dropout': 0.49014421092756033, 'batch_norm': False, 'lr': 0.000164883241117597, 'weight_decay': 3.0667574975431704e-05, 'epochs': 96, 'loss': 'mae', 'optimizer': 'adam', 'graph_mode': 'cutoff', 'cutoff': 0.7512583069056723, 'grm_norm': 'cosine', 'self_loops': False, 'use_snp_selection': True, 'num_snps': 24039}. Best is trial 69 with value: 0.3680033444187648.
[I 2025-12-08 22:38:15,230] Trial 104 finished with value: 0.3665542395154843 and parameters: {'model_type': 'gcn', 'hidden_dims': '[512, 128]', 'dropout': 0.4624051496237729, 'batch_norm': False, 'lr': 0.00014288042001583015, 'weight_decay': 1.418314388705345e-05, 'epochs': 125, 'loss': 'mae', 'optimizer': 'adam', 'graph_mode': 'cutoff', 'cutoff': 0.648789893903157, 'grm_norm': 'cosine', 'self_loops': False, 'use_snp_selection': True, 'num_snps': 35797}. Best is trial 69 with value: 0.3680033444187648.
[I 2025-12-08 22:38:46,442] Trial 105 finished with value: 0.3697012984789329 and parameters: {'model_type': 'gcn', 'hidden_dims': '[512, 128]', 'dropout': 0.462426263067674, 'batch_norm': False, 'lr': 0.00021063059957707243, 'weight_decay': 2.2278124158137177e-05, 'epochs': 120, 'loss': 'mae', 'optimizer': 'adam', 'graph_mode': 'cutoff', 'cutoff': 0.6000409065107418, 'grm_norm': 'cosine', 'self_loops': False, 'use_snp_selection': True, 'num_snps': 37491}. Best is trial 105 with value: 0.3697012984789329.
[I 2025-12-08 22:39:16,425] Trial 106 finished with value: 0.3636626889549391 and parameters: {'model_type': 'gcn', 'hidden_dims': '[512, 128]', 'dropout': 0.4621437392430061, 'batch_norm': False, 'lr': 0.0002242553460345593, 'weight_decay': 4.284971014333331e-06, 'epochs': 117, 'loss': 'mae', 'optimizer': 'adam', 'graph_mode': 'cutoff', 'cutoff': 0.5718495012566224, 'grm_norm': 'cosine', 'self_loops': False, 'use_snp_selection': True, 'num_snps': 36148}. Best is trial 105 with value: 0.3697012984789329.
[I 2025-12-08 22:39:47,873] Trial 107 finished with value: 0.36809492348407136 and parameters: {'model_type': 'gcn', 'hidden_dims': '[512, 128]', 'dropout': 0.46630422813929423, 'batch_norm': False, 'lr': 0.00022232583775192268, 'weight_decay': 4.717791607162107e-06, 'epochs': 121, 'loss': 'mae', 'optimizer': 'adam', 'graph_mode': 'cutoff', 'cutoff': 0.5756755314372924, 'grm_norm': 'cosine', 'self_loops': False, 'use_snp_selection': True, 'num_snps': 37625}. Best is trial 105 with value: 0.3697012984789329.
[I 2025-12-08 22:40:20,998] Trial 108 finished with value: 0.2882919141115375 and parameters: {'model_type': 'gcn', 'hidden_dims': '[512, 128]', 'dropout': 0.45938000829346937, 'batch_norm': True, 'lr': 0.00021539584579518154, 'weight_decay': 4.545270707034701e-06, 'epochs': 120, 'loss': 'mae', 'optimizer': 'adam', 'graph_mode': 'cutoff', 'cutoff': 0.5606461851658554, 'grm_norm': 'cosine', 'self_loops': False, 'use_snp_selection': True, 'num_snps': 40079}. Best is trial 105 with value: 0.3697012984789329.
[I 2025-12-08 22:40:46,813] Trial 109 finished with value: 0.35701287214063904 and parameters: {'model_type': 'gcn', 'hidden_dims': '[512, 128]', 'dropout': 0.4709434312570495, 'batch_norm': False, 'lr': 0.0004526016481531666, 'weight_decay': 2.20824249994179e-06, 'epochs': 83, 'loss': 'mae', 'optimizer': 'adam', 'graph_mode': 'cutoff', 'cutoff': 0.5154408847673215, 'grm_norm': 'cosine', 'self_loops': False, 'use_snp_selection': True, 'num_snps': 36383}. Best is trial 105 with value: 0.3697012984789329.
[I 2025-12-08 22:41:15,659] Trial 110 finished with value: 0.36249926920980996 and parameters: {'model_type': 'gcn', 'hidden_dims': '[512, 128]', 'dropout': 0.44965775445423384, 'batch_norm': False, 'lr': 0.0002837657717238395, 'weight_decay': 3.879364743308831e-06, 'epochs': 108, 'loss': 'mae', 'optimizer': 'adam', 'graph_mode': 'cutoff', 'cutoff': 0.5872747817588602, 'grm_norm': 'cosine', 'self_loops': False, 'use_snp_selection': False}. Best is trial 105 with value: 0.3697012984789329.
[I 2025-12-08 22:41:46,683] Trial 111 finished with value: 0.36550358095610613 and parameters: {'model_type': 'gcn', 'hidden_dims': '[512, 128]', 'dropout': 0.42886109862968325, 'batch_norm': False, 'lr': 0.00013942203022982398, 'weight_decay': 6.822705239467823e-06, 'epochs': 117, 'loss': 'mae', 'optimizer': 'adam', 'graph_mode': 'cutoff', 'cutoff': 0.5986483958244488, 'grm_norm': 'cosine', 'self_loops': False, 'use_snp_selection': True, 'num_snps': 37817}. Best is trial 105 with value: 0.3697012984789329.
[I 2025-12-08 22:42:16,663] Trial 112 finished with value: 0.3630570653450474 and parameters: {'model_type': 'gcn', 'hidden_dims': '[512, 128]', 'dropout': 0.46071804112523035, 'batch_norm': False, 'lr': 0.0001382761427785976, 'weight_decay': 6.090227780833665e-06, 'epochs': 98, 'loss': 'mae', 'optimizer': 'adam', 'graph_mode': 'cutoff', 'cutoff': 0.6015810959903127, 'grm_norm': 'cosine', 'self_loops': False, 'use_snp_selection': True, 'num_snps': 40942}. Best is trial 105 with value: 0.3697012984789329.
[I 2025-12-08 22:42:48,381] Trial 113 finished with value: 0.3644124019624823 and parameters: {'model_type': 'gcn', 'hidden_dims': '[512, 128]', 'dropout': 0.42853684013115395, 'batch_norm': False, 'lr': 0.0002373267949261112, 'weight_decay': 7.075194316602707e-06, 'epochs': 104, 'loss': 'mae', 'optimizer': 'adam', 'graph_mode': 'cutoff', 'cutoff': 0.5736233558143268, 'grm_norm': 'cosine', 'self_loops': False, 'use_snp_selection': True, 'num_snps': 42276}. Best is trial 105 with value: 0.3697012984789329.
[I 2025-12-08 22:43:16,727] Trial 114 finished with value: 0.37435876783182165 and parameters: {'model_type': 'gcn', 'hidden_dims': '[512, 128]', 'dropout': 0.4245840481297584, 'batch_norm': False, 'lr': 0.000232769908716316, 'weight_decay': 6.862059155144902e-06, 'epochs': 99, 'loss': 'mae', 'optimizer': 'adam', 'graph_mode': 'cutoff', 'cutoff': 0.6012123173898576, 'grm_norm': 'cosine', 'self_loops': False, 'use_snp_selection': True, 'num_snps': 37685}. Best is trial 114 with value: 0.37435876783182165.
[I 2025-12-08 22:43:50,919] Trial 115 finished with value: 0.36068562951456995 and parameters: {'model_type': 'gcn', 'hidden_dims': '[512, 128]', 'dropout': 0.4326384567174369, 'batch_norm': False, 'lr': 0.00022538137818774813, 'weight_decay': 2.8345117192432183e-06, 'epochs': 129, 'loss': 'mae', 'optimizer': 'adam', 'graph_mode': 'cutoff', 'cutoff': 0.525799743023663, 'grm_norm': 'cosine', 'self_loops': False, 'use_snp_selection': True, 'num_snps': 38869}. Best is trial 114 with value: 0.37435876783182165.
[I 2025-12-08 22:44:20,122] Trial 116 finished with value: 0.33170353721257234 and parameters: {'model_type': 'gcn', 'hidden_dims': '[512, 128]', 'dropout': 0.4163455530339438, 'batch_norm': False, 'lr': 0.00029955385264680617, 'weight_decay': 5.1587916898994155e-06, 'epochs': 104, 'loss': 'mse', 'optimizer': 'adam', 'graph_mode': 'cutoff', 'cutoff': 0.572817780084605, 'grm_norm': 'cosine', 'self_loops': False, 'use_snp_selection': True, 'num_snps': 37953}. Best is trial 114 with value: 0.37435876783182165.
[I 2025-12-08 22:44:49,643] Trial 117 finished with value: 0.34350491758150337 and parameters: {'model_type': 'gcn', 'hidden_dims': '[512, 128]', 'dropout': 0.4267704545986358, 'batch_norm': False, 'lr': 0.00024853265847365585, 'weight_decay': 7.2159175923711056e-06, 'epochs': 113, 'loss': 'mae', 'optimizer': 'adam', 'graph_mode': 'knn', 'knn_k': 6, 'weighted_edges': False, 'symmetrize_mode': 'mutual', 'self_loops': False, 'use_snp_selection': True, 'num_snps': 35859}. Best is trial 114 with value: 0.37435876783182165.
[I 2025-12-08 22:45:19,106] Trial 118 finished with value: 0.3498446102077036 and parameters: {'model_type': 'gcn', 'hidden_dims': '[512, 128]', 'dropout': 0.47413481379411676, 'batch_norm': False, 'lr': 0.00035059642640242916, 'weight_decay': 8.987119910611971e-06, 'epochs': 72, 'loss': 'mae', 'optimizer': 'adam', 'graph_mode': 'cutoff', 'cutoff': 0.5602211840124243, 'grm_norm': 'cosine', 'self_loops': False, 'use_snp_selection': True, 'num_snps': 42362}. Best is trial 114 with value: 0.37435876783182165.
[I 2025-12-08 22:45:46,061] Trial 119 finished with value: 0.36033018872016953 and parameters: {'model_type': 'gcn', 'hidden_dims': '[512, 128]', 'dropout': 0.4387979761711627, 'batch_norm': False, 'lr': 0.00016492810680921875, 'weight_decay': 4.515379924170646e-06, 'epochs': 87, 'loss': 'mae', 'optimizer': 'adam', 'graph_mode': 'cutoff', 'cutoff': 0.5427847946381262, 'grm_norm': 'cosine', 'self_loops': False, 'use_snp_selection': True, 'num_snps': 37435}. Best is trial 114 with value: 0.37435876783182165.
[I 2025-12-08 22:46:17,463] Trial 120 finished with value: 0.35939863223975516 and parameters: {'model_type': 'gcn', 'hidden_dims': '[512, 128]', 'dropout': 0.39832784217785017, 'batch_norm': False, 'lr': 0.00014558927501288465, 'weight_decay': 2.2911077572759676e-05, 'epochs': 131, 'loss': 'mae', 'optimizer': 'adam', 'graph_mode': 'cutoff', 'cutoff': 0.5954608234482945, 'grm_norm': 'cosine', 'self_loops': False, 'use_snp_selection': True, 'num_snps': 34838}. Best is trial 114 with value: 0.37435876783182165.
[I 2025-12-08 22:46:47,741] Trial 121 finished with value: 0.3655911595014382 and parameters: {'model_type': 'gcn', 'hidden_dims': '[512, 128]', 'dropout': 0.46819173881619464, 'batch_norm': False, 'lr': 0.00014170330859561209, 'weight_decay': 6.32320282308596e-06, 'epochs': 98, 'loss': 'mae', 'optimizer': 'adam', 'graph_mode': 'cutoff', 'cutoff': 0.6113731772367346, 'grm_norm': 'cosine', 'self_loops': False, 'use_snp_selection': True, 'num_snps': 41438}. Best is trial 114 with value: 0.37435876783182165.
[I 2025-12-08 22:47:18,237] Trial 122 finished with value: 0.3532075811577298 and parameters: {'model_type': 'gcn', 'hidden_dims': '[512, 128]', 'dropout': 0.49885597196830256, 'batch_norm': False, 'lr': 0.0004124375553072721, 'weight_decay': 7.5106940674766006e-06, 'epochs': 96, 'loss': 'mae', 'optimizer': 'adam', 'graph_mode': 'cutoff', 'cutoff': 0.6145212742949644, 'grm_norm': 'cosine', 'self_loops': False, 'use_snp_selection': True, 'num_snps': 41515}. Best is trial 114 with value: 0.37435876783182165.
[I 2025-12-08 22:47:48,551] Trial 123 finished with value: 0.36119013267568595 and parameters: {'model_type': 'gcn', 'hidden_dims': '[512, 128]', 'dropout': 0.4684150629842475, 'batch_norm': False, 'lr': 0.00019058080939569053, 'weight_decay': 9.266115890368556e-06, 'epochs': 103, 'loss': 'mae', 'optimizer': 'adam', 'graph_mode': 'cutoff', 'cutoff': 0.6307048823351419, 'grm_norm': 'cosine', 'self_loops': False, 'use_snp_selection': True, 'num_snps': 39834}. Best is trial 114 with value: 0.37435876783182165.
[I 2025-12-08 22:48:19,904] Trial 124 finished with value: 0.35157589122983546 and parameters: {'model_type': 'gcn', 'hidden_dims': '[512, 128]', 'dropout': 0.4848083248340509, 'batch_norm': False, 'lr': 0.0001176174457346956, 'weight_decay': 4.799379754661895e-06, 'epochs': 116, 'loss': 'mae', 'optimizer': 'adam', 'graph_mode': 'cutoff', 'cutoff': 0.5061316012003387, 'grm_norm': 'cosine', 'self_loops': False, 'use_snp_selection': True, 'num_snps': 38161}. Best is trial 114 with value: 0.37435876783182165.
[I 2025-12-08 22:48:51,302] Trial 125 finished with value: 0.3600785157033031 and parameters: {'model_type': 'gcn', 'hidden_dims': '[512, 128]', 'dropout': 0.4134239605988388, 'batch_norm': False, 'lr': 0.0002483534004878722, 'weight_decay': 5.788829312525707e-06, 'epochs': 123, 'loss': 'mae', 'optimizer': 'adam', 'graph_mode': 'cutoff', 'cutoff': 0.6501045552543181, 'grm_norm': 'cosine', 'self_loops': False, 'use_snp_selection': True, 'num_snps': 36676}. Best is trial 114 with value: 0.37435876783182165.
[I 2025-12-08 22:49:24,852] Trial 126 finished with value: 0.3655926665119428 and parameters: {'model_type': 'gcn', 'hidden_dims': '[512, 128]', 'dropout': 0.45985595657006173, 'batch_norm': False, 'lr': 0.00017100232947628215, 'weight_decay': 2.694392586457301e-06, 'epochs': 108, 'loss': 'mae', 'optimizer': 'adam', 'graph_mode': 'cutoff', 'cutoff': 0.581580736638384, 'grm_norm': 'cosine', 'self_loops': False, 'use_snp_selection': True, 'num_snps': 44599}. Best is trial 114 with value: 0.37435876783182165.
[I 2025-12-08 22:49:58,680] Trial 127 finished with value: 0.12292649775315008 and parameters: {'model_type': 'gcn', 'hidden_dims': '[512, 128]', 'dropout': 0.4414983885440807, 'batch_norm': False, 'lr': 0.0021052442329129784, 'weight_decay': 2.1820816346131743e-06, 'epochs': 108, 'loss': 'mae', 'optimizer': 'adam', 'graph_mode': 'cutoff', 'cutoff': 0.6087911812168113, 'grm_norm': 'gcn', 'self_loops': True, 'use_snp_selection': True, 'num_snps': 45049}. Best is trial 114 with value: 0.37435876783182165.
[I 2025-12-08 22:50:28,804] Trial 128 finished with value: 0.3537481615422794 and parameters: {'model_type': 'gcn', 'hidden_dims': '[512, 128]', 'dropout': 0.42628041535556244, 'batch_norm': False, 'lr': 0.00014916614016095446, 'weight_decay': 3.0504285780321857e-06, 'epochs': 79, 'loss': 'mae', 'optimizer': 'adam', 'graph_mode': 'cutoff', 'cutoff': 0.6289441352889988, 'grm_norm': 'cosine', 'self_loops': False, 'use_snp_selection': True, 'num_snps': 47121}. Best is trial 114 with value: 0.37435876783182165.
[I 2025-12-08 22:50:49,057] Trial 129 finished with value: 0.3177847985198407 and parameters: {'model_type': 'gcn', 'hidden_dims': '[128, 64]', 'dropout': 0.47235696684463424, 'batch_norm': True, 'lr': 0.00017182257231075293, 'weight_decay': 1.802013021737886e-06, 'epochs': 127, 'loss': 'mae', 'optimizer': 'adam', 'graph_mode': 'cutoff', 'cutoff': 0.5859404663046435, 'grm_norm': 'cosine', 'self_loops': False, 'use_snp_selection': True, 'num_snps': 38726}. Best is trial 114 with value: 0.37435876783182165.
[I 2025-12-08 22:51:02,213] Trial 130 finished with value: 0.3240068119998838 and parameters: {'model_type': 'gcn', 'hidden_dims': '[256, 128, 64]', 'dropout': 0.5030160700601649, 'batch_norm': False, 'lr': 0.00012926067348383304, 'weight_decay': 1.0175767718843513e-05, 'epochs': 90, 'loss': 'mae', 'optimizer': 'adam', 'graph_mode': 'cutoff', 'cutoff': 0.5526945484577621, 'grm_norm': 'cosine', 'self_loops': False, 'use_snp_selection': False}. Best is trial 114 with value: 0.37435876783182165.
[I 2025-12-08 22:51:27,249] Trial 131 finished with value: 0.3025395615530784 and parameters: {'model_type': 'gcn', 'hidden_dims': '[512, 128]', 'dropout': 0.4604950970776405, 'batch_norm': False, 'lr': 0.0002136013312937134, 'weight_decay': 5.863281330630256e-06, 'epochs': 58, 'loss': 'mae', 'optimizer': 'adam', 'graph_mode': 'cutoff', 'cutoff': 0.5787271124958205, 'grm_norm': 'cosine', 'self_loops': False, 'use_snp_selection': True, 'num_snps': 43380}. Best is trial 114 with value: 0.37435876783182165.
[I 2025-12-08 22:51:55,660] Trial 132 finished with value: 0.3555198910667197 and parameters: {'model_type': 'gcn', 'hidden_dims': '[512, 128]', 'dropout': 0.4638521007942123, 'batch_norm': False, 'lr': 0.0006963899385404699, 'weight_decay': 4.017152033929738e-06, 'epochs': 112, 'loss': 'mae', 'optimizer': 'adam', 'graph_mode': 'cutoff', 'cutoff': 0.6021414015654141, 'grm_norm': 'cosine', 'self_loops': False, 'use_snp_selection': True, 'num_snps': 34457}. Best is trial 114 with value: 0.37435876783182165.
[I 2025-12-08 22:52:25,865] Trial 133 finished with value: 0.3628839292299356 and parameters: {'model_type': 'gcn', 'hidden_dims': '[512, 128]', 'dropout': 0.4871714042370413, 'batch_norm': False, 'lr': 0.00026340916013722606, 'weight_decay': 1.3992354794676512e-05, 'epochs': 100, 'loss': 'mae', 'optimizer': 'adam', 'graph_mode': 'cutoff', 'cutoff': 0.5701217924933272, 'grm_norm': 'cosine', 'self_loops': False, 'use_snp_selection': True, 'num_snps': 40457}. Best is trial 114 with value: 0.37435876783182165.
[I 2025-12-08 22:52:59,054] Trial 134 finished with value: 0.3476883916495977 and parameters: {'model_type': 'gcn', 'hidden_dims': '[512, 128]', 'dropout': 0.44412274365787824, 'batch_norm': False, 'lr': 0.0001862594597231152, 'weight_decay': 3.401006185377543e-06, 'epochs': 135, 'loss': 'mae', 'optimizer': 'adam', 'graph_mode': 'cutoff', 'cutoff': 0.49724871646023394, 'grm_norm': 'cosine', 'self_loops': False, 'use_snp_selection': True, 'num_snps': 36750}. Best is trial 114 with value: 0.37435876783182165.
[I 2025-12-08 22:53:23,903] Trial 135 finished with value: 0.34034748032889467 and parameters: {'model_type': 'gcn', 'hidden_dims': '[256, 128]', 'dropout': 0.4555590657105502, 'batch_norm': False, 'lr': 0.00015608103553952946, 'weight_decay': 7.0561407657354716e-06, 'epochs': 116, 'loss': 'mae', 'optimizer': 'adam', 'graph_mode': 'cutoff', 'cutoff': 0.6524222188010026, 'grm_norm': 'cosine', 'self_loops': False, 'use_snp_selection': True, 'num_snps': 42425}. Best is trial 114 with value: 0.37435876783182165.
[I 2025-12-08 22:53:56,895] Trial 136 finished with value: 0.3632493434465224 and parameters: {'model_type': 'gcn', 'hidden_dims': '[512, 128]', 'dropout': 0.4742736893421211, 'batch_norm': False, 'lr': 0.0001311644955387787, 'weight_decay': 5.100888394891385e-05, 'epochs': 143, 'loss': 'mae', 'optimizer': 'adam', 'graph_mode': 'cutoff', 'cutoff': 0.6227001453648418, 'grm_norm': 'cosine', 'self_loops': False, 'use_snp_selection': True, 'num_snps': 35066}. Best is trial 114 with value: 0.37435876783182165.
[I 2025-12-08 22:54:29,901] Trial 137 finished with value: 0.22645428855757638 and parameters: {'model_type': 'gcn', 'hidden_dims': '[512, 128]', 'dropout': 0.39073961972354515, 'batch_norm': False, 'lr': 0.00031130602722875323, 'weight_decay': 1.9535357411611102e-05, 'epochs': 125, 'loss': 'mse', 'optimizer': 'adam', 'graph_mode': 'cutoff', 'cutoff': 0.5381357152990963, 'grm_norm': 'cosine', 'self_loops': False, 'use_snp_selection': True, 'num_snps': 39382}. Best is trial 114 with value: 0.37435876783182165.
[I 2025-12-08 22:54:57,355] Trial 138 finished with value: 0.32989761620743224 and parameters: {'model_type': 'gcn', 'hidden_dims': '[512, 128]', 'dropout': 0.43390523956945454, 'batch_norm': False, 'lr': 0.00023479534664999936, 'weight_decay': 2.5921963157614003e-06, 'epochs': 104, 'loss': 'mae', 'optimizer': 'adam', 'graph_mode': 'knn', 'knn_k': 5, 'weighted_edges': True, 'symmetrize_mode': 'union', 'self_loops': False, 'use_snp_selection': True, 'num_snps': 33095}. Best is trial 114 with value: 0.37435876783182165.
[I 2025-12-08 22:55:28,542] Trial 139 finished with value: 0.36117732761127297 and parameters: {'model_type': 'gcn', 'hidden_dims': '[512, 128]', 'dropout': 0.478515736232379, 'batch_norm': False, 'lr': 0.00011215906106592938, 'weight_decay': 1.0179885935738001e-05, 'epochs': 149, 'loss': 'mae', 'optimizer': 'adam', 'graph_mode': 'cutoff', 'cutoff': 0.6354175036831177, 'grm_norm': 'cosine', 'self_loops': False, 'use_snp_selection': True, 'num_snps': 31278}. Best is trial 114 with value: 0.37435876783182165.
[I 2025-12-08 22:56:00,333] Trial 140 finished with value: 0.3626752597737905 and parameters: {'model_type': 'gcn', 'hidden_dims': '[512, 128]', 'dropout': 0.4211205209708583, 'batch_norm': False, 'lr': 0.00019112523043773207, 'weight_decay': 6.348207868818584e-06, 'epochs': 132, 'loss': 'mae', 'optimizer': 'adam', 'graph_mode': 'cutoff', 'cutoff': 0.5917065276291243, 'grm_norm': 'cosine', 'self_loops': False, 'use_snp_selection': True, 'num_snps': 35688}. Best is trial 114 with value: 0.37435876783182165.
[I 2025-12-08 22:56:28,958] Trial 141 finished with value: 0.36227956812313555 and parameters: {'model_type': 'gcn', 'hidden_dims': '[512, 128]', 'dropout': 0.4632555116486734, 'batch_norm': False, 'lr': 0.000135725762863666, 'weight_decay': 6.004980125767486e-05, 'epochs': 115, 'loss': 'mae', 'optimizer': 'adam', 'graph_mode': 'cutoff', 'cutoff': 0.6139434554420637, 'grm_norm': 'cosine', 'self_loops': False, 'use_snp_selection': True, 'num_snps': 34161}. Best is trial 114 with value: 0.37435876783182165.
[I 2025-12-08 22:57:03,334] Trial 142 finished with value: 0.3657110683731495 and parameters: {'model_type': 'gcn', 'hidden_dims': '[512, 128]', 'dropout': 0.4509159037500904, 'batch_norm': False, 'lr': 9.961738648630653e-05, 'weight_decay': 8.345961700130755e-05, 'epochs': 142, 'loss': 'mae', 'optimizer': 'adam', 'graph_mode': 'cutoff', 'cutoff': 0.6212844587865062, 'grm_norm': 'cosine', 'self_loops': False, 'use_snp_selection': True, 'num_snps': 37671}. Best is trial 114 with value: 0.37435876783182165.
[I 2025-12-08 22:57:31,167] Trial 143 finished with value: 0.3585153185949265 and parameters: {'model_type': 'gcn', 'hidden_dims': '[512, 128]', 'dropout': 0.4497799398999838, 'batch_norm': False, 'lr': 0.00010226766627610467, 'weight_decay': 8.489823244350284e-05, 'epochs': 96, 'loss': 'mae', 'optimizer': 'adam', 'graph_mode': 'cutoff', 'cutoff': 0.5990218057927238, 'grm_norm': 'cosine', 'self_loops': False, 'use_snp_selection': True, 'num_snps': 37347}. Best is trial 114 with value: 0.37435876783182165.
[I 2025-12-08 22:58:05,366] Trial 144 finished with value: 0.3688341336048301 and parameters: {'model_type': 'gcn', 'hidden_dims': '[512, 128]', 'dropout': 0.4930105117921284, 'batch_norm': False, 'lr': 9.780941737779544e-05, 'weight_decay': 3.447938338610481e-05, 'epochs': 124, 'loss': 'mae', 'optimizer': 'adam', 'graph_mode': 'cutoff', 'cutoff': 0.5605731316296727, 'grm_norm': 'cosine', 'self_loops': False, 'use_snp_selection': True, 'num_snps': 41312}. Best is trial 114 with value: 0.37435876783182165.
[I 2025-12-08 22:58:41,215] Trial 145 finished with value: 0.3668337450084251 and parameters: {'model_type': 'gcn', 'hidden_dims': '[512, 128]', 'dropout': 0.4908578821656553, 'batch_norm': False, 'lr': 7.566288551596429e-05, 'weight_decay': 3.403691190824105e-05, 'epochs': 124, 'loss': 'mae', 'optimizer': 'adam', 'graph_mode': 'cutoff', 'cutoff': 0.653165167562476, 'grm_norm': 'cosine', 'self_loops': False, 'use_snp_selection': True, 'num_snps': 43914}. Best is trial 114 with value: 0.37435876783182165.
