Running from this directory: /cluster/work/simennes/Project_thesis/Project_thesis
Name of job: gcn_t
ID of job: 23696749
The job was run on these nodes: idun-06-03
[I 2025-12-08 10:17:56,505] Trial 0 finished with value: 0.2893071597022555 and parameters: {'model_type': 'gcn', 'hidden_dims': '[128, 64]', 'dropout': 0.199031432379812, 'batch_norm': True, 'lr': 1.8408544111075823e-05, 'weight_decay': 5.5136510071208614e-05, 'epochs': 336, 'loss': 'mae', 'optimizer': 'adam', 'graph_mode': 'knn', 'knn_k': 8, 'weighted_edges': True, 'symmetrize_mode': 'mutual', 'self_loops': True, 'use_snp_selection': True, 'num_snps': 27173}. Best is trial 0 with value: 0.2893071597022555.
[I 2025-12-08 10:18:36,040] Trial 1 finished with value: 0.22760921898108027 and parameters: {'model_type': 'gcn', 'hidden_dims': '[256, 128, 64]', 'dropout': 0.5543244404043342, 'batch_norm': True, 'lr': 7.981787657617978e-05, 'weight_decay': 2.8571789869344834e-07, 'epochs': 297, 'loss': 'mae', 'optimizer': 'adam', 'graph_mode': 'cutoff', 'cutoff': 0.3392632777751686, 'grm_norm': 'gcn', 'self_loops': False, 'use_snp_selection': False}. Best is trial 0 with value: 0.2893071597022555.
[I 2025-12-08 10:19:34,411] Trial 2 finished with value: 0.25676608069578927 and parameters: {'model_type': 'gcn', 'hidden_dims': '[512, 64]', 'dropout': 0.32815227354739207, 'batch_norm': True, 'lr': 0.000619605044204259, 'weight_decay': 0.0004086269831625786, 'epochs': 206, 'loss': 'mse', 'optimizer': 'adam', 'graph_mode': 'knn', 'knn_k': 4, 'weighted_edges': True, 'symmetrize_mode': 'union', 'self_loops': True, 'use_snp_selection': True, 'num_snps': 53035}. Best is trial 0 with value: 0.2893071597022555.
[I 2025-12-08 10:20:02,462] Trial 3 finished with value: 0.2376257784725604 and parameters: {'model_type': 'gcn', 'hidden_dims': '[256, 128]', 'dropout': 0.23110783056597514, 'batch_norm': True, 'lr': 8.11311593386298e-05, 'weight_decay': 9.296158109581328e-07, 'epochs': 213, 'loss': 'mse', 'optimizer': 'adam', 'graph_mode': 'knn', 'knn_k': 10, 'weighted_edges': True, 'symmetrize_mode': 'mutual', 'self_loops': True, 'use_snp_selection': False}. Best is trial 0 with value: 0.2893071597022555.
[I 2025-12-08 10:20:17,510] Trial 4 finished with value: 0.34392974063828613 and parameters: {'model_type': 'gcn', 'hidden_dims': '[512, 256]', 'dropout': 0.2753281956415665, 'batch_norm': True, 'lr': 0.00034435188114839693, 'weight_decay': 4.9416012835950194e-05, 'epochs': 89, 'loss': 'mae', 'optimizer': 'adam', 'graph_mode': 'cutoff', 'cutoff': 0.820078967317394, 'grm_norm': 'none', 'self_loops': False, 'use_snp_selection': True, 'num_snps': 12674}. Best is trial 4 with value: 0.34392974063828613.
[I 2025-12-08 10:20:43,804] Trial 5 finished with value: 0.31310617592133216 and parameters: {'model_type': 'gcn', 'hidden_dims': '[128, 64]', 'dropout': 0.5611163934517731, 'batch_norm': True, 'lr': 0.0003984856210762587, 'weight_decay': 1.1466743517565185e-07, 'epochs': 344, 'loss': 'mae', 'optimizer': 'adam', 'graph_mode': 'cutoff', 'cutoff': 0.6089370799714728, 'grm_norm': 'gcn', 'self_loops': True, 'use_snp_selection': False}. Best is trial 4 with value: 0.34392974063828613.
[I 2025-12-08 10:21:06,946] Trial 6 finished with value: 0.28341830886251945 and parameters: {'model_type': 'gcn', 'hidden_dims': '[128, 64]', 'dropout': 0.31805912766941713, 'batch_norm': True, 'lr': 1.2361026034262557e-05, 'weight_decay': 6.492620232791903e-06, 'epochs': 271, 'loss': 'mse', 'optimizer': 'adam', 'graph_mode': 'cutoff', 'cutoff': 0.6193362582230448, 'grm_norm': 'cosine', 'self_loops': False, 'use_snp_selection': True, 'num_snps': 28594}. Best is trial 4 with value: 0.34392974063828613.
[I 2025-12-08 10:21:26,948] Trial 7 finished with value: 0.27825903799885554 and parameters: {'model_type': 'gcn', 'hidden_dims': '[512, 64]', 'dropout': 0.471337288649717, 'batch_norm': True, 'lr': 2.239693207292708e-05, 'weight_decay': 2.263166635514082e-06, 'epochs': 69, 'loss': 'mse', 'optimizer': 'adam', 'graph_mode': 'cutoff', 'cutoff': 0.4056820886426376, 'grm_norm': 'cosine', 'self_loops': False, 'use_snp_selection': False}. Best is trial 4 with value: 0.34392974063828613.
[I 2025-12-08 10:22:04,663] Trial 8 finished with value: 0.332327287744295 and parameters: {'model_type': 'gcn', 'hidden_dims': '[512, 256]', 'dropout': 0.20659328268932406, 'batch_norm': False, 'lr': 8.93315124361372e-05, 'weight_decay': 0.00028987480727919035, 'epochs': 136, 'loss': 'mae', 'optimizer': 'adam', 'graph_mode': 'knn', 'knn_k': 3, 'weighted_edges': False, 'symmetrize_mode': 'union', 'self_loops': False, 'use_snp_selection': True, 'num_snps': 43128}. Best is trial 4 with value: 0.34392974063828613.
[I 2025-12-08 10:22:47,096] Trial 9 finished with value: -0.004097010319929805 and parameters: {'model_type': 'gcn', 'hidden_dims': '[512, 256]', 'dropout': 0.2888209592870401, 'batch_norm': False, 'lr': 0.004734648143129892, 'weight_decay': 1.5879705591356368e-06, 'epochs': 163, 'loss': 'mse', 'optimizer': 'adam', 'graph_mode': 'cutoff', 'cutoff': 0.5984899797909019, 'grm_norm': 'cosine', 'self_loops': True, 'use_snp_selection': False}. Best is trial 4 with value: 0.34392974063828613.
[I 2025-12-08 10:22:56,334] Trial 10 finished with value: 0.31325844929106245 and parameters: {'model_type': 'gcn', 'hidden_dims': '[512, 128]', 'dropout': 0.11372025982957354, 'batch_norm': False, 'lr': 0.0023343012062770553, 'weight_decay': 4.14440562940608e-05, 'epochs': 41, 'loss': 'mae', 'optimizer': 'adam', 'graph_mode': 'cutoff', 'cutoff': 0.8740100033033124, 'grm_norm': 'none', 'self_loops': False, 'use_snp_selection': True, 'num_snps': 3859}. Best is trial 4 with value: 0.34392974063828613.
[I 2025-12-08 10:23:32,672] Trial 11 finished with value: 0.3222088800704342 and parameters: {'model_type': 'gcn', 'hidden_dims': '[512, 256]', 'dropout': 0.42220860806405436, 'batch_norm': False, 'lr': 0.00012587284186352953, 'weight_decay': 0.0006590033092812647, 'epochs': 114, 'loss': 'mae', 'optimizer': 'adam', 'graph_mode': 'knn', 'knn_k': 1, 'weighted_edges': False, 'symmetrize_mode': 'union', 'self_loops': False, 'use_snp_selection': True, 'num_snps': 47068}. Best is trial 4 with value: 0.34392974063828613.
[I 2025-12-08 10:23:47,514] Trial 12 finished with value: 0.3278467100618173 and parameters: {'model_type': 'gcn', 'hidden_dims': '[512, 256]', 'dropout': 0.14142767069304862, 'batch_norm': False, 'lr': 0.0011798598123878552, 'weight_decay': 9.414718277089941e-05, 'epochs': 124, 'loss': 'mae', 'optimizer': 'adam', 'graph_mode': 'knn', 'knn_k': 3, 'weighted_edges': False, 'symmetrize_mode': 'union', 'self_loops': False, 'use_snp_selection': True, 'num_snps': 8584}. Best is trial 4 with value: 0.34392974063828613.
[I 2025-12-08 10:24:18,349] Trial 13 finished with value: 0.33660531145076134 and parameters: {'model_type': 'gcn', 'hidden_dims': '[512, 256]', 'dropout': 0.23483876358445724, 'batch_norm': False, 'lr': 0.00018005512155234809, 'weight_decay': 0.00018148625050029915, 'epochs': 101, 'loss': 'mae', 'optimizer': 'adam', 'graph_mode': 'knn', 'knn_k': 6, 'weighted_edges': False, 'symmetrize_mode': 'union', 'self_loops': False, 'use_snp_selection': True, 'num_snps': 39863}. Best is trial 4 with value: 0.34392974063828613.
[I 2025-12-08 10:24:35,275] Trial 14 finished with value: 0.3327099276582241 and parameters: {'model_type': 'gcn', 'hidden_dims': '[512, 256]', 'dropout': 0.4254746032272495, 'batch_norm': False, 'lr': 0.0002379532657617651, 'weight_decay': 2.2203297076850073e-05, 'epochs': 82, 'loss': 'mae', 'optimizer': 'adam', 'graph_mode': 'cutoff', 'cutoff': 0.8944237199027842, 'grm_norm': 'none', 'self_loops': False, 'use_snp_selection': True, 'num_snps': 18062}. Best is trial 4 with value: 0.34392974063828613.
[I 2025-12-08 10:24:57,326] Trial 15 finished with value: 0.24401121081563254 and parameters: {'model_type': 'gcn', 'hidden_dims': '[256, 128, 64]', 'dropout': 0.2564047612056343, 'batch_norm': False, 'lr': 0.0008254853273697265, 'weight_decay': 0.00014901638558421508, 'epochs': 88, 'loss': 'mae', 'optimizer': 'adam', 'graph_mode': 'knn', 'knn_k': 7, 'weighted_edges': False, 'symmetrize_mode': 'union', 'self_loops': False, 'use_snp_selection': True, 'num_snps': 38253}. Best is trial 4 with value: 0.34392974063828613.
[I 2025-12-08 10:25:21,790] Trial 16 finished with value: 0.2536216006187225 and parameters: {'model_type': 'gcn', 'hidden_dims': '[512, 128]', 'dropout': 0.37665059630504216, 'batch_norm': True, 'lr': 0.0002301785186164904, 'weight_decay': 9.2348112544764e-06, 'epochs': 168, 'loss': 'mae', 'optimizer': 'adam', 'graph_mode': 'knn', 'knn_k': 6, 'weighted_edges': False, 'symmetrize_mode': 'mutual', 'self_loops': False, 'use_snp_selection': True, 'num_snps': 18435}. Best is trial 4 with value: 0.34392974063828613.
[I 2025-12-08 10:25:44,409] Trial 17 finished with value: 0.2718887333213155 and parameters: {'model_type': 'gcn', 'hidden_dims': '[256, 128]', 'dropout': 0.17806299578892837, 'batch_norm': False, 'lr': 4.072503007086959e-05, 'weight_decay': 0.00016023121200172893, 'epochs': 45, 'loss': 'mae', 'optimizer': 'adam', 'graph_mode': 'cutoff', 'cutoff': 0.7365908344247583, 'grm_norm': 'cosine_then_gcn', 'self_loops': False, 'use_snp_selection': True, 'num_snps': 58441}. Best is trial 4 with value: 0.34392974063828613.
[I 2025-12-08 10:26:21,098] Trial 18 finished with value: 0.2703743658751922 and parameters: {'model_type': 'gcn', 'hidden_dims': '[512, 256]', 'dropout': 0.2636526873191328, 'batch_norm': True, 'lr': 0.00838578189186818, 'weight_decay': 2.5392258529917177e-05, 'epochs': 162, 'loss': 'mae', 'optimizer': 'adam', 'graph_mode': 'knn', 'knn_k': 9, 'weighted_edges': False, 'symmetrize_mode': 'union', 'self_loops': False, 'use_snp_selection': True, 'num_snps': 34445}. Best is trial 4 with value: 0.34392974063828613.
[I 2025-12-08 10:26:51,323] Trial 19 finished with value: 0.30998410112097324 and parameters: {'model_type': 'gcn', 'hidden_dims': '[512, 256]', 'dropout': 0.3712388260466385, 'batch_norm': False, 'lr': 0.0017155069867009734, 'weight_decay': 0.0009594690048001424, 'epochs': 236, 'loss': 'mae', 'optimizer': 'adam', 'graph_mode': 'cutoff', 'cutoff': 0.2386548621641688, 'grm_norm': 'none', 'self_loops': False, 'use_snp_selection': True, 'num_snps': 17731}. Best is trial 4 with value: 0.34392974063828613.
[I 2025-12-08 10:27:13,465] Trial 20 finished with value: 0.34126072626394055 and parameters: {'model_type': 'gcn', 'hidden_dims': '[512, 256]', 'dropout': 0.16197658307326462, 'batch_norm': False, 'lr': 0.0003375235593966263, 'weight_decay': 1.3627762158375425e-05, 'epochs': 102, 'loss': 'mae', 'optimizer': 'adam', 'graph_mode': 'cutoff', 'cutoff': 0.7550233606026814, 'grm_norm': 'cosine_then_gcn', 'self_loops': False, 'use_snp_selection': True, 'num_snps': 24828}. Best is trial 4 with value: 0.34392974063828613.
[I 2025-12-08 10:27:34,466] Trial 21 finished with value: 0.3471410223196152 and parameters: {'model_type': 'gcn', 'hidden_dims': '[512, 256]', 'dropout': 0.15791007695155174, 'batch_norm': False, 'lr': 0.0003962910134077785, 'weight_decay': 1.6206393908885257e-05, 'epochs': 96, 'loss': 'mae', 'optimizer': 'adam', 'graph_mode': 'cutoff', 'cutoff': 0.7559354342028177, 'grm_norm': 'cosine_then_gcn', 'self_loops': False, 'use_snp_selection': True, 'num_snps': 23877}. Best is trial 21 with value: 0.3471410223196152.
[I 2025-12-08 10:27:58,666] Trial 22 finished with value: 0.3381778761286084 and parameters: {'model_type': 'gcn', 'hidden_dims': '[512, 256]', 'dropout': 0.15723991490283562, 'batch_norm': False, 'lr': 0.0004463459025205235, 'weight_decay': 6.421029097550443e-06, 'epochs': 133, 'loss': 'mae', 'optimizer': 'adam', 'graph_mode': 'cutoff', 'cutoff': 0.7688228325477409, 'grm_norm': 'cosine_then_gcn', 'self_loops': False, 'use_snp_selection': True, 'num_snps': 23314}. Best is trial 21 with value: 0.3471410223196152.
[I 2025-12-08 10:28:11,669] Trial 23 finished with value: 0.3451648676800451 and parameters: {'model_type': 'gcn', 'hidden_dims': '[512, 256]', 'dropout': 0.12009211195398284, 'batch_norm': False, 'lr': 0.000358658188383162, 'weight_decay': 2.2162117347098698e-05, 'epochs': 65, 'loss': 'mae', 'optimizer': 'adam', 'graph_mode': 'cutoff', 'cutoff': 0.7444647125279281, 'grm_norm': 'cosine_then_gcn', 'self_loops': False, 'use_snp_selection': True, 'num_snps': 11597}. Best is trial 21 with value: 0.3471410223196152.
[I 2025-12-08 10:28:24,182] Trial 24 finished with value: 0.3501916586441283 and parameters: {'model_type': 'gcn', 'hidden_dims': '[512, 256]', 'dropout': 0.11781460126671443, 'batch_norm': False, 'lr': 0.0007518938254560987, 'weight_decay': 4.076075300932442e-06, 'epochs': 60, 'loss': 'mae', 'optimizer': 'adam', 'graph_mode': 'cutoff', 'cutoff': 0.7221944772335787, 'grm_norm': 'cosine_then_gcn', 'self_loops': False, 'use_snp_selection': True, 'num_snps': 10717}. Best is trial 24 with value: 0.3501916586441283.
[I 2025-12-08 10:28:33,944] Trial 25 finished with value: 0.34044364404451494 and parameters: {'model_type': 'gcn', 'hidden_dims': '[512, 128]', 'dropout': 0.10925925569918463, 'batch_norm': False, 'lr': 0.0009409608966986038, 'weight_decay': 3.56466325539028e-06, 'epochs': 66, 'loss': 'mae', 'optimizer': 'adam', 'graph_mode': 'cutoff', 'cutoff': 0.6773848313161432, 'grm_norm': 'cosine_then_gcn', 'self_loops': False, 'use_snp_selection': True, 'num_snps': 3320}. Best is trial 24 with value: 0.3501916586441283.
[I 2025-12-08 10:28:41,545] Trial 26 finished with value: -0.008281306534628736 and parameters: {'model_type': 'gcn', 'hidden_dims': '[256, 128, 64]', 'dropout': 0.10689292820282148, 'batch_norm': False, 'lr': 0.0026158786531554246, 'weight_decay': 7.026349024016814e-07, 'epochs': 44, 'loss': 'mse', 'optimizer': 'adam', 'graph_mode': 'cutoff', 'cutoff': 0.4940367267437375, 'grm_norm': 'cosine_then_gcn', 'self_loops': True, 'use_snp_selection': False}. Best is trial 24 with value: 0.3501916586441283.
[I 2025-12-08 10:28:53,095] Trial 27 finished with value: 0.3517598284332952 and parameters: {'model_type': 'gcn', 'hidden_dims': '[256, 128]', 'dropout': 0.13070935660827487, 'batch_norm': False, 'lr': 0.0006263132282190044, 'weight_decay': 1.5271691254150556e-05, 'epochs': 66, 'loss': 'mae', 'optimizer': 'adam', 'graph_mode': 'cutoff', 'cutoff': 0.7012083836212005, 'grm_norm': 'cosine_then_gcn', 'self_loops': False, 'use_snp_selection': True, 'num_snps': 10993}. Best is trial 27 with value: 0.3517598284332952.
[I 2025-12-08 10:29:05,857] Trial 28 finished with value: 0.3150300800989327 and parameters: {'model_type': 'gcn', 'hidden_dims': '[256, 128]', 'dropout': 0.18275802542837358, 'batch_norm': False, 'lr': 0.0013916779810629483, 'weight_decay': 3.6096636673816993e-06, 'epochs': 150, 'loss': 'mae', 'optimizer': 'adam', 'graph_mode': 'cutoff', 'cutoff': 0.678695026247042, 'grm_norm': 'cosine_then_gcn', 'self_loops': False, 'use_snp_selection': True, 'num_snps': 8027}. Best is trial 27 with value: 0.3517598284332952.
[I 2025-12-08 10:29:23,588] Trial 29 finished with value: 0.3380775232703932 and parameters: {'model_type': 'gcn', 'hidden_dims': '[256, 128]', 'dropout': 0.18465944904706047, 'batch_norm': False, 'lr': 0.003987179142489036, 'weight_decay': 1.543208967592796e-05, 'epochs': 184, 'loss': 'mae', 'optimizer': 'adam', 'graph_mode': 'cutoff', 'cutoff': 0.49256596882969794, 'grm_norm': 'cosine_then_gcn', 'self_loops': True, 'use_snp_selection': True, 'num_snps': 15766}. Best is trial 27 with value: 0.3517598284332952.
[I 2025-12-08 10:29:38,150] Trial 30 finished with value: 0.3454331434682088 and parameters: {'model_type': 'gcn', 'hidden_dims': '[256, 128]', 'dropout': 0.2116249696446563, 'batch_norm': False, 'lr': 0.00015264676719210015, 'weight_decay': 4.588651012742765e-06, 'epochs': 59, 'loss': 'mae', 'optimizer': 'adam', 'graph_mode': 'cutoff', 'cutoff': 0.6693085398968817, 'grm_norm': 'cosine_then_gcn', 'self_loops': False, 'use_snp_selection': True, 'num_snps': 22708}. Best is trial 27 with value: 0.3517598284332952.
[I 2025-12-08 10:29:51,984] Trial 31 finished with value: 0.34490156546153006 and parameters: {'model_type': 'gcn', 'hidden_dims': '[256, 128]', 'dropout': 0.2081521217381557, 'batch_norm': False, 'lr': 0.0006024314375922735, 'weight_decay': 4.659004854087897e-06, 'epochs': 63, 'loss': 'mae', 'optimizer': 'adam', 'graph_mode': 'cutoff', 'cutoff': 0.6856383321898807, 'grm_norm': 'cosine_then_gcn', 'self_loops': False, 'use_snp_selection': True, 'num_snps': 19351}. Best is trial 27 with value: 0.3517598284332952.
[I 2025-12-08 10:30:09,009] Trial 32 finished with value: 0.34111877484001163 and parameters: {'model_type': 'gcn', 'hidden_dims': '[256, 128]', 'dropout': 0.14150895876962705, 'batch_norm': False, 'lr': 0.00014876359553465523, 'weight_decay': 1.6059243941084847e-06, 'epochs': 112, 'loss': 'mae', 'optimizer': 'adam', 'graph_mode': 'cutoff', 'cutoff': 0.8118314882634499, 'grm_norm': 'cosine_then_gcn', 'self_loops': False, 'use_snp_selection': True, 'num_snps': 22165}. Best is trial 27 with value: 0.3517598284332952.
[I 2025-12-08 10:30:42,378] Trial 33 finished with value: 0.32967343310319835 and parameters: {'model_type': 'gcn', 'hidden_dims': '[256, 128]', 'dropout': 0.1423138456436348, 'batch_norm': False, 'lr': 4.7521678076545747e-05, 'weight_decay': 1.0848470190856575e-05, 'epochs': 315, 'loss': 'mae', 'optimizer': 'adam', 'graph_mode': 'cutoff', 'cutoff': 0.6738162470814064, 'grm_norm': 'cosine_then_gcn', 'self_loops': False, 'use_snp_selection': True, 'num_snps': 30601}. Best is trial 27 with value: 0.3517598284332952.
[I 2025-12-08 10:31:05,392] Trial 34 finished with value: -0.018557991184657653 and parameters: {'model_type': 'gcn', 'hidden_dims': '[512, 64]', 'dropout': 0.22930724978812494, 'batch_norm': False, 'lr': 0.0006276776998448425, 'weight_decay': 3.946637445760036e-07, 'epochs': 83, 'loss': 'mae', 'optimizer': 'adam', 'graph_mode': 'cutoff', 'cutoff': 0.8161320655869976, 'grm_norm': 'cosine_then_gcn', 'self_loops': False, 'use_snp_selection': False}. Best is trial 27 with value: 0.3517598284332952.
[I 2025-12-08 10:31:17,003] Trial 35 finished with value: 0.2667208116603108 and parameters: {'model_type': 'gcn', 'hidden_dims': '[256, 128]', 'dropout': 0.20733852990023846, 'batch_norm': False, 'lr': 0.0005682180170538771, 'weight_decay': 2.2717394810406624e-06, 'epochs': 54, 'loss': 'mse', 'optimizer': 'adam', 'graph_mode': 'cutoff', 'cutoff': 0.5709708604139627, 'grm_norm': 'cosine_then_gcn', 'self_loops': True, 'use_snp_selection': True, 'num_snps': 12837}. Best is trial 27 with value: 0.3517598284332952.
[I 2025-12-08 10:31:27,358] Trial 36 finished with value: 0.33235879801841994 and parameters: {'model_type': 'gcn', 'hidden_dims': '[128, 64]', 'dropout': 0.13669136279340172, 'batch_norm': False, 'lr': 0.00011562236965710195, 'weight_decay': 6.776710995196693e-05, 'epochs': 78, 'loss': 'mae', 'optimizer': 'adam', 'graph_mode': 'cutoff', 'cutoff': 0.7193761558497307, 'grm_norm': 'gcn', 'self_loops': False, 'use_snp_selection': True, 'num_snps': 8692}. Best is trial 27 with value: 0.3517598284332952.
[I 2025-12-08 10:31:41,025] Trial 37 finished with value: 0.12441716707703798 and parameters: {'model_type': 'gcn', 'hidden_dims': '[256, 128]', 'dropout': 0.5902537114089704, 'batch_norm': False, 'lr': 0.0002310654642769748, 'weight_decay': 8.345575940748882e-07, 'epochs': 98, 'loss': 'mae', 'optimizer': 'adam', 'graph_mode': 'cutoff', 'cutoff': 0.6458776816395267, 'grm_norm': 'cosine_then_gcn', 'self_loops': False, 'use_snp_selection': False}. Best is trial 27 with value: 0.3517598284332952.
[I 2025-12-08 10:31:56,621] Trial 38 finished with value: 0.34868349277758787 and parameters: {'model_type': 'gcn', 'hidden_dims': '[256, 128, 64]', 'dropout': 0.17728136290008992, 'batch_norm': False, 'lr': 5.6248057305645005e-05, 'weight_decay': 3.946051121509703e-05, 'epochs': 56, 'loss': 'mse', 'optimizer': 'adam', 'graph_mode': 'cutoff', 'cutoff': 0.5193273863379942, 'grm_norm': 'cosine_then_gcn', 'self_loops': True, 'use_snp_selection': True, 'num_snps': 26280}. Best is trial 27 with value: 0.3517598284332952.
[I 2025-12-08 10:32:24,412] Trial 39 finished with value: 0.26080734739606115 and parameters: {'model_type': 'gcn', 'hidden_dims': '[256, 128, 64]', 'dropout': 0.164523977697281, 'batch_norm': True, 'lr': 4.865033660396054e-05, 'weight_decay': 5.10324458969281e-05, 'epochs': 227, 'loss': 'mse', 'optimizer': 'adam', 'graph_mode': 'cutoff', 'cutoff': 0.5136546829777229, 'grm_norm': 'cosine_then_gcn', 'self_loops': True, 'use_snp_selection': True, 'num_snps': 27719}. Best is trial 27 with value: 0.3517598284332952.
[I 2025-12-08 10:32:40,978] Trial 40 finished with value: 0.3339506953130283 and parameters: {'model_type': 'gcn', 'hidden_dims': '[256, 128, 64]', 'dropout': 0.3197014327718655, 'batch_norm': False, 'lr': 1.8682703174501623e-05, 'weight_decay': 3.524090792440202e-05, 'epochs': 119, 'loss': 'mse', 'optimizer': 'adam', 'graph_mode': 'cutoff', 'cutoff': 0.4168804721207486, 'grm_norm': 'gcn', 'self_loops': True, 'use_snp_selection': False}. Best is trial 27 with value: 0.3517598284332952.
[I 2025-12-08 10:32:55,642] Trial 41 finished with value: 0.3435727369148334 and parameters: {'model_type': 'gcn', 'hidden_dims': '[256, 128, 64]', 'dropout': 0.2315098751424453, 'batch_norm': False, 'lr': 6.421239728547072e-05, 'weight_decay': 8.730053633034201e-06, 'epochs': 57, 'loss': 'mse', 'optimizer': 'adam', 'graph_mode': 'cutoff', 'cutoff': 0.5672101289725582, 'grm_norm': 'cosine_then_gcn', 'self_loops': True, 'use_snp_selection': True, 'num_snps': 22521}. Best is trial 27 with value: 0.3517598284332952.
