[I 2025-12-08 17:05:40,836] Trial 93 finished with value: 0.28131015217609256 and parameters: {'model_type': 'gcn', 'hidden_dims': '[512, 256]', 'dropout': 0.35653385318812, 'batch_norm': False, 'lr': 1.56709714727774e-05, 'weight_decay': 0.0004210457843996249, 'epochs': 150, 'loss': 'mse', 'optimizer': 'adam', 'graph_mode': 'cutoff', 'cutoff': 0.6827707758111685, 'grm_norm': 'none', 'self_loops': False, 'use_snp_selection': True, 'num_snps': 34931}. Best is trial 63 with value: 0.29437649173181957.
[I 2025-12-08 17:06:20,853] Trial 94 finished with value: 0.28731195778725205 and parameters: {'model_type': 'gcn', 'hidden_dims': '[512, 256]', 'dropout': 0.43124937552318654, 'batch_norm': False, 'lr': 7.100489854784947e-05, 'weight_decay': 7.660101408975662e-05, 'epochs': 123, 'loss': 'mse', 'optimizer': 'adam', 'graph_mode': 'cutoff', 'cutoff': 0.6256168813490426, 'grm_norm': 'cosine_then_gcn', 'self_loops': False, 'use_snp_selection': True, 'num_snps': 50773}. Best is trial 63 with value: 0.29437649173181957.
[I 2025-12-08 17:06:51,031] Trial 95 finished with value: 0.23121560441884387 and parameters: {'model_type': 'gcn', 'hidden_dims': '[128, 64]', 'dropout': 0.3906439383151716, 'batch_norm': True, 'lr': 5.882503306009202e-05, 'weight_decay': 0.00013391479057360406, 'epochs': 199, 'loss': 'mse', 'optimizer': 'adam', 'graph_mode': 'cutoff', 'cutoff': 0.5534960832653353, 'grm_norm': 'cosine_then_gcn', 'self_loops': False, 'use_snp_selection': True, 'num_snps': 58889}. Best is trial 63 with value: 0.29437649173181957.
[I 2025-12-08 17:07:35,240] Trial 96 finished with value: 0.25830261926791137 and parameters: {'model_type': 'gcn', 'hidden_dims': '[512, 128]', 'dropout': 0.317613698764604, 'batch_norm': False, 'lr': 2.541802465095641e-05, 'weight_decay': 0.0002446453444293496, 'epochs': 210, 'loss': 'mse', 'optimizer': 'adam', 'graph_mode': 'knn', 'knn_k': 2, 'weighted_edges': False, 'symmetrize_mode': 'mutual', 'self_loops': False, 'use_snp_selection': True, 'num_snps': 37098}. Best is trial 63 with value: 0.29437649173181957.
[I 2025-12-08 17:08:07,967] Trial 97 finished with value: 0.01676294569290961 and parameters: {'model_type': 'gcn', 'hidden_dims': '[256, 128, 64]', 'dropout': 0.4125804058021382, 'batch_norm': False, 'lr': 0.008738350066447121, 'weight_decay': 0.0001860443535623889, 'epochs': 174, 'loss': 'mae', 'optimizer': 'adam', 'graph_mode': 'cutoff', 'cutoff': 0.6616521380544387, 'grm_norm': 'none', 'self_loops': True, 'use_snp_selection': True, 'num_snps': 46673}. Best is trial 63 with value: 0.29437649173181957.
[I 2025-12-08 17:08:52,122] Trial 98 finished with value: 0.27406062009098925 and parameters: {'model_type': 'gcn', 'hidden_dims': '[512, 256]', 'dropout': 0.3373476825231231, 'batch_norm': True, 'lr': 1.9741996482758697e-05, 'weight_decay': 2.8760293704860263e-05, 'epochs': 188, 'loss': 'mse', 'optimizer': 'adam', 'graph_mode': 'cutoff', 'cutoff': 0.7186579242349724, 'grm_norm': 'cosine_then_gcn', 'self_loops': False, 'use_snp_selection': True, 'num_snps': 40249}. Best is trial 63 with value: 0.29437649173181957.
[I 2025-12-08 17:09:24,073] Trial 99 finished with value: 0.2845852204789354 and parameters: {'model_type': 'gcn', 'hidden_dims': '[512, 256]', 'dropout': 0.4953682470139235, 'batch_norm': False, 'lr': 4.1752182065115265e-05, 'weight_decay': 8.684187217855817e-05, 'epochs': 157, 'loss': 'mse', 'optimizer': 'adam', 'graph_mode': 'cutoff', 'cutoff': 0.6387462973832538, 'grm_norm': 'cosine', 'self_loops': False, 'use_snp_selection': True, 'num_snps': 31066}. Best is trial 63 with value: 0.29437649173181957.
[I 2025-12-08 17:09:58,953] Trial 100 finished with value: 0.284232109686812 and parameters: {'model_type': 'gcn', 'hidden_dims': '[256, 128]', 'dropout': 0.459741747660149, 'batch_norm': False, 'lr': 3.0254017565058896e-05, 'weight_decay': 5.321395642204317e-05, 'epochs': 218, 'loss': 'mae', 'optimizer': 'adam', 'graph_mode': 'cutoff', 'cutoff': 0.5699491488769929, 'grm_norm': 'cosine_then_gcn', 'self_loops': False, 'use_snp_selection': True, 'num_snps': 44349}. Best is trial 63 with value: 0.29437649173181957.
[I 2025-12-08 17:10:41,617] Trial 101 finished with value: 0.27719814979316565 and parameters: {'model_type': 'gcn', 'hidden_dims': '[512, 256]', 'dropout': 0.42895000269397976, 'batch_norm': False, 'lr': 7.342892811022229e-05, 'weight_decay': 7.116619367417016e-05, 'epochs': 144, 'loss': 'mse', 'optimizer': 'adam', 'graph_mode': 'cutoff', 'cutoff': 0.6179980156819888, 'grm_norm': 'cosine_then_gcn', 'self_loops': False, 'use_snp_selection': True, 'num_snps': 48786}. Best is trial 63 with value: 0.29437649173181957.
[I 2025-12-08 17:11:21,243] Trial 102 finished with value: 0.28679062096723174 and parameters: {'model_type': 'gcn', 'hidden_dims': '[512, 256]', 'dropout': 0.40447110267764497, 'batch_norm': False, 'lr': 5.718273570895475e-05, 'weight_decay': 0.0001577891351616079, 'epochs': 121, 'loss': 'mse', 'optimizer': 'adam', 'graph_mode': 'cutoff', 'cutoff': 0.6911487234658813, 'grm_norm': 'cosine_then_gcn', 'self_loops': False, 'use_snp_selection': True, 'num_snps': 50275}. Best is trial 63 with value: 0.29437649173181957.
[I 2025-12-08 17:11:56,358] Trial 103 finished with value: 0.28486313288634457 and parameters: {'model_type': 'gcn', 'hidden_dims': '[512, 256]', 'dropout': 0.36122863750681283, 'batch_norm': False, 'lr': 3.546635223584306e-05, 'weight_decay': 8.776511463905266e-05, 'epochs': 95, 'loss': 'mse', 'optimizer': 'adam', 'graph_mode': 'cutoff', 'cutoff': 0.5955930373167656, 'grm_norm': 'cosine_then_gcn', 'self_loops': False, 'use_snp_selection': True, 'num_snps': 51725}. Best is trial 63 with value: 0.29437649173181957.
[I 2025-12-08 17:13:05,724] Trial 104 finished with value: 0.2745167354346893 and parameters: {'model_type': 'gcn', 'hidden_dims': '[512, 256]', 'dropout': 0.4711997129795836, 'batch_norm': False, 'lr': 8.88162440622929e-05, 'weight_decay': 4.086556780153848e-05, 'epochs': 262, 'loss': 'mse', 'optimizer': 'adam', 'graph_mode': 'cutoff', 'cutoff': 0.6255773924282374, 'grm_norm': 'cosine_then_gcn', 'self_loops': False, 'use_snp_selection': True, 'num_snps': 53883}. Best is trial 63 with value: 0.29437649173181957.
[I 2025-12-08 17:13:44,681] Trial 105 finished with value: 0.28820059900272943 and parameters: {'model_type': 'gcn', 'hidden_dims': '[512, 256]', 'dropout': 0.568208929086528, 'batch_norm': False, 'lr': 2.5287257748288984e-05, 'weight_decay': 2.423358859842937e-05, 'epochs': 128, 'loss': 'mse', 'optimizer': 'adam', 'graph_mode': 'cutoff', 'cutoff': 0.6489065818889467, 'grm_norm': 'cosine_then_gcn', 'self_loops': False, 'use_snp_selection': True, 'num_snps': 47246}. Best is trial 63 with value: 0.29437649173181957.
[I 2025-12-08 17:14:22,653] Trial 106 finished with value: 0.26756858760217167 and parameters: {'model_type': 'gcn', 'hidden_dims': '[512, 256]', 'dropout': 0.5630573840967876, 'batch_norm': True, 'lr': 1.863400671319434e-05, 'weight_decay': 1.1372105410936446e-05, 'epochs': 130, 'loss': 'mse', 'optimizer': 'adam', 'graph_mode': 'cutoff', 'cutoff': 0.6632624889121472, 'grm_norm': 'gcn', 'self_loops': False, 'use_snp_selection': True, 'num_snps': 45385}. Best is trial 63 with value: 0.29437649173181957.
[I 2025-12-08 17:14:46,111] Trial 107 finished with value: 0.2834603789549958 and parameters: {'model_type': 'gcn', 'hidden_dims': '[128, 64]', 'dropout': 0.5345050395824955, 'batch_norm': False, 'lr': 2.682189654500623e-05, 'weight_decay': 1.7071458489551537e-05, 'epochs': 179, 'loss': 'mse', 'optimizer': 'adam', 'graph_mode': 'cutoff', 'cutoff': 0.7076589509269654, 'grm_norm': 'none', 'self_loops': True, 'use_snp_selection': True, 'num_snps': 42277}. Best is trial 63 with value: 0.29437649173181957.
[I 2025-12-08 17:15:22,065] Trial 108 finished with value: 0.25235226026090407 and parameters: {'model_type': 'gcn', 'hidden_dims': '[512, 256]', 'dropout': 0.5746946408635588, 'batch_norm': False, 'lr': 1.2476864373939726e-05, 'weight_decay': 2.3960739667344478e-05, 'epochs': 111, 'loss': 'mae', 'optimizer': 'adam', 'graph_mode': 'cutoff', 'cutoff': 0.8730985631876773, 'grm_norm': 'cosine_then_gcn', 'self_loops': False, 'use_snp_selection': True, 'num_snps': 47235}. Best is trial 63 with value: 0.29437649173181957.
[I 2025-12-08 17:16:05,639] Trial 109 finished with value: 0.06765348622210925 and parameters: {'model_type': 'gcn', 'hidden_dims': '[512, 256]', 'dropout': 0.5906290097741438, 'batch_norm': False, 'lr': 0.00037511007083065027, 'weight_decay': 3.2118930764635666e-05, 'epochs': 169, 'loss': 'mse', 'optimizer': 'adam', 'graph_mode': 'cutoff', 'cutoff': 0.6507146680905043, 'grm_norm': 'none', 'self_loops': False, 'use_snp_selection': False}. Best is trial 63 with value: 0.29437649173181957.
[I 2025-12-08 17:16:56,565] Trial 110 finished with value: 0.2697883234183712 and parameters: {'model_type': 'gcn', 'hidden_dims': '[512, 256]', 'dropout': 0.5986742450817446, 'batch_norm': True, 'lr': 2.2006484114039705e-05, 'weight_decay': 0.0002268327671196263, 'epochs': 150, 'loss': 'mse', 'optimizer': 'adam', 'graph_mode': 'knn', 'knn_k': 6, 'weighted_edges': True, 'symmetrize_mode': 'union', 'self_loops': False, 'use_snp_selection': True, 'num_snps': 57614}. Best is trial 63 with value: 0.29437649173181957.
[I 2025-12-08 17:17:30,541] Trial 111 finished with value: 0.29285372136982185 and parameters: {'model_type': 'gcn', 'hidden_dims': '[512, 256]', 'dropout': 0.43320005604718903, 'batch_norm': False, 'lr': 3.186656954378937e-05, 'weight_decay': 5.8823392403636944e-05, 'epochs': 104, 'loss': 'mse', 'optimizer': 'adam', 'graph_mode': 'cutoff', 'cutoff': 0.636547938224499, 'grm_norm': 'cosine_then_gcn', 'self_loops': False, 'use_snp_selection': True, 'num_snps': 46315}. Best is trial 63 with value: 0.29437649173181957.
[I 2025-12-08 17:18:04,765] Trial 112 finished with value: 0.2772527947785439 and parameters: {'model_type': 'gcn', 'hidden_dims': '[512, 256]', 'dropout': 0.44116133519175377, 'batch_norm': False, 'lr': 0.0002626919163589147, 'weight_decay': 5.799551257227916e-05, 'epochs': 106, 'loss': 'mse', 'optimizer': 'adam', 'graph_mode': 'cutoff', 'cutoff': 0.6890869973696457, 'grm_norm': 'cosine_then_gcn', 'self_loops': False, 'use_snp_selection': True, 'num_snps': 46169}. Best is trial 63 with value: 0.29437649173181957.
[I 2025-12-08 17:18:31,643] Trial 113 finished with value: 0.27984134212561623 and parameters: {'model_type': 'gcn', 'hidden_dims': '[512, 256]', 'dropout': 0.4209963295039164, 'batch_norm': False, 'lr': 3.115368091181519e-05, 'weight_decay': 0.0002921323389590555, 'epochs': 76, 'loss': 'mse', 'optimizer': 'adam', 'graph_mode': 'cutoff', 'cutoff': 0.6392710447657871, 'grm_norm': 'cosine_then_gcn', 'self_loops': False, 'use_snp_selection': True, 'num_snps': 40998}. Best is trial 63 with value: 0.29437649173181957.
[I 2025-12-08 17:18:56,991] Trial 114 finished with value: 0.2808671161122752 and parameters: {'model_type': 'gcn', 'hidden_dims': '[512, 256]', 'dropout': 0.5429649373703088, 'batch_norm': False, 'lr': 3.856603943257342e-05, 'weight_decay': 0.00012512831881959137, 'epochs': 89, 'loss': 'mse', 'optimizer': 'adam', 'graph_mode': 'cutoff', 'cutoff': 0.608354251083987, 'grm_norm': 'cosine_then_gcn', 'self_loops': False, 'use_snp_selection': True, 'num_snps': 33754}. Best is trial 63 with value: 0.29437649173181957.
[I 2025-12-08 17:19:38,328] Trial 115 finished with value: 0.2935689388856891 and parameters: {'model_type': 'gcn', 'hidden_dims': '[512, 256]', 'dropout': 0.39415233080253786, 'batch_norm': False, 'lr': 1.5608255251237312e-05, 'weight_decay': 0.0001095373723775155, 'epochs': 161, 'loss': 'mse', 'optimizer': 'adam', 'graph_mode': 'cutoff', 'cutoff': 0.8030311294893188, 'grm_norm': 'cosine_then_gcn', 'self_loops': False, 'use_snp_selection': True, 'num_snps': 43053}. Best is trial 63 with value: 0.29437649173181957.
[I 2025-12-08 17:20:14,588] Trial 116 finished with value: 0.2808903328958219 and parameters: {'model_type': 'gcn', 'hidden_dims': '[512, 128]', 'dropout': 0.39693607329064123, 'batch_norm': False, 'lr': 1.5610682792759633e-05, 'weight_decay': 4.319902391729557e-05, 'epochs': 161, 'loss': 'mae', 'optimizer': 'adam', 'graph_mode': 'cutoff', 'cutoff': 0.8016939004395507, 'grm_norm': 'cosine_then_gcn', 'self_loops': False, 'use_snp_selection': True, 'num_snps': 36242}. Best is trial 63 with value: 0.29437649173181957.
[I 2025-12-08 17:20:51,319] Trial 117 finished with value: 0.281813031962851 and parameters: {'model_type': 'gcn', 'hidden_dims': '[512, 256]', 'dropout': 0.5132541339733644, 'batch_norm': False, 'lr': 1.4127675280306611e-05, 'weight_decay': 0.00010021182704123745, 'epochs': 127, 'loss': 'mse', 'optimizer': 'adam', 'graph_mode': 'cutoff', 'cutoff': 0.7560425331359982, 'grm_norm': 'cosine_then_gcn', 'self_loops': True, 'use_snp_selection': True, 'num_snps': 43805}. Best is trial 63 with value: 0.29437649173181957.
[I 2025-12-08 17:21:28,058] Trial 118 finished with value: 0.24011689153540178 and parameters: {'model_type': 'gcn', 'hidden_dims': '[512, 256]', 'dropout': 0.3726393274633445, 'batch_norm': False, 'lr': 0.00046260026925664896, 'weight_decay': 7.144597996978772e-06, 'epochs': 133, 'loss': 'mse', 'optimizer': 'adam', 'graph_mode': 'cutoff', 'cutoff': 0.8177583679012517, 'grm_norm': 'cosine_then_gcn', 'self_loops': False, 'use_snp_selection': True, 'num_snps': 42858}. Best is trial 63 with value: 0.29437649173181957.
[I 2025-12-08 17:22:03,329] Trial 119 finished with value: 0.2610448832702185 and parameters: {'model_type': 'gcn', 'hidden_dims': '[512, 64]', 'dropout': 0.38548403091329775, 'batch_norm': True, 'lr': 1.777527282260589e-05, 'weight_decay': 2.1721872264417163e-05, 'epochs': 140, 'loss': 'mse', 'optimizer': 'adam', 'graph_mode': 'cutoff', 'cutoff': 0.7769674757692306, 'grm_norm': 'cosine_then_gcn', 'self_loops': False, 'use_snp_selection': True, 'num_snps': 38740}. Best is trial 63 with value: 0.29437649173181957.
[I 2025-12-08 17:22:37,906] Trial 120 finished with value: 0.28239446059001494 and parameters: {'model_type': 'gcn', 'hidden_dims': '[128, 64]', 'dropout': 0.40860491418276906, 'batch_norm': False, 'lr': 2.360969550830709e-05, 'weight_decay': 0.00011695071615178315, 'epochs': 281, 'loss': 'mae', 'optimizer': 'adam', 'graph_mode': 'cutoff', 'cutoff': 0.6716964723027508, 'grm_norm': 'cosine_then_gcn', 'self_loops': False, 'use_snp_selection': True, 'num_snps': 55607}. Best is trial 63 with value: 0.29437649173181957.
[I 2025-12-08 17:23:27,239] Trial 121 finished with value: 0.28157297512096185 and parameters: {'model_type': 'gcn', 'hidden_dims': '[512, 256]', 'dropout': 0.39077992258374683, 'batch_norm': False, 'lr': 4.438590482766215e-05, 'weight_decay': 0.00016458174963921658, 'epochs': 182, 'loss': 'mse', 'optimizer': 'adam', 'graph_mode': 'cutoff', 'cutoff': 0.6465468860738395, 'grm_norm': 'none', 'self_loops': False, 'use_snp_selection': True, 'num_snps': 48918}. Best is trial 63 with value: 0.29437649173181957.
[I 2025-12-08 17:24:14,049] Trial 122 finished with value: 0.2863188802976543 and parameters: {'model_type': 'gcn', 'hidden_dims': '[512, 256]', 'dropout': 0.3486906678651125, 'batch_norm': False, 'lr': 2.744021409343448e-05, 'weight_decay': 0.0002096294612401297, 'epochs': 173, 'loss': 'mse', 'optimizer': 'adam', 'graph_mode': 'cutoff', 'cutoff': 0.7388748399947181, 'grm_norm': 'cosine_then_gcn', 'self_loops': False, 'use_snp_selection': True, 'num_snps': 47724}. Best is trial 63 with value: 0.29437649173181957.
[I 2025-12-08 17:24:56,389] Trial 123 finished with value: 0.2900156872841039 and parameters: {'model_type': 'gcn', 'hidden_dims': '[512, 256]', 'dropout': 0.42087435999316825, 'batch_norm': False, 'lr': 3.502734354097614e-05, 'weight_decay': 5.9604953101779e-05, 'epochs': 156, 'loss': 'mse', 'optimizer': 'adam', 'graph_mode': 'cutoff', 'cutoff': 0.7115998818183298, 'grm_norm': 'none', 'self_loops': False, 'use_snp_selection': True, 'num_snps': 45788}. Best is trial 63 with value: 0.29437649173181957.
[I 2025-12-08 17:25:38,596] Trial 124 finished with value: 0.28737482532936576 and parameters: {'model_type': 'gcn', 'hidden_dims': '[512, 256]', 'dropout': 0.4219125686818549, 'batch_norm': False, 'lr': 5.0944248674801426e-05, 'weight_decay': 3.2322652592296506e-05, 'epochs': 155, 'loss': 'mse', 'optimizer': 'adam', 'graph_mode': 'cutoff', 'cutoff': 0.7092322348416151, 'grm_norm': 'cosine_then_gcn', 'self_loops': False, 'use_snp_selection': True, 'num_snps': 45479}. Best is trial 63 with value: 0.29437649173181957.
[I 2025-12-08 17:26:20,745] Trial 125 finished with value: 0.28136503346116937 and parameters: {'model_type': 'gcn', 'hidden_dims': '[512, 256]', 'dropout': 0.455387222518977, 'batch_norm': False, 'lr': 3.8331585633819335e-05, 'weight_decay': 5.913265060562325e-05, 'epochs': 162, 'loss': 'mse', 'optimizer': 'adam', 'graph_mode': 'cutoff', 'cutoff': 0.6674494270721018, 'grm_norm': 'cosine', 'self_loops': False, 'use_snp_selection': True, 'num_snps': 41107}. Best is trial 63 with value: 0.29437649173181957.
[I 2025-12-08 17:26:48,798] Trial 126 finished with value: 0.27841209932713534 and parameters: {'model_type': 'gcn', 'hidden_dims': '[256, 128, 64]', 'dropout': 0.4360837329756182, 'batch_norm': False, 'lr': 3.353559201235502e-05, 'weight_decay': 5.010751554601909e-05, 'epochs': 142, 'loss': 'mse', 'optimizer': 'adam', 'graph_mode': 'cutoff', 'cutoff': 0.6882488034131465, 'grm_norm': 'none', 'self_loops': False, 'use_snp_selection': True, 'num_snps': 43412}. Best is trial 63 with value: 0.29437649173181957.
[I 2025-12-08 17:27:30,961] Trial 127 finished with value: 0.28788362796282085 and parameters: {'model_type': 'gcn', 'hidden_dims': '[512, 256]', 'dropout': 0.40251716125311343, 'batch_norm': False, 'lr': 2.208922492217253e-05, 'weight_decay': 7.830096474512449e-05, 'epochs': 152, 'loss': 'mse', 'optimizer': 'adam', 'graph_mode': 'cutoff', 'cutoff': 0.8824832353609684, 'grm_norm': 'cosine_then_gcn', 'self_loops': False, 'use_snp_selection': True, 'num_snps': 46404}. Best is trial 63 with value: 0.29437649173181957.
[I 2025-12-08 17:27:50,398] Trial 128 finished with value: 0.2515070477257619 and parameters: {'model_type': 'gcn', 'hidden_dims': '[256, 128]', 'dropout': 0.3794376767597417, 'batch_norm': True, 'lr': 2.499013952103195e-05, 'weight_decay': 0.00010653210974118199, 'epochs': 147, 'loss': 'mse', 'optimizer': 'adam', 'graph_mode': 'cutoff', 'cutoff': 0.584380630359326, 'grm_norm': 'cosine_then_gcn', 'self_loops': True, 'use_snp_selection': False}. Best is trial 63 with value: 0.29437649173181957.
[I 2025-12-08 17:28:24,309] Trial 129 finished with value: 0.29299056262934337 and parameters: {'model_type': 'gcn', 'hidden_dims': '[512, 256]', 'dropout': 0.5739128535161013, 'batch_norm': False, 'lr': 1.8517656965660945e-05, 'weight_decay': 6.603950788977288e-05, 'epochs': 169, 'loss': 'mse', 'optimizer': 'adam', 'graph_mode': 'cutoff', 'cutoff': 0.8640020715652766, 'grm_norm': 'none', 'self_loops': False, 'use_snp_selection': True, 'num_snps': 31845}. Best is trial 63 with value: 0.29437649173181957.
[I 2025-12-08 17:28:58,261] Trial 130 finished with value: 0.27447948796988536 and parameters: {'model_type': 'gcn', 'hidden_dims': '[512, 128]', 'dropout': 0.41666218660358584, 'batch_norm': False, 'lr': 1.1639279811393858e-05, 'weight_decay': 6.495500293052068e-05, 'epochs': 168, 'loss': 'mae', 'optimizer': 'adam', 'graph_mode': 'cutoff', 'cutoff': 0.8591992062280563, 'grm_norm': 'none', 'self_loops': False, 'use_snp_selection': True, 'num_snps': 32201}. Best is trial 63 with value: 0.29437649173181957.
[I 2025-12-08 17:29:27,563] Trial 131 finished with value: 0.19561851605944827 and parameters: {'model_type': 'gcn', 'hidden_dims': '[512, 256]', 'dropout': 0.5699676874380812, 'batch_norm': False, 'lr': 1.61750306413614e-05, 'weight_decay': 3.872551139493826e-05, 'epochs': 50, 'loss': 'mse', 'optimizer': 'adam', 'graph_mode': 'cutoff', 'cutoff': 0.7630330669186606, 'grm_norm': 'none', 'self_loops': False, 'use_snp_selection': True, 'num_snps': 59759}. Best is trial 63 with value: 0.29437649173181957.
[I 2025-12-08 17:30:01,203] Trial 132 finished with value: 0.29129328784229025 and parameters: {'model_type': 'gcn', 'hidden_dims': '[512, 256]', 'dropout': 0.5563682489798336, 'batch_norm': False, 'lr': 1.9612930784441944e-05, 'weight_decay': 0.00013790027991369958, 'epochs': 163, 'loss': 'mse', 'optimizer': 'adam', 'graph_mode': 'cutoff', 'cutoff': 0.8317800407390882, 'grm_norm': 'none', 'self_loops': False, 'use_snp_selection': True, 'num_snps': 32747}. Best is trial 63 with value: 0.29437649173181957.
[I 2025-12-08 17:30:35,018] Trial 133 finished with value: 0.2906747653507776 and parameters: {'model_type': 'gcn', 'hidden_dims': '[512, 256]', 'dropout': 0.5858654638719812, 'batch_norm': False, 'lr': 1.831429224676056e-05, 'weight_decay': 0.00014118099682151137, 'epochs': 189, 'loss': 'mse', 'optimizer': 'adam', 'graph_mode': 'cutoff', 'cutoff': 0.8297745596396576, 'grm_norm': 'none', 'self_loops': False, 'use_snp_selection': True, 'num_snps': 28873}. Best is trial 63 with value: 0.29437649173181957.
[I 2025-12-08 17:31:08,158] Trial 134 finished with value: 0.2919552631948473 and parameters: {'model_type': 'gcn', 'hidden_dims': '[512, 256]', 'dropout': 0.5542850471636903, 'batch_norm': False, 'lr': 1.873014014784292e-05, 'weight_decay': 0.00013684304171109323, 'epochs': 186, 'loss': 'mse', 'optimizer': 'adam', 'graph_mode': 'cutoff', 'cutoff': 0.8252758119827199, 'grm_norm': 'none', 'self_loops': False, 'use_snp_selection': True, 'num_snps': 28139}. Best is trial 63 with value: 0.29437649173181957.
