[I 2025-12-08 14:01:05,826] Trial 130 finished with value: 0.36139045893335997 and parameters: {'model_type': 'gcn', 'hidden_dims': '[512, 256]', 'dropout': 0.3920932494116815, 'batch_norm': False, 'lr': 3.901835072683325e-05, 'weight_decay': 3.854256780574743e-07, 'epochs': 137, 'loss': 'mse', 'optimizer': 'adam', 'graph_mode': 'cutoff', 'cutoff': 0.6751595842699527, 'grm_norm': 'gcn', 'self_loops': True, 'use_snp_selection': False}. Best is trial 119 with value: 0.37476439791585225.
[I 2025-12-08 14:01:46,670] Trial 131 finished with value: 0.36364824830991027 and parameters: {'model_type': 'gcn', 'hidden_dims': '[512, 128]', 'dropout': 0.3884004665502836, 'batch_norm': False, 'lr': 4.594557953129161e-05, 'weight_decay': 2.248869571823249e-07, 'epochs': 159, 'loss': 'mse', 'optimizer': 'adam', 'graph_mode': 'cutoff', 'cutoff': 0.7562803461243938, 'grm_norm': 'gcn', 'self_loops': True, 'use_snp_selection': False}. Best is trial 119 with value: 0.37476439791585225.
[I 2025-12-08 14:02:24,692] Trial 132 finished with value: 0.3666977353763442 and parameters: {'model_type': 'gcn', 'hidden_dims': '[512, 128]', 'dropout': 0.4178332605366126, 'batch_norm': False, 'lr': 2.240416687794901e-05, 'weight_decay': 4.943406022038989e-07, 'epochs': 147, 'loss': 'mse', 'optimizer': 'adam', 'graph_mode': 'cutoff', 'cutoff': 0.7227445688636656, 'grm_norm': 'gcn', 'self_loops': True, 'use_snp_selection': False}. Best is trial 119 with value: 0.37476439791585225.
[I 2025-12-08 14:03:04,433] Trial 133 finished with value: 0.36542094936954916 and parameters: {'model_type': 'gcn', 'hidden_dims': '[512, 128]', 'dropout': 0.33875371472616045, 'batch_norm': False, 'lr': 2.8607694177042508e-05, 'weight_decay': 1.4439855043856e-07, 'epochs': 154, 'loss': 'mse', 'optimizer': 'adam', 'graph_mode': 'cutoff', 'cutoff': 0.6852639374114644, 'grm_norm': 'gcn', 'self_loops': True, 'use_snp_selection': False}. Best is trial 119 with value: 0.37476439791585225.
[I 2025-12-08 14:03:46,359] Trial 134 finished with value: 0.36718721247008 and parameters: {'model_type': 'gcn', 'hidden_dims': '[512, 128]', 'dropout': 0.4030132899671611, 'batch_norm': False, 'lr': 5.105144163007488e-05, 'weight_decay': 2.03305277976275e-07, 'epochs': 163, 'loss': 'mse', 'optimizer': 'adam', 'graph_mode': 'cutoff', 'cutoff': 0.591874193251288, 'grm_norm': 'gcn', 'self_loops': True, 'use_snp_selection': False}. Best is trial 119 with value: 0.37476439791585225.
[I 2025-12-08 14:04:31,541] Trial 135 finished with value: 0.37148168841132595 and parameters: {'model_type': 'gcn', 'hidden_dims': '[512, 128]', 'dropout': 0.35822665219720606, 'batch_norm': False, 'lr': 3.459043986221185e-05, 'weight_decay': 3.001125789217081e-07, 'epochs': 177, 'loss': 'mse', 'optimizer': 'adam', 'graph_mode': 'cutoff', 'cutoff': 0.6293376001717671, 'grm_norm': 'gcn', 'self_loops': True, 'use_snp_selection': False}. Best is trial 119 with value: 0.37476439791585225.
[I 2025-12-08 14:05:15,074] Trial 136 finished with value: 0.36487518006597547 and parameters: {'model_type': 'gcn', 'hidden_dims': '[512, 128]', 'dropout': 0.4375231163118538, 'batch_norm': False, 'lr': 3.242977341582922e-05, 'weight_decay': 3.1877473559132716e-07, 'epochs': 170, 'loss': 'mse', 'optimizer': 'adam', 'graph_mode': 'cutoff', 'cutoff': 0.6398838048504204, 'grm_norm': 'gcn', 'self_loops': True, 'use_snp_selection': False}. Best is trial 119 with value: 0.37476439791585225.
[I 2025-12-08 14:06:00,917] Trial 137 finished with value: 0.33599886254002687 and parameters: {'model_type': 'gcn', 'hidden_dims': '[512, 128]', 'dropout': 0.3798018980755704, 'batch_norm': True, 'lr': 3.821704216409205e-05, 'weight_decay': 5.889580716632016e-07, 'epochs': 179, 'loss': 'mse', 'optimizer': 'adam', 'graph_mode': 'cutoff', 'cutoff': 0.6546297438599123, 'grm_norm': 'gcn', 'self_loops': True, 'use_snp_selection': False}. Best is trial 119 with value: 0.37476439791585225.
[I 2025-12-08 14:06:20,179] Trial 138 finished with value: 0.36777585169308546 and parameters: {'model_type': 'gcn', 'hidden_dims': '[256, 128, 64]', 'dropout': 0.30641766440741197, 'batch_norm': False, 'lr': 2.648612635965558e-05, 'weight_decay': 3.685421962028423e-07, 'epochs': 145, 'loss': 'mse', 'optimizer': 'adam', 'graph_mode': 'cutoff', 'cutoff': 0.6286868691474289, 'grm_norm': 'gcn', 'self_loops': True, 'use_snp_selection': False}. Best is trial 119 with value: 0.37476439791585225.
[I 2025-12-08 14:07:04,414] Trial 139 finished with value: 0.34998163905331714 and parameters: {'model_type': 'gcn', 'hidden_dims': '[512, 128]', 'dropout': 0.31335412516346667, 'batch_norm': False, 'lr': 5.6122186317956407e-05, 'weight_decay': 2.421785157751184e-07, 'epochs': 170, 'loss': 'mse', 'optimizer': 'adam', 'graph_mode': 'knn', 'knn_k': 6, 'weighted_edges': True, 'symmetrize_mode': 'mutual', 'self_loops': True, 'use_snp_selection': False}. Best is trial 119 with value: 0.37476439791585225.
[I 2025-12-08 14:07:43,670] Trial 140 finished with value: 0.37084228547997594 and parameters: {'model_type': 'gcn', 'hidden_dims': '[512, 128]', 'dropout': 0.36223600761515984, 'batch_norm': False, 'lr': 3.5439510644480304e-05, 'weight_decay': 2.83581881726723e-07, 'epochs': 152, 'loss': 'mse', 'optimizer': 'adam', 'graph_mode': 'cutoff', 'cutoff': 0.6197409466295489, 'grm_norm': 'gcn', 'self_loops': True, 'use_snp_selection': False}. Best is trial 119 with value: 0.37476439791585225.
[I 2025-12-08 14:08:23,043] Trial 141 finished with value: 0.3742777845063014 and parameters: {'model_type': 'gcn', 'hidden_dims': '[512, 128]', 'dropout': 0.34419496531549243, 'batch_norm': False, 'lr': 3.460833667031712e-05, 'weight_decay': 4.557265710845828e-07, 'epochs': 153, 'loss': 'mse', 'optimizer': 'adam', 'graph_mode': 'cutoff', 'cutoff': 0.6185830339676928, 'grm_norm': 'gcn', 'self_loops': True, 'use_snp_selection': False}. Best is trial 119 with value: 0.37476439791585225.
[I 2025-12-08 14:09:02,207] Trial 142 finished with value: 0.3663947960647064 and parameters: {'model_type': 'gcn', 'hidden_dims': '[512, 128]', 'dropout': 0.32740190082302845, 'batch_norm': False, 'lr': 3.3268499416656556e-05, 'weight_decay': 4.7230751633284235e-07, 'epochs': 152, 'loss': 'mse', 'optimizer': 'adam', 'graph_mode': 'cutoff', 'cutoff': 0.6182427165266499, 'grm_norm': 'gcn', 'self_loops': True, 'use_snp_selection': False}. Best is trial 119 with value: 0.37476439791585225.
[I 2025-12-08 14:09:38,375] Trial 143 finished with value: 0.359741971609762 and parameters: {'model_type': 'gcn', 'hidden_dims': '[512, 128]', 'dropout': 0.3577844023390498, 'batch_norm': False, 'lr': 2.4130441609404543e-05, 'weight_decay': 6.484012171287633e-07, 'epochs': 139, 'loss': 'mse', 'optimizer': 'adam', 'graph_mode': 'cutoff', 'cutoff': 0.5805408140010628, 'grm_norm': 'gcn', 'self_loops': True, 'use_snp_selection': False}. Best is trial 119 with value: 0.37476439791585225.
[I 2025-12-08 14:10:20,883] Trial 144 finished with value: 0.3700285132424111 and parameters: {'model_type': 'gcn', 'hidden_dims': '[512, 128]', 'dropout': 0.3713117072263095, 'batch_norm': False, 'lr': 4.307274947226557e-05, 'weight_decay': 3.023029813051745e-07, 'epochs': 166, 'loss': 'mse', 'optimizer': 'adam', 'graph_mode': 'cutoff', 'cutoff': 0.6295657316532413, 'grm_norm': 'gcn', 'self_loops': True, 'use_snp_selection': False}. Best is trial 119 with value: 0.37476439791585225.
[I 2025-12-08 14:10:58,946] Trial 145 finished with value: 0.36605636927314195 and parameters: {'model_type': 'gcn', 'hidden_dims': '[512, 128]', 'dropout': 0.4092602261380228, 'batch_norm': False, 'lr': 3.4842783042832245e-05, 'weight_decay': 4.3620330012442264e-07, 'epochs': 147, 'loss': 'mse', 'optimizer': 'adam', 'graph_mode': 'cutoff', 'cutoff': 0.592485262575837, 'grm_norm': 'gcn', 'self_loops': True, 'use_snp_selection': False}. Best is trial 119 with value: 0.37476439791585225.
[I 2025-12-08 14:11:11,803] Trial 146 finished with value: 0.35984336421850927 and parameters: {'model_type': 'gcn', 'hidden_dims': '[128, 64]', 'dropout': 0.43112345891500675, 'batch_norm': False, 'lr': 2.9183071997713724e-05, 'weight_decay': 2.631626190332485e-07, 'epochs': 163, 'loss': 'mse', 'optimizer': 'adam', 'graph_mode': 'cutoff', 'cutoff': 0.6593928273993046, 'grm_norm': 'cosine', 'self_loops': True, 'use_snp_selection': False}. Best is trial 119 with value: 0.37476439791585225.
[I 2025-12-08 14:11:34,368] Trial 147 finished with value: 0.3639826266728966 and parameters: {'model_type': 'gcn', 'hidden_dims': '[256, 128]', 'dropout': 0.37851285264852313, 'batch_norm': False, 'lr': 2.0589910402553338e-05, 'weight_decay': 3.8427711772132703e-07, 'epochs': 179, 'loss': 'mse', 'optimizer': 'adam', 'graph_mode': 'cutoff', 'cutoff': 0.6148734936902895, 'grm_norm': 'gcn', 'self_loops': True, 'use_snp_selection': False}. Best is trial 119 with value: 0.37476439791585225.
[I 2025-12-08 14:12:19,851] Trial 148 finished with value: 0.3664338922264415 and parameters: {'model_type': 'gcn', 'hidden_dims': '[512, 128]', 'dropout': 0.3517777035437809, 'batch_norm': False, 'lr': 4.962323270324695e-05, 'weight_decay': 2.9802176562104245e-07, 'epochs': 151, 'loss': 'mae', 'optimizer': 'adam', 'graph_mode': 'cutoff', 'cutoff': 0.5710699263285416, 'grm_norm': 'gcn', 'self_loops': True, 'use_snp_selection': True, 'num_snps': 52255}. Best is trial 119 with value: 0.37476439791585225.
[I 2025-12-08 14:12:54,410] Trial 149 finished with value: 0.36350903822058844 and parameters: {'model_type': 'gcn', 'hidden_dims': '[512, 128]', 'dropout': 0.11501312276191625, 'batch_norm': False, 'lr': 1.7546578686274868e-05, 'weight_decay': 1.754702322139914e-07, 'epochs': 132, 'loss': 'mse', 'optimizer': 'adam', 'graph_mode': 'cutoff', 'cutoff': 0.6449083894192597, 'grm_norm': 'cosine_then_gcn', 'self_loops': False, 'use_snp_selection': False}. Best is trial 119 with value: 0.37476439791585225.
[I 2025-12-08 14:13:26,937] Trial 0 finished with value: 0.2926975789785085 and parameters: {'model_type': 'gcn', 'hidden_dims': '[128, 64]', 'dropout': 0.199031432379812, 'batch_norm': True, 'lr': 1.8408544111075823e-05, 'weight_decay': 5.5136510071208614e-05, 'epochs': 336, 'loss': 'mae', 'optimizer': 'adam', 'graph_mode': 'knn', 'knn_k': 8, 'weighted_edges': True, 'symmetrize_mode': 'mutual', 'self_loops': True, 'use_snp_selection': True, 'num_snps': 27173}. Best is trial 0 with value: 0.2926975789785085.
[I 2025-12-08 14:14:05,119] Trial 1 finished with value: 0.22347492765715105 and parameters: {'model_type': 'gcn', 'hidden_dims': '[256, 128, 64]', 'dropout': 0.5543244404043342, 'batch_norm': True, 'lr': 7.981787657617978e-05, 'weight_decay': 2.8571789869344834e-07, 'epochs': 297, 'loss': 'mae', 'optimizer': 'adam', 'graph_mode': 'cutoff', 'cutoff': 0.3392632777751686, 'grm_norm': 'gcn', 'self_loops': False, 'use_snp_selection': False}. Best is trial 0 with value: 0.2926975789785085.
[I 2025-12-08 14:15:02,735] Trial 2 finished with value: 0.260616197600831 and parameters: {'model_type': 'gcn', 'hidden_dims': '[512, 64]', 'dropout': 0.32815227354739207, 'batch_norm': True, 'lr': 0.000619605044204259, 'weight_decay': 0.0004086269831625786, 'epochs': 206, 'loss': 'mse', 'optimizer': 'adam', 'graph_mode': 'knn', 'knn_k': 4, 'weighted_edges': True, 'symmetrize_mode': 'union', 'self_loops': True, 'use_snp_selection': True, 'num_snps': 53035}. Best is trial 0 with value: 0.2926975789785085.
[I 2025-12-08 14:15:30,228] Trial 3 finished with value: 0.24463589071392491 and parameters: {'model_type': 'gcn', 'hidden_dims': '[256, 128]', 'dropout': 0.23110783056597514, 'batch_norm': True, 'lr': 8.11311593386298e-05, 'weight_decay': 9.296158109581328e-07, 'epochs': 213, 'loss': 'mse', 'optimizer': 'adam', 'graph_mode': 'knn', 'knn_k': 10, 'weighted_edges': True, 'symmetrize_mode': 'mutual', 'self_loops': True, 'use_snp_selection': False}. Best is trial 0 with value: 0.2926975789785085.
[I 2025-12-08 14:15:44,829] Trial 4 finished with value: 0.34650870432520353 and parameters: {'model_type': 'gcn', 'hidden_dims': '[512, 256]', 'dropout': 0.2753281956415665, 'batch_norm': True, 'lr': 0.00034435188114839693, 'weight_decay': 4.9416012835950194e-05, 'epochs': 89, 'loss': 'mae', 'optimizer': 'adam', 'graph_mode': 'cutoff', 'cutoff': 0.820078967317394, 'grm_norm': 'none', 'self_loops': False, 'use_snp_selection': True, 'num_snps': 12674}. Best is trial 4 with value: 0.34650870432520353.
[I 2025-12-08 14:16:09,888] Trial 5 finished with value: 0.3193073763823182 and parameters: {'model_type': 'gcn', 'hidden_dims': '[128, 64]', 'dropout': 0.5611163934517731, 'batch_norm': True, 'lr': 0.0003984856210762587, 'weight_decay': 1.1466743517565185e-07, 'epochs': 344, 'loss': 'mae', 'optimizer': 'adam', 'graph_mode': 'cutoff', 'cutoff': 0.6089370799714728, 'grm_norm': 'gcn', 'self_loops': True, 'use_snp_selection': False}. Best is trial 4 with value: 0.34650870432520353.
[I 2025-12-08 14:16:32,170] Trial 6 finished with value: 0.30727875678147126 and parameters: {'model_type': 'gcn', 'hidden_dims': '[128, 64]', 'dropout': 0.31805912766941713, 'batch_norm': True, 'lr': 1.2361026034262557e-05, 'weight_decay': 6.492620232791903e-06, 'epochs': 271, 'loss': 'mse', 'optimizer': 'adam', 'graph_mode': 'cutoff', 'cutoff': 0.6193362582230448, 'grm_norm': 'cosine', 'self_loops': False, 'use_snp_selection': True, 'num_snps': 28594}. Best is trial 4 with value: 0.34650870432520353.
[I 2025-12-08 14:16:51,854] Trial 7 finished with value: 0.2660889924742955 and parameters: {'model_type': 'gcn', 'hidden_dims': '[512, 64]', 'dropout': 0.471337288649717, 'batch_norm': True, 'lr': 2.239693207292708e-05, 'weight_decay': 2.263166635514082e-06, 'epochs': 69, 'loss': 'mse', 'optimizer': 'adam', 'graph_mode': 'cutoff', 'cutoff': 0.4056820886426376, 'grm_norm': 'cosine', 'self_loops': False, 'use_snp_selection': False}. Best is trial 4 with value: 0.34650870432520353.
[I 2025-12-08 14:17:29,143] Trial 8 finished with value: 0.33455890180545894 and parameters: {'model_type': 'gcn', 'hidden_dims': '[512, 256]', 'dropout': 0.20659328268932406, 'batch_norm': False, 'lr': 8.93315124361372e-05, 'weight_decay': 0.00028987480727919035, 'epochs': 136, 'loss': 'mae', 'optimizer': 'adam', 'graph_mode': 'knn', 'knn_k': 3, 'weighted_edges': False, 'symmetrize_mode': 'union', 'self_loops': False, 'use_snp_selection': True, 'num_snps': 43128}. Best is trial 4 with value: 0.34650870432520353.
[I 2025-12-08 14:18:11,215] Trial 9 finished with value: -0.03254018868346379 and parameters: {'model_type': 'gcn', 'hidden_dims': '[512, 256]', 'dropout': 0.2888209592870401, 'batch_norm': False, 'lr': 0.004734648143129892, 'weight_decay': 1.5879705591356368e-06, 'epochs': 163, 'loss': 'mse', 'optimizer': 'adam', 'graph_mode': 'cutoff', 'cutoff': 0.5984899797909019, 'grm_norm': 'cosine', 'self_loops': True, 'use_snp_selection': False}. Best is trial 4 with value: 0.34650870432520353.
[I 2025-12-08 14:18:20,183] Trial 10 finished with value: 0.30946473765562743 and parameters: {'model_type': 'gcn', 'hidden_dims': '[512, 128]', 'dropout': 0.11372025982957354, 'batch_norm': False, 'lr': 0.0023343012062770553, 'weight_decay': 4.14440562940608e-05, 'epochs': 41, 'loss': 'mae', 'optimizer': 'adam', 'graph_mode': 'cutoff', 'cutoff': 0.8740100033033124, 'grm_norm': 'none', 'self_loops': False, 'use_snp_selection': True, 'num_snps': 3859}. Best is trial 4 with value: 0.34650870432520353.
[I 2025-12-08 14:18:56,114] Trial 11 finished with value: 0.32316310826204875 and parameters: {'model_type': 'gcn', 'hidden_dims': '[512, 256]', 'dropout': 0.42220860806405436, 'batch_norm': False, 'lr': 0.00012587284186352953, 'weight_decay': 0.0006590033092812647, 'epochs': 114, 'loss': 'mae', 'optimizer': 'adam', 'graph_mode': 'knn', 'knn_k': 1, 'weighted_edges': False, 'symmetrize_mode': 'union', 'self_loops': False, 'use_snp_selection': True, 'num_snps': 47068}. Best is trial 4 with value: 0.34650870432520353.
[I 2025-12-08 14:19:10,612] Trial 12 finished with value: 0.3365578940959802 and parameters: {'model_type': 'gcn', 'hidden_dims': '[512, 256]', 'dropout': 0.14142767069304862, 'batch_norm': False, 'lr': 0.0011798598123878552, 'weight_decay': 9.414718277089941e-05, 'epochs': 124, 'loss': 'mae', 'optimizer': 'adam', 'graph_mode': 'knn', 'knn_k': 3, 'weighted_edges': False, 'symmetrize_mode': 'union', 'self_loops': False, 'use_snp_selection': True, 'num_snps': 8584}. Best is trial 4 with value: 0.34650870432520353.
[I 2025-12-08 14:19:23,079] Trial 13 finished with value: 0.34077072506491496 and parameters: {'model_type': 'gcn', 'hidden_dims': '[512, 256]', 'dropout': 0.13529665206282515, 'batch_norm': False, 'lr': 0.0013143362382724787, 'weight_decay': 5.2475435102613655e-05, 'epochs': 101, 'loss': 'mae', 'optimizer': 'adam', 'graph_mode': 'knn', 'knn_k': 6, 'weighted_edges': False, 'symmetrize_mode': 'union', 'self_loops': False, 'use_snp_selection': True, 'num_snps': 5870}. Best is trial 4 with value: 0.34650870432520353.
[I 2025-12-08 14:19:38,659] Trial 14 finished with value: 0.2274974549003455 and parameters: {'model_type': 'gcn', 'hidden_dims': '[512, 256]', 'dropout': 0.25632205209505254, 'batch_norm': False, 'lr': 0.00687208991084213, 'weight_decay': 1.8542303090238745e-05, 'epochs': 82, 'loss': 'mae', 'optimizer': 'adam', 'graph_mode': 'cutoff', 'cutoff': 0.8944237199027842, 'grm_norm': 'none', 'self_loops': False, 'use_snp_selection': True, 'num_snps': 15654}. Best is trial 4 with value: 0.34650870432520353.
[I 2025-12-08 14:19:52,524] Trial 15 finished with value: 0.2524802654958364 and parameters: {'model_type': 'gcn', 'hidden_dims': '[256, 128, 64]', 'dropout': 0.40991201822777057, 'batch_norm': False, 'lr': 0.0015315707618607853, 'weight_decay': 8.602279249719694e-06, 'epochs': 88, 'loss': 'mae', 'optimizer': 'adam', 'graph_mode': 'knn', 'knn_k': 7, 'weighted_edges': False, 'symmetrize_mode': 'union', 'self_loops': False, 'use_snp_selection': True, 'num_snps': 14623}. Best is trial 4 with value: 0.34650870432520353.
[I 2025-12-08 14:20:17,620] Trial 16 finished with value: 0.2637771869212241 and parameters: {'model_type': 'gcn', 'hidden_dims': '[512, 128]', 'dropout': 0.1573538820129295, 'batch_norm': True, 'lr': 0.0002351737822521291, 'weight_decay': 0.00013965361036408488, 'epochs': 168, 'loss': 'mae', 'optimizer': 'adam', 'graph_mode': 'knn', 'knn_k': 6, 'weighted_edges': False, 'symmetrize_mode': 'mutual', 'self_loops': False, 'use_snp_selection': True, 'num_snps': 19782}. Best is trial 4 with value: 0.34650870432520353.
[I 2025-12-08 14:20:26,261] Trial 17 finished with value: 0.3395177447005837 and parameters: {'model_type': 'gcn', 'hidden_dims': '[256, 128]', 'dropout': 0.36694829928621503, 'batch_norm': False, 'lr': 0.0008407831391711085, 'weight_decay': 3.2193607048083006e-05, 'epochs': 45, 'loss': 'mae', 'optimizer': 'adam', 'graph_mode': 'cutoff', 'cutoff': 0.7365908344247583, 'grm_norm': 'cosine_then_gcn', 'self_loops': False, 'use_snp_selection': True, 'num_snps': 2778}. Best is trial 4 with value: 0.34650870432520353.
[I 2025-12-08 14:20:53,536] Trial 18 finished with value: 0.3233580778646633 and parameters: {'model_type': 'gcn', 'hidden_dims': '[512, 256]', 'dropout': 0.10093752871871903, 'batch_norm': True, 'lr': 0.00025458792542160157, 'weight_decay': 0.00021038576568746655, 'epochs': 162, 'loss': 'mae', 'optimizer': 'adam', 'graph_mode': 'knn', 'knn_k': 9, 'weighted_edges': False, 'symmetrize_mode': 'union', 'self_loops': False, 'use_snp_selection': True, 'num_snps': 22119}. Best is trial 4 with value: 0.34650870432520353.
[I 2025-12-08 14:21:42,810] Trial 19 finished with value: 0.22390637914652461 and parameters: {'model_type': 'gcn', 'hidden_dims': '[512, 256]', 'dropout': 0.17960265661255337, 'batch_norm': False, 'lr': 0.0029751110466155147, 'weight_decay': 0.0009506528840190462, 'epochs': 236, 'loss': 'mae', 'optimizer': 'adam', 'graph_mode': 'cutoff', 'cutoff': 0.2386548621641688, 'grm_norm': 'none', 'self_loops': False, 'use_snp_selection': True, 'num_snps': 37947}. Best is trial 4 with value: 0.34650870432520353.
[I 2025-12-08 14:21:55,690] Trial 20 finished with value: 0.34099620081325377 and parameters: {'model_type': 'gcn', 'hidden_dims': '[512, 256]', 'dropout': 0.2663159678862425, 'batch_norm': False, 'lr': 0.0005731795743213937, 'weight_decay': 1.3683815410345108e-05, 'epochs': 102, 'loss': 'mae', 'optimizer': 'adam', 'graph_mode': 'cutoff', 'cutoff': 0.7550233606026814, 'grm_norm': 'cosine_then_gcn', 'self_loops': False, 'use_snp_selection': True, 'num_snps': 8231}. Best is trial 4 with value: 0.34650870432520353.
[I 2025-12-08 14:22:09,212] Trial 21 finished with value: 0.3468048079254538 and parameters: {'model_type': 'gcn', 'hidden_dims': '[512, 256]', 'dropout': 0.2462334917012407, 'batch_norm': False, 'lr': 0.0005436100252487031, 'weight_decay': 1.6206393908885257e-05, 'epochs': 96, 'loss': 'mae', 'optimizer': 'adam', 'graph_mode': 'cutoff', 'cutoff': 0.7559354342028177, 'grm_norm': 'cosine_then_gcn', 'self_loops': False, 'use_snp_selection': True, 'num_snps': 9792}. Best is trial 21 with value: 0.3468048079254538.
[I 2025-12-08 14:22:26,241] Trial 22 finished with value: 0.3401639834746465 and parameters: {'model_type': 'gcn', 'hidden_dims': '[512, 256]', 'dropout': 0.2741569540402562, 'batch_norm': False, 'lr': 0.0004738576084570272, 'weight_decay': 1.539286867407512e-05, 'epochs': 133, 'loss': 'mae', 'optimizer': 'adam', 'graph_mode': 'cutoff', 'cutoff': 0.7688228325477409, 'grm_norm': 'cosine_then_gcn', 'self_loops': False, 'use_snp_selection': True, 'num_snps': 13077}. Best is trial 21 with value: 0.3468048079254538.
