[I 2025-12-08 15:43:30,690] Trial 70 finished with value: 0.28347169727717425 and parameters: {'model_type': 'gcn', 'hidden_dims': '[512, 64]', 'dropout': 0.4452703032632122, 'batch_norm': True, 'lr': 0.00020393121108050396, 'weight_decay': 2.5976981503161214e-07, 'epochs': 241, 'loss': 'mae', 'optimizer': 'adam', 'graph_mode': 'cutoff', 'cutoff': 0.718513849472143, 'grm_norm': 'cosine_then_gcn', 'self_loops': False, 'use_snp_selection': False}. Best is trial 23 with value: 0.2997949033109354.
[I 2025-12-08 15:43:47,541] Trial 71 finished with value: 0.2948720070672982 and parameters: {'model_type': 'gcn', 'hidden_dims': '[512, 128]', 'dropout': 0.47979514646787125, 'batch_norm': True, 'lr': 0.0005129248060653223, 'weight_decay': 0.0001556533040719785, 'epochs': 57, 'loss': 'mae', 'optimizer': 'adam', 'graph_mode': 'cutoff', 'cutoff': 0.8245566927863347, 'grm_norm': 'cosine_then_gcn', 'self_loops': False, 'use_snp_selection': False}. Best is trial 23 with value: 0.2997949033109354.
[I 2025-12-08 15:44:12,536] Trial 72 finished with value: 0.2925509962983316 and parameters: {'model_type': 'gcn', 'hidden_dims': '[512, 128]', 'dropout': 0.48870495888589827, 'batch_norm': True, 'lr': 0.0009206101958375744, 'weight_decay': 0.00012087608940214247, 'epochs': 91, 'loss': 'mae', 'optimizer': 'adam', 'graph_mode': 'cutoff', 'cutoff': 0.8970881002867318, 'grm_norm': 'cosine_then_gcn', 'self_loops': False, 'use_snp_selection': False}. Best is trial 23 with value: 0.2997949033109354.
[I 2025-12-08 15:44:30,529] Trial 73 finished with value: 0.29533514971563274 and parameters: {'model_type': 'gcn', 'hidden_dims': '[512, 128]', 'dropout': 0.4656864613353911, 'batch_norm': True, 'lr': 2.7372233147621077e-05, 'weight_decay': 5.600878935541929e-05, 'epochs': 62, 'loss': 'mae', 'optimizer': 'adam', 'graph_mode': 'cutoff', 'cutoff': 0.8035247030485476, 'grm_norm': 'cosine_then_gcn', 'self_loops': False, 'use_snp_selection': False}. Best is trial 23 with value: 0.2997949033109354.
[I 2025-12-08 15:44:48,537] Trial 74 finished with value: 0.27637850896227495 and parameters: {'model_type': 'gcn', 'hidden_dims': '[512, 128]', 'dropout': 0.5042176353127512, 'batch_norm': True, 'lr': 2.186030676381414e-05, 'weight_decay': 5.737564265985172e-05, 'epochs': 62, 'loss': 'mae', 'optimizer': 'adam', 'graph_mode': 'cutoff', 'cutoff': 0.8190826623345057, 'grm_norm': 'cosine_then_gcn', 'self_loops': False, 'use_snp_selection': False}. Best is trial 23 with value: 0.2997949033109354.
[I 2025-12-08 15:45:03,482] Trial 75 finished with value: 0.26669651671047523 and parameters: {'model_type': 'gcn', 'hidden_dims': '[512, 128]', 'dropout': 0.4644362715896555, 'batch_norm': True, 'lr': 3.137625831055797e-05, 'weight_decay': 3.84525246892085e-05, 'epochs': 50, 'loss': 'mae', 'optimizer': 'adam', 'graph_mode': 'cutoff', 'cutoff': 0.752832801191721, 'grm_norm': 'gcn', 'self_loops': False, 'use_snp_selection': False}. Best is trial 23 with value: 0.2997949033109354.
[I 2025-12-08 15:45:15,378] Trial 76 finished with value: 0.29333137309431956 and parameters: {'model_type': 'gcn', 'hidden_dims': '[256, 128, 64]', 'dropout': 0.41811556843836806, 'batch_norm': True, 'lr': 0.0005918381923103494, 'weight_decay': 1.4971176178586035e-07, 'epochs': 80, 'loss': 'mae', 'optimizer': 'adam', 'graph_mode': 'cutoff', 'cutoff': 0.8666809937136297, 'grm_norm': 'cosine_then_gcn', 'self_loops': False, 'use_snp_selection': False}. Best is trial 23 with value: 0.2997949033109354.
[I 2025-12-08 15:45:37,078] Trial 77 finished with value: 0.27072876395523876 and parameters: {'model_type': 'gcn', 'hidden_dims': '[128, 64]', 'dropout': 0.5670220573701137, 'batch_norm': True, 'lr': 1.47872843976011e-05, 'weight_decay': 2.3572188209712705e-05, 'epochs': 66, 'loss': 'mae', 'optimizer': 'adam', 'graph_mode': 'knn', 'knn_k': 5, 'weighted_edges': False, 'symmetrize_mode': 'mutual', 'self_loops': False, 'use_snp_selection': True, 'num_snps': 58588}. Best is trial 23 with value: 0.2997949033109354.
[I 2025-12-08 15:46:45,595] Trial 78 finished with value: 0.2872895250632814 and parameters: {'model_type': 'gcn', 'hidden_dims': '[512, 128]', 'dropout': 0.3742117732201354, 'batch_norm': True, 'lr': 0.0012775292202612419, 'weight_decay': 1.0141485209153895e-05, 'epochs': 271, 'loss': 'mse', 'optimizer': 'adam', 'graph_mode': 'cutoff', 'cutoff': 0.7764699905229262, 'grm_norm': 'cosine_then_gcn', 'self_loops': True, 'use_snp_selection': False}. Best is trial 23 with value: 0.2997949033109354.
[I 2025-12-08 15:47:15,016] Trial 79 finished with value: 0.25511459141456616 and parameters: {'model_type': 'gcn', 'hidden_dims': '[512, 128]', 'dropout': 0.34692214687834483, 'batch_norm': False, 'lr': 1.0698107459746791e-05, 'weight_decay': 7.577678147659589e-05, 'epochs': 109, 'loss': 'mae', 'optimizer': 'adam', 'graph_mode': 'cutoff', 'cutoff': 0.4832743982288671, 'grm_norm': 'cosine_then_gcn', 'self_loops': False, 'use_snp_selection': False}. Best is trial 23 with value: 0.2997949033109354.
[I 2025-12-08 15:47:28,057] Trial 80 finished with value: 0.289390077632131 and parameters: {'model_type': 'gcn', 'hidden_dims': '[128, 64]', 'dropout': 0.431520016528114, 'batch_norm': True, 'lr': 0.0007262106954329133, 'weight_decay': 1.6816085336298174e-05, 'epochs': 165, 'loss': 'mae', 'optimizer': 'adam', 'graph_mode': 'cutoff', 'cutoff': 0.8055481907793194, 'grm_norm': 'cosine', 'self_loops': False, 'use_snp_selection': False}. Best is trial 23 with value: 0.2997949033109354.
[I 2025-12-08 15:47:49,895] Trial 81 finished with value: 0.2639350611636536 and parameters: {'model_type': 'gcn', 'hidden_dims': '[512, 128]', 'dropout': 0.4722103007747979, 'batch_norm': True, 'lr': 5.3302131833741846e-05, 'weight_decay': 0.00035803146165772325, 'epochs': 78, 'loss': 'mae', 'optimizer': 'adam', 'graph_mode': 'cutoff', 'cutoff': 0.7897083824520761, 'grm_norm': 'cosine_then_gcn', 'self_loops': False, 'use_snp_selection': False}. Best is trial 23 with value: 0.2997949033109354.
[I 2025-12-08 15:48:05,972] Trial 82 finished with value: 0.29380744129456116 and parameters: {'model_type': 'gcn', 'hidden_dims': '[512, 128]', 'dropout': 0.450449054268291, 'batch_norm': True, 'lr': 0.00043340189899524644, 'weight_decay': 0.00010468345699879247, 'epochs': 54, 'loss': 'mae', 'optimizer': 'adam', 'graph_mode': 'cutoff', 'cutoff': 0.8444714058776275, 'grm_norm': 'cosine_then_gcn', 'self_loops': False, 'use_snp_selection': False}. Best is trial 23 with value: 0.2997949033109354.
[I 2025-12-08 15:48:32,135] Trial 83 finished with value: 0.2939916049122003 and parameters: {'model_type': 'gcn', 'hidden_dims': '[512, 128]', 'dropout': 0.487416731938412, 'batch_norm': True, 'lr': 0.000539631756207645, 'weight_decay': 0.00019941189244378457, 'epochs': 96, 'loss': 'mae', 'optimizer': 'adam', 'graph_mode': 'cutoff', 'cutoff': 0.8193412291326567, 'grm_norm': 'cosine_then_gcn', 'self_loops': False, 'use_snp_selection': False}. Best is trial 23 with value: 0.2997949033109354.
[I 2025-12-08 15:48:59,263] Trial 84 finished with value: 0.28190043650666313 and parameters: {'model_type': 'gcn', 'hidden_dims': '[512, 128]', 'dropout': 0.49063080976558676, 'batch_norm': True, 'lr': 0.0003267137002563202, 'weight_decay': 0.0005895260599938928, 'epochs': 100, 'loss': 'mae', 'optimizer': 'adam', 'graph_mode': 'cutoff', 'cutoff': 0.8276774854335545, 'grm_norm': 'cosine_then_gcn', 'self_loops': False, 'use_snp_selection': False}. Best is trial 23 with value: 0.2997949033109354.
[I 2025-12-08 15:49:23,367] Trial 85 finished with value: 0.2936864633696056 and parameters: {'model_type': 'gcn', 'hidden_dims': '[512, 128]', 'dropout': 0.5129438152442244, 'batch_norm': True, 'lr': 0.0005431963479136364, 'weight_decay': 0.00015016521153389376, 'epochs': 88, 'loss': 'mae', 'optimizer': 'adam', 'graph_mode': 'cutoff', 'cutoff': 0.8558217696619429, 'grm_norm': 'gcn', 'self_loops': False, 'use_snp_selection': False}. Best is trial 23 with value: 0.2997949033109354.
[I 2025-12-08 15:49:42,593] Trial 86 finished with value: 0.29622873428037877 and parameters: {'model_type': 'gcn', 'hidden_dims': '[512, 128]', 'dropout': 0.465099600188708, 'batch_norm': True, 'lr': 0.0008361107951519486, 'weight_decay': 3.252301223954555e-05, 'epochs': 67, 'loss': 'mae', 'optimizer': 'adam', 'graph_mode': 'cutoff', 'cutoff': 0.6999744729413001, 'grm_norm': 'cosine_then_gcn', 'self_loops': False, 'use_snp_selection': False}. Best is trial 23 with value: 0.2997949033109354.
[I 2025-12-08 15:49:52,336] Trial 87 finished with value: 0.29475469727414916 and parameters: {'model_type': 'gcn', 'hidden_dims': '[256, 128]', 'dropout': 0.4610918241109188, 'batch_norm': True, 'lr': 0.0010780212074992918, 'weight_decay': 4.938839651407128e-05, 'epochs': 66, 'loss': 'mae', 'optimizer': 'adam', 'graph_mode': 'cutoff', 'cutoff': 0.6906305922028787, 'grm_norm': 'none', 'self_loops': True, 'use_snp_selection': False}. Best is trial 23 with value: 0.2997949033109354.
[I 2025-12-08 15:49:59,076] Trial 88 finished with value: 0.2932294119529542 and parameters: {'model_type': 'gcn', 'hidden_dims': '[256, 128]', 'dropout': 0.41109026910523544, 'batch_norm': True, 'lr': 0.0015136179283389874, 'weight_decay': 3.244843016603942e-05, 'epochs': 40, 'loss': 'mae', 'optimizer': 'adam', 'graph_mode': 'cutoff', 'cutoff': 0.6661901045347124, 'grm_norm': 'none', 'self_loops': False, 'use_snp_selection': False}. Best is trial 23 with value: 0.2997949033109354.
[I 2025-12-08 15:50:08,477] Trial 89 finished with value: 0.29243406280123596 and parameters: {'model_type': 'gcn', 'hidden_dims': '[256, 128]', 'dropout': 0.46191725432829495, 'batch_norm': True, 'lr': 0.0008531433586850351, 'weight_decay': 6.384009372606894e-05, 'epochs': 63, 'loss': 'mae', 'optimizer': 'adam', 'graph_mode': 'cutoff', 'cutoff': 0.6969420123325845, 'grm_norm': 'none', 'self_loops': True, 'use_snp_selection': False}. Best is trial 23 with value: 0.2997949033109354.
[I 2025-12-08 15:50:27,776] Trial 90 finished with value: 0.28491325906972154 and parameters: {'model_type': 'gcn', 'hidden_dims': '[256, 128]', 'dropout': 0.4357679590339185, 'batch_norm': True, 'lr': 0.0009774276326329787, 'weight_decay': 4.8889280161178286e-05, 'epochs': 57, 'loss': 'mse', 'optimizer': 'adam', 'graph_mode': 'knn', 'knn_k': 9, 'weighted_edges': True, 'symmetrize_mode': 'union', 'self_loops': False, 'use_snp_selection': True, 'num_snps': 38717}. Best is trial 23 with value: 0.2997949033109354.
[I 2025-12-08 15:50:37,997] Trial 91 finished with value: 0.28630449046286843 and parameters: {'model_type': 'gcn', 'hidden_dims': '[256, 128]', 'dropout': 0.4409682321474364, 'batch_norm': True, 'lr': 0.00116727947783028, 'weight_decay': 1.2154099796714169e-05, 'epochs': 70, 'loss': 'mae', 'optimizer': 'adam', 'graph_mode': 'cutoff', 'cutoff': 0.6269660312614502, 'grm_norm': 'none', 'self_loops': True, 'use_snp_selection': False}. Best is trial 23 with value: 0.2997949033109354.
[I 2025-12-08 15:50:52,220] Trial 92 finished with value: 0.2919904335411846 and parameters: {'model_type': 'gcn', 'hidden_dims': '[512, 64]', 'dropout': 0.48056243070320115, 'batch_norm': True, 'lr': 0.000648114002901164, 'weight_decay': 2.631486600714083e-05, 'epochs': 47, 'loss': 'mae', 'optimizer': 'adam', 'graph_mode': 'cutoff', 'cutoff': 0.7293246609557416, 'grm_norm': 'none', 'self_loops': True, 'use_snp_selection': False}. Best is trial 23 with value: 0.2997949033109354.
[I 2025-12-08 15:50:58,499] Trial 93 finished with value: 0.293270239158798 and parameters: {'model_type': 'gcn', 'hidden_dims': '[128, 64]', 'dropout': 0.45801771006389735, 'batch_norm': True, 'lr': 0.0018254317810782051, 'weight_decay': 3.553136578849311e-05, 'epochs': 64, 'loss': 'mae', 'optimizer': 'adam', 'graph_mode': 'cutoff', 'cutoff': 0.6761136608926869, 'grm_norm': 'cosine_then_gcn', 'self_loops': True, 'use_snp_selection': False}. Best is trial 23 with value: 0.2997949033109354.
[I 2025-12-08 15:51:19,921] Trial 94 finished with value: 0.29312832416114504 and parameters: {'model_type': 'gcn', 'hidden_dims': '[512, 256]', 'dropout': 0.5251163875750907, 'batch_norm': True, 'lr': 0.0008117649503769872, 'weight_decay': 1.789488503093455e-05, 'epochs': 76, 'loss': 'mae', 'optimizer': 'adam', 'graph_mode': 'cutoff', 'cutoff': 0.7172673407236495, 'grm_norm': 'cosine_then_gcn', 'self_loops': True, 'use_snp_selection': False}. Best is trial 23 with value: 0.2997949033109354.
[I 2025-12-08 15:51:44,001] Trial 95 finished with value: 0.29342163969542595 and parameters: {'model_type': 'gcn', 'hidden_dims': '[512, 128]', 'dropout': 0.5469545956082922, 'batch_norm': True, 'lr': 0.0010701069601228696, 'weight_decay': 5.228479961384144e-05, 'epochs': 88, 'loss': 'mae', 'optimizer': 'adam', 'graph_mode': 'cutoff', 'cutoff': 0.7607025282178972, 'grm_norm': 'gcn', 'self_loops': True, 'use_snp_selection': False}. Best is trial 23 with value: 0.2997949033109354.
[I 2025-12-08 15:52:06,319] Trial 96 finished with value: 0.29298310588061993 and parameters: {'model_type': 'gcn', 'hidden_dims': '[512, 128]', 'dropout': 0.5008856585350753, 'batch_norm': True, 'lr': 0.00044627756395832077, 'weight_decay': 7.008825071377622e-05, 'epochs': 80, 'loss': 'mae', 'optimizer': 'adam', 'graph_mode': 'cutoff', 'cutoff': 0.7901048064689489, 'grm_norm': 'cosine_then_gcn', 'self_loops': False, 'use_snp_selection': False}. Best is trial 23 with value: 0.2997949033109354.
[I 2025-12-08 15:52:32,398] Trial 97 finished with value: 0.26955467459249033 and parameters: {'model_type': 'gcn', 'hidden_dims': '[256, 128, 64]', 'dropout': 0.4691660583875086, 'batch_norm': False, 'lr': 3.0786511296843866e-05, 'weight_decay': 2.101907227567395e-05, 'epochs': 202, 'loss': 'mae', 'optimizer': 'adam', 'graph_mode': 'cutoff', 'cutoff': 0.6415914825380442, 'grm_norm': 'none', 'self_loops': False, 'use_snp_selection': False}. Best is trial 23 with value: 0.2997949033109354.
[I 2025-12-08 15:52:48,479] Trial 98 finished with value: 0.2947025710486461 and parameters: {'model_type': 'gcn', 'hidden_dims': '[512, 128]', 'dropout': 0.42759864843662043, 'batch_norm': True, 'lr': 0.0007325874784152517, 'weight_decay': 9.915562056884704e-05, 'epochs': 54, 'loss': 'mae', 'optimizer': 'adam', 'graph_mode': 'cutoff', 'cutoff': 0.7028875329486145, 'grm_norm': 'cosine_then_gcn', 'self_loops': True, 'use_snp_selection': False}. Best is trial 23 with value: 0.2997949033109354.
[I 2025-12-08 15:53:00,461] Trial 99 finished with value: 0.28843371912219784 and parameters: {'model_type': 'gcn', 'hidden_dims': '[256, 128]', 'dropout': 0.3817234944437504, 'batch_norm': True, 'lr': 0.001314635638103741, 'weight_decay': 0.0001330421172606925, 'epochs': 84, 'loss': 'mae', 'optimizer': 'adam', 'graph_mode': 'cutoff', 'cutoff': 0.7407510582319023, 'grm_norm': 'cosine', 'self_loops': False, 'use_snp_selection': False}. Best is trial 23 with value: 0.2997949033109354.
[I 2025-12-08 15:53:09,683] Trial 100 finished with value: 0.2702858103057714 and parameters: {'model_type': 'gcn', 'hidden_dims': '[128, 64]', 'dropout': 0.402621458357528, 'batch_norm': True, 'lr': 2.1957672963055436e-05, 'weight_decay': 4.395769982211375e-06, 'epochs': 108, 'loss': 'mae', 'optimizer': 'adam', 'graph_mode': 'cutoff', 'cutoff': 0.6035710044896935, 'grm_norm': 'cosine_then_gcn', 'self_loops': False, 'use_snp_selection': False}. Best is trial 23 with value: 0.2997949033109354.
[I 2025-12-08 15:53:25,750] Trial 101 finished with value: 0.2977647380287224 and parameters: {'model_type': 'gcn', 'hidden_dims': '[512, 128]', 'dropout': 0.42733723647004296, 'batch_norm': True, 'lr': 0.0007158814896541439, 'weight_decay': 9.353128603098557e-05, 'epochs': 54, 'loss': 'mae', 'optimizer': 'adam', 'graph_mode': 'cutoff', 'cutoff': 0.6979684261996615, 'grm_norm': 'cosine_then_gcn', 'self_loops': True, 'use_snp_selection': False}. Best is trial 23 with value: 0.2997949033109354.
[I 2025-12-08 15:53:45,674] Trial 102 finished with value: 0.2921977583489169 and parameters: {'model_type': 'gcn', 'hidden_dims': '[512, 128]', 'dropout': 0.4442556333769942, 'batch_norm': True, 'lr': 0.000383781827762937, 'weight_decay': 8.418858065167317e-05, 'epochs': 70, 'loss': 'mae', 'optimizer': 'adam', 'graph_mode': 'cutoff', 'cutoff': 0.6695379327178073, 'grm_norm': 'cosine_then_gcn', 'self_loops': True, 'use_snp_selection': False}. Best is trial 23 with value: 0.2997949033109354.
[I 2025-12-08 15:53:59,818] Trial 103 finished with value: 0.28525423192869725 and parameters: {'model_type': 'gcn', 'hidden_dims': '[512, 128]', 'dropout': 0.454861714190982, 'batch_norm': True, 'lr': 0.0006615508368278615, 'weight_decay': 5.91856758650645e-05, 'epochs': 46, 'loss': 'mae', 'optimizer': 'adam', 'graph_mode': 'cutoff', 'cutoff': 0.7694623744844269, 'grm_norm': 'cosine_then_gcn', 'self_loops': True, 'use_snp_selection': False}. Best is trial 23 with value: 0.2997949033109354.
[I 2025-12-08 15:54:17,095] Trial 104 finished with value: 0.29004735107967705 and parameters: {'model_type': 'gcn', 'hidden_dims': '[512, 128]', 'dropout': 0.47726415560483065, 'batch_norm': True, 'lr': 0.0009718679921296057, 'weight_decay': 3.728498206829839e-05, 'epochs': 59, 'loss': 'mae', 'optimizer': 'adam', 'graph_mode': 'cutoff', 'cutoff': 0.6830913111630007, 'grm_norm': 'cosine_then_gcn', 'self_loops': True, 'use_snp_selection': False}. Best is trial 23 with value: 0.2997949033109354.
[I 2025-12-08 15:54:42,787] Trial 105 finished with value: 0.29481291004687493 and parameters: {'model_type': 'gcn', 'hidden_dims': '[512, 128]', 'dropout': 0.4151316948469024, 'batch_norm': True, 'lr': 0.0005726434703163768, 'weight_decay': 0.00022458646302478142, 'epochs': 94, 'loss': 'mae', 'optimizer': 'adam', 'graph_mode': 'cutoff', 'cutoff': 0.8845327687819581, 'grm_norm': 'cosine_then_gcn', 'self_loops': True, 'use_snp_selection': False}. Best is trial 23 with value: 0.2997949033109354.
[I 2025-12-08 15:55:03,903] Trial 106 finished with value: 0.29188920333349333 and parameters: {'model_type': 'gcn', 'hidden_dims': '[512, 128]', 'dropout': 0.412515492008107, 'batch_norm': True, 'lr': 0.0008328193037663694, 'weight_decay': 0.00023652016826121255, 'epochs': 75, 'loss': 'mae', 'optimizer': 'adam', 'graph_mode': 'cutoff', 'cutoff': 0.8866543384704529, 'grm_norm': 'cosine_then_gcn', 'self_loops': True, 'use_snp_selection': False}. Best is trial 23 with value: 0.2997949033109354.
[I 2025-12-08 15:56:30,966] Trial 107 finished with value: 0.292184404740457 and parameters: {'model_type': 'gcn', 'hidden_dims': '[512, 128]', 'dropout': 0.39431553943231235, 'batch_norm': True, 'lr': 0.00010288791779649091, 'weight_decay': 0.0003319259655310641, 'epochs': 349, 'loss': 'mae', 'optimizer': 'adam', 'graph_mode': 'cutoff', 'cutoff': 0.7454034749744776, 'grm_norm': 'cosine_then_gcn', 'self_loops': False, 'use_snp_selection': False}. Best is trial 23 with value: 0.2997949033109354.
[I 2025-12-08 15:57:04,726] Trial 108 finished with value: 0.28793862065248155 and parameters: {'model_type': 'gcn', 'hidden_dims': '[512, 128]', 'dropout': 0.38675346636793584, 'batch_norm': True, 'lr': 0.0005693223367824154, 'weight_decay': 0.000161076301908279, 'epochs': 95, 'loss': 'mae', 'optimizer': 'adam', 'graph_mode': 'cutoff', 'cutoff': 0.8031376463275715, 'grm_norm': 'gcn', 'self_loops': True, 'use_snp_selection': True, 'num_snps': 49412}. Best is trial 23 with value: 0.2997949033109354.
[I 2025-12-08 15:57:23,792] Trial 109 finished with value: 0.22232352340462094 and parameters: {'model_type': 'gcn', 'hidden_dims': '[512, 128]', 'dropout': 0.10246132341805703, 'batch_norm': True, 'lr': 7.070471474579584e-05, 'weight_decay': 0.00011543438077280995, 'epochs': 65, 'loss': 'mse', 'optimizer': 'adam', 'graph_mode': 'knn', 'knn_k': 6, 'weighted_edges': False, 'symmetrize_mode': 'mutual', 'self_loops': False, 'use_snp_selection': False}. Best is trial 23 with value: 0.2997949033109354.
[I 2025-12-08 15:58:46,784] Trial 110 finished with value: 0.2913057689103771 and parameters: {'model_type': 'gcn', 'hidden_dims': '[512, 128]', 'dropout': 0.3625005729448407, 'batch_norm': True, 'lr': 0.00047610306900880444, 'weight_decay': 4.539112984841925e-05, 'epochs': 332, 'loss': 'mae', 'optimizer': 'adam', 'graph_mode': 'cutoff', 'cutoff': 0.7042081131552679, 'grm_norm': 'cosine_then_gcn', 'self_loops': False, 'use_snp_selection': False}. Best is trial 23 with value: 0.2997949033109354.
[I 2025-12-08 15:59:02,376] Trial 111 finished with value: 0.29232163915405146 and parameters: {'model_type': 'gcn', 'hidden_dims': '[512, 128]', 'dropout': 0.4292996392331385, 'batch_norm': True, 'lr': 0.0007189216842425616, 'weight_decay': 2.953879384753156e-05, 'epochs': 52, 'loss': 'mae', 'optimizer': 'adam', 'graph_mode': 'cutoff', 'cutoff': 0.840191456006431, 'grm_norm': 'cosine_then_gcn', 'self_loops': True, 'use_snp_selection': False}. Best is trial 23 with value: 0.2997949033109354.
[I 2025-12-08 15:59:09,217] Trial 112 finished with value: 0.287098357757552 and parameters: {'model_type': 'gcn', 'hidden_dims': '[128, 64]', 'dropout': 0.44450810126470724, 'batch_norm': True, 'lr': 0.00025957916519455965, 'weight_decay': 0.00022355166070645241, 'epochs': 73, 'loss': 'mae', 'optimizer': 'adam', 'graph_mode': 'cutoff', 'cutoff': 0.8677696034534764, 'grm_norm': 'cosine_then_gcn', 'self_loops': True, 'use_snp_selection': False}. Best is trial 23 with value: 0.2997949033109354.
[I 2025-12-08 15:59:32,494] Trial 113 finished with value: 0.28842072642543753 and parameters: {'model_type': 'gcn', 'hidden_dims': '[512, 128]', 'dropout': 0.4660256402455258, 'batch_norm': True, 'lr': 0.0011690407066382664, 'weight_decay': 9.612849663598227e-05, 'epochs': 84, 'loss': 'mae', 'optimizer': 'adam', 'graph_mode': 'cutoff', 'cutoff': 0.8271986425832634, 'grm_norm': 'cosine_then_gcn', 'self_loops': True, 'use_snp_selection': False}. Best is trial 23 with value: 0.2997949033109354.
