[I 2025-12-08 14:20:21,633] Trial 5 finished with value: 0.25972649672110776 and parameters: {'model_type': 'gcn', 'hidden_dims': '[128, 64]', 'dropout': 0.5611163934517731, 'batch_norm': True, 'lr': 0.0003984856210762587, 'weight_decay': 1.1466743517565185e-07, 'epochs': 344, 'loss': 'mae', 'optimizer': 'adam', 'graph_mode': 'cutoff', 'cutoff': 0.6089370799714728, 'grm_norm': 'gcn', 'self_loops': True, 'use_snp_selection': False}. Best is trial 4 with value: 0.2729382015736053.
[I 2025-12-08 14:20:44,106] Trial 6 finished with value: 0.2521644620534915 and parameters: {'model_type': 'gcn', 'hidden_dims': '[128, 64]', 'dropout': 0.31805912766941713, 'batch_norm': True, 'lr': 1.2361026034262557e-05, 'weight_decay': 6.492620232791903e-06, 'epochs': 271, 'loss': 'mse', 'optimizer': 'adam', 'graph_mode': 'cutoff', 'cutoff': 0.6193362582230448, 'grm_norm': 'cosine', 'self_loops': False, 'use_snp_selection': True, 'num_snps': 28594}. Best is trial 4 with value: 0.2729382015736053.
[I 2025-12-08 14:21:03,929] Trial 7 finished with value: 0.24918411127338197 and parameters: {'model_type': 'gcn', 'hidden_dims': '[512, 64]', 'dropout': 0.471337288649717, 'batch_norm': True, 'lr': 2.239693207292708e-05, 'weight_decay': 2.263166635514082e-06, 'epochs': 69, 'loss': 'mse', 'optimizer': 'adam', 'graph_mode': 'cutoff', 'cutoff': 0.4056820886426376, 'grm_norm': 'cosine', 'self_loops': False, 'use_snp_selection': False}. Best is trial 4 with value: 0.2729382015736053.
[I 2025-12-08 14:21:41,608] Trial 8 finished with value: 0.26158422293967154 and parameters: {'model_type': 'gcn', 'hidden_dims': '[512, 256]', 'dropout': 0.20659328268932406, 'batch_norm': False, 'lr': 8.93315124361372e-05, 'weight_decay': 0.00028987480727919035, 'epochs': 136, 'loss': 'mae', 'optimizer': 'adam', 'graph_mode': 'knn', 'knn_k': 3, 'weighted_edges': False, 'symmetrize_mode': 'union', 'self_loops': False, 'use_snp_selection': True, 'num_snps': 43128}. Best is trial 4 with value: 0.2729382015736053.
[I 2025-12-08 14:22:23,814] Trial 9 finished with value: 0.018585967635780767 and parameters: {'model_type': 'gcn', 'hidden_dims': '[512, 256]', 'dropout': 0.2888209592870401, 'batch_norm': False, 'lr': 0.004734648143129892, 'weight_decay': 1.5879705591356368e-06, 'epochs': 163, 'loss': 'mse', 'optimizer': 'adam', 'graph_mode': 'cutoff', 'cutoff': 0.5984899797909019, 'grm_norm': 'cosine', 'self_loops': True, 'use_snp_selection': False}. Best is trial 4 with value: 0.2729382015736053.
[I 2025-12-08 14:22:32,931] Trial 10 finished with value: 0.24385630897768787 and parameters: {'model_type': 'gcn', 'hidden_dims': '[512, 128]', 'dropout': 0.11372025982957354, 'batch_norm': False, 'lr': 0.0023343012062770553, 'weight_decay': 4.14440562940608e-05, 'epochs': 41, 'loss': 'mae', 'optimizer': 'adam', 'graph_mode': 'cutoff', 'cutoff': 0.8740100033033124, 'grm_norm': 'none', 'self_loops': False, 'use_snp_selection': True, 'num_snps': 3859}. Best is trial 4 with value: 0.2729382015736053.
[I 2025-12-08 14:23:09,408] Trial 11 finished with value: 0.2505754106668884 and parameters: {'model_type': 'gcn', 'hidden_dims': '[512, 256]', 'dropout': 0.42220860806405436, 'batch_norm': False, 'lr': 0.00012587284186352953, 'weight_decay': 0.0006590033092812647, 'epochs': 114, 'loss': 'mae', 'optimizer': 'adam', 'graph_mode': 'knn', 'knn_k': 1, 'weighted_edges': False, 'symmetrize_mode': 'union', 'self_loops': False, 'use_snp_selection': True, 'num_snps': 47068}. Best is trial 4 with value: 0.2729382015736053.
[I 2025-12-08 14:23:24,156] Trial 12 finished with value: 0.264215855273547 and parameters: {'model_type': 'gcn', 'hidden_dims': '[512, 256]', 'dropout': 0.14142767069304862, 'batch_norm': False, 'lr': 0.0011798598123878552, 'weight_decay': 9.414718277089941e-05, 'epochs': 124, 'loss': 'mae', 'optimizer': 'adam', 'graph_mode': 'knn', 'knn_k': 3, 'weighted_edges': False, 'symmetrize_mode': 'union', 'self_loops': False, 'use_snp_selection': True, 'num_snps': 8584}. Best is trial 4 with value: 0.2729382015736053.
[I 2025-12-08 14:23:36,774] Trial 13 finished with value: 0.24420010084626226 and parameters: {'model_type': 'gcn', 'hidden_dims': '[512, 256]', 'dropout': 0.13529665206282515, 'batch_norm': False, 'lr': 0.0013143362382724787, 'weight_decay': 5.2475435102613655e-05, 'epochs': 101, 'loss': 'mae', 'optimizer': 'adam', 'graph_mode': 'knn', 'knn_k': 6, 'weighted_edges': False, 'symmetrize_mode': 'union', 'self_loops': False, 'use_snp_selection': True, 'num_snps': 5870}. Best is trial 4 with value: 0.2729382015736053.
[I 2025-12-08 14:23:58,027] Trial 14 finished with value: 0.27218211559404903 and parameters: {'model_type': 'gcn', 'hidden_dims': '[512, 256]', 'dropout': 0.25632205209505254, 'batch_norm': False, 'lr': 0.0009612459132665168, 'weight_decay': 2.2203297076850073e-05, 'epochs': 165, 'loss': 'mae', 'optimizer': 'adam', 'graph_mode': 'cutoff', 'cutoff': 0.8944237199027842, 'grm_norm': 'none', 'self_loops': False, 'use_snp_selection': True, 'num_snps': 15654}. Best is trial 4 with value: 0.2729382015736053.
[I 2025-12-08 14:24:16,213] Trial 15 finished with value: 0.11106756216786229 and parameters: {'model_type': 'gcn', 'hidden_dims': '[256, 128, 64]', 'dropout': 0.400283527263757, 'batch_norm': False, 'lr': 0.008017119310501081, 'weight_decay': 1.3728672854267767e-05, 'epochs': 164, 'loss': 'mae', 'optimizer': 'adam', 'graph_mode': 'cutoff', 'cutoff': 0.8872255416714164, 'grm_norm': 'none', 'self_loops': False, 'use_snp_selection': True, 'num_snps': 18030}. Best is trial 4 with value: 0.2729382015736053.
[I 2025-12-08 14:24:43,490] Trial 16 finished with value: 0.26621345139824265 and parameters: {'model_type': 'gcn', 'hidden_dims': '[512, 128]', 'dropout': 0.26504450412433567, 'batch_norm': True, 'lr': 0.0002698949967223157, 'weight_decay': 1.535136061044636e-05, 'epochs': 243, 'loss': 'mae', 'optimizer': 'adam', 'graph_mode': 'cutoff', 'cutoff': 0.7714575519927706, 'grm_norm': 'none', 'self_loops': False, 'use_snp_selection': True, 'num_snps': 16805}. Best is trial 4 with value: 0.2729382015736053.
[I 2025-12-08 14:24:59,815] Trial 17 finished with value: 0.27361680874778405 and parameters: {'model_type': 'gcn', 'hidden_dims': '[512, 256]', 'dropout': 0.40340011562026795, 'batch_norm': False, 'lr': 0.00020720022527164094, 'weight_decay': 0.00016580623989172948, 'epochs': 79, 'loss': 'mae', 'optimizer': 'adam', 'graph_mode': 'cutoff', 'cutoff': 0.7430449078328386, 'grm_norm': 'cosine_then_gcn', 'self_loops': False, 'use_snp_selection': True, 'num_snps': 17161}. Best is trial 17 with value: 0.27361680874778405.
[I 2025-12-08 14:25:19,696] Trial 18 finished with value: 0.22338325365219255 and parameters: {'model_type': 'gcn', 'hidden_dims': '[256, 128]', 'dropout': 0.38002237069221595, 'batch_norm': False, 'lr': 0.00019416468155302821, 'weight_decay': 0.0002328490539999114, 'epochs': 77, 'loss': 'mae', 'optimizer': 'adam', 'graph_mode': 'cutoff', 'cutoff': 0.7175035598106263, 'grm_norm': 'cosine_then_gcn', 'self_loops': False, 'use_snp_selection': True, 'num_snps': 37299}. Best is trial 17 with value: 0.27361680874778405.
[I 2025-12-08 14:25:35,422] Trial 19 finished with value: 0.2721896315485126 and parameters: {'model_type': 'gcn', 'hidden_dims': '[512, 256]', 'dropout': 0.46201114806835597, 'batch_norm': True, 'lr': 3.631841990198277e-05, 'weight_decay': 0.00015564981699712466, 'epochs': 41, 'loss': 'mae', 'optimizer': 'adam', 'graph_mode': 'cutoff', 'cutoff': 0.7299598277380559, 'grm_norm': 'cosine_then_gcn', 'self_loops': False, 'use_snp_selection': True, 'num_snps': 23217}. Best is trial 17 with value: 0.27361680874778405.
[I 2025-12-08 14:25:49,878] Trial 20 finished with value: 0.2375203793044543 and parameters: {'model_type': 'gcn', 'hidden_dims': '[512, 256]', 'dropout': 0.3616577749921118, 'batch_norm': True, 'lr': 0.00040402552806157393, 'weight_decay': 4.550573702741921e-06, 'epochs': 86, 'loss': 'mae', 'optimizer': 'adam', 'graph_mode': 'cutoff', 'cutoff': 0.4642572787104977, 'grm_norm': 'cosine_then_gcn', 'self_loops': False, 'use_snp_selection': True, 'num_snps': 11964}. Best is trial 17 with value: 0.27361680874778405.
[I 2025-12-08 14:26:06,840] Trial 21 finished with value: 0.2734766443556209 and parameters: {'model_type': 'gcn', 'hidden_dims': '[512, 256]', 'dropout': 0.5202853294377866, 'batch_norm': True, 'lr': 3.617224327028526e-05, 'weight_decay': 0.0001356927558079467, 'epochs': 47, 'loss': 'mae', 'optimizer': 'adam', 'graph_mode': 'cutoff', 'cutoff': 0.7514177000999241, 'grm_norm': 'cosine_then_gcn', 'self_loops': False, 'use_snp_selection': True, 'num_snps': 25180}. Best is trial 17 with value: 0.27361680874778405.
[I 2025-12-08 14:26:24,587] Trial 22 finished with value: 0.27864574360961286 and parameters: {'model_type': 'gcn', 'hidden_dims': '[512, 256]', 'dropout': 0.5039653094674108, 'batch_norm': True, 'lr': 4.306181214893874e-05, 'weight_decay': 0.0008921781180722003, 'epochs': 69, 'loss': 'mae', 'optimizer': 'adam', 'graph_mode': 'cutoff', 'cutoff': 0.8009317244892571, 'grm_norm': 'cosine_then_gcn', 'self_loops': False, 'use_snp_selection': True, 'num_snps': 22070}. Best is trial 22 with value: 0.27864574360961286.
[I 2025-12-08 14:26:45,780] Trial 23 finished with value: 0.2840589082976175 and parameters: {'model_type': 'gcn', 'hidden_dims': '[512, 256]', 'dropout': 0.5185716979403545, 'batch_norm': True, 'lr': 3.9510794764131e-05, 'weight_decay': 0.0009691370104417833, 'epochs': 57, 'loss': 'mae', 'optimizer': 'adam', 'graph_mode': 'cutoff', 'cutoff': 0.6681249298428082, 'grm_norm': 'cosine_then_gcn', 'self_loops': False, 'use_snp_selection': True, 'num_snps': 33745}. Best is trial 23 with value: 0.2840589082976175.
[I 2025-12-08 14:27:07,292] Trial 24 finished with value: 0.2835206248412884 and parameters: {'model_type': 'gcn', 'hidden_dims': '[512, 256]', 'dropout': 0.5995751300145292, 'batch_norm': True, 'lr': 4.766115685403152e-05, 'weight_decay': 0.0008463244790083638, 'epochs': 60, 'loss': 'mae', 'optimizer': 'adam', 'graph_mode': 'cutoff', 'cutoff': 0.6722791950209699, 'grm_norm': 'cosine_then_gcn', 'self_loops': False, 'use_snp_selection': True, 'num_snps': 33454}. Best is trial 23 with value: 0.2840589082976175.
[I 2025-12-08 14:27:39,404] Trial 25 finished with value: 0.26426573768360484 and parameters: {'model_type': 'gcn', 'hidden_dims': '[512, 64]', 'dropout': 0.596769104153231, 'batch_norm': True, 'lr': 4.107909230972711e-05, 'weight_decay': 0.0009622260253752989, 'epochs': 134, 'loss': 'mae', 'optimizer': 'adam', 'graph_mode': 'cutoff', 'cutoff': 0.6572469868327967, 'grm_norm': 'cosine_then_gcn', 'self_loops': False, 'use_snp_selection': True, 'num_snps': 35753}. Best is trial 23 with value: 0.2840589082976175.
[I 2025-12-08 14:27:58,614] Trial 26 finished with value: 0.2811869146388927 and parameters: {'model_type': 'gcn', 'hidden_dims': '[512, 128]', 'dropout': 0.4888627496609909, 'batch_norm': True, 'lr': 1.1313290961116952e-05, 'weight_decay': 0.0005280699144031716, 'epochs': 67, 'loss': 'mse', 'optimizer': 'adam', 'graph_mode': 'cutoff', 'cutoff': 0.6553197315021432, 'grm_norm': 'cosine_then_gcn', 'self_loops': True, 'use_snp_selection': False}. Best is trial 23 with value: 0.2840589082976175.
[I 2025-12-08 14:28:15,692] Trial 27 finished with value: 0.268579036357382 and parameters: {'model_type': 'gcn', 'hidden_dims': '[512, 128]', 'dropout': 0.595221431955278, 'batch_norm': True, 'lr': 1.0758869966494098e-05, 'weight_decay': 0.0004349620876003044, 'epochs': 58, 'loss': 'mse', 'optimizer': 'adam', 'graph_mode': 'cutoff', 'cutoff': 0.5180615269487421, 'grm_norm': 'cosine_then_gcn', 'self_loops': True, 'use_snp_selection': False}. Best is trial 23 with value: 0.2840589082976175.
[I 2025-12-08 14:28:46,189] Trial 28 finished with value: 0.25809656294019445 and parameters: {'model_type': 'gcn', 'hidden_dims': '[512, 128]', 'dropout': 0.455013102206961, 'batch_norm': True, 'lr': 2.0081482601214697e-05, 'weight_decay': 0.00046755327568338736, 'epochs': 114, 'loss': 'mse', 'optimizer': 'adam', 'graph_mode': 'cutoff', 'cutoff': 0.6749200461553776, 'grm_norm': 'cosine_then_gcn', 'self_loops': True, 'use_snp_selection': False}. Best is trial 23 with value: 0.2840589082976175.
[I 2025-12-08 14:30:04,707] Trial 29 finished with value: 0.22990149812269065 and parameters: {'model_type': 'gcn', 'hidden_dims': '[512, 128]', 'dropout': 0.5241098413977898, 'batch_norm': True, 'lr': 1.624871852479449e-05, 'weight_decay': 9.033397682264232e-05, 'epochs': 313, 'loss': 'mse', 'optimizer': 'adam', 'graph_mode': 'cutoff', 'cutoff': 0.5335449468141173, 'grm_norm': 'cosine_then_gcn', 'self_loops': True, 'use_snp_selection': False}. Best is trial 23 with value: 0.2840589082976175.
[I 2025-12-08 14:30:19,242] Trial 30 finished with value: 0.24881485942813858 and parameters: {'model_type': 'gcn', 'hidden_dims': '[256, 128, 64]', 'dropout': 0.5558816903386264, 'batch_norm': True, 'lr': 2.6657934263258335e-05, 'weight_decay': 0.0009801422324880594, 'epochs': 98, 'loss': 'mse', 'optimizer': 'adam', 'graph_mode': 'cutoff', 'cutoff': 0.20617936076702692, 'grm_norm': 'gcn', 'self_loops': True, 'use_snp_selection': False}. Best is trial 23 with value: 0.2840589082976175.
[I 2025-12-08 14:30:37,764] Trial 31 finished with value: 0.28163957132898615 and parameters: {'model_type': 'gcn', 'hidden_dims': '[256, 128]', 'dropout': 0.511721522538215, 'batch_norm': True, 'lr': 5.7564168055214526e-05, 'weight_decay': 0.0009884908105514117, 'epochs': 66, 'loss': 'mae', 'optimizer': 'adam', 'graph_mode': 'cutoff', 'cutoff': 0.6739953370745334, 'grm_norm': 'cosine_then_gcn', 'self_loops': True, 'use_snp_selection': True, 'num_snps': 34695}. Best is trial 23 with value: 0.2840589082976175.
[I 2025-12-08 14:30:47,110] Trial 32 finished with value: 0.27371182047048714 and parameters: {'model_type': 'gcn', 'hidden_dims': '[256, 128]', 'dropout': 0.49441739881599284, 'batch_norm': True, 'lr': 5.694069784258311e-05, 'weight_decay': 0.0003003982415632896, 'epochs': 61, 'loss': 'mse', 'optimizer': 'adam', 'graph_mode': 'cutoff', 'cutoff': 0.6666901724801682, 'grm_norm': 'cosine_then_gcn', 'self_loops': True, 'use_snp_selection': False}. Best is trial 23 with value: 0.2840589082976175.
[I 2025-12-08 14:31:04,262] Trial 33 finished with value: 0.2721044752917158 and parameters: {'model_type': 'gcn', 'hidden_dims': '[256, 128]', 'dropout': 0.5448425020292863, 'batch_norm': True, 'lr': 0.00011921934173703332, 'weight_decay': 0.0005718498933271309, 'epochs': 54, 'loss': 'mae', 'optimizer': 'adam', 'graph_mode': 'cutoff', 'cutoff': 0.5725666236111934, 'grm_norm': 'cosine_then_gcn', 'self_loops': True, 'use_snp_selection': True, 'num_snps': 33264}. Best is trial 23 with value: 0.2840589082976175.
[I 2025-12-08 14:31:23,177] Trial 34 finished with value: 0.2755155278734821 and parameters: {'model_type': 'gcn', 'hidden_dims': '[256, 128]', 'dropout': 0.5758178066530822, 'batch_norm': True, 'lr': 5.901684977297326e-05, 'weight_decay': 0.0004206314551200905, 'epochs': 144, 'loss': 'mse', 'optimizer': 'adam', 'graph_mode': 'cutoff', 'cutoff': 0.6819810194086052, 'grm_norm': 'cosine_then_gcn', 'self_loops': True, 'use_snp_selection': False}. Best is trial 23 with value: 0.2840589082976175.
[I 2025-12-08 14:31:46,458] Trial 35 finished with value: 0.2600751203418749 and parameters: {'model_type': 'gcn', 'hidden_dims': '[256, 128]', 'dropout': 0.48744552854511813, 'batch_norm': True, 'lr': 2.6703533726308695e-05, 'weight_decay': 0.0006111529833581883, 'epochs': 106, 'loss': 'mae', 'optimizer': 'adam', 'graph_mode': 'knn', 'knn_k': 10, 'weighted_edges': True, 'symmetrize_mode': 'mutual', 'self_loops': True, 'use_snp_selection': True, 'num_snps': 38625}. Best is trial 23 with value: 0.2840589082976175.
[I 2025-12-08 14:32:01,102] Trial 36 finished with value: 0.2496950571365019 and parameters: {'model_type': 'gcn', 'hidden_dims': '[128, 64]', 'dropout': 0.5273393893286582, 'batch_norm': True, 'lr': 1.4326875173721158e-05, 'weight_decay': 0.00028533700183682316, 'epochs': 188, 'loss': 'mae', 'optimizer': 'adam', 'graph_mode': 'cutoff', 'cutoff': 0.6386879295951969, 'grm_norm': 'cosine_then_gcn', 'self_loops': True, 'use_snp_selection': False}. Best is trial 23 with value: 0.2840589082976175.
[I 2025-12-08 14:32:24,441] Trial 37 finished with value: 0.2599674535945806 and parameters: {'model_type': 'gcn', 'hidden_dims': '[256, 128, 64]', 'dropout': 0.43877524687132674, 'batch_norm': True, 'lr': 6.682352238711869e-05, 'weight_decay': 6.242937871419589e-07, 'epochs': 89, 'loss': 'mse', 'optimizer': 'adam', 'graph_mode': 'cutoff', 'cutoff': 0.4943815582181957, 'grm_norm': 'cosine_then_gcn', 'self_loops': True, 'use_snp_selection': True, 'num_snps': 43352}. Best is trial 23 with value: 0.2840589082976175.
[I 2025-12-08 14:32:42,745] Trial 38 finished with value: 0.2632664851196844 and parameters: {'model_type': 'gcn', 'hidden_dims': '[512, 64]', 'dropout': 0.5704544858249424, 'batch_norm': True, 'lr': 0.00012738695706582454, 'weight_decay': 9.011237978811409e-05, 'epochs': 64, 'loss': 'mae', 'optimizer': 'adam', 'graph_mode': 'cutoff', 'cutoff': 0.6995770910055041, 'grm_norm': 'gcn', 'self_loops': True, 'use_snp_selection': False}. Best is trial 23 with value: 0.2840589082976175.
[I 2025-12-08 14:33:50,122] Trial 39 finished with value: 0.23079957168835702 and parameters: {'model_type': 'gcn', 'hidden_dims': '[512, 128]', 'dropout': 0.5330389627438362, 'batch_norm': True, 'lr': 2.2725300183189697e-05, 'weight_decay': 0.00021150135260726273, 'epochs': 221, 'loss': 'mse', 'optimizer': 'adam', 'graph_mode': 'knn', 'knn_k': 7, 'weighted_edges': True, 'symmetrize_mode': 'mutual', 'self_loops': True, 'use_snp_selection': True, 'num_snps': 59716}. Best is trial 23 with value: 0.2840589082976175.
[I 2025-12-08 14:34:06,576] Trial 40 finished with value: 0.23550438124423417 and parameters: {'model_type': 'gcn', 'hidden_dims': '[128, 64]', 'dropout': 0.48727860532591816, 'batch_norm': True, 'lr': 1.0955855270095219e-05, 'weight_decay': 3.050664010024889e-05, 'epochs': 90, 'loss': 'mae', 'optimizer': 'adam', 'graph_mode': 'cutoff', 'cutoff': 0.5760826211174199, 'grm_norm': 'cosine_then_gcn', 'self_loops': True, 'use_snp_selection': True, 'num_snps': 31588}. Best is trial 23 with value: 0.2840589082976175.
[I 2025-12-08 14:34:25,026] Trial 41 finished with value: 0.28419062551940144 and parameters: {'model_type': 'gcn', 'hidden_dims': '[512, 256]', 'dropout': 0.5006397065080772, 'batch_norm': True, 'lr': 4.7033097382192854e-05, 'weight_decay': 0.0008933406150919806, 'epochs': 73, 'loss': 'mae', 'optimizer': 'adam', 'graph_mode': 'cutoff', 'cutoff': 0.8028207230720088, 'grm_norm': 'cosine_then_gcn', 'self_loops': False, 'use_snp_selection': True, 'num_snps': 22567}. Best is trial 41 with value: 0.28419062551940144.
[I 2025-12-08 14:34:46,898] Trial 42 finished with value: 0.27774026950309566 and parameters: {'model_type': 'gcn', 'hidden_dims': '[512, 256]', 'dropout': 0.5051417208513889, 'batch_norm': True, 'lr': 8.683777085115916e-05, 'weight_decay': 0.0006961224790406213, 'epochs': 73, 'loss': 'mae', 'optimizer': 'adam', 'graph_mode': 'cutoff', 'cutoff': 0.8125219899648612, 'grm_norm': 'cosine_then_gcn', 'self_loops': False, 'use_snp_selection': True, 'num_snps': 30703}. Best is trial 41 with value: 0.28419062551940144.
[I 2025-12-08 14:35:05,401] Trial 43 finished with value: 0.2634295663139091 and parameters: {'model_type': 'gcn', 'hidden_dims': '[256, 128]', 'dropout': 0.42831014791365296, 'batch_norm': True, 'lr': 5.0068551424073994e-05, 'weight_decay': 0.00040252487189677046, 'epochs': 41, 'loss': 'mae', 'optimizer': 'adam', 'graph_mode': 'cutoff', 'cutoff': 0.8265996749312856, 'grm_norm': 'cosine_then_gcn', 'self_loops': False, 'use_snp_selection': True, 'num_snps': 42461}. Best is trial 41 with value: 0.28419062551940144.
[I 2025-12-08 14:35:23,589] Trial 44 finished with value: 0.26151641742179166 and parameters: {'model_type': 'gcn', 'hidden_dims': '[512, 256]', 'dropout': 0.47062006437247206, 'batch_norm': True, 'lr': 3.100886849503121e-05, 'weight_decay': 0.0009805235160597057, 'epochs': 54, 'loss': 'mae', 'optimizer': 'adam', 'graph_mode': 'cutoff', 'cutoff': 0.6295972358701761, 'grm_norm': 'gcn', 'self_loops': False, 'use_snp_selection': True, 'num_snps': 27251}. Best is trial 41 with value: 0.28419062551940144.
[I 2025-12-08 14:35:52,572] Trial 45 finished with value: 0.2775584729855872 and parameters: {'model_type': 'gcn', 'hidden_dims': '[512, 128]', 'dropout': 0.5744595160400834, 'batch_norm': True, 'lr': 1.6913248073828863e-05, 'weight_decay': 0.00034713051625021724, 'epochs': 118, 'loss': 'mae', 'optimizer': 'adam', 'graph_mode': 'cutoff', 'cutoff': 0.7777966546133626, 'grm_norm': 'cosine_then_gcn', 'self_loops': False, 'use_snp_selection': True, 'num_snps': 33840}. Best is trial 41 with value: 0.28419062551940144.
[I 2025-12-08 14:36:15,085] Trial 46 finished with value: 0.21784864511910085 and parameters: {'model_type': 'gcn', 'hidden_dims': '[512, 256]', 'dropout': 0.5463728759385295, 'batch_norm': True, 'lr': 9.117153118868039e-05, 'weight_decay': 1.0436034896527129e-07, 'epochs': 80, 'loss': 'mse', 'optimizer': 'adam', 'graph_mode': 'knn', 'knn_k': 1, 'weighted_edges': False, 'symmetrize_mode': 'mutual', 'self_loops': True, 'use_snp_selection': False}. Best is trial 41 with value: 0.28419062551940144.
[I 2025-12-08 14:36:44,621] Trial 47 finished with value: 0.26645501801979027 and parameters: {'model_type': 'gcn', 'hidden_dims': '[512, 64]', 'dropout': 0.3128685405833279, 'batch_norm': True, 'lr': 0.00017976370146221792, 'weight_decay': 0.0006012313587722819, 'epochs': 100, 'loss': 'mae', 'optimizer': 'adam', 'graph_mode': 'cutoff', 'cutoff': 0.6055631078513146, 'grm_norm': 'cosine_then_gcn', 'self_loops': False, 'use_snp_selection': True, 'num_snps': 39664}. Best is trial 41 with value: 0.28419062551940144.
