[I 2025-12-08 22:12:46,842] Trial 57 finished with value: 0.31030523103738294 and parameters: {'model_type': 'gcn', 'hidden_dims': '[512, 256]', 'dropout': 0.47981247181582193, 'batch_norm': True, 'lr': 0.00048253327867513136, 'weight_decay': 7.824318682091549e-07, 'epochs': 40, 'loss': 'mae', 'optimizer': 'adam', 'graph_mode': 'cutoff', 'cutoff': 0.6088752433770899, 'grm_norm': 'cosine_then_gcn', 'self_loops': False, 'use_snp_selection': True, 'num_snps': 59641}. Best is trial 15 with value: 0.3135668235684893.
[I 2025-12-08 22:13:18,985] Trial 58 finished with value: 0.30198005959602175 and parameters: {'model_type': 'gcn', 'hidden_dims': '[512, 256]', 'dropout': 0.4815637145779529, 'batch_norm': True, 'lr': 0.0005332595689058672, 'weight_decay': 8.202258037508348e-07, 'epochs': 54, 'loss': 'mae', 'optimizer': 'adam', 'graph_mode': 'cutoff', 'cutoff': 0.58322332202773, 'grm_norm': 'cosine_then_gcn', 'self_loops': False, 'use_snp_selection': True, 'num_snps': 59582}. Best is trial 15 with value: 0.3135668235684893.
[I 2025-12-08 22:13:49,249] Trial 59 finished with value: 0.30188005898055276 and parameters: {'model_type': 'gcn', 'hidden_dims': '[512, 256]', 'dropout': 0.504433611572799, 'batch_norm': True, 'lr': 0.0002886873066110161, 'weight_decay': 1.8226171038702336e-06, 'epochs': 209, 'loss': 'mae', 'optimizer': 'adam', 'graph_mode': 'cutoff', 'cutoff': 0.6244476891680328, 'grm_norm': 'cosine_then_gcn', 'self_loops': False, 'use_snp_selection': True, 'num_snps': 20897}. Best is trial 15 with value: 0.3135668235684893.
[I 2025-12-08 22:14:18,285] Trial 60 finished with value: 0.2641714705849107 and parameters: {'model_type': 'gcn', 'hidden_dims': '[512, 256]', 'dropout': 0.5860696699584887, 'batch_norm': True, 'lr': 2.1998518408470796e-05, 'weight_decay': 3.1258328027418463e-06, 'epochs': 47, 'loss': 'mae', 'optimizer': 'adam', 'graph_mode': 'cutoff', 'cutoff': 0.5152666112333923, 'grm_norm': 'cosine_then_gcn', 'self_loops': False, 'use_snp_selection': True, 'num_snps': 56297}. Best is trial 15 with value: 0.3135668235684893.
[I 2025-12-08 22:14:49,440] Trial 61 finished with value: 0.31105760613531935 and parameters: {'model_type': 'gcn', 'hidden_dims': '[512, 256]', 'dropout': 0.45199610579393745, 'batch_norm': True, 'lr': 8.636088825813959e-05, 'weight_decay': 1.9887088103932882e-07, 'epochs': 72, 'loss': 'mae', 'optimizer': 'adam', 'graph_mode': 'cutoff', 'cutoff': 0.7110749402136181, 'grm_norm': 'cosine_then_gcn', 'self_loops': False, 'use_snp_selection': True, 'num_snps': 48873}. Best is trial 15 with value: 0.3135668235684893.
[I 2025-12-08 22:15:15,455] Trial 62 finished with value: 0.30311119082356264 and parameters: {'model_type': 'gcn', 'hidden_dims': '[512, 256]', 'dropout': 0.412317155881965, 'batch_norm': True, 'lr': 7.872803521133487e-05, 'weight_decay': 2.2754213592116866e-07, 'epochs': 40, 'loss': 'mae', 'optimizer': 'adam', 'graph_mode': 'cutoff', 'cutoff': 0.5867821149937957, 'grm_norm': 'cosine_then_gcn', 'self_loops': False, 'use_snp_selection': True, 'num_snps': 49169}. Best is trial 15 with value: 0.3135668235684893.
[I 2025-12-08 22:15:48,300] Trial 63 finished with value: 0.3012196762083663 and parameters: {'model_type': 'gcn', 'hidden_dims': '[512, 256]', 'dropout': 0.5510540932003309, 'batch_norm': True, 'lr': 4.802270349050583e-05, 'weight_decay': 3.308088023684985e-07, 'epochs': 66, 'loss': 'mae', 'optimizer': 'adam', 'graph_mode': 'cutoff', 'cutoff': 0.710949930363166, 'grm_norm': 'cosine_then_gcn', 'self_loops': False, 'use_snp_selection': True, 'num_snps': 53905}. Best is trial 15 with value: 0.3135668235684893.
[I 2025-12-08 22:16:24,283] Trial 64 finished with value: 0.3004545076994038 and parameters: {'model_type': 'gcn', 'hidden_dims': '[512, 256]', 'dropout': 0.4401618895643974, 'batch_norm': True, 'lr': 0.00012521508275552148, 'weight_decay': 1.1095535712549306e-06, 'epochs': 76, 'loss': 'mae', 'optimizer': 'adam', 'graph_mode': 'cutoff', 'cutoff': 0.6642322982728693, 'grm_norm': 'cosine_then_gcn', 'self_loops': False, 'use_snp_selection': True, 'num_snps': 56938}. Best is trial 15 with value: 0.3135668235684893.
[I 2025-12-08 22:17:24,548] Trial 65 finished with value: 0.29935267401378596 and parameters: {'model_type': 'gcn', 'hidden_dims': '[512, 128]', 'dropout': 0.5273480938168398, 'batch_norm': True, 'lr': 9.157321421074761e-05, 'weight_decay': 1.1912679890532145e-07, 'epochs': 182, 'loss': 'mae', 'optimizer': 'adam', 'graph_mode': 'cutoff', 'cutoff': 0.7699488538997185, 'grm_norm': 'cosine_then_gcn', 'self_loops': False, 'use_snp_selection': True, 'num_snps': 59631}. Best is trial 15 with value: 0.3135668235684893.
[I 2025-12-08 22:17:58,851] Trial 66 finished with value: 0.25674372330712075 and parameters: {'model_type': 'gcn', 'hidden_dims': '[512, 256]', 'dropout': 0.4769155081072186, 'batch_norm': True, 'lr': 0.00018533279483344214, 'weight_decay': 5.907552067296401e-07, 'epochs': 107, 'loss': 'mae', 'optimizer': 'adam', 'graph_mode': 'cutoff', 'cutoff': 0.20258165163238306, 'grm_norm': 'cosine_then_gcn', 'self_loops': True, 'use_snp_selection': True, 'num_snps': 41203}. Best is trial 15 with value: 0.3135668235684893.
[I 2025-12-08 22:18:26,772] Trial 67 finished with value: 0.24974802688099298 and parameters: {'model_type': 'gcn', 'hidden_dims': '[256, 128, 64]', 'dropout': 0.4995151488206004, 'batch_norm': False, 'lr': 0.00046215314053535525, 'weight_decay': 4.901318162187866e-06, 'epochs': 84, 'loss': 'mse', 'optimizer': 'adam', 'graph_mode': 'knn', 'knn_k': 3, 'weighted_edges': False, 'symmetrize_mode': 'mutual', 'self_loops': False, 'use_snp_selection': True, 'num_snps': 52989}. Best is trial 15 with value: 0.3135668235684893.
[I 2025-12-08 22:19:20,592] Trial 68 finished with value: 0.22296012533240414 and parameters: {'model_type': 'gcn', 'hidden_dims': '[512, 128]', 'dropout': 0.41819615141640176, 'batch_norm': True, 'lr': 6.250511553315165e-05, 'weight_decay': 4.2460528129053836e-07, 'epochs': 199, 'loss': 'mae', 'optimizer': 'adam', 'graph_mode': 'cutoff', 'cutoff': 0.4534303079000723, 'grm_norm': 'cosine_then_gcn', 'self_loops': False, 'use_snp_selection': True, 'num_snps': 48271}. Best is trial 15 with value: 0.3135668235684893.
[I 2025-12-08 22:20:28,736] Trial 69 finished with value: 0.3113497377421309 and parameters: {'model_type': 'gcn', 'hidden_dims': '[512, 256]', 'dropout': 0.5587374275720518, 'batch_norm': True, 'lr': 0.0002579262071680047, 'weight_decay': 8.420487824836498e-07, 'epochs': 261, 'loss': 'mae', 'optimizer': 'adam', 'graph_mode': 'cutoff', 'cutoff': 0.7314193133470116, 'grm_norm': 'gcn', 'self_loops': False, 'use_snp_selection': False}. Best is trial 15 with value: 0.3135668235684893.
[I 2025-12-08 22:21:39,062] Trial 70 finished with value: 0.3016216222942952 and parameters: {'model_type': 'gcn', 'hidden_dims': '[512, 256]', 'dropout': 0.5795706303606472, 'batch_norm': True, 'lr': 0.00014591370843625683, 'weight_decay': 2.2274221961308546e-07, 'epochs': 270, 'loss': 'mae', 'optimizer': 'adam', 'graph_mode': 'cutoff', 'cutoff': 0.728478259670622, 'grm_norm': 'gcn', 'self_loops': False, 'use_snp_selection': False}. Best is trial 15 with value: 0.3135668235684893.
[I 2025-12-08 22:22:52,763] Trial 71 finished with value: 0.303784627381781 and parameters: {'model_type': 'gcn', 'hidden_dims': '[512, 256]', 'dropout': 0.5578808892744713, 'batch_norm': True, 'lr': 0.000246787452182533, 'weight_decay': 8.030494016265322e-07, 'epochs': 287, 'loss': 'mae', 'optimizer': 'adam', 'graph_mode': 'cutoff', 'cutoff': 0.6947764258837887, 'grm_norm': 'gcn', 'self_loops': False, 'use_snp_selection': False}. Best is trial 15 with value: 0.3135668235684893.
[I 2025-12-08 22:23:53,783] Trial 72 finished with value: 0.26940718589641516 and parameters: {'model_type': 'gcn', 'hidden_dims': '[512, 256]', 'dropout': 0.5345995390782703, 'batch_norm': True, 'lr': 1.0749491698496556e-05, 'weight_decay': 5.304480209232805e-07, 'epochs': 233, 'loss': 'mae', 'optimizer': 'adam', 'graph_mode': 'cutoff', 'cutoff': 0.6296504665385394, 'grm_norm': 'gcn', 'self_loops': False, 'use_snp_selection': False}. Best is trial 15 with value: 0.3135668235684893.
[I 2025-12-08 22:24:45,450] Trial 73 finished with value: 0.2340211946637309 and parameters: {'model_type': 'gcn', 'hidden_dims': '[512, 256]', 'dropout': 0.5165358875107782, 'batch_norm': True, 'lr': 3.0353516957016835e-05, 'weight_decay': 1.9261518996526647e-06, 'epochs': 190, 'loss': 'mae', 'optimizer': 'adam', 'graph_mode': 'cutoff', 'cutoff': 0.3370708659113847, 'grm_norm': 'cosine_then_gcn', 'self_loops': False, 'use_snp_selection': False}. Best is trial 15 with value: 0.3135668235684893.
[I 2025-12-08 22:25:14,012] Trial 74 finished with value: 0.2987321532464638 and parameters: {'model_type': 'gcn', 'hidden_dims': '[128, 64]', 'dropout': 0.5664640342673617, 'batch_norm': True, 'lr': 0.00033591758138868945, 'weight_decay': 2.990937039132704e-07, 'epochs': 326, 'loss': 'mae', 'optimizer': 'adam', 'graph_mode': 'cutoff', 'cutoff': 0.6686096101312853, 'grm_norm': 'gcn', 'self_loops': False, 'use_snp_selection': False}. Best is trial 15 with value: 0.3135668235684893.
[I 2025-12-08 22:25:37,523] Trial 75 finished with value: 0.3075918268761574 and parameters: {'model_type': 'gcn', 'hidden_dims': '[512, 256]', 'dropout': 0.5442071485209263, 'batch_norm': True, 'lr': 0.0007220065288258339, 'weight_decay': 3.8328307383998474e-07, 'epochs': 62, 'loss': 'mae', 'optimizer': 'adam', 'graph_mode': 'cutoff', 'cutoff': 0.7628887503585507, 'grm_norm': 'cosine_then_gcn', 'self_loops': True, 'use_snp_selection': False}. Best is trial 15 with value: 0.3135668235684893.
[I 2025-12-08 22:26:26,966] Trial 76 finished with value: 0.3154340227316396 and parameters: {'model_type': 'gcn', 'hidden_dims': '[512, 128]', 'dropout': 0.4993675341538775, 'batch_norm': True, 'lr': 9.84861968361745e-05, 'weight_decay': 6.791002875750555e-07, 'epochs': 169, 'loss': 'mae', 'optimizer': 'adam', 'graph_mode': 'cutoff', 'cutoff': 0.7335037460326634, 'grm_norm': 'cosine_then_gcn', 'self_loops': False, 'use_snp_selection': False}. Best is trial 76 with value: 0.3154340227316396.
[I 2025-12-08 22:27:14,939] Trial 77 finished with value: 0.29446007790972856 and parameters: {'model_type': 'gcn', 'hidden_dims': '[512, 128]', 'dropout': 0.500107484122882, 'batch_norm': True, 'lr': 0.00010043623527610219, 'weight_decay': 1.1727200484225034e-07, 'epochs': 162, 'loss': 'mae', 'optimizer': 'adam', 'graph_mode': 'cutoff', 'cutoff': 0.7291635219508588, 'grm_norm': 'cosine_then_gcn', 'self_loops': False, 'use_snp_selection': False}. Best is trial 76 with value: 0.3154340227316396.
[I 2025-12-08 22:28:28,045] Trial 78 finished with value: 0.2617873844589857 and parameters: {'model_type': 'gcn', 'hidden_dims': '[512, 128]', 'dropout': 0.5894894293184513, 'batch_norm': True, 'lr': 0.00016590894668144367, 'weight_decay': 1.966155792633415e-07, 'epochs': 257, 'loss': 'mse', 'optimizer': 'adam', 'graph_mode': 'knn', 'knn_k': 8, 'weighted_edges': True, 'symmetrize_mode': 'union', 'self_loops': False, 'use_snp_selection': False}. Best is trial 76 with value: 0.3154340227316396.
[I 2025-12-08 22:29:18,467] Trial 79 finished with value: 0.2948965201598603 and parameters: {'model_type': 'gcn', 'hidden_dims': '[512, 128]', 'dropout': 0.5206342692093253, 'batch_norm': False, 'lr': 6.163576070175905e-05, 'weight_decay': 1.332695184527288e-06, 'epochs': 172, 'loss': 'mae', 'optimizer': 'adam', 'graph_mode': 'cutoff', 'cutoff': 0.791362899680092, 'grm_norm': 'cosine_then_gcn', 'self_loops': False, 'use_snp_selection': False}. Best is trial 76 with value: 0.3154340227316396.
[I 2025-12-08 22:29:57,402] Trial 80 finished with value: 0.29879593292643297 and parameters: {'model_type': 'gcn', 'hidden_dims': '[512, 64]', 'dropout': 0.39659761798896326, 'batch_norm': True, 'lr': 0.00020889507610813952, 'weight_decay': 1.0290664107366757e-06, 'epochs': 126, 'loss': 'mae', 'optimizer': 'adam', 'graph_mode': 'cutoff', 'cutoff': 0.7034336600890152, 'grm_norm': 'gcn', 'self_loops': False, 'use_snp_selection': False}. Best is trial 76 with value: 0.3154340227316396.
[I 2025-12-08 22:30:58,256] Trial 81 finished with value: 0.30678929878320427 and parameters: {'model_type': 'gcn', 'hidden_dims': '[512, 128]', 'dropout': 0.45476608880911973, 'batch_norm': True, 'lr': 0.002675839145094842, 'weight_decay': 6.532923038801331e-07, 'epochs': 216, 'loss': 'mae', 'optimizer': 'adam', 'graph_mode': 'cutoff', 'cutoff': 0.677198903715034, 'grm_norm': 'cosine_then_gcn', 'self_loops': False, 'use_snp_selection': False}. Best is trial 76 with value: 0.3154340227316396.
[I 2025-12-08 22:31:43,723] Trial 82 finished with value: 0.29486109496144886 and parameters: {'model_type': 'gcn', 'hidden_dims': '[256, 128, 64]', 'dropout': 0.4690511274235192, 'batch_norm': True, 'lr': 0.0001341559428142025, 'weight_decay': 4.790926624692706e-07, 'epochs': 304, 'loss': 'mae', 'optimizer': 'adam', 'graph_mode': 'cutoff', 'cutoff': 0.7486479642475997, 'grm_norm': 'cosine_then_gcn', 'self_loops': False, 'use_snp_selection': False}. Best is trial 76 with value: 0.3154340227316396.
[I 2025-12-08 22:32:07,711] Trial 83 finished with value: 0.29687798216113037 and parameters: {'model_type': 'gcn', 'hidden_dims': '[512, 256]', 'dropout': 0.49570674009100374, 'batch_norm': True, 'lr': 0.00023461046378478296, 'weight_decay': 7.722137591229183e-07, 'epochs': 72, 'loss': 'mae', 'optimizer': 'adam', 'graph_mode': 'cutoff', 'cutoff': 0.6521102941300821, 'grm_norm': 'cosine_then_gcn', 'self_loops': False, 'use_snp_selection': True, 'num_snps': 30542}. Best is trial 76 with value: 0.3154340227316396.
[I 2025-12-08 22:32:24,647] Trial 84 finished with value: 0.30798107894634175 and parameters: {'model_type': 'gcn', 'hidden_dims': '[128, 64]', 'dropout': 0.4809072051212397, 'batch_norm': True, 'lr': 0.0012335853215919318, 'weight_decay': 3.21478632653834e-07, 'epochs': 148, 'loss': 'mae', 'optimizer': 'adam', 'graph_mode': 'cutoff', 'cutoff': 0.7695053765654238, 'grm_norm': 'cosine_then_gcn', 'self_loops': False, 'use_snp_selection': False}. Best is trial 76 with value: 0.3154340227316396.
[I 2025-12-08 22:33:23,715] Trial 85 finished with value: 0.2996179560197928 and parameters: {'model_type': 'gcn', 'hidden_dims': '[512, 128]', 'dropout': 0.5999856649744969, 'batch_norm': True, 'lr': 0.00040819208730929243, 'weight_decay': 2.538801145774007e-07, 'epochs': 178, 'loss': 'mae', 'optimizer': 'adam', 'graph_mode': 'cutoff', 'cutoff': 0.6041409571474592, 'grm_norm': 'cosine', 'self_loops': False, 'use_snp_selection': True, 'num_snps': 56297}. Best is trial 76 with value: 0.3154340227316396.
[I 2025-12-08 22:33:55,649] Trial 86 finished with value: 0.3045547997956162 and parameters: {'model_type': 'gcn', 'hidden_dims': '[512, 256]', 'dropout': 0.573430590273792, 'batch_norm': True, 'lr': 0.00010161500175024178, 'weight_decay': 1.8083183972190377e-07, 'epochs': 100, 'loss': 'mae', 'optimizer': 'adam', 'graph_mode': 'cutoff', 'cutoff': 0.7260638218430431, 'grm_norm': 'cosine_then_gcn', 'self_loops': True, 'use_snp_selection': False}. Best is trial 76 with value: 0.3154340227316396.
[I 2025-12-08 22:34:14,425] Trial 87 finished with value: 0.3072012966078729 and parameters: {'model_type': 'gcn', 'hidden_dims': '[512, 128]', 'dropout': 0.5338551271322689, 'batch_norm': True, 'lr': 0.0019497589438417476, 'weight_decay': 3.869013086702592e-07, 'epochs': 49, 'loss': 'mae', 'optimizer': 'adam', 'graph_mode': 'cutoff', 'cutoff': 0.689497632714884, 'grm_norm': 'cosine_then_gcn', 'self_loops': False, 'use_snp_selection': True, 'num_snps': 24256}. Best is trial 76 with value: 0.3154340227316396.
[I 2025-12-08 22:34:47,228] Trial 88 finished with value: 0.3161096373420557 and parameters: {'model_type': 'gcn', 'hidden_dims': '[512, 64]', 'dropout': 0.5553004680214794, 'batch_norm': True, 'lr': 0.0002892409258741937, 'weight_decay': 9.733814502589802e-05, 'epochs': 84, 'loss': 'mae', 'optimizer': 'adam', 'graph_mode': 'cutoff', 'cutoff': 0.71065124169937, 'grm_norm': 'cosine_then_gcn', 'self_loops': False, 'use_snp_selection': True, 'num_snps': 44317}. Best is trial 88 with value: 0.3161096373420557.
[I 2025-12-08 22:35:16,875] Trial 89 finished with value: 0.2344498287172982 and parameters: {'model_type': 'gcn', 'hidden_dims': '[512, 64]', 'dropout': 0.5568049741747008, 'batch_norm': True, 'lr': 0.00027237798849520813, 'weight_decay': 8.749369358860406e-05, 'epochs': 88, 'loss': 'mae', 'optimizer': 'adam', 'graph_mode': 'knn', 'knn_k': 5, 'weighted_edges': False, 'symmetrize_mode': 'mutual', 'self_loops': False, 'use_snp_selection': False}. Best is trial 88 with value: 0.3161096373420557.
[I 2025-12-08 22:36:09,032] Trial 90 finished with value: 0.3102201100207168 and parameters: {'model_type': 'gcn', 'hidden_dims': '[512, 64]', 'dropout': 0.5467805435395299, 'batch_norm': True, 'lr': 0.00018344865761283589, 'weight_decay': 0.00023980907518416495, 'epochs': 200, 'loss': 'mse', 'optimizer': 'adam', 'graph_mode': 'cutoff', 'cutoff': 0.7429719171036892, 'grm_norm': 'cosine_then_gcn', 'self_loops': False, 'use_snp_selection': True, 'num_snps': 44880}. Best is trial 88 with value: 0.3161096373420557.
[I 2025-12-08 22:36:37,953] Trial 91 finished with value: 0.3096490708997146 and parameters: {'model_type': 'gcn', 'hidden_dims': '[256, 128]', 'dropout': 0.5107940544734724, 'batch_norm': True, 'lr': 0.004396081782567674, 'weight_decay': 8.998228992637307e-07, 'epochs': 78, 'loss': 'mae', 'optimizer': 'adam', 'graph_mode': 'cutoff', 'cutoff': 0.7106456022790235, 'grm_norm': 'cosine_then_gcn', 'self_loops': False, 'use_snp_selection': True, 'num_snps': 52697}. Best is trial 88 with value: 0.3161096373420557.
[I 2025-12-08 22:37:17,945] Trial 92 finished with value: 0.2987830032192506 and parameters: {'model_type': 'gcn', 'hidden_dims': '[512, 64]', 'dropout': 0.4395398829669425, 'batch_norm': True, 'lr': 0.00034790987252497857, 'weight_decay': 1.2103113654677621e-05, 'epochs': 136, 'loss': 'mae', 'optimizer': 'adam', 'graph_mode': 'cutoff', 'cutoff': 0.7843241185063936, 'grm_norm': 'cosine_then_gcn', 'self_loops': False, 'use_snp_selection': True, 'num_snps': 41691}. Best is trial 88 with value: 0.3161096373420557.
[I 2025-12-08 22:37:42,680] Trial 93 finished with value: 0.3043033574449597 and parameters: {'model_type': 'gcn', 'hidden_dims': '[512, 64]', 'dropout': 0.5264602904994927, 'batch_norm': True, 'lr': 0.003172814777533405, 'weight_decay': 0.000328970045268802, 'epochs': 57, 'loss': 'mae', 'optimizer': 'adam', 'graph_mode': 'cutoff', 'cutoff': 0.6818617438385326, 'grm_norm': 'cosine_then_gcn', 'self_loops': False, 'use_snp_selection': True, 'num_snps': 36931}. Best is trial 88 with value: 0.3161096373420557.
[I 2025-12-08 22:38:21,292] Trial 94 finished with value: 0.304533126217308 and parameters: {'model_type': 'gcn', 'hidden_dims': '[512, 256]', 'dropout': 0.5664639383226582, 'batch_norm': True, 'lr': 7.754319764817377e-05, 'weight_decay': 2.784731289221599e-05, 'epochs': 93, 'loss': 'mae', 'optimizer': 'adam', 'graph_mode': 'cutoff', 'cutoff': 0.7272677706825019, 'grm_norm': 'cosine_then_gcn', 'self_loops': False, 'use_snp_selection': True, 'num_snps': 50902}. Best is trial 88 with value: 0.3161096373420557.
[I 2025-12-08 22:38:47,010] Trial 95 finished with value: 0.30500673140583234 and parameters: {'model_type': 'gcn', 'hidden_dims': '[256, 128]', 'dropout': 0.5813247365962129, 'batch_norm': True, 'lr': 0.00030753602571672814, 'weight_decay': 1.4570838603850841e-07, 'epochs': 70, 'loss': 'mae', 'optimizer': 'adam', 'graph_mode': 'cutoff', 'cutoff': 0.6356487698147026, 'grm_norm': 'cosine_then_gcn', 'self_loops': False, 'use_snp_selection': True, 'num_snps': 46240}. Best is trial 88 with value: 0.3161096373420557.
[I 2025-12-08 22:39:42,245] Trial 96 finished with value: 0.3035546885130132 and parameters: {'model_type': 'gcn', 'hidden_dims': '[512, 256]', 'dropout': 0.5574536441798612, 'batch_norm': True, 'lr': 0.00015485630879341042, 'weight_decay': 4.952528483238337e-07, 'epochs': 156, 'loss': 'mae', 'optimizer': 'adam', 'graph_mode': 'cutoff', 'cutoff': 0.6592071897745778, 'grm_norm': 'gcn', 'self_loops': False, 'use_snp_selection': True, 'num_snps': 57616}. Best is trial 88 with value: 0.3161096373420557.
[I 2025-12-08 22:39:56,401] Trial 97 finished with value: 0.18349966045034305 and parameters: {'model_type': 'gcn', 'hidden_dims': '[256, 128, 64]', 'dropout': 0.5394879909043485, 'batch_norm': False, 'lr': 0.002470716255171663, 'weight_decay': 2.7323981839967337e-05, 'epochs': 107, 'loss': 'mae', 'optimizer': 'adam', 'graph_mode': 'cutoff', 'cutoff': 0.7576572881817136, 'grm_norm': 'cosine_then_gcn', 'self_loops': False, 'use_snp_selection': True, 'num_snps': 10717}. Best is trial 88 with value: 0.3161096373420557.
[I 2025-12-08 22:40:24,464] Trial 98 finished with value: 0.30711290068337205 and parameters: {'model_type': 'gcn', 'hidden_dims': '[256, 128]', 'dropout': 0.489197680858683, 'batch_norm': True, 'lr': 0.0006148911569860765, 'weight_decay': 5.7909602975627474e-05, 'epochs': 188, 'loss': 'mae', 'optimizer': 'adam', 'graph_mode': 'cutoff', 'cutoff': 0.6988018946797393, 'grm_norm': 'cosine', 'self_loops': False, 'use_snp_selection': False}. Best is trial 88 with value: 0.3161096373420557.
[I 2025-12-08 22:41:17,909] Trial 99 finished with value: 0.29308437883997124 and parameters: {'model_type': 'gcn', 'hidden_dims': '[512, 64]', 'dropout': 0.458570602190032, 'batch_norm': True, 'lr': 0.00011133905563149029, 'weight_decay': 0.0008056973305087722, 'epochs': 167, 'loss': 'mae', 'optimizer': 'adam', 'graph_mode': 'cutoff', 'cutoff': 0.5839629674571862, 'grm_norm': 'cosine_then_gcn', 'self_loops': False, 'use_snp_selection': True, 'num_snps': 53779}. Best is trial 88 with value: 0.3161096373420557.
