[I 2025-12-08 15:25:01,864] Trial 26 finished with value: 0.22066083388147914 and parameters: {'model_type': 'gcn', 'hidden_dims': '[512, 128]', 'dropout': 0.5396287082649128, 'batch_norm': False, 'lr': 3.819028166922864e-05, 'weight_decay': 0.0009422211166401505, 'epochs': 65, 'loss': 'mse', 'optimizer': 'adam', 'graph_mode': 'knn', 'knn_k': 6, 'weighted_edges': False, 'symmetrize_mode': 'union', 'self_loops': False, 'use_snp_selection': False}. Best is trial 23 with value: 0.2997949033109354.
[I 2025-12-08 15:25:09,494] Trial 27 finished with value: 0.2970522794592846 and parameters: {'model_type': 'gcn', 'hidden_dims': '[128, 64]', 'dropout': 0.466653711712877, 'batch_norm': True, 'lr': 0.0006791980651204152, 'weight_decay': 1.7748586863155897e-05, 'epochs': 87, 'loss': 'mae', 'optimizer': 'adam', 'graph_mode': 'cutoff', 'cutoff': 0.8038725225695935, 'grm_norm': 'gcn', 'self_loops': False, 'use_snp_selection': False}. Best is trial 23 with value: 0.2997949033109354.
[I 2025-12-08 15:25:21,515] Trial 28 finished with value: 0.28927195119322 and parameters: {'model_type': 'gcn', 'hidden_dims': '[128, 64]', 'dropout': 0.5935725731648722, 'batch_norm': True, 'lr': 0.0007191379679856878, 'weight_decay': 1.838210454418802e-05, 'epochs': 152, 'loss': 'mae', 'optimizer': 'adam', 'graph_mode': 'cutoff', 'cutoff': 0.6550617496333359, 'grm_norm': 'gcn', 'self_loops': True, 'use_snp_selection': False}. Best is trial 23 with value: 0.2997949033109354.
[I 2025-12-08 15:25:31,398] Trial 29 finished with value: 0.2240195561682264 and parameters: {'model_type': 'gcn', 'hidden_dims': '[128, 64]', 'dropout': 0.3585209991726384, 'batch_norm': True, 'lr': 0.002245027066087349, 'weight_decay': 2.0050296441122717e-05, 'epochs': 113, 'loss': 'mae', 'optimizer': 'adam', 'graph_mode': 'knn', 'knn_k': 10, 'weighted_edges': False, 'symmetrize_mode': 'mutual', 'self_loops': True, 'use_snp_selection': False}. Best is trial 23 with value: 0.2997949033109354.
[I 2025-12-08 15:25:39,051] Trial 30 finished with value: 0.2556100721313414 and parameters: {'model_type': 'gcn', 'hidden_dims': '[128, 64]', 'dropout': 0.4524700293782935, 'batch_norm': True, 'lr': 0.0004924838300529216, 'weight_decay': 8.395811791992205e-05, 'epochs': 87, 'loss': 'mae', 'optimizer': 'adam', 'graph_mode': 'cutoff', 'cutoff': 0.5105929905786715, 'grm_norm': 'gcn', 'self_loops': False, 'use_snp_selection': False}. Best is trial 23 with value: 0.2997949033109354.
[I 2025-12-08 15:25:44,384] Trial 31 finished with value: 0.27981029276142083 and parameters: {'model_type': 'gcn', 'hidden_dims': '[128, 64]', 'dropout': 0.511302888589551, 'batch_norm': True, 'lr': 0.00017451578884709488, 'weight_decay': 0.00022851704534649307, 'epochs': 53, 'loss': 'mae', 'optimizer': 'adam', 'graph_mode': 'cutoff', 'cutoff': 0.8094316886149814, 'grm_norm': 'gcn', 'self_loops': False, 'use_snp_selection': False}. Best is trial 23 with value: 0.2997949033109354.
[I 2025-12-08 15:25:56,419] Trial 32 finished with value: 0.2771005313975138 and parameters: {'model_type': 'gcn', 'hidden_dims': '[256, 128, 64]', 'dropout': 0.4753278915775163, 'batch_norm': True, 'lr': 0.00013127827062884667, 'weight_decay': 0.0008072906457341063, 'epochs': 81, 'loss': 'mae', 'optimizer': 'adam', 'graph_mode': 'cutoff', 'cutoff': 0.8078239305638442, 'grm_norm': 'cosine_then_gcn', 'self_loops': False, 'use_snp_selection': False}. Best is trial 23 with value: 0.2997949033109354.
[I 2025-12-08 15:26:26,960] Trial 33 finished with value: 0.28730755963496435 and parameters: {'model_type': 'gcn', 'hidden_dims': '[512, 64]', 'dropout': 0.5538641716211303, 'batch_norm': True, 'lr': 0.0007608598805847043, 'weight_decay': 0.00044885425438544765, 'epochs': 115, 'loss': 'mae', 'optimizer': 'adam', 'graph_mode': 'cutoff', 'cutoff': 0.8369818461220394, 'grm_norm': 'gcn', 'self_loops': False, 'use_snp_selection': False}. Best is trial 23 with value: 0.2997949033109354.
[I 2025-12-08 15:27:23,928] Trial 34 finished with value: 0.29606648397343616 and parameters: {'model_type': 'gcn', 'hidden_dims': '[512, 128]', 'dropout': 0.4042337098694172, 'batch_norm': True, 'lr': 4.691547237845659e-05, 'weight_decay': 2.3372362059018843e-05, 'epochs': 224, 'loss': 'mae', 'optimizer': 'adam', 'graph_mode': 'cutoff', 'cutoff': 0.6962084807876935, 'grm_norm': 'cosine_then_gcn', 'self_loops': False, 'use_snp_selection': False}. Best is trial 23 with value: 0.2997949033109354.
[I 2025-12-08 15:27:41,511] Trial 35 finished with value: 0.18840559471758947 and parameters: {'model_type': 'gcn', 'hidden_dims': '[128, 64]', 'dropout': 0.3917827915203265, 'batch_norm': True, 'lr': 4.184412915750246e-05, 'weight_decay': 1.5971232076284632e-05, 'epochs': 231, 'loss': 'mse', 'optimizer': 'adam', 'graph_mode': 'knn', 'knn_k': 1, 'weighted_edges': True, 'symmetrize_mode': 'union', 'self_loops': False, 'use_snp_selection': False}. Best is trial 23 with value: 0.2997949033109354.
[I 2025-12-08 15:28:21,222] Trial 36 finished with value: 0.2794576746057934 and parameters: {'model_type': 'gcn', 'hidden_dims': '[256, 128, 64]', 'dropout': 0.33954982212202245, 'batch_norm': True, 'lr': 5.1117397617113184e-05, 'weight_decay': 3.2996780570796125e-06, 'epochs': 195, 'loss': 'mae', 'optimizer': 'adam', 'graph_mode': 'cutoff', 'cutoff': 0.6881299058163558, 'grm_norm': 'cosine_then_gcn', 'self_loops': True, 'use_snp_selection': True, 'num_snps': 55695}. Best is trial 23 with value: 0.2997949033109354.
[I 2025-12-08 15:28:37,010] Trial 37 finished with value: 0.2880550238229 and parameters: {'model_type': 'gcn', 'hidden_dims': '[128, 64]', 'dropout': 0.4062126021764231, 'batch_norm': True, 'lr': 0.00033639054530654655, 'weight_decay': 6.685198548246614e-05, 'epochs': 208, 'loss': 'mae', 'optimizer': 'adam', 'graph_mode': 'cutoff', 'cutoff': 0.8524146502249037, 'grm_norm': 'gcn', 'self_loops': False, 'use_snp_selection': False}. Best is trial 23 with value: 0.2997949033109354.
[I 2025-12-08 15:29:26,006] Trial 38 finished with value: 0.2916033517647344 and parameters: {'model_type': 'gcn', 'hidden_dims': '[512, 64]', 'dropout': 0.43874300993567195, 'batch_norm': True, 'lr': 0.00011405273434307867, 'weight_decay': 2.8484501184018403e-05, 'epochs': 191, 'loss': 'mse', 'optimizer': 'adam', 'graph_mode': 'cutoff', 'cutoff': 0.7164317021096263, 'grm_norm': 'gcn', 'self_loops': False, 'use_snp_selection': False}. Best is trial 23 with value: 0.2997949033109354.
[I 2025-12-08 15:30:23,411] Trial 39 finished with value: 0.201982627354694 and parameters: {'model_type': 'gcn', 'hidden_dims': '[512, 128]', 'dropout': 0.2953631346188236, 'batch_norm': True, 'lr': 0.0004783756625529569, 'weight_decay': 1.3072108049665418e-05, 'epochs': 297, 'loss': 'mae', 'optimizer': 'adam', 'graph_mode': 'knn', 'knn_k': 7, 'weighted_edges': True, 'symmetrize_mode': 'mutual', 'self_loops': True, 'use_snp_selection': True, 'num_snps': 37740}. Best is trial 23 with value: 0.2997949033109354.
[I 2025-12-08 15:30:45,621] Trial 40 finished with value: 0.27817209046806174 and parameters: {'model_type': 'gcn', 'hidden_dims': '[128, 64]', 'dropout': 0.24343843574998902, 'batch_norm': False, 'lr': 1.2291866154506941e-05, 'weight_decay': 5.588481406800529e-06, 'epochs': 305, 'loss': 'mse', 'optimizer': 'adam', 'graph_mode': 'cutoff', 'cutoff': 0.6581793009580902, 'grm_norm': 'cosine_then_gcn', 'self_loops': False, 'use_snp_selection': False}. Best is trial 23 with value: 0.2997949033109354.
[I 2025-12-08 15:31:50,298] Trial 41 finished with value: 0.27681310115669444 and parameters: {'model_type': 'gcn', 'hidden_dims': '[512, 128]', 'dropout': 0.4578083371982384, 'batch_norm': True, 'lr': 2.6871554419893876e-05, 'weight_decay': 0.00012396197911146073, 'epochs': 256, 'loss': 'mae', 'optimizer': 'adam', 'graph_mode': 'cutoff', 'cutoff': 0.7863618856413153, 'grm_norm': 'cosine_then_gcn', 'self_loops': False, 'use_snp_selection': False}. Best is trial 23 with value: 0.2997949033109354.
[I 2025-12-08 15:32:06,839] Trial 42 finished with value: 0.2728445151293033 and parameters: {'model_type': 'gcn', 'hidden_dims': '[512, 128]', 'dropout': 0.5053482845416891, 'batch_norm': True, 'lr': 6.195391679248823e-05, 'weight_decay': 0.00019559352771666202, 'epochs': 56, 'loss': 'mae', 'optimizer': 'adam', 'graph_mode': 'cutoff', 'cutoff': 0.792965984288186, 'grm_norm': 'cosine_then_gcn', 'self_loops': False, 'use_snp_selection': False}. Best is trial 23 with value: 0.2997949033109354.
[I 2025-12-08 15:33:04,578] Trial 43 finished with value: 0.2828810223439673 and parameters: {'model_type': 'gcn', 'hidden_dims': '[512, 128]', 'dropout': 0.5425553566742334, 'batch_norm': True, 'lr': 0.000917355735498865, 'weight_decay': 0.000430509106770964, 'epochs': 228, 'loss': 'mae', 'optimizer': 'adam', 'graph_mode': 'cutoff', 'cutoff': 0.8563560661833624, 'grm_norm': 'none', 'self_loops': False, 'use_snp_selection': False}. Best is trial 23 with value: 0.2997949033109354.
[I 2025-12-08 15:33:43,287] Trial 44 finished with value: 0.2923332262328298 and parameters: {'model_type': 'gcn', 'hidden_dims': '[512, 128]', 'dropout': 0.41349321557110513, 'batch_norm': True, 'lr': 0.00023242747122561048, 'weight_decay': 5.34197259736239e-05, 'epochs': 148, 'loss': 'mae', 'optimizer': 'adam', 'graph_mode': 'cutoff', 'cutoff': 0.8157375266877175, 'grm_norm': 'cosine_then_gcn', 'self_loops': False, 'use_snp_selection': False}. Best is trial 23 with value: 0.2997949033109354.
[I 2025-12-08 15:34:04,397] Trial 45 finished with value: 0.2844561088052681 and parameters: {'model_type': 'gcn', 'hidden_dims': '[512, 256]', 'dropout': 0.46782891411289623, 'batch_norm': True, 'lr': 0.0005922320514287632, 'weight_decay': 3.0162280630652854e-05, 'epochs': 109, 'loss': 'mae', 'optimizer': 'adam', 'graph_mode': 'cutoff', 'cutoff': 0.7735833520664117, 'grm_norm': 'cosine', 'self_loops': False, 'use_snp_selection': True, 'num_snps': 21630}. Best is trial 23 with value: 0.2997949033109354.
[I 2025-12-08 15:34:29,165] Trial 46 finished with value: 0.27534884991511854 and parameters: {'model_type': 'gcn', 'hidden_dims': '[512, 128]', 'dropout': 0.15627737439101627, 'batch_norm': True, 'lr': 0.0015723839165004097, 'weight_decay': 0.00030285543163340994, 'epochs': 90, 'loss': 'mae', 'optimizer': 'adam', 'graph_mode': 'cutoff', 'cutoff': 0.5935340987220982, 'grm_norm': 'cosine_then_gcn', 'self_loops': False, 'use_snp_selection': False}. Best is trial 23 with value: 0.2997949033109354.
[I 2025-12-08 15:34:49,796] Trial 47 finished with value: 0.28952929867046007 and parameters: {'model_type': 'gcn', 'hidden_dims': '[512, 64]', 'dropout': 0.36414819239641, 'batch_norm': True, 'lr': 0.0003703535091599115, 'weight_decay': 5.133559690847041e-06, 'epochs': 73, 'loss': 'mae', 'optimizer': 'adam', 'graph_mode': 'cutoff', 'cutoff': 0.847022446495851, 'grm_norm': 'cosine', 'self_loops': True, 'use_snp_selection': False}. Best is trial 23 with value: 0.2997949033109354.
[I 2025-12-08 15:35:06,564] Trial 48 finished with value: 0.13280167622085504 and parameters: {'model_type': 'gcn', 'hidden_dims': '[128, 64]', 'dropout': 0.49722717135774913, 'batch_norm': False, 'lr': 8.499985383088924e-05, 'weight_decay': 1.0901153993215468e-05, 'epochs': 40, 'loss': 'mae', 'optimizer': 'adam', 'graph_mode': 'cutoff', 'cutoff': 0.7065883016803055, 'grm_norm': 'none', 'self_loops': False, 'use_snp_selection': True, 'num_snps': 44439}. Best is trial 23 with value: 0.2997949033109354.
[I 2025-12-08 15:35:29,191] Trial 49 finished with value: 0.29277723765774705 and parameters: {'model_type': 'gcn', 'hidden_dims': '[512, 128]', 'dropout': 0.31946095607612834, 'batch_norm': True, 'lr': 0.00025772827215520455, 'weight_decay': 1.6817188542968773e-06, 'epochs': 82, 'loss': 'mse', 'optimizer': 'adam', 'graph_mode': 'cutoff', 'cutoff': 0.8849506250659588, 'grm_norm': 'gcn', 'self_loops': False, 'use_snp_selection': False}. Best is trial 23 with value: 0.2997949033109354.
[I 2025-12-08 15:35:55,933] Trial 50 finished with value: 0.23965067005986024 and parameters: {'model_type': 'gcn', 'hidden_dims': '[512, 256]', 'dropout': 0.5761818249808952, 'batch_norm': True, 'lr': 1.6009221661124116e-05, 'weight_decay': 0.000585444051797467, 'epochs': 96, 'loss': 'mae', 'optimizer': 'adam', 'graph_mode': 'knn', 'knn_k': 3, 'weighted_edges': False, 'symmetrize_mode': 'union', 'self_loops': True, 'use_snp_selection': False}. Best is trial 23 with value: 0.2997949033109354.
[I 2025-12-08 15:36:12,964] Trial 51 finished with value: 0.29355637461820233 and parameters: {'model_type': 'gcn', 'hidden_dims': '[512, 128]', 'dropout': 0.4764615552462861, 'batch_norm': True, 'lr': 0.0005254476003540831, 'weight_decay': 0.00016573881317869467, 'epochs': 58, 'loss': 'mae', 'optimizer': 'adam', 'graph_mode': 'cutoff', 'cutoff': 0.8344705086053074, 'grm_norm': 'cosine_then_gcn', 'self_loops': False, 'use_snp_selection': False}. Best is trial 23 with value: 0.2997949033109354.
[I 2025-12-08 15:36:30,486] Trial 52 finished with value: 0.2901352738782551 and parameters: {'model_type': 'gcn', 'hidden_dims': '[512, 128]', 'dropout': 0.4779719023604727, 'batch_norm': True, 'lr': 0.0006330943082325844, 'weight_decay': 0.00018457246456963098, 'epochs': 60, 'loss': 'mae', 'optimizer': 'adam', 'graph_mode': 'cutoff', 'cutoff': 0.8305506375991711, 'grm_norm': 'cosine_then_gcn', 'self_loops': False, 'use_snp_selection': False}. Best is trial 23 with value: 0.2997949033109354.
[I 2025-12-08 15:36:51,612] Trial 53 finished with value: 0.2967308353342486 and parameters: {'model_type': 'gcn', 'hidden_dims': '[512, 128]', 'dropout': 0.45425958233934705, 'batch_norm': True, 'lr': 0.0010603115961785648, 'weight_decay': 7.057394465952961e-05, 'epochs': 75, 'loss': 'mae', 'optimizer': 'adam', 'graph_mode': 'cutoff', 'cutoff': 0.7616935625663225, 'grm_norm': 'cosine_then_gcn', 'self_loops': False, 'use_snp_selection': False}. Best is trial 23 with value: 0.2997949033109354.
[I 2025-12-08 15:37:13,226] Trial 54 finished with value: 0.2953396627677527 and parameters: {'model_type': 'gcn', 'hidden_dims': '[512, 128]', 'dropout': 0.44590553168065944, 'batch_norm': True, 'lr': 0.0009819950763632849, 'weight_decay': 7.180256143752395e-05, 'epochs': 77, 'loss': 'mae', 'optimizer': 'adam', 'graph_mode': 'cutoff', 'cutoff': 0.750389561985212, 'grm_norm': 'cosine_then_gcn', 'self_loops': False, 'use_snp_selection': False}. Best is trial 23 with value: 0.2997949033109354.
[I 2025-12-08 15:37:29,597] Trial 55 finished with value: 0.293095708585187 and parameters: {'model_type': 'gcn', 'hidden_dims': '[256, 128]', 'dropout': 0.43803652168331536, 'batch_norm': True, 'lr': 0.0010474842986761242, 'weight_decay': 6.517318690476537e-05, 'epochs': 122, 'loss': 'mae', 'optimizer': 'adam', 'graph_mode': 'cutoff', 'cutoff': 0.6424273201103903, 'grm_norm': 'cosine_then_gcn', 'self_loops': False, 'use_snp_selection': False}. Best is trial 23 with value: 0.2997949033109354.
[I 2025-12-08 15:37:44,660] Trial 56 finished with value: 0.07573917020928259 and parameters: {'model_type': 'gcn', 'hidden_dims': '[512, 128]', 'dropout': 0.40396704606738737, 'batch_norm': False, 'lr': 0.001409459738497347, 'weight_decay': 2.6854941644388312e-05, 'epochs': 50, 'loss': 'mae', 'optimizer': 'adam', 'graph_mode': 'cutoff', 'cutoff': 0.7379634154531425, 'grm_norm': 'cosine', 'self_loops': False, 'use_snp_selection': False}. Best is trial 23 with value: 0.2997949033109354.
[I 2025-12-08 15:37:58,715] Trial 57 finished with value: 0.29032535087609285 and parameters: {'model_type': 'gcn', 'hidden_dims': '[256, 128, 64]', 'dropout': 0.4208351854742192, 'batch_norm': True, 'lr': 0.0034029705771785788, 'weight_decay': 3.8515095170334944e-05, 'epochs': 98, 'loss': 'mae', 'optimizer': 'adam', 'graph_mode': 'cutoff', 'cutoff': 0.7541493435517557, 'grm_norm': 'cosine_then_gcn', 'self_loops': True, 'use_snp_selection': False}. Best is trial 23 with value: 0.2997949033109354.
[I 2025-12-08 15:38:10,222] Trial 58 finished with value: 0.28122896708926415 and parameters: {'model_type': 'gcn', 'hidden_dims': '[128, 64]', 'dropout': 0.5314826970162899, 'batch_norm': True, 'lr': 0.0017897866057123726, 'weight_decay': 0.00010298103131779236, 'epochs': 142, 'loss': 'mae', 'optimizer': 'adam', 'graph_mode': 'cutoff', 'cutoff': 0.5652403960848916, 'grm_norm': 'cosine_then_gcn', 'self_loops': False, 'use_snp_selection': False}. Best is trial 23 with value: 0.2997949033109354.
[I 2025-12-08 15:38:38,532] Trial 59 finished with value: 0.2293084345151862 and parameters: {'model_type': 'gcn', 'hidden_dims': '[512, 128]', 'dropout': 0.45011038094342143, 'batch_norm': True, 'lr': 0.000887650671180601, 'weight_decay': 4.718652697352321e-05, 'epochs': 228, 'loss': 'mae', 'optimizer': 'adam', 'graph_mode': 'cutoff', 'cutoff': 0.36622772469969717, 'grm_norm': 'cosine_then_gcn', 'self_loops': False, 'use_snp_selection': True, 'num_snps': 17832}. Best is trial 23 with value: 0.2997949033109354.
[I 2025-12-08 15:39:00,619] Trial 60 finished with value: 0.28875012152822643 and parameters: {'model_type': 'gcn', 'hidden_dims': '[512, 128]', 'dropout': 0.45466390022044084, 'batch_norm': True, 'lr': 0.00038480964779621517, 'weight_decay': 2.2233580481802246e-05, 'epochs': 79, 'loss': 'mae', 'optimizer': 'adam', 'graph_mode': 'cutoff', 'cutoff': 0.6898357807379657, 'grm_norm': 'cosine_then_gcn', 'self_loops': True, 'use_snp_selection': False}. Best is trial 23 with value: 0.2997949033109354.
[I 2025-12-08 15:39:21,023] Trial 61 finished with value: 0.2921451814477012 and parameters: {'model_type': 'gcn', 'hidden_dims': '[512, 128]', 'dropout': 0.48628029488480395, 'batch_norm': True, 'lr': 0.0011125388073000102, 'weight_decay': 0.00028026331668788446, 'epochs': 72, 'loss': 'mae', 'optimizer': 'adam', 'graph_mode': 'cutoff', 'cutoff': 0.7752963988433483, 'grm_norm': 'cosine_then_gcn', 'self_loops': False, 'use_snp_selection': False}. Best is trial 23 with value: 0.2997949033109354.
[I 2025-12-08 15:39:45,266] Trial 62 finished with value: 0.2901032435303149 and parameters: {'model_type': 'gcn', 'hidden_dims': '[512, 128]', 'dropout': 0.3776050755603837, 'batch_norm': True, 'lr': 0.0007759476937708935, 'weight_decay': 7.943311951755877e-05, 'epochs': 88, 'loss': 'mae', 'optimizer': 'adam', 'graph_mode': 'cutoff', 'cutoff': 0.8729599544021485, 'grm_norm': 'cosine_then_gcn', 'self_loops': False, 'use_snp_selection': False}. Best is trial 23 with value: 0.2997949033109354.
[I 2025-12-08 15:40:13,110] Trial 63 finished with value: 0.2847089577331287 and parameters: {'model_type': 'gcn', 'hidden_dims': '[512, 128]', 'dropout': 0.4349322528453516, 'batch_norm': True, 'lr': 0.0033117443926609013, 'weight_decay': 0.00012787201853164026, 'epochs': 103, 'loss': 'mae', 'optimizer': 'adam', 'graph_mode': 'cutoff', 'cutoff': 0.7968336894620845, 'grm_norm': 'cosine_then_gcn', 'self_loops': False, 'use_snp_selection': False}. Best is trial 23 with value: 0.2997949033109354.
[I 2025-12-08 15:40:22,993] Trial 64 finished with value: 0.2772913365444993 and parameters: {'model_type': 'gcn', 'hidden_dims': '[128, 64]', 'dropout': 0.4637757193087522, 'batch_norm': True, 'lr': 0.00029653528582411476, 'weight_decay': 4.376149720015329e-05, 'epochs': 118, 'loss': 'mae', 'optimizer': 'adam', 'graph_mode': 'cutoff', 'cutoff': 0.7364652552794768, 'grm_norm': 'cosine_then_gcn', 'self_loops': False, 'use_snp_selection': False}. Best is trial 23 with value: 0.2997949033109354.
[I 2025-12-08 15:40:43,451] Trial 65 finished with value: 0.24369007670054826 and parameters: {'model_type': 'gcn', 'hidden_dims': '[512, 128]', 'dropout': 0.49821753065207847, 'batch_norm': True, 'lr': 0.0006584980509776311, 'weight_decay': 7.797487065844832e-06, 'epochs': 70, 'loss': 'mae', 'optimizer': 'adam', 'graph_mode': 'cutoff', 'cutoff': 0.2108046070993395, 'grm_norm': 'none', 'self_loops': False, 'use_snp_selection': False}. Best is trial 23 with value: 0.2997949033109354.
[I 2025-12-08 15:40:51,409] Trial 66 finished with value: 0.0006888776226538051 and parameters: {'model_type': 'gcn', 'hidden_dims': '[256, 128]', 'dropout': 0.530729098444168, 'batch_norm': False, 'lr': 0.001802601092221149, 'weight_decay': 1.4377511412635428e-05, 'epochs': 46, 'loss': 'mae', 'optimizer': 'adam', 'graph_mode': 'knn', 'knn_k': 8, 'weighted_edges': True, 'symmetrize_mode': 'union', 'self_loops': False, 'use_snp_selection': False}. Best is trial 23 with value: 0.2997949033109354.
[I 2025-12-08 15:41:38,547] Trial 67 finished with value: 0.2904875309484716 and parameters: {'model_type': 'gcn', 'hidden_dims': '[512, 256]', 'dropout': 0.5183628981772791, 'batch_norm': True, 'lr': 0.00043761367750849364, 'weight_decay': 8.889934206040222e-05, 'epochs': 182, 'loss': 'mse', 'optimizer': 'adam', 'graph_mode': 'cutoff', 'cutoff': 0.7605828835036627, 'grm_norm': 'cosine_then_gcn', 'self_loops': False, 'use_snp_selection': False}. Best is trial 23 with value: 0.2997949033109354.
[I 2025-12-08 15:41:55,124] Trial 68 finished with value: 0.28573245293559485 and parameters: {'model_type': 'gcn', 'hidden_dims': '[128, 64]', 'dropout': 0.39739832078453147, 'batch_norm': True, 'lr': 0.002643149642310835, 'weight_decay': 6.510322035858444e-07, 'epochs': 220, 'loss': 'mae', 'optimizer': 'adam', 'graph_mode': 'cutoff', 'cutoff': 0.8125557373423072, 'grm_norm': 'gcn', 'self_loops': True, 'use_snp_selection': False}. Best is trial 23 with value: 0.2997949033109354.
[I 2025-12-08 15:42:29,276] Trial 69 finished with value: 0.2772006560011315 and parameters: {'model_type': 'gcn', 'hidden_dims': '[512, 128]', 'dropout': 0.4225848136739197, 'batch_norm': True, 'lr': 0.005213883460900296, 'weight_decay': 0.00024951946166460815, 'epochs': 129, 'loss': 'mae', 'optimizer': 'adam', 'graph_mode': 'cutoff', 'cutoff': 0.8687125839778275, 'grm_norm': 'cosine_then_gcn', 'self_loops': False, 'use_snp_selection': False}. Best is trial 23 with value: 0.2997949033109354.
