[I 2025-12-08 16:36:32,401] Trial 51 finished with value: 0.27079936309536784 and parameters: {'model_type': 'gcn', 'hidden_dims': '[512, 256]', 'dropout': 0.10552280578493133, 'batch_norm': False, 'lr': 2.5433961980718088e-05, 'weight_decay': 0.0004507372420504196, 'epochs': 181, 'loss': 'mse', 'optimizer': 'adam', 'graph_mode': 'cutoff', 'cutoff': 0.6536394909089783, 'grm_norm': 'cosine_then_gcn', 'self_loops': False, 'use_snp_selection': True, 'num_snps': 52755}. Best is trial 49 with value: 0.29193782419144687.
[I 2025-12-08 16:37:25,997] Trial 52 finished with value: 0.28886210701562975 and parameters: {'model_type': 'gcn', 'hidden_dims': '[512, 256]', 'dropout': 0.3866619488997892, 'batch_norm': False, 'lr': 3.077859176090148e-05, 'weight_decay': 0.00016404077582389683, 'epochs': 173, 'loss': 'mse', 'optimizer': 'adam', 'graph_mode': 'cutoff', 'cutoff': 0.6516299434385656, 'grm_norm': 'cosine_then_gcn', 'self_loops': False, 'use_snp_selection': True, 'num_snps': 56911}. Best is trial 49 with value: 0.29193782419144687.
[I 2025-12-08 16:38:20,290] Trial 53 finished with value: 0.28867299800974716 and parameters: {'model_type': 'gcn', 'hidden_dims': '[512, 256]', 'dropout': 0.37073983681467687, 'batch_norm': False, 'lr': 3.30238449223504e-05, 'weight_decay': 0.00015084386532519665, 'epochs': 165, 'loss': 'mse', 'optimizer': 'adam', 'graph_mode': 'cutoff', 'cutoff': 0.5503507517747258, 'grm_norm': 'cosine_then_gcn', 'self_loops': False, 'use_snp_selection': True, 'num_snps': 59623}. Best is trial 49 with value: 0.29193782419144687.
[I 2025-12-08 16:39:16,539] Trial 54 finished with value: 0.28281679953391237 and parameters: {'model_type': 'gcn', 'hidden_dims': '[512, 256]', 'dropout': 0.3837036750863057, 'batch_norm': False, 'lr': 3.010571771673065e-05, 'weight_decay': 0.00014460223080732488, 'epochs': 174, 'loss': 'mse', 'optimizer': 'adam', 'graph_mode': 'cutoff', 'cutoff': 0.5407392306579023, 'grm_norm': 'cosine_then_gcn', 'self_loops': False, 'use_snp_selection': True, 'num_snps': 59724}. Best is trial 49 with value: 0.29193782419144687.
[I 2025-12-08 16:40:06,007] Trial 55 finished with value: 0.2830063984337837 and parameters: {'model_type': 'gcn', 'hidden_dims': '[512, 256]', 'dropout': 0.37044787251001904, 'batch_norm': False, 'lr': 1.306363675057941e-05, 'weight_decay': 0.00034379507773675983, 'epochs': 155, 'loss': 'mse', 'optimizer': 'adam', 'graph_mode': 'cutoff', 'cutoff': 0.572914093547596, 'grm_norm': 'cosine_then_gcn', 'self_loops': False, 'use_snp_selection': True, 'num_snps': 56005}. Best is trial 49 with value: 0.29193782419144687.
[I 2025-12-08 16:40:47,591] Trial 56 finished with value: 0.2805278645469094 and parameters: {'model_type': 'gcn', 'hidden_dims': '[512, 256]', 'dropout': 0.33765157770076243, 'batch_norm': False, 'lr': 1.8844847599533818e-05, 'weight_decay': 0.0005659946962270213, 'epochs': 137, 'loss': 'mse', 'optimizer': 'adam', 'graph_mode': 'cutoff', 'cutoff': 0.6430629770303928, 'grm_norm': 'cosine_then_gcn', 'self_loops': False, 'use_snp_selection': True, 'num_snps': 49888}. Best is trial 49 with value: 0.29193782419144687.
[I 2025-12-08 16:41:45,633] Trial 57 finished with value: 0.2797689124715593 and parameters: {'model_type': 'gcn', 'hidden_dims': '[512, 256]', 'dropout': 0.4448670763381676, 'batch_norm': False, 'lr': 5.250170147767632e-05, 'weight_decay': 0.00021411277669584834, 'epochs': 205, 'loss': 'mse', 'optimizer': 'adam', 'graph_mode': 'cutoff', 'cutoff': 0.6522326746364686, 'grm_norm': 'cosine_then_gcn', 'self_loops': False, 'use_snp_selection': True, 'num_snps': 54354}. Best is trial 49 with value: 0.29193782419144687.
[I 2025-12-08 16:42:39,769] Trial 58 finished with value: 0.282884571381549 and parameters: {'model_type': 'gcn', 'hidden_dims': '[512, 256]', 'dropout': 0.4021462223987301, 'batch_norm': False, 'lr': 1.0792640197241974e-05, 'weight_decay': 7.868305398346319e-05, 'epochs': 175, 'loss': 'mse', 'optimizer': 'adam', 'graph_mode': 'cutoff', 'cutoff': 0.5097352518376271, 'grm_norm': 'cosine_then_gcn', 'self_loops': False, 'use_snp_selection': True, 'num_snps': 56796}. Best is trial 49 with value: 0.29193782419144687.
[I 2025-12-08 16:43:38,739] Trial 59 finished with value: 0.27205190300605486 and parameters: {'model_type': 'gcn', 'hidden_dims': '[512, 256]', 'dropout': 0.30528059836924126, 'batch_norm': False, 'lr': 2.0404136648345844e-05, 'weight_decay': 0.0001193115842476139, 'epochs': 225, 'loss': 'mse', 'optimizer': 'adam', 'graph_mode': 'cutoff', 'cutoff': 0.5808676357169966, 'grm_norm': 'cosine', 'self_loops': False, 'use_snp_selection': True, 'num_snps': 50429}. Best is trial 49 with value: 0.29193782419144687.
[I 2025-12-08 16:44:13,275] Trial 60 finished with value: 0.28045230879040695 and parameters: {'model_type': 'gcn', 'hidden_dims': '[256, 128, 64]', 'dropout': 0.4863266337210632, 'batch_norm': False, 'lr': 3.3099352522709235e-05, 'weight_decay': 0.00015267770770680745, 'epochs': 191, 'loss': 'mse', 'optimizer': 'adam', 'graph_mode': 'cutoff', 'cutoff': 0.3493853393229701, 'grm_norm': 'cosine_then_gcn', 'self_loops': False, 'use_snp_selection': True, 'num_snps': 47110}. Best is trial 49 with value: 0.29193782419144687.
[I 2025-12-08 16:44:50,511] Trial 61 finished with value: 0.29101289313806256 and parameters: {'model_type': 'gcn', 'hidden_dims': '[512, 256]', 'dropout': 0.4120443255207687, 'batch_norm': False, 'lr': 4.181442708894049e-05, 'weight_decay': 8.07300041041239e-05, 'epochs': 157, 'loss': 'mse', 'optimizer': 'adam', 'graph_mode': 'cutoff', 'cutoff': 0.6248140580434043, 'grm_norm': 'none', 'self_loops': False, 'use_snp_selection': True, 'num_snps': 38746}. Best is trial 49 with value: 0.29193782419144687.
[I 2025-12-08 16:45:29,196] Trial 62 finished with value: 0.28382879418068363 and parameters: {'model_type': 'gcn', 'hidden_dims': '[512, 256]', 'dropout': 0.35503308283637375, 'batch_norm': False, 'lr': 2.170908921986547e-05, 'weight_decay': 8.71195357481492e-05, 'epochs': 159, 'loss': 'mse', 'optimizer': 'adam', 'graph_mode': 'cutoff', 'cutoff': 0.6259694930784958, 'grm_norm': 'none', 'self_loops': False, 'use_snp_selection': True, 'num_snps': 40016}. Best is trial 49 with value: 0.29193782419144687.
[I 2025-12-08 16:46:08,720] Trial 63 finished with value: 0.29437649173181957 and parameters: {'model_type': 'gcn', 'hidden_dims': '[512, 256]', 'dropout': 0.45753775595182355, 'batch_norm': False, 'lr': 3.638368364863776e-05, 'weight_decay': 0.00026099500081615165, 'epochs': 138, 'loss': 'mse', 'optimizer': 'adam', 'graph_mode': 'cutoff', 'cutoff': 0.7233724084351482, 'grm_norm': 'none', 'self_loops': False, 'use_snp_selection': True, 'num_snps': 46396}. Best is trial 63 with value: 0.29437649173181957.
[I 2025-12-08 16:46:43,710] Trial 64 finished with value: 0.28204780588202677 and parameters: {'model_type': 'gcn', 'hidden_dims': '[512, 256]', 'dropout': 0.41482870861777366, 'batch_norm': False, 'lr': 8.047398084581371e-05, 'weight_decay': 0.0002774882697205241, 'epochs': 143, 'loss': 'mse', 'optimizer': 'adam', 'graph_mode': 'cutoff', 'cutoff': 0.7208300115366556, 'grm_norm': 'none', 'self_loops': False, 'use_snp_selection': True, 'num_snps': 38357}. Best is trial 63 with value: 0.29437649173181957.
[I 2025-12-08 16:47:20,341] Trial 65 finished with value: 0.28347103351273945 and parameters: {'model_type': 'gcn', 'hidden_dims': '[512, 256]', 'dropout': 0.4534652170305679, 'batch_norm': False, 'lr': 1.3847964318743953e-05, 'weight_decay': 0.0007343540452675262, 'epochs': 128, 'loss': 'mse', 'optimizer': 'adam', 'graph_mode': 'cutoff', 'cutoff': 0.6720700775611416, 'grm_norm': 'cosine_then_gcn', 'self_loops': False, 'use_snp_selection': True, 'num_snps': 43766}. Best is trial 63 with value: 0.29437649173181957.
[I 2025-12-08 16:47:42,302] Trial 66 finished with value: 0.282779799017128 and parameters: {'model_type': 'gcn', 'hidden_dims': '[256, 128]', 'dropout': 0.4991160360053754, 'batch_norm': False, 'lr': 4.401459748984844e-05, 'weight_decay': 0.00047871928714701207, 'epochs': 117, 'loss': 'mse', 'optimizer': 'adam', 'graph_mode': 'cutoff', 'cutoff': 0.7481142250093769, 'grm_norm': 'gcn', 'self_loops': False, 'use_snp_selection': True, 'num_snps': 34732}. Best is trial 63 with value: 0.29437649173181957.
[I 2025-12-08 16:48:25,791] Trial 67 finished with value: 0.2804532688984928 and parameters: {'model_type': 'gcn', 'hidden_dims': '[512, 128]', 'dropout': 0.37080645831847964, 'batch_norm': False, 'lr': 3.693378021644557e-05, 'weight_decay': 7.458056524447854e-05, 'epochs': 166, 'loss': 'mse', 'optimizer': 'adam', 'graph_mode': 'knn', 'knn_k': 5, 'weighted_edges': True, 'symmetrize_mode': 'mutual', 'self_loops': False, 'use_snp_selection': False}. Best is trial 63 with value: 0.29437649173181957.
[I 2025-12-08 16:49:10,718] Trial 68 finished with value: 0.2867853290198893 and parameters: {'model_type': 'gcn', 'hidden_dims': '[512, 256]', 'dropout': 0.4297708579818766, 'batch_norm': False, 'lr': 9.891328177917555e-05, 'weight_decay': 4.7058506730386956e-05, 'epochs': 146, 'loss': 'mse', 'optimizer': 'adam', 'graph_mode': 'cutoff', 'cutoff': 0.5889503238891883, 'grm_norm': 'none', 'self_loops': False, 'use_snp_selection': True, 'num_snps': 52014}. Best is trial 63 with value: 0.29437649173181957.
[I 2025-12-08 16:49:34,235] Trial 69 finished with value: 0.25607455901917275 and parameters: {'model_type': 'gcn', 'hidden_dims': '[128, 64]', 'dropout': 0.39289052682022046, 'batch_norm': False, 'lr': 1.6108786738560884e-05, 'weight_decay': 0.00010241785218396737, 'epochs': 108, 'loss': 'mse', 'optimizer': 'adam', 'graph_mode': 'cutoff', 'cutoff': 0.617791110155434, 'grm_norm': 'cosine_then_gcn', 'self_loops': False, 'use_snp_selection': True, 'num_snps': 56292}. Best is trial 63 with value: 0.29437649173181957.
[I 2025-12-08 16:50:12,633] Trial 70 finished with value: 0.28592651728593016 and parameters: {'model_type': 'gcn', 'hidden_dims': '[512, 256]', 'dropout': 0.46746691956541914, 'batch_norm': False, 'lr': 5.0781795397409165e-05, 'weight_decay': 0.0001584075265705334, 'epochs': 137, 'loss': 'mse', 'optimizer': 'adam', 'graph_mode': 'cutoff', 'cutoff': 0.7207372208562179, 'grm_norm': 'cosine_then_gcn', 'self_loops': False, 'use_snp_selection': True, 'num_snps': 44924}. Best is trial 63 with value: 0.29437649173181957.
[I 2025-12-08 16:51:00,533] Trial 71 finished with value: 0.2870403086226717 and parameters: {'model_type': 'gcn', 'hidden_dims': '[512, 256]', 'dropout': 0.5676649564670642, 'batch_norm': False, 'lr': 2.847195384448027e-05, 'weight_decay': 0.00017479258741431514, 'epochs': 180, 'loss': 'mse', 'optimizer': 'adam', 'graph_mode': 'cutoff', 'cutoff': 0.6317266894281618, 'grm_norm': 'none', 'self_loops': False, 'use_snp_selection': True, 'num_snps': 48025}. Best is trial 63 with value: 0.29437649173181957.
[I 2025-12-08 16:51:46,165] Trial 72 finished with value: 0.27928991654448587 and parameters: {'model_type': 'gcn', 'hidden_dims': '[512, 256]', 'dropout': 0.309988605058438, 'batch_norm': False, 'lr': 2.147499544083845e-05, 'weight_decay': 0.00023024339303896515, 'epochs': 195, 'loss': 'mse', 'optimizer': 'adam', 'graph_mode': 'cutoff', 'cutoff': 0.6733886101524613, 'grm_norm': 'none', 'self_loops': False, 'use_snp_selection': True, 'num_snps': 41923}. Best is trial 63 with value: 0.29437649173181957.
[I 2025-12-08 16:52:20,710] Trial 73 finished with value: 0.2807523231066076 and parameters: {'model_type': 'gcn', 'hidden_dims': '[512, 256]', 'dropout': 0.4230031517034357, 'batch_norm': False, 'lr': 3.119085368717917e-05, 'weight_decay': 0.0003522348315893801, 'epochs': 163, 'loss': 'mse', 'optimizer': 'adam', 'graph_mode': 'cutoff', 'cutoff': 0.5161366838708916, 'grm_norm': 'none', 'self_loops': False, 'use_snp_selection': True, 'num_snps': 33487}. Best is trial 63 with value: 0.29437649173181957.
[I 2025-12-08 16:52:55,786] Trial 74 finished with value: 0.2763268519951983 and parameters: {'model_type': 'gcn', 'hidden_dims': '[512, 256]', 'dropout': 0.36767812361105723, 'batch_norm': False, 'lr': 1.0109002069106838e-05, 'weight_decay': 6.507495316743484e-05, 'epochs': 171, 'loss': 'mse', 'optimizer': 'adam', 'graph_mode': 'cutoff', 'cutoff': 0.21479938489652323, 'grm_norm': 'none', 'self_loops': False, 'use_snp_selection': True, 'num_snps': 31069}. Best is trial 63 with value: 0.29437649173181957.
[I 2025-12-08 16:53:52,320] Trial 75 finished with value: 0.2822364604578963 and parameters: {'model_type': 'gcn', 'hidden_dims': '[512, 256]', 'dropout': 0.3458653225601086, 'batch_norm': False, 'lr': 2.486890877501757e-05, 'weight_decay': 0.00012269875934485197, 'epochs': 184, 'loss': 'mse', 'optimizer': 'adam', 'graph_mode': 'cutoff', 'cutoff': 0.5571261415354917, 'grm_norm': 'none', 'self_loops': False, 'use_snp_selection': True, 'num_snps': 57597}. Best is trial 63 with value: 0.29437649173181957.
[I 2025-12-08 16:54:22,148] Trial 76 finished with value: 0.2866268707620627 and parameters: {'model_type': 'gcn', 'hidden_dims': '[128, 64]', 'dropout': 0.3982469343790254, 'batch_norm': False, 'lr': 3.800454238426751e-05, 'weight_decay': 2.947098424092203e-05, 'epochs': 233, 'loss': 'mse', 'optimizer': 'adam', 'graph_mode': 'cutoff', 'cutoff': 0.704015792418469, 'grm_norm': 'none', 'self_loops': False, 'use_snp_selection': True, 'num_snps': 54260}. Best is trial 63 with value: 0.29437649173181957.
[I 2025-12-08 16:54:52,430] Trial 77 finished with value: 0.2863286704609835 and parameters: {'model_type': 'gcn', 'hidden_dims': '[256, 128, 64]', 'dropout': 0.38165689307619327, 'batch_norm': False, 'lr': 6.358227323592602e-05, 'weight_decay': 0.00027219805487508546, 'epochs': 147, 'loss': 'mse', 'optimizer': 'adam', 'graph_mode': 'cutoff', 'cutoff': 0.6026767755623907, 'grm_norm': 'cosine_then_gcn', 'self_loops': False, 'use_snp_selection': True, 'num_snps': 48304}. Best is trial 63 with value: 0.29437649173181957.
[I 2025-12-08 16:55:46,122] Trial 78 finished with value: 0.2698944036108578 and parameters: {'model_type': 'gcn', 'hidden_dims': '[512, 256]', 'dropout': 0.5317790534026788, 'batch_norm': False, 'lr': 0.0002933254849210102, 'weight_decay': 0.00019971825800307283, 'epochs': 211, 'loss': 'mse', 'optimizer': 'adam', 'graph_mode': 'cutoff', 'cutoff': 0.7675116065648631, 'grm_norm': 'cosine', 'self_loops': False, 'use_snp_selection': False}. Best is trial 63 with value: 0.29437649173181957.
[I 2025-12-08 16:56:10,826] Trial 79 finished with value: 0.2860177730337476 and parameters: {'model_type': 'gcn', 'hidden_dims': '[256, 128]', 'dropout': 0.32893158118223065, 'batch_norm': False, 'lr': 1.7261518094356194e-05, 'weight_decay': 0.0006519339730311262, 'epochs': 123, 'loss': 'mse', 'optimizer': 'adam', 'graph_mode': 'knn', 'knn_k': 9, 'weighted_edges': True, 'symmetrize_mode': 'union', 'self_loops': False, 'use_snp_selection': True, 'num_snps': 38540}. Best is trial 63 with value: 0.29437649173181957.
[I 2025-12-08 16:56:39,832] Trial 80 finished with value: 0.28125641046397765 and parameters: {'model_type': 'gcn', 'hidden_dims': '[512, 256]', 'dropout': 0.28978277203680747, 'batch_norm': False, 'lr': 5.2275232690256464e-05, 'weight_decay': 5.1968686122217135e-05, 'epochs': 161, 'loss': 'mse', 'optimizer': 'adam', 'graph_mode': 'cutoff', 'cutoff': 0.6755704204442596, 'grm_norm': 'cosine_then_gcn', 'self_loops': False, 'use_snp_selection': True, 'num_snps': 26268}. Best is trial 63 with value: 0.29437649173181957.
[I 2025-12-08 16:57:25,179] Trial 81 finished with value: 0.2870223592251083 and parameters: {'model_type': 'gcn', 'hidden_dims': '[512, 256]', 'dropout': 0.5770961155860744, 'batch_norm': False, 'lr': 2.7793111858556014e-05, 'weight_decay': 9.725536124233448e-05, 'epochs': 177, 'loss': 'mse', 'optimizer': 'adam', 'graph_mode': 'cutoff', 'cutoff': 0.6347447355196449, 'grm_norm': 'none', 'self_loops': False, 'use_snp_selection': True, 'num_snps': 45101}. Best is trial 63 with value: 0.29437649173181957.
[I 2025-12-08 16:58:14,745] Trial 82 finished with value: 0.2913193291212987 and parameters: {'model_type': 'gcn', 'hidden_dims': '[512, 256]', 'dropout': 0.5713847874006063, 'batch_norm': False, 'lr': 3.2169540538660195e-05, 'weight_decay': 0.00017436825603997825, 'epochs': 191, 'loss': 'mse', 'optimizer': 'adam', 'graph_mode': 'cutoff', 'cutoff': 0.6600190673189548, 'grm_norm': 'none', 'self_loops': False, 'use_snp_selection': True, 'num_snps': 47649}. Best is trial 63 with value: 0.29437649173181957.
[I 2025-12-08 16:59:08,682] Trial 83 finished with value: 0.2748641189831921 and parameters: {'model_type': 'gcn', 'hidden_dims': '[512, 256]', 'dropout': 0.5837626529518729, 'batch_norm': False, 'lr': 4.115478169657766e-05, 'weight_decay': 0.0003154071737621771, 'epochs': 194, 'loss': 'mse', 'optimizer': 'adam', 'graph_mode': 'cutoff', 'cutoff': 0.6602123845833885, 'grm_norm': 'none', 'self_loops': False, 'use_snp_selection': True, 'num_snps': 51924}. Best is trial 63 with value: 0.29437649173181957.
[I 2025-12-08 16:59:59,062] Trial 84 finished with value: 0.2844090239826887 and parameters: {'model_type': 'gcn', 'hidden_dims': '[512, 256]', 'dropout': 0.5337915755455135, 'batch_norm': False, 'lr': 2.0705684053546974e-05, 'weight_decay': 0.0001356948988308114, 'epochs': 167, 'loss': 'mse', 'optimizer': 'adam', 'graph_mode': 'cutoff', 'cutoff': 0.7016055186337155, 'grm_norm': 'none', 'self_loops': False, 'use_snp_selection': True, 'num_snps': 54399}. Best is trial 63 with value: 0.29437649173181957.
[I 2025-12-08 17:00:24,409] Trial 85 finished with value: 0.26634969421295046 and parameters: {'model_type': 'gcn', 'hidden_dims': '[128, 64]', 'dropout': 0.5530784388979236, 'batch_norm': False, 'lr': 1.2002222743417635e-05, 'weight_decay': 0.00018340511414496844, 'epochs': 202, 'loss': 'mse', 'optimizer': 'adam', 'graph_mode': 'cutoff', 'cutoff': 0.733887605151685, 'grm_norm': 'none', 'self_loops': False, 'use_snp_selection': True, 'num_snps': 46111}. Best is trial 63 with value: 0.29437649173181957.
[I 2025-12-08 17:01:04,946] Trial 86 finished with value: 0.2915685781169279 and parameters: {'model_type': 'gcn', 'hidden_dims': '[512, 128]', 'dropout': 0.44263070495290924, 'batch_norm': False, 'lr': 3.588892238004713e-05, 'weight_decay': 3.764139981938401e-05, 'epochs': 154, 'loss': 'mse', 'optimizer': 'adam', 'graph_mode': 'cutoff', 'cutoff': 0.606267134808904, 'grm_norm': 'cosine_then_gcn', 'self_loops': False, 'use_snp_selection': True, 'num_snps': 43276}. Best is trial 63 with value: 0.29437649173181957.
[I 2025-12-08 17:01:44,030] Trial 87 finished with value: 0.286604698530702 and parameters: {'model_type': 'gcn', 'hidden_dims': '[512, 128]', 'dropout': 0.44366649835727967, 'batch_norm': False, 'lr': 3.479855050052443e-05, 'weight_decay': 3.585491487128432e-05, 'epochs': 152, 'loss': 'mse', 'optimizer': 'adam', 'graph_mode': 'cutoff', 'cutoff': 0.6101978664386543, 'grm_norm': 'cosine_then_gcn', 'self_loops': False, 'use_snp_selection': True, 'num_snps': 42143}. Best is trial 63 with value: 0.29437649173181957.
[I 2025-12-08 17:02:18,626] Trial 88 finished with value: 0.28523353784516825 and parameters: {'model_type': 'gcn', 'hidden_dims': '[512, 128]', 'dropout': 0.41597793321427945, 'batch_norm': False, 'lr': 2.356172175349288e-05, 'weight_decay': 1.4362850982397228e-05, 'epochs': 140, 'loss': 'mse', 'optimizer': 'adam', 'graph_mode': 'cutoff', 'cutoff': 0.5246467928198388, 'grm_norm': 'cosine_then_gcn', 'self_loops': False, 'use_snp_selection': True, 'num_snps': 38078}. Best is trial 63 with value: 0.29437649173181957.
[I 2025-12-08 17:02:56,462] Trial 89 finished with value: 0.24080296821541491 and parameters: {'model_type': 'gcn', 'hidden_dims': '[512, 128]', 'dropout': 0.48230277241805036, 'batch_norm': True, 'lr': 0.0001388174087517882, 'weight_decay': 6.416897219024706e-05, 'epochs': 134, 'loss': 'mse', 'optimizer': 'adam', 'graph_mode': 'cutoff', 'cutoff': 0.4749082654864487, 'grm_norm': 'cosine_then_gcn', 'self_loops': True, 'use_snp_selection': True, 'num_snps': 43486}. Best is trial 63 with value: 0.29437649173181957.
[I 2025-12-08 17:03:37,014] Trial 90 finished with value: 0.12899345601269915 and parameters: {'model_type': 'gcn', 'hidden_dims': '[512, 128]', 'dropout': 0.4509736638117558, 'batch_norm': False, 'lr': 0.0005537155805976142, 'weight_decay': 4.327254207973935e-05, 'epochs': 157, 'loss': 'mse', 'optimizer': 'adam', 'graph_mode': 'cutoff', 'cutoff': 0.5724014286264427, 'grm_norm': 'gcn', 'self_loops': False, 'use_snp_selection': False}. Best is trial 63 with value: 0.29437649173181957.
[I 2025-12-08 17:04:27,131] Trial 91 finished with value: 0.2869182321356808 and parameters: {'model_type': 'gcn', 'hidden_dims': '[512, 256]', 'dropout': 0.3780059224834037, 'batch_norm': False, 'lr': 4.5939072667182915e-05, 'weight_decay': 2.12958536018485e-05, 'epochs': 187, 'loss': 'mse', 'optimizer': 'adam', 'graph_mode': 'cutoff', 'cutoff': 0.649222018707428, 'grm_norm': 'cosine_then_gcn', 'self_loops': False, 'use_snp_selection': True, 'num_snps': 48793}. Best is trial 63 with value: 0.29437649173181957.
[I 2025-12-08 17:05:07,234] Trial 92 finished with value: 0.2819785997343545 and parameters: {'model_type': 'gcn', 'hidden_dims': '[512, 256]', 'dropout': 0.5890902428156598, 'batch_norm': False, 'lr': 3.307332664485672e-05, 'weight_decay': 0.00010703252165492797, 'epochs': 167, 'loss': 'mse', 'optimizer': 'adam', 'graph_mode': 'cutoff', 'cutoff': 0.5953514887018477, 'grm_norm': 'cosine_then_gcn', 'self_loops': False, 'use_snp_selection': True, 'num_snps': 40047}. Best is trial 63 with value: 0.29437649173181957.
