[I 2025-12-08 20:55:49,799] Trial 30 finished with value: 0.23622089398917584 and parameters: {'model_type': 'gcn', 'hidden_dims': '[256, 128, 64]', 'dropout': 0.18317310420558705, 'batch_norm': True, 'lr': 0.0068516184047816165, 'weight_decay': 9.78812323344375e-06, 'epochs': 106, 'loss': 'mse', 'optimizer': 'adam', 'graph_mode': 'cutoff', 'cutoff': 0.5241934893635325, 'grm_norm': 'cosine_then_gcn', 'self_loops': True, 'use_snp_selection': False}. Best is trial 4 with value: 0.29441346525531686.
[I 2025-12-08 20:56:06,586] Trial 31 finished with value: 0.2856276699274057 and parameters: {'model_type': 'gcn', 'hidden_dims': '[256, 128]', 'dropout': 0.44601818929268133, 'batch_norm': True, 'lr': 0.000726763946742568, 'weight_decay': 3.5691958996442762e-06, 'epochs': 94, 'loss': 'mae', 'optimizer': 'adam', 'graph_mode': 'cutoff', 'cutoff': 0.7086941973184467, 'grm_norm': 'cosine_then_gcn', 'self_loops': True, 'use_snp_selection': True, 'num_snps': 23866}. Best is trial 4 with value: 0.29441346525531686.
[I 2025-12-08 20:56:12,198] Trial 32 finished with value: 0.2750513650129307 and parameters: {'model_type': 'gcn', 'hidden_dims': '[128, 64]', 'dropout': 0.5962951404549851, 'batch_norm': True, 'lr': 0.0003568153788690838, 'weight_decay': 4.570408232069541e-07, 'epochs': 57, 'loss': 'mse', 'optimizer': 'adam', 'graph_mode': 'cutoff', 'cutoff': 0.8248296233873172, 'grm_norm': 'cosine_then_gcn', 'self_loops': True, 'use_snp_selection': False}. Best is trial 4 with value: 0.29441346525531686.
[I 2025-12-08 20:56:36,792] Trial 33 finished with value: 0.28650825759139165 and parameters: {'model_type': 'gcn', 'hidden_dims': '[512, 128]', 'dropout': 0.4291353500081331, 'batch_norm': True, 'lr': 0.00014986597983137104, 'weight_decay': 7.319585391006906e-05, 'epochs': 83, 'loss': 'mae', 'optimizer': 'adam', 'graph_mode': 'cutoff', 'cutoff': 0.8277171839551158, 'grm_norm': 'cosine_then_gcn', 'self_loops': False, 'use_snp_selection': True, 'num_snps': 34059}. Best is trial 4 with value: 0.29441346525531686.
[I 2025-12-08 20:56:53,384] Trial 34 finished with value: 0.2837196470787212 and parameters: {'model_type': 'gcn', 'hidden_dims': '[256, 128, 64]', 'dropout': 0.25265542838589905, 'batch_norm': True, 'lr': 0.0004533042465765716, 'weight_decay': 1.2558722570556064e-06, 'epochs': 120, 'loss': 'mse', 'optimizer': 'adam', 'graph_mode': 'cutoff', 'cutoff': 0.7089798978065035, 'grm_norm': 'cosine_then_gcn', 'self_loops': True, 'use_snp_selection': False}. Best is trial 4 with value: 0.29441346525531686.
[I 2025-12-08 20:58:16,738] Trial 35 finished with value: 0.21620373715534819 and parameters: {'model_type': 'gcn', 'hidden_dims': '[512, 256]', 'dropout': 0.345817939053336, 'batch_norm': True, 'lr': 0.0008710171368387491, 'weight_decay': 1.0539802735408327e-07, 'epochs': 307, 'loss': 'mae', 'optimizer': 'adam', 'graph_mode': 'knn', 'knn_k': 10, 'weighted_edges': True, 'symmetrize_mode': 'mutual', 'self_loops': False, 'use_snp_selection': True, 'num_snps': 56952}. Best is trial 4 with value: 0.29441346525531686.
[I 2025-12-08 20:59:14,549] Trial 36 finished with value: 0.2811214571697766 and parameters: {'model_type': 'gcn', 'hidden_dims': '[512, 64]', 'dropout': 0.5071039987967118, 'batch_norm': True, 'lr': 0.00026338276688513655, 'weight_decay': 2.2764494759370685e-07, 'epochs': 228, 'loss': 'mse', 'optimizer': 'adam', 'graph_mode': 'cutoff', 'cutoff': 0.6564097652962482, 'grm_norm': 'cosine_then_gcn', 'self_loops': True, 'use_snp_selection': False}. Best is trial 4 with value: 0.29441346525531686.
[I 2025-12-08 20:59:25,828] Trial 37 finished with value: 0.2743153800153627 and parameters: {'model_type': 'gcn', 'hidden_dims': '[128, 64]', 'dropout': 0.3211733831810437, 'batch_norm': True, 'lr': 0.0033994966631703764, 'weight_decay': 8.555934645986432e-07, 'epochs': 87, 'loss': 'mae', 'optimizer': 'adam', 'graph_mode': 'cutoff', 'cutoff': 0.7770289192171288, 'grm_norm': 'none', 'self_loops': False, 'use_snp_selection': True, 'num_snps': 11037}. Best is trial 4 with value: 0.29441346525531686.
[I 2025-12-08 20:59:48,984] Trial 38 finished with value: 0.28025343657933705 and parameters: {'model_type': 'gcn', 'hidden_dims': '[256, 128]', 'dropout': 0.3908746409275631, 'batch_norm': True, 'lr': 0.0013343637162559555, 'weight_decay': 9.486045078864202e-06, 'epochs': 183, 'loss': 'mse', 'optimizer': 'adam', 'graph_mode': 'cutoff', 'cutoff': 0.8456121108872188, 'grm_norm': 'gcn', 'self_loops': False, 'use_snp_selection': False}. Best is trial 4 with value: 0.29441346525531686.
[I 2025-12-08 21:00:28,910] Trial 39 finished with value: 0.22244505547398913 and parameters: {'model_type': 'gcn', 'hidden_dims': '[512, 256]', 'dropout': 0.4474384139696815, 'batch_norm': True, 'lr': 0.0005844098617016038, 'weight_decay': 0.0002410125926625789, 'epochs': 148, 'loss': 'mae', 'optimizer': 'adam', 'graph_mode': 'knn', 'knn_k': 7, 'weighted_edges': True, 'symmetrize_mode': 'mutual', 'self_loops': True, 'use_snp_selection': True, 'num_snps': 42839}. Best is trial 4 with value: 0.29441346525531686.
[I 2025-12-08 21:01:20,459] Trial 40 finished with value: 0.2842058722706738 and parameters: {'model_type': 'gcn', 'hidden_dims': '[512, 128]', 'dropout': 0.48494412826081723, 'batch_norm': True, 'lr': 0.0016204323495965273, 'weight_decay': 3.5959805167120866e-06, 'epochs': 202, 'loss': 'mse', 'optimizer': 'adam', 'graph_mode': 'cutoff', 'cutoff': 0.7404664540000988, 'grm_norm': 'cosine_then_gcn', 'self_loops': False, 'use_snp_selection': False}. Best is trial 4 with value: 0.29441346525531686.
[I 2025-12-08 21:01:42,136] Trial 41 finished with value: 0.28708280124422514 and parameters: {'model_type': 'gcn', 'hidden_dims': '[512, 256]', 'dropout': 0.4103225733830763, 'batch_norm': False, 'lr': 5.6587459878661945e-05, 'weight_decay': 2.1042614820608693e-05, 'epochs': 134, 'loss': 'mae', 'optimizer': 'adam', 'graph_mode': 'cutoff', 'cutoff': 0.8935716924219372, 'grm_norm': 'none', 'self_loops': False, 'use_snp_selection': True, 'num_snps': 19386}. Best is trial 4 with value: 0.29441346525531686.
[I 2025-12-08 21:02:04,181] Trial 42 finished with value: 0.28921544065499144 and parameters: {'model_type': 'gcn', 'hidden_dims': '[512, 256]', 'dropout': 0.4230456277499986, 'batch_norm': False, 'lr': 5.352019913861801e-05, 'weight_decay': 3.812008085270124e-05, 'epochs': 133, 'loss': 'mae', 'optimizer': 'adam', 'graph_mode': 'cutoff', 'cutoff': 0.8511969337416417, 'grm_norm': 'none', 'self_loops': False, 'use_snp_selection': True, 'num_snps': 20512}. Best is trial 4 with value: 0.29441346525531686.
[I 2025-12-08 21:02:18,190] Trial 43 finished with value: 0.26533132589778896 and parameters: {'model_type': 'gcn', 'hidden_dims': '[512, 256]', 'dropout': 0.4052455935066859, 'batch_norm': False, 'lr': 6.254514753688559e-05, 'weight_decay': 3.182108359926794e-05, 'epochs': 138, 'loss': 'mae', 'optimizer': 'adam', 'graph_mode': 'cutoff', 'cutoff': 0.8665617951320104, 'grm_norm': 'none', 'self_loops': False, 'use_snp_selection': True, 'num_snps': 7690}. Best is trial 4 with value: 0.29441346525531686.
[I 2025-12-08 21:02:34,029] Trial 44 finished with value: 0.2650439902504485 and parameters: {'model_type': 'gcn', 'hidden_dims': '[512, 256]', 'dropout': 0.34229621846775776, 'batch_norm': False, 'lr': 1.7397466211677275e-05, 'weight_decay': 0.00010825082000576903, 'epochs': 109, 'loss': 'mae', 'optimizer': 'adam', 'graph_mode': 'cutoff', 'cutoff': 0.7994171199319146, 'grm_norm': 'none', 'self_loops': False, 'use_snp_selection': True, 'num_snps': 13018}. Best is trial 4 with value: 0.29441346525531686.
[I 2025-12-08 21:03:01,178] Trial 45 finished with value: 0.28641278129637265 and parameters: {'model_type': 'gcn', 'hidden_dims': '[512, 256]', 'dropout': 0.30352850016593613, 'batch_norm': False, 'lr': 0.00010575529378852794, 'weight_decay': 5.602251339594671e-05, 'epochs': 129, 'loss': 'mae', 'optimizer': 'adam', 'graph_mode': 'cutoff', 'cutoff': 0.8531877666012838, 'grm_norm': 'none', 'self_loops': False, 'use_snp_selection': True, 'num_snps': 29165}. Best is trial 4 with value: 0.29441346525531686.
[I 2025-12-08 21:03:28,052] Trial 46 finished with value: 0.25024108100012654 and parameters: {'model_type': 'gcn', 'hidden_dims': '[512, 64]', 'dropout': 0.37095555248713286, 'batch_norm': False, 'lr': 6.796798587073975e-05, 'weight_decay': 1.7253089523434817e-05, 'epochs': 178, 'loss': 'mae', 'optimizer': 'adam', 'graph_mode': 'knn', 'knn_k': 1, 'weighted_edges': False, 'symmetrize_mode': 'mutual', 'self_loops': False, 'use_snp_selection': True, 'num_snps': 21567}. Best is trial 4 with value: 0.29441346525531686.
[I 2025-12-08 21:03:57,476] Trial 47 finished with value: 0.2832708415188773 and parameters: {'model_type': 'gcn', 'hidden_dims': '[512, 256]', 'dropout': 0.2697220302470267, 'batch_norm': False, 'lr': 1.0836024497480881e-05, 'weight_decay': 0.0005645916711282832, 'epochs': 154, 'loss': 'mae', 'optimizer': 'adam', 'graph_mode': 'cutoff', 'cutoff': 0.8996565994176379, 'grm_norm': 'none', 'self_loops': False, 'use_snp_selection': True, 'num_snps': 28247}. Best is trial 4 with value: 0.29441346525531686.
[I 2025-12-08 21:04:15,865] Trial 48 finished with value: 0.2681606361696116 and parameters: {'model_type': 'gcn', 'hidden_dims': '[128, 64]', 'dropout': 0.20188777804236113, 'batch_norm': False, 'lr': 2.6716979848470953e-05, 'weight_decay': 4.3934472052949345e-05, 'epochs': 131, 'loss': 'mae', 'optimizer': 'adam', 'graph_mode': 'cutoff', 'cutoff': 0.4629205588681369, 'grm_norm': 'cosine', 'self_loops': True, 'use_snp_selection': True, 'num_snps': 32990}. Best is trial 4 with value: 0.29441346525531686.
[I 2025-12-08 21:04:45,639] Trial 49 finished with value: 0.25159334560740654 and parameters: {'model_type': 'gcn', 'hidden_dims': '[512, 256]', 'dropout': 0.41482536893663613, 'batch_norm': False, 'lr': 0.00014343422928783626, 'weight_decay': 2.0704594027962738e-05, 'epochs': 109, 'loss': 'mae', 'optimizer': 'adam', 'graph_mode': 'knn', 'knn_k': 8, 'weighted_edges': True, 'symmetrize_mode': 'mutual', 'self_loops': False, 'use_snp_selection': False}. Best is trial 4 with value: 0.29441346525531686.
[I 2025-12-08 21:05:04,347] Trial 50 finished with value: 0.2581938520255088 and parameters: {'model_type': 'gcn', 'hidden_dims': '[256, 128, 64]', 'dropout': 0.3961700060531244, 'batch_norm': False, 'lr': 5.051378177749784e-05, 'weight_decay': 0.0001686903326110617, 'epochs': 54, 'loss': 'mse', 'optimizer': 'adam', 'graph_mode': 'cutoff', 'cutoff': 0.31087250972468405, 'grm_norm': 'gcn', 'self_loops': False, 'use_snp_selection': True, 'num_snps': 38059}. Best is trial 4 with value: 0.29441346525531686.
[I 2025-12-08 21:05:22,980] Trial 51 finished with value: 0.28480743637370687 and parameters: {'model_type': 'gcn', 'hidden_dims': '[512, 256]', 'dropout': 0.4356384934812519, 'batch_norm': True, 'lr': 0.000299282978713674, 'weight_decay': 1.4157435674925773e-05, 'epochs': 91, 'loss': 'mae', 'optimizer': 'adam', 'graph_mode': 'cutoff', 'cutoff': 0.8508570170152754, 'grm_norm': 'cosine', 'self_loops': False, 'use_snp_selection': True, 'num_snps': 19644}. Best is trial 4 with value: 0.29441346525531686.
[I 2025-12-08 21:05:42,814] Trial 52 finished with value: 0.2842883564370896 and parameters: {'model_type': 'gcn', 'hidden_dims': '[512, 256]', 'dropout': 0.4635401316611474, 'batch_norm': True, 'lr': 0.00011175316157217331, 'weight_decay': 6.702818722127274e-06, 'epochs': 76, 'loss': 'mae', 'optimizer': 'adam', 'graph_mode': 'cutoff', 'cutoff': 0.7992139136252608, 'grm_norm': 'none', 'self_loops': False, 'use_snp_selection': True, 'num_snps': 25623}. Best is trial 4 with value: 0.29441346525531686.
[I 2025-12-08 21:06:02,088] Trial 53 finished with value: 0.28400371721790535 and parameters: {'model_type': 'gcn', 'hidden_dims': '[512, 256]', 'dropout': 0.4922301727010944, 'batch_norm': False, 'lr': 8.795668790873059e-05, 'weight_decay': 2.956964685595509e-05, 'epochs': 155, 'loss': 'mae', 'optimizer': 'adam', 'graph_mode': 'cutoff', 'cutoff': 0.6010389110824976, 'grm_norm': 'none', 'self_loops': False, 'use_snp_selection': True, 'num_snps': 14228}. Best is trial 4 with value: 0.29441346525531686.
[I 2025-12-08 21:06:24,100] Trial 54 finished with value: 0.2851308052423384 and parameters: {'model_type': 'gcn', 'hidden_dims': '[512, 256]', 'dropout': 0.42530749755634234, 'batch_norm': True, 'lr': 0.0001872771710938766, 'weight_decay': 8.907149727489169e-05, 'epochs': 117, 'loss': 'mae', 'optimizer': 'adam', 'graph_mode': 'cutoff', 'cutoff': 0.8787093265920773, 'grm_norm': 'none', 'self_loops': False, 'use_snp_selection': True, 'num_snps': 21054}. Best is trial 4 with value: 0.29441346525531686.
[I 2025-12-08 21:06:46,786] Trial 55 finished with value: 0.28177125984524354 and parameters: {'model_type': 'gcn', 'hidden_dims': '[512, 256]', 'dropout': 0.38399864428546654, 'batch_norm': False, 'lr': 0.00043915088226794807, 'weight_decay': 1.0105808855128196e-05, 'epochs': 100, 'loss': 'mae', 'optimizer': 'adam', 'graph_mode': 'cutoff', 'cutoff': 0.6428854400312884, 'grm_norm': 'none', 'self_loops': False, 'use_snp_selection': True, 'num_snps': 26222}. Best is trial 4 with value: 0.29441346525531686.
[I 2025-12-08 21:07:15,867] Trial 56 finished with value: 0.29526868984015453 and parameters: {'model_type': 'gcn', 'hidden_dims': '[512, 256]', 'dropout': 0.5342921495132754, 'batch_norm': True, 'lr': 2.675131715850325e-05, 'weight_decay': 5.687525366161631e-05, 'epochs': 71, 'loss': 'mae', 'optimizer': 'adam', 'graph_mode': 'cutoff', 'cutoff': 0.7344770690131671, 'grm_norm': 'cosine', 'self_loops': False, 'use_snp_selection': True, 'num_snps': 48210}. Best is trial 56 with value: 0.29526868984015453.
[I 2025-12-08 21:07:39,757] Trial 57 finished with value: 0.2483599084235418 and parameters: {'model_type': 'gcn', 'hidden_dims': '[512, 128]', 'dropout': 0.5280188195002105, 'batch_norm': True, 'lr': 1.6444634020351933e-05, 'weight_decay': 5.8955994407476664e-05, 'epochs': 43, 'loss': 'mae', 'optimizer': 'adam', 'graph_mode': 'cutoff', 'cutoff': 0.7534553896328053, 'grm_norm': 'cosine', 'self_loops': False, 'use_snp_selection': True, 'num_snps': 47508}. Best is trial 56 with value: 0.29526868984015453.
[I 2025-12-08 21:08:19,684] Trial 58 finished with value: 0.27898403884606116 and parameters: {'model_type': 'gcn', 'hidden_dims': '[256, 128]', 'dropout': 0.5444517629639967, 'batch_norm': False, 'lr': 2.7653617364431296e-05, 'weight_decay': 3.554102330646861e-05, 'epochs': 262, 'loss': 'mae', 'optimizer': 'adam', 'graph_mode': 'cutoff', 'cutoff': 0.8065138633824271, 'grm_norm': 'cosine', 'self_loops': False, 'use_snp_selection': True, 'num_snps': 46414}. Best is trial 56 with value: 0.29526868984015453.
[I 2025-12-08 21:08:49,102] Trial 59 finished with value: 0.2655374674878702 and parameters: {'model_type': 'gcn', 'hidden_dims': '[512, 256]', 'dropout': 0.5915987892929531, 'batch_norm': True, 'lr': 3.1287162785855874e-05, 'weight_decay': 0.00012236766183352203, 'epochs': 66, 'loss': 'mae', 'optimizer': 'adam', 'graph_mode': 'cutoff', 'cutoff': 0.8570599626548403, 'grm_norm': 'cosine', 'self_loops': False, 'use_snp_selection': True, 'num_snps': 50518}. Best is trial 56 with value: 0.29526868984015453.
[I 2025-12-08 21:09:25,143] Trial 60 finished with value: 0.21784452817794664 and parameters: {'model_type': 'gcn', 'hidden_dims': '[512, 256]', 'dropout': 0.17567313304148374, 'batch_norm': True, 'lr': 4.970232445771243e-05, 'weight_decay': 2.104941400266325e-05, 'epochs': 78, 'loss': 'mae', 'optimizer': 'adam', 'graph_mode': 'knn', 'knn_k': 5, 'weighted_edges': False, 'symmetrize_mode': 'union', 'self_loops': True, 'use_snp_selection': True, 'num_snps': 59331}. Best is trial 56 with value: 0.29526868984015453.
[I 2025-12-08 21:09:37,122] Trial 61 finished with value: 0.27681707489195634 and parameters: {'model_type': 'gcn', 'hidden_dims': '[512, 256]', 'dropout': 0.5725167802653989, 'batch_norm': True, 'lr': 0.0002477267561934184, 'weight_decay': 4.139855117077602e-05, 'epochs': 89, 'loss': 'mae', 'optimizer': 'adam', 'graph_mode': 'cutoff', 'cutoff': 0.7315379739020524, 'grm_norm': 'cosine', 'self_loops': False, 'use_snp_selection': True, 'num_snps': 6624}. Best is trial 56 with value: 0.29526868984015453.
[I 2025-12-08 21:10:02,148] Trial 62 finished with value: 0.2699017860206935 and parameters: {'model_type': 'gcn', 'hidden_dims': '[512, 256]', 'dropout': 0.447801707677899, 'batch_norm': True, 'lr': 1.3414074202196227e-05, 'weight_decay': 7.923294164326029e-05, 'epochs': 100, 'loss': 'mae', 'optimizer': 'adam', 'graph_mode': 'cutoff', 'cutoff': 0.7845738531105824, 'grm_norm': 'none', 'self_loops': False, 'use_snp_selection': True, 'num_snps': 31017}. Best is trial 56 with value: 0.29526868984015453.
[I 2025-12-08 21:10:17,163] Trial 63 finished with value: 0.2843071037431543 and parameters: {'model_type': 'gcn', 'hidden_dims': '[512, 256]', 'dropout': 0.3587015097249588, 'batch_norm': True, 'lr': 0.0008718768488756093, 'weight_decay': 2.614864340879367e-05, 'epochs': 51, 'loss': 'mae', 'optimizer': 'adam', 'graph_mode': 'cutoff', 'cutoff': 0.8778510634507812, 'grm_norm': 'cosine_then_gcn', 'self_loops': False, 'use_snp_selection': True, 'num_snps': 18667}. Best is trial 56 with value: 0.29526868984015453.
[I 2025-12-08 21:10:32,139] Trial 64 finished with value: 0.2863948973727942 and parameters: {'model_type': 'gcn', 'hidden_dims': '[512, 256]', 'dropout': 0.46195976745730816, 'batch_norm': True, 'lr': 6.417713395139286e-05, 'weight_decay': 2.1470244108082e-06, 'epochs': 70, 'loss': 'mae', 'optimizer': 'adam', 'graph_mode': 'cutoff', 'cutoff': 0.7740789749749071, 'grm_norm': 'none', 'self_loops': False, 'use_snp_selection': True, 'num_snps': 15546}. Best is trial 56 with value: 0.29526868984015453.
[I 2025-12-08 21:11:03,922] Trial 65 finished with value: 0.28765074554846237 and parameters: {'model_type': 'gcn', 'hidden_dims': '[512, 128]', 'dropout': 0.23029822388855997, 'batch_norm': True, 'lr': 0.001945641994084156, 'weight_decay': 1.367397795494523e-05, 'epochs': 120, 'loss': 'mse', 'optimizer': 'adam', 'graph_mode': 'cutoff', 'cutoff': 0.836131465213873, 'grm_norm': 'cosine_then_gcn', 'self_loops': False, 'use_snp_selection': False}. Best is trial 56 with value: 0.29526868984015453.
[I 2025-12-08 21:11:35,627] Trial 66 finished with value: 0.2838648169209293 and parameters: {'model_type': 'gcn', 'hidden_dims': '[512, 128]', 'dropout': 0.2296758154023664, 'batch_norm': True, 'lr': 0.0019511572177922784, 'weight_decay': 1.2533765841597568e-05, 'epochs': 119, 'loss': 'mse', 'optimizer': 'adam', 'graph_mode': 'cutoff', 'cutoff': 0.8459351473293899, 'grm_norm': 'cosine', 'self_loops': False, 'use_snp_selection': False}. Best is trial 56 with value: 0.29526868984015453.
[I 2025-12-08 21:12:13,134] Trial 67 finished with value: -0.033148250909963414 and parameters: {'model_type': 'gcn', 'hidden_dims': '[512, 128]', 'dropout': 0.24925178480767257, 'batch_norm': False, 'lr': 0.0046720133077475965, 'weight_decay': 5.087640788011081e-05, 'epochs': 145, 'loss': 'mse', 'optimizer': 'adam', 'graph_mode': 'cutoff', 'cutoff': 0.8942052727506908, 'grm_norm': 'gcn', 'self_loops': False, 'use_snp_selection': False}. Best is trial 56 with value: 0.29526868984015453.
[I 2025-12-08 21:12:47,122] Trial 68 finished with value: 0.2866928384874205 and parameters: {'model_type': 'gcn', 'hidden_dims': '[512, 128]', 'dropout': 0.13313665427236615, 'batch_norm': True, 'lr': 0.0010344733172741362, 'weight_decay': 7.765813915913238e-06, 'epochs': 129, 'loss': 'mse', 'optimizer': 'adam', 'graph_mode': 'cutoff', 'cutoff': 0.8277130527426049, 'grm_norm': 'cosine_then_gcn', 'self_loops': True, 'use_snp_selection': False}. Best is trial 56 with value: 0.29526868984015453.
[I 2025-12-08 21:13:30,798] Trial 69 finished with value: 0.2649086884759317 and parameters: {'model_type': 'gcn', 'hidden_dims': '[512, 128]', 'dropout': 0.2226061706861586, 'batch_norm': True, 'lr': 2.2202125099363325e-05, 'weight_decay': 2.159901050718236e-05, 'epochs': 170, 'loss': 'mse', 'optimizer': 'adam', 'graph_mode': 'cutoff', 'cutoff': 0.8121975952342215, 'grm_norm': 'none', 'self_loops': False, 'use_snp_selection': False}. Best is trial 56 with value: 0.29526868984015453.
[I 2025-12-08 21:14:00,402] Trial 70 finished with value: 0.27771012221760005 and parameters: {'model_type': 'gcn', 'hidden_dims': '[512, 64]', 'dropout': 0.29617621865062727, 'batch_norm': True, 'lr': 3.7034419896917094e-05, 'weight_decay': 1.2108402471691906e-05, 'epochs': 111, 'loss': 'mse', 'optimizer': 'adam', 'graph_mode': 'cutoff', 'cutoff': 0.8655148433526891, 'grm_norm': 'cosine_then_gcn', 'self_loops': False, 'use_snp_selection': False}. Best is trial 56 with value: 0.29526868984015453.
[I 2025-12-08 21:14:13,487] Trial 71 finished with value: 0.2704645078846243 and parameters: {'model_type': 'gcn', 'hidden_dims': '[512, 256]', 'dropout': 0.33583542114822923, 'batch_norm': True, 'lr': 0.0006249182766970666, 'weight_decay': 4.448138302806017e-06, 'epochs': 79, 'loss': 'mae', 'optimizer': 'adam', 'graph_mode': 'cutoff', 'cutoff': 0.5659903468066557, 'grm_norm': 'cosine_then_gcn', 'self_loops': False, 'use_snp_selection': True, 'num_snps': 9892}. Best is trial 56 with value: 0.29526868984015453.
[I 2025-12-08 21:14:40,952] Trial 72 finished with value: 0.28623271791837585 and parameters: {'model_type': 'gcn', 'hidden_dims': '[512, 128]', 'dropout': 0.3774341315749834, 'batch_norm': True, 'lr': 0.003337067197558721, 'weight_decay': 4.394863167688189e-07, 'epochs': 102, 'loss': 'mse', 'optimizer': 'adam', 'graph_mode': 'cutoff', 'cutoff': 0.7619102246444692, 'grm_norm': 'cosine_then_gcn', 'self_loops': False, 'use_snp_selection': False}. Best is trial 56 with value: 0.29526868984015453.
