[I 2025-12-08 19:05:21,671] Trial 87 finished with value: 0.34259612114988824 and parameters: {'model_type': 'gcn', 'hidden_dims': '[256, 128, 64]', 'dropout': 0.15667244407946887, 'batch_norm': False, 'lr': 0.00025929246991155097, 'weight_decay': 8.314770645970707e-05, 'epochs': 56, 'loss': 'mae', 'optimizer': 'adam', 'graph_mode': 'cutoff', 'cutoff': 0.5334159076621598, 'grm_norm': 'none', 'self_loops': False, 'use_snp_selection': True, 'num_snps': 23390}. Best is trial 73 with value: 0.36806197678801444.
[I 2025-12-08 19:05:37,109] Trial 88 finished with value: 0.3391662980725297 and parameters: {'model_type': 'gcn', 'hidden_dims': '[256, 128, 64]', 'dropout': 0.19173960243813007, 'batch_norm': False, 'lr': 1.7342606493592057e-05, 'weight_decay': 8.70479472366768e-06, 'epochs': 87, 'loss': 'mae', 'optimizer': 'adam', 'graph_mode': 'cutoff', 'cutoff': 0.6214219161349271, 'grm_norm': 'cosine', 'self_loops': False, 'use_snp_selection': True, 'num_snps': 20517}. Best is trial 73 with value: 0.36806197678801444.
[I 2025-12-08 19:05:49,199] Trial 89 finished with value: 0.13103274267418485 and parameters: {'model_type': 'gcn', 'hidden_dims': '[128, 64]', 'dropout': 0.5308197272666769, 'batch_norm': False, 'lr': 0.0009650951197773672, 'weight_decay': 1.970305448946619e-05, 'epochs': 66, 'loss': 'mae', 'optimizer': 'adam', 'graph_mode': 'cutoff', 'cutoff': 0.6548616107739172, 'grm_norm': 'none', 'self_loops': False, 'use_snp_selection': True, 'num_snps': 17571}. Best is trial 73 with value: 0.36806197678801444.
[I 2025-12-08 19:06:01,047] Trial 90 finished with value: 0.35286298120692383 and parameters: {'model_type': 'gcn', 'hidden_dims': '[256, 128, 64]', 'dropout': 0.13321722857884868, 'batch_norm': False, 'lr': 0.00022251702064573427, 'weight_decay': 0.00012749233314319328, 'epochs': 81, 'loss': 'mae', 'optimizer': 'adam', 'graph_mode': 'cutoff', 'cutoff': 0.5958656148427648, 'grm_norm': 'none', 'self_loops': False, 'use_snp_selection': False}. Best is trial 73 with value: 0.36806197678801444.
[I 2025-12-08 19:06:18,815] Trial 91 finished with value: 0.3577710693039024 and parameters: {'model_type': 'gcn', 'hidden_dims': '[512, 256]', 'dropout': 0.16400422949499158, 'batch_norm': False, 'lr': 0.0003444025230140438, 'weight_decay': 5.2240993139363684e-05, 'epochs': 73, 'loss': 'mae', 'optimizer': 'adam', 'graph_mode': 'cutoff', 'cutoff': 0.8751827155760344, 'grm_norm': 'none', 'self_loops': False, 'use_snp_selection': True, 'num_snps': 22149}. Best is trial 73 with value: 0.36806197678801444.
[I 2025-12-08 19:06:36,382] Trial 92 finished with value: 0.36195741033857703 and parameters: {'model_type': 'gcn', 'hidden_dims': '[512, 256]', 'dropout': 0.1690167513030114, 'batch_norm': False, 'lr': 0.0003630621137150423, 'weight_decay': 4.230700652283835e-05, 'epochs': 72, 'loss': 'mae', 'optimizer': 'adam', 'graph_mode': 'cutoff', 'cutoff': 0.8744153849395009, 'grm_norm': 'none', 'self_loops': False, 'use_snp_selection': True, 'num_snps': 21786}. Best is trial 73 with value: 0.36806197678801444.
[I 2025-12-08 19:06:55,509] Trial 93 finished with value: 0.36018445615593386 and parameters: {'model_type': 'gcn', 'hidden_dims': '[512, 256]', 'dropout': 0.16767412762112766, 'batch_norm': False, 'lr': 0.0001742073204676569, 'weight_decay': 5.751849068737805e-05, 'epochs': 71, 'loss': 'mae', 'optimizer': 'adam', 'graph_mode': 'cutoff', 'cutoff': 0.8782896278064548, 'grm_norm': 'none', 'self_loops': False, 'use_snp_selection': True, 'num_snps': 25810}. Best is trial 73 with value: 0.36806197678801444.
[I 2025-12-08 19:07:16,098] Trial 94 finished with value: 0.35928132024582266 and parameters: {'model_type': 'gcn', 'hidden_dims': '[512, 256]', 'dropout': 0.16941212775773126, 'batch_norm': False, 'lr': 0.00016514684429517427, 'weight_decay': 5.7370322522760074e-05, 'epochs': 72, 'loss': 'mae', 'optimizer': 'adam', 'graph_mode': 'cutoff', 'cutoff': 0.8765042133347947, 'grm_norm': 'none', 'self_loops': False, 'use_snp_selection': True, 'num_snps': 28952}. Best is trial 73 with value: 0.36806197678801444.
[I 2025-12-08 19:07:35,781] Trial 95 finished with value: 0.3569539189743196 and parameters: {'model_type': 'gcn', 'hidden_dims': '[512, 256]', 'dropout': 0.12009625294011042, 'batch_norm': False, 'lr': 0.00016169294023884185, 'weight_decay': 9.906492603659147e-05, 'epochs': 73, 'loss': 'mae', 'optimizer': 'adam', 'graph_mode': 'cutoff', 'cutoff': 0.8749829783367943, 'grm_norm': 'none', 'self_loops': False, 'use_snp_selection': True, 'num_snps': 26416}. Best is trial 73 with value: 0.36806197678801444.
[I 2025-12-08 19:07:55,366] Trial 96 finished with value: 0.3584756507232329 and parameters: {'model_type': 'gcn', 'hidden_dims': '[512, 256]', 'dropout': 0.17005790358993644, 'batch_norm': False, 'lr': 0.0001665484398919996, 'weight_decay': 5.982808660946691e-05, 'epochs': 72, 'loss': 'mae', 'optimizer': 'adam', 'graph_mode': 'cutoff', 'cutoff': 0.8702470377118545, 'grm_norm': 'none', 'self_loops': False, 'use_snp_selection': True, 'num_snps': 26477}. Best is trial 73 with value: 0.36806197678801444.
[I 2025-12-08 19:08:13,150] Trial 97 finished with value: 0.33243021088086305 and parameters: {'model_type': 'gcn', 'hidden_dims': '[512, 256]', 'dropout': 0.17207902352545024, 'batch_norm': False, 'lr': 8.876331259876274e-05, 'weight_decay': 6.943825627620009e-05, 'epochs': 46, 'loss': 'mae', 'optimizer': 'adam', 'graph_mode': 'cutoff', 'cutoff': 0.8739355892493854, 'grm_norm': 'none', 'self_loops': False, 'use_snp_selection': True, 'num_snps': 29051}. Best is trial 73 with value: 0.36806197678801444.
[I 2025-12-08 19:08:33,745] Trial 98 finished with value: 0.33978835572150634 and parameters: {'model_type': 'gcn', 'hidden_dims': '[512, 256]', 'dropout': 0.16256730511005435, 'batch_norm': False, 'lr': 0.00010686330107502489, 'weight_decay': 5.52365908326308e-05, 'epochs': 71, 'loss': 'mae', 'optimizer': 'adam', 'graph_mode': 'knn', 'knn_k': 2, 'weighted_edges': False, 'symmetrize_mode': 'union', 'self_loops': False, 'use_snp_selection': True, 'num_snps': 27745}. Best is trial 73 with value: 0.36806197678801444.
[I 2025-12-08 19:09:26,552] Trial 99 finished with value: 0.351361965287124 and parameters: {'model_type': 'gcn', 'hidden_dims': '[512, 256]', 'dropout': 0.21224455894391867, 'batch_norm': True, 'lr': 0.00013825756272934254, 'weight_decay': 4.463573668822072e-05, 'epochs': 348, 'loss': 'mae', 'optimizer': 'adam', 'graph_mode': 'cutoff', 'cutoff': 0.8756538147768769, 'grm_norm': 'none', 'self_loops': False, 'use_snp_selection': True, 'num_snps': 29708}. Best is trial 73 with value: 0.36806197678801444.
[I 2025-12-08 19:09:44,050] Trial 100 finished with value: 0.3464561703876578 and parameters: {'model_type': 'gcn', 'hidden_dims': '[512, 256]', 'dropout': 0.19728764048270958, 'batch_norm': False, 'lr': 0.0001809066217613297, 'weight_decay': 0.00016700827709903345, 'epochs': 56, 'loss': 'mae', 'optimizer': 'adam', 'graph_mode': 'cutoff', 'cutoff': 0.8870461684635799, 'grm_norm': 'none', 'self_loops': False, 'use_snp_selection': True, 'num_snps': 25405}. Best is trial 73 with value: 0.36806197678801444.
[I 2025-12-08 19:10:03,690] Trial 101 finished with value: 0.35275693749812687 and parameters: {'model_type': 'gcn', 'hidden_dims': '[512, 256]', 'dropout': 0.14689234679611948, 'batch_norm': False, 'lr': 0.0001256076247876777, 'weight_decay': 0.00010458440088115537, 'epochs': 71, 'loss': 'mae', 'optimizer': 'adam', 'graph_mode': 'cutoff', 'cutoff': 0.8660201834235967, 'grm_norm': 'none', 'self_loops': False, 'use_snp_selection': True, 'num_snps': 26893}. Best is trial 73 with value: 0.36806197678801444.
[I 2025-12-08 19:10:23,997] Trial 102 finished with value: 0.36562793956084577 and parameters: {'model_type': 'gcn', 'hidden_dims': '[512, 256]', 'dropout': 0.11793783760700363, 'batch_norm': False, 'lr': 0.00016514599082935382, 'weight_decay': 7.5873803911712e-05, 'epochs': 79, 'loss': 'mae', 'optimizer': 'adam', 'graph_mode': 'cutoff', 'cutoff': 0.8271592319946383, 'grm_norm': 'none', 'self_loops': False, 'use_snp_selection': True, 'num_snps': 26341}. Best is trial 73 with value: 0.36806197678801444.
[I 2025-12-08 19:10:43,615] Trial 103 finished with value: 0.3550120936040816 and parameters: {'model_type': 'gcn', 'hidden_dims': '[512, 256]', 'dropout': 0.1732097139231982, 'batch_norm': False, 'lr': 0.00015197017049449027, 'weight_decay': 7.45209225492761e-05, 'epochs': 80, 'loss': 'mae', 'optimizer': 'adam', 'graph_mode': 'cutoff', 'cutoff': 0.8018640557084014, 'grm_norm': 'none', 'self_loops': False, 'use_snp_selection': True, 'num_snps': 24696}. Best is trial 73 with value: 0.36806197678801444.
[I 2025-12-08 19:11:00,977] Trial 104 finished with value: 0.3533815496763993 and parameters: {'model_type': 'gcn', 'hidden_dims': '[512, 256]', 'dropout': 0.1016397606577984, 'batch_norm': False, 'lr': 0.00023378206531725703, 'weight_decay': 5.249275046972124e-05, 'epochs': 60, 'loss': 'mae', 'optimizer': 'adam', 'graph_mode': 'cutoff', 'cutoff': 0.8286558807677827, 'grm_norm': 'none', 'self_loops': False, 'use_snp_selection': True, 'num_snps': 23999}. Best is trial 73 with value: 0.36806197678801444.
[I 2025-12-08 19:11:19,543] Trial 105 finished with value: 0.3102224727241783 and parameters: {'model_type': 'gcn', 'hidden_dims': '[512, 256]', 'dropout': 0.1393575003472728, 'batch_norm': False, 'lr': 0.00020149555529438566, 'weight_decay': 6.048965601783205e-05, 'epochs': 46, 'loss': 'mae', 'optimizer': 'adam', 'graph_mode': 'cutoff', 'cutoff': 0.8877189403505484, 'grm_norm': 'none', 'self_loops': False, 'use_snp_selection': True, 'num_snps': 31120}. Best is trial 73 with value: 0.36806197678801444.
[I 2025-12-08 19:12:07,030] Trial 106 finished with value: 0.3508791430456938 and parameters: {'model_type': 'gcn', 'hidden_dims': '[512, 128]', 'dropout': 0.1654195044710831, 'batch_norm': False, 'lr': 6.786912371469404e-05, 'weight_decay': 0.00012270085682726363, 'epochs': 325, 'loss': 'mae', 'optimizer': 'adam', 'graph_mode': 'cutoff', 'cutoff': 0.898018732128972, 'grm_norm': 'cosine_then_gcn', 'self_loops': False, 'use_snp_selection': True, 'num_snps': 27919}. Best is trial 73 with value: 0.36806197678801444.
[I 2025-12-08 19:12:41,891] Trial 107 finished with value: 0.3565204999654481 and parameters: {'model_type': 'gcn', 'hidden_dims': '[512, 256]', 'dropout': 0.15481099966822404, 'batch_norm': False, 'lr': 0.000279231257861676, 'weight_decay': 3.9783015312020256e-05, 'epochs': 82, 'loss': 'mae', 'optimizer': 'adam', 'graph_mode': 'cutoff', 'cutoff': 0.838360085738603, 'grm_norm': 'none', 'self_loops': False, 'use_snp_selection': True, 'num_snps': 57487}. Best is trial 73 with value: 0.36806197678801444.
[I 2025-12-08 19:12:56,963] Trial 108 finished with value: 0.33655101235077345 and parameters: {'model_type': 'gcn', 'hidden_dims': '[512, 256]', 'dropout': 0.18101844439973275, 'batch_norm': False, 'lr': 0.00011437674236392115, 'weight_decay': 8.399785738349127e-05, 'epochs': 52, 'loss': 'mae', 'optimizer': 'adam', 'graph_mode': 'cutoff', 'cutoff': 0.8588870270923241, 'grm_norm': 'gcn', 'self_loops': False, 'use_snp_selection': True, 'num_snps': 19438}. Best is trial 73 with value: 0.36806197678801444.
[I 2025-12-08 19:13:23,558] Trial 109 finished with value: 0.3579577159028736 and parameters: {'model_type': 'gcn', 'hidden_dims': '[512, 256]', 'dropout': 0.11293810197146233, 'batch_norm': False, 'lr': 0.00017758495784910561, 'weight_decay': 0.0002519891944499251, 'epochs': 107, 'loss': 'mae', 'optimizer': 'adam', 'graph_mode': 'cutoff', 'cutoff': 0.8081187771003576, 'grm_norm': 'cosine', 'self_loops': False, 'use_snp_selection': True, 'num_snps': 32653}. Best is trial 73 with value: 0.36806197678801444.
[I 2025-12-08 19:13:38,772] Trial 110 finished with value: 0.3635861509721074 and parameters: {'model_type': 'gcn', 'hidden_dims': '[256, 128, 64]', 'dropout': 0.10988859534815312, 'batch_norm': False, 'lr': 0.0001600609867143363, 'weight_decay': 0.00014319939091081562, 'epochs': 108, 'loss': 'mae', 'optimizer': 'adam', 'graph_mode': 'cutoff', 'cutoff': 0.8025877719836387, 'grm_norm': 'cosine', 'self_loops': True, 'use_snp_selection': False}. Best is trial 73 with value: 0.36806197678801444.
[I 2025-12-08 19:13:54,106] Trial 111 finished with value: 0.35533693614073264 and parameters: {'model_type': 'gcn', 'hidden_dims': '[256, 128, 64]', 'dropout': 0.11580090919087925, 'batch_norm': False, 'lr': 0.000175287155716161, 'weight_decay': 0.0002471464749676402, 'epochs': 109, 'loss': 'mae', 'optimizer': 'adam', 'graph_mode': 'cutoff', 'cutoff': 0.8137128122474998, 'grm_norm': 'cosine', 'self_loops': True, 'use_snp_selection': False}. Best is trial 73 with value: 0.36806197678801444.
[I 2025-12-08 19:14:07,735] Trial 112 finished with value: 0.35568946361020454 and parameters: {'model_type': 'gcn', 'hidden_dims': '[256, 128, 64]', 'dropout': 0.14812765789689294, 'batch_norm': False, 'lr': 0.00014739687256419548, 'weight_decay': 0.000160897021488302, 'epochs': 95, 'loss': 'mae', 'optimizer': 'adam', 'graph_mode': 'cutoff', 'cutoff': 0.8292485486874093, 'grm_norm': 'cosine', 'self_loops': True, 'use_snp_selection': False}. Best is trial 73 with value: 0.36806197678801444.
[I 2025-12-08 19:14:22,317] Trial 113 finished with value: 0.35273946289293623 and parameters: {'model_type': 'gcn', 'hidden_dims': '[256, 128, 64]', 'dropout': 0.10918045697898898, 'batch_norm': False, 'lr': 0.00019876656874648075, 'weight_decay': 0.0003359069063941625, 'epochs': 103, 'loss': 'mae', 'optimizer': 'adam', 'graph_mode': 'cutoff', 'cutoff': 0.795448544366091, 'grm_norm': 'cosine', 'self_loops': True, 'use_snp_selection': False}. Best is trial 73 with value: 0.36806197678801444.
[I 2025-12-08 19:14:35,369] Trial 114 finished with value: 0.35291125466960416 and parameters: {'model_type': 'gcn', 'hidden_dims': '[256, 128, 64]', 'dropout': 0.13859344642564883, 'batch_norm': False, 'lr': 9.510792259375099e-05, 'weight_decay': 0.0005379533529734332, 'epochs': 90, 'loss': 'mae', 'optimizer': 'adam', 'graph_mode': 'cutoff', 'cutoff': 0.7770392151127776, 'grm_norm': 'cosine', 'self_loops': True, 'use_snp_selection': False}. Best is trial 73 with value: 0.36806197678801444.
[I 2025-12-08 19:14:56,075] Trial 115 finished with value: 0.33156579915299444 and parameters: {'model_type': 'gcn', 'hidden_dims': '[128, 64]', 'dropout': 0.12052841992916859, 'batch_norm': False, 'lr': 0.00025451494845687, 'weight_decay': 3.18252554389127e-05, 'epochs': 280, 'loss': 'mae', 'optimizer': 'adam', 'graph_mode': 'cutoff', 'cutoff': 0.8476883989221089, 'grm_norm': 'cosine', 'self_loops': True, 'use_snp_selection': False}. Best is trial 73 with value: 0.36806197678801444.
[I 2025-12-08 19:15:36,270] Trial 116 finished with value: 0.33381632601369976 and parameters: {'model_type': 'gcn', 'hidden_dims': '[512, 256]', 'dropout': 0.1010001741634237, 'batch_norm': False, 'lr': 0.00013854429524041856, 'weight_decay': 0.00023812953740214642, 'epochs': 218, 'loss': 'mae', 'optimizer': 'adam', 'graph_mode': 'cutoff', 'cutoff': 0.3739527961792144, 'grm_norm': 'cosine', 'self_loops': False, 'use_snp_selection': True, 'num_snps': 31629}. Best is trial 73 with value: 0.36806197678801444.
[I 2025-12-08 19:16:06,234] Trial 117 finished with value: 0.33942152934290876 and parameters: {'model_type': 'gcn', 'hidden_dims': '[512, 256]', 'dropout': 0.5679168490658013, 'batch_norm': False, 'lr': 0.00017641594488362216, 'weight_decay': 6.608591785862308e-05, 'epochs': 131, 'loss': 'mse', 'optimizer': 'adam', 'graph_mode': 'knn', 'knn_k': 4, 'weighted_edges': True, 'symmetrize_mode': 'mutual', 'self_loops': False, 'use_snp_selection': True, 'num_snps': 32791}. Best is trial 73 with value: 0.36806197678801444.
[I 2025-12-08 19:16:24,975] Trial 118 finished with value: 0.3590798409121723 and parameters: {'model_type': 'gcn', 'hidden_dims': '[512, 128]', 'dropout': 0.1360148454290272, 'batch_norm': False, 'lr': 8.126242204821106e-05, 'weight_decay': 4.2160837919721994e-05, 'epochs': 63, 'loss': 'mae', 'optimizer': 'adam', 'graph_mode': 'cutoff', 'cutoff': 0.8156117859497425, 'grm_norm': 'cosine', 'self_loops': False, 'use_snp_selection': True, 'num_snps': 26272}. Best is trial 73 with value: 0.36806197678801444.
[I 2025-12-08 19:16:43,703] Trial 119 finished with value: 0.3349248674128916 and parameters: {'model_type': 'gcn', 'hidden_dims': '[512, 128]', 'dropout': 0.13601320892598295, 'batch_norm': True, 'lr': 7.345918608451636e-05, 'weight_decay': 4.2555876890846734e-05, 'epochs': 65, 'loss': 'mae', 'optimizer': 'adam', 'graph_mode': 'cutoff', 'cutoff': 0.8535258586034715, 'grm_norm': 'cosine', 'self_loops': True, 'use_snp_selection': False}. Best is trial 73 with value: 0.36806197678801444.
[I 2025-12-08 19:16:56,231] Trial 120 finished with value: 0.294592920552296 and parameters: {'model_type': 'gcn', 'hidden_dims': '[512, 128]', 'dropout': 0.19734293594537386, 'batch_norm': False, 'lr': 4.875536661274258e-05, 'weight_decay': 0.00010877755400861878, 'epochs': 40, 'loss': 'mae', 'optimizer': 'adam', 'graph_mode': 'cutoff', 'cutoff': 0.8258194324341526, 'grm_norm': 'none', 'self_loops': False, 'use_snp_selection': True, 'num_snps': 15049}. Best is trial 73 with value: 0.36806197678801444.
[I 2025-12-08 19:17:18,282] Trial 121 finished with value: 0.35227331613753643 and parameters: {'model_type': 'gcn', 'hidden_dims': '[512, 128]', 'dropout': 0.14939684123849806, 'batch_norm': False, 'lr': 5.7093246205025894e-05, 'weight_decay': 8.385193363970912e-05, 'epochs': 80, 'loss': 'mae', 'optimizer': 'adam', 'graph_mode': 'cutoff', 'cutoff': 0.8112993357067165, 'grm_norm': 'cosine', 'self_loops': False, 'use_snp_selection': True, 'num_snps': 29956}. Best is trial 73 with value: 0.36806197678801444.
[I 2025-12-08 19:17:40,349] Trial 122 finished with value: 0.36191424377844034 and parameters: {'model_type': 'gcn', 'hidden_dims': '[512, 128]', 'dropout': 0.49592959706324463, 'batch_norm': False, 'lr': 0.000125314134528107, 'weight_decay': 3.053309502167099e-05, 'epochs': 101, 'loss': 'mae', 'optimizer': 'adam', 'graph_mode': 'cutoff', 'cutoff': 0.860750601798221, 'grm_norm': 'cosine', 'self_loops': False, 'use_snp_selection': True, 'num_snps': 25760}. Best is trial 73 with value: 0.36806197678801444.
[I 2025-12-08 19:17:58,771] Trial 123 finished with value: 0.34233126502562555 and parameters: {'model_type': 'gcn', 'hidden_dims': '[512, 128]', 'dropout': 0.4750404004687974, 'batch_norm': False, 'lr': 9.842725852466519e-05, 'weight_decay': 2.665737671677163e-05, 'epochs': 61, 'loss': 'mae', 'optimizer': 'adam', 'graph_mode': 'cutoff', 'cutoff': 0.8831694686448939, 'grm_norm': 'cosine', 'self_loops': False, 'use_snp_selection': True, 'num_snps': 26095}. Best is trial 73 with value: 0.36806197678801444.
[I 2025-12-08 19:18:19,775] Trial 124 finished with value: 0.35655470241843235 and parameters: {'model_type': 'gcn', 'hidden_dims': '[512, 128]', 'dropout': 0.48927415996565365, 'batch_norm': False, 'lr': 0.00023063635409606664, 'weight_decay': 3.8734773631352006e-05, 'epochs': 100, 'loss': 'mae', 'optimizer': 'adam', 'graph_mode': 'cutoff', 'cutoff': 0.8628589429044231, 'grm_norm': 'cosine', 'self_loops': False, 'use_snp_selection': True, 'num_snps': 23791}. Best is trial 73 with value: 0.36806197678801444.
[I 2025-12-08 19:18:40,846] Trial 125 finished with value: 0.35958638120346975 and parameters: {'model_type': 'gcn', 'hidden_dims': '[512, 128]', 'dropout': 0.4993818171410179, 'batch_norm': False, 'lr': 0.00012164155648423403, 'weight_decay': 4.7922012184916365e-05, 'epochs': 77, 'loss': 'mae', 'optimizer': 'adam', 'graph_mode': 'cutoff', 'cutoff': 0.8356889222689383, 'grm_norm': 'cosine', 'self_loops': False, 'use_snp_selection': True, 'num_snps': 28533}. Best is trial 73 with value: 0.36806197678801444.
[I 2025-12-08 19:19:02,619] Trial 126 finished with value: 0.3608905455835266 and parameters: {'model_type': 'gcn', 'hidden_dims': '[512, 128]', 'dropout': 0.5023051876826169, 'batch_norm': False, 'lr': 8.50458241561625e-05, 'weight_decay': 3.105927418280694e-05, 'epochs': 84, 'loss': 'mae', 'optimizer': 'adam', 'graph_mode': 'cutoff', 'cutoff': 0.8384189446057243, 'grm_norm': 'cosine', 'self_loops': False, 'use_snp_selection': True, 'num_snps': 28454}. Best is trial 73 with value: 0.36806197678801444.
[I 2025-12-08 19:19:25,269] Trial 127 finished with value: 0.35828308677682574 and parameters: {'model_type': 'gcn', 'hidden_dims': '[512, 128]', 'dropout': 0.4999080856492012, 'batch_norm': False, 'lr': 0.00012461282914835774, 'weight_decay': 3.168484175969798e-05, 'epochs': 91, 'loss': 'mae', 'optimizer': 'adam', 'graph_mode': 'cutoff', 'cutoff': 0.838482961977454, 'grm_norm': 'cosine', 'self_loops': False, 'use_snp_selection': True, 'num_snps': 28850}. Best is trial 73 with value: 0.36806197678801444.
[I 2025-12-08 19:19:44,807] Trial 128 finished with value: 0.34622650691007856 and parameters: {'model_type': 'gcn', 'hidden_dims': '[512, 128]', 'dropout': 0.5231820669124998, 'batch_norm': False, 'lr': 9.165183076462042e-05, 'weight_decay': 4.530086906679619e-05, 'epochs': 77, 'loss': 'mae', 'optimizer': 'adam', 'graph_mode': 'cutoff', 'cutoff': 0.7927751646328418, 'grm_norm': 'cosine', 'self_loops': False, 'use_snp_selection': True, 'num_snps': 25222}. Best is trial 73 with value: 0.36806197678801444.
[I 2025-12-08 19:20:05,893] Trial 129 finished with value: 0.3563959286069392 and parameters: {'model_type': 'gcn', 'hidden_dims': '[512, 128]', 'dropout': 0.5090542648239502, 'batch_norm': False, 'lr': 8.449996837604854e-05, 'weight_decay': 7.673707545527544e-05, 'epochs': 84, 'loss': 'mae', 'optimizer': 'adam', 'graph_mode': 'cutoff', 'cutoff': 0.8303041157787951, 'grm_norm': 'cosine', 'self_loops': False, 'use_snp_selection': True, 'num_snps': 27125}. Best is trial 73 with value: 0.36806197678801444.
