[I 2025-12-08 19:28:19,557] Trial 94 finished with value: 0.3160553614904426 and parameters: {'model_type': 'gcn', 'hidden_dims': '[512, 256]', 'dropout': 0.4293400917583541, 'batch_norm': True, 'lr': 0.0040063035257360425, 'weight_decay': 2.1590983843808488e-07, 'epochs': 266, 'loss': 'mse', 'optimizer': 'adam', 'graph_mode': 'cutoff', 'cutoff': 0.7909844603447654, 'grm_norm': 'cosine_then_gcn', 'self_loops': True, 'use_snp_selection': False}. Best is trial 83 with value: 0.318887468710363.
[I 2025-12-08 19:29:25,421] Trial 95 finished with value: 0.31488895070698086 and parameters: {'model_type': 'gcn', 'hidden_dims': '[512, 256]', 'dropout': 0.4157010359886448, 'batch_norm': True, 'lr': 0.006171214679880883, 'weight_decay': 3.084904928735029e-07, 'epochs': 244, 'loss': 'mse', 'optimizer': 'adam', 'graph_mode': 'cutoff', 'cutoff': 0.8637981255369207, 'grm_norm': 'cosine_then_gcn', 'self_loops': True, 'use_snp_selection': False}. Best is trial 83 with value: 0.318887468710363.
[I 2025-12-08 19:30:43,315] Trial 96 finished with value: 0.31480532541925305 and parameters: {'model_type': 'gcn', 'hidden_dims': '[512, 256]', 'dropout': 0.4435388353653786, 'batch_norm': True, 'lr': 0.0067956106477449285, 'weight_decay': 1.2328173398760226e-07, 'epochs': 256, 'loss': 'mse', 'optimizer': 'adam', 'graph_mode': 'cutoff', 'cutoff': 0.8831612067077679, 'grm_norm': 'cosine_then_gcn', 'self_loops': True, 'use_snp_selection': True, 'num_snps': 59399}. Best is trial 83 with value: 0.318887468710363.
[I 2025-12-08 19:31:46,115] Trial 97 finished with value: 0.3138648847136638 and parameters: {'model_type': 'gcn', 'hidden_dims': '[512, 256]', 'dropout': 0.2949908016715279, 'batch_norm': True, 'lr': 0.004871512485829266, 'weight_decay': 1.784696356121664e-07, 'epochs': 228, 'loss': 'mse', 'optimizer': 'adam', 'graph_mode': 'cutoff', 'cutoff': 0.8234383179077629, 'grm_norm': 'cosine_then_gcn', 'self_loops': True, 'use_snp_selection': False}. Best is trial 83 with value: 0.318887468710363.
[I 2025-12-08 19:33:03,531] Trial 98 finished with value: 0.20042071804074163 and parameters: {'model_type': 'gcn', 'hidden_dims': '[512, 64]', 'dropout': 0.3526411223013759, 'batch_norm': True, 'lr': 0.007995054911412048, 'weight_decay': 5.238768747193197e-07, 'epochs': 290, 'loss': 'mse', 'optimizer': 'adam', 'graph_mode': 'knn', 'knn_k': 2, 'weighted_edges': True, 'symmetrize_mode': 'mutual', 'self_loops': True, 'use_snp_selection': False}. Best is trial 83 with value: 0.318887468710363.
[I 2025-12-08 19:34:08,589] Trial 99 finished with value: 0.03836305490109575 and parameters: {'model_type': 'gcn', 'hidden_dims': '[512, 256]', 'dropout': 0.39211588763906985, 'batch_norm': False, 'lr': 0.0020025251743582472, 'weight_decay': 2.41319188408389e-07, 'epochs': 246, 'loss': 'mse', 'optimizer': 'adam', 'graph_mode': 'cutoff', 'cutoff': 0.8466839585713497, 'grm_norm': 'cosine', 'self_loops': True, 'use_snp_selection': False}. Best is trial 83 with value: 0.318887468710363.
[I 2025-12-08 19:34:53,483] Trial 100 finished with value: 0.3123684107251116 and parameters: {'model_type': 'gcn', 'hidden_dims': '[256, 128, 64]', 'dropout': 0.3651595601428736, 'batch_norm': True, 'lr': 0.0033545697228809074, 'weight_decay': 4.0787554362132154e-07, 'epochs': 329, 'loss': 'mse', 'optimizer': 'adam', 'graph_mode': 'cutoff', 'cutoff': 0.8988242440728318, 'grm_norm': 'cosine_then_gcn', 'self_loops': True, 'use_snp_selection': False}. Best is trial 83 with value: 0.318887468710363.
[I 2025-12-08 19:35:55,929] Trial 101 finished with value: 0.31225373178983656 and parameters: {'model_type': 'gcn', 'hidden_dims': '[512, 128]', 'dropout': 0.4710275858785035, 'batch_norm': True, 'lr': 0.008751230991636199, 'weight_decay': 1.7615125654902008e-07, 'epochs': 236, 'loss': 'mse', 'optimizer': 'adam', 'graph_mode': 'cutoff', 'cutoff': 0.8617172180877269, 'grm_norm': 'cosine_then_gcn', 'self_loops': True, 'use_snp_selection': False}. Best is trial 83 with value: 0.318887468710363.
[I 2025-12-08 19:36:56,666] Trial 102 finished with value: 0.31329078222529766 and parameters: {'model_type': 'gcn', 'hidden_dims': '[512, 128]', 'dropout': 0.3425158734957825, 'batch_norm': True, 'lr': 0.005499432103805991, 'weight_decay': 1.4334095212133122e-07, 'epochs': 230, 'loss': 'mse', 'optimizer': 'adam', 'graph_mode': 'cutoff', 'cutoff': 0.8793325146127768, 'grm_norm': 'cosine_then_gcn', 'self_loops': True, 'use_snp_selection': False}. Best is trial 83 with value: 0.318887468710363.
[I 2025-12-08 19:38:10,644] Trial 103 finished with value: 0.31712291465006837 and parameters: {'model_type': 'gcn', 'hidden_dims': '[512, 128]', 'dropout': 0.5055451446829188, 'batch_norm': True, 'lr': 0.00974476007496258, 'weight_decay': 1.405349694786937e-07, 'epochs': 284, 'loss': 'mse', 'optimizer': 'adam', 'graph_mode': 'cutoff', 'cutoff': 0.8085822414088948, 'grm_norm': 'cosine_then_gcn', 'self_loops': True, 'use_snp_selection': False}. Best is trial 83 with value: 0.318887468710363.
[I 2025-12-08 19:39:24,146] Trial 104 finished with value: 0.3163364227172426 and parameters: {'model_type': 'gcn', 'hidden_dims': '[512, 128]', 'dropout': 0.46240498271808006, 'batch_norm': True, 'lr': 0.007115475146527322, 'weight_decay': 3.2085720979407085e-07, 'epochs': 284, 'loss': 'mse', 'optimizer': 'adam', 'graph_mode': 'cutoff', 'cutoff': 0.8071624139400841, 'grm_norm': 'cosine_then_gcn', 'self_loops': True, 'use_snp_selection': False}. Best is trial 83 with value: 0.318887468710363.
[I 2025-12-08 19:40:41,339] Trial 105 finished with value: 0.31523640886465126 and parameters: {'model_type': 'gcn', 'hidden_dims': '[512, 128]', 'dropout': 0.4596461710113853, 'batch_norm': True, 'lr': 0.006765018472625014, 'weight_decay': 3.2329506278132725e-07, 'epochs': 299, 'loss': 'mse', 'optimizer': 'adam', 'graph_mode': 'cutoff', 'cutoff': 0.8047214677109096, 'grm_norm': 'cosine_then_gcn', 'self_loops': True, 'use_snp_selection': False}. Best is trial 83 with value: 0.318887468710363.
[I 2025-12-08 19:41:04,793] Trial 106 finished with value: 0.3149906744912533 and parameters: {'model_type': 'gcn', 'hidden_dims': '[128, 64]', 'dropout': 0.4261527463330879, 'batch_norm': True, 'lr': 0.0045088589152511935, 'weight_decay': 7.64290003586185e-07, 'epochs': 283, 'loss': 'mse', 'optimizer': 'adam', 'graph_mode': 'cutoff', 'cutoff': 0.7821389673253671, 'grm_norm': 'gcn', 'self_loops': True, 'use_snp_selection': False}. Best is trial 83 with value: 0.318887468710363.
[I 2025-12-08 19:42:25,037] Trial 107 finished with value: 0.3131946156586165 and parameters: {'model_type': 'gcn', 'hidden_dims': '[512, 128]', 'dropout': 0.48697275085845027, 'batch_norm': True, 'lr': 0.009944044568792899, 'weight_decay': 2.212582907323132e-07, 'epochs': 311, 'loss': 'mse', 'optimizer': 'adam', 'graph_mode': 'cutoff', 'cutoff': 0.8071078035888312, 'grm_norm': 'cosine_then_gcn', 'self_loops': True, 'use_snp_selection': False}. Best is trial 83 with value: 0.318887468710363.
[I 2025-12-08 19:43:39,974] Trial 108 finished with value: 0.3153253381171668 and parameters: {'model_type': 'gcn', 'hidden_dims': '[512, 128]', 'dropout': 0.40928485061061864, 'batch_norm': True, 'lr': 0.0076743130344161525, 'weight_decay': 6.059518181899135e-07, 'epochs': 288, 'loss': 'mse', 'optimizer': 'adam', 'graph_mode': 'cutoff', 'cutoff': 0.7608501400615685, 'grm_norm': 'cosine_then_gcn', 'self_loops': True, 'use_snp_selection': False}. Best is trial 83 with value: 0.318887468710363.
[I 2025-12-08 19:44:51,445] Trial 109 finished with value: 0.31348644256207325 and parameters: {'model_type': 'gcn', 'hidden_dims': '[512, 128]', 'dropout': 0.4422073299946852, 'batch_norm': True, 'lr': 0.005961531865992655, 'weight_decay': 2.728938322830626e-07, 'epochs': 274, 'loss': 'mse', 'optimizer': 'adam', 'graph_mode': 'cutoff', 'cutoff': 0.8421248353962383, 'grm_norm': 'cosine_then_gcn', 'self_loops': True, 'use_snp_selection': False}. Best is trial 83 with value: 0.318887468710363.
[I 2025-12-08 19:45:57,377] Trial 110 finished with value: 0.3114278126004267 and parameters: {'model_type': 'gcn', 'hidden_dims': '[512, 256]', 'dropout': 0.42383443665460324, 'batch_norm': True, 'lr': 0.00381653224499933, 'weight_decay': 1.0150027209491275e-06, 'epochs': 268, 'loss': 'mse', 'optimizer': 'adam', 'graph_mode': 'cutoff', 'cutoff': 0.7284740973140523, 'grm_norm': 'none', 'self_loops': True, 'use_snp_selection': True, 'num_snps': 48140}. Best is trial 83 with value: 0.318887468710363.
[I 2025-12-08 19:46:53,518] Trial 111 finished with value: 0.3186559708164282 and parameters: {'model_type': 'gcn', 'hidden_dims': '[512, 128]', 'dropout': 0.5125114335005851, 'batch_norm': True, 'lr': 0.00832487720756399, 'weight_decay': 1.5347801149231025e-07, 'epochs': 211, 'loss': 'mse', 'optimizer': 'adam', 'graph_mode': 'cutoff', 'cutoff': 0.8254323518408481, 'grm_norm': 'cosine_then_gcn', 'self_loops': True, 'use_snp_selection': False}. Best is trial 83 with value: 0.318887468710363.
[I 2025-12-08 19:47:49,658] Trial 112 finished with value: 0.3161317461108947 and parameters: {'model_type': 'gcn', 'hidden_dims': '[512, 128]', 'dropout': 0.5359771954537809, 'batch_norm': True, 'lr': 0.00556424264272417, 'weight_decay': 4.447948486305091e-07, 'epochs': 211, 'loss': 'mse', 'optimizer': 'adam', 'graph_mode': 'cutoff', 'cutoff': 0.8840147949259399, 'grm_norm': 'cosine_then_gcn', 'self_loops': True, 'use_snp_selection': False}. Best is trial 83 with value: 0.318887468710363.
[I 2025-12-08 19:49:05,247] Trial 113 finished with value: 0.31610597115019246 and parameters: {'model_type': 'gcn', 'hidden_dims': '[512, 128]', 'dropout': 0.5161271632108138, 'batch_norm': True, 'lr': 0.006975594504878404, 'weight_decay': 1.6098276816611908e-07, 'epochs': 293, 'loss': 'mse', 'optimizer': 'adam', 'graph_mode': 'cutoff', 'cutoff': 0.8641506328858953, 'grm_norm': 'cosine_then_gcn', 'self_loops': True, 'use_snp_selection': False}. Best is trial 83 with value: 0.318887468710363.
[I 2025-12-08 19:50:18,704] Trial 114 finished with value: 0.23830617757151354 and parameters: {'model_type': 'gcn', 'hidden_dims': '[512, 128]', 'dropout': 0.3795913376182227, 'batch_norm': True, 'lr': 0.008332157139699, 'weight_decay': 1.3447829511392986e-07, 'epochs': 279, 'loss': 'mse', 'optimizer': 'adam', 'graph_mode': 'cutoff', 'cutoff': 0.4597870372201491, 'grm_norm': 'cosine_then_gcn', 'self_loops': True, 'use_snp_selection': False}. Best is trial 83 with value: 0.318887468710363.
[I 2025-12-08 19:51:27,398] Trial 115 finished with value: 0.31792951428642646 and parameters: {'model_type': 'gcn', 'hidden_dims': '[512, 128]', 'dropout': 0.47455864772904405, 'batch_norm': True, 'lr': 0.00477548580578503, 'weight_decay': 3.5752275807736136e-07, 'epochs': 263, 'loss': 'mse', 'optimizer': 'adam', 'graph_mode': 'cutoff', 'cutoff': 0.8211513298320957, 'grm_norm': 'cosine_then_gcn', 'self_loops': True, 'use_snp_selection': False}. Best is trial 83 with value: 0.318887468710363.
[I 2025-12-08 19:52:33,119] Trial 116 finished with value: 0.3115360919358057 and parameters: {'model_type': 'gcn', 'hidden_dims': '[512, 128]', 'dropout': 0.5059972613646858, 'batch_norm': True, 'lr': 0.004618317384027731, 'weight_decay': 3.791574996381235e-07, 'epochs': 252, 'loss': 'mse', 'optimizer': 'adam', 'graph_mode': 'cutoff', 'cutoff': 0.8230960774059506, 'grm_norm': 'cosine_then_gcn', 'self_loops': True, 'use_snp_selection': False}. Best is trial 83 with value: 0.318887468710363.
[I 2025-12-08 19:52:48,521] Trial 117 finished with value: 0.25718102644866514 and parameters: {'model_type': 'gcn', 'hidden_dims': '[512, 128]', 'dropout': 0.47660358890350457, 'batch_norm': True, 'lr': 0.005073951751326264, 'weight_decay': 2.440431362188012e-07, 'epochs': 43, 'loss': 'mse', 'optimizer': 'adam', 'graph_mode': 'knn', 'knn_k': 9, 'weighted_edges': False, 'symmetrize_mode': 'union', 'self_loops': True, 'use_snp_selection': False}. Best is trial 83 with value: 0.318887468710363.
[I 2025-12-08 19:53:22,438] Trial 118 finished with value: 0.0048011312914762174 and parameters: {'model_type': 'gcn', 'hidden_dims': '[256, 128]', 'dropout': 0.3184138698070151, 'batch_norm': False, 'lr': 0.004019688841016589, 'weight_decay': 1.95440980040782e-07, 'epochs': 263, 'loss': 'mse', 'optimizer': 'adam', 'graph_mode': 'cutoff', 'cutoff': 0.8407974469471324, 'grm_norm': 'cosine', 'self_loops': True, 'use_snp_selection': False}. Best is trial 83 with value: 0.318887468710363.
[I 2025-12-08 19:54:19,945] Trial 119 finished with value: 0.31723794284175877 and parameters: {'model_type': 'gcn', 'hidden_dims': '[512, 256]', 'dropout': 0.3969244555733673, 'batch_norm': True, 'lr': 0.002708995698959729, 'weight_decay': 1.1961478038010333e-07, 'epochs': 219, 'loss': 'mse', 'optimizer': 'adam', 'graph_mode': 'cutoff', 'cutoff': 0.8604433233962892, 'grm_norm': 'cosine_then_gcn', 'self_loops': True, 'use_snp_selection': False}. Best is trial 83 with value: 0.318887468710363.
[I 2025-12-08 19:55:07,295] Trial 120 finished with value: 0.31459080381574206 and parameters: {'model_type': 'gcn', 'hidden_dims': '[512, 128]', 'dropout': 0.17281682037922244, 'batch_norm': True, 'lr': 0.003139024216223998, 'weight_decay': 1.5392062244991044e-06, 'epochs': 180, 'loss': 'mse', 'optimizer': 'adam', 'graph_mode': 'cutoff', 'cutoff': 0.7761952695093524, 'grm_norm': 'cosine_then_gcn', 'self_loops': True, 'use_snp_selection': False}. Best is trial 83 with value: 0.318887468710363.
[I 2025-12-08 19:56:03,868] Trial 121 finished with value: 0.31961821300847115 and parameters: {'model_type': 'gcn', 'hidden_dims': '[512, 256]', 'dropout': 0.40074017689070046, 'batch_norm': True, 'lr': 0.006305974975950723, 'weight_decay': 1.2263207378210907e-07, 'epochs': 217, 'loss': 'mse', 'optimizer': 'adam', 'graph_mode': 'cutoff', 'cutoff': 0.854419460742369, 'grm_norm': 'cosine_then_gcn', 'self_loops': True, 'use_snp_selection': False}. Best is trial 121 with value: 0.31961821300847115.
[I 2025-12-08 19:57:01,249] Trial 122 finished with value: 0.31545745728069924 and parameters: {'model_type': 'gcn', 'hidden_dims': '[512, 256]', 'dropout': 0.39722223529187356, 'batch_norm': True, 'lr': 0.006151564489048106, 'weight_decay': 1.2759955136415544e-07, 'epochs': 220, 'loss': 'mse', 'optimizer': 'adam', 'graph_mode': 'cutoff', 'cutoff': 0.8532238835041956, 'grm_norm': 'cosine_then_gcn', 'self_loops': True, 'use_snp_selection': False}. Best is trial 121 with value: 0.31961821300847115.
[I 2025-12-08 19:57:45,239] Trial 123 finished with value: 0.3162586986885033 and parameters: {'model_type': 'gcn', 'hidden_dims': '[512, 256]', 'dropout': 0.3838636549988749, 'batch_norm': True, 'lr': 0.002596629007606147, 'weight_decay': 1.5461660339360091e-07, 'epochs': 164, 'loss': 'mse', 'optimizer': 'adam', 'graph_mode': 'cutoff', 'cutoff': 0.8862492751921915, 'grm_norm': 'cosine_then_gcn', 'self_loops': True, 'use_snp_selection': False}. Best is trial 121 with value: 0.31961821300847115.
[I 2025-12-08 19:58:38,533] Trial 124 finished with value: 0.31590526883681896 and parameters: {'model_type': 'gcn', 'hidden_dims': '[512, 256]', 'dropout': 0.36328681185094974, 'batch_norm': True, 'lr': 0.008256977116393624, 'weight_decay': 2.7121223511584426e-07, 'epochs': 202, 'loss': 'mse', 'optimizer': 'adam', 'graph_mode': 'cutoff', 'cutoff': 0.8241937695042605, 'grm_norm': 'cosine_then_gcn', 'self_loops': True, 'use_snp_selection': False}. Best is trial 121 with value: 0.31961821300847115.
[I 2025-12-08 19:59:28,547] Trial 125 finished with value: 0.31371333520062167 and parameters: {'model_type': 'gcn', 'hidden_dims': '[512, 256]', 'dropout': 0.33543946963146737, 'batch_norm': True, 'lr': 0.009718738879311654, 'weight_decay': 2.0674023831346275e-07, 'epochs': 190, 'loss': 'mse', 'optimizer': 'adam', 'graph_mode': 'cutoff', 'cutoff': 0.8723065637659342, 'grm_norm': 'cosine_then_gcn', 'self_loops': True, 'use_snp_selection': False}. Best is trial 121 with value: 0.31961821300847115.
[I 2025-12-08 20:00:34,938] Trial 126 finished with value: 0.3152652361542964 and parameters: {'model_type': 'gcn', 'hidden_dims': '[512, 64]', 'dropout': 0.5223386456118816, 'batch_norm': True, 'lr': 0.0042239245213524556, 'weight_decay': 3.4334977996742768e-06, 'epochs': 260, 'loss': 'mse', 'optimizer': 'adam', 'graph_mode': 'cutoff', 'cutoff': 0.8372720350952372, 'grm_norm': 'cosine', 'self_loops': True, 'use_snp_selection': False}. Best is trial 121 with value: 0.31961821300847115.
[I 2025-12-08 20:01:44,497] Trial 127 finished with value: 0.31719700196561157 and parameters: {'model_type': 'gcn', 'hidden_dims': '[512, 128]', 'dropout': 0.3699981993606491, 'batch_norm': True, 'lr': 0.006431297757993478, 'weight_decay': 5.49606907693164e-07, 'epochs': 272, 'loss': 'mse', 'optimizer': 'adam', 'graph_mode': 'cutoff', 'cutoff': 0.8518928277728378, 'grm_norm': 'cosine_then_gcn', 'self_loops': True, 'use_snp_selection': False}. Best is trial 121 with value: 0.31961821300847115.
[I 2025-12-08 20:02:46,501] Trial 128 finished with value: 0.31442478708469046 and parameters: {'model_type': 'gcn', 'hidden_dims': '[512, 256]', 'dropout': 0.36932940186464785, 'batch_norm': True, 'lr': 0.004693018398345486, 'weight_decay': 5.651339872361661e-07, 'epochs': 240, 'loss': 'mse', 'optimizer': 'adam', 'graph_mode': 'cutoff', 'cutoff': 0.8527957693585573, 'grm_norm': 'cosine_then_gcn', 'self_loops': True, 'use_snp_selection': False}. Best is trial 121 with value: 0.31961821300847115.
[I 2025-12-08 20:03:42,174] Trial 129 finished with value: 0.31707240436446366 and parameters: {'model_type': 'gcn', 'hidden_dims': '[512, 128]', 'dropout': 0.35617434865636727, 'batch_norm': True, 'lr': 0.006435995549394142, 'weight_decay': 7.523795876607401e-07, 'epochs': 215, 'loss': 'mse', 'optimizer': 'adam', 'graph_mode': 'cutoff', 'cutoff': 0.8890375851023943, 'grm_norm': 'gcn', 'self_loops': True, 'use_snp_selection': False}. Best is trial 121 with value: 0.31961821300847115.
[I 2025-12-08 20:03:58,567] Trial 130 finished with value: 0.28226096267213413 and parameters: {'model_type': 'gcn', 'hidden_dims': '[128, 64]', 'dropout': 0.40935252456508264, 'batch_norm': True, 'lr': 0.0037067573279120436, 'weight_decay': 4.817576076032331e-07, 'epochs': 271, 'loss': 'mse', 'optimizer': 'adam', 'graph_mode': 'cutoff', 'cutoff': 0.5754403507515471, 'grm_norm': 'cosine_then_gcn', 'self_loops': True, 'use_snp_selection': True, 'num_snps': 11851}. Best is trial 121 with value: 0.31961821300847115.
[I 2025-12-08 20:04:53,015] Trial 131 finished with value: 0.31848997531198553 and parameters: {'model_type': 'gcn', 'hidden_dims': '[512, 128]', 'dropout': 0.39240364036676434, 'batch_norm': True, 'lr': 0.007749228978056604, 'weight_decay': 3.6233248061919187e-07, 'epochs': 210, 'loss': 'mse', 'optimizer': 'adam', 'graph_mode': 'cutoff', 'cutoff': 0.7945010899299446, 'grm_norm': 'cosine_then_gcn', 'self_loops': True, 'use_snp_selection': False}. Best is trial 121 with value: 0.31961821300847115.
[I 2025-12-08 20:05:47,838] Trial 132 finished with value: 0.31639189850201105 and parameters: {'model_type': 'gcn', 'hidden_dims': '[512, 128]', 'dropout': 0.39415742969233714, 'batch_norm': True, 'lr': 0.00747886243772313, 'weight_decay': 3.6624459257278465e-07, 'epochs': 210, 'loss': 'mse', 'optimizer': 'adam', 'graph_mode': 'cutoff', 'cutoff': 0.8702227847579768, 'grm_norm': 'cosine_then_gcn', 'self_loops': True, 'use_snp_selection': False}. Best is trial 121 with value: 0.31961821300847115.
[I 2025-12-08 20:06:51,815] Trial 133 finished with value: 0.31413457366079334 and parameters: {'model_type': 'gcn', 'hidden_dims': '[512, 128]', 'dropout': 0.37723425704888885, 'batch_norm': True, 'lr': 0.005616933635191628, 'weight_decay': 9.056781716704576e-07, 'epochs': 249, 'loss': 'mse', 'optimizer': 'adam', 'graph_mode': 'cutoff', 'cutoff': 0.8342081484008298, 'grm_norm': 'cosine_then_gcn', 'self_loops': True, 'use_snp_selection': False}. Best is trial 121 with value: 0.31961821300847115.
[I 2025-12-08 20:07:57,250] Trial 134 finished with value: 0.316294422156892 and parameters: {'model_type': 'gcn', 'hidden_dims': '[512, 128]', 'dropout': 0.34872247070993206, 'batch_norm': True, 'lr': 0.00801572225314582, 'weight_decay': 2.961244220561765e-07, 'epochs': 255, 'loss': 'mse', 'optimizer': 'adam', 'graph_mode': 'cutoff', 'cutoff': 0.7932361272674506, 'grm_norm': 'cosine_then_gcn', 'self_loops': True, 'use_snp_selection': False}. Best is trial 121 with value: 0.31961821300847115.
[I 2025-12-08 20:08:24,190] Trial 135 finished with value: 0.3159168104163876 and parameters: {'model_type': 'gcn', 'hidden_dims': '[256, 128, 64]', 'dropout': 0.40034698896191, 'batch_norm': True, 'lr': 0.006293492248678302, 'weight_decay': 2.042030828674361e-06, 'epochs': 197, 'loss': 'mse', 'optimizer': 'adam', 'graph_mode': 'cutoff', 'cutoff': 0.8522522073083844, 'grm_norm': 'cosine_then_gcn', 'self_loops': True, 'use_snp_selection': False}. Best is trial 121 with value: 0.31961821300847115.
[I 2025-12-08 20:09:21,213] Trial 136 finished with value: 0.3138328703815182 and parameters: {'model_type': 'gcn', 'hidden_dims': '[512, 128]', 'dropout': 0.3896127150186647, 'batch_norm': True, 'lr': 0.004782855870675277, 'weight_decay': 6.476643596531493e-07, 'epochs': 221, 'loss': 'mse', 'optimizer': 'adam', 'graph_mode': 'cutoff', 'cutoff': 0.8982652427217753, 'grm_norm': 'cosine', 'self_loops': True, 'use_snp_selection': False}. Best is trial 121 with value: 0.31961821300847115.
[I 2025-12-08 20:10:09,901] Trial 137 finished with value: 0.2256191690728217 and parameters: {'model_type': 'gcn', 'hidden_dims': '[512, 256]', 'dropout': 0.32680764924177713, 'batch_norm': True, 'lr': 0.006840472778549727, 'weight_decay': 4.2590622093143335e-07, 'epochs': 182, 'loss': 'mse', 'optimizer': 'adam', 'graph_mode': 'knn', 'knn_k': 5, 'weighted_edges': True, 'symmetrize_mode': 'mutual', 'self_loops': True, 'use_snp_selection': False}. Best is trial 121 with value: 0.31961821300847115.
