[I 2025-12-08 16:24:13,521] Trial 47 finished with value: 0.35576234517148997 and parameters: {'model_type': 'gcn', 'hidden_dims': '[512, 128]', 'dropout': 0.3547918841618162, 'batch_norm': False, 'lr': 1.0334459331591436e-05, 'weight_decay': 0.00018816080937888503, 'epochs': 350, 'loss': 'mae', 'optimizer': 'adam', 'graph_mode': 'knn', 'knn_k': 7, 'weighted_edges': True, 'symmetrize_mode': 'mutual', 'self_loops': False, 'use_snp_selection': True, 'num_snps': 13995}. Best is trial 44 with value: 0.3695676652276214.
[I 2025-12-08 16:25:40,520] Trial 48 finished with value: 0.33145067194498046 and parameters: {'model_type': 'gcn', 'hidden_dims': '[512, 256]', 'dropout': 0.5981897663302678, 'batch_norm': False, 'lr': 1.057771147894028e-05, 'weight_decay': 0.0006187676641827564, 'epochs': 334, 'loss': 'mae', 'optimizer': 'adam', 'graph_mode': 'cutoff', 'cutoff': 0.20079517618519477, 'grm_norm': 'cosine_then_gcn', 'self_loops': False, 'use_snp_selection': False}. Best is trial 44 with value: 0.3695676652276214.
[I 2025-12-08 16:26:02,038] Trial 49 finished with value: 0.3728386152974518 and parameters: {'model_type': 'gcn', 'hidden_dims': '[128, 64]', 'dropout': 0.5018560808555418, 'batch_norm': False, 'lr': 4.3283806426659864e-05, 'weight_decay': 0.0002122233178132305, 'epochs': 281, 'loss': 'mse', 'optimizer': 'adam', 'graph_mode': 'knn', 'knn_k': 9, 'weighted_edges': True, 'symmetrize_mode': 'union', 'self_loops': False, 'use_snp_selection': True, 'num_snps': 25474}. Best is trial 49 with value: 0.3728386152974518.
[I 2025-12-08 16:26:23,259] Trial 50 finished with value: 0.31189901393384734 and parameters: {'model_type': 'gcn', 'hidden_dims': '[128, 64]', 'dropout': 0.4456736047289446, 'batch_norm': True, 'lr': 0.0001019909774668514, 'weight_decay': 0.0002087420840412124, 'epochs': 268, 'loss': 'mse', 'optimizer': 'adam', 'graph_mode': 'knn', 'knn_k': 8, 'weighted_edges': True, 'symmetrize_mode': 'union', 'self_loops': False, 'use_snp_selection': True, 'num_snps': 25313}. Best is trial 49 with value: 0.3728386152974518.
[I 2025-12-08 16:26:46,751] Trial 51 finished with value: 0.36664738119214724 and parameters: {'model_type': 'gcn', 'hidden_dims': '[128, 64]', 'dropout': 0.49836768468363946, 'batch_norm': False, 'lr': 5.761619286278667e-05, 'weight_decay': 0.00040906239907955735, 'epochs': 287, 'loss': 'mse', 'optimizer': 'adam', 'graph_mode': 'knn', 'knn_k': 9, 'weighted_edges': True, 'symmetrize_mode': 'union', 'self_loops': False, 'use_snp_selection': True, 'num_snps': 29490}. Best is trial 49 with value: 0.3728386152974518.
[I 2025-12-08 16:27:11,119] Trial 52 finished with value: 0.3670945351565872 and parameters: {'model_type': 'gcn', 'hidden_dims': '[128, 64]', 'dropout': 0.4994886504772377, 'batch_norm': False, 'lr': 5.668186019391356e-05, 'weight_decay': 0.0004491652570731935, 'epochs': 305, 'loss': 'mse', 'optimizer': 'adam', 'graph_mode': 'knn', 'knn_k': 10, 'weighted_edges': True, 'symmetrize_mode': 'union', 'self_loops': False, 'use_snp_selection': True, 'num_snps': 29825}. Best is trial 49 with value: 0.3728386152974518.
[I 2025-12-08 16:27:36,968] Trial 53 finished with value: 0.3683703938741905 and parameters: {'model_type': 'gcn', 'hidden_dims': '[128, 64]', 'dropout': 0.4925600149984892, 'batch_norm': False, 'lr': 6.666744084660979e-05, 'weight_decay': 0.0005079824366651739, 'epochs': 302, 'loss': 'mse', 'optimizer': 'adam', 'graph_mode': 'knn', 'knn_k': 10, 'weighted_edges': True, 'symmetrize_mode': 'union', 'self_loops': False, 'use_snp_selection': True, 'num_snps': 34043}. Best is trial 49 with value: 0.3728386152974518.
[I 2025-12-08 16:28:00,678] Trial 54 finished with value: 0.3490537634042553 and parameters: {'model_type': 'gcn', 'hidden_dims': '[128, 64]', 'dropout': 0.5046062453959503, 'batch_norm': False, 'lr': 6.781207753374487e-05, 'weight_decay': 0.0005019188383447537, 'epochs': 302, 'loss': 'mse', 'optimizer': 'adam', 'graph_mode': 'cutoff', 'cutoff': 0.7206183785123149, 'grm_norm': 'cosine_then_gcn', 'self_loops': False, 'use_snp_selection': True, 'num_snps': 30483}. Best is trial 49 with value: 0.3728386152974518.
[I 2025-12-08 16:28:24,488] Trial 55 finished with value: 0.36707821458785606 and parameters: {'model_type': 'gcn', 'hidden_dims': '[128, 64]', 'dropout': 0.5482622730376806, 'batch_norm': False, 'lr': 0.00011176875844880919, 'weight_decay': 0.0003574135493743228, 'epochs': 260, 'loss': 'mse', 'optimizer': 'adam', 'graph_mode': 'knn', 'knn_k': 10, 'weighted_edges': True, 'symmetrize_mode': 'union', 'self_loops': False, 'use_snp_selection': True, 'num_snps': 33190}. Best is trial 49 with value: 0.3728386152974518.
[I 2025-12-08 16:28:50,224] Trial 56 finished with value: 0.37249880700665083 and parameters: {'model_type': 'gcn', 'hidden_dims': '[128, 64]', 'dropout': 0.49893271174043646, 'batch_norm': False, 'lr': 4.82910312049501e-05, 'weight_decay': 0.0003284833992111487, 'epochs': 279, 'loss': 'mse', 'optimizer': 'adam', 'graph_mode': 'knn', 'knn_k': 10, 'weighted_edges': True, 'symmetrize_mode': 'union', 'self_loops': False, 'use_snp_selection': True, 'num_snps': 35183}. Best is trial 49 with value: 0.3728386152974518.
[I 2025-12-08 16:29:13,915] Trial 57 finished with value: 0.3577531379511384 and parameters: {'model_type': 'gcn', 'hidden_dims': '[128, 64]', 'dropout': 0.5585577055910687, 'batch_norm': False, 'lr': 0.00011445146955366385, 'weight_decay': 0.0008819136192616837, 'epochs': 253, 'loss': 'mse', 'optimizer': 'adam', 'graph_mode': 'knn', 'knn_k': 10, 'weighted_edges': True, 'symmetrize_mode': 'union', 'self_loops': False, 'use_snp_selection': True, 'num_snps': 33804}. Best is trial 49 with value: 0.3728386152974518.
[I 2025-12-08 16:29:42,592] Trial 58 finished with value: 0.34397582020391626 and parameters: {'model_type': 'gcn', 'hidden_dims': '[128, 64]', 'dropout': 0.5426556217943566, 'batch_norm': False, 'lr': 0.00013295403469382227, 'weight_decay': 0.00031072138463239497, 'epochs': 279, 'loss': 'mse', 'optimizer': 'adam', 'graph_mode': 'cutoff', 'cutoff': 0.2266751040863212, 'grm_norm': 'gcn', 'self_loops': False, 'use_snp_selection': True, 'num_snps': 43558}. Best is trial 49 with value: 0.3728386152974518.
[I 2025-12-08 16:30:07,270] Trial 59 finished with value: 0.3723054677584853 and parameters: {'model_type': 'gcn', 'hidden_dims': '[128, 64]', 'dropout': 0.4915350043775849, 'batch_norm': False, 'lr': 4.550733804468688e-05, 'weight_decay': 0.0001417163530434305, 'epochs': 256, 'loss': 'mse', 'optimizer': 'adam', 'graph_mode': 'knn', 'knn_k': 10, 'weighted_edges': True, 'symmetrize_mode': 'union', 'self_loops': False, 'use_snp_selection': True, 'num_snps': 35091}. Best is trial 49 with value: 0.3728386152974518.
[I 2025-12-08 16:30:31,249] Trial 60 finished with value: 0.35438937217283933 and parameters: {'model_type': 'gcn', 'hidden_dims': '[128, 64]', 'dropout': 0.48589160178623836, 'batch_norm': False, 'lr': 4.525419182346334e-05, 'weight_decay': 0.0006499556187985252, 'epochs': 241, 'loss': 'mse', 'optimizer': 'adam', 'graph_mode': 'knn', 'knn_k': 10, 'weighted_edges': True, 'symmetrize_mode': 'union', 'self_loops': True, 'use_snp_selection': True, 'num_snps': 34646}. Best is trial 49 with value: 0.3728386152974518.
[I 2025-12-08 16:30:54,776] Trial 61 finished with value: 0.3710852160922115 and parameters: {'model_type': 'gcn', 'hidden_dims': '[128, 64]', 'dropout': 0.44711977106673134, 'batch_norm': False, 'lr': 7.397436149623718e-05, 'weight_decay': 0.00013796204939958633, 'epochs': 263, 'loss': 'mse', 'optimizer': 'adam', 'graph_mode': 'knn', 'knn_k': 10, 'weighted_edges': True, 'symmetrize_mode': 'union', 'self_loops': False, 'use_snp_selection': True, 'num_snps': 31796}. Best is trial 49 with value: 0.3728386152974518.
[I 2025-12-08 16:31:18,589] Trial 62 finished with value: 0.36560353734443274 and parameters: {'model_type': 'gcn', 'hidden_dims': '[128, 64]', 'dropout': 0.4536146263726205, 'batch_norm': False, 'lr': 7.34408592905171e-05, 'weight_decay': 0.00016144941140864828, 'epochs': 275, 'loss': 'mse', 'optimizer': 'adam', 'graph_mode': 'knn', 'knn_k': 10, 'weighted_edges': True, 'symmetrize_mode': 'union', 'self_loops': False, 'use_snp_selection': True, 'num_snps': 31183}. Best is trial 49 with value: 0.3728386152974518.
[I 2025-12-08 16:31:49,690] Trial 63 finished with value: 0.36752729619930424 and parameters: {'model_type': 'gcn', 'hidden_dims': '[128, 64]', 'dropout': 0.409131884595457, 'batch_norm': False, 'lr': 4.966023807951246e-05, 'weight_decay': 0.00041021333852880534, 'epochs': 328, 'loss': 'mse', 'optimizer': 'adam', 'graph_mode': 'knn', 'knn_k': 10, 'weighted_edges': True, 'symmetrize_mode': 'union', 'self_loops': False, 'use_snp_selection': True, 'num_snps': 42388}. Best is trial 49 with value: 0.3728386152974518.
[I 2025-12-08 16:32:22,323] Trial 64 finished with value: 0.3748934160983876 and parameters: {'model_type': 'gcn', 'hidden_dims': '[128, 64]', 'dropout': 0.4109613542282932, 'batch_norm': False, 'lr': 4.211056914796003e-05, 'weight_decay': 0.00013866490105227396, 'epochs': 326, 'loss': 'mse', 'optimizer': 'adam', 'graph_mode': 'knn', 'knn_k': 10, 'weighted_edges': True, 'symmetrize_mode': 'union', 'self_loops': False, 'use_snp_selection': True, 'num_snps': 47006}. Best is trial 64 with value: 0.3748934160983876.
[I 2025-12-08 16:32:54,330] Trial 65 finished with value: 0.36216328859860525 and parameters: {'model_type': 'gcn', 'hidden_dims': '[128, 64]', 'dropout': 0.4248702186189619, 'batch_norm': False, 'lr': 3.949972577405901e-05, 'weight_decay': 0.00013167406336759597, 'epochs': 321, 'loss': 'mse', 'optimizer': 'adam', 'graph_mode': 'knn', 'knn_k': 9, 'weighted_edges': True, 'symmetrize_mode': 'union', 'self_loops': False, 'use_snp_selection': True, 'num_snps': 45839}. Best is trial 64 with value: 0.3748934160983876.
[I 2025-12-08 16:33:24,133] Trial 66 finished with value: 0.34860834801724533 and parameters: {'model_type': 'gcn', 'hidden_dims': '[128, 64]', 'dropout': 0.45912681856316806, 'batch_norm': False, 'lr': 0.00014517374258066166, 'weight_decay': 7.235268766644684e-05, 'epochs': 244, 'loss': 'mse', 'optimizer': 'adam', 'graph_mode': 'knn', 'knn_k': 10, 'weighted_edges': True, 'symmetrize_mode': 'mutual', 'self_loops': False, 'use_snp_selection': True, 'num_snps': 51439}. Best is trial 64 with value: 0.3748934160983876.
[I 2025-12-08 16:33:55,174] Trial 67 finished with value: 0.37126198854843573 and parameters: {'model_type': 'gcn', 'hidden_dims': '[128, 64]', 'dropout': 0.38356300311980857, 'batch_norm': False, 'lr': 8.66648449789469e-05, 'weight_decay': 0.0002611226753622967, 'epochs': 223, 'loss': 'mse', 'optimizer': 'adam', 'graph_mode': 'knn', 'knn_k': 9, 'weighted_edges': True, 'symmetrize_mode': 'union', 'self_loops': False, 'use_snp_selection': True, 'num_snps': 57251}. Best is trial 64 with value: 0.3748934160983876.
[I 2025-12-08 16:34:12,350] Trial 68 finished with value: 0.3551968863830936 and parameters: {'model_type': 'gcn', 'hidden_dims': '[128, 64]', 'dropout': 0.3831059241136323, 'batch_norm': False, 'lr': 0.00017466750309937215, 'weight_decay': 0.00014518728732821327, 'epochs': 220, 'loss': 'mse', 'optimizer': 'adam', 'graph_mode': 'knn', 'knn_k': 9, 'weighted_edges': True, 'symmetrize_mode': 'union', 'self_loops': False, 'use_snp_selection': False}. Best is trial 64 with value: 0.3748934160983876.
[I 2025-12-08 16:34:43,808] Trial 69 finished with value: 0.35459886228061355 and parameters: {'model_type': 'gcn', 'hidden_dims': '[128, 64]', 'dropout': 0.35603950721899297, 'batch_norm': False, 'lr': 8.530634856414989e-05, 'weight_decay': 0.00024671542637468594, 'epochs': 232, 'loss': 'mse', 'optimizer': 'adam', 'graph_mode': 'cutoff', 'cutoff': 0.51822965022848, 'grm_norm': 'cosine_then_gcn', 'self_loops': False, 'use_snp_selection': True, 'num_snps': 58320}. Best is trial 64 with value: 0.3748934160983876.
[I 2025-12-08 16:35:15,850] Trial 70 finished with value: 0.3711596850114077 and parameters: {'model_type': 'gcn', 'hidden_dims': '[128, 64]', 'dropout': 0.40687709558334323, 'batch_norm': False, 'lr': 9.400658502175495e-05, 'weight_decay': 8.513895024066107e-05, 'epochs': 256, 'loss': 'mse', 'optimizer': 'adam', 'graph_mode': 'knn', 'knn_k': 9, 'weighted_edges': True, 'symmetrize_mode': 'union', 'self_loops': False, 'use_snp_selection': True, 'num_snps': 51491}. Best is trial 64 with value: 0.3748934160983876.
[I 2025-12-08 16:35:48,784] Trial 71 finished with value: 0.36805914612407703 and parameters: {'model_type': 'gcn', 'hidden_dims': '[128, 64]', 'dropout': 0.3993955551726117, 'batch_norm': False, 'lr': 4.241601900491506e-05, 'weight_decay': 8.642715681146544e-05, 'epochs': 257, 'loss': 'mse', 'optimizer': 'adam', 'graph_mode': 'knn', 'knn_k': 9, 'weighted_edges': True, 'symmetrize_mode': 'union', 'self_loops': False, 'use_snp_selection': True, 'num_snps': 54790}. Best is trial 64 with value: 0.3748934160983876.
[I 2025-12-08 16:36:20,941] Trial 72 finished with value: 0.37090782814211176 and parameters: {'model_type': 'gcn', 'hidden_dims': '[128, 64]', 'dropout': 0.42149641480645306, 'batch_norm': False, 'lr': 9.122830757674129e-05, 'weight_decay': 5.1968204781066176e-05, 'epochs': 278, 'loss': 'mse', 'optimizer': 'adam', 'graph_mode': 'knn', 'knn_k': 9, 'weighted_edges': True, 'symmetrize_mode': 'union', 'self_loops': False, 'use_snp_selection': True, 'num_snps': 49622}. Best is trial 64 with value: 0.3748934160983876.
[I 2025-12-08 16:36:53,510] Trial 73 finished with value: 0.3643174344135076 and parameters: {'model_type': 'gcn', 'hidden_dims': '[128, 64]', 'dropout': 0.37646861822465066, 'batch_norm': False, 'lr': 8.823256504501974e-05, 'weight_decay': 5.029103324754223e-05, 'epochs': 279, 'loss': 'mse', 'optimizer': 'adam', 'graph_mode': 'knn', 'knn_k': 9, 'weighted_edges': True, 'symmetrize_mode': 'union', 'self_loops': False, 'use_snp_selection': True, 'num_snps': 50686}. Best is trial 64 with value: 0.3748934160983876.
[I 2025-12-08 16:37:25,855] Trial 74 finished with value: 0.3669383239965212 and parameters: {'model_type': 'gcn', 'hidden_dims': '[128, 64]', 'dropout': 0.40971155804904347, 'batch_norm': False, 'lr': 6.947411264115895e-05, 'weight_decay': 0.00011570417654161992, 'epochs': 240, 'loss': 'mse', 'optimizer': 'adam', 'graph_mode': 'knn', 'knn_k': 9, 'weighted_edges': True, 'symmetrize_mode': 'union', 'self_loops': False, 'use_snp_selection': True, 'num_snps': 55707}. Best is trial 64 with value: 0.3748934160983876.
[I 2025-12-08 16:37:57,715] Trial 75 finished with value: 0.3686267280886617 and parameters: {'model_type': 'gcn', 'hidden_dims': '[128, 64]', 'dropout': 0.4606836419844707, 'batch_norm': False, 'lr': 0.00010240687367309503, 'weight_decay': 5.829920083736955e-05, 'epochs': 268, 'loss': 'mse', 'optimizer': 'adam', 'graph_mode': 'knn', 'knn_k': 10, 'weighted_edges': True, 'symmetrize_mode': 'union', 'self_loops': False, 'use_snp_selection': True, 'num_snps': 50059}. Best is trial 64 with value: 0.3748934160983876.
[I 2025-12-08 16:38:44,258] Trial 76 finished with value: 0.3272017295763995 and parameters: {'model_type': 'gcn', 'hidden_dims': '[256, 128, 64]', 'dropout': 0.439615415096021, 'batch_norm': True, 'lr': 3.363939188419868e-05, 'weight_decay': 0.00015634200783565093, 'epochs': 251, 'loss': 'mse', 'optimizer': 'adam', 'graph_mode': 'knn', 'knn_k': 10, 'weighted_edges': True, 'symmetrize_mode': 'union', 'self_loops': False, 'use_snp_selection': True, 'num_snps': 54356}. Best is trial 64 with value: 0.3748934160983876.
[I 2025-12-08 16:39:11,995] Trial 77 finished with value: 0.34747566025334026 and parameters: {'model_type': 'gcn', 'hidden_dims': '[128, 64]', 'dropout': 0.3667410285951149, 'batch_norm': False, 'lr': 0.0001476655379194788, 'weight_decay': 8.31102980152596e-05, 'epochs': 218, 'loss': 'mse', 'optimizer': 'adam', 'graph_mode': 'knn', 'knn_k': 9, 'weighted_edges': True, 'symmetrize_mode': 'union', 'self_loops': True, 'use_snp_selection': True, 'num_snps': 47776}. Best is trial 64 with value: 0.3748934160983876.
[I 2025-12-08 16:39:42,365] Trial 78 finished with value: 0.36821473366884794 and parameters: {'model_type': 'gcn', 'hidden_dims': '[128, 64]', 'dropout': 0.39308460046099863, 'batch_norm': False, 'lr': 5.050920110265169e-05, 'weight_decay': 1.6543811214867707e-05, 'epochs': 202, 'loss': 'mse', 'optimizer': 'adam', 'graph_mode': 'knn', 'knn_k': 10, 'weighted_edges': True, 'symmetrize_mode': 'union', 'self_loops': False, 'use_snp_selection': True, 'num_snps': 57619}. Best is trial 64 with value: 0.3748934160983876.
[I 2025-12-08 16:40:12,857] Trial 79 finished with value: 0.3665631135297673 and parameters: {'model_type': 'gcn', 'hidden_dims': '[256, 128]', 'dropout': 0.3358651956437431, 'batch_norm': False, 'lr': 6.180504774787131e-05, 'weight_decay': 0.00010992544451396696, 'epochs': 234, 'loss': 'mse', 'optimizer': 'adam', 'graph_mode': 'knn', 'knn_k': 9, 'weighted_edges': True, 'symmetrize_mode': 'union', 'self_loops': False, 'use_snp_selection': False}. Best is trial 64 with value: 0.3748934160983876.
[I 2025-12-08 16:40:41,396] Trial 80 finished with value: 0.35923832495402586 and parameters: {'model_type': 'gcn', 'hidden_dims': '[128, 64]', 'dropout': 0.5121335002173466, 'batch_norm': False, 'lr': 0.00010086457672690082, 'weight_decay': 0.00022479034221941935, 'epochs': 259, 'loss': 'mse', 'optimizer': 'adam', 'graph_mode': 'knn', 'knn_k': 10, 'weighted_edges': True, 'symmetrize_mode': 'mutual', 'self_loops': False, 'use_snp_selection': True, 'num_snps': 45280}. Best is trial 64 with value: 0.3748934160983876.
[I 2025-12-08 16:41:39,136] Trial 81 finished with value: 0.36706617718723 and parameters: {'model_type': 'gcn', 'hidden_dims': '[512, 128]', 'dropout': 0.4262721465072802, 'batch_norm': False, 'lr': 1.59388017131182e-05, 'weight_decay': 0.00025408281798613936, 'epochs': 295, 'loss': 'mse', 'optimizer': 'adam', 'graph_mode': 'knn', 'knn_k': 9, 'weighted_edges': True, 'symmetrize_mode': 'union', 'self_loops': False, 'use_snp_selection': True, 'num_snps': 37353}. Best is trial 64 with value: 0.3748934160983876.
[I 2025-12-08 16:42:10,842] Trial 82 finished with value: 0.3539691374640318 and parameters: {'model_type': 'gcn', 'hidden_dims': '[128, 64]', 'dropout': 0.48173324496540487, 'batch_norm': False, 'lr': 0.0003101682676863026, 'weight_decay': 0.0002931711984075718, 'epochs': 282, 'loss': 'mse', 'optimizer': 'adam', 'graph_mode': 'knn', 'knn_k': 8, 'weighted_edges': True, 'symmetrize_mode': 'union', 'self_loops': False, 'use_snp_selection': True, 'num_snps': 48851}. Best is trial 64 with value: 0.3748934160983876.
[I 2025-12-08 16:42:45,114] Trial 83 finished with value: 0.365082613204077 and parameters: {'model_type': 'gcn', 'hidden_dims': '[128, 64]', 'dropout': 0.41360118211724545, 'batch_norm': False, 'lr': 2.3048472147863694e-05, 'weight_decay': 0.00016240995606708162, 'epochs': 315, 'loss': 'mse', 'optimizer': 'adam', 'graph_mode': 'knn', 'knn_k': 5, 'weighted_edges': True, 'symmetrize_mode': 'union', 'self_loops': False, 'use_snp_selection': True, 'num_snps': 52068}. Best is trial 64 with value: 0.3748934160983876.
[I 2025-12-08 16:43:14,867] Trial 84 finished with value: 0.3684590475429686 and parameters: {'model_type': 'gcn', 'hidden_dims': '[128, 64]', 'dropout': 0.4328174980005733, 'batch_norm': False, 'lr': 2.966498436053723e-05, 'weight_decay': 0.0001004181315821763, 'epochs': 337, 'loss': 'mse', 'optimizer': 'adam', 'graph_mode': 'knn', 'knn_k': 10, 'weighted_edges': True, 'symmetrize_mode': 'union', 'self_loops': False, 'use_snp_selection': True, 'num_snps': 38872}. Best is trial 64 with value: 0.3748934160983876.
[I 2025-12-08 16:44:01,748] Trial 85 finished with value: 0.2999939787748859 and parameters: {'model_type': 'gcn', 'hidden_dims': '[256, 128, 64]', 'dropout': 0.4670407077399463, 'batch_norm': False, 'lr': 0.00044871569444001095, 'weight_decay': 4.22128037450076e-05, 'epochs': 270, 'loss': 'mse', 'optimizer': 'adam', 'graph_mode': 'knn', 'knn_k': 9, 'weighted_edges': True, 'symmetrize_mode': 'union', 'self_loops': False, 'use_snp_selection': True, 'num_snps': 53188}. Best is trial 64 with value: 0.3748934160983876.
[I 2025-12-08 16:44:22,792] Trial 86 finished with value: 0.36125091237934903 and parameters: {'model_type': 'gcn', 'hidden_dims': '[128, 64]', 'dropout': 0.39736025499205074, 'batch_norm': False, 'lr': 8.603185281655353e-05, 'weight_decay': 0.00012677372259156325, 'epochs': 264, 'loss': 'mse', 'optimizer': 'adam', 'graph_mode': 'knn', 'knn_k': 8, 'weighted_edges': True, 'symmetrize_mode': 'union', 'self_loops': False, 'use_snp_selection': True, 'num_snps': 25946}. Best is trial 64 with value: 0.3748934160983876.
[I 2025-12-08 16:44:53,932] Trial 87 finished with value: 0.3127061076888418 and parameters: {'model_type': 'gcn', 'hidden_dims': '[128, 64]', 'dropout': 0.44829039467263876, 'batch_norm': True, 'lr': 3.7809927135818764e-05, 'weight_decay': 6.138425757374012e-05, 'epochs': 225, 'loss': 'mse', 'optimizer': 'adam', 'graph_mode': 'knn', 'knn_k': 9, 'weighted_edges': True, 'symmetrize_mode': 'union', 'self_loops': False, 'use_snp_selection': True, 'num_snps': 56144}. Best is trial 64 with value: 0.3748934160983876.
[I 2025-12-08 16:45:12,715] Trial 88 finished with value: 0.3653557368298405 and parameters: {'model_type': 'gcn', 'hidden_dims': '[128, 64]', 'dropout': 0.3838741396880947, 'batch_norm': False, 'lr': 4.885512955487348e-05, 'weight_decay': 0.00033799965403258413, 'epochs': 288, 'loss': 'mse', 'optimizer': 'adam', 'graph_mode': 'knn', 'knn_k': 6, 'weighted_edges': True, 'symmetrize_mode': 'union', 'self_loops': False, 'use_snp_selection': True, 'num_snps': 18494}. Best is trial 64 with value: 0.3748934160983876.
