[I 2025-12-08 12:11:27,070] Trial 2 finished with value: 0.19631893609287815 and parameters: {'model_type': 'gcn', 'hidden_dims': '[512, 64]', 'dropout': 0.32815227354739207, 'batch_norm': True, 'lr': 0.000619605044204259, 'weight_decay': 0.0004086269831625786, 'epochs': 206, 'loss': 'mse', 'optimizer': 'adam', 'graph_mode': 'knn', 'knn_k': 4, 'weighted_edges': True, 'symmetrize_mode': 'union', 'self_loops': True, 'use_snp_selection': True, 'num_snps': 53035}. Best is trial 0 with value: 0.2555495213347082.
[I 2025-12-08 12:11:54,539] Trial 3 finished with value: 0.22175982731029528 and parameters: {'model_type': 'gcn', 'hidden_dims': '[256, 128]', 'dropout': 0.23110783056597514, 'batch_norm': True, 'lr': 8.11311593386298e-05, 'weight_decay': 9.296158109581328e-07, 'epochs': 213, 'loss': 'mse', 'optimizer': 'adam', 'graph_mode': 'knn', 'knn_k': 10, 'weighted_edges': True, 'symmetrize_mode': 'mutual', 'self_loops': True, 'use_snp_selection': False}. Best is trial 0 with value: 0.2555495213347082.
[I 2025-12-08 12:12:09,087] Trial 4 finished with value: 0.2992661302815046 and parameters: {'model_type': 'gcn', 'hidden_dims': '[512, 256]', 'dropout': 0.2753281956415665, 'batch_norm': True, 'lr': 0.00034435188114839693, 'weight_decay': 4.9416012835950194e-05, 'epochs': 89, 'loss': 'mae', 'optimizer': 'adam', 'graph_mode': 'cutoff', 'cutoff': 0.820078967317394, 'grm_norm': 'none', 'self_loops': False, 'use_snp_selection': True, 'num_snps': 12674}. Best is trial 4 with value: 0.2992661302815046.
[I 2025-12-08 12:12:34,160] Trial 5 finished with value: 0.2724350405710015 and parameters: {'model_type': 'gcn', 'hidden_dims': '[128, 64]', 'dropout': 0.5611163934517731, 'batch_norm': True, 'lr': 0.0003984856210762587, 'weight_decay': 1.1466743517565185e-07, 'epochs': 344, 'loss': 'mae', 'optimizer': 'adam', 'graph_mode': 'cutoff', 'cutoff': 0.6089370799714728, 'grm_norm': 'gcn', 'self_loops': True, 'use_snp_selection': False}. Best is trial 4 with value: 0.2992661302815046.
[I 2025-12-08 12:12:56,579] Trial 6 finished with value: 0.2732585686919869 and parameters: {'model_type': 'gcn', 'hidden_dims': '[128, 64]', 'dropout': 0.31805912766941713, 'batch_norm': True, 'lr': 1.2361026034262557e-05, 'weight_decay': 6.492620232791903e-06, 'epochs': 271, 'loss': 'mse', 'optimizer': 'adam', 'graph_mode': 'cutoff', 'cutoff': 0.6193362582230448, 'grm_norm': 'cosine', 'self_loops': False, 'use_snp_selection': True, 'num_snps': 28594}. Best is trial 4 with value: 0.2992661302815046.
[I 2025-12-08 12:13:16,270] Trial 7 finished with value: 0.2392048828130267 and parameters: {'model_type': 'gcn', 'hidden_dims': '[512, 64]', 'dropout': 0.471337288649717, 'batch_norm': True, 'lr': 2.239693207292708e-05, 'weight_decay': 2.263166635514082e-06, 'epochs': 69, 'loss': 'mse', 'optimizer': 'adam', 'graph_mode': 'cutoff', 'cutoff': 0.4056820886426376, 'grm_norm': 'cosine', 'self_loops': False, 'use_snp_selection': False}. Best is trial 4 with value: 0.2992661302815046.
[I 2025-12-08 12:13:53,759] Trial 8 finished with value: 0.2695991039280471 and parameters: {'model_type': 'gcn', 'hidden_dims': '[512, 256]', 'dropout': 0.20659328268932406, 'batch_norm': False, 'lr': 8.93315124361372e-05, 'weight_decay': 0.00028987480727919035, 'epochs': 136, 'loss': 'mae', 'optimizer': 'adam', 'graph_mode': 'knn', 'knn_k': 3, 'weighted_edges': False, 'symmetrize_mode': 'union', 'self_loops': False, 'use_snp_selection': True, 'num_snps': 43128}. Best is trial 4 with value: 0.2992661302815046.
[I 2025-12-08 12:14:35,762] Trial 9 finished with value: 0.0058655997506665575 and parameters: {'model_type': 'gcn', 'hidden_dims': '[512, 256]', 'dropout': 0.2888209592870401, 'batch_norm': False, 'lr': 0.004734648143129892, 'weight_decay': 1.5879705591356368e-06, 'epochs': 163, 'loss': 'mse', 'optimizer': 'adam', 'graph_mode': 'cutoff', 'cutoff': 0.5984899797909019, 'grm_norm': 'cosine', 'self_loops': True, 'use_snp_selection': False}. Best is trial 4 with value: 0.2992661302815046.
[I 2025-12-08 12:14:44,900] Trial 10 finished with value: 0.2694515402460932 and parameters: {'model_type': 'gcn', 'hidden_dims': '[512, 128]', 'dropout': 0.11372025982957354, 'batch_norm': False, 'lr': 0.0023343012062770553, 'weight_decay': 4.14440562940608e-05, 'epochs': 41, 'loss': 'mae', 'optimizer': 'adam', 'graph_mode': 'cutoff', 'cutoff': 0.8740100033033124, 'grm_norm': 'none', 'self_loops': False, 'use_snp_selection': True, 'num_snps': 3859}. Best is trial 4 with value: 0.2992661302815046.
[I 2025-12-08 12:15:02,134] Trial 11 finished with value: 0.28399280483286377 and parameters: {'model_type': 'gcn', 'hidden_dims': '[128, 64]', 'dropout': 0.40483337339263037, 'batch_norm': True, 'lr': 0.0008716651983952945, 'weight_decay': 1.6792768777147005e-05, 'epochs': 253, 'loss': 'mse', 'optimizer': 'adam', 'graph_mode': 'cutoff', 'cutoff': 0.8576830859783061, 'grm_norm': 'cosine_then_gcn', 'self_loops': False, 'use_snp_selection': True, 'num_snps': 16385}. Best is trial 4 with value: 0.2992661302815046.
[I 2025-12-08 12:15:16,243] Trial 12 finished with value: 0.2791968900207984 and parameters: {'model_type': 'gcn', 'hidden_dims': '[512, 256]', 'dropout': 0.42058772746038836, 'batch_norm': True, 'lr': 0.0011839894135894482, 'weight_decay': 3.769314426796163e-05, 'epochs': 111, 'loss': 'mse', 'optimizer': 'adam', 'graph_mode': 'cutoff', 'cutoff': 0.8997334580241522, 'grm_norm': 'cosine_then_gcn', 'self_loops': False, 'use_snp_selection': True, 'num_snps': 9404}. Best is trial 4 with value: 0.2992661302815046.
[I 2025-12-08 12:15:45,775] Trial 13 finished with value: 0.2962863971741715 and parameters: {'model_type': 'gcn', 'hidden_dims': '[512, 128]', 'dropout': 0.42169375384010027, 'batch_norm': True, 'lr': 0.00015760028577826093, 'weight_decay': 1.0957653494853036e-05, 'epochs': 259, 'loss': 'mae', 'optimizer': 'adam', 'graph_mode': 'cutoff', 'cutoff': 0.7699179571762822, 'grm_norm': 'cosine_then_gcn', 'self_loops': False, 'use_snp_selection': True, 'num_snps': 17287}. Best is trial 4 with value: 0.2992661302815046.
[I 2025-12-08 12:16:03,723] Trial 14 finished with value: 0.29234343158899456 and parameters: {'model_type': 'gcn', 'hidden_dims': '[512, 128]', 'dropout': 0.4506894495718366, 'batch_norm': False, 'lr': 0.0002008596430296155, 'weight_decay': 0.00012014795738940992, 'epochs': 98, 'loss': 'mae', 'optimizer': 'adam', 'graph_mode': 'cutoff', 'cutoff': 0.7448878090285934, 'grm_norm': 'none', 'self_loops': False, 'use_snp_selection': True, 'num_snps': 18149}. Best is trial 4 with value: 0.2992661302815046.
[I 2025-12-08 12:16:27,591] Trial 15 finished with value: 0.29855773850342393 and parameters: {'model_type': 'gcn', 'hidden_dims': '[512, 128]', 'dropout': 0.37821646043415796, 'batch_norm': True, 'lr': 0.00019946804531991192, 'weight_decay': 7.311129231034126e-06, 'epochs': 168, 'loss': 'mae', 'optimizer': 'adam', 'graph_mode': 'cutoff', 'cutoff': 0.7389935703830977, 'grm_norm': 'cosine_then_gcn', 'self_loops': False, 'use_snp_selection': True, 'num_snps': 18426}. Best is trial 4 with value: 0.2992661302815046.
[I 2025-12-08 12:16:54,114] Trial 16 finished with value: 0.285263809014811 and parameters: {'model_type': 'gcn', 'hidden_dims': '[256, 128, 64]', 'dropout': 0.27959930776626396, 'batch_norm': True, 'lr': 3.837553030630782e-05, 'weight_decay': 3.4192222342518138e-06, 'epochs': 161, 'loss': 'mae', 'optimizer': 'adam', 'graph_mode': 'cutoff', 'cutoff': 0.7199483908986014, 'grm_norm': 'none', 'self_loops': False, 'use_snp_selection': True, 'num_snps': 36329}. Best is trial 4 with value: 0.2992661302815046.
[I 2025-12-08 12:17:03,696] Trial 17 finished with value: 0.2585625520537848 and parameters: {'model_type': 'gcn', 'hidden_dims': '[256, 128]', 'dropout': 0.36994064828121664, 'batch_norm': True, 'lr': 0.0003137103694305674, 'weight_decay': 0.0009120495298946692, 'epochs': 92, 'loss': 'mae', 'optimizer': 'adam', 'graph_mode': 'cutoff', 'cutoff': 0.47709696350666464, 'grm_norm': 'none', 'self_loops': False, 'use_snp_selection': True, 'num_snps': 3040}. Best is trial 4 with value: 0.2992661302815046.
[I 2025-12-08 12:17:30,866] Trial 18 finished with value: 0.28247807707081185 and parameters: {'model_type': 'gcn', 'hidden_dims': '[512, 256]', 'dropout': 0.16889985278784186, 'batch_norm': False, 'lr': 0.002420120270320009, 'weight_decay': 1.738517095158091e-05, 'epochs': 171, 'loss': 'mae', 'optimizer': 'adam', 'graph_mode': 'knn', 'knn_k': 1, 'weighted_edges': False, 'symmetrize_mode': 'mutual', 'self_loops': False, 'use_snp_selection': True, 'num_snps': 22566}. Best is trial 4 with value: 0.2992661302815046.
[I 2025-12-08 12:17:42,489] Trial 19 finished with value: 0.28876421476490083 and parameters: {'model_type': 'gcn', 'hidden_dims': '[512, 128]', 'dropout': 0.5200178071993855, 'batch_norm': True, 'lr': 0.007001397433356405, 'weight_decay': 7.124459546710191e-07, 'epochs': 42, 'loss': 'mae', 'optimizer': 'adam', 'graph_mode': 'cutoff', 'cutoff': 0.7128695891452442, 'grm_norm': 'cosine_then_gcn', 'self_loops': False, 'use_snp_selection': True, 'num_snps': 10680}. Best is trial 4 with value: 0.2992661302815046.
[I 2025-12-08 12:18:16,920] Trial 20 finished with value: 0.2538442939563081 and parameters: {'model_type': 'gcn', 'hidden_dims': '[512, 256]', 'dropout': 0.25133075349524486, 'batch_norm': True, 'lr': 0.00017728095956590583, 'weight_decay': 0.00016158273890698178, 'epochs': 135, 'loss': 'mae', 'optimizer': 'adam', 'graph_mode': 'cutoff', 'cutoff': 0.2234589932533121, 'grm_norm': 'none', 'self_loops': False, 'use_snp_selection': True, 'num_snps': 37379}. Best is trial 4 with value: 0.2992661302815046.
[I 2025-12-08 12:18:42,678] Trial 21 finished with value: 0.29832093860627024 and parameters: {'model_type': 'gcn', 'hidden_dims': '[512, 128]', 'dropout': 0.3592616140493563, 'batch_norm': True, 'lr': 0.0001269462404919864, 'weight_decay': 8.165488245307366e-06, 'epochs': 246, 'loss': 'mae', 'optimizer': 'adam', 'graph_mode': 'cutoff', 'cutoff': 0.7802912706563878, 'grm_norm': 'cosine_then_gcn', 'self_loops': False, 'use_snp_selection': True, 'num_snps': 14926}. Best is trial 4 with value: 0.2992661302815046.
[I 2025-12-08 12:19:03,116] Trial 22 finished with value: 0.2916587724905909 and parameters: {'model_type': 'gcn', 'hidden_dims': '[512, 128]', 'dropout': 0.37188715721894217, 'batch_norm': True, 'lr': 4.555702040829355e-05, 'weight_decay': 6.653515804237531e-06, 'epochs': 228, 'loss': 'mae', 'optimizer': 'adam', 'graph_mode': 'cutoff', 'cutoff': 0.8031072454519742, 'grm_norm': 'cosine_then_gcn', 'self_loops': False, 'use_snp_selection': True, 'num_snps': 10782}. Best is trial 4 with value: 0.2992661302815046.
[I 2025-12-08 12:19:31,923] Trial 23 finished with value: 0.2986870411904619 and parameters: {'model_type': 'gcn', 'hidden_dims': '[512, 128]', 'dropout': 0.3530816531624273, 'batch_norm': True, 'lr': 0.00031617568287649957, 'weight_decay': 2.7973135729354244e-05, 'epochs': 184, 'loss': 'mae', 'optimizer': 'adam', 'graph_mode': 'cutoff', 'cutoff': 0.6656309440875677, 'grm_norm': 'cosine_then_gcn', 'self_loops': False, 'use_snp_selection': True, 'num_snps': 23395}. Best is trial 4 with value: 0.2992661302815046.
[I 2025-12-08 12:20:00,722] Trial 24 finished with value: 0.2957372335656886 and parameters: {'model_type': 'gcn', 'hidden_dims': '[512, 128]', 'dropout': 0.29651490588016793, 'batch_norm': True, 'lr': 0.00034950667285206, 'weight_decay': 9.733787595411457e-05, 'epochs': 189, 'loss': 'mae', 'optimizer': 'adam', 'graph_mode': 'cutoff', 'cutoff': 0.6653422099842323, 'grm_norm': 'cosine_then_gcn', 'self_loops': False, 'use_snp_selection': True, 'num_snps': 22579}. Best is trial 4 with value: 0.2992661302815046.
[I 2025-12-08 12:20:24,710] Trial 25 finished with value: 0.2481318162609579 and parameters: {'model_type': 'gcn', 'hidden_dims': '[512, 128]', 'dropout': 0.49201148679675377, 'batch_norm': True, 'lr': 0.0005919707274512864, 'weight_decay': 2.639436418580917e-05, 'epochs': 130, 'loss': 'mae', 'optimizer': 'adam', 'graph_mode': 'cutoff', 'cutoff': 0.5215044698097842, 'grm_norm': 'cosine_then_gcn', 'self_loops': False, 'use_snp_selection': True, 'num_snps': 23525}. Best is trial 4 with value: 0.2992661302815046.
[I 2025-12-08 12:21:14,382] Trial 26 finished with value: 0.10291925410786788 and parameters: {'model_type': 'gcn', 'hidden_dims': '[512, 64]', 'dropout': 0.39527006907316775, 'batch_norm': False, 'lr': 0.0012640347609229575, 'weight_decay': 7.040018808336452e-05, 'epochs': 190, 'loss': 'mae', 'optimizer': 'adam', 'graph_mode': 'knn', 'knn_k': 7, 'weighted_edges': False, 'symmetrize_mode': 'union', 'self_loops': True, 'use_snp_selection': False}. Best is trial 4 with value: 0.2992661302815046.
[I 2025-12-08 12:21:33,361] Trial 27 finished with value: 0.29247526726429907 and parameters: {'model_type': 'gcn', 'hidden_dims': '[256, 128, 64]', 'dropout': 0.33552637559440623, 'batch_norm': True, 'lr': 0.00023581122083581935, 'weight_decay': 3.705019681357915e-06, 'epochs': 77, 'loss': 'mae', 'optimizer': 'adam', 'graph_mode': 'cutoff', 'cutoff': 0.6826250019164547, 'grm_norm': 'gcn', 'self_loops': False, 'use_snp_selection': True, 'num_snps': 33726}. Best is trial 4 with value: 0.2992661302815046.
[I 2025-12-08 12:21:45,159] Trial 28 finished with value: 0.2857466915325714 and parameters: {'model_type': 'gcn', 'hidden_dims': '[256, 128]', 'dropout': 0.2527221988097175, 'batch_norm': True, 'lr': 0.0006021532415642933, 'weight_decay': 1.8946877978140237e-05, 'epochs': 122, 'loss': 'mae', 'optimizer': 'adam', 'graph_mode': 'cutoff', 'cutoff': 0.7993621824929966, 'grm_norm': 'none', 'self_loops': False, 'use_snp_selection': True, 'num_snps': 7938}. Best is trial 4 with value: 0.2992661302815046.
[I 2025-12-08 12:22:21,631] Trial 29 finished with value: 0.1928809757713702 and parameters: {'model_type': 'gcn', 'hidden_dims': '[512, 256]', 'dropout': 0.158490986895877, 'batch_norm': True, 'lr': 4.453207096163834e-05, 'weight_decay': 0.0002081905998535256, 'epochs': 283, 'loss': 'mae', 'optimizer': 'adam', 'graph_mode': 'knn', 'knn_k': 1, 'weighted_edges': False, 'symmetrize_mode': 'union', 'self_loops': True, 'use_snp_selection': True, 'num_snps': 21697}. Best is trial 4 with value: 0.2992661302815046.
[I 2025-12-08 12:22:52,730] Trial 30 finished with value: 0.2898686699967433 and parameters: {'model_type': 'gcn', 'hidden_dims': '[512, 128]', 'dropout': 0.3074228290574258, 'batch_norm': True, 'lr': 0.0022111491174099784, 'weight_decay': 4.594606586061699e-05, 'epochs': 154, 'loss': 'mae', 'optimizer': 'adam', 'graph_mode': 'cutoff', 'cutoff': 0.6527102601915319, 'grm_norm': 'cosine_then_gcn', 'self_loops': False, 'use_snp_selection': True, 'num_snps': 30660}. Best is trial 4 with value: 0.2992661302815046.
[I 2025-12-08 12:23:16,029] Trial 31 finished with value: 0.2974994887564224 and parameters: {'model_type': 'gcn', 'hidden_dims': '[512, 128]', 'dropout': 0.3640467617902433, 'batch_norm': True, 'lr': 0.00012490376231469799, 'weight_decay': 8.210844186364235e-06, 'epochs': 219, 'loss': 'mae', 'optimizer': 'adam', 'graph_mode': 'cutoff', 'cutoff': 0.8094704860241547, 'grm_norm': 'cosine_then_gcn', 'self_loops': False, 'use_snp_selection': True, 'num_snps': 14585}. Best is trial 4 with value: 0.2992661302815046.
[I 2025-12-08 12:23:37,840] Trial 32 finished with value: 0.280081397357833 and parameters: {'model_type': 'gcn', 'hidden_dims': '[512, 128]', 'dropout': 0.33960493829658644, 'batch_norm': True, 'lr': 0.00010029241753088906, 'weight_decay': 1.2506711348378737e-05, 'epochs': 184, 'loss': 'mae', 'optimizer': 'adam', 'graph_mode': 'cutoff', 'cutoff': 0.8323280537343372, 'grm_norm': 'cosine_then_gcn', 'self_loops': False, 'use_snp_selection': True, 'num_snps': 14829}. Best is trial 4 with value: 0.2992661302815046.
[I 2025-12-08 12:24:11,711] Trial 33 finished with value: 0.29420987074304167 and parameters: {'model_type': 'gcn', 'hidden_dims': '[512, 128]', 'dropout': 0.4460281224413467, 'batch_norm': True, 'lr': 0.00027267114614364937, 'weight_decay': 4.309077576824345e-06, 'epochs': 303, 'loss': 'mae', 'optimizer': 'adam', 'graph_mode': 'cutoff', 'cutoff': 0.751377626377983, 'grm_norm': 'cosine_then_gcn', 'self_loops': False, 'use_snp_selection': True, 'num_snps': 18801}. Best is trial 4 with value: 0.2992661302815046.
[I 2025-12-08 12:24:42,148] Trial 34 finished with value: 0.2667045963988825 and parameters: {'model_type': 'gcn', 'hidden_dims': '[256, 128, 64]', 'dropout': 0.38378692974663453, 'batch_norm': True, 'lr': 0.00040958914275536235, 'weight_decay': 2.718830963121012e-05, 'epochs': 234, 'loss': 'mae', 'optimizer': 'adam', 'graph_mode': 'cutoff', 'cutoff': 0.5531897281254609, 'grm_norm': 'cosine_then_gcn', 'self_loops': False, 'use_snp_selection': False}. Best is trial 4 with value: 0.2992661302815046.
[I 2025-12-08 12:25:20,275] Trial 35 finished with value: 0.23830565572999962 and parameters: {'model_type': 'gcn', 'hidden_dims': '[512, 128]', 'dropout': 0.2570463326361467, 'batch_norm': True, 'lr': 0.0001285190211631498, 'weight_decay': 7.050662285766308e-05, 'epochs': 247, 'loss': 'mae', 'optimizer': 'adam', 'graph_mode': 'knn', 'knn_k': 10, 'weighted_edges': True, 'symmetrize_mode': 'mutual', 'self_loops': True, 'use_snp_selection': True, 'num_snps': 25875}. Best is trial 4 with value: 0.2992661302815046.
[I 2025-12-08 12:25:46,490] Trial 36 finished with value: 0.288206530163312 and parameters: {'model_type': 'gcn', 'hidden_dims': '[512, 64]', 'dropout': 0.5868630739646995, 'batch_norm': True, 'lr': 6.565623708493218e-05, 'weight_decay': 5.53068414061565e-07, 'epochs': 304, 'loss': 'mae', 'optimizer': 'adam', 'graph_mode': 'cutoff', 'cutoff': 0.6994196998027667, 'grm_norm': 'cosine_then_gcn', 'self_loops': False, 'use_snp_selection': True, 'num_snps': 12742}. Best is trial 4 with value: 0.2992661302815046.
[I 2025-12-08 12:26:11,730] Trial 37 finished with value: 0.29562100604346303 and parameters: {'model_type': 'gcn', 'hidden_dims': '[256, 128]', 'dropout': 0.3407624973187323, 'batch_norm': True, 'lr': 6.869173835874833e-05, 'weight_decay': 1.4692777268570668e-06, 'epochs': 201, 'loss': 'mse', 'optimizer': 'adam', 'graph_mode': 'cutoff', 'cutoff': 0.7653140552870887, 'grm_norm': 'none', 'self_loops': True, 'use_snp_selection': False}. Best is trial 4 with value: 0.2992661302815046.
[I 2025-12-08 12:26:23,042] Trial 38 finished with value: 0.29018146693792324 and parameters: {'model_type': 'gcn', 'hidden_dims': '[128, 64]', 'dropout': 0.2043389047212504, 'batch_norm': True, 'lr': 0.0004812709895026682, 'weight_decay': 4.820112484162755e-06, 'epochs': 147, 'loss': 'mae', 'optimizer': 'adam', 'graph_mode': 'cutoff', 'cutoff': 0.8378749741680188, 'grm_norm': 'gcn', 'self_loops': False, 'use_snp_selection': True, 'num_snps': 7554}. Best is trial 4 with value: 0.2992661302815046.
[I 2025-12-08 12:27:16,784] Trial 39 finished with value: 0.26343932721818747 and parameters: {'model_type': 'gcn', 'hidden_dims': '[512, 256]', 'dropout': 0.27257256676746944, 'batch_norm': False, 'lr': 2.5768910903417922e-05, 'weight_decay': 3.303450050941413e-07, 'epochs': 206, 'loss': 'mae', 'optimizer': 'adam', 'graph_mode': 'knn', 'knn_k': 6, 'weighted_edges': False, 'symmetrize_mode': 'union', 'self_loops': False, 'use_snp_selection': False}. Best is trial 4 with value: 0.2992661302815046.
[I 2025-12-08 12:27:58,473] Trial 40 finished with value: 0.28423763678797354 and parameters: {'model_type': 'gcn', 'hidden_dims': '[512, 128]', 'dropout': 0.31953972717282614, 'batch_norm': True, 'lr': 0.0010117601205491765, 'weight_decay': 0.0005814233651319514, 'epochs': 281, 'loss': 'mse', 'optimizer': 'adam', 'graph_mode': 'cutoff', 'cutoff': 0.6591550862706693, 'grm_norm': 'cosine_then_gcn', 'self_loops': True, 'use_snp_selection': True, 'num_snps': 26563}. Best is trial 4 with value: 0.2992661302815046.
[I 2025-12-08 12:28:23,440] Trial 41 finished with value: 0.2967897935650911 and parameters: {'model_type': 'gcn', 'hidden_dims': '[512, 128]', 'dropout': 0.35446942318225994, 'batch_norm': True, 'lr': 0.00012819884237647082, 'weight_decay': 9.167139376709603e-06, 'epochs': 229, 'loss': 'mae', 'optimizer': 'adam', 'graph_mode': 'cutoff', 'cutoff': 0.8060637448049027, 'grm_norm': 'cosine_then_gcn', 'self_loops': False, 'use_snp_selection': True, 'num_snps': 15406}. Best is trial 4 with value: 0.2992661302815046.
[I 2025-12-08 12:28:52,382] Trial 42 finished with value: 0.30089919308297963 and parameters: {'model_type': 'gcn', 'hidden_dims': '[512, 128]', 'dropout': 0.35940792422136963, 'batch_norm': True, 'lr': 0.0001084909158261706, 'weight_decay': 7.365994840546624e-06, 'epochs': 219, 'loss': 'mae', 'optimizer': 'adam', 'graph_mode': 'cutoff', 'cutoff': 0.779749145813185, 'grm_norm': 'cosine_then_gcn', 'self_loops': False, 'use_snp_selection': True, 'num_snps': 20197}. Best is trial 42 with value: 0.30089919308297963.
[I 2025-12-08 12:29:49,533] Trial 43 finished with value: 0.30228818287114556 and parameters: {'model_type': 'gcn', 'hidden_dims': '[512, 128]', 'dropout': 0.41787976346273825, 'batch_norm': True, 'lr': 0.00022317926912463317, 'weight_decay': 2.7882748700819692e-06, 'epochs': 181, 'loss': 'mae', 'optimizer': 'adam', 'graph_mode': 'cutoff', 'cutoff': 0.7401484190783294, 'grm_norm': 'gcn', 'self_loops': False, 'use_snp_selection': True, 'num_snps': 59433}. Best is trial 43 with value: 0.30228818287114556.
[I 2025-12-08 12:30:13,028] Trial 44 finished with value: 0.2830339237848947 and parameters: {'model_type': 'gcn', 'hidden_dims': '[128, 64]', 'dropout': 0.4308869859650333, 'batch_norm': True, 'lr': 0.00023506954655853836, 'weight_decay': 2.488020952913554e-06, 'epochs': 179, 'loss': 'mae', 'optimizer': 'adam', 'graph_mode': 'cutoff', 'cutoff': 0.5991488772732003, 'grm_norm': 'gcn', 'self_loops': False, 'use_snp_selection': True, 'num_snps': 43155}. Best is trial 43 with value: 0.30228818287114556.
