[I 2025-12-08 15:38:38,824] Trial 45 finished with value: 0.30849741061432023 and parameters: {'model_type': 'gcn', 'hidden_dims': '[512, 128]', 'dropout': 0.4422553087564528, 'batch_norm': True, 'lr': 0.0005931286532118328, 'weight_decay': 2.7054726150736524e-05, 'epochs': 285, 'loss': 'mae', 'optimizer': 'adam', 'graph_mode': 'cutoff', 'cutoff': 0.8418293493696953, 'grm_norm': 'none', 'self_loops': True, 'use_snp_selection': False}. Best is trial 21 with value: 0.3153339696847911.
[I 2025-12-08 15:38:54,871] Trial 46 finished with value: 0.27924723465886203 and parameters: {'model_type': 'gcn', 'hidden_dims': '[128, 64]', 'dropout': 0.4697051294220432, 'batch_norm': True, 'lr': 0.00010530333850681968, 'weight_decay': 5.331128420265634e-05, 'epochs': 195, 'loss': 'mae', 'optimizer': 'adam', 'graph_mode': 'cutoff', 'cutoff': 0.8982982538364817, 'grm_norm': 'none', 'self_loops': False, 'use_snp_selection': False}. Best is trial 21 with value: 0.3153339696847911.
[I 2025-12-08 15:40:00,988] Trial 47 finished with value: 0.30937064969343486 and parameters: {'model_type': 'gcn', 'hidden_dims': '[512, 128]', 'dropout': 0.501352797538062, 'batch_norm': True, 'lr': 0.000955353028337895, 'weight_decay': 0.00013359508413965187, 'epochs': 257, 'loss': 'mae', 'optimizer': 'adam', 'graph_mode': 'cutoff', 'cutoff': 0.7914923537001826, 'grm_norm': 'none', 'self_loops': False, 'use_snp_selection': False}. Best is trial 21 with value: 0.3153339696847911.
[I 2025-12-08 15:40:30,136] Trial 48 finished with value: 0.0 and parameters: {'model_type': 'gcn', 'hidden_dims': '[512, 64]', 'dropout': 0.4194358186660979, 'batch_norm': False, 'lr': 0.002713985395483434, 'weight_decay': 0.0003745186704964045, 'epochs': 51, 'loss': 'mae', 'optimizer': 'adam', 'graph_mode': 'cutoff', 'cutoff': 0.4240231078997576, 'grm_norm': 'gcn', 'self_loops': True, 'use_snp_selection': True, 'num_snps': 55272}. Best is trial 21 with value: 0.3153339696847911.
[I 2025-12-08 15:41:52,598] Trial 49 finished with value: 0.30826713900548675 and parameters: {'model_type': 'gcn', 'hidden_dims': '[512, 128]', 'dropout': 0.15263109196352656, 'batch_norm': True, 'lr': 0.0010864524857470013, 'weight_decay': 0.00014784285021664982, 'epochs': 327, 'loss': 'mse', 'optimizer': 'adam', 'graph_mode': 'cutoff', 'cutoff': 0.7388712548809291, 'grm_norm': 'cosine', 'self_loops': False, 'use_snp_selection': False}. Best is trial 21 with value: 0.3153339696847911.
[I 2025-12-08 15:42:15,811] Trial 50 finished with value: 0.21354039205495087 and parameters: {'model_type': 'gcn', 'hidden_dims': '[256, 128, 64]', 'dropout': 0.5806771510315463, 'batch_norm': True, 'lr': 0.00022794594791552473, 'weight_decay': 0.0007308644893439584, 'epochs': 158, 'loss': 'mae', 'optimizer': 'adam', 'graph_mode': 'knn', 'knn_k': 7, 'weighted_edges': False, 'symmetrize_mode': 'mutual', 'self_loops': False, 'use_snp_selection': False}. Best is trial 21 with value: 0.3153339696847911.
[I 2025-12-08 15:43:21,281] Trial 51 finished with value: 0.3063476595567629 and parameters: {'model_type': 'gcn', 'hidden_dims': '[512, 128]', 'dropout': 0.4969799567791347, 'batch_norm': True, 'lr': 0.00040925437694108144, 'weight_decay': 0.0009796605922362319, 'epochs': 257, 'loss': 'mae', 'optimizer': 'adam', 'graph_mode': 'cutoff', 'cutoff': 0.8567518552949435, 'grm_norm': 'none', 'self_loops': False, 'use_snp_selection': False}. Best is trial 21 with value: 0.3153339696847911.
[I 2025-12-08 15:44:33,211] Trial 52 finished with value: 0.3043962794750898 and parameters: {'model_type': 'gcn', 'hidden_dims': '[512, 128]', 'dropout': 0.4557110805003601, 'batch_norm': True, 'lr': 0.000558785391139623, 'weight_decay': 0.00021719854666943118, 'epochs': 284, 'loss': 'mae', 'optimizer': 'adam', 'graph_mode': 'cutoff', 'cutoff': 0.7947108180587852, 'grm_norm': 'none', 'self_loops': False, 'use_snp_selection': False}. Best is trial 21 with value: 0.3153339696847911.
[I 2025-12-08 15:45:30,093] Trial 53 finished with value: 0.30549359785209346 and parameters: {'model_type': 'gcn', 'hidden_dims': '[512, 128]', 'dropout': 0.5071251148176149, 'batch_norm': True, 'lr': 0.0008261643673280521, 'weight_decay': 0.00035466074848735534, 'epochs': 221, 'loss': 'mae', 'optimizer': 'adam', 'graph_mode': 'cutoff', 'cutoff': 0.8361169044262189, 'grm_norm': 'none', 'self_loops': False, 'use_snp_selection': False}. Best is trial 21 with value: 0.3153339696847911.
[I 2025-12-08 15:45:57,129] Trial 54 finished with value: 0.31100327899207775 and parameters: {'model_type': 'gcn', 'hidden_dims': '[512, 128]', 'dropout': 0.5500132375975287, 'batch_norm': True, 'lr': 0.0021542558448734714, 'weight_decay': 0.00011543653322521996, 'epochs': 60, 'loss': 'mae', 'optimizer': 'adam', 'graph_mode': 'cutoff', 'cutoff': 0.7736044229847298, 'grm_norm': 'none', 'self_loops': False, 'use_snp_selection': True, 'num_snps': 45615}. Best is trial 21 with value: 0.3153339696847911.
[I 2025-12-08 15:46:23,604] Trial 55 finished with value: 0.307331847061122 and parameters: {'model_type': 'gcn', 'hidden_dims': '[512, 128]', 'dropout': 0.5492695316914137, 'batch_norm': True, 'lr': 0.0049538147813951066, 'weight_decay': 9.942043347765978e-05, 'epochs': 55, 'loss': 'mae', 'optimizer': 'adam', 'graph_mode': 'cutoff', 'cutoff': 0.7726694952015104, 'grm_norm': 'none', 'self_loops': False, 'use_snp_selection': True, 'num_snps': 46374}. Best is trial 21 with value: 0.3153339696847911.
[I 2025-12-08 15:46:44,585] Trial 56 finished with value: 0.28611835833409044 and parameters: {'model_type': 'gcn', 'hidden_dims': '[256, 128]', 'dropout': 0.548526127800441, 'batch_norm': True, 'lr': 0.0021365371667223495, 'weight_decay': 0.0001371040634696401, 'epochs': 86, 'loss': 'mae', 'optimizer': 'adam', 'graph_mode': 'cutoff', 'cutoff': 0.6199685080632499, 'grm_norm': 'none', 'self_loops': True, 'use_snp_selection': True, 'num_snps': 35333}. Best is trial 21 with value: 0.3153339696847911.
[I 2025-12-08 15:47:17,877] Trial 57 finished with value: 0.0 and parameters: {'model_type': 'gcn', 'hidden_dims': '[512, 128]', 'dropout': 0.4832548075982175, 'batch_norm': False, 'lr': 0.005195534693982968, 'weight_decay': 3.596885085657756e-05, 'epochs': 64, 'loss': 'mae', 'optimizer': 'adam', 'graph_mode': 'cutoff', 'cutoff': 0.7380517344180204, 'grm_norm': 'none', 'self_loops': False, 'use_snp_selection': True, 'num_snps': 59225}. Best is trial 21 with value: 0.3153339696847911.
[I 2025-12-08 15:47:58,389] Trial 58 finished with value: 0.3106517924920328 and parameters: {'model_type': 'gcn', 'hidden_dims': '[512, 256]', 'dropout': 0.5862504506716145, 'batch_norm': True, 'lr': 0.0001789908097643955, 'weight_decay': 6.450315963077959e-05, 'epochs': 132, 'loss': 'mae', 'optimizer': 'adam', 'graph_mode': 'cutoff', 'cutoff': 0.7730196073929375, 'grm_norm': 'cosine', 'self_loops': False, 'use_snp_selection': True, 'num_snps': 47998}. Best is trial 21 with value: 0.3153339696847911.
[I 2025-12-08 15:48:40,471] Trial 59 finished with value: 0.3117980174717334 and parameters: {'model_type': 'gcn', 'hidden_dims': '[512, 256]', 'dropout': 0.5880271184523884, 'batch_norm': True, 'lr': 0.0001711007240128537, 'weight_decay': 6.038881810410648e-05, 'epochs': 140, 'loss': 'mae', 'optimizer': 'adam', 'graph_mode': 'cutoff', 'cutoff': 0.7546038037276032, 'grm_norm': 'cosine', 'self_loops': False, 'use_snp_selection': True, 'num_snps': 47610}. Best is trial 21 with value: 0.3153339696847911.
[I 2025-12-08 15:49:22,567] Trial 60 finished with value: 0.3142120116636448 and parameters: {'model_type': 'gcn', 'hidden_dims': '[512, 256]', 'dropout': 0.5843682776561663, 'batch_norm': True, 'lr': 0.00017542139714463251, 'weight_decay': 1.4612057754423958e-05, 'epochs': 140, 'loss': 'mae', 'optimizer': 'adam', 'graph_mode': 'cutoff', 'cutoff': 0.6663101172440031, 'grm_norm': 'cosine', 'self_loops': False, 'use_snp_selection': True, 'num_snps': 47991}. Best is trial 21 with value: 0.3153339696847911.
[I 2025-12-08 15:50:05,013] Trial 61 finished with value: 0.3056212776248809 and parameters: {'model_type': 'gcn', 'hidden_dims': '[512, 256]', 'dropout': 0.5887100992217518, 'batch_norm': True, 'lr': 7.731606061016998e-05, 'weight_decay': 1.425214956218973e-05, 'epochs': 143, 'loss': 'mae', 'optimizer': 'adam', 'graph_mode': 'cutoff', 'cutoff': 0.7480704990613295, 'grm_norm': 'cosine', 'self_loops': False, 'use_snp_selection': True, 'num_snps': 47040}. Best is trial 21 with value: 0.3153339696847911.
[I 2025-12-08 15:50:44,891] Trial 62 finished with value: 0.3087454091029541 and parameters: {'model_type': 'gcn', 'hidden_dims': '[512, 256]', 'dropout': 0.5755316749275194, 'batch_norm': True, 'lr': 0.00017329791733573186, 'weight_decay': 5.1212244329570616e-06, 'epochs': 121, 'loss': 'mae', 'optimizer': 'adam', 'graph_mode': 'cutoff', 'cutoff': 0.6638674160300205, 'grm_norm': 'cosine', 'self_loops': False, 'use_snp_selection': True, 'num_snps': 50110}. Best is trial 21 with value: 0.3153339696847911.
[I 2025-12-08 15:51:18,118] Trial 63 finished with value: 0.3026280765541126 and parameters: {'model_type': 'gcn', 'hidden_dims': '[512, 256]', 'dropout': 0.5588128591048624, 'batch_norm': True, 'lr': 0.00018262645409586084, 'weight_decay': 2.5004700964561857e-05, 'epochs': 110, 'loss': 'mae', 'optimizer': 'adam', 'graph_mode': 'cutoff', 'cutoff': 0.6319780142721275, 'grm_norm': 'cosine', 'self_loops': False, 'use_snp_selection': True, 'num_snps': 42171}. Best is trial 21 with value: 0.3153339696847911.
[I 2025-12-08 15:51:52,924] Trial 64 finished with value: 0.30523986571873407 and parameters: {'model_type': 'gcn', 'hidden_dims': '[512, 256]', 'dropout': 0.5874963912478378, 'batch_norm': True, 'lr': 0.00012286084069492172, 'weight_decay': 7.55318692090112e-05, 'epochs': 133, 'loss': 'mae', 'optimizer': 'adam', 'graph_mode': 'cutoff', 'cutoff': 0.7636191854074976, 'grm_norm': 'cosine', 'self_loops': False, 'use_snp_selection': True, 'num_snps': 38753}. Best is trial 21 with value: 0.3153339696847911.
[I 2025-12-08 15:52:28,369] Trial 65 finished with value: 0.29850307672073456 and parameters: {'model_type': 'gcn', 'hidden_dims': '[512, 256]', 'dropout': 0.5982398357302265, 'batch_norm': True, 'lr': 0.00014084803138868902, 'weight_decay': 4.5134046774204124e-05, 'epochs': 99, 'loss': 'mae', 'optimizer': 'adam', 'graph_mode': 'cutoff', 'cutoff': 0.7051848649612877, 'grm_norm': 'cosine', 'self_loops': False, 'use_snp_selection': True, 'num_snps': 50009}. Best is trial 21 with value: 0.3153339696847911.
[I 2025-12-08 15:53:22,533] Trial 66 finished with value: 0.3080228884791648 and parameters: {'model_type': 'gcn', 'hidden_dims': '[512, 256]', 'dropout': 0.5351297760931766, 'batch_norm': True, 'lr': 0.00025939657932451274, 'weight_decay': 1.0115745449635507e-05, 'epochs': 162, 'loss': 'mae', 'optimizer': 'adam', 'graph_mode': 'cutoff', 'cutoff': 0.7158737430097122, 'grm_norm': 'cosine', 'self_loops': False, 'use_snp_selection': True, 'num_snps': 59353}. Best is trial 21 with value: 0.3153339696847911.
[I 2025-12-08 15:54:00,433] Trial 67 finished with value: 0.26473098666984324 and parameters: {'model_type': 'gcn', 'hidden_dims': '[512, 256]', 'dropout': 0.5628497006086101, 'batch_norm': False, 'lr': 0.000343733947152598, 'weight_decay': 9.042866432544884e-07, 'epochs': 129, 'loss': 'mse', 'optimizer': 'adam', 'graph_mode': 'knn', 'knn_k': 3, 'weighted_edges': False, 'symmetrize_mode': 'mutual', 'self_loops': False, 'use_snp_selection': True, 'num_snps': 44077}. Best is trial 21 with value: 0.3153339696847911.
[I 2025-12-08 15:54:39,719] Trial 68 finished with value: 0.2957674787033299 and parameters: {'model_type': 'gcn', 'hidden_dims': '[512, 256]', 'dropout': 0.5731753231494325, 'batch_norm': True, 'lr': 0.00010623495792097317, 'weight_decay': 1.7261856452228937e-05, 'epochs': 113, 'loss': 'mae', 'optimizer': 'adam', 'graph_mode': 'cutoff', 'cutoff': 0.5891747571056705, 'grm_norm': 'cosine', 'self_loops': False, 'use_snp_selection': True, 'num_snps': 51925}. Best is trial 21 with value: 0.3153339696847911.
[I 2025-12-08 15:55:12,856] Trial 69 finished with value: 0.3058865859768448 and parameters: {'model_type': 'gcn', 'hidden_dims': '[512, 256]', 'dropout': 0.29096155162447573, 'batch_norm': True, 'lr': 0.00022018994917069576, 'weight_decay': 0.0007158704675561259, 'epochs': 146, 'loss': 'mae', 'optimizer': 'adam', 'graph_mode': 'cutoff', 'cutoff': 0.6854389679753043, 'grm_norm': 'cosine', 'self_loops': True, 'use_snp_selection': True, 'num_snps': 33871}. Best is trial 21 with value: 0.3153339696847911.
[I 2025-12-08 15:55:39,592] Trial 70 finished with value: 0.30892021358487753 and parameters: {'model_type': 'gcn', 'hidden_dims': '[512, 256]', 'dropout': 0.519488944591697, 'batch_norm': True, 'lr': 0.00014399064544067352, 'weight_decay': 2.9791089350278508e-06, 'epochs': 75, 'loss': 'mae', 'optimizer': 'adam', 'graph_mode': 'cutoff', 'cutoff': 0.7672403341027465, 'grm_norm': 'cosine', 'self_loops': False, 'use_snp_selection': True, 'num_snps': 39972}. Best is trial 21 with value: 0.3153339696847911.
[I 2025-12-08 15:56:28,299] Trial 71 finished with value: 0.3082392530389688 and parameters: {'model_type': 'gcn', 'hidden_dims': '[512, 256]', 'dropout': 0.5547174102946575, 'batch_norm': True, 'lr': 8.414522760724445e-05, 'weight_decay': 5.8435026721195384e-05, 'epochs': 152, 'loss': 'mae', 'optimizer': 'adam', 'graph_mode': 'cutoff', 'cutoff': 0.8247361751054949, 'grm_norm': 'cosine', 'self_loops': False, 'use_snp_selection': True, 'num_snps': 55136}. Best is trial 21 with value: 0.3153339696847911.
[I 2025-12-08 15:56:52,996] Trial 72 finished with value: 0.29870926229872996 and parameters: {'model_type': 'gcn', 'hidden_dims': '[128, 64]', 'dropout': 0.5338721734113373, 'batch_norm': True, 'lr': 0.00019226775170744185, 'weight_decay': 0.0002836858668566654, 'epochs': 168, 'loss': 'mae', 'optimizer': 'adam', 'graph_mode': 'cutoff', 'cutoff': 0.8645155707239718, 'grm_norm': 'cosine', 'self_loops': False, 'use_snp_selection': True, 'num_snps': 46391}. Best is trial 21 with value: 0.3153339696847911.
[I 2025-12-08 15:57:30,002] Trial 73 finished with value: 0.3054272950222924 and parameters: {'model_type': 'gcn', 'hidden_dims': '[512, 64]', 'dropout': 0.584150291470841, 'batch_norm': True, 'lr': 0.0002837425023801056, 'weight_decay': 0.00048617783353117937, 'epochs': 181, 'loss': 'mae', 'optimizer': 'adam', 'graph_mode': 'cutoff', 'cutoff': 0.8050488455390585, 'grm_norm': 'gcn', 'self_loops': False, 'use_snp_selection': True, 'num_snps': 33151}. Best is trial 21 with value: 0.3153339696847911.
[I 2025-12-08 15:57:53,157] Trial 74 finished with value: 0.3078496716307842 and parameters: {'model_type': 'gcn', 'hidden_dims': '[512, 256]', 'dropout': 0.5197819614415239, 'batch_norm': True, 'lr': 0.0001686821261306414, 'weight_decay': 0.00017340797772054793, 'epochs': 95, 'loss': 'mae', 'optimizer': 'adam', 'graph_mode': 'cutoff', 'cutoff': 0.7796898427228012, 'grm_norm': 'cosine_then_gcn', 'self_loops': False, 'use_snp_selection': True, 'num_snps': 27618}. Best is trial 21 with value: 0.3153339696847911.
[I 2025-12-08 15:58:46,902] Trial 75 finished with value: 0.305233781601978 and parameters: {'model_type': 'gcn', 'hidden_dims': '[512, 128]', 'dropout': 0.5405777675659857, 'batch_norm': True, 'lr': 0.0034561436484039252, 'weight_decay': 0.00010930654701734123, 'epochs': 204, 'loss': 'mae', 'optimizer': 'adam', 'graph_mode': 'cutoff', 'cutoff': 0.816296846184912, 'grm_norm': 'none', 'self_loops': False, 'use_snp_selection': True, 'num_snps': 48691}. Best is trial 21 with value: 0.3153339696847911.
[I 2025-12-08 15:59:20,178] Trial 76 finished with value: 0.3030462846995864 and parameters: {'model_type': 'gcn', 'hidden_dims': '[256, 128, 64]', 'dropout': 0.5616262183394687, 'batch_norm': True, 'lr': 0.00035379619246382556, 'weight_decay': 0.0006114507643796032, 'epochs': 139, 'loss': 'mae', 'optimizer': 'adam', 'graph_mode': 'cutoff', 'cutoff': 0.7309131935443332, 'grm_norm': 'cosine', 'self_loops': False, 'use_snp_selection': True, 'num_snps': 54517}. Best is trial 21 with value: 0.3153339696847911.
[I 2025-12-08 16:00:07,469] Trial 77 finished with value: 0.27753174984864987 and parameters: {'model_type': 'gcn', 'hidden_dims': '[512, 128]', 'dropout': 0.5973614891397764, 'batch_norm': True, 'lr': 0.00010554932241226497, 'weight_decay': 0.00040045534901810535, 'epochs': 188, 'loss': 'mae', 'optimizer': 'adam', 'graph_mode': 'knn', 'knn_k': 8, 'weighted_edges': True, 'symmetrize_mode': 'union', 'self_loops': False, 'use_snp_selection': True, 'num_snps': 42434}. Best is trial 21 with value: 0.3153339696847911.
[I 2025-12-08 16:00:31,538] Trial 78 finished with value: 0.2571566925184046 and parameters: {'model_type': 'gcn', 'hidden_dims': '[256, 128]', 'dropout': 0.4901482152298557, 'batch_norm': True, 'lr': 0.0013922216605738948, 'weight_decay': 7.833341238672076e-06, 'epochs': 64, 'loss': 'mse', 'optimizer': 'adam', 'graph_mode': 'cutoff', 'cutoff': 0.28283207793612264, 'grm_norm': 'cosine_then_gcn', 'self_loops': False, 'use_snp_selection': True, 'num_snps': 52045}. Best is trial 21 with value: 0.3153339696847911.
[I 2025-12-08 16:01:14,487] Trial 79 finished with value: 0.28218507701745704 and parameters: {'model_type': 'gcn', 'hidden_dims': '[512, 128]', 'dropout': 0.5733970602991442, 'batch_norm': False, 'lr': 1.391262208666309e-05, 'weight_decay': 2.7851969834179706e-05, 'epochs': 119, 'loss': 'mae', 'optimizer': 'adam', 'graph_mode': 'cutoff', 'cutoff': 0.753266834897999, 'grm_norm': 'none', 'self_loops': False, 'use_snp_selection': True, 'num_snps': 56314}. Best is trial 21 with value: 0.3153339696847911.
[I 2025-12-08 16:01:36,976] Trial 80 finished with value: 0.2988942185168181 and parameters: {'model_type': 'gcn', 'hidden_dims': '[512, 256]', 'dropout': 0.46959629559437194, 'batch_norm': True, 'lr': 0.009864527267273887, 'weight_decay': 8.175556133249385e-05, 'epochs': 79, 'loss': 'mae', 'optimizer': 'adam', 'graph_mode': 'cutoff', 'cutoff': 0.6719701066149821, 'grm_norm': 'none', 'self_loops': False, 'use_snp_selection': False}. Best is trial 21 with value: 0.3153339696847911.
[I 2025-12-08 16:02:37,056] Trial 81 finished with value: 0.29907621907313975 and parameters: {'model_type': 'gcn', 'hidden_dims': '[512, 128]', 'dropout': 0.5073579659667244, 'batch_norm': True, 'lr': 0.0065372701894368095, 'weight_decay': 0.00012256142125583103, 'epochs': 235, 'loss': 'mae', 'optimizer': 'adam', 'graph_mode': 'cutoff', 'cutoff': 0.8054571506822895, 'grm_norm': 'none', 'self_loops': False, 'use_snp_selection': False}. Best is trial 21 with value: 0.3153339696847911.
[I 2025-12-08 16:02:52,305] Trial 82 finished with value: 0.3077950950512232 and parameters: {'model_type': 'gcn', 'hidden_dims': '[512, 128]', 'dropout': 0.5500254029180967, 'batch_norm': True, 'lr': 0.00048239648972973485, 'weight_decay': 0.00025332275952517344, 'epochs': 49, 'loss': 'mae', 'optimizer': 'adam', 'graph_mode': 'cutoff', 'cutoff': 0.7875527357816401, 'grm_norm': 'none', 'self_loops': False, 'use_snp_selection': False}. Best is trial 21 with value: 0.3153339696847911.
[I 2025-12-08 16:03:37,139] Trial 83 finished with value: 0.3078447587509271 and parameters: {'model_type': 'gcn', 'hidden_dims': '[512, 128]', 'dropout': 0.5247516409323444, 'batch_norm': True, 'lr': 0.0011220788389974762, 'weight_decay': 0.00016036698622725462, 'epochs': 172, 'loss': 'mae', 'optimizer': 'adam', 'graph_mode': 'cutoff', 'cutoff': 0.8338904460879808, 'grm_norm': 'none', 'self_loops': False, 'use_snp_selection': False}. Best is trial 21 with value: 0.3153339696847911.
[I 2025-12-08 16:04:12,128] Trial 84 finished with value: 0.2834646671395514 and parameters: {'model_type': 'gcn', 'hidden_dims': '[512, 128]', 'dropout': 0.49939053325287525, 'batch_norm': True, 'lr': 0.00023937497205828092, 'weight_decay': 6.69380572100654e-05, 'epochs': 130, 'loss': 'mae', 'optimizer': 'adam', 'graph_mode': 'cutoff', 'cutoff': 0.7138467714959074, 'grm_norm': 'none', 'self_loops': False, 'use_snp_selection': False}. Best is trial 21 with value: 0.3153339696847911.
[I 2025-12-08 16:04:53,185] Trial 85 finished with value: 0.31011177948733576 and parameters: {'model_type': 'gcn', 'hidden_dims': '[512, 128]', 'dropout': 0.20729099098105724, 'batch_norm': True, 'lr': 0.0007097192628638701, 'weight_decay': 0.0007928093695163457, 'epochs': 156, 'loss': 'mae', 'optimizer': 'adam', 'graph_mode': 'cutoff', 'cutoff': 0.8690230981187373, 'grm_norm': 'gcn', 'self_loops': False, 'use_snp_selection': False}. Best is trial 21 with value: 0.3153339696847911.
[I 2025-12-08 16:05:06,039] Trial 86 finished with value: 0.3024867396400245 and parameters: {'model_type': 'gcn', 'hidden_dims': '[128, 64]', 'dropout': 0.12240782268040999, 'batch_norm': True, 'lr': 0.0007267789751176062, 'weight_decay': 0.0007691452805889666, 'epochs': 150, 'loss': 'mae', 'optimizer': 'adam', 'graph_mode': 'cutoff', 'cutoff': 0.8725062847059011, 'grm_norm': 'gcn', 'self_loops': False, 'use_snp_selection': False}. Best is trial 21 with value: 0.3153339696847911.
[I 2025-12-08 16:05:48,869] Trial 87 finished with value: 0.3026481912703597 and parameters: {'model_type': 'gcn', 'hidden_dims': '[512, 128]', 'dropout': 0.23734908791054687, 'batch_norm': True, 'lr': 0.00015236273283585248, 'weight_decay': 0.00045936857476752734, 'epochs': 163, 'loss': 'mae', 'optimizer': 'adam', 'graph_mode': 'cutoff', 'cutoff': 0.8490851024197357, 'grm_norm': 'gcn', 'self_loops': True, 'use_snp_selection': False}. Best is trial 21 with value: 0.3153339696847911.
