[I 2025-12-08 15:09:49,553] Trial 1 finished with value: 0.19418008673846096 and parameters: {'model_type': 'gcn', 'hidden_dims': '[256, 128, 64]', 'dropout': 0.5543244404043342, 'batch_norm': True, 'lr': 7.981787657617978e-05, 'weight_decay': 2.8571789869344834e-07, 'epochs': 297, 'loss': 'mae', 'optimizer': 'adam', 'graph_mode': 'cutoff', 'cutoff': 0.3392632777751686, 'grm_norm': 'gcn', 'self_loops': False, 'use_snp_selection': False}. Best is trial 0 with value: 0.23925318886593616.
[I 2025-12-08 15:10:50,036] Trial 2 finished with value: 0.21077027606556928 and parameters: {'model_type': 'gcn', 'hidden_dims': '[512, 64]', 'dropout': 0.32815227354739207, 'batch_norm': True, 'lr': 0.000619605044204259, 'weight_decay': 0.0004086269831625786, 'epochs': 206, 'loss': 'mse', 'optimizer': 'adam', 'graph_mode': 'knn', 'knn_k': 4, 'weighted_edges': True, 'symmetrize_mode': 'union', 'self_loops': True, 'use_snp_selection': True, 'num_snps': 53035}. Best is trial 0 with value: 0.23925318886593616.
[I 2025-12-08 15:11:19,575] Trial 3 finished with value: 0.1954701279665782 and parameters: {'model_type': 'gcn', 'hidden_dims': '[256, 128]', 'dropout': 0.23110783056597514, 'batch_norm': True, 'lr': 8.11311593386298e-05, 'weight_decay': 9.296158109581328e-07, 'epochs': 213, 'loss': 'mse', 'optimizer': 'adam', 'graph_mode': 'knn', 'knn_k': 10, 'weighted_edges': True, 'symmetrize_mode': 'mutual', 'self_loops': True, 'use_snp_selection': False}. Best is trial 0 with value: 0.23925318886593616.
[I 2025-12-08 15:11:34,679] Trial 4 finished with value: 0.30245639831850085 and parameters: {'model_type': 'gcn', 'hidden_dims': '[512, 256]', 'dropout': 0.2753281956415665, 'batch_norm': True, 'lr': 0.00034435188114839693, 'weight_decay': 4.9416012835950194e-05, 'epochs': 89, 'loss': 'mae', 'optimizer': 'adam', 'graph_mode': 'cutoff', 'cutoff': 0.820078967317394, 'grm_norm': 'none', 'self_loops': False, 'use_snp_selection': True, 'num_snps': 12674}. Best is trial 4 with value: 0.30245639831850085.
[I 2025-12-08 15:12:02,146] Trial 5 finished with value: 0.28363102548492164 and parameters: {'model_type': 'gcn', 'hidden_dims': '[128, 64]', 'dropout': 0.5611163934517731, 'batch_norm': True, 'lr': 0.0003984856210762587, 'weight_decay': 1.1466743517565185e-07, 'epochs': 344, 'loss': 'mae', 'optimizer': 'adam', 'graph_mode': 'cutoff', 'cutoff': 0.6089370799714728, 'grm_norm': 'gcn', 'self_loops': True, 'use_snp_selection': False}. Best is trial 4 with value: 0.30245639831850085.
[I 2025-12-08 15:12:25,892] Trial 6 finished with value: 0.27426824290559065 and parameters: {'model_type': 'gcn', 'hidden_dims': '[128, 64]', 'dropout': 0.31805912766941713, 'batch_norm': True, 'lr': 1.2361026034262557e-05, 'weight_decay': 6.492620232791903e-06, 'epochs': 271, 'loss': 'mse', 'optimizer': 'adam', 'graph_mode': 'cutoff', 'cutoff': 0.6193362582230448, 'grm_norm': 'cosine', 'self_loops': False, 'use_snp_selection': True, 'num_snps': 28594}. Best is trial 4 with value: 0.30245639831850085.
[I 2025-12-08 15:12:47,599] Trial 7 finished with value: 0.25376699527813534 and parameters: {'model_type': 'gcn', 'hidden_dims': '[512, 64]', 'dropout': 0.471337288649717, 'batch_norm': True, 'lr': 2.239693207292708e-05, 'weight_decay': 2.263166635514082e-06, 'epochs': 69, 'loss': 'mse', 'optimizer': 'adam', 'graph_mode': 'cutoff', 'cutoff': 0.4056820886426376, 'grm_norm': 'cosine', 'self_loops': False, 'use_snp_selection': False}. Best is trial 4 with value: 0.30245639831850085.
[I 2025-12-08 15:13:26,812] Trial 8 finished with value: 0.2649015294633813 and parameters: {'model_type': 'gcn', 'hidden_dims': '[512, 256]', 'dropout': 0.20659328268932406, 'batch_norm': False, 'lr': 8.93315124361372e-05, 'weight_decay': 0.00028987480727919035, 'epochs': 136, 'loss': 'mae', 'optimizer': 'adam', 'graph_mode': 'knn', 'knn_k': 3, 'weighted_edges': False, 'symmetrize_mode': 'union', 'self_loops': False, 'use_snp_selection': True, 'num_snps': 43128}. Best is trial 4 with value: 0.30245639831850085.
[I 2025-12-08 15:14:10,208] Trial 9 finished with value: 0.01735012114255593 and parameters: {'model_type': 'gcn', 'hidden_dims': '[512, 256]', 'dropout': 0.2888209592870401, 'batch_norm': False, 'lr': 0.004734648143129892, 'weight_decay': 1.5879705591356368e-06, 'epochs': 163, 'loss': 'mse', 'optimizer': 'adam', 'graph_mode': 'cutoff', 'cutoff': 0.5984899797909019, 'grm_norm': 'cosine', 'self_loops': True, 'use_snp_selection': False}. Best is trial 4 with value: 0.30245639831850085.
[I 2025-12-08 15:14:20,344] Trial 10 finished with value: 0.2615184677706624 and parameters: {'model_type': 'gcn', 'hidden_dims': '[512, 128]', 'dropout': 0.11372025982957354, 'batch_norm': False, 'lr': 0.0023343012062770553, 'weight_decay': 4.14440562940608e-05, 'epochs': 41, 'loss': 'mae', 'optimizer': 'adam', 'graph_mode': 'cutoff', 'cutoff': 0.8740100033033124, 'grm_norm': 'none', 'self_loops': False, 'use_snp_selection': True, 'num_snps': 3859}. Best is trial 4 with value: 0.30245639831850085.
[I 2025-12-08 15:14:31,018] Trial 11 finished with value: 0.3004122473485237 and parameters: {'model_type': 'gcn', 'hidden_dims': '[128, 64]', 'dropout': 0.44863014119095845, 'batch_norm': True, 'lr': 0.0005943392021247852, 'weight_decay': 1.0655358607693621e-07, 'epochs': 110, 'loss': 'mae', 'optimizer': 'adam', 'graph_mode': 'cutoff', 'cutoff': 0.8568899271933978, 'grm_norm': 'cosine_then_gcn', 'self_loops': True, 'use_snp_selection': False}. Best is trial 4 with value: 0.30245639831850085.
[I 2025-12-08 15:14:43,584] Trial 12 finished with value: 0.2906528917145796 and parameters: {'model_type': 'gcn', 'hidden_dims': '[512, 256]', 'dropout': 0.42758862319180935, 'batch_norm': True, 'lr': 0.0012059085553112938, 'weight_decay': 3.482253699955131e-05, 'epochs': 103, 'loss': 'mae', 'optimizer': 'adam', 'graph_mode': 'cutoff', 'cutoff': 0.8919050080438428, 'grm_norm': 'cosine_then_gcn', 'self_loops': True, 'use_snp_selection': True, 'num_snps': 6176}. Best is trial 4 with value: 0.30245639831850085.
[I 2025-12-08 15:14:57,995] Trial 13 finished with value: 0.29813823826563485 and parameters: {'model_type': 'gcn', 'hidden_dims': '[256, 128]', 'dropout': 0.4452783958423849, 'batch_norm': True, 'lr': 0.00028764898471530923, 'weight_decay': 8.746795324277564e-06, 'epochs': 96, 'loss': 'mae', 'optimizer': 'adam', 'graph_mode': 'cutoff', 'cutoff': 0.7596101551526167, 'grm_norm': 'cosine_then_gcn', 'self_loops': False, 'use_snp_selection': False}. Best is trial 4 with value: 0.30245639831850085.
[I 2025-12-08 15:15:15,464] Trial 14 finished with value: 0.1797013760068993 and parameters: {'model_type': 'gcn', 'hidden_dims': '[256, 128, 64]', 'dropout': 0.39299544085603144, 'batch_norm': False, 'lr': 0.00903200857050876, 'weight_decay': 0.00014121513384232615, 'epochs': 149, 'loss': 'mae', 'optimizer': 'adam', 'graph_mode': 'cutoff', 'cutoff': 0.7597613116543563, 'grm_norm': 'none', 'self_loops': True, 'use_snp_selection': True, 'num_snps': 16639}. Best is trial 4 with value: 0.30245639831850085.
[I 2025-12-08 15:15:45,169] Trial 15 finished with value: 0.30085552162201923 and parameters: {'model_type': 'gcn', 'hidden_dims': '[512, 128]', 'dropout': 0.49413637725410897, 'batch_norm': True, 'lr': 0.000196808428342167, 'weight_decay': 0.0009750094345805517, 'epochs': 105, 'loss': 'mae', 'optimizer': 'adam', 'graph_mode': 'cutoff', 'cutoff': 0.7577997856891925, 'grm_norm': 'cosine_then_gcn', 'self_loops': False, 'use_snp_selection': False}. Best is trial 4 with value: 0.30245639831850085.
[I 2025-12-08 15:16:04,170] Trial 16 finished with value: 0.31113498011448304 and parameters: {'model_type': 'gcn', 'hidden_dims': '[512, 128]', 'dropout': 0.5065564400563585, 'batch_norm': True, 'lr': 0.00014869658642945196, 'weight_decay': 0.000759056720664848, 'epochs': 62, 'loss': 'mae', 'optimizer': 'adam', 'graph_mode': 'cutoff', 'cutoff': 0.7493987499516714, 'grm_norm': 'none', 'self_loops': False, 'use_snp_selection': False}. Best is trial 16 with value: 0.31113498011448304.
[I 2025-12-08 15:16:18,684] Trial 17 finished with value: 0.25919770252005014 and parameters: {'model_type': 'gcn', 'hidden_dims': '[512, 128]', 'dropout': 0.37526706473388166, 'batch_norm': True, 'lr': 3.8661066828267564e-05, 'weight_decay': 0.000910213678090183, 'epochs': 42, 'loss': 'mae', 'optimizer': 'adam', 'graph_mode': 'cutoff', 'cutoff': 0.5062556644593699, 'grm_norm': 'none', 'self_loops': False, 'use_snp_selection': True, 'num_snps': 18293}. Best is trial 16 with value: 0.31113498011448304.
[I 2025-12-08 15:16:44,094] Trial 18 finished with value: 0.2797350516809206 and parameters: {'model_type': 'gcn', 'hidden_dims': '[512, 128]', 'dropout': 0.11399899071862205, 'batch_norm': False, 'lr': 0.00016869951012262287, 'weight_decay': 0.0001017357104678328, 'epochs': 72, 'loss': 'mae', 'optimizer': 'adam', 'graph_mode': 'knn', 'knn_k': 1, 'weighted_edges': False, 'symmetrize_mode': 'mutual', 'self_loops': False, 'use_snp_selection': True, 'num_snps': 37464}. Best is trial 16 with value: 0.31113498011448304.
[I 2025-12-08 15:17:30,618] Trial 19 finished with value: 0.22885119611315452 and parameters: {'model_type': 'gcn', 'hidden_dims': '[512, 256]', 'dropout': 0.26143995471295434, 'batch_norm': True, 'lr': 0.0008940507643794903, 'weight_decay': 2.052165057887668e-05, 'epochs': 170, 'loss': 'mae', 'optimizer': 'adam', 'graph_mode': 'cutoff', 'cutoff': 0.2219358891087448, 'grm_norm': 'none', 'self_loops': False, 'use_snp_selection': False}. Best is trial 16 with value: 0.31113498011448304.
[I 2025-12-08 15:17:51,975] Trial 20 finished with value: 0.29480784402438526 and parameters: {'model_type': 'gcn', 'hidden_dims': '[512, 256]', 'dropout': 0.5976070116713255, 'batch_norm': True, 'lr': 4.536992959750576e-05, 'weight_decay': 0.00028432645074395513, 'epochs': 73, 'loss': 'mae', 'optimizer': 'adam', 'graph_mode': 'cutoff', 'cutoff': 0.7033546788689287, 'grm_norm': 'none', 'self_loops': False, 'use_snp_selection': False}. Best is trial 16 with value: 0.31113498011448304.
[I 2025-12-08 15:18:25,161] Trial 21 finished with value: 0.3153339696847911 and parameters: {'model_type': 'gcn', 'hidden_dims': '[512, 128]', 'dropout': 0.5117038445325931, 'batch_norm': True, 'lr': 0.0001755964749363814, 'weight_decay': 0.0006986101856712013, 'epochs': 121, 'loss': 'mae', 'optimizer': 'adam', 'graph_mode': 'cutoff', 'cutoff': 0.7596405514348656, 'grm_norm': 'cosine_then_gcn', 'self_loops': False, 'use_snp_selection': False}. Best is trial 21 with value: 0.3153339696847911.
[I 2025-12-08 15:18:59,185] Trial 22 finished with value: 0.28649680773562897 and parameters: {'model_type': 'gcn', 'hidden_dims': '[512, 128]', 'dropout': 0.5158098173292207, 'batch_norm': True, 'lr': 0.000155412094818524, 'weight_decay': 0.00014156578003760655, 'epochs': 125, 'loss': 'mae', 'optimizer': 'adam', 'graph_mode': 'cutoff', 'cutoff': 0.7006834412743986, 'grm_norm': 'none', 'self_loops': False, 'use_snp_selection': False}. Best is trial 21 with value: 0.3153339696847911.
[I 2025-12-08 15:19:46,103] Trial 23 finished with value: 0.30738750529684233 and parameters: {'model_type': 'gcn', 'hidden_dims': '[512, 128]', 'dropout': 0.5309224678437306, 'batch_norm': True, 'lr': 0.0003097255414899433, 'weight_decay': 0.0004911889264231501, 'epochs': 179, 'loss': 'mae', 'optimizer': 'adam', 'graph_mode': 'cutoff', 'cutoff': 0.8143768733607121, 'grm_norm': 'none', 'self_loops': False, 'use_snp_selection': False}. Best is trial 21 with value: 0.3153339696847911.
[I 2025-12-08 15:20:49,532] Trial 24 finished with value: 0.3075061022364201 and parameters: {'model_type': 'gcn', 'hidden_dims': '[512, 128]', 'dropout': 0.5260032681338198, 'batch_norm': True, 'lr': 0.0014616791541689064, 'weight_decay': 0.0005282596262983764, 'epochs': 247, 'loss': 'mae', 'optimizer': 'adam', 'graph_mode': 'cutoff', 'cutoff': 0.7005300953271087, 'grm_norm': 'cosine_then_gcn', 'self_loops': False, 'use_snp_selection': False}. Best is trial 21 with value: 0.3153339696847911.
[I 2025-12-08 15:21:50,330] Trial 25 finished with value: 0.2972860746289073 and parameters: {'model_type': 'gcn', 'hidden_dims': '[512, 128]', 'dropout': 0.5682368055266251, 'batch_norm': True, 'lr': 0.0017470576070710512, 'weight_decay': 0.0005315239879727211, 'epochs': 236, 'loss': 'mae', 'optimizer': 'adam', 'graph_mode': 'cutoff', 'cutoff': 0.6848883588488363, 'grm_norm': 'cosine_then_gcn', 'self_loops': False, 'use_snp_selection': False}. Best is trial 21 with value: 0.3153339696847911.
[I 2025-12-08 15:22:54,488] Trial 26 finished with value: -0.0129913046403102 and parameters: {'model_type': 'gcn', 'hidden_dims': '[512, 128]', 'dropout': 0.49785115960088683, 'batch_norm': False, 'lr': 0.0032984471317662164, 'weight_decay': 0.0001868403081429612, 'epochs': 244, 'loss': 'mse', 'optimizer': 'adam', 'graph_mode': 'knn', 'knn_k': 7, 'weighted_edges': False, 'symmetrize_mode': 'union', 'self_loops': False, 'use_snp_selection': False}. Best is trial 21 with value: 0.3153339696847911.
[I 2025-12-08 15:24:02,951] Trial 27 finished with value: 0.24925735678895738 and parameters: {'model_type': 'gcn', 'hidden_dims': '[512, 128]', 'dropout': 0.41757328956612944, 'batch_norm': True, 'lr': 0.00011734426746722672, 'weight_decay': 0.0006558436870617039, 'epochs': 267, 'loss': 'mae', 'optimizer': 'adam', 'graph_mode': 'cutoff', 'cutoff': 0.5110418046269174, 'grm_norm': 'cosine_then_gcn', 'self_loops': False, 'use_snp_selection': False}. Best is trial 21 with value: 0.3153339696847911.
[I 2025-12-08 15:25:21,540] Trial 28 finished with value: 0.3053263367221195 and parameters: {'model_type': 'gcn', 'hidden_dims': '[512, 128]', 'dropout': 0.596773484680706, 'batch_norm': True, 'lr': 4.768519888775495e-05, 'weight_decay': 9.890138705836822e-05, 'epochs': 311, 'loss': 'mae', 'optimizer': 'adam', 'graph_mode': 'cutoff', 'cutoff': 0.6618725864947297, 'grm_norm': 'cosine_then_gcn', 'self_loops': False, 'use_snp_selection': False}. Best is trial 21 with value: 0.3153339696847911.
[I 2025-12-08 15:26:21,304] Trial 29 finished with value: 0.24137050677455468 and parameters: {'model_type': 'gcn', 'hidden_dims': '[512, 128]', 'dropout': 0.4870313702232657, 'batch_norm': True, 'lr': 0.0006752941532961776, 'weight_decay': 0.0002747629526088678, 'epochs': 228, 'loss': 'mae', 'optimizer': 'adam', 'graph_mode': 'knn', 'knn_k': 10, 'weighted_edges': True, 'symmetrize_mode': 'mutual', 'self_loops': False, 'use_snp_selection': False}. Best is trial 21 with value: 0.3153339696847911.
[I 2025-12-08 15:27:12,595] Trial 30 finished with value: 0.30583888675258397 and parameters: {'model_type': 'gcn', 'hidden_dims': '[512, 64]', 'dropout': 0.5305306704443575, 'batch_norm': True, 'lr': 0.0016477387204810482, 'weight_decay': 1.4855475477034204e-05, 'epochs': 196, 'loss': 'mae', 'optimizer': 'adam', 'graph_mode': 'cutoff', 'cutoff': 0.7837734859506583, 'grm_norm': 'cosine_then_gcn', 'self_loops': False, 'use_snp_selection': False}. Best is trial 21 with value: 0.3153339696847911.
[I 2025-12-08 15:27:57,174] Trial 31 finished with value: 0.30981561750186 and parameters: {'model_type': 'gcn', 'hidden_dims': '[512, 128]', 'dropout': 0.5332304977828266, 'batch_norm': True, 'lr': 0.0002078131549625669, 'weight_decay': 0.0004833669817225949, 'epochs': 168, 'loss': 'mae', 'optimizer': 'adam', 'graph_mode': 'cutoff', 'cutoff': 0.8180997194968134, 'grm_norm': 'none', 'self_loops': False, 'use_snp_selection': False}. Best is trial 21 with value: 0.3153339696847911.
[I 2025-12-08 15:28:17,738] Trial 32 finished with value: 0.29962317160425794 and parameters: {'model_type': 'gcn', 'hidden_dims': '[256, 128, 64]', 'dropout': 0.543356896088143, 'batch_norm': True, 'lr': 0.00025494213007422204, 'weight_decay': 0.0008442723144096152, 'epochs': 138, 'loss': 'mae', 'optimizer': 'adam', 'graph_mode': 'cutoff', 'cutoff': 0.7273076030002356, 'grm_norm': 'gcn', 'self_loops': False, 'use_snp_selection': False}. Best is trial 21 with value: 0.3153339696847911.
[I 2025-12-08 15:29:06,488] Trial 33 finished with value: 0.3037669325087847 and parameters: {'model_type': 'gcn', 'hidden_dims': '[512, 128]', 'dropout': 0.4623664958901822, 'batch_norm': True, 'lr': 0.00013321211589393178, 'weight_decay': 0.00038187611054563917, 'epochs': 184, 'loss': 'mae', 'optimizer': 'adam', 'graph_mode': 'cutoff', 'cutoff': 0.8224815891385406, 'grm_norm': 'none', 'self_loops': False, 'use_snp_selection': False}. Best is trial 21 with value: 0.3153339696847911.
[I 2025-12-08 15:29:28,357] Trial 34 finished with value: 0.30417503899595155 and parameters: {'model_type': 'gcn', 'hidden_dims': '[256, 128]', 'dropout': 0.5130464216246242, 'batch_norm': True, 'lr': 0.00048150829045358145, 'weight_decay': 0.000183997866835559, 'epochs': 154, 'loss': 'mae', 'optimizer': 'adam', 'graph_mode': 'cutoff', 'cutoff': 0.6521406644937361, 'grm_norm': 'cosine_then_gcn', 'self_loops': False, 'use_snp_selection': False}. Best is trial 21 with value: 0.3153339696847911.
[I 2025-12-08 15:30:23,810] Trial 35 finished with value: 0.18685755394270348 and parameters: {'model_type': 'gcn', 'hidden_dims': '[512, 128]', 'dropout': 0.5636865184831024, 'batch_norm': True, 'lr': 0.0002136640987486629, 'weight_decay': 8.276145008995568e-05, 'epochs': 211, 'loss': 'mse', 'optimizer': 'adam', 'graph_mode': 'knn', 'knn_k': 1, 'weighted_edges': False, 'symmetrize_mode': 'union', 'self_loops': False, 'use_snp_selection': False}. Best is trial 21 with value: 0.3153339696847911.
[I 2025-12-08 15:31:41,777] Trial 36 finished with value: 0.29597177143338727 and parameters: {'model_type': 'gcn', 'hidden_dims': '[512, 128]', 'dropout': 0.39746921598947943, 'batch_norm': True, 'lr': 9.081100456682864e-05, 'weight_decay': 0.0004917460344129826, 'epochs': 307, 'loss': 'mae', 'optimizer': 'adam', 'graph_mode': 'cutoff', 'cutoff': 0.8085221034754835, 'grm_norm': 'none', 'self_loops': False, 'use_snp_selection': False}. Best is trial 21 with value: 0.3153339696847911.
[I 2025-12-08 15:32:00,163] Trial 37 finished with value: 0.2883912714757261 and parameters: {'model_type': 'gcn', 'hidden_dims': '[256, 128, 64]', 'dropout': 0.5737174468931984, 'batch_norm': True, 'lr': 5.6128698501206e-05, 'weight_decay': 3.3413761779852584e-07, 'epochs': 121, 'loss': 'mae', 'optimizer': 'adam', 'graph_mode': 'cutoff', 'cutoff': 0.5631815857626931, 'grm_norm': 'cosine_then_gcn', 'self_loops': False, 'use_snp_selection': False}. Best is trial 21 with value: 0.3153339696847911.
[I 2025-12-08 15:33:08,977] Trial 38 finished with value: 0.27451818462961824 and parameters: {'model_type': 'gcn', 'hidden_dims': '[512, 128]', 'dropout': 0.4782975623756578, 'batch_norm': True, 'lr': 2.726418932637214e-05, 'weight_decay': 6.585184801172097e-05, 'epochs': 268, 'loss': 'mse', 'optimizer': 'adam', 'graph_mode': 'cutoff', 'cutoff': 0.7301057622464152, 'grm_norm': 'gcn', 'self_loops': True, 'use_snp_selection': False}. Best is trial 21 with value: 0.3153339696847911.
[I 2025-12-08 15:33:18,649] Trial 39 finished with value: 0.2612818991908921 and parameters: {'model_type': 'gcn', 'hidden_dims': '[128, 64]', 'dropout': 0.5449245643759025, 'batch_norm': True, 'lr': 0.0004259293810694137, 'weight_decay': 4.030547219671232e-06, 'epochs': 86, 'loss': 'mae', 'optimizer': 'adam', 'graph_mode': 'knn', 'knn_k': 5, 'weighted_edges': True, 'symmetrize_mode': 'union', 'self_loops': False, 'use_snp_selection': False}. Best is trial 21 with value: 0.3153339696847911.
[I 2025-12-08 15:34:09,771] Trial 40 finished with value: 0.3010454792489513 and parameters: {'model_type': 'gcn', 'hidden_dims': '[512, 64]', 'dropout': 0.3241521384424838, 'batch_norm': False, 'lr': 6.539242864865874e-05, 'weight_decay': 0.0003186574551027668, 'epochs': 195, 'loss': 'mse', 'optimizer': 'adam', 'graph_mode': 'cutoff', 'cutoff': 0.8461987624098386, 'grm_norm': 'cosine', 'self_loops': False, 'use_snp_selection': False}. Best is trial 21 with value: 0.3153339696847911.
[I 2025-12-08 15:34:55,663] Trial 41 finished with value: 0.30223696529759086 and parameters: {'model_type': 'gcn', 'hidden_dims': '[512, 128]', 'dropout': 0.5258194955309446, 'batch_norm': True, 'lr': 0.00031266747811934005, 'weight_decay': 0.0005525678446313886, 'epochs': 174, 'loss': 'mae', 'optimizer': 'adam', 'graph_mode': 'cutoff', 'cutoff': 0.7892581501941186, 'grm_norm': 'none', 'self_loops': False, 'use_snp_selection': False}. Best is trial 21 with value: 0.3153339696847911.
[I 2025-12-08 15:35:53,030] Trial 42 finished with value: 0.3097881349609089 and parameters: {'model_type': 'gcn', 'hidden_dims': '[512, 128]', 'dropout': 0.5091045882589108, 'batch_norm': True, 'lr': 0.0009130883981135179, 'weight_decay': 0.00021342091709775264, 'epochs': 221, 'loss': 'mae', 'optimizer': 'adam', 'graph_mode': 'cutoff', 'cutoff': 0.8205933069289091, 'grm_norm': 'none', 'self_loops': False, 'use_snp_selection': False}. Best is trial 21 with value: 0.3153339696847911.
[I 2025-12-08 15:36:57,714] Trial 43 finished with value: 0.3092998230712377 and parameters: {'model_type': 'gcn', 'hidden_dims': '[512, 128]', 'dropout': 0.5059516638909076, 'batch_norm': True, 'lr': 0.0008252719398573258, 'weight_decay': 0.0002366660928113991, 'epochs': 253, 'loss': 'mae', 'optimizer': 'adam', 'graph_mode': 'cutoff', 'cutoff': 0.8915372602251426, 'grm_norm': 'none', 'self_loops': False, 'use_snp_selection': False}. Best is trial 21 with value: 0.3153339696847911.
[I 2025-12-08 15:37:26,419] Trial 44 finished with value: 0.3057798884634092 and parameters: {'model_type': 'gcn', 'hidden_dims': '[256, 128]', 'dropout': 0.3561197205496971, 'batch_norm': True, 'lr': 0.0008708822948085631, 'weight_decay': 0.0002151365487094069, 'epochs': 219, 'loss': 'mae', 'optimizer': 'adam', 'graph_mode': 'cutoff', 'cutoff': 0.8879964676363511, 'grm_norm': 'none', 'self_loops': False, 'use_snp_selection': False}. Best is trial 21 with value: 0.3153339696847911.
