[I 2025-12-08 10:57:01,325] Trial 127 finished with value: 0.3259790792988092 and parameters: {'model_type': 'gcn', 'hidden_dims': '[128, 64]', 'dropout': 0.12401146198354511, 'batch_norm': False, 'lr': 0.0005461333802236537, 'weight_decay': 3.378735100178712e-06, 'epochs': 112, 'loss': 'mse', 'optimizer': 'adam', 'graph_mode': 'cutoff', 'cutoff': 0.6478358056379656, 'grm_norm': 'cosine_then_gcn', 'self_loops': True, 'use_snp_selection': True, 'num_snps': 20074}. Best is trial 124 with value: 0.35741966317924095.
[I 2025-12-08 10:57:17,358] Trial 128 finished with value: 0.33140560431607036 and parameters: {'model_type': 'gcn', 'hidden_dims': '[256, 128]', 'dropout': 0.15003902646625875, 'batch_norm': True, 'lr': 0.0008988692401175166, 'weight_decay': 3.944547806041392e-06, 'epochs': 46, 'loss': 'mae', 'optimizer': 'adam', 'graph_mode': 'cutoff', 'cutoff': 0.6144550872115819, 'grm_norm': 'cosine_then_gcn', 'self_loops': True, 'use_snp_selection': True, 'num_snps': 31232}. Best is trial 124 with value: 0.35741966317924095.
[I 2025-12-08 10:57:55,050] Trial 129 finished with value: 0.33689406436267316 and parameters: {'model_type': 'gcn', 'hidden_dims': '[512, 256]', 'dropout': 0.13921089120735314, 'batch_norm': False, 'lr': 4.016277685960274e-05, 'weight_decay': 3.873762127452584e-05, 'epochs': 97, 'loss': 'mae', 'optimizer': 'adam', 'graph_mode': 'cutoff', 'cutoff': 0.6894377024303757, 'grm_norm': 'cosine', 'self_loops': True, 'use_snp_selection': True, 'num_snps': 56613}. Best is trial 124 with value: 0.35741966317924095.
[I 2025-12-08 10:58:16,414] Trial 130 finished with value: 0.34388881247020014 and parameters: {'model_type': 'gcn', 'hidden_dims': '[512, 128]', 'dropout': 0.12048808986632643, 'batch_norm': False, 'lr': 0.00016473534772794214, 'weight_decay': 5.330396879347647e-06, 'epochs': 78, 'loss': 'mae', 'optimizer': 'adam', 'graph_mode': 'cutoff', 'cutoff': 0.7117492848022913, 'grm_norm': 'cosine_then_gcn', 'self_loops': False, 'use_snp_selection': True, 'num_snps': 28725}. Best is trial 124 with value: 0.35741966317924095.
[I 2025-12-08 10:58:42,321] Trial 131 finished with value: 0.35033838266334427 and parameters: {'model_type': 'gcn', 'hidden_dims': '[512, 256]', 'dropout': 0.11291053057680829, 'batch_norm': False, 'lr': 0.0012071592244508407, 'weight_decay': 0.0004417443631329399, 'epochs': 130, 'loss': 'mae', 'optimizer': 'adam', 'graph_mode': 'cutoff', 'cutoff': 0.6720670589829006, 'grm_norm': 'cosine_then_gcn', 'self_loops': True, 'use_snp_selection': True, 'num_snps': 26771}. Best is trial 124 with value: 0.35741966317924095.
[I 2025-12-08 10:59:10,592] Trial 132 finished with value: 0.28003169712071846 and parameters: {'model_type': 'gcn', 'hidden_dims': '[512, 256]', 'dropout': 0.41136039420844217, 'batch_norm': False, 'lr': 0.0010761888474639359, 'weight_decay': 0.0006021290678738149, 'epochs': 149, 'loss': 'mae', 'optimizer': 'adam', 'graph_mode': 'cutoff', 'cutoff': 0.6687128277712208, 'grm_norm': 'cosine_then_gcn', 'self_loops': True, 'use_snp_selection': True, 'num_snps': 27543}. Best is trial 124 with value: 0.35741966317924095.
[I 2025-12-08 10:59:40,640] Trial 133 finished with value: 0.33747085564654056 and parameters: {'model_type': 'gcn', 'hidden_dims': '[512, 256]', 'dropout': 0.12682188774320935, 'batch_norm': False, 'lr': 0.0012509656321158867, 'weight_decay': 0.0004075595376575542, 'epochs': 171, 'loss': 'mae', 'optimizer': 'adam', 'graph_mode': 'cutoff', 'cutoff': 0.7291863392017612, 'grm_norm': 'cosine_then_gcn', 'self_loops': True, 'use_snp_selection': True, 'num_snps': 26558}. Best is trial 124 with value: 0.35741966317924095.
[I 2025-12-08 11:00:04,348] Trial 134 finished with value: 0.343002433500431 and parameters: {'model_type': 'gcn', 'hidden_dims': '[512, 256]', 'dropout': 0.11196124607290467, 'batch_norm': False, 'lr': 0.0004230488556266386, 'weight_decay': 0.0001819974150077536, 'epochs': 138, 'loss': 'mae', 'optimizer': 'adam', 'graph_mode': 'cutoff', 'cutoff': 0.6595006175349076, 'grm_norm': 'cosine_then_gcn', 'self_loops': True, 'use_snp_selection': True, 'num_snps': 22335}. Best is trial 124 with value: 0.35741966317924095.
[I 2025-12-08 11:00:19,282] Trial 135 finished with value: 0.2897318522976574 and parameters: {'model_type': 'gcn', 'hidden_dims': '[512, 256]', 'dropout': 0.135140631969293, 'batch_norm': False, 'lr': 0.0021872475353196387, 'weight_decay': 7.962093317803574e-05, 'epochs': 57, 'loss': 'mae', 'optimizer': 'adam', 'graph_mode': 'cutoff', 'cutoff': 0.6352476055086665, 'grm_norm': 'cosine_then_gcn', 'self_loops': True, 'use_snp_selection': True, 'num_snps': 17282}. Best is trial 124 with value: 0.35741966317924095.
[I 2025-12-08 11:00:33,067] Trial 136 finished with value: 0.33271733325517705 and parameters: {'model_type': 'gcn', 'hidden_dims': '[512, 256]', 'dropout': 0.1476535557732288, 'batch_norm': False, 'lr': 2.5907090319503126e-05, 'weight_decay': 0.00023938863848065048, 'epochs': 128, 'loss': 'mae', 'optimizer': 'adam', 'graph_mode': 'cutoff', 'cutoff': 0.5880560270628166, 'grm_norm': 'cosine_then_gcn', 'self_loops': True, 'use_snp_selection': True, 'num_snps': 7755}. Best is trial 124 with value: 0.35741966317924095.
[I 2025-12-08 11:00:47,400] Trial 137 finished with value: 0.3404430117358144 and parameters: {'model_type': 'gcn', 'hidden_dims': '[128, 64]', 'dropout': 0.1617889781869657, 'batch_norm': False, 'lr': 0.0005990178948553765, 'weight_decay': 0.00010716246795090416, 'epochs': 118, 'loss': 'mae', 'optimizer': 'adam', 'graph_mode': 'cutoff', 'cutoff': 0.5428625373271514, 'grm_norm': 'cosine_then_gcn', 'self_loops': False, 'use_snp_selection': True, 'num_snps': 20520}. Best is trial 124 with value: 0.35741966317924095.
[I 2025-12-08 11:01:13,040] Trial 138 finished with value: 0.35168486262660176 and parameters: {'model_type': 'gcn', 'hidden_dims': '[512, 256]', 'dropout': 0.12690663753406498, 'batch_norm': False, 'lr': 0.0018152589258363379, 'weight_decay': 0.00014612978586567193, 'epochs': 85, 'loss': 'mae', 'optimizer': 'adam', 'graph_mode': 'knn', 'knn_k': 1, 'weighted_edges': True, 'symmetrize_mode': 'mutual', 'self_loops': True, 'use_snp_selection': True, 'num_snps': 35896}. Best is trial 124 with value: 0.35741966317924095.
[I 2025-12-08 11:01:37,786] Trial 139 finished with value: 0.14472927028079138 and parameters: {'model_type': 'gcn', 'hidden_dims': '[512, 256]', 'dropout': 0.1287550929987983, 'batch_norm': False, 'lr': 0.0017691413959541379, 'weight_decay': 6.7412634835832685e-06, 'epochs': 84, 'loss': 'mse', 'optimizer': 'adam', 'graph_mode': 'knn', 'knn_k': 1, 'weighted_edges': True, 'symmetrize_mode': 'mutual', 'self_loops': True, 'use_snp_selection': True, 'num_snps': 34385}. Best is trial 124 with value: 0.35741966317924095.
[I 2025-12-08 11:02:23,896] Trial 140 finished with value: 0.32427176768887767 and parameters: {'model_type': 'gcn', 'hidden_dims': '[512, 256]', 'dropout': 0.14196626300444165, 'batch_norm': False, 'lr': 0.0005269088327670521, 'weight_decay': 0.00014352250757667696, 'epochs': 193, 'loss': 'mae', 'optimizer': 'adam', 'graph_mode': 'knn', 'knn_k': 2, 'weighted_edges': True, 'symmetrize_mode': 'mutual', 'self_loops': False, 'use_snp_selection': True, 'num_snps': 42556}. Best is trial 124 with value: 0.35741966317924095.
[I 2025-12-08 11:02:56,489] Trial 141 finished with value: 0.27439845088466724 and parameters: {'model_type': 'gcn', 'hidden_dims': '[512, 256]', 'dropout': 0.11383757110345029, 'batch_norm': False, 'lr': 0.0015588962331270057, 'weight_decay': 0.0001691612593799665, 'epochs': 65, 'loss': 'mae', 'optimizer': 'adam', 'graph_mode': 'knn', 'knn_k': 1, 'weighted_edges': True, 'symmetrize_mode': 'mutual', 'self_loops': True, 'use_snp_selection': True, 'num_snps': 59847}. Best is trial 124 with value: 0.35741966317924095.
[I 2025-12-08 11:03:26,247] Trial 142 finished with value: 0.2969625471434414 and parameters: {'model_type': 'gcn', 'hidden_dims': '[512, 256]', 'dropout': 0.12806417537160936, 'batch_norm': False, 'lr': 0.0010181943407650703, 'weight_decay': 0.00046867450674561696, 'epochs': 72, 'loss': 'mae', 'optimizer': 'adam', 'graph_mode': 'knn', 'knn_k': 3, 'weighted_edges': True, 'symmetrize_mode': 'mutual', 'self_loops': True, 'use_snp_selection': True, 'num_snps': 49223}. Best is trial 124 with value: 0.35741966317924095.
[I 2025-12-08 11:03:44,941] Trial 143 finished with value: 0.33794721283752255 and parameters: {'model_type': 'gcn', 'hidden_dims': '[512, 256]', 'dropout': 0.1154771090944066, 'batch_norm': False, 'lr': 0.0024507524298043844, 'weight_decay': 9.190278134580646e-05, 'epochs': 93, 'loss': 'mae', 'optimizer': 'adam', 'graph_mode': 'knn', 'knn_k': 2, 'weighted_edges': True, 'symmetrize_mode': 'mutual', 'self_loops': True, 'use_snp_selection': True, 'num_snps': 19251}. Best is trial 124 with value: 0.35741966317924095.
[I 2025-12-08 11:04:05,388] Trial 144 finished with value: 0.3612236390416207 and parameters: {'model_type': 'gcn', 'hidden_dims': '[256, 128, 64]', 'dropout': 0.15284486495594646, 'batch_norm': False, 'lr': 0.0013863282818868477, 'weight_decay': 6.648724740314952e-05, 'epochs': 106, 'loss': 'mae', 'optimizer': 'adam', 'graph_mode': 'cutoff', 'cutoff': 0.5602095934757413, 'grm_norm': 'cosine_then_gcn', 'self_loops': True, 'use_snp_selection': True, 'num_snps': 31222}. Best is trial 144 with value: 0.3612236390416207.
[I 2025-12-08 11:04:27,724] Trial 145 finished with value: 0.3527735781735154 and parameters: {'model_type': 'gcn', 'hidden_dims': '[256, 128, 64]', 'dropout': 0.1548379015506031, 'batch_norm': False, 'lr': 0.0007670490744191357, 'weight_decay': 0.00012939188580684012, 'epochs': 108, 'loss': 'mae', 'optimizer': 'adam', 'graph_mode': 'cutoff', 'cutoff': 0.7541409640548545, 'grm_norm': 'cosine', 'self_loops': True, 'use_snp_selection': True, 'num_snps': 36624}. Best is trial 144 with value: 0.3612236390416207.
[I 2025-12-08 11:04:52,388] Trial 146 finished with value: 0.34333026540455996 and parameters: {'model_type': 'gcn', 'hidden_dims': '[256, 128, 64]', 'dropout': 0.17790727304832699, 'batch_norm': False, 'lr': 0.0007747611035629961, 'weight_decay': 3.034670236018267e-06, 'epochs': 126, 'loss': 'mae', 'optimizer': 'adam', 'graph_mode': 'cutoff', 'cutoff': 0.7606011004861418, 'grm_norm': 'cosine', 'self_loops': True, 'use_snp_selection': True, 'num_snps': 38616}. Best is trial 144 with value: 0.3612236390416207.
[I 2025-12-08 11:05:14,216] Trial 147 finished with value: 0.323030220890287 and parameters: {'model_type': 'gcn', 'hidden_dims': '[256, 128, 64]', 'dropout': 0.15495581252864438, 'batch_norm': False, 'lr': 0.0019012720490901617, 'weight_decay': 4.351436594288419e-06, 'epochs': 101, 'loss': 'mae', 'optimizer': 'adam', 'graph_mode': 'cutoff', 'cutoff': 0.706042784483314, 'grm_norm': 'cosine', 'self_loops': True, 'use_snp_selection': True, 'num_snps': 36655}. Best is trial 144 with value: 0.3612236390416207.
[I 2025-12-08 11:05:35,405] Trial 148 finished with value: 0.2622500554363332 and parameters: {'model_type': 'gcn', 'hidden_dims': '[256, 128, 64]', 'dropout': 0.16731623611398957, 'batch_norm': True, 'lr': 0.0008919247062839749, 'weight_decay': 2.123351316056706e-06, 'epochs': 116, 'loss': 'mae', 'optimizer': 'adam', 'graph_mode': 'knn', 'knn_k': 7, 'weighted_edges': True, 'symmetrize_mode': 'mutual', 'self_loops': False, 'use_snp_selection': True, 'num_snps': 30511}. Best is trial 144 with value: 0.3612236390416207.
[I 2025-12-08 11:05:56,320] Trial 149 finished with value: 0.34429391852592206 and parameters: {'model_type': 'gcn', 'hidden_dims': '[256, 128, 64]', 'dropout': 0.19116232609296918, 'batch_norm': False, 'lr': 0.000638993186057593, 'weight_decay': 1.0489308171790639e-07, 'epochs': 108, 'loss': 'mae', 'optimizer': 'adam', 'graph_mode': 'cutoff', 'cutoff': 0.7987432472072609, 'grm_norm': 'cosine', 'self_loops': True, 'use_snp_selection': True, 'num_snps': 32698}. Best is trial 144 with value: 0.3612236390416207.
[I 2025-12-08 11:06:25,366] Trial 0 finished with value: 0.25566796177948936 and parameters: {'model_type': 'gcn', 'hidden_dims': '[128, 64]', 'dropout': 0.199031432379812, 'batch_norm': True, 'lr': 1.8408544111075823e-05, 'weight_decay': 5.5136510071208614e-05, 'epochs': 336, 'loss': 'mae', 'optimizer': 'adam', 'graph_mode': 'knn', 'knn_k': 8, 'weighted_edges': True, 'symmetrize_mode': 'mutual', 'self_loops': True, 'use_snp_selection': True, 'num_snps': 27173}. Best is trial 0 with value: 0.25566796177948936.
[I 2025-12-08 11:07:03,817] Trial 1 finished with value: 0.22029880820859846 and parameters: {'model_type': 'gcn', 'hidden_dims': '[256, 128, 64]', 'dropout': 0.5543244404043342, 'batch_norm': True, 'lr': 7.981787657617978e-05, 'weight_decay': 2.8571789869344834e-07, 'epochs': 297, 'loss': 'mae', 'optimizer': 'adam', 'graph_mode': 'cutoff', 'cutoff': 0.3392632777751686, 'grm_norm': 'gcn', 'self_loops': False, 'use_snp_selection': False}. Best is trial 0 with value: 0.25566796177948936.
[I 2025-12-08 11:08:01,655] Trial 2 finished with value: 0.2450464698286512 and parameters: {'model_type': 'gcn', 'hidden_dims': '[512, 64]', 'dropout': 0.32815227354739207, 'batch_norm': True, 'lr': 0.000619605044204259, 'weight_decay': 0.0004086269831625786, 'epochs': 206, 'loss': 'mse', 'optimizer': 'adam', 'graph_mode': 'knn', 'knn_k': 4, 'weighted_edges': True, 'symmetrize_mode': 'union', 'self_loops': True, 'use_snp_selection': True, 'num_snps': 53035}. Best is trial 0 with value: 0.25566796177948936.
[I 2025-12-08 11:08:29,207] Trial 3 finished with value: 0.25013867873448425 and parameters: {'model_type': 'gcn', 'hidden_dims': '[256, 128]', 'dropout': 0.23110783056597514, 'batch_norm': True, 'lr': 8.11311593386298e-05, 'weight_decay': 9.296158109581328e-07, 'epochs': 213, 'loss': 'mse', 'optimizer': 'adam', 'graph_mode': 'knn', 'knn_k': 10, 'weighted_edges': True, 'symmetrize_mode': 'mutual', 'self_loops': True, 'use_snp_selection': False}. Best is trial 0 with value: 0.25566796177948936.
[I 2025-12-08 11:08:43,780] Trial 4 finished with value: 0.35082313422103845 and parameters: {'model_type': 'gcn', 'hidden_dims': '[512, 256]', 'dropout': 0.2753281956415665, 'batch_norm': True, 'lr': 0.00034435188114839693, 'weight_decay': 4.9416012835950194e-05, 'epochs': 89, 'loss': 'mae', 'optimizer': 'adam', 'graph_mode': 'cutoff', 'cutoff': 0.820078967317394, 'grm_norm': 'none', 'self_loops': False, 'use_snp_selection': True, 'num_snps': 12674}. Best is trial 4 with value: 0.35082313422103845.
[I 2025-12-08 11:09:08,911] Trial 5 finished with value: 0.3141754987475225 and parameters: {'model_type': 'gcn', 'hidden_dims': '[128, 64]', 'dropout': 0.5611163934517731, 'batch_norm': True, 'lr': 0.0003984856210762587, 'weight_decay': 1.1466743517565185e-07, 'epochs': 344, 'loss': 'mae', 'optimizer': 'adam', 'graph_mode': 'cutoff', 'cutoff': 0.6089370799714728, 'grm_norm': 'gcn', 'self_loops': True, 'use_snp_selection': False}. Best is trial 4 with value: 0.35082313422103845.
[I 2025-12-08 11:09:31,346] Trial 6 finished with value: 0.30107724925217105 and parameters: {'model_type': 'gcn', 'hidden_dims': '[128, 64]', 'dropout': 0.31805912766941713, 'batch_norm': True, 'lr': 1.2361026034262557e-05, 'weight_decay': 6.492620232791903e-06, 'epochs': 271, 'loss': 'mse', 'optimizer': 'adam', 'graph_mode': 'cutoff', 'cutoff': 0.6193362582230448, 'grm_norm': 'cosine', 'self_loops': False, 'use_snp_selection': True, 'num_snps': 28594}. Best is trial 4 with value: 0.35082313422103845.
[I 2025-12-08 11:09:51,175] Trial 7 finished with value: 0.2858038541612593 and parameters: {'model_type': 'gcn', 'hidden_dims': '[512, 64]', 'dropout': 0.471337288649717, 'batch_norm': True, 'lr': 2.239693207292708e-05, 'weight_decay': 2.263166635514082e-06, 'epochs': 69, 'loss': 'mse', 'optimizer': 'adam', 'graph_mode': 'cutoff', 'cutoff': 0.4056820886426376, 'grm_norm': 'cosine', 'self_loops': False, 'use_snp_selection': False}. Best is trial 4 with value: 0.35082313422103845.
[I 2025-12-08 11:10:28,711] Trial 8 finished with value: 0.34414222737998196 and parameters: {'model_type': 'gcn', 'hidden_dims': '[512, 256]', 'dropout': 0.20659328268932406, 'batch_norm': False, 'lr': 8.93315124361372e-05, 'weight_decay': 0.00028987480727919035, 'epochs': 136, 'loss': 'mae', 'optimizer': 'adam', 'graph_mode': 'knn', 'knn_k': 3, 'weighted_edges': False, 'symmetrize_mode': 'union', 'self_loops': False, 'use_snp_selection': True, 'num_snps': 43128}. Best is trial 4 with value: 0.35082313422103845.
[I 2025-12-08 11:11:10,829] Trial 9 finished with value: -0.0039003360052524555 and parameters: {'model_type': 'gcn', 'hidden_dims': '[512, 256]', 'dropout': 0.2888209592870401, 'batch_norm': False, 'lr': 0.004734648143129892, 'weight_decay': 1.5879705591356368e-06, 'epochs': 163, 'loss': 'mse', 'optimizer': 'adam', 'graph_mode': 'cutoff', 'cutoff': 0.5984899797909019, 'grm_norm': 'cosine', 'self_loops': True, 'use_snp_selection': False}. Best is trial 4 with value: 0.35082313422103845.
[I 2025-12-08 11:11:19,941] Trial 10 finished with value: 0.3218961162466467 and parameters: {'model_type': 'gcn', 'hidden_dims': '[512, 128]', 'dropout': 0.11372025982957354, 'batch_norm': False, 'lr': 0.0023343012062770553, 'weight_decay': 4.14440562940608e-05, 'epochs': 41, 'loss': 'mae', 'optimizer': 'adam', 'graph_mode': 'cutoff', 'cutoff': 0.8740100033033124, 'grm_norm': 'none', 'self_loops': False, 'use_snp_selection': True, 'num_snps': 3859}. Best is trial 4 with value: 0.35082313422103845.
[I 2025-12-08 11:11:56,163] Trial 11 finished with value: 0.3395114537294156 and parameters: {'model_type': 'gcn', 'hidden_dims': '[512, 256]', 'dropout': 0.42220860806405436, 'batch_norm': False, 'lr': 0.00012587284186352953, 'weight_decay': 0.0006590033092812647, 'epochs': 114, 'loss': 'mae', 'optimizer': 'adam', 'graph_mode': 'knn', 'knn_k': 1, 'weighted_edges': False, 'symmetrize_mode': 'union', 'self_loops': False, 'use_snp_selection': True, 'num_snps': 47068}. Best is trial 4 with value: 0.35082313422103845.
[I 2025-12-08 11:12:10,888] Trial 12 finished with value: 0.3448342202595267 and parameters: {'model_type': 'gcn', 'hidden_dims': '[512, 256]', 'dropout': 0.14142767069304862, 'batch_norm': False, 'lr': 0.0011798598123878552, 'weight_decay': 9.414718277089941e-05, 'epochs': 124, 'loss': 'mae', 'optimizer': 'adam', 'graph_mode': 'knn', 'knn_k': 3, 'weighted_edges': False, 'symmetrize_mode': 'union', 'self_loops': False, 'use_snp_selection': True, 'num_snps': 8584}. Best is trial 4 with value: 0.35082313422103845.
[I 2025-12-08 11:12:23,488] Trial 13 finished with value: 0.345775807162601 and parameters: {'model_type': 'gcn', 'hidden_dims': '[512, 256]', 'dropout': 0.13529665206282515, 'batch_norm': False, 'lr': 0.0013143362382724787, 'weight_decay': 5.2475435102613655e-05, 'epochs': 101, 'loss': 'mae', 'optimizer': 'adam', 'graph_mode': 'knn', 'knn_k': 6, 'weighted_edges': False, 'symmetrize_mode': 'union', 'self_loops': False, 'use_snp_selection': True, 'num_snps': 5870}. Best is trial 4 with value: 0.35082313422103845.
[I 2025-12-08 11:12:39,233] Trial 14 finished with value: 0.25302980656564167 and parameters: {'model_type': 'gcn', 'hidden_dims': '[512, 256]', 'dropout': 0.25632205209505254, 'batch_norm': False, 'lr': 0.00687208991084213, 'weight_decay': 1.8542303090238745e-05, 'epochs': 82, 'loss': 'mae', 'optimizer': 'adam', 'graph_mode': 'cutoff', 'cutoff': 0.8944237199027842, 'grm_norm': 'none', 'self_loops': False, 'use_snp_selection': True, 'num_snps': 15654}. Best is trial 4 with value: 0.35082313422103845.
[I 2025-12-08 11:12:53,272] Trial 15 finished with value: 0.29174111057421215 and parameters: {'model_type': 'gcn', 'hidden_dims': '[256, 128, 64]', 'dropout': 0.40991201822777057, 'batch_norm': False, 'lr': 0.0015315707618607853, 'weight_decay': 8.602279249719694e-06, 'epochs': 88, 'loss': 'mae', 'optimizer': 'adam', 'graph_mode': 'knn', 'knn_k': 7, 'weighted_edges': False, 'symmetrize_mode': 'union', 'self_loops': False, 'use_snp_selection': True, 'num_snps': 14623}. Best is trial 4 with value: 0.35082313422103845.
[I 2025-12-08 11:13:18,551] Trial 16 finished with value: 0.2624795070903986 and parameters: {'model_type': 'gcn', 'hidden_dims': '[512, 128]', 'dropout': 0.1573538820129295, 'batch_norm': True, 'lr': 0.0002351737822521291, 'weight_decay': 0.00013965361036408488, 'epochs': 168, 'loss': 'mae', 'optimizer': 'adam', 'graph_mode': 'knn', 'knn_k': 6, 'weighted_edges': False, 'symmetrize_mode': 'mutual', 'self_loops': False, 'use_snp_selection': True, 'num_snps': 19782}. Best is trial 4 with value: 0.35082313422103845.
[I 2025-12-08 11:13:27,345] Trial 17 finished with value: 0.33151801090904925 and parameters: {'model_type': 'gcn', 'hidden_dims': '[256, 128]', 'dropout': 0.36694829928621503, 'batch_norm': False, 'lr': 0.0008407831391711085, 'weight_decay': 3.2193607048083006e-05, 'epochs': 45, 'loss': 'mae', 'optimizer': 'adam', 'graph_mode': 'cutoff', 'cutoff': 0.7365908344247583, 'grm_norm': 'cosine_then_gcn', 'self_loops': False, 'use_snp_selection': True, 'num_snps': 2778}. Best is trial 4 with value: 0.35082313422103845.
[I 2025-12-08 11:13:54,861] Trial 18 finished with value: 0.3235417711262861 and parameters: {'model_type': 'gcn', 'hidden_dims': '[512, 256]', 'dropout': 0.10093752871871903, 'batch_norm': True, 'lr': 0.00025458792542160157, 'weight_decay': 0.00021038576568746655, 'epochs': 162, 'loss': 'mae', 'optimizer': 'adam', 'graph_mode': 'knn', 'knn_k': 9, 'weighted_edges': False, 'symmetrize_mode': 'union', 'self_loops': False, 'use_snp_selection': True, 'num_snps': 22119}. Best is trial 4 with value: 0.35082313422103845.
