[I 2025-12-08 17:31:42,091] Trial 135 finished with value: 0.2885009961786974 and parameters: {'model_type': 'gcn', 'hidden_dims': '[512, 256]', 'dropout': 0.5553610234495718, 'batch_norm': False, 'lr': 1.8406418353297303e-05, 'weight_decay': 8.835836596317888e-05, 'epochs': 191, 'loss': 'mse', 'optimizer': 'adam', 'graph_mode': 'cutoff', 'cutoff': 0.8392285152445538, 'grm_norm': 'none', 'self_loops': False, 'use_snp_selection': True, 'num_snps': 28617}. Best is trial 63 with value: 0.29437649173181957.
[I 2025-12-08 17:32:13,590] Trial 136 finished with value: 0.27639564586578536 and parameters: {'model_type': 'gcn', 'hidden_dims': '[512, 256]', 'dropout': 0.5864744536859307, 'batch_norm': False, 'lr': 1.3788623597973416e-05, 'weight_decay': 0.00013680401833145842, 'epochs': 197, 'loss': 'mse', 'optimizer': 'adam', 'graph_mode': 'cutoff', 'cutoff': 0.8104484076963028, 'grm_norm': 'none', 'self_loops': False, 'use_snp_selection': True, 'num_snps': 25095}. Best is trial 63 with value: 0.29437649173181957.
[I 2025-12-08 17:32:49,203] Trial 137 finished with value: 0.2809922709520228 and parameters: {'model_type': 'gcn', 'hidden_dims': '[512, 256]', 'dropout': 0.54224620209607, 'batch_norm': False, 'lr': 1.9382343829162504e-05, 'weight_decay': 0.00017227211270136905, 'epochs': 187, 'loss': 'mse', 'optimizer': 'adam', 'graph_mode': 'knn', 'knn_k': 5, 'weighted_edges': False, 'symmetrize_mode': 'mutual', 'self_loops': False, 'use_snp_selection': True, 'num_snps': 30060}. Best is trial 63 with value: 0.29437649173181957.
[I 2025-12-08 17:33:15,968] Trial 138 finished with value: 0.27298340718384473 and parameters: {'model_type': 'gcn', 'hidden_dims': '[512, 256]', 'dropout': 0.5794832485553502, 'batch_norm': False, 'lr': 1.0286136459809128e-05, 'weight_decay': 0.00011651132736086709, 'epochs': 176, 'loss': 'mse', 'optimizer': 'adam', 'graph_mode': 'cutoff', 'cutoff': 0.8334312770007283, 'grm_norm': 'none', 'self_loops': False, 'use_snp_selection': True, 'num_snps': 21737}. Best is trial 63 with value: 0.29437649173181957.
[I 2025-12-08 17:33:34,369] Trial 139 finished with value: 0.24860677782299317 and parameters: {'model_type': 'gcn', 'hidden_dims': '[128, 64]', 'dropout': 0.5589193022252579, 'batch_norm': False, 'lr': 1.4370412439632285e-05, 'weight_decay': 0.00032833063732427956, 'epochs': 181, 'loss': 'mse', 'optimizer': 'adam', 'graph_mode': 'cutoff', 'cutoff': 0.7816592464147012, 'grm_norm': 'none', 'self_loops': False, 'use_snp_selection': True, 'num_snps': 27424}. Best is trial 63 with value: 0.29437649173181957.
[I 2025-12-08 17:34:06,426] Trial 140 finished with value: 0.2876960620146722 and parameters: {'model_type': 'gcn', 'hidden_dims': '[512, 256]', 'dropout': 0.5270722206020981, 'batch_norm': False, 'lr': 1.7351804162241907e-05, 'weight_decay': 0.0002584442031040927, 'epochs': 171, 'loss': 'mse', 'optimizer': 'adam', 'graph_mode': 'cutoff', 'cutoff': 0.859050214537702, 'grm_norm': 'none', 'self_loops': False, 'use_snp_selection': True, 'num_snps': 29311}. Best is trial 63 with value: 0.29437649173181957.
[I 2025-12-08 17:34:40,376] Trial 141 finished with value: 0.285880000563964 and parameters: {'model_type': 'gcn', 'hidden_dims': '[512, 256]', 'dropout': 0.5951045646136263, 'batch_norm': False, 'lr': 2.9613337634890314e-05, 'weight_decay': 0.0001522597762168755, 'epochs': 167, 'loss': 'mse', 'optimizer': 'adam', 'graph_mode': 'cutoff', 'cutoff': 0.8306671893433968, 'grm_norm': 'none', 'self_loops': False, 'use_snp_selection': True, 'num_snps': 32420}. Best is trial 63 with value: 0.29437649173181957.
[I 2025-12-08 17:35:14,965] Trial 142 finished with value: 0.28697740303098374 and parameters: {'model_type': 'gcn', 'hidden_dims': '[512, 256]', 'dropout': 0.5468141193951587, 'batch_norm': False, 'lr': 2.1258744468302013e-05, 'weight_decay': 9.549090172911437e-05, 'epochs': 161, 'loss': 'mse', 'optimizer': 'adam', 'graph_mode': 'cutoff', 'cutoff': 0.8043148552312613, 'grm_norm': 'none', 'self_loops': False, 'use_snp_selection': True, 'num_snps': 34284}. Best is trial 63 with value: 0.29437649173181957.
[I 2025-12-08 17:35:50,252] Trial 143 finished with value: 0.2833585079661701 and parameters: {'model_type': 'gcn', 'hidden_dims': '[512, 256]', 'dropout': 0.5739142128294998, 'batch_norm': False, 'lr': 3.452481340453863e-05, 'weight_decay': 7.157527734036278e-05, 'epochs': 191, 'loss': 'mse', 'optimizer': 'adam', 'graph_mode': 'cutoff', 'cutoff': 0.8733976925813435, 'grm_norm': 'none', 'self_loops': False, 'use_snp_selection': True, 'num_snps': 29965}. Best is trial 63 with value: 0.29437649173181957.
[I 2025-12-08 17:36:17,368] Trial 144 finished with value: 0.2813635211650613 and parameters: {'model_type': 'gcn', 'hidden_dims': '[512, 256]', 'dropout': 0.5821916128998761, 'batch_norm': False, 'lr': 2.32828450840521e-05, 'weight_decay': 0.0001309621676656371, 'epochs': 156, 'loss': 'mse', 'optimizer': 'adam', 'graph_mode': 'cutoff', 'cutoff': 0.7939355466169167, 'grm_norm': 'none', 'self_loops': False, 'use_snp_selection': True, 'num_snps': 24403}. Best is trial 63 with value: 0.29437649173181957.
[I 2025-12-08 17:36:55,484] Trial 145 finished with value: 0.27841589361427144 and parameters: {'model_type': 'gcn', 'hidden_dims': '[512, 256]', 'dropout': 0.5633336487802549, 'batch_norm': False, 'lr': 4.5395195743319673e-05, 'weight_decay': 0.0001991019492854181, 'epochs': 205, 'loss': 'mse', 'optimizer': 'adam', 'graph_mode': 'cutoff', 'cutoff': 0.8505433307114776, 'grm_norm': 'none', 'self_loops': False, 'use_snp_selection': True, 'num_snps': 31569}. Best is trial 63 with value: 0.29437649173181957.
[I 2025-12-08 17:37:26,467] Trial 146 finished with value: 0.2810207110999391 and parameters: {'model_type': 'gcn', 'hidden_dims': '[512, 256]', 'dropout': 0.4457020335647246, 'batch_norm': False, 'lr': 2.704899364558145e-05, 'weight_decay': 0.00014418990328439482, 'epochs': 164, 'loss': 'mse', 'optimizer': 'adam', 'graph_mode': 'cutoff', 'cutoff': 0.8236132101141342, 'grm_norm': 'none', 'self_loops': True, 'use_snp_selection': True, 'num_snps': 28651}. Best is trial 63 with value: 0.29437649173181957.
[I 2025-12-08 17:37:57,198] Trial 147 finished with value: 0.295144562546282 and parameters: {'model_type': 'gcn', 'hidden_dims': '[512, 256]', 'dropout': 0.4253078328547382, 'batch_norm': False, 'lr': 1.224015330724162e-05, 'weight_decay': 9.339961036423239e-05, 'epochs': 184, 'loss': 'mse', 'optimizer': 'adam', 'graph_mode': 'cutoff', 'cutoff': 0.5312825626366493, 'grm_norm': 'none', 'self_loops': False, 'use_snp_selection': True, 'num_snps': 25767}. Best is trial 147 with value: 0.295144562546282.
[I 2025-12-08 17:38:28,611] Trial 148 finished with value: 0.28780076673705934 and parameters: {'model_type': 'gcn', 'hidden_dims': '[512, 128]', 'dropout': 0.43053985538613254, 'batch_norm': False, 'lr': 1.2446389625418423e-05, 'weight_decay': 8.132206840413758e-05, 'epochs': 185, 'loss': 'mse', 'optimizer': 'adam', 'graph_mode': 'cutoff', 'cutoff': 0.724076733997289, 'grm_norm': 'none', 'self_loops': False, 'use_snp_selection': True, 'num_snps': 26199}. Best is trial 147 with value: 0.295144562546282.
[I 2025-12-08 17:38:54,121] Trial 149 finished with value: 0.2862452789227869 and parameters: {'model_type': 'gcn', 'hidden_dims': '[512, 256]', 'dropout': 0.4621811483019381, 'batch_norm': False, 'lr': 1.9742769712781974e-05, 'weight_decay': 0.00010232328352086505, 'epochs': 174, 'loss': 'mse', 'optimizer': 'adam', 'graph_mode': 'cutoff', 'cutoff': 0.5386264687951283, 'grm_norm': 'none', 'self_loops': False, 'use_snp_selection': True, 'num_snps': 20182}. Best is trial 147 with value: 0.295144562546282.
[I 2025-12-08 17:39:25,823] Trial 0 finished with value: 0.23004789982525442 and parameters: {'model_type': 'gcn', 'hidden_dims': '[128, 64]', 'dropout': 0.199031432379812, 'batch_norm': True, 'lr': 1.8408544111075823e-05, 'weight_decay': 5.5136510071208614e-05, 'epochs': 336, 'loss': 'mae', 'optimizer': 'adam', 'graph_mode': 'knn', 'knn_k': 8, 'weighted_edges': True, 'symmetrize_mode': 'mutual', 'self_loops': True, 'use_snp_selection': True, 'num_snps': 27173}. Best is trial 0 with value: 0.23004789982525442.
[I 2025-12-08 17:40:04,035] Trial 1 finished with value: 0.2126696354784389 and parameters: {'model_type': 'gcn', 'hidden_dims': '[256, 128, 64]', 'dropout': 0.5543244404043342, 'batch_norm': True, 'lr': 7.981787657617978e-05, 'weight_decay': 2.8571789869344834e-07, 'epochs': 297, 'loss': 'mae', 'optimizer': 'adam', 'graph_mode': 'cutoff', 'cutoff': 0.3392632777751686, 'grm_norm': 'gcn', 'self_loops': False, 'use_snp_selection': False}. Best is trial 0 with value: 0.23004789982525442.
[I 2025-12-08 17:41:02,069] Trial 2 finished with value: 0.1982066285323895 and parameters: {'model_type': 'gcn', 'hidden_dims': '[512, 64]', 'dropout': 0.32815227354739207, 'batch_norm': True, 'lr': 0.000619605044204259, 'weight_decay': 0.0004086269831625786, 'epochs': 206, 'loss': 'mse', 'optimizer': 'adam', 'graph_mode': 'knn', 'knn_k': 4, 'weighted_edges': True, 'symmetrize_mode': 'union', 'self_loops': True, 'use_snp_selection': True, 'num_snps': 53035}. Best is trial 0 with value: 0.23004789982525442.
[I 2025-12-08 17:41:29,452] Trial 3 finished with value: 0.20214287715791118 and parameters: {'model_type': 'gcn', 'hidden_dims': '[256, 128]', 'dropout': 0.23110783056597514, 'batch_norm': True, 'lr': 8.11311593386298e-05, 'weight_decay': 9.296158109581328e-07, 'epochs': 213, 'loss': 'mse', 'optimizer': 'adam', 'graph_mode': 'knn', 'knn_k': 10, 'weighted_edges': True, 'symmetrize_mode': 'mutual', 'self_loops': True, 'use_snp_selection': False}. Best is trial 0 with value: 0.23004789982525442.
[I 2025-12-08 17:41:44,155] Trial 4 finished with value: 0.28406428402854017 and parameters: {'model_type': 'gcn', 'hidden_dims': '[512, 256]', 'dropout': 0.2753281956415665, 'batch_norm': True, 'lr': 0.00034435188114839693, 'weight_decay': 4.9416012835950194e-05, 'epochs': 89, 'loss': 'mae', 'optimizer': 'adam', 'graph_mode': 'cutoff', 'cutoff': 0.820078967317394, 'grm_norm': 'none', 'self_loops': False, 'use_snp_selection': True, 'num_snps': 12674}. Best is trial 4 with value: 0.28406428402854017.
[I 2025-12-08 17:42:09,106] Trial 5 finished with value: 0.25745595785535463 and parameters: {'model_type': 'gcn', 'hidden_dims': '[128, 64]', 'dropout': 0.5611163934517731, 'batch_norm': True, 'lr': 0.0003984856210762587, 'weight_decay': 1.1466743517565185e-07, 'epochs': 344, 'loss': 'mae', 'optimizer': 'adam', 'graph_mode': 'cutoff', 'cutoff': 0.6089370799714728, 'grm_norm': 'gcn', 'self_loops': True, 'use_snp_selection': False}. Best is trial 4 with value: 0.28406428402854017.
[I 2025-12-08 17:42:31,714] Trial 6 finished with value: 0.2686344062881114 and parameters: {'model_type': 'gcn', 'hidden_dims': '[128, 64]', 'dropout': 0.31805912766941713, 'batch_norm': True, 'lr': 1.2361026034262557e-05, 'weight_decay': 6.492620232791903e-06, 'epochs': 271, 'loss': 'mse', 'optimizer': 'adam', 'graph_mode': 'cutoff', 'cutoff': 0.6193362582230448, 'grm_norm': 'cosine', 'self_loops': False, 'use_snp_selection': True, 'num_snps': 28594}. Best is trial 4 with value: 0.28406428402854017.
[I 2025-12-08 17:42:51,382] Trial 7 finished with value: 0.24773246832924084 and parameters: {'model_type': 'gcn', 'hidden_dims': '[512, 64]', 'dropout': 0.471337288649717, 'batch_norm': True, 'lr': 2.239693207292708e-05, 'weight_decay': 2.263166635514082e-06, 'epochs': 69, 'loss': 'mse', 'optimizer': 'adam', 'graph_mode': 'cutoff', 'cutoff': 0.4056820886426376, 'grm_norm': 'cosine', 'self_loops': False, 'use_snp_selection': False}. Best is trial 4 with value: 0.28406428402854017.
[I 2025-12-08 17:43:29,093] Trial 8 finished with value: 0.2639063362762878 and parameters: {'model_type': 'gcn', 'hidden_dims': '[512, 256]', 'dropout': 0.20659328268932406, 'batch_norm': False, 'lr': 8.93315124361372e-05, 'weight_decay': 0.00028987480727919035, 'epochs': 136, 'loss': 'mae', 'optimizer': 'adam', 'graph_mode': 'knn', 'knn_k': 3, 'weighted_edges': False, 'symmetrize_mode': 'union', 'self_loops': False, 'use_snp_selection': True, 'num_snps': 43128}. Best is trial 4 with value: 0.28406428402854017.
[I 2025-12-08 17:44:11,159] Trial 9 finished with value: 0.031219991750949007 and parameters: {'model_type': 'gcn', 'hidden_dims': '[512, 256]', 'dropout': 0.2888209592870401, 'batch_norm': False, 'lr': 0.004734648143129892, 'weight_decay': 1.5879705591356368e-06, 'epochs': 163, 'loss': 'mse', 'optimizer': 'adam', 'graph_mode': 'cutoff', 'cutoff': 0.5984899797909019, 'grm_norm': 'cosine', 'self_loops': True, 'use_snp_selection': False}. Best is trial 4 with value: 0.28406428402854017.
[I 2025-12-08 17:44:20,458] Trial 10 finished with value: 0.25481025145328534 and parameters: {'model_type': 'gcn', 'hidden_dims': '[512, 128]', 'dropout': 0.11372025982957354, 'batch_norm': False, 'lr': 0.0023343012062770553, 'weight_decay': 4.14440562940608e-05, 'epochs': 41, 'loss': 'mae', 'optimizer': 'adam', 'graph_mode': 'cutoff', 'cutoff': 0.8740100033033124, 'grm_norm': 'none', 'self_loops': False, 'use_snp_selection': True, 'num_snps': 3859}. Best is trial 4 with value: 0.28406428402854017.
[I 2025-12-08 17:44:37,862] Trial 11 finished with value: 0.27069291952063773 and parameters: {'model_type': 'gcn', 'hidden_dims': '[128, 64]', 'dropout': 0.40483337339263037, 'batch_norm': True, 'lr': 0.0008716651983952945, 'weight_decay': 1.6792768777147005e-05, 'epochs': 253, 'loss': 'mse', 'optimizer': 'adam', 'graph_mode': 'cutoff', 'cutoff': 0.8576830859783061, 'grm_norm': 'cosine_then_gcn', 'self_loops': False, 'use_snp_selection': True, 'num_snps': 16385}. Best is trial 4 with value: 0.28406428402854017.
[I 2025-12-08 17:44:52,120] Trial 12 finished with value: 0.2717489700033515 and parameters: {'model_type': 'gcn', 'hidden_dims': '[512, 256]', 'dropout': 0.42058772746038836, 'batch_norm': True, 'lr': 0.0011839894135894482, 'weight_decay': 3.769314426796163e-05, 'epochs': 111, 'loss': 'mse', 'optimizer': 'adam', 'graph_mode': 'cutoff', 'cutoff': 0.8997334580241522, 'grm_norm': 'cosine_then_gcn', 'self_loops': False, 'use_snp_selection': True, 'num_snps': 9404}. Best is trial 4 with value: 0.28406428402854017.
[I 2025-12-08 17:45:02,661] Trial 13 finished with value: 0.23956674313273033 and parameters: {'model_type': 'gcn', 'hidden_dims': '[512, 256]', 'dropout': 0.4341332937751319, 'batch_norm': True, 'lr': 0.0018435488415382577, 'weight_decay': 0.00010487442510472757, 'epochs': 106, 'loss': 'mae', 'optimizer': 'adam', 'graph_mode': 'cutoff', 'cutoff': 0.7865478727444295, 'grm_norm': 'cosine_then_gcn', 'self_loops': False, 'use_snp_selection': True, 'num_snps': 2722}. Best is trial 4 with value: 0.28406428402854017.
[I 2025-12-08 17:45:20,087] Trial 14 finished with value: 0.19442054048624563 and parameters: {'model_type': 'gcn', 'hidden_dims': '[512, 256]', 'dropout': 0.38761239997752067, 'batch_norm': False, 'lr': 0.008744281029186956, 'weight_decay': 1.1930383557863318e-05, 'epochs': 104, 'loss': 'mae', 'optimizer': 'adam', 'graph_mode': 'cutoff', 'cutoff': 0.739384470062415, 'grm_norm': 'none', 'self_loops': False, 'use_snp_selection': True, 'num_snps': 15706}. Best is trial 4 with value: 0.28406428402854017.
[I 2025-12-08 17:45:40,688] Trial 15 finished with value: 0.2860714037416533 and parameters: {'model_type': 'gcn', 'hidden_dims': '[512, 256]', 'dropout': 0.5079586938766676, 'batch_norm': True, 'lr': 0.00019917992184554818, 'weight_decay': 0.0008123085288536146, 'epochs': 158, 'loss': 'mse', 'optimizer': 'adam', 'graph_mode': 'cutoff', 'cutoff': 0.7275399680093717, 'grm_norm': 'cosine_then_gcn', 'self_loops': False, 'use_snp_selection': True, 'num_snps': 15194}. Best is trial 15 with value: 0.2860714037416533.
[I 2025-12-08 17:46:05,015] Trial 16 finished with value: 0.2839836780321546 and parameters: {'model_type': 'gcn', 'hidden_dims': '[512, 128]', 'dropout': 0.5074606042461072, 'batch_norm': True, 'lr': 0.0002075877141913459, 'weight_decay': 0.00072773905543734, 'epochs': 161, 'loss': 'mse', 'optimizer': 'adam', 'graph_mode': 'cutoff', 'cutoff': 0.7175434572540981, 'grm_norm': 'none', 'self_loops': False, 'use_snp_selection': True, 'num_snps': 20383}. Best is trial 15 with value: 0.2860714037416533.
[I 2025-12-08 17:46:25,118] Trial 17 finished with value: 0.23095850563325007 and parameters: {'model_type': 'gcn', 'hidden_dims': '[256, 128, 64]', 'dropout': 0.2702037781903839, 'batch_norm': True, 'lr': 0.00022845254464933431, 'weight_decay': 0.0001172775091180384, 'epochs': 70, 'loss': 'mae', 'optimizer': 'adam', 'graph_mode': 'cutoff', 'cutoff': 0.47709696350666464, 'grm_norm': 'none', 'self_loops': False, 'use_snp_selection': True, 'num_snps': 38424}. Best is trial 15 with value: 0.2860714037416533.
[I 2025-12-08 17:46:44,939] Trial 18 finished with value: 0.2572380924604134 and parameters: {'model_type': 'gcn', 'hidden_dims': '[256, 128]', 'dropout': 0.36263622831349185, 'batch_norm': False, 'lr': 0.00012146633967625105, 'weight_decay': 0.0007805871620966975, 'epochs': 174, 'loss': 'mse', 'optimizer': 'adam', 'graph_mode': 'knn', 'knn_k': 1, 'weighted_edges': False, 'symmetrize_mode': 'mutual', 'self_loops': False, 'use_snp_selection': True, 'num_snps': 21061}. Best is trial 15 with value: 0.2860714037416533.
[I 2025-12-08 17:47:05,716] Trial 19 finished with value: 0.2934508337753504 and parameters: {'model_type': 'gcn', 'hidden_dims': '[512, 256]', 'dropout': 0.5995145236134543, 'batch_norm': True, 'lr': 3.9749609453181005e-05, 'weight_decay': 0.00019258983777349208, 'epochs': 231, 'loss': 'mae', 'optimizer': 'adam', 'graph_mode': 'cutoff', 'cutoff': 0.7106561718329152, 'grm_norm': 'cosine_then_gcn', 'self_loops': False, 'use_snp_selection': True, 'num_snps': 10680}. Best is trial 19 with value: 0.2934508337753504.
[I 2025-12-08 17:47:52,716] Trial 20 finished with value: 0.22832830563423298 and parameters: {'model_type': 'gcn', 'hidden_dims': '[512, 256]', 'dropout': 0.5908565359562941, 'batch_norm': True, 'lr': 4.2733795867291983e-05, 'weight_decay': 0.0002666389913980857, 'epochs': 230, 'loss': 'mae', 'optimizer': 'adam', 'graph_mode': 'cutoff', 'cutoff': 0.2234589932533121, 'grm_norm': 'cosine_then_gcn', 'self_loops': False, 'use_snp_selection': True, 'num_snps': 35344}. Best is trial 19 with value: 0.2934508337753504.
[I 2025-12-08 17:48:10,642] Trial 21 finished with value: 0.28185270796592193 and parameters: {'model_type': 'gcn', 'hidden_dims': '[512, 256]', 'dropout': 0.5071237907515573, 'batch_norm': True, 'lr': 3.781996825417674e-05, 'weight_decay': 0.0001421855800111949, 'epochs': 186, 'loss': 'mae', 'optimizer': 'adam', 'graph_mode': 'cutoff', 'cutoff': 0.7117557717366555, 'grm_norm': 'cosine_then_gcn', 'self_loops': False, 'use_snp_selection': True, 'num_snps': 10148}. Best is trial 19 with value: 0.2934508337753504.
[I 2025-12-08 17:48:27,029] Trial 22 finished with value: 0.2737923089708843 and parameters: {'model_type': 'gcn', 'hidden_dims': '[512, 256]', 'dropout': 0.5905055949919167, 'batch_norm': True, 'lr': 0.000459524316595707, 'weight_decay': 0.00022546814195725283, 'epochs': 139, 'loss': 'mae', 'optimizer': 'adam', 'graph_mode': 'cutoff', 'cutoff': 0.7867471466777212, 'grm_norm': 'cosine_then_gcn', 'self_loops': False, 'use_snp_selection': True, 'num_snps': 10644}. Best is trial 19 with value: 0.2934508337753504.
[I 2025-12-08 17:49:00,619] Trial 23 finished with value: 0.28708964889867566 and parameters: {'model_type': 'gcn', 'hidden_dims': '[512, 256]', 'dropout': 0.5187806585254409, 'batch_norm': True, 'lr': 0.000185717999415743, 'weight_decay': 7.34463912596506e-05, 'epochs': 235, 'loss': 'mae', 'optimizer': 'adam', 'graph_mode': 'cutoff', 'cutoff': 0.6656309440875677, 'grm_norm': 'cosine_then_gcn', 'self_loops': False, 'use_snp_selection': True, 'num_snps': 23174}. Best is trial 19 with value: 0.2934508337753504.
[I 2025-12-08 17:49:35,041] Trial 24 finished with value: 0.29124207950035297 and parameters: {'model_type': 'gcn', 'hidden_dims': '[512, 256]', 'dropout': 0.5127674604358509, 'batch_norm': True, 'lr': 0.00015864963968328737, 'weight_decay': 0.0005674818215336487, 'epochs': 243, 'loss': 'mae', 'optimizer': 'adam', 'graph_mode': 'cutoff', 'cutoff': 0.6653422099842323, 'grm_norm': 'cosine_then_gcn', 'self_loops': False, 'use_snp_selection': True, 'num_snps': 23307}. Best is trial 19 with value: 0.2934508337753504.
[I 2025-12-08 17:50:10,337] Trial 25 finished with value: 0.2264206657691739 and parameters: {'model_type': 'gcn', 'hidden_dims': '[512, 256]', 'dropout': 0.4665968118223398, 'batch_norm': True, 'lr': 3.7544166286640394e-05, 'weight_decay': 2.4715472727915887e-05, 'epochs': 245, 'loss': 'mae', 'optimizer': 'adam', 'graph_mode': 'cutoff', 'cutoff': 0.5215044698097842, 'grm_norm': 'cosine_then_gcn', 'self_loops': False, 'use_snp_selection': True, 'num_snps': 24061}. Best is trial 19 with value: 0.2934508337753504.
[I 2025-12-08 17:51:23,686] Trial 26 finished with value: 0.10266402741289331 and parameters: {'model_type': 'gcn', 'hidden_dims': '[512, 64]', 'dropout': 0.5440334775149109, 'batch_norm': False, 'lr': 0.00013404013279546696, 'weight_decay': 7.55842909620672e-05, 'epochs': 285, 'loss': 'mae', 'optimizer': 'adam', 'graph_mode': 'knn', 'knn_k': 7, 'weighted_edges': False, 'symmetrize_mode': 'union', 'self_loops': True, 'use_snp_selection': False}. Best is trial 19 with value: 0.2934508337753504.
[I 2025-12-08 17:52:00,156] Trial 27 finished with value: 0.2744696732675419 and parameters: {'model_type': 'gcn', 'hidden_dims': '[256, 128, 64]', 'dropout': 0.4566290960367284, 'batch_norm': True, 'lr': 5.8565266937851264e-05, 'weight_decay': 5.82449327402825e-06, 'epochs': 313, 'loss': 'mae', 'optimizer': 'adam', 'graph_mode': 'cutoff', 'cutoff': 0.678613568486062, 'grm_norm': 'cosine_then_gcn', 'self_loops': False, 'use_snp_selection': True, 'num_snps': 32591}. Best is trial 19 with value: 0.2934508337753504.
