[I 2025-12-08 23:12:02,789] Trial 143 finished with value: 0.30813551118556415 and parameters: {'model_type': 'gcn', 'hidden_dims': '[512, 256]', 'dropout': 0.2939303964344726, 'batch_norm': True, 'lr': 0.00016219352543588478, 'weight_decay': 2.031954630753855e-07, 'epochs': 227, 'loss': 'mae', 'optimizer': 'adam', 'graph_mode': 'cutoff', 'cutoff': 0.8025555740956822, 'grm_norm': 'cosine_then_gcn', 'self_loops': False, 'use_snp_selection': True, 'num_snps': 45116}. Best is trial 88 with value: 0.3161096373420557.
[I 2025-12-08 23:12:29,550] Trial 144 finished with value: 0.29311076244853995 and parameters: {'model_type': 'gcn', 'hidden_dims': '[512, 256]', 'dropout': 0.4986849258734553, 'batch_norm': True, 'lr': 1.3830353725220541e-05, 'weight_decay': 0.00048527161764606505, 'epochs': 93, 'loss': 'mse', 'optimizer': 'adam', 'graph_mode': 'cutoff', 'cutoff': 0.7209441041571275, 'grm_norm': 'gcn', 'self_loops': False, 'use_snp_selection': False}. Best is trial 88 with value: 0.3161096373420557.
[I 2025-12-08 23:13:30,579] Trial 145 finished with value: 0.22613128596543683 and parameters: {'model_type': 'gcn', 'hidden_dims': '[512, 64]', 'dropout': 0.5359463465987913, 'batch_norm': True, 'lr': 0.00025380227794863977, 'weight_decay': 6.666747789458332e-07, 'epochs': 280, 'loss': 'mae', 'optimizer': 'adam', 'graph_mode': 'cutoff', 'cutoff': 0.5033095401205818, 'grm_norm': 'cosine_then_gcn', 'self_loops': False, 'use_snp_selection': True, 'num_snps': 41086}. Best is trial 88 with value: 0.3161096373420557.
[I 2025-12-08 23:14:36,292] Trial 146 finished with value: 0.3085460183831936 and parameters: {'model_type': 'gcn', 'hidden_dims': '[512, 256]', 'dropout': 0.54962037934031, 'batch_norm': True, 'lr': 0.004320470370238902, 'weight_decay': 2.73889978945377e-07, 'epochs': 271, 'loss': 'mae', 'optimizer': 'adam', 'graph_mode': 'cutoff', 'cutoff': 0.7358397539817982, 'grm_norm': 'cosine_then_gcn', 'self_loops': False, 'use_snp_selection': True, 'num_snps': 48122}. Best is trial 88 with value: 0.3161096373420557.
[I 2025-12-08 23:14:51,477] Trial 147 finished with value: 0.3003274162325757 and parameters: {'model_type': 'gcn', 'hidden_dims': '[256, 128]', 'dropout': 0.5993552881611598, 'batch_norm': True, 'lr': 0.00012954483494943074, 'weight_decay': 4.990241241558749e-07, 'epochs': 101, 'loss': 'mae', 'optimizer': 'adam', 'graph_mode': 'cutoff', 'cutoff': 0.7705484753222092, 'grm_norm': 'none', 'self_loops': False, 'use_snp_selection': False}. Best is trial 88 with value: 0.3161096373420557.
[I 2025-12-08 23:15:41,377] Trial 148 finished with value: 0.29377799364983315 and parameters: {'model_type': 'gcn', 'hidden_dims': '[512, 256]', 'dropout': 0.5446189496537325, 'batch_norm': True, 'lr': 0.00017676593205951462, 'weight_decay': 3.253911776085551e-07, 'epochs': 156, 'loss': 'mse', 'optimizer': 'adam', 'graph_mode': 'cutoff', 'cutoff': 0.57027642839886, 'grm_norm': 'cosine_then_gcn', 'self_loops': False, 'use_snp_selection': True, 'num_snps': 54891}. Best is trial 88 with value: 0.3161096373420557.
[I 2025-12-08 23:16:28,150] Trial 149 finished with value: 0.24529173144381144 and parameters: {'model_type': 'gcn', 'hidden_dims': '[512, 64]', 'dropout': 0.561223271423178, 'batch_norm': True, 'lr': 0.00014398021385418752, 'weight_decay': 9.020663531683767e-07, 'epochs': 122, 'loss': 'mae', 'optimizer': 'adam', 'graph_mode': 'knn', 'knn_k': 9, 'weighted_edges': False, 'symmetrize_mode': 'mutual', 'self_loops': False, 'use_snp_selection': True, 'num_snps': 59895}. Best is trial 88 with value: 0.3161096373420557.
[I 2025-12-08 23:17:00,393] Trial 0 finished with value: 0.2518896290127292 and parameters: {'model_type': 'gcn', 'hidden_dims': '[128, 64]', 'dropout': 0.199031432379812, 'batch_norm': True, 'lr': 1.8408544111075823e-05, 'weight_decay': 5.5136510071208614e-05, 'epochs': 336, 'loss': 'mae', 'optimizer': 'adam', 'graph_mode': 'knn', 'knn_k': 8, 'weighted_edges': True, 'symmetrize_mode': 'mutual', 'self_loops': True, 'use_snp_selection': True, 'num_snps': 27173}. Best is trial 0 with value: 0.2518896290127292.
[I 2025-12-08 23:17:40,354] Trial 1 finished with value: 0.20417974922144394 and parameters: {'model_type': 'gcn', 'hidden_dims': '[256, 128, 64]', 'dropout': 0.5543244404043342, 'batch_norm': True, 'lr': 7.981787657617978e-05, 'weight_decay': 2.8571789869344834e-07, 'epochs': 297, 'loss': 'mae', 'optimizer': 'adam', 'graph_mode': 'cutoff', 'cutoff': 0.3392632777751686, 'grm_norm': 'gcn', 'self_loops': False, 'use_snp_selection': False}. Best is trial 0 with value: 0.2518896290127292.
[I 2025-12-08 23:18:39,346] Trial 2 finished with value: 0.19603266634981326 and parameters: {'model_type': 'gcn', 'hidden_dims': '[512, 64]', 'dropout': 0.32815227354739207, 'batch_norm': True, 'lr': 0.000619605044204259, 'weight_decay': 0.0004086269831625786, 'epochs': 206, 'loss': 'mse', 'optimizer': 'adam', 'graph_mode': 'knn', 'knn_k': 4, 'weighted_edges': True, 'symmetrize_mode': 'union', 'self_loops': True, 'use_snp_selection': True, 'num_snps': 53035}. Best is trial 0 with value: 0.2518896290127292.
[I 2025-12-08 23:19:07,971] Trial 3 finished with value: 0.20507056409087537 and parameters: {'model_type': 'gcn', 'hidden_dims': '[256, 128]', 'dropout': 0.23110783056597514, 'batch_norm': True, 'lr': 8.11311593386298e-05, 'weight_decay': 9.296158109581328e-07, 'epochs': 213, 'loss': 'mse', 'optimizer': 'adam', 'graph_mode': 'knn', 'knn_k': 10, 'weighted_edges': True, 'symmetrize_mode': 'mutual', 'self_loops': True, 'use_snp_selection': False}. Best is trial 0 with value: 0.2518896290127292.
[I 2025-12-08 23:19:23,184] Trial 4 finished with value: 0.31126302180851384 and parameters: {'model_type': 'gcn', 'hidden_dims': '[512, 256]', 'dropout': 0.2753281956415665, 'batch_norm': True, 'lr': 0.00034435188114839693, 'weight_decay': 4.9416012835950194e-05, 'epochs': 89, 'loss': 'mae', 'optimizer': 'adam', 'graph_mode': 'cutoff', 'cutoff': 0.820078967317394, 'grm_norm': 'none', 'self_loops': False, 'use_snp_selection': True, 'num_snps': 12674}. Best is trial 4 with value: 0.31126302180851384.
[I 2025-12-08 23:19:49,670] Trial 5 finished with value: 0.29069612246055754 and parameters: {'model_type': 'gcn', 'hidden_dims': '[128, 64]', 'dropout': 0.5611163934517731, 'batch_norm': True, 'lr': 0.0003984856210762587, 'weight_decay': 1.1466743517565185e-07, 'epochs': 344, 'loss': 'mae', 'optimizer': 'adam', 'graph_mode': 'cutoff', 'cutoff': 0.6089370799714728, 'grm_norm': 'gcn', 'self_loops': True, 'use_snp_selection': False}. Best is trial 4 with value: 0.31126302180851384.
[I 2025-12-08 23:20:12,646] Trial 6 finished with value: 0.2853862760850808 and parameters: {'model_type': 'gcn', 'hidden_dims': '[128, 64]', 'dropout': 0.31805912766941713, 'batch_norm': True, 'lr': 1.2361026034262557e-05, 'weight_decay': 6.492620232791903e-06, 'epochs': 271, 'loss': 'mse', 'optimizer': 'adam', 'graph_mode': 'cutoff', 'cutoff': 0.6193362582230448, 'grm_norm': 'cosine', 'self_loops': False, 'use_snp_selection': True, 'num_snps': 28594}. Best is trial 4 with value: 0.31126302180851384.
[I 2025-12-08 23:20:33,373] Trial 7 finished with value: 0.25108443152464927 and parameters: {'model_type': 'gcn', 'hidden_dims': '[512, 64]', 'dropout': 0.471337288649717, 'batch_norm': True, 'lr': 2.239693207292708e-05, 'weight_decay': 2.263166635514082e-06, 'epochs': 69, 'loss': 'mse', 'optimizer': 'adam', 'graph_mode': 'cutoff', 'cutoff': 0.4056820886426376, 'grm_norm': 'cosine', 'self_loops': False, 'use_snp_selection': False}. Best is trial 4 with value: 0.31126302180851384.
[I 2025-12-08 23:21:11,749] Trial 8 finished with value: 0.27030537713705993 and parameters: {'model_type': 'gcn', 'hidden_dims': '[512, 256]', 'dropout': 0.20659328268932406, 'batch_norm': False, 'lr': 8.93315124361372e-05, 'weight_decay': 0.00028987480727919035, 'epochs': 136, 'loss': 'mae', 'optimizer': 'adam', 'graph_mode': 'knn', 'knn_k': 3, 'weighted_edges': False, 'symmetrize_mode': 'union', 'self_loops': False, 'use_snp_selection': True, 'num_snps': 43128}. Best is trial 4 with value: 0.31126302180851384.
[I 2025-12-08 23:21:55,135] Trial 9 finished with value: -0.019380955547296068 and parameters: {'model_type': 'gcn', 'hidden_dims': '[512, 256]', 'dropout': 0.2888209592870401, 'batch_norm': False, 'lr': 0.004734648143129892, 'weight_decay': 1.5879705591356368e-06, 'epochs': 163, 'loss': 'mse', 'optimizer': 'adam', 'graph_mode': 'cutoff', 'cutoff': 0.5984899797909019, 'grm_norm': 'cosine', 'self_loops': True, 'use_snp_selection': False}. Best is trial 4 with value: 0.31126302180851384.
[I 2025-12-08 23:22:04,361] Trial 10 finished with value: 0.2671917030678487 and parameters: {'model_type': 'gcn', 'hidden_dims': '[512, 128]', 'dropout': 0.11372025982957354, 'batch_norm': False, 'lr': 0.0023343012062770553, 'weight_decay': 4.14440562940608e-05, 'epochs': 41, 'loss': 'mae', 'optimizer': 'adam', 'graph_mode': 'cutoff', 'cutoff': 0.8740100033033124, 'grm_norm': 'none', 'self_loops': False, 'use_snp_selection': True, 'num_snps': 3859}. Best is trial 4 with value: 0.31126302180851384.
[I 2025-12-08 23:22:14,350] Trial 11 finished with value: 0.3168547767471023 and parameters: {'model_type': 'gcn', 'hidden_dims': '[128, 64]', 'dropout': 0.44863014119095845, 'batch_norm': True, 'lr': 0.0005943392021247852, 'weight_decay': 1.0655358607693621e-07, 'epochs': 110, 'loss': 'mae', 'optimizer': 'adam', 'graph_mode': 'cutoff', 'cutoff': 0.8568899271933978, 'grm_norm': 'cosine_then_gcn', 'self_loops': True, 'use_snp_selection': False}. Best is trial 11 with value: 0.3168547767471023.
[I 2025-12-08 23:22:26,546] Trial 12 finished with value: 0.2913471024727059 and parameters: {'model_type': 'gcn', 'hidden_dims': '[512, 256]', 'dropout': 0.42758862319180935, 'batch_norm': True, 'lr': 0.0012059085553112938, 'weight_decay': 3.482253699955131e-05, 'epochs': 103, 'loss': 'mae', 'optimizer': 'adam', 'graph_mode': 'cutoff', 'cutoff': 0.8919050080438428, 'grm_norm': 'cosine_then_gcn', 'self_loops': True, 'use_snp_selection': True, 'num_snps': 6176}. Best is trial 11 with value: 0.3168547767471023.
[I 2025-12-08 23:22:40,617] Trial 13 finished with value: 0.3121837506353307 and parameters: {'model_type': 'gcn', 'hidden_dims': '[256, 128]', 'dropout': 0.4452783958423849, 'batch_norm': True, 'lr': 0.00028764898471530923, 'weight_decay': 8.746795324277564e-06, 'epochs': 96, 'loss': 'mae', 'optimizer': 'adam', 'graph_mode': 'cutoff', 'cutoff': 0.7596101551526167, 'grm_norm': 'cosine_then_gcn', 'self_loops': False, 'use_snp_selection': False}. Best is trial 11 with value: 0.3168547767471023.
[I 2025-12-08 23:22:58,811] Trial 14 finished with value: 0.03783760993232147 and parameters: {'model_type': 'gcn', 'hidden_dims': '[256, 128]', 'dropout': 0.4280653677930823, 'batch_norm': False, 'lr': 0.009430566714901507, 'weight_decay': 7.081154721639774e-06, 'epochs': 135, 'loss': 'mae', 'optimizer': 'adam', 'graph_mode': 'cutoff', 'cutoff': 0.7240625816402448, 'grm_norm': 'cosine_then_gcn', 'self_loops': True, 'use_snp_selection': False}. Best is trial 11 with value: 0.3168547767471023.
[I 2025-12-08 23:23:21,760] Trial 15 finished with value: 0.31395600101210885 and parameters: {'model_type': 'gcn', 'hidden_dims': '[256, 128]', 'dropout': 0.4827864904294467, 'batch_norm': True, 'lr': 0.000166827860779801, 'weight_decay': 4.104169171058631e-07, 'epochs': 172, 'loss': 'mae', 'optimizer': 'adam', 'graph_mode': 'cutoff', 'cutoff': 0.7416328481826706, 'grm_norm': 'cosine_then_gcn', 'self_loops': False, 'use_snp_selection': False}. Best is trial 11 with value: 0.3168547767471023.
[I 2025-12-08 23:24:07,871] Trial 16 finished with value: 0.3046411774127982 and parameters: {'model_type': 'gcn', 'hidden_dims': '[512, 128]', 'dropout': 0.4988064344225382, 'batch_norm': True, 'lr': 0.00018610916715297834, 'weight_decay': 3.7717055221981746e-07, 'epochs': 178, 'loss': 'mae', 'optimizer': 'adam', 'graph_mode': 'cutoff', 'cutoff': 0.7162710405524246, 'grm_norm': 'cosine_then_gcn', 'self_loops': False, 'use_snp_selection': False}. Best is trial 11 with value: 0.3168547767471023.
[I 2025-12-08 23:24:40,653] Trial 17 finished with value: 0.22785058185284318 and parameters: {'model_type': 'gcn', 'hidden_dims': '[256, 128, 64]', 'dropout': 0.38972932269140576, 'batch_norm': True, 'lr': 0.001197126891228748, 'weight_decay': 1.0578030337496367e-07, 'epochs': 247, 'loss': 'mae', 'optimizer': 'adam', 'graph_mode': 'cutoff', 'cutoff': 0.478328769620374, 'grm_norm': 'cosine_then_gcn', 'self_loops': True, 'use_snp_selection': False}. Best is trial 11 with value: 0.3168547767471023.
[I 2025-12-08 23:24:59,595] Trial 18 finished with value: 0.2524764684383153 and parameters: {'model_type': 'gcn', 'hidden_dims': '[256, 128]', 'dropout': 0.5946862229490071, 'batch_norm': False, 'lr': 3.997746938164808e-05, 'weight_decay': 4.6872079487991683e-07, 'epochs': 137, 'loss': 'mae', 'optimizer': 'adam', 'graph_mode': 'knn', 'knn_k': 1, 'weighted_edges': False, 'symmetrize_mode': 'mutual', 'self_loops': False, 'use_snp_selection': False}. Best is trial 11 with value: 0.3168547767471023.
[I 2025-12-08 23:25:18,097] Trial 19 finished with value: 0.23360024252346223 and parameters: {'model_type': 'gcn', 'hidden_dims': '[128, 64]', 'dropout': 0.5043518344358267, 'batch_norm': True, 'lr': 0.00014271396483742915, 'weight_decay': 2.0439181326924044e-07, 'epochs': 234, 'loss': 'mae', 'optimizer': 'adam', 'graph_mode': 'cutoff', 'cutoff': 0.25019712285855694, 'grm_norm': 'cosine_then_gcn', 'self_loops': True, 'use_snp_selection': False}. Best is trial 11 with value: 0.3168547767471023.
[I 2025-12-08 23:25:31,645] Trial 20 finished with value: 0.30869542550778367 and parameters: {'model_type': 'gcn', 'hidden_dims': '[128, 64]', 'dropout': 0.3632406484879136, 'batch_norm': True, 'lr': 0.0008311705536467122, 'weight_decay': 8.768281135366405e-07, 'epochs': 163, 'loss': 'mae', 'optimizer': 'adam', 'graph_mode': 'cutoff', 'cutoff': 0.78724786673861, 'grm_norm': 'cosine_then_gcn', 'self_loops': True, 'use_snp_selection': False}. Best is trial 11 with value: 0.3168547767471023.
[I 2025-12-08 23:25:47,021] Trial 21 finished with value: 0.2956621583622022 and parameters: {'model_type': 'gcn', 'hidden_dims': '[256, 128]', 'dropout': 0.4418812994104156, 'batch_norm': True, 'lr': 0.0002117180705775003, 'weight_decay': 3.123315824666904e-06, 'epochs': 109, 'loss': 'mae', 'optimizer': 'adam', 'graph_mode': 'cutoff', 'cutoff': 0.7228147268679663, 'grm_norm': 'cosine_then_gcn', 'self_loops': False, 'use_snp_selection': False}. Best is trial 11 with value: 0.3168547767471023.
[I 2025-12-08 23:25:57,224] Trial 22 finished with value: 0.31164312802774896 and parameters: {'model_type': 'gcn', 'hidden_dims': '[256, 128]', 'dropout': 0.39267369485962794, 'batch_norm': True, 'lr': 0.0004171219722678718, 'weight_decay': 1.9080586636794223e-05, 'epochs': 64, 'loss': 'mae', 'optimizer': 'adam', 'graph_mode': 'cutoff', 'cutoff': 0.7901846547466451, 'grm_norm': 'cosine_then_gcn', 'self_loops': False, 'use_snp_selection': False}. Best is trial 11 with value: 0.3168547767471023.
[I 2025-12-08 23:26:13,002] Trial 23 finished with value: 0.3145096085608027 and parameters: {'model_type': 'gcn', 'hidden_dims': '[256, 128]', 'dropout': 0.5127417811058923, 'batch_norm': True, 'lr': 0.002389152582266095, 'weight_decay': 0.00011721986068622469, 'epochs': 113, 'loss': 'mae', 'optimizer': 'adam', 'graph_mode': 'cutoff', 'cutoff': 0.6822434416247553, 'grm_norm': 'cosine_then_gcn', 'self_loops': False, 'use_snp_selection': False}. Best is trial 11 with value: 0.3168547767471023.
[I 2025-12-08 23:26:30,390] Trial 24 finished with value: 0.31486130628353853 and parameters: {'model_type': 'gcn', 'hidden_dims': '[256, 128]', 'dropout': 0.532567851638772, 'batch_norm': True, 'lr': 0.0022045143817877584, 'weight_decay': 0.00014169276442423538, 'epochs': 126, 'loss': 'mae', 'optimizer': 'adam', 'graph_mode': 'cutoff', 'cutoff': 0.6621022808985668, 'grm_norm': 'cosine_then_gcn', 'self_loops': False, 'use_snp_selection': False}. Best is trial 11 with value: 0.3168547767471023.
[I 2025-12-08 23:26:48,052] Trial 25 finished with value: 0.29911985741104563 and parameters: {'model_type': 'gcn', 'hidden_dims': '[256, 128]', 'dropout': 0.5318588693152735, 'batch_norm': True, 'lr': 0.0029001587619815242, 'weight_decay': 0.0001758485503672999, 'epochs': 132, 'loss': 'mae', 'optimizer': 'adam', 'graph_mode': 'cutoff', 'cutoff': 0.6568218798516736, 'grm_norm': 'none', 'self_loops': False, 'use_snp_selection': False}. Best is trial 11 with value: 0.3168547767471023.
[I 2025-12-08 23:26:59,813] Trial 26 finished with value: -0.010993922996535576 and parameters: {'model_type': 'gcn', 'hidden_dims': '[256, 128, 64]', 'dropout': 0.5396287082649128, 'batch_norm': False, 'lr': 0.0017227273691963992, 'weight_decay': 0.0009422211166401505, 'epochs': 73, 'loss': 'mse', 'optimizer': 'adam', 'graph_mode': 'knn', 'knn_k': 6, 'weighted_edges': False, 'symmetrize_mode': 'union', 'self_loops': False, 'use_snp_selection': False}. Best is trial 11 with value: 0.3168547767471023.
[I 2025-12-08 23:27:30,634] Trial 27 finished with value: 0.25089061071998947 and parameters: {'model_type': 'gcn', 'hidden_dims': '[512, 128]', 'dropout': 0.5845940077969332, 'batch_norm': True, 'lr': 0.005193432676924061, 'weight_decay': 0.00011276016151495734, 'epochs': 113, 'loss': 'mae', 'optimizer': 'adam', 'graph_mode': 'cutoff', 'cutoff': 0.5124698934543266, 'grm_norm': 'gcn', 'self_loops': False, 'use_snp_selection': False}. Best is trial 11 with value: 0.3168547767471023.
[I 2025-12-08 23:27:44,483] Trial 28 finished with value: 0.3135353187510173 and parameters: {'model_type': 'gcn', 'hidden_dims': '[512, 64]', 'dropout': 0.5178949237540135, 'batch_norm': True, 'lr': 0.0035624272162532236, 'weight_decay': 0.00010349334860013424, 'epochs': 43, 'loss': 'mae', 'optimizer': 'adam', 'graph_mode': 'cutoff', 'cutoff': 0.665993600030345, 'grm_norm': 'cosine_then_gcn', 'self_loops': True, 'use_snp_selection': False}. Best is trial 11 with value: 0.3168547767471023.
[I 2025-12-08 23:27:59,719] Trial 29 finished with value: 0.2131340362635909 and parameters: {'model_type': 'gcn', 'hidden_dims': '[128, 64]', 'dropout': 0.4653336041232562, 'batch_norm': True, 'lr': 0.009748138379697568, 'weight_decay': 2.0050296441122717e-05, 'epochs': 186, 'loss': 'mae', 'optimizer': 'adam', 'graph_mode': 'knn', 'knn_k': 10, 'weighted_edges': False, 'symmetrize_mode': 'mutual', 'self_loops': True, 'use_snp_selection': False}. Best is trial 11 with value: 0.3168547767471023.
[I 2025-12-08 23:28:12,207] Trial 30 finished with value: 0.2852754651147988 and parameters: {'model_type': 'gcn', 'hidden_dims': '[128, 64]', 'dropout': 0.39460213409460454, 'batch_norm': True, 'lr': 0.0006653466286103725, 'weight_decay': 0.0004236485979111201, 'epochs': 146, 'loss': 'mae', 'optimizer': 'adam', 'graph_mode': 'cutoff', 'cutoff': 0.5521192447504151, 'grm_norm': 'cosine_then_gcn', 'self_loops': False, 'use_snp_selection': False}. Best is trial 11 with value: 0.3168547767471023.
[I 2025-12-08 23:28:33,593] Trial 31 finished with value: 0.31348473949002764 and parameters: {'model_type': 'gcn', 'hidden_dims': '[256, 128]', 'dropout': 0.49776311737616186, 'batch_norm': True, 'lr': 0.001653284744005144, 'weight_decay': 1.8246321891509552e-07, 'epochs': 161, 'loss': 'mae', 'optimizer': 'adam', 'graph_mode': 'cutoff', 'cutoff': 0.8424281308611204, 'grm_norm': 'cosine_then_gcn', 'self_loops': False, 'use_snp_selection': False}. Best is trial 11 with value: 0.3168547767471023.
[I 2025-12-08 23:28:50,287] Trial 32 finished with value: 0.3109688975342446 and parameters: {'model_type': 'gcn', 'hidden_dims': '[256, 128]', 'dropout': 0.4753278915775163, 'batch_norm': True, 'lr': 0.0009535768476242522, 'weight_decay': 9.440976258342205e-05, 'epochs': 119, 'loss': 'mae', 'optimizer': 'adam', 'graph_mode': 'cutoff', 'cutoff': 0.6782684422179587, 'grm_norm': 'cosine_then_gcn', 'self_loops': False, 'use_snp_selection': False}. Best is trial 11 with value: 0.3168547767471023.
[I 2025-12-08 23:29:04,017] Trial 33 finished with value: 0.3168647095669232 and parameters: {'model_type': 'gcn', 'hidden_dims': '[256, 128]', 'dropout': 0.5585503836633015, 'batch_norm': True, 'lr': 0.0005938481624259443, 'weight_decay': 0.0009340306411883499, 'epochs': 89, 'loss': 'mae', 'optimizer': 'adam', 'graph_mode': 'cutoff', 'cutoff': 0.7617301548286999, 'grm_norm': 'cosine_then_gcn', 'self_loops': False, 'use_snp_selection': False}. Best is trial 33 with value: 0.3168647095669232.
[I 2025-12-08 23:29:16,825] Trial 34 finished with value: 0.3169953281532211 and parameters: {'model_type': 'gcn', 'hidden_dims': '[256, 128]', 'dropout': 0.5619464591968211, 'batch_norm': True, 'lr': 0.0005143782738394929, 'weight_decay': 0.0006121335801052123, 'epochs': 80, 'loss': 'mae', 'optimizer': 'adam', 'graph_mode': 'cutoff', 'cutoff': 0.8295214041086654, 'grm_norm': 'cosine_then_gcn', 'self_loops': False, 'use_snp_selection': False}. Best is trial 34 with value: 0.3169953281532211.
[I 2025-12-08 23:29:29,172] Trial 35 finished with value: 0.22737857529183042 and parameters: {'model_type': 'gcn', 'hidden_dims': '[256, 128]', 'dropout': 0.5619810388497714, 'batch_norm': True, 'lr': 0.000517797545392034, 'weight_decay': 0.0009940916883637472, 'epochs': 79, 'loss': 'mse', 'optimizer': 'adam', 'graph_mode': 'knn', 'knn_k': 1, 'weighted_edges': True, 'symmetrize_mode': 'union', 'self_loops': False, 'use_snp_selection': False}. Best is trial 34 with value: 0.3169953281532211.
