[I 2025-12-08 14:37:03,725] Trial 48 finished with value: 0.27068402041171324 and parameters: {'model_type': 'gcn', 'hidden_dims': '[128, 64]', 'dropout': 0.4417800186852837, 'batch_norm': True, 'lr': 7.13909439334744e-05, 'weight_decay': 1.8728095866180442e-07, 'epochs': 68, 'loss': 'mae', 'optimizer': 'adam', 'graph_mode': 'cutoff', 'cutoff': 0.6960040158350618, 'grm_norm': 'cosine', 'self_loops': False, 'use_snp_selection': True, 'num_snps': 47397}. Best is trial 41 with value: 0.28419062551940144.
[I 2025-12-08 14:37:43,829] Trial 49 finished with value: 0.274315444047848 and parameters: {'model_type': 'gcn', 'hidden_dims': '[512, 256]', 'dropout': 0.5993654264756613, 'batch_norm': True, 'lr': 0.00012723461448883877, 'weight_decay': 0.0006665816621808148, 'epochs': 147, 'loss': 'mae', 'optimizer': 'adam', 'graph_mode': 'cutoff', 'cutoff': 0.835541385737815, 'grm_norm': 'cosine', 'self_loops': False, 'use_snp_selection': True, 'num_snps': 21647}. Best is trial 41 with value: 0.28419062551940144.
[I 2025-12-08 14:38:18,704] Trial 50 finished with value: 0.2547230376122033 and parameters: {'model_type': 'gcn', 'hidden_dims': '[256, 128]', 'dropout': 0.5121087750462942, 'batch_norm': True, 'lr': 1.8811736789140488e-05, 'weight_decay': 0.00020478479485542953, 'epochs': 271, 'loss': 'mse', 'optimizer': 'adam', 'graph_mode': 'knn', 'knn_k': 8, 'weighted_edges': True, 'symmetrize_mode': 'union', 'self_loops': True, 'use_snp_selection': False}. Best is trial 41 with value: 0.28419062551940144.
[I 2025-12-08 14:38:36,497] Trial 51 finished with value: 0.2752338924736522 and parameters: {'model_type': 'gcn', 'hidden_dims': '[512, 256]', 'dropout': 0.4784063964025282, 'batch_norm': True, 'lr': 4.338293866789658e-05, 'weight_decay': 0.0009276237586840449, 'epochs': 71, 'loss': 'mae', 'optimizer': 'adam', 'graph_mode': 'cutoff', 'cutoff': 0.7685126659976567, 'grm_norm': 'cosine_then_gcn', 'self_loops': False, 'use_snp_selection': True, 'num_snps': 21621}. Best is trial 41 with value: 0.28419062551940144.
[I 2025-12-08 14:38:55,262] Trial 52 finished with value: 0.27262333981050646 and parameters: {'model_type': 'gcn', 'hidden_dims': '[512, 256]', 'dropout': 0.5069710546316504, 'batch_norm': True, 'lr': 3.005274551169847e-05, 'weight_decay': 0.0007224902879052017, 'epochs': 57, 'loss': 'mae', 'optimizer': 'adam', 'graph_mode': 'cutoff', 'cutoff': 0.8050568440947119, 'grm_norm': 'cosine_then_gcn', 'self_loops': False, 'use_snp_selection': True, 'num_snps': 27485}. Best is trial 41 with value: 0.28419062551940144.
[I 2025-12-08 14:39:19,251] Trial 53 finished with value: 0.28546478285669324 and parameters: {'model_type': 'gcn', 'hidden_dims': '[512, 256]', 'dropout': 0.5491566274466353, 'batch_norm': True, 'lr': 4.207091584731365e-05, 'weight_decay': 0.00047239379545516483, 'epochs': 91, 'loss': 'mae', 'optimizer': 'adam', 'graph_mode': 'cutoff', 'cutoff': 0.7162347174518252, 'grm_norm': 'cosine_then_gcn', 'self_loops': False, 'use_snp_selection': True, 'num_snps': 30844}. Best is trial 53 with value: 0.28546478285669324.
[I 2025-12-08 14:39:42,601] Trial 54 finished with value: 0.2675378741106019 and parameters: {'model_type': 'gcn', 'hidden_dims': '[512, 256]', 'dropout': 0.5423006155777617, 'batch_norm': True, 'lr': 9.893782995275351e-05, 'weight_decay': 0.00012380193187880092, 'epochs': 88, 'loss': 'mae', 'optimizer': 'adam', 'graph_mode': 'cutoff', 'cutoff': 0.721825450565629, 'grm_norm': 'cosine_then_gcn', 'self_loops': False, 'use_snp_selection': True, 'num_snps': 29770}. Best is trial 53 with value: 0.28546478285669324.
[I 2025-12-08 14:40:03,719] Trial 55 finished with value: 0.2617335835274173 and parameters: {'model_type': 'gcn', 'hidden_dims': '[512, 256]', 'dropout': 0.5649687656571869, 'batch_norm': True, 'lr': 1.3662905711469666e-05, 'weight_decay': 0.0003030374176292222, 'epochs': 50, 'loss': 'mae', 'optimizer': 'adam', 'graph_mode': 'cutoff', 'cutoff': 0.6384400502869265, 'grm_norm': 'none', 'self_loops': False, 'use_snp_selection': True, 'num_snps': 36322}. Best is trial 53 with value: 0.28546478285669324.
[I 2025-12-08 14:40:26,184] Trial 56 finished with value: 0.04743048294181899 and parameters: {'model_type': 'gcn', 'hidden_dims': '[256, 128, 64]', 'dropout': 0.5789722677458687, 'batch_norm': False, 'lr': 0.0005319520811538446, 'weight_decay': 0.0004821998294567483, 'epochs': 128, 'loss': 'mae', 'optimizer': 'adam', 'graph_mode': 'cutoff', 'cutoff': 0.8574785174374706, 'grm_norm': 'cosine', 'self_loops': False, 'use_snp_selection': True, 'num_snps': 32591}. Best is trial 53 with value: 0.28546478285669324.
[I 2025-12-08 14:40:49,674] Trial 57 finished with value: 0.25697609174194935 and parameters: {'model_type': 'gcn', 'hidden_dims': '[512, 256]', 'dropout': 0.4106038279749708, 'batch_norm': True, 'lr': 2.3393464811633147e-05, 'weight_decay': 6.744407006829222e-05, 'epochs': 107, 'loss': 'mae', 'optimizer': 'adam', 'graph_mode': 'cutoff', 'cutoff': 0.5801579811486947, 'grm_norm': 'cosine_then_gcn', 'self_loops': False, 'use_snp_selection': True, 'num_snps': 25997}. Best is trial 53 with value: 0.28546478285669324.
[I 2025-12-08 14:41:16,926] Trial 58 finished with value: 0.26416192950326034 and parameters: {'model_type': 'gcn', 'hidden_dims': '[512, 128]', 'dropout': 0.44988270052711843, 'batch_norm': True, 'lr': 5.3472227214874546e-05, 'weight_decay': 4.266267267013184e-06, 'epochs': 80, 'loss': 'mae', 'optimizer': 'adam', 'graph_mode': 'cutoff', 'cutoff': 0.7106362134046929, 'grm_norm': 'cosine_then_gcn', 'self_loops': False, 'use_snp_selection': True, 'num_snps': 40507}. Best is trial 53 with value: 0.28546478285669324.
[I 2025-12-08 14:41:48,931] Trial 59 finished with value: 0.2565472324036135 and parameters: {'model_type': 'gcn', 'hidden_dims': '[512, 256]', 'dropout': 0.17134001061279686, 'batch_norm': True, 'lr': 3.541087405566997e-05, 'weight_decay': 0.00022327977990811053, 'epochs': 95, 'loss': 'mae', 'optimizer': 'adam', 'graph_mode': 'cutoff', 'cutoff': 0.7438729517768078, 'grm_norm': 'none', 'self_loops': False, 'use_snp_selection': True, 'num_snps': 45827}. Best is trial 53 with value: 0.28546478285669324.
[I 2025-12-08 14:42:04,988] Trial 60 finished with value: 0.23295832554302726 and parameters: {'model_type': 'gcn', 'hidden_dims': '[512, 256]', 'dropout': 0.3839143434118566, 'batch_norm': False, 'lr': 6.728563407047851e-05, 'weight_decay': 0.0004582705062612305, 'epochs': 41, 'loss': 'mae', 'optimizer': 'adam', 'graph_mode': 'cutoff', 'cutoff': 0.6491763725840292, 'grm_norm': 'gcn', 'self_loops': False, 'use_snp_selection': True, 'num_snps': 24786}. Best is trial 53 with value: 0.28546478285669324.
[I 2025-12-08 14:42:21,799] Trial 61 finished with value: 0.27452059024778797 and parameters: {'model_type': 'gcn', 'hidden_dims': '[512, 256]', 'dropout': 0.5026069452151781, 'batch_norm': True, 'lr': 4.6553521029070636e-05, 'weight_decay': 0.0007528187998365265, 'epochs': 69, 'loss': 'mae', 'optimizer': 'adam', 'graph_mode': 'cutoff', 'cutoff': 0.7801184949458427, 'grm_norm': 'cosine_then_gcn', 'self_loops': False, 'use_snp_selection': True, 'num_snps': 19643}. Best is trial 53 with value: 0.28546478285669324.
[I 2025-12-08 14:42:44,224] Trial 62 finished with value: 0.2767644433462241 and parameters: {'model_type': 'gcn', 'hidden_dims': '[512, 256]', 'dropout': 0.5324619580801269, 'batch_norm': True, 'lr': 3.942676650153616e-05, 'weight_decay': 0.0009991591198374099, 'epochs': 63, 'loss': 'mae', 'optimizer': 'adam', 'graph_mode': 'cutoff', 'cutoff': 0.790011482592588, 'grm_norm': 'cosine_then_gcn', 'self_loops': False, 'use_snp_selection': True, 'num_snps': 34790}. Best is trial 53 with value: 0.28546478285669324.
[I 2025-12-08 14:43:05,846] Trial 63 finished with value: 0.2711397144581555 and parameters: {'model_type': 'gcn', 'hidden_dims': '[512, 256]', 'dropout': 0.5536230442540228, 'batch_norm': True, 'lr': 0.00017331620515438075, 'weight_decay': 0.0005461120002016333, 'epochs': 80, 'loss': 'mae', 'optimizer': 'adam', 'graph_mode': 'cutoff', 'cutoff': 0.8605190791905734, 'grm_norm': 'cosine_then_gcn', 'self_loops': False, 'use_snp_selection': True, 'num_snps': 28013}. Best is trial 53 with value: 0.28546478285669324.
[I 2025-12-08 14:43:18,524] Trial 64 finished with value: 0.27333211203004487 and parameters: {'model_type': 'gcn', 'hidden_dims': '[512, 256]', 'dropout': 0.47229627490487797, 'batch_norm': True, 'lr': 0.0002539453037832447, 'weight_decay': 0.00033681290272264503, 'epochs': 50, 'loss': 'mae', 'optimizer': 'adam', 'graph_mode': 'cutoff', 'cutoff': 0.7555068588093892, 'grm_norm': 'cosine_then_gcn', 'self_loops': False, 'use_snp_selection': True, 'num_snps': 12179}. Best is trial 53 with value: 0.28546478285669324.
[I 2025-12-08 14:43:48,069] Trial 65 finished with value: 0.2598531829932969 and parameters: {'model_type': 'gcn', 'hidden_dims': '[512, 128]', 'dropout': 0.5203450535365975, 'batch_norm': True, 'lr': 3.209608459253653e-05, 'weight_decay': 0.0007788206978707691, 'epochs': 110, 'loss': 'mse', 'optimizer': 'adam', 'graph_mode': 'cutoff', 'cutoff': 0.6770030176433408, 'grm_norm': 'cosine_then_gcn', 'self_loops': False, 'use_snp_selection': False}. Best is trial 53 with value: 0.28546478285669324.
[I 2025-12-08 14:44:04,902] Trial 66 finished with value: 0.2664425954694928 and parameters: {'model_type': 'gcn', 'hidden_dims': '[256, 128]', 'dropout': 0.49514727836607086, 'batch_norm': True, 'lr': 0.003530435801594443, 'weight_decay': 0.0005491763343996823, 'epochs': 63, 'loss': 'mae', 'optimizer': 'adam', 'graph_mode': 'cutoff', 'cutoff': 0.610306446958593, 'grm_norm': 'cosine_then_gcn', 'self_loops': True, 'use_snp_selection': True, 'num_snps': 29904}. Best is trial 53 with value: 0.28546478285669324.
[I 2025-12-08 14:44:24,029] Trial 67 finished with value: 0.2663324778850706 and parameters: {'model_type': 'gcn', 'hidden_dims': '[512, 64]', 'dropout': 0.5894517152106005, 'batch_norm': True, 'lr': 0.00010837799233762304, 'weight_decay': 0.0001694954841432014, 'epochs': 75, 'loss': 'mae', 'optimizer': 'adam', 'graph_mode': 'knn', 'knn_k': 5, 'weighted_edges': False, 'symmetrize_mode': 'mutual', 'self_loops': False, 'use_snp_selection': True, 'num_snps': 23009}. Best is trial 53 with value: 0.28546478285669324.
[I 2025-12-08 14:44:38,944] Trial 68 finished with value: 0.2671783082915301 and parameters: {'model_type': 'gcn', 'hidden_dims': '[512, 256]', 'dropout': 0.5600347591583494, 'batch_norm': True, 'lr': 7.617662879054347e-05, 'weight_decay': 0.0003677842815137597, 'epochs': 49, 'loss': 'mse', 'optimizer': 'adam', 'graph_mode': 'cutoff', 'cutoff': 0.7346871902064271, 'grm_norm': 'cosine_then_gcn', 'self_loops': True, 'use_snp_selection': False}. Best is trial 53 with value: 0.28546478285669324.
[I 2025-12-08 14:45:02,153] Trial 69 finished with value: 0.26338363175185514 and parameters: {'model_type': 'gcn', 'hidden_dims': '[256, 128, 64]', 'dropout': 0.5385935271094913, 'batch_norm': False, 'lr': 2.51008390253281e-05, 'weight_decay': 0.00027014236287033764, 'epochs': 350, 'loss': 'mae', 'optimizer': 'adam', 'graph_mode': 'cutoff', 'cutoff': 0.7016868751613548, 'grm_norm': 'cosine_then_gcn', 'self_loops': False, 'use_snp_selection': True, 'num_snps': 13863}. Best is trial 53 with value: 0.28546478285669324.
[I 2025-12-08 14:45:28,739] Trial 70 finished with value: 0.24444614305150308 and parameters: {'model_type': 'gcn', 'hidden_dims': '[512, 256]', 'dropout': 0.5176658061691505, 'batch_norm': True, 'lr': 5.4539281958119776e-05, 'weight_decay': 0.000763059751511223, 'epochs': 187, 'loss': 'mae', 'optimizer': 'adam', 'graph_mode': 'cutoff', 'cutoff': 0.37034763259061476, 'grm_norm': 'none', 'self_loops': True, 'use_snp_selection': True, 'num_snps': 19434}. Best is trial 53 with value: 0.28546478285669324.
[I 2025-12-08 14:45:50,646] Trial 71 finished with value: 0.2744588318917461 and parameters: {'model_type': 'gcn', 'hidden_dims': '[512, 256]', 'dropout': 0.4618742135328037, 'batch_norm': True, 'lr': 0.00014568863825310322, 'weight_decay': 0.0007594872333468491, 'epochs': 73, 'loss': 'mae', 'optimizer': 'adam', 'graph_mode': 'cutoff', 'cutoff': 0.8987040464801291, 'grm_norm': 'cosine_then_gcn', 'self_loops': False, 'use_snp_selection': True, 'num_snps': 30837}. Best is trial 53 with value: 0.28546478285669324.
[I 2025-12-08 14:46:17,970] Trial 72 finished with value: 0.2674430291484709 and parameters: {'model_type': 'gcn', 'hidden_dims': '[512, 256]', 'dropout': 0.49943691997606066, 'batch_norm': True, 'lr': 8.47017317547448e-05, 'weight_decay': 0.0006188767904741735, 'epochs': 92, 'loss': 'mae', 'optimizer': 'adam', 'graph_mode': 'cutoff', 'cutoff': 0.8082216212364163, 'grm_norm': 'cosine_then_gcn', 'self_loops': False, 'use_snp_selection': True, 'num_snps': 36867}. Best is trial 53 with value: 0.28546478285669324.
[I 2025-12-08 14:46:41,903] Trial 73 finished with value: 0.2693590689647753 and parameters: {'model_type': 'gcn', 'hidden_dims': '[512, 256]', 'dropout': 0.4864103941346064, 'batch_norm': True, 'lr': 4.258864383741091e-05, 'weight_decay': 0.0005183209562433425, 'epochs': 83, 'loss': 'mae', 'optimizer': 'adam', 'graph_mode': 'cutoff', 'cutoff': 0.8456897502703065, 'grm_norm': 'cosine_then_gcn', 'self_loops': False, 'use_snp_selection': True, 'num_snps': 32694}. Best is trial 53 with value: 0.28546478285669324.
[I 2025-12-08 14:47:02,081] Trial 74 finished with value: 0.2699877641780228 and parameters: {'model_type': 'gcn', 'hidden_dims': '[512, 256]', 'dropout': 0.5067654121974533, 'batch_norm': True, 'lr': 6.087087513480665e-05, 'weight_decay': 0.0004206549318189988, 'epochs': 64, 'loss': 'mae', 'optimizer': 'adam', 'graph_mode': 'cutoff', 'cutoff': 0.6675635763759056, 'grm_norm': 'cosine_then_gcn', 'self_loops': False, 'use_snp_selection': True, 'num_snps': 29369}. Best is trial 53 with value: 0.28546478285669324.
[I 2025-12-08 14:47:13,182] Trial 75 finished with value: 0.20518258513543025 and parameters: {'model_type': 'gcn', 'hidden_dims': '[128, 64]', 'dropout': 0.581844220486132, 'batch_norm': True, 'lr': 2.034567091547329e-05, 'weight_decay': 0.000978614547873698, 'epochs': 98, 'loss': 'mae', 'optimizer': 'adam', 'graph_mode': 'cutoff', 'cutoff': 0.8123952481696525, 'grm_norm': 'cosine_then_gcn', 'self_loops': False, 'use_snp_selection': True, 'num_snps': 9310}. Best is trial 53 with value: 0.28546478285669324.
[I 2025-12-08 14:47:29,759] Trial 76 finished with value: 0.28400435374141264 and parameters: {'model_type': 'gcn', 'hidden_dims': '[512, 128]', 'dropout': 0.5517251529600554, 'batch_norm': True, 'lr': 2.7249043360827837e-05, 'weight_decay': 0.0007848023683788508, 'epochs': 56, 'loss': 'mse', 'optimizer': 'adam', 'graph_mode': 'cutoff', 'cutoff': 0.7521599194373155, 'grm_norm': 'cosine_then_gcn', 'self_loops': False, 'use_snp_selection': False}. Best is trial 53 with value: 0.28546478285669324.
[I 2025-12-08 14:47:45,853] Trial 77 finished with value: 0.26105202564471885 and parameters: {'model_type': 'gcn', 'hidden_dims': '[512, 128]', 'dropout': 0.5556277363162833, 'batch_norm': True, 'lr': 1.3552923563689576e-05, 'weight_decay': 0.0002549144998406633, 'epochs': 54, 'loss': 'mse', 'optimizer': 'adam', 'graph_mode': 'cutoff', 'cutoff': 0.7565763842565192, 'grm_norm': 'cosine_then_gcn', 'self_loops': True, 'use_snp_selection': False}. Best is trial 53 with value: 0.28546478285669324.
[I 2025-12-08 14:48:00,886] Trial 78 finished with value: 0.2812249979205446 and parameters: {'model_type': 'gcn', 'hidden_dims': '[512, 128]', 'dropout': 0.5283737679531934, 'batch_norm': True, 'lr': 2.862389207028286e-05, 'weight_decay': 0.0007800049072813715, 'epochs': 47, 'loss': 'mse', 'optimizer': 'adam', 'graph_mode': 'knn', 'knn_k': 9, 'weighted_edges': True, 'symmetrize_mode': 'union', 'self_loops': False, 'use_snp_selection': False}. Best is trial 53 with value: 0.28546478285669324.
[I 2025-12-08 14:48:15,155] Trial 79 finished with value: 0.27408962919472923 and parameters: {'model_type': 'gcn', 'hidden_dims': '[512, 128]', 'dropout': 0.5668928193980282, 'batch_norm': True, 'lr': 1.0398933762013277e-05, 'weight_decay': 0.00041820012595669156, 'epochs': 44, 'loss': 'mse', 'optimizer': 'adam', 'graph_mode': 'knn', 'knn_k': 9, 'weighted_edges': True, 'symmetrize_mode': 'union', 'self_loops': False, 'use_snp_selection': False}. Best is trial 53 with value: 0.28546478285669324.
[I 2025-12-08 14:48:32,295] Trial 80 finished with value: 0.26692902164269816 and parameters: {'model_type': 'gcn', 'hidden_dims': '[512, 128]', 'dropout': 0.5305341117367337, 'batch_norm': True, 'lr': 1.7284182179361846e-05, 'weight_decay': 8.285887415100169e-06, 'epochs': 56, 'loss': 'mse', 'optimizer': 'adam', 'graph_mode': 'knn', 'knn_k': 7, 'weighted_edges': True, 'symmetrize_mode': 'union', 'self_loops': True, 'use_snp_selection': False}. Best is trial 53 with value: 0.28546478285669324.
[I 2025-12-08 14:48:50,038] Trial 81 finished with value: 0.27460095678608915 and parameters: {'model_type': 'gcn', 'hidden_dims': '[512, 128]', 'dropout': 0.5215780576857496, 'batch_norm': True, 'lr': 2.7714575429911842e-05, 'weight_decay': 0.0008016218005379279, 'epochs': 58, 'loss': 'mse', 'optimizer': 'adam', 'graph_mode': 'knn', 'knn_k': 9, 'weighted_edges': True, 'symmetrize_mode': 'union', 'self_loops': False, 'use_snp_selection': False}. Best is trial 53 with value: 0.28546478285669324.
[I 2025-12-08 14:49:09,815] Trial 82 finished with value: 0.2760031034617971 and parameters: {'model_type': 'gcn', 'hidden_dims': '[512, 128]', 'dropout': 0.5448696659489612, 'batch_norm': True, 'lr': 3.373568598049687e-05, 'weight_decay': 0.0005732908172926336, 'epochs': 67, 'loss': 'mse', 'optimizer': 'adam', 'graph_mode': 'knn', 'knn_k': 6, 'weighted_edges': True, 'symmetrize_mode': 'union', 'self_loops': False, 'use_snp_selection': False}. Best is trial 53 with value: 0.28546478285669324.
[I 2025-12-08 14:49:24,796] Trial 83 finished with value: 0.28253533943102865 and parameters: {'model_type': 'gcn', 'hidden_dims': '[512, 128]', 'dropout': 0.4748522836395268, 'batch_norm': True, 'lr': 4.712414629633553e-05, 'weight_decay': 0.000820696214625232, 'epochs': 47, 'loss': 'mse', 'optimizer': 'adam', 'graph_mode': 'knn', 'knn_k': 8, 'weighted_edges': True, 'symmetrize_mode': 'union', 'self_loops': False, 'use_snp_selection': False}. Best is trial 53 with value: 0.28546478285669324.
[I 2025-12-08 14:49:38,022] Trial 84 finished with value: 0.2743525631957925 and parameters: {'model_type': 'gcn', 'hidden_dims': '[512, 128]', 'dropout': 0.4830482760995665, 'batch_norm': True, 'lr': 4.863665484869507e-05, 'weight_decay': 0.00034430401492778983, 'epochs': 40, 'loss': 'mse', 'optimizer': 'adam', 'graph_mode': 'knn', 'knn_k': 8, 'weighted_edges': True, 'symmetrize_mode': 'union', 'self_loops': False, 'use_snp_selection': False}. Best is trial 53 with value: 0.28546478285669324.
[I 2025-12-08 14:49:53,278] Trial 85 finished with value: 0.2767591654570925 and parameters: {'model_type': 'gcn', 'hidden_dims': '[512, 128]', 'dropout': 0.23125242546978136, 'batch_norm': True, 'lr': 2.2263634992200785e-05, 'weight_decay': 0.0007012118270059315, 'epochs': 48, 'loss': 'mse', 'optimizer': 'adam', 'graph_mode': 'knn', 'knn_k': 9, 'weighted_edges': True, 'symmetrize_mode': 'union', 'self_loops': False, 'use_snp_selection': False}. Best is trial 53 with value: 0.28546478285669324.
[I 2025-12-08 14:50:17,552] Trial 86 finished with value: 0.2709926331136744 and parameters: {'model_type': 'gcn', 'hidden_dims': '[512, 128]', 'dropout': 0.4621506610319711, 'batch_norm': True, 'lr': 3.807807251291972e-05, 'weight_decay': 0.00047587948849963664, 'epochs': 83, 'loss': 'mse', 'optimizer': 'adam', 'graph_mode': 'knn', 'knn_k': 7, 'weighted_edges': True, 'symmetrize_mode': 'union', 'self_loops': False, 'use_snp_selection': False}. Best is trial 53 with value: 0.28546478285669324.
[I 2025-12-08 14:50:39,625] Trial 87 finished with value: 0.22000004190420483 and parameters: {'model_type': 'gcn', 'hidden_dims': '[512, 128]', 'dropout': 0.5866979318099854, 'batch_norm': False, 'lr': 2.851633403901e-05, 'weight_decay': 0.0008416465112039722, 'epochs': 74, 'loss': 'mse', 'optimizer': 'adam', 'graph_mode': 'knn', 'knn_k': 10, 'weighted_edges': True, 'symmetrize_mode': 'union', 'self_loops': False, 'use_snp_selection': False}. Best is trial 53 with value: 0.28546478285669324.
[I 2025-12-08 14:50:49,190] Trial 88 finished with value: 0.2658308506038339 and parameters: {'model_type': 'gcn', 'hidden_dims': '[256, 128]', 'dropout': 0.547462498582942, 'batch_norm': True, 'lr': 1.538609842888215e-05, 'weight_decay': 0.0006192986405412122, 'epochs': 60, 'loss': 'mse', 'optimizer': 'adam', 'graph_mode': 'knn', 'knn_k': 5, 'weighted_edges': True, 'symmetrize_mode': 'union', 'self_loops': True, 'use_snp_selection': False}. Best is trial 53 with value: 0.28546478285669324.
[I 2025-12-08 14:51:04,876] Trial 89 finished with value: 0.27659276826696055 and parameters: {'model_type': 'gcn', 'hidden_dims': '[512, 128]', 'dropout': 0.5145800959671041, 'batch_norm': True, 'lr': 6.217355824787482e-05, 'weight_decay': 0.000368115908174214, 'epochs': 50, 'loss': 'mse', 'optimizer': 'adam', 'graph_mode': 'knn', 'knn_k': 8, 'weighted_edges': True, 'symmetrize_mode': 'union', 'self_loops': False, 'use_snp_selection': False}. Best is trial 53 with value: 0.28546478285669324.
[I 2025-12-08 14:52:07,623] Trial 90 finished with value: 0.21094884424884947 and parameters: {'model_type': 'gcn', 'hidden_dims': '[512, 128]', 'dropout': 0.4302027649986327, 'batch_norm': True, 'lr': 3.389414131666688e-05, 'weight_decay': 1.2858349042911432e-06, 'epochs': 243, 'loss': 'mse', 'optimizer': 'adam', 'graph_mode': 'knn', 'knn_k': 9, 'weighted_edges': True, 'symmetrize_mode': 'mutual', 'self_loops': False, 'use_snp_selection': False}. Best is trial 53 with value: 0.28546478285669324.
