[I 2025-12-08 21:30:42,709] Trial 126 finished with value: 0.3582549543167306 and parameters: {'model_type': 'gcn', 'hidden_dims': '[128, 64]', 'dropout': 0.4773493425373291, 'batch_norm': False, 'lr': 1.535205476965423e-05, 'weight_decay': 5.716310043862757e-07, 'epochs': 213, 'loss': 'mse', 'optimizer': 'adam', 'graph_mode': 'knn', 'knn_k': 5, 'weighted_edges': True, 'symmetrize_mode': 'union', 'self_loops': False, 'use_snp_selection': True, 'num_snps': 25131}. Best is trial 124 with value: 0.3755487195179888.
[I 2025-12-08 21:31:02,209] Trial 127 finished with value: 0.3601855695917076 and parameters: {'model_type': 'gcn', 'hidden_dims': '[128, 64]', 'dropout': 0.48596700105847135, 'batch_norm': False, 'lr': 1.553089471241826e-05, 'weight_decay': 4.856416362737684e-07, 'epochs': 186, 'loss': 'mse', 'optimizer': 'adam', 'graph_mode': 'knn', 'knn_k': 5, 'weighted_edges': True, 'symmetrize_mode': 'union', 'self_loops': True, 'use_snp_selection': True, 'num_snps': 27815}. Best is trial 124 with value: 0.3755487195179888.
[I 2025-12-08 21:31:22,678] Trial 128 finished with value: 0.3659622303594981 and parameters: {'model_type': 'gcn', 'hidden_dims': '[128, 64]', 'dropout': 0.43959728232778195, 'batch_norm': False, 'lr': 2.1788988146913025e-05, 'weight_decay': 7.361127190131343e-07, 'epochs': 202, 'loss': 'mse', 'optimizer': 'adam', 'graph_mode': 'knn', 'knn_k': 5, 'weighted_edges': True, 'symmetrize_mode': 'union', 'self_loops': False, 'use_snp_selection': True, 'num_snps': 29445}. Best is trial 124 with value: 0.3755487195179888.
[I 2025-12-08 21:31:43,289] Trial 129 finished with value: 0.37258935322637277 and parameters: {'model_type': 'gcn', 'hidden_dims': '[128, 64]', 'dropout': 0.46341600965021995, 'batch_norm': False, 'lr': 2.8565964352973688e-05, 'weight_decay': 2.837470350908225e-07, 'epochs': 183, 'loss': 'mse', 'optimizer': 'adam', 'graph_mode': 'knn', 'knn_k': 6, 'weighted_edges': True, 'symmetrize_mode': 'union', 'self_loops': False, 'use_snp_selection': True, 'num_snps': 31954}. Best is trial 124 with value: 0.3755487195179888.
[I 2025-12-08 21:32:02,867] Trial 130 finished with value: 0.3660736909770431 and parameters: {'model_type': 'gcn', 'hidden_dims': '[128, 64]', 'dropout': 0.4268859956979786, 'batch_norm': False, 'lr': 1.7870156447357686e-05, 'weight_decay': 2.588269723270142e-07, 'epochs': 157, 'loss': 'mse', 'optimizer': 'adam', 'graph_mode': 'knn', 'knn_k': 5, 'weighted_edges': True, 'symmetrize_mode': 'union', 'self_loops': False, 'use_snp_selection': True, 'num_snps': 31918}. Best is trial 124 with value: 0.3755487195179888.
[I 2025-12-08 21:32:21,994] Trial 131 finished with value: 0.3660611394988063 and parameters: {'model_type': 'gcn', 'hidden_dims': '[128, 64]', 'dropout': 0.4707685204549368, 'batch_norm': False, 'lr': 1.2579542071277128e-05, 'weight_decay': 1.6860539858223894e-07, 'epochs': 194, 'loss': 'mse', 'optimizer': 'adam', 'graph_mode': 'knn', 'knn_k': 6, 'weighted_edges': True, 'symmetrize_mode': 'union', 'self_loops': False, 'use_snp_selection': True, 'num_snps': 26314}. Best is trial 124 with value: 0.3755487195179888.
[I 2025-12-08 21:32:40,916] Trial 132 finished with value: 0.36635908127060113 and parameters: {'model_type': 'gcn', 'hidden_dims': '[128, 64]', 'dropout': 0.45695691655742116, 'batch_norm': False, 'lr': 2.6635176154477027e-05, 'weight_decay': 3.1208528618592414e-07, 'epochs': 182, 'loss': 'mse', 'optimizer': 'adam', 'graph_mode': 'knn', 'knn_k': 5, 'weighted_edges': True, 'symmetrize_mode': 'union', 'self_loops': False, 'use_snp_selection': True, 'num_snps': 27348}. Best is trial 124 with value: 0.3755487195179888.
[I 2025-12-08 21:33:00,096] Trial 133 finished with value: 0.36915841446986275 and parameters: {'model_type': 'gcn', 'hidden_dims': '[128, 64]', 'dropout': 0.49277296062463255, 'batch_norm': False, 'lr': 1.7498830583948245e-05, 'weight_decay': 1.9798625768082657e-07, 'epochs': 208, 'loss': 'mse', 'optimizer': 'adam', 'graph_mode': 'knn', 'knn_k': 5, 'weighted_edges': True, 'symmetrize_mode': 'union', 'self_loops': False, 'use_snp_selection': True, 'num_snps': 25084}. Best is trial 124 with value: 0.3755487195179888.
[I 2025-12-08 21:33:20,633] Trial 134 finished with value: 0.3673294212684601 and parameters: {'model_type': 'gcn', 'hidden_dims': '[128, 64]', 'dropout': 0.48329905913691756, 'batch_norm': False, 'lr': 1.9049323184153335e-05, 'weight_decay': 3.9850400862929805e-07, 'epochs': 175, 'loss': 'mse', 'optimizer': 'adam', 'graph_mode': 'knn', 'knn_k': 4, 'weighted_edges': True, 'symmetrize_mode': 'union', 'self_loops': False, 'use_snp_selection': True, 'num_snps': 32971}. Best is trial 124 with value: 0.3755487195179888.
[I 2025-12-08 21:33:38,691] Trial 135 finished with value: 0.3723568878225425 and parameters: {'model_type': 'gcn', 'hidden_dims': '[128, 64]', 'dropout': 0.46590778976171754, 'batch_norm': False, 'lr': 3.0275939291037203e-05, 'weight_decay': 2.5155706341572726e-07, 'epochs': 198, 'loss': 'mse', 'optimizer': 'adam', 'graph_mode': 'knn', 'knn_k': 6, 'weighted_edges': True, 'symmetrize_mode': 'union', 'self_loops': False, 'use_snp_selection': True, 'num_snps': 22757}. Best is trial 124 with value: 0.3755487195179888.
[I 2025-12-08 21:33:59,102] Trial 136 finished with value: 0.3695812603285356 and parameters: {'model_type': 'gcn', 'hidden_dims': '[128, 64]', 'dropout': 0.4645445272302228, 'batch_norm': False, 'lr': 3.0472557952480817e-05, 'weight_decay': 2.644147382200359e-07, 'epochs': 193, 'loss': 'mse', 'optimizer': 'adam', 'graph_mode': 'knn', 'knn_k': 6, 'weighted_edges': True, 'symmetrize_mode': 'union', 'self_loops': False, 'use_snp_selection': True, 'num_snps': 30407}. Best is trial 124 with value: 0.3755487195179888.
[I 2025-12-08 21:34:54,995] Trial 137 finished with value: 0.28056391952742565 and parameters: {'model_type': 'gcn', 'hidden_dims': '[512, 64]', 'dropout': 0.4436301388013657, 'batch_norm': True, 'lr': 2.1947353832145822e-05, 'weight_decay': 5.006501639500741e-07, 'epochs': 217, 'loss': 'mse', 'optimizer': 'adam', 'graph_mode': 'knn', 'knn_k': 6, 'weighted_edges': True, 'symmetrize_mode': 'mutual', 'self_loops': False, 'use_snp_selection': False}. Best is trial 124 with value: 0.3755487195179888.
[I 2025-12-08 21:35:12,642] Trial 138 finished with value: 0.3388342952557749 and parameters: {'model_type': 'gcn', 'hidden_dims': '[128, 64]', 'dropout': 0.42981820041094604, 'batch_norm': False, 'lr': 1.0708941420429561e-05, 'weight_decay': 3.6854490906147157e-07, 'epochs': 183, 'loss': 'mse', 'optimizer': 'adam', 'graph_mode': 'cutoff', 'cutoff': 0.21234904556735368, 'grm_norm': 'cosine_then_gcn', 'self_loops': False, 'use_snp_selection': True, 'num_snps': 22782}. Best is trial 124 with value: 0.3755487195179888.
[I 2025-12-08 21:35:29,877] Trial 139 finished with value: 0.36612623406186917 and parameters: {'model_type': 'gcn', 'hidden_dims': '[128, 64]', 'dropout': 0.47342495876158497, 'batch_norm': False, 'lr': 2.312114756526871e-05, 'weight_decay': 6.495371126007794e-07, 'epochs': 164, 'loss': 'mse', 'optimizer': 'adam', 'graph_mode': 'knn', 'knn_k': 5, 'weighted_edges': True, 'symmetrize_mode': 'union', 'self_loops': False, 'use_snp_selection': True, 'num_snps': 23853}. Best is trial 124 with value: 0.3755487195179888.
[I 2025-12-08 21:35:48,854] Trial 140 finished with value: 0.3688688547764911 and parameters: {'model_type': 'gcn', 'hidden_dims': '[128, 64]', 'dropout': 0.4486628740929788, 'batch_norm': False, 'lr': 1.2978512206338533e-05, 'weight_decay': 7.531348527580464e-06, 'epochs': 190, 'loss': 'mse', 'optimizer': 'adam', 'graph_mode': 'knn', 'knn_k': 5, 'weighted_edges': True, 'symmetrize_mode': 'union', 'self_loops': False, 'use_snp_selection': True, 'num_snps': 26688}. Best is trial 124 with value: 0.3755487195179888.
[I 2025-12-08 21:36:08,883] Trial 141 finished with value: 0.36818092558326165 and parameters: {'model_type': 'gcn', 'hidden_dims': '[128, 64]', 'dropout': 0.4998039340870187, 'batch_norm': False, 'lr': 2.6895663166492497e-05, 'weight_decay': 2.0771723661736e-07, 'epochs': 199, 'loss': 'mse', 'optimizer': 'adam', 'graph_mode': 'knn', 'knn_k': 4, 'weighted_edges': True, 'symmetrize_mode': 'union', 'self_loops': False, 'use_snp_selection': True, 'num_snps': 28367}. Best is trial 124 with value: 0.3755487195179888.
[I 2025-12-08 21:36:29,659] Trial 142 finished with value: 0.36581199363704664 and parameters: {'model_type': 'gcn', 'hidden_dims': '[128, 64]', 'dropout': 0.49108992236727234, 'batch_norm': False, 'lr': 3.260143296518193e-05, 'weight_decay': 1.699586972123302e-07, 'epochs': 205, 'loss': 'mse', 'optimizer': 'adam', 'graph_mode': 'knn', 'knn_k': 6, 'weighted_edges': True, 'symmetrize_mode': 'union', 'self_loops': False, 'use_snp_selection': True, 'num_snps': 29176}. Best is trial 124 with value: 0.3755487195179888.
[I 2025-12-08 21:36:51,294] Trial 143 finished with value: 0.3636224339631002 and parameters: {'model_type': 'gcn', 'hidden_dims': '[128, 64]', 'dropout': 0.5169723884005919, 'batch_norm': False, 'lr': 2.9806628087915037e-05, 'weight_decay': 1.3181824062423347e-07, 'epochs': 212, 'loss': 'mse', 'optimizer': 'adam', 'graph_mode': 'knn', 'knn_k': 5, 'weighted_edges': True, 'symmetrize_mode': 'union', 'self_loops': False, 'use_snp_selection': True, 'num_snps': 31628}. Best is trial 124 with value: 0.3755487195179888.
[I 2025-12-08 21:37:10,194] Trial 144 finished with value: 0.3653454173597638 and parameters: {'model_type': 'gcn', 'hidden_dims': '[128, 64]', 'dropout': 0.47974031786788357, 'batch_norm': False, 'lr': 2.601125832099247e-05, 'weight_decay': 2.9408784474485417e-07, 'epochs': 197, 'loss': 'mse', 'optimizer': 'adam', 'graph_mode': 'knn', 'knn_k': 5, 'weighted_edges': True, 'symmetrize_mode': 'union', 'self_loops': False, 'use_snp_selection': True, 'num_snps': 25687}. Best is trial 124 with value: 0.3755487195179888.
[I 2025-12-08 21:37:27,689] Trial 145 finished with value: 0.3724061323371317 and parameters: {'model_type': 'gcn', 'hidden_dims': '[128, 64]', 'dropout': 0.41255232011667026, 'batch_norm': False, 'lr': 4.330454602237922e-05, 'weight_decay': 2.298214627585527e-07, 'epochs': 183, 'loss': 'mse', 'optimizer': 'adam', 'graph_mode': 'knn', 'knn_k': 6, 'weighted_edges': True, 'symmetrize_mode': 'union', 'self_loops': False, 'use_snp_selection': True, 'num_snps': 22327}. Best is trial 124 with value: 0.3755487195179888.
[I 2025-12-08 21:37:44,020] Trial 146 finished with value: 0.37262491751710247 and parameters: {'model_type': 'gcn', 'hidden_dims': '[128, 64]', 'dropout': 0.38849938681518364, 'batch_norm': False, 'lr': 1.969203871706129e-05, 'weight_decay': 2.502761444579375e-07, 'epochs': 176, 'loss': 'mse', 'optimizer': 'adam', 'graph_mode': 'knn', 'knn_k': 6, 'weighted_edges': True, 'symmetrize_mode': 'union', 'self_loops': False, 'use_snp_selection': True, 'num_snps': 19529}. Best is trial 124 with value: 0.3755487195179888.
[I 2025-12-08 21:38:04,247] Trial 147 finished with value: 0.3592340688358345 and parameters: {'model_type': 'gcn', 'hidden_dims': '[256, 128, 64]', 'dropout': 0.4047353793319872, 'batch_norm': False, 'lr': 4.276628919053453e-05, 'weight_decay': 2.3695442425844584e-07, 'epochs': 171, 'loss': 'mse', 'optimizer': 'adam', 'graph_mode': 'knn', 'knn_k': 6, 'weighted_edges': True, 'symmetrize_mode': 'union', 'self_loops': False, 'use_snp_selection': True, 'num_snps': 19494}. Best is trial 124 with value: 0.3755487195179888.
[I 2025-12-08 21:38:20,547] Trial 148 finished with value: 0.36759100518105325 and parameters: {'model_type': 'gcn', 'hidden_dims': '[128, 64]', 'dropout': 0.38251443989477335, 'batch_norm': False, 'lr': 3.386542745308712e-05, 'weight_decay': 3.209459515036082e-07, 'epochs': 178, 'loss': 'mse', 'optimizer': 'adam', 'graph_mode': 'knn', 'knn_k': 6, 'weighted_edges': True, 'symmetrize_mode': 'union', 'self_loops': False, 'use_snp_selection': True, 'num_snps': 19201}. Best is trial 124 with value: 0.3755487195179888.
[I 2025-12-08 21:38:37,760] Trial 149 finished with value: 0.36286961882440233 and parameters: {'model_type': 'gcn', 'hidden_dims': '[128, 64]', 'dropout': 0.4176249729522495, 'batch_norm': False, 'lr': 1.9952799691993958e-05, 'weight_decay': 1.5792396037782637e-07, 'epochs': 179, 'loss': 'mse', 'optimizer': 'adam', 'graph_mode': 'knn', 'knn_k': 6, 'weighted_edges': True, 'symmetrize_mode': 'union', 'self_loops': True, 'use_snp_selection': True, 'num_snps': 21445}. Best is trial 124 with value: 0.3755487195179888.
[I 2025-12-08 21:39:07,049] Trial 0 finished with value: 0.2586266476920525 and parameters: {'model_type': 'gcn', 'hidden_dims': '[128, 64]', 'dropout': 0.199031432379812, 'batch_norm': True, 'lr': 1.8408544111075823e-05, 'weight_decay': 5.5136510071208614e-05, 'epochs': 336, 'loss': 'mae', 'optimizer': 'adam', 'graph_mode': 'knn', 'knn_k': 8, 'weighted_edges': True, 'symmetrize_mode': 'mutual', 'self_loops': True, 'use_snp_selection': True, 'num_snps': 27173}. Best is trial 0 with value: 0.2586266476920525.
[I 2025-12-08 21:39:45,401] Trial 1 finished with value: 0.23953410659626476 and parameters: {'model_type': 'gcn', 'hidden_dims': '[256, 128, 64]', 'dropout': 0.5543244404043342, 'batch_norm': True, 'lr': 7.981787657617978e-05, 'weight_decay': 2.8571789869344834e-07, 'epochs': 297, 'loss': 'mae', 'optimizer': 'adam', 'graph_mode': 'cutoff', 'cutoff': 0.3392632777751686, 'grm_norm': 'gcn', 'self_loops': False, 'use_snp_selection': False}. Best is trial 0 with value: 0.2586266476920525.
[I 2025-12-08 21:40:43,438] Trial 2 finished with value: 0.253833254293688 and parameters: {'model_type': 'gcn', 'hidden_dims': '[512, 64]', 'dropout': 0.32815227354739207, 'batch_norm': True, 'lr': 0.000619605044204259, 'weight_decay': 0.0004086269831625786, 'epochs': 206, 'loss': 'mse', 'optimizer': 'adam', 'graph_mode': 'knn', 'knn_k': 4, 'weighted_edges': True, 'symmetrize_mode': 'union', 'self_loops': True, 'use_snp_selection': True, 'num_snps': 53035}. Best is trial 0 with value: 0.2586266476920525.
[I 2025-12-08 21:41:10,885] Trial 3 finished with value: 0.24180110386609305 and parameters: {'model_type': 'gcn', 'hidden_dims': '[256, 128]', 'dropout': 0.23110783056597514, 'batch_norm': True, 'lr': 8.11311593386298e-05, 'weight_decay': 9.296158109581328e-07, 'epochs': 213, 'loss': 'mse', 'optimizer': 'adam', 'graph_mode': 'knn', 'knn_k': 10, 'weighted_edges': True, 'symmetrize_mode': 'mutual', 'self_loops': True, 'use_snp_selection': False}. Best is trial 0 with value: 0.2586266476920525.
[I 2025-12-08 21:41:25,717] Trial 4 finished with value: 0.3473156276421043 and parameters: {'model_type': 'gcn', 'hidden_dims': '[512, 256]', 'dropout': 0.2753281956415665, 'batch_norm': True, 'lr': 0.00034435188114839693, 'weight_decay': 4.9416012835950194e-05, 'epochs': 89, 'loss': 'mae', 'optimizer': 'adam', 'graph_mode': 'cutoff', 'cutoff': 0.820078967317394, 'grm_norm': 'none', 'self_loops': False, 'use_snp_selection': True, 'num_snps': 12674}. Best is trial 4 with value: 0.3473156276421043.
[I 2025-12-08 21:41:50,695] Trial 5 finished with value: 0.31505719515021985 and parameters: {'model_type': 'gcn', 'hidden_dims': '[128, 64]', 'dropout': 0.5611163934517731, 'batch_norm': True, 'lr': 0.0003984856210762587, 'weight_decay': 1.1466743517565185e-07, 'epochs': 344, 'loss': 'mae', 'optimizer': 'adam', 'graph_mode': 'cutoff', 'cutoff': 0.6089370799714728, 'grm_norm': 'gcn', 'self_loops': True, 'use_snp_selection': False}. Best is trial 4 with value: 0.3473156276421043.
[I 2025-12-08 21:42:13,389] Trial 6 finished with value: 0.30046831895972625 and parameters: {'model_type': 'gcn', 'hidden_dims': '[128, 64]', 'dropout': 0.31805912766941713, 'batch_norm': True, 'lr': 1.2361026034262557e-05, 'weight_decay': 6.492620232791903e-06, 'epochs': 271, 'loss': 'mse', 'optimizer': 'adam', 'graph_mode': 'cutoff', 'cutoff': 0.6193362582230448, 'grm_norm': 'cosine', 'self_loops': False, 'use_snp_selection': True, 'num_snps': 28594}. Best is trial 4 with value: 0.3473156276421043.
[I 2025-12-08 21:42:33,185] Trial 7 finished with value: 0.245950220762293 and parameters: {'model_type': 'gcn', 'hidden_dims': '[512, 64]', 'dropout': 0.471337288649717, 'batch_norm': True, 'lr': 2.239693207292708e-05, 'weight_decay': 2.263166635514082e-06, 'epochs': 69, 'loss': 'mse', 'optimizer': 'adam', 'graph_mode': 'cutoff', 'cutoff': 0.4056820886426376, 'grm_norm': 'cosine', 'self_loops': False, 'use_snp_selection': False}. Best is trial 4 with value: 0.3473156276421043.
[I 2025-12-08 21:43:11,132] Trial 8 finished with value: 0.340989532086751 and parameters: {'model_type': 'gcn', 'hidden_dims': '[512, 256]', 'dropout': 0.20659328268932406, 'batch_norm': False, 'lr': 8.93315124361372e-05, 'weight_decay': 0.00028987480727919035, 'epochs': 136, 'loss': 'mae', 'optimizer': 'adam', 'graph_mode': 'knn', 'knn_k': 3, 'weighted_edges': False, 'symmetrize_mode': 'union', 'self_loops': False, 'use_snp_selection': True, 'num_snps': 43128}. Best is trial 4 with value: 0.3473156276421043.
[I 2025-12-08 21:43:53,177] Trial 9 finished with value: -0.04141968147693158 and parameters: {'model_type': 'gcn', 'hidden_dims': '[512, 256]', 'dropout': 0.2888209592870401, 'batch_norm': False, 'lr': 0.004734648143129892, 'weight_decay': 1.5879705591356368e-06, 'epochs': 163, 'loss': 'mse', 'optimizer': 'adam', 'graph_mode': 'cutoff', 'cutoff': 0.5984899797909019, 'grm_norm': 'cosine', 'self_loops': True, 'use_snp_selection': False}. Best is trial 4 with value: 0.3473156276421043.
[I 2025-12-08 21:44:02,446] Trial 10 finished with value: 0.3250050226749174 and parameters: {'model_type': 'gcn', 'hidden_dims': '[512, 128]', 'dropout': 0.11372025982957354, 'batch_norm': False, 'lr': 0.0023343012062770553, 'weight_decay': 4.14440562940608e-05, 'epochs': 41, 'loss': 'mae', 'optimizer': 'adam', 'graph_mode': 'cutoff', 'cutoff': 0.8740100033033124, 'grm_norm': 'none', 'self_loops': False, 'use_snp_selection': True, 'num_snps': 3859}. Best is trial 4 with value: 0.3473156276421043.
[I 2025-12-08 21:44:38,959] Trial 11 finished with value: 0.32189585895187256 and parameters: {'model_type': 'gcn', 'hidden_dims': '[512, 256]', 'dropout': 0.42220860806405436, 'batch_norm': False, 'lr': 0.00012587284186352953, 'weight_decay': 0.0006590033092812647, 'epochs': 114, 'loss': 'mae', 'optimizer': 'adam', 'graph_mode': 'knn', 'knn_k': 1, 'weighted_edges': False, 'symmetrize_mode': 'union', 'self_loops': False, 'use_snp_selection': True, 'num_snps': 47068}. Best is trial 4 with value: 0.3473156276421043.
[I 2025-12-08 21:44:53,829] Trial 12 finished with value: 0.3380111927975496 and parameters: {'model_type': 'gcn', 'hidden_dims': '[512, 256]', 'dropout': 0.14142767069304862, 'batch_norm': False, 'lr': 0.0011798598123878552, 'weight_decay': 9.414718277089941e-05, 'epochs': 124, 'loss': 'mae', 'optimizer': 'adam', 'graph_mode': 'knn', 'knn_k': 3, 'weighted_edges': False, 'symmetrize_mode': 'union', 'self_loops': False, 'use_snp_selection': True, 'num_snps': 8584}. Best is trial 4 with value: 0.3473156276421043.
[I 2025-12-08 21:45:24,894] Trial 13 finished with value: 0.3437378452711857 and parameters: {'model_type': 'gcn', 'hidden_dims': '[512, 256]', 'dropout': 0.23483876358445724, 'batch_norm': False, 'lr': 0.00018005512155234809, 'weight_decay': 0.00018148625050029915, 'epochs': 101, 'loss': 'mae', 'optimizer': 'adam', 'graph_mode': 'knn', 'knn_k': 6, 'weighted_edges': False, 'symmetrize_mode': 'union', 'self_loops': False, 'use_snp_selection': True, 'num_snps': 39863}. Best is trial 4 with value: 0.3473156276421043.
[I 2025-12-08 21:45:41,963] Trial 14 finished with value: 0.36156912815813697 and parameters: {'model_type': 'gcn', 'hidden_dims': '[512, 256]', 'dropout': 0.4254746032272495, 'batch_norm': False, 'lr': 0.0002379532657617651, 'weight_decay': 2.2203297076850073e-05, 'epochs': 82, 'loss': 'mae', 'optimizer': 'adam', 'graph_mode': 'cutoff', 'cutoff': 0.8944237199027842, 'grm_norm': 'none', 'self_loops': False, 'use_snp_selection': True, 'num_snps': 18062}. Best is trial 14 with value: 0.36156912815813697.
[I 2025-12-08 21:45:55,348] Trial 15 finished with value: 0.30970648662292455 and parameters: {'model_type': 'gcn', 'hidden_dims': '[256, 128, 64]', 'dropout': 0.4038548841002544, 'batch_norm': False, 'lr': 0.0009999216920007895, 'weight_decay': 1.3728672854267767e-05, 'epochs': 70, 'loss': 'mae', 'optimizer': 'adam', 'graph_mode': 'cutoff', 'cutoff': 0.8872255416714164, 'grm_norm': 'none', 'self_loops': False, 'use_snp_selection': True, 'num_snps': 15581}. Best is trial 14 with value: 0.36156912815813697.
[I 2025-12-08 21:46:19,563] Trial 16 finished with value: 0.31324272957601346 and parameters: {'model_type': 'gcn', 'hidden_dims': '[512, 128]', 'dropout': 0.4816899998625315, 'batch_norm': True, 'lr': 3.324514570871406e-05, 'weight_decay': 1.585184858108273e-05, 'epochs': 179, 'loss': 'mae', 'optimizer': 'adam', 'graph_mode': 'cutoff', 'cutoff': 0.7714575519927706, 'grm_norm': 'none', 'self_loops': False, 'use_snp_selection': True, 'num_snps': 18042}. Best is trial 14 with value: 0.36156912815813697.
[I 2025-12-08 21:46:34,703] Trial 17 finished with value: 0.3269202488147699 and parameters: {'model_type': 'gcn', 'hidden_dims': '[512, 256]', 'dropout': 0.39676531083157673, 'batch_norm': False, 'lr': 0.00021158082341882003, 'weight_decay': 5.633813841868188e-06, 'epochs': 47, 'loss': 'mae', 'optimizer': 'adam', 'graph_mode': 'cutoff', 'cutoff': 0.7430449078328386, 'grm_norm': 'cosine_then_gcn', 'self_loops': False, 'use_snp_selection': True, 'num_snps': 19181}. Best is trial 14 with value: 0.36156912815813697.
