[I 2025-12-08 11:14:44,389] Trial 19 finished with value: 0.2748446254894829 and parameters: {'model_type': 'gcn', 'hidden_dims': '[512, 256]', 'dropout': 0.17960265661255337, 'batch_norm': False, 'lr': 0.0029751110466155147, 'weight_decay': 0.0009506528840190462, 'epochs': 236, 'loss': 'mae', 'optimizer': 'adam', 'graph_mode': 'cutoff', 'cutoff': 0.2386548621641688, 'grm_norm': 'none', 'self_loops': False, 'use_snp_selection': True, 'num_snps': 37947}. Best is trial 4 with value: 0.35082313422103845.
[I 2025-12-08 11:14:57,433] Trial 20 finished with value: 0.3528628985357215 and parameters: {'model_type': 'gcn', 'hidden_dims': '[512, 256]', 'dropout': 0.2663159678862425, 'batch_norm': False, 'lr': 0.0005731795743213937, 'weight_decay': 1.3683815410345108e-05, 'epochs': 102, 'loss': 'mae', 'optimizer': 'adam', 'graph_mode': 'cutoff', 'cutoff': 0.7550233606026814, 'grm_norm': 'cosine_then_gcn', 'self_loops': False, 'use_snp_selection': True, 'num_snps': 8231}. Best is trial 20 with value: 0.3528628985357215.
[I 2025-12-08 11:15:11,041] Trial 21 finished with value: 0.3567832364186757 and parameters: {'model_type': 'gcn', 'hidden_dims': '[512, 256]', 'dropout': 0.2462334917012407, 'batch_norm': False, 'lr': 0.0005436100252487031, 'weight_decay': 1.6206393908885257e-05, 'epochs': 96, 'loss': 'mae', 'optimizer': 'adam', 'graph_mode': 'cutoff', 'cutoff': 0.7559354342028177, 'grm_norm': 'cosine_then_gcn', 'self_loops': False, 'use_snp_selection': True, 'num_snps': 9792}. Best is trial 21 with value: 0.3567832364186757.
[I 2025-12-08 11:15:28,244] Trial 22 finished with value: 0.34992536636683835 and parameters: {'model_type': 'gcn', 'hidden_dims': '[512, 256]', 'dropout': 0.2741569540402562, 'batch_norm': False, 'lr': 0.0004738576084570272, 'weight_decay': 1.539286867407512e-05, 'epochs': 133, 'loss': 'mae', 'optimizer': 'adam', 'graph_mode': 'cutoff', 'cutoff': 0.7688228325477409, 'grm_norm': 'cosine_then_gcn', 'self_loops': False, 'use_snp_selection': True, 'num_snps': 13077}. Best is trial 21 with value: 0.3567832364186757.
[I 2025-12-08 11:15:40,809] Trial 23 finished with value: 0.36083280754286046 and parameters: {'model_type': 'gcn', 'hidden_dims': '[512, 256]', 'dropout': 0.3557319859649986, 'batch_norm': False, 'lr': 0.00023044144595281416, 'weight_decay': 3.90666642494886e-06, 'epochs': 65, 'loss': 'mae', 'optimizer': 'adam', 'graph_mode': 'cutoff', 'cutoff': 0.7444647125279281, 'grm_norm': 'cosine_then_gcn', 'self_loops': False, 'use_snp_selection': True, 'num_snps': 10516}. Best is trial 23 with value: 0.36083280754286046.
[I 2025-12-08 11:15:58,350] Trial 24 finished with value: 0.35138938797235425 and parameters: {'model_type': 'gcn', 'hidden_dims': '[512, 256]', 'dropout': 0.3682233245401061, 'batch_norm': False, 'lr': 0.00016306385721494087, 'weight_decay': 5.081603357092399e-06, 'epochs': 67, 'loss': 'mae', 'optimizer': 'adam', 'graph_mode': 'cutoff', 'cutoff': 0.7032307748171842, 'grm_norm': 'cosine_then_gcn', 'self_loops': False, 'use_snp_selection': True, 'num_snps': 22186}. Best is trial 23 with value: 0.36083280754286046.
[I 2025-12-08 11:16:09,716] Trial 25 finished with value: 0.2831096325293616 and parameters: {'model_type': 'gcn', 'hidden_dims': '[512, 128]', 'dropout': 0.48992825192923517, 'batch_norm': False, 'lr': 3.809134172793569e-05, 'weight_decay': 3.0349220347468946e-06, 'epochs': 57, 'loss': 'mae', 'optimizer': 'adam', 'graph_mode': 'cutoff', 'cutoff': 0.7076303676332742, 'grm_norm': 'cosine_then_gcn', 'self_loops': False, 'use_snp_selection': True, 'num_snps': 8535}. Best is trial 23 with value: 0.36083280754286046.
[I 2025-12-08 11:16:29,232] Trial 26 finished with value: 0.3168157816636731 and parameters: {'model_type': 'gcn', 'hidden_dims': '[256, 128, 64]', 'dropout': 0.23539821628671176, 'batch_norm': False, 'lr': 0.00017532132889601726, 'weight_decay': 7.04037782240393e-07, 'epochs': 144, 'loss': 'mse', 'optimizer': 'adam', 'graph_mode': 'cutoff', 'cutoff': 0.4940367267437375, 'grm_norm': 'cosine_then_gcn', 'self_loops': True, 'use_snp_selection': False}. Best is trial 23 with value: 0.36083280754286046.
[I 2025-12-08 11:16:58,625] Trial 27 finished with value: 0.26711162381348014 and parameters: {'model_type': 'gcn', 'hidden_dims': '[256, 128]', 'dropout': 0.31410152297750354, 'batch_norm': False, 'lr': 0.0006719888704349442, 'weight_decay': 1.7006602306210426e-05, 'epochs': 102, 'loss': 'mae', 'optimizer': 'adam', 'graph_mode': 'cutoff', 'cutoff': 0.8021035364438854, 'grm_norm': 'cosine_then_gcn', 'self_loops': False, 'use_snp_selection': True, 'num_snps': 59311}. Best is trial 23 with value: 0.36083280754286046.
[I 2025-12-08 11:17:35,891] Trial 28 finished with value: 0.36309430880710425 and parameters: {'model_type': 'gcn', 'hidden_dims': '[512, 64]', 'dropout': 0.3985340964588429, 'batch_norm': False, 'lr': 5.154921871195775e-05, 'weight_decay': 4.623368488243616e-06, 'epochs': 174, 'loss': 'mae', 'optimizer': 'adam', 'graph_mode': 'cutoff', 'cutoff': 0.6747150168251552, 'grm_norm': 'cosine_then_gcn', 'self_loops': False, 'use_snp_selection': True, 'num_snps': 35866}. Best is trial 28 with value: 0.36309430880710425.
[I 2025-12-08 11:18:14,228] Trial 29 finished with value: 0.35959479754441903 and parameters: {'model_type': 'gcn', 'hidden_dims': '[512, 64]', 'dropout': 0.39732469899775597, 'batch_norm': False, 'lr': 4.2798796947466284e-05, 'weight_decay': 4.310761577104929e-06, 'epochs': 185, 'loss': 'mae', 'optimizer': 'adam', 'graph_mode': 'cutoff', 'cutoff': 0.6701392188206087, 'grm_norm': 'cosine_then_gcn', 'self_loops': True, 'use_snp_selection': True, 'num_snps': 35107}. Best is trial 28 with value: 0.36309430880710425.
[I 2025-12-08 11:19:01,558] Trial 30 finished with value: 0.36192696170048677 and parameters: {'model_type': 'gcn', 'hidden_dims': '[512, 64]', 'dropout': 0.4109276013470672, 'batch_norm': False, 'lr': 4.324653142445367e-05, 'weight_decay': 3.7691408738382073e-06, 'epochs': 255, 'loss': 'mae', 'optimizer': 'adam', 'graph_mode': 'cutoff', 'cutoff': 0.5310760479148952, 'grm_norm': 'cosine_then_gcn', 'self_loops': True, 'use_snp_selection': True, 'num_snps': 34646}. Best is trial 28 with value: 0.36309430880710425.
[I 2025-12-08 11:19:52,248] Trial 31 finished with value: 0.34676369426284837 and parameters: {'model_type': 'gcn', 'hidden_dims': '[512, 64]', 'dropout': 0.41197580281128876, 'batch_norm': False, 'lr': 3.916149818090063e-05, 'weight_decay': 1.1139614497021269e-06, 'epochs': 261, 'loss': 'mae', 'optimizer': 'adam', 'graph_mode': 'cutoff', 'cutoff': 0.5147799978986852, 'grm_norm': 'cosine_then_gcn', 'self_loops': True, 'use_snp_selection': True, 'num_snps': 37353}. Best is trial 28 with value: 0.36309430880710425.
[I 2025-12-08 11:20:44,259] Trial 32 finished with value: 0.35270633543765795 and parameters: {'model_type': 'gcn', 'hidden_dims': '[512, 64]', 'dropout': 0.4478016253497419, 'batch_norm': False, 'lr': 4.590897196261615e-05, 'weight_decay': 3.824020942917534e-06, 'epochs': 299, 'loss': 'mae', 'optimizer': 'adam', 'graph_mode': 'cutoff', 'cutoff': 0.6516549369614908, 'grm_norm': 'cosine_then_gcn', 'self_loops': True, 'use_snp_selection': True, 'num_snps': 34459}. Best is trial 28 with value: 0.36309430880710425.
[I 2025-12-08 11:21:19,717] Trial 33 finished with value: 0.3719975991266678 and parameters: {'model_type': 'gcn', 'hidden_dims': '[512, 64]', 'dropout': 0.5298759612044265, 'batch_norm': False, 'lr': 2.491134236984863e-05, 'weight_decay': 3.8259806092474213e-07, 'epochs': 182, 'loss': 'mae', 'optimizer': 'adam', 'graph_mode': 'cutoff', 'cutoff': 0.5603929357175733, 'grm_norm': 'cosine_then_gcn', 'self_loops': True, 'use_snp_selection': True, 'num_snps': 32174}. Best is trial 33 with value: 0.3719975991266678.
[I 2025-12-08 11:22:16,203] Trial 34 finished with value: 0.3648572771174202 and parameters: {'model_type': 'gcn', 'hidden_dims': '[512, 64]', 'dropout': 0.4870387356474606, 'batch_norm': False, 'lr': 2.256860217009084e-05, 'weight_decay': 4.1689733589504135e-07, 'epochs': 223, 'loss': 'mae', 'optimizer': 'adam', 'graph_mode': 'cutoff', 'cutoff': 0.5584210119193442, 'grm_norm': 'cosine_then_gcn', 'self_loops': True, 'use_snp_selection': False}. Best is trial 33 with value: 0.3719975991266678.
[I 2025-12-08 11:23:15,231] Trial 35 finished with value: 0.3550570584069325 and parameters: {'model_type': 'gcn', 'hidden_dims': '[512, 64]', 'dropout': 0.5278519082215529, 'batch_norm': False, 'lr': 2.056613858190663e-05, 'weight_decay': 4.046827819910667e-07, 'epochs': 227, 'loss': 'mse', 'optimizer': 'adam', 'graph_mode': 'cutoff', 'cutoff': 0.4618203102896523, 'grm_norm': 'cosine_then_gcn', 'self_loops': True, 'use_snp_selection': False}. Best is trial 33 with value: 0.3719975991266678.
[I 2025-12-08 11:24:05,824] Trial 36 finished with value: 0.35848128988025885 and parameters: {'model_type': 'gcn', 'hidden_dims': '[512, 64]', 'dropout': 0.5171704421016152, 'batch_norm': False, 'lr': 1.1225400322657802e-05, 'weight_decay': 1.1247451289470394e-07, 'epochs': 199, 'loss': 'mae', 'optimizer': 'adam', 'graph_mode': 'cutoff', 'cutoff': 0.5631592978015065, 'grm_norm': 'gcn', 'self_loops': True, 'use_snp_selection': False}. Best is trial 33 with value: 0.3719975991266678.
[I 2025-12-08 11:25:07,517] Trial 37 finished with value: 0.36389278872904357 and parameters: {'model_type': 'gcn', 'hidden_dims': '[512, 64]', 'dropout': 0.5870053296534858, 'batch_norm': False, 'lr': 2.7108531684581506e-05, 'weight_decay': 2.4448323547961474e-07, 'epochs': 245, 'loss': 'mae', 'optimizer': 'adam', 'graph_mode': 'cutoff', 'cutoff': 0.5445775395526514, 'grm_norm': 'cosine_then_gcn', 'self_loops': True, 'use_snp_selection': False}. Best is trial 33 with value: 0.3719975991266678.
[I 2025-12-08 11:26:21,101] Trial 38 finished with value: 0.3431355823075963 and parameters: {'model_type': 'gcn', 'hidden_dims': '[512, 64]', 'dropout': 0.5958425202957375, 'batch_norm': False, 'lr': 2.9228398450773744e-05, 'weight_decay': 2.601568778074062e-07, 'epochs': 293, 'loss': 'mse', 'optimizer': 'adam', 'graph_mode': 'cutoff', 'cutoff': 0.437203187654058, 'grm_norm': 'cosine_then_gcn', 'self_loops': True, 'use_snp_selection': False}. Best is trial 33 with value: 0.3719975991266678.
[I 2025-12-08 11:27:15,313] Trial 39 finished with value: 0.31899367866597306 and parameters: {'model_type': 'gcn', 'hidden_dims': '[512, 64]', 'dropout': 0.5927729482594805, 'batch_norm': True, 'lr': 1.5561940484694262e-05, 'weight_decay': 2.085648572339233e-07, 'epochs': 213, 'loss': 'mae', 'optimizer': 'adam', 'graph_mode': 'cutoff', 'cutoff': 0.5662065939160129, 'grm_norm': 'cosine_then_gcn', 'self_loops': True, 'use_snp_selection': False}. Best is trial 33 with value: 0.3719975991266678.
[I 2025-12-08 11:27:29,411] Trial 40 finished with value: 0.27757694687492934 and parameters: {'model_type': 'gcn', 'hidden_dims': '[128, 64]', 'dropout': 0.5566465364724388, 'batch_norm': False, 'lr': 7.247935200808935e-05, 'weight_decay': 5.161386555454318e-07, 'epochs': 183, 'loss': 'mse', 'optimizer': 'adam', 'graph_mode': 'cutoff', 'cutoff': 0.3791083867627543, 'grm_norm': 'gcn', 'self_loops': True, 'use_snp_selection': False}. Best is trial 33 with value: 0.3719975991266678.
[I 2025-12-08 11:28:31,841] Trial 41 finished with value: 0.3636562338685172 and parameters: {'model_type': 'gcn', 'hidden_dims': '[512, 64]', 'dropout': 0.4938216977217994, 'batch_norm': False, 'lr': 5.755663000121356e-05, 'weight_decay': 1.5385820066457092e-07, 'epochs': 248, 'loss': 'mae', 'optimizer': 'adam', 'graph_mode': 'cutoff', 'cutoff': 0.5364673909197804, 'grm_norm': 'cosine_then_gcn', 'self_loops': True, 'use_snp_selection': False}. Best is trial 33 with value: 0.3719975991266678.
[I 2025-12-08 11:29:32,718] Trial 42 finished with value: 0.34278777210046424 and parameters: {'model_type': 'gcn', 'hidden_dims': '[512, 64]', 'dropout': 0.5210318870647948, 'batch_norm': False, 'lr': 6.217990038878803e-05, 'weight_decay': 1.7217822443954418e-07, 'epochs': 240, 'loss': 'mae', 'optimizer': 'adam', 'graph_mode': 'cutoff', 'cutoff': 0.48734316605278355, 'grm_norm': 'cosine_then_gcn', 'self_loops': True, 'use_snp_selection': False}. Best is trial 33 with value: 0.3719975991266678.
[I 2025-12-08 11:30:43,186] Trial 43 finished with value: 0.36038584322274464 and parameters: {'model_type': 'gcn', 'hidden_dims': '[512, 64]', 'dropout': 0.4895476058252138, 'batch_norm': False, 'lr': 2.5982845900844633e-05, 'weight_decay': 3.8282895182285847e-07, 'epochs': 282, 'loss': 'mae', 'optimizer': 'adam', 'graph_mode': 'cutoff', 'cutoff': 0.5810933678041492, 'grm_norm': 'cosine_then_gcn', 'self_loops': True, 'use_snp_selection': False}. Best is trial 33 with value: 0.3719975991266678.
[I 2025-12-08 11:31:39,328] Trial 44 finished with value: 0.3598102669626628 and parameters: {'model_type': 'gcn', 'hidden_dims': '[512, 64]', 'dropout': 0.45288389543256585, 'batch_norm': False, 'lr': 1.7397466211677275e-05, 'weight_decay': 1.6103000289769345e-07, 'epochs': 222, 'loss': 'mae', 'optimizer': 'adam', 'graph_mode': 'cutoff', 'cutoff': 0.6487190391756734, 'grm_norm': 'cosine_then_gcn', 'self_loops': True, 'use_snp_selection': False}. Best is trial 33 with value: 0.3719975991266678.
[I 2025-12-08 11:32:56,526] Trial 45 finished with value: 0.25635693743857146 and parameters: {'model_type': 'gcn', 'hidden_dims': '[512, 64]', 'dropout': 0.5493502144806721, 'batch_norm': True, 'lr': 6.428427465651237e-05, 'weight_decay': 1.1660230258664244e-06, 'epochs': 309, 'loss': 'mae', 'optimizer': 'adam', 'graph_mode': 'cutoff', 'cutoff': 0.5407627159733582, 'grm_norm': 'gcn', 'self_loops': True, 'use_snp_selection': False}. Best is trial 33 with value: 0.3719975991266678.
[I 2025-12-08 11:33:59,043] Trial 46 finished with value: 0.36029873508287835 and parameters: {'model_type': 'gcn', 'hidden_dims': '[512, 64]', 'dropout': 0.5794564121572219, 'batch_norm': False, 'lr': 1.380507921526621e-05, 'weight_decay': 5.744723144704274e-07, 'epochs': 249, 'loss': 'mae', 'optimizer': 'adam', 'graph_mode': 'cutoff', 'cutoff': 0.6285710740030325, 'grm_norm': 'cosine', 'self_loops': True, 'use_snp_selection': False}. Best is trial 33 with value: 0.3719975991266678.
[I 2025-12-08 11:34:14,667] Trial 47 finished with value: 0.34408835703649343 and parameters: {'model_type': 'gcn', 'hidden_dims': '[128, 64]', 'dropout': 0.49526958687383016, 'batch_norm': False, 'lr': 2.8905721180582526e-05, 'weight_decay': 1.6422302894297619e-06, 'epochs': 204, 'loss': 'mae', 'optimizer': 'adam', 'graph_mode': 'cutoff', 'cutoff': 0.31585609859252284, 'grm_norm': 'cosine_then_gcn', 'self_loops': True, 'use_snp_selection': False}. Best is trial 33 with value: 0.3719975991266678.
[I 2025-12-08 11:35:02,185] Trial 48 finished with value: 0.36719508258015343 and parameters: {'model_type': 'gcn', 'hidden_dims': '[512, 64]', 'dropout': 0.539148526041127, 'batch_norm': False, 'lr': 9.982422257543519e-05, 'weight_decay': 3.009159435503416e-07, 'epochs': 186, 'loss': 'mae', 'optimizer': 'adam', 'graph_mode': 'cutoff', 'cutoff': 0.5973497894856097, 'grm_norm': 'cosine', 'self_loops': True, 'use_snp_selection': False}. Best is trial 33 with value: 0.3719975991266678.
[I 2025-12-08 11:35:43,804] Trial 49 finished with value: 0.2615531685374408 and parameters: {'model_type': 'gcn', 'hidden_dims': '[256, 128, 64]', 'dropout': 0.553973657415704, 'batch_norm': True, 'lr': 9.725422397157008e-05, 'weight_decay': 3.0512134743684045e-07, 'epochs': 326, 'loss': 'mse', 'optimizer': 'adam', 'graph_mode': 'knn', 'knn_k': 1, 'weighted_edges': True, 'symmetrize_mode': 'mutual', 'self_loops': True, 'use_snp_selection': False}. Best is trial 33 with value: 0.3719975991266678.
[I 2025-12-08 11:36:38,085] Trial 50 finished with value: 0.3628189386773628 and parameters: {'model_type': 'gcn', 'hidden_dims': '[512, 64]', 'dropout': 0.5738966244189092, 'batch_norm': False, 'lr': 0.00010168092747395188, 'weight_decay': 1.3768738643685606e-07, 'epochs': 214, 'loss': 'mae', 'optimizer': 'adam', 'graph_mode': 'cutoff', 'cutoff': 0.6156508686813459, 'grm_norm': 'cosine', 'self_loops': True, 'use_snp_selection': False}. Best is trial 33 with value: 0.3719975991266678.
[I 2025-12-08 11:37:24,928] Trial 51 finished with value: 0.3714629273272008 and parameters: {'model_type': 'gcn', 'hidden_dims': '[512, 64]', 'dropout': 0.5371661087324331, 'batch_norm': False, 'lr': 5.417275058295514e-05, 'weight_decay': 1.0017516654779173e-07, 'epochs': 183, 'loss': 'mae', 'optimizer': 'adam', 'graph_mode': 'cutoff', 'cutoff': 0.5918036535312743, 'grm_norm': 'cosine', 'self_loops': True, 'use_snp_selection': False}. Best is trial 33 with value: 0.3719975991266678.
[I 2025-12-08 11:38:04,579] Trial 52 finished with value: 0.3514933065222367 and parameters: {'model_type': 'gcn', 'hidden_dims': '[512, 64]', 'dropout': 0.5420207681172162, 'batch_norm': False, 'lr': 2.1552634206838904e-05, 'weight_decay': 2.282921835276478e-07, 'epochs': 153, 'loss': 'mae', 'optimizer': 'adam', 'graph_mode': 'cutoff', 'cutoff': 0.598506333609033, 'grm_norm': 'cosine', 'self_loops': True, 'use_snp_selection': False}. Best is trial 33 with value: 0.3719975991266678.
[I 2025-12-08 11:38:53,797] Trial 53 finished with value: 0.3610436590923908 and parameters: {'model_type': 'gcn', 'hidden_dims': '[512, 64]', 'dropout': 0.5102728078040993, 'batch_norm': False, 'lr': 3.252228674390956e-05, 'weight_decay': 7.569991717705361e-07, 'epochs': 193, 'loss': 'mae', 'optimizer': 'adam', 'graph_mode': 'cutoff', 'cutoff': 0.542757408942854, 'grm_norm': 'cosine', 'self_loops': True, 'use_snp_selection': False}. Best is trial 33 with value: 0.3719975991266678.
[I 2025-12-08 11:40:02,160] Trial 54 finished with value: 0.3274467522580258 and parameters: {'model_type': 'gcn', 'hidden_dims': '[512, 64]', 'dropout': 0.4578088978652977, 'batch_norm': False, 'lr': 0.0001220831037669005, 'weight_decay': 1.0118980167335947e-07, 'epochs': 271, 'loss': 'mae', 'optimizer': 'adam', 'graph_mode': 'cutoff', 'cutoff': 0.46562723796559846, 'grm_norm': 'cosine', 'self_loops': True, 'use_snp_selection': False}. Best is trial 33 with value: 0.3719975991266678.
[I 2025-12-08 11:40:31,334] Trial 55 finished with value: 0.3381329940874763 and parameters: {'model_type': 'gcn', 'hidden_dims': '[256, 128]', 'dropout': 0.533148912249819, 'batch_norm': False, 'lr': 1.0487647922170244e-05, 'weight_decay': 3.540620717586366e-07, 'epochs': 234, 'loss': 'mae', 'optimizer': 'adam', 'graph_mode': 'cutoff', 'cutoff': 0.5147243942256136, 'grm_norm': 'cosine', 'self_loops': True, 'use_snp_selection': False}. Best is trial 33 with value: 0.3719975991266678.
[I 2025-12-08 11:41:21,028] Trial 56 finished with value: 0.3295896315441419 and parameters: {'model_type': 'gcn', 'hidden_dims': '[512, 128]', 'dropout': 0.4711853274765709, 'batch_norm': False, 'lr': 6.115151584050745e-05, 'weight_decay': 1.8878087705379382e-07, 'epochs': 193, 'loss': 'mae', 'optimizer': 'adam', 'graph_mode': 'knn', 'knn_k': 4, 'weighted_edges': True, 'symmetrize_mode': 'mutual', 'self_loops': True, 'use_snp_selection': False}. Best is trial 33 with value: 0.3719975991266678.
[I 2025-12-08 11:42:22,470] Trial 57 finished with value: 0.3526136718991929 and parameters: {'model_type': 'gcn', 'hidden_dims': '[512, 64]', 'dropout': 0.5663446555978758, 'batch_norm': False, 'lr': 2.2624389527262122e-05, 'weight_decay': 1.389320267135982e-07, 'epochs': 245, 'loss': 'mae', 'optimizer': 'adam', 'graph_mode': 'cutoff', 'cutoff': 0.5867223418573254, 'grm_norm': 'none', 'self_loops': True, 'use_snp_selection': False}. Best is trial 33 with value: 0.3719975991266678.
[I 2025-12-08 11:43:07,913] Trial 58 finished with value: 0.2428028324290968 and parameters: {'model_type': 'gcn', 'hidden_dims': '[512, 64]', 'dropout': 0.4342128965929601, 'batch_norm': True, 'lr': 8.468654396684769e-05, 'weight_decay': 5.384302530182977e-07, 'epochs': 175, 'loss': 'mae', 'optimizer': 'adam', 'graph_mode': 'cutoff', 'cutoff': 0.4289121718138771, 'grm_norm': 'cosine', 'self_loops': True, 'use_snp_selection': False}. Best is trial 33 with value: 0.3719975991266678.
[I 2025-12-08 11:43:24,738] Trial 59 finished with value: 0.33455175790998554 and parameters: {'model_type': 'gcn', 'hidden_dims': '[128, 64]', 'dropout': 0.5022805298926366, 'batch_norm': False, 'lr': 1.5826549225545215e-05, 'weight_decay': 2.6752795003145795e-07, 'epochs': 223, 'loss': 'mae', 'optimizer': 'adam', 'graph_mode': 'cutoff', 'cutoff': 0.5609269132126913, 'grm_norm': 'cosine', 'self_loops': True, 'use_snp_selection': False}. Best is trial 33 with value: 0.3719975991266678.
[I 2025-12-08 11:43:46,500] Trial 60 finished with value: 0.30956102821830017 and parameters: {'model_type': 'gcn', 'hidden_dims': '[256, 128, 64]', 'dropout': 0.5327372953298183, 'batch_norm': False, 'lr': 3.38576257523245e-05, 'weight_decay': 1.7360173434746037e-06, 'epochs': 159, 'loss': 'mae', 'optimizer': 'adam', 'graph_mode': 'knn', 'knn_k': 10, 'weighted_edges': True, 'symmetrize_mode': 'mutual', 'self_loops': True, 'use_snp_selection': False}. Best is trial 33 with value: 0.3719975991266678.
[I 2025-12-08 11:44:31,051] Trial 61 finished with value: 0.36402638366407525 and parameters: {'model_type': 'gcn', 'hidden_dims': '[512, 64]', 'dropout': 0.4722116673318693, 'batch_norm': False, 'lr': 4.785917412566151e-05, 'weight_decay': 4.185561817995218e-07, 'epochs': 174, 'loss': 'mae', 'optimizer': 'adam', 'graph_mode': 'cutoff', 'cutoff': 0.6869013392921404, 'grm_norm': 'none', 'self_loops': True, 'use_snp_selection': False}. Best is trial 33 with value: 0.3719975991266678.
