[I 2025-12-08 14:38:00,123] Trial 109 finished with value: 0.23226232106731573 and parameters: {'model_type': 'gcn', 'hidden_dims': '[512, 128]', 'dropout': 0.17763551413892958, 'batch_norm': True, 'lr': 0.0003420844002268129, 'weight_decay': 1.2692741677561277e-06, 'epochs': 244, 'loss': 'mae', 'optimizer': 'adam', 'graph_mode': 'knn', 'knn_k': 9, 'weighted_edges': True, 'symmetrize_mode': 'mutual', 'self_loops': False, 'use_snp_selection': True, 'num_snps': 38947}. Best is trial 101 with value: 0.31016855248954933.
[I 2025-12-08 14:38:40,944] Trial 110 finished with value: 0.29209984511176157 and parameters: {'model_type': 'gcn', 'hidden_dims': '[512, 128]', 'dropout': 0.13373302100902196, 'batch_norm': True, 'lr': 0.0001137997985806397, 'weight_decay': 2.5483215651516507e-06, 'epochs': 235, 'loss': 'mae', 'optimizer': 'adam', 'graph_mode': 'cutoff', 'cutoff': 0.7548053835341507, 'grm_norm': 'cosine_then_gcn', 'self_loops': False, 'use_snp_selection': True, 'num_snps': 29681}. Best is trial 101 with value: 0.31016855248954933.
[I 2025-12-08 14:39:33,773] Trial 111 finished with value: 0.3124099692085903 and parameters: {'model_type': 'gcn', 'hidden_dims': '[512, 128]', 'dropout': 0.15606302250696785, 'batch_norm': True, 'lr': 0.00014280672602207873, 'weight_decay': 2.2219655961570194e-06, 'epochs': 287, 'loss': 'mae', 'optimizer': 'adam', 'graph_mode': 'cutoff', 'cutoff': 0.7955972197310112, 'grm_norm': 'cosine_then_gcn', 'self_loops': False, 'use_snp_selection': True, 'num_snps': 35315}. Best is trial 111 with value: 0.3124099692085903.
[I 2025-12-08 14:40:27,532] Trial 112 finished with value: 0.30236421829445986 and parameters: {'model_type': 'gcn', 'hidden_dims': '[512, 128]', 'dropout': 0.15233067390570929, 'batch_norm': True, 'lr': 0.0001280830904047014, 'weight_decay': 2.2114493859353336e-06, 'epochs': 298, 'loss': 'mae', 'optimizer': 'adam', 'graph_mode': 'cutoff', 'cutoff': 0.7947544949997856, 'grm_norm': 'cosine_then_gcn', 'self_loops': False, 'use_snp_selection': True, 'num_snps': 35115}. Best is trial 111 with value: 0.3124099692085903.
[I 2025-12-08 14:41:10,436] Trial 113 finished with value: 0.30532201736194126 and parameters: {'model_type': 'gcn', 'hidden_dims': '[512, 128]', 'dropout': 0.16623151400425618, 'batch_norm': True, 'lr': 0.00016970981878436595, 'weight_decay': 3.4422947494464706e-06, 'epochs': 288, 'loss': 'mae', 'optimizer': 'adam', 'graph_mode': 'cutoff', 'cutoff': 0.8123210976021271, 'grm_norm': 'cosine_then_gcn', 'self_loops': False, 'use_snp_selection': True, 'num_snps': 27157}. Best is trial 111 with value: 0.3124099692085903.
[I 2025-12-08 14:41:53,376] Trial 114 finished with value: 0.3015309620161081 and parameters: {'model_type': 'gcn', 'hidden_dims': '[512, 128]', 'dropout': 0.16154855475732616, 'batch_norm': True, 'lr': 0.0002222285040123864, 'weight_decay': 4.606728796706616e-06, 'epochs': 289, 'loss': 'mae', 'optimizer': 'adam', 'graph_mode': 'cutoff', 'cutoff': 0.765131142558071, 'grm_norm': 'cosine_then_gcn', 'self_loops': False, 'use_snp_selection': True, 'num_snps': 27025}. Best is trial 111 with value: 0.3124099692085903.
[I 2025-12-08 14:42:44,167] Trial 115 finished with value: 0.3085890977034474 and parameters: {'model_type': 'gcn', 'hidden_dims': '[512, 128]', 'dropout': 0.19174675729905488, 'batch_norm': True, 'lr': 0.00017000669777271003, 'weight_decay': 3.4480147571962553e-06, 'epochs': 308, 'loss': 'mae', 'optimizer': 'adam', 'graph_mode': 'cutoff', 'cutoff': 0.8080503201338957, 'grm_norm': 'cosine_then_gcn', 'self_loops': False, 'use_snp_selection': True, 'num_snps': 31554}. Best is trial 111 with value: 0.3124099692085903.
[I 2025-12-08 14:43:30,115] Trial 116 finished with value: 0.305773424721045 and parameters: {'model_type': 'gcn', 'hidden_dims': '[512, 128]', 'dropout': 0.16835387673947474, 'batch_norm': True, 'lr': 0.00010333527548623827, 'weight_decay': 8.316978327015333e-06, 'epochs': 336, 'loss': 'mae', 'optimizer': 'adam', 'graph_mode': 'cutoff', 'cutoff': 0.8059603178223451, 'grm_norm': 'cosine_then_gcn', 'self_loops': False, 'use_snp_selection': True, 'num_snps': 25830}. Best is trial 111 with value: 0.3124099692085903.
[I 2025-12-08 14:44:21,136] Trial 117 finished with value: 0.2838524196426554 and parameters: {'model_type': 'gcn', 'hidden_dims': '[512, 64]', 'dropout': 0.18520707687552032, 'batch_norm': True, 'lr': 0.00010287104989162731, 'weight_decay': 8.811872337505846e-06, 'epochs': 342, 'loss': 'mse', 'optimizer': 'adam', 'graph_mode': 'cutoff', 'cutoff': 0.8186969965983952, 'grm_norm': 'cosine_then_gcn', 'self_loops': False, 'use_snp_selection': True, 'num_snps': 29154}. Best is trial 111 with value: 0.3124099692085903.
[I 2025-12-08 14:45:10,911] Trial 118 finished with value: 0.20678431329044128 and parameters: {'model_type': 'gcn', 'hidden_dims': '[512, 128]', 'dropout': 0.2202905958059128, 'batch_norm': True, 'lr': 8.677948839963599e-05, 'weight_decay': 3.507681442531317e-06, 'epochs': 334, 'loss': 'mae', 'optimizer': 'adam', 'graph_mode': 'cutoff', 'cutoff': 0.2190423116735013, 'grm_norm': 'cosine_then_gcn', 'self_loops': False, 'use_snp_selection': True, 'num_snps': 25964}. Best is trial 111 with value: 0.3124099692085903.
[I 2025-12-08 14:46:06,635] Trial 119 finished with value: 0.3025039093379066 and parameters: {'model_type': 'gcn', 'hidden_dims': '[512, 128]', 'dropout': 0.17029391466879748, 'batch_norm': True, 'lr': 0.0001648216851830847, 'weight_decay': 5.777056466493352e-06, 'epochs': 349, 'loss': 'mae', 'optimizer': 'adam', 'graph_mode': 'cutoff', 'cutoff': 0.8597241158821733, 'grm_norm': 'cosine_then_gcn', 'self_loops': False, 'use_snp_selection': True, 'num_snps': 31528}. Best is trial 111 with value: 0.3124099692085903.
[I 2025-12-08 14:46:54,016] Trial 120 finished with value: 0.29585403633043084 and parameters: {'model_type': 'gcn', 'hidden_dims': '[512, 128]', 'dropout': 0.1632893022088663, 'batch_norm': True, 'lr': 0.00011504255344219949, 'weight_decay': 8.409202814740539e-06, 'epochs': 316, 'loss': 'mae', 'optimizer': 'adam', 'graph_mode': 'cutoff', 'cutoff': 0.8095964519203213, 'grm_norm': 'cosine_then_gcn', 'self_loops': False, 'use_snp_selection': True, 'num_snps': 27896}. Best is trial 111 with value: 0.3124099692085903.
[I 2025-12-08 14:47:34,371] Trial 121 finished with value: 0.3075831226431634 and parameters: {'model_type': 'gcn', 'hidden_dims': '[512, 128]', 'dropout': 0.11525703225442775, 'batch_norm': True, 'lr': 0.00014011930948046382, 'weight_decay': 1.2441766149436262e-05, 'epochs': 309, 'loss': 'mae', 'optimizer': 'adam', 'graph_mode': 'cutoff', 'cutoff': 0.796269007439469, 'grm_norm': 'cosine_then_gcn', 'self_loops': False, 'use_snp_selection': True, 'num_snps': 22842}. Best is trial 111 with value: 0.3124099692085903.
[I 2025-12-08 14:48:16,513] Trial 122 finished with value: 0.2941819506317151 and parameters: {'model_type': 'gcn', 'hidden_dims': '[512, 128]', 'dropout': 0.10020280942015582, 'batch_norm': True, 'lr': 0.00017012154928931644, 'weight_decay': 1.2786465519127613e-05, 'epochs': 310, 'loss': 'mae', 'optimizer': 'adam', 'graph_mode': 'cutoff', 'cutoff': 0.8013140898387747, 'grm_norm': 'cosine_then_gcn', 'self_loops': False, 'use_snp_selection': True, 'num_snps': 24223}. Best is trial 111 with value: 0.3124099692085903.
[I 2025-12-08 14:49:02,692] Trial 123 finished with value: 0.30384269324149565 and parameters: {'model_type': 'gcn', 'hidden_dims': '[512, 128]', 'dropout': 0.11792178556733161, 'batch_norm': True, 'lr': 0.00013516651051695346, 'weight_decay': 1.5106671074560822e-05, 'epochs': 334, 'loss': 'mae', 'optimizer': 'adam', 'graph_mode': 'cutoff', 'cutoff': 0.7496135491175266, 'grm_norm': 'cosine_then_gcn', 'self_loops': False, 'use_snp_selection': True, 'num_snps': 25614}. Best is trial 111 with value: 0.3124099692085903.
[I 2025-12-08 14:49:44,101] Trial 124 finished with value: 0.3032421115743797 and parameters: {'model_type': 'gcn', 'hidden_dims': '[512, 128]', 'dropout': 0.1509148154196347, 'batch_norm': True, 'lr': 9.380848211071828e-05, 'weight_decay': 3.8897526474582095e-06, 'epochs': 316, 'loss': 'mae', 'optimizer': 'adam', 'graph_mode': 'cutoff', 'cutoff': 0.8273129508638246, 'grm_norm': 'cosine_then_gcn', 'self_loops': False, 'use_snp_selection': True, 'num_snps': 22997}. Best is trial 111 with value: 0.3124099692085903.
[I 2025-12-08 14:50:21,876] Trial 125 finished with value: 0.21412239290658394 and parameters: {'model_type': 'gcn', 'hidden_dims': '[256, 128, 64]', 'dropout': 0.11213319373925625, 'batch_norm': True, 'lr': 0.0002255228876184461, 'weight_decay': 1.0887173197216898e-05, 'epochs': 320, 'loss': 'mae', 'optimizer': 'adam', 'graph_mode': 'cutoff', 'cutoff': 0.50925522924199, 'grm_norm': 'cosine_then_gcn', 'self_loops': False, 'use_snp_selection': True, 'num_snps': 32638}. Best is trial 111 with value: 0.3124099692085903.
[I 2025-12-08 14:50:57,296] Trial 126 finished with value: 0.3014068418551692 and parameters: {'model_type': 'gcn', 'hidden_dims': '[512, 128]', 'dropout': 0.12898312797011574, 'batch_norm': True, 'lr': 0.0001371513336213492, 'weight_decay': 2.5185450754665503e-05, 'epochs': 298, 'loss': 'mae', 'optimizer': 'adam', 'graph_mode': 'cutoff', 'cutoff': 0.7677198560332994, 'grm_norm': 'cosine_then_gcn', 'self_loops': False, 'use_snp_selection': True, 'num_snps': 19535}. Best is trial 111 with value: 0.3124099692085903.
[I 2025-12-08 14:51:55,488] Trial 127 finished with value: 0.2999388300217853 and parameters: {'model_type': 'gcn', 'hidden_dims': '[512, 128]', 'dropout': 0.17561943415724138, 'batch_norm': True, 'lr': 0.00011145212234799178, 'weight_decay': 5.152175140632911e-06, 'epochs': 306, 'loss': 'mae', 'optimizer': 'adam', 'graph_mode': 'cutoff', 'cutoff': 0.8055751497948642, 'grm_norm': 'cosine_then_gcn', 'self_loops': False, 'use_snp_selection': True, 'num_snps': 37752}. Best is trial 111 with value: 0.3124099692085903.
[I 2025-12-08 14:52:32,700] Trial 128 finished with value: 0.29953262171525935 and parameters: {'model_type': 'gcn', 'hidden_dims': '[256, 128]', 'dropout': 0.12289964082063329, 'batch_norm': True, 'lr': 0.0002944342913326194, 'weight_decay': 3.070721147520528e-06, 'epochs': 330, 'loss': 'mae', 'optimizer': 'adam', 'graph_mode': 'cutoff', 'cutoff': 0.7937404104975868, 'grm_norm': 'cosine_then_gcn', 'self_loops': False, 'use_snp_selection': True, 'num_snps': 33601}. Best is trial 111 with value: 0.3124099692085903.
[I 2025-12-08 14:53:20,792] Trial 129 finished with value: 0.30782453337328974 and parameters: {'model_type': 'gcn', 'hidden_dims': '[512, 128]', 'dropout': 0.2413795577503271, 'batch_norm': True, 'lr': 8.415625648724103e-05, 'weight_decay': 7.593140799489033e-06, 'epochs': 297, 'loss': 'mae', 'optimizer': 'adam', 'graph_mode': 'cutoff', 'cutoff': 0.8231276451094156, 'grm_norm': 'cosine', 'self_loops': False, 'use_snp_selection': True, 'num_snps': 29902}. Best is trial 111 with value: 0.3124099692085903.
[I 2025-12-08 14:54:40,548] Trial 130 finished with value: 0.3018376393819767 and parameters: {'model_type': 'gcn', 'hidden_dims': '[512, 128]', 'dropout': 0.2370790847807628, 'batch_norm': True, 'lr': 5.567544812318526e-05, 'weight_decay': 7.578007139428023e-06, 'epochs': 312, 'loss': 'mae', 'optimizer': 'adam', 'graph_mode': 'cutoff', 'cutoff': 0.8859107273897132, 'grm_norm': 'cosine', 'self_loops': False, 'use_snp_selection': False}. Best is trial 111 with value: 0.3124099692085903.
[I 2025-12-08 14:55:31,030] Trial 131 finished with value: 0.3058737713675906 and parameters: {'model_type': 'gcn', 'hidden_dims': '[512, 128]', 'dropout': 0.20456306827922008, 'batch_norm': True, 'lr': 8.228107944613024e-05, 'weight_decay': 6.343378600638961e-06, 'epochs': 302, 'loss': 'mae', 'optimizer': 'adam', 'graph_mode': 'cutoff', 'cutoff': 0.8190746588960361, 'grm_norm': 'cosine_then_gcn', 'self_loops': False, 'use_snp_selection': True, 'num_snps': 31259}. Best is trial 111 with value: 0.3124099692085903.
[I 2025-12-08 14:56:19,864] Trial 132 finished with value: 0.3089115180545239 and parameters: {'model_type': 'gcn', 'hidden_dims': '[512, 128]', 'dropout': 0.21947310280700208, 'batch_norm': True, 'lr': 7.897244267477095e-05, 'weight_decay': 3.1185829281105015e-05, 'epochs': 297, 'loss': 'mae', 'optimizer': 'adam', 'graph_mode': 'cutoff', 'cutoff': 0.8412111808678868, 'grm_norm': 'cosine', 'self_loops': False, 'use_snp_selection': True, 'num_snps': 30546}. Best is trial 111 with value: 0.3124099692085903.
[I 2025-12-08 14:57:07,802] Trial 133 finished with value: 0.30691938367529026 and parameters: {'model_type': 'gcn', 'hidden_dims': '[512, 128]', 'dropout': 0.24707373385062728, 'batch_norm': True, 'lr': 8.210315705590432e-05, 'weight_decay': 1.8737138728449386e-05, 'epochs': 296, 'loss': 'mae', 'optimizer': 'adam', 'graph_mode': 'cutoff', 'cutoff': 0.8433643549118016, 'grm_norm': 'cosine', 'self_loops': False, 'use_snp_selection': True, 'num_snps': 29779}. Best is trial 111 with value: 0.3124099692085903.
[I 2025-12-08 14:57:54,309] Trial 134 finished with value: 0.29131509138220046 and parameters: {'model_type': 'gcn', 'hidden_dims': '[512, 128]', 'dropout': 0.2493967131035485, 'batch_norm': True, 'lr': 6.991217993852719e-05, 'weight_decay': 1.940568069354103e-05, 'epochs': 295, 'loss': 'mae', 'optimizer': 'adam', 'graph_mode': 'cutoff', 'cutoff': 0.8528610271948439, 'grm_norm': 'cosine', 'self_loops': False, 'use_snp_selection': True, 'num_snps': 29375}. Best is trial 111 with value: 0.3124099692085903.
[I 2025-12-08 14:58:33,840] Trial 135 finished with value: 0.22295193799618634 and parameters: {'model_type': 'gcn', 'hidden_dims': '[512, 128]', 'dropout': 0.27640427064605216, 'batch_norm': True, 'lr': 8.974674504015875e-05, 'weight_decay': 2.8755107963991298e-05, 'epochs': 218, 'loss': 'mae', 'optimizer': 'adam', 'graph_mode': 'knn', 'knn_k': 2, 'weighted_edges': False, 'symmetrize_mode': 'mutual', 'self_loops': False, 'use_snp_selection': True, 'num_snps': 30224}. Best is trial 111 with value: 0.3124099692085903.
[I 2025-12-08 14:59:22,889] Trial 136 finished with value: 0.30947117117857237 and parameters: {'model_type': 'gcn', 'hidden_dims': '[512, 256]', 'dropout': 0.2176847008660438, 'batch_norm': True, 'lr': 5.732005037796096e-05, 'weight_decay': 2.132326486754369e-05, 'epochs': 278, 'loss': 'mae', 'optimizer': 'adam', 'graph_mode': 'cutoff', 'cutoff': 0.8443620749773447, 'grm_norm': 'cosine', 'self_loops': False, 'use_snp_selection': True, 'num_snps': 32718}. Best is trial 111 with value: 0.3124099692085903.
[I 2025-12-08 14:59:48,073] Trial 137 finished with value: 0.2967683473712511 and parameters: {'model_type': 'gcn', 'hidden_dims': '[128, 64]', 'dropout': 0.21021269552969152, 'batch_norm': False, 'lr': 4.342382381765228e-05, 'weight_decay': 2.165119929942091e-05, 'epochs': 279, 'loss': 'mae', 'optimizer': 'adam', 'graph_mode': 'cutoff', 'cutoff': 0.8383236354827031, 'grm_norm': 'cosine', 'self_loops': False, 'use_snp_selection': True, 'num_snps': 33108}. Best is trial 111 with value: 0.3124099692085903.
[I 2025-12-08 15:00:01,900] Trial 138 finished with value: 0.2493587034918554 and parameters: {'model_type': 'gcn', 'hidden_dims': '[512, 256]', 'dropout': 0.22034856430705854, 'batch_norm': True, 'lr': 5.5405343325086516e-05, 'weight_decay': 3.569975005384704e-05, 'epochs': 274, 'loss': 'mse', 'optimizer': 'adam', 'graph_mode': 'cutoff', 'cutoff': 0.876852951329643, 'grm_norm': 'cosine', 'self_loops': False, 'use_snp_selection': True, 'num_snps': 2349}. Best is trial 111 with value: 0.3124099692085903.
[I 2025-12-08 15:00:52,539] Trial 139 finished with value: 0.2815322014913953 and parameters: {'model_type': 'gcn', 'hidden_dims': '[512, 64]', 'dropout': 0.24312422749943285, 'batch_norm': True, 'lr': 6.217036965131768e-05, 'weight_decay': 1.3549748975629021e-05, 'epochs': 267, 'loss': 'mae', 'optimizer': 'adam', 'graph_mode': 'cutoff', 'cutoff': 0.8624861220727298, 'grm_norm': 'cosine', 'self_loops': False, 'use_snp_selection': True, 'num_snps': 35455}. Best is trial 111 with value: 0.3124099692085903.
[I 2025-12-08 15:01:37,148] Trial 140 finished with value: 0.31587478269715125 and parameters: {'model_type': 'gcn', 'hidden_dims': '[512, 256]', 'dropout': 0.18937091172342121, 'batch_norm': True, 'lr': 0.00011927638192565845, 'weight_decay': 2.1541744909350982e-05, 'epochs': 249, 'loss': 'mae', 'optimizer': 'adam', 'graph_mode': 'cutoff', 'cutoff': 0.8319455243644908, 'grm_norm': 'cosine', 'self_loops': False, 'use_snp_selection': True, 'num_snps': 31759}. Best is trial 140 with value: 0.31587478269715125.
[I 2025-12-08 15:02:22,526] Trial 141 finished with value: 0.3009608575493483 and parameters: {'model_type': 'gcn', 'hidden_dims': '[512, 256]', 'dropout': 0.19156157972761337, 'batch_norm': True, 'lr': 7.791691819878334e-05, 'weight_decay': 1.8376525938038509e-06, 'epochs': 250, 'loss': 'mae', 'optimizer': 'adam', 'graph_mode': 'cutoff', 'cutoff': 0.8498997154310619, 'grm_norm': 'cosine', 'self_loops': False, 'use_snp_selection': True, 'num_snps': 32106}. Best is trial 140 with value: 0.31587478269715125.
[I 2025-12-08 15:03:04,964] Trial 142 finished with value: 0.30026096408856107 and parameters: {'model_type': 'gcn', 'hidden_dims': '[512, 256]', 'dropout': 0.206372660439796, 'batch_norm': True, 'lr': 9.380674389941923e-05, 'weight_decay': 1.723326130303148e-05, 'epochs': 261, 'loss': 'mae', 'optimizer': 'adam', 'graph_mode': 'cutoff', 'cutoff': 0.8314888090724576, 'grm_norm': 'cosine', 'self_loops': False, 'use_snp_selection': True, 'num_snps': 28213}. Best is trial 140 with value: 0.31587478269715125.
[I 2025-12-08 15:03:53,586] Trial 143 finished with value: 0.30898469933846395 and parameters: {'model_type': 'gcn', 'hidden_dims': '[512, 256]', 'dropout': 0.22146671105702614, 'batch_norm': True, 'lr': 0.00012081056583674838, 'weight_decay': 2.9689620550650646e-05, 'epochs': 294, 'loss': 'mae', 'optimizer': 'adam', 'graph_mode': 'cutoff', 'cutoff': 0.8400585067058763, 'grm_norm': 'cosine', 'self_loops': False, 'use_snp_selection': True, 'num_snps': 30766}. Best is trial 140 with value: 0.31587478269715125.
[I 2025-12-08 15:04:38,424] Trial 144 finished with value: 0.3034919860446637 and parameters: {'model_type': 'gcn', 'hidden_dims': '[512, 256]', 'dropout': 0.2303121881432405, 'batch_norm': True, 'lr': 0.00012192400959794976, 'weight_decay': 3.210269372835039e-05, 'epochs': 253, 'loss': 'mae', 'optimizer': 'adam', 'graph_mode': 'cutoff', 'cutoff': 0.8263028734884171, 'grm_norm': 'cosine', 'self_loops': False, 'use_snp_selection': True, 'num_snps': 31331}. Best is trial 140 with value: 0.31587478269715125.
[I 2025-12-08 15:05:31,434] Trial 145 finished with value: 0.3003904162658818 and parameters: {'model_type': 'gcn', 'hidden_dims': '[512, 256]', 'dropout': 0.21752614284011765, 'batch_norm': True, 'lr': 0.00013980448759241422, 'weight_decay': 4.579257498416624e-05, 'epochs': 282, 'loss': 'mae', 'optimizer': 'adam', 'graph_mode': 'cutoff', 'cutoff': 0.8802390925468497, 'grm_norm': 'cosine', 'self_loops': False, 'use_snp_selection': True, 'num_snps': 34751}. Best is trial 140 with value: 0.31587478269715125.
[I 2025-12-08 15:06:25,539] Trial 146 finished with value: 0.3025543981008 and parameters: {'model_type': 'gcn', 'hidden_dims': '[512, 256]', 'dropout': 0.5732619050628985, 'batch_norm': True, 'lr': 0.00010967433017791448, 'weight_decay': 2.5981278104984338e-05, 'epochs': 307, 'loss': 'mae', 'optimizer': 'adam', 'graph_mode': 'cutoff', 'cutoff': 0.8614281454909651, 'grm_norm': 'cosine', 'self_loops': False, 'use_snp_selection': True, 'num_snps': 32981}. Best is trial 140 with value: 0.31587478269715125.
[I 2025-12-08 15:07:07,598] Trial 147 finished with value: 0.3114964740910738 and parameters: {'model_type': 'gcn', 'hidden_dims': '[512, 256]', 'dropout': 0.19093797057021905, 'batch_norm': True, 'lr': 0.00012433176057704312, 'weight_decay': 2.259439632685367e-05, 'epochs': 239, 'loss': 'mae', 'optimizer': 'adam', 'graph_mode': 'cutoff', 'cutoff': 0.7766072864857817, 'grm_norm': 'cosine', 'self_loops': False, 'use_snp_selection': True, 'num_snps': 30447}. Best is trial 140 with value: 0.31587478269715125.
[I 2025-12-08 15:07:49,680] Trial 148 finished with value: 0.2997126083428272 and parameters: {'model_type': 'gcn', 'hidden_dims': '[512, 256]', 'dropout': 0.18736141231499331, 'batch_norm': True, 'lr': 0.002628203396174098, 'weight_decay': 2.3208040081326874e-05, 'epochs': 237, 'loss': 'mae', 'optimizer': 'adam', 'graph_mode': 'cutoff', 'cutoff': 0.774555330376398, 'grm_norm': 'cosine', 'self_loops': False, 'use_snp_selection': True, 'num_snps': 30404}. Best is trial 140 with value: 0.31587478269715125.
[I 2025-12-08 15:08:32,941] Trial 149 finished with value: 0.30382595102440463 and parameters: {'model_type': 'gcn', 'hidden_dims': '[512, 256]', 'dropout': 0.20074932339178722, 'batch_norm': True, 'lr': 0.00012844716283220105, 'weight_decay': 4.217825885807514e-05, 'epochs': 222, 'loss': 'mae', 'optimizer': 'adam', 'graph_mode': 'cutoff', 'cutoff': 0.8164058955683904, 'grm_norm': 'cosine', 'self_loops': False, 'use_snp_selection': True, 'num_snps': 33718}. Best is trial 140 with value: 0.31587478269715125.
[I 2025-12-08 15:09:08,418] Trial 0 finished with value: 0.23925318886593616 and parameters: {'model_type': 'gcn', 'hidden_dims': '[128, 64]', 'dropout': 0.199031432379812, 'batch_norm': True, 'lr': 1.8408544111075823e-05, 'weight_decay': 5.5136510071208614e-05, 'epochs': 336, 'loss': 'mae', 'optimizer': 'adam', 'graph_mode': 'knn', 'knn_k': 8, 'weighted_edges': True, 'symmetrize_mode': 'mutual', 'self_loops': True, 'use_snp_selection': True, 'num_snps': 27173}. Best is trial 0 with value: 0.23925318886593616.
