[I 2025-10-16 19:13:56,584] Trial 30 finished with value: 0.3258599519729614 and parameters: {'hidden_dims': '[512, 64]', 'dropout': 0.4333793027620763, 'batch_norm': False, 'graph_on': True, 'source': 'grm', 'knn_k': 1, 'weighted_edges': True, 'symmetrize_mode': 'mutual', 'lr': 0.0005089089593143393, 'weight_decay': 1.0769249506249124e-07, 'epochs': 191, 'use_snp_selection': True, 'num_snps': 14000}. Best is trial 21 with value: 0.3370202720165253.
[I 2025-10-16 19:14:25,593] Trial 31 finished with value: 0.3354912340641022 and parameters: {'hidden_dims': '[512, 64]', 'dropout': 0.40055931630824243, 'batch_norm': False, 'graph_on': True, 'source': 'grm', 'knn_k': 6, 'weighted_edges': True, 'symmetrize_mode': 'mutual', 'lr': 5.42716527879396e-05, 'weight_decay': 7.005553575226293e-05, 'epochs': 82, 'use_snp_selection': True, 'num_snps': 28000}. Best is trial 21 with value: 0.3370202720165253.
[I 2025-10-16 19:14:53,114] Trial 32 finished with value: 0.17994312047958375 and parameters: {'hidden_dims': '[512, 64]', 'dropout': 0.3212053383933601, 'batch_norm': False, 'graph_on': True, 'source': 'grm', 'knn_k': 6, 'weighted_edges': True, 'symmetrize_mode': 'mutual', 'lr': 0.00024081886296418347, 'weight_decay': 6.845833162799926e-05, 'epochs': 38, 'use_snp_selection': True, 'num_snps': 42000}. Best is trial 21 with value: 0.3370202720165253.
[I 2025-10-16 19:15:12,884] Trial 33 finished with value: 0.3147316038608551 and parameters: {'hidden_dims': '[512, 64]', 'dropout': 0.47521715211169147, 'batch_norm': False, 'graph_on': True, 'source': 'grm', 'knn_k': 7, 'weighted_edges': True, 'symmetrize_mode': 'mutual', 'lr': 1.3192911605135788e-05, 'weight_decay': 2.2373712255604543e-05, 'epochs': 84, 'use_snp_selection': True, 'num_snps': 6000}. Best is trial 21 with value: 0.3370202720165253.
[I 2025-10-16 19:15:35,807] Trial 34 finished with value: 0.32459197044372556 and parameters: {'hidden_dims': '[512, 64]', 'dropout': 0.4021104001631976, 'batch_norm': False, 'graph_on': True, 'source': 'grm', 'knn_k': 4, 'weighted_edges': True, 'symmetrize_mode': 'mutual', 'lr': 2.3004712472628565e-05, 'weight_decay': 0.00014771541326460478, 'epochs': 44, 'use_snp_selection': True, 'num_snps': 22000}. Best is trial 21 with value: 0.3370202720165253.
[I 2025-10-16 19:15:59,321] Trial 35 finished with value: 0.3350485324859619 and parameters: {'hidden_dims': '[128, 64]', 'dropout': 0.32701141525642374, 'batch_norm': False, 'graph_on': True, 'source': 'grm', 'knn_k': 6, 'weighted_edges': True, 'symmetrize_mode': 'mutual', 'lr': 5.553657873953091e-05, 'weight_decay': 9.090918472727493e-07, 'epochs': 116, 'use_snp_selection': True, 'num_snps': 28000}. Best is trial 21 with value: 0.3370202720165253.
[I 2025-10-16 19:16:22,763] Trial 36 finished with value: 0.3338340759277344 and parameters: {'hidden_dims': '[128, 64]', 'dropout': 0.2646199049115812, 'batch_norm': False, 'graph_on': True, 'source': 'grm', 'knn_k': 5, 'weighted_edges': True, 'symmetrize_mode': 'mutual', 'lr': 5.974288941992026e-05, 'weight_decay': 7.450727023739341e-07, 'epochs': 116, 'use_snp_selection': True, 'num_snps': 28000}. Best is trial 21 with value: 0.3370202720165253.
[I 2025-10-16 19:16:46,302] Trial 37 finished with value: 0.33680649399757384 and parameters: {'hidden_dims': '[128, 64]', 'dropout': 0.17452840402030884, 'batch_norm': False, 'graph_on': True, 'source': 'grm', 'knn_k': 5, 'weighted_edges': True, 'symmetrize_mode': 'mutual', 'lr': 5.658496435882294e-05, 'weight_decay': 7.361487327451286e-07, 'epochs': 118, 'use_snp_selection': True, 'num_snps': 28000}. Best is trial 21 with value: 0.3370202720165253.
[I 2025-10-16 19:17:09,680] Trial 38 finished with value: 0.33098568916320803 and parameters: {'hidden_dims': '[128, 64]', 'dropout': 0.16787755833751816, 'batch_norm': False, 'graph_on': True, 'source': 'grm', 'knn_k': 6, 'weighted_edges': True, 'symmetrize_mode': 'mutual', 'lr': 0.00016075971542618141, 'weight_decay': 8.054968824877167e-07, 'epochs': 96, 'use_snp_selection': True, 'num_snps': 32000}. Best is trial 21 with value: 0.3370202720165253.
[I 2025-10-16 19:17:29,360] Trial 39 finished with value: 0.2864912271499634 and parameters: {'hidden_dims': '[128, 64]', 'dropout': 0.19109649418270003, 'batch_norm': False, 'graph_on': True, 'source': 'grm', 'knn_k': 5, 'weighted_edges': True, 'symmetrize_mode': 'mutual', 'lr': 0.0004596737316704279, 'weight_decay': 1.8253087851649026e-06, 'epochs': 59, 'use_snp_selection': True, 'num_snps': 18000}. Best is trial 21 with value: 0.3370202720165253.
[I 2025-10-16 19:17:49,454] Trial 40 finished with value: 0.1969458907842636 and parameters: {'hidden_dims': '[128, 64]', 'dropout': 0.10112842990908917, 'batch_norm': False, 'graph_on': True, 'source': 'grm', 'knn_k': 4, 'weighted_edges': True, 'symmetrize_mode': 'mutual', 'lr': 0.0008740218069183801, 'weight_decay': 4.4465200903838423e-07, 'epochs': 30, 'use_snp_selection': True, 'num_snps': 28000}. Best is trial 21 with value: 0.3370202720165253.
[I 2025-10-16 19:18:12,996] Trial 41 finished with value: 0.33517044186592104 and parameters: {'hidden_dims': '[128, 64]', 'dropout': 0.2669973779116983, 'batch_norm': False, 'graph_on': True, 'source': 'grm', 'knn_k': 5, 'weighted_edges': True, 'symmetrize_mode': 'mutual', 'lr': 5.745220370661563e-05, 'weight_decay': 2.94589652825224e-07, 'epochs': 118, 'use_snp_selection': True, 'num_snps': 28000}. Best is trial 21 with value: 0.3370202720165253.
[I 2025-10-16 19:18:35,800] Trial 42 finished with value: 0.3353907585144043 and parameters: {'hidden_dims': '[128, 64]', 'dropout': 0.20756943029049738, 'batch_norm': False, 'graph_on': True, 'source': 'grm', 'knn_k': 5, 'weighted_edges': True, 'symmetrize_mode': 'mutual', 'lr': 6.506444849878339e-05, 'weight_decay': 2.3268457603828734e-07, 'epochs': 123, 'use_snp_selection': True, 'num_snps': 24000}. Best is trial 21 with value: 0.3370202720165253.
[I 2025-10-16 19:19:05,086] Trial 43 finished with value: 0.33615441918373107 and parameters: {'hidden_dims': '[512, 256]', 'dropout': 0.1616915320264069, 'batch_norm': False, 'graph_on': True, 'source': 'grm', 'knn_k': 5, 'weighted_edges': True, 'symmetrize_mode': 'mutual', 'lr': 9.406766785746027e-05, 'weight_decay': 1.493359963965536e-07, 'epochs': 102, 'use_snp_selection': True, 'num_snps': 24000}. Best is trial 21 with value: 0.3370202720165253.
[I 2025-10-16 19:19:36,611] Trial 44 finished with value: 0.32556447982788084 and parameters: {'hidden_dims': '[512, 256]', 'dropout': 0.15067136303280584, 'batch_norm': False, 'graph_on': True, 'source': 'grm', 'knn_k': 5, 'weighted_edges': True, 'symmetrize_mode': 'mutual', 'lr': 9.485399333411342e-05, 'weight_decay': 1.1167461553103675e-07, 'epochs': 136, 'use_snp_selection': True, 'num_snps': 22000}. Best is trial 21 with value: 0.3370202720165253.
[I 2025-10-16 19:20:25,583] Trial 45 finished with value: 0.30148943066596984 and parameters: {'hidden_dims': '[512, 256]', 'dropout': 0.21877823463548735, 'batch_norm': False, 'graph_on': True, 'source': 'grm', 'knn_k': 4, 'weighted_edges': True, 'symmetrize_mode': 'mutual', 'lr': 3.842956333769883e-05, 'weight_decay': 1.500997118243203e-07, 'epochs': 298, 'use_snp_selection': True, 'num_snps': 24000}. Best is trial 21 with value: 0.3370202720165253.
[I 2025-10-16 19:21:00,192] Trial 46 finished with value: 0.34003596305847167 and parameters: {'hidden_dims': '[512, 256]', 'dropout': 0.14391090923436914, 'batch_norm': False, 'graph_on': True, 'source': 'grm', 'knn_k': 6, 'weighted_edges': True, 'symmetrize_mode': 'mutual', 'lr': 7.40777251103819e-05, 'weight_decay': 2.3639082568823967e-07, 'epochs': 103, 'use_snp_selection': True, 'num_snps': 34000}. Best is trial 46 with value: 0.34003596305847167.
[I 2025-10-16 19:21:34,105] Trial 47 finished with value: 0.3335524141788483 and parameters: {'hidden_dims': '[512, 256]', 'dropout': 0.1411205101183415, 'batch_norm': False, 'graph_on': True, 'source': 'grm', 'knn_k': 7, 'weighted_edges': True, 'symmetrize_mode': 'mutual', 'lr': 0.00011155392663518606, 'weight_decay': 2.2640745937389483e-06, 'epochs': 99, 'use_snp_selection': True, 'num_snps': 34000}. Best is trial 46 with value: 0.34003596305847167.
[I 2025-10-16 19:22:04,157] Trial 48 finished with value: 0.2811957597732544 and parameters: {'hidden_dims': '[512, 256]', 'dropout': 0.1284359044687303, 'batch_norm': False, 'graph_on': True, 'source': 'grm', 'knn_k': 6, 'weighted_edges': True, 'symmetrize_mode': 'mutual', 'lr': 0.00015490180341833808, 'weight_decay': 4.481667694625181e-07, 'epochs': 66, 'use_snp_selection': True, 'num_snps': 36000}. Best is trial 46 with value: 0.34003596305847167.
[I 2025-10-16 19:22:35,494] Trial 49 finished with value: 0.3297309935092926 and parameters: {'hidden_dims': '[512, 256]', 'dropout': 0.17651391049039694, 'batch_norm': False, 'graph_on': True, 'source': 'grm', 'knn_k': 6, 'weighted_edges': True, 'symmetrize_mode': 'mutual', 'lr': 0.00020238891510064027, 'weight_decay': 1.897837355091403e-07, 'epochs': 163, 'use_snp_selection': True, 'num_snps': 18000}. Best is trial 46 with value: 0.34003596305847167.
[I 2025-10-16 19:23:08,589] Trial 50 finished with value: 0.3343235433101654 and parameters: {'hidden_dims': '[512, 256]', 'dropout': 0.10801029999127312, 'batch_norm': False, 'graph_on': True, 'source': 'grm', 'knn_k': 7, 'weighted_edges': True, 'symmetrize_mode': 'mutual', 'lr': 8.369131053347183e-05, 'weight_decay': 3.7257120994981716e-07, 'epochs': 93, 'use_snp_selection': True, 'num_snps': 34000}. Best is trial 46 with value: 0.34003596305847167.
[I 2025-10-16 19:23:40,465] Trial 51 finished with value: 0.33360694646835326 and parameters: {'hidden_dims': '[512, 256]', 'dropout': 0.2056867192860952, 'batch_norm': False, 'graph_on': True, 'source': 'grm', 'knn_k': 5, 'weighted_edges': True, 'symmetrize_mode': 'mutual', 'lr': 6.894016887055574e-05, 'weight_decay': 2.112532858131444e-07, 'epochs': 128, 'use_snp_selection': True, 'num_snps': 24000}. Best is trial 46 with value: 0.34003596305847167.
[I 2025-10-16 19:24:06,868] Trial 52 finished with value: 0.3372818946838379 and parameters: {'hidden_dims': '[256, 128]', 'dropout': 0.16871831190172568, 'batch_norm': False, 'graph_on': True, 'source': 'grm', 'knn_k': 5, 'weighted_edges': True, 'symmetrize_mode': 'mutual', 'lr': 4.437638554093172e-05, 'weight_decay': 2.925772205755182e-07, 'epochs': 105, 'use_snp_selection': True, 'num_snps': 30000}. Best is trial 46 with value: 0.34003596305847167.
[I 2025-10-16 19:24:33,422] Trial 53 finished with value: 0.3412400782108307 and parameters: {'hidden_dims': '[256, 128]', 'dropout': 0.1519151394705251, 'batch_norm': False, 'graph_on': True, 'source': 'grm', 'knn_k': 6, 'weighted_edges': True, 'symmetrize_mode': 'mutual', 'lr': 3.1146201800447795e-05, 'weight_decay': 5.067588348743759e-07, 'epochs': 107, 'use_snp_selection': True, 'num_snps': 30000}. Best is trial 53 with value: 0.3412400782108307.
[I 2025-10-16 19:25:00,641] Trial 54 finished with value: 0.33419119715690615 and parameters: {'hidden_dims': '[256, 128]', 'dropout': 0.15811458040532636, 'batch_norm': False, 'graph_on': True, 'source': 'grm', 'knn_k': 4, 'weighted_edges': True, 'symmetrize_mode': 'mutual', 'lr': 4.369125758229825e-05, 'weight_decay': 1.1996310973126277e-06, 'epochs': 107, 'use_snp_selection': True, 'num_snps': 32000}. Best is trial 53 with value: 0.3412400782108307.
[I 2025-10-16 19:25:26,632] Trial 55 finished with value: 0.3375747799873352 and parameters: {'hidden_dims': '[256, 128]', 'dropout': 0.18220876893452678, 'batch_norm': False, 'graph_on': True, 'source': 'grm', 'knn_k': 6, 'weighted_edges': True, 'symmetrize_mode': 'mutual', 'lr': 2.984047844463359e-05, 'weight_decay': 6.049281949401241e-07, 'epochs': 70, 'use_snp_selection': True, 'num_snps': 38000}. Best is trial 53 with value: 0.3412400782108307.
[I 2025-10-16 19:25:58,346] Trial 56 finished with value: 0.3388786554336548 and parameters: {'hidden_dims': '[256, 128]', 'dropout': 0.18649566695323486, 'batch_norm': False, 'graph_on': True, 'source': 'grm', 'knn_k': 6, 'weighted_edges': True, 'symmetrize_mode': 'mutual', 'lr': 2.7051703819968058e-05, 'weight_decay': 6.0835037951574e-07, 'epochs': 146, 'use_snp_selection': True, 'num_snps': 36000}. Best is trial 53 with value: 0.3412400782108307.
[I 2025-10-16 19:26:30,330] Trial 57 finished with value: 0.3375118672847748 and parameters: {'hidden_dims': '[256, 128]', 'dropout': 0.23492498655499378, 'batch_norm': False, 'graph_on': True, 'source': 'grm', 'knn_k': 7, 'weighted_edges': True, 'symmetrize_mode': 'mutual', 'lr': 2.7324605639190374e-05, 'weight_decay': 1.284337372991288e-06, 'epochs': 143, 'use_snp_selection': True, 'num_snps': 38000}. Best is trial 53 with value: 0.3412400782108307.
[I 2025-10-16 19:27:02,632] Trial 58 finished with value: 0.3373789608478546 and parameters: {'hidden_dims': '[256, 128]', 'dropout': 0.22842278506675037, 'batch_norm': False, 'graph_on': True, 'source': 'grm', 'knn_k': 7, 'weighted_edges': True, 'symmetrize_mode': 'mutual', 'lr': 1.8492886723413776e-05, 'weight_decay': 1.3738420583372904e-06, 'epochs': 146, 'use_snp_selection': True, 'num_snps': 38000}. Best is trial 53 with value: 0.3412400782108307.
[I 2025-10-16 19:27:38,731] Trial 59 finished with value: 0.33801063895225525 and parameters: {'hidden_dims': '[256, 128]', 'dropout': 0.2278969066270987, 'batch_norm': False, 'graph_on': True, 'source': 'grm', 'knn_k': 7, 'weighted_edges': True, 'symmetrize_mode': 'mutual', 'lr': 1.0368693987795365e-05, 'weight_decay': 1.4614763842418948e-06, 'epochs': 178, 'use_snp_selection': True, 'num_snps': 40000}. Best is trial 53 with value: 0.3412400782108307.
[I 2025-10-16 19:28:17,225] Trial 60 finished with value: 0.33835259079933167 and parameters: {'hidden_dims': '[256, 128]', 'dropout': 0.1884093808788173, 'batch_norm': False, 'graph_on': True, 'source': 'grm', 'knn_k': 7, 'weighted_edges': True, 'symmetrize_mode': 'mutual', 'lr': 9.777401884666558e-06, 'weight_decay': 2.953673653860187e-06, 'epochs': 184, 'use_snp_selection': True, 'num_snps': 44000}. Best is trial 53 with value: 0.3412400782108307.
[I 2025-10-16 19:28:55,892] Trial 61 finished with value: 0.3386875808238983 and parameters: {'hidden_dims': '[256, 128]', 'dropout': 0.18825074225187793, 'batch_norm': False, 'graph_on': True, 'source': 'grm', 'knn_k': 7, 'weighted_edges': True, 'symmetrize_mode': 'mutual', 'lr': 9.603620392272168e-06, 'weight_decay': 3.865140340714897e-06, 'epochs': 186, 'use_snp_selection': True, 'num_snps': 44000}. Best is trial 53 with value: 0.3412400782108307.
[I 2025-10-16 19:29:36,235] Trial 62 finished with value: 0.33750622868537905 and parameters: {'hidden_dims': '[256, 128]', 'dropout': 0.13302131910929038, 'batch_norm': False, 'graph_on': True, 'source': 'grm', 'knn_k': 7, 'weighted_edges': True, 'symmetrize_mode': 'mutual', 'lr': 1.0153629844772753e-05, 'weight_decay': 3.3489761629502636e-06, 'epochs': 191, 'use_snp_selection': True, 'num_snps': 46000}. Best is trial 53 with value: 0.3412400782108307.
[I 2025-10-16 19:30:14,303] Trial 63 finished with value: 0.3362348675727844 and parameters: {'hidden_dims': '[256, 128]', 'dropout': 0.194043250419221, 'batch_norm': False, 'graph_on': True, 'source': 'grm', 'knn_k': 7, 'weighted_edges': True, 'symmetrize_mode': 'mutual', 'lr': 1.0516309828823046e-05, 'weight_decay': 3.8141661020536505e-06, 'epochs': 184, 'use_snp_selection': True, 'num_snps': 42000}. Best is trial 53 with value: 0.3412400782108307.
[I 2025-10-16 19:30:59,150] Trial 64 finished with value: 0.3361772358417511 and parameters: {'hidden_dims': '[256, 128]', 'dropout': 0.18391560528932754, 'batch_norm': False, 'graph_on': True, 'source': 'grm', 'knn_k': 7, 'weighted_edges': True, 'symmetrize_mode': 'mutual', 'lr': 4.736869640219893e-06, 'weight_decay': 5.148015546565596e-07, 'epochs': 230, 'use_snp_selection': True, 'num_snps': 48000}. Best is trial 53 with value: 0.3412400782108307.
[I 2025-10-16 19:31:41,253] Trial 65 finished with value: 0.2562409371137619 and parameters: {'hidden_dims': '[256, 128]', 'dropout': 0.14802511816558828, 'batch_norm': True, 'graph_on': True, 'source': 'grm', 'knn_k': 6, 'weighted_edges': False, 'symmetrize_mode': 'mutual', 'lr': 8.083841760321826e-06, 'weight_decay': 7.03545316730428e-06, 'epochs': 174, 'use_snp_selection': True, 'num_snps': 54000}. Best is trial 53 with value: 0.3412400782108307.
[I 2025-10-16 19:32:21,397] Trial 66 finished with value: 0.33429294228553774 and parameters: {'hidden_dims': '[256, 128]', 'dropout': 0.11820029435710229, 'batch_norm': False, 'graph_on': True, 'source': 'grm', 'knn_k': 7, 'weighted_edges': True, 'symmetrize_mode': 'union', 'lr': 1.6568839548380734e-05, 'weight_decay': 2.852779652661713e-06, 'epochs': 206, 'use_snp_selection': True, 'num_snps': 42000}. Best is trial 53 with value: 0.3412400782108307.
[I 2025-10-16 19:32:55,604] Trial 67 finished with value: 0.33507528305053713 and parameters: {'hidden_dims': '[256, 128]', 'dropout': 0.2211592010181586, 'batch_norm': False, 'graph_on': True, 'source': 'grm', 'knn_k': 6, 'weighted_edges': True, 'symmetrize_mode': 'mutual', 'lr': 2.0571576170157432e-06, 'weight_decay': 5.404429518040419e-06, 'epochs': 156, 'use_snp_selection': True, 'num_snps': 40000}. Best is trial 53 with value: 0.3412400782108307.
[I 2025-10-16 19:33:37,781] Trial 68 finished with value: 0.3353658616542816 and parameters: {'hidden_dims': '[256, 128]', 'dropout': 0.2570964600662787, 'batch_norm': False, 'graph_on': True, 'source': 'grm', 'knn_k': 7, 'weighted_edges': True, 'symmetrize_mode': 'mutual', 'lr': 1.3082311438094716e-05, 'weight_decay': 5.577758762013172e-07, 'epochs': 223, 'use_snp_selection': True, 'num_snps': 44000}. Best is trial 53 with value: 0.3412400782108307.
[I 2025-10-16 19:34:13,860] Trial 69 finished with value: 0.31986268162727355 and parameters: {'hidden_dims': '[256, 128]', 'dropout': 0.29383300175032123, 'batch_norm': False, 'graph_on': True, 'source': 'grm', 'knn_k': 6, 'weighted_edges': False, 'symmetrize_mode': 'mutual', 'lr': 2.22369933420852e-05, 'weight_decay': 2.024790426514089e-06, 'epochs': 199, 'use_snp_selection': True, 'num_snps': 36000}. Best is trial 53 with value: 0.3412400782108307.
[I 2025-10-16 19:34:50,104] Trial 70 finished with value: 0.298823618888855 and parameters: {'hidden_dims': '[256, 128, 64]', 'dropout': 0.20727971880694998, 'batch_norm': True, 'graph_on': True, 'source': 'grm', 'knn_k': 7, 'weighted_edges': True, 'symmetrize_mode': 'union', 'lr': 1.1993876580779692e-05, 'weight_decay': 1.5799784552059398e-06, 'epochs': 166, 'use_snp_selection': True, 'num_snps': 40000}. Best is trial 53 with value: 0.3412400782108307.
[I 2025-10-16 19:35:22,057] Trial 71 finished with value: 0.3380991816520691 and parameters: {'hidden_dims': '[256, 128]', 'dropout': 0.2422777257391914, 'batch_norm': False, 'graph_on': True, 'source': 'grm', 'knn_k': 7, 'weighted_edges': True, 'symmetrize_mode': 'mutual', 'lr': 2.6492132679379717e-05, 'weight_decay': 9.590500287208526e-07, 'epochs': 142, 'use_snp_selection': True, 'num_snps': 38000}. Best is trial 53 with value: 0.3412400782108307.
[I 2025-10-16 19:36:00,355] Trial 72 finished with value: 0.3368726849555969 and parameters: {'hidden_dims': '[256, 128]', 'dropout': 0.18863692843364036, 'batch_norm': False, 'graph_on': True, 'source': 'grm', 'knn_k': 7, 'weighted_edges': True, 'symmetrize_mode': 'mutual', 'lr': 6.364154734714698e-06, 'weight_decay': 1.0280341368956748e-06, 'epochs': 181, 'use_snp_selection': True, 'num_snps': 44000}. Best is trial 53 with value: 0.3412400782108307.
[I 2025-10-16 19:36:32,013] Trial 73 finished with value: 0.3400299847126007 and parameters: {'hidden_dims': '[256, 128]', 'dropout': 0.24959584715958288, 'batch_norm': False, 'graph_on': True, 'source': 'grm', 'knn_k': 6, 'weighted_edges': True, 'symmetrize_mode': 'mutual', 'lr': 1.7898048162794015e-05, 'weight_decay': 6.362939139684265e-07, 'epochs': 157, 'use_snp_selection': True, 'num_snps': 34000}. Best is trial 53 with value: 0.3412400782108307.
[I 2025-10-16 19:37:03,511] Trial 74 finished with value: 0.33972770571708677 and parameters: {'hidden_dims': '[256, 128]', 'dropout': 0.24713903057672343, 'batch_norm': False, 'graph_on': True, 'source': 'grm', 'knn_k': 7, 'weighted_edges': True, 'symmetrize_mode': 'mutual', 'lr': 1.7727142311872188e-05, 'weight_decay': 2.4997280462918933e-06, 'epochs': 154, 'use_snp_selection': True, 'num_snps': 34000}. Best is trial 53 with value: 0.3412400782108307.
[I 2025-10-16 19:37:34,890] Trial 75 finished with value: 0.33656332492828367 and parameters: {'hidden_dims': '[256, 128]', 'dropout': 0.27962791866631925, 'batch_norm': False, 'graph_on': True, 'source': 'grm', 'knn_k': 6, 'weighted_edges': True, 'symmetrize_mode': 'mutual', 'lr': 1.8326731970131375e-05, 'weight_decay': 1.1239443948964146e-05, 'epochs': 140, 'use_snp_selection': True, 'num_snps': 36000}. Best is trial 53 with value: 0.3412400782108307.
[I 2025-10-16 19:38:06,760] Trial 76 finished with value: 0.3376051664352417 and parameters: {'hidden_dims': '[256, 128]', 'dropout': 0.2517972523169223, 'batch_norm': False, 'graph_on': True, 'source': 'grm', 'knn_k': 7, 'weighted_edges': True, 'symmetrize_mode': 'mutual', 'lr': 2.5526529026485066e-05, 'weight_decay': 3.2231447811844964e-07, 'epochs': 160, 'use_snp_selection': True, 'num_snps': 34000}. Best is trial 53 with value: 0.3412400782108307.
[I 2025-10-16 19:38:37,542] Trial 77 finished with value: 0.33972030878067017 and parameters: {'hidden_dims': '[256, 128]', 'dropout': 0.3042000837100879, 'batch_norm': False, 'graph_on': True, 'source': 'grm', 'knn_k': 7, 'weighted_edges': True, 'symmetrize_mode': 'mutual', 'lr': 1.5176920619210094e-05, 'weight_decay': 4.242725024515183e-06, 'epochs': 152, 'use_snp_selection': True, 'num_snps': 32000}. Best is trial 53 with value: 0.3412400782108307.
