[I 2025-10-16 20:15:04,248] Trial 126 finished with value: 0.33073477149009706 and parameters: {'hidden_dims': '[512, 128]', 'dropout': 0.37145229426802234, 'batch_norm': False, 'graph_on': True, 'source': 'grm', 'knn_k': 6, 'weighted_edges': True, 'symmetrize_mode': 'union', 'lr': 6.126210622890582e-06, 'weight_decay': 0.0002668732071985381, 'epochs': 92, 'use_snp_selection': True, 'num_snps': 50000}. Best is trial 91 with value: 0.34324071407318113.
[I 2025-10-16 20:15:45,637] Trial 127 finished with value: 0.3251113831996918 and parameters: {'hidden_dims': '[512, 128]', 'dropout': 0.3967666994712244, 'batch_norm': False, 'graph_on': True, 'source': 'grm', 'knn_k': 6, 'weighted_edges': True, 'symmetrize_mode': 'mutual', 'lr': 1.982539263148709e-06, 'weight_decay': 9.451256077574922e-05, 'epochs': 108, 'use_snp_selection': True, 'num_snps': 44000}. Best is trial 91 with value: 0.34324071407318113.
[I 2025-10-16 20:17:05,688] Trial 128 finished with value: 0.3404181659221649 and parameters: {'hidden_dims': '[512, 128]', 'dropout': 0.5500761319819953, 'batch_norm': False, 'graph_on': True, 'source': 'grm', 'knn_k': 6, 'weighted_edges': True, 'symmetrize_mode': 'mutual', 'lr': 3.3186193106508866e-06, 'weight_decay': 0.00022827443978328132, 'epochs': 268, 'use_snp_selection': True, 'num_snps': 52000}. Best is trial 91 with value: 0.34324071407318113.
[I 2025-10-16 20:17:41,930] Trial 129 finished with value: 0.3225573360919952 and parameters: {'hidden_dims': '[256, 128, 64]', 'dropout': 0.3811600231197491, 'batch_norm': False, 'graph_on': True, 'source': 'grm', 'knn_k': 6, 'weighted_edges': True, 'symmetrize_mode': 'mutual', 'lr': 7.365921362849835e-06, 'weight_decay': 0.0005015779745704329, 'epochs': 126, 'use_snp_selection': True, 'num_snps': 42000}. Best is trial 91 with value: 0.34324071407318113.
[I 2025-10-16 20:18:18,493] Trial 130 finished with value: 0.3279576122760773 and parameters: {'hidden_dims': '[512, 128]', 'dropout': 0.32755111927140557, 'batch_norm': False, 'graph_on': True, 'source': 'grm', 'knn_k': 6, 'weighted_edges': True, 'symmetrize_mode': 'mutual', 'lr': 4.023444533406015e-06, 'weight_decay': 0.0001602919878773356, 'epochs': 67, 'use_snp_selection': True, 'num_snps': 52000}. Best is trial 91 with value: 0.34324071407318113.
[I 2025-10-16 20:19:46,164] Trial 131 finished with value: 0.33783305883407594 and parameters: {'hidden_dims': '[512, 128]', 'dropout': 0.5547969840157235, 'batch_norm': False, 'graph_on': True, 'source': 'grm', 'knn_k': 6, 'weighted_edges': True, 'symmetrize_mode': 'mutual', 'lr': 3.073455777324678e-06, 'weight_decay': 0.00019484520989471754, 'epochs': 303, 'use_snp_selection': True, 'num_snps': 52000}. Best is trial 91 with value: 0.34324071407318113.
[I 2025-10-16 20:21:25,703] Trial 132 finished with value: 0.33653515577316284 and parameters: {'hidden_dims': '[512, 128]', 'dropout': 0.493991479572619, 'batch_norm': False, 'graph_on': True, 'source': 'grm', 'knn_k': 6, 'weighted_edges': True, 'symmetrize_mode': 'mutual', 'lr': 2.5514228348714824e-06, 'weight_decay': 0.00011895149634410241, 'epochs': 332, 'use_snp_selection': True, 'num_snps': 56000}. Best is trial 91 with value: 0.34324071407318113.
[I 2025-10-16 20:22:10,621] Trial 133 finished with value: 0.3415068805217743 and parameters: {'hidden_dims': '[512, 128]', 'dropout': 0.5162647138309611, 'batch_norm': False, 'graph_on': True, 'source': 'grm', 'knn_k': 6, 'weighted_edges': True, 'symmetrize_mode': 'mutual', 'lr': 4.7051123242902065e-06, 'weight_decay': 0.00034757657481374347, 'epochs': 102, 'use_snp_selection': True, 'num_snps': 54000}. Best is trial 91 with value: 0.34324071407318113.
[I 2025-10-16 20:22:48,587] Trial 134 finished with value: 0.3224431097507477 and parameters: {'hidden_dims': '[512, 128]', 'dropout': 0.5994837359693068, 'batch_norm': False, 'graph_on': True, 'source': 'grm', 'knn_k': 6, 'weighted_edges': True, 'symmetrize_mode': 'mutual', 'lr': 4.85559506559458e-06, 'weight_decay': 0.00034575216365430805, 'epochs': 79, 'use_snp_selection': True, 'num_snps': 50000}. Best is trial 91 with value: 0.34324071407318113.
[I 2025-10-16 20:23:33,171] Trial 135 finished with value: 0.3400674879550934 and parameters: {'hidden_dims': '[512, 128]', 'dropout': 0.41404391630340226, 'batch_norm': False, 'graph_on': True, 'source': 'grm', 'knn_k': 6, 'weighted_edges': True, 'symmetrize_mode': 'mutual', 'lr': 5.288532563441113e-06, 'weight_decay': 0.000669083767018605, 'epochs': 101, 'use_snp_selection': True, 'num_snps': 54000}. Best is trial 91 with value: 0.34324071407318113.
[I 2025-10-16 20:24:25,700] Trial 136 finished with value: 0.34376481771469114 and parameters: {'hidden_dims': '[512, 128]', 'dropout': 0.3426831640190523, 'batch_norm': False, 'graph_on': True, 'source': 'grm', 'knn_k': 6, 'weighted_edges': True, 'symmetrize_mode': 'mutual', 'lr': 4.523761213849331e-06, 'weight_decay': 2.385094812696498e-05, 'epochs': 119, 'use_snp_selection': True, 'num_snps': 60000}. Best is trial 136 with value: 0.34376481771469114.
[I 2025-10-16 20:25:15,392] Trial 137 finished with value: 0.3369562208652496 and parameters: {'hidden_dims': '[512, 128]', 'dropout': 0.3451222132253017, 'batch_norm': False, 'graph_on': True, 'source': 'grm', 'knn_k': 6, 'weighted_edges': True, 'symmetrize_mode': 'mutual', 'lr': 4.512920455284682e-06, 'weight_decay': 0.00047514671846115745, 'epochs': 108, 'use_snp_selection': True, 'num_snps': 60000}. Best is trial 136 with value: 0.34376481771469114.
[I 2025-10-16 20:25:58,792] Trial 138 finished with value: 0.34299553036689756 and parameters: {'hidden_dims': '[512, 128]', 'dropout': 0.3365744514567748, 'batch_norm': False, 'graph_on': True, 'source': 'grm', 'knn_k': 6, 'weighted_edges': True, 'symmetrize_mode': 'mutual', 'lr': 8.488857295560546e-06, 'weight_decay': 2.3765022379251454e-05, 'epochs': 90, 'use_snp_selection': True, 'num_snps': 56000}. Best is trial 136 with value: 0.34376481771469114.
[I 2025-10-16 20:26:49,321] Trial 139 finished with value: 0.3346772134304047 and parameters: {'hidden_dims': '[512, 128]', 'dropout': 0.5149631365077139, 'batch_norm': False, 'graph_on': True, 'source': 'grm', 'knn_k': 5, 'weighted_edges': True, 'symmetrize_mode': 'mutual', 'lr': 8.717476362436421e-06, 'weight_decay': 2.4087905006224033e-05, 'epochs': 118, 'use_snp_selection': True, 'num_snps': 58000}. Best is trial 136 with value: 0.34376481771469114.
[I 2025-10-16 20:27:32,433] Trial 140 finished with value: 0.33600807189941406 and parameters: {'hidden_dims': '[512, 128]', 'dropout': 0.4003627002556791, 'batch_norm': False, 'graph_on': True, 'source': 'grm', 'knn_k': 6, 'weighted_edges': True, 'symmetrize_mode': 'mutual', 'lr': 6.608557164357614e-06, 'weight_decay': 2.2965838002411835e-05, 'epochs': 86, 'use_snp_selection': True, 'num_snps': 58000}. Best is trial 136 with value: 0.34376481771469114.
[I 2025-10-16 20:28:16,749] Trial 141 finished with value: 0.33813703060150146 and parameters: {'hidden_dims': '[512, 128]', 'dropout': 0.33479124971593166, 'batch_norm': False, 'graph_on': True, 'source': 'grm', 'knn_k': 6, 'weighted_edges': True, 'symmetrize_mode': 'mutual', 'lr': 6.03855595976307e-06, 'weight_decay': 1.747982805506038e-05, 'epochs': 94, 'use_snp_selection': True, 'num_snps': 56000}. Best is trial 136 with value: 0.34376481771469114.
[I 2025-10-16 20:29:04,053] Trial 142 finished with value: 0.3390381634235382 and parameters: {'hidden_dims': '[512, 128]', 'dropout': 0.31513817608380046, 'batch_norm': False, 'graph_on': True, 'source': 'grm', 'knn_k': 6, 'weighted_edges': True, 'symmetrize_mode': 'mutual', 'lr': 4.709860755343212e-06, 'weight_decay': 1.2229345551696128e-05, 'epochs': 98, 'use_snp_selection': True, 'num_snps': 60000}. Best is trial 136 with value: 0.34376481771469114.
[I 2025-10-16 20:29:49,726] Trial 143 finished with value: 0.33654956221580506 and parameters: {'hidden_dims': '[512, 128]', 'dropout': 0.5757628057859555, 'batch_norm': False, 'graph_on': True, 'source': 'grm', 'knn_k': 6, 'weighted_edges': True, 'symmetrize_mode': 'mutual', 'lr': 3.817242338588348e-06, 'weight_decay': 2.9265407982655365e-05, 'epochs': 106, 'use_snp_selection': True, 'num_snps': 54000}. Best is trial 136 with value: 0.34376481771469114.
[I 2025-10-16 20:30:35,077] Trial 144 finished with value: 0.3409380853176117 and parameters: {'hidden_dims': '[512, 128]', 'dropout': 0.36536111090715206, 'batch_norm': False, 'graph_on': True, 'source': 'grm', 'knn_k': 6, 'weighted_edges': True, 'symmetrize_mode': 'mutual', 'lr': 7.572657339270477e-06, 'weight_decay': 1.9907407199653097e-05, 'epochs': 115, 'use_snp_selection': True, 'num_snps': 50000}. Best is trial 136 with value: 0.34376481771469114.
[I 2025-10-16 20:31:19,912] Trial 145 finished with value: 0.3417315065860748 and parameters: {'hidden_dims': '[512, 128]', 'dropout': 0.3701252601625139, 'batch_norm': False, 'graph_on': True, 'source': 'grm', 'knn_k': 6, 'weighted_edges': True, 'symmetrize_mode': 'mutual', 'lr': 7.121564055299446e-06, 'weight_decay': 3.515318293938823e-05, 'epochs': 116, 'use_snp_selection': True, 'num_snps': 48000}. Best is trial 136 with value: 0.34376481771469114.
[I 2025-10-16 20:32:04,551] Trial 146 finished with value: 0.28772308826446535 and parameters: {'hidden_dims': '[512, 128]', 'dropout': 0.3699323065271707, 'batch_norm': True, 'graph_on': True, 'source': 'grm', 'knn_k': 6, 'weighted_edges': False, 'symmetrize_mode': 'mutual', 'lr': 7.919853066098655e-06, 'weight_decay': 3.00519045126364e-05, 'epochs': 114, 'use_snp_selection': True, 'num_snps': 48000}. Best is trial 136 with value: 0.34376481771469114.
[I 2025-10-16 20:32:51,237] Trial 147 finished with value: 0.3400850474834442 and parameters: {'hidden_dims': '[512, 128]', 'dropout': 0.38076432006459715, 'batch_norm': False, 'graph_on': True, 'source': 'grm', 'knn_k': 6, 'weighted_edges': True, 'symmetrize_mode': 'mutual', 'lr': 6.890297887909711e-06, 'weight_decay': 3.770194541869823e-05, 'epochs': 126, 'use_snp_selection': True, 'num_snps': 48000}. Best is trial 136 with value: 0.34376481771469114.
[I 2025-10-16 20:33:26,893] Trial 148 finished with value: 0.3047644793987274 and parameters: {'hidden_dims': '[256, 128, 64]', 'dropout': 0.4772510148818047, 'batch_norm': False, 'graph_on': True, 'source': 'grm', 'knn_k': 6, 'weighted_edges': True, 'symmetrize_mode': 'union', 'lr': 5.183354585143773e-06, 'weight_decay': 7.959928930106327e-05, 'epochs': 137, 'use_snp_selection': True, 'num_snps': 46000}. Best is trial 136 with value: 0.34376481771469114.
[I 2025-10-16 20:34:10,197] Trial 149 finished with value: 0.339029586315155 and parameters: {'hidden_dims': '[512, 128]', 'dropout': 0.3681357860184909, 'batch_norm': False, 'graph_on': True, 'source': 'grm', 'knn_k': 6, 'weighted_edges': True, 'symmetrize_mode': 'mutual', 'lr': 3.37376631265875e-06, 'weight_decay': 3.3506400689335966e-05, 'epochs': 118, 'use_snp_selection': True, 'num_snps': 44000}. Best is trial 136 with value: 0.34376481771469114.
[I 2025-10-16 20:34:46,387] Trial 0 finished with value: 0.2209010660648346 and parameters: {'hidden_dims': '[128, 64]', 'dropout': 0.199031432379812, 'batch_norm': True, 'graph_on': True, 'source': 'grm', 'knn_k': 1, 'weighted_edges': True, 'symmetrize_mode': 'union', 'lr': 0.0002740708741343236, 'weight_decay': 2.819059662190987e-05, 'epochs': 256, 'use_snp_selection': True, 'num_snps': 18000}. Best is trial 0 with value: 0.2209010660648346.
[I 2025-10-16 20:35:05,727] Trial 1 finished with value: 0.2563993990421295 and parameters: {'hidden_dims': '[128, 64]', 'dropout': 0.32091658721149807, 'batch_norm': False, 'graph_on': True, 'source': 'grm', 'knn_k': 4, 'weighted_edges': False, 'symmetrize_mode': 'mutual', 'lr': 0.0005320428882732732, 'weight_decay': 1.89210117736594e-06, 'epochs': 40, 'use_snp_selection': True, 'num_snps': 20000}. Best is trial 1 with value: 0.2563993990421295.
[I 2025-10-16 20:35:31,782] Trial 2 finished with value: 0.286474746465683 and parameters: {'hidden_dims': '[256, 128]', 'dropout': 0.19947376983940615, 'batch_norm': True, 'graph_on': True, 'source': 'grm', 'knn_k': 6, 'weighted_edges': True, 'symmetrize_mode': 'mutual', 'lr': 1.5051775490493461e-05, 'weight_decay': 2.3650563799866155e-07, 'epochs': 289, 'use_snp_selection': True, 'num_snps': 10000}. Best is trial 2 with value: 0.286474746465683.
[I 2025-10-16 20:35:53,624] Trial 3 finished with value: 0.31624701619148254 and parameters: {'hidden_dims': '[512, 256]', 'dropout': 0.3986858241154422, 'batch_norm': True, 'graph_on': True, 'source': 'grm', 'knn_k': 5, 'weighted_edges': True, 'symmetrize_mode': 'union', 'lr': 9.821050313409216e-06, 'weight_decay': 0.00012454353397331594, 'epochs': 23, 'use_snp_selection': True, 'num_snps': 26000}. Best is trial 3 with value: 0.31624701619148254.
[I 2025-10-16 20:36:29,402] Trial 4 finished with value: 0.3079854965209961 and parameters: {'hidden_dims': '[256, 128, 64]', 'dropout': 0.5390483213624292, 'batch_norm': False, 'graph_on': True, 'source': 'grm', 'knn_k': 4, 'weighted_edges': False, 'symmetrize_mode': 'mutual', 'lr': 8.11311593386297e-06, 'weight_decay': 9.296158109581328e-07, 'epochs': 200, 'use_snp_selection': True, 'num_snps': 34000}. Best is trial 3 with value: 0.31624701619148254.
[I 2025-10-16 20:36:57,607] Trial 5 finished with value: 0.2430390238761902 and parameters: {'hidden_dims': '[512, 256]', 'dropout': 0.528994345325027, 'batch_norm': True, 'graph_on': True, 'source': 'grm', 'knn_k': 6, 'weighted_edges': True, 'symmetrize_mode': 'union', 'lr': 1.164930281795184e-06, 'weight_decay': 0.00020941850571250828, 'epochs': 21, 'use_snp_selection': True, 'num_snps': 60000}. Best is trial 3 with value: 0.31624701619148254.
[I 2025-10-16 20:37:37,205] Trial 6 finished with value: 0.25957723557949064 and parameters: {'hidden_dims': '[512, 256]', 'dropout': 0.4244699923044819, 'batch_norm': True, 'graph_on': True, 'source': 'grm', 'knn_k': 2, 'weighted_edges': True, 'symmetrize_mode': 'union', 'lr': 5.719516246965409e-05, 'weight_decay': 0.0007446207004743823, 'epochs': 111, 'use_snp_selection': True, 'num_snps': 40000}. Best is trial 3 with value: 0.31624701619148254.
[I 2025-10-16 20:38:23,989] Trial 7 finished with value: 0.33423091173172 and parameters: {'hidden_dims': '[512, 64]', 'dropout': 0.3607638271959879, 'batch_norm': True, 'graph_on': True, 'source': 'grm', 'knn_k': 7, 'weighted_edges': True, 'symmetrize_mode': 'union', 'lr': 2.400010639603384e-06, 'weight_decay': 3.556750757572288e-05, 'epochs': 124, 'use_snp_selection': True, 'num_snps': 48000}. Best is trial 7 with value: 0.33423091173172.
[I 2025-10-16 20:39:15,491] Trial 8 finished with value: 0.29384317994117737 and parameters: {'hidden_dims': '[512, 64]', 'dropout': 0.2928493908415588, 'batch_norm': False, 'graph_on': True, 'source': 'grm', 'knn_k': 7, 'weighted_edges': False, 'symmetrize_mode': 'union', 'lr': 1.1043450617383017e-06, 'weight_decay': 1.511705358910635e-05, 'epochs': 135, 'use_snp_selection': True, 'num_snps': 52000}. Best is trial 7 with value: 0.33423091173172.
[I 2025-10-16 20:40:45,097] Trial 9 finished with value: 0.2993116796016693 and parameters: {'hidden_dims': '[512, 64]', 'dropout': 0.1194044225528384, 'batch_norm': True, 'graph_on': True, 'source': 'grm', 'knn_k': 7, 'weighted_edges': True, 'symmetrize_mode': 'union', 'lr': 3.754731899410945e-06, 'weight_decay': 3.797795084560882e-06, 'epochs': 347, 'use_snp_selection': True, 'num_snps': 46000}. Best is trial 7 with value: 0.33423091173172.
[I 2025-10-16 20:41:32,905] Trial 10 finished with value: 0.29227217435836794 and parameters: {'hidden_dims': '[512, 128]', 'dropout': 0.4648806431230973, 'batch_norm': False, 'graph_on': True, 'source': 'grm', 'knn_k': 3, 'weighted_edges': False, 'symmetrize_mode': 'mutual', 'lr': 8.29984835644417e-05, 'weight_decay': 6.552467860785973e-05, 'epochs': 103, 'use_snp_selection': True, 'num_snps': 60000}. Best is trial 7 with value: 0.33423091173172.
[I 2025-10-16 20:42:00,300] Trial 11 finished with value: 0.33762024641036986 and parameters: {'hidden_dims': '[512, 256]', 'dropout': 0.3858350368681998, 'batch_norm': True, 'graph_on': True, 'source': 'grm', 'knn_k': 5, 'weighted_edges': True, 'symmetrize_mode': 'union', 'lr': 4.678770236916612e-06, 'weight_decay': 0.00011651623597470792, 'epochs': 70, 'use_snp_selection': True, 'num_snps': 26000}. Best is trial 11 with value: 0.33762024641036986.
[I 2025-10-16 20:42:43,575] Trial 12 finished with value: 0.32399651408195496 and parameters: {'hidden_dims': '[512, 64]', 'dropout': 0.35019340741861255, 'batch_norm': True, 'graph_on': True, 'source': 'grm', 'knn_k': 5, 'weighted_edges': True, 'symmetrize_mode': 'union', 'lr': 3.0454205372733332e-06, 'weight_decay': 0.0005712270851809406, 'epochs': 161, 'use_snp_selection': True, 'num_snps': 34000}. Best is trial 11 with value: 0.33762024641036986.
[I 2025-10-16 20:43:03,309] Trial 13 finished with value: 0.30332600474357607 and parameters: {'hidden_dims': '[512, 128]', 'dropout': 0.25352344068386523, 'batch_norm': True, 'graph_on': True, 'source': 'grm', 'knn_k': 6, 'weighted_edges': True, 'symmetrize_mode': 'union', 'lr': 3.220061187901276e-06, 'weight_decay': 3.115797140866395e-05, 'epochs': 77, 'use_snp_selection': True, 'num_snps': 6000}. Best is trial 11 with value: 0.33762024641036986.
[I 2025-10-16 20:43:45,224] Trial 14 finished with value: 0.2997986078262329 and parameters: {'hidden_dims': '[256, 128, 64]', 'dropout': 0.4620071939754916, 'batch_norm': True, 'graph_on': True, 'source': 'grm', 'knn_k': 5, 'weighted_edges': True, 'symmetrize_mode': 'union', 'lr': 3.395863860154344e-05, 'weight_decay': 6.985646420233191e-06, 'epochs': 193, 'use_snp_selection': True, 'num_snps': 46000}. Best is trial 11 with value: 0.33762024641036986.
[I 2025-10-16 20:44:08,756] Trial 15 finished with value: 0.32257348895072935 and parameters: {'hidden_dims': '[256, 128]', 'dropout': 0.380365898425765, 'batch_norm': True, 'graph_on': True, 'source': 'grm', 'knn_k': 7, 'weighted_edges': True, 'symmetrize_mode': 'union', 'lr': 4.74330039808902e-06, 'weight_decay': 0.0001766341487564716, 'epochs': 73, 'use_snp_selection': True, 'num_snps': 26000}. Best is trial 11 with value: 0.33762024641036986.
[I 2025-10-16 20:44:58,539] Trial 16 finished with value: 0.3131026327610016 and parameters: {'hidden_dims': '[512, 256]', 'dropout': 0.47899860292060553, 'batch_norm': True, 'graph_on': True, 'source': 'grm', 'knn_k': 3, 'weighted_edges': True, 'symmetrize_mode': 'union', 'lr': 1.6121869440359382e-06, 'weight_decay': 5.882373694022856e-05, 'epochs': 151, 'use_snp_selection': True, 'num_snps': 44000}. Best is trial 11 with value: 0.33762024641036986.
[I 2025-10-16 20:45:33,656] Trial 17 finished with value: 0.33212239742279054 and parameters: {'hidden_dims': '[512, 64]', 'dropout': 0.5741974551696398, 'batch_norm': True, 'graph_on': True, 'source': 'grm', 'knn_k': 6, 'weighted_edges': True, 'symmetrize_mode': 'union', 'lr': 1.9570306195962757e-05, 'weight_decay': 0.00032978373145443613, 'epochs': 225, 'use_snp_selection': True, 'num_snps': 16000}. Best is trial 11 with value: 0.33762024641036986.
[I 2025-10-16 20:46:10,532] Trial 18 finished with value: 0.32596172094345094 and parameters: {'hidden_dims': '[512, 64]', 'dropout': 0.25056033742691175, 'batch_norm': False, 'graph_on': True, 'source': 'grm', 'knn_k': 5, 'weighted_edges': False, 'symmetrize_mode': 'mutual', 'lr': 7.059438901020032e-06, 'weight_decay': 1.1548552564797604e-05, 'epochs': 69, 'use_snp_selection': True, 'num_snps': 52000}. Best is trial 11 with value: 0.33762024641036986.
[I 2025-10-16 20:46:44,130] Trial 19 finished with value: 0.32174726724624636 and parameters: {'hidden_dims': '[512, 256]', 'dropout': 0.36153879257480914, 'batch_norm': True, 'graph_on': True, 'source': 'grm', 'knn_k': 3, 'weighted_edges': True, 'symmetrize_mode': 'union', 'lr': 1.9118541515842097e-06, 'weight_decay': 1.629286964864674e-07, 'epochs': 117, 'use_snp_selection': True, 'num_snps': 28000}. Best is trial 11 with value: 0.33762024641036986.
[I 2025-10-16 20:47:06,579] Trial 20 finished with value: 0.3274247169494629 and parameters: {'hidden_dims': '[128, 64]', 'dropout': 0.3002180922607724, 'batch_norm': True, 'graph_on': True, 'source': 'grm', 'knn_k': 7, 'weighted_edges': True, 'symmetrize_mode': 'union', 'lr': 0.00012807860911047994, 'weight_decay': 9.184854182491129e-05, 'epochs': 55, 'use_snp_selection': True, 'num_snps': 36000}. Best is trial 11 with value: 0.33762024641036986.
[I 2025-10-16 20:47:41,583] Trial 21 finished with value: 0.33196665048599244 and parameters: {'hidden_dims': '[512, 64]', 'dropout': 0.5768433851625637, 'batch_norm': True, 'graph_on': True, 'source': 'grm', 'knn_k': 6, 'weighted_edges': True, 'symmetrize_mode': 'union', 'lr': 1.8850342756180156e-05, 'weight_decay': 0.00038895629853802317, 'epochs': 224, 'use_snp_selection': True, 'num_snps': 16000}. Best is trial 11 with value: 0.33762024641036986.
[I 2025-10-16 20:48:12,247] Trial 22 finished with value: 0.3365432798862457 and parameters: {'hidden_dims': '[512, 64]', 'dropout': 0.4200877391280943, 'batch_norm': True, 'graph_on': True, 'source': 'grm', 'knn_k': 6, 'weighted_edges': True, 'symmetrize_mode': 'union', 'lr': 2.203875705977525e-05, 'weight_decay': 0.00029950099858621677, 'epochs': 236, 'use_snp_selection': True, 'num_snps': 12000}. Best is trial 11 with value: 0.33762024641036986.
[I 2025-10-16 20:48:37,241] Trial 23 finished with value: 0.3048655092716217 and parameters: {'hidden_dims': '[512, 64]', 'dropout': 0.4270385135811759, 'batch_norm': True, 'graph_on': True, 'source': 'grm', 'knn_k': 5, 'weighted_edges': True, 'symmetrize_mode': 'union', 'lr': 2.370830630732254e-06, 'weight_decay': 4.090645666016974e-05, 'epochs': 284, 'use_snp_selection': True, 'num_snps': 4000}. Best is trial 11 with value: 0.33762024641036986.
