Running from this directory: /cluster/work/simennes/Project_thesis/Project_thesis
Name of job: tune_params
ID of job: 23132761
The job was run on these nodes: idun-07-05
[I 2025-10-16 14:02:35,698] Trial 0 finished with value: 0.19967860877513885 and parameters: {'hidden_dims': '[128, 64]', 'dropout': 0.199031432379812, 'batch_norm': True, 'graph_on': True, 'source': 'grm', 'knn_k': 1, 'weighted_edges': True, 'symmetrize_mode': 'union', 'lr': 0.0002740708741343236, 'weight_decay': 2.819059662190987e-05, 'epochs': 256, 'use_snp_selection': True, 'num_snps': 18000}. Best is trial 0 with value: 0.19967860877513885.
[I 2025-10-16 14:02:54,732] Trial 1 finished with value: 0.22110104858875274 and parameters: {'hidden_dims': '[128, 64]', 'dropout': 0.32091658721149807, 'batch_norm': False, 'graph_on': True, 'source': 'grm', 'knn_k': 4, 'weighted_edges': False, 'symmetrize_mode': 'mutual', 'lr': 0.0005320428882732732, 'weight_decay': 1.89210117736594e-06, 'epochs': 40, 'use_snp_selection': True, 'num_snps': 20000}. Best is trial 1 with value: 0.22110104858875274.
[I 2025-10-16 14:03:20,540] Trial 2 finished with value: 0.26369360089302063 and parameters: {'hidden_dims': '[256, 128]', 'dropout': 0.19947376983940615, 'batch_norm': True, 'graph_on': True, 'source': 'grm', 'knn_k': 6, 'weighted_edges': True, 'symmetrize_mode': 'mutual', 'lr': 1.5051775490493461e-05, 'weight_decay': 2.3650563799866155e-07, 'epochs': 289, 'use_snp_selection': True, 'num_snps': 10000}. Best is trial 2 with value: 0.26369360089302063.
[I 2025-10-16 14:03:42,129] Trial 3 finished with value: 0.29185073375701903 and parameters: {'hidden_dims': '[512, 256]', 'dropout': 0.3986858241154422, 'batch_norm': True, 'graph_on': True, 'source': 'grm', 'knn_k': 5, 'weighted_edges': True, 'symmetrize_mode': 'union', 'lr': 9.821050313409216e-06, 'weight_decay': 0.00012454353397331594, 'epochs': 23, 'use_snp_selection': True, 'num_snps': 26000}. Best is trial 3 with value: 0.29185073375701903.
[I 2025-10-16 14:04:17,437] Trial 4 finished with value: 0.3000617206096649 and parameters: {'hidden_dims': '[256, 128, 64]', 'dropout': 0.5390483213624292, 'batch_norm': False, 'graph_on': True, 'source': 'grm', 'knn_k': 4, 'weighted_edges': False, 'symmetrize_mode': 'mutual', 'lr': 8.11311593386297e-06, 'weight_decay': 9.296158109581328e-07, 'epochs': 200, 'use_snp_selection': True, 'num_snps': 34000}. Best is trial 4 with value: 0.3000617206096649.
[I 2025-10-16 14:04:56,020] Trial 5 finished with value: 0.2364977329969406 and parameters: {'hidden_dims': '[256, 128, 64]', 'dropout': 0.5885461262002587, 'batch_norm': False, 'graph_on': True, 'source': 'grm', 'knn_k': 3, 'weighted_edges': False, 'symmetrize_mode': 'mutual', 'lr': 1.164930281795184e-06, 'weight_decay': 1.3145475249585842e-07, 'epochs': 145, 'use_snp_selection': True, 'num_snps': 54000}. Best is trial 4 with value: 0.3000617206096649.
[I 2025-10-16 14:05:34,887] Trial 6 finished with value: 0.2788095474243164 and parameters: {'hidden_dims': '[256, 128, 64]', 'dropout': 0.5824426399282747, 'batch_norm': False, 'graph_on': True, 'source': 'grm', 'knn_k': 7, 'weighted_edges': False, 'symmetrize_mode': 'mutual', 'lr': 1.8103274335042867e-06, 'weight_decay': 1.8980551329127457e-06, 'epochs': 168, 'use_snp_selection': True, 'num_snps': 48000}. Best is trial 4 with value: 0.3000617206096649.
[I 2025-10-16 14:06:50,955] Trial 7 finished with value: 0.26750691831111906 and parameters: {'hidden_dims': '[512, 64]', 'dropout': 0.4492085423675365, 'batch_norm': False, 'graph_on': True, 'source': 'grm', 'knn_k': 2, 'weighted_edges': False, 'symmetrize_mode': 'mutual', 'lr': 7.458996247470631e-05, 'weight_decay': 3.63708811960795e-06, 'epochs': 339, 'use_snp_selection': True, 'num_snps': 40000}. Best is trial 4 with value: 0.3000617206096649.
[I 2025-10-16 14:07:28,855] Trial 8 finished with value: 0.31547735929489135 and parameters: {'hidden_dims': '[512, 128]', 'dropout': 0.4855348583679587, 'batch_norm': False, 'graph_on': True, 'source': 'grm', 'knn_k': 4, 'weighted_edges': False, 'symmetrize_mode': 'union', 'lr': 5.347869726837025e-06, 'weight_decay': 0.000825219321368031, 'epochs': 112, 'use_snp_selection': True, 'num_snps': 38000}. Best is trial 8 with value: 0.31547735929489135.
[I 2025-10-16 14:07:47,922] Trial 9 finished with value: 0.301743620634079 and parameters: {'hidden_dims': '[512, 128]', 'dropout': 0.31141454109750316, 'batch_norm': False, 'graph_on': True, 'source': 'grm', 'knn_k': 3, 'weighted_edges': False, 'symmetrize_mode': 'union', 'lr': 6.926774652277983e-05, 'weight_decay': 0.0009810933865270722, 'epochs': 95, 'use_snp_selection': True, 'num_snps': 4000}. Best is trial 8 with value: 0.31547735929489135.
[I 2025-10-16 14:08:36,383] Trial 10 finished with value: 0.3072149693965912 and parameters: {'hidden_dims': '[512, 128]', 'dropout': 0.4740429507843431, 'batch_norm': True, 'graph_on': True, 'source': 'grm', 'knn_k': 6, 'weighted_edges': True, 'symmetrize_mode': 'union', 'lr': 3.014958777034699e-06, 'weight_decay': 0.0008456324193342337, 'epochs': 103, 'use_snp_selection': True, 'num_snps': 60000}. Best is trial 8 with value: 0.31547735929489135.
[I 2025-10-16 14:09:25,303] Trial 11 finished with value: 0.30549827218055725 and parameters: {'hidden_dims': '[512, 128]', 'dropout': 0.47296614780803475, 'batch_norm': True, 'graph_on': True, 'source': 'grm', 'knn_k': 6, 'weighted_edges': True, 'symmetrize_mode': 'union', 'lr': 3.7460210613156336e-06, 'weight_decay': 0.000988571501865363, 'epochs': 105, 'use_snp_selection': True, 'num_snps': 60000}. Best is trial 8 with value: 0.31547735929489135.
[I 2025-10-16 14:10:04,645] Trial 12 finished with value: 0.30340989828109743 and parameters: {'hidden_dims': '[512, 128]', 'dropout': 0.4822963694533881, 'batch_norm': True, 'graph_on': True, 'source': 'grm', 'knn_k': 5, 'weighted_edges': True, 'symmetrize_mode': 'union', 'lr': 3.353007483207438e-06, 'weight_decay': 0.00020158056220819277, 'epochs': 97, 'use_snp_selection': True, 'num_snps': 44000}. Best is trial 8 with value: 0.31547735929489135.
[I 2025-10-16 14:10:41,964] Trial 13 finished with value: 0.29688590168952944 and parameters: {'hidden_dims': '[512, 128]', 'dropout': 0.39025349469048803, 'batch_norm': True, 'graph_on': True, 'source': 'grm', 'knn_k': 7, 'weighted_edges': True, 'symmetrize_mode': 'union', 'lr': 2.2383395567904606e-05, 'weight_decay': 0.00014101307769783075, 'epochs': 58, 'use_snp_selection': True, 'num_snps': 60000}. Best is trial 8 with value: 0.31547735929489135.
[I 2025-10-16 14:11:31,517] Trial 14 finished with value: 0.3036750018596649 and parameters: {'hidden_dims': '[512, 128]', 'dropout': 0.506064761551703, 'batch_norm': True, 'graph_on': True, 'source': 'grm', 'knn_k': 5, 'weighted_edges': False, 'symmetrize_mode': 'union', 'lr': 4.192117865675457e-06, 'weight_decay': 2.3527920112703006e-05, 'epochs': 207, 'use_snp_selection': True, 'num_snps': 34000}. Best is trial 8 with value: 0.31547735929489135.
[I 2025-10-16 14:12:07,141] Trial 15 finished with value: 0.3168779253959656 and parameters: {'hidden_dims': '[256, 128]', 'dropout': 0.11399899071862205, 'batch_norm': False, 'graph_on': True, 'source': 'grm', 'knn_k': 3, 'weighted_edges': True, 'symmetrize_mode': 'union', 'lr': 3.847989198170386e-05, 'weight_decay': 0.00035019828034201156, 'epochs': 135, 'use_snp_selection': True, 'num_snps': 50000}. Best is trial 15 with value: 0.3168779253959656.
[I 2025-10-16 14:12:42,039] Trial 16 finished with value: 0.3071799695491791 and parameters: {'hidden_dims': '[256, 128]', 'dropout': 0.11480274788990631, 'batch_norm': False, 'graph_on': True, 'source': 'grm', 'knn_k': 3, 'weighted_edges': False, 'symmetrize_mode': 'union', 'lr': 4.576489092463135e-05, 'weight_decay': 0.00027478619033360294, 'epochs': 141, 'use_snp_selection': True, 'num_snps': 46000}. Best is trial 15 with value: 0.3168779253959656.
[I 2025-10-16 14:13:21,159] Trial 17 finished with value: 0.29652096033096315 and parameters: {'hidden_dims': '[256, 128]', 'dropout': 0.253769840387702, 'batch_norm': False, 'graph_on': True, 'source': 'grm', 'knn_k': 2, 'weighted_edges': True, 'symmetrize_mode': 'union', 'lr': 0.00016474991744482988, 'weight_decay': 5.313767782522443e-05, 'epochs': 239, 'use_snp_selection': True, 'num_snps': 38000}. Best is trial 15 with value: 0.3168779253959656.
[I 2025-10-16 14:13:55,666] Trial 18 finished with value: 0.2842616379261017 and parameters: {'hidden_dims': '[512, 64]', 'dropout': 0.12761061583154912, 'batch_norm': False, 'graph_on': True, 'source': 'grm', 'knn_k': 2, 'weighted_edges': False, 'symmetrize_mode': 'union', 'lr': 2.7502629630629554e-05, 'weight_decay': 1.1548552564797604e-05, 'epochs': 62, 'use_snp_selection': True, 'num_snps': 52000}. Best is trial 15 with value: 0.3168779253959656.
[I 2025-10-16 14:14:30,939] Trial 19 finished with value: 0.29613207578659057 and parameters: {'hidden_dims': '[512, 256]', 'dropout': 0.3945971183862107, 'batch_norm': False, 'graph_on': True, 'source': 'grm', 'knn_k': 1, 'weighted_edges': True, 'symmetrize_mode': 'union', 'lr': 0.00012267917248335073, 'weight_decay': 0.00036075611445864504, 'epochs': 144, 'use_snp_selection': True, 'num_snps': 28000}. Best is trial 15 with value: 0.3168779253959656.
[I 2025-10-16 14:15:12,045] Trial 20 finished with value: 0.09085469171404839 and parameters: {'hidden_dims': '[256, 128]', 'dropout': 0.26134099153471885, 'batch_norm': False, 'graph_on': True, 'source': 'grm', 'knn_k': 4, 'weighted_edges': True, 'symmetrize_mode': 'union', 'lr': 0.0008283912151294985, 'weight_decay': 5.156532883479338e-05, 'epochs': 176, 'use_snp_selection': True, 'num_snps': 52000}. Best is trial 15 with value: 0.3168779253959656.
[I 2025-10-16 14:16:01,972] Trial 21 finished with value: 0.2857315719127655 and parameters: {'hidden_dims': '[512, 128]', 'dropout': 0.4296084722889722, 'batch_norm': True, 'graph_on': True, 'source': 'grm', 'knn_k': 4, 'weighted_edges': True, 'symmetrize_mode': 'union', 'lr': 7.6088254603734275e-06, 'weight_decay': 0.0004865661962289218, 'epochs': 119, 'use_snp_selection': True, 'num_snps': 56000}. Best is trial 15 with value: 0.3168779253959656.
[I 2025-10-16 14:16:36,557] Trial 22 finished with value: 0.2798882722854614 and parameters: {'hidden_dims': '[512, 128]', 'dropout': 0.5310440934987848, 'batch_norm': False, 'graph_on': True, 'source': 'grm', 'knn_k': 6, 'weighted_edges': True, 'symmetrize_mode': 'union', 'lr': 1.8551420521384265e-06, 'weight_decay': 0.0005651393517005084, 'epochs': 78, 'use_snp_selection': True, 'num_snps': 42000}. Best is trial 15 with value: 0.3168779253959656.
[I 2025-10-16 14:17:10,442] Trial 23 finished with value: 0.26336481869220735 and parameters: {'hidden_dims': '[256, 128]', 'dropout': 0.34806767940140687, 'batch_norm': True, 'graph_on': True, 'source': 'grm', 'knn_k': 3, 'weighted_edges': True, 'symmetrize_mode': 'union', 'lr': 1.2243631947996377e-05, 'weight_decay': 9.733787595411457e-05, 'epochs': 125, 'use_snp_selection': True, 'num_snps': 48000}. Best is trial 15 with value: 0.3168779253959656.
[I 2025-10-16 14:17:50,723] Trial 24 finished with value: 0.318724125623703 and parameters: {'hidden_dims': '[512, 128]', 'dropout': 0.5430815483906483, 'batch_norm': False, 'graph_on': True, 'source': 'grm', 'knn_k': 5, 'weighted_edges': True, 'symmetrize_mode': 'union', 'lr': 5.3921999874262565e-06, 'weight_decay': 0.00044305005868005, 'epochs': 78, 'use_snp_selection': True, 'num_snps': 56000}. Best is trial 24 with value: 0.318724125623703.
[I 2025-10-16 14:18:14,464] Trial 25 finished with value: 0.2458484172821045 and parameters: {'hidden_dims': '[512, 256]', 'dropout': 0.5501052441339456, 'batch_norm': False, 'graph_on': True, 'source': 'grm', 'knn_k': 5, 'weighted_edges': True, 'symmetrize_mode': 'union', 'lr': 5.600851764001501e-06, 'weight_decay': 0.0002712992799121551, 'epochs': 22, 'use_snp_selection': True, 'num_snps': 38000}. Best is trial 24 with value: 0.318724125623703.
[I 2025-10-16 14:18:38,332] Trial 26 finished with value: 0.29625425934791566 and parameters: {'hidden_dims': '[128, 64]', 'dropout': 0.17531107446328953, 'batch_norm': False, 'graph_on': True, 'source': 'grm', 'knn_k': 4, 'weighted_edges': False, 'symmetrize_mode': 'union', 'lr': 2.152604834042511e-05, 'weight_decay': 6.256734248630117e-05, 'epochs': 57, 'use_snp_selection': True, 'num_snps': 48000}. Best is trial 24 with value: 0.318724125623703.
[I 2025-10-16 14:19:17,805] Trial 27 finished with value: 0.2674043297767639 and parameters: {'hidden_dims': '[512, 64]', 'dropout': 0.5964895954984708, 'batch_norm': False, 'graph_on': True, 'source': 'grm', 'knn_k': 3, 'weighted_edges': True, 'symmetrize_mode': 'union', 'lr': 3.959982338801045e-05, 'weight_decay': 0.000494425237911488, 'epochs': 77, 'use_snp_selection': True, 'num_snps': 56000}. Best is trial 24 with value: 0.318724125623703.
[I 2025-10-16 14:19:49,320] Trial 28 finished with value: 0.3141898989677429 and parameters: {'hidden_dims': '[256, 128]', 'dropout': 0.2778190382292169, 'batch_norm': False, 'graph_on': True, 'source': 'grm', 'knn_k': 5, 'weighted_edges': False, 'symmetrize_mode': 'union', 'lr': 1.6198978902178067e-05, 'weight_decay': 0.0001944320649108489, 'epochs': 159, 'use_snp_selection': True, 'num_snps': 34000}. Best is trial 24 with value: 0.318724125623703.
[I 2025-10-16 14:20:22,005] Trial 29 finished with value: 0.3060781717300415 and parameters: {'hidden_dims': '[128, 64]', 'dropout': 0.2134087392267546, 'batch_norm': False, 'graph_on': True, 'source': 'grm', 'knn_k': 1, 'weighted_edges': True, 'symmetrize_mode': 'union', 'lr': 5.731353454624436e-06, 'weight_decay': 1.905084717416042e-05, 'epochs': 204, 'use_snp_selection': True, 'num_snps': 50000}. Best is trial 24 with value: 0.318724125623703.
[I 2025-10-16 14:21:25,578] Trial 30 finished with value: 0.3145975947380066 and parameters: {'hidden_dims': '[512, 128]', 'dropout': 0.15378522630352098, 'batch_norm': False, 'graph_on': True, 'source': 'grm', 'knn_k': 4, 'weighted_edges': True, 'symmetrize_mode': 'union', 'lr': 0.000344019508914213, 'weight_decay': 7.1596880971865045e-06, 'epochs': 235, 'use_snp_selection': True, 'num_snps': 44000}. Best is trial 24 with value: 0.318724125623703.
[I 2025-10-16 14:22:32,995] Trial 31 finished with value: 0.31921048164367677 and parameters: {'hidden_dims': '[512, 128]', 'dropout': 0.157370049972093, 'batch_norm': False, 'graph_on': True, 'source': 'grm', 'knn_k': 4, 'weighted_edges': True, 'symmetrize_mode': 'union', 'lr': 0.0003201243058293664, 'weight_decay': 6.484271862458393e-06, 'epochs': 255, 'use_snp_selection': True, 'num_snps': 44000}. Best is trial 31 with value: 0.31921048164367677.
[I 2025-10-16 14:23:01,450] Trial 32 finished with value: 0.3235889971256256 and parameters: {'hidden_dims': '[512, 128]', 'dropout': 0.1321724590198799, 'batch_norm': False, 'graph_on': True, 'source': 'grm', 'knn_k': 4, 'weighted_edges': True, 'symmetrize_mode': 'union', 'lr': 0.00017796385833407304, 'weight_decay': 5.2991983395518776e-06, 'epochs': 118, 'use_snp_selection': True, 'num_snps': 20000}. Best is trial 32 with value: 0.3235889971256256.
[I 2025-10-16 14:23:41,761] Trial 33 finished with value: 0.3094354152679443 and parameters: {'hidden_dims': '[512, 128]', 'dropout': 0.1002218568904917, 'batch_norm': False, 'graph_on': True, 'source': 'grm', 'knn_k': 5, 'weighted_edges': True, 'symmetrize_mode': 'union', 'lr': 0.00022206138195399872, 'weight_decay': 5.782846356809245e-06, 'epochs': 278, 'use_snp_selection': True, 'num_snps': 18000}. Best is trial 32 with value: 0.3235889971256256.
[I 2025-10-16 14:24:17,603] Trial 34 finished with value: 0.26841828525066375 and parameters: {'hidden_dims': '[512, 128]', 'dropout': 0.1557829322450944, 'batch_norm': False, 'graph_on': True, 'source': 'grm', 'knn_k': 3, 'weighted_edges': True, 'symmetrize_mode': 'mutual', 'lr': 0.0004189958248098875, 'weight_decay': 6.141027980037929e-07, 'epochs': 302, 'use_snp_selection': True, 'num_snps': 14000}. Best is trial 32 with value: 0.3235889971256256.
[I 2025-10-16 14:24:37,775] Trial 35 finished with value: 0.19651313722133637 and parameters: {'hidden_dims': '[128, 64]', 'dropout': 0.22102213945952728, 'batch_norm': False, 'graph_on': True, 'source': 'grm', 'knn_k': 4, 'weighted_edges': True, 'symmetrize_mode': 'union', 'lr': 0.0006757055455808973, 'weight_decay': 2.2261932822346044e-06, 'epochs': 38, 'use_snp_selection': True, 'num_snps': 28000}. Best is trial 32 with value: 0.3235889971256256.
[I 2025-10-16 14:25:05,545] Trial 36 finished with value: 0.29087421000003816 and parameters: {'hidden_dims': '[256, 128]', 'dropout': 0.13540742808182848, 'batch_norm': False, 'graph_on': True, 'source': 'grm', 'knn_k': 2, 'weighted_edges': True, 'symmetrize_mode': 'mutual', 'lr': 0.00011133558272673289, 'weight_decay': 8.636186939004156e-07, 'epochs': 188, 'use_snp_selection': True, 'num_snps': 22000}. Best is trial 32 with value: 0.3235889971256256.
[I 2025-10-16 14:25:41,881] Trial 37 finished with value: 0.3025883734226227 and parameters: {'hidden_dims': '[512, 256]', 'dropout': 0.18520850190835053, 'batch_norm': False, 'graph_on': True, 'source': 'grm', 'knn_k': 5, 'weighted_edges': True, 'symmetrize_mode': 'union', 'lr': 0.00024582232829002855, 'weight_decay': 1.5496010876276332e-05, 'epochs': 346, 'use_snp_selection': True, 'num_snps': 12000}. Best is trial 32 with value: 0.3235889971256256.
[I 2025-10-16 14:26:18,459] Trial 38 finished with value: 0.29180440306663513 and parameters: {'hidden_dims': '[256, 128, 64]', 'dropout': 0.22204767196423958, 'batch_norm': False, 'graph_on': True, 'source': 'grm', 'knn_k': 6, 'weighted_edges': True, 'symmetrize_mode': 'mutual', 'lr': 0.00046425091594913954, 'weight_decay': 5.696321129751779e-06, 'epochs': 320, 'use_snp_selection': True, 'num_snps': 22000}. Best is trial 32 with value: 0.3235889971256256.
[I 2025-10-16 14:26:42,242] Trial 39 finished with value: 0.3026218473911285 and parameters: {'hidden_dims': '[512, 128]', 'dropout': 0.15904191165268608, 'batch_norm': False, 'graph_on': True, 'source': 'grm', 'knn_k': 4, 'weighted_edges': True, 'symmetrize_mode': 'union', 'lr': 5.9430485229770615e-05, 'weight_decay': 3.5091215635370896e-06, 'epochs': 263, 'use_snp_selection': True, 'num_snps': 4000}. Best is trial 32 with value: 0.3235889971256256.
[I 2025-10-16 14:27:20,295] Trial 40 finished with value: 0.2817940592765808 and parameters: {'hidden_dims': '[256, 128, 64]', 'dropout': 0.10056011768772666, 'batch_norm': False, 'graph_on': True, 'source': 'grm', 'knn_k': 3, 'weighted_edges': True, 'symmetrize_mode': 'mutual', 'lr': 0.0001424115721751591, 'weight_decay': 4.3534890052316087e-07, 'epochs': 131, 'use_snp_selection': True, 'num_snps': 56000}. Best is trial 32 with value: 0.3235889971256256.
[I 2025-10-16 14:27:55,573] Trial 41 finished with value: 0.3181620955467224 and parameters: {'hidden_dims': '[512, 128]', 'dropout': 0.5421316471588582, 'batch_norm': False, 'graph_on': True, 'source': 'grm', 'knn_k': 4, 'weighted_edges': False, 'symmetrize_mode': 'union', 'lr': 9.491655182184808e-06, 'weight_decay': 2.660843784458433e-06, 'epochs': 116, 'use_snp_selection': True, 'num_snps': 32000}. Best is trial 32 with value: 0.3235889971256256.
[I 2025-10-16 14:28:30,597] Trial 42 finished with value: 0.31531110405921936 and parameters: {'hidden_dims': '[512, 128]', 'dropout': 0.5663215679760216, 'batch_norm': False, 'graph_on': True, 'source': 'grm', 'knn_k': 4, 'weighted_edges': False, 'symmetrize_mode': 'union', 'lr': 1.3523903159282604e-05, 'weight_decay': 1.4757447113694103e-06, 'epochs': 161, 'use_snp_selection': True, 'num_snps': 24000}. Best is trial 32 with value: 0.3235889971256256.
[I 2025-10-16 14:29:01,880] Trial 43 finished with value: 0.32611833810806273 and parameters: {'hidden_dims': '[512, 128]', 'dropout': 0.5115670300089683, 'batch_norm': False, 'graph_on': True, 'source': 'grm', 'knn_k': 4, 'weighted_edges': True, 'symmetrize_mode': 'union', 'lr': 9.336018238221805e-06, 'weight_decay': 3.1718699815435147e-06, 'epochs': 86, 'use_snp_selection': True, 'num_snps': 32000}. Best is trial 43 with value: 0.32611833810806273.
[I 2025-10-16 14:29:32,500] Trial 44 finished with value: 0.31039648652076723 and parameters: {'hidden_dims': '[512, 128]', 'dropout': 0.5301050146164379, 'batch_norm': False, 'graph_on': True, 'source': 'grm', 'knn_k': 5, 'weighted_edges': False, 'symmetrize_mode': 'union', 'lr': 9.218591717239311e-06, 'weight_decay': 1.0909805161919876e-05, 'epochs': 82, 'use_snp_selection': True, 'num_snps': 32000}. Best is trial 43 with value: 0.32611833810806273.
[I 2025-10-16 14:29:56,777] Trial 45 finished with value: 0.2878699958324432 and parameters: {'hidden_dims': '[512, 128]', 'dropout': 0.5555293646116567, 'batch_norm': False, 'graph_on': True, 'source': 'grm', 'knn_k': 4, 'weighted_edges': True, 'symmetrize_mode': 'union', 'lr': 7.91376050433127e-06, 'weight_decay': 3.27885534354558e-06, 'epochs': 38, 'use_snp_selection': True, 'num_snps': 30000}. Best is trial 43 with value: 0.32611833810806273.
[I 2025-10-16 14:30:17,469] Trial 46 finished with value: 0.24106302559375764 and parameters: {'hidden_dims': '[512, 128]', 'dropout': 0.5053188047960192, 'batch_norm': False, 'graph_on': True, 'source': 'grm', 'knn_k': 5, 'weighted_edges': False, 'symmetrize_mode': 'union', 'lr': 2.6451524405790376e-06, 'weight_decay': 1.289431263067349e-06, 'epochs': 91, 'use_snp_selection': True, 'num_snps': 8000}. Best is trial 43 with value: 0.32611833810806273.
[I 2025-10-16 14:30:40,306] Trial 47 finished with value: 0.2614495873451233 and parameters: {'hidden_dims': '[512, 128]', 'dropout': 0.437265268166609, 'batch_norm': False, 'graph_on': True, 'source': 'grm', 'knn_k': 4, 'weighted_edges': True, 'symmetrize_mode': 'union', 'lr': 2.0740162235773995e-06, 'weight_decay': 2.5075573343806036e-06, 'epochs': 69, 'use_snp_selection': True, 'num_snps': 16000}. Best is trial 43 with value: 0.32611833810806273.
