[I 2025-10-17 03:05:47,418] Trial 0 finished with value: 0.2277306854724884 and parameters: {'hidden_dims': '[128, 64]', 'dropout': 0.199031432379812, 'batch_norm': True, 'graph_on': True, 'source': 'grm', 'knn_k': 1, 'weighted_edges': True, 'symmetrize_mode': 'union', 'lr': 0.0002740708741343236, 'weight_decay': 2.819059662190987e-05, 'epochs': 256, 'use_snp_selection': True, 'num_snps': 18000}. Best is trial 0 with value: 0.2277306854724884.
[I 2025-10-17 03:06:06,871] Trial 1 finished with value: 0.2683204233646393 and parameters: {'hidden_dims': '[128, 64]', 'dropout': 0.32091658721149807, 'batch_norm': False, 'graph_on': True, 'source': 'grm', 'knn_k': 4, 'weighted_edges': False, 'symmetrize_mode': 'mutual', 'lr': 0.0005320428882732732, 'weight_decay': 1.89210117736594e-06, 'epochs': 40, 'use_snp_selection': True, 'num_snps': 20000}. Best is trial 1 with value: 0.2683204233646393.
[I 2025-10-17 03:06:33,064] Trial 2 finished with value: 0.26175199151039125 and parameters: {'hidden_dims': '[256, 128]', 'dropout': 0.19947376983940615, 'batch_norm': True, 'graph_on': True, 'source': 'grm', 'knn_k': 6, 'weighted_edges': True, 'symmetrize_mode': 'mutual', 'lr': 1.5051775490493461e-05, 'weight_decay': 2.3650563799866155e-07, 'epochs': 289, 'use_snp_selection': True, 'num_snps': 10000}. Best is trial 1 with value: 0.2683204233646393.
[I 2025-10-17 03:06:55,248] Trial 3 finished with value: 0.3146248996257782 and parameters: {'hidden_dims': '[512, 256]', 'dropout': 0.3986858241154422, 'batch_norm': True, 'graph_on': True, 'source': 'grm', 'knn_k': 5, 'weighted_edges': True, 'symmetrize_mode': 'union', 'lr': 9.821050313409216e-06, 'weight_decay': 0.00012454353397331594, 'epochs': 23, 'use_snp_selection': True, 'num_snps': 26000}. Best is trial 3 with value: 0.3146248996257782.
[I 2025-10-17 03:07:30,984] Trial 4 finished with value: 0.30709107518196105 and parameters: {'hidden_dims': '[256, 128, 64]', 'dropout': 0.5390483213624292, 'batch_norm': False, 'graph_on': True, 'source': 'grm', 'knn_k': 4, 'weighted_edges': False, 'symmetrize_mode': 'mutual', 'lr': 8.11311593386297e-06, 'weight_decay': 9.296158109581328e-07, 'epochs': 200, 'use_snp_selection': True, 'num_snps': 34000}. Best is trial 3 with value: 0.3146248996257782.
[I 2025-10-17 03:07:59,430] Trial 5 finished with value: 0.24131702184677123 and parameters: {'hidden_dims': '[512, 256]', 'dropout': 0.528994345325027, 'batch_norm': True, 'graph_on': True, 'source': 'grm', 'knn_k': 6, 'weighted_edges': True, 'symmetrize_mode': 'union', 'lr': 1.164930281795184e-06, 'weight_decay': 0.00020941850571250828, 'epochs': 21, 'use_snp_selection': True, 'num_snps': 60000}. Best is trial 3 with value: 0.3146248996257782.
[I 2025-10-17 03:08:39,184] Trial 6 finished with value: 0.25379072725772855 and parameters: {'hidden_dims': '[512, 256]', 'dropout': 0.4244699923044819, 'batch_norm': True, 'graph_on': True, 'source': 'grm', 'knn_k': 2, 'weighted_edges': True, 'symmetrize_mode': 'union', 'lr': 5.719516246965409e-05, 'weight_decay': 0.0007446207004743823, 'epochs': 111, 'use_snp_selection': True, 'num_snps': 40000}. Best is trial 3 with value: 0.3146248996257782.
[I 2025-10-17 03:09:26,142] Trial 7 finished with value: 0.3288097620010376 and parameters: {'hidden_dims': '[512, 64]', 'dropout': 0.3607638271959879, 'batch_norm': True, 'graph_on': True, 'source': 'grm', 'knn_k': 7, 'weighted_edges': True, 'symmetrize_mode': 'union', 'lr': 2.400010639603384e-06, 'weight_decay': 3.556750757572288e-05, 'epochs': 124, 'use_snp_selection': True, 'num_snps': 48000}. Best is trial 7 with value: 0.3288097620010376.
[I 2025-10-17 03:10:17,621] Trial 8 finished with value: 0.2947212278842926 and parameters: {'hidden_dims': '[512, 64]', 'dropout': 0.2928493908415588, 'batch_norm': False, 'graph_on': True, 'source': 'grm', 'knn_k': 7, 'weighted_edges': False, 'symmetrize_mode': 'union', 'lr': 1.1043450617383017e-06, 'weight_decay': 1.511705358910635e-05, 'epochs': 135, 'use_snp_selection': True, 'num_snps': 52000}. Best is trial 7 with value: 0.3288097620010376.
[I 2025-10-17 03:11:47,304] Trial 9 finished with value: 0.263125416636467 and parameters: {'hidden_dims': '[512, 64]', 'dropout': 0.1194044225528384, 'batch_norm': True, 'graph_on': True, 'source': 'grm', 'knn_k': 7, 'weighted_edges': True, 'symmetrize_mode': 'union', 'lr': 3.754731899410945e-06, 'weight_decay': 3.797795084560882e-06, 'epochs': 347, 'use_snp_selection': True, 'num_snps': 46000}. Best is trial 7 with value: 0.3288097620010376.
[I 2025-10-17 03:12:35,240] Trial 10 finished with value: 0.30099705457687376 and parameters: {'hidden_dims': '[512, 128]', 'dropout': 0.4648806431230973, 'batch_norm': False, 'graph_on': True, 'source': 'grm', 'knn_k': 3, 'weighted_edges': False, 'symmetrize_mode': 'mutual', 'lr': 8.29984835644417e-05, 'weight_decay': 6.552467860785973e-05, 'epochs': 103, 'use_snp_selection': True, 'num_snps': 60000}. Best is trial 7 with value: 0.3288097620010376.
[I 2025-10-17 03:13:02,795] Trial 11 finished with value: 0.3142538547515869 and parameters: {'hidden_dims': '[512, 256]', 'dropout': 0.3858350368681998, 'batch_norm': True, 'graph_on': True, 'source': 'grm', 'knn_k': 5, 'weighted_edges': True, 'symmetrize_mode': 'union', 'lr': 4.678770236916612e-06, 'weight_decay': 0.00011651623597470792, 'epochs': 70, 'use_snp_selection': True, 'num_snps': 26000}. Best is trial 7 with value: 0.3288097620010376.
[I 2025-10-17 03:13:48,505] Trial 12 finished with value: 0.2994938611984253 and parameters: {'hidden_dims': '[512, 64]', 'dropout': 0.3169743263279262, 'batch_norm': True, 'graph_on': True, 'source': 'grm', 'knn_k': 5, 'weighted_edges': True, 'symmetrize_mode': 'union', 'lr': 1.352570837276448e-05, 'weight_decay': 0.0005455735680336306, 'epochs': 177, 'use_snp_selection': True, 'num_snps': 34000}. Best is trial 7 with value: 0.3288097620010376.
[I 2025-10-17 03:14:09,644] Trial 13 finished with value: 0.2712488263845444 and parameters: {'hidden_dims': '[256, 128, 64]', 'dropout': 0.4568969122225589, 'batch_norm': True, 'graph_on': True, 'source': 'grm', 'knn_k': 6, 'weighted_edges': True, 'symmetrize_mode': 'union', 'lr': 2.7285373386772434e-06, 'weight_decay': 3.809440142473118e-05, 'epochs': 165, 'use_snp_selection': True, 'num_snps': 4000}. Best is trial 7 with value: 0.3288097620010376.
[I 2025-10-17 03:14:43,357] Trial 14 finished with value: 0.29908007979393003 and parameters: {'hidden_dims': '[512, 128]', 'dropout': 0.3659865996532051, 'batch_norm': True, 'graph_on': True, 'source': 'grm', 'knn_k': 5, 'weighted_edges': True, 'symmetrize_mode': 'union', 'lr': 3.071793983818403e-05, 'weight_decay': 6.9152673551190724e-06, 'epochs': 59, 'use_snp_selection': True, 'num_snps': 48000}. Best is trial 7 with value: 0.3288097620010376.
[I 2025-10-17 03:15:03,314] Trial 15 finished with value: 0.1730873852968216 and parameters: {'hidden_dims': '[256, 128]', 'dropout': 0.2478701895191911, 'batch_norm': True, 'graph_on': True, 'source': 'grm', 'knn_k': 7, 'weighted_edges': True, 'symmetrize_mode': 'union', 'lr': 2.256893283742107e-06, 'weight_decay': 0.00012135626827276385, 'epochs': 12, 'use_snp_selection': True, 'num_snps': 26000}. Best is trial 7 with value: 0.3288097620010376.
[I 2025-10-17 03:15:58,524] Trial 16 finished with value: 0.26867138743400576 and parameters: {'hidden_dims': '[512, 64]', 'dropout': 0.40692704837207677, 'batch_norm': True, 'graph_on': True, 'source': 'grm', 'knn_k': 3, 'weighted_edges': True, 'symmetrize_mode': 'union', 'lr': 1.0339930351440496e-05, 'weight_decay': 0.00027478619033360294, 'epochs': 219, 'use_snp_selection': True, 'num_snps': 38000}. Best is trial 7 with value: 0.3288097620010376.
[I 2025-10-17 03:16:22,392] Trial 17 finished with value: 0.325835257768631 and parameters: {'hidden_dims': '[512, 256]', 'dropout': 0.5741974551696398, 'batch_norm': True, 'graph_on': True, 'source': 'grm', 'knn_k': 6, 'weighted_edges': True, 'symmetrize_mode': 'union', 'lr': 3.3512851311424045e-05, 'weight_decay': 1.6920616384215465e-05, 'epochs': 89, 'use_snp_selection': True, 'num_snps': 14000}. Best is trial 7 with value: 0.3288097620010376.
[I 2025-10-17 03:16:46,120] Trial 18 finished with value: 0.31654911637306216 and parameters: {'hidden_dims': '[512, 64]', 'dropout': 0.5715273373099197, 'batch_norm': False, 'graph_on': True, 'source': 'grm', 'knn_k': 6, 'weighted_edges': False, 'symmetrize_mode': 'mutual', 'lr': 0.00011091059005639674, 'weight_decay': 1.1548552564797604e-05, 'epochs': 95, 'use_snp_selection': True, 'num_snps': 14000}. Best is trial 7 with value: 0.3288097620010376.
[I 2025-10-17 03:17:06,334] Trial 19 finished with value: 0.33331512212753295 and parameters: {'hidden_dims': '[512, 256]', 'dropout': 0.5014639212644008, 'batch_norm': True, 'graph_on': True, 'source': 'grm', 'knn_k': 7, 'weighted_edges': True, 'symmetrize_mode': 'union', 'lr': 3.200497413621636e-05, 'weight_decay': 5.882345609145746e-07, 'epochs': 143, 'use_snp_selection': True, 'num_snps': 2000}. Best is trial 19 with value: 0.33331512212753295.
[I 2025-10-17 03:17:26,185] Trial 20 finished with value: 0.3316112756729126 and parameters: {'hidden_dims': '[128, 64]', 'dropout': 0.4955643105403838, 'batch_norm': True, 'graph_on': True, 'source': 'grm', 'knn_k': 7, 'weighted_edges': True, 'symmetrize_mode': 'union', 'lr': 2.7564205373405815e-05, 'weight_decay': 1.9103894965733393e-07, 'epochs': 148, 'use_snp_selection': True, 'num_snps': 6000}. Best is trial 19 with value: 0.33331512212753295.
[I 2025-10-17 03:17:45,430] Trial 21 finished with value: 0.3271352291107178 and parameters: {'hidden_dims': '[128, 64]', 'dropout': 0.4941683978775899, 'batch_norm': True, 'graph_on': True, 'source': 'grm', 'knn_k': 7, 'weighted_edges': True, 'symmetrize_mode': 'union', 'lr': 0.00017931821285320257, 'weight_decay': 1.225206879061961e-07, 'epochs': 146, 'use_snp_selection': True, 'num_snps': 4000}. Best is trial 19 with value: 0.33331512212753295.
[I 2025-10-17 03:18:04,172] Trial 22 finished with value: 0.32538147568702697 and parameters: {'hidden_dims': '[128, 64]', 'dropout': 0.5035015455524068, 'batch_norm': True, 'graph_on': True, 'source': 'grm', 'knn_k': 7, 'weighted_edges': True, 'symmetrize_mode': 'union', 'lr': 2.4885667050638348e-05, 'weight_decay': 5.794372451647606e-07, 'epochs': 139, 'use_snp_selection': True, 'num_snps': 2000}. Best is trial 19 with value: 0.33331512212753295.
[I 2025-10-17 03:18:26,416] Trial 23 finished with value: 0.27698310017585753 and parameters: {'hidden_dims': '[128, 64]', 'dropout': 0.45065962525361647, 'batch_norm': True, 'graph_on': True, 'source': 'grm', 'knn_k': 7, 'weighted_edges': True, 'symmetrize_mode': 'union', 'lr': 0.0009793199542474462, 'weight_decay': 3.714056543622424e-07, 'epochs': 213, 'use_snp_selection': True, 'num_snps': 10000}. Best is trial 19 with value: 0.33331512212753295.
[I 2025-10-17 03:18:47,227] Trial 24 finished with value: 0.32795299887657164 and parameters: {'hidden_dims': '[256, 128]', 'dropout': 0.5993105810954936, 'batch_norm': True, 'graph_on': True, 'source': 'grm', 'knn_k': 6, 'weighted_edges': True, 'symmetrize_mode': 'union', 'lr': 4.3947835158029936e-05, 'weight_decay': 1.205362609850014e-07, 'epochs': 129, 'use_snp_selection': True, 'num_snps': 8000}. Best is trial 19 with value: 0.33331512212753295.
[I 2025-10-17 03:19:46,838] Trial 25 finished with value: 0.3090521216392517 and parameters: {'hidden_dims': '[512, 128]', 'dropout': 0.4953677871026087, 'batch_norm': True, 'graph_on': True, 'source': 'grm', 'knn_k': 7, 'weighted_edges': True, 'symmetrize_mode': 'union', 'lr': 2.0463570704610496e-05, 'weight_decay': 1.8649467141177418e-06, 'epochs': 166, 'use_snp_selection': True, 'num_snps': 54000}. Best is trial 19 with value: 0.33331512212753295.
[I 2025-10-17 03:20:25,102] Trial 26 finished with value: 0.31149266958236693 and parameters: {'hidden_dims': '[256, 128, 64]', 'dropout': 0.3421812627977955, 'batch_norm': False, 'graph_on': True, 'source': 'grm', 'knn_k': 6, 'weighted_edges': False, 'symmetrize_mode': 'mutual', 'lr': 5.956516844462453e-06, 'weight_decay': 9.401082074529535e-07, 'epochs': 192, 'use_snp_selection': True, 'num_snps': 40000}. Best is trial 19 with value: 0.33331512212753295.
[I 2025-10-17 03:21:05,203] Trial 27 finished with value: 0.27703813910484315 and parameters: {'hidden_dims': '[512, 64]', 'dropout': 0.26757411280169435, 'batch_norm': True, 'graph_on': True, 'source': 'grm', 'knn_k': 7, 'weighted_edges': True, 'symmetrize_mode': 'union', 'lr': 6.93654083400581e-05, 'weight_decay': 5.161930867201549e-06, 'epochs': 243, 'use_snp_selection': True, 'num_snps': 18000}. Best is trial 19 with value: 0.33331512212753295.
[I 2025-10-17 03:21:23,450] Trial 28 finished with value: 0.32029099464416505 and parameters: {'hidden_dims': '[128, 64]', 'dropout': 0.5387204821696994, 'batch_norm': True, 'graph_on': True, 'source': 'grm', 'knn_k': 5, 'weighted_edges': True, 'symmetrize_mode': 'union', 'lr': 0.00015580405495432866, 'weight_decay': 2.448952153163262e-07, 'epochs': 71, 'use_snp_selection': True, 'num_snps': 6000}. Best is trial 19 with value: 0.33331512212753295.
[I 2025-10-17 03:21:56,504] Trial 29 finished with value: 0.2399924397468567 and parameters: {'hidden_dims': '[512, 256]', 'dropout': 0.4299879447141274, 'batch_norm': True, 'graph_on': True, 'source': 'grm', 'knn_k': 2, 'weighted_edges': True, 'symmetrize_mode': 'union', 'lr': 0.0002918030294202062, 'weight_decay': 2.2603523000820713e-06, 'epochs': 238, 'use_snp_selection': True, 'num_snps': 14000}. Best is trial 19 with value: 0.33331512212753295.
[I 2025-10-17 03:22:16,857] Trial 30 finished with value: 0.2012701451778412 and parameters: {'hidden_dims': '[128, 64]', 'dropout': 0.11858828401890467, 'batch_norm': True, 'graph_on': True, 'source': 'grm', 'knn_k': 1, 'weighted_edges': True, 'symmetrize_mode': 'union', 'lr': 2.003167580366841e-06, 'weight_decay': 3.691303137730906e-05, 'epochs': 290, 'use_snp_selection': True, 'num_snps': 2000}. Best is trial 19 with value: 0.33331512212753295.
[I 2025-10-17 03:22:37,496] Trial 31 finished with value: 0.3349620997905731 and parameters: {'hidden_dims': '[256, 128]', 'dropout': 0.5795406786580639, 'batch_norm': True, 'graph_on': True, 'source': 'grm', 'knn_k': 6, 'weighted_edges': True, 'symmetrize_mode': 'union', 'lr': 4.291439374725157e-05, 'weight_decay': 1.0847024796281629e-07, 'epochs': 123, 'use_snp_selection': True, 'num_snps': 8000}. Best is trial 31 with value: 0.3349620997905731.
[I 2025-10-17 03:23:02,523] Trial 32 finished with value: 0.31912568807601926 and parameters: {'hidden_dims': '[256, 128]', 'dropout': 0.5962635341406939, 'batch_norm': True, 'graph_on': True, 'source': 'grm', 'knn_k': 7, 'weighted_edges': True, 'symmetrize_mode': 'union', 'lr': 4.917716499261556e-05, 'weight_decay': 1.0031018902728861e-07, 'epochs': 114, 'use_snp_selection': True, 'num_snps': 22000}. Best is trial 31 with value: 0.3349620997905731.
[I 2025-10-17 03:23:24,803] Trial 33 finished with value: 0.3278834342956543 and parameters: {'hidden_dims': '[256, 128]', 'dropout': 0.5172234438703074, 'batch_norm': True, 'graph_on': True, 'source': 'grm', 'knn_k': 6, 'weighted_edges': True, 'symmetrize_mode': 'union', 'lr': 2.1293654312696602e-05, 'weight_decay': 2.3366819591584743e-07, 'epochs': 158, 'use_snp_selection': True, 'num_snps': 10000}. Best is trial 31 with value: 0.3349620997905731.
[I 2025-10-17 03:23:48,956] Trial 34 finished with value: 0.28825504183769224 and parameters: {'hidden_dims': '[256, 128]', 'dropout': 0.5579865666375935, 'batch_norm': True, 'graph_on': True, 'source': 'grm', 'knn_k': 7, 'weighted_edges': True, 'symmetrize_mode': 'mutual', 'lr': 0.00031932088802963854, 'weight_decay': 3.9178027452944326e-07, 'epochs': 126, 'use_snp_selection': True, 'num_snps': 18000}. Best is trial 31 with value: 0.3349620997905731.
[I 2025-10-17 03:24:09,606] Trial 35 finished with value: 0.31478204727172854 and parameters: {'hidden_dims': '[128, 64]', 'dropout': 0.4731305913070295, 'batch_norm': False, 'graph_on': True, 'source': 'grm', 'knn_k': 6, 'weighted_edges': False, 'symmetrize_mode': 'union', 'lr': 1.549544128408184e-05, 'weight_decay': 1.93112288620817e-07, 'epochs': 182, 'use_snp_selection': True, 'num_snps': 8000}. Best is trial 31 with value: 0.3349620997905731.
[I 2025-10-17 03:24:28,582] Trial 36 finished with value: 0.2712162613868713 and parameters: {'hidden_dims': '[256, 128]', 'dropout': 0.5484816345686963, 'batch_norm': True, 'graph_on': True, 'source': 'grm', 'knn_k': 4, 'weighted_edges': True, 'symmetrize_mode': 'mutual', 'lr': 0.00011322883491315538, 'weight_decay': 7.450727023739341e-07, 'epochs': 41, 'use_snp_selection': True, 'num_snps': 12000}. Best is trial 31 with value: 0.3349620997905731.
[I 2025-10-17 03:25:02,680] Trial 37 finished with value: 0.312681782245636 and parameters: {'hidden_dims': '[512, 256]', 'dropout': 0.17452840402030884, 'batch_norm': True, 'graph_on': True, 'source': 'grm', 'knn_k': 6, 'weighted_edges': True, 'symmetrize_mode': 'union', 'lr': 7.07667659711686e-06, 'weight_decay': 1.3611976155994614e-06, 'epochs': 152, 'use_snp_selection': True, 'num_snps': 22000}. Best is trial 31 with value: 0.3349620997905731.
[I 2025-10-17 03:25:22,945] Trial 38 finished with value: 0.31905664801597594 and parameters: {'hidden_dims': '[512, 256]', 'dropout': 0.22491593397057957, 'batch_norm': False, 'graph_on': True, 'source': 'grm', 'knn_k': 7, 'weighted_edges': False, 'symmetrize_mode': 'union', 'lr': 4.459592293105337e-05, 'weight_decay': 4.022612560073496e-07, 'epochs': 87, 'use_snp_selection': True, 'num_snps': 6000}. Best is trial 31 with value: 0.3349620997905731.
[I 2025-10-17 03:25:48,286] Trial 39 finished with value: 0.30029332637786865 and parameters: {'hidden_dims': '[512, 64]', 'dropout': 0.4279590121978444, 'batch_norm': True, 'graph_on': True, 'source': 'grm', 'knn_k': 4, 'weighted_edges': True, 'symmetrize_mode': 'union', 'lr': 1.1405273434307873e-05, 'weight_decay': 1.9249058268213699e-07, 'epochs': 43, 'use_snp_selection': True, 'num_snps': 30000}. Best is trial 31 with value: 0.3349620997905731.
[I 2025-10-17 03:26:22,539] Trial 40 finished with value: 0.24075325429439545 and parameters: {'hidden_dims': '[256, 128, 64]', 'dropout': 0.48539172235965394, 'batch_norm': True, 'graph_on': True, 'source': 'grm', 'knn_k': 5, 'weighted_edges': True, 'symmetrize_mode': 'mutual', 'lr': 8.262997439660374e-05, 'weight_decay': 2.5720936379451195e-05, 'epochs': 122, 'use_snp_selection': True, 'num_snps': 46000}. Best is trial 31 with value: 0.3349620997905731.
[I 2025-10-17 03:26:43,522] Trial 41 finished with value: 0.32546895146369936 and parameters: {'hidden_dims': '[256, 128]', 'dropout': 0.5787338816520244, 'batch_norm': True, 'graph_on': True, 'source': 'grm', 'knn_k': 6, 'weighted_edges': True, 'symmetrize_mode': 'union', 'lr': 3.8005998549456784e-05, 'weight_decay': 1.4157044088700017e-07, 'epochs': 135, 'use_snp_selection': True, 'num_snps': 8000}. Best is trial 31 with value: 0.3349620997905731.
[I 2025-10-17 03:27:01,897] Trial 42 finished with value: 0.3331451892852783 and parameters: {'hidden_dims': '[256, 128]', 'dropout': 0.5962238256466006, 'batch_norm': True, 'graph_on': True, 'source': 'grm', 'knn_k': 6, 'weighted_edges': True, 'symmetrize_mode': 'union', 'lr': 5.969058587735471e-05, 'weight_decay': 3.0311220515731654e-07, 'epochs': 106, 'use_snp_selection': True, 'num_snps': 2000}. Best is trial 31 with value: 0.3349620997905731.
[I 2025-10-17 03:27:20,361] Trial 43 finished with value: 0.31314738988876345 and parameters: {'hidden_dims': '[256, 128]', 'dropout': 0.5513244624724339, 'batch_norm': True, 'graph_on': True, 'source': 'grm', 'knn_k': 7, 'weighted_edges': True, 'symmetrize_mode': 'union', 'lr': 1.728492285962147e-05, 'weight_decay': 4.858885014179985e-07, 'epochs': 106, 'use_snp_selection': True, 'num_snps': 2000}. Best is trial 31 with value: 0.3349620997905731.
[I 2025-10-17 03:27:40,148] Trial 44 finished with value: 0.33132686614990237 and parameters: {'hidden_dims': '[256, 128]', 'dropout': 0.5268944320511638, 'batch_norm': True, 'graph_on': True, 'source': 'grm', 'knn_k': 7, 'weighted_edges': True, 'symmetrize_mode': 'union', 'lr': 6.065798947564021e-05, 'weight_decay': 6.677997381108009e-05, 'epochs': 112, 'use_snp_selection': True, 'num_snps': 6000}. Best is trial 31 with value: 0.3349620997905731.
[I 2025-10-17 03:27:58,691] Trial 45 finished with value: 0.3238257527351379 and parameters: {'hidden_dims': '[256, 128]', 'dropout': 0.5220116803719956, 'batch_norm': True, 'graph_on': True, 'source': 'grm', 'knn_k': 6, 'weighted_edges': True, 'symmetrize_mode': 'union', 'lr': 6.24942800054274e-05, 'weight_decay': 1.1415591177480843e-06, 'epochs': 64, 'use_snp_selection': True, 'num_snps': 6000}. Best is trial 31 with value: 0.3349620997905731.
[I 2025-10-17 03:28:22,312] Trial 46 finished with value: 0.3321767866611481 and parameters: {'hidden_dims': '[256, 128]', 'dropout': 0.5221919109531201, 'batch_norm': True, 'graph_on': True, 'source': 'grm', 'knn_k': 7, 'weighted_edges': True, 'symmetrize_mode': 'union', 'lr': 2.6426620655748344e-05, 'weight_decay': 2.775375660056366e-07, 'epochs': 174, 'use_snp_selection': True, 'num_snps': 12000}. Best is trial 31 with value: 0.3349620997905731.
[I 2025-10-17 03:28:47,862] Trial 47 finished with value: 0.3214568495750427 and parameters: {'hidden_dims': '[256, 128]', 'dropout': 0.5885155065435083, 'batch_norm': False, 'graph_on': True, 'source': 'grm', 'knn_k': 5, 'weighted_edges': False, 'symmetrize_mode': 'union', 'lr': 2.7771404526927823e-05, 'weight_decay': 3.298177569637599e-07, 'epochs': 180, 'use_snp_selection': True, 'num_snps': 16000}. Best is trial 31 with value: 0.3349620997905731.
