[I 2025-10-16 16:01:01,184] Trial 42 finished with value: 0.3382022142410278 and parameters: {'hidden_dims': '[512, 256]', 'dropout': 0.3241521384424838, 'batch_norm': False, 'graph_on': True, 'source': 'grm', 'knn_k': 2, 'weighted_edges': False, 'symmetrize_mode': 'union', 'lr': 1.1847709409799823e-05, 'weight_decay': 0.0006419388840016628, 'epochs': 130, 'use_snp_selection': True, 'num_snps': 32000}. Best is trial 23 with value: 0.3423058807849884.
[I 2025-10-16 16:01:35,731] Trial 43 finished with value: 0.34330337047576903 and parameters: {'hidden_dims': '[512, 256]', 'dropout': 0.24954850826320066, 'batch_norm': False, 'graph_on': True, 'source': 'grm', 'knn_k': 1, 'weighted_edges': False, 'symmetrize_mode': 'union', 'lr': 3.4707524576687097e-06, 'weight_decay': 6.579512396046858e-06, 'epochs': 143, 'use_snp_selection': True, 'num_snps': 26000}. Best is trial 43 with value: 0.34330337047576903.
[I 2025-10-16 16:02:09,943] Trial 44 finished with value: 0.34192023873329164 and parameters: {'hidden_dims': '[512, 256]', 'dropout': 0.24440577143242576, 'batch_norm': False, 'graph_on': True, 'source': 'grm', 'knn_k': 1, 'weighted_edges': False, 'symmetrize_mode': 'union', 'lr': 3.5976821260955907e-06, 'weight_decay': 2.3034556397802026e-06, 'epochs': 160, 'use_snp_selection': True, 'num_snps': 24000}. Best is trial 43 with value: 0.34330337047576903.
[I 2025-10-16 16:02:46,179] Trial 45 finished with value: 0.3421539545059204 and parameters: {'hidden_dims': '[512, 256]', 'dropout': 0.2500140197750677, 'batch_norm': False, 'graph_on': True, 'source': 'grm', 'knn_k': 1, 'weighted_edges': False, 'symmetrize_mode': 'union', 'lr': 3.3204532544953824e-06, 'weight_decay': 2.397675382777582e-06, 'epochs': 158, 'use_snp_selection': True, 'num_snps': 26000}. Best is trial 43 with value: 0.34330337047576903.
[I 2025-10-16 16:03:43,682] Trial 46 finished with value: 0.3464482545852661 and parameters: {'hidden_dims': '[512, 256]', 'dropout': 0.25984094530569285, 'batch_norm': False, 'graph_on': True, 'source': 'grm', 'knn_k': 1, 'weighted_edges': False, 'symmetrize_mode': 'union', 'lr': 1.1026569036570992e-06, 'weight_decay': 2.601489980000073e-06, 'epochs': 343, 'use_snp_selection': True, 'num_snps': 26000}. Best is trial 46 with value: 0.3464482545852661.
[I 2025-10-16 16:04:43,460] Trial 47 finished with value: 0.3451249897480011 and parameters: {'hidden_dims': '[512, 256]', 'dropout': 0.24890049046342078, 'batch_norm': False, 'graph_on': True, 'source': 'grm', 'knn_k': 1, 'weighted_edges': False, 'symmetrize_mode': 'union', 'lr': 1.2339880872314726e-06, 'weight_decay': 7.908520454522966e-07, 'epochs': 343, 'use_snp_selection': True, 'num_snps': 28000}. Best is trial 46 with value: 0.3464482545852661.
[I 2025-10-16 16:05:45,801] Trial 48 finished with value: 0.3604872763156891 and parameters: {'hidden_dims': '[512, 256]', 'dropout': 0.257802318726976, 'batch_norm': False, 'graph_on': True, 'source': 'grm', 'knn_k': 1, 'weighted_edges': False, 'symmetrize_mode': 'mutual', 'lr': 1.1183567552125236e-06, 'weight_decay': 8.928142687904343e-07, 'epochs': 337, 'use_snp_selection': True, 'num_snps': 30000}. Best is trial 48 with value: 0.3604872763156891.
[I 2025-10-16 16:06:48,976] Trial 49 finished with value: 0.35707170367240904 and parameters: {'hidden_dims': '[512, 256]', 'dropout': 0.20267810486396104, 'batch_norm': False, 'graph_on': True, 'source': 'grm', 'knn_k': 1, 'weighted_edges': False, 'symmetrize_mode': 'mutual', 'lr': 1.023425300425517e-06, 'weight_decay': 7.359840590999623e-07, 'epochs': 343, 'use_snp_selection': True, 'num_snps': 30000}. Best is trial 48 with value: 0.3604872763156891.
[I 2025-10-16 16:07:52,560] Trial 50 finished with value: 0.3587030291557312 and parameters: {'hidden_dims': '[512, 256]', 'dropout': 0.20159387814320515, 'batch_norm': False, 'graph_on': True, 'source': 'grm', 'knn_k': 1, 'weighted_edges': False, 'symmetrize_mode': 'mutual', 'lr': 1.1110749133601857e-06, 'weight_decay': 8.497655691515755e-07, 'epochs': 347, 'use_snp_selection': True, 'num_snps': 30000}. Best is trial 48 with value: 0.3604872763156891.
[I 2025-10-16 16:08:56,340] Trial 51 finished with value: 0.35424641370773313 and parameters: {'hidden_dims': '[512, 256]', 'dropout': 0.2056867192860952, 'batch_norm': False, 'graph_on': True, 'source': 'grm', 'knn_k': 1, 'weighted_edges': False, 'symmetrize_mode': 'mutual', 'lr': 1.0093711638119886e-06, 'weight_decay': 8.261169129659877e-07, 'epochs': 348, 'use_snp_selection': True, 'num_snps': 30000}. Best is trial 48 with value: 0.3604872763156891.
[I 2025-10-16 16:10:00,058] Trial 52 finished with value: 0.35870993733406065 and parameters: {'hidden_dims': '[512, 256]', 'dropout': 0.19926460081243103, 'batch_norm': False, 'graph_on': True, 'source': 'grm', 'knn_k': 1, 'weighted_edges': False, 'symmetrize_mode': 'mutual', 'lr': 1.0376514131561252e-06, 'weight_decay': 8.761618717461984e-07, 'epochs': 346, 'use_snp_selection': True, 'num_snps': 30000}. Best is trial 48 with value: 0.3604872763156891.
[I 2025-10-16 16:11:00,869] Trial 53 finished with value: 0.36012760996818544 and parameters: {'hidden_dims': '[512, 256]', 'dropout': 0.19457751642804128, 'batch_norm': False, 'graph_on': True, 'source': 'grm', 'knn_k': 1, 'weighted_edges': False, 'symmetrize_mode': 'mutual', 'lr': 1.6362618512809184e-06, 'weight_decay': 1.0411851144990473e-06, 'epochs': 323, 'use_snp_selection': True, 'num_snps': 30000}. Best is trial 48 with value: 0.3604872763156891.
[I 2025-10-16 16:12:01,166] Trial 54 finished with value: 0.3636793613433838 and parameters: {'hidden_dims': '[512, 256]', 'dropout': 0.20493656907184712, 'batch_norm': False, 'graph_on': True, 'source': 'grm', 'knn_k': 1, 'weighted_edges': False, 'symmetrize_mode': 'mutual', 'lr': 1.730106607693227e-06, 'weight_decay': 1.1100397906856186e-06, 'epochs': 321, 'use_snp_selection': True, 'num_snps': 30000}. Best is trial 54 with value: 0.3636793613433838.
[I 2025-10-16 16:13:03,296] Trial 55 finished with value: 0.3580134749412537 and parameters: {'hidden_dims': '[512, 256]', 'dropout': 0.19035448072927677, 'batch_norm': False, 'graph_on': True, 'source': 'grm', 'knn_k': 1, 'weighted_edges': False, 'symmetrize_mode': 'mutual', 'lr': 1.7648744545737163e-06, 'weight_decay': 1.1746796889880226e-06, 'epochs': 320, 'use_snp_selection': True, 'num_snps': 32000}. Best is trial 54 with value: 0.3636793613433838.
[I 2025-10-16 16:14:04,206] Trial 56 finished with value: 0.26291576623916624 and parameters: {'hidden_dims': '[512, 256]', 'dropout': 0.17883515646734988, 'batch_norm': True, 'graph_on': True, 'source': 'grm', 'knn_k': 1, 'weighted_edges': True, 'symmetrize_mode': 'mutual', 'lr': 1.687018767839555e-06, 'weight_decay': 1.2840845593466244e-06, 'epochs': 307, 'use_snp_selection': True, 'num_snps': 32000}. Best is trial 54 with value: 0.3636793613433838.
[I 2025-10-16 16:15:11,994] Trial 57 finished with value: 0.35246229767799375 and parameters: {'hidden_dims': '[512, 256]', 'dropout': 0.2112296223106825, 'batch_norm': False, 'graph_on': True, 'source': 'grm', 'knn_k': 1, 'weighted_edges': False, 'symmetrize_mode': 'mutual', 'lr': 2.1477385258287795e-06, 'weight_decay': 3.965109219973042e-07, 'epochs': 321, 'use_snp_selection': True, 'num_snps': 36000}. Best is trial 54 with value: 0.3636793613433838.
[I 2025-10-16 16:16:00,166] Trial 58 finished with value: 0.35279234647750857 and parameters: {'hidden_dims': '[512, 64]', 'dropout': 0.18609971475977422, 'batch_norm': False, 'graph_on': True, 'source': 'grm', 'knn_k': 1, 'weighted_edges': False, 'symmetrize_mode': 'mutual', 'lr': 1.5342778954535438e-06, 'weight_decay': 4.834941560134327e-07, 'epochs': 323, 'use_snp_selection': True, 'num_snps': 22000}. Best is trial 54 with value: 0.3636793613433838.
[I 2025-10-16 16:17:02,802] Trial 59 finished with value: 0.3334132552146912 and parameters: {'hidden_dims': '[512, 256]', 'dropout': 0.16450681919593604, 'batch_norm': False, 'graph_on': True, 'source': 'grm', 'knn_k': 2, 'weighted_edges': False, 'symmetrize_mode': 'mutual', 'lr': 2.0127418500784405e-06, 'weight_decay': 1.5077878292447805e-07, 'epochs': 283, 'use_snp_selection': True, 'num_snps': 36000}. Best is trial 54 with value: 0.3636793613433838.
[I 2025-10-16 16:17:47,874] Trial 60 finished with value: 0.3363984763622284 and parameters: {'hidden_dims': '[512, 256]', 'dropout': 0.22863201036961964, 'batch_norm': False, 'graph_on': True, 'source': 'grm', 'knn_k': 7, 'weighted_edges': False, 'symmetrize_mode': 'mutual', 'lr': 2.7774794179101584e-06, 'weight_decay': 1.2633534146429874e-06, 'epochs': 301, 'use_snp_selection': True, 'num_snps': 20000}. Best is trial 54 with value: 0.3636793613433838.
[I 2025-10-16 16:18:49,463] Trial 61 finished with value: 0.35936543345451355 and parameters: {'hidden_dims': '[512, 256]', 'dropout': 0.1984106322656944, 'batch_norm': False, 'graph_on': True, 'source': 'grm', 'knn_k': 1, 'weighted_edges': False, 'symmetrize_mode': 'mutual', 'lr': 1.234031701448547e-06, 'weight_decay': 5.590369353942516e-07, 'epochs': 332, 'use_snp_selection': True, 'num_snps': 30000}. Best is trial 54 with value: 0.3636793613433838.
[I 2025-10-16 16:19:53,051] Trial 62 finished with value: 0.35331389904022215 and parameters: {'hidden_dims': '[512, 256]', 'dropout': 0.14513005617506228, 'batch_norm': False, 'graph_on': True, 'source': 'grm', 'knn_k': 1, 'weighted_edges': False, 'symmetrize_mode': 'mutual', 'lr': 1.392039262960339e-06, 'weight_decay': 1.3401877088164809e-06, 'epochs': 328, 'use_snp_selection': True, 'num_snps': 32000}. Best is trial 54 with value: 0.3636793613433838.
[I 2025-10-16 16:20:48,486] Trial 63 finished with value: 0.3595597445964813 and parameters: {'hidden_dims': '[512, 256]', 'dropout': 0.1826763533793275, 'batch_norm': False, 'graph_on': True, 'source': 'grm', 'knn_k': 1, 'weighted_edges': False, 'symmetrize_mode': 'mutual', 'lr': 1.8010851745325489e-06, 'weight_decay': 5.26188411891296e-07, 'epochs': 306, 'use_snp_selection': True, 'num_snps': 28000}. Best is trial 54 with value: 0.3636793613433838.
[I 2025-10-16 16:21:39,932] Trial 64 finished with value: 0.33620360493659973 and parameters: {'hidden_dims': '[512, 256]', 'dropout': 0.21392897448115406, 'batch_norm': False, 'graph_on': True, 'source': 'grm', 'knn_k': 2, 'weighted_edges': False, 'symmetrize_mode': 'mutual', 'lr': 2.549924245236804e-06, 'weight_decay': 2.0329370396827245e-07, 'epochs': 270, 'use_snp_selection': True, 'num_snps': 28000}. Best is trial 54 with value: 0.3636793613433838.
[I 2025-10-16 16:22:29,052] Trial 65 finished with value: 0.35265412330627444 and parameters: {'hidden_dims': '[512, 256]', 'dropout': 0.2728133490386275, 'batch_norm': False, 'graph_on': True, 'source': 'grm', 'knn_k': 1, 'weighted_edges': False, 'symmetrize_mode': 'mutual', 'lr': 1.342275105849615e-06, 'weight_decay': 4.913286893940427e-07, 'epochs': 304, 'use_snp_selection': True, 'num_snps': 24000}. Best is trial 54 with value: 0.3636793613433838.
[I 2025-10-16 16:23:36,160] Trial 66 finished with value: 0.3303772032260895 and parameters: {'hidden_dims': '[512, 256]', 'dropout': 0.1712506944508441, 'batch_norm': False, 'graph_on': True, 'source': 'grm', 'knn_k': 2, 'weighted_edges': False, 'symmetrize_mode': 'mutual', 'lr': 1.859145538900805e-06, 'weight_decay': 5.927723344311476e-07, 'epochs': 332, 'use_snp_selection': True, 'num_snps': 34000}. Best is trial 54 with value: 0.3636793613433838.
[I 2025-10-16 16:24:24,450] Trial 67 finished with value: 0.32347692251205445 and parameters: {'hidden_dims': '[512, 256]', 'dropout': 0.1576492730343058, 'batch_norm': False, 'graph_on': True, 'source': 'grm', 'knn_k': 1, 'weighted_edges': False, 'symmetrize_mode': 'mutual', 'lr': 4.599338422510685e-06, 'weight_decay': 2.7840812835785316e-07, 'epochs': 295, 'use_snp_selection': True, 'num_snps': 24000}. Best is trial 54 with value: 0.3636793613433838.
[I 2025-10-16 16:25:11,385] Trial 68 finished with value: 0.27920432686805724 and parameters: {'hidden_dims': '[256, 128, 64]', 'dropout': 0.22814250622003135, 'batch_norm': True, 'graph_on': True, 'source': 'grm', 'knn_k': 1, 'weighted_edges': True, 'symmetrize_mode': 'mutual', 'lr': 1.1945734371528664e-06, 'weight_decay': 4.211257998428664e-06, 'epochs': 309, 'use_snp_selection': True, 'num_snps': 38000}. Best is trial 54 with value: 0.3636793613433838.
[I 2025-10-16 16:26:10,533] Trial 69 finished with value: 0.36000128984451296 and parameters: {'hidden_dims': '[512, 64]', 'dropout': 0.29383300175032123, 'batch_norm': False, 'graph_on': True, 'source': 'grm', 'knn_k': 1, 'weighted_edges': False, 'symmetrize_mode': 'mutual', 'lr': 1.6347086676354392e-06, 'weight_decay': 3.5353434246096946e-06, 'epochs': 314, 'use_snp_selection': True, 'num_snps': 30000}. Best is trial 54 with value: 0.3636793613433838.
[I 2025-10-16 16:27:00,994] Trial 70 finished with value: 0.3366856575012207 and parameters: {'hidden_dims': '[512, 64]', 'dropout': 0.29884200892424156, 'batch_norm': False, 'graph_on': True, 'source': 'grm', 'knn_k': 2, 'weighted_edges': False, 'symmetrize_mode': 'mutual', 'lr': 2.8251942348058673e-06, 'weight_decay': 4.287898012013864e-06, 'epochs': 264, 'use_snp_selection': True, 'num_snps': 28000}. Best is trial 54 with value: 0.3636793613433838.
[I 2025-10-16 16:28:02,632] Trial 71 finished with value: 0.35984671115875244 and parameters: {'hidden_dims': '[512, 64]', 'dropout': 0.26943167992242156, 'batch_norm': False, 'graph_on': True, 'source': 'grm', 'knn_k': 1, 'weighted_edges': False, 'symmetrize_mode': 'mutual', 'lr': 1.5975063535828527e-06, 'weight_decay': 1.7616009216329547e-06, 'epochs': 333, 'use_snp_selection': True, 'num_snps': 30000}. Best is trial 54 with value: 0.3636793613433838.
[I 2025-10-16 16:28:59,128] Trial 72 finished with value: 0.3607486844062805 and parameters: {'hidden_dims': '[512, 64]', 'dropout': 0.2649683043932364, 'batch_norm': False, 'graph_on': True, 'source': 'grm', 'knn_k': 1, 'weighted_edges': False, 'symmetrize_mode': 'mutual', 'lr': 1.5464596086859431e-06, 'weight_decay': 1.7103022081546817e-06, 'epochs': 318, 'use_snp_selection': True, 'num_snps': 28000}. Best is trial 54 with value: 0.3636793613433838.
[I 2025-10-16 16:29:55,340] Trial 73 finished with value: 0.3600805401802063 and parameters: {'hidden_dims': '[512, 64]', 'dropout': 0.29230368642457494, 'batch_norm': False, 'graph_on': True, 'source': 'grm', 'knn_k': 1, 'weighted_edges': False, 'symmetrize_mode': 'mutual', 'lr': 1.7558936669442995e-06, 'weight_decay': 3.265786774354695e-06, 'epochs': 316, 'use_snp_selection': True, 'num_snps': 28000}. Best is trial 54 with value: 0.3636793613433838.
[I 2025-10-16 16:30:38,174] Trial 74 finished with value: 0.35535566210746766 and parameters: {'hidden_dims': '[512, 64]', 'dropout': 0.29113234343829786, 'batch_norm': False, 'graph_on': True, 'source': 'grm', 'knn_k': 1, 'weighted_edges': False, 'symmetrize_mode': 'mutual', 'lr': 1.6277976958456585e-06, 'weight_decay': 1.7431717925698612e-06, 'epochs': 290, 'use_snp_selection': True, 'num_snps': 20000}. Best is trial 54 with value: 0.3636793613433838.
[I 2025-10-16 16:31:28,386] Trial 75 finished with value: 0.34483529925346373 and parameters: {'hidden_dims': '[512, 64]', 'dropout': 0.3341233643033886, 'batch_norm': False, 'graph_on': True, 'source': 'grm', 'knn_k': 2, 'weighted_edges': False, 'symmetrize_mode': 'mutual', 'lr': 2.290642450232906e-06, 'weight_decay': 5.624018442255513e-06, 'epochs': 313, 'use_snp_selection': True, 'num_snps': 24000}. Best is trial 54 with value: 0.3636793613433838.
[I 2025-10-16 16:32:24,582] Trial 76 finished with value: 0.36765947937965393 and parameters: {'hidden_dims': '[512, 64]', 'dropout': 0.265784207172872, 'batch_norm': False, 'graph_on': True, 'source': 'grm', 'knn_k': 1, 'weighted_edges': False, 'symmetrize_mode': 'mutual', 'lr': 1.8992304853304857e-06, 'weight_decay': 3.319156732128307e-06, 'epochs': 316, 'use_snp_selection': True, 'num_snps': 28000}. Best is trial 76 with value: 0.36765947937965393.
[I 2025-10-16 16:33:18,652] Trial 77 finished with value: 0.3591722249984741 and parameters: {'hidden_dims': '[512, 64]', 'dropout': 0.2669599141358528, 'batch_norm': False, 'graph_on': True, 'source': 'grm', 'knn_k': 1, 'weighted_edges': False, 'symmetrize_mode': 'mutual', 'lr': 1.4888983696238029e-06, 'weight_decay': 3.2947672371793104e-06, 'epochs': 316, 'use_snp_selection': True, 'num_snps': 26000}. Best is trial 76 with value: 0.36765947937965393.
[I 2025-10-16 16:34:29,470] Trial 78 finished with value: 0.3371418833732605 and parameters: {'hidden_dims': '[512, 64]', 'dropout': 0.30011869168399297, 'batch_norm': False, 'graph_on': True, 'source': 'grm', 'knn_k': 6, 'weighted_edges': False, 'symmetrize_mode': 'mutual', 'lr': 2.8823748957926664e-06, 'weight_decay': 1.8984812901170426e-06, 'epochs': 335, 'use_snp_selection': True, 'num_snps': 36000}. Best is trial 76 with value: 0.36765947937965393.
[I 2025-10-16 16:35:31,119] Trial 79 finished with value: 0.27061551809310913 and parameters: {'hidden_dims': '[512, 64]', 'dropout': 0.35882418396156746, 'batch_norm': True, 'graph_on': True, 'source': 'grm', 'knn_k': 2, 'weighted_edges': True, 'symmetrize_mode': 'mutual', 'lr': 4.274058255148743e-06, 'weight_decay': 3.1203761258978286e-06, 'epochs': 294, 'use_snp_selection': True, 'num_snps': 34000}. Best is trial 76 with value: 0.36765947937965393.
[I 2025-10-16 16:36:15,282] Trial 80 finished with value: 0.36425150036811826 and parameters: {'hidden_dims': '[512, 64]', 'dropout': 0.2738237752415467, 'batch_norm': False, 'graph_on': True, 'source': 'grm', 'knn_k': 1, 'weighted_edges': False, 'symmetrize_mode': 'mutual', 'lr': 1.9931757633542915e-06, 'weight_decay': 1.8195875880437135e-06, 'epochs': 278, 'use_snp_selection': True, 'num_snps': 22000}. Best is trial 76 with value: 0.36765947937965393.
[I 2025-10-16 16:36:56,512] Trial 81 finished with value: 0.35387460589408876 and parameters: {'hidden_dims': '[512, 64]', 'dropout': 0.28202166346542384, 'batch_norm': False, 'graph_on': True, 'source': 'grm', 'knn_k': 1, 'weighted_edges': False, 'symmetrize_mode': 'mutual', 'lr': 1.9646787454452876e-06, 'weight_decay': 1.7121909575993688e-06, 'epochs': 248, 'use_snp_selection': True, 'num_snps': 22000}. Best is trial 76 with value: 0.36765947937965393.
[I 2025-10-16 16:37:36,257] Trial 82 finished with value: 0.35800981521606445 and parameters: {'hidden_dims': '[512, 64]', 'dropout': 0.26583392313588633, 'batch_norm': False, 'graph_on': True, 'source': 'grm', 'knn_k': 1, 'weighted_edges': False, 'symmetrize_mode': 'mutual', 'lr': 2.35366140137017e-06, 'weight_decay': 5.31663365650119e-06, 'epochs': 281, 'use_snp_selection': True, 'num_snps': 18000}. Best is trial 76 with value: 0.36765947937965393.
[I 2025-10-16 16:38:39,113] Trial 83 finished with value: 0.3624692618846893 and parameters: {'hidden_dims': '[512, 64]', 'dropout': 0.3069623608091572, 'batch_norm': False, 'graph_on': True, 'source': 'grm', 'knn_k': 1, 'weighted_edges': False, 'symmetrize_mode': 'mutual', 'lr': 1.4014120473071757e-06, 'weight_decay': 1.0454540573463514e-06, 'epochs': 328, 'use_snp_selection': True, 'num_snps': 32000}. Best is trial 76 with value: 0.36765947937965393.
[I 2025-10-16 16:39:40,587] Trial 84 finished with value: 0.35066816210746765 and parameters: {'hidden_dims': '[512, 64]', 'dropout': 0.33091307939724846, 'batch_norm': False, 'graph_on': True, 'source': 'grm', 'knn_k': 1, 'weighted_edges': False, 'symmetrize_mode': 'mutual', 'lr': 3.215297012012759e-06, 'weight_decay': 1.0198187685247253e-06, 'epochs': 316, 'use_snp_selection': True, 'num_snps': 32000}. Best is trial 76 with value: 0.36765947937965393.
[I 2025-10-16 16:40:56,149] Trial 85 finished with value: 0.342233008146286 and parameters: {'hidden_dims': '[512, 64]', 'dropout': 0.30598295511476425, 'batch_norm': False, 'graph_on': True, 'source': 'grm', 'knn_k': 2, 'weighted_edges': False, 'symmetrize_mode': 'mutual', 'lr': 1.4006877313272675e-06, 'weight_decay': 2.840919636281203e-06, 'epochs': 325, 'use_snp_selection': True, 'num_snps': 40000}. Best is trial 76 with value: 0.36765947937965393.
[I 2025-10-16 16:41:46,705] Trial 86 finished with value: 0.3588023841381073 and parameters: {'hidden_dims': '[512, 64]', 'dropout': 0.28786102434188593, 'batch_norm': False, 'graph_on': True, 'source': 'grm', 'knn_k': 1, 'weighted_edges': False, 'symmetrize_mode': 'mutual', 'lr': 2.1175674080251728e-06, 'weight_decay': 8.396491407036438e-06, 'epochs': 268, 'use_snp_selection': True, 'num_snps': 28000}. Best is trial 76 with value: 0.36765947937965393.
[I 2025-10-16 16:42:48,718] Trial 87 finished with value: 0.35100101232528685 and parameters: {'hidden_dims': '[512, 64]', 'dropout': 0.23787620669673215, 'batch_norm': False, 'graph_on': True, 'source': 'grm', 'knn_k': 1, 'weighted_edges': False, 'symmetrize_mode': 'mutual', 'lr': 2.648872283516868e-06, 'weight_decay': 2.0945117379929963e-06, 'epochs': 298, 'use_snp_selection': True, 'num_snps': 34000}. Best is trial 76 with value: 0.36765947937965393.
[I 2025-10-16 16:43:45,291] Trial 88 finished with value: 0.35862300395965574 and parameters: {'hidden_dims': '[512, 64]', 'dropout': 0.3164299176222418, 'batch_norm': False, 'graph_on': True, 'source': 'grm', 'knn_k': 1, 'weighted_edges': False, 'symmetrize_mode': 'mutual', 'lr': 1.2992098514761122e-06, 'weight_decay': 1.5841632951773077e-06, 'epochs': 336, 'use_snp_selection': True, 'num_snps': 26000}. Best is trial 76 with value: 0.36765947937965393.
[I 2025-10-16 16:44:11,784] Trial 89 finished with value: 0.31889966130256653 and parameters: {'hidden_dims': '[128, 64]', 'dropout': 0.3564176410785216, 'batch_norm': False, 'graph_on': True, 'source': 'grm', 'knn_k': 2, 'weighted_edges': False, 'symmetrize_mode': 'mutual', 'lr': 1.9027248693387784e-06, 'weight_decay': 4.0817264257101955e-06, 'epochs': 287, 'use_snp_selection': True, 'num_snps': 20000}. Best is trial 76 with value: 0.36765947937965393.
