[I 2025-10-17 05:56:52,665] Trial 138 finished with value: 0.2983469098806381 and parameters: {'hidden_dims': '[128, 64]', 'dropout': 0.441756929447016, 'batch_norm': True, 'graph_on': True, 'source': 'grm', 'knn_k': 7, 'weighted_edges': True, 'symmetrize_mode': 'mutual', 'lr': 1.6725708523920496e-06, 'weight_decay': 4.165631310498562e-05, 'epochs': 118, 'use_snp_selection': True, 'num_snps': 42000}. Best is trial 131 with value: 0.3333899021148682.
[I 2025-10-17 05:57:57,655] Trial 139 finished with value: 0.32846245765686033 and parameters: {'hidden_dims': '[512, 64]', 'dropout': 0.47917022239400203, 'batch_norm': True, 'graph_on': True, 'source': 'grm', 'knn_k': 7, 'weighted_edges': True, 'symmetrize_mode': 'union', 'lr': 2.0258447283702565e-06, 'weight_decay': 1.4007265161581978e-06, 'epochs': 327, 'use_snp_selection': True, 'num_snps': 32000}. Best is trial 131 with value: 0.3333899021148682.
[I 2025-10-17 05:58:44,128] Trial 140 finished with value: 0.32408002614974973 and parameters: {'hidden_dims': '[256, 128, 64]', 'dropout': 0.49544522067893665, 'batch_norm': True, 'graph_on': True, 'source': 'grm', 'knn_k': 7, 'weighted_edges': True, 'symmetrize_mode': 'union', 'lr': 3.246849269156459e-06, 'weight_decay': 1.1600713688076025e-06, 'epochs': 331, 'use_snp_selection': True, 'num_snps': 32000}. Best is trial 131 with value: 0.3333899021148682.
[I 2025-10-17 05:59:46,707] Trial 141 finished with value: 0.3293782651424408 and parameters: {'hidden_dims': '[512, 64]', 'dropout': 0.479247815581012, 'batch_norm': True, 'graph_on': True, 'source': 'grm', 'knn_k': 7, 'weighted_edges': True, 'symmetrize_mode': 'union', 'lr': 2.005874401319671e-06, 'weight_decay': 2.4769206377610677e-06, 'epochs': 350, 'use_snp_selection': True, 'num_snps': 28000}. Best is trial 131 with value: 0.3333899021148682.
[I 2025-10-17 06:00:59,084] Trial 142 finished with value: 0.3249239921569824 and parameters: {'hidden_dims': '[512, 64]', 'dropout': 0.4600591994927188, 'batch_norm': True, 'graph_on': True, 'source': 'grm', 'knn_k': 7, 'weighted_edges': True, 'symmetrize_mode': 'union', 'lr': 1.9692407472150704e-06, 'weight_decay': 1.4468016404269597e-06, 'epochs': 339, 'use_snp_selection': True, 'num_snps': 36000}. Best is trial 131 with value: 0.3333899021148682.
[I 2025-10-17 06:02:09,771] Trial 143 finished with value: 0.266226327419281 and parameters: {'hidden_dims': '[512, 64]', 'dropout': 0.4849874657114087, 'batch_norm': True, 'graph_on': True, 'source': 'grm', 'knn_k': 7, 'weighted_edges': True, 'symmetrize_mode': 'union', 'lr': 5.1775623752340473e-05, 'weight_decay': 1.6331551497115993e-06, 'epochs': 348, 'use_snp_selection': True, 'num_snps': 34000}. Best is trial 131 with value: 0.3333899021148682.
[I 2025-10-17 06:03:12,828] Trial 144 finished with value: 0.3232079565525055 and parameters: {'hidden_dims': '[512, 64]', 'dropout': 0.5118709686690537, 'batch_norm': True, 'graph_on': True, 'source': 'grm', 'knn_k': 7, 'weighted_edges': True, 'symmetrize_mode': 'union', 'lr': 2.3551745521066642e-06, 'weight_decay': 9.826499543351134e-07, 'epochs': 326, 'use_snp_selection': True, 'num_snps': 30000}. Best is trial 131 with value: 0.3333899021148682.
[I 2025-10-17 06:03:44,703] Trial 145 finished with value: 0.33028397560119627 and parameters: {'hidden_dims': '[512, 64]', 'dropout': 0.48015727317731016, 'batch_norm': True, 'graph_on': True, 'source': 'grm', 'knn_k': 7, 'weighted_edges': True, 'symmetrize_mode': 'union', 'lr': 1.53960295403919e-06, 'weight_decay': 2.1072969516338163e-06, 'epochs': 341, 'use_snp_selection': True, 'num_snps': 8000}. Best is trial 131 with value: 0.3333899021148682.
[I 2025-10-17 06:05:06,415] Trial 146 finished with value: 0.3176465630531311 and parameters: {'hidden_dims': '[512, 64]', 'dropout': 0.4777004700179028, 'batch_norm': True, 'graph_on': True, 'source': 'grm', 'knn_k': 7, 'weighted_edges': True, 'symmetrize_mode': 'union', 'lr': 1.5824994173618662e-06, 'weight_decay': 2.613470871717866e-06, 'epochs': 350, 'use_snp_selection': True, 'num_snps': 40000}. Best is trial 131 with value: 0.3333899021148682.
[I 2025-10-17 06:05:34,429] Trial 147 finished with value: 0.27733216285705564 and parameters: {'hidden_dims': '[512, 64]', 'dropout': 0.45094444000173584, 'batch_norm': False, 'graph_on': True, 'source': 'grm', 'knn_k': 7, 'weighted_edges': False, 'symmetrize_mode': 'union', 'lr': 1.945955776335941e-06, 'weight_decay': 1.9470235747144883e-06, 'epochs': 259, 'use_snp_selection': True, 'num_snps': 8000}. Best is trial 131 with value: 0.3333899021148682.
[I 2025-10-17 06:06:06,598] Trial 148 finished with value: 0.3155857682228088 and parameters: {'hidden_dims': '[512, 128]', 'dropout': 0.4727762830271096, 'batch_norm': True, 'graph_on': True, 'source': 'grm', 'knn_k': 7, 'weighted_edges': True, 'symmetrize_mode': 'union', 'lr': 1.1360022203239855e-06, 'weight_decay': 1.2801465726350312e-06, 'epochs': 343, 'use_snp_selection': True, 'num_snps': 8000}. Best is trial 131 with value: 0.3333899021148682.
[I 2025-10-17 06:07:17,568] Trial 149 finished with value: 0.3267978012561798 and parameters: {'hidden_dims': '[512, 64]', 'dropout': 0.4345447071119148, 'batch_norm': True, 'graph_on': True, 'source': 'grm', 'knn_k': 7, 'weighted_edges': True, 'symmetrize_mode': 'union', 'lr': 1.4218225462066823e-06, 'weight_decay': 2.6764086880302917e-06, 'epochs': 315, 'use_snp_selection': True, 'num_snps': 38000}. Best is trial 131 with value: 0.3333899021148682.
