[I 2025-10-17 03:29:12,258] Trial 48 finished with value: 0.314819860458374 and parameters: {'hidden_dims': '[256, 128]', 'dropout': 0.5600130850396057, 'batch_norm': True, 'graph_on': True, 'source': 'grm', 'knn_k': 6, 'weighted_edges': True, 'symmetrize_mode': 'union', 'lr': 9.676874396563212e-05, 'weight_decay': 6.684864409836611e-07, 'epochs': 199, 'use_snp_selection': True, 'num_snps': 12000}. Best is trial 31 with value: 0.3349620997905731.
[I 2025-10-17 03:29:34,137] Trial 49 finished with value: 0.33073991537094116 and parameters: {'hidden_dims': '[512, 128]', 'dropout': 0.5185561576267389, 'batch_norm': True, 'graph_on': True, 'source': 'grm', 'knn_k': 7, 'weighted_edges': True, 'symmetrize_mode': 'union', 'lr': 3.245023116772909e-05, 'weight_decay': 2.3347929408185785e-07, 'epochs': 166, 'use_snp_selection': True, 'num_snps': 4000}. Best is trial 31 with value: 0.3349620997905731.
[I 2025-10-17 03:29:55,862] Trial 50 finished with value: 0.3162884056568146 and parameters: {'hidden_dims': '[512, 256]', 'dropout': 0.45078521307889396, 'batch_norm': True, 'graph_on': True, 'source': 'grm', 'knn_k': 6, 'weighted_edges': True, 'symmetrize_mode': 'union', 'lr': 0.0001546770010182694, 'weight_decay': 1.606569667400664e-07, 'epochs': 210, 'use_snp_selection': True, 'num_snps': 2000}. Best is trial 31 with value: 0.3349620997905731.
[I 2025-10-17 03:30:15,952] Trial 51 finished with value: 0.3237812161445618 and parameters: {'hidden_dims': '[256, 128]', 'dropout': 0.5390351007439967, 'batch_norm': True, 'graph_on': True, 'source': 'grm', 'knn_k': 7, 'weighted_edges': True, 'symmetrize_mode': 'union', 'lr': 5.887786386612394e-05, 'weight_decay': 6.711693589887134e-05, 'epochs': 84, 'use_snp_selection': True, 'num_snps': 10000}. Best is trial 31 with value: 0.3349620997905731.
[I 2025-10-17 03:30:36,620] Trial 52 finished with value: 0.32106305956840514 and parameters: {'hidden_dims': '[256, 128]', 'dropout': 0.5113136055526548, 'batch_norm': True, 'graph_on': True, 'source': 'grm', 'knn_k': 7, 'weighted_edges': True, 'symmetrize_mode': 'union', 'lr': 2.2155102549760266e-05, 'weight_decay': 3.0582953857192856e-07, 'epochs': 149, 'use_snp_selection': True, 'num_snps': 6000}. Best is trial 31 with value: 0.3349620997905731.
[I 2025-10-17 03:30:55,850] Trial 53 finished with value: 0.3324448227882385 and parameters: {'hidden_dims': '[256, 128]', 'dropout': 0.4755738377430496, 'batch_norm': True, 'graph_on': True, 'source': 'grm', 'knn_k': 7, 'weighted_edges': True, 'symmetrize_mode': 'union', 'lr': 3.698817875315729e-05, 'weight_decay': 0.0002669385250847541, 'epochs': 115, 'use_snp_selection': True, 'num_snps': 4000}. Best is trial 31 with value: 0.3349620997905731.
[I 2025-10-17 03:31:14,724] Trial 54 finished with value: 0.32292848229408266 and parameters: {'hidden_dims': '[256, 128]', 'dropout': 0.5693124379624565, 'batch_norm': True, 'graph_on': True, 'source': 'grm', 'knn_k': 7, 'weighted_edges': True, 'symmetrize_mode': 'union', 'lr': 3.774506815524633e-05, 'weight_decay': 0.0002590611550143668, 'epochs': 96, 'use_snp_selection': True, 'num_snps': 4000}. Best is trial 31 with value: 0.3349620997905731.
[I 2025-10-17 03:31:36,984] Trial 55 finished with value: 0.32427539825439455 and parameters: {'hidden_dims': '[256, 128]', 'dropout': 0.4885424463771949, 'batch_norm': True, 'graph_on': True, 'source': 'grm', 'knn_k': 6, 'weighted_edges': True, 'symmetrize_mode': 'union', 'lr': 2.9254471439141097e-05, 'weight_decay': 2.555232104017724e-06, 'epochs': 137, 'use_snp_selection': True, 'num_snps': 12000}. Best is trial 31 with value: 0.3349620997905731.
[I 2025-10-17 03:31:55,732] Trial 56 finished with value: 0.3230477809906006 and parameters: {'hidden_dims': '[128, 64]', 'dropout': 0.474215614454566, 'batch_norm': True, 'graph_on': True, 'source': 'grm', 'knn_k': 7, 'weighted_edges': True, 'symmetrize_mode': 'union', 'lr': 1.5251082999238965e-05, 'weight_decay': 1.5014774990271326e-07, 'epochs': 77, 'use_snp_selection': True, 'num_snps': 8000}. Best is trial 31 with value: 0.3349620997905731.
[I 2025-10-17 03:32:14,779] Trial 57 finished with value: 0.2818979054689407 and parameters: {'hidden_dims': '[256, 128, 64]', 'dropout': 0.39081369375803066, 'batch_norm': True, 'graph_on': True, 'source': 'grm', 'knn_k': 7, 'weighted_edges': True, 'symmetrize_mode': 'mutual', 'lr': 1.2018322405727755e-05, 'weight_decay': 0.0005515634873456426, 'epochs': 114, 'use_snp_selection': True, 'num_snps': 2000}. Best is trial 31 with value: 0.3349620997905731.
[I 2025-10-17 03:32:36,620] Trial 58 finished with value: 0.3031820595264435 and parameters: {'hidden_dims': '[512, 256]', 'dropout': 0.582050904629464, 'batch_norm': False, 'graph_on': True, 'source': 'grm', 'knn_k': 5, 'weighted_edges': False, 'symmetrize_mode': 'union', 'lr': 8.55059486592611e-06, 'weight_decay': 5.998679620199114e-07, 'epochs': 172, 'use_snp_selection': True, 'num_snps': 4000}. Best is trial 31 with value: 0.3349620997905731.
[I 2025-10-17 03:33:01,619] Trial 59 finished with value: 0.31832624673843385 and parameters: {'hidden_dims': '[512, 128]', 'dropout': 0.41380393242422414, 'batch_norm': True, 'graph_on': True, 'source': 'grm', 'knn_k': 6, 'weighted_edges': True, 'symmetrize_mode': 'union', 'lr': 5.1351526279616766e-05, 'weight_decay': 0.0008967375224667733, 'epochs': 151, 'use_snp_selection': True, 'num_snps': 10000}. Best is trial 31 with value: 0.3349620997905731.
[I 2025-10-17 03:33:24,068] Trial 60 finished with value: 0.32566202282905576 and parameters: {'hidden_dims': '[256, 128]', 'dropout': 0.536130168610406, 'batch_norm': True, 'graph_on': True, 'source': 'grm', 'knn_k': 7, 'weighted_edges': True, 'symmetrize_mode': 'union', 'lr': 7.813624600940564e-05, 'weight_decay': 2.518252507025935e-07, 'epochs': 101, 'use_snp_selection': True, 'num_snps': 16000}. Best is trial 31 with value: 0.3349620997905731.
[I 2025-10-17 03:33:43,891] Trial 61 finished with value: 0.3106057822704315 and parameters: {'hidden_dims': '[256, 128]', 'dropout': 0.5058642696084724, 'batch_norm': True, 'graph_on': True, 'source': 'grm', 'knn_k': 3, 'weighted_edges': True, 'symmetrize_mode': 'union', 'lr': 3.9456983422562774e-05, 'weight_decay': 7.416383916326215e-05, 'epochs': 121, 'use_snp_selection': True, 'num_snps': 6000}. Best is trial 31 with value: 0.3349620997905731.
[I 2025-10-17 03:34:04,370] Trial 62 finished with value: 0.33230848908424376 and parameters: {'hidden_dims': '[256, 128]', 'dropout': 0.5303219306308073, 'batch_norm': True, 'graph_on': True, 'source': 'grm', 'knn_k': 7, 'weighted_edges': True, 'symmetrize_mode': 'union', 'lr': 1.9480279683841712e-05, 'weight_decay': 0.00014778368907116218, 'epochs': 116, 'use_snp_selection': True, 'num_snps': 8000}. Best is trial 31 with value: 0.3349620997905731.
[I 2025-10-17 03:34:25,586] Trial 63 finished with value: 0.3277498781681061 and parameters: {'hidden_dims': '[256, 128]', 'dropout': 0.4682798329527684, 'batch_norm': True, 'graph_on': True, 'source': 'grm', 'knn_k': 7, 'weighted_edges': True, 'symmetrize_mode': 'union', 'lr': 2.6539668346868593e-05, 'weight_decay': 0.00029549151766788495, 'epochs': 141, 'use_snp_selection': True, 'num_snps': 8000}. Best is trial 31 with value: 0.3349620997905731.
[I 2025-10-17 03:34:43,208] Trial 64 finished with value: 0.2918255150318146 and parameters: {'hidden_dims': '[128, 64]', 'dropout': 0.5625272921578711, 'batch_norm': True, 'graph_on': True, 'source': 'grm', 'knn_k': 7, 'weighted_edges': True, 'symmetrize_mode': 'union', 'lr': 1.8010027048471273e-05, 'weight_decay': 1.0571350368665561e-07, 'epochs': 52, 'use_snp_selection': True, 'num_snps': 4000}. Best is trial 31 with value: 0.3349620997905731.
[I 2025-10-17 03:35:03,041] Trial 65 finished with value: 0.32605867385864257 and parameters: {'hidden_dims': '[256, 128]', 'dropout': 0.4379789684413938, 'batch_norm': True, 'graph_on': True, 'source': 'grm', 'knn_k': 6, 'weighted_edges': True, 'symmetrize_mode': 'union', 'lr': 2.4338418196310636e-05, 'weight_decay': 0.0001725241765310543, 'epochs': 188, 'use_snp_selection': True, 'num_snps': 2000}. Best is trial 31 with value: 0.3349620997905731.
[I 2025-10-17 03:35:25,848] Trial 66 finished with value: 0.3240462183952332 and parameters: {'hidden_dims': '[256, 128]', 'dropout': 0.5018158025529319, 'batch_norm': True, 'graph_on': True, 'source': 'grm', 'knn_k': 7, 'weighted_edges': True, 'symmetrize_mode': 'union', 'lr': 1.9154945672196756e-05, 'weight_decay': 0.0004944018143078858, 'epochs': 127, 'use_snp_selection': True, 'num_snps': 14000}. Best is trial 31 with value: 0.3349620997905731.
[I 2025-10-17 03:35:52,922] Trial 67 finished with value: 0.32517611384391787 and parameters: {'hidden_dims': '[512, 256]', 'dropout': 0.548537295232052, 'batch_norm': True, 'graph_on': True, 'source': 'grm', 'knn_k': 6, 'weighted_edges': True, 'symmetrize_mode': 'union', 'lr': 3.316802884642576e-05, 'weight_decay': 0.0003973940765284781, 'epochs': 165, 'use_snp_selection': True, 'num_snps': 12000}. Best is trial 31 with value: 0.3349620997905731.
[I 2025-10-17 03:36:12,604] Trial 68 finished with value: 0.3095717132091522 and parameters: {'hidden_dims': '[128, 64]', 'dropout': 0.5943245292896672, 'batch_norm': True, 'graph_on': True, 'source': 'grm', 'knn_k': 7, 'weighted_edges': True, 'symmetrize_mode': 'mutual', 'lr': 4.6406111415903246e-05, 'weight_decay': 0.0001812843575845286, 'epochs': 104, 'use_snp_selection': True, 'num_snps': 10000}. Best is trial 31 with value: 0.3349620997905731.
[I 2025-10-17 03:36:32,761] Trial 69 finished with value: 0.32426377534866335 and parameters: {'hidden_dims': '[256, 128]', 'dropout': 0.5325913254329624, 'batch_norm': True, 'graph_on': True, 'source': 'grm', 'knn_k': 7, 'weighted_edges': True, 'symmetrize_mode': 'union', 'lr': 1.410477350462272e-05, 'weight_decay': 7.951039934827847e-06, 'epochs': 160, 'use_snp_selection': True, 'num_snps': 4000}. Best is trial 31 with value: 0.3349620997905731.
[I 2025-10-17 03:37:00,585] Trial 70 finished with value: 0.31638402938842775 and parameters: {'hidden_dims': '[256, 128, 64]', 'dropout': 0.48855747306466024, 'batch_norm': False, 'graph_on': True, 'source': 'grm', 'knn_k': 6, 'weighted_edges': False, 'symmetrize_mode': 'union', 'lr': 0.00011432266471682395, 'weight_decay': 9.31953621846326e-05, 'epochs': 337, 'use_snp_selection': True, 'num_snps': 8000}. Best is trial 31 with value: 0.3349620997905731.
[I 2025-10-17 03:37:20,381] Trial 71 finished with value: 0.32597981095314027 and parameters: {'hidden_dims': '[256, 128]', 'dropout': 0.5167285528299959, 'batch_norm': True, 'graph_on': True, 'source': 'grm', 'knn_k': 7, 'weighted_edges': True, 'symmetrize_mode': 'union', 'lr': 6.12895032928175e-05, 'weight_decay': 0.0001419436477465142, 'epochs': 112, 'use_snp_selection': True, 'num_snps': 6000}. Best is trial 31 with value: 0.3349620997905731.
[I 2025-10-17 03:37:40,318] Trial 72 finished with value: 0.33670055866241455 and parameters: {'hidden_dims': '[256, 128]', 'dropout': 0.5285083951941463, 'batch_norm': True, 'graph_on': True, 'source': 'grm', 'knn_k': 7, 'weighted_edges': True, 'symmetrize_mode': 'union', 'lr': 5.089114024673088e-05, 'weight_decay': 4.644733166565095e-05, 'epochs': 119, 'use_snp_selection': True, 'num_snps': 6000}. Best is trial 72 with value: 0.33670055866241455.
[I 2025-10-17 03:37:59,281] Trial 73 finished with value: 0.32089787125587466 and parameters: {'hidden_dims': '[256, 128]', 'dropout': 0.5751743153068225, 'batch_norm': True, 'graph_on': True, 'source': 'grm', 'knn_k': 7, 'weighted_edges': True, 'symmetrize_mode': 'union', 'lr': 3.9492148784732805e-05, 'weight_decay': 2.3446466655431167e-05, 'epochs': 135, 'use_snp_selection': True, 'num_snps': 2000}. Best is trial 72 with value: 0.33670055866241455.
[I 2025-10-17 03:38:19,702] Trial 74 finished with value: 0.3344173073768616 and parameters: {'hidden_dims': '[256, 128]', 'dropout': 0.5551890823669698, 'batch_norm': True, 'graph_on': True, 'source': 'grm', 'knn_k': 7, 'weighted_edges': True, 'symmetrize_mode': 'union', 'lr': 2.4301604138319202e-05, 'weight_decay': 4.502065450028422e-07, 'epochs': 95, 'use_snp_selection': True, 'num_snps': 10000}. Best is trial 72 with value: 0.33670055866241455.
[I 2025-10-17 03:38:41,343] Trial 75 finished with value: 0.3209488868713379 and parameters: {'hidden_dims': '[256, 128]', 'dropout': 0.5521571684838238, 'batch_norm': True, 'graph_on': True, 'source': 'grm', 'knn_k': 7, 'weighted_edges': True, 'symmetrize_mode': 'union', 'lr': 7.370314911221091e-05, 'weight_decay': 8.299571765822287e-07, 'epochs': 81, 'use_snp_selection': True, 'num_snps': 16000}. Best is trial 72 with value: 0.33670055866241455.
[I 2025-10-17 03:39:01,829] Trial 76 finished with value: 0.3291246175765991 and parameters: {'hidden_dims': '[256, 128]', 'dropout': 0.5626171551982755, 'batch_norm': True, 'graph_on': True, 'source': 'grm', 'knn_k': 7, 'weighted_edges': True, 'symmetrize_mode': 'union', 'lr': 5.1959009679152724e-05, 'weight_decay': 5.229241167197832e-07, 'epochs': 98, 'use_snp_selection': True, 'num_snps': 10000}. Best is trial 72 with value: 0.33670055866241455.
[I 2025-10-17 03:39:23,156] Trial 77 finished with value: 0.32918527722358704 and parameters: {'hidden_dims': '[256, 128]', 'dropout': 0.5838073910756675, 'batch_norm': True, 'graph_on': True, 'source': 'grm', 'knn_k': 6, 'weighted_edges': True, 'symmetrize_mode': 'union', 'lr': 2.265016205963927e-05, 'weight_decay': 4.5091925649497006e-05, 'epochs': 91, 'use_snp_selection': True, 'num_snps': 14000}. Best is trial 72 with value: 0.33670055866241455.
[I 2025-10-17 03:39:47,868] Trial 78 finished with value: 0.33729336857795716 and parameters: {'hidden_dims': '[256, 128]', 'dropout': 0.5416592062633975, 'batch_norm': True, 'graph_on': True, 'source': 'grm', 'knn_k': 7, 'weighted_edges': True, 'symmetrize_mode': 'union', 'lr': 9.473753104113567e-06, 'weight_decay': 3.370485110980048e-06, 'epochs': 123, 'use_snp_selection': True, 'num_snps': 20000}. Best is trial 78 with value: 0.33729336857795716.
[I 2025-10-17 03:40:07,006] Trial 79 finished with value: 0.24210534989833832 and parameters: {'hidden_dims': '[256, 128]', 'dropout': 0.5412825420602553, 'batch_norm': True, 'graph_on': True, 'source': 'grm', 'knn_k': 4, 'weighted_edges': True, 'symmetrize_mode': 'mutual', 'lr': 4.55563831917868e-06, 'weight_decay': 1.3449121388170823e-05, 'epochs': 119, 'use_snp_selection': True, 'num_snps': 4000}. Best is trial 78 with value: 0.33729336857795716.
[I 2025-10-17 03:40:31,136] Trial 80 finished with value: 0.3181315243244171 and parameters: {'hidden_dims': '[512, 256]', 'dropout': 0.5985805306675148, 'batch_norm': True, 'graph_on': True, 'source': 'grm', 'knn_k': 1, 'weighted_edges': True, 'symmetrize_mode': 'union', 'lr': 1.0223652093904216e-05, 'weight_decay': 3.1304479523993553e-06, 'epochs': 69, 'use_snp_selection': True, 'num_snps': 20000}. Best is trial 78 with value: 0.33729336857795716.
[I 2025-10-17 03:40:59,390] Trial 81 finished with value: 0.33276771903038027 and parameters: {'hidden_dims': '[256, 128]', 'dropout': 0.5336696048331125, 'batch_norm': True, 'graph_on': True, 'source': 'grm', 'knn_k': 7, 'weighted_edges': True, 'symmetrize_mode': 'union', 'lr': 7.71421239398243e-06, 'weight_decay': 5.650674903883076e-06, 'epochs': 132, 'use_snp_selection': True, 'num_snps': 28000}. Best is trial 78 with value: 0.33729336857795716.
[I 2025-10-17 03:41:27,398] Trial 82 finished with value: 0.3296230614185333 and parameters: {'hidden_dims': '[256, 128]', 'dropout': 0.5309272352325062, 'batch_norm': True, 'graph_on': True, 'source': 'grm', 'knn_k': 7, 'weighted_edges': True, 'symmetrize_mode': 'union', 'lr': 6.434886835258168e-06, 'weight_decay': 5.947485712173216e-06, 'epochs': 128, 'use_snp_selection': True, 'num_snps': 28000}. Best is trial 78 with value: 0.33729336857795716.
[I 2025-10-17 03:41:55,639] Trial 83 finished with value: 0.34240866303443906 and parameters: {'hidden_dims': '[256, 128]', 'dropout': 0.5526742502618995, 'batch_norm': True, 'graph_on': True, 'source': 'grm', 'knn_k': 7, 'weighted_edges': True, 'symmetrize_mode': 'union', 'lr': 8.155371984650096e-06, 'weight_decay': 4.489803851339941e-06, 'epochs': 108, 'use_snp_selection': True, 'num_snps': 34000}. Best is trial 83 with value: 0.34240866303443906.
[I 2025-10-17 03:42:26,600] Trial 84 finished with value: 0.32189422845840454 and parameters: {'hidden_dims': '[256, 128]', 'dropout': 0.5698421222071621, 'batch_norm': True, 'graph_on': True, 'source': 'grm', 'knn_k': 7, 'weighted_edges': True, 'symmetrize_mode': 'union', 'lr': 3.770993734093759e-06, 'weight_decay': 4.367796978699541e-06, 'epochs': 143, 'use_snp_selection': True, 'num_snps': 34000}. Best is trial 83 with value: 0.34240866303443906.
[I 2025-10-17 03:43:00,982] Trial 85 finished with value: 0.32958407402038575 and parameters: {'hidden_dims': '[512, 64]', 'dropout': 0.5555005651903657, 'batch_norm': True, 'graph_on': True, 'source': 'grm', 'knn_k': 6, 'weighted_edges': True, 'symmetrize_mode': 'union', 'lr': 5.138866465407289e-06, 'weight_decay': 8.761861043299016e-06, 'epochs': 106, 'use_snp_selection': True, 'num_snps': 32000}. Best is trial 83 with value: 0.34240866303443906.
[I 2025-10-17 03:43:32,494] Trial 86 finished with value: 0.3337946593761444 and parameters: {'hidden_dims': '[256, 128]', 'dropout': 0.5436633865106978, 'batch_norm': True, 'graph_on': True, 'source': 'grm', 'knn_k': 7, 'weighted_edges': True, 'symmetrize_mode': 'union', 'lr': 9.074717439949961e-06, 'weight_decay': 1.4532123822804265e-06, 'epochs': 132, 'use_snp_selection': True, 'num_snps': 38000}. Best is trial 83 with value: 0.34240866303443906.
[I 2025-10-17 03:44:13,781] Trial 87 finished with value: 0.31641972064971924 and parameters: {'hidden_dims': '[512, 128]', 'dropout': 0.5842946243793312, 'batch_norm': False, 'graph_on': True, 'source': 'grm', 'knn_k': 7, 'weighted_edges': False, 'symmetrize_mode': 'union', 'lr': 7.67493053592928e-06, 'weight_decay': 2.0193881262902803e-06, 'epochs': 131, 'use_snp_selection': True, 'num_snps': 38000}. Best is trial 83 with value: 0.34240866303443906.
[I 2025-10-17 03:44:37,728] Trial 88 finished with value: 0.31547742486000063 and parameters: {'hidden_dims': '[256, 128]', 'dropout': 0.5460825231397906, 'batch_norm': True, 'graph_on': True, 'source': 'grm', 'knn_k': 5, 'weighted_edges': True, 'symmetrize_mode': 'union', 'lr': 5.615425014166254e-06, 'weight_decay': 1.625093640819123e-06, 'epochs': 91, 'use_snp_selection': True, 'num_snps': 24000}. Best is trial 83 with value: 0.34240866303443906.
[I 2025-10-17 03:45:09,067] Trial 89 finished with value: 0.3302084982395172 and parameters: {'hidden_dims': '[256, 128]', 'dropout': 0.3123650644164667, 'batch_norm': True, 'graph_on': True, 'source': 'grm', 'knn_k': 7, 'weighted_edges': True, 'symmetrize_mode': 'union', 'lr': 8.454332855443377e-06, 'weight_decay': 3.4577407822661677e-06, 'epochs': 107, 'use_snp_selection': True, 'num_snps': 44000}. Best is trial 83 with value: 0.34240866303443906.
[I 2025-10-17 03:45:42,083] Trial 90 finished with value: 0.33626407384872437 and parameters: {'hidden_dims': '[256, 128]', 'dropout': 0.5713003723997988, 'batch_norm': True, 'graph_on': True, 'source': 'grm', 'knn_k': 6, 'weighted_edges': True, 'symmetrize_mode': 'union', 'lr': 3.4440095844311326e-06, 'weight_decay': 1.2193012740515607e-06, 'epochs': 156, 'use_snp_selection': True, 'num_snps': 36000}. Best is trial 83 with value: 0.34240866303443906.
[I 2025-10-17 03:46:12,989] Trial 91 finished with value: 0.31154369115829467 and parameters: {'hidden_dims': '[256, 128]', 'dropout': 0.5714424095556159, 'batch_norm': True, 'graph_on': True, 'source': 'grm', 'knn_k': 6, 'weighted_edges': True, 'symmetrize_mode': 'union', 'lr': 1.5396886044787153e-06, 'weight_decay': 1.43559350979367e-06, 'epochs': 143, 'use_snp_selection': True, 'num_snps': 34000}. Best is trial 83 with value: 0.34240866303443906.
[I 2025-10-17 03:46:47,354] Trial 92 finished with value: 0.3229722142219543 and parameters: {'hidden_dims': '[256, 128]', 'dropout': 0.5896555756828147, 'batch_norm': True, 'graph_on': True, 'source': 'grm', 'knn_k': 6, 'weighted_edges': True, 'symmetrize_mode': 'union', 'lr': 2.7181091319740503e-06, 'weight_decay': 9.96298606539053e-07, 'epochs': 156, 'use_snp_selection': True, 'num_snps': 40000}. Best is trial 83 with value: 0.34240866303443906.
[I 2025-10-17 03:47:17,663] Trial 93 finished with value: 0.32921079397201536 and parameters: {'hidden_dims': '[256, 128]', 'dropout': 0.5653621757060199, 'batch_norm': True, 'graph_on': True, 'source': 'grm', 'knn_k': 6, 'weighted_edges': True, 'symmetrize_mode': 'union', 'lr': 3.771783274265806e-06, 'weight_decay': 2.6859085740821537e-06, 'epochs': 124, 'use_snp_selection': True, 'num_snps': 36000}. Best is trial 83 with value: 0.34240866303443906.
[I 2025-10-17 03:47:49,315] Trial 94 finished with value: 0.32564441561698915 and parameters: {'hidden_dims': '[256, 128]', 'dropout': 0.5451353907063589, 'batch_norm': True, 'graph_on': True, 'source': 'grm', 'knn_k': 7, 'weighted_edges': True, 'symmetrize_mode': 'union', 'lr': 1.2194892022970277e-05, 'weight_decay': 4.715038628308174e-06, 'epochs': 134, 'use_snp_selection': True, 'num_snps': 38000}. Best is trial 83 with value: 0.34240866303443906.
[I 2025-10-17 03:48:28,807] Trial 95 finished with value: 0.31425543427467345 and parameters: {'hidden_dims': '[512, 256]', 'dropout': 0.5057570449796168, 'batch_norm': True, 'graph_on': True, 'source': 'grm', 'knn_k': 5, 'weighted_edges': True, 'symmetrize_mode': 'union', 'lr': 9.517512473090698e-06, 'weight_decay': 1.2155574351066657e-06, 'epochs': 149, 'use_snp_selection': True, 'num_snps': 30000}. Best is trial 83 with value: 0.34240866303443906.
