[I 2025-10-16 22:07:57,264] Trial 18 finished with value: 0.2740578055381775 and parameters: {'hidden_dims': '[512, 256]', 'dropout': 0.2436515136749151, 'batch_norm': True, 'graph_on': True, 'source': 'grm', 'knn_k': 2, 'weighted_edges': True, 'symmetrize_mode': 'union', 'lr': 1.9027700240234262e-05, 'weight_decay': 2.669798244874423e-05, 'epochs': 68, 'use_snp_selection': True, 'num_snps': 26000}. Best is trial 17 with value: 0.32797229290008545.
[I 2025-10-16 22:08:19,115] Trial 19 finished with value: 0.2685568153858185 and parameters: {'hidden_dims': '[512, 256]', 'dropout': 0.12404445791983387, 'batch_norm': False, 'graph_on': True, 'source': 'grm', 'knn_k': 1, 'weighted_edges': False, 'symmetrize_mode': 'union', 'lr': 1.03468692018674e-05, 'weight_decay': 1.0911147393243862e-05, 'epochs': 18, 'use_snp_selection': True, 'num_snps': 32000}. Best is trial 17 with value: 0.32797229290008545.
[I 2025-10-16 22:09:00,356] Trial 20 finished with value: 0.30976906418800354 and parameters: {'hidden_dims': '[512, 256]', 'dropout': 0.17014400913059735, 'batch_norm': False, 'graph_on': True, 'source': 'grm', 'knn_k': 2, 'weighted_edges': False, 'symmetrize_mode': 'union', 'lr': 3.971714814711436e-05, 'weight_decay': 4.905393996402135e-05, 'epochs': 240, 'use_snp_selection': True, 'num_snps': 22000}. Best is trial 17 with value: 0.32797229290008545.
[I 2025-10-16 22:09:20,478] Trial 21 finished with value: 0.32107897400856017 and parameters: {'hidden_dims': '[512, 256]', 'dropout': 0.2769554157843872, 'batch_norm': False, 'graph_on': True, 'source': 'grm', 'knn_k': 3, 'weighted_edges': False, 'symmetrize_mode': 'union', 'lr': 7.43101914486274e-05, 'weight_decay': 9.51860582369537e-06, 'epochs': 67, 'use_snp_selection': True, 'num_snps': 8000}. Best is trial 17 with value: 0.32797229290008545.
[I 2025-10-16 22:09:46,442] Trial 22 finished with value: 0.31716989278793334 and parameters: {'hidden_dims': '[512, 64]', 'dropout': 0.3136703825475354, 'batch_norm': False, 'graph_on': True, 'source': 'grm', 'knn_k': 2, 'weighted_edges': False, 'symmetrize_mode': 'union', 'lr': 0.00012553766722757593, 'weight_decay': 6.579657582724642e-05, 'epochs': 136, 'use_snp_selection': True, 'num_snps': 14000}. Best is trial 17 with value: 0.32797229290008545.
[I 2025-10-16 22:10:17,507] Trial 23 finished with value: -0.029582980461418627 and parameters: {'hidden_dims': '[512, 256]', 'dropout': 0.38226416688078535, 'batch_norm': False, 'graph_on': True, 'source': 'grm', 'knn_k': 3, 'weighted_edges': False, 'symmetrize_mode': 'union', 'lr': 0.0009944339142287908, 'weight_decay': 1.0015945718344948e-05, 'epochs': 48, 'use_snp_selection': True, 'num_snps': 48000}. Best is trial 17 with value: 0.32797229290008545.
[I 2025-10-16 22:10:39,341] Trial 24 finished with value: 0.2276407390832901 and parameters: {'hidden_dims': '[512, 256]', 'dropout': 0.26433643393818373, 'batch_norm': False, 'graph_on': True, 'source': 'grm', 'knn_k': 1, 'weighted_edges': False, 'symmetrize_mode': 'union', 'lr': 2.2963477934828327e-05, 'weight_decay': 7.54495499940271e-05, 'epochs': 13, 'use_snp_selection': True, 'num_snps': 36000}. Best is trial 17 with value: 0.32797229290008545.
[I 2025-10-16 22:11:32,387] Trial 25 finished with value: 0.3265873908996582 and parameters: {'hidden_dims': '[512, 256]', 'dropout': 0.31235209375756856, 'batch_norm': False, 'graph_on': True, 'source': 'grm', 'knn_k': 2, 'weighted_edges': False, 'symmetrize_mode': 'union', 'lr': 4.9648677492237475e-06, 'weight_decay': 0.00037038220311700904, 'epochs': 164, 'use_snp_selection': True, 'num_snps': 46000}. Best is trial 17 with value: 0.32797229290008545.
[I 2025-10-16 22:12:26,888] Trial 26 finished with value: 0.32181422114372255 and parameters: {'hidden_dims': '[512, 256]', 'dropout': 0.2190606823847132, 'batch_norm': False, 'graph_on': True, 'source': 'grm', 'knn_k': 2, 'weighted_edges': False, 'symmetrize_mode': 'union', 'lr': 5.86981541962804e-06, 'weight_decay': 0.0003270632099272169, 'epochs': 178, 'use_snp_selection': True, 'num_snps': 44000}. Best is trial 17 with value: 0.32797229290008545.
[I 2025-10-16 22:13:14,916] Trial 27 finished with value: 0.2635818421840668 and parameters: {'hidden_dims': '[512, 256]', 'dropout': 0.364283482625604, 'batch_norm': True, 'graph_on': True, 'source': 'grm', 'knn_k': 1, 'weighted_edges': True, 'symmetrize_mode': 'union', 'lr': 2.444713274062952e-06, 'weight_decay': 5.161930867201549e-06, 'epochs': 121, 'use_snp_selection': True, 'num_snps': 52000}. Best is trial 17 with value: 0.32797229290008545.
[I 2025-10-16 22:13:55,277] Trial 28 finished with value: 0.3258324027061462 and parameters: {'hidden_dims': '[512, 256]', 'dropout': 0.1723079873989949, 'batch_norm': False, 'graph_on': True, 'source': 'grm', 'knn_k': 2, 'weighted_edges': False, 'symmetrize_mode': 'union', 'lr': 4.8093188768849785e-06, 'weight_decay': 0.0003896080711517632, 'epochs': 159, 'use_snp_selection': True, 'num_snps': 30000}. Best is trial 17 with value: 0.32797229290008545.
[I 2025-10-16 22:14:21,282] Trial 29 finished with value: 0.2331736981868744 and parameters: {'hidden_dims': '[128, 64]', 'dropout': 0.2359589520542226, 'batch_norm': True, 'graph_on': True, 'source': 'grm', 'knn_k': 1, 'weighted_edges': True, 'symmetrize_mode': 'union', 'lr': 1.3107196687870464e-05, 'weight_decay': 1.9062761763058294e-05, 'epochs': 238, 'use_snp_selection': True, 'num_snps': 22000}. Best is trial 17 with value: 0.32797229290008545.
[I 2025-10-16 22:15:55,684] Trial 30 finished with value: 0.3121680021286011 and parameters: {'hidden_dims': '[512, 256]', 'dropout': 0.29491084167087434, 'batch_norm': False, 'graph_on': True, 'source': 'grm', 'knn_k': 1, 'weighted_edges': False, 'symmetrize_mode': 'union', 'lr': 1.4243035325917954e-06, 'weight_decay': 3.9093817983164194e-05, 'epochs': 290, 'use_snp_selection': True, 'num_snps': 60000}. Best is trial 17 with value: 0.32797229290008545.
[I 2025-10-16 22:16:34,979] Trial 31 finished with value: 0.3266380548477173 and parameters: {'hidden_dims': '[512, 256]', 'dropout': 0.15321562266763744, 'batch_norm': False, 'graph_on': True, 'source': 'grm', 'knn_k': 2, 'weighted_edges': False, 'symmetrize_mode': 'union', 'lr': 4.67465772734459e-06, 'weight_decay': 0.0003521295263929621, 'epochs': 150, 'use_snp_selection': True, 'num_snps': 30000}. Best is trial 17 with value: 0.32797229290008545.
[I 2025-10-16 22:17:03,009] Trial 32 finished with value: 0.32650631070137026 and parameters: {'hidden_dims': '[128, 64]', 'dropout': 0.17257296412380807, 'batch_norm': False, 'graph_on': True, 'source': 'grm', 'knn_k': 2, 'weighted_edges': False, 'symmetrize_mode': 'union', 'lr': 6.687975807479069e-06, 'weight_decay': 9.00831556554518e-05, 'epochs': 197, 'use_snp_selection': True, 'num_snps': 34000}. Best is trial 17 with value: 0.32797229290008545.
[I 2025-10-16 22:17:32,387] Trial 33 finished with value: 0.29959845542907715 and parameters: {'hidden_dims': '[512, 256]', 'dropout': 0.3415648155955786, 'batch_norm': False, 'graph_on': True, 'source': 'grm', 'knn_k': 3, 'weighted_edges': False, 'symmetrize_mode': 'union', 'lr': 2.1343898282580408e-06, 'weight_decay': 0.00024108036009872296, 'epochs': 151, 'use_snp_selection': True, 'num_snps': 16000}. Best is trial 17 with value: 0.32797229290008545.
[I 2025-10-16 22:17:55,220] Trial 34 finished with value: 0.29197238087654115 and parameters: {'hidden_dims': '[256, 128]', 'dropout': 0.1349979910283938, 'batch_norm': False, 'graph_on': True, 'source': 'grm', 'knn_k': 4, 'weighted_edges': False, 'symmetrize_mode': 'mutual', 'lr': 3.7665646383862897e-06, 'weight_decay': 0.00012409631572788703, 'epochs': 72, 'use_snp_selection': True, 'num_snps': 24000}. Best is trial 17 with value: 0.32797229290008545.
[I 2025-10-16 22:18:19,383] Trial 35 finished with value: 0.27805221974849703 and parameters: {'hidden_dims': '[512, 256]', 'dropout': 0.20466721345343408, 'batch_norm': True, 'graph_on': True, 'source': 'grm', 'knn_k': 2, 'weighted_edges': True, 'symmetrize_mode': 'union', 'lr': 1.382315185895738e-05, 'weight_decay': 0.0005933165892394496, 'epochs': 35, 'use_snp_selection': True, 'num_snps': 30000}. Best is trial 17 with value: 0.32797229290008545.
[I 2025-10-16 22:18:52,043] Trial 36 finished with value: 0.33173811435699463 and parameters: {'hidden_dims': '[512, 64]', 'dropout': 0.4191284004496212, 'batch_norm': False, 'graph_on': True, 'source': 'grm', 'knn_k': 1, 'weighted_edges': False, 'symmetrize_mode': 'mutual', 'lr': 8.926961086563063e-06, 'weight_decay': 7.450727023739341e-07, 'epochs': 188, 'use_snp_selection': True, 'num_snps': 18000}. Best is trial 36 with value: 0.33173811435699463.
[I 2025-10-16 22:19:26,548] Trial 37 finished with value: 0.3228658974170685 and parameters: {'hidden_dims': '[512, 64]', 'dropout': 0.3949800977440123, 'batch_norm': False, 'graph_on': True, 'source': 'grm', 'knn_k': 1, 'weighted_edges': False, 'symmetrize_mode': 'mutual', 'lr': 9.849102096652047e-06, 'weight_decay': 5.411309239623654e-07, 'epochs': 211, 'use_snp_selection': True, 'num_snps': 18000}. Best is trial 36 with value: 0.33173811435699463.
[I 2025-10-16 22:19:55,858] Trial 38 finished with value: 0.32775421142578126 and parameters: {'hidden_dims': '[512, 64]', 'dropout': 0.42227357410961386, 'batch_norm': False, 'graph_on': True, 'source': 'grm', 'knn_k': 6, 'weighted_edges': False, 'symmetrize_mode': 'mutual', 'lr': 8.286294144627556e-06, 'weight_decay': 3.44713806977659e-07, 'epochs': 123, 'use_snp_selection': True, 'num_snps': 20000}. Best is trial 36 with value: 0.33173811435699463.
[I 2025-10-16 22:20:17,923] Trial 39 finished with value: 0.3210863649845123 and parameters: {'hidden_dims': '[512, 64]', 'dropout': 0.4160330665345594, 'batch_norm': True, 'graph_on': True, 'source': 'grm', 'knn_k': 7, 'weighted_edges': True, 'symmetrize_mode': 'mutual', 'lr': 8.167378509728983e-06, 'weight_decay': 2.987818331718473e-07, 'epochs': 86, 'use_snp_selection': True, 'num_snps': 10000}. Best is trial 36 with value: 0.33173811435699463.
[I 2025-10-16 22:20:47,296] Trial 40 finished with value: 0.32536362409591674 and parameters: {'hidden_dims': '[512, 64]', 'dropout': 0.5381772499825824, 'batch_norm': False, 'graph_on': True, 'source': 'grm', 'knn_k': 6, 'weighted_edges': False, 'symmetrize_mode': 'mutual', 'lr': 1.8859476829756564e-05, 'weight_decay': 1.0239298363251313e-06, 'epochs': 123, 'use_snp_selection': True, 'num_snps': 20000}. Best is trial 36 with value: 0.33173811435699463.
[I 2025-10-16 22:21:18,186] Trial 41 finished with value: 0.32714377641677855 and parameters: {'hidden_dims': '[512, 64]', 'dropout': 0.4163618691543648, 'batch_norm': False, 'graph_on': True, 'source': 'grm', 'knn_k': 6, 'weighted_edges': False, 'symmetrize_mode': 'mutual', 'lr': 1.2286728409964879e-05, 'weight_decay': 1.0770951287543777e-07, 'epochs': 117, 'use_snp_selection': True, 'num_snps': 24000}. Best is trial 36 with value: 0.33173811435699463.
[I 2025-10-16 22:21:49,359] Trial 42 finished with value: 0.32793778777122495 and parameters: {'hidden_dims': '[512, 64]', 'dropout': 0.4375661469611033, 'batch_norm': False, 'graph_on': True, 'source': 'grm', 'knn_k': 6, 'weighted_edges': False, 'symmetrize_mode': 'mutual', 'lr': 3.601431498442565e-05, 'weight_decay': 1.533778599336444e-07, 'epochs': 106, 'use_snp_selection': True, 'num_snps': 26000}. Best is trial 36 with value: 0.33173811435699463.
[I 2025-10-16 22:22:10,682] Trial 43 finished with value: 0.30539520978927615 and parameters: {'hidden_dims': '[512, 64]', 'dropout': 0.5061826811120768, 'batch_norm': False, 'graph_on': True, 'source': 'grm', 'knn_k': 6, 'weighted_edges': False, 'symmetrize_mode': 'mutual', 'lr': 4.259527902061002e-05, 'weight_decay': 2.883496010884968e-07, 'epochs': 37, 'use_snp_selection': True, 'num_snps': 18000}. Best is trial 36 with value: 0.33173811435699463.
[I 2025-10-16 22:22:51,106] Trial 44 finished with value: 0.3159639358520508 and parameters: {'hidden_dims': '[512, 64]', 'dropout': 0.44005666366926405, 'batch_norm': False, 'graph_on': True, 'source': 'grm', 'knn_k': 7, 'weighted_edges': False, 'symmetrize_mode': 'mutual', 'lr': 2.6421267525863184e-05, 'weight_decay': 1.5621423496146932e-07, 'epochs': 188, 'use_snp_selection': True, 'num_snps': 26000}. Best is trial 36 with value: 0.33173811435699463.
[I 2025-10-16 22:23:12,031] Trial 45 finished with value: 0.30622613430023193 and parameters: {'hidden_dims': '[256, 128, 64]', 'dropout': 0.4468607069137574, 'batch_norm': False, 'graph_on': True, 'source': 'grm', 'knn_k': 5, 'weighted_edges': False, 'symmetrize_mode': 'mutual', 'lr': 5.1753267148063806e-05, 'weight_decay': 6.821564609879948e-07, 'epochs': 90, 'use_snp_selection': True, 'num_snps': 12000}. Best is trial 36 with value: 0.33173811435699463.
[I 2025-10-16 22:23:35,873] Trial 46 finished with value: 0.3175875127315521 and parameters: {'hidden_dims': '[512, 64]', 'dropout': 0.363204563491664, 'batch_norm': False, 'graph_on': True, 'source': 'grm', 'knn_k': 6, 'weighted_edges': False, 'symmetrize_mode': 'mutual', 'lr': 1.788503448239946e-05, 'weight_decay': 1.6182968220526488e-06, 'epochs': 60, 'use_snp_selection': True, 'num_snps': 20000}. Best is trial 36 with value: 0.33173811435699463.
[I 2025-10-16 22:24:12,081] Trial 47 finished with value: 0.32351458072662354 and parameters: {'hidden_dims': '[512, 64]', 'dropout': 0.4309892886994687, 'batch_norm': False, 'graph_on': True, 'source': 'grm', 'knn_k': 5, 'weighted_edges': False, 'symmetrize_mode': 'mutual', 'lr': 8.451833239859276e-06, 'weight_decay': 4.207302115825771e-07, 'epochs': 105, 'use_snp_selection': True, 'num_snps': 36000}. Best is trial 36 with value: 0.33173811435699463.
[I 2025-10-16 22:24:40,741] Trial 48 finished with value: 0.2395235240459442 and parameters: {'hidden_dims': '[512, 64]', 'dropout': 0.517770987579496, 'batch_norm': False, 'graph_on': True, 'source': 'grm', 'knn_k': 4, 'weighted_edges': False, 'symmetrize_mode': 'mutual', 'lr': 0.00014930629159328927, 'weight_decay': 1.5132158713174554e-07, 'epochs': 79, 'use_snp_selection': True, 'num_snps': 28000}. Best is trial 36 with value: 0.33173811435699463.
[I 2025-10-16 22:25:12,495] Trial 49 finished with value: 0.30816582441329954 and parameters: {'hidden_dims': '[256, 128, 64]', 'dropout': 0.4607961320546147, 'batch_norm': False, 'graph_on': True, 'source': 'grm', 'knn_k': 7, 'weighted_edges': False, 'symmetrize_mode': 'mutual', 'lr': 2.9507257420552167e-05, 'weight_decay': 3.209418357907507e-06, 'epochs': 132, 'use_snp_selection': True, 'num_snps': 38000}. Best is trial 36 with value: 0.33173811435699463.
[I 2025-10-16 22:25:50,011] Trial 50 finished with value: 0.26980434358119965 and parameters: {'hidden_dims': '[256, 128]', 'dropout': 0.4892034509883305, 'batch_norm': True, 'graph_on': True, 'source': 'grm', 'knn_k': 5, 'weighted_edges': True, 'symmetrize_mode': 'mutual', 'lr': 6.728806549224535e-06, 'weight_decay': 1.1469550445077132e-06, 'epochs': 344, 'use_snp_selection': True, 'num_snps': 22000}. Best is trial 36 with value: 0.33173811435699463.
[I 2025-10-16 22:26:21,015] Trial 51 finished with value: 0.3285619139671326 and parameters: {'hidden_dims': '[512, 64]', 'dropout': 0.41884101748293334, 'batch_norm': False, 'graph_on': True, 'source': 'grm', 'knn_k': 6, 'weighted_edges': False, 'symmetrize_mode': 'mutual', 'lr': 1.178044798430417e-05, 'weight_decay': 2.0306927287084414e-07, 'epochs': 113, 'use_snp_selection': True, 'num_snps': 24000}. Best is trial 36 with value: 0.33173811435699463.
[I 2025-10-16 22:26:50,524] Trial 52 finished with value: 0.3305167376995087 and parameters: {'hidden_dims': '[512, 64]', 'dropout': 0.37806256022739165, 'batch_norm': False, 'graph_on': True, 'source': 'grm', 'knn_k': 6, 'weighted_edges': False, 'symmetrize_mode': 'mutual', 'lr': 1.1576331793272651e-05, 'weight_decay': 2.0973139716652893e-07, 'epochs': 103, 'use_snp_selection': True, 'num_snps': 24000}. Best is trial 36 with value: 0.33173811435699463.
[I 2025-10-16 22:27:20,178] Trial 53 finished with value: 0.32926726937294004 and parameters: {'hidden_dims': '[512, 64]', 'dropout': 0.33852730109121115, 'batch_norm': False, 'graph_on': True, 'source': 'grm', 'knn_k': 6, 'weighted_edges': False, 'symmetrize_mode': 'mutual', 'lr': 1.6232348996085723e-05, 'weight_decay': 1.977174657032247e-07, 'epochs': 105, 'use_snp_selection': True, 'num_snps': 24000}. Best is trial 36 with value: 0.33173811435699463.
[I 2025-10-16 22:27:45,499] Trial 54 finished with value: 0.32587422132492067 and parameters: {'hidden_dims': '[512, 64]', 'dropout': 0.35183266673944125, 'batch_norm': False, 'graph_on': True, 'source': 'grm', 'knn_k': 6, 'weighted_edges': False, 'symmetrize_mode': 'mutual', 'lr': 1.5054972393342488e-05, 'weight_decay': 1.9284925734719488e-07, 'epochs': 98, 'use_snp_selection': True, 'num_snps': 16000}. Best is trial 36 with value: 0.33173811435699463.
[I 2025-10-16 22:28:06,959] Trial 55 finished with value: 0.29596906900405884 and parameters: {'hidden_dims': '[128, 64]', 'dropout': 0.33373579872029185, 'batch_norm': False, 'graph_on': True, 'source': 'grm', 'knn_k': 7, 'weighted_edges': False, 'symmetrize_mode': 'mutual', 'lr': 2.168648639458163e-05, 'weight_decay': 2.0397374234355295e-07, 'epochs': 46, 'use_snp_selection': True, 'num_snps': 32000}. Best is trial 36 with value: 0.33173811435699463.
[I 2025-10-16 22:28:30,032] Trial 56 finished with value: 0.28387573957443235 and parameters: {'hidden_dims': '[512, 64]', 'dropout': 0.29171166731701864, 'batch_norm': False, 'graph_on': True, 'source': 'grm', 'knn_k': 5, 'weighted_edges': False, 'symmetrize_mode': 'mutual', 'lr': 1.1212730647284336e-05, 'weight_decay': 1.8669201491122663e-05, 'epochs': 30, 'use_snp_selection': True, 'num_snps': 28000}. Best is trial 36 with value: 0.33173811435699463.
[I 2025-10-16 22:28:54,971] Trial 57 finished with value: 0.2771879494190216 and parameters: {'hidden_dims': '[512, 64]', 'dropout': 0.39081369375803066, 'batch_norm': False, 'graph_on': True, 'source': 'grm', 'knn_k': 5, 'weighted_edges': False, 'symmetrize_mode': 'mutual', 'lr': 3.107335837821597e-06, 'weight_decay': 4.807481080189128e-07, 'epochs': 58, 'use_snp_selection': True, 'num_snps': 24000}. Best is trial 36 with value: 0.33173811435699463.
[I 2025-10-16 22:29:32,253] Trial 58 finished with value: 0.3107039213180542 and parameters: {'hidden_dims': '[256, 128, 64]', 'dropout': 0.3728135757497614, 'batch_norm': False, 'graph_on': True, 'source': 'grm', 'knn_k': 6, 'weighted_edges': False, 'symmetrize_mode': 'mutual', 'lr': 1.4718654790252439e-05, 'weight_decay': 7.437837921304448e-07, 'epochs': 218, 'use_snp_selection': True, 'num_snps': 34000}. Best is trial 36 with value: 0.33173811435699463.
[I 2025-10-16 22:29:57,403] Trial 59 finished with value: 0.30030823349952696 and parameters: {'hidden_dims': '[256, 128]', 'dropout': 0.25069816077360885, 'batch_norm': False, 'graph_on': True, 'source': 'grm', 'knn_k': 3, 'weighted_edges': False, 'symmetrize_mode': 'mutual', 'lr': 1.6110613909678454e-05, 'weight_decay': 1.4229846464127187e-05, 'epochs': 174, 'use_snp_selection': True, 'num_snps': 16000}. Best is trial 36 with value: 0.33173811435699463.
[I 2025-10-16 22:30:32,704] Trial 60 finished with value: 0.33827688097953795 and parameters: {'hidden_dims': '[512, 64]', 'dropout': 0.2909930127166017, 'batch_norm': False, 'graph_on': True, 'source': 'grm', 'knn_k': 1, 'weighted_edges': False, 'symmetrize_mode': 'mutual', 'lr': 6.589469376366107e-06, 'weight_decay': 2.2832320131215362e-07, 'epochs': 139, 'use_snp_selection': True, 'num_snps': 28000}. Best is trial 60 with value: 0.33827688097953795.
[I 2025-10-16 22:31:00,880] Trial 61 finished with value: 0.3434982717037201 and parameters: {'hidden_dims': '[512, 64]', 'dropout': 0.2881364392066118, 'batch_norm': False, 'graph_on': True, 'source': 'grm', 'knn_k': 1, 'weighted_edges': False, 'symmetrize_mode': 'mutual', 'lr': 6.336424986899689e-06, 'weight_decay': 2.4473419398710484e-07, 'epochs': 78, 'use_snp_selection': True, 'num_snps': 28000}. Best is trial 61 with value: 0.3434982717037201.
[I 2025-10-16 22:31:35,021] Trial 62 finished with value: 0.3377164363861084 and parameters: {'hidden_dims': '[512, 64]', 'dropout': 0.3202391377127803, 'batch_norm': False, 'graph_on': True, 'source': 'grm', 'knn_k': 1, 'weighted_edges': False, 'symmetrize_mode': 'mutual', 'lr': 7.231371985494862e-06, 'weight_decay': 2.4182553897891296e-07, 'epochs': 138, 'use_snp_selection': True, 'num_snps': 26000}. Best is trial 61 with value: 0.3434982717037201.
[I 2025-10-16 22:32:10,808] Trial 63 finished with value: 0.33906295895576477 and parameters: {'hidden_dims': '[512, 64]', 'dropout': 0.32709806018785964, 'batch_norm': False, 'graph_on': True, 'source': 'grm', 'knn_k': 1, 'weighted_edges': False, 'symmetrize_mode': 'mutual', 'lr': 6.662205249981999e-06, 'weight_decay': 3.0378679122976404e-07, 'epochs': 143, 'use_snp_selection': True, 'num_snps': 28000}. Best is trial 61 with value: 0.3434982717037201.
[I 2025-10-16 22:32:46,505] Trial 64 finished with value: 0.3364683508872986 and parameters: {'hidden_dims': '[512, 64]', 'dropout': 0.32581884881237894, 'batch_norm': False, 'graph_on': True, 'source': 'grm', 'knn_k': 1, 'weighted_edges': False, 'symmetrize_mode': 'mutual', 'lr': 3.5641797651769243e-06, 'weight_decay': 1.0630688810060617e-07, 'epochs': 142, 'use_snp_selection': True, 'num_snps': 28000}. Best is trial 61 with value: 0.3434982717037201.
[I 2025-10-16 22:33:21,726] Trial 65 finished with value: 0.3375206828117371 and parameters: {'hidden_dims': '[512, 64]', 'dropout': 0.32523751442582916, 'batch_norm': False, 'graph_on': True, 'source': 'grm', 'knn_k': 1, 'weighted_edges': False, 'symmetrize_mode': 'mutual', 'lr': 3.2550272259775727e-06, 'weight_decay': 1.1225277336111058e-07, 'epochs': 138, 'use_snp_selection': True, 'num_snps': 28000}. Best is trial 61 with value: 0.3434982717037201.
