[I 2025-10-16 21:41:19,418] Trial 120 finished with value: 0.32109256982803347 and parameters: {'hidden_dims': '[512, 64]', 'dropout': 0.5993725339139281, 'batch_norm': True, 'graph_on': True, 'source': 'grm', 'knn_k': 6, 'weighted_edges': True, 'symmetrize_mode': 'union', 'lr': 3.7127741492663313e-06, 'weight_decay': 0.00020926781131611215, 'epochs': 124, 'use_snp_selection': True, 'num_snps': 26000}. Best is trial 91 with value: 0.34311728477478026.
[I 2025-10-16 21:41:45,617] Trial 121 finished with value: 0.333241730928421 and parameters: {'hidden_dims': '[512, 128]', 'dropout': 0.39659823766350155, 'batch_norm': True, 'graph_on': True, 'source': 'grm', 'knn_k': 7, 'weighted_edges': True, 'symmetrize_mode': 'union', 'lr': 4.461756686014329e-06, 'weight_decay': 0.00038823080434758245, 'epochs': 108, 'use_snp_selection': True, 'num_snps': 16000}. Best is trial 91 with value: 0.34311728477478026.
[I 2025-10-16 21:42:16,710] Trial 122 finished with value: 0.32925169467926024 and parameters: {'hidden_dims': '[256, 128]', 'dropout': 0.3609820243428478, 'batch_norm': True, 'graph_on': True, 'source': 'grm', 'knn_k': 7, 'weighted_edges': True, 'symmetrize_mode': 'union', 'lr': 6.5118037692103484e-06, 'weight_decay': 5.217248604706547e-05, 'epochs': 145, 'use_snp_selection': True, 'num_snps': 34000}. Best is trial 91 with value: 0.34311728477478026.
[I 2025-10-16 21:42:45,827] Trial 123 finished with value: 0.325680011510849 and parameters: {'hidden_dims': '[256, 128, 64]', 'dropout': 0.3505251131326322, 'batch_norm': True, 'graph_on': True, 'source': 'grm', 'knn_k': 7, 'weighted_edges': True, 'symmetrize_mode': 'union', 'lr': 5.389450076332862e-06, 'weight_decay': 6.796938023640154e-05, 'epochs': 118, 'use_snp_selection': True, 'num_snps': 32000}. Best is trial 91 with value: 0.34311728477478026.
[I 2025-10-16 21:43:21,892] Trial 124 finished with value: 0.3408465445041656 and parameters: {'hidden_dims': '[512, 128]', 'dropout': 0.32936661598523126, 'batch_norm': True, 'graph_on': True, 'source': 'grm', 'knn_k': 7, 'weighted_edges': True, 'symmetrize_mode': 'union', 'lr': 3.9373587385891044e-06, 'weight_decay': 0.00012264176749615994, 'epochs': 136, 'use_snp_selection': True, 'num_snps': 28000}. Best is trial 91 with value: 0.34311728477478026.
[I 2025-10-16 21:43:57,925] Trial 125 finished with value: 0.3404206335544586 and parameters: {'hidden_dims': '[512, 64]', 'dropout': 0.30814591383686146, 'batch_norm': True, 'graph_on': True, 'source': 'grm', 'knn_k': 7, 'weighted_edges': True, 'symmetrize_mode': 'union', 'lr': 2.75904495447364e-06, 'weight_decay': 0.00013877330850984408, 'epochs': 136, 'use_snp_selection': True, 'num_snps': 28000}. Best is trial 91 with value: 0.34311728477478026.
[I 2025-10-16 21:44:35,580] Trial 126 finished with value: 0.33734720945358276 and parameters: {'hidden_dims': '[512, 64]', 'dropout': 0.3284275382760515, 'batch_norm': True, 'graph_on': True, 'source': 'grm', 'knn_k': 7, 'weighted_edges': True, 'symmetrize_mode': 'union', 'lr': 2.0815710393097656e-06, 'weight_decay': 9.538012631830073e-05, 'epochs': 149, 'use_snp_selection': True, 'num_snps': 28000}. Best is trial 91 with value: 0.34311728477478026.
[I 2025-10-16 21:45:10,905] Trial 127 finished with value: 0.3358710765838623 and parameters: {'hidden_dims': '[512, 128]', 'dropout': 0.2690523976090878, 'batch_norm': True, 'graph_on': True, 'source': 'grm', 'knn_k': 7, 'weighted_edges': True, 'symmetrize_mode': 'union', 'lr': 2.692103698975606e-06, 'weight_decay': 0.0003010400009028286, 'epochs': 139, 'use_snp_selection': True, 'num_snps': 26000}. Best is trial 91 with value: 0.34311728477478026.
[I 2025-10-16 21:45:37,004] Trial 128 finished with value: 0.3258699655532837 and parameters: {'hidden_dims': '[128, 64]', 'dropout': 0.3021609772209142, 'batch_norm': True, 'graph_on': True, 'source': 'grm', 'knn_k': 7, 'weighted_edges': True, 'symmetrize_mode': 'union', 'lr': 3.6408638587860747e-06, 'weight_decay': 0.0006338998315582415, 'epochs': 164, 'use_snp_selection': True, 'num_snps': 30000}. Best is trial 91 with value: 0.34311728477478026.
[I 2025-10-16 21:46:09,346] Trial 129 finished with value: 0.3353590488433838 and parameters: {'hidden_dims': '[512, 64]', 'dropout': 0.3085214152634592, 'batch_norm': True, 'graph_on': True, 'source': 'grm', 'knn_k': 7, 'weighted_edges': True, 'symmetrize_mode': 'union', 'lr': 4.732250547453877e-06, 'weight_decay': 0.0001858972861110893, 'epochs': 129, 'use_snp_selection': True, 'num_snps': 24000}. Best is trial 91 with value: 0.34311728477478026.
[I 2025-10-16 21:46:41,372] Trial 130 finished with value: 0.32415434122085574 and parameters: {'hidden_dims': '[512, 64]', 'dropout': 0.3137693354463934, 'batch_norm': True, 'graph_on': True, 'source': 'grm', 'knn_k': 7, 'weighted_edges': True, 'symmetrize_mode': 'union', 'lr': 4.1144505022722385e-06, 'weight_decay': 0.0001134861003710187, 'epochs': 103, 'use_snp_selection': True, 'num_snps': 28000}. Best is trial 91 with value: 0.34311728477478026.
[I 2025-10-16 21:47:19,015] Trial 131 finished with value: 0.3320167660713196 and parameters: {'hidden_dims': '[512, 64]', 'dropout': 0.3299942533588291, 'batch_norm': True, 'graph_on': True, 'source': 'grm', 'knn_k': 7, 'weighted_edges': True, 'symmetrize_mode': 'union', 'lr': 3.146703937702028e-06, 'weight_decay': 8.862677823338106e-05, 'epochs': 149, 'use_snp_selection': True, 'num_snps': 28000}. Best is trial 91 with value: 0.34311728477478026.
[I 2025-10-16 21:47:59,200] Trial 132 finished with value: 0.3342422068119049 and parameters: {'hidden_dims': '[512, 64]', 'dropout': 0.2924832307636274, 'batch_norm': True, 'graph_on': True, 'source': 'grm', 'knn_k': 7, 'weighted_edges': True, 'symmetrize_mode': 'union', 'lr': 2.1501158338263007e-06, 'weight_decay': 0.0001484050291236637, 'epochs': 180, 'use_snp_selection': True, 'num_snps': 26000}. Best is trial 91 with value: 0.34311728477478026.
[I 2025-10-16 21:48:39,253] Trial 133 finished with value: 0.33539111614227296 and parameters: {'hidden_dims': '[512, 64]', 'dropout': 0.3239021357747339, 'batch_norm': True, 'graph_on': True, 'source': 'grm', 'knn_k': 7, 'weighted_edges': True, 'symmetrize_mode': 'union', 'lr': 1.7417832645914493e-06, 'weight_decay': 9.14148561727894e-05, 'epochs': 154, 'use_snp_selection': True, 'num_snps': 30000}. Best is trial 91 with value: 0.34311728477478026.
[I 2025-10-16 21:49:17,568] Trial 134 finished with value: 0.3350383937358856 and parameters: {'hidden_dims': '[512, 64]', 'dropout': 0.33749236162111673, 'batch_norm': True, 'graph_on': True, 'source': 'grm', 'knn_k': 6, 'weighted_edges': True, 'symmetrize_mode': 'union', 'lr': 2.037098096268889e-06, 'weight_decay': 0.00023642903841735046, 'epochs': 134, 'use_snp_selection': True, 'num_snps': 32000}. Best is trial 91 with value: 0.34311728477478026.
[I 2025-10-16 21:49:47,894] Trial 135 finished with value: 0.32558452486991885 and parameters: {'hidden_dims': '[512, 256]', 'dropout': 0.3802314521321845, 'batch_norm': True, 'graph_on': True, 'source': 'grm', 'knn_k': 7, 'weighted_edges': True, 'symmetrize_mode': 'union', 'lr': 2.4966739208663224e-06, 'weight_decay': 2.1997516386751075e-06, 'epochs': 142, 'use_snp_selection': True, 'num_snps': 18000}. Best is trial 91 with value: 0.34311728477478026.
[I 2025-10-16 21:50:26,099] Trial 136 finished with value: 0.3416703939437866 and parameters: {'hidden_dims': '[512, 64]', 'dropout': 0.34263673800437616, 'batch_norm': True, 'graph_on': True, 'source': 'grm', 'knn_k': 6, 'weighted_edges': True, 'symmetrize_mode': 'union', 'lr': 2.844170878737912e-06, 'weight_decay': 0.00013543340686021535, 'epochs': 154, 'use_snp_selection': True, 'num_snps': 28000}. Best is trial 91 with value: 0.34311728477478026.
[I 2025-10-16 21:51:01,195] Trial 137 finished with value: 0.312107253074646 and parameters: {'hidden_dims': '[512, 64]', 'dropout': 0.3437583017629251, 'batch_norm': True, 'graph_on': True, 'source': 'grm', 'knn_k': 6, 'weighted_edges': True, 'symmetrize_mode': 'mutual', 'lr': 2.898965265057783e-06, 'weight_decay': 0.0005206528656561627, 'epochs': 156, 'use_snp_selection': True, 'num_snps': 24000}. Best is trial 91 with value: 0.34311728477478026.
[I 2025-10-16 21:51:41,719] Trial 138 finished with value: 0.32268919944763186 and parameters: {'hidden_dims': '[512, 64]', 'dropout': 0.3633769209165144, 'batch_norm': True, 'graph_on': True, 'source': 'grm', 'knn_k': 6, 'weighted_edges': True, 'symmetrize_mode': 'union', 'lr': 5.381671827420037e-06, 'weight_decay': 0.0001349205747311006, 'epochs': 172, 'use_snp_selection': True, 'num_snps': 28000}. Best is trial 91 with value: 0.34311728477478026.
[I 2025-10-16 21:52:11,780] Trial 139 finished with value: 0.3391116499900818 and parameters: {'hidden_dims': '[512, 128]', 'dropout': 0.3500627034491701, 'batch_norm': True, 'graph_on': True, 'source': 'grm', 'knn_k': 6, 'weighted_edges': True, 'symmetrize_mode': 'union', 'lr': 3.4467745026094616e-06, 'weight_decay': 0.0003917212721161482, 'epochs': 114, 'use_snp_selection': True, 'num_snps': 22000}. Best is trial 91 with value: 0.34311728477478026.
[I 2025-10-16 21:52:41,629] Trial 140 finished with value: 0.3036370277404785 and parameters: {'hidden_dims': '[512, 128]', 'dropout': 0.35251660443090727, 'batch_norm': False, 'graph_on': True, 'source': 'grm', 'knn_k': 6, 'weighted_edges': False, 'symmetrize_mode': 'union', 'lr': 3.4074184435400494e-06, 'weight_decay': 0.00017450248783805057, 'epochs': 114, 'use_snp_selection': True, 'num_snps': 22000}. Best is trial 91 with value: 0.34311728477478026.
[I 2025-10-16 21:53:15,506] Trial 141 finished with value: 0.3381741583347321 and parameters: {'hidden_dims': '[512, 128]', 'dropout': 0.3745704129885734, 'batch_norm': True, 'graph_on': True, 'source': 'grm', 'knn_k': 6, 'weighted_edges': True, 'symmetrize_mode': 'union', 'lr': 4.740343858622057e-06, 'weight_decay': 0.00035559839422731414, 'epochs': 125, 'use_snp_selection': True, 'num_snps': 26000}. Best is trial 91 with value: 0.34311728477478026.
[I 2025-10-16 21:53:49,132] Trial 142 finished with value: 0.32924759984016416 and parameters: {'hidden_dims': '[512, 128]', 'dropout': 0.3757032166952059, 'batch_norm': True, 'graph_on': True, 'source': 'grm', 'knn_k': 6, 'weighted_edges': True, 'symmetrize_mode': 'union', 'lr': 3.928647640686361e-06, 'weight_decay': 0.0002703496808452676, 'epochs': 123, 'use_snp_selection': True, 'num_snps': 26000}. Best is trial 91 with value: 0.34311728477478026.
[I 2025-10-16 21:54:27,220] Trial 143 finished with value: 0.336967796087265 and parameters: {'hidden_dims': '[512, 128]', 'dropout': 0.36522203510361, 'batch_norm': True, 'graph_on': True, 'source': 'grm', 'knn_k': 6, 'weighted_edges': True, 'symmetrize_mode': 'union', 'lr': 4.6158635744649435e-06, 'weight_decay': 0.0003205006806602812, 'epochs': 138, 'use_snp_selection': True, 'num_snps': 30000}. Best is trial 91 with value: 0.34311728477478026.
[I 2025-10-16 21:55:00,326] Trial 144 finished with value: 0.3336140990257263 and parameters: {'hidden_dims': '[512, 128]', 'dropout': 0.31763619514254143, 'batch_norm': True, 'graph_on': True, 'source': 'grm', 'knn_k': 6, 'weighted_edges': True, 'symmetrize_mode': 'union', 'lr': 2.8415559132520318e-06, 'weight_decay': 0.00020998957058683405, 'epochs': 134, 'use_snp_selection': True, 'num_snps': 24000}. Best is trial 91 with value: 0.34311728477478026.
[I 2025-10-16 21:55:24,152] Trial 145 finished with value: 0.3318813323974609 and parameters: {'hidden_dims': '[512, 128]', 'dropout': 0.3495410775322497, 'batch_norm': True, 'graph_on': True, 'source': 'grm', 'knn_k': 6, 'weighted_edges': True, 'symmetrize_mode': 'union', 'lr': 3.5992007110350053e-06, 'weight_decay': 0.00037508761750873996, 'epochs': 109, 'use_snp_selection': True, 'num_snps': 12000}. Best is trial 91 with value: 0.34311728477478026.
[I 2025-10-16 21:55:58,720] Trial 146 finished with value: 0.33862953186035155 and parameters: {'hidden_dims': '[512, 128]', 'dropout': 0.33909281294284, 'batch_norm': True, 'graph_on': True, 'source': 'grm', 'knn_k': 6, 'weighted_edges': True, 'symmetrize_mode': 'union', 'lr': 2.4607524692379363e-06, 'weight_decay': 0.00011847120203142563, 'epochs': 123, 'use_snp_selection': True, 'num_snps': 28000}. Best is trial 91 with value: 0.34311728477478026.
[I 2025-10-16 21:56:33,324] Trial 147 finished with value: 0.32672306299209597 and parameters: {'hidden_dims': '[512, 128]', 'dropout': 0.3402813188703783, 'batch_norm': True, 'graph_on': True, 'source': 'grm', 'knn_k': 6, 'weighted_edges': True, 'symmetrize_mode': 'union', 'lr': 2.4411317378911994e-06, 'weight_decay': 0.00012415067260327636, 'epochs': 112, 'use_snp_selection': True, 'num_snps': 30000}. Best is trial 91 with value: 0.34311728477478026.
[I 2025-10-16 21:57:07,457] Trial 148 finished with value: 0.3407317280769348 and parameters: {'hidden_dims': '[512, 128]', 'dropout': 0.35742107195111666, 'batch_norm': True, 'graph_on': True, 'source': 'grm', 'knn_k': 6, 'weighted_edges': True, 'symmetrize_mode': 'union', 'lr': 3.1977497774280057e-06, 'weight_decay': 7.568665044172035e-05, 'epochs': 119, 'use_snp_selection': True, 'num_snps': 28000}. Best is trial 91 with value: 0.34311728477478026.
[I 2025-10-16 21:57:41,862] Trial 149 finished with value: 0.3364013314247131 and parameters: {'hidden_dims': '[512, 128]', 'dropout': 0.33310406161624645, 'batch_norm': True, 'graph_on': True, 'source': 'grm', 'knn_k': 6, 'weighted_edges': True, 'symmetrize_mode': 'union', 'lr': 3.13218668900823e-06, 'weight_decay': 0.0007114177573060402, 'epochs': 121, 'use_snp_selection': True, 'num_snps': 28000}. Best is trial 91 with value: 0.34311728477478026.
[I 2025-10-16 21:58:12,722] Trial 0 finished with value: 0.2017960488796234 and parameters: {'hidden_dims': '[128, 64]', 'dropout': 0.199031432379812, 'batch_norm': True, 'graph_on': True, 'source': 'grm', 'knn_k': 1, 'weighted_edges': True, 'symmetrize_mode': 'union', 'lr': 0.0002740708741343236, 'weight_decay': 2.819059662190987e-05, 'epochs': 256, 'use_snp_selection': True, 'num_snps': 18000}. Best is trial 0 with value: 0.2017960488796234.
[I 2025-10-16 21:58:32,178] Trial 1 finished with value: 0.21497524827718734 and parameters: {'hidden_dims': '[128, 64]', 'dropout': 0.32091658721149807, 'batch_norm': False, 'graph_on': True, 'source': 'grm', 'knn_k': 4, 'weighted_edges': False, 'symmetrize_mode': 'mutual', 'lr': 0.0005320428882732732, 'weight_decay': 1.89210117736594e-06, 'epochs': 40, 'use_snp_selection': True, 'num_snps': 20000}. Best is trial 1 with value: 0.21497524827718734.
[I 2025-10-16 21:58:58,287] Trial 2 finished with value: 0.2559698820114136 and parameters: {'hidden_dims': '[256, 128]', 'dropout': 0.19947376983940615, 'batch_norm': True, 'graph_on': True, 'source': 'grm', 'knn_k': 6, 'weighted_edges': True, 'symmetrize_mode': 'mutual', 'lr': 1.5051775490493461e-05, 'weight_decay': 2.3650563799866155e-07, 'epochs': 289, 'use_snp_selection': True, 'num_snps': 10000}. Best is trial 2 with value: 0.2559698820114136.
[I 2025-10-16 21:59:20,310] Trial 3 finished with value: 0.3123787403106689 and parameters: {'hidden_dims': '[512, 256]', 'dropout': 0.3986858241154422, 'batch_norm': True, 'graph_on': True, 'source': 'grm', 'knn_k': 5, 'weighted_edges': True, 'symmetrize_mode': 'union', 'lr': 9.821050313409216e-06, 'weight_decay': 0.00012454353397331594, 'epochs': 23, 'use_snp_selection': True, 'num_snps': 26000}. Best is trial 3 with value: 0.3123787403106689.
[I 2025-10-16 21:59:56,037] Trial 4 finished with value: 0.3135532379150391 and parameters: {'hidden_dims': '[256, 128, 64]', 'dropout': 0.5390483213624292, 'batch_norm': False, 'graph_on': True, 'source': 'grm', 'knn_k': 4, 'weighted_edges': False, 'symmetrize_mode': 'mutual', 'lr': 8.11311593386297e-06, 'weight_decay': 9.296158109581328e-07, 'epochs': 200, 'use_snp_selection': True, 'num_snps': 34000}. Best is trial 4 with value: 0.3135532379150391.
[I 2025-10-16 22:00:35,049] Trial 5 finished with value: 0.24899196326732637 and parameters: {'hidden_dims': '[256, 128, 64]', 'dropout': 0.5885461262002587, 'batch_norm': False, 'graph_on': True, 'source': 'grm', 'knn_k': 3, 'weighted_edges': False, 'symmetrize_mode': 'mutual', 'lr': 1.164930281795184e-06, 'weight_decay': 1.3145475249585842e-07, 'epochs': 145, 'use_snp_selection': True, 'num_snps': 54000}. Best is trial 4 with value: 0.3135532379150391.
[I 2025-10-16 22:01:14,348] Trial 6 finished with value: 0.27338539361953734 and parameters: {'hidden_dims': '[256, 128, 64]', 'dropout': 0.5824426399282747, 'batch_norm': False, 'graph_on': True, 'source': 'grm', 'knn_k': 7, 'weighted_edges': False, 'symmetrize_mode': 'mutual', 'lr': 1.8103274335042867e-06, 'weight_decay': 1.8980551329127457e-06, 'epochs': 168, 'use_snp_selection': True, 'num_snps': 48000}. Best is trial 4 with value: 0.3135532379150391.
[I 2025-10-16 22:02:30,992] Trial 7 finished with value: 0.2779100835323334 and parameters: {'hidden_dims': '[512, 64]', 'dropout': 0.4492085423675365, 'batch_norm': False, 'graph_on': True, 'source': 'grm', 'knn_k': 2, 'weighted_edges': False, 'symmetrize_mode': 'mutual', 'lr': 7.458996247470631e-05, 'weight_decay': 3.63708811960795e-06, 'epochs': 339, 'use_snp_selection': True, 'num_snps': 40000}. Best is trial 4 with value: 0.3135532379150391.
[I 2025-10-16 22:03:09,325] Trial 8 finished with value: 0.3193611681461334 and parameters: {'hidden_dims': '[512, 128]', 'dropout': 0.4855348583679587, 'batch_norm': False, 'graph_on': True, 'source': 'grm', 'knn_k': 4, 'weighted_edges': False, 'symmetrize_mode': 'union', 'lr': 5.347869726837025e-06, 'weight_decay': 0.000825219321368031, 'epochs': 112, 'use_snp_selection': True, 'num_snps': 38000}. Best is trial 8 with value: 0.3193611681461334.
[I 2025-10-16 22:03:28,658] Trial 9 finished with value: 0.32173137068748475 and parameters: {'hidden_dims': '[512, 128]', 'dropout': 0.31141454109750316, 'batch_norm': False, 'graph_on': True, 'source': 'grm', 'knn_k': 3, 'weighted_edges': False, 'symmetrize_mode': 'union', 'lr': 6.926774652277983e-05, 'weight_decay': 0.0009810933865270722, 'epochs': 95, 'use_snp_selection': True, 'num_snps': 4000}. Best is trial 9 with value: 0.32173137068748475.
[I 2025-10-16 22:03:46,359] Trial 10 finished with value: 0.23228783309459686 and parameters: {'hidden_dims': '[512, 128]', 'dropout': 0.1062256058813002, 'batch_norm': True, 'graph_on': True, 'source': 'grm', 'knn_k': 1, 'weighted_edges': True, 'symmetrize_mode': 'union', 'lr': 9.43680651114941e-05, 'weight_decay': 0.0008453596826300955, 'epochs': 83, 'use_snp_selection': True, 'num_snps': 2000}. Best is trial 9 with value: 0.32173137068748475.
[I 2025-10-16 22:04:25,598] Trial 11 finished with value: 0.31811285614967344 and parameters: {'hidden_dims': '[512, 128]', 'dropout': 0.3433284124473246, 'batch_norm': False, 'graph_on': True, 'source': 'grm', 'knn_k': 3, 'weighted_edges': False, 'symmetrize_mode': 'union', 'lr': 3.930371849503765e-05, 'weight_decay': 0.000988571501865363, 'epochs': 105, 'use_snp_selection': True, 'num_snps': 42000}. Best is trial 9 with value: 0.32173137068748475.
[I 2025-10-16 22:04:56,675] Trial 12 finished with value: 0.31326659917831423 and parameters: {'hidden_dims': '[512, 128]', 'dropout': 0.4668908025443073, 'batch_norm': False, 'graph_on': True, 'source': 'grm', 'knn_k': 3, 'weighted_edges': False, 'symmetrize_mode': 'union', 'lr': 3.7885316110644027e-06, 'weight_decay': 0.00020308816406776852, 'epochs': 97, 'use_snp_selection': True, 'num_snps': 28000}. Best is trial 9 with value: 0.32173137068748475.
[I 2025-10-16 22:05:52,339] Trial 13 finished with value: 0.3093100666999817 and parameters: {'hidden_dims': '[512, 128]', 'dropout': 0.2690173658366945, 'batch_norm': False, 'graph_on': True, 'source': 'grm', 'knn_k': 5, 'weighted_edges': False, 'symmetrize_mode': 'union', 'lr': 2.7712663817559323e-05, 'weight_decay': 0.00015040002709759882, 'epochs': 134, 'use_snp_selection': True, 'num_snps': 60000}. Best is trial 9 with value: 0.32173137068748475.
[I 2025-10-16 22:06:14,974] Trial 14 finished with value: 0.3147770404815674 and parameters: {'hidden_dims': '[512, 128]', 'dropout': 0.4774156968265142, 'batch_norm': False, 'graph_on': True, 'source': 'grm', 'knn_k': 5, 'weighted_edges': False, 'symmetrize_mode': 'union', 'lr': 0.0002135639563472117, 'weight_decay': 2.8231945077744424e-05, 'epochs': 207, 'use_snp_selection': True, 'num_snps': 4000}. Best is trial 9 with value: 0.32173137068748475.
[I 2025-10-16 22:06:34,445] Trial 15 finished with value: 0.24718388319015502 and parameters: {'hidden_dims': '[256, 128]', 'dropout': 0.4048223255145925, 'batch_norm': False, 'graph_on': True, 'source': 'grm', 'knn_k': 2, 'weighted_edges': False, 'symmetrize_mode': 'union', 'lr': 2.972700900905692e-06, 'weight_decay': 0.00035019828034201156, 'epochs': 53, 'use_snp_selection': True, 'num_snps': 14000}. Best is trial 9 with value: 0.32173137068748475.
[I 2025-10-16 22:07:04,537] Trial 16 finished with value: 0.32796341776847837 and parameters: {'hidden_dims': '[512, 256]', 'dropout': 0.2879026935803246, 'batch_norm': False, 'graph_on': True, 'source': 'grm', 'knn_k': 2, 'weighted_edges': False, 'symmetrize_mode': 'union', 'lr': 5.726637662658769e-06, 'weight_decay': 3.4046254775532125e-05, 'epochs': 71, 'use_snp_selection': True, 'num_snps': 34000}. Best is trial 16 with value: 0.32796341776847837.
[I 2025-10-16 22:07:30,352] Trial 17 finished with value: 0.32797229290008545 and parameters: {'hidden_dims': '[512, 256]', 'dropout': 0.2599517223129724, 'batch_norm': False, 'graph_on': True, 'source': 'grm', 'knn_k': 2, 'weighted_edges': False, 'symmetrize_mode': 'union', 'lr': 2.093025995220435e-05, 'weight_decay': 3.222196026009043e-05, 'epochs': 69, 'use_snp_selection': True, 'num_snps': 24000}. Best is trial 17 with value: 0.32797229290008545.
