[I 2025-10-17 04:33:48,509] Trial 42 finished with value: 0.2937298357486725 and parameters: {'hidden_dims': '[256, 128]', 'dropout': 0.13365672893445776, 'batch_norm': True, 'graph_on': True, 'source': 'grm', 'knn_k': 5, 'weighted_edges': True, 'symmetrize_mode': 'union', 'lr': 1.0609584106935777e-05, 'weight_decay': 7.400788762840183e-06, 'epochs': 106, 'use_snp_selection': True, 'num_snps': 38000}. Best is trial 22 with value: 0.3290797591209412.
[I 2025-10-17 04:34:28,202] Trial 43 finished with value: 0.31078633666038513 and parameters: {'hidden_dims': '[512, 256]', 'dropout': 0.19245029301948166, 'batch_norm': True, 'graph_on': True, 'source': 'grm', 'knn_k': 6, 'weighted_edges': True, 'symmetrize_mode': 'union', 'lr': 4.3504974043507635e-06, 'weight_decay': 2.6617630896425337e-06, 'epochs': 89, 'use_snp_selection': True, 'num_snps': 48000}. Best is trial 22 with value: 0.3290797591209412.
[I 2025-10-17 04:34:54,156] Trial 44 finished with value: 0.2919383645057678 and parameters: {'hidden_dims': '[256, 128]', 'dropout': 0.17993452648308672, 'batch_norm': True, 'graph_on': True, 'source': 'grm', 'knn_k': 3, 'weighted_edges': True, 'symmetrize_mode': 'union', 'lr': 2.631151064900582e-06, 'weight_decay': 4.111659095889544e-05, 'epochs': 57, 'use_snp_selection': True, 'num_snps': 42000}. Best is trial 22 with value: 0.3290797591209412.
[I 2025-10-17 04:35:36,344] Trial 45 finished with value: 0.32597928047180175 and parameters: {'hidden_dims': '[256, 128]', 'dropout': 0.24120227065099806, 'batch_norm': True, 'graph_on': True, 'source': 'grm', 'knn_k': 7, 'weighted_edges': True, 'symmetrize_mode': 'union', 'lr': 1.2128732563217233e-06, 'weight_decay': 1.095780059385389e-05, 'epochs': 298, 'use_snp_selection': True, 'num_snps': 32000}. Best is trial 22 with value: 0.3290797591209412.
[I 2025-10-17 04:36:31,917] Trial 46 finished with value: 0.3168006896972656 and parameters: {'hidden_dims': '[512, 128]', 'dropout': 0.2242298769393179, 'batch_norm': True, 'graph_on': True, 'source': 'grm', 'knn_k': 7, 'weighted_edges': True, 'symmetrize_mode': 'union', 'lr': 1.3331803680140867e-06, 'weight_decay': 0.00010746730564314607, 'epochs': 295, 'use_snp_selection': True, 'num_snps': 28000}. Best is trial 22 with value: 0.3290797591209412.
[I 2025-10-17 04:37:39,216] Trial 47 finished with value: 0.3122355222702026 and parameters: {'hidden_dims': '[512, 256]', 'dropout': 0.28103508206549593, 'batch_norm': False, 'graph_on': True, 'source': 'grm', 'knn_k': 7, 'weighted_edges': False, 'symmetrize_mode': 'union', 'lr': 1.346855211168338e-06, 'weight_decay': 2.278885673312568e-05, 'epochs': 342, 'use_snp_selection': True, 'num_snps': 32000}. Best is trial 22 with value: 0.3290797591209412.
[I 2025-10-17 04:38:16,081] Trial 48 finished with value: 0.3254130780696869 and parameters: {'hidden_dims': '[256, 128]', 'dropout': 0.35748066404708095, 'batch_norm': True, 'graph_on': True, 'source': 'grm', 'knn_k': 7, 'weighted_edges': True, 'symmetrize_mode': 'union', 'lr': 3.2978584711119426e-06, 'weight_decay': 0.00016663366014456967, 'epochs': 284, 'use_snp_selection': True, 'num_snps': 26000}. Best is trial 22 with value: 0.3290797591209412.
[I 2025-10-17 04:38:48,738] Trial 49 finished with value: 0.316633802652359 and parameters: {'hidden_dims': '[256, 128]', 'dropout': 0.36760957707382336, 'batch_norm': True, 'graph_on': True, 'source': 'grm', 'knn_k': 7, 'weighted_edges': True, 'symmetrize_mode': 'union', 'lr': 1.0221917293365644e-06, 'weight_decay': 0.00016592960286963644, 'epochs': 301, 'use_snp_selection': True, 'num_snps': 18000}. Best is trial 22 with value: 0.3290797591209412.
[I 2025-10-17 04:39:24,887] Trial 50 finished with value: 0.3224338352680206 and parameters: {'hidden_dims': '[256, 128]', 'dropout': 0.3404931710402266, 'batch_norm': True, 'graph_on': True, 'source': 'grm', 'knn_k': 7, 'weighted_edges': True, 'symmetrize_mode': 'union', 'lr': 1.9575822102213972e-06, 'weight_decay': 0.0004080391712359191, 'epochs': 273, 'use_snp_selection': True, 'num_snps': 26000}. Best is trial 22 with value: 0.3290797591209412.
[I 2025-10-17 04:40:09,374] Trial 51 finished with value: 0.321296226978302 and parameters: {'hidden_dims': '[256, 128]', 'dropout': 0.39522993145674007, 'batch_norm': True, 'graph_on': True, 'source': 'grm', 'knn_k': 7, 'weighted_edges': True, 'symmetrize_mode': 'union', 'lr': 3.1323453486253337e-06, 'weight_decay': 0.0009446634395666513, 'epochs': 317, 'use_snp_selection': True, 'num_snps': 34000}. Best is trial 22 with value: 0.3290797591209412.
[I 2025-10-17 04:40:46,465] Trial 52 finished with value: 0.3274384617805481 and parameters: {'hidden_dims': '[256, 128]', 'dropout': 0.4170593572907237, 'batch_norm': True, 'graph_on': True, 'source': 'grm', 'knn_k': 7, 'weighted_edges': True, 'symmetrize_mode': 'union', 'lr': 2.406303132051845e-06, 'weight_decay': 6.169506914541303e-05, 'epochs': 263, 'use_snp_selection': True, 'num_snps': 28000}. Best is trial 22 with value: 0.3290797591209412.
[I 2025-10-17 04:41:19,664] Trial 53 finished with value: 0.3251537561416626 and parameters: {'hidden_dims': '[256, 128]', 'dropout': 0.40861814187024303, 'batch_norm': True, 'graph_on': True, 'source': 'grm', 'knn_k': 7, 'weighted_edges': True, 'symmetrize_mode': 'union', 'lr': 2.7750166669883754e-06, 'weight_decay': 0.00018243243739186202, 'epochs': 250, 'use_snp_selection': True, 'num_snps': 24000}. Best is trial 22 with value: 0.3290797591209412.
[I 2025-10-17 04:42:10,221] Trial 54 finished with value: 0.3284155249595642 and parameters: {'hidden_dims': '[512, 64]', 'dropout': 0.44419321858574495, 'batch_norm': True, 'graph_on': True, 'source': 'grm', 'knn_k': 7, 'weighted_edges': True, 'symmetrize_mode': 'union', 'lr': 2.2005327053786685e-06, 'weight_decay': 5.215844488062079e-05, 'epochs': 255, 'use_snp_selection': True, 'num_snps': 28000}. Best is trial 22 with value: 0.3290797591209412.
[I 2025-10-17 04:43:00,970] Trial 55 finished with value: 0.3300714135169983 and parameters: {'hidden_dims': '[512, 64]', 'dropout': 0.42610169852989455, 'batch_norm': True, 'graph_on': True, 'source': 'grm', 'knn_k': 7, 'weighted_edges': True, 'symmetrize_mode': 'union', 'lr': 2.0460479453945934e-06, 'weight_decay': 5.0525362874693444e-05, 'epochs': 256, 'use_snp_selection': True, 'num_snps': 28000}. Best is trial 55 with value: 0.3300714135169983.
[I 2025-10-17 04:43:38,739] Trial 56 finished with value: 0.3013626456260681 and parameters: {'hidden_dims': '[512, 64]', 'dropout': 0.42749967719400844, 'batch_norm': True, 'graph_on': True, 'source': 'grm', 'knn_k': 7, 'weighted_edges': True, 'symmetrize_mode': 'mutual', 'lr': 2.1480097072392887e-06, 'weight_decay': 4.9375106886772756e-05, 'epochs': 217, 'use_snp_selection': True, 'num_snps': 20000}. Best is trial 55 with value: 0.3300714135169983.
[I 2025-10-17 04:44:28,083] Trial 57 finished with value: 0.32582101225852966 and parameters: {'hidden_dims': '[512, 64]', 'dropout': 0.4861211310836788, 'batch_norm': True, 'graph_on': True, 'source': 'grm', 'knn_k': 7, 'weighted_edges': True, 'symmetrize_mode': 'union', 'lr': 1.6766270029176936e-06, 'weight_decay': 9.327759214507221e-05, 'epochs': 244, 'use_snp_selection': True, 'num_snps': 28000}. Best is trial 55 with value: 0.3300714135169983.
[I 2025-10-17 04:45:23,528] Trial 58 finished with value: 0.31902958154678346 and parameters: {'hidden_dims': '[512, 64]', 'dropout': 0.44920023085254723, 'batch_norm': False, 'graph_on': True, 'source': 'grm', 'knn_k': 6, 'weighted_edges': False, 'symmetrize_mode': 'union', 'lr': 3.7403044209636825e-06, 'weight_decay': 5.2525557013809056e-05, 'epochs': 273, 'use_snp_selection': True, 'num_snps': 30000}. Best is trial 55 with value: 0.3300714135169983.
[I 2025-10-17 04:46:08,233] Trial 59 finished with value: 0.32487099766731264 and parameters: {'hidden_dims': '[512, 64]', 'dropout': 0.4264663135907169, 'batch_norm': True, 'graph_on': True, 'source': 'grm', 'knn_k': 7, 'weighted_edges': True, 'symmetrize_mode': 'union', 'lr': 2.280532694978905e-06, 'weight_decay': 3.018632849803076e-05, 'epochs': 263, 'use_snp_selection': True, 'num_snps': 22000}. Best is trial 55 with value: 0.3300714135169983.
[I 2025-10-17 04:46:58,798] Trial 60 finished with value: 0.2157248377799988 and parameters: {'hidden_dims': '[512, 64]', 'dropout': 0.47864786991173575, 'batch_norm': True, 'graph_on': True, 'source': 'grm', 'knn_k': 2, 'weighted_edges': True, 'symmetrize_mode': 'union', 'lr': 8.6209852184322e-05, 'weight_decay': 8.484346487926489e-05, 'epochs': 201, 'use_snp_selection': True, 'num_snps': 36000}. Best is trial 55 with value: 0.3300714135169983.
[I 2025-10-17 04:48:01,167] Trial 61 finished with value: 0.3274396240711212 and parameters: {'hidden_dims': '[512, 64]', 'dropout': 0.4407239947357669, 'batch_norm': True, 'graph_on': True, 'source': 'grm', 'knn_k': 7, 'weighted_edges': True, 'symmetrize_mode': 'union', 'lr': 1.2751441874991306e-06, 'weight_decay': 1.4298406383877756e-05, 'epochs': 308, 'use_snp_selection': True, 'num_snps': 32000}. Best is trial 55 with value: 0.3300714135169983.
[I 2025-10-17 04:48:58,959] Trial 62 finished with value: 0.32560343742370607 and parameters: {'hidden_dims': '[512, 64]', 'dropout': 0.5251712073755658, 'batch_norm': True, 'graph_on': True, 'source': 'grm', 'knn_k': 7, 'weighted_edges': True, 'symmetrize_mode': 'union', 'lr': 1.5067747249117475e-06, 'weight_decay': 0.00013329699844057661, 'epochs': 313, 'use_snp_selection': True, 'num_snps': 28000}. Best is trial 55 with value: 0.3300714135169983.
[I 2025-10-17 04:49:56,734] Trial 63 finished with value: 0.32759294509887693 and parameters: {'hidden_dims': '[512, 64]', 'dropout': 0.4474209728630972, 'batch_norm': True, 'graph_on': True, 'source': 'grm', 'knn_k': 7, 'weighted_edges': True, 'symmetrize_mode': 'union', 'lr': 2.0189379434163086e-06, 'weight_decay': 2.2685182449429785e-05, 'epochs': 330, 'use_snp_selection': True, 'num_snps': 26000}. Best is trial 55 with value: 0.3300714135169983.
[I 2025-10-17 04:50:49,936] Trial 64 finished with value: 0.32188647985458374 and parameters: {'hidden_dims': '[512, 64]', 'dropout': 0.4461447723271267, 'batch_norm': True, 'graph_on': True, 'source': 'grm', 'knn_k': 7, 'weighted_edges': True, 'symmetrize_mode': 'union', 'lr': 1.8909909688948003e-06, 'weight_decay': 2.334254410644515e-05, 'epochs': 327, 'use_snp_selection': True, 'num_snps': 24000}. Best is trial 55 with value: 0.3300714135169983.
[I 2025-10-17 04:51:44,860] Trial 65 finished with value: 0.32668725252151487 and parameters: {'hidden_dims': '[512, 64]', 'dropout': 0.4726681033602477, 'batch_norm': True, 'graph_on': True, 'source': 'grm', 'knn_k': 6, 'weighted_edges': True, 'symmetrize_mode': 'union', 'lr': 1.265989783300449e-06, 'weight_decay': 1.4685556765504539e-05, 'epochs': 241, 'use_snp_selection': True, 'num_snps': 34000}. Best is trial 55 with value: 0.3300714135169983.
[I 2025-10-17 04:52:49,161] Trial 66 finished with value: 0.3282981991767883 and parameters: {'hidden_dims': '[512, 64]', 'dropout': 0.4994746119350371, 'batch_norm': True, 'graph_on': True, 'source': 'grm', 'knn_k': 7, 'weighted_edges': True, 'symmetrize_mode': 'union', 'lr': 2.3499170763339633e-06, 'weight_decay': 5.712149438497315e-06, 'epochs': 336, 'use_snp_selection': True, 'num_snps': 30000}. Best is trial 55 with value: 0.3300714135169983.
[I 2025-10-17 04:54:14,980] Trial 67 finished with value: 0.32049031257629396 and parameters: {'hidden_dims': '[512, 64]', 'dropout': 0.5547215285332933, 'batch_norm': True, 'graph_on': True, 'source': 'grm', 'knn_k': 7, 'weighted_edges': True, 'symmetrize_mode': 'union', 'lr': 1.0919502239090597e-06, 'weight_decay': 6.640960494004598e-06, 'epochs': 339, 'use_snp_selection': True, 'num_snps': 44000}. Best is trial 55 with value: 0.3300714135169983.
[I 2025-10-17 04:54:38,496] Trial 68 finished with value: 0.29081867933273314 and parameters: {'hidden_dims': '[512, 64]', 'dropout': 0.45751771748525105, 'batch_norm': True, 'graph_on': True, 'source': 'grm', 'knn_k': 6, 'weighted_edges': True, 'symmetrize_mode': 'mutual', 'lr': 4.139642712324123e-06, 'weight_decay': 5.165662551920433e-06, 'epochs': 330, 'use_snp_selection': True, 'num_snps': 2000}. Best is trial 55 with value: 0.3300714135169983.
[I 2025-10-17 04:55:40,044] Trial 69 finished with value: 0.3131581723690033 and parameters: {'hidden_dims': '[512, 64]', 'dropout': 0.5006489588499969, 'batch_norm': True, 'graph_on': True, 'source': 'grm', 'knn_k': 6, 'weighted_edges': True, 'symmetrize_mode': 'union', 'lr': 3.1383803317721034e-06, 'weight_decay': 1.7543846091191878e-05, 'epochs': 316, 'use_snp_selection': True, 'num_snps': 30000}. Best is trial 55 with value: 0.3300714135169983.
[I 2025-10-17 04:56:53,124] Trial 70 finished with value: 0.30796616077423095 and parameters: {'hidden_dims': '[512, 64]', 'dropout': 0.5560008703584527, 'batch_norm': False, 'graph_on': True, 'source': 'grm', 'knn_k': 7, 'weighted_edges': False, 'symmetrize_mode': 'union', 'lr': 1.7816932538775552e-06, 'weight_decay': 3.4487154834329847e-06, 'epochs': 347, 'use_snp_selection': True, 'num_snps': 36000}. Best is trial 55 with value: 0.3300714135169983.
[I 2025-10-17 04:57:47,290] Trial 71 finished with value: 0.3219662070274353 and parameters: {'hidden_dims': '[512, 64]', 'dropout': 0.41680685826215647, 'batch_norm': True, 'graph_on': True, 'source': 'grm', 'knn_k': 7, 'weighted_edges': True, 'symmetrize_mode': 'union', 'lr': 2.4139516858975056e-06, 'weight_decay': 3.411001101977851e-05, 'epochs': 283, 'use_snp_selection': True, 'num_snps': 28000}. Best is trial 55 with value: 0.3300714135169983.
[I 2025-10-17 04:58:49,857] Trial 72 finished with value: 0.325663286447525 and parameters: {'hidden_dims': '[512, 64]', 'dropout': 0.43556515036085336, 'batch_norm': True, 'graph_on': True, 'source': 'grm', 'knn_k': 7, 'weighted_edges': True, 'symmetrize_mode': 'union', 'lr': 2.2766375178958716e-06, 'weight_decay': 4.464107026463245e-05, 'epochs': 309, 'use_snp_selection': True, 'num_snps': 32000}. Best is trial 55 with value: 0.3300714135169983.
[I 2025-10-17 04:59:32,401] Trial 73 finished with value: 0.3279188394546509 and parameters: {'hidden_dims': '[512, 64]', 'dropout': 0.5058379723568388, 'batch_norm': True, 'graph_on': True, 'source': 'grm', 'knn_k': 7, 'weighted_edges': True, 'symmetrize_mode': 'union', 'lr': 1.4616882614140486e-06, 'weight_decay': 6.341034012615905e-05, 'epochs': 266, 'use_snp_selection': True, 'num_snps': 20000}. Best is trial 55 with value: 0.3300714135169983.
[I 2025-10-17 05:00:18,376] Trial 74 finished with value: 0.3216168940067291 and parameters: {'hidden_dims': '[512, 64]', 'dropout': 0.5025203089043143, 'batch_norm': True, 'graph_on': True, 'source': 'grm', 'knn_k': 7, 'weighted_edges': True, 'symmetrize_mode': 'union', 'lr': 1.4644422399535276e-06, 'weight_decay': 1.3959157034276073e-05, 'epochs': 330, 'use_snp_selection': True, 'num_snps': 18000}. Best is trial 55 with value: 0.3300714135169983.
[I 2025-10-17 05:00:49,874] Trial 75 finished with value: 0.30601673722267153 and parameters: {'hidden_dims': '[512, 64]', 'dropout': 0.5238114247671297, 'batch_norm': True, 'graph_on': True, 'source': 'grm', 'knn_k': 7, 'weighted_edges': True, 'symmetrize_mode': 'union', 'lr': 1.0118057476398351e-06, 'weight_decay': 2.503192009879743e-05, 'epochs': 210, 'use_snp_selection': True, 'num_snps': 14000}. Best is trial 55 with value: 0.3300714135169983.
[I 2025-10-17 05:01:21,115] Trial 76 finished with value: 0.31613253355026244 and parameters: {'hidden_dims': '[256, 128, 64]', 'dropout': 0.4842817158811602, 'batch_norm': True, 'graph_on': True, 'source': 'grm', 'knn_k': 6, 'weighted_edges': True, 'symmetrize_mode': 'union', 'lr': 1.920262883767016e-06, 'weight_decay': 8.061838310739063e-06, 'epochs': 232, 'use_snp_selection': True, 'num_snps': 20000}. Best is trial 55 with value: 0.3300714135169983.
[I 2025-10-17 05:01:58,693] Trial 77 finished with value: 0.32099186778068545 and parameters: {'hidden_dims': '[512, 64]', 'dropout': 0.5118086761546494, 'batch_norm': True, 'graph_on': True, 'source': 'grm', 'knn_k': 7, 'weighted_edges': True, 'symmetrize_mode': 'union', 'lr': 1.3936870419459734e-06, 'weight_decay': 5.762368385559748e-06, 'epochs': 179, 'use_snp_selection': True, 'num_snps': 24000}. Best is trial 55 with value: 0.3300714135169983.
[I 2025-10-17 05:02:29,253] Trial 78 finished with value: 0.32838053703308107 and parameters: {'hidden_dims': '[128, 64]', 'dropout': 0.45978655366410986, 'batch_norm': True, 'graph_on': True, 'source': 'grm', 'knn_k': 7, 'weighted_edges': True, 'symmetrize_mode': 'union', 'lr': 3.604093992536205e-06, 'weight_decay': 1.9236170455274055e-05, 'epochs': 350, 'use_snp_selection': True, 'num_snps': 22000}. Best is trial 55 with value: 0.3300714135169983.
[I 2025-10-17 05:02:59,446] Trial 79 finished with value: 0.25959526300430297 and parameters: {'hidden_dims': '[128, 64]', 'dropout': 0.4620643107863859, 'batch_norm': True, 'graph_on': True, 'source': 'grm', 'knn_k': 4, 'weighted_edges': True, 'symmetrize_mode': 'mutual', 'lr': 3.8034184876608984e-06, 'weight_decay': 3.7212938151264976e-06, 'epochs': 349, 'use_snp_selection': True, 'num_snps': 22000}. Best is trial 55 with value: 0.3300714135169983.
[I 2025-10-17 05:03:26,940] Trial 80 finished with value: 0.3181190550327301 and parameters: {'hidden_dims': '[128, 64]', 'dropout': 0.5429046043884347, 'batch_norm': True, 'graph_on': True, 'source': 'grm', 'knn_k': 6, 'weighted_edges': True, 'symmetrize_mode': 'union', 'lr': 2.848346724497817e-06, 'weight_decay': 2.028246669819477e-05, 'epochs': 322, 'use_snp_selection': True, 'num_snps': 16000}. Best is trial 55 with value: 0.3300714135169983.
[I 2025-10-17 05:04:15,836] Trial 81 finished with value: 0.3238290727138519 and parameters: {'hidden_dims': '[512, 128]', 'dropout': 0.38807207929293686, 'batch_norm': True, 'graph_on': True, 'source': 'grm', 'knn_k': 7, 'weighted_edges': True, 'symmetrize_mode': 'union', 'lr': 1.696346973571919e-06, 'weight_decay': 2.8474744539516383e-05, 'epochs': 336, 'use_snp_selection': True, 'num_snps': 20000}. Best is trial 55 with value: 0.3300714135169983.
[I 2025-10-17 05:05:10,474] Trial 82 finished with value: 0.3279459774494171 and parameters: {'hidden_dims': '[512, 64]', 'dropout': 0.4714896797683274, 'batch_norm': True, 'graph_on': True, 'source': 'grm', 'knn_k': 7, 'weighted_edges': True, 'symmetrize_mode': 'union', 'lr': 1.2894410431889277e-06, 'weight_decay': 9.268125667059429e-06, 'epochs': 304, 'use_snp_selection': True, 'num_snps': 26000}. Best is trial 55 with value: 0.3300714135169983.
[I 2025-10-17 05:05:39,874] Trial 83 finished with value: 0.29720935225486755 and parameters: {'hidden_dims': '[128, 64]', 'dropout': 0.5841697960608734, 'batch_norm': True, 'graph_on': True, 'source': 'grm', 'knn_k': 7, 'weighted_edges': True, 'symmetrize_mode': 'union', 'lr': 3.728144738504092e-05, 'weight_decay': 8.476731918835713e-06, 'epochs': 281, 'use_snp_selection': True, 'num_snps': 26000}. Best is trial 55 with value: 0.3300714135169983.
[I 2025-10-17 05:06:08,951] Trial 84 finished with value: 0.263293394446373 and parameters: {'hidden_dims': '[128, 64]', 'dropout': 0.4883948604459653, 'batch_norm': True, 'graph_on': True, 'source': 'grm', 'knn_k': 7, 'weighted_edges': True, 'symmetrize_mode': 'union', 'lr': 0.000213701922789726, 'weight_decay': 6.774756216565623e-05, 'epochs': 292, 'use_snp_selection': True, 'num_snps': 24000}. Best is trial 55 with value: 0.3300714135169983.
[I 2025-10-17 05:07:03,454] Trial 85 finished with value: 0.3244562685489655 and parameters: {'hidden_dims': '[512, 64]', 'dropout': 0.4689295365626466, 'batch_norm': True, 'graph_on': True, 'source': 'grm', 'knn_k': 7, 'weighted_edges': True, 'symmetrize_mode': 'union', 'lr': 2.0294468925431686e-06, 'weight_decay': 3.665412813411761e-05, 'epochs': 303, 'use_snp_selection': True, 'num_snps': 26000}. Best is trial 55 with value: 0.3300714135169983.
[I 2025-10-17 05:07:45,494] Trial 86 finished with value: 0.3260945200920105 and parameters: {'hidden_dims': '[512, 256]', 'dropout': 0.4560900399348879, 'batch_norm': True, 'graph_on': True, 'source': 'grm', 'knn_k': 6, 'weighted_edges': True, 'symmetrize_mode': 'union', 'lr': 3.4785380154540602e-06, 'weight_decay': 1.3084379939977876e-05, 'epochs': 166, 'use_snp_selection': True, 'num_snps': 30000}. Best is trial 55 with value: 0.3300714135169983.
[I 2025-10-17 05:08:29,314] Trial 87 finished with value: 0.30616495013237 and parameters: {'hidden_dims': '[512, 64]', 'dropout': 0.5174121019395258, 'batch_norm': False, 'graph_on': True, 'source': 'grm', 'knn_k': 7, 'weighted_edges': False, 'symmetrize_mode': 'union', 'lr': 2.687595551144282e-06, 'weight_decay': 9.917643674675596e-06, 'epochs': 259, 'use_snp_selection': True, 'num_snps': 22000}. Best is trial 55 with value: 0.3300714135169983.
[I 2025-10-17 05:09:23,814] Trial 88 finished with value: 0.3091675519943237 and parameters: {'hidden_dims': '[256, 128, 64]', 'dropout': 0.4957075852908507, 'batch_norm': True, 'graph_on': True, 'source': 'grm', 'knn_k': 7, 'weighted_edges': True, 'symmetrize_mode': 'union', 'lr': 6.916581640573291e-06, 'weight_decay': 1.8376930436467982e-05, 'epochs': 336, 'use_snp_selection': True, 'num_snps': 42000}. Best is trial 55 with value: 0.3300714135169983.
[I 2025-10-17 05:09:50,312] Trial 89 finished with value: 0.32451931238174436 and parameters: {'hidden_dims': '[128, 64]', 'dropout': 0.5354595415458657, 'batch_norm': True, 'graph_on': True, 'source': 'grm', 'knn_k': 6, 'weighted_edges': True, 'symmetrize_mode': 'union', 'lr': 4.816282582388681e-06, 'weight_decay': 8.851892765505232e-06, 'epochs': 275, 'use_snp_selection': True, 'num_snps': 18000}. Best is trial 55 with value: 0.3300714135169983.
