[I 2025-10-17 00:44:31,109] Trial 108 finished with value: 0.3209811389446259 and parameters: {'hidden_dims': '[512, 256]', 'dropout': 0.44318128202268825, 'batch_norm': False, 'graph_on': True, 'source': 'grm', 'knn_k': 2, 'weighted_edges': False, 'symmetrize_mode': 'mutual', 'lr': 3.3303443119535846e-06, 'weight_decay': 1.908065408645374e-05, 'epochs': 73, 'use_snp_selection': True, 'num_snps': 44000}. Best is trial 97 with value: 0.3451789140701294.
[I 2025-10-17 00:44:55,876] Trial 109 finished with value: 0.2610189139842987 and parameters: {'hidden_dims': '[512, 256]', 'dropout': 0.3398534123008198, 'batch_norm': False, 'graph_on': True, 'source': 'grm', 'knn_k': 1, 'weighted_edges': False, 'symmetrize_mode': 'mutual', 'lr': 4.811038498774111e-06, 'weight_decay': 2.285441556113695e-05, 'epochs': 18, 'use_snp_selection': True, 'num_snps': 48000}. Best is trial 97 with value: 0.3451789140701294.
[I 2025-10-17 00:45:23,376] Trial 110 finished with value: 0.24573712348937987 and parameters: {'hidden_dims': '[256, 128, 64]', 'dropout': 0.3523208678960942, 'batch_norm': False, 'graph_on': True, 'source': 'grm', 'knn_k': 1, 'weighted_edges': False, 'symmetrize_mode': 'mutual', 'lr': 2.177594758006977e-06, 'weight_decay': 9.985308928921768e-06, 'epochs': 54, 'use_snp_selection': True, 'num_snps': 52000}. Best is trial 97 with value: 0.3451789140701294.
[I 2025-10-17 00:45:58,020] Trial 111 finished with value: 0.3471894383430481 and parameters: {'hidden_dims': '[512, 256]', 'dropout': 0.3874138845613755, 'batch_norm': False, 'graph_on': True, 'source': 'grm', 'knn_k': 1, 'weighted_edges': False, 'symmetrize_mode': 'mutual', 'lr': 7.484879749530357e-06, 'weight_decay': 2.5792631263465505e-05, 'epochs': 85, 'use_snp_selection': True, 'num_snps': 40000}. Best is trial 111 with value: 0.3471894383430481.
[I 2025-10-17 00:46:33,262] Trial 112 finished with value: 0.3042303562164307 and parameters: {'hidden_dims': '[512, 256]', 'dropout': 0.3883404879480661, 'batch_norm': False, 'graph_on': True, 'source': 'grm', 'knn_k': 1, 'weighted_edges': False, 'symmetrize_mode': 'mutual', 'lr': 1.536304811251125e-06, 'weight_decay': 2.6038396672055395e-05, 'epochs': 89, 'use_snp_selection': True, 'num_snps': 40000}. Best is trial 111 with value: 0.3471894383430481.
[I 2025-10-17 00:47:08,233] Trial 113 finished with value: 0.3443615555763245 and parameters: {'hidden_dims': '[512, 256]', 'dropout': 0.40249173560928664, 'batch_norm': False, 'graph_on': True, 'source': 'grm', 'knn_k': 1, 'weighted_edges': False, 'symmetrize_mode': 'mutual', 'lr': 6.100410675258624e-06, 'weight_decay': 1.2636119509950966e-05, 'epochs': 77, 'use_snp_selection': True, 'num_snps': 44000}. Best is trial 111 with value: 0.3471894383430481.
[I 2025-10-17 00:47:41,437] Trial 114 finished with value: 0.3462218403816223 and parameters: {'hidden_dims': '[512, 256]', 'dropout': 0.4039963404317523, 'batch_norm': False, 'graph_on': True, 'source': 'grm', 'knn_k': 1, 'weighted_edges': False, 'symmetrize_mode': 'mutual', 'lr': 5.619251234606368e-06, 'weight_decay': 4.991715038851683e-06, 'epochs': 67, 'use_snp_selection': True, 'num_snps': 44000}. Best is trial 111 with value: 0.3471894383430481.
[I 2025-10-17 00:48:14,924] Trial 115 finished with value: 0.3499588668346405 and parameters: {'hidden_dims': '[512, 256]', 'dropout': 0.37443454697894896, 'batch_norm': False, 'graph_on': True, 'source': 'grm', 'knn_k': 1, 'weighted_edges': False, 'symmetrize_mode': 'mutual', 'lr': 5.915697157529529e-06, 'weight_decay': 4.068549880563048e-06, 'epochs': 69, 'use_snp_selection': True, 'num_snps': 44000}. Best is trial 115 with value: 0.3499588668346405.
[I 2025-10-17 00:48:48,085] Trial 116 finished with value: 0.32964072823524476 and parameters: {'hidden_dims': '[512, 128]', 'dropout': 0.3802902062222621, 'batch_norm': False, 'graph_on': True, 'source': 'grm', 'knn_k': 1, 'weighted_edges': False, 'symmetrize_mode': 'mutual', 'lr': 3.827243817042188e-06, 'weight_decay': 4.254452546810355e-06, 'epochs': 67, 'use_snp_selection': True, 'num_snps': 44000}. Best is trial 115 with value: 0.3499588668346405.
[I 2025-10-17 00:49:21,127] Trial 117 finished with value: 0.3046516299247742 and parameters: {'hidden_dims': '[512, 128]', 'dropout': 0.37408165331057947, 'batch_norm': False, 'graph_on': True, 'source': 'grm', 'knn_k': 1, 'weighted_edges': False, 'symmetrize_mode': 'mutual', 'lr': 2.7757609061051532e-06, 'weight_decay': 4.680705748070314e-06, 'epochs': 65, 'use_snp_selection': True, 'num_snps': 44000}. Best is trial 115 with value: 0.3499588668346405.
[I 2025-10-17 00:49:48,870] Trial 118 finished with value: 0.28371906876564024 and parameters: {'hidden_dims': '[512, 256]', 'dropout': 0.4014883561916579, 'batch_norm': False, 'graph_on': True, 'source': 'grm', 'knn_k': 1, 'weighted_edges': False, 'symmetrize_mode': 'mutual', 'lr': 3.7784417674905143e-06, 'weight_decay': 2.549734579249827e-06, 'epochs': 35, 'use_snp_selection': True, 'num_snps': 46000}. Best is trial 115 with value: 0.3499588668346405.
[I 2025-10-17 00:50:20,040] Trial 119 finished with value: 0.32173448204994204 and parameters: {'hidden_dims': '[512, 128]', 'dropout': 0.3800020276300708, 'batch_norm': False, 'graph_on': True, 'source': 'grm', 'knn_k': 2, 'weighted_edges': False, 'symmetrize_mode': 'mutual', 'lr': 6.013389137185646e-06, 'weight_decay': 4.739877381492805e-06, 'epochs': 59, 'use_snp_selection': True, 'num_snps': 42000}. Best is trial 115 with value: 0.3499588668346405.
[I 2025-10-17 00:50:56,636] Trial 120 finished with value: 0.3439720094203949 and parameters: {'hidden_dims': '[512, 128]', 'dropout': 0.36196956702836797, 'batch_norm': False, 'graph_on': True, 'source': 'grm', 'knn_k': 1, 'weighted_edges': False, 'symmetrize_mode': 'mutual', 'lr': 4.769998374892652e-06, 'weight_decay': 1.3801589019310534e-06, 'epochs': 79, 'use_snp_selection': True, 'num_snps': 48000}. Best is trial 115 with value: 0.3499588668346405.
[I 2025-10-17 00:51:32,323] Trial 121 finished with value: 0.33886159062385557 and parameters: {'hidden_dims': '[512, 128]', 'dropout': 0.33526989677548535, 'batch_norm': False, 'graph_on': True, 'source': 'grm', 'knn_k': 1, 'weighted_edges': False, 'symmetrize_mode': 'mutual', 'lr': 4.1853764718076625e-06, 'weight_decay': 1.5727137820613786e-06, 'epochs': 74, 'use_snp_selection': True, 'num_snps': 48000}. Best is trial 115 with value: 0.3499588668346405.
[I 2025-10-17 00:52:09,733] Trial 122 finished with value: 0.3463779926300049 and parameters: {'hidden_dims': '[512, 128]', 'dropout': 0.3357596666268816, 'batch_norm': False, 'graph_on': True, 'source': 'grm', 'knn_k': 1, 'weighted_edges': False, 'symmetrize_mode': 'mutual', 'lr': 4.6010193626354875e-06, 'weight_decay': 1.3163073155259492e-06, 'epochs': 79, 'use_snp_selection': True, 'num_snps': 50000}. Best is trial 115 with value: 0.3499588668346405.
[I 2025-10-17 00:52:46,637] Trial 123 finished with value: 0.3439190149307251 and parameters: {'hidden_dims': '[512, 128]', 'dropout': 0.33515057246633234, 'batch_norm': False, 'graph_on': True, 'source': 'grm', 'knn_k': 1, 'weighted_edges': False, 'symmetrize_mode': 'mutual', 'lr': 4.583739707608491e-06, 'weight_decay': 1.1720689367885112e-06, 'epochs': 76, 'use_snp_selection': True, 'num_snps': 50000}. Best is trial 115 with value: 0.3499588668346405.
[I 2025-10-17 00:53:25,109] Trial 124 finished with value: 0.3473290026187897 and parameters: {'hidden_dims': '[512, 128]', 'dropout': 0.34952988692215087, 'batch_norm': False, 'graph_on': True, 'source': 'grm', 'knn_k': 1, 'weighted_edges': False, 'symmetrize_mode': 'mutual', 'lr': 4.6963695593670955e-06, 'weight_decay': 1.4578897470602082e-06, 'epochs': 79, 'use_snp_selection': True, 'num_snps': 52000}. Best is trial 115 with value: 0.3499588668346405.
[I 2025-10-17 00:54:02,152] Trial 125 finished with value: 0.348611980676651 and parameters: {'hidden_dims': '[512, 128]', 'dropout': 0.317955979402167, 'batch_norm': False, 'graph_on': True, 'source': 'grm', 'knn_k': 1, 'weighted_edges': False, 'symmetrize_mode': 'mutual', 'lr': 4.8447150792636455e-06, 'weight_decay': 1.3837631551466604e-06, 'epochs': 77, 'use_snp_selection': True, 'num_snps': 50000}. Best is trial 115 with value: 0.3499588668346405.
[I 2025-10-17 00:54:39,792] Trial 126 finished with value: 0.33749733567237855 and parameters: {'hidden_dims': '[512, 128]', 'dropout': 0.3346819185066181, 'batch_norm': False, 'graph_on': True, 'source': 'grm', 'knn_k': 1, 'weighted_edges': False, 'symmetrize_mode': 'mutual', 'lr': 3.1107191616911836e-06, 'weight_decay': 1.4478777915033213e-06, 'epochs': 75, 'use_snp_selection': True, 'num_snps': 52000}. Best is trial 115 with value: 0.3499588668346405.
[I 2025-10-17 00:55:18,421] Trial 127 finished with value: 0.3133776605129242 and parameters: {'hidden_dims': '[512, 128]', 'dropout': 0.3337898233634106, 'batch_norm': False, 'graph_on': True, 'source': 'grm', 'knn_k': 2, 'weighted_edges': False, 'symmetrize_mode': 'mutual', 'lr': 2.556508167137849e-06, 'weight_decay': 1.4830502514836095e-06, 'epochs': 78, 'use_snp_selection': True, 'num_snps': 52000}. Best is trial 115 with value: 0.3499588668346405.
[I 2025-10-17 00:56:00,129] Trial 128 finished with value: 0.3439748764038086 and parameters: {'hidden_dims': '[512, 128]', 'dropout': 0.3178991256967005, 'batch_norm': False, 'graph_on': True, 'source': 'grm', 'knn_k': 1, 'weighted_edges': False, 'symmetrize_mode': 'mutual', 'lr': 6.274184370637807e-06, 'weight_decay': 8.506933373675051e-07, 'epochs': 86, 'use_snp_selection': True, 'num_snps': 56000}. Best is trial 115 with value: 0.3499588668346405.
[I 2025-10-17 00:56:41,362] Trial 129 finished with value: 0.344624274969101 and parameters: {'hidden_dims': '[512, 128]', 'dropout': 0.297110778682488, 'batch_norm': False, 'graph_on': True, 'source': 'grm', 'knn_k': 1, 'weighted_edges': False, 'symmetrize_mode': 'mutual', 'lr': 5.8909180918448945e-06, 'weight_decay': 8.028326123712108e-07, 'epochs': 84, 'use_snp_selection': True, 'num_snps': 56000}. Best is trial 115 with value: 0.3499588668346405.
[I 2025-10-17 00:57:23,638] Trial 130 finished with value: 0.35029696822166445 and parameters: {'hidden_dims': '[512, 128]', 'dropout': 0.2968731459869662, 'batch_norm': False, 'graph_on': True, 'source': 'grm', 'knn_k': 1, 'weighted_edges': False, 'symmetrize_mode': 'mutual', 'lr': 5.9207212447016706e-06, 'weight_decay': 7.921371011788098e-07, 'epochs': 85, 'use_snp_selection': True, 'num_snps': 58000}. Best is trial 130 with value: 0.35029696822166445.
[I 2025-10-17 00:58:05,984] Trial 131 finished with value: 0.3439728140830994 and parameters: {'hidden_dims': '[512, 128]', 'dropout': 0.2984398610753437, 'batch_norm': False, 'graph_on': True, 'source': 'grm', 'knn_k': 1, 'weighted_edges': False, 'symmetrize_mode': 'mutual', 'lr': 5.986301172811232e-06, 'weight_decay': 7.584483056147552e-07, 'epochs': 85, 'use_snp_selection': True, 'num_snps': 58000}. Best is trial 130 with value: 0.35029696822166445.
[I 2025-10-17 00:58:47,797] Trial 132 finished with value: 0.3481882572174072 and parameters: {'hidden_dims': '[512, 128]', 'dropout': 0.3183053632108283, 'batch_norm': False, 'graph_on': True, 'source': 'grm', 'knn_k': 1, 'weighted_edges': False, 'symmetrize_mode': 'mutual', 'lr': 5.864616413964672e-06, 'weight_decay': 7.602212137411046e-07, 'epochs': 83, 'use_snp_selection': True, 'num_snps': 58000}. Best is trial 130 with value: 0.35029696822166445.
[I 2025-10-17 00:59:29,886] Trial 133 finished with value: 0.3470097303390503 and parameters: {'hidden_dims': '[512, 128]', 'dropout': 0.31608908504319266, 'batch_norm': False, 'graph_on': True, 'source': 'grm', 'knn_k': 1, 'weighted_edges': False, 'symmetrize_mode': 'mutual', 'lr': 6.261316759915847e-06, 'weight_decay': 6.462894232173828e-07, 'epochs': 80, 'use_snp_selection': True, 'num_snps': 60000}. Best is trial 130 with value: 0.35029696822166445.
[I 2025-10-17 01:00:12,770] Trial 134 finished with value: 0.3230175137519836 and parameters: {'hidden_dims': '[512, 128]', 'dropout': 0.2967287845753033, 'batch_norm': False, 'graph_on': True, 'source': 'grm', 'knn_k': 2, 'weighted_edges': False, 'symmetrize_mode': 'mutual', 'lr': 7.254811779815671e-06, 'weight_decay': 6.59179200351318e-07, 'epochs': 86, 'use_snp_selection': True, 'num_snps': 58000}. Best is trial 130 with value: 0.35029696822166445.
[I 2025-10-17 01:00:59,521] Trial 135 finished with value: 0.34775479435920714 and parameters: {'hidden_dims': '[512, 128]', 'dropout': 0.322178224392821, 'batch_norm': False, 'graph_on': True, 'source': 'grm', 'knn_k': 1, 'weighted_edges': False, 'symmetrize_mode': 'mutual', 'lr': 5.884241294138443e-06, 'weight_decay': 7.230624065750941e-07, 'epochs': 99, 'use_snp_selection': True, 'num_snps': 60000}. Best is trial 130 with value: 0.35029696822166445.
[I 2025-10-17 01:01:46,076] Trial 136 finished with value: 0.34298808574676515 and parameters: {'hidden_dims': '[512, 128]', 'dropout': 0.3169902044191248, 'batch_norm': False, 'graph_on': True, 'source': 'grm', 'knn_k': 1, 'weighted_edges': False, 'symmetrize_mode': 'mutual', 'lr': 7.619635504620693e-06, 'weight_decay': 4.7437087970674417e-07, 'epochs': 98, 'use_snp_selection': True, 'num_snps': 60000}. Best is trial 130 with value: 0.35029696822166445.
[I 2025-10-17 01:02:31,926] Trial 137 finished with value: 0.3434094250202179 and parameters: {'hidden_dims': '[512, 128]', 'dropout': 0.2760830335433979, 'batch_norm': False, 'graph_on': True, 'source': 'grm', 'knn_k': 1, 'weighted_edges': False, 'symmetrize_mode': 'mutual', 'lr': 5.946251946042753e-06, 'weight_decay': 9.803135804148715e-07, 'epochs': 100, 'use_snp_selection': True, 'num_snps': 58000}. Best is trial 130 with value: 0.35029696822166445.
[I 2025-10-17 01:03:15,077] Trial 138 finished with value: 0.3456965386867523 and parameters: {'hidden_dims': '[512, 128]', 'dropout': 0.2578614772294385, 'batch_norm': False, 'graph_on': True, 'source': 'grm', 'knn_k': 1, 'weighted_edges': False, 'symmetrize_mode': 'mutual', 'lr': 6.736470041230345e-06, 'weight_decay': 4.948645401219058e-07, 'epochs': 92, 'use_snp_selection': True, 'num_snps': 56000}. Best is trial 130 with value: 0.35029696822166445.
[I 2025-10-17 01:03:53,194] Trial 139 finished with value: 0.3447944164276123 and parameters: {'hidden_dims': '[512, 128]', 'dropout': 0.23592953315988993, 'batch_norm': False, 'graph_on': True, 'source': 'grm', 'knn_k': 1, 'weighted_edges': False, 'symmetrize_mode': 'mutual', 'lr': 7.166957551945129e-06, 'weight_decay': 5.450198025097995e-07, 'epochs': 70, 'use_snp_selection': True, 'num_snps': 56000}. Best is trial 130 with value: 0.35029696822166445.
[I 2025-10-17 01:04:36,642] Trial 140 finished with value: 0.34719051122665406 and parameters: {'hidden_dims': '[512, 128]', 'dropout': 0.2522081755707252, 'batch_norm': False, 'graph_on': True, 'source': 'grm', 'knn_k': 1, 'weighted_edges': False, 'symmetrize_mode': 'mutual', 'lr': 7.677949538291437e-06, 'weight_decay': 3.202114913456136e-07, 'epochs': 94, 'use_snp_selection': True, 'num_snps': 56000}. Best is trial 130 with value: 0.35029696822166445.
[I 2025-10-17 01:05:14,305] Trial 141 finished with value: 0.3466552972793579 and parameters: {'hidden_dims': '[512, 128]', 'dropout': 0.23947574889381715, 'batch_norm': False, 'graph_on': True, 'source': 'grm', 'knn_k': 1, 'weighted_edges': False, 'symmetrize_mode': 'mutual', 'lr': 7.1356682217779735e-06, 'weight_decay': 2.6208737386828107e-07, 'epochs': 68, 'use_snp_selection': True, 'num_snps': 56000}. Best is trial 130 with value: 0.35029696822166445.
[I 2025-10-17 01:05:59,678] Trial 142 finished with value: 0.34434384703636167 and parameters: {'hidden_dims': '[512, 128]', 'dropout': 0.22584757129097122, 'batch_norm': False, 'graph_on': True, 'source': 'grm', 'knn_k': 1, 'weighted_edges': False, 'symmetrize_mode': 'mutual', 'lr': 7.705374673365107e-06, 'weight_decay': 2.2951298220690176e-07, 'epochs': 93, 'use_snp_selection': True, 'num_snps': 60000}. Best is trial 130 with value: 0.35029696822166445.
[I 2025-10-17 01:06:37,817] Trial 143 finished with value: 0.3449792265892029 and parameters: {'hidden_dims': '[512, 128]', 'dropout': 0.2497985044579449, 'batch_norm': False, 'graph_on': True, 'source': 'grm', 'knn_k': 1, 'weighted_edges': False, 'symmetrize_mode': 'mutual', 'lr': 7.010580216924748e-06, 'weight_decay': 2.737896800819463e-07, 'epochs': 70, 'use_snp_selection': True, 'num_snps': 56000}. Best is trial 130 with value: 0.35029696822166445.
[I 2025-10-17 01:07:09,742] Trial 144 finished with value: 0.3325244128704071 and parameters: {'hidden_dims': '[512, 128]', 'dropout': 0.27964278918891483, 'batch_norm': False, 'graph_on': True, 'source': 'grm', 'knn_k': 1, 'weighted_edges': False, 'symmetrize_mode': 'mutual', 'lr': 5.38937228691411e-06, 'weight_decay': 3.142979494074842e-07, 'epochs': 46, 'use_snp_selection': True, 'num_snps': 54000}. Best is trial 130 with value: 0.35029696822166445.
[I 2025-10-17 01:07:56,355] Trial 145 finished with value: 0.3201812505722046 and parameters: {'hidden_dims': '[512, 128]', 'dropout': 0.25431479909845545, 'batch_norm': False, 'graph_on': True, 'source': 'grm', 'knn_k': 2, 'weighted_edges': False, 'symmetrize_mode': 'mutual', 'lr': 8.661929827626589e-06, 'weight_decay': 2.5320882704683193e-07, 'epochs': 102, 'use_snp_selection': True, 'num_snps': 58000}. Best is trial 130 with value: 0.35029696822166445.
[I 2025-10-17 01:08:35,548] Trial 146 finished with value: 0.3470361948013306 and parameters: {'hidden_dims': '[512, 128]', 'dropout': 0.2586885372331542, 'batch_norm': False, 'graph_on': True, 'source': 'grm', 'knn_k': 1, 'weighted_edges': False, 'symmetrize_mode': 'mutual', 'lr': 6.919810659871002e-06, 'weight_decay': 1.4545915363312627e-07, 'epochs': 68, 'use_snp_selection': True, 'num_snps': 60000}. Best is trial 130 with value: 0.35029696822166445.
[I 2025-10-17 01:09:21,331] Trial 147 finished with value: 0.3419692873954773 and parameters: {'hidden_dims': '[512, 128]', 'dropout': 0.3250222382945482, 'batch_norm': False, 'graph_on': True, 'source': 'grm', 'knn_k': 1, 'weighted_edges': False, 'symmetrize_mode': 'mutual', 'lr': 5.306302109157225e-06, 'weight_decay': 1.1281846998584394e-07, 'epochs': 95, 'use_snp_selection': True, 'num_snps': 60000}. Best is trial 130 with value: 0.35029696822166445.
[I 2025-10-17 01:10:03,724] Trial 148 finished with value: 0.343379282951355 and parameters: {'hidden_dims': '[512, 128]', 'dropout': 0.20592792055175305, 'batch_norm': False, 'graph_on': True, 'source': 'grm', 'knn_k': 1, 'weighted_edges': False, 'symmetrize_mode': 'mutual', 'lr': 9.37565495877973e-06, 'weight_decay': 1.922575805930397e-07, 'epochs': 81, 'use_snp_selection': True, 'num_snps': 60000}. Best is trial 130 with value: 0.35029696822166445.
[I 2025-10-17 01:10:41,791] Trial 149 finished with value: 0.3400020897388458 and parameters: {'hidden_dims': '[512, 128]', 'dropout': 0.2893046329707267, 'batch_norm': False, 'graph_on': True, 'source': 'grm', 'knn_k': 1, 'weighted_edges': False, 'symmetrize_mode': 'mutual', 'lr': 6.796485454014885e-06, 'weight_decay': 5.947016948818257e-07, 'epochs': 67, 'use_snp_selection': True, 'num_snps': 58000}. Best is trial 130 with value: 0.35029696822166445.
[I 2025-10-17 01:11:16,082] Trial 0 finished with value: 0.2258416712284088 and parameters: {'hidden_dims': '[128, 64]', 'dropout': 0.199031432379812, 'batch_norm': True, 'graph_on': True, 'source': 'grm', 'knn_k': 1, 'weighted_edges': True, 'symmetrize_mode': 'union', 'lr': 0.0002740708741343236, 'weight_decay': 2.819059662190987e-05, 'epochs': 256, 'use_snp_selection': True, 'num_snps': 18000}. Best is trial 0 with value: 0.2258416712284088.
[I 2025-10-17 01:11:35,550] Trial 1 finished with value: 0.26873558163642886 and parameters: {'hidden_dims': '[128, 64]', 'dropout': 0.32091658721149807, 'batch_norm': False, 'graph_on': True, 'source': 'grm', 'knn_k': 4, 'weighted_edges': False, 'symmetrize_mode': 'mutual', 'lr': 0.0005320428882732732, 'weight_decay': 1.89210117736594e-06, 'epochs': 40, 'use_snp_selection': True, 'num_snps': 20000}. Best is trial 1 with value: 0.26873558163642886.
[I 2025-10-17 01:12:01,682] Trial 2 finished with value: 0.29644877314567564 and parameters: {'hidden_dims': '[256, 128]', 'dropout': 0.19947376983940615, 'batch_norm': True, 'graph_on': True, 'source': 'grm', 'knn_k': 6, 'weighted_edges': True, 'symmetrize_mode': 'mutual', 'lr': 1.5051775490493461e-05, 'weight_decay': 2.3650563799866155e-07, 'epochs': 289, 'use_snp_selection': True, 'num_snps': 10000}. Best is trial 2 with value: 0.29644877314567564.
[I 2025-10-17 01:12:23,673] Trial 3 finished with value: 0.32146102786064146 and parameters: {'hidden_dims': '[512, 256]', 'dropout': 0.3986858241154422, 'batch_norm': True, 'graph_on': True, 'source': 'grm', 'knn_k': 5, 'weighted_edges': True, 'symmetrize_mode': 'union', 'lr': 9.821050313409216e-06, 'weight_decay': 0.00012454353397331594, 'epochs': 23, 'use_snp_selection': True, 'num_snps': 26000}. Best is trial 3 with value: 0.32146102786064146.
[I 2025-10-17 01:12:59,349] Trial 4 finished with value: 0.3227506935596466 and parameters: {'hidden_dims': '[256, 128, 64]', 'dropout': 0.5390483213624292, 'batch_norm': False, 'graph_on': True, 'source': 'grm', 'knn_k': 4, 'weighted_edges': False, 'symmetrize_mode': 'mutual', 'lr': 8.11311593386297e-06, 'weight_decay': 9.296158109581328e-07, 'epochs': 200, 'use_snp_selection': True, 'num_snps': 34000}. Best is trial 4 with value: 0.3227506935596466.
[I 2025-10-17 01:13:38,351] Trial 5 finished with value: 0.26102901697158815 and parameters: {'hidden_dims': '[256, 128, 64]', 'dropout': 0.5885461262002587, 'batch_norm': False, 'graph_on': True, 'source': 'grm', 'knn_k': 3, 'weighted_edges': False, 'symmetrize_mode': 'mutual', 'lr': 1.164930281795184e-06, 'weight_decay': 1.3145475249585842e-07, 'epochs': 145, 'use_snp_selection': True, 'num_snps': 54000}. Best is trial 4 with value: 0.3227506935596466.
