[I 2025-10-17 00:18:02,647] Trial 60 finished with value: 0.3031162440776825 and parameters: {'hidden_dims': '[512, 256]', 'dropout': 0.5432568448083951, 'batch_norm': False, 'graph_on': True, 'source': 'grm', 'knn_k': 6, 'weighted_edges': False, 'symmetrize_mode': 'union', 'lr': 2.3409407968128735e-06, 'weight_decay': 0.0003537570923613229, 'epochs': 134, 'use_snp_selection': True, 'num_snps': 32000}. Best is trial 54 with value: 0.32737566232681276.
[I 2025-10-17 00:18:37,902] Trial 61 finished with value: 0.32411946058273317 and parameters: {'hidden_dims': '[512, 256]', 'dropout': 0.5174973160375563, 'batch_norm': False, 'graph_on': True, 'source': 'grm', 'knn_k': 7, 'weighted_edges': False, 'symmetrize_mode': 'mutual', 'lr': 7.152828842733928e-06, 'weight_decay': 0.0002052507580482395, 'epochs': 158, 'use_snp_selection': True, 'num_snps': 24000}. Best is trial 54 with value: 0.32737566232681276.
[I 2025-10-17 00:19:14,043] Trial 62 finished with value: 0.3255455493927002 and parameters: {'hidden_dims': '[512, 256]', 'dropout': 0.4605078280658324, 'batch_norm': False, 'graph_on': True, 'source': 'grm', 'knn_k': 7, 'weighted_edges': False, 'symmetrize_mode': 'mutual', 'lr': 4.374320911428461e-06, 'weight_decay': 0.000380474165340041, 'epochs': 146, 'use_snp_selection': True, 'num_snps': 26000}. Best is trial 54 with value: 0.32737566232681276.
[I 2025-10-17 00:19:49,171] Trial 63 finished with value: 0.3249644756317139 and parameters: {'hidden_dims': '[512, 256]', 'dropout': 0.5546208952704403, 'batch_norm': False, 'graph_on': True, 'source': 'grm', 'knn_k': 7, 'weighted_edges': False, 'symmetrize_mode': 'mutual', 'lr': 6.452331867204761e-06, 'weight_decay': 0.0009154562322720122, 'epochs': 185, 'use_snp_selection': True, 'num_snps': 20000}. Best is trial 54 with value: 0.32737566232681276.
[I 2025-10-17 00:20:09,733] Trial 64 finished with value: 0.2643024206161499 and parameters: {'hidden_dims': '[128, 64]', 'dropout': 0.5911571352640265, 'batch_norm': False, 'graph_on': True, 'source': 'grm', 'knn_k': 6, 'weighted_edges': False, 'symmetrize_mode': 'mutual', 'lr': 4.922618228192381e-06, 'weight_decay': 0.00025508989849772263, 'epochs': 63, 'use_snp_selection': True, 'num_snps': 22000}. Best is trial 54 with value: 0.32737566232681276.
[I 2025-10-17 00:20:38,975] Trial 65 finished with value: 0.31669837832450864 and parameters: {'hidden_dims': '[256, 128]', 'dropout': 0.4756640264852458, 'batch_norm': False, 'graph_on': True, 'source': 'grm', 'knn_k': 7, 'weighted_edges': False, 'symmetrize_mode': 'mutual', 'lr': 3.431077089500722e-06, 'weight_decay': 7.981200456293277e-05, 'epochs': 167, 'use_snp_selection': True, 'num_snps': 26000}. Best is trial 54 with value: 0.32737566232681276.
[I 2025-10-17 00:21:07,169] Trial 66 finished with value: 0.3275394678115845 and parameters: {'hidden_dims': '[512, 256]', 'dropout': 0.5192888080973617, 'batch_norm': False, 'graph_on': True, 'source': 'grm', 'knn_k': 6, 'weighted_edges': False, 'symmetrize_mode': 'mutual', 'lr': 1.067166565920532e-05, 'weight_decay': 0.0005622677964086699, 'epochs': 135, 'use_snp_selection': True, 'num_snps': 16000}. Best is trial 66 with value: 0.3275394678115845.
[I 2025-10-17 00:21:33,450] Trial 67 finished with value: 0.324425208568573 and parameters: {'hidden_dims': '[512, 256]', 'dropout': 0.4464715907268298, 'batch_norm': False, 'graph_on': True, 'source': 'grm', 'knn_k': 6, 'weighted_edges': False, 'symmetrize_mode': 'mutual', 'lr': 1.011831109689027e-05, 'weight_decay': 0.0005845971748008002, 'epochs': 110, 'use_snp_selection': True, 'num_snps': 16000}. Best is trial 66 with value: 0.3275394678115845.
[I 2025-10-17 00:21:58,666] Trial 68 finished with value: 0.3109833598136902 and parameters: {'hidden_dims': '[256, 128]', 'dropout': 0.4548821597777573, 'batch_norm': False, 'graph_on': True, 'source': 'grm', 'knn_k': 5, 'weighted_edges': False, 'symmetrize_mode': 'mutual', 'lr': 2.685256488927754e-06, 'weight_decay': 0.0004372352825035255, 'epochs': 239, 'use_snp_selection': True, 'num_snps': 12000}. Best is trial 66 with value: 0.3275394678115845.
[I 2025-10-17 00:22:26,825] Trial 69 finished with value: 0.31203254461288454 and parameters: {'hidden_dims': '[512, 64]', 'dropout': 0.5004173709891161, 'batch_norm': True, 'graph_on': True, 'source': 'grm', 'knn_k': 5, 'weighted_edges': True, 'symmetrize_mode': 'mutual', 'lr': 5.319948640354308e-06, 'weight_decay': 0.0007056167365411057, 'epochs': 134, 'use_snp_selection': True, 'num_snps': 16000}. Best is trial 66 with value: 0.3275394678115845.
[I 2025-10-17 00:23:02,528] Trial 70 finished with value: 0.31817370653152466 and parameters: {'hidden_dims': '[512, 256]', 'dropout': 0.42338399474193933, 'batch_norm': False, 'graph_on': True, 'source': 'grm', 'knn_k': 6, 'weighted_edges': False, 'symmetrize_mode': 'union', 'lr': 1.946286187165686e-05, 'weight_decay': 0.00015610936962014198, 'epochs': 101, 'use_snp_selection': True, 'num_snps': 36000}. Best is trial 66 with value: 0.3275394678115845.
[I 2025-10-17 00:23:37,017] Trial 71 finished with value: 0.3253324866294861 and parameters: {'hidden_dims': '[512, 256]', 'dropout': 0.5277446726079347, 'batch_norm': False, 'graph_on': True, 'source': 'grm', 'knn_k': 7, 'weighted_edges': False, 'symmetrize_mode': 'mutual', 'lr': 7.5601553863908055e-06, 'weight_decay': 0.00028893116550877127, 'epochs': 150, 'use_snp_selection': True, 'num_snps': 24000}. Best is trial 66 with value: 0.3275394678115845.
[I 2025-10-17 00:24:14,892] Trial 72 finished with value: 0.3253238320350647 and parameters: {'hidden_dims': '[512, 256]', 'dropout': 0.5177994659460174, 'batch_norm': False, 'graph_on': True, 'source': 'grm', 'knn_k': 6, 'weighted_edges': False, 'symmetrize_mode': 'mutual', 'lr': 6.364154734714698e-06, 'weight_decay': 0.00023386868049523148, 'epochs': 139, 'use_snp_selection': True, 'num_snps': 30000}. Best is trial 66 with value: 0.3275394678115845.
[I 2025-10-17 00:24:49,791] Trial 73 finished with value: 0.31578850746154785 and parameters: {'hidden_dims': '[512, 256]', 'dropout': 0.4843479556333016, 'batch_norm': False, 'graph_on': True, 'source': 'grm', 'knn_k': 4, 'weighted_edges': False, 'symmetrize_mode': 'mutual', 'lr': 1.1012378395366502e-05, 'weight_decay': 0.0005081568945111057, 'epochs': 168, 'use_snp_selection': True, 'num_snps': 22000}. Best is trial 66 with value: 0.3275394678115845.
[I 2025-10-17 00:25:19,008] Trial 74 finished with value: 0.31760181188583375 and parameters: {'hidden_dims': '[512, 256]', 'dropout': 0.43825600368712847, 'batch_norm': False, 'graph_on': True, 'source': 'grm', 'knn_k': 6, 'weighted_edges': False, 'symmetrize_mode': 'mutual', 'lr': 4.493173387744643e-06, 'weight_decay': 0.00019745798306577598, 'epochs': 120, 'use_snp_selection': True, 'num_snps': 20000}. Best is trial 66 with value: 0.3275394678115845.
[I 2025-10-17 00:25:49,887] Trial 75 finished with value: 0.3233379006385803 and parameters: {'hidden_dims': '[256, 128]', 'dropout': 0.5818259324229528, 'batch_norm': False, 'graph_on': True, 'source': 'grm', 'knn_k': 7, 'weighted_edges': False, 'symmetrize_mode': 'mutual', 'lr': 1.3699218178751311e-05, 'weight_decay': 0.0003580858230850376, 'epochs': 195, 'use_snp_selection': True, 'num_snps': 26000}. Best is trial 66 with value: 0.3275394678115845.
[I 2025-10-17 00:26:10,931] Trial 76 finished with value: 0.276575630903244 and parameters: {'hidden_dims': '[256, 128, 64]', 'dropout': 0.39665941560869633, 'batch_norm': False, 'graph_on': True, 'source': 'grm', 'knn_k': 5, 'weighted_edges': False, 'symmetrize_mode': 'mutual', 'lr': 6.381712259826828e-06, 'weight_decay': 0.0009752881227424324, 'epochs': 80, 'use_snp_selection': True, 'num_snps': 14000}. Best is trial 66 with value: 0.3275394678115845.
[I 2025-10-17 00:26:47,316] Trial 77 finished with value: 0.32703499794006347 and parameters: {'hidden_dims': '[512, 256]', 'dropout': 0.5551191739422071, 'batch_norm': False, 'graph_on': True, 'source': 'grm', 'knn_k': 5, 'weighted_edges': False, 'symmetrize_mode': 'mutual', 'lr': 8.709279971270196e-06, 'weight_decay': 8.110936996360235e-05, 'epochs': 129, 'use_snp_selection': True, 'num_snps': 30000}. Best is trial 66 with value: 0.3275394678115845.
[I 2025-10-17 00:27:11,826] Trial 78 finished with value: 0.32277106642723086 and parameters: {'hidden_dims': '[128, 64]', 'dropout': 0.5545430478266716, 'batch_norm': False, 'graph_on': True, 'source': 'grm', 'knn_k': 5, 'weighted_edges': False, 'symmetrize_mode': 'mutual', 'lr': 8.710087376131993e-06, 'weight_decay': 5.1557513197045686e-05, 'epochs': 130, 'use_snp_selection': True, 'num_snps': 30000}. Best is trial 66 with value: 0.3275394678115845.
[I 2025-10-17 00:27:48,144] Trial 79 finished with value: 0.29150505661964415 and parameters: {'hidden_dims': '[512, 256]', 'dropout': 0.37298124398267685, 'batch_norm': True, 'graph_on': True, 'source': 'grm', 'knn_k': 4, 'weighted_edges': True, 'symmetrize_mode': 'mutual', 'lr': 2.2709322678043005e-06, 'weight_decay': 4.067609765794108e-07, 'epochs': 112, 'use_snp_selection': True, 'num_snps': 34000}. Best is trial 66 with value: 0.3275394678115845.
[I 2025-10-17 00:28:32,577] Trial 80 finished with value: 0.32342413663864134 and parameters: {'hidden_dims': '[512, 128]', 'dropout': 0.3582501056534185, 'batch_norm': False, 'graph_on': True, 'source': 'grm', 'knn_k': 5, 'weighted_edges': False, 'symmetrize_mode': 'union', 'lr': 1.2254932873435997e-05, 'weight_decay': 0.00010233195254043526, 'epochs': 159, 'use_snp_selection': True, 'num_snps': 36000}. Best is trial 66 with value: 0.3275394678115845.
[I 2025-10-17 00:29:06,557] Trial 81 finished with value: 0.3257762253284454 and parameters: {'hidden_dims': '[512, 256]', 'dropout': 0.5036118624528175, 'batch_norm': False, 'graph_on': True, 'source': 'grm', 'knn_k': 5, 'weighted_edges': False, 'symmetrize_mode': 'mutual', 'lr': 5.369295116627499e-06, 'weight_decay': 0.00017451031023483504, 'epochs': 145, 'use_snp_selection': True, 'num_snps': 24000}. Best is trial 66 with value: 0.3275394678115845.
[I 2025-10-17 00:29:43,490] Trial 82 finished with value: 0.32698867917060853 and parameters: {'hidden_dims': '[512, 256]', 'dropout': 0.5312056100588873, 'batch_norm': False, 'graph_on': True, 'source': 'grm', 'knn_k': 5, 'weighted_edges': False, 'symmetrize_mode': 'mutual', 'lr': 5.454903697002902e-06, 'weight_decay': 0.0001617229763882343, 'epochs': 125, 'use_snp_selection': True, 'num_snps': 32000}. Best is trial 66 with value: 0.3275394678115845.
[I 2025-10-17 00:30:22,911] Trial 83 finished with value: 0.32805309295654295 and parameters: {'hidden_dims': '[512, 256]', 'dropout': 0.503586119953284, 'batch_norm': False, 'graph_on': True, 'source': 'grm', 'knn_k': 5, 'weighted_edges': False, 'symmetrize_mode': 'mutual', 'lr': 5.352804935807532e-06, 'weight_decay': 7.719252186437158e-05, 'epochs': 143, 'use_snp_selection': True, 'num_snps': 32000}. Best is trial 83 with value: 0.32805309295654295.
[I 2025-10-17 00:31:07,317] Trial 84 finished with value: 0.3223236739635468 and parameters: {'hidden_dims': '[512, 256]', 'dropout': 0.5531385041401489, 'batch_norm': False, 'graph_on': True, 'source': 'grm', 'knn_k': 4, 'weighted_edges': False, 'symmetrize_mode': 'mutual', 'lr': 3.7319754880733895e-06, 'weight_decay': 8.135624700920607e-05, 'epochs': 181, 'use_snp_selection': True, 'num_snps': 32000}. Best is trial 83 with value: 0.32805309295654295.
[I 2025-10-17 00:31:35,135] Trial 85 finished with value: 0.30687758326530457 and parameters: {'hidden_dims': '[256, 128]', 'dropout': 0.5714195148775576, 'batch_norm': False, 'graph_on': True, 'source': 'grm', 'knn_k': 5, 'weighted_edges': False, 'symmetrize_mode': 'mutual', 'lr': 3.0912694458952143e-06, 'weight_decay': 0.00012946021538458237, 'epochs': 123, 'use_snp_selection': True, 'num_snps': 30000}. Best is trial 83 with value: 0.32805309295654295.
[I 2025-10-17 00:32:12,774] Trial 86 finished with value: 0.328561532497406 and parameters: {'hidden_dims': '[512, 256]', 'dropout': 0.47880395918821667, 'batch_norm': False, 'graph_on': True, 'source': 'grm', 'knn_k': 5, 'weighted_edges': False, 'symmetrize_mode': 'mutual', 'lr': 8.583033162795725e-06, 'weight_decay': 2.6548219768420327e-05, 'epochs': 108, 'use_snp_selection': True, 'num_snps': 38000}. Best is trial 86 with value: 0.328561532497406.
[I 2025-10-17 00:32:49,397] Trial 87 finished with value: 0.32288376688957215 and parameters: {'hidden_dims': '[512, 256]', 'dropout': 0.48055011040468015, 'batch_norm': False, 'graph_on': True, 'source': 'grm', 'knn_k': 5, 'weighted_edges': False, 'symmetrize_mode': 'mutual', 'lr': 8.680723561064449e-06, 'weight_decay': 3.877826974542464e-05, 'epochs': 88, 'use_snp_selection': True, 'num_snps': 42000}. Best is trial 86 with value: 0.328561532497406.
[I 2025-10-17 00:33:24,863] Trial 88 finished with value: 0.3285365879535675 and parameters: {'hidden_dims': '[512, 256]', 'dropout': 0.46627889951477347, 'batch_norm': False, 'graph_on': True, 'source': 'grm', 'knn_k': 5, 'weighted_edges': False, 'symmetrize_mode': 'mutual', 'lr': 1.0041457092008848e-05, 'weight_decay': 2.1144500253798553e-05, 'epochs': 94, 'use_snp_selection': True, 'num_snps': 38000}. Best is trial 86 with value: 0.328561532497406.
[I 2025-10-17 00:34:03,807] Trial 89 finished with value: 0.32528135776519773 and parameters: {'hidden_dims': '[512, 256]', 'dropout': 0.49230627620127604, 'batch_norm': False, 'graph_on': True, 'source': 'grm', 'knn_k': 5, 'weighted_edges': False, 'symmetrize_mode': 'mutual', 'lr': 1.567120060867433e-05, 'weight_decay': 7.69364963847569e-06, 'epochs': 95, 'use_snp_selection': True, 'num_snps': 44000}. Best is trial 86 with value: 0.328561532497406.
[I 2025-10-17 00:34:40,933] Trial 90 finished with value: 0.3219874560832977 and parameters: {'hidden_dims': '[512, 256]', 'dropout': 0.4542481483217144, 'batch_norm': False, 'graph_on': True, 'source': 'grm', 'knn_k': 4, 'weighted_edges': False, 'symmetrize_mode': 'mutual', 'lr': 1.1206958867680852e-05, 'weight_decay': 2.1973159907453535e-05, 'epochs': 105, 'use_snp_selection': True, 'num_snps': 38000}. Best is trial 86 with value: 0.328561532497406.
[I 2025-10-17 00:34:59,895] Trial 91 finished with value: 0.2836721360683441 and parameters: {'hidden_dims': '[512, 256]', 'dropout': 0.46354386868995673, 'batch_norm': False, 'graph_on': True, 'source': 'grm', 'knn_k': 5, 'weighted_edges': False, 'symmetrize_mode': 'mutual', 'lr': 9.571545920108803e-06, 'weight_decay': 5.2208167913665244e-05, 'epochs': 115, 'use_snp_selection': True, 'num_snps': 2000}. Best is trial 86 with value: 0.328561532497406.
[I 2025-10-17 00:35:30,315] Trial 92 finished with value: 0.32045249342918397 and parameters: {'hidden_dims': '[512, 256]', 'dropout': 0.4343614045422819, 'batch_norm': False, 'graph_on': True, 'source': 'grm', 'knn_k': 5, 'weighted_edges': False, 'symmetrize_mode': 'mutual', 'lr': 5.506817901963595e-06, 'weight_decay': 9.628809921996383e-06, 'epochs': 72, 'use_snp_selection': True, 'num_snps': 34000}. Best is trial 86 with value: 0.328561532497406.
[I 2025-10-17 00:36:10,772] Trial 93 finished with value: 0.27542015314102175 and parameters: {'hidden_dims': '[512, 256]', 'dropout': 0.5086921170163, 'batch_norm': True, 'graph_on': True, 'source': 'grm', 'knn_k': 5, 'weighted_edges': True, 'symmetrize_mode': 'mutual', 'lr': 7.914325515630678e-06, 'weight_decay': 1.459783281244625e-05, 'epochs': 124, 'use_snp_selection': True, 'num_snps': 38000}. Best is trial 86 with value: 0.328561532497406.
[I 2025-10-17 00:36:49,526] Trial 94 finished with value: 0.01642426699399948 and parameters: {'hidden_dims': '[512, 256]', 'dropout': 0.4136893669586073, 'batch_norm': False, 'graph_on': True, 'source': 'grm', 'knn_k': 5, 'weighted_edges': False, 'symmetrize_mode': 'mutual', 'lr': 0.0009825436837295682, 'weight_decay': 8.174936078985645e-05, 'epochs': 108, 'use_snp_selection': True, 'num_snps': 40000}. Best is trial 86 with value: 0.328561532497406.
[I 2025-10-17 00:37:30,845] Trial 95 finished with value: 0.3216874122619629 and parameters: {'hidden_dims': '[512, 256]', 'dropout': 0.5366940412894755, 'batch_norm': False, 'graph_on': True, 'source': 'grm', 'knn_k': 5, 'weighted_edges': False, 'symmetrize_mode': 'union', 'lr': 1.4122432139218826e-05, 'weight_decay': 1.8624265744945712e-05, 'epochs': 138, 'use_snp_selection': True, 'num_snps': 36000}. Best is trial 86 with value: 0.328561532497406.
[I 2025-10-17 00:37:55,540] Trial 96 finished with value: 0.2956712692975998 and parameters: {'hidden_dims': '[512, 256]', 'dropout': 0.4708027499016898, 'batch_norm': False, 'graph_on': True, 'source': 'grm', 'knn_k': 4, 'weighted_edges': False, 'symmetrize_mode': 'mutual', 'lr': 1.2235616785863774e-05, 'weight_decay': 3.161335834531796e-05, 'epochs': 35, 'use_snp_selection': True, 'num_snps': 32000}. Best is trial 86 with value: 0.328561532497406.
[I 2025-10-17 00:38:28,214] Trial 97 finished with value: 0.3451789140701294 and parameters: {'hidden_dims': '[512, 256]', 'dropout': 0.3936324809486714, 'batch_norm': False, 'graph_on': True, 'source': 'grm', 'knn_k': 1, 'weighted_edges': False, 'symmetrize_mode': 'mutual', 'lr': 4.5567684554444515e-06, 'weight_decay': 6.4098997212116e-05, 'epochs': 86, 'use_snp_selection': True, 'num_snps': 36000}. Best is trial 97 with value: 0.3451789140701294.
[I 2025-10-17 00:39:03,873] Trial 98 finished with value: 0.3401634514331818 and parameters: {'hidden_dims': '[512, 256]', 'dropout': 0.3927319500821094, 'batch_norm': False, 'graph_on': True, 'source': 'grm', 'knn_k': 1, 'weighted_edges': False, 'symmetrize_mode': 'mutual', 'lr': 4.3826681425862606e-06, 'weight_decay': 3.991767471687641e-06, 'epochs': 91, 'use_snp_selection': True, 'num_snps': 40000}. Best is trial 97 with value: 0.3451789140701294.
[I 2025-10-17 00:39:33,693] Trial 99 finished with value: 0.3307418882846832 and parameters: {'hidden_dims': '[512, 256]', 'dropout': 0.38919507265447123, 'batch_norm': False, 'graph_on': True, 'source': 'grm', 'knn_k': 1, 'weighted_edges': False, 'symmetrize_mode': 'mutual', 'lr': 4.8419052975628155e-06, 'weight_decay': 2.660593245440835e-05, 'epochs': 56, 'use_snp_selection': True, 'num_snps': 40000}. Best is trial 97 with value: 0.3451789140701294.
[I 2025-10-17 00:40:05,879] Trial 100 finished with value: 0.3301710546016693 and parameters: {'hidden_dims': '[512, 256]', 'dropout': 0.3967612671101804, 'batch_norm': False, 'graph_on': True, 'source': 'grm', 'knn_k': 1, 'weighted_edges': False, 'symmetrize_mode': 'mutual', 'lr': 4.537993780277857e-06, 'weight_decay': 2.556172812601051e-05, 'epochs': 59, 'use_snp_selection': True, 'num_snps': 46000}. Best is trial 97 with value: 0.3451789140701294.
[I 2025-10-17 00:40:39,108] Trial 101 finished with value: 0.3293100595474243 and parameters: {'hidden_dims': '[512, 256]', 'dropout': 0.3970756393775537, 'batch_norm': False, 'graph_on': True, 'source': 'grm', 'knn_k': 1, 'weighted_edges': False, 'symmetrize_mode': 'mutual', 'lr': 3.7713835551563286e-06, 'weight_decay': 2.3202801106656846e-06, 'epochs': 61, 'use_snp_selection': True, 'num_snps': 48000}. Best is trial 97 with value: 0.3451789140701294.
[I 2025-10-17 00:41:12,330] Trial 102 finished with value: 0.3227980673313141 and parameters: {'hidden_dims': '[512, 256]', 'dropout': 0.3855580614359271, 'batch_norm': False, 'graph_on': True, 'source': 'grm', 'knn_k': 1, 'weighted_edges': False, 'symmetrize_mode': 'mutual', 'lr': 3.621252616234173e-06, 'weight_decay': 2.9463828356342472e-06, 'epochs': 58, 'use_snp_selection': True, 'num_snps': 50000}. Best is trial 97 with value: 0.3451789140701294.
[I 2025-10-17 00:41:41,309] Trial 103 finished with value: 0.29199531078338625 and parameters: {'hidden_dims': '[512, 256]', 'dropout': 0.3935068096971083, 'batch_norm': False, 'graph_on': True, 'source': 'grm', 'knn_k': 1, 'weighted_edges': False, 'symmetrize_mode': 'mutual', 'lr': 4.4615533167901075e-06, 'weight_decay': 4.744635742505866e-06, 'epochs': 42, 'use_snp_selection': True, 'num_snps': 46000}. Best is trial 97 with value: 0.3451789140701294.
[I 2025-10-17 00:42:13,579] Trial 104 finished with value: 0.30710535645484927 and parameters: {'hidden_dims': '[512, 256]', 'dropout': 0.4041051715368207, 'batch_norm': False, 'graph_on': True, 'source': 'grm', 'knn_k': 1, 'weighted_edges': False, 'symmetrize_mode': 'mutual', 'lr': 2.840345871576674e-06, 'weight_decay': 2.1380275332742624e-06, 'epochs': 48, 'use_snp_selection': True, 'num_snps': 54000}. Best is trial 97 with value: 0.3451789140701294.
[I 2025-10-17 00:42:48,816] Trial 105 finished with value: 0.2974882185459137 and parameters: {'hidden_dims': '[512, 256]', 'dropout': 0.36411132118584705, 'batch_norm': False, 'graph_on': True, 'source': 'grm', 'knn_k': 2, 'weighted_edges': False, 'symmetrize_mode': 'mutual', 'lr': 1.9614072070570133e-06, 'weight_decay': 3.229390401439085e-05, 'epochs': 82, 'use_snp_selection': True, 'num_snps': 42000}. Best is trial 97 with value: 0.3451789140701294.
[I 2025-10-17 00:43:22,983] Trial 106 finished with value: 0.3296556055545807 and parameters: {'hidden_dims': '[512, 256]', 'dropout': 0.4207690785596002, 'batch_norm': False, 'graph_on': True, 'source': 'grm', 'knn_k': 1, 'weighted_edges': False, 'symmetrize_mode': 'mutual', 'lr': 4.508656704571734e-06, 'weight_decay': 2.47693446053313e-05, 'epochs': 66, 'use_snp_selection': True, 'num_snps': 48000}. Best is trial 97 with value: 0.3451789140701294.
[I 2025-10-17 00:43:56,482] Trial 107 finished with value: 0.3227973937988281 and parameters: {'hidden_dims': '[512, 64]', 'dropout': 0.41397304258492906, 'batch_norm': False, 'graph_on': True, 'source': 'grm', 'knn_k': 1, 'weighted_edges': False, 'symmetrize_mode': 'mutual', 'lr': 4.0896699577425025e-06, 'weight_decay': 1.3400431479034656e-05, 'epochs': 63, 'use_snp_selection': True, 'num_snps': 48000}. Best is trial 97 with value: 0.3451789140701294.
