[I 2025-10-16 15:34:33,501] Trial 144 finished with value: 0.3144644916057587 and parameters: {'hidden_dims': '[512, 64]', 'dropout': 0.11361540003662815, 'batch_norm': False, 'graph_on': True, 'source': 'grm', 'knn_k': 4, 'weighted_edges': True, 'symmetrize_mode': 'union', 'lr': 2.241657426709012e-06, 'weight_decay': 9.66404873666687e-06, 'epochs': 88, 'use_snp_selection': True, 'num_snps': 38000}. Best is trial 43 with value: 0.32611833810806273.
[I 2025-10-16 15:35:00,995] Trial 145 finished with value: 0.3213780760765076 and parameters: {'hidden_dims': '[256, 128]', 'dropout': 0.1313644859594184, 'batch_norm': False, 'graph_on': True, 'source': 'grm', 'knn_k': 4, 'weighted_edges': True, 'symmetrize_mode': 'union', 'lr': 1.175307631923622e-05, 'weight_decay': 6.6482397188786e-06, 'epochs': 106, 'use_snp_selection': True, 'num_snps': 34000}. Best is trial 43 with value: 0.32611833810806273.
[I 2025-10-16 15:35:34,152] Trial 146 finished with value: 0.32520349621772765 and parameters: {'hidden_dims': '[512, 64]', 'dropout': 0.14251871867363639, 'batch_norm': False, 'graph_on': True, 'source': 'grm', 'knn_k': 4, 'weighted_edges': True, 'symmetrize_mode': 'union', 'lr': 6.341543344143656e-06, 'weight_decay': 3.2760761369450445e-06, 'epochs': 75, 'use_snp_selection': True, 'num_snps': 40000}. Best is trial 43 with value: 0.32611833810806273.
[I 2025-10-16 15:36:07,478] Trial 147 finished with value: 0.3260462820529938 and parameters: {'hidden_dims': '[512, 256]', 'dropout': 0.1474495430249246, 'batch_norm': False, 'graph_on': True, 'source': 'grm', 'knn_k': 4, 'weighted_edges': True, 'symmetrize_mode': 'union', 'lr': 8.013729981337995e-06, 'weight_decay': 3.267305837708879e-06, 'epochs': 75, 'use_snp_selection': True, 'num_snps': 40000}. Best is trial 43 with value: 0.32611833810806273.
[I 2025-10-16 15:36:38,142] Trial 148 finished with value: 0.32196643352508547 and parameters: {'hidden_dims': '[512, 256]', 'dropout': 0.14688874451460265, 'batch_norm': False, 'graph_on': True, 'source': 'grm', 'knn_k': 4, 'weighted_edges': True, 'symmetrize_mode': 'union', 'lr': 6.429933412600291e-06, 'weight_decay': 3.416490334608711e-06, 'epochs': 66, 'use_snp_selection': True, 'num_snps': 38000}. Best is trial 43 with value: 0.32611833810806273.
[I 2025-10-16 15:37:09,455] Trial 149 finished with value: 0.3145607769489288 and parameters: {'hidden_dims': '[512, 256]', 'dropout': 0.10745073779874414, 'batch_norm': False, 'graph_on': True, 'source': 'grm', 'knn_k': 3, 'weighted_edges': True, 'symmetrize_mode': 'union', 'lr': 3.2750548872757818e-06, 'weight_decay': 3.845106045214627e-06, 'epochs': 75, 'use_snp_selection': True, 'num_snps': 36000}. Best is trial 43 with value: 0.32611833810806273.
[I 2025-10-16 15:37:40,962] Trial 0 finished with value: 0.2166963130235672 and parameters: {'hidden_dims': '[128, 64]', 'dropout': 0.199031432379812, 'batch_norm': True, 'graph_on': True, 'source': 'grm', 'knn_k': 1, 'weighted_edges': True, 'symmetrize_mode': 'union', 'lr': 0.0002740708741343236, 'weight_decay': 2.819059662190987e-05, 'epochs': 256, 'use_snp_selection': True, 'num_snps': 18000}. Best is trial 0 with value: 0.2166963130235672.
[I 2025-10-16 15:37:59,969] Trial 1 finished with value: 0.179811891913414 and parameters: {'hidden_dims': '[128, 64]', 'dropout': 0.32091658721149807, 'batch_norm': False, 'graph_on': True, 'source': 'grm', 'knn_k': 4, 'weighted_edges': False, 'symmetrize_mode': 'mutual', 'lr': 0.0005320428882732732, 'weight_decay': 1.89210117736594e-06, 'epochs': 40, 'use_snp_selection': True, 'num_snps': 20000}. Best is trial 0 with value: 0.2166963130235672.
[I 2025-10-16 15:38:25,654] Trial 2 finished with value: 0.276373952627182 and parameters: {'hidden_dims': '[256, 128]', 'dropout': 0.19947376983940615, 'batch_norm': True, 'graph_on': True, 'source': 'grm', 'knn_k': 6, 'weighted_edges': True, 'symmetrize_mode': 'mutual', 'lr': 1.5051775490493461e-05, 'weight_decay': 2.3650563799866155e-07, 'epochs': 289, 'use_snp_selection': True, 'num_snps': 10000}. Best is trial 2 with value: 0.276373952627182.
[I 2025-10-16 15:38:47,182] Trial 3 finished with value: 0.31434511542320254 and parameters: {'hidden_dims': '[512, 256]', 'dropout': 0.3986858241154422, 'batch_norm': True, 'graph_on': True, 'source': 'grm', 'knn_k': 5, 'weighted_edges': True, 'symmetrize_mode': 'union', 'lr': 9.821050313409216e-06, 'weight_decay': 0.00012454353397331594, 'epochs': 23, 'use_snp_selection': True, 'num_snps': 26000}. Best is trial 3 with value: 0.31434511542320254.
[I 2025-10-16 15:39:22,394] Trial 4 finished with value: 0.3213117778301239 and parameters: {'hidden_dims': '[256, 128, 64]', 'dropout': 0.5390483213624292, 'batch_norm': False, 'graph_on': True, 'source': 'grm', 'knn_k': 4, 'weighted_edges': False, 'symmetrize_mode': 'mutual', 'lr': 8.11311593386297e-06, 'weight_decay': 9.296158109581328e-07, 'epochs': 200, 'use_snp_selection': True, 'num_snps': 34000}. Best is trial 4 with value: 0.3213117778301239.
[I 2025-10-16 15:40:00,942] Trial 5 finished with value: 0.2518829435110092 and parameters: {'hidden_dims': '[256, 128, 64]', 'dropout': 0.5885461262002587, 'batch_norm': False, 'graph_on': True, 'source': 'grm', 'knn_k': 3, 'weighted_edges': False, 'symmetrize_mode': 'mutual', 'lr': 1.164930281795184e-06, 'weight_decay': 1.3145475249585842e-07, 'epochs': 145, 'use_snp_selection': True, 'num_snps': 54000}. Best is trial 4 with value: 0.3213117778301239.
[I 2025-10-16 15:40:39,808] Trial 6 finished with value: 0.3000217080116272 and parameters: {'hidden_dims': '[256, 128, 64]', 'dropout': 0.5824426399282747, 'batch_norm': False, 'graph_on': True, 'source': 'grm', 'knn_k': 7, 'weighted_edges': False, 'symmetrize_mode': 'mutual', 'lr': 1.8103274335042867e-06, 'weight_decay': 1.8980551329127457e-06, 'epochs': 168, 'use_snp_selection': True, 'num_snps': 48000}. Best is trial 4 with value: 0.3213117778301239.
[I 2025-10-16 15:41:55,838] Trial 7 finished with value: 0.295522403717041 and parameters: {'hidden_dims': '[512, 64]', 'dropout': 0.4492085423675365, 'batch_norm': False, 'graph_on': True, 'source': 'grm', 'knn_k': 2, 'weighted_edges': False, 'symmetrize_mode': 'mutual', 'lr': 7.458996247470631e-05, 'weight_decay': 3.63708811960795e-06, 'epochs': 339, 'use_snp_selection': True, 'num_snps': 40000}. Best is trial 4 with value: 0.3213117778301239.
[I 2025-10-16 15:42:33,682] Trial 8 finished with value: 0.3395680129528046 and parameters: {'hidden_dims': '[512, 128]', 'dropout': 0.4855348583679587, 'batch_norm': False, 'graph_on': True, 'source': 'grm', 'knn_k': 4, 'weighted_edges': False, 'symmetrize_mode': 'union', 'lr': 5.347869726837025e-06, 'weight_decay': 0.000825219321368031, 'epochs': 112, 'use_snp_selection': True, 'num_snps': 38000}. Best is trial 8 with value: 0.3395680129528046.
[I 2025-10-16 15:42:52,672] Trial 9 finished with value: 0.3421079754829407 and parameters: {'hidden_dims': '[512, 128]', 'dropout': 0.31141454109750316, 'batch_norm': False, 'graph_on': True, 'source': 'grm', 'knn_k': 3, 'weighted_edges': False, 'symmetrize_mode': 'union', 'lr': 6.926774652277983e-05, 'weight_decay': 0.0009810933865270722, 'epochs': 95, 'use_snp_selection': True, 'num_snps': 4000}. Best is trial 9 with value: 0.3421079754829407.
[I 2025-10-16 15:43:09,967] Trial 10 finished with value: 0.2735208809375763 and parameters: {'hidden_dims': '[512, 128]', 'dropout': 0.1062256058813002, 'batch_norm': True, 'graph_on': True, 'source': 'grm', 'knn_k': 1, 'weighted_edges': True, 'symmetrize_mode': 'union', 'lr': 9.43680651114941e-05, 'weight_decay': 0.0008453596826300955, 'epochs': 83, 'use_snp_selection': True, 'num_snps': 2000}. Best is trial 9 with value: 0.3421079754829407.
[I 2025-10-16 15:43:48,572] Trial 11 finished with value: 0.3284651815891266 and parameters: {'hidden_dims': '[512, 128]', 'dropout': 0.3433284124473246, 'batch_norm': False, 'graph_on': True, 'source': 'grm', 'knn_k': 3, 'weighted_edges': False, 'symmetrize_mode': 'union', 'lr': 3.930371849503765e-05, 'weight_decay': 0.000988571501865363, 'epochs': 105, 'use_snp_selection': True, 'num_snps': 42000}. Best is trial 9 with value: 0.3421079754829407.
[I 2025-10-16 15:44:19,198] Trial 12 finished with value: 0.32482277154922484 and parameters: {'hidden_dims': '[512, 128]', 'dropout': 0.4668908025443073, 'batch_norm': False, 'graph_on': True, 'source': 'grm', 'knn_k': 3, 'weighted_edges': False, 'symmetrize_mode': 'union', 'lr': 3.7885316110644027e-06, 'weight_decay': 0.00020308816406776852, 'epochs': 97, 'use_snp_selection': True, 'num_snps': 28000}. Best is trial 9 with value: 0.3421079754829407.
[I 2025-10-16 15:45:14,370] Trial 13 finished with value: 0.3262736678123474 and parameters: {'hidden_dims': '[512, 128]', 'dropout': 0.2690173658366945, 'batch_norm': False, 'graph_on': True, 'source': 'grm', 'knn_k': 5, 'weighted_edges': False, 'symmetrize_mode': 'union', 'lr': 2.7712663817559323e-05, 'weight_decay': 0.00015040002709759882, 'epochs': 134, 'use_snp_selection': True, 'num_snps': 60000}. Best is trial 9 with value: 0.3421079754829407.
[I 2025-10-16 15:45:36,487] Trial 14 finished with value: 0.3372689485549927 and parameters: {'hidden_dims': '[512, 128]', 'dropout': 0.4774156968265142, 'batch_norm': False, 'graph_on': True, 'source': 'grm', 'knn_k': 5, 'weighted_edges': False, 'symmetrize_mode': 'union', 'lr': 0.0002135639563472117, 'weight_decay': 2.8231945077744424e-05, 'epochs': 207, 'use_snp_selection': True, 'num_snps': 4000}. Best is trial 9 with value: 0.3421079754829407.
[I 2025-10-16 15:45:55,596] Trial 15 finished with value: 0.25646139681339264 and parameters: {'hidden_dims': '[256, 128]', 'dropout': 0.4048223255145925, 'batch_norm': False, 'graph_on': True, 'source': 'grm', 'knn_k': 2, 'weighted_edges': False, 'symmetrize_mode': 'union', 'lr': 2.972700900905692e-06, 'weight_decay': 0.00035019828034201156, 'epochs': 53, 'use_snp_selection': True, 'num_snps': 14000}. Best is trial 9 with value: 0.3421079754829407.
[I 2025-10-16 15:46:25,155] Trial 16 finished with value: 0.33905929923057554 and parameters: {'hidden_dims': '[512, 256]', 'dropout': 0.2879026935803246, 'batch_norm': False, 'graph_on': True, 'source': 'grm', 'knn_k': 2, 'weighted_edges': False, 'symmetrize_mode': 'union', 'lr': 5.726637662658769e-06, 'weight_decay': 3.4046254775532125e-05, 'epochs': 71, 'use_snp_selection': True, 'num_snps': 34000}. Best is trial 9 with value: 0.3421079754829407.
[I 2025-10-16 15:47:08,208] Trial 17 finished with value: 0.3344202101230621 and parameters: {'hidden_dims': '[512, 64]', 'dropout': 0.5229846035630021, 'batch_norm': False, 'graph_on': True, 'source': 'grm', 'knn_k': 4, 'weighted_edges': False, 'symmetrize_mode': 'union', 'lr': 3.8033127727520434e-05, 'weight_decay': 7.864053419930699e-05, 'epochs': 130, 'use_snp_selection': True, 'num_snps': 42000}. Best is trial 9 with value: 0.3421079754829407.
[I 2025-10-16 15:47:50,440] Trial 18 finished with value: 0.3187470316886902 and parameters: {'hidden_dims': '[512, 128]', 'dropout': 0.38806046775887465, 'batch_norm': True, 'graph_on': True, 'source': 'grm', 'knn_k': 6, 'weighted_edges': True, 'symmetrize_mode': 'union', 'lr': 1.73413915906971e-05, 'weight_decay': 0.0005034638231346915, 'epochs': 242, 'use_snp_selection': True, 'num_snps': 22000}. Best is trial 9 with value: 0.3421079754829407.
[I 2025-10-16 15:48:14,391] Trial 19 finished with value: 0.3360292911529541 and parameters: {'hidden_dims': '[512, 128]', 'dropout': 0.2267443421725418, 'batch_norm': False, 'graph_on': True, 'source': 'grm', 'knn_k': 3, 'weighted_edges': False, 'symmetrize_mode': 'union', 'lr': 9.155471411454066e-05, 'weight_decay': 8.531590147785583e-06, 'epochs': 176, 'use_snp_selection': True, 'num_snps': 8000}. Best is trial 9 with value: 0.3421079754829407.
[I 2025-10-16 15:48:39,608] Trial 20 finished with value: 0.06581314280629158 and parameters: {'hidden_dims': '[512, 128]', 'dropout': 0.515427752982863, 'batch_norm': False, 'graph_on': True, 'source': 'grm', 'knn_k': 6, 'weighted_edges': False, 'symmetrize_mode': 'union', 'lr': 0.0008283912151294985, 'weight_decay': 0.0003585398523554377, 'epochs': 18, 'use_snp_selection': True, 'num_snps': 50000}. Best is trial 9 with value: 0.3421079754829407.
[I 2025-10-16 15:49:09,986] Trial 21 finished with value: 0.3370815396308899 and parameters: {'hidden_dims': '[512, 256]', 'dropout': 0.28018711118910494, 'batch_norm': False, 'graph_on': True, 'source': 'grm', 'knn_k': 2, 'weighted_edges': False, 'symmetrize_mode': 'union', 'lr': 4.179039546243581e-06, 'weight_decay': 4.5533688045824673e-05, 'epochs': 77, 'use_snp_selection': True, 'num_snps': 34000}. Best is trial 9 with value: 0.3421079754829407.
[I 2025-10-16 15:49:39,142] Trial 22 finished with value: 0.33555153012275696 and parameters: {'hidden_dims': '[512, 256]', 'dropout': 0.28775192071493183, 'batch_norm': False, 'graph_on': True, 'source': 'grm', 'knn_k': 2, 'weighted_edges': False, 'symmetrize_mode': 'union', 'lr': 8.746744355595335e-06, 'weight_decay': 1.1536969550551617e-05, 'epochs': 62, 'use_snp_selection': True, 'num_snps': 36000}. Best is trial 9 with value: 0.3421079754829407.
[I 2025-10-16 15:50:12,435] Trial 23 finished with value: 0.3423058807849884 and parameters: {'hidden_dims': '[512, 256]', 'dropout': 0.11816744603196028, 'batch_norm': False, 'graph_on': True, 'source': 'grm', 'knn_k': 3, 'weighted_edges': False, 'symmetrize_mode': 'union', 'lr': 5.873517702296465e-06, 'weight_decay': 0.000280661101026257, 'epochs': 118, 'use_snp_selection': True, 'num_snps': 28000}. Best is trial 23 with value: 0.3423058807849884.
[I 2025-10-16 15:50:44,790] Trial 24 finished with value: 0.3321336328983307 and parameters: {'hidden_dims': '[512, 256]', 'dropout': 0.11883959814015715, 'batch_norm': False, 'graph_on': True, 'source': 'grm', 'knn_k': 3, 'weighted_edges': False, 'symmetrize_mode': 'union', 'lr': 2.2735819207696533e-06, 'weight_decay': 0.00044305005868005, 'epochs': 118, 'use_snp_selection': True, 'num_snps': 26000}. Best is trial 23 with value: 0.3423058807849884.
[I 2025-10-16 15:51:21,560] Trial 25 finished with value: 0.34116117358207704 and parameters: {'hidden_dims': '[256, 128]', 'dropout': 0.14753201615988754, 'batch_norm': False, 'graph_on': True, 'source': 'grm', 'knn_k': 4, 'weighted_edges': False, 'symmetrize_mode': 'union', 'lr': 2.0463570704610496e-05, 'weight_decay': 0.0009119597082290585, 'epochs': 157, 'use_snp_selection': True, 'num_snps': 48000}. Best is trial 23 with value: 0.3423058807849884.
[I 2025-10-16 15:52:02,421] Trial 26 finished with value: 0.32702961564064026 and parameters: {'hidden_dims': '[256, 128]', 'dropout': 0.1586874440370984, 'batch_norm': False, 'graph_on': True, 'source': 'grm', 'knn_k': 5, 'weighted_edges': False, 'symmetrize_mode': 'union', 'lr': 5.6032665268074246e-05, 'weight_decay': 0.00021496353706448624, 'epochs': 150, 'use_snp_selection': True, 'num_snps': 60000}. Best is trial 23 with value: 0.3423058807849884.
[I 2025-10-16 15:52:40,364] Trial 27 finished with value: 0.26226635575294494 and parameters: {'hidden_dims': '[256, 128]', 'dropout': 0.14251514627366774, 'batch_norm': True, 'graph_on': True, 'source': 'grm', 'knn_k': 4, 'weighted_edges': True, 'symmetrize_mode': 'union', 'lr': 1.9628864627609566e-05, 'weight_decay': 0.0001136910389776803, 'epochs': 164, 'use_snp_selection': True, 'num_snps': 48000}. Best is trial 23 with value: 0.3423058807849884.
[I 2025-10-16 15:53:06,003] Trial 28 finished with value: 0.3309522092342377 and parameters: {'hidden_dims': '[256, 128]', 'dropout': 0.16711516922854816, 'batch_norm': False, 'graph_on': True, 'source': 'grm', 'knn_k': 3, 'weighted_edges': False, 'symmetrize_mode': 'union', 'lr': 0.00016993949413748362, 'weight_decay': 7.14559107129513e-05, 'epochs': 197, 'use_snp_selection': True, 'num_snps': 16000}. Best is trial 23 with value: 0.3423058807849884.
[I 2025-10-16 15:53:28,233] Trial 29 finished with value: 0.23015756905078888 and parameters: {'hidden_dims': '[128, 64]', 'dropout': 0.21988721851785928, 'batch_norm': True, 'graph_on': True, 'source': 'grm', 'knn_k': 1, 'weighted_edges': True, 'symmetrize_mode': 'union', 'lr': 0.00013006832172956077, 'weight_decay': 0.00025241312155602143, 'epochs': 238, 'use_snp_selection': True, 'num_snps': 12000}. Best is trial 23 with value: 0.3423058807849884.
[I 2025-10-16 15:54:38,276] Trial 30 finished with value: 0.33905630111694335 and parameters: {'hidden_dims': '[512, 64]', 'dropout': 0.1802908303115555, 'batch_norm': False, 'graph_on': True, 'source': 'grm', 'knn_k': 4, 'weighted_edges': False, 'symmetrize_mode': 'union', 'lr': 0.000344019508914213, 'weight_decay': 0.0006579305653418272, 'epochs': 224, 'use_snp_selection': True, 'num_snps': 54000}. Best is trial 23 with value: 0.3423058807849884.
[I 2025-10-16 15:55:03,858] Trial 31 finished with value: 0.3373538553714752 and parameters: {'hidden_dims': '[128, 64]', 'dropout': 0.2334741390979832, 'batch_norm': False, 'graph_on': True, 'source': 'grm', 'knn_k': 4, 'weighted_edges': False, 'symmetrize_mode': 'union', 'lr': 1.1892187353893525e-05, 'weight_decay': 0.0009703001659994596, 'epochs': 116, 'use_snp_selection': True, 'num_snps': 40000}. Best is trial 23 with value: 0.3423058807849884.
[I 2025-10-16 15:55:42,578] Trial 32 finished with value: 0.33826062083244324 and parameters: {'hidden_dims': '[512, 256]', 'dropout': 0.12754593574307413, 'batch_norm': False, 'graph_on': True, 'source': 'grm', 'knn_k': 4, 'weighted_edges': False, 'symmetrize_mode': 'union', 'lr': 5.994902521641951e-06, 'weight_decay': 0.0005411328453358018, 'epochs': 95, 'use_snp_selection': True, 'num_snps': 44000}. Best is trial 23 with value: 0.3423058807849884.
[I 2025-10-16 15:56:15,592] Trial 33 finished with value: 0.33388572931289673 and parameters: {'hidden_dims': '[256, 128]', 'dropout': 0.10039706377348931, 'batch_norm': False, 'graph_on': True, 'source': 'grm', 'knn_k': 3, 'weighted_edges': False, 'symmetrize_mode': 'union', 'lr': 2.5617114613324005e-05, 'weight_decay': 0.0003026973643815305, 'epochs': 278, 'use_snp_selection': True, 'num_snps': 22000}. Best is trial 23 with value: 0.3423058807849884.
[I 2025-10-16 15:56:53,865] Trial 34 finished with value: 0.33426541090011597 and parameters: {'hidden_dims': '[512, 128]', 'dropout': 0.37146530372980335, 'batch_norm': False, 'graph_on': True, 'source': 'grm', 'knn_k': 5, 'weighted_edges': False, 'symmetrize_mode': 'mutual', 'lr': 5.2848630593058635e-06, 'weight_decay': 0.0005392744940124165, 'epochs': 147, 'use_snp_selection': True, 'num_snps': 30000}. Best is trial 23 with value: 0.3423058807849884.
[I 2025-10-16 15:57:12,720] Trial 35 finished with value: 0.3352080523967743 and parameters: {'hidden_dims': '[128, 64]', 'dropout': 0.42774100008321764, 'batch_norm': True, 'graph_on': True, 'source': 'grm', 'knn_k': 4, 'weighted_edges': True, 'symmetrize_mode': 'union', 'lr': 1.4120718364419808e-05, 'weight_decay': 0.0009489906432258132, 'epochs': 38, 'use_snp_selection': True, 'num_snps': 18000}. Best is trial 23 with value: 0.3423058807849884.
[I 2025-10-16 15:57:46,797] Trial 36 finished with value: 0.3239162743091583 and parameters: {'hidden_dims': '[256, 128]', 'dropout': 0.3469174362533123, 'batch_norm': False, 'graph_on': True, 'source': 'grm', 'knn_k': 3, 'weighted_edges': False, 'symmetrize_mode': 'mutual', 'lr': 5.339813280954715e-05, 'weight_decay': 1.4363811655320629e-05, 'epochs': 113, 'use_snp_selection': True, 'num_snps': 54000}. Best is trial 23 with value: 0.3423058807849884.
[I 2025-10-16 15:58:11,644] Trial 37 finished with value: 0.2823285639286041 and parameters: {'hidden_dims': '[512, 256]', 'dropout': 0.19700188697219506, 'batch_norm': False, 'graph_on': True, 'source': 'grm', 'knn_k': 5, 'weighted_edges': False, 'symmetrize_mode': 'union', 'lr': 1.4525002376145753e-06, 'weight_decay': 0.00012737750603249441, 'epochs': 188, 'use_snp_selection': True, 'num_snps': 8000}. Best is trial 23 with value: 0.3423058807849884.
[I 2025-10-16 15:58:45,635] Trial 38 finished with value: 0.32215439677238467 and parameters: {'hidden_dims': '[256, 128, 64]', 'dropout': 0.31943973689580907, 'batch_norm': False, 'graph_on': True, 'source': 'grm', 'knn_k': 4, 'weighted_edges': False, 'symmetrize_mode': 'mutual', 'lr': 8.286294144627556e-06, 'weight_decay': 3.341376177985258e-07, 'epochs': 163, 'use_snp_selection': True, 'num_snps': 38000}. Best is trial 23 with value: 0.3423058807849884.
[I 2025-10-16 15:59:16,502] Trial 39 finished with value: 0.32170267701148986 and parameters: {'hidden_dims': '[512, 128]', 'dropout': 0.5580318291740233, 'batch_norm': True, 'graph_on': True, 'source': 'grm', 'knn_k': 2, 'weighted_edges': True, 'symmetrize_mode': 'union', 'lr': 2.312327577343686e-06, 'weight_decay': 0.00020784997129960625, 'epochs': 49, 'use_snp_selection': True, 'num_snps': 48000}. Best is trial 23 with value: 0.3423058807849884.
[I 2025-10-16 15:59:46,347] Trial 40 finished with value: 0.31830461621284484 and parameters: {'hidden_dims': '[256, 128, 64]', 'dropout': 0.48930324158719507, 'batch_norm': False, 'graph_on': True, 'source': 'grm', 'knn_k': 3, 'weighted_edges': False, 'symmetrize_mode': 'mutual', 'lr': 2.1692601897074867e-05, 'weight_decay': 8.089206341438257e-05, 'epochs': 89, 'use_snp_selection': True, 'num_snps': 46000}. Best is trial 23 with value: 0.3423058807849884.
[I 2025-10-16 16:00:24,342] Trial 41 finished with value: 0.3395499587059021 and parameters: {'hidden_dims': '[512, 256]', 'dropout': 0.3113561417510549, 'batch_norm': False, 'graph_on': True, 'source': 'grm', 'knn_k': 2, 'weighted_edges': False, 'symmetrize_mode': 'union', 'lr': 6.62487901611983e-06, 'weight_decay': 2.8004107745987206e-05, 'epochs': 130, 'use_snp_selection': True, 'num_snps': 34000}. Best is trial 23 with value: 0.3423058807849884.
