[I 2025-10-16 20:49:03,684] Trial 24 finished with value: 0.3343365490436554 and parameters: {'hidden_dims': '[512, 64]', 'dropout': 0.4121846580076386, 'batch_norm': True, 'graph_on': True, 'source': 'grm', 'knn_k': 7, 'weighted_edges': True, 'symmetrize_mode': 'union', 'lr': 4.087071828760919e-05, 'weight_decay': 0.00022826125069405224, 'epochs': 159, 'use_snp_selection': True, 'num_snps': 12000}. Best is trial 11 with value: 0.33762024641036986.
[I 2025-10-16 20:49:27,234] Trial 25 finished with value: 0.32468973398208617 and parameters: {'hidden_dims': '[256, 128, 64]', 'dropout': 0.5049738387016905, 'batch_norm': True, 'graph_on': True, 'source': 'grm', 'knn_k': 6, 'weighted_edges': True, 'symmetrize_mode': 'union', 'lr': 3.779452795825624e-05, 'weight_decay': 0.0009119597082290585, 'epochs': 172, 'use_snp_selection': True, 'num_snps': 10000}. Best is trial 11 with value: 0.33762024641036986.
[I 2025-10-16 20:50:10,676] Trial 26 finished with value: 0.2338160514831543 and parameters: {'hidden_dims': '[512, 128]', 'dropout': 0.4266934814950101, 'batch_norm': True, 'graph_on': True, 'source': 'grm', 'knn_k': 4, 'weighted_edges': True, 'symmetrize_mode': 'mutual', 'lr': 0.00014881796653345994, 'weight_decay': 0.00024576432195237707, 'epochs': 259, 'use_snp_selection': True, 'num_snps': 22000}. Best is trial 11 with value: 0.33762024641036986.
[I 2025-10-16 20:50:37,972] Trial 27 finished with value: 0.3281733512878418 and parameters: {'hidden_dims': '[256, 128]', 'dropout': 0.40536282820117453, 'batch_norm': False, 'graph_on': True, 'source': 'grm', 'knn_k': 6, 'weighted_edges': False, 'symmetrize_mode': 'union', 'lr': 5.355335899300771e-05, 'weight_decay': 0.0001209289163984403, 'epochs': 337, 'use_snp_selection': True, 'num_snps': 10000}. Best is trial 11 with value: 0.33762024641036986.
[I 2025-10-16 20:51:10,289] Trial 28 finished with value: 0.3315196692943573 and parameters: {'hidden_dims': '[512, 256]', 'dropout': 0.31494324191552325, 'batch_norm': True, 'graph_on': True, 'source': 'grm', 'knn_k': 7, 'weighted_edges': True, 'symmetrize_mode': 'union', 'lr': 1.694014766891748e-05, 'weight_decay': 0.0004196962191965498, 'epochs': 217, 'use_snp_selection': True, 'num_snps': 14000}. Best is trial 11 with value: 0.33762024641036986.
[I 2025-10-16 20:51:30,658] Trial 29 finished with value: 0.3249288022518158 and parameters: {'hidden_dims': '[128, 64]', 'dropout': 0.4396967863862903, 'batch_norm': True, 'graph_on': True, 'source': 'grm', 'knn_k': 4, 'weighted_edges': True, 'symmetrize_mode': 'union', 'lr': 0.0002029868195405036, 'weight_decay': 1.905084717416042e-05, 'epochs': 252, 'use_snp_selection': True, 'num_snps': 2000}. Best is trial 11 with value: 0.33762024641036986.
[I 2025-10-16 20:51:57,321] Trial 30 finished with value: 0.2633942306041718 and parameters: {'hidden_dims': '[512, 64]', 'dropout': 0.2655782191745206, 'batch_norm': True, 'graph_on': True, 'source': 'grm', 'knn_k': 1, 'weighted_edges': True, 'symmetrize_mode': 'union', 'lr': 0.0005089089593143393, 'weight_decay': 0.0009467620402815667, 'epochs': 90, 'use_snp_selection': True, 'num_snps': 22000}. Best is trial 11 with value: 0.33762024641036986.
[I 2025-10-16 20:52:34,910] Trial 31 finished with value: 0.3378046989440918 and parameters: {'hidden_dims': '[512, 64]', 'dropout': 0.37871963023017036, 'batch_norm': True, 'graph_on': True, 'source': 'grm', 'knn_k': 7, 'weighted_edges': True, 'symmetrize_mode': 'union', 'lr': 5.803504244964049e-06, 'weight_decay': 4.63544013517805e-05, 'epochs': 136, 'use_snp_selection': True, 'num_snps': 30000}. Best is trial 31 with value: 0.3378046989440918.
[I 2025-10-16 20:53:14,801] Trial 32 finished with value: 0.3343402922153473 and parameters: {'hidden_dims': '[512, 64]', 'dropout': 0.38500021655034017, 'batch_norm': True, 'graph_on': True, 'source': 'grm', 'knn_k': 7, 'weighted_edges': True, 'symmetrize_mode': 'union', 'lr': 5.510724115451726e-06, 'weight_decay': 7.582292254745986e-05, 'epochs': 153, 'use_snp_selection': True, 'num_snps': 30000}. Best is trial 31 with value: 0.3378046989440918.
[I 2025-10-16 20:53:51,802] Trial 33 finished with value: 0.3409039795398712 and parameters: {'hidden_dims': '[512, 64]', 'dropout': 0.33721855367552006, 'batch_norm': True, 'graph_on': True, 'source': 'grm', 'knn_k': 6, 'weighted_edges': True, 'symmetrize_mode': 'union', 'lr': 5.257816052813587e-06, 'weight_decay': 7.476634591228557e-05, 'epochs': 144, 'use_snp_selection': True, 'num_snps': 28000}. Best is trial 33 with value: 0.3409039795398712.
[I 2025-10-16 20:54:13,888] Trial 34 finished with value: 0.30767130851745605 and parameters: {'hidden_dims': '[512, 64]', 'dropout': 0.33978554320876647, 'batch_norm': True, 'graph_on': True, 'source': 'grm', 'knn_k': 5, 'weighted_edges': True, 'symmetrize_mode': 'mutual', 'lr': 9.233885703241324e-06, 'weight_decay': 2.2032837743875733e-05, 'epochs': 41, 'use_snp_selection': True, 'num_snps': 20000}. Best is trial 33 with value: 0.3409039795398712.
[I 2025-10-16 20:54:37,123] Trial 35 finished with value: 0.31862057447433473 and parameters: {'hidden_dims': '[128, 64]', 'dropout': 0.21726464790883793, 'batch_norm': False, 'graph_on': True, 'source': 'grm', 'knn_k': 6, 'weighted_edges': False, 'symmetrize_mode': 'union', 'lr': 1.2073858085366628e-05, 'weight_decay': 0.00014724284412919304, 'epochs': 137, 'use_snp_selection': True, 'num_snps': 24000}. Best is trial 33 with value: 0.3409039795398712.
[I 2025-10-16 20:55:13,170] Trial 36 finished with value: 0.27574279308319094 and parameters: {'hidden_dims': '[256, 128]', 'dropout': 0.31823576806168186, 'batch_norm': True, 'graph_on': True, 'source': 'grm', 'knn_k': 6, 'weighted_edges': True, 'symmetrize_mode': 'mutual', 'lr': 2.4274441960288853e-05, 'weight_decay': 6.14684072583864e-06, 'epochs': 188, 'use_snp_selection': True, 'num_snps': 38000}. Best is trial 33 with value: 0.3409039795398712.
[I 2025-10-16 20:55:46,336] Trial 37 finished with value: 0.31129931211471557 and parameters: {'hidden_dims': '[512, 256]', 'dropout': 0.38334742336411937, 'batch_norm': True, 'graph_on': True, 'source': 'grm', 'knn_k': 4, 'weighted_edges': True, 'symmetrize_mode': 'union', 'lr': 6.185818068588236e-06, 'weight_decay': 5.562128010477101e-05, 'epochs': 97, 'use_snp_selection': True, 'num_snps': 32000}. Best is trial 33 with value: 0.3409039795398712.
[I 2025-10-16 20:56:21,167] Trial 38 finished with value: 0.32338610887527464 and parameters: {'hidden_dims': '[256, 128, 64]', 'dropout': 0.5046357441569926, 'batch_norm': True, 'graph_on': True, 'source': 'grm', 'knn_k': 5, 'weighted_edges': True, 'symmetrize_mode': 'union', 'lr': 1.0749203586327587e-05, 'weight_decay': 8.054968824877167e-07, 'epochs': 207, 'use_snp_selection': True, 'num_snps': 30000}. Best is trial 33 with value: 0.3409039795398712.
[I 2025-10-16 20:57:05,504] Trial 39 finished with value: 0.32916465401649475 and parameters: {'hidden_dims': '[512, 64]', 'dropout': 0.28001278560648246, 'batch_norm': False, 'graph_on': True, 'source': 'grm', 'knn_k': 5, 'weighted_edges': False, 'symmetrize_mode': 'union', 'lr': 1.3035243584901752e-05, 'weight_decay': 0.00010274618288562263, 'epochs': 319, 'use_snp_selection': True, 'num_snps': 18000}. Best is trial 33 with value: 0.3409039795398712.
[I 2025-10-16 20:58:10,743] Trial 40 finished with value: 0.2828021883964539 and parameters: {'hidden_dims': '[512, 256]', 'dropout': 0.13352554932798905, 'batch_norm': True, 'graph_on': True, 'source': 'grm', 'knn_k': 6, 'weighted_edges': True, 'symmetrize_mode': 'mutual', 'lr': 4.710416647887137e-06, 'weight_decay': 3.800473494806151e-05, 'epochs': 256, 'use_snp_selection': True, 'num_snps': 40000}. Best is trial 33 with value: 0.3409039795398712.
[I 2025-10-16 20:58:47,766] Trial 41 finished with value: 0.3349004745483398 and parameters: {'hidden_dims': '[512, 64]', 'dropout': 0.39368026627595043, 'batch_norm': True, 'graph_on': True, 'source': 'grm', 'knn_k': 7, 'weighted_edges': True, 'symmetrize_mode': 'union', 'lr': 6.62487901611983e-06, 'weight_decay': 7.634342668349214e-05, 'epochs': 131, 'use_snp_selection': True, 'num_snps': 30000}. Best is trial 33 with value: 0.3409039795398712.
[I 2025-10-16 20:59:24,068] Trial 42 finished with value: 0.3288367331027985 and parameters: {'hidden_dims': '[512, 64]', 'dropout': 0.3360585603552889, 'batch_norm': True, 'graph_on': True, 'source': 'grm', 'knn_k': 7, 'weighted_edges': True, 'symmetrize_mode': 'union', 'lr': 8.199204413197395e-06, 'weight_decay': 0.00014750027227250658, 'epochs': 137, 'use_snp_selection': True, 'num_snps': 28000}. Best is trial 33 with value: 0.3409039795398712.
[I 2025-10-16 21:00:03,610] Trial 43 finished with value: 0.3387496829032898 and parameters: {'hidden_dims': '[512, 64]', 'dropout': 0.37438486477832605, 'batch_norm': True, 'graph_on': True, 'source': 'grm', 'knn_k': 6, 'weighted_edges': True, 'symmetrize_mode': 'union', 'lr': 3.66000812744736e-06, 'weight_decay': 0.00029921067823356507, 'epochs': 175, 'use_snp_selection': True, 'num_snps': 26000}. Best is trial 33 with value: 0.3409039795398712.
[I 2025-10-16 21:00:47,243] Trial 44 finished with value: 0.33235321044921873 and parameters: {'hidden_dims': '[512, 64]', 'dropout': 0.3635600813939496, 'batch_norm': True, 'graph_on': True, 'source': 'grm', 'knn_k': 6, 'weighted_edges': True, 'symmetrize_mode': 'union', 'lr': 3.7672239806621103e-06, 'weight_decay': 0.00032352354402450994, 'epochs': 237, 'use_snp_selection': True, 'num_snps': 24000}. Best is trial 33 with value: 0.3409039795398712.
[I 2025-10-16 21:01:32,905] Trial 45 finished with value: 0.3303754389286041 and parameters: {'hidden_dims': '[512, 64]', 'dropout': 0.45027349262811944, 'batch_norm': True, 'graph_on': True, 'source': 'grm', 'knn_k': 6, 'weighted_edges': True, 'symmetrize_mode': 'union', 'lr': 1.7565767753434583e-06, 'weight_decay': 0.0005260255564582189, 'epochs': 177, 'use_snp_selection': True, 'num_snps': 34000}. Best is trial 33 with value: 0.3409039795398712.
[I 2025-10-16 21:02:15,955] Trial 46 finished with value: 0.3397350609302521 and parameters: {'hidden_dims': '[512, 128]', 'dropout': 0.3328668484463099, 'batch_norm': True, 'graph_on': True, 'source': 'grm', 'knn_k': 6, 'weighted_edges': True, 'symmetrize_mode': 'union', 'lr': 2.6451524405790376e-06, 'weight_decay': 0.00021967018158066675, 'epochs': 204, 'use_snp_selection': True, 'num_snps': 26000}. Best is trial 33 with value: 0.3409039795398712.
[I 2025-10-16 21:02:57,916] Trial 47 finished with value: 0.3075628519058228 and parameters: {'hidden_dims': '[512, 128]', 'dropout': 0.329638917831869, 'batch_norm': False, 'graph_on': True, 'source': 'grm', 'knn_k': 5, 'weighted_edges': False, 'symmetrize_mode': 'union', 'lr': 1.4051207943728179e-06, 'weight_decay': 0.00020208363289471166, 'epochs': 198, 'use_snp_selection': True, 'num_snps': 26000}. Best is trial 33 with value: 0.3409039795398712.
[I 2025-10-16 21:03:32,062] Trial 48 finished with value: 0.3324472367763519 and parameters: {'hidden_dims': '[512, 128]', 'dropout': 0.29834259803891405, 'batch_norm': True, 'graph_on': True, 'source': 'grm', 'knn_k': 5, 'weighted_edges': True, 'symmetrize_mode': 'union', 'lr': 2.5644833860543328e-06, 'weight_decay': 5.193071607377175e-05, 'epochs': 174, 'use_snp_selection': True, 'num_snps': 20000}. Best is trial 33 with value: 0.3409039795398712.
[I 2025-10-16 21:03:55,220] Trial 49 finished with value: 0.24590623676776885 and parameters: {'hidden_dims': '[512, 128]', 'dropout': 0.22535564534614544, 'batch_norm': True, 'graph_on': True, 'source': 'grm', 'knn_k': 6, 'weighted_edges': True, 'symmetrize_mode': 'union', 'lr': 1.07937161386487e-06, 'weight_decay': 0.000538944656094979, 'epochs': 24, 'use_snp_selection': True, 'num_snps': 32000}. Best is trial 33 with value: 0.3409039795398712.
[I 2025-10-16 21:04:32,957] Trial 50 finished with value: 0.3366307020187378 and parameters: {'hidden_dims': '[512, 128]', 'dropout': 0.36319258814372707, 'batch_norm': True, 'graph_on': True, 'source': 'grm', 'knn_k': 7, 'weighted_edges': True, 'symmetrize_mode': 'union', 'lr': 4.021831372630852e-06, 'weight_decay': 2.666593241367214e-05, 'epochs': 114, 'use_snp_selection': True, 'num_snps': 36000}. Best is trial 33 with value: 0.3409039795398712.
[I 2025-10-16 21:05:11,590] Trial 51 finished with value: 0.3338853895664215 and parameters: {'hidden_dims': '[512, 128]', 'dropout': 0.36443854179527185, 'batch_norm': True, 'graph_on': True, 'source': 'grm', 'knn_k': 7, 'weighted_edges': True, 'symmetrize_mode': 'union', 'lr': 3.9865244041313704e-06, 'weight_decay': 2.7010535042933963e-05, 'epochs': 113, 'use_snp_selection': True, 'num_snps': 38000}. Best is trial 33 with value: 0.3409039795398712.
[I 2025-10-16 21:05:42,152] Trial 52 finished with value: 0.33337533473968506 and parameters: {'hidden_dims': '[512, 128]', 'dropout': 0.35028447209993174, 'batch_norm': True, 'graph_on': True, 'source': 'grm', 'knn_k': 7, 'weighted_edges': True, 'symmetrize_mode': 'union', 'lr': 2.625131750338894e-06, 'weight_decay': 1.3585202431844761e-05, 'epochs': 91, 'use_snp_selection': True, 'num_snps': 28000}. Best is trial 33 with value: 0.3409039795398712.
[I 2025-10-16 21:06:23,689] Trial 53 finished with value: 0.31997278332710266 and parameters: {'hidden_dims': '[512, 128]', 'dropout': 0.3141899424182448, 'batch_norm': True, 'graph_on': True, 'source': 'grm', 'knn_k': 7, 'weighted_edges': True, 'symmetrize_mode': 'union', 'lr': 4.654203906546194e-06, 'weight_decay': 0.00012267163765806256, 'epochs': 148, 'use_snp_selection': True, 'num_snps': 34000}. Best is trial 33 with value: 0.3409039795398712.
[I 2025-10-16 21:07:03,878] Trial 54 finished with value: 0.3343993604183197 and parameters: {'hidden_dims': '[512, 128]', 'dropout': 0.376941044322219, 'batch_norm': True, 'graph_on': True, 'source': 'grm', 'knn_k': 6, 'weighted_edges': True, 'symmetrize_mode': 'union', 'lr': 3.2370600986539435e-06, 'weight_decay': 8.978898643943911e-05, 'epochs': 107, 'use_snp_selection': True, 'num_snps': 42000}. Best is trial 33 with value: 0.3409039795398712.
[I 2025-10-16 21:07:35,823] Trial 55 finished with value: 0.32494114637374877 and parameters: {'hidden_dims': '[512, 256]', 'dropout': 0.28168377843018694, 'batch_norm': True, 'graph_on': True, 'source': 'grm', 'knn_k': 7, 'weighted_edges': True, 'symmetrize_mode': 'union', 'lr': 1.4095939656816456e-06, 'weight_decay': 5.063220131221295e-05, 'epochs': 122, 'use_snp_selection': True, 'num_snps': 24000}. Best is trial 33 with value: 0.3409039795398712.
[I 2025-10-16 21:08:08,760] Trial 56 finished with value: 0.3313311755657196 and parameters: {'hidden_dims': '[512, 128]', 'dropout': 0.34489311964746766, 'batch_norm': True, 'graph_on': True, 'source': 'grm', 'knn_k': 6, 'weighted_edges': True, 'symmetrize_mode': 'union', 'lr': 2.4373493442126207e-06, 'weight_decay': 8.194382924091537e-06, 'epochs': 83, 'use_snp_selection': True, 'num_snps': 36000}. Best is trial 33 with value: 0.3409039795398712.
[I 2025-10-16 21:08:31,261] Trial 57 finished with value: 0.29203128814697266 and parameters: {'hidden_dims': '[256, 128]', 'dropout': 0.404483114420783, 'batch_norm': True, 'graph_on': True, 'source': 'grm', 'knn_k': 6, 'weighted_edges': True, 'symmetrize_mode': 'mutual', 'lr': 1.9862178030514e-06, 'weight_decay': 2.8789250061062916e-05, 'epochs': 58, 'use_snp_selection': True, 'num_snps': 26000}. Best is trial 33 with value: 0.3409039795398712.
[I 2025-10-16 21:09:03,471] Trial 58 finished with value: 0.2902134895324707 and parameters: {'hidden_dims': '[256, 128, 64]', 'dropout': 0.3704267920824532, 'batch_norm': False, 'graph_on': True, 'source': 'grm', 'knn_k': 5, 'weighted_edges': False, 'symmetrize_mode': 'union', 'lr': 3.2838697215187884e-06, 'weight_decay': 0.00017385047830653695, 'epochs': 186, 'use_snp_selection': True, 'num_snps': 28000}. Best is trial 33 with value: 0.3409039795398712.
[I 2025-10-16 21:09:45,887] Trial 59 finished with value: 0.32473340034484866 and parameters: {'hidden_dims': '[512, 256]', 'dropout': 0.4786016491737808, 'batch_norm': True, 'graph_on': True, 'source': 'grm', 'knn_k': 7, 'weighted_edges': True, 'symmetrize_mode': 'union', 'lr': 7.473742720603004e-06, 'weight_decay': 1.3184886194129964e-06, 'epochs': 162, 'use_snp_selection': True, 'num_snps': 32000}. Best is trial 33 with value: 0.3409039795398712.
[I 2025-10-16 21:10:25,025] Trial 60 finished with value: 0.3353153645992279 and parameters: {'hidden_dims': '[512, 128]', 'dropout': 0.39562517886054677, 'batch_norm': True, 'graph_on': True, 'source': 'grm', 'knn_k': 6, 'weighted_edges': True, 'symmetrize_mode': 'union', 'lr': 5.3529276132356515e-06, 'weight_decay': 0.00024956907278553015, 'epochs': 207, 'use_snp_selection': True, 'num_snps': 22000}. Best is trial 33 with value: 0.3409039795398712.
[I 2025-10-16 21:10:50,601] Trial 61 finished with value: 0.33645972013473513 and parameters: {'hidden_dims': '[512, 64]', 'dropout': 0.417424873423709, 'batch_norm': True, 'graph_on': True, 'source': 'grm', 'knn_k': 5, 'weighted_edges': True, 'symmetrize_mode': 'union', 'lr': 2.4778845324995402e-05, 'weight_decay': 0.0003462988320933645, 'epochs': 244, 'use_snp_selection': True, 'num_snps': 6000}. Best is trial 33 with value: 0.3409039795398712.
[I 2025-10-16 21:11:22,703] Trial 62 finished with value: 0.33579103350639344 and parameters: {'hidden_dims': '[512, 64]', 'dropout': 0.3574493032213132, 'batch_norm': True, 'graph_on': True, 'source': 'grm', 'knn_k': 6, 'weighted_edges': True, 'symmetrize_mode': 'union', 'lr': 3.968011456994494e-06, 'weight_decay': 0.0006507265225074177, 'epochs': 166, 'use_snp_selection': True, 'num_snps': 18000}. Best is trial 33 with value: 0.3409039795398712.
[I 2025-10-16 21:12:04,943] Trial 63 finished with value: 0.3285075306892395 and parameters: {'hidden_dims': '[512, 64]', 'dropout': 0.4358942781782632, 'batch_norm': True, 'graph_on': True, 'source': 'grm', 'knn_k': 6, 'weighted_edges': True, 'symmetrize_mode': 'union', 'lr': 9.428301429432457e-06, 'weight_decay': 0.0002634822193371088, 'epochs': 144, 'use_snp_selection': True, 'num_snps': 36000}. Best is trial 33 with value: 0.3409039795398712.
[I 2025-10-16 21:12:26,454] Trial 64 finished with value: 0.33264360427856443 and parameters: {'hidden_dims': '[128, 64]', 'dropout': 0.32627181411978495, 'batch_norm': True, 'graph_on': True, 'source': 'grm', 'knn_k': 7, 'weighted_edges': True, 'symmetrize_mode': 'union', 'lr': 9.142151608223332e-05, 'weight_decay': 2.0006142125900714e-05, 'epochs': 126, 'use_snp_selection': True, 'num_snps': 14000}. Best is trial 33 with value: 0.3409039795398712.
[I 2025-10-16 21:13:14,176] Trial 65 finished with value: 0.32318833470344543 and parameters: {'hidden_dims': '[512, 64]', 'dropout': 0.44976501204222646, 'batch_norm': True, 'graph_on': True, 'source': 'grm', 'knn_k': 7, 'weighted_edges': True, 'symmetrize_mode': 'union', 'lr': 1.5241271561167681e-05, 'weight_decay': 0.00010449554611830078, 'epochs': 276, 'use_snp_selection': True, 'num_snps': 24000}. Best is trial 33 with value: 0.3409039795398712.
[I 2025-10-16 21:14:27,068] Trial 66 finished with value: 0.32842464447021485 and parameters: {'hidden_dims': '[512, 64]', 'dropout': 0.41273785903156, 'batch_norm': True, 'graph_on': True, 'source': 'grm', 'knn_k': 6, 'weighted_edges': True, 'symmetrize_mode': 'union', 'lr': 2.04000238036916e-06, 'weight_decay': 4.318993524644815e-05, 'epochs': 215, 'use_snp_selection': True, 'num_snps': 56000}. Best is trial 33 with value: 0.3409039795398712.
[I 2025-10-16 21:15:13,194] Trial 67 finished with value: 0.3130796253681183 and parameters: {'hidden_dims': '[512, 256]', 'dropout': 0.38837072448994525, 'batch_norm': True, 'graph_on': True, 'source': 'grm', 'knn_k': 4, 'weighted_edges': True, 'symmetrize_mode': 'union', 'lr': 5.835373092363824e-06, 'weight_decay': 7.341355512014542e-05, 'epochs': 230, 'use_snp_selection': True, 'num_snps': 26000}. Best is trial 33 with value: 0.3409039795398712.
[I 2025-10-16 21:15:57,035] Trial 68 finished with value: 0.3042080760002136 and parameters: {'hidden_dims': '[512, 64]', 'dropout': 0.3061965730373001, 'batch_norm': True, 'graph_on': True, 'source': 'grm', 'knn_k': 6, 'weighted_edges': True, 'symmetrize_mode': 'mutual', 'lr': 2.8199034093100067e-06, 'weight_decay': 0.00015746503899456173, 'epochs': 185, 'use_snp_selection': True, 'num_snps': 30000}. Best is trial 33 with value: 0.3409039795398712.
[I 2025-10-16 21:16:16,992] Trial 69 finished with value: 0.17236092388629914 and parameters: {'hidden_dims': '[256, 128]', 'dropout': 0.35223235741526354, 'batch_norm': False, 'graph_on': True, 'source': 'grm', 'knn_k': 1, 'weighted_edges': False, 'symmetrize_mode': 'union', 'lr': 4.3117116034516934e-06, 'weight_decay': 0.0004327473781072113, 'epochs': 11, 'use_snp_selection': True, 'num_snps': 34000}. Best is trial 33 with value: 0.3409039795398712.
[I 2025-10-16 21:16:42,932] Trial 70 finished with value: 0.3071325898170471 and parameters: {'hidden_dims': '[256, 128, 64]', 'dropout': 0.3790391912574721, 'batch_norm': True, 'graph_on': True, 'source': 'grm', 'knn_k': 5, 'weighted_edges': True, 'symmetrize_mode': 'union', 'lr': 0.0003707641186029783, 'weight_decay': 0.0002812163669338253, 'epochs': 59, 'use_snp_selection': True, 'num_snps': 40000}. Best is trial 33 with value: 0.3409039795398712.
[I 2025-10-16 21:17:10,197] Trial 71 finished with value: 0.32836354374885557 and parameters: {'hidden_dims': '[512, 64]', 'dropout': 0.4198346806617112, 'batch_norm': True, 'graph_on': True, 'source': 'grm', 'knn_k': 5, 'weighted_edges': True, 'symmetrize_mode': 'union', 'lr': 2.6492132679379717e-05, 'weight_decay': 0.00036606174053095084, 'epochs': 237, 'use_snp_selection': True, 'num_snps': 8000}. Best is trial 33 with value: 0.3409039795398712.
