[I 2025-10-17 01:52:18,087] Trial 54 finished with value: 0.3227740883827209 and parameters: {'hidden_dims': '[512, 128]', 'dropout': 0.5409714498409595, 'batch_norm': True, 'graph_on': True, 'source': 'grm', 'knn_k': 5, 'weighted_edges': True, 'symmetrize_mode': 'union', 'lr': 4.36908073739866e-06, 'weight_decay': 0.00028524849669177966, 'epochs': 182, 'use_snp_selection': True, 'num_snps': 48000}. Best is trial 13 with value: 0.34549073576927186.
[I 2025-10-17 01:53:10,758] Trial 55 finished with value: 0.3480435013771057 and parameters: {'hidden_dims': '[256, 128]', 'dropout': 0.4731148080713836, 'batch_norm': True, 'graph_on': True, 'source': 'grm', 'knn_k': 7, 'weighted_edges': True, 'symmetrize_mode': 'union', 'lr': 2.3036221628593323e-06, 'weight_decay': 0.0006478253057034337, 'epochs': 260, 'use_snp_selection': True, 'num_snps': 54000}. Best is trial 55 with value: 0.3480435013771057.
[I 2025-10-17 01:54:03,356] Trial 56 finished with value: 0.33654112219810484 and parameters: {'hidden_dims': '[256, 128]', 'dropout': 0.3241696993307933, 'batch_norm': True, 'graph_on': True, 'source': 'grm', 'knn_k': 7, 'weighted_edges': True, 'symmetrize_mode': 'union', 'lr': 1.8916921357202001e-06, 'weight_decay': 0.0007881508809045173, 'epochs': 260, 'use_snp_selection': True, 'num_snps': 54000}. Best is trial 55 with value: 0.3480435013771057.
[I 2025-10-17 01:55:00,333] Trial 57 finished with value: 0.34303986430168154 and parameters: {'hidden_dims': '[256, 128]', 'dropout': 0.4721879430878772, 'batch_norm': True, 'graph_on': True, 'source': 'grm', 'knn_k': 7, 'weighted_edges': True, 'symmetrize_mode': 'union', 'lr': 1.0007728940081747e-06, 'weight_decay': 0.0006521399252342711, 'epochs': 272, 'use_snp_selection': True, 'num_snps': 58000}. Best is trial 55 with value: 0.3480435013771057.
[I 2025-10-17 01:55:57,574] Trial 58 finished with value: 0.34344133734703064 and parameters: {'hidden_dims': '[256, 128]', 'dropout': 0.4957748702465144, 'batch_norm': True, 'graph_on': True, 'source': 'grm', 'knn_k': 7, 'weighted_edges': True, 'symmetrize_mode': 'union', 'lr': 2.3097178251768468e-06, 'weight_decay': 0.00035758715919985477, 'epochs': 299, 'use_snp_selection': True, 'num_snps': 54000}. Best is trial 55 with value: 0.3480435013771057.
[I 2025-10-17 01:56:49,852] Trial 59 finished with value: 0.3199798345565796 and parameters: {'hidden_dims': '[256, 128]', 'dropout': 0.4617337618981509, 'batch_norm': False, 'graph_on': True, 'source': 'grm', 'knn_k': 7, 'weighted_edges': False, 'symmetrize_mode': 'union', 'lr': 1.376260663160148e-06, 'weight_decay': 1.3184886194129964e-06, 'epochs': 274, 'use_snp_selection': True, 'num_snps': 50000}. Best is trial 55 with value: 0.3480435013771057.
[I 2025-10-17 01:57:41,551] Trial 60 finished with value: 0.31211975812911985 and parameters: {'hidden_dims': '[512, 64]', 'dropout': 0.2909930127166017, 'batch_norm': True, 'graph_on': True, 'source': 'grm', 'knn_k': 6, 'weighted_edges': True, 'symmetrize_mode': 'union', 'lr': 5.2814544861159025e-06, 'weight_decay': 2.4402416108252785e-05, 'epochs': 333, 'use_snp_selection': True, 'num_snps': 22000}. Best is trial 55 with value: 0.3480435013771057.
[I 2025-10-17 01:58:04,754] Trial 61 finished with value: 0.3104842782020569 and parameters: {'hidden_dims': '[256, 128]', 'dropout': 0.4943566005134758, 'batch_norm': True, 'graph_on': True, 'source': 'grm', 'knn_k': 7, 'weighted_edges': True, 'symmetrize_mode': 'union', 'lr': 2.3810353969544814e-06, 'weight_decay': 0.0003712838273987586, 'epochs': 303, 'use_snp_selection': True, 'num_snps': 4000}. Best is trial 55 with value: 0.3480435013771057.
[I 2025-10-17 01:59:01,872] Trial 62 finished with value: 0.3425878703594208 and parameters: {'hidden_dims': '[256, 128]', 'dropout': 0.5281905390032497, 'batch_norm': True, 'graph_on': True, 'source': 'grm', 'knn_k': 7, 'weighted_edges': True, 'symmetrize_mode': 'union', 'lr': 1.6614422421046878e-06, 'weight_decay': 0.00024272265251319523, 'epochs': 299, 'use_snp_selection': True, 'num_snps': 54000}. Best is trial 55 with value: 0.3480435013771057.
[I 2025-10-17 02:00:09,887] Trial 63 finished with value: 0.3314483642578125 and parameters: {'hidden_dims': '[256, 128]', 'dropout': 0.43651239429755384, 'batch_norm': True, 'graph_on': True, 'source': 'grm', 'knn_k': 7, 'weighted_edges': True, 'symmetrize_mode': 'union', 'lr': 2.9668163898109313e-06, 'weight_decay': 0.0004456309492201865, 'epochs': 348, 'use_snp_selection': True, 'num_snps': 60000}. Best is trial 55 with value: 0.3480435013771057.
[I 2025-10-17 02:01:45,519] Trial 64 finished with value: 0.33116014003753663 and parameters: {'hidden_dims': '[512, 256]', 'dropout': 0.41224005815308373, 'batch_norm': True, 'graph_on': True, 'source': 'grm', 'knn_k': 7, 'weighted_edges': True, 'symmetrize_mode': 'union', 'lr': 2.139242130932024e-06, 'weight_decay': 0.00015403204578689326, 'epochs': 308, 'use_snp_selection': True, 'num_snps': 56000}. Best is trial 55 with value: 0.3480435013771057.
[I 2025-10-17 02:02:46,422] Trial 65 finished with value: 0.3174588143825531 and parameters: {'hidden_dims': '[256, 128]', 'dropout': 0.3693511862110821, 'batch_norm': True, 'graph_on': True, 'source': 'grm', 'knn_k': 6, 'weighted_edges': True, 'symmetrize_mode': 'union', 'lr': 4.098267728276188e-06, 'weight_decay': 0.00033048370622569344, 'epochs': 330, 'use_snp_selection': True, 'num_snps': 52000}. Best is trial 55 with value: 0.3480435013771057.
[I 2025-10-17 02:03:23,772] Trial 66 finished with value: 0.33986198902130127 and parameters: {'hidden_dims': '[128, 64]', 'dropout': 0.5104594345090647, 'batch_norm': True, 'graph_on': True, 'source': 'grm', 'knn_k': 7, 'weighted_edges': True, 'symmetrize_mode': 'union', 'lr': 2.5416825042192606e-06, 'weight_decay': 7.696900351544035e-05, 'epochs': 281, 'use_snp_selection': True, 'num_snps': 46000}. Best is trial 55 with value: 0.3480435013771057.
[I 2025-10-17 02:03:50,838] Trial 67 finished with value: 0.33584659099578856 and parameters: {'hidden_dims': '[256, 128]', 'dropout': 0.3467874982764948, 'batch_norm': True, 'graph_on': True, 'source': 'grm', 'knn_k': 6, 'weighted_edges': True, 'symmetrize_mode': 'union', 'lr': 1.7570869722026108e-06, 'weight_decay': 0.00011933205732581909, 'epochs': 313, 'use_snp_selection': True, 'num_snps': 10000}. Best is trial 55 with value: 0.3480435013771057.
[I 2025-10-17 02:05:10,830] Trial 68 finished with value: 0.2668634742498398 and parameters: {'hidden_dims': '[512, 128]', 'dropout': 0.5520897343847914, 'batch_norm': True, 'graph_on': True, 'source': 'grm', 'knn_k': 7, 'weighted_edges': True, 'symmetrize_mode': 'mutual', 'lr': 3.82634585522473e-05, 'weight_decay': 0.0007497715479667407, 'epochs': 239, 'use_snp_selection': True, 'num_snps': 58000}. Best is trial 55 with value: 0.3480435013771057.
[I 2025-10-17 02:06:09,429] Trial 69 finished with value: 0.3330854535102844 and parameters: {'hidden_dims': '[256, 128]', 'dropout': 0.4860999949266158, 'batch_norm': True, 'graph_on': True, 'source': 'grm', 'knn_k': 7, 'weighted_edges': True, 'symmetrize_mode': 'union', 'lr': 3.214697898160325e-06, 'weight_decay': 1.2735897835436825e-05, 'epochs': 327, 'use_snp_selection': True, 'num_snps': 50000}. Best is trial 55 with value: 0.3480435013771057.
[I 2025-10-17 02:06:43,130] Trial 70 finished with value: 0.325431752204895 and parameters: {'hidden_dims': '[512, 128]', 'dropout': 0.40201708727948976, 'batch_norm': True, 'graph_on': True, 'source': 'grm', 'knn_k': 6, 'weighted_edges': True, 'symmetrize_mode': 'union', 'lr': 1.3041095301720832e-06, 'weight_decay': 0.0004991221825894186, 'epochs': 50, 'use_snp_selection': True, 'num_snps': 54000}. Best is trial 55 with value: 0.3480435013771057.
[I 2025-10-17 02:07:15,583] Trial 71 finished with value: 0.3314502418041229 and parameters: {'hidden_dims': '[512, 128]', 'dropout': 0.5273032537808215, 'batch_norm': True, 'graph_on': True, 'source': 'grm', 'knn_k': 4, 'weighted_edges': True, 'symmetrize_mode': 'union', 'lr': 3.6975192447024636e-06, 'weight_decay': 0.00017730834891277318, 'epochs': 59, 'use_snp_selection': True, 'num_snps': 44000}. Best is trial 55 with value: 0.3480435013771057.
[I 2025-10-17 02:07:50,913] Trial 72 finished with value: 0.33536221385002135 and parameters: {'hidden_dims': '[512, 128]', 'dropout': 0.47765007740733695, 'batch_norm': True, 'graph_on': True, 'source': 'grm', 'knn_k': 5, 'weighted_edges': True, 'symmetrize_mode': 'union', 'lr': 5.365428160820733e-06, 'weight_decay': 0.00023244893477901147, 'epochs': 67, 'use_snp_selection': True, 'num_snps': 48000}. Best is trial 55 with value: 0.3480435013771057.
[I 2025-10-17 02:08:31,994] Trial 73 finished with value: 0.3287029445171356 and parameters: {'hidden_dims': '[512, 128]', 'dropout': 0.4614891364386328, 'batch_norm': True, 'graph_on': True, 'source': 'grm', 'knn_k': 6, 'weighted_edges': True, 'symmetrize_mode': 'union', 'lr': 2.171966325262398e-06, 'weight_decay': 0.0009845928805489997, 'epochs': 86, 'use_snp_selection': True, 'num_snps': 52000}. Best is trial 55 with value: 0.3480435013771057.
[I 2025-10-17 02:09:02,669] Trial 74 finished with value: 0.3327455461025238 and parameters: {'hidden_dims': '[512, 256]', 'dropout': 0.3838225070418544, 'batch_norm': True, 'graph_on': True, 'source': 'grm', 'knn_k': 7, 'weighted_edges': True, 'symmetrize_mode': 'union', 'lr': 2.693629577794118e-06, 'weight_decay': 5.6880246423803615e-05, 'epochs': 41, 'use_snp_selection': True, 'num_snps': 50000}. Best is trial 55 with value: 0.3480435013771057.
[I 2025-10-17 02:09:39,704] Trial 75 finished with value: 0.34320604205131533 and parameters: {'hidden_dims': '[512, 128]', 'dropout': 0.42342095645356903, 'batch_norm': True, 'graph_on': True, 'source': 'grm', 'knn_k': 6, 'weighted_edges': True, 'symmetrize_mode': 'union', 'lr': 1.18917203296807e-06, 'weight_decay': 0.00010009087858179835, 'epochs': 116, 'use_snp_selection': True, 'num_snps': 34000}. Best is trial 55 with value: 0.3480435013771057.
[I 2025-10-17 02:10:09,505] Trial 76 finished with value: 0.296315062046051 and parameters: {'hidden_dims': '[512, 128]', 'dropout': 0.4433020633740708, 'batch_norm': True, 'graph_on': True, 'source': 'grm', 'knn_k': 2, 'weighted_edges': True, 'symmetrize_mode': 'union', 'lr': 1.1453333154917428e-06, 'weight_decay': 0.00010002665871913786, 'epochs': 79, 'use_snp_selection': True, 'num_snps': 30000}. Best is trial 55 with value: 0.3480435013771057.
[I 2025-10-17 02:10:39,634] Trial 77 finished with value: 0.24417540729045867 and parameters: {'hidden_dims': '[256, 128, 64]', 'dropout': 0.4245553526076412, 'batch_norm': False, 'graph_on': True, 'source': 'grm', 'knn_k': 6, 'weighted_edges': False, 'symmetrize_mode': 'union', 'lr': 1.5748120415118176e-06, 'weight_decay': 0.0003094108426211137, 'epochs': 104, 'use_snp_selection': True, 'num_snps': 40000}. Best is trial 55 with value: 0.3480435013771057.
[I 2025-10-17 02:11:00,587] Trial 78 finished with value: 0.12849994897842407 and parameters: {'hidden_dims': '[128, 64]', 'dropout': 0.3896799995285738, 'batch_norm': True, 'graph_on': True, 'source': 'grm', 'knn_k': 6, 'weighted_edges': True, 'symmetrize_mode': 'union', 'lr': 1.2818537337285489e-06, 'weight_decay': 3.370485110980048e-06, 'epochs': 21, 'use_snp_selection': True, 'num_snps': 36000}. Best is trial 55 with value: 0.3480435013771057.
[I 2025-10-17 02:11:56,343] Trial 79 finished with value: 0.2823435544967651 and parameters: {'hidden_dims': '[512, 64]', 'dropout': 0.3574416083125189, 'batch_norm': True, 'graph_on': True, 'source': 'grm', 'knn_k': 7, 'weighted_edges': True, 'symmetrize_mode': 'mutual', 'lr': 0.00013031924649659578, 'weight_decay': 4.592207803282202e-05, 'epochs': 143, 'use_snp_selection': True, 'num_snps': 56000}. Best is trial 55 with value: 0.3480435013771057.
[I 2025-10-17 02:12:58,029] Trial 80 finished with value: 0.3343598544597626 and parameters: {'hidden_dims': '[512, 128]', 'dropout': 0.49699611962877616, 'batch_norm': True, 'graph_on': True, 'source': 'grm', 'knn_k': 7, 'weighted_edges': True, 'symmetrize_mode': 'union', 'lr': 1.6214334368106944e-06, 'weight_decay': 3.482403798867116e-05, 'epochs': 154, 'use_snp_selection': True, 'num_snps': 60000}. Best is trial 55 with value: 0.3480435013771057.
[I 2025-10-17 02:13:33,948] Trial 81 finished with value: 0.3305121064186096 and parameters: {'hidden_dims': '[512, 128]', 'dropout': 0.48132983480747504, 'batch_norm': True, 'graph_on': True, 'source': 'grm', 'knn_k': 5, 'weighted_edges': True, 'symmetrize_mode': 'union', 'lr': 3.3899820405385188e-06, 'weight_decay': 0.00013826918494110946, 'epochs': 116, 'use_snp_selection': True, 'num_snps': 32000}. Best is trial 55 with value: 0.3480435013771057.
[I 2025-10-17 02:14:20,392] Trial 82 finished with value: 0.33389668464660643 and parameters: {'hidden_dims': '[512, 128]', 'dropout': 0.46357658723492334, 'batch_norm': True, 'graph_on': True, 'source': 'grm', 'knn_k': 5, 'weighted_edges': True, 'symmetrize_mode': 'union', 'lr': 1.842688567612755e-06, 'weight_decay': 0.00018022129412852714, 'epochs': 128, 'use_snp_selection': True, 'num_snps': 46000}. Best is trial 55 with value: 0.3480435013771057.
[I 2025-10-17 02:14:58,077] Trial 83 finished with value: 0.3385494589805603 and parameters: {'hidden_dims': '[512, 128]', 'dropout': 0.4150312606159634, 'batch_norm': True, 'graph_on': True, 'source': 'grm', 'knn_k': 6, 'weighted_edges': True, 'symmetrize_mode': 'union', 'lr': 2.3140771072887917e-06, 'weight_decay': 6.865918861342316e-05, 'epochs': 68, 'use_snp_selection': True, 'num_snps': 54000}. Best is trial 55 with value: 0.3480435013771057.
[I 2025-10-17 02:16:35,439] Trial 84 finished with value: 0.318869012594223 and parameters: {'hidden_dims': '[512, 128]', 'dropout': 0.3732530079155502, 'batch_norm': True, 'graph_on': True, 'source': 'grm', 'knn_k': 7, 'weighted_edges': True, 'symmetrize_mode': 'union', 'lr': 4.529316263491863e-06, 'weight_decay': 0.00010354498584083664, 'epochs': 339, 'use_snp_selection': True, 'num_snps': 52000}. Best is trial 55 with value: 0.3480435013771057.
[I 2025-10-17 02:17:11,212] Trial 85 finished with value: 0.31165996193885803 and parameters: {'hidden_dims': '[512, 128]', 'dropout': 0.13484378102876293, 'batch_norm': True, 'graph_on': True, 'source': 'grm', 'knn_k': 4, 'weighted_edges': True, 'symmetrize_mode': 'union', 'lr': 2.910087366749673e-06, 'weight_decay': 0.0004330827475792792, 'epochs': 82, 'use_snp_selection': True, 'num_snps': 42000}. Best is trial 55 with value: 0.3480435013771057.
[I 2025-10-17 02:17:52,291] Trial 86 finished with value: 0.3279793858528137 and parameters: {'hidden_dims': '[512, 128]', 'dropout': 0.4277030202812725, 'batch_norm': True, 'graph_on': True, 'source': 'grm', 'knn_k': 6, 'weighted_edges': True, 'symmetrize_mode': 'union', 'lr': 1.7148302073051284e-05, 'weight_decay': 0.0002137862273144469, 'epochs': 95, 'use_snp_selection': True, 'num_snps': 48000}. Best is trial 55 with value: 0.3480435013771057.
[I 2025-10-17 02:18:52,115] Trial 87 finished with value: 0.3358536422252655 and parameters: {'hidden_dims': '[512, 128]', 'dropout': 0.5158941220918343, 'batch_norm': True, 'graph_on': True, 'source': 'grm', 'knn_k': 7, 'weighted_edges': True, 'symmetrize_mode': 'union', 'lr': 6.638598304299795e-06, 'weight_decay': 0.00036095345651471894, 'epochs': 181, 'use_snp_selection': True, 'num_snps': 50000}. Best is trial 55 with value: 0.3480435013771057.
[I 2025-10-17 02:19:17,487] Trial 88 finished with value: 0.2081696182489395 and parameters: {'hidden_dims': '[256, 128]', 'dropout': 0.4531589981521683, 'batch_norm': False, 'graph_on': True, 'source': 'grm', 'knn_k': 6, 'weighted_edges': False, 'symmetrize_mode': 'union', 'lr': 1.116867202855113e-06, 'weight_decay': 0.0005884232538494323, 'epochs': 46, 'use_snp_selection': True, 'num_snps': 44000}. Best is trial 55 with value: 0.3480435013771057.
[I 2025-10-17 02:20:01,864] Trial 89 finished with value: 0.32617228031158446 and parameters: {'hidden_dims': '[512, 128]', 'dropout': 0.3327834443420022, 'batch_norm': True, 'graph_on': True, 'source': 'grm', 'knn_k': 7, 'weighted_edges': True, 'symmetrize_mode': 'union', 'lr': 1.0663069467147595e-05, 'weight_decay': 0.0002442853544891761, 'epochs': 202, 'use_snp_selection': True, 'num_snps': 28000}. Best is trial 55 with value: 0.3480435013771057.
[I 2025-10-17 02:21:06,634] Trial 90 finished with value: 0.3200390636920929 and parameters: {'hidden_dims': '[512, 128]', 'dropout': 0.3981744949934256, 'batch_norm': True, 'graph_on': True, 'source': 'grm', 'knn_k': 6, 'weighted_edges': True, 'symmetrize_mode': 'mutual', 'lr': 1.4280594654407061e-06, 'weight_decay': 0.00014808978448379903, 'epochs': 310, 'use_snp_selection': True, 'num_snps': 34000}. Best is trial 55 with value: 0.3480435013771057.
[I 2025-10-17 02:22:04,047] Trial 91 finished with value: 0.3331234037876129 and parameters: {'hidden_dims': '[256, 128]', 'dropout': 0.4698152430512292, 'batch_norm': True, 'graph_on': True, 'source': 'grm', 'knn_k': 7, 'weighted_edges': True, 'symmetrize_mode': 'union', 'lr': 1.017770570655029e-06, 'weight_decay': 0.0006892478422370771, 'epochs': 276, 'use_snp_selection': True, 'num_snps': 58000}. Best is trial 55 with value: 0.3480435013771057.
[I 2025-10-17 02:22:59,882] Trial 92 finished with value: 0.35022597312927245 and parameters: {'hidden_dims': '[256, 128]', 'dropout': 0.4902571566501771, 'batch_norm': True, 'graph_on': True, 'source': 'grm', 'knn_k': 7, 'weighted_edges': True, 'symmetrize_mode': 'union', 'lr': 1.8868793869418105e-06, 'weight_decay': 4.2848409730118937e-07, 'epochs': 263, 'use_snp_selection': True, 'num_snps': 58000}. Best is trial 92 with value: 0.35022597312927245.
[I 2025-10-17 02:23:52,969] Trial 93 finished with value: 0.3424909472465515 and parameters: {'hidden_dims': '[256, 128]', 'dropout': 0.4928731714475881, 'batch_norm': True, 'graph_on': True, 'source': 'grm', 'knn_k': 7, 'weighted_edges': True, 'symmetrize_mode': 'union', 'lr': 1.9181467324621386e-06, 'weight_decay': 1.267178989523492e-07, 'epochs': 244, 'use_snp_selection': True, 'num_snps': 56000}. Best is trial 92 with value: 0.35022597312927245.
[I 2025-10-17 02:24:48,386] Trial 94 finished with value: 0.3345951020717621 and parameters: {'hidden_dims': '[256, 128]', 'dropout': 0.505888063565693, 'batch_norm': True, 'graph_on': True, 'source': 'grm', 'knn_k': 7, 'weighted_edges': True, 'symmetrize_mode': 'union', 'lr': 2.5302497991917084e-06, 'weight_decay': 0.00010433699098602357, 'epochs': 284, 'use_snp_selection': True, 'num_snps': 52000}. Best is trial 92 with value: 0.35022597312927245.
[I 2025-10-17 02:25:43,530] Trial 95 finished with value: 0.33689669966697694 and parameters: {'hidden_dims': '[256, 128]', 'dropout': 0.4451738858495332, 'batch_norm': True, 'graph_on': True, 'source': 'grm', 'knn_k': 7, 'weighted_edges': True, 'symmetrize_mode': 'union', 'lr': 3.839887358454305e-06, 'weight_decay': 1.0631969046739446e-06, 'epochs': 260, 'use_snp_selection': True, 'num_snps': 56000}. Best is trial 92 with value: 0.35022597312927245.
[I 2025-10-17 02:26:17,549] Trial 96 finished with value: 0.3278206169605255 and parameters: {'hidden_dims': '[256, 128, 64]', 'dropout': 0.5526418015779724, 'batch_norm': True, 'graph_on': True, 'source': 'grm', 'knn_k': 7, 'weighted_edges': True, 'symmetrize_mode': 'union', 'lr': 3.2236603470757353e-06, 'weight_decay': 2.1349611951480997e-06, 'epochs': 98, 'use_snp_selection': True, 'num_snps': 54000}. Best is trial 92 with value: 0.35022597312927245.
[I 2025-10-17 02:27:45,280] Trial 97 finished with value: 0.3400204598903656 and parameters: {'hidden_dims': '[512, 256]', 'dropout': 0.4851833004987691, 'batch_norm': True, 'graph_on': True, 'source': 'grm', 'knn_k': 6, 'weighted_edges': True, 'symmetrize_mode': 'union', 'lr': 2.0575559567633655e-06, 'weight_decay': 6.497262949727552e-07, 'epochs': 268, 'use_snp_selection': True, 'num_snps': 58000}. Best is trial 92 with value: 0.35022597312927245.
[I 2025-10-17 02:28:10,028] Trial 98 finished with value: 0.30630221366882326 and parameters: {'hidden_dims': '[128, 64]', 'dropout': 0.5216892143657559, 'batch_norm': True, 'graph_on': True, 'source': 'grm', 'knn_k': 7, 'weighted_edges': True, 'symmetrize_mode': 'union', 'lr': 1.5385359008712947e-06, 'weight_decay': 2.7919664271200595e-07, 'epochs': 61, 'use_snp_selection': True, 'num_snps': 48000}. Best is trial 92 with value: 0.35022597312927245.
[I 2025-10-17 02:28:50,330] Trial 99 finished with value: 0.34387636184692383 and parameters: {'hidden_dims': '[512, 64]', 'dropout': 0.5375343683427419, 'batch_norm': True, 'graph_on': True, 'source': 'grm', 'knn_k': 6, 'weighted_edges': True, 'symmetrize_mode': 'union', 'lr': 2.2668393928791497e-06, 'weight_decay': 6.01440896158954e-07, 'epochs': 219, 'use_snp_selection': True, 'num_snps': 22000}. Best is trial 92 with value: 0.35022597312927245.
[I 2025-10-17 02:29:30,791] Trial 100 finished with value: 0.3470330357551575 and parameters: {'hidden_dims': '[512, 64]', 'dropout': 0.587735166528512, 'batch_norm': True, 'graph_on': True, 'source': 'grm', 'knn_k': 6, 'weighted_edges': True, 'symmetrize_mode': 'union', 'lr': 1.2614121838547398e-06, 'weight_decay': 4.5113557180609995e-07, 'epochs': 221, 'use_snp_selection': True, 'num_snps': 22000}. Best is trial 92 with value: 0.35022597312927245.
[I 2025-10-17 02:30:11,611] Trial 101 finished with value: 0.32974883913993835 and parameters: {'hidden_dims': '[512, 64]', 'dropout': 0.5898690831360669, 'batch_norm': True, 'graph_on': True, 'source': 'grm', 'knn_k': 6, 'weighted_edges': True, 'symmetrize_mode': 'union', 'lr': 1.2001436310440878e-06, 'weight_decay': 6.115409355207729e-07, 'epochs': 224, 'use_snp_selection': True, 'num_snps': 22000}. Best is trial 92 with value: 0.35022597312927245.
