[I 2025-10-16 19:39:22,871] Trial 78 finished with value: 0.33954550623893737 and parameters: {'hidden_dims': '[256, 128]', 'dropout': 0.3395356394996636, 'batch_norm': False, 'graph_on': True, 'source': 'grm', 'knn_k': 6, 'weighted_edges': True, 'symmetrize_mode': 'mutual', 'lr': 1.4926920547015962e-05, 'weight_decay': 2.7788904989343445e-06, 'epochs': 190, 'use_snp_selection': True, 'num_snps': 56000}. Best is trial 53 with value: 0.3412400782108307.
[I 2025-10-16 19:39:53,349] Trial 79 finished with value: 0.3272374927997589 and parameters: {'hidden_dims': '[256, 128, 64]', 'dropout': 0.30134842961667624, 'batch_norm': False, 'graph_on': True, 'source': 'grm', 'knn_k': 6, 'weighted_edges': True, 'symmetrize_mode': 'mutual', 'lr': 1.6593291449655166e-05, 'weight_decay': 4.0901110899108974e-06, 'epochs': 154, 'use_snp_selection': True, 'num_snps': 30000}. Best is trial 53 with value: 0.3412400782108307.
[I 2025-10-16 19:40:40,408] Trial 80 finished with value: 0.24982829093933107 and parameters: {'hidden_dims': '[256, 128]', 'dropout': 0.2762263124249285, 'batch_norm': True, 'graph_on': True, 'source': 'grm', 'knn_k': 6, 'weighted_edges': False, 'symmetrize_mode': 'mutual', 'lr': 1.5583120731494592e-05, 'weight_decay': 1.5471487045385127e-05, 'epochs': 197, 'use_snp_selection': True, 'num_snps': 58000}. Best is trial 53 with value: 0.3412400782108307.
[I 2025-10-16 19:41:23,279] Trial 81 finished with value: 0.33257717490196226 and parameters: {'hidden_dims': '[256, 128]', 'dropout': 0.3364261201678157, 'batch_norm': False, 'graph_on': True, 'source': 'grm', 'knn_k': 6, 'weighted_edges': True, 'symmetrize_mode': 'mutual', 'lr': 1.927341510465636e-05, 'weight_decay': 4.66768589291238e-06, 'epochs': 171, 'use_snp_selection': True, 'num_snps': 56000}. Best is trial 53 with value: 0.3412400782108307.
[I 2025-10-16 19:42:04,933] Trial 82 finished with value: 0.33995537757873534 and parameters: {'hidden_dims': '[256, 128]', 'dropout': 0.3513110429849732, 'batch_norm': False, 'graph_on': True, 'source': 'grm', 'knn_k': 7, 'weighted_edges': True, 'symmetrize_mode': 'mutual', 'lr': 7.657089297987761e-06, 'weight_decay': 3.0643026148238056e-06, 'epochs': 183, 'use_snp_selection': True, 'num_snps': 50000}. Best is trial 53 with value: 0.3412400782108307.
[I 2025-10-16 19:42:43,026] Trial 83 finished with value: 0.3386907041072845 and parameters: {'hidden_dims': '[256, 128]', 'dropout': 0.3708340782616, 'batch_norm': False, 'graph_on': True, 'source': 'grm', 'knn_k': 6, 'weighted_edges': True, 'symmetrize_mode': 'mutual', 'lr': 1.1753618537788743e-05, 'weight_decay': 2.700380871551099e-06, 'epochs': 152, 'use_snp_selection': True, 'num_snps': 50000}. Best is trial 53 with value: 0.3412400782108307.
[I 2025-10-16 19:43:19,923] Trial 84 finished with value: 0.33948421478271484 and parameters: {'hidden_dims': '[256, 128]', 'dropout': 0.3505844067682453, 'batch_norm': False, 'graph_on': True, 'source': 'grm', 'knn_k': 6, 'weighted_edges': True, 'symmetrize_mode': 'mutual', 'lr': 6.7761106668761545e-06, 'weight_decay': 2.627109389131409e-06, 'epochs': 132, 'use_snp_selection': True, 'num_snps': 52000}. Best is trial 53 with value: 0.3412400782108307.
[I 2025-10-16 19:44:10,402] Trial 85 finished with value: 0.34029660820961 and parameters: {'hidden_dims': '[512, 128]', 'dropout': 0.35494803944564607, 'batch_norm': False, 'graph_on': True, 'source': 'grm', 'knn_k': 6, 'weighted_edges': True, 'symmetrize_mode': 'mutual', 'lr': 5.138866465407289e-06, 'weight_decay': 9.072872003856215e-06, 'epochs': 132, 'use_snp_selection': True, 'num_snps': 52000}. Best is trial 53 with value: 0.3412400782108307.
[I 2025-10-16 19:45:01,422] Trial 86 finished with value: 0.332368803024292 and parameters: {'hidden_dims': '[512, 128]', 'dropout': 0.31326009335455957, 'batch_norm': False, 'graph_on': True, 'source': 'grm', 'knn_k': 6, 'weighted_edges': True, 'symmetrize_mode': 'union', 'lr': 2.756476014007798e-06, 'weight_decay': 7.751815208414127e-06, 'epochs': 129, 'use_snp_selection': True, 'num_snps': 54000}. Best is trial 53 with value: 0.3412400782108307.
[I 2025-10-16 19:45:55,754] Trial 87 finished with value: 0.3393247127532959 and parameters: {'hidden_dims': '[512, 128]', 'dropout': 0.3642707920584834, 'batch_norm': False, 'graph_on': True, 'source': 'grm', 'knn_k': 6, 'weighted_edges': True, 'symmetrize_mode': 'mutual', 'lr': 4.4969163603368135e-06, 'weight_decay': 9.116137214804911e-06, 'epochs': 133, 'use_snp_selection': True, 'num_snps': 58000}. Best is trial 53 with value: 0.3412400782108307.
[I 2025-10-16 19:46:42,036] Trial 88 finished with value: 0.34016175866127013 and parameters: {'hidden_dims': '[512, 128]', 'dropout': 0.3881355425190619, 'batch_norm': False, 'graph_on': True, 'source': 'grm', 'knn_k': 6, 'weighted_edges': True, 'symmetrize_mode': 'mutual', 'lr': 6.9349554620127446e-06, 'weight_decay': 1.5075497681321968e-05, 'epochs': 112, 'use_snp_selection': True, 'num_snps': 52000}. Best is trial 53 with value: 0.3412400782108307.
[I 2025-10-16 19:47:26,535] Trial 89 finished with value: 0.34023135900497437 and parameters: {'hidden_dims': '[512, 128]', 'dropout': 0.3854678373190579, 'batch_norm': False, 'graph_on': True, 'source': 'grm', 'knn_k': 6, 'weighted_edges': True, 'symmetrize_mode': 'mutual', 'lr': 4.5193964241458345e-06, 'weight_decay': 1.4845690860264695e-05, 'epochs': 114, 'use_snp_selection': True, 'num_snps': 48000}. Best is trial 53 with value: 0.3412400782108307.
[I 2025-10-16 19:48:06,612] Trial 90 finished with value: 0.31668795347213746 and parameters: {'hidden_dims': '[512, 128]', 'dropout': 0.4178797672683212, 'batch_norm': False, 'graph_on': True, 'source': 'grm', 'knn_k': 7, 'weighted_edges': True, 'symmetrize_mode': 'mutual', 'lr': 1.7795463392045643e-06, 'weight_decay': 3.211659499733253e-05, 'epochs': 89, 'use_snp_selection': True, 'num_snps': 50000}. Best is trial 53 with value: 0.3412400782108307.
[I 2025-10-16 19:48:52,735] Trial 91 finished with value: 0.34324071407318113 and parameters: {'hidden_dims': '[512, 128]', 'dropout': 0.3861675487877473, 'batch_norm': False, 'graph_on': True, 'source': 'grm', 'knn_k': 6, 'weighted_edges': True, 'symmetrize_mode': 'mutual', 'lr': 4.322428773499124e-06, 'weight_decay': 1.4987116270669305e-05, 'epochs': 123, 'use_snp_selection': True, 'num_snps': 48000}. Best is trial 91 with value: 0.34324071407318113.
[I 2025-10-16 19:49:39,065] Trial 92 finished with value: 0.3413641095161438 and parameters: {'hidden_dims': '[512, 128]', 'dropout': 0.3802433096682596, 'batch_norm': False, 'graph_on': True, 'source': 'grm', 'knn_k': 6, 'weighted_edges': True, 'symmetrize_mode': 'mutual', 'lr': 4.766521234440917e-06, 'weight_decay': 1.8608902762484866e-05, 'epochs': 112, 'use_snp_selection': True, 'num_snps': 52000}. Best is trial 91 with value: 0.34324071407318113.
[I 2025-10-16 19:50:23,500] Trial 93 finished with value: 0.3395411014556885 and parameters: {'hidden_dims': '[512, 128]', 'dropout': 0.38467544838728235, 'batch_norm': False, 'graph_on': True, 'source': 'grm', 'knn_k': 6, 'weighted_edges': True, 'symmetrize_mode': 'mutual', 'lr': 4.9108879760935746e-06, 'weight_decay': 1.7205805424032063e-05, 'epochs': 115, 'use_snp_selection': True, 'num_snps': 48000}. Best is trial 91 with value: 0.34324071407318113.
[I 2025-10-16 19:51:12,110] Trial 94 finished with value: 0.3406784772872925 and parameters: {'hidden_dims': '[512, 128]', 'dropout': 0.3859569965194284, 'batch_norm': False, 'graph_on': True, 'source': 'grm', 'knn_k': 6, 'weighted_edges': True, 'symmetrize_mode': 'mutual', 'lr': 3.7595181523415202e-06, 'weight_decay': 1.0519690287339144e-05, 'epochs': 123, 'use_snp_selection': True, 'num_snps': 52000}. Best is trial 91 with value: 0.34324071407318113.
[I 2025-10-16 19:51:56,492] Trial 95 finished with value: 0.3378304660320282 and parameters: {'hidden_dims': '[512, 128]', 'dropout': 0.38957510886072233, 'batch_norm': False, 'graph_on': True, 'source': 'grm', 'knn_k': 5, 'weighted_edges': True, 'symmetrize_mode': 'mutual', 'lr': 3.3406182857224124e-06, 'weight_decay': 1.7835318594470868e-05, 'epochs': 110, 'use_snp_selection': True, 'num_snps': 50000}. Best is trial 91 with value: 0.34324071407318113.
[I 2025-10-16 19:52:45,129] Trial 96 finished with value: 0.33870754241943357 and parameters: {'hidden_dims': '[512, 128]', 'dropout': 0.4128945529092222, 'batch_norm': False, 'graph_on': True, 'source': 'grm', 'knn_k': 6, 'weighted_edges': True, 'symmetrize_mode': 'mutual', 'lr': 5.191119598149214e-06, 'weight_decay': 1.1712105895371111e-05, 'epochs': 123, 'use_snp_selection': True, 'num_snps': 52000}. Best is trial 91 with value: 0.34324071407318113.
[I 2025-10-16 19:53:25,804] Trial 97 finished with value: 0.3403814911842346 and parameters: {'hidden_dims': '[512, 128]', 'dropout': 0.43382438591383576, 'batch_norm': False, 'graph_on': True, 'source': 'grm', 'knn_k': 6, 'weighted_edges': True, 'symmetrize_mode': 'mutual', 'lr': 4.146157564259154e-06, 'weight_decay': 4.337256191278505e-05, 'epochs': 100, 'use_snp_selection': True, 'num_snps': 46000}. Best is trial 91 with value: 0.34324071407318113.
[I 2025-10-16 19:54:06,596] Trial 98 finished with value: 0.3364774167537689 and parameters: {'hidden_dims': '[512, 128]', 'dropout': 0.43287371156288373, 'batch_norm': False, 'graph_on': True, 'source': 'grm', 'knn_k': 6, 'weighted_edges': True, 'symmetrize_mode': 'mutual', 'lr': 3.877903737085302e-06, 'weight_decay': 5.451120215480193e-05, 'epochs': 96, 'use_snp_selection': True, 'num_snps': 48000}. Best is trial 91 with value: 0.34324071407318113.
[I 2025-10-16 19:54:47,897] Trial 99 finished with value: 0.28531600534915924 and parameters: {'hidden_dims': '[512, 128]', 'dropout': 0.43942032954583365, 'batch_norm': True, 'graph_on': True, 'source': 'grm', 'knn_k': 6, 'weighted_edges': False, 'symmetrize_mode': 'mutual', 'lr': 4.234390968588717e-06, 'weight_decay': 3.6243962780502694e-05, 'epochs': 86, 'use_snp_selection': True, 'num_snps': 54000}. Best is trial 91 with value: 0.34324071407318113.
[I 2025-10-16 19:55:34,206] Trial 100 finished with value: 0.3276679813861847 and parameters: {'hidden_dims': '[512, 128]', 'dropout': 0.4655931220402432, 'batch_norm': False, 'graph_on': True, 'source': 'grm', 'knn_k': 6, 'weighted_edges': True, 'symmetrize_mode': 'union', 'lr': 2.681650720039527e-06, 'weight_decay': 2.5794589212149554e-05, 'epochs': 111, 'use_snp_selection': True, 'num_snps': 52000}. Best is trial 91 with value: 0.34324071407318113.
[I 2025-10-16 19:56:19,560] Trial 101 finished with value: 0.3409000217914581 and parameters: {'hidden_dims': '[512, 128]', 'dropout': 0.37903794561460524, 'batch_norm': False, 'graph_on': True, 'source': 'grm', 'knn_k': 6, 'weighted_edges': True, 'symmetrize_mode': 'mutual', 'lr': 3.160895935837246e-06, 'weight_decay': 2.0866009159614365e-05, 'epochs': 124, 'use_snp_selection': True, 'num_snps': 46000}. Best is trial 91 with value: 0.34324071407318113.
[I 2025-10-16 19:57:04,284] Trial 102 finished with value: 0.325477260351181 and parameters: {'hidden_dims': '[512, 128]', 'dropout': 0.3817809288635187, 'batch_norm': False, 'graph_on': True, 'source': 'grm', 'knn_k': 6, 'weighted_edges': True, 'symmetrize_mode': 'mutual', 'lr': 1.5742242614707683e-06, 'weight_decay': 2.0186631433884386e-05, 'epochs': 121, 'use_snp_selection': True, 'num_snps': 46000}. Best is trial 91 with value: 0.34324071407318113.
[I 2025-10-16 19:57:46,584] Trial 103 finished with value: 0.3398665010929108 and parameters: {'hidden_dims': '[512, 128]', 'dropout': 0.36720122492904994, 'batch_norm': False, 'graph_on': True, 'source': 'grm', 'knn_k': 6, 'weighted_edges': True, 'symmetrize_mode': 'mutual', 'lr': 3.0106929187772423e-06, 'weight_decay': 1.3168784439205727e-05, 'epochs': 103, 'use_snp_selection': True, 'num_snps': 48000}. Best is trial 91 with value: 0.34324071407318113.
[I 2025-10-16 19:58:31,869] Trial 104 finished with value: 0.3417066276073456 and parameters: {'hidden_dims': '[512, 128]', 'dropout': 0.40018373513666977, 'batch_norm': False, 'graph_on': True, 'source': 'grm', 'knn_k': 6, 'weighted_edges': True, 'symmetrize_mode': 'mutual', 'lr': 3.684144496595091e-06, 'weight_decay': 2.8814392573680326e-05, 'epochs': 124, 'use_snp_selection': True, 'num_snps': 46000}. Best is trial 91 with value: 0.34324071407318113.
[I 2025-10-16 19:59:17,349] Trial 105 finished with value: 0.3326991438865662 and parameters: {'hidden_dims': '[512, 128]', 'dropout': 0.4083595145985218, 'batch_norm': False, 'graph_on': True, 'source': 'grm', 'knn_k': 6, 'weighted_edges': True, 'symmetrize_mode': 'mutual', 'lr': 2.159175871045585e-06, 'weight_decay': 2.859195667473548e-05, 'epochs': 125, 'use_snp_selection': True, 'num_snps': 46000}. Best is trial 91 with value: 0.34324071407318113.
[I 2025-10-16 20:00:02,431] Trial 106 finished with value: 0.33384225964546205 and parameters: {'hidden_dims': '[512, 128]', 'dropout': 0.4520251987281616, 'batch_norm': False, 'graph_on': True, 'source': 'grm', 'knn_k': 5, 'weighted_edges': True, 'symmetrize_mode': 'mutual', 'lr': 3.664290727016627e-06, 'weight_decay': 4.9568036387240426e-05, 'epochs': 98, 'use_snp_selection': True, 'num_snps': 56000}. Best is trial 91 with value: 0.34324071407318113.
[I 2025-10-16 20:00:42,001] Trial 107 finished with value: 0.3192136764526367 and parameters: {'hidden_dims': '[512, 128]', 'dropout': 0.3959353531891743, 'batch_norm': False, 'graph_on': True, 'source': 'grm', 'knn_k': 6, 'weighted_edges': True, 'symmetrize_mode': 'mutual', 'lr': 2.4458288171118183e-06, 'weight_decay': 4.033668255452222e-05, 'epochs': 81, 'use_snp_selection': True, 'num_snps': 52000}. Best is trial 91 with value: 0.34324071407318113.
[I 2025-10-16 20:01:15,176] Trial 108 finished with value: 0.32572298049926757 and parameters: {'hidden_dims': '[512, 128]', 'dropout': 0.4257693989126254, 'batch_norm': False, 'graph_on': True, 'source': 'grm', 'knn_k': 6, 'weighted_edges': True, 'symmetrize_mode': 'mutual', 'lr': 5.6312270396281595e-06, 'weight_decay': 9.595128715782477e-06, 'epochs': 58, 'use_snp_selection': True, 'num_snps': 48000}. Best is trial 91 with value: 0.34324071407318113.
[I 2025-10-16 20:01:58,324] Trial 109 finished with value: 0.3411868214607239 and parameters: {'hidden_dims': '[512, 128]', 'dropout': 0.3770801529303355, 'batch_norm': False, 'graph_on': True, 'source': 'grm', 'knn_k': 6, 'weighted_edges': True, 'symmetrize_mode': 'mutual', 'lr': 4.041787487778981e-06, 'weight_decay': 1.387522089426732e-05, 'epochs': 111, 'use_snp_selection': True, 'num_snps': 46000}. Best is trial 91 with value: 0.34324071407318113.
[I 2025-10-16 20:02:41,267] Trial 110 finished with value: 0.33931989073753355 and parameters: {'hidden_dims': '[512, 128]', 'dropout': 0.3609306835924091, 'batch_norm': False, 'graph_on': True, 'source': 'grm', 'knn_k': 5, 'weighted_edges': True, 'symmetrize_mode': 'mutual', 'lr': 3.0662379525476585e-06, 'weight_decay': 2.094473010320481e-05, 'epochs': 112, 'use_snp_selection': True, 'num_snps': 46000}. Best is trial 91 with value: 0.34324071407318113.
[I 2025-10-16 20:03:21,670] Trial 111 finished with value: 0.34136955738067626 and parameters: {'hidden_dims': '[512, 128]', 'dropout': 0.38047700412922913, 'batch_norm': False, 'graph_on': True, 'source': 'grm', 'knn_k': 6, 'weighted_edges': True, 'symmetrize_mode': 'mutual', 'lr': 4.221977285105514e-06, 'weight_decay': 1.4448442817285227e-05, 'epochs': 91, 'use_snp_selection': True, 'num_snps': 50000}. Best is trial 91 with value: 0.34324071407318113.
[I 2025-10-16 20:04:01,905] Trial 112 finished with value: 0.3376293361186981 and parameters: {'hidden_dims': '[512, 128]', 'dropout': 0.3759711481734299, 'batch_norm': False, 'graph_on': True, 'source': 'grm', 'knn_k': 6, 'weighted_edges': True, 'symmetrize_mode': 'mutual', 'lr': 4.085634501159106e-06, 'weight_decay': 1.439061837655053e-05, 'epochs': 90, 'use_snp_selection': True, 'num_snps': 50000}. Best is trial 91 with value: 0.34324071407318113.
[I 2025-10-16 20:04:37,758] Trial 113 finished with value: 0.3305670976638794 and parameters: {'hidden_dims': '[512, 128]', 'dropout': 0.39387605203552944, 'batch_norm': False, 'graph_on': True, 'source': 'grm', 'knn_k': 6, 'weighted_edges': True, 'symmetrize_mode': 'mutual', 'lr': 5.471335329923183e-06, 'weight_decay': 7.066083031675605e-06, 'epochs': 75, 'use_snp_selection': True, 'num_snps': 46000}. Best is trial 91 with value: 0.34324071407318113.
[I 2025-10-16 20:05:23,611] Trial 114 finished with value: 0.341316157579422 and parameters: {'hidden_dims': '[512, 128]', 'dropout': 0.3821344779009542, 'batch_norm': False, 'graph_on': True, 'source': 'grm', 'knn_k': 6, 'weighted_edges': True, 'symmetrize_mode': 'mutual', 'lr': 6.544630713904752e-06, 'weight_decay': 3.0470934096578066e-05, 'epochs': 107, 'use_snp_selection': True, 'num_snps': 54000}. Best is trial 91 with value: 0.34324071407318113.
[I 2025-10-16 20:06:16,412] Trial 115 finished with value: 0.3393899440765381 and parameters: {'hidden_dims': '[512, 128]', 'dropout': 0.32724340130354596, 'batch_norm': False, 'graph_on': True, 'source': 'grm', 'knn_k': 6, 'weighted_edges': True, 'symmetrize_mode': 'mutual', 'lr': 3.4417424052605033e-06, 'weight_decay': 3.0384877182649856e-05, 'epochs': 138, 'use_snp_selection': True, 'num_snps': 54000}. Best is trial 91 with value: 0.34324071407318113.
[I 2025-10-16 20:07:01,969] Trial 116 finished with value: 0.3145925283432007 and parameters: {'hidden_dims': '[512, 128]', 'dropout': 0.4058797507778041, 'batch_norm': False, 'graph_on': True, 'source': 'grm', 'knn_k': 6, 'weighted_edges': True, 'symmetrize_mode': 'mutual', 'lr': 1.3277145984793057e-06, 'weight_decay': 2.466466856321396e-05, 'epochs': 120, 'use_snp_selection': True, 'num_snps': 48000}. Best is trial 91 with value: 0.34324071407318113.
[I 2025-10-16 20:07:43,322] Trial 117 finished with value: 0.3407715499401093 and parameters: {'hidden_dims': '[512, 128]', 'dropout': 0.35710315542368926, 'batch_norm': False, 'graph_on': True, 'source': 'grm', 'knn_k': 6, 'weighted_edges': True, 'symmetrize_mode': 'mutual', 'lr': 4.582539758128392e-06, 'weight_decay': 1.8764508729705855e-05, 'epochs': 95, 'use_snp_selection': True, 'num_snps': 50000}. Best is trial 91 with value: 0.34324071407318113.
[I 2025-10-16 20:08:26,604] Trial 118 finished with value: 0.34084577560424806 and parameters: {'hidden_dims': '[512, 128]', 'dropout': 0.3557319871263289, 'batch_norm': False, 'graph_on': True, 'source': 'grm', 'knn_k': 6, 'weighted_edges': True, 'symmetrize_mode': 'mutual', 'lr': 6.108908765292035e-06, 'weight_decay': 1.9095941624607415e-05, 'epochs': 95, 'use_snp_selection': True, 'num_snps': 54000}. Best is trial 91 with value: 0.34324071407318113.
[I 2025-10-16 20:09:11,977] Trial 119 finished with value: 0.21880636215209961 and parameters: {'hidden_dims': '[512, 128]', 'dropout': 0.34282305327936746, 'batch_norm': True, 'graph_on': True, 'source': 'grm', 'knn_k': 3, 'weighted_edges': False, 'symmetrize_mode': 'mutual', 'lr': 5.98421178538701e-06, 'weight_decay': 2.0193926380705627e-05, 'epochs': 95, 'use_snp_selection': True, 'num_snps': 58000}. Best is trial 91 with value: 0.34324071407318113.
[I 2025-10-16 20:09:57,418] Trial 120 finished with value: 0.3289198219776154 and parameters: {'hidden_dims': '[512, 128]', 'dropout': 0.4516812560338986, 'batch_norm': False, 'graph_on': True, 'source': 'grm', 'knn_k': 5, 'weighted_edges': True, 'symmetrize_mode': 'mutual', 'lr': 2.3419270540936137e-06, 'weight_decay': 1.1181397852760304e-05, 'epochs': 105, 'use_snp_selection': True, 'num_snps': 54000}. Best is trial 91 with value: 0.34324071407318113.
[I 2025-10-16 20:11:40,408] Trial 121 finished with value: 0.3233236312866211 and parameters: {'hidden_dims': '[512, 128]', 'dropout': 0.35417510301195, 'batch_norm': False, 'graph_on': True, 'source': 'grm', 'knn_k': 6, 'weighted_edges': True, 'symmetrize_mode': 'mutual', 'lr': 8.805872648096895e-06, 'weight_decay': 4.2007287353332216e-05, 'epochs': 349, 'use_snp_selection': True, 'num_snps': 56000}. Best is trial 91 with value: 0.34324071407318113.
[I 2025-10-16 20:12:21,584] Trial 122 finished with value: 0.33618471026420593 and parameters: {'hidden_dims': '[512, 128]', 'dropout': 0.3620635870320247, 'batch_norm': False, 'graph_on': True, 'source': 'grm', 'knn_k': 6, 'weighted_edges': True, 'symmetrize_mode': 'mutual', 'lr': 3.5601473390988e-06, 'weight_decay': 1.798229880384424e-05, 'epochs': 85, 'use_snp_selection': True, 'num_snps': 54000}. Best is trial 91 with value: 0.34324071407318113.
[I 2025-10-16 20:13:03,995] Trial 123 finished with value: 0.3427607834339142 and parameters: {'hidden_dims': '[512, 128]', 'dropout': 0.37679003957513946, 'batch_norm': False, 'graph_on': True, 'source': 'grm', 'knn_k': 6, 'weighted_edges': True, 'symmetrize_mode': 'mutual', 'lr': 3.995666571151394e-06, 'weight_decay': 9.98285700829923e-05, 'epochs': 100, 'use_snp_selection': True, 'num_snps': 50000}. Best is trial 91 with value: 0.34324071407318113.
[I 2025-10-16 20:13:41,035] Trial 124 finished with value: 0.32679916024208067 and parameters: {'hidden_dims': '[512, 128]', 'dropout': 0.37430189019879456, 'batch_norm': False, 'graph_on': True, 'source': 'grm', 'knn_k': 6, 'weighted_edges': True, 'symmetrize_mode': 'mutual', 'lr': 2.8339299027975124e-06, 'weight_decay': 6.213634285411645e-05, 'epochs': 74, 'use_snp_selection': True, 'num_snps': 50000}. Best is trial 91 with value: 0.34324071407318113.
[I 2025-10-16 20:14:23,407] Trial 125 finished with value: 0.34177128672599794 and parameters: {'hidden_dims': '[512, 128]', 'dropout': 0.3966175275864873, 'batch_norm': False, 'graph_on': True, 'source': 'grm', 'knn_k': 6, 'weighted_edges': True, 'symmetrize_mode': 'mutual', 'lr': 4.080894765823584e-06, 'weight_decay': 0.00020464983749224314, 'epochs': 100, 'use_snp_selection': True, 'num_snps': 50000}. Best is trial 91 with value: 0.34324071407318113.
