[I 2025-10-16 18:47:51,346] Trial 132 finished with value: 0.33295021653175355 and parameters: {'hidden_dims': '[256, 128]', 'dropout': 0.1462210393175038, 'batch_norm': True, 'graph_on': True, 'source': 'grm', 'knn_k': 7, 'weighted_edges': True, 'symmetrize_mode': 'union', 'lr': 3.090543204146355e-06, 'weight_decay': 0.00011177937275458706, 'epochs': 137, 'use_snp_selection': True, 'num_snps': 36000}. Best is trial 98 with value: 0.3420106410980225.
[I 2025-10-16 18:48:23,471] Trial 133 finished with value: 0.3322581112384796 and parameters: {'hidden_dims': '[256, 128]', 'dropout': 0.15116627947496586, 'batch_norm': True, 'graph_on': True, 'source': 'grm', 'knn_k': 7, 'weighted_edges': True, 'symmetrize_mode': 'union', 'lr': 3.5146452773406936e-06, 'weight_decay': 0.0002967405464103949, 'epochs': 165, 'use_snp_selection': True, 'num_snps': 32000}. Best is trial 98 with value: 0.3420106410980225.
[I 2025-10-16 18:48:55,209] Trial 134 finished with value: 0.32956643104553224 and parameters: {'hidden_dims': '[256, 128]', 'dropout': 0.16946886963175015, 'batch_norm': True, 'graph_on': True, 'source': 'grm', 'knn_k': 7, 'weighted_edges': True, 'symmetrize_mode': 'union', 'lr': 2.524577415867554e-06, 'weight_decay': 7.86213086849828e-05, 'epochs': 153, 'use_snp_selection': True, 'num_snps': 34000}. Best is trial 98 with value: 0.3420106410980225.
[I 2025-10-16 18:49:23,930] Trial 135 finished with value: 0.3403951823711395 and parameters: {'hidden_dims': '[256, 128]', 'dropout': 0.13730968865760446, 'batch_norm': True, 'graph_on': True, 'source': 'grm', 'knn_k': 7, 'weighted_edges': True, 'symmetrize_mode': 'union', 'lr': 2.0934137689214894e-06, 'weight_decay': 0.00012258877930834282, 'epochs': 133, 'use_snp_selection': True, 'num_snps': 30000}. Best is trial 98 with value: 0.3420106410980225.
[I 2025-10-16 18:49:52,628] Trial 136 finished with value: 0.3310395061969757 and parameters: {'hidden_dims': '[256, 128]', 'dropout': 0.17979668375059216, 'batch_norm': True, 'graph_on': True, 'source': 'grm', 'knn_k': 7, 'weighted_edges': True, 'symmetrize_mode': 'union', 'lr': 3.202382267398387e-06, 'weight_decay': 0.00018083936115184483, 'epochs': 133, 'use_snp_selection': True, 'num_snps': 30000}. Best is trial 98 with value: 0.3420106410980225.
[I 2025-10-16 18:50:22,831] Trial 137 finished with value: 0.33847185373306277 and parameters: {'hidden_dims': '[256, 128]', 'dropout': 0.15806633520300317, 'batch_norm': True, 'graph_on': True, 'source': 'grm', 'knn_k': 7, 'weighted_edges': True, 'symmetrize_mode': 'union', 'lr': 2.2308438140410923e-06, 'weight_decay': 0.00012637961051577002, 'epochs': 140, 'use_snp_selection': True, 'num_snps': 32000}. Best is trial 98 with value: 0.3420106410980225.
[I 2025-10-16 18:50:53,251] Trial 138 finished with value: 0.3272159993648529 and parameters: {'hidden_dims': '[256, 128]', 'dropout': 0.37683550850052744, 'batch_norm': True, 'graph_on': True, 'source': 'grm', 'knn_k': 7, 'weighted_edges': True, 'symmetrize_mode': 'mutual', 'lr': 2.025744387199895e-06, 'weight_decay': 0.00013520415598425236, 'epochs': 145, 'use_snp_selection': True, 'num_snps': 32000}. Best is trial 98 with value: 0.3420106410980225.
[I 2025-10-16 18:51:23,802] Trial 139 finished with value: 0.33739221692085264 and parameters: {'hidden_dims': '[256, 128]', 'dropout': 0.16114310002254265, 'batch_norm': True, 'graph_on': True, 'source': 'grm', 'knn_k': 7, 'weighted_edges': True, 'symmetrize_mode': 'union', 'lr': 2.226804098281288e-06, 'weight_decay': 5.211051387053001e-05, 'epochs': 159, 'use_snp_selection': True, 'num_snps': 30000}. Best is trial 98 with value: 0.3420106410980225.
[I 2025-10-16 18:51:55,579] Trial 140 finished with value: 0.33194727301597593 and parameters: {'hidden_dims': '[256, 128]', 'dropout': 0.1614949432477501, 'batch_norm': True, 'graph_on': True, 'source': 'grm', 'knn_k': 7, 'weighted_edges': True, 'symmetrize_mode': 'union', 'lr': 2.148487452890839e-06, 'weight_decay': 4.161797243630034e-05, 'epochs': 177, 'use_snp_selection': True, 'num_snps': 30000}. Best is trial 98 with value: 0.3420106410980225.
[I 2025-10-16 18:52:26,927] Trial 141 finished with value: 0.3328781008720398 and parameters: {'hidden_dims': '[256, 128]', 'dropout': 0.4102836091841916, 'batch_norm': True, 'graph_on': True, 'source': 'grm', 'knn_k': 7, 'weighted_edges': True, 'symmetrize_mode': 'union', 'lr': 2.5847214131318852e-06, 'weight_decay': 5.6975564530741756e-05, 'epochs': 156, 'use_snp_selection': True, 'num_snps': 32000}. Best is trial 98 with value: 0.3420106410980225.
[I 2025-10-16 18:52:57,690] Trial 142 finished with value: 0.33026336431503295 and parameters: {'hidden_dims': '[256, 128]', 'dropout': 0.1413471355233365, 'batch_norm': True, 'graph_on': True, 'source': 'grm', 'knn_k': 7, 'weighted_edges': True, 'symmetrize_mode': 'union', 'lr': 1.7579704382668023e-06, 'weight_decay': 7.948522689386405e-05, 'epochs': 162, 'use_snp_selection': True, 'num_snps': 30000}. Best is trial 98 with value: 0.3420106410980225.
[I 2025-10-16 18:53:26,429] Trial 143 finished with value: 0.3409408092498779 and parameters: {'hidden_dims': '[256, 128]', 'dropout': 0.11609391837887373, 'batch_norm': True, 'graph_on': True, 'source': 'grm', 'knn_k': 7, 'weighted_edges': True, 'symmetrize_mode': 'union', 'lr': 2.2610335209275105e-06, 'weight_decay': 2.462270258461611e-05, 'epochs': 141, 'use_snp_selection': True, 'num_snps': 28000}. Best is trial 98 with value: 0.3420106410980225.
[I 2025-10-16 18:53:54,000] Trial 144 finished with value: 0.3373709261417389 and parameters: {'hidden_dims': '[256, 128]', 'dropout': 0.11717346980078731, 'batch_norm': True, 'graph_on': True, 'source': 'grm', 'knn_k': 7, 'weighted_edges': True, 'symmetrize_mode': 'union', 'lr': 2.3112417686192204e-06, 'weight_decay': 2.809860161089198e-05, 'epochs': 124, 'use_snp_selection': True, 'num_snps': 28000}. Best is trial 98 with value: 0.3420106410980225.
[I 2025-10-16 18:54:20,768] Trial 145 finished with value: 0.3356360554695129 and parameters: {'hidden_dims': '[256, 128]', 'dropout': 0.12082228282315931, 'batch_norm': True, 'graph_on': True, 'source': 'grm', 'knn_k': 7, 'weighted_edges': True, 'symmetrize_mode': 'union', 'lr': 2.2532335351761003e-06, 'weight_decay': 3.4017225325935193e-05, 'epochs': 125, 'use_snp_selection': True, 'num_snps': 26000}. Best is trial 98 with value: 0.3420106410980225.
[I 2025-10-16 18:54:49,759] Trial 146 finished with value: 0.33003086447715757 and parameters: {'hidden_dims': '[256, 128]', 'dropout': 0.13305243119024243, 'batch_norm': True, 'graph_on': True, 'source': 'grm', 'knn_k': 7, 'weighted_edges': True, 'symmetrize_mode': 'union', 'lr': 1.9089482792431518e-06, 'weight_decay': 1.7949478453807667e-05, 'epochs': 145, 'use_snp_selection': True, 'num_snps': 28000}. Best is trial 98 with value: 0.3420106410980225.
[I 2025-10-16 18:55:21,749] Trial 147 finished with value: 0.3125729262828827 and parameters: {'hidden_dims': '[256, 128]', 'dropout': 0.10816609875100046, 'batch_norm': False, 'graph_on': True, 'source': 'grm', 'knn_k': 7, 'weighted_edges': False, 'symmetrize_mode': 'union', 'lr': 2.7769670317167625e-06, 'weight_decay': 2.6168345447244954e-05, 'epochs': 191, 'use_snp_selection': True, 'num_snps': 28000}. Best is trial 98 with value: 0.3420106410980225.
[I 2025-10-16 18:55:57,463] Trial 148 finished with value: 0.32677243947982787 and parameters: {'hidden_dims': '[512, 256]', 'dropout': 0.1151007622162116, 'batch_norm': True, 'graph_on': True, 'source': 'grm', 'knn_k': 7, 'weighted_edges': True, 'symmetrize_mode': 'union', 'lr': 2.374663214762504e-06, 'weight_decay': 2.3832030755961476e-05, 'epochs': 120, 'use_snp_selection': True, 'num_snps': 30000}. Best is trial 98 with value: 0.3420106410980225.
[I 2025-10-16 18:56:31,095] Trial 149 finished with value: 0.33131171464920045 and parameters: {'hidden_dims': '[512, 64]', 'dropout': 0.36118339482596273, 'batch_norm': True, 'graph_on': True, 'source': 'grm', 'knn_k': 7, 'weighted_edges': True, 'symmetrize_mode': 'union', 'lr': 1.7900691777411537e-06, 'weight_decay': 0.0007439596852985713, 'epochs': 141, 'use_snp_selection': True, 'num_snps': 24000}. Best is trial 98 with value: 0.3420106410980225.
[I 2025-10-16 18:57:02,072] Trial 0 finished with value: 0.21142999827861786 and parameters: {'hidden_dims': '[128, 64]', 'dropout': 0.199031432379812, 'batch_norm': True, 'graph_on': True, 'source': 'grm', 'knn_k': 1, 'weighted_edges': True, 'symmetrize_mode': 'union', 'lr': 0.0002740708741343236, 'weight_decay': 2.819059662190987e-05, 'epochs': 256, 'use_snp_selection': True, 'num_snps': 18000}. Best is trial 0 with value: 0.21142999827861786.
[I 2025-10-16 18:57:21,368] Trial 1 finished with value: 0.20580989569425584 and parameters: {'hidden_dims': '[128, 64]', 'dropout': 0.32091658721149807, 'batch_norm': False, 'graph_on': True, 'source': 'grm', 'knn_k': 4, 'weighted_edges': False, 'symmetrize_mode': 'mutual', 'lr': 0.0005320428882732732, 'weight_decay': 1.89210117736594e-06, 'epochs': 40, 'use_snp_selection': True, 'num_snps': 20000}. Best is trial 0 with value: 0.21142999827861786.
[I 2025-10-16 18:57:47,460] Trial 2 finished with value: 0.2901594877243042 and parameters: {'hidden_dims': '[256, 128]', 'dropout': 0.19947376983940615, 'batch_norm': True, 'graph_on': True, 'source': 'grm', 'knn_k': 6, 'weighted_edges': True, 'symmetrize_mode': 'mutual', 'lr': 1.5051775490493461e-05, 'weight_decay': 2.3650563799866155e-07, 'epochs': 289, 'use_snp_selection': True, 'num_snps': 10000}. Best is trial 2 with value: 0.2901594877243042.
[I 2025-10-16 18:58:09,306] Trial 3 finished with value: 0.308327841758728 and parameters: {'hidden_dims': '[512, 256]', 'dropout': 0.3986858241154422, 'batch_norm': True, 'graph_on': True, 'source': 'grm', 'knn_k': 5, 'weighted_edges': True, 'symmetrize_mode': 'union', 'lr': 9.821050313409216e-06, 'weight_decay': 0.00012454353397331594, 'epochs': 23, 'use_snp_selection': True, 'num_snps': 26000}. Best is trial 3 with value: 0.308327841758728.
[I 2025-10-16 18:58:44,894] Trial 4 finished with value: 0.3018430173397064 and parameters: {'hidden_dims': '[256, 128, 64]', 'dropout': 0.5390483213624292, 'batch_norm': False, 'graph_on': True, 'source': 'grm', 'knn_k': 4, 'weighted_edges': False, 'symmetrize_mode': 'mutual', 'lr': 8.11311593386297e-06, 'weight_decay': 9.296158109581328e-07, 'epochs': 200, 'use_snp_selection': True, 'num_snps': 34000}. Best is trial 3 with value: 0.308327841758728.
[I 2025-10-16 18:59:13,070] Trial 5 finished with value: 0.24751286208629608 and parameters: {'hidden_dims': '[512, 256]', 'dropout': 0.528994345325027, 'batch_norm': True, 'graph_on': True, 'source': 'grm', 'knn_k': 6, 'weighted_edges': True, 'symmetrize_mode': 'union', 'lr': 1.164930281795184e-06, 'weight_decay': 0.00020941850571250828, 'epochs': 21, 'use_snp_selection': True, 'num_snps': 60000}. Best is trial 3 with value: 0.308327841758728.
[I 2025-10-16 18:59:52,660] Trial 6 finished with value: 0.24637636542320251 and parameters: {'hidden_dims': '[512, 256]', 'dropout': 0.4244699923044819, 'batch_norm': True, 'graph_on': True, 'source': 'grm', 'knn_k': 2, 'weighted_edges': True, 'symmetrize_mode': 'union', 'lr': 5.719516246965409e-05, 'weight_decay': 0.0007446207004743823, 'epochs': 111, 'use_snp_selection': True, 'num_snps': 40000}. Best is trial 3 with value: 0.308327841758728.
[I 2025-10-16 19:00:39,415] Trial 7 finished with value: 0.3274878621101379 and parameters: {'hidden_dims': '[512, 64]', 'dropout': 0.3607638271959879, 'batch_norm': True, 'graph_on': True, 'source': 'grm', 'knn_k': 7, 'weighted_edges': True, 'symmetrize_mode': 'union', 'lr': 2.400010639603384e-06, 'weight_decay': 3.556750757572288e-05, 'epochs': 124, 'use_snp_selection': True, 'num_snps': 48000}. Best is trial 7 with value: 0.3274878621101379.
[I 2025-10-16 19:01:30,775] Trial 8 finished with value: 0.2900674879550934 and parameters: {'hidden_dims': '[512, 64]', 'dropout': 0.2928493908415588, 'batch_norm': False, 'graph_on': True, 'source': 'grm', 'knn_k': 7, 'weighted_edges': False, 'symmetrize_mode': 'union', 'lr': 1.1043450617383017e-06, 'weight_decay': 1.511705358910635e-05, 'epochs': 135, 'use_snp_selection': True, 'num_snps': 52000}. Best is trial 7 with value: 0.3274878621101379.
[I 2025-10-16 19:03:00,238] Trial 9 finished with value: 0.2722809374332428 and parameters: {'hidden_dims': '[512, 64]', 'dropout': 0.1194044225528384, 'batch_norm': True, 'graph_on': True, 'source': 'grm', 'knn_k': 7, 'weighted_edges': True, 'symmetrize_mode': 'union', 'lr': 3.754731899410945e-06, 'weight_decay': 3.797795084560882e-06, 'epochs': 347, 'use_snp_selection': True, 'num_snps': 46000}. Best is trial 7 with value: 0.3274878621101379.
[I 2025-10-16 19:03:48,019] Trial 10 finished with value: 0.3106645941734314 and parameters: {'hidden_dims': '[512, 128]', 'dropout': 0.4648806431230973, 'batch_norm': False, 'graph_on': True, 'source': 'grm', 'knn_k': 3, 'weighted_edges': False, 'symmetrize_mode': 'mutual', 'lr': 8.29984835644417e-05, 'weight_decay': 6.552467860785973e-05, 'epochs': 103, 'use_snp_selection': True, 'num_snps': 60000}. Best is trial 7 with value: 0.3274878621101379.
[I 2025-10-16 19:04:36,251] Trial 11 finished with value: 0.3032087802886963 and parameters: {'hidden_dims': '[512, 128]', 'dropout': 0.4669761282213152, 'batch_norm': False, 'graph_on': True, 'source': 'grm', 'knn_k': 3, 'weighted_edges': False, 'symmetrize_mode': 'mutual', 'lr': 7.774273435092724e-05, 'weight_decay': 4.902247331197566e-05, 'epochs': 105, 'use_snp_selection': True, 'num_snps': 60000}. Best is trial 7 with value: 0.3274878621101379.
[I 2025-10-16 19:05:33,567] Trial 12 finished with value: 0.3056586146354675 and parameters: {'hidden_dims': '[512, 128]', 'dropout': 0.5887766944235128, 'batch_norm': False, 'graph_on': True, 'source': 'grm', 'knn_k': 3, 'weighted_edges': False, 'symmetrize_mode': 'mutual', 'lr': 0.00014334793979738487, 'weight_decay': 8.055516632415227e-06, 'epochs': 175, 'use_snp_selection': True, 'num_snps': 50000}. Best is trial 7 with value: 0.3274878621101379.
[I 2025-10-16 19:06:07,036] Trial 13 finished with value: 0.33322330117225646 and parameters: {'hidden_dims': '[512, 128]', 'dropout': 0.37418260234806416, 'batch_norm': False, 'graph_on': True, 'source': 'grm', 'knn_k': 2, 'weighted_edges': False, 'symmetrize_mode': 'mutual', 'lr': 2.8408979813470725e-05, 'weight_decay': 0.00011622626262884773, 'epochs': 78, 'use_snp_selection': True, 'num_snps': 40000}. Best is trial 13 with value: 0.33322330117225646.
[I 2025-10-16 19:06:37,061] Trial 14 finished with value: 0.2878719449043274 and parameters: {'hidden_dims': '[512, 64]', 'dropout': 0.35809612330943663, 'batch_norm': True, 'graph_on': True, 'source': 'grm', 'knn_k': 1, 'weighted_edges': True, 'symmetrize_mode': 'union', 'lr': 3.180980412936957e-06, 'weight_decay': 0.000563273472841316, 'epochs': 64, 'use_snp_selection': True, 'num_snps': 38000}. Best is trial 13 with value: 0.33322330117225646.
[I 2025-10-16 19:07:13,480] Trial 15 finished with value: 0.3142439305782318 and parameters: {'hidden_dims': '[256, 128]', 'dropout': 0.27818268042245403, 'batch_norm': False, 'graph_on': True, 'source': 'grm', 'knn_k': 2, 'weighted_edges': False, 'symmetrize_mode': 'mutual', 'lr': 2.719123035487706e-05, 'weight_decay': 0.00017639577556985872, 'epochs': 169, 'use_snp_selection': True, 'num_snps': 44000}. Best is trial 13 with value: 0.33322330117225646.
[I 2025-10-16 19:07:37,971] Trial 16 finished with value: 0.2824395179748535 and parameters: {'hidden_dims': '[256, 128, 64]', 'dropout': 0.24239797017188272, 'batch_norm': True, 'graph_on': True, 'source': 'grm', 'knn_k': 5, 'weighted_edges': False, 'symmetrize_mode': 'mutual', 'lr': 3.528071606537024e-06, 'weight_decay': 1.2797230220691679e-05, 'epochs': 63, 'use_snp_selection': True, 'num_snps': 32000}. Best is trial 13 with value: 0.33322330117225646.
[I 2025-10-16 19:08:45,717] Trial 17 finished with value: 0.32535293102264407 and parameters: {'hidden_dims': '[512, 128]', 'dropout': 0.3512031139590652, 'batch_norm': False, 'graph_on': True, 'source': 'grm', 'knn_k': 2, 'weighted_edges': True, 'symmetrize_mode': 'union', 'lr': 2.174046820155494e-05, 'weight_decay': 0.00031981986362457154, 'epochs': 217, 'use_snp_selection': True, 'num_snps': 52000}. Best is trial 13 with value: 0.33322330117225646.
[I 2025-10-16 19:09:06,748] Trial 18 finished with value: 0.3299724280834198 and parameters: {'hidden_dims': '[512, 64]', 'dropout': 0.408247094126174, 'batch_norm': True, 'graph_on': True, 'source': 'grm', 'knn_k': 6, 'weighted_edges': True, 'symmetrize_mode': 'union', 'lr': 5.958171976420772e-06, 'weight_decay': 6.947912767688255e-05, 'epochs': 147, 'use_snp_selection': True, 'num_snps': 4000}. Best is trial 13 with value: 0.33322330117225646.
[I 2025-10-16 19:09:26,184] Trial 19 finished with value: 0.2809763550758362 and parameters: {'hidden_dims': '[512, 128]', 'dropout': 0.4470166419206838, 'batch_norm': False, 'graph_on': True, 'source': 'grm', 'knn_k': 5, 'weighted_edges': False, 'symmetrize_mode': 'mutual', 'lr': 7.529542512635712e-06, 'weight_decay': 0.0009960552912393187, 'epochs': 149, 'use_snp_selection': True, 'num_snps': 2000}. Best is trial 13 with value: 0.33322330117225646.
[I 2025-10-16 19:09:53,893] Trial 20 finished with value: 0.3296346068382263 and parameters: {'hidden_dims': '[512, 64]', 'dropout': 0.40153751572507573, 'batch_norm': False, 'graph_on': True, 'source': 'grm', 'knn_k': 6, 'weighted_edges': True, 'symmetrize_mode': 'mutual', 'lr': 4.710755869770833e-05, 'weight_decay': 9.184854182491129e-05, 'epochs': 77, 'use_snp_selection': True, 'num_snps': 26000}. Best is trial 13 with value: 0.33322330117225646.
[I 2025-10-16 19:10:20,170] Trial 21 finished with value: 0.3370202720165253 and parameters: {'hidden_dims': '[512, 64]', 'dropout': 0.4025497973167898, 'batch_norm': False, 'graph_on': True, 'source': 'grm', 'knn_k': 6, 'weighted_edges': True, 'symmetrize_mode': 'mutual', 'lr': 3.264629521300404e-05, 'weight_decay': 8.58970861149538e-05, 'epochs': 72, 'use_snp_selection': True, 'num_snps': 24000}. Best is trial 21 with value: 0.3370202720165253.
[I 2025-10-16 19:10:38,296] Trial 22 finished with value: 0.2899760365486145 and parameters: {'hidden_dims': '[512, 64]', 'dropout': 0.5035015455524068, 'batch_norm': False, 'graph_on': True, 'source': 'grm', 'knn_k': 6, 'weighted_edges': True, 'symmetrize_mode': 'mutual', 'lr': 1.8463029479764024e-05, 'weight_decay': 0.0002758760527898617, 'epochs': 78, 'use_snp_selection': True, 'num_snps': 2000}. Best is trial 21 with value: 0.3370202720165253.
[I 2025-10-16 19:11:02,912] Trial 23 finished with value: 0.3246274709701538 and parameters: {'hidden_dims': '[512, 64]', 'dropout': 0.3925117116324654, 'batch_norm': False, 'graph_on': True, 'source': 'grm', 'knn_k': 5, 'weighted_edges': True, 'symmetrize_mode': 'mutual', 'lr': 0.00014071657215205283, 'weight_decay': 2.4749323200963537e-05, 'epochs': 157, 'use_snp_selection': True, 'num_snps': 10000}. Best is trial 21 with value: 0.3370202720165253.
[I 2025-10-16 19:11:23,040] Trial 24 finished with value: 0.325123006105423 and parameters: {'hidden_dims': '[512, 64]', 'dropout': 0.30404955427283037, 'batch_norm': False, 'graph_on': True, 'source': 'grm', 'knn_k': 4, 'weighted_edges': True, 'symmetrize_mode': 'mutual', 'lr': 3.5084035665713646e-05, 'weight_decay': 8.565929477687183e-05, 'epochs': 50, 'use_snp_selection': True, 'num_snps': 12000}. Best is trial 21 with value: 0.3370202720165253.
[I 2025-10-16 19:11:47,106] Trial 25 finished with value: 0.31681485176086427 and parameters: {'hidden_dims': '[256, 128, 64]', 'dropout': 0.49569728429740934, 'batch_norm': False, 'graph_on': True, 'source': 'grm', 'knn_k': 6, 'weighted_edges': True, 'symmetrize_mode': 'mutual', 'lr': 1.383908224639154e-05, 'weight_decay': 5.871639336405786e-06, 'epochs': 89, 'use_snp_selection': True, 'num_snps': 24000}. Best is trial 21 with value: 0.3370202720165253.
[I 2025-10-16 19:12:11,266] Trial 26 finished with value: 0.32146496772766114 and parameters: {'hidden_dims': '[128, 64]', 'dropout': 0.422146678041246, 'batch_norm': True, 'graph_on': True, 'source': 'grm', 'knn_k': 7, 'weighted_edges': False, 'symmetrize_mode': 'union', 'lr': 6.00640604345454e-06, 'weight_decay': 0.00038939323308526564, 'epochs': 211, 'use_snp_selection': True, 'num_snps': 16000}. Best is trial 21 with value: 0.3370202720165253.
[I 2025-10-16 19:12:41,775] Trial 27 finished with value: 0.3289045035839081 and parameters: {'hidden_dims': '[256, 128]', 'dropout': 0.3414528163680246, 'batch_norm': False, 'graph_on': True, 'source': 'grm', 'knn_k': 5, 'weighted_edges': True, 'symmetrize_mode': 'mutual', 'lr': 3.8175058741993616e-05, 'weight_decay': 0.0001402325746320832, 'epochs': 132, 'use_snp_selection': True, 'num_snps': 36000}. Best is trial 21 with value: 0.3370202720165253.
[I 2025-10-16 19:13:02,797] Trial 28 finished with value: 0.27576154470443726 and parameters: {'hidden_dims': '[512, 128]', 'dropout': 0.245072068731175, 'batch_norm': True, 'graph_on': True, 'source': 'grm', 'knn_k': 3, 'weighted_edges': False, 'symmetrize_mode': 'union', 'lr': 0.00010237680213908352, 'weight_decay': 4.1837492418059215e-05, 'epochs': 11, 'use_snp_selection': True, 'num_snps': 30000}. Best is trial 21 with value: 0.3370202720165253.
[I 2025-10-16 19:13:27,983] Trial 29 finished with value: 0.22435509860515596 and parameters: {'hidden_dims': '[128, 64]', 'dropout': 0.37653415144043734, 'batch_norm': True, 'graph_on': True, 'source': 'grm', 'knn_k': 1, 'weighted_edges': True, 'symmetrize_mode': 'union', 'lr': 0.0002482364097466563, 'weight_decay': 2.2470856652108347e-05, 'epochs': 242, 'use_snp_selection': True, 'num_snps': 20000}. Best is trial 21 with value: 0.3370202720165253.
