[I 2025-10-16 15:04:33,977] Trial 96 finished with value: 0.31751627326011655 and parameters: {'hidden_dims': '[512, 64]', 'dropout': 0.22354991377154487, 'batch_norm': False, 'graph_on': True, 'source': 'grm', 'knn_k': 5, 'weighted_edges': True, 'symmetrize_mode': 'union', 'lr': 7.124617803990721e-05, 'weight_decay': 2.2650624508137044e-06, 'epochs': 169, 'use_snp_selection': True, 'num_snps': 48000}. Best is trial 43 with value: 0.32611833810806273.
[I 2025-10-16 15:05:33,277] Trial 97 finished with value: 0.20714092552661895 and parameters: {'hidden_dims': '[512, 64]', 'dropout': 0.13820211803292934, 'batch_norm': True, 'graph_on': True, 'source': 'grm', 'knn_k': 4, 'weighted_edges': True, 'symmetrize_mode': 'mutual', 'lr': 3.0212328357963664e-05, 'weight_decay': 1.5182522060159115e-05, 'epochs': 168, 'use_snp_selection': True, 'num_snps': 54000}. Best is trial 43 with value: 0.32611833810806273.
[I 2025-10-16 15:06:24,400] Trial 98 finished with value: 0.3191186308860779 and parameters: {'hidden_dims': '[512, 64]', 'dropout': 0.1263323579810206, 'batch_norm': False, 'graph_on': True, 'source': 'grm', 'knn_k': 4, 'weighted_edges': True, 'symmetrize_mode': 'union', 'lr': 4.123970017848495e-05, 'weight_decay': 6.276438656906329e-06, 'epochs': 123, 'use_snp_selection': True, 'num_snps': 58000}. Best is trial 43 with value: 0.32611833810806273.
[I 2025-10-16 15:07:03,711] Trial 99 finished with value: 0.3201375186443329 and parameters: {'hidden_dims': '[512, 64]', 'dropout': 0.26871610499509724, 'batch_norm': False, 'graph_on': True, 'source': 'grm', 'knn_k': 5, 'weighted_edges': True, 'symmetrize_mode': 'union', 'lr': 2.3147642976594263e-05, 'weight_decay': 3.231066978653957e-06, 'epochs': 99, 'use_snp_selection': True, 'num_snps': 44000}. Best is trial 43 with value: 0.32611833810806273.
[I 2025-10-16 15:07:27,372] Trial 100 finished with value: 0.32137306928634646 and parameters: {'hidden_dims': '[512, 64]', 'dropout': 0.15757772660032793, 'batch_norm': False, 'graph_on': True, 'source': 'grm', 'knn_k': 4, 'weighted_edges': True, 'symmetrize_mode': 'union', 'lr': 1.5266752235097853e-05, 'weight_decay': 4.457467142505592e-06, 'epochs': 114, 'use_snp_selection': True, 'num_snps': 8000}. Best is trial 43 with value: 0.32611833810806273.
[I 2025-10-16 15:07:48,217] Trial 101 finished with value: 0.3186730146408081 and parameters: {'hidden_dims': '[512, 64]', 'dropout': 0.16203098793241727, 'batch_norm': False, 'graph_on': True, 'source': 'grm', 'knn_k': 4, 'weighted_edges': True, 'symmetrize_mode': 'union', 'lr': 1.2007038465847407e-05, 'weight_decay': 4.2755806447321235e-06, 'epochs': 117, 'use_snp_selection': True, 'num_snps': 6000}. Best is trial 43 with value: 0.32611833810806273.
[I 2025-10-16 15:08:07,635] Trial 102 finished with value: 0.31013056039810183 and parameters: {'hidden_dims': '[512, 64]', 'dropout': 0.18406685947008347, 'batch_norm': False, 'graph_on': True, 'source': 'grm', 'knn_k': 4, 'weighted_edges': True, 'symmetrize_mode': 'union', 'lr': 1.613745471189664e-05, 'weight_decay': 7.92074646450541e-06, 'epochs': 153, 'use_snp_selection': True, 'num_snps': 2000}. Best is trial 43 with value: 0.32611833810806273.
[I 2025-10-16 15:08:29,846] Trial 103 finished with value: 0.3202733933925629 and parameters: {'hidden_dims': '[512, 64]', 'dropout': 0.14989649114649686, 'batch_norm': False, 'graph_on': True, 'source': 'grm', 'knn_k': 4, 'weighted_edges': True, 'symmetrize_mode': 'union', 'lr': 8.842275429163285e-06, 'weight_decay': 1.0237063997765412e-05, 'epochs': 109, 'use_snp_selection': True, 'num_snps': 10000}. Best is trial 43 with value: 0.32611833810806273.
[I 2025-10-16 15:08:57,957] Trial 104 finished with value: 0.31291438937187194 and parameters: {'hidden_dims': '[512, 64]', 'dropout': 0.19630532664375472, 'batch_norm': False, 'graph_on': True, 'source': 'grm', 'knn_k': 4, 'weighted_edges': True, 'symmetrize_mode': 'union', 'lr': 8.925919090414863e-05, 'weight_decay': 5.196887774441569e-06, 'epochs': 170, 'use_snp_selection': True, 'num_snps': 14000}. Best is trial 43 with value: 0.32611833810806273.
[I 2025-10-16 15:09:55,928] Trial 105 finished with value: 0.3188992261886597 and parameters: {'hidden_dims': '[512, 256]', 'dropout': 0.1742909775331576, 'batch_norm': False, 'graph_on': True, 'source': 'grm', 'knn_k': 4, 'weighted_edges': True, 'symmetrize_mode': 'union', 'lr': 1.2983887713105399e-05, 'weight_decay': 1.89580315265848e-06, 'epochs': 179, 'use_snp_selection': True, 'num_snps': 50000}. Best is trial 43 with value: 0.32611833810806273.
[I 2025-10-16 15:10:26,428] Trial 106 finished with value: 0.32036293148994444 and parameters: {'hidden_dims': '[256, 128]', 'dropout': 0.15923671807487821, 'batch_norm': False, 'graph_on': True, 'source': 'grm', 'knn_k': 4, 'weighted_edges': True, 'symmetrize_mode': 'union', 'lr': 2.7267595521115082e-05, 'weight_decay': 7.026089109379635e-06, 'epochs': 95, 'use_snp_selection': True, 'num_snps': 48000}. Best is trial 43 with value: 0.32611833810806273.
[I 2025-10-16 15:10:58,038] Trial 107 finished with value: 0.3129559576511383 and parameters: {'hidden_dims': '[256, 128, 64]', 'dropout': 0.21749558572997585, 'batch_norm': False, 'graph_on': True, 'source': 'grm', 'knn_k': 4, 'weighted_edges': True, 'symmetrize_mode': 'union', 'lr': 1.734712795406687e-05, 'weight_decay': 1.3200458279500534e-05, 'epochs': 125, 'use_snp_selection': True, 'num_snps': 40000}. Best is trial 43 with value: 0.32611833810806273.
[I 2025-10-16 15:11:24,241] Trial 108 finished with value: 0.32091699838638305 and parameters: {'hidden_dims': '[128, 64]', 'dropout': 0.22983489773217408, 'batch_norm': False, 'graph_on': True, 'source': 'grm', 'knn_k': 5, 'weighted_edges': True, 'symmetrize_mode': 'union', 'lr': 1.0600669512637066e-05, 'weight_decay': 2.8817559514609164e-06, 'epochs': 114, 'use_snp_selection': True, 'num_snps': 42000}. Best is trial 43 with value: 0.32611833810806273.
[I 2025-10-16 15:12:13,613] Trial 109 finished with value: 0.3227360486984253 and parameters: {'hidden_dims': '[512, 64]', 'dropout': 0.1196327830279181, 'batch_norm': False, 'graph_on': True, 'source': 'grm', 'knn_k': 4, 'weighted_edges': True, 'symmetrize_mode': 'union', 'lr': 2.0801707095306196e-05, 'weight_decay': 4.547539221304815e-06, 'epochs': 149, 'use_snp_selection': True, 'num_snps': 46000}. Best is trial 43 with value: 0.32611833810806273.
[I 2025-10-16 15:12:43,415] Trial 110 finished with value: 0.31243348121643066 and parameters: {'hidden_dims': '[512, 64]', 'dropout': 0.11765732753988996, 'batch_norm': False, 'graph_on': True, 'source': 'grm', 'knn_k': 3, 'weighted_edges': True, 'symmetrize_mode': 'union', 'lr': 2.1144651387761028e-05, 'weight_decay': 2.3152786712096228e-06, 'epochs': 147, 'use_snp_selection': True, 'num_snps': 18000}. Best is trial 43 with value: 0.32611833810806273.
[I 2025-10-16 15:13:35,308] Trial 111 finished with value: 0.3198570966720581 and parameters: {'hidden_dims': '[512, 64]', 'dropout': 0.134777652054181, 'batch_norm': False, 'graph_on': True, 'source': 'grm', 'knn_k': 4, 'weighted_edges': True, 'symmetrize_mode': 'union', 'lr': 3.224224372847399e-05, 'weight_decay': 3.761179398770651e-06, 'epochs': 157, 'use_snp_selection': True, 'num_snps': 48000}. Best is trial 43 with value: 0.32611833810806273.
[I 2025-10-16 15:14:31,317] Trial 112 finished with value: 0.31764277815818787 and parameters: {'hidden_dims': '[512, 64]', 'dropout': 0.20294834251135746, 'batch_norm': False, 'graph_on': True, 'source': 'grm', 'knn_k': 4, 'weighted_edges': True, 'symmetrize_mode': 'union', 'lr': 2.4411268551249734e-05, 'weight_decay': 4.794782077044062e-06, 'epochs': 184, 'use_snp_selection': True, 'num_snps': 46000}. Best is trial 43 with value: 0.32611833810806273.
[I 2025-10-16 15:15:16,344] Trial 113 finished with value: 0.3208020985126495 and parameters: {'hidden_dims': '[512, 64]', 'dropout': 0.10364200382909065, 'batch_norm': False, 'graph_on': True, 'source': 'grm', 'knn_k': 4, 'weighted_edges': True, 'symmetrize_mode': 'union', 'lr': 1.3931599703133625e-05, 'weight_decay': 5.988782316032287e-06, 'epochs': 130, 'use_snp_selection': True, 'num_snps': 44000}. Best is trial 43 with value: 0.32611833810806273.
[I 2025-10-16 15:16:15,044] Trial 114 finished with value: 0.31746090650558473 and parameters: {'hidden_dims': '[512, 128]', 'dropout': 0.1442222448599284, 'batch_norm': False, 'graph_on': True, 'source': 'grm', 'knn_k': 4, 'weighted_edges': True, 'symmetrize_mode': 'union', 'lr': 1.9655447538871282e-05, 'weight_decay': 9.20177892195519e-06, 'epochs': 198, 'use_snp_selection': True, 'num_snps': 46000}. Best is trial 43 with value: 0.32611833810806273.
[I 2025-10-16 15:17:12,392] Trial 115 finished with value: 0.3139669895172119 and parameters: {'hidden_dims': '[512, 128]', 'dropout': 0.1249281920644249, 'batch_norm': False, 'graph_on': True, 'source': 'grm', 'knn_k': 4, 'weighted_edges': False, 'symmetrize_mode': 'union', 'lr': 8.354515993217365e-06, 'weight_decay': 1.6800560331103695e-05, 'epochs': 165, 'use_snp_selection': True, 'num_snps': 52000}. Best is trial 43 with value: 0.32611833810806273.
[I 2025-10-16 15:17:55,441] Trial 116 finished with value: 0.27077102065086367 and parameters: {'hidden_dims': '[512, 64]', 'dropout': 0.18808371291893994, 'batch_norm': True, 'graph_on': True, 'source': 'grm', 'knn_k': 4, 'weighted_edges': True, 'symmetrize_mode': 'union', 'lr': 1.4948787613893235e-05, 'weight_decay': 1.583603187167703e-06, 'epochs': 104, 'use_snp_selection': True, 'num_snps': 50000}. Best is trial 43 with value: 0.32611833810806273.
[I 2025-10-16 15:18:47,927] Trial 117 finished with value: 0.32001089453697207 and parameters: {'hidden_dims': '[512, 128]', 'dropout': 0.17601124245933156, 'batch_norm': False, 'graph_on': True, 'source': 'grm', 'knn_k': 6, 'weighted_edges': True, 'symmetrize_mode': 'mutual', 'lr': 4.142193275085794e-05, 'weight_decay': 3.5728005407153707e-06, 'epochs': 141, 'use_snp_selection': True, 'num_snps': 54000}. Best is trial 43 with value: 0.32611833810806273.
[I 2025-10-16 15:19:31,000] Trial 118 finished with value: 0.31198890209198 and parameters: {'hidden_dims': '[512, 128]', 'dropout': 0.24174481308323736, 'batch_norm': False, 'graph_on': True, 'source': 'grm', 'knn_k': 3, 'weighted_edges': True, 'symmetrize_mode': 'union', 'lr': 2.7745197778531745e-05, 'weight_decay': 6.970982890750333e-06, 'epochs': 148, 'use_snp_selection': True, 'num_snps': 38000}. Best is trial 43 with value: 0.32611833810806273.
[I 2025-10-16 15:20:05,574] Trial 119 finished with value: 0.32134953141212463 and parameters: {'hidden_dims': '[512, 64]', 'dropout': 0.15663487228984158, 'batch_norm': False, 'graph_on': True, 'source': 'grm', 'knn_k': 4, 'weighted_edges': True, 'symmetrize_mode': 'union', 'lr': 1.7225213698207135e-05, 'weight_decay': 1.0908334393520572e-05, 'epochs': 80, 'use_snp_selection': True, 'num_snps': 42000}. Best is trial 43 with value: 0.32611833810806273.
[I 2025-10-16 15:20:38,635] Trial 120 finished with value: 0.32008448243141174 and parameters: {'hidden_dims': '[512, 64]', 'dropout': 0.1534883309906142, 'batch_norm': False, 'graph_on': True, 'source': 'grm', 'knn_k': 4, 'weighted_edges': True, 'symmetrize_mode': 'union', 'lr': 1.7307540691265824e-05, 'weight_decay': 4.789636903810505e-06, 'epochs': 71, 'use_snp_selection': True, 'num_snps': 42000}. Best is trial 43 with value: 0.32611833810806273.
[I 2025-10-16 15:21:14,685] Trial 121 finished with value: 0.3194694399833679 and parameters: {'hidden_dims': '[512, 64]', 'dropout': 0.16768660294727578, 'batch_norm': False, 'graph_on': True, 'source': 'grm', 'knn_k': 4, 'weighted_edges': True, 'symmetrize_mode': 'union', 'lr': 2.149188513024152e-05, 'weight_decay': 1.1222321246122841e-05, 'epochs': 79, 'use_snp_selection': True, 'num_snps': 46000}. Best is trial 43 with value: 0.32611833810806273.
[I 2025-10-16 15:21:53,753] Trial 122 finished with value: 0.3227334201335907 and parameters: {'hidden_dims': '[512, 64]', 'dropout': 0.13821508924065593, 'batch_norm': False, 'graph_on': True, 'source': 'grm', 'knn_k': 4, 'weighted_edges': True, 'symmetrize_mode': 'union', 'lr': 1.2600377731598475e-05, 'weight_decay': 8.643172308528162e-06, 'epochs': 98, 'use_snp_selection': True, 'num_snps': 44000}. Best is trial 43 with value: 0.32611833810806273.
[I 2025-10-16 15:22:32,458] Trial 123 finished with value: 0.3245494067668915 and parameters: {'hidden_dims': '[512, 64]', 'dropout': 0.13173492988435895, 'batch_norm': False, 'graph_on': True, 'source': 'grm', 'knn_k': 4, 'weighted_edges': True, 'symmetrize_mode': 'union', 'lr': 1.1326176098950409e-05, 'weight_decay': 8.533696820370017e-06, 'epochs': 96, 'use_snp_selection': True, 'num_snps': 44000}. Best is trial 43 with value: 0.32611833810806273.
[I 2025-10-16 15:23:10,992] Trial 124 finished with value: 0.32277644872665406 and parameters: {'hidden_dims': '[512, 64]', 'dropout': 0.1388279209856871, 'batch_norm': False, 'graph_on': True, 'source': 'grm', 'knn_k': 4, 'weighted_edges': True, 'symmetrize_mode': 'union', 'lr': 1.0448396793027177e-05, 'weight_decay': 6.1327099893187075e-06, 'epochs': 95, 'use_snp_selection': True, 'num_snps': 44000}. Best is trial 43 with value: 0.32611833810806273.
[I 2025-10-16 15:23:49,539] Trial 125 finished with value: 0.32320051789283755 and parameters: {'hidden_dims': '[512, 64]', 'dropout': 0.13286273040724808, 'batch_norm': False, 'graph_on': True, 'source': 'grm', 'knn_k': 4, 'weighted_edges': True, 'symmetrize_mode': 'union', 'lr': 9.990055617810404e-06, 'weight_decay': 5.503472764241917e-06, 'epochs': 95, 'use_snp_selection': True, 'num_snps': 44000}. Best is trial 43 with value: 0.32611833810806273.
[I 2025-10-16 15:24:28,012] Trial 126 finished with value: 0.32366121411323545 and parameters: {'hidden_dims': '[512, 64]', 'dropout': 0.11091447555352896, 'batch_norm': False, 'graph_on': True, 'source': 'grm', 'knn_k': 4, 'weighted_edges': True, 'symmetrize_mode': 'union', 'lr': 1.1598477147372867e-05, 'weight_decay': 7.882216787905554e-06, 'epochs': 95, 'use_snp_selection': True, 'num_snps': 44000}. Best is trial 43 with value: 0.32611833810806273.
[I 2025-10-16 15:25:04,325] Trial 127 finished with value: 0.32488991022109986 and parameters: {'hidden_dims': '[512, 64]', 'dropout': 0.1301933913074365, 'batch_norm': False, 'graph_on': True, 'source': 'grm', 'knn_k': 4, 'weighted_edges': True, 'symmetrize_mode': 'union', 'lr': 1.077545633063899e-05, 'weight_decay': 8.262255231113533e-06, 'epochs': 93, 'use_snp_selection': True, 'num_snps': 40000}. Best is trial 43 with value: 0.32611833810806273.
[I 2025-10-16 15:25:42,524] Trial 128 finished with value: 0.3222573518753052 and parameters: {'hidden_dims': '[512, 64]', 'dropout': 0.11087023759300267, 'batch_norm': False, 'graph_on': True, 'source': 'grm', 'knn_k': 4, 'weighted_edges': True, 'symmetrize_mode': 'union', 'lr': 1.00882808923595e-05, 'weight_decay': 7.962761009099873e-06, 'epochs': 93, 'use_snp_selection': True, 'num_snps': 44000}. Best is trial 43 with value: 0.32611833810806273.
[I 2025-10-16 15:26:19,031] Trial 129 finished with value: 0.3147566854953766 and parameters: {'hidden_dims': '[512, 64]', 'dropout': 0.11053298122486442, 'batch_norm': False, 'graph_on': True, 'source': 'grm', 'knn_k': 4, 'weighted_edges': False, 'symmetrize_mode': 'union', 'lr': 7.987505572239946e-06, 'weight_decay': 6.02864495135788e-06, 'epochs': 95, 'use_snp_selection': True, 'num_snps': 40000}. Best is trial 43 with value: 0.32611833810806273.
[I 2025-10-16 15:26:50,429] Trial 130 finished with value: 0.3181351900100708 and parameters: {'hidden_dims': '[512, 64]', 'dropout': 0.10010518928959047, 'batch_norm': False, 'graph_on': True, 'source': 'grm', 'knn_k': 4, 'weighted_edges': True, 'symmetrize_mode': 'union', 'lr': 1.0495160050494666e-05, 'weight_decay': 7.854546959383372e-06, 'epochs': 61, 'use_snp_selection': True, 'num_snps': 42000}. Best is trial 43 with value: 0.32611833810806273.
[I 2025-10-16 15:27:26,749] Trial 131 finished with value: 0.32512948513031004 and parameters: {'hidden_dims': '[512, 64]', 'dropout': 0.128928511335642, 'batch_norm': False, 'graph_on': True, 'source': 'grm', 'knn_k': 4, 'weighted_edges': True, 'symmetrize_mode': 'union', 'lr': 1.1966193144471132e-05, 'weight_decay': 8.54349357193361e-06, 'epochs': 103, 'use_snp_selection': True, 'num_snps': 38000}. Best is trial 43 with value: 0.32611833810806273.
[I 2025-10-16 15:28:01,786] Trial 132 finished with value: 0.32302939891815186 and parameters: {'hidden_dims': '[512, 64]', 'dropout': 0.12759781375559626, 'batch_norm': False, 'graph_on': True, 'source': 'grm', 'knn_k': 4, 'weighted_edges': True, 'symmetrize_mode': 'union', 'lr': 1.2092534346470687e-05, 'weight_decay': 5.535929225367981e-06, 'epochs': 95, 'use_snp_selection': True, 'num_snps': 38000}. Best is trial 43 with value: 0.32611833810806273.
[I 2025-10-16 15:28:38,838] Trial 133 finished with value: 0.32300862669944763 and parameters: {'hidden_dims': '[512, 64]', 'dropout': 0.12949497437094004, 'batch_norm': False, 'graph_on': True, 'source': 'grm', 'knn_k': 4, 'weighted_edges': True, 'symmetrize_mode': 'union', 'lr': 1.2335924787107186e-05, 'weight_decay': 5.4453123604091755e-06, 'epochs': 98, 'use_snp_selection': True, 'num_snps': 40000}. Best is trial 43 with value: 0.32611833810806273.
[I 2025-10-16 15:29:14,563] Trial 134 finished with value: 0.3240024149417877 and parameters: {'hidden_dims': '[512, 64]', 'dropout': 0.1261922680555267, 'batch_norm': False, 'graph_on': True, 'source': 'grm', 'knn_k': 4, 'weighted_edges': True, 'symmetrize_mode': 'union', 'lr': 8.839288223104762e-06, 'weight_decay': 5.5515976650724745e-06, 'epochs': 99, 'use_snp_selection': True, 'num_snps': 38000}. Best is trial 43 with value: 0.32611833810806273.
[I 2025-10-16 15:29:50,652] Trial 135 finished with value: 0.32132436633110045 and parameters: {'hidden_dims': '[512, 64]', 'dropout': 0.12255324382261777, 'batch_norm': False, 'graph_on': True, 'source': 'grm', 'knn_k': 4, 'weighted_edges': True, 'symmetrize_mode': 'union', 'lr': 9.318564014023507e-06, 'weight_decay': 5.449692707915924e-06, 'epochs': 101, 'use_snp_selection': True, 'num_snps': 38000}. Best is trial 43 with value: 0.32611833810806273.
[I 2025-10-16 15:30:23,968] Trial 136 finished with value: 0.3219759464263916 and parameters: {'hidden_dims': '[512, 64]', 'dropout': 0.1296054812593456, 'batch_norm': False, 'graph_on': True, 'source': 'grm', 'knn_k': 4, 'weighted_edges': True, 'symmetrize_mode': 'union', 'lr': 7.415471380084028e-06, 'weight_decay': 6.858758602641946e-06, 'epochs': 83, 'use_snp_selection': True, 'num_snps': 38000}. Best is trial 43 with value: 0.32611833810806273.
[I 2025-10-16 15:30:54,200] Trial 137 finished with value: 0.2890542149543762 and parameters: {'hidden_dims': '[512, 64]', 'dropout': 0.11853974617576465, 'batch_norm': True, 'graph_on': True, 'source': 'grm', 'knn_k': 4, 'weighted_edges': True, 'symmetrize_mode': 'union', 'lr': 1.121258604767958e-05, 'weight_decay': 5.811234301061184e-06, 'epochs': 67, 'use_snp_selection': True, 'num_snps': 36000}. Best is trial 43 with value: 0.32611833810806273.
[I 2025-10-16 15:31:30,178] Trial 138 finished with value: 0.3176456272602081 and parameters: {'hidden_dims': '[512, 64]', 'dropout': 0.13419993089903542, 'batch_norm': False, 'graph_on': True, 'source': 'grm', 'knn_k': 4, 'weighted_edges': True, 'symmetrize_mode': 'mutual', 'lr': 5.782025945279843e-06, 'weight_decay': 1.4184677733311634e-05, 'epochs': 92, 'use_snp_selection': True, 'num_snps': 40000}. Best is trial 43 with value: 0.32611833810806273.
[I 2025-10-16 15:32:00,483] Trial 139 finished with value: 0.32482269406318665 and parameters: {'hidden_dims': '[512, 64]', 'dropout': 0.1431127746091108, 'batch_norm': False, 'graph_on': True, 'source': 'grm', 'knn_k': 4, 'weighted_edges': True, 'symmetrize_mode': 'union', 'lr': 8.49332955343387e-06, 'weight_decay': 5.00064520206446e-06, 'epochs': 75, 'use_snp_selection': True, 'num_snps': 34000}. Best is trial 43 with value: 0.32611833810806273.
[I 2025-10-16 15:32:30,975] Trial 140 finished with value: 0.3231890797615051 and parameters: {'hidden_dims': '[512, 64]', 'dropout': 0.1457393756664792, 'batch_norm': False, 'graph_on': True, 'source': 'grm', 'knn_k': 4, 'weighted_edges': True, 'symmetrize_mode': 'union', 'lr': 4.860328572723852e-06, 'weight_decay': 6.7082132681974475e-06, 'epochs': 76, 'use_snp_selection': True, 'num_snps': 34000}. Best is trial 43 with value: 0.32611833810806273.
[I 2025-10-16 15:33:01,066] Trial 141 finished with value: 0.32018918395042417 and parameters: {'hidden_dims': '[512, 64]', 'dropout': 0.13947184584726033, 'batch_norm': False, 'graph_on': True, 'source': 'grm', 'knn_k': 4, 'weighted_edges': True, 'symmetrize_mode': 'union', 'lr': 4.740343858622057e-06, 'weight_decay': 6.990719287569129e-06, 'epochs': 73, 'use_snp_selection': True, 'num_snps': 34000}. Best is trial 43 with value: 0.32611833810806273.
[I 2025-10-16 15:33:29,024] Trial 142 finished with value: 0.30259133577346803 and parameters: {'hidden_dims': '[512, 64]', 'dropout': 0.1459886423788199, 'batch_norm': False, 'graph_on': True, 'source': 'grm', 'knn_k': 4, 'weighted_edges': True, 'symmetrize_mode': 'union', 'lr': 4.004285369051222e-06, 'weight_decay': 5.602759205962768e-06, 'epochs': 53, 'use_snp_selection': True, 'num_snps': 36000}. Best is trial 43 with value: 0.32611833810806273.
[I 2025-10-16 15:33:59,470] Trial 143 finished with value: 0.32217466831207275 and parameters: {'hidden_dims': '[512, 64]', 'dropout': 0.12743315125783883, 'batch_norm': False, 'graph_on': True, 'source': 'grm', 'knn_k': 4, 'weighted_edges': True, 'symmetrize_mode': 'union', 'lr': 8.658203746496678e-06, 'weight_decay': 1.2528503235968563e-05, 'epochs': 81, 'use_snp_selection': True, 'num_snps': 32000}. Best is trial 43 with value: 0.32611833810806273.
