[I 2025-10-17 02:30:50,857] Trial 102 finished with value: 0.33561879992485044 and parameters: {'hidden_dims': '[512, 64]', 'dropout': 0.569777645550102, 'batch_norm': True, 'graph_on': True, 'source': 'grm', 'knn_k': 6, 'weighted_edges': True, 'symmetrize_mode': 'union', 'lr': 1.8297679739319777e-06, 'weight_decay': 2.0345427744764901e-07, 'epochs': 249, 'use_snp_selection': True, 'num_snps': 18000}. Best is trial 92 with value: 0.35022597312927245.
[I 2025-10-17 02:31:19,094] Trial 103 finished with value: 0.3308917939662933 and parameters: {'hidden_dims': '[512, 64]', 'dropout': 0.5992545388684128, 'batch_norm': True, 'graph_on': True, 'source': 'grm', 'knn_k': 6, 'weighted_edges': True, 'symmetrize_mode': 'union', 'lr': 2.2189924157199174e-06, 'weight_decay': 4.1806794317439073e-07, 'epochs': 191, 'use_snp_selection': True, 'num_snps': 12000}. Best is trial 92 with value: 0.35022597312927245.
[I 2025-10-17 02:31:59,690] Trial 104 finished with value: 0.3342308521270752 and parameters: {'hidden_dims': '[512, 64]', 'dropout': 0.5590551307599008, 'batch_norm': True, 'graph_on': True, 'source': 'grm', 'knn_k': 7, 'weighted_edges': True, 'symmetrize_mode': 'union', 'lr': 1.4143140826550294e-06, 'weight_decay': 4.010391604534318e-07, 'epochs': 206, 'use_snp_selection': True, 'num_snps': 24000}. Best is trial 92 with value: 0.35022597312927245.
[I 2025-10-17 02:32:38,486] Trial 105 finished with value: 0.347459876537323 and parameters: {'hidden_dims': '[512, 64]', 'dropout': 0.5784581112694581, 'batch_norm': True, 'graph_on': True, 'source': 'grm', 'knn_k': 6, 'weighted_edges': True, 'symmetrize_mode': 'union', 'lr': 1.6899223529475333e-06, 'weight_decay': 1.8695074958828e-07, 'epochs': 224, 'use_snp_selection': True, 'num_snps': 20000}. Best is trial 92 with value: 0.35022597312927245.
[I 2025-10-17 02:33:17,548] Trial 106 finished with value: 0.3258767068386078 and parameters: {'hidden_dims': '[512, 64]', 'dropout': 0.578173870099425, 'batch_norm': True, 'graph_on': True, 'source': 'grm', 'knn_k': 3, 'weighted_edges': True, 'symmetrize_mode': 'union', 'lr': 2.6271359402344504e-06, 'weight_decay': 5.892952607009944e-07, 'epochs': 231, 'use_snp_selection': True, 'num_snps': 20000}. Best is trial 92 with value: 0.35022597312927245.
[I 2025-10-17 02:33:54,028] Trial 107 finished with value: 0.29988551139831543 and parameters: {'hidden_dims': '[512, 64]', 'dropout': 0.5330962898761491, 'batch_norm': False, 'graph_on': True, 'source': 'grm', 'knn_k': 7, 'weighted_edges': False, 'symmetrize_mode': 'union', 'lr': 1.8070125346397e-06, 'weight_decay': 1.8502995533655748e-07, 'epochs': 219, 'use_snp_selection': True, 'num_snps': 18000}. Best is trial 92 with value: 0.35022597312927245.
[I 2025-10-17 02:34:25,781] Trial 108 finished with value: 0.33083581924438477 and parameters: {'hidden_dims': '[512, 64]', 'dropout': 0.5426640072632175, 'batch_norm': True, 'graph_on': True, 'source': 'grm', 'knn_k': 6, 'weighted_edges': True, 'symmetrize_mode': 'union', 'lr': 2.3884962936542416e-06, 'weight_decay': 4.7606902242622237e-07, 'epochs': 213, 'use_snp_selection': True, 'num_snps': 14000}. Best is trial 92 with value: 0.35022597312927245.
[I 2025-10-17 02:35:07,767] Trial 109 finished with value: 0.34633126854896545 and parameters: {'hidden_dims': '[512, 64]', 'dropout': 0.5877035064268955, 'batch_norm': True, 'graph_on': True, 'source': 'grm', 'knn_k': 7, 'weighted_edges': True, 'symmetrize_mode': 'union', 'lr': 2.981614420487841e-06, 'weight_decay': 7.854706176357637e-07, 'epochs': 235, 'use_snp_selection': True, 'num_snps': 22000}. Best is trial 92 with value: 0.35022597312927245.
[I 2025-10-17 02:35:50,924] Trial 110 finished with value: 0.3340266525745392 and parameters: {'hidden_dims': '[512, 64]', 'dropout': 0.5895793355685489, 'batch_norm': True, 'graph_on': True, 'source': 'grm', 'knn_k': 7, 'weighted_edges': True, 'symmetrize_mode': 'mutual', 'lr': 4.78709938639728e-06, 'weight_decay': 7.871136162024033e-07, 'epochs': 234, 'use_snp_selection': True, 'num_snps': 24000}. Best is trial 92 with value: 0.35022597312927245.
[I 2025-10-17 02:36:31,809] Trial 111 finished with value: 0.3447878360748291 and parameters: {'hidden_dims': '[512, 64]', 'dropout': 0.5817033683669128, 'batch_norm': True, 'graph_on': True, 'source': 'grm', 'knn_k': 7, 'weighted_edges': True, 'symmetrize_mode': 'union', 'lr': 3.050174276075166e-06, 'weight_decay': 2.7887814806905407e-07, 'epochs': 246, 'use_snp_selection': True, 'num_snps': 20000}. Best is trial 92 with value: 0.35022597312927245.
[I 2025-10-17 02:37:12,776] Trial 112 finished with value: 0.3483074367046356 and parameters: {'hidden_dims': '[512, 64]', 'dropout': 0.5710747645547377, 'batch_norm': True, 'graph_on': True, 'source': 'grm', 'knn_k': 7, 'weighted_edges': True, 'symmetrize_mode': 'union', 'lr': 2.934408521738274e-06, 'weight_decay': 1.4889878597630638e-07, 'epochs': 247, 'use_snp_selection': True, 'num_snps': 20000}. Best is trial 92 with value: 0.35022597312927245.
[I 2025-10-17 02:37:49,648] Trial 113 finished with value: 0.3473352253437042 and parameters: {'hidden_dims': '[512, 64]', 'dropout': 0.5738011209339371, 'batch_norm': True, 'graph_on': True, 'source': 'grm', 'knn_k': 7, 'weighted_edges': True, 'symmetrize_mode': 'union', 'lr': 3.0946798001341804e-06, 'weight_decay': 1.9262000637290605e-07, 'epochs': 245, 'use_snp_selection': True, 'num_snps': 16000}. Best is trial 92 with value: 0.35022597312927245.
[I 2025-10-17 02:38:30,921] Trial 114 finished with value: 0.3426173686981201 and parameters: {'hidden_dims': '[512, 64]', 'dropout': 0.5722995903470139, 'batch_norm': True, 'graph_on': True, 'source': 'grm', 'knn_k': 7, 'weighted_edges': True, 'symmetrize_mode': 'union', 'lr': 2.9007358348132437e-06, 'weight_decay': 1.5364976221291453e-07, 'epochs': 251, 'use_snp_selection': True, 'num_snps': 20000}. Best is trial 92 with value: 0.35022597312927245.
[I 2025-10-17 02:39:17,624] Trial 115 finished with value: 0.3434462308883667 and parameters: {'hidden_dims': '[512, 64]', 'dropout': 0.5847272351155869, 'batch_norm': True, 'graph_on': True, 'source': 'grm', 'knn_k': 7, 'weighted_edges': True, 'symmetrize_mode': 'union', 'lr': 3.188264895167921e-06, 'weight_decay': 2.483784718314172e-07, 'epochs': 264, 'use_snp_selection': True, 'num_snps': 24000}. Best is trial 92 with value: 0.35022597312927245.
[I 2025-10-17 02:39:58,265] Trial 116 finished with value: 0.2967847764492035 and parameters: {'hidden_dims': '[512, 64]', 'dropout': 0.5673059209206471, 'batch_norm': True, 'graph_on': True, 'source': 'grm', 'knn_k': 7, 'weighted_edges': True, 'symmetrize_mode': 'union', 'lr': 0.00025747300094124847, 'weight_decay': 1.6724827974315306e-07, 'epochs': 243, 'use_snp_selection': True, 'num_snps': 20000}. Best is trial 92 with value: 0.35022597312927245.
[I 2025-10-17 02:40:32,584] Trial 117 finished with value: 0.3416961312294006 and parameters: {'hidden_dims': '[512, 64]', 'dropout': 0.5930649828956269, 'batch_norm': True, 'graph_on': True, 'source': 'grm', 'knn_k': 7, 'weighted_edges': True, 'symmetrize_mode': 'union', 'lr': 4.037244048575286e-06, 'weight_decay': 1.1234575868058442e-07, 'epochs': 250, 'use_snp_selection': True, 'num_snps': 14000}. Best is trial 92 with value: 0.35022597312927245.
[I 2025-10-17 02:41:10,596] Trial 118 finished with value: 0.34306702613830564 and parameters: {'hidden_dims': '[512, 64]', 'dropout': 0.5787554864866185, 'batch_norm': True, 'graph_on': True, 'source': 'grm', 'knn_k': 7, 'weighted_edges': True, 'symmetrize_mode': 'union', 'lr': 1.5932372014929181e-06, 'weight_decay': 2.288043422525136e-07, 'epochs': 234, 'use_snp_selection': True, 'num_snps': 18000}. Best is trial 92 with value: 0.35022597312927245.
[I 2025-10-17 02:41:46,047] Trial 119 finished with value: 0.34275488257408143 and parameters: {'hidden_dims': '[512, 64]', 'dropout': 0.5600622379097154, 'batch_norm': True, 'graph_on': True, 'source': 'grm', 'knn_k': 7, 'weighted_edges': True, 'symmetrize_mode': 'union', 'lr': 2.762493247181551e-06, 'weight_decay': 3.2086090867665125e-07, 'epochs': 227, 'use_snp_selection': True, 'num_snps': 16000}. Best is trial 92 with value: 0.35022597312927245.
[I 2025-10-17 02:42:22,130] Trial 120 finished with value: 0.34065582752227785 and parameters: {'hidden_dims': '[512, 64]', 'dropout': 0.5508641191967305, 'batch_norm': True, 'graph_on': True, 'source': 'grm', 'knn_k': 7, 'weighted_edges': True, 'symmetrize_mode': 'union', 'lr': 2.014972621179997e-06, 'weight_decay': 1.4353846493507288e-07, 'epochs': 193, 'use_snp_selection': True, 'num_snps': 20000}. Best is trial 92 with value: 0.35022597312927245.
[I 2025-10-17 02:43:09,568] Trial 121 finished with value: 0.3473671734333038 and parameters: {'hidden_dims': '[512, 64]', 'dropout': 0.5818344009001998, 'batch_norm': True, 'graph_on': True, 'source': 'grm', 'knn_k': 7, 'weighted_edges': True, 'symmetrize_mode': 'union', 'lr': 3.56201078397088e-06, 'weight_decay': 3.070030033527226e-07, 'epochs': 240, 'use_snp_selection': True, 'num_snps': 26000}. Best is trial 92 with value: 0.35022597312927245.
[I 2025-10-17 02:43:58,750] Trial 122 finished with value: 0.3445048153400421 and parameters: {'hidden_dims': '[512, 64]', 'dropout': 0.5819952521790299, 'batch_norm': True, 'graph_on': True, 'source': 'grm', 'knn_k': 7, 'weighted_edges': True, 'symmetrize_mode': 'union', 'lr': 3.5614603762854073e-06, 'weight_decay': 3.07920290349189e-07, 'epochs': 255, 'use_snp_selection': True, 'num_snps': 26000}. Best is trial 92 with value: 0.35022597312927245.
[I 2025-10-17 02:44:48,357] Trial 123 finished with value: 0.3520033538341522 and parameters: {'hidden_dims': '[512, 64]', 'dropout': 0.5818585625127153, 'batch_norm': True, 'graph_on': True, 'source': 'grm', 'knn_k': 7, 'weighted_edges': True, 'symmetrize_mode': 'union', 'lr': 4.941895030944401e-06, 'weight_decay': 3.1870108590759753e-07, 'epochs': 259, 'use_snp_selection': True, 'num_snps': 26000}. Best is trial 123 with value: 0.3520033538341522.
[I 2025-10-17 02:45:37,905] Trial 124 finished with value: 0.34356018900871277 and parameters: {'hidden_dims': '[512, 64]', 'dropout': 0.5796254812741255, 'batch_norm': True, 'graph_on': True, 'source': 'grm', 'knn_k': 7, 'weighted_edges': True, 'symmetrize_mode': 'union', 'lr': 6.133177472250779e-06, 'weight_decay': 2.793684179913876e-07, 'epochs': 258, 'use_snp_selection': True, 'num_snps': 26000}. Best is trial 123 with value: 0.3520033538341522.
[I 2025-10-17 02:46:27,252] Trial 125 finished with value: 0.3424577176570892 and parameters: {'hidden_dims': '[512, 64]', 'dropout': 0.5905211570830655, 'batch_norm': True, 'graph_on': True, 'source': 'grm', 'knn_k': 7, 'weighted_edges': True, 'symmetrize_mode': 'union', 'lr': 4.704256837457044e-06, 'weight_decay': 3.4350095128945925e-07, 'epochs': 242, 'use_snp_selection': True, 'num_snps': 28000}. Best is trial 123 with value: 0.3520033538341522.
[I 2025-10-17 02:47:17,843] Trial 126 finished with value: 0.3519160866737366 and parameters: {'hidden_dims': '[512, 64]', 'dropout': 0.562087735847302, 'batch_norm': True, 'graph_on': True, 'source': 'grm', 'knn_k': 7, 'weighted_edges': True, 'symmetrize_mode': 'union', 'lr': 3.5472562972385055e-06, 'weight_decay': 1.022091478567456e-07, 'epochs': 267, 'use_snp_selection': True, 'num_snps': 26000}. Best is trial 123 with value: 0.3520033538341522.
[I 2025-10-17 02:48:03,103] Trial 127 finished with value: 0.3419152021408081 and parameters: {'hidden_dims': '[512, 64]', 'dropout': 0.5681078121494694, 'batch_norm': True, 'graph_on': True, 'source': 'grm', 'knn_k': 7, 'weighted_edges': True, 'symmetrize_mode': 'union', 'lr': 3.302029469299608e-06, 'weight_decay': 1.0075467759804545e-07, 'epochs': 266, 'use_snp_selection': True, 'num_snps': 22000}. Best is trial 123 with value: 0.3520033538341522.
[I 2025-10-17 02:48:57,255] Trial 128 finished with value: 0.3458528876304626 and parameters: {'hidden_dims': '[512, 64]', 'dropout': 0.5977387269202639, 'batch_norm': True, 'graph_on': True, 'source': 'grm', 'knn_k': 7, 'weighted_edges': True, 'symmetrize_mode': 'union', 'lr': 5.146535765496177e-06, 'weight_decay': 2.1041919507874057e-07, 'epochs': 282, 'use_snp_selection': True, 'num_snps': 28000}. Best is trial 123 with value: 0.3520033538341522.
[I 2025-10-17 02:49:51,819] Trial 129 finished with value: 0.3415197491645813 and parameters: {'hidden_dims': '[512, 64]', 'dropout': 0.5615516893448755, 'batch_norm': True, 'graph_on': True, 'source': 'grm', 'knn_k': 7, 'weighted_edges': True, 'symmetrize_mode': 'union', 'lr': 5.1216096721925075e-06, 'weight_decay': 2.32981686454881e-07, 'epochs': 285, 'use_snp_selection': True, 'num_snps': 28000}. Best is trial 123 with value: 0.3520033538341522.
[I 2025-10-17 02:50:39,139] Trial 130 finished with value: 0.3367415189743042 and parameters: {'hidden_dims': '[512, 64]', 'dropout': 0.5487966018683172, 'batch_norm': False, 'graph_on': True, 'source': 'grm', 'knn_k': 7, 'weighted_edges': False, 'symmetrize_mode': 'union', 'lr': 8.588100891666996e-06, 'weight_decay': 1.9260503786103083e-07, 'epochs': 274, 'use_snp_selection': True, 'num_snps': 24000}. Best is trial 123 with value: 0.3520033538341522.
[I 2025-10-17 02:51:30,610] Trial 131 finished with value: 0.34507336616516116 and parameters: {'hidden_dims': '[512, 64]', 'dropout': 0.5969793614808642, 'batch_norm': True, 'graph_on': True, 'source': 'grm', 'knn_k': 7, 'weighted_edges': True, 'symmetrize_mode': 'union', 'lr': 7.3160463387097315e-06, 'weight_decay': 1.273440228234751e-07, 'epochs': 238, 'use_snp_selection': True, 'num_snps': 30000}. Best is trial 123 with value: 0.3520033538341522.
[I 2025-10-17 02:52:22,056] Trial 132 finished with value: 0.34616370797157286 and parameters: {'hidden_dims': '[512, 64]', 'dropout': 0.5999249821233832, 'batch_norm': True, 'graph_on': True, 'source': 'grm', 'knn_k': 7, 'weighted_edges': True, 'symmetrize_mode': 'union', 'lr': 7.142497714401653e-06, 'weight_decay': 1.2133941265420215e-07, 'epochs': 238, 'use_snp_selection': True, 'num_snps': 30000}. Best is trial 123 with value: 0.3520033538341522.
[I 2025-10-17 02:53:09,230] Trial 133 finished with value: 0.3490134119987488 and parameters: {'hidden_dims': '[512, 64]', 'dropout': 0.5729877977407882, 'batch_norm': True, 'graph_on': True, 'source': 'grm', 'knn_k': 7, 'weighted_edges': True, 'symmetrize_mode': 'union', 'lr': 5.8100962171755465e-06, 'weight_decay': 1.260515031585174e-07, 'epochs': 238, 'use_snp_selection': True, 'num_snps': 26000}. Best is trial 123 with value: 0.3520033538341522.
[I 2025-10-17 02:53:59,947] Trial 134 finished with value: 0.3372023403644562 and parameters: {'hidden_dims': '[512, 64]', 'dropout': 0.5998359181831681, 'batch_norm': True, 'graph_on': True, 'source': 'grm', 'knn_k': 7, 'weighted_edges': True, 'symmetrize_mode': 'union', 'lr': 5.648100719743328e-06, 'weight_decay': 1.6517528742452307e-07, 'epochs': 254, 'use_snp_selection': True, 'num_snps': 28000}. Best is trial 123 with value: 0.3520033538341522.
[I 2025-10-17 02:54:50,197] Trial 135 finished with value: 0.3397518754005432 and parameters: {'hidden_dims': '[512, 64]', 'dropout': 0.5689980321201464, 'batch_norm': True, 'graph_on': True, 'source': 'grm', 'knn_k': 7, 'weighted_edges': True, 'symmetrize_mode': 'union', 'lr': 4.498160181824525e-06, 'weight_decay': 1.1799296733482575e-07, 'epochs': 264, 'use_snp_selection': True, 'num_snps': 26000}. Best is trial 123 with value: 0.3520033538341522.
[I 2025-10-17 02:55:38,126] Trial 136 finished with value: 0.34254661202430725 and parameters: {'hidden_dims': '[512, 64]', 'dropout': 0.586604736411864, 'batch_norm': True, 'graph_on': True, 'source': 'grm', 'knn_k': 7, 'weighted_edges': True, 'symmetrize_mode': 'union', 'lr': 7.589684848511642e-06, 'weight_decay': 4.960117242205856e-07, 'epochs': 212, 'use_snp_selection': True, 'num_snps': 30000}. Best is trial 123 with value: 0.3520033538341522.
[I 2025-10-17 02:56:24,217] Trial 137 finished with value: 0.35311723351478574 and parameters: {'hidden_dims': '[512, 64]', 'dropout': 0.5744890258637684, 'batch_norm': True, 'graph_on': True, 'source': 'grm', 'knn_k': 7, 'weighted_edges': True, 'symmetrize_mode': 'union', 'lr': 4.1588952377875785e-06, 'weight_decay': 2.101264356668083e-07, 'epochs': 229, 'use_snp_selection': True, 'num_snps': 26000}. Best is trial 137 with value: 0.35311723351478574.
[I 2025-10-17 02:57:09,662] Trial 138 finished with value: 0.3394333302974701 and parameters: {'hidden_dims': '[512, 64]', 'dropout': 0.5595883696560764, 'batch_norm': True, 'graph_on': True, 'source': 'grm', 'knn_k': 7, 'weighted_edges': True, 'symmetrize_mode': 'union', 'lr': 6.642305036996327e-06, 'weight_decay': 2.0645577822270814e-07, 'epochs': 223, 'use_snp_selection': True, 'num_snps': 26000}. Best is trial 137 with value: 0.35311723351478574.
[I 2025-10-17 02:58:01,289] Trial 139 finished with value: 0.2853974372148514 and parameters: {'hidden_dims': '[512, 64]', 'dropout': 0.5743049905009859, 'batch_norm': True, 'graph_on': True, 'source': 'grm', 'knn_k': 7, 'weighted_edges': True, 'symmetrize_mode': 'mutual', 'lr': 1.3070269524474338e-05, 'weight_decay': 1.4449884957021097e-07, 'epochs': 232, 'use_snp_selection': True, 'num_snps': 32000}. Best is trial 137 with value: 0.35311723351478574.
[I 2025-10-17 02:58:45,099] Trial 140 finished with value: 0.3512376844882965 and parameters: {'hidden_dims': '[512, 64]', 'dropout': 0.5493263553097858, 'batch_norm': True, 'graph_on': True, 'source': 'grm', 'knn_k': 7, 'weighted_edges': True, 'symmetrize_mode': 'union', 'lr': 4.141576085935218e-06, 'weight_decay': 1.0419880412808349e-07, 'epochs': 236, 'use_snp_selection': True, 'num_snps': 24000}. Best is trial 137 with value: 0.35311723351478574.
[I 2025-10-17 02:59:29,117] Trial 141 finished with value: 0.3495413601398468 and parameters: {'hidden_dims': '[512, 64]', 'dropout': 0.5608327788928312, 'batch_norm': True, 'graph_on': True, 'source': 'grm', 'knn_k': 7, 'weighted_edges': True, 'symmetrize_mode': 'union', 'lr': 4.147938783174933e-06, 'weight_decay': 1.010148533800281e-07, 'epochs': 238, 'use_snp_selection': True, 'num_snps': 24000}. Best is trial 137 with value: 0.35311723351478574.
[I 2025-10-17 03:00:13,117] Trial 142 finished with value: 0.3446458220481873 and parameters: {'hidden_dims': '[512, 64]', 'dropout': 0.5452601893074105, 'batch_norm': True, 'graph_on': True, 'source': 'grm', 'knn_k': 7, 'weighted_edges': True, 'symmetrize_mode': 'union', 'lr': 4.114866738543733e-06, 'weight_decay': 1.1243786928041405e-07, 'epochs': 238, 'use_snp_selection': True, 'num_snps': 24000}. Best is trial 137 with value: 0.35311723351478574.
[I 2025-10-17 03:00:54,748] Trial 143 finished with value: 0.34884117245674134 and parameters: {'hidden_dims': '[512, 64]', 'dropout': 0.5621896487491128, 'batch_norm': True, 'graph_on': True, 'source': 'grm', 'knn_k': 7, 'weighted_edges': True, 'symmetrize_mode': 'union', 'lr': 3.8511776689223735e-06, 'weight_decay': 1.053334881971354e-07, 'epochs': 228, 'use_snp_selection': True, 'num_snps': 22000}. Best is trial 137 with value: 0.35311723351478574.
[I 2025-10-17 03:01:36,248] Trial 144 finished with value: 0.34767436385154726 and parameters: {'hidden_dims': '[512, 64]', 'dropout': 0.559349948486962, 'batch_norm': True, 'graph_on': True, 'source': 'grm', 'knn_k': 7, 'weighted_edges': True, 'symmetrize_mode': 'union', 'lr': 3.8213113558046e-06, 'weight_decay': 1.6502728182707963e-07, 'epochs': 229, 'use_snp_selection': True, 'num_snps': 22000}. Best is trial 137 with value: 0.35311723351478574.
[I 2025-10-17 03:02:18,732] Trial 145 finished with value: 0.347441577911377 and parameters: {'hidden_dims': '[512, 64]', 'dropout': 0.5571049860737669, 'batch_norm': True, 'graph_on': True, 'source': 'grm', 'knn_k': 7, 'weighted_edges': True, 'symmetrize_mode': 'union', 'lr': 3.90574229131812e-06, 'weight_decay': 1.6949388514283234e-07, 'epochs': 223, 'use_snp_selection': True, 'num_snps': 24000}. Best is trial 137 with value: 0.35311723351478574.
[I 2025-10-17 03:03:04,104] Trial 146 finished with value: 0.3420683264732361 and parameters: {'hidden_dims': '[512, 64]', 'dropout': 0.5268091853807991, 'batch_norm': True, 'graph_on': True, 'source': 'grm', 'knn_k': 7, 'weighted_edges': True, 'symmetrize_mode': 'union', 'lr': 4.041736209444367e-06, 'weight_decay': 1.0263590065462612e-07, 'epochs': 252, 'use_snp_selection': True, 'num_snps': 24000}. Best is trial 137 with value: 0.35311723351478574.
[I 2025-10-17 03:03:47,723] Trial 147 finished with value: 0.3483627259731293 and parameters: {'hidden_dims': '[512, 64]', 'dropout': 0.5535310447200193, 'batch_norm': True, 'graph_on': True, 'source': 'grm', 'knn_k': 7, 'weighted_edges': True, 'symmetrize_mode': 'union', 'lr': 3.6346527913619436e-06, 'weight_decay': 1.675572022748562e-07, 'epochs': 208, 'use_snp_selection': True, 'num_snps': 26000}. Best is trial 137 with value: 0.35311723351478574.
[I 2025-10-17 03:04:31,253] Trial 148 finished with value: 0.339456844329834 and parameters: {'hidden_dims': '[512, 64]', 'dropout': 0.5342888376490774, 'batch_norm': True, 'graph_on': True, 'source': 'grm', 'knn_k': 7, 'weighted_edges': True, 'symmetrize_mode': 'union', 'lr': 5.814725382672807e-06, 'weight_decay': 1.3245958127884065e-07, 'epochs': 204, 'use_snp_selection': True, 'num_snps': 26000}. Best is trial 137 with value: 0.35311723351478574.
[I 2025-10-17 03:05:12,318] Trial 149 finished with value: 0.35038607120513915 and parameters: {'hidden_dims': '[512, 64]', 'dropout': 0.5537582412433226, 'batch_norm': True, 'graph_on': True, 'source': 'grm', 'knn_k': 7, 'weighted_edges': True, 'symmetrize_mode': 'union', 'lr': 3.659048275219299e-06, 'weight_decay': 1.6444764044782805e-07, 'epochs': 210, 'use_snp_selection': True, 'num_snps': 24000}. Best is trial 137 with value: 0.35311723351478574.
