[I 2025-10-16 18:19:14,699] Trial 84 finished with value: 0.3314147651195526 and parameters: {'hidden_dims': '[512, 256]', 'dropout': 0.20568182218667524, 'batch_norm': True, 'graph_on': True, 'source': 'grm', 'knn_k': 7, 'weighted_edges': True, 'symmetrize_mode': 'union', 'lr': 1.9601897121045262e-06, 'weight_decay': 2.8526105512030595e-05, 'epochs': 97, 'use_snp_selection': True, 'num_snps': 34000}. Best is trial 81 with value: 0.3399097740650177.
[I 2025-10-16 18:19:49,649] Trial 85 finished with value: 0.32942240238189696 and parameters: {'hidden_dims': '[512, 256]', 'dropout': 0.2444792175506253, 'batch_norm': True, 'graph_on': True, 'source': 'grm', 'knn_k': 7, 'weighted_edges': True, 'symmetrize_mode': 'union', 'lr': 5.143701074780439e-06, 'weight_decay': 5.250300003176638e-06, 'epochs': 110, 'use_snp_selection': True, 'num_snps': 32000}. Best is trial 81 with value: 0.3399097740650177.
[I 2025-10-16 18:20:21,232] Trial 86 finished with value: 0.3253303825855255 and parameters: {'hidden_dims': '[512, 256]', 'dropout': 0.3178790976049207, 'batch_norm': True, 'graph_on': True, 'source': 'grm', 'knn_k': 7, 'weighted_edges': True, 'symmetrize_mode': 'union', 'lr': 1.6590211499168387e-06, 'weight_decay': 1.4253876584856238e-05, 'epochs': 121, 'use_snp_selection': True, 'num_snps': 24000}. Best is trial 81 with value: 0.3399097740650177.
[I 2025-10-16 18:20:47,536] Trial 87 finished with value: 0.2676407217979431 and parameters: {'hidden_dims': '[512, 256]', 'dropout': 0.5794585313848482, 'batch_norm': False, 'graph_on': True, 'source': 'grm', 'knn_k': 7, 'weighted_edges': False, 'symmetrize_mode': 'union', 'lr': 3.74517648649271e-06, 'weight_decay': 0.00025325753942332426, 'epochs': 63, 'use_snp_selection': True, 'num_snps': 26000}. Best is trial 81 with value: 0.3399097740650177.
[I 2025-10-16 18:21:19,269] Trial 88 finished with value: 0.3017788648605347 and parameters: {'hidden_dims': '[512, 256]', 'dropout': 0.5021650879752164, 'batch_norm': True, 'graph_on': True, 'source': 'grm', 'knn_k': 1, 'weighted_edges': True, 'symmetrize_mode': 'union', 'lr': 2.590738911400485e-06, 'weight_decay': 3.340328618586172e-06, 'epochs': 109, 'use_snp_selection': True, 'num_snps': 28000}. Best is trial 81 with value: 0.3399097740650177.
[I 2025-10-16 18:21:58,893] Trial 89 finished with value: 0.3330415666103363 and parameters: {'hidden_dims': '[512, 64]', 'dropout': 0.2936855663842307, 'batch_norm': True, 'graph_on': True, 'source': 'grm', 'knn_k': 7, 'weighted_edges': True, 'symmetrize_mode': 'union', 'lr': 1.325499262718776e-06, 'weight_decay': 5.542194096136873e-05, 'epochs': 121, 'use_snp_selection': True, 'num_snps': 38000}. Best is trial 81 with value: 0.3399097740650177.
[I 2025-10-16 18:22:27,449] Trial 90 finished with value: 0.33270602226257323 and parameters: {'hidden_dims': '[512, 256]', 'dropout': 0.16160573643869094, 'batch_norm': True, 'graph_on': True, 'source': 'grm', 'knn_k': 7, 'weighted_edges': True, 'symmetrize_mode': 'union', 'lr': 1.848375141515158e-06, 'weight_decay': 9.571360236060527e-06, 'epochs': 55, 'use_snp_selection': True, 'num_snps': 36000}. Best is trial 81 with value: 0.3399097740650177.
[I 2025-10-16 18:22:55,380] Trial 91 finished with value: 0.32977538704872134 and parameters: {'hidden_dims': '[128, 64]', 'dropout': 0.17862603856568554, 'batch_norm': True, 'graph_on': True, 'source': 'grm', 'knn_k': 6, 'weighted_edges': True, 'symmetrize_mode': 'union', 'lr': 1.4965306514996322e-06, 'weight_decay': 7.06869860021505e-07, 'epochs': 142, 'use_snp_selection': True, 'num_snps': 42000}. Best is trial 81 with value: 0.3399097740650177.
[I 2025-10-16 18:23:25,621] Trial 92 finished with value: 0.32005804777145386 and parameters: {'hidden_dims': '[512, 256]', 'dropout': 0.23013458559903882, 'batch_norm': True, 'graph_on': True, 'source': 'grm', 'knn_k': 7, 'weighted_edges': True, 'symmetrize_mode': 'union', 'lr': 1.0101595773784555e-06, 'weight_decay': 9.06555844456165e-05, 'epochs': 81, 'use_snp_selection': True, 'num_snps': 30000}. Best is trial 81 with value: 0.3399097740650177.
[I 2025-10-16 18:24:15,259] Trial 93 finished with value: 0.31036739945411684 and parameters: {'hidden_dims': '[512, 256]', 'dropout': 0.1861611306595249, 'batch_norm': True, 'graph_on': True, 'source': 'grm', 'knn_k': 6, 'weighted_edges': True, 'symmetrize_mode': 'union', 'lr': 2.348085803063303e-06, 'weight_decay': 9.439341260232975e-07, 'epochs': 150, 'use_snp_selection': True, 'num_snps': 44000}. Best is trial 81 with value: 0.3399097740650177.
[I 2025-10-16 18:24:43,388] Trial 94 finished with value: 0.3216745674610138 and parameters: {'hidden_dims': '[256, 128, 64]', 'dropout': 0.21048923942364972, 'batch_norm': True, 'graph_on': True, 'source': 'grm', 'knn_k': 6, 'weighted_edges': True, 'symmetrize_mode': 'union', 'lr': 1.5513879148627531e-06, 'weight_decay': 3.408324239993756e-05, 'epochs': 95, 'use_snp_selection': True, 'num_snps': 36000}. Best is trial 81 with value: 0.3399097740650177.
[I 2025-10-16 18:25:26,771] Trial 95 finished with value: 0.3256828606128693 and parameters: {'hidden_dims': '[512, 128]', 'dropout': 0.1305916745994798, 'batch_norm': True, 'graph_on': True, 'source': 'grm', 'knn_k': 7, 'weighted_edges': True, 'symmetrize_mode': 'union', 'lr': 1.183651269349894e-06, 'weight_decay': 2.3425515397830204e-07, 'epochs': 104, 'use_snp_selection': True, 'num_snps': 50000}. Best is trial 81 with value: 0.3399097740650177.
[I 2025-10-16 18:26:11,126] Trial 96 finished with value: 0.33869877457618713 and parameters: {'hidden_dims': '[512, 128]', 'dropout': 0.11281058873932973, 'batch_norm': True, 'graph_on': True, 'source': 'grm', 'knn_k': 7, 'weighted_edges': True, 'symmetrize_mode': 'union', 'lr': 1.7393963388255377e-06, 'weight_decay': 1.9990966170318094e-06, 'epochs': 169, 'use_snp_selection': True, 'num_snps': 34000}. Best is trial 81 with value: 0.3399097740650177.
[I 2025-10-16 18:26:49,035] Trial 97 finished with value: 0.3106007695198059 and parameters: {'hidden_dims': '[512, 128]', 'dropout': 0.10150590616650906, 'batch_norm': True, 'graph_on': True, 'source': 'grm', 'knn_k': 7, 'weighted_edges': True, 'symmetrize_mode': 'mutual', 'lr': 1.8233344808042185e-06, 'weight_decay': 2.02129702947469e-06, 'epochs': 134, 'use_snp_selection': True, 'num_snps': 32000}. Best is trial 81 with value: 0.3399097740650177.
[I 2025-10-16 18:27:15,311] Trial 98 finished with value: 0.3420106410980225 and parameters: {'hidden_dims': '[256, 128]', 'dropout': 0.1181471751754915, 'batch_norm': True, 'graph_on': True, 'source': 'grm', 'knn_k': 7, 'weighted_edges': True, 'symmetrize_mode': 'union', 'lr': 3.054261631113536e-06, 'weight_decay': 1.7038281264279889e-06, 'epochs': 86, 'use_snp_selection': True, 'num_snps': 34000}. Best is trial 98 with value: 0.3420106410980225.
[I 2025-10-16 18:27:40,147] Trial 99 finished with value: 0.32377577424049375 and parameters: {'hidden_dims': '[256, 128]', 'dropout': 0.11287285237415813, 'batch_norm': True, 'graph_on': True, 'source': 'grm', 'knn_k': 7, 'weighted_edges': True, 'symmetrize_mode': 'union', 'lr': 8.323772199511746e-06, 'weight_decay': 1.5062864757125887e-06, 'epochs': 68, 'use_snp_selection': True, 'num_snps': 34000}. Best is trial 98 with value: 0.3420106410980225.
[I 2025-10-16 18:28:02,069] Trial 100 finished with value: 0.2494947999715805 and parameters: {'hidden_dims': '[256, 128]', 'dropout': 0.11768962740671494, 'batch_norm': False, 'graph_on': True, 'source': 'grm', 'knn_k': 7, 'weighted_edges': False, 'symmetrize_mode': 'union', 'lr': 3.2969091158994845e-06, 'weight_decay': 1.7125983406684505e-06, 'epochs': 41, 'use_snp_selection': True, 'num_snps': 30000}. Best is trial 98 with value: 0.3420106410980225.
[I 2025-10-16 18:28:28,504] Trial 101 finished with value: 0.3189912557601929 and parameters: {'hidden_dims': '[256, 128]', 'dropout': 0.5530074978283976, 'batch_norm': True, 'graph_on': True, 'source': 'grm', 'knn_k': 7, 'weighted_edges': True, 'symmetrize_mode': 'union', 'lr': 2.2346684822639132e-06, 'weight_decay': 2.538021756325232e-06, 'epochs': 89, 'use_snp_selection': True, 'num_snps': 34000}. Best is trial 98 with value: 0.3420106410980225.
[I 2025-10-16 18:28:54,490] Trial 102 finished with value: 0.31799268126487734 and parameters: {'hidden_dims': '[256, 128]', 'dropout': 0.1565703050624914, 'batch_norm': True, 'graph_on': True, 'source': 'grm', 'knn_k': 7, 'weighted_edges': True, 'symmetrize_mode': 'union', 'lr': 1.3544583921240486e-06, 'weight_decay': 4.448784121988376e-06, 'epochs': 116, 'use_snp_selection': True, 'num_snps': 26000}. Best is trial 98 with value: 0.3420106410980225.
[I 2025-10-16 18:29:20,181] Trial 103 finished with value: 0.3298305034637451 and parameters: {'hidden_dims': '[256, 128]', 'dropout': 0.528376016539587, 'batch_norm': True, 'graph_on': True, 'source': 'grm', 'knn_k': 7, 'weighted_edges': True, 'symmetrize_mode': 'union', 'lr': 3.9208949012829616e-06, 'weight_decay': 5.964931368043599e-06, 'epochs': 84, 'use_snp_selection': True, 'num_snps': 32000}. Best is trial 98 with value: 0.3420106410980225.
[I 2025-10-16 18:30:00,555] Trial 104 finished with value: 0.32289583683013917 and parameters: {'hidden_dims': '[512, 64]', 'dropout': 0.13518966860493759, 'batch_norm': True, 'graph_on': True, 'source': 'grm', 'knn_k': 7, 'weighted_edges': True, 'symmetrize_mode': 'union', 'lr': 2.7057850019903582e-06, 'weight_decay': 9.106782610593971e-06, 'epochs': 126, 'use_snp_selection': True, 'num_snps': 38000}. Best is trial 98 with value: 0.3420106410980225.
[I 2025-10-16 18:30:36,553] Trial 105 finished with value: 0.245191553235054 and parameters: {'hidden_dims': '[512, 128]', 'dropout': 0.11228036457395014, 'batch_norm': True, 'graph_on': True, 'source': 'grm', 'knn_k': 2, 'weighted_edges': True, 'symmetrize_mode': 'union', 'lr': 1.9410806060501487e-05, 'weight_decay': 1.8379847776793755e-05, 'epochs': 107, 'use_snp_selection': True, 'num_snps': 36000}. Best is trial 98 with value: 0.3420106410980225.
[I 2025-10-16 18:31:23,926] Trial 106 finished with value: 0.33362947702407836 and parameters: {'hidden_dims': '[512, 256]', 'dropout': 0.44861046205268895, 'batch_norm': True, 'graph_on': True, 'source': 'grm', 'knn_k': 7, 'weighted_edges': True, 'symmetrize_mode': 'union', 'lr': 2.0259507799732307e-06, 'weight_decay': 5.65714549513902e-07, 'epochs': 188, 'use_snp_selection': True, 'num_snps': 34000}. Best is trial 98 with value: 0.3420106410980225.
[I 2025-10-16 18:32:06,626] Trial 107 finished with value: 0.29797389507293703 and parameters: {'hidden_dims': '[512, 128]', 'dropout': 0.12318422574780878, 'batch_norm': True, 'graph_on': True, 'source': 'grm', 'knn_k': 7, 'weighted_edges': True, 'symmetrize_mode': 'union', 'lr': 2.9718449513332568e-05, 'weight_decay': 1.3162355286814256e-05, 'epochs': 175, 'use_snp_selection': True, 'num_snps': 30000}. Best is trial 98 with value: 0.3420106410980225.
[I 2025-10-16 18:32:49,055] Trial 108 finished with value: 0.32544301748275756 and parameters: {'hidden_dims': '[256, 128]', 'dropout': 0.16656953370856487, 'batch_norm': True, 'graph_on': True, 'source': 'grm', 'knn_k': 6, 'weighted_edges': True, 'symmetrize_mode': 'union', 'lr': 1.7142088324676421e-06, 'weight_decay': 9.483120205741406e-07, 'epochs': 304, 'use_snp_selection': True, 'num_snps': 32000}. Best is trial 98 with value: 0.3420106410980225.
[I 2025-10-16 18:33:20,623] Trial 109 finished with value: 0.322661018371582 and parameters: {'hidden_dims': '[512, 128]', 'dropout': 0.14182552797935455, 'batch_norm': True, 'graph_on': True, 'source': 'grm', 'knn_k': 7, 'weighted_edges': True, 'symmetrize_mode': 'union', 'lr': 1.4228435967508734e-06, 'weight_decay': 8.079795740893682e-07, 'epochs': 53, 'use_snp_selection': True, 'num_snps': 46000}. Best is trial 98 with value: 0.3420106410980225.
[I 2025-10-16 18:33:40,255] Trial 110 finished with value: 0.3198745548725128 and parameters: {'hidden_dims': '[128, 64]', 'dropout': 0.2554054227904798, 'batch_norm': True, 'graph_on': True, 'source': 'grm', 'knn_k': 6, 'weighted_edges': True, 'symmetrize_mode': 'union', 'lr': 4.443727916685008e-05, 'weight_decay': 1.1704263273385376e-06, 'epochs': 22, 'use_snp_selection': True, 'num_snps': 28000}. Best is trial 98 with value: 0.3420106410980225.
[I 2025-10-16 18:34:29,298] Trial 111 finished with value: 0.33749558925628664 and parameters: {'hidden_dims': '[512, 128]', 'dropout': 0.14809734768910693, 'batch_norm': True, 'graph_on': True, 'source': 'grm', 'knn_k': 6, 'weighted_edges': True, 'symmetrize_mode': 'union', 'lr': 1.1617366616853618e-06, 'weight_decay': 7.855701676083214e-05, 'epochs': 165, 'use_snp_selection': True, 'num_snps': 40000}. Best is trial 98 with value: 0.3420106410980225.
[I 2025-10-16 18:35:18,113] Trial 112 finished with value: 0.3308636903762817 and parameters: {'hidden_dims': '[512, 128]', 'dropout': 0.15283163546358058, 'batch_norm': True, 'graph_on': True, 'source': 'grm', 'knn_k': 5, 'weighted_edges': True, 'symmetrize_mode': 'union', 'lr': 1.2070040181295304e-06, 'weight_decay': 7.611100090052205e-05, 'epochs': 156, 'use_snp_selection': True, 'num_snps': 42000}. Best is trial 98 with value: 0.3420106410980225.
[I 2025-10-16 18:35:55,626] Trial 113 finished with value: 0.3365359902381897 and parameters: {'hidden_dims': '[512, 128]', 'dropout': 0.13272214277970265, 'batch_norm': True, 'graph_on': True, 'source': 'grm', 'knn_k': 6, 'weighted_edges': True, 'symmetrize_mode': 'union', 'lr': 1.16387928143501e-06, 'weight_decay': 0.00010257423877369535, 'epochs': 97, 'use_snp_selection': True, 'num_snps': 40000}. Best is trial 98 with value: 0.3420106410980225.
[I 2025-10-16 18:36:33,194] Trial 114 finished with value: 0.3114049196243286 and parameters: {'hidden_dims': '[512, 128]', 'dropout': 0.12633150723351616, 'batch_norm': True, 'graph_on': True, 'source': 'grm', 'knn_k': 6, 'weighted_edges': True, 'symmetrize_mode': 'union', 'lr': 8.56601069843845e-05, 'weight_decay': 7.11922072078546e-05, 'epochs': 97, 'use_snp_selection': True, 'num_snps': 40000}. Best is trial 98 with value: 0.3420106410980225.
[I 2025-10-16 18:37:21,283] Trial 115 finished with value: 0.33341721892356874 and parameters: {'hidden_dims': '[512, 128]', 'dropout': 0.10902639730127195, 'batch_norm': True, 'graph_on': True, 'source': 'grm', 'knn_k': 7, 'weighted_edges': True, 'symmetrize_mode': 'union', 'lr': 1.152570612766765e-06, 'weight_decay': 4.9221060623239036e-05, 'epochs': 181, 'use_snp_selection': True, 'num_snps': 36000}. Best is trial 98 with value: 0.3420106410980225.
[I 2025-10-16 18:37:49,804] Trial 116 finished with value: 0.26736652851104736 and parameters: {'hidden_dims': '[256, 128, 64]', 'dropout': 0.3372180645596652, 'batch_norm': True, 'graph_on': True, 'source': 'grm', 'knn_k': 7, 'weighted_edges': True, 'symmetrize_mode': 'mutual', 'lr': 1.0062509253983397e-06, 'weight_decay': 0.00013311956379056532, 'epochs': 76, 'use_snp_selection': True, 'num_snps': 44000}. Best is trial 98 with value: 0.3420106410980225.
[I 2025-10-16 18:38:35,874] Trial 117 finished with value: 0.3261637628078461 and parameters: {'hidden_dims': '[512, 128]', 'dropout': 0.14325764516683173, 'batch_norm': True, 'graph_on': True, 'source': 'grm', 'knn_k': 6, 'weighted_edges': True, 'symmetrize_mode': 'union', 'lr': 1.949101666457482e-06, 'weight_decay': 0.00015049281424108063, 'epochs': 140, 'use_snp_selection': True, 'num_snps': 42000}. Best is trial 98 with value: 0.3420106410980225.
[I 2025-10-16 18:39:08,599] Trial 118 finished with value: 0.3400402367115021 and parameters: {'hidden_dims': '[256, 128]', 'dropout': 0.1967164408041866, 'batch_norm': True, 'graph_on': True, 'source': 'grm', 'knn_k': 6, 'weighted_edges': True, 'symmetrize_mode': 'union', 'lr': 1.654508914777425e-06, 'weight_decay': 0.00010831754344221849, 'epochs': 166, 'use_snp_selection': True, 'num_snps': 34000}. Best is trial 98 with value: 0.3420106410980225.
[I 2025-10-16 18:39:42,765] Trial 119 finished with value: 0.32919334769248965 and parameters: {'hidden_dims': '[256, 128]', 'dropout': 0.1928734517222974, 'batch_norm': True, 'graph_on': True, 'source': 'grm', 'knn_k': 6, 'weighted_edges': True, 'symmetrize_mode': 'union', 'lr': 2.504469770745817e-06, 'weight_decay': 9.018127703896993e-05, 'epochs': 164, 'use_snp_selection': True, 'num_snps': 38000}. Best is trial 98 with value: 0.3420106410980225.
[I 2025-10-16 18:40:13,085] Trial 120 finished with value: 0.2825376927852631 and parameters: {'hidden_dims': '[256, 128]', 'dropout': 0.22799452476166426, 'batch_norm': False, 'graph_on': True, 'source': 'grm', 'knn_k': 6, 'weighted_edges': False, 'symmetrize_mode': 'union', 'lr': 1.6634522115894905e-06, 'weight_decay': 6.111398924549522e-05, 'epochs': 89, 'use_snp_selection': True, 'num_snps': 48000}. Best is trial 98 with value: 0.3420106410980225.
[I 2025-10-16 18:40:48,585] Trial 121 finished with value: 0.326200270652771 and parameters: {'hidden_dims': '[256, 128]', 'dropout': 0.16605908025492813, 'batch_norm': True, 'graph_on': True, 'source': 'grm', 'knn_k': 5, 'weighted_edges': True, 'symmetrize_mode': 'union', 'lr': 1.4844690598340929e-06, 'weight_decay': 0.00010337188853003736, 'epochs': 203, 'use_snp_selection': True, 'num_snps': 34000}. Best is trial 98 with value: 0.3420106410980225.
[I 2025-10-16 18:41:21,176] Trial 122 finished with value: 0.2925414443016052 and parameters: {'hidden_dims': '[256, 128]', 'dropout': 0.2016188535103077, 'batch_norm': True, 'graph_on': True, 'source': 'grm', 'knn_k': 6, 'weighted_edges': True, 'symmetrize_mode': 'union', 'lr': 0.00030694336228555307, 'weight_decay': 0.00016506689340556853, 'epochs': 172, 'use_snp_selection': True, 'num_snps': 32000}. Best is trial 98 with value: 0.3420106410980225.
[I 2025-10-16 18:42:04,383] Trial 123 finished with value: 0.33798129558563234 and parameters: {'hidden_dims': '[512, 256]', 'dropout': 0.13713708190613919, 'batch_norm': True, 'graph_on': True, 'source': 'grm', 'knn_k': 7, 'weighted_edges': True, 'symmetrize_mode': 'union', 'lr': 2.1108627296562707e-06, 'weight_decay': 0.0002573249831745605, 'epochs': 148, 'use_snp_selection': True, 'num_snps': 36000}. Best is trial 98 with value: 0.3420106410980225.
[I 2025-10-16 18:42:47,440] Trial 124 finished with value: 0.338422954082489 and parameters: {'hidden_dims': '[512, 256]', 'dropout': 0.1325690348337419, 'batch_norm': True, 'graph_on': True, 'source': 'grm', 'knn_k': 7, 'weighted_edges': True, 'symmetrize_mode': 'union', 'lr': 3.0264211211306555e-06, 'weight_decay': 0.0003541240145536246, 'epochs': 147, 'use_snp_selection': True, 'num_snps': 36000}. Best is trial 98 with value: 0.3420106410980225.
[I 2025-10-16 18:43:35,043] Trial 125 finished with value: 0.3285555601119995 and parameters: {'hidden_dims': '[512, 256]', 'dropout': 0.13027012969343524, 'batch_norm': True, 'graph_on': True, 'source': 'grm', 'knn_k': 7, 'weighted_edges': True, 'symmetrize_mode': 'union', 'lr': 2.8706742865435148e-06, 'weight_decay': 0.0005585541039144035, 'epochs': 153, 'use_snp_selection': True, 'num_snps': 40000}. Best is trial 98 with value: 0.3420106410980225.
[I 2025-10-16 18:44:19,058] Trial 126 finished with value: 0.32996789216995237 and parameters: {'hidden_dims': '[512, 256]', 'dropout': 0.1180169720475032, 'batch_norm': True, 'graph_on': True, 'source': 'grm', 'knn_k': 7, 'weighted_edges': True, 'symmetrize_mode': 'union', 'lr': 2.297847374102383e-06, 'weight_decay': 0.0003546637506956, 'epochs': 145, 'use_snp_selection': True, 'num_snps': 38000}. Best is trial 98 with value: 0.3420106410980225.
[I 2025-10-16 18:45:02,484] Trial 127 finished with value: 0.32385587096214297 and parameters: {'hidden_dims': '[512, 256]', 'dropout': 0.1006713963573837, 'batch_norm': True, 'graph_on': True, 'source': 'grm', 'knn_k': 7, 'weighted_edges': True, 'symmetrize_mode': 'union', 'lr': 4.143637173985234e-06, 'weight_decay': 0.00021297191694084823, 'epochs': 159, 'use_snp_selection': True, 'num_snps': 34000}. Best is trial 98 with value: 0.3420106410980225.
[I 2025-10-16 18:45:45,828] Trial 128 finished with value: 0.31896494030952455 and parameters: {'hidden_dims': '[512, 256]', 'dropout': 0.1350475958712287, 'batch_norm': True, 'graph_on': True, 'source': 'grm', 'knn_k': 7, 'weighted_edges': True, 'symmetrize_mode': 'union', 'lr': 5.167341181516446e-06, 'weight_decay': 0.00023782048922917065, 'epochs': 128, 'use_snp_selection': True, 'num_snps': 40000}. Best is trial 98 with value: 0.3420106410980225.
[I 2025-10-16 18:46:17,132] Trial 129 finished with value: 0.33667114973068235 and parameters: {'hidden_dims': '[256, 128]', 'dropout': 0.15022567037710685, 'batch_norm': True, 'graph_on': True, 'source': 'grm', 'knn_k': 7, 'weighted_edges': True, 'symmetrize_mode': 'union', 'lr': 3.3414590371057487e-06, 'weight_decay': 0.00011649403330949145, 'epochs': 135, 'use_snp_selection': True, 'num_snps': 36000}. Best is trial 98 with value: 0.3420106410980225.
[I 2025-10-16 18:46:49,596] Trial 130 finished with value: 0.3296674370765686 and parameters: {'hidden_dims': '[256, 128]', 'dropout': 0.3015734501285233, 'batch_norm': True, 'graph_on': True, 'source': 'grm', 'knn_k': 7, 'weighted_edges': True, 'symmetrize_mode': 'union', 'lr': 6.989615734888196e-06, 'weight_decay': 0.00043583582613664426, 'epochs': 149, 'use_snp_selection': True, 'num_snps': 36000}. Best is trial 98 with value: 0.3420106410980225.
[I 2025-10-16 18:47:19,915] Trial 131 finished with value: 0.33708376288414 and parameters: {'hidden_dims': '[256, 128]', 'dropout': 0.1471704181865864, 'batch_norm': True, 'graph_on': True, 'source': 'grm', 'knn_k': 7, 'weighted_edges': True, 'symmetrize_mode': 'union', 'lr': 3.1644212738432625e-06, 'weight_decay': 0.0001223148836920028, 'epochs': 136, 'use_snp_selection': True, 'num_snps': 34000}. Best is trial 98 with value: 0.3420106410980225.
