[I 2025-10-17 01:14:17,572] Trial 6 finished with value: 0.2917689085006714 and parameters: {'hidden_dims': '[256, 128, 64]', 'dropout': 0.5824426399282747, 'batch_norm': False, 'graph_on': True, 'source': 'grm', 'knn_k': 7, 'weighted_edges': False, 'symmetrize_mode': 'mutual', 'lr': 1.8103274335042867e-06, 'weight_decay': 1.8980551329127457e-06, 'epochs': 168, 'use_snp_selection': True, 'num_snps': 48000}. Best is trial 4 with value: 0.3227506935596466.
[I 2025-10-17 01:15:34,000] Trial 7 finished with value: 0.2993913233280182 and parameters: {'hidden_dims': '[512, 64]', 'dropout': 0.4492085423675365, 'batch_norm': False, 'graph_on': True, 'source': 'grm', 'knn_k': 2, 'weighted_edges': False, 'symmetrize_mode': 'mutual', 'lr': 7.458996247470631e-05, 'weight_decay': 3.63708811960795e-06, 'epochs': 339, 'use_snp_selection': True, 'num_snps': 40000}. Best is trial 4 with value: 0.3227506935596466.
[I 2025-10-17 01:16:12,346] Trial 8 finished with value: 0.33929952383041384 and parameters: {'hidden_dims': '[512, 128]', 'dropout': 0.4855348583679587, 'batch_norm': False, 'graph_on': True, 'source': 'grm', 'knn_k': 4, 'weighted_edges': False, 'symmetrize_mode': 'union', 'lr': 5.347869726837025e-06, 'weight_decay': 0.000825219321368031, 'epochs': 112, 'use_snp_selection': True, 'num_snps': 38000}. Best is trial 8 with value: 0.33929952383041384.
[I 2025-10-17 01:16:31,646] Trial 9 finished with value: 0.3331002175807953 and parameters: {'hidden_dims': '[512, 128]', 'dropout': 0.31141454109750316, 'batch_norm': False, 'graph_on': True, 'source': 'grm', 'knn_k': 3, 'weighted_edges': False, 'symmetrize_mode': 'union', 'lr': 6.926774652277983e-05, 'weight_decay': 0.0009810933865270722, 'epochs': 95, 'use_snp_selection': True, 'num_snps': 4000}. Best is trial 8 with value: 0.33929952383041384.
[I 2025-10-17 01:17:20,506] Trial 10 finished with value: 0.33982003927230836 and parameters: {'hidden_dims': '[512, 128]', 'dropout': 0.4740429507843431, 'batch_norm': True, 'graph_on': True, 'source': 'grm', 'knn_k': 6, 'weighted_edges': True, 'symmetrize_mode': 'union', 'lr': 3.014958777034699e-06, 'weight_decay': 0.0008456324193342337, 'epochs': 103, 'use_snp_selection': True, 'num_snps': 60000}. Best is trial 10 with value: 0.33982003927230836.
[I 2025-10-17 01:18:09,977] Trial 11 finished with value: 0.3354105412960052 and parameters: {'hidden_dims': '[512, 128]', 'dropout': 0.47296614780803475, 'batch_norm': True, 'graph_on': True, 'source': 'grm', 'knn_k': 6, 'weighted_edges': True, 'symmetrize_mode': 'union', 'lr': 3.7460210613156336e-06, 'weight_decay': 0.000988571501865363, 'epochs': 105, 'use_snp_selection': True, 'num_snps': 60000}. Best is trial 10 with value: 0.33982003927230836.
[I 2025-10-17 01:18:49,683] Trial 12 finished with value: 0.34317910075187685 and parameters: {'hidden_dims': '[512, 128]', 'dropout': 0.4822963694533881, 'batch_norm': True, 'graph_on': True, 'source': 'grm', 'knn_k': 5, 'weighted_edges': True, 'symmetrize_mode': 'union', 'lr': 3.353007483207438e-06, 'weight_decay': 0.00020158056220819277, 'epochs': 97, 'use_snp_selection': True, 'num_snps': 44000}. Best is trial 12 with value: 0.34317910075187685.
[I 2025-10-17 01:19:25,109] Trial 13 finished with value: 0.34549073576927186 and parameters: {'hidden_dims': '[512, 128]', 'dropout': 0.3955283515992003, 'batch_norm': True, 'graph_on': True, 'source': 'grm', 'knn_k': 7, 'weighted_edges': True, 'symmetrize_mode': 'union', 'lr': 2.4226646270249322e-06, 'weight_decay': 0.0001230031499879591, 'epochs': 67, 'use_snp_selection': True, 'num_snps': 48000}. Best is trial 13 with value: 0.34549073576927186.
[I 2025-10-17 01:19:57,848] Trial 14 finished with value: 0.3281893730163574 and parameters: {'hidden_dims': '[512, 128]', 'dropout': 0.3649853224536259, 'batch_norm': True, 'graph_on': True, 'source': 'grm', 'knn_k': 7, 'weighted_edges': True, 'symmetrize_mode': 'union', 'lr': 2.7448845736297555e-05, 'weight_decay': 0.00012211904319028993, 'epochs': 54, 'use_snp_selection': True, 'num_snps': 48000}. Best is trial 13 with value: 0.34549073576927186.
[I 2025-10-17 01:20:25,813] Trial 15 finished with value: 0.3207155704498291 and parameters: {'hidden_dims': '[256, 128]', 'dropout': 0.11399899071862205, 'batch_norm': True, 'graph_on': True, 'source': 'grm', 'knn_k': 5, 'weighted_edges': True, 'symmetrize_mode': 'union', 'lr': 1.4185310877642224e-06, 'weight_decay': 8.412784419292537e-05, 'epochs': 72, 'use_snp_selection': True, 'num_snps': 44000}. Best is trial 13 with value: 0.34549073576927186.
[I 2025-10-17 01:20:47,511] Trial 16 finished with value: 0.2986668229103088 and parameters: {'hidden_dims': '[512, 256]', 'dropout': 0.40952256764644107, 'batch_norm': True, 'graph_on': True, 'source': 'grm', 'knn_k': 7, 'weighted_edges': True, 'symmetrize_mode': 'union', 'lr': 2.25645952002303e-05, 'weight_decay': 1.8536802817016367e-05, 'epochs': 12, 'use_snp_selection': True, 'num_snps': 32000}. Best is trial 13 with value: 0.34549073576927186.
[I 2025-10-17 01:21:52,138] Trial 17 finished with value: 0.3148874342441559 and parameters: {'hidden_dims': '[512, 64]', 'dropout': 0.2615140751265874, 'batch_norm': True, 'graph_on': True, 'source': 'grm', 'knn_k': 5, 'weighted_edges': True, 'symmetrize_mode': 'union', 'lr': 2.878156845744116e-06, 'weight_decay': 0.0002115924215959132, 'epochs': 195, 'use_snp_selection': True, 'num_snps': 52000}. Best is trial 13 with value: 0.34549073576927186.
[I 2025-10-17 01:22:38,692] Trial 18 finished with value: 0.31932902336120605 and parameters: {'hidden_dims': '[512, 128]', 'dropout': 0.5282032089933053, 'batch_norm': True, 'graph_on': True, 'source': 'grm', 'knn_k': 6, 'weighted_edges': True, 'symmetrize_mode': 'union', 'lr': 9.008446059000548e-05, 'weight_decay': 3.418851408022533e-05, 'epochs': 142, 'use_snp_selection': True, 'num_snps': 42000}. Best is trial 13 with value: 0.34549073576927186.
[I 2025-10-17 01:23:25,804] Trial 19 finished with value: 0.318498557806015 and parameters: {'hidden_dims': '[512, 128]', 'dropout': 0.40128413899296156, 'batch_norm': True, 'graph_on': True, 'source': 'grm', 'knn_k': 5, 'weighted_edges': True, 'symmetrize_mode': 'union', 'lr': 6.62917566586262e-06, 'weight_decay': 8.411769048458365e-06, 'epochs': 239, 'use_snp_selection': True, 'num_snps': 26000}. Best is trial 13 with value: 0.34549073576927186.
[I 2025-10-17 01:24:04,230] Trial 20 finished with value: 0.3191989541053772 and parameters: {'hidden_dims': '[512, 128]', 'dropout': 0.26893090771095407, 'batch_norm': True, 'graph_on': True, 'source': 'grm', 'knn_k': 3, 'weighted_edges': True, 'symmetrize_mode': 'union', 'lr': 2.484177466184404e-06, 'weight_decay': 0.00033205193081355425, 'epochs': 72, 'use_snp_selection': True, 'num_snps': 54000}. Best is trial 13 with value: 0.34549073576927186.
[I 2025-10-17 01:24:57,473] Trial 21 finished with value: 0.33873543739318845 and parameters: {'hidden_dims': '[512, 128]', 'dropout': 0.5194809473005307, 'batch_norm': True, 'graph_on': True, 'source': 'grm', 'knn_k': 6, 'weighted_edges': True, 'symmetrize_mode': 'union', 'lr': 4.545855558781444e-06, 'weight_decay': 0.0003708096696755049, 'epochs': 126, 'use_snp_selection': True, 'num_snps': 58000}. Best is trial 13 with value: 0.34549073576927186.
[I 2025-10-17 01:25:35,106] Trial 22 finished with value: 0.3314763903617859 and parameters: {'hidden_dims': '[512, 128]', 'dropout': 0.4406146064059172, 'batch_norm': True, 'graph_on': True, 'source': 'grm', 'knn_k': 7, 'weighted_edges': True, 'symmetrize_mode': 'union', 'lr': 1.3309476171886534e-05, 'weight_decay': 4.993553332752009e-05, 'epochs': 78, 'use_snp_selection': True, 'num_snps': 48000}. Best is trial 13 with value: 0.34549073576927186.
[I 2025-10-17 01:26:39,567] Trial 23 finished with value: 0.33374428153038027 and parameters: {'hidden_dims': '[512, 128]', 'dropout': 0.4878058030356964, 'batch_norm': True, 'graph_on': True, 'source': 'grm', 'knn_k': 6, 'weighted_edges': True, 'symmetrize_mode': 'union', 'lr': 1.0088569005439033e-06, 'weight_decay': 0.00047117457126461963, 'epochs': 165, 'use_snp_selection': True, 'num_snps': 60000}. Best is trial 13 with value: 0.34549073576927186.
[I 2025-10-17 01:27:13,895] Trial 24 finished with value: 0.3439981997013092 and parameters: {'hidden_dims': '[512, 128]', 'dropout': 0.35755711905351295, 'batch_norm': True, 'graph_on': True, 'source': 'grm', 'knn_k': 7, 'weighted_edges': True, 'symmetrize_mode': 'union', 'lr': 2.420598842619066e-06, 'weight_decay': 0.0001784331410023612, 'epochs': 55, 'use_snp_selection': True, 'num_snps': 52000}. Best is trial 13 with value: 0.34549073576927186.
[I 2025-10-17 01:27:37,878] Trial 25 finished with value: 0.32025938630104067 and parameters: {'hidden_dims': '[256, 128]', 'dropout': 0.34946120715211776, 'batch_norm': True, 'graph_on': True, 'source': 'grm', 'knn_k': 7, 'weighted_edges': True, 'symmetrize_mode': 'union', 'lr': 2.0727937824556774e-06, 'weight_decay': 6.571572258350343e-05, 'epochs': 46, 'use_snp_selection': True, 'num_snps': 36000}. Best is trial 13 with value: 0.34549073576927186.
[I 2025-10-17 01:28:00,690] Trial 26 finished with value: 0.3365109920501709 and parameters: {'hidden_dims': '[128, 64]', 'dropout': 0.360543468478277, 'batch_norm': True, 'graph_on': True, 'source': 'grm', 'knn_k': 7, 'weighted_edges': True, 'symmetrize_mode': 'union', 'lr': 4.5469559199709326e-05, 'weight_decay': 0.00017593799361319905, 'epochs': 36, 'use_snp_selection': True, 'num_snps': 44000}. Best is trial 13 with value: 0.34549073576927186.
[I 2025-10-17 01:28:37,036] Trial 27 finished with value: 0.32650318145751955 and parameters: {'hidden_dims': '[512, 256]', 'dropout': 0.4248989680663156, 'batch_norm': True, 'graph_on': True, 'source': 'grm', 'knn_k': 5, 'weighted_edges': True, 'symmetrize_mode': 'union', 'lr': 4.707375078230735e-06, 'weight_decay': 9.754561246841796e-06, 'epochs': 64, 'use_snp_selection': True, 'num_snps': 52000}. Best is trial 13 with value: 0.34549073576927186.
[I 2025-10-17 01:29:00,809] Trial 28 finished with value: 0.19758567214012146 and parameters: {'hidden_dims': '[512, 64]', 'dropout': 0.2778190382292169, 'batch_norm': True, 'graph_on': True, 'source': 'grm', 'knn_k': 7, 'weighted_edges': True, 'symmetrize_mode': 'union', 'lr': 1.7348339187371343e-06, 'weight_decay': 1.6031469257218636e-05, 'epochs': 11, 'use_snp_selection': True, 'num_snps': 46000}. Best is trial 13 with value: 0.34549073576927186.
[I 2025-10-17 01:29:22,703] Trial 29 finished with value: 0.3049543559551239 and parameters: {'hidden_dims': '[128, 64]', 'dropout': 0.21988721851785928, 'batch_norm': True, 'graph_on': True, 'source': 'grm', 'knn_k': 2, 'weighted_edges': True, 'symmetrize_mode': 'union', 'lr': 1.619615830957708e-05, 'weight_decay': 3.815035911871326e-05, 'epochs': 87, 'use_snp_selection': True, 'num_snps': 26000}. Best is trial 13 with value: 0.34549073576927186.
[I 2025-10-17 01:30:05,120] Trial 30 finished with value: 0.24541980922222137 and parameters: {'hidden_dims': '[512, 128]', 'dropout': 0.11858828401890467, 'batch_norm': True, 'graph_on': True, 'source': 'grm', 'knn_k': 1, 'weighted_edges': True, 'symmetrize_mode': 'union', 'lr': 0.000344019508914213, 'weight_decay': 0.0002572682533853728, 'epochs': 130, 'use_snp_selection': True, 'num_snps': 40000}. Best is trial 13 with value: 0.34549073576927186.
[I 2025-10-17 01:30:54,897] Trial 31 finished with value: 0.3392921328544617 and parameters: {'hidden_dims': '[512, 128]', 'dropout': 0.378809668782341, 'batch_norm': True, 'graph_on': True, 'source': 'grm', 'knn_k': 6, 'weighted_edges': True, 'symmetrize_mode': 'union', 'lr': 2.856840102282839e-06, 'weight_decay': 0.0004250409984319842, 'epochs': 116, 'use_snp_selection': True, 'num_snps': 56000}. Best is trial 13 with value: 0.34549073576927186.
[I 2025-10-17 01:31:27,526] Trial 32 finished with value: 0.3438840746879578 and parameters: {'hidden_dims': '[512, 128]', 'dropout': 0.4604702174676149, 'batch_norm': True, 'graph_on': True, 'source': 'grm', 'knn_k': 6, 'weighted_edges': True, 'symmetrize_mode': 'union', 'lr': 3.791433396383818e-06, 'weight_decay': 0.00011681832413983558, 'epochs': 51, 'use_snp_selection': True, 'num_snps': 50000}. Best is trial 13 with value: 0.34549073576927186.
[I 2025-10-17 01:31:57,252] Trial 33 finished with value: 0.33864020705223086 and parameters: {'hidden_dims': '[512, 128]', 'dropout': 0.3367022193821474, 'batch_norm': True, 'graph_on': True, 'source': 'grm', 'knn_k': 6, 'weighted_edges': True, 'symmetrize_mode': 'union', 'lr': 9.425763920868817e-06, 'weight_decay': 9.666988532358212e-05, 'epochs': 37, 'use_snp_selection': True, 'num_snps': 50000}. Best is trial 13 with value: 0.34549073576927186.
[I 2025-10-17 01:32:20,959] Trial 34 finished with value: 0.31038307547569277 and parameters: {'hidden_dims': '[128, 64]', 'dropout': 0.30803084880760734, 'batch_norm': True, 'graph_on': True, 'source': 'grm', 'knn_k': 5, 'weighted_edges': True, 'symmetrize_mode': 'mutual', 'lr': 3.901182971261984e-06, 'weight_decay': 5.6001079725374714e-05, 'epochs': 54, 'use_snp_selection': True, 'num_snps': 44000}. Best is trial 13 with value: 0.34549073576927186.
[I 2025-10-17 01:32:41,219] Trial 35 finished with value: 0.3280335009098053 and parameters: {'hidden_dims': '[512, 128]', 'dropout': 0.44216937172995424, 'batch_norm': True, 'graph_on': True, 'source': 'grm', 'knn_k': 7, 'weighted_edges': True, 'symmetrize_mode': 'union', 'lr': 6.475520456646999e-06, 'weight_decay': 0.000151464702457686, 'epochs': 28, 'use_snp_selection': True, 'num_snps': 16000}. Best is trial 13 with value: 0.34549073576927186.
[I 2025-10-17 01:33:14,577] Trial 36 finished with value: 0.29546589255332945 and parameters: {'hidden_dims': '[256, 128]', 'dropout': 0.3941930011756089, 'batch_norm': True, 'graph_on': True, 'source': 'grm', 'knn_k': 4, 'weighted_edges': True, 'symmetrize_mode': 'mutual', 'lr': 0.0007785276786335056, 'weight_decay': 2.141852145715469e-05, 'epochs': 90, 'use_snp_selection': True, 'num_snps': 56000}. Best is trial 13 with value: 0.34549073576927186.
[I 2025-10-17 01:33:41,836] Trial 37 finished with value: 0.23467110395431517 and parameters: {'hidden_dims': '[512, 256]', 'dropout': 0.5630848549974117, 'batch_norm': False, 'graph_on': True, 'source': 'grm', 'knn_k': 6, 'weighted_edges': False, 'symmetrize_mode': 'union', 'lr': 1.4525002376145753e-06, 'weight_decay': 0.0005494566683109755, 'epochs': 57, 'use_snp_selection': True, 'num_snps': 30000}. Best is trial 13 with value: 0.34549073576927186.
[I 2025-10-17 01:34:06,539] Trial 38 finished with value: 0.32107357382774354 and parameters: {'hidden_dims': '[256, 128, 64]', 'dropout': 0.515948408273396, 'batch_norm': True, 'graph_on': True, 'source': 'grm', 'knn_k': 4, 'weighted_edges': True, 'symmetrize_mode': 'mutual', 'lr': 1.0147940607870607e-05, 'weight_decay': 3.341376177985258e-07, 'epochs': 27, 'use_snp_selection': True, 'num_snps': 50000}. Best is trial 13 with value: 0.34549073576927186.
[I 2025-10-17 01:34:51,995] Trial 39 finished with value: 0.3100955605506897 and parameters: {'hidden_dims': '[512, 128]', 'dropout': 0.45199093179980315, 'batch_norm': False, 'graph_on': True, 'source': 'grm', 'knn_k': 7, 'weighted_edges': False, 'symmetrize_mode': 'union', 'lr': 0.00013282022866337715, 'weight_decay': 0.0001903741373196457, 'epochs': 161, 'use_snp_selection': True, 'num_snps': 38000}. Best is trial 13 with value: 0.34549073576927186.
[I 2025-10-17 01:35:44,885] Trial 40 finished with value: 0.30643774271011354 and parameters: {'hidden_dims': '[256, 128, 64]', 'dropout': 0.5532253548564168, 'batch_norm': True, 'graph_on': True, 'source': 'grm', 'knn_k': 5, 'weighted_edges': True, 'symmetrize_mode': 'mutual', 'lr': 2.0637115615117165e-06, 'weight_decay': 5.535258193916491e-06, 'epochs': 256, 'use_snp_selection': True, 'num_snps': 54000}. Best is trial 13 with value: 0.34549073576927186.
[I 2025-10-17 01:36:30,268] Trial 41 finished with value: 0.34191323518753053 and parameters: {'hidden_dims': '[512, 128]', 'dropout': 0.47214086213466966, 'batch_norm': True, 'graph_on': True, 'source': 'grm', 'knn_k': 6, 'weighted_edges': True, 'symmetrize_mode': 'union', 'lr': 3.386087733162138e-06, 'weight_decay': 0.0005856525296736661, 'epochs': 94, 'use_snp_selection': True, 'num_snps': 58000}. Best is trial 13 with value: 0.34549073576927186.
[I 2025-10-17 01:37:10,537] Trial 42 finished with value: 0.3426822066307068 and parameters: {'hidden_dims': '[512, 128]', 'dropout': 0.5008764375667608, 'batch_norm': True, 'graph_on': True, 'source': 'grm', 'knn_k': 6, 'weighted_edges': True, 'symmetrize_mode': 'union', 'lr': 3.49646648820786e-06, 'weight_decay': 0.00011689079068741077, 'epochs': 75, 'use_snp_selection': True, 'num_snps': 56000}. Best is trial 13 with value: 0.34549073576927186.
[I 2025-10-17 01:38:43,427] Trial 43 finished with value: 0.3444837689399719 and parameters: {'hidden_dims': '[512, 128]', 'dropout': 0.5042110445177497, 'batch_norm': True, 'graph_on': True, 'source': 'grm', 'knn_k': 6, 'weighted_edges': True, 'symmetrize_mode': 'union', 'lr': 1.2479953503663852e-06, 'weight_decay': 0.00010629613272837377, 'epochs': 339, 'use_snp_selection': True, 'num_snps': 50000}. Best is trial 13 with value: 0.34549073576927186.
[I 2025-10-17 01:39:52,810] Trial 44 finished with value: 0.3209797263145447 and parameters: {'hidden_dims': '[512, 128]', 'dropout': 0.41554437726075677, 'batch_norm': False, 'graph_on': True, 'source': 'grm', 'knn_k': 7, 'weighted_edges': False, 'symmetrize_mode': 'union', 'lr': 1.2384360004087728e-06, 'weight_decay': 6.677997381108009e-05, 'epochs': 227, 'use_snp_selection': True, 'num_snps': 50000}. Best is trial 13 with value: 0.34549073576927186.
[I 2025-10-17 01:41:14,714] Trial 45 finished with value: 0.31258960962295534 and parameters: {'hidden_dims': '[512, 64]', 'dropout': 0.4562507446956541, 'batch_norm': True, 'graph_on': True, 'source': 'grm', 'knn_k': 5, 'weighted_edges': True, 'symmetrize_mode': 'union', 'lr': 5.755481136096405e-06, 'weight_decay': 0.00027841321546689013, 'epochs': 339, 'use_snp_selection': True, 'num_snps': 42000}. Best is trial 13 with value: 0.34549073576927186.
[I 2025-10-17 01:42:34,074] Trial 46 finished with value: 0.3380221962928772 and parameters: {'hidden_dims': '[512, 128]', 'dropout': 0.5050135259391769, 'batch_norm': True, 'graph_on': True, 'source': 'grm', 'knn_k': 6, 'weighted_edges': True, 'symmetrize_mode': 'union', 'lr': 1.604016407874094e-06, 'weight_decay': 9.177177863958402e-05, 'epochs': 294, 'use_snp_selection': True, 'num_snps': 46000}. Best is trial 13 with value: 0.34549073576927186.
[I 2025-10-17 01:44:07,563] Trial 47 finished with value: 0.3445693254470825 and parameters: {'hidden_dims': '[512, 128]', 'dropout': 0.5938475575217266, 'batch_norm': True, 'graph_on': True, 'source': 'grm', 'knn_k': 7, 'weighted_edges': True, 'symmetrize_mode': 'union', 'lr': 2.2949483258573516e-06, 'weight_decay': 0.00014724296732706704, 'epochs': 323, 'use_snp_selection': True, 'num_snps': 52000}. Best is trial 13 with value: 0.34549073576927186.
[I 2025-10-17 01:45:39,111] Trial 48 finished with value: 0.33709555864334106 and parameters: {'hidden_dims': '[512, 128]', 'dropout': 0.5987688803957761, 'batch_norm': False, 'graph_on': True, 'source': 'grm', 'knn_k': 7, 'weighted_edges': False, 'symmetrize_mode': 'mutual', 'lr': 1.0559675465580017e-06, 'weight_decay': 2.9258288436920775e-05, 'epochs': 319, 'use_snp_selection': True, 'num_snps': 52000}. Best is trial 13 with value: 0.34549073576927186.
[I 2025-10-17 01:46:36,191] Trial 49 finished with value: 0.33994186520576475 and parameters: {'hidden_dims': '[256, 128, 64]', 'dropout': 0.5696350082698078, 'batch_norm': True, 'graph_on': True, 'source': 'grm', 'knn_k': 7, 'weighted_edges': True, 'symmetrize_mode': 'union', 'lr': 2.005723961826331e-06, 'weight_decay': 0.000123543176286347, 'epochs': 322, 'use_snp_selection': True, 'num_snps': 48000}. Best is trial 13 with value: 0.34549073576927186.
[I 2025-10-17 01:47:16,755] Trial 50 finished with value: 0.34165123105049133 and parameters: {'hidden_dims': '[512, 128]', 'dropout': 0.38239211889236036, 'batch_norm': True, 'graph_on': True, 'source': 'grm', 'knn_k': 7, 'weighted_edges': True, 'symmetrize_mode': 'union', 'lr': 1.3953463697641298e-06, 'weight_decay': 4.41024408295151e-05, 'epochs': 291, 'use_snp_selection': True, 'num_snps': 16000}. Best is trial 13 with value: 0.34549073576927186.
[I 2025-10-17 01:48:41,223] Trial 51 finished with value: 0.33062132000923156 and parameters: {'hidden_dims': '[512, 128]', 'dropout': 0.5407298735627931, 'batch_norm': True, 'graph_on': True, 'source': 'grm', 'knn_k': 6, 'weighted_edges': True, 'symmetrize_mode': 'union', 'lr': 2.388784598344681e-06, 'weight_decay': 0.0002104380154951638, 'epochs': 319, 'use_snp_selection': True, 'num_snps': 46000}. Best is trial 13 with value: 0.34549073576927186.
[I 2025-10-17 01:50:19,547] Trial 52 finished with value: 0.3252405166625977 and parameters: {'hidden_dims': '[512, 128]', 'dropout': 0.42935666374738557, 'batch_norm': True, 'graph_on': True, 'source': 'grm', 'knn_k': 7, 'weighted_edges': True, 'symmetrize_mode': 'union', 'lr': 2.710269264909833e-06, 'weight_decay': 0.00014747984251334533, 'epochs': 345, 'use_snp_selection': True, 'num_snps': 52000}. Best is trial 13 with value: 0.34549073576927186.
[I 2025-10-17 01:51:19,463] Trial 53 finished with value: 0.33144624829292296 and parameters: {'hidden_dims': '[512, 128]', 'dropout': 0.5800572718521873, 'batch_norm': True, 'graph_on': True, 'source': 'grm', 'knn_k': 6, 'weighted_edges': True, 'symmetrize_mode': 'union', 'lr': 7.573217066764344e-06, 'weight_decay': 8.374249906165374e-05, 'epochs': 215, 'use_snp_selection': True, 'num_snps': 42000}. Best is trial 13 with value: 0.34549073576927186.
