[I 2025-10-16 17:49:58,529] Trial 36 finished with value: 0.2925093650817871 and parameters: {'hidden_dims': '[256, 128, 64]', 'dropout': 0.399004757613421, 'batch_norm': True, 'graph_on': True, 'source': 'grm', 'knn_k': 4, 'weighted_edges': True, 'symmetrize_mode': 'mutual', 'lr': 1.0300566529468079e-05, 'weight_decay': 6.800214949239367e-05, 'epochs': 66, 'use_snp_selection': True, 'num_snps': 32000}. Best is trial 21 with value: 0.3372834980487823.
[I 2025-10-16 17:50:21,951] Trial 37 finished with value: 0.2950694978237152 and parameters: {'hidden_dims': '[256, 128]', 'dropout': 0.530597948667177, 'batch_norm': True, 'graph_on': True, 'source': 'grm', 'knn_k': 7, 'weighted_edges': True, 'symmetrize_mode': 'union', 'lr': 2.358731705477428e-05, 'weight_decay': 1.1873656933706528e-05, 'epochs': 13, 'use_snp_selection': True, 'num_snps': 56000}. Best is trial 21 with value: 0.3372834980487823.
[I 2025-10-16 17:50:59,292] Trial 38 finished with value: 0.3123326778411865 and parameters: {'hidden_dims': '[512, 128]', 'dropout': 0.31943973689580907, 'batch_norm': True, 'graph_on': True, 'source': 'grm', 'knn_k': 4, 'weighted_edges': True, 'symmetrize_mode': 'union', 'lr': 5.6120815847791315e-06, 'weight_decay': 2.137555737688033e-05, 'epochs': 87, 'use_snp_selection': True, 'num_snps': 44000}. Best is trial 21 with value: 0.3372834980487823.
[I 2025-10-16 17:51:22,096] Trial 39 finished with value: 0.3171648859977722 and parameters: {'hidden_dims': '[128, 64]', 'dropout': 0.44819351009249325, 'batch_norm': False, 'graph_on': True, 'source': 'grm', 'knn_k': 6, 'weighted_edges': False, 'symmetrize_mode': 'union', 'lr': 1.1940777859320512e-05, 'weight_decay': 4.226488242168351e-05, 'epochs': 139, 'use_snp_selection': True, 'num_snps': 22000}. Best is trial 21 with value: 0.3372834980487823.
[I 2025-10-16 17:51:51,670] Trial 40 finished with value: 0.30926249623298646 and parameters: {'hidden_dims': '[256, 128]', 'dropout': 0.19942362661665355, 'batch_norm': True, 'graph_on': True, 'source': 'grm', 'knn_k': 7, 'weighted_edges': True, 'symmetrize_mode': 'mutual', 'lr': 3.241914000206418e-06, 'weight_decay': 0.00019800675962252021, 'epochs': 114, 'use_snp_selection': True, 'num_snps': 38000}. Best is trial 21 with value: 0.3372834980487823.
[I 2025-10-16 17:52:21,319] Trial 41 finished with value: 0.3326089560985565 and parameters: {'hidden_dims': '[256, 128]', 'dropout': 0.4164450821362031, 'batch_norm': True, 'graph_on': True, 'source': 'grm', 'knn_k': 6, 'weighted_edges': True, 'symmetrize_mode': 'union', 'lr': 2.262038064398847e-06, 'weight_decay': 0.000137518797897034, 'epochs': 93, 'use_snp_selection': True, 'num_snps': 44000}. Best is trial 21 with value: 0.3372834980487823.
[I 2025-10-16 17:52:45,942] Trial 42 finished with value: 0.29383867383003237 and parameters: {'hidden_dims': '[256, 128]', 'dropout': 0.40250180778838845, 'batch_norm': True, 'graph_on': True, 'source': 'grm', 'knn_k': 6, 'weighted_edges': True, 'symmetrize_mode': 'union', 'lr': 1.5728202895588073e-06, 'weight_decay': 0.0003689770117907305, 'epochs': 35, 'use_snp_selection': True, 'num_snps': 48000}. Best is trial 21 with value: 0.3372834980487823.
[I 2025-10-16 17:53:16,114] Trial 43 finished with value: 0.3062166690826416 and parameters: {'hidden_dims': '[256, 128]', 'dropout': 0.3805640433130884, 'batch_norm': True, 'graph_on': True, 'source': 'grm', 'knn_k': 5, 'weighted_edges': True, 'symmetrize_mode': 'union', 'lr': 7.170202019909101e-06, 'weight_decay': 0.00016044551224062082, 'epochs': 102, 'use_snp_selection': True, 'num_snps': 42000}. Best is trial 21 with value: 0.3372834980487823.
[I 2025-10-16 17:53:50,342] Trial 44 finished with value: 0.3248940706253052 and parameters: {'hidden_dims': '[512, 256]', 'dropout': 0.42271839050954507, 'batch_norm': True, 'graph_on': True, 'source': 'grm', 'knn_k': 7, 'weighted_edges': True, 'symmetrize_mode': 'union', 'lr': 1.9406923270112326e-06, 'weight_decay': 6.677997381108009e-05, 'epochs': 60, 'use_snp_selection': True, 'num_snps': 50000}. Best is trial 21 with value: 0.3372834980487823.
[I 2025-10-16 17:54:34,937] Trial 45 finished with value: 0.32482646107673646 and parameters: {'hidden_dims': '[256, 128]', 'dropout': 0.32999498917664766, 'batch_norm': True, 'graph_on': True, 'source': 'grm', 'knn_k': 6, 'weighted_edges': True, 'symmetrize_mode': 'union', 'lr': 4.1578271084761036e-06, 'weight_decay': 2.3259319364634973e-05, 'epochs': 298, 'use_snp_selection': True, 'num_snps': 36000}. Best is trial 21 with value: 0.3372834980487823.
[I 2025-10-16 17:55:13,361] Trial 46 finished with value: 0.32502142786979676 and parameters: {'hidden_dims': '[256, 128, 64]', 'dropout': 0.46751622942089993, 'batch_norm': True, 'graph_on': True, 'source': 'grm', 'knn_k': 7, 'weighted_edges': True, 'symmetrize_mode': 'union', 'lr': 2.465810845863507e-06, 'weight_decay': 9.529951689526023e-05, 'epochs': 179, 'use_snp_selection': True, 'num_snps': 42000}. Best is trial 21 with value: 0.3372834980487823.
[I 2025-10-16 17:55:42,456] Trial 47 finished with value: 0.3083667278289795 and parameters: {'hidden_dims': '[256, 128]', 'dropout': 0.1147241343165514, 'batch_norm': False, 'graph_on': True, 'source': 'grm', 'knn_k': 5, 'weighted_edges': False, 'symmetrize_mode': 'union', 'lr': 3.570393343396783e-06, 'weight_decay': 4.435761225637649e-05, 'epochs': 82, 'use_snp_selection': True, 'num_snps': 46000}. Best is trial 21 with value: 0.3372834980487823.
[I 2025-10-16 17:56:21,835] Trial 48 finished with value: 0.3344511091709137 and parameters: {'hidden_dims': '[512, 128]', 'dropout': 0.5207204801371211, 'batch_norm': True, 'graph_on': True, 'source': 'grm', 'knn_k': 6, 'weighted_edges': True, 'symmetrize_mode': 'union', 'lr': 1.2151717203664418e-06, 'weight_decay': 9.316044418441371e-06, 'epochs': 120, 'use_snp_selection': True, 'num_snps': 38000}. Best is trial 21 with value: 0.3372834980487823.
[I 2025-10-16 17:57:01,144] Trial 49 finished with value: 0.32564436793327334 and parameters: {'hidden_dims': '[512, 128]', 'dropout': 0.540042561653813, 'batch_norm': True, 'graph_on': True, 'source': 'grm', 'knn_k': 5, 'weighted_edges': True, 'symmetrize_mode': 'union', 'lr': 1.0420220925516315e-06, 'weight_decay': 2.393085908516617e-06, 'epochs': 120, 'use_snp_selection': True, 'num_snps': 38000}. Best is trial 21 with value: 0.3372834980487823.
[I 2025-10-16 17:57:40,042] Trial 50 finished with value: 0.3387017011642456 and parameters: {'hidden_dims': '[512, 128]', 'dropout': 0.14584289182719573, 'batch_norm': True, 'graph_on': True, 'source': 'grm', 'knn_k': 6, 'weighted_edges': True, 'symmetrize_mode': 'union', 'lr': 1.2845002157290334e-06, 'weight_decay': 9.377814615952429e-07, 'epochs': 140, 'use_snp_selection': True, 'num_snps': 32000}. Best is trial 50 with value: 0.3387017011642456.
[I 2025-10-16 17:58:19,871] Trial 51 finished with value: 0.31811121106147766 and parameters: {'hidden_dims': '[512, 128]', 'dropout': 0.16195921674944985, 'batch_norm': True, 'graph_on': True, 'source': 'grm', 'knn_k': 6, 'weighted_edges': True, 'symmetrize_mode': 'union', 'lr': 1.4461280375561173e-06, 'weight_decay': 7.776674360117824e-07, 'epochs': 147, 'use_snp_selection': True, 'num_snps': 32000}. Best is trial 50 with value: 0.3387017011642456.
[I 2025-10-16 17:58:59,734] Trial 52 finished with value: 0.3343527436256409 and parameters: {'hidden_dims': '[512, 128]', 'dropout': 0.14796193657110462, 'batch_norm': True, 'graph_on': True, 'source': 'grm', 'knn_k': 6, 'weighted_edges': True, 'symmetrize_mode': 'union', 'lr': 1.2152348889385593e-06, 'weight_decay': 4.15745591932629e-07, 'epochs': 130, 'use_snp_selection': True, 'num_snps': 36000}. Best is trial 50 with value: 0.3387017011642456.
[I 2025-10-16 17:59:39,332] Trial 53 finished with value: 0.3358741164207458 and parameters: {'hidden_dims': '[512, 128]', 'dropout': 0.15495392289646412, 'batch_norm': True, 'graph_on': True, 'source': 'grm', 'knn_k': 5, 'weighted_edges': True, 'symmetrize_mode': 'union', 'lr': 1.3229731321831984e-06, 'weight_decay': 4.254666079977e-07, 'epochs': 168, 'use_snp_selection': True, 'num_snps': 28000}. Best is trial 50 with value: 0.3387017011642456.
[I 2025-10-16 18:00:18,110] Trial 54 finished with value: 0.32899832129478457 and parameters: {'hidden_dims': '[512, 128]', 'dropout': 0.14714563637813535, 'batch_norm': True, 'graph_on': True, 'source': 'grm', 'knn_k': 5, 'weighted_edges': True, 'symmetrize_mode': 'union', 'lr': 1.2466833649885506e-06, 'weight_decay': 5.357433755342433e-07, 'epochs': 193, 'use_snp_selection': True, 'num_snps': 24000}. Best is trial 50 with value: 0.3387017011642456.
[I 2025-10-16 18:00:59,419] Trial 55 finished with value: 0.3335430145263672 and parameters: {'hidden_dims': '[512, 128]', 'dropout': 0.24026717461253055, 'batch_norm': True, 'graph_on': True, 'source': 'grm', 'knn_k': 4, 'weighted_edges': True, 'symmetrize_mode': 'union', 'lr': 1.0498657858909916e-06, 'weight_decay': 3.121741772477954e-07, 'epochs': 166, 'use_snp_selection': True, 'num_snps': 30000}. Best is trial 50 with value: 0.3387017011642456.
[I 2025-10-16 18:01:37,961] Trial 56 finished with value: 0.3271754622459412 and parameters: {'hidden_dims': '[512, 128]', 'dropout': 0.17138265336821346, 'batch_norm': True, 'graph_on': True, 'source': 'grm', 'knn_k': 5, 'weighted_edges': True, 'symmetrize_mode': 'union', 'lr': 1.7849465787736666e-06, 'weight_decay': 1.3893914086380229e-06, 'epochs': 169, 'use_snp_selection': True, 'num_snps': 26000}. Best is trial 50 with value: 0.3387017011642456.
[I 2025-10-16 18:02:11,776] Trial 57 finished with value: 0.29921109080314634 and parameters: {'hidden_dims': '[512, 128]', 'dropout': 0.2301176115219113, 'batch_norm': True, 'graph_on': True, 'source': 'grm', 'knn_k': 5, 'weighted_edges': True, 'symmetrize_mode': 'mutual', 'lr': 2.565864573337281e-06, 'weight_decay': 1.629246674602553e-07, 'epochs': 215, 'use_snp_selection': True, 'num_snps': 16000}. Best is trial 50 with value: 0.3387017011642456.
[I 2025-10-16 18:02:46,997] Trial 58 finished with value: 0.29636881947517396 and parameters: {'hidden_dims': '[512, 128]', 'dropout': 0.10286751752608114, 'batch_norm': False, 'graph_on': True, 'source': 'grm', 'knn_k': 6, 'weighted_edges': False, 'symmetrize_mode': 'union', 'lr': 1.3318703351725137e-06, 'weight_decay': 3.6639639012610693e-07, 'epochs': 133, 'use_snp_selection': True, 'num_snps': 28000}. Best is trial 50 with value: 0.3387017011642456.
[I 2025-10-16 18:03:26,598] Trial 59 finished with value: 0.29769988656044005 and parameters: {'hidden_dims': '[512, 128]', 'dropout': 0.13596106128656862, 'batch_norm': True, 'graph_on': True, 'source': 'grm', 'knn_k': 5, 'weighted_edges': True, 'symmetrize_mode': 'union', 'lr': 0.00012529760139847273, 'weight_decay': 1.3184886194129964e-06, 'epochs': 137, 'use_snp_selection': True, 'num_snps': 34000}. Best is trial 50 with value: 0.3387017011642456.
[I 2025-10-16 18:04:09,209] Trial 60 finished with value: 0.33286280035972593 and parameters: {'hidden_dims': '[512, 128]', 'dropout': 0.17407016955994287, 'batch_norm': True, 'graph_on': True, 'source': 'grm', 'knn_k': 6, 'weighted_edges': True, 'symmetrize_mode': 'union', 'lr': 1.9283417424734802e-06, 'weight_decay': 5.626884509781816e-07, 'epochs': 148, 'use_snp_selection': True, 'num_snps': 36000}. Best is trial 50 with value: 0.3387017011642456.
[I 2025-10-16 18:04:51,684] Trial 61 finished with value: 0.3331119120121002 and parameters: {'hidden_dims': '[512, 128]', 'dropout': 0.22319598551633807, 'batch_norm': True, 'graph_on': True, 'source': 'grm', 'knn_k': 4, 'weighted_edges': True, 'symmetrize_mode': 'union', 'lr': 1.0466251689410118e-06, 'weight_decay': 2.4031336528266177e-07, 'epochs': 176, 'use_snp_selection': True, 'num_snps': 30000}. Best is trial 50 with value: 0.3387017011642456.
[I 2025-10-16 18:05:30,478] Trial 62 finished with value: 0.3254010796546936 and parameters: {'hidden_dims': '[512, 128]', 'dropout': 0.25870462847464354, 'batch_norm': True, 'graph_on': True, 'source': 'grm', 'knn_k': 4, 'weighted_edges': True, 'symmetrize_mode': 'union', 'lr': 1.0988363287718042e-06, 'weight_decay': 3.2237408088562115e-07, 'epochs': 162, 'use_snp_selection': True, 'num_snps': 28000}. Best is trial 50 with value: 0.3387017011642456.
[I 2025-10-16 18:06:17,131] Trial 63 finished with value: 0.3260776400566101 and parameters: {'hidden_dims': '[512, 128]', 'dropout': 0.18811178856154964, 'batch_norm': True, 'graph_on': True, 'source': 'grm', 'knn_k': 4, 'weighted_edges': True, 'symmetrize_mode': 'union', 'lr': 1.6163490773017624e-06, 'weight_decay': 4.746774875838309e-07, 'epochs': 198, 'use_snp_selection': True, 'num_snps': 32000}. Best is trial 50 with value: 0.3387017011642456.
[I 2025-10-16 18:06:52,134] Trial 64 finished with value: 0.3138381361961365 and parameters: {'hidden_dims': '[512, 128]', 'dropout': 0.15144978036020368, 'batch_norm': True, 'graph_on': True, 'source': 'grm', 'knn_k': 3, 'weighted_edges': True, 'symmetrize_mode': 'union', 'lr': 2.8347028234693485e-06, 'weight_decay': 1.7312815741498346e-07, 'epochs': 159, 'use_snp_selection': True, 'num_snps': 24000}. Best is trial 50 with value: 0.3387017011642456.
[I 2025-10-16 18:07:31,356] Trial 65 finished with value: 0.32379022240638733 and parameters: {'hidden_dims': '[512, 256]', 'dropout': 0.21897847202169113, 'batch_norm': True, 'graph_on': True, 'source': 'grm', 'knn_k': 3, 'weighted_edges': True, 'symmetrize_mode': 'union', 'lr': 1.4017059519959305e-06, 'weight_decay': 2.8927173501140725e-07, 'epochs': 126, 'use_snp_selection': True, 'num_snps': 36000}. Best is trial 50 with value: 0.3387017011642456.
[I 2025-10-16 18:08:24,260] Trial 66 finished with value: 0.3103182852268219 and parameters: {'hidden_dims': '[512, 128]', 'dropout': 0.28030019021797425, 'batch_norm': True, 'graph_on': True, 'source': 'grm', 'knn_k': 7, 'weighted_edges': True, 'symmetrize_mode': 'union', 'lr': 5.274081508861922e-05, 'weight_decay': 1.704603195153117e-07, 'epochs': 186, 'use_snp_selection': True, 'num_snps': 40000}. Best is trial 50 with value: 0.3387017011642456.
[I 2025-10-16 18:08:59,193] Trial 67 finished with value: 0.3362753987312317 and parameters: {'hidden_dims': '[512, 128]', 'dropout': 0.12382411100906124, 'batch_norm': True, 'graph_on': True, 'source': 'grm', 'knn_k': 6, 'weighted_edges': True, 'symmetrize_mode': 'union', 'lr': 1.0212477402462912e-06, 'weight_decay': 6.968167788850108e-07, 'epochs': 104, 'use_snp_selection': True, 'num_snps': 34000}. Best is trial 50 with value: 0.3387017011642456.
[I 2025-10-16 18:09:17,629] Trial 68 finished with value: 0.18524908423423767 and parameters: {'hidden_dims': '[512, 128]', 'dropout': 0.1264843853015227, 'batch_norm': True, 'graph_on': True, 'source': 'grm', 'knn_k': 6, 'weighted_edges': True, 'symmetrize_mode': 'mutual', 'lr': 2.1158938373650538e-06, 'weight_decay': 2.892264863215109e-06, 'epochs': 101, 'use_snp_selection': True, 'num_snps': 2000}. Best is trial 50 with value: 0.3387017011642456.
[I 2025-10-16 18:09:56,384] Trial 69 finished with value: 0.33186256885528564 and parameters: {'hidden_dims': '[512, 64]', 'dropout': 0.10431684261483141, 'batch_norm': True, 'graph_on': True, 'source': 'grm', 'knn_k': 6, 'weighted_edges': True, 'symmetrize_mode': 'union', 'lr': 1.274135104620799e-06, 'weight_decay': 6.759289528310683e-07, 'epochs': 116, 'use_snp_selection': True, 'num_snps': 38000}. Best is trial 50 with value: 0.3387017011642456.
[I 2025-10-16 18:10:36,799] Trial 70 finished with value: 0.30633525252342225 and parameters: {'hidden_dims': '[512, 128]', 'dropout': 0.14334113602076803, 'batch_norm': False, 'graph_on': True, 'source': 'grm', 'knn_k': 7, 'weighted_edges': False, 'symmetrize_mode': 'union', 'lr': 1.7723503151876672e-06, 'weight_decay': 1.215783686270647e-06, 'epochs': 143, 'use_snp_selection': True, 'num_snps': 34000}. Best is trial 50 with value: 0.3387017011642456.
[I 2025-10-16 18:11:13,314] Trial 71 finished with value: 0.33295207023620604 and parameters: {'hidden_dims': '[512, 128]', 'dropout': 0.12409863217040841, 'batch_norm': True, 'graph_on': True, 'source': 'grm', 'knn_k': 5, 'weighted_edges': True, 'symmetrize_mode': 'union', 'lr': 1.0503990486314509e-06, 'weight_decay': 3.91453594841328e-06, 'epochs': 130, 'use_snp_selection': True, 'num_snps': 30000}. Best is trial 50 with value: 0.3387017011642456.
[I 2025-10-16 18:12:03,302] Trial 72 finished with value: 0.334449428319931 and parameters: {'hidden_dims': '[512, 128]', 'dropout': 0.18021938801152884, 'batch_norm': True, 'graph_on': True, 'source': 'grm', 'knn_k': 6, 'weighted_edges': True, 'symmetrize_mode': 'union', 'lr': 1.5330279786631328e-06, 'weight_decay': 3.651396846821902e-07, 'epochs': 170, 'use_snp_selection': True, 'num_snps': 40000}. Best is trial 50 with value: 0.3387017011642456.
[I 2025-10-16 18:12:50,911] Trial 73 finished with value: 0.32416958212852476 and parameters: {'hidden_dims': '[512, 128]', 'dropout': 0.1747444856944722, 'batch_norm': True, 'graph_on': True, 'source': 'grm', 'knn_k': 6, 'weighted_edges': True, 'symmetrize_mode': 'union', 'lr': 3.0160405361578985e-06, 'weight_decay': 4.1068516016655145e-07, 'epochs': 156, 'use_snp_selection': True, 'num_snps': 40000}. Best is trial 50 with value: 0.3387017011642456.
[I 2025-10-16 18:13:14,816] Trial 74 finished with value: 0.3160041034221649 and parameters: {'hidden_dims': '[128, 64]', 'dropout': 0.19522779866808426, 'batch_norm': True, 'graph_on': True, 'source': 'grm', 'knn_k': 6, 'weighted_edges': True, 'symmetrize_mode': 'union', 'lr': 1.5510732495945656e-06, 'weight_decay': 2.2141375529206626e-07, 'epochs': 101, 'use_snp_selection': True, 'num_snps': 34000}. Best is trial 50 with value: 0.3387017011642456.
[I 2025-10-16 18:13:38,756] Trial 75 finished with value: 0.31516125798225403 and parameters: {'hidden_dims': '[256, 128, 64]', 'dropout': 0.13786589297799962, 'batch_norm': True, 'graph_on': True, 'source': 'grm', 'knn_k': 7, 'weighted_edges': True, 'symmetrize_mode': 'union', 'lr': 2.290642450232906e-06, 'weight_decay': 1.0716875512543448e-06, 'epochs': 210, 'use_snp_selection': True, 'num_snps': 8000}. Best is trial 50 with value: 0.3387017011642456.
[I 2025-10-16 18:14:41,226] Trial 76 finished with value: 0.322355055809021 and parameters: {'hidden_dims': '[512, 128]', 'dropout': 0.15817810893919415, 'batch_norm': True, 'graph_on': True, 'source': 'grm', 'knn_k': 6, 'weighted_edges': True, 'symmetrize_mode': 'union', 'lr': 1.2527733539313139e-06, 'weight_decay': 1.58452602614007e-06, 'epochs': 242, 'use_snp_selection': True, 'num_snps': 40000}. Best is trial 50 with value: 0.3387017011642456.
[I 2025-10-16 18:15:18,823] Trial 77 finished with value: 0.3360507845878601 and parameters: {'hidden_dims': '[512, 256]', 'dropout': 0.21010545799311162, 'batch_norm': True, 'graph_on': True, 'source': 'grm', 'knn_k': 7, 'weighted_edges': True, 'symmetrize_mode': 'union', 'lr': 1.593769344991136e-06, 'weight_decay': 1.1603632383282758e-07, 'epochs': 113, 'use_snp_selection': True, 'num_snps': 36000}. Best is trial 50 with value: 0.3387017011642456.
[I 2025-10-16 18:16:01,998] Trial 78 finished with value: 0.32740779519081115 and parameters: {'hidden_dims': '[512, 256]', 'dropout': 0.18827149377174984, 'batch_norm': True, 'graph_on': True, 'source': 'grm', 'knn_k': 7, 'weighted_edges': True, 'symmetrize_mode': 'union', 'lr': 3.4194988855316755e-06, 'weight_decay': 1.1831588015824056e-07, 'epochs': 110, 'use_snp_selection': True, 'num_snps': 46000}. Best is trial 50 with value: 0.3387017011642456.
[I 2025-10-16 18:16:33,981] Trial 79 finished with value: 0.29848345518112185 and parameters: {'hidden_dims': '[512, 256]', 'dropout': 0.36540102273613856, 'batch_norm': True, 'graph_on': True, 'source': 'grm', 'knn_k': 7, 'weighted_edges': True, 'symmetrize_mode': 'mutual', 'lr': 4.55563831917868e-06, 'weight_decay': 1.3264140497568797e-07, 'epochs': 73, 'use_snp_selection': True, 'num_snps': 38000}. Best is trial 50 with value: 0.3387017011642456.
[I 2025-10-16 18:17:06,831] Trial 80 finished with value: 0.33906136751174926 and parameters: {'hidden_dims': '[512, 256]', 'dropout': 0.2109420042084317, 'batch_norm': True, 'graph_on': True, 'source': 'grm', 'knn_k': 7, 'weighted_edges': True, 'symmetrize_mode': 'union', 'lr': 2.013224417042615e-06, 'weight_decay': 8.866583793239102e-06, 'epochs': 95, 'use_snp_selection': True, 'num_snps': 32000}. Best is trial 80 with value: 0.33906136751174926.
[I 2025-10-16 18:17:39,580] Trial 81 finished with value: 0.3399097740650177 and parameters: {'hidden_dims': '[512, 256]', 'dropout': 0.21399937364898047, 'batch_norm': True, 'graph_on': True, 'source': 'grm', 'knn_k': 7, 'weighted_edges': True, 'symmetrize_mode': 'union', 'lr': 1.999618788681134e-06, 'weight_decay': 1.2697409983526783e-05, 'epochs': 94, 'use_snp_selection': True, 'num_snps': 32000}. Best is trial 81 with value: 0.3399097740650177.
[I 2025-10-16 18:18:11,945] Trial 82 finished with value: 0.33370964527130126 and parameters: {'hidden_dims': '[512, 256]', 'dropout': 0.21222617745012715, 'batch_norm': True, 'graph_on': True, 'source': 'grm', 'knn_k': 7, 'weighted_edges': True, 'symmetrize_mode': 'union', 'lr': 2.1429075912490124e-06, 'weight_decay': 7.411288569478049e-06, 'epochs': 91, 'use_snp_selection': True, 'num_snps': 32000}. Best is trial 81 with value: 0.3399097740650177.
[I 2025-10-16 18:18:40,654] Trial 83 finished with value: 0.326063472032547 and parameters: {'hidden_dims': '[512, 256]', 'dropout': 0.2712924136496212, 'batch_norm': True, 'graph_on': True, 'source': 'grm', 'knn_k': 7, 'weighted_edges': True, 'symmetrize_mode': 'union', 'lr': 2.8028946097657086e-06, 'weight_decay': 1.0883937176592973e-05, 'epochs': 77, 'use_snp_selection': True, 'num_snps': 28000}. Best is trial 81 with value: 0.3399097740650177.
