[I 2025-10-16 23:52:41,295] Trial 12 finished with value: 0.31731027364730835 and parameters: {'hidden_dims': '[512, 64]', 'dropout': 0.35019340741861255, 'batch_norm': True, 'graph_on': True, 'source': 'grm', 'knn_k': 5, 'weighted_edges': True, 'symmetrize_mode': 'union', 'lr': 3.0454205372733332e-06, 'weight_decay': 0.0005712270851809406, 'epochs': 161, 'use_snp_selection': True, 'num_snps': 34000}. Best is trial 11 with value: 0.3223285496234894.
[I 2025-10-16 23:53:01,155] Trial 13 finished with value: 0.28851165175437926 and parameters: {'hidden_dims': '[512, 128]', 'dropout': 0.25352344068386523, 'batch_norm': True, 'graph_on': True, 'source': 'grm', 'knn_k': 6, 'weighted_edges': True, 'symmetrize_mode': 'union', 'lr': 3.220061187901276e-06, 'weight_decay': 3.115797140866395e-05, 'epochs': 77, 'use_snp_selection': True, 'num_snps': 6000}. Best is trial 11 with value: 0.3223285496234894.
[I 2025-10-16 23:53:43,247] Trial 14 finished with value: 0.29521504044532776 and parameters: {'hidden_dims': '[256, 128, 64]', 'dropout': 0.4620071939754916, 'batch_norm': True, 'graph_on': True, 'source': 'grm', 'knn_k': 5, 'weighted_edges': True, 'symmetrize_mode': 'union', 'lr': 3.395863860154344e-05, 'weight_decay': 6.985646420233191e-06, 'epochs': 193, 'use_snp_selection': True, 'num_snps': 46000}. Best is trial 11 with value: 0.3223285496234894.
[I 2025-10-16 23:54:06,923] Trial 15 finished with value: 0.32677879333496096 and parameters: {'hidden_dims': '[256, 128]', 'dropout': 0.380365898425765, 'batch_norm': True, 'graph_on': True, 'source': 'grm', 'knn_k': 7, 'weighted_edges': True, 'symmetrize_mode': 'union', 'lr': 4.74330039808902e-06, 'weight_decay': 0.0001766341487564716, 'epochs': 73, 'use_snp_selection': True, 'num_snps': 26000}. Best is trial 15 with value: 0.32677879333496096.
[I 2025-10-16 23:54:30,050] Trial 16 finished with value: 0.3173753619194031 and parameters: {'hidden_dims': '[256, 128]', 'dropout': 0.48303306183530675, 'batch_norm': True, 'graph_on': True, 'source': 'grm', 'knn_k': 3, 'weighted_edges': True, 'symmetrize_mode': 'union', 'lr': 7.701333547960312e-06, 'weight_decay': 0.00027478619033360294, 'epochs': 66, 'use_snp_selection': True, 'num_snps': 26000}. Best is trial 15 with value: 0.32677879333496096.
[I 2025-10-16 23:54:50,531] Trial 17 finished with value: 0.32155974507331847 and parameters: {'hidden_dims': '[256, 128]', 'dropout': 0.5741974551696398, 'batch_norm': True, 'graph_on': True, 'source': 'grm', 'knn_k': 6, 'weighted_edges': True, 'symmetrize_mode': 'union', 'lr': 1.3528230031176427e-05, 'weight_decay': 8.107869086034154e-05, 'epochs': 69, 'use_snp_selection': True, 'num_snps': 14000}. Best is trial 15 with value: 0.32677879333496096.
[I 2025-10-16 23:55:28,464] Trial 18 finished with value: 0.32282292246818545 and parameters: {'hidden_dims': '[512, 256]', 'dropout': 0.4016582146827277, 'batch_norm': False, 'graph_on': True, 'source': 'grm', 'knn_k': 5, 'weighted_edges': False, 'symmetrize_mode': 'mutual', 'lr': 2.60780055176315e-05, 'weight_decay': 0.0003219573978591418, 'epochs': 165, 'use_snp_selection': True, 'num_snps': 26000}. Best is trial 15 with value: 0.32677879333496096.
[I 2025-10-16 23:55:48,555] Trial 19 finished with value: 0.26851826906204224 and parameters: {'hidden_dims': '[256, 128]', 'dropout': 0.2804031803170345, 'batch_norm': False, 'graph_on': True, 'source': 'grm', 'knn_k': 3, 'weighted_edges': False, 'symmetrize_mode': 'mutual', 'lr': 0.00016793003902660844, 'weight_decay': 0.0009982036767066734, 'epochs': 239, 'use_snp_selection': True, 'num_snps': 2000}. Best is trial 15 with value: 0.32677879333496096.
[I 2025-10-16 23:56:20,232] Trial 20 finished with value: 0.3199484050273895 and parameters: {'hidden_dims': '[512, 256]', 'dropout': 0.4221100968027565, 'batch_norm': False, 'graph_on': True, 'source': 'grm', 'knn_k': 7, 'weighted_edges': False, 'symmetrize_mode': 'mutual', 'lr': 2.310137194389767e-05, 'weight_decay': 0.0003467022962468008, 'epochs': 148, 'use_snp_selection': True, 'num_snps': 20000}. Best is trial 15 with value: 0.32677879333496096.
[I 2025-10-16 23:56:50,789] Trial 21 finished with value: 0.3234648823738098 and parameters: {'hidden_dims': '[512, 256]', 'dropout': 0.3807716375701576, 'batch_norm': False, 'graph_on': True, 'source': 'grm', 'knn_k': 5, 'weighted_edges': False, 'symmetrize_mode': 'mutual', 'lr': 4.973862557891448e-06, 'weight_decay': 0.0001554453307665363, 'epochs': 92, 'use_snp_selection': True, 'num_snps': 28000}. Best is trial 15 with value: 0.32677879333496096.
[I 2025-10-16 23:57:32,278] Trial 22 finished with value: 0.3066950023174286 and parameters: {'hidden_dims': '[512, 256]', 'dropout': 0.35888571073607295, 'batch_norm': False, 'graph_on': True, 'source': 'grm', 'knn_k': 4, 'weighted_edges': False, 'symmetrize_mode': 'mutual', 'lr': 3.393339078137103e-05, 'weight_decay': 0.00023898049797539605, 'epochs': 171, 'use_snp_selection': True, 'num_snps': 30000}. Best is trial 15 with value: 0.32677879333496096.
[I 2025-10-16 23:58:08,865] Trial 23 finished with value: 0.30958165526390075 and parameters: {'hidden_dims': '[512, 256]', 'dropout': 0.3126459972486339, 'batch_norm': False, 'graph_on': True, 'source': 'grm', 'knn_k': 5, 'weighted_edges': False, 'symmetrize_mode': 'mutual', 'lr': 1.8777049027384127e-06, 'weight_decay': 6.243690797674961e-05, 'epochs': 101, 'use_snp_selection': True, 'num_snps': 38000}. Best is trial 15 with value: 0.32677879333496096.
[I 2025-10-16 23:58:39,937] Trial 24 finished with value: 0.322712117433548 and parameters: {'hidden_dims': '[256, 128]', 'dropout': 0.43527119823713184, 'batch_norm': False, 'graph_on': True, 'source': 'grm', 'knn_k': 4, 'weighted_edges': False, 'symmetrize_mode': 'mutual', 'lr': 6.162484705761059e-06, 'weight_decay': 0.00044305005868005, 'epochs': 220, 'use_snp_selection': True, 'num_snps': 24000}. Best is trial 15 with value: 0.32677879333496096.
[I 2025-10-16 23:59:05,486] Trial 25 finished with value: 0.2964963227510452 and parameters: {'hidden_dims': '[512, 256]', 'dropout': 0.5096842135786868, 'batch_norm': False, 'graph_on': True, 'source': 'grm', 'knn_k': 6, 'weighted_edges': False, 'symmetrize_mode': 'mutual', 'lr': 2.0463570704610496e-05, 'weight_decay': 1.5087339322311783e-05, 'epochs': 45, 'use_snp_selection': True, 'num_snps': 30000}. Best is trial 15 with value: 0.32677879333496096.
[I 2025-10-16 23:59:32,629] Trial 26 finished with value: 0.3188683569431305 and parameters: {'hidden_dims': '[128, 64]', 'dropout': 0.23484670757304538, 'batch_norm': False, 'graph_on': True, 'source': 'grm', 'knn_k': 6, 'weighted_edges': False, 'symmetrize_mode': 'mutual', 'lr': 5.595457072743042e-05, 'weight_decay': 0.0001479007082677717, 'epochs': 139, 'use_snp_selection': True, 'num_snps': 40000}. Best is trial 15 with value: 0.32677879333496096.
[I 2025-10-16 23:59:55,623] Trial 27 finished with value: 0.31568276286125185 and parameters: {'hidden_dims': '[512, 128]', 'dropout': 0.3884438920030272, 'batch_norm': False, 'graph_on': True, 'source': 'grm', 'knn_k': 2, 'weighted_edges': False, 'symmetrize_mode': 'mutual', 'lr': 0.00015837376605507762, 'weight_decay': 0.00045164330095504983, 'epochs': 88, 'use_snp_selection': True, 'num_snps': 14000}. Best is trial 15 with value: 0.32677879333496096.
[I 2025-10-17 00:00:19,438] Trial 28 finished with value: 0.22290403842926027 and parameters: {'hidden_dims': '[256, 128, 64]', 'dropout': 0.3299140586726943, 'batch_norm': False, 'graph_on': True, 'source': 'grm', 'knn_k': 5, 'weighted_edges': False, 'symmetrize_mode': 'mutual', 'lr': 1.798668397099031e-06, 'weight_decay': 4.1837492418059215e-05, 'epochs': 50, 'use_snp_selection': True, 'num_snps': 34000}. Best is trial 15 with value: 0.32677879333496096.
[I 2025-10-17 00:00:44,718] Trial 29 finished with value: 0.3031404554843903 and parameters: {'hidden_dims': '[128, 64]', 'dropout': 0.15908996185386132, 'batch_norm': False, 'graph_on': True, 'source': 'grm', 'knn_k': 4, 'weighted_edges': False, 'symmetrize_mode': 'mutual', 'lr': 0.0006643031323513601, 'weight_decay': 1.905084717416042e-05, 'epochs': 263, 'use_snp_selection': True, 'num_snps': 16000}. Best is trial 15 with value: 0.32677879333496096.
[I 2025-10-17 00:01:03,193] Trial 30 finished with value: 0.13449718654155732 and parameters: {'hidden_dims': '[256, 128]', 'dropout': 0.39729621613281485, 'batch_norm': False, 'graph_on': True, 'source': 'grm', 'knn_k': 1, 'weighted_edges': False, 'symmetrize_mode': 'mutual', 'lr': 5.840610222036029e-06, 'weight_decay': 1.0769249506249124e-07, 'epochs': 10, 'use_snp_selection': True, 'num_snps': 22000}. Best is trial 15 with value: 0.32677879333496096.
[I 2025-10-17 00:01:34,315] Trial 31 finished with value: 0.32278657555580137 and parameters: {'hidden_dims': '[256, 128]', 'dropout': 0.44480435908953764, 'batch_norm': False, 'graph_on': True, 'source': 'grm', 'knn_k': 4, 'weighted_edges': False, 'symmetrize_mode': 'mutual', 'lr': 5.535978340901182e-06, 'weight_decay': 0.0004454020659597511, 'epochs': 222, 'use_snp_selection': True, 'num_snps': 24000}. Best is trial 15 with value: 0.32677879333496096.
[I 2025-10-17 00:02:02,362] Trial 32 finished with value: 0.2988006889820099 and parameters: {'hidden_dims': '[256, 128]', 'dropout': 0.44635279911634673, 'batch_norm': False, 'graph_on': True, 'source': 'grm', 'knn_k': 3, 'weighted_edges': False, 'symmetrize_mode': 'mutual', 'lr': 1.67747365759292e-05, 'weight_decay': 0.0001614378274862695, 'epochs': 216, 'use_snp_selection': True, 'num_snps': 18000}. Best is trial 15 with value: 0.32677879333496096.
[I 2025-10-17 00:02:40,589] Trial 33 finished with value: 0.3096684455871582 and parameters: {'hidden_dims': '[256, 128]', 'dropout': 0.4978291066559371, 'batch_norm': False, 'graph_on': True, 'source': 'grm', 'knn_k': 4, 'weighted_edges': False, 'symmetrize_mode': 'mutual', 'lr': 1.1042674270917389e-05, 'weight_decay': 0.0008759059586139775, 'epochs': 278, 'use_snp_selection': True, 'num_snps': 30000}. Best is trial 15 with value: 0.32677879333496096.
[I 2025-10-17 00:03:09,167] Trial 34 finished with value: 0.3258989155292511 and parameters: {'hidden_dims': '[256, 128]', 'dropout': 0.37587196041542614, 'batch_norm': False, 'graph_on': True, 'source': 'grm', 'knn_k': 5, 'weighted_edges': False, 'symmetrize_mode': 'mutual', 'lr': 4.121230593484276e-06, 'weight_decay': 0.0002879128509065004, 'epochs': 186, 'use_snp_selection': True, 'num_snps': 22000}. Best is trial 15 with value: 0.32677879333496096.
[I 2025-10-17 00:03:36,840] Trial 35 finished with value: 0.32107590436935424 and parameters: {'hidden_dims': '[512, 256]', 'dropout': 0.3273580436253837, 'batch_norm': False, 'graph_on': True, 'source': 'grm', 'knn_k': 5, 'weighted_edges': False, 'symmetrize_mode': 'mutual', 'lr': 0.0004146937980757511, 'weight_decay': 9.090918472727493e-07, 'epochs': 187, 'use_snp_selection': True, 'num_snps': 12000}. Best is trial 15 with value: 0.32677879333496096.
[I 2025-10-17 00:03:59,905] Trial 36 finished with value: 0.2849308788776398 and parameters: {'hidden_dims': '[128, 64]', 'dropout': 0.3679395825871217, 'batch_norm': False, 'graph_on': True, 'source': 'grm', 'knn_k': 6, 'weighted_edges': False, 'symmetrize_mode': 'mutual', 'lr': 1.8214558563829453e-06, 'weight_decay': 0.00010046123426309118, 'epochs': 159, 'use_snp_selection': True, 'num_snps': 20000}. Best is trial 15 with value: 0.32677879333496096.
[I 2025-10-17 00:04:33,792] Trial 37 finished with value: 0.3269404351711273 and parameters: {'hidden_dims': '[512, 256]', 'dropout': 0.41265725486528543, 'batch_norm': False, 'graph_on': True, 'source': 'grm', 'knn_k': 5, 'weighted_edges': False, 'symmetrize_mode': 'mutual', 'lr': 1.0503886224728086e-05, 'weight_decay': 0.00020145761826849222, 'epochs': 120, 'use_snp_selection': True, 'num_snps': 28000}. Best is trial 37 with value: 0.3269404351711273.
[I 2025-10-17 00:04:54,175] Trial 38 finished with value: 0.3227319478988647 and parameters: {'hidden_dims': '[256, 128]', 'dropout': 0.412393110528225, 'batch_norm': True, 'graph_on': True, 'source': 'grm', 'knn_k': 6, 'weighted_edges': True, 'symmetrize_mode': 'mutual', 'lr': 9.823381188938318e-06, 'weight_decay': 4.920848258295229e-05, 'epochs': 119, 'use_snp_selection': True, 'num_snps': 8000}. Best is trial 37 with value: 0.3269404351711273.
[I 2025-10-17 00:05:28,892] Trial 39 finished with value: 0.30766681432723997 and parameters: {'hidden_dims': '[512, 256]', 'dropout': 0.29097967478882236, 'batch_norm': False, 'graph_on': True, 'source': 'grm', 'knn_k': 7, 'weighted_edges': False, 'symmetrize_mode': 'union', 'lr': 3.928249907324688e-06, 'weight_decay': 0.00019816306032325885, 'epochs': 88, 'use_snp_selection': True, 'num_snps': 38000}. Best is trial 37 with value: 0.3269404351711273.
[I 2025-10-17 00:05:51,210] Trial 40 finished with value: 0.30226104259490966 and parameters: {'hidden_dims': '[256, 128, 64]', 'dropout': 0.37134131011510824, 'batch_norm': True, 'graph_on': True, 'source': 'grm', 'knn_k': 5, 'weighted_edges': True, 'symmetrize_mode': 'mutual', 'lr': 7.635023948057852e-06, 'weight_decay': 6.54538445626927e-06, 'epochs': 30, 'use_snp_selection': True, 'num_snps': 34000}. Best is trial 37 with value: 0.3269404351711273.
[I 2025-10-17 00:06:24,445] Trial 41 finished with value: 0.32440829277038574 and parameters: {'hidden_dims': '[512, 256]', 'dropout': 0.4055884749707501, 'batch_norm': False, 'graph_on': True, 'source': 'grm', 'knn_k': 5, 'weighted_edges': False, 'symmetrize_mode': 'mutual', 'lr': 2.49928849599579e-05, 'weight_decay': 0.0002840322872471583, 'epochs': 115, 'use_snp_selection': True, 'num_snps': 28000}. Best is trial 37 with value: 0.3269404351711273.
[I 2025-10-17 00:06:59,171] Trial 42 finished with value: 0.32458804845809935 and parameters: {'hidden_dims': '[512, 256]', 'dropout': 0.3241521384424838, 'batch_norm': False, 'graph_on': True, 'source': 'grm', 'knn_k': 5, 'weighted_edges': False, 'symmetrize_mode': 'mutual', 'lr': 1.3523903159282604e-05, 'weight_decay': 0.00011095711546103144, 'epochs': 127, 'use_snp_selection': True, 'num_snps': 28000}. Best is trial 37 with value: 0.3269404351711273.
[I 2025-10-17 00:07:29,372] Trial 43 finished with value: 0.3172481656074524 and parameters: {'hidden_dims': '[512, 256]', 'dropout': 0.34062449496565134, 'batch_norm': False, 'graph_on': True, 'source': 'grm', 'knn_k': 4, 'weighted_edges': False, 'symmetrize_mode': 'mutual', 'lr': 1.532396387462742e-05, 'weight_decay': 9.534688598010383e-05, 'epochs': 120, 'use_snp_selection': True, 'num_snps': 22000}. Best is trial 37 with value: 0.3269404351711273.
[I 2025-10-17 00:08:05,664] Trial 44 finished with value: 0.32188365459442136 and parameters: {'hidden_dims': '[512, 256]', 'dropout': 0.30832360496091, 'batch_norm': False, 'graph_on': True, 'source': 'grm', 'knn_k': 6, 'weighted_edges': False, 'symmetrize_mode': 'mutual', 'lr': 4.696765511686341e-05, 'weight_decay': 0.0007128837199951404, 'epochs': 141, 'use_snp_selection': True, 'num_snps': 28000}. Best is trial 37 with value: 0.3269404351711273.
[I 2025-10-17 00:08:34,687] Trial 45 finished with value: 0.32269654273986814 and parameters: {'hidden_dims': '[512, 256]', 'dropout': 0.26972538328699164, 'batch_norm': False, 'graph_on': True, 'source': 'grm', 'knn_k': 5, 'weighted_edges': False, 'symmetrize_mode': 'union', 'lr': 1.2164747815744103e-05, 'weight_decay': 0.0002653333399798091, 'epochs': 128, 'use_snp_selection': True, 'num_snps': 18000}. Best is trial 37 with value: 0.3269404351711273.
[I 2025-10-17 00:09:38,815] Trial 46 finished with value: 0.3021770536899567 and parameters: {'hidden_dims': '[512, 64]', 'dropout': 0.4117289134327288, 'batch_norm': True, 'graph_on': True, 'source': 'grm', 'knn_k': 7, 'weighted_edges': True, 'symmetrize_mode': 'mutual', 'lr': 2.6451524405790376e-06, 'weight_decay': 2.6983709257254635e-05, 'epochs': 324, 'use_snp_selection': True, 'num_snps': 32000}. Best is trial 37 with value: 0.3269404351711273.
[I 2025-10-17 00:10:14,906] Trial 47 finished with value: 0.30358908176422117 and parameters: {'hidden_dims': '[512, 128]', 'dropout': 0.3471976912356105, 'batch_norm': False, 'graph_on': True, 'source': 'grm', 'knn_k': 5, 'weighted_edges': False, 'symmetrize_mode': 'union', 'lr': 9.329554101355227e-05, 'weight_decay': 0.00012066984331193762, 'epochs': 106, 'use_snp_selection': True, 'num_snps': 36000}. Best is trial 37 with value: 0.3269404351711273.
[I 2025-10-17 00:10:36,554] Trial 48 finished with value: 0.3193636119365692 and parameters: {'hidden_dims': '[256, 128]', 'dropout': 0.47047833312718046, 'batch_norm': True, 'graph_on': True, 'source': 'grm', 'knn_k': 6, 'weighted_edges': True, 'symmetrize_mode': 'union', 'lr': 8.445667627002838e-06, 'weight_decay': 0.0005918052792256458, 'epochs': 54, 'use_snp_selection': True, 'num_snps': 22000}. Best is trial 37 with value: 0.3269404351711273.
[I 2025-10-17 00:11:28,907] Trial 49 finished with value: 0.31085812449455263 and parameters: {'hidden_dims': '[512, 256]', 'dropout': 0.23028159737822915, 'batch_norm': False, 'graph_on': True, 'source': 'grm', 'knn_k': 4, 'weighted_edges': False, 'symmetrize_mode': 'mutual', 'lr': 1.7820838549720657e-05, 'weight_decay': 0.00018387369178132776, 'epochs': 178, 'use_snp_selection': True, 'num_snps': 42000}. Best is trial 37 with value: 0.3269404351711273.
[I 2025-10-17 00:12:12,867] Trial 50 finished with value: 0.28561133742332456 and parameters: {'hidden_dims': '[512, 64]', 'dropout': 0.30726196830656377, 'batch_norm': True, 'graph_on': True, 'source': 'grm', 'knn_k': 6, 'weighted_edges': True, 'symmetrize_mode': 'union', 'lr': 4.0647199424857926e-05, 'weight_decay': 6.614391770278667e-05, 'epochs': 200, 'use_snp_selection': True, 'num_snps': 28000}. Best is trial 37 with value: 0.3269404351711273.
[I 2025-10-17 00:12:42,090] Trial 51 finished with value: 0.3176692366600037 and parameters: {'hidden_dims': '[512, 256]', 'dropout': 0.3820886957552073, 'batch_norm': False, 'graph_on': True, 'source': 'grm', 'knn_k': 5, 'weighted_edges': False, 'symmetrize_mode': 'mutual', 'lr': 4.009725892712194e-06, 'weight_decay': 0.0001368930452578719, 'epochs': 81, 'use_snp_selection': True, 'num_snps': 28000}. Best is trial 37 with value: 0.3269404351711273.
[I 2025-10-17 00:13:18,782] Trial 52 finished with value: 0.32702940702438354 and parameters: {'hidden_dims': '[512, 256]', 'dropout': 0.42851971394348437, 'batch_norm': False, 'graph_on': True, 'source': 'grm', 'knn_k': 5, 'weighted_edges': False, 'symmetrize_mode': 'mutual', 'lr': 6.7809784942249754e-06, 'weight_decay': 0.00034317233092341095, 'epochs': 152, 'use_snp_selection': True, 'num_snps': 26000}. Best is trial 52 with value: 0.32702940702438354.
[I 2025-10-17 00:13:53,390] Trial 53 finished with value: 0.322448855638504 and parameters: {'hidden_dims': '[512, 256]', 'dropout': 0.42751253807437634, 'batch_norm': False, 'graph_on': True, 'source': 'grm', 'knn_k': 5, 'weighted_edges': False, 'symmetrize_mode': 'mutual', 'lr': 2.529942525891864e-05, 'weight_decay': 0.00034543307216195265, 'epochs': 153, 'use_snp_selection': True, 'num_snps': 24000}. Best is trial 52 with value: 0.32702940702438354.
[I 2025-10-17 00:14:30,858] Trial 54 finished with value: 0.32737566232681276 and parameters: {'hidden_dims': '[512, 256]', 'dropout': 0.4544241223537854, 'batch_norm': False, 'graph_on': True, 'source': 'grm', 'knn_k': 5, 'weighted_edges': False, 'symmetrize_mode': 'mutual', 'lr': 6.866747210547119e-06, 'weight_decay': 0.00022034480100549268, 'epochs': 129, 'use_snp_selection': True, 'num_snps': 32000}. Best is trial 54 with value: 0.32737566232681276.
[I 2025-10-17 00:15:03,464] Trial 55 finished with value: 0.3256245791912079 and parameters: {'hidden_dims': '[512, 256]', 'dropout': 0.5271355316746008, 'batch_norm': False, 'graph_on': True, 'source': 'grm', 'knn_k': 6, 'weighted_edges': False, 'symmetrize_mode': 'mutual', 'lr': 6.810483593631434e-06, 'weight_decay': 0.0005622498466473975, 'epochs': 132, 'use_snp_selection': True, 'num_snps': 24000}. Best is trial 54 with value: 0.32737566232681276.
[I 2025-10-17 00:15:39,576] Trial 56 finished with value: 0.28907606899738314 and parameters: {'hidden_dims': '[256, 128, 64]', 'dropout': 0.5404035996076255, 'batch_norm': True, 'graph_on': True, 'source': 'grm', 'knn_k': 7, 'weighted_edges': True, 'symmetrize_mode': 'mutual', 'lr': 1.3836015822876204e-06, 'weight_decay': 0.0005117900101377188, 'epochs': 205, 'use_snp_selection': True, 'num_snps': 32000}. Best is trial 54 with value: 0.32737566232681276.
[I 2025-10-17 00:16:05,936] Trial 57 finished with value: 0.2990663945674896 and parameters: {'hidden_dims': '[256, 128]', 'dropout': 0.5656712658979086, 'batch_norm': False, 'graph_on': True, 'source': 'grm', 'knn_k': 6, 'weighted_edges': False, 'symmetrize_mode': 'union', 'lr': 3.2167296024277873e-06, 'weight_decay': 0.0006873171361313115, 'epochs': 174, 'use_snp_selection': True, 'num_snps': 18000}. Best is trial 54 with value: 0.32737566232681276.
[I 2025-10-17 00:16:40,150] Trial 58 finished with value: 0.32562397718429564 and parameters: {'hidden_dims': '[512, 256]', 'dropout': 0.51927242370936, 'batch_norm': False, 'graph_on': True, 'source': 'grm', 'knn_k': 7, 'weighted_edges': False, 'symmetrize_mode': 'mutual', 'lr': 6.8439224001098066e-06, 'weight_decay': 0.0002239863383787205, 'epochs': 148, 'use_snp_selection': True, 'num_snps': 24000}. Best is trial 54 with value: 0.32737566232681276.
[I 2025-10-17 00:17:24,171] Trial 59 finished with value: 0.28392229676246644 and parameters: {'hidden_dims': '[512, 128]', 'dropout': 0.4912476322219386, 'batch_norm': True, 'graph_on': True, 'source': 'grm', 'knn_k': 7, 'weighted_edges': True, 'symmetrize_mode': 'mutual', 'lr': 9.276632396701522e-06, 'weight_decay': 1.3184886194129964e-06, 'epochs': 97, 'use_snp_selection': True, 'num_snps': 54000}. Best is trial 54 with value: 0.32737566232681276.
