[I 2025-10-16 21:17:36,546] Trial 72 finished with value: 0.323478901386261 and parameters: {'hidden_dims': '[512, 64]', 'dropout': 0.4001980624426331, 'batch_norm': True, 'graph_on': True, 'source': 'grm', 'knn_k': 4, 'weighted_edges': True, 'symmetrize_mode': 'union', 'lr': 1.1802021562699595e-05, 'weight_decay': 0.0007499014051572866, 'epochs': 270, 'use_snp_selection': True, 'num_snps': 6000}. Best is trial 33 with value: 0.3409039795398712.
[I 2025-10-16 21:17:59,888] Trial 73 finished with value: 0.3367376983165741 and parameters: {'hidden_dims': '[512, 64]', 'dropout': 0.4712409289835601, 'batch_norm': True, 'graph_on': True, 'source': 'grm', 'knn_k': 5, 'weighted_edges': True, 'symmetrize_mode': 'union', 'lr': 5.9331519750291225e-05, 'weight_decay': 0.00013010683899403273, 'epochs': 308, 'use_snp_selection': True, 'num_snps': 2000}. Best is trial 33 with value: 0.3409039795398712.
[I 2025-10-16 21:18:22,444] Trial 74 finished with value: 0.30905343890190123 and parameters: {'hidden_dims': '[512, 64]', 'dropout': 0.4767500080846559, 'batch_norm': True, 'graph_on': True, 'source': 'grm', 'knn_k': 2, 'weighted_edges': True, 'symmetrize_mode': 'union', 'lr': 7.117592902164729e-05, 'weight_decay': 0.00012986458717220755, 'epochs': 301, 'use_snp_selection': True, 'num_snps': 2000}. Best is trial 33 with value: 0.3409039795398712.
[I 2025-10-16 21:18:56,388] Trial 75 finished with value: 0.30341286659240724 and parameters: {'hidden_dims': '[512, 64]', 'dropout': 0.33943632952872566, 'batch_norm': True, 'graph_on': True, 'source': 'grm', 'knn_k': 5, 'weighted_edges': True, 'symmetrize_mode': 'union', 'lr': 4.8767422853135505e-05, 'weight_decay': 0.00019933887072118794, 'epochs': 298, 'use_snp_selection': True, 'num_snps': 12000}. Best is trial 33 with value: 0.3409039795398712.
[I 2025-10-16 21:19:49,135] Trial 76 finished with value: 0.28393187522888186 and parameters: {'hidden_dims': '[512, 64]', 'dropout': 0.4895540240546425, 'batch_norm': True, 'graph_on': True, 'source': 'grm', 'knn_k': 6, 'weighted_edges': True, 'symmetrize_mode': 'union', 'lr': 0.00011396739096655274, 'weight_decay': 6.622439187392876e-05, 'epochs': 348, 'use_snp_selection': True, 'num_snps': 22000}. Best is trial 33 with value: 0.3409039795398712.
[I 2025-10-16 21:20:14,963] Trial 77 finished with value: 0.3328528940677643 and parameters: {'hidden_dims': '[512, 256]', 'dropout': 0.5454934649205642, 'batch_norm': True, 'graph_on': True, 'source': 'grm', 'knn_k': 7, 'weighted_edges': True, 'symmetrize_mode': 'union', 'lr': 3.4902608285169354e-06, 'weight_decay': 3.5124213681607725e-05, 'epochs': 100, 'use_snp_selection': True, 'num_snps': 16000}. Best is trial 33 with value: 0.3409039795398712.
[I 2025-10-16 21:20:40,187] Trial 78 finished with value: 0.3067044377326965 and parameters: {'hidden_dims': '[128, 64]', 'dropout': 0.4417014226461934, 'batch_norm': True, 'graph_on': True, 'source': 'grm', 'knn_k': 6, 'weighted_edges': True, 'symmetrize_mode': 'mutual', 'lr': 8.061807729027042e-06, 'weight_decay': 8.817558356057127e-05, 'epochs': 154, 'use_snp_selection': True, 'num_snps': 28000}. Best is trial 33 with value: 0.3409039795398712.
[I 2025-10-16 21:21:10,325] Trial 79 finished with value: 0.3049667179584503 and parameters: {'hidden_dims': '[512, 128]', 'dropout': 0.42971111627547387, 'batch_norm': True, 'graph_on': True, 'source': 'grm', 'knn_k': 4, 'weighted_edges': True, 'symmetrize_mode': 'union', 'lr': 3.154697158116734e-05, 'weight_decay': 4.067609765794108e-07, 'epochs': 144, 'use_snp_selection': True, 'num_snps': 18000}. Best is trial 33 with value: 0.3409039795398712.
[I 2025-10-16 21:21:57,518] Trial 80 finished with value: 0.32962438464164734 and parameters: {'hidden_dims': '[512, 64]', 'dropout': 0.5296339453188174, 'batch_norm': True, 'graph_on': True, 'source': 'grm', 'knn_k': 7, 'weighted_edges': True, 'symmetrize_mode': 'union', 'lr': 4.901781975173872e-06, 'weight_decay': 2.4244075819779895e-05, 'epochs': 318, 'use_snp_selection': True, 'num_snps': 20000}. Best is trial 33 with value: 0.3409039795398712.
[I 2025-10-16 21:22:23,182] Trial 81 finished with value: 0.3275753140449524 and parameters: {'hidden_dims': '[512, 64]', 'dropout': 0.4154041882425038, 'batch_norm': True, 'graph_on': True, 'source': 'grm', 'knn_k': 5, 'weighted_edges': True, 'symmetrize_mode': 'union', 'lr': 2.294463882402085e-05, 'weight_decay': 0.0004694544741734952, 'epochs': 246, 'use_snp_selection': True, 'num_snps': 6000}. Best is trial 33 with value: 0.3409039795398712.
[I 2025-10-16 21:22:45,602] Trial 82 finished with value: 0.3345439314842224 and parameters: {'hidden_dims': '[512, 64]', 'dropout': 0.4619129209715624, 'batch_norm': True, 'graph_on': True, 'source': 'grm', 'knn_k': 5, 'weighted_edges': True, 'symmetrize_mode': 'union', 'lr': 6.139241753236965e-05, 'weight_decay': 0.0003294279453616688, 'epochs': 198, 'use_snp_selection': True, 'num_snps': 4000}. Best is trial 33 with value: 0.3409039795398712.
[I 2025-10-16 21:23:09,935] Trial 83 finished with value: 0.3186709344387054 and parameters: {'hidden_dims': '[512, 64]', 'dropout': 0.3792794117366741, 'batch_norm': True, 'graph_on': True, 'source': 'grm', 'knn_k': 5, 'weighted_edges': True, 'symmetrize_mode': 'union', 'lr': 4.620187293848338e-05, 'weight_decay': 4.489803851339941e-06, 'epochs': 170, 'use_snp_selection': True, 'num_snps': 8000}. Best is trial 33 with value: 0.3409039795398712.
[I 2025-10-16 21:23:32,992] Trial 84 finished with value: 0.33076639771461486 and parameters: {'hidden_dims': '[512, 64]', 'dropout': 0.36318354278925286, 'batch_norm': True, 'graph_on': True, 'source': 'grm', 'knn_k': 6, 'weighted_edges': True, 'symmetrize_mode': 'union', 'lr': 6.481431171570216e-06, 'weight_decay': 0.00020371401407936728, 'epochs': 214, 'use_snp_selection': True, 'num_snps': 4000}. Best is trial 33 with value: 0.3409039795398712.
[I 2025-10-16 21:24:00,621] Trial 85 finished with value: 0.32218614816665647 and parameters: {'hidden_dims': '[512, 64]', 'dropout': 0.4033871200350636, 'batch_norm': True, 'graph_on': True, 'source': 'grm', 'knn_k': 5, 'weighted_edges': True, 'symmetrize_mode': 'union', 'lr': 1.943860793442359e-05, 'weight_decay': 0.00010522235036851526, 'epochs': 247, 'use_snp_selection': True, 'num_snps': 8000}. Best is trial 33 with value: 0.3409039795398712.
[I 2025-10-16 21:24:22,477] Trial 86 finished with value: 0.33051685690879823 and parameters: {'hidden_dims': '[512, 128]', 'dropout': 0.328423476778501, 'batch_norm': False, 'graph_on': True, 'source': 'grm', 'knn_k': 3, 'weighted_edges': True, 'symmetrize_mode': 'union', 'lr': 3.4099918524234937e-05, 'weight_decay': 0.00014152386429001023, 'epochs': 264, 'use_snp_selection': True, 'num_snps': 2000}. Best is trial 33 with value: 0.3409039795398712.
[I 2025-10-16 21:24:57,184] Trial 87 finished with value: 0.32464154362678527 and parameters: {'hidden_dims': '[512, 64]', 'dropout': 0.4620384737105914, 'batch_norm': True, 'graph_on': True, 'source': 'grm', 'knn_k': 6, 'weighted_edges': False, 'symmetrize_mode': 'union', 'lr': 1.5464969130507975e-06, 'weight_decay': 0.0001810679039997197, 'epochs': 115, 'use_snp_selection': True, 'num_snps': 30000}. Best is trial 33 with value: 0.3409039795398712.
[I 2025-10-16 21:25:35,171] Trial 88 finished with value: 0.3175447702407837 and parameters: {'hidden_dims': '[512, 256]', 'dropout': 0.3745399076292595, 'batch_norm': True, 'graph_on': True, 'source': 'grm', 'knn_k': 4, 'weighted_edges': True, 'symmetrize_mode': 'union', 'lr': 1.3954090692248066e-05, 'weight_decay': 6.130908561595187e-05, 'epochs': 132, 'use_snp_selection': True, 'num_snps': 32000}. Best is trial 33 with value: 0.3409039795398712.
[I 2025-10-16 21:25:55,018] Trial 89 finished with value: 0.2695829629898071 and parameters: {'hidden_dims': '[256, 128]', 'dropout': 0.5000004783663543, 'batch_norm': True, 'graph_on': True, 'source': 'grm', 'knn_k': 5, 'weighted_edges': True, 'symmetrize_mode': 'union', 'lr': 2.2170609340636946e-06, 'weight_decay': 1.6802856417466498e-05, 'epochs': 68, 'use_snp_selection': True, 'num_snps': 12000}. Best is trial 33 with value: 0.3409039795398712.
[I 2025-10-16 21:26:19,154] Trial 90 finished with value: 0.3230257034301758 and parameters: {'hidden_dims': '[512, 128]', 'dropout': 0.3934006520440534, 'batch_norm': True, 'graph_on': True, 'source': 'grm', 'knn_k': 7, 'weighted_edges': True, 'symmetrize_mode': 'union', 'lr': 2.8807621425605334e-05, 'weight_decay': 0.0002742083273628119, 'epochs': 42, 'use_snp_selection': True, 'num_snps': 26000}. Best is trial 33 with value: 0.3409039795398712.
[I 2025-10-16 21:26:44,670] Trial 91 finished with value: 0.34311728477478026 and parameters: {'hidden_dims': '[512, 64]', 'dropout': 0.35570676605074614, 'batch_norm': True, 'graph_on': True, 'source': 'grm', 'knn_k': 6, 'weighted_edges': True, 'symmetrize_mode': 'union', 'lr': 2.982522886926343e-06, 'weight_decay': 0.0006014186712786357, 'epochs': 166, 'use_snp_selection': True, 'num_snps': 10000}. Best is trial 91 with value: 0.34311728477478026.
[I 2025-10-16 21:27:09,910] Trial 92 finished with value: 0.3359450578689575 and parameters: {'hidden_dims': '[512, 64]', 'dropout': 0.3493262830954729, 'batch_norm': True, 'graph_on': True, 'source': 'grm', 'knn_k': 6, 'weighted_edges': True, 'symmetrize_mode': 'union', 'lr': 2.8550444097302803e-06, 'weight_decay': 0.0006156782625221224, 'epochs': 157, 'use_snp_selection': True, 'num_snps': 10000}. Best is trial 91 with value: 0.34311728477478026.
[I 2025-10-16 21:27:31,805] Trial 93 finished with value: 0.33292187452316285 and parameters: {'hidden_dims': '[512, 64]', 'dropout': 0.3348955029920375, 'batch_norm': True, 'graph_on': True, 'source': 'grm', 'knn_k': 6, 'weighted_edges': True, 'symmetrize_mode': 'union', 'lr': 5.163669696942061e-06, 'weight_decay': 0.0007967345400716329, 'epochs': 175, 'use_snp_selection': True, 'num_snps': 4000}. Best is trial 91 with value: 0.34311728477478026.
[I 2025-10-16 21:28:25,011] Trial 94 finished with value: 0.2770064115524292 and parameters: {'hidden_dims': '[512, 64]', 'dropout': 0.28451045858204527, 'batch_norm': True, 'graph_on': True, 'source': 'grm', 'knn_k': 6, 'weighted_edges': True, 'symmetrize_mode': 'union', 'lr': 0.0009825436837295682, 'weight_decay': 0.00034417530985027494, 'epochs': 205, 'use_snp_selection': True, 'num_snps': 38000}. Best is trial 91 with value: 0.34311728477478026.
[I 2025-10-16 21:28:51,815] Trial 95 finished with value: 0.3383265256881714 and parameters: {'hidden_dims': '[512, 64]', 'dropout': 0.30993753417908193, 'batch_norm': True, 'graph_on': True, 'source': 'grm', 'knn_k': 6, 'weighted_edges': True, 'symmetrize_mode': 'union', 'lr': 3.873758151546964e-06, 'weight_decay': 0.0004493836255282715, 'epochs': 139, 'use_snp_selection': True, 'num_snps': 14000}. Best is trial 91 with value: 0.34311728477478026.
[I 2025-10-16 21:29:18,409] Trial 96 finished with value: 0.3131323277950287 and parameters: {'hidden_dims': '[512, 64]', 'dropout': 0.26176905550551127, 'batch_norm': True, 'graph_on': True, 'source': 'grm', 'knn_k': 6, 'weighted_edges': True, 'symmetrize_mode': 'mutual', 'lr': 3.723337038012304e-06, 'weight_decay': 4.405605710687598e-05, 'epochs': 139, 'use_snp_selection': True, 'num_snps': 14000}. Best is trial 91 with value: 0.34311728477478026.
[I 2025-10-16 21:29:40,120] Trial 97 finished with value: 0.3231867551803589 and parameters: {'hidden_dims': '[256, 128, 64]', 'dropout': 0.3010227285862451, 'batch_norm': True, 'graph_on': True, 'source': 'grm', 'knn_k': 7, 'weighted_edges': True, 'symmetrize_mode': 'union', 'lr': 4.234142211451638e-06, 'weight_decay': 0.0004623519494202674, 'epochs': 121, 'use_snp_selection': True, 'num_snps': 10000}. Best is trial 91 with value: 0.34311728477478026.
[I 2025-10-16 21:30:01,522] Trial 98 finished with value: 0.30635754466056825 and parameters: {'hidden_dims': '[128, 64]', 'dropout': 0.31148523661585137, 'batch_norm': True, 'graph_on': True, 'source': 'grm', 'knn_k': 6, 'weighted_edges': False, 'symmetrize_mode': 'union', 'lr': 1.79519514644906e-06, 'weight_decay': 0.0009720666038256442, 'epochs': 162, 'use_snp_selection': True, 'num_snps': 12000}. Best is trial 91 with value: 0.34311728477478026.
[I 2025-10-16 21:30:40,086] Trial 99 finished with value: 0.3362904071807861 and parameters: {'hidden_dims': '[512, 128]', 'dropout': 0.3199625552956305, 'batch_norm': False, 'graph_on': True, 'source': 'grm', 'knn_k': 6, 'weighted_edges': True, 'symmetrize_mode': 'union', 'lr': 2.923102405733671e-06, 'weight_decay': 0.00023626256268721995, 'epochs': 191, 'use_snp_selection': True, 'num_snps': 24000}. Best is trial 91 with value: 0.34311728477478026.
[I 2025-10-16 21:31:22,192] Trial 100 finished with value: 0.3195904493331909 and parameters: {'hidden_dims': '[512, 256]', 'dropout': 0.15623230357081883, 'batch_norm': True, 'graph_on': True, 'source': 'grm', 'knn_k': 7, 'weighted_edges': True, 'symmetrize_mode': 'union', 'lr': 7.004366523008952e-06, 'weight_decay': 1.0867061697956363e-07, 'epochs': 183, 'use_snp_selection': True, 'num_snps': 28000}. Best is trial 91 with value: 0.34311728477478026.
[I 2025-10-16 21:31:45,777] Trial 101 finished with value: 0.3299910545349121 and parameters: {'hidden_dims': '[512, 64]', 'dropout': 0.3684867675904566, 'batch_norm': True, 'graph_on': True, 'source': 'grm', 'knn_k': 6, 'weighted_edges': True, 'symmetrize_mode': 'union', 'lr': 3.2289382844579264e-06, 'weight_decay': 0.0005803801144044998, 'epochs': 150, 'use_snp_selection': True, 'num_snps': 8000}. Best is trial 91 with value: 0.34311728477478026.
[I 2025-10-16 21:32:10,683] Trial 102 finished with value: 0.31285104155540466 and parameters: {'hidden_dims': '[512, 64]', 'dropout': 0.355906062556798, 'batch_norm': True, 'graph_on': True, 'source': 'grm', 'knn_k': 5, 'weighted_edges': True, 'symmetrize_mode': 'union', 'lr': 2.3169411896830203e-06, 'weight_decay': 0.0003261221291899523, 'epochs': 224, 'use_snp_selection': True, 'num_snps': 6000}. Best is trial 91 with value: 0.34311728477478026.
[I 2025-10-16 21:32:36,762] Trial 103 finished with value: 0.34136157035827636 and parameters: {'hidden_dims': '[512, 64]', 'dropout': 0.3875190696639683, 'batch_norm': True, 'graph_on': True, 'source': 'grm', 'knn_k': 6, 'weighted_edges': True, 'symmetrize_mode': 'union', 'lr': 5.752563346718968e-06, 'weight_decay': 0.00042477267000148004, 'epochs': 128, 'use_snp_selection': True, 'num_snps': 14000}. Best is trial 91 with value: 0.34311728477478026.
[I 2025-10-16 21:33:01,554] Trial 104 finished with value: 0.3357894837856293 and parameters: {'hidden_dims': '[512, 64]', 'dropout': 0.3430774302615859, 'batch_norm': True, 'graph_on': True, 'source': 'grm', 'knn_k': 6, 'weighted_edges': True, 'symmetrize_mode': 'union', 'lr': 1.0166175694402055e-05, 'weight_decay': 0.0006984066410606583, 'epochs': 107, 'use_snp_selection': True, 'num_snps': 14000}. Best is trial 91 with value: 0.34311728477478026.
[I 2025-10-16 21:33:29,163] Trial 105 finished with value: 0.3413256645202637 and parameters: {'hidden_dims': '[512, 64]', 'dropout': 0.3871684473570703, 'batch_norm': True, 'graph_on': True, 'source': 'grm', 'knn_k': 6, 'weighted_edges': True, 'symmetrize_mode': 'union', 'lr': 5.710680422060177e-06, 'weight_decay': 0.0004362445543898605, 'epochs': 127, 'use_snp_selection': True, 'num_snps': 16000}. Best is trial 91 with value: 0.34311728477478026.
[I 2025-10-16 21:33:59,144] Trial 106 finished with value: 0.33738536238670347 and parameters: {'hidden_dims': '[512, 64]', 'dropout': 0.3856587890543485, 'batch_norm': True, 'graph_on': True, 'source': 'grm', 'knn_k': 6, 'weighted_edges': True, 'symmetrize_mode': 'union', 'lr': 5.753031993255795e-06, 'weight_decay': 0.0004073275847017363, 'epochs': 128, 'use_snp_selection': True, 'num_snps': 20000}. Best is trial 91 with value: 0.34311728477478026.
[I 2025-10-16 21:34:27,093] Trial 107 finished with value: 0.3357853889465332 and parameters: {'hidden_dims': '[512, 64]', 'dropout': 0.2919612051018176, 'batch_norm': True, 'graph_on': True, 'source': 'grm', 'knn_k': 6, 'weighted_edges': True, 'symmetrize_mode': 'union', 'lr': 5.968859943418522e-06, 'weight_decay': 0.000404070272734728, 'epochs': 131, 'use_snp_selection': True, 'num_snps': 16000}. Best is trial 91 with value: 0.34311728477478026.
[I 2025-10-16 21:34:58,315] Trial 108 finished with value: 0.3279986441135406 and parameters: {'hidden_dims': '[512, 64]', 'dropout': 0.3891716697896811, 'batch_norm': True, 'graph_on': True, 'source': 'grm', 'knn_k': 6, 'weighted_edges': True, 'symmetrize_mode': 'union', 'lr': 8.375003903503033e-06, 'weight_decay': 0.0004770476019603453, 'epochs': 141, 'use_snp_selection': True, 'num_snps': 20000}. Best is trial 91 with value: 0.34311728477478026.
[I 2025-10-16 21:35:25,775] Trial 109 finished with value: 0.33194448947906496 and parameters: {'hidden_dims': '[512, 64]', 'dropout': 0.3709999474987391, 'batch_norm': True, 'graph_on': True, 'source': 'grm', 'knn_k': 6, 'weighted_edges': True, 'symmetrize_mode': 'union', 'lr': 4.689985866095444e-06, 'weight_decay': 0.00022863344689572047, 'epochs': 125, 'use_snp_selection': True, 'num_snps': 16000}. Best is trial 91 with value: 0.34311728477478026.
[I 2025-10-16 21:35:51,608] Trial 110 finished with value: 0.33645702600479127 and parameters: {'hidden_dims': '[512, 64]', 'dropout': 0.32287261284540186, 'batch_norm': True, 'graph_on': True, 'source': 'grm', 'knn_k': 6, 'weighted_edges': True, 'symmetrize_mode': 'union', 'lr': 5.950874233297264e-06, 'weight_decay': 0.00016795711401563118, 'epochs': 91, 'use_snp_selection': True, 'num_snps': 18000}. Best is trial 91 with value: 0.34311728477478026.
[I 2025-10-16 21:36:24,609] Trial 111 finished with value: 0.3382196307182312 and parameters: {'hidden_dims': '[512, 64]', 'dropout': 0.3556855611116528, 'batch_norm': True, 'graph_on': True, 'source': 'grm', 'knn_k': 7, 'weighted_edges': True, 'symmetrize_mode': 'union', 'lr': 3.632879049149349e-06, 'weight_decay': 0.00011111169084167578, 'epochs': 118, 'use_snp_selection': True, 'num_snps': 26000}. Best is trial 91 with value: 0.34311728477478026.
[I 2025-10-16 21:36:57,815] Trial 112 finished with value: 0.3243446171283722 and parameters: {'hidden_dims': '[512, 64]', 'dropout': 0.3863974233446099, 'batch_norm': True, 'graph_on': True, 'source': 'grm', 'knn_k': 6, 'weighted_edges': True, 'symmetrize_mode': 'union', 'lr': 3.464561740360553e-06, 'weight_decay': 0.00012088777633534121, 'epochs': 148, 'use_snp_selection': True, 'num_snps': 22000}. Best is trial 91 with value: 0.34311728477478026.
[I 2025-10-16 21:37:30,292] Trial 113 finished with value: 0.3329819023609161 and parameters: {'hidden_dims': '[512, 64]', 'dropout': 0.3569059301145081, 'batch_norm': True, 'graph_on': True, 'source': 'grm', 'knn_k': 7, 'weighted_edges': True, 'symmetrize_mode': 'union', 'lr': 5.302866845104474e-06, 'weight_decay': 0.0005294920846298691, 'epochs': 130, 'use_snp_selection': True, 'num_snps': 24000}. Best is trial 91 with value: 0.34311728477478026.
[I 2025-10-16 21:38:03,165] Trial 114 finished with value: 0.3332210659980774 and parameters: {'hidden_dims': '[512, 64]', 'dropout': 0.5570407201236632, 'batch_norm': True, 'graph_on': True, 'source': 'grm', 'knn_k': 6, 'weighted_edges': True, 'symmetrize_mode': 'union', 'lr': 4.268046111530554e-06, 'weight_decay': 0.0002761716719022984, 'epochs': 118, 'use_snp_selection': True, 'num_snps': 26000}. Best is trial 91 with value: 0.34311728477478026.
[I 2025-10-16 21:38:35,157] Trial 115 finished with value: 0.335923832654953 and parameters: {'hidden_dims': '[512, 64]', 'dropout': 0.33479633653656443, 'batch_norm': True, 'graph_on': True, 'source': 'grm', 'knn_k': 6, 'weighted_edges': True, 'symmetrize_mode': 'union', 'lr': 7.35456107812706e-06, 'weight_decay': 0.0008156314072078071, 'epochs': 136, 'use_snp_selection': True, 'num_snps': 22000}. Best is trial 91 with value: 0.34311728477478026.
[I 2025-10-16 21:39:00,942] Trial 116 finished with value: 0.31185356974601747 and parameters: {'hidden_dims': '[512, 64]', 'dropout': 0.4071605687428783, 'batch_norm': True, 'graph_on': True, 'source': 'grm', 'knn_k': 7, 'weighted_edges': True, 'symmetrize_mode': 'mutual', 'lr': 2.5604600727527945e-06, 'weight_decay': 8.190734440533369e-05, 'epochs': 82, 'use_snp_selection': True, 'num_snps': 20000}. Best is trial 91 with value: 0.34311728477478026.
[I 2025-10-16 21:39:40,809] Trial 117 finished with value: 0.33093786239624023 and parameters: {'hidden_dims': '[512, 64]', 'dropout': 0.3444026822406698, 'batch_norm': True, 'graph_on': True, 'source': 'grm', 'knn_k': 6, 'weighted_edges': True, 'symmetrize_mode': 'union', 'lr': 3.094162935229876e-06, 'weight_decay': 0.00043088009635050317, 'epochs': 168, 'use_snp_selection': True, 'num_snps': 28000}. Best is trial 91 with value: 0.34311728477478026.
[I 2025-10-16 21:40:04,994] Trial 118 finished with value: 0.290840083360672 and parameters: {'hidden_dims': '[512, 64]', 'dropout': 0.38381449227153697, 'batch_norm': True, 'graph_on': True, 'source': 'grm', 'knn_k': 7, 'weighted_edges': True, 'symmetrize_mode': 'union', 'lr': 1.3052466238145063e-06, 'weight_decay': 0.00010580436656123554, 'epochs': 97, 'use_snp_selection': True, 'num_snps': 14000}. Best is trial 91 with value: 0.34311728477478026.
[I 2025-10-16 21:40:45,651] Trial 119 finished with value: 0.32652210593223574 and parameters: {'hidden_dims': '[512, 256]', 'dropout': 0.3711171882959198, 'batch_norm': False, 'graph_on': True, 'source': 'grm', 'knn_k': 6, 'weighted_edges': False, 'symmetrize_mode': 'union', 'lr': 8.992282064216444e-06, 'weight_decay': 0.00015739096675064165, 'epochs': 158, 'use_snp_selection': True, 'num_snps': 30000}. Best is trial 91 with value: 0.34311728477478026.
