[I 2025-10-17 05:11:03,081] Trial 90 finished with value: 0.3308109641075134 and parameters: {'hidden_dims': '[512, 64]', 'dropout': 0.5097400689558543, 'batch_norm': True, 'graph_on': True, 'source': 'grm', 'knn_k': 7, 'weighted_edges': True, 'symmetrize_mode': 'union', 'lr': 1.1754329465577804e-06, 'weight_decay': 6.149079072330681e-06, 'epochs': 326, 'use_snp_selection': True, 'num_snps': 38000}. Best is trial 90 with value: 0.3308109641075134.
[I 2025-10-17 05:12:15,008] Trial 91 finished with value: 0.31553332805633544 and parameters: {'hidden_dims': '[512, 64]', 'dropout': 0.4661096319190194, 'batch_norm': True, 'graph_on': True, 'source': 'grm', 'knn_k': 7, 'weighted_edges': True, 'symmetrize_mode': 'union', 'lr': 1.5249552498647738e-06, 'weight_decay': 5.844875289178827e-06, 'epochs': 320, 'use_snp_selection': True, 'num_snps': 38000}. Best is trial 90 with value: 0.3308109641075134.
[I 2025-10-17 05:13:40,919] Trial 92 finished with value: 0.3095936954021454 and parameters: {'hidden_dims': '[512, 64]', 'dropout': 0.30210106670207787, 'batch_norm': True, 'graph_on': True, 'source': 'grm', 'knn_k': 7, 'weighted_edges': True, 'symmetrize_mode': 'union', 'lr': 1.2119311009393476e-06, 'weight_decay': 4.470220497406943e-06, 'epochs': 328, 'use_snp_selection': True, 'num_snps': 46000}. Best is trial 90 with value: 0.3308109641075134.
[I 2025-10-17 05:15:01,428] Trial 93 finished with value: 0.32386767864227295 and parameters: {'hidden_dims': '[512, 64]', 'dropout': 0.5056032673964047, 'batch_norm': True, 'graph_on': True, 'source': 'grm', 'knn_k': 7, 'weighted_edges': True, 'symmetrize_mode': 'union', 'lr': 1.809682284630479e-06, 'weight_decay': 2.821328614881803e-06, 'epochs': 342, 'use_snp_selection': True, 'num_snps': 40000}. Best is trial 90 with value: 0.3308109641075134.
[I 2025-10-17 05:16:05,910] Trial 94 finished with value: 0.3284249246120453 and parameters: {'hidden_dims': '[512, 64]', 'dropout': 0.4746730230769962, 'batch_norm': True, 'graph_on': True, 'source': 'grm', 'knn_k': 7, 'weighted_edges': True, 'symmetrize_mode': 'union', 'lr': 2.237004406127768e-06, 'weight_decay': 1.9734362985311496e-06, 'epochs': 305, 'use_snp_selection': True, 'num_snps': 34000}. Best is trial 90 with value: 0.3308109641075134.
[I 2025-10-17 05:17:10,653] Trial 95 finished with value: 0.32876962423324585 and parameters: {'hidden_dims': '[512, 128]', 'dropout': 0.47466910529786205, 'batch_norm': True, 'graph_on': True, 'source': 'grm', 'knn_k': 7, 'weighted_edges': True, 'symmetrize_mode': 'union', 'lr': 1.1445998195963096e-06, 'weight_decay': 1.6617376981833628e-06, 'epochs': 287, 'use_snp_selection': True, 'num_snps': 36000}. Best is trial 90 with value: 0.3308109641075134.
[I 2025-10-17 05:18:11,909] Trial 96 finished with value: 0.2583165466785431 and parameters: {'hidden_dims': '[512, 128]', 'dropout': 0.4752568888743919, 'batch_norm': True, 'graph_on': True, 'source': 'grm', 'knn_k': 1, 'weighted_edges': True, 'symmetrize_mode': 'union', 'lr': 1.1675448918993511e-06, 'weight_decay': 1.8502971612096081e-06, 'epochs': 292, 'use_snp_selection': True, 'num_snps': 34000}. Best is trial 90 with value: 0.3308109641075134.
[I 2025-10-17 05:19:08,843] Trial 97 finished with value: 0.3116956353187561 and parameters: {'hidden_dims': '[512, 128]', 'dropout': 0.34195933952021046, 'batch_norm': True, 'graph_on': True, 'source': 'grm', 'knn_k': 7, 'weighted_edges': True, 'symmetrize_mode': 'union', 'lr': 1.4673970718907237e-06, 'weight_decay': 1.4168352443909575e-06, 'epochs': 253, 'use_snp_selection': True, 'num_snps': 34000}. Best is trial 90 with value: 0.3308109641075134.
[I 2025-10-17 05:20:15,608] Trial 98 finished with value: 0.3057488739490509 and parameters: {'hidden_dims': '[512, 128]', 'dropout': 0.4951864171345272, 'batch_norm': True, 'graph_on': True, 'source': 'grm', 'knn_k': 7, 'weighted_edges': True, 'symmetrize_mode': 'mutual', 'lr': 1.0009356303301869e-06, 'weight_decay': 8.343114422905769e-07, 'epochs': 305, 'use_snp_selection': True, 'num_snps': 36000}. Best is trial 90 with value: 0.3308109641075134.
[I 2025-10-17 05:21:19,118] Trial 99 finished with value: 0.3265851497650146 and parameters: {'hidden_dims': '[512, 128]', 'dropout': 0.5502826257058209, 'batch_norm': True, 'graph_on': True, 'source': 'grm', 'knn_k': 7, 'weighted_edges': True, 'symmetrize_mode': 'union', 'lr': 2.441216833528095e-06, 'weight_decay': 6.01440896158954e-07, 'epochs': 267, 'use_snp_selection': True, 'num_snps': 38000}. Best is trial 90 with value: 0.3308109641075134.
[I 2025-10-17 05:22:17,096] Trial 100 finished with value: 0.3310714662075043 and parameters: {'hidden_dims': '[512, 64]', 'dropout': 0.5160029377635075, 'batch_norm': True, 'graph_on': True, 'source': 'grm', 'knn_k': 7, 'weighted_edges': True, 'symmetrize_mode': 'union', 'lr': 1.662270655568996e-06, 'weight_decay': 1.6703152708956042e-06, 'epochs': 288, 'use_snp_selection': True, 'num_snps': 30000}. Best is trial 100 with value: 0.3310714662075043.
[I 2025-10-17 05:23:15,339] Trial 101 finished with value: 0.32150004506111146 and parameters: {'hidden_dims': '[512, 64]', 'dropout': 0.5140571537173434, 'batch_norm': True, 'graph_on': True, 'source': 'grm', 'knn_k': 7, 'weighted_edges': True, 'symmetrize_mode': 'union', 'lr': 1.5189837491425432e-06, 'weight_decay': 1.8591437014200925e-06, 'epochs': 290, 'use_snp_selection': True, 'num_snps': 30000}. Best is trial 100 with value: 0.3310714662075043.
[I 2025-10-17 05:24:16,690] Trial 102 finished with value: 0.32768760323524476 and parameters: {'hidden_dims': '[512, 64]', 'dropout': 0.5685795307060754, 'batch_norm': True, 'graph_on': True, 'source': 'grm', 'knn_k': 7, 'weighted_edges': True, 'symmetrize_mode': 'union', 'lr': 1.1611665368331363e-06, 'weight_decay': 9.892469744638894e-07, 'epochs': 300, 'use_snp_selection': True, 'num_snps': 32000}. Best is trial 100 with value: 0.3310714662075043.
[I 2025-10-17 05:25:19,925] Trial 103 finished with value: 0.33207474946975707 and parameters: {'hidden_dims': '[512, 64]', 'dropout': 0.5353145115379004, 'batch_norm': True, 'graph_on': True, 'source': 'grm', 'knn_k': 7, 'weighted_edges': True, 'symmetrize_mode': 'union', 'lr': 1.6735085536479317e-06, 'weight_decay': 1.5225770592772832e-06, 'epochs': 279, 'use_snp_selection': True, 'num_snps': 36000}. Best is trial 103 with value: 0.33207474946975707.
[I 2025-10-17 05:26:29,046] Trial 104 finished with value: 0.3172457754611969 and parameters: {'hidden_dims': '[512, 64]', 'dropout': 0.5308595971164899, 'batch_norm': True, 'graph_on': True, 'source': 'grm', 'knn_k': 7, 'weighted_edges': True, 'symmetrize_mode': 'union', 'lr': 2.954951843839801e-06, 'weight_decay': 1.5251968145603664e-06, 'epochs': 277, 'use_snp_selection': True, 'num_snps': 40000}. Best is trial 103 with value: 0.33207474946975707.
[I 2025-10-17 05:27:36,848] Trial 105 finished with value: 0.2550539344549179 and parameters: {'hidden_dims': '[512, 256]', 'dropout': 0.43468561751201357, 'batch_norm': True, 'graph_on': True, 'source': 'grm', 'knn_k': 2, 'weighted_edges': True, 'symmetrize_mode': 'union', 'lr': 2.1775941904569912e-06, 'weight_decay': 7.675004079273939e-07, 'epochs': 312, 'use_snp_selection': True, 'num_snps': 36000}. Best is trial 103 with value: 0.33207474946975707.
[I 2025-10-17 05:28:38,148] Trial 106 finished with value: 0.3068744301795959 and parameters: {'hidden_dims': '[512, 64]', 'dropout': 0.48801406160810656, 'batch_norm': False, 'graph_on': True, 'source': 'grm', 'knn_k': 7, 'weighted_edges': False, 'symmetrize_mode': 'union', 'lr': 1.6992098313920386e-06, 'weight_decay': 2.170372901699845e-06, 'epochs': 286, 'use_snp_selection': True, 'num_snps': 34000}. Best is trial 103 with value: 0.33207474946975707.
[I 2025-10-17 05:29:37,268] Trial 107 finished with value: 0.31748553514480593 and parameters: {'hidden_dims': '[512, 64]', 'dropout': 0.48134736334090855, 'batch_norm': True, 'graph_on': True, 'source': 'grm', 'knn_k': 7, 'weighted_edges': True, 'symmetrize_mode': 'union', 'lr': 1.2639727379163882e-06, 'weight_decay': 3.8259823103484655e-07, 'epochs': 323, 'use_snp_selection': True, 'num_snps': 28000}. Best is trial 103 with value: 0.33207474946975707.
[I 2025-10-17 05:30:37,685] Trial 108 finished with value: 0.3163901686668396 and parameters: {'hidden_dims': '[512, 64]', 'dropout': 0.5436536317917433, 'batch_norm': True, 'graph_on': True, 'source': 'grm', 'knn_k': 7, 'weighted_edges': True, 'symmetrize_mode': 'union', 'lr': 2.452952445315129e-06, 'weight_decay': 3.080180827140015e-06, 'epochs': 248, 'use_snp_selection': True, 'num_snps': 38000}. Best is trial 103 with value: 0.33207474946975707.
[I 2025-10-17 05:31:30,973] Trial 109 finished with value: 0.32435014843940735 and parameters: {'hidden_dims': '[512, 64]', 'dropout': 0.37202893675626775, 'batch_norm': True, 'graph_on': True, 'source': 'grm', 'knn_k': 7, 'weighted_edges': True, 'symmetrize_mode': 'union', 'lr': 1.7238177801804731e-06, 'weight_decay': 4.562912500259094e-06, 'epochs': 239, 'use_snp_selection': True, 'num_snps': 32000}. Best is trial 103 with value: 0.33207474946975707.
[I 2025-10-17 05:32:02,750] Trial 110 finished with value: 0.2754246652126312 and parameters: {'hidden_dims': '[128, 64]', 'dropout': 0.5666148676848082, 'batch_norm': True, 'graph_on': True, 'source': 'grm', 'knn_k': 7, 'weighted_edges': True, 'symmetrize_mode': 'union', 'lr': 0.0009274022453508309, 'weight_decay': 2.3465188280696778e-06, 'epochs': 297, 'use_snp_selection': True, 'num_snps': 30000}. Best is trial 103 with value: 0.33207474946975707.
[I 2025-10-17 05:33:11,455] Trial 111 finished with value: 0.3241228938102722 and parameters: {'hidden_dims': '[512, 64]', 'dropout': 0.5170259704167917, 'batch_norm': True, 'graph_on': True, 'source': 'grm', 'knn_k': 7, 'weighted_edges': True, 'symmetrize_mode': 'union', 'lr': 1.431028077955441e-06, 'weight_decay': 1.5855004485296142e-06, 'epochs': 265, 'use_snp_selection': True, 'num_snps': 42000}. Best is trial 103 with value: 0.33207474946975707.
[I 2025-10-17 05:34:13,196] Trial 112 finished with value: 0.32644994258880616 and parameters: {'hidden_dims': '[512, 64]', 'dropout': 0.4721233394417042, 'batch_norm': True, 'graph_on': True, 'source': 'grm', 'knn_k': 7, 'weighted_edges': True, 'symmetrize_mode': 'union', 'lr': 2.1132584310345245e-06, 'weight_decay': 1.11453811768669e-06, 'epochs': 270, 'use_snp_selection': True, 'num_snps': 36000}. Best is trial 103 with value: 0.33207474946975707.
[I 2025-10-17 05:35:15,617] Trial 113 finished with value: 0.3317255020141602 and parameters: {'hidden_dims': '[512, 64]', 'dropout': 0.453975287291009, 'batch_norm': True, 'graph_on': True, 'source': 'grm', 'knn_k': 7, 'weighted_edges': True, 'symmetrize_mode': 'union', 'lr': 1.1298659110063344e-06, 'weight_decay': 5.623265940580563e-05, 'epochs': 350, 'use_snp_selection': True, 'num_snps': 28000}. Best is trial 103 with value: 0.33207474946975707.
[I 2025-10-17 05:36:18,047] Trial 114 finished with value: 0.32258756160736085 and parameters: {'hidden_dims': '[512, 64]', 'dropout': 0.4556317531594067, 'batch_norm': True, 'graph_on': True, 'source': 'grm', 'knn_k': 7, 'weighted_edges': True, 'symmetrize_mode': 'union', 'lr': 1.1620856431864988e-06, 'weight_decay': 1.2409945029326093e-06, 'epochs': 350, 'use_snp_selection': True, 'num_snps': 28000}. Best is trial 103 with value: 0.33207474946975707.
[I 2025-10-17 05:37:23,370] Trial 115 finished with value: 0.31257517337799073 and parameters: {'hidden_dims': '[512, 64]', 'dropout': 0.4921905728476139, 'batch_norm': True, 'graph_on': True, 'source': 'grm', 'knn_k': 7, 'weighted_edges': True, 'symmetrize_mode': 'union', 'lr': 1.8501330790579854e-06, 'weight_decay': 3.3084103530091934e-06, 'epochs': 343, 'use_snp_selection': True, 'num_snps': 30000}. Best is trial 103 with value: 0.33207474946975707.
[I 2025-10-17 05:38:32,342] Trial 116 finished with value: 0.3256850838661194 and parameters: {'hidden_dims': '[512, 128]', 'dropout': 0.41586415955254175, 'batch_norm': True, 'graph_on': True, 'source': 'grm', 'knn_k': 7, 'weighted_edges': True, 'symmetrize_mode': 'union', 'lr': 1.1100826437899673e-06, 'weight_decay': 9.795845188856026e-05, 'epochs': 335, 'use_snp_selection': True, 'num_snps': 34000}. Best is trial 103 with value: 0.33207474946975707.
[I 2025-10-17 05:39:10,781] Trial 117 finished with value: 0.2981738269329071 and parameters: {'hidden_dims': '[256, 128, 64]', 'dropout': 0.4354017750733411, 'batch_norm': True, 'graph_on': True, 'source': 'grm', 'knn_k': 7, 'weighted_edges': True, 'symmetrize_mode': 'mutual', 'lr': 1.3364182210698215e-06, 'weight_decay': 0.000124630064441522, 'epochs': 317, 'use_snp_selection': True, 'num_snps': 24000}. Best is trial 103 with value: 0.33207474946975707.
[I 2025-10-17 05:40:08,098] Trial 118 finished with value: 0.32339630722999574 and parameters: {'hidden_dims': '[512, 64]', 'dropout': 0.4650541308089628, 'batch_norm': True, 'graph_on': True, 'source': 'grm', 'knn_k': 6, 'weighted_edges': True, 'symmetrize_mode': 'union', 'lr': 2.8440944484689862e-06, 'weight_decay': 4.810915236668415e-05, 'epochs': 310, 'use_snp_selection': True, 'num_snps': 28000}. Best is trial 103 with value: 0.33207474946975707.
[I 2025-10-17 05:41:06,533] Trial 119 finished with value: 0.3184074401855469 and parameters: {'hidden_dims': '[512, 64]', 'dropout': 0.45217291225573697, 'batch_norm': True, 'graph_on': True, 'source': 'grm', 'knn_k': 7, 'weighted_edges': True, 'symmetrize_mode': 'union', 'lr': 3.369159865918689e-06, 'weight_decay': 4.254386779302225e-06, 'epochs': 279, 'use_snp_selection': True, 'num_snps': 32000}. Best is trial 103 with value: 0.33207474946975707.
[I 2025-10-17 05:41:42,776] Trial 120 finished with value: 0.2869996577501297 and parameters: {'hidden_dims': '[512, 64]', 'dropout': 0.47764050919367124, 'batch_norm': False, 'graph_on': True, 'source': 'grm', 'knn_k': 7, 'weighted_edges': False, 'symmetrize_mode': 'union', 'lr': 1.7036680253698686e-06, 'weight_decay': 6.335171432418647e-06, 'epochs': 148, 'use_snp_selection': True, 'num_snps': 26000}. Best is trial 103 with value: 0.33207474946975707.
[I 2025-10-17 05:42:47,097] Trial 121 finished with value: 0.32277672290802 and parameters: {'hidden_dims': '[512, 64]', 'dropout': 0.5052422165069538, 'batch_norm': True, 'graph_on': True, 'source': 'grm', 'knn_k': 7, 'weighted_edges': True, 'symmetrize_mode': 'union', 'lr': 2.1416227731732033e-06, 'weight_decay': 3.841972376512465e-05, 'epochs': 287, 'use_snp_selection': True, 'num_snps': 36000}. Best is trial 103 with value: 0.33207474946975707.
[I 2025-10-17 05:43:44,130] Trial 122 finished with value: 0.3235532581806183 and parameters: {'hidden_dims': '[512, 64]', 'dropout': 0.5256960199791838, 'batch_norm': True, 'graph_on': True, 'source': 'grm', 'knn_k': 7, 'weighted_edges': True, 'symmetrize_mode': 'union', 'lr': 1.3995473479441565e-06, 'weight_decay': 5.8704988091775446e-05, 'epochs': 323, 'use_snp_selection': True, 'num_snps': 26000}. Best is trial 103 with value: 0.33207474946975707.
[I 2025-10-17 05:44:25,762] Trial 123 finished with value: 0.3210462868213654 and parameters: {'hidden_dims': '[512, 64]', 'dropout': 0.3108305734138114, 'batch_norm': True, 'graph_on': True, 'source': 'grm', 'knn_k': 7, 'weighted_edges': True, 'symmetrize_mode': 'union', 'lr': 1.5416820265035492e-06, 'weight_decay': 1.230720098141556e-05, 'epochs': 256, 'use_snp_selection': True, 'num_snps': 20000}. Best is trial 103 with value: 0.33207474946975707.
[I 2025-10-17 05:45:35,141] Trial 124 finished with value: 0.3228604793548584 and parameters: {'hidden_dims': '[512, 64]', 'dropout': 0.5073848800979465, 'batch_norm': True, 'graph_on': True, 'source': 'grm', 'knn_k': 7, 'weighted_edges': True, 'symmetrize_mode': 'union', 'lr': 2.5626390540300517e-06, 'weight_decay': 7.543703893106591e-05, 'epochs': 304, 'use_snp_selection': True, 'num_snps': 38000}. Best is trial 103 with value: 0.33207474946975707.
[I 2025-10-17 05:46:27,126] Trial 125 finished with value: 0.3258581519126892 and parameters: {'hidden_dims': '[512, 64]', 'dropout': 0.4450426332619326, 'batch_norm': True, 'graph_on': True, 'source': 'grm', 'knn_k': 7, 'weighted_edges': True, 'symmetrize_mode': 'union', 'lr': 1.889285957922235e-06, 'weight_decay': 3.146694514379223e-05, 'epochs': 335, 'use_snp_selection': True, 'num_snps': 22000}. Best is trial 103 with value: 0.33207474946975707.
[I 2025-10-17 05:47:00,190] Trial 126 finished with value: 0.3179427206516266 and parameters: {'hidden_dims': '[128, 64]', 'dropout': 0.4963650651683867, 'batch_norm': True, 'graph_on': True, 'source': 'grm', 'knn_k': 7, 'weighted_edges': True, 'symmetrize_mode': 'union', 'lr': 1.3003374555653774e-06, 'weight_decay': 7.160935882830204e-05, 'epochs': 298, 'use_snp_selection': True, 'num_snps': 34000}. Best is trial 103 with value: 0.33207474946975707.
[I 2025-10-17 05:47:55,906] Trial 127 finished with value: 0.3261502325534821 and parameters: {'hidden_dims': '[512, 256]', 'dropout': 0.519305130862617, 'batch_norm': True, 'graph_on': True, 'source': 'grm', 'knn_k': 7, 'weighted_edges': True, 'symmetrize_mode': 'union', 'lr': 1.0064959383966243e-06, 'weight_decay': 2.2503245847349803e-06, 'epochs': 345, 'use_snp_selection': True, 'num_snps': 24000}. Best is trial 103 with value: 0.33207474946975707.
[I 2025-10-17 05:48:46,839] Trial 128 finished with value: 0.3295625627040863 and parameters: {'hidden_dims': '[512, 64]', 'dropout': 0.48419820218936266, 'batch_norm': True, 'graph_on': True, 'source': 'grm', 'knn_k': 6, 'weighted_edges': True, 'symmetrize_mode': 'union', 'lr': 1.5702105007401126e-06, 'weight_decay': 1.6228528461161473e-05, 'epochs': 258, 'use_snp_selection': True, 'num_snps': 28000}. Best is trial 103 with value: 0.33207474946975707.
[I 2025-10-17 05:49:36,001] Trial 129 finished with value: 0.3138868689537048 and parameters: {'hidden_dims': '[512, 64]', 'dropout': 0.4271080042535949, 'batch_norm': True, 'graph_on': True, 'source': 'grm', 'knn_k': 5, 'weighted_edges': True, 'symmetrize_mode': 'union', 'lr': 2.2841054019304194e-06, 'weight_decay': 1.4917687555731936e-05, 'epochs': 224, 'use_snp_selection': True, 'num_snps': 30000}. Best is trial 103 with value: 0.33207474946975707.
[I 2025-10-17 05:50:22,223] Trial 130 finished with value: 0.31317328214645385 and parameters: {'hidden_dims': '[512, 128]', 'dropout': 0.462805096913264, 'batch_norm': True, 'graph_on': True, 'source': 'grm', 'knn_k': 6, 'weighted_edges': True, 'symmetrize_mode': 'union', 'lr': 4.105530239702599e-06, 'weight_decay': 1.7255883165305468e-05, 'epochs': 191, 'use_snp_selection': True, 'num_snps': 32000}. Best is trial 103 with value: 0.33207474946975707.
[I 2025-10-17 05:51:13,717] Trial 131 finished with value: 0.3333899021148682 and parameters: {'hidden_dims': '[512, 64]', 'dropout': 0.4844403622418646, 'batch_norm': True, 'graph_on': True, 'source': 'grm', 'knn_k': 7, 'weighted_edges': True, 'symmetrize_mode': 'union', 'lr': 1.5811325469436075e-06, 'weight_decay': 5.457173521264961e-05, 'epochs': 261, 'use_snp_selection': True, 'num_snps': 28000}. Best is trial 131 with value: 0.3333899021148682.
[I 2025-10-17 05:52:03,415] Trial 132 finished with value: 0.3237953305244446 and parameters: {'hidden_dims': '[512, 64]', 'dropout': 0.48092101243047924, 'batch_norm': True, 'graph_on': True, 'source': 'grm', 'knn_k': 7, 'weighted_edges': True, 'symmetrize_mode': 'union', 'lr': 1.8154902911336149e-06, 'weight_decay': 9.586102180128951e-06, 'epochs': 247, 'use_snp_selection': True, 'num_snps': 28000}. Best is trial 131 with value: 0.3333899021148682.
[I 2025-10-17 05:52:54,060] Trial 133 finished with value: 0.2965325593948364 and parameters: {'hidden_dims': '[512, 64]', 'dropout': 0.47057054479563987, 'batch_norm': True, 'graph_on': True, 'source': 'grm', 'knn_k': 4, 'weighted_edges': True, 'symmetrize_mode': 'union', 'lr': 1.5678115005495883e-06, 'weight_decay': 2.5325880480775592e-05, 'epochs': 236, 'use_snp_selection': True, 'num_snps': 30000}. Best is trial 131 with value: 0.3333899021148682.
[I 2025-10-17 05:53:42,812] Trial 134 finished with value: 0.2969385266304016 and parameters: {'hidden_dims': '[512, 64]', 'dropout': 0.3323955379080801, 'batch_norm': True, 'graph_on': True, 'source': 'grm', 'knn_k': 3, 'weighted_edges': True, 'symmetrize_mode': 'union', 'lr': 1.1566329255455896e-06, 'weight_decay': 7.083879736658382e-06, 'epochs': 257, 'use_snp_selection': True, 'num_snps': 26000}. Best is trial 131 with value: 0.3333899021148682.
[I 2025-10-17 05:54:35,607] Trial 135 finished with value: 0.32303351163864136 and parameters: {'hidden_dims': '[512, 64]', 'dropout': 0.48860172381362366, 'batch_norm': True, 'graph_on': True, 'source': 'grm', 'knn_k': 7, 'weighted_edges': True, 'symmetrize_mode': 'union', 'lr': 2.118980299605281e-06, 'weight_decay': 5.041548355931668e-05, 'epochs': 272, 'use_snp_selection': True, 'num_snps': 28000}. Best is trial 131 with value: 0.3333899021148682.
[I 2025-10-17 05:55:32,617] Trial 136 finished with value: 0.32762972116470335 and parameters: {'hidden_dims': '[512, 64]', 'dropout': 0.45553497350896194, 'batch_norm': True, 'graph_on': True, 'source': 'grm', 'knn_k': 7, 'weighted_edges': True, 'symmetrize_mode': 'union', 'lr': 1.308709355759963e-06, 'weight_decay': 1.8055028086005164e-06, 'epochs': 281, 'use_snp_selection': True, 'num_snps': 30000}. Best is trial 131 with value: 0.3333899021148682.
[I 2025-10-17 05:56:25,843] Trial 137 finished with value: 0.3193404793739319 and parameters: {'hidden_dims': '[512, 64]', 'dropout': 0.5336291772697253, 'batch_norm': True, 'graph_on': True, 'source': 'grm', 'knn_k': 6, 'weighted_edges': True, 'symmetrize_mode': 'union', 'lr': 2.6789082441349884e-06, 'weight_decay': 6.591088604059434e-07, 'epochs': 292, 'use_snp_selection': True, 'num_snps': 26000}. Best is trial 131 with value: 0.3333899021148682.
