[I 2025-11-03 13:03:30,363] Trial 78 finished with value: 0.0896799797023298 and parameters: {'model_type': 'gcn', 'hidden_dims': '[512, 128]', 'dropout': 0.20585837119356132, 'batch_norm': True, 'lr': 0.00021439583708279662, 'weight_decay': 1.0069616738431247e-07, 'epochs': 277, 'loss': 'mse', 'optimizer': 'adam', 'graph_mode': 'off', 'use_snp_selection': False}. Best is trial 74 with value: 0.1266375421692321.
[I 2025-11-03 13:03:31,379] Trial 79 finished with value: 0.09308745810437562 and parameters: {'model_type': 'gcn', 'hidden_dims': '[512, 128]', 'dropout': 0.2596807024896184, 'batch_norm': True, 'lr': 9.34989907460591e-05, 'weight_decay': 2.0739519812574124e-07, 'epochs': 230, 'loss': 'mse', 'optimizer': 'adam', 'graph_mode': 'off', 'use_snp_selection': True, 'num_snps': 3769}. Best is trial 74 with value: 0.1266375421692321.
[I 2025-11-03 13:03:33,183] Trial 80 finished with value: 0.09617477561405037 and parameters: {'model_type': 'gcn', 'hidden_dims': '[512, 128]', 'dropout': 0.1896825833419428, 'batch_norm': True, 'lr': 0.00015935939571340554, 'weight_decay': 4.574706356960725e-07, 'epochs': 213, 'loss': 'mse', 'optimizer': 'adam', 'graph_mode': 'off', 'use_snp_selection': False}. Best is trial 74 with value: 0.1266375421692321.
[I 2025-11-03 13:03:35,136] Trial 81 finished with value: 0.09948442912821225 and parameters: {'model_type': 'gcn', 'hidden_dims': '[512, 128]', 'dropout': 0.15813086738415014, 'batch_norm': True, 'lr': 0.00036331602098175835, 'weight_decay': 3.387070329029341e-07, 'epochs': 246, 'loss': 'mse', 'optimizer': 'adam', 'graph_mode': 'off', 'use_snp_selection': False}. Best is trial 74 with value: 0.1266375421692321.
[I 2025-11-03 13:03:37,259] Trial 82 finished with value: 0.08986279229171451 and parameters: {'model_type': 'gcn', 'hidden_dims': '[512, 128]', 'dropout': 0.33631370426405466, 'batch_norm': True, 'lr': 0.00029146822522904453, 'weight_decay': 2.6263262189560663e-07, 'epochs': 289, 'loss': 'mse', 'optimizer': 'adam', 'graph_mode': 'off', 'use_snp_selection': False}. Best is trial 74 with value: 0.1266375421692321.
[I 2025-11-03 13:03:39,234] Trial 83 finished with value: 0.09463778472724389 and parameters: {'model_type': 'gcn', 'hidden_dims': '[512, 128]', 'dropout': 0.37048990063383735, 'batch_norm': True, 'lr': 0.00018602569018690265, 'weight_decay': 5.240301693236274e-07, 'epochs': 260, 'loss': 'mse', 'optimizer': 'adam', 'graph_mode': 'off', 'use_snp_selection': False}. Best is trial 74 with value: 0.1266375421692321.
[I 2025-11-03 13:03:41,462] Trial 84 finished with value: 0.0717362902310084 and parameters: {'model_type': 'gcn', 'hidden_dims': '[512, 128]', 'dropout': 0.21455675288535092, 'batch_norm': True, 'lr': 4.8093660468377304e-05, 'weight_decay': 6.823776716668984e-07, 'epochs': 305, 'loss': 'mse', 'optimizer': 'adam', 'graph_mode': 'off', 'use_snp_selection': False}. Best is trial 74 with value: 0.1266375421692321.
[I 2025-11-03 13:03:43,392] Trial 85 finished with value: 0.11870521569024271 and parameters: {'model_type': 'gcn', 'hidden_dims': '[512, 128]', 'dropout': 0.23257737098934608, 'batch_norm': True, 'lr': 0.0004884829099634954, 'weight_decay': 1.407433849436176e-07, 'epochs': 235, 'loss': 'mse', 'optimizer': 'adam', 'graph_mode': 'off', 'use_snp_selection': False}. Best is trial 74 with value: 0.1266375421692321.
[I 2025-11-03 13:03:45,318] Trial 86 finished with value: 0.09799482754676297 and parameters: {'model_type': 'gcn', 'hidden_dims': '[512, 128]', 'dropout': 0.18131662309990162, 'batch_norm': True, 'lr': 0.00046646599000951366, 'weight_decay': 1.444167921277187e-07, 'epochs': 240, 'loss': 'mse', 'optimizer': 'adam', 'graph_mode': 'off', 'use_snp_selection': False}. Best is trial 74 with value: 0.1266375421692321.
[I 2025-11-03 13:03:47,399] Trial 87 finished with value: 0.09586289835167393 and parameters: {'model_type': 'gcn', 'hidden_dims': '[512, 128]', 'dropout': 0.2391189174622551, 'batch_norm': True, 'lr': 0.00023050973062647165, 'weight_decay': 1.8888963409532193e-07, 'epochs': 254, 'loss': 'mse', 'optimizer': 'adam', 'graph_mode': 'off', 'use_snp_selection': False}. Best is trial 74 with value: 0.1266375421692321.
[I 2025-11-03 13:03:48,379] Trial 88 finished with value: 0.10462081116354592 and parameters: {'model_type': 'gcn', 'hidden_dims': '[128, 64]', 'dropout': 0.22800485552299252, 'batch_norm': False, 'lr': 0.00031210387051174016, 'weight_decay': 3.7185489622898356e-07, 'epochs': 194, 'loss': 'mse', 'optimizer': 'adam', 'graph_mode': 'off', 'use_snp_selection': False}. Best is trial 74 with value: 0.1266375421692321.
[I 2025-11-03 13:03:50,264] Trial 89 finished with value: 0.0975047274016641 and parameters: {'model_type': 'gcn', 'hidden_dims': '[512, 128]', 'dropout': 0.2745900009155563, 'batch_norm': True, 'lr': 0.0003733301113335849, 'weight_decay': 1.287251944258291e-07, 'epochs': 230, 'loss': 'mse', 'optimizer': 'adam', 'graph_mode': 'off', 'use_snp_selection': False}. Best is trial 74 with value: 0.1266375421692321.
[I 2025-11-03 13:03:52,021] Trial 90 finished with value: 0.10797928379132532 and parameters: {'model_type': 'gcn', 'hidden_dims': '[512, 128]', 'dropout': 0.20054415718333019, 'batch_norm': True, 'lr': 0.0004627487572942569, 'weight_decay': 2.2403461360379685e-07, 'epochs': 204, 'loss': 'mse', 'optimizer': 'adam', 'graph_mode': 'off', 'use_snp_selection': False}. Best is trial 74 with value: 0.1266375421692321.
[I 2025-11-03 13:03:54,100] Trial 91 finished with value: 0.11214697410146106 and parameters: {'model_type': 'gcn', 'hidden_dims': '[512, 128]', 'dropout': 0.16437403951396728, 'batch_norm': True, 'lr': 0.00048763729307516724, 'weight_decay': 3.296835914110339e-07, 'epochs': 278, 'loss': 'mse', 'optimizer': 'adam', 'graph_mode': 'off', 'use_snp_selection': False}. Best is trial 74 with value: 0.1266375421692321.
[I 2025-11-03 13:03:56,167] Trial 92 finished with value: 0.11848187415490748 and parameters: {'model_type': 'gcn', 'hidden_dims': '[512, 128]', 'dropout': 0.16649688643024899, 'batch_norm': True, 'lr': 0.0004885796027695242, 'weight_decay': 3.014070403721493e-07, 'epochs': 267, 'loss': 'mse', 'optimizer': 'adam', 'graph_mode': 'off', 'use_snp_selection': False}. Best is trial 74 with value: 0.1266375421692321.
[I 2025-11-03 13:03:58,236] Trial 93 finished with value: 0.10010890035503249 and parameters: {'model_type': 'gcn', 'hidden_dims': '[512, 128]', 'dropout': 0.18500535197151252, 'batch_norm': True, 'lr': 0.0003971641484120882, 'weight_decay': 2.6804294566246055e-07, 'epochs': 269, 'loss': 'mse', 'optimizer': 'adam', 'graph_mode': 'off', 'use_snp_selection': False}. Best is trial 74 with value: 0.1266375421692321.
[I 2025-11-03 13:03:59,729] Trial 94 finished with value: 0.09015216772378061 and parameters: {'model_type': 'gcn', 'hidden_dims': '[256, 128, 64]', 'dropout': 0.2131178799178473, 'batch_norm': True, 'lr': 0.00032563900945085076, 'weight_decay': 1.7079988695219667e-07, 'epochs': 218, 'loss': 'mse', 'optimizer': 'adam', 'graph_mode': 'off', 'use_snp_selection': False}. Best is trial 74 with value: 0.1266375421692321.
[I 2025-11-03 13:04:01,657] Trial 95 finished with value: 0.08703418757239349 and parameters: {'model_type': 'gcn', 'hidden_dims': '[512, 128]', 'dropout': 0.14299442394904238, 'batch_norm': True, 'lr': 0.0002579296074296218, 'weight_decay': 5.409408997316135e-07, 'epochs': 239, 'loss': 'mse', 'optimizer': 'adam', 'graph_mode': 'off', 'use_snp_selection': False}. Best is trial 74 with value: 0.1266375421692321.
[I 2025-11-03 13:04:04,335] Trial 96 finished with value: 0.10841631542036247 and parameters: {'model_type': 'gcn', 'hidden_dims': '[512, 128]', 'dropout': 0.19627309573484866, 'batch_norm': True, 'lr': 0.0006851998262009631, 'weight_decay': 3.9114047247955703e-07, 'epochs': 293, 'loss': 'mse', 'optimizer': 'adam', 'graph_mode': 'off', 'use_snp_selection': True, 'num_snps': 48962}. Best is trial 74 with value: 0.1266375421692321.
[I 2025-11-03 13:04:06,326] Trial 97 finished with value: 0.09082785442950345 and parameters: {'model_type': 'gcn', 'hidden_dims': '[512, 128]', 'dropout': 0.2498339109635974, 'batch_norm': True, 'lr': 0.0002964161050184396, 'weight_decay': 2.1342478745358378e-07, 'epochs': 253, 'loss': 'mse', 'optimizer': 'adam', 'graph_mode': 'off', 'use_snp_selection': False}. Best is trial 74 with value: 0.1266375421692321.
[I 2025-11-03 13:04:08,167] Trial 98 finished with value: 0.11933348664943765 and parameters: {'model_type': 'gcn', 'hidden_dims': '[512, 128]', 'dropout': 0.1749902470798857, 'batch_norm': True, 'lr': 0.0006246411557344422, 'weight_decay': 4.372893130048002e-07, 'epochs': 230, 'loss': 'mse', 'optimizer': 'adam', 'graph_mode': 'off', 'use_snp_selection': False}. Best is trial 74 with value: 0.1266375421692321.
[I 2025-11-03 13:04:10,003] Trial 99 finished with value: 0.11139094441581417 and parameters: {'model_type': 'gcn', 'hidden_dims': '[512, 128]', 'dropout': 0.17494987137156987, 'batch_norm': True, 'lr': 0.0008386178385831753, 'weight_decay': 4.228151604541114e-07, 'epochs': 229, 'loss': 'mse', 'optimizer': 'adam', 'graph_mode': 'off', 'use_snp_selection': False}. Best is trial 74 with value: 0.1266375421692321.
[I 2025-11-03 13:04:11,683] Trial 100 finished with value: 0.10740925066822449 and parameters: {'model_type': 'gcn', 'hidden_dims': '[512, 128]', 'dropout': 0.2262074331128294, 'batch_norm': True, 'lr': 0.0006475195302280187, 'weight_decay': 1.780192850022624e-07, 'epochs': 187, 'loss': 'mse', 'optimizer': 'adam', 'graph_mode': 'off', 'use_snp_selection': False}. Best is trial 74 with value: 0.1266375421692321.
[I 2025-11-03 13:04:13,771] Trial 101 finished with value: 0.0998230656183468 and parameters: {'model_type': 'gcn', 'hidden_dims': '[512, 128]', 'dropout': 0.11969114405235193, 'batch_norm': True, 'lr': 0.0004908754508608831, 'weight_decay': 3.239700587116621e-07, 'epochs': 268, 'loss': 'mse', 'optimizer': 'adam', 'graph_mode': 'off', 'use_snp_selection': False}. Best is trial 74 with value: 0.1266375421692321.
[I 2025-11-03 13:04:15,600] Trial 102 finished with value: 0.11530246711431376 and parameters: {'model_type': 'gcn', 'hidden_dims': '[512, 128]', 'dropout': 0.1510189678837554, 'batch_norm': True, 'lr': 0.00035677469519833214, 'weight_decay': 1.1843730724583843e-07, 'epochs': 215, 'loss': 'mse', 'optimizer': 'adam', 'graph_mode': 'off', 'use_snp_selection': False}. Best is trial 74 with value: 0.1266375421692321.
[I 2025-11-03 13:04:17,397] Trial 103 finished with value: 0.112499691949219 and parameters: {'model_type': 'gcn', 'hidden_dims': '[512, 128]', 'dropout': 0.1668116160832906, 'batch_norm': True, 'lr': 0.0002181976891126327, 'weight_decay': 1.2543302765097293e-07, 'epochs': 219, 'loss': 'mse', 'optimizer': 'adam', 'graph_mode': 'off', 'use_snp_selection': False}. Best is trial 74 with value: 0.1266375421692321.
[I 2025-11-03 13:04:19,336] Trial 104 finished with value: 0.11013727722090577 and parameters: {'model_type': 'gcn', 'hidden_dims': '[512, 128]', 'dropout': 0.15613410012948195, 'batch_norm': True, 'lr': 0.0006343514742041545, 'weight_decay': 1.1273978142789749e-07, 'epochs': 235, 'loss': 'mse', 'optimizer': 'adam', 'graph_mode': 'off', 'use_snp_selection': False}. Best is trial 74 with value: 0.1266375421692321.
[I 2025-11-03 13:04:21,151] Trial 105 finished with value: 0.09897353628265305 and parameters: {'model_type': 'gcn', 'hidden_dims': '[512, 128]', 'dropout': 0.19349828329200075, 'batch_norm': True, 'lr': 0.0005256824681106356, 'weight_decay': 2.3843451998903853e-07, 'epochs': 210, 'loss': 'mse', 'optimizer': 'adam', 'graph_mode': 'off', 'use_snp_selection': False}. Best is trial 74 with value: 0.1266375421692321.
[I 2025-11-03 13:04:22,858] Trial 106 finished with value: 0.017975900187261543 and parameters: {'model_type': 'gcn', 'hidden_dims': '[512, 128]', 'dropout': 0.13832988002141178, 'batch_norm': False, 'lr': 0.00043904406619131033, 'weight_decay': 2.970211797902227e-07, 'epochs': 199, 'loss': 'mse', 'optimizer': 'adam', 'graph_mode': 'off', 'use_snp_selection': False}. Best is trial 74 with value: 0.1266375421692321.
[I 2025-11-03 13:04:24,011] Trial 107 finished with value: 0.0751906415691515 and parameters: {'model_type': 'gcn', 'hidden_dims': '[128, 64]', 'dropout': 0.18047530600054607, 'batch_norm': True, 'lr': 2.2031158580962367e-05, 'weight_decay': 1.5980153149871424e-07, 'epochs': 245, 'loss': 'mse', 'optimizer': 'adam', 'graph_mode': 'off', 'use_snp_selection': False}. Best is trial 74 with value: 0.1266375421692321.
[I 2025-11-03 13:04:25,810] Trial 108 finished with value: 0.10837016054468163 and parameters: {'model_type': 'gcn', 'hidden_dims': '[512, 128]', 'dropout': 0.20708627191598344, 'batch_norm': True, 'lr': 0.00031889762972243913, 'weight_decay': 7.456855334770197e-07, 'epochs': 223, 'loss': 'mse', 'optimizer': 'adam', 'graph_mode': 'off', 'use_snp_selection': False}. Best is trial 74 with value: 0.1266375421692321.
[I 2025-11-03 13:04:27,402] Trial 109 finished with value: 0.10385203643596472 and parameters: {'model_type': 'gcn', 'hidden_dims': '[256, 128, 64]', 'dropout': 0.38678313168656, 'batch_norm': True, 'lr': 0.0007768539222563151, 'weight_decay': 1.8939882440963473e-07, 'epochs': 235, 'loss': 'mse', 'optimizer': 'adam', 'graph_mode': 'off', 'use_snp_selection': False}. Best is trial 74 with value: 0.1266375421692321.
[I 2025-11-03 13:04:29,160] Trial 110 finished with value: 0.11038417852133335 and parameters: {'model_type': 'gcn', 'hidden_dims': '[512, 128]', 'dropout': 0.23374339728968524, 'batch_norm': True, 'lr': 0.0002450751159925232, 'weight_decay': 2.388614475570326e-07, 'epochs': 254, 'loss': 'mse', 'optimizer': 'adam', 'graph_mode': 'off', 'use_snp_selection': True, 'num_snps': 26398}. Best is trial 74 with value: 0.1266375421692321.
[I 2025-11-03 13:04:30,935] Trial 111 finished with value: 0.11730926912682402 and parameters: {'model_type': 'gcn', 'hidden_dims': '[512, 128]', 'dropout': 0.16473059863985812, 'batch_norm': True, 'lr': 0.0002003131213463113, 'weight_decay': 1.258809155782927e-07, 'epochs': 217, 'loss': 'mse', 'optimizer': 'adam', 'graph_mode': 'off', 'use_snp_selection': False}. Best is trial 74 with value: 0.1266375421692321.
[I 2025-11-03 13:04:32,706] Trial 112 finished with value: 0.11664045506329661 and parameters: {'model_type': 'gcn', 'hidden_dims': '[512, 128]', 'dropout': 0.17443014582003283, 'batch_norm': True, 'lr': 0.00018943972596878987, 'weight_decay': 1.3134766607630173e-07, 'epochs': 215, 'loss': 'mse', 'optimizer': 'adam', 'graph_mode': 'off', 'use_snp_selection': False}. Best is trial 74 with value: 0.1266375421692321.
[I 2025-11-03 13:04:34,517] Trial 113 finished with value: 0.11099429269900034 and parameters: {'model_type': 'gcn', 'hidden_dims': '[512, 128]', 'dropout': 0.1451858824152294, 'batch_norm': True, 'lr': 0.00011736186177012805, 'weight_decay': 1.2335757131886449e-07, 'epochs': 214, 'loss': 'mse', 'optimizer': 'adam', 'graph_mode': 'off', 'use_snp_selection': False}. Best is trial 74 with value: 0.1266375421692321.
[I 2025-11-03 13:04:36,400] Trial 114 finished with value: 0.08679796292496271 and parameters: {'model_type': 'gcn', 'hidden_dims': '[512, 128]', 'dropout': 0.19019546446275062, 'batch_norm': True, 'lr': 0.00019092923765857102, 'weight_decay': 1.0680969053259881e-07, 'epochs': 228, 'loss': 'mse', 'optimizer': 'adam', 'graph_mode': 'off', 'use_snp_selection': False}. Best is trial 74 with value: 0.1266375421692321.
[I 2025-11-03 13:04:38,115] Trial 115 finished with value: 0.10062503915914275 and parameters: {'model_type': 'gcn', 'hidden_dims': '[512, 128]', 'dropout': 0.22008902827418997, 'batch_norm': True, 'lr': 0.00020521987566928833, 'weight_decay': 1.5277636192486342e-07, 'epochs': 202, 'loss': 'mse', 'optimizer': 'adam', 'graph_mode': 'off', 'use_snp_selection': False}. Best is trial 74 with value: 0.1266375421692321.
[I 2025-11-03 13:04:39,788] Trial 116 finished with value: 0.09909135135880522 and parameters: {'model_type': 'gcn', 'hidden_dims': '[512, 128]', 'dropout': 0.15656790525733694, 'batch_norm': True, 'lr': 0.0001683926643383293, 'weight_decay': 1.378179162542616e-07, 'epochs': 189, 'loss': 'mse', 'optimizer': 'adam', 'graph_mode': 'off', 'use_snp_selection': False}. Best is trial 74 with value: 0.1266375421692321.
[I 2025-11-03 13:04:41,624] Trial 117 finished with value: 0.0517828042372623 and parameters: {'model_type': 'gcn', 'hidden_dims': '[512, 128]', 'dropout': 0.17175034322065783, 'batch_norm': True, 'lr': 1.019291588701599e-05, 'weight_decay': 1.9730956414674294e-07, 'epochs': 221, 'loss': 'mse', 'optimizer': 'adam', 'graph_mode': 'off', 'use_snp_selection': False}. Best is trial 74 with value: 0.1266375421692321.
[I 2025-11-03 13:04:43,575] Trial 118 finished with value: 0.11731410635764832 and parameters: {'model_type': 'gcn', 'hidden_dims': '[512, 128]', 'dropout': 0.12559619169971487, 'batch_norm': True, 'lr': 0.00027195488939152666, 'weight_decay': 1.0380904443194938e-07, 'epochs': 243, 'loss': 'mse', 'optimizer': 'adam', 'graph_mode': 'off', 'use_snp_selection': False}. Best is trial 74 with value: 0.1266375421692321.
[I 2025-11-03 13:04:45,655] Trial 119 finished with value: 0.09946201791303004 and parameters: {'model_type': 'gcn', 'hidden_dims': '[512, 128]', 'dropout': 0.1165245548420544, 'batch_norm': True, 'lr': 0.0001503386737912519, 'weight_decay': 1.00969367422273e-07, 'epochs': 268, 'loss': 'mse', 'optimizer': 'adam', 'graph_mode': 'off', 'use_snp_selection': False}. Best is trial 74 with value: 0.1266375421692321.
[I 2025-11-03 13:04:47,585] Trial 120 finished with value: 0.09974151487425613 and parameters: {'model_type': 'gcn', 'hidden_dims': '[512, 128]', 'dropout': 0.1295382489350788, 'batch_norm': True, 'lr': 0.0002813539763576572, 'weight_decay': 1.582992423247106e-07, 'epochs': 248, 'loss': 'mse', 'optimizer': 'adam', 'graph_mode': 'off', 'use_snp_selection': False}. Best is trial 74 with value: 0.1266375421692321.
[I 2025-11-03 13:04:49,480] Trial 121 finished with value: 0.11313019465166013 and parameters: {'model_type': 'gcn', 'hidden_dims': '[512, 128]', 'dropout': 0.14773500953034996, 'batch_norm': True, 'lr': 0.0003593243279800775, 'weight_decay': 2.7930666775579083e-07, 'epochs': 242, 'loss': 'mse', 'optimizer': 'adam', 'graph_mode': 'off', 'use_snp_selection': False}. Best is trial 74 with value: 0.1266375421692321.
[I 2025-11-03 13:04:51,293] Trial 122 finished with value: 0.09461710397909655 and parameters: {'model_type': 'gcn', 'hidden_dims': '[512, 128]', 'dropout': 0.20139187970874975, 'batch_norm': True, 'lr': 6.455743032278106e-05, 'weight_decay': 1.274748290498174e-07, 'epochs': 214, 'loss': 'mse', 'optimizer': 'adam', 'graph_mode': 'off', 'use_snp_selection': False}. Best is trial 74 with value: 0.1266375421692321.
[I 2025-11-03 13:04:53,222] Trial 123 finished with value: 0.09839650869867936 and parameters: {'model_type': 'gcn', 'hidden_dims': '[512, 128]', 'dropout': 0.40017410247155144, 'batch_norm': True, 'lr': 0.0002423685656452666, 'weight_decay': 4.1689485799777767e-07, 'epochs': 235, 'loss': 'mse', 'optimizer': 'adam', 'graph_mode': 'off', 'use_snp_selection': False}. Best is trial 74 with value: 0.1266375421692321.
[I 2025-11-03 13:04:55,241] Trial 124 finished with value: 0.11566008143077984 and parameters: {'model_type': 'gcn', 'hidden_dims': '[512, 128]', 'dropout': 0.1743907275099401, 'batch_norm': True, 'lr': 0.00015079403785488702, 'weight_decay': 2.205567800619393e-07, 'epochs': 259, 'loss': 'mse', 'optimizer': 'adam', 'graph_mode': 'off', 'use_snp_selection': False}. Best is trial 74 with value: 0.1266375421692321.
[I 2025-11-03 13:04:57,215] Trial 125 finished with value: 0.0900033179306588 and parameters: {'model_type': 'gcn', 'hidden_dims': '[512, 128]', 'dropout': 0.17961613399707027, 'batch_norm': True, 'lr': 0.0001400964147603697, 'weight_decay': 2.1282320508134598e-07, 'epochs': 256, 'loss': 'mse', 'optimizer': 'adam', 'graph_mode': 'off', 'use_snp_selection': False}. Best is trial 74 with value: 0.1266375421692321.
[I 2025-11-03 13:04:59,260] Trial 126 finished with value: 0.08185359926592312 and parameters: {'model_type': 'gcn', 'hidden_dims': '[512, 128]', 'dropout': 0.16335547700358424, 'batch_norm': False, 'lr': 0.00017546199765760415, 'weight_decay': 1.6692275422641762e-07, 'epochs': 274, 'loss': 'mse', 'optimizer': 'adam', 'graph_mode': 'off', 'use_snp_selection': False}. Best is trial 74 with value: 0.1266375421692321.
[I 2025-11-03 13:05:01,070] Trial 127 finished with value: 0.08858714082859762 and parameters: {'model_type': 'gcn', 'hidden_dims': '[512, 128]', 'dropout': 0.1334257232435178, 'batch_norm': True, 'lr': 0.00011814580573094433, 'weight_decay': 2.5598022660206236e-07, 'epochs': 224, 'loss': 'mse', 'optimizer': 'adam', 'graph_mode': 'off', 'use_snp_selection': False}. Best is trial 74 with value: 0.1266375421692321.
[I 2025-11-03 13:05:03,032] Trial 128 finished with value: 0.1015646475628269 and parameters: {'model_type': 'gcn', 'hidden_dims': '[512, 128]', 'dropout': 0.15132254968345052, 'batch_norm': True, 'lr': 0.00027519762081028884, 'weight_decay': 1.2207154123602254e-07, 'epochs': 249, 'loss': 'mse', 'optimizer': 'adam', 'graph_mode': 'off', 'use_snp_selection': False}. Best is trial 74 with value: 0.1266375421692321.
[I 2025-11-03 13:05:05,068] Trial 129 finished with value: 0.10822134331508461 and parameters: {'model_type': 'gcn', 'hidden_dims': '[512, 128]', 'dropout': 0.21411559054405788, 'batch_norm': True, 'lr': 0.0002011633197963042, 'weight_decay': 1.0220186475537251e-07, 'epochs': 263, 'loss': 'mse', 'optimizer': 'adam', 'graph_mode': 'off', 'use_snp_selection': False}. Best is trial 74 with value: 0.1266375421692321.
