[I 2025-11-03 14:19:17,864] Trial 75 finished with value: 0.14914375472708408 and parameters: {'model_type': 'graphsage', 'hidden_dims': '[512, 128]', 'dropout': 0.4978398721170833, 'batch_norm': True, 'lr': 0.00028601915796459457, 'weight_decay': 2.4981817376691757e-06, 'epochs': 238, 'loss': 'mae', 'optimizer': 'adam', 'graph_mode': 'knn', 'source': 'grm', 'knn_k': 9, 'weighted_edges': True, 'symmetrize_mode': 'mutual', 'use_snp_selection': False}. Best is trial 55 with value: 0.15949987873804383.
[I 2025-11-03 14:19:29,364] Trial 76 finished with value: 0.13278407479623874 and parameters: {'model_type': 'graphsage', 'hidden_dims': '[512, 128]', 'dropout': 0.5693990383990244, 'batch_norm': True, 'lr': 0.0004280528404802371, 'weight_decay': 5.106851227495142e-06, 'epochs': 285, 'loss': 'mae', 'optimizer': 'adam', 'graph_mode': 'knn', 'source': 'grm', 'knn_k': 9, 'weighted_edges': False, 'symmetrize_mode': 'mutual', 'use_snp_selection': False}. Best is trial 55 with value: 0.15949987873804383.
[I 2025-11-03 14:19:40,560] Trial 77 finished with value: 0.14556812825628587 and parameters: {'model_type': 'graphsage', 'hidden_dims': '[512, 128]', 'dropout': 0.5202781008278624, 'batch_norm': True, 'lr': 0.00023238053882592994, 'weight_decay': 1.5136043422628666e-06, 'epochs': 277, 'loss': 'mae', 'optimizer': 'adam', 'graph_mode': 'knn', 'source': 'grm', 'knn_k': 9, 'weighted_edges': True, 'symmetrize_mode': 'mutual', 'use_snp_selection': False}. Best is trial 55 with value: 0.15949987873804383.
[I 2025-11-03 14:19:50,523] Trial 78 finished with value: 0.09102741494922664 and parameters: {'model_type': 'graphsage', 'hidden_dims': '[512, 128]', 'dropout': 0.48752081732094865, 'batch_norm': False, 'lr': 0.0005567475111689192, 'weight_decay': 3.155585209451582e-06, 'epochs': 269, 'loss': 'mae', 'optimizer': 'adam', 'graph_mode': 'knn', 'source': 'grm', 'knn_k': 2, 'weighted_edges': True, 'symmetrize_mode': 'mutual', 'use_snp_selection': True, 'num_snps': 49628}. Best is trial 55 with value: 0.15949987873804383.
[I 2025-11-03 14:20:00,947] Trial 79 finished with value: 0.1348649641189942 and parameters: {'model_type': 'graphsage', 'hidden_dims': '[512, 128]', 'dropout': 0.470085191417663, 'batch_norm': True, 'lr': 0.0008114108067272645, 'weight_decay': 1.023170061144298e-06, 'epochs': 245, 'loss': 'mae', 'optimizer': 'adam', 'graph_mode': 'knn', 'source': 'grm', 'knn_k': 10, 'weighted_edges': False, 'symmetrize_mode': 'mutual', 'use_snp_selection': False}. Best is trial 55 with value: 0.15949987873804383.
[I 2025-11-03 14:20:10,753] Trial 80 finished with value: 0.1391810968228481 and parameters: {'model_type': 'graphsage', 'hidden_dims': '[512, 128]', 'dropout': 0.5469733729643635, 'batch_norm': True, 'lr': 0.00021222916991777373, 'weight_decay': 5.56107974870524e-06, 'epochs': 303, 'loss': 'mae', 'optimizer': 'adam', 'graph_mode': 'cutoff', 'cutoff': 0.5743609294765462, 'grm_norm': 'gcn', 'self_loops': False, 'use_snp_selection': False}. Best is trial 55 with value: 0.15949987873804383.
[I 2025-11-03 14:20:21,753] Trial 81 finished with value: 0.15040530623476261 and parameters: {'model_type': 'graphsage', 'hidden_dims': '[512, 128]', 'dropout': 0.5287661380922687, 'batch_norm': True, 'lr': 0.00047618280751892577, 'weight_decay': 2.0571667623972486e-06, 'epochs': 262, 'loss': 'mae', 'optimizer': 'adam', 'graph_mode': 'knn', 'source': 'grm', 'knn_k': 10, 'weighted_edges': True, 'symmetrize_mode': 'mutual', 'use_snp_selection': False}. Best is trial 55 with value: 0.15949987873804383.
[I 2025-11-03 14:20:33,013] Trial 82 finished with value: 0.14403797326502477 and parameters: {'model_type': 'graphsage', 'hidden_dims': '[512, 128]', 'dropout': 0.5768719915002107, 'batch_norm': True, 'lr': 0.0003610505262420134, 'weight_decay': 3.952446745489253e-06, 'epochs': 269, 'loss': 'mae', 'optimizer': 'adam', 'graph_mode': 'knn', 'source': 'grm', 'knn_k': 10, 'weighted_edges': True, 'symmetrize_mode': 'mutual', 'use_snp_selection': False}. Best is trial 55 with value: 0.15949987873804383.
[I 2025-11-03 14:20:43,835] Trial 83 finished with value: 0.14749593074621195 and parameters: {'model_type': 'graphsage', 'hidden_dims': '[512, 128]', 'dropout': 0.5344577694035291, 'batch_norm': True, 'lr': 0.0004987446819906137, 'weight_decay': 7.913753809828279e-06, 'epochs': 262, 'loss': 'mae', 'optimizer': 'adam', 'graph_mode': 'knn', 'source': 'grm', 'knn_k': 9, 'weighted_edges': True, 'symmetrize_mode': 'mutual', 'use_snp_selection': False}. Best is trial 55 with value: 0.15949987873804383.
[I 2025-11-03 14:20:52,975] Trial 84 finished with value: 0.13733176806530858 and parameters: {'model_type': 'graphsage', 'hidden_dims': '[512, 128]', 'dropout': 0.5987253113562495, 'batch_norm': True, 'lr': 0.0007428251054131158, 'weight_decay': 1.8466082742660155e-06, 'epochs': 220, 'loss': 'mae', 'optimizer': 'adam', 'graph_mode': 'knn', 'source': 'grm', 'knn_k': 8, 'weighted_edges': True, 'symmetrize_mode': 'mutual', 'use_snp_selection': False}. Best is trial 55 with value: 0.15949987873804383.
[I 2025-11-03 14:21:01,276] Trial 85 finished with value: 0.14221485979121617 and parameters: {'model_type': 'graphsage', 'hidden_dims': '[256, 128, 64]', 'dropout': 0.5200126587102193, 'batch_norm': True, 'lr': 0.0002913028162683962, 'weight_decay': 2.935433544450564e-06, 'epochs': 291, 'loss': 'mae', 'optimizer': 'adam', 'graph_mode': 'knn', 'source': 'grm', 'knn_k': 10, 'weighted_edges': True, 'symmetrize_mode': 'mutual', 'use_snp_selection': False}. Best is trial 55 with value: 0.15949987873804383.
[I 2025-11-03 14:21:08,175] Trial 86 finished with value: 0.15623643130051307 and parameters: {'model_type': 'graphsage', 'hidden_dims': '[256, 128]', 'dropout': 0.5509150506156633, 'batch_norm': True, 'lr': 0.0006329548171512947, 'weight_decay': 1.6610167984978388e-06, 'epochs': 252, 'loss': 'mae', 'optimizer': 'adam', 'graph_mode': 'knn', 'source': 'grm', 'knn_k': 8, 'weighted_edges': True, 'symmetrize_mode': 'mutual', 'use_snp_selection': False}. Best is trial 55 with value: 0.15949987873804383.
[I 2025-11-03 14:21:17,767] Trial 87 finished with value: 0.13848018309154597 and parameters: {'model_type': 'graphsage', 'hidden_dims': '[256, 128]', 'dropout': 0.5493544772762973, 'batch_norm': True, 'lr': 0.0006757547134574589, 'weight_decay': 3.7296085944933347e-06, 'epochs': 282, 'loss': 'mae', 'optimizer': 'adam', 'graph_mode': 'knn', 'source': 'grm', 'knn_k': 8, 'weighted_edges': True, 'symmetrize_mode': 'union', 'use_snp_selection': False}. Best is trial 55 with value: 0.15949987873804383.
[I 2025-11-03 14:21:26,340] Trial 88 finished with value: 0.14395456589343683 and parameters: {'model_type': 'graphsage', 'hidden_dims': '[256, 128]', 'dropout': 0.5670232522973251, 'batch_norm': True, 'lr': 0.00018091605428278626, 'weight_decay': 6.01440896158954e-07, 'epochs': 331, 'loss': 'mae', 'optimizer': 'adam', 'graph_mode': 'knn', 'source': 'grm', 'knn_k': 8, 'weighted_edges': False, 'symmetrize_mode': 'mutual', 'use_snp_selection': False}. Best is trial 55 with value: 0.15949987873804383.
[I 2025-11-03 14:21:32,860] Trial 89 finished with value: 0.13505946729454607 and parameters: {'model_type': 'graphsage', 'hidden_dims': '[256, 128]', 'dropout': 0.4799715766697519, 'batch_norm': True, 'lr': 0.00036279974096178327, 'weight_decay': 1.653672572021307e-06, 'epochs': 234, 'loss': 'mae', 'optimizer': 'adam', 'graph_mode': 'knn', 'source': 'grm', 'knn_k': 8, 'weighted_edges': True, 'symmetrize_mode': 'mutual', 'use_snp_selection': False}. Best is trial 55 with value: 0.15949987873804383.
[I 2025-11-03 14:21:35,885] Trial 90 finished with value: 0.056512739475314294 and parameters: {'model_type': 'graphsage', 'hidden_dims': '[256, 128]', 'dropout': 0.5090914841763349, 'batch_norm': False, 'lr': 0.00016665828335054252, 'weight_decay': 2.6459385296880168e-06, 'epochs': 253, 'loss': 'mae', 'optimizer': 'adam', 'graph_mode': 'knn', 'source': 'grm', 'knn_k': 9, 'weighted_edges': True, 'symmetrize_mode': 'union', 'use_snp_selection': True, 'num_snps': 3647}. Best is trial 55 with value: 0.15949987873804383.
[I 2025-11-03 14:21:46,946] Trial 91 finished with value: 0.14018827231341732 and parameters: {'model_type': 'graphsage', 'hidden_dims': '[512, 128]', 'dropout': 0.5239737055444085, 'batch_norm': True, 'lr': 0.0005731240823357177, 'weight_decay': 1.257312124989009e-06, 'epochs': 271, 'loss': 'mae', 'optimizer': 'adam', 'graph_mode': 'knn', 'source': 'grm', 'knn_k': 9, 'weighted_edges': True, 'symmetrize_mode': 'mutual', 'use_snp_selection': False}. Best is trial 55 with value: 0.15949987873804383.
[I 2025-11-03 14:21:53,570] Trial 92 finished with value: 0.131105593869384 and parameters: {'model_type': 'graphsage', 'hidden_dims': '[256, 128, 64]', 'dropout': 0.5619360959827981, 'batch_norm': True, 'lr': 0.000999423448545456, 'weight_decay': 2.0287448741114404e-06, 'epochs': 247, 'loss': 'mae', 'optimizer': 'adam', 'graph_mode': 'knn', 'source': 'grm', 'knn_k': 7, 'weighted_edges': True, 'symmetrize_mode': 'mutual', 'use_snp_selection': False}. Best is trial 55 with value: 0.15949987873804383.
[I 2025-11-03 14:22:04,496] Trial 93 finished with value: 0.14832546258727192 and parameters: {'model_type': 'graphsage', 'hidden_dims': '[512, 128]', 'dropout': 0.4658240224988304, 'batch_norm': True, 'lr': 0.00024137905435324137, 'weight_decay': 8.719740055431385e-07, 'epochs': 259, 'loss': 'mae', 'optimizer': 'adam', 'graph_mode': 'knn', 'source': 'grm', 'knn_k': 10, 'weighted_edges': True, 'symmetrize_mode': 'mutual', 'use_snp_selection': False}. Best is trial 55 with value: 0.15949987873804383.
[I 2025-11-03 14:22:17,566] Trial 94 finished with value: 0.144854708385789 and parameters: {'model_type': 'graphsage', 'hidden_dims': '[512, 64]', 'dropout': 0.41609561256442784, 'batch_norm': True, 'lr': 0.0004161798640099763, 'weight_decay': 5.80503098968814e-06, 'epochs': 341, 'loss': 'mae', 'optimizer': 'adam', 'graph_mode': 'knn', 'source': 'grm', 'knn_k': 8, 'weighted_edges': True, 'symmetrize_mode': 'mutual', 'use_snp_selection': False}. Best is trial 55 with value: 0.15949987873804383.
[I 2025-11-03 14:22:29,984] Trial 95 finished with value: 0.14460605561080514 and parameters: {'model_type': 'graphsage', 'hidden_dims': '[512, 128]', 'dropout': 0.5419498992520424, 'batch_norm': True, 'lr': 0.0002872071540250712, 'weight_decay': 2.259249769028848e-06, 'epochs': 311, 'loss': 'mae', 'optimizer': 'adam', 'graph_mode': 'knn', 'source': 'grm', 'knn_k': 9, 'weighted_edges': True, 'symmetrize_mode': 'mutual', 'use_snp_selection': False}. Best is trial 55 with value: 0.15949987873804383.
[I 2025-11-03 14:22:35,475] Trial 96 finished with value: 0.1428132108598626 and parameters: {'model_type': 'graphsage', 'hidden_dims': '[256, 128, 64]', 'dropout': 0.5055293845643904, 'batch_norm': True, 'lr': 0.0002100719694609943, 'weight_decay': 0.0001216528605505208, 'epochs': 182, 'loss': 'mae', 'optimizer': 'adam', 'graph_mode': 'knn', 'source': 'grm', 'knn_k': 4, 'weighted_edges': True, 'symmetrize_mode': 'union', 'use_snp_selection': False}. Best is trial 55 with value: 0.15949987873804383.
[I 2025-11-03 14:22:42,686] Trial 97 finished with value: 0.14880781391049253 and parameters: {'model_type': 'graphsage', 'hidden_dims': '[256, 128]', 'dropout': 0.5334873596816224, 'batch_norm': True, 'lr': 0.0005719172619433123, 'weight_decay': 0.00017806052587882094, 'epochs': 279, 'loss': 'mae', 'optimizer': 'adam', 'graph_mode': 'knn', 'source': 'grm', 'knn_k': 7, 'weighted_edges': False, 'symmetrize_mode': 'mutual', 'use_snp_selection': False}. Best is trial 55 with value: 0.15949987873804383.
[I 2025-11-03 14:22:53,302] Trial 98 finished with value: 0.07993117909460407 and parameters: {'model_type': 'graphsage', 'hidden_dims': '[512, 128]', 'dropout': 0.2055615684294379, 'batch_norm': True, 'lr': 1.2189814811696432e-05, 'weight_decay': 4.821343421864318e-06, 'epochs': 291, 'loss': 'mae', 'optimizer': 'adam', 'graph_mode': 'cutoff', 'cutoff': 0.4505412639275435, 'grm_norm': 'cosine_then_gcn', 'self_loops': False, 'use_snp_selection': False}. Best is trial 55 with value: 0.15949987873804383.
[I 2025-11-03 14:23:05,064] Trial 99 finished with value: 0.14246031758792232 and parameters: {'model_type': 'graphsage', 'hidden_dims': '[512, 64]', 'dropout': 0.5596710296542678, 'batch_norm': True, 'lr': 0.0003298233092877476, 'weight_decay': 5.267605696289632e-05, 'epochs': 300, 'loss': 'mse', 'optimizer': 'adam', 'graph_mode': 'knn', 'source': 'grm', 'knn_k': 8, 'weighted_edges': True, 'symmetrize_mode': 'mutual', 'use_snp_selection': False}. Best is trial 55 with value: 0.15949987873804383.
[I 2025-11-03 14:23:13,954] Trial 100 finished with value: 0.10933497485959066 and parameters: {'model_type': 'graphsage', 'hidden_dims': '[256, 128, 64]', 'dropout': 0.37919024411947905, 'batch_norm': True, 'lr': 0.0001324536588349029, 'weight_decay': 1.244995251378166e-05, 'epochs': 240, 'loss': 'mae', 'optimizer': 'adam', 'graph_mode': 'knn', 'source': 'grm', 'knn_k': 9, 'weighted_edges': True, 'symmetrize_mode': 'union', 'use_snp_selection': False}. Best is trial 55 with value: 0.15949987873804383.
[I 2025-11-03 14:23:26,744] Trial 101 finished with value: 0.14794592162940512 and parameters: {'model_type': 'graphsage', 'hidden_dims': '[512, 256]', 'dropout': 0.5155814304252292, 'batch_norm': True, 'lr': 0.00011071595099837858, 'weight_decay': 6.323265450342197e-05, 'epochs': 341, 'loss': 'mae', 'optimizer': 'adam', 'graph_mode': 'knn', 'source': 'grm', 'knn_k': 7, 'weighted_edges': True, 'symmetrize_mode': 'mutual', 'use_snp_selection': False}. Best is trial 55 with value: 0.15949987873804383.
[I 2025-11-03 14:23:38,833] Trial 102 finished with value: 0.13771733610537934 and parameters: {'model_type': 'graphsage', 'hidden_dims': '[512, 256]', 'dropout': 0.4312819120032793, 'batch_norm': True, 'lr': 0.00016244400653014503, 'weight_decay': 1.7126718708582961e-06, 'epochs': 317, 'loss': 'mae', 'optimizer': 'adam', 'graph_mode': 'knn', 'source': 'grm', 'knn_k': 7, 'weighted_edges': True, 'symmetrize_mode': 'mutual', 'use_snp_selection': False}. Best is trial 55 with value: 0.15949987873804383.
[I 2025-11-03 14:23:51,460] Trial 103 finished with value: 0.14277573604604923 and parameters: {'model_type': 'graphsage', 'hidden_dims': '[512, 256]', 'dropout': 0.1776607064441154, 'batch_norm': True, 'lr': 0.00046982377458319117, 'weight_decay': 3.893954267325151e-05, 'epochs': 325, 'loss': 'mae', 'optimizer': 'adam', 'graph_mode': 'knn', 'source': 'grm', 'knn_k': 8, 'weighted_edges': True, 'symmetrize_mode': 'mutual', 'use_snp_selection': False}. Best is trial 55 with value: 0.15949987873804383.
[I 2025-11-03 14:23:57,483] Trial 104 finished with value: 0.13545313669692882 and parameters: {'model_type': 'graphsage', 'hidden_dims': '[128, 64]', 'dropout': 0.5858928102830234, 'batch_norm': True, 'lr': 0.00010039748804697323, 'weight_decay': 8.732966847453228e-05, 'epochs': 333, 'loss': 'mae', 'optimizer': 'adam', 'graph_mode': 'knn', 'source': 'grm', 'knn_k': 7, 'weighted_edges': True, 'symmetrize_mode': 'mutual', 'use_snp_selection': False}. Best is trial 55 with value: 0.15949987873804383.
[I 2025-11-03 14:24:07,812] Trial 105 finished with value: 0.13767387426120717 and parameters: {'model_type': 'graphsage', 'hidden_dims': '[512, 256]', 'dropout': 0.18857599008280354, 'batch_norm': True, 'lr': 0.00026247329934085624, 'weight_decay': 2.4044214547477402e-05, 'epochs': 255, 'loss': 'mae', 'optimizer': 'adam', 'graph_mode': 'knn', 'source': 'grm', 'knn_k': 8, 'weighted_edges': True, 'symmetrize_mode': 'mutual', 'use_snp_selection': False}. Best is trial 55 with value: 0.15949987873804383.
[I 2025-11-03 14:24:19,972] Trial 106 finished with value: 0.14352977163930725 and parameters: {'model_type': 'graphsage', 'hidden_dims': '[512, 128]', 'dropout': 0.494497692821557, 'batch_norm': True, 'lr': 0.0003712618680630016, 'weight_decay': 8.789525916446924e-06, 'epochs': 344, 'loss': 'mae', 'optimizer': 'adam', 'graph_mode': 'knn', 'source': 'grm', 'knn_k': 5, 'weighted_edges': True, 'symmetrize_mode': 'mutual', 'use_snp_selection': False}. Best is trial 55 with value: 0.15949987873804383.
[I 2025-11-03 14:24:26,834] Trial 107 finished with value: 0.12818247760471127 and parameters: {'model_type': 'graphsage', 'hidden_dims': '[256, 128, 64]', 'dropout': 0.1699558884587605, 'batch_norm': True, 'lr': 0.0008528390829475462, 'weight_decay': 0.00032313514329711235, 'epochs': 333, 'loss': 'mae', 'optimizer': 'adam', 'graph_mode': 'knn', 'source': 'grm', 'knn_k': 2, 'weighted_edges': True, 'symmetrize_mode': 'mutual', 'use_snp_selection': False}. Best is trial 55 with value: 0.15949987873804383.
[I 2025-11-03 14:24:34,391] Trial 108 finished with value: 0.1250046460183115 and parameters: {'model_type': 'graphsage', 'hidden_dims': '[256, 128]', 'dropout': 0.24487295430336128, 'batch_norm': False, 'lr': 0.00019516328262034628, 'weight_decay': 3.817713504247666e-06, 'epochs': 230, 'loss': 'mse', 'optimizer': 'adam', 'graph_mode': 'knn', 'source': 'grm', 'knn_k': 7, 'weighted_edges': False, 'symmetrize_mode': 'union', 'use_snp_selection': True, 'num_snps': 36947}. Best is trial 55 with value: 0.15949987873804383.
[I 2025-11-03 14:24:43,862] Trial 109 finished with value: 0.14526313187910878 and parameters: {'model_type': 'graphsage', 'hidden_dims': '[512, 256]', 'dropout': 0.2137829805775232, 'batch_norm': True, 'lr': 0.0006690930485148438, 'weight_decay': 6.102993117534837e-07, 'epochs': 266, 'loss': 'mae', 'optimizer': 'adam', 'graph_mode': 'knn', 'source': 'grm', 'knn_k': 3, 'weighted_edges': True, 'symmetrize_mode': 'mutual', 'use_snp_selection': False}. Best is trial 55 with value: 0.15949987873804383.
[I 2025-11-03 14:24:54,770] Trial 110 finished with value: 0.15081571314027148 and parameters: {'model_type': 'graphsage', 'hidden_dims': '[512, 64]', 'dropout': 0.1517772734966869, 'batch_norm': True, 'lr': 5.562082770167592e-05, 'weight_decay': 1.027216305420008e-06, 'epochs': 274, 'loss': 'mae', 'optimizer': 'adam', 'graph_mode': 'knn', 'source': 'grm', 'knn_k': 8, 'weighted_edges': True, 'symmetrize_mode': 'mutual', 'use_snp_selection': False}. Best is trial 55 with value: 0.15949987873804383.
[I 2025-11-03 14:25:05,667] Trial 111 finished with value: 0.145906433450676 and parameters: {'model_type': 'graphsage', 'hidden_dims': '[512, 64]', 'dropout': 0.1504432000189642, 'batch_norm': True, 'lr': 5.749638162652193e-05, 'weight_decay': 2.5485698718003264e-06, 'epochs': 274, 'loss': 'mae', 'optimizer': 'adam', 'graph_mode': 'knn', 'source': 'grm', 'knn_k': 8, 'weighted_edges': True, 'symmetrize_mode': 'mutual', 'use_snp_selection': False}. Best is trial 55 with value: 0.15949987873804383.
[I 2025-11-03 14:25:19,003] Trial 112 finished with value: 0.14658082224314606 and parameters: {'model_type': 'graphsage', 'hidden_dims': '[512, 64]', 'dropout': 0.12051546891474052, 'batch_norm': True, 'lr': 0.00011623535043311397, 'weight_decay': 1.0832025741693764e-06, 'epochs': 350, 'loss': 'mae', 'optimizer': 'adam', 'graph_mode': 'knn', 'source': 'grm', 'knn_k': 8, 'weighted_edges': True, 'symmetrize_mode': 'mutual', 'use_snp_selection': False}. Best is trial 55 with value: 0.15949987873804383.
[I 2025-11-03 14:25:29,748] Trial 113 finished with value: 0.14527193540708755 and parameters: {'model_type': 'graphsage', 'hidden_dims': '[512, 64]', 'dropout': 0.18930034231039194, 'batch_norm': True, 'lr': 8.985279661605008e-05, 'weight_decay': 7.298766766444557e-07, 'epochs': 285, 'loss': 'mae', 'optimizer': 'adam', 'graph_mode': 'knn', 'source': 'grm', 'knn_k': 6, 'weighted_edges': True, 'symmetrize_mode': 'mutual', 'use_snp_selection': False}. Best is trial 55 with value: 0.15949987873804383.
[I 2025-11-03 14:25:41,924] Trial 114 finished with value: 0.14056247954252651 and parameters: {'model_type': 'graphsage', 'hidden_dims': '[512, 64]', 'dropout': 0.1680680662183747, 'batch_norm': True, 'lr': 2.6775023446636356e-05, 'weight_decay': 1.395770335656882e-06, 'epochs': 306, 'loss': 'mae', 'optimizer': 'adam', 'graph_mode': 'knn', 'source': 'grm', 'knn_k': 9, 'weighted_edges': True, 'symmetrize_mode': 'mutual', 'use_snp_selection': False}. Best is trial 55 with value: 0.15949987873804383.
[I 2025-11-03 14:25:53,307] Trial 115 finished with value: 0.14979211566633172 and parameters: {'model_type': 'graphsage', 'hidden_dims': '[512, 128]', 'dropout': 0.14238705124416806, 'batch_norm': True, 'lr': 0.000168907542551666, 'weight_decay': 5.01629656749608e-07, 'epochs': 296, 'loss': 'mae', 'optimizer': 'adam', 'graph_mode': 'knn', 'source': 'grm', 'knn_k': 7, 'weighted_edges': True, 'symmetrize_mode': 'mutual', 'use_snp_selection': False}. Best is trial 55 with value: 0.15949987873804383.
[I 2025-11-03 14:26:01,791] Trial 116 finished with value: 0.12266454528216378 and parameters: {'model_type': 'graphsage', 'hidden_dims': '[512, 64]', 'dropout': 0.2239907378882758, 'batch_norm': True, 'lr': 6.289607823938151e-05, 'weight_decay': 6.969364797921405e-05, 'epochs': 256, 'loss': 'mae', 'optimizer': 'adam', 'graph_mode': 'cutoff', 'cutoff': 0.8000328009838027, 'grm_norm': 'cosine', 'self_loops': True, 'use_snp_selection': False}. Best is trial 55 with value: 0.15949987873804383.
[I 2025-11-03 14:26:11,211] Trial 117 finished with value: 0.12483844355016524 and parameters: {'model_type': 'graphsage', 'hidden_dims': '[256, 128, 64]', 'dropout': 0.5405297385437786, 'batch_norm': True, 'lr': 8.192541187417043e-05, 'weight_decay': 3.3775499803214184e-05, 'epochs': 275, 'loss': 'mae', 'optimizer': 'adam', 'graph_mode': 'knn', 'source': 'grm', 'knn_k': 8, 'weighted_edges': True, 'symmetrize_mode': 'union', 'use_snp_selection': False}. Best is trial 55 with value: 0.15949987873804383.
