[I 2025-11-03 12:44:18,482] Trial 81 finished with value: 0.05906950203255246 and parameters: {'model_type': 'gcn', 'hidden_dims': '[512, 64]', 'dropout': 0.3065473041043433, 'batch_norm': True, 'lr': 0.00021591500316036976, 'weight_decay': 2.2793299082413534e-07, 'epochs': 269, 'loss': 'mae', 'optimizer': 'adam', 'graph_mode': 'knn', 'source': 'grm', 'knn_k': 1, 'weighted_edges': True, 'symmetrize_mode': 'union', 'use_snp_selection': False}. Best is trial 46 with value: 0.09113089337527672.
[I 2025-11-03 12:44:21,474] Trial 82 finished with value: 0.06305134915905869 and parameters: {'model_type': 'gcn', 'hidden_dims': '[512, 64]', 'dropout': 0.2497167989884023, 'batch_norm': True, 'lr': 0.00019157117671048283, 'weight_decay': 1.3538241106570574e-07, 'epochs': 294, 'loss': 'mae', 'optimizer': 'adam', 'graph_mode': 'knn', 'source': 'grm', 'knn_k': 1, 'weighted_edges': True, 'symmetrize_mode': 'union', 'use_snp_selection': False}. Best is trial 46 with value: 0.09113089337527672.
[I 2025-11-03 12:44:24,145] Trial 83 finished with value: 0.06489977085933332 and parameters: {'model_type': 'gcn', 'hidden_dims': '[512, 64]', 'dropout': 0.31715941416637067, 'batch_norm': True, 'lr': 0.00014073832553115773, 'weight_decay': 2.6733928092407477e-07, 'epochs': 238, 'loss': 'mae', 'optimizer': 'adam', 'graph_mode': 'knn', 'source': 'grm', 'knn_k': 1, 'weighted_edges': True, 'symmetrize_mode': 'union', 'use_snp_selection': False}. Best is trial 46 with value: 0.09113089337527672.
[I 2025-11-03 12:44:26,546] Trial 84 finished with value: 0.02102271849777234 and parameters: {'model_type': 'gcn', 'hidden_dims': '[512, 64]', 'dropout': 0.34448969777080196, 'batch_norm': True, 'lr': 0.0003642609240316562, 'weight_decay': 1.2835524991518116e-07, 'epochs': 191, 'loss': 'mae', 'optimizer': 'adam', 'graph_mode': 'knn', 'source': 'grm', 'knn_k': 2, 'weighted_edges': True, 'symmetrize_mode': 'union', 'use_snp_selection': False}. Best is trial 46 with value: 0.09113089337527672.
[I 2025-11-03 12:44:29,432] Trial 85 finished with value: 0.059329442846595505 and parameters: {'model_type': 'gcn', 'hidden_dims': '[512, 64]', 'dropout': 0.28130429512664484, 'batch_norm': True, 'lr': 0.000257757791059184, 'weight_decay': 4.856655118475369e-07, 'epochs': 276, 'loss': 'mae', 'optimizer': 'adam', 'graph_mode': 'knn', 'source': 'grm', 'knn_k': 1, 'weighted_edges': True, 'symmetrize_mode': 'union', 'use_snp_selection': False}. Best is trial 46 with value: 0.09113089337527672.
[I 2025-11-03 12:44:31,521] Trial 86 finished with value: 0.05346379010668056 and parameters: {'model_type': 'gcn', 'hidden_dims': '[256, 128]', 'dropout': 0.29996975482859106, 'batch_norm': True, 'lr': 0.0005686948066316329, 'weight_decay': 2.1297851689023878e-07, 'epochs': 256, 'loss': 'mse', 'optimizer': 'adam', 'graph_mode': 'knn', 'source': 'grm', 'knn_k': 1, 'weighted_edges': True, 'symmetrize_mode': 'union', 'use_snp_selection': False}. Best is trial 46 with value: 0.09113089337527672.
[I 2025-11-03 12:44:34,089] Trial 87 finished with value: -0.0009065155819897972 and parameters: {'model_type': 'gcn', 'hidden_dims': '[512, 256]', 'dropout': 0.2648809442162206, 'batch_norm': True, 'lr': 2.332831021115922e-05, 'weight_decay': 5.5089096636323395e-05, 'epochs': 214, 'loss': 'mae', 'optimizer': 'adam', 'graph_mode': 'knn', 'source': 'grm', 'knn_k': 10, 'weighted_edges': True, 'symmetrize_mode': 'union', 'use_snp_selection': False}. Best is trial 46 with value: 0.09113089337527672.
[I 2025-11-03 12:44:37,005] Trial 88 finished with value: 0.07269173355338272 and parameters: {'model_type': 'gcn', 'hidden_dims': '[512, 64]', 'dropout': 0.33098870418730664, 'batch_norm': True, 'lr': 0.00020428810835012987, 'weight_decay': 3.538043242342213e-07, 'epochs': 282, 'loss': 'mse', 'optimizer': 'adam', 'graph_mode': 'knn', 'source': 'grm', 'knn_k': 2, 'weighted_edges': False, 'symmetrize_mode': 'union', 'use_snp_selection': False}. Best is trial 46 with value: 0.09113089337527672.
[I 2025-11-03 12:44:38,844] Trial 89 finished with value: -0.007705121117217655 and parameters: {'model_type': 'gcn', 'hidden_dims': '[128, 64]', 'dropout': 0.24047705895309962, 'batch_norm': False, 'lr': 0.00037296412257932786, 'weight_decay': 1.5896471473541768e-07, 'epochs': 323, 'loss': 'mse', 'optimizer': 'adam', 'graph_mode': 'knn', 'source': 'grm', 'knn_k': 1, 'weighted_edges': True, 'symmetrize_mode': 'mutual', 'use_snp_selection': True, 'num_snps': 3785}. Best is trial 46 with value: 0.09113089337527672.
[I 2025-11-03 12:44:41,499] Trial 90 finished with value: 0.016550839023322887 and parameters: {'model_type': 'gcn', 'hidden_dims': '[512, 256]', 'dropout': 0.22353663896923626, 'batch_norm': True, 'lr': 0.00011141099606711692, 'weight_decay': 0.0003035818353218248, 'epochs': 225, 'loss': 'mae', 'optimizer': 'adam', 'graph_mode': 'knn', 'source': 'grm', 'knn_k': 2, 'weighted_edges': True, 'symmetrize_mode': 'union', 'use_snp_selection': False}. Best is trial 46 with value: 0.09113089337527672.
[I 2025-11-03 12:44:44,404] Trial 91 finished with value: 0.03415868376863914 and parameters: {'model_type': 'gcn', 'hidden_dims': '[512, 64]', 'dropout': 0.3349252339280002, 'batch_norm': True, 'lr': 0.00021007967400876436, 'weight_decay': 3.680931513039401e-07, 'epochs': 281, 'loss': 'mse', 'optimizer': 'adam', 'graph_mode': 'knn', 'source': 'grm', 'knn_k': 1, 'weighted_edges': False, 'symmetrize_mode': 'union', 'use_snp_selection': False}. Best is trial 46 with value: 0.09113089337527672.
[I 2025-11-03 12:44:47,215] Trial 92 finished with value: 0.04682975515753415 and parameters: {'model_type': 'gcn', 'hidden_dims': '[512, 64]', 'dropout': 0.38716463367586096, 'batch_norm': True, 'lr': 0.0001810579632071299, 'weight_decay': 1.9802217393719732e-07, 'epochs': 265, 'loss': 'mse', 'optimizer': 'adam', 'graph_mode': 'knn', 'source': 'grm', 'knn_k': 1, 'weighted_edges': False, 'symmetrize_mode': 'union', 'use_snp_selection': False}. Best is trial 46 with value: 0.09113089337527672.
[I 2025-11-03 12:44:50,156] Trial 93 finished with value: 0.04700895836228012 and parameters: {'model_type': 'gcn', 'hidden_dims': '[512, 64]', 'dropout': 0.35396233983517245, 'batch_norm': True, 'lr': 0.0002484313057805065, 'weight_decay': 2.974201969229534e-07, 'epochs': 286, 'loss': 'mse', 'optimizer': 'adam', 'graph_mode': 'knn', 'source': 'grm', 'knn_k': 2, 'weighted_edges': False, 'symmetrize_mode': 'union', 'use_snp_selection': False}. Best is trial 46 with value: 0.09113089337527672.
[I 2025-11-03 12:44:52,893] Trial 94 finished with value: 0.014377783115070078 and parameters: {'model_type': 'gcn', 'hidden_dims': '[512, 64]', 'dropout': 0.28620829532600905, 'batch_norm': True, 'lr': 0.00014996220132795736, 'weight_decay': 0.00012476366812935445, 'epochs': 252, 'loss': 'mse', 'optimizer': 'adam', 'graph_mode': 'knn', 'source': 'grm', 'knn_k': 1, 'weighted_edges': False, 'symmetrize_mode': 'union', 'use_snp_selection': False}. Best is trial 46 with value: 0.09113089337527672.
[I 2025-11-03 12:44:55,911] Trial 95 finished with value: 0.05496457729086545 and parameters: {'model_type': 'gcn', 'hidden_dims': '[512, 64]', 'dropout': 0.31691717939828734, 'batch_norm': True, 'lr': 0.0003158141675351773, 'weight_decay': 1.0411966759928495e-07, 'epochs': 296, 'loss': 'mse', 'optimizer': 'adam', 'graph_mode': 'knn', 'source': 'grm', 'knn_k': 2, 'weighted_edges': False, 'symmetrize_mode': 'union', 'use_snp_selection': False}. Best is trial 46 with value: 0.09113089337527672.
[I 2025-11-03 12:44:58,757] Trial 96 finished with value: 0.05309172188818708 and parameters: {'model_type': 'gcn', 'hidden_dims': '[512, 256]', 'dropout': 0.3650471808076781, 'batch_norm': True, 'lr': 7.353191586707089e-05, 'weight_decay': 9.490367328524051e-07, 'epochs': 270, 'loss': 'mse', 'optimizer': 'adam', 'graph_mode': 'knn', 'source': 'grm', 'knn_k': 1, 'weighted_edges': True, 'symmetrize_mode': 'union', 'use_snp_selection': False}. Best is trial 46 with value: 0.09113089337527672.
[I 2025-11-03 12:45:01,774] Trial 97 finished with value: 0.06267895300391392 and parameters: {'model_type': 'gcn', 'hidden_dims': '[512, 64]', 'dropout': 0.25961527139847346, 'batch_norm': True, 'lr': 0.0007188464038150965, 'weight_decay': 4.2834268892261295e-07, 'epochs': 306, 'loss': 'mse', 'optimizer': 'adam', 'graph_mode': 'cutoff', 'cutoff': 0.7864264008407802, 'grm_norm': 'cosine_then_gcn', 'self_loops': True, 'use_snp_selection': False}. Best is trial 46 with value: 0.09113089337527672.
[I 2025-11-03 12:45:03,753] Trial 98 finished with value: 0.05066956116302007 and parameters: {'model_type': 'gcn', 'hidden_dims': '[256, 128, 64]', 'dropout': 0.297523545298673, 'batch_norm': True, 'lr': 9.973442467801181e-05, 'weight_decay': 4.12725326873889e-05, 'epochs': 175, 'loss': 'mae', 'optimizer': 'adam', 'graph_mode': 'knn', 'source': 'grm', 'knn_k': 1, 'weighted_edges': True, 'symmetrize_mode': 'union', 'use_snp_selection': False}. Best is trial 46 with value: 0.09113089337527672.
[I 2025-11-03 12:45:05,519] Trial 99 finished with value: 0.025596810334920315 and parameters: {'model_type': 'gcn', 'hidden_dims': '[128, 64]', 'dropout': 0.32941519763408317, 'batch_norm': True, 'lr': 0.00013007549492425932, 'weight_decay': 2.1636208252967074e-05, 'epochs': 241, 'loss': 'mse', 'optimizer': 'adam', 'graph_mode': 'knn', 'source': 'grm', 'knn_k': 2, 'weighted_edges': True, 'symmetrize_mode': 'union', 'use_snp_selection': False}. Best is trial 46 with value: 0.09113089337527672.
[I 2025-11-03 12:45:07,940] Trial 100 finished with value: 0.02518059371117597 and parameters: {'model_type': 'gcn', 'hidden_dims': '[512, 64]', 'dropout': 0.280300789263288, 'batch_norm': True, 'lr': 0.00044761655173092426, 'weight_decay': 1.5050546514437309e-05, 'epochs': 197, 'loss': 'mse', 'optimizer': 'adam', 'graph_mode': 'knn', 'source': 'grm', 'knn_k': 1, 'weighted_edges': False, 'symmetrize_mode': 'union', 'use_snp_selection': False}. Best is trial 46 with value: 0.09113089337527672.
[I 2025-11-03 12:45:11,017] Trial 101 finished with value: 0.06381640673518402 and parameters: {'model_type': 'gcn', 'hidden_dims': '[512, 64]', 'dropout': 0.30849261626194235, 'batch_norm': True, 'lr': 0.00023534761036033273, 'weight_decay': 1.7246392600172977e-07, 'epochs': 279, 'loss': 'mae', 'optimizer': 'adam', 'graph_mode': 'knn', 'source': 'grm', 'knn_k': 1, 'weighted_edges': True, 'symmetrize_mode': 'union', 'use_snp_selection': False}. Best is trial 46 with value: 0.09113089337527672.
[I 2025-11-03 12:45:15,200] Trial 102 finished with value: 0.08150624033983674 and parameters: {'model_type': 'gcn', 'hidden_dims': '[512, 64]', 'dropout': 0.2755743400816941, 'batch_norm': True, 'lr': 0.00016064414081835428, 'weight_decay': 2.5172804824756227e-07, 'epochs': 260, 'loss': 'mae', 'optimizer': 'adam', 'graph_mode': 'knn', 'source': 'grm', 'knn_k': 1, 'weighted_edges': True, 'symmetrize_mode': 'union', 'use_snp_selection': False}. Best is trial 46 with value: 0.09113089337527672.
[I 2025-11-03 12:45:18,244] Trial 103 finished with value: 0.07006823276862119 and parameters: {'model_type': 'gcn', 'hidden_dims': '[512, 64]', 'dropout': 0.24909536714646555, 'batch_norm': True, 'lr': 0.0001626313648578929, 'weight_decay': 2.7582945418227417e-07, 'epochs': 260, 'loss': 'mae', 'optimizer': 'adam', 'graph_mode': 'knn', 'source': 'grm', 'knn_k': 1, 'weighted_edges': True, 'symmetrize_mode': 'union', 'use_snp_selection': False}. Best is trial 46 with value: 0.09113089337527672.
[I 2025-11-03 12:45:20,969] Trial 104 finished with value: 0.07959535593950531 and parameters: {'model_type': 'gcn', 'hidden_dims': '[512, 64]', 'dropout': 0.29939049692691294, 'batch_norm': True, 'lr': 0.00019073735691189946, 'weight_decay': 1.2035359209731156e-07, 'epochs': 248, 'loss': 'mae', 'optimizer': 'adam', 'graph_mode': 'knn', 'source': 'grm', 'knn_k': 1, 'weighted_edges': True, 'symmetrize_mode': 'union', 'use_snp_selection': False}. Best is trial 46 with value: 0.09113089337527672.
[I 2025-11-03 12:45:23,603] Trial 105 finished with value: 0.07912733399342922 and parameters: {'model_type': 'gcn', 'hidden_dims': '[512, 256]', 'dropout': 0.2723744621628296, 'batch_norm': True, 'lr': 0.0002888794529321487, 'weight_decay': 1.4157412135793943e-07, 'epochs': 231, 'loss': 'mae', 'optimizer': 'adam', 'graph_mode': 'knn', 'source': 'grm', 'knn_k': 1, 'weighted_edges': True, 'symmetrize_mode': 'union', 'use_snp_selection': False}. Best is trial 46 with value: 0.09113089337527672.
[I 2025-11-03 12:45:26,229] Trial 106 finished with value: 0.0645012191675415 and parameters: {'model_type': 'gcn', 'hidden_dims': '[512, 256]', 'dropout': 0.26245480287152295, 'batch_norm': True, 'lr': 0.00030606440570025945, 'weight_decay': 1.2013449920292365e-07, 'epochs': 230, 'loss': 'mae', 'optimizer': 'adam', 'graph_mode': 'knn', 'source': 'grm', 'knn_k': 1, 'weighted_edges': True, 'symmetrize_mode': 'union', 'use_snp_selection': False}. Best is trial 46 with value: 0.09113089337527672.
[I 2025-11-03 12:45:28,750] Trial 107 finished with value: 0.06073812315010228 and parameters: {'model_type': 'gcn', 'hidden_dims': '[512, 256]', 'dropout': 0.23284713757510908, 'batch_norm': True, 'lr': 0.00027446414884377463, 'weight_decay': 1.2161097934728596e-07, 'epochs': 211, 'loss': 'mae', 'optimizer': 'adam', 'graph_mode': 'knn', 'source': 'grm', 'knn_k': 1, 'weighted_edges': True, 'symmetrize_mode': 'union', 'use_snp_selection': False}. Best is trial 46 with value: 0.09113089337527672.
[I 2025-11-03 12:45:31,901] Trial 108 finished with value: 0.028779477949062913 and parameters: {'model_type': 'gcn', 'hidden_dims': '[512, 256]', 'dropout': 0.27261454404926383, 'batch_norm': False, 'lr': 0.0005286361984916015, 'weight_decay': 3.242067357721893e-05, 'epochs': 237, 'loss': 'mae', 'optimizer': 'adam', 'graph_mode': 'knn', 'source': 'grm', 'knn_k': 1, 'weighted_edges': True, 'symmetrize_mode': 'mutual', 'use_snp_selection': True, 'num_snps': 36947}. Best is trial 46 with value: 0.09113089337527672.
[I 2025-11-03 12:45:34,692] Trial 109 finished with value: 0.027160347927229614 and parameters: {'model_type': 'gcn', 'hidden_dims': '[512, 256]', 'dropout': 0.29192031079554215, 'batch_norm': True, 'lr': 0.000387974582134223, 'weight_decay': 1.5398258637571845e-07, 'epochs': 248, 'loss': 'mae', 'optimizer': 'adam', 'graph_mode': 'knn', 'source': 'grm', 'knn_k': 2, 'weighted_edges': True, 'symmetrize_mode': 'union', 'use_snp_selection': False}. Best is trial 46 with value: 0.09113089337527672.
[I 2025-11-03 12:45:37,359] Trial 110 finished with value: 0.05065927585842519 and parameters: {'model_type': 'gcn', 'hidden_dims': '[512, 256]', 'dropout': 0.20849606731110756, 'batch_norm': True, 'lr': 3.946777912552912e-05, 'weight_decay': 0.00010639110829083468, 'epochs': 226, 'loss': 'mae', 'optimizer': 'adam', 'graph_mode': 'knn', 'source': 'grm', 'knn_k': 1, 'weighted_edges': True, 'symmetrize_mode': 'union', 'use_snp_selection': False}. Best is trial 46 with value: 0.09113089337527672.
[I 2025-11-03 12:45:40,217] Trial 111 finished with value: 0.0793254856003828 and parameters: {'model_type': 'gcn', 'hidden_dims': '[512, 128]', 'dropout': 0.27699397044763396, 'batch_norm': True, 'lr': 0.00018423322570257993, 'weight_decay': 2.0161597741265496e-07, 'epochs': 270, 'loss': 'mae', 'optimizer': 'adam', 'graph_mode': 'knn', 'source': 'grm', 'knn_k': 1, 'weighted_edges': True, 'symmetrize_mode': 'union', 'use_snp_selection': False}. Best is trial 46 with value: 0.09113089337527672.
[I 2025-11-03 12:45:42,986] Trial 112 finished with value: 0.06125340686180055 and parameters: {'model_type': 'gcn', 'hidden_dims': '[512, 128]', 'dropout': 0.2716519696183442, 'batch_norm': True, 'lr': 0.0001870450294919962, 'weight_decay': 7.616242845079677e-05, 'epochs': 255, 'loss': 'mae', 'optimizer': 'adam', 'graph_mode': 'knn', 'source': 'grm', 'knn_k': 1, 'weighted_edges': True, 'symmetrize_mode': 'union', 'use_snp_selection': False}. Best is trial 46 with value: 0.09113089337527672.
[I 2025-11-03 12:45:45,862] Trial 113 finished with value: 0.049582261400006884 and parameters: {'model_type': 'gcn', 'hidden_dims': '[512, 128]', 'dropout': 0.24420430027580026, 'batch_norm': True, 'lr': 0.00024382684010656623, 'weight_decay': 1.9237230163117822e-07, 'epochs': 269, 'loss': 'mae', 'optimizer': 'adam', 'graph_mode': 'knn', 'source': 'grm', 'knn_k': 7, 'weighted_edges': True, 'symmetrize_mode': 'union', 'use_snp_selection': False}. Best is trial 46 with value: 0.09113089337527672.
[I 2025-11-03 12:45:48,613] Trial 114 finished with value: 0.06272962071614367 and parameters: {'model_type': 'gcn', 'hidden_dims': '[512, 128]', 'dropout': 0.25731847450395573, 'batch_norm': True, 'lr': 0.00014504628068965248, 'weight_decay': 2.4062174118626367e-07, 'epochs': 247, 'loss': 'mae', 'optimizer': 'adam', 'graph_mode': 'knn', 'source': 'grm', 'knn_k': 1, 'weighted_edges': True, 'symmetrize_mode': 'union', 'use_snp_selection': False}. Best is trial 46 with value: 0.09113089337527672.
[I 2025-11-03 12:45:50,764] Trial 115 finished with value: 0.0728374223603697 and parameters: {'model_type': 'gcn', 'hidden_dims': '[128, 64]', 'dropout': 0.28085403092413863, 'batch_norm': True, 'lr': 0.0003245181157827191, 'weight_decay': 1.531199831574622e-07, 'epochs': 261, 'loss': 'mae', 'optimizer': 'adam', 'graph_mode': 'knn', 'source': 'grm', 'knn_k': 1, 'weighted_edges': True, 'symmetrize_mode': 'union', 'use_snp_selection': False}. Best is trial 46 with value: 0.09113089337527672.
[I 2025-11-03 12:45:53,485] Trial 116 finished with value: 0.014322206027928781 and parameters: {'model_type': 'gcn', 'hidden_dims': '[512, 128]', 'dropout': 0.2926634018052985, 'batch_norm': True, 'lr': 0.0001605059469897456, 'weight_decay': 5.59303150326453e-05, 'epochs': 202, 'loss': 'mae', 'optimizer': 'adam', 'graph_mode': 'cutoff', 'cutoff': 0.4630355692636521, 'grm_norm': 'cosine', 'self_loops': False, 'use_snp_selection': False}. Best is trial 46 with value: 0.09113089337527672.
[I 2025-11-03 12:45:55,529] Trial 117 finished with value: 0.04003664687625422 and parameters: {'model_type': 'gcn', 'hidden_dims': '[256, 128]', 'dropout': 0.3019804513232628, 'batch_norm': True, 'lr': 0.00028868111842499214, 'weight_decay': 2.314602385597962e-07, 'epochs': 238, 'loss': 'mae', 'optimizer': 'adam', 'graph_mode': 'knn', 'source': 'grm', 'knn_k': 2, 'weighted_edges': True, 'symmetrize_mode': 'union', 'use_snp_selection': False}. Best is trial 46 with value: 0.09113089337527672.
[I 2025-11-03 12:45:59,864] Trial 118 finished with value: 0.07044720246481415 and parameters: {'model_type': 'gcn', 'hidden_dims': '[512, 256]', 'dropout': 0.27516912916829167, 'batch_norm': True, 'lr': 0.00022091948249995213, 'weight_decay': 6.14595037657097e-07, 'epochs': 290, 'loss': 'mae', 'optimizer': 'adam', 'graph_mode': 'knn', 'source': 'grm', 'knn_k': 1, 'weighted_edges': True, 'symmetrize_mode': 'union', 'use_snp_selection': False}. Best is trial 46 with value: 0.09113089337527672.
[I 2025-11-03 12:46:02,432] Trial 119 finished with value: 0.06832634159642365 and parameters: {'model_type': 'gcn', 'hidden_dims': '[512, 128]', 'dropout': 0.19410971197050153, 'batch_norm': True, 'lr': 0.00010595279152826846, 'weight_decay': 1.286285784778197e-07, 'epochs': 218, 'loss': 'mae', 'optimizer': 'adam', 'graph_mode': 'knn', 'source': 'grm', 'knn_k': 1, 'weighted_edges': True, 'symmetrize_mode': 'union', 'use_snp_selection': False}. Best is trial 46 with value: 0.09113089337527672.
[I 2025-11-03 12:46:04,259] Trial 120 finished with value: 0.021615955436462317 and parameters: {'model_type': 'gcn', 'hidden_dims': '[128, 64]', 'dropout': 0.26178677583244536, 'batch_norm': True, 'lr': 8.66396359495803e-05, 'weight_decay': 4.602260430666055e-05, 'epochs': 252, 'loss': 'mae', 'optimizer': 'adam', 'graph_mode': 'knn', 'source': 'grm', 'knn_k': 9, 'weighted_edges': True, 'symmetrize_mode': 'union', 'use_snp_selection': False}. Best is trial 46 with value: 0.09113089337527672.
[I 2025-11-03 12:46:12,323] Trial 121 finished with value: 0.08568514142922015 and parameters: {'model_type': 'gcn', 'hidden_dims': '[512, 64]', 'dropout': 0.3155363462341452, 'batch_norm': True, 'lr': 0.00018575762971520063, 'weight_decay': 1.049059232455731e-07, 'epochs': 269, 'loss': 'mae', 'optimizer': 'adam', 'graph_mode': 'knn', 'source': 'grm', 'knn_k': 1, 'weighted_edges': True, 'symmetrize_mode': 'union', 'use_snp_selection': False}. Best is trial 46 with value: 0.09113089337527672.
[I 2025-11-03 12:46:15,401] Trial 122 finished with value: 0.07139942180856568 and parameters: {'model_type': 'gcn', 'hidden_dims': '[512, 64]', 'dropout': 0.3144489689712135, 'batch_norm': True, 'lr': 0.00018512629632349748, 'weight_decay': 1.0507437473917372e-07, 'epochs': 267, 'loss': 'mae', 'optimizer': 'adam', 'graph_mode': 'knn', 'source': 'grm', 'knn_k': 1, 'weighted_edges': True, 'symmetrize_mode': 'union', 'use_snp_selection': False}. Best is trial 46 with value: 0.09113089337527672.
[I 2025-11-03 12:46:18,095] Trial 123 finished with value: 0.06502592871618035 and parameters: {'model_type': 'gcn', 'hidden_dims': '[512, 64]', 'dropout': 0.29157882735517154, 'batch_norm': True, 'lr': 0.0001281756082036616, 'weight_decay': 1.0051675842123403e-07, 'epochs': 243, 'loss': 'mae', 'optimizer': 'adam', 'graph_mode': 'knn', 'source': 'grm', 'knn_k': 1, 'weighted_edges': True, 'symmetrize_mode': 'union', 'use_snp_selection': False}. Best is trial 46 with value: 0.09113089337527672.
[I 2025-11-03 12:46:19,713] Trial 124 finished with value: 0.0426075066518547 and parameters: {'model_type': 'gcn', 'hidden_dims': '[512, 64]', 'dropout': 0.30500507970151014, 'batch_norm': True, 'lr': 0.00024027982424386954, 'weight_decay': 1.4032761378861577e-07, 'epochs': 58, 'loss': 'mae', 'optimizer': 'adam', 'graph_mode': 'knn', 'source': 'grm', 'knn_k': 1, 'weighted_edges': True, 'symmetrize_mode': 'union', 'use_snp_selection': False}. Best is trial 46 with value: 0.09113089337527672.
