[I 2025-11-13 09:32:30,569] Trial 33 finished with value: 0.21109262815430002 and parameters: {'model_type': 'graphsage', 'hidden_dims': '[512, 64]', 'dropout': 0.44519326798949094, 'batch_norm': False, 'lr': 2.7145607928270954e-06, 'weight_decay': 1.912773086747458e-06, 'epochs': 176, 'loss': 'mae', 'optimizer': 'adam', 'graph_mode': 'cutoff', 'cutoff': 0.6730109019120531, 'grm_norm': 'none', 'self_loops': False, 'use_snp_selection': True, 'num_snps': 32951}. Best is trial 4 with value: 0.2568370581276163.
[I 2025-11-13 09:34:14,677] Trial 34 finished with value: 0.24106577646722843 and parameters: {'model_type': 'graphsage', 'hidden_dims': '[512, 64]', 'dropout': 0.5018119370539919, 'batch_norm': False, 'lr': 2.1131757723868955e-05, 'weight_decay': 2.825761016679828e-07, 'epochs': 80, 'loss': 'mse', 'optimizer': 'adam', 'graph_mode': 'cutoff', 'cutoff': 0.7762007418994172, 'grm_norm': 'none', 'self_loops': False, 'use_snp_selection': True, 'num_snps': 47277}. Best is trial 4 with value: 0.2568370581276163.
[I 2025-11-13 09:34:44,842] Trial 35 finished with value: 0.19657562298771916 and parameters: {'model_type': 'graphsage', 'hidden_dims': '[128, 64]', 'dropout': 0.5020813623332087, 'batch_norm': True, 'lr': 2.2519165220131683e-05, 'weight_decay': 2.954779853934988e-07, 'epochs': 79, 'loss': 'mse', 'optimizer': 'adam', 'graph_mode': 'cutoff', 'cutoff': 0.7977825973619324, 'grm_norm': 'cosine_then_gcn', 'self_loops': False, 'use_snp_selection': False}. Best is trial 4 with value: 0.2568370581276163.
[I 2025-11-13 09:36:33,649] Trial 36 finished with value: -0.0038130887218404117 and parameters: {'model_type': 'graphsage', 'hidden_dims': '[256, 128]', 'dropout': 0.49202076556541857, 'batch_norm': False, 'lr': 0.0005364896118674517, 'weight_decay': 6.22620128335252e-07, 'epochs': 58, 'loss': 'mse', 'optimizer': 'adam', 'graph_mode': 'knn', 'source': 'grm', 'knn_k': 5, 'weighted_edges': True, 'symmetrize_mode': 'union', 'use_snp_selection': True, 'num_snps': 47489}. Best is trial 4 with value: 0.2568370581276163.
[I 2025-11-13 09:38:25,636] Trial 37 finished with value: 0.21407612077879987 and parameters: {'model_type': 'graphsage', 'hidden_dims': '[512, 256]', 'dropout': 0.5385740412695437, 'batch_norm': True, 'lr': 0.00021668031063438526, 'weight_decay': 2.706512944770061e-06, 'epochs': 144, 'loss': 'mse', 'optimizer': 'adam', 'graph_mode': 'cutoff', 'cutoff': 0.5695203585992076, 'grm_norm': 'none', 'self_loops': True, 'use_snp_selection': False}. Best is trial 4 with value: 0.2568370581276163.
[I 2025-11-13 09:42:05,148] Trial 38 finished with value: 0.2077620266525749 and parameters: {'model_type': 'graphsage', 'hidden_dims': '[256, 128, 64]', 'dropout': 0.5513208289621254, 'batch_norm': False, 'lr': 3.4288189073805916e-05, 'weight_decay': 2.567372201480175e-07, 'epochs': 195, 'loss': 'mse', 'optimizer': 'adam', 'graph_mode': 'knn', 'source': 'grm', 'knn_k': 8, 'weighted_edges': False, 'symmetrize_mode': 'mutual', 'use_snp_selection': True, 'num_snps': 56065}. Best is trial 4 with value: 0.2568370581276163.
[I 2025-11-13 09:43:56,968] Trial 39 finished with value: 0.15797079043423992 and parameters: {'model_type': 'graphsage', 'hidden_dims': '[512, 128]', 'dropout': 0.37222175894452003, 'batch_norm': False, 'lr': 0.00038590271114971966, 'weight_decay': 1.3865804576634748e-05, 'epochs': 111, 'loss': 'mse', 'optimizer': 'adam', 'graph_mode': 'cutoff', 'cutoff': 0.8994746652675649, 'grm_norm': 'none', 'self_loops': False, 'use_snp_selection': True, 'num_snps': 44096}. Best is trial 4 with value: 0.2568370581276163.
[I 2025-11-13 09:44:58,332] Trial 40 finished with value: 0.22091015993119362 and parameters: {'model_type': 'graphsage', 'hidden_dims': '[512, 256]', 'dropout': 0.48241958287966424, 'batch_norm': True, 'lr': 4.6788432088406416e-05, 'weight_decay': 3.050664010024889e-05, 'epochs': 52, 'loss': 'mse', 'optimizer': 'adam', 'graph_mode': 'cutoff', 'cutoff': 0.4252443922897383, 'grm_norm': 'cosine_then_gcn', 'self_loops': False, 'use_snp_selection': False}. Best is trial 4 with value: 0.2568370581276163.
[I 2025-11-13 09:46:42,790] Trial 41 finished with value: 0.22736798338859296 and parameters: {'model_type': 'graphsage', 'hidden_dims': '[512, 64]', 'dropout': 0.4257668996087953, 'batch_norm': False, 'lr': 7.2377871999429165e-06, 'weight_decay': 1.2624135724934397e-07, 'epochs': 79, 'loss': 'mse', 'optimizer': 'adam', 'graph_mode': 'cutoff', 'cutoff': 0.7347814478304155, 'grm_norm': 'none', 'self_loops': False, 'use_snp_selection': True, 'num_snps': 47592}. Best is trial 4 with value: 0.2568370581276163.
[I 2025-11-13 09:48:24,681] Trial 42 finished with value: 0.2395215611229641 and parameters: {'model_type': 'graphsage', 'hidden_dims': '[512, 64]', 'dropout': 0.4733083511575913, 'batch_norm': False, 'lr': 1.0489160834017978e-05, 'weight_decay': 1.424191773421999e-06, 'epochs': 107, 'loss': 'mae', 'optimizer': 'adam', 'graph_mode': 'cutoff', 'cutoff': 0.791511107854341, 'grm_norm': 'none', 'self_loops': False, 'use_snp_selection': True, 'num_snps': 38372}. Best is trial 4 with value: 0.2568370581276163.
[I 2025-11-13 09:49:55,282] Trial 43 finished with value: 0.22822304993006232 and parameters: {'model_type': 'graphsage', 'hidden_dims': '[512, 64]', 'dropout': 0.5441042825318714, 'batch_norm': False, 'lr': 8.848950044301635e-06, 'weight_decay': 1.3956396505257606e-06, 'epochs': 125, 'loss': 'mae', 'optimizer': 'adam', 'graph_mode': 'cutoff', 'cutoff': 0.8200387118807089, 'grm_norm': 'none', 'self_loops': False, 'use_snp_selection': True, 'num_snps': 28222}. Best is trial 4 with value: 0.2568370581276163.
[I 2025-11-13 09:51:43,009] Trial 44 finished with value: 0.21488268801129143 and parameters: {'model_type': 'graphsage', 'hidden_dims': '[512, 64]', 'dropout': 0.5259825375120585, 'batch_norm': False, 'lr': 2.0502998585758223e-05, 'weight_decay': 7.203085881283793e-07, 'epochs': 81, 'loss': 'mse', 'optimizer': 'adam', 'graph_mode': 'cutoff', 'cutoff': 0.768003237067534, 'grm_norm': 'none', 'self_loops': False, 'use_snp_selection': True, 'num_snps': 49529}. Best is trial 4 with value: 0.2568370581276163.
[I 2025-11-13 09:53:35,506] Trial 45 finished with value: 0.23706133252858502 and parameters: {'model_type': 'graphsage', 'hidden_dims': '[512, 64]', 'dropout': 0.5674269856533481, 'batch_norm': False, 'lr': 1.7279642291200787e-05, 'weight_decay': 4.5249846110945035e-07, 'epochs': 159, 'loss': 'mae', 'optimizer': 'adam', 'graph_mode': 'cutoff', 'cutoff': 0.6125045237542688, 'grm_norm': 'gcn', 'self_loops': False, 'use_snp_selection': True, 'num_snps': 33925}. Best is trial 4 with value: 0.2568370581276163.
[I 2025-11-13 09:55:34,908] Trial 46 finished with value: 0.24218670017621657 and parameters: {'model_type': 'graphsage', 'hidden_dims': '[256, 128]', 'dropout': 0.11642847481658215, 'batch_norm': False, 'lr': 9.850755636741736e-05, 'weight_decay': 2.889388557189809e-06, 'epochs': 183, 'loss': 'mae', 'optimizer': 'adam', 'graph_mode': 'knn', 'source': 'grm', 'knn_k': 2, 'weighted_edges': False, 'symmetrize_mode': 'mutual', 'use_snp_selection': True, 'num_snps': 43192}. Best is trial 4 with value: 0.2568370581276163.
[I 2025-11-13 09:57:32,276] Trial 47 finished with value: 0.22488869032852382 and parameters: {'model_type': 'graphsage', 'hidden_dims': '[256, 128]', 'dropout': 0.12650571304632457, 'batch_norm': False, 'lr': 8.846916985806184e-05, 'weight_decay': 3.485269761888751e-06, 'epochs': 183, 'loss': 'mae', 'optimizer': 'adam', 'graph_mode': 'knn', 'source': 'grm', 'knn_k': 2, 'weighted_edges': False, 'symmetrize_mode': 'mutual', 'use_snp_selection': True, 'num_snps': 43635}. Best is trial 4 with value: 0.2568370581276163.
[I 2025-11-13 09:59:47,784] Trial 48 finished with value: 0.23107703065932816 and parameters: {'model_type': 'graphsage', 'hidden_dims': '[256, 128]', 'dropout': 0.10101155275410285, 'batch_norm': False, 'lr': 0.0001258358340381283, 'weight_decay': 9.28289625556834e-06, 'epochs': 171, 'loss': 'mse', 'optimizer': 'adam', 'graph_mode': 'knn', 'source': 'grm', 'knn_k': 2, 'weighted_edges': False, 'symmetrize_mode': 'mutual', 'use_snp_selection': True, 'num_snps': 56148}. Best is trial 4 with value: 0.2568370581276163.
[I 2025-11-13 10:01:54,321] Trial 49 finished with value: 0.22851836128487726 and parameters: {'model_type': 'graphsage', 'hidden_dims': '[256, 128]', 'dropout': 0.16386004318336375, 'batch_norm': False, 'lr': 0.00017416282744914707, 'weight_decay': 0.0008158041388838711, 'epochs': 146, 'loss': 'mae', 'optimizer': 'adam', 'graph_mode': 'knn', 'source': 'grm', 'knn_k': 3, 'weighted_edges': False, 'symmetrize_mode': 'mutual', 'use_snp_selection': True, 'num_snps': 50057}. Best is trial 4 with value: 0.2568370581276163.
[I 2025-11-13 10:03:11,576] Trial 50 finished with value: 0.20668278624019737 and parameters: {'model_type': 'graphsage', 'hidden_dims': '[256, 128]', 'dropout': 0.12511410866644684, 'batch_norm': False, 'lr': 7.320075431671977e-05, 'weight_decay': 4.802565811863191e-06, 'epochs': 40, 'loss': 'mae', 'optimizer': 'adam', 'graph_mode': 'knn', 'source': 'grm', 'knn_k': 2, 'weighted_edges': False, 'symmetrize_mode': 'mutual', 'use_snp_selection': True, 'num_snps': 45062}. Best is trial 4 with value: 0.2568370581276163.
[I 2025-11-13 10:05:02,706] Trial 51 finished with value: 0.22484575031929097 and parameters: {'model_type': 'graphsage', 'hidden_dims': '[256, 128, 64]', 'dropout': 0.16237339501288356, 'batch_norm': False, 'lr': 2.8087318266326675e-05, 'weight_decay': 1.2868311738307873e-06, 'epochs': 132, 'loss': 'mae', 'optimizer': 'adam', 'graph_mode': 'knn', 'source': 'grm', 'knn_k': 5, 'weighted_edges': False, 'symmetrize_mode': 'mutual', 'use_snp_selection': True, 'num_snps': 38387}. Best is trial 4 with value: 0.2568370581276163.
[I 2025-11-13 10:06:19,828] Trial 52 finished with value: 0.2605289408605313 and parameters: {'model_type': 'graphsage', 'hidden_dims': '[128, 64]', 'dropout': 0.47661094683374494, 'batch_norm': False, 'lr': 4.812281527804883e-05, 'weight_decay': 1.875906616869111e-06, 'epochs': 102, 'loss': 'mae', 'optimizer': 'adam', 'graph_mode': 'cutoff', 'cutoff': 0.5268958434893929, 'grm_norm': 'none', 'self_loops': False, 'use_snp_selection': True, 'num_snps': 40432}. Best is trial 52 with value: 0.2605289408605313.
[I 2025-11-13 10:07:53,017] Trial 53 finished with value: 0.24561883133990894 and parameters: {'model_type': 'graphsage', 'hidden_dims': '[128, 64]', 'dropout': 0.42704437132518075, 'batch_norm': False, 'lr': 4.569470432838701e-05, 'weight_decay': 2.2969624527446656e-06, 'epochs': 190, 'loss': 'mae', 'optimizer': 'adam', 'graph_mode': 'cutoff', 'cutoff': 0.5459767584243065, 'grm_norm': 'gcn', 'self_loops': True, 'use_snp_selection': True, 'num_snps': 42362}. Best is trial 52 with value: 0.2605289408605313.
[I 2025-11-13 10:10:21,925] Trial 54 finished with value: 0.2180162155878564 and parameters: {'model_type': 'graphsage', 'hidden_dims': '[128, 64]', 'dropout': 0.4235444513733926, 'batch_norm': False, 'lr': 4.6192027207813857e-05, 'weight_decay': 2.806554141780574e-06, 'epochs': 186, 'loss': 'mae', 'optimizer': 'adam', 'graph_mode': 'knn', 'source': 'grm', 'knn_k': 4, 'weighted_edges': True, 'symmetrize_mode': 'union', 'use_snp_selection': True, 'num_snps': 42442}. Best is trial 52 with value: 0.2605289408605313.
[I 2025-11-13 10:11:44,804] Trial 55 finished with value: 0.2405118970815642 and parameters: {'model_type': 'graphsage', 'hidden_dims': '[128, 64]', 'dropout': 0.3224891328553948, 'batch_norm': False, 'lr': 0.00010481422980754162, 'weight_decay': 5.936541974590677e-06, 'epochs': 208, 'loss': 'mae', 'optimizer': 'adam', 'graph_mode': 'cutoff', 'cutoff': 0.5154597674847358, 'grm_norm': 'gcn', 'self_loops': True, 'use_snp_selection': True, 'num_snps': 30549}. Best is trial 52 with value: 0.2605289408605313.
[I 2025-11-13 10:13:25,741] Trial 56 finished with value: 0.2228094515775151 and parameters: {'model_type': 'graphsage', 'hidden_dims': '[128, 64]', 'dropout': 0.3740587510397476, 'batch_norm': False, 'lr': 7.592705615462078e-05, 'weight_decay': 2.043394500461001e-06, 'epochs': 226, 'loss': 'mae', 'optimizer': 'adam', 'graph_mode': 'knn', 'source': 'grm', 'knn_k': 2, 'weighted_edges': False, 'symmetrize_mode': 'mutual', 'use_snp_selection': True, 'num_snps': 40312}. Best is trial 52 with value: 0.2605289408605313.
[I 2025-11-13 10:16:22,713] Trial 57 finished with value: 0.22118416834655888 and parameters: {'model_type': 'graphsage', 'hidden_dims': '[128, 64]', 'dropout': 0.18476579989087002, 'batch_norm': False, 'lr': 5.3325956890586796e-05, 'weight_decay': 1.7447313273633618e-05, 'epochs': 196, 'loss': 'mae', 'optimizer': 'adam', 'graph_mode': 'cutoff', 'cutoff': 0.37058252478149534, 'grm_norm': 'gcn', 'self_loops': True, 'use_snp_selection': True, 'num_snps': 51602}. Best is trial 52 with value: 0.2605289408605313.
[I 2025-11-13 10:17:13,762] Trial 58 finished with value: 0.21823718660999886 and parameters: {'model_type': 'graphsage', 'hidden_dims': '[128, 64]', 'dropout': 0.12123559503399589, 'batch_norm': True, 'lr': 0.00013399742219877573, 'weight_decay': 9.406999916828603e-07, 'epochs': 158, 'loss': 'mae', 'optimizer': 'adam', 'graph_mode': 'cutoff', 'cutoff': 0.5243415953976232, 'grm_norm': 'gcn', 'self_loops': True, 'use_snp_selection': False}. Best is trial 52 with value: 0.2605289408605313.
[I 2025-11-13 10:18:46,654] Trial 59 finished with value: 0.22829122911140173 and parameters: {'model_type': 'graphsage', 'hidden_dims': '[128, 64]', 'dropout': 0.19786450025004207, 'batch_norm': False, 'lr': 0.00021525976026147076, 'weight_decay': 3.1936326374915742e-06, 'epochs': 241, 'loss': 'mae', 'optimizer': 'adam', 'graph_mode': 'knn', 'source': 'grm', 'knn_k': 1, 'weighted_edges': False, 'symmetrize_mode': 'mutual', 'use_snp_selection': True, 'num_snps': 36892}. Best is trial 52 with value: 0.2605289408605313.
[I 2025-11-13 10:20:49,817] Trial 60 finished with value: 0.17315421927648844 and parameters: {'model_type': 'graphsage', 'hidden_dims': '[128, 64]', 'dropout': 0.3796008829855038, 'batch_norm': False, 'lr': 0.00033625827762725943, 'weight_decay': 4.796010399075646e-05, 'epochs': 170, 'loss': 'mae', 'optimizer': 'adam', 'graph_mode': 'cutoff', 'cutoff': 0.46787023020613017, 'grm_norm': 'cosine', 'self_loops': True, 'use_snp_selection': True, 'num_snps': 43903}. Best is trial 52 with value: 0.2605289408605313.
[I 2025-11-13 10:22:10,059] Trial 61 finished with value: 0.22856642791843326 and parameters: {'model_type': 'graphsage', 'hidden_dims': '[256, 128]', 'dropout': 0.1450105264415255, 'batch_norm': False, 'lr': 2.954538954600168e-05, 'weight_decay': 4.295059882696469e-07, 'epochs': 57, 'loss': 'mae', 'optimizer': 'adam', 'graph_mode': 'cutoff', 'cutoff': 0.5463936010300214, 'grm_norm': 'gcn', 'self_loops': True, 'use_snp_selection': True, 'num_snps': 46136}. Best is trial 52 with value: 0.2605289408605313.
[I 2025-11-13 10:23:42,923] Trial 62 finished with value: 0.2298032275959542 and parameters: {'model_type': 'graphsage', 'hidden_dims': '[256, 128, 64]', 'dropout': 0.5135212901747914, 'batch_norm': False, 'lr': 4.0346007382532976e-05, 'weight_decay': 6.677138944174765e-07, 'epochs': 150, 'loss': 'mae', 'optimizer': 'adam', 'graph_mode': 'cutoff', 'cutoff': 0.6785791262086555, 'grm_norm': 'gcn', 'self_loops': False, 'use_snp_selection': True, 'num_snps': 40795}. Best is trial 52 with value: 0.2605289408605313.
[I 2025-11-13 10:25:37,667] Trial 63 finished with value: 0.22442754232816386 and parameters: {'model_type': 'graphsage', 'hidden_dims': '[512, 128]', 'dropout': 0.47762100678405756, 'batch_norm': False, 'lr': 6.059266945500099e-05, 'weight_decay': 1.6732408682546428e-06, 'epochs': 99, 'loss': 'mae', 'optimizer': 'adam', 'graph_mode': 'cutoff', 'cutoff': 0.6035165842078166, 'grm_norm': 'cosine_then_gcn', 'self_loops': True, 'use_snp_selection': True, 'num_snps': 48696}. Best is trial 52 with value: 0.2605289408605313.
[I 2025-11-13 10:26:57,227] Trial 64 finished with value: 0.19956401467815293 and parameters: {'model_type': 'graphsage', 'hidden_dims': '[128, 64]', 'dropout': 0.4351917855264405, 'batch_norm': False, 'lr': 2.9537347285081984e-05, 'weight_decay': 1.0524907276917697e-06, 'epochs': 73, 'loss': 'mae', 'optimizer': 'adam', 'graph_mode': 'cutoff', 'cutoff': 0.5530607122768416, 'grm_norm': 'none', 'self_loops': False, 'use_snp_selection': True, 'num_snps': 52047}. Best is trial 52 with value: 0.2605289408605313.
[I 2025-11-13 10:28:57,418] Trial 65 finished with value: 0.25569098879658614 and parameters: {'model_type': 'graphsage', 'hidden_dims': '[512, 256]', 'dropout': 0.4580648113746855, 'batch_norm': False, 'lr': 8.285462292561092e-05, 'weight_decay': 2.2073206634163136e-07, 'epochs': 93, 'loss': 'mae', 'optimizer': 'adam', 'graph_mode': 'cutoff', 'cutoff': 0.48732290421402036, 'grm_norm': 'cosine', 'self_loops': True, 'use_snp_selection': True, 'num_snps': 45784}. Best is trial 52 with value: 0.2605289408605313.
[I 2025-11-13 10:32:18,525] Trial 66 finished with value: 0.24177554818907723 and parameters: {'model_type': 'graphsage', 'hidden_dims': '[512, 256]', 'dropout': 0.40858344543181224, 'batch_norm': False, 'lr': 8.898034268095304e-05, 'weight_decay': 2.3592429048657816e-06, 'epochs': 123, 'loss': 'mae', 'optimizer': 'adam', 'graph_mode': 'cutoff', 'cutoff': 0.337325726382138, 'grm_norm': 'cosine', 'self_loops': True, 'use_snp_selection': True, 'num_snps': 57612}. Best is trial 52 with value: 0.2605289408605313.
[I 2025-11-13 10:35:59,119] Trial 67 finished with value: 0.2509946240083802 and parameters: {'model_type': 'graphsage', 'hidden_dims': '[512, 256]', 'dropout': 0.4131552817779318, 'batch_norm': False, 'lr': 8.871947141734245e-05, 'weight_decay': 2.3838857969709173e-06, 'epochs': 122, 'loss': 'mae', 'optimizer': 'adam', 'graph_mode': 'cutoff', 'cutoff': 0.29828293112907217, 'grm_norm': 'cosine', 'self_loops': True, 'use_snp_selection': True, 'num_snps': 57004}. Best is trial 52 with value: 0.2605289408605313.
[I 2025-11-13 10:39:16,669] Trial 68 finished with value: 0.19841516222938674 and parameters: {'model_type': 'graphsage', 'hidden_dims': '[512, 256]', 'dropout': 0.44773781827248654, 'batch_norm': False, 'lr': 0.00017048298825958347, 'weight_decay': 3.914764621603171e-06, 'epochs': 93, 'loss': 'mae', 'optimizer': 'adam', 'graph_mode': 'cutoff', 'cutoff': 0.26635376363472085, 'grm_norm': 'cosine', 'self_loops': True, 'use_snp_selection': True, 'num_snps': 54363}. Best is trial 52 with value: 0.2605289408605313.
[I 2025-11-13 10:42:30,971] Trial 69 finished with value: 0.24617543271128683 and parameters: {'model_type': 'graphsage', 'hidden_dims': '[512, 256]', 'dropout': 0.4655524035207537, 'batch_norm': False, 'lr': 0.00010495180702434947, 'weight_decay': 6.818490119023942e-06, 'epochs': 137, 'loss': 'mae', 'optimizer': 'adam', 'graph_mode': 'cutoff', 'cutoff': 0.47600054172636896, 'grm_norm': 'cosine', 'self_loops': True, 'use_snp_selection': True, 'num_snps': 58354}. Best is trial 52 with value: 0.2605289408605313.
[I 2025-11-13 10:45:24,858] Trial 70 finished with value: 0.18854505301186383 and parameters: {'model_type': 'graphsage', 'hidden_dims': '[512, 256]', 'dropout': 0.4666879770197894, 'batch_norm': False, 'lr': 0.00024705260808567306, 'weight_decay': 5.886661347397317e-06, 'epochs': 137, 'loss': 'mae', 'optimizer': 'adam', 'graph_mode': 'cutoff', 'cutoff': 0.4846808415114493, 'grm_norm': 'cosine', 'self_loops': True, 'use_snp_selection': True, 'num_snps': 53310}. Best is trial 52 with value: 0.2605289408605313.
[I 2025-11-13 10:48:21,123] Trial 71 finished with value: 0.23065269176030173 and parameters: {'model_type': 'graphsage', 'hidden_dims': '[512, 256]', 'dropout': 0.40448253562499425, 'batch_norm': False, 'lr': 0.00010978314982893688, 'weight_decay': 1.4675616676403882e-05, 'epochs': 112, 'loss': 'mae', 'optimizer': 'adam', 'graph_mode': 'cutoff', 'cutoff': 0.4295719776232211, 'grm_norm': 'cosine', 'self_loops': True, 'use_snp_selection': True, 'num_snps': 59395}. Best is trial 52 with value: 0.2605289408605313.
[I 2025-11-13 10:51:16,543] Trial 72 finished with value: 0.2302932504880529 and parameters: {'model_type': 'graphsage', 'hidden_dims': '[512, 256]', 'dropout': 0.3868770533531194, 'batch_norm': False, 'lr': 0.00014115945320910384, 'weight_decay': 1.1178017895943666e-05, 'epochs': 120, 'loss': 'mae', 'optimizer': 'adam', 'graph_mode': 'cutoff', 'cutoff': 0.38448115525426474, 'grm_norm': 'cosine', 'self_loops': True, 'use_snp_selection': True, 'num_snps': 55848}. Best is trial 52 with value: 0.2605289408605313.
[I 2025-11-13 10:54:20,065] Trial 73 finished with value: 0.2343239870439012 and parameters: {'model_type': 'graphsage', 'hidden_dims': '[512, 256]', 'dropout': 0.14780520949215536, 'batch_norm': False, 'lr': 8.150324778278108e-05, 'weight_decay': 6.721555137386364e-06, 'epochs': 162, 'loss': 'mae', 'optimizer': 'adam', 'graph_mode': 'cutoff', 'cutoff': 0.5095071551299624, 'grm_norm': 'cosine', 'self_loops': True, 'use_snp_selection': True, 'num_snps': 58827}. Best is trial 52 with value: 0.2605289408605313.
[I 2025-11-13 10:57:27,287] Trial 74 finished with value: 0.24162425021085915 and parameters: {'model_type': 'graphsage', 'hidden_dims': '[512, 256]', 'dropout': 0.4363683394623209, 'batch_norm': False, 'lr': 5.5384700896368204e-05, 'weight_decay': 7.014215286198957e-05, 'epochs': 128, 'loss': 'mae', 'optimizer': 'adam', 'graph_mode': 'cutoff', 'cutoff': 0.32912349776060257, 'grm_norm': 'cosine', 'self_loops': True, 'use_snp_selection': True, 'num_snps': 51351}. Best is trial 52 with value: 0.2605289408605313.
