[I 2025-11-03 12:09:02,410] Trial 46 finished with value: 0.14859399973910556 and parameters: {'model_type': 'gcn', 'hidden_dims': '[512, 256]', 'dropout': 0.23624806401353732, 'batch_norm': True, 'lr': 0.0006948295115424393, 'weight_decay': 1.3020129558271557e-05, 'epochs': 256, 'loss': 'mae', 'optimizer': 'adam', 'graph_mode': 'knn', 'source': 'grm', 'knn_k': 2, 'weighted_edges': True, 'symmetrize_mode': 'union', 'use_snp_selection': False}. Best is trial 31 with value: 0.16424899737975157.
[I 2025-11-03 12:09:05,875] Trial 47 finished with value: 0.09893197679366204 and parameters: {'model_type': 'gcn', 'hidden_dims': '[512, 128]', 'dropout': 0.37306410477695595, 'batch_norm': True, 'lr': 8.517713278235128e-05, 'weight_decay': 2.3850251127575025e-06, 'epochs': 164, 'loss': 'mse', 'optimizer': 'adam', 'graph_mode': 'knn', 'source': 'grm', 'knn_k': 1, 'weighted_edges': True, 'symmetrize_mode': 'mutual', 'use_snp_selection': False}. Best is trial 31 with value: 0.16424899737975157.
[I 2025-11-03 12:09:11,227] Trial 48 finished with value: 0.11016976665660762 and parameters: {'model_type': 'gcn', 'hidden_dims': '[512, 64]', 'dropout': 0.2708842964539274, 'batch_norm': False, 'lr': 3.2985442289410815e-05, 'weight_decay': 5.743603751539007e-06, 'epochs': 200, 'loss': 'mae', 'optimizer': 'adam', 'graph_mode': 'knn', 'source': 'grm', 'knn_k': 1, 'weighted_edges': False, 'symmetrize_mode': 'union', 'use_snp_selection': True, 'num_snps': 42595}. Best is trial 31 with value: 0.16424899737975157.
[I 2025-11-03 12:09:16,317] Trial 49 finished with value: 0.023809863480772787 and parameters: {'model_type': 'gcn', 'hidden_dims': '[512, 256]', 'dropout': 0.4277388498545998, 'batch_norm': True, 'lr': 3.824619144218153e-06, 'weight_decay': 6.199295109175704e-05, 'epochs': 282, 'loss': 'mae', 'optimizer': 'adam', 'graph_mode': 'knn', 'source': 'grm', 'knn_k': 3, 'weighted_edges': True, 'symmetrize_mode': 'union', 'use_snp_selection': False}. Best is trial 31 with value: 0.16424899737975157.
[I 2025-11-03 12:09:20,844] Trial 50 finished with value: 0.12508750473561137 and parameters: {'model_type': 'gcn', 'hidden_dims': '[512, 128]', 'dropout': 0.2970761674361704, 'batch_norm': True, 'lr': 0.0003008638644761316, 'weight_decay': 0.0002891530627400715, 'epochs': 244, 'loss': 'mae', 'optimizer': 'adam', 'graph_mode': 'cutoff', 'cutoff': 0.20628834676422192, 'grm_norm': 'none', 'self_loops': True, 'use_snp_selection': False}. Best is trial 31 with value: 0.16424899737975157.
[I 2025-11-03 12:09:24,477] Trial 51 finished with value: 0.15072707682362252 and parameters: {'model_type': 'gcn', 'hidden_dims': '[512, 64]', 'dropout': 0.3632530661290368, 'batch_norm': True, 'lr': 0.0005257922924400678, 'weight_decay': 0.0005809842788623965, 'epochs': 175, 'loss': 'mae', 'optimizer': 'adam', 'graph_mode': 'knn', 'source': 'grm', 'knn_k': 2, 'weighted_edges': True, 'symmetrize_mode': 'union', 'use_snp_selection': False}. Best is trial 31 with value: 0.16424899737975157.
[I 2025-11-03 12:09:28,682] Trial 52 finished with value: 0.15073121945307827 and parameters: {'model_type': 'gcn', 'hidden_dims': '[512, 64]', 'dropout': 0.4024587764140105, 'batch_norm': True, 'lr': 0.000535202340160488, 'weight_decay': 0.0005553441973290037, 'epochs': 219, 'loss': 'mae', 'optimizer': 'adam', 'graph_mode': 'knn', 'source': 'grm', 'knn_k': 2, 'weighted_edges': True, 'symmetrize_mode': 'union', 'use_snp_selection': False}. Best is trial 31 with value: 0.16424899737975157.
[I 2025-11-03 12:09:32,350] Trial 53 finished with value: 0.15940643698264836 and parameters: {'model_type': 'gcn', 'hidden_dims': '[512, 64]', 'dropout': 0.33045016217029366, 'batch_norm': True, 'lr': 0.0006964750606138346, 'weight_decay': 0.00013318394755210255, 'epochs': 179, 'loss': 'mae', 'optimizer': 'adam', 'graph_mode': 'knn', 'source': 'grm', 'knn_k': 1, 'weighted_edges': True, 'symmetrize_mode': 'union', 'use_snp_selection': False}. Best is trial 31 with value: 0.16424899737975157.
[I 2025-11-03 12:09:36,067] Trial 54 finished with value: 0.14295877111947863 and parameters: {'model_type': 'gcn', 'hidden_dims': '[512, 64]', 'dropout': 0.32514920270834924, 'batch_norm': True, 'lr': 0.0003365227903174831, 'weight_decay': 0.00016400181215057782, 'epochs': 183, 'loss': 'mae', 'optimizer': 'adam', 'graph_mode': 'knn', 'source': 'grm', 'knn_k': 1, 'weighted_edges': True, 'symmetrize_mode': 'union', 'use_snp_selection': False}. Best is trial 31 with value: 0.16424899737975157.
[I 2025-11-03 12:09:41,912] Trial 55 finished with value: 0.14604884184964864 and parameters: {'model_type': 'gcn', 'hidden_dims': '[512, 64]', 'dropout': 0.3069131383224052, 'batch_norm': True, 'lr': 0.00014895031248854837, 'weight_decay': 9.425756334898138e-05, 'epochs': 350, 'loss': 'mae', 'optimizer': 'adam', 'graph_mode': 'knn', 'source': 'grm', 'knn_k': 1, 'weighted_edges': True, 'symmetrize_mode': 'union', 'use_snp_selection': False}. Best is trial 31 with value: 0.16424899737975157.
[I 2025-11-03 12:09:44,894] Trial 56 finished with value: 0.16527228997469587 and parameters: {'model_type': 'gcn', 'hidden_dims': '[512, 256]', 'dropout': 0.2406416226326793, 'batch_norm': True, 'lr': 0.0008162005246734601, 'weight_decay': 2.149826503758487e-05, 'epochs': 125, 'loss': 'mae', 'optimizer': 'adam', 'graph_mode': 'knn', 'source': 'grm', 'knn_k': 1, 'weighted_edges': True, 'symmetrize_mode': 'mutual', 'use_snp_selection': False}. Best is trial 56 with value: 0.16527228997469587.
[I 2025-11-03 12:09:47,383] Trial 57 finished with value: 0.17255374985086222 and parameters: {'model_type': 'gcn', 'hidden_dims': '[512, 256]', 'dropout': 0.18063154706805906, 'batch_norm': True, 'lr': 0.0007810624351892275, 'weight_decay': 0.0002608537457946495, 'epochs': 86, 'loss': 'mae', 'optimizer': 'adam', 'graph_mode': 'knn', 'source': 'grm', 'knn_k': 1, 'weighted_edges': True, 'symmetrize_mode': 'mutual', 'use_snp_selection': False}. Best is trial 57 with value: 0.17255374985086222.
[I 2025-11-03 12:09:49,762] Trial 58 finished with value: 0.116082626248635 and parameters: {'model_type': 'gcn', 'hidden_dims': '[512, 256]', 'dropout': 0.10415430620475762, 'batch_norm': True, 'lr': 0.0007412463901902033, 'weight_decay': 0.00028434031680580815, 'epochs': 75, 'loss': 'mae', 'optimizer': 'adam', 'graph_mode': 'knn', 'source': 'grm', 'knn_k': 7, 'weighted_edges': True, 'symmetrize_mode': 'mutual', 'use_snp_selection': False}. Best is trial 57 with value: 0.17255374985086222.
[I 2025-11-03 12:09:52,493] Trial 59 finished with value: 0.1501893225666338 and parameters: {'model_type': 'gcn', 'hidden_dims': '[512, 256]', 'dropout': 0.12857047860765358, 'batch_norm': True, 'lr': 0.0006846365367432873, 'weight_decay': 0.00012156291535432745, 'epochs': 105, 'loss': 'mae', 'optimizer': 'adam', 'graph_mode': 'knn', 'source': 'grm', 'knn_k': 1, 'weighted_edges': False, 'symmetrize_mode': 'mutual', 'use_snp_selection': False}. Best is trial 57 with value: 0.17255374985086222.
[I 2025-11-03 12:09:55,105] Trial 60 finished with value: 0.0065130654838973364 and parameters: {'model_type': 'gcn', 'hidden_dims': '[256, 128, 64]', 'dropout': 0.17773162507967666, 'batch_norm': False, 'lr': 0.0007933940406239713, 'weight_decay': 2.87517267146977e-05, 'epochs': 19, 'loss': 'mse', 'optimizer': 'adam', 'graph_mode': 'knn', 'source': 'grm', 'knn_k': 6, 'weighted_edges': True, 'symmetrize_mode': 'mutual', 'use_snp_selection': True, 'num_snps': 19019}. Best is trial 57 with value: 0.17255374985086222.
[I 2025-11-03 12:09:57,684] Trial 61 finished with value: 0.15341905343061846 and parameters: {'model_type': 'gcn', 'hidden_dims': '[512, 256]', 'dropout': 0.2425589060269688, 'batch_norm': True, 'lr': 0.0009719073617088205, 'weight_decay': 0.00026500904359682355, 'epochs': 89, 'loss': 'mae', 'optimizer': 'adam', 'graph_mode': 'knn', 'source': 'grm', 'knn_k': 1, 'weighted_edges': True, 'symmetrize_mode': 'mutual', 'use_snp_selection': False}. Best is trial 57 with value: 0.17255374985086222.
[I 2025-11-03 12:10:00,707] Trial 62 finished with value: 0.15785795778880984 and parameters: {'model_type': 'gcn', 'hidden_dims': '[512, 256]', 'dropout': 0.21183454104468472, 'batch_norm': True, 'lr': 0.00041635372212062675, 'weight_decay': 8.422032261246222e-05, 'epochs': 128, 'loss': 'mae', 'optimizer': 'adam', 'graph_mode': 'knn', 'source': 'grm', 'knn_k': 1, 'weighted_edges': True, 'symmetrize_mode': 'mutual', 'use_snp_selection': False}. Best is trial 57 with value: 0.17255374985086222.
[I 2025-11-03 12:10:03,505] Trial 63 finished with value: 0.15153057283852425 and parameters: {'model_type': 'gcn', 'hidden_dims': '[512, 256]', 'dropout': 0.20226787031379895, 'batch_norm': True, 'lr': 0.00023407243348338454, 'weight_decay': 8.995182232331882e-05, 'epochs': 110, 'loss': 'mae', 'optimizer': 'adam', 'graph_mode': 'knn', 'source': 'grm', 'knn_k': 1, 'weighted_edges': True, 'symmetrize_mode': 'mutual', 'use_snp_selection': False}. Best is trial 57 with value: 0.17255374985086222.
[I 2025-11-03 12:10:06,486] Trial 64 finished with value: 0.13822817546599442 and parameters: {'model_type': 'gcn', 'hidden_dims': '[512, 256]', 'dropout': 0.16124618689650305, 'batch_norm': True, 'lr': 0.00045344278455876683, 'weight_decay': 0.00018865945549916148, 'epochs': 124, 'loss': 'mae', 'optimizer': 'adam', 'graph_mode': 'knn', 'source': 'grm', 'knn_k': 2, 'weighted_edges': True, 'symmetrize_mode': 'mutual', 'use_snp_selection': False}. Best is trial 57 with value: 0.17255374985086222.
[I 2025-11-03 12:10:08,848] Trial 65 finished with value: 0.16024838011342657 and parameters: {'model_type': 'gcn', 'hidden_dims': '[512, 128]', 'dropout': 0.19326989946713274, 'batch_norm': True, 'lr': 0.0006092745535419901, 'weight_decay': 0.00014740108107672822, 'epochs': 76, 'loss': 'mae', 'optimizer': 'adam', 'graph_mode': 'knn', 'source': 'grm', 'knn_k': 1, 'weighted_edges': True, 'symmetrize_mode': 'mutual', 'use_snp_selection': False}. Best is trial 57 with value: 0.17255374985086222.
[I 2025-11-03 12:10:10,989] Trial 66 finished with value: 0.14409936440302124 and parameters: {'model_type': 'gcn', 'hidden_dims': '[512, 128]', 'dropout': 0.171332410737465, 'batch_norm': True, 'lr': 0.0008385807406462954, 'weight_decay': 0.0007047582720977777, 'epochs': 58, 'loss': 'mae', 'optimizer': 'adam', 'graph_mode': 'knn', 'source': 'grm', 'knn_k': 2, 'weighted_edges': True, 'symmetrize_mode': 'mutual', 'use_snp_selection': False}. Best is trial 57 with value: 0.17255374985086222.
[I 2025-11-03 12:10:13,237] Trial 67 finished with value: 0.16574041085912974 and parameters: {'model_type': 'gcn', 'hidden_dims': '[512, 128]', 'dropout': 0.19341750391685572, 'batch_norm': True, 'lr': 0.0006614444887675131, 'weight_decay': 5.875029078638433e-05, 'epochs': 67, 'loss': 'mae', 'optimizer': 'adam', 'graph_mode': 'knn', 'source': 'grm', 'knn_k': 1, 'weighted_edges': True, 'symmetrize_mode': 'mutual', 'use_snp_selection': False}. Best is trial 57 with value: 0.17255374985086222.
[I 2025-11-03 12:10:15,586] Trial 68 finished with value: 0.16352063405040196 and parameters: {'model_type': 'gcn', 'hidden_dims': '[512, 128]', 'dropout': 0.12448137931141824, 'batch_norm': True, 'lr': 0.0006357364180512296, 'weight_decay': 5.9684207981568796e-05, 'epochs': 77, 'loss': 'mae', 'optimizer': 'adam', 'graph_mode': 'cutoff', 'cutoff': 0.7364324640933693, 'grm_norm': 'cosine_then_gcn', 'self_loops': True, 'use_snp_selection': False}. Best is trial 57 with value: 0.17255374985086222.
[I 2025-11-03 12:10:17,960] Trial 69 finished with value: 0.15823147765806478 and parameters: {'model_type': 'gcn', 'hidden_dims': '[512, 128]', 'dropout': 0.1947236254451395, 'batch_norm': True, 'lr': 0.000577201030224525, 'weight_decay': 4.5955952169135275e-05, 'epochs': 79, 'loss': 'mae', 'optimizer': 'adam', 'graph_mode': 'cutoff', 'cutoff': 0.7370367546062915, 'grm_norm': 'cosine_then_gcn', 'self_loops': True, 'use_snp_selection': False}. Best is trial 57 with value: 0.17255374985086222.
[I 2025-11-03 12:10:19,681] Trial 70 finished with value: 0.14772303135628417 and parameters: {'model_type': 'gcn', 'hidden_dims': '[512, 128]', 'dropout': 0.1362134164187923, 'batch_norm': True, 'lr': 0.000982945299121361, 'weight_decay': 5.757984684227693e-05, 'epochs': 27, 'loss': 'mae', 'optimizer': 'adam', 'graph_mode': 'cutoff', 'cutoff': 0.5697386360408563, 'grm_norm': 'cosine_then_gcn', 'self_loops': True, 'use_snp_selection': False}. Best is trial 57 with value: 0.17255374985086222.
[I 2025-11-03 12:10:21,616] Trial 71 finished with value: 0.13745962507021559 and parameters: {'model_type': 'gcn', 'hidden_dims': '[512, 128]', 'dropout': 0.12614270486835488, 'batch_norm': True, 'lr': 0.0006292816963609215, 'weight_decay': 0.00035205031011953603, 'epochs': 44, 'loss': 'mae', 'optimizer': 'adam', 'graph_mode': 'cutoff', 'cutoff': 0.7982131211905916, 'grm_norm': 'cosine_then_gcn', 'self_loops': True, 'use_snp_selection': False}. Best is trial 57 with value: 0.17255374985086222.
[I 2025-11-03 12:10:23,908] Trial 72 finished with value: 0.15428503665958415 and parameters: {'model_type': 'gcn', 'hidden_dims': '[512, 128]', 'dropout': 0.14730362558632654, 'batch_norm': True, 'lr': 0.0007004036935312498, 'weight_decay': 0.0001673518306661661, 'epochs': 73, 'loss': 'mae', 'optimizer': 'adam', 'graph_mode': 'cutoff', 'cutoff': 0.6371291600472871, 'grm_norm': 'gcn', 'self_loops': True, 'use_snp_selection': False}. Best is trial 57 with value: 0.17255374985086222.
[I 2025-11-03 12:10:26,551] Trial 73 finished with value: 0.17893980951458158 and parameters: {'model_type': 'gcn', 'hidden_dims': '[512, 128]', 'dropout': 0.16464936889113105, 'batch_norm': True, 'lr': 0.0008145570920432785, 'weight_decay': 0.00010990492989854744, 'epochs': 99, 'loss': 'mae', 'optimizer': 'adam', 'graph_mode': 'cutoff', 'cutoff': 0.4760790866927218, 'grm_norm': 'cosine_then_gcn', 'self_loops': True, 'use_snp_selection': False}. Best is trial 73 with value: 0.17893980951458158.
[I 2025-11-03 12:10:27,976] Trial 74 finished with value: 0.14232723676911382 and parameters: {'model_type': 'gcn', 'hidden_dims': '[512, 128]', 'dropout': 0.11200170909751611, 'batch_norm': True, 'lr': 0.00048291536504382963, 'weight_decay': 2.8978081073689465e-05, 'epochs': 3, 'loss': 'mae', 'optimizer': 'adam', 'graph_mode': 'cutoff', 'cutoff': 0.48804402599421476, 'grm_norm': 'cosine_then_gcn', 'self_loops': True, 'use_snp_selection': False}. Best is trial 73 with value: 0.17893980951458158.
[I 2025-11-03 12:10:30,718] Trial 75 finished with value: 0.15494672011321584 and parameters: {'model_type': 'gcn', 'hidden_dims': '[512, 128]', 'dropout': 0.1659927437040182, 'batch_norm': True, 'lr': 0.0007980477211333832, 'weight_decay': 7.047417671702547e-05, 'epochs': 100, 'loss': 'mae', 'optimizer': 'adam', 'graph_mode': 'cutoff', 'cutoff': 0.7883392507690342, 'grm_norm': 'cosine_then_gcn', 'self_loops': True, 'use_snp_selection': False}. Best is trial 73 with value: 0.17893980951458158.
[I 2025-11-03 12:10:33,183] Trial 76 finished with value: 0.14529112446289716 and parameters: {'model_type': 'gcn', 'hidden_dims': '[512, 128]', 'dropout': 0.18287693514632755, 'batch_norm': True, 'lr': 0.0005645435111442743, 'weight_decay': 0.00011029851287524766, 'epochs': 85, 'loss': 'mae', 'optimizer': 'adam', 'graph_mode': 'cutoff', 'cutoff': 0.36586904427162914, 'grm_norm': 'cosine_then_gcn', 'self_loops': True, 'use_snp_selection': False}. Best is trial 73 with value: 0.17893980951458158.
[I 2025-11-03 12:10:35,358] Trial 77 finished with value: 0.14808488986340876 and parameters: {'model_type': 'gcn', 'hidden_dims': '[512, 128]', 'dropout': 0.1544812847779187, 'batch_norm': True, 'lr': 0.0009847674730459263, 'weight_decay': 1.779487739835396e-05, 'epochs': 63, 'loss': 'mse', 'optimizer': 'adam', 'graph_mode': 'cutoff', 'cutoff': 0.5207935353441873, 'grm_norm': 'cosine_then_gcn', 'self_loops': True, 'use_snp_selection': False}. Best is trial 73 with value: 0.17893980951458158.
[I 2025-11-03 12:10:39,559] Trial 78 finished with value: -0.026624468556319607 and parameters: {'model_type': 'gcn', 'hidden_dims': '[512, 128]', 'dropout': 0.19388944069543723, 'batch_norm': False, 'lr': 0.0002879164786780391, 'weight_decay': 0.0002307611409290975, 'epochs': 43, 'loss': 'mae', 'optimizer': 'adam', 'graph_mode': 'cutoff', 'cutoff': 0.6196274633932805, 'grm_norm': 'cosine_then_gcn', 'self_loops': True, 'use_snp_selection': True, 'num_snps': 49628}. Best is trial 73 with value: 0.17893980951458158.
[I 2025-11-03 12:10:42,481] Trial 79 finished with value: 0.09827524826117402 and parameters: {'model_type': 'gcn', 'hidden_dims': '[512, 128]', 'dropout': 0.22315812965347115, 'batch_norm': True, 'lr': 4.445845420911327e-05, 'weight_decay': 0.0001571044343892707, 'epochs': 117, 'loss': 'mae', 'optimizer': 'adam', 'graph_mode': 'cutoff', 'cutoff': 0.3996113369183804, 'grm_norm': 'cosine', 'self_loops': False, 'use_snp_selection': False}. Best is trial 73 with value: 0.17893980951458158.
[I 2025-11-03 12:10:45,075] Trial 80 finished with value: 0.11727110819977749 and parameters: {'model_type': 'gcn', 'hidden_dims': '[512, 128]', 'dropout': 0.11913918711076127, 'batch_norm': True, 'lr': 1.7704254345288895e-05, 'weight_decay': 3.322586607226667e-05, 'epochs': 97, 'loss': 'mae', 'optimizer': 'adam', 'graph_mode': 'cutoff', 'cutoff': 0.8196383213400376, 'grm_norm': 'gcn', 'self_loops': True, 'use_snp_selection': False}. Best is trial 73 with value: 0.17893980951458158.
[I 2025-11-03 12:10:46,547] Trial 81 finished with value: 0.16151165450019145 and parameters: {'model_type': 'gcn', 'hidden_dims': '[128, 64]', 'dropout': 0.24202886820187458, 'batch_norm': True, 'lr': 0.0007982174806732631, 'weight_decay': 0.00013829120964093175, 'epochs': 68, 'loss': 'mae', 'optimizer': 'adam', 'graph_mode': 'knn', 'source': 'grm', 'knn_k': 2, 'weighted_edges': True, 'symmetrize_mode': 'mutual', 'use_snp_selection': False}. Best is trial 73 with value: 0.17893980951458158.
[I 2025-11-03 12:10:48,019] Trial 82 finished with value: 0.13898540437886572 and parameters: {'model_type': 'gcn', 'hidden_dims': '[128, 64]', 'dropout': 0.23763434899976255, 'batch_norm': True, 'lr': 0.0004529352897934868, 'weight_decay': 5.0696608763227826e-05, 'epochs': 66, 'loss': 'mae', 'optimizer': 'adam', 'graph_mode': 'knn', 'source': 'grm', 'knn_k': 3, 'weighted_edges': True, 'symmetrize_mode': 'mutual', 'use_snp_selection': False}. Best is trial 73 with value: 0.17893980951458158.
[I 2025-11-03 12:10:49,405] Trial 83 finished with value: 0.12455705649116494 and parameters: {'model_type': 'gcn', 'hidden_dims': '[128, 64]', 'dropout': 0.21067824712221786, 'batch_norm': True, 'lr': 0.0008074651093223189, 'weight_decay': 6.863391305992723e-05, 'epochs': 50, 'loss': 'mae', 'optimizer': 'adam', 'graph_mode': 'knn', 'source': 'grm', 'knn_k': 3, 'weighted_edges': False, 'symmetrize_mode': 'mutual', 'use_snp_selection': False}. Best is trial 73 with value: 0.17893980951458158.
[I 2025-11-03 12:10:50,969] Trial 84 finished with value: 0.12281704211824734 and parameters: {'model_type': 'gcn', 'hidden_dims': '[128, 64]', 'dropout': 0.25050516310831905, 'batch_norm': True, 'lr': 0.0006045401013262209, 'weight_decay': 0.00010136036018062075, 'epochs': 85, 'loss': 'mae', 'optimizer': 'adam', 'graph_mode': 'knn', 'source': 'grm', 'knn_k': 2, 'weighted_edges': True, 'symmetrize_mode': 'mutual', 'use_snp_selection': False}. Best is trial 73 with value: 0.17893980951458158.
[I 2025-11-03 12:10:52,444] Trial 85 finished with value: 0.11842718826684642 and parameters: {'model_type': 'gcn', 'hidden_dims': '[256, 128]', 'dropout': 0.17477533312856108, 'batch_norm': True, 'lr': 0.0003678490258092671, 'weight_decay': 0.00020757453939315273, 'epochs': 32, 'loss': 'mae', 'optimizer': 'adam', 'graph_mode': 'knn', 'source': 'grm', 'knn_k': 4, 'weighted_edges': True, 'symmetrize_mode': 'mutual', 'use_snp_selection': False}. Best is trial 73 with value: 0.17893980951458158.
[I 2025-11-03 12:10:55,057] Trial 86 finished with value: 0.1499231168451431 and parameters: {'model_type': 'gcn', 'hidden_dims': '[512, 128]', 'dropout': 0.13715100931879703, 'batch_norm': True, 'lr': 0.0008461282081838431, 'weight_decay': 0.00014333300957124326, 'epochs': 95, 'loss': 'mae', 'optimizer': 'adam', 'graph_mode': 'knn', 'source': 'grm', 'knn_k': 2, 'weighted_edges': True, 'symmetrize_mode': 'mutual', 'use_snp_selection': False}. Best is trial 73 with value: 0.17893980951458158.
[I 2025-11-03 12:10:56,576] Trial 87 finished with value: 0.12914341280263078 and parameters: {'model_type': 'gcn', 'hidden_dims': '[128, 64]', 'dropout': 0.19681601990249986, 'batch_norm': True, 'lr': 0.0004908875490261788, 'weight_decay': 7.904772208119393e-05, 'epochs': 71, 'loss': 'mae', 'optimizer': 'adam', 'graph_mode': 'knn', 'source': 'grm', 'knn_k': 10, 'weighted_edges': True, 'symmetrize_mode': 'mutual', 'use_snp_selection': False}. Best is trial 73 with value: 0.17893980951458158.
[I 2025-11-03 12:10:59,784] Trial 88 finished with value: 0.15701067583711872 and parameters: {'model_type': 'gcn', 'hidden_dims': '[512, 128]', 'dropout': 0.21996950503291707, 'batch_norm': True, 'lr': 0.0006401579985652711, 'weight_decay': 0.0001153360214967702, 'epochs': 141, 'loss': 'mae', 'optimizer': 'adam', 'graph_mode': 'knn', 'source': 'grm', 'knn_k': 3, 'weighted_edges': True, 'symmetrize_mode': 'mutual', 'use_snp_selection': False}. Best is trial 73 with value: 0.17893980951458158.
[I 2025-11-03 12:11:02,635] Trial 89 finished with value: 0.09448573844062941 and parameters: {'model_type': 'gcn', 'hidden_dims': '[512, 128]', 'dropout': 0.14650322265074395, 'batch_norm': True, 'lr': 2.3732095640054574e-06, 'weight_decay': 0.0003298277997741701, 'epochs': 114, 'loss': 'mse', 'optimizer': 'adam', 'graph_mode': 'knn', 'source': 'grm', 'knn_k': 2, 'weighted_edges': True, 'symmetrize_mode': 'mutual', 'use_snp_selection': False}. Best is trial 73 with value: 0.17893980951458158.
