Running from this directory: /cluster/work/simennes/Project_thesis/Project_thesis
Name of job: sage_inductive
ID of job: 23365299
The job was run on these nodes: idun-09-16
[I 2025-11-11 21:28:07,170] Trial 0 finished with value: 0.16583835473199182 and parameters: {'model_type': 'graphsage', 'hidden_dims': '[128, 64]', 'dropout': 0.199031432379812, 'batch_norm': True, 'lr': 1.8408544111075837e-06, 'weight_decay': 5.5136510071208614e-05, 'epochs': 336, 'loss': 'mae', 'optimizer': 'adam', 'graph_mode': 'knn', 'source': 'grm', 'knn_k': 8, 'weighted_edges': True, 'symmetrize_mode': 'mutual', 'use_snp_selection': False}. Best is trial 0 with value: 0.16583835473199182.
[I 2025-11-11 21:29:01,978] Trial 1 finished with value: 0.24194958609695855 and parameters: {'model_type': 'graphsage', 'hidden_dims': '[128, 64]', 'dropout': 0.40051947670227217, 'batch_norm': True, 'lr': 0.0005320428882732732, 'weight_decay': 1.89210117736594e-06, 'epochs': 68, 'loss': 'mse', 'optimizer': 'adam', 'graph_mode': 'knn', 'source': 'grm', 'knn_k': 7, 'weighted_edges': True, 'symmetrize_mode': 'union', 'use_snp_selection': False}. Best is trial 1 with value: 0.24194958609695855.
[I 2025-11-11 21:30:25,028] Trial 2 finished with value: 0.1758187397679379 and parameters: {'model_type': 'graphsage', 'hidden_dims': '[256, 128]', 'dropout': 0.5105528289184642, 'batch_norm': False, 'lr': 0.0006804279372404962, 'weight_decay': 0.0008922815224257085, 'epochs': 181, 'loss': 'mse', 'optimizer': 'adam', 'graph_mode': 'cutoff', 'cutoff': 0.5741905641612706, 'grm_norm': 'gcn', 'self_loops': False, 'use_snp_selection': True, 'num_snps': 26910}. Best is trial 1 with value: 0.24194958609695855.
[I 2025-11-11 21:31:59,952] Trial 3 finished with value: 0.2529381469342754 and parameters: {'model_type': 'graphsage', 'hidden_dims': '[256, 128, 64]', 'dropout': 0.5390483213624292, 'batch_norm': False, 'lr': 3.4705625989073525e-05, 'weight_decay': 2.4623319020131338e-05, 'epochs': 121, 'loss': 'mse', 'optimizer': 'adam', 'graph_mode': 'knn', 'source': 'grm', 'knn_k': 6, 'weighted_edges': False, 'symmetrize_mode': 'mutual', 'use_snp_selection': True, 'num_snps': 30713}. Best is trial 3 with value: 0.2529381469342754.
[I 2025-11-11 21:33:10,030] Trial 4 finished with value: 0.22508866817098871 and parameters: {'model_type': 'graphsage', 'hidden_dims': '[128, 64]', 'dropout': 0.13404863676897502, 'batch_norm': False, 'lr': 0.0001431556295367288, 'weight_decay': 2.2084517750726675e-05, 'epochs': 51, 'loss': 'mae', 'optimizer': 'adam', 'graph_mode': 'cutoff', 'cutoff': 0.6714268476993044, 'grm_norm': 'none', 'self_loops': False, 'use_snp_selection': True, 'num_snps': 45645}. Best is trial 3 with value: 0.2529381469342754.
[I 2025-11-11 21:34:54,695] Trial 5 finished with value: 0.25784664837610466 and parameters: {'model_type': 'graphsage', 'hidden_dims': '[256, 128]', 'dropout': 0.42253606323412096, 'batch_norm': False, 'lr': 4.238630400638805e-05, 'weight_decay': 8.074086040046576e-07, 'epochs': 158, 'loss': 'mae', 'optimizer': 'adam', 'graph_mode': 'knn', 'source': 'grm', 'knn_k': 1, 'weighted_edges': False, 'symmetrize_mode': 'mutual', 'use_snp_selection': True, 'num_snps': 43113}. Best is trial 5 with value: 0.25784664837610466.
[I 2025-11-11 21:37:39,684] Trial 6 finished with value: 0.24866411590015985 and parameters: {'model_type': 'graphsage', 'hidden_dims': '[512, 256]', 'dropout': 0.3534893146320237, 'batch_norm': True, 'lr': 0.000251307964226932, 'weight_decay': 1.821819791794022e-05, 'epochs': 223, 'loss': 'mae', 'optimizer': 'adam', 'graph_mode': 'knn', 'source': 'grm', 'knn_k': 1, 'weighted_edges': True, 'symmetrize_mode': 'mutual', 'use_snp_selection': False}. Best is trial 5 with value: 0.25784664837610466.
[I 2025-11-11 21:40:00,083] Trial 7 finished with value: 0.23437291769889343 and parameters: {'model_type': 'graphsage', 'hidden_dims': '[512, 256]', 'dropout': 0.1105825955860775, 'batch_norm': True, 'lr': 2.374338412754043e-05, 'weight_decay': 1.1284721123340274e-05, 'epochs': 190, 'loss': 'mse', 'optimizer': 'adam', 'graph_mode': 'cutoff', 'cutoff': 0.719872204109604, 'grm_norm': 'gcn', 'self_loops': False, 'use_snp_selection': False}. Best is trial 5 with value: 0.25784664837610466.
[I 2025-11-11 21:41:56,741] Trial 8 finished with value: 0.2566819700213284 and parameters: {'model_type': 'graphsage', 'hidden_dims': '[512, 128]', 'dropout': 0.5066580418354021, 'batch_norm': True, 'lr': 0.00039213678276659976, 'weight_decay': 3.43655320802934e-06, 'epochs': 120, 'loss': 'mse', 'optimizer': 'adam', 'graph_mode': 'cutoff', 'cutoff': 0.34923059576505366, 'grm_norm': 'cosine', 'self_loops': True, 'use_snp_selection': False}. Best is trial 5 with value: 0.25784664837610466.
[I 2025-11-11 21:43:16,335] Trial 9 finished with value: 0.23605873121540047 and parameters: {'model_type': 'graphsage', 'hidden_dims': '[512, 256]', 'dropout': 0.301734920240333, 'batch_norm': False, 'lr': 6.650961854953448e-06, 'weight_decay': 6.861575656590315e-05, 'epochs': 150, 'loss': 'mae', 'optimizer': 'adam', 'graph_mode': 'cutoff', 'cutoff': 0.2857569870061939, 'grm_norm': 'cosine_then_gcn', 'self_loops': False, 'use_snp_selection': True, 'num_snps': 12722}. Best is trial 5 with value: 0.25784664837610466.
[I 2025-11-11 21:46:38,367] Trial 10 finished with value: 0.24018096376894396 and parameters: {'model_type': 'graphsage', 'hidden_dims': '[256, 128]', 'dropout': 0.42081077970837905, 'batch_norm': False, 'lr': 6.10458015764876e-05, 'weight_decay': 1.1882920363656206e-07, 'epochs': 265, 'loss': 'mae', 'optimizer': 'adam', 'graph_mode': 'knn', 'source': 'grm', 'knn_k': 1, 'weighted_edges': False, 'symmetrize_mode': 'union', 'use_snp_selection': True, 'num_snps': 58960}. Best is trial 5 with value: 0.25784664837610466.
[I 2025-11-11 21:48:49,222] Trial 11 finished with value: 0.1954989120254104 and parameters: {'model_type': 'graphsage', 'hidden_dims': '[512, 128]', 'dropout': 0.5984993350797241, 'batch_norm': True, 'lr': 8.807069823561703e-06, 'weight_decay': 1.0705295993875854e-06, 'epochs': 114, 'loss': 'mse', 'optimizer': 'adam', 'graph_mode': 'cutoff', 'cutoff': 0.26571427357234195, 'grm_norm': 'cosine', 'self_loops': True, 'use_snp_selection': False}. Best is trial 5 with value: 0.25784664837610466.
[I 2025-11-11 21:51:11,968] Trial 12 finished with value: 0.2590084406566383 and parameters: {'model_type': 'graphsage', 'hidden_dims': '[512, 128]', 'dropout': 0.4599947205431382, 'batch_norm': True, 'lr': 0.00012059085553112924, 'weight_decay': 2.1215328315431727e-06, 'epochs': 103, 'loss': 'mse', 'optimizer': 'adam', 'graph_mode': 'cutoff', 'cutoff': 0.421678803879304, 'grm_norm': 'cosine', 'self_loops': True, 'use_snp_selection': True, 'num_snps': 47202}. Best is trial 12 with value: 0.2590084406566383.
[I 2025-11-11 21:54:44,699] Trial 13 finished with value: 0.2507201314186689 and parameters: {'model_type': 'graphsage', 'hidden_dims': '[512, 64]', 'dropout': 0.4452783958423849, 'batch_norm': False, 'lr': 9.435873784504329e-05, 'weight_decay': 3.5747956999090315e-07, 'epochs': 234, 'loss': 'mae', 'optimizer': 'adam', 'graph_mode': 'knn', 'source': 'grm', 'knn_k': 3, 'weighted_edges': False, 'symmetrize_mode': 'mutual', 'use_snp_selection': True, 'num_snps': 47927}. Best is trial 12 with value: 0.2590084406566383.
[I 2025-11-11 21:56:11,737] Trial 14 finished with value: 0.21566211540903835 and parameters: {'model_type': 'graphsage', 'hidden_dims': '[256, 128]', 'dropout': 0.2984650537158794, 'batch_norm': True, 'lr': 1.6058946182044635e-05, 'weight_decay': 5.570243977922399e-07, 'epochs': 89, 'loss': 'mse', 'optimizer': 'adam', 'graph_mode': 'cutoff', 'cutoff': 0.89003853770128, 'grm_norm': 'cosine', 'self_loops': True, 'use_snp_selection': True, 'num_snps': 44844}. Best is trial 12 with value: 0.2590084406566383.
[I 2025-11-11 21:59:17,544] Trial 15 finished with value: 0.2547040290209884 and parameters: {'model_type': 'graphsage', 'hidden_dims': '[512, 128]', 'dropout': 0.4637052439186998, 'batch_norm': False, 'lr': 5.5758659587657317e-05, 'weight_decay': 4.109412643182285e-06, 'epochs': 158, 'loss': 'mae', 'optimizer': 'adam', 'graph_mode': 'knn', 'source': 'grm', 'knn_k': 10, 'weighted_edges': False, 'symmetrize_mode': 'mutual', 'use_snp_selection': True, 'num_snps': 39168}. Best is trial 12 with value: 0.2590084406566383.
[I 2025-11-11 22:06:22,542] Trial 16 finished with value: 0.17579337383258192 and parameters: {'model_type': 'graphsage', 'hidden_dims': '[512, 64]', 'dropout': 0.29074878043911745, 'batch_norm': False, 'lr': 0.00017731606219830573, 'weight_decay': 1.082742401299246e-07, 'epochs': 298, 'loss': 'mae', 'optimizer': 'adam', 'graph_mode': 'knn', 'source': 'grm', 'knn_k': 4, 'weighted_edges': False, 'symmetrize_mode': 'union', 'use_snp_selection': True, 'num_snps': 59635}. Best is trial 12 with value: 0.2590084406566383.
[I 2025-11-11 22:07:36,983] Trial 17 finished with value: 0.09592586105100906 and parameters: {'model_type': 'graphsage', 'hidden_dims': '[256, 128, 64]', 'dropout': 0.3699925123628064, 'batch_norm': True, 'lr': 2.1309508936835578e-06, 'weight_decay': 4.101281111267374e-07, 'epochs': 41, 'loss': 'mse', 'optimizer': 'adam', 'graph_mode': 'cutoff', 'cutoff': 0.44845136463148116, 'grm_norm': 'cosine_then_gcn', 'self_loops': True, 'use_snp_selection': True, 'num_snps': 35836}. Best is trial 12 with value: 0.2590084406566383.
[I 2025-11-11 22:08:46,146] Trial 18 finished with value: 0.24537481344199982 and parameters: {'model_type': 'graphsage', 'hidden_dims': '[256, 128]', 'dropout': 0.5911829750599904, 'batch_norm': True, 'lr': 0.000957302611948741, 'weight_decay': 3.567476169624953e-06, 'epochs': 89, 'loss': 'mse', 'optimizer': 'adam', 'graph_mode': 'knn', 'source': 'grm', 'knn_k': 4, 'weighted_edges': False, 'symmetrize_mode': 'mutual', 'use_snp_selection': True, 'num_snps': 20891}. Best is trial 12 with value: 0.2590084406566383.
[I 2025-11-11 22:09:36,936] Trial 19 finished with value: 0.1928680015355992 and parameters: {'model_type': 'graphsage', 'hidden_dims': '[512, 128]', 'dropout': 0.23994589886213116, 'batch_norm': False, 'lr': 6.9203558186246126e-06, 'weight_decay': 1.0945321444242485e-06, 'epochs': 153, 'loss': 'mae', 'optimizer': 'adam', 'graph_mode': 'cutoff', 'cutoff': 0.4498953050325049, 'grm_norm': 'none', 'self_loops': True, 'use_snp_selection': True, 'num_snps': 3009}. Best is trial 12 with value: 0.2590084406566383.
[I 2025-11-11 22:13:54,333] Trial 20 finished with value: 0.24087599528719866 and parameters: {'model_type': 'graphsage', 'hidden_dims': '[512, 128]', 'dropout': 0.4629681823820593, 'batch_norm': False, 'lr': 6.058167513608847e-05, 'weight_decay': 0.00031684675981644096, 'epochs': 241, 'loss': 'mae', 'optimizer': 'adam', 'graph_mode': 'knn', 'source': 'grm', 'knn_k': 3, 'weighted_edges': True, 'symmetrize_mode': 'union', 'use_snp_selection': True, 'num_snps': 49906}. Best is trial 12 with value: 0.2590084406566383.
[I 2025-11-11 22:15:43,174] Trial 21 finished with value: 0.255841069041042 and parameters: {'model_type': 'graphsage', 'hidden_dims': '[512, 128]', 'dropout': 0.5208566505179647, 'batch_norm': True, 'lr': 0.000293452852987219, 'weight_decay': 4.950558617424414e-06, 'epochs': 114, 'loss': 'mse', 'optimizer': 'adam', 'graph_mode': 'cutoff', 'cutoff': 0.3953717208385542, 'grm_norm': 'cosine', 'self_loops': True, 'use_snp_selection': False}. Best is trial 12 with value: 0.2590084406566383.
[I 2025-11-11 22:19:22,988] Trial 22 finished with value: 0.24097957999235686 and parameters: {'model_type': 'graphsage', 'hidden_dims': '[512, 128]', 'dropout': 0.506611031174147, 'batch_norm': True, 'lr': 0.00012204070589661161, 'weight_decay': 1.9069472132709764e-06, 'epochs': 143, 'loss': 'mse', 'optimizer': 'adam', 'graph_mode': 'cutoff', 'cutoff': 0.20289428157460127, 'grm_norm': 'cosine', 'self_loops': True, 'use_snp_selection': False}. Best is trial 12 with value: 0.2590084406566383.
[I 2025-11-11 22:20:45,708] Trial 23 finished with value: 0.25791548995578045 and parameters: {'model_type': 'graphsage', 'hidden_dims': '[512, 128]', 'dropout': 0.3895238480883739, 'batch_norm': True, 'lr': 0.0003578809754003499, 'weight_decay': 7.639316604876579e-06, 'epochs': 77, 'loss': 'mse', 'optimizer': 'adam', 'graph_mode': 'cutoff', 'cutoff': 0.3616594601059005, 'grm_norm': 'cosine', 'self_loops': True, 'use_snp_selection': False}. Best is trial 12 with value: 0.2590084406566383.
[I 2025-11-11 22:21:32,395] Trial 24 finished with value: 0.24060043265981199 and parameters: {'model_type': 'graphsage', 'hidden_dims': '[256, 128]', 'dropout': 0.3978604106922989, 'batch_norm': True, 'lr': 0.000236316758051064, 'weight_decay': 9.46734893940053e-06, 'epochs': 78, 'loss': 'mse', 'optimizer': 'adam', 'graph_mode': 'cutoff', 'cutoff': 0.533681595520939, 'grm_norm': 'cosine', 'self_loops': True, 'use_snp_selection': False}. Best is trial 12 with value: 0.2590084406566383.
[I 2025-11-11 22:23:42,495] Trial 25 finished with value: 0.2413218194167587 and parameters: {'model_type': 'graphsage', 'hidden_dims': '[512, 128]', 'dropout': 0.3244692578890053, 'batch_norm': True, 'lr': 2.833442837969907e-05, 'weight_decay': 2.476222099038176e-07, 'epochs': 101, 'loss': 'mse', 'optimizer': 'adam', 'graph_mode': 'cutoff', 'cutoff': 0.5481163139074389, 'grm_norm': 'cosine', 'self_loops': True, 'use_snp_selection': True, 'num_snps': 53774}. Best is trial 12 with value: 0.2590084406566383.
[I 2025-11-11 22:24:56,468] Trial 26 finished with value: 0.2614173534938351 and parameters: {'model_type': 'graphsage', 'hidden_dims': '[512, 64]', 'dropout': 0.43392274677684384, 'batch_norm': True, 'lr': 0.00011422685042380385, 'weight_decay': 8.973991107308083e-07, 'epochs': 65, 'loss': 'mse', 'optimizer': 'adam', 'graph_mode': 'cutoff', 'cutoff': 0.34300548308557716, 'grm_norm': 'cosine', 'self_loops': True, 'use_snp_selection': False}. Best is trial 26 with value: 0.2614173534938351.
[I 2025-11-11 22:26:09,323] Trial 27 finished with value: 0.2296723219305397 and parameters: {'model_type': 'graphsage', 'hidden_dims': '[512, 64]', 'dropout': 0.3815207698889247, 'batch_norm': True, 'lr': 9.577947253507523e-05, 'weight_decay': 7.291908288006674e-06, 'epochs': 64, 'loss': 'mse', 'optimizer': 'adam', 'graph_mode': 'cutoff', 'cutoff': 0.35119959578011917, 'grm_norm': 'cosine', 'self_loops': True, 'use_snp_selection': False}. Best is trial 26 with value: 0.2614173534938351.
[I 2025-11-11 22:27:05,391] Trial 28 finished with value: 0.27007454636037104 and parameters: {'model_type': 'graphsage', 'hidden_dims': '[512, 64]', 'dropout': 0.5530370961344045, 'batch_norm': True, 'lr': 0.0004315759423653309, 'weight_decay': 1.6377039988613388e-06, 'epochs': 44, 'loss': 'mse', 'optimizer': 'adam', 'graph_mode': 'cutoff', 'cutoff': 0.44515972124128356, 'grm_norm': 'cosine', 'self_loops': True, 'use_snp_selection': False}. Best is trial 28 with value: 0.27007454636037104.
[I 2025-11-11 22:27:59,978] Trial 29 finished with value: 0.15191258609716435 and parameters: {'model_type': 'graphsage', 'hidden_dims': '[512, 64]', 'dropout': 0.5536701625891388, 'batch_norm': True, 'lr': 1.2103727732165146e-06, 'weight_decay': 1.7215382365426427e-06, 'epochs': 42, 'loss': 'mse', 'optimizer': 'adam', 'graph_mode': 'cutoff', 'cutoff': 0.44951037055911125, 'grm_norm': 'cosine', 'self_loops': True, 'use_snp_selection': False}. Best is trial 28 with value: 0.27007454636037104.
[I 2025-11-11 22:31:55,853] Trial 30 finished with value: 0.2611709951948013 and parameters: {'model_type': 'graphsage', 'hidden_dims': '[512, 64]', 'dropout': 0.5582643567440748, 'batch_norm': True, 'lr': 0.0009647429446528166, 'weight_decay': 2.210265095476223e-07, 'epochs': 320, 'loss': 'mse', 'optimizer': 'adam', 'graph_mode': 'cutoff', 'cutoff': 0.5135398837131555, 'grm_norm': 'none', 'self_loops': True, 'use_snp_selection': False}. Best is trial 28 with value: 0.27007454636037104.
[I 2025-11-11 22:36:09,230] Trial 31 finished with value: 0.2547689851692009 and parameters: {'model_type': 'graphsage', 'hidden_dims': '[512, 64]', 'dropout': 0.5628383994636232, 'batch_norm': True, 'lr': 0.0009485897961610826, 'weight_decay': 2.4748821185769754e-07, 'epochs': 347, 'loss': 'mse', 'optimizer': 'adam', 'graph_mode': 'cutoff', 'cutoff': 0.5149127537314694, 'grm_norm': 'none', 'self_loops': True, 'use_snp_selection': False}. Best is trial 28 with value: 0.27007454636037104.
[I 2025-11-11 22:39:41,689] Trial 32 finished with value: 0.24721502675375745 and parameters: {'model_type': 'graphsage', 'hidden_dims': '[512, 64]', 'dropout': 0.47444125662312336, 'batch_norm': True, 'lr': 0.000630456343452189, 'weight_decay': 1.9483016740583392e-07, 'epochs': 305, 'loss': 'mse', 'optimizer': 'adam', 'graph_mode': 'cutoff', 'cutoff': 0.6366111663672916, 'grm_norm': 'none', 'self_loops': True, 'use_snp_selection': False}. Best is trial 28 with value: 0.27007454636037104.
[I 2025-11-11 22:40:49,487] Trial 33 finished with value: 0.2575114974730173 and parameters: {'model_type': 'graphsage', 'hidden_dims': '[512, 64]', 'dropout': 0.4891710320499686, 'batch_norm': True, 'lr': 0.0003875250120639049, 'weight_decay': 2.0644369601901728e-06, 'epochs': 62, 'loss': 'mse', 'optimizer': 'adam', 'graph_mode': 'cutoff', 'cutoff': 0.4727583336945642, 'grm_norm': 'none', 'self_loops': True, 'use_snp_selection': False}. Best is trial 28 with value: 0.27007454636037104.
[I 2025-11-11 22:45:14,824] Trial 34 finished with value: 0.25521727584044146 and parameters: {'model_type': 'graphsage', 'hidden_dims': '[512, 64]', 'dropout': 0.5652626658391333, 'batch_norm': True, 'lr': 0.0005202263317807604, 'weight_decay': 6.040790348152671e-07, 'epochs': 318, 'loss': 'mse', 'optimizer': 'adam', 'graph_mode': 'cutoff', 'cutoff': 0.3865505800273704, 'grm_norm': 'gcn', 'self_loops': True, 'use_snp_selection': False}. Best is trial 28 with value: 0.27007454636037104.
[I 2025-11-11 22:47:29,768] Trial 35 finished with value: 0.24711023724366127 and parameters: {'model_type': 'graphsage', 'hidden_dims': '[128, 64]', 'dropout': 0.5332307470473103, 'batch_norm': True, 'lr': 0.0001754975052084955, 'weight_decay': 1.5130491143385343e-06, 'epochs': 262, 'loss': 'mse', 'optimizer': 'adam', 'graph_mode': 'cutoff', 'cutoff': 0.28721852122940184, 'grm_norm': 'cosine_then_gcn', 'self_loops': True, 'use_snp_selection': False}. Best is trial 28 with value: 0.27007454636037104.
[I 2025-11-11 22:49:58,904] Trial 36 finished with value: 0.2498603377953897 and parameters: {'model_type': 'graphsage', 'hidden_dims': '[512, 64]', 'dropout': 0.43891941994646844, 'batch_norm': True, 'lr': 0.0005872910071825134, 'weight_decay': 7.31743802805627e-07, 'epochs': 202, 'loss': 'mse', 'optimizer': 'adam', 'graph_mode': 'cutoff', 'cutoff': 0.6054125548057089, 'grm_norm': 'cosine', 'self_loops': True, 'use_snp_selection': False}. Best is trial 28 with value: 0.27007454636037104.
[I 2025-11-11 22:50:40,133] Trial 37 finished with value: 0.2732189666284773 and parameters: {'model_type': 'graphsage', 'hidden_dims': '[256, 128, 64]', 'dropout': 0.5702083932589544, 'batch_norm': True, 'lr': 9.134284903445995e-05, 'weight_decay': 1.805219356976209e-07, 'epochs': 58, 'loss': 'mse', 'optimizer': 'adam', 'graph_mode': 'cutoff', 'cutoff': 0.49744296306809965, 'grm_norm': 'none', 'self_loops': True, 'use_snp_selection': False}. Best is trial 37 with value: 0.2732189666284773.
[I 2025-11-11 22:51:19,883] Trial 38 finished with value: 0.25388628473262986 and parameters: {'model_type': 'graphsage', 'hidden_dims': '[256, 128, 64]', 'dropout': 0.5777903954448484, 'batch_norm': True, 'lr': 0.00019252975597623779, 'weight_decay': 1.854404167459295e-07, 'epochs': 56, 'loss': 'mse', 'optimizer': 'adam', 'graph_mode': 'cutoff', 'cutoff': 0.5020715526536558, 'grm_norm': 'none', 'self_loops': False, 'use_snp_selection': False}. Best is trial 37 with value: 0.2732189666284773.
[I 2025-11-11 22:52:51,373] Trial 39 finished with value: 0.2518296232058586 and parameters: {'model_type': 'graphsage', 'hidden_dims': '[256, 128, 64]', 'dropout': 0.5378978575996127, 'batch_norm': True, 'lr': 8.708708371235565e-05, 'weight_decay': 3.650669522217143e-07, 'epochs': 173, 'loss': 'mse', 'optimizer': 'adam', 'graph_mode': 'cutoff', 'cutoff': 0.49276697506430234, 'grm_norm': 'none', 'self_loops': True, 'use_snp_selection': False}. Best is trial 37 with value: 0.2732189666284773.
[I 2025-11-11 22:55:03,352] Trial 40 finished with value: 0.26120455900420303 and parameters: {'model_type': 'graphsage', 'hidden_dims': '[256, 128, 64]', 'dropout': 0.18406967583918152, 'batch_norm': True, 'lr': 0.0007611405991666986, 'weight_decay': 1.5358702046411868e-07, 'epochs': 207, 'loss': 'mse', 'optimizer': 'adam', 'graph_mode': 'cutoff', 'cutoff': 0.32149689099109824, 'grm_norm': 'none', 'self_loops': True, 'use_snp_selection': False}. Best is trial 37 with value: 0.2732189666284773.
[I 2025-11-11 22:57:57,760] Trial 41 finished with value: 0.24970520648365285 and parameters: {'model_type': 'graphsage', 'hidden_dims': '[256, 128, 64]', 'dropout': 0.17275806814552655, 'batch_norm': True, 'lr': 0.0007498259848278917, 'weight_decay': 1.3613318906646217e-07, 'epochs': 280, 'loss': 'mse', 'optimizer': 'adam', 'graph_mode': 'cutoff', 'cutoff': 0.31800282427860244, 'grm_norm': 'none', 'self_loops': True, 'use_snp_selection': False}. Best is trial 37 with value: 0.2732189666284773.
[I 2025-11-11 22:59:03,476] Trial 42 finished with value: 0.24295051723575728 and parameters: {'model_type': 'graphsage', 'hidden_dims': '[256, 128, 64]', 'dropout': 0.2503707351641101, 'batch_norm': True, 'lr': 0.0005047858820582858, 'weight_decay': 3.1882622628984205e-07, 'epochs': 134, 'loss': 'mse', 'optimizer': 'adam', 'graph_mode': 'cutoff', 'cutoff': 0.5766740148767655, 'grm_norm': 'none', 'self_loops': True, 'use_snp_selection': False}. Best is trial 37 with value: 0.2732189666284773.
