[I 2025-11-03 14:36:26,261] Trial 54 finished with value: 0.11038479141349646 and parameters: {'model_type': 'graphsage', 'hidden_dims': '[512, 256]', 'dropout': 0.45420452952180723, 'batch_norm': True, 'lr': 0.00039815985152580986, 'weight_decay': 1.619433043593252e-06, 'epochs': 195, 'loss': 'mse', 'optimizer': 'adam', 'graph_mode': 'knn', 'source': 'grm', 'knn_k': 9, 'weighted_edges': True, 'symmetrize_mode': 'union', 'use_snp_selection': False}. Best is trial 24 with value: 0.1360864241733849.
[I 2025-11-03 14:36:29,924] Trial 55 finished with value: 0.12326262765217574 and parameters: {'model_type': 'graphsage', 'hidden_dims': '[256, 128, 64]', 'dropout': 0.41260003648003596, 'batch_norm': True, 'lr': 0.00018862554031400132, 'weight_decay': 3.72859671660014e-07, 'epochs': 228, 'loss': 'mse', 'optimizer': 'adam', 'graph_mode': 'knn', 'source': 'grm', 'knn_k': 10, 'weighted_edges': True, 'symmetrize_mode': 'mutual', 'use_snp_selection': False}. Best is trial 24 with value: 0.1360864241733849.
[I 2025-11-03 14:36:33,607] Trial 56 finished with value: 0.11078584038052669 and parameters: {'model_type': 'graphsage', 'hidden_dims': '[256, 128, 64]', 'dropout': 0.4764165104221256, 'batch_norm': True, 'lr': 0.00012133728690706829, 'weight_decay': 4.343042032311606e-07, 'epochs': 230, 'loss': 'mae', 'optimizer': 'adam', 'graph_mode': 'knn', 'source': 'grm', 'knn_k': 10, 'weighted_edges': True, 'symmetrize_mode': 'mutual', 'use_snp_selection': False}. Best is trial 24 with value: 0.1360864241733849.
[I 2025-11-03 14:36:37,224] Trial 57 finished with value: 0.09173357982568603 and parameters: {'model_type': 'graphsage', 'hidden_dims': '[256, 128, 64]', 'dropout': 0.3768931000533608, 'batch_norm': True, 'lr': 7.891298208287907e-05, 'weight_decay': 1.5169208196341012e-07, 'epochs': 224, 'loss': 'mse', 'optimizer': 'adam', 'graph_mode': 'knn', 'source': 'grm', 'knn_k': 10, 'weighted_edges': False, 'symmetrize_mode': 'mutual', 'use_snp_selection': False}. Best is trial 24 with value: 0.1360864241733849.
[I 2025-11-03 14:36:40,095] Trial 58 finished with value: 0.09245740181989887 and parameters: {'model_type': 'graphsage', 'hidden_dims': '[256, 128, 64]', 'dropout': 0.40651939300272416, 'batch_norm': True, 'lr': 0.0001866675185292539, 'weight_decay': 2.5794277197675926e-07, 'epochs': 197, 'loss': 'mae', 'optimizer': 'adam', 'graph_mode': 'knn', 'source': 'grm', 'knn_k': 1, 'weighted_edges': True, 'symmetrize_mode': 'mutual', 'use_snp_selection': False}. Best is trial 24 with value: 0.1360864241733849.
[I 2025-11-03 14:36:43,486] Trial 59 finished with value: 0.09012665501494613 and parameters: {'model_type': 'graphsage', 'hidden_dims': '[256, 128, 64]', 'dropout': 0.3376508927593588, 'batch_norm': False, 'lr': 0.0002973766730983357, 'weight_decay': 6.593577693028661e-07, 'epochs': 349, 'loss': 'mae', 'optimizer': 'adam', 'graph_mode': 'knn', 'source': 'grm', 'knn_k': 4, 'weighted_edges': True, 'symmetrize_mode': 'mutual', 'use_snp_selection': True, 'num_snps': 16802}. Best is trial 24 with value: 0.1360864241733849.
[I 2025-11-03 14:36:49,700] Trial 60 finished with value: 0.11668676649309541 and parameters: {'model_type': 'graphsage', 'hidden_dims': '[512, 128]', 'dropout': 0.35971493287755696, 'batch_norm': True, 'lr': 5.794787963445177e-05, 'weight_decay': 1.3146127670479037e-07, 'epochs': 323, 'loss': 'mse', 'optimizer': 'adam', 'graph_mode': 'knn', 'source': 'grm', 'knn_k': 3, 'weighted_edges': False, 'symmetrize_mode': 'mutual', 'use_snp_selection': False}. Best is trial 24 with value: 0.1360864241733849.
[I 2025-11-03 14:36:55,488] Trial 61 finished with value: 0.11834951303941096 and parameters: {'model_type': 'graphsage', 'hidden_dims': '[512, 256]', 'dropout': 0.41289670208202467, 'batch_norm': True, 'lr': 0.0005397768109185908, 'weight_decay': 1.2041402101827059e-06, 'epochs': 251, 'loss': 'mse', 'optimizer': 'adam', 'graph_mode': 'knn', 'source': 'grm', 'knn_k': 10, 'weighted_edges': True, 'symmetrize_mode': 'mutual', 'use_snp_selection': False}. Best is trial 24 with value: 0.1360864241733849.
[I 2025-11-03 14:37:01,303] Trial 62 finished with value: 0.11556041932657772 and parameters: {'model_type': 'graphsage', 'hidden_dims': '[512, 64]', 'dropout': 0.37985532211710005, 'batch_norm': True, 'lr': 0.0009682468039749298, 'weight_decay': 2.7927357136191517e-06, 'epochs': 216, 'loss': 'mse', 'optimizer': 'adam', 'graph_mode': 'knn', 'source': 'grm', 'knn_k': 9, 'weighted_edges': True, 'symmetrize_mode': 'union', 'use_snp_selection': False}. Best is trial 24 with value: 0.1360864241733849.
[I 2025-11-03 14:37:06,658] Trial 63 finished with value: 0.10745405906127209 and parameters: {'model_type': 'graphsage', 'hidden_dims': '[512, 256]', 'dropout': 0.44930996071416246, 'batch_norm': True, 'lr': 0.00013386542743439703, 'weight_decay': 3.2235652760281316e-07, 'epochs': 233, 'loss': 'mse', 'optimizer': 'adam', 'graph_mode': 'knn', 'source': 'grm', 'knn_k': 8, 'weighted_edges': True, 'symmetrize_mode': 'mutual', 'use_snp_selection': False}. Best is trial 24 with value: 0.1360864241733849.
[I 2025-11-03 14:37:11,364] Trial 64 finished with value: 0.11095236764933471 and parameters: {'model_type': 'graphsage', 'hidden_dims': '[512, 256]', 'dropout': 0.4244840744002383, 'batch_norm': True, 'lr': 0.0003507050959020134, 'weight_decay': 1.6246750281219717e-05, 'epochs': 180, 'loss': 'mse', 'optimizer': 'adam', 'graph_mode': 'knn', 'source': 'grm', 'knn_k': 10, 'weighted_edges': True, 'symmetrize_mode': 'mutual', 'use_snp_selection': False}. Best is trial 24 with value: 0.1360864241733849.
[I 2025-11-03 14:37:13,839] Trial 65 finished with value: 0.12037669644159345 and parameters: {'model_type': 'graphsage', 'hidden_dims': '[128, 64]', 'dropout': 0.3119134038706944, 'batch_norm': True, 'lr': 0.00023604419552116808, 'weight_decay': 4.2839152474177514e-07, 'epochs': 245, 'loss': 'mae', 'optimizer': 'adam', 'graph_mode': 'knn', 'source': 'grm', 'knn_k': 5, 'weighted_edges': True, 'symmetrize_mode': 'mutual', 'use_snp_selection': False}. Best is trial 24 with value: 0.1360864241733849.
[I 2025-11-03 14:37:16,416] Trial 66 finished with value: 0.10648295351994086 and parameters: {'model_type': 'graphsage', 'hidden_dims': '[128, 64]', 'dropout': 0.31828930498517766, 'batch_norm': True, 'lr': 0.00022637547737328602, 'weight_decay': 3.7915107335978066e-07, 'epochs': 267, 'loss': 'mae', 'optimizer': 'adam', 'graph_mode': 'knn', 'source': 'grm', 'knn_k': 5, 'weighted_edges': False, 'symmetrize_mode': 'mutual', 'use_snp_selection': False}. Best is trial 24 with value: 0.1360864241733849.
[I 2025-11-03 14:37:17,931] Trial 67 finished with value: 0.11938767010080831 and parameters: {'model_type': 'graphsage', 'hidden_dims': '[128, 64]', 'dropout': 0.3104132403998967, 'batch_norm': True, 'lr': 0.00015023471702019835, 'weight_decay': 8.985927417884434e-07, 'epochs': 85, 'loss': 'mae', 'optimizer': 'adam', 'graph_mode': 'cutoff', 'cutoff': 0.7470249819019097, 'grm_norm': 'none', 'self_loops': True, 'use_snp_selection': False}. Best is trial 24 with value: 0.1360864241733849.
[I 2025-11-03 14:37:20,590] Trial 68 finished with value: 0.11069302316172128 and parameters: {'model_type': 'graphsage', 'hidden_dims': '[128, 64]', 'dropout': 0.2740166555605544, 'batch_norm': True, 'lr': 0.0001047292690796071, 'weight_decay': 5.721342037385296e-07, 'epochs': 283, 'loss': 'mae', 'optimizer': 'adam', 'graph_mode': 'knn', 'source': 'grm', 'knn_k': 5, 'weighted_edges': True, 'symmetrize_mode': 'mutual', 'use_snp_selection': False}. Best is trial 24 with value: 0.1360864241733849.
[I 2025-11-03 14:37:23,027] Trial 69 finished with value: 0.11111819665485652 and parameters: {'model_type': 'graphsage', 'hidden_dims': '[128, 64]', 'dropout': 0.2132357645603981, 'batch_norm': True, 'lr': 0.00017786349480771653, 'weight_decay': 2.250120518909961e-07, 'epochs': 252, 'loss': 'mae', 'optimizer': 'adam', 'graph_mode': 'knn', 'source': 'grm', 'knn_k': 4, 'weighted_edges': False, 'symmetrize_mode': 'mutual', 'use_snp_selection': False}. Best is trial 24 with value: 0.1360864241733849.
[I 2025-11-03 14:37:27,010] Trial 70 finished with value: 0.10289894049418975 and parameters: {'model_type': 'graphsage', 'hidden_dims': '[256, 128]', 'dropout': 0.34005552038072206, 'batch_norm': True, 'lr': 9.309306440612133e-05, 'weight_decay': 1.2443392550542457e-07, 'epochs': 309, 'loss': 'mae', 'optimizer': 'adam', 'graph_mode': 'knn', 'source': 'grm', 'knn_k': 6, 'weighted_edges': True, 'symmetrize_mode': 'mutual', 'use_snp_selection': False}. Best is trial 24 with value: 0.1360864241733849.
[I 2025-11-03 14:37:28,517] Trial 71 finished with value: 0.09555749357180693 and parameters: {'model_type': 'graphsage', 'hidden_dims': '[128, 64]', 'dropout': 0.2837050489729377, 'batch_norm': True, 'lr': 0.0002668844776343335, 'weight_decay': 9.267995213724084e-07, 'epochs': 83, 'loss': 'mae', 'optimizer': 'adam', 'graph_mode': 'cutoff', 'cutoff': 0.7743918622743104, 'grm_norm': 'none', 'self_loops': True, 'use_snp_selection': False}. Best is trial 24 with value: 0.1360864241733849.
[I 2025-11-03 14:37:30,541] Trial 72 finished with value: 0.11521502270253775 and parameters: {'model_type': 'graphsage', 'hidden_dims': '[128, 64]', 'dropout': 0.30445926818698366, 'batch_norm': True, 'lr': 0.00014494315756453192, 'weight_decay': 4.2134545787030177e-07, 'epochs': 211, 'loss': 'mae', 'optimizer': 'adam', 'graph_mode': 'cutoff', 'cutoff': 0.5991479368397558, 'grm_norm': 'none', 'self_loops': True, 'use_snp_selection': False}. Best is trial 24 with value: 0.1360864241733849.
[I 2025-11-03 14:37:32,478] Trial 73 finished with value: 0.0657214226153307 and parameters: {'model_type': 'graphsage', 'hidden_dims': '[128, 64]', 'dropout': 0.3571957694544006, 'batch_norm': True, 'lr': 6.22047834615747e-05, 'weight_decay': 7.926128838807152e-07, 'epochs': 155, 'loss': 'mae', 'optimizer': 'adam', 'graph_mode': 'cutoff', 'cutoff': 0.4760790866927217, 'grm_norm': 'none', 'self_loops': True, 'use_snp_selection': False}. Best is trial 24 with value: 0.1360864241733849.
[I 2025-11-03 14:37:34,217] Trial 74 finished with value: 0.11530570595226745 and parameters: {'model_type': 'graphsage', 'hidden_dims': '[128, 64]', 'dropout': 0.4337513913566654, 'batch_norm': True, 'lr': 0.0007689533291808837, 'weight_decay': 3.139547797086984e-07, 'epochs': 131, 'loss': 'mae', 'optimizer': 'adam', 'graph_mode': 'cutoff', 'cutoff': 0.7715055986866843, 'grm_norm': 'cosine_then_gcn', 'self_loops': True, 'use_snp_selection': False}. Best is trial 24 with value: 0.1360864241733849.
[I 2025-11-03 14:37:37,143] Trial 75 finished with value: 0.11387067966963185 and parameters: {'model_type': 'graphsage', 'hidden_dims': '[256, 128, 64]', 'dropout': 0.31445838494820566, 'batch_norm': True, 'lr': 0.00020223462683192564, 'weight_decay': 1.5371044660025608e-06, 'epochs': 225, 'loss': 'mae', 'optimizer': 'adam', 'graph_mode': 'cutoff', 'cutoff': 0.6609061554744229, 'grm_norm': 'none', 'self_loops': True, 'use_snp_selection': False}. Best is trial 24 with value: 0.1360864241733849.
[I 2025-11-03 14:37:38,835] Trial 76 finished with value: 0.09312444243307769 and parameters: {'model_type': 'graphsage', 'hidden_dims': '[128, 64]', 'dropout': 0.4612028708395581, 'batch_norm': False, 'lr': 0.00016220958432330965, 'weight_decay': 1.9057898504831555e-07, 'epochs': 102, 'loss': 'mae', 'optimizer': 'adam', 'graph_mode': 'cutoff', 'cutoff': 0.7955895487163291, 'grm_norm': 'none', 'self_loops': False, 'use_snp_selection': True, 'num_snps': 5307}. Best is trial 24 with value: 0.1360864241733849.
[I 2025-11-03 14:37:43,610] Trial 77 finished with value: 0.11262303730288498 and parameters: {'model_type': 'graphsage', 'hidden_dims': '[512, 128]', 'dropout': 0.3345423405420293, 'batch_norm': True, 'lr': 0.0006062619225335604, 'weight_decay': 7.019030225409503e-07, 'epochs': 197, 'loss': 'mae', 'optimizer': 'adam', 'graph_mode': 'knn', 'source': 'grm', 'knn_k': 6, 'weighted_edges': False, 'symmetrize_mode': 'mutual', 'use_snp_selection': False}. Best is trial 24 with value: 0.1360864241733849.
[I 2025-11-03 14:37:48,572] Trial 78 finished with value: 0.10431891599856469 and parameters: {'model_type': 'graphsage', 'hidden_dims': '[512, 64]', 'dropout': 0.3746245070794992, 'batch_norm': True, 'lr': 0.00024282897061062274, 'weight_decay': 9.783192162794985e-07, 'epochs': 236, 'loss': 'mae', 'optimizer': 'adam', 'graph_mode': 'knn', 'source': 'grm', 'knn_k': 2, 'weighted_edges': True, 'symmetrize_mode': 'mutual', 'use_snp_selection': False}. Best is trial 24 with value: 0.1360864241733849.
[I 2025-11-03 14:37:51,307] Trial 79 finished with value: 0.11050145261712917 and parameters: {'model_type': 'graphsage', 'hidden_dims': '[512, 256]', 'dropout': 0.2828039548444802, 'batch_norm': True, 'lr': 0.0003429575452666956, 'weight_decay': 3.6980208057714166e-05, 'epochs': 46, 'loss': 'mae', 'optimizer': 'adam', 'graph_mode': 'knn', 'source': 'grm', 'knn_k': 4, 'weighted_edges': False, 'symmetrize_mode': 'mutual', 'use_snp_selection': False}. Best is trial 24 with value: 0.1360864241733849.
[I 2025-11-03 14:37:55,458] Trial 80 finished with value: 0.07491146730938049 and parameters: {'model_type': 'graphsage', 'hidden_dims': '[256, 128, 64]', 'dropout': 0.4050098192915155, 'batch_norm': True, 'lr': 3.2530632889195026e-05, 'weight_decay': 5.344452649197115e-07, 'epochs': 336, 'loss': 'mae', 'optimizer': 'adam', 'graph_mode': 'cutoff', 'cutoff': 0.42590600315867083, 'grm_norm': 'cosine_then_gcn', 'self_loops': True, 'use_snp_selection': False}. Best is trial 24 with value: 0.1360864241733849.
[I 2025-11-03 14:38:01,197] Trial 81 finished with value: 0.12926713441552556 and parameters: {'model_type': 'graphsage', 'hidden_dims': '[512, 256]', 'dropout': 0.3902606416914158, 'batch_norm': True, 'lr': 0.0004038967805532933, 'weight_decay': 6.439377536777079e-06, 'epochs': 243, 'loss': 'mse', 'optimizer': 'adam', 'graph_mode': 'knn', 'source': 'grm', 'knn_k': 5, 'weighted_edges': True, 'symmetrize_mode': 'union', 'use_snp_selection': False}. Best is trial 24 with value: 0.1360864241733849.
[I 2025-11-03 14:38:06,532] Trial 82 finished with value: 0.11242398015061252 and parameters: {'model_type': 'graphsage', 'hidden_dims': '[512, 256]', 'dropout': 0.3903804406656462, 'batch_norm': True, 'lr': 0.000528463897152867, 'weight_decay': 5.633632112295911e-06, 'epochs': 247, 'loss': 'mse', 'optimizer': 'adam', 'graph_mode': 'knn', 'source': 'grm', 'knn_k': 5, 'weighted_edges': True, 'symmetrize_mode': 'mutual', 'use_snp_selection': False}. Best is trial 24 with value: 0.1360864241733849.
[I 2025-11-03 14:38:12,238] Trial 83 finished with value: 0.12493836000400282 and parameters: {'model_type': 'graphsage', 'hidden_dims': '[512, 256]', 'dropout': 0.41582653529994584, 'batch_norm': True, 'lr': 0.0008199212403601761, 'weight_decay': 9.55171122512749e-06, 'epochs': 270, 'loss': 'mse', 'optimizer': 'adam', 'graph_mode': 'knn', 'source': 'grm', 'knn_k': 5, 'weighted_edges': True, 'symmetrize_mode': 'mutual', 'use_snp_selection': False}. Best is trial 24 with value: 0.1360864241733849.
[I 2025-11-03 14:38:17,924] Trial 84 finished with value: 0.12603616094648887 and parameters: {'model_type': 'graphsage', 'hidden_dims': '[512, 256]', 'dropout': 0.4135933731358326, 'batch_norm': True, 'lr': 0.0008867305579540129, 'weight_decay': 2.012429650316708e-05, 'epochs': 270, 'loss': 'mse', 'optimizer': 'adam', 'graph_mode': 'knn', 'source': 'grm', 'knn_k': 5, 'weighted_edges': True, 'symmetrize_mode': 'mutual', 'use_snp_selection': False}. Best is trial 24 with value: 0.1360864241733849.
[I 2025-11-03 14:38:23,646] Trial 85 finished with value: 0.10724277659963771 and parameters: {'model_type': 'graphsage', 'hidden_dims': '[512, 256]', 'dropout': 0.4861950892983046, 'batch_norm': True, 'lr': 0.0008460037680403502, 'weight_decay': 1.041463021711826e-05, 'epochs': 271, 'loss': 'mse', 'optimizer': 'adam', 'graph_mode': 'knn', 'source': 'grm', 'knn_k': 5, 'weighted_edges': True, 'symmetrize_mode': 'mutual', 'use_snp_selection': False}. Best is trial 24 with value: 0.1360864241733849.
[I 2025-11-03 14:38:29,268] Trial 86 finished with value: 0.12382910421332044 and parameters: {'model_type': 'graphsage', 'hidden_dims': '[512, 256]', 'dropout': 0.4435457710790278, 'batch_norm': True, 'lr': 0.0006752804974086449, 'weight_decay': 2.0515184025636705e-05, 'epochs': 258, 'loss': 'mse', 'optimizer': 'adam', 'graph_mode': 'knn', 'source': 'grm', 'knn_k': 6, 'weighted_edges': True, 'symmetrize_mode': 'mutual', 'use_snp_selection': False}. Best is trial 24 with value: 0.1360864241733849.
[I 2025-11-03 14:38:35,728] Trial 87 finished with value: 0.12362946055398008 and parameters: {'model_type': 'graphsage', 'hidden_dims': '[512, 256]', 'dropout': 0.44287692840682735, 'batch_norm': True, 'lr': 0.0006951343709692977, 'weight_decay': 2.2960405352600695e-05, 'epochs': 313, 'loss': 'mse', 'optimizer': 'adam', 'graph_mode': 'knn', 'source': 'grm', 'knn_k': 7, 'weighted_edges': True, 'symmetrize_mode': 'mutual', 'use_snp_selection': False}. Best is trial 24 with value: 0.1360864241733849.
[I 2025-11-03 14:38:42,169] Trial 88 finished with value: 0.10907123312052405 and parameters: {'model_type': 'graphsage', 'hidden_dims': '[512, 256]', 'dropout': 0.4676318782439026, 'batch_norm': True, 'lr': 0.0006407457146228961, 'weight_decay': 2.0598257576567732e-05, 'epochs': 317, 'loss': 'mse', 'optimizer': 'adam', 'graph_mode': 'knn', 'source': 'grm', 'knn_k': 7, 'weighted_edges': True, 'symmetrize_mode': 'mutual', 'use_snp_selection': False}. Best is trial 24 with value: 0.1360864241733849.
[I 2025-11-03 14:38:46,263] Trial 89 finished with value: 0.09548087655199383 and parameters: {'model_type': 'graphsage', 'hidden_dims': '[512, 256]', 'dropout': 0.4375515778005367, 'batch_norm': False, 'lr': 0.00044920140785813565, 'weight_decay': 1.2489960277066977e-05, 'epochs': 339, 'loss': 'mse', 'optimizer': 'adam', 'graph_mode': 'knn', 'source': 'grm', 'knn_k': 6, 'weighted_edges': True, 'symmetrize_mode': 'mutual', 'use_snp_selection': True, 'num_snps': 23862}. Best is trial 24 with value: 0.1360864241733849.
[I 2025-11-03 14:38:52,507] Trial 90 finished with value: 0.11789290409472214 and parameters: {'model_type': 'graphsage', 'hidden_dims': '[512, 256]', 'dropout': 0.413620043338091, 'batch_norm': True, 'lr': 0.0007006743528543683, 'weight_decay': 0.00011305971722956918, 'epochs': 299, 'loss': 'mse', 'optimizer': 'adam', 'graph_mode': 'knn', 'source': 'grm', 'knn_k': 7, 'weighted_edges': True, 'symmetrize_mode': 'mutual', 'use_snp_selection': False}. Best is trial 24 with value: 0.1360864241733849.
[I 2025-11-03 14:38:58,042] Trial 91 finished with value: 0.11418734668920164 and parameters: {'model_type': 'graphsage', 'hidden_dims': '[512, 256]', 'dropout': 0.446808871170364, 'batch_norm': True, 'lr': 0.0008304988318480682, 'weight_decay': 8.73188800305434e-06, 'epochs': 258, 'loss': 'mse', 'optimizer': 'adam', 'graph_mode': 'knn', 'source': 'grm', 'knn_k': 5, 'weighted_edges': True, 'symmetrize_mode': 'mutual', 'use_snp_selection': False}. Best is trial 24 with value: 0.1360864241733849.
[I 2025-11-03 14:39:03,877] Trial 92 finished with value: 0.11238180866394039 and parameters: {'model_type': 'graphsage', 'hidden_dims': '[512, 256]', 'dropout': 0.4238678809498068, 'batch_norm': True, 'lr': 0.0005763306088115295, 'weight_decay': 2.142738729228972e-05, 'epochs': 284, 'loss': 'mse', 'optimizer': 'adam', 'graph_mode': 'knn', 'source': 'grm', 'knn_k': 4, 'weighted_edges': True, 'symmetrize_mode': 'mutual', 'use_snp_selection': False}. Best is trial 24 with value: 0.1360864241733849.
[I 2025-11-03 14:39:09,601] Trial 93 finished with value: 0.11242693956210606 and parameters: {'model_type': 'graphsage', 'hidden_dims': '[512, 256]', 'dropout': 0.39700928261063595, 'batch_norm': True, 'lr': 0.00039610280008731217, 'weight_decay': 3.1421482773937895e-05, 'epochs': 264, 'loss': 'mse', 'optimizer': 'adam', 'graph_mode': 'knn', 'source': 'grm', 'knn_k': 6, 'weighted_edges': True, 'symmetrize_mode': 'mutual', 'use_snp_selection': False}. Best is trial 24 with value: 0.1360864241733849.
[I 2025-11-03 14:39:15,876] Trial 94 finished with value: 0.12132849281729853 and parameters: {'model_type': 'graphsage', 'hidden_dims': '[512, 256]', 'dropout': 0.43021875646474705, 'batch_norm': True, 'lr': 0.0004891510686199424, 'weight_decay': 4.821033080235547e-05, 'epochs': 313, 'loss': 'mse', 'optimizer': 'adam', 'graph_mode': 'knn', 'source': 'grm', 'knn_k': 5, 'weighted_edges': True, 'symmetrize_mode': 'mutual', 'use_snp_selection': False}. Best is trial 24 with value: 0.1360864241733849.
[I 2025-11-03 14:39:21,754] Trial 95 finished with value: 0.12457779453860018 and parameters: {'model_type': 'graphsage', 'hidden_dims': '[512, 256]', 'dropout': 0.5145982576294469, 'batch_norm': True, 'lr': 0.0007028050477110912, 'weight_decay': 1.41947674159105e-05, 'epochs': 278, 'loss': 'mse', 'optimizer': 'adam', 'graph_mode': 'knn', 'source': 'grm', 'knn_k': 6, 'weighted_edges': True, 'symmetrize_mode': 'mutual', 'use_snp_selection': False}. Best is trial 24 with value: 0.1360864241733849.
[I 2025-11-03 14:39:27,876] Trial 96 finished with value: 0.11809091979923375 and parameters: {'model_type': 'graphsage', 'hidden_dims': '[512, 256]', 'dropout': 0.5035395074553157, 'batch_norm': True, 'lr': 0.0006472430217668708, 'weight_decay': 1.666251288413743e-05, 'epochs': 295, 'loss': 'mse', 'optimizer': 'adam', 'graph_mode': 'knn', 'source': 'grm', 'knn_k': 6, 'weighted_edges': True, 'symmetrize_mode': 'mutual', 'use_snp_selection': False}. Best is trial 24 with value: 0.1360864241733849.
