[I 2025-11-03 12:32:18,982] Trial 2 finished with value: -0.020038460212747133 and parameters: {'model_type': 'gcn', 'hidden_dims': '[256, 128, 64]', 'dropout': 0.41314357415569625, 'batch_norm': False, 'lr': 3.952233718592101e-06, 'weight_decay': 0.00026754769258252603, 'epochs': 149, 'loss': 'mse', 'optimizer': 'adam', 'graph_mode': 'off', 'use_snp_selection': True, 'num_snps': 11571}. Best is trial 0 with value: 0.0209650431234701.
[I 2025-11-03 12:32:21,632] Trial 3 finished with value: 0.04464986188906611 and parameters: {'model_type': 'gcn', 'hidden_dims': '[512, 64]', 'dropout': 0.5938127374509361, 'batch_norm': False, 'lr': 5.67704586114731e-06, 'weight_decay': 2.4518087630137052e-05, 'epochs': 320, 'loss': 'mae', 'optimizer': 'adam', 'graph_mode': 'off', 'use_snp_selection': False}. Best is trial 3 with value: 0.04464986188906611.
[I 2025-11-03 12:32:24,012] Trial 4 finished with value: 0.0193731775035172 and parameters: {'model_type': 'gcn', 'hidden_dims': '[512, 128]', 'dropout': 0.25746343592134413, 'batch_norm': True, 'lr': 1.3467657668402788e-06, 'weight_decay': 0.00033087251918647806, 'epochs': 277, 'loss': 'mse', 'optimizer': 'adam', 'graph_mode': 'off', 'use_snp_selection': True, 'num_snps': 36675}. Best is trial 3 with value: 0.04464986188906611.
[I 2025-11-03 12:32:25,739] Trial 5 finished with value: 0.03029620465500069 and parameters: {'model_type': 'gcn', 'hidden_dims': '[512, 64]', 'dropout': 0.38275350994408375, 'batch_norm': True, 'lr': 1.5586664309232824e-06, 'weight_decay': 0.0008227664668621182, 'epochs': 145, 'loss': 'mae', 'optimizer': 'adam', 'graph_mode': 'off', 'use_snp_selection': True, 'num_snps': 32148}. Best is trial 3 with value: 0.04464986188906611.
[I 2025-11-03 12:32:27,065] Trial 6 finished with value: 0.04292929418191401 and parameters: {'model_type': 'gcn', 'hidden_dims': '[256, 128]', 'dropout': 0.3930109900265879, 'batch_norm': False, 'lr': 4.892964372128395e-05, 'weight_decay': 1.5809549317992182e-06, 'epochs': 199, 'loss': 'mse', 'optimizer': 'adam', 'graph_mode': 'off', 'use_snp_selection': False}. Best is trial 3 with value: 0.04464986188906611.
[I 2025-11-03 12:32:28,439] Trial 7 finished with value: 0.027759544827677063 and parameters: {'model_type': 'gcn', 'hidden_dims': '[512, 256]', 'dropout': 0.15343979219678458, 'batch_norm': True, 'lr': 6.234003099047341e-05, 'weight_decay': 3.894760610535477e-07, 'epochs': 97, 'loss': 'mse', 'optimizer': 'adam', 'graph_mode': 'off', 'use_snp_selection': False}. Best is trial 3 with value: 0.04464986188906611.
[I 2025-11-03 12:32:31,051] Trial 8 finished with value: 0.015496146353402677 and parameters: {'model_type': 'gcn', 'hidden_dims': '[512, 128]', 'dropout': 0.10743001231661406, 'batch_norm': True, 'lr': 0.00023728538449271062, 'weight_decay': 1.7629071578048637e-05, 'epochs': 312, 'loss': 'mae', 'optimizer': 'adam', 'graph_mode': 'off', 'use_snp_selection': False}. Best is trial 3 with value: 0.04464986188906611.
[I 2025-11-03 12:32:32,862] Trial 9 finished with value: 0.030512765139913627 and parameters: {'model_type': 'gcn', 'hidden_dims': '[512, 64]', 'dropout': 0.14505336736221927, 'batch_norm': True, 'lr': 5.8619638388111826e-05, 'weight_decay': 6.200156172669308e-07, 'epochs': 175, 'loss': 'mse', 'optimizer': 'adam', 'graph_mode': 'off', 'use_snp_selection': False}. Best is trial 3 with value: 0.04464986188906611.
[I 2025-11-03 12:32:33,964] Trial 10 finished with value: -0.009305739239540574 and parameters: {'model_type': 'gcn', 'hidden_dims': '[512, 64]', 'dropout': 0.5885461262002587, 'batch_norm': False, 'lr': 8.769366258768696e-06, 'weight_decay': 2.78273193871783e-06, 'epochs': 55, 'loss': 'mae', 'optimizer': 'adam', 'graph_mode': 'off', 'use_snp_selection': False}. Best is trial 3 with value: 0.04464986188906611.
[I 2025-11-03 12:32:35,423] Trial 11 finished with value: -0.007335197466987385 and parameters: {'model_type': 'gcn', 'hidden_dims': '[256, 128]', 'dropout': 0.583942291816117, 'batch_norm': False, 'lr': 1.422933652790185e-05, 'weight_decay': 2.8055190190955713e-06, 'epochs': 231, 'loss': 'mse', 'optimizer': 'adam', 'graph_mode': 'off', 'use_snp_selection': False}. Best is trial 3 with value: 0.04464986188906611.
[I 2025-11-03 12:32:36,931] Trial 12 finished with value: 0.006948673588331848 and parameters: {'model_type': 'gcn', 'hidden_dims': '[256, 128]', 'dropout': 0.4779690972965961, 'batch_norm': False, 'lr': 0.0006753264773209732, 'weight_decay': 1.3081036432574914e-07, 'epochs': 240, 'loss': 'mae', 'optimizer': 'adam', 'graph_mode': 'off', 'use_snp_selection': False}. Best is trial 3 with value: 0.04464986188906611.
[I 2025-11-03 12:32:38,216] Trial 13 finished with value: 0.01980553941055802 and parameters: {'model_type': 'gcn', 'hidden_dims': '[128, 64]', 'dropout': 0.3041365173646664, 'batch_norm': False, 'lr': 2.0021225389711998e-05, 'weight_decay': 4.373608364627903e-05, 'epochs': 293, 'loss': 'mse', 'optimizer': 'adam', 'graph_mode': 'off', 'use_snp_selection': False}. Best is trial 3 with value: 0.04464986188906611.
[I 2025-11-03 12:32:40,986] Trial 14 finished with value: -0.008284627367042545 and parameters: {'model_type': 'gcn', 'hidden_dims': '[512, 256]', 'dropout': 0.5143108008659758, 'batch_norm': False, 'lr': 5.932455544499841e-06, 'weight_decay': 2.362559310733596e-06, 'epochs': 344, 'loss': 'mse', 'optimizer': 'adam', 'graph_mode': 'off', 'use_snp_selection': False}. Best is trial 3 with value: 0.04464986188906611.
[I 2025-11-03 12:32:42,472] Trial 15 finished with value: 0.03545475157774146 and parameters: {'model_type': 'gcn', 'hidden_dims': '[256, 128, 64]', 'dropout': 0.32864867985638985, 'batch_norm': False, 'lr': 0.00018429018027102802, 'weight_decay': 5.343087596659364e-05, 'epochs': 190, 'loss': 'mae', 'optimizer': 'adam', 'graph_mode': 'off', 'use_snp_selection': False}. Best is trial 3 with value: 0.04464986188906611.
[I 2025-11-03 12:32:43,421] Trial 16 finished with value: 0.04435544480539054 and parameters: {'model_type': 'gcn', 'hidden_dims': '[256, 128]', 'dropout': 0.5053372842363391, 'batch_norm': False, 'lr': 3.2434545947455485e-05, 'weight_decay': 1.2294468020462874e-06, 'epochs': 98, 'loss': 'mse', 'optimizer': 'adam', 'graph_mode': 'off', 'use_snp_selection': False}. Best is trial 3 with value: 0.04464986188906611.
[I 2025-11-03 12:32:44,439] Trial 17 finished with value: 0.013429044506232182 and parameters: {'model_type': 'gcn', 'hidden_dims': '[512, 64]', 'dropout': 0.543474321376226, 'batch_norm': False, 'lr': 3.378196935792496e-06, 'weight_decay': 6.503919561253859e-06, 'epochs': 43, 'loss': 'mae', 'optimizer': 'adam', 'graph_mode': 'off', 'use_snp_selection': False}. Best is trial 3 with value: 0.04464986188906611.
[I 2025-11-03 12:32:46,416] Trial 18 finished with value: 0.05289640959883176 and parameters: {'model_type': 'gcn', 'hidden_dims': '[256, 128]', 'dropout': 0.49511833116234694, 'batch_norm': False, 'lr': 2.797772152750264e-05, 'weight_decay': 4.585917110798861e-07, 'epochs': 103, 'loss': 'mse', 'optimizer': 'adam', 'graph_mode': 'off', 'use_snp_selection': True, 'num_snps': 58241}. Best is trial 18 with value: 0.05289640959883176.
[I 2025-11-03 12:32:48,691] Trial 19 finished with value: -0.002749304607460772 and parameters: {'model_type': 'gcn', 'hidden_dims': '[512, 64]', 'dropout': 0.4738009488117749, 'batch_norm': False, 'lr': 1.352570837276448e-05, 'weight_decay': 1.1354159408743119e-07, 'epochs': 112, 'loss': 'mae', 'optimizer': 'adam', 'graph_mode': 'off', 'use_snp_selection': True, 'num_snps': 55667}. Best is trial 18 with value: 0.05289640959883176.
[I 2025-11-03 12:32:50,857] Trial 20 finished with value: 0.05011879168597734 and parameters: {'model_type': 'gcn', 'hidden_dims': '[512, 256]', 'dropout': 0.5520934896181884, 'batch_norm': False, 'lr': 6.44710683422689e-06, 'weight_decay': 2.2016567235561013e-05, 'epochs': 73, 'loss': 'mae', 'optimizer': 'adam', 'graph_mode': 'off', 'use_snp_selection': True, 'num_snps': 57703}. Best is trial 18 with value: 0.05289640959883176.
[I 2025-11-03 12:32:53,076] Trial 21 finished with value: 0.045719017883043535 and parameters: {'model_type': 'gcn', 'hidden_dims': '[512, 256]', 'dropout': 0.5504332651975594, 'batch_norm': False, 'lr': 8.117853260426941e-06, 'weight_decay': 1.629166573201001e-05, 'epochs': 79, 'loss': 'mae', 'optimizer': 'adam', 'graph_mode': 'off', 'use_snp_selection': True, 'num_snps': 59811}. Best is trial 18 with value: 0.05289640959883176.
[I 2025-11-03 12:32:55,257] Trial 22 finished with value: 0.014788631216609307 and parameters: {'model_type': 'gcn', 'hidden_dims': '[512, 256]', 'dropout': 0.539263615599099, 'batch_norm': False, 'lr': 2.5760186074045187e-05, 'weight_decay': 0.00013770627270333954, 'epochs': 74, 'loss': 'mae', 'optimizer': 'adam', 'graph_mode': 'off', 'use_snp_selection': True, 'num_snps': 59634}. Best is trial 18 with value: 0.05289640959883176.
[I 2025-11-03 12:32:57,197] Trial 23 finished with value: 0.004656295778764117 and parameters: {'model_type': 'gcn', 'hidden_dims': '[512, 256]', 'dropout': 0.4505754159052279, 'batch_norm': False, 'lr': 1.2414065760207298e-05, 'weight_decay': 4.628382603957811e-06, 'epochs': 74, 'loss': 'mae', 'optimizer': 'adam', 'graph_mode': 'off', 'use_snp_selection': True, 'num_snps': 52839}. Best is trial 18 with value: 0.05289640959883176.
[I 2025-11-03 12:32:59,684] Trial 24 finished with value: 0.01453178111024654 and parameters: {'model_type': 'gcn', 'hidden_dims': '[512, 256]', 'dropout': 0.5485362947523613, 'batch_norm': False, 'lr': 3.287529063359235e-06, 'weight_decay': 9.971828672476965e-06, 'epochs': 132, 'loss': 'mae', 'optimizer': 'adam', 'graph_mode': 'off', 'use_snp_selection': True, 'num_snps': 59343}. Best is trial 18 with value: 0.05289640959883176.
[I 2025-11-03 12:33:01,436] Trial 25 finished with value: 0.009368223213721417 and parameters: {'model_type': 'gcn', 'hidden_dims': '[512, 256]', 'dropout': 0.4899201145877813, 'batch_norm': False, 'lr': 0.00011712513068745696, 'weight_decay': 0.00012046480565973241, 'epochs': 67, 'loss': 'mae', 'optimizer': 'adam', 'graph_mode': 'off', 'use_snp_selection': True, 'num_snps': 44688}. Best is trial 18 with value: 0.05289640959883176.
[I 2025-11-03 12:33:02,505] Trial 26 finished with value: 0.07396831806114475 and parameters: {'model_type': 'gcn', 'hidden_dims': '[512, 256]', 'dropout': 0.5590010103188929, 'batch_norm': False, 'lr': 7.935876884247295e-06, 'weight_decay': 3.732133112200012e-07, 'epochs': 117, 'loss': 'mse', 'optimizer': 'adam', 'graph_mode': 'off', 'use_snp_selection': True, 'num_snps': 15352}. Best is trial 26 with value: 0.07396831806114475.
[I 2025-11-03 12:33:03,671] Trial 27 finished with value: 0.06853914038752906 and parameters: {'model_type': 'gcn', 'hidden_dims': '[512, 256]', 'dropout': 0.44902977111651277, 'batch_norm': False, 'lr': 3.3225291294020515e-05, 'weight_decay': 3.80109909105439e-07, 'epochs': 113, 'loss': 'mse', 'optimizer': 'adam', 'graph_mode': 'off', 'use_snp_selection': True, 'num_snps': 17779}. Best is trial 26 with value: 0.07396831806114475.
[I 2025-11-03 12:33:04,784] Trial 28 finished with value: -0.051605696075979465 and parameters: {'model_type': 'gcn', 'hidden_dims': '[512, 128]', 'dropout': 0.44075041057635694, 'batch_norm': False, 'lr': 2.910036568097721e-05, 'weight_decay': 2.72796427173412e-07, 'epochs': 112, 'loss': 'mse', 'optimizer': 'adam', 'graph_mode': 'off', 'use_snp_selection': True, 'num_snps': 16830}. Best is trial 26 with value: 0.07396831806114475.
[I 2025-11-03 12:33:05,976] Trial 29 finished with value: 0.05101828938871796 and parameters: {'model_type': 'gcn', 'hidden_dims': '[128, 64]', 'dropout': 0.25231358023503264, 'batch_norm': False, 'lr': 4.126612295196157e-05, 'weight_decay': 8.051216966992359e-07, 'epochs': 165, 'loss': 'mse', 'optimizer': 'adam', 'graph_mode': 'off', 'use_snp_selection': True, 'num_snps': 20610}. Best is trial 26 with value: 0.07396831806114475.
[I 2025-11-03 12:33:06,752] Trial 30 finished with value: 0.047377783166846626 and parameters: {'model_type': 'gcn', 'hidden_dims': '[128, 64]', 'dropout': 0.3802642448727081, 'batch_norm': False, 'lr': 0.00010717836802809381, 'weight_decay': 2.3617609557312434e-07, 'epochs': 115, 'loss': 'mse', 'optimizer': 'adam', 'graph_mode': 'off', 'use_snp_selection': True, 'num_snps': 5144}. Best is trial 26 with value: 0.07396831806114475.
[I 2025-11-03 12:33:07,963] Trial 31 finished with value: 0.02499708924687528 and parameters: {'model_type': 'gcn', 'hidden_dims': '[128, 64]', 'dropout': 0.23700204350320905, 'batch_norm': False, 'lr': 3.947083915153896e-05, 'weight_decay': 7.177915163890492e-07, 'epochs': 164, 'loss': 'mse', 'optimizer': 'adam', 'graph_mode': 'off', 'use_snp_selection': True, 'num_snps': 20985}. Best is trial 26 with value: 0.07396831806114475.
[I 2025-11-03 12:33:09,140] Trial 32 finished with value: 0.046641387917478135 and parameters: {'model_type': 'gcn', 'hidden_dims': '[128, 64]', 'dropout': 0.29661343185018085, 'batch_norm': False, 'lr': 1.824730248039597e-05, 'weight_decay': 5.936406977260028e-07, 'epochs': 130, 'loss': 'mse', 'optimizer': 'adam', 'graph_mode': 'off', 'use_snp_selection': True, 'num_snps': 23314}. Best is trial 26 with value: 0.07396831806114475.
[I 2025-11-03 12:33:10,490] Trial 33 finished with value: 0.049860823858757515 and parameters: {'model_type': 'gcn', 'hidden_dims': '[128, 64]', 'dropout': 0.2180636661314326, 'batch_norm': False, 'lr': 8.291731199641519e-05, 'weight_decay': 2.6754016719648464e-07, 'epochs': 208, 'loss': 'mse', 'optimizer': 'adam', 'graph_mode': 'off', 'use_snp_selection': True, 'num_snps': 24605}. Best is trial 26 with value: 0.07396831806114475.
[I 2025-11-03 12:33:11,653] Trial 34 finished with value: 0.012606741867789074 and parameters: {'model_type': 'gcn', 'hidden_dims': '[256, 128, 64]', 'dropout': 0.42401554279832565, 'batch_norm': False, 'lr': 0.00018880051767898584, 'weight_decay': 1.099932027685871e-06, 'epochs': 155, 'loss': 'mse', 'optimizer': 'adam', 'graph_mode': 'off', 'use_snp_selection': True, 'num_snps': 13042}. Best is trial 26 with value: 0.07396831806114475.
[I 2025-11-03 12:33:12,542] Trial 35 finished with value: 0.014415005474711605 and parameters: {'model_type': 'gcn', 'hidden_dims': '[256, 128]', 'dropout': 0.2763654167184324, 'batch_norm': True, 'lr': 4.0759581297162966e-05, 'weight_decay': 1.6663087601663796e-07, 'epochs': 132, 'loss': 'mse', 'optimizer': 'adam', 'graph_mode': 'off', 'use_snp_selection': True, 'num_snps': 6479}. Best is trial 26 with value: 0.07396831806114475.
[I 2025-11-03 12:33:13,917] Trial 36 finished with value: -0.013352244869237702 and parameters: {'model_type': 'gcn', 'hidden_dims': '[128, 64]', 'dropout': 0.3391432488336251, 'batch_norm': False, 'lr': 2.2731984015408595e-06, 'weight_decay': 5.00755930838149e-07, 'epochs': 176, 'loss': 'mse', 'optimizer': 'adam', 'graph_mode': 'off', 'use_snp_selection': True, 'num_snps': 28973}. Best is trial 26 with value: 0.07396831806114475.
[I 2025-11-03 12:33:14,910] Trial 37 finished with value: 0.0227336045181898 and parameters: {'model_type': 'gcn', 'hidden_dims': '[256, 128]', 'dropout': 0.4621462360556933, 'batch_norm': False, 'lr': 2.0574130223891478e-05, 'weight_decay': 9.732426596648958e-07, 'epochs': 97, 'loss': 'mse', 'optimizer': 'adam', 'graph_mode': 'off', 'use_snp_selection': True, 'num_snps': 17628}. Best is trial 26 with value: 0.07396831806114475.
[I 2025-11-03 12:33:15,902] Trial 38 finished with value: 0.03201752842113908 and parameters: {'model_type': 'gcn', 'hidden_dims': '[512, 256]', 'dropout': 0.5159023359808054, 'batch_norm': True, 'lr': 0.0004454529519245758, 'weight_decay': 3.7606643819622254e-07, 'epochs': 144, 'loss': 'mse', 'optimizer': 'adam', 'graph_mode': 'off', 'use_snp_selection': True, 'num_snps': 8951}. Best is trial 26 with value: 0.07396831806114475.
[I 2025-11-03 12:33:17,321] Trial 39 finished with value: -0.0011323454869601056 and parameters: {'model_type': 'gcn', 'hidden_dims': '[256, 128, 64]', 'dropout': 0.41093125020629806, 'batch_norm': False, 'lr': 9.439419371056864e-06, 'weight_decay': 1.930596685032261e-06, 'epochs': 218, 'loss': 'mse', 'optimizer': 'adam', 'graph_mode': 'off', 'use_snp_selection': True, 'num_snps': 16636}. Best is trial 26 with value: 0.07396831806114475.
[I 2025-11-03 12:33:18,696] Trial 40 finished with value: 0.01665327848259819 and parameters: {'model_type': 'gcn', 'hidden_dims': '[512, 128]', 'dropout': 0.3720089836401416, 'batch_norm': True, 'lr': 9.280602731999539e-05, 'weight_decay': 1.9770215512862543e-07, 'epochs': 89, 'loss': 'mse', 'optimizer': 'adam', 'graph_mode': 'off', 'use_snp_selection': True, 'num_snps': 26892}. Best is trial 26 with value: 0.07396831806114475.
[I 2025-11-03 12:33:20,483] Trial 41 finished with value: 0.00872988020470738 and parameters: {'model_type': 'gcn', 'hidden_dims': '[512, 256]', 'dropout': 0.5693344980018706, 'batch_norm': False, 'lr': 4.052275766101242e-06, 'weight_decay': 3.3315847576016074e-05, 'epochs': 40, 'loss': 'mse', 'optimizer': 'adam', 'graph_mode': 'off', 'use_snp_selection': True, 'num_snps': 50795}. Best is trial 26 with value: 0.07396831806114475.
[I 2025-11-03 12:33:22,309] Trial 42 finished with value: 0.029197498176621477 and parameters: {'model_type': 'gcn', 'hidden_dims': '[512, 256]', 'dropout': 0.5190037720748979, 'batch_norm': False, 'lr': 6.347921406244812e-06, 'weight_decay': 4.032632426266007e-07, 'epochs': 59, 'loss': 'mse', 'optimizer': 'adam', 'graph_mode': 'off', 'use_snp_selection': True, 'num_snps': 47661}. Best is trial 26 with value: 0.07396831806114475.
[I 2025-11-03 12:33:23,610] Trial 43 finished with value: 0.024539427004840447 and parameters: {'model_type': 'gcn', 'hidden_dims': '[512, 256]', 'dropout': 0.17380133916029936, 'batch_norm': False, 'lr': 2.280196447253346e-06, 'weight_decay': 9.554817510631228e-05, 'epochs': 119, 'loss': 'mse', 'optimizer': 'adam', 'graph_mode': 'off', 'use_snp_selection': True, 'num_snps': 20899}. Best is trial 26 with value: 0.07396831806114475.
[I 2025-11-03 12:33:24,279] Trial 44 finished with value: 0.017098257691958066 and parameters: {'model_type': 'gcn', 'hidden_dims': '[512, 256]', 'dropout': 0.5654343481757661, 'batch_norm': False, 'lr': 6.11619850303047e-05, 'weight_decay': 5.6401704433409395e-06, 'epochs': 89, 'loss': 'mse', 'optimizer': 'adam', 'graph_mode': 'off', 'use_snp_selection': True, 'num_snps': 2030}. Best is trial 26 with value: 0.07396831806114475.
[I 2025-11-03 12:33:26,206] Trial 45 finished with value: -0.019725366810156315 and parameters: {'model_type': 'gcn', 'hidden_dims': '[256, 128]', 'dropout': 0.5995468288090083, 'batch_norm': False, 'lr': 4.7096962047133425e-06, 'weight_decay': 8.282855210171741e-07, 'epochs': 266, 'loss': 'mse', 'optimizer': 'adam', 'graph_mode': 'off', 'use_snp_selection': True, 'num_snps': 37818}. Best is trial 26 with value: 0.07396831806114475.
[I 2025-11-03 12:33:27,348] Trial 46 finished with value: 0.04842162690877162 and parameters: {'model_type': 'gcn', 'hidden_dims': '[512, 256]', 'dropout': 0.4986753334736066, 'batch_norm': True, 'lr': 1.0242541744052126e-05, 'weight_decay': 0.0005542794834756084, 'epochs': 145, 'loss': 'mse', 'optimizer': 'adam', 'graph_mode': 'off', 'use_snp_selection': True, 'num_snps': 13958}. Best is trial 26 with value: 0.07396831806114475.
[I 2025-11-03 12:33:28,425] Trial 47 finished with value: 0.019838448398612745 and parameters: {'model_type': 'gcn', 'hidden_dims': '[128, 64]', 'dropout': 0.5294237897078732, 'batch_norm': False, 'lr': 1.2607190061427945e-06, 'weight_decay': 3.926915404767566e-06, 'epochs': 104, 'loss': 'mse', 'optimizer': 'adam', 'graph_mode': 'off', 'use_snp_selection': True, 'num_snps': 20078}. Best is trial 26 with value: 0.07396831806114475.
[I 2025-11-03 12:33:30,081] Trial 48 finished with value: 0.03233728558086653 and parameters: {'model_type': 'gcn', 'hidden_dims': '[256, 128]', 'dropout': 0.5663709912364568, 'batch_norm': False, 'lr': 4.683302164418881e-05, 'weight_decay': 1.7622169863964646e-06, 'epochs': 177, 'loss': 'mse', 'optimizer': 'adam', 'graph_mode': 'off', 'use_snp_selection': True, 'num_snps': 36282}. Best is trial 26 with value: 0.07396831806114475.
[I 2025-11-03 12:33:32,398] Trial 49 finished with value: -0.011174422985215222 and parameters: {'model_type': 'gcn', 'hidden_dims': '[512, 128]', 'dropout': 0.4845922380049539, 'batch_norm': False, 'lr': 2.2752487073162458e-05, 'weight_decay': 8.874634444584939e-06, 'epochs': 130, 'loss': 'mae', 'optimizer': 'adam', 'graph_mode': 'off', 'use_snp_selection': True, 'num_snps': 53869}. Best is trial 26 with value: 0.07396831806114475.
[I 2025-11-03 12:33:33,462] Trial 50 finished with value: 0.015442772251798909 and parameters: {'model_type': 'gcn', 'hidden_dims': '[512, 256]', 'dropout': 0.1917588286418651, 'batch_norm': False, 'lr': 1.547930254483838e-05, 'weight_decay': 2.2486189271806176e-05, 'epochs': 161, 'loss': 'mse', 'optimizer': 'adam', 'graph_mode': 'off', 'use_snp_selection': True, 'num_snps': 10992}. Best is trial 26 with value: 0.07396831806114475.
[I 2025-11-03 12:33:34,808] Trial 51 finished with value: 0.04858051067727224 and parameters: {'model_type': 'gcn', 'hidden_dims': '[128, 64]', 'dropout': 0.22737387944754375, 'batch_norm': False, 'lr': 7.917891219016743e-05, 'weight_decay': 2.990102589415427e-07, 'epochs': 208, 'loss': 'mse', 'optimizer': 'adam', 'graph_mode': 'off', 'use_snp_selection': True, 'num_snps': 25675}. Best is trial 26 with value: 0.07396831806114475.
[I 2025-11-03 12:33:36,157] Trial 52 finished with value: 0.03893456474821939 and parameters: {'model_type': 'gcn', 'hidden_dims': '[128, 64]', 'dropout': 0.10407893019406392, 'batch_norm': False, 'lr': 0.00013240660148822225, 'weight_decay': 1.539991847046742e-07, 'epochs': 193, 'loss': 'mse', 'optimizer': 'adam', 'graph_mode': 'off', 'use_snp_selection': True, 'num_snps': 25500}. Best is trial 26 with value: 0.07396831806114475.
