[I 2025-11-03 13:01:12,995] Trial 125 finished with value: 0.024397641394444603 and parameters: {'model_type': 'gcn', 'hidden_dims': '[512, 256]', 'dropout': 0.5833613268023567, 'batch_norm': False, 'lr': 1.367259017363909e-05, 'weight_decay': 1.534379707194654e-05, 'epochs': 286, 'loss': 'mae', 'optimizer': 'adam', 'graph_mode': 'off', 'use_snp_selection': True, 'num_snps': 7289}. Best is trial 123 with value: 0.061587640670861275.
[I 2025-11-03 13:01:14,009] Trial 126 finished with value: -0.004997374973305435 and parameters: {'model_type': 'gcn', 'hidden_dims': '[512, 256]', 'dropout': 0.568826750421868, 'batch_norm': False, 'lr': 7.497911290433585e-06, 'weight_decay': 3.238965438425166e-05, 'epochs': 196, 'loss': 'mae', 'optimizer': 'adam', 'graph_mode': 'off', 'use_snp_selection': True, 'num_snps': 7105}. Best is trial 123 with value: 0.061587640670861275.
[I 2025-11-03 13:01:15,162] Trial 127 finished with value: 0.008922637588985812 and parameters: {'model_type': 'gcn', 'hidden_dims': '[512, 256]', 'dropout': 0.5565994798920534, 'batch_norm': False, 'lr': 1.7740089861378168e-05, 'weight_decay': 2.0142761527746988e-05, 'epochs': 264, 'loss': 'mae', 'optimizer': 'adam', 'graph_mode': 'off', 'use_snp_selection': True, 'num_snps': 7347}. Best is trial 123 with value: 0.061587640670861275.
[I 2025-11-03 13:01:16,821] Trial 128 finished with value: 0.02895764039804995 and parameters: {'model_type': 'gcn', 'hidden_dims': '[512, 256]', 'dropout': 0.5705141374195327, 'batch_norm': False, 'lr': 2.0960346068237702e-05, 'weight_decay': 5.744569314574805e-06, 'epochs': 348, 'loss': 'mae', 'optimizer': 'adam', 'graph_mode': 'off', 'use_snp_selection': True, 'num_snps': 15363}. Best is trial 123 with value: 0.061587640670861275.
[I 2025-11-03 13:01:18,314] Trial 129 finished with value: 0.04698505767880354 and parameters: {'model_type': 'gcn', 'hidden_dims': '[512, 256]', 'dropout': 0.589015329244325, 'batch_norm': False, 'lr': 2.5755693270764265e-05, 'weight_decay': 8.202351417471788e-06, 'epochs': 232, 'loss': 'mse', 'optimizer': 'adam', 'graph_mode': 'off', 'use_snp_selection': True, 'num_snps': 20055}. Best is trial 123 with value: 0.061587640670861275.
[I 2025-11-03 13:01:19,899] Trial 130 finished with value: 0.014403460947156185 and parameters: {'model_type': 'gcn', 'hidden_dims': '[512, 256]', 'dropout': 0.595493743278495, 'batch_norm': False, 'lr': 2.570989710184423e-05, 'weight_decay': 6.7626951147547685e-06, 'epochs': 257, 'loss': 'mse', 'optimizer': 'adam', 'graph_mode': 'off', 'use_snp_selection': True, 'num_snps': 20213}. Best is trial 123 with value: 0.061587640670861275.
[I 2025-11-03 13:01:21,134] Trial 131 finished with value: 0.005849739230122069 and parameters: {'model_type': 'gcn', 'hidden_dims': '[512, 256]', 'dropout': 0.5847697411296672, 'batch_norm': False, 'lr': 2.760251692712521e-05, 'weight_decay': 8.407523981373054e-06, 'epochs': 231, 'loss': 'mse', 'optimizer': 'adam', 'graph_mode': 'off', 'use_snp_selection': True, 'num_snps': 12594}. Best is trial 123 with value: 0.061587640670861275.
[I 2025-11-03 13:01:22,608] Trial 132 finished with value: -0.025792468723226943 and parameters: {'model_type': 'gcn', 'hidden_dims': '[512, 256]', 'dropout': 0.5613277346277156, 'batch_norm': False, 'lr': 1.2467099759551776e-05, 'weight_decay': 1.2745511036437564e-05, 'epochs': 245, 'loss': 'mse', 'optimizer': 'adam', 'graph_mode': 'off', 'use_snp_selection': True, 'num_snps': 18143}. Best is trial 123 with value: 0.061587640670861275.
[I 2025-11-03 13:01:23,677] Trial 133 finished with value: -0.022459144232700387 and parameters: {'model_type': 'gcn', 'hidden_dims': '[512, 256]', 'dropout': 0.581152944252376, 'batch_norm': False, 'lr': 3.2959688916420534e-05, 'weight_decay': 1.8584770674775824e-05, 'epochs': 203, 'loss': 'mse', 'optimizer': 'adam', 'graph_mode': 'off', 'use_snp_selection': True, 'num_snps': 8984}. Best is trial 123 with value: 0.061587640670861275.
[I 2025-11-03 13:01:24,825] Trial 134 finished with value: 0.02143915034841786 and parameters: {'model_type': 'gcn', 'hidden_dims': '[512, 256]', 'dropout': 0.5996674769020273, 'batch_norm': False, 'lr': 2.308312113003337e-05, 'weight_decay': 1.4668607218205853e-05, 'epochs': 288, 'loss': 'mse', 'optimizer': 'adam', 'graph_mode': 'off', 'use_snp_selection': True, 'num_snps': 4937}. Best is trial 123 with value: 0.061587640670861275.
[I 2025-11-03 13:01:26,674] Trial 135 finished with value: -0.034010830382594885 and parameters: {'model_type': 'gcn', 'hidden_dims': '[512, 256]', 'dropout': 0.5455386166153916, 'batch_norm': False, 'lr': 1.9843547878075627e-05, 'weight_decay': 1.0770840272673761e-05, 'epochs': 304, 'loss': 'mae', 'optimizer': 'adam', 'graph_mode': 'off', 'use_snp_selection': True, 'num_snps': 22334}. Best is trial 123 with value: 0.061587640670861275.
[I 2025-11-03 13:01:27,291] Trial 136 finished with value: 0.029343051604616113 and parameters: {'model_type': 'gcn', 'hidden_dims': '[512, 256]', 'dropout': 0.5269371647374731, 'batch_norm': False, 'lr': 9.115213315957598e-06, 'weight_decay': 1.9742666709966388e-06, 'epochs': 65, 'loss': 'mae', 'optimizer': 'adam', 'graph_mode': 'off', 'use_snp_selection': True, 'num_snps': 2341}. Best is trial 123 with value: 0.061587640670861275.
[I 2025-11-03 13:01:28,171] Trial 137 finished with value: 0.007263564227937209 and parameters: {'model_type': 'gcn', 'hidden_dims': '[512, 256]', 'dropout': 0.5023613487999562, 'batch_norm': False, 'lr': 1.722458484775127e-05, 'weight_decay': 4.601585965883057e-06, 'epochs': 50, 'loss': 'mae', 'optimizer': 'adam', 'graph_mode': 'off', 'use_snp_selection': True, 'num_snps': 14077}. Best is trial 123 with value: 0.061587640670861275.
[I 2025-11-03 13:01:29,229] Trial 138 finished with value: 0.027646139438589217 and parameters: {'model_type': 'gcn', 'hidden_dims': '[512, 64]', 'dropout': 0.4472468649373956, 'batch_norm': False, 'lr': 7.0025781200565885e-06, 'weight_decay': 7.489609195938658e-06, 'epochs': 77, 'loss': 'mae', 'optimizer': 'adam', 'graph_mode': 'off', 'use_snp_selection': True, 'num_snps': 17360}. Best is trial 123 with value: 0.061587640670861275.
[I 2025-11-03 13:01:30,261] Trial 139 finished with value: 0.023534377081619078 and parameters: {'model_type': 'gcn', 'hidden_dims': '[512, 128]', 'dropout': 0.5759921846597701, 'batch_norm': False, 'lr': 5.180559633762649e-05, 'weight_decay': 3.7868081173616e-06, 'epochs': 41, 'loss': 'mse', 'optimizer': 'adam', 'graph_mode': 'off', 'use_snp_selection': True, 'num_snps': 21684}. Best is trial 123 with value: 0.061587640670861275.
[I 2025-11-03 13:01:32,601] Trial 140 finished with value: -0.009546083190674008 and parameters: {'model_type': 'gcn', 'hidden_dims': '[512, 256]', 'dropout': 0.4740702705340274, 'batch_norm': True, 'lr': 4.440991919577162e-05, 'weight_decay': 2.466019687770548e-05, 'epochs': 268, 'loss': 'mae', 'optimizer': 'adam', 'graph_mode': 'off', 'use_snp_selection': False}. Best is trial 123 with value: 0.061587640670861275.
[I 2025-11-03 13:01:33,628] Trial 141 finished with value: -0.01839886880980477 and parameters: {'model_type': 'gcn', 'hidden_dims': '[512, 256]', 'dropout': 0.5277713719014638, 'batch_norm': False, 'lr': 1.570553572072075e-05, 'weight_decay': 1.7307780435241013e-06, 'epochs': 224, 'loss': 'mae', 'optimizer': 'adam', 'graph_mode': 'off', 'use_snp_selection': True, 'num_snps': 4891}. Best is trial 123 with value: 0.061587640670861275.
[I 2025-11-03 13:01:34,426] Trial 142 finished with value: 0.014339327414915405 and parameters: {'model_type': 'gcn', 'hidden_dims': '[512, 256]', 'dropout': 0.5640492321838756, 'batch_norm': False, 'lr': 8.640452185661914e-06, 'weight_decay': 1.3072092160242863e-06, 'epochs': 61, 'loss': 'mae', 'optimizer': 'adam', 'graph_mode': 'off', 'use_snp_selection': True, 'num_snps': 10054}. Best is trial 123 with value: 0.061587640670861275.
[I 2025-11-03 13:01:35,438] Trial 143 finished with value: -0.0016413283808790911 and parameters: {'model_type': 'gcn', 'hidden_dims': '[512, 256]', 'dropout': 0.5189555136940813, 'batch_norm': False, 'lr': 5.605270471092984e-06, 'weight_decay': 1.721386019896334e-05, 'epochs': 251, 'loss': 'mae', 'optimizer': 'adam', 'graph_mode': 'off', 'use_snp_selection': True, 'num_snps': 2053}. Best is trial 123 with value: 0.061587640670861275.
[I 2025-11-03 13:01:36,364] Trial 144 finished with value: 0.02295552256769588 and parameters: {'model_type': 'gcn', 'hidden_dims': '[512, 256]', 'dropout': 0.48653849964618057, 'batch_norm': False, 'lr': 1.0211827581915524e-05, 'weight_decay': 9.38823264827453e-06, 'epochs': 171, 'loss': 'mae', 'optimizer': 'adam', 'graph_mode': 'off', 'use_snp_selection': True, 'num_snps': 5532}. Best is trial 123 with value: 0.061587640670861275.
[I 2025-11-03 13:01:37,586] Trial 145 finished with value: 0.0017455552645251338 and parameters: {'model_type': 'gcn', 'hidden_dims': '[512, 64]', 'dropout': 0.5376248945854946, 'batch_norm': False, 'lr': 8.590098335712993e-06, 'weight_decay': 2.4676359844429635e-06, 'epochs': 70, 'loss': 'mae', 'optimizer': 'adam', 'graph_mode': 'off', 'use_snp_selection': True, 'num_snps': 25377}. Best is trial 123 with value: 0.061587640670861275.
[I 2025-11-03 13:01:38,454] Trial 146 finished with value: -0.010948290351942426 and parameters: {'model_type': 'gcn', 'hidden_dims': '[256, 128]', 'dropout': 0.21147401397995935, 'batch_norm': False, 'lr': 1.0864687369234802e-05, 'weight_decay': 3.153452070099952e-06, 'epochs': 66, 'loss': 'mae', 'optimizer': 'adam', 'graph_mode': 'off', 'use_snp_selection': False}. Best is trial 123 with value: 0.061587640670861275.
[I 2025-11-03 13:01:39,705] Trial 147 finished with value: -0.03355851848333415 and parameters: {'model_type': 'gcn', 'hidden_dims': '[512, 128]', 'dropout': 0.45585075015205306, 'batch_norm': False, 'lr': 1.3278891958122737e-05, 'weight_decay': 5.709904196547636e-06, 'epochs': 86, 'loss': 'mae', 'optimizer': 'adam', 'graph_mode': 'off', 'use_snp_selection': False}. Best is trial 123 with value: 0.061587640670861275.
[I 2025-11-03 13:01:40,412] Trial 148 finished with value: 0.002575898812221305 and parameters: {'model_type': 'gcn', 'hidden_dims': '[128, 64]', 'dropout': 0.499023087419414, 'batch_norm': False, 'lr': 0.00035652633827972175, 'weight_decay': 2.192489583487218e-06, 'epochs': 55, 'loss': 'mae', 'optimizer': 'adam', 'graph_mode': 'off', 'use_snp_selection': True, 'num_snps': 8239}. Best is trial 123 with value: 0.061587640670861275.
[I 2025-11-03 13:01:41,724] Trial 149 finished with value: -0.03912604636412878 and parameters: {'model_type': 'gcn', 'hidden_dims': '[512, 256]', 'dropout': 0.5493377381355785, 'batch_norm': False, 'lr': 5.964195245164318e-05, 'weight_decay': 1.2046261122477048e-05, 'epochs': 96, 'loss': 'mae', 'optimizer': 'adam', 'graph_mode': 'off', 'use_snp_selection': False}. Best is trial 123 with value: 0.061587640670861275.
[I 2025-11-03 13:01:43,776] Trial 0 finished with value: 0.04086936216794051 and parameters: {'model_type': 'gcn', 'hidden_dims': '[128, 64]', 'dropout': 0.199031432379812, 'batch_norm': True, 'lr': 1.8408544111075837e-06, 'weight_decay': 5.5136510071208614e-05, 'epochs': 336, 'loss': 'mae', 'optimizer': 'adam', 'graph_mode': 'off', 'use_snp_selection': True, 'num_snps': 43862}. Best is trial 0 with value: 0.04086936216794051.
[I 2025-11-03 13:01:45,179] Trial 1 finished with value: 0.07440246896080721 and parameters: {'model_type': 'gcn', 'hidden_dims': '[256, 128]', 'dropout': 0.4370668075331726, 'batch_norm': True, 'lr': 7.133471581159139e-05, 'weight_decay': 1.128633586803549e-05, 'epochs': 242, 'loss': 'mae', 'optimizer': 'adam', 'graph_mode': 'off', 'use_snp_selection': False}. Best is trial 1 with value: 0.07440246896080721.
[I 2025-11-03 13:01:46,252] Trial 2 finished with value: 0.012112667698927817 and parameters: {'model_type': 'gcn', 'hidden_dims': '[256, 128, 64]', 'dropout': 0.41314357415569625, 'batch_norm': False, 'lr': 3.952233718592101e-06, 'weight_decay': 0.00026754769258252603, 'epochs': 149, 'loss': 'mse', 'optimizer': 'adam', 'graph_mode': 'off', 'use_snp_selection': True, 'num_snps': 11571}. Best is trial 1 with value: 0.07440246896080721.
[I 2025-11-03 13:01:48,543] Trial 3 finished with value: 0.04573856253177123 and parameters: {'model_type': 'gcn', 'hidden_dims': '[512, 64]', 'dropout': 0.5938127374509361, 'batch_norm': False, 'lr': 5.67704586114731e-06, 'weight_decay': 2.4518087630137052e-05, 'epochs': 320, 'loss': 'mae', 'optimizer': 'adam', 'graph_mode': 'off', 'use_snp_selection': False}. Best is trial 1 with value: 0.07440246896080721.
[I 2025-11-03 13:01:50,667] Trial 4 finished with value: 0.009094692602014015 and parameters: {'model_type': 'gcn', 'hidden_dims': '[512, 128]', 'dropout': 0.25746343592134413, 'batch_norm': True, 'lr': 1.3467657668402788e-06, 'weight_decay': 0.00033087251918647806, 'epochs': 277, 'loss': 'mse', 'optimizer': 'adam', 'graph_mode': 'off', 'use_snp_selection': True, 'num_snps': 36675}. Best is trial 1 with value: 0.07440246896080721.
[I 2025-11-03 13:01:52,256] Trial 5 finished with value: 0.0019727108802098272 and parameters: {'model_type': 'gcn', 'hidden_dims': '[512, 64]', 'dropout': 0.38275350994408375, 'batch_norm': True, 'lr': 1.5586664309232824e-06, 'weight_decay': 0.0008227664668621182, 'epochs': 145, 'loss': 'mae', 'optimizer': 'adam', 'graph_mode': 'off', 'use_snp_selection': True, 'num_snps': 32148}. Best is trial 1 with value: 0.07440246896080721.
[I 2025-11-03 13:01:53,461] Trial 6 finished with value: 0.030610822907710618 and parameters: {'model_type': 'gcn', 'hidden_dims': '[256, 128]', 'dropout': 0.3930109900265879, 'batch_norm': False, 'lr': 4.892964372128395e-05, 'weight_decay': 1.5809549317992182e-06, 'epochs': 199, 'loss': 'mse', 'optimizer': 'adam', 'graph_mode': 'off', 'use_snp_selection': False}. Best is trial 1 with value: 0.07440246896080721.
[I 2025-11-03 13:01:54,744] Trial 7 finished with value: 0.10556939247467163 and parameters: {'model_type': 'gcn', 'hidden_dims': '[512, 256]', 'dropout': 0.15343979219678458, 'batch_norm': True, 'lr': 6.234003099047341e-05, 'weight_decay': 3.894760610535477e-07, 'epochs': 97, 'loss': 'mse', 'optimizer': 'adam', 'graph_mode': 'off', 'use_snp_selection': False}. Best is trial 7 with value: 0.10556939247467163.
[I 2025-11-03 13:01:56,992] Trial 8 finished with value: 0.10155198377179611 and parameters: {'model_type': 'gcn', 'hidden_dims': '[512, 128]', 'dropout': 0.10743001231661406, 'batch_norm': True, 'lr': 0.00023728538449271062, 'weight_decay': 1.7629071578048637e-05, 'epochs': 312, 'loss': 'mae', 'optimizer': 'adam', 'graph_mode': 'off', 'use_snp_selection': False}. Best is trial 7 with value: 0.10556939247467163.
[I 2025-11-03 13:01:58,605] Trial 9 finished with value: 0.0831285627485334 and parameters: {'model_type': 'gcn', 'hidden_dims': '[512, 64]', 'dropout': 0.14505336736221927, 'batch_norm': True, 'lr': 5.8619638388111826e-05, 'weight_decay': 6.200156172669308e-07, 'epochs': 175, 'loss': 'mse', 'optimizer': 'adam', 'graph_mode': 'off', 'use_snp_selection': False}. Best is trial 7 with value: 0.10556939247467163.
[I 2025-11-03 13:01:59,589] Trial 10 finished with value: -0.03411542833570267 and parameters: {'model_type': 'gcn', 'hidden_dims': '[512, 256]', 'dropout': 0.2736992815328032, 'batch_norm': False, 'lr': 0.00032393778075602147, 'weight_decay': 1.1511946696017091e-07, 'epochs': 41, 'loss': 'mse', 'optimizer': 'adam', 'graph_mode': 'off', 'use_snp_selection': False}. Best is trial 7 with value: 0.10556939247467163.
[I 2025-11-03 13:02:00,687] Trial 11 finished with value: 0.11167912209591514 and parameters: {'model_type': 'gcn', 'hidden_dims': '[512, 128]', 'dropout': 0.10095648685224448, 'batch_norm': True, 'lr': 0.0007666984023899754, 'weight_decay': 2.512571353186099e-06, 'epochs': 70, 'loss': 'mae', 'optimizer': 'adam', 'graph_mode': 'off', 'use_snp_selection': False}. Best is trial 11 with value: 0.11167912209591514.
[I 2025-11-03 13:02:01,728] Trial 12 finished with value: 0.10718411924916962 and parameters: {'model_type': 'gcn', 'hidden_dims': '[512, 256]', 'dropout': 0.10344600881777158, 'batch_norm': True, 'lr': 0.0006753264773209732, 'weight_decay': 1.2006458821839938e-06, 'epochs': 63, 'loss': 'mae', 'optimizer': 'adam', 'graph_mode': 'off', 'use_snp_selection': False}. Best is trial 11 with value: 0.11167912209591514.
[I 2025-11-03 13:02:02,787] Trial 13 finished with value: 0.10932345449583791 and parameters: {'model_type': 'gcn', 'hidden_dims': '[512, 256]', 'dropout': 0.24637176605202246, 'batch_norm': True, 'lr': 0.0006925072561196448, 'weight_decay': 2.9080284089521244e-06, 'epochs': 51, 'loss': 'mae', 'optimizer': 'adam', 'graph_mode': 'off', 'use_snp_selection': False}. Best is trial 11 with value: 0.11167912209591514.
[I 2025-11-03 13:02:04,015] Trial 14 finished with value: 0.10579047910589583 and parameters: {'model_type': 'gcn', 'hidden_dims': '[512, 128]', 'dropout': 0.2896280300541336, 'batch_norm': True, 'lr': 0.0008799700862786951, 'weight_decay': 3.6626918519483994e-06, 'epochs': 93, 'loss': 'mae', 'optimizer': 'adam', 'graph_mode': 'off', 'use_snp_selection': False}. Best is trial 11 with value: 0.11167912209591514.
[I 2025-11-03 13:02:04,840] Trial 15 finished with value: 0.10616596914176754 and parameters: {'model_type': 'gcn', 'hidden_dims': '[128, 64]', 'dropout': 0.2276339412675447, 'batch_norm': True, 'lr': 0.00018429018027102802, 'weight_decay': 4.647398975110258e-06, 'epochs': 100, 'loss': 'mae', 'optimizer': 'adam', 'graph_mode': 'off', 'use_snp_selection': False}. Best is trial 11 with value: 0.11167912209591514.
[I 2025-11-03 13:02:05,620] Trial 16 finished with value: -0.012377173175444848 and parameters: {'model_type': 'gcn', 'hidden_dims': '[256, 128, 64]', 'dropout': 0.3290077421919887, 'batch_norm': True, 'lr': 1.2586985041154999e-05, 'weight_decay': 1.8679690592372175e-07, 'epochs': 43, 'loss': 'mae', 'optimizer': 'adam', 'graph_mode': 'off', 'use_snp_selection': False}. Best is trial 11 with value: 0.11167912209591514.
[I 2025-11-03 13:02:06,965] Trial 17 finished with value: 0.10806537399773702 and parameters: {'model_type': 'gcn', 'hidden_dims': '[512, 256]', 'dropout': 0.5056554626591924, 'batch_norm': True, 'lr': 0.00044642725319954336, 'weight_decay': 6.029789253022092e-05, 'epochs': 125, 'loss': 'mae', 'optimizer': 'adam', 'graph_mode': 'off', 'use_snp_selection': False}. Best is trial 11 with value: 0.11167912209591514.
[I 2025-11-03 13:02:09,576] Trial 18 finished with value: 0.0814269405687516 and parameters: {'model_type': 'gcn', 'hidden_dims': '[512, 128]', 'dropout': 0.19211246602271237, 'batch_norm': False, 'lr': 0.00015928038629232352, 'weight_decay': 4.109412643182285e-06, 'epochs': 219, 'loss': 'mae', 'optimizer': 'adam', 'graph_mode': 'off', 'use_snp_selection': True, 'num_snps': 58241}. Best is trial 11 with value: 0.11167912209591514.
[I 2025-11-03 13:02:10,740] Trial 19 finished with value: 0.053755506135791734 and parameters: {'model_type': 'gcn', 'hidden_dims': '[512, 256]', 'dropout': 0.32551592065274, 'batch_norm': True, 'lr': 1.8913585393810635e-05, 'weight_decay': 1.2663842343872694e-06, 'epochs': 83, 'loss': 'mae', 'optimizer': 'adam', 'graph_mode': 'off', 'use_snp_selection': False}. Best is trial 11 with value: 0.11167912209591514.
[I 2025-11-03 13:02:12,102] Trial 20 finished with value: 0.09520445081716145 and parameters: {'model_type': 'gcn', 'hidden_dims': '[512, 128]', 'dropout': 0.1696175915922815, 'batch_norm': True, 'lr': 0.0005516960221520528, 'weight_decay': 3.8595240428604215e-07, 'epochs': 126, 'loss': 'mae', 'optimizer': 'adam', 'graph_mode': 'off', 'use_snp_selection': False}. Best is trial 11 with value: 0.11167912209591514.
[I 2025-11-03 13:02:13,472] Trial 21 finished with value: 0.09768054794707395 and parameters: {'model_type': 'gcn', 'hidden_dims': '[512, 256]', 'dropout': 0.4803040619494792, 'batch_norm': True, 'lr': 0.00045118879873212546, 'weight_decay': 6.139807638873775e-05, 'epochs': 124, 'loss': 'mae', 'optimizer': 'adam', 'graph_mode': 'off', 'use_snp_selection': False}. Best is trial 11 with value: 0.11167912209591514.
[I 2025-11-03 13:02:14,554] Trial 22 finished with value: 0.08721054942824946 and parameters: {'model_type': 'gcn', 'hidden_dims': '[512, 256]', 'dropout': 0.5447308805905808, 'batch_norm': True, 'lr': 0.0009595623178922175, 'weight_decay': 5.8163652393034084e-05, 'epochs': 72, 'loss': 'mae', 'optimizer': 'adam', 'graph_mode': 'off', 'use_snp_selection': False}. Best is trial 11 with value: 0.11167912209591514.
[I 2025-11-03 13:02:15,917] Trial 23 finished with value: 0.0740222430329965 and parameters: {'model_type': 'gcn', 'hidden_dims': '[512, 256]', 'dropout': 0.4750131582113186, 'batch_norm': True, 'lr': 0.00012786166852879932, 'weight_decay': 7.0420674790720225e-06, 'epochs': 124, 'loss': 'mae', 'optimizer': 'adam', 'graph_mode': 'off', 'use_snp_selection': False}. Best is trial 11 with value: 0.11167912209591514.
[I 2025-11-03 13:02:16,974] Trial 24 finished with value: 0.10795782615794908 and parameters: {'model_type': 'gcn', 'hidden_dims': '[512, 256]', 'dropout': 0.537744997380118, 'batch_norm': True, 'lr': 0.0003378460404782885, 'weight_decay': 2.046696771467823e-06, 'epochs': 58, 'loss': 'mae', 'optimizer': 'adam', 'graph_mode': 'off', 'use_snp_selection': False}. Best is trial 11 with value: 0.11167912209591514.
[I 2025-11-03 13:02:18,311] Trial 25 finished with value: 0.08105615760738717 and parameters: {'model_type': 'gcn', 'hidden_dims': '[256, 128, 64]', 'dropout': 0.232427577990737, 'batch_norm': True, 'lr': 0.00011510921003348973, 'weight_decay': 2.456471643870495e-05, 'epochs': 168, 'loss': 'mae', 'optimizer': 'adam', 'graph_mode': 'off', 'use_snp_selection': False}. Best is trial 11 with value: 0.11167912209591514.
