[I 2025-11-03 12:39:11,581] Trial 9 finished with value: 0.04574989692911037 and parameters: {'model_type': 'gcn', 'hidden_dims': '[512, 64]', 'dropout': 0.14505336736221927, 'batch_norm': True, 'lr': 5.8619638388111826e-05, 'weight_decay': 6.200156172669308e-07, 'epochs': 175, 'loss': 'mse', 'optimizer': 'adam', 'graph_mode': 'off', 'use_snp_selection': False}. Best is trial 7 with value: 0.07889921334247457.
[I 2025-11-03 12:39:12,678] Trial 10 finished with value: 0.006393710178510117 and parameters: {'model_type': 'gcn', 'hidden_dims': '[512, 256]', 'dropout': 0.2736992815328032, 'batch_norm': False, 'lr': 0.00032393778075602147, 'weight_decay': 1.1511946696017091e-07, 'epochs': 41, 'loss': 'mse', 'optimizer': 'adam', 'graph_mode': 'off', 'use_snp_selection': False}. Best is trial 7 with value: 0.07889921334247457.
[I 2025-11-03 12:39:14,014] Trial 11 finished with value: 0.06045997372241087 and parameters: {'model_type': 'gcn', 'hidden_dims': '[512, 128]', 'dropout': 0.10095648685224448, 'batch_norm': True, 'lr': 0.0007666984023899754, 'weight_decay': 2.512571353186099e-06, 'epochs': 70, 'loss': 'mae', 'optimizer': 'adam', 'graph_mode': 'off', 'use_snp_selection': False}. Best is trial 7 with value: 0.07889921334247457.
[I 2025-11-03 12:39:15,544] Trial 12 finished with value: 0.07359132881774662 and parameters: {'model_type': 'gcn', 'hidden_dims': '[512, 256]', 'dropout': 0.18206399419301494, 'batch_norm': True, 'lr': 0.00026576228959612443, 'weight_decay': 1.3081036432574914e-07, 'epochs': 88, 'loss': 'mae', 'optimizer': 'adam', 'graph_mode': 'off', 'use_snp_selection': False}. Best is trial 7 with value: 0.07889921334247457.
[I 2025-11-03 12:39:18,200] Trial 13 finished with value: 0.03557817912400526 and parameters: {'model_type': 'gcn', 'hidden_dims': '[512, 128]', 'dropout': 0.28178980110198326, 'batch_norm': True, 'lr': 1.620313997304389e-05, 'weight_decay': 3.475237872468419e-06, 'epochs': 237, 'loss': 'mse', 'optimizer': 'adam', 'graph_mode': 'off', 'use_snp_selection': False}. Best is trial 7 with value: 0.07889921334247457.
[I 2025-11-03 12:39:20,016] Trial 14 finished with value: 0.07378150645021568 and parameters: {'model_type': 'gcn', 'hidden_dims': '[512, 256]', 'dropout': 0.12319334351899142, 'batch_norm': True, 'lr': 0.00017558188744418174, 'weight_decay': 6.057825071170492e-05, 'epochs': 119, 'loss': 'mse', 'optimizer': 'adam', 'graph_mode': 'off', 'use_snp_selection': False}. Best is trial 7 with value: 0.07889921334247457.
[I 2025-11-03 12:39:21,515] Trial 15 finished with value: 0.08135214166621302 and parameters: {'model_type': 'gcn', 'hidden_dims': '[128, 64]', 'dropout': 0.2144644905818855, 'batch_norm': True, 'lr': 2.002944590579291e-05, 'weight_decay': 5.056071213029491e-07, 'epochs': 297, 'loss': 'mae', 'optimizer': 'adam', 'graph_mode': 'off', 'use_snp_selection': False}. Best is trial 15 with value: 0.08135214166621302.
[I 2025-11-03 12:39:22,837] Trial 16 finished with value: 0.008718597029629294 and parameters: {'model_type': 'gcn', 'hidden_dims': '[128, 64]', 'dropout': 0.22222337490690977, 'batch_norm': True, 'lr': 1.4098012456697182e-05, 'weight_decay': 4.833299252951357e-07, 'epochs': 220, 'loss': 'mae', 'optimizer': 'adam', 'graph_mode': 'off', 'use_snp_selection': False}. Best is trial 15 with value: 0.08135214166621302.
[I 2025-11-03 12:39:24,343] Trial 17 finished with value: 0.06284350879626334 and parameters: {'model_type': 'gcn', 'hidden_dims': '[128, 64]', 'dropout': 0.32888830259108426, 'batch_norm': True, 'lr': 2.349300150160791e-05, 'weight_decay': 3.6392708945165584e-07, 'epochs': 275, 'loss': 'mse', 'optimizer': 'adam', 'graph_mode': 'off', 'use_snp_selection': False}. Best is trial 15 with value: 0.08135214166621302.
[I 2025-11-03 12:39:27,421] Trial 18 finished with value: 0.022456536794207088 and parameters: {'model_type': 'gcn', 'hidden_dims': '[256, 128, 64]', 'dropout': 0.5098431992326697, 'batch_norm': False, 'lr': 0.00011002413714488088, 'weight_decay': 1.2664493946510444e-06, 'epochs': 282, 'loss': 'mae', 'optimizer': 'adam', 'graph_mode': 'off', 'use_snp_selection': True, 'num_snps': 58241}. Best is trial 15 with value: 0.08135214166621302.
[I 2025-11-03 12:39:29,209] Trial 19 finished with value: -0.022923736923508114 and parameters: {'model_type': 'gcn', 'hidden_dims': '[512, 256]', 'dropout': 0.3283027164458897, 'batch_norm': True, 'lr': 7.449216952554795e-06, 'weight_decay': 5.616604511856019e-06, 'epochs': 118, 'loss': 'mse', 'optimizer': 'adam', 'graph_mode': 'off', 'use_snp_selection': False}. Best is trial 15 with value: 0.08135214166621302.
[I 2025-11-03 12:39:30,373] Trial 20 finished with value: 0.026604399061282383 and parameters: {'model_type': 'gcn', 'hidden_dims': '[128, 64]', 'dropout': 0.1683003999978968, 'batch_norm': True, 'lr': 1.1857669757062644e-05, 'weight_decay': 2.748407622134108e-07, 'epochs': 179, 'loss': 'mse', 'optimizer': 'adam', 'graph_mode': 'off', 'use_snp_selection': False}. Best is trial 15 with value: 0.08135214166621302.
[I 2025-11-03 12:39:33,695] Trial 21 finished with value: 0.06656946796518415 and parameters: {'model_type': 'gcn', 'hidden_dims': '[512, 128]', 'dropout': 0.10369083852141449, 'batch_norm': True, 'lr': 3.262791773108692e-05, 'weight_decay': 1.2860718105339766e-05, 'epochs': 307, 'loss': 'mae', 'optimizer': 'adam', 'graph_mode': 'off', 'use_snp_selection': False}. Best is trial 15 with value: 0.08135214166621302.
[I 2025-11-03 12:39:37,242] Trial 22 finished with value: 0.06230621663685852 and parameters: {'model_type': 'gcn', 'hidden_dims': '[512, 128]', 'dropout': 0.23075167760877666, 'batch_norm': True, 'lr': 0.0006767672126108538, 'weight_decay': 9.606832583545451e-07, 'epochs': 345, 'loss': 'mae', 'optimizer': 'adam', 'graph_mode': 'off', 'use_snp_selection': False}. Best is trial 15 with value: 0.08135214166621302.
[I 2025-11-03 12:39:40,503] Trial 23 finished with value: 0.0640702405346226 and parameters: {'model_type': 'gcn', 'hidden_dims': '[512, 256]', 'dropout': 0.16507216694258064, 'batch_norm': True, 'lr': 0.00011931563357677646, 'weight_decay': 3.524397404249958e-05, 'epochs': 294, 'loss': 'mae', 'optimizer': 'adam', 'graph_mode': 'off', 'use_snp_selection': False}. Best is trial 15 with value: 0.08135214166621302.
[I 2025-11-03 12:39:41,847] Trial 24 finished with value: 0.05216294221886672 and parameters: {'model_type': 'gcn', 'hidden_dims': '[128, 64]', 'dropout': 0.14285231658225506, 'batch_norm': True, 'lr': 3.159290428929018e-05, 'weight_decay': 4.8282682878004544e-06, 'epochs': 248, 'loss': 'mae', 'optimizer': 'adam', 'graph_mode': 'off', 'use_snp_selection': False}. Best is trial 15 with value: 0.08135214166621302.
[I 2025-11-03 12:39:44,339] Trial 25 finished with value: 0.06847163424301217 and parameters: {'model_type': 'gcn', 'hidden_dims': '[256, 128, 64]', 'dropout': 0.20777382632073504, 'batch_norm': True, 'lr': 0.00028887803087408975, 'weight_decay': 2.1214443870108263e-07, 'epochs': 321, 'loss': 'mae', 'optimizer': 'adam', 'graph_mode': 'off', 'use_snp_selection': False}. Best is trial 15 with value: 0.08135214166621302.
[I 2025-11-03 12:39:45,492] Trial 26 finished with value: 0.02101895935306228 and parameters: {'model_type': 'gcn', 'hidden_dims': '[256, 128]', 'dropout': 0.3017666430086059, 'batch_norm': False, 'lr': 0.00046580302726414324, 'weight_decay': 0.00015265805543382738, 'epochs': 263, 'loss': 'mae', 'optimizer': 'adam', 'graph_mode': 'off', 'use_snp_selection': True, 'num_snps': 3842}. Best is trial 15 with value: 0.08135214166621302.
[I 2025-11-03 12:39:47,930] Trial 27 finished with value: 0.07939598320141356 and parameters: {'model_type': 'gcn', 'hidden_dims': '[512, 128]', 'dropout': 0.23403980434611624, 'batch_norm': True, 'lr': 0.00010202671117596517, 'weight_decay': 7.297989052822808e-07, 'epochs': 199, 'loss': 'mae', 'optimizer': 'adam', 'graph_mode': 'off', 'use_snp_selection': False}. Best is trial 15 with value: 0.08135214166621302.
[I 2025-11-03 12:39:49,153] Trial 28 finished with value: 0.08347084095638742 and parameters: {'model_type': 'gcn', 'hidden_dims': '[128, 64]', 'dropout': 0.219196935871986, 'batch_norm': True, 'lr': 0.00010118004692841974, 'weight_decay': 6.866597506933016e-07, 'epochs': 212, 'loss': 'mse', 'optimizer': 'adam', 'graph_mode': 'off', 'use_snp_selection': False}. Best is trial 28 with value: 0.08347084095638742.
[I 2025-11-03 12:39:50,542] Trial 29 finished with value: 0.007748293857721383 and parameters: {'model_type': 'gcn', 'hidden_dims': '[128, 64]', 'dropout': 0.22249104135299486, 'batch_norm': True, 'lr': 2.8966762461994946e-06, 'weight_decay': 2.1019293387824395e-06, 'epochs': 212, 'loss': 'mae', 'optimizer': 'adam', 'graph_mode': 'off', 'use_snp_selection': True, 'num_snps': 19468}. Best is trial 28 with value: 0.08347084095638742.
[I 2025-11-03 12:39:51,620] Trial 30 finished with value: 0.07176451908777598 and parameters: {'model_type': 'gcn', 'hidden_dims': '[128, 64]', 'dropout': 0.25231358023503264, 'batch_norm': True, 'lr': 0.00011483764029458455, 'weight_decay': 8.720737829094907e-07, 'epochs': 174, 'loss': 'mae', 'optimizer': 'adam', 'graph_mode': 'off', 'use_snp_selection': False}. Best is trial 28 with value: 0.08347084095638742.
[I 2025-11-03 12:39:52,624] Trial 31 finished with value: 0.036529995201355074 and parameters: {'model_type': 'gcn', 'hidden_dims': '[128, 64]', 'dropout': 0.2114818638035461, 'batch_norm': True, 'lr': 4.5994356050567516e-05, 'weight_decay': 2.306768064291122e-07, 'epochs': 149, 'loss': 'mse', 'optimizer': 'adam', 'graph_mode': 'off', 'use_snp_selection': False}. Best is trial 28 with value: 0.08347084095638742.
[I 2025-11-03 12:39:53,862] Trial 32 finished with value: 0.043446944467344435 and parameters: {'model_type': 'gcn', 'hidden_dims': '[128, 64]', 'dropout': 0.18018254516766022, 'batch_norm': True, 'lr': 7.802836778160368e-05, 'weight_decay': 6.26641893322677e-07, 'epochs': 221, 'loss': 'mse', 'optimizer': 'adam', 'graph_mode': 'off', 'use_snp_selection': False}. Best is trial 28 with value: 0.08347084095638742.
[I 2025-11-03 12:39:55,670] Trial 33 finished with value: 0.04321027667664398 and parameters: {'model_type': 'gcn', 'hidden_dims': '[512, 256]', 'dropout': 0.2481632955675448, 'batch_norm': True, 'lr': 8.61340432137355e-05, 'weight_decay': 1.7291626118433404e-07, 'epochs': 130, 'loss': 'mse', 'optimizer': 'adam', 'graph_mode': 'off', 'use_snp_selection': False}. Best is trial 28 with value: 0.08347084095638742.
[I 2025-11-03 12:39:56,488] Trial 34 finished with value: 0.01275204435422207 and parameters: {'model_type': 'gcn', 'hidden_dims': '[128, 64]', 'dropout': 0.29894883229945146, 'batch_norm': True, 'lr': 2.5298060117196053e-05, 'weight_decay': 3.941477066731579e-07, 'epochs': 93, 'loss': 'mse', 'optimizer': 'adam', 'graph_mode': 'off', 'use_snp_selection': False}. Best is trial 28 with value: 0.08347084095638742.
[I 2025-11-03 12:39:58,191] Trial 35 finished with value: 0.0385265711616788 and parameters: {'model_type': 'gcn', 'hidden_dims': '[256, 128, 64]', 'dropout': 0.4544759458916864, 'batch_norm': False, 'lr': 0.00017750846076065643, 'weight_decay': 9.267696035960277e-07, 'epochs': 194, 'loss': 'mse', 'optimizer': 'adam', 'graph_mode': 'off', 'use_snp_selection': False}. Best is trial 28 with value: 0.08347084095638742.
[I 2025-11-03 12:40:00,995] Trial 36 finished with value: 0.054642452848957274 and parameters: {'model_type': 'gcn', 'hidden_dims': '[256, 128]', 'dropout': 0.14129838352673674, 'batch_norm': True, 'lr': 3.851630785242125e-05, 'weight_decay': 6.0387060086471e-06, 'epochs': 245, 'loss': 'mse', 'optimizer': 'adam', 'graph_mode': 'off', 'use_snp_selection': True, 'num_snps': 58661}. Best is trial 28 with value: 0.08347084095638742.
[I 2025-11-03 12:40:03,185] Trial 37 finished with value: 0.06312101777487365 and parameters: {'model_type': 'gcn', 'hidden_dims': '[512, 64]', 'dropout': 0.3570929234445909, 'batch_norm': True, 'lr': 6.368928505430746e-05, 'weight_decay': 1.4899919315257423e-06, 'epochs': 166, 'loss': 'mae', 'optimizer': 'adam', 'graph_mode': 'off', 'use_snp_selection': False}. Best is trial 28 with value: 0.08347084095638742.
[I 2025-11-03 12:40:04,502] Trial 38 finished with value: 0.04734630062007884 and parameters: {'model_type': 'gcn', 'hidden_dims': '[128, 64]', 'dropout': 0.1973362039102453, 'batch_norm': False, 'lr': 8.061953406700679e-06, 'weight_decay': 2.5601859108532993e-06, 'epochs': 190, 'loss': 'mse', 'optimizer': 'adam', 'graph_mode': 'off', 'use_snp_selection': True, 'num_snps': 19911}. Best is trial 28 with value: 0.08347084095638742.
[I 2025-11-03 12:40:06,574] Trial 39 finished with value: 0.028625526594873933 and parameters: {'model_type': 'gcn', 'hidden_dims': '[512, 128]', 'dropout': 0.593444752072398, 'batch_norm': True, 'lr': 1.971997465183711e-05, 'weight_decay': 1.0376720728299249e-07, 'epochs': 160, 'loss': 'mae', 'optimizer': 'adam', 'graph_mode': 'off', 'use_snp_selection': False}. Best is trial 28 with value: 0.08347084095638742.
[I 2025-11-03 12:40:09,006] Trial 40 finished with value: 0.07469948359386287 and parameters: {'model_type': 'gcn', 'hidden_dims': '[512, 64]', 'dropout': 0.24103535146714228, 'batch_norm': True, 'lr': 0.00015603841492270256, 'weight_decay': 6.299830564096743e-07, 'epochs': 210, 'loss': 'mse', 'optimizer': 'adam', 'graph_mode': 'off', 'use_snp_selection': False}. Best is trial 28 with value: 0.08347084095638742.
[I 2025-11-03 12:40:12,287] Trial 41 finished with value: 0.06829683193312748 and parameters: {'model_type': 'gcn', 'hidden_dims': '[512, 128]', 'dropout': 0.12946835834288956, 'batch_norm': True, 'lr': 0.00021402694140943936, 'weight_decay': 1.4546601045491361e-05, 'epochs': 312, 'loss': 'mae', 'optimizer': 'adam', 'graph_mode': 'off', 'use_snp_selection': False}. Best is trial 28 with value: 0.08347084095638742.
[I 2025-11-03 12:40:15,724] Trial 42 finished with value: 0.06425290604586492 and parameters: {'model_type': 'gcn', 'hidden_dims': '[512, 128]', 'dropout': 0.15890663948126835, 'batch_norm': True, 'lr': 0.0003903733102844566, 'weight_decay': 8.404514750157084e-05, 'epochs': 333, 'loss': 'mae', 'optimizer': 'adam', 'graph_mode': 'off', 'use_snp_selection': False}. Best is trial 28 with value: 0.08347084095638742.
[I 2025-11-03 12:40:16,895] Trial 43 finished with value: 0.04880770204302223 and parameters: {'model_type': 'gcn', 'hidden_dims': '[512, 128]', 'dropout': 0.19352959407094214, 'batch_norm': True, 'lr': 5.3432678605007595e-05, 'weight_decay': 2.1202090803562472e-05, 'epochs': 49, 'loss': 'mae', 'optimizer': 'adam', 'graph_mode': 'off', 'use_snp_selection': False}. Best is trial 28 with value: 0.08347084095638742.
[I 2025-11-03 12:40:19,859] Trial 44 finished with value: 0.08125551923072477 and parameters: {'model_type': 'gcn', 'hidden_dims': '[512, 128]', 'dropout': 0.11610431181071769, 'batch_norm': True, 'lr': 8.380557455945833e-05, 'weight_decay': 7.961600373344327e-06, 'epochs': 263, 'loss': 'mae', 'optimizer': 'adam', 'graph_mode': 'off', 'use_snp_selection': False}. Best is trial 28 with value: 0.08347084095638742.
[I 2025-11-03 12:40:22,756] Trial 45 finished with value: 0.038613599073382784 and parameters: {'model_type': 'gcn', 'hidden_dims': '[512, 256]', 'dropout': 0.1249419250436001, 'batch_norm': True, 'lr': 8.518244987897074e-05, 'weight_decay': 9.509045568147612e-06, 'epochs': 262, 'loss': 'mae', 'optimizer': 'adam', 'graph_mode': 'off', 'use_snp_selection': False}. Best is trial 28 with value: 0.08347084095638742.
[I 2025-11-03 12:40:25,343] Trial 46 finished with value: 0.07624120163153424 and parameters: {'model_type': 'gcn', 'hidden_dims': '[512, 128]', 'dropout': 0.2682512335883215, 'batch_norm': False, 'lr': 0.00012845397360221515, 'weight_decay': 3.9173204579787707e-07, 'epochs': 229, 'loss': 'mae', 'optimizer': 'adam', 'graph_mode': 'off', 'use_snp_selection': False}. Best is trial 28 with value: 0.08347084095638742.
[I 2025-11-03 12:40:27,399] Trial 47 finished with value: 0.048527165535884785 and parameters: {'model_type': 'gcn', 'hidden_dims': '[256, 128]', 'dropout': 0.1648065802709893, 'batch_norm': True, 'lr': 4.5257013991055714e-05, 'weight_decay': 1.7857654936931872e-06, 'epochs': 297, 'loss': 'mse', 'optimizer': 'adam', 'graph_mode': 'off', 'use_snp_selection': False}. Best is trial 28 with value: 0.08347084095638742.
[I 2025-11-03 12:40:30,256] Trial 48 finished with value: 0.055215707035853996 and parameters: {'model_type': 'gcn', 'hidden_dims': '[512, 128]', 'dropout': 0.18329228626708488, 'batch_norm': True, 'lr': 6.736795765781812e-05, 'weight_decay': 0.0006963874766430633, 'epochs': 256, 'loss': 'mae', 'optimizer': 'adam', 'graph_mode': 'off', 'use_snp_selection': False}. Best is trial 28 with value: 0.08347084095638742.
[I 2025-11-03 12:40:33,511] Trial 49 finished with value: 0.06974013713007354 and parameters: {'model_type': 'gcn', 'hidden_dims': '[512, 256]', 'dropout': 0.11329633687284564, 'batch_norm': True, 'lr': 9.691766716145729e-05, 'weight_decay': 1.7009079364163222e-07, 'epochs': 272, 'loss': 'mse', 'optimizer': 'adam', 'graph_mode': 'off', 'use_snp_selection': True, 'num_snps': 46888}. Best is trial 28 with value: 0.08347084095638742.
[I 2025-11-03 12:40:36,176] Trial 50 finished with value: 0.05265570262402465 and parameters: {'model_type': 'gcn', 'hidden_dims': '[512, 64]', 'dropout': 0.28777086553750336, 'batch_norm': True, 'lr': 9.71528237744233e-06, 'weight_decay': 3.458358706613729e-06, 'epochs': 233, 'loss': 'mae', 'optimizer': 'adam', 'graph_mode': 'off', 'use_snp_selection': False}. Best is trial 28 with value: 0.08347084095638742.
[I 2025-11-03 12:40:38,883] Trial 51 finished with value: 0.06323277064476467 and parameters: {'model_type': 'gcn', 'hidden_dims': '[512, 128]', 'dropout': 0.2730591362812328, 'batch_norm': False, 'lr': 0.00014209001818834562, 'weight_decay': 2.94029604852398e-07, 'epochs': 233, 'loss': 'mae', 'optimizer': 'adam', 'graph_mode': 'off', 'use_snp_selection': False}. Best is trial 28 with value: 0.08347084095638742.
[I 2025-11-03 12:40:41,258] Trial 52 finished with value: 0.053314203349141734 and parameters: {'model_type': 'gcn', 'hidden_dims': '[512, 128]', 'dropout': 0.2649036362809279, 'batch_norm': False, 'lr': 1.0921708743861942e-06, 'weight_decay': 5.938943440106139e-07, 'epochs': 203, 'loss': 'mae', 'optimizer': 'adam', 'graph_mode': 'off', 'use_snp_selection': False}. Best is trial 28 with value: 0.08347084095638742.
[I 2025-11-03 12:40:44,364] Trial 53 finished with value: 0.07908966068732516 and parameters: {'model_type': 'gcn', 'hidden_dims': '[512, 128]', 'dropout': 0.31723315829765286, 'batch_norm': False, 'lr': 0.00019821005372428502, 'weight_decay': 4.282885421352401e-07, 'epochs': 288, 'loss': 'mae', 'optimizer': 'adam', 'graph_mode': 'off', 'use_snp_selection': False}. Best is trial 28 with value: 0.08347084095638742.
[I 2025-11-03 12:40:47,415] Trial 54 finished with value: 0.06791427032163018 and parameters: {'model_type': 'gcn', 'hidden_dims': '[512, 128]', 'dropout': 0.31613500932101124, 'batch_norm': False, 'lr': 0.00023003401494532753, 'weight_decay': 1.3206308732246024e-06, 'epochs': 284, 'loss': 'mae', 'optimizer': 'adam', 'graph_mode': 'off', 'use_snp_selection': False}. Best is trial 28 with value: 0.08347084095638742.
[I 2025-11-03 12:40:50,539] Trial 55 finished with value: 0.05010210058235649 and parameters: {'model_type': 'gcn', 'hidden_dims': '[512, 128]', 'dropout': 0.3666438988645417, 'batch_norm': False, 'lr': 0.0005419870218147941, 'weight_decay': 9.17275189662429e-07, 'epochs': 296, 'loss': 'mae', 'optimizer': 'adam', 'graph_mode': 'off', 'use_snp_selection': False}. Best is trial 28 with value: 0.08347084095638742.
[I 2025-11-03 12:40:52,075] Trial 56 finished with value: 0.06676532277315994 and parameters: {'model_type': 'gcn', 'hidden_dims': '[128, 64]', 'dropout': 0.449810222978798, 'batch_norm': False, 'lr': 3.247358176012499e-05, 'weight_decay': 5.192134235288107e-07, 'epochs': 321, 'loss': 'mae', 'optimizer': 'adam', 'graph_mode': 'off', 'use_snp_selection': False}. Best is trial 28 with value: 0.08347084095638742.
[I 2025-11-03 12:40:54,628] Trial 57 finished with value: 0.06566434872584638 and parameters: {'model_type': 'gcn', 'hidden_dims': '[256, 128, 64]', 'dropout': 0.1503846173782146, 'batch_norm': True, 'lr': 6.866003597243274e-05, 'weight_decay': 3.182179003395455e-07, 'epochs': 334, 'loss': 'mse', 'optimizer': 'adam', 'graph_mode': 'off', 'use_snp_selection': False}. Best is trial 28 with value: 0.08347084095638742.
[I 2025-11-03 12:40:56,878] Trial 58 finished with value: 0.06837163035299582 and parameters: {'model_type': 'gcn', 'hidden_dims': '[512, 256]', 'dropout': 0.4056974487224328, 'batch_norm': True, 'lr': 0.0009799246477861568, 'weight_decay': 1.35791760299961e-07, 'epochs': 182, 'loss': 'mae', 'optimizer': 'adam', 'graph_mode': 'off', 'use_snp_selection': False}. Best is trial 28 with value: 0.08347084095638742.
[I 2025-11-03 12:40:59,812] Trial 59 finished with value: 0.08758940275051783 and parameters: {'model_type': 'gcn', 'hidden_dims': '[512, 128]', 'dropout': 0.23192301044315103, 'batch_norm': False, 'lr': 0.00018832375289181598, 'weight_decay': 7.880215732164159e-07, 'epochs': 272, 'loss': 'mse', 'optimizer': 'adam', 'graph_mode': 'off', 'use_snp_selection': False}. Best is trial 59 with value: 0.08758940275051783.
[I 2025-11-03 12:41:02,834] Trial 60 finished with value: 0.06855794011811583 and parameters: {'model_type': 'gcn', 'hidden_dims': '[512, 128]', 'dropout': 0.33794664277484165, 'batch_norm': False, 'lr': 0.0003335233392968043, 'weight_decay': 1.1905827544071596e-06, 'epochs': 285, 'loss': 'mae', 'optimizer': 'adam', 'graph_mode': 'off', 'use_snp_selection': False}. Best is trial 59 with value: 0.08758940275051783.
