[I 2025-11-12 12:03:52,954] Trial 18 finished with value: 0.24214456737688575 and parameters: {'model_type': 'graphsage', 'hidden_dims': '[256, 128]', 'dropout': 0.1913821980352725, 'batch_norm': False, 'lr': 2.2465963456090454e-05, 'weight_decay': 1.2185824617217162e-06, 'epochs': 138, 'loss': 'mae', 'optimizer': 'adam', 'graph_mode': 'knn', 'source': 'grm', 'knn_k': 10, 'weighted_edges': False, 'symmetrize_mode': 'mutual', 'use_snp_selection': True, 'num_snps': 37415}. Best is trial 15 with value: 0.24590502067261824.
[I 2025-11-12 12:06:55,753] Trial 19 finished with value: 0.20951819820693326 and parameters: {'model_type': 'graphsage', 'hidden_dims': '[256, 128, 64]', 'dropout': 0.46954416037136953, 'batch_norm': False, 'lr': 0.00016420571218832427, 'weight_decay': 0.0006216982449466464, 'epochs': 309, 'loss': 'mae', 'optimizer': 'adam', 'graph_mode': 'knn', 'source': 'grm', 'knn_k': 3, 'weighted_edges': False, 'symmetrize_mode': 'union', 'use_snp_selection': True, 'num_snps': 37351}. Best is trial 15 with value: 0.24590502067261824.
[I 2025-11-12 12:07:50,318] Trial 20 finished with value: 0.2087213406635219 and parameters: {'model_type': 'graphsage', 'hidden_dims': '[512, 128]', 'dropout': 0.22053645767263116, 'batch_norm': False, 'lr': 3.93692482201822e-06, 'weight_decay': 1.0256949837567505e-07, 'epochs': 100, 'loss': 'mae', 'optimizer': 'adam', 'graph_mode': 'knn', 'source': 'grm', 'knn_k': 8, 'weighted_edges': False, 'symmetrize_mode': 'mutual', 'use_snp_selection': True, 'num_snps': 5460}. Best is trial 15 with value: 0.24590502067261824.
[I 2025-11-12 12:10:17,455] Trial 21 finished with value: 0.22899126947249862 and parameters: {'model_type': 'graphsage', 'hidden_dims': '[256, 128]', 'dropout': 0.1520617032610564, 'batch_norm': False, 'lr': 1.8545682679093075e-05, 'weight_decay': 1.3596528607720949e-06, 'epochs': 147, 'loss': 'mae', 'optimizer': 'adam', 'graph_mode': 'knn', 'source': 'grm', 'knn_k': 10, 'weighted_edges': False, 'symmetrize_mode': 'mutual', 'use_snp_selection': True, 'num_snps': 39604}. Best is trial 15 with value: 0.24590502067261824.
[I 2025-11-12 12:11:52,693] Trial 22 finished with value: 0.23501728980777478 and parameters: {'model_type': 'graphsage', 'hidden_dims': '[256, 128]', 'dropout': 0.1814744209077171, 'batch_norm': False, 'lr': 4.9119438776848604e-05, 'weight_decay': 1.1376350683959151e-06, 'epochs': 134, 'loss': 'mae', 'optimizer': 'adam', 'graph_mode': 'knn', 'source': 'grm', 'knn_k': 9, 'weighted_edges': False, 'symmetrize_mode': 'mutual', 'use_snp_selection': True, 'num_snps': 26209}. Best is trial 15 with value: 0.24590502067261824.
[I 2025-11-12 12:14:01,948] Trial 23 finished with value: 0.23310168338092158 and parameters: {'model_type': 'graphsage', 'hidden_dims': '[256, 128]', 'dropout': 0.28787210035699284, 'batch_norm': False, 'lr': 1.8631218133208407e-05, 'weight_decay': 4.914926911114837e-06, 'epochs': 177, 'loss': 'mae', 'optimizer': 'adam', 'graph_mode': 'knn', 'source': 'grm', 'knn_k': 5, 'weighted_edges': False, 'symmetrize_mode': 'mutual', 'use_snp_selection': True, 'num_snps': 39515}. Best is trial 15 with value: 0.24590502067261824.
[I 2025-11-12 12:18:27,333] Trial 24 finished with value: 0.24202137979581212 and parameters: {'model_type': 'graphsage', 'hidden_dims': '[256, 128]', 'dropout': 0.3353718581415941, 'batch_norm': False, 'lr': 9.745539980203566e-06, 'weight_decay': 2.756183718340635e-07, 'epochs': 212, 'loss': 'mae', 'optimizer': 'adam', 'graph_mode': 'knn', 'source': 'grm', 'knn_k': 10, 'weighted_edges': False, 'symmetrize_mode': 'mutual', 'use_snp_selection': True, 'num_snps': 52530}. Best is trial 15 with value: 0.24590502067261824.
[I 2025-11-12 12:20:05,766] Trial 25 finished with value: 0.23777603816647255 and parameters: {'model_type': 'graphsage', 'hidden_dims': '[256, 128]', 'dropout': 0.23702867664321658, 'batch_norm': False, 'lr': 3.530959569476962e-05, 'weight_decay': 9.04936246058431e-07, 'epochs': 100, 'loss': 'mae', 'optimizer': 'adam', 'graph_mode': 'knn', 'source': 'grm', 'knn_k': 8, 'weighted_edges': False, 'symmetrize_mode': 'mutual', 'use_snp_selection': True, 'num_snps': 32931}. Best is trial 15 with value: 0.24590502067261824.
[I 2025-11-12 12:22:51,426] Trial 26 finished with value: 0.207177736566804 and parameters: {'model_type': 'graphsage', 'hidden_dims': '[256, 128]', 'dropout': 0.377520482545004, 'batch_norm': True, 'lr': 7.691421943796944e-05, 'weight_decay': 7.21735731213039e-06, 'epochs': 164, 'loss': 'mse', 'optimizer': 'adam', 'graph_mode': 'knn', 'source': 'grm', 'knn_k': 9, 'weighted_edges': True, 'symmetrize_mode': 'union', 'use_snp_selection': False}. Best is trial 15 with value: 0.24590502067261824.
[I 2025-11-12 12:24:49,941] Trial 27 finished with value: 0.24890724959693297 and parameters: {'model_type': 'graphsage', 'hidden_dims': '[256, 128]', 'dropout': 0.26757411280169435, 'batch_norm': False, 'lr': 0.00024400741282454608, 'weight_decay': 2.4048218354983645e-06, 'epochs': 204, 'loss': 'mae', 'optimizer': 'adam', 'graph_mode': 'knn', 'source': 'grm', 'knn_k': 2, 'weighted_edges': False, 'symmetrize_mode': 'mutual', 'use_snp_selection': True, 'num_snps': 42002}. Best is trial 27 with value: 0.24890724959693297.
[I 2025-11-12 12:27:01,822] Trial 28 finished with value: 0.21837501819087063 and parameters: {'model_type': 'graphsage', 'hidden_dims': '[256, 128, 64]', 'dropout': 0.3123816300900517, 'batch_norm': False, 'lr': 0.0002134225036637538, 'weight_decay': 3.014582074211409e-06, 'epochs': 241, 'loss': 'mae', 'optimizer': 'adam', 'graph_mode': 'knn', 'source': 'grm', 'knn_k': 2, 'weighted_edges': False, 'symmetrize_mode': 'mutual', 'use_snp_selection': True, 'num_snps': 43523}. Best is trial 27 with value: 0.24890724959693297.
[I 2025-11-12 12:30:23,553] Trial 29 finished with value: 0.12239389128677969 and parameters: {'model_type': 'graphsage', 'hidden_dims': '[512, 128]', 'dropout': 0.26550671841361545, 'batch_norm': True, 'lr': 1.0893781950163453e-06, 'weight_decay': 0.0001388436987570473, 'epochs': 279, 'loss': 'mae', 'optimizer': 'adam', 'graph_mode': 'knn', 'source': 'grm', 'knn_k': 2, 'weighted_edges': False, 'symmetrize_mode': 'mutual', 'use_snp_selection': False}. Best is trial 27 with value: 0.24890724959693297.
[I 2025-11-12 12:34:04,489] Trial 30 finished with value: 0.10708239388503402 and parameters: {'model_type': 'graphsage', 'hidden_dims': '[128, 64]', 'dropout': 0.43693704038073217, 'batch_norm': False, 'lr': 0.0003037086527840924, 'weight_decay': 1.1931215993700127e-05, 'epochs': 343, 'loss': 'mae', 'optimizer': 'adam', 'graph_mode': 'knn', 'source': 'grm', 'knn_k': 5, 'weighted_edges': True, 'symmetrize_mode': 'mutual', 'use_snp_selection': True, 'num_snps': 52718}. Best is trial 27 with value: 0.24890724959693297.
[I 2025-11-12 12:36:04,180] Trial 31 finished with value: 0.21656887996205723 and parameters: {'model_type': 'graphsage', 'hidden_dims': '[256, 128]', 'dropout': 0.19459928039205787, 'batch_norm': False, 'lr': 0.00012175204638762452, 'weight_decay': 1.3883894851928925e-06, 'epochs': 203, 'loss': 'mae', 'optimizer': 'adam', 'graph_mode': 'knn', 'source': 'grm', 'knn_k': 2, 'weighted_edges': False, 'symmetrize_mode': 'mutual', 'use_snp_selection': True, 'num_snps': 42473}. Best is trial 27 with value: 0.24890724959693297.
[I 2025-11-12 12:37:27,323] Trial 32 finished with value: 0.18856242127280687 and parameters: {'model_type': 'graphsage', 'hidden_dims': '[256, 128]', 'dropout': 0.17134904461428077, 'batch_norm': False, 'lr': 0.0008145111648726696, 'weight_decay': 2.1789134212735805e-06, 'epochs': 131, 'loss': 'mae', 'optimizer': 'adam', 'graph_mode': 'knn', 'source': 'grm', 'knn_k': 1, 'weighted_edges': False, 'symmetrize_mode': 'mutual', 'use_snp_selection': True, 'num_snps': 32737}. Best is trial 27 with value: 0.24890724959693297.
[I 2025-11-12 12:39:52,878] Trial 33 finished with value: 0.2396772742672431 and parameters: {'model_type': 'graphsage', 'hidden_dims': '[256, 128]', 'dropout': 0.21686740229040952, 'batch_norm': False, 'lr': 3.8064906068482273e-05, 'weight_decay': 3.8420618258138287e-07, 'epochs': 176, 'loss': 'mae', 'optimizer': 'adam', 'graph_mode': 'knn', 'source': 'grm', 'knn_k': 9, 'weighted_edges': False, 'symmetrize_mode': 'mutual', 'use_snp_selection': True, 'num_snps': 35712}. Best is trial 27 with value: 0.24890724959693297.
[I 2025-11-12 12:41:21,034] Trial 34 finished with value: 0.2186418774642327 and parameters: {'model_type': 'graphsage', 'hidden_dims': '[256, 128]', 'dropout': 0.394193001175609, 'batch_norm': False, 'lr': 2.43254422207519e-05, 'weight_decay': 3.870997369681199e-06, 'epochs': 81, 'loss': 'mse', 'optimizer': 'adam', 'graph_mode': 'knn', 'source': 'grm', 'knn_k': 3, 'weighted_edges': False, 'symmetrize_mode': 'mutual', 'use_snp_selection': True, 'num_snps': 41793}. Best is trial 27 with value: 0.24890724959693297.
[I 2025-11-12 12:44:20,190] Trial 35 finished with value: 0.04607285322254275 and parameters: {'model_type': 'graphsage', 'hidden_dims': '[128, 64]', 'dropout': 0.3471704122733287, 'batch_norm': False, 'lr': 0.0005872910071825134, 'weight_decay': 1.7551872000223493e-06, 'epochs': 150, 'loss': 'mae', 'optimizer': 'adam', 'graph_mode': 'knn', 'source': 'grm', 'knn_k': 6, 'weighted_edges': False, 'symmetrize_mode': 'union', 'use_snp_selection': True, 'num_snps': 49665}. Best is trial 27 with value: 0.24890724959693297.
[I 2025-11-12 12:46:02,543] Trial 36 finished with value: 0.21213615990433018 and parameters: {'model_type': 'graphsage', 'hidden_dims': '[256, 128]', 'dropout': 0.2790617343637257, 'batch_norm': True, 'lr': 7.385442247480018e-05, 'weight_decay': 7.396823407044747e-07, 'epochs': 195, 'loss': 'mse', 'optimizer': 'adam', 'graph_mode': 'knn', 'source': 'grm', 'knn_k': 4, 'weighted_edges': False, 'symmetrize_mode': 'mutual', 'use_snp_selection': False}. Best is trial 27 with value: 0.24890724959693297.
[I 2025-11-12 12:47:33,315] Trial 37 finished with value: 0.23914188400427347 and parameters: {'model_type': 'graphsage', 'hidden_dims': '[256, 128]', 'dropout': 0.24887624869327885, 'batch_norm': False, 'lr': 0.00017680127036891349, 'weight_decay': 1.9668859459517633e-07, 'epochs': 121, 'loss': 'mae', 'optimizer': 'adam', 'graph_mode': 'knn', 'source': 'grm', 'knn_k': 7, 'weighted_edges': False, 'symmetrize_mode': 'mutual', 'use_snp_selection': True, 'num_snps': 27811}. Best is trial 27 with value: 0.24890724959693297.
[I 2025-11-12 12:50:01,489] Trial 38 finished with value: 0.22274827821961107 and parameters: {'model_type': 'graphsage', 'hidden_dims': '[256, 128, 64]', 'dropout': 0.1047208738371832, 'batch_norm': True, 'lr': 2.516378293932779e-05, 'weight_decay': 7.524580650736021e-06, 'epochs': 233, 'loss': 'mse', 'optimizer': 'adam', 'graph_mode': 'knn', 'source': 'grm', 'knn_k': 9, 'weighted_edges': True, 'symmetrize_mode': 'mutual', 'use_snp_selection': False}. Best is trial 27 with value: 0.24890724959693297.
[I 2025-11-12 12:51:44,927] Trial 39 finished with value: 0.2202522457051989 and parameters: {'model_type': 'graphsage', 'hidden_dims': '[512, 256]', 'dropout': 0.13374476263453355, 'batch_norm': False, 'lr': 0.000364965604584255, 'weight_decay': 3.6962962020594e-05, 'epochs': 186, 'loss': 'mae', 'optimizer': 'adam', 'graph_mode': 'knn', 'source': 'grm', 'knn_k': 2, 'weighted_edges': False, 'symmetrize_mode': 'mutual', 'use_snp_selection': True, 'num_snps': 24760}. Best is trial 27 with value: 0.24890724959693297.
[I 2025-11-12 12:53:30,885] Trial 40 finished with value: 0.2349015654427442 and parameters: {'model_type': 'graphsage', 'hidden_dims': '[128, 64]', 'dropout': 0.4917283223600363, 'batch_norm': False, 'lr': 6.172532198883255e-06, 'weight_decay': 4.191055932124248e-07, 'epochs': 164, 'loss': 'mae', 'optimizer': 'adam', 'graph_mode': 'cutoff', 'cutoff': 0.4522672743519659, 'grm_norm': 'cosine', 'self_loops': True, 'use_snp_selection': True, 'num_snps': 40030}. Best is trial 27 with value: 0.24890724959693297.
[I 2025-11-12 12:57:43,023] Trial 41 finished with value: 0.23948517995454816 and parameters: {'model_type': 'graphsage', 'hidden_dims': '[256, 128]', 'dropout': 0.3366189686437153, 'batch_norm': False, 'lr': 1.1929003234326217e-05, 'weight_decay': 2.3869779458193565e-07, 'epochs': 203, 'loss': 'mae', 'optimizer': 'adam', 'graph_mode': 'knn', 'source': 'grm', 'knn_k': 10, 'weighted_edges': False, 'symmetrize_mode': 'mutual', 'use_snp_selection': True, 'num_snps': 55433}. Best is trial 27 with value: 0.24890724959693297.
[I 2025-11-12 13:01:59,682] Trial 42 finished with value: 0.23871725360443324 and parameters: {'model_type': 'graphsage', 'hidden_dims': '[256, 128]', 'dropout': 0.30644210272126904, 'batch_norm': False, 'lr': 7.933269362126652e-06, 'weight_decay': 4.6123599986375604e-07, 'epochs': 208, 'loss': 'mae', 'optimizer': 'adam', 'graph_mode': 'knn', 'source': 'grm', 'knn_k': 10, 'weighted_edges': False, 'symmetrize_mode': 'mutual', 'use_snp_selection': True, 'num_snps': 54053}. Best is trial 27 with value: 0.24890724959693297.
[I 2025-11-12 13:04:47,482] Trial 43 finished with value: 0.24244996194195859 and parameters: {'model_type': 'graphsage', 'hidden_dims': '[256, 128]', 'dropout': 0.370484653497623, 'batch_norm': False, 'lr': 1.454479608130603e-05, 'weight_decay': 1.157089803745143e-06, 'epochs': 141, 'loss': 'mae', 'optimizer': 'adam', 'graph_mode': 'knn', 'source': 'grm', 'knn_k': 10, 'weighted_edges': False, 'symmetrize_mode': 'mutual', 'use_snp_selection': True, 'num_snps': 45583}. Best is trial 27 with value: 0.24890724959693297.
[I 2025-11-12 13:08:26,819] Trial 44 finished with value: 0.23981758471128845 and parameters: {'model_type': 'graphsage', 'hidden_dims': '[256, 128]', 'dropout': 0.40055205105267583, 'batch_norm': False, 'lr': 1.6796254855940093e-05, 'weight_decay': 1.9739867479822384e-06, 'epochs': 139, 'loss': 'mae', 'optimizer': 'adam', 'graph_mode': 'knn', 'source': 'grm', 'knn_k': 9, 'weighted_edges': True, 'symmetrize_mode': 'union', 'use_snp_selection': True, 'num_snps': 45004}. Best is trial 27 with value: 0.24890724959693297.
[I 2025-11-12 13:11:09,584] Trial 45 finished with value: 0.23050426059421542 and parameters: {'model_type': 'graphsage', 'hidden_dims': '[512, 256]', 'dropout': 0.45946850004129736, 'batch_norm': False, 'lr': 5.146013843298688e-05, 'weight_decay': 9.170895429843889e-07, 'epochs': 117, 'loss': 'mae', 'optimizer': 'adam', 'graph_mode': 'knn', 'source': 'grm', 'knn_k': 7, 'weighted_edges': False, 'symmetrize_mode': 'mutual', 'use_snp_selection': True, 'num_snps': 46806}. Best is trial 27 with value: 0.24890724959693297.
[I 2025-11-12 13:14:42,799] Trial 46 finished with value: 0.1861154115427443 and parameters: {'model_type': 'graphsage', 'hidden_dims': '[512, 128]', 'dropout': 0.4243685106085044, 'batch_norm': True, 'lr': 4.656884163212492e-06, 'weight_decay': 1.3680170430242816e-05, 'epochs': 171, 'loss': 'mse', 'optimizer': 'adam', 'graph_mode': 'cutoff', 'cutoff': 0.24227436551491188, 'grm_norm': 'cosine_then_gcn', 'self_loops': False, 'use_snp_selection': False}. Best is trial 27 with value: 0.24890724959693297.
[I 2025-11-12 13:16:34,944] Trial 47 finished with value: 0.2529642368794975 and parameters: {'model_type': 'graphsage', 'hidden_dims': '[256, 128]', 'dropout': 0.36375412361783543, 'batch_norm': False, 'lr': 3.299235178756411e-05, 'weight_decay': 3.0305756689210146e-06, 'epochs': 108, 'loss': 'mae', 'optimizer': 'adam', 'graph_mode': 'knn', 'source': 'grm', 'knn_k': 8, 'weighted_edges': False, 'symmetrize_mode': 'mutual', 'use_snp_selection': True, 'num_snps': 37421}. Best is trial 47 with value: 0.2529642368794975.
[I 2025-11-12 13:18:15,356] Trial 48 finished with value: 0.241559920874115 and parameters: {'model_type': 'graphsage', 'hidden_dims': '[256, 128]', 'dropout': 0.36146004587234065, 'batch_norm': False, 'lr': 3.918628003623909e-05, 'weight_decay': 3.377892957759533e-06, 'epochs': 116, 'loss': 'mae', 'optimizer': 'adam', 'graph_mode': 'knn', 'source': 'grm', 'knn_k': 1, 'weighted_edges': False, 'symmetrize_mode': 'mutual', 'use_snp_selection': True, 'num_snps': 49090}. Best is trial 47 with value: 0.2529642368794975.
[I 2025-11-12 13:19:49,106] Trial 49 finished with value: 0.2491499700052513 and parameters: {'model_type': 'graphsage', 'hidden_dims': '[512, 64]', 'dropout': 0.5397371989495731, 'batch_norm': False, 'lr': 0.00010987142322835803, 'weight_decay': 5.173522942416409e-06, 'epochs': 89, 'loss': 'mae', 'optimizer': 'adam', 'graph_mode': 'cutoff', 'cutoff': 0.4411545452773006, 'grm_norm': 'gcn', 'self_loops': False, 'use_snp_selection': True, 'num_snps': 30561}. Best is trial 47 with value: 0.2529642368794975.
[I 2025-11-12 13:21:16,091] Trial 50 finished with value: 0.2518106896976255 and parameters: {'model_type': 'graphsage', 'hidden_dims': '[512, 64]', 'dropout': 0.543538183400797, 'batch_norm': False, 'lr': 0.00010616815189126099, 'weight_decay': 1.967185345919061e-05, 'epochs': 75, 'loss': 'mae', 'optimizer': 'adam', 'graph_mode': 'cutoff', 'cutoff': 0.4348636522018359, 'grm_norm': 'gcn', 'self_loops': False, 'use_snp_selection': True, 'num_snps': 29928}. Best is trial 47 with value: 0.2529642368794975.
[I 2025-11-12 13:22:41,839] Trial 51 finished with value: 0.18431608275464623 and parameters: {'model_type': 'graphsage', 'hidden_dims': '[512, 64]', 'dropout': 0.580407108844092, 'batch_norm': False, 'lr': 0.00011357831525246402, 'weight_decay': 7.838975057761602e-05, 'epochs': 69, 'loss': 'mae', 'optimizer': 'adam', 'graph_mode': 'cutoff', 'cutoff': 0.4469241396095817, 'grm_norm': 'gcn', 'self_loops': False, 'use_snp_selection': True, 'num_snps': 30991}. Best is trial 47 with value: 0.2529642368794975.
[I 2025-11-12 13:23:56,803] Trial 52 finished with value: 0.2676437601376995 and parameters: {'model_type': 'graphsage', 'hidden_dims': '[512, 64]', 'dropout': 0.5385314762692528, 'batch_norm': False, 'lr': 7.640161732915417e-05, 'weight_decay': 2.7990015211807574e-05, 'epochs': 84, 'loss': 'mae', 'optimizer': 'adam', 'graph_mode': 'cutoff', 'cutoff': 0.4292364378396683, 'grm_norm': 'gcn', 'self_loops': False, 'use_snp_selection': True, 'num_snps': 20769}. Best is trial 52 with value: 0.2676437601376995.
[I 2025-11-12 13:25:04,965] Trial 53 finished with value: 0.23942423209298114 and parameters: {'model_type': 'graphsage', 'hidden_dims': '[512, 64]', 'dropout': 0.5381064362676324, 'batch_norm': False, 'lr': 7.778892032869111e-05, 'weight_decay': 2.876461640694132e-05, 'epochs': 60, 'loss': 'mae', 'optimizer': 'adam', 'graph_mode': 'cutoff', 'cutoff': 0.424296142592819, 'grm_norm': 'gcn', 'self_loops': False, 'use_snp_selection': True, 'num_snps': 20994}. Best is trial 52 with value: 0.2676437601376995.
[I 2025-11-12 13:26:08,794] Trial 54 finished with value: 0.24759990362682274 and parameters: {'model_type': 'graphsage', 'hidden_dims': '[512, 64]', 'dropout': 0.5423918631220774, 'batch_norm': False, 'lr': 0.00022855023227164118, 'weight_decay': 2.018961213393306e-05, 'epochs': 84, 'loss': 'mae', 'optimizer': 'adam', 'graph_mode': 'cutoff', 'cutoff': 0.542812252740338, 'grm_norm': 'gcn', 'self_loops': False, 'use_snp_selection': True, 'num_snps': 16327}. Best is trial 52 with value: 0.2676437601376995.
[I 2025-11-12 13:27:13,645] Trial 55 finished with value: 0.2134604074481829 and parameters: {'model_type': 'graphsage', 'hidden_dims': '[512, 64]', 'dropout': 0.5506684080098789, 'batch_norm': False, 'lr': 0.00024187555893213686, 'weight_decay': 1.623165063432291e-05, 'epochs': 85, 'loss': 'mae', 'optimizer': 'adam', 'graph_mode': 'cutoff', 'cutoff': 0.5436092150898417, 'grm_norm': 'gcn', 'self_loops': False, 'use_snp_selection': True, 'num_snps': 16793}. Best is trial 52 with value: 0.2676437601376995.
[I 2025-11-12 13:28:05,419] Trial 56 finished with value: 0.24542726620440694 and parameters: {'model_type': 'graphsage', 'hidden_dims': '[512, 64]', 'dropout': 0.5201844138175619, 'batch_norm': False, 'lr': 0.0001451409769872206, 'weight_decay': 4.357457994946096e-05, 'epochs': 40, 'loss': 'mae', 'optimizer': 'adam', 'graph_mode': 'cutoff', 'cutoff': 0.5345051855682764, 'grm_norm': 'gcn', 'self_loops': False, 'use_snp_selection': True, 'num_snps': 10152}. Best is trial 52 with value: 0.2676437601376995.
[I 2025-11-12 13:29:08,853] Trial 57 finished with value: 0.23858649765997617 and parameters: {'model_type': 'graphsage', 'hidden_dims': '[512, 64]', 'dropout': 0.5645584022790484, 'batch_norm': False, 'lr': 0.00019737036468220676, 'weight_decay': 0.00010376554453665674, 'epochs': 79, 'loss': 'mae', 'optimizer': 'adam', 'graph_mode': 'cutoff', 'cutoff': 0.349548637992526, 'grm_norm': 'gcn', 'self_loops': False, 'use_snp_selection': True, 'num_snps': 14041}. Best is trial 52 with value: 0.2676437601376995.
[I 2025-11-12 13:30:27,942] Trial 58 finished with value: 0.08498111317028242 and parameters: {'model_type': 'graphsage', 'hidden_dims': '[512, 64]', 'dropout': 0.4952617313607705, 'batch_norm': False, 'lr': 0.00043017669145768733, 'weight_decay': 2.158769226244754e-05, 'epochs': 95, 'loss': 'mae', 'optimizer': 'adam', 'graph_mode': 'cutoff', 'cutoff': 0.47481488277891015, 'grm_norm': 'gcn', 'self_loops': False, 'use_snp_selection': True, 'num_snps': 22557}. Best is trial 52 with value: 0.2676437601376995.
[I 2025-11-12 13:32:08,116] Trial 59 finished with value: 0.24440922871063647 and parameters: {'model_type': 'graphsage', 'hidden_dims': '[512, 64]', 'dropout': 0.5971184262880986, 'batch_norm': False, 'lr': 9.227943729997997e-05, 'weight_decay': 8.830909113029847e-06, 'epochs': 106, 'loss': 'mae', 'optimizer': 'adam', 'graph_mode': 'cutoff', 'cutoff': 0.3741915797324387, 'grm_norm': 'gcn', 'self_loops': False, 'use_snp_selection': True, 'num_snps': 28895}. Best is trial 52 with value: 0.2676437601376995.
