[I 2025-11-03 12:19:44,455] Trial 115 finished with value: 0.13059990804311897 and parameters: {'model_type': 'gcn', 'hidden_dims': '[512, 64]', 'dropout': 0.4684148730226558, 'batch_norm': True, 'lr': 0.000880448777701372, 'weight_decay': 1.2650891539717065e-07, 'epochs': 339, 'loss': 'mse', 'optimizer': 'adam', 'graph_mode': 'cutoff', 'cutoff': 0.7190850719375538, 'grm_norm': 'cosine', 'self_loops': False, 'use_snp_selection': False}. Best is trial 32 with value: 0.1359998317137015.
[I 2025-11-03 12:19:48,105] Trial 116 finished with value: 0.10739094649754898 and parameters: {'model_type': 'gcn', 'hidden_dims': '[512, 64]', 'dropout': 0.48308627410134775, 'batch_norm': True, 'lr': 0.0008862673597921185, 'weight_decay': 1.9460996128625916e-07, 'epochs': 317, 'loss': 'mse', 'optimizer': 'adam', 'graph_mode': 'knn', 'source': 'grm', 'knn_k': 5, 'weighted_edges': True, 'symmetrize_mode': 'mutual', 'use_snp_selection': False}. Best is trial 32 with value: 0.1359998317137015.
[I 2025-11-03 12:19:50,894] Trial 117 finished with value: 0.11658794781098053 and parameters: {'model_type': 'gcn', 'hidden_dims': '[512, 64]', 'dropout': 0.4698385448982306, 'batch_norm': True, 'lr': 0.0007320295246664944, 'weight_decay': 1.2507126257819305e-07, 'epochs': 208, 'loss': 'mse', 'optimizer': 'adam', 'graph_mode': 'cutoff', 'cutoff': 0.7716748009818549, 'grm_norm': 'cosine', 'self_loops': False, 'use_snp_selection': False}. Best is trial 32 with value: 0.1359998317137015.
[I 2025-11-03 12:19:53,058] Trial 118 finished with value: 0.03159104366545539 and parameters: {'model_type': 'gcn', 'hidden_dims': '[512, 64]', 'dropout': 0.4591328906548059, 'batch_norm': False, 'lr': 0.0008448642046452543, 'weight_decay': 1.0153376963653067e-07, 'epochs': 335, 'loss': 'mae', 'optimizer': 'adam', 'graph_mode': 'knn', 'source': 'grm', 'knn_k': 5, 'weighted_edges': False, 'symmetrize_mode': 'mutual', 'use_snp_selection': True, 'num_snps': 2377}. Best is trial 32 with value: 0.1359998317137015.
[I 2025-11-03 12:19:56,871] Trial 119 finished with value: 0.10627747753613734 and parameters: {'model_type': 'gcn', 'hidden_dims': '[512, 64]', 'dropout': 0.42561323482868413, 'batch_norm': True, 'lr': 0.0004637205451593769, 'weight_decay': 1.968929058206551e-05, 'epochs': 339, 'loss': 'mse', 'optimizer': 'adam', 'graph_mode': 'cutoff', 'cutoff': 0.7181227108783963, 'grm_norm': 'cosine', 'self_loops': True, 'use_snp_selection': False}. Best is trial 32 with value: 0.1359998317137015.
[I 2025-11-03 12:20:00,319] Trial 120 finished with value: 0.11689241108106775 and parameters: {'model_type': 'gcn', 'hidden_dims': '[512, 128]', 'dropout': 0.4435954531719854, 'batch_norm': True, 'lr': 0.000512364567806895, 'weight_decay': 0.00016390027196648793, 'epochs': 298, 'loss': 'mse', 'optimizer': 'adam', 'graph_mode': 'cutoff', 'cutoff': 0.896632852557407, 'grm_norm': 'cosine', 'self_loops': False, 'use_snp_selection': False}. Best is trial 32 with value: 0.1359998317137015.
[I 2025-11-03 12:20:02,615] Trial 121 finished with value: 0.10985706171225174 and parameters: {'model_type': 'gcn', 'hidden_dims': '[256, 128, 64]', 'dropout': 0.413971885900874, 'batch_norm': True, 'lr': 0.0006599028172176306, 'weight_decay': 2.474944611049756e-07, 'epochs': 197, 'loss': 'mse', 'optimizer': 'adam', 'graph_mode': 'cutoff', 'cutoff': 0.8208917147299821, 'grm_norm': 'cosine_then_gcn', 'self_loops': False, 'use_snp_selection': False}. Best is trial 32 with value: 0.1359998317137015.
[I 2025-11-03 12:20:05,670] Trial 122 finished with value: 0.1274099080147511 and parameters: {'model_type': 'gcn', 'hidden_dims': '[512, 256]', 'dropout': 0.49967200262765543, 'batch_norm': True, 'lr': 0.0005991828709658515, 'weight_decay': 1.6754002279438482e-07, 'epochs': 242, 'loss': 'mse', 'optimizer': 'adam', 'graph_mode': 'cutoff', 'cutoff': 0.6050578080207146, 'grm_norm': 'cosine', 'self_loops': False, 'use_snp_selection': False}. Best is trial 32 with value: 0.1359998317137015.
[I 2025-11-03 12:20:08,687] Trial 123 finished with value: 0.12311290905681307 and parameters: {'model_type': 'gcn', 'hidden_dims': '[512, 256]', 'dropout': 0.4961449961921465, 'batch_norm': True, 'lr': 0.0007628086576096546, 'weight_decay': 1.8347989167363826e-07, 'epochs': 238, 'loss': 'mse', 'optimizer': 'adam', 'graph_mode': 'cutoff', 'cutoff': 0.7422604320390392, 'grm_norm': 'cosine', 'self_loops': False, 'use_snp_selection': False}. Best is trial 32 with value: 0.1359998317137015.
[I 2025-11-03 12:20:11,849] Trial 124 finished with value: 0.12045748822493091 and parameters: {'model_type': 'gcn', 'hidden_dims': '[512, 256]', 'dropout': 0.5036801500384707, 'batch_norm': True, 'lr': 0.0007383655478189337, 'weight_decay': 1.6234684762133625e-07, 'epochs': 258, 'loss': 'mse', 'optimizer': 'adam', 'graph_mode': 'cutoff', 'cutoff': 0.7391216751163612, 'grm_norm': 'cosine', 'self_loops': False, 'use_snp_selection': False}. Best is trial 32 with value: 0.1359998317137015.
[I 2025-11-03 12:20:14,846] Trial 125 finished with value: 0.12624483007271398 and parameters: {'model_type': 'gcn', 'hidden_dims': '[512, 256]', 'dropout': 0.4964350413821953, 'batch_norm': True, 'lr': 0.0008711992344166635, 'weight_decay': 1.3347839188613386e-07, 'epochs': 235, 'loss': 'mse', 'optimizer': 'adam', 'graph_mode': 'cutoff', 'cutoff': 0.7847089243170986, 'grm_norm': 'cosine', 'self_loops': False, 'use_snp_selection': False}. Best is trial 32 with value: 0.1359998317137015.
[I 2025-11-03 12:20:17,951] Trial 126 finished with value: 0.1092904066986903 and parameters: {'model_type': 'gcn', 'hidden_dims': '[512, 256]', 'dropout': 0.5115983418864696, 'batch_norm': True, 'lr': 0.000838796451273299, 'weight_decay': 1.2538936722174668e-07, 'epochs': 249, 'loss': 'mse', 'optimizer': 'adam', 'graph_mode': 'cutoff', 'cutoff': 0.6708551590432925, 'grm_norm': 'cosine', 'self_loops': False, 'use_snp_selection': False}. Best is trial 32 with value: 0.1359998317137015.
[I 2025-11-03 12:20:20,828] Trial 127 finished with value: 0.12221521233512084 and parameters: {'model_type': 'gcn', 'hidden_dims': '[512, 256]', 'dropout': 0.48438791002763465, 'batch_norm': True, 'lr': 0.0008913080470037057, 'weight_decay': 2.2826900710436265e-07, 'epochs': 219, 'loss': 'mse', 'optimizer': 'adam', 'graph_mode': 'cutoff', 'cutoff': 0.7799307264707817, 'grm_norm': 'cosine', 'self_loops': False, 'use_snp_selection': False}. Best is trial 32 with value: 0.1359998317137015.
[I 2025-11-03 12:20:23,764] Trial 128 finished with value: 0.1351505573861305 and parameters: {'model_type': 'gcn', 'hidden_dims': '[512, 64]', 'dropout': 0.5272947471073882, 'batch_norm': True, 'lr': 0.0006405318166916876, 'weight_decay': 1.4620082420329788e-07, 'epochs': 228, 'loss': 'mse', 'optimizer': 'adam', 'graph_mode': 'cutoff', 'cutoff': 0.84848774540896, 'grm_norm': 'cosine', 'self_loops': False, 'use_snp_selection': False}. Best is trial 32 with value: 0.1359998317137015.
[I 2025-11-03 12:20:26,779] Trial 129 finished with value: 0.09360485737402172 and parameters: {'model_type': 'gcn', 'hidden_dims': '[512, 256]', 'dropout': 0.5362295166843914, 'batch_norm': True, 'lr': 0.00013294284383733417, 'weight_decay': 1.3704648454192562e-07, 'epochs': 236, 'loss': 'mae', 'optimizer': 'adam', 'graph_mode': 'cutoff', 'cutoff': 0.7997788530937421, 'grm_norm': 'cosine', 'self_loops': False, 'use_snp_selection': False}. Best is trial 32 with value: 0.1359998317137015.
[I 2025-11-03 12:20:29,745] Trial 130 finished with value: 0.11846620277729314 and parameters: {'model_type': 'gcn', 'hidden_dims': '[512, 256]', 'dropout': 0.5281215029822808, 'batch_norm': True, 'lr': 0.0009967795721044126, 'weight_decay': 1.7848378801964476e-07, 'epochs': 231, 'loss': 'mse', 'optimizer': 'adam', 'graph_mode': 'cutoff', 'cutoff': 0.838271403890219, 'grm_norm': 'cosine', 'self_loops': False, 'use_snp_selection': False}. Best is trial 32 with value: 0.1359998317137015.
[I 2025-11-03 12:20:32,662] Trial 131 finished with value: 0.11506745510229854 and parameters: {'model_type': 'gcn', 'hidden_dims': '[512, 64]', 'dropout': 0.5199848085751814, 'batch_norm': True, 'lr': 0.0006220130408233179, 'weight_decay': 2.895656234634267e-07, 'epochs': 225, 'loss': 'mse', 'optimizer': 'adam', 'graph_mode': 'cutoff', 'cutoff': 0.8547305494769101, 'grm_norm': 'cosine', 'self_loops': False, 'use_snp_selection': False}. Best is trial 32 with value: 0.1359998317137015.
[I 2025-11-03 12:20:35,497] Trial 132 finished with value: 0.117641729456684 and parameters: {'model_type': 'gcn', 'hidden_dims': '[512, 64]', 'dropout': 0.5094638539504475, 'batch_norm': True, 'lr': 0.0006674543484594586, 'weight_decay': 1.0232924603346288e-07, 'epochs': 214, 'loss': 'mse', 'optimizer': 'adam', 'graph_mode': 'cutoff', 'cutoff': 0.8747137186601102, 'grm_norm': 'cosine', 'self_loops': False, 'use_snp_selection': False}. Best is trial 32 with value: 0.1359998317137015.
[I 2025-11-03 12:20:38,534] Trial 133 finished with value: 0.12994818858437532 and parameters: {'model_type': 'gcn', 'hidden_dims': '[512, 64]', 'dropout': 0.49540372891605716, 'batch_norm': True, 'lr': 0.00039063302616082544, 'weight_decay': 1.4172603464407006e-07, 'epochs': 242, 'loss': 'mse', 'optimizer': 'adam', 'graph_mode': 'cutoff', 'cutoff': 0.819064580459431, 'grm_norm': 'gcn', 'self_loops': False, 'use_snp_selection': False}. Best is trial 32 with value: 0.1359998317137015.
[I 2025-11-03 12:20:41,652] Trial 134 finished with value: 0.11488045892925647 and parameters: {'model_type': 'gcn', 'hidden_dims': '[512, 64]', 'dropout': 0.49319591855458544, 'batch_norm': True, 'lr': 0.00036695374264404727, 'weight_decay': 1.4308731226581036e-07, 'epochs': 252, 'loss': 'mse', 'optimizer': 'adam', 'graph_mode': 'cutoff', 'cutoff': 0.801200436060617, 'grm_norm': 'gcn', 'self_loops': False, 'use_snp_selection': False}. Best is trial 32 with value: 0.1359998317137015.
[I 2025-11-03 12:20:44,690] Trial 135 finished with value: 0.127324951735648 and parameters: {'model_type': 'gcn', 'hidden_dims': '[512, 64]', 'dropout': 0.4813254712979954, 'batch_norm': True, 'lr': 0.0008403074985749135, 'weight_decay': 2.0922851934327604e-07, 'epochs': 241, 'loss': 'mse', 'optimizer': 'adam', 'graph_mode': 'cutoff', 'cutoff': 0.7629429247029258, 'grm_norm': 'gcn', 'self_loops': False, 'use_snp_selection': False}. Best is trial 32 with value: 0.1359998317137015.
[I 2025-11-03 12:20:47,750] Trial 136 finished with value: 0.10799508561799485 and parameters: {'model_type': 'gcn', 'hidden_dims': '[512, 64]', 'dropout': 0.4854040872034996, 'batch_norm': True, 'lr': 0.0005442419266840905, 'weight_decay': 2.215968094844875e-07, 'epochs': 244, 'loss': 'mse', 'optimizer': 'adam', 'graph_mode': 'cutoff', 'cutoff': 0.7647963867571025, 'grm_norm': 'gcn', 'self_loops': False, 'use_snp_selection': False}. Best is trial 32 with value: 0.1359998317137015.
[I 2025-11-03 12:20:50,767] Trial 137 finished with value: 0.12747035711509608 and parameters: {'model_type': 'gcn', 'hidden_dims': '[512, 64]', 'dropout': 0.47420243002105933, 'batch_norm': True, 'lr': 0.00040857300874622783, 'weight_decay': 1.2704974136878994e-07, 'epochs': 239, 'loss': 'mse', 'optimizer': 'adam', 'graph_mode': 'cutoff', 'cutoff': 0.8272845839708458, 'grm_norm': 'gcn', 'self_loops': False, 'use_snp_selection': False}. Best is trial 32 with value: 0.1359998317137015.
[I 2025-11-03 12:20:53,796] Trial 138 finished with value: 0.10962560892618546 and parameters: {'model_type': 'gcn', 'hidden_dims': '[512, 64]', 'dropout': 0.4642718860512654, 'batch_norm': True, 'lr': 0.00041715326775936006, 'weight_decay': 1.2300713211638808e-07, 'epochs': 241, 'loss': 'mse', 'optimizer': 'adam', 'graph_mode': 'cutoff', 'cutoff': 0.8262827907607618, 'grm_norm': 'gcn', 'self_loops': False, 'use_snp_selection': False}. Best is trial 32 with value: 0.1359998317137015.
[I 2025-11-03 12:20:56,745] Trial 139 finished with value: 0.10075674993813646 and parameters: {'model_type': 'gcn', 'hidden_dims': '[512, 64]', 'dropout': 0.47579254998954024, 'batch_norm': True, 'lr': 0.00021235354583376936, 'weight_decay': 1.581816605841454e-07, 'epochs': 229, 'loss': 'mse', 'optimizer': 'adam', 'graph_mode': 'cutoff', 'cutoff': 0.7807955482176355, 'grm_norm': 'gcn', 'self_loops': False, 'use_snp_selection': False}. Best is trial 32 with value: 0.1359998317137015.
[I 2025-11-03 12:20:59,990] Trial 140 finished with value: 0.10486672018858272 and parameters: {'model_type': 'gcn', 'hidden_dims': '[512, 64]', 'dropout': 0.45556992615834524, 'batch_norm': True, 'lr': 0.0006245647390727947, 'weight_decay': 1.1626490464821719e-07, 'epochs': 264, 'loss': 'mse', 'optimizer': 'adam', 'graph_mode': 'cutoff', 'cutoff': 0.7225531205110244, 'grm_norm': 'gcn', 'self_loops': False, 'use_snp_selection': False}. Best is trial 32 with value: 0.1359998317137015.
[I 2025-11-03 12:21:03,141] Trial 141 finished with value: 0.11911601594220694 and parameters: {'model_type': 'gcn', 'hidden_dims': '[512, 64]', 'dropout': 0.5021697750315832, 'batch_norm': True, 'lr': 0.0007434951950917339, 'weight_decay': 1.6321875775200114e-07, 'epochs': 249, 'loss': 'mse', 'optimizer': 'adam', 'graph_mode': 'cutoff', 'cutoff': 0.8414969948295887, 'grm_norm': 'gcn', 'self_loops': False, 'use_snp_selection': False}. Best is trial 32 with value: 0.1359998317137015.
[I 2025-11-03 12:21:06,127] Trial 142 finished with value: 0.12872137690642044 and parameters: {'model_type': 'gcn', 'hidden_dims': '[512, 64]', 'dropout': 0.47085613706379886, 'batch_norm': True, 'lr': 0.0008147474218556763, 'weight_decay': 2.2979143423024252e-07, 'epochs': 235, 'loss': 'mse', 'optimizer': 'adam', 'graph_mode': 'cutoff', 'cutoff': 0.7917597176525197, 'grm_norm': 'gcn', 'self_loops': False, 'use_snp_selection': False}. Best is trial 32 with value: 0.1359998317137015.
[I 2025-11-03 12:21:09,181] Trial 143 finished with value: 0.009543574020919968 and parameters: {'model_type': 'gcn', 'hidden_dims': '[512, 64]', 'dropout': 0.4691308506112222, 'batch_norm': True, 'lr': 4.083937611040631e-06, 'weight_decay': 2.4067009964536064e-07, 'epochs': 237, 'loss': 'mse', 'optimizer': 'adam', 'graph_mode': 'cutoff', 'cutoff': 0.7555012302644606, 'grm_norm': 'gcn', 'self_loops': False, 'use_snp_selection': False}. Best is trial 32 with value: 0.1359998317137015.
[I 2025-11-03 12:21:12,416] Trial 144 finished with value: 0.0462325362644101 and parameters: {'model_type': 'gcn', 'hidden_dims': '[512, 64]', 'dropout': 0.4800715199735581, 'batch_norm': True, 'lr': 9.20548167669148e-06, 'weight_decay': 1.3291728447754402e-07, 'epochs': 254, 'loss': 'mse', 'optimizer': 'adam', 'graph_mode': 'cutoff', 'cutoff': 0.7864821918830291, 'grm_norm': 'gcn', 'self_loops': False, 'use_snp_selection': False}. Best is trial 32 with value: 0.1359998317137015.
[I 2025-11-03 12:21:15,392] Trial 145 finished with value: 0.1052949922059319 and parameters: {'model_type': 'gcn', 'hidden_dims': '[512, 256]', 'dropout': 0.4904109631046507, 'batch_norm': True, 'lr': 0.0008325748197141789, 'weight_decay': 1.9912866001562113e-07, 'epochs': 223, 'loss': 'mse', 'optimizer': 'adam', 'graph_mode': 'cutoff', 'cutoff': 0.8189999797100018, 'grm_norm': 'gcn', 'self_loops': False, 'use_snp_selection': False}. Best is trial 32 with value: 0.1359998317137015.
[I 2025-11-03 12:21:18,436] Trial 146 finished with value: 0.1025581276868483 and parameters: {'model_type': 'gcn', 'hidden_dims': '[512, 64]', 'dropout': 0.4527200104945661, 'batch_norm': True, 'lr': 0.0003409176092170449, 'weight_decay': 2.93448390978076e-07, 'epochs': 232, 'loss': 'mse', 'optimizer': 'adam', 'graph_mode': 'cutoff', 'cutoff': 0.7021093094938725, 'grm_norm': 'gcn', 'self_loops': False, 'use_snp_selection': False}. Best is trial 32 with value: 0.1359998317137015.
[I 2025-11-03 12:21:20,507] Trial 147 finished with value: 0.1090963414510146 and parameters: {'model_type': 'gcn', 'hidden_dims': '[512, 256]', 'dropout': 0.43709398816835077, 'batch_norm': True, 'lr': 0.0009998695802125143, 'weight_decay': 1.531509115121295e-07, 'epochs': 98, 'loss': 'mae', 'optimizer': 'adam', 'graph_mode': 'cutoff', 'cutoff': 0.7635263906854242, 'grm_norm': 'gcn', 'self_loops': False, 'use_snp_selection': False}. Best is trial 32 with value: 0.1359998317137015.
[I 2025-11-03 12:21:23,636] Trial 148 finished with value: 0.11949423395593294 and parameters: {'model_type': 'gcn', 'hidden_dims': '[512, 64]', 'dropout': 0.4750607888487774, 'batch_norm': True, 'lr': 0.0005450535419354331, 'weight_decay': 1.0286295952356898e-07, 'epochs': 243, 'loss': 'mse', 'optimizer': 'adam', 'graph_mode': 'cutoff', 'cutoff': 0.8514009301343408, 'grm_norm': 'cosine', 'self_loops': False, 'use_snp_selection': False}. Best is trial 32 with value: 0.1359998317137015.
[I 2025-11-03 12:21:27,545] Trial 149 finished with value: 0.1300343686107228 and parameters: {'model_type': 'gcn', 'hidden_dims': '[512, 256]', 'dropout': 0.49126359798831537, 'batch_norm': True, 'lr': 0.00017664998639158448, 'weight_decay': 2.608686019148462e-07, 'epochs': 347, 'loss': 'mse', 'optimizer': 'adam', 'graph_mode': 'cutoff', 'cutoff': 0.574642010882586, 'grm_norm': 'gcn', 'self_loops': False, 'use_snp_selection': False}. Best is trial 32 with value: 0.1359998317137015.
[I 2025-11-03 12:21:29,805] Trial 0 finished with value: -0.0057737534643643815 and parameters: {'model_type': 'gcn', 'hidden_dims': '[128, 64]', 'dropout': 0.199031432379812, 'batch_norm': True, 'lr': 1.8408544111075837e-06, 'weight_decay': 5.5136510071208614e-05, 'epochs': 334, 'loss': 'mae', 'optimizer': 'adam', 'graph_mode': 'knn', 'source': 'grm', 'knn_k': 8, 'weighted_edges': True, 'symmetrize_mode': 'mutual', 'use_snp_selection': False}. Best is trial 0 with value: -0.0057737534643643815.
[I 2025-11-03 12:21:31,000] Trial 1 finished with value: 0.00742824345780579 and parameters: {'model_type': 'gcn', 'hidden_dims': '[128, 64]', 'dropout': 0.40051947670227217, 'batch_norm': True, 'lr': 0.0005320428882732732, 'weight_decay': 1.89210117736594e-06, 'epochs': 32, 'loss': 'mse', 'optimizer': 'adam', 'graph_mode': 'knn', 'source': 'grm', 'knn_k': 7, 'weighted_edges': True, 'symmetrize_mode': 'union', 'use_snp_selection': False}. Best is trial 1 with value: 0.00742824345780579.
[I 2025-11-03 12:21:33,382] Trial 2 finished with value: 0.015007536207951425 and parameters: {'model_type': 'gcn', 'hidden_dims': '[256, 128]', 'dropout': 0.5105528289184642, 'batch_norm': False, 'lr': 0.0006804279372404962, 'weight_decay': 0.0008922815224257085, 'epochs': 160, 'loss': 'mse', 'optimizer': 'adam', 'graph_mode': 'cutoff', 'cutoff': 0.5741905641612706, 'grm_norm': 'gcn', 'self_loops': False, 'use_snp_selection': True, 'num_snps': 26910}. Best is trial 2 with value: 0.015007536207951425.
[I 2025-11-03 12:21:35,854] Trial 3 finished with value: 0.0029891603830752103 and parameters: {'model_type': 'gcn', 'hidden_dims': '[256, 128, 64]', 'dropout': 0.5390483213624292, 'batch_norm': False, 'lr': 3.4705625989073525e-05, 'weight_decay': 2.4623319020131338e-05, 'epochs': 92, 'loss': 'mse', 'optimizer': 'adam', 'graph_mode': 'knn', 'source': 'grm', 'knn_k': 6, 'weighted_edges': False, 'symmetrize_mode': 'mutual', 'use_snp_selection': True, 'num_snps': 30713}. Best is trial 2 with value: 0.015007536207951425.
[I 2025-11-03 12:21:38,336] Trial 4 finished with value: -0.013396723253963547 and parameters: {'model_type': 'gcn', 'hidden_dims': '[128, 64]', 'dropout': 0.13404863676897502, 'batch_norm': False, 'lr': 0.0001431556295367288, 'weight_decay': 2.2084517750726675e-05, 'epochs': 13, 'loss': 'mae', 'optimizer': 'adam', 'graph_mode': 'cutoff', 'cutoff': 0.6714268476993044, 'grm_norm': 'none', 'self_loops': False, 'use_snp_selection': True, 'num_snps': 45645}. Best is trial 2 with value: 0.015007536207951425.
[I 2025-11-03 12:21:41,304] Trial 5 finished with value: -0.010572739705941352 and parameters: {'model_type': 'gcn', 'hidden_dims': '[256, 128]', 'dropout': 0.42253606323412096, 'batch_norm': False, 'lr': 4.238630400638805e-05, 'weight_decay': 8.074086040046576e-07, 'epochs': 134, 'loss': 'mae', 'optimizer': 'adam', 'graph_mode': 'knn', 'source': 'grm', 'knn_k': 1, 'weighted_edges': False, 'symmetrize_mode': 'mutual', 'use_snp_selection': True, 'num_snps': 43113}. Best is trial 2 with value: 0.015007536207951425.
[I 2025-11-03 12:21:44,121] Trial 6 finished with value: 0.022837550690999395 and parameters: {'model_type': 'gcn', 'hidden_dims': '[512, 256]', 'dropout': 0.3534893146320237, 'batch_norm': True, 'lr': 0.000251307964226932, 'weight_decay': 1.821819791794022e-05, 'epochs': 207, 'loss': 'mae', 'optimizer': 'adam', 'graph_mode': 'knn', 'source': 'grm', 'knn_k': 1, 'weighted_edges': True, 'symmetrize_mode': 'mutual', 'use_snp_selection': False}. Best is trial 6 with value: 0.022837550690999395.
[I 2025-11-03 12:21:46,597] Trial 7 finished with value: 0.020983673410842778 and parameters: {'model_type': 'gcn', 'hidden_dims': '[512, 256]', 'dropout': 0.1105825955860775, 'batch_norm': True, 'lr': 2.374338412754043e-05, 'weight_decay': 1.1284721123340274e-05, 'epochs': 170, 'loss': 'mse', 'optimizer': 'adam', 'graph_mode': 'cutoff', 'cutoff': 0.719872204109604, 'grm_norm': 'gcn', 'self_loops': False, 'use_snp_selection': False}. Best is trial 6 with value: 0.022837550690999395.
[I 2025-11-03 12:21:48,537] Trial 8 finished with value: 0.004416458873694008 and parameters: {'model_type': 'gcn', 'hidden_dims': '[512, 128]', 'dropout': 0.5066580418354021, 'batch_norm': True, 'lr': 0.00039213678276659976, 'weight_decay': 3.43655320802934e-06, 'epochs': 91, 'loss': 'mse', 'optimizer': 'adam', 'graph_mode': 'cutoff', 'cutoff': 0.34923059576505366, 'grm_norm': 'cosine', 'self_loops': True, 'use_snp_selection': False}. Best is trial 6 with value: 0.022837550690999395.
