[I 2025-11-03 14:29:52,075] Trial 51 finished with value: -0.0034160852595693635 and parameters: {'model_type': 'gcn', 'hidden_dims': '[256, 128, 64]', 'dropout': 0.38489492003860193, 'batch_norm': False, 'lr': 2.7463244012561582e-05, 'weight_decay': 0.000857890879519562, 'epochs': 228, 'loss': 'mae', 'optimizer': 'adam', 'graph_mode': 'knn', 'source': 'grm', 'knn_k': 7, 'weighted_edges': True, 'symmetrize_mode': 'mutual', 'use_snp_selection': False}. Best is trial 20 with value: 0.07082609450133819.
[I 2025-11-03 14:29:54,433] Trial 52 finished with value: 0.011300088571705726 and parameters: {'model_type': 'gcn', 'hidden_dims': '[256, 128, 64]', 'dropout': 0.3426402577462032, 'batch_norm': False, 'lr': 4.4839663158289224e-05, 'weight_decay': 0.00014753179279855674, 'epochs': 242, 'loss': 'mae', 'optimizer': 'adam', 'graph_mode': 'knn', 'source': 'grm', 'knn_k': 8, 'weighted_edges': True, 'symmetrize_mode': 'mutual', 'use_snp_selection': False}. Best is trial 20 with value: 0.07082609450133819.
[I 2025-11-03 14:29:55,574] Trial 53 finished with value: 0.012646281230069266 and parameters: {'model_type': 'gcn', 'hidden_dims': '[256, 128, 64]', 'dropout': 0.5738406529465047, 'batch_norm': False, 'lr': 1.8821279276799272e-05, 'weight_decay': 0.00029266950179218356, 'epochs': 1, 'loss': 'mae', 'optimizer': 'adam', 'graph_mode': 'knn', 'source': 'grm', 'knn_k': 6, 'weighted_edges': True, 'symmetrize_mode': 'mutual', 'use_snp_selection': False}. Best is trial 20 with value: 0.07082609450133819.
[I 2025-11-03 14:29:58,839] Trial 54 finished with value: -0.025285848343265523 and parameters: {'model_type': 'gcn', 'hidden_dims': '[256, 128, 64]', 'dropout': 0.48910887910453255, 'batch_norm': False, 'lr': 8.740353481262061e-05, 'weight_decay': 0.00042199765673341723, 'epochs': 206, 'loss': 'mae', 'optimizer': 'adam', 'graph_mode': 'knn', 'source': 'grm', 'knn_k': 7, 'weighted_edges': True, 'symmetrize_mode': 'mutual', 'use_snp_selection': True, 'num_snps': 43199}. Best is trial 20 with value: 0.07082609450133819.
[I 2025-11-03 14:30:01,859] Trial 55 finished with value: 0.014236231916606536 and parameters: {'model_type': 'gcn', 'hidden_dims': '[512, 128]', 'dropout': 0.4493903756361875, 'batch_norm': False, 'lr': 5.811021333226563e-05, 'weight_decay': 0.00023742546319202823, 'epochs': 264, 'loss': 'mae', 'optimizer': 'adam', 'graph_mode': 'knn', 'source': 'grm', 'knn_k': 6, 'weighted_edges': True, 'symmetrize_mode': 'mutual', 'use_snp_selection': False}. Best is trial 20 with value: 0.07082609450133819.
[I 2025-11-03 14:30:04,477] Trial 56 finished with value: 0.012562397694785338 and parameters: {'model_type': 'gcn', 'hidden_dims': '[128, 64]', 'dropout': 0.41358193683126476, 'batch_norm': False, 'lr': 0.0001765512495454826, 'weight_decay': 9.52817074595068e-05, 'epochs': 183, 'loss': 'mae', 'optimizer': 'adam', 'graph_mode': 'knn', 'source': 'grm', 'knn_k': 9, 'weighted_edges': True, 'symmetrize_mode': 'mutual', 'use_snp_selection': True, 'num_snps': 38130}. Best is trial 20 with value: 0.07082609450133819.
[I 2025-11-03 14:30:07,012] Trial 57 finished with value: 0.04418195864837641 and parameters: {'model_type': 'gcn', 'hidden_dims': '[256, 128, 64]', 'dropout': 0.3788568514905963, 'batch_norm': False, 'lr': 0.0007620321293055288, 'weight_decay': 0.000161697713969778, 'epochs': 168, 'loss': 'mae', 'optimizer': 'adam', 'graph_mode': 'knn', 'source': 'grm', 'knn_k': 8, 'weighted_edges': False, 'symmetrize_mode': 'mutual', 'use_snp_selection': True, 'num_snps': 28334}. Best is trial 20 with value: 0.07082609450133819.
[I 2025-11-03 14:30:10,350] Trial 58 finished with value: -0.026510719292915753 and parameters: {'model_type': 'gcn', 'hidden_dims': '[256, 128, 64]', 'dropout': 0.5825017199223299, 'batch_norm': False, 'lr': 1.0482365406927622e-05, 'weight_decay': 1.3772454395532748e-06, 'epochs': 219, 'loss': 'mae', 'optimizer': 'adam', 'graph_mode': 'knn', 'source': 'grm', 'knn_k': 7, 'weighted_edges': True, 'symmetrize_mode': 'union', 'use_snp_selection': True, 'num_snps': 44420}. Best is trial 20 with value: 0.07082609450133819.
[I 2025-11-03 14:30:11,957] Trial 59 finished with value: -0.0016157007788874687 and parameters: {'model_type': 'gcn', 'hidden_dims': '[128, 64]', 'dropout': 0.3550357189997716, 'batch_norm': False, 'lr': 3.3549725359314585e-05, 'weight_decay': 0.0009781707654194169, 'epochs': 201, 'loss': 'mae', 'optimizer': 'adam', 'graph_mode': 'cutoff', 'cutoff': 0.3818326907416613, 'grm_norm': 'cosine_then_gcn', 'self_loops': True, 'use_snp_selection': False}. Best is trial 20 with value: 0.07082609450133819.
[I 2025-11-03 14:30:15,748] Trial 60 finished with value: -0.00044111765770625685 and parameters: {'model_type': 'gcn', 'hidden_dims': '[512, 256]', 'dropout': 0.5471403196139545, 'batch_norm': False, 'lr': 8.169121449558554e-06, 'weight_decay': 0.0006879034841048109, 'epochs': 148, 'loss': 'mse', 'optimizer': 'adam', 'graph_mode': 'knn', 'source': 'grm', 'knn_k': 6, 'weighted_edges': True, 'symmetrize_mode': 'mutual', 'use_snp_selection': True, 'num_snps': 56572}. Best is trial 20 with value: 0.07082609450133819.
[I 2025-11-03 14:30:18,229] Trial 61 finished with value: 0.02377518445976333 and parameters: {'model_type': 'gcn', 'hidden_dims': '[256, 128, 64]', 'dropout': 0.37855203338549803, 'batch_norm': False, 'lr': 0.0005660663926049566, 'weight_decay': 0.00016415421086772968, 'epochs': 166, 'loss': 'mae', 'optimizer': 'adam', 'graph_mode': 'knn', 'source': 'grm', 'knn_k': 8, 'weighted_edges': False, 'symmetrize_mode': 'mutual', 'use_snp_selection': True, 'num_snps': 27501}. Best is trial 20 with value: 0.07082609450133819.
[I 2025-11-03 14:30:20,411] Trial 62 finished with value: 0.041310363457086274 and parameters: {'model_type': 'gcn', 'hidden_dims': '[256, 128, 64]', 'dropout': 0.4220345870500921, 'batch_norm': False, 'lr': 0.0008399794600782382, 'weight_decay': 7.977431215682854e-05, 'epochs': 139, 'loss': 'mae', 'optimizer': 'adam', 'graph_mode': 'knn', 'source': 'grm', 'knn_k': 8, 'weighted_edges': False, 'symmetrize_mode': 'mutual', 'use_snp_selection': True, 'num_snps': 22251}. Best is trial 20 with value: 0.07082609450133819.
[I 2025-11-03 14:30:23,354] Trial 63 finished with value: -0.0486644930111761 and parameters: {'model_type': 'gcn', 'hidden_dims': '[256, 128, 64]', 'dropout': 0.46151089358511693, 'batch_norm': False, 'lr': 2.2878068909643257e-05, 'weight_decay': 0.00023937850689832282, 'epochs': 230, 'loss': 'mae', 'optimizer': 'adam', 'graph_mode': 'knn', 'source': 'grm', 'knn_k': 9, 'weighted_edges': False, 'symmetrize_mode': 'mutual', 'use_snp_selection': True, 'num_snps': 33273}. Best is trial 20 with value: 0.07082609450133819.
[I 2025-11-03 14:30:26,265] Trial 64 finished with value: 0.013220010470692552 and parameters: {'model_type': 'gcn', 'hidden_dims': '[256, 128, 64]', 'dropout': 0.48450713991193606, 'batch_norm': False, 'lr': 0.0004864139374716312, 'weight_decay': 4.9338546051020916e-05, 'epochs': 251, 'loss': 'mae', 'optimizer': 'adam', 'graph_mode': 'knn', 'source': 'grm', 'knn_k': 7, 'weighted_edges': False, 'symmetrize_mode': 'mutual', 'use_snp_selection': True, 'num_snps': 29158}. Best is trial 20 with value: 0.07082609450133819.
[I 2025-11-03 14:30:30,226] Trial 65 finished with value: -0.0021369534470849 and parameters: {'model_type': 'gcn', 'hidden_dims': '[256, 128, 64]', 'dropout': 0.43183400789366816, 'batch_norm': False, 'lr': 0.0002786562111905452, 'weight_decay': 0.00011629790808405515, 'epochs': 275, 'loss': 'mae', 'optimizer': 'adam', 'graph_mode': 'cutoff', 'cutoff': 0.7996293335662998, 'grm_norm': 'cosine_then_gcn', 'self_loops': True, 'use_snp_selection': True, 'num_snps': 53129}. Best is trial 20 with value: 0.07082609450133819.
[I 2025-11-03 14:30:32,525] Trial 66 finished with value: 0.043794687864137975 and parameters: {'model_type': 'gcn', 'hidden_dims': '[512, 128]', 'dropout': 0.5188142511795377, 'batch_norm': False, 'lr': 0.00032475696108354564, 'weight_decay': 0.00038734258247503353, 'epochs': 192, 'loss': 'mae', 'optimizer': 'adam', 'graph_mode': 'knn', 'source': 'grm', 'knn_k': 10, 'weighted_edges': False, 'symmetrize_mode': 'union', 'use_snp_selection': True, 'num_snps': 18759}. Best is trial 20 with value: 0.07082609450133819.
[I 2025-11-03 14:30:35,649] Trial 67 finished with value: 0.009955298151603639 and parameters: {'model_type': 'gcn', 'hidden_dims': '[256, 128]', 'dropout': 0.3569943976279927, 'batch_norm': False, 'lr': 1.4221901073092551e-05, 'weight_decay': 1.5266445356144482e-05, 'epochs': 160, 'loss': 'mse', 'optimizer': 'adam', 'graph_mode': 'knn', 'source': 'grm', 'knn_k': 8, 'weighted_edges': False, 'symmetrize_mode': 'mutual', 'use_snp_selection': True, 'num_snps': 49356}. Best is trial 20 with value: 0.07082609450133819.
[I 2025-11-03 14:30:38,777] Trial 68 finished with value: 0.014130583528293082 and parameters: {'model_type': 'gcn', 'hidden_dims': '[256, 128, 64]', 'dropout': 0.4030918131830252, 'batch_norm': True, 'lr': 2.6081047728342606e-05, 'weight_decay': 6.942268997915435e-05, 'epochs': 237, 'loss': 'mae', 'optimizer': 'adam', 'graph_mode': 'cutoff', 'cutoff': 0.5288338913648741, 'grm_norm': 'none', 'self_loops': True, 'use_snp_selection': True, 'num_snps': 34586}. Best is trial 20 with value: 0.07082609450133819.
[I 2025-11-03 14:30:41,595] Trial 69 finished with value: 0.03108688672734105 and parameters: {'model_type': 'gcn', 'hidden_dims': '[256, 128]', 'dropout': 0.5614727290265273, 'batch_norm': True, 'lr': 4.412501061497458e-05, 'weight_decay': 3.095757901317053e-05, 'epochs': 260, 'loss': 'mae', 'optimizer': 'adam', 'graph_mode': 'knn', 'source': 'grm', 'knn_k': 8, 'weighted_edges': False, 'symmetrize_mode': 'mutual', 'use_snp_selection': True, 'num_snps': 30375}. Best is trial 20 with value: 0.07082609450133819.
[I 2025-11-03 14:30:44,979] Trial 70 finished with value: 0.012755556696591511 and parameters: {'model_type': 'gcn', 'hidden_dims': '[128, 64]', 'dropout': 0.3237164611926814, 'batch_norm': False, 'lr': 0.00011359639581451216, 'weight_decay': 0.0001300577340758218, 'epochs': 206, 'loss': 'mse', 'optimizer': 'adam', 'graph_mode': 'knn', 'source': 'grm', 'knn_k': 5, 'weighted_edges': True, 'symmetrize_mode': 'union', 'use_snp_selection': True, 'num_snps': 57574}. Best is trial 20 with value: 0.07082609450133819.
[I 2025-11-03 14:30:47,272] Trial 71 finished with value: 0.014062472666693653 and parameters: {'model_type': 'gcn', 'hidden_dims': '[512, 128]', 'dropout': 0.5101151251572154, 'batch_norm': False, 'lr': 0.0009457711934609266, 'weight_decay': 0.0003511345190934652, 'epochs': 195, 'loss': 'mae', 'optimizer': 'adam', 'graph_mode': 'knn', 'source': 'grm', 'knn_k': 10, 'weighted_edges': False, 'symmetrize_mode': 'union', 'use_snp_selection': True, 'num_snps': 18671}. Best is trial 20 with value: 0.07082609450133819.
[I 2025-11-03 14:30:49,184] Trial 72 finished with value: 0.052951993819524 and parameters: {'model_type': 'gcn', 'hidden_dims': '[512, 128]', 'dropout': 0.5291595977689382, 'batch_norm': False, 'lr': 0.00031705963446479186, 'weight_decay': 0.00045903544633751464, 'epochs': 215, 'loss': 'mae', 'optimizer': 'adam', 'graph_mode': 'knn', 'source': 'grm', 'knn_k': 10, 'weighted_edges': False, 'symmetrize_mode': 'union', 'use_snp_selection': True, 'num_snps': 11016}. Best is trial 20 with value: 0.07082609450133819.
[I 2025-11-03 14:30:51,089] Trial 73 finished with value: 0.07441295286138189 and parameters: {'model_type': 'gcn', 'hidden_dims': '[512, 128]', 'dropout': 0.3900689326712143, 'batch_norm': False, 'lr': 0.0004255953798813907, 'weight_decay': 0.0005211280039949222, 'epochs': 219, 'loss': 'mae', 'optimizer': 'adam', 'graph_mode': 'knn', 'source': 'grm', 'knn_k': 9, 'weighted_edges': False, 'symmetrize_mode': 'union', 'use_snp_selection': True, 'num_snps': 10707}. Best is trial 73 with value: 0.07441295286138189.
[I 2025-11-03 14:30:52,936] Trial 74 finished with value: 0.04624894358133728 and parameters: {'model_type': 'gcn', 'hidden_dims': '[512, 128]', 'dropout': 0.5360644496903307, 'batch_norm': False, 'lr': 0.0006192879631602994, 'weight_decay': 0.0005839102589572821, 'epochs': 218, 'loss': 'mae', 'optimizer': 'adam', 'graph_mode': 'knn', 'source': 'grm', 'knn_k': 9, 'weighted_edges': False, 'symmetrize_mode': 'union', 'use_snp_selection': True, 'num_snps': 9292}. Best is trial 73 with value: 0.07441295286138189.
[I 2025-11-03 14:30:54,923] Trial 75 finished with value: 0.027831949842497976 and parameters: {'model_type': 'gcn', 'hidden_dims': '[512, 128]', 'dropout': 0.4485886024205192, 'batch_norm': True, 'lr': 0.000456484329618959, 'weight_decay': 0.0004761394679133263, 'epochs': 222, 'loss': 'mae', 'optimizer': 'adam', 'graph_mode': 'knn', 'source': 'grm', 'knn_k': 10, 'weighted_edges': False, 'symmetrize_mode': 'union', 'use_snp_selection': True, 'num_snps': 10976}. Best is trial 73 with value: 0.07441295286138189.
[I 2025-11-03 14:30:56,664] Trial 76 finished with value: 0.01430666152190646 and parameters: {'model_type': 'gcn', 'hidden_dims': '[512, 128]', 'dropout': 0.5877678932431756, 'batch_norm': False, 'lr': 0.0001720626599654137, 'weight_decay': 0.0007622493556913851, 'epochs': 184, 'loss': 'mae', 'optimizer': 'adam', 'graph_mode': 'cutoff', 'cutoff': 0.36676717998582387, 'grm_norm': 'cosine', 'self_loops': False, 'use_snp_selection': True, 'num_snps': 10274}. Best is trial 73 with value: 0.07441295286138189.
[I 2025-11-03 14:30:58,397] Trial 77 finished with value: -0.002789141231849837 and parameters: {'model_type': 'gcn', 'hidden_dims': '[512, 128]', 'dropout': 0.4772251615434468, 'batch_norm': False, 'lr': 0.00035761258769528685, 'weight_decay': 0.0002188082593198488, 'epochs': 247, 'loss': 'mae', 'optimizer': 'adam', 'graph_mode': 'knn', 'source': 'grm', 'knn_k': 9, 'weighted_edges': True, 'symmetrize_mode': 'union', 'use_snp_selection': True, 'num_snps': 3149}. Best is trial 73 with value: 0.07441295286138189.
[I 2025-11-03 14:31:01,338] Trial 78 finished with value: -0.025246911452150713 and parameters: {'model_type': 'gcn', 'hidden_dims': '[512, 128]', 'dropout': 0.5299677383443453, 'batch_norm': True, 'lr': 1.993013494493548e-05, 'weight_decay': 0.0002865818708941713, 'epochs': 234, 'loss': 'mse', 'optimizer': 'adam', 'graph_mode': 'knn', 'source': 'grm', 'knn_k': 10, 'weighted_edges': False, 'symmetrize_mode': 'union', 'use_snp_selection': False}. Best is trial 73 with value: 0.07441295286138189.
[I 2025-11-03 14:31:03,412] Trial 79 finished with value: 0.015959144143964137 and parameters: {'model_type': 'gcn', 'hidden_dims': '[256, 128]', 'dropout': 0.558256002574834, 'batch_norm': False, 'lr': 0.0002333039501651974, 'weight_decay': 0.00041708778967593327, 'epochs': 271, 'loss': 'mae', 'optimizer': 'adam', 'graph_mode': 'knn', 'source': 'grm', 'knn_k': 7, 'weighted_edges': True, 'symmetrize_mode': 'union', 'use_snp_selection': True, 'num_snps': 12735}. Best is trial 73 with value: 0.07441295286138189.
[I 2025-11-03 14:31:05,247] Trial 80 finished with value: 0.056551003368918745 and parameters: {'model_type': 'gcn', 'hidden_dims': '[512, 128]', 'dropout': 0.4332586221545983, 'batch_norm': True, 'lr': 1.2538778150585394e-05, 'weight_decay': 0.0005639736596467248, 'epochs': 226, 'loss': 'mae', 'optimizer': 'adam', 'graph_mode': 'cutoff', 'cutoff': 0.6057863099694831, 'grm_norm': 'cosine', 'self_loops': True, 'use_snp_selection': True, 'num_snps': 7424}. Best is trial 73 with value: 0.07441295286138189.
[I 2025-11-03 14:31:07,186] Trial 81 finished with value: 0.03391625858247415 and parameters: {'model_type': 'gcn', 'hidden_dims': '[512, 128]', 'dropout': 0.3903524084165907, 'batch_norm': True, 'lr': 1.169707809078514e-05, 'weight_decay': 0.0006473376229358236, 'epochs': 255, 'loss': 'mae', 'optimizer': 'adam', 'graph_mode': 'cutoff', 'cutoff': 0.5895072082484138, 'grm_norm': 'cosine', 'self_loops': True, 'use_snp_selection': True, 'num_snps': 7679}. Best is trial 73 with value: 0.07441295286138189.
[I 2025-11-03 14:31:08,919] Trial 82 finished with value: 0.01749719568281878 and parameters: {'model_type': 'gcn', 'hidden_dims': '[512, 128]', 'dropout': 0.4315679392227611, 'batch_norm': True, 'lr': 8.555787257564506e-06, 'weight_decay': 0.0009886004485875767, 'epochs': 213, 'loss': 'mae', 'optimizer': 'adam', 'graph_mode': 'cutoff', 'cutoff': 0.5036760877040217, 'grm_norm': 'cosine', 'self_loops': True, 'use_snp_selection': True, 'num_snps': 5642}. Best is trial 73 with value: 0.07441295286138189.
