[I 2025-11-03 13:35:56,542] Trial 94 finished with value: 0.10952189639246798 and parameters: {'model_type': 'gcn', 'hidden_dims': '[256, 128, 64]', 'dropout': 0.45388073673531004, 'batch_norm': True, 'lr': 0.0006293176222668265, 'weight_decay': 8.608601247698143e-06, 'epochs': 147, 'loss': 'mae', 'optimizer': 'adam', 'graph_mode': 'knn', 'source': 'grm', 'knn_k': 1, 'weighted_edges': True, 'symmetrize_mode': 'mutual', 'use_snp_selection': False}. Best is trial 90 with value: 0.12385554697147882.
[I 2025-11-03 13:35:58,264] Trial 95 finished with value: 0.08828683763371818 and parameters: {'model_type': 'gcn', 'hidden_dims': '[256, 128, 64]', 'dropout': 0.4640542578491705, 'batch_norm': True, 'lr': 0.0006754214768506655, 'weight_decay': 9.678703838562734e-06, 'epochs': 132, 'loss': 'mae', 'optimizer': 'adam', 'graph_mode': 'knn', 'source': 'grm', 'knn_k': 1, 'weighted_edges': True, 'symmetrize_mode': 'mutual', 'use_snp_selection': False}. Best is trial 90 with value: 0.12385554697147882.
[I 2025-11-03 13:36:01,019] Trial 96 finished with value: 0.05321832873313141 and parameters: {'model_type': 'gcn', 'hidden_dims': '[256, 128, 64]', 'dropout': 0.45782737017538294, 'batch_norm': False, 'lr': 0.0005981267906172077, 'weight_decay': 6.605281281256368e-06, 'epochs': 148, 'loss': 'mae', 'optimizer': 'adam', 'graph_mode': 'cutoff', 'cutoff': 0.46947742149781474, 'grm_norm': 'none', 'self_loops': False, 'use_snp_selection': True, 'num_snps': 41864}. Best is trial 90 with value: 0.12385554697147882.
[I 2025-11-03 13:36:02,942] Trial 97 finished with value: 0.0993675200513065 and parameters: {'model_type': 'gcn', 'hidden_dims': '[256, 128, 64]', 'dropout': 0.4329658435216532, 'batch_norm': True, 'lr': 0.0003808050327920922, 'weight_decay': 2.0894415649874928e-05, 'epochs': 167, 'loss': 'mse', 'optimizer': 'adam', 'graph_mode': 'knn', 'source': 'grm', 'knn_k': 2, 'weighted_edges': True, 'symmetrize_mode': 'mutual', 'use_snp_selection': False}. Best is trial 90 with value: 0.12385554697147882.
[I 2025-11-03 13:36:04,604] Trial 98 finished with value: 0.05721168740465163 and parameters: {'model_type': 'gcn', 'hidden_dims': '[256, 128, 64]', 'dropout': 0.4500116238954141, 'batch_norm': True, 'lr': 6.948741461334013e-05, 'weight_decay': 8.245252641529463e-06, 'epochs': 119, 'loss': 'mae', 'optimizer': 'adam', 'graph_mode': 'knn', 'source': 'grm', 'knn_k': 1, 'weighted_edges': False, 'symmetrize_mode': 'mutual', 'use_snp_selection': False}. Best is trial 90 with value: 0.12385554697147882.
[I 2025-11-03 13:36:06,201] Trial 99 finished with value: 0.012682039159846361 and parameters: {'model_type': 'gcn', 'hidden_dims': '[256, 128, 64]', 'dropout': 0.5056860167260008, 'batch_norm': True, 'lr': 3.846901465858706e-06, 'weight_decay': 4.012477700536882e-06, 'epochs': 103, 'loss': 'mse', 'optimizer': 'adam', 'graph_mode': 'knn', 'source': 'grm', 'knn_k': 2, 'weighted_edges': True, 'symmetrize_mode': 'union', 'use_snp_selection': False}. Best is trial 90 with value: 0.12385554697147882.
[I 2025-11-03 13:36:08,003] Trial 100 finished with value: 0.09329164160095907 and parameters: {'model_type': 'gcn', 'hidden_dims': '[256, 128, 64]', 'dropout': 0.41890014681856447, 'batch_norm': True, 'lr': 0.0005018597093188095, 'weight_decay': 3.441286297914562e-05, 'epochs': 159, 'loss': 'mae', 'optimizer': 'adam', 'graph_mode': 'cutoff', 'cutoff': 0.6734514828971205, 'grm_norm': 'none', 'self_loops': False, 'use_snp_selection': False}. Best is trial 90 with value: 0.12385554697147882.
[I 2025-11-03 13:36:09,993] Trial 101 finished with value: 0.08669096608837923 and parameters: {'model_type': 'gcn', 'hidden_dims': '[256, 128, 64]', 'dropout': 0.4002914464805694, 'batch_norm': True, 'lr': 0.0008015782111841157, 'weight_decay': 9.777431414154498e-06, 'epochs': 189, 'loss': 'mae', 'optimizer': 'adam', 'graph_mode': 'knn', 'source': 'grm', 'knn_k': 1, 'weighted_edges': True, 'symmetrize_mode': 'mutual', 'use_snp_selection': False}. Best is trial 90 with value: 0.12385554697147882.
[I 2025-11-03 13:36:11,754] Trial 102 finished with value: 0.09964340279914699 and parameters: {'model_type': 'gcn', 'hidden_dims': '[256, 128, 64]', 'dropout': 0.48319477041621184, 'batch_norm': True, 'lr': 0.000270588259695205, 'weight_decay': 1.8398064979510033e-05, 'epochs': 142, 'loss': 'mae', 'optimizer': 'adam', 'graph_mode': 'knn', 'source': 'grm', 'knn_k': 1, 'weighted_edges': True, 'symmetrize_mode': 'mutual', 'use_snp_selection': False}. Best is trial 90 with value: 0.12385554697147882.
[I 2025-11-03 13:36:13,963] Trial 103 finished with value: 0.1050868928053417 and parameters: {'model_type': 'gcn', 'hidden_dims': '[512, 256]', 'dropout': 0.3767605452184757, 'batch_norm': True, 'lr': 0.0006774888097748768, 'weight_decay': 1.2113140519166858e-05, 'epochs': 167, 'loss': 'mae', 'optimizer': 'adam', 'graph_mode': 'knn', 'source': 'grm', 'knn_k': 1, 'weighted_edges': True, 'symmetrize_mode': 'mutual', 'use_snp_selection': False}. Best is trial 90 with value: 0.12385554697147882.
[I 2025-11-03 13:36:15,809] Trial 104 finished with value: 0.10623960857202905 and parameters: {'model_type': 'gcn', 'hidden_dims': '[256, 128, 64]', 'dropout': 0.1703934920129038, 'batch_norm': True, 'lr': 0.0006264580576858172, 'weight_decay': 6.76423721805987e-06, 'epochs': 155, 'loss': 'mae', 'optimizer': 'adam', 'graph_mode': 'knn', 'source': 'grm', 'knn_k': 2, 'weighted_edges': True, 'symmetrize_mode': 'mutual', 'use_snp_selection': False}. Best is trial 90 with value: 0.12385554697147882.
[I 2025-11-03 13:36:17,596] Trial 105 finished with value: 0.0997874476231691 and parameters: {'model_type': 'gcn', 'hidden_dims': '[256, 128, 64]', 'dropout': 0.1504899843758393, 'batch_norm': True, 'lr': 0.0006689968722403001, 'weight_decay': 6.613724393224386e-06, 'epochs': 136, 'loss': 'mae', 'optimizer': 'adam', 'graph_mode': 'knn', 'source': 'grm', 'knn_k': 2, 'weighted_edges': True, 'symmetrize_mode': 'mutual', 'use_snp_selection': False}. Best is trial 90 with value: 0.12385554697147882.
[I 2025-11-03 13:36:19,883] Trial 106 finished with value: 0.09920314886568884 and parameters: {'model_type': 'gcn', 'hidden_dims': '[256, 128, 64]', 'dropout': 0.38872997351462824, 'batch_norm': True, 'lr': 0.0004233005747544554, 'weight_decay': 1.7693349718386732e-06, 'epochs': 156, 'loss': 'mae', 'optimizer': 'adam', 'graph_mode': 'knn', 'source': 'grm', 'knn_k': 2, 'weighted_edges': True, 'symmetrize_mode': 'mutual', 'use_snp_selection': True, 'num_snps': 24881}. Best is trial 90 with value: 0.12385554697147882.
[I 2025-11-03 13:36:21,798] Trial 107 finished with value: 0.05780285371425922 and parameters: {'model_type': 'gcn', 'hidden_dims': '[256, 128, 64]', 'dropout': 0.1707461121631506, 'batch_norm': False, 'lr': 0.0005853425220683678, 'weight_decay': 8.632675752962902e-06, 'epochs': 169, 'loss': 'mse', 'optimizer': 'adam', 'graph_mode': 'knn', 'source': 'grm', 'knn_k': 3, 'weighted_edges': True, 'symmetrize_mode': 'mutual', 'use_snp_selection': False}. Best is trial 90 with value: 0.12385554697147882.
[I 2025-11-03 13:36:23,828] Trial 108 finished with value: 0.07191608380929322 and parameters: {'model_type': 'gcn', 'hidden_dims': '[512, 128]', 'dropout': 0.3434658555974756, 'batch_norm': True, 'lr': 2.3824755048202815e-05, 'weight_decay': 3.272752079339939e-06, 'epochs': 129, 'loss': 'mae', 'optimizer': 'adam', 'graph_mode': 'knn', 'source': 'grm', 'knn_k': 1, 'weighted_edges': True, 'symmetrize_mode': 'mutual', 'use_snp_selection': False}. Best is trial 90 with value: 0.12385554697147882.
[I 2025-11-03 13:36:25,615] Trial 109 finished with value: 0.09742654698171789 and parameters: {'model_type': 'gcn', 'hidden_dims': '[256, 128, 64]', 'dropout': 0.13231152590052223, 'batch_norm': True, 'lr': 0.0003491738632294408, 'weight_decay': 5.374343958221737e-06, 'epochs': 145, 'loss': 'mae', 'optimizer': 'adam', 'graph_mode': 'cutoff', 'cutoff': 0.7799110487046247, 'grm_norm': 'cosine', 'self_loops': True, 'use_snp_selection': False}. Best is trial 90 with value: 0.12385554697147882.
[I 2025-11-03 13:36:27,792] Trial 110 finished with value: 0.10920830667464308 and parameters: {'model_type': 'gcn', 'hidden_dims': '[512, 256]', 'dropout': 0.3726196606614334, 'batch_norm': True, 'lr': 0.0004646689547540743, 'weight_decay': 1.0622732832842596e-05, 'epochs': 156, 'loss': 'mse', 'optimizer': 'adam', 'graph_mode': 'knn', 'source': 'grm', 'knn_k': 1, 'weighted_edges': False, 'symmetrize_mode': 'mutual', 'use_snp_selection': False}. Best is trial 90 with value: 0.12385554697147882.
[I 2025-11-03 13:36:29,988] Trial 111 finished with value: 0.11353412007904234 and parameters: {'model_type': 'gcn', 'hidden_dims': '[512, 256]', 'dropout': 0.37828351727743303, 'batch_norm': True, 'lr': 0.0005153050709301634, 'weight_decay': 1.1571197619171732e-05, 'epochs': 160, 'loss': 'mse', 'optimizer': 'adam', 'graph_mode': 'knn', 'source': 'grm', 'knn_k': 1, 'weighted_edges': False, 'symmetrize_mode': 'mutual', 'use_snp_selection': False}. Best is trial 90 with value: 0.12385554697147882.
[I 2025-11-03 13:36:32,098] Trial 112 finished with value: 0.10964234798556736 and parameters: {'model_type': 'gcn', 'hidden_dims': '[512, 256]', 'dropout': 0.37650174898577493, 'batch_norm': True, 'lr': 0.00048278507422798455, 'weight_decay': 1.2132320162364023e-05, 'epochs': 148, 'loss': 'mse', 'optimizer': 'adam', 'graph_mode': 'knn', 'source': 'grm', 'knn_k': 1, 'weighted_edges': False, 'symmetrize_mode': 'mutual', 'use_snp_selection': False}. Best is trial 90 with value: 0.12385554697147882.
[I 2025-11-03 13:36:34,090] Trial 113 finished with value: 0.10698664988977283 and parameters: {'model_type': 'gcn', 'hidden_dims': '[512, 256]', 'dropout': 0.3821802009762183, 'batch_norm': True, 'lr': 0.0004940075433421883, 'weight_decay': 1.0715201236922649e-05, 'epochs': 125, 'loss': 'mse', 'optimizer': 'adam', 'graph_mode': 'knn', 'source': 'grm', 'knn_k': 1, 'weighted_edges': False, 'symmetrize_mode': 'mutual', 'use_snp_selection': False}. Best is trial 90 with value: 0.12385554697147882.
[I 2025-11-03 13:36:36,063] Trial 114 finished with value: 0.10867619769710045 and parameters: {'model_type': 'gcn', 'hidden_dims': '[512, 256]', 'dropout': 0.37890613899160475, 'batch_norm': True, 'lr': 0.0007035261573943378, 'weight_decay': 1.1849636454115088e-05, 'epochs': 121, 'loss': 'mse', 'optimizer': 'adam', 'graph_mode': 'knn', 'source': 'grm', 'knn_k': 1, 'weighted_edges': False, 'symmetrize_mode': 'mutual', 'use_snp_selection': False}. Best is trial 90 with value: 0.12385554697147882.
[I 2025-11-03 13:36:38,021] Trial 115 finished with value: 0.08885326245028566 and parameters: {'model_type': 'gcn', 'hidden_dims': '[512, 256]', 'dropout': 0.3998213870308186, 'batch_norm': True, 'lr': 0.0004955080930694119, 'weight_decay': 1.4218343707747705e-05, 'epochs': 121, 'loss': 'mse', 'optimizer': 'adam', 'graph_mode': 'knn', 'source': 'grm', 'knn_k': 1, 'weighted_edges': False, 'symmetrize_mode': 'mutual', 'use_snp_selection': False}. Best is trial 90 with value: 0.12385554697147882.
[I 2025-11-03 13:36:40,013] Trial 116 finished with value: 0.11921550544967244 and parameters: {'model_type': 'gcn', 'hidden_dims': '[512, 256]', 'dropout': 0.3592037073014963, 'batch_norm': True, 'lr': 0.0008459689639322797, 'weight_decay': 1.0206372739097576e-05, 'epochs': 126, 'loss': 'mse', 'optimizer': 'adam', 'graph_mode': 'knn', 'source': 'grm', 'knn_k': 1, 'weighted_edges': False, 'symmetrize_mode': 'mutual', 'use_snp_selection': False}. Best is trial 90 with value: 0.12385554697147882.
[I 2025-11-03 13:36:41,900] Trial 117 finished with value: 0.09167580110251769 and parameters: {'model_type': 'gcn', 'hidden_dims': '[512, 256]', 'dropout': 0.3577283565938636, 'batch_norm': True, 'lr': 0.0008883642738521922, 'weight_decay': 2.2326955621388844e-05, 'epochs': 108, 'loss': 'mse', 'optimizer': 'adam', 'graph_mode': 'knn', 'source': 'grm', 'knn_k': 1, 'weighted_edges': False, 'symmetrize_mode': 'mutual', 'use_snp_selection': False}. Best is trial 90 with value: 0.12385554697147882.
[I 2025-11-03 13:36:43,884] Trial 118 finished with value: 0.10426759738525426 and parameters: {'model_type': 'gcn', 'hidden_dims': '[512, 256]', 'dropout': 0.36661679207835157, 'batch_norm': True, 'lr': 0.000756689090766135, 'weight_decay': 1.0153907917037862e-05, 'epochs': 126, 'loss': 'mse', 'optimizer': 'adam', 'graph_mode': 'knn', 'source': 'grm', 'knn_k': 1, 'weighted_edges': False, 'symmetrize_mode': 'mutual', 'use_snp_selection': False}. Best is trial 90 with value: 0.12385554697147882.
[I 2025-11-03 13:36:45,927] Trial 119 finished with value: 0.09500398808119989 and parameters: {'model_type': 'gcn', 'hidden_dims': '[512, 256]', 'dropout': 0.38306940263170847, 'batch_norm': True, 'lr': 0.00044161188152640847, 'weight_decay': 1.8156789145435295e-05, 'epochs': 137, 'loss': 'mse', 'optimizer': 'adam', 'graph_mode': 'knn', 'source': 'grm', 'knn_k': 1, 'weighted_edges': False, 'symmetrize_mode': 'mutual', 'use_snp_selection': False}. Best is trial 90 with value: 0.12385554697147882.
[I 2025-11-03 13:36:49,306] Trial 120 finished with value: 0.008283774788654228 and parameters: {'model_type': 'gcn', 'hidden_dims': '[512, 256]', 'dropout': 0.37105031320881937, 'batch_norm': False, 'lr': 0.0005345337238761618, 'weight_decay': 2.5873177614255156e-05, 'epochs': 114, 'loss': 'mse', 'optimizer': 'adam', 'graph_mode': 'knn', 'source': 'grm', 'knn_k': 1, 'weighted_edges': False, 'symmetrize_mode': 'mutual', 'use_snp_selection': True, 'num_snps': 54830}. Best is trial 90 with value: 0.12385554697147882.
[I 2025-11-03 13:36:51,486] Trial 121 finished with value: 0.10285692058229168 and parameters: {'model_type': 'gcn', 'hidden_dims': '[512, 256]', 'dropout': 0.4207833537856104, 'batch_norm': True, 'lr': 0.0006081100991043642, 'weight_decay': 7.362802358771125e-06, 'epochs': 150, 'loss': 'mse', 'optimizer': 'adam', 'graph_mode': 'knn', 'source': 'grm', 'knn_k': 1, 'weighted_edges': False, 'symmetrize_mode': 'mutual', 'use_snp_selection': False}. Best is trial 90 with value: 0.12385554697147882.
[I 2025-11-03 13:36:53,573] Trial 122 finished with value: 0.08454936614999368 and parameters: {'model_type': 'gcn', 'hidden_dims': '[512, 256]', 'dropout': 0.34799541619059576, 'batch_norm': True, 'lr': 0.0008212361736637207, 'weight_decay': 9.64781626362101e-06, 'epochs': 144, 'loss': 'mse', 'optimizer': 'adam', 'graph_mode': 'knn', 'source': 'grm', 'knn_k': 2, 'weighted_edges': False, 'symmetrize_mode': 'mutual', 'use_snp_selection': False}. Best is trial 90 with value: 0.12385554697147882.
[I 2025-11-03 13:36:55,396] Trial 123 finished with value: 0.1148512597870428 and parameters: {'model_type': 'gcn', 'hidden_dims': '[512, 256]', 'dropout': 0.392479569272004, 'batch_norm': True, 'lr': 0.0007018631330483464, 'weight_decay': 1.22672345794051e-05, 'epochs': 95, 'loss': 'mse', 'optimizer': 'adam', 'graph_mode': 'knn', 'source': 'grm', 'knn_k': 1, 'weighted_edges': False, 'symmetrize_mode': 'mutual', 'use_snp_selection': False}. Best is trial 90 with value: 0.12385554697147882.
[I 2025-11-03 13:36:57,220] Trial 124 finished with value: 0.09877184624886268 and parameters: {'model_type': 'gcn', 'hidden_dims': '[512, 256]', 'dropout': 0.3935970677688743, 'batch_norm': True, 'lr': 0.0004886526550279423, 'weight_decay': 1.4871626724065508e-05, 'epochs': 95, 'loss': 'mse', 'optimizer': 'adam', 'graph_mode': 'knn', 'source': 'grm', 'knn_k': 1, 'weighted_edges': False, 'symmetrize_mode': 'mutual', 'use_snp_selection': False}. Best is trial 90 with value: 0.12385554697147882.
[I 2025-11-03 13:36:59,138] Trial 125 finished with value: 0.09937778688920142 and parameters: {'model_type': 'gcn', 'hidden_dims': '[512, 256]', 'dropout': 0.4079997025786291, 'batch_norm': True, 'lr': 0.0007222186108471796, 'weight_decay': 0.0001032522300488033, 'epochs': 114, 'loss': 'mse', 'optimizer': 'adam', 'graph_mode': 'knn', 'source': 'grm', 'knn_k': 1, 'weighted_edges': False, 'symmetrize_mode': 'mutual', 'use_snp_selection': False}. Best is trial 90 with value: 0.12385554697147882.
[I 2025-11-03 13:37:01,165] Trial 126 finished with value: 0.11027523442088667 and parameters: {'model_type': 'gcn', 'hidden_dims': '[512, 256]', 'dropout': 0.3564689898782268, 'batch_norm': True, 'lr': 0.0008602618533469317, 'weight_decay': 1.1708609003559012e-05, 'epochs': 132, 'loss': 'mse', 'optimizer': 'adam', 'graph_mode': 'knn', 'source': 'grm', 'knn_k': 1, 'weighted_edges': False, 'symmetrize_mode': 'mutual', 'use_snp_selection': False}. Best is trial 90 with value: 0.12385554697147882.
[I 2025-11-03 13:37:02,952] Trial 127 finished with value: 0.1145622935509929 and parameters: {'model_type': 'gcn', 'hidden_dims': '[512, 256]', 'dropout': 0.334493352788368, 'batch_norm': True, 'lr': 0.000987682474114768, 'weight_decay': 4.63014252899854e-06, 'epochs': 88, 'loss': 'mse', 'optimizer': 'adam', 'graph_mode': 'knn', 'source': 'grm', 'knn_k': 1, 'weighted_edges': False, 'symmetrize_mode': 'mutual', 'use_snp_selection': False}. Best is trial 90 with value: 0.12385554697147882.
[I 2025-11-03 13:37:04,729] Trial 128 finished with value: 0.09792499256496076 and parameters: {'model_type': 'gcn', 'hidden_dims': '[512, 256]', 'dropout': 0.3325755572725179, 'batch_norm': True, 'lr': 0.0009988866017363615, 'weight_decay': 4.942938268280895e-06, 'epochs': 87, 'loss': 'mse', 'optimizer': 'adam', 'graph_mode': 'knn', 'source': 'grm', 'knn_k': 1, 'weighted_edges': False, 'symmetrize_mode': 'mutual', 'use_snp_selection': False}. Best is trial 90 with value: 0.12385554697147882.
[I 2025-11-03 13:37:06,561] Trial 129 finished with value: 0.11637900571729075 and parameters: {'model_type': 'gcn', 'hidden_dims': '[512, 256]', 'dropout': 0.35617434865636727, 'batch_norm': True, 'lr': 0.000869485588841773, 'weight_decay': 6.608530762036859e-07, 'epochs': 97, 'loss': 'mse', 'optimizer': 'adam', 'graph_mode': 'knn', 'source': 'grm', 'knn_k': 2, 'weighted_edges': False, 'symmetrize_mode': 'mutual', 'use_snp_selection': False}. Best is trial 90 with value: 0.12385554697147882.
[I 2025-11-03 13:37:08,304] Trial 130 finished with value: 0.07910329293352844 and parameters: {'model_type': 'gcn', 'hidden_dims': '[512, 256]', 'dropout': 0.35679143733340773, 'batch_norm': True, 'lr': 0.0009192140023454264, 'weight_decay': 5.218386163425656e-07, 'epochs': 78, 'loss': 'mse', 'optimizer': 'adam', 'graph_mode': 'knn', 'source': 'grm', 'knn_k': 2, 'weighted_edges': False, 'symmetrize_mode': 'mutual', 'use_snp_selection': False}. Best is trial 90 with value: 0.12385554697147882.
[I 2025-11-03 13:37:10,156] Trial 131 finished with value: 0.11223410724347078 and parameters: {'model_type': 'gcn', 'hidden_dims': '[512, 256]', 'dropout': 0.3361558821903332, 'batch_norm': True, 'lr': 0.0008566341011650674, 'weight_decay': 6.378909117603708e-07, 'epochs': 100, 'loss': 'mse', 'optimizer': 'adam', 'graph_mode': 'knn', 'source': 'grm', 'knn_k': 1, 'weighted_edges': False, 'symmetrize_mode': 'mutual', 'use_snp_selection': False}. Best is trial 90 with value: 0.12385554697147882.
[I 2025-11-03 13:37:11,842] Trial 132 finished with value: 0.10573223258179054 and parameters: {'model_type': 'gcn', 'hidden_dims': '[512, 256]', 'dropout': 0.3190639267600016, 'batch_norm': True, 'lr': 0.0008457166660390463, 'weight_decay': 6.366116473567929e-07, 'epochs': 71, 'loss': 'mse', 'optimizer': 'adam', 'graph_mode': 'knn', 'source': 'grm', 'knn_k': 1, 'weighted_edges': False, 'symmetrize_mode': 'mutual', 'use_snp_selection': False}. Best is trial 90 with value: 0.12385554697147882.
[I 2025-11-03 13:37:13,642] Trial 133 finished with value: 0.10441940266356159 and parameters: {'model_type': 'gcn', 'hidden_dims': '[512, 256]', 'dropout': 0.33981253602002987, 'batch_norm': True, 'lr': 0.0008282249921621087, 'weight_decay': 1.1642763496868225e-06, 'epochs': 91, 'loss': 'mse', 'optimizer': 'adam', 'graph_mode': 'knn', 'source': 'grm', 'knn_k': 2, 'weighted_edges': False, 'symmetrize_mode': 'mutual', 'use_snp_selection': False}. Best is trial 90 with value: 0.12385554697147882.
[I 2025-11-03 13:37:15,497] Trial 134 finished with value: 0.09051590056720576 and parameters: {'model_type': 'gcn', 'hidden_dims': '[512, 256]', 'dropout': 0.35197859867333087, 'batch_norm': True, 'lr': 0.000996035158368642, 'weight_decay': 3.9701713233110805e-07, 'epochs': 102, 'loss': 'mse', 'optimizer': 'adam', 'graph_mode': 'knn', 'source': 'grm', 'knn_k': 1, 'weighted_edges': False, 'symmetrize_mode': 'mutual', 'use_snp_selection': False}. Best is trial 90 with value: 0.12385554697147882.
[I 2025-11-03 13:37:17,307] Trial 135 finished with value: 0.10895628286922783 and parameters: {'model_type': 'gcn', 'hidden_dims': '[512, 256]', 'dropout': 0.32462474296233185, 'batch_norm': True, 'lr': 0.0007755350063275247, 'weight_decay': 7.329663185145105e-07, 'epochs': 94, 'loss': 'mse', 'optimizer': 'adam', 'graph_mode': 'knn', 'source': 'grm', 'knn_k': 1, 'weighted_edges': False, 'symmetrize_mode': 'mutual', 'use_snp_selection': False}. Best is trial 90 with value: 0.12385554697147882.
[I 2025-11-03 13:37:19,073] Trial 136 finished with value: 0.06316853545622247 and parameters: {'model_type': 'gcn', 'hidden_dims': '[512, 256]', 'dropout': 0.3646365351899156, 'batch_norm': True, 'lr': 0.0007175202775938513, 'weight_decay': 8.157143857682207e-06, 'epochs': 65, 'loss': 'mse', 'optimizer': 'adam', 'graph_mode': 'knn', 'source': 'grm', 'knn_k': 2, 'weighted_edges': False, 'symmetrize_mode': 'union', 'use_snp_selection': True, 'num_snps': 19219}. Best is trial 90 with value: 0.12385554697147882.
