[I 2025-11-03 13:44:20,277] Trial 59 finished with value: -0.0036744339504404333 and parameters: {'model_type': 'graphsage', 'hidden_dims': '[512, 64]', 'dropout': 0.30913709230456105, 'batch_norm': False, 'lr': 0.00018782018377022826, 'weight_decay': 3.4797705588504086e-05, 'epochs': 209, 'loss': 'mse', 'optimizer': 'adam', 'graph_mode': 'cutoff', 'cutoff': 0.6533225181520949, 'grm_norm': 'none', 'self_loops': False, 'use_snp_selection': True, 'num_snps': 53864}. Best is trial 14 with value: 0.07089940486947045.
[I 2025-11-03 13:44:23,313] Trial 60 finished with value: 0.023593809465351553 and parameters: {'model_type': 'graphsage', 'hidden_dims': '[128, 64]', 'dropout': 0.19903655350372168, 'batch_norm': False, 'lr': 2.792079123049513e-06, 'weight_decay': 4.7701348663481634e-05, 'epochs': 71, 'loss': 'mae', 'optimizer': 'adam', 'graph_mode': 'cutoff', 'cutoff': 0.7603287286033259, 'grm_norm': 'gcn', 'self_loops': False, 'use_snp_selection': True, 'num_snps': 48837}. Best is trial 14 with value: 0.07089940486947045.
[I 2025-11-03 13:44:25,752] Trial 61 finished with value: -0.012878987992107674 and parameters: {'model_type': 'graphsage', 'hidden_dims': '[128, 64]', 'dropout': 0.23650299728297686, 'batch_norm': True, 'lr': 1.2288075127140845e-06, 'weight_decay': 0.00020416108197337274, 'epochs': 307, 'loss': 'mae', 'optimizer': 'adam', 'graph_mode': 'cutoff', 'cutoff': 0.6959793240254268, 'grm_norm': 'none', 'self_loops': False, 'use_snp_selection': False}. Best is trial 14 with value: 0.07089940486947045.
[I 2025-11-03 13:44:27,685] Trial 62 finished with value: 0.027229074981665227 and parameters: {'model_type': 'graphsage', 'hidden_dims': '[128, 64]', 'dropout': 0.22144803209348657, 'batch_norm': True, 'lr': 5.534427688293992e-05, 'weight_decay': 1.5037868715545034e-05, 'epochs': 185, 'loss': 'mae', 'optimizer': 'adam', 'graph_mode': 'cutoff', 'cutoff': 0.7152734156389964, 'grm_norm': 'none', 'self_loops': False, 'use_snp_selection': False}. Best is trial 14 with value: 0.07089940486947045.
[I 2025-11-03 13:44:30,160] Trial 63 finished with value: 0.03389242583211176 and parameters: {'model_type': 'graphsage', 'hidden_dims': '[128, 64]', 'dropout': 0.14882028185256793, 'batch_norm': True, 'lr': 3.7787359820580376e-06, 'weight_decay': 5.325853078312703e-05, 'epochs': 317, 'loss': 'mae', 'optimizer': 'adam', 'graph_mode': 'cutoff', 'cutoff': 0.592986217192362, 'grm_norm': 'none', 'self_loops': False, 'use_snp_selection': False}. Best is trial 14 with value: 0.07089940486947045.
[I 2025-11-03 13:44:32,662] Trial 64 finished with value: 0.0391893088045047 and parameters: {'model_type': 'graphsage', 'hidden_dims': '[128, 64]', 'dropout': 0.3265446808139497, 'batch_norm': True, 'lr': 2.3404508728516916e-06, 'weight_decay': 0.0001129055488830061, 'epochs': 323, 'loss': 'mae', 'optimizer': 'adam', 'graph_mode': 'cutoff', 'cutoff': 0.7841471233324973, 'grm_norm': 'none', 'self_loops': False, 'use_snp_selection': False}. Best is trial 14 with value: 0.07089940486947045.
[I 2025-11-03 13:44:35,026] Trial 65 finished with value: 0.021132710110018733 and parameters: {'model_type': 'graphsage', 'hidden_dims': '[128, 64]', 'dropout': 0.24004270500845498, 'batch_norm': True, 'lr': 1.0813691545271785e-06, 'weight_decay': 2.8603671999886652e-05, 'epochs': 290, 'loss': 'mae', 'optimizer': 'adam', 'graph_mode': 'cutoff', 'cutoff': 0.6688556252985293, 'grm_norm': 'none', 'self_loops': True, 'use_snp_selection': False}. Best is trial 14 with value: 0.07089940486947045.
[I 2025-11-03 13:44:38,642] Trial 66 finished with value: 0.006620503544579185 and parameters: {'model_type': 'graphsage', 'hidden_dims': '[256, 128]', 'dropout': 0.2604877144228597, 'batch_norm': True, 'lr': 1.0488298038078883e-05, 'weight_decay': 0.0001563846485208706, 'epochs': 346, 'loss': 'mae', 'optimizer': 'adam', 'graph_mode': 'cutoff', 'cutoff': 0.37658126440244033, 'grm_norm': 'cosine_then_gcn', 'self_loops': False, 'use_snp_selection': False}. Best is trial 14 with value: 0.07089940486947045.
[I 2025-11-03 13:44:40,511] Trial 67 finished with value: 0.03098832264854899 and parameters: {'model_type': 'graphsage', 'hidden_dims': '[128, 64]', 'dropout': 0.2879590526424821, 'batch_norm': True, 'lr': 7.359955045890432e-06, 'weight_decay': 2.1158872686101947e-05, 'epochs': 169, 'loss': 'mae', 'optimizer': 'adam', 'graph_mode': 'cutoff', 'cutoff': 0.6323911508327908, 'grm_norm': 'none', 'self_loops': False, 'use_snp_selection': False}. Best is trial 14 with value: 0.07089940486947045.
[I 2025-11-03 13:44:43,950] Trial 68 finished with value: 0.049334952799800574 and parameters: {'model_type': 'graphsage', 'hidden_dims': '[128, 64]', 'dropout': 0.20617509300647174, 'batch_norm': False, 'lr': 1.5332728900251712e-05, 'weight_decay': 6.027847128585013e-05, 'epochs': 258, 'loss': 'mae', 'optimizer': 'adam', 'graph_mode': 'cutoff', 'cutoff': 0.7191080907706533, 'grm_norm': 'cosine', 'self_loops': False, 'use_snp_selection': True, 'num_snps': 41189}. Best is trial 14 with value: 0.07089940486947045.
[I 2025-11-03 13:44:47,997] Trial 69 finished with value: -0.0035496590114889137 and parameters: {'model_type': 'graphsage', 'hidden_dims': '[256, 128, 64]', 'dropout': 0.19307659276415584, 'batch_norm': False, 'lr': 1.574690832343593e-05, 'weight_decay': 6.786976338644531e-05, 'epochs': 255, 'loss': 'mae', 'optimizer': 'adam', 'graph_mode': 'knn', 'source': 'grm', 'knn_k': 2, 'weighted_edges': False, 'symmetrize_mode': 'mutual', 'use_snp_selection': True, 'num_snps': 42475}. Best is trial 14 with value: 0.07089940486947045.
[I 2025-11-03 13:44:51,604] Trial 70 finished with value: 0.01713114576607468 and parameters: {'model_type': 'graphsage', 'hidden_dims': '[128, 64]', 'dropout': 0.40827195425207174, 'batch_norm': False, 'lr': 2.1791926334845014e-05, 'weight_decay': 0.00010953771164837539, 'epochs': 268, 'loss': 'mae', 'optimizer': 'adam', 'graph_mode': 'cutoff', 'cutoff': 0.7368598783941309, 'grm_norm': 'cosine', 'self_loops': False, 'use_snp_selection': True, 'num_snps': 44649}. Best is trial 14 with value: 0.07089940486947045.
[I 2025-11-03 13:44:54,969] Trial 71 finished with value: 0.0007040846366689798 and parameters: {'model_type': 'graphsage', 'hidden_dims': '[128, 64]', 'dropout': 0.2099011607359514, 'batch_norm': False, 'lr': 1.3203309797603842e-05, 'weight_decay': 3.628133343610957e-05, 'epochs': 247, 'loss': 'mae', 'optimizer': 'adam', 'graph_mode': 'cutoff', 'cutoff': 0.6825678651597674, 'grm_norm': 'cosine', 'self_loops': False, 'use_snp_selection': True, 'num_snps': 39722}. Best is trial 14 with value: 0.07089940486947045.
[I 2025-11-03 13:44:58,569] Trial 72 finished with value: -0.015158835904453808 and parameters: {'model_type': 'graphsage', 'hidden_dims': '[128, 64]', 'dropout': 0.17530788617003518, 'batch_norm': False, 'lr': 5.303586895999469e-06, 'weight_decay': 1.2341655238483388e-05, 'epochs': 228, 'loss': 'mae', 'optimizer': 'adam', 'graph_mode': 'cutoff', 'cutoff': 0.7035464019662027, 'grm_norm': 'cosine', 'self_loops': False, 'use_snp_selection': True, 'num_snps': 48518}. Best is trial 14 with value: 0.07089940486947045.
[I 2025-11-03 13:45:01,789] Trial 73 finished with value: 0.039479878817705094 and parameters: {'model_type': 'graphsage', 'hidden_dims': '[128, 64]', 'dropout': 0.1375639308091136, 'batch_norm': False, 'lr': 3.939594330910915e-05, 'weight_decay': 5.5796615556690844e-05, 'epochs': 57, 'loss': 'mae', 'optimizer': 'adam', 'graph_mode': 'cutoff', 'cutoff': 0.6622646542933314, 'grm_norm': 'cosine', 'self_loops': False, 'use_snp_selection': True, 'num_snps': 55324}. Best is trial 14 with value: 0.07089940486947045.
[I 2025-11-03 13:45:04,269] Trial 74 finished with value: 0.024975457848693913 and parameters: {'model_type': 'graphsage', 'hidden_dims': '[128, 64]', 'dropout': 0.5603703359911668, 'batch_norm': False, 'lr': 1.0429311484839972e-05, 'weight_decay': 8.896138487592428e-05, 'epochs': 95, 'loss': 'mae', 'optimizer': 'adam', 'graph_mode': 'cutoff', 'cutoff': 0.8113664613688114, 'grm_norm': 'cosine_then_gcn', 'self_loops': False, 'use_snp_selection': True, 'num_snps': 29140}. Best is trial 14 with value: 0.07089940486947045.
[I 2025-11-03 13:45:06,352] Trial 75 finished with value: 0.017905130612318527 and parameters: {'model_type': 'graphsage', 'hidden_dims': '[128, 64]', 'dropout': 0.2436120253116221, 'batch_norm': True, 'lr': 4.373426817851261e-06, 'weight_decay': 0.00026438621697248894, 'epochs': 220, 'loss': 'mae', 'optimizer': 'adam', 'graph_mode': 'cutoff', 'cutoff': 0.7698858035546331, 'grm_norm': 'none', 'self_loops': False, 'use_snp_selection': False}. Best is trial 14 with value: 0.07089940486947045.
[I 2025-11-03 13:45:10,059] Trial 76 finished with value: 0.05532133252539154 and parameters: {'model_type': 'graphsage', 'hidden_dims': '[512, 128]', 'dropout': 0.26660112953606596, 'batch_norm': False, 'lr': 7.62716481687142e-06, 'weight_decay': 5.023515565483031e-07, 'epochs': 199, 'loss': 'mse', 'optimizer': 'adam', 'graph_mode': 'cutoff', 'cutoff': 0.7188858937783941, 'grm_norm': 'none', 'self_loops': False, 'use_snp_selection': True, 'num_snps': 32020}. Best is trial 14 with value: 0.07089940486947045.
[I 2025-11-03 13:45:14,253] Trial 77 finished with value: 0.04413385944701513 and parameters: {'model_type': 'graphsage', 'hidden_dims': '[512, 128]', 'dropout': 0.27085674495037415, 'batch_norm': False, 'lr': 7.344332175603454e-06, 'weight_decay': 7.299650466566978e-07, 'epochs': 264, 'loss': 'mse', 'optimizer': 'adam', 'graph_mode': 'cutoff', 'cutoff': 0.7361609920780615, 'grm_norm': 'none', 'self_loops': True, 'use_snp_selection': True, 'num_snps': 32477}. Best is trial 14 with value: 0.07089940486947045.
[I 2025-11-03 13:45:18,894] Trial 78 finished with value: 0.012916488243682767 and parameters: {'model_type': 'graphsage', 'hidden_dims': '[512, 128]', 'dropout': 0.2665886462709177, 'batch_norm': False, 'lr': 6.795123840223797e-06, 'weight_decay': 3.460135729296992e-07, 'epochs': 273, 'loss': 'mse', 'optimizer': 'adam', 'graph_mode': 'cutoff', 'cutoff': 0.7413026619224746, 'grm_norm': 'none', 'self_loops': True, 'use_snp_selection': True, 'num_snps': 37027}. Best is trial 14 with value: 0.07089940486947045.
[I 2025-11-03 13:45:23,260] Trial 79 finished with value: 0.014710599275965368 and parameters: {'model_type': 'graphsage', 'hidden_dims': '[512, 128]', 'dropout': 0.3201816729028409, 'batch_norm': False, 'lr': 8.395090811874625e-06, 'weight_decay': 6.403624881852101e-07, 'epochs': 293, 'loss': 'mse', 'optimizer': 'adam', 'graph_mode': 'cutoff', 'cutoff': 0.7857722853092725, 'grm_norm': 'gcn', 'self_loops': True, 'use_snp_selection': True, 'num_snps': 32394}. Best is trial 14 with value: 0.07089940486947045.
[I 2025-11-03 13:45:27,005] Trial 80 finished with value: 0.014007345904374009 and parameters: {'model_type': 'graphsage', 'hidden_dims': '[512, 128]', 'dropout': 0.28231579674710894, 'batch_norm': False, 'lr': 5.155579929409464e-06, 'weight_decay': 2.442369476158098e-06, 'epochs': 119, 'loss': 'mse', 'optimizer': 'adam', 'graph_mode': 'cutoff', 'cutoff': 0.8528201131106681, 'grm_norm': 'cosine_then_gcn', 'self_loops': True, 'use_snp_selection': True, 'num_snps': 37787}. Best is trial 14 with value: 0.07089940486947045.
[I 2025-11-03 13:45:32,096] Trial 81 finished with value: 0.0521731085465647 and parameters: {'model_type': 'graphsage', 'hidden_dims': '[512, 128]', 'dropout': 0.22099691862323317, 'batch_norm': False, 'lr': 6.037872686692987e-06, 'weight_decay': 1.2703174636896528e-06, 'epochs': 263, 'loss': 'mse', 'optimizer': 'adam', 'graph_mode': 'cutoff', 'cutoff': 0.719915734814318, 'grm_norm': 'none', 'self_loops': True, 'use_snp_selection': True, 'num_snps': 42642}. Best is trial 14 with value: 0.07089940486947045.
[I 2025-11-03 13:45:37,266] Trial 82 finished with value: 0.0531289793672259 and parameters: {'model_type': 'graphsage', 'hidden_dims': '[512, 128]', 'dropout': 0.35766369647100604, 'batch_norm': False, 'lr': 3.3800902022694906e-06, 'weight_decay': 1.138115066319622e-06, 'epochs': 283, 'loss': 'mse', 'optimizer': 'adam', 'graph_mode': 'cutoff', 'cutoff': 0.7219064429030447, 'grm_norm': 'none', 'self_loops': True, 'use_snp_selection': True, 'num_snps': 41598}. Best is trial 14 with value: 0.07089940486947045.
[I 2025-11-03 13:45:42,448] Trial 83 finished with value: 0.04070468200887459 and parameters: {'model_type': 'graphsage', 'hidden_dims': '[512, 128]', 'dropout': 0.35672562071062724, 'batch_norm': False, 'lr': 3.08627548218769e-06, 'weight_decay': 5.115565544466188e-07, 'epochs': 281, 'loss': 'mse', 'optimizer': 'adam', 'graph_mode': 'cutoff', 'cutoff': 0.6825990751440265, 'grm_norm': 'none', 'self_loops': True, 'use_snp_selection': True, 'num_snps': 41713}. Best is trial 14 with value: 0.07089940486947045.
[I 2025-11-03 13:45:47,828] Trial 84 finished with value: 0.053865038071961045 and parameters: {'model_type': 'graphsage', 'hidden_dims': '[512, 128]', 'dropout': 0.3732148037395405, 'batch_norm': False, 'lr': 3.823843584064778e-06, 'weight_decay': 1.1189425976114212e-06, 'epochs': 280, 'loss': 'mse', 'optimizer': 'adam', 'graph_mode': 'cutoff', 'cutoff': 0.7194617000505815, 'grm_norm': 'none', 'self_loops': True, 'use_snp_selection': True, 'num_snps': 44726}. Best is trial 14 with value: 0.07089940486947045.
[I 2025-11-03 13:45:53,256] Trial 85 finished with value: 0.06964062475145302 and parameters: {'model_type': 'graphsage', 'hidden_dims': '[512, 128]', 'dropout': 0.3735125928192643, 'batch_norm': False, 'lr': 2.0993813225487676e-06, 'weight_decay': 1.1241516638207553e-06, 'epochs': 281, 'loss': 'mse', 'optimizer': 'adam', 'graph_mode': 'cutoff', 'cutoff': 0.7190240952662107, 'grm_norm': 'none', 'self_loops': True, 'use_snp_selection': True, 'num_snps': 44948}. Best is trial 14 with value: 0.07089940486947045.
[I 2025-11-03 13:45:58,715] Trial 86 finished with value: 0.051915044629215853 and parameters: {'model_type': 'graphsage', 'hidden_dims': '[512, 128]', 'dropout': 0.3711198336677671, 'batch_norm': False, 'lr': 3.3055716795452034e-06, 'weight_decay': 1.3001939172754826e-06, 'epochs': 277, 'loss': 'mse', 'optimizer': 'adam', 'graph_mode': 'cutoff', 'cutoff': 0.7181224279957743, 'grm_norm': 'none', 'self_loops': True, 'use_snp_selection': True, 'num_snps': 45848}. Best is trial 14 with value: 0.07089940486947045.
[I 2025-11-03 13:46:04,102] Trial 87 finished with value: 0.026970363301653234 and parameters: {'model_type': 'graphsage', 'hidden_dims': '[512, 128]', 'dropout': 0.3896054851452492, 'batch_norm': False, 'lr': 2.1509275413505894e-06, 'weight_decay': 1.294944725574442e-06, 'epochs': 276, 'loss': 'mse', 'optimizer': 'adam', 'graph_mode': 'cutoff', 'cutoff': 0.7535570356381855, 'grm_norm': 'none', 'self_loops': True, 'use_snp_selection': True, 'num_snps': 45092}. Best is trial 14 with value: 0.07089940486947045.
[I 2025-11-03 13:46:10,894] Trial 88 finished with value: 0.03497756774913684 and parameters: {'model_type': 'graphsage', 'hidden_dims': '[512, 128]', 'dropout': 0.4251088243052065, 'batch_norm': False, 'lr': 3.219860868191953e-06, 'weight_decay': 1.1635305112281246e-06, 'epochs': 288, 'loss': 'mse', 'optimizer': 'adam', 'graph_mode': 'knn', 'source': 'grm', 'knn_k': 9, 'weighted_edges': True, 'symmetrize_mode': 'union', 'use_snp_selection': True, 'num_snps': 46887}. Best is trial 14 with value: 0.07089940486947045.
[I 2025-11-03 13:46:16,914] Trial 89 finished with value: 0.033392768911570454 and parameters: {'model_type': 'graphsage', 'hidden_dims': '[512, 128]', 'dropout': 0.37143904737624756, 'batch_norm': False, 'lr': 1.4441547580613875e-06, 'weight_decay': 3.2277995899089412e-06, 'epochs': 303, 'loss': 'mse', 'optimizer': 'adam', 'graph_mode': 'cutoff', 'cutoff': 0.7126141515171978, 'grm_norm': 'none', 'self_loops': True, 'use_snp_selection': True, 'num_snps': 50497}. Best is trial 14 with value: 0.07089940486947045.
[I 2025-11-03 13:46:22,355] Trial 90 finished with value: 0.014626742346954333 and parameters: {'model_type': 'graphsage', 'hidden_dims': '[512, 128]', 'dropout': 0.33576099506666807, 'batch_norm': False, 'lr': 4.2834477249047526e-06, 'weight_decay': 3.3202685298386324e-07, 'epochs': 300, 'loss': 'mse', 'optimizer': 'adam', 'graph_mode': 'cutoff', 'cutoff': 0.8061107995583486, 'grm_norm': 'none', 'self_loops': True, 'use_snp_selection': True, 'num_snps': 43867}. Best is trial 14 with value: 0.07089940486947045.
[I 2025-11-03 13:46:27,215] Trial 91 finished with value: 0.026672917878661453 and parameters: {'model_type': 'graphsage', 'hidden_dims': '[512, 128]', 'dropout': 0.3655545243720973, 'batch_norm': False, 'lr': 1.9910526402360944e-06, 'weight_decay': 1.6879689269459176e-06, 'epochs': 262, 'loss': 'mse', 'optimizer': 'adam', 'graph_mode': 'cutoff', 'cutoff': 0.7175436936234857, 'grm_norm': 'none', 'self_loops': True, 'use_snp_selection': True, 'num_snps': 40207}. Best is trial 14 with value: 0.07089940486947045.
[I 2025-11-03 13:46:32,331] Trial 92 finished with value: 0.028813750102940676 and parameters: {'model_type': 'graphsage', 'hidden_dims': '[512, 128]', 'dropout': 0.3465824942980237, 'batch_norm': False, 'lr': 2.836830011457777e-06, 'weight_decay': 1.4741431361424241e-06, 'epochs': 280, 'loss': 'mse', 'optimizer': 'adam', 'graph_mode': 'cutoff', 'cutoff': 0.7658189257574286, 'grm_norm': 'none', 'self_loops': True, 'use_snp_selection': True, 'num_snps': 41324}. Best is trial 14 with value: 0.07089940486947045.
[I 2025-11-03 13:46:37,650] Trial 93 finished with value: 0.029516602153635916 and parameters: {'model_type': 'graphsage', 'hidden_dims': '[512, 128]', 'dropout': 0.39548694921422745, 'batch_norm': False, 'lr': 6.150976716435331e-06, 'weight_decay': 8.895062527296498e-07, 'epochs': 253, 'loss': 'mse', 'optimizer': 'adam', 'graph_mode': 'cutoff', 'cutoff': 0.6948949590392289, 'grm_norm': 'none', 'self_loops': True, 'use_snp_selection': True, 'num_snps': 46592}. Best is trial 14 with value: 0.07089940486947045.
[I 2025-11-03 13:46:42,169] Trial 94 finished with value: 0.0012550685549490323 and parameters: {'model_type': 'graphsage', 'hidden_dims': '[512, 128]', 'dropout': 0.4149321073059037, 'batch_norm': False, 'lr': 4.585377187687643e-06, 'weight_decay': 5.095543466052698e-07, 'epochs': 243, 'loss': 'mse', 'optimizer': 'adam', 'graph_mode': 'cutoff', 'cutoff': 0.7261512587188573, 'grm_norm': 'none', 'self_loops': True, 'use_snp_selection': True, 'num_snps': 37888}. Best is trial 14 with value: 0.07089940486947045.
[I 2025-11-03 13:46:47,929] Trial 95 finished with value: 0.012970920137198458 and parameters: {'model_type': 'graphsage', 'hidden_dims': '[512, 128]', 'dropout': 0.34056882176132414, 'batch_norm': False, 'lr': 3.446719764497067e-06, 'weight_decay': 1.0074351962482646e-06, 'epochs': 284, 'loss': 'mse', 'optimizer': 'adam', 'graph_mode': 'cutoff', 'cutoff': 0.7486691296372017, 'grm_norm': 'none', 'self_loops': True, 'use_snp_selection': True, 'num_snps': 48677}. Best is trial 14 with value: 0.07089940486947045.
[I 2025-11-03 13:46:53,108] Trial 96 finished with value: 0.03523821239084923 and parameters: {'model_type': 'graphsage', 'hidden_dims': '[512, 128]', 'dropout': 0.2190652883011908, 'batch_norm': False, 'lr': 5.7477664384995596e-06, 'weight_decay': 4.1894135700373855e-06, 'epochs': 269, 'loss': 'mse', 'optimizer': 'adam', 'graph_mode': 'cutoff', 'cutoff': 0.6790626309944098, 'grm_norm': 'none', 'self_loops': True, 'use_snp_selection': True, 'num_snps': 43260}. Best is trial 14 with value: 0.07089940486947045.
[I 2025-11-03 13:46:57,461] Trial 97 finished with value: 0.037630139620897535 and parameters: {'model_type': 'graphsage', 'hidden_dims': '[512, 128]', 'dropout': 0.4312819120032793, 'batch_norm': False, 'lr': 3.781044834452976e-06, 'weight_decay': 2.8660059759734535e-07, 'epochs': 239, 'loss': 'mse', 'optimizer': 'adam', 'graph_mode': 'cutoff', 'cutoff': 0.6394111497183119, 'grm_norm': 'cosine', 'self_loops': True, 'use_snp_selection': True, 'num_snps': 36093}. Best is trial 14 with value: 0.07089940486947045.
[I 2025-11-03 13:47:02,439] Trial 98 finished with value: 0.026433914618236472 and parameters: {'model_type': 'graphsage', 'hidden_dims': '[512, 128]', 'dropout': 0.3816341350599387, 'batch_norm': False, 'lr': 2.479270751954701e-06, 'weight_decay': 2.3320932983162195e-06, 'epochs': 259, 'loss': 'mse', 'optimizer': 'adam', 'graph_mode': 'cutoff', 'cutoff': 0.7858385747602923, 'grm_norm': 'none', 'self_loops': True, 'use_snp_selection': True, 'num_snps': 41511}. Best is trial 14 with value: 0.07089940486947045.
[I 2025-11-03 13:47:04,986] Trial 99 finished with value: 0.03843792598955506 and parameters: {'model_type': 'graphsage', 'hidden_dims': '[512, 64]', 'dropout': 0.20420543927627116, 'batch_norm': False, 'lr': 5.0830842729848446e-06, 'weight_decay': 2.8887972690573445e-06, 'epochs': 300, 'loss': 'mse', 'optimizer': 'adam', 'graph_mode': 'cutoff', 'cutoff': 0.725122460012026, 'grm_norm': 'none', 'self_loops': True, 'use_snp_selection': True, 'num_snps': 7983}. Best is trial 14 with value: 0.07089940486947045.
[I 2025-11-03 13:47:10,304] Trial 100 finished with value: 0.03158105294824655 and parameters: {'model_type': 'graphsage', 'hidden_dims': '[512, 256]', 'dropout': 0.22840471339956864, 'batch_norm': False, 'lr': 1.4867170069737353e-06, 'weight_decay': 6.02813270478127e-07, 'epochs': 249, 'loss': 'mse', 'optimizer': 'adam', 'graph_mode': 'cutoff', 'cutoff': 0.6996217630177274, 'grm_norm': 'none', 'self_loops': True, 'use_snp_selection': True, 'num_snps': 46920}. Best is trial 14 with value: 0.07089940486947045.
