[I 2025-11-03 12:26:21,157] Trial 96 finished with value: 0.056731109413455015 and parameters: {'model_type': 'gcn', 'hidden_dims': '[512, 256]', 'dropout': 0.5176173353591514, 'batch_norm': True, 'lr': 0.0007229122801540537, 'weight_decay': 1.9517785966206273e-07, 'epochs': 207, 'loss': 'mse', 'optimizer': 'adam', 'graph_mode': 'off', 'use_snp_selection': False}. Best is trial 16 with value: 0.08131540450815136.
[I 2025-11-03 12:26:23,632] Trial 97 finished with value: 0.06563851762996438 and parameters: {'model_type': 'gcn', 'hidden_dims': '[512, 256]', 'dropout': 0.5405584987466736, 'batch_norm': True, 'lr': 0.00017127481736630356, 'weight_decay': 4.1389639353664266e-07, 'epochs': 342, 'loss': 'mse', 'optimizer': 'adam', 'graph_mode': 'off', 'use_snp_selection': False}. Best is trial 16 with value: 0.08131540450815136.
[I 2025-11-03 12:26:26,022] Trial 98 finished with value: 0.011096358495423703 and parameters: {'model_type': 'gcn', 'hidden_dims': '[512, 256]', 'dropout': 0.5358575269300435, 'batch_norm': False, 'lr': 0.00016564768704646827, 'weight_decay': 1.732394799961945e-06, 'epochs': 345, 'loss': 'mse', 'optimizer': 'adam', 'graph_mode': 'off', 'use_snp_selection': False}. Best is trial 16 with value: 0.08131540450815136.
[I 2025-11-03 12:26:28,433] Trial 99 finished with value: 0.055098198376105634 and parameters: {'model_type': 'gcn', 'hidden_dims': '[512, 256]', 'dropout': 0.49355254392408093, 'batch_norm': True, 'lr': 7.814209908524934e-05, 'weight_decay': 5.757480532065917e-07, 'epochs': 333, 'loss': 'mae', 'optimizer': 'adam', 'graph_mode': 'off', 'use_snp_selection': False}. Best is trial 16 with value: 0.08131540450815136.
[I 2025-11-03 12:26:30,890] Trial 100 finished with value: 0.027049058545201548 and parameters: {'model_type': 'gcn', 'hidden_dims': '[512, 256]', 'dropout': 0.4648462927261928, 'batch_norm': True, 'lr': 5.8068898176502534e-05, 'weight_decay': 1.1588117436735339e-06, 'epochs': 340, 'loss': 'mse', 'optimizer': 'adam', 'graph_mode': 'off', 'use_snp_selection': False}. Best is trial 16 with value: 0.08131540450815136.
[I 2025-11-03 12:26:33,263] Trial 101 finished with value: 0.04619882707165581 and parameters: {'model_type': 'gcn', 'hidden_dims': '[512, 256]', 'dropout': 0.5102020778584232, 'batch_norm': True, 'lr': 0.00020031567849916875, 'weight_decay': 3.8097852594075085e-07, 'epochs': 328, 'loss': 'mse', 'optimizer': 'adam', 'graph_mode': 'off', 'use_snp_selection': False}. Best is trial 16 with value: 0.08131540450815136.
[I 2025-11-03 12:26:35,013] Trial 102 finished with value: 0.04078283257011481 and parameters: {'model_type': 'gcn', 'hidden_dims': '[512, 256]', 'dropout': 0.5504891531021894, 'batch_norm': True, 'lr': 0.00023273345319498945, 'weight_decay': 1.4955445303447185e-07, 'epochs': 203, 'loss': 'mse', 'optimizer': 'adam', 'graph_mode': 'off', 'use_snp_selection': False}. Best is trial 16 with value: 0.08131540450815136.
[I 2025-11-03 12:26:36,863] Trial 103 finished with value: 0.024186659720737025 and parameters: {'model_type': 'gcn', 'hidden_dims': '[512, 256]', 'dropout': 0.28780045387525954, 'batch_norm': True, 'lr': 0.00010833224855653639, 'weight_decay': 2.770394873794852e-07, 'epochs': 215, 'loss': 'mse', 'optimizer': 'adam', 'graph_mode': 'off', 'use_snp_selection': False}. Best is trial 16 with value: 0.08131540450815136.
[I 2025-11-03 12:26:38,863] Trial 104 finished with value: -0.016713357814840017 and parameters: {'model_type': 'gcn', 'hidden_dims': '[512, 128]', 'dropout': 0.4474688600918333, 'batch_norm': True, 'lr': 2.7344203603628323e-05, 'weight_decay': 4.468778783235075e-07, 'epochs': 246, 'loss': 'mse', 'optimizer': 'adam', 'graph_mode': 'off', 'use_snp_selection': False}. Best is trial 16 with value: 0.08131540450815136.
[I 2025-11-03 12:26:41,055] Trial 105 finished with value: 0.051473979930085706 and parameters: {'model_type': 'gcn', 'hidden_dims': '[512, 256]', 'dropout': 0.5890887471034787, 'batch_norm': True, 'lr': 0.00014094290904880793, 'weight_decay': 1.010486833817918e-07, 'epochs': 290, 'loss': 'mse', 'optimizer': 'adam', 'graph_mode': 'off', 'use_snp_selection': False}. Best is trial 16 with value: 0.08131540450815136.
[I 2025-11-03 12:26:43,390] Trial 106 finished with value: 0.05441260224460717 and parameters: {'model_type': 'gcn', 'hidden_dims': '[512, 256]', 'dropout': 0.5252699385055234, 'batch_norm': True, 'lr': 0.0006198729826877678, 'weight_decay': 2.3170900139864606e-07, 'epochs': 314, 'loss': 'mse', 'optimizer': 'adam', 'graph_mode': 'off', 'use_snp_selection': False}. Best is trial 16 with value: 0.08131540450815136.
[I 2025-11-03 12:26:44,968] Trial 107 finished with value: 0.00684767337678979 and parameters: {'model_type': 'gcn', 'hidden_dims': '[512, 64]', 'dropout': 0.487578376542362, 'batch_norm': True, 'lr': 3.688444326559862e-05, 'weight_decay': 6.383817413053752e-07, 'epochs': 160, 'loss': 'mse', 'optimizer': 'adam', 'graph_mode': 'off', 'use_snp_selection': False}. Best is trial 16 with value: 0.08131540450815136.
[I 2025-11-03 12:26:47,319] Trial 108 finished with value: 0.05463551351551507 and parameters: {'model_type': 'gcn', 'hidden_dims': '[512, 256]', 'dropout': 0.3502819453963347, 'batch_norm': True, 'lr': 0.00031387159954686866, 'weight_decay': 8.685190727685694e-07, 'epochs': 320, 'loss': 'mse', 'optimizer': 'adam', 'graph_mode': 'off', 'use_snp_selection': False}. Best is trial 16 with value: 0.08131540450815136.
[I 2025-11-03 12:26:49,802] Trial 109 finished with value: 0.05925984446361037 and parameters: {'model_type': 'gcn', 'hidden_dims': '[512, 128]', 'dropout': 0.5432162728932491, 'batch_norm': True, 'lr': 0.000396314837082649, 'weight_decay': 1.765803105692338e-07, 'epochs': 350, 'loss': 'mse', 'optimizer': 'adam', 'graph_mode': 'off', 'use_snp_selection': False}. Best is trial 16 with value: 0.08131540450815136.
[I 2025-11-03 12:26:51,689] Trial 110 finished with value: 0.031410729949608286 and parameters: {'model_type': 'gcn', 'hidden_dims': '[512, 256]', 'dropout': 0.5694196830598086, 'batch_norm': True, 'lr': 0.0001757092884414861, 'weight_decay': 2.689251392209419e-06, 'epochs': 224, 'loss': 'mse', 'optimizer': 'adam', 'graph_mode': 'off', 'use_snp_selection': False}. Best is trial 16 with value: 0.08131540450815136.
[I 2025-11-03 12:26:53,536] Trial 111 finished with value: 0.04490693358864375 and parameters: {'model_type': 'gcn', 'hidden_dims': '[256, 128]', 'dropout': 0.32824071867247145, 'batch_norm': True, 'lr': 0.00044105093214345684, 'weight_decay': 3.515868855715231e-07, 'epochs': 233, 'loss': 'mse', 'optimizer': 'adam', 'graph_mode': 'off', 'use_snp_selection': True, 'num_snps': 42578}. Best is trial 16 with value: 0.08131540450815136.
[I 2025-11-03 12:26:55,462] Trial 112 finished with value: 0.05086130528956746 and parameters: {'model_type': 'gcn', 'hidden_dims': '[512, 256]', 'dropout': 0.5002315721214818, 'batch_norm': True, 'lr': 0.0005040951416678273, 'weight_decay': 3.124522391263256e-07, 'epochs': 277, 'loss': 'mse', 'optimizer': 'adam', 'graph_mode': 'off', 'use_snp_selection': True, 'num_snps': 29961}. Best is trial 16 with value: 0.08131540450815136.
[I 2025-11-03 12:26:57,420] Trial 113 finished with value: -0.01909204693987898 and parameters: {'model_type': 'gcn', 'hidden_dims': '[256, 128, 64]', 'dropout': 0.30195700906255496, 'batch_norm': True, 'lr': 9.077238560294936e-06, 'weight_decay': 4.453443714576988e-07, 'epochs': 307, 'loss': 'mse', 'optimizer': 'adam', 'graph_mode': 'off', 'use_snp_selection': True, 'num_snps': 25959}. Best is trial 16 with value: 0.08131540450815136.
[I 2025-11-03 12:26:58,821] Trial 114 finished with value: 0.057775861825662696 and parameters: {'model_type': 'gcn', 'hidden_dims': '[512, 256]', 'dropout': 0.47277833718729356, 'batch_norm': True, 'lr': 0.0002749886231852912, 'weight_decay': 2.479345071452629e-07, 'epochs': 243, 'loss': 'mse', 'optimizer': 'adam', 'graph_mode': 'off', 'use_snp_selection': True, 'num_snps': 16127}. Best is trial 16 with value: 0.08131540450815136.
[I 2025-11-03 12:27:01,054] Trial 115 finished with value: 0.04337962412800174 and parameters: {'model_type': 'gcn', 'hidden_dims': '[128, 64]', 'dropout': 0.36417186660203216, 'batch_norm': True, 'lr': 0.000351194123625995, 'weight_decay': 5.404651452179434e-07, 'epochs': 301, 'loss': 'mse', 'optimizer': 'adam', 'graph_mode': 'off', 'use_snp_selection': True, 'num_snps': 56738}. Best is trial 16 with value: 0.08131540450815136.
[I 2025-11-03 12:27:02,861] Trial 116 finished with value: -0.009185270006008169 and parameters: {'model_type': 'gcn', 'hidden_dims': '[512, 128]', 'dropout': 0.5862957935263939, 'batch_norm': False, 'lr': 0.0006125890506782704, 'weight_decay': 1.176306098344642e-07, 'epochs': 199, 'loss': 'mae', 'optimizer': 'adam', 'graph_mode': 'off', 'use_snp_selection': True, 'num_snps': 33737}. Best is trial 16 with value: 0.08131540450815136.
[I 2025-11-03 12:27:04,086] Trial 117 finished with value: 0.05212768825556082 and parameters: {'model_type': 'gcn', 'hidden_dims': '[512, 256]', 'dropout': 0.5305944724805493, 'batch_norm': True, 'lr': 0.0008042664688146178, 'weight_decay': 1.8199702555444087e-07, 'epochs': 225, 'loss': 'mse', 'optimizer': 'adam', 'graph_mode': 'off', 'use_snp_selection': True, 'num_snps': 12623}. Best is trial 16 with value: 0.08131540450815136.
[I 2025-11-03 12:27:05,876] Trial 118 finished with value: 0.04403184036634169 and parameters: {'model_type': 'gcn', 'hidden_dims': '[512, 256]', 'dropout': 0.3328260467095755, 'batch_norm': True, 'lr': 0.00025315521936183807, 'weight_decay': 1.48775682971649e-07, 'epochs': 295, 'loss': 'mse', 'optimizer': 'adam', 'graph_mode': 'off', 'use_snp_selection': True, 'num_snps': 23496}. Best is trial 16 with value: 0.08131540450815136.
[I 2025-11-03 12:27:07,859] Trial 119 finished with value: 0.024092911631692 and parameters: {'model_type': 'gcn', 'hidden_dims': '[256, 128, 64]', 'dropout': 0.31422410364153275, 'batch_norm': True, 'lr': 0.00021481527524441202, 'weight_decay': 1.476993296270438e-05, 'epochs': 212, 'loss': 'mse', 'optimizer': 'adam', 'graph_mode': 'off', 'use_snp_selection': True, 'num_snps': 38889}. Best is trial 16 with value: 0.08131540450815136.
[I 2025-11-03 12:27:09,806] Trial 120 finished with value: 0.05160688666331162 and parameters: {'model_type': 'gcn', 'hidden_dims': '[512, 256]', 'dropout': 0.5564730035447711, 'batch_norm': True, 'lr': 0.0004275211045889089, 'weight_decay': 3.9801294527014214e-07, 'epochs': 238, 'loss': 'mse', 'optimizer': 'adam', 'graph_mode': 'off', 'use_snp_selection': False}. Best is trial 16 with value: 0.08131540450815136.
[I 2025-11-03 12:27:12,320] Trial 121 finished with value: 0.05672496542852133 and parameters: {'model_type': 'gcn', 'hidden_dims': '[512, 128]', 'dropout': 0.5464347506433446, 'batch_norm': True, 'lr': 0.00039243224290889657, 'weight_decay': 2.070844446205316e-07, 'epochs': 349, 'loss': 'mse', 'optimizer': 'adam', 'graph_mode': 'off', 'use_snp_selection': False}. Best is trial 16 with value: 0.08131540450815136.
[I 2025-11-03 12:27:14,749] Trial 122 finished with value: 0.06485319158626796 and parameters: {'model_type': 'gcn', 'hidden_dims': '[512, 128]', 'dropout': 0.5196555215777585, 'batch_norm': True, 'lr': 0.0003156247189024714, 'weight_decay': 1.7216093681269848e-07, 'epochs': 338, 'loss': 'mse', 'optimizer': 'adam', 'graph_mode': 'off', 'use_snp_selection': False}. Best is trial 16 with value: 0.08131540450815136.
[I 2025-11-03 12:27:17,196] Trial 123 finished with value: 0.05512253918453639 and parameters: {'model_type': 'gcn', 'hidden_dims': '[512, 128]', 'dropout': 0.5220621471157613, 'batch_norm': True, 'lr': 0.0009953741409490528, 'weight_decay': 2.701839866652116e-07, 'epochs': 341, 'loss': 'mse', 'optimizer': 'adam', 'graph_mode': 'off', 'use_snp_selection': False}. Best is trial 16 with value: 0.08131540450815136.
[I 2025-11-03 12:27:19,625] Trial 124 finished with value: 0.042266235768522634 and parameters: {'model_type': 'gcn', 'hidden_dims': '[512, 128]', 'dropout': 0.5086672933201677, 'batch_norm': True, 'lr': 0.00018583295186600272, 'weight_decay': 1.28494358926724e-07, 'epochs': 331, 'loss': 'mse', 'optimizer': 'adam', 'graph_mode': 'off', 'use_snp_selection': False}. Best is trial 16 with value: 0.08131540450815136.
[I 2025-11-03 12:27:22,011] Trial 125 finished with value: 0.04268537449090218 and parameters: {'model_type': 'gcn', 'hidden_dims': '[512, 128]', 'dropout': 0.4948499410753958, 'batch_norm': True, 'lr': 0.000286034355318367, 'weight_decay': 3.5309364029009514e-07, 'epochs': 322, 'loss': 'mse', 'optimizer': 'adam', 'graph_mode': 'off', 'use_snp_selection': False}. Best is trial 16 with value: 0.08131540450815136.
[I 2025-11-03 12:27:24,658] Trial 126 finished with value: 0.02057069916430007 and parameters: {'model_type': 'gcn', 'hidden_dims': '[512, 64]', 'dropout': 0.2778691922930463, 'batch_norm': True, 'lr': 0.00015565198218940094, 'weight_decay': 2.249453250034537e-07, 'epochs': 338, 'loss': 'mse', 'optimizer': 'adam', 'graph_mode': 'off', 'use_snp_selection': True, 'num_snps': 42980}. Best is trial 16 with value: 0.08131540450815136.
[I 2025-11-03 12:27:27,018] Trial 127 finished with value: 0.04456247936160177 and parameters: {'model_type': 'gcn', 'hidden_dims': '[512, 256]', 'dropout': 0.4838322772740356, 'batch_norm': True, 'lr': 0.00012365013993439038, 'weight_decay': 6.450259064482128e-07, 'epochs': 325, 'loss': 'mse', 'optimizer': 'adam', 'graph_mode': 'off', 'use_snp_selection': False}. Best is trial 16 with value: 0.08131540450815136.
[I 2025-11-03 12:27:29,129] Trial 128 finished with value: 0.06286852441912097 and parameters: {'model_type': 'gcn', 'hidden_dims': '[512, 128]', 'dropout': 0.426567899989918, 'batch_norm': True, 'lr': 0.0003348090267834375, 'weight_decay': 1.0772093278961122e-06, 'epochs': 256, 'loss': 'mse', 'optimizer': 'adam', 'graph_mode': 'off', 'use_snp_selection': True, 'num_snps': 36555}. Best is trial 16 with value: 0.08131540450815136.
[I 2025-11-03 12:27:31,068] Trial 129 finished with value: 0.05438577337781169 and parameters: {'model_type': 'gcn', 'hidden_dims': '[512, 128]', 'dropout': 0.4503078475033568, 'batch_norm': True, 'lr': 0.00022552343762024713, 'weight_decay': 1.1154604523169136e-06, 'epochs': 259, 'loss': 'mse', 'optimizer': 'adam', 'graph_mode': 'off', 'use_snp_selection': True, 'num_snps': 32516}. Best is trial 16 with value: 0.08131540450815136.
[I 2025-11-03 12:27:33,234] Trial 130 finished with value: 0.06075077649793603 and parameters: {'model_type': 'gcn', 'hidden_dims': '[512, 128]', 'dropout': 0.46689214785697397, 'batch_norm': True, 'lr': 0.0003245596509167516, 'weight_decay': 1.5533018899278295e-06, 'epochs': 287, 'loss': 'mse', 'optimizer': 'adam', 'graph_mode': 'off', 'use_snp_selection': False}. Best is trial 16 with value: 0.08131540450815136.
[I 2025-11-03 12:27:35,474] Trial 131 finished with value: 0.05420585108728157 and parameters: {'model_type': 'gcn', 'hidden_dims': '[512, 128]', 'dropout': 0.42618054569250347, 'batch_norm': True, 'lr': 0.00034461568191239455, 'weight_decay': 1.45870439774991e-06, 'epochs': 291, 'loss': 'mse', 'optimizer': 'adam', 'graph_mode': 'off', 'use_snp_selection': False}. Best is trial 16 with value: 0.08131540450815136.
[I 2025-11-03 12:27:37,678] Trial 132 finished with value: 0.07995391012701816 and parameters: {'model_type': 'gcn', 'hidden_dims': '[512, 128]', 'dropout': 0.4764660542285131, 'batch_norm': True, 'lr': 0.000317777194560413, 'weight_decay': 2.2196537993429657e-06, 'epochs': 282, 'loss': 'mse', 'optimizer': 'adam', 'graph_mode': 'off', 'use_snp_selection': False}. Best is trial 16 with value: 0.08131540450815136.
[I 2025-11-03 12:27:39,702] Trial 133 finished with value: 0.052708176449236796 and parameters: {'model_type': 'gcn', 'hidden_dims': '[512, 128]', 'dropout': 0.4644027313771123, 'batch_norm': True, 'lr': 0.00030437671782427233, 'weight_decay': 2.1629265990106994e-06, 'epochs': 252, 'loss': 'mse', 'optimizer': 'adam', 'graph_mode': 'off', 'use_snp_selection': False}. Best is trial 16 with value: 0.08131540450815136.
[I 2025-11-03 12:27:41,834] Trial 134 finished with value: 0.0572050343408697 and parameters: {'model_type': 'gcn', 'hidden_dims': '[512, 128]', 'dropout': 0.47267879664768514, 'batch_norm': True, 'lr': 0.00024931036621943866, 'weight_decay': 3.4851907881086846e-06, 'epochs': 272, 'loss': 'mse', 'optimizer': 'adam', 'graph_mode': 'off', 'use_snp_selection': False}. Best is trial 16 with value: 0.08131540450815136.
[I 2025-11-03 12:27:44,031] Trial 135 finished with value: 0.05310099089455768 and parameters: {'model_type': 'gcn', 'hidden_dims': '[512, 128]', 'dropout': 0.5991659392673143, 'batch_norm': True, 'lr': 0.00019873180753544035, 'weight_decay': 1.9766917590212473e-06, 'epochs': 282, 'loss': 'mse', 'optimizer': 'adam', 'graph_mode': 'off', 'use_snp_selection': False}. Best is trial 16 with value: 0.08131540450815136.
[I 2025-11-03 12:27:46,144] Trial 136 finished with value: -0.024714190982340553 and parameters: {'model_type': 'gcn', 'hidden_dims': '[512, 128]', 'dropout': 0.4374439929169508, 'batch_norm': True, 'lr': 1.6856723614772346e-05, 'weight_decay': 1.324677288970106e-06, 'epochs': 267, 'loss': 'mse', 'optimizer': 'adam', 'graph_mode': 'off', 'use_snp_selection': False}. Best is trial 16 with value: 0.08131540450815136.
[I 2025-11-03 12:27:48,336] Trial 137 finished with value: 0.05236987967263749 and parameters: {'model_type': 'gcn', 'hidden_dims': '[512, 128]', 'dropout': 0.48298152910730646, 'batch_norm': True, 'lr': 0.0005310186470528741, 'weight_decay': 9.73708361263017e-07, 'epochs': 283, 'loss': 'mse', 'optimizer': 'adam', 'graph_mode': 'off', 'use_snp_selection': False}. Best is trial 16 with value: 0.08131540450815136.
[I 2025-11-03 12:27:50,628] Trial 138 finished with value: 0.038752343725200394 and parameters: {'model_type': 'gcn', 'hidden_dims': '[512, 128]', 'dropout': 0.5076990178305559, 'batch_norm': False, 'lr': 1.2407431727651125e-05, 'weight_decay': 1.789405245593486e-06, 'epochs': 309, 'loss': 'mae', 'optimizer': 'adam', 'graph_mode': 'off', 'use_snp_selection': False}. Best is trial 16 with value: 0.08131540450815136.
[I 2025-11-03 12:27:52,797] Trial 139 finished with value: 0.05865412134376261 and parameters: {'model_type': 'gcn', 'hidden_dims': '[512, 128]', 'dropout': 0.4959195055911266, 'batch_norm': True, 'lr': 0.0003894090495648461, 'weight_decay': 7.709486011885072e-07, 'epochs': 277, 'loss': 'mse', 'optimizer': 'adam', 'graph_mode': 'off', 'use_snp_selection': False}. Best is trial 16 with value: 0.08131540450815136.
[I 2025-11-03 12:27:55,155] Trial 140 finished with value: 0.06187802604167631 and parameters: {'model_type': 'gcn', 'hidden_dims': '[512, 128]', 'dropout': 0.5166303700847963, 'batch_norm': True, 'lr': 0.0003178753969499207, 'weight_decay': 1.4096662038291213e-06, 'epochs': 315, 'loss': 'mse', 'optimizer': 'adam', 'graph_mode': 'off', 'use_snp_selection': False}. Best is trial 16 with value: 0.08131540450815136.
[I 2025-11-03 12:27:57,538] Trial 141 finished with value: 0.04149448984057755 and parameters: {'model_type': 'gcn', 'hidden_dims': '[512, 128]', 'dropout': 0.5182276111727108, 'batch_norm': True, 'lr': 0.0003121793477372901, 'weight_decay': 1.672557980631665e-06, 'epochs': 319, 'loss': 'mse', 'optimizer': 'adam', 'graph_mode': 'off', 'use_snp_selection': False}. Best is trial 16 with value: 0.08131540450815136.
[I 2025-11-03 12:27:59,843] Trial 142 finished with value: 0.06525121884440756 and parameters: {'model_type': 'gcn', 'hidden_dims': '[512, 128]', 'dropout': 0.5369852594822894, 'batch_norm': True, 'lr': 0.0002713903193428304, 'weight_decay': 2.8954498276732907e-06, 'epochs': 303, 'loss': 'mse', 'optimizer': 'adam', 'graph_mode': 'off', 'use_snp_selection': False}. Best is trial 16 with value: 0.08131540450815136.
[I 2025-11-03 12:28:02,138] Trial 143 finished with value: 0.06947004443821761 and parameters: {'model_type': 'gcn', 'hidden_dims': '[512, 128]', 'dropout': 0.5320483365607228, 'batch_norm': True, 'lr': 0.0003564597823499268, 'weight_decay': 2.5374560450222392e-06, 'epochs': 303, 'loss': 'mse', 'optimizer': 'adam', 'graph_mode': 'off', 'use_snp_selection': False}. Best is trial 16 with value: 0.08131540450815136.
[I 2025-11-03 12:28:04,412] Trial 144 finished with value: 0.04099435946645063 and parameters: {'model_type': 'gcn', 'hidden_dims': '[512, 128]', 'dropout': 0.5313935375240267, 'batch_norm': True, 'lr': 0.00034172250505028066, 'weight_decay': 2.5686193903434283e-06, 'epochs': 302, 'loss': 'mse', 'optimizer': 'adam', 'graph_mode': 'off', 'use_snp_selection': False}. Best is trial 16 with value: 0.08131540450815136.
[I 2025-11-03 12:28:06,745] Trial 145 finished with value: 0.048247613696072576 and parameters: {'model_type': 'gcn', 'hidden_dims': '[512, 128]', 'dropout': 0.54230185447553, 'batch_norm': True, 'lr': 0.0002888875416793749, 'weight_decay': 3.762133453647383e-06, 'epochs': 312, 'loss': 'mse', 'optimizer': 'adam', 'graph_mode': 'off', 'use_snp_selection': False}. Best is trial 16 with value: 0.08131540450815136.
[I 2025-11-03 12:28:09,202] Trial 146 finished with value: 0.06889451531700384 and parameters: {'model_type': 'gcn', 'hidden_dims': '[512, 128]', 'dropout': 0.45960426099308127, 'batch_norm': True, 'lr': 0.0007126947097911171, 'weight_decay': 4.5135625201773914e-06, 'epochs': 331, 'loss': 'mse', 'optimizer': 'adam', 'graph_mode': 'off', 'use_snp_selection': False}. Best is trial 16 with value: 0.08131540450815136.
[I 2025-11-03 12:28:11,663] Trial 147 finished with value: 0.05902473916596132 and parameters: {'model_type': 'gcn', 'hidden_dims': '[512, 128]', 'dropout': 0.41827444010435105, 'batch_norm': True, 'lr': 0.000757740994182748, 'weight_decay': 5.3186779170370186e-06, 'epochs': 333, 'loss': 'mse', 'optimizer': 'adam', 'graph_mode': 'off', 'use_snp_selection': False}. Best is trial 16 with value: 0.08131540450815136.
