[I 2025-11-03 12:40:43,027] Trial 143 finished with value: 0.0665648372815941 and parameters: {'model_type': 'gcn', 'hidden_dims': '[256, 128, 64]', 'dropout': 0.2018465164821496, 'batch_norm': True, 'lr': 0.0005927806024815299, 'weight_decay': 2.544340617541589e-05, 'epochs': 286, 'loss': 'mae', 'optimizer': 'adam', 'graph_mode': 'knn', 'source': 'grm', 'knn_k': 6, 'weighted_edges': True, 'symmetrize_mode': 'mutual', 'use_snp_selection': False}. Best is trial 142 with value: 0.09723403236236733.
[I 2025-11-03 12:40:45,479] Trial 144 finished with value: 0.074001046524687 and parameters: {'model_type': 'gcn', 'hidden_dims': '[256, 128, 64]', 'dropout': 0.18228833214041312, 'batch_norm': True, 'lr': 0.0006483780639190129, 'weight_decay': 2.065391642722876e-05, 'epochs': 265, 'loss': 'mae', 'optimizer': 'adam', 'graph_mode': 'knn', 'source': 'grm', 'knn_k': 7, 'weighted_edges': True, 'symmetrize_mode': 'mutual', 'use_snp_selection': False}. Best is trial 142 with value: 0.09723403236236733.
[I 2025-11-03 12:40:48,110] Trial 145 finished with value: 0.09755771414533755 and parameters: {'model_type': 'gcn', 'hidden_dims': '[256, 128, 64]', 'dropout': 0.24578094472298273, 'batch_norm': True, 'lr': 0.0009916612012346826, 'weight_decay': 3.123171371718167e-05, 'epochs': 301, 'loss': 'mae', 'optimizer': 'adam', 'graph_mode': 'knn', 'source': 'grm', 'knn_k': 6, 'weighted_edges': True, 'symmetrize_mode': 'mutual', 'use_snp_selection': False}. Best is trial 145 with value: 0.09755771414533755.
[I 2025-11-03 12:40:50,739] Trial 146 finished with value: 0.0379801561169021 and parameters: {'model_type': 'gcn', 'hidden_dims': '[256, 128, 64]', 'dropout': 0.24521517003291973, 'batch_norm': True, 'lr': 0.0009602033736341352, 'weight_decay': 1.7445245389465292e-05, 'epochs': 301, 'loss': 'mae', 'optimizer': 'adam', 'graph_mode': 'knn', 'source': 'grm', 'knn_k': 6, 'weighted_edges': False, 'symmetrize_mode': 'mutual', 'use_snp_selection': False}. Best is trial 145 with value: 0.09755771414533755.
[I 2025-11-03 12:40:53,259] Trial 147 finished with value: 0.05109744776412907 and parameters: {'model_type': 'gcn', 'hidden_dims': '[256, 128, 64]', 'dropout': 0.23325434833344816, 'batch_norm': True, 'lr': 0.0007855112461577645, 'weight_decay': 4.414081588553415e-06, 'epochs': 279, 'loss': 'mae', 'optimizer': 'adam', 'graph_mode': 'knn', 'source': 'grm', 'knn_k': 6, 'weighted_edges': True, 'symmetrize_mode': 'union', 'use_snp_selection': False}. Best is trial 145 with value: 0.09755771414533755.
[I 2025-11-03 12:40:55,874] Trial 148 finished with value: 0.07702347340460444 and parameters: {'model_type': 'gcn', 'hidden_dims': '[256, 128, 64]', 'dropout': 0.24285852598592603, 'batch_norm': True, 'lr': 0.0009956862018220321, 'weight_decay': 2.9435877152824782e-05, 'epochs': 297, 'loss': 'mae', 'optimizer': 'adam', 'graph_mode': 'knn', 'source': 'grm', 'knn_k': 6, 'weighted_edges': True, 'symmetrize_mode': 'mutual', 'use_snp_selection': False}. Best is trial 145 with value: 0.09755771414533755.
[I 2025-11-03 12:40:58,561] Trial 149 finished with value: 0.07652732223450791 and parameters: {'model_type': 'gcn', 'hidden_dims': '[256, 128, 64]', 'dropout': 0.20905042602204674, 'batch_norm': True, 'lr': 0.0005459695431389529, 'weight_decay': 1.384725657647305e-05, 'epochs': 312, 'loss': 'mae', 'optimizer': 'adam', 'graph_mode': 'knn', 'source': 'grm', 'knn_k': 7, 'weighted_edges': True, 'symmetrize_mode': 'mutual', 'use_snp_selection': False}. Best is trial 145 with value: 0.09755771414533755.
[I 2025-11-03 12:41:00,658] Trial 0 finished with value: 0.028429897442161997 and parameters: {'model_type': 'gcn', 'hidden_dims': '[128, 64]', 'dropout': 0.199031432379812, 'batch_norm': True, 'lr': 1.8408544111075837e-06, 'weight_decay': 5.5136510071208614e-05, 'epochs': 334, 'loss': 'mae', 'optimizer': 'adam', 'graph_mode': 'knn', 'source': 'grm', 'knn_k': 8, 'weighted_edges': True, 'symmetrize_mode': 'mutual', 'use_snp_selection': False}. Best is trial 0 with value: 0.028429897442161997.
[I 2025-11-03 12:41:01,759] Trial 1 finished with value: 0.05194496653763473 and parameters: {'model_type': 'gcn', 'hidden_dims': '[128, 64]', 'dropout': 0.40051947670227217, 'batch_norm': True, 'lr': 0.0005320428882732732, 'weight_decay': 1.89210117736594e-06, 'epochs': 32, 'loss': 'mse', 'optimizer': 'adam', 'graph_mode': 'knn', 'source': 'grm', 'knn_k': 7, 'weighted_edges': True, 'symmetrize_mode': 'union', 'use_snp_selection': False}. Best is trial 1 with value: 0.05194496653763473.
[I 2025-11-03 12:41:03,869] Trial 2 finished with value: 0.0013929492128620965 and parameters: {'model_type': 'gcn', 'hidden_dims': '[256, 128]', 'dropout': 0.5105528289184642, 'batch_norm': False, 'lr': 0.0006804279372404962, 'weight_decay': 0.0008922815224257085, 'epochs': 160, 'loss': 'mse', 'optimizer': 'adam', 'graph_mode': 'cutoff', 'cutoff': 0.5741905641612706, 'grm_norm': 'gcn', 'self_loops': False, 'use_snp_selection': True, 'num_snps': 26910}. Best is trial 1 with value: 0.05194496653763473.
[I 2025-11-03 12:41:06,062] Trial 3 finished with value: 0.03407262281714139 and parameters: {'model_type': 'gcn', 'hidden_dims': '[256, 128, 64]', 'dropout': 0.5390483213624292, 'batch_norm': False, 'lr': 3.4705625989073525e-05, 'weight_decay': 2.4623319020131338e-05, 'epochs': 92, 'loss': 'mse', 'optimizer': 'adam', 'graph_mode': 'knn', 'source': 'grm', 'knn_k': 6, 'weighted_edges': False, 'symmetrize_mode': 'mutual', 'use_snp_selection': True, 'num_snps': 30713}. Best is trial 1 with value: 0.05194496653763473.
[I 2025-11-03 12:41:08,283] Trial 4 finished with value: -0.012462955462233891 and parameters: {'model_type': 'gcn', 'hidden_dims': '[128, 64]', 'dropout': 0.13404863676897502, 'batch_norm': False, 'lr': 0.0001431556295367288, 'weight_decay': 2.2084517750726675e-05, 'epochs': 13, 'loss': 'mae', 'optimizer': 'adam', 'graph_mode': 'cutoff', 'cutoff': 0.6714268476993044, 'grm_norm': 'none', 'self_loops': False, 'use_snp_selection': True, 'num_snps': 45645}. Best is trial 1 with value: 0.05194496653763473.
[I 2025-11-03 12:41:10,952] Trial 5 finished with value: 0.007461834713734165 and parameters: {'model_type': 'gcn', 'hidden_dims': '[256, 128]', 'dropout': 0.42253606323412096, 'batch_norm': False, 'lr': 4.238630400638805e-05, 'weight_decay': 8.074086040046576e-07, 'epochs': 134, 'loss': 'mae', 'optimizer': 'adam', 'graph_mode': 'knn', 'source': 'grm', 'knn_k': 1, 'weighted_edges': False, 'symmetrize_mode': 'mutual', 'use_snp_selection': True, 'num_snps': 43113}. Best is trial 1 with value: 0.05194496653763473.
[I 2025-11-03 12:41:13,459] Trial 6 finished with value: 0.0555663340085906 and parameters: {'model_type': 'gcn', 'hidden_dims': '[512, 256]', 'dropout': 0.3534893146320237, 'batch_norm': True, 'lr': 0.000251307964226932, 'weight_decay': 1.821819791794022e-05, 'epochs': 207, 'loss': 'mae', 'optimizer': 'adam', 'graph_mode': 'knn', 'source': 'grm', 'knn_k': 1, 'weighted_edges': True, 'symmetrize_mode': 'mutual', 'use_snp_selection': False}. Best is trial 6 with value: 0.0555663340085906.
[I 2025-11-03 12:41:15,672] Trial 7 finished with value: 0.04081349950928467 and parameters: {'model_type': 'gcn', 'hidden_dims': '[512, 256]', 'dropout': 0.1105825955860775, 'batch_norm': True, 'lr': 2.374338412754043e-05, 'weight_decay': 1.1284721123340274e-05, 'epochs': 170, 'loss': 'mse', 'optimizer': 'adam', 'graph_mode': 'cutoff', 'cutoff': 0.719872204109604, 'grm_norm': 'gcn', 'self_loops': False, 'use_snp_selection': False}. Best is trial 6 with value: 0.0555663340085906.
[I 2025-11-03 12:41:17,437] Trial 8 finished with value: 0.012557573645356784 and parameters: {'model_type': 'gcn', 'hidden_dims': '[512, 128]', 'dropout': 0.5066580418354021, 'batch_norm': True, 'lr': 0.00039213678276659976, 'weight_decay': 3.43655320802934e-06, 'epochs': 91, 'loss': 'mse', 'optimizer': 'adam', 'graph_mode': 'cutoff', 'cutoff': 0.34923059576505366, 'grm_norm': 'cosine', 'self_loops': True, 'use_snp_selection': False}. Best is trial 6 with value: 0.0555663340085906.
[I 2025-11-03 12:41:19,048] Trial 9 finished with value: 0.005707980917984157 and parameters: {'model_type': 'gcn', 'hidden_dims': '[512, 256]', 'dropout': 0.301734920240333, 'batch_norm': False, 'lr': 6.650961854953448e-06, 'weight_decay': 6.861575656590315e-05, 'epochs': 125, 'loss': 'mae', 'optimizer': 'adam', 'graph_mode': 'cutoff', 'cutoff': 0.2857569870061939, 'grm_norm': 'cosine_then_gcn', 'self_loops': False, 'use_snp_selection': True, 'num_snps': 12722}. Best is trial 6 with value: 0.0555663340085906.
[I 2025-11-03 12:41:21,872] Trial 10 finished with value: 0.08432973395887666 and parameters: {'model_type': 'gcn', 'hidden_dims': '[512, 64]', 'dropout': 0.2833599465317005, 'batch_norm': True, 'lr': 0.00016916760584270694, 'weight_decay': 1.7866650996308468e-07, 'epochs': 266, 'loss': 'mae', 'optimizer': 'adam', 'graph_mode': 'knn', 'source': 'grm', 'knn_k': 1, 'weighted_edges': True, 'symmetrize_mode': 'union', 'use_snp_selection': False}. Best is trial 10 with value: 0.08432973395887666.
[I 2025-11-03 12:41:24,689] Trial 11 finished with value: 0.07053017720593052 and parameters: {'model_type': 'gcn', 'hidden_dims': '[512, 64]', 'dropout': 0.2859699507705008, 'batch_norm': True, 'lr': 0.00012623783700890367, 'weight_decay': 1.6805209943987688e-07, 'epochs': 265, 'loss': 'mae', 'optimizer': 'adam', 'graph_mode': 'knn', 'source': 'grm', 'knn_k': 1, 'weighted_edges': True, 'symmetrize_mode': 'union', 'use_snp_selection': False}. Best is trial 10 with value: 0.08432973395887666.
[I 2025-11-03 12:41:27,550] Trial 12 finished with value: 0.0326929323154334 and parameters: {'model_type': 'gcn', 'hidden_dims': '[512, 64]', 'dropout': 0.26266132038870743, 'batch_norm': True, 'lr': 9.336280153487897e-05, 'weight_decay': 1.0551808429767219e-07, 'epochs': 270, 'loss': 'mae', 'optimizer': 'adam', 'graph_mode': 'knn', 'source': 'grm', 'knn_k': 3, 'weighted_edges': True, 'symmetrize_mode': 'union', 'use_snp_selection': False}. Best is trial 10 with value: 0.08432973395887666.
[I 2025-11-03 12:41:30,304] Trial 13 finished with value: 0.01198013988706953 and parameters: {'model_type': 'gcn', 'hidden_dims': '[512, 64]', 'dropout': 0.2687736708759205, 'batch_norm': True, 'lr': 8.732942663241711e-05, 'weight_decay': 1.1697174867672891e-07, 'epochs': 251, 'loss': 'mae', 'optimizer': 'adam', 'graph_mode': 'knn', 'source': 'grm', 'knn_k': 4, 'weighted_edges': True, 'symmetrize_mode': 'union', 'use_snp_selection': False}. Best is trial 10 with value: 0.08432973395887666.
[I 2025-11-03 12:41:33,625] Trial 14 finished with value: 0.01062137099743116 and parameters: {'model_type': 'gcn', 'hidden_dims': '[512, 64]', 'dropout': 0.19696847261698813, 'batch_norm': True, 'lr': 1.2586985041154999e-05, 'weight_decay': 3.8054513427732407e-07, 'epochs': 349, 'loss': 'mae', 'optimizer': 'adam', 'graph_mode': 'knn', 'source': 'grm', 'knn_k': 3, 'weighted_edges': True, 'symmetrize_mode': 'union', 'use_snp_selection': False}. Best is trial 10 with value: 0.08432973395887666.
[I 2025-11-03 12:41:36,543] Trial 15 finished with value: 0.06822389438629119 and parameters: {'model_type': 'gcn', 'hidden_dims': '[512, 64]', 'dropout': 0.32182199730807426, 'batch_norm': True, 'lr': 0.00016454300965981406, 'weight_decay': 4.3750989597912334e-07, 'epochs': 282, 'loss': 'mae', 'optimizer': 'adam', 'graph_mode': 'knn', 'source': 'grm', 'knn_k': 1, 'weighted_edges': True, 'symmetrize_mode': 'union', 'use_snp_selection': False}. Best is trial 10 with value: 0.08432973395887666.
[I 2025-11-03 12:41:39,099] Trial 16 finished with value: -0.010094169763732995 and parameters: {'model_type': 'gcn', 'hidden_dims': '[512, 64]', 'dropout': 0.21908549744794692, 'batch_norm': True, 'lr': 5.782974614565059e-05, 'weight_decay': 3.222651619217792e-06, 'epochs': 215, 'loss': 'mae', 'optimizer': 'adam', 'graph_mode': 'knn', 'source': 'grm', 'knn_k': 10, 'weighted_edges': False, 'symmetrize_mode': 'union', 'use_snp_selection': False}. Best is trial 10 with value: 0.08432973395887666.
[I 2025-11-03 12:41:42,132] Trial 17 finished with value: 0.04865758400476941 and parameters: {'model_type': 'gcn', 'hidden_dims': '[512, 128]', 'dropout': 0.3979233558206208, 'batch_norm': True, 'lr': 0.0002681341972492662, 'weight_decay': 2.690272323435558e-07, 'epochs': 299, 'loss': 'mae', 'optimizer': 'adam', 'graph_mode': 'knn', 'source': 'grm', 'knn_k': 3, 'weighted_edges': True, 'symmetrize_mode': 'union', 'use_snp_selection': False}. Best is trial 10 with value: 0.08432973395887666.
[I 2025-11-03 12:41:44,396] Trial 18 finished with value: 0.04615673770502133 and parameters: {'model_type': 'gcn', 'hidden_dims': '[256, 128, 64]', 'dropout': 0.45638033887282076, 'batch_norm': True, 'lr': 0.0009438285356975068, 'weight_decay': 9.66892592802624e-07, 'epochs': 229, 'loss': 'mae', 'optimizer': 'adam', 'graph_mode': 'knn', 'source': 'grm', 'knn_k': 5, 'weighted_edges': True, 'symmetrize_mode': 'union', 'use_snp_selection': False}. Best is trial 10 with value: 0.08432973395887666.
[I 2025-11-03 12:41:47,507] Trial 19 finished with value: -0.01977725114421384 and parameters: {'model_type': 'gcn', 'hidden_dims': '[512, 64]', 'dropout': 0.34874238090770604, 'batch_norm': True, 'lr': 1.4712248825400985e-05, 'weight_decay': 0.0007059990992276139, 'epochs': 314, 'loss': 'mae', 'optimizer': 'adam', 'graph_mode': 'knn', 'source': 'grm', 'knn_k': 2, 'weighted_edges': True, 'symmetrize_mode': 'union', 'use_snp_selection': False}. Best is trial 10 with value: 0.08432973395887666.
[I 2025-11-03 12:41:50,269] Trial 20 finished with value: 0.038207766947413 and parameters: {'model_type': 'gcn', 'hidden_dims': '[512, 64]', 'dropout': 0.2530942114746781, 'batch_norm': True, 'lr': 3.6318419901982732e-06, 'weight_decay': 2.3402754091627478e-07, 'epochs': 254, 'loss': 'mae', 'optimizer': 'adam', 'graph_mode': 'knn', 'source': 'grm', 'knn_k': 2, 'weighted_edges': False, 'symmetrize_mode': 'union', 'use_snp_selection': False}. Best is trial 10 with value: 0.08432973395887666.
[I 2025-11-03 12:41:53,148] Trial 21 finished with value: 0.03991653458536218 and parameters: {'model_type': 'gcn', 'hidden_dims': '[512, 64]', 'dropout': 0.5993068941859252, 'batch_norm': True, 'lr': 0.0001552429523774223, 'weight_decay': 6.392690692719032e-07, 'epochs': 275, 'loss': 'mae', 'optimizer': 'adam', 'graph_mode': 'knn', 'source': 'grm', 'knn_k': 1, 'weighted_edges': True, 'symmetrize_mode': 'union', 'use_snp_selection': False}. Best is trial 10 with value: 0.08432973395887666.
[I 2025-11-03 12:41:56,159] Trial 22 finished with value: 0.06925703063680058 and parameters: {'model_type': 'gcn', 'hidden_dims': '[512, 64]', 'dropout': 0.3272164183750637, 'batch_norm': True, 'lr': 9.54426629859464e-05, 'weight_decay': 1.780227002140273e-07, 'epochs': 298, 'loss': 'mae', 'optimizer': 'adam', 'graph_mode': 'knn', 'source': 'grm', 'knn_k': 1, 'weighted_edges': True, 'symmetrize_mode': 'union', 'use_snp_selection': False}. Best is trial 10 with value: 0.08432973395887666.
[I 2025-11-03 12:41:59,270] Trial 23 finished with value: 0.03571375670297366 and parameters: {'model_type': 'gcn', 'hidden_dims': '[512, 64]', 'dropout': 0.30833321744117387, 'batch_norm': True, 'lr': 0.0002734711303064993, 'weight_decay': 1.451341078069201e-07, 'epochs': 314, 'loss': 'mae', 'optimizer': 'adam', 'graph_mode': 'knn', 'source': 'grm', 'knn_k': 2, 'weighted_edges': True, 'symmetrize_mode': 'union', 'use_snp_selection': False}. Best is trial 10 with value: 0.08432973395887666.
[I 2025-11-03 12:42:01,710] Trial 24 finished with value: 0.017537496303793088 and parameters: {'model_type': 'gcn', 'hidden_dims': '[512, 64]', 'dropout': 0.36599241154607315, 'batch_norm': True, 'lr': 6.714340284124602e-05, 'weight_decay': 1.1274440047463391e-06, 'epochs': 197, 'loss': 'mae', 'optimizer': 'adam', 'graph_mode': 'knn', 'source': 'grm', 'knn_k': 4, 'weighted_edges': True, 'symmetrize_mode': 'union', 'use_snp_selection': False}. Best is trial 10 with value: 0.08432973395887666.
[I 2025-11-03 12:42:04,392] Trial 25 finished with value: 0.03652914538488369 and parameters: {'model_type': 'gcn', 'hidden_dims': '[512, 64]', 'dropout': 0.16565624396296894, 'batch_norm': True, 'lr': 0.0001335920680544142, 'weight_decay': 2.314225770122047e-07, 'epochs': 240, 'loss': 'mae', 'optimizer': 'adam', 'graph_mode': 'knn', 'source': 'grm', 'knn_k': 2, 'weighted_edges': True, 'symmetrize_mode': 'union', 'use_snp_selection': False}. Best is trial 10 with value: 0.08432973395887666.
[I 2025-11-03 12:42:08,856] Trial 26 finished with value: 0.018402977331249175 and parameters: {'model_type': 'gcn', 'hidden_dims': '[512, 128]', 'dropout': 0.23652719319751145, 'batch_norm': False, 'lr': 5.2181385186014805e-05, 'weight_decay': 2.5961438750364377e-06, 'epochs': 299, 'loss': 'mae', 'optimizer': 'adam', 'graph_mode': 'cutoff', 'cutoff': 0.8765009073803762, 'grm_norm': 'none', 'self_loops': True, 'use_snp_selection': True, 'num_snps': 59005}. Best is trial 10 with value: 0.08432973395887666.
[I 2025-11-03 12:42:10,732] Trial 27 finished with value: 0.023279004595455382 and parameters: {'model_type': 'gcn', 'hidden_dims': '[256, 128]', 'dropout': 0.2890824481643671, 'batch_norm': True, 'lr': 1.9937354098458108e-05, 'weight_decay': 0.00022939905569297644, 'epochs': 188, 'loss': 'mse', 'optimizer': 'adam', 'graph_mode': 'knn', 'source': 'grm', 'knn_k': 4, 'weighted_edges': True, 'symmetrize_mode': 'union', 'use_snp_selection': False}. Best is trial 10 with value: 0.08432973395887666.
[I 2025-11-03 12:42:13,492] Trial 28 finished with value: 0.0020550754291841947 and parameters: {'model_type': 'gcn', 'hidden_dims': '[256, 128, 64]', 'dropout': 0.3304317157843971, 'batch_norm': True, 'lr': 9.656074681221489e-05, 'weight_decay': 4.977979952500835e-06, 'epochs': 333, 'loss': 'mae', 'optimizer': 'adam', 'graph_mode': 'knn', 'source': 'grm', 'knn_k': 1, 'weighted_edges': False, 'symmetrize_mode': 'mutual', 'use_snp_selection': False}. Best is trial 10 with value: 0.08432973395887666.
[I 2025-11-03 12:42:15,559] Trial 29 finished with value: 0.03617213482339237 and parameters: {'model_type': 'gcn', 'hidden_dims': '[128, 64]', 'dropout': 0.1881763221627632, 'batch_norm': True, 'lr': 0.00035730431753131235, 'weight_decay': 4.57405721135614e-07, 'epochs': 330, 'loss': 'mae', 'optimizer': 'adam', 'graph_mode': 'knn', 'source': 'grm', 'knn_k': 3, 'weighted_edges': True, 'symmetrize_mode': 'union', 'use_snp_selection': False}. Best is trial 10 with value: 0.08432973395887666.
[I 2025-11-03 12:42:18,179] Trial 30 finished with value: 0.033974362418320976 and parameters: {'model_type': 'gcn', 'hidden_dims': '[512, 64]', 'dropout': 0.3782360469058257, 'batch_norm': True, 'lr': 1.2963802273643008e-06, 'weight_decay': 1.444526386549156e-06, 'epochs': 229, 'loss': 'mae', 'optimizer': 'adam', 'graph_mode': 'knn', 'source': 'grm', 'knn_k': 2, 'weighted_edges': True, 'symmetrize_mode': 'union', 'use_snp_selection': False}. Best is trial 10 with value: 0.08432973395887666.
[I 2025-11-03 12:42:21,053] Trial 31 finished with value: 0.07288482657133823 and parameters: {'model_type': 'gcn', 'hidden_dims': '[512, 64]', 'dropout': 0.310584451129458, 'batch_norm': True, 'lr': 0.00020381914694493156, 'weight_decay': 1.7510640731259243e-07, 'epochs': 274, 'loss': 'mae', 'optimizer': 'adam', 'graph_mode': 'knn', 'source': 'grm', 'knn_k': 1, 'weighted_edges': True, 'symmetrize_mode': 'union', 'use_snp_selection': False}. Best is trial 10 with value: 0.08432973395887666.
[I 2025-11-03 12:42:23,872] Trial 32 finished with value: 0.07520827175659729 and parameters: {'model_type': 'gcn', 'hidden_dims': '[512, 64]', 'dropout': 0.28690703455225874, 'batch_norm': True, 'lr': 0.00047865651230238535, 'weight_decay': 2.0358866269894875e-07, 'epochs': 265, 'loss': 'mae', 'optimizer': 'adam', 'graph_mode': 'knn', 'source': 'grm', 'knn_k': 1, 'weighted_edges': True, 'symmetrize_mode': 'union', 'use_snp_selection': False}. Best is trial 10 with value: 0.08432973395887666.
[I 2025-11-03 12:42:26,698] Trial 33 finished with value: 0.03039638016954396 and parameters: {'model_type': 'gcn', 'hidden_dims': '[512, 64]', 'dropout': 0.29006144029575737, 'batch_norm': True, 'lr': 0.0005620845620169074, 'weight_decay': 1.0084326397831497e-07, 'epochs': 265, 'loss': 'mae', 'optimizer': 'adam', 'graph_mode': 'knn', 'source': 'grm', 'knn_k': 2, 'weighted_edges': True, 'symmetrize_mode': 'union', 'use_snp_selection': False}. Best is trial 10 with value: 0.08432973395887666.
[I 2025-11-03 12:42:28,591] Trial 34 finished with value: 0.06998122038882112 and parameters: {'model_type': 'gcn', 'hidden_dims': '[128, 64]', 'dropout': 0.2412019004825905, 'batch_norm': True, 'lr': 0.000920874219866835, 'weight_decay': 3.3423980150614626e-07, 'epochs': 285, 'loss': 'mse', 'optimizer': 'adam', 'graph_mode': 'knn', 'source': 'grm', 'knn_k': 1, 'weighted_edges': True, 'symmetrize_mode': 'union', 'use_snp_selection': False}. Best is trial 10 with value: 0.08432973395887666.
[I 2025-11-03 12:42:30,189] Trial 35 finished with value: -0.04224330445358933 and parameters: {'model_type': 'gcn', 'hidden_dims': '[512, 64]', 'dropout': 0.22090235603096656, 'batch_norm': False, 'lr': 0.00044222025244458385, 'weight_decay': 5.98602938593384e-07, 'epochs': 243, 'loss': 'mae', 'optimizer': 'adam', 'graph_mode': 'knn', 'source': 'grm', 'knn_k': 2, 'weighted_edges': True, 'symmetrize_mode': 'union', 'use_snp_selection': True, 'num_snps': 2074}. Best is trial 10 with value: 0.08432973395887666.
[I 2025-11-03 12:42:32,139] Trial 36 finished with value: 0.03155504242521193 and parameters: {'model_type': 'gcn', 'hidden_dims': '[256, 128]', 'dropout': 0.432499240057405, 'batch_norm': True, 'lr': 0.00022287453744540878, 'weight_decay': 1.8116517050256053e-07, 'epochs': 220, 'loss': 'mse', 'optimizer': 'adam', 'graph_mode': 'cutoff', 'cutoff': 0.42596163795855535, 'grm_norm': 'cosine', 'self_loops': True, 'use_snp_selection': False}. Best is trial 10 with value: 0.08432973395887666.
