[I 2025-11-03 11:52:27,230] Trial 45 finished with value: 0.06264599394468122 and parameters: {'model_type': 'gcn', 'hidden_dims': '[512, 256]', 'dropout': 0.40175843320340554, 'batch_norm': True, 'lr': 0.0007164047179018972, 'weight_decay': 6.181876049788926e-06, 'epochs': 175, 'loss': 'mae', 'optimizer': 'adam', 'graph_mode': 'knn', 'source': 'grm', 'knn_k': 9, 'weighted_edges': True, 'symmetrize_mode': 'mutual', 'use_snp_selection': False}. Best is trial 1 with value: 0.08157570597177372.
[I 2025-11-03 11:52:29,337] Trial 46 finished with value: 0.02029920115897377 and parameters: {'model_type': 'gcn', 'hidden_dims': '[512, 256]', 'dropout': 0.4919827874917948, 'batch_norm': True, 'lr': 0.00020026317974984481, 'weight_decay': 1.503557404680968e-05, 'epochs': 144, 'loss': 'mae', 'optimizer': 'adam', 'graph_mode': 'cutoff', 'cutoff': 0.8900298648505328, 'grm_norm': 'cosine', 'self_loops': True, 'use_snp_selection': False}. Best is trial 1 with value: 0.08157570597177372.
[I 2025-11-03 11:52:31,069] Trial 47 finished with value: 0.028373478317924965 and parameters: {'model_type': 'gcn', 'hidden_dims': '[256, 128]', 'dropout': 0.46188286880772783, 'batch_norm': False, 'lr': 0.000453807688341954, 'weight_decay': 4.350241963574607e-05, 'epochs': 166, 'loss': 'mae', 'optimizer': 'adam', 'graph_mode': 'knn', 'source': 'grm', 'knn_k': 6, 'weighted_edges': True, 'symmetrize_mode': 'union', 'use_snp_selection': False}. Best is trial 1 with value: 0.08157570597177372.
[I 2025-11-03 11:52:33,192] Trial 48 finished with value: 0.03494603015280473 and parameters: {'model_type': 'gcn', 'hidden_dims': '[256, 128, 64]', 'dropout': 0.3749914567963433, 'batch_norm': True, 'lr': 0.0007826559735084907, 'weight_decay': 0.00010870030984420117, 'epochs': 210, 'loss': 'mae', 'optimizer': 'adam', 'graph_mode': 'cutoff', 'cutoff': 0.4043836212934655, 'grm_norm': 'cosine_then_gcn', 'self_loops': True, 'use_snp_selection': False}. Best is trial 1 with value: 0.08157570597177372.
[I 2025-11-03 11:52:35,095] Trial 49 finished with value: 0.03363053026064107 and parameters: {'model_type': 'gcn', 'hidden_dims': '[512, 256]', 'dropout': 0.4334393559658237, 'batch_norm': True, 'lr': 0.00025855978539680993, 'weight_decay': 0.00021531990792496007, 'epochs': 102, 'loss': 'mae', 'optimizer': 'adam', 'graph_mode': 'knn', 'source': 'grm', 'knn_k': 10, 'weighted_edges': False, 'symmetrize_mode': 'union', 'use_snp_selection': False}. Best is trial 1 with value: 0.08157570597177372.
[I 2025-11-03 11:52:36,491] Trial 50 finished with value: 0.02400009116142958 and parameters: {'model_type': 'gcn', 'hidden_dims': '[128, 64]', 'dropout': 0.5257536305966003, 'batch_norm': True, 'lr': 0.00015432338671609504, 'weight_decay': 2.5809089088164386e-05, 'epochs': 132, 'loss': 'mse', 'optimizer': 'adam', 'graph_mode': 'knn', 'source': 'grm', 'knn_k': 8, 'weighted_edges': True, 'symmetrize_mode': 'union', 'use_snp_selection': False}. Best is trial 1 with value: 0.08157570597177372.
[I 2025-11-03 11:52:38,673] Trial 51 finished with value: 0.08379407168685457 and parameters: {'model_type': 'gcn', 'hidden_dims': '[512, 256]', 'dropout': 0.47935247193449226, 'batch_norm': True, 'lr': 0.0005762452459924252, 'weight_decay': 3.916246323864136e-05, 'epochs': 148, 'loss': 'mae', 'optimizer': 'adam', 'graph_mode': 'knn', 'source': 'grm', 'knn_k': 9, 'weighted_edges': True, 'symmetrize_mode': 'union', 'use_snp_selection': False}. Best is trial 51 with value: 0.08379407168685457.
[I 2025-11-03 11:52:41,112] Trial 52 finished with value: 0.04276457714352567 and parameters: {'model_type': 'gcn', 'hidden_dims': '[512, 256]', 'dropout': 0.47377276379867267, 'batch_norm': True, 'lr': 0.0005016677447827572, 'weight_decay': 8.138658654729723e-05, 'epochs': 191, 'loss': 'mae', 'optimizer': 'adam', 'graph_mode': 'knn', 'source': 'grm', 'knn_k': 8, 'weighted_edges': True, 'symmetrize_mode': 'union', 'use_snp_selection': False}. Best is trial 51 with value: 0.08379407168685457.
[I 2025-11-03 11:52:43,295] Trial 53 finished with value: 0.04184642895048164 and parameters: {'model_type': 'gcn', 'hidden_dims': '[512, 256]', 'dropout': 0.4089925533392268, 'batch_norm': True, 'lr': 0.00030079429637653, 'weight_decay': 9.488550556655005e-06, 'epochs': 148, 'loss': 'mae', 'optimizer': 'adam', 'graph_mode': 'knn', 'source': 'grm', 'knn_k': 9, 'weighted_edges': True, 'symmetrize_mode': 'union', 'use_snp_selection': False}. Best is trial 51 with value: 0.08379407168685457.
[I 2025-11-03 11:52:45,125] Trial 54 finished with value: 0.07570171243860803 and parameters: {'model_type': 'gcn', 'hidden_dims': '[512, 256]', 'dropout': 0.4973581250835713, 'batch_norm': True, 'lr': 0.00099742250073082, 'weight_decay': 4.774997956271447e-05, 'epochs': 89, 'loss': 'mae', 'optimizer': 'adam', 'graph_mode': 'knn', 'source': 'grm', 'knn_k': 10, 'weighted_edges': True, 'symmetrize_mode': 'union', 'use_snp_selection': False}. Best is trial 51 with value: 0.08379407168685457.
[I 2025-11-03 11:52:46,931] Trial 55 finished with value: 0.07662478446266419 and parameters: {'model_type': 'gcn', 'hidden_dims': '[512, 256]', 'dropout': 0.4436973334701995, 'batch_norm': True, 'lr': 0.0009958198640884802, 'weight_decay': 0.00030206974399120835, 'epochs': 85, 'loss': 'mae', 'optimizer': 'adam', 'graph_mode': 'knn', 'source': 'grm', 'knn_k': 10, 'weighted_edges': True, 'symmetrize_mode': 'union', 'use_snp_selection': False}. Best is trial 51 with value: 0.08379407168685457.
[I 2025-11-03 11:52:48,682] Trial 56 finished with value: 0.007377120445250851 and parameters: {'model_type': 'gcn', 'hidden_dims': '[512, 256]', 'dropout': 0.4538875482886106, 'batch_norm': False, 'lr': 0.0009757946266370417, 'weight_decay': 0.0006773981715330392, 'epochs': 79, 'loss': 'mse', 'optimizer': 'adam', 'graph_mode': 'knn', 'source': 'grm', 'knn_k': 10, 'weighted_edges': True, 'symmetrize_mode': 'union', 'use_snp_selection': False}. Best is trial 51 with value: 0.08379407168685457.
[I 2025-11-03 11:52:50,262] Trial 57 finished with value: 0.06405130525271846 and parameters: {'model_type': 'gcn', 'hidden_dims': '[512, 256]', 'dropout': 0.39088589339621244, 'batch_norm': True, 'lr': 0.0009898613932075155, 'weight_decay': 0.0003056447079214258, 'epochs': 58, 'loss': 'mse', 'optimizer': 'adam', 'graph_mode': 'cutoff', 'cutoff': 0.7449874563461618, 'grm_norm': 'cosine', 'self_loops': True, 'use_snp_selection': False}. Best is trial 51 with value: 0.08379407168685457.
[I 2025-11-03 11:52:53,368] Trial 58 finished with value: 0.06043340249264337 and parameters: {'model_type': 'gcn', 'hidden_dims': '[512, 128]', 'dropout': 0.35314824455271665, 'batch_norm': True, 'lr': 0.000701237731552321, 'weight_decay': 8.200121095108255e-05, 'epochs': 27, 'loss': 'mae', 'optimizer': 'adam', 'graph_mode': 'knn', 'source': 'grm', 'knn_k': 10, 'weighted_edges': True, 'symmetrize_mode': 'mutual', 'use_snp_selection': True, 'num_snps': 58846}. Best is trial 51 with value: 0.08379407168685457.
[I 2025-11-03 11:52:54,873] Trial 59 finished with value: 0.06263385961792206 and parameters: {'model_type': 'gcn', 'hidden_dims': '[256, 128]', 'dropout': 0.42223119193802705, 'batch_norm': True, 'lr': 0.00039047949310176786, 'weight_decay': 4.609819158826186e-06, 'epochs': 91, 'loss': 'mse', 'optimizer': 'adam', 'graph_mode': 'knn', 'source': 'grm', 'knn_k': 10, 'weighted_edges': True, 'symmetrize_mode': 'union', 'use_snp_selection': False}. Best is trial 51 with value: 0.08379407168685457.
[I 2025-11-03 11:52:56,413] Trial 60 finished with value: 0.04680798687087808 and parameters: {'model_type': 'gcn', 'hidden_dims': '[512, 256]', 'dropout': 0.47168312493428705, 'batch_norm': True, 'lr': 0.0007534529593635859, 'weight_decay': 2.609307239386279e-06, 'epochs': 41, 'loss': 'mse', 'optimizer': 'adam', 'graph_mode': 'knn', 'source': 'grm', 'knn_k': 8, 'weighted_edges': True, 'symmetrize_mode': 'union', 'use_snp_selection': False}. Best is trial 51 with value: 0.08379407168685457.
[I 2025-11-03 11:52:58,383] Trial 61 finished with value: 0.056561087928333045 and parameters: {'model_type': 'gcn', 'hidden_dims': '[512, 256]', 'dropout': 0.49563069415439137, 'batch_norm': True, 'lr': 0.0004986987338931458, 'weight_decay': 4.038655189806491e-05, 'epochs': 112, 'loss': 'mae', 'optimizer': 'adam', 'graph_mode': 'knn', 'source': 'grm', 'knn_k': 9, 'weighted_edges': True, 'symmetrize_mode': 'union', 'use_snp_selection': False}. Best is trial 51 with value: 0.08379407168685457.
[I 2025-11-03 11:53:00,422] Trial 62 finished with value: 0.06352954687475093 and parameters: {'model_type': 'gcn', 'hidden_dims': '[512, 256]', 'dropout': 0.44568306283524617, 'batch_norm': True, 'lr': 0.0006275481849474299, 'weight_decay': 1.9466293292111195e-05, 'epochs': 123, 'loss': 'mae', 'optimizer': 'adam', 'graph_mode': 'knn', 'source': 'grm', 'knn_k': 10, 'weighted_edges': True, 'symmetrize_mode': 'union', 'use_snp_selection': False}. Best is trial 51 with value: 0.08379407168685457.
[I 2025-11-03 11:53:01,819] Trial 63 finished with value: 0.04597677125896158 and parameters: {'model_type': 'gcn', 'hidden_dims': '[512, 256]', 'dropout': 0.526655944683203, 'batch_norm': True, 'lr': 0.0003639643572254458, 'weight_decay': 5.224107661433294e-05, 'epochs': 16, 'loss': 'mae', 'optimizer': 'adam', 'graph_mode': 'knn', 'source': 'grm', 'knn_k': 9, 'weighted_edges': True, 'symmetrize_mode': 'union', 'use_snp_selection': False}. Best is trial 51 with value: 0.08379407168685457.
[I 2025-11-03 11:53:03,493] Trial 64 finished with value: 0.07777796345447874 and parameters: {'model_type': 'gcn', 'hidden_dims': '[512, 128]', 'dropout': 0.4754119329870784, 'batch_norm': True, 'lr': 0.0007880509975561935, 'weight_decay': 3.116759864921691e-05, 'epochs': 64, 'loss': 'mae', 'optimizer': 'adam', 'graph_mode': 'knn', 'source': 'grm', 'knn_k': 7, 'weighted_edges': True, 'symmetrize_mode': 'union', 'use_snp_selection': False}. Best is trial 51 with value: 0.08379407168685457.
[I 2025-11-03 11:53:05,176] Trial 65 finished with value: 0.046509326269363854 and parameters: {'model_type': 'gcn', 'hidden_dims': '[512, 128]', 'dropout': 0.4747539630850605, 'batch_norm': True, 'lr': 0.0007889727350782945, 'weight_decay': 0.00036890340586552485, 'epochs': 66, 'loss': 'mae', 'optimizer': 'adam', 'graph_mode': 'knn', 'source': 'grm', 'knn_k': 6, 'weighted_edges': False, 'symmetrize_mode': 'union', 'use_snp_selection': False}. Best is trial 51 with value: 0.08379407168685457.
[I 2025-11-03 11:53:07,749] Trial 66 finished with value: 0.047854520741379386 and parameters: {'model_type': 'gcn', 'hidden_dims': '[512, 128]', 'dropout': 0.10771757649952818, 'batch_norm': True, 'lr': 0.00042682101218168944, 'weight_decay': 8.03852019873105e-06, 'epochs': 86, 'loss': 'mae', 'optimizer': 'adam', 'graph_mode': 'knn', 'source': 'grm', 'knn_k': 7, 'weighted_edges': True, 'symmetrize_mode': 'union', 'use_snp_selection': True, 'num_snps': 38212}. Best is trial 51 with value: 0.08379407168685457.
[I 2025-11-03 11:53:09,712] Trial 67 finished with value: 0.06779615124753392 and parameters: {'model_type': 'gcn', 'hidden_dims': '[512, 128]', 'dropout': 0.5776960781333902, 'batch_norm': True, 'lr': 0.0009282991773414075, 'weight_decay': 2.6356786220016293e-05, 'epochs': 99, 'loss': 'mse', 'optimizer': 'adam', 'graph_mode': 'knn', 'source': 'grm', 'knn_k': 7, 'weighted_edges': True, 'symmetrize_mode': 'union', 'use_snp_selection': False}. Best is trial 51 with value: 0.08379407168685457.
[I 2025-11-03 11:53:11,372] Trial 68 finished with value: -0.024461354353517893 and parameters: {'model_type': 'gcn', 'hidden_dims': '[512, 128]', 'dropout': 0.15999288413528254, 'batch_norm': False, 'lr': 0.0006206634824253141, 'weight_decay': 1.291471784671801e-05, 'epochs': 62, 'loss': 'mae', 'optimizer': 'adam', 'graph_mode': 'knn', 'source': 'grm', 'knn_k': 8, 'weighted_edges': True, 'symmetrize_mode': 'union', 'use_snp_selection': False}. Best is trial 51 with value: 0.08379407168685457.
[I 2025-11-03 11:53:12,865] Trial 69 finished with value: 0.04667150315570744 and parameters: {'model_type': 'gcn', 'hidden_dims': '[256, 128, 64]', 'dropout': 0.4139748274091479, 'batch_norm': True, 'lr': 0.0002525684980509719, 'weight_decay': 6.667055535563612e-06, 'epochs': 80, 'loss': 'mse', 'optimizer': 'adam', 'graph_mode': 'knn', 'source': 'grm', 'knn_k': 1, 'weighted_edges': True, 'symmetrize_mode': 'union', 'use_snp_selection': False}. Best is trial 51 with value: 0.08379407168685457.
[I 2025-11-03 11:53:14,351] Trial 70 finished with value: 0.04086368306954416 and parameters: {'model_type': 'gcn', 'hidden_dims': '[512, 128]', 'dropout': 0.5630195734029878, 'batch_norm': True, 'lr': 0.00031921196410527095, 'weight_decay': 1.8620997522150808e-06, 'epochs': 43, 'loss': 'mae', 'optimizer': 'adam', 'graph_mode': 'cutoff', 'cutoff': 0.6134899082294079, 'grm_norm': 'none', 'self_loops': False, 'use_snp_selection': False}. Best is trial 51 with value: 0.08379407168685457.
[I 2025-11-03 11:53:15,759] Trial 71 finished with value: 0.030340878925014105 and parameters: {'model_type': 'gcn', 'hidden_dims': '[512, 256]', 'dropout': 0.49746936031647504, 'batch_norm': True, 'lr': 0.0008371186623926591, 'weight_decay': 3.369236766212348e-05, 'epochs': 18, 'loss': 'mae', 'optimizer': 'adam', 'graph_mode': 'knn', 'source': 'grm', 'knn_k': 10, 'weighted_edges': True, 'symmetrize_mode': 'union', 'use_snp_selection': False}. Best is trial 51 with value: 0.08379407168685457.
[I 2025-11-03 11:53:17,833] Trial 72 finished with value: 0.04471174697203747 and parameters: {'model_type': 'gcn', 'hidden_dims': '[512, 256]', 'dropout': 0.478599976394602, 'batch_norm': True, 'lr': 0.0005909590751862002, 'weight_decay': 6.974484776085177e-05, 'epochs': 129, 'loss': 'mae', 'optimizer': 'adam', 'graph_mode': 'knn', 'source': 'grm', 'knn_k': 9, 'weighted_edges': True, 'symmetrize_mode': 'union', 'use_snp_selection': False}. Best is trial 51 with value: 0.08379407168685457.
[I 2025-11-03 11:53:19,422] Trial 73 finished with value: 0.06254656135403175 and parameters: {'model_type': 'gcn', 'hidden_dims': '[512, 256]', 'dropout': 0.4404751945276745, 'batch_norm': True, 'lr': 0.0005075973387296971, 'weight_decay': 5.1280771280049556e-05, 'epochs': 48, 'loss': 'mae', 'optimizer': 'adam', 'graph_mode': 'knn', 'source': 'grm', 'knn_k': 10, 'weighted_edges': True, 'symmetrize_mode': 'union', 'use_snp_selection': False}. Best is trial 51 with value: 0.08379407168685457.
[I 2025-11-03 11:53:20,918] Trial 74 finished with value: 0.022856728554294978 and parameters: {'model_type': 'gcn', 'hidden_dims': '[256, 128]', 'dropout': 0.46038430891636467, 'batch_norm': True, 'lr': 0.000705350653130145, 'weight_decay': 0.00010946410315266196, 'epochs': 97, 'loss': 'mae', 'optimizer': 'adam', 'graph_mode': 'knn', 'source': 'grm', 'knn_k': 9, 'weighted_edges': True, 'symmetrize_mode': 'union', 'use_snp_selection': False}. Best is trial 51 with value: 0.08379407168685457.
[I 2025-11-03 11:53:22,939] Trial 75 finished with value: 0.08073278061333113 and parameters: {'model_type': 'gcn', 'hidden_dims': '[512, 128]', 'dropout': 0.5173028587672034, 'batch_norm': True, 'lr': 0.0009980662019819467, 'weight_decay': 1.4866234987398846e-05, 'epochs': 121, 'loss': 'mae', 'optimizer': 'adam', 'graph_mode': 'knn', 'source': 'grm', 'knn_k': 8, 'weighted_edges': True, 'symmetrize_mode': 'union', 'use_snp_selection': False}. Best is trial 51 with value: 0.08379407168685457.
[I 2025-11-03 11:53:25,972] Trial 76 finished with value: 0.08054758724574893 and parameters: {'model_type': 'gcn', 'hidden_dims': '[512, 128]', 'dropout': 0.5186727143022979, 'batch_norm': True, 'lr': 0.0009853137144322256, 'weight_decay': 3.3370079756738514e-06, 'epochs': 69, 'loss': 'mae', 'optimizer': 'adam', 'graph_mode': 'knn', 'source': 'grm', 'knn_k': 7, 'weighted_edges': True, 'symmetrize_mode': 'union', 'use_snp_selection': True, 'num_snps': 51171}. Best is trial 51 with value: 0.08379407168685457.
[I 2025-11-03 11:53:29,039] Trial 77 finished with value: 0.0562702809231131 and parameters: {'model_type': 'gcn', 'hidden_dims': '[512, 128]', 'dropout': 0.5506148944078438, 'batch_norm': True, 'lr': 0.0008593838290399516, 'weight_decay': 3.3255437009748632e-06, 'epochs': 70, 'loss': 'mae', 'optimizer': 'adam', 'graph_mode': 'knn', 'source': 'grm', 'knn_k': 7, 'weighted_edges': True, 'symmetrize_mode': 'union', 'use_snp_selection': True, 'num_snps': 51335}. Best is trial 51 with value: 0.08379407168685457.
[I 2025-11-03 11:53:32,344] Trial 78 finished with value: -0.009589092517889955 and parameters: {'model_type': 'gcn', 'hidden_dims': '[512, 128]', 'dropout': 0.5272721934881262, 'batch_norm': True, 'lr': 2.8974154089379776e-06, 'weight_decay': 1.571517642809656e-05, 'epochs': 108, 'loss': 'mae', 'optimizer': 'adam', 'graph_mode': 'knn', 'source': 'grm', 'knn_k': 8, 'weighted_edges': False, 'symmetrize_mode': 'union', 'use_snp_selection': True, 'num_snps': 52330}. Best is trial 51 with value: 0.08379407168685457.
[I 2025-11-03 11:53:34,874] Trial 79 finished with value: 0.08078243805296476 and parameters: {'model_type': 'gcn', 'hidden_dims': '[512, 128]', 'dropout': 0.5109708279995462, 'batch_norm': True, 'lr': 0.0009924001748987201, 'weight_decay': 1.1157415741606654e-06, 'epochs': 81, 'loss': 'mae', 'optimizer': 'adam', 'graph_mode': 'knn', 'source': 'grm', 'knn_k': 8, 'weighted_edges': True, 'symmetrize_mode': 'union', 'use_snp_selection': True, 'num_snps': 36709}. Best is trial 51 with value: 0.08379407168685457.
[I 2025-11-03 11:53:37,560] Trial 80 finished with value: 0.08075838566440424 and parameters: {'model_type': 'gcn', 'hidden_dims': '[512, 128]', 'dropout': 0.522839216998848, 'batch_norm': True, 'lr': 0.0004211726504349287, 'weight_decay': 1.383626075180932e-06, 'epochs': 118, 'loss': 'mae', 'optimizer': 'adam', 'graph_mode': 'knn', 'source': 'grm', 'knn_k': 8, 'weighted_edges': True, 'symmetrize_mode': 'mutual', 'use_snp_selection': True, 'num_snps': 36239}. Best is trial 51 with value: 0.08379407168685457.
[I 2025-11-03 11:53:39,886] Trial 81 finished with value: 0.04670506621793385 and parameters: {'model_type': 'gcn', 'hidden_dims': '[512, 128]', 'dropout': 0.5166546853236174, 'batch_norm': True, 'lr': 0.0007170454834516425, 'weight_decay': 1.0196498050273792e-06, 'epochs': 32, 'loss': 'mae', 'optimizer': 'adam', 'graph_mode': 'knn', 'source': 'grm', 'knn_k': 8, 'weighted_edges': True, 'symmetrize_mode': 'mutual', 'use_snp_selection': True, 'num_snps': 36836}. Best is trial 51 with value: 0.08379407168685457.
[I 2025-11-03 11:53:42,581] Trial 82 finished with value: 0.06216059455068084 and parameters: {'model_type': 'gcn', 'hidden_dims': '[512, 128]', 'dropout': 0.5344242343064952, 'batch_norm': True, 'lr': 0.00043581748511562504, 'weight_decay': 1.172381912928411e-06, 'epochs': 122, 'loss': 'mae', 'optimizer': 'adam', 'graph_mode': 'knn', 'source': 'grm', 'knn_k': 7, 'weighted_edges': True, 'symmetrize_mode': 'mutual', 'use_snp_selection': True, 'num_snps': 35910}. Best is trial 51 with value: 0.08379407168685457.
[I 2025-11-03 11:53:45,539] Trial 83 finished with value: 0.07914668202822782 and parameters: {'model_type': 'gcn', 'hidden_dims': '[512, 128]', 'dropout': 0.5124100843760284, 'batch_norm': True, 'lr': 0.0005899808695595579, 'weight_decay': 5.083112428664538e-07, 'epochs': 57, 'loss': 'mae', 'optimizer': 'adam', 'graph_mode': 'knn', 'source': 'grm', 'knn_k': 7, 'weighted_edges': True, 'symmetrize_mode': 'mutual', 'use_snp_selection': True, 'num_snps': 49621}. Best is trial 51 with value: 0.08379407168685457.
[I 2025-11-03 11:53:48,762] Trial 84 finished with value: 0.06643384687736557 and parameters: {'model_type': 'gcn', 'hidden_dims': '[512, 128]', 'dropout': 0.5522618238162756, 'batch_norm': True, 'lr': 0.0005779984106266015, 'weight_decay': 1.9297336392578344e-06, 'epochs': 116, 'loss': 'mae', 'optimizer': 'adam', 'graph_mode': 'knn', 'source': 'grm', 'knn_k': 7, 'weighted_edges': True, 'symmetrize_mode': 'mutual', 'use_snp_selection': True, 'num_snps': 48950}. Best is trial 51 with value: 0.08379407168685457.
[I 2025-11-03 11:53:51,331] Trial 85 finished with value: 0.06928375962736644 and parameters: {'model_type': 'gcn', 'hidden_dims': '[512, 128]', 'dropout': 0.5123367028090349, 'batch_norm': True, 'lr': 0.0003698997986763644, 'weight_decay': 5.65223511732403e-07, 'epochs': 57, 'loss': 'mae', 'optimizer': 'adam', 'graph_mode': 'knn', 'source': 'grm', 'knn_k': 6, 'weighted_edges': True, 'symmetrize_mode': 'mutual', 'use_snp_selection': True, 'num_snps': 40307}. Best is trial 51 with value: 0.08379407168685457.
[I 2025-11-03 11:53:54,884] Trial 86 finished with value: 0.05917966411329637 and parameters: {'model_type': 'gcn', 'hidden_dims': '[512, 128]', 'dropout': 0.5035880177373253, 'batch_norm': True, 'lr': 0.0007909925960540561, 'weight_decay': 6.469044603867781e-07, 'epochs': 135, 'loss': 'mae', 'optimizer': 'adam', 'graph_mode': 'knn', 'source': 'grm', 'knn_k': 7, 'weighted_edges': True, 'symmetrize_mode': 'mutual', 'use_snp_selection': True, 'num_snps': 53906}. Best is trial 51 with value: 0.08379407168685457.
[I 2025-11-03 11:53:58,211] Trial 87 finished with value: 0.06743031502604621 and parameters: {'model_type': 'gcn', 'hidden_dims': '[512, 128]', 'dropout': 0.5834158444820478, 'batch_norm': False, 'lr': 0.0005331960101927064, 'weight_decay': 2.0054316034468155e-07, 'epochs': 167, 'loss': 'mae', 'optimizer': 'adam', 'graph_mode': 'knn', 'source': 'grm', 'knn_k': 8, 'weighted_edges': True, 'symmetrize_mode': 'mutual', 'use_snp_selection': True, 'num_snps': 45734}. Best is trial 51 with value: 0.08379407168685457.
