[I 2025-11-03 12:16:20,411] Trial 36 finished with value: 0.11904810485082258 and parameters: {'model_type': 'gcn', 'hidden_dims': '[512, 64]', 'dropout': 0.3408492983337011, 'batch_norm': True, 'lr': 0.0009116757561499892, 'weight_decay': 6.886876803351276e-05, 'epochs': 230, 'loss': 'mse', 'optimizer': 'adam', 'graph_mode': 'off', 'use_snp_selection': True, 'num_snps': 58661}. Best is trial 11 with value: 0.1465910463303249.
[I 2025-11-03 12:16:22,338] Trial 37 finished with value: 0.03134690420752095 and parameters: {'model_type': 'gcn', 'hidden_dims': '[256, 128, 64]', 'dropout': 0.3830020398246707, 'batch_norm': True, 'lr': 4.446294938689988e-06, 'weight_decay': 1.7331777011776498e-07, 'epochs': 318, 'loss': 'mae', 'optimizer': 'adam', 'graph_mode': 'off', 'use_snp_selection': False}. Best is trial 11 with value: 0.1465910463303249.
[I 2025-11-03 12:16:23,904] Trial 38 finished with value: 0.08681943341837187 and parameters: {'model_type': 'gcn', 'hidden_dims': '[512, 128]', 'dropout': 0.2724569281783293, 'batch_norm': False, 'lr': 0.00018060072915358807, 'weight_decay': 9.456830003165751e-07, 'epochs': 298, 'loss': 'mse', 'optimizer': 'adam', 'graph_mode': 'off', 'use_snp_selection': True, 'num_snps': 19911}. Best is trial 11 with value: 0.1465910463303249.
[I 2025-11-03 12:16:25,903] Trial 39 finished with value: 0.09955006219114479 and parameters: {'model_type': 'gcn', 'hidden_dims': '[512, 256]', 'dropout': 0.12763051281469295, 'batch_norm': True, 'lr': 4.2433496150853426e-05, 'weight_decay': 7.2921747674577865e-06, 'epochs': 255, 'loss': 'mse', 'optimizer': 'adam', 'graph_mode': 'off', 'use_snp_selection': False}. Best is trial 11 with value: 0.1465910463303249.
[I 2025-11-03 12:16:27,662] Trial 40 finished with value: 0.10531860031002939 and parameters: {'model_type': 'gcn', 'hidden_dims': '[256, 128]', 'dropout': 0.2941665192267963, 'batch_norm': True, 'lr': 9.928770174677613e-05, 'weight_decay': 1.0393855268417987e-07, 'epochs': 350, 'loss': 'mae', 'optimizer': 'adam', 'graph_mode': 'off', 'use_snp_selection': False}. Best is trial 11 with value: 0.1465910463303249.
[I 2025-11-03 12:16:29,405] Trial 41 finished with value: 0.12105977530500527 and parameters: {'model_type': 'gcn', 'hidden_dims': '[512, 128]', 'dropout': 0.2099834643991203, 'batch_norm': True, 'lr': 0.0004215661301488184, 'weight_decay': 2.4271972784835284e-07, 'epochs': 196, 'loss': 'mse', 'optimizer': 'adam', 'graph_mode': 'off', 'use_snp_selection': False}. Best is trial 11 with value: 0.1465910463303249.
[I 2025-11-03 12:16:31,151] Trial 42 finished with value: 0.11443055827663409 and parameters: {'model_type': 'gcn', 'hidden_dims': '[512, 128]', 'dropout': 0.18766081529880152, 'batch_norm': True, 'lr': 0.00041643377149204756, 'weight_decay': 4.815638912913599e-07, 'epochs': 184, 'loss': 'mse', 'optimizer': 'adam', 'graph_mode': 'off', 'use_snp_selection': False}. Best is trial 11 with value: 0.1465910463303249.
[I 2025-11-03 12:16:32,698] Trial 43 finished with value: 0.05325589241487583 and parameters: {'model_type': 'gcn', 'hidden_dims': '[512, 128]', 'dropout': 0.16721649992558796, 'batch_norm': True, 'lr': 2.1409924724993155e-06, 'weight_decay': 1.7774065812883787e-07, 'epochs': 151, 'loss': 'mse', 'optimizer': 'adam', 'graph_mode': 'off', 'use_snp_selection': False}. Best is trial 11 with value: 0.1465910463303249.
[I 2025-11-03 12:16:34,157] Trial 44 finished with value: 0.1237212299547114 and parameters: {'model_type': 'gcn', 'hidden_dims': '[512, 128]', 'dropout': 0.12536473085535332, 'batch_norm': True, 'lr': 0.00026266922681025053, 'weight_decay': 0.00010040081007592979, 'epochs': 135, 'loss': 'mse', 'optimizer': 'adam', 'graph_mode': 'off', 'use_snp_selection': False}. Best is trial 11 with value: 0.1465910463303249.
[I 2025-11-03 12:16:35,922] Trial 45 finished with value: 0.11960355606314982 and parameters: {'model_type': 'gcn', 'hidden_dims': '[512, 64]', 'dropout': 0.25388892124505746, 'batch_norm': True, 'lr': 0.0006576936314916269, 'weight_decay': 2.7790858527397755e-07, 'epochs': 206, 'loss': 'mse', 'optimizer': 'adam', 'graph_mode': 'off', 'use_snp_selection': False}. Best is trial 11 with value: 0.1465910463303249.
[I 2025-11-03 12:16:37,466] Trial 46 finished with value: 0.1335707497314577 and parameters: {'model_type': 'gcn', 'hidden_dims': '[512, 128]', 'dropout': 0.4140026247765831, 'batch_norm': False, 'lr': 0.0004683927401604667, 'weight_decay': 1.5289654648165003e-07, 'epochs': 164, 'loss': 'mse', 'optimizer': 'adam', 'graph_mode': 'off', 'use_snp_selection': False}. Best is trial 11 with value: 0.1465910463303249.
[I 2025-11-03 12:16:38,997] Trial 47 finished with value: 0.08961918218606645 and parameters: {'model_type': 'gcn', 'hidden_dims': '[512, 128]', 'dropout': 0.4170932742382465, 'batch_norm': False, 'lr': 0.0002163067485576623, 'weight_decay': 3.184998275725864e-05, 'epochs': 158, 'loss': 'mae', 'optimizer': 'adam', 'graph_mode': 'off', 'use_snp_selection': False}. Best is trial 11 with value: 0.1465910463303249.
[I 2025-11-03 12:16:40,492] Trial 48 finished with value: 0.02461449704128583 and parameters: {'model_type': 'gcn', 'hidden_dims': '[128, 64]', 'dropout': 0.4795202150982728, 'batch_norm': False, 'lr': 0.000825383282062003, 'weight_decay': 0.0006963874766430633, 'epochs': 125, 'loss': 'mse', 'optimizer': 'adam', 'graph_mode': 'off', 'use_snp_selection': True, 'num_snps': 43224}. Best is trial 11 with value: 0.1465910463303249.
[I 2025-11-03 12:16:41,645] Trial 49 finished with value: 0.0008918003183546503 and parameters: {'model_type': 'gcn', 'hidden_dims': '[512, 256]', 'dropout': 0.40476327151748887, 'batch_norm': False, 'lr': 0.0005444799185191278, 'weight_decay': 1.3638612515206067e-07, 'epochs': 88, 'loss': 'mse', 'optimizer': 'adam', 'graph_mode': 'off', 'use_snp_selection': False}. Best is trial 11 with value: 0.1465910463303249.
[I 2025-11-03 12:16:43,222] Trial 50 finished with value: 0.07804755129060939 and parameters: {'model_type': 'gcn', 'hidden_dims': '[512, 128]', 'dropout': 0.5632529855506866, 'batch_norm': False, 'lr': 0.00031123867981522384, 'weight_decay': 5.352334369329199e-07, 'epochs': 168, 'loss': 'mse', 'optimizer': 'adam', 'graph_mode': 'off', 'use_snp_selection': False}. Best is trial 11 with value: 0.1465910463303249.
[I 2025-11-03 12:16:44,831] Trial 51 finished with value: 0.017942739109888015 and parameters: {'model_type': 'gcn', 'hidden_dims': '[512, 128]', 'dropout': 0.3614548072924068, 'batch_norm': False, 'lr': 0.0004911097053911928, 'weight_decay': 1.6151094914807943e-07, 'epochs': 185, 'loss': 'mse', 'optimizer': 'adam', 'graph_mode': 'off', 'use_snp_selection': False}. Best is trial 11 with value: 0.1465910463303249.
[I 2025-11-03 12:16:46,686] Trial 52 finished with value: 0.1444682931240753 and parameters: {'model_type': 'gcn', 'hidden_dims': '[512, 128]', 'dropout': 0.33434873356719214, 'batch_norm': True, 'lr': 0.0004158727875088592, 'weight_decay': 2.975563039365431e-07, 'epochs': 220, 'loss': 'mse', 'optimizer': 'adam', 'graph_mode': 'off', 'use_snp_selection': False}. Best is trial 11 with value: 0.1465910463303249.
[I 2025-11-03 12:16:48,512] Trial 53 finished with value: 0.12157386689358221 and parameters: {'model_type': 'gcn', 'hidden_dims': '[512, 128]', 'dropout': 0.32813646305781213, 'batch_norm': True, 'lr': 0.0007325169383041786, 'weight_decay': 2.837961079528414e-07, 'epochs': 225, 'loss': 'mse', 'optimizer': 'adam', 'graph_mode': 'off', 'use_snp_selection': False}. Best is trial 11 with value: 0.1465910463303249.
[I 2025-11-03 12:16:50,330] Trial 54 finished with value: 0.0949989930244522 and parameters: {'model_type': 'gcn', 'hidden_dims': '[512, 128]', 'dropout': 0.3663065211093275, 'batch_norm': True, 'lr': 0.00017094057985229846, 'weight_decay': 1.0891915226766353e-07, 'epochs': 213, 'loss': 'mse', 'optimizer': 'adam', 'graph_mode': 'off', 'use_snp_selection': False}. Best is trial 11 with value: 0.1465910463303249.
[I 2025-11-03 12:16:51,959] Trial 55 finished with value: 0.08804530070741141 and parameters: {'model_type': 'gcn', 'hidden_dims': '[256, 128, 64]', 'dropout': 0.285844154292907, 'batch_norm': False, 'lr': 0.0009796521839342603, 'weight_decay': 1.0003301757760351e-06, 'epochs': 265, 'loss': 'mse', 'optimizer': 'adam', 'graph_mode': 'off', 'use_snp_selection': False}. Best is trial 11 with value: 0.1465910463303249.
[I 2025-11-03 12:16:53,897] Trial 56 finished with value: 0.12051026392864034 and parameters: {'model_type': 'gcn', 'hidden_dims': '[512, 128]', 'dropout': 0.37613997473655847, 'batch_norm': True, 'lr': 0.0004951141385202884, 'weight_decay': 1.962665493403199e-06, 'epochs': 239, 'loss': 'mse', 'optimizer': 'adam', 'graph_mode': 'off', 'use_snp_selection': False}. Best is trial 11 with value: 0.1465910463303249.
[I 2025-11-03 12:16:54,910] Trial 57 finished with value: 0.1220018679457448 and parameters: {'model_type': 'gcn', 'hidden_dims': '[512, 256]', 'dropout': 0.334653733972036, 'batch_norm': True, 'lr': 0.00033030611265790356, 'weight_decay': 3.4201775620100584e-07, 'epochs': 42, 'loss': 'mse', 'optimizer': 'adam', 'graph_mode': 'off', 'use_snp_selection': False}. Best is trial 11 with value: 0.1465910463303249.
[I 2025-11-03 12:16:56,592] Trial 58 finished with value: 0.13348564518203646 and parameters: {'model_type': 'gcn', 'hidden_dims': '[512, 64]', 'dropout': 0.3989751199039738, 'batch_norm': True, 'lr': 0.0002420214003652247, 'weight_decay': 6.68800759818523e-07, 'epochs': 191, 'loss': 'mae', 'optimizer': 'adam', 'graph_mode': 'off', 'use_snp_selection': False}. Best is trial 11 with value: 0.1465910463303249.
[I 2025-11-03 12:16:58,120] Trial 59 finished with value: 0.11263541868642246 and parameters: {'model_type': 'gcn', 'hidden_dims': '[512, 64]', 'dropout': 0.42465275071607367, 'batch_norm': False, 'lr': 7.943804255640849e-05, 'weight_decay': 5.501669198358442e-07, 'epochs': 165, 'loss': 'mae', 'optimizer': 'adam', 'graph_mode': 'off', 'use_snp_selection': False}. Best is trial 11 with value: 0.1465910463303249.
[I 2025-11-03 12:16:59,692] Trial 60 finished with value: 0.11641733053381742 and parameters: {'model_type': 'gcn', 'hidden_dims': '[512, 64]', 'dropout': 0.3977525153587156, 'batch_norm': True, 'lr': 0.00024948833272973056, 'weight_decay': 1.3651794011259769e-05, 'epochs': 220, 'loss': 'mae', 'optimizer': 'adam', 'graph_mode': 'off', 'use_snp_selection': True, 'num_snps': 24139}. Best is trial 11 with value: 0.1465910463303249.
[I 2025-11-03 12:17:01,423] Trial 61 finished with value: 0.09918735707651853 and parameters: {'model_type': 'gcn', 'hidden_dims': '[512, 64]', 'dropout': 0.4527455172135944, 'batch_norm': True, 'lr': 0.0003738423275503091, 'weight_decay': 2.162182961547132e-07, 'epochs': 197, 'loss': 'mae', 'optimizer': 'adam', 'graph_mode': 'off', 'use_snp_selection': False}. Best is trial 11 with value: 0.1465910463303249.
[I 2025-11-03 12:17:03,120] Trial 62 finished with value: 0.12192522371949183 and parameters: {'model_type': 'gcn', 'hidden_dims': '[512, 64]', 'dropout': 0.31154982198335684, 'batch_norm': True, 'lr': 0.0005986258560942435, 'weight_decay': 7.109064769842965e-07, 'epochs': 187, 'loss': 'mae', 'optimizer': 'adam', 'graph_mode': 'off', 'use_snp_selection': False}. Best is trial 11 with value: 0.1465910463303249.
[I 2025-11-03 12:17:04,763] Trial 63 finished with value: 0.11775073110872358 and parameters: {'model_type': 'gcn', 'hidden_dims': '[512, 128]', 'dropout': 0.38992360353456224, 'batch_norm': True, 'lr': 0.0001449336058964551, 'weight_decay': 1.4823946928116784e-07, 'epochs': 176, 'loss': 'mae', 'optimizer': 'adam', 'graph_mode': 'off', 'use_snp_selection': False}. Best is trial 11 with value: 0.1465910463303249.
[I 2025-11-03 12:17:06,563] Trial 64 finished with value: 0.10707520799936295 and parameters: {'model_type': 'gcn', 'hidden_dims': '[512, 256]', 'dropout': 0.4379243644546651, 'batch_norm': True, 'lr': 0.0002100880142745122, 'weight_decay': 3.288641709550681e-07, 'epochs': 209, 'loss': 'mse', 'optimizer': 'adam', 'graph_mode': 'off', 'use_snp_selection': False}. Best is trial 11 with value: 0.1465910463303249.
[I 2025-11-03 12:17:07,449] Trial 65 finished with value: 0.11459868893713154 and parameters: {'model_type': 'gcn', 'hidden_dims': '[128, 64]', 'dropout': 0.3721204337835481, 'batch_norm': True, 'lr': 0.0007489954340473658, 'weight_decay': 1.1802638290152431e-06, 'epochs': 141, 'loss': 'mse', 'optimizer': 'adam', 'graph_mode': 'off', 'use_snp_selection': False}. Best is trial 11 with value: 0.1465910463303249.
[I 2025-11-03 12:17:08,562] Trial 66 finished with value: 0.1016042171973668 and parameters: {'model_type': 'gcn', 'hidden_dims': '[256, 128]', 'dropout': 0.3430937923006851, 'batch_norm': True, 'lr': 0.00046661589910287053, 'weight_decay': 1.0534658286087212e-07, 'epochs': 153, 'loss': 'mse', 'optimizer': 'adam', 'graph_mode': 'off', 'use_snp_selection': False}. Best is trial 11 with value: 0.1465910463303249.
[I 2025-11-03 12:17:10,522] Trial 67 finished with value: 0.014745484133704308 and parameters: {'model_type': 'gcn', 'hidden_dims': '[512, 128]', 'dropout': 0.24689823235638597, 'batch_norm': True, 'lr': 1.0387880921401811e-06, 'weight_decay': 2.112532858131444e-07, 'epochs': 245, 'loss': 'mae', 'optimizer': 'adam', 'graph_mode': 'off', 'use_snp_selection': False}. Best is trial 11 with value: 0.1465910463303249.
[I 2025-11-03 12:17:12,313] Trial 68 finished with value: 0.08029092937905631 and parameters: {'model_type': 'gcn', 'hidden_dims': '[256, 128, 64]', 'dropout': 0.47394415466615597, 'batch_norm': True, 'lr': 0.00011240389232122089, 'weight_decay': 4.2617589892860346e-07, 'epochs': 282, 'loss': 'mse', 'optimizer': 'adam', 'graph_mode': 'off', 'use_snp_selection': False}. Best is trial 11 with value: 0.1465910463303249.
[I 2025-11-03 12:17:14,212] Trial 69 finished with value: 0.13525603858449592 and parameters: {'model_type': 'gcn', 'hidden_dims': '[512, 64]', 'dropout': 0.3202739080441834, 'batch_norm': True, 'lr': 0.00029811975326016795, 'weight_decay': 3.03411708708235e-06, 'epochs': 230, 'loss': 'mse', 'optimizer': 'adam', 'graph_mode': 'off', 'use_snp_selection': False}. Best is trial 11 with value: 0.1465910463303249.
[I 2025-11-03 12:17:16,062] Trial 70 finished with value: 0.11071822594623817 and parameters: {'model_type': 'gcn', 'hidden_dims': '[512, 64]', 'dropout': 0.2654501410865972, 'batch_norm': True, 'lr': 0.0003477164706981069, 'weight_decay': 2.4387090436017347e-06, 'epochs': 227, 'loss': 'mse', 'optimizer': 'adam', 'graph_mode': 'off', 'use_snp_selection': False}. Best is trial 11 with value: 0.1465910463303249.
[I 2025-11-03 12:17:18,113] Trial 71 finished with value: 0.10544829547146464 and parameters: {'model_type': 'gcn', 'hidden_dims': '[512, 64]', 'dropout': 0.2869505179199817, 'batch_norm': True, 'lr': 0.0002551174791041617, 'weight_decay': 4.420780084541935e-06, 'epochs': 264, 'loss': 'mse', 'optimizer': 'adam', 'graph_mode': 'off', 'use_snp_selection': False}. Best is trial 11 with value: 0.1465910463303249.
[I 2025-11-03 12:17:20,067] Trial 72 finished with value: 0.13672322872135784 and parameters: {'model_type': 'gcn', 'hidden_dims': '[512, 64]', 'dropout': 0.3257656975379084, 'batch_norm': True, 'lr': 0.00015487882077736787, 'weight_decay': 2.893072993323412e-07, 'epochs': 234, 'loss': 'mse', 'optimizer': 'adam', 'graph_mode': 'off', 'use_snp_selection': False}. Best is trial 11 with value: 0.1465910463303249.
[I 2025-11-03 12:17:22,005] Trial 73 finished with value: 0.11131767924270902 and parameters: {'model_type': 'gcn', 'hidden_dims': '[512, 64]', 'dropout': 0.3533346161683915, 'batch_norm': True, 'lr': 0.0001619852395011579, 'weight_decay': 2.9628001925976194e-07, 'epochs': 232, 'loss': 'mse', 'optimizer': 'adam', 'graph_mode': 'off', 'use_snp_selection': False}. Best is trial 11 with value: 0.1465910463303249.
[I 2025-11-03 12:17:23,991] Trial 74 finished with value: 0.04337614032658446 and parameters: {'model_type': 'gcn', 'hidden_dims': '[512, 64]', 'dropout': 0.3219352170687836, 'batch_norm': True, 'lr': 1.0484293688932914e-05, 'weight_decay': 1.296254805991364e-07, 'epochs': 249, 'loss': 'mse', 'optimizer': 'adam', 'graph_mode': 'off', 'use_snp_selection': False}. Best is trial 11 with value: 0.1465910463303249.
[I 2025-11-03 12:17:25,766] Trial 75 finished with value: 0.10526773256711067 and parameters: {'model_type': 'gcn', 'hidden_dims': '[512, 64]', 'dropout': 0.2984610987161416, 'batch_norm': True, 'lr': 0.0002919924279954669, 'weight_decay': 7.061945122258935e-06, 'epochs': 205, 'loss': 'mse', 'optimizer': 'adam', 'graph_mode': 'off', 'use_snp_selection': False}. Best is trial 11 with value: 0.1465910463303249.
[I 2025-11-03 12:17:26,804] Trial 76 finished with value: 0.09682431152174442 and parameters: {'model_type': 'gcn', 'hidden_dims': '[512, 64]', 'dropout': 0.4044981080633146, 'batch_norm': True, 'lr': 0.0004105042859835182, 'weight_decay': 7.732041476636012e-07, 'epochs': 239, 'loss': 'mse', 'optimizer': 'adam', 'graph_mode': 'off', 'use_snp_selection': True, 'num_snps': 3325}. Best is trial 11 with value: 0.1465910463303249.
[I 2025-11-03 12:17:28,603] Trial 77 finished with value: 0.027958715693639797 and parameters: {'model_type': 'gcn', 'hidden_dims': '[512, 64]', 'dropout': 0.383625051443997, 'batch_norm': False, 'lr': 0.0008095469890696532, 'weight_decay': 1.805807367341434e-07, 'epochs': 218, 'loss': 'mse', 'optimizer': 'adam', 'graph_mode': 'off', 'use_snp_selection': False}. Best is trial 11 with value: 0.1465910463303249.
[I 2025-11-03 12:17:30,290] Trial 78 finished with value: 0.11160520047361845 and parameters: {'model_type': 'gcn', 'hidden_dims': '[512, 128]', 'dropout': 0.2221013687305136, 'batch_norm': True, 'lr': 0.0005502467837930578, 'weight_decay': 2.449902944201852e-07, 'epochs': 191, 'loss': 'mse', 'optimizer': 'adam', 'graph_mode': 'off', 'use_snp_selection': False}. Best is trial 11 with value: 0.1465910463303249.
[I 2025-11-03 12:17:32,352] Trial 79 finished with value: 0.12468503753070014 and parameters: {'model_type': 'gcn', 'hidden_dims': '[512, 256]', 'dropout': 0.1190704429680782, 'batch_norm': True, 'lr': 0.0006412366557838641, 'weight_decay': 3.0038999956457955e-06, 'epochs': 261, 'loss': 'mae', 'optimizer': 'adam', 'graph_mode': 'off', 'use_snp_selection': False}. Best is trial 11 with value: 0.1465910463303249.
[I 2025-11-03 12:17:34,125] Trial 80 finished with value: 0.07509215076684848 and parameters: {'model_type': 'gcn', 'hidden_dims': '[512, 128]', 'dropout': 0.34806022540433257, 'batch_norm': True, 'lr': 4.371633072038414e-05, 'weight_decay': 1.320917931009474e-07, 'epochs': 215, 'loss': 'mse', 'optimizer': 'adam', 'graph_mode': 'off', 'use_snp_selection': False}. Best is trial 11 with value: 0.1465910463303249.
[I 2025-11-03 12:17:35,412] Trial 81 finished with value: 0.11925323297616448 and parameters: {'model_type': 'gcn', 'hidden_dims': '[128, 64]', 'dropout': 0.3158285381358687, 'batch_norm': True, 'lr': 0.00019057062232436455, 'weight_decay': 4.6452215105065246e-07, 'epochs': 302, 'loss': 'mse', 'optimizer': 'adam', 'graph_mode': 'off', 'use_snp_selection': False}. Best is trial 11 with value: 0.1465910463303249.
[I 2025-11-03 12:17:37,521] Trial 82 finished with value: 0.11467769287558727 and parameters: {'model_type': 'gcn', 'hidden_dims': '[512, 64]', 'dropout': 0.30540600525303163, 'batch_norm': True, 'lr': 0.00023595271715578706, 'weight_decay': 6.265100265866453e-07, 'epochs': 274, 'loss': 'mse', 'optimizer': 'adam', 'graph_mode': 'off', 'use_snp_selection': False}. Best is trial 11 with value: 0.1465910463303249.
[I 2025-11-03 12:17:38,523] Trial 83 finished with value: 0.12569113636658627 and parameters: {'model_type': 'gcn', 'hidden_dims': '[128, 64]', 'dropout': 0.33104885614215573, 'batch_norm': True, 'lr': 0.00044960189324696706, 'weight_decay': 3.6683427769650594e-07, 'epochs': 180, 'loss': 'mse', 'optimizer': 'adam', 'graph_mode': 'off', 'use_snp_selection': False}. Best is trial 11 with value: 0.1465910463303249.
[I 2025-11-03 12:17:40,146] Trial 84 finished with value: 0.09381452718651011 and parameters: {'model_type': 'gcn', 'hidden_dims': '[512, 128]', 'dropout': 0.14631193194313133, 'batch_norm': True, 'lr': 5.7085496971782174e-05, 'weight_decay': 2.6579983446653483e-07, 'epochs': 171, 'loss': 'mse', 'optimizer': 'adam', 'graph_mode': 'off', 'use_snp_selection': False}. Best is trial 11 with value: 0.1465910463303249.
[I 2025-11-03 12:17:41,801] Trial 85 finished with value: 0.07721073818024332 and parameters: {'model_type': 'gcn', 'hidden_dims': '[512, 256]', 'dropout': 0.279963086742521, 'batch_norm': False, 'lr': 0.00035987795534715375, 'weight_decay': 1.4546402402346697e-06, 'epochs': 200, 'loss': 'mse', 'optimizer': 'adam', 'graph_mode': 'off', 'use_snp_selection': False}. Best is trial 11 with value: 0.1465910463303249.
[I 2025-11-03 12:17:43,210] Trial 86 finished with value: 0.09711116978586169 and parameters: {'model_type': 'gcn', 'hidden_dims': '[512, 128]', 'dropout': 0.42291158971097975, 'batch_norm': True, 'lr': 0.00029099651126861795, 'weight_decay': 1.856778076651925e-07, 'epochs': 131, 'loss': 'mse', 'optimizer': 'adam', 'graph_mode': 'off', 'use_snp_selection': False}. Best is trial 11 with value: 0.1465910463303249.
[I 2025-11-03 12:17:45,043] Trial 87 finished with value: 0.12243052874570487 and parameters: {'model_type': 'gcn', 'hidden_dims': '[512, 64]', 'dropout': 0.3650386933084157, 'batch_norm': True, 'lr': 0.0001449525215850465, 'weight_decay': 1.2562901294481478e-07, 'epochs': 114, 'loss': 'mse', 'optimizer': 'adam', 'graph_mode': 'off', 'use_snp_selection': True, 'num_snps': 43141}. Best is trial 11 with value: 0.1465910463303249.
