[I 2025-11-03 15:03:25,929] Trial 74 finished with value: 0.0811315533620764 and parameters: {'model_type': 'graphsage', 'hidden_dims': '[512, 64]', 'dropout': 0.175551571662561, 'batch_norm': True, 'lr': 0.0003515955515717893, 'weight_decay': 5.208563516959466e-07, 'epochs': 320, 'loss': 'mse', 'optimizer': 'adam', 'graph_mode': 'cutoff', 'cutoff': 0.8541939311945281, 'grm_norm': 'cosine_then_gcn', 'self_loops': True, 'use_snp_selection': False}. Best is trial 20 with value: 0.10068966775143183.
[I 2025-11-03 15:03:30,310] Trial 75 finished with value: 0.07653328625834668 and parameters: {'model_type': 'graphsage', 'hidden_dims': '[512, 64]', 'dropout': 0.3053776319504618, 'batch_norm': True, 'lr': 0.0006377921620070715, 'weight_decay': 7.148174959633651e-06, 'epochs': 291, 'loss': 'mse', 'optimizer': 'adam', 'graph_mode': 'cutoff', 'cutoff': 0.8743114434733532, 'grm_norm': 'cosine_then_gcn', 'self_loops': True, 'use_snp_selection': False}. Best is trial 20 with value: 0.10068966775143183.
[I 2025-11-03 15:03:34,495] Trial 76 finished with value: 0.08433557631366856 and parameters: {'model_type': 'graphsage', 'hidden_dims': '[512, 64]', 'dropout': 0.2793481386252626, 'batch_norm': True, 'lr': 0.00011556474250558124, 'weight_decay': 1.1010574950656374e-06, 'epochs': 266, 'loss': 'mae', 'optimizer': 'adam', 'graph_mode': 'cutoff', 'cutoff': 0.8055698806269315, 'grm_norm': 'cosine', 'self_loops': True, 'use_snp_selection': False}. Best is trial 20 with value: 0.10068966775143183.
[I 2025-11-03 15:03:36,403] Trial 77 finished with value: 0.0398872834843513 and parameters: {'model_type': 'graphsage', 'hidden_dims': '[128, 64]', 'dropout': 0.4932034158049379, 'batch_norm': False, 'lr': 0.0008047901733116438, 'weight_decay': 5.313288998509552e-05, 'epochs': 239, 'loss': 'mse', 'optimizer': 'adam', 'graph_mode': 'cutoff', 'cutoff': 0.5054752067283694, 'grm_norm': 'cosine_then_gcn', 'self_loops': True, 'use_snp_selection': True, 'num_snps': 5844}. Best is trial 20 with value: 0.10068966775143183.
[I 2025-11-03 15:03:40,247] Trial 78 finished with value: 0.08833163830733073 and parameters: {'model_type': 'graphsage', 'hidden_dims': '[512, 128]', 'dropout': 0.21004261338425137, 'batch_norm': True, 'lr': 0.00018401312813214288, 'weight_decay': 4.251457336682525e-06, 'epochs': 227, 'loss': 'mse', 'optimizer': 'adam', 'graph_mode': 'cutoff', 'cutoff': 0.7817582064612209, 'grm_norm': 'none', 'self_loops': True, 'use_snp_selection': False}. Best is trial 20 with value: 0.10068966775143183.
[I 2025-11-03 15:03:42,976] Trial 79 finished with value: 0.07614404883241033 and parameters: {'model_type': 'graphsage', 'hidden_dims': '[256, 128, 64]', 'dropout': 0.12199266803598655, 'batch_norm': True, 'lr': 0.0002466597331074939, 'weight_decay': 1.8591664835489396e-06, 'epochs': 256, 'loss': 'mse', 'optimizer': 'adam', 'graph_mode': 'cutoff', 'cutoff': 0.838861880536631, 'grm_norm': 'cosine_then_gcn', 'self_loops': True, 'use_snp_selection': False}. Best is trial 20 with value: 0.10068966775143183.
[I 2025-11-03 15:03:46,782] Trial 80 finished with value: 0.07313526292237188 and parameters: {'model_type': 'graphsage', 'hidden_dims': '[512, 64]', 'dropout': 0.2334282711125212, 'batch_norm': True, 'lr': 0.000540683877235526, 'weight_decay': 3.661495709194574e-07, 'epochs': 214, 'loss': 'mse', 'optimizer': 'adam', 'graph_mode': 'cutoff', 'cutoff': 0.44979462646213847, 'grm_norm': 'gcn', 'self_loops': True, 'use_snp_selection': False}. Best is trial 20 with value: 0.10068966775143183.
[I 2025-11-03 15:03:49,834] Trial 81 finished with value: 0.06987500895647668 and parameters: {'model_type': 'graphsage', 'hidden_dims': '[256, 128]', 'dropout': 0.19130462777127366, 'batch_norm': True, 'lr': 0.0009675318499090208, 'weight_decay': 5.638750974299274e-07, 'epochs': 310, 'loss': 'mse', 'optimizer': 'adam', 'graph_mode': 'knn', 'source': 'grm', 'knn_k': 6, 'weighted_edges': False, 'symmetrize_mode': 'mutual', 'use_snp_selection': False}. Best is trial 20 with value: 0.10068966775143183.
[I 2025-11-03 15:03:52,705] Trial 82 finished with value: 0.08404320721902146 and parameters: {'model_type': 'graphsage', 'hidden_dims': '[256, 128]', 'dropout': 0.3665980087399676, 'batch_norm': True, 'lr': 0.00044069255769105584, 'weight_decay': 7.106743440665776e-07, 'epochs': 208, 'loss': 'mse', 'optimizer': 'adam', 'graph_mode': 'knn', 'source': 'grm', 'knn_k': 8, 'weighted_edges': True, 'symmetrize_mode': 'union', 'use_snp_selection': False}. Best is trial 20 with value: 0.10068966775143183.
[I 2025-11-03 15:03:57,016] Trial 83 finished with value: 0.08170318974616 and parameters: {'model_type': 'graphsage', 'hidden_dims': '[512, 64]', 'dropout': 0.15705042885108952, 'batch_norm': True, 'lr': 0.000671689564804052, 'weight_decay': 9.265793204105817e-07, 'epochs': 249, 'loss': 'mse', 'optimizer': 'adam', 'graph_mode': 'knn', 'source': 'grm', 'knn_k': 4, 'weighted_edges': True, 'symmetrize_mode': 'union', 'use_snp_selection': False}. Best is trial 20 with value: 0.10068966775143183.
[I 2025-11-03 15:04:01,470] Trial 84 finished with value: 0.08769933608257124 and parameters: {'model_type': 'graphsage', 'hidden_dims': '[512, 64]', 'dropout': 0.26140445375261956, 'batch_norm': True, 'lr': 0.0008187037786249026, 'weight_decay': 2.940772584407069e-05, 'epochs': 297, 'loss': 'mse', 'optimizer': 'adam', 'graph_mode': 'cutoff', 'cutoff': 0.41149644883563535, 'grm_norm': 'cosine_then_gcn', 'self_loops': False, 'use_snp_selection': False}. Best is trial 20 with value: 0.10068966775143183.
[I 2025-11-03 15:04:04,137] Trial 85 finished with value: 0.08042781603365026 and parameters: {'model_type': 'graphsage', 'hidden_dims': '[256, 128]', 'dropout': 0.24859109926382866, 'batch_norm': True, 'lr': 0.0005517490865205652, 'weight_decay': 2.565555234050243e-07, 'epochs': 276, 'loss': 'mse', 'optimizer': 'adam', 'graph_mode': 'cutoff', 'cutoff': 0.8789762043903501, 'grm_norm': 'cosine_then_gcn', 'self_loops': True, 'use_snp_selection': False}. Best is trial 20 with value: 0.10068966775143183.
[I 2025-11-03 15:04:08,183] Trial 86 finished with value: 0.07043042719661617 and parameters: {'model_type': 'graphsage', 'hidden_dims': '[512, 256]', 'dropout': 0.3325415697637234, 'batch_norm': True, 'lr': 0.00032709706317387085, 'weight_decay': 1.5181940017038455e-06, 'epochs': 237, 'loss': 'mse', 'optimizer': 'adam', 'graph_mode': 'knn', 'source': 'grm', 'knn_k': 2, 'weighted_edges': False, 'symmetrize_mode': 'mutual', 'use_snp_selection': False}. Best is trial 20 with value: 0.10068966775143183.
[I 2025-11-03 15:04:11,269] Trial 87 finished with value: 0.07653260073744622 and parameters: {'model_type': 'graphsage', 'hidden_dims': '[512, 64]', 'dropout': 0.18588579616649595, 'batch_norm': True, 'lr': 0.0009329027504743273, 'weight_decay': 2.679957417308117e-06, 'epochs': 128, 'loss': 'mse', 'optimizer': 'adam', 'graph_mode': 'cutoff', 'cutoff': 0.898173376859023, 'grm_norm': 'cosine_then_gcn', 'self_loops': True, 'use_snp_selection': False}. Best is trial 20 with value: 0.10068966775143183.
[I 2025-11-03 15:04:14,476] Trial 88 finished with value: 0.07016088650017986 and parameters: {'model_type': 'graphsage', 'hidden_dims': '[128, 64]', 'dropout': 0.23055840284953993, 'batch_norm': False, 'lr': 0.000668935173356796, 'weight_decay': 4.2633459682837506e-07, 'epochs': 163, 'loss': 'mae', 'optimizer': 'adam', 'graph_mode': 'cutoff', 'cutoff': 0.8159686249045481, 'grm_norm': 'gcn', 'self_loops': True, 'use_snp_selection': True, 'num_snps': 50231}. Best is trial 20 with value: 0.10068966775143183.
[I 2025-11-03 15:04:16,913] Trial 89 finished with value: 0.0858706841118617 and parameters: {'model_type': 'graphsage', 'hidden_dims': '[256, 128, 64]', 'dropout': 0.17101356086589314, 'batch_norm': True, 'lr': 0.0004514378342356584, 'weight_decay': 5.107762779725393e-05, 'epochs': 191, 'loss': 'mse', 'optimizer': 'adam', 'graph_mode': 'cutoff', 'cutoff': 0.7356603274023581, 'grm_norm': 'cosine', 'self_loops': False, 'use_snp_selection': False}. Best is trial 20 with value: 0.10068966775143183.
[I 2025-11-03 15:04:20,514] Trial 90 finished with value: 0.07029780690506097 and parameters: {'model_type': 'graphsage', 'hidden_dims': '[512, 128]', 'dropout': 0.13180388165220308, 'batch_norm': True, 'lr': 0.0009946704146081323, 'weight_decay': 1.3008776642445489e-05, 'epochs': 143, 'loss': 'mse', 'optimizer': 'adam', 'graph_mode': 'knn', 'source': 'grm', 'knn_k': 7, 'weighted_edges': True, 'symmetrize_mode': 'union', 'use_snp_selection': False}. Best is trial 20 with value: 0.10068966775143183.
[I 2025-11-03 15:04:24,372] Trial 91 finished with value: 0.07463627351507113 and parameters: {'model_type': 'graphsage', 'hidden_dims': '[512, 64]', 'dropout': 0.15797033464455684, 'batch_norm': True, 'lr': 0.0005657228191244213, 'weight_decay': 6.353557734698179e-06, 'epochs': 226, 'loss': 'mse', 'optimizer': 'adam', 'graph_mode': 'cutoff', 'cutoff': 0.8484091854712454, 'grm_norm': 'cosine_then_gcn', 'self_loops': True, 'use_snp_selection': False}. Best is trial 20 with value: 0.10068966775143183.
[I 2025-11-03 15:04:28,396] Trial 92 finished with value: 0.07755568099928146 and parameters: {'model_type': 'graphsage', 'hidden_dims': '[512, 64]', 'dropout': 0.19887006233281074, 'batch_norm': True, 'lr': 0.000694289998417837, 'weight_decay': 9.004968511728894e-07, 'epochs': 239, 'loss': 'mse', 'optimizer': 'adam', 'graph_mode': 'cutoff', 'cutoff': 0.8146495235498302, 'grm_norm': 'cosine_then_gcn', 'self_loops': True, 'use_snp_selection': False}. Best is trial 20 with value: 0.10068966775143183.
[I 2025-11-03 15:04:32,611] Trial 93 finished with value: 0.08728654759474232 and parameters: {'model_type': 'graphsage', 'hidden_dims': '[512, 64]', 'dropout': 0.21211071616099092, 'batch_norm': True, 'lr': 0.0007768767736175867, 'weight_decay': 7.5764814096717505e-06, 'epochs': 263, 'loss': 'mse', 'optimizer': 'adam', 'graph_mode': 'cutoff', 'cutoff': 0.8667135435889151, 'grm_norm': 'cosine_then_gcn', 'self_loops': True, 'use_snp_selection': False}. Best is trial 20 with value: 0.10068966775143183.
[I 2025-11-03 15:04:35,606] Trial 94 finished with value: 0.07261440711514819 and parameters: {'model_type': 'graphsage', 'hidden_dims': '[512, 64]', 'dropout': 0.14305276072094672, 'batch_norm': True, 'lr': 0.0004024361904529573, 'weight_decay': 4.0871396229533e-06, 'epochs': 111, 'loss': 'mse', 'optimizer': 'adam', 'graph_mode': 'cutoff', 'cutoff': 0.8417028430929919, 'grm_norm': 'cosine_then_gcn', 'self_loops': True, 'use_snp_selection': False}. Best is trial 20 with value: 0.10068966775143183.
[I 2025-11-03 15:04:39,425] Trial 95 finished with value: 0.09033748766914369 and parameters: {'model_type': 'graphsage', 'hidden_dims': '[512, 64]', 'dropout': 0.17650854194116464, 'batch_norm': True, 'lr': 0.0005819268881699955, 'weight_decay': 6.191086601378163e-07, 'epochs': 216, 'loss': 'mse', 'optimizer': 'adam', 'graph_mode': 'cutoff', 'cutoff': 0.7903348955543533, 'grm_norm': 'cosine_then_gcn', 'self_loops': True, 'use_snp_selection': False}. Best is trial 20 with value: 0.10068966775143183.
[I 2025-11-03 15:04:42,907] Trial 96 finished with value: 0.05591735549454159 and parameters: {'model_type': 'graphsage', 'hidden_dims': '[512, 64]', 'dropout': 0.1777276446083804, 'batch_norm': True, 'lr': 7.755764712953633e-06, 'weight_decay': 1.2911104953370976e-06, 'epochs': 175, 'loss': 'mse', 'optimizer': 'adam', 'graph_mode': 'cutoff', 'cutoff': 0.8799398079311809, 'grm_norm': 'gcn', 'self_loops': True, 'use_snp_selection': False}. Best is trial 20 with value: 0.10068966775143183.
[I 2025-11-03 15:04:45,339] Trial 97 finished with value: 0.07948788736334358 and parameters: {'model_type': 'graphsage', 'hidden_dims': '[256, 128]', 'dropout': 0.3162949665182451, 'batch_norm': True, 'lr': 0.00021907271301780084, 'weight_decay': 5.257926079730759e-07, 'epochs': 216, 'loss': 'mse', 'optimizer': 'adam', 'graph_mode': 'cutoff', 'cutoff': 0.6268948561089989, 'grm_norm': 'cosine_then_gcn', 'self_loops': False, 'use_snp_selection': False}. Best is trial 20 with value: 0.10068966775143183.
[I 2025-11-03 15:04:49,045] Trial 98 finished with value: 0.07745728501210629 and parameters: {'model_type': 'graphsage', 'hidden_dims': '[512, 64]', 'dropout': 0.27900090512741155, 'batch_norm': True, 'lr': 0.0004722949410909136, 'weight_decay': 6.551674858213649e-07, 'epochs': 204, 'loss': 'mse', 'optimizer': 'adam', 'graph_mode': 'cutoff', 'cutoff': 0.6580209649470061, 'grm_norm': 'none', 'self_loops': True, 'use_snp_selection': False}. Best is trial 20 with value: 0.10068966775143183.
[I 2025-11-03 15:04:50,926] Trial 99 finished with value: 0.06512999725658504 and parameters: {'model_type': 'graphsage', 'hidden_dims': '[256, 128, 64]', 'dropout': 0.1952410453910256, 'batch_norm': True, 'lr': 0.000849429247302385, 'weight_decay': 3.4891628960405235e-07, 'epochs': 76, 'loss': 'mse', 'optimizer': 'adam', 'graph_mode': 'cutoff', 'cutoff': 0.789512581491127, 'grm_norm': 'cosine_then_gcn', 'self_loops': True, 'use_snp_selection': False}. Best is trial 20 with value: 0.10068966775143183.
[I 2025-11-03 15:04:54,609] Trial 100 finished with value: 0.08984130020969659 and parameters: {'model_type': 'graphsage', 'hidden_dims': '[512, 64]', 'dropout': 0.3618311411244409, 'batch_norm': True, 'lr': 0.00026829117548391823, 'weight_decay': 1.5831104173509096e-07, 'epochs': 200, 'loss': 'mse', 'optimizer': 'adam', 'graph_mode': 'cutoff', 'cutoff': 0.8596828115543873, 'grm_norm': 'gcn', 'self_loops': True, 'use_snp_selection': False}. Best is trial 20 with value: 0.10068966775143183.
[I 2025-11-03 15:04:58,537] Trial 101 finished with value: 0.0804113445750966 and parameters: {'model_type': 'graphsage', 'hidden_dims': '[512, 64]', 'dropout': 0.364519413787111, 'batch_norm': True, 'lr': 0.0002709081318485974, 'weight_decay': 1.5391237302697076e-07, 'epochs': 231, 'loss': 'mse', 'optimizer': 'adam', 'graph_mode': 'cutoff', 'cutoff': 0.855012980120615, 'grm_norm': 'gcn', 'self_loops': True, 'use_snp_selection': False}. Best is trial 20 with value: 0.10068966775143183.
[I 2025-11-03 15:05:02,208] Trial 102 finished with value: 0.09444328323126162 and parameters: {'model_type': 'graphsage', 'hidden_dims': '[512, 64]', 'dropout': 0.34877711228661934, 'batch_norm': True, 'lr': 0.00035282852319024847, 'weight_decay': 1.9178536396628961e-07, 'epochs': 201, 'loss': 'mse', 'optimizer': 'adam', 'graph_mode': 'cutoff', 'cutoff': 0.8304259525299317, 'grm_norm': 'gcn', 'self_loops': True, 'use_snp_selection': False}. Best is trial 20 with value: 0.10068966775143183.
[I 2025-11-03 15:05:05,973] Trial 103 finished with value: 0.07769605118243235 and parameters: {'model_type': 'graphsage', 'hidden_dims': '[512, 64]', 'dropout': 0.29908093514708756, 'batch_norm': True, 'lr': 0.00028668561273101297, 'weight_decay': 1.335249299277889e-07, 'epochs': 210, 'loss': 'mse', 'optimizer': 'adam', 'graph_mode': 'cutoff', 'cutoff': 0.8784945475602777, 'grm_norm': 'gcn', 'self_loops': True, 'use_snp_selection': False}. Best is trial 20 with value: 0.10068966775143183.
[I 2025-11-03 15:05:09,615] Trial 104 finished with value: 0.08508612096106222 and parameters: {'model_type': 'graphsage', 'hidden_dims': '[512, 64]', 'dropout': 0.416279515699012, 'batch_norm': True, 'lr': 0.0003496698453092264, 'weight_decay': 2.1399453248631243e-07, 'epochs': 198, 'loss': 'mse', 'optimizer': 'adam', 'graph_mode': 'cutoff', 'cutoff': 0.8351718340455943, 'grm_norm': 'gcn', 'self_loops': True, 'use_snp_selection': False}. Best is trial 20 with value: 0.10068966775143183.
[I 2025-11-03 15:05:13,451] Trial 105 finished with value: 0.07943863656725542 and parameters: {'model_type': 'graphsage', 'hidden_dims': '[512, 64]', 'dropout': 0.3843888425208495, 'batch_norm': True, 'lr': 0.00017401367137187746, 'weight_decay': 1.763680117840092e-07, 'epochs': 222, 'loss': 'mse', 'optimizer': 'adam', 'graph_mode': 'cutoff', 'cutoff': 0.8574584670515546, 'grm_norm': 'gcn', 'self_loops': True, 'use_snp_selection': False}. Best is trial 20 with value: 0.10068966775143183.
[I 2025-11-03 15:05:17,024] Trial 106 finished with value: 0.07187460151037325 and parameters: {'model_type': 'graphsage', 'hidden_dims': '[512, 64]', 'dropout': 0.3572802878004605, 'batch_norm': True, 'lr': 0.00021585344951833603, 'weight_decay': 2.747520783098214e-07, 'epochs': 188, 'loss': 'mae', 'optimizer': 'adam', 'graph_mode': 'cutoff', 'cutoff': 0.8288191107321997, 'grm_norm': 'gcn', 'self_loops': True, 'use_snp_selection': False}. Best is trial 20 with value: 0.10068966775143183.
[I 2025-11-03 15:05:20,635] Trial 107 finished with value: 0.07476964800965573 and parameters: {'model_type': 'graphsage', 'hidden_dims': '[512, 64]', 'dropout': 0.4049993142501501, 'batch_norm': False, 'lr': 0.00013680245338653288, 'weight_decay': 2.3324578893751962e-07, 'epochs': 177, 'loss': 'mse', 'optimizer': 'adam', 'graph_mode': 'cutoff', 'cutoff': 0.7703276517963468, 'grm_norm': 'gcn', 'self_loops': True, 'use_snp_selection': True, 'num_snps': 37397}. Best is trial 20 with value: 0.10068966775143183.
[I 2025-11-03 15:05:24,265] Trial 108 finished with value: 0.08008843649070403 and parameters: {'model_type': 'graphsage', 'hidden_dims': '[512, 64]', 'dropout': 0.34340144674929707, 'batch_norm': True, 'lr': 0.0003980705770887385, 'weight_decay': 1.1753821108718981e-07, 'epochs': 195, 'loss': 'mse', 'optimizer': 'adam', 'graph_mode': 'cutoff', 'cutoff': 0.8890834305016334, 'grm_norm': 'gcn', 'self_loops': True, 'use_snp_selection': False}. Best is trial 20 with value: 0.10068966775143183.
[I 2025-11-03 15:05:28,012] Trial 109 finished with value: 0.08455754924419105 and parameters: {'model_type': 'graphsage', 'hidden_dims': '[512, 64]', 'dropout': 0.3249922077338318, 'batch_norm': True, 'lr': 0.0003163061292359255, 'weight_decay': 2.0440912707498556e-05, 'epochs': 201, 'loss': 'mse', 'optimizer': 'adam', 'graph_mode': 'cutoff', 'cutoff': 0.5004953896911574, 'grm_norm': 'gcn', 'self_loops': True, 'use_snp_selection': False}. Best is trial 20 with value: 0.10068966775143183.
[I 2025-11-03 15:05:31,866] Trial 110 finished with value: 0.08281141213849265 and parameters: {'model_type': 'graphsage', 'hidden_dims': '[512, 128]', 'dropout': 0.40077498418732405, 'batch_norm': True, 'lr': 0.0005942886024133664, 'weight_decay': 3.973705709926481e-07, 'epochs': 218, 'loss': 'mse', 'optimizer': 'adam', 'graph_mode': 'cutoff', 'cutoff': 0.7934938381508047, 'grm_norm': 'cosine_then_gcn', 'self_loops': False, 'use_snp_selection': False}. Best is trial 20 with value: 0.10068966775143183.
[I 2025-11-03 15:05:35,950] Trial 111 finished with value: 0.09036784816341387 and parameters: {'model_type': 'graphsage', 'hidden_dims': '[512, 64]', 'dropout': 0.18113802994595837, 'batch_norm': True, 'lr': 0.0007299258981601689, 'weight_decay': 7.84925953879838e-07, 'epochs': 250, 'loss': 'mse', 'optimizer': 'adam', 'graph_mode': 'cutoff', 'cutoff': 0.5439420386323475, 'grm_norm': 'none', 'self_loops': True, 'use_snp_selection': False}. Best is trial 20 with value: 0.10068966775143183.
[I 2025-11-03 15:05:40,020] Trial 112 finished with value: 0.06682974350696988 and parameters: {'model_type': 'graphsage', 'hidden_dims': '[512, 64]', 'dropout': 0.16646181925270354, 'batch_norm': True, 'lr': 0.0005045402848510681, 'weight_decay': 3.276306950893761e-07, 'epochs': 249, 'loss': 'mse', 'optimizer': 'adam', 'graph_mode': 'cutoff', 'cutoff': 0.5232756618750677, 'grm_norm': 'none', 'self_loops': True, 'use_snp_selection': False}. Best is trial 20 with value: 0.10068966775143183.
[I 2025-11-03 15:05:43,920] Trial 113 finished with value: 0.0945118392608531 and parameters: {'model_type': 'graphsage', 'hidden_dims': '[512, 64]', 'dropout': 0.11324016234743897, 'batch_norm': True, 'lr': 0.0007211360877710935, 'weight_decay': 1.0679173691187366e-06, 'epochs': 230, 'loss': 'mse', 'optimizer': 'adam', 'graph_mode': 'cutoff', 'cutoff': 0.5468018085082889, 'grm_norm': 'none', 'self_loops': True, 'use_snp_selection': False}. Best is trial 20 with value: 0.10068966775143183.
[I 2025-11-03 15:05:47,854] Trial 114 finished with value: 0.09120984095246477 and parameters: {'model_type': 'graphsage', 'hidden_dims': '[512, 64]', 'dropout': 0.10742772270959475, 'batch_norm': True, 'lr': 0.0007390809259060802, 'weight_decay': 1.0878684307311394e-06, 'epochs': 231, 'loss': 'mse', 'optimizer': 'adam', 'graph_mode': 'cutoff', 'cutoff': 0.578188829300029, 'grm_norm': 'none', 'self_loops': True, 'use_snp_selection': False}. Best is trial 20 with value: 0.10068966775143183.
[I 2025-11-03 15:05:51,759] Trial 115 finished with value: 0.10532585301183989 and parameters: {'model_type': 'graphsage', 'hidden_dims': '[512, 64]', 'dropout': 0.10662561305281652, 'batch_norm': True, 'lr': 0.0007341956148810597, 'weight_decay': 8.332221115810149e-07, 'epochs': 231, 'loss': 'mse', 'optimizer': 'adam', 'graph_mode': 'cutoff', 'cutoff': 0.5748157712857764, 'grm_norm': 'none', 'self_loops': True, 'use_snp_selection': False}. Best is trial 115 with value: 0.10532585301183989.
[I 2025-11-03 15:05:55,707] Trial 116 finished with value: 0.08717510299562023 and parameters: {'model_type': 'graphsage', 'hidden_dims': '[512, 256]', 'dropout': 0.11553388088906338, 'batch_norm': True, 'lr': 0.0007421363521043798, 'weight_decay': 8.388860070208751e-07, 'epochs': 231, 'loss': 'mse', 'optimizer': 'adam', 'graph_mode': 'cutoff', 'cutoff': 0.5515027039696823, 'grm_norm': 'none', 'self_loops': True, 'use_snp_selection': False}. Best is trial 115 with value: 0.10532585301183989.
