[I 2025-11-13 06:28:14,089] Trial 52 finished with value: 0.29835353192792013 and parameters: {'model_type': 'graphsage', 'hidden_dims': '[512, 128]', 'dropout': 0.5776911461938228, 'batch_norm': True, 'lr': 0.00036944246202028037, 'weight_decay': 4.271935473757056e-05, 'epochs': 94, 'loss': 'mae', 'optimizer': 'adam', 'graph_mode': 'cutoff', 'cutoff': 0.33574514640218805, 'grm_norm': 'none', 'self_loops': True, 'use_snp_selection': False}. Best is trial 23 with value: 0.3049833692233162.
[I 2025-11-13 06:29:13,470] Trial 53 finished with value: 0.29329927987860355 and parameters: {'model_type': 'graphsage', 'hidden_dims': '[256, 128]', 'dropout': 0.5458834039515763, 'batch_norm': True, 'lr': 0.0009912527422612889, 'weight_decay': 2.453441103157535e-07, 'epochs': 66, 'loss': 'mae', 'optimizer': 'adam', 'graph_mode': 'cutoff', 'cutoff': 0.2696923925645986, 'grm_norm': 'none', 'self_loops': True, 'use_snp_selection': False}. Best is trial 23 with value: 0.3049833692233162.
[I 2025-11-13 06:30:39,513] Trial 54 finished with value: 0.2978824996811358 and parameters: {'model_type': 'graphsage', 'hidden_dims': '[512, 128]', 'dropout': 0.5026019747172371, 'batch_norm': True, 'lr': 0.0005553051823248353, 'weight_decay': 1.5426290756455158e-07, 'epochs': 83, 'loss': 'mse', 'optimizer': 'adam', 'graph_mode': 'cutoff', 'cutoff': 0.3303852931825942, 'grm_norm': 'none', 'self_loops': False, 'use_snp_selection': False}. Best is trial 23 with value: 0.3049833692233162.
[I 2025-11-13 06:31:30,209] Trial 55 finished with value: 0.26428436450574133 and parameters: {'model_type': 'graphsage', 'hidden_dims': '[512, 128]', 'dropout': 0.5955956585576757, 'batch_norm': True, 'lr': 5.2817435275367825e-05, 'weight_decay': 3.6653373382208314e-07, 'epochs': 40, 'loss': 'mae', 'optimizer': 'adam', 'graph_mode': 'cutoff', 'cutoff': 0.4608144464226572, 'grm_norm': 'cosine_then_gcn', 'self_loops': True, 'use_snp_selection': False}. Best is trial 23 with value: 0.3049833692233162.
[I 2025-11-13 06:32:38,315] Trial 56 finished with value: 0.29464648800797033 and parameters: {'model_type': 'graphsage', 'hidden_dims': '[512, 128]', 'dropout': 0.3305999632644836, 'batch_norm': True, 'lr': 0.0003023983662137319, 'weight_decay': 1.0096424637546006e-07, 'epochs': 53, 'loss': 'mae', 'optimizer': 'adam', 'graph_mode': 'cutoff', 'cutoff': 0.2809834966145372, 'grm_norm': 'none', 'self_loops': True, 'use_snp_selection': False}. Best is trial 23 with value: 0.3049833692233162.
[I 2025-11-13 06:33:28,376] Trial 57 finished with value: 0.25523325366787336 and parameters: {'model_type': 'graphsage', 'hidden_dims': '[256, 128, 64]', 'dropout': 0.5321190191921942, 'batch_norm': True, 'lr': 0.00018919864524958685, 'weight_decay': 1.0116962000269902e-06, 'epochs': 125, 'loss': 'mae', 'optimizer': 'adam', 'graph_mode': 'knn', 'source': 'grm', 'knn_k': 10, 'weighted_edges': False, 'symmetrize_mode': 'mutual', 'use_snp_selection': True, 'num_snps': 2839}. Best is trial 23 with value: 0.3049833692233162.
[I 2025-11-13 06:35:03,496] Trial 58 finished with value: 0.2754376715845961 and parameters: {'model_type': 'graphsage', 'hidden_dims': '[512, 256]', 'dropout': 0.4799714818586641, 'batch_norm': False, 'lr': 2.37826732803143e-05, 'weight_decay': 2.5998244079177778e-06, 'epochs': 103, 'loss': 'mse', 'optimizer': 'adam', 'graph_mode': 'cutoff', 'cutoff': 0.3803629627042716, 'grm_norm': 'none', 'self_loops': True, 'use_snp_selection': False}. Best is trial 23 with value: 0.3049833692233162.
[I 2025-11-13 06:36:18,621] Trial 59 finished with value: 0.30221318639314776 and parameters: {'model_type': 'graphsage', 'hidden_dims': '[512, 128]', 'dropout': 0.434380681854168, 'batch_norm': True, 'lr': 0.00010645593280987998, 'weight_decay': 6.872309661429998e-07, 'epochs': 74, 'loss': 'mae', 'optimizer': 'adam', 'graph_mode': 'cutoff', 'cutoff': 0.4044124734218019, 'grm_norm': 'cosine', 'self_loops': False, 'use_snp_selection': False}. Best is trial 23 with value: 0.3049833692233162.
[I 2025-11-13 06:36:49,692] Trial 60 finished with value: 0.2881533193929161 and parameters: {'model_type': 'graphsage', 'hidden_dims': '[128, 64]', 'dropout': 0.4106038279749708, 'batch_norm': True, 'lr': 9.686853184218297e-05, 'weight_decay': 8.077093194117125e-07, 'epochs': 63, 'loss': 'mae', 'optimizer': 'adam', 'graph_mode': 'knn', 'source': 'grm', 'knn_k': 3, 'weighted_edges': False, 'symmetrize_mode': 'mutual', 'use_snp_selection': False}. Best is trial 23 with value: 0.3049833692233162.
[I 2025-11-13 06:38:05,073] Trial 61 finished with value: 0.2962858624979169 and parameters: {'model_type': 'graphsage', 'hidden_dims': '[512, 128]', 'dropout': 0.5751547445192978, 'batch_norm': True, 'lr': 0.0004013726670034059, 'weight_decay': 2.924927212615513e-07, 'epochs': 75, 'loss': 'mae', 'optimizer': 'adam', 'graph_mode': 'cutoff', 'cutoff': 0.4105355207382083, 'grm_norm': 'cosine', 'self_loops': False, 'use_snp_selection': False}. Best is trial 23 with value: 0.3049833692233162.
[I 2025-11-13 06:39:32,861] Trial 62 finished with value: 0.2915763804294885 and parameters: {'model_type': 'graphsage', 'hidden_dims': '[512, 128]', 'dropout': 0.5527852797238868, 'batch_norm': True, 'lr': 0.000773363842820901, 'weight_decay': 6.644465637656586e-07, 'epochs': 90, 'loss': 'mae', 'optimizer': 'adam', 'graph_mode': 'cutoff', 'cutoff': 0.35999825591776724, 'grm_norm': 'cosine', 'self_loops': False, 'use_snp_selection': False}. Best is trial 23 with value: 0.3049833692233162.
[I 2025-11-13 06:40:23,632] Trial 63 finished with value: 0.29061920013965387 and parameters: {'model_type': 'graphsage', 'hidden_dims': '[512, 128]', 'dropout': 0.44275557700915114, 'batch_norm': True, 'lr': 0.00029236056243732845, 'weight_decay': 2.111692607429874e-07, 'epochs': 48, 'loss': 'mae', 'optimizer': 'adam', 'graph_mode': 'cutoff', 'cutoff': 0.8384012185018337, 'grm_norm': 'cosine', 'self_loops': False, 'use_snp_selection': False}. Best is trial 23 with value: 0.3049833692233162.
[I 2025-11-13 06:41:36,754] Trial 64 finished with value: 0.2908489644303528 and parameters: {'model_type': 'graphsage', 'hidden_dims': '[512, 128]', 'dropout': 0.5137466198296219, 'batch_norm': True, 'lr': 0.0001101770774681672, 'weight_decay': 1.4442681131478402e-07, 'epochs': 73, 'loss': 'mae', 'optimizer': 'adam', 'graph_mode': 'cutoff', 'cutoff': 0.4482960797528387, 'grm_norm': 'cosine', 'self_loops': False, 'use_snp_selection': False}. Best is trial 23 with value: 0.3049833692233162.
[I 2025-11-13 06:42:59,257] Trial 65 finished with value: 0.2927380356930254 and parameters: {'model_type': 'graphsage', 'hidden_dims': '[512, 128]', 'dropout': 0.3854900899294931, 'batch_norm': True, 'lr': 0.0005186680126630492, 'weight_decay': 4.2569326444656607e-07, 'epochs': 85, 'loss': 'mae', 'optimizer': 'adam', 'graph_mode': 'cutoff', 'cutoff': 0.40648399049034245, 'grm_norm': 'cosine_then_gcn', 'self_loops': True, 'use_snp_selection': False}. Best is trial 23 with value: 0.3049833692233162.
[I 2025-11-13 06:44:08,830] Trial 66 finished with value: 0.2863231578973761 and parameters: {'model_type': 'graphsage', 'hidden_dims': '[512, 64]', 'dropout': 0.5791333003769786, 'batch_norm': True, 'lr': 0.00016035653534266376, 'weight_decay': 1.2142319579904438e-06, 'epochs': 64, 'loss': 'mae', 'optimizer': 'adam', 'graph_mode': 'cutoff', 'cutoff': 0.3456422803437992, 'grm_norm': 'cosine', 'self_loops': False, 'use_snp_selection': False}. Best is trial 23 with value: 0.3049833692233162.
[I 2025-11-13 06:48:19,765] Trial 67 finished with value: 0.27786266659317765 and parameters: {'model_type': 'graphsage', 'hidden_dims': '[512, 128]', 'dropout': 0.5422585706153943, 'batch_norm': True, 'lr': 6.99242171724821e-05, 'weight_decay': 2.4486567054510166e-07, 'epochs': 272, 'loss': 'mae', 'optimizer': 'adam', 'graph_mode': 'cutoff', 'cutoff': 0.29478131020226683, 'grm_norm': 'none', 'self_loops': True, 'use_snp_selection': False}. Best is trial 23 with value: 0.3049833692233162.
[I 2025-11-13 06:49:43,280] Trial 68 finished with value: 0.2691276128126364 and parameters: {'model_type': 'graphsage', 'hidden_dims': '[256, 128]', 'dropout': 0.5591020295042632, 'batch_norm': True, 'lr': 0.00021911113276718586, 'weight_decay': 7.267089328613958e-06, 'epochs': 99, 'loss': 'mae', 'optimizer': 'adam', 'graph_mode': 'knn', 'source': 'grm', 'knn_k': 7, 'weighted_edges': True, 'symmetrize_mode': 'union', 'use_snp_selection': False}. Best is trial 23 with value: 0.3049833692233162.
[I 2025-11-13 06:52:17,267] Trial 69 finished with value: 0.2827113399330282 and parameters: {'model_type': 'graphsage', 'hidden_dims': '[512, 128]', 'dropout': 0.4773243440981886, 'batch_norm': True, 'lr': 0.000710234165135217, 'weight_decay': 0.000917104021964243, 'epochs': 114, 'loss': 'mse', 'optimizer': 'adam', 'graph_mode': 'cutoff', 'cutoff': 0.2362689169974001, 'grm_norm': 'gcn', 'self_loops': True, 'use_snp_selection': False}. Best is trial 23 with value: 0.3049833692233162.
[I 2025-11-13 06:53:37,370] Trial 70 finished with value: 0.28161412754357323 and parameters: {'model_type': 'graphsage', 'hidden_dims': '[128, 64]', 'dropout': 0.5312238169584224, 'batch_norm': False, 'lr': 1.1746034379828302e-05, 'weight_decay': 1.272934217361076e-07, 'epochs': 192, 'loss': 'mae', 'optimizer': 'adam', 'graph_mode': 'cutoff', 'cutoff': 0.6063835797813953, 'grm_norm': 'none', 'self_loops': True, 'use_snp_selection': True, 'num_snps': 38298}. Best is trial 23 with value: 0.3049833692233162.
[I 2025-11-13 06:54:51,631] Trial 71 finished with value: 0.29456850509320476 and parameters: {'model_type': 'graphsage', 'hidden_dims': '[512, 128]', 'dropout': 0.5589829973323075, 'batch_norm': True, 'lr': 0.000998775189921264, 'weight_decay': 4.999765645712598e-07, 'epochs': 72, 'loss': 'mae', 'optimizer': 'adam', 'graph_mode': 'cutoff', 'cutoff': 0.36646475746661344, 'grm_norm': 'none', 'self_loops': True, 'use_snp_selection': False}. Best is trial 23 with value: 0.3049833692233162.
[I 2025-11-13 06:55:53,082] Trial 72 finished with value: 0.30120699774903786 and parameters: {'model_type': 'graphsage', 'hidden_dims': '[512, 128]', 'dropout': 0.5838535747951493, 'batch_norm': True, 'lr': 0.0008159659745068033, 'weight_decay': 2.0397785259425674e-07, 'epochs': 52, 'loss': 'mae', 'optimizer': 'adam', 'graph_mode': 'cutoff', 'cutoff': 0.33324172515620054, 'grm_norm': 'none', 'self_loops': True, 'use_snp_selection': False}. Best is trial 23 with value: 0.3049833692233162.
[I 2025-11-13 06:56:52,795] Trial 73 finished with value: 0.30679751240794156 and parameters: {'model_type': 'graphsage', 'hidden_dims': '[512, 128]', 'dropout': 0.5806485475093, 'batch_norm': True, 'lr': 0.0008283672444172409, 'weight_decay': 1.878741875310062e-07, 'epochs': 49, 'loss': 'mae', 'optimizer': 'adam', 'graph_mode': 'cutoff', 'cutoff': 0.32542872305492443, 'grm_norm': 'none', 'self_loops': True, 'use_snp_selection': False}. Best is trial 73 with value: 0.30679751240794156.
[I 2025-11-13 06:57:58,225] Trial 74 finished with value: 0.2921292881714654 and parameters: {'model_type': 'graphsage', 'hidden_dims': '[512, 128]', 'dropout': 0.5957817877388791, 'batch_norm': True, 'lr': 0.0005609602168897351, 'weight_decay': 3.5763978980555967e-07, 'epochs': 46, 'loss': 'mae', 'optimizer': 'adam', 'graph_mode': 'cutoff', 'cutoff': 0.2663824628112914, 'grm_norm': 'none', 'self_loops': True, 'use_snp_selection': False}. Best is trial 73 with value: 0.30679751240794156.
[I 2025-11-13 06:59:02,342] Trial 75 finished with value: 0.28731186736304914 and parameters: {'model_type': 'graphsage', 'hidden_dims': '[512, 128]', 'dropout': 0.4952130992192624, 'batch_norm': True, 'lr': 0.0003471731384117994, 'weight_decay': 1.9017840504869517e-07, 'epochs': 60, 'loss': 'mae', 'optimizer': 'adam', 'graph_mode': 'cutoff', 'cutoff': 0.4105685927487764, 'grm_norm': 'none', 'self_loops': True, 'use_snp_selection': False}. Best is trial 73 with value: 0.30679751240794156.
[I 2025-11-13 06:59:57,013] Trial 76 finished with value: 0.29515796747413325 and parameters: {'model_type': 'graphsage', 'hidden_dims': '[256, 128, 64]', 'dropout': 0.5620761273199391, 'batch_norm': True, 'lr': 0.0004257099195725174, 'weight_decay': 2.794375600635751e-07, 'epochs': 85, 'loss': 'mae', 'optimizer': 'adam', 'graph_mode': 'cutoff', 'cutoff': 0.4350972522875774, 'grm_norm': 'cosine', 'self_loops': True, 'use_snp_selection': False}. Best is trial 73 with value: 0.30679751240794156.
[I 2025-11-13 07:01:23,494] Trial 77 finished with value: 0.2920292142958257 and parameters: {'model_type': 'graphsage', 'hidden_dims': '[512, 128]', 'dropout': 0.5332697815083549, 'batch_norm': True, 'lr': 0.0006609835765152959, 'weight_decay': 6.429993521365523e-07, 'epochs': 79, 'loss': 'mae', 'optimizer': 'adam', 'graph_mode': 'knn', 'source': 'grm', 'knn_k': 9, 'weighted_edges': False, 'symmetrize_mode': 'mutual', 'use_snp_selection': False}. Best is trial 73 with value: 0.30679751240794156.
[I 2025-11-13 07:02:00,264] Trial 78 finished with value: 0.29423271186690314 and parameters: {'model_type': 'graphsage', 'hidden_dims': '[128, 64]', 'dropout': 0.5134121328567672, 'batch_norm': True, 'lr': 0.0008378562631138417, 'weight_decay': 1.385975523130614e-07, 'epochs': 60, 'loss': 'mae', 'optimizer': 'adam', 'graph_mode': 'cutoff', 'cutoff': 0.3184833680409608, 'grm_norm': 'none', 'self_loops': True, 'use_snp_selection': False}. Best is trial 73 with value: 0.30679751240794156.
[I 2025-11-13 07:02:49,370] Trial 79 finished with value: 0.2870424634025703 and parameters: {'model_type': 'graphsage', 'hidden_dims': '[512, 128]', 'dropout': 0.5857457493200637, 'batch_norm': True, 'lr': 0.00026568550503513653, 'weight_decay': 0.0002717671377340078, 'epochs': 41, 'loss': 'mae', 'optimizer': 'adam', 'graph_mode': 'cutoff', 'cutoff': 0.487037978725004, 'grm_norm': 'none', 'self_loops': True, 'use_snp_selection': False}. Best is trial 73 with value: 0.30679751240794156.
[I 2025-11-13 07:04:28,843] Trial 80 finished with value: 0.29452981813867235 and parameters: {'model_type': 'graphsage', 'hidden_dims': '[512, 256]', 'dropout': 0.31731354180719834, 'batch_norm': True, 'lr': 0.00046625218196372193, 'weight_decay': 3.7547282130082156e-07, 'epochs': 92, 'loss': 'mae', 'optimizer': 'adam', 'graph_mode': 'cutoff', 'cutoff': 0.2885450994182604, 'grm_norm': 'cosine_then_gcn', 'self_loops': True, 'use_snp_selection': False}. Best is trial 73 with value: 0.30679751240794156.
[I 2025-11-13 07:05:30,643] Trial 81 finished with value: 0.3032994043656304 and parameters: {'model_type': 'graphsage', 'hidden_dims': '[512, 128]', 'dropout': 0.5828208670372902, 'batch_norm': True, 'lr': 0.0008392580766809339, 'weight_decay': 1.9501477085114867e-07, 'epochs': 51, 'loss': 'mae', 'optimizer': 'adam', 'graph_mode': 'cutoff', 'cutoff': 0.34899648153932794, 'grm_norm': 'none', 'self_loops': True, 'use_snp_selection': False}. Best is trial 73 with value: 0.30679751240794156.
[I 2025-11-13 07:06:43,286] Trial 82 finished with value: 0.2962774529065842 and parameters: {'model_type': 'graphsage', 'hidden_dims': '[512, 128]', 'dropout': 0.5998675430291361, 'batch_norm': True, 'lr': 0.0005939901993264697, 'weight_decay': 1.7213288165851045e-07, 'epochs': 68, 'loss': 'mae', 'optimizer': 'adam', 'graph_mode': 'cutoff', 'cutoff': 0.35665781142039227, 'grm_norm': 'none', 'self_loops': True, 'use_snp_selection': False}. Best is trial 73 with value: 0.30679751240794156.
[I 2025-11-13 07:07:41,056] Trial 83 finished with value: 0.30473321862901526 and parameters: {'model_type': 'graphsage', 'hidden_dims': '[512, 128]', 'dropout': 0.5715961298379758, 'batch_norm': True, 'lr': 0.0008447119320732404, 'weight_decay': 2.627619838528584e-07, 'epochs': 50, 'loss': 'mae', 'optimizer': 'adam', 'graph_mode': 'cutoff', 'cutoff': 0.3907475866527693, 'grm_norm': 'none', 'self_loops': True, 'use_snp_selection': False}. Best is trial 73 with value: 0.30679751240794156.
[I 2025-11-13 07:08:38,978] Trial 84 finished with value: 0.297022448444043 and parameters: {'model_type': 'graphsage', 'hidden_dims': '[512, 128]', 'dropout': 0.5706284562586253, 'batch_norm': True, 'lr': 0.000756200632107969, 'weight_decay': 1.8474249288605532e-05, 'epochs': 50, 'loss': 'mae', 'optimizer': 'adam', 'graph_mode': 'cutoff', 'cutoff': 0.38430316419445637, 'grm_norm': 'none', 'self_loops': True, 'use_snp_selection': False}. Best is trial 73 with value: 0.30679751240794156.
[I 2025-11-13 07:09:46,083] Trial 85 finished with value: 0.2864686700511237 and parameters: {'model_type': 'graphsage', 'hidden_dims': '[512, 128]', 'dropout': 0.2606871709456787, 'batch_norm': True, 'lr': 0.0003331553881058667, 'weight_decay': 2.7608612199770713e-07, 'epochs': 57, 'loss': 'mae', 'optimizer': 'adam', 'graph_mode': 'cutoff', 'cutoff': 0.3160927893943689, 'grm_norm': 'none', 'self_loops': True, 'use_snp_selection': False}. Best is trial 73 with value: 0.30679751240794156.
[I 2025-11-13 07:11:04,889] Trial 86 finished with value: 0.27747752273532533 and parameters: {'model_type': 'graphsage', 'hidden_dims': '[512, 64]', 'dropout': 0.5843952061975171, 'batch_norm': True, 'lr': 0.0005310126423457128, 'weight_decay': 1.4852737096793448e-06, 'epochs': 48, 'loss': 'mae', 'optimizer': 'adam', 'graph_mode': 'knn', 'source': 'grm', 'knn_k': 9, 'weighted_edges': True, 'symmetrize_mode': 'union', 'use_snp_selection': False}. Best is trial 73 with value: 0.30679751240794156.
[I 2025-11-13 07:14:22,077] Trial 87 finished with value: 0.2753425335407204 and parameters: {'model_type': 'graphsage', 'hidden_dims': '[512, 128]', 'dropout': 0.10306553708832952, 'batch_norm': False, 'lr': 0.0006423226216649044, 'weight_decay': 1.2120008616645494e-07, 'epochs': 164, 'loss': 'mae', 'optimizer': 'adam', 'graph_mode': 'cutoff', 'cutoff': 0.4372337547033194, 'grm_norm': 'none', 'self_loops': False, 'use_snp_selection': True, 'num_snps': 52220}. Best is trial 73 with value: 0.30679751240794156.
[I 2025-11-13 07:15:21,710] Trial 88 finished with value: 0.18539147485626747 and parameters: {'model_type': 'graphsage', 'hidden_dims': '[512, 128]', 'dropout': 0.5390831042482694, 'batch_norm': True, 'lr': 3.244561572190895e-06, 'weight_decay': 4.392878644136971e-07, 'epochs': 62, 'loss': 'mse', 'optimizer': 'adam', 'graph_mode': 'cutoff', 'cutoff': 0.5302112739012403, 'grm_norm': 'none', 'self_loops': True, 'use_snp_selection': False}. Best is trial 73 with value: 0.30679751240794156.
[I 2025-11-13 07:15:48,155] Trial 89 finished with value: 0.2885475388918077 and parameters: {'model_type': 'graphsage', 'hidden_dims': '[128, 64]', 'dropout': 0.5718442514769965, 'batch_norm': True, 'lr': 0.00012300268037910108, 'weight_decay': 8.989896666794503e-07, 'epochs': 41, 'loss': 'mae', 'optimizer': 'adam', 'graph_mode': 'cutoff', 'cutoff': 0.39228872307476553, 'grm_norm': 'none', 'self_loops': True, 'use_snp_selection': False}. Best is trial 73 with value: 0.30679751240794156.
[I 2025-11-13 07:17:40,908] Trial 90 finished with value: 0.28719127625933843 and parameters: {'model_type': 'graphsage', 'hidden_dims': '[256, 128]', 'dropout': 0.5518637177911245, 'batch_norm': True, 'lr': 0.00042939638476391574, 'weight_decay': 6.092140994806707e-07, 'epochs': 204, 'loss': 'mae', 'optimizer': 'adam', 'graph_mode': 'cutoff', 'cutoff': 0.3652113897514413, 'grm_norm': 'cosine', 'self_loops': True, 'use_snp_selection': False}. Best is trial 73 with value: 0.30679751240794156.
[I 2025-11-13 07:18:56,800] Trial 91 finished with value: 0.2920332966318337 and parameters: {'model_type': 'graphsage', 'hidden_dims': '[512, 128]', 'dropout': 0.5199321095050436, 'batch_norm': True, 'lr': 0.0008717102765016337, 'weight_decay': 2.1715489212852925e-07, 'epochs': 71, 'loss': 'mae', 'optimizer': 'adam', 'graph_mode': 'cutoff', 'cutoff': 0.34150353552569135, 'grm_norm': 'none', 'self_loops': True, 'use_snp_selection': False}. Best is trial 73 with value: 0.30679751240794156.
[I 2025-11-13 07:20:21,664] Trial 92 finished with value: 0.2857751369796872 and parameters: {'model_type': 'graphsage', 'hidden_dims': '[512, 128]', 'dropout': 0.5653926692307688, 'batch_norm': True, 'lr': 0.0007036775304194755, 'weight_decay': 1.5853508244272855e-07, 'epochs': 77, 'loss': 'mae', 'optimizer': 'adam', 'graph_mode': 'cutoff', 'cutoff': 0.3045766172202389, 'grm_norm': 'none', 'self_loops': True, 'use_snp_selection': False}. Best is trial 73 with value: 0.30679751240794156.
[I 2025-11-13 07:21:21,864] Trial 93 finished with value: 0.3069511992074966 and parameters: {'model_type': 'graphsage', 'hidden_dims': '[512, 128]', 'dropout': 0.586475667042373, 'batch_norm': True, 'lr': 0.0009219530708148286, 'weight_decay': 3.280403958178771e-07, 'epochs': 54, 'loss': 'mae', 'optimizer': 'adam', 'graph_mode': 'cutoff', 'cutoff': 0.4168162355898979, 'grm_norm': 'none', 'self_loops': True, 'use_snp_selection': False}. Best is trial 93 with value: 0.3069511992074966.
[I 2025-11-13 07:22:22,046] Trial 94 finished with value: 0.30260486164380423 and parameters: {'model_type': 'graphsage', 'hidden_dims': '[512, 128]', 'dropout': 0.584876311871641, 'batch_norm': True, 'lr': 0.0008609659292780906, 'weight_decay': 3.6175866793380926e-07, 'epochs': 54, 'loss': 'mae', 'optimizer': 'adam', 'graph_mode': 'cutoff', 'cutoff': 0.41505746413927014, 'grm_norm': 'none', 'self_loops': True, 'use_snp_selection': False}. Best is trial 93 with value: 0.3069511992074966.
[I 2025-11-13 07:23:21,702] Trial 95 finished with value: 0.2965950743977259 and parameters: {'model_type': 'graphsage', 'hidden_dims': '[512, 128]', 'dropout': 0.5871848835448907, 'batch_norm': True, 'lr': 0.000857732411054743, 'weight_decay': 3.2268473613267305e-07, 'epochs': 55, 'loss': 'mae', 'optimizer': 'adam', 'graph_mode': 'cutoff', 'cutoff': 0.4749082654864487, 'grm_norm': 'none', 'self_loops': True, 'use_snp_selection': False}. Best is trial 93 with value: 0.3069511992074966.
