[I 2025-11-12 03:57:36,257] Trial 66 finished with value: 0.2136781643653181 and parameters: {'model_type': 'graphsage', 'hidden_dims': '[512, 128]', 'dropout': 0.26466984787745595, 'batch_norm': False, 'lr': 5.271744519355815e-06, 'weight_decay': 3.273517998835716e-07, 'epochs': 68, 'loss': 'mae', 'optimizer': 'adam', 'graph_mode': 'cutoff', 'cutoff': 0.7913725549007817, 'grm_norm': 'gcn', 'self_loops': False, 'use_snp_selection': True, 'num_snps': 29831}. Best is trial 50 with value: 0.2535306602402755.
[I 2025-11-12 03:59:15,938] Trial 67 finished with value: 0.22097524450141098 and parameters: {'model_type': 'graphsage', 'hidden_dims': '[512, 128]', 'dropout': 0.24289190091097457, 'batch_norm': False, 'lr': 3.7805116588591428e-06, 'weight_decay': 5.99177912782219e-07, 'epochs': 103, 'loss': 'mae', 'optimizer': 'adam', 'graph_mode': 'cutoff', 'cutoff': 0.7406617414744852, 'grm_norm': 'cosine_then_gcn', 'self_loops': False, 'use_snp_selection': True, 'num_snps': 35471}. Best is trial 50 with value: 0.2535306602402755.
[I 2025-11-12 04:02:52,305] Trial 68 finished with value: 0.22305565063700467 and parameters: {'model_type': 'graphsage', 'hidden_dims': '[512, 128]', 'dropout': 0.4596458644256471, 'batch_norm': False, 'lr': 6.558848712453255e-06, 'weight_decay': 2.6065949117791304e-07, 'epochs': 283, 'loss': 'mae', 'optimizer': 'adam', 'graph_mode': 'cutoff', 'cutoff': 0.6419453085622723, 'grm_norm': 'cosine_then_gcn', 'self_loops': False, 'use_snp_selection': True, 'num_snps': 50910}. Best is trial 50 with value: 0.2535306602402755.
[I 2025-11-12 04:04:15,634] Trial 69 finished with value: 0.22570082358819987 and parameters: {'model_type': 'graphsage', 'hidden_dims': '[512, 128]', 'dropout': 0.5782621378426247, 'batch_norm': False, 'lr': 1.235400658891003e-05, 'weight_decay': 3.779644071816047e-07, 'epochs': 41, 'loss': 'mae', 'optimizer': 'adam', 'graph_mode': 'cutoff', 'cutoff': 0.8205839799012484, 'grm_norm': 'cosine', 'self_loops': False, 'use_snp_selection': True, 'num_snps': 39746}. Best is trial 50 with value: 0.2535306602402755.
[I 2025-11-12 04:05:09,523] Trial 70 finished with value: 0.18170692211926331 and parameters: {'model_type': 'graphsage', 'hidden_dims': '[512, 256]', 'dropout': 0.41850292641173, 'batch_norm': False, 'lr': 1.9086705532540966e-05, 'weight_decay': 9.063509205662707e-07, 'epochs': 90, 'loss': 'mae', 'optimizer': 'adam', 'graph_mode': 'knn', 'source': 'grm', 'knn_k': 3, 'weighted_edges': True, 'symmetrize_mode': 'mutual', 'use_snp_selection': True, 'num_snps': 4516}. Best is trial 50 with value: 0.2535306602402755.
[I 2025-11-12 04:06:56,514] Trial 71 finished with value: 0.2448912284697911 and parameters: {'model_type': 'graphsage', 'hidden_dims': '[512, 64]', 'dropout': 0.2968025683996361, 'batch_norm': False, 'lr': 1.070314384039294e-05, 'weight_decay': 1.3880129198893804e-07, 'epochs': 116, 'loss': 'mae', 'optimizer': 'adam', 'graph_mode': 'cutoff', 'cutoff': 0.8339160020903092, 'grm_norm': 'cosine_then_gcn', 'self_loops': False, 'use_snp_selection': True, 'num_snps': 37442}. Best is trial 50 with value: 0.2535306602402755.
[I 2025-11-12 04:09:31,685] Trial 72 finished with value: 0.21904110396964463 and parameters: {'model_type': 'graphsage', 'hidden_dims': '[512, 64]', 'dropout': 0.27378630966358664, 'batch_norm': False, 'lr': 7.289866497687994e-06, 'weight_decay': 1.4089702138538209e-06, 'epochs': 204, 'loss': 'mae', 'optimizer': 'adam', 'graph_mode': 'cutoff', 'cutoff': 0.8776196293811691, 'grm_norm': 'cosine_then_gcn', 'self_loops': False, 'use_snp_selection': True, 'num_snps': 43644}. Best is trial 50 with value: 0.2535306602402755.
[I 2025-11-12 04:11:06,025] Trial 73 finished with value: 0.2241038857031185 and parameters: {'model_type': 'graphsage', 'hidden_dims': '[512, 64]', 'dropout': 0.3305702503755674, 'batch_norm': False, 'lr': 1.2354084778444585e-05, 'weight_decay': 7.181595256001032e-07, 'epochs': 70, 'loss': 'mae', 'optimizer': 'adam', 'graph_mode': 'cutoff', 'cutoff': 0.801649296740256, 'grm_norm': 'cosine_then_gcn', 'self_loops': False, 'use_snp_selection': True, 'num_snps': 40334}. Best is trial 50 with value: 0.2535306602402755.
[I 2025-11-12 04:12:33,296] Trial 74 finished with value: 0.23130441705322163 and parameters: {'model_type': 'graphsage', 'hidden_dims': '[256, 128]', 'dropout': 0.3520442004073878, 'batch_norm': False, 'lr': 0.0001293784698823101, 'weight_decay': 1.2131478457183783e-06, 'epochs': 149, 'loss': 'mae', 'optimizer': 'adam', 'graph_mode': 'cutoff', 'cutoff': 0.7654214518655338, 'grm_norm': 'cosine_then_gcn', 'self_loops': False, 'use_snp_selection': True, 'num_snps': 33525}. Best is trial 50 with value: 0.2535306602402755.
[I 2025-11-12 04:14:13,159] Trial 75 finished with value: 0.20450420589914828 and parameters: {'model_type': 'graphsage', 'hidden_dims': '[512, 64]', 'dropout': 0.3115546397326393, 'batch_norm': False, 'lr': 2.295157057671738e-06, 'weight_decay': 3.5222561608032065e-06, 'epochs': 106, 'loss': 'mae', 'optimizer': 'adam', 'graph_mode': 'cutoff', 'cutoff': 0.8427662167655919, 'grm_norm': 'none', 'self_loops': False, 'use_snp_selection': True, 'num_snps': 35931}. Best is trial 50 with value: 0.2535306602402755.
[I 2025-11-12 04:15:39,270] Trial 76 finished with value: 0.24183740031330844 and parameters: {'model_type': 'graphsage', 'hidden_dims': '[512, 128]', 'dropout': 0.2577831052618587, 'batch_norm': False, 'lr': 1.5193393435078619e-05, 'weight_decay': 5.357097749654021e-07, 'epochs': 53, 'loss': 'mae', 'optimizer': 'adam', 'graph_mode': 'cutoff', 'cutoff': 0.8719422357051867, 'grm_norm': 'cosine_then_gcn', 'self_loops': False, 'use_snp_selection': True, 'num_snps': 38619}. Best is trial 50 with value: 0.2535306602402755.
[I 2025-11-12 04:18:12,932] Trial 77 finished with value: 0.2463193978190727 and parameters: {'model_type': 'graphsage', 'hidden_dims': '[512, 64]', 'dropout': 0.27556575126998145, 'batch_norm': False, 'lr': 0.00018597297721406153, 'weight_decay': 1.7597567894019628e-06, 'epochs': 184, 'loss': 'mae', 'optimizer': 'adam', 'graph_mode': 'cutoff', 'cutoff': 0.7015444075779664, 'grm_norm': 'cosine_then_gcn', 'self_loops': False, 'use_snp_selection': True, 'num_snps': 46829}. Best is trial 50 with value: 0.2535306602402755.
[I 2025-11-12 04:20:08,407] Trial 78 finished with value: 0.21931404443900493 and parameters: {'model_type': 'graphsage', 'hidden_dims': '[256, 128, 64]', 'dropout': 0.23708112958644417, 'batch_norm': False, 'lr': 0.0002667569055115357, 'weight_decay': 1.6834328094890029e-06, 'epochs': 185, 'loss': 'mae', 'optimizer': 'adam', 'graph_mode': 'cutoff', 'cutoff': 0.6914851696200505, 'grm_norm': 'cosine_then_gcn', 'self_loops': False, 'use_snp_selection': True, 'num_snps': 46958}. Best is trial 50 with value: 0.2535306602402755.
[I 2025-11-12 04:21:09,397] Trial 79 finished with value: 0.21438803491343728 and parameters: {'model_type': 'graphsage', 'hidden_dims': '[512, 64]', 'dropout': 0.2747479492406029, 'batch_norm': True, 'lr': 0.00017715777436762243, 'weight_decay': 4.057753481747648e-07, 'epochs': 60, 'loss': 'mse', 'optimizer': 'adam', 'graph_mode': 'cutoff', 'cutoff': 0.5792586802837436, 'grm_norm': 'cosine_then_gcn', 'self_loops': False, 'use_snp_selection': False}. Best is trial 50 with value: 0.2535306602402755.
[I 2025-11-12 04:23:26,123] Trial 80 finished with value: 0.1397075512746671 and parameters: {'model_type': 'graphsage', 'hidden_dims': '[512, 64]', 'dropout': 0.21432428252224617, 'batch_norm': False, 'lr': 0.0003931591959914584, 'weight_decay': 2.262770320330873e-07, 'epochs': 173, 'loss': 'mae', 'optimizer': 'adam', 'graph_mode': 'cutoff', 'cutoff': 0.7141683434427637, 'grm_norm': 'cosine_then_gcn', 'self_loops': True, 'use_snp_selection': True, 'num_snps': 41780}. Best is trial 50 with value: 0.2535306602402755.
[I 2025-11-12 04:25:28,252] Trial 81 finished with value: 0.08585097323334748 and parameters: {'model_type': 'graphsage', 'hidden_dims': '[512, 64]', 'dropout': 0.2925123273782609, 'batch_norm': False, 'lr': 0.0005209629840720858, 'weight_decay': 2.0817351601831056e-06, 'epochs': 125, 'loss': 'mae', 'optimizer': 'adam', 'graph_mode': 'cutoff', 'cutoff': 0.8210728150494321, 'grm_norm': 'cosine_then_gcn', 'self_loops': False, 'use_snp_selection': True, 'num_snps': 44674}. Best is trial 50 with value: 0.2535306602402755.
[I 2025-11-12 04:27:28,894] Trial 82 finished with value: 0.23852133059698882 and parameters: {'model_type': 'graphsage', 'hidden_dims': '[512, 64]', 'dropout': 0.1909916998848961, 'batch_norm': False, 'lr': 7.221642941052728e-05, 'weight_decay': 2.815797391127955e-06, 'epochs': 158, 'loss': 'mae', 'optimizer': 'adam', 'graph_mode': 'cutoff', 'cutoff': 0.7981459744678739, 'grm_norm': 'cosine_then_gcn', 'self_loops': False, 'use_snp_selection': True, 'num_snps': 37054}. Best is trial 50 with value: 0.2535306602402755.
[I 2025-11-12 04:29:27,178] Trial 83 finished with value: 0.05956575368034099 and parameters: {'model_type': 'graphsage', 'hidden_dims': '[512, 64]', 'dropout': 0.37732944570132443, 'batch_norm': False, 'lr': 0.0006732917410255772, 'weight_decay': 1.0155959053126932e-06, 'epochs': 93, 'loss': 'mae', 'optimizer': 'adam', 'graph_mode': 'cutoff', 'cutoff': 0.8446002299276085, 'grm_norm': 'cosine_then_gcn', 'self_loops': False, 'use_snp_selection': True, 'num_snps': 50944}. Best is trial 50 with value: 0.2535306602402755.
[I 2025-11-12 04:31:01,015] Trial 84 finished with value: 0.2522587255220906 and parameters: {'model_type': 'graphsage', 'hidden_dims': '[512, 64]', 'dropout': 0.24695888352649217, 'batch_norm': False, 'lr': 0.00010031617406412151, 'weight_decay': 3.973712982218384e-06, 'epochs': 74, 'loss': 'mae', 'optimizer': 'adam', 'graph_mode': 'cutoff', 'cutoff': 0.8858521092575826, 'grm_norm': 'cosine_then_gcn', 'self_loops': False, 'use_snp_selection': True, 'num_snps': 38940}. Best is trial 50 with value: 0.2535306602402755.
[I 2025-11-12 04:32:19,836] Trial 85 finished with value: 0.23855772868234104 and parameters: {'model_type': 'graphsage', 'hidden_dims': '[256, 128, 64]', 'dropout': 0.260877542655669, 'batch_norm': False, 'lr': 0.0001122250295676296, 'weight_decay': 4.155247389504211e-06, 'epochs': 73, 'loss': 'mae', 'optimizer': 'adam', 'graph_mode': 'cutoff', 'cutoff': 0.8866198392075127, 'grm_norm': 'none', 'self_loops': False, 'use_snp_selection': True, 'num_snps': 40713}. Best is trial 50 with value: 0.2535306602402755.
[I 2025-11-12 04:34:05,681] Trial 86 finished with value: 0.15701599796948087 and parameters: {'model_type': 'graphsage', 'hidden_dims': '[512, 64]', 'dropout': 0.25128567977252864, 'batch_norm': False, 'lr': 9.133177868740351e-05, 'weight_decay': 6.800849770973109e-06, 'epochs': 47, 'loss': 'mae', 'optimizer': 'adam', 'graph_mode': 'knn', 'source': 'grm', 'knn_k': 5, 'weighted_edges': True, 'symmetrize_mode': 'mutual', 'use_snp_selection': True, 'num_snps': 47801}. Best is trial 50 with value: 0.2535306602402755.
[I 2025-11-12 04:35:47,967] Trial 87 finished with value: 0.2119537110358794 and parameters: {'model_type': 'graphsage', 'hidden_dims': '[512, 64]', 'dropout': 0.218992486551999, 'batch_norm': False, 'lr': 0.00016394164583405656, 'weight_decay': 1.0010141174615002e-05, 'epochs': 86, 'loss': 'mae', 'optimizer': 'adam', 'graph_mode': 'cutoff', 'cutoff': 0.8988792519257222, 'grm_norm': 'gcn', 'self_loops': False, 'use_snp_selection': True, 'num_snps': 42985}. Best is trial 50 with value: 0.2535306602402755.
[I 2025-11-12 04:39:10,821] Trial 88 finished with value: 0.21513178137697225 and parameters: {'model_type': 'graphsage', 'hidden_dims': '[512, 256]', 'dropout': 0.2789378947494471, 'batch_norm': False, 'lr': 5.7243431449504996e-05, 'weight_decay': 3.152851280810713e-07, 'epochs': 218, 'loss': 'mae', 'optimizer': 'adam', 'graph_mode': 'cutoff', 'cutoff': 0.7412576141985852, 'grm_norm': 'cosine_then_gcn', 'self_loops': False, 'use_snp_selection': True, 'num_snps': 58272}. Best is trial 50 with value: 0.2535306602402755.
[I 2025-11-12 04:40:33,387] Trial 89 finished with value: 0.23495744729847265 and parameters: {'model_type': 'graphsage', 'hidden_dims': '[512, 128]', 'dropout': 0.23579713664738994, 'batch_norm': False, 'lr': 0.00019660404063720382, 'weight_decay': 6.456390836009792e-07, 'epochs': 63, 'loss': 'mae', 'optimizer': 'adam', 'graph_mode': 'cutoff', 'cutoff': 0.8253883820798074, 'grm_norm': 'cosine_then_gcn', 'self_loops': False, 'use_snp_selection': True, 'num_snps': 32602}. Best is trial 50 with value: 0.2535306602402755.
[I 2025-11-12 04:41:44,006] Trial 90 finished with value: 0.19732048163716553 and parameters: {'model_type': 'graphsage', 'hidden_dims': '[128, 64]', 'dropout': 0.33157621039977536, 'batch_norm': False, 'lr': 0.0003162892367442133, 'weight_decay': 4.082462536499586e-06, 'epochs': 57, 'loss': 'mae', 'optimizer': 'adam', 'graph_mode': 'cutoff', 'cutoff': 0.5292768654920729, 'grm_norm': 'cosine_then_gcn', 'self_loops': False, 'use_snp_selection': True, 'num_snps': 39040}. Best is trial 50 with value: 0.2535306602402755.
[I 2025-11-12 04:43:29,445] Trial 91 finished with value: 0.24511663871740597 and parameters: {'model_type': 'graphsage', 'hidden_dims': '[512, 64]', 'dropout': 0.2468244052762976, 'batch_norm': False, 'lr': 4.723201563583179e-05, 'weight_decay': 3.097456402747766e-06, 'epochs': 109, 'loss': 'mae', 'optimizer': 'adam', 'graph_mode': 'cutoff', 'cutoff': 0.8631827805947775, 'grm_norm': 'cosine_then_gcn', 'self_loops': False, 'use_snp_selection': True, 'num_snps': 38313}. Best is trial 50 with value: 0.2535306602402755.
[I 2025-11-12 04:45:06,157] Trial 92 finished with value: 0.2461669423686108 and parameters: {'model_type': 'graphsage', 'hidden_dims': '[512, 64]', 'dropout': 0.3171999288104231, 'batch_norm': False, 'lr': 3.710902581959723e-05, 'weight_decay': 1.3432670895562786e-06, 'epochs': 97, 'loss': 'mae', 'optimizer': 'adam', 'graph_mode': 'cutoff', 'cutoff': 0.7886166511313496, 'grm_norm': 'cosine_then_gcn', 'self_loops': False, 'use_snp_selection': True, 'num_snps': 35227}. Best is trial 50 with value: 0.2535306602402755.
[I 2025-11-12 04:46:41,257] Trial 93 finished with value: 0.23419617653531763 and parameters: {'model_type': 'graphsage', 'hidden_dims': '[512, 64]', 'dropout': 0.34028327907420036, 'batch_norm': False, 'lr': 3.45799585891314e-05, 'weight_decay': 1.2929321985664478e-06, 'epochs': 96, 'loss': 'mae', 'optimizer': 'adam', 'graph_mode': 'cutoff', 'cutoff': 0.7843921086921166, 'grm_norm': 'cosine_then_gcn', 'self_loops': False, 'use_snp_selection': True, 'num_snps': 34353}. Best is trial 50 with value: 0.2535306602402755.
[I 2025-11-12 04:48:01,973] Trial 94 finished with value: 0.24260947608897282 and parameters: {'model_type': 'graphsage', 'hidden_dims': '[512, 64]', 'dropout': 0.3620931640347109, 'batch_norm': False, 'lr': 2.4440720886527125e-05, 'weight_decay': 1.6520953570914825e-06, 'epochs': 82, 'loss': 'mae', 'optimizer': 'adam', 'graph_mode': 'cutoff', 'cutoff': 0.7626200326287483, 'grm_norm': 'cosine_then_gcn', 'self_loops': False, 'use_snp_selection': True, 'num_snps': 27214}. Best is trial 50 with value: 0.2535306602402755.
[I 2025-11-12 04:51:22,125] Trial 95 finished with value: 0.2313047904439786 and parameters: {'model_type': 'graphsage', 'hidden_dims': '[512, 64]', 'dropout': 0.31963612945485187, 'batch_norm': True, 'lr': 6.768595286282667e-05, 'weight_decay': 8.579282794632466e-07, 'epochs': 320, 'loss': 'mae', 'optimizer': 'adam', 'graph_mode': 'cutoff', 'cutoff': 0.595693834983051, 'grm_norm': 'cosine', 'self_loops': False, 'use_snp_selection': True, 'num_snps': 41303}. Best is trial 50 with value: 0.2535306602402755.
[I 2025-11-12 04:52:04,419] Trial 96 finished with value: 0.20681753324369692 and parameters: {'model_type': 'graphsage', 'hidden_dims': '[256, 128]', 'dropout': 0.20110574497855122, 'batch_norm': False, 'lr': 0.00011187621476197204, 'weight_decay': 4.85456381904239e-07, 'epochs': 72, 'loss': 'mse', 'optimizer': 'adam', 'graph_mode': 'cutoff', 'cutoff': 0.6423960840741048, 'grm_norm': 'cosine_then_gcn', 'self_loops': False, 'use_snp_selection': False}. Best is trial 50 with value: 0.2535306602402755.
[I 2025-11-12 04:54:02,320] Trial 97 finished with value: 0.22368877984522192 and parameters: {'model_type': 'graphsage', 'hidden_dims': '[256, 128, 64]', 'dropout': 0.3050803184594185, 'batch_norm': False, 'lr': 1.755018467406996e-05, 'weight_decay': 1.3325762557175267e-05, 'epochs': 283, 'loss': 'mae', 'optimizer': 'adam', 'graph_mode': 'cutoff', 'cutoff': 0.8107495631338193, 'grm_norm': 'cosine_then_gcn', 'self_loops': False, 'use_snp_selection': True, 'num_snps': 36215}. Best is trial 50 with value: 0.2535306602402755.
[I 2025-11-12 04:55:44,101] Trial 98 finished with value: 0.22707589526038574 and parameters: {'model_type': 'graphsage', 'hidden_dims': '[512, 64]', 'dropout': 0.270648138764705, 'batch_norm': False, 'lr': 0.00012664039099677667, 'weight_decay': 1.506317150212926e-07, 'epochs': 78, 'loss': 'mae', 'optimizer': 'adam', 'graph_mode': 'cutoff', 'cutoff': 0.8316903561536093, 'grm_norm': 'cosine_then_gcn', 'self_loops': True, 'use_snp_selection': True, 'num_snps': 43246}. Best is trial 50 with value: 0.2535306602402755.
[I 2025-11-12 05:00:13,874] Trial 99 finished with value: 0.22261165899591248 and parameters: {'model_type': 'graphsage', 'hidden_dims': '[512, 64]', 'dropout': 0.29619360110219156, 'batch_norm': False, 'lr': 4.19918331095055e-05, 'weight_decay': 2.175402470333066e-06, 'epochs': 269, 'loss': 'mae', 'optimizer': 'adam', 'graph_mode': 'knn', 'source': 'grm', 'knn_k': 9, 'weighted_edges': False, 'symmetrize_mode': 'union', 'use_snp_selection': True, 'num_snps': 29567}. Best is trial 50 with value: 0.2535306602402755.
[I 2025-11-12 05:02:21,846] Trial 100 finished with value: 0.23227430101817478 and parameters: {'model_type': 'graphsage', 'hidden_dims': '[512, 64]', 'dropout': 0.2804415502599524, 'batch_norm': False, 'lr': 8.304973103966909e-05, 'weight_decay': 0.000937573981626215, 'epochs': 89, 'loss': 'mae', 'optimizer': 'adam', 'graph_mode': 'cutoff', 'cutoff': 0.42302106922925237, 'grm_norm': 'cosine_then_gcn', 'self_loops': False, 'use_snp_selection': True, 'num_snps': 44994}. Best is trial 50 with value: 0.2535306602402755.
[I 2025-11-12 05:04:15,339] Trial 101 finished with value: 0.24174492483617263 and parameters: {'model_type': 'graphsage', 'hidden_dims': '[512, 64]', 'dropout': 0.30818833803775847, 'batch_norm': False, 'lr': 8.299710993241907e-06, 'weight_decay': 5.874385855460204e-06, 'epochs': 121, 'loss': 'mae', 'optimizer': 'adam', 'graph_mode': 'cutoff', 'cutoff': 0.8559881677171493, 'grm_norm': 'cosine_then_gcn', 'self_loops': False, 'use_snp_selection': True, 'num_snps': 39944}. Best is trial 50 with value: 0.2535306602402755.
[I 2025-11-12 05:06:07,960] Trial 102 finished with value: 0.2216525382883044 and parameters: {'model_type': 'graphsage', 'hidden_dims': '[512, 64]', 'dropout': 0.34519096795998344, 'batch_norm': False, 'lr': 6.171353095857336e-06, 'weight_decay': 2.4895063249268426e-06, 'epochs': 130, 'loss': 'mae', 'optimizer': 'adam', 'graph_mode': 'cutoff', 'cutoff': 0.8824690344976123, 'grm_norm': 'cosine_then_gcn', 'self_loops': False, 'use_snp_selection': True, 'num_snps': 37725}. Best is trial 50 with value: 0.2535306602402755.
[I 2025-11-12 05:07:59,679] Trial 103 finished with value: 0.24480510696654184 and parameters: {'model_type': 'graphsage', 'hidden_dims': '[512, 64]', 'dropout': 0.2879305395892118, 'batch_norm': False, 'lr': 1.0271368289060551e-05, 'weight_decay': 1.3465306363690818e-06, 'epochs': 141, 'loss': 'mae', 'optimizer': 'adam', 'graph_mode': 'cutoff', 'cutoff': 0.7818227849783856, 'grm_norm': 'cosine_then_gcn', 'self_loops': False, 'use_snp_selection': True, 'num_snps': 35272}. Best is trial 50 with value: 0.2535306602402755.
[I 2025-11-12 05:09:32,830] Trial 104 finished with value: 0.22770397691828945 and parameters: {'model_type': 'graphsage', 'hidden_dims': '[512, 64]', 'dropout': 0.41326913481524885, 'batch_norm': False, 'lr': 1.3720078172254473e-05, 'weight_decay': 1.9025748737612774e-06, 'epochs': 101, 'loss': 'mae', 'optimizer': 'adam', 'graph_mode': 'cutoff', 'cutoff': 0.8516631487562619, 'grm_norm': 'cosine', 'self_loops': False, 'use_snp_selection': True, 'num_snps': 32054}. Best is trial 50 with value: 0.2535306602402755.
[I 2025-11-12 05:10:44,938] Trial 105 finished with value: 0.21131859279237272 and parameters: {'model_type': 'graphsage', 'hidden_dims': '[512, 64]', 'dropout': 0.3126513336718041, 'batch_norm': False, 'lr': 4.023393806411108e-06, 'weight_decay': 1.0151574475198008e-06, 'epochs': 114, 'loss': 'mae', 'optimizer': 'adam', 'graph_mode': 'cutoff', 'cutoff': 0.834152289366733, 'grm_norm': 'cosine_then_gcn', 'self_loops': False, 'use_snp_selection': True, 'num_snps': 17028}. Best is trial 50 with value: 0.2535306602402755.
[I 2025-11-12 05:13:25,510] Trial 106 finished with value: 0.22896433755691165 and parameters: {'model_type': 'graphsage', 'hidden_dims': '[512, 128]', 'dropout': 0.26734008261548925, 'batch_norm': False, 'lr': 0.00043015484510599736, 'weight_decay': 7.112093562446932e-07, 'epochs': 255, 'loss': 'mae', 'optimizer': 'adam', 'graph_mode': 'cutoff', 'cutoff': 0.8022377198614615, 'grm_norm': 'gcn', 'self_loops': False, 'use_snp_selection': True, 'num_snps': 39704}. Best is trial 50 with value: 0.2535306602402755.
[I 2025-11-12 05:15:00,787] Trial 107 finished with value: 0.23901125396966066 and parameters: {'model_type': 'graphsage', 'hidden_dims': '[512, 64]', 'dropout': 0.3902227501693124, 'batch_norm': False, 'lr': 7.4570408642880665e-06, 'weight_decay': 3.645609265403972e-06, 'epochs': 97, 'loss': 'mae', 'optimizer': 'adam', 'graph_mode': 'cutoff', 'cutoff': 0.681628354970498, 'grm_norm': 'cosine_then_gcn', 'self_loops': False, 'use_snp_selection': True, 'num_snps': 33974}. Best is trial 50 with value: 0.2535306602402755.
