[I 2025-11-03 13:26:08,664] Trial 3 finished with value: 0.029214055458932995 and parameters: {'model_type': 'gcn', 'hidden_dims': '[512, 64]', 'dropout': 0.5938127374509361, 'batch_norm': False, 'lr': 5.67704586114731e-06, 'weight_decay': 2.4518087630137052e-05, 'epochs': 320, 'loss': 'mae', 'optimizer': 'adam', 'graph_mode': 'off', 'use_snp_selection': False}. Best is trial 1 with value: 0.06604946229440718.
[I 2025-11-03 13:26:11,325] Trial 4 finished with value: 0.028100728360400944 and parameters: {'model_type': 'gcn', 'hidden_dims': '[512, 128]', 'dropout': 0.25746343592134413, 'batch_norm': True, 'lr': 1.3467657668402788e-06, 'weight_decay': 0.00033087251918647806, 'epochs': 277, 'loss': 'mse', 'optimizer': 'adam', 'graph_mode': 'off', 'use_snp_selection': True, 'num_snps': 36675}. Best is trial 1 with value: 0.06604946229440718.
[I 2025-11-03 13:26:13,171] Trial 5 finished with value: -0.04847527284641599 and parameters: {'model_type': 'gcn', 'hidden_dims': '[512, 64]', 'dropout': 0.38275350994408375, 'batch_norm': True, 'lr': 1.5586664309232824e-06, 'weight_decay': 0.0008227664668621182, 'epochs': 145, 'loss': 'mae', 'optimizer': 'adam', 'graph_mode': 'off', 'use_snp_selection': True, 'num_snps': 32148}. Best is trial 1 with value: 0.06604946229440718.
[I 2025-11-03 13:26:14,699] Trial 6 finished with value: 0.06434282496555956 and parameters: {'model_type': 'gcn', 'hidden_dims': '[256, 128]', 'dropout': 0.3930109900265879, 'batch_norm': False, 'lr': 4.892964372128395e-05, 'weight_decay': 1.5809549317992182e-06, 'epochs': 199, 'loss': 'mse', 'optimizer': 'adam', 'graph_mode': 'off', 'use_snp_selection': False}. Best is trial 1 with value: 0.06604946229440718.
[I 2025-11-03 13:26:16,278] Trial 7 finished with value: 0.10461207705592254 and parameters: {'model_type': 'gcn', 'hidden_dims': '[512, 256]', 'dropout': 0.15343979219678458, 'batch_norm': True, 'lr': 6.234003099047341e-05, 'weight_decay': 3.894760610535477e-07, 'epochs': 97, 'loss': 'mse', 'optimizer': 'adam', 'graph_mode': 'off', 'use_snp_selection': False}. Best is trial 7 with value: 0.10461207705592254.
[I 2025-11-03 13:26:19,537] Trial 8 finished with value: 0.07534416864194139 and parameters: {'model_type': 'gcn', 'hidden_dims': '[512, 128]', 'dropout': 0.10743001231661406, 'batch_norm': True, 'lr': 0.00023728538449271062, 'weight_decay': 1.7629071578048637e-05, 'epochs': 312, 'loss': 'mae', 'optimizer': 'adam', 'graph_mode': 'off', 'use_snp_selection': False}. Best is trial 7 with value: 0.10461207705592254.
[I 2025-11-03 13:26:21,707] Trial 9 finished with value: 0.10735604745860525 and parameters: {'model_type': 'gcn', 'hidden_dims': '[512, 64]', 'dropout': 0.14505336736221927, 'batch_norm': True, 'lr': 5.8619638388111826e-05, 'weight_decay': 6.200156172669308e-07, 'epochs': 175, 'loss': 'mse', 'optimizer': 'adam', 'graph_mode': 'off', 'use_snp_selection': False}. Best is trial 9 with value: 0.10735604745860525.
[I 2025-11-03 13:26:22,827] Trial 10 finished with value: 0.009060937861781838 and parameters: {'model_type': 'gcn', 'hidden_dims': '[512, 64]', 'dropout': 0.2753166624526289, 'batch_norm': False, 'lr': 0.00032393778075602147, 'weight_decay': 1.1714031539166645e-07, 'epochs': 44, 'loss': 'mse', 'optimizer': 'adam', 'graph_mode': 'off', 'use_snp_selection': False}. Best is trial 9 with value: 0.10735604745860525.
[I 2025-11-03 13:26:24,114] Trial 11 finished with value: 0.03566790807699205 and parameters: {'model_type': 'gcn', 'hidden_dims': '[512, 256]', 'dropout': 0.10095648685224448, 'batch_norm': True, 'lr': 1.647410838612645e-05, 'weight_decay': 6.203180869264506e-07, 'epochs': 67, 'loss': 'mse', 'optimizer': 'adam', 'graph_mode': 'off', 'use_snp_selection': False}. Best is trial 9 with value: 0.10735604745860525.
[I 2025-11-03 13:26:25,717] Trial 12 finished with value: 0.06064891314645246 and parameters: {'model_type': 'gcn', 'hidden_dims': '[512, 256]', 'dropout': 0.1977119287227368, 'batch_norm': True, 'lr': 0.000121041789182661, 'weight_decay': 1.2192432071058163e-06, 'epochs': 106, 'loss': 'mse', 'optimizer': 'adam', 'graph_mode': 'off', 'use_snp_selection': False}. Best is trial 9 with value: 0.10735604745860525.
[I 2025-11-03 13:26:27,935] Trial 13 finished with value: 0.013378001735225574 and parameters: {'model_type': 'gcn', 'hidden_dims': '[512, 256]', 'dropout': 0.17892004217860003, 'batch_norm': True, 'lr': 1.9472380101128875e-05, 'weight_decay': 1.1026057540153843e-07, 'epochs': 181, 'loss': 'mse', 'optimizer': 'adam', 'graph_mode': 'off', 'use_snp_selection': False}. Best is trial 9 with value: 0.10735604745860525.
[I 2025-11-03 13:26:28,784] Trial 14 finished with value: 0.06504386209432546 and parameters: {'model_type': 'gcn', 'hidden_dims': '[128, 64]', 'dropout': 0.3012984444538551, 'batch_norm': True, 'lr': 0.0006681578335050942, 'weight_decay': 4.814764599662762e-07, 'epochs': 105, 'loss': 'mse', 'optimizer': 'adam', 'graph_mode': 'off', 'use_snp_selection': False}. Best is trial 9 with value: 0.10735604745860525.
[I 2025-11-03 13:26:30,651] Trial 15 finished with value: 0.019870200390703502 and parameters: {'model_type': 'gcn', 'hidden_dims': '[256, 128, 64]', 'dropout': 0.49061215024256943, 'batch_norm': True, 'lr': 2.200457974768058e-05, 'weight_decay': 3.0158133721245484e-06, 'epochs': 219, 'loss': 'mse', 'optimizer': 'adam', 'graph_mode': 'off', 'use_snp_selection': False}. Best is trial 9 with value: 0.10735604745860525.
[I 2025-11-03 13:26:32,239] Trial 16 finished with value: 0.06064824379274179 and parameters: {'model_type': 'gcn', 'hidden_dims': '[512, 64]', 'dropout': 0.16016829601914256, 'batch_norm': True, 'lr': 0.0001154043714215127, 'weight_decay': 4.411191520975562e-06, 'epochs': 104, 'loss': 'mse', 'optimizer': 'adam', 'graph_mode': 'off', 'use_snp_selection': False}. Best is trial 9 with value: 0.10735604745860525.
[I 2025-11-03 13:26:34,324] Trial 17 finished with value: 0.03875164457697247 and parameters: {'model_type': 'gcn', 'hidden_dims': '[512, 256]', 'dropout': 0.31793710483525317, 'batch_norm': True, 'lr': 9.746523544442226e-06, 'weight_decay': 3.53946548624492e-07, 'epochs': 166, 'loss': 'mse', 'optimizer': 'adam', 'graph_mode': 'off', 'use_snp_selection': False}. Best is trial 9 with value: 0.10735604745860525.
[I 2025-11-03 13:26:36,786] Trial 18 finished with value: 0.06879484350400167 and parameters: {'model_type': 'gcn', 'hidden_dims': '[512, 256]', 'dropout': 0.23917094658642957, 'batch_norm': False, 'lr': 4.286919484755963e-05, 'weight_decay': 2.457070557037528e-07, 'epochs': 123, 'loss': 'mse', 'optimizer': 'adam', 'graph_mode': 'off', 'use_snp_selection': True, 'num_snps': 58241}. Best is trial 9 with value: 0.10735604745860525.
[I 2025-11-03 13:26:38,103] Trial 19 finished with value: 0.09432117597312496 and parameters: {'model_type': 'gcn', 'hidden_dims': '[512, 64]', 'dropout': 0.14397347595664306, 'batch_norm': True, 'lr': 0.0001433479397973849, 'weight_decay': 5.616604511856019e-06, 'epochs': 69, 'loss': 'mse', 'optimizer': 'adam', 'graph_mode': 'off', 'use_snp_selection': False}. Best is trial 9 with value: 0.10735604745860525.
[I 2025-11-03 13:26:40,824] Trial 20 finished with value: 0.08174438328006484 and parameters: {'model_type': 'gcn', 'hidden_dims': '[512, 128]', 'dropout': 0.22771192404829296, 'batch_norm': True, 'lr': 0.0004365995502006314, 'weight_decay': 1.1725561138335134e-06, 'epochs': 243, 'loss': 'mse', 'optimizer': 'adam', 'graph_mode': 'off', 'use_snp_selection': False}. Best is trial 9 with value: 0.10735604745860525.
[I 2025-11-03 13:26:42,109] Trial 21 finished with value: 0.07704504267521378 and parameters: {'model_type': 'gcn', 'hidden_dims': '[512, 64]', 'dropout': 0.152725720410351, 'batch_norm': True, 'lr': 0.0001530559798361738, 'weight_decay': 3.992660556214202e-06, 'epochs': 66, 'loss': 'mse', 'optimizer': 'adam', 'graph_mode': 'off', 'use_snp_selection': False}. Best is trial 9 with value: 0.10735604745860525.
[I 2025-11-03 13:26:43,490] Trial 22 finished with value: 0.04477920232817803 and parameters: {'model_type': 'gcn', 'hidden_dims': '[512, 64]', 'dropout': 0.1309659694373014, 'batch_norm': True, 'lr': 6.279282430719401e-05, 'weight_decay': 4.63838166130343e-05, 'epochs': 73, 'loss': 'mse', 'optimizer': 'adam', 'graph_mode': 'off', 'use_snp_selection': False}. Best is trial 9 with value: 0.10735604745860525.
[I 2025-11-03 13:26:44,551] Trial 23 finished with value: 0.0686978396910321 and parameters: {'model_type': 'gcn', 'hidden_dims': '[512, 64]', 'dropout': 0.1448811127903747, 'batch_norm': True, 'lr': 0.0001869446370033556, 'weight_decay': 5.8244172550017204e-06, 'epochs': 40, 'loss': 'mse', 'optimizer': 'adam', 'graph_mode': 'off', 'use_snp_selection': False}. Best is trial 9 with value: 0.10735604745860525.
[I 2025-11-03 13:26:46,325] Trial 24 finished with value: 0.05778336123452779 and parameters: {'model_type': 'gcn', 'hidden_dims': '[512, 64]', 'dropout': 0.19882985276286996, 'batch_norm': True, 'lr': 7.958858508534454e-05, 'weight_decay': 2.2450450035383515e-07, 'epochs': 128, 'loss': 'mse', 'optimizer': 'adam', 'graph_mode': 'off', 'use_snp_selection': False}. Best is trial 9 with value: 0.10735604745860525.
[I 2025-11-03 13:26:47,466] Trial 25 finished with value: 0.06413397845135818 and parameters: {'model_type': 'gcn', 'hidden_dims': '[256, 128, 64]', 'dropout': 0.33060550134148603, 'batch_norm': True, 'lr': 0.00095914823911109, 'weight_decay': 1.007773466594241e-06, 'epochs': 88, 'loss': 'mse', 'optimizer': 'adam', 'graph_mode': 'off', 'use_snp_selection': False}. Best is trial 9 with value: 0.10735604745860525.
[I 2025-11-03 13:26:48,374] Trial 26 finished with value: 0.03911738394634651 and parameters: {'model_type': 'gcn', 'hidden_dims': '[256, 128]', 'dropout': 0.10094288033847984, 'batch_norm': False, 'lr': 3.5652153356401597e-05, 'weight_decay': 2.443643243280606e-06, 'epochs': 157, 'loss': 'mae', 'optimizer': 'adam', 'graph_mode': 'off', 'use_snp_selection': True, 'num_snps': 3842}. Best is trial 9 with value: 0.10735604745860525.
[I 2025-11-03 13:26:49,534] Trial 27 finished with value: 0.06579660560383695 and parameters: {'model_type': 'gcn', 'hidden_dims': '[128, 64]', 'dropout': 0.21626339628509894, 'batch_norm': True, 'lr': 9.911283524093763e-05, 'weight_decay': 6.777086077327474e-07, 'epochs': 199, 'loss': 'mse', 'optimizer': 'adam', 'graph_mode': 'off', 'use_snp_selection': False}. Best is trial 9 with value: 0.10735604745860525.
[I 2025-11-03 13:26:51,356] Trial 28 finished with value: 0.04827772036197129 and parameters: {'model_type': 'gcn', 'hidden_dims': '[512, 256]', 'dropout': 0.2667359562450607, 'batch_norm': True, 'lr': 1.094990034050885e-05, 'weight_decay': 8.056404589273065e-06, 'epochs': 136, 'loss': 'mse', 'optimizer': 'adam', 'graph_mode': 'off', 'use_snp_selection': False}. Best is trial 9 with value: 0.10735604745860525.
[I 2025-11-03 13:26:52,366] Trial 29 finished with value: 0.06926135504389756 and parameters: {'model_type': 'gcn', 'hidden_dims': '[128, 64]', 'dropout': 0.17736852557700797, 'batch_norm': True, 'lr': 0.00024131284079230954, 'weight_decay': 7.556740997596572e-05, 'epochs': 78, 'loss': 'mae', 'optimizer': 'adam', 'graph_mode': 'off', 'use_snp_selection': True, 'num_snps': 19468}. Best is trial 9 with value: 0.10735604745860525.
[I 2025-11-03 13:26:54,534] Trial 30 finished with value: 0.039990220237215414 and parameters: {'model_type': 'gcn', 'hidden_dims': '[512, 64]', 'dropout': 0.5513165335456363, 'batch_norm': True, 'lr': 3.0756577649619966e-05, 'weight_decay': 2.020443109445596e-06, 'epochs': 175, 'loss': 'mse', 'optimizer': 'adam', 'graph_mode': 'off', 'use_snp_selection': False}. Best is trial 9 with value: 0.10735604745860525.
[I 2025-11-03 13:26:57,443] Trial 31 finished with value: 0.07765512852168421 and parameters: {'model_type': 'gcn', 'hidden_dims': '[512, 128]', 'dropout': 0.2208808741718699, 'batch_norm': True, 'lr': 0.00040117791456766814, 'weight_decay': 2.306768064291122e-07, 'epochs': 263, 'loss': 'mse', 'optimizer': 'adam', 'graph_mode': 'off', 'use_snp_selection': False}. Best is trial 9 with value: 0.10735604745860525.
[I 2025-11-03 13:27:00,064] Trial 32 finished with value: 0.0802617147811529 and parameters: {'model_type': 'gcn', 'hidden_dims': '[512, 128]', 'dropout': 0.13495290164355433, 'batch_norm': True, 'lr': 0.0003617993278062973, 'weight_decay': 9.589659748418039e-07, 'epochs': 227, 'loss': 'mse', 'optimizer': 'adam', 'graph_mode': 'off', 'use_snp_selection': False}. Best is trial 9 with value: 0.10735604745860525.
[I 2025-11-03 13:27:02,867] Trial 33 finished with value: 0.08176529493295882 and parameters: {'model_type': 'gcn', 'hidden_dims': '[512, 128]', 'dropout': 0.167452311173247, 'batch_norm': True, 'lr': 0.000738571949795849, 'weight_decay': 5.324208193796431e-07, 'epochs': 260, 'loss': 'mse', 'optimizer': 'adam', 'graph_mode': 'off', 'use_snp_selection': False}. Best is trial 9 with value: 0.10735604745860525.
[I 2025-11-03 13:27:06,123] Trial 34 finished with value: 0.09246342953011512 and parameters: {'model_type': 'gcn', 'hidden_dims': '[512, 128]', 'dropout': 0.17664021214869247, 'batch_norm': True, 'lr': 6.348521146285095e-05, 'weight_decay': 3.50742483387142e-07, 'epochs': 310, 'loss': 'mae', 'optimizer': 'adam', 'graph_mode': 'off', 'use_snp_selection': False}. Best is trial 9 with value: 0.10735604745860525.
[I 2025-11-03 13:27:08,157] Trial 35 finished with value: 0.12334639703087553 and parameters: {'model_type': 'gcn', 'hidden_dims': '[256, 128]', 'dropout': 0.12653083077787963, 'batch_norm': False, 'lr': 6.079576276527107e-05, 'weight_decay': 3.3009611710791964e-07, 'epochs': 303, 'loss': 'mae', 'optimizer': 'adam', 'graph_mode': 'off', 'use_snp_selection': False}. Best is trial 35 with value: 0.12334639703087553.
[I 2025-11-03 13:27:10,045] Trial 36 finished with value: 0.07421660214571503 and parameters: {'model_type': 'gcn', 'hidden_dims': '[256, 128]', 'dropout': 0.1167368981575973, 'batch_norm': False, 'lr': 2.8050869020116803e-05, 'weight_decay': 1.3965552653915976e-07, 'epochs': 55, 'loss': 'mae', 'optimizer': 'adam', 'graph_mode': 'off', 'use_snp_selection': True, 'num_snps': 58661}. Best is trial 35 with value: 0.12334639703087553.
[I 2025-11-03 13:27:11,998] Trial 37 finished with value: 0.02757559585959955 and parameters: {'model_type': 'gcn', 'hidden_dims': '[256, 128]', 'dropout': 0.4444623823363072, 'batch_norm': False, 'lr': 4.446294938689988e-06, 'weight_decay': 9.096918760018813e-05, 'epochs': 290, 'loss': 'mae', 'optimizer': 'adam', 'graph_mode': 'off', 'use_snp_selection': False}. Best is trial 35 with value: 0.12334639703087553.
[I 2025-11-03 13:27:13,092] Trial 38 finished with value: 0.05263638937909493 and parameters: {'model_type': 'gcn', 'hidden_dims': '[256, 128]', 'dropout': 0.1480192154130222, 'batch_norm': False, 'lr': 4.642355957045609e-05, 'weight_decay': 1.4568183467280446e-05, 'epochs': 96, 'loss': 'mae', 'optimizer': 'adam', 'graph_mode': 'off', 'use_snp_selection': True, 'num_snps': 19911}. Best is trial 35 with value: 0.12334639703087553.
[I 2025-11-03 13:27:14,240] Trial 39 finished with value: 0.10544355002140957 and parameters: {'model_type': 'gcn', 'hidden_dims': '[256, 128]', 'dropout': 0.24592446576700527, 'batch_norm': False, 'lr': 0.00016388427237875585, 'weight_decay': 3.1454796673030104e-05, 'epochs': 119, 'loss': 'mae', 'optimizer': 'adam', 'graph_mode': 'off', 'use_snp_selection': False}. Best is trial 35 with value: 0.12334639703087553.
[I 2025-11-03 13:27:16,483] Trial 40 finished with value: 0.09050606708704162 and parameters: {'model_type': 'gcn', 'hidden_dims': '[256, 128]', 'dropout': 0.24864535246040906, 'batch_norm': False, 'lr': 8.625746403528466e-05, 'weight_decay': 3.2882072521516707e-05, 'epochs': 341, 'loss': 'mae', 'optimizer': 'adam', 'graph_mode': 'off', 'use_snp_selection': False}. Best is trial 35 with value: 0.12334639703087553.
[I 2025-11-03 13:27:17,585] Trial 41 finished with value: 0.11304408023291633 and parameters: {'model_type': 'gcn', 'hidden_dims': '[256, 128]', 'dropout': 0.19675281234167358, 'batch_norm': False, 'lr': 0.00016854363467843627, 'weight_decay': 0.00016807320533150004, 'epochs': 113, 'loss': 'mae', 'optimizer': 'adam', 'graph_mode': 'off', 'use_snp_selection': False}. Best is trial 35 with value: 0.12334639703087553.
[I 2025-11-03 13:27:18,740] Trial 42 finished with value: 0.08536711142847855 and parameters: {'model_type': 'gcn', 'hidden_dims': '[256, 128]', 'dropout': 0.20382545450657277, 'batch_norm': False, 'lr': 0.0002203188081565345, 'weight_decay': 0.0003613804411464135, 'epochs': 121, 'loss': 'mae', 'optimizer': 'adam', 'graph_mode': 'off', 'use_snp_selection': False}. Best is trial 35 with value: 0.12334639703087553.
[I 2025-11-03 13:27:20,018] Trial 43 finished with value: 0.016480614928238945 and parameters: {'model_type': 'gcn', 'hidden_dims': '[256, 128]', 'dropout': 0.12348930592874577, 'batch_norm': False, 'lr': 2.1409924724993155e-06, 'weight_decay': 0.0008774322796921551, 'epochs': 146, 'loss': 'mae', 'optimizer': 'adam', 'graph_mode': 'off', 'use_snp_selection': False}. Best is trial 35 with value: 0.12334639703087553.
[I 2025-11-03 13:27:21,488] Trial 44 finished with value: 0.0710660245872085 and parameters: {'model_type': 'gcn', 'hidden_dims': '[256, 128]', 'dropout': 0.28234966765142, 'batch_norm': False, 'lr': 5.613467475441859e-05, 'weight_decay': 0.00010040081007592979, 'epochs': 189, 'loss': 'mae', 'optimizer': 'adam', 'graph_mode': 'off', 'use_snp_selection': False}. Best is trial 35 with value: 0.12334639703087553.
[I 2025-11-03 13:27:22,628] Trial 45 finished with value: 0.09490522155492673 and parameters: {'model_type': 'gcn', 'hidden_dims': '[256, 128]', 'dropout': 0.19538964222290195, 'batch_norm': False, 'lr': 8.245304589782865e-05, 'weight_decay': 0.0003629992525476937, 'epochs': 110, 'loss': 'mae', 'optimizer': 'adam', 'graph_mode': 'off', 'use_snp_selection': False}. Best is trial 35 with value: 0.12334639703087553.
[I 2025-11-03 13:27:23,620] Trial 46 finished with value: 0.10295345511586879 and parameters: {'model_type': 'gcn', 'hidden_dims': '[256, 128]', 'dropout': 0.1895117499370023, 'batch_norm': False, 'lr': 0.00015612369250927793, 'weight_decay': 2.943656773993478e-05, 'epochs': 89, 'loss': 'mae', 'optimizer': 'adam', 'graph_mode': 'off', 'use_snp_selection': False}. Best is trial 35 with value: 0.12334639703087553.
[I 2025-11-03 13:27:25,325] Trial 47 finished with value: 0.061400673847611484 and parameters: {'model_type': 'gcn', 'hidden_dims': '[256, 128, 64]', 'dropout': 0.2922785314201022, 'batch_norm': False, 'lr': 1.4269783637740988e-05, 'weight_decay': 0.0001803456264880134, 'epochs': 208, 'loss': 'mae', 'optimizer': 'adam', 'graph_mode': 'off', 'use_snp_selection': False}. Best is trial 35 with value: 0.12334639703087553.
[I 2025-11-03 13:27:27,402] Trial 48 finished with value: 0.10321070132576597 and parameters: {'model_type': 'gcn', 'hidden_dims': '[512, 256]', 'dropout': 0.25265542838589905, 'batch_norm': False, 'lr': 0.000262201989984537, 'weight_decay': 0.0002043493249287199, 'epochs': 167, 'loss': 'mae', 'optimizer': 'adam', 'graph_mode': 'off', 'use_snp_selection': False}. Best is trial 35 with value: 0.12334639703087553.
[I 2025-11-03 13:27:29,289] Trial 49 finished with value: 0.08678763568435238 and parameters: {'model_type': 'gcn', 'hidden_dims': '[256, 128]', 'dropout': 0.36167318450128966, 'batch_norm': False, 'lr': 0.00010947313196401232, 'weight_decay': 0.0005066159281116345, 'epochs': 137, 'loss': 'mae', 'optimizer': 'adam', 'graph_mode': 'off', 'use_snp_selection': True, 'num_snps': 46888}. Best is trial 35 with value: 0.12334639703087553.
[I 2025-11-03 13:27:31,282] Trial 50 finished with value: 0.06036390121721036 and parameters: {'model_type': 'gcn', 'hidden_dims': '[512, 256]', 'dropout': 0.12115839594075331, 'batch_norm': False, 'lr': 2.6690286657062508e-05, 'weight_decay': 1.975453923099614e-05, 'epochs': 154, 'loss': 'mae', 'optimizer': 'adam', 'graph_mode': 'off', 'use_snp_selection': False}. Best is trial 35 with value: 0.12334639703087553.
[I 2025-11-03 13:27:33,497] Trial 51 finished with value: 0.1071437328971902 and parameters: {'model_type': 'gcn', 'hidden_dims': '[512, 256]', 'dropout': 0.23593648040298498, 'batch_norm': False, 'lr': 0.0002725924622903714, 'weight_decay': 0.00014401217796928149, 'epochs': 179, 'loss': 'mae', 'optimizer': 'adam', 'graph_mode': 'off', 'use_snp_selection': False}. Best is trial 35 with value: 0.12334639703087553.
[I 2025-11-03 13:27:35,219] Trial 52 finished with value: 0.07910904936554355 and parameters: {'model_type': 'gcn', 'hidden_dims': '[512, 256]', 'dropout': 0.23296823503850728, 'batch_norm': False, 'lr': 0.00046964998442983413, 'weight_decay': 0.0001429967331679789, 'epochs': 116, 'loss': 'mae', 'optimizer': 'adam', 'graph_mode': 'off', 'use_snp_selection': False}. Best is trial 35 with value: 0.12334639703087553.
[I 2025-11-03 13:27:37,717] Trial 53 finished with value: 0.09104023392365054 and parameters: {'model_type': 'gcn', 'hidden_dims': '[512, 256]', 'dropout': 0.16725466124334518, 'batch_norm': False, 'lr': 0.00028429724382691106, 'weight_decay': 5.123620498698759e-05, 'epochs': 225, 'loss': 'mae', 'optimizer': 'adam', 'graph_mode': 'off', 'use_snp_selection': False}. Best is trial 35 with value: 0.12334639703087553.
[I 2025-11-03 13:27:39,841] Trial 54 finished with value: 0.10117991282135808 and parameters: {'model_type': 'gcn', 'hidden_dims': '[512, 256]', 'dropout': 0.21172758691871457, 'batch_norm': False, 'lr': 0.00018423361994008956, 'weight_decay': 1.613699332271553e-07, 'epochs': 177, 'loss': 'mae', 'optimizer': 'adam', 'graph_mode': 'off', 'use_snp_selection': False}. Best is trial 35 with value: 0.12334639703087553.
