[I 2025-11-03 13:31:05,881] Trial 114 finished with value: -0.0008426242518031138 and parameters: {'model_type': 'gcn', 'hidden_dims': '[512, 128]', 'dropout': 0.49516199294970364, 'batch_norm': True, 'lr': 5.176903323111327e-05, 'weight_decay': 0.00022147836734766368, 'epochs': 6, 'loss': 'mse', 'optimizer': 'adam', 'graph_mode': 'cutoff', 'cutoff': 0.6464454804686407, 'grm_norm': 'cosine_then_gcn', 'self_loops': True, 'use_snp_selection': True, 'num_snps': 46287}. Best is trial 44 with value: 0.06423072367905273.
[I 2025-11-03 13:31:08,498] Trial 115 finished with value: 0.014082619093114554 and parameters: {'model_type': 'gcn', 'hidden_dims': '[512, 64]', 'dropout': 0.47884314647790527, 'batch_norm': True, 'lr': 7.87709020711698e-05, 'weight_decay': 0.00011287501489017138, 'epochs': 14, 'loss': 'mse', 'optimizer': 'adam', 'graph_mode': 'knn', 'source': 'grm', 'knn_k': 9, 'weighted_edges': False, 'symmetrize_mode': 'mutual', 'use_snp_selection': True, 'num_snps': 44273}. Best is trial 44 with value: 0.06423072367905273.
[I 2025-11-03 13:31:11,334] Trial 116 finished with value: 0.018903507951104397 and parameters: {'model_type': 'gcn', 'hidden_dims': '[512, 128]', 'dropout': 0.5164986317303522, 'batch_norm': True, 'lr': 4.007353094159233e-06, 'weight_decay': 0.00018966863270386116, 'epochs': 29, 'loss': 'mse', 'optimizer': 'adam', 'graph_mode': 'cutoff', 'cutoff': 0.758877349124999, 'grm_norm': 'gcn', 'self_loops': True, 'use_snp_selection': True, 'num_snps': 48945}. Best is trial 44 with value: 0.06423072367905273.
[I 2025-11-03 13:31:14,344] Trial 117 finished with value: 0.025287757781235362 and parameters: {'model_type': 'gcn', 'hidden_dims': '[512, 64]', 'dropout': 0.5293152015397514, 'batch_norm': True, 'lr': 0.00011271304452583737, 'weight_decay': 0.00025677999702291643, 'epochs': 60, 'loss': 'mse', 'optimizer': 'adam', 'graph_mode': 'knn', 'source': 'grm', 'knn_k': 10, 'weighted_edges': False, 'symmetrize_mode': 'mutual', 'use_snp_selection': True, 'num_snps': 47686}. Best is trial 44 with value: 0.06423072367905273.
[I 2025-11-03 13:31:15,611] Trial 118 finished with value: -0.014259616129108803 and parameters: {'model_type': 'gcn', 'hidden_dims': '[256, 128]', 'dropout': 0.461817292175015, 'batch_norm': False, 'lr': 0.00034670077624004465, 'weight_decay': 1.2189441502780998e-05, 'epochs': 37, 'loss': 'mse', 'optimizer': 'adam', 'graph_mode': 'cutoff', 'cutoff': 0.5488451233350462, 'grm_norm': 'cosine_then_gcn', 'self_loops': False, 'use_snp_selection': False}. Best is trial 44 with value: 0.06423072367905273.
[I 2025-11-03 13:31:18,608] Trial 119 finished with value: -0.011424738210736604 and parameters: {'model_type': 'gcn', 'hidden_dims': '[512, 128]', 'dropout': 0.5463255443253612, 'batch_norm': True, 'lr': 0.00026728057003681306, 'weight_decay': 0.00035817077304163043, 'epochs': 25, 'loss': 'mse', 'optimizer': 'adam', 'graph_mode': 'cutoff', 'cutoff': 0.6882541707240735, 'grm_norm': 'none', 'self_loops': True, 'use_snp_selection': True, 'num_snps': 54528}. Best is trial 44 with value: 0.06423072367905273.
[I 2025-11-03 13:31:21,319] Trial 120 finished with value: 0.01793122215750237 and parameters: {'model_type': 'gcn', 'hidden_dims': '[512, 64]', 'dropout': 0.5876849403826805, 'batch_norm': False, 'lr': 0.00019793394282851374, 'weight_decay': 5.768758276269311e-06, 'epochs': 45, 'loss': 'mse', 'optimizer': 'adam', 'graph_mode': 'knn', 'source': 'grm', 'knn_k': 5, 'weighted_edges': False, 'symmetrize_mode': 'mutual', 'use_snp_selection': True, 'num_snps': 42251}. Best is trial 44 with value: 0.06423072367905273.
[I 2025-11-03 13:31:23,817] Trial 121 finished with value: 0.02130684465030177 and parameters: {'model_type': 'gcn', 'hidden_dims': '[128, 64]', 'dropout': 0.5118819416418826, 'batch_norm': False, 'lr': 3.180475096574555e-05, 'weight_decay': 0.00016086697370214492, 'epochs': 41, 'loss': 'mae', 'optimizer': 'adam', 'graph_mode': 'knn', 'source': 'grm', 'knn_k': 8, 'weighted_edges': False, 'symmetrize_mode': 'mutual', 'use_snp_selection': True, 'num_snps': 45740}. Best is trial 44 with value: 0.06423072367905273.
[I 2025-11-03 13:31:25,790] Trial 122 finished with value: -0.057118871087370744 and parameters: {'model_type': 'gcn', 'hidden_dims': '[128, 64]', 'dropout': 0.4270744131716969, 'batch_norm': False, 'lr': 4.858478591528848e-05, 'weight_decay': 1.0101049086894927e-05, 'epochs': 15, 'loss': 'mae', 'optimizer': 'adam', 'graph_mode': 'knn', 'source': 'grm', 'knn_k': 7, 'weighted_edges': False, 'symmetrize_mode': 'mutual', 'use_snp_selection': True, 'num_snps': 31529}. Best is trial 44 with value: 0.06423072367905273.
[I 2025-11-03 13:31:28,234] Trial 123 finished with value: 0.011131214923379122 and parameters: {'model_type': 'gcn', 'hidden_dims': '[128, 64]', 'dropout': 0.445809204489456, 'batch_norm': False, 'lr': 5.854387298964339e-05, 'weight_decay': 0.0002913333705428697, 'epochs': 35, 'loss': 'mae', 'optimizer': 'adam', 'graph_mode': 'knn', 'source': 'grm', 'knn_k': 8, 'weighted_edges': False, 'symmetrize_mode': 'mutual', 'use_snp_selection': True, 'num_snps': 44207}. Best is trial 44 with value: 0.06423072367905273.
[I 2025-11-03 13:31:31,256] Trial 124 finished with value: 0.018129858045563843 and parameters: {'model_type': 'gcn', 'hidden_dims': '[512, 128]', 'dropout': 0.5024968261568991, 'batch_norm': False, 'lr': 4.1245657508094875e-05, 'weight_decay': 0.00012509297424859671, 'epochs': 71, 'loss': 'mae', 'optimizer': 'adam', 'graph_mode': 'knn', 'source': 'grm', 'knn_k': 9, 'weighted_edges': False, 'symmetrize_mode': 'mutual', 'use_snp_selection': True, 'num_snps': 46879}. Best is trial 44 with value: 0.06423072367905273.
[I 2025-11-03 13:31:33,680] Trial 125 finished with value: -0.004578444037528361 and parameters: {'model_type': 'gcn', 'hidden_dims': '[512, 64]', 'dropout': 0.5212070849988342, 'batch_norm': False, 'lr': 9.147691023566022e-05, 'weight_decay': 7.377495030048651e-05, 'epochs': 8, 'loss': 'mse', 'optimizer': 'adam', 'graph_mode': 'knn', 'source': 'grm', 'knn_k': 9, 'weighted_edges': False, 'symmetrize_mode': 'mutual', 'use_snp_selection': True, 'num_snps': 40016}. Best is trial 44 with value: 0.06423072367905273.
[I 2025-11-03 13:31:36,574] Trial 126 finished with value: 0.03485693399766866 and parameters: {'model_type': 'gcn', 'hidden_dims': '[512, 128]', 'dropout': 0.5593910726027008, 'batch_norm': False, 'lr': 0.00015707557267053129, 'weight_decay': 9.56984167450522e-05, 'epochs': 44, 'loss': 'mse', 'optimizer': 'adam', 'graph_mode': 'cutoff', 'cutoff': 0.507875491638503, 'grm_norm': 'cosine_then_gcn', 'self_loops': True, 'use_snp_selection': True, 'num_snps': 48378}. Best is trial 44 with value: 0.06423072367905273.
[I 2025-11-03 13:31:39,357] Trial 127 finished with value: 0.00683122255145278 and parameters: {'model_type': 'gcn', 'hidden_dims': '[512, 128]', 'dropout': 0.5571140596216854, 'batch_norm': True, 'lr': 0.00016017506725290073, 'weight_decay': 9.570777835832596e-05, 'epochs': 21, 'loss': 'mse', 'optimizer': 'adam', 'graph_mode': 'cutoff', 'cutoff': 0.46991644765537577, 'grm_norm': 'cosine_then_gcn', 'self_loops': True, 'use_snp_selection': True, 'num_snps': 48506}. Best is trial 44 with value: 0.06423072367905273.
[I 2025-11-03 13:31:42,359] Trial 128 finished with value: -0.023804963943054674 and parameters: {'model_type': 'gcn', 'hidden_dims': '[512, 128]', 'dropout': 0.568575613375067, 'batch_norm': False, 'lr': 0.00022854221419483337, 'weight_decay': 2.999679670865748e-05, 'epochs': 50, 'loss': 'mse', 'optimizer': 'adam', 'graph_mode': 'cutoff', 'cutoff': 0.4949626187245862, 'grm_norm': 'cosine_then_gcn', 'self_loops': True, 'use_snp_selection': True, 'num_snps': 49956}. Best is trial 44 with value: 0.06423072367905273.
[I 2025-11-03 13:31:44,114] Trial 129 finished with value: 0.0052787374809323325 and parameters: {'model_type': 'gcn', 'hidden_dims': '[512, 128]', 'dropout': 0.5797019321727003, 'batch_norm': True, 'lr': 0.000137504228883929, 'weight_decay': 9.898694016842636e-05, 'epochs': 29, 'loss': 'mse', 'optimizer': 'adam', 'graph_mode': 'cutoff', 'cutoff': 0.4105317614330814, 'grm_norm': 'cosine_then_gcn', 'self_loops': True, 'use_snp_selection': True, 'num_snps': 20526}. Best is trial 44 with value: 0.06423072367905273.
[I 2025-11-03 13:31:47,251] Trial 130 finished with value: -0.00862778076745503 and parameters: {'model_type': 'gcn', 'hidden_dims': '[512, 128]', 'dropout': 0.5420691227485109, 'batch_norm': False, 'lr': 2.310236575468232e-06, 'weight_decay': 6.0466998312779035e-05, 'epochs': 59, 'loss': 'mse', 'optimizer': 'adam', 'graph_mode': 'cutoff', 'cutoff': 0.5169738391401381, 'grm_norm': 'cosine_then_gcn', 'self_loops': True, 'use_snp_selection': True, 'num_snps': 52371}. Best is trial 44 with value: 0.06423072367905273.
[I 2025-11-03 13:31:50,572] Trial 131 finished with value: 0.015503181520384641 and parameters: {'model_type': 'gcn', 'hidden_dims': '[512, 128]', 'dropout': 0.489982737603795, 'batch_norm': False, 'lr': 0.0001702772647146849, 'weight_decay': 0.0004540155524703116, 'epochs': 159, 'loss': 'mse', 'optimizer': 'adam', 'graph_mode': 'cutoff', 'cutoff': 0.45005149257588917, 'grm_norm': 'gcn', 'self_loops': True, 'use_snp_selection': True, 'num_snps': 44964}. Best is trial 44 with value: 0.06423072367905273.
[I 2025-11-03 13:31:53,193] Trial 132 finished with value: 0.00021916199353749546 and parameters: {'model_type': 'gcn', 'hidden_dims': '[512, 64]', 'dropout': 0.5145602153313544, 'batch_norm': False, 'lr': 6.767176980732544e-05, 'weight_decay': 0.0002410816146062337, 'epochs': 1, 'loss': 'mae', 'optimizer': 'adam', 'graph_mode': 'knn', 'source': 'grm', 'knn_k': 7, 'weighted_edges': False, 'symmetrize_mode': 'mutual', 'use_snp_selection': True, 'num_snps': 46785}. Best is trial 44 with value: 0.06423072367905273.
[I 2025-11-03 13:31:55,566] Trial 133 finished with value: -0.0036789451953905747 and parameters: {'model_type': 'gcn', 'hidden_dims': '[128, 64]', 'dropout': 0.5293715391840058, 'batch_norm': False, 'lr': 0.00011917259879973766, 'weight_decay': 0.00019084441878855954, 'epochs': 41, 'loss': 'mse', 'optimizer': 'adam', 'graph_mode': 'cutoff', 'cutoff': 0.34052203244415546, 'grm_norm': 'cosine_then_gcn', 'self_loops': True, 'use_snp_selection': True, 'num_snps': 43303}. Best is trial 44 with value: 0.06423072367905273.
[I 2025-11-03 13:31:58,488] Trial 134 finished with value: 0.006846676492889319 and parameters: {'model_type': 'gcn', 'hidden_dims': '[512, 128]', 'dropout': 0.598721800577819, 'batch_norm': False, 'lr': 2.3853154478889343e-05, 'weight_decay': 1.713588153775104e-05, 'epochs': 46, 'loss': 'mse', 'optimizer': 'adam', 'graph_mode': 'knn', 'source': 'grm', 'knn_k': 8, 'weighted_edges': False, 'symmetrize_mode': 'mutual', 'use_snp_selection': True, 'num_snps': 45723}. Best is trial 44 with value: 0.06423072367905273.
[I 2025-11-03 13:32:01,435] Trial 135 finished with value: -0.02714521389186654 and parameters: {'model_type': 'gcn', 'hidden_dims': '[512, 256]', 'dropout': 0.19559625087017832, 'batch_norm': False, 'lr': 0.00020377172299316322, 'weight_decay': 0.00013425900951151708, 'epochs': 15, 'loss': 'mse', 'optimizer': 'adam', 'graph_mode': 'cutoff', 'cutoff': 0.6094750257848796, 'grm_norm': 'cosine_then_gcn', 'self_loops': True, 'use_snp_selection': True, 'num_snps': 50665}. Best is trial 44 with value: 0.06423072367905273.
[I 2025-11-03 13:32:04,049] Trial 136 finished with value: -0.0058686232536191 and parameters: {'model_type': 'gcn', 'hidden_dims': '[512, 64]', 'dropout': 0.504768143188578, 'batch_norm': True, 'lr': 0.0002841494723736244, 'weight_decay': 0.00031530879914801814, 'epochs': 23, 'loss': 'mae', 'optimizer': 'adam', 'graph_mode': 'cutoff', 'cutoff': 0.5578057618450383, 'grm_norm': 'cosine', 'self_loops': False, 'use_snp_selection': True, 'num_snps': 41517}. Best is trial 44 with value: 0.06423072367905273.
[I 2025-11-03 13:32:07,182] Trial 137 finished with value: -0.032500793944545685 and parameters: {'model_type': 'gcn', 'hidden_dims': '[512, 128]', 'dropout': 0.4751318168755595, 'batch_norm': False, 'lr': 0.0001497178657874739, 'weight_decay': 8.538967294724439e-05, 'epochs': 66, 'loss': 'mse', 'optimizer': 'adam', 'graph_mode': 'knn', 'source': 'grm', 'knn_k': 10, 'weighted_edges': False, 'symmetrize_mode': 'mutual', 'use_snp_selection': True, 'num_snps': 48036}. Best is trial 44 with value: 0.06423072367905273.
[I 2025-11-03 13:32:10,264] Trial 138 finished with value: 0.041352248194012946 and parameters: {'model_type': 'gcn', 'hidden_dims': '[512, 64]', 'dropout': 0.5533605174453047, 'batch_norm': True, 'lr': 0.00010477969996842244, 'weight_decay': 0.00017540324866519765, 'epochs': 190, 'loss': 'mse', 'optimizer': 'adam', 'graph_mode': 'cutoff', 'cutoff': 0.8018461072292354, 'grm_norm': 'cosine_then_gcn', 'self_loops': True, 'use_snp_selection': True, 'num_snps': 35182}. Best is trial 44 with value: 0.06423072367905273.
[I 2025-11-03 13:32:12,820] Trial 139 finished with value: -0.030139521899959 and parameters: {'model_type': 'gcn', 'hidden_dims': '[512, 64]', 'dropout': 0.5561210200468237, 'batch_norm': True, 'lr': 0.00010621687900494167, 'weight_decay': 5.380038493215959e-05, 'epochs': 185, 'loss': 'mse', 'optimizer': 'adam', 'graph_mode': 'cutoff', 'cutoff': 0.8124627555476585, 'grm_norm': 'cosine_then_gcn', 'self_loops': True, 'use_snp_selection': False}. Best is trial 44 with value: 0.06423072367905273.
[I 2025-11-03 13:32:15,978] Trial 140 finished with value: -0.004610711737156643 and parameters: {'model_type': 'gcn', 'hidden_dims': '[512, 64]', 'dropout': 0.5458801931857855, 'batch_norm': True, 'lr': 0.00012658887348393136, 'weight_decay': 0.00015891767916513067, 'epochs': 228, 'loss': 'mse', 'optimizer': 'adam', 'graph_mode': 'cutoff', 'cutoff': 0.8080156205259751, 'grm_norm': 'cosine_then_gcn', 'self_loops': True, 'use_snp_selection': True, 'num_snps': 34279}. Best is trial 44 with value: 0.06423072367905273.
[I 2025-11-03 13:32:19,152] Trial 141 finished with value: -0.017279329156703743 and parameters: {'model_type': 'gcn', 'hidden_dims': '[512, 64]', 'dropout': 0.565942921782712, 'batch_norm': True, 'lr': 7.499174385412862e-05, 'weight_decay': 0.0002585123943161782, 'epochs': 196, 'loss': 'mse', 'optimizer': 'adam', 'graph_mode': 'cutoff', 'cutoff': 0.5871890552927299, 'grm_norm': 'cosine_then_gcn', 'self_loops': True, 'use_snp_selection': True, 'num_snps': 36323}. Best is trial 44 with value: 0.06423072367905273.
[I 2025-11-03 13:32:21,441] Trial 142 finished with value: -0.0073893473374335595 and parameters: {'model_type': 'gcn', 'hidden_dims': '[512, 64]', 'dropout': 0.5337091387029175, 'batch_norm': True, 'lr': 6.25276898141385e-05, 'weight_decay': 0.00019508039492916425, 'epochs': 8, 'loss': 'mse', 'optimizer': 'adam', 'graph_mode': 'cutoff', 'cutoff': 0.8306671893433968, 'grm_norm': 'cosine_then_gcn', 'self_loops': True, 'use_snp_selection': True, 'num_snps': 35112}. Best is trial 44 with value: 0.06423072367905273.
[I 2025-11-03 13:32:23,898] Trial 143 finished with value: 0.003230049433745557 and parameters: {'model_type': 'gcn', 'hidden_dims': '[128, 64]', 'dropout': 0.5227967316727331, 'batch_norm': True, 'lr': 0.00018047751770046847, 'weight_decay': 0.00013105373174999527, 'epochs': 200, 'loss': 'mse', 'optimizer': 'adam', 'graph_mode': 'cutoff', 'cutoff': 0.7755520601655483, 'grm_norm': 'cosine_then_gcn', 'self_loops': True, 'use_snp_selection': True, 'num_snps': 29738}. Best is trial 44 with value: 0.06423072367905273.
[I 2025-11-03 13:32:26,714] Trial 144 finished with value: -0.0020413119391636575 and parameters: {'model_type': 'gcn', 'hidden_dims': '[512, 64]', 'dropout': 0.3330969964691401, 'batch_norm': False, 'lr': 0.00022440739642197528, 'weight_decay': 0.00011270765356017041, 'epochs': 33, 'loss': 'mse', 'optimizer': 'adam', 'graph_mode': 'knn', 'source': 'grm', 'knn_k': 6, 'weighted_edges': False, 'symmetrize_mode': 'mutual', 'use_snp_selection': True, 'num_snps': 43871}. Best is trial 44 with value: 0.06423072367905273.
[I 2025-11-03 13:32:29,647] Trial 145 finished with value: 0.0026991788385296433 and parameters: {'model_type': 'gcn', 'hidden_dims': '[512, 128]', 'dropout': 0.4881955696316106, 'batch_norm': True, 'lr': 0.000143823672584597, 'weight_decay': 0.0003884382567122118, 'epochs': 182, 'loss': 'mae', 'optimizer': 'adam', 'graph_mode': 'cutoff', 'cutoff': 0.7220839005914617, 'grm_norm': 'none', 'self_loops': True, 'use_snp_selection': True, 'num_snps': 32464}. Best is trial 44 with value: 0.06423072367905273.
[I 2025-11-03 13:32:32,657] Trial 146 finished with value: -0.01621107190228018 and parameters: {'model_type': 'gcn', 'hidden_dims': '[512, 128]', 'dropout': 0.38973716153692967, 'batch_norm': True, 'lr': 9.199155480331862e-05, 'weight_decay': 2.1017016295137723e-07, 'epochs': 52, 'loss': 'mse', 'optimizer': 'adam', 'graph_mode': 'cutoff', 'cutoff': 0.6587836429348142, 'grm_norm': 'gcn', 'self_loops': True, 'use_snp_selection': True, 'num_snps': 47259}. Best is trial 44 with value: 0.06423072367905273.
[I 2025-11-03 13:32:35,915] Trial 147 finished with value: -0.01249936892282246 and parameters: {'model_type': 'gcn', 'hidden_dims': '[256, 128]', 'dropout': 0.5132321917818927, 'batch_norm': False, 'lr': 4.875355059374064e-05, 'weight_decay': 0.0005949864327535418, 'epochs': 167, 'loss': 'mse', 'optimizer': 'adam', 'graph_mode': 'knn', 'source': 'grm', 'knn_k': 2, 'weighted_edges': False, 'symmetrize_mode': 'mutual', 'use_snp_selection': True, 'num_snps': 49235}. Best is trial 44 with value: 0.06423072367905273.
[I 2025-11-03 13:32:38,715] Trial 148 finished with value: -0.010150519246761271 and parameters: {'model_type': 'gcn', 'hidden_dims': '[512, 64]', 'dropout': 0.5496996414333133, 'batch_norm': True, 'lr': 0.00024108755705315463, 'weight_decay': 0.00022556425419782182, 'epochs': 25, 'loss': 'mse', 'optimizer': 'adam', 'graph_mode': 'cutoff', 'cutoff': 0.5318832636383211, 'grm_norm': 'cosine_then_gcn', 'self_loops': False, 'use_snp_selection': True, 'num_snps': 45975}. Best is trial 44 with value: 0.06423072367905273.
[I 2025-11-03 13:32:41,109] Trial 149 finished with value: -0.0035095996077140388 and parameters: {'model_type': 'gcn', 'hidden_dims': '[512, 128]', 'dropout': 0.49670564935847994, 'batch_norm': False, 'lr': 3.243914570808551e-05, 'weight_decay': 0.00017618265843682792, 'epochs': 1, 'loss': 'mae', 'optimizer': 'adam', 'graph_mode': 'knn', 'source': 'grm', 'knn_k': 9, 'weighted_edges': False, 'symmetrize_mode': 'mutual', 'use_snp_selection': True, 'num_snps': 37724}. Best is trial 44 with value: 0.06423072367905273.
[I 2025-11-03 13:32:43,186] Trial 0 finished with value: 0.05949036026181799 and parameters: {'model_type': 'gcn', 'hidden_dims': '[128, 64]', 'dropout': 0.199031432379812, 'batch_norm': True, 'lr': 1.8408544111075837e-06, 'weight_decay': 5.5136510071208614e-05, 'epochs': 334, 'loss': 'mae', 'optimizer': 'adam', 'graph_mode': 'knn', 'source': 'grm', 'knn_k': 8, 'weighted_edges': True, 'symmetrize_mode': 'mutual', 'use_snp_selection': False}. Best is trial 0 with value: 0.05949036026181799.
[I 2025-11-03 13:32:44,306] Trial 1 finished with value: 0.08676422414749585 and parameters: {'model_type': 'gcn', 'hidden_dims': '[128, 64]', 'dropout': 0.40051947670227217, 'batch_norm': True, 'lr': 0.0005320428882732732, 'weight_decay': 1.89210117736594e-06, 'epochs': 32, 'loss': 'mse', 'optimizer': 'adam', 'graph_mode': 'knn', 'source': 'grm', 'knn_k': 7, 'weighted_edges': True, 'symmetrize_mode': 'union', 'use_snp_selection': False}. Best is trial 1 with value: 0.08676422414749585.
[I 2025-11-03 13:32:46,460] Trial 2 finished with value: 0.04493880496541661 and parameters: {'model_type': 'gcn', 'hidden_dims': '[256, 128]', 'dropout': 0.5105528289184642, 'batch_norm': False, 'lr': 0.0006804279372404962, 'weight_decay': 0.0008922815224257085, 'epochs': 160, 'loss': 'mse', 'optimizer': 'adam', 'graph_mode': 'cutoff', 'cutoff': 0.5741905641612706, 'grm_norm': 'gcn', 'self_loops': False, 'use_snp_selection': True, 'num_snps': 26910}. Best is trial 1 with value: 0.08676422414749585.
[I 2025-11-03 13:32:48,702] Trial 3 finished with value: 0.022761959735808163 and parameters: {'model_type': 'gcn', 'hidden_dims': '[256, 128, 64]', 'dropout': 0.5390483213624292, 'batch_norm': False, 'lr': 3.4705625989073525e-05, 'weight_decay': 2.4623319020131338e-05, 'epochs': 92, 'loss': 'mse', 'optimizer': 'adam', 'graph_mode': 'knn', 'source': 'grm', 'knn_k': 6, 'weighted_edges': False, 'symmetrize_mode': 'mutual', 'use_snp_selection': True, 'num_snps': 30713}. Best is trial 1 with value: 0.08676422414749585.
[I 2025-11-03 13:32:51,018] Trial 4 finished with value: 0.020262914287412295 and parameters: {'model_type': 'gcn', 'hidden_dims': '[128, 64]', 'dropout': 0.13404863676897502, 'batch_norm': False, 'lr': 0.0001431556295367288, 'weight_decay': 2.2084517750726675e-05, 'epochs': 13, 'loss': 'mae', 'optimizer': 'adam', 'graph_mode': 'cutoff', 'cutoff': 0.6714268476993044, 'grm_norm': 'none', 'self_loops': False, 'use_snp_selection': True, 'num_snps': 45645}. Best is trial 1 with value: 0.08676422414749585.
[I 2025-11-03 13:32:53,720] Trial 5 finished with value: 0.11004804627476908 and parameters: {'model_type': 'gcn', 'hidden_dims': '[256, 128]', 'dropout': 0.42253606323412096, 'batch_norm': False, 'lr': 4.238630400638805e-05, 'weight_decay': 8.074086040046576e-07, 'epochs': 134, 'loss': 'mae', 'optimizer': 'adam', 'graph_mode': 'knn', 'source': 'grm', 'knn_k': 1, 'weighted_edges': False, 'symmetrize_mode': 'mutual', 'use_snp_selection': True, 'num_snps': 43113}. Best is trial 5 with value: 0.11004804627476908.
