[I 2025-11-03 13:56:51,519] Trial 105 finished with value: 0.11196608650559209 and parameters: {'model_type': 'gcn', 'hidden_dims': '[512, 64]', 'dropout': 0.3274946654962028, 'batch_norm': True, 'lr': 0.0003902934761575189, 'weight_decay': 6.678250985906386e-05, 'epochs': 76, 'loss': 'mse', 'optimizer': 'adam', 'graph_mode': 'knn', 'source': 'grm', 'knn_k': 8, 'weighted_edges': False, 'symmetrize_mode': 'mutual', 'use_snp_selection': False}. Best is trial 11 with value: 0.1282886373815262.
[I 2025-11-03 13:56:53,616] Trial 106 finished with value: 0.09197926567858546 and parameters: {'model_type': 'gcn', 'hidden_dims': '[512, 64]', 'dropout': 0.39277758069596913, 'batch_norm': True, 'lr': 0.0006844590150658841, 'weight_decay': 2.5781935185243585e-05, 'epochs': 172, 'loss': 'mse', 'optimizer': 'adam', 'graph_mode': 'knn', 'source': 'grm', 'knn_k': 10, 'weighted_edges': False, 'symmetrize_mode': 'mutual', 'use_snp_selection': False}. Best is trial 11 with value: 0.1282886373815262.
[I 2025-11-03 13:56:55,314] Trial 107 finished with value: 0.09582873103403597 and parameters: {'model_type': 'gcn', 'hidden_dims': '[512, 64]', 'dropout': 0.36019873600131863, 'batch_norm': True, 'lr': 0.0005741030366977458, 'weight_decay': 0.00010658100634465289, 'epochs': 91, 'loss': 'mse', 'optimizer': 'adam', 'graph_mode': 'knn', 'source': 'grm', 'knn_k': 2, 'weighted_edges': True, 'symmetrize_mode': 'mutual', 'use_snp_selection': False}. Best is trial 11 with value: 0.1282886373815262.
[I 2025-11-03 13:56:57,224] Trial 108 finished with value: -0.008098299411445254 and parameters: {'model_type': 'gcn', 'hidden_dims': '[256, 128]', 'dropout': 0.3056299294274247, 'batch_norm': False, 'lr': 0.00045293855094144384, 'weight_decay': 6.909584553759736e-07, 'epochs': 7, 'loss': 'mae', 'optimizer': 'adam', 'graph_mode': 'knn', 'source': 'grm', 'knn_k': 9, 'weighted_edges': False, 'symmetrize_mode': 'mutual', 'use_snp_selection': True, 'num_snps': 36947}. Best is trial 11 with value: 0.1282886373815262.
[I 2025-11-03 13:56:59,179] Trial 109 finished with value: 0.0004812991560563768 and parameters: {'model_type': 'gcn', 'hidden_dims': '[512, 256]', 'dropout': 0.3733500921084394, 'batch_norm': True, 'lr': 0.0009031864164926001, 'weight_decay': 7.122196384887604e-06, 'epochs': 137, 'loss': 'mse', 'optimizer': 'adam', 'graph_mode': 'knn', 'source': 'grm', 'knn_k': 8, 'weighted_edges': False, 'symmetrize_mode': 'union', 'use_snp_selection': False}. Best is trial 11 with value: 0.1282886373815262.
[I 2025-11-03 13:57:01,289] Trial 110 finished with value: 0.07323667191599763 and parameters: {'model_type': 'gcn', 'hidden_dims': '[512, 64]', 'dropout': 0.4527764192551149, 'batch_norm': True, 'lr': 0.0006368549991162709, 'weight_decay': 0.0006632389222309448, 'epochs': 189, 'loss': 'mse', 'optimizer': 'adam', 'graph_mode': 'cutoff', 'cutoff': 0.7485493479819436, 'grm_norm': 'none', 'self_loops': False, 'use_snp_selection': False}. Best is trial 11 with value: 0.1282886373815262.
[I 2025-11-03 13:57:02,403] Trial 111 finished with value: 0.10822860442812174 and parameters: {'model_type': 'gcn', 'hidden_dims': '[128, 64]', 'dropout': 0.25486110047433713, 'batch_norm': True, 'lr': 0.0007663205752846263, 'weight_decay': 4.6829320838610665e-05, 'epochs': 46, 'loss': 'mse', 'optimizer': 'adam', 'graph_mode': 'knn', 'source': 'grm', 'knn_k': 7, 'weighted_edges': False, 'symmetrize_mode': 'mutual', 'use_snp_selection': False}. Best is trial 11 with value: 0.1282886373815262.
[I 2025-11-03 13:57:03,981] Trial 112 finished with value: 0.1268192998052861 and parameters: {'model_type': 'gcn', 'hidden_dims': '[512, 256]', 'dropout': 0.2863937863393587, 'batch_norm': True, 'lr': 0.0007815409545087544, 'weight_decay': 3.360599444157278e-05, 'epochs': 60, 'loss': 'mse', 'optimizer': 'adam', 'graph_mode': 'knn', 'source': 'grm', 'knn_k': 6, 'weighted_edges': False, 'symmetrize_mode': 'mutual', 'use_snp_selection': False}. Best is trial 11 with value: 0.1282886373815262.
[I 2025-11-03 13:57:05,595] Trial 113 finished with value: 0.12561339788038345 and parameters: {'model_type': 'gcn', 'hidden_dims': '[512, 256]', 'dropout': 0.2853111554587172, 'batch_norm': True, 'lr': 0.0005151017387925031, 'weight_decay': 3.224893989123745e-05, 'epochs': 71, 'loss': 'mse', 'optimizer': 'adam', 'graph_mode': 'knn', 'source': 'grm', 'knn_k': 6, 'weighted_edges': False, 'symmetrize_mode': 'mutual', 'use_snp_selection': False}. Best is trial 11 with value: 0.1282886373815262.
[I 2025-11-03 13:57:07,061] Trial 114 finished with value: 0.11116278783665462 and parameters: {'model_type': 'gcn', 'hidden_dims': '[512, 256]', 'dropout': 0.28354505953544046, 'batch_norm': True, 'lr': 0.00031009707544366326, 'weight_decay': 5.7805277654895176e-05, 'epochs': 42, 'loss': 'mse', 'optimizer': 'adam', 'graph_mode': 'knn', 'source': 'grm', 'knn_k': 6, 'weighted_edges': False, 'symmetrize_mode': 'mutual', 'use_snp_selection': False}. Best is trial 11 with value: 0.1282886373815262.
[I 2025-11-03 13:57:08,674] Trial 115 finished with value: 0.086388029336095 and parameters: {'model_type': 'gcn', 'hidden_dims': '[512, 256]', 'dropout': 0.32075152341326396, 'batch_norm': True, 'lr': 0.0004989315969487457, 'weight_decay': 3.09144207845209e-05, 'epochs': 72, 'loss': 'mse', 'optimizer': 'adam', 'graph_mode': 'knn', 'source': 'grm', 'knn_k': 6, 'weighted_edges': False, 'symmetrize_mode': 'mutual', 'use_snp_selection': False}. Best is trial 11 with value: 0.1282886373815262.
[I 2025-11-03 13:57:10,552] Trial 116 finished with value: 0.08812643432335937 and parameters: {'model_type': 'gcn', 'hidden_dims': '[512, 256]', 'dropout': 0.3402781788102716, 'batch_norm': True, 'lr': 0.0003738769374175473, 'weight_decay': 1.670224421169007e-05, 'epochs': 127, 'loss': 'mse', 'optimizer': 'adam', 'graph_mode': 'knn', 'source': 'grm', 'knn_k': 6, 'weighted_edges': False, 'symmetrize_mode': 'mutual', 'use_snp_selection': False}. Best is trial 11 with value: 0.1282886373815262.
[I 2025-11-03 13:57:12,357] Trial 117 finished with value: 0.1123579367783267 and parameters: {'model_type': 'gcn', 'hidden_dims': '[512, 256]', 'dropout': 0.30059867231821324, 'batch_norm': True, 'lr': 0.000543467584216243, 'weight_decay': 2.0293996328508005e-05, 'epochs': 112, 'loss': 'mse', 'optimizer': 'adam', 'graph_mode': 'knn', 'source': 'grm', 'knn_k': 5, 'weighted_edges': False, 'symmetrize_mode': 'mutual', 'use_snp_selection': False}. Best is trial 11 with value: 0.1282886373815262.
[I 2025-11-03 13:57:13,938] Trial 118 finished with value: 0.12464851244344105 and parameters: {'model_type': 'gcn', 'hidden_dims': '[512, 256]', 'dropout': 0.2712481835344093, 'batch_norm': True, 'lr': 0.0006316454552549533, 'weight_decay': 0.0001487128870513513, 'epochs': 65, 'loss': 'mse', 'optimizer': 'adam', 'graph_mode': 'knn', 'source': 'grm', 'knn_k': 6, 'weighted_edges': False, 'symmetrize_mode': 'mutual', 'use_snp_selection': False}. Best is trial 11 with value: 0.1282886373815262.
[I 2025-11-03 13:57:15,488] Trial 119 finished with value: 0.02393735410345465 and parameters: {'model_type': 'gcn', 'hidden_dims': '[512, 256]', 'dropout': 0.23991828507460614, 'batch_norm': True, 'lr': 3.0680152677666365e-05, 'weight_decay': 0.00018639470878359447, 'epochs': 59, 'loss': 'mse', 'optimizer': 'adam', 'graph_mode': 'knn', 'source': 'grm', 'knn_k': 6, 'weighted_edges': False, 'symmetrize_mode': 'mutual', 'use_snp_selection': False}. Best is trial 11 with value: 0.1282886373815262.
[I 2025-11-03 13:57:16,675] Trial 120 finished with value: 0.11086011363048903 and parameters: {'model_type': 'gcn', 'hidden_dims': '[256, 128, 64]', 'dropout': 0.2725472529251766, 'batch_norm': True, 'lr': 0.0004249313915727476, 'weight_decay': 0.0003122130440905819, 'epochs': 22, 'loss': 'mse', 'optimizer': 'adam', 'graph_mode': 'knn', 'source': 'grm', 'knn_k': 6, 'weighted_edges': False, 'symmetrize_mode': 'mutual', 'use_snp_selection': False}. Best is trial 11 with value: 0.1282886373815262.
[I 2025-11-03 13:57:18,294] Trial 121 finished with value: 0.09881233827295019 and parameters: {'model_type': 'gcn', 'hidden_dims': '[512, 256]', 'dropout': 0.2844207876317226, 'batch_norm': True, 'lr': 0.0006340867658318358, 'weight_decay': 3.072468036940639e-05, 'epochs': 68, 'loss': 'mse', 'optimizer': 'adam', 'graph_mode': 'knn', 'source': 'grm', 'knn_k': 7, 'weighted_edges': False, 'symmetrize_mode': 'mutual', 'use_snp_selection': False}. Best is trial 11 with value: 0.1282886373815262.
[I 2025-11-03 13:57:19,967] Trial 122 finished with value: 0.1053968315780014 and parameters: {'model_type': 'gcn', 'hidden_dims': '[512, 256]', 'dropout': 0.21331394258609893, 'batch_norm': True, 'lr': 0.0007174745911063293, 'weight_decay': 2.445588532315429e-05, 'epochs': 84, 'loss': 'mse', 'optimizer': 'adam', 'graph_mode': 'knn', 'source': 'grm', 'knn_k': 5, 'weighted_edges': False, 'symmetrize_mode': 'mutual', 'use_snp_selection': False}. Best is trial 11 with value: 0.1282886373815262.
[I 2025-11-03 13:57:21,384] Trial 123 finished with value: 0.11718379887224989 and parameters: {'model_type': 'gcn', 'hidden_dims': '[512, 256]', 'dropout': 0.5231384868244945, 'batch_norm': True, 'lr': 0.0009949502553099777, 'weight_decay': 0.0001383009473912087, 'epochs': 32, 'loss': 'mse', 'optimizer': 'adam', 'graph_mode': 'knn', 'source': 'grm', 'knn_k': 6, 'weighted_edges': False, 'symmetrize_mode': 'mutual', 'use_snp_selection': False}. Best is trial 11 with value: 0.1282886373815262.
[I 2025-11-03 13:57:22,908] Trial 124 finished with value: 0.11438595577713391 and parameters: {'model_type': 'gcn', 'hidden_dims': '[512, 256]', 'dropout': 0.5448977822493372, 'batch_norm': True, 'lr': 0.0009276290340504839, 'weight_decay': 0.00013917656784823794, 'epochs': 53, 'loss': 'mse', 'optimizer': 'adam', 'graph_mode': 'knn', 'source': 'grm', 'knn_k': 6, 'weighted_edges': False, 'symmetrize_mode': 'mutual', 'use_snp_selection': False}. Best is trial 11 with value: 0.1282886373815262.
[I 2025-11-03 13:57:24,326] Trial 125 finished with value: 0.10728695908049825 and parameters: {'model_type': 'gcn', 'hidden_dims': '[512, 256]', 'dropout': 0.5681200385903069, 'batch_norm': True, 'lr': 0.0008152997585501211, 'weight_decay': 7.63600815597959e-05, 'epochs': 30, 'loss': 'mse', 'optimizer': 'adam', 'graph_mode': 'knn', 'source': 'grm', 'knn_k': 6, 'weighted_edges': False, 'symmetrize_mode': 'mutual', 'use_snp_selection': False}. Best is trial 11 with value: 0.1282886373815262.
[I 2025-11-03 13:57:25,650] Trial 126 finished with value: -0.022512759244374868 and parameters: {'model_type': 'gcn', 'hidden_dims': '[512, 256]', 'dropout': 0.293620231998851, 'batch_norm': True, 'lr': 1.0013725580650348e-06, 'weight_decay': 0.00023427509694001725, 'epochs': 11, 'loss': 'mse', 'optimizer': 'adam', 'graph_mode': 'knn', 'source': 'grm', 'knn_k': 6, 'weighted_edges': False, 'symmetrize_mode': 'mutual', 'use_snp_selection': False}. Best is trial 11 with value: 0.1282886373815262.
[I 2025-11-03 13:57:27,142] Trial 127 finished with value: 0.10298694808012956 and parameters: {'model_type': 'gcn', 'hidden_dims': '[512, 256]', 'dropout': 0.5246391657892294, 'batch_norm': True, 'lr': 0.0005714189138017286, 'weight_decay': 9.351109750834925e-05, 'epochs': 39, 'loss': 'mse', 'optimizer': 'adam', 'graph_mode': 'knn', 'source': 'grm', 'knn_k': 7, 'weighted_edges': True, 'symmetrize_mode': 'mutual', 'use_snp_selection': False}. Best is trial 11 with value: 0.1282886373815262.
[I 2025-11-03 13:57:28,891] Trial 128 finished with value: 0.028106931550708036 and parameters: {'model_type': 'gcn', 'hidden_dims': '[512, 256]', 'dropout': 0.49415441921758174, 'batch_norm': False, 'lr': 0.0006406482125084743, 'weight_decay': 6.358965328012129e-05, 'epochs': 58, 'loss': 'mae', 'optimizer': 'adam', 'graph_mode': 'knn', 'source': 'grm', 'knn_k': 6, 'weighted_edges': False, 'symmetrize_mode': 'mutual', 'use_snp_selection': True, 'num_snps': 23993}. Best is trial 11 with value: 0.1282886373815262.
[I 2025-11-03 13:57:30,326] Trial 129 finished with value: 0.02059593928897375 and parameters: {'model_type': 'gcn', 'hidden_dims': '[512, 256]', 'dropout': 0.5539229430535954, 'batch_norm': True, 'lr': 7.362568323593476e-05, 'weight_decay': 0.00015241771356004866, 'epochs': 30, 'loss': 'mse', 'optimizer': 'adam', 'graph_mode': 'knn', 'source': 'grm', 'knn_k': 5, 'weighted_edges': False, 'symmetrize_mode': 'union', 'use_snp_selection': False}. Best is trial 11 with value: 0.1282886373815262.
[I 2025-11-03 13:57:31,962] Trial 130 finished with value: 0.08455911556130133 and parameters: {'model_type': 'gcn', 'hidden_dims': '[512, 256]', 'dropout': 0.5826360943146094, 'batch_norm': True, 'lr': 0.0004853449493264433, 'weight_decay': 3.6337611725907425e-05, 'epochs': 75, 'loss': 'mse', 'optimizer': 'adam', 'graph_mode': 'knn', 'source': 'grm', 'knn_k': 4, 'weighted_edges': False, 'symmetrize_mode': 'mutual', 'use_snp_selection': False}. Best is trial 11 with value: 0.1282886373815262.
[I 2025-11-03 13:57:33,554] Trial 131 finished with value: 0.09841385540319976 and parameters: {'model_type': 'gcn', 'hidden_dims': '[512, 256]', 'dropout': 0.5979243427892977, 'batch_norm': True, 'lr': 0.0007443227831777701, 'weight_decay': 4.3655850594010226e-05, 'epochs': 66, 'loss': 'mse', 'optimizer': 'adam', 'graph_mode': 'knn', 'source': 'grm', 'knn_k': 8, 'weighted_edges': False, 'symmetrize_mode': 'mutual', 'use_snp_selection': False}. Best is trial 11 with value: 0.1282886373815262.
[I 2025-11-03 13:57:35,560] Trial 132 finished with value: 0.120341040923958 and parameters: {'model_type': 'gcn', 'hidden_dims': '[512, 256]', 'dropout': 0.2719200149532842, 'batch_norm': True, 'lr': 0.000883580174052333, 'weight_decay': 0.0002363012840651987, 'epochs': 152, 'loss': 'mse', 'optimizer': 'adam', 'graph_mode': 'knn', 'source': 'grm', 'knn_k': 7, 'weighted_edges': False, 'symmetrize_mode': 'mutual', 'use_snp_selection': False}. Best is trial 11 with value: 0.1282886373815262.
[I 2025-11-03 13:57:37,552] Trial 133 finished with value: 0.1268937471023273 and parameters: {'model_type': 'gcn', 'hidden_dims': '[512, 256]', 'dropout': 0.2690611734946411, 'batch_norm': True, 'lr': 0.0008609152500419271, 'weight_decay': 0.00029848356895724205, 'epochs': 151, 'loss': 'mse', 'optimizer': 'adam', 'graph_mode': 'knn', 'source': 'grm', 'knn_k': 7, 'weighted_edges': False, 'symmetrize_mode': 'mutual', 'use_snp_selection': False}. Best is trial 11 with value: 0.1282886373815262.
[I 2025-11-03 13:57:39,547] Trial 134 finished with value: 0.11590157169748307 and parameters: {'model_type': 'gcn', 'hidden_dims': '[512, 256]', 'dropout': 0.2639752619358654, 'batch_norm': True, 'lr': 0.000972202482796187, 'weight_decay': 0.0003729670391692088, 'epochs': 151, 'loss': 'mse', 'optimizer': 'adam', 'graph_mode': 'knn', 'source': 'grm', 'knn_k': 7, 'weighted_edges': False, 'symmetrize_mode': 'mutual', 'use_snp_selection': False}. Best is trial 11 with value: 0.1282886373815262.
[I 2025-11-03 13:57:41,604] Trial 135 finished with value: 0.11552995980636112 and parameters: {'model_type': 'gcn', 'hidden_dims': '[512, 256]', 'dropout': 0.24760921492662907, 'batch_norm': True, 'lr': 0.0008237736057092758, 'weight_decay': 0.0002753376783649379, 'epochs': 164, 'loss': 'mse', 'optimizer': 'adam', 'graph_mode': 'knn', 'source': 'grm', 'knn_k': 7, 'weighted_edges': False, 'symmetrize_mode': 'mutual', 'use_snp_selection': False}. Best is trial 11 with value: 0.1282886373815262.
[I 2025-11-03 13:57:43,624] Trial 136 finished with value: 0.12796892926950068 and parameters: {'model_type': 'gcn', 'hidden_dims': '[512, 128]', 'dropout': 0.2701523065868837, 'batch_norm': True, 'lr': 0.0008582253167721134, 'weight_decay': 0.0002609694707962421, 'epochs': 158, 'loss': 'mse', 'optimizer': 'adam', 'graph_mode': 'knn', 'source': 'grm', 'knn_k': 6, 'weighted_edges': False, 'symmetrize_mode': 'mutual', 'use_snp_selection': False}. Best is trial 11 with value: 0.1282886373815262.
[I 2025-11-03 13:57:45,260] Trial 137 finished with value: 0.113892295360683 and parameters: {'model_type': 'gcn', 'hidden_dims': '[256, 128]', 'dropout': 0.27330756923223354, 'batch_norm': True, 'lr': 0.0005442006759196676, 'weight_decay': 0.0005419050738360533, 'epochs': 159, 'loss': 'mse', 'optimizer': 'adam', 'graph_mode': 'knn', 'source': 'grm', 'knn_k': 7, 'weighted_edges': False, 'symmetrize_mode': 'mutual', 'use_snp_selection': False}. Best is trial 11 with value: 0.1282886373815262.
[I 2025-11-03 13:57:47,413] Trial 138 finished with value: 0.07591985683388552 and parameters: {'model_type': 'gcn', 'hidden_dims': '[512, 128]', 'dropout': 0.23319745979121195, 'batch_norm': True, 'lr': 0.0001024473759950057, 'weight_decay': 0.0004290286394360197, 'epochs': 182, 'loss': 'mse', 'optimizer': 'adam', 'graph_mode': 'knn', 'source': 'grm', 'knn_k': 10, 'weighted_edges': True, 'symmetrize_mode': 'mutual', 'use_snp_selection': False}. Best is trial 11 with value: 0.1282886373815262.
[I 2025-11-03 13:57:49,369] Trial 139 finished with value: 0.10783472118307016 and parameters: {'model_type': 'gcn', 'hidden_dims': '[512, 128]', 'dropout': 0.25289948367389065, 'batch_norm': True, 'lr': 0.0008476875816507706, 'weight_decay': 0.000359690469479395, 'epochs': 144, 'loss': 'mse', 'optimizer': 'adam', 'graph_mode': 'knn', 'source': 'grm', 'knn_k': 6, 'weighted_edges': False, 'symmetrize_mode': 'mutual', 'use_snp_selection': False}. Best is trial 11 with value: 0.1282886373815262.
[I 2025-11-03 13:57:51,382] Trial 140 finished with value: -0.01872405790973092 and parameters: {'model_type': 'gcn', 'hidden_dims': '[512, 128]', 'dropout': 0.3068399671066702, 'batch_norm': True, 'lr': 0.0006440940684773321, 'weight_decay': 0.0002795780613882822, 'epochs': 155, 'loss': 'mse', 'optimizer': 'adam', 'graph_mode': 'knn', 'source': 'grm', 'knn_k': 7, 'weighted_edges': False, 'symmetrize_mode': 'union', 'use_snp_selection': False}. Best is trial 11 with value: 0.1282886373815262.
[I 2025-11-03 13:57:53,477] Trial 141 finished with value: 0.11517772897503395 and parameters: {'model_type': 'gcn', 'hidden_dims': '[512, 128]', 'dropout': 0.263225117294442, 'batch_norm': True, 'lr': 0.00097757391572418, 'weight_decay': 0.0002460122458989406, 'epochs': 173, 'loss': 'mse', 'optimizer': 'adam', 'graph_mode': 'knn', 'source': 'grm', 'knn_k': 6, 'weighted_edges': False, 'symmetrize_mode': 'mutual', 'use_snp_selection': False}. Best is trial 11 with value: 0.1282886373815262.
[I 2025-11-03 13:57:55,455] Trial 142 finished with value: 0.10582882712144391 and parameters: {'model_type': 'gcn', 'hidden_dims': '[512, 256]', 'dropout': 0.29088575428478786, 'batch_norm': True, 'lr': 0.0007056874939539279, 'weight_decay': 0.0002118286825742923, 'epochs': 148, 'loss': 'mse', 'optimizer': 'adam', 'graph_mode': 'knn', 'source': 'grm', 'knn_k': 6, 'weighted_edges': False, 'symmetrize_mode': 'mutual', 'use_snp_selection': False}. Best is trial 11 with value: 0.1282886373815262.
[I 2025-11-03 13:57:57,370] Trial 143 finished with value: 0.1257258459149012 and parameters: {'model_type': 'gcn', 'hidden_dims': '[512, 256]', 'dropout': 0.26498340604991055, 'batch_norm': True, 'lr': 0.000831850499810785, 'weight_decay': 0.00013093677015589208, 'epochs': 135, 'loss': 'mse', 'optimizer': 'adam', 'graph_mode': 'knn', 'source': 'grm', 'knn_k': 6, 'weighted_edges': False, 'symmetrize_mode': 'mutual', 'use_snp_selection': False}. Best is trial 11 with value: 0.1282886373815262.
[I 2025-11-03 13:57:59,324] Trial 144 finished with value: 0.10673979908964804 and parameters: {'model_type': 'gcn', 'hidden_dims': '[512, 256]', 'dropout': 0.2686142447503002, 'batch_norm': True, 'lr': 0.0008258485763028412, 'weight_decay': 0.0001746309850833629, 'epochs': 141, 'loss': 'mse', 'optimizer': 'adam', 'graph_mode': 'knn', 'source': 'grm', 'knn_k': 5, 'weighted_edges': False, 'symmetrize_mode': 'mutual', 'use_snp_selection': False}. Best is trial 11 with value: 0.1282886373815262.
[I 2025-11-03 13:58:01,022] Trial 145 finished with value: 0.08766196312156056 and parameters: {'model_type': 'gcn', 'hidden_dims': '[256, 128, 64]', 'dropout': 0.27830355098359655, 'batch_norm': True, 'lr': 0.0006136065786448205, 'weight_decay': 0.0005025429010120615, 'epochs': 138, 'loss': 'mse', 'optimizer': 'adam', 'graph_mode': 'knn', 'source': 'grm', 'knn_k': 9, 'weighted_edges': False, 'symmetrize_mode': 'mutual', 'use_snp_selection': False}. Best is trial 11 with value: 0.1282886373815262.
[I 2025-11-03 13:58:02,879] Trial 146 finished with value: 0.11783626012451474 and parameters: {'model_type': 'gcn', 'hidden_dims': '[512, 256]', 'dropout': 0.2508625801558368, 'batch_norm': True, 'lr': 0.0007344334220968349, 'weight_decay': 0.00012046688043070929, 'epochs': 123, 'loss': 'mse', 'optimizer': 'adam', 'graph_mode': 'knn', 'source': 'grm', 'knn_k': 6, 'weighted_edges': False, 'symmetrize_mode': 'mutual', 'use_snp_selection': False}. Best is trial 11 with value: 0.1282886373815262.
[I 2025-11-03 13:58:04,740] Trial 147 finished with value: 0.13167818544689694 and parameters: {'model_type': 'gcn', 'hidden_dims': '[512, 256]', 'dropout': 0.24914632971650552, 'batch_norm': True, 'lr': 0.0007755634902626655, 'weight_decay': 0.00018117503138493526, 'epochs': 124, 'loss': 'mse', 'optimizer': 'adam', 'graph_mode': 'knn', 'source': 'grm', 'knn_k': 6, 'weighted_edges': False, 'symmetrize_mode': 'mutual', 'use_snp_selection': False}. Best is trial 147 with value: 0.13167818544689694.
[I 2025-11-03 13:58:06,585] Trial 148 finished with value: 0.1400873934416444 and parameters: {'model_type': 'gcn', 'hidden_dims': '[512, 128]', 'dropout': 0.239120310144953, 'batch_norm': True, 'lr': 0.000814967735013068, 'weight_decay': 0.00011957643707363338, 'epochs': 120, 'loss': 'mse', 'optimizer': 'adam', 'graph_mode': 'knn', 'source': 'grm', 'knn_k': 6, 'weighted_edges': False, 'symmetrize_mode': 'mutual', 'use_snp_selection': False}. Best is trial 148 with value: 0.1400873934416444.
