[I 2025-11-03 12:37:50,148] Trial 107 finished with value: 0.027844012911750125 and parameters: {'model_type': 'gcn', 'hidden_dims': '[128, 64]', 'dropout': 0.43001554751024584, 'batch_norm': True, 'lr': 0.00016879926234106122, 'weight_decay': 3.6798001810255086e-07, 'epochs': 294, 'loss': 'mae', 'optimizer': 'adam', 'graph_mode': 'off', 'use_snp_selection': False}. Best is trial 95 with value: 0.06935101396569539.
[I 2025-11-03 12:37:52,566] Trial 108 finished with value: 0.04521320763873489 and parameters: {'model_type': 'gcn', 'hidden_dims': '[512, 128]', 'dropout': 0.3779127062781991, 'batch_norm': True, 'lr': 9.251627144599182e-05, 'weight_decay': 2.7181963764539407e-07, 'epochs': 349, 'loss': 'mse', 'optimizer': 'adam', 'graph_mode': 'off', 'use_snp_selection': True, 'num_snps': 34752}. Best is trial 95 with value: 0.06935101396569539.
[I 2025-11-03 12:37:53,529] Trial 109 finished with value: 0.054469358625727514 and parameters: {'model_type': 'gcn', 'hidden_dims': '[256, 128]', 'dropout': 0.36220205279140383, 'batch_norm': True, 'lr': 0.0003256196034007911, 'weight_decay': 2.1370196655177677e-07, 'epochs': 90, 'loss': 'mse', 'optimizer': 'adam', 'graph_mode': 'off', 'use_snp_selection': False}. Best is trial 95 with value: 0.06935101396569539.
[I 2025-11-03 12:37:55,586] Trial 110 finished with value: 0.02092825375185604 and parameters: {'model_type': 'gcn', 'hidden_dims': '[256, 128, 64]', 'dropout': 0.15775237564751782, 'batch_norm': True, 'lr': 7.353928854120903e-05, 'weight_decay': 1.5194407182563972e-07, 'epochs': 313, 'loss': 'mae', 'optimizer': 'adam', 'graph_mode': 'off', 'use_snp_selection': False}. Best is trial 95 with value: 0.06935101396569539.
[I 2025-11-03 12:37:58,155] Trial 111 finished with value: 0.003405909705656988 and parameters: {'model_type': 'gcn', 'hidden_dims': '[512, 128]', 'dropout': 0.34272101148148976, 'batch_norm': True, 'lr': 4.7906224249763193e-05, 'weight_decay': 1.5062116044658166e-07, 'epochs': 331, 'loss': 'mse', 'optimizer': 'adam', 'graph_mode': 'off', 'use_snp_selection': False}. Best is trial 95 with value: 0.06935101396569539.
[I 2025-11-03 12:38:00,240] Trial 112 finished with value: 0.009222299435709362 and parameters: {'model_type': 'gcn', 'hidden_dims': '[512, 128]', 'dropout': 0.407602191779556, 'batch_norm': True, 'lr': 5.2450533590328526e-05, 'weight_decay': 1.0177046208558308e-07, 'epochs': 240, 'loss': 'mse', 'optimizer': 'adam', 'graph_mode': 'off', 'use_snp_selection': False}. Best is trial 95 with value: 0.06935101396569539.
[I 2025-11-03 12:38:02,814] Trial 113 finished with value: 0.048516947787688246 and parameters: {'model_type': 'gcn', 'hidden_dims': '[512, 128]', 'dropout': 0.3153650148069439, 'batch_norm': True, 'lr': 5.627638777623584e-05, 'weight_decay': 1.3561308631007778e-07, 'epochs': 337, 'loss': 'mse', 'optimizer': 'adam', 'graph_mode': 'off', 'use_snp_selection': False}. Best is trial 95 with value: 0.06935101396569539.
[I 2025-11-03 12:38:05,447] Trial 114 finished with value: 0.010746613377279382 and parameters: {'model_type': 'gcn', 'hidden_dims': '[512, 128]', 'dropout': 0.35439444007922355, 'batch_norm': True, 'lr': 2.7271226553480457e-05, 'weight_decay': 3.1837937205705097e-07, 'epochs': 342, 'loss': 'mse', 'optimizer': 'adam', 'graph_mode': 'off', 'use_snp_selection': False}. Best is trial 95 with value: 0.06935101396569539.
[I 2025-11-03 12:38:06,441] Trial 115 finished with value: 0.031178111668908055 and parameters: {'model_type': 'gcn', 'hidden_dims': '[128, 64]', 'dropout': 0.34963016353341103, 'batch_norm': True, 'lr': 0.0002119335464727116, 'weight_decay': 4.905045306778416e-07, 'epochs': 186, 'loss': 'mse', 'optimizer': 'adam', 'graph_mode': 'off', 'use_snp_selection': False}. Best is trial 95 with value: 0.06935101396569539.
[I 2025-11-03 12:38:07,894] Trial 116 finished with value: 0.025268428785079677 and parameters: {'model_type': 'gcn', 'hidden_dims': '[512, 256]', 'dropout': 0.297840862199134, 'batch_norm': False, 'lr': 3.2384162099291984e-05, 'weight_decay': 1.0065886571981018e-06, 'epochs': 129, 'loss': 'mse', 'optimizer': 'adam', 'graph_mode': 'off', 'use_snp_selection': False}. Best is trial 95 with value: 0.06935101396569539.
[I 2025-11-03 12:38:09,486] Trial 117 finished with value: 0.04976820653755123 and parameters: {'model_type': 'gcn', 'hidden_dims': '[512, 128]', 'dropout': 0.45720356919935445, 'batch_norm': True, 'lr': 0.0005573483670415866, 'weight_decay': 1.7850485175645107e-07, 'epochs': 331, 'loss': 'mse', 'optimizer': 'adam', 'graph_mode': 'off', 'use_snp_selection': True, 'num_snps': 14900}. Best is trial 95 with value: 0.06935101396569539.
[I 2025-11-03 12:38:10,149] Trial 118 finished with value: 0.006234139763132463 and parameters: {'model_type': 'gcn', 'hidden_dims': '[128, 64]', 'dropout': 0.20212542895680338, 'batch_norm': True, 'lr': 2.261423595108197e-05, 'weight_decay': 7.684475467581258e-07, 'epochs': 51, 'loss': 'mse', 'optimizer': 'adam', 'graph_mode': 'off', 'use_snp_selection': False}. Best is trial 95 with value: 0.06935101396569539.
[I 2025-11-03 12:38:10,840] Trial 119 finished with value: 0.021133666322424104 and parameters: {'model_type': 'gcn', 'hidden_dims': '[128, 64]', 'dropout': 0.3897980203434112, 'batch_norm': True, 'lr': 7.986279158740565e-05, 'weight_decay': 2.447432312413472e-07, 'epochs': 60, 'loss': 'mae', 'optimizer': 'adam', 'graph_mode': 'off', 'use_snp_selection': False}. Best is trial 95 with value: 0.06935101396569539.
[I 2025-11-03 12:38:13,006] Trial 120 finished with value: 0.04370266075812711 and parameters: {'model_type': 'gcn', 'hidden_dims': '[512, 256]', 'dropout': 0.1715875539593251, 'batch_norm': True, 'lr': 0.0002663699267196472, 'weight_decay': 5.929520926113874e-07, 'epochs': 257, 'loss': 'mse', 'optimizer': 'adam', 'graph_mode': 'off', 'use_snp_selection': False}. Best is trial 95 with value: 0.06935101396569539.
[I 2025-11-03 12:38:14,740] Trial 121 finished with value: 0.04321268490416842 and parameters: {'model_type': 'gcn', 'hidden_dims': '[256, 128]', 'dropout': 0.24431249887694756, 'batch_norm': True, 'lr': 0.00012576928761327526, 'weight_decay': 1.6319715521751982e-07, 'epochs': 302, 'loss': 'mae', 'optimizer': 'adam', 'graph_mode': 'off', 'use_snp_selection': False}. Best is trial 95 with value: 0.06935101396569539.
[I 2025-11-03 12:38:15,509] Trial 122 finished with value: 0.06774932919986419 and parameters: {'model_type': 'gcn', 'hidden_dims': '[256, 128]', 'dropout': 0.22403353265296935, 'batch_norm': True, 'lr': 0.00011332148852128813, 'weight_decay': 1.1734562081422572e-07, 'epochs': 43, 'loss': 'mae', 'optimizer': 'adam', 'graph_mode': 'off', 'use_snp_selection': False}. Best is trial 95 with value: 0.06935101396569539.
[I 2025-11-03 12:38:16,322] Trial 123 finished with value: 0.05333048041718864 and parameters: {'model_type': 'gcn', 'hidden_dims': '[256, 128]', 'dropout': 0.3261171577904615, 'batch_norm': True, 'lr': 0.00010528145518490805, 'weight_decay': 2.0207358454045158e-07, 'epochs': 44, 'loss': 'mae', 'optimizer': 'adam', 'graph_mode': 'off', 'use_snp_selection': False}. Best is trial 95 with value: 0.06935101396569539.
[I 2025-11-03 12:38:17,206] Trial 124 finished with value: 0.04552543915842168 and parameters: {'model_type': 'gcn', 'hidden_dims': '[256, 128]', 'dropout': 0.22839657864186003, 'batch_norm': True, 'lr': 0.00015205050674031866, 'weight_decay': 1.1953409701974825e-07, 'epochs': 70, 'loss': 'mae', 'optimizer': 'adam', 'graph_mode': 'off', 'use_snp_selection': False}. Best is trial 95 with value: 0.06935101396569539.
[I 2025-11-03 12:38:17,976] Trial 125 finished with value: 0.05017519767274936 and parameters: {'model_type': 'gcn', 'hidden_dims': '[256, 128]', 'dropout': 0.1321570412608729, 'batch_norm': True, 'lr': 3.8836978538097786e-05, 'weight_decay': 1.3047096825857454e-07, 'epochs': 40, 'loss': 'mae', 'optimizer': 'adam', 'graph_mode': 'off', 'use_snp_selection': False}. Best is trial 95 with value: 0.06935101396569539.
[I 2025-11-03 12:38:19,840] Trial 126 finished with value: 0.031622285459010684 and parameters: {'model_type': 'gcn', 'hidden_dims': '[512, 64]', 'dropout': 0.14460248598642592, 'batch_norm': False, 'lr': 6.719975903422387e-05, 'weight_decay': 4.058255628895933e-07, 'epochs': 322, 'loss': 'mae', 'optimizer': 'adam', 'graph_mode': 'off', 'use_snp_selection': True, 'num_snps': 22835}. Best is trial 95 with value: 0.06935101396569539.
[I 2025-11-03 12:38:20,937] Trial 127 finished with value: 0.00916062808730221 and parameters: {'model_type': 'gcn', 'hidden_dims': '[512, 128]', 'dropout': 0.3640829436138033, 'batch_norm': True, 'lr': 0.00037814070217432477, 'weight_decay': 3.191261204231317e-07, 'epochs': 57, 'loss': 'mse', 'optimizer': 'adam', 'graph_mode': 'off', 'use_snp_selection': False}. Best is trial 95 with value: 0.06935101396569539.
[I 2025-11-03 12:38:21,897] Trial 128 finished with value: 0.041598031551764794 and parameters: {'model_type': 'gcn', 'hidden_dims': '[256, 128, 64]', 'dropout': 0.11737609813523235, 'batch_norm': True, 'lr': 0.00018911339495709627, 'weight_decay': 2.5445236909223517e-06, 'epochs': 75, 'loss': 'mse', 'optimizer': 'adam', 'graph_mode': 'off', 'use_snp_selection': False}. Best is trial 95 with value: 0.06935101396569539.
[I 2025-11-03 12:38:22,558] Trial 129 finished with value: 0.05700889366428996 and parameters: {'model_type': 'gcn', 'hidden_dims': '[128, 64]', 'dropout': 0.19897579610688787, 'batch_norm': True, 'lr': 0.00045198556683533964, 'weight_decay': 1.0174295408203538e-07, 'epochs': 51, 'loss': 'mse', 'optimizer': 'adam', 'graph_mode': 'off', 'use_snp_selection': False}. Best is trial 95 with value: 0.06935101396569539.
[I 2025-11-03 12:38:23,691] Trial 130 finished with value: 0.05301380751203597 and parameters: {'model_type': 'gcn', 'hidden_dims': '[128, 64]', 'dropout': 0.10121165673303745, 'batch_norm': True, 'lr': 0.00034077196413303683, 'weight_decay': 2.077895416692818e-07, 'epochs': 247, 'loss': 'mae', 'optimizer': 'adam', 'graph_mode': 'off', 'use_snp_selection': True, 'num_snps': 6598}. Best is trial 95 with value: 0.06935101396569539.
[I 2025-11-03 12:38:25,267] Trial 131 finished with value: 0.042544868746571145 and parameters: {'model_type': 'gcn', 'hidden_dims': '[256, 128]', 'dropout': 0.2553179168216195, 'batch_norm': True, 'lr': 0.00010984095631666018, 'weight_decay': 1.3664471415979545e-07, 'epochs': 265, 'loss': 'mae', 'optimizer': 'adam', 'graph_mode': 'off', 'use_snp_selection': False}. Best is trial 95 with value: 0.06935101396569539.
[I 2025-11-03 12:38:26,738] Trial 132 finished with value: 0.03356812490101189 and parameters: {'model_type': 'gcn', 'hidden_dims': '[256, 128]', 'dropout': 0.219260571213823, 'batch_norm': True, 'lr': 0.00012241161612051624, 'weight_decay': 1.1626787884021826e-07, 'epochs': 231, 'loss': 'mae', 'optimizer': 'adam', 'graph_mode': 'off', 'use_snp_selection': False}. Best is trial 95 with value: 0.06935101396569539.
[I 2025-11-03 12:38:28,128] Trial 133 finished with value: 0.045852606831098104 and parameters: {'model_type': 'gcn', 'hidden_dims': '[256, 128]', 'dropout': 0.271096466790571, 'batch_norm': True, 'lr': 0.000218264132526314, 'weight_decay': 1.633455926089417e-07, 'epochs': 215, 'loss': 'mae', 'optimizer': 'adam', 'graph_mode': 'off', 'use_snp_selection': False}. Best is trial 95 with value: 0.06935101396569539.
[I 2025-11-03 12:38:29,325] Trial 134 finished with value: 0.03817662650784816 and parameters: {'model_type': 'gcn', 'hidden_dims': '[256, 128]', 'dropout': 0.28290215930374024, 'batch_norm': True, 'lr': 0.0001626648808366851, 'weight_decay': 1.0057543773153035e-07, 'epochs': 161, 'loss': 'mae', 'optimizer': 'adam', 'graph_mode': 'off', 'use_snp_selection': False}. Best is trial 95 with value: 0.06935101396569539.
[I 2025-11-03 12:38:30,379] Trial 135 finished with value: 0.061865887797366154 and parameters: {'model_type': 'gcn', 'hidden_dims': '[512, 256]', 'dropout': 0.1877081780401016, 'batch_norm': True, 'lr': 9.565272642078554e-05, 'weight_decay': 3.345412161610561e-05, 'epochs': 60, 'loss': 'mse', 'optimizer': 'adam', 'graph_mode': 'off', 'use_snp_selection': False}. Best is trial 95 with value: 0.06935101396569539.
[I 2025-11-03 12:38:31,477] Trial 136 finished with value: 0.023310416617758668 and parameters: {'model_type': 'gcn', 'hidden_dims': '[512, 256]', 'dropout': 0.18470874038357668, 'batch_norm': True, 'lr': 5.659528739256651e-05, 'weight_decay': 2.561600698001665e-07, 'epochs': 64, 'loss': 'mse', 'optimizer': 'adam', 'graph_mode': 'off', 'use_snp_selection': False}. Best is trial 95 with value: 0.06935101396569539.
[I 2025-11-03 12:38:32,703] Trial 137 finished with value: 0.0004838026113155067 and parameters: {'model_type': 'gcn', 'hidden_dims': '[512, 256]', 'dropout': 0.16670754436917276, 'batch_norm': False, 'lr': 7.118369987423319e-05, 'weight_decay': 2.242950062682312e-05, 'epochs': 83, 'loss': 'mse', 'optimizer': 'adam', 'graph_mode': 'off', 'use_snp_selection': False}. Best is trial 95 with value: 0.06935101396569539.
[I 2025-11-03 12:38:33,737] Trial 138 finished with value: 0.031160469743477068 and parameters: {'model_type': 'gcn', 'hidden_dims': '[512, 256]', 'dropout': 0.15226996355772407, 'batch_norm': True, 'lr': 9.024176508026053e-05, 'weight_decay': 9.730960058660626e-05, 'epochs': 44, 'loss': 'mse', 'optimizer': 'adam', 'graph_mode': 'off', 'use_snp_selection': False}. Best is trial 95 with value: 0.06935101396569539.
[I 2025-11-03 12:38:35,050] Trial 139 finished with value: 0.045504491675244986 and parameters: {'model_type': 'gcn', 'hidden_dims': '[512, 256]', 'dropout': 0.18005341840794342, 'batch_norm': True, 'lr': 0.00013606288923507612, 'weight_decay': 4.6083292127935976e-05, 'epochs': 100, 'loss': 'mse', 'optimizer': 'adam', 'graph_mode': 'off', 'use_snp_selection': False}. Best is trial 95 with value: 0.06935101396569539.
[I 2025-11-03 12:38:36,652] Trial 140 finished with value: 0.041832984157091156 and parameters: {'model_type': 'gcn', 'hidden_dims': '[512, 128]', 'dropout': 0.2077183281397525, 'batch_norm': True, 'lr': 4.339843045221471e-05, 'weight_decay': 7.775882939438254e-06, 'epochs': 91, 'loss': 'mse', 'optimizer': 'adam', 'graph_mode': 'off', 'use_snp_selection': True, 'num_snps': 38669}. Best is trial 95 with value: 0.06935101396569539.
[I 2025-11-03 12:38:37,338] Trial 141 finished with value: 0.0394513917306015 and parameters: {'model_type': 'gcn', 'hidden_dims': '[128, 64]', 'dropout': 0.18891223952734837, 'batch_norm': True, 'lr': 0.00010011690021142151, 'weight_decay': 0.00027262768557095624, 'epochs': 59, 'loss': 'mse', 'optimizer': 'adam', 'graph_mode': 'off', 'use_snp_selection': False}. Best is trial 95 with value: 0.06935101396569539.
[I 2025-11-03 12:38:39,218] Trial 142 finished with value: 0.05742784176969816 and parameters: {'model_type': 'gcn', 'hidden_dims': '[512, 256]', 'dropout': 0.2135283447223456, 'batch_norm': True, 'lr': 0.00018592725102031205, 'weight_decay': 3.669943434716652e-07, 'epochs': 205, 'loss': 'mae', 'optimizer': 'adam', 'graph_mode': 'off', 'use_snp_selection': False}. Best is trial 95 with value: 0.06935101396569539.
[I 2025-11-03 12:38:40,329] Trial 143 finished with value: 0.04857360682732793 and parameters: {'model_type': 'gcn', 'hidden_dims': '[512, 256]', 'dropout': 0.21461108655781258, 'batch_norm': True, 'lr': 0.0001686410387037048, 'weight_decay': 4.541235816280075e-07, 'epochs': 55, 'loss': 'mse', 'optimizer': 'adam', 'graph_mode': 'off', 'use_snp_selection': False}. Best is trial 95 with value: 0.06935101396569539.
[I 2025-11-03 12:38:41,497] Trial 144 finished with value: 0.048020902159506725 and parameters: {'model_type': 'gcn', 'hidden_dims': '[512, 256]', 'dropout': 0.3746229095078938, 'batch_norm': True, 'lr': 0.0002744228114945284, 'weight_decay': 3.634309615812225e-07, 'epochs': 71, 'loss': 'mae', 'optimizer': 'adam', 'graph_mode': 'off', 'use_snp_selection': False}. Best is trial 95 with value: 0.06935101396569539.
[I 2025-11-03 12:38:42,604] Trial 145 finished with value: 0.04362803083020648 and parameters: {'model_type': 'gcn', 'hidden_dims': '[512, 256]', 'dropout': 0.19311102574227762, 'batch_norm': True, 'lr': 0.00019295664681436348, 'weight_decay': 1.3166190250485115e-05, 'epochs': 66, 'loss': 'mse', 'optimizer': 'adam', 'graph_mode': 'off', 'use_snp_selection': False}. Best is trial 95 with value: 0.06935101396569539.
[I 2025-11-03 12:38:44,486] Trial 146 finished with value: 0.0317505039342567 and parameters: {'model_type': 'gcn', 'hidden_dims': '[512, 256]', 'dropout': 0.23827142689744393, 'batch_norm': True, 'lr': 0.000238554127019014, 'weight_decay': 5.392594768510463e-07, 'epochs': 208, 'loss': 'mse', 'optimizer': 'adam', 'graph_mode': 'off', 'use_snp_selection': False}. Best is trial 95 with value: 0.06935101396569539.
[I 2025-11-03 12:38:46,517] Trial 147 finished with value: 0.06144156346149795 and parameters: {'model_type': 'gcn', 'hidden_dims': '[256, 128, 64]', 'dropout': 0.17023163616612838, 'batch_norm': True, 'lr': 0.00030102029713942736, 'weight_decay': 6.804788749970679e-07, 'epochs': 318, 'loss': 'mse', 'optimizer': 'adam', 'graph_mode': 'off', 'use_snp_selection': False}. Best is trial 95 with value: 0.06935101396569539.
[I 2025-11-03 12:38:47,866] Trial 148 finished with value: 0.034165532423570934 and parameters: {'model_type': 'gcn', 'hidden_dims': '[128, 64]', 'dropout': 0.1390480254860656, 'batch_norm': True, 'lr': 0.00041190867421495947, 'weight_decay': 6.949405216164045e-07, 'epochs': 311, 'loss': 'mse', 'optimizer': 'adam', 'graph_mode': 'off', 'use_snp_selection': False}. Best is trial 95 with value: 0.06935101396569539.
[I 2025-11-03 12:38:49,872] Trial 149 finished with value: 0.05041061153583242 and parameters: {'model_type': 'gcn', 'hidden_dims': '[256, 128, 64]', 'dropout': 0.12394572538608913, 'batch_norm': False, 'lr': 0.0002972455441065338, 'weight_decay': 9.8175002467119e-07, 'epochs': 334, 'loss': 'mse', 'optimizer': 'adam', 'graph_mode': 'off', 'use_snp_selection': False}. Best is trial 95 with value: 0.06935101396569539.
[I 2025-11-03 12:38:52,119] Trial 0 finished with value: 0.00755740210902105 and parameters: {'model_type': 'gcn', 'hidden_dims': '[128, 64]', 'dropout': 0.199031432379812, 'batch_norm': True, 'lr': 1.8408544111075837e-06, 'weight_decay': 5.5136510071208614e-05, 'epochs': 336, 'loss': 'mae', 'optimizer': 'adam', 'graph_mode': 'off', 'use_snp_selection': True, 'num_snps': 43862}. Best is trial 0 with value: 0.00755740210902105.
[I 2025-11-03 12:38:53,891] Trial 1 finished with value: 0.03826487082924976 and parameters: {'model_type': 'gcn', 'hidden_dims': '[256, 128]', 'dropout': 0.4370668075331726, 'batch_norm': True, 'lr': 7.133471581159139e-05, 'weight_decay': 1.128633586803549e-05, 'epochs': 242, 'loss': 'mae', 'optimizer': 'adam', 'graph_mode': 'off', 'use_snp_selection': False}. Best is trial 1 with value: 0.03826487082924976.
[I 2025-11-03 12:38:55,091] Trial 2 finished with value: -0.008728394590029498 and parameters: {'model_type': 'gcn', 'hidden_dims': '[256, 128, 64]', 'dropout': 0.41314357415569625, 'batch_norm': False, 'lr': 3.952233718592101e-06, 'weight_decay': 0.00026754769258252603, 'epochs': 149, 'loss': 'mse', 'optimizer': 'adam', 'graph_mode': 'off', 'use_snp_selection': True, 'num_snps': 11571}. Best is trial 1 with value: 0.03826487082924976.
[I 2025-11-03 12:38:58,365] Trial 3 finished with value: 0.062090958625617726 and parameters: {'model_type': 'gcn', 'hidden_dims': '[512, 64]', 'dropout': 0.5938127374509361, 'batch_norm': False, 'lr': 5.67704586114731e-06, 'weight_decay': 2.4518087630137052e-05, 'epochs': 320, 'loss': 'mae', 'optimizer': 'adam', 'graph_mode': 'off', 'use_snp_selection': False}. Best is trial 3 with value: 0.062090958625617726.
[I 2025-11-03 12:39:01,050] Trial 4 finished with value: 0.02897656776875694 and parameters: {'model_type': 'gcn', 'hidden_dims': '[512, 128]', 'dropout': 0.25746343592134413, 'batch_norm': True, 'lr': 1.3467657668402788e-06, 'weight_decay': 0.00033087251918647806, 'epochs': 277, 'loss': 'mse', 'optimizer': 'adam', 'graph_mode': 'off', 'use_snp_selection': True, 'num_snps': 36675}. Best is trial 3 with value: 0.062090958625617726.
[I 2025-11-03 12:39:02,921] Trial 5 finished with value: -0.0028026505419302605 and parameters: {'model_type': 'gcn', 'hidden_dims': '[512, 64]', 'dropout': 0.38275350994408375, 'batch_norm': True, 'lr': 1.5586664309232824e-06, 'weight_decay': 0.0008227664668621182, 'epochs': 145, 'loss': 'mae', 'optimizer': 'adam', 'graph_mode': 'off', 'use_snp_selection': True, 'num_snps': 32148}. Best is trial 3 with value: 0.062090958625617726.
[I 2025-11-03 12:39:04,426] Trial 6 finished with value: 0.062174810850007076 and parameters: {'model_type': 'gcn', 'hidden_dims': '[256, 128]', 'dropout': 0.3930109900265879, 'batch_norm': False, 'lr': 4.892964372128395e-05, 'weight_decay': 1.5809549317992182e-06, 'epochs': 199, 'loss': 'mse', 'optimizer': 'adam', 'graph_mode': 'off', 'use_snp_selection': False}. Best is trial 6 with value: 0.062174810850007076.
[I 2025-11-03 12:39:06,057] Trial 7 finished with value: 0.07889921334247457 and parameters: {'model_type': 'gcn', 'hidden_dims': '[512, 256]', 'dropout': 0.15343979219678458, 'batch_norm': True, 'lr': 6.234003099047341e-05, 'weight_decay': 3.894760610535477e-07, 'epochs': 97, 'loss': 'mse', 'optimizer': 'adam', 'graph_mode': 'off', 'use_snp_selection': False}. Best is trial 7 with value: 0.07889921334247457.
[I 2025-11-03 12:39:09,345] Trial 8 finished with value: 0.07470379511144581 and parameters: {'model_type': 'gcn', 'hidden_dims': '[512, 128]', 'dropout': 0.10743001231661406, 'batch_norm': True, 'lr': 0.00023728538449271062, 'weight_decay': 1.7629071578048637e-05, 'epochs': 312, 'loss': 'mae', 'optimizer': 'adam', 'graph_mode': 'off', 'use_snp_selection': False}. Best is trial 7 with value: 0.07889921334247457.
