[I 2025-11-03 13:46:43,209] Trial 99 finished with value: 0.03385169028635201 and parameters: {'model_type': 'gcn', 'hidden_dims': '[512, 64]', 'dropout': 0.39456067591464516, 'batch_norm': True, 'lr': 0.0002762561475663451, 'weight_decay': 2.337612144450029e-07, 'epochs': 194, 'loss': 'mse', 'optimizer': 'adam', 'graph_mode': 'cutoff', 'cutoff': 0.772965668216392, 'grm_norm': 'cosine_then_gcn', 'self_loops': False, 'use_snp_selection': False}. Best is trial 98 with value: 0.0635875299136068.
[I 2025-11-03 13:46:45,674] Trial 100 finished with value: 0.03814310890476331 and parameters: {'model_type': 'gcn', 'hidden_dims': '[512, 64]', 'dropout': 0.4109187397610855, 'batch_norm': True, 'lr': 0.0003294911170305394, 'weight_decay': 1.72497605512711e-07, 'epochs': 212, 'loss': 'mse', 'optimizer': 'adam', 'graph_mode': 'cutoff', 'cutoff': 0.6692139398781107, 'grm_norm': 'cosine_then_gcn', 'self_loops': False, 'use_snp_selection': False}. Best is trial 98 with value: 0.0635875299136068.
[I 2025-11-03 13:46:47,946] Trial 101 finished with value: 0.031707015619089285 and parameters: {'model_type': 'gcn', 'hidden_dims': '[512, 64]', 'dropout': 0.5206732038399042, 'batch_norm': True, 'lr': 0.00014857333602819175, 'weight_decay': 1.1433010083489839e-07, 'epochs': 177, 'loss': 'mse', 'optimizer': 'adam', 'graph_mode': 'cutoff', 'cutoff': 0.6922898725445861, 'grm_norm': 'cosine_then_gcn', 'self_loops': False, 'use_snp_selection': False}. Best is trial 98 with value: 0.0635875299136068.
[I 2025-11-03 13:46:50,141] Trial 102 finished with value: 0.007891709532890636 and parameters: {'model_type': 'gcn', 'hidden_dims': '[512, 64]', 'dropout': 0.5516310983293238, 'batch_norm': True, 'lr': 0.00017536688339839186, 'weight_decay': 2.8624962689016844e-05, 'epochs': 164, 'loss': 'mse', 'optimizer': 'adam', 'graph_mode': 'cutoff', 'cutoff': 0.823393795520766, 'grm_norm': 'cosine_then_gcn', 'self_loops': False, 'use_snp_selection': False}. Best is trial 98 with value: 0.0635875299136068.
[I 2025-11-03 13:46:51,915] Trial 103 finished with value: 0.03878286334287332 and parameters: {'model_type': 'gcn', 'hidden_dims': '[256, 128]', 'dropout': 0.3542819867693364, 'batch_norm': True, 'lr': 0.0008110526566132037, 'weight_decay': 1.6653759464462687e-07, 'epochs': 186, 'loss': 'mse', 'optimizer': 'adam', 'graph_mode': 'cutoff', 'cutoff': 0.6221311178559615, 'grm_norm': 'cosine', 'self_loops': True, 'use_snp_selection': False}. Best is trial 98 with value: 0.0635875299136068.
[I 2025-11-03 13:46:54,449] Trial 104 finished with value: 0.05361703062754329 and parameters: {'model_type': 'gcn', 'hidden_dims': '[512, 256]', 'dropout': 0.1254931015889994, 'batch_norm': True, 'lr': 0.0002124734177085368, 'weight_decay': 2.0627635499301095e-05, 'epochs': 222, 'loss': 'mse', 'optimizer': 'adam', 'graph_mode': 'cutoff', 'cutoff': 0.4124617781178981, 'grm_norm': 'cosine_then_gcn', 'self_loops': True, 'use_snp_selection': False}. Best is trial 98 with value: 0.0635875299136068.
[I 2025-11-03 13:46:56,980] Trial 105 finished with value: 0.04835424408063766 and parameters: {'model_type': 'gcn', 'hidden_dims': '[512, 256]', 'dropout': 0.16431783717542892, 'batch_norm': True, 'lr': 0.00019727680391138974, 'weight_decay': 1.9719341274295155e-05, 'epochs': 222, 'loss': 'mse', 'optimizer': 'adam', 'graph_mode': 'cutoff', 'cutoff': 0.3525123881008786, 'grm_norm': 'cosine_then_gcn', 'self_loops': True, 'use_snp_selection': False}. Best is trial 98 with value: 0.0635875299136068.
[I 2025-11-03 13:46:59,489] Trial 106 finished with value: 0.04281710755840911 and parameters: {'model_type': 'gcn', 'hidden_dims': '[512, 256]', 'dropout': 0.12237552733330986, 'batch_norm': True, 'lr': 0.0004991062378254273, 'weight_decay': 6.768934899145927e-06, 'epochs': 219, 'loss': 'mse', 'optimizer': 'adam', 'graph_mode': 'cutoff', 'cutoff': 0.3535530061430432, 'grm_norm': 'cosine_then_gcn', 'self_loops': True, 'use_snp_selection': False}. Best is trial 98 with value: 0.0635875299136068.
[I 2025-11-03 13:47:02,117] Trial 107 finished with value: 0.04549590495254693 and parameters: {'model_type': 'gcn', 'hidden_dims': '[512, 256]', 'dropout': 0.3744175533985806, 'batch_norm': True, 'lr': 0.0002046042872940526, 'weight_decay': 2.1345543355330625e-05, 'epochs': 237, 'loss': 'mae', 'optimizer': 'adam', 'graph_mode': 'cutoff', 'cutoff': 0.4061259347421959, 'grm_norm': 'cosine_then_gcn', 'self_loops': True, 'use_snp_selection': False}. Best is trial 98 with value: 0.0635875299136068.
[I 2025-11-03 13:47:04,717] Trial 108 finished with value: 0.0563332907329683 and parameters: {'model_type': 'gcn', 'hidden_dims': '[512, 256]', 'dropout': 0.37208740685515723, 'batch_norm': True, 'lr': 0.00020472459746293843, 'weight_decay': 6.638090067060438e-05, 'epochs': 231, 'loss': 'mae', 'optimizer': 'adam', 'graph_mode': 'cutoff', 'cutoff': 0.26789167142485526, 'grm_norm': 'cosine_then_gcn', 'self_loops': True, 'use_snp_selection': False}. Best is trial 98 with value: 0.0635875299136068.
[I 2025-11-03 13:47:07,344] Trial 109 finished with value: 0.07413610610422695 and parameters: {'model_type': 'gcn', 'hidden_dims': '[512, 256]', 'dropout': 0.36939596542127595, 'batch_norm': True, 'lr': 0.00022967539894464068, 'weight_decay': 0.00012202179213419145, 'epochs': 233, 'loss': 'mae', 'optimizer': 'adam', 'graph_mode': 'cutoff', 'cutoff': 0.26225658588593304, 'grm_norm': 'cosine_then_gcn', 'self_loops': True, 'use_snp_selection': False}. Best is trial 109 with value: 0.07413610610422695.
[I 2025-11-03 13:47:09,955] Trial 110 finished with value: 0.050996456571411115 and parameters: {'model_type': 'gcn', 'hidden_dims': '[512, 256]', 'dropout': 0.4086317944284872, 'batch_norm': True, 'lr': 0.00023003855360090233, 'weight_decay': 0.0002537295100646233, 'epochs': 229, 'loss': 'mae', 'optimizer': 'adam', 'graph_mode': 'cutoff', 'cutoff': 0.25664138376793433, 'grm_norm': 'cosine_then_gcn', 'self_loops': True, 'use_snp_selection': False}. Best is trial 109 with value: 0.07413610610422695.
[I 2025-11-03 13:47:12,606] Trial 111 finished with value: 0.054046444706261555 and parameters: {'model_type': 'gcn', 'hidden_dims': '[512, 256]', 'dropout': 0.4293250845812877, 'batch_norm': True, 'lr': 0.0002162570519880779, 'weight_decay': 0.00016303447264977018, 'epochs': 235, 'loss': 'mae', 'optimizer': 'adam', 'graph_mode': 'cutoff', 'cutoff': 0.24248715847497312, 'grm_norm': 'cosine_then_gcn', 'self_loops': True, 'use_snp_selection': False}. Best is trial 109 with value: 0.07413610610422695.
[I 2025-11-03 13:47:15,230] Trial 112 finished with value: 0.038929368120561976 and parameters: {'model_type': 'gcn', 'hidden_dims': '[512, 256]', 'dropout': 0.4387240503769955, 'batch_norm': True, 'lr': 0.0003184512461080708, 'weight_decay': 0.00023596483669448135, 'epochs': 231, 'loss': 'mae', 'optimizer': 'adam', 'graph_mode': 'cutoff', 'cutoff': 0.2459838011373677, 'grm_norm': 'cosine_then_gcn', 'self_loops': True, 'use_snp_selection': False}. Best is trial 109 with value: 0.07413610610422695.
[I 2025-11-03 13:47:17,788] Trial 113 finished with value: 0.05091079774609168 and parameters: {'model_type': 'gcn', 'hidden_dims': '[512, 256]', 'dropout': 0.4388468975718172, 'batch_norm': True, 'lr': 0.00027018391541863175, 'weight_decay': 0.0001680800986991845, 'epochs': 223, 'loss': 'mae', 'optimizer': 'adam', 'graph_mode': 'cutoff', 'cutoff': 0.28100297075032943, 'grm_norm': 'cosine_then_gcn', 'self_loops': True, 'use_snp_selection': False}. Best is trial 109 with value: 0.07413610610422695.
[I 2025-11-03 13:47:20,356] Trial 114 finished with value: 0.049630160872228185 and parameters: {'model_type': 'gcn', 'hidden_dims': '[512, 256]', 'dropout': 0.44228104214230185, 'batch_norm': True, 'lr': 0.00027218329082745777, 'weight_decay': 0.00021756543805841598, 'epochs': 222, 'loss': 'mae', 'optimizer': 'adam', 'graph_mode': 'cutoff', 'cutoff': 0.263642246855779, 'grm_norm': 'cosine_then_gcn', 'self_loops': True, 'use_snp_selection': False}. Best is trial 109 with value: 0.07413610610422695.
[I 2025-11-03 13:47:23,049] Trial 115 finished with value: 0.04869903365161459 and parameters: {'model_type': 'gcn', 'hidden_dims': '[512, 256]', 'dropout': 0.4347382422288499, 'batch_norm': True, 'lr': 0.00039499346078709425, 'weight_decay': 0.00021730374519629778, 'epochs': 244, 'loss': 'mae', 'optimizer': 'adam', 'graph_mode': 'cutoff', 'cutoff': 0.2724212553192693, 'grm_norm': 'cosine_then_gcn', 'self_loops': True, 'use_snp_selection': False}. Best is trial 109 with value: 0.07413610610422695.
[I 2025-11-03 13:47:25,754] Trial 116 finished with value: 0.06607144580062016 and parameters: {'model_type': 'gcn', 'hidden_dims': '[512, 256]', 'dropout': 0.4460164837014708, 'batch_norm': True, 'lr': 0.0003692560172591148, 'weight_decay': 0.00018364387988860042, 'epochs': 246, 'loss': 'mae', 'optimizer': 'adam', 'graph_mode': 'cutoff', 'cutoff': 0.27248673462698175, 'grm_norm': 'cosine_then_gcn', 'self_loops': True, 'use_snp_selection': False}. Best is trial 109 with value: 0.07413610610422695.
[I 2025-11-03 13:47:28,517] Trial 117 finished with value: 0.044481192371277185 and parameters: {'model_type': 'gcn', 'hidden_dims': '[512, 256]', 'dropout': 0.4489201840376194, 'batch_norm': True, 'lr': 0.00027840671873227045, 'weight_decay': 0.00013952713950517824, 'epochs': 253, 'loss': 'mae', 'optimizer': 'adam', 'graph_mode': 'cutoff', 'cutoff': 0.20565343898407587, 'grm_norm': 'cosine_then_gcn', 'self_loops': True, 'use_snp_selection': False}. Best is trial 109 with value: 0.07413610610422695.
[I 2025-11-03 13:47:31,298] Trial 118 finished with value: 0.03739421310900724 and parameters: {'model_type': 'gcn', 'hidden_dims': '[512, 256]', 'dropout': 0.41067180716741536, 'batch_norm': True, 'lr': 0.00033493117600692795, 'weight_decay': 0.00016430805088819942, 'epochs': 263, 'loss': 'mae', 'optimizer': 'adam', 'graph_mode': 'cutoff', 'cutoff': 0.3013280646685774, 'grm_norm': 'cosine_then_gcn', 'self_loops': True, 'use_snp_selection': False}. Best is trial 109 with value: 0.07413610610422695.
[I 2025-11-03 13:47:33,896] Trial 119 finished with value: 0.044637194194877605 and parameters: {'model_type': 'gcn', 'hidden_dims': '[512, 256]', 'dropout': 0.38813217898986524, 'batch_norm': True, 'lr': 0.0002341788531673524, 'weight_decay': 0.0003268063838092577, 'epochs': 226, 'loss': 'mae', 'optimizer': 'adam', 'graph_mode': 'cutoff', 'cutoff': 0.24991638146783907, 'grm_norm': 'cosine_then_gcn', 'self_loops': True, 'use_snp_selection': False}. Best is trial 109 with value: 0.07413610610422695.
[I 2025-11-03 13:47:36,547] Trial 120 finished with value: 0.029815050472037266 and parameters: {'model_type': 'gcn', 'hidden_dims': '[512, 256]', 'dropout': 0.41957435148853167, 'batch_norm': True, 'lr': 0.0005214992705751684, 'weight_decay': 0.0004993861543870678, 'epochs': 238, 'loss': 'mae', 'optimizer': 'adam', 'graph_mode': 'cutoff', 'cutoff': 0.2948691507020364, 'grm_norm': 'cosine_then_gcn', 'self_loops': True, 'use_snp_selection': False}. Best is trial 109 with value: 0.07413610610422695.
[I 2025-11-03 13:47:39,245] Trial 121 finished with value: 0.04260250587548188 and parameters: {'model_type': 'gcn', 'hidden_dims': '[512, 256]', 'dropout': 0.43319810433105826, 'batch_norm': True, 'lr': 0.00037315952487771944, 'weight_decay': 0.00010003259790181043, 'epochs': 246, 'loss': 'mae', 'optimizer': 'adam', 'graph_mode': 'cutoff', 'cutoff': 0.2696329657547477, 'grm_norm': 'cosine_then_gcn', 'self_loops': True, 'use_snp_selection': False}. Best is trial 109 with value: 0.07413610610422695.
[I 2025-11-03 13:47:41,922] Trial 122 finished with value: 0.030584741100257926 and parameters: {'model_type': 'gcn', 'hidden_dims': '[512, 256]', 'dropout': 0.45552559521665126, 'batch_norm': True, 'lr': 0.00040099255105147526, 'weight_decay': 0.00021767307831490387, 'epochs': 242, 'loss': 'mae', 'optimizer': 'adam', 'graph_mode': 'cutoff', 'cutoff': 0.31553589932759596, 'grm_norm': 'cosine_then_gcn', 'self_loops': True, 'use_snp_selection': False}. Best is trial 109 with value: 0.07413610610422695.
[I 2025-11-03 13:47:44,657] Trial 123 finished with value: 0.03771478586587526 and parameters: {'model_type': 'gcn', 'hidden_dims': '[512, 256]', 'dropout': 0.4765927332991675, 'batch_norm': True, 'lr': 0.00022951804185861817, 'weight_decay': 0.0002884285561858183, 'epochs': 251, 'loss': 'mae', 'optimizer': 'adam', 'graph_mode': 'cutoff', 'cutoff': 0.2660194878805715, 'grm_norm': 'cosine_then_gcn', 'self_loops': True, 'use_snp_selection': False}. Best is trial 109 with value: 0.07413610610422695.
[I 2025-11-03 13:47:47,193] Trial 124 finished with value: 0.07404736822579738 and parameters: {'model_type': 'gcn', 'hidden_dims': '[512, 256]', 'dropout': 0.44426191342097854, 'batch_norm': True, 'lr': 0.00031191305434977233, 'weight_decay': 0.00018221494286450312, 'epochs': 213, 'loss': 'mae', 'optimizer': 'adam', 'graph_mode': 'cutoff', 'cutoff': 0.21301754869659242, 'grm_norm': 'cosine_then_gcn', 'self_loops': True, 'use_snp_selection': False}. Best is trial 109 with value: 0.07413610610422695.
[I 2025-11-03 13:47:49,755] Trial 125 finished with value: 0.056645196542393576 and parameters: {'model_type': 'gcn', 'hidden_dims': '[512, 256]', 'dropout': 0.4509638314294525, 'batch_norm': True, 'lr': 0.0002686266963214488, 'weight_decay': 0.00012731434457241106, 'epochs': 220, 'loss': 'mae', 'optimizer': 'adam', 'graph_mode': 'cutoff', 'cutoff': 0.2154386657611859, 'grm_norm': 'cosine_then_gcn', 'self_loops': True, 'use_snp_selection': False}. Best is trial 109 with value: 0.07413610610422695.
[I 2025-11-03 13:47:52,275] Trial 126 finished with value: 0.05277888708427587 and parameters: {'model_type': 'gcn', 'hidden_dims': '[512, 256]', 'dropout': 0.40509858296489387, 'batch_norm': True, 'lr': 0.00028833995059562146, 'weight_decay': 0.00016303767330606766, 'epochs': 213, 'loss': 'mae', 'optimizer': 'adam', 'graph_mode': 'cutoff', 'cutoff': 0.20051756598907755, 'grm_norm': 'cosine_then_gcn', 'self_loops': True, 'use_snp_selection': False}. Best is trial 109 with value: 0.07413610610422695.
[I 2025-11-03 13:47:54,790] Trial 127 finished with value: 0.05717694290770362 and parameters: {'model_type': 'gcn', 'hidden_dims': '[512, 256]', 'dropout': 0.3979965468399734, 'batch_norm': True, 'lr': 0.0003123207725302726, 'weight_decay': 0.00010372012923131908, 'epochs': 211, 'loss': 'mae', 'optimizer': 'adam', 'graph_mode': 'cutoff', 'cutoff': 0.20068648632406405, 'grm_norm': 'cosine_then_gcn', 'self_loops': True, 'use_snp_selection': False}. Best is trial 109 with value: 0.07413610610422695.
[I 2025-11-03 13:47:57,315] Trial 128 finished with value: 0.04840108078274942 and parameters: {'model_type': 'gcn', 'hidden_dims': '[512, 256]', 'dropout': 0.42106843546953754, 'batch_norm': True, 'lr': 0.00031514885374315664, 'weight_decay': 7.822840454822433e-05, 'epochs': 213, 'loss': 'mae', 'optimizer': 'adam', 'graph_mode': 'cutoff', 'cutoff': 0.20389347596223276, 'grm_norm': 'cosine_then_gcn', 'self_loops': True, 'use_snp_selection': False}. Best is trial 109 with value: 0.07413610610422695.
[I 2025-11-03 13:47:59,774] Trial 129 finished with value: 0.06302007336972655 and parameters: {'model_type': 'gcn', 'hidden_dims': '[512, 256]', 'dropout': 0.3961038166232638, 'batch_norm': True, 'lr': 0.0004656481594380398, 'weight_decay': 0.00010617960463684816, 'epochs': 203, 'loss': 'mae', 'optimizer': 'adam', 'graph_mode': 'cutoff', 'cutoff': 0.22564851907914307, 'grm_norm': 'cosine_then_gcn', 'self_loops': True, 'use_snp_selection': False}. Best is trial 109 with value: 0.07413610610422695.
[I 2025-11-03 13:48:02,220] Trial 130 finished with value: 0.0518997684874766 and parameters: {'model_type': 'gcn', 'hidden_dims': '[512, 256]', 'dropout': 0.46980984435842654, 'batch_norm': True, 'lr': 0.0006358974197377631, 'weight_decay': 0.00011477040204655254, 'epochs': 199, 'loss': 'mae', 'optimizer': 'adam', 'graph_mode': 'cutoff', 'cutoff': 0.22983233791491264, 'grm_norm': 'cosine_then_gcn', 'self_loops': True, 'use_snp_selection': False}. Best is trial 109 with value: 0.07413610610422695.
[I 2025-11-03 13:48:04,728] Trial 131 finished with value: 0.06713561240900831 and parameters: {'model_type': 'gcn', 'hidden_dims': '[512, 256]', 'dropout': 0.40057776775189324, 'batch_norm': True, 'lr': 0.0004444440298177011, 'weight_decay': 0.0001224115687530847, 'epochs': 212, 'loss': 'mae', 'optimizer': 'adam', 'graph_mode': 'cutoff', 'cutoff': 0.22670055072689932, 'grm_norm': 'cosine_then_gcn', 'self_loops': True, 'use_snp_selection': False}. Best is trial 109 with value: 0.07413610610422695.
[I 2025-11-03 13:48:07,214] Trial 132 finished with value: 0.06768453264062962 and parameters: {'model_type': 'gcn', 'hidden_dims': '[512, 256]', 'dropout': 0.37737640174979, 'batch_norm': True, 'lr': 0.0004691870788633188, 'weight_decay': 6.419570587707755e-05, 'epochs': 209, 'loss': 'mae', 'optimizer': 'adam', 'graph_mode': 'cutoff', 'cutoff': 0.2141474888202963, 'grm_norm': 'cosine_then_gcn', 'self_loops': True, 'use_snp_selection': False}. Best is trial 109 with value: 0.07413610610422695.
[I 2025-11-03 13:48:09,655] Trial 133 finished with value: 0.05941621878860169 and parameters: {'model_type': 'gcn', 'hidden_dims': '[512, 256]', 'dropout': 0.37703565387264154, 'batch_norm': True, 'lr': 0.0004834588664408642, 'weight_decay': 0.00012171644929768146, 'epochs': 201, 'loss': 'mae', 'optimizer': 'adam', 'graph_mode': 'cutoff', 'cutoff': 0.22790089346633827, 'grm_norm': 'cosine_then_gcn', 'self_loops': True, 'use_snp_selection': False}. Best is trial 109 with value: 0.07413610610422695.
[I 2025-11-03 13:48:12,100] Trial 134 finished with value: 0.06482192933509782 and parameters: {'model_type': 'gcn', 'hidden_dims': '[512, 256]', 'dropout': 0.37450548446555865, 'batch_norm': True, 'lr': 0.0008201727403228045, 'weight_decay': 0.0001270275438103977, 'epochs': 200, 'loss': 'mae', 'optimizer': 'adam', 'graph_mode': 'cutoff', 'cutoff': 0.23182505705287557, 'grm_norm': 'cosine_then_gcn', 'self_loops': True, 'use_snp_selection': False}. Best is trial 109 with value: 0.07413610610422695.
[I 2025-11-03 13:48:14,576] Trial 135 finished with value: 0.06152943564651787 and parameters: {'model_type': 'gcn', 'hidden_dims': '[512, 256]', 'dropout': 0.3764743444550344, 'batch_norm': True, 'lr': 0.000808811957498385, 'weight_decay': 5.905261197253194e-05, 'epochs': 205, 'loss': 'mae', 'optimizer': 'adam', 'graph_mode': 'cutoff', 'cutoff': 0.21979997180603475, 'grm_norm': 'cosine_then_gcn', 'self_loops': True, 'use_snp_selection': False}. Best is trial 109 with value: 0.07413610610422695.
[I 2025-11-03 13:48:17,015] Trial 136 finished with value: 0.053864046581243746 and parameters: {'model_type': 'gcn', 'hidden_dims': '[512, 256]', 'dropout': 0.37935147260116325, 'batch_norm': True, 'lr': 0.0007435788596833987, 'weight_decay': 6.702782547545567e-05, 'epochs': 198, 'loss': 'mae', 'optimizer': 'adam', 'graph_mode': 'cutoff', 'cutoff': 0.22496273280464713, 'grm_norm': 'cosine_then_gcn', 'self_loops': True, 'use_snp_selection': False}. Best is trial 109 with value: 0.07413610610422695.
[I 2025-11-03 13:48:19,480] Trial 137 finished with value: 0.049402861037102425 and parameters: {'model_type': 'gcn', 'hidden_dims': '[512, 256]', 'dropout': 0.39603934800827284, 'batch_norm': True, 'lr': 0.0009454344409907473, 'weight_decay': 0.00011497151703302897, 'epochs': 203, 'loss': 'mae', 'optimizer': 'adam', 'graph_mode': 'cutoff', 'cutoff': 0.22887051074463294, 'grm_norm': 'cosine_then_gcn', 'self_loops': True, 'use_snp_selection': False}. Best is trial 109 with value: 0.07413610610422695.
[I 2025-11-03 13:48:21,970] Trial 138 finished with value: 0.0505667991233648 and parameters: {'model_type': 'gcn', 'hidden_dims': '[512, 256]', 'dropout': 0.3729276022880028, 'batch_norm': True, 'lr': 0.0005599133603555102, 'weight_decay': 6.887092316378374e-05, 'epochs': 208, 'loss': 'mae', 'optimizer': 'adam', 'graph_mode': 'cutoff', 'cutoff': 0.21766857134196543, 'grm_norm': 'cosine_then_gcn', 'self_loops': True, 'use_snp_selection': False}. Best is trial 109 with value: 0.07413610610422695.
[I 2025-11-03 13:48:24,333] Trial 139 finished with value: 0.06233122351173732 and parameters: {'model_type': 'gcn', 'hidden_dims': '[512, 256]', 'dropout': 0.36240366416765635, 'batch_norm': True, 'lr': 0.0008754598535906036, 'weight_decay': 0.00012020393808885012, 'epochs': 187, 'loss': 'mae', 'optimizer': 'adam', 'graph_mode': 'cutoff', 'cutoff': 0.23761091760540917, 'grm_norm': 'cosine_then_gcn', 'self_loops': True, 'use_snp_selection': False}. Best is trial 109 with value: 0.07413610610422695.
[I 2025-11-03 13:48:26,723] Trial 140 finished with value: 0.05947538969178672 and parameters: {'model_type': 'gcn', 'hidden_dims': '[512, 256]', 'dropout': 0.3648108144953257, 'batch_norm': True, 'lr': 0.0008227029019228522, 'weight_decay': 0.000104300522068483, 'epochs': 189, 'loss': 'mae', 'optimizer': 'adam', 'graph_mode': 'cutoff', 'cutoff': 0.23820210593240568, 'grm_norm': 'cosine_then_gcn', 'self_loops': True, 'use_snp_selection': False}. Best is trial 109 with value: 0.07413610610422695.
[I 2025-11-03 13:48:29,141] Trial 141 finished with value: 0.06101380557030166 and parameters: {'model_type': 'gcn', 'hidden_dims': '[512, 256]', 'dropout': 0.3579723013289638, 'batch_norm': True, 'lr': 0.00045364631884122603, 'weight_decay': 0.00012861439937032906, 'epochs': 196, 'loss': 'mae', 'optimizer': 'adam', 'graph_mode': 'cutoff', 'cutoff': 0.23523573561156028, 'grm_norm': 'cosine_then_gcn', 'self_loops': True, 'use_snp_selection': False}. Best is trial 109 with value: 0.07413610610422695.
