[I 2025-11-03 14:01:51,095] Trial 146 finished with value: 0.05127352419320414 and parameters: {'model_type': 'gcn', 'hidden_dims': '[512, 256]', 'dropout': 0.16569137606278522, 'batch_norm': True, 'lr': 2.3365833236030507e-05, 'weight_decay': 2.0798602055189966e-05, 'epochs': 326, 'loss': 'mae', 'optimizer': 'adam', 'graph_mode': 'off', 'use_snp_selection': False}. Best is trial 139 with value: 0.07264745599929207.
[I 2025-11-03 14:01:52,777] Trial 147 finished with value: 0.0034507844957423644 and parameters: {'model_type': 'gcn', 'hidden_dims': '[256, 128]', 'dropout': 0.24745158844459392, 'batch_norm': True, 'lr': 3.237791584837309e-05, 'weight_decay': 1.199891458797646e-05, 'epochs': 342, 'loss': 'mae', 'optimizer': 'adam', 'graph_mode': 'off', 'use_snp_selection': False}. Best is trial 139 with value: 0.07264745599929207.
[I 2025-11-03 14:01:55,119] Trial 148 finished with value: 0.06052629733603027 and parameters: {'model_type': 'gcn', 'hidden_dims': '[512, 256]', 'dropout': 0.4738802391278785, 'batch_norm': True, 'lr': 0.000787075906867518, 'weight_decay': 9.701205925682826e-06, 'epochs': 350, 'loss': 'mae', 'optimizer': 'adam', 'graph_mode': 'off', 'use_snp_selection': False}. Best is trial 139 with value: 0.07264745599929207.
[I 2025-11-03 14:01:57,393] Trial 149 finished with value: 0.05009687583993288 and parameters: {'model_type': 'gcn', 'hidden_dims': '[512, 256]', 'dropout': 0.47938198553419287, 'batch_norm': True, 'lr': 0.0007651976820980749, 'weight_decay': 2.6094144198358516e-05, 'epochs': 329, 'loss': 'mae', 'optimizer': 'adam', 'graph_mode': 'off', 'use_snp_selection': False}. Best is trial 139 with value: 0.07264745599929207.
[I 2025-11-03 14:01:59,365] Trial 0 finished with value: 0.04665695794817765 and parameters: {'model_type': 'gcn', 'hidden_dims': '[128, 64]', 'dropout': 0.199031432379812, 'batch_norm': True, 'lr': 1.8408544111075837e-06, 'weight_decay': 5.5136510071208614e-05, 'epochs': 336, 'loss': 'mae', 'optimizer': 'adam', 'graph_mode': 'off', 'use_snp_selection': True, 'num_snps': 43862}. Best is trial 0 with value: 0.04665695794817765.
[I 2025-11-03 14:02:00,701] Trial 1 finished with value: 0.06923782347506652 and parameters: {'model_type': 'gcn', 'hidden_dims': '[256, 128]', 'dropout': 0.4370668075331726, 'batch_norm': True, 'lr': 7.133471581159139e-05, 'weight_decay': 1.128633586803549e-05, 'epochs': 242, 'loss': 'mae', 'optimizer': 'adam', 'graph_mode': 'off', 'use_snp_selection': False}. Best is trial 1 with value: 0.06923782347506652.
[I 2025-11-03 14:02:01,735] Trial 2 finished with value: 0.002701202790705685 and parameters: {'model_type': 'gcn', 'hidden_dims': '[256, 128, 64]', 'dropout': 0.41314357415569625, 'batch_norm': False, 'lr': 3.952233718592101e-06, 'weight_decay': 0.00026754769258252603, 'epochs': 149, 'loss': 'mse', 'optimizer': 'adam', 'graph_mode': 'off', 'use_snp_selection': True, 'num_snps': 11571}. Best is trial 1 with value: 0.06923782347506652.
[I 2025-11-03 14:02:03,819] Trial 3 finished with value: 0.016084643733920937 and parameters: {'model_type': 'gcn', 'hidden_dims': '[512, 64]', 'dropout': 0.5938127374509361, 'batch_norm': False, 'lr': 5.67704586114731e-06, 'weight_decay': 2.4518087630137052e-05, 'epochs': 320, 'loss': 'mae', 'optimizer': 'adam', 'graph_mode': 'off', 'use_snp_selection': False}. Best is trial 1 with value: 0.06923782347506652.
[I 2025-11-03 14:02:05,904] Trial 4 finished with value: 0.04636328440941895 and parameters: {'model_type': 'gcn', 'hidden_dims': '[512, 128]', 'dropout': 0.25746343592134413, 'batch_norm': True, 'lr': 1.3467657668402788e-06, 'weight_decay': 0.00033087251918647806, 'epochs': 277, 'loss': 'mse', 'optimizer': 'adam', 'graph_mode': 'off', 'use_snp_selection': True, 'num_snps': 36675}. Best is trial 1 with value: 0.06923782347506652.
[I 2025-11-03 14:02:07,429] Trial 5 finished with value: 0.00654731022003902 and parameters: {'model_type': 'gcn', 'hidden_dims': '[512, 64]', 'dropout': 0.38275350994408375, 'batch_norm': True, 'lr': 1.5586664309232824e-06, 'weight_decay': 0.0008227664668621182, 'epochs': 145, 'loss': 'mae', 'optimizer': 'adam', 'graph_mode': 'off', 'use_snp_selection': True, 'num_snps': 32148}. Best is trial 1 with value: 0.06923782347506652.
[I 2025-11-03 14:02:08,605] Trial 6 finished with value: 0.022876091321774546 and parameters: {'model_type': 'gcn', 'hidden_dims': '[256, 128]', 'dropout': 0.3930109900265879, 'batch_norm': False, 'lr': 4.892964372128395e-05, 'weight_decay': 1.5809549317992182e-06, 'epochs': 199, 'loss': 'mse', 'optimizer': 'adam', 'graph_mode': 'off', 'use_snp_selection': False}. Best is trial 1 with value: 0.06923782347506652.
[I 2025-11-03 14:02:09,800] Trial 7 finished with value: 0.10494215965788155 and parameters: {'model_type': 'gcn', 'hidden_dims': '[512, 256]', 'dropout': 0.15343979219678458, 'batch_norm': True, 'lr': 6.234003099047341e-05, 'weight_decay': 3.894760610535477e-07, 'epochs': 97, 'loss': 'mse', 'optimizer': 'adam', 'graph_mode': 'off', 'use_snp_selection': False}. Best is trial 7 with value: 0.10494215965788155.
[I 2025-11-03 14:02:11,877] Trial 8 finished with value: 0.10628923064304346 and parameters: {'model_type': 'gcn', 'hidden_dims': '[512, 128]', 'dropout': 0.10743001231661406, 'batch_norm': True, 'lr': 0.00023728538449271062, 'weight_decay': 1.7629071578048637e-05, 'epochs': 312, 'loss': 'mae', 'optimizer': 'adam', 'graph_mode': 'off', 'use_snp_selection': False}. Best is trial 8 with value: 0.10628923064304346.
[I 2025-11-03 14:02:13,376] Trial 9 finished with value: 0.08227110965497625 and parameters: {'model_type': 'gcn', 'hidden_dims': '[512, 64]', 'dropout': 0.14505336736221927, 'batch_norm': True, 'lr': 5.8619638388111826e-05, 'weight_decay': 6.200156172669308e-07, 'epochs': 175, 'loss': 'mse', 'optimizer': 'adam', 'graph_mode': 'off', 'use_snp_selection': False}. Best is trial 8 with value: 0.10628923064304346.
[I 2025-11-03 14:02:14,391] Trial 10 finished with value: 0.016034216747082053 and parameters: {'model_type': 'gcn', 'hidden_dims': '[512, 128]', 'dropout': 0.2800030442581858, 'batch_norm': False, 'lr': 0.0004919806695968257, 'weight_decay': 2.9953888095455486e-06, 'epochs': 55, 'loss': 'mae', 'optimizer': 'adam', 'graph_mode': 'off', 'use_snp_selection': False}. Best is trial 8 with value: 0.10628923064304346.
[I 2025-11-03 14:02:15,485] Trial 11 finished with value: 0.0973922408549245 and parameters: {'model_type': 'gcn', 'hidden_dims': '[512, 256]', 'dropout': 0.10095648685224448, 'batch_norm': True, 'lr': 0.0003926892266729099, 'weight_decay': 3.172181990533228e-07, 'epochs': 70, 'loss': 'mse', 'optimizer': 'adam', 'graph_mode': 'off', 'use_snp_selection': False}. Best is trial 8 with value: 0.10628923064304346.
[I 2025-11-03 14:02:16,786] Trial 12 finished with value: 0.09848509399773668 and parameters: {'model_type': 'gcn', 'hidden_dims': '[512, 256]', 'dropout': 0.18206399419301494, 'batch_norm': True, 'lr': 0.00026576228959612443, 'weight_decay': 1.3081036432574914e-07, 'epochs': 115, 'loss': 'mae', 'optimizer': 'adam', 'graph_mode': 'off', 'use_snp_selection': False}. Best is trial 8 with value: 0.10628923064304346.
[I 2025-11-03 14:02:18,563] Trial 13 finished with value: 0.10772917699753332 and parameters: {'model_type': 'gcn', 'hidden_dims': '[512, 256]', 'dropout': 0.28178980110198326, 'batch_norm': True, 'lr': 0.0001448400953749671, 'weight_decay': 3.475237872468419e-06, 'epochs': 232, 'loss': 'mse', 'optimizer': 'adam', 'graph_mode': 'off', 'use_snp_selection': False}. Best is trial 13 with value: 0.10772917699753332.
[I 2025-11-03 14:02:20,481] Trial 14 finished with value: 0.10556774230667458 and parameters: {'model_type': 'gcn', 'hidden_dims': '[512, 128]', 'dropout': 0.3012984444538551, 'batch_norm': True, 'lr': 0.00017558188744418174, 'weight_decay': 4.236933484339999e-06, 'epochs': 270, 'loss': 'mse', 'optimizer': 'adam', 'graph_mode': 'off', 'use_snp_selection': False}. Best is trial 13 with value: 0.10772917699753332.
[I 2025-11-03 14:02:21,604] Trial 15 finished with value: 0.0854846019477516 and parameters: {'model_type': 'gcn', 'hidden_dims': '[128, 64]', 'dropout': 0.5175762982265439, 'batch_norm': True, 'lr': 0.000789806924142399, 'weight_decay': 6.682546297843178e-05, 'epochs': 231, 'loss': 'mae', 'optimizer': 'adam', 'graph_mode': 'off', 'use_snp_selection': False}. Best is trial 13 with value: 0.10772917699753332.
[I 2025-11-03 14:02:23,413] Trial 16 finished with value: 0.057587997730648696 and parameters: {'model_type': 'gcn', 'hidden_dims': '[256, 128, 64]', 'dropout': 0.23252090215536952, 'batch_norm': True, 'lr': 1.2586985041154999e-05, 'weight_decay': 1.0765286122019607e-05, 'epochs': 299, 'loss': 'mse', 'optimizer': 'adam', 'graph_mode': 'off', 'use_snp_selection': False}. Best is trial 13 with value: 0.10772917699753332.
[I 2025-11-03 14:02:25,717] Trial 17 finished with value: 0.099194744707053 and parameters: {'model_type': 'gcn', 'hidden_dims': '[512, 256]', 'dropout': 0.32888830259108426, 'batch_norm': True, 'lr': 0.00014093832979401093, 'weight_decay': 1.4546742936401585e-06, 'epochs': 349, 'loss': 'mae', 'optimizer': 'adam', 'graph_mode': 'off', 'use_snp_selection': False}. Best is trial 13 with value: 0.10772917699753332.
[I 2025-11-03 14:02:28,152] Trial 18 finished with value: 0.07401473477063344 and parameters: {'model_type': 'gcn', 'hidden_dims': '[512, 128]', 'dropout': 0.10884892417738423, 'batch_norm': False, 'lr': 2.4591080287676947e-05, 'weight_decay': 3.615736329976439e-05, 'epochs': 213, 'loss': 'mse', 'optimizer': 'adam', 'graph_mode': 'off', 'use_snp_selection': True, 'num_snps': 58241}. Best is trial 13 with value: 0.10772917699753332.
[I 2025-11-03 14:02:30,135] Trial 19 finished with value: 0.10400670218468994 and parameters: {'model_type': 'gcn', 'hidden_dims': '[512, 256]', 'dropout': 0.49115824212437376, 'batch_norm': True, 'lr': 0.00013956619248928968, 'weight_decay': 5.3406794053848885e-06, 'epochs': 269, 'loss': 'mae', 'optimizer': 'adam', 'graph_mode': 'off', 'use_snp_selection': False}. Best is trial 13 with value: 0.10772917699753332.
[I 2025-11-03 14:02:32,181] Trial 20 finished with value: 0.0690718513187899 and parameters: {'model_type': 'gcn', 'hidden_dims': '[512, 128]', 'dropout': 0.3451197848446597, 'batch_norm': True, 'lr': 1.6465519595683603e-05, 'weight_decay': 0.00012479819807205216, 'epochs': 311, 'loss': 'mae', 'optimizer': 'adam', 'graph_mode': 'off', 'use_snp_selection': False}. Best is trial 13 with value: 0.10772917699753332.
[I 2025-11-03 14:02:34,070] Trial 21 finished with value: 0.09679794583790419 and parameters: {'model_type': 'gcn', 'hidden_dims': '[512, 128]', 'dropout': 0.3099616840079003, 'batch_norm': True, 'lr': 0.00017228730194886107, 'weight_decay': 4.518501047697647e-06, 'epochs': 261, 'loss': 'mse', 'optimizer': 'adam', 'graph_mode': 'off', 'use_snp_selection': False}. Best is trial 13 with value: 0.10772917699753332.
[I 2025-11-03 14:02:36,023] Trial 22 finished with value: 0.1100696792739543 and parameters: {'model_type': 'gcn', 'hidden_dims': '[512, 128]', 'dropout': 0.24051316871672254, 'batch_norm': True, 'lr': 0.0009053250498378013, 'weight_decay': 1.6399047316866625e-05, 'epochs': 290, 'loss': 'mse', 'optimizer': 'adam', 'graph_mode': 'off', 'use_snp_selection': False}. Best is trial 22 with value: 0.1100696792739543.
[I 2025-11-03 14:02:37,986] Trial 23 finished with value: 0.10608752390227107 and parameters: {'model_type': 'gcn', 'hidden_dims': '[512, 128]', 'dropout': 0.2241855140953984, 'batch_norm': True, 'lr': 0.0009553807033667985, 'weight_decay': 2.080371467039633e-05, 'epochs': 285, 'loss': 'mse', 'optimizer': 'adam', 'graph_mode': 'off', 'use_snp_selection': False}. Best is trial 22 with value: 0.1100696792739543.
[I 2025-11-03 14:02:39,812] Trial 24 finished with value: 0.11747820393099737 and parameters: {'model_type': 'gcn', 'hidden_dims': '[512, 128]', 'dropout': 0.26202595955550523, 'batch_norm': True, 'lr': 0.00048393272553899137, 'weight_decay': 1.0014653592864093e-05, 'epochs': 244, 'loss': 'mse', 'optimizer': 'adam', 'graph_mode': 'off', 'use_snp_selection': False}. Best is trial 24 with value: 0.11747820393099737.
[I 2025-11-03 14:02:41,337] Trial 25 finished with value: 0.11813016956098205 and parameters: {'model_type': 'gcn', 'hidden_dims': '[256, 128, 64]', 'dropout': 0.26761272629292265, 'batch_norm': True, 'lr': 0.0005249655064849734, 'weight_decay': 1.2984072831737739e-06, 'epochs': 237, 'loss': 'mse', 'optimizer': 'adam', 'graph_mode': 'off', 'use_snp_selection': False}. Best is trial 25 with value: 0.11813016956098205.
[I 2025-11-03 14:02:42,293] Trial 26 finished with value: 0.020227597529719456 and parameters: {'model_type': 'gcn', 'hidden_dims': '[256, 128, 64]', 'dropout': 0.2505237136772003, 'batch_norm': False, 'lr': 0.00046540600703731026, 'weight_decay': 1.1530634721010896e-06, 'epochs': 174, 'loss': 'mse', 'optimizer': 'adam', 'graph_mode': 'off', 'use_snp_selection': True, 'num_snps': 3842}. Best is trial 25 with value: 0.11813016956098205.
[I 2025-11-03 14:02:43,860] Trial 27 finished with value: 0.10256299599314372 and parameters: {'model_type': 'gcn', 'hidden_dims': '[256, 128, 64]', 'dropout': 0.20442358810600314, 'batch_norm': True, 'lr': 0.0006294991929783455, 'weight_decay': 1.0556514054089352e-07, 'epochs': 248, 'loss': 'mse', 'optimizer': 'adam', 'graph_mode': 'off', 'use_snp_selection': False}. Best is trial 25 with value: 0.11813016956098205.
[I 2025-11-03 14:02:45,299] Trial 28 finished with value: 0.11820176294236523 and parameters: {'model_type': 'gcn', 'hidden_dims': '[256, 128, 64]', 'dropout': 0.1602895116201787, 'batch_norm': True, 'lr': 0.0009971923289648736, 'weight_decay': 8.78553903268699e-06, 'epochs': 213, 'loss': 'mse', 'optimizer': 'adam', 'graph_mode': 'off', 'use_snp_selection': False}. Best is trial 28 with value: 0.11820176294236523.
[I 2025-11-03 14:02:46,755] Trial 29 finished with value: 0.09813551597215887 and parameters: {'model_type': 'gcn', 'hidden_dims': '[256, 128, 64]', 'dropout': 0.16938430428953155, 'batch_norm': True, 'lr': 0.00032762804424396223, 'weight_decay': 5.522710335772481e-05, 'epochs': 215, 'loss': 'mse', 'optimizer': 'adam', 'graph_mode': 'off', 'use_snp_selection': True, 'num_snps': 19468}. Best is trial 28 with value: 0.11820176294236523.
[I 2025-11-03 14:02:47,762] Trial 30 finished with value: 0.10928339591368864 and parameters: {'model_type': 'gcn', 'hidden_dims': '[128, 64]', 'dropout': 0.20829544063427693, 'batch_norm': True, 'lr': 0.0006110638257944029, 'weight_decay': 7.822848749264847e-06, 'epochs': 185, 'loss': 'mse', 'optimizer': 'adam', 'graph_mode': 'off', 'use_snp_selection': False}. Best is trial 28 with value: 0.11820176294236523.
[I 2025-11-03 14:02:49,259] Trial 31 finished with value: 0.11247782489697711 and parameters: {'model_type': 'gcn', 'hidden_dims': '[256, 128, 64]', 'dropout': 0.27628051658456176, 'batch_norm': True, 'lr': 0.0007192189359753656, 'weight_decay': 8.974280790259746e-06, 'epochs': 223, 'loss': 'mse', 'optimizer': 'adam', 'graph_mode': 'off', 'use_snp_selection': False}. Best is trial 28 with value: 0.11820176294236523.
[I 2025-11-03 14:02:50,670] Trial 32 finished with value: 0.10737197448024134 and parameters: {'model_type': 'gcn', 'hidden_dims': '[256, 128, 64]', 'dropout': 0.3620870687489563, 'batch_norm': True, 'lr': 0.00037104065967145586, 'weight_decay': 1.919648398817733e-06, 'epochs': 208, 'loss': 'mse', 'optimizer': 'adam', 'graph_mode': 'off', 'use_snp_selection': False}. Best is trial 28 with value: 0.11820176294236523.
[I 2025-11-03 14:02:52,242] Trial 33 finished with value: 0.061503876073408695 and parameters: {'model_type': 'gcn', 'hidden_dims': '[256, 128, 64]', 'dropout': 0.2687497429101584, 'batch_norm': True, 'lr': 9.629741931946152e-05, 'weight_decay': 9.24271091794429e-06, 'epochs': 245, 'loss': 'mse', 'optimizer': 'adam', 'graph_mode': 'off', 'use_snp_selection': False}. Best is trial 28 with value: 0.11820176294236523.
[I 2025-11-03 14:02:53,460] Trial 34 finished with value: 0.11196400447174619 and parameters: {'model_type': 'gcn', 'hidden_dims': '[256, 128, 64]', 'dropout': 0.3166900198387381, 'batch_norm': True, 'lr': 0.0006116495634878496, 'weight_decay': 7.950475569892429e-07, 'epochs': 153, 'loss': 'mse', 'optimizer': 'adam', 'graph_mode': 'off', 'use_snp_selection': False}. Best is trial 28 with value: 0.11820176294236523.
[I 2025-11-03 14:02:54,773] Trial 35 finished with value: 0.015459343894690752 and parameters: {'model_type': 'gcn', 'hidden_dims': '[256, 128]', 'dropout': 0.43024169205778806, 'batch_norm': False, 'lr': 0.00027651154656785836, 'weight_decay': 2.4085461666638467e-06, 'epochs': 252, 'loss': 'mse', 'optimizer': 'adam', 'graph_mode': 'off', 'use_snp_selection': False}. Best is trial 28 with value: 0.11820176294236523.
[I 2025-11-03 14:02:57,104] Trial 36 finished with value: 0.11373297210187953 and parameters: {'model_type': 'gcn', 'hidden_dims': '[256, 128, 64]', 'dropout': 0.13618109679436535, 'batch_norm': True, 'lr': 0.0009093810722916069, 'weight_decay': 2.838956319506774e-05, 'epochs': 226, 'loss': 'mse', 'optimizer': 'adam', 'graph_mode': 'off', 'use_snp_selection': True, 'num_snps': 58661}. Best is trial 28 with value: 0.11820176294236523.
[I 2025-11-03 14:02:59,428] Trial 37 finished with value: 0.03752135674089361 and parameters: {'model_type': 'gcn', 'hidden_dims': '[256, 128, 64]', 'dropout': 0.12633158638715059, 'batch_norm': True, 'lr': 4.446294938689988e-06, 'weight_decay': 0.00011670827118390997, 'epochs': 198, 'loss': 'mse', 'optimizer': 'adam', 'graph_mode': 'off', 'use_snp_selection': True, 'num_snps': 57733}. Best is trial 28 with value: 0.11820176294236523.
[I 2025-11-03 14:03:01,230] Trial 38 finished with value: 0.018685057257508218 and parameters: {'model_type': 'gcn', 'hidden_dims': '[256, 128, 64]', 'dropout': 0.1881763221627632, 'batch_norm': False, 'lr': 0.0009900203104195818, 'weight_decay': 3.18257793468402e-05, 'epochs': 159, 'loss': 'mse', 'optimizer': 'adam', 'graph_mode': 'off', 'use_snp_selection': True, 'num_snps': 46312}. Best is trial 28 with value: 0.11820176294236523.
[I 2025-11-03 14:03:02,269] Trial 39 finished with value: 0.09556362350049191 and parameters: {'model_type': 'gcn', 'hidden_dims': '[256, 128]', 'dropout': 0.14546011717102836, 'batch_norm': True, 'lr': 9.183481116387735e-05, 'weight_decay': 0.0001204258831199517, 'epochs': 123, 'loss': 'mse', 'optimizer': 'adam', 'graph_mode': 'off', 'use_snp_selection': True, 'num_snps': 19621}. Best is trial 28 with value: 0.11820176294236523.
[I 2025-11-03 14:03:04,462] Trial 40 finished with value: 0.10992746977465015 and parameters: {'model_type': 'gcn', 'hidden_dims': '[512, 64]', 'dropout': 0.21375642977258866, 'batch_norm': True, 'lr': 0.0004821444585498804, 'weight_decay': 0.0005236495483424502, 'epochs': 231, 'loss': 'mse', 'optimizer': 'adam', 'graph_mode': 'off', 'use_snp_selection': True, 'num_snps': 46840}. Best is trial 28 with value: 0.11820176294236523.
[I 2025-11-03 14:03:06,079] Trial 41 finished with value: 0.10166591824996578 and parameters: {'model_type': 'gcn', 'hidden_dims': '[256, 128, 64]', 'dropout': 0.2851570208832136, 'batch_norm': True, 'lr': 0.0006827973895217691, 'weight_decay': 7.301811778434109e-06, 'epochs': 225, 'loss': 'mse', 'optimizer': 'adam', 'graph_mode': 'off', 'use_snp_selection': True, 'num_snps': 25404}. Best is trial 28 with value: 0.11820176294236523.
[I 2025-11-03 14:03:08,226] Trial 42 finished with value: 0.0035047314648355976 and parameters: {'model_type': 'gcn', 'hidden_dims': '[256, 128, 64]', 'dropout': 0.17334752449878926, 'batch_norm': True, 'lr': 2.1087442807785206e-06, 'weight_decay': 1.519005149710483e-05, 'epochs': 199, 'loss': 'mse', 'optimizer': 'adam', 'graph_mode': 'off', 'use_snp_selection': True, 'num_snps': 52728}. Best is trial 28 with value: 0.11820176294236523.
[I 2025-11-03 14:03:09,696] Trial 43 finished with value: 0.11949461926480603 and parameters: {'model_type': 'gcn', 'hidden_dims': '[256, 128, 64]', 'dropout': 0.24911832044804813, 'batch_norm': True, 'lr': 0.0005016940976755085, 'weight_decay': 3.114418804309438e-05, 'epochs': 218, 'loss': 'mse', 'optimizer': 'adam', 'graph_mode': 'off', 'use_snp_selection': False}. Best is trial 43 with value: 0.11949461926480603.
[I 2025-11-03 14:03:11,031] Trial 44 finished with value: 0.10979410576695775 and parameters: {'model_type': 'gcn', 'hidden_dims': '[256, 128, 64]', 'dropout': 0.13156803822211263, 'batch_norm': True, 'lr': 0.00023740378051771374, 'weight_decay': 2.7076544772679237e-05, 'epochs': 181, 'loss': 'mse', 'optimizer': 'adam', 'graph_mode': 'off', 'use_snp_selection': False}. Best is trial 43 with value: 0.11949461926480603.
[I 2025-11-03 14:03:12,213] Trial 45 finished with value: 0.10581442777292081 and parameters: {'model_type': 'gcn', 'hidden_dims': '[128, 64]', 'dropout': 0.2567787011075227, 'batch_norm': True, 'lr': 0.0004164275215967656, 'weight_decay': 4.402613038743546e-05, 'epochs': 259, 'loss': 'mse', 'optimizer': 'adam', 'graph_mode': 'off', 'use_snp_selection': False}. Best is trial 43 with value: 0.11949461926480603.
[I 2025-11-03 14:03:14,256] Trial 46 finished with value: 0.11163069317515022 and parameters: {'model_type': 'gcn', 'hidden_dims': '[512, 64]', 'dropout': 0.16057595498823152, 'batch_norm': True, 'lr': 0.0003143095502106349, 'weight_decay': 8.784449630243451e-05, 'epochs': 240, 'loss': 'mse', 'optimizer': 'adam', 'graph_mode': 'off', 'use_snp_selection': True, 'num_snps': 38360}. Best is trial 43 with value: 0.11949461926480603.
[I 2025-11-03 14:03:15,560] Trial 47 finished with value: 0.037647500524583544 and parameters: {'model_type': 'gcn', 'hidden_dims': '[256, 128, 64]', 'dropout': 0.1925359758653487, 'batch_norm': False, 'lr': 0.0005165398276368711, 'weight_decay': 0.00019596386225609861, 'epochs': 188, 'loss': 'mse', 'optimizer': 'adam', 'graph_mode': 'off', 'use_snp_selection': False}. Best is trial 43 with value: 0.11949461926480603.
