[I 2025-10-23 21:42:56,984] Trial 133 finished with value: 0.2060063814395245 and parameters: {'model_type': 'gat', 'hidden_dims': '[512, 128]', 'dropout': 0.5326022859581907, 'batch_norm': True, 'gat_heads': 7, 'gat_attn_dropout': 0.4857562105144989, 'gat_concat_hidden': True, 'lr': 0.00018112233887119898, 'weight_decay': 2.0265513342817652e-05, 'epochs': 56, 'loss': 'mae', 'optimizer': 'adam', 'graph_mode': 'cutoff', 'cutoff': 0.8359352829983023, 'grm_norm': 'cosine_then_gcn', 'self_loops': False}. Best is trial 126 with value: 0.24692329289560697.
[I 2025-10-23 21:44:47,409] Trial 134 finished with value: 0.22437926110870995 and parameters: {'model_type': 'gat', 'hidden_dims': '[512, 128]', 'dropout': 0.46782481962782574, 'batch_norm': True, 'gat_heads': 7, 'gat_attn_dropout': 0.5120881919578235, 'gat_concat_hidden': True, 'lr': 0.00014486583204526628, 'weight_decay': 1.2524234314920594e-05, 'epochs': 40, 'loss': 'mae', 'optimizer': 'adam', 'graph_mode': 'cutoff', 'cutoff': 0.863478612455399, 'grm_norm': 'cosine_then_gcn', 'self_loops': False}. Best is trial 126 with value: 0.24692329289560697.
[I 2025-10-23 21:47:34,543] Trial 135 finished with value: 0.23114868836253252 and parameters: {'model_type': 'gat', 'hidden_dims': '[512, 128]', 'dropout': 0.5685803554376154, 'batch_norm': True, 'gat_heads': 7, 'gat_attn_dropout': 0.5335192478802784, 'gat_concat_hidden': True, 'lr': 0.00012950570671177005, 'weight_decay': 1.2799631782415016e-05, 'epochs': 68, 'loss': 'mae', 'optimizer': 'adam', 'graph_mode': 'cutoff', 'cutoff': 0.8417942569574208, 'grm_norm': 'cosine_then_gcn', 'self_loops': False}. Best is trial 126 with value: 0.24692329289560697.
[I 2025-10-23 21:50:52,262] Trial 136 finished with value: 0.2121611328010554 and parameters: {'model_type': 'gat', 'hidden_dims': '[512, 128]', 'dropout': 0.5532908392446281, 'batch_norm': True, 'gat_heads': 7, 'gat_attn_dropout': 0.49866742003857517, 'gat_concat_hidden': True, 'lr': 0.00010128587243624467, 'weight_decay': 2.405898997090234e-05, 'epochs': 83, 'loss': 'mae', 'optimizer': 'adam', 'graph_mode': 'cutoff', 'cutoff': 0.8080152863672851, 'grm_norm': 'cosine_then_gcn', 'self_loops': False}. Best is trial 126 with value: 0.24692329289560697.
[I 2025-10-23 21:53:20,484] Trial 137 finished with value: 0.18937298164859742 and parameters: {'model_type': 'gat', 'hidden_dims': '[512, 128]', 'dropout': 0.4888934661999822, 'batch_norm': True, 'gat_heads': 7, 'gat_attn_dropout': 0.4791119616975742, 'gat_concat_hidden': False, 'lr': 0.0001784463311766251, 'weight_decay': 3.013629928185749e-05, 'epochs': 60, 'loss': 'mae', 'optimizer': 'adam', 'graph_mode': 'cutoff', 'cutoff': 0.8760273222033473, 'grm_norm': 'cosine_then_gcn', 'self_loops': False}. Best is trial 126 with value: 0.24692329289560697.
[I 2025-10-23 21:55:35,577] Trial 138 finished with value: 0.14743241154109146 and parameters: {'model_type': 'gat', 'hidden_dims': '[512, 128]', 'dropout': 0.5124374859420491, 'batch_norm': True, 'gat_heads': 7, 'gat_attn_dropout': 0.44327126864657684, 'gat_concat_hidden': True, 'lr': 0.000117348117583418, 'weight_decay': 1.6507397511135987e-05, 'epochs': 51, 'loss': 'mae', 'optimizer': 'adam', 'graph_mode': 'knn', 'source': 'grm', 'knn_k': 5, 'weighted_edges': False, 'symmetrize_mode': 'mutual'}. Best is trial 126 with value: 0.24692329289560697.
[I 2025-10-23 21:58:26,650] Trial 139 finished with value: 0.24150016440040276 and parameters: {'model_type': 'gat', 'hidden_dims': '[512, 128]', 'dropout': 0.5386924173653355, 'batch_norm': True, 'gat_heads': 7, 'gat_attn_dropout': 0.5234511181609409, 'gat_concat_hidden': True, 'lr': 0.00019566476180407627, 'weight_decay': 3.487406890512984e-05, 'epochs': 70, 'loss': 'mae', 'optimizer': 'adam', 'graph_mode': 'cutoff', 'cutoff': 0.8234432453350615, 'grm_norm': 'cosine_then_gcn', 'self_loops': False}. Best is trial 126 with value: 0.24692329289560697.
[I 2025-10-23 22:01:08,227] Trial 140 finished with value: 0.22894837230245296 and parameters: {'model_type': 'gat', 'hidden_dims': '[512, 64]', 'dropout': 0.28314596669709935, 'batch_norm': True, 'gat_heads': 7, 'gat_attn_dropout': 0.4758226242310186, 'gat_concat_hidden': True, 'lr': 0.00028606236437115425, 'weight_decay': 3.8860230441241885e-05, 'epochs': 66, 'loss': 'mae', 'optimizer': 'adam', 'graph_mode': 'cutoff', 'cutoff': 0.8167450037240763, 'grm_norm': 'cosine_then_gcn', 'self_loops': False}. Best is trial 126 with value: 0.24692329289560697.
[I 2025-10-23 22:04:05,663] Trial 141 finished with value: 0.24197603852546484 and parameters: {'model_type': 'gat', 'hidden_dims': '[512, 128]', 'dropout': 0.5433795037576418, 'batch_norm': True, 'gat_heads': 7, 'gat_attn_dropout': 0.5199894423109128, 'gat_concat_hidden': True, 'lr': 0.00014047276623104004, 'weight_decay': 7.410902976167718e-05, 'epochs': 73, 'loss': 'mae', 'optimizer': 'adam', 'graph_mode': 'cutoff', 'cutoff': 0.7886528680053542, 'grm_norm': 'cosine_then_gcn', 'self_loops': False}. Best is trial 126 with value: 0.24692329289560697.
[I 2025-10-23 22:07:05,175] Trial 142 finished with value: 0.23524150351665019 and parameters: {'model_type': 'gat', 'hidden_dims': '[512, 128]', 'dropout': 0.5440330893084322, 'batch_norm': True, 'gat_heads': 7, 'gat_attn_dropout': 0.505313832087519, 'gat_concat_hidden': True, 'lr': 0.00014413927468314342, 'weight_decay': 0.00012279703104537196, 'epochs': 74, 'loss': 'mae', 'optimizer': 'adam', 'graph_mode': 'cutoff', 'cutoff': 0.7864967409290861, 'grm_norm': 'cosine_then_gcn', 'self_loops': False}. Best is trial 126 with value: 0.24692329289560697.
[I 2025-10-23 22:10:00,484] Trial 143 finished with value: 0.22739879932619805 and parameters: {'model_type': 'gat', 'hidden_dims': '[512, 128]', 'dropout': 0.5314083289011797, 'batch_norm': True, 'gat_heads': 7, 'gat_attn_dropout': 0.5060097117865603, 'gat_concat_hidden': True, 'lr': 0.00018825012266319622, 'weight_decay': 8.181781749896989e-05, 'epochs': 72, 'loss': 'mae', 'optimizer': 'adam', 'graph_mode': 'cutoff', 'cutoff': 0.7788004657929387, 'grm_norm': 'cosine_then_gcn', 'self_loops': False}. Best is trial 126 with value: 0.24692329289560697.
[I 2025-10-23 22:13:12,002] Trial 144 finished with value: 0.2315018649521922 and parameters: {'model_type': 'gat', 'hidden_dims': '[512, 128]', 'dropout': 0.3285028065999492, 'batch_norm': True, 'gat_heads': 7, 'gat_attn_dropout': 0.5227040600460447, 'gat_concat_hidden': True, 'lr': 0.00014090323972723424, 'weight_decay': 1.0813206974939328e-05, 'epochs': 80, 'loss': 'mae', 'optimizer': 'adam', 'graph_mode': 'cutoff', 'cutoff': 0.7923734849686741, 'grm_norm': 'cosine_then_gcn', 'self_loops': False}. Best is trial 126 with value: 0.24692329289560697.
[I 2025-10-23 22:16:46,054] Trial 145 finished with value: 0.24073405985415225 and parameters: {'model_type': 'gat', 'hidden_dims': '[512, 128]', 'dropout': 0.4981555459091536, 'batch_norm': True, 'gat_heads': 7, 'gat_attn_dropout': 0.4710702497744664, 'gat_concat_hidden': True, 'lr': 0.00015845122650145604, 'weight_decay': 9.967254042841653e-05, 'epochs': 91, 'loss': 'mae', 'optimizer': 'adam', 'graph_mode': 'cutoff', 'cutoff': 0.764653600574864, 'grm_norm': 'cosine_then_gcn', 'self_loops': False}. Best is trial 126 with value: 0.24692329289560697.
[I 2025-10-23 22:20:26,155] Trial 146 finished with value: 0.22180797122215762 and parameters: {'model_type': 'gat', 'hidden_dims': '[512, 128]', 'dropout': 0.49378612903969366, 'batch_norm': True, 'gat_heads': 7, 'gat_attn_dropout': 0.4671089395521223, 'gat_concat_hidden': True, 'lr': 0.0001545997806933776, 'weight_decay': 0.0001332088561375462, 'epochs': 94, 'loss': 'mae', 'optimizer': 'adam', 'graph_mode': 'cutoff', 'cutoff': 0.760108126103273, 'grm_norm': 'cosine_then_gcn', 'self_loops': True}. Best is trial 126 with value: 0.24692329289560697.
[I 2025-10-23 22:24:00,696] Trial 147 finished with value: 0.22186199760438816 and parameters: {'model_type': 'gat', 'hidden_dims': '[512, 128]', 'dropout': 0.5051114407377483, 'batch_norm': True, 'gat_heads': 7, 'gat_attn_dropout': 0.3135849180679032, 'gat_concat_hidden': True, 'lr': 0.00019359698949259646, 'weight_decay': 9.044784943085433e-05, 'epochs': 91, 'loss': 'mae', 'optimizer': 'adam', 'graph_mode': 'cutoff', 'cutoff': 0.7263589768142531, 'grm_norm': 'cosine_then_gcn', 'self_loops': False}. Best is trial 126 with value: 0.24692329289560697.
[I 2025-10-23 22:27:56,991] Trial 148 finished with value: 0.2264588583207634 and parameters: {'model_type': 'gat', 'hidden_dims': '[512, 128]', 'dropout': 0.5185278982177115, 'batch_norm': True, 'gat_heads': 7, 'gat_attn_dropout': 0.49428855232385455, 'gat_concat_hidden': True, 'lr': 0.000269945505597443, 'weight_decay': 0.00020350579499234754, 'epochs': 102, 'loss': 'mae', 'optimizer': 'adam', 'graph_mode': 'cutoff', 'cutoff': 0.8013883381101506, 'grm_norm': 'cosine_then_gcn', 'self_loops': False}. Best is trial 126 with value: 0.24692329289560697.
[I 2025-10-23 22:31:06,498] Trial 149 finished with value: 0.23178258021502404 and parameters: {'model_type': 'gat', 'hidden_dims': '[512, 128]', 'dropout': 0.5435716048179107, 'batch_norm': True, 'gat_heads': 7, 'gat_attn_dropout': 0.5389112586405937, 'gat_concat_hidden': True, 'lr': 0.0001678889998235872, 'weight_decay': 0.00012218378321211216, 'epochs': 79, 'loss': 'mae', 'optimizer': 'adam', 'graph_mode': 'cutoff', 'cutoff': 0.7506859737447372, 'grm_norm': 'cosine_then_gcn', 'self_loops': False}. Best is trial 126 with value: 0.24692329289560697.
