[I 2025-11-03 13:54:40,345] Trial 36 finished with value: 0.061948815964126096 and parameters: {'model_type': 'gcn', 'hidden_dims': '[512, 64]', 'dropout': 0.3983179069062818, 'batch_norm': True, 'lr': 0.00018336890780698944, 'weight_decay': 1.2975703658853108e-06, 'epochs': 274, 'loss': 'mae', 'optimizer': 'adam', 'graph_mode': 'off', 'use_snp_selection': True, 'num_snps': 58661}. Best is trial 6 with value: 0.07880801334778773.
[I 2025-11-03 13:54:42,251] Trial 37 finished with value: 0.05645833850945189 and parameters: {'model_type': 'gcn', 'hidden_dims': '[256, 128, 64]', 'dropout': 0.11190079470958687, 'batch_norm': False, 'lr': 0.00034178508331667387, 'weight_decay': 9.096918760018813e-05, 'epochs': 335, 'loss': 'mse', 'optimizer': 'adam', 'graph_mode': 'off', 'use_snp_selection': False}. Best is trial 6 with value: 0.07880801334778773.
[I 2025-11-03 13:54:43,829] Trial 38 finished with value: -0.001002309433272952 and parameters: {'model_type': 'gcn', 'hidden_dims': '[512, 128]', 'dropout': 0.46348439059080443, 'batch_norm': True, 'lr': 6.481954846846461e-06, 'weight_decay': 8.19285891183218e-06, 'epochs': 282, 'loss': 'mae', 'optimizer': 'adam', 'graph_mode': 'off', 'use_snp_selection': True, 'num_snps': 19911}. Best is trial 6 with value: 0.07880801334778773.
[I 2025-11-03 13:54:46,269] Trial 39 finished with value: 0.05579042251085996 and parameters: {'model_type': 'gcn', 'hidden_dims': '[512, 256]', 'dropout': 0.16021400793788773, 'batch_norm': True, 'lr': 0.0006109727740430378, 'weight_decay': 2.802138162444238e-05, 'epochs': 348, 'loss': 'mse', 'optimizer': 'adam', 'graph_mode': 'off', 'use_snp_selection': False}. Best is trial 6 with value: 0.07880801334778773.
[I 2025-11-03 13:54:48,063] Trial 40 finished with value: 0.042244892915416166 and parameters: {'model_type': 'gcn', 'hidden_dims': '[512, 64]', 'dropout': 0.35237785008091616, 'batch_norm': False, 'lr': 7.104724814014888e-05, 'weight_decay': 2.5389296274237693e-06, 'epochs': 219, 'loss': 'mae', 'optimizer': 'adam', 'graph_mode': 'off', 'use_snp_selection': False}. Best is trial 6 with value: 0.07880801334778773.
[I 2025-11-03 13:54:50,475] Trial 41 finished with value: 0.06266102992562214 and parameters: {'model_type': 'gcn', 'hidden_dims': '[512, 128]', 'dropout': 0.21356330388048264, 'batch_norm': True, 'lr': 0.0006430501552188014, 'weight_decay': 0.00014164125563580584, 'epochs': 331, 'loss': 'mae', 'optimizer': 'adam', 'graph_mode': 'off', 'use_snp_selection': False}. Best is trial 6 with value: 0.07880801334778773.
[I 2025-11-03 13:54:52,826] Trial 42 finished with value: 0.0569620599402124 and parameters: {'model_type': 'gcn', 'hidden_dims': '[512, 128]', 'dropout': 0.1361975271952258, 'batch_norm': True, 'lr': 0.0004536406283766, 'weight_decay': 0.00040031033027471954, 'epochs': 322, 'loss': 'mae', 'optimizer': 'adam', 'graph_mode': 'off', 'use_snp_selection': False}. Best is trial 6 with value: 0.07880801334778773.
[I 2025-11-03 13:54:55,027] Trial 43 finished with value: 0.07102300783890174 and parameters: {'model_type': 'gcn', 'hidden_dims': '[512, 128]', 'dropout': 0.1486756824915678, 'batch_norm': True, 'lr': 0.0002655702893407146, 'weight_decay': 0.0002040389883557638, 'epochs': 296, 'loss': 'mae', 'optimizer': 'adam', 'graph_mode': 'off', 'use_snp_selection': False}. Best is trial 6 with value: 0.07880801334778773.
[I 2025-11-03 13:54:57,027] Trial 44 finished with value: 0.0695703867311446 and parameters: {'model_type': 'gcn', 'hidden_dims': '[512, 128]', 'dropout': 0.14732061524300744, 'batch_norm': True, 'lr': 0.00028741802174184384, 'weight_decay': 0.0007411478079161487, 'epochs': 245, 'loss': 'mae', 'optimizer': 'adam', 'graph_mode': 'off', 'use_snp_selection': False}. Best is trial 6 with value: 0.07880801334778773.
[I 2025-11-03 13:54:58,989] Trial 45 finished with value: 0.06043188081839105 and parameters: {'model_type': 'gcn', 'hidden_dims': '[512, 128]', 'dropout': 0.1508384505572716, 'batch_norm': True, 'lr': 0.0001383667112832493, 'weight_decay': 0.0006635234817351488, 'epochs': 250, 'loss': 'mae', 'optimizer': 'adam', 'graph_mode': 'off', 'use_snp_selection': False}. Best is trial 6 with value: 0.07880801334778773.
[I 2025-11-03 13:55:00,163] Trial 46 finished with value: 0.056765379200780286 and parameters: {'model_type': 'gcn', 'hidden_dims': '[256, 128]', 'dropout': 0.2575052209037903, 'batch_norm': True, 'lr': 0.0002827852899378472, 'weight_decay': 0.0007772279129774364, 'epochs': 183, 'loss': 'mse', 'optimizer': 'adam', 'graph_mode': 'off', 'use_snp_selection': False}. Best is trial 6 with value: 0.07880801334778773.
[I 2025-11-03 13:55:02,045] Trial 47 finished with value: 0.015098927545172027 and parameters: {'model_type': 'gcn', 'hidden_dims': '[512, 128]', 'dropout': 0.18199901944611047, 'batch_norm': False, 'lr': 0.0003368406379275874, 'weight_decay': 0.0002747942807856569, 'epochs': 242, 'loss': 'mae', 'optimizer': 'adam', 'graph_mode': 'off', 'use_snp_selection': False}. Best is trial 6 with value: 0.07880801334778773.
[I 2025-11-03 13:55:03,267] Trial 48 finished with value: -0.007690559439197307 and parameters: {'model_type': 'gcn', 'hidden_dims': '[128, 64]', 'dropout': 0.14308095906415108, 'batch_norm': True, 'lr': 1.1170552432785515e-06, 'weight_decay': 0.0005170363382455172, 'epochs': 270, 'loss': 'mse', 'optimizer': 'adam', 'graph_mode': 'off', 'use_snp_selection': False}. Best is trial 6 with value: 0.07880801334778773.
[I 2025-11-03 13:55:05,543] Trial 49 finished with value: 0.06500985435109459 and parameters: {'model_type': 'gcn', 'hidden_dims': '[512, 256]', 'dropout': 0.2291956450496911, 'batch_norm': False, 'lr': 0.00016520682393409575, 'weight_decay': 3.946637445760036e-07, 'epochs': 229, 'loss': 'mae', 'optimizer': 'adam', 'graph_mode': 'off', 'use_snp_selection': True, 'num_snps': 46888}. Best is trial 6 with value: 0.07880801334778773.
[I 2025-11-03 13:55:07,097] Trial 50 finished with value: 0.024714139953721077 and parameters: {'model_type': 'gcn', 'hidden_dims': '[256, 128]', 'dropout': 0.2698443945713901, 'batch_norm': True, 'lr': 2.8878191455207526e-05, 'weight_decay': 0.0002163152471706957, 'epochs': 291, 'loss': 'mae', 'optimizer': 'adam', 'graph_mode': 'off', 'use_snp_selection': False}. Best is trial 6 with value: 0.07880801334778773.
[I 2025-11-03 13:55:09,384] Trial 51 finished with value: 0.045858345681684155 and parameters: {'model_type': 'gcn', 'hidden_dims': '[512, 128]', 'dropout': 0.11642629919609454, 'batch_norm': True, 'lr': 0.00025065231298256204, 'weight_decay': 0.0001749050756399567, 'epochs': 308, 'loss': 'mae', 'optimizer': 'adam', 'graph_mode': 'off', 'use_snp_selection': False}. Best is trial 6 with value: 0.07880801334778773.
[I 2025-11-03 13:55:11,136] Trial 52 finished with value: 0.07526029809290825 and parameters: {'model_type': 'gcn', 'hidden_dims': '[512, 128]', 'dropout': 0.38163578586210556, 'batch_norm': True, 'lr': 0.0007484427026319452, 'weight_decay': 7.519829118407656e-07, 'epochs': 199, 'loss': 'mae', 'optimizer': 'adam', 'graph_mode': 'off', 'use_snp_selection': False}. Best is trial 6 with value: 0.07880801334778773.
[I 2025-11-03 13:55:12,863] Trial 53 finished with value: 0.06576959817526988 and parameters: {'model_type': 'gcn', 'hidden_dims': '[512, 128]', 'dropout': 0.37539978831527, 'batch_norm': True, 'lr': 0.0007652826440424154, 'weight_decay': 0.000942479801705023, 'epochs': 197, 'loss': 'mae', 'optimizer': 'adam', 'graph_mode': 'off', 'use_snp_selection': False}. Best is trial 6 with value: 0.07880801334778773.
[I 2025-11-03 13:55:14,427] Trial 54 finished with value: 0.06591930627306736 and parameters: {'model_type': 'gcn', 'hidden_dims': '[512, 128]', 'dropout': 0.40839456765397764, 'batch_norm': True, 'lr': 0.000445610931936921, 'weight_decay': 7.806013903746299e-07, 'epochs': 164, 'loss': 'mae', 'optimizer': 'adam', 'graph_mode': 'off', 'use_snp_selection': False}. Best is trial 6 with value: 0.07880801334778773.
[I 2025-11-03 13:55:15,941] Trial 55 finished with value: 0.0741921054226368 and parameters: {'model_type': 'gcn', 'hidden_dims': '[256, 128, 64]', 'dropout': 0.3265610404057079, 'batch_norm': True, 'lr': 0.0009902534092014693, 'weight_decay': 1.5733308199703283e-06, 'epochs': 213, 'loss': 'mse', 'optimizer': 'adam', 'graph_mode': 'off', 'use_snp_selection': False}. Best is trial 6 with value: 0.07880801334778773.
[I 2025-11-03 13:55:17,116] Trial 56 finished with value: 0.011945733870690624 and parameters: {'model_type': 'gcn', 'hidden_dims': '[256, 128, 64]', 'dropout': 0.32809099024142446, 'batch_norm': False, 'lr': 0.0009591086813342151, 'weight_decay': 1.7443622100770702e-06, 'epochs': 147, 'loss': 'mse', 'optimizer': 'adam', 'graph_mode': 'off', 'use_snp_selection': False}. Best is trial 6 with value: 0.07880801334778773.
[I 2025-11-03 13:55:18,595] Trial 57 finished with value: 0.0776644275976927 and parameters: {'model_type': 'gcn', 'hidden_dims': '[256, 128, 64]', 'dropout': 0.5258194955309446, 'batch_norm': True, 'lr': 0.0007207991105595786, 'weight_decay': 2.60353538876114e-07, 'epochs': 212, 'loss': 'mse', 'optimizer': 'adam', 'graph_mode': 'off', 'use_snp_selection': False}. Best is trial 6 with value: 0.07880801334778773.
[I 2025-11-03 13:55:20,073] Trial 58 finished with value: 0.08659301246794728 and parameters: {'model_type': 'gcn', 'hidden_dims': '[256, 128, 64]', 'dropout': 0.5223205445937444, 'batch_norm': True, 'lr': 0.0009974356547062346, 'weight_decay': 2.3525186230200996e-07, 'epochs': 211, 'loss': 'mse', 'optimizer': 'adam', 'graph_mode': 'off', 'use_snp_selection': False}. Best is trial 58 with value: 0.08659301246794728.
[I 2025-11-03 13:55:21,535] Trial 59 finished with value: 0.026890542090666176 and parameters: {'model_type': 'gcn', 'hidden_dims': '[256, 128, 64]', 'dropout': 0.5221400804943259, 'batch_norm': False, 'lr': 0.0007728717363983273, 'weight_decay': 2.0185389668636742e-07, 'epochs': 214, 'loss': 'mse', 'optimizer': 'adam', 'graph_mode': 'off', 'use_snp_selection': False}. Best is trial 58 with value: 0.08659301246794728.
[I 2025-11-03 13:55:22,893] Trial 60 finished with value: 0.06259865963205548 and parameters: {'model_type': 'gcn', 'hidden_dims': '[256, 128, 64]', 'dropout': 0.5973765641309059, 'batch_norm': True, 'lr': 0.0005335535775145433, 'weight_decay': 5.776184926929762e-07, 'epochs': 188, 'loss': 'mse', 'optimizer': 'adam', 'graph_mode': 'off', 'use_snp_selection': False}. Best is trial 58 with value: 0.08659301246794728.
[I 2025-11-03 13:55:24,334] Trial 61 finished with value: 0.07008215873479255 and parameters: {'model_type': 'gcn', 'hidden_dims': '[256, 128, 64]', 'dropout': 0.5474013740332369, 'batch_norm': True, 'lr': 0.0009795294555825036, 'weight_decay': 3.3993195152811243e-07, 'epochs': 203, 'loss': 'mse', 'optimizer': 'adam', 'graph_mode': 'off', 'use_snp_selection': False}. Best is trial 58 with value: 0.08659301246794728.
[I 2025-11-03 13:55:25,605] Trial 62 finished with value: 0.06969930840623137 and parameters: {'model_type': 'gcn', 'hidden_dims': '[256, 128, 64]', 'dropout': 0.5050446020358313, 'batch_norm': True, 'lr': 0.0007064243137410966, 'weight_decay': 1.573807272847972e-07, 'epochs': 166, 'loss': 'mse', 'optimizer': 'adam', 'graph_mode': 'off', 'use_snp_selection': False}. Best is trial 58 with value: 0.08659301246794728.
[I 2025-11-03 13:55:27,109] Trial 63 finished with value: 0.048487716381260274 and parameters: {'model_type': 'gcn', 'hidden_dims': '[256, 128, 64]', 'dropout': 0.4628515659561067, 'batch_norm': True, 'lr': 0.00040961031529320146, 'weight_decay': 3.316041483451571e-07, 'epochs': 224, 'loss': 'mse', 'optimizer': 'adam', 'graph_mode': 'off', 'use_snp_selection': False}. Best is trial 58 with value: 0.08659301246794728.
[I 2025-11-03 13:55:28,423] Trial 64 finished with value: 0.06818862459860285 and parameters: {'model_type': 'gcn', 'hidden_dims': '[256, 128, 64]', 'dropout': 0.44368284807328595, 'batch_norm': True, 'lr': 0.0004998065890516362, 'weight_decay': 3.4158838070855283e-06, 'epochs': 173, 'loss': 'mse', 'optimizer': 'adam', 'graph_mode': 'off', 'use_snp_selection': False}. Best is trial 58 with value: 0.08659301246794728.
[I 2025-11-03 13:55:29,803] Trial 65 finished with value: 0.075615965671557 and parameters: {'model_type': 'gcn', 'hidden_dims': '[256, 128, 64]', 'dropout': 0.541838698411284, 'batch_norm': True, 'lr': 0.0008055162594470718, 'weight_decay': 5.4393348109476855e-06, 'epochs': 194, 'loss': 'mse', 'optimizer': 'adam', 'graph_mode': 'off', 'use_snp_selection': False}. Best is trial 58 with value: 0.08659301246794728.
[I 2025-11-03 13:55:31,131] Trial 66 finished with value: 0.06266899937251617 and parameters: {'model_type': 'gcn', 'hidden_dims': '[256, 128, 64]', 'dropout': 0.5660649453897539, 'batch_norm': True, 'lr': 0.0007711407716126939, 'weight_decay': 4.821832015689265e-06, 'epochs': 136, 'loss': 'mse', 'optimizer': 'adam', 'graph_mode': 'off', 'use_snp_selection': True, 'num_snps': 22881}. Best is trial 58 with value: 0.08659301246794728.
[I 2025-11-03 13:55:32,519] Trial 67 finished with value: 0.0672233522325773 and parameters: {'model_type': 'gcn', 'hidden_dims': '[256, 128, 64]', 'dropout': 0.5079119959426672, 'batch_norm': True, 'lr': 0.000855099458000036, 'weight_decay': 7.746950731419604e-07, 'epochs': 195, 'loss': 'mse', 'optimizer': 'adam', 'graph_mode': 'off', 'use_snp_selection': False}. Best is trial 58 with value: 0.08659301246794728.
[I 2025-11-03 13:55:33,921] Trial 68 finished with value: -0.030304963468804378 and parameters: {'model_type': 'gcn', 'hidden_dims': '[256, 128, 64]', 'dropout': 0.5786542990983491, 'batch_norm': False, 'lr': 0.0005511280769585186, 'weight_decay': 1.3981114765479894e-06, 'epochs': 211, 'loss': 'mse', 'optimizer': 'adam', 'graph_mode': 'off', 'use_snp_selection': False}. Best is trial 58 with value: 0.08659301246794728.
[I 2025-11-03 13:55:35,464] Trial 69 finished with value: -0.0018473362514826789 and parameters: {'model_type': 'gcn', 'hidden_dims': '[256, 128, 64]', 'dropout': 0.548041780218411, 'batch_norm': True, 'lr': 1.5006379676206754e-05, 'weight_decay': 2.138536740369953e-06, 'epochs': 231, 'loss': 'mse', 'optimizer': 'adam', 'graph_mode': 'off', 'use_snp_selection': False}. Best is trial 58 with value: 0.08659301246794728.
[I 2025-11-03 13:55:36,801] Trial 70 finished with value: 0.06925052667860106 and parameters: {'model_type': 'gcn', 'hidden_dims': '[256, 128, 64]', 'dropout': 0.48837470622147267, 'batch_norm': True, 'lr': 0.0006580599919561652, 'weight_decay': 4.6943836985920355e-07, 'epochs': 181, 'loss': 'mse', 'optimizer': 'adam', 'graph_mode': 'off', 'use_snp_selection': False}. Best is trial 58 with value: 0.08659301246794728.
[I 2025-11-03 13:55:38,516] Trial 71 finished with value: 0.043502634658899746 and parameters: {'model_type': 'gcn', 'hidden_dims': '[512, 64]', 'dropout': 0.5432903266085043, 'batch_norm': True, 'lr': 0.00039094129735768346, 'weight_decay': 3.197523053306034e-06, 'epochs': 197, 'loss': 'mse', 'optimizer': 'adam', 'graph_mode': 'off', 'use_snp_selection': False}. Best is trial 58 with value: 0.08659301246794728.
[I 2025-11-03 13:55:39,856] Trial 72 finished with value: 0.07696032762942462 and parameters: {'model_type': 'gcn', 'hidden_dims': '[256, 128]', 'dropout': 0.2975442162118037, 'batch_norm': True, 'lr': 0.0009772341457443688, 'weight_decay': 6.090605222954301e-06, 'epochs': 238, 'loss': 'mse', 'optimizer': 'adam', 'graph_mode': 'off', 'use_snp_selection': False}. Best is trial 58 with value: 0.08659301246794728.
[I 2025-11-03 13:55:41,329] Trial 73 finished with value: 0.07451011361641664 and parameters: {'model_type': 'gcn', 'hidden_dims': '[256, 128]', 'dropout': 0.2964377468140762, 'batch_norm': True, 'lr': 0.0009508871941556467, 'weight_decay': 6.685565607907777e-06, 'epochs': 236, 'loss': 'mse', 'optimizer': 'adam', 'graph_mode': 'off', 'use_snp_selection': False}. Best is trial 58 with value: 0.08659301246794728.
[I 2025-11-03 13:55:42,752] Trial 74 finished with value: 0.0665963614296074 and parameters: {'model_type': 'gcn', 'hidden_dims': '[256, 128]', 'dropout': 0.2919353380286706, 'batch_norm': True, 'lr': 0.0006871072966211262, 'weight_decay': 6.426124697275019e-06, 'epochs': 261, 'loss': 'mse', 'optimizer': 'adam', 'graph_mode': 'off', 'use_snp_selection': False}. Best is trial 58 with value: 0.08659301246794728.
[I 2025-11-03 13:55:44,134] Trial 75 finished with value: 0.06483194343945048 and parameters: {'model_type': 'gcn', 'hidden_dims': '[256, 128]', 'dropout': 0.3843517347200856, 'batch_norm': True, 'lr': 0.0008141534201954473, 'weight_decay': 4.729100155575622e-06, 'epochs': 241, 'loss': 'mse', 'optimizer': 'adam', 'graph_mode': 'off', 'use_snp_selection': False}. Best is trial 58 with value: 0.08659301246794728.
[I 2025-11-03 13:55:45,423] Trial 76 finished with value: 0.05592081302393083 and parameters: {'model_type': 'gcn', 'hidden_dims': '[256, 128]', 'dropout': 0.295982330809843, 'batch_norm': True, 'lr': 0.0005269151573946368, 'weight_decay': 1.4264014487414035e-05, 'epochs': 220, 'loss': 'mse', 'optimizer': 'adam', 'graph_mode': 'off', 'use_snp_selection': False}. Best is trial 58 with value: 0.08659301246794728.
[I 2025-11-03 13:55:46,645] Trial 77 finished with value: 0.043750201349986084 and parameters: {'model_type': 'gcn', 'hidden_dims': '[256, 128]', 'dropout': 0.4255363848404823, 'batch_norm': False, 'lr': 0.0006143825905990944, 'weight_decay': 9.375989771833814e-06, 'epochs': 207, 'loss': 'mse', 'optimizer': 'adam', 'graph_mode': 'off', 'use_snp_selection': False}. Best is trial 58 with value: 0.08659301246794728.
[I 2025-11-03 13:55:47,612] Trial 78 finished with value: 0.011467419806003255 and parameters: {'model_type': 'gcn', 'hidden_dims': '[256, 128]', 'dropout': 0.5312239779247352, 'batch_norm': True, 'lr': 0.0008337417624755142, 'weight_decay': 5.956094278352815e-06, 'epochs': 234, 'loss': 'mse', 'optimizer': 'adam', 'graph_mode': 'off', 'use_snp_selection': True, 'num_snps': 2246}. Best is trial 58 with value: 0.08659301246794728.
[I 2025-11-03 13:55:48,810] Trial 79 finished with value: 0.062465177398426136 and parameters: {'model_type': 'gcn', 'hidden_dims': '[256, 128]', 'dropout': 0.3465521713177667, 'batch_norm': True, 'lr': 0.000470072830540245, 'weight_decay': 1.2611888704963646e-05, 'epochs': 191, 'loss': 'mse', 'optimizer': 'adam', 'graph_mode': 'off', 'use_snp_selection': False}. Best is trial 58 with value: 0.08659301246794728.
[I 2025-11-03 13:55:50,190] Trial 80 finished with value: 0.06643656429684416 and parameters: {'model_type': 'gcn', 'hidden_dims': '[256, 128]', 'dropout': 0.4513675461889417, 'batch_norm': True, 'lr': 0.00035480453367180864, 'weight_decay': 2.2002658111928435e-07, 'epochs': 252, 'loss': 'mse', 'optimizer': 'adam', 'graph_mode': 'off', 'use_snp_selection': False}. Best is trial 58 with value: 0.08659301246794728.
[I 2025-11-03 13:55:51,615] Trial 81 finished with value: 0.058403764573739116 and parameters: {'model_type': 'gcn', 'hidden_dims': '[256, 128, 64]', 'dropout': 0.32445244386134403, 'batch_norm': True, 'lr': 0.0009762933582665711, 'weight_decay': 9.978133550453953e-07, 'epochs': 202, 'loss': 'mse', 'optimizer': 'adam', 'graph_mode': 'off', 'use_snp_selection': False}. Best is trial 58 with value: 0.08659301246794728.
[I 2025-11-03 13:55:52,687] Trial 82 finished with value: 0.04691550032630962 and parameters: {'model_type': 'gcn', 'hidden_dims': '[128, 64]', 'dropout': 0.3582379549660321, 'batch_norm': True, 'lr': 0.0009908890258683062, 'weight_decay': 1.172823721793619e-07, 'epochs': 221, 'loss': 'mse', 'optimizer': 'adam', 'graph_mode': 'off', 'use_snp_selection': False}. Best is trial 58 with value: 0.08659301246794728.
[I 2025-11-03 13:55:53,832] Trial 83 finished with value: 0.08091658857808984 and parameters: {'model_type': 'gcn', 'hidden_dims': '[256, 128]', 'dropout': 0.3347922805789049, 'batch_norm': True, 'lr': 0.0006846710003790791, 'weight_decay': 2.9086398034235635e-06, 'epochs': 176, 'loss': 'mse', 'optimizer': 'adam', 'graph_mode': 'off', 'use_snp_selection': False}. Best is trial 58 with value: 0.08659301246794728.
[I 2025-11-03 13:55:54,888] Trial 84 finished with value: 0.010452542459271127 and parameters: {'model_type': 'gcn', 'hidden_dims': '[256, 128]', 'dropout': 0.49733228678203023, 'batch_norm': True, 'lr': 2.715164838610728e-06, 'weight_decay': 2.659138066767944e-06, 'epochs': 156, 'loss': 'mse', 'optimizer': 'adam', 'graph_mode': 'off', 'use_snp_selection': False}. Best is trial 58 with value: 0.08659301246794728.
[I 2025-11-03 13:55:56,027] Trial 85 finished with value: 0.0498030324526517 and parameters: {'model_type': 'gcn', 'hidden_dims': '[256, 128]', 'dropout': 0.3777026233804489, 'batch_norm': True, 'lr': 0.0006544335527793375, 'weight_decay': 8.049556452720546e-06, 'epochs': 174, 'loss': 'mse', 'optimizer': 'adam', 'graph_mode': 'off', 'use_snp_selection': False}. Best is trial 58 with value: 0.08659301246794728.
[I 2025-11-03 13:55:57,200] Trial 86 finished with value: 0.053039619127670176 and parameters: {'model_type': 'gcn', 'hidden_dims': '[256, 128]', 'dropout': 0.33610804746607564, 'batch_norm': True, 'lr': 0.0007782424609018088, 'weight_decay': 5.066520148618257e-06, 'epochs': 181, 'loss': 'mse', 'optimizer': 'adam', 'graph_mode': 'off', 'use_snp_selection': False}. Best is trial 58 with value: 0.08659301246794728.
[I 2025-11-03 13:55:58,186] Trial 87 finished with value: 0.05720020872972699 and parameters: {'model_type': 'gcn', 'hidden_dims': '[256, 128]', 'dropout': 0.2671292574223657, 'batch_norm': False, 'lr': 0.000552486864662091, 'weight_decay': 2.0616799077520676e-06, 'epochs': 137, 'loss': 'mse', 'optimizer': 'adam', 'graph_mode': 'off', 'use_snp_selection': False}. Best is trial 58 with value: 0.08659301246794728.
