[I 2025-10-21 07:19:06,236] Trial 49 finished with value: 0.12369454950878615 and parameters: {'model_type': 'gat', 'hidden_dims': '[128, 64]', 'dropout': 0.5373202842271474, 'batch_norm': True, 'gat_heads': 6, 'gat_attn_dropout': 0.1478376967584885, 'gat_concat_hidden': False, 'lr': 4.764427508110588e-05, 'weight_decay': 2.926425151177316e-06, 'epochs': 148, 'loss': 'mae', 'optimizer': 'adam', 'graph_mode': 'cutoff', 'cutoff': 0.5183925440032591, 'grm_norm': 'cosine_then_gcn', 'self_loops': True}. Best is trial 32 with value: 0.2586181751914642.
[I 2025-10-21 07:19:45,681] Trial 50 finished with value: 0.1593332741860139 and parameters: {'model_type': 'gat', 'hidden_dims': '[256, 128, 64]', 'dropout': 0.4503309159882492, 'batch_norm': False, 'gat_heads': 1, 'gat_attn_dropout': 0.20568238098616456, 'gat_concat_hidden': False, 'lr': 1.0711162954002652e-05, 'weight_decay': 6.220417290588914e-05, 'epochs': 182, 'loss': 'mae', 'optimizer': 'adam', 'graph_mode': 'knn', 'source': 'grm', 'knn_k': 7, 'weighted_edges': False, 'symmetrize_mode': 'union'}. Best is trial 32 with value: 0.2586181751914642.
[I 2025-10-21 07:21:03,316] Trial 51 finished with value: 0.2003930827328202 and parameters: {'model_type': 'gat', 'hidden_dims': '[128, 64]', 'dropout': 0.4751559292359874, 'batch_norm': False, 'gat_heads': 5, 'gat_attn_dropout': 0.23683908540737628, 'gat_concat_hidden': False, 'lr': 0.0001965705257089548, 'weight_decay': 0.0002821037692404936, 'epochs': 172, 'loss': 'mae', 'optimizer': 'adam', 'graph_mode': 'cutoff', 'cutoff': 0.5781811772490398, 'grm_norm': 'none', 'self_loops': True}. Best is trial 32 with value: 0.2586181751914642.
[I 2025-10-21 07:22:06,720] Trial 52 finished with value: 0.2589532475445489 and parameters: {'model_type': 'gat', 'hidden_dims': '[128, 64]', 'dropout': 0.4227484340105464, 'batch_norm': False, 'gat_heads': 5, 'gat_attn_dropout': 0.18424908925952663, 'gat_concat_hidden': False, 'lr': 7.438966541066012e-05, 'weight_decay': 0.00019913055154119802, 'epochs': 137, 'loss': 'mae', 'optimizer': 'adam', 'graph_mode': 'cutoff', 'cutoff': 0.5640434243023813, 'grm_norm': 'none', 'self_loops': True}. Best is trial 52 with value: 0.2589532475445489.
[I 2025-10-21 07:23:20,325] Trial 53 finished with value: 0.22090518973551165 and parameters: {'model_type': 'gat', 'hidden_dims': '[128, 64]', 'dropout': 0.4189636834222819, 'batch_norm': False, 'gat_heads': 6, 'gat_attn_dropout': 0.1699171989567659, 'gat_concat_hidden': False, 'lr': 7.30504621548889e-05, 'weight_decay': 0.0001420635127783768, 'epochs': 132, 'loss': 'mae', 'optimizer': 'adam', 'graph_mode': 'cutoff', 'cutoff': 0.45172416785568076, 'grm_norm': 'none', 'self_loops': True}. Best is trial 52 with value: 0.2589532475445489.
[I 2025-10-21 07:24:32,733] Trial 54 finished with value: 0.22483754669621173 and parameters: {'model_type': 'gat', 'hidden_dims': '[128, 64]', 'dropout': 0.38950077451099807, 'batch_norm': False, 'gat_heads': 5, 'gat_attn_dropout': 0.1232281853431885, 'gat_concat_hidden': False, 'lr': 0.00010211580865133843, 'weight_decay': 0.000656390310945357, 'epochs': 159, 'loss': 'mae', 'optimizer': 'adam', 'graph_mode': 'cutoff', 'cutoff': 0.6069156827596156, 'grm_norm': 'none', 'self_loops': True}. Best is trial 52 with value: 0.2589532475445489.
[I 2025-10-21 07:25:25,972] Trial 55 finished with value: 0.24653369841361675 and parameters: {'model_type': 'gat', 'hidden_dims': '[128, 64]', 'dropout': 0.3653268150191902, 'batch_norm': False, 'gat_heads': 5, 'gat_attn_dropout': 0.35835542606968945, 'gat_concat_hidden': False, 'lr': 6.567563040802867e-05, 'weight_decay': 0.00019983992133631412, 'epochs': 113, 'loss': 'mae', 'optimizer': 'adam', 'graph_mode': 'cutoff', 'cutoff': 0.6542939343247614, 'grm_norm': 'none', 'self_loops': True}. Best is trial 52 with value: 0.2589532475445489.
[I 2025-10-21 07:29:56,434] Trial 56 finished with value: 0.23734276122232667 and parameters: {'model_type': 'gat', 'hidden_dims': '[512, 256]', 'dropout': 0.5185255396456463, 'batch_norm': False, 'gat_heads': 6, 'gat_attn_dropout': 0.19677198174394292, 'gat_concat_hidden': False, 'lr': 0.0001291083075137104, 'weight_decay': 6.964854891321165e-05, 'epochs': 144, 'loss': 'mae', 'optimizer': 'adam', 'graph_mode': 'cutoff', 'cutoff': 0.5392524189945603, 'grm_norm': 'none', 'self_loops': True}. Best is trial 52 with value: 0.2589532475445489.
[I 2025-10-21 07:32:05,115] Trial 57 finished with value: 0.2491857988384718 and parameters: {'model_type': 'gat', 'hidden_dims': '[512, 64]', 'dropout': 0.4914943064055011, 'batch_norm': False, 'gat_heads': 4, 'gat_attn_dropout': 0.24437333294032879, 'gat_concat_hidden': False, 'lr': 3.502354096157541e-05, 'weight_decay': 0.00033482279253955495, 'epochs': 96, 'loss': 'mae', 'optimizer': 'adam', 'graph_mode': 'cutoff', 'cutoff': 0.6041163594877133, 'grm_norm': 'cosine', 'self_loops': True}. Best is trial 52 with value: 0.2589532475445489.
[I 2025-10-21 07:34:47,720] Trial 58 finished with value: 0.25533557330611517 and parameters: {'model_type': 'gat', 'hidden_dims': '[256, 128]', 'dropout': 0.3308401930760112, 'batch_norm': False, 'gat_heads': 5, 'gat_attn_dropout': 0.05168020881436819, 'gat_concat_hidden': False, 'lr': 2.0687639605603263e-05, 'weight_decay': 0.0003914389978749019, 'epochs': 188, 'loss': 'mae', 'optimizer': 'adam', 'graph_mode': 'cutoff', 'cutoff': 0.5003701621958835, 'grm_norm': 'cosine_then_gcn', 'self_loops': False}. Best is trial 52 with value: 0.2589532475445489.
[I 2025-10-21 07:36:49,740] Trial 59 finished with value: 0.22226514535351316 and parameters: {'model_type': 'gat', 'hidden_dims': '[256, 128]', 'dropout': 0.3403020103260529, 'batch_norm': False, 'gat_heads': 4, 'gat_attn_dropout': 0.04626340477022761, 'gat_concat_hidden': False, 'lr': 2.1061896876681446e-05, 'weight_decay': 0.0003976226319056664, 'epochs': 191, 'loss': 'mae', 'optimizer': 'adam', 'graph_mode': 'cutoff', 'cutoff': 0.37100988227381115, 'grm_norm': 'cosine_then_gcn', 'self_loops': False}. Best is trial 52 with value: 0.2589532475445489.
[I 2025-10-21 07:38:46,332] Trial 60 finished with value: 0.16918704556861003 and parameters: {'model_type': 'gat', 'hidden_dims': '[256, 128]', 'dropout': 0.27962791866631925, 'batch_norm': False, 'gat_heads': 3, 'gat_attn_dropout': 0.08746264657886627, 'gat_concat_hidden': True, 'lr': 7.204612220497992e-06, 'weight_decay': 0.00011485510112487198, 'epochs': 210, 'loss': 'mse', 'optimizer': 'adam', 'graph_mode': 'cutoff', 'cutoff': 0.26066545760818777, 'grm_norm': 'cosine_then_gcn', 'self_loops': False}. Best is trial 52 with value: 0.2589532475445489.
[I 2025-10-21 07:41:02,963] Trial 61 finished with value: 0.24469792325936437 and parameters: {'model_type': 'gat', 'hidden_dims': '[256, 128]', 'dropout': 0.4253741075555704, 'batch_norm': False, 'gat_heads': 5, 'gat_attn_dropout': 0.14343918194101804, 'gat_concat_hidden': False, 'lr': 0.00024042550949532077, 'weight_decay': 0.0006277372119772617, 'epochs': 157, 'loss': 'mae', 'optimizer': 'adam', 'graph_mode': 'cutoff', 'cutoff': 0.5058535626420745, 'grm_norm': 'cosine_then_gcn', 'self_loops': False}. Best is trial 52 with value: 0.2589532475445489.
[I 2025-10-21 07:44:00,409] Trial 62 finished with value: 0.2392657735378914 and parameters: {'model_type': 'gat', 'hidden_dims': '[256, 128]', 'dropout': 0.45004015912835516, 'batch_norm': False, 'gat_heads': 6, 'gat_attn_dropout': 0.11484049727538335, 'gat_concat_hidden': False, 'lr': 0.00011864499039386535, 'weight_decay': 0.00020620187682815702, 'epochs': 193, 'loss': 'mae', 'optimizer': 'adam', 'graph_mode': 'cutoff', 'cutoff': 0.5600696256615214, 'grm_norm': 'cosine_then_gcn', 'self_loops': False}. Best is trial 52 with value: 0.2589532475445489.
[I 2025-10-21 07:45:21,954] Trial 63 finished with value: 0.22769886616323792 and parameters: {'model_type': 'gat', 'hidden_dims': '[128, 64]', 'dropout': 0.403130722541477, 'batch_norm': False, 'gat_heads': 5, 'gat_attn_dropout': 0.06947287261810664, 'gat_concat_hidden': False, 'lr': 1.3957305802485563e-05, 'weight_decay': 0.0003428622877951537, 'epochs': 178, 'loss': 'mae', 'optimizer': 'adam', 'graph_mode': 'cutoff', 'cutoff': 0.46145835843228394, 'grm_norm': 'none', 'self_loops': True}. Best is trial 52 with value: 0.2589532475445489.
[I 2025-10-21 07:47:10,221] Trial 64 finished with value: 0.2090076509622781 and parameters: {'model_type': 'gat', 'hidden_dims': '[128, 64]', 'dropout': 0.32690946466535153, 'batch_norm': False, 'gat_heads': 5, 'gat_attn_dropout': 0.31313780393033513, 'gat_concat_hidden': False, 'lr': 2.1108941394714788e-05, 'weight_decay': 0.0008198927430502374, 'epochs': 241, 'loss': 'mae', 'optimizer': 'adam', 'graph_mode': 'cutoff', 'cutoff': 0.43190482609918224, 'grm_norm': 'cosine', 'self_loops': True}. Best is trial 52 with value: 0.2589532475445489.
[I 2025-10-21 07:49:38,020] Trial 65 finished with value: 0.24358644816482733 and parameters: {'model_type': 'gat', 'hidden_dims': '[512, 256]', 'dropout': 0.39344511246494984, 'batch_norm': False, 'gat_heads': 6, 'gat_attn_dropout': 0.04240572729393584, 'gat_concat_hidden': False, 'lr': 4.479951103790359e-05, 'weight_decay': 0.000435067044381192, 'epochs': 72, 'loss': 'mae', 'optimizer': 'adam', 'graph_mode': 'cutoff', 'cutoff': 0.6280180472554153, 'grm_norm': 'none', 'self_loops': False}. Best is trial 52 with value: 0.2589532475445489.
[I 2025-10-21 07:51:05,014] Trial 66 finished with value: 0.24005585783947306 and parameters: {'model_type': 'gat', 'hidden_dims': '[128, 64]', 'dropout': 0.30538043672443077, 'batch_norm': False, 'gat_heads': 4, 'gat_attn_dropout': 0.004146078674512874, 'gat_concat_hidden': False, 'lr': 8.936644702628394e-06, 'weight_decay': 0.00012943942128550585, 'epochs': 264, 'loss': 'mae', 'optimizer': 'adam', 'graph_mode': 'cutoff', 'cutoff': 0.5869962460999486, 'grm_norm': 'none', 'self_loops': True}. Best is trial 52 with value: 0.2589532475445489.
[I 2025-10-21 07:54:49,278] Trial 67 finished with value: 0.08204864414335629 and parameters: {'model_type': 'gat', 'hidden_dims': '[256, 128, 64]', 'dropout': 0.37242709564726595, 'batch_norm': True, 'gat_heads': 7, 'gat_attn_dropout': 0.09831296430831343, 'gat_concat_hidden': False, 'lr': 3.0278308963025988e-05, 'weight_decay': 0.00021608546118210593, 'epochs': 202, 'loss': 'mae', 'optimizer': 'adam', 'graph_mode': 'knn', 'source': 'grm', 'knn_k': 3, 'weighted_edges': False, 'symmetrize_mode': 'mutual'}. Best is trial 52 with value: 0.2589532475445489.
[I 2025-10-21 07:57:37,698] Trial 68 finished with value: 0.23826184151204127 and parameters: {'model_type': 'gat', 'hidden_dims': '[128, 64]', 'dropout': 0.42731432647840994, 'batch_norm': False, 'gat_heads': 6, 'gat_attn_dropout': 0.13248706107343436, 'gat_concat_hidden': False, 'lr': 5.693152199275009e-06, 'weight_decay': 0.0005783252719516604, 'epochs': 324, 'loss': 'mae', 'optimizer': 'adam', 'graph_mode': 'cutoff', 'cutoff': 0.7419419307326848, 'grm_norm': 'cosine_then_gcn', 'self_loops': True}. Best is trial 52 with value: 0.2589532475445489.
[I 2025-10-21 08:00:44,306] Trial 69 finished with value: 0.24675631149533772 and parameters: {'model_type': 'gat', 'hidden_dims': '[256, 128]', 'dropout': 0.4864721094276159, 'batch_norm': False, 'gat_heads': 5, 'gat_attn_dropout': 0.17198895500221417, 'gat_concat_hidden': False, 'lr': 3.3050338777261716e-06, 'weight_decay': 0.0007801558397820737, 'epochs': 220, 'loss': 'mae', 'optimizer': 'adam', 'graph_mode': 'cutoff', 'cutoff': 0.6803211281711015, 'grm_norm': 'none', 'self_loops': True}. Best is trial 52 with value: 0.2589532475445489.
[I 2025-10-21 08:01:59,614] Trial 70 finished with value: 0.21851423515101437 and parameters: {'model_type': 'gat', 'hidden_dims': '[128, 64]', 'dropout': 0.24103347513348683, 'batch_norm': False, 'gat_heads': 6, 'gat_attn_dropout': 0.06616194215458385, 'gat_concat_hidden': False, 'lr': 1.5200970195552665e-06, 'weight_decay': 6.712057898498742e-05, 'epochs': 136, 'loss': 'mse', 'optimizer': 'adam', 'graph_mode': 'cutoff', 'cutoff': 0.5466990273943736, 'grm_norm': 'cosine', 'self_loops': True}. Best is trial 52 with value: 0.2589532475445489.
[I 2025-10-21 08:03:15,679] Trial 71 finished with value: 0.16685897956556522 and parameters: {'model_type': 'gat', 'hidden_dims': '[128, 64]', 'dropout': 0.46616828440677477, 'batch_norm': False, 'gat_heads': 5, 'gat_attn_dropout': 0.47735060745806523, 'gat_concat_hidden': False, 'lr': 0.00036514871528660147, 'weight_decay': 0.0002519496062193451, 'epochs': 169, 'loss': 'mae', 'optimizer': 'adam', 'graph_mode': 'cutoff', 'cutoff': 0.5729082750120278, 'grm_norm': 'none', 'self_loops': True}. Best is trial 52 with value: 0.2589532475445489.
[I 2025-10-21 08:04:35,159] Trial 72 finished with value: 0.22969559440029536 and parameters: {'model_type': 'gat', 'hidden_dims': '[128, 64]', 'dropout': 0.4582592476359983, 'batch_norm': False, 'gat_heads': 5, 'gat_attn_dropout': 0.15354275182706426, 'gat_concat_hidden': False, 'lr': 0.000160366961363708, 'weight_decay': 0.00035962855608107194, 'epochs': 175, 'loss': 'mae', 'optimizer': 'adam', 'graph_mode': 'cutoff', 'cutoff': 0.5021685896482646, 'grm_norm': 'none', 'self_loops': True}. Best is trial 52 with value: 0.2589532475445489.
[I 2025-10-21 08:05:18,355] Trial 73 finished with value: 0.15188832330032812 and parameters: {'model_type': 'gat', 'hidden_dims': '[128, 64]', 'dropout': 0.47572555483035717, 'batch_norm': False, 'gat_heads': 4, 'gat_attn_dropout': 0.17671929490025323, 'gat_concat_hidden': False, 'lr': 0.0002924553564883065, 'weight_decay': 0.00019298339501988085, 'epochs': 124, 'loss': 'mae', 'optimizer': 'adam', 'graph_mode': 'cutoff', 'cutoff': 0.6551714600694533, 'grm_norm': 'none', 'self_loops': True}. Best is trial 52 with value: 0.2589532475445489.
[I 2025-10-21 08:06:43,234] Trial 74 finished with value: 0.13534480788946202 and parameters: {'model_type': 'gat', 'hidden_dims': '[128, 64]', 'dropout': 0.5083849764358257, 'batch_norm': False, 'gat_heads': 5, 'gat_attn_dropout': 0.22443142409477768, 'gat_concat_hidden': False, 'lr': 0.0006872995589771295, 'weight_decay': 9.74192423073379e-05, 'epochs': 190, 'loss': 'mae', 'optimizer': 'adam', 'graph_mode': 'cutoff', 'cutoff': 0.5954686436231382, 'grm_norm': 'none', 'self_loops': True}. Best is trial 52 with value: 0.2589532475445489.
[I 2025-10-21 08:07:53,637] Trial 75 finished with value: 0.2487724351394302 and parameters: {'model_type': 'gat', 'hidden_dims': '[128, 64]', 'dropout': 0.4399377035567414, 'batch_norm': False, 'gat_heads': 5, 'gat_attn_dropout': 0.1852260053701174, 'gat_concat_hidden': False, 'lr': 1.7892614682656196e-05, 'weight_decay': 0.0001549144323372435, 'epochs': 153, 'loss': 'mae', 'optimizer': 'adam', 'graph_mode': 'cutoff', 'cutoff': 0.5185381901376642, 'grm_norm': 'gcn', 'self_loops': True}. Best is trial 52 with value: 0.2589532475445489.
[I 2025-10-21 08:11:40,484] Trial 76 finished with value: 0.21991247464366298 and parameters: {'model_type': 'gat', 'hidden_dims': '[512, 128]', 'dropout': 0.5406206595265494, 'batch_norm': False, 'gat_heads': 4, 'gat_attn_dropout': 0.2671339783728899, 'gat_concat_hidden': True, 'lr': 5.811943467481827e-05, 'weight_decay': 0.0004773773309920449, 'epochs': 178, 'loss': 'mae', 'optimizer': 'adam', 'graph_mode': 'cutoff', 'cutoff': 0.5558366966714217, 'grm_norm': 'none', 'self_loops': True}. Best is trial 52 with value: 0.2589532475445489.
[I 2025-10-21 08:17:09,458] Trial 77 finished with value: 0.13418423099351223 and parameters: {'model_type': 'gat', 'hidden_dims': '[512, 64]', 'dropout': 0.35199540448243455, 'batch_norm': True, 'gat_heads': 5, 'gat_attn_dropout': 0.024366972985911853, 'gat_concat_hidden': False, 'lr': 8.346614571875076e-05, 'weight_decay': 0.0009992860054452834, 'epochs': 199, 'loss': 'mae', 'optimizer': 'adam', 'graph_mode': 'knn', 'source': 'grm', 'knn_k': 10, 'weighted_edges': True, 'symmetrize_mode': 'union'}. Best is trial 52 with value: 0.2589532475445489.
[I 2025-10-21 08:19:23,323] Trial 78 finished with value: 0.21615152196180634 and parameters: {'model_type': 'gat', 'hidden_dims': '[128, 64]', 'dropout': 0.39578453606374686, 'batch_norm': False, 'gat_heads': 8, 'gat_attn_dropout': 0.08188992907248502, 'gat_concat_hidden': False, 'lr': 0.00017352871823701332, 'weight_decay': 0.00030026227415368774, 'epochs': 214, 'loss': 'mae', 'optimizer': 'adam', 'graph_mode': 'cutoff', 'cutoff': 0.49119915776010864, 'grm_norm': 'none', 'self_loops': True}. Best is trial 52 with value: 0.2589532475445489.
[I 2025-10-21 08:21:44,416] Trial 79 finished with value: 0.20583725711321849 and parameters: {'model_type': 'gat', 'hidden_dims': '[512, 256]', 'dropout': 0.5792887323301121, 'batch_norm': False, 'gat_heads': 2, 'gat_attn_dropout': 0.20481053905055036, 'gat_concat_hidden': False, 'lr': 0.00012267606517253195, 'weight_decay': 1.1141220245321456e-05, 'epochs': 230, 'loss': 'mae', 'optimizer': 'adam', 'graph_mode': 'cutoff', 'cutoff': 0.6223844062093017, 'grm_norm': 'gcn', 'self_loops': False}. Best is trial 52 with value: 0.2589532475445489.
[I 2025-10-21 08:24:08,232] Trial 80 finished with value: 0.2319239395225628 and parameters: {'model_type': 'gat', 'hidden_dims': '[128, 64]', 'dropout': 0.2611253596846572, 'batch_norm': False, 'gat_heads': 6, 'gat_attn_dropout': 0.1233208197071492, 'gat_concat_hidden': False, 'lr': 1.227292138997659e-05, 'weight_decay': 9.637268973301385e-07, 'epochs': 273, 'loss': 'mae', 'optimizer': 'adam', 'graph_mode': 'cutoff', 'cutoff': 0.5255869756745333, 'grm_norm': 'none', 'self_loops': True}. Best is trial 52 with value: 0.2589532475445489.
[I 2025-10-21 08:26:27,361] Trial 81 finished with value: 0.23363588538369795 and parameters: {'model_type': 'gat', 'hidden_dims': '[512, 64]', 'dropout': 0.4976730382667651, 'batch_norm': False, 'gat_heads': 4, 'gat_attn_dropout': 0.24511153181584958, 'gat_concat_hidden': False, 'lr': 4.1892059717109165e-05, 'weight_decay': 0.0003611109580132111, 'epochs': 105, 'loss': 'mae', 'optimizer': 'adam', 'graph_mode': 'cutoff', 'cutoff': 0.6014168833498663, 'grm_norm': 'cosine', 'self_loops': True}. Best is trial 52 with value: 0.2589532475445489.
[I 2025-10-21 08:27:41,629] Trial 82 finished with value: 0.23791552531372046 and parameters: {'model_type': 'gat', 'hidden_dims': '[512, 64]', 'dropout': 0.47636275524317684, 'batch_norm': False, 'gat_heads': 3, 'gat_attn_dropout': 0.2502638734126297, 'gat_concat_hidden': False, 'lr': 2.672226430570213e-05, 'weight_decay': 0.00028405201793331165, 'epochs': 72, 'loss': 'mae', 'optimizer': 'adam', 'graph_mode': 'cutoff', 'cutoff': 0.5835835044191869, 'grm_norm': 'cosine', 'self_loops': True}. Best is trial 52 with value: 0.2589532475445489.
[I 2025-10-21 08:29:59,682] Trial 83 finished with value: 0.2438545693565392 and parameters: {'model_type': 'gat', 'hidden_dims': '[512, 64]', 'dropout': 0.521392004158252, 'batch_norm': False, 'gat_heads': 4, 'gat_attn_dropout': 0.3101176781454307, 'gat_concat_hidden': False, 'lr': 3.6688151436273195e-05, 'weight_decay': 0.0005234700872874585, 'epochs': 104, 'loss': 'mae', 'optimizer': 'adam', 'graph_mode': 'cutoff', 'cutoff': 0.5639839236847024, 'grm_norm': 'cosine', 'self_loops': True}. Best is trial 52 with value: 0.2589532475445489.
[I 2025-10-21 08:32:18,187] Trial 84 finished with value: 0.23132526650442903 and parameters: {'model_type': 'gat', 'hidden_dims': '[512, 64]', 'dropout': 0.45615080058832336, 'batch_norm': False, 'gat_heads': 3, 'gat_attn_dropout': 0.21655042332978802, 'gat_concat_hidden': False, 'lr': 2.372794162384705e-05, 'weight_decay': 0.0002434544135934605, 'epochs': 148, 'loss': 'mae', 'optimizer': 'adam', 'graph_mode': 'cutoff', 'cutoff': 0.6962473325359888, 'grm_norm': 'cosine', 'self_loops': True}. Best is trial 52 with value: 0.2589532475445489.
[I 2025-10-21 08:34:21,246] Trial 85 finished with value: 0.22546737762079094 and parameters: {'model_type': 'gat', 'hidden_dims': '[512, 128]', 'dropout': 0.41279840206677154, 'batch_norm': False, 'gat_heads': 4, 'gat_attn_dropout': 0.2792351447537202, 'gat_concat_hidden': False, 'lr': 1.730182229818231e-05, 'weight_decay': 0.0006979676296322889, 'epochs': 91, 'loss': 'mae', 'optimizer': 'adam', 'graph_mode': 'cutoff', 'cutoff': 0.6130645253420132, 'grm_norm': 'none', 'self_loops': True}. Best is trial 52 with value: 0.2589532475445489.
[I 2025-10-21 08:36:46,709] Trial 86 finished with value: 0.20238794662790469 and parameters: {'model_type': 'gat', 'hidden_dims': '[256, 128, 64]', 'dropout': 0.4947209844858527, 'batch_norm': False, 'gat_heads': 5, 'gat_attn_dropout': 0.10437910103626989, 'gat_concat_hidden': False, 'lr': 3.628012008962761e-05, 'weight_decay': 0.00018046933204200015, 'epochs': 166, 'loss': 'mse', 'optimizer': 'adam', 'graph_mode': 'cutoff', 'cutoff': 0.6422310587529203, 'grm_norm': 'cosine_then_gcn', 'self_loops': True}. Best is trial 52 with value: 0.2589532475445489.
[I 2025-10-21 08:38:09,912] Trial 87 finished with value: 0.22705399949412045 and parameters: {'model_type': 'gat', 'hidden_dims': '[128, 64]', 'dropout': 0.44719860529168287, 'batch_norm': False, 'gat_heads': 5, 'gat_attn_dropout': 0.15678692279665987, 'gat_concat_hidden': True, 'lr': 6.949583699350793e-05, 'weight_decay': 3.571109931542088e-05, 'epochs': 185, 'loss': 'mae', 'optimizer': 'adam', 'graph_mode': 'cutoff', 'cutoff': 0.6682646482078695, 'grm_norm': 'gcn', 'self_loops': True}. Best is trial 52 with value: 0.2589532475445489.
[I 2025-10-21 08:39:31,422] Trial 88 finished with value: 0.24086052177985778 and parameters: {'model_type': 'gat', 'hidden_dims': '[256, 128]', 'dropout': 0.4347498890439508, 'batch_norm': False, 'gat_heads': 4, 'gat_attn_dropout': 0.19403758432453527, 'gat_concat_hidden': False, 'lr': 9.162600551322184e-06, 'weight_decay': 0.00012107235199262531, 'epochs': 125, 'loss': 'mae', 'optimizer': 'adam', 'graph_mode': 'cutoff', 'cutoff': 0.54217501671849, 'grm_norm': 'none', 'self_loops': True}. Best is trial 52 with value: 0.2589532475445489.
