[I 2025-11-03 13:06:39,869] Trial 32 finished with value: 0.05128175105111809 and parameters: {'model_type': 'gcn', 'hidden_dims': '[512, 256]', 'dropout': 0.3658814786440656, 'batch_norm': False, 'lr': 0.0006353501349548086, 'weight_decay': 1.648665959189506e-05, 'epochs': 219, 'loss': 'mse', 'optimizer': 'adam', 'graph_mode': 'off', 'use_snp_selection': True, 'num_snps': 25025}. Best is trial 26 with value: 0.08910794720524956.
[I 2025-11-03 13:06:42,394] Trial 33 finished with value: 0.06209581370018797 and parameters: {'model_type': 'gcn', 'hidden_dims': '[512, 256]', 'dropout': 0.41463546512843663, 'batch_norm': True, 'lr': 0.0003066690394344178, 'weight_decay': 8.218706337757774e-06, 'epochs': 234, 'loss': 'mae', 'optimizer': 'adam', 'graph_mode': 'off', 'use_snp_selection': True, 'num_snps': 47655}. Best is trial 26 with value: 0.08910794720524956.
[I 2025-11-03 13:06:43,597] Trial 34 finished with value: 0.08444325644030944 and parameters: {'model_type': 'gcn', 'hidden_dims': '[512, 256]', 'dropout': 0.4226526405737787, 'batch_norm': False, 'lr': 0.0006264372825596673, 'weight_decay': 6.868856419280809e-07, 'epochs': 236, 'loss': 'mae', 'optimizer': 'adam', 'graph_mode': 'off', 'use_snp_selection': True, 'num_snps': 11877}. Best is trial 26 with value: 0.08910794720524956.
[I 2025-11-03 13:06:44,607] Trial 35 finished with value: 0.020553534384452368 and parameters: {'model_type': 'gcn', 'hidden_dims': '[512, 256]', 'dropout': 0.4315388633597663, 'batch_norm': False, 'lr': 2.8945959070496487e-06, 'weight_decay': 2.1179584964845606e-07, 'epochs': 190, 'loss': 'mse', 'optimizer': 'adam', 'graph_mode': 'off', 'use_snp_selection': True, 'num_snps': 9897}. Best is trial 26 with value: 0.08910794720524956.
[I 2025-11-03 13:06:45,939] Trial 36 finished with value: 0.044056867450794714 and parameters: {'model_type': 'gcn', 'hidden_dims': '[512, 256]', 'dropout': 0.40060667618146334, 'batch_norm': False, 'lr': 0.00016714958166025735, 'weight_decay': 5.853509806835933e-07, 'epochs': 153, 'loss': 'mae', 'optimizer': 'adam', 'graph_mode': 'off', 'use_snp_selection': True, 'num_snps': 23038}. Best is trial 26 with value: 0.08910794720524956.
[I 2025-11-03 13:06:47,100] Trial 37 finished with value: 0.05191529587920594 and parameters: {'model_type': 'gcn', 'hidden_dims': '[512, 256]', 'dropout': 0.4755725278584597, 'batch_norm': False, 'lr': 7.73634807764692e-06, 'weight_decay': 1.0572427499878303e-06, 'epochs': 237, 'loss': 'mse', 'optimizer': 'adam', 'graph_mode': 'off', 'use_snp_selection': True, 'num_snps': 10666}. Best is trial 26 with value: 0.08910794720524956.
[I 2025-11-03 13:06:48,633] Trial 38 finished with value: -0.0015657414031236226 and parameters: {'model_type': 'gcn', 'hidden_dims': '[256, 128, 64]', 'dropout': 0.5280629099514724, 'batch_norm': False, 'lr': 0.00010111102679688424, 'weight_decay': 3.425628320004722e-07, 'epochs': 272, 'loss': 'mae', 'optimizer': 'adam', 'graph_mode': 'off', 'use_snp_selection': True, 'num_snps': 15458}. Best is trial 26 with value: 0.08910794720524956.
[I 2025-11-03 13:06:49,851] Trial 39 finished with value: 0.036357982031040986 and parameters: {'model_type': 'gcn', 'hidden_dims': '[256, 128]', 'dropout': 0.3754709094989395, 'batch_norm': False, 'lr': 3.811569057895656e-05, 'weight_decay': 1.6506662269942616e-07, 'epochs': 101, 'loss': 'mse', 'optimizer': 'adam', 'graph_mode': 'off', 'use_snp_selection': True, 'num_snps': 29069}. Best is trial 26 with value: 0.08910794720524956.
[I 2025-11-03 13:06:51,036] Trial 40 finished with value: 0.06378967193188248 and parameters: {'model_type': 'gcn', 'hidden_dims': '[512, 64]', 'dropout': 0.4417380687302595, 'batch_norm': False, 'lr': 0.00044635320338662994, 'weight_decay': 1.7085449295120942e-06, 'epochs': 309, 'loss': 'mae', 'optimizer': 'adam', 'graph_mode': 'off', 'use_snp_selection': True, 'num_snps': 5280}. Best is trial 26 with value: 0.08910794720524956.
[I 2025-11-03 13:06:52,264] Trial 41 finished with value: 0.07494681979669678 and parameters: {'model_type': 'gcn', 'hidden_dims': '[512, 256]', 'dropout': 0.2553487041765163, 'batch_norm': True, 'lr': 0.0006445968234581121, 'weight_decay': 4.367570231984751e-07, 'epochs': 250, 'loss': 'mae', 'optimizer': 'adam', 'graph_mode': 'off', 'use_snp_selection': True, 'num_snps': 9356}. Best is trial 26 with value: 0.08910794720524956.
[I 2025-11-03 13:06:53,548] Trial 42 finished with value: 0.07345279170361747 and parameters: {'model_type': 'gcn', 'hidden_dims': '[128, 64]', 'dropout': 0.32603439181729493, 'batch_norm': True, 'lr': 0.0006193885469982616, 'weight_decay': 2.617923448264297e-06, 'epochs': 237, 'loss': 'mae', 'optimizer': 'adam', 'graph_mode': 'off', 'use_snp_selection': True, 'num_snps': 17115}. Best is trial 26 with value: 0.08910794720524956.
[I 2025-11-03 13:06:55,407] Trial 43 finished with value: 0.0750502974834459 and parameters: {'model_type': 'gcn', 'hidden_dims': '[512, 256]', 'dropout': 0.35861222063334197, 'batch_norm': True, 'lr': 0.0009501033354359457, 'weight_decay': 1.380796891153356e-05, 'epochs': 263, 'loss': 'mae', 'optimizer': 'adam', 'graph_mode': 'off', 'use_snp_selection': True, 'num_snps': 27976}. Best is trial 26 with value: 0.08910794720524956.
[I 2025-11-03 13:06:57,477] Trial 44 finished with value: 0.057288858398229246 and parameters: {'model_type': 'gcn', 'hidden_dims': '[256, 128, 64]', 'dropout': 0.3967294203490555, 'batch_norm': False, 'lr': 0.0003069805514330277, 'weight_decay': 2.6706346190392686e-05, 'epochs': 280, 'loss': 'mae', 'optimizer': 'adam', 'graph_mode': 'off', 'use_snp_selection': True, 'num_snps': 35503}. Best is trial 26 with value: 0.08910794720524956.
[I 2025-11-03 13:06:58,783] Trial 45 finished with value: 0.06947448871479536 and parameters: {'model_type': 'gcn', 'hidden_dims': '[256, 128]', 'dropout': 0.3125313597382091, 'batch_norm': True, 'lr': 0.0002007404625374245, 'weight_decay': 7.042575928037626e-07, 'epochs': 196, 'loss': 'mae', 'optimizer': 'adam', 'graph_mode': 'off', 'use_snp_selection': True, 'num_snps': 22141}. Best is trial 26 with value: 0.08910794720524956.
[I 2025-11-03 13:07:00,108] Trial 46 finished with value: 0.07989036214279407 and parameters: {'model_type': 'gcn', 'hidden_dims': '[512, 64]', 'dropout': 0.425817425825501, 'batch_norm': True, 'lr': 0.0005076265636660247, 'weight_decay': 6.6931758283135315e-06, 'epochs': 247, 'loss': 'mae', 'optimizer': 'adam', 'graph_mode': 'off', 'use_snp_selection': True, 'num_snps': 14063}. Best is trial 26 with value: 0.08910794720524956.
[I 2025-11-03 13:07:01,311] Trial 47 finished with value: 0.04881897519164808 and parameters: {'model_type': 'gcn', 'hidden_dims': '[512, 64]', 'dropout': 0.17703508771828752, 'batch_norm': False, 'lr': 0.0003734524082994359, 'weight_decay': 3.021767921366916e-06, 'epochs': 226, 'loss': 'mse', 'optimizer': 'adam', 'graph_mode': 'off', 'use_snp_selection': True, 'num_snps': 13672}. Best is trial 26 with value: 0.08910794720524956.
[I 2025-11-03 13:07:02,395] Trial 48 finished with value: 0.08822520329774465 and parameters: {'model_type': 'gcn', 'hidden_dims': '[512, 64]', 'dropout': 0.5035250027973849, 'batch_norm': True, 'lr': 0.000503293570234707, 'weight_decay': 1.5478605156360545e-06, 'epochs': 206, 'loss': 'mae', 'optimizer': 'adam', 'graph_mode': 'off', 'use_snp_selection': True, 'num_snps': 8768}. Best is trial 26 with value: 0.08910794720524956.
[I 2025-11-03 13:07:03,237] Trial 49 finished with value: 0.032473461946760936 and parameters: {'model_type': 'gcn', 'hidden_dims': '[512, 64]', 'dropout': 0.5812070309030891, 'batch_norm': True, 'lr': 8.184596219995009e-05, 'weight_decay': 0.0009709528483568236, 'epochs': 124, 'loss': 'mae', 'optimizer': 'adam', 'graph_mode': 'off', 'use_snp_selection': True, 'num_snps': 6947}. Best is trial 26 with value: 0.08910794720524956.
[I 2025-11-03 13:07:04,210] Trial 50 finished with value: 0.0578691140249254 and parameters: {'model_type': 'gcn', 'hidden_dims': '[512, 64]', 'dropout': 0.5231462840994129, 'batch_norm': False, 'lr': 0.000985436039792973, 'weight_decay': 9.268081339190439e-07, 'epochs': 204, 'loss': 'mae', 'optimizer': 'adam', 'graph_mode': 'off', 'use_snp_selection': True, 'num_snps': 6833}. Best is trial 26 with value: 0.08910794720524956.
[I 2025-11-03 13:07:05,251] Trial 51 finished with value: 0.04989208553335519 and parameters: {'model_type': 'gcn', 'hidden_dims': '[512, 64]', 'dropout': 0.41979215946764087, 'batch_norm': True, 'lr': 0.0005139980193576428, 'weight_decay': 1.6998258321173315e-06, 'epochs': 244, 'loss': 'mae', 'optimizer': 'adam', 'graph_mode': 'off', 'use_snp_selection': True, 'num_snps': 2547}. Best is trial 26 with value: 0.08910794720524956.
[I 2025-11-03 13:07:06,506] Trial 52 finished with value: 0.07940127444663918 and parameters: {'model_type': 'gcn', 'hidden_dims': '[512, 64]', 'dropout': 0.463342387399181, 'batch_norm': True, 'lr': 0.0007211902613477074, 'weight_decay': 4.1364668224032786e-06, 'epochs': 214, 'loss': 'mae', 'optimizer': 'adam', 'graph_mode': 'off', 'use_snp_selection': True, 'num_snps': 13410}. Best is trial 26 with value: 0.08910794720524956.
[I 2025-11-03 13:07:07,542] Trial 53 finished with value: 0.06099429341174182 and parameters: {'model_type': 'gcn', 'hidden_dims': '[512, 64]', 'dropout': 0.5046847263822388, 'batch_norm': True, 'lr': 0.0002917916629579056, 'weight_decay': 8.942279757056423e-06, 'epochs': 185, 'loss': 'mae', 'optimizer': 'adam', 'graph_mode': 'off', 'use_snp_selection': True, 'num_snps': 8292}. Best is trial 26 with value: 0.08910794720524956.
[I 2025-11-03 13:07:09,062] Trial 54 finished with value: 0.08067699975565273 and parameters: {'model_type': 'gcn', 'hidden_dims': '[512, 64]', 'dropout': 0.5548852059435639, 'batch_norm': True, 'lr': 0.00045742546132111555, 'weight_decay': 1.5531561005227715e-07, 'epochs': 246, 'loss': 'mae', 'optimizer': 'adam', 'graph_mode': 'off', 'use_snp_selection': True, 'num_snps': 19273}. Best is trial 26 with value: 0.08910794720524956.
[I 2025-11-03 13:07:10,513] Trial 55 finished with value: 0.06852623332706805 and parameters: {'model_type': 'gcn', 'hidden_dims': '[512, 256]', 'dropout': 0.5789084185626189, 'batch_norm': True, 'lr': 0.00041285056830513405, 'weight_decay': 1.3958387002685446e-07, 'epochs': 228, 'loss': 'mae', 'optimizer': 'adam', 'graph_mode': 'off', 'use_snp_selection': True, 'num_snps': 19523}. Best is trial 26 with value: 0.08910794720524956.
[I 2025-11-03 13:07:12,120] Trial 56 finished with value: 0.06468384066059404 and parameters: {'model_type': 'gcn', 'hidden_dims': '[512, 64]', 'dropout': 0.5639491018285917, 'batch_norm': True, 'lr': 0.000713835777713934, 'weight_decay': 4.2948819091761516e-07, 'epochs': 286, 'loss': 'mae', 'optimizer': 'adam', 'graph_mode': 'off', 'use_snp_selection': True, 'num_snps': 19628}. Best is trial 26 with value: 0.08910794720524956.
[I 2025-11-03 13:07:13,959] Trial 57 finished with value: 0.06008443047411697 and parameters: {'model_type': 'gcn', 'hidden_dims': '[256, 128, 64]', 'dropout': 0.5473231830917694, 'batch_norm': True, 'lr': 0.00019047883424477287, 'weight_decay': 1.89719067626988e-07, 'epochs': 267, 'loss': 'mae', 'optimizer': 'adam', 'graph_mode': 'off', 'use_snp_selection': True, 'num_snps': 24882}. Best is trial 26 with value: 0.08910794720524956.
[I 2025-11-03 13:07:14,954] Trial 58 finished with value: -0.027522554698262366 and parameters: {'model_type': 'gcn', 'hidden_dims': '[128, 64]', 'dropout': 0.5073118253012676, 'batch_norm': True, 'lr': 1.0889258301622254e-06, 'weight_decay': 1.0645607500750554e-07, 'epochs': 165, 'loss': 'mse', 'optimizer': 'adam', 'graph_mode': 'off', 'use_snp_selection': True, 'num_snps': 11049}. Best is trial 26 with value: 0.08910794720524956.
[I 2025-11-03 13:07:15,731] Trial 59 finished with value: 0.06067986868565642 and parameters: {'model_type': 'gcn', 'hidden_dims': '[256, 128]', 'dropout': 0.2711744512957631, 'batch_norm': True, 'lr': 0.0007916194045519138, 'weight_decay': 2.893978553020424e-07, 'epochs': 47, 'loss': 'mae', 'optimizer': 'adam', 'graph_mode': 'off', 'use_snp_selection': False}. Best is trial 26 with value: 0.08910794720524956.
[I 2025-11-03 13:07:18,312] Trial 60 finished with value: 0.06260111323567336 and parameters: {'model_type': 'gcn', 'hidden_dims': '[512, 256]', 'dropout': 0.5998528347722202, 'batch_norm': True, 'lr': 0.00026117759075532625, 'weight_decay': 7.790536473879523e-07, 'epochs': 298, 'loss': 'mae', 'optimizer': 'adam', 'graph_mode': 'off', 'use_snp_selection': True, 'num_snps': 43042}. Best is trial 26 with value: 0.08910794720524956.
[I 2025-11-03 13:07:19,614] Trial 61 finished with value: 0.07587893995123965 and parameters: {'model_type': 'gcn', 'hidden_dims': '[512, 64]', 'dropout': 0.3841732680619757, 'batch_norm': True, 'lr': 0.0005214203835379439, 'weight_decay': 5.826184007469266e-06, 'epochs': 245, 'loss': 'mae', 'optimizer': 'adam', 'graph_mode': 'off', 'use_snp_selection': True, 'num_snps': 13437}. Best is trial 26 with value: 0.08910794720524956.
[I 2025-11-03 13:07:21,014] Trial 62 finished with value: 0.07419631016712104 and parameters: {'model_type': 'gcn', 'hidden_dims': '[512, 64]', 'dropout': 0.3423672699722906, 'batch_norm': True, 'lr': 0.000441518648873537, 'weight_decay': 5.05527198784959e-07, 'epochs': 251, 'loss': 'mae', 'optimizer': 'adam', 'graph_mode': 'off', 'use_snp_selection': True, 'num_snps': 16016}. Best is trial 26 with value: 0.08910794720524956.
[I 2025-11-03 13:07:22,032] Trial 63 finished with value: 0.06141455688288914 and parameters: {'model_type': 'gcn', 'hidden_dims': '[512, 64]', 'dropout': 0.46253509232808715, 'batch_norm': True, 'lr': 0.0005685019866716102, 'weight_decay': 1.194455586986802e-06, 'epochs': 208, 'loss': 'mae', 'optimizer': 'adam', 'graph_mode': 'off', 'use_snp_selection': True, 'num_snps': 5884}. Best is trial 26 with value: 0.08910794720524956.
[I 2025-11-03 13:07:23,561] Trial 64 finished with value: 0.0816544152844685 and parameters: {'model_type': 'gcn', 'hidden_dims': '[512, 64]', 'dropout': 0.5448587724055655, 'batch_norm': True, 'lr': 0.00033067394845798026, 'weight_decay': 2.1674885360191653e-06, 'epochs': 261, 'loss': 'mae', 'optimizer': 'adam', 'graph_mode': 'off', 'use_snp_selection': True, 'num_snps': 19519}. Best is trial 26 with value: 0.08910794720524956.
[I 2025-11-03 13:07:25,138] Trial 65 finished with value: 0.07109037156751762 and parameters: {'model_type': 'gcn', 'hidden_dims': '[256, 128, 64]', 'dropout': 0.5518292127836126, 'batch_norm': True, 'lr': 0.00035841585551694527, 'weight_decay': 1.494055611049427e-06, 'epochs': 230, 'loss': 'mae', 'optimizer': 'adam', 'graph_mode': 'off', 'use_snp_selection': False}. Best is trial 26 with value: 0.08910794720524956.
[I 2025-11-03 13:07:27,114] Trial 66 finished with value: 0.02621401593244908 and parameters: {'model_type': 'gcn', 'hidden_dims': '[512, 64]', 'dropout': 0.49082991490774697, 'batch_norm': False, 'lr': 0.0007593703480322909, 'weight_decay': 2.2780659394695998e-06, 'epochs': 268, 'loss': 'mae', 'optimizer': 'adam', 'graph_mode': 'off', 'use_snp_selection': True, 'num_snps': 32445}. Best is trial 26 with value: 0.08910794720524956.
[I 2025-11-03 13:07:28,697] Trial 67 finished with value: 0.045201752723580485 and parameters: {'model_type': 'gcn', 'hidden_dims': '[512, 256]', 'dropout': 0.5636580840853289, 'batch_norm': True, 'lr': 0.00021350484372056712, 'weight_decay': 3.637083866387983e-06, 'epochs': 257, 'loss': 'mse', 'optimizer': 'adam', 'graph_mode': 'off', 'use_snp_selection': True, 'num_snps': 21075}. Best is trial 26 with value: 0.08910794720524956.
[I 2025-11-03 13:07:30,570] Trial 68 finished with value: -0.011676429059795436 and parameters: {'model_type': 'gcn', 'hidden_dims': '[512, 128]', 'dropout': 0.5155107676766624, 'batch_norm': False, 'lr': 0.00013870515318465307, 'weight_decay': 2.9397720403313525e-07, 'epochs': 223, 'loss': 'mae', 'optimizer': 'adam', 'graph_mode': 'off', 'use_snp_selection': False}. Best is trial 26 with value: 0.08910794720524956.
[I 2025-11-03 13:07:32,162] Trial 69 finished with value: 0.08495925683328236 and parameters: {'model_type': 'gcn', 'hidden_dims': '[512, 256]', 'dropout': 0.5431273491689993, 'batch_norm': True, 'lr': 0.0003645321603097866, 'weight_decay': 1.4299591418094956e-07, 'epochs': 196, 'loss': 'mae', 'optimizer': 'adam', 'graph_mode': 'off', 'use_snp_selection': True, 'num_snps': 25791}. Best is trial 26 with value: 0.08910794720524956.
[I 2025-11-03 13:07:33,786] Trial 70 finished with value: 0.07383039872350236 and parameters: {'model_type': 'gcn', 'hidden_dims': '[512, 256]', 'dropout': 0.45115088377584844, 'batch_norm': True, 'lr': 0.00033680164339524395, 'weight_decay': 0.00038771798399532016, 'epochs': 198, 'loss': 'mse', 'optimizer': 'adam', 'graph_mode': 'off', 'use_snp_selection': True, 'num_snps': 26456}. Best is trial 26 with value: 0.08910794720524956.
[I 2025-11-03 13:07:35,593] Trial 71 finished with value: 0.07352917829990943 and parameters: {'model_type': 'gcn', 'hidden_dims': '[512, 256]', 'dropout': 0.5664898233044512, 'batch_norm': True, 'lr': 0.0005298755408247125, 'weight_decay': 1.421633439352718e-07, 'epochs': 214, 'loss': 'mae', 'optimizer': 'adam', 'graph_mode': 'off', 'use_snp_selection': True, 'num_snps': 31094}. Best is trial 26 with value: 0.08910794720524956.
[I 2025-11-03 13:07:37,052] Trial 72 finished with value: 0.08697632360209882 and parameters: {'model_type': 'gcn', 'hidden_dims': '[512, 256]', 'dropout': 0.5411511395556745, 'batch_norm': True, 'lr': 0.00041925553619169385, 'weight_decay': 2.1334955982440094e-07, 'epochs': 238, 'loss': 'mae', 'optimizer': 'adam', 'graph_mode': 'off', 'use_snp_selection': True, 'num_snps': 18361}. Best is trial 26 with value: 0.08910794720524956.
[I 2025-11-03 13:07:38,643] Trial 73 finished with value: 0.07353805929369227 and parameters: {'model_type': 'gcn', 'hidden_dims': '[512, 256]', 'dropout': 0.5434451164407594, 'batch_norm': True, 'lr': 0.0007832185438215139, 'weight_decay': 2.4197465261774666e-07, 'epochs': 237, 'loss': 'mae', 'optimizer': 'adam', 'graph_mode': 'off', 'use_snp_selection': True, 'num_snps': 23188}. Best is trial 26 with value: 0.08910794720524956.
[I 2025-11-03 13:07:39,917] Trial 74 finished with value: 0.07530304534982497 and parameters: {'model_type': 'gcn', 'hidden_dims': '[512, 256]', 'dropout': 0.5371985905954428, 'batch_norm': True, 'lr': 0.00024972860815589696, 'weight_decay': 1.0036625556305525e-07, 'epochs': 181, 'loss': 'mae', 'optimizer': 'adam', 'graph_mode': 'off', 'use_snp_selection': True, 'num_snps': 18178}. Best is trial 26 with value: 0.08910794720524956.
[I 2025-11-03 13:07:41,940] Trial 75 finished with value: 0.017683899360891528 and parameters: {'model_type': 'gcn', 'hidden_dims': '[512, 256]', 'dropout': 0.4819561597069278, 'batch_norm': False, 'lr': 0.0003539421096869407, 'weight_decay': 8.605256165408771e-07, 'epochs': 258, 'loss': 'mae', 'optimizer': 'adam', 'graph_mode': 'off', 'use_snp_selection': False}. Best is trial 26 with value: 0.08910794720524956.
[I 2025-11-03 13:07:43,526] Trial 76 finished with value: 0.07315128191137113 and parameters: {'model_type': 'gcn', 'hidden_dims': '[512, 256]', 'dropout': 0.5288131124865924, 'batch_norm': True, 'lr': 0.0006059007533317772, 'weight_decay': 1.4270734815755884e-06, 'epochs': 219, 'loss': 'mae', 'optimizer': 'adam', 'graph_mode': 'off', 'use_snp_selection': True, 'num_snps': 23837}. Best is trial 26 with value: 0.08910794720524956.
[I 2025-11-03 13:07:44,474] Trial 77 finished with value: 0.057039477844298525 and parameters: {'model_type': 'gcn', 'hidden_dims': '[512, 256]', 'dropout': 0.5823892500336947, 'batch_norm': True, 'lr': 0.000291748988406669, 'weight_decay': 4.968299390818546e-07, 'epochs': 191, 'loss': 'mae', 'optimizer': 'adam', 'graph_mode': 'off', 'use_snp_selection': True, 'num_snps': 3951}. Best is trial 26 with value: 0.08910794720524956.
[I 2025-11-03 13:07:46,268] Trial 78 finished with value: 0.07102831347048136 and parameters: {'model_type': 'gcn', 'hidden_dims': '[512, 128]', 'dropout': 0.3599163079940935, 'batch_norm': False, 'lr': 2.2031171970659196e-05, 'weight_decay': 4.8836360749173895e-06, 'epochs': 274, 'loss': 'mse', 'optimizer': 'adam', 'graph_mode': 'off', 'use_snp_selection': True, 'num_snps': 27292}. Best is trial 26 with value: 0.08910794720524956.
[I 2025-11-03 13:07:47,734] Trial 79 finished with value: 0.06709285227493313 and parameters: {'model_type': 'gcn', 'hidden_dims': '[256, 128, 64]', 'dropout': 0.3005786534205368, 'batch_norm': True, 'lr': 0.0008533746205822691, 'weight_decay': 3.4936491270231576e-07, 'epochs': 203, 'loss': 'mae', 'optimizer': 'adam', 'graph_mode': 'off', 'use_snp_selection': False}. Best is trial 26 with value: 0.08910794720524956.
[I 2025-11-03 13:07:49,009] Trial 80 finished with value: 0.03963714403192999 and parameters: {'model_type': 'gcn', 'hidden_dims': '[128, 64]', 'dropout': 0.33282718117443544, 'batch_norm': False, 'lr': 0.0004225194671194564, 'weight_decay': 2.2405830540324675e-06, 'epochs': 302, 'loss': 'mae', 'optimizer': 'adam', 'graph_mode': 'off', 'use_snp_selection': True, 'num_snps': 12067}. Best is trial 26 with value: 0.08910794720524956.
[I 2025-11-03 13:07:50,556] Trial 81 finished with value: 0.07006092547621688 and parameters: {'model_type': 'gcn', 'hidden_dims': '[512, 256]', 'dropout': 0.5513563531265442, 'batch_norm': True, 'lr': 0.0004370314427086612, 'weight_decay': 1.370629443345955e-07, 'epochs': 240, 'loss': 'mae', 'optimizer': 'adam', 'graph_mode': 'off', 'use_snp_selection': True, 'num_snps': 20989}. Best is trial 26 with value: 0.08910794720524956.
