[I 2025-11-03 12:44:16,734] Trial 125 finished with value: 0.17099519665606136 and parameters: {'model_type': 'graphsage', 'hidden_dims': '[512, 256]', 'dropout': 0.4099033328973915, 'batch_norm': True, 'lr': 8.979359038264831e-05, 'weight_decay': 7.459428068693515e-06, 'epochs': 349, 'loss': 'mse', 'optimizer': 'adam', 'graph_mode': 'knn', 'source': 'grm', 'knn_k': 8, 'weighted_edges': True, 'symmetrize_mode': 'mutual', 'use_snp_selection': False}. Best is trial 122 with value: 0.19334342359748394.
[I 2025-11-03 12:44:29,474] Trial 126 finished with value: 0.16613149863850654 and parameters: {'model_type': 'graphsage', 'hidden_dims': '[512, 256]', 'dropout': 0.3851257387172295, 'batch_norm': True, 'lr': 7.271035918450392e-05, 'weight_decay': 6.700903055529683e-06, 'epochs': 350, 'loss': 'mse', 'optimizer': 'adam', 'graph_mode': 'knn', 'source': 'grm', 'knn_k': 6, 'weighted_edges': True, 'symmetrize_mode': 'mutual', 'use_snp_selection': False}. Best is trial 122 with value: 0.19334342359748394.
[I 2025-11-03 12:44:42,019] Trial 127 finished with value: 0.1705768243435153 and parameters: {'model_type': 'graphsage', 'hidden_dims': '[512, 256]', 'dropout': 0.3649064534837305, 'batch_norm': True, 'lr': 0.0001337360739173356, 'weight_decay': 5.2835984501622405e-06, 'epochs': 334, 'loss': 'mse', 'optimizer': 'adam', 'graph_mode': 'knn', 'source': 'grm', 'knn_k': 7, 'weighted_edges': True, 'symmetrize_mode': 'mutual', 'use_snp_selection': False}. Best is trial 122 with value: 0.19334342359748394.
[I 2025-11-03 12:44:53,365] Trial 128 finished with value: 0.13854731822165747 and parameters: {'model_type': 'graphsage', 'hidden_dims': '[512, 256]', 'dropout': 0.4431468623968462, 'batch_norm': True, 'lr': 6.065558392724334e-05, 'weight_decay': 4.1379672172188005e-06, 'epochs': 329, 'loss': 'mse', 'optimizer': 'adam', 'graph_mode': 'cutoff', 'cutoff': 0.48919633383858613, 'grm_norm': 'cosine', 'self_loops': True, 'use_snp_selection': False}. Best is trial 122 with value: 0.19334342359748394.
[I 2025-11-03 12:44:59,258] Trial 129 finished with value: 0.1856207275639285 and parameters: {'model_type': 'graphsage', 'hidden_dims': '[128, 64]', 'dropout': 0.13236399511840483, 'batch_norm': True, 'lr': 0.00010138317219938529, 'weight_decay': 3.628809468722525e-06, 'epochs': 325, 'loss': 'mse', 'optimizer': 'adam', 'graph_mode': 'knn', 'source': 'grm', 'knn_k': 7, 'weighted_edges': True, 'symmetrize_mode': 'mutual', 'use_snp_selection': False}. Best is trial 122 with value: 0.19334342359748394.
[I 2025-11-03 12:45:05,448] Trial 130 finished with value: 0.11227764199138567 and parameters: {'model_type': 'graphsage', 'hidden_dims': '[128, 64]', 'dropout': 0.4168972732454359, 'batch_norm': True, 'lr': 1.6414006368577075e-05, 'weight_decay': 3.694625247007394e-06, 'epochs': 326, 'loss': 'mse', 'optimizer': 'adam', 'graph_mode': 'knn', 'source': 'grm', 'knn_k': 8, 'weighted_edges': True, 'symmetrize_mode': 'mutual', 'use_snp_selection': False}. Best is trial 122 with value: 0.19334342359748394.
[I 2025-11-03 12:45:09,967] Trial 131 finished with value: 0.187100301913029 and parameters: {'model_type': 'graphsage', 'hidden_dims': '[512, 256]', 'dropout': 0.1797921470571026, 'batch_norm': True, 'lr': 8.888475650500122e-05, 'weight_decay': 2.917274382528704e-06, 'epochs': 77, 'loss': 'mse', 'optimizer': 'adam', 'graph_mode': 'knn', 'source': 'grm', 'knn_k': 7, 'weighted_edges': True, 'symmetrize_mode': 'mutual', 'use_snp_selection': False}. Best is trial 122 with value: 0.19334342359748394.
[I 2025-11-03 12:45:12,047] Trial 132 finished with value: 0.16898935730991282 and parameters: {'model_type': 'graphsage', 'hidden_dims': '[128, 64]', 'dropout': 0.18983335792396663, 'batch_norm': True, 'lr': 8.740761942242396e-05, 'weight_decay': 2.6750102863826336e-06, 'epochs': 58, 'loss': 'mse', 'optimizer': 'adam', 'graph_mode': 'knn', 'source': 'grm', 'knn_k': 7, 'weighted_edges': True, 'symmetrize_mode': 'mutual', 'use_snp_selection': False}. Best is trial 122 with value: 0.19334342359748394.
[I 2025-11-03 12:45:14,385] Trial 133 finished with value: 0.1871195782583159 and parameters: {'model_type': 'graphsage', 'hidden_dims': '[128, 64]', 'dropout': 0.16015363856755563, 'batch_norm': True, 'lr': 0.00011870136894982143, 'weight_decay': 2.9852691234187912e-06, 'epochs': 76, 'loss': 'mse', 'optimizer': 'adam', 'graph_mode': 'knn', 'source': 'grm', 'knn_k': 7, 'weighted_edges': True, 'symmetrize_mode': 'mutual', 'use_snp_selection': False}. Best is trial 122 with value: 0.19334342359748394.
[I 2025-11-03 12:45:16,724] Trial 134 finished with value: 0.16478605823140158 and parameters: {'model_type': 'graphsage', 'hidden_dims': '[128, 64]', 'dropout': 0.1324161424659724, 'batch_norm': True, 'lr': 0.00012437500738049013, 'weight_decay': 2.2448426241721947e-06, 'epochs': 78, 'loss': 'mse', 'optimizer': 'adam', 'graph_mode': 'knn', 'source': 'grm', 'knn_k': 7, 'weighted_edges': True, 'symmetrize_mode': 'mutual', 'use_snp_selection': False}. Best is trial 122 with value: 0.19334342359748394.
[I 2025-11-03 12:45:19,001] Trial 135 finished with value: 0.1507000660055667 and parameters: {'model_type': 'graphsage', 'hidden_dims': '[128, 64]', 'dropout': 0.13875241942687763, 'batch_norm': True, 'lr': 0.00014666700554757906, 'weight_decay': 1.7925962289585894e-06, 'epochs': 77, 'loss': 'mse', 'optimizer': 'adam', 'graph_mode': 'knn', 'source': 'grm', 'knn_k': 6, 'weighted_edges': True, 'symmetrize_mode': 'mutual', 'use_snp_selection': False}. Best is trial 122 with value: 0.19334342359748394.
[I 2025-11-03 12:45:21,637] Trial 136 finished with value: 0.17194839365183562 and parameters: {'model_type': 'graphsage', 'hidden_dims': '[128, 64]', 'dropout': 0.1423857366684857, 'batch_norm': True, 'lr': 6.752102251007916e-05, 'weight_decay': 2.9562725527471283e-06, 'epochs': 97, 'loss': 'mse', 'optimizer': 'adam', 'graph_mode': 'knn', 'source': 'grm', 'knn_k': 7, 'weighted_edges': True, 'symmetrize_mode': 'mutual', 'use_snp_selection': False}. Best is trial 122 with value: 0.19334342359748394.
[I 2025-11-03 12:45:24,042] Trial 137 finished with value: 0.037289450950634614 and parameters: {'model_type': 'graphsage', 'hidden_dims': '[128, 64]', 'dropout': 0.18102168643150432, 'batch_norm': True, 'lr': 7.897847622858132e-05, 'weight_decay': 9.197210890941398e-06, 'epochs': 46, 'loss': 'mse', 'optimizer': 'adam', 'graph_mode': 'knn', 'source': 'grm', 'knn_k': 7, 'weighted_edges': True, 'symmetrize_mode': 'mutual', 'use_snp_selection': True, 'num_snps': 5724}. Best is trial 122 with value: 0.19334342359748394.
[I 2025-11-03 12:45:26,473] Trial 138 finished with value: 0.024824466840192554 and parameters: {'model_type': 'graphsage', 'hidden_dims': '[128, 64]', 'dropout': 0.4606496280024909, 'batch_norm': False, 'lr': 0.0001731848590774087, 'weight_decay': 3.894659500464275e-06, 'epochs': 73, 'loss': 'mse', 'optimizer': 'adam', 'graph_mode': 'knn', 'source': 'grm', 'knn_k': 8, 'weighted_edges': True, 'symmetrize_mode': 'mutual', 'use_snp_selection': False}. Best is trial 122 with value: 0.19334342359748394.
[I 2025-11-03 12:45:28,402] Trial 139 finished with value: 0.12712649655184985 and parameters: {'model_type': 'graphsage', 'hidden_dims': '[128, 64]', 'dropout': 0.1578154573729746, 'batch_norm': True, 'lr': 5.115429169891787e-05, 'weight_decay': 5.265663781012494e-06, 'epochs': 58, 'loss': 'mse', 'optimizer': 'adam', 'graph_mode': 'cutoff', 'cutoff': 0.37308958828280125, 'grm_norm': 'none', 'self_loops': False, 'use_snp_selection': False}. Best is trial 122 with value: 0.19334342359748394.
[I 2025-11-03 12:45:36,524] Trial 140 finished with value: 0.17625059495382273 and parameters: {'model_type': 'graphsage', 'hidden_dims': '[256, 128, 64]', 'dropout': 0.1768789972678044, 'batch_norm': True, 'lr': 9.011345238297775e-05, 'weight_decay': 1.533270047075365e-06, 'epochs': 337, 'loss': 'mse', 'optimizer': 'adam', 'graph_mode': 'knn', 'source': 'grm', 'knn_k': 6, 'weighted_edges': True, 'symmetrize_mode': 'mutual', 'use_snp_selection': False}. Best is trial 122 with value: 0.19334342359748394.
[I 2025-11-03 12:45:48,377] Trial 141 finished with value: 0.17558638044025163 and parameters: {'model_type': 'graphsage', 'hidden_dims': '[512, 256]', 'dropout': 0.11908940067327946, 'batch_norm': True, 'lr': 0.00011234500186668478, 'weight_decay': 6.349313297793454e-06, 'epochs': 312, 'loss': 'mse', 'optimizer': 'adam', 'graph_mode': 'knn', 'source': 'grm', 'knn_k': 7, 'weighted_edges': True, 'symmetrize_mode': 'mutual', 'use_snp_selection': False}. Best is trial 122 with value: 0.19334342359748394.
[I 2025-11-03 12:45:51,708] Trial 142 finished with value: 0.14364566990201136 and parameters: {'model_type': 'graphsage', 'hidden_dims': '[256, 128]', 'dropout': 0.39250853891260457, 'batch_norm': True, 'lr': 9.924848258247226e-05, 'weight_decay': 4.747212880552521e-06, 'epochs': 90, 'loss': 'mse', 'optimizer': 'adam', 'graph_mode': 'knn', 'source': 'grm', 'knn_k': 7, 'weighted_edges': True, 'symmetrize_mode': 'mutual', 'use_snp_selection': False}. Best is trial 122 with value: 0.19334342359748394.
[I 2025-11-03 12:46:04,603] Trial 143 finished with value: 0.1646674265551468 and parameters: {'model_type': 'graphsage', 'hidden_dims': '[512, 256]', 'dropout': 0.16525446598291865, 'batch_norm': True, 'lr': 0.0001257908783653761, 'weight_decay': 2.9828140965517873e-06, 'epochs': 345, 'loss': 'mse', 'optimizer': 'adam', 'graph_mode': 'knn', 'source': 'grm', 'knn_k': 7, 'weighted_edges': True, 'symmetrize_mode': 'mutual', 'use_snp_selection': False}. Best is trial 122 with value: 0.19334342359748394.
[I 2025-11-03 12:46:16,784] Trial 144 finished with value: 0.17530652672671967 and parameters: {'model_type': 'graphsage', 'hidden_dims': '[512, 256]', 'dropout': 0.43056692736378116, 'batch_norm': True, 'lr': 0.00010868145114471706, 'weight_decay': 7.49246089055522e-06, 'epochs': 322, 'loss': 'mse', 'optimizer': 'adam', 'graph_mode': 'knn', 'source': 'grm', 'knn_k': 7, 'weighted_edges': True, 'symmetrize_mode': 'mutual', 'use_snp_selection': False}. Best is trial 122 with value: 0.19334342359748394.
[I 2025-11-03 12:46:21,521] Trial 145 finished with value: 0.16434715345658102 and parameters: {'model_type': 'graphsage', 'hidden_dims': '[512, 256]', 'dropout': 0.15571199862612664, 'batch_norm': True, 'lr': 0.00015958011464918016, 'weight_decay': 3.4828335244623428e-06, 'epochs': 84, 'loss': 'mse', 'optimizer': 'adam', 'graph_mode': 'knn', 'source': 'grm', 'knn_k': 7, 'weighted_edges': False, 'symmetrize_mode': 'mutual', 'use_snp_selection': False}. Best is trial 122 with value: 0.19334342359748394.
[I 2025-11-03 12:46:27,794] Trial 146 finished with value: 0.17311875340968808 and parameters: {'model_type': 'graphsage', 'hidden_dims': '[128, 64]', 'dropout': 0.21435773008336162, 'batch_norm': True, 'lr': 7.492766241174245e-05, 'weight_decay': 9.296919766387638e-06, 'epochs': 332, 'loss': 'mse', 'optimizer': 'adam', 'graph_mode': 'knn', 'source': 'grm', 'knn_k': 8, 'weighted_edges': True, 'symmetrize_mode': 'mutual', 'use_snp_selection': False}. Best is trial 122 with value: 0.19334342359748394.
[I 2025-11-03 12:46:31,952] Trial 147 finished with value: 0.16270132206882876 and parameters: {'model_type': 'graphsage', 'hidden_dims': '[512, 256]', 'dropout': 0.12656678141229055, 'batch_norm': True, 'lr': 6.43591406053378e-05, 'weight_decay': 1.4957200206556733e-05, 'epochs': 67, 'loss': 'mse', 'optimizer': 'adam', 'graph_mode': 'knn', 'source': 'grm', 'knn_k': 7, 'weighted_edges': True, 'symmetrize_mode': 'mutual', 'use_snp_selection': False}. Best is trial 122 with value: 0.19334342359748394.
[I 2025-11-03 12:46:40,093] Trial 148 finished with value: 0.16878006217422323 and parameters: {'model_type': 'graphsage', 'hidden_dims': '[512, 256]', 'dropout': 0.10027459527720417, 'batch_norm': True, 'lr': 8.972017683971539e-05, 'weight_decay': 2.6101792769076066e-06, 'epochs': 199, 'loss': 'mse', 'optimizer': 'adam', 'graph_mode': 'knn', 'source': 'grm', 'knn_k': 6, 'weighted_edges': True, 'symmetrize_mode': 'mutual', 'use_snp_selection': False}. Best is trial 122 with value: 0.19334342359748394.
[I 2025-11-03 12:46:45,767] Trial 149 finished with value: 0.06157125239520903 and parameters: {'model_type': 'graphsage', 'hidden_dims': '[512, 256]', 'dropout': 0.5971535078413075, 'batch_norm': True, 'lr': 1.0416567501770114e-06, 'weight_decay': 5.6171006507675546e-06, 'epochs': 113, 'loss': 'mse', 'optimizer': 'adam', 'graph_mode': 'knn', 'source': 'grm', 'knn_k': 7, 'weighted_edges': True, 'symmetrize_mode': 'mutual', 'use_snp_selection': False}. Best is trial 122 with value: 0.19334342359748394.
[I 2025-11-03 12:46:48,948] Trial 0 finished with value: 0.022468764513700213 and parameters: {'model_type': 'graphsage', 'hidden_dims': '[128, 64]', 'dropout': 0.199031432379812, 'batch_norm': True, 'lr': 1.8408544111075837e-06, 'weight_decay': 5.5136510071208614e-05, 'epochs': 336, 'loss': 'mae', 'optimizer': 'adam', 'graph_mode': 'knn', 'source': 'grm', 'knn_k': 8, 'weighted_edges': True, 'symmetrize_mode': 'mutual', 'use_snp_selection': False}. Best is trial 0 with value: 0.022468764513700213.
[I 2025-11-03 12:46:50,721] Trial 1 finished with value: 0.10369705125979059 and parameters: {'model_type': 'graphsage', 'hidden_dims': '[128, 64]', 'dropout': 0.40051947670227217, 'batch_norm': True, 'lr': 0.0005320428882732732, 'weight_decay': 1.89210117736594e-06, 'epochs': 68, 'loss': 'mse', 'optimizer': 'adam', 'graph_mode': 'knn', 'source': 'grm', 'knn_k': 7, 'weighted_edges': True, 'symmetrize_mode': 'union', 'use_snp_selection': False}. Best is trial 1 with value: 0.10369705125979059.
[I 2025-11-03 12:46:53,526] Trial 2 finished with value: 0.058493578213758286 and parameters: {'model_type': 'graphsage', 'hidden_dims': '[256, 128]', 'dropout': 0.5105528289184642, 'batch_norm': False, 'lr': 0.0006804279372404962, 'weight_decay': 0.0008922815224257085, 'epochs': 181, 'loss': 'mse', 'optimizer': 'adam', 'graph_mode': 'cutoff', 'cutoff': 0.5741905641612706, 'grm_norm': 'gcn', 'self_loops': False, 'use_snp_selection': True, 'num_snps': 26910}. Best is trial 1 with value: 0.10369705125979059.
[I 2025-11-03 12:46:56,512] Trial 3 finished with value: 0.06031752368979278 and parameters: {'model_type': 'graphsage', 'hidden_dims': '[256, 128, 64]', 'dropout': 0.5390483213624292, 'batch_norm': False, 'lr': 3.4705625989073525e-05, 'weight_decay': 2.4623319020131338e-05, 'epochs': 121, 'loss': 'mse', 'optimizer': 'adam', 'graph_mode': 'knn', 'source': 'grm', 'knn_k': 6, 'weighted_edges': False, 'symmetrize_mode': 'mutual', 'use_snp_selection': True, 'num_snps': 30713}. Best is trial 1 with value: 0.10369705125979059.
[I 2025-11-03 12:46:59,367] Trial 4 finished with value: 0.1250646917535024 and parameters: {'model_type': 'graphsage', 'hidden_dims': '[128, 64]', 'dropout': 0.13404863676897502, 'batch_norm': False, 'lr': 0.0001431556295367288, 'weight_decay': 2.2084517750726675e-05, 'epochs': 51, 'loss': 'mae', 'optimizer': 'adam', 'graph_mode': 'cutoff', 'cutoff': 0.6714268476993044, 'grm_norm': 'none', 'self_loops': False, 'use_snp_selection': True, 'num_snps': 45645}. Best is trial 4 with value: 0.1250646917535024.
[I 2025-11-03 12:47:02,976] Trial 5 finished with value: 0.10042651403782835 and parameters: {'model_type': 'graphsage', 'hidden_dims': '[256, 128]', 'dropout': 0.42253606323412096, 'batch_norm': False, 'lr': 4.238630400638805e-05, 'weight_decay': 8.074086040046576e-07, 'epochs': 158, 'loss': 'mae', 'optimizer': 'adam', 'graph_mode': 'knn', 'source': 'grm', 'knn_k': 1, 'weighted_edges': False, 'symmetrize_mode': 'mutual', 'use_snp_selection': True, 'num_snps': 43113}. Best is trial 4 with value: 0.1250646917535024.
[I 2025-11-03 12:47:07,776] Trial 6 finished with value: 0.12032341366501403 and parameters: {'model_type': 'graphsage', 'hidden_dims': '[512, 256]', 'dropout': 0.3534893146320237, 'batch_norm': True, 'lr': 0.000251307964226932, 'weight_decay': 1.821819791794022e-05, 'epochs': 223, 'loss': 'mae', 'optimizer': 'adam', 'graph_mode': 'knn', 'source': 'grm', 'knn_k': 1, 'weighted_edges': True, 'symmetrize_mode': 'mutual', 'use_snp_selection': False}. Best is trial 4 with value: 0.1250646917535024.
[I 2025-11-03 12:47:12,046] Trial 7 finished with value: 0.1141898317134733 and parameters: {'model_type': 'graphsage', 'hidden_dims': '[512, 256]', 'dropout': 0.1105825955860775, 'batch_norm': True, 'lr': 2.374338412754043e-05, 'weight_decay': 1.1284721123340274e-05, 'epochs': 190, 'loss': 'mse', 'optimizer': 'adam', 'graph_mode': 'cutoff', 'cutoff': 0.719872204109604, 'grm_norm': 'gcn', 'self_loops': False, 'use_snp_selection': False}. Best is trial 4 with value: 0.1250646917535024.
[I 2025-11-03 12:47:15,819] Trial 8 finished with value: 0.10168733759673462 and parameters: {'model_type': 'graphsage', 'hidden_dims': '[512, 128]', 'dropout': 0.5066580418354021, 'batch_norm': True, 'lr': 0.00039213678276659976, 'weight_decay': 3.43655320802934e-06, 'epochs': 120, 'loss': 'mse', 'optimizer': 'adam', 'graph_mode': 'cutoff', 'cutoff': 0.34923059576505366, 'grm_norm': 'cosine', 'self_loops': True, 'use_snp_selection': False}. Best is trial 4 with value: 0.1250646917535024.
[I 2025-11-03 12:47:18,142] Trial 9 finished with value: 0.06471196347208687 and parameters: {'model_type': 'graphsage', 'hidden_dims': '[512, 256]', 'dropout': 0.301734920240333, 'batch_norm': False, 'lr': 6.650961854953448e-06, 'weight_decay': 6.861575656590315e-05, 'epochs': 150, 'loss': 'mae', 'optimizer': 'adam', 'graph_mode': 'cutoff', 'cutoff': 0.2857569870061939, 'grm_norm': 'cosine_then_gcn', 'self_loops': False, 'use_snp_selection': True, 'num_snps': 12722}. Best is trial 4 with value: 0.1250646917535024.
[I 2025-11-03 12:47:22,528] Trial 10 finished with value: 0.020239694164602626 and parameters: {'model_type': 'graphsage', 'hidden_dims': '[512, 64]', 'dropout': 0.22492338276159776, 'batch_norm': False, 'lr': 0.00014233761188460356, 'weight_decay': 1.8772904431456567e-07, 'epochs': 41, 'loss': 'mae', 'optimizer': 'adam', 'graph_mode': 'cutoff', 'cutoff': 0.8740100033033124, 'grm_norm': 'none', 'self_loops': True, 'use_snp_selection': True, 'num_snps': 58960}. Best is trial 4 with value: 0.1250646917535024.
[I 2025-11-03 12:47:24,915] Trial 11 finished with value: 0.1113318321846064 and parameters: {'model_type': 'graphsage', 'hidden_dims': '[128, 64]', 'dropout': 0.3197265029098936, 'batch_norm': True, 'lr': 0.00017730835062589574, 'weight_decay': 0.00025962428892461895, 'epochs': 264, 'loss': 'mae', 'optimizer': 'adam', 'graph_mode': 'knn', 'source': 'grm', 'knn_k': 1, 'weighted_edges': True, 'symmetrize_mode': 'union', 'use_snp_selection': False}. Best is trial 4 with value: 0.1250646917535024.
[I 2025-11-03 12:47:31,271] Trial 12 finished with value: 0.10842945830129505 and parameters: {'model_type': 'graphsage', 'hidden_dims': '[512, 256]', 'dropout': 0.22972401386577462, 'batch_norm': True, 'lr': 0.00012059085553112924, 'weight_decay': 6.733495359340639e-06, 'epochs': 251, 'loss': 'mae', 'optimizer': 'adam', 'graph_mode': 'knn', 'source': 'grm', 'knn_k': 3, 'weighted_edges': True, 'symmetrize_mode': 'mutual', 'use_snp_selection': True, 'num_snps': 53389}. Best is trial 4 with value: 0.1250646917535024.
[I 2025-11-03 12:47:36,298] Trial 13 finished with value: 0.11067678070130525 and parameters: {'model_type': 'graphsage', 'hidden_dims': '[512, 64]', 'dropout': 0.13503330426954757, 'batch_norm': False, 'lr': 8.978210403668438e-05, 'weight_decay': 9.690605553568081e-05, 'epochs': 249, 'loss': 'mae', 'optimizer': 'adam', 'graph_mode': 'cutoff', 'cutoff': 0.5564519904141579, 'grm_norm': 'none', 'self_loops': False, 'use_snp_selection': False}. Best is trial 4 with value: 0.1250646917535024.
[I 2025-11-03 12:47:41,120] Trial 14 finished with value: 0.10260474968463364 and parameters: {'model_type': 'graphsage', 'hidden_dims': '[256, 128, 64]', 'dropout': 0.3944228750377537, 'batch_norm': False, 'lr': 0.0009730482189174043, 'weight_decay': 2.2420022920045706e-05, 'epochs': 304, 'loss': 'mae', 'optimizer': 'adam', 'graph_mode': 'knn', 'source': 'grm', 'knn_k': 10, 'weighted_edges': True, 'symmetrize_mode': 'mutual', 'use_snp_selection': True, 'num_snps': 42499}. Best is trial 4 with value: 0.1250646917535024.
[I 2025-11-03 12:47:45,641] Trial 15 finished with value: 0.06725727655870072 and parameters: {'model_type': 'graphsage', 'hidden_dims': '[512, 128]', 'dropout': 0.3152781583098168, 'batch_norm': True, 'lr': 1.3910584477010868e-05, 'weight_decay': 9.812172340687842e-07, 'epochs': 213, 'loss': 'mae', 'optimizer': 'adam', 'graph_mode': 'cutoff', 'cutoff': 0.7616100140494622, 'grm_norm': 'none', 'self_loops': False, 'use_snp_selection': False}. Best is trial 4 with value: 0.1250646917535024.
[I 2025-11-03 12:47:49,142] Trial 16 finished with value: 0.10354771334819396 and parameters: {'model_type': 'graphsage', 'hidden_dims': '[512, 256]', 'dropout': 0.45939857593813493, 'batch_norm': True, 'lr': 0.0002525371175684366, 'weight_decay': 0.00020886916777127813, 'epochs': 109, 'loss': 'mae', 'optimizer': 'adam', 'graph_mode': 'cutoff', 'cutoff': 0.43357126852662536, 'grm_norm': 'cosine', 'self_loops': True, 'use_snp_selection': False}. Best is trial 4 with value: 0.1250646917535024.
[I 2025-11-03 12:47:51,412] Trial 17 finished with value: 0.07296208062785944 and parameters: {'model_type': 'graphsage', 'hidden_dims': '[128, 64]', 'dropout': 0.5928746349572604, 'batch_norm': False, 'lr': 7.402617597693963e-05, 'weight_decay': 1.228253378581801e-05, 'epochs': 216, 'loss': 'mae', 'optimizer': 'adam', 'graph_mode': 'knn', 'source': 'grm', 'knn_k': 4, 'weighted_edges': False, 'symmetrize_mode': 'union', 'use_snp_selection': True, 'num_snps': 11519}. Best is trial 4 with value: 0.1250646917535024.
