[I 2025-11-11 23:02:52,114] Trial 43 finished with value: 0.2606438584998826 and parameters: {'model_type': 'graphsage', 'hidden_dims': '[256, 128, 64]', 'dropout': 0.13397659830428124, 'batch_norm': True, 'lr': 0.0003006029691887376, 'weight_decay': 1.7981322489846494e-07, 'epochs': 208, 'loss': 'mse', 'optimizer': 'adam', 'graph_mode': 'cutoff', 'cutoff': 0.22392163642371876, 'grm_norm': 'none', 'self_loops': True, 'use_snp_selection': False}. Best is trial 37 with value: 0.2732189666284773.
[I 2025-11-11 23:04:04,360] Trial 44 finished with value: 0.253559012002766 and parameters: {'model_type': 'graphsage', 'hidden_dims': '[128, 64]', 'dropout': 0.49213580635191867, 'batch_norm': True, 'lr': 0.0007316268451180218, 'weight_decay': 9.557869625614087e-07, 'epochs': 172, 'loss': 'mse', 'optimizer': 'adam', 'graph_mode': 'cutoff', 'cutoff': 0.40137391749249673, 'grm_norm': 'none', 'self_loops': False, 'use_snp_selection': False}. Best is trial 37 with value: 0.2732189666284773.
[I 2025-11-11 23:08:55,149] Trial 45 finished with value: 0.250101803580416 and parameters: {'model_type': 'graphsage', 'hidden_dims': '[512, 256]', 'dropout': 0.5461520637154368, 'batch_norm': True, 'lr': 0.0004465736230576347, 'weight_decay': 4.778098203988525e-07, 'epochs': 325, 'loss': 'mse', 'optimizer': 'adam', 'graph_mode': 'cutoff', 'cutoff': 0.32539086702049436, 'grm_norm': 'gcn', 'self_loops': False, 'use_snp_selection': False}. Best is trial 37 with value: 0.2732189666284773.
[I 2025-11-11 23:09:40,748] Trial 46 finished with value: 0.25526203451536583 and parameters: {'model_type': 'graphsage', 'hidden_dims': '[256, 128, 64]', 'dropout': 0.2067023179999063, 'batch_norm': True, 'lr': 0.0009459078091323646, 'weight_decay': 1.100255521897788e-07, 'epochs': 80, 'loss': 'mse', 'optimizer': 'adam', 'graph_mode': 'cutoff', 'cutoff': 0.569944289510674, 'grm_norm': 'none', 'self_loops': True, 'use_snp_selection': False}. Best is trial 37 with value: 0.2732189666284773.
[I 2025-11-11 23:10:35,786] Trial 47 finished with value: 0.2417052945749875 and parameters: {'model_type': 'graphsage', 'hidden_dims': '[512, 64]', 'dropout': 0.5795759762789798, 'batch_norm': True, 'lr': 3.6284621777626104e-05, 'weight_decay': 2.6034109926874627e-07, 'epochs': 53, 'loss': 'mse', 'optimizer': 'adam', 'graph_mode': 'cutoff', 'cutoff': 0.7137832121620598, 'grm_norm': 'gcn', 'self_loops': True, 'use_snp_selection': False}. Best is trial 37 with value: 0.2732189666284773.
[I 2025-11-11 23:12:11,209] Trial 48 finished with value: 0.2492710817970786 and parameters: {'model_type': 'graphsage', 'hidden_dims': '[512, 64]', 'dropout': 0.4190604575148843, 'batch_norm': True, 'lr': 0.00024609493970874065, 'weight_decay': 4.313733488574102e-05, 'epochs': 98, 'loss': 'mse', 'optimizer': 'adam', 'graph_mode': 'cutoff', 'cutoff': 0.4255572590026287, 'grm_norm': 'none', 'self_loops': False, 'use_snp_selection': False}. Best is trial 37 with value: 0.2732189666284773.
[I 2025-11-11 23:15:48,658] Trial 49 finished with value: 0.2211235315864218 and parameters: {'model_type': 'graphsage', 'hidden_dims': '[256, 128, 64]', 'dropout': 0.5983736260637812, 'batch_norm': True, 'lr': 1.5006379676206754e-05, 'weight_decay': 6.229073765287197e-07, 'epochs': 252, 'loss': 'mse', 'optimizer': 'adam', 'graph_mode': 'cutoff', 'cutoff': 0.2518078811491725, 'grm_norm': 'cosine_then_gcn', 'self_loops': True, 'use_snp_selection': False}. Best is trial 37 with value: 0.2732189666284773.
[I 2025-11-11 23:20:54,680] Trial 50 finished with value: 0.2426293479230539 and parameters: {'model_type': 'graphsage', 'hidden_dims': '[512, 256]', 'dropout': 0.5191356447715174, 'batch_norm': True, 'lr': 4.808606448156854e-05, 'weight_decay': 1.6255144919332839e-07, 'epochs': 222, 'loss': 'mse', 'optimizer': 'adam', 'graph_mode': 'knn', 'source': 'grm', 'knn_k': 10, 'weighted_edges': True, 'symmetrize_mode': 'union', 'use_snp_selection': False}. Best is trial 37 with value: 0.2732189666284773.
[I 2025-11-11 23:25:01,875] Trial 51 finished with value: 0.25485968085448324 and parameters: {'model_type': 'graphsage', 'hidden_dims': '[256, 128, 64]', 'dropout': 0.11053031636803197, 'batch_norm': True, 'lr': 0.0003509367630695417, 'weight_decay': 1.960390712687284e-07, 'epochs': 207, 'loss': 'mse', 'optimizer': 'adam', 'graph_mode': 'cutoff', 'cutoff': 0.20722870448125563, 'grm_norm': 'none', 'self_loops': True, 'use_snp_selection': False}. Best is trial 37 with value: 0.2732189666284773.
[I 2025-11-11 23:28:28,653] Trial 52 finished with value: 0.2543729718811316 and parameters: {'model_type': 'graphsage', 'hidden_dims': '[256, 128, 64]', 'dropout': 0.13332678957229122, 'batch_norm': True, 'lr': 0.0003094146882407598, 'weight_decay': 1.505830463555872e-07, 'epochs': 208, 'loss': 'mse', 'optimizer': 'adam', 'graph_mode': 'cutoff', 'cutoff': 0.2426531689803082, 'grm_norm': 'none', 'self_loops': True, 'use_snp_selection': False}. Best is trial 37 with value: 0.2732189666284773.
[I 2025-11-11 23:30:01,328] Trial 53 finished with value: 0.24560032128683346 and parameters: {'model_type': 'graphsage', 'hidden_dims': '[256, 128, 64]', 'dropout': 0.17107203593109696, 'batch_norm': True, 'lr': 7.902874273550846e-05, 'weight_decay': 1.0360056440013195e-07, 'epochs': 130, 'loss': 'mse', 'optimizer': 'adam', 'graph_mode': 'cutoff', 'cutoff': 0.3056075498696252, 'grm_norm': 'none', 'self_loops': True, 'use_snp_selection': False}. Best is trial 37 with value: 0.2732189666284773.
[I 2025-11-11 23:31:51,674] Trial 54 finished with value: 0.26254052644403847 and parameters: {'model_type': 'graphsage', 'hidden_dims': '[256, 128, 64]', 'dropout': 0.14738153711872265, 'batch_norm': True, 'lr': 0.0001515539360745015, 'weight_decay': 4.0207220943679125e-07, 'epochs': 187, 'loss': 'mse', 'optimizer': 'adam', 'graph_mode': 'cutoff', 'cutoff': 0.37019405779452474, 'grm_norm': 'none', 'self_loops': True, 'use_snp_selection': False}. Best is trial 37 with value: 0.2732189666284773.
[I 2025-11-11 23:34:33,111] Trial 55 finished with value: 0.22963217385738482 and parameters: {'model_type': 'graphsage', 'hidden_dims': '[512, 64]', 'dropout': 0.17531328813448896, 'batch_norm': False, 'lr': 0.00020080643031105484, 'weight_decay': 1.2828461189833276e-06, 'epochs': 184, 'loss': 'mae', 'optimizer': 'adam', 'graph_mode': 'cutoff', 'cutoff': 0.3771385963802004, 'grm_norm': 'none', 'self_loops': True, 'use_snp_selection': False}. Best is trial 37 with value: 0.2732189666284773.
[I 2025-11-11 23:35:46,192] Trial 56 finished with value: 0.2328151159745951 and parameters: {'model_type': 'graphsage', 'hidden_dims': '[128, 64]', 'dropout': 0.341463104089671, 'batch_norm': True, 'lr': 0.00013060099297187712, 'weight_decay': 4.1292975153914264e-07, 'epochs': 292, 'loss': 'mse', 'optimizer': 'adam', 'graph_mode': 'cutoff', 'cutoff': 0.8273550538077808, 'grm_norm': 'none', 'self_loops': True, 'use_snp_selection': False}. Best is trial 37 with value: 0.2732189666284773.
[I 2025-11-11 23:36:43,024] Trial 57 finished with value: 0.24807228958177996 and parameters: {'model_type': 'graphsage', 'hidden_dims': '[256, 128, 64]', 'dropout': 0.14939803868950485, 'batch_norm': True, 'lr': 0.00015210386796265312, 'weight_decay': 2.810569316612965e-06, 'epochs': 44, 'loss': 'mse', 'optimizer': 'adam', 'graph_mode': 'knn', 'source': 'grm', 'knn_k': 8, 'weighted_edges': True, 'symmetrize_mode': 'union', 'use_snp_selection': False}. Best is trial 37 with value: 0.2732189666284773.
[I 2025-11-11 23:38:01,018] Trial 58 finished with value: 0.010582924332259692 and parameters: {'model_type': 'graphsage', 'hidden_dims': '[512, 64]', 'dropout': 0.23787042417297344, 'batch_norm': False, 'lr': 0.0007134273390922381, 'weight_decay': 9.3904849505704e-07, 'epochs': 70, 'loss': 'mae', 'optimizer': 'adam', 'graph_mode': 'cutoff', 'cutoff': 0.33026579711334175, 'grm_norm': 'cosine', 'self_loops': True, 'use_snp_selection': False}. Best is trial 37 with value: 0.2732189666284773.
[I 2025-11-11 23:39:00,968] Trial 59 finished with value: 0.24465457428531864 and parameters: {'model_type': 'graphsage', 'hidden_dims': '[256, 128, 64]', 'dropout': 0.2805415476125026, 'batch_norm': True, 'lr': 7.746865070263058e-05, 'weight_decay': 2.90645669035509e-07, 'epochs': 90, 'loss': 'mse', 'optimizer': 'adam', 'graph_mode': 'cutoff', 'cutoff': 0.414925029984977, 'grm_norm': 'cosine_then_gcn', 'self_loops': True, 'use_snp_selection': False}. Best is trial 37 with value: 0.2732189666284773.
[I 2025-11-11 23:40:09,405] Trial 60 finished with value: 0.24851800464983334 and parameters: {'model_type': 'graphsage', 'hidden_dims': '[256, 128]', 'dropout': 0.22275609423310389, 'batch_norm': True, 'lr': 0.0004801487886465829, 'weight_decay': 4.793409331991199e-07, 'epochs': 112, 'loss': 'mse', 'optimizer': 'adam', 'graph_mode': 'cutoff', 'cutoff': 0.4619879351249924, 'grm_norm': 'cosine', 'self_loops': False, 'use_snp_selection': False}. Best is trial 37 with value: 0.2732189666284773.
[I 2025-11-11 23:42:48,995] Trial 61 finished with value: 0.25069022792513096 and parameters: {'model_type': 'graphsage', 'hidden_dims': '[256, 128, 64]', 'dropout': 0.19343940867570883, 'batch_norm': True, 'lr': 0.00010897101345656561, 'weight_decay': 2.223817116154172e-07, 'epochs': 226, 'loss': 'mse', 'optimizer': 'adam', 'graph_mode': 'cutoff', 'cutoff': 0.28697639971929223, 'grm_norm': 'none', 'self_loops': True, 'use_snp_selection': False}. Best is trial 37 with value: 0.2732189666284773.
[I 2025-11-11 23:44:30,813] Trial 62 finished with value: 0.24684288869934673 and parameters: {'model_type': 'graphsage', 'hidden_dims': '[256, 128, 64]', 'dropout': 0.1414159716969916, 'batch_norm': True, 'lr': 0.0002271708538312603, 'weight_decay': 7.168435766751728e-07, 'epochs': 166, 'loss': 'mse', 'optimizer': 'adam', 'graph_mode': 'cutoff', 'cutoff': 0.3556409297252867, 'grm_norm': 'none', 'self_loops': True, 'use_snp_selection': False}. Best is trial 37 with value: 0.2732189666284773.
[I 2025-11-11 23:48:43,353] Trial 63 finished with value: 0.25244934363063076 and parameters: {'model_type': 'graphsage', 'hidden_dims': '[256, 128, 64]', 'dropout': 0.13065933249301634, 'batch_norm': True, 'lr': 0.00015784120806161618, 'weight_decay': 0.0004446383961193731, 'epochs': 246, 'loss': 'mse', 'optimizer': 'adam', 'graph_mode': 'cutoff', 'cutoff': 0.23406113230470782, 'grm_norm': 'none', 'self_loops': True, 'use_snp_selection': False}. Best is trial 37 with value: 0.2732189666284773.
[I 2025-11-11 23:51:26,965] Trial 64 finished with value: 0.25194513077050346 and parameters: {'model_type': 'graphsage', 'hidden_dims': '[512, 64]', 'dropout': 0.156869916584505, 'batch_norm': True, 'lr': 0.00029484494260614884, 'weight_decay': 3.6739392862286967e-07, 'epochs': 189, 'loss': 'mse', 'optimizer': 'adam', 'graph_mode': 'cutoff', 'cutoff': 0.4313564327814527, 'grm_norm': 'none', 'self_loops': True, 'use_snp_selection': False}. Best is trial 37 with value: 0.2732189666284773.
[I 2025-11-11 23:53:05,544] Trial 65 finished with value: 0.25339542442029817 and parameters: {'model_type': 'graphsage', 'hidden_dims': '[256, 128, 64]', 'dropout': 0.12114463168816773, 'batch_norm': True, 'lr': 0.0004200018150153185, 'weight_decay': 1.4592944650493372e-07, 'epochs': 217, 'loss': 'mse', 'optimizer': 'adam', 'graph_mode': 'cutoff', 'cutoff': 0.5281368668458869, 'grm_norm': 'cosine', 'self_loops': True, 'use_snp_selection': False}. Best is trial 37 with value: 0.2732189666284773.
[I 2025-11-11 23:56:52,992] Trial 66 finished with value: 0.17108145862455065 and parameters: {'model_type': 'graphsage', 'hidden_dims': '[512, 256]', 'dropout': 0.1003577210696488, 'batch_norm': True, 'lr': 3.558242491469619e-06, 'weight_decay': 2.7587404673993247e-07, 'epochs': 233, 'loss': 'mse', 'optimizer': 'adam', 'graph_mode': 'knn', 'source': 'grm', 'knn_k': 5, 'weighted_edges': True, 'symmetrize_mode': 'union', 'use_snp_selection': False}. Best is trial 37 with value: 0.2732189666284773.
[I 2025-11-11 23:59:35,015] Trial 67 finished with value: 0.01937398993359072 and parameters: {'model_type': 'graphsage', 'hidden_dims': '[512, 64]', 'dropout': 0.5804137108981646, 'batch_norm': False, 'lr': 0.0007675819477836079, 'weight_decay': 5.279454245795783e-07, 'epochs': 197, 'loss': 'mse', 'optimizer': 'adam', 'graph_mode': 'cutoff', 'cutoff': 0.4786501660270163, 'grm_norm': 'none', 'self_loops': True, 'use_snp_selection': False}. Best is trial 37 with value: 0.2732189666284773.
[I 2025-11-12 00:02:02,826] Trial 68 finished with value: 0.25518534399792847 and parameters: {'model_type': 'graphsage', 'hidden_dims': '[256, 128, 64]', 'dropout': 0.4978302178478253, 'batch_norm': True, 'lr': 6.304511795649614e-05, 'weight_decay': 1.7726801768625212e-05, 'epochs': 269, 'loss': 'mae', 'optimizer': 'adam', 'graph_mode': 'cutoff', 'cutoff': 0.3740455679482741, 'grm_norm': 'cosine', 'self_loops': True, 'use_snp_selection': False}. Best is trial 37 with value: 0.2732189666284773.
[I 2025-11-12 00:03:32,678] Trial 69 finished with value: 0.26058283641756225 and parameters: {'model_type': 'graphsage', 'hidden_dims': '[512, 64]', 'dropout': 0.5250988218513101, 'batch_norm': True, 'lr': 0.0002834431586629344, 'weight_decay': 2.0372150826689285e-07, 'epochs': 72, 'loss': 'mse', 'optimizer': 'adam', 'graph_mode': 'cutoff', 'cutoff': 0.2761721094766185, 'grm_norm': 'gcn', 'self_loops': True, 'use_snp_selection': False}. Best is trial 37 with value: 0.2732189666284773.
[I 2025-11-12 00:04:19,648] Trial 70 finished with value: 0.23684748227035599 and parameters: {'model_type': 'graphsage', 'hidden_dims': '[256, 128, 64]', 'dropout': 0.562949289187077, 'batch_norm': True, 'lr': 0.0005782102551946249, 'weight_decay': 1.271212668891156e-06, 'epochs': 59, 'loss': 'mse', 'optimizer': 'adam', 'graph_mode': 'cutoff', 'cutoff': 0.4479593825724525, 'grm_norm': 'none', 'self_loops': True, 'use_snp_selection': True, 'num_snps': 2309}. Best is trial 37 with value: 0.2732189666284773.
[I 2025-11-12 00:06:19,521] Trial 71 finished with value: 0.25791582702646804 and parameters: {'model_type': 'graphsage', 'hidden_dims': '[512, 64]', 'dropout': 0.5492695340630603, 'batch_norm': True, 'lr': 0.00032995853392888465, 'weight_decay': 1.973840360898615e-07, 'epochs': 74, 'loss': 'mse', 'optimizer': 'adam', 'graph_mode': 'cutoff', 'cutoff': 0.2190793700630555, 'grm_norm': 'gcn', 'self_loops': True, 'use_snp_selection': False}. Best is trial 37 with value: 0.2732189666284773.
[I 2025-11-12 00:07:31,007] Trial 72 finished with value: 0.279860945049314 and parameters: {'model_type': 'graphsage', 'hidden_dims': '[512, 64]', 'dropout': 0.5147843523475018, 'batch_norm': True, 'lr': 0.0002725925663263472, 'weight_decay': 1.3684202669678292e-07, 'epochs': 49, 'loss': 'mse', 'optimizer': 'adam', 'graph_mode': 'cutoff', 'cutoff': 0.26886638557448267, 'grm_norm': 'gcn', 'self_loops': True, 'use_snp_selection': False}. Best is trial 72 with value: 0.279860945049314.
[I 2025-11-12 00:08:35,297] Trial 73 finished with value: 0.24886426917075233 and parameters: {'model_type': 'graphsage', 'hidden_dims': '[512, 64]', 'dropout': 0.4775097639551357, 'batch_norm': True, 'lr': 0.0002019211911515717, 'weight_decay': 1.3263553060622737e-07, 'epochs': 49, 'loss': 'mse', 'optimizer': 'adam', 'graph_mode': 'cutoff', 'cutoff': 0.3065989958919599, 'grm_norm': 'gcn', 'self_loops': True, 'use_snp_selection': False}. Best is trial 72 with value: 0.279860945049314.
[I 2025-11-12 00:09:43,575] Trial 74 finished with value: 0.26677800008637614 and parameters: {'model_type': 'graphsage', 'hidden_dims': '[512, 64]', 'dropout': 0.44369218748452977, 'batch_norm': True, 'lr': 0.00014114181368454458, 'weight_decay': 3.178709461346929e-07, 'epochs': 42, 'loss': 'mse', 'optimizer': 'adam', 'graph_mode': 'cutoff', 'cutoff': 0.25712125012124165, 'grm_norm': 'gcn', 'self_loops': True, 'use_snp_selection': False}. Best is trial 72 with value: 0.279860945049314.
[I 2025-11-12 00:10:39,066] Trial 75 finished with value: 0.25732695604727623 and parameters: {'model_type': 'graphsage', 'hidden_dims': '[512, 64]', 'dropout': 0.4320064375127777, 'batch_norm': True, 'lr': 0.00010499239084067532, 'weight_decay': 1.0018106429849394e-07, 'epochs': 41, 'loss': 'mse', 'optimizer': 'adam', 'graph_mode': 'cutoff', 'cutoff': 0.33529193230095566, 'grm_norm': 'gcn', 'self_loops': True, 'use_snp_selection': False}. Best is trial 72 with value: 0.279860945049314.
[I 2025-11-12 00:12:11,262] Trial 76 finished with value: 0.25430669591979105 and parameters: {'model_type': 'graphsage', 'hidden_dims': '[512, 64]', 'dropout': 0.35677143725326116, 'batch_norm': True, 'lr': 0.0009883048148975806, 'weight_decay': 3.2423015886827185e-07, 'epochs': 65, 'loss': 'mse', 'optimizer': 'adam', 'graph_mode': 'cutoff', 'cutoff': 0.2589180699986438, 'grm_norm': 'gcn', 'self_loops': True, 'use_snp_selection': False}. Best is trial 72 with value: 0.279860945049314.
[I 2025-11-12 00:13:13,135] Trial 77 finished with value: 0.257055970453544 and parameters: {'model_type': 'graphsage', 'hidden_dims': '[512, 64]', 'dropout': 0.41054160770106074, 'batch_norm': True, 'lr': 0.00014775296682561947, 'weight_decay': 4.388155184267998e-07, 'epochs': 50, 'loss': 'mse', 'optimizer': 'adam', 'graph_mode': 'cutoff', 'cutoff': 0.35359724418567884, 'grm_norm': 'gcn', 'self_loops': True, 'use_snp_selection': False}. Best is trial 72 with value: 0.279860945049314.
[I 2025-11-12 00:14:49,161] Trial 78 finished with value: 0.2565211559781955 and parameters: {'model_type': 'graphsage', 'hidden_dims': '[512, 64]', 'dropout': 0.44990373941101963, 'batch_norm': True, 'lr': 0.00013150854988108813, 'weight_decay': 2.525239763210035e-06, 'epochs': 88, 'loss': 'mse', 'optimizer': 'adam', 'graph_mode': 'knn', 'source': 'grm', 'knn_k': 8, 'weighted_edges': False, 'symmetrize_mode': 'mutual', 'use_snp_selection': False}. Best is trial 72 with value: 0.279860945049314.
[I 2025-11-12 00:15:46,740] Trial 79 finished with value: 0.2426807465899723 and parameters: {'model_type': 'graphsage', 'hidden_dims': '[256, 128]', 'dropout': 0.5170134752288528, 'batch_norm': False, 'lr': 6.998013773688581e-05, 'weight_decay': 7.680893059146225e-07, 'epochs': 56, 'loss': 'mae', 'optimizer': 'adam', 'graph_mode': 'cutoff', 'cutoff': 0.29504755057129267, 'grm_norm': 'cosine', 'self_loops': True, 'use_snp_selection': True, 'num_snps': 12699}. Best is trial 72 with value: 0.279860945049314.
[I 2025-11-12 00:17:10,438] Trial 80 finished with value: 0.24863335005442916 and parameters: {'model_type': 'graphsage', 'hidden_dims': '[512, 64]', 'dropout': 0.5056640430330502, 'batch_norm': True, 'lr': 4.7597476101244256e-05, 'weight_decay': 2.737555928682389e-07, 'epochs': 82, 'loss': 'mse', 'optimizer': 'adam', 'graph_mode': 'cutoff', 'cutoff': 0.40164814877257676, 'grm_norm': 'gcn', 'self_loops': True, 'use_snp_selection': False}. Best is trial 72 with value: 0.279860945049314.
[I 2025-11-12 00:18:03,845] Trial 81 finished with value: 0.2506163451353845 and parameters: {'model_type': 'graphsage', 'hidden_dims': '[128, 64]', 'dropout': 0.5320699182800239, 'batch_norm': True, 'lr': 0.00024249494175066177, 'weight_decay': 1.5456666240583035e-07, 'epochs': 65, 'loss': 'mse', 'optimizer': 'adam', 'graph_mode': 'cutoff', 'cutoff': 0.26577640208152814, 'grm_norm': 'none', 'self_loops': True, 'use_snp_selection': False}. Best is trial 72 with value: 0.279860945049314.
[I 2025-11-12 00:19:26,918] Trial 82 finished with value: 0.26747402390927133 and parameters: {'model_type': 'graphsage', 'hidden_dims': '[512, 64]', 'dropout': 0.5737760476091586, 'batch_norm': True, 'lr': 0.0008157690436888029, 'weight_decay': 2.3890316395104826e-07, 'epochs': 50, 'loss': 'mse', 'optimizer': 'adam', 'graph_mode': 'cutoff', 'cutoff': 0.23463783563594426, 'grm_norm': 'cosine', 'self_loops': True, 'use_snp_selection': False}. Best is trial 72 with value: 0.279860945049314.
[I 2025-11-12 00:20:16,835] Trial 83 finished with value: 0.25542414546347486 and parameters: {'model_type': 'graphsage', 'hidden_dims': '[512, 64]', 'dropout': 0.5704861871447825, 'batch_norm': True, 'lr': 0.0008241605277231077, 'weight_decay': 2.3669314805456483e-07, 'epochs': 40, 'loss': 'mse', 'optimizer': 'adam', 'graph_mode': 'cutoff', 'cutoff': 0.509247199635303, 'grm_norm': 'cosine', 'self_loops': True, 'use_snp_selection': False}. Best is trial 72 with value: 0.279860945049314.
[I 2025-11-12 00:21:11,941] Trial 84 finished with value: 0.2585180233918728 and parameters: {'model_type': 'graphsage', 'hidden_dims': '[512, 64]', 'dropout': 0.5893678297195352, 'batch_norm': True, 'lr': 0.000653207648960993, 'weight_decay': 3.486885379084631e-07, 'epochs': 50, 'loss': 'mse', 'optimizer': 'adam', 'graph_mode': 'cutoff', 'cutoff': 0.5480816837121041, 'grm_norm': 'cosine', 'self_loops': True, 'use_snp_selection': False}. Best is trial 72 with value: 0.279860945049314.
[I 2025-11-12 00:22:30,579] Trial 85 finished with value: 0.2553305487300407 and parameters: {'model_type': 'graphsage', 'hidden_dims': '[512, 64]', 'dropout': 0.5521698188245675, 'batch_norm': True, 'lr': 0.00040949897805051005, 'weight_decay': 5.581687682440961e-07, 'epochs': 60, 'loss': 'mse', 'optimizer': 'adam', 'graph_mode': 'cutoff', 'cutoff': 0.27131287722682285, 'grm_norm': 'cosine', 'self_loops': False, 'use_snp_selection': False}. Best is trial 72 with value: 0.279860945049314.
[I 2025-11-12 00:24:18,545] Trial 86 finished with value: 0.25617672800619634 and parameters: {'model_type': 'graphsage', 'hidden_dims': '[512, 64]', 'dropout': 0.5401164186155564, 'batch_norm': True, 'lr': 0.0005356628411013797, 'weight_decay': 1.2597280827448918e-07, 'epochs': 104, 'loss': 'mse', 'optimizer': 'adam', 'graph_mode': 'cutoff', 'cutoff': 0.31420142737663803, 'grm_norm': 'cosine', 'self_loops': True, 'use_snp_selection': False}. Best is trial 72 with value: 0.279860945049314.
