[I 2025-11-03 11:47:00,903] Trial 57 finished with value: 0.032285038656674946 and parameters: {'model_type': 'gcn', 'hidden_dims': '[512, 128]', 'dropout': 0.4708777545559389, 'batch_norm': False, 'lr': 0.00017237788563035148, 'weight_decay': 0.00019150920174298684, 'epochs': 120, 'loss': 'mse', 'optimizer': 'adam', 'graph_mode': 'off', 'use_snp_selection': False}. Best is trial 24 with value: 0.07345968974271269.
[I 2025-11-03 11:47:02,230] Trial 58 finished with value: 0.007328368001447452 and parameters: {'model_type': 'gcn', 'hidden_dims': '[256, 128, 64]', 'dropout': 0.5959012340184064, 'batch_norm': False, 'lr': 0.00024759030440601364, 'weight_decay': 2.7207901917403743e-05, 'epochs': 153, 'loss': 'mse', 'optimizer': 'adam', 'graph_mode': 'off', 'use_snp_selection': False}. Best is trial 24 with value: 0.07345968974271269.
[I 2025-11-03 11:47:04,052] Trial 59 finished with value: 0.03542236268176892 and parameters: {'model_type': 'gcn', 'hidden_dims': '[512, 128]', 'dropout': 0.3992170812000825, 'batch_norm': False, 'lr': 7.629669210086254e-05, 'weight_decay': 3.2319509321267284e-06, 'epochs': 179, 'loss': 'mae', 'optimizer': 'adam', 'graph_mode': 'off', 'use_snp_selection': False}. Best is trial 24 with value: 0.07345968974271269.
[I 2025-11-03 11:47:05,754] Trial 60 finished with value: 0.03962582662551875 and parameters: {'model_type': 'gcn', 'hidden_dims': '[256, 128, 64]', 'dropout': 0.5114559528441769, 'batch_norm': True, 'lr': 0.0004946616959399289, 'weight_decay': 4.642432197778821e-05, 'epochs': 225, 'loss': 'mse', 'optimizer': 'adam', 'graph_mode': 'off', 'use_snp_selection': False}. Best is trial 24 with value: 0.07345968974271269.
[I 2025-11-03 11:47:07,635] Trial 61 finished with value: 0.024152713309822053 and parameters: {'model_type': 'gcn', 'hidden_dims': '[512, 64]', 'dropout': 0.33263554818931573, 'batch_norm': False, 'lr': 0.00013269228185391657, 'weight_decay': 1.5269835882391667e-05, 'epochs': 196, 'loss': 'mse', 'optimizer': 'adam', 'graph_mode': 'off', 'use_snp_selection': False}. Best is trial 24 with value: 0.07345968974271269.
[I 2025-11-03 11:47:08,949] Trial 62 finished with value: 0.037465161530946776 and parameters: {'model_type': 'gcn', 'hidden_dims': '[256, 128]', 'dropout': 0.4651892634495746, 'batch_norm': False, 'lr': 2.549187430189012e-05, 'weight_decay': 6.893016716063388e-05, 'epochs': 190, 'loss': 'mse', 'optimizer': 'adam', 'graph_mode': 'off', 'use_snp_selection': False}. Best is trial 24 with value: 0.07345968974271269.
[I 2025-11-03 11:47:10,958] Trial 63 finished with value: 0.05186096117710226 and parameters: {'model_type': 'gcn', 'hidden_dims': '[512, 256]', 'dropout': 0.43028230697506753, 'batch_norm': False, 'lr': 5.066423945002271e-05, 'weight_decay': 5.441358100537133e-05, 'epochs': 211, 'loss': 'mse', 'optimizer': 'adam', 'graph_mode': 'off', 'use_snp_selection': True, 'num_snps': 33608}. Best is trial 24 with value: 0.07345968974271269.
[I 2025-11-03 11:47:12,819] Trial 64 finished with value: 0.05122263191357725 and parameters: {'model_type': 'gcn', 'hidden_dims': '[256, 128, 64]', 'dropout': 0.5147924332182363, 'batch_norm': False, 'lr': 0.0001853679997274887, 'weight_decay': 2.281601216263704e-05, 'epochs': 164, 'loss': 'mse', 'optimizer': 'adam', 'graph_mode': 'off', 'use_snp_selection': True, 'num_snps': 40968}. Best is trial 24 with value: 0.07345968974271269.
[I 2025-11-03 11:47:14,001] Trial 65 finished with value: 0.06436495013047461 and parameters: {'model_type': 'gcn', 'hidden_dims': '[128, 64]', 'dropout': 0.5523842373638098, 'batch_norm': False, 'lr': 1.748686607907624e-05, 'weight_decay': 3.539904302213493e-05, 'epochs': 243, 'loss': 'mse', 'optimizer': 'adam', 'graph_mode': 'off', 'use_snp_selection': False}. Best is trial 24 with value: 0.07345968974271269.
[I 2025-11-03 11:47:16,149] Trial 66 finished with value: 0.03056913102891256 and parameters: {'model_type': 'gcn', 'hidden_dims': '[512, 128]', 'dropout': 0.5707659404518755, 'batch_norm': False, 'lr': 0.0003603336806104467, 'weight_decay': 3.837763342098563e-05, 'epochs': 242, 'loss': 'mse', 'optimizer': 'adam', 'graph_mode': 'off', 'use_snp_selection': False}. Best is trial 24 with value: 0.07345968974271269.
[I 2025-11-03 11:47:17,928] Trial 67 finished with value: -0.001617620343936819 and parameters: {'model_type': 'gcn', 'hidden_dims': '[256, 128, 64]', 'dropout': 0.48914740791855804, 'batch_norm': False, 'lr': 0.0008264389416775473, 'weight_decay': 4.5110215881504544e-07, 'epochs': 254, 'loss': 'mse', 'optimizer': 'adam', 'graph_mode': 'off', 'use_snp_selection': False}. Best is trial 24 with value: 0.07345968974271269.
[I 2025-11-03 11:47:20,003] Trial 68 finished with value: 0.04912443257483449 and parameters: {'model_type': 'gcn', 'hidden_dims': '[512, 256]', 'dropout': 0.5397371989495731, 'batch_norm': False, 'lr': 2.0601852321407098e-05, 'weight_decay': 1.026473054730291e-05, 'epochs': 219, 'loss': 'mse', 'optimizer': 'adam', 'graph_mode': 'off', 'use_snp_selection': False}. Best is trial 24 with value: 0.07345968974271269.
[I 2025-11-03 11:47:21,069] Trial 69 finished with value: 0.04766155961775249 and parameters: {'model_type': 'gcn', 'hidden_dims': '[128, 64]', 'dropout': 0.5486948185500025, 'batch_norm': False, 'lr': 0.00011362758535559901, 'weight_decay': 0.00010159055428971625, 'epochs': 205, 'loss': 'mae', 'optimizer': 'adam', 'graph_mode': 'off', 'use_snp_selection': False}. Best is trial 24 with value: 0.07345968974271269.
[I 2025-11-03 11:47:22,678] Trial 70 finished with value: 0.03309732523426019 and parameters: {'model_type': 'gcn', 'hidden_dims': '[256, 128]', 'dropout': 0.5782842217441959, 'batch_norm': False, 'lr': 1.0723833370436655e-06, 'weight_decay': 0.0004213503350751288, 'epochs': 269, 'loss': 'mse', 'optimizer': 'adam', 'graph_mode': 'off', 'use_snp_selection': False}. Best is trial 24 with value: 0.07345968974271269.
[I 2025-11-03 11:47:24,066] Trial 71 finished with value: 0.04314133920323897 and parameters: {'model_type': 'gcn', 'hidden_dims': '[128, 64]', 'dropout': 0.35937961548771036, 'batch_norm': False, 'lr': 1.281013193329676e-05, 'weight_decay': 6.480744923020752e-05, 'epochs': 188, 'loss': 'mse', 'optimizer': 'adam', 'graph_mode': 'off', 'use_snp_selection': True, 'num_snps': 28164}. Best is trial 24 with value: 0.07345968974271269.
[I 2025-11-03 11:47:25,019] Trial 72 finished with value: 0.057714833998138 and parameters: {'model_type': 'gcn', 'hidden_dims': '[128, 64]', 'dropout': 0.47873704227967534, 'batch_norm': False, 'lr': 2.8565481338685498e-05, 'weight_decay': 0.00019003835627791587, 'epochs': 173, 'loss': 'mse', 'optimizer': 'adam', 'graph_mode': 'off', 'use_snp_selection': True, 'num_snps': 7906}. Best is trial 24 with value: 0.07345968974271269.
[I 2025-11-03 11:47:26,104] Trial 73 finished with value: 0.0426072004330556 and parameters: {'model_type': 'gcn', 'hidden_dims': '[128, 64]', 'dropout': 0.2638478721818553, 'batch_norm': False, 'lr': 2.023283039216149e-05, 'weight_decay': 2.4864124896782496e-05, 'epochs': 244, 'loss': 'mse', 'optimizer': 'adam', 'graph_mode': 'off', 'use_snp_selection': True, 'num_snps': 7100}. Best is trial 24 with value: 0.07345968974271269.
[I 2025-11-03 11:47:27,348] Trial 74 finished with value: 0.06414488836608388 and parameters: {'model_type': 'gcn', 'hidden_dims': '[128, 64]', 'dropout': 0.5125742200168911, 'batch_norm': False, 'lr': 9.012239954524738e-05, 'weight_decay': 4.035795133215071e-05, 'epochs': 216, 'loss': 'mse', 'optimizer': 'adam', 'graph_mode': 'off', 'use_snp_selection': True, 'num_snps': 18822}. Best is trial 24 with value: 0.07345968974271269.
[I 2025-11-03 11:47:28,955] Trial 75 finished with value: 0.045723343222916844 and parameters: {'model_type': 'gcn', 'hidden_dims': '[256, 128, 64]', 'dropout': 0.5146175960210964, 'batch_norm': False, 'lr': 9.523455158048043e-05, 'weight_decay': 1.7489158293876096e-05, 'epochs': 221, 'loss': 'mse', 'optimizer': 'adam', 'graph_mode': 'off', 'use_snp_selection': False}. Best is trial 24 with value: 0.07345968974271269.
[I 2025-11-03 11:47:30,503] Trial 76 finished with value: 0.023556598405824445 and parameters: {'model_type': 'gcn', 'hidden_dims': '[512, 256]', 'dropout': 0.5024562930376094, 'batch_norm': False, 'lr': 0.0002352682494147687, 'weight_decay': 3.554910263786126e-05, 'epochs': 232, 'loss': 'mse', 'optimizer': 'adam', 'graph_mode': 'off', 'use_snp_selection': True, 'num_snps': 18711}. Best is trial 24 with value: 0.07345968974271269.
[I 2025-11-03 11:47:32,553] Trial 77 finished with value: 0.06114895099641479 and parameters: {'model_type': 'gcn', 'hidden_dims': '[128, 64]', 'dropout': 0.44476964213360254, 'batch_norm': True, 'lr': 8.433985468028033e-05, 'weight_decay': 1.0869595795164962e-05, 'epochs': 209, 'loss': 'mse', 'optimizer': 'adam', 'graph_mode': 'off', 'use_snp_selection': True, 'num_snps': 54527}. Best is trial 24 with value: 0.07345968974271269.
[I 2025-11-03 11:47:34,476] Trial 78 finished with value: 0.05009518491625933 and parameters: {'model_type': 'gcn', 'hidden_dims': '[128, 64]', 'dropout': 0.4165059885375808, 'batch_norm': True, 'lr': 5.855740589328068e-05, 'weight_decay': 7.3579958163342195e-06, 'epochs': 209, 'loss': 'mse', 'optimizer': 'adam', 'graph_mode': 'off', 'use_snp_selection': True, 'num_snps': 48874}. Best is trial 24 with value: 0.07345968974271269.
[I 2025-11-03 11:47:35,559] Trial 79 finished with value: 0.050466931411957544 and parameters: {'model_type': 'gcn', 'hidden_dims': '[128, 64]', 'dropout': 0.4577959620174218, 'batch_norm': True, 'lr': 4.126451355109082e-05, 'weight_decay': 1.239045019475656e-05, 'epochs': 201, 'loss': 'mse', 'optimizer': 'adam', 'graph_mode': 'off', 'use_snp_selection': False}. Best is trial 24 with value: 0.07345968974271269.
[I 2025-11-03 11:47:36,946] Trial 80 finished with value: 0.03621615655619305 and parameters: {'model_type': 'gcn', 'hidden_dims': '[128, 64]', 'dropout': 0.4352414925409944, 'batch_norm': True, 'lr': 0.0001516642116229211, 'weight_decay': 2.934245027926965e-05, 'epochs': 315, 'loss': 'mse', 'optimizer': 'adam', 'graph_mode': 'off', 'use_snp_selection': True, 'num_snps': 9755}. Best is trial 24 with value: 0.07345968974271269.
[I 2025-11-03 11:47:38,901] Trial 81 finished with value: 0.04463695951855925 and parameters: {'model_type': 'gcn', 'hidden_dims': '[128, 64]', 'dropout': 0.3812064936511889, 'batch_norm': True, 'lr': 8.28610132228353e-05, 'weight_decay': 1.8559298959042482e-05, 'epochs': 188, 'loss': 'mse', 'optimizer': 'adam', 'graph_mode': 'off', 'use_snp_selection': True, 'num_snps': 55935}. Best is trial 24 with value: 0.07345968974271269.
[I 2025-11-03 11:47:41,316] Trial 82 finished with value: 0.05587329187695145 and parameters: {'model_type': 'gcn', 'hidden_dims': '[256, 128, 64]', 'dropout': 0.5251645998004333, 'batch_norm': True, 'lr': 0.00012148518272095185, 'weight_decay': 5.580474222190276e-06, 'epochs': 170, 'loss': 'mse', 'optimizer': 'adam', 'graph_mode': 'off', 'use_snp_selection': True, 'num_snps': 59829}. Best is trial 24 with value: 0.07345968974271269.
[I 2025-11-03 11:47:44,135] Trial 83 finished with value: 0.032072625176574054 and parameters: {'model_type': 'gcn', 'hidden_dims': '[512, 64]', 'dropout': 0.4818713124162247, 'batch_norm': False, 'lr': 6.111280697195873e-05, 'weight_decay': 1.0172392456062503e-05, 'epochs': 213, 'loss': 'mse', 'optimizer': 'adam', 'graph_mode': 'off', 'use_snp_selection': True, 'num_snps': 54524}. Best is trial 24 with value: 0.07345968974271269.
[I 2025-11-03 11:47:46,598] Trial 84 finished with value: 0.025354430732619306 and parameters: {'model_type': 'gcn', 'hidden_dims': '[512, 128]', 'dropout': 0.5392176598071864, 'batch_norm': True, 'lr': 0.00034077821559791124, 'weight_decay': 5.028380482499692e-05, 'epochs': 180, 'loss': 'mse', 'optimizer': 'adam', 'graph_mode': 'off', 'use_snp_selection': True, 'num_snps': 49966}. Best is trial 24 with value: 0.07345968974271269.
[I 2025-11-03 11:47:47,775] Trial 85 finished with value: 0.041176469654661305 and parameters: {'model_type': 'gcn', 'hidden_dims': '[512, 256]', 'dropout': 0.45302671900623137, 'batch_norm': False, 'lr': 0.00022683099962029693, 'weight_decay': 3.230636124813673e-05, 'epochs': 159, 'loss': 'mse', 'optimizer': 'adam', 'graph_mode': 'off', 'use_snp_selection': True, 'num_snps': 14122}. Best is trial 24 with value: 0.07345968974271269.
[I 2025-11-03 11:47:49,134] Trial 86 finished with value: 0.015291128104632228 and parameters: {'model_type': 'gcn', 'hidden_dims': '[128, 64]', 'dropout': 0.5578787063493411, 'batch_norm': False, 'lr': 0.00010026384407955022, 'weight_decay': 2.2757103568555163e-05, 'epochs': 248, 'loss': 'mse', 'optimizer': 'adam', 'graph_mode': 'off', 'use_snp_selection': True, 'num_snps': 21104}. Best is trial 24 with value: 0.07345968974271269.
[I 2025-11-03 11:47:50,750] Trial 87 finished with value: 0.043218958214310176 and parameters: {'model_type': 'gcn', 'hidden_dims': '[256, 128, 64]', 'dropout': 0.4433569299934129, 'batch_norm': True, 'lr': 0.0001575520889239446, 'weight_decay': 1.4262513499127127e-05, 'epochs': 235, 'loss': 'mse', 'optimizer': 'adam', 'graph_mode': 'off', 'use_snp_selection': True, 'num_snps': 17539}. Best is trial 24 with value: 0.07345968974271269.
[I 2025-11-03 11:47:53,759] Trial 88 finished with value: 0.05677001909190335 and parameters: {'model_type': 'gcn', 'hidden_dims': '[512, 128]', 'dropout': 0.4990755915600735, 'batch_norm': False, 'lr': 0.00018304447816058116, 'weight_decay': 0.00011879102920295738, 'epochs': 294, 'loss': 'mae', 'optimizer': 'adam', 'graph_mode': 'off', 'use_snp_selection': True, 'num_snps': 50924}. Best is trial 24 with value: 0.07345968974271269.
[I 2025-11-03 11:47:55,397] Trial 89 finished with value: 0.02741150090987162 and parameters: {'model_type': 'gcn', 'hidden_dims': '[512, 256]', 'dropout': 0.47765438126956644, 'batch_norm': False, 'lr': 0.00042240827254679057, 'weight_decay': 8.366630479491424e-06, 'epochs': 144, 'loss': 'mse', 'optimizer': 'adam', 'graph_mode': 'off', 'use_snp_selection': False}. Best is trial 24 with value: 0.07345968974271269.
[I 2025-11-03 11:47:57,223] Trial 90 finished with value: 0.06373776772955483 and parameters: {'model_type': 'gcn', 'hidden_dims': '[128, 64]', 'dropout': 0.4199253954099016, 'batch_norm': True, 'lr': 0.0002820923587193233, 'weight_decay': 4.0398505139983846e-05, 'epochs': 192, 'loss': 'mse', 'optimizer': 'adam', 'graph_mode': 'off', 'use_snp_selection': True, 'num_snps': 45772}. Best is trial 24 with value: 0.07345968974271269.
[I 2025-11-03 11:47:59,073] Trial 91 finished with value: 0.02225202999443934 and parameters: {'model_type': 'gcn', 'hidden_dims': '[128, 64]', 'dropout': 0.39268199638366535, 'batch_norm': True, 'lr': 0.00014011877132753036, 'weight_decay': 3.950882466514858e-05, 'epochs': 193, 'loss': 'mse', 'optimizer': 'adam', 'graph_mode': 'off', 'use_snp_selection': True, 'num_snps': 45502}. Best is trial 24 with value: 0.07345968974271269.
[I 2025-11-03 11:48:01,148] Trial 92 finished with value: 0.03028116472257092 and parameters: {'model_type': 'gcn', 'hidden_dims': '[128, 64]', 'dropout': 0.4194545432367371, 'batch_norm': True, 'lr': 0.0002736345305313325, 'weight_decay': 8.365488315414131e-05, 'epochs': 226, 'loss': 'mse', 'optimizer': 'adam', 'graph_mode': 'off', 'use_snp_selection': True, 'num_snps': 57292}. Best is trial 24 with value: 0.07345968974271269.
[I 2025-11-03 11:48:03,134] Trial 93 finished with value: 0.04241650849498472 and parameters: {'model_type': 'gcn', 'hidden_dims': '[128, 64]', 'dropout': 0.40423258786473265, 'batch_norm': True, 'lr': 0.0005319055965504874, 'weight_decay': 4.7896959327845e-05, 'epochs': 200, 'loss': 'mse', 'optimizer': 'adam', 'graph_mode': 'off', 'use_snp_selection': True, 'num_snps': 53037}. Best is trial 24 with value: 0.07345968974271269.
[I 2025-11-03 11:48:05,291] Trial 94 finished with value: 0.06180528994074847 and parameters: {'model_type': 'gcn', 'hidden_dims': '[128, 64]', 'dropout': 0.3347817405988442, 'batch_norm': True, 'lr': 7.300504612890775e-05, 'weight_decay': 0.0008127319556170281, 'epochs': 216, 'loss': 'mse', 'optimizer': 'adam', 'graph_mode': 'off', 'use_snp_selection': True, 'num_snps': 57471}. Best is trial 24 with value: 0.07345968974271269.
[I 2025-11-03 11:48:07,341] Trial 95 finished with value: 0.06193192422549207 and parameters: {'model_type': 'gcn', 'hidden_dims': '[128, 64]', 'dropout': 0.33929577961188084, 'batch_norm': True, 'lr': 6.671883882224866e-05, 'weight_decay': 1.7222397479928714e-05, 'epochs': 216, 'loss': 'mse', 'optimizer': 'adam', 'graph_mode': 'off', 'use_snp_selection': True, 'num_snps': 55859}. Best is trial 24 with value: 0.07345968974271269.
[I 2025-11-03 11:48:09,460] Trial 96 finished with value: 0.04272168016685771 and parameters: {'model_type': 'gcn', 'hidden_dims': '[128, 64]', 'dropout': 0.33405381612525464, 'batch_norm': True, 'lr': 6.97992093282745e-05, 'weight_decay': 0.000766294658939221, 'epochs': 219, 'loss': 'mse', 'optimizer': 'adam', 'graph_mode': 'off', 'use_snp_selection': True, 'num_snps': 57451}. Best is trial 24 with value: 0.07345968974271269.
[I 2025-11-03 11:48:10,707] Trial 97 finished with value: 0.03903048509764137 and parameters: {'model_type': 'gcn', 'hidden_dims': '[128, 64]', 'dropout': 0.2974235655231897, 'batch_norm': True, 'lr': 3.563375615735809e-05, 'weight_decay': 2.6477984340520742e-05, 'epochs': 266, 'loss': 'mse', 'optimizer': 'adam', 'graph_mode': 'off', 'use_snp_selection': False}. Best is trial 24 with value: 0.07345968974271269.
[I 2025-11-03 11:48:13,003] Trial 98 finished with value: 0.06014497613770378 and parameters: {'model_type': 'gcn', 'hidden_dims': '[128, 64]', 'dropout': 0.3111347319015014, 'batch_norm': True, 'lr': 5.409604463068671e-05, 'weight_decay': 1.8992065171749874e-05, 'epochs': 345, 'loss': 'mse', 'optimizer': 'adam', 'graph_mode': 'off', 'use_snp_selection': True, 'num_snps': 51738}. Best is trial 24 with value: 0.07345968974271269.
[I 2025-11-03 11:48:14,288] Trial 99 finished with value: 0.06244012796218815 and parameters: {'model_type': 'gcn', 'hidden_dims': '[512, 128]', 'dropout': 0.32338425222899536, 'batch_norm': True, 'lr': 6.931658525007873e-05, 'weight_decay': 5.909828226451559e-05, 'epochs': 217, 'loss': 'mse', 'optimizer': 'adam', 'graph_mode': 'off', 'use_snp_selection': True, 'num_snps': 12565}. Best is trial 24 with value: 0.07345968974271269.
[I 2025-11-03 11:48:17,029] Trial 100 finished with value: 0.06758788962153611 and parameters: {'model_type': 'gcn', 'hidden_dims': '[512, 128]', 'dropout': 0.3585688034239548, 'batch_norm': True, 'lr': 4.429269875081319e-05, 'weight_decay': 6.481683878758133e-05, 'epochs': 330, 'loss': 'mse', 'optimizer': 'adam', 'graph_mode': 'off', 'use_snp_selection': False}. Best is trial 24 with value: 0.07345968974271269.
[I 2025-11-03 11:48:19,640] Trial 101 finished with value: 0.059643609645186016 and parameters: {'model_type': 'gcn', 'hidden_dims': '[512, 128]', 'dropout': 0.3574733023258112, 'batch_norm': True, 'lr': 4.089477761009051e-05, 'weight_decay': 6.835784003901874e-05, 'epochs': 303, 'loss': 'mse', 'optimizer': 'adam', 'graph_mode': 'off', 'use_snp_selection': False}. Best is trial 24 with value: 0.07345968974271269.
[I 2025-11-03 11:48:22,373] Trial 102 finished with value: 0.05257536725900854 and parameters: {'model_type': 'gcn', 'hidden_dims': '[512, 128]', 'dropout': 0.3228693319920531, 'batch_norm': True, 'lr': 4.692189868288966e-05, 'weight_decay': 0.00010854740099304563, 'epochs': 327, 'loss': 'mse', 'optimizer': 'adam', 'graph_mode': 'off', 'use_snp_selection': False}. Best is trial 24 with value: 0.07345968974271269.
[I 2025-11-03 11:48:25,060] Trial 103 finished with value: 0.049540856342156374 and parameters: {'model_type': 'gcn', 'hidden_dims': '[512, 128]', 'dropout': 0.34387317364044495, 'batch_norm': True, 'lr': 6.689090732687401e-05, 'weight_decay': 5.7896828814417084e-05, 'epochs': 320, 'loss': 'mse', 'optimizer': 'adam', 'graph_mode': 'off', 'use_snp_selection': False}. Best is trial 24 with value: 0.07345968974271269.
[I 2025-11-03 11:48:27,834] Trial 104 finished with value: 0.0583944232798462 and parameters: {'model_type': 'gcn', 'hidden_dims': '[512, 128]', 'dropout': 0.36509328769899124, 'batch_norm': True, 'lr': 1.587856668188927e-05, 'weight_decay': 4.308581016673694e-05, 'epochs': 336, 'loss': 'mse', 'optimizer': 'adam', 'graph_mode': 'off', 'use_snp_selection': False}. Best is trial 24 with value: 0.07345968974271269.
[I 2025-11-03 11:48:29,734] Trial 105 finished with value: 0.02208455083648564 and parameters: {'model_type': 'gcn', 'hidden_dims': '[512, 128]', 'dropout': 0.3748303523642463, 'batch_norm': True, 'lr': 0.00010419759323199871, 'weight_decay': 3.5208865206015684e-05, 'epochs': 185, 'loss': 'mse', 'optimizer': 'adam', 'graph_mode': 'off', 'use_snp_selection': False}. Best is trial 24 with value: 0.07345968974271269.
[I 2025-11-03 11:48:31,822] Trial 106 finished with value: 0.05835428233156939 and parameters: {'model_type': 'gcn', 'hidden_dims': '[512, 128]', 'dropout': 0.3018585115122849, 'batch_norm': True, 'lr': 3.3021263681473406e-05, 'weight_decay': 7.6081010931785e-05, 'epochs': 226, 'loss': 'mae', 'optimizer': 'adam', 'graph_mode': 'off', 'use_snp_selection': False}. Best is trial 24 with value: 0.07345968974271269.
[I 2025-11-03 11:48:33,001] Trial 107 finished with value: 0.05409935013718051 and parameters: {'model_type': 'gcn', 'hidden_dims': '[512, 128]', 'dropout': 0.317436911209924, 'batch_norm': True, 'lr': 9.849767377812688e-06, 'weight_decay': 3.000185940973797e-05, 'epochs': 203, 'loss': 'mse', 'optimizer': 'adam', 'graph_mode': 'off', 'use_snp_selection': True, 'num_snps': 10288}. Best is trial 24 with value: 0.07345968974271269.
