[I 2025-11-03 13:53:09,493] Trial 134 finished with value: 0.10572238571660399 and parameters: {'model_type': 'gcn', 'hidden_dims': '[512, 64]', 'dropout': 0.23535285753104382, 'batch_norm': True, 'lr': 0.0005246086898334621, 'weight_decay': 4.7375822666311245e-07, 'epochs': 189, 'loss': 'mse', 'optimizer': 'adam', 'graph_mode': 'off', 'use_snp_selection': False}. Best is trial 120 with value: 0.11513711209619745.
[I 2025-11-03 13:53:10,472] Trial 135 finished with value: 0.09700349740524866 and parameters: {'model_type': 'gcn', 'hidden_dims': '[512, 64]', 'dropout': 0.3036466598841201, 'batch_norm': True, 'lr': 0.0004399181188471061, 'weight_decay': 3.131274053339185e-07, 'epochs': 52, 'loss': 'mse', 'optimizer': 'adam', 'graph_mode': 'off', 'use_snp_selection': False}. Best is trial 120 with value: 0.11513711209619745.
[I 2025-11-03 13:53:12,858] Trial 136 finished with value: 0.10028470238069497 and parameters: {'model_type': 'gcn', 'hidden_dims': '[512, 64]', 'dropout': 0.36425134269800097, 'batch_norm': True, 'lr': 0.0007022017536808382, 'weight_decay': 1.1923526179921085e-06, 'epochs': 340, 'loss': 'mse', 'optimizer': 'adam', 'graph_mode': 'off', 'use_snp_selection': False}. Best is trial 120 with value: 0.11513711209619745.
[I 2025-11-03 13:53:14,478] Trial 137 finished with value: 0.08709830229167692 and parameters: {'model_type': 'gcn', 'hidden_dims': '[256, 128]', 'dropout': 0.3499692801378232, 'batch_norm': False, 'lr': 0.0009802776085877337, 'weight_decay': 1.3874797714905696e-06, 'epochs': 334, 'loss': 'mse', 'optimizer': 'adam', 'graph_mode': 'off', 'use_snp_selection': False}. Best is trial 120 with value: 0.11513711209619745.
[I 2025-11-03 13:53:16,419] Trial 138 finished with value: 0.09088378915402401 and parameters: {'model_type': 'gcn', 'hidden_dims': '[512, 64]', 'dropout': 0.3782130621508365, 'batch_norm': True, 'lr': 0.0002789647719998304, 'weight_decay': 4.007507289311521e-07, 'epochs': 251, 'loss': 'mse', 'optimizer': 'adam', 'graph_mode': 'off', 'use_snp_selection': False}. Best is trial 120 with value: 0.11513711209619745.
[I 2025-11-03 13:53:17,067] Trial 139 finished with value: 0.05611831284815594 and parameters: {'model_type': 'gcn', 'hidden_dims': '[128, 64]', 'dropout': 0.2939803565219954, 'batch_norm': True, 'lr': 5.0531120521989417e-05, 'weight_decay': 1.2864492341446376e-05, 'epochs': 63, 'loss': 'mse', 'optimizer': 'adam', 'graph_mode': 'off', 'use_snp_selection': False}. Best is trial 120 with value: 0.11513711209619745.
[I 2025-11-03 13:53:19,282] Trial 140 finished with value: 0.10078954068113478 and parameters: {'model_type': 'gcn', 'hidden_dims': '[512, 64]', 'dropout': 0.5468028390382208, 'batch_norm': True, 'lr': 0.00039281430434820344, 'weight_decay': 8.042213830470497e-06, 'epochs': 296, 'loss': 'mse', 'optimizer': 'adam', 'graph_mode': 'off', 'use_snp_selection': False}. Best is trial 120 with value: 0.11513711209619745.
[I 2025-11-03 13:53:21,373] Trial 141 finished with value: 0.10197632585858865 and parameters: {'model_type': 'gcn', 'hidden_dims': '[512, 256]', 'dropout': 0.3578532702598623, 'batch_norm': True, 'lr': 0.000582462183452342, 'weight_decay': 8.999526222975524e-07, 'epochs': 276, 'loss': 'mse', 'optimizer': 'adam', 'graph_mode': 'off', 'use_snp_selection': False}. Best is trial 120 with value: 0.11513711209619745.
[I 2025-11-03 13:53:23,813] Trial 142 finished with value: 0.1040989286771103 and parameters: {'model_type': 'gcn', 'hidden_dims': '[512, 256]', 'dropout': 0.31990480238619656, 'batch_norm': True, 'lr': 0.0004931108626588239, 'weight_decay': 1.5234651089043006e-06, 'epochs': 349, 'loss': 'mse', 'optimizer': 'adam', 'graph_mode': 'off', 'use_snp_selection': False}. Best is trial 120 with value: 0.11513711209619745.
[I 2025-11-03 13:53:24,760] Trial 143 finished with value: 0.10502335847297345 and parameters: {'model_type': 'gcn', 'hidden_dims': '[512, 256]', 'dropout': 0.33964995621162825, 'batch_norm': True, 'lr': 0.00036748654332422224, 'weight_decay': 6.176564492041106e-07, 'epochs': 49, 'loss': 'mse', 'optimizer': 'adam', 'graph_mode': 'off', 'use_snp_selection': False}. Best is trial 120 with value: 0.11513711209619745.
[I 2025-11-03 13:53:26,045] Trial 144 finished with value: 0.10098295358306793 and parameters: {'model_type': 'gcn', 'hidden_dims': '[512, 256]', 'dropout': 0.3739818382762179, 'batch_norm': True, 'lr': 0.000430772973469587, 'weight_decay': 2.512245292251901e-06, 'epochs': 117, 'loss': 'mse', 'optimizer': 'adam', 'graph_mode': 'off', 'use_snp_selection': False}. Best is trial 120 with value: 0.11513711209619745.
[I 2025-11-03 13:53:27,937] Trial 145 finished with value: 0.09078314335202656 and parameters: {'model_type': 'gcn', 'hidden_dims': '[512, 256]', 'dropout': 0.3905059846618022, 'batch_norm': True, 'lr': 0.0006685704149839362, 'weight_decay': 1.0659757900199486e-06, 'epochs': 240, 'loss': 'mse', 'optimizer': 'adam', 'graph_mode': 'off', 'use_snp_selection': False}. Best is trial 120 with value: 0.11513711209619745.
[I 2025-11-03 13:53:29,519] Trial 146 finished with value: 0.08898802863576703 and parameters: {'model_type': 'gcn', 'hidden_dims': '[256, 128, 64]', 'dropout': 0.3527841476108224, 'batch_norm': True, 'lr': 0.0008002433202042975, 'weight_decay': 7.376998159279259e-07, 'epochs': 289, 'loss': 'mse', 'optimizer': 'adam', 'graph_mode': 'off', 'use_snp_selection': True, 'num_snps': 12142}. Best is trial 120 with value: 0.11513711209619745.
[I 2025-11-03 13:53:31,529] Trial 147 finished with value: 0.10020411585727586 and parameters: {'model_type': 'gcn', 'hidden_dims': '[512, 64]', 'dropout': 0.4090203464823269, 'batch_norm': True, 'lr': 0.0005851988475322201, 'weight_decay': 1.7073570850086802e-06, 'epochs': 260, 'loss': 'mse', 'optimizer': 'adam', 'graph_mode': 'off', 'use_snp_selection': False}. Best is trial 120 with value: 0.11513711209619745.
[I 2025-11-03 13:53:33,736] Trial 148 finished with value: 0.11566181011093508 and parameters: {'model_type': 'gcn', 'hidden_dims': '[512, 64]', 'dropout': 0.33109560994787823, 'batch_norm': True, 'lr': 0.0005128660993729225, 'weight_decay': 1.2249988723212121e-06, 'epochs': 302, 'loss': 'mse', 'optimizer': 'adam', 'graph_mode': 'off', 'use_snp_selection': False}. Best is trial 148 with value: 0.11566181011093508.
[I 2025-11-03 13:53:35,986] Trial 149 finished with value: 0.09171262425154607 and parameters: {'model_type': 'gcn', 'hidden_dims': '[512, 64]', 'dropout': 0.3247961795499429, 'batch_norm': True, 'lr': 0.0008510946226015116, 'weight_decay': 5.110881578319381e-07, 'epochs': 306, 'loss': 'mae', 'optimizer': 'adam', 'graph_mode': 'off', 'use_snp_selection': False}. Best is trial 148 with value: 0.11566181011093508.
[I 2025-11-03 13:53:38,021] Trial 0 finished with value: 0.0269427842033118 and parameters: {'model_type': 'gcn', 'hidden_dims': '[128, 64]', 'dropout': 0.199031432379812, 'batch_norm': True, 'lr': 1.8408544111075837e-06, 'weight_decay': 5.5136510071208614e-05, 'epochs': 336, 'loss': 'mae', 'optimizer': 'adam', 'graph_mode': 'off', 'use_snp_selection': True, 'num_snps': 43862}. Best is trial 0 with value: 0.0269427842033118.
[I 2025-11-03 13:53:39,407] Trial 1 finished with value: 0.06511810615303149 and parameters: {'model_type': 'gcn', 'hidden_dims': '[256, 128]', 'dropout': 0.4370668075331726, 'batch_norm': True, 'lr': 7.133471581159139e-05, 'weight_decay': 1.128633586803549e-05, 'epochs': 242, 'loss': 'mae', 'optimizer': 'adam', 'graph_mode': 'off', 'use_snp_selection': False}. Best is trial 1 with value: 0.06511810615303149.
[I 2025-11-03 13:53:40,444] Trial 2 finished with value: 0.020892851141369524 and parameters: {'model_type': 'gcn', 'hidden_dims': '[256, 128, 64]', 'dropout': 0.41314357415569625, 'batch_norm': False, 'lr': 3.952233718592101e-06, 'weight_decay': 0.00026754769258252603, 'epochs': 149, 'loss': 'mse', 'optimizer': 'adam', 'graph_mode': 'off', 'use_snp_selection': True, 'num_snps': 11571}. Best is trial 1 with value: 0.06511810615303149.
[I 2025-11-03 13:53:42,751] Trial 3 finished with value: 0.0065470736884879815 and parameters: {'model_type': 'gcn', 'hidden_dims': '[512, 64]', 'dropout': 0.5938127374509361, 'batch_norm': False, 'lr': 5.67704586114731e-06, 'weight_decay': 2.4518087630137052e-05, 'epochs': 320, 'loss': 'mae', 'optimizer': 'adam', 'graph_mode': 'off', 'use_snp_selection': False}. Best is trial 1 with value: 0.06511810615303149.
[I 2025-11-03 13:53:44,910] Trial 4 finished with value: 0.028538467487760653 and parameters: {'model_type': 'gcn', 'hidden_dims': '[512, 128]', 'dropout': 0.25746343592134413, 'batch_norm': True, 'lr': 1.3467657668402788e-06, 'weight_decay': 0.00033087251918647806, 'epochs': 277, 'loss': 'mse', 'optimizer': 'adam', 'graph_mode': 'off', 'use_snp_selection': True, 'num_snps': 36675}. Best is trial 1 with value: 0.06511810615303149.
[I 2025-11-03 13:53:46,438] Trial 5 finished with value: 0.02180353660203945 and parameters: {'model_type': 'gcn', 'hidden_dims': '[512, 64]', 'dropout': 0.38275350994408375, 'batch_norm': True, 'lr': 1.5586664309232824e-06, 'weight_decay': 0.0008227664668621182, 'epochs': 145, 'loss': 'mae', 'optimizer': 'adam', 'graph_mode': 'off', 'use_snp_selection': True, 'num_snps': 32148}. Best is trial 1 with value: 0.06511810615303149.
[I 2025-11-03 13:53:47,653] Trial 6 finished with value: 0.07880801334778773 and parameters: {'model_type': 'gcn', 'hidden_dims': '[256, 128]', 'dropout': 0.3930109900265879, 'batch_norm': False, 'lr': 4.892964372128395e-05, 'weight_decay': 1.5809549317992182e-06, 'epochs': 199, 'loss': 'mse', 'optimizer': 'adam', 'graph_mode': 'off', 'use_snp_selection': False}. Best is trial 6 with value: 0.07880801334778773.
[I 2025-11-03 13:53:48,896] Trial 7 finished with value: 0.06120649494644814 and parameters: {'model_type': 'gcn', 'hidden_dims': '[512, 256]', 'dropout': 0.15343979219678458, 'batch_norm': True, 'lr': 6.234003099047341e-05, 'weight_decay': 3.894760610535477e-07, 'epochs': 97, 'loss': 'mse', 'optimizer': 'adam', 'graph_mode': 'off', 'use_snp_selection': False}. Best is trial 6 with value: 0.07880801334778773.
[I 2025-11-03 13:53:51,190] Trial 8 finished with value: 0.06781068894167758 and parameters: {'model_type': 'gcn', 'hidden_dims': '[512, 128]', 'dropout': 0.10743001231661406, 'batch_norm': True, 'lr': 0.00023728538449271062, 'weight_decay': 1.7629071578048637e-05, 'epochs': 312, 'loss': 'mae', 'optimizer': 'adam', 'graph_mode': 'off', 'use_snp_selection': False}. Best is trial 6 with value: 0.07880801334778773.
[I 2025-11-03 13:53:52,814] Trial 9 finished with value: 0.04770072649419091 and parameters: {'model_type': 'gcn', 'hidden_dims': '[512, 64]', 'dropout': 0.14505336736221927, 'batch_norm': True, 'lr': 5.8619638388111826e-05, 'weight_decay': 6.200156172669308e-07, 'epochs': 175, 'loss': 'mse', 'optimizer': 'adam', 'graph_mode': 'off', 'use_snp_selection': False}. Best is trial 6 with value: 0.07880801334778773.
[I 2025-11-03 13:53:53,575] Trial 10 finished with value: 0.015484932757538736 and parameters: {'model_type': 'gcn', 'hidden_dims': '[256, 128]', 'dropout': 0.5267360651501256, 'batch_norm': False, 'lr': 0.00032393778075602147, 'weight_decay': 1.936962886850364e-06, 'epochs': 46, 'loss': 'mse', 'optimizer': 'adam', 'graph_mode': 'off', 'use_snp_selection': False}. Best is trial 6 with value: 0.07880801334778773.
[I 2025-11-03 13:53:55,439] Trial 11 finished with value: 0.015242520396449112 and parameters: {'model_type': 'gcn', 'hidden_dims': '[512, 128]', 'dropout': 0.30438831352760154, 'batch_norm': False, 'lr': 0.0007666984023899754, 'weight_decay': 2.512571353186099e-06, 'epochs': 239, 'loss': 'mae', 'optimizer': 'adam', 'graph_mode': 'off', 'use_snp_selection': False}. Best is trial 6 with value: 0.07880801334778773.
[I 2025-11-03 13:53:57,279] Trial 12 finished with value: 0.029785052004265414 and parameters: {'model_type': 'gcn', 'hidden_dims': '[512, 128]', 'dropout': 0.4779690972965961, 'batch_norm': False, 'lr': 0.00026576228959612443, 'weight_decay': 1.3081036432574914e-07, 'epochs': 235, 'loss': 'mae', 'optimizer': 'adam', 'graph_mode': 'off', 'use_snp_selection': False}. Best is trial 6 with value: 0.07880801334778773.
[I 2025-11-03 13:53:58,738] Trial 13 finished with value: 0.044404060779277166 and parameters: {'model_type': 'gcn', 'hidden_dims': '[256, 128]', 'dropout': 0.3136384318677553, 'batch_norm': False, 'lr': 1.581618310073141e-05, 'weight_decay': 4.380057356309532e-06, 'epochs': 285, 'loss': 'mse', 'optimizer': 'adam', 'graph_mode': 'off', 'use_snp_selection': False}. Best is trial 6 with value: 0.07880801334778773.
[I 2025-11-03 13:53:59,750] Trial 14 finished with value: 0.040719200685584225 and parameters: {'model_type': 'gcn', 'hidden_dims': '[128, 64]', 'dropout': 0.2386468568583971, 'batch_norm': True, 'lr': 0.00017558188744418174, 'weight_decay': 5.472340527804409e-05, 'epochs': 203, 'loss': 'mse', 'optimizer': 'adam', 'graph_mode': 'off', 'use_snp_selection': False}. Best is trial 6 with value: 0.07880801334778773.
[I 2025-11-03 13:54:01,500] Trial 15 finished with value: -0.04648825360935286 and parameters: {'model_type': 'gcn', 'hidden_dims': '[256, 128, 64]', 'dropout': 0.36434762352660965, 'batch_norm': False, 'lr': 1.6267534889505977e-05, 'weight_decay': 7.236536090132001e-06, 'epochs': 298, 'loss': 'mae', 'optimizer': 'adam', 'graph_mode': 'off', 'use_snp_selection': False}. Best is trial 6 with value: 0.07880801334778773.
[I 2025-11-03 13:54:03,986] Trial 16 finished with value: 0.07072625783132963 and parameters: {'model_type': 'gcn', 'hidden_dims': '[512, 256]', 'dropout': 0.12064802936228951, 'batch_norm': True, 'lr': 0.0007079443589762948, 'weight_decay': 1.0704088371086755e-06, 'epochs': 348, 'loss': 'mae', 'optimizer': 'adam', 'graph_mode': 'off', 'use_snp_selection': False}. Best is trial 6 with value: 0.07880801334778773.
[I 2025-11-03 13:54:06,379] Trial 17 finished with value: -0.023103008143147415 and parameters: {'model_type': 'gcn', 'hidden_dims': '[512, 256]', 'dropout': 0.31226206234945486, 'batch_norm': False, 'lr': 0.000906375209920231, 'weight_decay': 8.283981469502681e-07, 'epochs': 350, 'loss': 'mse', 'optimizer': 'adam', 'graph_mode': 'off', 'use_snp_selection': False}. Best is trial 6 with value: 0.07880801334778773.
[I 2025-11-03 13:54:08,247] Trial 18 finished with value: 0.009145774492559332 and parameters: {'model_type': 'gcn', 'hidden_dims': '[512, 256]', 'dropout': 0.4838829734439946, 'batch_norm': False, 'lr': 2.357070669596173e-05, 'weight_decay': 2.427593612355222e-07, 'epochs': 61, 'loss': 'mae', 'optimizer': 'adam', 'graph_mode': 'off', 'use_snp_selection': True, 'num_snps': 58241}. Best is trial 6 with value: 0.07880801334778773.
[I 2025-11-03 13:54:09,236] Trial 19 finished with value: 0.035882289952738886 and parameters: {'model_type': 'gcn', 'hidden_dims': '[256, 128]', 'dropout': 0.23740597688310255, 'batch_norm': True, 'lr': 0.00013223805819867514, 'weight_decay': 1.6896891039813104e-06, 'epochs': 119, 'loss': 'mse', 'optimizer': 'adam', 'graph_mode': 'off', 'use_snp_selection': False}. Best is trial 6 with value: 0.07880801334778773.
[I 2025-11-03 13:54:11,023] Trial 20 finished with value: 0.01569504813253715 and parameters: {'model_type': 'gcn', 'hidden_dims': '[512, 256]', 'dropout': 0.5695462196468178, 'batch_norm': False, 'lr': 0.0004916486726276557, 'weight_decay': 9.708981427032704e-07, 'epochs': 207, 'loss': 'mse', 'optimizer': 'adam', 'graph_mode': 'off', 'use_snp_selection': False}. Best is trial 6 with value: 0.07880801334778773.
[I 2025-11-03 13:54:13,300] Trial 21 finished with value: 0.04865050846844134 and parameters: {'model_type': 'gcn', 'hidden_dims': '[512, 128]', 'dropout': 0.10287612838937642, 'batch_norm': True, 'lr': 0.00011467620668229786, 'weight_decay': 1.5685969505030866e-05, 'epochs': 312, 'loss': 'mae', 'optimizer': 'adam', 'graph_mode': 'off', 'use_snp_selection': False}. Best is trial 6 with value: 0.07880801334778773.
[I 2025-11-03 13:54:15,278] Trial 22 finished with value: 0.07608411882098748 and parameters: {'model_type': 'gcn', 'hidden_dims': '[512, 128]', 'dropout': 0.11008055662681301, 'batch_norm': True, 'lr': 0.0004169593465846234, 'weight_decay': 4.165790493143951e-06, 'epochs': 253, 'loss': 'mae', 'optimizer': 'adam', 'graph_mode': 'off', 'use_snp_selection': False}. Best is trial 6 with value: 0.07880801334778773.
[I 2025-11-03 13:54:17,324] Trial 23 finished with value: 0.06511651654661586 and parameters: {'model_type': 'gcn', 'hidden_dims': '[512, 256]', 'dropout': 0.17700275993539785, 'batch_norm': True, 'lr': 0.00042664642674276524, 'weight_decay': 4.248114829406161e-06, 'epochs': 258, 'loss': 'mae', 'optimizer': 'adam', 'graph_mode': 'off', 'use_snp_selection': False}. Best is trial 6 with value: 0.07880801334778773.
[I 2025-11-03 13:54:18,497] Trial 24 finished with value: 0.06199921416957183 and parameters: {'model_type': 'gcn', 'hidden_dims': '[256, 128]', 'dropout': 0.12932822753058773, 'batch_norm': True, 'lr': 0.0005957169779499929, 'weight_decay': 2.5130256486824807e-07, 'epochs': 186, 'loss': 'mae', 'optimizer': 'adam', 'graph_mode': 'off', 'use_snp_selection': False}. Best is trial 6 with value: 0.07880801334778773.
[I 2025-11-03 13:54:20,175] Trial 25 finished with value: 0.0637120453806494 and parameters: {'model_type': 'gcn', 'hidden_dims': '[256, 128, 64]', 'dropout': 0.20259942526017038, 'batch_norm': True, 'lr': 3.691510480064806e-05, 'weight_decay': 3.817320030500515e-06, 'epochs': 265, 'loss': 'mae', 'optimizer': 'adam', 'graph_mode': 'off', 'use_snp_selection': False}. Best is trial 6 with value: 0.07880801334778773.
[I 2025-11-03 13:54:21,003] Trial 26 finished with value: 0.01464663074825402 and parameters: {'model_type': 'gcn', 'hidden_dims': '[128, 64]', 'dropout': 0.28083895761626665, 'batch_norm': True, 'lr': 1.0420456008582359e-05, 'weight_decay': 1.2336479971468375e-06, 'epochs': 162, 'loss': 'mae', 'optimizer': 'adam', 'graph_mode': 'off', 'use_snp_selection': True, 'num_snps': 3842}. Best is trial 6 with value: 0.07880801334778773.
[I 2025-11-03 13:54:22,820] Trial 27 finished with value: 0.06680879700902478 and parameters: {'model_type': 'gcn', 'hidden_dims': '[512, 256]', 'dropout': 0.42848663036549467, 'batch_norm': True, 'lr': 0.0009508960436883683, 'weight_decay': 5.011063717672031e-07, 'epochs': 215, 'loss': 'mae', 'optimizer': 'adam', 'graph_mode': 'off', 'use_snp_selection': False}. Best is trial 6 with value: 0.07880801334778773.
[I 2025-11-03 13:54:24,103] Trial 28 finished with value: 0.021905242910933695 and parameters: {'model_type': 'gcn', 'hidden_dims': '[256, 128]', 'dropout': 0.19619381716213843, 'batch_norm': False, 'lr': 0.00010930515921328497, 'weight_decay': 1.0026867207276766e-07, 'epochs': 228, 'loss': 'mse', 'optimizer': 'adam', 'graph_mode': 'off', 'use_snp_selection': False}. Best is trial 6 with value: 0.07880801334778773.
[I 2025-11-03 13:54:25,649] Trial 29 finished with value: -0.007091686212110764 and parameters: {'model_type': 'gcn', 'hidden_dims': '[128, 64]', 'dropout': 0.3426494374114982, 'batch_norm': True, 'lr': 2.8966762461994946e-06, 'weight_decay': 3.8339287981989784e-05, 'epochs': 340, 'loss': 'mae', 'optimizer': 'adam', 'graph_mode': 'off', 'use_snp_selection': True, 'num_snps': 19468}. Best is trial 6 with value: 0.07880801334778773.
[I 2025-11-03 13:54:26,925] Trial 30 finished with value: 0.04711583975887843 and parameters: {'model_type': 'gcn', 'hidden_dims': '[512, 128]', 'dropout': 0.1643682238690179, 'batch_norm': True, 'lr': 0.00036625687188655853, 'weight_decay': 6.3175895207505055e-06, 'epochs': 113, 'loss': 'mae', 'optimizer': 'adam', 'graph_mode': 'off', 'use_snp_selection': False}. Best is trial 6 with value: 0.07880801334778773.
[I 2025-11-03 13:54:29,227] Trial 31 finished with value: 0.04919504911485331 and parameters: {'model_type': 'gcn', 'hidden_dims': '[512, 128]', 'dropout': 0.10131407579169126, 'batch_norm': True, 'lr': 0.00020306859190468636, 'weight_decay': 2.1697970162256072e-05, 'epochs': 317, 'loss': 'mae', 'optimizer': 'adam', 'graph_mode': 'off', 'use_snp_selection': False}. Best is trial 6 with value: 0.07880801334778773.
[I 2025-11-03 13:54:31,428] Trial 32 finished with value: 0.05700053666397478 and parameters: {'model_type': 'gcn', 'hidden_dims': '[512, 128]', 'dropout': 0.122364368905237, 'batch_norm': True, 'lr': 0.00023734716787016108, 'weight_decay': 9.951350417535434e-06, 'epochs': 296, 'loss': 'mae', 'optimizer': 'adam', 'graph_mode': 'off', 'use_snp_selection': False}. Best is trial 6 with value: 0.07880801334778773.
[I 2025-11-03 13:54:33,798] Trial 33 finished with value: 0.06742001247422548 and parameters: {'model_type': 'gcn', 'hidden_dims': '[512, 128]', 'dropout': 0.21186312325604695, 'batch_norm': True, 'lr': 0.0005879461033546061, 'weight_decay': 9.084152589024884e-05, 'epochs': 328, 'loss': 'mae', 'optimizer': 'adam', 'graph_mode': 'off', 'use_snp_selection': False}. Best is trial 6 with value: 0.07880801334778773.
[I 2025-11-03 13:54:35,798] Trial 34 finished with value: 0.0517925772011414 and parameters: {'model_type': 'gcn', 'hidden_dims': '[512, 128]', 'dropout': 0.13075951866527052, 'batch_norm': True, 'lr': 8.75528634084696e-05, 'weight_decay': 1.143626544018692e-05, 'epochs': 254, 'loss': 'mae', 'optimizer': 'adam', 'graph_mode': 'off', 'use_snp_selection': False}. Best is trial 6 with value: 0.07880801334778773.
[I 2025-11-03 13:54:37,387] Trial 35 finished with value: 0.023734056249489995 and parameters: {'model_type': 'gcn', 'hidden_dims': '[256, 128]', 'dropout': 0.17714778735932457, 'batch_norm': True, 'lr': 4.606765526908114e-05, 'weight_decay': 2.6256996528892102e-06, 'epochs': 305, 'loss': 'mae', 'optimizer': 'adam', 'graph_mode': 'off', 'use_snp_selection': False}. Best is trial 6 with value: 0.07880801334778773.
