[I 2025-11-03 15:58:33,909] Trial 36 finished with value: 0.1615479996828858 and parameters: {'model_type': 'graphsage', 'hidden_dims': '[256, 128, 64]', 'dropout': 0.42889344082648484, 'batch_norm': True, 'lr': 0.0004121156031674948, 'weight_decay': 8.452599641094045e-07, 'epochs': 225, 'loss': 'mse', 'optimizer': 'adam', 'graph_mode': 'knn', 'source': 'grm', 'knn_k': 9, 'weighted_edges': True, 'symmetrize_mode': 'union', 'use_snp_selection': False}. Best is trial 1 with value: 0.17738091980546125.
[I 2025-11-03 15:58:36,583] Trial 37 finished with value: 0.12935804744228802 and parameters: {'model_type': 'graphsage', 'hidden_dims': '[128, 64]', 'dropout': 0.5516623747417227, 'batch_norm': True, 'lr': 0.0006751775907662531, 'weight_decay': 5.991948774976363e-06, 'epochs': 187, 'loss': 'mse', 'optimizer': 'adam', 'graph_mode': 'cutoff', 'cutoff': 0.875471069470994, 'grm_norm': 'cosine_then_gcn', 'self_loops': True, 'use_snp_selection': False}. Best is trial 1 with value: 0.17738091980546125.
[I 2025-11-03 15:58:49,100] Trial 38 finished with value: 0.15773464959462555 and parameters: {'model_type': 'graphsage', 'hidden_dims': '[512, 256]', 'dropout': 0.34198559038096665, 'batch_norm': False, 'lr': 4.168155772944075e-05, 'weight_decay': 1.4522403746866532e-05, 'epochs': 249, 'loss': 'mse', 'optimizer': 'adam', 'graph_mode': 'knn', 'source': 'grm', 'knn_k': 7, 'weighted_edges': True, 'symmetrize_mode': 'mutual', 'use_snp_selection': True, 'num_snps': 58508}. Best is trial 1 with value: 0.17738091980546125.
[I 2025-11-03 15:58:53,700] Trial 39 finished with value: 0.159183318760551 and parameters: {'model_type': 'graphsage', 'hidden_dims': '[256, 128]', 'dropout': 0.27756118622095033, 'batch_norm': True, 'lr': 0.00038609016685617006, 'weight_decay': 0.0008356601475880457, 'epochs': 170, 'loss': 'mae', 'optimizer': 'adam', 'graph_mode': 'cutoff', 'cutoff': 0.42608840590814967, 'grm_norm': 'none', 'self_loops': True, 'use_snp_selection': False}. Best is trial 1 with value: 0.17738091980546125.
[I 2025-11-03 15:59:01,851] Trial 40 finished with value: 0.1364256156332295 and parameters: {'model_type': 'graphsage', 'hidden_dims': '[512, 128]', 'dropout': 0.5356840386827548, 'batch_norm': False, 'lr': 7.628895094406047e-05, 'weight_decay': 1.7996338803235138e-07, 'epochs': 137, 'loss': 'mse', 'optimizer': 'adam', 'graph_mode': 'knn', 'source': 'grm', 'knn_k': 8, 'weighted_edges': True, 'symmetrize_mode': 'union', 'use_snp_selection': True, 'num_snps': 42724}. Best is trial 1 with value: 0.17738091980546125.
[I 2025-11-03 15:59:12,481] Trial 41 finished with value: 0.16263315860479466 and parameters: {'model_type': 'graphsage', 'hidden_dims': '[512, 64]', 'dropout': 0.3717827674469679, 'batch_norm': True, 'lr': 0.0005298671319328324, 'weight_decay': 2.404350157896033e-05, 'epochs': 230, 'loss': 'mse', 'optimizer': 'adam', 'graph_mode': 'knn', 'source': 'grm', 'knn_k': 7, 'weighted_edges': True, 'symmetrize_mode': 'union', 'use_snp_selection': False}. Best is trial 1 with value: 0.17738091980546125.
[I 2025-11-03 15:59:21,634] Trial 42 finished with value: 0.17251050438183896 and parameters: {'model_type': 'graphsage', 'hidden_dims': '[512, 64]', 'dropout': 0.309106607021394, 'batch_norm': True, 'lr': 0.000717001262674225, 'weight_decay': 1.927551459342875e-07, 'epochs': 202, 'loss': 'mse', 'optimizer': 'adam', 'graph_mode': 'knn', 'source': 'grm', 'knn_k': 6, 'weighted_edges': True, 'symmetrize_mode': 'union', 'use_snp_selection': False}. Best is trial 1 with value: 0.17738091980546125.
[I 2025-11-03 15:59:30,822] Trial 43 finished with value: 0.16892090063518278 and parameters: {'model_type': 'graphsage', 'hidden_dims': '[512, 64]', 'dropout': 0.3172476771701427, 'batch_norm': True, 'lr': 0.0007931524486652559, 'weight_decay': 2.6256835430286003e-07, 'epochs': 201, 'loss': 'mse', 'optimizer': 'adam', 'graph_mode': 'knn', 'source': 'grm', 'knn_k': 6, 'weighted_edges': False, 'symmetrize_mode': 'union', 'use_snp_selection': False}. Best is trial 1 with value: 0.17738091980546125.
[I 2025-11-03 15:59:42,243] Trial 44 finished with value: 0.1760015425715974 and parameters: {'model_type': 'graphsage', 'hidden_dims': '[512, 64]', 'dropout': 0.41822889824085757, 'batch_norm': True, 'lr': 0.00027454920152338974, 'weight_decay': 1.082379144495811e-06, 'epochs': 311, 'loss': 'mse', 'optimizer': 'adam', 'graph_mode': 'knn', 'source': 'grm', 'knn_k': 6, 'weighted_edges': True, 'symmetrize_mode': 'mutual', 'use_snp_selection': False}. Best is trial 1 with value: 0.17738091980546125.
[I 2025-11-03 15:59:53,141] Trial 45 finished with value: 0.14948974807911167 and parameters: {'model_type': 'graphsage', 'hidden_dims': '[512, 64]', 'dropout': 0.42128429245841337, 'batch_norm': True, 'lr': 0.00012242881987680265, 'weight_decay': 2.4578621901372465e-06, 'epochs': 348, 'loss': 'mse', 'optimizer': 'adam', 'graph_mode': 'knn', 'source': 'grm', 'knn_k': 1, 'weighted_edges': True, 'symmetrize_mode': 'mutual', 'use_snp_selection': False}. Best is trial 1 with value: 0.17738091980546125.
[I 2025-11-03 16:00:04,410] Trial 46 finished with value: 0.17473477113696392 and parameters: {'model_type': 'graphsage', 'hidden_dims': '[512, 256]', 'dropout': 0.45384513325886294, 'batch_norm': True, 'lr': 0.00030619042173221455, 'weight_decay': 1.0686768151020163e-06, 'epochs': 315, 'loss': 'mae', 'optimizer': 'adam', 'graph_mode': 'knn', 'source': 'grm', 'knn_k': 5, 'weighted_edges': True, 'symmetrize_mode': 'mutual', 'use_snp_selection': False}. Best is trial 1 with value: 0.17738091980546125.
[I 2025-11-03 16:00:18,974] Trial 47 finished with value: 0.1726731423462855 and parameters: {'model_type': 'graphsage', 'hidden_dims': '[512, 256]', 'dropout': 0.46500479754397367, 'batch_norm': True, 'lr': 0.00028460436323427343, 'weight_decay': 1.0891594666869535e-06, 'epochs': 321, 'loss': 'mae', 'optimizer': 'adam', 'graph_mode': 'cutoff', 'cutoff': 0.2303079448894761, 'grm_norm': 'cosine_then_gcn', 'self_loops': False, 'use_snp_selection': False}. Best is trial 1 with value: 0.17738091980546125.
[I 2025-11-03 16:00:30,203] Trial 48 finished with value: 0.18074188677385775 and parameters: {'model_type': 'graphsage', 'hidden_dims': '[512, 256]', 'dropout': 0.5068798637466051, 'batch_norm': True, 'lr': 0.00042971926409808353, 'weight_decay': 2.165850859629439e-06, 'epochs': 315, 'loss': 'mae', 'optimizer': 'adam', 'graph_mode': 'knn', 'source': 'grm', 'knn_k': 5, 'weighted_edges': False, 'symmetrize_mode': 'mutual', 'use_snp_selection': False}. Best is trial 48 with value: 0.18074188677385775.
[I 2025-11-03 16:00:40,098] Trial 49 finished with value: 0.1640048492122213 and parameters: {'model_type': 'graphsage', 'hidden_dims': '[512, 256]', 'dropout': 0.48732253511657114, 'batch_norm': True, 'lr': 0.0004963974556306713, 'weight_decay': 2.8401796161734297e-06, 'epochs': 275, 'loss': 'mae', 'optimizer': 'adam', 'graph_mode': 'knn', 'source': 'grm', 'knn_k': 4, 'weighted_edges': False, 'symmetrize_mode': 'mutual', 'use_snp_selection': False}. Best is trial 48 with value: 0.18074188677385775.
[I 2025-11-03 16:00:44,262] Trial 50 finished with value: 0.160927068536157 and parameters: {'model_type': 'graphsage', 'hidden_dims': '[128, 64]', 'dropout': 0.5997622171138433, 'batch_norm': True, 'lr': 0.00015711470689621553, 'weight_decay': 6.393693191201583e-06, 'epochs': 307, 'loss': 'mae', 'optimizer': 'adam', 'graph_mode': 'knn', 'source': 'grm', 'knn_k': 2, 'weighted_edges': False, 'symmetrize_mode': 'mutual', 'use_snp_selection': False}. Best is trial 48 with value: 0.18074188677385775.
[I 2025-11-03 16:00:55,811] Trial 51 finished with value: 0.17077487268895344 and parameters: {'model_type': 'graphsage', 'hidden_dims': '[512, 256]', 'dropout': 0.44791147796118974, 'batch_norm': True, 'lr': 0.0002613231698361083, 'weight_decay': 5.759906951686454e-07, 'epochs': 326, 'loss': 'mae', 'optimizer': 'adam', 'graph_mode': 'knn', 'source': 'grm', 'knn_k': 5, 'weighted_edges': False, 'symmetrize_mode': 'mutual', 'use_snp_selection': False}. Best is trial 48 with value: 0.18074188677385775.
[I 2025-11-03 16:01:06,738] Trial 52 finished with value: 0.17559628548495101 and parameters: {'model_type': 'graphsage', 'hidden_dims': '[512, 256]', 'dropout': 0.5092654202570914, 'batch_norm': True, 'lr': 0.0003700731041584676, 'weight_decay': 1.2676673579834068e-06, 'epochs': 302, 'loss': 'mae', 'optimizer': 'adam', 'graph_mode': 'knn', 'source': 'grm', 'knn_k': 5, 'weighted_edges': False, 'symmetrize_mode': 'mutual', 'use_snp_selection': False}. Best is trial 48 with value: 0.18074188677385775.
[I 2025-11-03 16:01:17,443] Trial 53 finished with value: 0.1649594980218898 and parameters: {'model_type': 'graphsage', 'hidden_dims': '[512, 256]', 'dropout': 0.5273579241745686, 'batch_norm': True, 'lr': 0.00044037914087443285, 'weight_decay': 1.7563141273238136e-06, 'epochs': 286, 'loss': 'mae', 'optimizer': 'adam', 'graph_mode': 'knn', 'source': 'grm', 'knn_k': 6, 'weighted_edges': False, 'symmetrize_mode': 'mutual', 'use_snp_selection': False}. Best is trial 48 with value: 0.18074188677385775.
[I 2025-11-03 16:01:29,028] Trial 54 finished with value: 0.1587528093443005 and parameters: {'model_type': 'graphsage', 'hidden_dims': '[512, 256]', 'dropout': 0.5120274597932946, 'batch_norm': True, 'lr': 0.0007982049506780542, 'weight_decay': 1.179242511466908e-06, 'epochs': 335, 'loss': 'mae', 'optimizer': 'adam', 'graph_mode': 'knn', 'source': 'grm', 'knn_k': 4, 'weighted_edges': False, 'symmetrize_mode': 'mutual', 'use_snp_selection': False}. Best is trial 48 with value: 0.18074188677385775.
[I 2025-11-03 16:01:39,751] Trial 55 finished with value: 0.17197890026338541 and parameters: {'model_type': 'graphsage', 'hidden_dims': '[512, 256]', 'dropout': 0.5682646150612471, 'batch_norm': True, 'lr': 0.0003724010851255898, 'weight_decay': 3.969872377747604e-06, 'epochs': 296, 'loss': 'mae', 'optimizer': 'adam', 'graph_mode': 'knn', 'source': 'grm', 'knn_k': 5, 'weighted_edges': False, 'symmetrize_mode': 'mutual', 'use_snp_selection': False}. Best is trial 48 with value: 0.18074188677385775.
[I 2025-11-03 16:01:52,354] Trial 56 finished with value: 0.16092698141710546 and parameters: {'model_type': 'graphsage', 'hidden_dims': '[512, 256]', 'dropout': 0.488077655550124, 'batch_norm': True, 'lr': 0.0005832382241488165, 'weight_decay': 3.7442779821032125e-07, 'epochs': 348, 'loss': 'mae', 'optimizer': 'adam', 'graph_mode': 'knn', 'source': 'grm', 'knn_k': 6, 'weighted_edges': False, 'symmetrize_mode': 'mutual', 'use_snp_selection': False}. Best is trial 48 with value: 0.18074188677385775.
[I 2025-11-03 16:01:54,733] Trial 57 finished with value: 0.10270752906108266 and parameters: {'model_type': 'graphsage', 'hidden_dims': '[256, 128, 64]', 'dropout': 0.5692091186213347, 'batch_norm': True, 'lr': 0.00018779694401670007, 'weight_decay': 1.1367690157630321e-05, 'epochs': 57, 'loss': 'mae', 'optimizer': 'adam', 'graph_mode': 'knn', 'source': 'grm', 'knn_k': 3, 'weighted_edges': False, 'symmetrize_mode': 'mutual', 'use_snp_selection': False}. Best is trial 48 with value: 0.18074188677385775.
[I 2025-11-03 16:01:57,689] Trial 58 finished with value: 0.0865513227890181 and parameters: {'model_type': 'graphsage', 'hidden_dims': '[128, 64]', 'dropout': 0.38399864428546654, 'batch_norm': False, 'lr': 1.9532467582638195e-05, 'weight_decay': 1.7411846918032848e-06, 'epochs': 306, 'loss': 'mae', 'optimizer': 'adam', 'graph_mode': 'knn', 'source': 'grm', 'knn_k': 1, 'weighted_edges': False, 'symmetrize_mode': 'mutual', 'use_snp_selection': True, 'num_snps': 4043}. Best is trial 48 with value: 0.18074188677385775.
[I 2025-11-03 16:02:07,326] Trial 59 finished with value: 0.07337807437679371 and parameters: {'model_type': 'graphsage', 'hidden_dims': '[512, 128]', 'dropout': 0.41711970961432204, 'batch_norm': True, 'lr': 3.870732125925166e-06, 'weight_decay': 6.28260553558329e-06, 'epochs': 268, 'loss': 'mae', 'optimizer': 'adam', 'graph_mode': 'knn', 'source': 'grm', 'knn_k': 4, 'weighted_edges': False, 'symmetrize_mode': 'mutual', 'use_snp_selection': False}. Best is trial 48 with value: 0.18074188677385775.
[I 2025-11-03 16:02:16,483] Trial 60 finished with value: 0.1626758012173494 and parameters: {'model_type': 'graphsage', 'hidden_dims': '[512, 256]', 'dropout': 0.5088113412139854, 'batch_norm': True, 'lr': 0.00033472265384089107, 'weight_decay': 6.530031859899603e-07, 'epochs': 286, 'loss': 'mae', 'optimizer': 'adam', 'graph_mode': 'cutoff', 'cutoff': 0.7480090567569319, 'grm_norm': 'gcn', 'self_loops': False, 'use_snp_selection': False}. Best is trial 48 with value: 0.18074188677385775.
[I 2025-11-03 16:02:27,736] Trial 61 finished with value: 0.16419426291940165 and parameters: {'model_type': 'graphsage', 'hidden_dims': '[512, 256]', 'dropout': 0.453093623013481, 'batch_norm': True, 'lr': 0.0003138840597736353, 'weight_decay': 1.064379838891821e-06, 'epochs': 313, 'loss': 'mae', 'optimizer': 'adam', 'graph_mode': 'knn', 'source': 'grm', 'knn_k': 5, 'weighted_edges': True, 'symmetrize_mode': 'mutual', 'use_snp_selection': False}. Best is trial 48 with value: 0.18074188677385775.
[I 2025-11-03 16:02:38,510] Trial 62 finished with value: 0.16610768074985283 and parameters: {'model_type': 'graphsage', 'hidden_dims': '[512, 256]', 'dropout': 0.4741497490585544, 'batch_norm': True, 'lr': 0.0002698001222141923, 'weight_decay': 2.4138941977109024e-06, 'epochs': 298, 'loss': 'mae', 'optimizer': 'adam', 'graph_mode': 'knn', 'source': 'grm', 'knn_k': 5, 'weighted_edges': True, 'symmetrize_mode': 'mutual', 'use_snp_selection': False}. Best is trial 48 with value: 0.18074188677385775.
[I 2025-11-03 16:02:50,869] Trial 63 finished with value: 0.17109205322662224 and parameters: {'model_type': 'graphsage', 'hidden_dims': '[512, 256]', 'dropout': 0.43481633225639776, 'batch_norm': True, 'lr': 0.0008450499287127787, 'weight_decay': 1.2767648464743325e-06, 'epochs': 330, 'loss': 'mae', 'optimizer': 'adam', 'graph_mode': 'knn', 'source': 'grm', 'knn_k': 7, 'weighted_edges': True, 'symmetrize_mode': 'mutual', 'use_snp_selection': False}. Best is trial 48 with value: 0.18074188677385775.
[I 2025-11-03 16:03:02,444] Trial 64 finished with value: 0.16078793378420617 and parameters: {'model_type': 'graphsage', 'hidden_dims': '[512, 256]', 'dropout': 0.40237799604826613, 'batch_norm': True, 'lr': 0.00045842594832458844, 'weight_decay': 4.1710724267477896e-07, 'epochs': 315, 'loss': 'mae', 'optimizer': 'adam', 'graph_mode': 'knn', 'source': 'grm', 'knn_k': 6, 'weighted_edges': True, 'symmetrize_mode': 'mutual', 'use_snp_selection': False}. Best is trial 48 with value: 0.18074188677385775.
[I 2025-11-03 16:03:11,883] Trial 65 finished with value: 0.1487904418632098 and parameters: {'model_type': 'graphsage', 'hidden_dims': '[512, 256]', 'dropout': 0.3545450068199213, 'batch_norm': True, 'lr': 0.00012668614633002244, 'weight_decay': 3.4081231243587266e-06, 'epochs': 252, 'loss': 'mae', 'optimizer': 'adam', 'graph_mode': 'knn', 'source': 'grm', 'knn_k': 5, 'weighted_edges': True, 'symmetrize_mode': 'mutual', 'use_snp_selection': False}. Best is trial 48 with value: 0.18074188677385775.
[I 2025-11-03 16:03:14,125] Trial 66 finished with value: 0.15360365765367426 and parameters: {'model_type': 'graphsage', 'hidden_dims': '[128, 64]', 'dropout': 0.520888500154534, 'batch_norm': True, 'lr': 0.00024369394613281086, 'weight_decay': 7.369537942430779e-07, 'epochs': 111, 'loss': 'mae', 'optimizer': 'adam', 'graph_mode': 'knn', 'source': 'grm', 'knn_k': 2, 'weighted_edges': True, 'symmetrize_mode': 'mutual', 'use_snp_selection': False}. Best is trial 48 with value: 0.18074188677385775.
[I 2025-11-03 16:03:23,949] Trial 67 finished with value: 0.1763357840245481 and parameters: {'model_type': 'graphsage', 'hidden_dims': '[512, 256]', 'dropout': 0.38284379313357914, 'batch_norm': True, 'lr': 0.0006185984335474622, 'weight_decay': 1.8383797917392638e-06, 'epochs': 283, 'loss': 'mae', 'optimizer': 'adam', 'graph_mode': 'knn', 'source': 'grm', 'knn_k': 3, 'weighted_edges': True, 'symmetrize_mode': 'mutual', 'use_snp_selection': False}. Best is trial 48 with value: 0.18074188677385775.
[I 2025-11-03 16:03:30,160] Trial 68 finished with value: 0.17612351825032055 and parameters: {'model_type': 'graphsage', 'hidden_dims': '[256, 128]', 'dropout': 0.3860839744259993, 'batch_norm': True, 'lr': 0.0009573616811392215, 'weight_decay': 5.080462398313401e-06, 'epochs': 285, 'loss': 'mae', 'optimizer': 'adam', 'graph_mode': 'knn', 'source': 'grm', 'knn_k': 3, 'weighted_edges': False, 'symmetrize_mode': 'mutual', 'use_snp_selection': False}. Best is trial 48 with value: 0.18074188677385775.
[I 2025-11-03 16:03:36,440] Trial 69 finished with value: 0.17201107917318548 and parameters: {'model_type': 'graphsage', 'hidden_dims': '[256, 128]', 'dropout': 0.3878579212378724, 'batch_norm': True, 'lr': 0.0009877471172356068, 'weight_decay': 1.9660947869798033e-06, 'epochs': 289, 'loss': 'mae', 'optimizer': 'adam', 'graph_mode': 'knn', 'source': 'grm', 'knn_k': 3, 'weighted_edges': False, 'symmetrize_mode': 'mutual', 'use_snp_selection': False}. Best is trial 48 with value: 0.18074188677385775.
[I 2025-11-03 16:03:42,636] Trial 70 finished with value: 0.17758473533903976 and parameters: {'model_type': 'graphsage', 'hidden_dims': '[256, 128]', 'dropout': 0.4122313289634482, 'batch_norm': True, 'lr': 0.0006359986930966677, 'weight_decay': 4.9198001705009966e-06, 'epochs': 284, 'loss': 'mae', 'optimizer': 'adam', 'graph_mode': 'knn', 'source': 'grm', 'knn_k': 3, 'weighted_edges': False, 'symmetrize_mode': 'mutual', 'use_snp_selection': False}. Best is trial 48 with value: 0.18074188677385775.
[I 2025-11-03 16:03:48,762] Trial 71 finished with value: 0.15984811137340765 and parameters: {'model_type': 'graphsage', 'hidden_dims': '[256, 128]', 'dropout': 0.4055446300979608, 'batch_norm': True, 'lr': 0.0006248752260732465, 'weight_decay': 4.406714054786062e-06, 'epochs': 266, 'loss': 'mae', 'optimizer': 'adam', 'graph_mode': 'knn', 'source': 'grm', 'knn_k': 4, 'weighted_edges': False, 'symmetrize_mode': 'mutual', 'use_snp_selection': False}. Best is trial 48 with value: 0.18074188677385775.
[I 2025-11-03 16:03:54,608] Trial 72 finished with value: 0.1607347719576045 and parameters: {'model_type': 'graphsage', 'hidden_dims': '[256, 128]', 'dropout': 0.37392186768136587, 'batch_norm': True, 'lr': 0.0007793467283881382, 'weight_decay': 3.1640439505938638e-06, 'epochs': 279, 'loss': 'mae', 'optimizer': 'adam', 'graph_mode': 'knn', 'source': 'grm', 'knn_k': 2, 'weighted_edges': False, 'symmetrize_mode': 'mutual', 'use_snp_selection': False}. Best is trial 48 with value: 0.18074188677385775.
[I 2025-11-03 16:04:00,146] Trial 73 finished with value: 0.17796170979427295 and parameters: {'model_type': 'graphsage', 'hidden_dims': '[256, 128]', 'dropout': 0.3434159810425166, 'batch_norm': True, 'lr': 0.0005783656189737685, 'weight_decay': 5.677411849762632e-06, 'epochs': 245, 'loss': 'mae', 'optimizer': 'adam', 'graph_mode': 'knn', 'source': 'grm', 'knn_k': 3, 'weighted_edges': False, 'symmetrize_mode': 'mutual', 'use_snp_selection': False}. Best is trial 48 with value: 0.18074188677385775.
[I 2025-11-03 16:04:05,702] Trial 74 finished with value: 0.17484159884108763 and parameters: {'model_type': 'graphsage', 'hidden_dims': '[256, 128]', 'dropout': 0.3290515882370237, 'batch_norm': True, 'lr': 0.0006177714636153302, 'weight_decay': 5.362197575821876e-06, 'epochs': 246, 'loss': 'mae', 'optimizer': 'adam', 'graph_mode': 'knn', 'source': 'grm', 'knn_k': 3, 'weighted_edges': False, 'symmetrize_mode': 'mutual', 'use_snp_selection': False}. Best is trial 48 with value: 0.18074188677385775.
[I 2025-11-03 16:04:11,846] Trial 75 finished with value: 0.1730361402324272 and parameters: {'model_type': 'graphsage', 'hidden_dims': '[256, 128]', 'dropout': 0.3464640467056739, 'batch_norm': True, 'lr': 0.0005274767901479882, 'weight_decay': 9.314297377463136e-06, 'epochs': 281, 'loss': 'mae', 'optimizer': 'adam', 'graph_mode': 'knn', 'source': 'grm', 'knn_k': 3, 'weighted_edges': False, 'symmetrize_mode': 'mutual', 'use_snp_selection': False}. Best is trial 48 with value: 0.18074188677385775.
[I 2025-11-03 16:04:16,096] Trial 76 finished with value: 0.11748385758879332 and parameters: {'model_type': 'graphsage', 'hidden_dims': '[256, 128]', 'dropout': 0.4139484095615262, 'batch_norm': False, 'lr': 0.0008664369741966645, 'weight_decay': 2.547523087359886e-06, 'epochs': 265, 'loss': 'mse', 'optimizer': 'adam', 'graph_mode': 'knn', 'source': 'grm', 'knn_k': 2, 'weighted_edges': False, 'symmetrize_mode': 'mutual', 'use_snp_selection': True, 'num_snps': 22616}. Best is trial 48 with value: 0.18074188677385775.
[I 2025-11-03 16:04:22,272] Trial 77 finished with value: 0.16295323386915028 and parameters: {'model_type': 'graphsage', 'hidden_dims': '[256, 128]', 'dropout': 0.2922085978758694, 'batch_norm': True, 'lr': 0.0006833709062989024, 'weight_decay': 7.716539435758229e-06, 'epochs': 242, 'loss': 'mae', 'optimizer': 'adam', 'graph_mode': 'knn', 'source': 'grm', 'knn_k': 3, 'weighted_edges': False, 'symmetrize_mode': 'union', 'use_snp_selection': False}. Best is trial 48 with value: 0.18074188677385775.
[I 2025-11-03 16:04:27,439] Trial 78 finished with value: 0.1595709865902803 and parameters: {'model_type': 'graphsage', 'hidden_dims': '[256, 128]', 'dropout': 0.3861263128294624, 'batch_norm': True, 'lr': 0.0004715439569601601, 'weight_decay': 1.2769496775055277e-05, 'epochs': 258, 'loss': 'mse', 'optimizer': 'adam', 'graph_mode': 'cutoff', 'cutoff': 0.5553230528140759, 'grm_norm': 'cosine', 'self_loops': True, 'use_snp_selection': False}. Best is trial 48 with value: 0.18074188677385775.
