[I 2025-11-03 14:14:33,483] Trial 45 finished with value: 0.15153850528303664 and parameters: {'model_type': 'gcn', 'hidden_dims': '[512, 128]', 'dropout': 0.5609681701888417, 'batch_norm': True, 'lr': 0.0006964939128649713, 'weight_decay': 1.0248871881166453e-07, 'epochs': 247, 'loss': 'mae', 'optimizer': 'adam', 'graph_mode': 'knn', 'source': 'grm', 'knn_k': 7, 'weighted_edges': True, 'symmetrize_mode': 'mutual', 'use_snp_selection': False}. Best is trial 31 with value: 0.17643153876650486.
[I 2025-11-03 14:14:35,140] Trial 46 finished with value: 0.1418693824624205 and parameters: {'model_type': 'gcn', 'hidden_dims': '[256, 128]', 'dropout': 0.3588374702647819, 'batch_norm': True, 'lr': 0.00023364051466754986, 'weight_decay': 3.4716442361519185e-05, 'epochs': 76, 'loss': 'mse', 'optimizer': 'adam', 'graph_mode': 'knn', 'source': 'grm', 'knn_k': 1, 'weighted_edges': True, 'symmetrize_mode': 'union', 'use_snp_selection': False}. Best is trial 31 with value: 0.17643153876650486.
[I 2025-11-03 14:14:40,464] Trial 47 finished with value: 0.11630032754407714 and parameters: {'model_type': 'gcn', 'hidden_dims': '[512, 256]', 'dropout': 0.41944681408942575, 'batch_norm': False, 'lr': 0.00016986292050337695, 'weight_decay': 3.5597138386425346e-07, 'epochs': 227, 'loss': 'mae', 'optimizer': 'adam', 'graph_mode': 'knn', 'source': 'grm', 'knn_k': 1, 'weighted_edges': True, 'symmetrize_mode': 'union', 'use_snp_selection': True, 'num_snps': 43485}. Best is trial 31 with value: 0.17643153876650486.
[I 2025-11-03 14:14:41,799] Trial 48 finished with value: 0.027772127169104058 and parameters: {'model_type': 'gcn', 'hidden_dims': '[512, 64]', 'dropout': 0.130033968034176, 'batch_norm': True, 'lr': 5.003250775960179e-05, 'weight_decay': 1.54242305322999e-05, 'epochs': 2, 'loss': 'mae', 'optimizer': 'adam', 'graph_mode': 'knn', 'source': 'grm', 'knn_k': 2, 'weighted_edges': False, 'symmetrize_mode': 'mutual', 'use_snp_selection': False}. Best is trial 31 with value: 0.17643153876650486.
[I 2025-11-03 14:14:45,048] Trial 49 finished with value: 0.15730952853242905 and parameters: {'model_type': 'gcn', 'hidden_dims': '[512, 64]', 'dropout': 0.20261405731896712, 'batch_norm': True, 'lr': 0.000312404719595867, 'weight_decay': 1.4603779285259418e-07, 'epochs': 153, 'loss': 'mae', 'optimizer': 'adam', 'graph_mode': 'cutoff', 'cutoff': 0.5358834616354315, 'grm_norm': 'gcn', 'self_loops': False, 'use_snp_selection': False}. Best is trial 31 with value: 0.17643153876650486.
[I 2025-11-03 14:14:47,996] Trial 50 finished with value: 0.16443622125875035 and parameters: {'model_type': 'gcn', 'hidden_dims': '[512, 256]', 'dropout': 0.2941636840211018, 'batch_norm': True, 'lr': 0.0007560503782617424, 'weight_decay': 2.1014873333916093e-07, 'epochs': 131, 'loss': 'mae', 'optimizer': 'adam', 'graph_mode': 'knn', 'source': 'grm', 'knn_k': 1, 'weighted_edges': True, 'symmetrize_mode': 'union', 'use_snp_selection': False}. Best is trial 31 with value: 0.17643153876650486.
[I 2025-11-03 14:14:50,986] Trial 51 finished with value: 0.15108278845933326 and parameters: {'model_type': 'gcn', 'hidden_dims': '[512, 256]', 'dropout': 0.28288568804885406, 'batch_norm': True, 'lr': 0.0007450174420902999, 'weight_decay': 2.1562472365832724e-07, 'epochs': 135, 'loss': 'mae', 'optimizer': 'adam', 'graph_mode': 'knn', 'source': 'grm', 'knn_k': 1, 'weighted_edges': True, 'symmetrize_mode': 'union', 'use_snp_selection': False}. Best is trial 31 with value: 0.17643153876650486.
[I 2025-11-03 14:14:54,491] Trial 52 finished with value: 0.15186910300231038 and parameters: {'model_type': 'gcn', 'hidden_dims': '[512, 256]', 'dropout': 0.310130786303471, 'batch_norm': True, 'lr': 0.0004934904846730256, 'weight_decay': 1.5264266086491303e-07, 'epochs': 176, 'loss': 'mae', 'optimizer': 'adam', 'graph_mode': 'knn', 'source': 'grm', 'knn_k': 1, 'weighted_edges': True, 'symmetrize_mode': 'union', 'use_snp_selection': False}. Best is trial 31 with value: 0.17643153876650486.
[I 2025-11-03 14:14:59,252] Trial 53 finished with value: 0.13643148689475054 and parameters: {'model_type': 'gcn', 'hidden_dims': '[512, 256]', 'dropout': 0.23239975655605233, 'batch_norm': True, 'lr': 0.0008086966535260534, 'weight_decay': 8.210523763883579e-06, 'epochs': 275, 'loss': 'mae', 'optimizer': 'adam', 'graph_mode': 'knn', 'source': 'grm', 'knn_k': 2, 'weighted_edges': True, 'symmetrize_mode': 'union', 'use_snp_selection': False}. Best is trial 31 with value: 0.17643153876650486.
[I 2025-11-03 14:15:02,178] Trial 54 finished with value: 0.15287375798009625 and parameters: {'model_type': 'gcn', 'hidden_dims': '[512, 256]', 'dropout': 0.2574097396591849, 'batch_norm': True, 'lr': 0.0004033781349088369, 'weight_decay': 3.142438667790743e-07, 'epochs': 134, 'loss': 'mae', 'optimizer': 'adam', 'graph_mode': 'knn', 'source': 'grm', 'knn_k': 3, 'weighted_edges': True, 'symmetrize_mode': 'union', 'use_snp_selection': False}. Best is trial 31 with value: 0.17643153876650486.
[I 2025-11-03 14:15:06,177] Trial 55 finished with value: 0.1704808174126785 and parameters: {'model_type': 'gcn', 'hidden_dims': '[256, 128, 64]', 'dropout': 0.28087377069481745, 'batch_norm': True, 'lr': 0.0002778166850329379, 'weight_decay': 5.052046048947169e-07, 'epochs': 350, 'loss': 'mae', 'optimizer': 'adam', 'graph_mode': 'knn', 'source': 'grm', 'knn_k': 1, 'weighted_edges': True, 'symmetrize_mode': 'mutual', 'use_snp_selection': False}. Best is trial 31 with value: 0.17643153876650486.
[I 2025-11-03 14:15:10,209] Trial 56 finished with value: 0.11754115627897403 and parameters: {'model_type': 'gcn', 'hidden_dims': '[256, 128, 64]', 'dropout': 0.28873097875849246, 'batch_norm': True, 'lr': 0.00020603765004025798, 'weight_decay': 7.013882999938442e-07, 'epochs': 345, 'loss': 'mae', 'optimizer': 'adam', 'graph_mode': 'knn', 'source': 'grm', 'knn_k': 4, 'weighted_edges': True, 'symmetrize_mode': 'mutual', 'use_snp_selection': False}. Best is trial 31 with value: 0.17643153876650486.
[I 2025-11-03 14:15:11,687] Trial 57 finished with value: 0.06896929336728537 and parameters: {'model_type': 'gcn', 'hidden_dims': '[256, 128, 64]', 'dropout': 0.27205417471687576, 'batch_norm': True, 'lr': 8.259812903045117e-05, 'weight_decay': 4.774184255362922e-07, 'epochs': 40, 'loss': 'mae', 'optimizer': 'adam', 'graph_mode': 'knn', 'source': 'grm', 'knn_k': 2, 'weighted_edges': True, 'symmetrize_mode': 'mutual', 'use_snp_selection': False}. Best is trial 31 with value: 0.17643153876650486.
[I 2025-11-03 14:15:13,888] Trial 58 finished with value: 0.13522495220739925 and parameters: {'model_type': 'gcn', 'hidden_dims': '[256, 128, 64]', 'dropout': 0.32231801912936886, 'batch_norm': True, 'lr': 0.00015195951055427032, 'weight_decay': 2.78826486896564e-06, 'epochs': 120, 'loss': 'mae', 'optimizer': 'adam', 'graph_mode': 'knn', 'source': 'grm', 'knn_k': 1, 'weighted_edges': False, 'symmetrize_mode': 'mutual', 'use_snp_selection': False}. Best is trial 31 with value: 0.17643153876650486.
[I 2025-11-03 14:15:16,739] Trial 59 finished with value: 0.13523488675186532 and parameters: {'model_type': 'gcn', 'hidden_dims': '[256, 128, 64]', 'dropout': 0.34751655905455403, 'batch_norm': True, 'lr': 0.0004922596483938694, 'weight_decay': 9.156157802438661e-07, 'epochs': 192, 'loss': 'mse', 'optimizer': 'adam', 'graph_mode': 'knn', 'source': 'grm', 'knn_k': 3, 'weighted_edges': True, 'symmetrize_mode': 'mutual', 'use_snp_selection': False}. Best is trial 31 with value: 0.17643153876650486.
[I 2025-11-03 14:15:20,247] Trial 60 finished with value: 0.08936466335890103 and parameters: {'model_type': 'gcn', 'hidden_dims': '[512, 256]', 'dropout': 0.24340375325035438, 'batch_norm': False, 'lr': 2.0143845477753547e-05, 'weight_decay': 2.0436904734975148e-07, 'epochs': 206, 'loss': 'mae', 'optimizer': 'adam', 'graph_mode': 'knn', 'source': 'grm', 'knn_k': 2, 'weighted_edges': True, 'symmetrize_mode': 'mutual', 'use_snp_selection': True, 'num_snps': 19019}. Best is trial 31 with value: 0.17643153876650486.
[I 2025-11-03 14:15:25,362] Trial 61 finished with value: 0.15381151060815737 and parameters: {'model_type': 'gcn', 'hidden_dims': '[512, 64]', 'dropout': 0.2165501310152599, 'batch_norm': True, 'lr': 0.00028563756374247565, 'weight_decay': 0.0009513139883287913, 'epochs': 311, 'loss': 'mae', 'optimizer': 'adam', 'graph_mode': 'knn', 'source': 'grm', 'knn_k': 1, 'weighted_edges': True, 'symmetrize_mode': 'union', 'use_snp_selection': False}. Best is trial 31 with value: 0.17643153876650486.
[I 2025-11-03 14:15:29,887] Trial 62 finished with value: 0.16591158059473926 and parameters: {'model_type': 'gcn', 'hidden_dims': '[512, 128]', 'dropout': 0.24894242879329836, 'batch_norm': True, 'lr': 0.0002829121022612674, 'weight_decay': 1.3428372022913933e-07, 'epochs': 258, 'loss': 'mae', 'optimizer': 'adam', 'graph_mode': 'knn', 'source': 'grm', 'knn_k': 1, 'weighted_edges': True, 'symmetrize_mode': 'union', 'use_snp_selection': False}. Best is trial 31 with value: 0.17643153876650486.
[I 2025-11-03 14:15:34,177] Trial 63 finished with value: 0.13542885471530403 and parameters: {'model_type': 'gcn', 'hidden_dims': '[512, 128]', 'dropout': 0.30088506431053585, 'batch_norm': True, 'lr': 0.0001295072986664118, 'weight_decay': 1.403053823333809e-07, 'epochs': 250, 'loss': 'mae', 'optimizer': 'adam', 'graph_mode': 'knn', 'source': 'grm', 'knn_k': 1, 'weighted_edges': True, 'symmetrize_mode': 'union', 'use_snp_selection': False}. Best is trial 31 with value: 0.17643153876650486.
[I 2025-11-03 14:15:38,274] Trial 64 finished with value: 0.14021513322644732 and parameters: {'model_type': 'gcn', 'hidden_dims': '[512, 128]', 'dropout': 0.25389010286217967, 'batch_norm': True, 'lr': 0.00036358245347369836, 'weight_decay': 2.614162497505699e-07, 'epochs': 233, 'loss': 'mae', 'optimizer': 'adam', 'graph_mode': 'knn', 'source': 'grm', 'knn_k': 2, 'weighted_edges': True, 'symmetrize_mode': 'mutual', 'use_snp_selection': False}. Best is trial 31 with value: 0.17643153876650486.
[I 2025-11-03 14:15:42,859] Trial 65 finished with value: 0.15165809250614332 and parameters: {'model_type': 'gcn', 'hidden_dims': '[512, 128]', 'dropout': 0.38045121280195154, 'batch_norm': True, 'lr': 0.00019751906838599959, 'weight_decay': 4.016677820099681e-07, 'epochs': 266, 'loss': 'mae', 'optimizer': 'adam', 'graph_mode': 'knn', 'source': 'grm', 'knn_k': 1, 'weighted_edges': True, 'symmetrize_mode': 'union', 'use_snp_selection': False}. Best is trial 31 with value: 0.17643153876650486.
[I 2025-11-03 14:15:46,841] Trial 66 finished with value: 0.17434743947658432 and parameters: {'model_type': 'gcn', 'hidden_dims': '[512, 128]', 'dropout': 0.2797049536407922, 'batch_norm': True, 'lr': 0.0005674023434730233, 'weight_decay': 1.8680553975134618e-07, 'epochs': 216, 'loss': 'mae', 'optimizer': 'adam', 'graph_mode': 'knn', 'source': 'grm', 'knn_k': 1, 'weighted_edges': True, 'symmetrize_mode': 'union', 'use_snp_selection': False}. Best is trial 31 with value: 0.17643153876650486.
[I 2025-11-03 14:15:52,260] Trial 67 finished with value: 0.1327464739107936 and parameters: {'model_type': 'gcn', 'hidden_dims': '[512, 128]', 'dropout': 0.2802875515184357, 'batch_norm': True, 'lr': 0.000979501661910588, 'weight_decay': 1.9095963171011052e-07, 'epochs': 330, 'loss': 'mae', 'optimizer': 'adam', 'graph_mode': 'knn', 'source': 'grm', 'knn_k': 2, 'weighted_edges': True, 'symmetrize_mode': 'mutual', 'use_snp_selection': False}. Best is trial 31 with value: 0.17643153876650486.
[I 2025-11-03 14:15:56,300] Trial 68 finished with value: 0.16642431084080653 and parameters: {'model_type': 'gcn', 'hidden_dims': '[512, 128]', 'dropout': 0.32313854599933756, 'batch_norm': True, 'lr': 0.0006405375097822861, 'weight_decay': 5.63986179001914e-07, 'epochs': 222, 'loss': 'mae', 'optimizer': 'adam', 'graph_mode': 'cutoff', 'cutoff': 0.7364324640933693, 'grm_norm': 'cosine_then_gcn', 'self_loops': True, 'use_snp_selection': False}. Best is trial 31 with value: 0.17643153876650486.
[I 2025-11-03 14:16:00,235] Trial 69 finished with value: 0.15463078950796055 and parameters: {'model_type': 'gcn', 'hidden_dims': '[512, 128]', 'dropout': 0.36514991816227643, 'batch_norm': True, 'lr': 0.0005580677325544936, 'weight_decay': 0.00011646387775473385, 'epochs': 214, 'loss': 'mae', 'optimizer': 'adam', 'graph_mode': 'cutoff', 'cutoff': 0.7370367546062915, 'grm_norm': 'cosine_then_gcn', 'self_loops': True, 'use_snp_selection': False}. Best is trial 31 with value: 0.17643153876650486.
[I 2025-11-03 14:16:04,769] Trial 70 finished with value: 0.1552452147089663 and parameters: {'model_type': 'gcn', 'hidden_dims': '[512, 128]', 'dropout': 0.31854647454653773, 'batch_norm': True, 'lr': 0.0005803623174202579, 'weight_decay': 6.189132669711842e-07, 'epochs': 262, 'loss': 'mae', 'optimizer': 'adam', 'graph_mode': 'cutoff', 'cutoff': 0.7811913630988434, 'grm_norm': 'cosine_then_gcn', 'self_loops': True, 'use_snp_selection': False}. Best is trial 31 with value: 0.17643153876650486.
[I 2025-11-03 14:16:08,369] Trial 71 finished with value: 0.1474135578850844 and parameters: {'model_type': 'gcn', 'hidden_dims': '[512, 128]', 'dropout': 0.33983004528372385, 'batch_norm': True, 'lr': 0.0007851820407376927, 'weight_decay': 3.2000641620612366e-07, 'epochs': 185, 'loss': 'mae', 'optimizer': 'adam', 'graph_mode': 'cutoff', 'cutoff': 0.5801846083890351, 'grm_norm': 'cosine_then_gcn', 'self_loops': True, 'use_snp_selection': False}. Best is trial 31 with value: 0.17643153876650486.
[I 2025-11-03 14:16:12,291] Trial 72 finished with value: 0.15494693068432558 and parameters: {'model_type': 'gcn', 'hidden_dims': '[512, 128]', 'dropout': 0.2958744389732705, 'batch_norm': True, 'lr': 0.00043055136136465586, 'weight_decay': 4.186005918028747e-07, 'epochs': 214, 'loss': 'mae', 'optimizer': 'adam', 'graph_mode': 'cutoff', 'cutoff': 0.6371291600472871, 'grm_norm': 'none', 'self_loops': True, 'use_snp_selection': False}. Best is trial 31 with value: 0.17643153876650486.
[I 2025-11-03 14:16:16,530] Trial 73 finished with value: 0.1556705975878322 and parameters: {'model_type': 'gcn', 'hidden_dims': '[512, 128]', 'dropout': 0.27107797258488053, 'batch_norm': True, 'lr': 0.00030559558148320873, 'weight_decay': 2.4640729167628573e-07, 'epochs': 235, 'loss': 'mae', 'optimizer': 'adam', 'graph_mode': 'cutoff', 'cutoff': 0.4760790866927218, 'grm_norm': 'cosine_then_gcn', 'self_loops': True, 'use_snp_selection': False}. Best is trial 31 with value: 0.17643153876650486.
[I 2025-11-03 14:16:21,000] Trial 74 finished with value: 0.1754568380888932 and parameters: {'model_type': 'gcn', 'hidden_dims': '[512, 128]', 'dropout': 0.30823697980390274, 'batch_norm': True, 'lr': 0.0006708395919417942, 'weight_decay': 1.4123890585677447e-07, 'epochs': 253, 'loss': 'mae', 'optimizer': 'adam', 'graph_mode': 'knn', 'source': 'grm', 'knn_k': 1, 'weighted_edges': True, 'symmetrize_mode': 'union', 'use_snp_selection': False}. Best is trial 31 with value: 0.17643153876650486.
[I 2025-11-03 14:16:25,523] Trial 75 finished with value: 0.10478110177652199 and parameters: {'model_type': 'gcn', 'hidden_dims': '[512, 128]', 'dropout': 0.3144583849482057, 'batch_norm': True, 'lr': 0.0003600842069932556, 'weight_decay': 1.568533060101509e-07, 'epochs': 257, 'loss': 'mae', 'optimizer': 'adam', 'graph_mode': 'knn', 'source': 'grm', 'knn_k': 2, 'weighted_edges': False, 'symmetrize_mode': 'union', 'use_snp_selection': False}. Best is trial 31 with value: 0.17643153876650486.
[I 2025-11-03 14:16:29,602] Trial 76 finished with value: 0.1017159129602741 and parameters: {'model_type': 'gcn', 'hidden_dims': '[512, 128]', 'dropout': 0.24244899627812078, 'batch_norm': True, 'lr': 3.0353516957016855e-06, 'weight_decay': 1.309045860710958e-07, 'epochs': 226, 'loss': 'mse', 'optimizer': 'adam', 'graph_mode': 'cutoff', 'cutoff': 0.7955895487163293, 'grm_norm': 'cosine_then_gcn', 'self_loops': False, 'use_snp_selection': False}. Best is trial 31 with value: 0.17643153876650486.
[I 2025-11-03 14:16:32,290] Trial 77 finished with value: 0.11152116398834871 and parameters: {'model_type': 'gcn', 'hidden_dims': '[512, 128]', 'dropout': 0.33477599841887473, 'batch_norm': False, 'lr': 0.0002674946627878503, 'weight_decay': 3.533385352659607e-05, 'epochs': 271, 'loss': 'mae', 'optimizer': 'adam', 'graph_mode': 'knn', 'source': 'grm', 'knn_k': 3, 'weighted_edges': True, 'symmetrize_mode': 'mutual', 'use_snp_selection': True, 'num_snps': 5844}. Best is trial 31 with value: 0.17643153876650486.
[I 2025-11-03 14:16:34,658] Trial 78 finished with value: 0.15422233519286174 and parameters: {'model_type': 'gcn', 'hidden_dims': '[128, 64]', 'dropout': 0.39449908255839833, 'batch_norm': True, 'lr': 0.0005806428659425858, 'weight_decay': 1.9186716092863227e-06, 'epochs': 287, 'loss': 'mae', 'optimizer': 'adam', 'graph_mode': 'knn', 'source': 'grm', 'knn_k': 1, 'weighted_edges': True, 'symmetrize_mode': 'union', 'use_snp_selection': False}. Best is trial 31 with value: 0.17643153876650486.
[I 2025-11-03 14:16:37,536] Trial 79 finished with value: 0.13131486550047256 and parameters: {'model_type': 'gcn', 'hidden_dims': '[256, 128]', 'dropout': 0.25966131524885083, 'batch_norm': True, 'lr': 0.00044805814010703056, 'weight_decay': 4.946874833726525e-07, 'epochs': 241, 'loss': 'mae', 'optimizer': 'adam', 'graph_mode': 'knn', 'source': 'grm', 'knn_k': 4, 'weighted_edges': True, 'symmetrize_mode': 'union', 'use_snp_selection': False}. Best is trial 31 with value: 0.17643153876650486.
[I 2025-11-03 14:16:41,990] Trial 80 finished with value: 0.16950556809001738 and parameters: {'model_type': 'gcn', 'hidden_dims': '[512, 128]', 'dropout': 0.20282409561711134, 'batch_norm': True, 'lr': 0.00033893083252198113, 'weight_decay': 2.3744362384163714e-05, 'epochs': 255, 'loss': 'mae', 'optimizer': 'adam', 'graph_mode': 'knn', 'source': 'grm', 'knn_k': 3, 'weighted_edges': True, 'symmetrize_mode': 'mutual', 'use_snp_selection': False}. Best is trial 31 with value: 0.17643153876650486.
[I 2025-11-03 14:16:46,511] Trial 81 finished with value: 0.14312352592252225 and parameters: {'model_type': 'gcn', 'hidden_dims': '[512, 128]', 'dropout': 0.20223615472805118, 'batch_norm': True, 'lr': 0.0001948257989152628, 'weight_decay': 2.4252177696358453e-05, 'epochs': 255, 'loss': 'mae', 'optimizer': 'adam', 'graph_mode': 'knn', 'source': 'grm', 'knn_k': 7, 'weighted_edges': True, 'symmetrize_mode': 'mutual', 'use_snp_selection': False}. Best is trial 31 with value: 0.17643153876650486.
[I 2025-11-03 14:16:50,345] Trial 82 finished with value: 0.15709484727304973 and parameters: {'model_type': 'gcn', 'hidden_dims': '[512, 128]', 'dropout': 0.209995880776787, 'batch_norm': True, 'lr': 0.00034401493444248207, 'weight_decay': 5.198269065246647e-05, 'epochs': 201, 'loss': 'mae', 'optimizer': 'adam', 'graph_mode': 'knn', 'source': 'grm', 'knn_k': 3, 'weighted_edges': True, 'symmetrize_mode': 'mutual', 'use_snp_selection': False}. Best is trial 31 with value: 0.17643153876650486.
[I 2025-11-03 14:16:54,443] Trial 83 finished with value: 0.1412878720968759 and parameters: {'model_type': 'gcn', 'hidden_dims': '[512, 128]', 'dropout': 0.18182019978882186, 'batch_norm': True, 'lr': 0.00025496965279049496, 'weight_decay': 1.2962397484876242e-05, 'epochs': 221, 'loss': 'mae', 'optimizer': 'adam', 'graph_mode': 'knn', 'source': 'grm', 'knn_k': 5, 'weighted_edges': True, 'symmetrize_mode': 'mutual', 'use_snp_selection': False}. Best is trial 31 with value: 0.17643153876650486.
[I 2025-11-03 14:16:58,791] Trial 84 finished with value: 0.14619406681348054 and parameters: {'model_type': 'gcn', 'hidden_dims': '[512, 128]', 'dropout': 0.1663646592858823, 'batch_norm': True, 'lr': 0.0006384187715789822, 'weight_decay': 7.244059568004386e-06, 'epochs': 243, 'loss': 'mae', 'optimizer': 'adam', 'graph_mode': 'knn', 'source': 'grm', 'knn_k': 2, 'weighted_edges': True, 'symmetrize_mode': 'mutual', 'use_snp_selection': False}. Best is trial 31 with value: 0.17643153876650486.
[I 2025-11-03 14:17:01,713] Trial 85 finished with value: 0.1513971305916263 and parameters: {'model_type': 'gcn', 'hidden_dims': '[256, 128, 64]', 'dropout': 0.22237771126617267, 'batch_norm': True, 'lr': 0.0008424436570671019, 'weight_decay': 5.223765816491704e-06, 'epochs': 210, 'loss': 'mae', 'optimizer': 'adam', 'graph_mode': 'knn', 'source': 'grm', 'knn_k': 1, 'weighted_edges': True, 'symmetrize_mode': 'union', 'use_snp_selection': False}. Best is trial 31 with value: 0.17643153876650486.
[I 2025-11-03 14:17:05,719] Trial 86 finished with value: 0.14498091657189432 and parameters: {'model_type': 'gcn', 'hidden_dims': '[512, 128]', 'dropout': 0.2790782511242118, 'batch_norm': True, 'lr': 0.00015616604592058215, 'weight_decay': 1.8892622057299525e-05, 'epochs': 224, 'loss': 'mae', 'optimizer': 'adam', 'graph_mode': 'knn', 'source': 'grm', 'knn_k': 4, 'weighted_edges': True, 'symmetrize_mode': 'mutual', 'use_snp_selection': False}. Best is trial 31 with value: 0.17643153876650486.
[I 2025-11-03 14:17:10,602] Trial 87 finished with value: 0.14067215078999995 and parameters: {'model_type': 'gcn', 'hidden_dims': '[512, 128]', 'dropout': 0.24101413124866797, 'batch_norm': True, 'lr': 0.0004333879556824027, 'weight_decay': 4.6099063007586264e-05, 'epochs': 298, 'loss': 'mae', 'optimizer': 'adam', 'graph_mode': 'cutoff', 'cutoff': 0.39637953767606615, 'grm_norm': 'gcn', 'self_loops': True, 'use_snp_selection': False}. Best is trial 31 with value: 0.17643153876650486.
[I 2025-11-03 14:17:12,546] Trial 88 finished with value: 0.15364144764024468 and parameters: {'model_type': 'gcn', 'hidden_dims': '[128, 64]', 'dropout': 0.35716716603546494, 'batch_norm': True, 'lr': 0.0005224850980966801, 'weight_decay': 1.2077115142800586e-07, 'epochs': 196, 'loss': 'mse', 'optimizer': 'adam', 'graph_mode': 'knn', 'source': 'grm', 'knn_k': 5, 'weighted_edges': True, 'symmetrize_mode': 'union', 'use_snp_selection': False}. Best is trial 31 with value: 0.17643153876650486.
