Running from this directory: /cluster/work/simennes/Project_thesis/Project_thesis
Name of job: sage_ens
ID of job: 23199302
The job was run on these nodes: idun-09-16
[I 2025-11-03 11:44:26,245] Trial 0 finished with value: -0.0009633201865806311 and parameters: {'model_type': 'graphsage', 'hidden_dims': '[128, 64]', 'dropout': 0.199031432379812, 'batch_norm': True, 'lr': 1.8408544111075837e-06, 'weight_decay': 5.5136510071208614e-05, 'epochs': 336, 'loss': 'mae', 'optimizer': 'adam', 'graph_mode': 'knn', 'source': 'grm', 'knn_k': 8, 'weighted_edges': True, 'symmetrize_mode': 'mutual', 'use_snp_selection': False}. Best is trial 0 with value: -0.0009633201865806311.
[I 2025-11-03 11:44:27,789] Trial 1 finished with value: 0.08300293358431513 and parameters: {'model_type': 'graphsage', 'hidden_dims': '[128, 64]', 'dropout': 0.40051947670227217, 'batch_norm': True, 'lr': 0.0005320428882732732, 'weight_decay': 1.89210117736594e-06, 'epochs': 68, 'loss': 'mse', 'optimizer': 'adam', 'graph_mode': 'knn', 'source': 'grm', 'knn_k': 7, 'weighted_edges': True, 'symmetrize_mode': 'union', 'use_snp_selection': False}. Best is trial 1 with value: 0.08300293358431513.
[I 2025-11-03 11:44:30,270] Trial 2 finished with value: 0.04996273461511633 and parameters: {'model_type': 'graphsage', 'hidden_dims': '[256, 128]', 'dropout': 0.5105528289184642, 'batch_norm': False, 'lr': 0.0006804279372404962, 'weight_decay': 0.0008922815224257085, 'epochs': 181, 'loss': 'mse', 'optimizer': 'adam', 'graph_mode': 'cutoff', 'cutoff': 0.5741905641612706, 'grm_norm': 'gcn', 'self_loops': False, 'use_snp_selection': True, 'num_snps': 26910}. Best is trial 1 with value: 0.08300293358431513.
[I 2025-11-03 11:44:32,891] Trial 3 finished with value: 0.0169572099873111 and parameters: {'model_type': 'graphsage', 'hidden_dims': '[256, 128, 64]', 'dropout': 0.5390483213624292, 'batch_norm': False, 'lr': 3.4705625989073525e-05, 'weight_decay': 2.4623319020131338e-05, 'epochs': 121, 'loss': 'mse', 'optimizer': 'adam', 'graph_mode': 'knn', 'source': 'grm', 'knn_k': 6, 'weighted_edges': False, 'symmetrize_mode': 'mutual', 'use_snp_selection': True, 'num_snps': 30713}. Best is trial 1 with value: 0.08300293358431513.
[I 2025-11-03 11:44:35,451] Trial 4 finished with value: 0.058129837218736276 and parameters: {'model_type': 'graphsage', 'hidden_dims': '[128, 64]', 'dropout': 0.13404863676897502, 'batch_norm': False, 'lr': 0.0001431556295367288, 'weight_decay': 2.2084517750726675e-05, 'epochs': 51, 'loss': 'mae', 'optimizer': 'adam', 'graph_mode': 'cutoff', 'cutoff': 0.6714268476993044, 'grm_norm': 'none', 'self_loops': False, 'use_snp_selection': True, 'num_snps': 45645}. Best is trial 1 with value: 0.08300293358431513.
[I 2025-11-03 11:44:38,549] Trial 5 finished with value: 0.06807577767406481 and parameters: {'model_type': 'graphsage', 'hidden_dims': '[256, 128]', 'dropout': 0.42253606323412096, 'batch_norm': False, 'lr': 4.238630400638805e-05, 'weight_decay': 8.074086040046576e-07, 'epochs': 158, 'loss': 'mae', 'optimizer': 'adam', 'graph_mode': 'knn', 'source': 'grm', 'knn_k': 1, 'weighted_edges': False, 'symmetrize_mode': 'mutual', 'use_snp_selection': True, 'num_snps': 43113}. Best is trial 1 with value: 0.08300293358431513.
[I 2025-11-03 11:44:42,127] Trial 6 finished with value: 0.1230570001346002 and parameters: {'model_type': 'graphsage', 'hidden_dims': '[512, 256]', 'dropout': 0.3534893146320237, 'batch_norm': True, 'lr': 0.000251307964226932, 'weight_decay': 1.821819791794022e-05, 'epochs': 223, 'loss': 'mae', 'optimizer': 'adam', 'graph_mode': 'knn', 'source': 'grm', 'knn_k': 1, 'weighted_edges': True, 'symmetrize_mode': 'mutual', 'use_snp_selection': False}. Best is trial 6 with value: 0.1230570001346002.
[I 2025-11-03 11:44:45,362] Trial 7 finished with value: 0.08986487879052793 and parameters: {'model_type': 'graphsage', 'hidden_dims': '[512, 256]', 'dropout': 0.1105825955860775, 'batch_norm': True, 'lr': 2.374338412754043e-05, 'weight_decay': 1.1284721123340274e-05, 'epochs': 190, 'loss': 'mse', 'optimizer': 'adam', 'graph_mode': 'cutoff', 'cutoff': 0.719872204109604, 'grm_norm': 'gcn', 'self_loops': False, 'use_snp_selection': False}. Best is trial 6 with value: 0.1230570001346002.
[I 2025-11-03 11:44:48,250] Trial 8 finished with value: 0.09985791323264225 and parameters: {'model_type': 'graphsage', 'hidden_dims': '[512, 128]', 'dropout': 0.5066580418354021, 'batch_norm': True, 'lr': 0.00039213678276659976, 'weight_decay': 3.43655320802934e-06, 'epochs': 120, 'loss': 'mse', 'optimizer': 'adam', 'graph_mode': 'cutoff', 'cutoff': 0.34923059576505366, 'grm_norm': 'cosine', 'self_loops': True, 'use_snp_selection': False}. Best is trial 6 with value: 0.1230570001346002.
[I 2025-11-03 11:44:50,259] Trial 9 finished with value: 0.07289217317756522 and parameters: {'model_type': 'graphsage', 'hidden_dims': '[512, 256]', 'dropout': 0.301734920240333, 'batch_norm': False, 'lr': 6.650961854953448e-06, 'weight_decay': 6.861575656590315e-05, 'epochs': 150, 'loss': 'mae', 'optimizer': 'adam', 'graph_mode': 'cutoff', 'cutoff': 0.2857569870061939, 'grm_norm': 'cosine_then_gcn', 'self_loops': False, 'use_snp_selection': True, 'num_snps': 12722}. Best is trial 6 with value: 0.1230570001346002.
[I 2025-11-03 11:44:54,174] Trial 10 finished with value: 0.10080638236909933 and parameters: {'model_type': 'graphsage', 'hidden_dims': '[512, 64]', 'dropout': 0.2833599465317005, 'batch_norm': True, 'lr': 0.00016916760584270694, 'weight_decay': 1.7866650996308468e-07, 'epochs': 275, 'loss': 'mae', 'optimizer': 'adam', 'graph_mode': 'knn', 'source': 'grm', 'knn_k': 1, 'weighted_edges': True, 'symmetrize_mode': 'union', 'use_snp_selection': False}. Best is trial 6 with value: 0.1230570001346002.
[I 2025-11-03 11:44:58,065] Trial 11 finished with value: 0.1016936585427039 and parameters: {'model_type': 'graphsage', 'hidden_dims': '[512, 64]', 'dropout': 0.2859699507705008, 'batch_norm': True, 'lr': 0.00012623783700890367, 'weight_decay': 1.680520994398766e-07, 'epochs': 274, 'loss': 'mae', 'optimizer': 'adam', 'graph_mode': 'knn', 'source': 'grm', 'knn_k': 1, 'weighted_edges': True, 'symmetrize_mode': 'union', 'use_snp_selection': False}. Best is trial 6 with value: 0.1230570001346002.
[I 2025-11-03 11:45:01,919] Trial 12 finished with value: 0.07977903509592181 and parameters: {'model_type': 'graphsage', 'hidden_dims': '[512, 64]', 'dropout': 0.2516138819478735, 'batch_norm': True, 'lr': 0.00011934893004304496, 'weight_decay': 1.0887150741139413e-07, 'epochs': 253, 'loss': 'mae', 'optimizer': 'adam', 'graph_mode': 'knn', 'source': 'grm', 'knn_k': 3, 'weighted_edges': True, 'symmetrize_mode': 'union', 'use_snp_selection': False}. Best is trial 6 with value: 0.1230570001346002.
[I 2025-11-03 11:45:05,677] Trial 13 finished with value: 0.09631381910890531 and parameters: {'model_type': 'graphsage', 'hidden_dims': '[512, 64]', 'dropout': 0.3597295172492356, 'batch_norm': True, 'lr': 7.689848153447392e-05, 'weight_decay': 0.000399947667615736, 'epochs': 251, 'loss': 'mae', 'optimizer': 'adam', 'graph_mode': 'knn', 'source': 'grm', 'knn_k': 4, 'weighted_edges': True, 'symmetrize_mode': 'mutual', 'use_snp_selection': False}. Best is trial 6 with value: 0.1230570001346002.
[I 2025-11-03 11:45:09,890] Trial 14 finished with value: 0.0874392043083524 and parameters: {'model_type': 'graphsage', 'hidden_dims': '[512, 256]', 'dropout': 0.44076965942752383, 'batch_norm': True, 'lr': 1.2586985041154999e-05, 'weight_decay': 8.665907472910647e-07, 'epochs': 303, 'loss': 'mae', 'optimizer': 'adam', 'graph_mode': 'knn', 'source': 'grm', 'knn_k': 3, 'weighted_edges': True, 'symmetrize_mode': 'union', 'use_snp_selection': False}. Best is trial 6 with value: 0.1230570001346002.
[I 2025-11-03 11:45:13,455] Trial 15 finished with value: 0.11107455333637363 and parameters: {'model_type': 'graphsage', 'hidden_dims': '[512, 128]', 'dropout': 0.3355876786391346, 'batch_norm': True, 'lr': 0.0002980455072267111, 'weight_decay': 0.00013722890470534003, 'epochs': 221, 'loss': 'mae', 'optimizer': 'adam', 'graph_mode': 'knn', 'source': 'grm', 'knn_k': 1, 'weighted_edges': True, 'symmetrize_mode': 'union', 'use_snp_selection': False}. Best is trial 6 with value: 0.1230570001346002.
[I 2025-11-03 11:45:17,140] Trial 16 finished with value: 0.09412643946232 and parameters: {'model_type': 'graphsage', 'hidden_dims': '[512, 128]', 'dropout': 0.5886866495246753, 'batch_norm': True, 'lr': 0.00030562170261851616, 'weight_decay': 0.00015985827070250024, 'epochs': 218, 'loss': 'mae', 'optimizer': 'adam', 'graph_mode': 'knn', 'source': 'grm', 'knn_k': 10, 'weighted_edges': False, 'symmetrize_mode': 'mutual', 'use_snp_selection': False}. Best is trial 6 with value: 0.1230570001346002.
[I 2025-11-03 11:45:20,594] Trial 17 finished with value: 0.11998875117065115 and parameters: {'model_type': 'graphsage', 'hidden_dims': '[512, 128]', 'dropout': 0.3496176651757554, 'batch_norm': True, 'lr': 0.00028616129463827076, 'weight_decay': 0.00017362465885902836, 'epochs': 207, 'loss': 'mae', 'optimizer': 'adam', 'graph_mode': 'knn', 'source': 'grm', 'knn_k': 3, 'weighted_edges': True, 'symmetrize_mode': 'mutual', 'use_snp_selection': False}. Best is trial 6 with value: 0.1230570001346002.
[I 2025-11-03 11:45:23,395] Trial 18 finished with value: 0.09481383767011924 and parameters: {'model_type': 'graphsage', 'hidden_dims': '[256, 128, 64]', 'dropout': 0.21883535368210386, 'batch_norm': True, 'lr': 0.000955755558887556, 'weight_decay': 6.76061307458082e-06, 'epochs': 217, 'loss': 'mae', 'optimizer': 'adam', 'graph_mode': 'knn', 'source': 'grm', 'knn_k': 4, 'weighted_edges': True, 'symmetrize_mode': 'mutual', 'use_snp_selection': False}. Best is trial 6 with value: 0.1230570001346002.
[I 2025-11-03 11:45:27,711] Trial 19 finished with value: 0.07489297662703691 and parameters: {'model_type': 'graphsage', 'hidden_dims': '[512, 128]', 'dropout': 0.3668553638489814, 'batch_norm': True, 'lr': 5.870858816837874e-05, 'weight_decay': 0.00021181406365012185, 'epochs': 337, 'loss': 'mae', 'optimizer': 'adam', 'graph_mode': 'knn', 'source': 'grm', 'knn_k': 3, 'weighted_edges': False, 'symmetrize_mode': 'mutual', 'use_snp_selection': False}. Best is trial 6 with value: 0.1230570001346002.
[I 2025-11-03 11:45:30,430] Trial 20 finished with value: 0.04095256538407327 and parameters: {'model_type': 'graphsage', 'hidden_dims': '[512, 256]', 'dropout': 0.46201114806835597, 'batch_norm': True, 'lr': 3.6318419901982732e-06, 'weight_decay': 0.0009708227750584831, 'epochs': 93, 'loss': 'mae', 'optimizer': 'adam', 'graph_mode': 'knn', 'source': 'grm', 'knn_k': 5, 'weighted_edges': True, 'symmetrize_mode': 'mutual', 'use_snp_selection': False}. Best is trial 6 with value: 0.1230570001346002.
[I 2025-11-03 11:45:34,010] Trial 21 finished with value: 0.11239826224667632 and parameters: {'model_type': 'graphsage', 'hidden_dims': '[512, 128]', 'dropout': 0.33107799167885665, 'batch_norm': True, 'lr': 0.00026144223540056414, 'weight_decay': 8.584254902151108e-05, 'epochs': 219, 'loss': 'mae', 'optimizer': 'adam', 'graph_mode': 'knn', 'source': 'grm', 'knn_k': 2, 'weighted_edges': True, 'symmetrize_mode': 'union', 'use_snp_selection': False}. Best is trial 6 with value: 0.1230570001346002.
[I 2025-11-03 11:45:37,731] Trial 22 finished with value: 0.11305721478031575 and parameters: {'model_type': 'graphsage', 'hidden_dims': '[512, 128]', 'dropout': 0.34501607639261406, 'batch_norm': True, 'lr': 0.0009982921811444935, 'weight_decay': 4.916652941778322e-05, 'epochs': 245, 'loss': 'mae', 'optimizer': 'adam', 'graph_mode': 'knn', 'source': 'grm', 'knn_k': 2, 'weighted_edges': True, 'symmetrize_mode': 'mutual', 'use_snp_selection': False}. Best is trial 6 with value: 0.1230570001346002.
[I 2025-11-03 11:45:41,432] Trial 23 finished with value: 0.11036706169303755 and parameters: {'model_type': 'graphsage', 'hidden_dims': '[512, 128]', 'dropout': 0.38673360812759683, 'batch_norm': True, 'lr': 0.0008697508285633541, 'weight_decay': 2.840667964973809e-05, 'epochs': 245, 'loss': 'mae', 'optimizer': 'adam', 'graph_mode': 'knn', 'source': 'grm', 'knn_k': 2, 'weighted_edges': True, 'symmetrize_mode': 'mutual', 'use_snp_selection': False}. Best is trial 6 with value: 0.1230570001346002.
[I 2025-11-03 11:45:44,616] Trial 24 finished with value: 0.11652192765314921 and parameters: {'model_type': 'graphsage', 'hidden_dims': '[512, 128]', 'dropout': 0.3076189369536917, 'batch_norm': True, 'lr': 0.000573427613667838, 'weight_decay': 0.000288763843094922, 'epochs': 170, 'loss': 'mae', 'optimizer': 'adam', 'graph_mode': 'knn', 'source': 'grm', 'knn_k': 2, 'weighted_edges': True, 'symmetrize_mode': 'mutual', 'use_snp_selection': False}. Best is trial 6 with value: 0.1230570001346002.
[I 2025-11-03 11:45:47,850] Trial 25 finished with value: 0.09357468990868956 and parameters: {'model_type': 'graphsage', 'hidden_dims': '[512, 256]', 'dropout': 0.18863658761230856, 'batch_norm': True, 'lr': 0.0005128228019843935, 'weight_decay': 0.00037933972666993773, 'epochs': 163, 'loss': 'mae', 'optimizer': 'adam', 'graph_mode': 'knn', 'source': 'grm', 'knn_k': 4, 'weighted_edges': True, 'symmetrize_mode': 'mutual', 'use_snp_selection': False}. Best is trial 6 with value: 0.1230570001346002.
[I 2025-11-03 11:45:52,266] Trial 26 finished with value: 0.0029848581096791693 and parameters: {'model_type': 'graphsage', 'hidden_dims': '[512, 128]', 'dropout': 0.2470035837292539, 'batch_norm': False, 'lr': 0.00022838844920754084, 'weight_decay': 0.00036653519976243524, 'epochs': 132, 'loss': 'mse', 'optimizer': 'adam', 'graph_mode': 'cutoff', 'cutoff': 0.8765009073803762, 'grm_norm': 'none', 'self_loops': True, 'use_snp_selection': True, 'num_snps': 59005}. Best is trial 6 with value: 0.1230570001346002.
[I 2025-11-03 11:45:54,598] Trial 27 finished with value: 0.09891425296316672 and parameters: {'model_type': 'graphsage', 'hidden_dims': '[256, 128]', 'dropout': 0.3053767741479389, 'batch_norm': True, 'lr': 8.218837186570652e-05, 'weight_decay': 6.878961218400797e-06, 'epochs': 192, 'loss': 'mae', 'optimizer': 'adam', 'graph_mode': 'knn', 'source': 'grm', 'knn_k': 2, 'weighted_edges': True, 'symmetrize_mode': 'mutual', 'use_snp_selection': False}. Best is trial 6 with value: 0.1230570001346002.
[I 2025-11-03 11:45:57,146] Trial 28 finished with value: 0.04309129256810741 and parameters: {'model_type': 'graphsage', 'hidden_dims': '[256, 128, 64]', 'dropout': 0.47665069595857895, 'batch_norm': True, 'lr': 1.605678973204785e-05, 'weight_decay': 0.00023038767964640852, 'epochs': 173, 'loss': 'mae', 'optimizer': 'adam', 'graph_mode': 'knn', 'source': 'grm', 'knn_k': 5, 'weighted_edges': False, 'symmetrize_mode': 'mutual', 'use_snp_selection': False}. Best is trial 6 with value: 0.1230570001346002.
[I 2025-11-03 11:45:59,574] Trial 29 finished with value: 0.0931215922879243 and parameters: {'model_type': 'graphsage', 'hidden_dims': '[128, 64]', 'dropout': 0.1881763221627632, 'batch_norm': True, 'lr': 0.00046279859445892723, 'weight_decay': 3.625979207896768e-05, 'epochs': 283, 'loss': 'mae', 'optimizer': 'adam', 'graph_mode': 'knn', 'source': 'grm', 'knn_k': 3, 'weighted_edges': True, 'symmetrize_mode': 'mutual', 'use_snp_selection': False}. Best is trial 6 with value: 0.1230570001346002.
[I 2025-11-03 11:46:03,706] Trial 30 finished with value: -0.014603166754774839 and parameters: {'model_type': 'graphsage', 'hidden_dims': '[512, 256]', 'dropout': 0.4036814769296127, 'batch_norm': True, 'lr': 1.296380227364303e-06, 'weight_decay': 8.572229145997394e-05, 'epochs': 306, 'loss': 'mae', 'optimizer': 'adam', 'graph_mode': 'knn', 'source': 'grm', 'knn_k': 2, 'weighted_edges': True, 'symmetrize_mode': 'mutual', 'use_snp_selection': False}. Best is trial 6 with value: 0.1230570001346002.
[I 2025-11-03 11:46:07,368] Trial 31 finished with value: 0.10747063377471948 and parameters: {'model_type': 'graphsage', 'hidden_dims': '[512, 128]', 'dropout': 0.3334512306824794, 'batch_norm': True, 'lr': 0.0008815831025112054, 'weight_decay': 1.4804885137046194e-05, 'epochs': 235, 'loss': 'mae', 'optimizer': 'adam', 'graph_mode': 'knn', 'source': 'grm', 'knn_k': 2, 'weighted_edges': True, 'symmetrize_mode': 'mutual', 'use_snp_selection': False}. Best is trial 6 with value: 0.1230570001346002.
[I 2025-11-03 11:46:10,804] Trial 32 finished with value: 0.1158275435244961 and parameters: {'model_type': 'graphsage', 'hidden_dims': '[512, 128]', 'dropout': 0.38174118469010165, 'batch_norm': True, 'lr': 0.0005901224803799996, 'weight_decay': 4.445407259733478e-05, 'epochs': 211, 'loss': 'mae', 'optimizer': 'adam', 'graph_mode': 'knn', 'source': 'grm', 'knn_k': 1, 'weighted_edges': True, 'symmetrize_mode': 'mutual', 'use_snp_selection': False}. Best is trial 6 with value: 0.1230570001346002.
[I 2025-11-03 11:46:14,153] Trial 33 finished with value: 0.11531058068340336 and parameters: {'model_type': 'graphsage', 'hidden_dims': '[512, 128]', 'dropout': 0.38674954955530105, 'batch_norm': True, 'lr': 0.0006050110233455115, 'weight_decay': 0.00010621054387580372, 'epochs': 191, 'loss': 'mae', 'optimizer': 'adam', 'graph_mode': 'knn', 'source': 'grm', 'knn_k': 1, 'weighted_edges': True, 'symmetrize_mode': 'mutual', 'use_snp_selection': False}. Best is trial 6 with value: 0.1230570001346002.
[I 2025-11-03 11:46:17,619] Trial 34 finished with value: 0.11478848282224235 and parameters: {'model_type': 'graphsage', 'hidden_dims': '[512, 128]', 'dropout': 0.257480879793612, 'batch_norm': True, 'lr': 0.0002240986976682039, 'weight_decay': 4.7636181019073486e-05, 'epochs': 209, 'loss': 'mse', 'optimizer': 'adam', 'graph_mode': 'knn', 'source': 'grm', 'knn_k': 1, 'weighted_edges': True, 'symmetrize_mode': 'mutual', 'use_snp_selection': False}. Best is trial 6 with value: 0.1230570001346002.
[I 2025-11-03 11:46:19,340] Trial 35 finished with value: 0.019695104770835303 and parameters: {'model_type': 'graphsage', 'hidden_dims': '[128, 64]', 'dropout': 0.41980096821421586, 'batch_norm': False, 'lr': 0.00042360447672997023, 'weight_decay': 1.5381131799334417e-05, 'epochs': 204, 'loss': 'mae', 'optimizer': 'adam', 'graph_mode': 'knn', 'source': 'grm', 'knn_k': 3, 'weighted_edges': True, 'symmetrize_mode': 'mutual', 'use_snp_selection': True, 'num_snps': 2074}. Best is trial 6 with value: 0.1230570001346002.
[I 2025-11-03 11:46:21,413] Trial 36 finished with value: 0.1044053333385983 and parameters: {'model_type': 'graphsage', 'hidden_dims': '[256, 128]', 'dropout': 0.3729515038313109, 'batch_norm': True, 'lr': 0.00017317344701923648, 'weight_decay': 0.00039780905419491776, 'epochs': 141, 'loss': 'mse', 'optimizer': 'adam', 'graph_mode': 'cutoff', 'cutoff': 0.42596163795855535, 'grm_norm': 'cosine', 'self_loops': True, 'use_snp_selection': False}. Best is trial 6 with value: 0.1230570001346002.
[I 2025-11-03 11:46:23,696] Trial 37 finished with value: 0.07659024211356193 and parameters: {'model_type': 'graphsage', 'hidden_dims': '[512, 128]', 'dropout': 0.30860042226365236, 'batch_norm': False, 'lr': 0.000632627596329511, 'weight_decay': 0.0006770548557360416, 'epochs': 175, 'loss': 'mae', 'optimizer': 'adam', 'graph_mode': 'knn', 'source': 'grm', 'knn_k': 9, 'weighted_edges': True, 'symmetrize_mode': 'mutual', 'use_snp_selection': True, 'num_snps': 15344}. Best is trial 6 with value: 0.1230570001346002.
[I 2025-11-03 11:46:25,790] Trial 38 finished with value: 0.0997176432853239 and parameters: {'model_type': 'graphsage', 'hidden_dims': '[256, 128, 64]', 'dropout': 0.4237050165947882, 'batch_norm': True, 'lr': 0.00037142296533542666, 'weight_decay': 4.273313729697462e-06, 'epochs': 112, 'loss': 'mse', 'optimizer': 'adam', 'graph_mode': 'cutoff', 'cutoff': 0.2236606579884875, 'grm_norm': 'cosine_then_gcn', 'self_loops': True, 'use_snp_selection': False}. Best is trial 6 with value: 0.1230570001346002.
[I 2025-11-03 11:46:30,772] Trial 39 finished with value: 0.07287533256062918 and parameters: {'model_type': 'graphsage', 'hidden_dims': '[512, 256]', 'dropout': 0.2729094843743982, 'batch_norm': False, 'lr': 0.0001076918198153438, 'weight_decay': 2.154468861026708e-05, 'epochs': 232, 'loss': 'mae', 'optimizer': 'adam', 'graph_mode': 'knn', 'source': 'grm', 'knn_k': 2, 'weighted_edges': True, 'symmetrize_mode': 'mutual', 'use_snp_selection': True, 'num_snps': 58379}. Best is trial 6 with value: 0.1230570001346002.
[I 2025-11-03 11:46:33,864] Trial 40 finished with value: 0.0942905805744869 and parameters: {'model_type': 'graphsage', 'hidden_dims': '[512, 128]', 'dropout': 0.31515341628581506, 'batch_norm': True, 'lr': 5.2951427322088835e-05, 'weight_decay': 5.9693970044524144e-05, 'epochs': 168, 'loss': 'mae', 'optimizer': 'adam', 'graph_mode': 'cutoff', 'cutoff': 0.8775832147217085, 'grm_norm': 'cosine', 'self_loops': True, 'use_snp_selection': False}. Best is trial 6 with value: 0.1230570001346002.
[I 2025-11-03 11:46:37,118] Trial 41 finished with value: 0.10253728165675949 and parameters: {'model_type': 'graphsage', 'hidden_dims': '[512, 128]', 'dropout': 0.402049779397978, 'batch_norm': True, 'lr': 0.000568927624788031, 'weight_decay': 0.00011496411606771321, 'epochs': 188, 'loss': 'mae', 'optimizer': 'adam', 'graph_mode': 'knn', 'source': 'grm', 'knn_k': 1, 'weighted_edges': True, 'symmetrize_mode': 'mutual', 'use_snp_selection': False}. Best is trial 6 with value: 0.1230570001346002.
[I 2025-11-03 11:46:40,465] Trial 42 finished with value: 0.10344004098158377 and parameters: {'model_type': 'graphsage', 'hidden_dims': '[512, 128]', 'dropout': 0.38688716985050636, 'batch_norm': True, 'lr': 0.0006738004989038082, 'weight_decay': 0.0002736148729800817, 'epochs': 202, 'loss': 'mae', 'optimizer': 'adam', 'graph_mode': 'knn', 'source': 'grm', 'knn_k': 1, 'weighted_edges': True, 'symmetrize_mode': 'mutual', 'use_snp_selection': False}. Best is trial 6 with value: 0.1230570001346002.
