[I 2025-11-12 15:55:34,407] Trial 144 finished with value: 0.2357065022493773 and parameters: {'model_type': 'graphsage', 'hidden_dims': '[512, 64]', 'dropout': 0.4460962366031751, 'batch_norm': False, 'lr': 3.1565189645887055e-05, 'weight_decay': 0.00042318037408536094, 'epochs': 48, 'loss': 'mae', 'optimizer': 'adam', 'graph_mode': 'cutoff', 'cutoff': 0.2978841262425507, 'grm_norm': 'gcn', 'self_loops': False, 'use_snp_selection': True, 'num_snps': 31555}. Best is trial 52 with value: 0.2676437601376995.
[I 2025-11-12 15:56:46,078] Trial 145 finished with value: 0.24536202160156076 and parameters: {'model_type': 'graphsage', 'hidden_dims': '[512, 64]', 'dropout': 0.4547432751552867, 'batch_norm': False, 'lr': 4.6127542629942594e-05, 'weight_decay': 0.0001262829349714345, 'epochs': 55, 'loss': 'mae', 'optimizer': 'adam', 'graph_mode': 'cutoff', 'cutoff': 0.5155091720237668, 'grm_norm': 'gcn', 'self_loops': False, 'use_snp_selection': True, 'num_snps': 26908}. Best is trial 52 with value: 0.2676437601376995.
[I 2025-11-12 15:58:06,937] Trial 146 finished with value: 0.26571898985318393 and parameters: {'model_type': 'graphsage', 'hidden_dims': '[512, 64]', 'dropout': 0.4410750662988528, 'batch_norm': False, 'lr': 2.7216997510638053e-05, 'weight_decay': 9.993986447627734e-05, 'epochs': 59, 'loss': 'mae', 'optimizer': 'adam', 'graph_mode': 'cutoff', 'cutoff': 0.4363421834188585, 'grm_norm': 'gcn', 'self_loops': False, 'use_snp_selection': True, 'num_snps': 29898}. Best is trial 52 with value: 0.2676437601376995.
[I 2025-11-12 15:59:57,579] Trial 147 finished with value: 0.24067187287553554 and parameters: {'model_type': 'graphsage', 'hidden_dims': '[512, 64]', 'dropout': 0.438573839040604, 'batch_norm': False, 'lr': 2.756745912647128e-05, 'weight_decay': 0.00010704588474266253, 'epochs': 62, 'loss': 'mae', 'optimizer': 'adam', 'graph_mode': 'cutoff', 'cutoff': 0.275477659950736, 'grm_norm': 'gcn', 'self_loops': False, 'use_snp_selection': True, 'num_snps': 36814}. Best is trial 52 with value: 0.2676437601376995.
[I 2025-11-12 16:01:02,976] Trial 148 finished with value: 0.24694702271003388 and parameters: {'model_type': 'graphsage', 'hidden_dims': '[512, 64]', 'dropout': 0.42290537704498066, 'batch_norm': False, 'lr': 3.5521405365435765e-05, 'weight_decay': 0.00027552262004926285, 'epochs': 42, 'loss': 'mae', 'optimizer': 'adam', 'graph_mode': 'cutoff', 'cutoff': 0.4418903150266472, 'grm_norm': 'gcn', 'self_loops': False, 'use_snp_selection': True, 'num_snps': 22611}. Best is trial 52 with value: 0.2676437601376995.
[I 2025-11-12 16:02:51,598] Trial 149 finished with value: 0.23838205459393996 and parameters: {'model_type': 'graphsage', 'hidden_dims': '[512, 64]', 'dropout': 0.40692298873712585, 'batch_norm': False, 'lr': 2.5578663570657997e-05, 'weight_decay': 6.931803154725835e-05, 'epochs': 53, 'loss': 'mae', 'optimizer': 'adam', 'graph_mode': 'knn', 'source': 'grm', 'knn_k': 8, 'weighted_edges': True, 'symmetrize_mode': 'union', 'use_snp_selection': True, 'num_snps': 35289}. Best is trial 52 with value: 0.2676437601376995.
[I 2025-11-12 16:05:11,306] Trial 0 finished with value: 0.13928443600854856 and parameters: {'model_type': 'graphsage', 'hidden_dims': '[128, 64]', 'dropout': 0.199031432379812, 'batch_norm': True, 'lr': 1.8408544111075837e-06, 'weight_decay': 5.5136510071208614e-05, 'epochs': 336, 'loss': 'mae', 'optimizer': 'adam', 'graph_mode': 'knn', 'source': 'grm', 'knn_k': 8, 'weighted_edges': True, 'symmetrize_mode': 'mutual', 'use_snp_selection': False}. Best is trial 0 with value: 0.13928443600854856.
[I 2025-11-12 16:05:57,788] Trial 1 finished with value: 0.21753598859175635 and parameters: {'model_type': 'graphsage', 'hidden_dims': '[128, 64]', 'dropout': 0.40051947670227217, 'batch_norm': True, 'lr': 0.0005320428882732732, 'weight_decay': 1.89210117736594e-06, 'epochs': 68, 'loss': 'mse', 'optimizer': 'adam', 'graph_mode': 'knn', 'source': 'grm', 'knn_k': 7, 'weighted_edges': True, 'symmetrize_mode': 'union', 'use_snp_selection': False}. Best is trial 1 with value: 0.21753598859175635.
[I 2025-11-12 16:07:10,465] Trial 2 finished with value: 0.1867556219840689 and parameters: {'model_type': 'graphsage', 'hidden_dims': '[256, 128]', 'dropout': 0.5105528289184642, 'batch_norm': False, 'lr': 0.0006804279372404962, 'weight_decay': 0.0008922815224257085, 'epochs': 181, 'loss': 'mse', 'optimizer': 'adam', 'graph_mode': 'cutoff', 'cutoff': 0.5741905641612706, 'grm_norm': 'gcn', 'self_loops': False, 'use_snp_selection': True, 'num_snps': 26910}. Best is trial 1 with value: 0.21753598859175635.
[I 2025-11-12 16:08:31,252] Trial 3 finished with value: 0.2520343013275527 and parameters: {'model_type': 'graphsage', 'hidden_dims': '[256, 128, 64]', 'dropout': 0.5390483213624292, 'batch_norm': False, 'lr': 3.4705625989073525e-05, 'weight_decay': 2.4623319020131338e-05, 'epochs': 121, 'loss': 'mse', 'optimizer': 'adam', 'graph_mode': 'knn', 'source': 'grm', 'knn_k': 6, 'weighted_edges': False, 'symmetrize_mode': 'mutual', 'use_snp_selection': True, 'num_snps': 30713}. Best is trial 3 with value: 0.2520343013275527.
[I 2025-11-12 16:09:32,292] Trial 4 finished with value: 0.2635881471921455 and parameters: {'model_type': 'graphsage', 'hidden_dims': '[128, 64]', 'dropout': 0.13404863676897502, 'batch_norm': False, 'lr': 0.0001431556295367288, 'weight_decay': 2.2084517750726675e-05, 'epochs': 51, 'loss': 'mae', 'optimizer': 'adam', 'graph_mode': 'cutoff', 'cutoff': 0.6714268476993044, 'grm_norm': 'none', 'self_loops': False, 'use_snp_selection': True, 'num_snps': 45645}. Best is trial 4 with value: 0.2635881471921455.
[I 2025-11-12 16:11:03,824] Trial 5 finished with value: 0.2393168080790113 and parameters: {'model_type': 'graphsage', 'hidden_dims': '[256, 128]', 'dropout': 0.42253606323412096, 'batch_norm': False, 'lr': 4.238630400638805e-05, 'weight_decay': 8.074086040046576e-07, 'epochs': 158, 'loss': 'mae', 'optimizer': 'adam', 'graph_mode': 'knn', 'source': 'grm', 'knn_k': 1, 'weighted_edges': False, 'symmetrize_mode': 'mutual', 'use_snp_selection': True, 'num_snps': 43113}. Best is trial 4 with value: 0.2635881471921455.
[I 2025-11-12 16:13:26,756] Trial 6 finished with value: 0.2309792696168957 and parameters: {'model_type': 'graphsage', 'hidden_dims': '[512, 256]', 'dropout': 0.3534893146320237, 'batch_norm': True, 'lr': 0.000251307964226932, 'weight_decay': 1.821819791794022e-05, 'epochs': 223, 'loss': 'mae', 'optimizer': 'adam', 'graph_mode': 'knn', 'source': 'grm', 'knn_k': 1, 'weighted_edges': True, 'symmetrize_mode': 'mutual', 'use_snp_selection': False}. Best is trial 4 with value: 0.2635881471921455.
[I 2025-11-12 16:15:28,538] Trial 7 finished with value: 0.22639709873768035 and parameters: {'model_type': 'graphsage', 'hidden_dims': '[512, 256]', 'dropout': 0.1105825955860775, 'batch_norm': True, 'lr': 2.374338412754043e-05, 'weight_decay': 1.1284721123340274e-05, 'epochs': 190, 'loss': 'mse', 'optimizer': 'adam', 'graph_mode': 'cutoff', 'cutoff': 0.719872204109604, 'grm_norm': 'gcn', 'self_loops': False, 'use_snp_selection': False}. Best is trial 4 with value: 0.2635881471921455.
[I 2025-11-12 16:17:09,070] Trial 8 finished with value: 0.23437253084590118 and parameters: {'model_type': 'graphsage', 'hidden_dims': '[512, 128]', 'dropout': 0.5066580418354021, 'batch_norm': True, 'lr': 0.00039213678276659976, 'weight_decay': 3.43655320802934e-06, 'epochs': 120, 'loss': 'mse', 'optimizer': 'adam', 'graph_mode': 'cutoff', 'cutoff': 0.34923059576505366, 'grm_norm': 'cosine', 'self_loops': True, 'use_snp_selection': False}. Best is trial 4 with value: 0.2635881471921455.
[I 2025-11-12 16:18:17,996] Trial 9 finished with value: 0.23544179758409203 and parameters: {'model_type': 'graphsage', 'hidden_dims': '[512, 256]', 'dropout': 0.301734920240333, 'batch_norm': False, 'lr': 6.650961854953448e-06, 'weight_decay': 6.861575656590315e-05, 'epochs': 150, 'loss': 'mae', 'optimizer': 'adam', 'graph_mode': 'cutoff', 'cutoff': 0.2857569870061939, 'grm_norm': 'cosine_then_gcn', 'self_loops': False, 'use_snp_selection': True, 'num_snps': 12722}. Best is trial 4 with value: 0.2635881471921455.
[I 2025-11-12 16:19:45,628] Trial 10 finished with value: 0.1401912798371882 and parameters: {'model_type': 'graphsage', 'hidden_dims': '[512, 64]', 'dropout': 0.22492338276159776, 'batch_norm': False, 'lr': 0.00014233761188460356, 'weight_decay': 1.8772904431456567e-07, 'epochs': 41, 'loss': 'mae', 'optimizer': 'adam', 'graph_mode': 'cutoff', 'cutoff': 0.8740100033033124, 'grm_norm': 'none', 'self_loops': True, 'use_snp_selection': True, 'num_snps': 58960}. Best is trial 4 with value: 0.2635881471921455.
[I 2025-11-12 16:21:27,927] Trial 11 finished with value: 0.21421736178155934 and parameters: {'model_type': 'graphsage', 'hidden_dims': '[256, 128, 64]', 'dropout': 0.5994089069221873, 'batch_norm': False, 'lr': 8.25287866247181e-05, 'weight_decay': 0.0002205522163250003, 'epochs': 94, 'loss': 'mse', 'optimizer': 'adam', 'graph_mode': 'knn', 'source': 'grm', 'knn_k': 5, 'weighted_edges': False, 'symmetrize_mode': 'union', 'use_snp_selection': True, 'num_snps': 38963}. Best is trial 4 with value: 0.2635881471921455.
[I 2025-11-12 16:23:02,718] Trial 12 finished with value: 0.24567328217733567 and parameters: {'model_type': 'graphsage', 'hidden_dims': '[256, 128, 64]', 'dropout': 0.10852296509461337, 'batch_norm': False, 'lr': 1.6075293249126023e-05, 'weight_decay': 4.159401756974887e-05, 'epochs': 259, 'loss': 'mae', 'optimizer': 'adam', 'graph_mode': 'cutoff', 'cutoff': 0.5157485749757096, 'grm_norm': 'none', 'self_loops': False, 'use_snp_selection': True, 'num_snps': 30790}. Best is trial 4 with value: 0.2635881471921455.
[I 2025-11-12 16:25:18,147] Trial 13 finished with value: 0.2426161640072813 and parameters: {'model_type': 'graphsage', 'hidden_dims': '[256, 128, 64]', 'dropout': 0.5843082786028272, 'batch_norm': False, 'lr': 6.992587711753582e-05, 'weight_decay': 4.973467440708404e-06, 'epochs': 106, 'loss': 'mse', 'optimizer': 'adam', 'graph_mode': 'knn', 'source': 'grm', 'knn_k': 10, 'weighted_edges': False, 'symmetrize_mode': 'mutual', 'use_snp_selection': True, 'num_snps': 51436}. Best is trial 4 with value: 0.2635881471921455.
[I 2025-11-12 16:26:06,216] Trial 14 finished with value: 0.22688628204978306 and parameters: {'model_type': 'graphsage', 'hidden_dims': '[128, 64]', 'dropout': 0.2431693408055321, 'batch_norm': False, 'lr': 6.728628530366481e-06, 'weight_decay': 0.00022828589047768893, 'epochs': 41, 'loss': 'mae', 'optimizer': 'adam', 'graph_mode': 'cutoff', 'cutoff': 0.7154802468613564, 'grm_norm': 'none', 'self_loops': False, 'use_snp_selection': True, 'num_snps': 22268}. Best is trial 4 with value: 0.2635881471921455.
[I 2025-11-12 16:26:50,732] Trial 15 finished with value: 0.16517006664134187 and parameters: {'model_type': 'graphsage', 'hidden_dims': '[512, 128]', 'dropout': 0.47025822868335876, 'batch_norm': False, 'lr': 0.00017512950821976263, 'weight_decay': 2.2787397405608774e-05, 'epochs': 123, 'loss': 'mse', 'optimizer': 'adam', 'graph_mode': 'knn', 'source': 'grm', 'knn_k': 4, 'weighted_edges': False, 'symmetrize_mode': 'mutual', 'use_snp_selection': True, 'num_snps': 2799}. Best is trial 4 with value: 0.2635881471921455.
[I 2025-11-12 16:28:15,316] Trial 16 finished with value: 0.2501308711030394 and parameters: {'model_type': 'graphsage', 'hidden_dims': '[512, 64]', 'dropout': 0.2990024808757039, 'batch_norm': False, 'lr': 1.263934335632705e-05, 'weight_decay': 5.90675653527182e-07, 'epochs': 70, 'loss': 'mse', 'optimizer': 'adam', 'graph_mode': 'cutoff', 'cutoff': 0.4985514132192289, 'grm_norm': 'cosine_then_gcn', 'self_loops': True, 'use_snp_selection': True, 'num_snps': 39339}. Best is trial 4 with value: 0.2635881471921455.
[I 2025-11-12 16:31:12,512] Trial 17 finished with value: 0.21836532754651206 and parameters: {'model_type': 'graphsage', 'hidden_dims': '[256, 128, 64]', 'dropout': 0.17152105508100177, 'batch_norm': False, 'lr': 1.2443923937739731e-06, 'weight_decay': 0.00019494652270657584, 'epochs': 246, 'loss': 'mae', 'optimizer': 'adam', 'graph_mode': 'knn', 'source': 'grm', 'knn_k': 3, 'weighted_edges': False, 'symmetrize_mode': 'union', 'use_snp_selection': True, 'num_snps': 47994}. Best is trial 4 with value: 0.2635881471921455.
[I 2025-11-12 16:32:09,693] Trial 18 finished with value: 0.2389255502389621 and parameters: {'model_type': 'graphsage', 'hidden_dims': '[128, 64]', 'dropout': 0.3002028883397685, 'batch_norm': False, 'lr': 4.9095005731105975e-05, 'weight_decay': 7.455062504114869e-06, 'epochs': 79, 'loss': 'mse', 'optimizer': 'adam', 'graph_mode': 'knn', 'source': 'grm', 'knn_k': 7, 'weighted_edges': False, 'symmetrize_mode': 'mutual', 'use_snp_selection': True, 'num_snps': 21614}. Best is trial 4 with value: 0.2635881471921455.
[I 2025-11-12 16:33:25,659] Trial 19 finished with value: 0.2136061039953121 and parameters: {'model_type': 'graphsage', 'hidden_dims': '[256, 128, 64]', 'dropout': 0.5424414860459843, 'batch_norm': False, 'lr': 0.00010950449487938709, 'weight_decay': 9.470045018160903e-05, 'epochs': 140, 'loss': 'mae', 'optimizer': 'adam', 'graph_mode': 'cutoff', 'cutoff': 0.8905947358709725, 'grm_norm': 'cosine', 'self_loops': False, 'use_snp_selection': True, 'num_snps': 34690}. Best is trial 4 with value: 0.2635881471921455.
[I 2025-11-12 16:35:10,873] Trial 20 finished with value: 0.0770149557409846 and parameters: {'model_type': 'graphsage', 'hidden_dims': '[128, 64]', 'dropout': 0.4199966049732131, 'batch_norm': False, 'lr': 0.0009995809208113741, 'weight_decay': 0.0006027337862100822, 'epochs': 312, 'loss': 'mse', 'optimizer': 'adam', 'graph_mode': 'cutoff', 'cutoff': 0.705916671355068, 'grm_norm': 'none', 'self_loops': True, 'use_snp_selection': True, 'num_snps': 51742}. Best is trial 4 with value: 0.2635881471921455.
[I 2025-11-12 16:36:38,904] Trial 21 finished with value: 0.24616314667285702 and parameters: {'model_type': 'graphsage', 'hidden_dims': '[512, 64]', 'dropout': 0.2699835799945552, 'batch_norm': False, 'lr': 1.0943232142211846e-05, 'weight_decay': 1.2711971377409182e-07, 'epochs': 66, 'loss': 'mse', 'optimizer': 'adam', 'graph_mode': 'cutoff', 'cutoff': 0.45697114628620655, 'grm_norm': 'cosine_then_gcn', 'self_loops': True, 'use_snp_selection': True, 'num_snps': 39711}. Best is trial 4 with value: 0.2635881471921455.
[I 2025-11-12 16:38:13,566] Trial 22 finished with value: 0.21928780849133603 and parameters: {'model_type': 'graphsage', 'hidden_dims': '[512, 64]', 'dropout': 0.16092840053275612, 'batch_norm': False, 'lr': 3.9490667991822726e-06, 'weight_decay': 5.118395777755228e-07, 'epochs': 90, 'loss': 'mse', 'optimizer': 'adam', 'graph_mode': 'cutoff', 'cutoff': 0.6301237851716812, 'grm_norm': 'cosine_then_gcn', 'self_loops': True, 'use_snp_selection': True, 'num_snps': 44431}. Best is trial 4 with value: 0.2635881471921455.
[I 2025-11-12 16:39:28,250] Trial 23 finished with value: 0.2683766351477281 and parameters: {'model_type': 'graphsage', 'hidden_dims': '[512, 64]', 'dropout': 0.347660980263511, 'batch_norm': False, 'lr': 2.632810655243636e-05, 'weight_decay': 1.985983602858351e-06, 'epochs': 55, 'loss': 'mse', 'optimizer': 'adam', 'graph_mode': 'cutoff', 'cutoff': 0.4325723120077534, 'grm_norm': 'cosine_then_gcn', 'self_loops': True, 'use_snp_selection': True, 'num_snps': 32990}. Best is trial 23 with value: 0.2683766351477281.
[I 2025-11-12 16:40:35,354] Trial 24 finished with value: 0.24625202496942183 and parameters: {'model_type': 'graphsage', 'hidden_dims': '[512, 64]', 'dropout': 0.36246484649767186, 'batch_norm': False, 'lr': 2.9181104978990582e-05, 'weight_decay': 1.964530614425709e-06, 'epochs': 41, 'loss': 'mse', 'optimizer': 'adam', 'graph_mode': 'cutoff', 'cutoff': 0.38258046488162717, 'grm_norm': 'none', 'self_loops': False, 'use_snp_selection': True, 'num_snps': 30944}. Best is trial 23 with value: 0.2683766351477281.
[I 2025-11-12 16:42:13,630] Trial 25 finished with value: 0.2435099227218632 and parameters: {'model_type': 'graphsage', 'hidden_dims': '[512, 128]', 'dropout': 0.4776495763450488, 'batch_norm': False, 'lr': 4.812791832079995e-05, 'weight_decay': 2.6213764752666e-05, 'epochs': 109, 'loss': 'mse', 'optimizer': 'adam', 'graph_mode': 'cutoff', 'cutoff': 0.20567632628370863, 'grm_norm': 'cosine_then_gcn', 'self_loops': True, 'use_snp_selection': True, 'num_snps': 22991}. Best is trial 23 with value: 0.2683766351477281.
[I 2025-11-12 16:43:15,697] Trial 26 finished with value: 0.19511046865440798 and parameters: {'model_type': 'graphsage', 'hidden_dims': '[256, 128]', 'dropout': 0.3923531266364781, 'batch_norm': True, 'lr': 2.296965167558613e-05, 'weight_decay': 1.1212255817523556e-05, 'epochs': 58, 'loss': 'mae', 'optimizer': 'adam', 'graph_mode': 'knn', 'source': 'grm', 'knn_k': 9, 'weighted_edges': True, 'symmetrize_mode': 'union', 'use_snp_selection': False}. Best is trial 23 with value: 0.2683766351477281.
[I 2025-11-12 16:44:03,832] Trial 27 finished with value: 0.2199588741744421 and parameters: {'model_type': 'graphsage', 'hidden_dims': '[128, 64]', 'dropout': 0.4565717380711648, 'batch_norm': False, 'lr': 0.0002575682585415158, 'weight_decay': 2.3358618016017455e-06, 'epochs': 134, 'loss': 'mse', 'optimizer': 'adam', 'graph_mode': 'cutoff', 'cutoff': 0.6193878067562226, 'grm_norm': 'gcn', 'self_loops': True, 'use_snp_selection': True, 'num_snps': 13605}. Best is trial 23 with value: 0.2683766351477281.
[I 2025-11-12 16:45:43,824] Trial 28 finished with value: 0.2565132793890688 and parameters: {'model_type': 'graphsage', 'hidden_dims': '[256, 128, 64]', 'dropout': 0.142395166731469, 'batch_norm': False, 'lr': 8.157370612161231e-05, 'weight_decay': 5.286100027236066e-06, 'epochs': 161, 'loss': 'mae', 'optimizer': 'adam', 'graph_mode': 'knn', 'source': 'grm', 'knn_k': 6, 'weighted_edges': False, 'symmetrize_mode': 'mutual', 'use_snp_selection': True, 'num_snps': 34156}. Best is trial 23 with value: 0.2683766351477281.
[I 2025-11-12 16:49:31,551] Trial 29 finished with value: 0.2273026097294451 and parameters: {'model_type': 'graphsage', 'hidden_dims': '[512, 64]', 'dropout': 0.15364872729778786, 'batch_norm': True, 'lr': 7.563500808341193e-05, 'weight_decay': 1.1234463293624949e-06, 'epochs': 336, 'loss': 'mae', 'optimizer': 'adam', 'graph_mode': 'knn', 'source': 'grm', 'knn_k': 4, 'weighted_edges': False, 'symmetrize_mode': 'mutual', 'use_snp_selection': False}. Best is trial 23 with value: 0.2683766351477281.
[I 2025-11-12 16:51:12,723] Trial 30 finished with value: 0.22274656932266618 and parameters: {'model_type': 'graphsage', 'hidden_dims': '[128, 64]', 'dropout': 0.17820912370617153, 'batch_norm': False, 'lr': 0.0002150315813571441, 'weight_decay': 5.465905163695794e-06, 'epochs': 221, 'loss': 'mae', 'optimizer': 'adam', 'graph_mode': 'cutoff', 'cutoff': 0.7995439720908208, 'grm_norm': 'cosine', 'self_loops': False, 'use_snp_selection': True, 'num_snps': 58767}. Best is trial 23 with value: 0.2683766351477281.
[I 2025-11-12 16:52:53,418] Trial 31 finished with value: 0.252961227914541 and parameters: {'model_type': 'graphsage', 'hidden_dims': '[256, 128, 64]', 'dropout': 0.22133118790094286, 'batch_norm': False, 'lr': 0.00010183509747287868, 'weight_decay': 4.001061338286775e-05, 'epochs': 168, 'loss': 'mae', 'optimizer': 'adam', 'graph_mode': 'knn', 'source': 'grm', 'knn_k': 6, 'weighted_edges': False, 'symmetrize_mode': 'mutual', 'use_snp_selection': True, 'num_snps': 34118}. Best is trial 23 with value: 0.2683766351477281.
[I 2025-11-12 16:54:38,097] Trial 32 finished with value: 0.24200809828985476 and parameters: {'model_type': 'graphsage', 'hidden_dims': '[256, 128, 64]', 'dropout': 0.2178884493790915, 'batch_norm': False, 'lr': 0.0001286974599174936, 'weight_decay': 4.211813495399825e-05, 'epochs': 172, 'loss': 'mae', 'optimizer': 'adam', 'graph_mode': 'knn', 'source': 'grm', 'knn_k': 6, 'weighted_edges': False, 'symmetrize_mode': 'mutual', 'use_snp_selection': True, 'num_snps': 35669}. Best is trial 23 with value: 0.2683766351477281.
[I 2025-11-12 16:56:50,803] Trial 33 finished with value: 0.24479696972116138 and parameters: {'model_type': 'graphsage', 'hidden_dims': '[256, 128, 64]', 'dropout': 0.12601456632906924, 'batch_norm': False, 'lr': 0.0003991610363396959, 'weight_decay': 1.1724200599705556e-05, 'epochs': 210, 'loss': 'mae', 'optimizer': 'adam', 'graph_mode': 'knn', 'source': 'grm', 'knn_k': 8, 'weighted_edges': False, 'symmetrize_mode': 'mutual', 'use_snp_selection': True, 'num_snps': 35712}. Best is trial 23 with value: 0.2683766351477281.
[I 2025-11-12 16:58:10,848] Trial 34 finished with value: 0.24198202287025078 and parameters: {'model_type': 'graphsage', 'hidden_dims': '[256, 128, 64]', 'dropout': 0.13540742808182837, 'batch_norm': False, 'lr': 6.462376438143855e-05, 'weight_decay': 3.897752716126107e-06, 'epochs': 164, 'loss': 'mae', 'optimizer': 'adam', 'graph_mode': 'knn', 'source': 'grm', 'knn_k': 5, 'weighted_edges': False, 'symmetrize_mode': 'mutual', 'use_snp_selection': True, 'num_snps': 25395}. Best is trial 23 with value: 0.2683766351477281.
[I 2025-11-12 17:00:31,165] Trial 35 finished with value: 0.24147016873398292 and parameters: {'model_type': 'graphsage', 'hidden_dims': '[256, 128]', 'dropout': 0.19402239528611437, 'batch_norm': False, 'lr': 0.00010422239275886247, 'weight_decay': 1.4054488891141067e-06, 'epochs': 281, 'loss': 'mae', 'optimizer': 'adam', 'graph_mode': 'knn', 'source': 'grm', 'knn_k': 3, 'weighted_edges': False, 'symmetrize_mode': 'mutual', 'use_snp_selection': True, 'num_snps': 43885}. Best is trial 23 with value: 0.2683766351477281.
