[I 2025-11-03 16:18:45,326] Trial 58 finished with value: 0.09910636630823118 and parameters: {'model_type': 'graphsage', 'hidden_dims': '[256, 128, 64]', 'dropout': 0.43294140849716894, 'batch_norm': True, 'lr': 4.738985757068415e-05, 'weight_decay': 2.1865993558124993e-06, 'epochs': 216, 'loss': 'mae', 'optimizer': 'adam', 'graph_mode': 'knn', 'source': 'grm', 'knn_k': 8, 'weighted_edges': False, 'symmetrize_mode': 'mutual', 'use_snp_selection': False}. Best is trial 22 with value: 0.146581783007024.
[I 2025-11-03 16:18:49,899] Trial 59 finished with value: 0.13056486188240676 and parameters: {'model_type': 'graphsage', 'hidden_dims': '[512, 128]', 'dropout': 0.521843150089055, 'batch_norm': True, 'lr': 0.0002616298468413822, 'weight_decay': 3.6260377118935723e-07, 'epochs': 197, 'loss': 'mae', 'optimizer': 'adam', 'graph_mode': 'knn', 'source': 'grm', 'knn_k': 2, 'weighted_edges': True, 'symmetrize_mode': 'union', 'use_snp_selection': False}. Best is trial 22 with value: 0.146581783007024.
[I 2025-11-03 16:18:52,934] Trial 60 finished with value: 0.08077160170372255 and parameters: {'model_type': 'graphsage', 'hidden_dims': '[512, 64]', 'dropout': 0.4826656963088399, 'batch_norm': False, 'lr': 0.00017588827026388272, 'weight_decay': 2.2152485214338882e-07, 'epochs': 235, 'loss': 'mse', 'optimizer': 'adam', 'graph_mode': 'knn', 'source': 'grm', 'knn_k': 3, 'weighted_edges': True, 'symmetrize_mode': 'union', 'use_snp_selection': True, 'num_snps': 19019}. Best is trial 22 with value: 0.146581783007024.
[I 2025-11-03 16:18:57,935] Trial 61 finished with value: 0.15093816360275758 and parameters: {'model_type': 'graphsage', 'hidden_dims': '[256, 128, 64]', 'dropout': 0.36719906269976255, 'batch_norm': True, 'lr': 0.00031702223982024914, 'weight_decay': 4.885767206249536e-05, 'epochs': 295, 'loss': 'mse', 'optimizer': 'adam', 'graph_mode': 'cutoff', 'cutoff': 0.21573255994042623, 'grm_norm': 'none', 'self_loops': True, 'use_snp_selection': False}. Best is trial 61 with value: 0.15093816360275758.
[I 2025-11-03 16:19:01,041] Trial 62 finished with value: 0.15150251319229463 and parameters: {'model_type': 'graphsage', 'hidden_dims': '[256, 128, 64]', 'dropout': 0.31459101061897315, 'batch_norm': True, 'lr': 0.0004798156332946064, 'weight_decay': 0.00011907084785307365, 'epochs': 246, 'loss': 'mse', 'optimizer': 'adam', 'graph_mode': 'cutoff', 'cutoff': 0.5319924128142648, 'grm_norm': 'none', 'self_loops': True, 'use_snp_selection': False}. Best is trial 62 with value: 0.15150251319229463.
[I 2025-11-03 16:19:04,400] Trial 63 finished with value: 0.12375636653822426 and parameters: {'model_type': 'graphsage', 'hidden_dims': '[256, 128, 64]', 'dropout': 0.3410029475821083, 'batch_norm': True, 'lr': 0.00047899493988672184, 'weight_decay': 0.00022642662440276333, 'epochs': 284, 'loss': 'mse', 'optimizer': 'adam', 'graph_mode': 'cutoff', 'cutoff': 0.541936338006385, 'grm_norm': 'none', 'self_loops': True, 'use_snp_selection': False}. Best is trial 62 with value: 0.15150251319229463.
[I 2025-11-03 16:19:09,084] Trial 64 finished with value: 0.15028602410515443 and parameters: {'model_type': 'graphsage', 'hidden_dims': '[256, 128, 64]', 'dropout': 0.3121149163690875, 'batch_norm': True, 'lr': 0.0003169719879932988, 'weight_decay': 0.00012486077696755588, 'epochs': 263, 'loss': 'mse', 'optimizer': 'adam', 'graph_mode': 'cutoff', 'cutoff': 0.20634497102267768, 'grm_norm': 'none', 'self_loops': True, 'use_snp_selection': False}. Best is trial 62 with value: 0.15150251319229463.
[I 2025-11-03 16:19:13,140] Trial 65 finished with value: 0.12986693751749837 and parameters: {'model_type': 'graphsage', 'hidden_dims': '[256, 128, 64]', 'dropout': 0.4049747488988573, 'batch_norm': True, 'lr': 0.0003232057934429719, 'weight_decay': 0.0001508244846184078, 'epochs': 248, 'loss': 'mse', 'optimizer': 'adam', 'graph_mode': 'cutoff', 'cutoff': 0.25083033333538823, 'grm_norm': 'none', 'self_loops': True, 'use_snp_selection': False}. Best is trial 62 with value: 0.15150251319229463.
[I 2025-11-03 16:19:16,791] Trial 66 finished with value: 0.1234244200252898 and parameters: {'model_type': 'graphsage', 'hidden_dims': '[256, 128, 64]', 'dropout': 0.3115196554449483, 'batch_norm': True, 'lr': 0.0005540025488238483, 'weight_decay': 8.71195357481492e-05, 'epochs': 268, 'loss': 'mse', 'optimizer': 'adam', 'graph_mode': 'cutoff', 'cutoff': 0.356482000957989, 'grm_norm': 'none', 'self_loops': True, 'use_snp_selection': False}. Best is trial 62 with value: 0.15150251319229463.
[I 2025-11-03 16:19:20,881] Trial 67 finished with value: 0.11739502778351074 and parameters: {'model_type': 'graphsage', 'hidden_dims': '[256, 128, 64]', 'dropout': 0.2736284520511712, 'batch_norm': True, 'lr': 0.0008133335711156345, 'weight_decay': 3.3434110529379606e-05, 'epochs': 310, 'loss': 'mse', 'optimizer': 'adam', 'graph_mode': 'cutoff', 'cutoff': 0.33076493494050485, 'grm_norm': 'none', 'self_loops': True, 'use_snp_selection': False}. Best is trial 62 with value: 0.15150251319229463.
[I 2025-11-03 16:19:25,140] Trial 68 finished with value: 0.1341068910976485 and parameters: {'model_type': 'graphsage', 'hidden_dims': '[256, 128, 64]', 'dropout': 0.39356072479995147, 'batch_norm': True, 'lr': 0.0002771009057096967, 'weight_decay': 0.0001203016258765247, 'epochs': 259, 'loss': 'mse', 'optimizer': 'adam', 'graph_mode': 'cutoff', 'cutoff': 0.24097075193057846, 'grm_norm': 'none', 'self_loops': True, 'use_snp_selection': False}. Best is trial 62 with value: 0.15150251319229463.
[I 2025-11-03 16:19:30,294] Trial 69 finished with value: 0.15410698700909709 and parameters: {'model_type': 'graphsage', 'hidden_dims': '[256, 128, 64]', 'dropout': 0.353334680505514, 'batch_norm': True, 'lr': 0.00037900181744582664, 'weight_decay': 0.0003356995984819312, 'epochs': 294, 'loss': 'mse', 'optimizer': 'adam', 'graph_mode': 'cutoff', 'cutoff': 0.20078795387801485, 'grm_norm': 'none', 'self_loops': True, 'use_snp_selection': False}. Best is trial 69 with value: 0.15410698700909709.
[I 2025-11-03 16:19:35,416] Trial 70 finished with value: 0.15210584259396745 and parameters: {'model_type': 'graphsage', 'hidden_dims': '[256, 128, 64]', 'dropout': 0.3454064554129781, 'batch_norm': True, 'lr': 0.0004195652830684498, 'weight_decay': 0.0003767211033051496, 'epochs': 301, 'loss': 'mse', 'optimizer': 'adam', 'graph_mode': 'cutoff', 'cutoff': 0.20958890601140123, 'grm_norm': 'none', 'self_loops': True, 'use_snp_selection': False}. Best is trial 69 with value: 0.15410698700909709.
[I 2025-11-03 16:19:40,934] Trial 71 finished with value: 0.15234527942931023 and parameters: {'model_type': 'graphsage', 'hidden_dims': '[256, 128, 64]', 'dropout': 0.34215394177950315, 'batch_norm': True, 'lr': 0.0004231899288937501, 'weight_decay': 0.00044526013128586743, 'epochs': 330, 'loss': 'mse', 'optimizer': 'adam', 'graph_mode': 'cutoff', 'cutoff': 0.2071139949306173, 'grm_norm': 'none', 'self_loops': True, 'use_snp_selection': False}. Best is trial 69 with value: 0.15410698700909709.
[I 2025-11-03 16:19:46,588] Trial 72 finished with value: 0.14726335716978117 and parameters: {'model_type': 'graphsage', 'hidden_dims': '[256, 128, 64]', 'dropout': 0.3444131309782762, 'batch_norm': True, 'lr': 0.0003896118814144133, 'weight_decay': 0.0004515471177657525, 'epochs': 340, 'loss': 'mse', 'optimizer': 'adam', 'graph_mode': 'cutoff', 'cutoff': 0.2064519909323031, 'grm_norm': 'none', 'self_loops': True, 'use_snp_selection': False}. Best is trial 69 with value: 0.15410698700909709.
[I 2025-11-03 16:19:52,319] Trial 73 finished with value: 0.12939604041499447 and parameters: {'model_type': 'graphsage', 'hidden_dims': '[256, 128, 64]', 'dropout': 0.35432068842766407, 'batch_norm': True, 'lr': 0.0004231710934236326, 'weight_decay': 0.0004399908035330051, 'epochs': 350, 'loss': 'mse', 'optimizer': 'adam', 'graph_mode': 'cutoff', 'cutoff': 0.20901224911760605, 'grm_norm': 'none', 'self_loops': True, 'use_snp_selection': False}. Best is trial 69 with value: 0.15410698700909709.
[I 2025-11-03 16:19:57,940] Trial 74 finished with value: 0.15100869550737295 and parameters: {'model_type': 'graphsage', 'hidden_dims': '[256, 128, 64]', 'dropout': 0.30840377487915416, 'batch_norm': True, 'lr': 0.0003646329249414917, 'weight_decay': 0.0003377620724617913, 'epochs': 330, 'loss': 'mse', 'optimizer': 'adam', 'graph_mode': 'cutoff', 'cutoff': 0.2006374119250086, 'grm_norm': 'none', 'self_loops': True, 'use_snp_selection': False}. Best is trial 69 with value: 0.15410698700909709.
[I 2025-11-03 16:20:03,578] Trial 75 finished with value: 0.14339312365442305 and parameters: {'model_type': 'graphsage', 'hidden_dims': '[256, 128, 64]', 'dropout': 0.30669107395965167, 'batch_norm': True, 'lr': 0.0003841939812999954, 'weight_decay': 0.00040369267908756855, 'epochs': 334, 'loss': 'mse', 'optimizer': 'adam', 'graph_mode': 'cutoff', 'cutoff': 0.20359054292225146, 'grm_norm': 'none', 'self_loops': True, 'use_snp_selection': False}. Best is trial 69 with value: 0.15410698700909709.
[I 2025-11-03 16:20:08,225] Trial 76 finished with value: 0.13487927819753848 and parameters: {'model_type': 'graphsage', 'hidden_dims': '[256, 128, 64]', 'dropout': 0.33660632069837204, 'batch_norm': True, 'lr': 0.000532217708049829, 'weight_decay': 0.00030189375973098317, 'epochs': 328, 'loss': 'mse', 'optimizer': 'adam', 'graph_mode': 'cutoff', 'cutoff': 0.27637139259321347, 'grm_norm': 'none', 'self_loops': True, 'use_snp_selection': False}. Best is trial 69 with value: 0.15410698700909709.
[I 2025-11-03 16:20:13,951] Trial 77 finished with value: 0.13427292604225963 and parameters: {'model_type': 'graphsage', 'hidden_dims': '[256, 128, 64]', 'dropout': 0.31519833066808683, 'batch_norm': True, 'lr': 0.0007359438362315996, 'weight_decay': 0.0007598564195076904, 'epochs': 342, 'loss': 'mse', 'optimizer': 'adam', 'graph_mode': 'cutoff', 'cutoff': 0.20383024244854003, 'grm_norm': 'none', 'self_loops': True, 'use_snp_selection': False}. Best is trial 69 with value: 0.15410698700909709.
[I 2025-11-03 16:20:18,557] Trial 78 finished with value: 0.13973420376042373 and parameters: {'model_type': 'graphsage', 'hidden_dims': '[256, 128, 64]', 'dropout': 0.37721265243751784, 'batch_norm': True, 'lr': 0.000402411445041497, 'weight_decay': 0.0005169879150104046, 'epochs': 321, 'loss': 'mse', 'optimizer': 'adam', 'graph_mode': 'cutoff', 'cutoff': 0.2736982966628454, 'grm_norm': 'none', 'self_loops': True, 'use_snp_selection': False}. Best is trial 69 with value: 0.15410698700909709.
[I 2025-11-03 16:20:21,179] Trial 79 finished with value: 0.142416608689698 and parameters: {'model_type': 'graphsage', 'hidden_dims': '[256, 128, 64]', 'dropout': 0.34666586218051293, 'batch_norm': False, 'lr': 0.00030544329103931794, 'weight_decay': 0.0009408129872010345, 'epochs': 294, 'loss': 'mse', 'optimizer': 'adam', 'graph_mode': 'cutoff', 'cutoff': 0.2599220699011674, 'grm_norm': 'none', 'self_loops': True, 'use_snp_selection': True, 'num_snps': 3682}. Best is trial 69 with value: 0.15410698700909709.
[I 2025-11-03 16:20:26,559] Trial 80 finished with value: 0.14194425186245085 and parameters: {'model_type': 'graphsage', 'hidden_dims': '[256, 128, 64]', 'dropout': 0.2956759289780873, 'batch_norm': True, 'lr': 0.0005327789776120027, 'weight_decay': 0.0002868369780047722, 'epochs': 305, 'loss': 'mse', 'optimizer': 'adam', 'graph_mode': 'cutoff', 'cutoff': 0.20039789859075458, 'grm_norm': 'none', 'self_loops': True, 'use_snp_selection': False}. Best is trial 69 with value: 0.15410698700909709.
[I 2025-11-03 16:20:31,415] Trial 81 finished with value: 0.1410559996325828 and parameters: {'model_type': 'graphsage', 'hidden_dims': '[256, 128, 64]', 'dropout': 0.36751647341898314, 'batch_norm': True, 'lr': 0.0002519209046819525, 'weight_decay': 4.7169104285151676e-05, 'epochs': 325, 'loss': 'mse', 'optimizer': 'adam', 'graph_mode': 'cutoff', 'cutoff': 0.2539349629171899, 'grm_norm': 'none', 'self_loops': True, 'use_snp_selection': False}. Best is trial 69 with value: 0.15410698700909709.
[I 2025-11-03 16:20:35,661] Trial 82 finished with value: 0.12252861668565804 and parameters: {'model_type': 'graphsage', 'hidden_dims': '[256, 128, 64]', 'dropout': 0.3235565368188234, 'batch_norm': True, 'lr': 0.0003643238075150479, 'weight_decay': 1.4913381439534207e-05, 'epochs': 312, 'loss': 'mse', 'optimizer': 'adam', 'graph_mode': 'cutoff', 'cutoff': 0.3066202160402298, 'grm_norm': 'none', 'self_loops': True, 'use_snp_selection': False}. Best is trial 69 with value: 0.15410698700909709.
[I 2025-11-03 16:20:41,329] Trial 83 finished with value: 0.13975625382095497 and parameters: {'model_type': 'graphsage', 'hidden_dims': '[256, 128, 64]', 'dropout': 0.35739169574344504, 'batch_norm': True, 'lr': 0.00044207396502508243, 'weight_decay': 0.0001622676732292846, 'epochs': 336, 'loss': 'mse', 'optimizer': 'adam', 'graph_mode': 'cutoff', 'cutoff': 0.20250224691419177, 'grm_norm': 'none', 'self_loops': True, 'use_snp_selection': False}. Best is trial 69 with value: 0.15410698700909709.
[I 2025-11-03 16:20:45,897] Trial 84 finished with value: 0.13260567674340928 and parameters: {'model_type': 'graphsage', 'hidden_dims': '[256, 128, 64]', 'dropout': 0.2836816449640298, 'batch_norm': True, 'lr': 0.000658380283614669, 'weight_decay': 0.00032515527499339414, 'epochs': 298, 'loss': 'mse', 'optimizer': 'adam', 'graph_mode': 'cutoff', 'cutoff': 0.2541537030603781, 'grm_norm': 'none', 'self_loops': True, 'use_snp_selection': False}. Best is trial 69 with value: 0.15410698700909709.
[I 2025-11-03 16:20:51,075] Trial 85 finished with value: 0.13298836059771274 and parameters: {'model_type': 'graphsage', 'hidden_dims': '[256, 128, 64]', 'dropout': 0.3295438090868709, 'batch_norm': True, 'lr': 0.0008027985598953067, 'weight_decay': 0.00023471460597267367, 'epochs': 342, 'loss': 'mse', 'optimizer': 'adam', 'graph_mode': 'cutoff', 'cutoff': 0.24261537290143506, 'grm_norm': 'gcn', 'self_loops': True, 'use_snp_selection': False}. Best is trial 69 with value: 0.15410698700909709.
[I 2025-11-03 16:20:55,607] Trial 86 finished with value: 0.11781021248487683 and parameters: {'model_type': 'graphsage', 'hidden_dims': '[256, 128, 64]', 'dropout': 0.38301429271290344, 'batch_norm': True, 'lr': 0.00014963914075451326, 'weight_decay': 0.0005728552275553261, 'epochs': 284, 'loss': 'mse', 'optimizer': 'adam', 'graph_mode': 'cutoff', 'cutoff': 0.24244761500189604, 'grm_norm': 'none', 'self_loops': True, 'use_snp_selection': False}. Best is trial 69 with value: 0.15410698700909709.
[I 2025-11-03 16:20:58,811] Trial 87 finished with value: 0.14227509274453964 and parameters: {'model_type': 'graphsage', 'hidden_dims': '[256, 128]', 'dropout': 0.300940647459061, 'batch_norm': True, 'lr': 0.0003140120905242169, 'weight_decay': 0.00010153033750687377, 'epochs': 277, 'loss': 'mse', 'optimizer': 'adam', 'graph_mode': 'cutoff', 'cutoff': 0.610318440645398, 'grm_norm': 'none', 'self_loops': True, 'use_snp_selection': False}. Best is trial 69 with value: 0.15410698700909709.
[I 2025-11-03 16:21:03,128] Trial 88 finished with value: 0.12448154973776851 and parameters: {'model_type': 'graphsage', 'hidden_dims': '[256, 128, 64]', 'dropout': 0.4047981813818852, 'batch_norm': True, 'lr': 0.0002387678935018823, 'weight_decay': 5.2409471368578677e-05, 'epochs': 318, 'loss': 'mse', 'optimizer': 'adam', 'graph_mode': 'cutoff', 'cutoff': 0.3070738652447621, 'grm_norm': 'gcn', 'self_loops': True, 'use_snp_selection': False}. Best is trial 69 with value: 0.15410698700909709.
[I 2025-11-03 16:21:07,917] Trial 89 finished with value: 0.08434320415084234 and parameters: {'model_type': 'graphsage', 'hidden_dims': '[256, 128, 64]', 'dropout': 0.31923948566280413, 'batch_norm': True, 'lr': 1.542494228687977e-05, 'weight_decay': 0.00016637515992818972, 'epochs': 291, 'loss': 'mse', 'optimizer': 'adam', 'graph_mode': 'cutoff', 'cutoff': 0.22576285042729086, 'grm_norm': 'none', 'self_loops': True, 'use_snp_selection': False}. Best is trial 69 with value: 0.15410698700909709.
[I 2025-11-03 16:21:12,446] Trial 90 finished with value: 0.10600567143651816 and parameters: {'model_type': 'graphsage', 'hidden_dims': '[256, 128, 64]', 'dropout': 0.3663613939418603, 'batch_norm': False, 'lr': 0.0005577382446909444, 'weight_decay': 6.664245681150227e-05, 'epochs': 306, 'loss': 'mse', 'optimizer': 'adam', 'graph_mode': 'cutoff', 'cutoff': 0.7866162054136682, 'grm_norm': 'cosine_then_gcn', 'self_loops': False, 'use_snp_selection': True, 'num_snps': 50303}. Best is trial 69 with value: 0.15410698700909709.
[I 2025-11-03 16:21:16,767] Trial 91 finished with value: 0.12175866765875146 and parameters: {'model_type': 'graphsage', 'hidden_dims': '[256, 128, 64]', 'dropout': 0.34318387495757485, 'batch_norm': True, 'lr': 0.00046372261482429186, 'weight_decay': 0.00042235256074938174, 'epochs': 342, 'loss': 'mse', 'optimizer': 'adam', 'graph_mode': 'cutoff', 'cutoff': 0.36280283640128963, 'grm_norm': 'none', 'self_loops': True, 'use_snp_selection': False}. Best is trial 69 with value: 0.15410698700909709.
[I 2025-11-03 16:21:21,142] Trial 92 finished with value: 0.12883028286164633 and parameters: {'model_type': 'graphsage', 'hidden_dims': '[256, 128, 64]', 'dropout': 0.25353286384860196, 'batch_norm': True, 'lr': 0.000279970127692597, 'weight_decay': 0.0007200260401144453, 'epochs': 324, 'loss': 'mse', 'optimizer': 'adam', 'graph_mode': 'cutoff', 'cutoff': 0.30374547621819875, 'grm_norm': 'none', 'self_loops': True, 'use_snp_selection': False}. Best is trial 69 with value: 0.15410698700909709.
[I 2025-11-03 16:21:27,363] Trial 93 finished with value: 0.11332574353811485 and parameters: {'model_type': 'graphsage', 'hidden_dims': '[512, 128]', 'dropout': 0.26111230002095825, 'batch_norm': True, 'lr': 0.00020309490214846023, 'weight_decay': 0.0003733607942890805, 'epochs': 315, 'loss': 'mse', 'optimizer': 'adam', 'graph_mode': 'cutoff', 'cutoff': 0.4028746540881723, 'grm_norm': 'none', 'self_loops': False, 'use_snp_selection': False}. Best is trial 69 with value: 0.15410698700909709.
[I 2025-11-03 16:21:33,818] Trial 94 finished with value: 0.14606203993725314 and parameters: {'model_type': 'graphsage', 'hidden_dims': '[512, 64]', 'dropout': 0.2742076078426487, 'batch_norm': True, 'lr': 0.0003588786901328214, 'weight_decay': 0.00012476366812935467, 'epochs': 303, 'loss': 'mse', 'optimizer': 'adam', 'graph_mode': 'cutoff', 'cutoff': 0.2832375012719901, 'grm_norm': 'cosine', 'self_loops': True, 'use_snp_selection': False}. Best is trial 69 with value: 0.15410698700909709.
[I 2025-11-03 16:21:37,272] Trial 95 finished with value: 0.12673248801220566 and parameters: {'model_type': 'graphsage', 'hidden_dims': '[256, 128, 64]', 'dropout': 0.2921612573480338, 'batch_norm': True, 'lr': 0.00033077329187888215, 'weight_decay': 0.0002003328262020575, 'epochs': 286, 'loss': 'mse', 'optimizer': 'adam', 'graph_mode': 'cutoff', 'cutoff': 0.5046824704592207, 'grm_norm': 'cosine', 'self_loops': True, 'use_snp_selection': False}. Best is trial 69 with value: 0.15410698700909709.
[I 2025-11-03 16:21:44,253] Trial 96 finished with value: 0.13531641037879302 and parameters: {'model_type': 'graphsage', 'hidden_dims': '[512, 64]', 'dropout': 0.273677839838119, 'batch_norm': True, 'lr': 0.00040383279465621645, 'weight_decay': 0.00012535440232064847, 'epochs': 302, 'loss': 'mse', 'optimizer': 'adam', 'graph_mode': 'cutoff', 'cutoff': 0.2336908414883493, 'grm_norm': 'cosine', 'self_loops': True, 'use_snp_selection': False}. Best is trial 69 with value: 0.15410698700909709.
[I 2025-11-03 16:21:47,444] Trial 97 finished with value: 0.13497261189691798 and parameters: {'model_type': 'graphsage', 'hidden_dims': '[256, 128]', 'dropout': 0.24098882944258146, 'batch_norm': True, 'lr': 0.0006113069983965803, 'weight_decay': 0.0002616525376768042, 'epochs': 276, 'loss': 'mse', 'optimizer': 'adam', 'graph_mode': 'cutoff', 'cutoff': 0.6765829078316328, 'grm_norm': 'cosine', 'self_loops': True, 'use_snp_selection': False}. Best is trial 69 with value: 0.15410698700909709.
[I 2025-11-03 16:21:52,010] Trial 98 finished with value: 0.1462537538683372 and parameters: {'model_type': 'graphsage', 'hidden_dims': '[256, 128, 64]', 'dropout': 0.3307371887621206, 'batch_norm': True, 'lr': 0.0004943300875244667, 'weight_decay': 0.0005080501248743023, 'epochs': 330, 'loss': 'mse', 'optimizer': 'adam', 'graph_mode': 'cutoff', 'cutoff': 0.2837454613943279, 'grm_norm': 'cosine_then_gcn', 'self_loops': True, 'use_snp_selection': False}. Best is trial 69 with value: 0.15410698700909709.
[I 2025-11-03 16:21:57,154] Trial 99 finished with value: 0.12977818010376957 and parameters: {'model_type': 'graphsage', 'hidden_dims': '[256, 128, 64]', 'dropout': 0.3344511848517823, 'batch_norm': True, 'lr': 0.0005105348124632672, 'weight_decay': 0.000517859523037217, 'epochs': 330, 'loss': 'mse', 'optimizer': 'adam', 'graph_mode': 'cutoff', 'cutoff': 0.2310143934798106, 'grm_norm': 'cosine_then_gcn', 'self_loops': True, 'use_snp_selection': False}. Best is trial 69 with value: 0.15410698700909709.
[I 2025-11-03 16:22:02,477] Trial 100 finished with value: 0.13357657295799463 and parameters: {'model_type': 'graphsage', 'hidden_dims': '[256, 128, 64]', 'dropout': 0.41742642175170214, 'batch_norm': True, 'lr': 0.0009411671711388489, 'weight_decay': 0.0003420269829577537, 'epochs': 338, 'loss': 'mse', 'optimizer': 'adam', 'graph_mode': 'cutoff', 'cutoff': 0.22370574619948355, 'grm_norm': 'cosine_then_gcn', 'self_loops': True, 'use_snp_selection': False}. Best is trial 69 with value: 0.15410698700909709.
