[I 2025-10-23 13:19:45,365] Trial 54 finished with value: 0.22660619612583854 and parameters: {'model_type': 'gat', 'hidden_dims': '[512, 128]', 'dropout': 0.5649003976885809, 'batch_norm': True, 'gat_heads': 8, 'gat_attn_dropout': 0.5804192215678197, 'gat_concat_hidden': True, 'lr': 9.04191480981783e-05, 'weight_decay': 3.233542955726542e-07, 'epochs': 333, 'loss': 'mae', 'optimizer': 'adam', 'graph_mode': 'cutoff', 'cutoff': 0.8479334158432587, 'grm_norm': 'cosine', 'self_loops': False}. Best is trial 54 with value: 0.22660619612583854.
[I 2025-10-23 13:33:42,932] Trial 55 finished with value: 0.22685590659338875 and parameters: {'model_type': 'gat', 'hidden_dims': '[512, 128]', 'dropout': 0.57042860694043, 'batch_norm': True, 'gat_heads': 8, 'gat_attn_dropout': 0.5738502698561816, 'gat_concat_hidden': True, 'lr': 8.923963498408062e-05, 'weight_decay': 3.4907789642935263e-07, 'epochs': 337, 'loss': 'mae', 'optimizer': 'adam', 'graph_mode': 'cutoff', 'cutoff': 0.8553204153807296, 'grm_norm': 'cosine', 'self_loops': False}. Best is trial 55 with value: 0.22685590659338875.
[I 2025-10-23 13:47:40,353] Trial 56 finished with value: 0.22174326605663194 and parameters: {'model_type': 'gat', 'hidden_dims': '[512, 128]', 'dropout': 0.5605452386541007, 'batch_norm': True, 'gat_heads': 8, 'gat_attn_dropout': 0.5375083048554197, 'gat_concat_hidden': True, 'lr': 8.546423691160296e-05, 'weight_decay': 3.3231403929991777e-07, 'epochs': 337, 'loss': 'mae', 'optimizer': 'adam', 'graph_mode': 'cutoff', 'cutoff': 0.8563940377758358, 'grm_norm': 'cosine', 'self_loops': False}. Best is trial 55 with value: 0.22685590659338875.
[I 2025-10-23 13:59:07,102] Trial 57 finished with value: 0.1929800857123919 and parameters: {'model_type': 'gat', 'hidden_dims': '[512, 128]', 'dropout': 0.540770275809728, 'batch_norm': True, 'gat_heads': 7, 'gat_attn_dropout': 0.5039040990938238, 'gat_concat_hidden': True, 'lr': 4.968617315916422e-05, 'weight_decay': 1.4838537437039366e-07, 'epochs': 318, 'loss': 'mae', 'optimizer': 'adam', 'graph_mode': 'cutoff', 'cutoff': 0.472158283816102, 'grm_norm': 'cosine', 'self_loops': False}. Best is trial 55 with value: 0.22685590659338875.
[I 2025-10-23 14:13:04,652] Trial 58 finished with value: 0.22340137447789205 and parameters: {'model_type': 'gat', 'hidden_dims': '[512, 128]', 'dropout': 0.5904161583077298, 'batch_norm': True, 'gat_heads': 8, 'gat_attn_dropout': 0.573897624771539, 'gat_concat_hidden': True, 'lr': 0.00014520467573186455, 'weight_decay': 7.965530672002075e-07, 'epochs': 336, 'loss': 'mae', 'optimizer': 'adam', 'graph_mode': 'cutoff', 'cutoff': 0.8175583112439614, 'grm_norm': 'cosine', 'self_loops': False}. Best is trial 55 with value: 0.22685590659338875.
[I 2025-10-23 14:25:58,634] Trial 59 finished with value: 0.23076226743565206 and parameters: {'model_type': 'gat', 'hidden_dims': '[512, 128]', 'dropout': 0.589872447336056, 'batch_norm': True, 'gat_heads': 8, 'gat_attn_dropout': 0.5714410396810776, 'gat_concat_hidden': True, 'lr': 0.00012998415889600468, 'weight_decay': 6.793873959055995e-07, 'epochs': 309, 'loss': 'mae', 'optimizer': 'adam', 'graph_mode': 'cutoff', 'cutoff': 0.8130523758471241, 'grm_norm': 'cosine', 'self_loops': False}. Best is trial 59 with value: 0.23076226743565206.
[I 2025-10-23 14:37:00,231] Trial 60 finished with value: 0.2189349715414946 and parameters: {'model_type': 'gat', 'hidden_dims': '[512, 128]', 'dropout': 0.5767189379244383, 'batch_norm': True, 'gat_heads': 7, 'gat_attn_dropout': 0.5189454701533781, 'gat_concat_hidden': True, 'lr': 0.00012035084710892501, 'weight_decay': 8.473455127962843e-07, 'epochs': 311, 'loss': 'mae', 'optimizer': 'adam', 'graph_mode': 'cutoff', 'cutoff': 0.8122463702134031, 'grm_norm': 'cosine', 'self_loops': False}. Best is trial 59 with value: 0.23076226743565206.
[I 2025-10-23 14:50:58,149] Trial 61 finished with value: 0.22297437189275193 and parameters: {'model_type': 'gat', 'hidden_dims': '[512, 128]', 'dropout': 0.5884392209662715, 'batch_norm': True, 'gat_heads': 8, 'gat_attn_dropout': 0.5755598186512386, 'gat_concat_hidden': True, 'lr': 0.00014555205126094494, 'weight_decay': 3.425831555595485e-07, 'epochs': 337, 'loss': 'mae', 'optimizer': 'adam', 'graph_mode': 'cutoff', 'cutoff': 0.8511080192849451, 'grm_norm': 'cosine', 'self_loops': False}. Best is trial 59 with value: 0.23076226743565206.
[I 2025-10-23 15:04:31,650] Trial 62 finished with value: 0.22703534243543327 and parameters: {'model_type': 'gat', 'hidden_dims': '[512, 128]', 'dropout': 0.5858862348714197, 'batch_norm': True, 'gat_heads': 8, 'gat_attn_dropout': 0.5604223141723687, 'gat_concat_hidden': True, 'lr': 8.087313614159353e-05, 'weight_decay': 3.636595108854916e-07, 'epochs': 327, 'loss': 'mae', 'optimizer': 'adam', 'graph_mode': 'cutoff', 'cutoff': 0.8404848417191171, 'grm_norm': 'cosine', 'self_loops': False}. Best is trial 59 with value: 0.23076226743565206.
[I 2025-10-23 15:18:02,202] Trial 63 finished with value: 0.22212683452070903 and parameters: {'model_type': 'gat', 'hidden_dims': '[512, 128]', 'dropout': 0.5475176521813351, 'batch_norm': True, 'gat_heads': 8, 'gat_attn_dropout': 0.5478308591197476, 'gat_concat_hidden': True, 'lr': 9.850868987483101e-05, 'weight_decay': 7.342032881780895e-07, 'epochs': 325, 'loss': 'mae', 'optimizer': 'adam', 'graph_mode': 'cutoff', 'cutoff': 0.7623483805519421, 'grm_norm': 'cosine', 'self_loops': False}. Best is trial 59 with value: 0.23076226743565206.
[I 2025-10-23 15:30:57,392] Trial 64 finished with value: 0.22907775288637344 and parameters: {'model_type': 'gat', 'hidden_dims': '[512, 128]', 'dropout': 0.5192538678992572, 'batch_norm': True, 'gat_heads': 8, 'gat_attn_dropout': 0.5600488705194567, 'gat_concat_hidden': True, 'lr': 7.7391589299132e-05, 'weight_decay': 1.8157589076255577e-06, 'epochs': 311, 'loss': 'mae', 'optimizer': 'adam', 'graph_mode': 'cutoff', 'cutoff': 0.8213087956491366, 'grm_norm': 'cosine', 'self_loops': False}. Best is trial 59 with value: 0.23076226743565206.
[I 2025-10-23 15:41:54,696] Trial 65 finished with value: 0.2228521855159235 and parameters: {'model_type': 'gat', 'hidden_dims': '[512, 128]', 'dropout': 0.5036273142480737, 'batch_norm': True, 'gat_heads': 7, 'gat_attn_dropout': 0.4956407386646255, 'gat_concat_hidden': True, 'lr': 7.837893671652757e-05, 'weight_decay': 2.0817108641432493e-06, 'epochs': 310, 'loss': 'mae', 'optimizer': 'adam', 'graph_mode': 'cutoff', 'cutoff': 0.6932281817916572, 'grm_norm': 'cosine', 'self_loops': False}. Best is trial 59 with value: 0.23076226743565206.
[I 2025-10-23 15:53:58,118] Trial 66 finished with value: 0.1982943118770512 and parameters: {'model_type': 'gat', 'hidden_dims': '[512, 128]', 'dropout': 0.5261913058747589, 'batch_norm': True, 'gat_heads': 8, 'gat_attn_dropout': 0.4703472713968099, 'gat_concat_hidden': True, 'lr': 5.721929857203971e-05, 'weight_decay': 1.5251286608970702e-06, 'epochs': 289, 'loss': 'mae', 'optimizer': 'adam', 'graph_mode': 'cutoff', 'cutoff': 0.8334110811295138, 'grm_norm': 'cosine', 'self_loops': False}. Best is trial 59 with value: 0.23076226743565206.
[I 2025-10-23 16:06:00,398] Trial 67 finished with value: 0.1988867994911812 and parameters: {'model_type': 'gat', 'hidden_dims': '[512, 128]', 'dropout': 0.5621564064262807, 'batch_norm': True, 'gat_heads': 8, 'gat_attn_dropout': 0.5227712542214182, 'gat_concat_hidden': False, 'lr': 0.00010411629074330964, 'weight_decay': 3.919579275312293e-07, 'epochs': 296, 'loss': 'mae', 'optimizer': 'adam', 'graph_mode': 'cutoff', 'cutoff': 0.7623996571684452, 'grm_norm': 'cosine', 'self_loops': False}. Best is trial 59 with value: 0.23076226743565206.
[I 2025-10-23 16:17:34,523] Trial 68 finished with value: 0.13691741366571597 and parameters: {'model_type': 'gat', 'hidden_dims': '[512, 128]', 'dropout': 0.5447616502447135, 'batch_norm': True, 'gat_heads': 7, 'gat_attn_dropout': 0.5581934552659921, 'gat_concat_hidden': True, 'lr': 4.891255402577138e-05, 'weight_decay': 1.1842839353938279e-06, 'epochs': 323, 'loss': 'mae', 'optimizer': 'adam', 'graph_mode': 'knn', 'source': 'grm', 'knn_k': 3, 'weighted_edges': True, 'symmetrize_mode': 'mutual'}. Best is trial 59 with value: 0.23076226743565206.
[I 2025-10-23 16:30:20,165] Trial 69 finished with value: 0.22603251623810755 and parameters: {'model_type': 'gat', 'hidden_dims': '[512, 128]', 'dropout': 0.599737589885749, 'batch_norm': True, 'gat_heads': 8, 'gat_attn_dropout': 0.5402965640056087, 'gat_concat_hidden': True, 'lr': 8.776537746949759e-05, 'weight_decay': 5.738113244538272e-07, 'epochs': 307, 'loss': 'mae', 'optimizer': 'adam', 'graph_mode': 'cutoff', 'cutoff': 0.8782386591149187, 'grm_norm': 'cosine', 'self_loops': False}. Best is trial 59 with value: 0.23076226743565206.
[I 2025-10-23 16:43:05,467] Trial 70 finished with value: 0.21942940226207835 and parameters: {'model_type': 'gat', 'hidden_dims': '[512, 128]', 'dropout': 0.5158874252494025, 'batch_norm': True, 'gat_heads': 8, 'gat_attn_dropout': 0.540383114858507, 'gat_concat_hidden': True, 'lr': 0.00018688013882393274, 'weight_decay': 5.652191636214336e-07, 'epochs': 307, 'loss': 'mae', 'optimizer': 'adam', 'graph_mode': 'cutoff', 'cutoff': 0.875352609710061, 'grm_norm': 'cosine', 'self_loops': False}. Best is trial 59 with value: 0.23076226743565206.
[I 2025-10-23 16:56:12,097] Trial 71 finished with value: 0.23399429199486196 and parameters: {'model_type': 'gat', 'hidden_dims': '[512, 128]', 'dropout': 0.5810819716890667, 'batch_norm': True, 'gat_heads': 8, 'gat_attn_dropout': 0.5988970031917589, 'gat_concat_hidden': True, 'lr': 8.465873403633892e-05, 'weight_decay': 2.8144645575243443e-07, 'epochs': 316, 'loss': 'mae', 'optimizer': 'adam', 'graph_mode': 'cutoff', 'cutoff': 0.8398594800555751, 'grm_norm': 'cosine', 'self_loops': False}. Best is trial 71 with value: 0.23399429199486196.
[I 2025-10-23 17:10:22,467] Trial 72 finished with value: 0.2282286545547561 and parameters: {'model_type': 'gat', 'hidden_dims': '[512, 128]', 'dropout': 0.5796577860924614, 'batch_norm': True, 'gat_heads': 8, 'gat_attn_dropout': 0.5910791366599123, 'gat_concat_hidden': True, 'lr': 0.0001292028814516835, 'weight_decay': 2.7579151813891754e-07, 'epochs': 343, 'loss': 'mae', 'optimizer': 'adam', 'graph_mode': 'cutoff', 'cutoff': 0.8409391071631808, 'grm_norm': 'cosine', 'self_loops': False}. Best is trial 71 with value: 0.23399429199486196.
[I 2025-10-23 17:24:02,792] Trial 73 finished with value: 0.21623933986012575 and parameters: {'model_type': 'gat', 'hidden_dims': '[512, 128]', 'dropout': 0.5778794038242162, 'batch_norm': True, 'gat_heads': 8, 'gat_attn_dropout': 0.5844208944744661, 'gat_concat_hidden': True, 'lr': 0.00014165104324589432, 'weight_decay': 2.6411460894236136e-07, 'epochs': 330, 'loss': 'mae', 'optimizer': 'adam', 'graph_mode': 'cutoff', 'cutoff': 0.8069119879867601, 'grm_norm': 'cosine', 'self_loops': False}. Best is trial 71 with value: 0.23399429199486196.
[I 2025-10-23 17:36:06,111] Trial 74 finished with value: 0.22417353843163124 and parameters: {'model_type': 'gat', 'hidden_dims': '[512, 128]', 'dropout': 0.5572154870920042, 'batch_norm': True, 'gat_heads': 7, 'gat_attn_dropout': 0.5982612309708084, 'gat_concat_hidden': True, 'lr': 9.497562855845662e-05, 'weight_decay': 3.1436640306382785e-07, 'epochs': 343, 'loss': 'mae', 'optimizer': 'adam', 'graph_mode': 'cutoff', 'cutoff': 0.8457101201173193, 'grm_norm': 'cosine', 'self_loops': False}. Best is trial 71 with value: 0.23399429199486196.
[I 2025-10-23 17:49:20,570] Trial 75 finished with value: 0.22412553301876223 and parameters: {'model_type': 'gat', 'hidden_dims': '[512, 128]', 'dropout': 0.569842756912725, 'batch_norm': True, 'gat_heads': 8, 'gat_attn_dropout': 0.5632355031181822, 'gat_concat_hidden': True, 'lr': 0.00012077813567562026, 'weight_decay': 3.7051513435229603e-07, 'epochs': 319, 'loss': 'mae', 'optimizer': 'adam', 'graph_mode': 'cutoff', 'cutoff': 0.782339357346844, 'grm_norm': 'cosine', 'self_loops': False}. Best is trial 71 with value: 0.23399429199486196.
[I 2025-10-23 18:03:39,733] Trial 76 finished with value: 0.22154723095562537 and parameters: {'model_type': 'gat', 'hidden_dims': '[512, 128]', 'dropout': 0.5844237259717894, 'batch_norm': True, 'gat_heads': 8, 'gat_attn_dropout': 0.5189221923354954, 'gat_concat_hidden': True, 'lr': 0.0001168105212953068, 'weight_decay': 2.176007035465587e-07, 'epochs': 346, 'loss': 'mae', 'optimizer': 'adam', 'graph_mode': 'cutoff', 'cutoff': 0.8339548628500645, 'grm_norm': 'cosine', 'self_loops': False}. Best is trial 71 with value: 0.23399429199486196.
[I 2025-10-23 18:14:49,381] Trial 77 finished with value: 0.22286808409069464 and parameters: {'model_type': 'gat', 'hidden_dims': '[512, 128]', 'dropout': 0.5437196642319235, 'batch_norm': True, 'gat_heads': 7, 'gat_attn_dropout': 0.5598206328833452, 'gat_concat_hidden': True, 'lr': 0.0001762053675011086, 'weight_decay': 4.4125992560297794e-07, 'epochs': 316, 'loss': 'mae', 'optimizer': 'adam', 'graph_mode': 'cutoff', 'cutoff': 0.7355356878872841, 'grm_norm': 'cosine', 'self_loops': False}. Best is trial 71 with value: 0.23399429199486196.
[I 2025-10-23 18:27:19,007] Trial 78 finished with value: 0.23273388953816498 and parameters: {'model_type': 'gat', 'hidden_dims': '[512, 128]', 'dropout': 0.5219245190395486, 'batch_norm': True, 'gat_heads': 8, 'gat_attn_dropout': 0.5994869245252443, 'gat_concat_hidden': True, 'lr': 6.04580421685877e-05, 'weight_decay': 2.7192130845937243e-07, 'epochs': 300, 'loss': 'mae', 'optimizer': 'adam', 'graph_mode': 'cutoff', 'cutoff': 0.8872890386605594, 'grm_norm': 'cosine', 'self_loops': False}. Best is trial 71 with value: 0.23399429199486196.
[I 2025-10-23 18:40:09,049] Trial 79 finished with value: 0.11404360074259672 and parameters: {'model_type': 'gat', 'hidden_dims': '[512, 128]', 'dropout': 0.52065534939928, 'batch_norm': True, 'gat_heads': 8, 'gat_attn_dropout': 0.597193982986075, 'gat_concat_hidden': False, 'lr': 6.490973416121476e-05, 'weight_decay': 1.7559733119376812e-07, 'epochs': 297, 'loss': 'mae', 'optimizer': 'adam', 'graph_mode': 'knn', 'source': 'grm', 'knn_k': 10, 'weighted_edges': False, 'symmetrize_mode': 'union'}. Best is trial 71 with value: 0.23399429199486196.
[I 2025-10-23 18:50:22,045] Trial 80 finished with value: 0.22016465814003214 and parameters: {'model_type': 'gat', 'hidden_dims': '[512, 128]', 'dropout': 0.45273416336941696, 'batch_norm': True, 'gat_heads': 7, 'gat_attn_dropout': 0.5521703564736318, 'gat_concat_hidden': True, 'lr': 4.201859871618761e-05, 'weight_decay': 6.650934477655223e-07, 'epochs': 288, 'loss': 'mae', 'optimizer': 'adam', 'graph_mode': 'cutoff', 'cutoff': 0.8875749359551376, 'grm_norm': 'cosine', 'self_loops': False}. Best is trial 71 with value: 0.23399429199486196.
[I 2025-10-23 19:04:02,326] Trial 81 finished with value: 0.22501681404773904 and parameters: {'model_type': 'gat', 'hidden_dims': '[512, 128]', 'dropout': 0.49905289537539016, 'batch_norm': True, 'gat_heads': 8, 'gat_attn_dropout': 0.5833857040453216, 'gat_concat_hidden': True, 'lr': 5.543533346165475e-05, 'weight_decay': 2.4054666628381035e-07, 'epochs': 330, 'loss': 'mae', 'optimizer': 'adam', 'graph_mode': 'cutoff', 'cutoff': 0.8608412214040547, 'grm_norm': 'cosine', 'self_loops': False}. Best is trial 71 with value: 0.23399429199486196.
[I 2025-10-23 19:18:11,036] Trial 82 finished with value: 0.22534109927568052 and parameters: {'model_type': 'gat', 'hidden_dims': '[512, 128]', 'dropout': 0.5389282215333326, 'batch_norm': True, 'gat_heads': 8, 'gat_attn_dropout': 0.5664331503212728, 'gat_concat_hidden': True, 'lr': 7.939635244251483e-05, 'weight_decay': 2.775187929439729e-07, 'epochs': 342, 'loss': 'mae', 'optimizer': 'adam', 'graph_mode': 'cutoff', 'cutoff': 0.826844184380296, 'grm_norm': 'cosine', 'self_loops': False}. Best is trial 71 with value: 0.23399429199486196.
[I 2025-10-23 19:23:20,855] Trial 83 finished with value: 0.23347210117243447 and parameters: {'model_type': 'gat', 'hidden_dims': '[512, 128]', 'dropout': 0.56693875082314, 'batch_norm': True, 'gat_heads': 8, 'gat_attn_dropout': 0.5314240357783514, 'gat_concat_hidden': True, 'lr': 7.636557236471486e-05, 'weight_decay': 4.1993493329734634e-07, 'epochs': 116, 'loss': 'mae', 'optimizer': 'adam', 'graph_mode': 'cutoff', 'cutoff': 0.8970579733011904, 'grm_norm': 'cosine', 'self_loops': False}. Best is trial 71 with value: 0.23399429199486196.
[I 2025-10-23 19:28:23,782] Trial 84 finished with value: 0.20575217077787045 and parameters: {'model_type': 'gat', 'hidden_dims': '[512, 128]', 'dropout': 0.5646241692453179, 'batch_norm': True, 'gat_heads': 8, 'gat_attn_dropout': 0.5299355095374984, 'gat_concat_hidden': True, 'lr': 7.121233047945287e-05, 'weight_decay': 4.775673887714293e-07, 'epochs': 113, 'loss': 'mae', 'optimizer': 'adam', 'graph_mode': 'cutoff', 'cutoff': 0.8928339537131491, 'grm_norm': 'cosine', 'self_loops': False}. Best is trial 71 with value: 0.23399429199486196.
[I 2025-10-23 19:34:12,627] Trial 85 finished with value: 0.23183219729687982 and parameters: {'model_type': 'gat', 'hidden_dims': '[512, 128]', 'dropout': 0.5835393432689754, 'batch_norm': True, 'gat_heads': 7, 'gat_attn_dropout': 0.5997464837997564, 'gat_concat_hidden': True, 'lr': 0.00023815216269406354, 'weight_decay': 9.467752649216694e-07, 'epochs': 158, 'loss': 'mae', 'optimizer': 'adam', 'graph_mode': 'cutoff', 'cutoff': 0.7971995491855284, 'grm_norm': 'cosine', 'self_loops': False}. Best is trial 71 with value: 0.23399429199486196.
[I 2025-10-23 19:39:10,999] Trial 86 finished with value: 0.23773721422984856 and parameters: {'model_type': 'gat', 'hidden_dims': '[512, 128]', 'dropout': 0.5888509345888676, 'batch_norm': True, 'gat_heads': 7, 'gat_attn_dropout': 0.5994924887618405, 'gat_concat_hidden': True, 'lr': 0.0002558078567920425, 'weight_decay': 6.409815314392239e-07, 'epochs': 133, 'loss': 'mae', 'optimizer': 'adam', 'graph_mode': 'cutoff', 'cutoff': 0.8030236980639407, 'grm_norm': 'cosine_then_gcn', 'self_loops': False}. Best is trial 86 with value: 0.23773721422984856.
[I 2025-10-23 19:41:28,855] Trial 87 finished with value: 0.23836199230299818 and parameters: {'model_type': 'gat', 'hidden_dims': '[256, 128, 64]', 'dropout': 0.5311122312618487, 'batch_norm': True, 'gat_heads': 6, 'gat_attn_dropout': 0.5962945586262587, 'gat_concat_hidden': True, 'lr': 0.00023762986846937077, 'weight_decay': 9.85376465484313e-07, 'epochs': 141, 'loss': 'mae', 'optimizer': 'adam', 'graph_mode': 'cutoff', 'cutoff': 0.778817457907589, 'grm_norm': 'cosine_then_gcn', 'self_loops': False}. Best is trial 87 with value: 0.23836199230299818.
[I 2025-10-23 19:43:42,258] Trial 88 finished with value: 0.20709323629129744 and parameters: {'model_type': 'gat', 'hidden_dims': '[256, 128, 64]', 'dropout': 0.5079279280000022, 'batch_norm': True, 'gat_heads': 6, 'gat_attn_dropout': 0.5976765227440894, 'gat_concat_hidden': True, 'lr': 0.0003974156562489356, 'weight_decay': 2.6018660590653298e-06, 'epochs': 136, 'loss': 'mae', 'optimizer': 'adam', 'graph_mode': 'cutoff', 'cutoff': 0.7823944467763946, 'grm_norm': 'cosine_then_gcn', 'self_loops': False}. Best is trial 87 with value: 0.23836199230299818.
[I 2025-10-23 19:46:12,706] Trial 89 finished with value: 0.22231138247025867 and parameters: {'model_type': 'gat', 'hidden_dims': '[256, 128, 64]', 'dropout': 0.4857425874813688, 'batch_norm': True, 'gat_heads': 6, 'gat_attn_dropout': 0.5072975319455189, 'gat_concat_hidden': True, 'lr': 0.00024182682098652204, 'weight_decay': 9.71435684982622e-07, 'epochs': 155, 'loss': 'mae', 'optimizer': 'adam', 'graph_mode': 'cutoff', 'cutoff': 0.8061773395075524, 'grm_norm': 'cosine_then_gcn', 'self_loops': False}. Best is trial 87 with value: 0.23836199230299818.
[I 2025-10-23 19:47:55,182] Trial 90 finished with value: 0.22617418047894278 and parameters: {'model_type': 'gat', 'hidden_dims': '[256, 128, 64]', 'dropout': 0.5315309958305263, 'batch_norm': True, 'gat_heads': 7, 'gat_attn_dropout': 0.5467036095227547, 'gat_concat_hidden': True, 'lr': 0.0003058939462981261, 'weight_decay': 1.3765987447286402e-06, 'epochs': 84, 'loss': 'mae', 'optimizer': 'adam', 'graph_mode': 'cutoff', 'cutoff': 0.7416354293813092, 'grm_norm': 'cosine_then_gcn', 'self_loops': False}. Best is trial 87 with value: 0.23836199230299818.
[I 2025-10-23 19:51:56,774] Trial 91 finished with value: 0.2392540303115429 and parameters: {'model_type': 'gat', 'hidden_dims': '[512, 128]', 'dropout': 0.5836081792847614, 'batch_norm': True, 'gat_heads': 7, 'gat_attn_dropout': 0.5641247635125608, 'gat_concat_hidden': True, 'lr': 0.00022375113212360744, 'weight_decay': 1.8227320032318959e-06, 'epochs': 105, 'loss': 'mae', 'optimizer': 'adam', 'graph_mode': 'cutoff', 'cutoff': 0.821688404660052, 'grm_norm': 'cosine_then_gcn', 'self_loops': False}. Best is trial 91 with value: 0.2392540303115429.
[I 2025-10-23 19:53:40,097] Trial 92 finished with value: 0.20912166172255525 and parameters: {'model_type': 'gat', 'hidden_dims': '[256, 128, 64]', 'dropout': 0.5864029495619555, 'batch_norm': True, 'gat_heads': 6, 'gat_attn_dropout': 0.5881320023497119, 'gat_concat_hidden': True, 'lr': 0.00023494669692940414, 'weight_decay': 1.8442262908053925e-06, 'epochs': 102, 'loss': 'mae', 'optimizer': 'adam', 'graph_mode': 'cutoff', 'cutoff': 0.7682019285210183, 'grm_norm': 'cosine_then_gcn', 'self_loops': False}. Best is trial 91 with value: 0.2392540303115429.
[I 2025-10-23 19:56:20,451] Trial 93 finished with value: 0.22871043194564994 and parameters: {'model_type': 'gat', 'hidden_dims': '[256, 128]', 'dropout': 0.5474339320792941, 'batch_norm': True, 'gat_heads': 7, 'gat_attn_dropout': 0.5982456864942782, 'gat_concat_hidden': True, 'lr': 0.0001640412914042563, 'weight_decay': 1.005245633336404e-06, 'epochs': 142, 'loss': 'mae', 'optimizer': 'adam', 'graph_mode': 'cutoff', 'cutoff': 0.7952955011405969, 'grm_norm': 'cosine_then_gcn', 'self_loops': False}. Best is trial 91 with value: 0.2392540303115429.
