[I 2025-11-03 14:07:03,837] Trial 64 finished with value: 0.08537858129417344 and parameters: {'model_type': 'gcn', 'hidden_dims': '[256, 128, 64]', 'dropout': 0.17146029482681766, 'batch_norm': False, 'lr': 0.0007840586101236668, 'weight_decay': 0.00019014877170219342, 'epochs': 85, 'loss': 'mae', 'optimizer': 'adam', 'graph_mode': 'cutoff', 'cutoff': 0.859214242903288, 'grm_norm': 'cosine_then_gcn', 'self_loops': False, 'use_snp_selection': True, 'num_snps': 19283}. Best is trial 50 with value: 0.11298321822955552.
[I 2025-11-03 14:07:06,264] Trial 65 finished with value: 0.05770400648993304 and parameters: {'model_type': 'gcn', 'hidden_dims': '[256, 128, 64]', 'dropout': 0.13534501287584458, 'batch_norm': False, 'lr': 0.0004630141559593674, 'weight_decay': 0.0006483154489226465, 'epochs': 104, 'loss': 'mae', 'optimizer': 'adam', 'graph_mode': 'cutoff', 'cutoff': 0.8146111363534702, 'grm_norm': 'cosine_then_gcn', 'self_loops': False, 'use_snp_selection': True, 'num_snps': 25680}. Best is trial 50 with value: 0.11298321822955552.
[I 2025-11-03 14:07:07,994] Trial 66 finished with value: 0.028260901826048426 and parameters: {'model_type': 'gcn', 'hidden_dims': '[256, 128, 64]', 'dropout': 0.11889216484683367, 'batch_norm': False, 'lr': 0.0009914972046848102, 'weight_decay': 0.000316981337085348, 'epochs': 55, 'loss': 'mae', 'optimizer': 'adam', 'graph_mode': 'cutoff', 'cutoff': 0.49921591842351665, 'grm_norm': 'cosine_then_gcn', 'self_loops': False, 'use_snp_selection': True, 'num_snps': 12728}. Best is trial 50 with value: 0.11298321822955552.
[I 2025-11-03 14:07:10,910] Trial 67 finished with value: 0.08376048722587928 and parameters: {'model_type': 'gcn', 'hidden_dims': '[256, 128, 64]', 'dropout': 0.18349609606769113, 'batch_norm': False, 'lr': 0.0004933521330810467, 'weight_decay': 0.00010793571752934143, 'epochs': 136, 'loss': 'mae', 'optimizer': 'adam', 'graph_mode': 'cutoff', 'cutoff': 0.8646637264343763, 'grm_norm': 'cosine_then_gcn', 'self_loops': False, 'use_snp_selection': True, 'num_snps': 35666}. Best is trial 50 with value: 0.11298321822955552.
[I 2025-11-03 14:07:12,972] Trial 68 finished with value: 0.0762695494304274 and parameters: {'model_type': 'gcn', 'hidden_dims': '[512, 256]', 'dropout': 0.14333246972013408, 'batch_norm': False, 'lr': 0.0006853544321740278, 'weight_decay': 3.498602406909212e-05, 'epochs': 142, 'loss': 'mae', 'optimizer': 'adam', 'graph_mode': 'cutoff', 'cutoff': 0.8129622843373285, 'grm_norm': 'cosine_then_gcn', 'self_loops': False, 'use_snp_selection': True, 'num_snps': 12415}. Best is trial 50 with value: 0.11298321822955552.
[I 2025-11-03 14:07:15,261] Trial 69 finished with value: 0.075690308621106 and parameters: {'model_type': 'gcn', 'hidden_dims': '[256, 128, 64]', 'dropout': 0.16668516375954395, 'batch_norm': True, 'lr': 0.0004080320244443356, 'weight_decay': 0.00030892759777430626, 'epochs': 103, 'loss': 'mae', 'optimizer': 'adam', 'graph_mode': 'cutoff', 'cutoff': 0.8338886624384017, 'grm_norm': 'cosine_then_gcn', 'self_loops': False, 'use_snp_selection': True, 'num_snps': 23925}. Best is trial 50 with value: 0.11298321822955552.
[I 2025-11-03 14:07:18,136] Trial 70 finished with value: 0.06927204941848925 and parameters: {'model_type': 'gcn', 'hidden_dims': '[256, 128, 64]', 'dropout': 0.10288229296893059, 'batch_norm': False, 'lr': 0.0007913552645113477, 'weight_decay': 0.0005404669211315514, 'epochs': 128, 'loss': 'mae', 'optimizer': 'adam', 'graph_mode': 'knn', 'source': 'grm', 'knn_k': 3, 'weighted_edges': True, 'symmetrize_mode': 'mutual', 'use_snp_selection': True, 'num_snps': 34736}. Best is trial 50 with value: 0.11298321822955552.
[I 2025-11-03 14:07:20,406] Trial 71 finished with value: 0.0934525931494153 and parameters: {'model_type': 'gcn', 'hidden_dims': '[256, 128, 64]', 'dropout': 0.2241426489048827, 'batch_norm': False, 'lr': 0.000280340267760317, 'weight_decay': 3.3808746161944036e-07, 'epochs': 158, 'loss': 'mae', 'optimizer': 'adam', 'graph_mode': 'cutoff', 'cutoff': 0.8611358254546989, 'grm_norm': 'cosine_then_gcn', 'self_loops': False, 'use_snp_selection': True, 'num_snps': 17195}. Best is trial 50 with value: 0.11298321822955552.
[I 2025-11-03 14:07:23,247] Trial 72 finished with value: 0.08042739384456214 and parameters: {'model_type': 'gcn', 'hidden_dims': '[256, 128, 64]', 'dropout': 0.19620245763695182, 'batch_norm': False, 'lr': 0.0003286631619770396, 'weight_decay': 6.15949415827619e-07, 'epochs': 166, 'loss': 'mae', 'optimizer': 'adam', 'graph_mode': 'cutoff', 'cutoff': 0.8756079851961214, 'grm_norm': 'cosine_then_gcn', 'self_loops': False, 'use_snp_selection': True, 'num_snps': 30151}. Best is trial 50 with value: 0.11298321822955552.
[I 2025-11-03 14:07:25,420] Trial 73 finished with value: 0.041337484397601994 and parameters: {'model_type': 'gcn', 'hidden_dims': '[256, 128, 64]', 'dropout': 0.16486642902400292, 'batch_norm': False, 'lr': 0.0005367651334183379, 'weight_decay': 2.0137337991182592e-07, 'epochs': 218, 'loss': 'mae', 'optimizer': 'adam', 'graph_mode': 'cutoff', 'cutoff': 0.8555557881733465, 'grm_norm': 'cosine_then_gcn', 'self_loops': False, 'use_snp_selection': True, 'num_snps': 9188}. Best is trial 50 with value: 0.11298321822955552.
[I 2025-11-03 14:07:27,456] Trial 74 finished with value: 0.06118717822717697 and parameters: {'model_type': 'gcn', 'hidden_dims': '[256, 128, 64]', 'dropout': 0.18657528181245756, 'batch_norm': False, 'lr': 0.00018698391225044738, 'weight_decay': 1.1113650854523494e-06, 'epochs': 123, 'loss': 'mae', 'optimizer': 'adam', 'graph_mode': 'cutoff', 'cutoff': 0.89945654953689, 'grm_norm': 'gcn', 'self_loops': False, 'use_snp_selection': True, 'num_snps': 15844}. Best is trial 50 with value: 0.11298321822955552.
[I 2025-11-03 14:07:29,855] Trial 75 finished with value: 0.08712072097518027 and parameters: {'model_type': 'gcn', 'hidden_dims': '[256, 128, 64]', 'dropout': 0.12041301744620232, 'batch_norm': False, 'lr': 0.0006826369030351434, 'weight_decay': 5.167230721910784e-05, 'epochs': 150, 'loss': 'mae', 'optimizer': 'adam', 'graph_mode': 'cutoff', 'cutoff': 0.8185587648883799, 'grm_norm': 'cosine_then_gcn', 'self_loops': False, 'use_snp_selection': True, 'num_snps': 23007}. Best is trial 50 with value: 0.11298321822955552.
[I 2025-11-03 14:07:32,300] Trial 76 finished with value: 0.04631586337220587 and parameters: {'model_type': 'gcn', 'hidden_dims': '[512, 64]', 'dropout': 0.1525904695830487, 'batch_norm': False, 'lr': 0.00026776439416853503, 'weight_decay': 3.7062804224969925e-07, 'epochs': 82, 'loss': 'mae', 'optimizer': 'adam', 'graph_mode': 'cutoff', 'cutoff': 0.4669306108961828, 'grm_norm': 'cosine_then_gcn', 'self_loops': False, 'use_snp_selection': True, 'num_snps': 26681}. Best is trial 50 with value: 0.11298321822955552.
[I 2025-11-03 14:07:35,082] Trial 77 finished with value: 0.09271010880677683 and parameters: {'model_type': 'gcn', 'hidden_dims': '[256, 128, 64]', 'dropout': 0.21337407839589775, 'batch_norm': False, 'lr': 0.0003919946708437813, 'weight_decay': 1.6805101616305254e-05, 'epochs': 112, 'loss': 'mae', 'optimizer': 'adam', 'graph_mode': 'cutoff', 'cutoff': 0.5733620562812678, 'grm_norm': 'cosine', 'self_loops': False, 'use_snp_selection': True, 'num_snps': 34904}. Best is trial 50 with value: 0.11298321822955552.
[I 2025-11-03 14:07:37,848] Trial 78 finished with value: 0.10098625711023554 and parameters: {'model_type': 'gcn', 'hidden_dims': '[512, 128]', 'dropout': 0.14145661869101545, 'batch_norm': False, 'lr': 0.00033934866828999355, 'weight_decay': 2.962564553216538e-07, 'epochs': 175, 'loss': 'mae', 'optimizer': 'adam', 'graph_mode': 'cutoff', 'cutoff': 0.8691692046199792, 'grm_norm': 'gcn', 'self_loops': False, 'use_snp_selection': False}. Best is trial 50 with value: 0.11298321822955552.
[I 2025-11-03 14:07:40,193] Trial 79 finished with value: 0.11627000017225243 and parameters: {'model_type': 'gcn', 'hidden_dims': '[512, 128]', 'dropout': 0.13768729050370865, 'batch_norm': False, 'lr': 0.0002278537257697915, 'weight_decay': 2.5789357084378587e-07, 'epochs': 134, 'loss': 'mae', 'optimizer': 'adam', 'graph_mode': 'cutoff', 'cutoff': 0.6321487868994744, 'grm_norm': 'gcn', 'self_loops': False, 'use_snp_selection': False}. Best is trial 79 with value: 0.11627000017225243.
[I 2025-11-03 14:07:42,904] Trial 80 finished with value: 0.10347247284729405 and parameters: {'model_type': 'gcn', 'hidden_dims': '[512, 128]', 'dropout': 0.14011383353258774, 'batch_norm': False, 'lr': 0.00022920734354125896, 'weight_decay': 1.3287439447490776e-07, 'epochs': 176, 'loss': 'mae', 'optimizer': 'adam', 'graph_mode': 'cutoff', 'cutoff': 0.6257725949944106, 'grm_norm': 'gcn', 'self_loops': False, 'use_snp_selection': False}. Best is trial 79 with value: 0.11627000017225243.
[I 2025-11-03 14:07:45,598] Trial 81 finished with value: 0.08805357183813835 and parameters: {'model_type': 'gcn', 'hidden_dims': '[512, 128]', 'dropout': 0.14004677772482899, 'batch_norm': False, 'lr': 0.0002224983506510686, 'weight_decay': 1.4018903887886565e-07, 'epochs': 175, 'loss': 'mae', 'optimizer': 'adam', 'graph_mode': 'cutoff', 'cutoff': 0.6294302487730871, 'grm_norm': 'gcn', 'self_loops': False, 'use_snp_selection': False}. Best is trial 79 with value: 0.11627000017225243.
[I 2025-11-03 14:07:47,933] Trial 82 finished with value: 0.07114569836336976 and parameters: {'model_type': 'gcn', 'hidden_dims': '[512, 128]', 'dropout': 0.15832384155972812, 'batch_norm': False, 'lr': 0.00014460986848770476, 'weight_decay': 2.5469924786241056e-07, 'epochs': 131, 'loss': 'mae', 'optimizer': 'adam', 'graph_mode': 'cutoff', 'cutoff': 0.5548567651113244, 'grm_norm': 'gcn', 'self_loops': False, 'use_snp_selection': False}. Best is trial 79 with value: 0.11627000017225243.
[I 2025-11-03 14:07:50,532] Trial 83 finished with value: 0.08260867051537538 and parameters: {'model_type': 'gcn', 'hidden_dims': '[512, 128]', 'dropout': 0.1737345435319373, 'batch_norm': False, 'lr': 9.706868193258347e-05, 'weight_decay': 2.9496381148582993e-07, 'epochs': 162, 'loss': 'mae', 'optimizer': 'adam', 'graph_mode': 'cutoff', 'cutoff': 0.6202734217332411, 'grm_norm': 'gcn', 'self_loops': False, 'use_snp_selection': False}. Best is trial 79 with value: 0.11627000017225243.
[I 2025-11-03 14:07:53,490] Trial 84 finished with value: 0.06066383733774727 and parameters: {'model_type': 'gcn', 'hidden_dims': '[512, 128]', 'dropout': 0.1278804932831451, 'batch_norm': False, 'lr': 0.0001894156676586538, 'weight_decay': 2.072018213419685e-07, 'epochs': 205, 'loss': 'mae', 'optimizer': 'adam', 'graph_mode': 'cutoff', 'cutoff': 0.5292264871217467, 'grm_norm': 'gcn', 'self_loops': False, 'use_snp_selection': False}. Best is trial 79 with value: 0.11627000017225243.
[I 2025-11-03 14:07:55,888] Trial 85 finished with value: 0.1099203848189147 and parameters: {'model_type': 'gcn', 'hidden_dims': '[512, 128]', 'dropout': 0.14275339471477766, 'batch_norm': False, 'lr': 0.00023341547706531501, 'weight_decay': 5.90510664963754e-07, 'epochs': 140, 'loss': 'mae', 'optimizer': 'adam', 'graph_mode': 'cutoff', 'cutoff': 0.6153234334098555, 'grm_norm': 'gcn', 'self_loops': False, 'use_snp_selection': False}. Best is trial 79 with value: 0.11627000017225243.
[I 2025-11-03 14:07:58,377] Trial 86 finished with value: 0.03307493759726694 and parameters: {'model_type': 'gcn', 'hidden_dims': '[512, 128]', 'dropout': 0.18289199665603684, 'batch_norm': False, 'lr': 0.0002475323949481598, 'weight_decay': 1.4265386055879285e-07, 'epochs': 143, 'loss': 'mae', 'optimizer': 'adam', 'graph_mode': 'knn', 'source': 'grm', 'knn_k': 6, 'weighted_edges': False, 'symmetrize_mode': 'mutual', 'use_snp_selection': False}. Best is trial 79 with value: 0.11627000017225243.
[I 2025-11-03 14:08:00,736] Trial 87 finished with value: 0.09667564363335376 and parameters: {'model_type': 'gcn', 'hidden_dims': '[512, 128]', 'dropout': 0.1003029686230259, 'batch_norm': False, 'lr': 0.00016773933543274015, 'weight_decay': 1.0776351569132281e-07, 'epochs': 135, 'loss': 'mae', 'optimizer': 'adam', 'graph_mode': 'cutoff', 'cutoff': 0.5905290456873769, 'grm_norm': 'gcn', 'self_loops': False, 'use_snp_selection': False}. Best is trial 79 with value: 0.11627000017225243.
[I 2025-11-03 14:08:04,864] Trial 88 finished with value: 0.09487510142230776 and parameters: {'model_type': 'gcn', 'hidden_dims': '[512, 128]', 'dropout': 0.16058556170898114, 'batch_norm': False, 'lr': 0.00012777713837778144, 'weight_decay': 1.779363893177197e-07, 'epochs': 343, 'loss': 'mae', 'optimizer': 'adam', 'graph_mode': 'cutoff', 'cutoff': 0.6425464870376335, 'grm_norm': 'gcn', 'self_loops': False, 'use_snp_selection': False}. Best is trial 79 with value: 0.11627000017225243.
[I 2025-11-03 14:08:08,231] Trial 89 finished with value: 0.0917492990489694 and parameters: {'model_type': 'gcn', 'hidden_dims': '[512, 128]', 'dropout': 0.13515822264422384, 'batch_norm': True, 'lr': 0.0002587471131963051, 'weight_decay': 2.3471115496511484e-07, 'epochs': 248, 'loss': 'mae', 'optimizer': 'adam', 'graph_mode': 'cutoff', 'cutoff': 0.5922004581314988, 'grm_norm': 'gcn', 'self_loops': False, 'use_snp_selection': False}. Best is trial 79 with value: 0.11627000017225243.
[I 2025-11-03 14:08:10,940] Trial 90 finished with value: 0.10193417362599672 and parameters: {'model_type': 'gcn', 'hidden_dims': '[512, 128]', 'dropout': 0.1899055498867015, 'batch_norm': False, 'lr': 0.0003214091234861447, 'weight_decay': 7.796694945879361e-07, 'epochs': 177, 'loss': 'mae', 'optimizer': 'adam', 'graph_mode': 'cutoff', 'cutoff': 0.6744049246773137, 'grm_norm': 'gcn', 'self_loops': False, 'use_snp_selection': False}. Best is trial 79 with value: 0.11627000017225243.
[I 2025-11-03 14:08:13,435] Trial 91 finished with value: 0.0786472782963777 and parameters: {'model_type': 'gcn', 'hidden_dims': '[512, 128]', 'dropout': 0.18894911858447982, 'batch_norm': False, 'lr': 0.0003104973700616356, 'weight_decay': 8.115032098108958e-07, 'epochs': 150, 'loss': 'mae', 'optimizer': 'adam', 'graph_mode': 'cutoff', 'cutoff': 0.68346524982037, 'grm_norm': 'gcn', 'self_loops': False, 'use_snp_selection': False}. Best is trial 79 with value: 0.11627000017225243.
[I 2025-11-03 14:08:16,118] Trial 92 finished with value: 0.09558020044267485 and parameters: {'model_type': 'gcn', 'hidden_dims': '[512, 128]', 'dropout': 0.201617871795681, 'batch_norm': False, 'lr': 0.00037309650290456083, 'weight_decay': 4.1192773112856656e-07, 'epochs': 172, 'loss': 'mae', 'optimizer': 'adam', 'graph_mode': 'cutoff', 'cutoff': 0.6110338096177266, 'grm_norm': 'gcn', 'self_loops': False, 'use_snp_selection': False}. Best is trial 79 with value: 0.11627000017225243.
[I 2025-11-03 14:08:18,641] Trial 93 finished with value: 0.06764017900542736 and parameters: {'model_type': 'gcn', 'hidden_dims': '[512, 128]', 'dropout': 0.1253262736848339, 'batch_norm': False, 'lr': 0.00022291344782194222, 'weight_decay': 3.0457672477982175e-07, 'epochs': 155, 'loss': 'mae', 'optimizer': 'adam', 'graph_mode': 'cutoff', 'cutoff': 0.5705203215296178, 'grm_norm': 'gcn', 'self_loops': False, 'use_snp_selection': False}. Best is trial 79 with value: 0.11627000017225243.
[I 2025-11-03 14:08:20,693] Trial 94 finished with value: 0.06971828678551482 and parameters: {'model_type': 'gcn', 'hidden_dims': '[512, 128]', 'dropout': 0.17344585119395792, 'batch_norm': False, 'lr': 2.5062646834319923e-05, 'weight_decay': 1.2843892462854616e-06, 'epochs': 98, 'loss': 'mae', 'optimizer': 'adam', 'graph_mode': 'cutoff', 'cutoff': 0.6650515860693664, 'grm_norm': 'gcn', 'self_loops': False, 'use_snp_selection': False}. Best is trial 79 with value: 0.11627000017225243.
[I 2025-11-03 14:08:23,797] Trial 95 finished with value: 0.09760907061357443 and parameters: {'model_type': 'gcn', 'hidden_dims': '[512, 128]', 'dropout': 0.23094309568294358, 'batch_norm': False, 'lr': 0.0004534065293510013, 'weight_decay': 5.690138804620174e-07, 'epochs': 222, 'loss': 'mae', 'optimizer': 'adam', 'graph_mode': 'cutoff', 'cutoff': 0.7310538998066833, 'grm_norm': 'gcn', 'self_loops': False, 'use_snp_selection': False}. Best is trial 79 with value: 0.11627000017225243.
[I 2025-11-03 14:08:25,737] Trial 96 finished with value: 0.0827833714936137 and parameters: {'model_type': 'gcn', 'hidden_dims': '[256, 128]', 'dropout': 0.15729041163152932, 'batch_norm': False, 'lr': 0.0001400861215786568, 'weight_decay': 2.787069807084426e-06, 'epochs': 178, 'loss': 'mae', 'optimizer': 'adam', 'graph_mode': 'cutoff', 'cutoff': 0.6372780379243977, 'grm_norm': 'gcn', 'self_loops': True, 'use_snp_selection': False}. Best is trial 79 with value: 0.11627000017225243.
[I 2025-11-03 14:08:29,403] Trial 97 finished with value: 0.1091774704027095 and parameters: {'model_type': 'gcn', 'hidden_dims': '[512, 128]', 'dropout': 0.1496069639077599, 'batch_norm': False, 'lr': 0.00018788390704804075, 'weight_decay': 6.613719047241778e-07, 'epochs': 287, 'loss': 'mae', 'optimizer': 'adam', 'graph_mode': 'cutoff', 'cutoff': 0.6043113874134236, 'grm_norm': 'gcn', 'self_loops': False, 'use_snp_selection': False}. Best is trial 79 with value: 0.11627000017225243.
[I 2025-11-03 14:08:32,835] Trial 98 finished with value: 0.09724004323838295 and parameters: {'model_type': 'gcn', 'hidden_dims': '[512, 128]', 'dropout': 0.13859316181823725, 'batch_norm': False, 'lr': 7.613108445514402e-05, 'weight_decay': 9.908649293422592e-07, 'epochs': 260, 'loss': 'mae', 'optimizer': 'adam', 'graph_mode': 'cutoff', 'cutoff': 0.6525033006882316, 'grm_norm': 'gcn', 'self_loops': True, 'use_snp_selection': False}. Best is trial 79 with value: 0.11627000017225243.
[I 2025-11-03 14:08:36,617] Trial 99 finished with value: 0.07124114359474093 and parameters: {'model_type': 'gcn', 'hidden_dims': '[512, 128]', 'dropout': 0.11498986516852, 'batch_norm': False, 'lr': 0.00019781953629045875, 'weight_decay': 6.945927313397457e-07, 'epochs': 290, 'loss': 'mae', 'optimizer': 'adam', 'graph_mode': 'knn', 'source': 'grm', 'knn_k': 9, 'weighted_edges': True, 'symmetrize_mode': 'union', 'use_snp_selection': False}. Best is trial 79 with value: 0.11627000017225243.
[I 2025-11-03 14:08:40,531] Trial 100 finished with value: 0.0987668997707583 and parameters: {'model_type': 'gcn', 'hidden_dims': '[512, 128]', 'dropout': 0.1510263666035006, 'batch_norm': False, 'lr': 9.827438010663451e-05, 'weight_decay': 4.827913749127622e-07, 'epochs': 317, 'loss': 'mae', 'optimizer': 'adam', 'graph_mode': 'cutoff', 'cutoff': 0.6974430171489354, 'grm_norm': 'gcn', 'self_loops': False, 'use_snp_selection': False}. Best is trial 79 with value: 0.11627000017225243.
[I 2025-11-03 14:08:44,380] Trial 101 finished with value: 0.10341495847882119 and parameters: {'model_type': 'gcn', 'hidden_dims': '[512, 128]', 'dropout': 0.14644971409377971, 'batch_norm': False, 'lr': 6.227656931778584e-05, 'weight_decay': 4.5070220169667896e-07, 'epochs': 309, 'loss': 'mae', 'optimizer': 'adam', 'graph_mode': 'cutoff', 'cutoff': 0.6072611828143194, 'grm_norm': 'gcn', 'self_loops': False, 'use_snp_selection': False}. Best is trial 79 with value: 0.11627000017225243.
[I 2025-11-03 14:08:48,136] Trial 102 finished with value: 0.08785770701729659 and parameters: {'model_type': 'gcn', 'hidden_dims': '[512, 128]', 'dropout': 0.15084733569038344, 'batch_norm': False, 'lr': 6.027007668777127e-05, 'weight_decay': 4.225311720149233e-07, 'epochs': 298, 'loss': 'mae', 'optimizer': 'adam', 'graph_mode': 'cutoff', 'cutoff': 0.702111090726235, 'grm_norm': 'gcn', 'self_loops': False, 'use_snp_selection': False}. Best is trial 79 with value: 0.11627000017225243.
[I 2025-11-03 14:08:52,106] Trial 103 finished with value: 0.12689197630595375 and parameters: {'model_type': 'gcn', 'hidden_dims': '[512, 128]', 'dropout': 0.14320005776076944, 'batch_norm': False, 'lr': 0.00010297383365354593, 'weight_decay': 5.005406137325696e-07, 'epochs': 323, 'loss': 'mae', 'optimizer': 'adam', 'graph_mode': 'cutoff', 'cutoff': 0.6043535898252217, 'grm_norm': 'gcn', 'self_loops': False, 'use_snp_selection': False}. Best is trial 103 with value: 0.12689197630595375.
[I 2025-11-03 14:08:55,922] Trial 104 finished with value: 0.1310460359363156 and parameters: {'model_type': 'gcn', 'hidden_dims': '[512, 128]', 'dropout': 0.12824289738887953, 'batch_norm': False, 'lr': 8.067447088493762e-05, 'weight_decay': 5.432963679854853e-07, 'epochs': 305, 'loss': 'mae', 'optimizer': 'adam', 'graph_mode': 'cutoff', 'cutoff': 0.6085922085059855, 'grm_norm': 'gcn', 'self_loops': False, 'use_snp_selection': False}. Best is trial 104 with value: 0.1310460359363156.
[I 2025-11-03 14:08:59,751] Trial 105 finished with value: 0.09430040226940327 and parameters: {'model_type': 'gcn', 'hidden_dims': '[512, 128]', 'dropout': 0.12539581620557458, 'batch_norm': False, 'lr': 8.122272170415879e-05, 'weight_decay': 5.426633833089857e-07, 'epochs': 308, 'loss': 'mae', 'optimizer': 'adam', 'graph_mode': 'cutoff', 'cutoff': 0.6088042509089869, 'grm_norm': 'gcn', 'self_loops': False, 'use_snp_selection': False}. Best is trial 104 with value: 0.1310460359363156.
[I 2025-11-03 14:09:03,605] Trial 106 finished with value: 0.09237693749733136 and parameters: {'model_type': 'gcn', 'hidden_dims': '[512, 128]', 'dropout': 0.11350725210401971, 'batch_norm': False, 'lr': 5.35179019012574e-05, 'weight_decay': 3.083998366561668e-07, 'epochs': 307, 'loss': 'mae', 'optimizer': 'adam', 'graph_mode': 'cutoff', 'cutoff': 0.5966014913583986, 'grm_norm': 'gcn', 'self_loops': False, 'use_snp_selection': False}. Best is trial 104 with value: 0.1310460359363156.
