[I 2025-11-03 16:22:06,906] Trial 101 finished with value: 0.13654338814497138 and parameters: {'model_type': 'graphsage', 'hidden_dims': '[256, 128, 64]', 'dropout': 0.30824110083998657, 'batch_norm': True, 'lr': 0.00035085776293304285, 'weight_decay': 0.0001833621216250095, 'epochs': 309, 'loss': 'mse', 'optimizer': 'adam', 'graph_mode': 'cutoff', 'cutoff': 0.27703976390685764, 'grm_norm': 'cosine_then_gcn', 'self_loops': True, 'use_snp_selection': False}. Best is trial 69 with value: 0.15410698700909709.
[I 2025-11-03 16:22:11,148] Trial 102 finished with value: 0.14781213487235312 and parameters: {'model_type': 'graphsage', 'hidden_dims': '[256, 128, 64]', 'dropout': 0.350897292839214, 'batch_norm': True, 'lr': 0.0004491465834555806, 'weight_decay': 0.0001366861622097153, 'epochs': 298, 'loss': 'mse', 'optimizer': 'adam', 'graph_mode': 'cutoff', 'cutoff': 0.28520122188627095, 'grm_norm': 'cosine', 'self_loops': True, 'use_snp_selection': False}. Best is trial 69 with value: 0.15410698700909709.
[I 2025-11-03 16:22:16,222] Trial 103 finished with value: 0.14474014607545582 and parameters: {'model_type': 'graphsage', 'hidden_dims': '[256, 128, 64]', 'dropout': 0.3476569391787831, 'batch_norm': True, 'lr': 0.0004689943628205514, 'weight_decay': 0.0008056973305087722, 'epochs': 321, 'loss': 'mse', 'optimizer': 'adam', 'graph_mode': 'cutoff', 'cutoff': 0.23139661339047157, 'grm_norm': 'none', 'self_loops': True, 'use_snp_selection': False}. Best is trial 69 with value: 0.15410698700909709.
[I 2025-11-03 16:22:21,351] Trial 104 finished with value: 0.14345043051050688 and parameters: {'model_type': 'graphsage', 'hidden_dims': '[256, 128, 64]', 'dropout': 0.3633945090133884, 'batch_norm': True, 'lr': 0.0006761459926183637, 'weight_decay': 0.000643697822540933, 'epochs': 291, 'loss': 'mse', 'optimizer': 'adam', 'graph_mode': 'cutoff', 'cutoff': 0.20058219412959666, 'grm_norm': 'none', 'self_loops': True, 'use_snp_selection': False}. Best is trial 69 with value: 0.15410698700909709.
[I 2025-11-03 16:22:25,016] Trial 105 finished with value: 0.10965581247681733 and parameters: {'model_type': 'graphsage', 'hidden_dims': '[256, 128, 64]', 'dropout': 0.3920615646484543, 'batch_norm': True, 'lr': 0.0005808791667216532, 'weight_decay': 0.00024902255023638353, 'epochs': 264, 'loss': 'mse', 'optimizer': 'adam', 'graph_mode': 'cutoff', 'cutoff': 0.3405474522005977, 'grm_norm': 'cosine_then_gcn', 'self_loops': False, 'use_snp_selection': False}. Best is trial 69 with value: 0.15410698700909709.
[I 2025-11-03 16:22:30,010] Trial 106 finished with value: 0.1382336608151925 and parameters: {'model_type': 'graphsage', 'hidden_dims': '[256, 128, 64]', 'dropout': 0.3258849436056581, 'batch_norm': True, 'lr': 0.0002718148776481708, 'weight_decay': 0.00047819938032714484, 'epochs': 348, 'loss': 'mse', 'optimizer': 'adam', 'graph_mode': 'cutoff', 'cutoff': 0.26149351322362707, 'grm_norm': 'none', 'self_loops': True, 'use_snp_selection': False}. Best is trial 69 with value: 0.15410698700909709.
[I 2025-11-03 16:22:34,349] Trial 107 finished with value: 0.04522156496020792 and parameters: {'model_type': 'graphsage', 'hidden_dims': '[256, 128, 64]', 'dropout': 0.3752184196546773, 'batch_norm': True, 'lr': 2.3129925064530994e-06, 'weight_decay': 9.748851937385309e-05, 'epochs': 254, 'loss': 'mse', 'optimizer': 'adam', 'graph_mode': 'cutoff', 'cutoff': 0.22956316413389763, 'grm_norm': 'gcn', 'self_loops': True, 'use_snp_selection': False}. Best is trial 69 with value: 0.15410698700909709.
[I 2025-11-03 16:22:36,161] Trial 108 finished with value: 0.11269518756456715 and parameters: {'model_type': 'graphsage', 'hidden_dims': '[256, 128, 64]', 'dropout': 0.35113719716113423, 'batch_norm': True, 'lr': 0.0008237141889586999, 'weight_decay': 7.448430374702054e-05, 'epochs': 45, 'loss': 'mse', 'optimizer': 'adam', 'graph_mode': 'cutoff', 'cutoff': 0.29836920463366634, 'grm_norm': 'none', 'self_loops': True, 'use_snp_selection': False}. Best is trial 69 with value: 0.15410698700909709.
[I 2025-11-03 16:22:40,227] Trial 109 finished with value: 0.10385262652316883 and parameters: {'model_type': 'graphsage', 'hidden_dims': '[256, 128, 64]', 'dropout': 0.317665380505733, 'batch_norm': False, 'lr': 0.0004245506878667307, 'weight_decay': 3.89858235621302e-05, 'epochs': 330, 'loss': 'mse', 'optimizer': 'adam', 'graph_mode': 'cutoff', 'cutoff': 0.48387979221716465, 'grm_norm': 'cosine', 'self_loops': True, 'use_snp_selection': True, 'num_snps': 37760}. Best is trial 69 with value: 0.15410698700909709.
[I 2025-11-03 16:22:44,093] Trial 110 finished with value: 0.11124072814467298 and parameters: {'model_type': 'graphsage', 'hidden_dims': '[256, 128, 64]', 'dropout': 0.3364405250265682, 'batch_norm': True, 'lr': 2.5319256129039628e-05, 'weight_decay': 0.0006021290242587974, 'epochs': 297, 'loss': 'mse', 'optimizer': 'adam', 'graph_mode': 'cutoff', 'cutoff': 0.39479400238592977, 'grm_norm': 'none', 'self_loops': True, 'use_snp_selection': False}. Best is trial 69 with value: 0.15410698700909709.
[I 2025-11-03 16:22:50,816] Trial 111 finished with value: 0.07758362671193514 and parameters: {'model_type': 'graphsage', 'hidden_dims': '[512, 128]', 'dropout': 0.30659924187261356, 'batch_norm': True, 'lr': 8.704893252565656e-06, 'weight_decay': 0.00012007930353499347, 'epochs': 314, 'loss': 'mse', 'optimizer': 'adam', 'graph_mode': 'cutoff', 'cutoff': 0.27799290698668777, 'grm_norm': 'cosine', 'self_loops': True, 'use_snp_selection': False}. Best is trial 69 with value: 0.15410698700909709.
[I 2025-11-03 16:22:57,919] Trial 112 finished with value: 0.13828619362503278 and parameters: {'model_type': 'graphsage', 'hidden_dims': '[512, 64]', 'dropout': 0.2887765518821859, 'batch_norm': True, 'lr': 0.00035837419582673846, 'weight_decay': 2.1998325656267986e-05, 'epochs': 301, 'loss': 'mse', 'optimizer': 'adam', 'graph_mode': 'cutoff', 'cutoff': 0.2184944287403659, 'grm_norm': 'cosine', 'self_loops': True, 'use_snp_selection': False}. Best is trial 69 with value: 0.15410698700909709.
[I 2025-11-03 16:23:04,198] Trial 113 finished with value: 0.1300707607591314 and parameters: {'model_type': 'graphsage', 'hidden_dims': '[512, 64]', 'dropout': 0.3580589700173206, 'batch_norm': True, 'lr': 0.00023535853607692896, 'weight_decay': 0.00036250711788568237, 'epochs': 278, 'loss': 'mse', 'optimizer': 'adam', 'graph_mode': 'cutoff', 'cutoff': 0.26094959441513754, 'grm_norm': 'cosine', 'self_loops': True, 'use_snp_selection': False}. Best is trial 69 with value: 0.15410698700909709.
[I 2025-11-03 16:23:08,017] Trial 114 finished with value: 0.1135725082335252 and parameters: {'model_type': 'graphsage', 'hidden_dims': '[256, 128, 64]', 'dropout': 0.27315763432761453, 'batch_norm': True, 'lr': 0.00048720319487102894, 'weight_decay': 0.0001407581900310375, 'epochs': 271, 'loss': 'mse', 'optimizer': 'adam', 'graph_mode': 'cutoff', 'cutoff': 0.317931075115675, 'grm_norm': 'none', 'self_loops': True, 'use_snp_selection': False}. Best is trial 69 with value: 0.15410698700909709.
[I 2025-11-03 16:23:13,683] Trial 115 finished with value: 0.1440055140940468 and parameters: {'model_type': 'graphsage', 'hidden_dims': '[512, 64]', 'dropout': 0.32789752318480253, 'batch_norm': True, 'lr': 0.00029796139685861153, 'weight_decay': 6.720839020283391e-05, 'epochs': 308, 'loss': 'mse', 'optimizer': 'adam', 'graph_mode': 'cutoff', 'cutoff': 0.5748157712857764, 'grm_norm': 'none', 'self_loops': True, 'use_snp_selection': False}. Best is trial 69 with value: 0.15410698700909709.
[I 2025-11-03 16:23:17,259] Trial 116 finished with value: 0.13090558215608875 and parameters: {'model_type': 'graphsage', 'hidden_dims': '[256, 128, 64]', 'dropout': 0.29948317138423775, 'batch_norm': True, 'lr': 0.00039218711334658413, 'weight_decay': 0.00019253026507620881, 'epochs': 326, 'loss': 'mae', 'optimizer': 'adam', 'graph_mode': 'cutoff', 'cutoff': 0.8341497155922593, 'grm_norm': 'cosine', 'self_loops': True, 'use_snp_selection': False}. Best is trial 69 with value: 0.15410698700909709.
[I 2025-11-03 16:23:22,719] Trial 117 finished with value: 0.15044308632333472 and parameters: {'model_type': 'graphsage', 'hidden_dims': '[256, 128, 64]', 'dropout': 0.4399550321689384, 'batch_norm': True, 'lr': 0.0003354714232546562, 'weight_decay': 0.000268886989501, 'epochs': 317, 'loss': 'mse', 'optimizer': 'adam', 'graph_mode': 'cutoff', 'cutoff': 0.2004213419799983, 'grm_norm': 'none', 'self_loops': True, 'use_snp_selection': False}. Best is trial 69 with value: 0.15410698700909709.
[I 2025-11-03 16:23:28,198] Trial 118 finished with value: 0.15551658510486643 and parameters: {'model_type': 'graphsage', 'hidden_dims': '[256, 128, 64]', 'dropout': 0.4717009250357544, 'batch_norm': True, 'lr': 0.0007152511259467264, 'weight_decay': 0.00027321870362150143, 'epochs': 319, 'loss': 'mse', 'optimizer': 'adam', 'graph_mode': 'cutoff', 'cutoff': 0.20135286128380708, 'grm_norm': 'none', 'self_loops': True, 'use_snp_selection': False}. Best is trial 118 with value: 0.15551658510486643.
[I 2025-11-03 16:23:33,693] Trial 119 finished with value: 0.1621043463471061 and parameters: {'model_type': 'graphsage', 'hidden_dims': '[256, 128, 64]', 'dropout': 0.4853501652602846, 'batch_norm': True, 'lr': 0.0006911710472405184, 'weight_decay': 0.000280468443527684, 'epochs': 319, 'loss': 'mse', 'optimizer': 'adam', 'graph_mode': 'cutoff', 'cutoff': 0.20041220313630326, 'grm_norm': 'none', 'self_loops': True, 'use_snp_selection': False}. Best is trial 119 with value: 0.1621043463471061.
[I 2025-11-03 16:23:39,121] Trial 120 finished with value: 0.14922721994026564 and parameters: {'model_type': 'graphsage', 'hidden_dims': '[256, 128, 64]', 'dropout': 0.44490364742059163, 'batch_norm': True, 'lr': 0.0007065863313424087, 'weight_decay': 0.0002903114186729995, 'epochs': 317, 'loss': 'mse', 'optimizer': 'adam', 'graph_mode': 'cutoff', 'cutoff': 0.20312077686023583, 'grm_norm': 'none', 'self_loops': True, 'use_snp_selection': False}. Best is trial 119 with value: 0.1621043463471061.
[I 2025-11-03 16:23:44,385] Trial 121 finished with value: 0.1260840793864261 and parameters: {'model_type': 'graphsage', 'hidden_dims': '[256, 128, 64]', 'dropout': 0.4813808728811039, 'batch_norm': True, 'lr': 0.0008695614129831645, 'weight_decay': 0.00028646520435797435, 'epochs': 315, 'loss': 'mse', 'optimizer': 'adam', 'graph_mode': 'cutoff', 'cutoff': 0.21256425927810743, 'grm_norm': 'none', 'self_loops': True, 'use_snp_selection': False}. Best is trial 119 with value: 0.1621043463471061.
[I 2025-11-03 16:23:49,851] Trial 122 finished with value: 0.14321008899803872 and parameters: {'model_type': 'graphsage', 'hidden_dims': '[256, 128, 64]', 'dropout': 0.44418981067482577, 'batch_norm': True, 'lr': 0.0006761511376812431, 'weight_decay': 0.00022845028615177068, 'epochs': 321, 'loss': 'mse', 'optimizer': 'adam', 'graph_mode': 'cutoff', 'cutoff': 0.2039938552154738, 'grm_norm': 'none', 'self_loops': True, 'use_snp_selection': False}. Best is trial 119 with value: 0.1621043463471061.
[I 2025-11-03 16:23:55,606] Trial 123 finished with value: 0.14746275644822032 and parameters: {'model_type': 'graphsage', 'hidden_dims': '[256, 128, 64]', 'dropout': 0.4473046661563449, 'batch_norm': True, 'lr': 0.0005983475753798857, 'weight_decay': 0.00033485876375334415, 'epochs': 341, 'loss': 'mse', 'optimizer': 'adam', 'graph_mode': 'cutoff', 'cutoff': 0.20157957916397998, 'grm_norm': 'none', 'self_loops': True, 'use_snp_selection': False}. Best is trial 119 with value: 0.1621043463471061.
[I 2025-11-03 16:24:00,697] Trial 124 finished with value: 0.13540758297603578 and parameters: {'model_type': 'graphsage', 'hidden_dims': '[256, 128, 64]', 'dropout': 0.4719082151634489, 'batch_norm': True, 'lr': 0.0007797199774188319, 'weight_decay': 0.00031929049765486644, 'epochs': 335, 'loss': 'mse', 'optimizer': 'adam', 'graph_mode': 'cutoff', 'cutoff': 0.24386634281265948, 'grm_norm': 'none', 'self_loops': True, 'use_snp_selection': False}. Best is trial 119 with value: 0.1621043463471061.
[I 2025-11-03 16:24:06,203] Trial 125 finished with value: 0.15440859421714556 and parameters: {'model_type': 'graphsage', 'hidden_dims': '[256, 128, 64]', 'dropout': 0.5005881734887019, 'batch_norm': True, 'lr': 0.0006233681004262289, 'weight_decay': 0.00020954791805384709, 'epochs': 347, 'loss': 'mse', 'optimizer': 'adam', 'graph_mode': 'cutoff', 'cutoff': 0.22224538196799482, 'grm_norm': 'none', 'self_loops': True, 'use_snp_selection': False}. Best is trial 119 with value: 0.1621043463471061.
[I 2025-11-03 16:24:10,993] Trial 126 finished with value: 0.12220225293367454 and parameters: {'model_type': 'graphsage', 'hidden_dims': '[256, 128, 64]', 'dropout': 0.5060332622701197, 'batch_norm': True, 'lr': 0.0007212612623383668, 'weight_decay': 0.00020821138123012007, 'epochs': 289, 'loss': 'mse', 'optimizer': 'adam', 'graph_mode': 'cutoff', 'cutoff': 0.22482749840789099, 'grm_norm': 'none', 'self_loops': True, 'use_snp_selection': False}. Best is trial 119 with value: 0.1621043463471061.
[I 2025-11-03 16:24:16,139] Trial 127 finished with value: 0.15452067905891748 and parameters: {'model_type': 'graphsage', 'hidden_dims': '[256, 128, 64]', 'dropout': 0.4967882606641825, 'batch_norm': True, 'lr': 0.0006100350666724059, 'weight_decay': 0.0001645238370866258, 'epochs': 346, 'loss': 'mse', 'optimizer': 'adam', 'graph_mode': 'cutoff', 'cutoff': 0.24832266480832477, 'grm_norm': 'none', 'self_loops': True, 'use_snp_selection': False}. Best is trial 119 with value: 0.1621043463471061.
[I 2025-11-03 16:24:21,349] Trial 128 finished with value: 0.13010071652478636 and parameters: {'model_type': 'graphsage', 'hidden_dims': '[256, 128, 64]', 'dropout': 0.49145100192529706, 'batch_norm': True, 'lr': 0.0009699567759476619, 'weight_decay': 0.00027251258963710513, 'epochs': 345, 'loss': 'mse', 'optimizer': 'adam', 'graph_mode': 'cutoff', 'cutoff': 0.24239011370688016, 'grm_norm': 'none', 'self_loops': True, 'use_snp_selection': False}. Best is trial 119 with value: 0.1621043463471061.
[I 2025-11-03 16:24:26,481] Trial 129 finished with value: 0.1325687957713526 and parameters: {'model_type': 'graphsage', 'hidden_dims': '[256, 128, 64]', 'dropout': 0.5029382909455102, 'batch_norm': True, 'lr': 0.0006237869610003601, 'weight_decay': 0.00016859649306443588, 'epochs': 318, 'loss': 'mse', 'optimizer': 'adam', 'graph_mode': 'cutoff', 'cutoff': 0.2245243295680934, 'grm_norm': 'none', 'self_loops': False, 'use_snp_selection': False}. Best is trial 119 with value: 0.1621043463471061.
[I 2025-11-03 16:24:29,997] Trial 130 finished with value: 0.1325264521136528 and parameters: {'model_type': 'graphsage', 'hidden_dims': '[256, 128, 64]', 'dropout': 0.5237766596310386, 'batch_norm': False, 'lr': 0.0005503099807514122, 'weight_decay': 9.973699678763149e-05, 'epochs': 333, 'loss': 'mse', 'optimizer': 'adam', 'graph_mode': 'cutoff', 'cutoff': 0.2594014902414481, 'grm_norm': 'none', 'self_loops': True, 'use_snp_selection': True, 'num_snps': 23556}. Best is trial 119 with value: 0.1621043463471061.
[I 2025-11-03 16:24:35,647] Trial 131 finished with value: 0.13948347864710822 and parameters: {'model_type': 'graphsage', 'hidden_dims': '[256, 128, 64]', 'dropout': 0.46508667526422864, 'batch_norm': True, 'lr': 0.0007041939464436856, 'weight_decay': 0.00014139980292043064, 'epochs': 350, 'loss': 'mse', 'optimizer': 'adam', 'graph_mode': 'cutoff', 'cutoff': 0.2181891318789231, 'grm_norm': 'none', 'self_loops': True, 'use_snp_selection': False}. Best is trial 119 with value: 0.1621043463471061.
[I 2025-11-03 16:24:41,011] Trial 132 finished with value: 0.14102926491650633 and parameters: {'model_type': 'graphsage', 'hidden_dims': '[256, 128, 64]', 'dropout': 0.4909106590746803, 'batch_norm': True, 'lr': 0.00047467961099878514, 'weight_decay': 0.00024352263753488228, 'epochs': 309, 'loss': 'mse', 'optimizer': 'adam', 'graph_mode': 'cutoff', 'cutoff': 0.20041145961486062, 'grm_norm': 'none', 'self_loops': True, 'use_snp_selection': False}. Best is trial 119 with value: 0.1621043463471061.
[I 2025-11-03 16:24:45,645] Trial 133 finished with value: 0.14044618670792355 and parameters: {'model_type': 'graphsage', 'hidden_dims': '[256, 128, 64]', 'dropout': 0.5327052064721008, 'batch_norm': True, 'lr': 0.0004349930602517446, 'weight_decay': 0.00040191038599872854, 'epochs': 298, 'loss': 'mse', 'optimizer': 'adam', 'graph_mode': 'cutoff', 'cutoff': 0.24806067741891644, 'grm_norm': 'none', 'self_loops': True, 'use_snp_selection': False}. Best is trial 119 with value: 0.1621043463471061.
[I 2025-11-03 16:24:50,827] Trial 134 finished with value: 0.13632891422084698 and parameters: {'model_type': 'graphsage', 'hidden_dims': '[256, 128, 64]', 'dropout': 0.4335871027510969, 'batch_norm': True, 'lr': 0.0005576924282381343, 'weight_decay': 0.00019237849648035433, 'epochs': 327, 'loss': 'mse', 'optimizer': 'adam', 'graph_mode': 'cutoff', 'cutoff': 0.22814375997438607, 'grm_norm': 'none', 'self_loops': True, 'use_snp_selection': False}. Best is trial 119 with value: 0.1621043463471061.
[I 2025-11-03 16:24:56,118] Trial 135 finished with value: 0.14791245205326972 and parameters: {'model_type': 'graphsage', 'hidden_dims': '[256, 128, 64]', 'dropout': 0.4577139137868978, 'batch_norm': True, 'lr': 0.0008519624950810011, 'weight_decay': 0.0001534728254909406, 'epochs': 320, 'loss': 'mse', 'optimizer': 'adam', 'graph_mode': 'cutoff', 'cutoff': 0.2169040843444934, 'grm_norm': 'none', 'self_loops': True, 'use_snp_selection': False}. Best is trial 119 with value: 0.1621043463471061.
[I 2025-11-03 16:25:01,552] Trial 136 finished with value: 0.15502451878500406 and parameters: {'model_type': 'graphsage', 'hidden_dims': '[256, 128]', 'dropout': 0.4588049392396685, 'batch_norm': True, 'lr': 0.0008420870424876448, 'weight_decay': 0.0002617651004071616, 'epochs': 335, 'loss': 'mse', 'optimizer': 'adam', 'graph_mode': 'cutoff', 'cutoff': 0.2132658859874243, 'grm_norm': 'none', 'self_loops': True, 'use_snp_selection': False}. Best is trial 119 with value: 0.1621043463471061.
[I 2025-11-03 16:25:06,563] Trial 137 finished with value: 0.1370812505998046 and parameters: {'model_type': 'graphsage', 'hidden_dims': '[256, 128]', 'dropout': 0.48176936176375923, 'batch_norm': True, 'lr': 0.0007178026042221226, 'weight_decay': 0.00030678390947957605, 'epochs': 336, 'loss': 'mse', 'optimizer': 'adam', 'graph_mode': 'cutoff', 'cutoff': 0.245461992870941, 'grm_norm': 'none', 'self_loops': True, 'use_snp_selection': False}. Best is trial 119 with value: 0.1621043463471061.
[I 2025-11-03 16:25:11,802] Trial 138 finished with value: 0.14506959495325666 and parameters: {'model_type': 'graphsage', 'hidden_dims': '[256, 128]', 'dropout': 0.564604686242449, 'batch_norm': True, 'lr': 0.0009692003344214107, 'weight_decay': 0.000394550998969647, 'epochs': 328, 'loss': 'mse', 'optimizer': 'adam', 'graph_mode': 'cutoff', 'cutoff': 0.22098041010615932, 'grm_norm': 'none', 'self_loops': True, 'use_snp_selection': False}. Best is trial 119 with value: 0.1621043463471061.
[I 2025-11-03 16:25:17,406] Trial 139 finished with value: 0.16184214414032147 and parameters: {'model_type': 'graphsage', 'hidden_dims': '[256, 128, 64]', 'dropout': 0.49993801815897193, 'batch_norm': True, 'lr': 0.0006079693859120618, 'weight_decay': 0.00023177914124181544, 'epochs': 346, 'loss': 'mse', 'optimizer': 'adam', 'graph_mode': 'cutoff', 'cutoff': 0.2147957928667487, 'grm_norm': 'none', 'self_loops': True, 'use_snp_selection': False}. Best is trial 119 with value: 0.1621043463471061.
[I 2025-11-03 16:25:22,361] Trial 140 finished with value: 0.1509768715154114 and parameters: {'model_type': 'graphsage', 'hidden_dims': '[256, 128]', 'dropout': 0.4985693461362033, 'batch_norm': True, 'lr': 0.0005660920422720715, 'weight_decay': 0.00021098387738085984, 'epochs': 345, 'loss': 'mse', 'optimizer': 'adam', 'graph_mode': 'cutoff', 'cutoff': 0.2573099589075795, 'grm_norm': 'none', 'self_loops': True, 'use_snp_selection': False}. Best is trial 119 with value: 0.1621043463471061.
[I 2025-11-03 16:25:27,518] Trial 141 finished with value: 0.14374557761486959 and parameters: {'model_type': 'graphsage', 'hidden_dims': '[256, 128]', 'dropout': 0.5041500959300292, 'batch_norm': True, 'lr': 0.0005242734701688188, 'weight_decay': 0.0002485527868381808, 'epochs': 343, 'loss': 'mse', 'optimizer': 'adam', 'graph_mode': 'cutoff', 'cutoff': 0.23905611821465092, 'grm_norm': 'none', 'self_loops': True, 'use_snp_selection': False}. Best is trial 119 with value: 0.1621043463471061.
[I 2025-11-03 16:25:32,461] Trial 142 finished with value: 0.13396071557640554 and parameters: {'model_type': 'graphsage', 'hidden_dims': '[256, 128]', 'dropout': 0.4784284082894039, 'batch_norm': True, 'lr': 0.0006244895353049738, 'weight_decay': 0.0002076815113915303, 'epochs': 350, 'loss': 'mse', 'optimizer': 'adam', 'graph_mode': 'cutoff', 'cutoff': 0.2628576661777903, 'grm_norm': 'none', 'self_loops': True, 'use_snp_selection': False}. Best is trial 119 with value: 0.1621043463471061.
[I 2025-11-03 16:25:37,866] Trial 143 finished with value: 0.13881133077756802 and parameters: {'model_type': 'graphsage', 'hidden_dims': '[256, 128]', 'dropout': 0.4974325013039834, 'batch_norm': True, 'lr': 0.0003088789516641278, 'weight_decay': 0.00017309626763321366, 'epochs': 337, 'loss': 'mse', 'optimizer': 'adam', 'graph_mode': 'cutoff', 'cutoff': 0.21662654315477642, 'grm_norm': 'none', 'self_loops': True, 'use_snp_selection': False}. Best is trial 119 with value: 0.1621043463471061.
