[I 2025-11-03 13:42:16,717] Trial 21 finished with value: 0.017959117856331416 and parameters: {'model_type': 'gcn', 'hidden_dims': '[256, 128, 64]', 'dropout': 0.43106876786559023, 'batch_norm': False, 'lr': 3.218522978576998e-06, 'weight_decay': 0.00019917584445956947, 'epochs': 146, 'loss': 'mse', 'optimizer': 'adam', 'graph_mode': 'off', 'use_snp_selection': True, 'num_snps': 18237}. Best is trial 3 with value: 0.04437937268203857.
[I 2025-11-03 13:42:18,053] Trial 22 finished with value: -0.0042144186010965624 and parameters: {'model_type': 'gcn', 'hidden_dims': '[256, 128, 64]', 'dropout': 0.45814908728145204, 'batch_norm': False, 'lr': 3.037785136331366e-06, 'weight_decay': 0.00010189001688333906, 'epochs': 169, 'loss': 'mse', 'optimizer': 'adam', 'graph_mode': 'off', 'use_snp_selection': True, 'num_snps': 22601}. Best is trial 3 with value: 0.04437937268203857.
[I 2025-11-03 13:42:18,888] Trial 23 finished with value: -0.056093839878050784 and parameters: {'model_type': 'gcn', 'hidden_dims': '[256, 128, 64]', 'dropout': 0.5245995990749711, 'batch_norm': False, 'lr': 1.0732177328169674e-06, 'weight_decay': 0.00047371602358128824, 'epochs': 80, 'loss': 'mse', 'optimizer': 'adam', 'graph_mode': 'off', 'use_snp_selection': True, 'num_snps': 11043}. Best is trial 3 with value: 0.04437937268203857.
[I 2025-11-03 13:42:20,186] Trial 24 finished with value: -0.00597862658322534 and parameters: {'model_type': 'gcn', 'hidden_dims': '[256, 128, 64]', 'dropout': 0.37969472499978774, 'batch_norm': False, 'lr': 5.450104373567728e-06, 'weight_decay': 3.6361321106234775e-05, 'epochs': 124, 'loss': 'mse', 'optimizer': 'adam', 'graph_mode': 'off', 'use_snp_selection': True, 'num_snps': 27266}. Best is trial 3 with value: 0.04437937268203857.
[I 2025-11-03 13:42:21,243] Trial 25 finished with value: -0.014702516686745533 and parameters: {'model_type': 'gcn', 'hidden_dims': '[128, 64]', 'dropout': 0.41699976528620064, 'batch_norm': False, 'lr': 2.422269945143646e-06, 'weight_decay': 0.00014977466677601196, 'epochs': 208, 'loss': 'mse', 'optimizer': 'adam', 'graph_mode': 'off', 'use_snp_selection': True, 'num_snps': 11975}. Best is trial 3 with value: 0.04437937268203857.
[I 2025-11-03 13:42:22,046] Trial 26 finished with value: 0.001891352981535725 and parameters: {'model_type': 'gcn', 'hidden_dims': '[256, 128]', 'dropout': 0.5674046429206574, 'batch_norm': False, 'lr': 5.933773279370658e-06, 'weight_decay': 1.4901638282675856e-05, 'epochs': 172, 'loss': 'mse', 'optimizer': 'adam', 'graph_mode': 'off', 'use_snp_selection': True, 'num_snps': 2156}. Best is trial 3 with value: 0.04437937268203857.
[I 2025-11-03 13:42:24,579] Trial 27 finished with value: -0.03646223561190706 and parameters: {'model_type': 'gcn', 'hidden_dims': '[512, 64]', 'dropout': 0.49961021450691634, 'batch_norm': False, 'lr': 1.4615632979788115e-05, 'weight_decay': 0.0004286358929849696, 'epochs': 277, 'loss': 'mse', 'optimizer': 'adam', 'graph_mode': 'off', 'use_snp_selection': True, 'num_snps': 42211}. Best is trial 3 with value: 0.04437937268203857.
[I 2025-11-03 13:42:25,776] Trial 28 finished with value: 0.006693103109901528 and parameters: {'model_type': 'gcn', 'hidden_dims': '[512, 256]', 'dropout': 0.35099252566048456, 'batch_norm': False, 'lr': 1.3130892084774215e-05, 'weight_decay': 5.971131244817706e-05, 'epochs': 78, 'loss': 'mae', 'optimizer': 'adam', 'graph_mode': 'off', 'use_snp_selection': False}. Best is trial 3 with value: 0.04437937268203857.
[I 2025-11-03 13:42:27,324] Trial 29 finished with value: -0.0096462564693897 and parameters: {'model_type': 'gcn', 'hidden_dims': '[128, 64]', 'dropout': 0.47048715477388725, 'batch_norm': False, 'lr': 2.534630930325139e-06, 'weight_decay': 5.1378103798111804e-05, 'epochs': 315, 'loss': 'mae', 'optimizer': 'adam', 'graph_mode': 'off', 'use_snp_selection': True, 'num_snps': 26460}. Best is trial 3 with value: 0.04437937268203857.
[I 2025-11-03 13:42:28,435] Trial 30 finished with value: 0.07188646269394335 and parameters: {'model_type': 'gcn', 'hidden_dims': '[256, 128, 64]', 'dropout': 0.5540803396351756, 'batch_norm': False, 'lr': 3.5202119249269794e-05, 'weight_decay': 0.0001938827698282308, 'epochs': 139, 'loss': 'mse', 'optimizer': 'adam', 'graph_mode': 'off', 'use_snp_selection': True, 'num_snps': 15097}. Best is trial 30 with value: 0.07188646269394335.
[I 2025-11-03 13:42:29,535] Trial 31 finished with value: 0.008728824041473592 and parameters: {'model_type': 'gcn', 'hidden_dims': '[256, 128, 64]', 'dropout': 0.5570722928186798, 'batch_norm': False, 'lr': 3.0383352138819223e-05, 'weight_decay': 0.0001856912912092733, 'epochs': 120, 'loss': 'mse', 'optimizer': 'adam', 'graph_mode': 'off', 'use_snp_selection': True, 'num_snps': 17175}. Best is trial 30 with value: 0.07188646269394335.
[I 2025-11-03 13:42:30,600] Trial 32 finished with value: -0.0017713616513230423 and parameters: {'model_type': 'gcn', 'hidden_dims': '[256, 128, 64]', 'dropout': 0.5996277749693233, 'batch_norm': False, 'lr': 0.00015278567872729852, 'weight_decay': 0.0005719887267237133, 'epochs': 144, 'loss': 'mse', 'optimizer': 'adam', 'graph_mode': 'off', 'use_snp_selection': True, 'num_snps': 12468}. Best is trial 30 with value: 0.07188646269394335.
[I 2025-11-03 13:42:31,707] Trial 33 finished with value: 0.029665898161002544 and parameters: {'model_type': 'gcn', 'hidden_dims': '[256, 128, 64]', 'dropout': 0.5089338218585711, 'batch_norm': False, 'lr': 3.370675628013212e-05, 'weight_decay': 0.0002891113719123499, 'epochs': 162, 'loss': 'mse', 'optimizer': 'adam', 'graph_mode': 'off', 'use_snp_selection': True, 'num_snps': 11188}. Best is trial 30 with value: 0.07188646269394335.
[I 2025-11-03 13:42:32,825] Trial 34 finished with value: 0.046879288107436495 and parameters: {'model_type': 'gcn', 'hidden_dims': '[256, 128]', 'dropout': 0.5109270784530657, 'batch_norm': True, 'lr': 3.747828395458085e-05, 'weight_decay': 0.0002820873437295587, 'epochs': 238, 'loss': 'mse', 'optimizer': 'adam', 'graph_mode': 'off', 'use_snp_selection': True, 'num_snps': 8660}. Best is trial 30 with value: 0.07188646269394335.
[I 2025-11-03 13:42:33,812] Trial 35 finished with value: -0.01389377384091998 and parameters: {'model_type': 'gcn', 'hidden_dims': '[256, 128]', 'dropout': 0.511291307488187, 'batch_norm': True, 'lr': 3.283688573061755e-05, 'weight_decay': 0.00030244851274759983, 'epochs': 231, 'loss': 'mse', 'optimizer': 'adam', 'graph_mode': 'off', 'use_snp_selection': True, 'num_snps': 2040}. Best is trial 30 with value: 0.07188646269394335.
[I 2025-11-03 13:42:34,962] Trial 36 finished with value: 0.009769764004565185 and parameters: {'model_type': 'gcn', 'hidden_dims': '[256, 128]', 'dropout': 0.5553382135617704, 'batch_norm': True, 'lr': 3.156665331708459e-05, 'weight_decay': 0.0009726416369633958, 'epochs': 251, 'loss': 'mse', 'optimizer': 'adam', 'graph_mode': 'off', 'use_snp_selection': True, 'num_snps': 7809}. Best is trial 30 with value: 0.07188646269394335.
[I 2025-11-03 13:42:36,682] Trial 37 finished with value: -0.009618926771056004 and parameters: {'model_type': 'gcn', 'hidden_dims': '[256, 128]', 'dropout': 0.5616188259493264, 'batch_norm': True, 'lr': 9.478163988020122e-05, 'weight_decay': 7.2921747674577865e-06, 'epochs': 309, 'loss': 'mae', 'optimizer': 'adam', 'graph_mode': 'off', 'use_snp_selection': False}. Best is trial 30 with value: 0.07188646269394335.
[I 2025-11-03 13:42:37,997] Trial 38 finished with value: -0.00815717985098418 and parameters: {'model_type': 'gcn', 'hidden_dims': '[256, 128]', 'dropout': 0.4821555539370637, 'batch_norm': True, 'lr': 9.330357478716042e-05, 'weight_decay': 8.856396795418981e-05, 'epochs': 263, 'loss': 'mse', 'optimizer': 'adam', 'graph_mode': 'off', 'use_snp_selection': True, 'num_snps': 15755}. Best is trial 30 with value: 0.07188646269394335.
[I 2025-11-03 13:42:39,825] Trial 39 finished with value: -0.03229547755906012 and parameters: {'model_type': 'gcn', 'hidden_dims': '[512, 128]', 'dropout': 0.5332686414046929, 'batch_norm': True, 'lr': 4.2476003995045354e-05, 'weight_decay': 1.98284395820634e-05, 'epochs': 189, 'loss': 'mse', 'optimizer': 'adam', 'graph_mode': 'off', 'use_snp_selection': False}. Best is trial 30 with value: 0.07188646269394335.
[I 2025-11-03 13:42:41,795] Trial 40 finished with value: 0.007205441568354136 and parameters: {'model_type': 'gcn', 'hidden_dims': '[512, 64]', 'dropout': 0.5988568895086473, 'batch_norm': True, 'lr': 0.0005032660082464978, 'weight_decay': 0.0003307636000624041, 'epochs': 328, 'loss': 'mae', 'optimizer': 'adam', 'graph_mode': 'off', 'use_snp_selection': True, 'num_snps': 24265}. Best is trial 30 with value: 0.07188646269394335.
[I 2025-11-03 13:42:42,918] Trial 41 finished with value: 0.02150806908894297 and parameters: {'model_type': 'gcn', 'hidden_dims': '[256, 128, 64]', 'dropout': 0.3952080425989313, 'batch_norm': True, 'lr': 4.343624226441063e-05, 'weight_decay': 0.0005683635279677192, 'epochs': 161, 'loss': 'mse', 'optimizer': 'adam', 'graph_mode': 'off', 'use_snp_selection': True, 'num_snps': 10295}. Best is trial 30 with value: 0.07188646269394335.
[I 2025-11-03 13:42:43,935] Trial 42 finished with value: -0.009301182987475877 and parameters: {'model_type': 'gcn', 'hidden_dims': '[512, 256]', 'dropout': 0.511739483803818, 'batch_norm': False, 'lr': 1.1900472982389308e-05, 'weight_decay': 0.00024150273733244563, 'epochs': 128, 'loss': 'mse', 'optimizer': 'adam', 'graph_mode': 'off', 'use_snp_selection': True, 'num_snps': 13919}. Best is trial 30 with value: 0.07188646269394335.
[I 2025-11-03 13:42:44,962] Trial 43 finished with value: 0.03256601090366231 and parameters: {'model_type': 'gcn', 'hidden_dims': '[256, 128]', 'dropout': 0.4219807038357588, 'batch_norm': True, 'lr': 1.853401693684837e-06, 'weight_decay': 5.350750040714549e-05, 'epochs': 212, 'loss': 'mse', 'optimizer': 'adam', 'graph_mode': 'off', 'use_snp_selection': True, 'num_snps': 6603}. Best is trial 30 with value: 0.07188646269394335.
[I 2025-11-03 13:42:45,976] Trial 44 finished with value: 0.012227010250510813 and parameters: {'model_type': 'gcn', 'hidden_dims': '[256, 128]', 'dropout': 0.5661738491720827, 'batch_norm': True, 'lr': 1.391541115679466e-06, 'weight_decay': 5.060865436833216e-05, 'epochs': 216, 'loss': 'mse', 'optimizer': 'adam', 'graph_mode': 'off', 'use_snp_selection': True, 'num_snps': 5280}. Best is trial 30 with value: 0.07188646269394335.
[I 2025-11-03 13:42:47,231] Trial 45 finished with value: 0.007209107528895519 and parameters: {'model_type': 'gcn', 'hidden_dims': '[256, 128]', 'dropout': 0.452644948637796, 'batch_norm': True, 'lr': 7.866103537980707e-05, 'weight_decay': 0.00010060979909143901, 'epochs': 182, 'loss': 'mse', 'optimizer': 'adam', 'graph_mode': 'off', 'use_snp_selection': False}. Best is trial 30 with value: 0.07188646269394335.
[I 2025-11-03 13:42:48,260] Trial 46 finished with value: 0.005717740844884707 and parameters: {'model_type': 'gcn', 'hidden_dims': '[256, 128]', 'dropout': 0.5423821651294413, 'batch_norm': True, 'lr': 2.3583882917855127e-05, 'weight_decay': 7.173810472103029e-05, 'epochs': 201, 'loss': 'mse', 'optimizer': 'adam', 'graph_mode': 'off', 'use_snp_selection': True, 'num_snps': 8037}. Best is trial 30 with value: 0.07188646269394335.
[I 2025-11-03 13:42:51,334] Trial 47 finished with value: -0.0020280342152147884 and parameters: {'model_type': 'gcn', 'hidden_dims': '[512, 64]', 'dropout': 0.5790096407057191, 'batch_norm': True, 'lr': 1.8625696653443923e-06, 'weight_decay': 2.4193265330602335e-05, 'epochs': 294, 'loss': 'mae', 'optimizer': 'adam', 'graph_mode': 'off', 'use_snp_selection': True, 'num_snps': 53324}. Best is trial 30 with value: 0.07188646269394335.
[I 2025-11-03 13:42:52,737] Trial 48 finished with value: 0.034121812158916444 and parameters: {'model_type': 'gcn', 'hidden_dims': '[256, 128]', 'dropout': 0.4930172931594377, 'batch_norm': True, 'lr': 5.236803247561666e-05, 'weight_decay': 1.1496493821517286e-05, 'epochs': 223, 'loss': 'mse', 'optimizer': 'adam', 'graph_mode': 'off', 'use_snp_selection': False}. Best is trial 30 with value: 0.07188646269394335.
[I 2025-11-03 13:42:54,159] Trial 49 finished with value: 0.0014249549281438673 and parameters: {'model_type': 'gcn', 'hidden_dims': '[256, 128]', 'dropout': 0.48505854885074917, 'batch_norm': True, 'lr': 5.831467236088994e-05, 'weight_decay': 1.2132982952208272e-05, 'epochs': 234, 'loss': 'mse', 'optimizer': 'adam', 'graph_mode': 'off', 'use_snp_selection': False}. Best is trial 30 with value: 0.07188646269394335.
[I 2025-11-03 13:42:55,688] Trial 50 finished with value: -0.0569020310723134 and parameters: {'model_type': 'gcn', 'hidden_dims': '[256, 128]', 'dropout': 0.4330040049893468, 'batch_norm': True, 'lr': 1.0634775938194225e-05, 'weight_decay': 3.153474699554488e-06, 'epochs': 259, 'loss': 'mae', 'optimizer': 'adam', 'graph_mode': 'off', 'use_snp_selection': False}. Best is trial 30 with value: 0.07188646269394335.
[I 2025-11-03 13:42:57,068] Trial 51 finished with value: -0.014243619740879331 and parameters: {'model_type': 'gcn', 'hidden_dims': '[256, 128]', 'dropout': 0.5120587390483529, 'batch_norm': True, 'lr': 0.00012170486543391672, 'weight_decay': 7.332172305272837e-06, 'epochs': 222, 'loss': 'mse', 'optimizer': 'adam', 'graph_mode': 'off', 'use_snp_selection': False}. Best is trial 30 with value: 0.07188646269394335.
[I 2025-11-03 13:42:59,034] Trial 52 finished with value: 0.026278575335585162 and parameters: {'model_type': 'gcn', 'hidden_dims': '[512, 128]', 'dropout': 0.4729103072879551, 'batch_norm': True, 'lr': 4.8127098950266805e-05, 'weight_decay': 4.410776048157314e-05, 'epochs': 211, 'loss': 'mse', 'optimizer': 'adam', 'graph_mode': 'off', 'use_snp_selection': False}. Best is trial 30 with value: 0.07188646269394335.
[I 2025-11-03 13:43:00,241] Trial 53 finished with value: -0.004373724577266309 and parameters: {'model_type': 'gcn', 'hidden_dims': '[256, 128]', 'dropout': 0.5454572612401392, 'batch_norm': True, 'lr': 2.6195819115184564e-05, 'weight_decay': 0.00013398202379147716, 'epochs': 161, 'loss': 'mse', 'optimizer': 'adam', 'graph_mode': 'off', 'use_snp_selection': False}. Best is trial 30 with value: 0.07188646269394335.
[I 2025-11-03 13:43:02,375] Trial 54 finished with value: -0.02076341063801683 and parameters: {'model_type': 'gcn', 'hidden_dims': '[512, 64]', 'dropout': 0.41511601891927474, 'batch_norm': True, 'lr': 6.28672159834576e-05, 'weight_decay': 2.351712894895386e-05, 'epochs': 238, 'loss': 'mse', 'optimizer': 'adam', 'graph_mode': 'off', 'use_snp_selection': False}. Best is trial 30 with value: 0.07188646269394335.
[I 2025-11-03 13:43:03,473] Trial 55 finished with value: 0.00832010138065914 and parameters: {'model_type': 'gcn', 'hidden_dims': '[128, 64]', 'dropout': 0.4985342866899417, 'batch_norm': True, 'lr': 3.696164091749257e-05, 'weight_decay': 9.945941321941949e-06, 'epochs': 184, 'loss': 'mse', 'optimizer': 'adam', 'graph_mode': 'off', 'use_snp_selection': True, 'num_snps': 14319}. Best is trial 30 with value: 0.07188646269394335.
[I 2025-11-03 13:43:04,994] Trial 56 finished with value: 0.006654842841192659 and parameters: {'model_type': 'gcn', 'hidden_dims': '[256, 128]', 'dropout': 0.46001057856530503, 'batch_norm': False, 'lr': 1.6693156359609692e-05, 'weight_decay': 1.9294840938962944e-06, 'epochs': 273, 'loss': 'mse', 'optimizer': 'adam', 'graph_mode': 'off', 'use_snp_selection': False}. Best is trial 30 with value: 0.07188646269394335.
[I 2025-11-03 13:43:06,502] Trial 57 finished with value: 0.024349953327711834 and parameters: {'model_type': 'gcn', 'hidden_dims': '[256, 128, 64]', 'dropout': 0.5779352268501978, 'batch_norm': False, 'lr': 0.00023336622285263797, 'weight_decay': 4.9789722660603664e-06, 'epochs': 136, 'loss': 'mae', 'optimizer': 'adam', 'graph_mode': 'off', 'use_snp_selection': True, 'num_snps': 31990}. Best is trial 30 with value: 0.07188646269394335.
[I 2025-11-03 13:43:07,394] Trial 58 finished with value: 0.014910951344307193 and parameters: {'model_type': 'gcn', 'hidden_dims': '[512, 256]', 'dropout': 0.5257508502729688, 'batch_norm': True, 'lr': 7.3282702745217166e-06, 'weight_decay': 3.735489222864122e-05, 'epochs': 163, 'loss': 'mse', 'optimizer': 'adam', 'graph_mode': 'off', 'use_snp_selection': True, 'num_snps': 4669}. Best is trial 30 with value: 0.07188646269394335.
[I 2025-11-03 13:43:10,123] Trial 59 finished with value: 0.018147259352581244 and parameters: {'model_type': 'gcn', 'hidden_dims': '[512, 64]', 'dropout': 0.1780090758356534, 'batch_norm': False, 'lr': 1.004991471033841e-06, 'weight_decay': 5.351110388180581e-07, 'epochs': 347, 'loss': 'mse', 'optimizer': 'adam', 'graph_mode': 'off', 'use_snp_selection': False}. Best is trial 30 with value: 0.07188646269394335.
[I 2025-11-03 13:43:12,228] Trial 60 finished with value: 0.010863151380230932 and parameters: {'model_type': 'gcn', 'hidden_dims': '[256, 128, 64]', 'dropout': 0.3776665555522415, 'batch_norm': False, 'lr': 2.0270880520856044e-06, 'weight_decay': 0.0003727532718878172, 'epochs': 291, 'loss': 'mse', 'optimizer': 'adam', 'graph_mode': 'off', 'use_snp_selection': True, 'num_snps': 36642}. Best is trial 30 with value: 0.07188646269394335.
[I 2025-11-03 13:43:13,273] Trial 61 finished with value: -0.011010038487988887 and parameters: {'model_type': 'gcn', 'hidden_dims': '[256, 128, 64]', 'dropout': 0.35688783658570256, 'batch_norm': False, 'lr': 3.953820101490863e-06, 'weight_decay': 0.0002555624299323578, 'epochs': 154, 'loss': 'mse', 'optimizer': 'adam', 'graph_mode': 'off', 'use_snp_selection': True, 'num_snps': 9955}. Best is trial 30 with value: 0.07188646269394335.
[I 2025-11-03 13:43:14,109] Trial 62 finished with value: 0.007567670740552584 and parameters: {'model_type': 'gcn', 'hidden_dims': '[256, 128, 64]', 'dropout': 0.29745775576153044, 'batch_norm': False, 'lr': 4.5059269120477495e-06, 'weight_decay': 0.000637476801471273, 'epochs': 91, 'loss': 'mse', 'optimizer': 'adam', 'graph_mode': 'off', 'use_snp_selection': True, 'num_snps': 8295}. Best is trial 30 with value: 0.07188646269394335.
[I 2025-11-03 13:43:15,388] Trial 63 finished with value: 0.019698521480485422 and parameters: {'model_type': 'gcn', 'hidden_dims': '[256, 128, 64]', 'dropout': 0.42448665841126776, 'batch_norm': False, 'lr': 1.8534736836511896e-05, 'weight_decay': 0.0002238091675093404, 'epochs': 201, 'loss': 'mse', 'optimizer': 'adam', 'graph_mode': 'off', 'use_snp_selection': True, 'num_snps': 14916}. Best is trial 30 with value: 0.07188646269394335.
[I 2025-11-03 13:43:16,567] Trial 64 finished with value: 0.01140542730070967 and parameters: {'model_type': 'gcn', 'hidden_dims': '[256, 128, 64]', 'dropout': 0.4918138966251126, 'batch_norm': False, 'lr': 1.6191621161469476e-06, 'weight_decay': 0.00011146409619661097, 'epochs': 225, 'loss': 'mse', 'optimizer': 'adam', 'graph_mode': 'off', 'use_snp_selection': True, 'num_snps': 5551}. Best is trial 30 with value: 0.07188646269394335.
[I 2025-11-03 13:43:17,990] Trial 65 finished with value: -0.0004929328546387031 and parameters: {'model_type': 'gcn', 'hidden_dims': '[512, 128]', 'dropout': 0.400337819240543, 'batch_norm': False, 'lr': 5.644937124298211e-05, 'weight_decay': 6.917078431572443e-05, 'epochs': 175, 'loss': 'mae', 'optimizer': 'adam', 'graph_mode': 'off', 'use_snp_selection': True, 'num_snps': 22047}. Best is trial 30 with value: 0.07188646269394335.
[I 2025-11-03 13:43:18,811] Trial 66 finished with value: -0.023901258270517596 and parameters: {'model_type': 'gcn', 'hidden_dims': '[256, 128]', 'dropout': 0.5146644069857889, 'batch_norm': False, 'lr': 6.900377562343955e-06, 'weight_decay': 0.00016520053097369188, 'epochs': 114, 'loss': 'mse', 'optimizer': 'adam', 'graph_mode': 'off', 'use_snp_selection': True, 'num_snps': 9740}. Best is trial 30 with value: 0.07188646269394335.
[I 2025-11-03 13:43:19,937] Trial 67 finished with value: 0.023783100103583088 and parameters: {'model_type': 'gcn', 'hidden_dims': '[128, 64]', 'dropout': 0.2374265408751493, 'batch_norm': False, 'lr': 2.458003146197366e-05, 'weight_decay': 1.4642865074813007e-05, 'epochs': 247, 'loss': 'mse', 'optimizer': 'adam', 'graph_mode': 'off', 'use_snp_selection': False}. Best is trial 30 with value: 0.07188646269394335.
[I 2025-11-03 13:43:20,722] Trial 68 finished with value: -0.024339163077474885 and parameters: {'model_type': 'gcn', 'hidden_dims': '[512, 64]', 'dropout': 0.4468475276637686, 'batch_norm': False, 'lr': 3.7914264624294024e-06, 'weight_decay': 0.0004281019042940273, 'epochs': 134, 'loss': 'mae', 'optimizer': 'adam', 'graph_mode': 'off', 'use_snp_selection': True, 'num_snps': 4749}. Best is trial 30 with value: 0.07188646269394335.
[I 2025-11-03 13:43:22,137] Trial 69 finished with value: -0.03065488868922098 and parameters: {'model_type': 'gcn', 'hidden_dims': '[256, 128, 64]', 'dropout': 0.5517444893677365, 'batch_norm': True, 'lr': 1.241306447889028e-06, 'weight_decay': 0.0007293797181439387, 'epochs': 195, 'loss': 'mse', 'optimizer': 'adam', 'graph_mode': 'off', 'use_snp_selection': True, 'num_snps': 19137}. Best is trial 30 with value: 0.07188646269394335.
[I 2025-11-03 13:43:23,252] Trial 70 finished with value: 0.02654685939467796 and parameters: {'model_type': 'gcn', 'hidden_dims': '[256, 128]', 'dropout': 0.46627144189480824, 'batch_norm': False, 'lr': 7.538578604869995e-05, 'weight_decay': 1.8876001521351663e-07, 'epochs': 154, 'loss': 'mse', 'optimizer': 'adam', 'graph_mode': 'off', 'use_snp_selection': False}. Best is trial 30 with value: 0.07188646269394335.
[I 2025-11-03 13:43:24,476] Trial 71 finished with value: -0.009454981781899637 and parameters: {'model_type': 'gcn', 'hidden_dims': '[256, 128, 64]', 'dropout': 0.44943402721038983, 'batch_norm': False, 'lr': 2.2520123951544335e-06, 'weight_decay': 0.00016580949164204367, 'epochs': 139, 'loss': 'mse', 'optimizer': 'adam', 'graph_mode': 'off', 'use_snp_selection': True, 'num_snps': 20963}. Best is trial 30 with value: 0.07188646269394335.
