[I 2025-11-03 12:15:28,740] Trial 65 finished with value: 0.10053650073679714 and parameters: {'model_type': 'graphsage', 'hidden_dims': '[512, 128]', 'dropout': 0.2561957240360617, 'batch_norm': False, 'lr': 0.00023865511122371573, 'weight_decay': 0.0001894819519619268, 'epochs': 325, 'loss': 'mae', 'optimizer': 'adam', 'graph_mode': 'cutoff', 'cutoff': 0.5925771322299886, 'grm_norm': 'cosine_then_gcn', 'self_loops': False, 'use_snp_selection': True, 'num_snps': 53440}. Best is trial 56 with value: 0.10286505916793648.
[I 2025-11-03 12:15:37,541] Trial 66 finished with value: 0.07651102546581907 and parameters: {'model_type': 'graphsage', 'hidden_dims': '[512, 128]', 'dropout': 0.25193316055407283, 'batch_norm': False, 'lr': 0.0002896769703298451, 'weight_decay': 0.00019424090794833564, 'epochs': 331, 'loss': 'mae', 'optimizer': 'adam', 'graph_mode': 'cutoff', 'cutoff': 0.6043118948603522, 'grm_norm': 'cosine_then_gcn', 'self_loops': False, 'use_snp_selection': True, 'num_snps': 58435}. Best is trial 56 with value: 0.10286505916793648.
[I 2025-11-03 12:15:46,358] Trial 67 finished with value: 0.0836137598002255 and parameters: {'model_type': 'graphsage', 'hidden_dims': '[512, 128]', 'dropout': 0.2812335842185598, 'batch_norm': False, 'lr': 0.00021937585607366717, 'weight_decay': 0.0005848454865122351, 'epochs': 341, 'loss': 'mae', 'optimizer': 'adam', 'graph_mode': 'cutoff', 'cutoff': 0.5059243270190599, 'grm_norm': 'none', 'self_loops': False, 'use_snp_selection': True, 'num_snps': 54734}. Best is trial 56 with value: 0.10286505916793648.
[I 2025-11-03 12:15:53,538] Trial 68 finished with value: 0.09812575376549386 and parameters: {'model_type': 'graphsage', 'hidden_dims': '[512, 128]', 'dropout': 0.3058698766169346, 'batch_norm': False, 'lr': 0.00015752340336456084, 'weight_decay': 0.0007081668899774838, 'epochs': 323, 'loss': 'mae', 'optimizer': 'adam', 'graph_mode': 'cutoff', 'cutoff': 0.6284018438315531, 'grm_norm': 'cosine_then_gcn', 'self_loops': False, 'use_snp_selection': True, 'num_snps': 46136}. Best is trial 56 with value: 0.10286505916793648.
[I 2025-11-03 12:15:59,901] Trial 69 finished with value: 0.08161827691595443 and parameters: {'model_type': 'graphsage', 'hidden_dims': '[256, 128, 64]', 'dropout': 0.34460858076763934, 'batch_norm': False, 'lr': 0.00016309281437827005, 'weight_decay': 0.0007240794409403929, 'epochs': 324, 'loss': 'mae', 'optimizer': 'adam', 'graph_mode': 'cutoff', 'cutoff': 0.6363120264684542, 'grm_norm': 'cosine', 'self_loops': True, 'use_snp_selection': True, 'num_snps': 59994}. Best is trial 56 with value: 0.10286505916793648.
[I 2025-11-03 12:16:06,753] Trial 70 finished with value: 0.0929182338746061 and parameters: {'model_type': 'graphsage', 'hidden_dims': '[512, 128]', 'dropout': 0.3116498204957199, 'batch_norm': False, 'lr': 0.00023472507966451506, 'weight_decay': 0.0004480919616880779, 'epochs': 296, 'loss': 'mae', 'optimizer': 'adam', 'graph_mode': 'cutoff', 'cutoff': 0.6938395125525992, 'grm_norm': 'cosine_then_gcn', 'self_loops': False, 'use_snp_selection': True, 'num_snps': 45897}. Best is trial 56 with value: 0.10286505916793648.
[I 2025-11-03 12:16:14,815] Trial 71 finished with value: 0.09812293867368392 and parameters: {'model_type': 'graphsage', 'hidden_dims': '[512, 128]', 'dropout': 0.28570034415732254, 'batch_norm': False, 'lr': 0.00041715052932957537, 'weight_decay': 0.0002099011404346688, 'epochs': 311, 'loss': 'mae', 'optimizer': 'adam', 'graph_mode': 'cutoff', 'cutoff': 0.5976172390829741, 'grm_norm': 'cosine_then_gcn', 'self_loops': False, 'use_snp_selection': True, 'num_snps': 53958}. Best is trial 56 with value: 0.10286505916793648.
[I 2025-11-03 12:16:23,207] Trial 72 finished with value: 0.07160472433946562 and parameters: {'model_type': 'graphsage', 'hidden_dims': '[512, 128]', 'dropout': 0.2944033871139863, 'batch_norm': False, 'lr': 0.00042537925617236976, 'weight_decay': 0.00019987131631307627, 'epochs': 335, 'loss': 'mae', 'optimizer': 'adam', 'graph_mode': 'cutoff', 'cutoff': 0.6052129995823102, 'grm_norm': 'cosine_then_gcn', 'self_loops': False, 'use_snp_selection': True, 'num_snps': 54252}. Best is trial 56 with value: 0.10286505916793648.
[I 2025-11-03 12:16:31,767] Trial 73 finished with value: 0.05970097243788787 and parameters: {'model_type': 'graphsage', 'hidden_dims': '[512, 128]', 'dropout': 0.3259047626252939, 'batch_norm': False, 'lr': 0.00032557525961815975, 'weight_decay': 0.0007440831397428822, 'epochs': 312, 'loss': 'mae', 'optimizer': 'adam', 'graph_mode': 'cutoff', 'cutoff': 0.5334456540602686, 'grm_norm': 'cosine_then_gcn', 'self_loops': False, 'use_snp_selection': True, 'num_snps': 57502}. Best is trial 56 with value: 0.10286505916793648.
[I 2025-11-03 12:16:34,427] Trial 74 finished with value: 0.030969042605957627 and parameters: {'model_type': 'graphsage', 'hidden_dims': '[512, 64]', 'dropout': 0.25102229624861344, 'batch_norm': False, 'lr': 0.00048371044329848856, 'weight_decay': 0.0004095581892741587, 'epochs': 324, 'loss': 'mae', 'optimizer': 'adam', 'graph_mode': 'cutoff', 'cutoff': 0.6373899933845889, 'grm_norm': 'cosine_then_gcn', 'self_loops': False, 'use_snp_selection': True, 'num_snps': 4028}. Best is trial 56 with value: 0.10286505916793648.
[I 2025-11-03 12:16:42,354] Trial 75 finished with value: 0.093071152833402 and parameters: {'model_type': 'graphsage', 'hidden_dims': '[512, 128]', 'dropout': 0.28713838049642976, 'batch_norm': False, 'lr': 0.0001365775839566555, 'weight_decay': 0.00022847251371447587, 'epochs': 301, 'loss': 'mae', 'optimizer': 'adam', 'graph_mode': 'cutoff', 'cutoff': 0.5908484547234532, 'grm_norm': 'cosine_then_gcn', 'self_loops': False, 'use_snp_selection': True, 'num_snps': 54438}. Best is trial 56 with value: 0.10286505916793648.
[I 2025-11-03 12:16:50,945] Trial 76 finished with value: 0.06516419633343497 and parameters: {'model_type': 'graphsage', 'hidden_dims': '[512, 256]', 'dropout': 0.22535244638467197, 'batch_norm': False, 'lr': 0.00027195138048231957, 'weight_decay': 0.0005298592267728111, 'epochs': 344, 'loss': 'mae', 'optimizer': 'adam', 'graph_mode': 'cutoff', 'cutoff': 0.47622761457067075, 'grm_norm': 'none', 'self_loops': True, 'use_snp_selection': True, 'num_snps': 49792}. Best is trial 56 with value: 0.10286505916793648.
[I 2025-11-03 12:16:53,756] Trial 77 finished with value: 0.0751713379579567 and parameters: {'model_type': 'graphsage', 'hidden_dims': '[512, 128]', 'dropout': 0.1858063503748276, 'batch_norm': False, 'lr': 7.523480713701287e-05, 'weight_decay': 3.3532567903997046e-05, 'epochs': 313, 'loss': 'mae', 'optimizer': 'adam', 'graph_mode': 'cutoff', 'cutoff': 0.7294432468170179, 'grm_norm': 'cosine', 'self_loops': False, 'use_snp_selection': True, 'num_snps': 7895}. Best is trial 56 with value: 0.10286505916793648.
[I 2025-11-03 12:17:02,563] Trial 78 finished with value: 0.07902503901929914 and parameters: {'model_type': 'graphsage', 'hidden_dims': '[512, 128]', 'dropout': 0.25647215137166407, 'batch_norm': False, 'lr': 0.00018058594978866211, 'weight_decay': 0.00016342132127700925, 'epochs': 335, 'loss': 'mae', 'optimizer': 'adam', 'graph_mode': 'cutoff', 'cutoff': 0.6617934077729111, 'grm_norm': 'cosine_then_gcn', 'self_loops': False, 'use_snp_selection': True, 'num_snps': 58516}. Best is trial 56 with value: 0.10286505916793648.
[I 2025-11-03 12:17:10,779] Trial 79 finished with value: 0.08961505665562836 and parameters: {'model_type': 'graphsage', 'hidden_dims': '[512, 128]', 'dropout': 0.2085533822252514, 'batch_norm': False, 'lr': 0.00014518816517952252, 'weight_decay': 0.0008292094062304962, 'epochs': 327, 'loss': 'mae', 'optimizer': 'adam', 'graph_mode': 'cutoff', 'cutoff': 0.6194044821433248, 'grm_norm': 'cosine_then_gcn', 'self_loops': False, 'use_snp_selection': True, 'num_snps': 53633}. Best is trial 56 with value: 0.10286505916793648.
[I 2025-11-03 12:17:16,307] Trial 80 finished with value: 0.07136186663667998 and parameters: {'model_type': 'graphsage', 'hidden_dims': '[256, 128, 64]', 'dropout': 0.3003448366614382, 'batch_norm': False, 'lr': 2.921880372182292e-05, 'weight_decay': 0.0006504988222347653, 'epochs': 289, 'loss': 'mae', 'optimizer': 'adam', 'graph_mode': 'cutoff', 'cutoff': 0.5389979715714599, 'grm_norm': 'cosine_then_gcn', 'self_loops': False, 'use_snp_selection': True, 'num_snps': 50854}. Best is trial 56 with value: 0.10286505916793648.
[I 2025-11-03 12:17:24,257] Trial 81 finished with value: 0.09222879239274445 and parameters: {'model_type': 'graphsage', 'hidden_dims': '[512, 128]', 'dropout': 0.2865651859078456, 'batch_norm': False, 'lr': 0.00013577056079227786, 'weight_decay': 0.00023480099325721003, 'epochs': 300, 'loss': 'mae', 'optimizer': 'adam', 'graph_mode': 'cutoff', 'cutoff': 0.5899252782513076, 'grm_norm': 'cosine_then_gcn', 'self_loops': False, 'use_snp_selection': True, 'num_snps': 54294}. Best is trial 56 with value: 0.10286505916793648.
[I 2025-11-03 12:17:32,533] Trial 82 finished with value: 0.10298220767882374 and parameters: {'model_type': 'graphsage', 'hidden_dims': '[512, 128]', 'dropout': 0.3195176136024123, 'batch_norm': False, 'lr': 0.00035961948751440844, 'weight_decay': 0.00031490383119689035, 'epochs': 307, 'loss': 'mae', 'optimizer': 'adam', 'graph_mode': 'cutoff', 'cutoff': 0.5896176656150803, 'grm_norm': 'cosine_then_gcn', 'self_loops': False, 'use_snp_selection': True, 'num_snps': 56027}. Best is trial 82 with value: 0.10298220767882374.
[I 2025-11-03 12:17:41,136] Trial 83 finished with value: 0.07766785870120706 and parameters: {'model_type': 'graphsage', 'hidden_dims': '[512, 128]', 'dropout': 0.3125756924961636, 'batch_norm': False, 'lr': 0.0003530595062748572, 'weight_decay': 6.670817507941941e-05, 'epochs': 319, 'loss': 'mae', 'optimizer': 'adam', 'graph_mode': 'cutoff', 'cutoff': 0.6337694965328345, 'grm_norm': 'cosine_then_gcn', 'self_loops': False, 'use_snp_selection': True, 'num_snps': 58250}. Best is trial 82 with value: 0.10298220767882374.
[I 2025-11-03 12:17:49,434] Trial 84 finished with value: 0.0669244790112303 and parameters: {'model_type': 'graphsage', 'hidden_dims': '[512, 128]', 'dropout': 0.34727777799652154, 'batch_norm': False, 'lr': 0.00022801001576982716, 'weight_decay': 0.0003236600673547547, 'epochs': 310, 'loss': 'mae', 'optimizer': 'adam', 'graph_mode': 'cutoff', 'cutoff': 0.5614550546320691, 'grm_norm': 'gcn', 'self_loops': False, 'use_snp_selection': True, 'num_snps': 56101}. Best is trial 82 with value: 0.10298220767882374.
[I 2025-11-03 12:17:56,887] Trial 85 finished with value: 0.07956478343925756 and parameters: {'model_type': 'graphsage', 'hidden_dims': '[512, 128]', 'dropout': 0.23151294658022678, 'batch_norm': False, 'lr': 0.00040035695385154613, 'weight_decay': 0.00043477039442981976, 'epochs': 350, 'loss': 'mae', 'optimizer': 'adam', 'graph_mode': 'cutoff', 'cutoff': 0.5952825433468554, 'grm_norm': 'cosine_then_gcn', 'self_loops': True, 'use_snp_selection': True, 'num_snps': 45287}. Best is trial 82 with value: 0.10298220767882374.
[I 2025-11-03 12:18:04,327] Trial 86 finished with value: 0.08047118984183349 and parameters: {'model_type': 'graphsage', 'hidden_dims': '[512, 128]', 'dropout': 0.3348439636374178, 'batch_norm': False, 'lr': 0.0005223453288723164, 'weight_decay': 0.0005307202201325212, 'epochs': 320, 'loss': 'mae', 'optimizer': 'adam', 'graph_mode': 'cutoff', 'cutoff': 0.6817671901811246, 'grm_norm': 'cosine_then_gcn', 'self_loops': False, 'use_snp_selection': True, 'num_snps': 48374}. Best is trial 82 with value: 0.10298220767882374.
[I 2025-11-03 12:18:12,633] Trial 87 finished with value: 0.07991064070444394 and parameters: {'model_type': 'graphsage', 'hidden_dims': '[512, 128]', 'dropout': 0.17221127183422547, 'batch_norm': False, 'lr': 4.9603165870532695e-05, 'weight_decay': 0.00030339045803215556, 'epochs': 268, 'loss': 'mae', 'optimizer': 'adam', 'graph_mode': 'cutoff', 'cutoff': 0.5111382937517349, 'grm_norm': 'cosine_then_gcn', 'self_loops': False, 'use_snp_selection': True, 'num_snps': 59843}. Best is trial 82 with value: 0.10298220767882374.
[I 2025-11-03 12:18:21,235] Trial 88 finished with value: 0.08091378523272294 and parameters: {'model_type': 'graphsage', 'hidden_dims': '[512, 64]', 'dropout': 0.25927676517961407, 'batch_norm': False, 'lr': 0.00019232747752879993, 'weight_decay': 0.00012679826425884868, 'epochs': 339, 'loss': 'mae', 'optimizer': 'adam', 'graph_mode': 'cutoff', 'cutoff': 0.6168566084197784, 'grm_norm': 'none', 'self_loops': False, 'use_snp_selection': True, 'num_snps': 55582}. Best is trial 82 with value: 0.10298220767882374.
[I 2025-11-03 12:18:29,106] Trial 89 finished with value: 0.09292170906660213 and parameters: {'model_type': 'graphsage', 'hidden_dims': '[512, 256]', 'dropout': 0.10028010296252257, 'batch_norm': False, 'lr': 7.182557186973878e-05, 'weight_decay': 0.0008880808920289373, 'epochs': 307, 'loss': 'mae', 'optimizer': 'adam', 'graph_mode': 'cutoff', 'cutoff': 0.5504340438159168, 'grm_norm': 'cosine_then_gcn', 'self_loops': False, 'use_snp_selection': True, 'num_snps': 52641}. Best is trial 82 with value: 0.10298220767882374.
[I 2025-11-03 12:18:33,642] Trial 90 finished with value: 0.09066347545885728 and parameters: {'model_type': 'graphsage', 'hidden_dims': '[512, 128]', 'dropout': 0.31699331156200095, 'batch_norm': False, 'lr': 0.0007860534911022167, 'weight_decay': 0.00017583553989696391, 'epochs': 327, 'loss': 'mae', 'optimizer': 'adam', 'graph_mode': 'cutoff', 'cutoff': 0.6481927856683838, 'grm_norm': 'cosine', 'self_loops': False, 'use_snp_selection': True, 'num_snps': 23908}. Best is trial 82 with value: 0.10298220767882374.
[I 2025-11-03 12:18:41,623] Trial 91 finished with value: 0.0835070668456503 and parameters: {'model_type': 'graphsage', 'hidden_dims': '[512, 128]', 'dropout': 0.2800532142104097, 'batch_norm': False, 'lr': 0.0001306496619627433, 'weight_decay': 0.00024715208316219875, 'epochs': 298, 'loss': 'mae', 'optimizer': 'adam', 'graph_mode': 'cutoff', 'cutoff': 0.5915791810898151, 'grm_norm': 'cosine_then_gcn', 'self_loops': False, 'use_snp_selection': True, 'num_snps': 55199}. Best is trial 82 with value: 0.10298220767882374.
[I 2025-11-03 12:18:49,827] Trial 92 finished with value: 0.10308926469434723 and parameters: {'model_type': 'graphsage', 'hidden_dims': '[512, 128]', 'dropout': 0.2888214042312055, 'batch_norm': False, 'lr': 0.0002692176764082273, 'weight_decay': 0.00021261888433659728, 'epochs': 289, 'loss': 'mae', 'optimizer': 'adam', 'graph_mode': 'cutoff', 'cutoff': 0.5776006247356319, 'grm_norm': 'cosine_then_gcn', 'self_loops': False, 'use_snp_selection': True, 'num_snps': 58151}. Best is trial 92 with value: 0.10308926469434723.
[I 2025-11-03 12:18:58,084] Trial 93 finished with value: 0.08046674307272081 and parameters: {'model_type': 'graphsage', 'hidden_dims': '[512, 128]', 'dropout': 0.3036130087656786, 'batch_norm': False, 'lr': 0.0002757280225275225, 'weight_decay': 0.0003669642406764255, 'epochs': 290, 'loss': 'mae', 'optimizer': 'adam', 'graph_mode': 'cutoff', 'cutoff': 0.530949312210778, 'grm_norm': 'cosine_then_gcn', 'self_loops': False, 'use_snp_selection': True, 'num_snps': 57117}. Best is trial 92 with value: 0.10308926469434723.
[I 2025-11-03 12:19:06,960] Trial 94 finished with value: 0.08364467055709708 and parameters: {'model_type': 'graphsage', 'hidden_dims': '[512, 128]', 'dropout': 0.324663905125378, 'batch_norm': False, 'lr': 0.0003226018582863593, 'weight_decay': 0.000658712159214098, 'epochs': 333, 'loss': 'mae', 'optimizer': 'adam', 'graph_mode': 'cutoff', 'cutoff': 0.5756154884749622, 'grm_norm': 'cosine_then_gcn', 'self_loops': False, 'use_snp_selection': True, 'num_snps': 58586}. Best is trial 92 with value: 0.10308926469434723.
[I 2025-11-03 12:19:14,939] Trial 95 finished with value: 0.10468386800364146 and parameters: {'model_type': 'graphsage', 'hidden_dims': '[512, 128]', 'dropout': 0.21456575783160362, 'batch_norm': False, 'lr': 0.00022113361387906467, 'weight_decay': 7.258629784445751e-05, 'epochs': 317, 'loss': 'mae', 'optimizer': 'adam', 'graph_mode': 'cutoff', 'cutoff': 0.6144045321622518, 'grm_norm': 'cosine_then_gcn', 'self_loops': False, 'use_snp_selection': True, 'num_snps': 53218}. Best is trial 95 with value: 0.10468386800364146.
[I 2025-11-03 12:19:22,697] Trial 96 finished with value: 0.08989852929757869 and parameters: {'model_type': 'graphsage', 'hidden_dims': '[512, 128]', 'dropout': 0.22227990042997278, 'batch_norm': False, 'lr': 0.0002386767798640468, 'weight_decay': 4.160130597098599e-05, 'epochs': 321, 'loss': 'mae', 'optimizer': 'adam', 'graph_mode': 'cutoff', 'cutoff': 0.6154689635290175, 'grm_norm': 'gcn', 'self_loops': False, 'use_snp_selection': True, 'num_snps': 50513}. Best is trial 95 with value: 0.10468386800364146.
[I 2025-11-03 12:19:28,052] Trial 97 finished with value: 0.07980390249364994 and parameters: {'model_type': 'graphsage', 'hidden_dims': '[512, 128]', 'dropout': 0.2427882088949145, 'batch_norm': False, 'lr': 0.0006034248769476595, 'weight_decay': 7.323128034022805e-05, 'epochs': 316, 'loss': 'mae', 'optimizer': 'adam', 'graph_mode': 'cutoff', 'cutoff': 0.6705926304707011, 'grm_norm': 'cosine_then_gcn', 'self_loops': False, 'use_snp_selection': True, 'num_snps': 31354}. Best is trial 95 with value: 0.10468386800364146.
[I 2025-11-03 12:19:33,661] Trial 98 finished with value: 0.07220345394437801 and parameters: {'model_type': 'graphsage', 'hidden_dims': '[512, 128]', 'dropout': 0.28913616407079734, 'batch_norm': False, 'lr': 0.0003862471937947281, 'weight_decay': 0.00014365906300255657, 'epochs': 247, 'loss': 'mae', 'optimizer': 'adam', 'graph_mode': 'cutoff', 'cutoff': 0.578407006568213, 'grm_norm': 'cosine_then_gcn', 'self_loops': False, 'use_snp_selection': True, 'num_snps': 38211}. Best is trial 95 with value: 0.10468386800364146.
[I 2025-11-03 12:19:41,084] Trial 99 finished with value: 0.06455051171302756 and parameters: {'model_type': 'graphsage', 'hidden_dims': '[512, 128]', 'dropout': 0.12042377971530557, 'batch_norm': True, 'lr': 0.00017299642735033272, 'weight_decay': 0.00011750404512418243, 'epochs': 270, 'loss': 'mae', 'optimizer': 'adam', 'graph_mode': 'cutoff', 'cutoff': 0.6516369935982664, 'grm_norm': 'cosine_then_gcn', 'self_loops': True, 'use_snp_selection': True, 'num_snps': 52929}. Best is trial 95 with value: 0.10468386800364146.
[I 2025-11-03 12:19:45,566] Trial 100 finished with value: 0.09378601492527211 and parameters: {'model_type': 'graphsage', 'hidden_dims': '[256, 128, 64]', 'dropout': 0.1983640902790351, 'batch_norm': False, 'lr': 0.00019661040064515353, 'weight_decay': 0.00020940052563929313, 'epochs': 344, 'loss': 'mae', 'optimizer': 'adam', 'graph_mode': 'cutoff', 'cutoff': 0.6189328854797643, 'grm_norm': 'cosine_then_gcn', 'self_loops': False, 'use_snp_selection': False}. Best is trial 95 with value: 0.10468386800364146.
[I 2025-11-03 12:19:54,097] Trial 101 finished with value: 0.10315828129051569 and parameters: {'model_type': 'graphsage', 'hidden_dims': '[512, 128]', 'dropout': 0.14550104060857766, 'batch_norm': False, 'lr': 0.00021410187336843165, 'weight_decay': 0.0002843058967771166, 'epochs': 307, 'loss': 'mae', 'optimizer': 'adam', 'graph_mode': 'cutoff', 'cutoff': 0.5533603960929442, 'grm_norm': 'cosine_then_gcn', 'self_loops': False, 'use_snp_selection': True, 'num_snps': 57561}. Best is trial 95 with value: 0.10468386800364146.
[I 2025-11-03 12:20:02,332] Trial 102 finished with value: 0.09306379075960676 and parameters: {'model_type': 'graphsage', 'hidden_dims': '[512, 128]', 'dropout': 0.16965677545910218, 'batch_norm': False, 'lr': 0.00021670131688901766, 'weight_decay': 0.00028005528953307853, 'epochs': 306, 'loss': 'mae', 'optimizer': 'adam', 'graph_mode': 'cutoff', 'cutoff': 0.5550677655125842, 'grm_norm': 'cosine_then_gcn', 'self_loops': False, 'use_snp_selection': True, 'num_snps': 55510}. Best is trial 95 with value: 0.10468386800364146.
[I 2025-11-03 12:20:12,975] Trial 103 finished with value: 0.07030911520789809 and parameters: {'model_type': 'graphsage', 'hidden_dims': '[512, 128]', 'dropout': 0.14116623606408352, 'batch_norm': False, 'lr': 0.0002562752291613219, 'weight_decay': 0.0001776331159125505, 'epochs': 286, 'loss': 'mae', 'optimizer': 'adam', 'graph_mode': 'cutoff', 'cutoff': 0.2455290606699374, 'grm_norm': 'cosine_then_gcn', 'self_loops': False, 'use_snp_selection': True, 'num_snps': 58026}. Best is trial 95 with value: 0.10468386800364146.
[I 2025-11-03 12:20:18,195] Trial 104 finished with value: 0.0961833513716603 and parameters: {'model_type': 'graphsage', 'hidden_dims': '[128, 64]', 'dropout': 0.15946671857962436, 'batch_norm': False, 'lr': 0.0003008180821903634, 'weight_decay': 0.0003995841459855838, 'epochs': 330, 'loss': 'mae', 'optimizer': 'adam', 'graph_mode': 'cutoff', 'cutoff': 0.48443158751523474, 'grm_norm': 'cosine_then_gcn', 'self_loops': False, 'use_snp_selection': True, 'num_snps': 53284}. Best is trial 95 with value: 0.10468386800364146.
[I 2025-11-03 12:20:26,543] Trial 105 finished with value: 0.09707703069621967 and parameters: {'model_type': 'graphsage', 'hidden_dims': '[512, 128]', 'dropout': 0.1349641451264609, 'batch_norm': False, 'lr': 0.0004411547754121657, 'weight_decay': 0.0002939555573838516, 'epochs': 309, 'loss': 'mae', 'optimizer': 'adam', 'graph_mode': 'cutoff', 'cutoff': 0.6006759661291451, 'grm_norm': 'cosine_then_gcn', 'self_loops': False, 'use_snp_selection': True, 'num_snps': 56952}. Best is trial 95 with value: 0.10468386800364146.
