[I 2025-11-13 19:54:18,735] Trial 27 finished with value: 0.11425842511107528 and parameters: {'model_type': 'graphsage', 'hidden_dims': '[256, 128]', 'dropout': 0.5409733384204808, 'batch_norm': False, 'lr': 0.00030677833008374594, 'weight_decay': 3.091261843713213e-06, 'epochs': 108, 'loss': 'mae', 'optimizer': 'adam', 'graph_mode': 'cutoff', 'cutoff': 0.6457131700588835, 'grm_norm': 'cosine_then_gcn', 'self_loops': False, 'use_snp_selection': True, 'num_snps': 36163}. Best is trial 8 with value: 0.266471348049475.
[I 2025-11-13 19:56:31,182] Trial 28 finished with value: 0.24453960913978207 and parameters: {'model_type': 'graphsage', 'hidden_dims': '[128, 64]', 'dropout': 0.3129528816540199, 'batch_norm': True, 'lr': 3.284066574045698e-06, 'weight_decay': 2.287650183546384e-07, 'epochs': 267, 'loss': 'mse', 'optimizer': 'adam', 'graph_mode': 'knn', 'source': 'grm', 'knn_k': 10, 'weighted_edges': False, 'symmetrize_mode': 'mutual', 'use_snp_selection': False}. Best is trial 8 with value: 0.266471348049475.
[I 2025-11-13 19:57:40,585] Trial 29 finished with value: 0.24375806590425428 and parameters: {'model_type': 'graphsage', 'hidden_dims': '[512, 128]', 'dropout': 0.1763010566883515, 'batch_norm': True, 'lr': 4.286366514544022e-05, 'weight_decay': 8.230715762379583e-05, 'epochs': 74, 'loss': 'mae', 'optimizer': 'adam', 'graph_mode': 'knn', 'source': 'grm', 'knn_k': 1, 'weighted_edges': False, 'symmetrize_mode': 'mutual', 'use_snp_selection': False}. Best is trial 8 with value: 0.266471348049475.
[I 2025-11-13 20:00:05,123] Trial 30 finished with value: 0.0 and parameters: {'model_type': 'graphsage', 'hidden_dims': '[128, 64]', 'dropout': 0.4319830908435392, 'batch_norm': False, 'lr': 0.0008057480812934646, 'weight_decay': 2.0657164296073778e-05, 'epochs': 199, 'loss': 'mae', 'optimizer': 'adam', 'graph_mode': 'cutoff', 'cutoff': 0.4930608403361803, 'grm_norm': 'gcn', 'self_loops': True, 'use_snp_selection': True, 'num_snps': 58163}. Best is trial 8 with value: 0.266471348049475.
[I 2025-11-13 20:04:57,618] Trial 31 finished with value: 0.24735198352561202 and parameters: {'model_type': 'graphsage', 'hidden_dims': '[512, 128]', 'dropout': 0.5961797414500049, 'batch_norm': True, 'lr': 0.0001027317673004503, 'weight_decay': 1.4327125002461061e-07, 'epochs': 344, 'loss': 'mse', 'optimizer': 'adam', 'graph_mode': 'cutoff', 'cutoff': 0.31130290256457016, 'grm_norm': 'cosine', 'self_loops': True, 'use_snp_selection': False}. Best is trial 8 with value: 0.266471348049475.
[I 2025-11-13 20:10:55,038] Trial 32 finished with value: 0.24110228721651836 and parameters: {'model_type': 'graphsage', 'hidden_dims': '[512, 128]', 'dropout': 0.5550214443952369, 'batch_norm': True, 'lr': 0.0001286137484969147, 'weight_decay': 1.0039146335638559e-07, 'epochs': 279, 'loss': 'mse', 'optimizer': 'adam', 'graph_mode': 'cutoff', 'cutoff': 0.21426255247750822, 'grm_norm': 'cosine', 'self_loops': True, 'use_snp_selection': False}. Best is trial 8 with value: 0.266471348049475.
[I 2025-11-13 20:14:26,220] Trial 33 finished with value: 0.2665763414453633 and parameters: {'model_type': 'graphsage', 'hidden_dims': '[512, 128]', 'dropout': 0.5639011376683031, 'batch_norm': True, 'lr': 0.0004358738195211114, 'weight_decay': 9.231534663827125e-07, 'epochs': 246, 'loss': 'mse', 'optimizer': 'adam', 'graph_mode': 'cutoff', 'cutoff': 0.32747231561645995, 'grm_norm': 'cosine', 'self_loops': True, 'use_snp_selection': False}. Best is trial 33 with value: 0.2665763414453633.
[I 2025-11-13 20:17:45,176] Trial 34 finished with value: 0.2586234653423054 and parameters: {'model_type': 'graphsage', 'hidden_dims': '[512, 128]', 'dropout': 0.511032845767093, 'batch_norm': True, 'lr': 0.0005384524397059019, 'weight_decay': 1.1691040392436474e-06, 'epochs': 238, 'loss': 'mse', 'optimizer': 'adam', 'graph_mode': 'cutoff', 'cutoff': 0.35940937414871, 'grm_norm': 'cosine', 'self_loops': True, 'use_snp_selection': False}. Best is trial 33 with value: 0.2665763414453633.
[I 2025-11-13 20:19:03,784] Trial 35 finished with value: 0.24923342494290268 and parameters: {'model_type': 'graphsage', 'hidden_dims': '[128, 64]', 'dropout': 0.48173492923245587, 'batch_norm': True, 'lr': 0.000542223107229418, 'weight_decay': 2.645630868605482e-06, 'epochs': 292, 'loss': 'mse', 'optimizer': 'adam', 'graph_mode': 'cutoff', 'cutoff': 0.5365411854982776, 'grm_norm': 'none', 'self_loops': True, 'use_snp_selection': False}. Best is trial 33 with value: 0.2665763414453633.
[I 2025-11-13 20:22:24,943] Trial 36 finished with value: 0.2364900299487739 and parameters: {'model_type': 'graphsage', 'hidden_dims': '[256, 128]', 'dropout': 0.5614755584693105, 'batch_norm': True, 'lr': 0.0002581720324102465, 'weight_decay': 1.3985865574924896e-05, 'epochs': 313, 'loss': 'mse', 'optimizer': 'adam', 'graph_mode': 'knn', 'source': 'grm', 'knn_k': 5, 'weighted_edges': True, 'symmetrize_mode': 'union', 'use_snp_selection': False}. Best is trial 33 with value: 0.2665763414453633.
[I 2025-11-13 20:25:31,595] Trial 37 finished with value: 0.26520558936004535 and parameters: {'model_type': 'graphsage', 'hidden_dims': '[512, 256]', 'dropout': 0.5082455659776982, 'batch_norm': True, 'lr': 0.0004268768202965026, 'weight_decay': 5.152104910606204e-06, 'epochs': 223, 'loss': 'mse', 'optimizer': 'adam', 'graph_mode': 'cutoff', 'cutoff': 0.3743436388387401, 'grm_norm': 'cosine', 'self_loops': False, 'use_snp_selection': False}. Best is trial 33 with value: 0.2665763414453633.
[I 2025-11-13 20:28:50,792] Trial 38 finished with value: 0.26384213342533 and parameters: {'model_type': 'graphsage', 'hidden_dims': '[512, 256]', 'dropout': 0.510238308958116, 'batch_norm': True, 'lr': 0.00042152972460814114, 'weight_decay': 5.231881450357287e-06, 'epochs': 233, 'loss': 'mse', 'optimizer': 'adam', 'graph_mode': 'cutoff', 'cutoff': 0.33674117490830835, 'grm_norm': 'cosine', 'self_loops': False, 'use_snp_selection': False}. Best is trial 33 with value: 0.2665763414453633.
[I 2025-11-13 20:32:16,303] Trial 39 finished with value: 0.2627620621017639 and parameters: {'model_type': 'graphsage', 'hidden_dims': '[512, 256]', 'dropout': 0.561570764643825, 'batch_norm': True, 'lr': 0.0009933657235712148, 'weight_decay': 0.00022240073010192476, 'epochs': 251, 'loss': 'mse', 'optimizer': 'adam', 'graph_mode': 'cutoff', 'cutoff': 0.4026031386430905, 'grm_norm': 'cosine', 'self_loops': False, 'use_snp_selection': False}. Best is trial 33 with value: 0.2665763414453633.
[I 2025-11-13 20:35:49,494] Trial 40 finished with value: 0.26103833574813295 and parameters: {'model_type': 'graphsage', 'hidden_dims': '[512, 256]', 'dropout': 0.5106080037278895, 'batch_norm': True, 'lr': 0.000602345387918943, 'weight_decay': 2.48025897494079e-05, 'epochs': 210, 'loss': 'mse', 'optimizer': 'adam', 'graph_mode': 'cutoff', 'cutoff': 0.26097449299108455, 'grm_norm': 'cosine', 'self_loops': False, 'use_snp_selection': False}. Best is trial 33 with value: 0.2665763414453633.
[I 2025-11-13 20:39:07,673] Trial 41 finished with value: 0.26519365678209905 and parameters: {'model_type': 'graphsage', 'hidden_dims': '[512, 256]', 'dropout': 0.5118802488348645, 'batch_norm': True, 'lr': 0.00035470362553170434, 'weight_decay': 5.268304380791587e-06, 'epochs': 229, 'loss': 'mse', 'optimizer': 'adam', 'graph_mode': 'cutoff', 'cutoff': 0.3304588772194187, 'grm_norm': 'cosine', 'self_loops': False, 'use_snp_selection': False}. Best is trial 33 with value: 0.2665763414453633.
[I 2025-11-13 20:41:56,781] Trial 42 finished with value: 0.2516110842120101 and parameters: {'model_type': 'graphsage', 'hidden_dims': '[512, 256]', 'dropout': 0.4577597264710492, 'batch_norm': True, 'lr': 0.000253418455113633, 'weight_decay': 3.550584204051601e-05, 'epochs': 192, 'loss': 'mse', 'optimizer': 'adam', 'graph_mode': 'cutoff', 'cutoff': 0.3341589196035577, 'grm_norm': 'cosine', 'self_loops': False, 'use_snp_selection': False}. Best is trial 33 with value: 0.2665763414453633.
[I 2025-11-13 20:45:21,845] Trial 43 finished with value: 0.2658606389969504 and parameters: {'model_type': 'graphsage', 'hidden_dims': '[512, 256]', 'dropout': 0.5758717475093875, 'batch_norm': True, 'lr': 0.00039898539773297826, 'weight_decay': 6.404529177362426e-06, 'epochs': 252, 'loss': 'mse', 'optimizer': 'adam', 'graph_mode': 'cutoff', 'cutoff': 0.42268766033352523, 'grm_norm': 'cosine', 'self_loops': False, 'use_snp_selection': False}. Best is trial 33 with value: 0.2665763414453633.
[I 2025-11-13 20:48:46,419] Trial 44 finished with value: 0.2650467321269353 and parameters: {'model_type': 'graphsage', 'hidden_dims': '[512, 256]', 'dropout': 0.5735295672638401, 'batch_norm': True, 'lr': 0.0007322243346909927, 'weight_decay': 1.4700317413249225e-05, 'epochs': 253, 'loss': 'mse', 'optimizer': 'adam', 'graph_mode': 'cutoff', 'cutoff': 0.4392594092192374, 'grm_norm': 'cosine', 'self_loops': False, 'use_snp_selection': False}. Best is trial 33 with value: 0.2665763414453633.
[I 2025-11-13 20:52:29,903] Trial 45 finished with value: 0.26683441598895186 and parameters: {'model_type': 'graphsage', 'hidden_dims': '[512, 256]', 'dropout': 0.5307377375141347, 'batch_norm': True, 'lr': 0.00019419435449275637, 'weight_decay': 8.316320320822914e-06, 'epochs': 273, 'loss': 'mse', 'optimizer': 'adam', 'graph_mode': 'cutoff', 'cutoff': 0.377623949930697, 'grm_norm': 'gcn', 'self_loops': False, 'use_snp_selection': False}. Best is trial 45 with value: 0.26683441598895186.
[I 2025-11-13 20:54:39,763] Trial 46 finished with value: 0.24594943385141357 and parameters: {'model_type': 'graphsage', 'hidden_dims': '[256, 128, 64]', 'dropout': 0.5371050527040581, 'batch_norm': True, 'lr': 0.00016509520500893412, 'weight_decay': 2.3471720433271187e-06, 'epochs': 320, 'loss': 'mse', 'optimizer': 'adam', 'graph_mode': 'cutoff', 'cutoff': 0.5684694026321268, 'grm_norm': 'gcn', 'self_loops': False, 'use_snp_selection': False}. Best is trial 45 with value: 0.26683441598895186.
[I 2025-11-13 20:57:53,720] Trial 47 finished with value: 0.26561641057338403 and parameters: {'model_type': 'graphsage', 'hidden_dims': '[512, 128]', 'dropout': 0.5769046201261254, 'batch_norm': True, 'lr': 0.0002142870687089917, 'weight_decay': 8.541704544146704e-06, 'epochs': 273, 'loss': 'mse', 'optimizer': 'adam', 'graph_mode': 'cutoff', 'cutoff': 0.5318825183439346, 'grm_norm': 'gcn', 'self_loops': False, 'use_snp_selection': False}. Best is trial 45 with value: 0.26683441598895186.
[I 2025-11-13 21:01:43,631] Trial 48 finished with value: 0.25273974169679403 and parameters: {'model_type': 'graphsage', 'hidden_dims': '[512, 64]', 'dropout': 0.22287373264375274, 'batch_norm': True, 'lr': 0.00029274260864218106, 'weight_decay': 0.0006997317972977202, 'epochs': 290, 'loss': 'mse', 'optimizer': 'adam', 'graph_mode': 'cutoff', 'cutoff': 0.44491137496876354, 'grm_norm': 'gcn', 'self_loops': False, 'use_snp_selection': False}. Best is trial 45 with value: 0.26683441598895186.
[I 2025-11-13 21:06:46,920] Trial 49 finished with value: 0.25426289423563475 and parameters: {'model_type': 'graphsage', 'hidden_dims': '[512, 256]', 'dropout': 0.3747739367650044, 'batch_norm': True, 'lr': 0.00015325512516304842, 'weight_decay': 4.5879634541748016e-05, 'epochs': 331, 'loss': 'mse', 'optimizer': 'adam', 'graph_mode': 'cutoff', 'cutoff': 0.28677492768785395, 'grm_norm': 'gcn', 'self_loops': True, 'use_snp_selection': False}. Best is trial 45 with value: 0.26683441598895186.
[I 2025-11-13 21:07:58,096] Trial 50 finished with value: 0.21042042491742824 and parameters: {'model_type': 'graphsage', 'hidden_dims': '[512, 128]', 'dropout': 0.13406170297243514, 'batch_norm': True, 'lr': 2.4804813621787817e-05, 'weight_decay': 1.2662779282173278e-05, 'epochs': 48, 'loss': 'mse', 'optimizer': 'adam', 'graph_mode': 'cutoff', 'cutoff': 0.24909242238189122, 'grm_norm': 'gcn', 'self_loops': False, 'use_snp_selection': False}. Best is trial 45 with value: 0.26683441598895186.
[I 2025-11-13 21:11:14,823] Trial 51 finished with value: 0.26163839627345103 and parameters: {'model_type': 'graphsage', 'hidden_dims': '[512, 128]', 'dropout': 0.5743723361630104, 'batch_norm': True, 'lr': 0.0002168041005675236, 'weight_decay': 7.373212041854703e-06, 'epochs': 274, 'loss': 'mse', 'optimizer': 'adam', 'graph_mode': 'cutoff', 'cutoff': 0.5214873215299125, 'grm_norm': 'gcn', 'self_loops': False, 'use_snp_selection': False}. Best is trial 45 with value: 0.26683441598895186.
[I 2025-11-13 21:14:13,930] Trial 52 finished with value: 0.24712694951585878 and parameters: {'model_type': 'graphsage', 'hidden_dims': '[512, 128]', 'dropout': 0.5812607243077716, 'batch_norm': True, 'lr': 8.607943649452875e-05, 'weight_decay': 2.7252387541929804e-05, 'epochs': 260, 'loss': 'mse', 'optimizer': 'adam', 'graph_mode': 'cutoff', 'cutoff': 0.7079391585822575, 'grm_norm': 'gcn', 'self_loops': False, 'use_snp_selection': False}. Best is trial 45 with value: 0.26683441598895186.
[I 2025-11-13 21:17:36,560] Trial 53 finished with value: 0.2519555740390097 and parameters: {'model_type': 'graphsage', 'hidden_dims': '[512, 128]', 'dropout': 0.5451803454195284, 'batch_norm': True, 'lr': 0.00020626447475949485, 'weight_decay': 1.0247873091711464e-05, 'epochs': 296, 'loss': 'mse', 'optimizer': 'adam', 'graph_mode': 'cutoff', 'cutoff': 0.6117923767910833, 'grm_norm': 'gcn', 'self_loops': False, 'use_snp_selection': False}. Best is trial 45 with value: 0.26683441598895186.
[I 2025-11-13 21:18:09,236] Trial 54 finished with value: 0.27045826557796715 and parameters: {'model_type': 'graphsage', 'hidden_dims': '[128, 64]', 'dropout': 0.531137022430502, 'batch_norm': True, 'lr': 0.00040705183611984395, 'weight_decay': 3.74939143818458e-06, 'epochs': 58, 'loss': 'mse', 'optimizer': 'adam', 'graph_mode': 'cutoff', 'cutoff': 0.42814223007535696, 'grm_norm': 'cosine_then_gcn', 'self_loops': False, 'use_snp_selection': False}. Best is trial 54 with value: 0.27045826557796715.
[I 2025-11-13 21:18:42,233] Trial 55 finished with value: 0.2560305191444886 and parameters: {'model_type': 'graphsage', 'hidden_dims': '[128, 64]', 'dropout': 0.10063253987713966, 'batch_norm': True, 'lr': 0.0004288525474938349, 'weight_decay': 2.0197962400452735e-06, 'epochs': 59, 'loss': 'mse', 'optimizer': 'adam', 'graph_mode': 'cutoff', 'cutoff': 0.4237045146055531, 'grm_norm': 'cosine_then_gcn', 'self_loops': True, 'use_snp_selection': False}. Best is trial 54 with value: 0.27045826557796715.
[I 2025-11-13 21:19:27,656] Trial 56 finished with value: 0.2733912807900185 and parameters: {'model_type': 'graphsage', 'hidden_dims': '[128, 64]', 'dropout': 0.531888074419091, 'batch_norm': True, 'lr': 0.0006838444095607388, 'weight_decay': 3.926937288349973e-06, 'epochs': 92, 'loss': 'mse', 'optimizer': 'adam', 'graph_mode': 'cutoff', 'cutoff': 0.35924612508281367, 'grm_norm': 'cosine_then_gcn', 'self_loops': False, 'use_snp_selection': False}. Best is trial 56 with value: 0.2733912807900185.
[I 2025-11-13 21:20:11,812] Trial 57 finished with value: 0.25570333360041425 and parameters: {'model_type': 'graphsage', 'hidden_dims': '[128, 64]', 'dropout': 0.5276698051773006, 'batch_norm': True, 'lr': 0.0006900089161695132, 'weight_decay': 3.713933175383154e-06, 'epochs': 88, 'loss': 'mse', 'optimizer': 'adam', 'graph_mode': 'cutoff', 'cutoff': 0.3588142389775631, 'grm_norm': 'cosine_then_gcn', 'self_loops': True, 'use_snp_selection': False}. Best is trial 56 with value: 0.2733912807900185.
[I 2025-11-13 21:21:17,403] Trial 58 finished with value: 0.051774110982939756 and parameters: {'model_type': 'graphsage', 'hidden_dims': '[128, 64]', 'dropout': 0.4931009254477783, 'batch_norm': False, 'lr': 0.0008319760322863958, 'weight_decay': 7.63753927375761e-07, 'epochs': 57, 'loss': 'mse', 'optimizer': 'adam', 'graph_mode': 'cutoff', 'cutoff': 0.30060197685706075, 'grm_norm': 'cosine_then_gcn', 'self_loops': False, 'use_snp_selection': True, 'num_snps': 23810}. Best is trial 56 with value: 0.2733912807900185.
[I 2025-11-13 21:22:12,751] Trial 59 finished with value: 0.26288675902574843 and parameters: {'model_type': 'graphsage', 'hidden_dims': '[128, 64]', 'dropout': 0.4458276403799877, 'batch_norm': True, 'lr': 0.0005129036149596341, 'weight_decay': 1.47685067151488e-06, 'epochs': 127, 'loss': 'mse', 'optimizer': 'adam', 'graph_mode': 'cutoff', 'cutoff': 0.3889572925941358, 'grm_norm': 'cosine_then_gcn', 'self_loops': True, 'use_snp_selection': False}. Best is trial 56 with value: 0.2733912807900185.
[I 2025-11-13 21:23:12,057] Trial 60 finished with value: 0.20182187153336084 and parameters: {'model_type': 'graphsage', 'hidden_dims': '[128, 64]', 'dropout': 0.4726487589669635, 'batch_norm': False, 'lr': 0.00031370415044525087, 'weight_decay': 6.138383283786058e-07, 'epochs': 82, 'loss': 'mae', 'optimizer': 'adam', 'graph_mode': 'cutoff', 'cutoff': 0.4754649920647574, 'grm_norm': 'cosine_then_gcn', 'self_loops': False, 'use_snp_selection': True, 'num_snps': 17446}. Best is trial 56 with value: 0.2733912807900185.
[I 2025-11-13 21:23:49,837] Trial 61 finished with value: 0.28362455932970543 and parameters: {'model_type': 'graphsage', 'hidden_dims': '[128, 64]', 'dropout': 0.5991900079874194, 'batch_norm': True, 'lr': 0.0003645033034479367, 'weight_decay': 4.030695783955982e-06, 'epochs': 72, 'loss': 'mse', 'optimizer': 'adam', 'graph_mode': 'cutoff', 'cutoff': 0.36000171566205647, 'grm_norm': 'none', 'self_loops': False, 'use_snp_selection': False}. Best is trial 61 with value: 0.28362455932970543.
[I 2025-11-13 21:24:26,880] Trial 62 finished with value: 0.2684748275854714 and parameters: {'model_type': 'graphsage', 'hidden_dims': '[128, 64]', 'dropout': 0.5980177922778012, 'batch_norm': True, 'lr': 0.00047625296481235905, 'weight_decay': 2.933164689232996e-07, 'epochs': 68, 'loss': 'mse', 'optimizer': 'adam', 'graph_mode': 'cutoff', 'cutoff': 0.35060507877637404, 'grm_norm': 'none', 'self_loops': False, 'use_snp_selection': False}. Best is trial 61 with value: 0.28362455932970543.
[I 2025-11-13 21:25:03,471] Trial 63 finished with value: 0.27560519768463526 and parameters: {'model_type': 'graphsage', 'hidden_dims': '[128, 64]', 'dropout': 0.5952555637119297, 'batch_norm': True, 'lr': 0.00061551021938763, 'weight_decay': 3.6145799607542415e-07, 'epochs': 69, 'loss': 'mse', 'optimizer': 'adam', 'graph_mode': 'cutoff', 'cutoff': 0.36710353383516875, 'grm_norm': 'none', 'self_loops': False, 'use_snp_selection': False}. Best is trial 61 with value: 0.28362455932970543.
[I 2025-11-13 21:25:38,959] Trial 64 finished with value: 0.2477859180278809 and parameters: {'model_type': 'graphsage', 'hidden_dims': '[128, 64]', 'dropout': 0.5956932612041793, 'batch_norm': True, 'lr': 0.00065444600758485, 'weight_decay': 2.3923647895714485e-07, 'epochs': 67, 'loss': 'mse', 'optimizer': 'adam', 'graph_mode': 'cutoff', 'cutoff': 0.37921808420088143, 'grm_norm': 'none', 'self_loops': False, 'use_snp_selection': False}. Best is trial 61 with value: 0.28362455932970543.
[I 2025-11-13 21:26:21,564] Trial 65 finished with value: 0.24916576364354817 and parameters: {'model_type': 'graphsage', 'hidden_dims': '[128, 64]', 'dropout': 0.599957054316268, 'batch_norm': True, 'lr': 0.00047483845454289117, 'weight_decay': 2.7740253889887907e-07, 'epochs': 74, 'loss': 'mse', 'optimizer': 'adam', 'graph_mode': 'cutoff', 'cutoff': 0.3107769325070947, 'grm_norm': 'none', 'self_loops': False, 'use_snp_selection': False}. Best is trial 61 with value: 0.28362455932970543.
[I 2025-11-13 21:27:44,913] Trial 66 finished with value: 0.26879903252296833 and parameters: {'model_type': 'graphsage', 'hidden_dims': '[128, 64]', 'dropout': 0.553870577416862, 'batch_norm': True, 'lr': 0.000890134693054496, 'weight_decay': 3.7972593265221726e-07, 'epochs': 103, 'loss': 'mse', 'optimizer': 'adam', 'graph_mode': 'cutoff', 'cutoff': 0.2373977125465176, 'grm_norm': 'none', 'self_loops': False, 'use_snp_selection': False}. Best is trial 61 with value: 0.28362455932970543.
[I 2025-11-13 21:29:15,604] Trial 67 finished with value: 0.2572037302010419 and parameters: {'model_type': 'graphsage', 'hidden_dims': '[128, 64]', 'dropout': 0.5274657651296002, 'batch_norm': True, 'lr': 0.0009551121553408283, 'weight_decay': 2.98567654774019e-07, 'epochs': 109, 'loss': 'mse', 'optimizer': 'adam', 'graph_mode': 'cutoff', 'cutoff': 0.23354339540426755, 'grm_norm': 'none', 'self_loops': False, 'use_snp_selection': False}. Best is trial 61 with value: 0.28362455932970543.
[I 2025-11-13 21:29:47,913] Trial 68 finished with value: 0.2466849087019507 and parameters: {'model_type': 'graphsage', 'hidden_dims': '[128, 64]', 'dropout': 0.5523439175871767, 'batch_norm': True, 'lr': 0.0006077164064081546, 'weight_decay': 6.803896939405334e-07, 'epochs': 40, 'loss': 'mse', 'optimizer': 'adam', 'graph_mode': 'cutoff', 'cutoff': 0.276335000038698, 'grm_norm': 'none', 'self_loops': False, 'use_snp_selection': False}. Best is trial 61 with value: 0.28362455932970543.
[I 2025-11-13 21:30:23,203] Trial 69 finished with value: 0.26448533601421875 and parameters: {'model_type': 'graphsage', 'hidden_dims': '[128, 64]', 'dropout': 0.5859418511035166, 'batch_norm': True, 'lr': 0.0008136472769868892, 'weight_decay': 4.171758002929692e-07, 'epochs': 86, 'loss': 'mse', 'optimizer': 'adam', 'graph_mode': 'cutoff', 'cutoff': 0.5034484691646399, 'grm_norm': 'none', 'self_loops': False, 'use_snp_selection': False}. Best is trial 61 with value: 0.28362455932970543.
[I 2025-11-13 21:31:05,312] Trial 70 finished with value: 0.2552263108522686 and parameters: {'model_type': 'graphsage', 'hidden_dims': '[128, 64]', 'dropout': 0.5466576168078194, 'batch_norm': True, 'lr': 0.000354004284712527, 'weight_decay': 1.462093574598746e-07, 'epochs': 95, 'loss': 'mse', 'optimizer': 'adam', 'graph_mode': 'cutoff', 'cutoff': 0.46161168020720844, 'grm_norm': 'none', 'self_loops': False, 'use_snp_selection': False}. Best is trial 61 with value: 0.28362455932970543.
