[I 2025-11-03 11:43:34,931] Trial 52 finished with value: 0.11132142981818591 and parameters: {'model_type': 'gcn', 'hidden_dims': '[512, 64]', 'dropout': 0.2560216195030066, 'batch_norm': True, 'lr': 0.0006220014428917856, 'weight_decay': 2.9490275001058773e-06, 'epochs': 62, 'loss': 'mae', 'optimizer': 'adam', 'graph_mode': 'off', 'use_snp_selection': False}. Best is trial 44 with value: 0.12588276278015856.
[I 2025-11-03 11:43:36,164] Trial 53 finished with value: 0.10547234267622599 and parameters: {'model_type': 'gcn', 'hidden_dims': '[512, 64]', 'dropout': 0.3358463061453822, 'batch_norm': True, 'lr': 0.0007670464176837513, 'weight_decay': 1.7889073542960619e-06, 'epochs': 85, 'loss': 'mae', 'optimizer': 'adam', 'graph_mode': 'off', 'use_snp_selection': False}. Best is trial 44 with value: 0.12588276278015856.
[I 2025-11-03 11:43:37,364] Trial 54 finished with value: 0.0971808914036188 and parameters: {'model_type': 'gcn', 'hidden_dims': '[512, 64]', 'dropout': 0.2692130209847767, 'batch_norm': True, 'lr': 0.00017094057985229846, 'weight_decay': 1.4801420951477012e-07, 'epochs': 92, 'loss': 'mae', 'optimizer': 'adam', 'graph_mode': 'off', 'use_snp_selection': False}. Best is trial 44 with value: 0.12588276278015856.
[I 2025-11-03 11:43:37,986] Trial 55 finished with value: 0.1132707671791947 and parameters: {'model_type': 'gcn', 'hidden_dims': '[128, 64]', 'dropout': 0.3835537556180089, 'batch_norm': True, 'lr': 0.0005083583374041988, 'weight_decay': 4.4863315926654267e-07, 'epochs': 42, 'loss': 'mse', 'optimizer': 'adam', 'graph_mode': 'off', 'use_snp_selection': False}. Best is trial 44 with value: 0.12588276278015856.
[I 2025-11-03 11:43:39,689] Trial 56 finished with value: 0.10988493004015248 and parameters: {'model_type': 'gcn', 'hidden_dims': '[512, 128]', 'dropout': 0.31101521229028944, 'batch_norm': True, 'lr': 0.0003839501928677698, 'weight_decay': 3.1573599029164685e-06, 'epochs': 218, 'loss': 'mae', 'optimizer': 'adam', 'graph_mode': 'off', 'use_snp_selection': False}. Best is trial 44 with value: 0.12588276278015856.
[I 2025-11-03 11:43:41,318] Trial 57 finished with value: 0.04627243327089657 and parameters: {'model_type': 'gcn', 'hidden_dims': '[512, 64]', 'dropout': 0.1397870549831764, 'batch_norm': False, 'lr': 0.000998406980928118, 'weight_decay': 1.6763230480555386e-06, 'epochs': 201, 'loss': 'mae', 'optimizer': 'adam', 'graph_mode': 'off', 'use_snp_selection': False}. Best is trial 44 with value: 0.12588276278015856.
[I 2025-11-03 11:43:42,668] Trial 58 finished with value: 0.11899566947193176 and parameters: {'model_type': 'gcn', 'hidden_dims': '[512, 128]', 'dropout': 0.16224006391335954, 'batch_norm': True, 'lr': 0.0007260870553443869, 'weight_decay': 8.779555222424877e-07, 'epochs': 137, 'loss': 'mae', 'optimizer': 'adam', 'graph_mode': 'off', 'use_snp_selection': False}. Best is trial 44 with value: 0.12588276278015856.
[I 2025-11-03 11:43:43,986] Trial 59 finished with value: 0.09975229086334539 and parameters: {'model_type': 'gcn', 'hidden_dims': '[512, 128]', 'dropout': 0.1604571335607231, 'batch_norm': True, 'lr': 0.0006021248767683532, 'weight_decay': 7.880215732164159e-07, 'epochs': 116, 'loss': 'mae', 'optimizer': 'adam', 'graph_mode': 'off', 'use_snp_selection': False}. Best is trial 44 with value: 0.12588276278015856.
[I 2025-11-03 11:43:45,290] Trial 60 finished with value: 0.10902831274321385 and parameters: {'model_type': 'gcn', 'hidden_dims': '[256, 128, 64]', 'dropout': 0.19430581573948835, 'batch_norm': True, 'lr': 0.0008060246692070735, 'weight_decay': 2.770024741571103e-07, 'epochs': 166, 'loss': 'mse', 'optimizer': 'adam', 'graph_mode': 'off', 'use_snp_selection': False}. Best is trial 44 with value: 0.12588276278015856.
[I 2025-11-03 11:43:46,392] Trial 61 finished with value: 0.10394161258275439 and parameters: {'model_type': 'gcn', 'hidden_dims': '[512, 128]', 'dropout': 0.11272417693042772, 'batch_norm': True, 'lr': 0.0006667395397427303, 'weight_decay': 1.2101756402041508e-06, 'epochs': 71, 'loss': 'mae', 'optimizer': 'adam', 'graph_mode': 'off', 'use_snp_selection': False}. Best is trial 44 with value: 0.12588276278015856.
[I 2025-11-03 11:43:47,829] Trial 62 finished with value: 0.10862613825861613 and parameters: {'model_type': 'gcn', 'hidden_dims': '[512, 128]', 'dropout': 0.23848461469839954, 'batch_norm': True, 'lr': 0.00030195883854969877, 'weight_decay': 3.6338126767399434e-07, 'epochs': 145, 'loss': 'mae', 'optimizer': 'adam', 'graph_mode': 'off', 'use_snp_selection': False}. Best is trial 44 with value: 0.12588276278015856.
[I 2025-11-03 11:43:49,129] Trial 63 finished with value: 0.09524268471213745 and parameters: {'model_type': 'gcn', 'hidden_dims': '[128, 64]', 'dropout': 0.10085159963028886, 'batch_norm': True, 'lr': 0.00044465922579907006, 'weight_decay': 2.287040713682523e-06, 'epochs': 261, 'loss': 'mae', 'optimizer': 'adam', 'graph_mode': 'off', 'use_snp_selection': False}. Best is trial 44 with value: 0.12588276278015856.
[I 2025-11-03 11:43:50,310] Trial 64 finished with value: 0.09812195283148245 and parameters: {'model_type': 'gcn', 'hidden_dims': '[512, 128]', 'dropout': 0.1745378781079463, 'batch_norm': True, 'lr': 0.0008133336687701795, 'weight_decay': 5.673414888717138e-07, 'epochs': 90, 'loss': 'mae', 'optimizer': 'adam', 'graph_mode': 'off', 'use_snp_selection': False}. Best is trial 44 with value: 0.12588276278015856.
[I 2025-11-03 11:43:51,689] Trial 65 finished with value: 0.1024046512718338 and parameters: {'model_type': 'gcn', 'hidden_dims': '[512, 128]', 'dropout': 0.142575605209756, 'batch_norm': True, 'lr': 0.0005317662032572988, 'weight_decay': 9.961563559210986e-07, 'epochs': 134, 'loss': 'mae', 'optimizer': 'adam', 'graph_mode': 'off', 'use_snp_selection': False}. Best is trial 44 with value: 0.12588276278015856.
[I 2025-11-03 11:43:53,080] Trial 66 finished with value: 0.09063505179635817 and parameters: {'model_type': 'gcn', 'hidden_dims': '[128, 64]', 'dropout': 0.20676184939209064, 'batch_norm': True, 'lr': 0.0002293326673722511, 'weight_decay': 4.3257495144728525e-06, 'epochs': 232, 'loss': 'mae', 'optimizer': 'adam', 'graph_mode': 'off', 'use_snp_selection': True, 'num_snps': 22881}. Best is trial 44 with value: 0.12588276278015856.
[I 2025-11-03 11:43:54,317] Trial 67 finished with value: 0.05838647365064845 and parameters: {'model_type': 'gcn', 'hidden_dims': '[512, 64]', 'dropout': 0.3439360810465122, 'batch_norm': True, 'lr': 4.196507383245992e-05, 'weight_decay': 0.00021043801549516417, 'epochs': 103, 'loss': 'mae', 'optimizer': 'adam', 'graph_mode': 'off', 'use_snp_selection': False}. Best is trial 44 with value: 0.12588276278015856.
[I 2025-11-03 11:43:55,643] Trial 68 finished with value: 0.10111415265236694 and parameters: {'model_type': 'gcn', 'hidden_dims': '[512, 128]', 'dropout': 0.22097240227896053, 'batch_norm': True, 'lr': 0.0003883409727904091, 'weight_decay': 3.486146564992259e-07, 'epochs': 117, 'loss': 'mae', 'optimizer': 'adam', 'graph_mode': 'off', 'use_snp_selection': False}. Best is trial 44 with value: 0.12588276278015856.
[I 2025-11-03 11:43:56,472] Trial 69 finished with value: 0.004277996069202192 and parameters: {'model_type': 'gcn', 'hidden_dims': '[256, 128]', 'dropout': 0.28402058891997095, 'batch_norm': False, 'lr': 0.0007957193473380277, 'weight_decay': 6.596153416157536e-05, 'epochs': 56, 'loss': 'mae', 'optimizer': 'adam', 'graph_mode': 'off', 'use_snp_selection': False}. Best is trial 44 with value: 0.12588276278015856.
[I 2025-11-03 11:43:57,534] Trial 70 finished with value: 0.10676463049394182 and parameters: {'model_type': 'gcn', 'hidden_dims': '[512, 128]', 'dropout': 0.14943731632274954, 'batch_norm': True, 'lr': 0.0005769740122147393, 'weight_decay': 3.3314358148170803e-06, 'epochs': 73, 'loss': 'mae', 'optimizer': 'adam', 'graph_mode': 'off', 'use_snp_selection': False}. Best is trial 44 with value: 0.12588276278015856.
[I 2025-11-03 11:43:58,344] Trial 71 finished with value: 0.11691180086375298 and parameters: {'model_type': 'gcn', 'hidden_dims': '[128, 64]', 'dropout': 0.2988398428855073, 'batch_norm': True, 'lr': 0.0003112529149801656, 'weight_decay': 7.057110755130945e-06, 'epochs': 105, 'loss': 'mae', 'optimizer': 'adam', 'graph_mode': 'off', 'use_snp_selection': False}. Best is trial 44 with value: 0.12588276278015856.
[I 2025-11-03 11:43:59,169] Trial 72 finished with value: 0.11787430727624398 and parameters: {'model_type': 'gcn', 'hidden_dims': '[128, 64]', 'dropout': 0.3054496663928423, 'batch_norm': True, 'lr': 0.0007503371011948948, 'weight_decay': 7.902039193142297e-06, 'epochs': 109, 'loss': 'mae', 'optimizer': 'adam', 'graph_mode': 'off', 'use_snp_selection': False}. Best is trial 44 with value: 0.12588276278015856.
[I 2025-11-03 11:43:59,970] Trial 73 finished with value: 0.09919847452909575 and parameters: {'model_type': 'gcn', 'hidden_dims': '[128, 64]', 'dropout': 0.30665150663584834, 'batch_norm': True, 'lr': 0.0009872357579703613, 'weight_decay': 8.673952804208912e-06, 'epochs': 109, 'loss': 'mae', 'optimizer': 'adam', 'graph_mode': 'off', 'use_snp_selection': False}. Best is trial 44 with value: 0.12588276278015856.
[I 2025-11-03 11:44:00,735] Trial 74 finished with value: 0.09963745570638588 and parameters: {'model_type': 'gcn', 'hidden_dims': '[128, 64]', 'dropout': 0.3228395345144117, 'batch_norm': True, 'lr': 0.000302705729087728, 'weight_decay': 1.75121450954265e-05, 'epochs': 92, 'loss': 'mae', 'optimizer': 'adam', 'graph_mode': 'off', 'use_snp_selection': False}. Best is trial 44 with value: 0.12588276278015856.
[I 2025-11-03 11:44:01,547] Trial 75 finished with value: 0.107598841149416 and parameters: {'model_type': 'gcn', 'hidden_dims': '[128, 64]', 'dropout': 0.3687538437790101, 'batch_norm': True, 'lr': 0.000497142947465548, 'weight_decay': 1.4601412008219637e-05, 'epochs': 99, 'loss': 'mae', 'optimizer': 'adam', 'graph_mode': 'off', 'use_snp_selection': False}. Best is trial 44 with value: 0.12588276278015856.
[I 2025-11-03 11:44:02,470] Trial 76 finished with value: 0.1127896948835958 and parameters: {'model_type': 'gcn', 'hidden_dims': '[128, 64]', 'dropout': 0.2759942549383714, 'batch_norm': True, 'lr': 0.0007001827663592097, 'weight_decay': 7.455900445194526e-06, 'epochs': 159, 'loss': 'mae', 'optimizer': 'adam', 'graph_mode': 'off', 'use_snp_selection': False}. Best is trial 44 with value: 0.12588276278015856.
[I 2025-11-03 11:44:03,339] Trial 77 finished with value: 0.10283073423382448 and parameters: {'model_type': 'gcn', 'hidden_dims': '[128, 64]', 'dropout': 0.255164173640618, 'batch_norm': True, 'lr': 0.0003982895224219077, 'weight_decay': 1.175839259040912e-05, 'epochs': 134, 'loss': 'mae', 'optimizer': 'adam', 'graph_mode': 'off', 'use_snp_selection': False}. Best is trial 44 with value: 0.12588276278015856.
[I 2025-11-03 11:44:04,537] Trial 78 finished with value: 0.03218151637988638 and parameters: {'model_type': 'gcn', 'hidden_dims': '[128, 64]', 'dropout': 0.33411889104976633, 'batch_norm': True, 'lr': 0.0005672101631628266, 'weight_decay': 1.6481602121026426e-07, 'epochs': 319, 'loss': 'mae', 'optimizer': 'adam', 'graph_mode': 'off', 'use_snp_selection': True, 'num_snps': 2246}. Best is trial 44 with value: 0.12588276278015856.
[I 2025-11-03 11:44:05,368] Trial 79 finished with value: 0.11076866015303072 and parameters: {'model_type': 'gcn', 'hidden_dims': '[128, 64]', 'dropout': 0.29969713986251717, 'batch_norm': True, 'lr': 0.0009024168298447247, 'weight_decay': 3.5440696586496004e-05, 'epochs': 108, 'loss': 'mse', 'optimizer': 'adam', 'graph_mode': 'off', 'use_snp_selection': False}. Best is trial 44 with value: 0.12588276278015856.
[I 2025-11-03 11:44:06,512] Trial 80 finished with value: 0.07458501556600033 and parameters: {'model_type': 'gcn', 'hidden_dims': '[512, 64]', 'dropout': 0.3537369047907071, 'batch_norm': True, 'lr': 6.792894880434347e-05, 'weight_decay': 2.2307882990632836e-05, 'epochs': 81, 'loss': 'mae', 'optimizer': 'adam', 'graph_mode': 'off', 'use_snp_selection': False}. Best is trial 44 with value: 0.12588276278015856.
[I 2025-11-03 11:44:07,875] Trial 81 finished with value: 0.11386853149695875 and parameters: {'model_type': 'gcn', 'hidden_dims': '[256, 128, 64]', 'dropout': 0.11602988359195718, 'batch_norm': True, 'lr': 0.0007055945477132914, 'weight_decay': 5.278384645884557e-06, 'epochs': 182, 'loss': 'mae', 'optimizer': 'adam', 'graph_mode': 'off', 'use_snp_selection': False}. Best is trial 44 with value: 0.12588276278015856.
[I 2025-11-03 11:44:09,246] Trial 82 finished with value: 0.10553138238175679 and parameters: {'model_type': 'gcn', 'hidden_dims': '[512, 128]', 'dropout': 0.12962189881312927, 'batch_norm': True, 'lr': 0.000832058320195192, 'weight_decay': 2.452491647329039e-06, 'epochs': 137, 'loss': 'mae', 'optimizer': 'adam', 'graph_mode': 'off', 'use_snp_selection': False}. Best is trial 44 with value: 0.12588276278015856.
[I 2025-11-03 11:44:10,094] Trial 83 finished with value: 0.10701070414567368 and parameters: {'model_type': 'gcn', 'hidden_dims': '[128, 64]', 'dropout': 0.2842484838133815, 'batch_norm': True, 'lr': 0.0004679989505872329, 'weight_decay': 1.8438754001800794e-06, 'epochs': 119, 'loss': 'mae', 'optimizer': 'adam', 'graph_mode': 'off', 'use_snp_selection': False}. Best is trial 44 with value: 0.12588276278015856.
[I 2025-11-03 11:44:12,156] Trial 84 finished with value: 0.1066673330447014 and parameters: {'model_type': 'gcn', 'hidden_dims': '[512, 128]', 'dropout': 0.31396562484466506, 'batch_norm': True, 'lr': 0.0006830054580696476, 'weight_decay': 4.861356390993157e-06, 'epochs': 291, 'loss': 'mae', 'optimizer': 'adam', 'graph_mode': 'off', 'use_snp_selection': False}. Best is trial 44 with value: 0.12588276278015856.
[I 2025-11-03 11:44:13,419] Trial 85 finished with value: 0.03600321199148317 and parameters: {'model_type': 'gcn', 'hidden_dims': '[512, 64]', 'dropout': 0.1646848709188559, 'batch_norm': False, 'lr': 0.0003325836506100312, 'weight_decay': 1.4546402402346723e-06, 'epochs': 97, 'loss': 'mae', 'optimizer': 'adam', 'graph_mode': 'off', 'use_snp_selection': False}. Best is trial 44 with value: 0.12588276278015856.
[I 2025-11-03 11:44:14,701] Trial 86 finished with value: 0.09915169429477039 and parameters: {'model_type': 'gcn', 'hidden_dims': '[512, 128]', 'dropout': 0.26954192922372633, 'batch_norm': True, 'lr': 0.0005544108558985183, 'weight_decay': 9.635525626862268e-05, 'epochs': 110, 'loss': 'mae', 'optimizer': 'adam', 'graph_mode': 'off', 'use_snp_selection': False}. Best is trial 44 with value: 0.12588276278015856.
[I 2025-11-03 11:44:15,535] Trial 87 finished with value: 0.11835384559472661 and parameters: {'model_type': 'gcn', 'hidden_dims': '[256, 128]', 'dropout': 0.2468081868664666, 'batch_norm': True, 'lr': 0.0001929736080194192, 'weight_decay': 7.101202685041124e-06, 'epochs': 69, 'loss': 'mse', 'optimizer': 'adam', 'graph_mode': 'off', 'use_snp_selection': False}. Best is trial 44 with value: 0.12588276278015856.
[I 2025-11-03 11:44:16,340] Trial 88 finished with value: 0.07393738639618691 and parameters: {'model_type': 'gcn', 'hidden_dims': '[256, 128]', 'dropout': 0.2403530119670894, 'batch_norm': True, 'lr': 0.0001419823632922928, 'weight_decay': 7.543208647627168e-06, 'epochs': 56, 'loss': 'mse', 'optimizer': 'adam', 'graph_mode': 'off', 'use_snp_selection': False}. Best is trial 44 with value: 0.12588276278015856.
[I 2025-11-03 11:44:17,784] Trial 89 finished with value: 0.11357236997542326 and parameters: {'model_type': 'gcn', 'hidden_dims': '[256, 128]', 'dropout': 0.29383300175032123, 'batch_norm': True, 'lr': 0.00019911981737366754, 'weight_decay': 3.577227413196974e-06, 'epochs': 71, 'loss': 'mse', 'optimizer': 'adam', 'graph_mode': 'off', 'use_snp_selection': True, 'num_snps': 45058}. Best is trial 44 with value: 0.12588276278015856.
[I 2025-11-03 11:44:18,787] Trial 90 finished with value: 0.12474305889606575 and parameters: {'model_type': 'gcn', 'hidden_dims': '[256, 128]', 'dropout': 0.19077715832818218, 'batch_norm': True, 'lr': 0.0002479046397369757, 'weight_decay': 6.4541153878802805e-06, 'epochs': 128, 'loss': 'mse', 'optimizer': 'adam', 'graph_mode': 'off', 'use_snp_selection': False}. Best is trial 44 with value: 0.12588276278015856.
[I 2025-11-03 11:44:19,676] Trial 91 finished with value: 0.1145123728866842 and parameters: {'model_type': 'gcn', 'hidden_dims': '[256, 128]', 'dropout': 0.2510965942551592, 'batch_norm': True, 'lr': 0.00027384270312062487, 'weight_decay': 8.098880571195413e-06, 'epochs': 87, 'loss': 'mse', 'optimizer': 'adam', 'graph_mode': 'off', 'use_snp_selection': False}. Best is trial 44 with value: 0.12588276278015856.
[I 2025-11-03 11:44:20,658] Trial 92 finished with value: 0.08016395178437002 and parameters: {'model_type': 'gcn', 'hidden_dims': '[256, 128]', 'dropout': 0.18437530155055437, 'batch_norm': True, 'lr': 0.00011785196120702509, 'weight_decay': 6.3445205509646e-06, 'epochs': 127, 'loss': 'mse', 'optimizer': 'adam', 'graph_mode': 'off', 'use_snp_selection': False}. Best is trial 44 with value: 0.12588276278015856.
[I 2025-11-03 11:44:21,591] Trial 93 finished with value: 0.057835096763403815 and parameters: {'model_type': 'gcn', 'hidden_dims': '[256, 128]', 'dropout': 0.2273994491992682, 'batch_norm': True, 'lr': 9.336193665769838e-06, 'weight_decay': 1.0173594476606829e-05, 'epochs': 103, 'loss': 'mse', 'optimizer': 'adam', 'graph_mode': 'off', 'use_snp_selection': False}. Best is trial 44 with value: 0.12588276278015856.
[I 2025-11-03 11:44:22,436] Trial 94 finished with value: 0.09910946147490972 and parameters: {'model_type': 'gcn', 'hidden_dims': '[256, 128]', 'dropout': 0.19006468437641452, 'batch_norm': True, 'lr': 0.00015455991791973392, 'weight_decay': 2.1762625649328744e-05, 'epochs': 77, 'loss': 'mse', 'optimizer': 'adam', 'graph_mode': 'off', 'use_snp_selection': False}. Best is trial 44 with value: 0.12588276278015856.
[I 2025-11-03 11:44:23,250] Trial 95 finished with value: 0.09505020060795454 and parameters: {'model_type': 'gcn', 'hidden_dims': '[256, 128]', 'dropout': 0.3249203804550801, 'batch_norm': True, 'lr': 0.00034153576570417554, 'weight_decay': 1.465537353650907e-05, 'epochs': 69, 'loss': 'mse', 'optimizer': 'adam', 'graph_mode': 'off', 'use_snp_selection': False}. Best is trial 44 with value: 0.12588276278015856.
[I 2025-11-03 11:44:24,370] Trial 96 finished with value: 0.09932813010164393 and parameters: {'model_type': 'gcn', 'hidden_dims': '[512, 64]', 'dropout': 0.2680403414012325, 'batch_norm': True, 'lr': 0.0002493695703771138, 'weight_decay': 5.859123137516444e-06, 'epochs': 83, 'loss': 'mse', 'optimizer': 'adam', 'graph_mode': 'off', 'use_snp_selection': False}. Best is trial 44 with value: 0.12588276278015856.
[I 2025-11-03 11:44:25,232] Trial 97 finished with value: 0.05972307962988437 and parameters: {'model_type': 'gcn', 'hidden_dims': '[128, 64]', 'dropout': 0.20571881210658968, 'batch_norm': True, 'lr': 9.14177233367956e-05, 'weight_decay': 1.2744903454610396e-07, 'epochs': 121, 'loss': 'mse', 'optimizer': 'adam', 'graph_mode': 'off', 'use_snp_selection': False}. Best is trial 44 with value: 0.12588276278015856.
[I 2025-11-03 11:44:26,298] Trial 98 finished with value: 0.10828614168219193 and parameters: {'model_type': 'gcn', 'hidden_dims': '[256, 128]', 'dropout': 0.30602148463382023, 'batch_norm': True, 'lr': 0.0004365067439139385, 'weight_decay': 1.168179748756915e-05, 'epochs': 148, 'loss': 'mse', 'optimizer': 'adam', 'graph_mode': 'off', 'use_snp_selection': False}. Best is trial 44 with value: 0.12588276278015856.
[I 2025-11-03 11:44:27,411] Trial 99 finished with value: 0.06068512855416641 and parameters: {'model_type': 'gcn', 'hidden_dims': '[256, 128, 64]', 'dropout': 0.16747902188056155, 'batch_norm': False, 'lr': 0.0005854388052405569, 'weight_decay': 4.449946661314359e-06, 'epochs': 131, 'loss': 'mse', 'optimizer': 'adam', 'graph_mode': 'off', 'use_snp_selection': False}. Best is trial 44 with value: 0.12588276278015856.
[I 2025-11-03 11:44:28,357] Trial 100 finished with value: 0.11158265191418515 and parameters: {'model_type': 'gcn', 'hidden_dims': '[512, 64]', 'dropout': 0.2797667774370557, 'batch_norm': True, 'lr': 0.0008991564086707312, 'weight_decay': 2.857213225983362e-06, 'epochs': 49, 'loss': 'mse', 'optimizer': 'adam', 'graph_mode': 'off', 'use_snp_selection': False}. Best is trial 44 with value: 0.12588276278015856.
[I 2025-11-03 11:44:29,609] Trial 101 finished with value: 0.11121672700878182 and parameters: {'model_type': 'gcn', 'hidden_dims': '[512, 128]', 'dropout': 0.1097194147111604, 'batch_norm': True, 'lr': 0.0007611289274535048, 'weight_decay': 1.966193040707347e-06, 'epochs': 112, 'loss': 'mae', 'optimizer': 'adam', 'graph_mode': 'off', 'use_snp_selection': False}. Best is trial 44 with value: 0.12588276278015856.
[I 2025-11-03 11:44:30,797] Trial 102 finished with value: 0.1167907054592581 and parameters: {'model_type': 'gcn', 'hidden_dims': '[512, 128]', 'dropout': 0.12540179771223, 'batch_norm': True, 'lr': 0.0006652299254871586, 'weight_decay': 0.000766193345811982, 'epochs': 95, 'loss': 'mae', 'optimizer': 'adam', 'graph_mode': 'off', 'use_snp_selection': False}. Best is trial 44 with value: 0.12588276278015856.
[I 2025-11-03 11:44:31,994] Trial 103 finished with value: 0.06728788646746706 and parameters: {'model_type': 'gcn', 'hidden_dims': '[512, 128]', 'dropout': 0.1353548274706801, 'batch_norm': True, 'lr': 8.427082884538237e-05, 'weight_decay': 0.0003109320643041227, 'epochs': 100, 'loss': 'mae', 'optimizer': 'adam', 'graph_mode': 'off', 'use_snp_selection': False}. Best is trial 44 with value: 0.12588276278015856.
