[I 2025-11-03 12:51:34,777] Trial 104 finished with value: 0.05398858639323911 and parameters: {'model_type': 'gcn', 'hidden_dims': '[512, 128]', 'dropout': 0.3396705407503849, 'batch_norm': False, 'lr': 4.6290247674303205e-05, 'weight_decay': 6.218275855044212e-06, 'epochs': 292, 'loss': 'mse', 'optimizer': 'adam', 'graph_mode': 'cutoff', 'cutoff': 0.3529541725602843, 'grm_norm': 'cosine_then_gcn', 'self_loops': False, 'use_snp_selection': True, 'num_snps': 7392}. Best is trial 9 with value: 0.06659124926087946.
[I 2025-11-03 12:51:36,449] Trial 105 finished with value: 0.018534663642231632 and parameters: {'model_type': 'gcn', 'hidden_dims': '[512, 128]', 'dropout': 0.3191707451884561, 'batch_norm': False, 'lr': 4.4952532291402605e-05, 'weight_decay': 1.3195643717106878e-07, 'epochs': 246, 'loss': 'mse', 'optimizer': 'adam', 'graph_mode': 'cutoff', 'cutoff': 0.46892624815293127, 'grm_norm': 'cosine_then_gcn', 'self_loops': False, 'use_snp_selection': True, 'num_snps': 7011}. Best is trial 9 with value: 0.06659124926087946.
[I 2025-11-03 12:51:38,186] Trial 106 finished with value: 0.027101272029481635 and parameters: {'model_type': 'gcn', 'hidden_dims': '[512, 128]', 'dropout': 0.33546125029923995, 'batch_norm': False, 'lr': 2.5844658959859306e-05, 'weight_decay': 5.585833704128608e-06, 'epochs': 295, 'loss': 'mse', 'optimizer': 'adam', 'graph_mode': 'knn', 'source': 'grm', 'knn_k': 3, 'weighted_edges': False, 'symmetrize_mode': 'mutual', 'use_snp_selection': True, 'num_snps': 4219}. Best is trial 9 with value: 0.06659124926087946.
[I 2025-11-03 12:51:40,808] Trial 107 finished with value: 0.02613167464911899 and parameters: {'model_type': 'gcn', 'hidden_dims': '[512, 128]', 'dropout': 0.30009728161488763, 'batch_norm': True, 'lr': 3.0644810168688925e-05, 'weight_decay': 4.19223293092034e-06, 'epochs': 253, 'loss': 'mse', 'optimizer': 'adam', 'graph_mode': 'cutoff', 'cutoff': 0.5950797116109724, 'grm_norm': 'cosine_then_gcn', 'self_loops': False, 'use_snp_selection': False}. Best is trial 9 with value: 0.06659124926087946.
[I 2025-11-03 12:51:43,301] Trial 108 finished with value: 0.01725700641750728 and parameters: {'model_type': 'gcn', 'hidden_dims': '[512, 128]', 'dropout': 0.33844546451612284, 'batch_norm': False, 'lr': 1.032757888065799e-05, 'weight_decay': 1.1596104281261153e-05, 'epochs': 273, 'loss': 'mse', 'optimizer': 'adam', 'graph_mode': 'cutoff', 'cutoff': 0.5073209581466539, 'grm_norm': 'none', 'self_loops': False, 'use_snp_selection': True, 'num_snps': 25785}. Best is trial 9 with value: 0.06659124926087946.
[I 2025-11-03 12:51:44,950] Trial 109 finished with value: 0.09816236567521958 and parameters: {'model_type': 'gcn', 'hidden_dims': '[512, 128]', 'dropout': 0.2294963550706813, 'batch_norm': False, 'lr': 5.121669176223392e-05, 'weight_decay': 8.094075314641322e-05, 'epochs': 211, 'loss': 'mse', 'optimizer': 'adam', 'graph_mode': 'knn', 'source': 'grm', 'knn_k': 4, 'weighted_edges': False, 'symmetrize_mode': 'union', 'use_snp_selection': True, 'num_snps': 8301}. Best is trial 109 with value: 0.09816236567521958.
[I 2025-11-03 12:51:47,076] Trial 110 finished with value: 0.026878764231974342 and parameters: {'model_type': 'gcn', 'hidden_dims': '[256, 128, 64]', 'dropout': 0.27877161881730145, 'batch_norm': True, 'lr': 2.7963985602963907e-06, 'weight_decay': 8.844117595331645e-05, 'epochs': 210, 'loss': 'mse', 'optimizer': 'adam', 'graph_mode': 'knn', 'source': 'grm', 'knn_k': 4, 'weighted_edges': False, 'symmetrize_mode': 'union', 'use_snp_selection': False}. Best is trial 109 with value: 0.09816236567521958.
[I 2025-11-03 12:51:48,639] Trial 111 finished with value: 0.02962320536905574 and parameters: {'model_type': 'gcn', 'hidden_dims': '[512, 128]', 'dropout': 0.23589917575063057, 'batch_norm': False, 'lr': 5.34322790258635e-05, 'weight_decay': 4.851947744503314e-05, 'epochs': 201, 'loss': 'mse', 'optimizer': 'adam', 'graph_mode': 'knn', 'source': 'grm', 'knn_k': 6, 'weighted_edges': False, 'symmetrize_mode': 'union', 'use_snp_selection': True, 'num_snps': 6308}. Best is trial 109 with value: 0.09816236567521958.
[I 2025-11-03 12:51:50,569] Trial 112 finished with value: 0.04687479075687607 and parameters: {'model_type': 'gcn', 'hidden_dims': '[512, 128]', 'dropout': 0.225067020849546, 'batch_norm': False, 'lr': 3.828789232816346e-05, 'weight_decay': 6.629823857221632e-06, 'epochs': 241, 'loss': 'mse', 'optimizer': 'adam', 'graph_mode': 'knn', 'source': 'grm', 'knn_k': 5, 'weighted_edges': False, 'symmetrize_mode': 'union', 'use_snp_selection': True, 'num_snps': 13138}. Best is trial 109 with value: 0.09816236567521958.
[I 2025-11-03 12:51:51,884] Trial 113 finished with value: 0.0558071111282893 and parameters: {'model_type': 'gcn', 'hidden_dims': '[512, 128]', 'dropout': 0.21100775201817454, 'batch_norm': False, 'lr': 4.611527444728856e-05, 'weight_decay': 0.00016096728431402074, 'epochs': 151, 'loss': 'mse', 'optimizer': 'adam', 'graph_mode': 'knn', 'source': 'grm', 'knn_k': 4, 'weighted_edges': False, 'symmetrize_mode': 'union', 'use_snp_selection': True, 'num_snps': 2847}. Best is trial 109 with value: 0.09816236567521958.
[I 2025-11-03 12:51:53,362] Trial 114 finished with value: 0.020443349123959276 and parameters: {'model_type': 'gcn', 'hidden_dims': '[512, 128]', 'dropout': 0.36102087500018, 'batch_norm': False, 'lr': 5.8055648291975365e-05, 'weight_decay': 0.00017431105434596012, 'epochs': 147, 'loss': 'mse', 'optimizer': 'adam', 'graph_mode': 'knn', 'source': 'grm', 'knn_k': 4, 'weighted_edges': False, 'symmetrize_mode': 'union', 'use_snp_selection': True, 'num_snps': 7963}. Best is trial 109 with value: 0.09816236567521958.
[I 2025-11-03 12:51:54,647] Trial 115 finished with value: 0.01928187396657454 and parameters: {'model_type': 'gcn', 'hidden_dims': '[512, 128]', 'dropout': 0.1600510301216743, 'batch_norm': False, 'lr': 8.921860398669017e-05, 'weight_decay': 0.0003666272311621718, 'epochs': 123, 'loss': 'mse', 'optimizer': 'adam', 'graph_mode': 'knn', 'source': 'grm', 'knn_k': 3, 'weighted_edges': False, 'symmetrize_mode': 'union', 'use_snp_selection': True, 'num_snps': 4163}. Best is trial 109 with value: 0.09816236567521958.
[I 2025-11-03 12:51:56,208] Trial 116 finished with value: 0.03911624979798437 and parameters: {'model_type': 'gcn', 'hidden_dims': '[512, 128]', 'dropout': 0.19950717782349556, 'batch_norm': False, 'lr': 6.698034169099421e-05, 'weight_decay': 0.00011422311673132672, 'epochs': 158, 'loss': 'mse', 'optimizer': 'adam', 'graph_mode': 'knn', 'source': 'grm', 'knn_k': 4, 'weighted_edges': False, 'symmetrize_mode': 'union', 'use_snp_selection': True, 'num_snps': 9474}. Best is trial 109 with value: 0.09816236567521958.
[I 2025-11-03 12:51:57,487] Trial 117 finished with value: 0.046746126204180886 and parameters: {'model_type': 'gcn', 'hidden_dims': '[128, 64]', 'dropout': 0.2073802836501316, 'batch_norm': False, 'lr': 4.183600370859781e-05, 'weight_decay': 0.00016970874488365136, 'epochs': 147, 'loss': 'mse', 'optimizer': 'adam', 'graph_mode': 'knn', 'source': 'grm', 'knn_k': 5, 'weighted_edges': False, 'symmetrize_mode': 'union', 'use_snp_selection': True, 'num_snps': 2253}. Best is trial 109 with value: 0.09816236567521958.
[I 2025-11-03 12:51:59,171] Trial 118 finished with value: 0.041563840040353725 and parameters: {'model_type': 'gcn', 'hidden_dims': '[512, 128]', 'dropout': 0.4395857681504972, 'batch_norm': False, 'lr': 3.567392062610158e-05, 'weight_decay': 0.00022144495142042663, 'epochs': 176, 'loss': 'mse', 'optimizer': 'adam', 'graph_mode': 'knn', 'source': 'grm', 'knn_k': 3, 'weighted_edges': False, 'symmetrize_mode': 'union', 'use_snp_selection': True, 'num_snps': 11500}. Best is trial 109 with value: 0.09816236567521958.
[I 2025-11-03 12:52:00,778] Trial 119 finished with value: 0.0124207941682717 and parameters: {'model_type': 'gcn', 'hidden_dims': '[256, 128]', 'dropout': 0.18566663593528612, 'batch_norm': True, 'lr': 4.896850223209198e-05, 'weight_decay': 5.9342139408318496e-05, 'epochs': 139, 'loss': 'mse', 'optimizer': 'adam', 'graph_mode': 'knn', 'source': 'grm', 'knn_k': 4, 'weighted_edges': False, 'symmetrize_mode': 'union', 'use_snp_selection': False}. Best is trial 109 with value: 0.09816236567521958.
[I 2025-11-03 12:52:02,401] Trial 120 finished with value: 0.01228218801617868 and parameters: {'model_type': 'gcn', 'hidden_dims': '[512, 128]', 'dropout': 0.38421839738828595, 'batch_norm': False, 'lr': 8.306005907304991e-06, 'weight_decay': 8.336231007786579e-06, 'epochs': 231, 'loss': 'mse', 'optimizer': 'adam', 'graph_mode': 'knn', 'source': 'grm', 'knn_k': 2, 'weighted_edges': False, 'symmetrize_mode': 'union', 'use_snp_selection': True, 'num_snps': 5980}. Best is trial 109 with value: 0.09816236567521958.
[I 2025-11-03 12:52:04,837] Trial 121 finished with value: 0.008980681551453318 and parameters: {'model_type': 'gcn', 'hidden_dims': '[512, 128]', 'dropout': 0.24624101678567106, 'batch_norm': False, 'lr': 4.6404977842978754e-05, 'weight_decay': 8.392538545354912e-05, 'epochs': 191, 'loss': 'mse', 'optimizer': 'adam', 'graph_mode': 'cutoff', 'cutoff': 0.21361811352988264, 'grm_norm': 'gcn', 'self_loops': False, 'use_snp_selection': True, 'num_snps': 29745}. Best is trial 109 with value: 0.09816236567521958.
[I 2025-11-03 12:52:07,658] Trial 122 finished with value: -0.0019730764343064856 and parameters: {'model_type': 'gcn', 'hidden_dims': '[512, 128]', 'dropout': 0.2690433286983318, 'batch_norm': False, 'lr': 3.118508049106152e-05, 'weight_decay': 2.1855351804135454e-07, 'epochs': 265, 'loss': 'mse', 'optimizer': 'adam', 'graph_mode': 'cutoff', 'cutoff': 0.3542358945783345, 'grm_norm': 'cosine_then_gcn', 'self_loops': False, 'use_snp_selection': True, 'num_snps': 32314}. Best is trial 109 with value: 0.09816236567521958.
[I 2025-11-03 12:52:09,031] Trial 123 finished with value: 0.028522847209157 and parameters: {'model_type': 'gcn', 'hidden_dims': '[512, 128]', 'dropout': 0.2310466171947713, 'batch_norm': False, 'lr': 6.065558392724334e-05, 'weight_decay': 0.0001451714246022938, 'epochs': 107, 'loss': 'mse', 'optimizer': 'adam', 'graph_mode': 'knn', 'source': 'grm', 'knn_k': 5, 'weighted_edges': False, 'symmetrize_mode': 'union', 'use_snp_selection': True, 'num_snps': 7813}. Best is trial 109 with value: 0.09816236567521958.
[I 2025-11-03 12:52:10,837] Trial 124 finished with value: 0.0254375152859629 and parameters: {'model_type': 'gcn', 'hidden_dims': '[512, 128]', 'dropout': 0.21871095657873843, 'batch_norm': False, 'lr': 4.237077140998637e-05, 'weight_decay': 1.7283350411700815e-07, 'epochs': 260, 'loss': 'mse', 'optimizer': 'adam', 'graph_mode': 'cutoff', 'cutoff': 0.8111167702111699, 'grm_norm': 'cosine', 'self_loops': False, 'use_snp_selection': True, 'num_snps': 10233}. Best is trial 109 with value: 0.09816236567521958.
[I 2025-11-03 12:52:13,290] Trial 125 finished with value: 0.005455906567245227 and parameters: {'model_type': 'gcn', 'hidden_dims': '[512, 128]', 'dropout': 0.21358971207439556, 'batch_norm': False, 'lr': 7.13970764400411e-05, 'weight_decay': 9.528512549389896e-06, 'epochs': 342, 'loss': 'mse', 'optimizer': 'adam', 'graph_mode': 'knn', 'source': 'grm', 'knn_k': 4, 'weighted_edges': False, 'symmetrize_mode': 'union', 'use_snp_selection': True, 'num_snps': 18737}. Best is trial 109 with value: 0.09816236567521958.
[I 2025-11-03 12:52:14,911] Trial 126 finished with value: 0.027180416165530893 and parameters: {'model_type': 'gcn', 'hidden_dims': '[512, 64]', 'dropout': 0.41803676051960603, 'batch_norm': False, 'lr': 5.1618509210021574e-05, 'weight_decay': 1.4314642372794657e-05, 'epochs': 281, 'loss': 'mse', 'optimizer': 'adam', 'graph_mode': 'cutoff', 'cutoff': 0.4504674340185596, 'grm_norm': 'gcn', 'self_loops': False, 'use_snp_selection': True, 'num_snps': 3030}. Best is trial 109 with value: 0.09816236567521958.
[I 2025-11-03 12:52:16,562] Trial 127 finished with value: 0.03220877193981628 and parameters: {'model_type': 'gcn', 'hidden_dims': '[128, 64]', 'dropout': 0.29349911472414525, 'batch_norm': False, 'lr': 2.7517428653571613e-05, 'weight_decay': 0.0001044544888291392, 'epochs': 87, 'loss': 'mse', 'optimizer': 'adam', 'graph_mode': 'knn', 'source': 'grm', 'knn_k': 2, 'weighted_edges': False, 'symmetrize_mode': 'union', 'use_snp_selection': True, 'num_snps': 20716}. Best is trial 109 with value: 0.09816236567521958.
[I 2025-11-03 12:52:19,537] Trial 128 finished with value: 0.008499893464904802 and parameters: {'model_type': 'gcn', 'hidden_dims': '[512, 256]', 'dropout': 0.2566257296006849, 'batch_norm': True, 'lr': 2.3745949812284572e-05, 'weight_decay': 3.8890937801299923e-07, 'epochs': 315, 'loss': 'mae', 'optimizer': 'adam', 'graph_mode': 'cutoff', 'cutoff': 0.5279656037143416, 'grm_norm': 'cosine_then_gcn', 'self_loops': False, 'use_snp_selection': False}. Best is trial 109 with value: 0.09816236567521958.
[I 2025-11-03 12:52:21,667] Trial 129 finished with value: -0.004354753597687208 and parameters: {'model_type': 'gcn', 'hidden_dims': '[256, 128, 64]', 'dropout': 0.2284217862500138, 'batch_norm': False, 'lr': 3.440172159334536e-05, 'weight_decay': 2.5473121620749054e-07, 'epochs': 326, 'loss': 'mse', 'optimizer': 'adam', 'graph_mode': 'cutoff', 'cutoff': 0.6242186059540256, 'grm_norm': 'cosine', 'self_loops': False, 'use_snp_selection': True, 'num_snps': 5441}. Best is trial 109 with value: 0.09816236567521958.
[I 2025-11-03 12:52:23,607] Trial 130 finished with value: 0.015812239605635593 and parameters: {'model_type': 'gcn', 'hidden_dims': '[512, 128]', 'dropout': 0.39930266420589977, 'batch_norm': False, 'lr': 0.0001023415776536269, 'weight_decay': 1.2379621572996946e-07, 'epochs': 221, 'loss': 'mae', 'optimizer': 'adam', 'graph_mode': 'knn', 'source': 'grm', 'knn_k': 3, 'weighted_edges': False, 'symmetrize_mode': 'union', 'use_snp_selection': True, 'num_snps': 13675}. Best is trial 109 with value: 0.09816236567521958.
[I 2025-11-03 12:52:25,813] Trial 131 finished with value: 0.06707761190457362 and parameters: {'model_type': 'gcn', 'hidden_dims': '[512, 256]', 'dropout': 0.45079788472065846, 'batch_norm': False, 'lr': 8.035340426825369e-05, 'weight_decay': 0.0003531727485580361, 'epochs': 289, 'loss': 'mae', 'optimizer': 'adam', 'graph_mode': 'cutoff', 'cutoff': 0.32872320107734915, 'grm_norm': 'cosine_then_gcn', 'self_loops': True, 'use_snp_selection': True, 'num_snps': 16152}. Best is trial 109 with value: 0.09816236567521958.
[I 2025-11-03 12:52:28,013] Trial 132 finished with value: 0.00569020557755082 and parameters: {'model_type': 'gcn', 'hidden_dims': '[512, 256]', 'dropout': 0.45313977329892624, 'batch_norm': False, 'lr': 8.222907138922102e-05, 'weight_decay': 0.0005223174300851935, 'epochs': 288, 'loss': 'mae', 'optimizer': 'adam', 'graph_mode': 'cutoff', 'cutoff': 0.32447783835542926, 'grm_norm': 'cosine_then_gcn', 'self_loops': True, 'use_snp_selection': True, 'num_snps': 16091}. Best is trial 109 with value: 0.09816236567521958.
[I 2025-11-03 12:52:30,452] Trial 133 finished with value: -0.0037163818209533014 and parameters: {'model_type': 'gcn', 'hidden_dims': '[512, 256]', 'dropout': 0.42856578923695565, 'batch_norm': False, 'lr': 0.00015019248034980426, 'weight_decay': 0.0004124162740001921, 'epochs': 270, 'loss': 'mae', 'optimizer': 'adam', 'graph_mode': 'cutoff', 'cutoff': 0.2549449811432849, 'grm_norm': 'cosine_then_gcn', 'self_loops': False, 'use_snp_selection': True, 'num_snps': 23786}. Best is trial 109 with value: 0.09816236567521958.
[I 2025-11-03 12:52:32,773] Trial 134 finished with value: -0.015626393818047358 and parameters: {'model_type': 'gcn', 'hidden_dims': '[512, 256]', 'dropout': 0.4768347789343689, 'batch_norm': False, 'lr': 0.0005620831005918848, 'weight_decay': 3.631043818131433e-05, 'epochs': 305, 'loss': 'mae', 'optimizer': 'adam', 'graph_mode': 'cutoff', 'cutoff': 0.2944464491196432, 'grm_norm': 'cosine_then_gcn', 'self_loops': False, 'use_snp_selection': True, 'num_snps': 18392}. Best is trial 109 with value: 0.09816236567521958.
[I 2025-11-03 12:52:34,787] Trial 135 finished with value: -0.004731396004098256 and parameters: {'model_type': 'gcn', 'hidden_dims': '[512, 256]', 'dropout': 0.24405579585550682, 'batch_norm': False, 'lr': 0.0001302286514681386, 'weight_decay': 0.0008120567571665008, 'epochs': 251, 'loss': 'mae', 'optimizer': 'adam', 'graph_mode': 'cutoff', 'cutoff': 0.35436900427679774, 'grm_norm': 'cosine_then_gcn', 'self_loops': False, 'use_snp_selection': True, 'num_snps': 14422}. Best is trial 109 with value: 0.09816236567521958.
[I 2025-11-03 12:52:37,550] Trial 136 finished with value: 0.02998752045927522 and parameters: {'model_type': 'gcn', 'hidden_dims': '[256, 128]', 'dropout': 0.31153452285728006, 'batch_norm': False, 'lr': 6.0076438208954046e-05, 'weight_decay': 2.7464510772168372e-05, 'epochs': 296, 'loss': 'mae', 'optimizer': 'adam', 'graph_mode': 'cutoff', 'cutoff': 0.40017115443583223, 'grm_norm': 'gcn', 'self_loops': True, 'use_snp_selection': True, 'num_snps': 34634}. Best is trial 109 with value: 0.09816236567521958.
[I 2025-11-03 12:52:40,284] Trial 137 finished with value: 0.021459191633771565 and parameters: {'model_type': 'gcn', 'hidden_dims': '[512, 128]', 'dropout': 0.19607044458413436, 'batch_norm': True, 'lr': 5.003945472179909e-05, 'weight_decay': 7.260393000317891e-05, 'epochs': 273, 'loss': 'mse', 'optimizer': 'adam', 'graph_mode': 'cutoff', 'cutoff': 0.43822942324216746, 'grm_norm': 'cosine', 'self_loops': False, 'use_snp_selection': False}. Best is trial 109 with value: 0.09816236567521958.
[I 2025-11-03 12:52:42,953] Trial 138 finished with value: 0.03504232142280999 and parameters: {'model_type': 'gcn', 'hidden_dims': '[512, 256]', 'dropout': 0.43963593806715423, 'batch_norm': False, 'lr': 9.221877066568211e-05, 'weight_decay': 6.2653749680246775e-06, 'epochs': 279, 'loss': 'mae', 'optimizer': 'adam', 'graph_mode': 'knn', 'source': 'grm', 'knn_k': 6, 'weighted_edges': True, 'symmetrize_mode': 'union', 'use_snp_selection': True, 'num_snps': 27493}. Best is trial 109 with value: 0.09816236567521958.
[I 2025-11-03 12:52:45,377] Trial 139 finished with value: 0.027259694732452513 and parameters: {'model_type': 'gcn', 'hidden_dims': '[512, 128]', 'dropout': 0.17036892942180298, 'batch_norm': False, 'lr': 7.170657043394675e-05, 'weight_decay': 0.0003091285334315263, 'epochs': 290, 'loss': 'mse', 'optimizer': 'adam', 'graph_mode': 'cutoff', 'cutoff': 0.5458158578199935, 'grm_norm': 'cosine_then_gcn', 'self_loops': False, 'use_snp_selection': True, 'num_snps': 21604}. Best is trial 109 with value: 0.09816236567521958.
[I 2025-11-03 12:52:46,591] Trial 140 finished with value: 0.004053335624000305 and parameters: {'model_type': 'gcn', 'hidden_dims': '[128, 64]', 'dropout': 0.26436337078892536, 'batch_norm': True, 'lr': 3.96962330783443e-05, 'weight_decay': 5.15638509022942e-05, 'epochs': 67, 'loss': 'mse', 'optimizer': 'adam', 'graph_mode': 'knn', 'source': 'grm', 'knn_k': 3, 'weighted_edges': False, 'symmetrize_mode': 'mutual', 'use_snp_selection': False}. Best is trial 109 with value: 0.09816236567521958.
[I 2025-11-03 12:52:48,874] Trial 141 finished with value: 0.04463168620199501 and parameters: {'model_type': 'gcn', 'hidden_dims': '[512, 256]', 'dropout': 0.4646723496367677, 'batch_norm': False, 'lr': 0.00011222444912148913, 'weight_decay': 1.5166194524477957e-06, 'epochs': 302, 'loss': 'mae', 'optimizer': 'adam', 'graph_mode': 'cutoff', 'cutoff': 0.3365295467891798, 'grm_norm': 'cosine_then_gcn', 'self_loops': True, 'use_snp_selection': True, 'num_snps': 17051}. Best is trial 109 with value: 0.09816236567521958.
[I 2025-11-03 12:52:50,420] Trial 142 finished with value: 0.02183094494164227 and parameters: {'model_type': 'gcn', 'hidden_dims': '[512, 256]', 'dropout': 0.49939112638831085, 'batch_norm': False, 'lr': 7.773583172206473e-05, 'weight_decay': 1.0140264623776092e-06, 'epochs': 126, 'loss': 'mae', 'optimizer': 'adam', 'graph_mode': 'cutoff', 'cutoff': 0.2716276504474721, 'grm_norm': 'cosine_then_gcn', 'self_loops': True, 'use_snp_selection': True, 'num_snps': 12179}. Best is trial 109 with value: 0.09816236567521958.
[I 2025-11-03 12:52:52,525] Trial 143 finished with value: -0.017445651055238893 and parameters: {'model_type': 'gcn', 'hidden_dims': '[512, 256]', 'dropout': 0.45116300812619986, 'batch_norm': False, 'lr': 6.566706671019835e-05, 'weight_decay': 3.7493272593198504e-06, 'epochs': 267, 'loss': 'mae', 'optimizer': 'adam', 'graph_mode': 'cutoff', 'cutoff': 0.3834132735113231, 'grm_norm': 'cosine_then_gcn', 'self_loops': True, 'use_snp_selection': True, 'num_snps': 15304}. Best is trial 109 with value: 0.09816236567521958.
[I 2025-11-03 12:52:54,397] Trial 144 finished with value: -0.0026745372511319723 and parameters: {'model_type': 'gcn', 'hidden_dims': '[512, 256]', 'dropout': 0.2332579389570486, 'batch_norm': False, 'lr': 1.8252830560687606e-05, 'weight_decay': 7.734169603303536e-06, 'epochs': 285, 'loss': 'mae', 'optimizer': 'adam', 'graph_mode': 'cutoff', 'cutoff': 0.3630533423966649, 'grm_norm': 'cosine_then_gcn', 'self_loops': True, 'use_snp_selection': True, 'num_snps': 9275}. Best is trial 109 with value: 0.09816236567521958.
[I 2025-11-03 12:52:57,179] Trial 145 finished with value: 0.05111225243823165 and parameters: {'model_type': 'gcn', 'hidden_dims': '[256, 128, 64]', 'dropout': 0.22380775131254413, 'batch_norm': False, 'lr': 0.00018632099488025242, 'weight_decay': 2.8217322266558854e-06, 'epochs': 350, 'loss': 'mae', 'optimizer': 'adam', 'graph_mode': 'cutoff', 'cutoff': 0.4878251672159644, 'grm_norm': 'none', 'self_loops': True, 'use_snp_selection': True, 'num_snps': 22769}. Best is trial 109 with value: 0.09816236567521958.
