[I 2025-11-03 12:33:37,590] Trial 53 finished with value: 0.02694143307173354 and parameters: {'model_type': 'gcn', 'hidden_dims': '[128, 64]', 'dropout': 0.20194068050131403, 'batch_norm': False, 'lr': 3.374384975157685e-05, 'weight_decay': 4.769869727320643e-07, 'epochs': 253, 'loss': 'mse', 'optimizer': 'adam', 'graph_mode': 'off', 'use_snp_selection': True, 'num_snps': 22359}. Best is trial 26 with value: 0.07396831806114475.
[I 2025-11-03 12:33:39,073] Trial 54 finished with value: 0.04049384605640138 and parameters: {'model_type': 'gcn', 'hidden_dims': '[128, 64]', 'dropout': 0.2358119392906592, 'batch_norm': False, 'lr': 7.265937822650724e-05, 'weight_decay': 2.970001964198336e-07, 'epochs': 213, 'loss': 'mse', 'optimizer': 'adam', 'graph_mode': 'off', 'use_snp_selection': True, 'num_snps': 33183}. Best is trial 26 with value: 0.07396831806114475.
[I 2025-11-03 12:33:40,005] Trial 55 finished with value: 0.05464940474993355 and parameters: {'model_type': 'gcn', 'hidden_dims': '[512, 64]', 'dropout': 0.27377178536099717, 'batch_norm': False, 'lr': 4.9550149988322115e-05, 'weight_decay': 1.4000420512241125e-06, 'epochs': 56, 'loss': 'mae', 'optimizer': 'adam', 'graph_mode': 'off', 'use_snp_selection': True, 'num_snps': 15181}. Best is trial 26 with value: 0.07396831806114475.
[I 2025-11-03 12:33:40,921] Trial 56 finished with value: 0.04194341842270401 and parameters: {'model_type': 'gcn', 'hidden_dims': '[512, 64]', 'dropout': 0.2654848543613292, 'batch_norm': False, 'lr': 4.618101730217766e-05, 'weight_decay': 1.4045398867062153e-06, 'epochs': 51, 'loss': 'mae', 'optimizer': 'adam', 'graph_mode': 'off', 'use_snp_selection': True, 'num_snps': 14880}. Best is trial 26 with value: 0.07396831806114475.
[I 2025-11-03 12:33:43,166] Trial 57 finished with value: 0.007554665943755263 and parameters: {'model_type': 'gcn', 'hidden_dims': '[512, 64]', 'dropout': 0.29632063644441375, 'batch_norm': True, 'lr': 2.695429938465368e-05, 'weight_decay': 3.345300707858668e-06, 'epochs': 86, 'loss': 'mae', 'optimizer': 'adam', 'graph_mode': 'off', 'use_snp_selection': True, 'num_snps': 57369}. Best is trial 26 with value: 0.07396831806114475.
[I 2025-11-03 12:33:44,372] Trial 58 finished with value: 0.011095463897517645 and parameters: {'model_type': 'gcn', 'hidden_dims': '[512, 64]', 'dropout': 0.3225667968232032, 'batch_norm': False, 'lr': 5.466586494701087e-05, 'weight_decay': 1.6146631003059392e-05, 'epochs': 75, 'loss': 'mae', 'optimizer': 'adam', 'graph_mode': 'off', 'use_snp_selection': False}. Best is trial 26 with value: 0.07396831806114475.
[I 2025-11-03 12:33:45,454] Trial 59 finished with value: 0.005111815230013958 and parameters: {'model_type': 'gcn', 'hidden_dims': '[512, 64]', 'dropout': 0.4012954779424238, 'batch_norm': False, 'lr': 7.321740612310062e-06, 'weight_decay': 1.1154737917537146e-07, 'epochs': 63, 'loss': 'mae', 'optimizer': 'adam', 'graph_mode': 'off', 'use_snp_selection': True, 'num_snps': 18976}. Best is trial 26 with value: 0.07396831806114475.
[I 2025-11-03 12:33:46,316] Trial 60 finished with value: 0.02730602770751098 and parameters: {'model_type': 'gcn', 'hidden_dims': '[512, 256]', 'dropout': 0.5834829387334929, 'batch_norm': False, 'lr': 3.626880297404526e-05, 'weight_decay': 6.766998745818341e-07, 'epochs': 97, 'loss': 'mae', 'optimizer': 'adam', 'graph_mode': 'off', 'use_snp_selection': True, 'num_snps': 9908}. Best is trial 26 with value: 0.07396831806114475.
[I 2025-11-03 12:33:47,253] Trial 61 finished with value: 0.008433062164059668 and parameters: {'model_type': 'gcn', 'hidden_dims': '[256, 128, 64]', 'dropout': 0.12985103267906936, 'batch_norm': False, 'lr': 8.758735838220525e-05, 'weight_decay': 1.9392967371342572e-07, 'epochs': 51, 'loss': 'mae', 'optimizer': 'adam', 'graph_mode': 'off', 'use_snp_selection': True, 'num_snps': 15770}. Best is trial 26 with value: 0.07396831806114475.
[I 2025-11-03 12:33:48,502] Trial 62 finished with value: 0.012843380082243045 and parameters: {'model_type': 'gcn', 'hidden_dims': '[256, 128]', 'dropout': 0.2518681774687498, 'batch_norm': False, 'lr': 0.0001526239847529056, 'weight_decay': 9.550257944191375e-07, 'epochs': 121, 'loss': 'mse', 'optimizer': 'adam', 'graph_mode': 'off', 'use_snp_selection': True, 'num_snps': 24376}. Best is trial 26 with value: 0.07396831806114475.
[I 2025-11-03 12:33:50,483] Trial 63 finished with value: 0.020687869049092113 and parameters: {'model_type': 'gcn', 'hidden_dims': '[128, 64]', 'dropout': 0.3575066668575528, 'batch_norm': False, 'lr': 0.00033240647431153107, 'weight_decay': 3.0818480418610103e-07, 'epochs': 185, 'loss': 'mae', 'optimizer': 'adam', 'graph_mode': 'off', 'use_snp_selection': True, 'num_snps': 56411}. Best is trial 26 with value: 0.07396831806114475.
[I 2025-11-03 12:33:51,998] Trial 64 finished with value: 0.017809865501723206 and parameters: {'model_type': 'gcn', 'hidden_dims': '[512, 256]', 'dropout': 0.2039118983489196, 'batch_norm': False, 'lr': 1.7715313121819945e-05, 'weight_decay': 5.391318988172083e-07, 'epochs': 105, 'loss': 'mse', 'optimizer': 'adam', 'graph_mode': 'off', 'use_snp_selection': True, 'num_snps': 30261}. Best is trial 26 with value: 0.07396831806114475.
[I 2025-11-03 12:33:53,518] Trial 65 finished with value: 0.018862842444907896 and parameters: {'model_type': 'gcn', 'hidden_dims': '[512, 64]', 'dropout': 0.21748274680230034, 'batch_norm': False, 'lr': 6.716464000797963e-05, 'weight_decay': 3.683799868361683e-07, 'epochs': 227, 'loss': 'mae', 'optimizer': 'adam', 'graph_mode': 'off', 'use_snp_selection': True, 'num_snps': 18429}. Best is trial 26 with value: 0.07396831806114475.
[I 2025-11-03 12:33:55,444] Trial 66 finished with value: 0.017542306732387436 and parameters: {'model_type': 'gcn', 'hidden_dims': '[512, 256]', 'dropout': 0.4651001755472421, 'batch_norm': False, 'lr': 1.1008704489502796e-05, 'weight_decay': 2.172270851697858e-07, 'epochs': 203, 'loss': 'mse', 'optimizer': 'adam', 'graph_mode': 'off', 'use_snp_selection': False}. Best is trial 26 with value: 0.07396831806114475.
[I 2025-11-03 12:33:56,311] Trial 67 finished with value: 0.07704791879056022 and parameters: {'model_type': 'gcn', 'hidden_dims': '[256, 128]', 'dropout': 0.27798246702974494, 'batch_norm': False, 'lr': 2.463140468135995e-05, 'weight_decay': 2.180216808071154e-06, 'epochs': 82, 'loss': 'mse', 'optimizer': 'adam', 'graph_mode': 'off', 'use_snp_selection': True, 'num_snps': 12631}. Best is trial 67 with value: 0.07704791879056022.
[I 2025-11-03 12:33:57,151] Trial 68 finished with value: 0.0005573415414165271 and parameters: {'model_type': 'gcn', 'hidden_dims': '[256, 128]', 'dropout': 0.27765221266868334, 'batch_norm': False, 'lr': 2.648931866764477e-05, 'weight_decay': 2.666517279634681e-06, 'epochs': 69, 'loss': 'mae', 'optimizer': 'adam', 'graph_mode': 'off', 'use_snp_selection': True, 'num_snps': 12169}. Best is trial 67 with value: 0.07704791879056022.
[I 2025-11-03 12:33:57,987] Trial 69 finished with value: 0.05563170104267967 and parameters: {'model_type': 'gcn', 'hidden_dims': '[256, 128]', 'dropout': 0.25168018728368613, 'batch_norm': False, 'lr': 1.464630899327684e-05, 'weight_decay': 1.541728983634725e-06, 'epochs': 106, 'loss': 'mse', 'optimizer': 'adam', 'graph_mode': 'off', 'use_snp_selection': True, 'num_snps': 8314}. Best is trial 67 with value: 0.07704791879056022.
[I 2025-11-03 12:33:58,977] Trial 70 finished with value: 0.01849594568510421 and parameters: {'model_type': 'gcn', 'hidden_dims': '[256, 128]', 'dropout': 0.31713945432384966, 'batch_norm': True, 'lr': 1.2686616651236374e-05, 'weight_decay': 1.3392576354755436e-06, 'epochs': 140, 'loss': 'mse', 'optimizer': 'adam', 'graph_mode': 'off', 'use_snp_selection': True, 'num_snps': 10009}. Best is trial 67 with value: 0.07704791879056022.
[I 2025-11-03 12:33:59,728] Trial 71 finished with value: 0.05564415507169455 and parameters: {'model_type': 'gcn', 'hidden_dims': '[256, 128]', 'dropout': 0.2590734716277228, 'batch_norm': False, 'lr': 1.5240291761246012e-05, 'weight_decay': 2.006295053586081e-06, 'epochs': 82, 'loss': 'mse', 'optimizer': 'adam', 'graph_mode': 'off', 'use_snp_selection': True, 'num_snps': 6437}. Best is trial 67 with value: 0.07704791879056022.
[I 2025-11-03 12:34:00,488] Trial 72 finished with value: 0.028995212331919144 and parameters: {'model_type': 'gcn', 'hidden_dims': '[256, 128]', 'dropout': 0.25804757679424906, 'batch_norm': False, 'lr': 1.6878100522839923e-05, 'weight_decay': 2.0607076424269758e-06, 'epochs': 82, 'loss': 'mse', 'optimizer': 'adam', 'graph_mode': 'off', 'use_snp_selection': True, 'num_snps': 7605}. Best is trial 67 with value: 0.07704791879056022.
[I 2025-11-03 12:34:01,246] Trial 73 finished with value: 0.022256485472505746 and parameters: {'model_type': 'gcn', 'hidden_dims': '[256, 128]', 'dropout': 0.28712167781381615, 'batch_norm': False, 'lr': 2.1382250407671035e-05, 'weight_decay': 7.213169134618954e-07, 'epochs': 109, 'loss': 'mse', 'optimizer': 'adam', 'graph_mode': 'off', 'use_snp_selection': True, 'num_snps': 4285}. Best is trial 67 with value: 0.07704791879056022.
[I 2025-11-03 12:34:02,150] Trial 74 finished with value: 0.03881414134203107 and parameters: {'model_type': 'gcn', 'hidden_dims': '[256, 128]', 'dropout': 0.3109587160257259, 'batch_norm': False, 'lr': 3.331360048489246e-05, 'weight_decay': 1.211134638432669e-06, 'epochs': 95, 'loss': 'mse', 'optimizer': 'adam', 'graph_mode': 'off', 'use_snp_selection': True, 'num_snps': 13007}. Best is trial 67 with value: 0.07704791879056022.
[I 2025-11-03 12:34:02,914] Trial 75 finished with value: 0.008081409871374875 and parameters: {'model_type': 'gcn', 'hidden_dims': '[256, 128]', 'dropout': 0.24472597901676085, 'batch_norm': False, 'lr': 2.357474992092213e-05, 'weight_decay': 2.401154984547643e-06, 'epochs': 81, 'loss': 'mse', 'optimizer': 'adam', 'graph_mode': 'off', 'use_snp_selection': True, 'num_snps': 7470}. Best is trial 67 with value: 0.07704791879056022.
[I 2025-11-03 12:34:03,692] Trial 76 finished with value: 0.04730732071676983 and parameters: {'model_type': 'gcn', 'hidden_dims': '[256, 128]', 'dropout': 0.26760228790353247, 'batch_norm': False, 'lr': 1.5129866399397952e-05, 'weight_decay': 1.5531552599784552e-06, 'epochs': 119, 'loss': 'mse', 'optimizer': 'adam', 'graph_mode': 'off', 'use_snp_selection': True, 'num_snps': 4322}. Best is trial 67 with value: 0.07704791879056022.
[I 2025-11-03 12:34:04,802] Trial 77 finished with value: 0.019202727545692924 and parameters: {'model_type': 'gcn', 'hidden_dims': '[256, 128]', 'dropout': 0.3374753482953063, 'batch_norm': False, 'lr': 8.040137457519941e-06, 'weight_decay': 3.76393644153181e-06, 'epochs': 127, 'loss': 'mse', 'optimizer': 'adam', 'graph_mode': 'off', 'use_snp_selection': False}. Best is trial 67 with value: 0.07704791879056022.
[I 2025-11-03 12:34:05,688] Trial 78 finished with value: 0.042404435931668004 and parameters: {'model_type': 'gcn', 'hidden_dims': '[256, 128]', 'dropout': 0.18568895481222691, 'batch_norm': False, 'lr': 4.295324316594131e-05, 'weight_decay': 8.325199553911245e-07, 'epochs': 59, 'loss': 'mse', 'optimizer': 'adam', 'graph_mode': 'off', 'use_snp_selection': True, 'num_snps': 15333}. Best is trial 67 with value: 0.07704791879056022.
[I 2025-11-03 12:34:06,613] Trial 79 finished with value: -0.003049838814591593 and parameters: {'model_type': 'gcn', 'hidden_dims': '[256, 128]', 'dropout': 0.42585694649750505, 'batch_norm': False, 'lr': 3.0112796337955673e-05, 'weight_decay': 4.483192924405649e-07, 'epochs': 103, 'loss': 'mse', 'optimizer': 'adam', 'graph_mode': 'off', 'use_snp_selection': True, 'num_snps': 11915}. Best is trial 67 with value: 0.07704791879056022.
[I 2025-11-03 12:34:07,452] Trial 80 finished with value: 0.06514579627107535 and parameters: {'model_type': 'gcn', 'hidden_dims': '[512, 128]', 'dropout': 0.292481331491216, 'batch_norm': False, 'lr': 5.592184311140731e-05, 'weight_decay': 5.06270726585624e-06, 'epochs': 91, 'loss': 'mse', 'optimizer': 'adam', 'graph_mode': 'off', 'use_snp_selection': True, 'num_snps': 8775}. Best is trial 67 with value: 0.07704791879056022.
[I 2025-11-03 12:34:08,287] Trial 81 finished with value: 0.011505835365262826 and parameters: {'model_type': 'gcn', 'hidden_dims': '[512, 128]', 'dropout': 0.2850165238317753, 'batch_norm': False, 'lr': 5.161159330705967e-05, 'weight_decay': 7.783409904272783e-06, 'epochs': 91, 'loss': 'mse', 'optimizer': 'adam', 'graph_mode': 'off', 'use_snp_selection': True, 'num_snps': 8843}. Best is trial 67 with value: 0.07704791879056022.
[I 2025-11-03 12:34:09,003] Trial 82 finished with value: 0.032407864975482564 and parameters: {'model_type': 'gcn', 'hidden_dims': '[512, 128]', 'dropout': 0.2993694105260225, 'batch_norm': False, 'lr': 1.2953012166040827e-05, 'weight_decay': 5.916197678025447e-06, 'epochs': 69, 'loss': 'mse', 'optimizer': 'adam', 'graph_mode': 'off', 'use_snp_selection': True, 'num_snps': 5837}. Best is trial 67 with value: 0.07704791879056022.
[I 2025-11-03 12:34:10,722] Trial 83 finished with value: 0.055203476360225934 and parameters: {'model_type': 'gcn', 'hidden_dims': '[512, 128]', 'dropout': 0.24767954531171224, 'batch_norm': False, 'lr': 3.784176954084842e-05, 'weight_decay': 4.544293358338597e-06, 'epochs': 323, 'loss': 'mse', 'optimizer': 'adam', 'graph_mode': 'off', 'use_snp_selection': True, 'num_snps': 17178}. Best is trial 67 with value: 0.07704791879056022.
[I 2025-11-03 12:34:11,836] Trial 84 finished with value: 0.0477927059141596 and parameters: {'model_type': 'gcn', 'hidden_dims': '[512, 128]', 'dropout': 0.273712115696987, 'batch_norm': False, 'lr': 2.0478106586236215e-05, 'weight_decay': 5.1384885452186695e-06, 'epochs': 296, 'loss': 'mse', 'optimizer': 'adam', 'graph_mode': 'off', 'use_snp_selection': True, 'num_snps': 2250}. Best is trial 67 with value: 0.07704791879056022.
[I 2025-11-03 12:34:13,386] Trial 85 finished with value: 0.013588692861286568 and parameters: {'model_type': 'gcn', 'hidden_dims': '[512, 128]', 'dropout': 0.22671527180883178, 'batch_norm': False, 'lr': 5.286958475702096e-06, 'weight_decay': 3.450070993215293e-06, 'epochs': 307, 'loss': 'mse', 'optimizer': 'adam', 'graph_mode': 'off', 'use_snp_selection': True, 'num_snps': 14421}. Best is trial 67 with value: 0.07704791879056022.
[I 2025-11-03 12:34:15,025] Trial 86 finished with value: 0.025709973536550787 and parameters: {'model_type': 'gcn', 'hidden_dims': '[512, 128]', 'dropout': 0.25557490569587166, 'batch_norm': False, 'lr': 1.1109266967482666e-05, 'weight_decay': 1.0883418362614595e-05, 'epochs': 48, 'loss': 'mse', 'optimizer': 'adam', 'graph_mode': 'off', 'use_snp_selection': True, 'num_snps': 41705}. Best is trial 67 with value: 0.07704791879056022.
[I 2025-11-03 12:34:16,549] Trial 87 finished with value: 0.02757748525162483 and parameters: {'model_type': 'gcn', 'hidden_dims': '[512, 128]', 'dropout': 0.28817614243500433, 'batch_norm': True, 'lr': 3.779277190821696e-05, 'weight_decay': 4.357817950016426e-06, 'epochs': 330, 'loss': 'mse', 'optimizer': 'adam', 'graph_mode': 'off', 'use_snp_selection': True, 'num_snps': 11147}. Best is trial 67 with value: 0.07704791879056022.
[I 2025-11-03 12:34:17,625] Trial 88 finished with value: 0.05488719316922827 and parameters: {'model_type': 'gcn', 'hidden_dims': '[512, 128]', 'dropout': 0.5288378475594004, 'batch_norm': False, 'lr': 5.885952288127102e-05, 'weight_decay': 7.030634913452423e-06, 'epochs': 79, 'loss': 'mse', 'optimizer': 'adam', 'graph_mode': 'off', 'use_snp_selection': True, 'num_snps': 17354}. Best is trial 67 with value: 0.07704791879056022.
[I 2025-11-03 12:34:18,689] Trial 89 finished with value: 0.010888357297681043 and parameters: {'model_type': 'gcn', 'hidden_dims': '[512, 128]', 'dropout': 0.5310672893793568, 'batch_norm': False, 'lr': 6.105742491379708e-05, 'weight_decay': 6.631482897294845e-06, 'epochs': 85, 'loss': 'mse', 'optimizer': 'adam', 'graph_mode': 'off', 'use_snp_selection': True, 'num_snps': 17213}. Best is trial 67 with value: 0.07704791879056022.
[I 2025-11-03 12:34:19,897] Trial 90 finished with value: 0.02372912114087772 and parameters: {'model_type': 'gcn', 'hidden_dims': '[512, 128]', 'dropout': 0.3488209039439131, 'batch_norm': False, 'lr': 5.208677468412695e-05, 'weight_decay': 1.3539755189859161e-05, 'epochs': 76, 'loss': 'mse', 'optimizer': 'adam', 'graph_mode': 'off', 'use_snp_selection': False}. Best is trial 67 with value: 0.07704791879056022.
[I 2025-11-03 12:34:21,484] Trial 91 finished with value: 0.020023716313031143 and parameters: {'model_type': 'gcn', 'hidden_dims': '[512, 128]', 'dropout': 0.49605265153324285, 'batch_norm': False, 'lr': 2.9669530596862725e-05, 'weight_decay': 1.8523994146211532e-06, 'epochs': 348, 'loss': 'mse', 'optimizer': 'adam', 'graph_mode': 'off', 'use_snp_selection': True, 'num_snps': 13431}. Best is trial 67 with value: 0.07704791879056022.
[I 2025-11-03 12:34:22,416] Trial 92 finished with value: 0.03255544476254694 and parameters: {'model_type': 'gcn', 'hidden_dims': '[256, 128, 64]', 'dropout': 0.24161627468666125, 'batch_norm': False, 'lr': 2.4101085615994737e-05, 'weight_decay': 2.9337107630526877e-06, 'epochs': 114, 'loss': 'mse', 'optimizer': 'adam', 'graph_mode': 'off', 'use_snp_selection': True, 'num_snps': 7834}. Best is trial 67 with value: 0.07704791879056022.
[I 2025-11-03 12:34:23,601] Trial 93 finished with value: 0.02442435901321493 and parameters: {'model_type': 'gcn', 'hidden_dims': '[512, 128]', 'dropout': 0.5329406472270979, 'batch_norm': False, 'lr': 0.000983207575469736, 'weight_decay': 8.220643959206523e-06, 'epochs': 100, 'loss': 'mse', 'optimizer': 'adam', 'graph_mode': 'off', 'use_snp_selection': True, 'num_snps': 19060}. Best is trial 67 with value: 0.07704791879056022.
[I 2025-11-03 12:34:24,670] Trial 94 finished with value: 0.01303679978684956 and parameters: {'model_type': 'gcn', 'hidden_dims': '[256, 128]', 'dropout': 0.5093541873379603, 'batch_norm': False, 'lr': 0.0001077540595956543, 'weight_decay': 2.3617480269538223e-06, 'epochs': 64, 'loss': 'mse', 'optimizer': 'adam', 'graph_mode': 'off', 'use_snp_selection': True, 'num_snps': 21845}. Best is trial 67 with value: 0.07704791879056022.
[I 2025-11-03 12:34:25,832] Trial 95 finished with value: 0.04842070690313324 and parameters: {'model_type': 'gcn', 'hidden_dims': '[512, 64]', 'dropout': 0.4469603602543498, 'batch_norm': False, 'lr': 1.8650664551708116e-05, 'weight_decay': 9.825093092346003e-07, 'epochs': 137, 'loss': 'mse', 'optimizer': 'adam', 'graph_mode': 'off', 'use_snp_selection': True, 'num_snps': 16528}. Best is trial 67 with value: 0.07704791879056022.
[I 2025-11-03 12:34:26,688] Trial 96 finished with value: 0.03694573503537915 and parameters: {'model_type': 'gcn', 'hidden_dims': '[512, 128]', 'dropout': 0.5767549312528429, 'batch_norm': False, 'lr': 7.160749689239083e-05, 'weight_decay': 4.617504216205149e-06, 'epochs': 92, 'loss': 'mse', 'optimizer': 'adam', 'graph_mode': 'off', 'use_snp_selection': True, 'num_snps': 9392}. Best is trial 67 with value: 0.07704791879056022.
[I 2025-11-03 12:34:27,598] Trial 97 finished with value: 0.002104210401121633 and parameters: {'model_type': 'gcn', 'hidden_dims': '[256, 128]', 'dropout': 0.21556797508253026, 'batch_norm': False, 'lr': 4.300508049232335e-05, 'weight_decay': 3.0461799021328117e-06, 'epochs': 109, 'loss': 'mse', 'optimizer': 'adam', 'graph_mode': 'off', 'use_snp_selection': True, 'num_snps': 11262}. Best is trial 67 with value: 0.07704791879056022.
[I 2025-11-03 12:34:28,429] Trial 98 finished with value: 0.008026946695996955 and parameters: {'model_type': 'gcn', 'hidden_dims': '[256, 128]', 'dropout': 0.5438591910744331, 'batch_norm': False, 'lr': 3.441430574585743e-05, 'weight_decay': 2.162622003599485e-06, 'epochs': 125, 'loss': 'mse', 'optimizer': 'adam', 'graph_mode': 'off', 'use_snp_selection': True, 'num_snps': 6212}. Best is trial 67 with value: 0.07704791879056022.
[I 2025-11-03 12:34:29,361] Trial 99 finished with value: 0.00198097093286743 and parameters: {'model_type': 'gcn', 'hidden_dims': '[512, 128]', 'dropout': 0.3089381209242471, 'batch_norm': False, 'lr': 9.002616155942065e-06, 'weight_decay': 1.5748438794129838e-06, 'epochs': 57, 'loss': 'mse', 'optimizer': 'adam', 'graph_mode': 'off', 'use_snp_selection': True, 'num_snps': 14557}. Best is trial 67 with value: 0.07704791879056022.
[I 2025-11-03 12:34:30,435] Trial 100 finished with value: 0.07283246764087681 and parameters: {'model_type': 'gcn', 'hidden_dims': '[512, 64]', 'dropout': 0.2632382643356802, 'batch_norm': True, 'lr': 1.5312402097133894e-05, 'weight_decay': 7.203927423151202e-06, 'epochs': 84, 'loss': 'mse', 'optimizer': 'adam', 'graph_mode': 'off', 'use_snp_selection': True, 'num_snps': 17343}. Best is trial 67 with value: 0.07704791879056022.
[I 2025-11-03 12:34:31,525] Trial 101 finished with value: 0.032289853635893054 and parameters: {'model_type': 'gcn', 'hidden_dims': '[512, 64]', 'dropout': 0.25876881006568603, 'batch_norm': True, 'lr': 1.4136264249471209e-05, 'weight_decay': 6.970431063612838e-06, 'epochs': 79, 'loss': 'mse', 'optimizer': 'adam', 'graph_mode': 'off', 'use_snp_selection': True, 'num_snps': 17318}. Best is trial 67 with value: 0.07704791879056022.
[I 2025-11-03 12:34:32,638] Trial 102 finished with value: -0.00527138440635287 and parameters: {'model_type': 'gcn', 'hidden_dims': '[512, 64]', 'dropout': 0.5559125200741409, 'batch_norm': True, 'lr': 2.7295610791314077e-05, 'weight_decay': 1.2041273728558173e-05, 'epochs': 70, 'loss': 'mse', 'optimizer': 'adam', 'graph_mode': 'off', 'use_snp_selection': True, 'num_snps': 19225}. Best is trial 67 with value: 0.07704791879056022.
