[I 2025-11-03 13:37:59,836] Trial 15 finished with value: 0.1395209539563746 and parameters: {'model_type': 'gcn', 'hidden_dims': '[512, 128]', 'dropout': 0.2270774052443235, 'batch_norm': True, 'lr': 0.00022081075816005494, 'weight_decay': 4.647398975110258e-06, 'epochs': 268, 'loss': 'mae', 'optimizer': 'adam', 'graph_mode': 'off', 'use_snp_selection': False}. Best is trial 13 with value: 0.1426536166699519.
[I 2025-11-03 13:38:01,536] Trial 16 finished with value: 0.04302475073070972 and parameters: {'model_type': 'gcn', 'hidden_dims': '[256, 128, 64]', 'dropout': 0.3272438537349502, 'batch_norm': True, 'lr': 1.4186730202195519e-05, 'weight_decay': 4.319682528055659e-07, 'epochs': 220, 'loss': 'mae', 'optimizer': 'adam', 'graph_mode': 'off', 'use_snp_selection': False}. Best is trial 13 with value: 0.1426536166699519.
[I 2025-11-03 13:38:02,468] Trial 17 finished with value: 0.142648033671488 and parameters: {'model_type': 'gcn', 'hidden_dims': '[128, 64]', 'dropout': 0.5023764840287924, 'batch_norm': True, 'lr': 0.0004316698161142987, 'weight_decay': 6.65496788673904e-05, 'epochs': 153, 'loss': 'mae', 'optimizer': 'adam', 'graph_mode': 'off', 'use_snp_selection': False}. Best is trial 13 with value: 0.1426536166699519.
[I 2025-11-03 13:38:04,261] Trial 18 finished with value: 0.09598023654188555 and parameters: {'model_type': 'gcn', 'hidden_dims': '[128, 64]', 'dropout': 0.496722732969213, 'batch_norm': False, 'lr': 0.00016733760154266994, 'weight_decay': 7.197637349971629e-05, 'epochs': 109, 'loss': 'mae', 'optimizer': 'adam', 'graph_mode': 'off', 'use_snp_selection': True, 'num_snps': 58241}. Best is trial 13 with value: 0.1426536166699519.
[I 2025-11-03 13:38:05,232] Trial 19 finished with value: 0.03081147520611805 and parameters: {'model_type': 'gcn', 'hidden_dims': '[128, 64]', 'dropout': 0.5151095629761573, 'batch_norm': True, 'lr': 1.749953613394236e-05, 'weight_decay': 6.781491313995479e-05, 'epochs': 166, 'loss': 'mae', 'optimizer': 'adam', 'graph_mode': 'off', 'use_snp_selection': False}. Best is trial 13 with value: 0.1426536166699519.
[I 2025-11-03 13:38:06,718] Trial 20 finished with value: 0.12323230775570165 and parameters: {'model_type': 'gcn', 'hidden_dims': '[512, 256]', 'dropout': 0.48086497730842764, 'batch_norm': True, 'lr': 0.00041601794456672374, 'weight_decay': 6.714783628966817e-06, 'epochs': 117, 'loss': 'mae', 'optimizer': 'adam', 'graph_mode': 'off', 'use_snp_selection': False}. Best is trial 13 with value: 0.1426536166699519.
[I 2025-11-03 13:38:07,756] Trial 21 finished with value: 0.13035972086372988 and parameters: {'model_type': 'gcn', 'hidden_dims': '[128, 64]', 'dropout': 0.5801943431504863, 'batch_norm': True, 'lr': 0.0004940655189215167, 'weight_decay': 1.0863796298982378e-06, 'epochs': 192, 'loss': 'mae', 'optimizer': 'adam', 'graph_mode': 'off', 'use_snp_selection': False}. Best is trial 13 with value: 0.1426536166699519.
[I 2025-11-03 13:38:10,374] Trial 22 finished with value: 0.12286052498921568 and parameters: {'model_type': 'gcn', 'hidden_dims': '[512, 128]', 'dropout': 0.2134670728629386, 'batch_norm': True, 'lr': 0.00013125309290784544, 'weight_decay': 1.5399046505057312e-07, 'epochs': 292, 'loss': 'mae', 'optimizer': 'adam', 'graph_mode': 'off', 'use_snp_selection': False}. Best is trial 13 with value: 0.1426536166699519.
[I 2025-11-03 13:38:12,593] Trial 23 finished with value: 0.13420452037284394 and parameters: {'model_type': 'gcn', 'hidden_dims': '[512, 128]', 'dropout': 0.18072397639648616, 'batch_norm': True, 'lr': 0.0009284471673756117, 'weight_decay': 3.1393293951100876e-05, 'epochs': 237, 'loss': 'mae', 'optimizer': 'adam', 'graph_mode': 'off', 'use_snp_selection': False}. Best is trial 13 with value: 0.1426536166699519.
[I 2025-11-03 13:38:13,675] Trial 24 finished with value: 0.1454863949305103 and parameters: {'model_type': 'gcn', 'hidden_dims': '[128, 64]', 'dropout': 0.3134906031308018, 'batch_norm': True, 'lr': 0.0005588826868706272, 'weight_decay': 2.8594700928272414e-06, 'epochs': 199, 'loss': 'mae', 'optimizer': 'adam', 'graph_mode': 'off', 'use_snp_selection': False}. Best is trial 24 with value: 0.1454863949305103.
[I 2025-11-03 13:38:14,427] Trial 25 finished with value: 0.10480593977124247 and parameters: {'model_type': 'gcn', 'hidden_dims': '[128, 64]', 'dropout': 0.2882391538407478, 'batch_norm': True, 'lr': 0.00015053661683443493, 'weight_decay': 0.00015528655474825369, 'epochs': 82, 'loss': 'mae', 'optimizer': 'adam', 'graph_mode': 'off', 'use_snp_selection': False}. Best is trial 24 with value: 0.1454863949305103.
[I 2025-11-03 13:38:15,218] Trial 26 finished with value: 0.1038097927634656 and parameters: {'model_type': 'gcn', 'hidden_dims': '[128, 64]', 'dropout': 0.32281770502199625, 'batch_norm': False, 'lr': 0.0004216976214868696, 'weight_decay': 9.461966509569133e-06, 'epochs': 138, 'loss': 'mae', 'optimizer': 'adam', 'graph_mode': 'off', 'use_snp_selection': True, 'num_snps': 3842}. Best is trial 24 with value: 0.1454863949305103.
[I 2025-11-03 13:38:16,239] Trial 27 finished with value: 0.13353337945985216 and parameters: {'model_type': 'gcn', 'hidden_dims': '[128, 64]', 'dropout': 0.3530521180552669, 'batch_norm': True, 'lr': 0.00010513723080897184, 'weight_decay': 4.881339110858778e-06, 'epochs': 179, 'loss': 'mae', 'optimizer': 'adam', 'graph_mode': 'off', 'use_snp_selection': False}. Best is trial 24 with value: 0.1454863949305103.
[I 2025-11-03 13:38:17,396] Trial 28 finished with value: 0.10582373381634586 and parameters: {'model_type': 'gcn', 'hidden_dims': '[128, 64]', 'dropout': 0.5446517125861267, 'batch_norm': True, 'lr': 0.000276998256924745, 'weight_decay': 8.74418883788382e-07, 'epochs': 228, 'loss': 'mae', 'optimizer': 'adam', 'graph_mode': 'off', 'use_snp_selection': False}. Best is trial 24 with value: 0.1454863949305103.
[I 2025-11-03 13:38:18,302] Trial 29 finished with value: 0.12493882078376511 and parameters: {'model_type': 'gcn', 'hidden_dims': '[128, 64]', 'dropout': 0.4520472425021774, 'batch_norm': True, 'lr': 0.0005388560200940643, 'weight_decay': 0.00012363202694194868, 'epochs': 65, 'loss': 'mae', 'optimizer': 'adam', 'graph_mode': 'off', 'use_snp_selection': True, 'num_snps': 19468}. Best is trial 24 with value: 0.1454863949305103.
[I 2025-11-03 13:38:20,767] Trial 30 finished with value: 0.13964671144229168 and parameters: {'model_type': 'gcn', 'hidden_dims': '[512, 256]', 'dropout': 0.25231358023503264, 'batch_norm': True, 'lr': 9.176796991703802e-05, 'weight_decay': 4.525081022265389e-05, 'epochs': 263, 'loss': 'mae', 'optimizer': 'adam', 'graph_mode': 'off', 'use_snp_selection': False}. Best is trial 24 with value: 0.1454863949305103.
[I 2025-11-03 13:38:22,833] Trial 31 finished with value: 0.13486559130702902 and parameters: {'model_type': 'gcn', 'hidden_dims': '[512, 128]', 'dropout': 0.3375165015840731, 'batch_norm': True, 'lr': 0.0006237512630638752, 'weight_decay': 2.931347468819864e-06, 'epochs': 208, 'loss': 'mae', 'optimizer': 'adam', 'graph_mode': 'off', 'use_snp_selection': False}. Best is trial 24 with value: 0.1454863949305103.
[I 2025-11-03 13:38:24,209] Trial 32 finished with value: 0.1397857993105131 and parameters: {'model_type': 'gcn', 'hidden_dims': '[256, 128]', 'dropout': 0.18190371951357476, 'batch_norm': True, 'lr': 0.0009093175248742247, 'weight_decay': 1.2722141514194005e-05, 'epochs': 195, 'loss': 'mae', 'optimizer': 'adam', 'graph_mode': 'off', 'use_snp_selection': False}. Best is trial 24 with value: 0.1454863949305103.
[I 2025-11-03 13:38:25,593] Trial 33 finished with value: 0.12929744496823456 and parameters: {'model_type': 'gcn', 'hidden_dims': '[256, 128, 64]', 'dropout': 0.3613899791583047, 'batch_norm': True, 'lr': 0.0003475825930960351, 'weight_decay': 1.8076418792822789e-06, 'epochs': 157, 'loss': 'mae', 'optimizer': 'adam', 'graph_mode': 'off', 'use_snp_selection': False}. Best is trial 24 with value: 0.1454863949305103.
[I 2025-11-03 13:38:27,195] Trial 34 finished with value: 0.06189218299393062 and parameters: {'model_type': 'gcn', 'hidden_dims': '[512, 128]', 'dropout': 0.42691988840758255, 'batch_norm': True, 'lr': 3.0101436579601713e-05, 'weight_decay': 7.555303163304107e-06, 'epochs': 131, 'loss': 'mae', 'optimizer': 'adam', 'graph_mode': 'off', 'use_snp_selection': False}. Best is trial 24 with value: 0.1454863949305103.
[I 2025-11-03 13:38:28,760] Trial 35 finished with value: 0.11872473200629356 and parameters: {'model_type': 'gcn', 'hidden_dims': '[256, 128]', 'dropout': 0.13860745454391238, 'batch_norm': False, 'lr': 0.000548123363523585, 'weight_decay': 2.3523302247068976e-06, 'epochs': 245, 'loss': 'mae', 'optimizer': 'adam', 'graph_mode': 'off', 'use_snp_selection': False}. Best is trial 24 with value: 0.1454863949305103.
[I 2025-11-03 13:38:31,049] Trial 36 finished with value: 0.11726626984881329 and parameters: {'model_type': 'gcn', 'hidden_dims': '[128, 64]', 'dropout': 0.30135021693709474, 'batch_norm': True, 'lr': 0.00018336890780698944, 'weight_decay': 2.678096707922712e-07, 'epochs': 289, 'loss': 'mse', 'optimizer': 'adam', 'graph_mode': 'off', 'use_snp_selection': True, 'num_snps': 58661}. Best is trial 24 with value: 0.1454863949305103.
[I 2025-11-03 13:38:32,553] Trial 37 finished with value: 0.032425366816125754 and parameters: {'model_type': 'gcn', 'hidden_dims': '[256, 128, 64]', 'dropout': 0.2351928604182124, 'batch_norm': True, 'lr': 4.446294938689988e-06, 'weight_decay': 0.0008621816733128948, 'epochs': 182, 'loss': 'mae', 'optimizer': 'adam', 'graph_mode': 'off', 'use_snp_selection': False}. Best is trial 24 with value: 0.1454863949305103.
[I 2025-11-03 13:38:33,924] Trial 38 finished with value: 0.0791301178525379 and parameters: {'model_type': 'gcn', 'hidden_dims': '[512, 128]', 'dropout': 0.3924287949145666, 'batch_norm': False, 'lr': 0.0007051501993818949, 'weight_decay': 1.1690776204021995e-06, 'epochs': 159, 'loss': 'mse', 'optimizer': 'adam', 'graph_mode': 'off', 'use_snp_selection': True, 'num_snps': 19911}. Best is trial 24 with value: 0.1454863949305103.
[I 2025-11-03 13:38:35,090] Trial 39 finished with value: 0.12711580170960468 and parameters: {'model_type': 'gcn', 'hidden_dims': '[128, 64]', 'dropout': 0.4617509720526823, 'batch_norm': True, 'lr': 0.000281106861434052, 'weight_decay': 1.937010495471198e-05, 'epochs': 231, 'loss': 'mae', 'optimizer': 'adam', 'graph_mode': 'off', 'use_snp_selection': False}. Best is trial 24 with value: 0.1454863949305103.
[I 2025-11-03 13:38:38,065] Trial 40 finished with value: 0.1359677313314279 and parameters: {'model_type': 'gcn', 'hidden_dims': '[512, 256]', 'dropout': 0.19741439938228278, 'batch_norm': True, 'lr': 0.0003774441456637704, 'weight_decay': 4.495176736034112e-06, 'epochs': 350, 'loss': 'mae', 'optimizer': 'adam', 'graph_mode': 'off', 'use_snp_selection': False}. Best is trial 24 with value: 0.1454863949305103.
[I 2025-11-03 13:38:39,492] Trial 41 finished with value: 0.14668912833758807 and parameters: {'model_type': 'gcn', 'hidden_dims': '[256, 128]', 'dropout': 0.17573319211474417, 'batch_norm': True, 'lr': 0.0008874008060616063, 'weight_decay': 1.2124532028910815e-05, 'epochs': 203, 'loss': 'mae', 'optimizer': 'adam', 'graph_mode': 'off', 'use_snp_selection': False}. Best is trial 41 with value: 0.14668912833758807.
[I 2025-11-03 13:38:40,930] Trial 42 finished with value: 0.13141662329665504 and parameters: {'model_type': 'gcn', 'hidden_dims': '[256, 128]', 'dropout': 0.12905133184621592, 'batch_norm': True, 'lr': 0.0006437951277364793, 'weight_decay': 0.00040031033027471954, 'epochs': 209, 'loss': 'mae', 'optimizer': 'adam', 'graph_mode': 'off', 'use_snp_selection': False}. Best is trial 41 with value: 0.14668912833758807.
[I 2025-11-03 13:38:42,353] Trial 43 finished with value: 0.012578551558927852 and parameters: {'model_type': 'gcn', 'hidden_dims': '[256, 128]', 'dropout': 0.16721649992558796, 'batch_norm': True, 'lr': 2.1409924724993155e-06, 'weight_decay': 1.1553421109133891e-05, 'epochs': 194, 'loss': 'mae', 'optimizer': 'adam', 'graph_mode': 'off', 'use_snp_selection': False}. Best is trial 41 with value: 0.14668912833758807.
[I 2025-11-03 13:38:43,633] Trial 44 finished with value: 0.13881804971489686 and parameters: {'model_type': 'gcn', 'hidden_dims': '[256, 128]', 'dropout': 0.11890870657825649, 'batch_norm': True, 'lr': 0.0008846659335090775, 'weight_decay': 3.938061686979022e-05, 'epochs': 175, 'loss': 'mse', 'optimizer': 'adam', 'graph_mode': 'off', 'use_snp_selection': False}. Best is trial 41 with value: 0.14668912833758807.
[I 2025-11-03 13:38:45,939] Trial 45 finished with value: 0.11648532682845111 and parameters: {'model_type': 'gcn', 'hidden_dims': '[512, 64]', 'dropout': 0.26401342173140574, 'batch_norm': True, 'lr': 0.0002300226355390726, 'weight_decay': 1.485642782204733e-06, 'epochs': 245, 'loss': 'mae', 'optimizer': 'adam', 'graph_mode': 'off', 'use_snp_selection': False}. Best is trial 41 with value: 0.14668912833758807.
[I 2025-11-03 13:38:48,081] Trial 46 finished with value: 0.13127614038614693 and parameters: {'model_type': 'gcn', 'hidden_dims': '[512, 128]', 'dropout': 0.21435801460304715, 'batch_norm': True, 'lr': 0.0009889550068576556, 'weight_decay': 6.694950032502243e-07, 'epochs': 220, 'loss': 'mae', 'optimizer': 'adam', 'graph_mode': 'off', 'use_snp_selection': False}. Best is trial 41 with value: 0.14668912833758807.
[I 2025-11-03 13:38:49,254] Trial 47 finished with value: 0.0822997798449388 and parameters: {'model_type': 'gcn', 'hidden_dims': '[256, 128]', 'dropout': 0.16081758286896758, 'batch_norm': False, 'lr': 0.0004900230427221237, 'weight_decay': 1.9664612334719653e-05, 'epochs': 147, 'loss': 'mse', 'optimizer': 'adam', 'graph_mode': 'off', 'use_snp_selection': False}. Best is trial 41 with value: 0.14668912833758807.
[I 2025-11-03 13:38:51,343] Trial 48 finished with value: 0.13802167090751113 and parameters: {'model_type': 'gcn', 'hidden_dims': '[512, 64]', 'dropout': 0.24635477857740423, 'batch_norm': True, 'lr': 0.0006666198563829992, 'weight_decay': 3.15085262798451e-06, 'epochs': 210, 'loss': 'mae', 'optimizer': 'adam', 'graph_mode': 'off', 'use_snp_selection': False}. Best is trial 41 with value: 0.14668912833758807.
[I 2025-11-03 13:38:54,038] Trial 49 finished with value: 0.08216202107917756 and parameters: {'model_type': 'gcn', 'hidden_dims': '[512, 128]', 'dropout': 0.3131612053933693, 'batch_norm': True, 'lr': 4.06721087608523e-05, 'weight_decay': 0.0005066159281116345, 'epochs': 260, 'loss': 'mae', 'optimizer': 'adam', 'graph_mode': 'off', 'use_snp_selection': True, 'num_snps': 46888}. Best is trial 41 with value: 0.14668912833758807.
[I 2025-11-03 13:38:55,254] Trial 50 finished with value: 0.13362046594044868 and parameters: {'model_type': 'gcn', 'hidden_dims': '[256, 128, 64]', 'dropout': 0.37440750649046983, 'batch_norm': True, 'lr': 0.000349544048207119, 'weight_decay': 0.0001192744771516481, 'epochs': 125, 'loss': 'mae', 'optimizer': 'adam', 'graph_mode': 'off', 'use_snp_selection': False}. Best is trial 41 with value: 0.14668912833758807.
[I 2025-11-03 13:38:56,648] Trial 51 finished with value: 0.13244593787263628 and parameters: {'model_type': 'gcn', 'hidden_dims': '[256, 128]', 'dropout': 0.19055597617297232, 'batch_norm': True, 'lr': 0.0008007556051270582, 'weight_decay': 1.4990398144769033e-05, 'epochs': 198, 'loss': 'mae', 'optimizer': 'adam', 'graph_mode': 'off', 'use_snp_selection': False}. Best is trial 41 with value: 0.14668912833758807.
[I 2025-11-03 13:38:58,022] Trial 52 finished with value: 0.13980868598875051 and parameters: {'model_type': 'gcn', 'hidden_dims': '[256, 128]', 'dropout': 0.17436288727237825, 'batch_norm': True, 'lr': 0.0004753723525644222, 'weight_decay': 7.150549265026063e-06, 'epochs': 186, 'loss': 'mae', 'optimizer': 'adam', 'graph_mode': 'off', 'use_snp_selection': False}. Best is trial 41 with value: 0.14668912833758807.
[I 2025-11-03 13:38:59,307] Trial 53 finished with value: 0.08564467015514302 and parameters: {'model_type': 'gcn', 'hidden_dims': '[256, 128]', 'dropout': 0.1010265901330993, 'batch_norm': True, 'lr': 9.893381551729691e-06, 'weight_decay': 5.3989307247750065e-06, 'epochs': 169, 'loss': 'mae', 'optimizer': 'adam', 'graph_mode': 'off', 'use_snp_selection': False}. Best is trial 41 with value: 0.14668912833758807.
[I 2025-11-03 13:39:00,652] Trial 54 finished with value: 0.1406113592311402 and parameters: {'model_type': 'gcn', 'hidden_dims': '[256, 128]', 'dropout': 0.1445101346600851, 'batch_norm': True, 'lr': 0.000504380855101573, 'weight_decay': 7.059106593778294e-06, 'epochs': 184, 'loss': 'mae', 'optimizer': 'adam', 'graph_mode': 'off', 'use_snp_selection': False}. Best is trial 41 with value: 0.14668912833758807.
[I 2025-11-03 13:39:02,845] Trial 55 finished with value: 0.12454744223794803 and parameters: {'model_type': 'gcn', 'hidden_dims': '[512, 128]', 'dropout': 0.15113323261890965, 'batch_norm': True, 'lr': 0.00028761614526107214, 'weight_decay': 2.328995840877795e-06, 'epochs': 223, 'loss': 'mae', 'optimizer': 'adam', 'graph_mode': 'off', 'use_snp_selection': False}. Best is trial 41 with value: 0.14668912833758807.
[I 2025-11-03 13:39:03,813] Trial 56 finished with value: 0.1435164988490394 and parameters: {'model_type': 'gcn', 'hidden_dims': '[128, 64]', 'dropout': 0.11579236719295323, 'batch_norm': True, 'lr': 0.0006849779011938037, 'weight_decay': 2.8008990694458432e-05, 'epochs': 158, 'loss': 'mae', 'optimizer': 'adam', 'graph_mode': 'off', 'use_snp_selection': False}. Best is trial 41 with value: 0.14668912833758807.
[I 2025-11-03 13:39:04,746] Trial 57 finished with value: 0.11477817956949071 and parameters: {'model_type': 'gcn', 'hidden_dims': '[128, 64]', 'dropout': 0.12453252455894631, 'batch_norm': False, 'lr': 0.00019856810008329873, 'weight_decay': 3.156257240331116e-05, 'epochs': 160, 'loss': 'mae', 'optimizer': 'adam', 'graph_mode': 'off', 'use_snp_selection': False}. Best is trial 41 with value: 0.14668912833758807.
[I 2025-11-03 13:39:05,510] Trial 58 finished with value: 0.13237711448881181 and parameters: {'model_type': 'gcn', 'hidden_dims': '[128, 64]', 'dropout': 0.20660483606825308, 'batch_norm': True, 'lr': 0.0006182175694917437, 'weight_decay': 7.943057525357202e-05, 'epochs': 98, 'loss': 'mse', 'optimizer': 'adam', 'graph_mode': 'off', 'use_snp_selection': False}. Best is trial 41 with value: 0.14668912833758807.
[I 2025-11-03 13:39:06,445] Trial 59 finished with value: 0.14470336775539164 and parameters: {'model_type': 'gcn', 'hidden_dims': '[128, 64]', 'dropout': 0.11368402812007039, 'batch_norm': True, 'lr': 0.00041632363565105465, 'weight_decay': 0.00024132224718186138, 'epochs': 144, 'loss': 'mae', 'optimizer': 'adam', 'graph_mode': 'off', 'use_snp_selection': False}. Best is trial 41 with value: 0.14668912833758807.
[I 2025-11-03 13:39:07,686] Trial 60 finished with value: 0.13923944444669745 and parameters: {'model_type': 'gcn', 'hidden_dims': '[128, 64]', 'dropout': 0.2817552576541295, 'batch_norm': True, 'lr': 0.0004025456077043226, 'weight_decay': 0.00022281597908391362, 'epochs': 144, 'loss': 'mae', 'optimizer': 'adam', 'graph_mode': 'off', 'use_snp_selection': True, 'num_snps': 24139}. Best is trial 41 with value: 0.14668912833758807.
[I 2025-11-03 13:39:08,527] Trial 61 finished with value: 0.1400170181740432 and parameters: {'model_type': 'gcn', 'hidden_dims': '[128, 64]', 'dropout': 0.11835972424201917, 'batch_norm': True, 'lr': 0.0007395547564000243, 'weight_decay': 2.429724125372407e-05, 'epochs': 113, 'loss': 'mae', 'optimizer': 'adam', 'graph_mode': 'off', 'use_snp_selection': False}. Best is trial 41 with value: 0.14668912833758807.
[I 2025-11-03 13:39:09,645] Trial 62 finished with value: 0.12014545592800434 and parameters: {'model_type': 'gcn', 'hidden_dims': '[128, 64]', 'dropout': 0.10284707430404681, 'batch_norm': True, 'lr': 0.0002536529460264719, 'weight_decay': 5.5171907018190126e-05, 'epochs': 205, 'loss': 'mae', 'optimizer': 'adam', 'graph_mode': 'off', 'use_snp_selection': False}. Best is trial 41 with value: 0.14668912833758807.
[I 2025-11-03 13:39:10,565] Trial 63 finished with value: 0.1430770507823746 and parameters: {'model_type': 'gcn', 'hidden_dims': '[128, 64]', 'dropout': 0.1423184331704258, 'batch_norm': True, 'lr': 0.0007512032229406296, 'weight_decay': 0.0005874491246443042, 'epochs': 136, 'loss': 'mae', 'optimizer': 'adam', 'graph_mode': 'off', 'use_snp_selection': False}. Best is trial 41 with value: 0.14668912833758807.
[I 2025-11-03 13:39:11,463] Trial 64 finished with value: 0.13356915114344114 and parameters: {'model_type': 'gcn', 'hidden_dims': '[128, 64]', 'dropout': 0.14008100028449916, 'batch_norm': True, 'lr': 0.000988095215606108, 'weight_decay': 0.00018625941696797835, 'epochs': 132, 'loss': 'mae', 'optimizer': 'adam', 'graph_mode': 'off', 'use_snp_selection': False}. Best is trial 41 with value: 0.14668912833758807.
[I 2025-11-03 13:39:12,373] Trial 65 finished with value: 0.12743723926396788 and parameters: {'model_type': 'gcn', 'hidden_dims': '[128, 64]', 'dropout': 0.2227982160583614, 'batch_norm': True, 'lr': 0.0004213784655317246, 'weight_decay': 0.00028823178582171164, 'epochs': 151, 'loss': 'mae', 'optimizer': 'adam', 'graph_mode': 'off', 'use_snp_selection': False}. Best is trial 41 with value: 0.14668912833758807.
[I 2025-11-03 13:39:13,154] Trial 66 finished with value: 0.09685517493439172 and parameters: {'model_type': 'gcn', 'hidden_dims': '[128, 64]', 'dropout': 0.5668976103846967, 'batch_norm': True, 'lr': 0.0005743457131576089, 'weight_decay': 0.0006289334884724694, 'epochs': 102, 'loss': 'mae', 'optimizer': 'adam', 'graph_mode': 'off', 'use_snp_selection': False}. Best is trial 41 with value: 0.14668912833758807.
