[I 2025-11-03 13:27:37,589] Trial 62 finished with value: 0.0705897256081463 and parameters: {'model_type': 'graphsage', 'hidden_dims': '[256, 128, 64]', 'dropout': 0.2790720235626114, 'batch_norm': True, 'lr': 0.0008089324854289526, 'weight_decay': 2.2519437770964032e-06, 'epochs': 319, 'loss': 'mae', 'optimizer': 'adam', 'graph_mode': 'knn', 'source': 'grm', 'knn_k': 1, 'weighted_edges': True, 'symmetrize_mode': 'union', 'use_snp_selection': False}. Best is trial 46 with value: 0.07994171952257709.
[I 2025-11-03 13:27:41,882] Trial 63 finished with value: 0.07083565110254648 and parameters: {'model_type': 'graphsage', 'hidden_dims': '[512, 256]', 'dropout': 0.3529611704593839, 'batch_norm': True, 'lr': 0.0004958515798119646, 'weight_decay': 6.723977716123461e-06, 'epochs': 251, 'loss': 'mae', 'optimizer': 'adam', 'graph_mode': 'knn', 'source': 'grm', 'knn_k': 2, 'weighted_edges': True, 'symmetrize_mode': 'union', 'use_snp_selection': False}. Best is trial 46 with value: 0.07994171952257709.
[I 2025-11-03 13:27:46,272] Trial 64 finished with value: 0.06892042646347879 and parameters: {'model_type': 'graphsage', 'hidden_dims': '[512, 128]', 'dropout': 0.32947093906082764, 'batch_norm': True, 'lr': 0.0003055479567605449, 'weight_decay': 4.766910595892958e-06, 'epochs': 280, 'loss': 'mae', 'optimizer': 'adam', 'graph_mode': 'knn', 'source': 'grm', 'knn_k': 1, 'weighted_edges': True, 'symmetrize_mode': 'union', 'use_snp_selection': False}. Best is trial 46 with value: 0.07994171952257709.
[I 2025-11-03 13:27:50,954] Trial 65 finished with value: 0.07259553443753607 and parameters: {'model_type': 'graphsage', 'hidden_dims': '[512, 64]', 'dropout': 0.41385242994502947, 'batch_norm': True, 'lr': 0.0006016986624831772, 'weight_decay': 8.534915660557771e-07, 'epochs': 297, 'loss': 'mae', 'optimizer': 'adam', 'graph_mode': 'knn', 'source': 'grm', 'knn_k': 2, 'weighted_edges': True, 'symmetrize_mode': 'union', 'use_snp_selection': False}. Best is trial 46 with value: 0.07994171952257709.
[I 2025-11-03 13:27:55,591] Trial 66 finished with value: 0.06653346248238738 and parameters: {'model_type': 'graphsage', 'hidden_dims': '[512, 256]', 'dropout': 0.3859245341658007, 'batch_norm': True, 'lr': 0.0008499896565214635, 'weight_decay': 1.6918774670173514e-06, 'epochs': 309, 'loss': 'mae', 'optimizer': 'adam', 'graph_mode': 'knn', 'source': 'grm', 'knn_k': 1, 'weighted_edges': True, 'symmetrize_mode': 'union', 'use_snp_selection': False}. Best is trial 46 with value: 0.07994171952257709.
[I 2025-11-03 13:28:00,419] Trial 67 finished with value: 0.04313282953431449 and parameters: {'model_type': 'graphsage', 'hidden_dims': '[512, 256]', 'dropout': 0.1605713722810197, 'batch_norm': True, 'lr': 0.00041477150578840316, 'weight_decay': 2.578505866874685e-07, 'epochs': 262, 'loss': 'mae', 'optimizer': 'adam', 'graph_mode': 'knn', 'source': 'grm', 'knn_k': 8, 'weighted_edges': True, 'symmetrize_mode': 'union', 'use_snp_selection': False}. Best is trial 46 with value: 0.07994171952257709.
[I 2025-11-03 13:28:05,070] Trial 68 finished with value: 0.01186050483456656 and parameters: {'model_type': 'graphsage', 'hidden_dims': '[512, 64]', 'dropout': 0.23963071028574945, 'batch_norm': True, 'lr': 2.5111169401181315e-06, 'weight_decay': 1.5253237863518643e-07, 'epochs': 325, 'loss': 'mae', 'optimizer': 'adam', 'graph_mode': 'cutoff', 'cutoff': 0.7364324640933693, 'grm_norm': 'cosine_then_gcn', 'self_loops': True, 'use_snp_selection': False}. Best is trial 46 with value: 0.07994171952257709.
[I 2025-11-03 13:28:07,685] Trial 69 finished with value: 0.07919678394504918 and parameters: {'model_type': 'graphsage', 'hidden_dims': '[256, 128]', 'dropout': 0.42452352868715953, 'batch_norm': True, 'lr': 0.0006330519400072471, 'weight_decay': 5.888825379454312e-07, 'epochs': 218, 'loss': 'mse', 'optimizer': 'adam', 'graph_mode': 'knn', 'source': 'grm', 'knn_k': 3, 'weighted_edges': True, 'symmetrize_mode': 'union', 'use_snp_selection': False}. Best is trial 46 with value: 0.07994171952257709.
[I 2025-11-03 13:28:10,350] Trial 70 finished with value: 0.07026985420557079 and parameters: {'model_type': 'graphsage', 'hidden_dims': '[256, 128]', 'dropout': 0.364581976766129, 'batch_norm': True, 'lr': 0.0009844512807843785, 'weight_decay': 4.70481743509331e-07, 'epochs': 228, 'loss': 'mse', 'optimizer': 'adam', 'graph_mode': 'knn', 'source': 'grm', 'knn_k': 3, 'weighted_edges': False, 'symmetrize_mode': 'union', 'use_snp_selection': False}. Best is trial 46 with value: 0.07994171952257709.
[I 2025-11-03 13:28:13,039] Trial 71 finished with value: 0.060590773986154485 and parameters: {'model_type': 'graphsage', 'hidden_dims': '[256, 128]', 'dropout': 0.4296047512660528, 'batch_norm': True, 'lr': 0.0006458560655958005, 'weight_decay': 5.451192370271297e-07, 'epochs': 246, 'loss': 'mse', 'optimizer': 'adam', 'graph_mode': 'knn', 'source': 'grm', 'knn_k': 2, 'weighted_edges': True, 'symmetrize_mode': 'union', 'use_snp_selection': False}. Best is trial 46 with value: 0.07994171952257709.
[I 2025-11-03 13:28:15,692] Trial 72 finished with value: 0.07450815925322184 and parameters: {'model_type': 'graphsage', 'hidden_dims': '[256, 128]', 'dropout': 0.47139159315049756, 'batch_norm': True, 'lr': 0.0005416135975855453, 'weight_decay': 3.5181913279258286e-06, 'epochs': 213, 'loss': 'mse', 'optimizer': 'adam', 'graph_mode': 'knn', 'source': 'grm', 'knn_k': 4, 'weighted_edges': True, 'symmetrize_mode': 'union', 'use_snp_selection': False}. Best is trial 46 with value: 0.07994171952257709.
[I 2025-11-03 13:28:18,310] Trial 73 finished with value: 0.07395543293797051 and parameters: {'model_type': 'graphsage', 'hidden_dims': '[256, 128]', 'dropout': 0.48092574302207125, 'batch_norm': True, 'lr': 0.00047755896627336774, 'weight_decay': 3.683836933990141e-06, 'epochs': 207, 'loss': 'mse', 'optimizer': 'adam', 'graph_mode': 'knn', 'source': 'grm', 'knn_k': 4, 'weighted_edges': True, 'symmetrize_mode': 'union', 'use_snp_selection': False}. Best is trial 46 with value: 0.07994171952257709.
[I 2025-11-03 13:28:20,965] Trial 74 finished with value: 0.06963298742746721 and parameters: {'model_type': 'graphsage', 'hidden_dims': '[256, 128]', 'dropout': 0.5118559193411003, 'batch_norm': True, 'lr': 0.0005592819298767995, 'weight_decay': 6.349698139036408e-06, 'epochs': 214, 'loss': 'mse', 'optimizer': 'adam', 'graph_mode': 'knn', 'source': 'grm', 'knn_k': 4, 'weighted_edges': True, 'symmetrize_mode': 'union', 'use_snp_selection': False}. Best is trial 46 with value: 0.07994171952257709.
[I 2025-11-03 13:28:23,664] Trial 75 finished with value: 0.041231673279965256 and parameters: {'model_type': 'graphsage', 'hidden_dims': '[256, 128]', 'dropout': 0.535415859610672, 'batch_norm': True, 'lr': 4.747198321788119e-05, 'weight_decay': 3.5069572914527616e-07, 'epochs': 234, 'loss': 'mse', 'optimizer': 'adam', 'graph_mode': 'knn', 'source': 'grm', 'knn_k': 3, 'weighted_edges': True, 'symmetrize_mode': 'union', 'use_snp_selection': False}. Best is trial 46 with value: 0.07994171952257709.
[I 2025-11-03 13:28:26,046] Trial 76 finished with value: 0.05822033597528379 and parameters: {'model_type': 'graphsage', 'hidden_dims': '[256, 128]', 'dropout': 0.4557319214523229, 'batch_norm': True, 'lr': 0.00035957106274493077, 'weight_decay': 2.759154508196237e-06, 'epochs': 154, 'loss': 'mse', 'optimizer': 'adam', 'graph_mode': 'knn', 'source': 'grm', 'knn_k': 5, 'weighted_edges': True, 'symmetrize_mode': 'union', 'use_snp_selection': False}. Best is trial 46 with value: 0.07994171952257709.
[I 2025-11-03 13:28:27,841] Trial 77 finished with value: 0.028991211688729965 and parameters: {'model_type': 'graphsage', 'hidden_dims': '[256, 128]', 'dropout': 0.4754239170384369, 'batch_norm': False, 'lr': 0.0008216797738450545, 'weight_decay': 6.835303830312083e-07, 'epochs': 177, 'loss': 'mse', 'optimizer': 'adam', 'graph_mode': 'knn', 'source': 'grm', 'knn_k': 4, 'weighted_edges': True, 'symmetrize_mode': 'mutual', 'use_snp_selection': True, 'num_snps': 5844}. Best is trial 46 with value: 0.07994171952257709.
[I 2025-11-03 13:28:30,251] Trial 78 finished with value: 0.0600667552204279 and parameters: {'model_type': 'graphsage', 'hidden_dims': '[256, 128, 64]', 'dropout': 0.39883080031909646, 'batch_norm': True, 'lr': 0.0002521385503773821, 'weight_decay': 2.511585711685192e-07, 'epochs': 138, 'loss': 'mse', 'optimizer': 'adam', 'graph_mode': 'knn', 'source': 'grm', 'knn_k': 6, 'weighted_edges': True, 'symmetrize_mode': 'union', 'use_snp_selection': False}. Best is trial 46 with value: 0.07994171952257709.
[I 2025-11-03 13:28:34,523] Trial 79 finished with value: 0.05539846128887901 and parameters: {'model_type': 'graphsage', 'hidden_dims': '[512, 64]', 'dropout': 0.4581607024301937, 'batch_norm': True, 'lr': 7.899140011217064e-06, 'weight_decay': 1.940286438468649e-06, 'epochs': 257, 'loss': 'mse', 'optimizer': 'adam', 'graph_mode': 'cutoff', 'cutoff': 0.5421360706360554, 'grm_norm': 'gcn', 'self_loops': False, 'use_snp_selection': False}. Best is trial 46 with value: 0.07994171952257709.
[I 2025-11-03 13:28:36,540] Trial 80 finished with value: 0.0770526519439152 and parameters: {'model_type': 'graphsage', 'hidden_dims': '[128, 64]', 'dropout': 0.4996328628591077, 'batch_norm': True, 'lr': 0.0008481765008809332, 'weight_decay': 1.0085813854074488e-05, 'epochs': 215, 'loss': 'mse', 'optimizer': 'adam', 'graph_mode': 'knn', 'source': 'grm', 'knn_k': 3, 'weighted_edges': True, 'symmetrize_mode': 'union', 'use_snp_selection': False}. Best is trial 46 with value: 0.07994171952257709.
[I 2025-11-03 13:28:38,557] Trial 81 finished with value: 0.06077453176808984 and parameters: {'model_type': 'graphsage', 'hidden_dims': '[128, 64]', 'dropout': 0.4921295317647458, 'batch_norm': True, 'lr': 0.000853700157463517, 'weight_decay': 1.045556447418526e-05, 'epochs': 215, 'loss': 'mse', 'optimizer': 'adam', 'graph_mode': 'knn', 'source': 'grm', 'knn_k': 3, 'weighted_edges': True, 'symmetrize_mode': 'union', 'use_snp_selection': False}. Best is trial 46 with value: 0.07994171952257709.
[I 2025-11-03 13:28:40,474] Trial 82 finished with value: 0.07124441715092934 and parameters: {'model_type': 'graphsage', 'hidden_dims': '[128, 64]', 'dropout': 0.4989752340308595, 'batch_norm': True, 'lr': 0.0006934207140396237, 'weight_decay': 8.499270602574878e-06, 'epochs': 192, 'loss': 'mse', 'optimizer': 'adam', 'graph_mode': 'knn', 'source': 'grm', 'knn_k': 3, 'weighted_edges': True, 'symmetrize_mode': 'union', 'use_snp_selection': False}. Best is trial 46 with value: 0.07994171952257709.
[I 2025-11-03 13:28:42,554] Trial 83 finished with value: 0.06218122707498413 and parameters: {'model_type': 'graphsage', 'hidden_dims': '[128, 64]', 'dropout': 0.5436409001924977, 'batch_norm': True, 'lr': 0.0005324830461053194, 'weight_decay': 4.183459435418772e-06, 'epochs': 228, 'loss': 'mse', 'optimizer': 'adam', 'graph_mode': 'knn', 'source': 'grm', 'knn_k': 4, 'weighted_edges': True, 'symmetrize_mode': 'union', 'use_snp_selection': False}. Best is trial 46 with value: 0.07994171952257709.
[I 2025-11-03 13:28:44,598] Trial 84 finished with value: 0.06156353921073032 and parameters: {'model_type': 'graphsage', 'hidden_dims': '[128, 64]', 'dropout': 0.557423764647786, 'batch_norm': True, 'lr': 0.0004236190923401547, 'weight_decay': 3.2072518457144675e-06, 'epochs': 208, 'loss': 'mse', 'optimizer': 'adam', 'graph_mode': 'knn', 'source': 'grm', 'knn_k': 5, 'weighted_edges': True, 'symmetrize_mode': 'union', 'use_snp_selection': False}. Best is trial 46 with value: 0.07994171952257709.
[I 2025-11-03 13:28:47,226] Trial 85 finished with value: 0.06867061537366877 and parameters: {'model_type': 'graphsage', 'hidden_dims': '[256, 128]', 'dropout': 0.5316717167767538, 'batch_norm': True, 'lr': 0.0008636041184670569, 'weight_decay': 1.6558489349827955e-05, 'epochs': 220, 'loss': 'mse', 'optimizer': 'adam', 'graph_mode': 'knn', 'source': 'grm', 'knn_k': 3, 'weighted_edges': True, 'symmetrize_mode': 'union', 'use_snp_selection': False}. Best is trial 46 with value: 0.07994171952257709.
[I 2025-11-03 13:28:51,384] Trial 86 finished with value: 0.07142510012139959 and parameters: {'model_type': 'graphsage', 'hidden_dims': '[512, 128]', 'dropout': 0.4500702318434338, 'batch_norm': True, 'lr': 0.0006940466925735273, 'weight_decay': 1.3413210119286662e-07, 'epochs': 242, 'loss': 'mse', 'optimizer': 'adam', 'graph_mode': 'knn', 'source': 'grm', 'knn_k': 2, 'weighted_edges': True, 'symmetrize_mode': 'union', 'use_snp_selection': False}. Best is trial 46 with value: 0.07994171952257709.
[I 2025-11-03 13:28:55,257] Trial 87 finished with value: 0.06458188037340873 and parameters: {'model_type': 'graphsage', 'hidden_dims': '[512, 64]', 'dropout': 0.1209683975284389, 'batch_norm': True, 'lr': 0.0005615689236681399, 'weight_decay': 9.785077727022838e-07, 'epochs': 200, 'loss': 'mse', 'optimizer': 'adam', 'graph_mode': 'knn', 'source': 'grm', 'knn_k': 3, 'weighted_edges': True, 'symmetrize_mode': 'union', 'use_snp_selection': False}. Best is trial 46 with value: 0.07994171952257709.
[I 2025-11-03 13:28:58,222] Trial 88 finished with value: 0.06509485205415855 and parameters: {'model_type': 'graphsage', 'hidden_dims': '[256, 128]', 'dropout': 0.5201576218687731, 'batch_norm': True, 'lr': 0.0009882317809607147, 'weight_decay': 6.454610382649444e-06, 'epochs': 272, 'loss': 'mae', 'optimizer': 'adam', 'graph_mode': 'knn', 'source': 'grm', 'knn_k': 4, 'weighted_edges': False, 'symmetrize_mode': 'union', 'use_snp_selection': False}. Best is trial 46 with value: 0.07994171952257709.
[I 2025-11-03 13:29:01,871] Trial 89 finished with value: 0.04940898880966133 and parameters: {'model_type': 'graphsage', 'hidden_dims': '[128, 64]', 'dropout': 0.19190167209584674, 'batch_norm': False, 'lr': 0.00017115457407937212, 'weight_decay': 2.5368558329970516e-05, 'epochs': 287, 'loss': 'mae', 'optimizer': 'adam', 'graph_mode': 'knn', 'source': 'grm', 'knn_k': 2, 'weighted_edges': True, 'symmetrize_mode': 'union', 'use_snp_selection': True, 'num_snps': 49875}. Best is trial 46 with value: 0.07994171952257709.
[I 2025-11-03 13:29:04,919] Trial 90 finished with value: 0.04577460690224385 and parameters: {'model_type': 'graphsage', 'hidden_dims': '[256, 128]', 'dropout': 0.4306340475322671, 'batch_norm': True, 'lr': 0.00013116357623669977, 'weight_decay': 1.8029298336390659e-07, 'epochs': 255, 'loss': 'mse', 'optimizer': 'adam', 'graph_mode': 'knn', 'source': 'grm', 'knn_k': 10, 'weighted_edges': True, 'symmetrize_mode': 'mutual', 'use_snp_selection': False}. Best is trial 46 with value: 0.07994171952257709.
[I 2025-11-03 13:29:07,366] Trial 91 finished with value: 0.05745194089256356 and parameters: {'model_type': 'graphsage', 'hidden_dims': '[256, 128]', 'dropout': 0.4721773029778935, 'batch_norm': True, 'lr': 0.0004914450343127246, 'weight_decay': 4.029039968782244e-06, 'epochs': 167, 'loss': 'mse', 'optimizer': 'adam', 'graph_mode': 'knn', 'source': 'grm', 'knn_k': 4, 'weighted_edges': True, 'symmetrize_mode': 'union', 'use_snp_selection': False}. Best is trial 46 with value: 0.07994171952257709.
[I 2025-11-03 13:29:10,096] Trial 92 finished with value: 0.07184117868992561 and parameters: {'model_type': 'graphsage', 'hidden_dims': '[256, 128]', 'dropout': 0.48745083878520734, 'batch_norm': True, 'lr': 0.0003343126894705377, 'weight_decay': 1.2380338983937601e-05, 'epochs': 209, 'loss': 'mse', 'optimizer': 'adam', 'graph_mode': 'knn', 'source': 'grm', 'knn_k': 5, 'weighted_edges': True, 'symmetrize_mode': 'union', 'use_snp_selection': False}. Best is trial 46 with value: 0.07994171952257709.
[I 2025-11-03 13:29:12,703] Trial 93 finished with value: 0.04346527432464484 and parameters: {'model_type': 'graphsage', 'hidden_dims': '[256, 128]', 'dropout': 0.47905058714843596, 'batch_norm': True, 'lr': 0.0006894529174119818, 'weight_decay': 8.054587309790034e-06, 'epochs': 197, 'loss': 'mse', 'optimizer': 'adam', 'graph_mode': 'knn', 'source': 'grm', 'knn_k': 4, 'weighted_edges': True, 'symmetrize_mode': 'union', 'use_snp_selection': False}. Best is trial 46 with value: 0.07994171952257709.
[I 2025-11-03 13:29:15,447] Trial 94 finished with value: 0.06730073693013486 and parameters: {'model_type': 'graphsage', 'hidden_dims': '[256, 128]', 'dropout': 0.43835818053589004, 'batch_norm': True, 'lr': 0.00043780559385571584, 'weight_decay': 4.941856152338348e-06, 'epochs': 235, 'loss': 'mse', 'optimizer': 'adam', 'graph_mode': 'knn', 'source': 'grm', 'knn_k': 3, 'weighted_edges': True, 'symmetrize_mode': 'union', 'use_snp_selection': False}. Best is trial 46 with value: 0.07994171952257709.
[I 2025-11-03 13:29:20,715] Trial 95 finished with value: 0.05904129771595718 and parameters: {'model_type': 'graphsage', 'hidden_dims': '[512, 64]', 'dropout': 0.41576373168357744, 'batch_norm': True, 'lr': 0.0008394437747982064, 'weight_decay': 3.5123694354411354e-06, 'epochs': 340, 'loss': 'mse', 'optimizer': 'adam', 'graph_mode': 'knn', 'source': 'grm', 'knn_k': 5, 'weighted_edges': True, 'symmetrize_mode': 'union', 'use_snp_selection': False}. Best is trial 46 with value: 0.07994171952257709.
[I 2025-11-03 13:29:23,160] Trial 96 finished with value: 0.0638022844916693 and parameters: {'model_type': 'graphsage', 'hidden_dims': '[256, 128]', 'dropout': 0.498688617380275, 'batch_norm': True, 'lr': 0.0005891861161330208, 'weight_decay': 5.571472588099665e-06, 'epochs': 187, 'loss': 'mae', 'optimizer': 'adam', 'graph_mode': 'knn', 'source': 'grm', 'knn_k': 2, 'weighted_edges': True, 'symmetrize_mode': 'union', 'use_snp_selection': False}. Best is trial 46 with value: 0.07994171952257709.
[I 2025-11-03 13:29:27,401] Trial 97 finished with value: 0.06149158333988769 and parameters: {'model_type': 'graphsage', 'hidden_dims': '[512, 256]', 'dropout': 0.3120747723105649, 'batch_norm': True, 'lr': 0.000754238051624034, 'weight_decay': 1.3800433799940057e-06, 'epochs': 266, 'loss': 'mae', 'optimizer': 'adam', 'graph_mode': 'cutoff', 'cutoff': 0.7864264008407802, 'grm_norm': 'cosine_then_gcn', 'self_loops': True, 'use_snp_selection': False}. Best is trial 46 with value: 0.07994171952257709.
[I 2025-11-03 13:29:30,040] Trial 98 finished with value: 0.07498392420954736 and parameters: {'model_type': 'graphsage', 'hidden_dims': '[256, 128, 64]', 'dropout': 0.1724355516351086, 'batch_norm': True, 'lr': 0.00029171387755792035, 'weight_decay': 2.7483009082156312e-06, 'epochs': 177, 'loss': 'mse', 'optimizer': 'adam', 'graph_mode': 'knn', 'source': 'grm', 'knn_k': 6, 'weighted_edges': True, 'symmetrize_mode': 'union', 'use_snp_selection': False}. Best is trial 46 with value: 0.07994171952257709.
[I 2025-11-03 13:29:32,074] Trial 99 finished with value: 0.07290440754966053 and parameters: {'model_type': 'graphsage', 'hidden_dims': '[256, 128, 64]', 'dropout': 0.15173665253950458, 'batch_norm': True, 'lr': 0.00029418288840298956, 'weight_decay': 2.683836064286856e-06, 'epochs': 76, 'loss': 'mae', 'optimizer': 'adam', 'graph_mode': 'knn', 'source': 'grm', 'knn_k': 6, 'weighted_edges': True, 'symmetrize_mode': 'union', 'use_snp_selection': False}. Best is trial 46 with value: 0.07994171952257709.
[I 2025-11-03 13:29:34,685] Trial 100 finished with value: 0.05852925369476293 and parameters: {'model_type': 'graphsage', 'hidden_dims': '[256, 128, 64]', 'dropout': 0.12533760300613042, 'batch_norm': True, 'lr': 0.0003756604633341253, 'weight_decay': 4.459286299554169e-07, 'epochs': 172, 'loss': 'mae', 'optimizer': 'adam', 'graph_mode': 'knn', 'source': 'grm', 'knn_k': 6, 'weighted_edges': True, 'symmetrize_mode': 'union', 'use_snp_selection': False}. Best is trial 46 with value: 0.07994171952257709.
[I 2025-11-03 13:29:37,098] Trial 101 finished with value: 0.04840691240107706 and parameters: {'model_type': 'graphsage', 'hidden_dims': '[256, 128, 64]', 'dropout': 0.46460451631290395, 'batch_norm': True, 'lr': 0.0004916112515865928, 'weight_decay': 2.3425516627196583e-06, 'epochs': 143, 'loss': 'mse', 'optimizer': 'adam', 'graph_mode': 'knn', 'source': 'grm', 'knn_k': 4, 'weighted_edges': True, 'symmetrize_mode': 'union', 'use_snp_selection': False}. Best is trial 46 with value: 0.07994171952257709.
[I 2025-11-03 13:29:40,013] Trial 102 finished with value: 0.06242132474191009 and parameters: {'model_type': 'graphsage', 'hidden_dims': '[256, 128, 64]', 'dropout': 0.4806607431627383, 'batch_norm': True, 'lr': 0.0006262077307112561, 'weight_decay': 1.817250399892816e-06, 'epochs': 276, 'loss': 'mse', 'optimizer': 'adam', 'graph_mode': 'knn', 'source': 'grm', 'knn_k': 1, 'weighted_edges': True, 'symmetrize_mode': 'union', 'use_snp_selection': False}. Best is trial 46 with value: 0.07994171952257709.
[I 2025-11-03 13:29:44,336] Trial 103 finished with value: 0.055448042138321746 and parameters: {'model_type': 'graphsage', 'hidden_dims': '[512, 64]', 'dropout': 0.17467911789975243, 'batch_norm': True, 'lr': 0.0009077583016365609, 'weight_decay': 6.754678875766504e-07, 'epochs': 223, 'loss': 'mse', 'optimizer': 'adam', 'graph_mode': 'knn', 'source': 'grm', 'knn_k': 6, 'weighted_edges': True, 'symmetrize_mode': 'union', 'use_snp_selection': False}. Best is trial 46 with value: 0.07994171952257709.
[I 2025-11-03 13:29:46,807] Trial 104 finished with value: 0.0660804932802663 and parameters: {'model_type': 'graphsage', 'hidden_dims': '[256, 128]', 'dropout': 0.3405677625716454, 'batch_norm': True, 'lr': 0.0007276416645590817, 'weight_decay': 3.2752148293783606e-06, 'epochs': 181, 'loss': 'mse', 'optimizer': 'adam', 'graph_mode': 'knn', 'source': 'grm', 'knn_k': 3, 'weighted_edges': True, 'symmetrize_mode': 'union', 'use_snp_selection': False}. Best is trial 46 with value: 0.07994171952257709.
