[I 2025-11-03 14:03:16,811] Trial 48 finished with value: 0.028789354243633283 and parameters: {'model_type': 'gcn', 'hidden_dims': '[256, 128, 64]', 'dropout': 0.38792101186216305, 'batch_norm': True, 'lr': 3.715686863154444e-05, 'weight_decay': 4.814443869184204e-07, 'epochs': 164, 'loss': 'mse', 'optimizer': 'adam', 'graph_mode': 'off', 'use_snp_selection': False}. Best is trial 43 with value: 0.11949461926480603.
[I 2025-11-03 14:03:17,941] Trial 49 finished with value: 0.10539582669197758 and parameters: {'model_type': 'gcn', 'hidden_dims': '[256, 128]', 'dropout': 0.2312932742226842, 'batch_norm': True, 'lr': 0.0002406162703030636, 'weight_decay': 1.540189359830602e-05, 'epochs': 138, 'loss': 'mse', 'optimizer': 'adam', 'graph_mode': 'off', 'use_snp_selection': False}. Best is trial 43 with value: 0.11949461926480603.
[I 2025-11-03 14:03:19,367] Trial 50 finished with value: 0.11942742415612415 and parameters: {'model_type': 'gcn', 'hidden_dims': '[256, 128, 64]', 'dropout': 0.12187395872215422, 'batch_norm': True, 'lr': 0.0007788045043399871, 'weight_decay': 6.219921430751427e-06, 'epochs': 205, 'loss': 'mse', 'optimizer': 'adam', 'graph_mode': 'off', 'use_snp_selection': False}. Best is trial 43 with value: 0.11949461926480603.
[I 2025-11-03 14:03:20,777] Trial 51 finished with value: 0.10437266271602003 and parameters: {'model_type': 'gcn', 'hidden_dims': '[256, 128, 64]', 'dropout': 0.14249891655179323, 'batch_norm': True, 'lr': 0.0008171198326219851, 'weight_decay': 5.641998705521989e-06, 'epochs': 207, 'loss': 'mse', 'optimizer': 'adam', 'graph_mode': 'off', 'use_snp_selection': False}. Best is trial 43 with value: 0.11949461926480603.
[I 2025-11-03 14:03:22,371] Trial 52 finished with value: 0.11152419284351807 and parameters: {'model_type': 'gcn', 'hidden_dims': '[256, 128, 64]', 'dropout': 0.11754530645291203, 'batch_norm': True, 'lr': 0.0005094089840725843, 'weight_decay': 1.854404167459295e-07, 'epochs': 238, 'loss': 'mse', 'optimizer': 'adam', 'graph_mode': 'off', 'use_snp_selection': False}. Best is trial 43 with value: 0.11949461926480603.
[I 2025-11-03 14:03:23,834] Trial 53 finished with value: 0.07877439899357143 and parameters: {'model_type': 'gcn', 'hidden_dims': '[256, 128, 64]', 'dropout': 0.5902537114089705, 'batch_norm': True, 'lr': 0.0003651629319880353, 'weight_decay': 1.3306179919863738e-05, 'epochs': 217, 'loss': 'mse', 'optimizer': 'adam', 'graph_mode': 'off', 'use_snp_selection': False}. Best is trial 43 with value: 0.11949461926480603.
[I 2025-11-03 14:03:25,585] Trial 54 finished with value: 0.102197260570899 and parameters: {'model_type': 'gcn', 'hidden_dims': '[256, 128, 64]', 'dropout': 0.15933158875549674, 'batch_norm': True, 'lr': 0.0007699571092109487, 'weight_decay': 2.9459825324144778e-06, 'epochs': 274, 'loss': 'mae', 'optimizer': 'adam', 'graph_mode': 'off', 'use_snp_selection': False}. Best is trial 43 with value: 0.11949461926480603.
[I 2025-11-03 14:03:26,775] Trial 55 finished with value: 0.11202214491039175 and parameters: {'model_type': 'gcn', 'hidden_dims': '[128, 64]', 'dropout': 0.10140115074228143, 'batch_norm': True, 'lr': 0.0005687079807024683, 'weight_decay': 9.974376096002142e-07, 'epochs': 258, 'loss': 'mse', 'optimizer': 'adam', 'graph_mode': 'off', 'use_snp_selection': False}. Best is trial 43 with value: 0.11949461926480603.
[I 2025-11-03 14:03:28,321] Trial 56 finished with value: 0.09228709189012797 and parameters: {'model_type': 'gcn', 'hidden_dims': '[512, 128]', 'dropout': 0.1868242039969414, 'batch_norm': True, 'lr': 0.0001902540596904379, 'weight_decay': 4.6021026451683345e-05, 'epochs': 191, 'loss': 'mse', 'optimizer': 'adam', 'graph_mode': 'off', 'use_snp_selection': False}. Best is trial 43 with value: 0.11949461926480603.
[I 2025-11-03 14:03:29,777] Trial 57 finished with value: 0.11077096769971528 and parameters: {'model_type': 'gcn', 'hidden_dims': '[512, 64]', 'dropout': 0.296282316252098, 'batch_norm': True, 'lr': 0.000989262527402168, 'weight_decay': 2.6197629846148934e-05, 'epochs': 169, 'loss': 'mae', 'optimizer': 'adam', 'graph_mode': 'off', 'use_snp_selection': False}. Best is trial 43 with value: 0.11949461926480603.
[I 2025-11-03 14:03:31,844] Trial 58 finished with value: 0.06839850608237273 and parameters: {'model_type': 'gcn', 'hidden_dims': '[256, 128, 64]', 'dropout': 0.33699227474830784, 'batch_norm': False, 'lr': 0.00041980772117803614, 'weight_decay': 6.822958374799277e-06, 'epochs': 205, 'loss': 'mse', 'optimizer': 'adam', 'graph_mode': 'off', 'use_snp_selection': True, 'num_snps': 51942}. Best is trial 43 with value: 0.11949461926480603.
[I 2025-11-03 14:03:33,362] Trial 59 finished with value: 0.10758368601279236 and parameters: {'model_type': 'gcn', 'hidden_dims': '[256, 128, 64]', 'dropout': 0.13375536883800904, 'batch_norm': True, 'lr': 0.0007370054935123821, 'weight_decay': 2.1607943763222728e-05, 'epochs': 225, 'loss': 'mse', 'optimizer': 'adam', 'graph_mode': 'off', 'use_snp_selection': False}. Best is trial 43 with value: 0.11949461926480603.
[I 2025-11-03 14:03:35,129] Trial 60 finished with value: 0.0412981422570259 and parameters: {'model_type': 'gcn', 'hidden_dims': '[512, 128]', 'dropout': 0.3589792604949422, 'batch_norm': True, 'lr': 7.331221727292531e-06, 'weight_decay': 1.1177275374219438e-05, 'epochs': 236, 'loss': 'mse', 'optimizer': 'adam', 'graph_mode': 'off', 'use_snp_selection': False}. Best is trial 43 with value: 0.11949461926480603.
[I 2025-11-03 14:03:36,607] Trial 61 finished with value: 0.08982212211482556 and parameters: {'model_type': 'gcn', 'hidden_dims': '[256, 128, 64]', 'dropout': 0.269192145906089, 'batch_norm': True, 'lr': 0.0007592728054366066, 'weight_decay': 4.274585004501639e-06, 'epochs': 217, 'loss': 'mse', 'optimizer': 'adam', 'graph_mode': 'off', 'use_snp_selection': False}. Best is trial 43 with value: 0.11949461926480603.
[I 2025-11-03 14:03:38,098] Trial 62 finished with value: 0.1075313893068191 and parameters: {'model_type': 'gcn', 'hidden_dims': '[256, 128, 64]', 'dropout': 0.24317944928064875, 'batch_norm': True, 'lr': 0.000623882720094293, 'weight_decay': 1.187256150023364e-05, 'epochs': 222, 'loss': 'mse', 'optimizer': 'adam', 'graph_mode': 'off', 'use_snp_selection': False}. Best is trial 43 with value: 0.11949461926480603.
[I 2025-11-03 14:03:39,707] Trial 63 finished with value: 0.0944336522583297 and parameters: {'model_type': 'gcn', 'hidden_dims': '[256, 128, 64]', 'dropout': 0.22103100409916226, 'batch_norm': True, 'lr': 0.0003122109494826367, 'weight_decay': 9.344809577891852e-06, 'epochs': 249, 'loss': 'mse', 'optimizer': 'adam', 'graph_mode': 'off', 'use_snp_selection': False}. Best is trial 43 with value: 0.11949461926480603.
[I 2025-11-03 14:03:41,374] Trial 64 finished with value: 0.11277833993861515 and parameters: {'model_type': 'gcn', 'hidden_dims': '[512, 256]', 'dropout': 0.2713124853285186, 'batch_norm': True, 'lr': 0.000981790751228039, 'weight_decay': 1.948468064170352e-05, 'epochs': 198, 'loss': 'mse', 'optimizer': 'adam', 'graph_mode': 'off', 'use_snp_selection': False}. Best is trial 43 with value: 0.11949461926480603.
[I 2025-11-03 14:03:43,009] Trial 65 finished with value: 0.11579597924402862 and parameters: {'model_type': 'gcn', 'hidden_dims': '[512, 256]', 'dropout': 0.3144437827046223, 'batch_norm': True, 'lr': 0.0009497719462226329, 'weight_decay': 3.6585233349978334e-05, 'epochs': 198, 'loss': 'mse', 'optimizer': 'adam', 'graph_mode': 'off', 'use_snp_selection': False}. Best is trial 43 with value: 0.11949461926480603.
[I 2025-11-03 14:03:44,559] Trial 66 finished with value: 0.1128300661222777 and parameters: {'model_type': 'gcn', 'hidden_dims': '[512, 256]', 'dropout': 0.3197787679255415, 'batch_norm': True, 'lr': 0.00044029794582985744, 'weight_decay': 3.781892182217095e-05, 'epochs': 177, 'loss': 'mae', 'optimizer': 'adam', 'graph_mode': 'off', 'use_snp_selection': False}. Best is trial 43 with value: 0.11949461926480603.
[I 2025-11-03 14:03:46,549] Trial 67 finished with value: 0.10284868184215093 and parameters: {'model_type': 'gcn', 'hidden_dims': '[512, 256]', 'dropout': 0.2988786179455572, 'batch_norm': True, 'lr': 0.00020365353982156306, 'weight_decay': 5.738411098806715e-05, 'epochs': 283, 'loss': 'mse', 'optimizer': 'adam', 'graph_mode': 'off', 'use_snp_selection': False}. Best is trial 43 with value: 0.11949461926480603.
[I 2025-11-03 14:03:48,472] Trial 68 finished with value: 0.11338134017458078 and parameters: {'model_type': 'gcn', 'hidden_dims': '[512, 256]', 'dropout': 0.1198285769537341, 'batch_norm': True, 'lr': 0.0005203341933302543, 'weight_decay': 2.636627246564757e-07, 'epochs': 267, 'loss': 'mse', 'optimizer': 'adam', 'graph_mode': 'off', 'use_snp_selection': False}. Best is trial 43 with value: 0.11949461926480603.
[I 2025-11-03 14:03:49,354] Trial 69 finished with value: 0.047711475339629175 and parameters: {'model_type': 'gcn', 'hidden_dims': '[512, 128]', 'dropout': 0.19986274599446602, 'batch_norm': False, 'lr': 0.0008120697196695884, 'weight_decay': 7.655900592332221e-05, 'epochs': 209, 'loss': 'mse', 'optimizer': 'adam', 'graph_mode': 'off', 'use_snp_selection': True, 'num_snps': 3748}. Best is trial 43 with value: 0.11949461926480603.
[I 2025-11-03 14:03:50,509] Trial 70 finished with value: 0.10701039442487205 and parameters: {'model_type': 'gcn', 'hidden_dims': '[512, 256]', 'dropout': 0.28900410156092776, 'batch_norm': True, 'lr': 0.0006204956653765986, 'weight_decay': 2.2039020653007077e-06, 'epochs': 90, 'loss': 'mse', 'optimizer': 'adam', 'graph_mode': 'off', 'use_snp_selection': False}. Best is trial 43 with value: 0.11949461926480603.
[I 2025-11-03 14:03:52,374] Trial 71 finished with value: 0.10929028679907872 and parameters: {'model_type': 'gcn', 'hidden_dims': '[512, 256]', 'dropout': 0.12102662551322936, 'batch_norm': True, 'lr': 0.0004940395847596393, 'weight_decay': 6.009654295713684e-07, 'epochs': 266, 'loss': 'mse', 'optimizer': 'adam', 'graph_mode': 'off', 'use_snp_selection': False}. Best is trial 43 with value: 0.11949461926480603.
[I 2025-11-03 14:03:54,414] Trial 72 finished with value: 0.10837835777098768 and parameters: {'model_type': 'gcn', 'hidden_dims': '[512, 256]', 'dropout': 0.1754192871969942, 'batch_norm': True, 'lr': 0.00033602879736660253, 'weight_decay': 1.2949862235770954e-06, 'epochs': 299, 'loss': 'mse', 'optimizer': 'adam', 'graph_mode': 'off', 'use_snp_selection': False}. Best is trial 43 with value: 0.11949461926480603.
[I 2025-11-03 14:03:56,252] Trial 73 finished with value: 0.11107840178899382 and parameters: {'model_type': 'gcn', 'hidden_dims': '[512, 256]', 'dropout': 0.14910000377836752, 'batch_norm': True, 'lr': 0.0005464023010760416, 'weight_decay': 2.466077848435382e-07, 'epochs': 249, 'loss': 'mse', 'optimizer': 'adam', 'graph_mode': 'off', 'use_snp_selection': False}. Best is trial 43 with value: 0.11949461926480603.
[I 2025-11-03 14:03:57,985] Trial 74 finished with value: 0.11338696761639865 and parameters: {'model_type': 'gcn', 'hidden_dims': '[512, 256]', 'dropout': 0.10783690969230449, 'batch_norm': True, 'lr': 0.0008477882555921998, 'weight_decay': 3.0767444386312144e-05, 'epochs': 231, 'loss': 'mse', 'optimizer': 'adam', 'graph_mode': 'off', 'use_snp_selection': False}. Best is trial 43 with value: 0.11949461926480603.
[I 2025-11-03 14:03:59,296] Trial 75 finished with value: 0.12047886213017892 and parameters: {'model_type': 'gcn', 'hidden_dims': '[256, 128]', 'dropout': 0.11126140523765034, 'batch_norm': True, 'lr': 0.0008494612046794571, 'weight_decay': 2.6526176082048624e-05, 'epochs': 229, 'loss': 'mse', 'optimizer': 'adam', 'graph_mode': 'off', 'use_snp_selection': False}. Best is trial 75 with value: 0.12047886213017892.
[I 2025-11-03 14:04:00,509] Trial 76 finished with value: 0.0970834766008039 and parameters: {'model_type': 'gcn', 'hidden_dims': '[256, 128]', 'dropout': 0.37096533986320385, 'batch_norm': True, 'lr': 0.0006485909251210862, 'weight_decay': 2.2290473936799607e-05, 'epochs': 192, 'loss': 'mse', 'optimizer': 'adam', 'graph_mode': 'off', 'use_snp_selection': False}. Best is trial 75 with value: 0.12047886213017892.
[I 2025-11-03 14:04:01,567] Trial 77 finished with value: 0.090952403967904 and parameters: {'model_type': 'gcn', 'hidden_dims': '[256, 128]', 'dropout': 0.15895897831734027, 'batch_norm': True, 'lr': 0.0003930446565449322, 'weight_decay': 4.211205625013453e-05, 'epochs': 40, 'loss': 'mse', 'optimizer': 'adam', 'graph_mode': 'off', 'use_snp_selection': True, 'num_snps': 28730}. Best is trial 75 with value: 0.12047886213017892.
[I 2025-11-03 14:04:02,795] Trial 78 finished with value: 0.1035793401994712 and parameters: {'model_type': 'gcn', 'hidden_dims': '[256, 128]', 'dropout': 0.2511144021479682, 'batch_norm': True, 'lr': 0.0008322339063273341, 'weight_decay': 6.1082887111467695e-06, 'epochs': 202, 'loss': 'mae', 'optimizer': 'adam', 'graph_mode': 'off', 'use_snp_selection': False}. Best is trial 75 with value: 0.12047886213017892.
[I 2025-11-03 14:04:04,133] Trial 79 finished with value: 0.10507081743009075 and parameters: {'model_type': 'gcn', 'hidden_dims': '[256, 128]', 'dropout': 0.13797094196356935, 'batch_norm': True, 'lr': 0.0009997775821807364, 'weight_decay': 3.2326345913893624e-06, 'epochs': 242, 'loss': 'mse', 'optimizer': 'adam', 'graph_mode': 'off', 'use_snp_selection': False}. Best is trial 75 with value: 0.12047886213017892.
[I 2025-11-03 14:04:05,714] Trial 80 finished with value: 0.048204694666673834 and parameters: {'model_type': 'gcn', 'hidden_dims': '[128, 64]', 'dropout': 0.32908744101817927, 'batch_norm': False, 'lr': 0.0007289622546671999, 'weight_decay': 1.6228447511641487e-05, 'epochs': 216, 'loss': 'mse', 'optimizer': 'adam', 'graph_mode': 'off', 'use_snp_selection': True, 'num_snps': 39935}. Best is trial 75 with value: 0.12047886213017892.
[I 2025-11-03 14:04:07,452] Trial 81 finished with value: 0.11379303387997883 and parameters: {'model_type': 'gcn', 'hidden_dims': '[512, 128]', 'dropout': 0.10957924494384988, 'batch_norm': True, 'lr': 0.000796187700897745, 'weight_decay': 2.9171255017450054e-05, 'epochs': 232, 'loss': 'mse', 'optimizer': 'adam', 'graph_mode': 'off', 'use_snp_selection': False}. Best is trial 75 with value: 0.12047886213017892.
[I 2025-11-03 14:04:09,210] Trial 82 finished with value: 0.11173421366449365 and parameters: {'model_type': 'gcn', 'hidden_dims': '[512, 128]', 'dropout': 0.11242901272188877, 'batch_norm': True, 'lr': 0.0006439898774815969, 'weight_decay': 3.344389081190614e-05, 'epochs': 227, 'loss': 'mse', 'optimizer': 'adam', 'graph_mode': 'off', 'use_snp_selection': False}. Best is trial 75 with value: 0.12047886213017892.
[I 2025-11-03 14:04:10,965] Trial 83 finished with value: 0.11915198400103501 and parameters: {'model_type': 'gcn', 'hidden_dims': '[512, 128]', 'dropout': 0.13042270705526599, 'batch_norm': True, 'lr': 0.0004283898627602791, 'weight_decay': 6.545220850248765e-05, 'epochs': 235, 'loss': 'mse', 'optimizer': 'adam', 'graph_mode': 'off', 'use_snp_selection': False}. Best is trial 75 with value: 0.12047886213017892.
[I 2025-11-03 14:04:12,784] Trial 84 finished with value: 0.10514422346163163 and parameters: {'model_type': 'gcn', 'hidden_dims': '[512, 128]', 'dropout': 0.4106038279749708, 'batch_norm': True, 'lr': 0.0002881006730512588, 'weight_decay': 6.150364876585817e-05, 'epochs': 255, 'loss': 'mse', 'optimizer': 'adam', 'graph_mode': 'off', 'use_snp_selection': False}. Best is trial 75 with value: 0.12047886213017892.
[I 2025-11-03 14:04:14,526] Trial 85 finished with value: 0.11873821122425585 and parameters: {'model_type': 'gcn', 'hidden_dims': '[512, 128]', 'dropout': 0.12577685272042968, 'batch_norm': True, 'lr': 0.00043721569102964146, 'weight_decay': 1.3562015899175793e-05, 'epochs': 235, 'loss': 'mse', 'optimizer': 'adam', 'graph_mode': 'off', 'use_snp_selection': False}. Best is trial 75 with value: 0.12047886213017892.
[I 2025-11-03 14:04:16,301] Trial 86 finished with value: 0.11901198159808396 and parameters: {'model_type': 'gcn', 'hidden_dims': '[512, 128]', 'dropout': 0.16710651156466597, 'batch_norm': True, 'lr': 0.00011852620128563793, 'weight_decay': 9.201106489839262e-05, 'epochs': 242, 'loss': 'mse', 'optimizer': 'adam', 'graph_mode': 'off', 'use_snp_selection': False}. Best is trial 75 with value: 0.12047886213017892.
[I 2025-11-03 14:04:18,112] Trial 87 finished with value: 0.0970603070748635 and parameters: {'model_type': 'gcn', 'hidden_dims': '[512, 128]', 'dropout': 0.15247412363653767, 'batch_norm': True, 'lr': 0.0001563373245674391, 'weight_decay': 9.057607477925639e-05, 'epochs': 243, 'loss': 'mse', 'optimizer': 'adam', 'graph_mode': 'off', 'use_snp_selection': False}. Best is trial 75 with value: 0.12047886213017892.
[I 2025-11-03 14:04:19,789] Trial 88 finished with value: 0.09505006649021491 and parameters: {'model_type': 'gcn', 'hidden_dims': '[512, 128]', 'dropout': 0.16858610482468275, 'batch_norm': True, 'lr': 0.00010921503147417363, 'weight_decay': 4.934730947374543e-06, 'epochs': 212, 'loss': 'mse', 'optimizer': 'adam', 'graph_mode': 'off', 'use_snp_selection': False}. Best is trial 75 with value: 0.12047886213017892.
