[I 2025-11-03 12:41:05,693] Trial 61 finished with value: 0.04443773025180262 and parameters: {'model_type': 'gcn', 'hidden_dims': '[512, 128]', 'dropout': 0.2352131211396297, 'batch_norm': False, 'lr': 0.0001832412966498606, 'weight_decay': 7.175541905492433e-07, 'epochs': 256, 'loss': 'mse', 'optimizer': 'adam', 'graph_mode': 'off', 'use_snp_selection': False}. Best is trial 59 with value: 0.08758940275051783.
[I 2025-11-03 12:41:08,625] Trial 62 finished with value: 0.09255496150865616 and parameters: {'model_type': 'gcn', 'hidden_dims': '[512, 128]', 'dropout': 0.21177780533198004, 'batch_norm': False, 'lr': 0.00010313371037763034, 'weight_decay': 3.9804816854358585e-07, 'epochs': 273, 'loss': 'mse', 'optimizer': 'adam', 'graph_mode': 'off', 'use_snp_selection': False}. Best is trial 62 with value: 0.09255496150865616.
[I 2025-11-03 12:41:11,887] Trial 63 finished with value: 0.06764157258160824 and parameters: {'model_type': 'gcn', 'hidden_dims': '[512, 128]', 'dropout': 0.2192790352131428, 'batch_norm': False, 'lr': 0.00014072527970965953, 'weight_decay': 4.883181978364599e-07, 'epochs': 307, 'loss': 'mse', 'optimizer': 'adam', 'graph_mode': 'off', 'use_snp_selection': False}. Best is trial 62 with value: 0.09255496150865616.
[I 2025-11-03 12:41:14,896] Trial 64 finished with value: 0.09378759425930866 and parameters: {'model_type': 'gcn', 'hidden_dims': '[512, 128]', 'dropout': 0.2035776640240814, 'batch_norm': False, 'lr': 0.00010041414504106135, 'weight_decay': 2.3146167229496891e-07, 'epochs': 275, 'loss': 'mse', 'optimizer': 'adam', 'graph_mode': 'off', 'use_snp_selection': False}. Best is trial 64 with value: 0.09378759425930866.
[I 2025-11-03 12:41:17,804] Trial 65 finished with value: 0.0687152633322301 and parameters: {'model_type': 'gcn', 'hidden_dims': '[512, 128]', 'dropout': 0.20456365088472275, 'batch_norm': False, 'lr': 0.0001037197876755534, 'weight_decay': 2.527001216485448e-07, 'epochs': 270, 'loss': 'mse', 'optimizer': 'adam', 'graph_mode': 'off', 'use_snp_selection': False}. Best is trial 64 with value: 0.09378759425930866.
[I 2025-11-03 12:41:19,744] Trial 66 finished with value: 0.047101581315548584 and parameters: {'model_type': 'gcn', 'hidden_dims': '[512, 128]', 'dropout': 0.18449806050091888, 'batch_norm': False, 'lr': 5.3665384656114695e-05, 'weight_decay': 1.9986537521009607e-07, 'epochs': 249, 'loss': 'mse', 'optimizer': 'adam', 'graph_mode': 'off', 'use_snp_selection': True, 'num_snps': 22881}. Best is trial 64 with value: 0.09378759425930866.
[I 2025-11-03 12:41:21,128] Trial 67 finished with value: 0.049751526474479744 and parameters: {'model_type': 'gcn', 'hidden_dims': '[128, 64]', 'dropout': 0.2490337867694, 'batch_norm': False, 'lr': 0.00026359083710598725, 'weight_decay': 7.958209402514625e-06, 'epochs': 274, 'loss': 'mse', 'optimizer': 'adam', 'graph_mode': 'off', 'use_snp_selection': False}. Best is trial 64 with value: 0.09378759425930866.
[I 2025-11-03 12:41:24,349] Trial 68 finished with value: 0.03735351989387929 and parameters: {'model_type': 'gcn', 'hidden_dims': '[512, 128]', 'dropout': 0.22663070252557016, 'batch_norm': False, 'lr': 1.5815410505739007e-05, 'weight_decay': 2.9492055132108062e-06, 'epochs': 302, 'loss': 'mse', 'optimizer': 'adam', 'graph_mode': 'off', 'use_snp_selection': False}. Best is trial 64 with value: 0.09378759425930866.
[I 2025-11-03 12:41:25,563] Trial 69 finished with value: 0.04625777933774868 and parameters: {'model_type': 'gcn', 'hidden_dims': '[128, 64]', 'dropout': 0.2040726027652714, 'batch_norm': False, 'lr': 9.407262616924423e-05, 'weight_decay': 4.0397264089390675e-05, 'epochs': 223, 'loss': 'mse', 'optimizer': 'adam', 'graph_mode': 'off', 'use_snp_selection': False}. Best is trial 64 with value: 0.09378759425930866.
[I 2025-11-03 12:41:27,302] Trial 70 finished with value: 0.10014434474599627 and parameters: {'model_type': 'gcn', 'hidden_dims': '[256, 128]', 'dropout': 0.2574608875911745, 'batch_norm': False, 'lr': 3.923673220872793e-05, 'weight_decay': 7.951537301994681e-07, 'epochs': 245, 'loss': 'mse', 'optimizer': 'adam', 'graph_mode': 'off', 'use_snp_selection': False}. Best is trial 70 with value: 0.10014434474599627.
[I 2025-11-03 12:41:29,049] Trial 71 finished with value: 0.03899921737191903 and parameters: {'model_type': 'gcn', 'hidden_dims': '[256, 128]', 'dropout': 0.2552080139853567, 'batch_norm': False, 'lr': 2.665929778854999e-05, 'weight_decay': 7.420467845016978e-07, 'epochs': 241, 'loss': 'mse', 'optimizer': 'adam', 'graph_mode': 'off', 'use_snp_selection': False}. Best is trial 70 with value: 0.10014434474599627.
[I 2025-11-03 12:41:30,912] Trial 72 finished with value: 0.08462453074572066 and parameters: {'model_type': 'gcn', 'hidden_dims': '[256, 128]', 'dropout': 0.23547516465337232, 'batch_norm': False, 'lr': 3.997182754056884e-05, 'weight_decay': 1.722300981841887e-06, 'epochs': 262, 'loss': 'mse', 'optimizer': 'adam', 'graph_mode': 'off', 'use_snp_selection': False}. Best is trial 70 with value: 0.10014434474599627.
[I 2025-11-03 12:41:32,737] Trial 73 finished with value: 0.03460283558287225 and parameters: {'model_type': 'gcn', 'hidden_dims': '[256, 128]', 'dropout': 0.29056494573095726, 'batch_norm': False, 'lr': 1.8521425860922855e-05, 'weight_decay': 1.1396347205349494e-06, 'epochs': 266, 'loss': 'mse', 'optimizer': 'adam', 'graph_mode': 'off', 'use_snp_selection': False}. Best is trial 70 with value: 0.10014434474599627.
[I 2025-11-03 12:41:34,524] Trial 74 finished with value: 0.051939533415289105 and parameters: {'model_type': 'gcn', 'hidden_dims': '[256, 128]', 'dropout': 0.21591317156271797, 'batch_norm': False, 'lr': 3.807001115380614e-05, 'weight_decay': 1.8796392048931106e-06, 'epochs': 254, 'loss': 'mse', 'optimizer': 'adam', 'graph_mode': 'off', 'use_snp_selection': False}. Best is trial 70 with value: 0.10014434474599627.
[I 2025-11-03 12:41:36,429] Trial 75 finished with value: 0.07806663339323727 and parameters: {'model_type': 'gcn', 'hidden_dims': '[256, 128]', 'dropout': 0.17107203593109696, 'batch_norm': False, 'lr': 7.687238533506487e-05, 'weight_decay': 3.0590315925359693e-07, 'epochs': 279, 'loss': 'mse', 'optimizer': 'adam', 'graph_mode': 'off', 'use_snp_selection': False}. Best is trial 70 with value: 0.10014434474599627.
[I 2025-11-03 12:41:38,249] Trial 76 finished with value: 0.07600247716062015 and parameters: {'model_type': 'gcn', 'hidden_dims': '[256, 128]', 'dropout': 0.18778871923847143, 'batch_norm': False, 'lr': 4.1968447119854984e-05, 'weight_decay': 1.4508488766056922e-07, 'epochs': 260, 'loss': 'mse', 'optimizer': 'adam', 'graph_mode': 'off', 'use_snp_selection': False}. Best is trial 70 with value: 0.10014434474599627.
[I 2025-11-03 12:41:40,276] Trial 77 finished with value: 0.06378762391005435 and parameters: {'model_type': 'gcn', 'hidden_dims': '[256, 128]', 'dropout': 0.24009288864323444, 'batch_norm': False, 'lr': 1.3082843873089165e-05, 'weight_decay': 2.196042781645902e-06, 'epochs': 291, 'loss': 'mse', 'optimizer': 'adam', 'graph_mode': 'off', 'use_snp_selection': False}. Best is trial 70 with value: 0.10014434474599627.
[I 2025-11-03 12:41:41,346] Trial 78 finished with value: 0.038233980971241505 and parameters: {'model_type': 'gcn', 'hidden_dims': '[256, 128]', 'dropout': 0.2795809131520594, 'batch_norm': False, 'lr': 2.8557112021398825e-05, 'weight_decay': 1.5195755842360376e-06, 'epochs': 242, 'loss': 'mse', 'optimizer': 'adam', 'graph_mode': 'off', 'use_snp_selection': True, 'num_snps': 2246}. Best is trial 70 with value: 0.10014434474599627.
[I 2025-11-03 12:41:42,761] Trial 79 finished with value: 0.01541389564999995 and parameters: {'model_type': 'gcn', 'hidden_dims': '[128, 64]', 'dropout': 0.21196545176101722, 'batch_norm': False, 'lr': 2.3143489677545154e-05, 'weight_decay': 4.512873472503446e-06, 'epochs': 276, 'loss': 'mse', 'optimizer': 'adam', 'graph_mode': 'off', 'use_snp_selection': False}. Best is trial 70 with value: 0.10014434474599627.
[I 2025-11-03 12:41:44,512] Trial 80 finished with value: 0.04522166505800594 and parameters: {'model_type': 'gcn', 'hidden_dims': '[256, 128]', 'dropout': 0.2620738127464713, 'batch_norm': False, 'lr': 0.00012147384741807906, 'weight_decay': 4.603043540154641e-07, 'epochs': 250, 'loss': 'mse', 'optimizer': 'adam', 'graph_mode': 'off', 'use_snp_selection': False}. Best is trial 70 with value: 0.10014434474599627.
[I 2025-11-03 12:41:46,343] Trial 81 finished with value: 0.05265932482202292 and parameters: {'model_type': 'gcn', 'hidden_dims': '[256, 128, 64]', 'dropout': 0.23206001282725514, 'batch_norm': True, 'lr': 6.0027484966993775e-05, 'weight_decay': 8.911647142149854e-07, 'epochs': 216, 'loss': 'mse', 'optimizer': 'adam', 'graph_mode': 'off', 'use_snp_selection': False}. Best is trial 70 with value: 0.10014434474599627.
[I 2025-11-03 12:41:48,789] Trial 82 finished with value: 0.07282479526417032 and parameters: {'model_type': 'gcn', 'hidden_dims': '[512, 128]', 'dropout': 0.19536610299909601, 'batch_norm': False, 'lr': 0.00010500920924363774, 'weight_decay': 6.440225059093992e-07, 'epochs': 200, 'loss': 'mse', 'optimizer': 'adam', 'graph_mode': 'off', 'use_snp_selection': False}. Best is trial 70 with value: 0.10014434474599627.
[I 2025-11-03 12:41:51,653] Trial 83 finished with value: 0.06421309982321938 and parameters: {'model_type': 'gcn', 'hidden_dims': '[512, 128]', 'dropout': 0.1729872763195387, 'batch_norm': True, 'lr': 0.0001508390160520286, 'weight_decay': 3.5422107798673705e-07, 'epochs': 263, 'loss': 'mse', 'optimizer': 'adam', 'graph_mode': 'off', 'use_snp_selection': False}. Best is trial 70 with value: 0.10014434474599627.
[I 2025-11-03 12:41:54,283] Trial 84 finished with value: 0.05250230891227011 and parameters: {'model_type': 'gcn', 'hidden_dims': '[512, 64]', 'dropout': 0.2437671528997484, 'batch_norm': True, 'lr': 7.805347940223066e-05, 'weight_decay': 7.769866220201334e-07, 'epochs': 229, 'loss': 'mse', 'optimizer': 'adam', 'graph_mode': 'off', 'use_snp_selection': False}. Best is trial 70 with value: 0.10014434474599627.
[I 2025-11-03 12:41:55,730] Trial 85 finished with value: 0.06976609327236467 and parameters: {'model_type': 'gcn', 'hidden_dims': '[128, 64]', 'dropout': 0.2278817185982409, 'batch_norm': False, 'lr': 3.59217268632704e-05, 'weight_decay': 1.0764073161190173e-06, 'epochs': 269, 'loss': 'mse', 'optimizer': 'adam', 'graph_mode': 'off', 'use_snp_selection': False}. Best is trial 70 with value: 0.10014434474599627.
[I 2025-11-03 12:41:58,187] Trial 86 finished with value: 0.042107733987097835 and parameters: {'model_type': 'gcn', 'hidden_dims': '[512, 128]', 'dropout': 0.1997426839636019, 'batch_norm': True, 'lr': 5.672182524165727e-05, 'weight_decay': 5.451333286045941e-07, 'epochs': 206, 'loss': 'mse', 'optimizer': 'adam', 'graph_mode': 'off', 'use_snp_selection': False}. Best is trial 70 with value: 0.10014434474599627.
[I 2025-11-03 12:42:00,705] Trial 87 finished with value: 0.07492334810517887 and parameters: {'model_type': 'gcn', 'hidden_dims': '[512, 128]', 'dropout': 0.13115282399932005, 'batch_norm': False, 'lr': 4.821342261668165e-05, 'weight_decay': 2.277364444593888e-07, 'epochs': 224, 'loss': 'mse', 'optimizer': 'adam', 'graph_mode': 'off', 'use_snp_selection': False}. Best is trial 70 with value: 0.10014434474599627.
[I 2025-11-03 12:42:02,268] Trial 88 finished with value: 0.03784918367259604 and parameters: {'model_type': 'gcn', 'hidden_dims': '[128, 64]', 'dropout': 0.21819986004504194, 'batch_norm': True, 'lr': 2.115337098174236e-05, 'weight_decay': 1.433894286620385e-06, 'epochs': 314, 'loss': 'mse', 'optimizer': 'adam', 'graph_mode': 'off', 'use_snp_selection': False}. Best is trial 70 with value: 0.10014434474599627.
[I 2025-11-03 12:42:04,638] Trial 89 finished with value: 0.027497956131921894 and parameters: {'model_type': 'gcn', 'hidden_dims': '[256, 128]', 'dropout': 0.30516597791421296, 'batch_norm': True, 'lr': 4.645500979311825e-06, 'weight_decay': 2.714532135004683e-07, 'epochs': 236, 'loss': 'mae', 'optimizer': 'adam', 'graph_mode': 'off', 'use_snp_selection': True, 'num_snps': 45058}. Best is trial 70 with value: 0.10014434474599627.
[I 2025-11-03 12:42:07,706] Trial 90 finished with value: 0.048854541960602876 and parameters: {'model_type': 'gcn', 'hidden_dims': '[512, 128]', 'dropout': 0.25558776821203366, 'batch_norm': False, 'lr': 0.00016402618683815796, 'weight_decay': 4.013247700314938e-07, 'epochs': 280, 'loss': 'mse', 'optimizer': 'adam', 'graph_mode': 'off', 'use_snp_selection': False}. Best is trial 70 with value: 0.10014434474599627.
[I 2025-11-03 12:42:10,814] Trial 91 finished with value: 0.09216554224177102 and parameters: {'model_type': 'gcn', 'hidden_dims': '[512, 128]', 'dropout': 0.23317912458057982, 'batch_norm': False, 'lr': 0.00021399056191534756, 'weight_decay': 3.912510357662735e-07, 'epochs': 288, 'loss': 'mae', 'optimizer': 'adam', 'graph_mode': 'off', 'use_snp_selection': False}. Best is trial 70 with value: 0.10014434474599627.
[I 2025-11-03 12:42:14,040] Trial 92 finished with value: 0.08306019368976642 and parameters: {'model_type': 'gcn', 'hidden_dims': '[512, 128]', 'dropout': 0.2719911238522125, 'batch_norm': False, 'lr': 0.00012814381263438084, 'weight_decay': 5.301685974677659e-07, 'epochs': 301, 'loss': 'mae', 'optimizer': 'adam', 'graph_mode': 'off', 'use_snp_selection': False}. Best is trial 70 with value: 0.10014434474599627.
[I 2025-11-03 12:42:17,218] Trial 93 finished with value: 0.08322794257844551 and parameters: {'model_type': 'gcn', 'hidden_dims': '[512, 128]', 'dropout': 0.26895407575564895, 'batch_norm': False, 'lr': 0.0002469083552766644, 'weight_decay': 1.921432801581169e-07, 'epochs': 302, 'loss': 'mae', 'optimizer': 'adam', 'graph_mode': 'off', 'use_snp_selection': False}. Best is trial 70 with value: 0.10014434474599627.
[I 2025-11-03 12:42:20,422] Trial 94 finished with value: 0.09317355124791706 and parameters: {'model_type': 'gcn', 'hidden_dims': '[512, 128]', 'dropout': 0.2710108179141346, 'batch_norm': False, 'lr': 0.00033832997511566135, 'weight_decay': 1.610396010886932e-07, 'epochs': 300, 'loss': 'mae', 'optimizer': 'adam', 'graph_mode': 'off', 'use_snp_selection': False}. Best is trial 70 with value: 0.10014434474599627.
[I 2025-11-03 12:42:23,938] Trial 95 finished with value: 0.07427666246484185 and parameters: {'model_type': 'gcn', 'hidden_dims': '[512, 128]', 'dropout': 0.27536566265322227, 'batch_norm': False, 'lr': 0.0003694584486286133, 'weight_decay': 1.0824351183608351e-07, 'epochs': 345, 'loss': 'mae', 'optimizer': 'adam', 'graph_mode': 'off', 'use_snp_selection': False}. Best is trial 70 with value: 0.10014434474599627.
[I 2025-11-03 12:42:27,321] Trial 96 finished with value: 0.08981128629875929 and parameters: {'model_type': 'gcn', 'hidden_dims': '[512, 128]', 'dropout': 0.29288719674042124, 'batch_norm': False, 'lr': 0.0002690012510267842, 'weight_decay': 1.695050784328291e-07, 'epochs': 323, 'loss': 'mae', 'optimizer': 'adam', 'graph_mode': 'off', 'use_snp_selection': False}. Best is trial 70 with value: 0.10014434474599627.
[I 2025-11-03 12:42:30,675] Trial 97 finished with value: 0.08745935982589248 and parameters: {'model_type': 'gcn', 'hidden_dims': '[512, 128]', 'dropout': 0.3030900859851267, 'batch_norm': False, 'lr': 0.0004732757570228196, 'weight_decay': 1.5979838611600842e-07, 'epochs': 323, 'loss': 'mae', 'optimizer': 'adam', 'graph_mode': 'off', 'use_snp_selection': False}. Best is trial 70 with value: 0.10014434474599627.
[I 2025-11-03 12:42:33,987] Trial 98 finished with value: 0.08278777453357228 and parameters: {'model_type': 'gcn', 'hidden_dims': '[512, 128]', 'dropout': 0.29190230824897706, 'batch_norm': False, 'lr': 0.0004539733302728305, 'weight_decay': 1.428643316125099e-07, 'epochs': 315, 'loss': 'mae', 'optimizer': 'adam', 'graph_mode': 'off', 'use_snp_selection': False}. Best is trial 70 with value: 0.10014434474599627.
[I 2025-11-03 12:42:37,384] Trial 99 finished with value: 0.06970321622647671 and parameters: {'model_type': 'gcn', 'hidden_dims': '[512, 128]', 'dropout': 0.3056044783084072, 'batch_norm': False, 'lr': 0.00027935291456143956, 'weight_decay': 1.0009136252435744e-07, 'epochs': 321, 'loss': 'mae', 'optimizer': 'adam', 'graph_mode': 'off', 'use_snp_selection': False}. Best is trial 70 with value: 0.10014434474599627.
[I 2025-11-03 12:42:40,719] Trial 100 finished with value: -0.011354241834942559 and parameters: {'model_type': 'gcn', 'hidden_dims': '[512, 128]', 'dropout': 0.34650475931609237, 'batch_norm': False, 'lr': 0.0006626037760476005, 'weight_decay': 1.6800558788058428e-07, 'epochs': 327, 'loss': 'mse', 'optimizer': 'adam', 'graph_mode': 'off', 'use_snp_selection': False}. Best is trial 70 with value: 0.10014434474599627.
[I 2025-11-03 12:42:43,969] Trial 101 finished with value: 0.06738623765362067 and parameters: {'model_type': 'gcn', 'hidden_dims': '[512, 128]', 'dropout': 0.2625381622486118, 'batch_norm': False, 'lr': 0.00024268203572747003, 'weight_decay': 1.9616077482126272e-07, 'epochs': 306, 'loss': 'mae', 'optimizer': 'adam', 'graph_mode': 'off', 'use_snp_selection': False}. Best is trial 70 with value: 0.10014434474599627.
[I 2025-11-03 12:42:47,178] Trial 102 finished with value: 0.08863829387248925 and parameters: {'model_type': 'gcn', 'hidden_dims': '[512, 128]', 'dropout': 0.28378230655583303, 'batch_norm': False, 'lr': 0.0003146818985587097, 'weight_decay': 1.262928990593947e-07, 'epochs': 293, 'loss': 'mae', 'optimizer': 'adam', 'graph_mode': 'off', 'use_snp_selection': False}. Best is trial 70 with value: 0.10014434474599627.
[I 2025-11-03 12:42:50,725] Trial 103 finished with value: 0.06904752757363869 and parameters: {'model_type': 'gcn', 'hidden_dims': '[512, 128]', 'dropout': 0.32456467846452125, 'batch_norm': False, 'lr': 0.0003186428493437631, 'weight_decay': 1.2306168184124697e-07, 'epochs': 342, 'loss': 'mae', 'optimizer': 'adam', 'graph_mode': 'off', 'use_snp_selection': False}. Best is trial 70 with value: 0.10014434474599627.
[I 2025-11-03 12:42:53,776] Trial 104 finished with value: 0.09354574761937817 and parameters: {'model_type': 'gcn', 'hidden_dims': '[512, 128]', 'dropout': 0.24536758902326034, 'batch_norm': False, 'lr': 0.0004735705695091536, 'weight_decay': 1.5661578509035898e-07, 'epochs': 290, 'loss': 'mae', 'optimizer': 'adam', 'graph_mode': 'off', 'use_snp_selection': False}. Best is trial 70 with value: 0.10014434474599627.
[I 2025-11-03 12:42:56,897] Trial 105 finished with value: 0.0961909020891853 and parameters: {'model_type': 'gcn', 'hidden_dims': '[512, 128]', 'dropout': 0.28482513029437706, 'batch_norm': False, 'lr': 0.0005236088198521432, 'weight_decay': 1.5903454841098636e-07, 'epochs': 290, 'loss': 'mae', 'optimizer': 'adam', 'graph_mode': 'off', 'use_snp_selection': False}. Best is trial 70 with value: 0.10014434474599627.
[I 2025-11-03 12:42:59,946] Trial 106 finished with value: 0.07842303662767816 and parameters: {'model_type': 'gcn', 'hidden_dims': '[512, 128]', 'dropout': 0.2876960130974633, 'batch_norm': False, 'lr': 0.0005603281394824631, 'weight_decay': 1.6914189626444706e-07, 'epochs': 288, 'loss': 'mae', 'optimizer': 'adam', 'graph_mode': 'off', 'use_snp_selection': False}. Best is trial 70 with value: 0.10014434474599627.
[I 2025-11-03 12:43:03,321] Trial 107 finished with value: 0.10626311983056189 and parameters: {'model_type': 'gcn', 'hidden_dims': '[512, 128]', 'dropout': 0.31755179696761643, 'batch_norm': False, 'lr': 0.0004390755306724507, 'weight_decay': 2.519878548438563e-07, 'epochs': 328, 'loss': 'mae', 'optimizer': 'adam', 'graph_mode': 'off', 'use_snp_selection': False}. Best is trial 107 with value: 0.10626311983056189.
[I 2025-11-03 12:43:06,454] Trial 108 finished with value: 0.07218799087109727 and parameters: {'model_type': 'gcn', 'hidden_dims': '[512, 128]', 'dropout': 0.3117744155145839, 'batch_norm': False, 'lr': 0.00042884564190442693, 'weight_decay': 2.3471702883058255e-07, 'epochs': 293, 'loss': 'mae', 'optimizer': 'adam', 'graph_mode': 'off', 'use_snp_selection': False}. Best is trial 107 with value: 0.10626311983056189.
[I 2025-11-03 12:43:09,667] Trial 109 finished with value: 0.05417499423964478 and parameters: {'model_type': 'gcn', 'hidden_dims': '[512, 128]', 'dropout': 0.3358965499867654, 'batch_norm': False, 'lr': 0.000822244845258766, 'weight_decay': 3.291028629715668e-07, 'epochs': 309, 'loss': 'mae', 'optimizer': 'adam', 'graph_mode': 'off', 'use_snp_selection': False}. Best is trial 107 with value: 0.10626311983056189.
[I 2025-11-03 12:43:12,094] Trial 110 finished with value: 0.0887519716286593 and parameters: {'model_type': 'gcn', 'hidden_dims': '[512, 128]', 'dropout': 0.28224683571627485, 'batch_norm': False, 'lr': 0.0005496332144307191, 'weight_decay': 2.8046132113204856e-07, 'epochs': 327, 'loss': 'mae', 'optimizer': 'adam', 'graph_mode': 'off', 'use_snp_selection': True, 'num_snps': 26398}. Best is trial 107 with value: 0.10626311983056189.
[I 2025-11-03 12:43:14,620] Trial 111 finished with value: 0.07225444830546718 and parameters: {'model_type': 'gcn', 'hidden_dims': '[512, 128]', 'dropout': 0.2839193750002647, 'batch_norm': False, 'lr': 0.0005785651955355367, 'weight_decay': 1.2085387366690996e-07, 'epochs': 337, 'loss': 'mae', 'optimizer': 'adam', 'graph_mode': 'off', 'use_snp_selection': True, 'num_snps': 27159}. Best is trial 107 with value: 0.10626311983056189.
[I 2025-11-03 12:43:16,359] Trial 112 finished with value: 0.07315186536896291 and parameters: {'model_type': 'gcn', 'hidden_dims': '[512, 128]', 'dropout': 0.29626781925307255, 'batch_norm': False, 'lr': 0.00036350219053662004, 'weight_decay': 2.609060547431047e-07, 'epochs': 316, 'loss': 'mae', 'optimizer': 'adam', 'graph_mode': 'off', 'use_snp_selection': True, 'num_snps': 13331}. Best is trial 107 with value: 0.10626311983056189.
