[I 2025-11-03 13:20:01,697] Trial 83 finished with value: 0.0873346833246625 and parameters: {'model_type': 'graphsage', 'hidden_dims': '[512, 256]', 'dropout': 0.3666182931047915, 'batch_norm': True, 'lr': 0.0001280475456728297, 'weight_decay': 0.0005109249577992721, 'epochs': 269, 'loss': 'mae', 'optimizer': 'adam', 'graph_mode': 'knn', 'source': 'grm', 'knn_k': 1, 'weighted_edges': False, 'symmetrize_mode': 'union', 'use_snp_selection': False}. Best is trial 75 with value: 0.1225689324935553.
[I 2025-11-03 13:20:04,349] Trial 84 finished with value: 0.0841001038826933 and parameters: {'model_type': 'graphsage', 'hidden_dims': '[256, 128]', 'dropout': 0.32578593400934813, 'batch_norm': True, 'lr': 0.00019331568980506778, 'weight_decay': 0.00017662830403381293, 'epochs': 233, 'loss': 'mae', 'optimizer': 'adam', 'graph_mode': 'knn', 'source': 'grm', 'knn_k': 2, 'weighted_edges': False, 'symmetrize_mode': 'union', 'use_snp_selection': False}. Best is trial 75 with value: 0.1225689324935553.
[I 2025-11-03 13:20:08,815] Trial 85 finished with value: 0.0785421944827358 and parameters: {'model_type': 'graphsage', 'hidden_dims': '[512, 128]', 'dropout': 0.38776316024541135, 'batch_norm': True, 'lr': 0.00022016631886046946, 'weight_decay': 3.9424356839079146e-05, 'epochs': 277, 'loss': 'mae', 'optimizer': 'adam', 'graph_mode': 'knn', 'source': 'grm', 'knn_k': 2, 'weighted_edges': False, 'symmetrize_mode': 'union', 'use_snp_selection': False}. Best is trial 75 with value: 0.1225689324935553.
[I 2025-11-03 13:20:10,998] Trial 86 finished with value: 0.08318314908301504 and parameters: {'model_type': 'graphsage', 'hidden_dims': '[128, 64]', 'dropout': 0.5952225783347752, 'batch_norm': True, 'lr': 9.651286892878834e-05, 'weight_decay': 0.0002710915171286909, 'epochs': 258, 'loss': 'mae', 'optimizer': 'adam', 'graph_mode': 'knn', 'source': 'grm', 'knn_k': 1, 'weighted_edges': True, 'symmetrize_mode': 'union', 'use_snp_selection': False}. Best is trial 75 with value: 0.1225689324935553.
[I 2025-11-03 13:20:14,769] Trial 87 finished with value: 0.07807293913650577 and parameters: {'model_type': 'graphsage', 'hidden_dims': '[512, 256]', 'dropout': 0.2887297092942377, 'batch_norm': True, 'lr': 0.00016981261009734128, 'weight_decay': 0.00010744581258976659, 'epochs': 212, 'loss': 'mae', 'optimizer': 'adam', 'graph_mode': 'cutoff', 'cutoff': 0.4604435738022427, 'grm_norm': 'none', 'self_loops': False, 'use_snp_selection': False}. Best is trial 75 with value: 0.1225689324935553.
[I 2025-11-03 13:20:17,317] Trial 88 finished with value: 0.07747646344216558 and parameters: {'model_type': 'graphsage', 'hidden_dims': '[256, 128]', 'dropout': 0.3030993302182615, 'batch_norm': True, 'lr': 0.0004904554862713447, 'weight_decay': 7.707642542212529e-06, 'epochs': 242, 'loss': 'mse', 'optimizer': 'adam', 'graph_mode': 'knn', 'source': 'grm', 'knn_k': 1, 'weighted_edges': False, 'symmetrize_mode': 'mutual', 'use_snp_selection': False}. Best is trial 75 with value: 0.1225689324935553.
[I 2025-11-03 13:20:20,702] Trial 89 finished with value: 0.07787676065294837 and parameters: {'model_type': 'graphsage', 'hidden_dims': '[256, 128, 64]', 'dropout': 0.3371429899690979, 'batch_norm': True, 'lr': 0.00031185112622662717, 'weight_decay': 0.0004187123780185168, 'epochs': 296, 'loss': 'mae', 'optimizer': 'adam', 'graph_mode': 'knn', 'source': 'grm', 'knn_k': 7, 'weighted_edges': True, 'symmetrize_mode': 'union', 'use_snp_selection': False}. Best is trial 75 with value: 0.1225689324935553.
[I 2025-11-03 13:20:22,935] Trial 90 finished with value: 0.05042744612431049 and parameters: {'model_type': 'graphsage', 'hidden_dims': '[256, 128]', 'dropout': 0.5716142116245555, 'batch_norm': True, 'lr': 3.899939465912959e-05, 'weight_decay': 7.086150110528082e-05, 'epochs': 165, 'loss': 'mse', 'optimizer': 'adam', 'graph_mode': 'knn', 'source': 'grm', 'knn_k': 2, 'weighted_edges': False, 'symmetrize_mode': 'mutual', 'use_snp_selection': False}. Best is trial 75 with value: 0.1225689324935553.
[I 2025-11-03 13:20:25,640] Trial 91 finished with value: 0.06262935633777954 and parameters: {'model_type': 'graphsage', 'hidden_dims': '[256, 128]', 'dropout': 0.3461137768042353, 'batch_norm': True, 'lr': 0.00012327836658325357, 'weight_decay': 0.00032619240263814613, 'epochs': 267, 'loss': 'mae', 'optimizer': 'adam', 'graph_mode': 'knn', 'source': 'grm', 'knn_k': 1, 'weighted_edges': False, 'symmetrize_mode': 'union', 'use_snp_selection': False}. Best is trial 75 with value: 0.1225689324935553.
[I 2025-11-03 13:20:28,269] Trial 92 finished with value: 0.06250676913047883 and parameters: {'model_type': 'graphsage', 'hidden_dims': '[256, 128]', 'dropout': 0.35540861995001055, 'batch_norm': True, 'lr': 5.233570926879751e-05, 'weight_decay': 0.0003231946569651291, 'epochs': 250, 'loss': 'mae', 'optimizer': 'adam', 'graph_mode': 'knn', 'source': 'grm', 'knn_k': 1, 'weighted_edges': False, 'symmetrize_mode': 'union', 'use_snp_selection': False}. Best is trial 75 with value: 0.1225689324935553.
[I 2025-11-03 13:20:31,050] Trial 93 finished with value: 0.06922564994684362 and parameters: {'model_type': 'graphsage', 'hidden_dims': '[256, 128]', 'dropout': 0.39664581173636976, 'batch_norm': True, 'lr': 6.770470213537514e-05, 'weight_decay': 0.0006742265294323123, 'epochs': 283, 'loss': 'mae', 'optimizer': 'adam', 'graph_mode': 'knn', 'source': 'grm', 'knn_k': 1, 'weighted_edges': False, 'symmetrize_mode': 'union', 'use_snp_selection': False}. Best is trial 75 with value: 0.1225689324935553.
[I 2025-11-03 13:20:33,701] Trial 94 finished with value: 0.05669198311364995 and parameters: {'model_type': 'graphsage', 'hidden_dims': '[256, 128]', 'dropout': 0.31671807848868966, 'batch_norm': True, 'lr': 7.635746650994018e-05, 'weight_decay': 0.000253836843741469, 'epochs': 255, 'loss': 'mae', 'optimizer': 'adam', 'graph_mode': 'knn', 'source': 'grm', 'knn_k': 1, 'weighted_edges': False, 'symmetrize_mode': 'union', 'use_snp_selection': False}. Best is trial 75 with value: 0.1225689324935553.
[I 2025-11-03 13:20:37,904] Trial 95 finished with value: 0.08129065324823968 and parameters: {'model_type': 'graphsage', 'hidden_dims': '[512, 256]', 'dropout': 0.36494589601256494, 'batch_norm': True, 'lr': 0.00015385176329319453, 'weight_decay': 0.00014405013884987128, 'epochs': 246, 'loss': 'mae', 'optimizer': 'adam', 'graph_mode': 'knn', 'source': 'grm', 'knn_k': 2, 'weighted_edges': True, 'symmetrize_mode': 'union', 'use_snp_selection': False}. Best is trial 75 with value: 0.1225689324935553.
[I 2025-11-03 13:20:41,203] Trial 96 finished with value: 0.08001831004880643 and parameters: {'model_type': 'graphsage', 'hidden_dims': '[256, 128]', 'dropout': 0.33127777942398245, 'batch_norm': False, 'lr': 0.0008547790256313296, 'weight_decay': 0.0003637842322846657, 'epochs': 223, 'loss': 'mae', 'optimizer': 'adam', 'graph_mode': 'knn', 'source': 'grm', 'knn_k': 10, 'weighted_edges': False, 'symmetrize_mode': 'union', 'use_snp_selection': True, 'num_snps': 34767}. Best is trial 75 with value: 0.1225689324935553.
[I 2025-11-03 13:20:43,919] Trial 97 finished with value: 0.053952494470679034 and parameters: {'model_type': 'graphsage', 'hidden_dims': '[256, 128]', 'dropout': 0.3470947147413969, 'batch_norm': True, 'lr': 5.495167490182448e-05, 'weight_decay': 0.00019842274369759482, 'epochs': 274, 'loss': 'mse', 'optimizer': 'adam', 'graph_mode': 'knn', 'source': 'grm', 'knn_k': 1, 'weighted_edges': False, 'symmetrize_mode': 'mutual', 'use_snp_selection': False}. Best is trial 75 with value: 0.1225689324935553.
[I 2025-11-03 13:20:47,907] Trial 98 finished with value: 0.06580984019600826 and parameters: {'model_type': 'graphsage', 'hidden_dims': '[512, 64]', 'dropout': 0.5009843135094842, 'batch_norm': True, 'lr': 0.00011324077273533204, 'weight_decay': 0.0005245004496750434, 'epochs': 236, 'loss': 'mae', 'optimizer': 'adam', 'graph_mode': 'cutoff', 'cutoff': 0.3255324741014019, 'grm_norm': 'cosine_then_gcn', 'self_loops': True, 'use_snp_selection': False}. Best is trial 75 with value: 0.1225689324935553.
[I 2025-11-03 13:20:52,186] Trial 99 finished with value: 0.08630193241125755 and parameters: {'model_type': 'graphsage', 'hidden_dims': '[512, 256]', 'dropout': 0.38151098281829066, 'batch_norm': True, 'lr': 0.0005922978690598911, 'weight_decay': 2.9652644256134793e-07, 'epochs': 261, 'loss': 'mse', 'optimizer': 'adam', 'graph_mode': 'knn', 'source': 'grm', 'knn_k': 2, 'weighted_edges': True, 'symmetrize_mode': 'union', 'use_snp_selection': False}. Best is trial 75 with value: 0.1225689324935553.
[I 2025-11-03 13:20:54,769] Trial 100 finished with value: 0.07820763850820285 and parameters: {'model_type': 'graphsage', 'hidden_dims': '[256, 128]', 'dropout': 0.2657070056271005, 'batch_norm': True, 'lr': 0.000672039065556917, 'weight_decay': 0.000978147614037395, 'epochs': 249, 'loss': 'mae', 'optimizer': 'adam', 'graph_mode': 'knn', 'source': 'grm', 'knn_k': 1, 'weighted_edges': False, 'symmetrize_mode': 'mutual', 'use_snp_selection': False}. Best is trial 75 with value: 0.1225689324935553.
[I 2025-11-03 13:20:59,127] Trial 101 finished with value: 0.08526257066998062 and parameters: {'model_type': 'graphsage', 'hidden_dims': '[512, 64]', 'dropout': 0.32160780989602017, 'batch_norm': True, 'lr': 8.063547068093508e-05, 'weight_decay': 0.00025096411523246024, 'epochs': 254, 'loss': 'mae', 'optimizer': 'adam', 'graph_mode': 'knn', 'source': 'grm', 'knn_k': 3, 'weighted_edges': True, 'symmetrize_mode': 'union', 'use_snp_selection': False}. Best is trial 75 with value: 0.1225689324935553.
[I 2025-11-03 13:21:03,602] Trial 102 finished with value: 0.10314828777767414 and parameters: {'model_type': 'graphsage', 'hidden_dims': '[512, 64]', 'dropout': 0.3039957577566525, 'batch_norm': True, 'lr': 2.584233518282608e-05, 'weight_decay': 0.000416742107408757, 'epochs': 264, 'loss': 'mae', 'optimizer': 'adam', 'graph_mode': 'knn', 'source': 'grm', 'knn_k': 4, 'weighted_edges': True, 'symmetrize_mode': 'union', 'use_snp_selection': False}. Best is trial 75 with value: 0.1225689324935553.
[I 2025-11-03 13:21:08,064] Trial 103 finished with value: 0.08247222857817114 and parameters: {'model_type': 'graphsage', 'hidden_dims': '[512, 64]', 'dropout': 0.28048014256978304, 'batch_norm': True, 'lr': 4.167966334783999e-05, 'weight_decay': 0.000791779456759604, 'epochs': 266, 'loss': 'mae', 'optimizer': 'adam', 'graph_mode': 'knn', 'source': 'grm', 'knn_k': 4, 'weighted_edges': True, 'symmetrize_mode': 'union', 'use_snp_selection': False}. Best is trial 75 with value: 0.1225689324935553.
[I 2025-11-03 13:21:12,387] Trial 104 finished with value: 0.06625527104493328 and parameters: {'model_type': 'graphsage', 'hidden_dims': '[512, 64]', 'dropout': 0.303396090851064, 'batch_norm': True, 'lr': 2.773211918753551e-05, 'weight_decay': 0.0005997701063877219, 'epochs': 276, 'loss': 'mae', 'optimizer': 'adam', 'graph_mode': 'knn', 'source': 'grm', 'knn_k': 1, 'weighted_edges': True, 'symmetrize_mode': 'union', 'use_snp_selection': False}. Best is trial 75 with value: 0.1225689324935553.
[I 2025-11-03 13:21:15,169] Trial 105 finished with value: 0.02990532792257771 and parameters: {'model_type': 'graphsage', 'hidden_dims': '[256, 128]', 'dropout': 0.24987405829937281, 'batch_norm': True, 'lr': 1.0605079674089096e-05, 'weight_decay': 0.0003998579536854856, 'epochs': 239, 'loss': 'mse', 'optimizer': 'adam', 'graph_mode': 'knn', 'source': 'grm', 'knn_k': 4, 'weighted_edges': True, 'symmetrize_mode': 'union', 'use_snp_selection': False}. Best is trial 75 with value: 0.1225689324935553.
[I 2025-11-03 13:21:17,310] Trial 106 finished with value: 0.05961410757550426 and parameters: {'model_type': 'graphsage', 'hidden_dims': '[512, 64]', 'dropout': 0.33097314760111707, 'batch_norm': False, 'lr': 1.5875630938522148e-05, 'weight_decay': 0.00047609652713562813, 'epochs': 230, 'loss': 'mae', 'optimizer': 'adam', 'graph_mode': 'knn', 'source': 'grm', 'knn_k': 3, 'weighted_edges': False, 'symmetrize_mode': 'mutual', 'use_snp_selection': True, 'num_snps': 8590}. Best is trial 75 with value: 0.1225689324935553.
[I 2025-11-03 13:21:21,806] Trial 107 finished with value: 0.06265993483070106 and parameters: {'model_type': 'graphsage', 'hidden_dims': '[512, 256]', 'dropout': 0.5467468228178166, 'batch_norm': True, 'lr': 3.18706064674745e-05, 'weight_decay': 1.5904100563218948e-05, 'epochs': 287, 'loss': 'mse', 'optimizer': 'adam', 'graph_mode': 'knn', 'source': 'grm', 'knn_k': 1, 'weighted_edges': True, 'symmetrize_mode': 'union', 'use_snp_selection': False}. Best is trial 75 with value: 0.1225689324935553.
[I 2025-11-03 13:21:26,001] Trial 108 finished with value: 0.0494674988035598 and parameters: {'model_type': 'graphsage', 'hidden_dims': '[512, 128]', 'dropout': 0.4597648661758546, 'batch_norm': True, 'lr': 2.0065894680603005e-05, 'weight_decay': 9.121339847030541e-05, 'epochs': 261, 'loss': 'mae', 'optimizer': 'adam', 'graph_mode': 'knn', 'source': 'grm', 'knn_k': 2, 'weighted_edges': False, 'symmetrize_mode': 'mutual', 'use_snp_selection': False}. Best is trial 75 with value: 0.1225689324935553.
[I 2025-11-03 13:21:28,711] Trial 109 finished with value: 0.04613032203789134 and parameters: {'model_type': 'graphsage', 'hidden_dims': '[256, 128, 64]', 'dropout': 0.312197427784237, 'batch_norm': True, 'lr': 0.00027334510724468403, 'weight_decay': 3.146694514379223e-05, 'epochs': 247, 'loss': 'mse', 'optimizer': 'adam', 'graph_mode': 'knn', 'source': 'grm', 'knn_k': 1, 'weighted_edges': False, 'symmetrize_mode': 'union', 'use_snp_selection': False}. Best is trial 75 with value: 0.1225689324935553.
[I 2025-11-03 13:21:31,630] Trial 110 finished with value: 0.04704295083875958 and parameters: {'model_type': 'graphsage', 'hidden_dims': '[256, 128]', 'dropout': 0.2963848291222446, 'batch_norm': False, 'lr': 0.0004481188853048297, 'weight_decay': 0.0003543116567770977, 'epochs': 256, 'loss': 'mae', 'optimizer': 'adam', 'graph_mode': 'knn', 'source': 'grm', 'knn_k': 2, 'weighted_edges': True, 'symmetrize_mode': 'mutual', 'use_snp_selection': True, 'num_snps': 28636}. Best is trial 75 with value: 0.1225689324935553.
[I 2025-11-03 13:21:36,385] Trial 111 finished with value: 0.07317399952816578 and parameters: {'model_type': 'graphsage', 'hidden_dims': '[512, 64]', 'dropout': 0.33934981727134583, 'batch_norm': True, 'lr': 9.591855009844268e-05, 'weight_decay': 0.00021674807259638906, 'epochs': 279, 'loss': 'mae', 'optimizer': 'adam', 'graph_mode': 'knn', 'source': 'grm', 'knn_k': 5, 'weighted_edges': True, 'symmetrize_mode': 'union', 'use_snp_selection': False}. Best is trial 75 with value: 0.1225689324935553.
[I 2025-11-03 13:21:40,900] Trial 112 finished with value: 0.06630586353282159 and parameters: {'model_type': 'graphsage', 'hidden_dims': '[512, 64]', 'dropout': 0.35443330969380543, 'batch_norm': True, 'lr': 6.262438952498397e-05, 'weight_decay': 0.00017758143397389296, 'epochs': 268, 'loss': 'mae', 'optimizer': 'adam', 'graph_mode': 'knn', 'source': 'grm', 'knn_k': 4, 'weighted_edges': True, 'symmetrize_mode': 'union', 'use_snp_selection': False}. Best is trial 75 with value: 0.1225689324935553.
[I 2025-11-03 13:21:45,308] Trial 113 finished with value: 0.06938053130472989 and parameters: {'model_type': 'graphsage', 'hidden_dims': '[512, 64]', 'dropout': 0.3199215297741342, 'batch_norm': True, 'lr': 0.00014000868080758466, 'weight_decay': 0.0002826893375152711, 'epochs': 241, 'loss': 'mae', 'optimizer': 'adam', 'graph_mode': 'knn', 'source': 'grm', 'knn_k': 6, 'weighted_edges': True, 'symmetrize_mode': 'union', 'use_snp_selection': False}. Best is trial 75 with value: 0.1225689324935553.
[I 2025-11-03 13:21:47,499] Trial 114 finished with value: 0.0823042933588463 and parameters: {'model_type': 'graphsage', 'hidden_dims': '[128, 64]', 'dropout': 0.28569222040785164, 'batch_norm': True, 'lr': 0.00017298080340241636, 'weight_decay': 0.00013602558091140956, 'epochs': 251, 'loss': 'mae', 'optimizer': 'adam', 'graph_mode': 'knn', 'source': 'grm', 'knn_k': 4, 'weighted_edges': True, 'symmetrize_mode': 'union', 'use_snp_selection': False}. Best is trial 75 with value: 0.1225689324935553.
[I 2025-11-03 13:21:51,748] Trial 115 finished with value: 0.03189219839227062 and parameters: {'model_type': 'graphsage', 'hidden_dims': '[512, 256]', 'dropout': 0.3659213651193214, 'batch_norm': True, 'lr': 2.614957865925808e-05, 'weight_decay': 0.0006113386861220127, 'epochs': 262, 'loss': 'mse', 'optimizer': 'adam', 'graph_mode': 'knn', 'source': 'grm', 'knn_k': 3, 'weighted_edges': False, 'symmetrize_mode': 'mutual', 'use_snp_selection': False}. Best is trial 75 with value: 0.1225689324935553.
[I 2025-11-03 13:21:56,041] Trial 116 finished with value: 0.06703644039245782 and parameters: {'model_type': 'graphsage', 'hidden_dims': '[512, 64]', 'dropout': 0.5601934669270481, 'batch_norm': True, 'lr': 0.00011009367105022303, 'weight_decay': 0.0004270156081551636, 'epochs': 272, 'loss': 'mae', 'optimizer': 'adam', 'graph_mode': 'knn', 'source': 'grm', 'knn_k': 1, 'weighted_edges': False, 'symmetrize_mode': 'union', 'use_snp_selection': False}. Best is trial 75 with value: 0.1225689324935553.
[I 2025-11-03 13:21:58,585] Trial 117 finished with value: 0.07196653137173556 and parameters: {'model_type': 'graphsage', 'hidden_dims': '[256, 128]', 'dropout': 0.5296035852762857, 'batch_norm': True, 'lr': 0.0008587493734853335, 'weight_decay': 5.2451322795883796e-05, 'epochs': 255, 'loss': 'mse', 'optimizer': 'adam', 'graph_mode': 'cutoff', 'cutoff': 0.5533205976602853, 'grm_norm': 'none', 'self_loops': False, 'use_snp_selection': False}. Best is trial 75 with value: 0.1225689324935553.
[I 2025-11-03 13:22:01,227] Trial 118 finished with value: 0.06531888646727417 and parameters: {'model_type': 'graphsage', 'hidden_dims': '[256, 128]', 'dropout': 0.3085158414585604, 'batch_norm': True, 'lr': 3.6418322486077e-05, 'weight_decay': 0.0002937790451759514, 'epochs': 229, 'loss': 'mae', 'optimizer': 'adam', 'graph_mode': 'knn', 'source': 'grm', 'knn_k': 5, 'weighted_edges': True, 'symmetrize_mode': 'mutual', 'use_snp_selection': False}. Best is trial 75 with value: 0.1225689324935553.
[I 2025-11-03 13:22:04,109] Trial 119 finished with value: 0.0791949416667759 and parameters: {'model_type': 'graphsage', 'hidden_dims': '[256, 128, 64]', 'dropout': 0.42229352164173983, 'batch_norm': True, 'lr': 0.0002170466876355321, 'weight_decay': 0.00016521213249486176, 'epochs': 282, 'loss': 'mse', 'optimizer': 'adam', 'graph_mode': 'knn', 'source': 'grm', 'knn_k': 1, 'weighted_edges': False, 'symmetrize_mode': 'union', 'use_snp_selection': False}. Best is trial 75 with value: 0.1225689324935553.
[I 2025-11-03 13:22:07,865] Trial 120 finished with value: 0.05477965465977533 and parameters: {'model_type': 'graphsage', 'hidden_dims': '[512, 256]', 'dropout': 0.34751084696405804, 'batch_norm': False, 'lr': 4.495710300562907e-05, 'weight_decay': 2.2178935151395194e-05, 'epochs': 220, 'loss': 'mae', 'optimizer': 'adam', 'graph_mode': 'knn', 'source': 'grm', 'knn_k': 1, 'weighted_edges': False, 'symmetrize_mode': 'mutual', 'use_snp_selection': True, 'num_snps': 36229}. Best is trial 75 with value: 0.1225689324935553.
[I 2025-11-03 13:22:11,845] Trial 121 finished with value: 0.068214179205362 and parameters: {'model_type': 'graphsage', 'hidden_dims': '[512, 256]', 'dropout': 0.32633880306565216, 'batch_norm': True, 'lr': 8.254607799389562e-05, 'weight_decay': 4.560232738854071e-06, 'epochs': 198, 'loss': 'mae', 'optimizer': 'adam', 'graph_mode': 'knn', 'source': 'grm', 'knn_k': 4, 'weighted_edges': True, 'symmetrize_mode': 'union', 'use_snp_selection': False}. Best is trial 75 with value: 0.1225689324935553.
[I 2025-11-03 13:22:16,148] Trial 122 finished with value: 0.03658821128840586 and parameters: {'model_type': 'graphsage', 'hidden_dims': '[512, 256]', 'dropout': 0.581045868262543, 'batch_norm': True, 'lr': 9.303385046256768e-05, 'weight_decay': 0.00021870680703217705, 'epochs': 236, 'loss': 'mae', 'optimizer': 'adam', 'graph_mode': 'knn', 'source': 'grm', 'knn_k': 5, 'weighted_edges': True, 'symmetrize_mode': 'union', 'use_snp_selection': False}. Best is trial 75 with value: 0.1225689324935553.
[I 2025-11-03 13:22:20,462] Trial 123 finished with value: 0.07800703726526927 and parameters: {'model_type': 'graphsage', 'hidden_dims': '[512, 256]', 'dropout': 0.29846425460891945, 'batch_norm': True, 'lr': 0.00011831625146892213, 'weight_decay': 0.00010959884207309927, 'epochs': 245, 'loss': 'mae', 'optimizer': 'adam', 'graph_mode': 'knn', 'source': 'grm', 'knn_k': 4, 'weighted_edges': True, 'symmetrize_mode': 'union', 'use_snp_selection': False}. Best is trial 75 with value: 0.1225689324935553.
[I 2025-11-03 13:22:24,866] Trial 124 finished with value: 0.08426093417074443 and parameters: {'model_type': 'graphsage', 'hidden_dims': '[512, 256]', 'dropout': 0.3360679144031004, 'batch_norm': True, 'lr': 0.0001413175357779492, 'weight_decay': 0.00034610838352621136, 'epochs': 263, 'loss': 'mae', 'optimizer': 'adam', 'graph_mode': 'knn', 'source': 'grm', 'knn_k': 3, 'weighted_edges': True, 'symmetrize_mode': 'union', 'use_snp_selection': False}. Best is trial 75 with value: 0.1225689324935553.
[I 2025-11-03 13:22:27,538] Trial 125 finished with value: 0.07884735391155155 and parameters: {'model_type': 'graphsage', 'hidden_dims': '[256, 128]', 'dropout': 0.2692167299525596, 'batch_norm': True, 'lr': 5.042951773825191e-05, 'weight_decay': 0.00025447059912646537, 'epochs': 211, 'loss': 'mae', 'optimizer': 'adam', 'graph_mode': 'knn', 'source': 'grm', 'knn_k': 4, 'weighted_edges': False, 'symmetrize_mode': 'union', 'use_snp_selection': False}. Best is trial 75 with value: 0.1225689324935553.
