[I 2025-11-03 12:43:19,287] Trial 113 finished with value: 0.08097048635208348 and parameters: {'model_type': 'gcn', 'hidden_dims': '[512, 128]', 'dropout': 0.24733624347175542, 'batch_norm': False, 'lr': 0.00030363311796204815, 'weight_decay': 2.0381553696205265e-07, 'epochs': 329, 'loss': 'mae', 'optimizer': 'adam', 'graph_mode': 'off', 'use_snp_selection': True, 'num_snps': 36077}. Best is trial 107 with value: 0.10626311983056189.
[I 2025-11-03 12:43:20,926] Trial 114 finished with value: 0.07326722645806737 and parameters: {'model_type': 'gcn', 'hidden_dims': '[512, 128]', 'dropout': 0.28077155807456944, 'batch_norm': False, 'lr': 0.0006700681682970814, 'weight_decay': 1.3502198057299294e-07, 'epochs': 298, 'loss': 'mae', 'optimizer': 'adam', 'graph_mode': 'off', 'use_snp_selection': True, 'num_snps': 12459}. Best is trial 107 with value: 0.10626311983056189.
[I 2025-11-03 12:43:24,419] Trial 115 finished with value: 0.0868606550428804 and parameters: {'model_type': 'gcn', 'hidden_dims': '[512, 128]', 'dropout': 0.32149573774780343, 'batch_norm': False, 'lr': 0.00019916161297443757, 'weight_decay': 3.4116137996456564e-07, 'epochs': 280, 'loss': 'mae', 'optimizer': 'adam', 'graph_mode': 'off', 'use_snp_selection': True, 'num_snps': 53297}. Best is trial 107 with value: 0.10626311983056189.
[I 2025-11-03 12:43:27,454] Trial 116 finished with value: 0.06617863761901717 and parameters: {'model_type': 'gcn', 'hidden_dims': '[512, 128]', 'dropout': 0.26091123606209693, 'batch_norm': False, 'lr': 0.0004098901992873809, 'weight_decay': 2.769981577033517e-07, 'epochs': 285, 'loss': 'mae', 'optimizer': 'adam', 'graph_mode': 'off', 'use_snp_selection': False}. Best is trial 107 with value: 0.10626311983056189.
[I 2025-11-03 12:43:29,717] Trial 117 finished with value: 0.09103587261544056 and parameters: {'model_type': 'gcn', 'hidden_dims': '[256, 128, 64]', 'dropout': 0.251342903348677, 'batch_norm': False, 'lr': 0.00047196646720463337, 'weight_decay': 2.168777103825568e-07, 'epochs': 293, 'loss': 'mae', 'optimizer': 'adam', 'graph_mode': 'off', 'use_snp_selection': False}. Best is trial 107 with value: 0.10626311983056189.
[I 2025-11-03 12:43:32,182] Trial 118 finished with value: 0.05088133173625756 and parameters: {'model_type': 'gcn', 'hidden_dims': '[256, 128, 64]', 'dropout': 0.2550096842214796, 'batch_norm': False, 'lr': 0.0005110223413185354, 'weight_decay': 2.165360127925855e-07, 'epochs': 328, 'loss': 'mae', 'optimizer': 'adam', 'graph_mode': 'off', 'use_snp_selection': False}. Best is trial 107 with value: 0.10626311983056189.
[I 2025-11-03 12:43:34,508] Trial 119 finished with value: 0.016629002430493353 and parameters: {'model_type': 'gcn', 'hidden_dims': '[256, 128, 64]', 'dropout': 0.3771828915676861, 'batch_norm': False, 'lr': 0.0007951772329886453, 'weight_decay': 1.5054173207762454e-07, 'epochs': 293, 'loss': 'mae', 'optimizer': 'adam', 'graph_mode': 'off', 'use_snp_selection': False}. Best is trial 107 with value: 0.10626311983056189.
[I 2025-11-03 12:43:36,996] Trial 120 finished with value: 0.0559954604272033 and parameters: {'model_type': 'gcn', 'hidden_dims': '[256, 128, 64]', 'dropout': 0.2970924255540599, 'batch_norm': False, 'lr': 0.0005971704821950849, 'weight_decay': 1.2170298789481195e-07, 'epochs': 307, 'loss': 'mae', 'optimizer': 'adam', 'graph_mode': 'off', 'use_snp_selection': True, 'num_snps': 37787}. Best is trial 107 with value: 0.10626311983056189.
[I 2025-11-03 12:43:39,161] Trial 121 finished with value: 0.06952138631971058 and parameters: {'model_type': 'gcn', 'hidden_dims': '[256, 128, 64]', 'dropout': 0.24675479511969356, 'batch_norm': False, 'lr': 0.0003338859856079741, 'weight_decay': 2.4711460638423683e-07, 'epochs': 273, 'loss': 'mae', 'optimizer': 'adam', 'graph_mode': 'off', 'use_snp_selection': False}. Best is trial 107 with value: 0.10626311983056189.
[I 2025-11-03 12:43:42,607] Trial 122 finished with value: 0.08614506858339709 and parameters: {'model_type': 'gcn', 'hidden_dims': '[512, 128]', 'dropout': 0.22460686542774516, 'batch_norm': False, 'lr': 0.00021706541173890126, 'weight_decay': 4.161555094497826e-07, 'epochs': 339, 'loss': 'mae', 'optimizer': 'adam', 'graph_mode': 'off', 'use_snp_selection': False}. Best is trial 107 with value: 0.10626311983056189.
[I 2025-11-03 12:43:45,693] Trial 123 finished with value: -0.0073884947334105595 and parameters: {'model_type': 'gcn', 'hidden_dims': '[512, 64]', 'dropout': 0.2765663583479309, 'batch_norm': False, 'lr': 0.0009438817272668435, 'weight_decay': 1.879928470139904e-07, 'epochs': 289, 'loss': 'mae', 'optimizer': 'adam', 'graph_mode': 'off', 'use_snp_selection': False}. Best is trial 107 with value: 0.10626311983056189.
[I 2025-11-03 12:43:49,220] Trial 124 finished with value: 0.09079380374344563 and parameters: {'model_type': 'gcn', 'hidden_dims': '[512, 128]', 'dropout': 0.23619432529172224, 'batch_norm': False, 'lr': 0.00039753468299362894, 'weight_decay': 3.216241278311067e-07, 'epochs': 348, 'loss': 'mae', 'optimizer': 'adam', 'graph_mode': 'off', 'use_snp_selection': False}. Best is trial 107 with value: 0.10626311983056189.
[I 2025-11-03 12:43:52,618] Trial 125 finished with value: 0.07431483426977394 and parameters: {'model_type': 'gcn', 'hidden_dims': '[512, 128]', 'dropout': 0.2653760437912962, 'batch_norm': False, 'lr': 0.00038179427228701766, 'weight_decay': 2.969134387895145e-07, 'epochs': 332, 'loss': 'mae', 'optimizer': 'adam', 'graph_mode': 'off', 'use_snp_selection': False}. Best is trial 107 with value: 0.10626311983056189.
[I 2025-11-03 12:43:56,138] Trial 126 finished with value: 0.0825779165109139 and parameters: {'model_type': 'gcn', 'hidden_dims': '[512, 128]', 'dropout': 0.2414812654085365, 'batch_norm': False, 'lr': 0.0004967520837251952, 'weight_decay': 3.766166101707918e-07, 'epochs': 346, 'loss': 'mae', 'optimizer': 'adam', 'graph_mode': 'off', 'use_snp_selection': False}. Best is trial 107 with value: 0.10626311983056189.
[I 2025-11-03 12:43:59,441] Trial 127 finished with value: 0.06154632413870428 and parameters: {'model_type': 'gcn', 'hidden_dims': '[512, 128]', 'dropout': 0.5255349037724308, 'batch_norm': False, 'lr': 0.0002983520397826097, 'weight_decay': 1.7010634217704555e-07, 'epochs': 317, 'loss': 'mae', 'optimizer': 'adam', 'graph_mode': 'off', 'use_snp_selection': False}. Best is trial 107 with value: 0.10626311983056189.
[I 2025-11-03 12:44:02,614] Trial 128 finished with value: 0.0802908641471179 and parameters: {'model_type': 'gcn', 'hidden_dims': '[512, 128]', 'dropout': 0.28391104729600153, 'batch_norm': False, 'lr': 0.0007012824042697555, 'weight_decay': 2.2781046279675604e-07, 'epochs': 301, 'loss': 'mae', 'optimizer': 'adam', 'graph_mode': 'off', 'use_snp_selection': False}. Best is trial 107 with value: 0.10626311983056189.
[I 2025-11-03 12:44:05,881] Trial 129 finished with value: 0.08334181798139097 and parameters: {'model_type': 'gcn', 'hidden_dims': '[512, 256]', 'dropout': 0.2117759827095585, 'batch_norm': False, 'lr': 0.00046147527833695443, 'weight_decay': 1.01278884971911e-07, 'epochs': 323, 'loss': 'mae', 'optimizer': 'adam', 'graph_mode': 'off', 'use_snp_selection': False}. Best is trial 107 with value: 0.10626311983056189.
[I 2025-11-03 12:44:08,483] Trial 130 finished with value: 0.0654626577305072 and parameters: {'model_type': 'gcn', 'hidden_dims': '[256, 128, 64]', 'dropout': 0.3318611381637231, 'batch_norm': False, 'lr': 0.00040340972218305546, 'weight_decay': 3.1324412910486973e-07, 'epochs': 349, 'loss': 'mae', 'optimizer': 'adam', 'graph_mode': 'off', 'use_snp_selection': False}. Best is trial 107 with value: 0.10626311983056189.
[I 2025-11-03 12:44:11,424] Trial 131 finished with value: 0.06965113071771391 and parameters: {'model_type': 'gcn', 'hidden_dims': '[512, 128]', 'dropout': 0.23249426117504102, 'batch_norm': False, 'lr': 0.0002637062727522702, 'weight_decay': 2.5780101115749784e-07, 'epochs': 277, 'loss': 'mae', 'optimizer': 'adam', 'graph_mode': 'off', 'use_snp_selection': False}. Best is trial 107 with value: 0.10626311983056189.
[I 2025-11-03 12:44:14,462] Trial 132 finished with value: 0.09528638008701036 and parameters: {'model_type': 'gcn', 'hidden_dims': '[512, 128]', 'dropout': 0.2489506228825102, 'batch_norm': False, 'lr': 0.0003494951554437791, 'weight_decay': 1.9161340020921802e-07, 'epochs': 283, 'loss': 'mae', 'optimizer': 'adam', 'graph_mode': 'off', 'use_snp_selection': False}. Best is trial 107 with value: 0.10626311983056189.
[I 2025-11-03 12:44:17,589] Trial 133 finished with value: 0.07995174805286985 and parameters: {'model_type': 'gcn', 'hidden_dims': '[512, 128]', 'dropout': 0.25397559174368917, 'batch_norm': False, 'lr': 0.0003202496743061239, 'weight_decay': 1.2996741483668192e-07, 'epochs': 295, 'loss': 'mae', 'optimizer': 'adam', 'graph_mode': 'off', 'use_snp_selection': False}. Best is trial 107 with value: 0.10626311983056189.
[I 2025-11-03 12:44:20,808] Trial 134 finished with value: 0.08225634585277468 and parameters: {'model_type': 'gcn', 'hidden_dims': '[512, 128]', 'dropout': 0.2692782724706444, 'batch_norm': False, 'lr': 0.00035287399237588624, 'weight_decay': 1.6085995344017307e-07, 'epochs': 311, 'loss': 'mae', 'optimizer': 'adam', 'graph_mode': 'off', 'use_snp_selection': False}. Best is trial 107 with value: 0.10626311983056189.
[I 2025-11-03 12:44:23,830] Trial 135 finished with value: 0.06511844512033013 and parameters: {'model_type': 'gcn', 'hidden_dims': '[512, 128]', 'dropout': 0.31327871978907873, 'batch_norm': False, 'lr': 0.00041667766646666913, 'weight_decay': 1.955909503549007e-07, 'epochs': 283, 'loss': 'mae', 'optimizer': 'adam', 'graph_mode': 'off', 'use_snp_selection': False}. Best is trial 107 with value: 0.10626311983056189.
[I 2025-11-03 12:44:26,896] Trial 136 finished with value: 0.06783709154941543 and parameters: {'model_type': 'gcn', 'hidden_dims': '[512, 128]', 'dropout': 0.24531668694717373, 'batch_norm': False, 'lr': 0.0006207797847662864, 'weight_decay': 4.5498426330395557e-07, 'epochs': 289, 'loss': 'mae', 'optimizer': 'adam', 'graph_mode': 'off', 'use_snp_selection': False}. Best is trial 107 with value: 0.10626311983056189.
[I 2025-11-03 12:44:30,089] Trial 137 finished with value: 0.05361850336818447 and parameters: {'model_type': 'gcn', 'hidden_dims': '[512, 128]', 'dropout': 0.2943603260893825, 'batch_norm': False, 'lr': 0.0005093853360948449, 'weight_decay': 1.4550772981138475e-07, 'epochs': 302, 'loss': 'mae', 'optimizer': 'adam', 'graph_mode': 'off', 'use_snp_selection': False}. Best is trial 107 with value: 0.10626311983056189.
[I 2025-11-03 12:44:33,584] Trial 138 finished with value: 0.07783606279439256 and parameters: {'model_type': 'gcn', 'hidden_dims': '[512, 128]', 'dropout': 0.2576718903116114, 'batch_norm': False, 'lr': 0.00026891736407780645, 'weight_decay': 3.477307983673271e-07, 'epochs': 338, 'loss': 'mae', 'optimizer': 'adam', 'graph_mode': 'off', 'use_snp_selection': False}. Best is trial 107 with value: 0.10626311983056189.
[I 2025-11-03 12:44:36,484] Trial 139 finished with value: 0.07718720044823872 and parameters: {'model_type': 'gcn', 'hidden_dims': '[512, 128]', 'dropout': 0.22311768583590985, 'batch_norm': False, 'lr': 0.000540149816979438, 'weight_decay': 2.3313364074653476e-07, 'epochs': 269, 'loss': 'mae', 'optimizer': 'adam', 'graph_mode': 'off', 'use_snp_selection': False}. Best is trial 107 with value: 0.10626311983056189.
[I 2025-11-03 12:44:39,561] Trial 140 finished with value: 0.09956546650208814 and parameters: {'model_type': 'gcn', 'hidden_dims': '[512, 64]', 'dropout': 0.20730197319097127, 'batch_norm': False, 'lr': 0.00023159389056074116, 'weight_decay': 1.8628472442630243e-07, 'epochs': 284, 'loss': 'mae', 'optimizer': 'adam', 'graph_mode': 'off', 'use_snp_selection': False}. Best is trial 107 with value: 0.10626311983056189.
[I 2025-11-03 12:44:42,589] Trial 141 finished with value: 0.07586225669078946 and parameters: {'model_type': 'gcn', 'hidden_dims': '[512, 64]', 'dropout': 0.20097785803126633, 'batch_norm': False, 'lr': 0.00023743734777595743, 'weight_decay': 1.883621740048347e-07, 'epochs': 285, 'loss': 'mae', 'optimizer': 'adam', 'graph_mode': 'off', 'use_snp_selection': False}. Best is trial 107 with value: 0.10626311983056189.
[I 2025-11-03 12:44:45,636] Trial 142 finished with value: 0.08367513631875036 and parameters: {'model_type': 'gcn', 'hidden_dims': '[512, 64]', 'dropout': 0.2082231979755554, 'batch_norm': False, 'lr': 0.0003548901077740461, 'weight_decay': 2.6688160926401194e-07, 'epochs': 278, 'loss': 'mae', 'optimizer': 'adam', 'graph_mode': 'off', 'use_snp_selection': False}. Best is trial 107 with value: 0.10626311983056189.
[I 2025-11-03 12:44:48,761] Trial 143 finished with value: 0.07056115110111076 and parameters: {'model_type': 'gcn', 'hidden_dims': '[512, 64]', 'dropout': 0.23806828411688738, 'batch_norm': False, 'lr': 0.00029234807941939104, 'weight_decay': 1.224881047952349e-07, 'epochs': 295, 'loss': 'mae', 'optimizer': 'adam', 'graph_mode': 'off', 'use_snp_selection': False}. Best is trial 107 with value: 0.10626311983056189.
[I 2025-11-03 12:44:51,947] Trial 144 finished with value: 0.07415205497365526 and parameters: {'model_type': 'gcn', 'hidden_dims': '[512, 64]', 'dropout': 0.27372471613019256, 'batch_norm': False, 'lr': 0.00044433456134737614, 'weight_decay': 2.136516905910606e-07, 'epochs': 305, 'loss': 'mae', 'optimizer': 'adam', 'graph_mode': 'off', 'use_snp_selection': False}. Best is trial 107 with value: 0.10626311983056189.
[I 2025-11-03 12:44:55,201] Trial 145 finished with value: 0.07791024327911343 and parameters: {'model_type': 'gcn', 'hidden_dims': '[512, 128]', 'dropout': 0.1870239594984604, 'batch_norm': False, 'lr': 0.00022198736220669046, 'weight_decay': 1.5620642859864197e-07, 'epochs': 312, 'loss': 'mae', 'optimizer': 'adam', 'graph_mode': 'off', 'use_snp_selection': False}. Best is trial 107 with value: 0.10626311983056189.
[I 2025-11-03 12:44:57,549] Trial 146 finished with value: 0.07630402999521037 and parameters: {'model_type': 'gcn', 'hidden_dims': '[512, 128]', 'dropout': 0.21999335981265428, 'batch_norm': False, 'lr': 0.00017646871541171746, 'weight_decay': 3.0837538318111406e-07, 'epochs': 296, 'loss': 'mae', 'optimizer': 'adam', 'graph_mode': 'off', 'use_snp_selection': True, 'num_snps': 27749}. Best is trial 107 with value: 0.10626311983056189.
[I 2025-11-03 12:45:00,653] Trial 147 finished with value: 0.04964488420126362 and parameters: {'model_type': 'gcn', 'hidden_dims': '[512, 128]', 'dropout': 0.28517993882710424, 'batch_norm': False, 'lr': 0.0007413789883718593, 'weight_decay': 1.8174058776156057e-07, 'epochs': 282, 'loss': 'mae', 'optimizer': 'adam', 'graph_mode': 'off', 'use_snp_selection': False}. Best is trial 107 with value: 0.10626311983056189.
[I 2025-11-03 12:45:03,513] Trial 148 finished with value: 0.06751418141974298 and parameters: {'model_type': 'gcn', 'hidden_dims': '[512, 128]', 'dropout': 0.30764486051436135, 'batch_norm': False, 'lr': 0.0004039822716153453, 'weight_decay': 0.0003323498727448428, 'epochs': 267, 'loss': 'mae', 'optimizer': 'adam', 'graph_mode': 'off', 'use_snp_selection': False}. Best is trial 107 with value: 0.10626311983056189.
[I 2025-11-03 12:45:05,947] Trial 149 finished with value: 0.09450126195986433 and parameters: {'model_type': 'gcn', 'hidden_dims': '[256, 128, 64]', 'dropout': 0.25736096359579236, 'batch_norm': False, 'lr': 0.00020297775559956945, 'weight_decay': 3.844670054296011e-07, 'epochs': 325, 'loss': 'mae', 'optimizer': 'adam', 'graph_mode': 'off', 'use_snp_selection': False}. Best is trial 107 with value: 0.10626311983056189.
[I 2025-11-03 12:45:08,665] Trial 0 finished with value: 0.07596208170338108 and parameters: {'model_type': 'gcn', 'hidden_dims': '[128, 64]', 'dropout': 0.199031432379812, 'batch_norm': True, 'lr': 1.8408544111075837e-06, 'weight_decay': 5.5136510071208614e-05, 'epochs': 336, 'loss': 'mae', 'optimizer': 'adam', 'graph_mode': 'off', 'use_snp_selection': True, 'num_snps': 43862}. Best is trial 0 with value: 0.07596208170338108.
[I 2025-11-03 12:45:10,932] Trial 1 finished with value: 0.12027947708588511 and parameters: {'model_type': 'gcn', 'hidden_dims': '[256, 128]', 'dropout': 0.4370668075331726, 'batch_norm': True, 'lr': 7.133471581159139e-05, 'weight_decay': 1.128633586803549e-05, 'epochs': 242, 'loss': 'mae', 'optimizer': 'adam', 'graph_mode': 'off', 'use_snp_selection': False}. Best is trial 1 with value: 0.12027947708588511.
[I 2025-11-03 12:45:12,357] Trial 2 finished with value: -0.005256438370079598 and parameters: {'model_type': 'gcn', 'hidden_dims': '[256, 128, 64]', 'dropout': 0.41314357415569625, 'batch_norm': False, 'lr': 3.952233718592101e-06, 'weight_decay': 0.00026754769258252603, 'epochs': 149, 'loss': 'mse', 'optimizer': 'adam', 'graph_mode': 'off', 'use_snp_selection': True, 'num_snps': 11571}. Best is trial 1 with value: 0.12027947708588511.
[I 2025-11-03 12:45:16,692] Trial 3 finished with value: 0.09189557546077624 and parameters: {'model_type': 'gcn', 'hidden_dims': '[512, 64]', 'dropout': 0.5938127374509361, 'batch_norm': False, 'lr': 5.67704586114731e-06, 'weight_decay': 2.4518087630137052e-05, 'epochs': 320, 'loss': 'mae', 'optimizer': 'adam', 'graph_mode': 'off', 'use_snp_selection': False}. Best is trial 1 with value: 0.12027947708588511.
[I 2025-11-03 12:45:20,147] Trial 4 finished with value: 0.04576040417864924 and parameters: {'model_type': 'gcn', 'hidden_dims': '[512, 128]', 'dropout': 0.25746343592134413, 'batch_norm': True, 'lr': 1.3467657668402788e-06, 'weight_decay': 0.00033087251918647806, 'epochs': 277, 'loss': 'mse', 'optimizer': 'adam', 'graph_mode': 'off', 'use_snp_selection': True, 'num_snps': 36675}. Best is trial 1 with value: 0.12027947708588511.
[I 2025-11-03 12:45:22,436] Trial 5 finished with value: 0.05637883657888497 and parameters: {'model_type': 'gcn', 'hidden_dims': '[512, 64]', 'dropout': 0.38275350994408375, 'batch_norm': True, 'lr': 1.5586664309232824e-06, 'weight_decay': 0.0008227664668621182, 'epochs': 145, 'loss': 'mae', 'optimizer': 'adam', 'graph_mode': 'off', 'use_snp_selection': True, 'num_snps': 32148}. Best is trial 1 with value: 0.12027947708588511.
[I 2025-11-03 12:45:24,309] Trial 6 finished with value: 0.12476692639482412 and parameters: {'model_type': 'gcn', 'hidden_dims': '[256, 128]', 'dropout': 0.3930109900265879, 'batch_norm': False, 'lr': 4.892964372128395e-05, 'weight_decay': 1.5809549317992182e-06, 'epochs': 199, 'loss': 'mse', 'optimizer': 'adam', 'graph_mode': 'off', 'use_snp_selection': False}. Best is trial 6 with value: 0.12476692639482412.
[I 2025-11-03 12:45:26,135] Trial 7 finished with value: 0.11692715735267388 and parameters: {'model_type': 'gcn', 'hidden_dims': '[512, 256]', 'dropout': 0.15343979219678458, 'batch_norm': True, 'lr': 6.234003099047341e-05, 'weight_decay': 3.894760610535477e-07, 'epochs': 97, 'loss': 'mse', 'optimizer': 'adam', 'graph_mode': 'off', 'use_snp_selection': False}. Best is trial 6 with value: 0.12476692639482412.
[I 2025-11-03 12:45:30,453] Trial 8 finished with value: 0.1365887314595145 and parameters: {'model_type': 'gcn', 'hidden_dims': '[512, 128]', 'dropout': 0.10743001231661406, 'batch_norm': True, 'lr': 0.00023728538449271062, 'weight_decay': 1.7629071578048637e-05, 'epochs': 312, 'loss': 'mae', 'optimizer': 'adam', 'graph_mode': 'off', 'use_snp_selection': False}. Best is trial 8 with value: 0.1365887314595145.
[I 2025-11-03 12:45:33,186] Trial 9 finished with value: 0.12844387477035718 and parameters: {'model_type': 'gcn', 'hidden_dims': '[512, 64]', 'dropout': 0.14505336736221927, 'batch_norm': True, 'lr': 5.8619638388111826e-05, 'weight_decay': 6.200156172669308e-07, 'epochs': 175, 'loss': 'mse', 'optimizer': 'adam', 'graph_mode': 'off', 'use_snp_selection': False}. Best is trial 8 with value: 0.1365887314595145.
[I 2025-11-03 12:45:34,547] Trial 10 finished with value: 0.062209375001030125 and parameters: {'model_type': 'gcn', 'hidden_dims': '[512, 128]', 'dropout': 0.2800030442581858, 'batch_norm': False, 'lr': 0.0004919806695968257, 'weight_decay': 2.9953888095455486e-06, 'epochs': 55, 'loss': 'mae', 'optimizer': 'adam', 'graph_mode': 'off', 'use_snp_selection': False}. Best is trial 8 with value: 0.1365887314595145.
[I 2025-11-03 12:45:37,720] Trial 11 finished with value: 0.13187666549511293 and parameters: {'model_type': 'gcn', 'hidden_dims': '[512, 128]', 'dropout': 0.10095648685224448, 'batch_norm': True, 'lr': 0.0003411435764085616, 'weight_decay': 1.2045055692919657e-07, 'epochs': 216, 'loss': 'mse', 'optimizer': 'adam', 'graph_mode': 'off', 'use_snp_selection': False}. Best is trial 8 with value: 0.1365887314595145.
[I 2025-11-03 12:45:41,416] Trial 12 finished with value: 0.1382886693296736 and parameters: {'model_type': 'gcn', 'hidden_dims': '[512, 128]', 'dropout': 0.10344600881777158, 'batch_norm': True, 'lr': 0.0006674532614549997, 'weight_decay': 1.3081036432574914e-07, 'epochs': 255, 'loss': 'mae', 'optimizer': 'adam', 'graph_mode': 'off', 'use_snp_selection': False}. Best is trial 12 with value: 0.1382886693296736.
[I 2025-11-03 12:45:45,434] Trial 13 finished with value: 0.13421561616605024 and parameters: {'model_type': 'gcn', 'hidden_dims': '[512, 128]', 'dropout': 0.2429461314891602, 'batch_norm': True, 'lr': 0.00020263148232071683, 'weight_decay': 5.014770300041101e-06, 'epochs': 285, 'loss': 'mae', 'optimizer': 'adam', 'graph_mode': 'off', 'use_snp_selection': False}. Best is trial 12 with value: 0.1382886693296736.
[I 2025-11-03 12:45:49,286] Trial 14 finished with value: 0.13145378725430157 and parameters: {'model_type': 'gcn', 'hidden_dims': '[512, 128]', 'dropout': 0.3221595656802847, 'batch_norm': True, 'lr': 0.0009218940720367965, 'weight_decay': 5.724103314313124e-05, 'epochs': 271, 'loss': 'mae', 'optimizer': 'adam', 'graph_mode': 'off', 'use_snp_selection': False}. Best is trial 12 with value: 0.1382886693296736.
