[I 2025-10-22 10:19:11,236] Trial 36 finished with value: 0.20213218906735916 and parameters: {'model_type': 'gat', 'hidden_dims': '[512, 64]', 'dropout': 0.2539863149367573, 'batch_norm': False, 'gat_heads': 6, 'gat_attn_dropout': 0.3826070563364917, 'gat_concat_hidden': True, 'lr': 4.053165109935146e-05, 'weight_decay': 3.9112756716074825e-05, 'epochs': 210, 'loss': 'mae', 'optimizer': 'adam', 'graph_mode': 'knn', 'source': 'grm', 'knn_k': 10, 'weighted_edges': True, 'symmetrize_mode': 'union'}. Best is trial 17 with value: 0.2584227340138163.
[I 2025-10-22 10:26:58,283] Trial 37 finished with value: 0.1506752768806252 and parameters: {'model_type': 'gat', 'hidden_dims': '[512, 128]', 'dropout': 0.21437793656138857, 'batch_norm': False, 'gat_heads': 8, 'gat_attn_dropout': 0.5525320461659639, 'gat_concat_hidden': True, 'lr': 1.4929372209735344e-06, 'weight_decay': 1.0532481711811489e-06, 'epochs': 181, 'loss': 'mae', 'optimizer': 'adam', 'graph_mode': 'cutoff', 'cutoff': 0.6988507440351425, 'grm_norm': 'gcn', 'self_loops': True}. Best is trial 17 with value: 0.2584227340138163.
[I 2025-10-22 10:35:50,817] Trial 38 finished with value: 0.2202073518338119 and parameters: {'model_type': 'gat', 'hidden_dims': '[512, 64]', 'dropout': 0.1817211060226257, 'batch_norm': True, 'gat_heads': 7, 'gat_attn_dropout': 0.4914566779574966, 'gat_concat_hidden': True, 'lr': 0.0001537471627152931, 'weight_decay': 3.1073605171781925e-07, 'epochs': 245, 'loss': 'mse', 'optimizer': 'adam', 'graph_mode': 'cutoff', 'cutoff': 0.4992831551134363, 'grm_norm': 'gcn', 'self_loops': False}. Best is trial 17 with value: 0.2584227340138163.
[I 2025-10-22 10:38:26,152] Trial 39 finished with value: 0.18239687255331824 and parameters: {'model_type': 'gat', 'hidden_dims': '[256, 128]', 'dropout': 0.12951362820341994, 'batch_norm': False, 'gat_heads': 6, 'gat_attn_dropout': 0.520549571050717, 'gat_concat_hidden': False, 'lr': 0.00026200904106863445, 'weight_decay': 2.646236274946402e-06, 'epochs': 162, 'loss': 'mae', 'optimizer': 'adam', 'graph_mode': 'knn', 'source': 'grm', 'knn_k': 3, 'weighted_edges': True, 'symmetrize_mode': 'mutual'}. Best is trial 17 with value: 0.2584227340138163.
[I 2025-10-22 10:47:13,117] Trial 40 finished with value: 0.21887631900970206 and parameters: {'model_type': 'gat', 'hidden_dims': '[512, 64]', 'dropout': 0.329638917831869, 'batch_norm': True, 'gat_heads': 5, 'gat_attn_dropout': 0.021607400698068546, 'gat_concat_hidden': True, 'lr': 7.991471174282198e-05, 'weight_decay': 5.337266793232115e-06, 'epochs': 337, 'loss': 'mae', 'optimizer': 'adam', 'graph_mode': 'cutoff', 'cutoff': 0.8246549236616902, 'grm_norm': 'gcn', 'self_loops': True}. Best is trial 17 with value: 0.2584227340138163.
[I 2025-10-22 10:53:10,411] Trial 41 finished with value: 0.235349008500146 and parameters: {'model_type': 'gat', 'hidden_dims': '[512, 64]', 'dropout': 0.1852545586154219, 'batch_norm': False, 'gat_heads': 6, 'gat_attn_dropout': 0.5667549187422073, 'gat_concat_hidden': True, 'lr': 0.00017229312887603383, 'weight_decay': 6.8693432797955795e-06, 'epochs': 195, 'loss': 'mae', 'optimizer': 'adam', 'graph_mode': 'cutoff', 'cutoff': 0.8533613800497095, 'grm_norm': 'gcn', 'self_loops': True}. Best is trial 17 with value: 0.2584227340138163.
[I 2025-10-22 10:59:12,477] Trial 42 finished with value: 0.2211420236912866 and parameters: {'model_type': 'gat', 'hidden_dims': '[512, 64]', 'dropout': 0.23858347190466966, 'batch_norm': False, 'gat_heads': 6, 'gat_attn_dropout': 0.5992259176357975, 'gat_concat_hidden': True, 'lr': 0.00033718300543281903, 'weight_decay': 9.209202812192722e-06, 'epochs': 198, 'loss': 'mae', 'optimizer': 'adam', 'graph_mode': 'cutoff', 'cutoff': 0.867219145814259, 'grm_norm': 'gcn', 'self_loops': True}. Best is trial 17 with value: 0.2584227340138163.
[I 2025-10-22 11:06:54,775] Trial 43 finished with value: 0.23973677915218494 and parameters: {'model_type': 'gat', 'hidden_dims': '[512, 64]', 'dropout': 0.1599121303668154, 'batch_norm': False, 'gat_heads': 7, 'gat_attn_dropout': 0.5656772195978562, 'gat_concat_hidden': True, 'lr': 0.00021585692289604157, 'weight_decay': 2.4199326270925577e-05, 'epochs': 218, 'loss': 'mae', 'optimizer': 'adam', 'graph_mode': 'cutoff', 'cutoff': 0.782285497960613, 'grm_norm': 'cosine_then_gcn', 'self_loops': True}. Best is trial 17 with value: 0.2584227340138163.
[I 2025-10-22 11:09:09,004] Trial 44 finished with value: 0.06701476100426358 and parameters: {'model_type': 'gat', 'hidden_dims': '[128, 64]', 'dropout': 0.1595281994834415, 'batch_norm': False, 'gat_heads': 7, 'gat_attn_dropout': 0.5245196329846746, 'gat_concat_hidden': True, 'lr': 0.0005868247801849997, 'weight_decay': 2.7607816963200874e-05, 'epochs': 218, 'loss': 'mae', 'optimizer': 'adam', 'graph_mode': 'cutoff', 'cutoff': 0.7381741778264506, 'grm_norm': 'cosine_then_gcn', 'self_loops': False}. Best is trial 17 with value: 0.2584227340138163.
[I 2025-10-22 11:17:42,117] Trial 45 finished with value: 0.22887823197392804 and parameters: {'model_type': 'gat', 'hidden_dims': '[512, 64]', 'dropout': 0.1231649118678052, 'batch_norm': False, 'gat_heads': 7, 'gat_attn_dropout': 0.4749619610215894, 'gat_concat_hidden': True, 'lr': 0.00010704449688348641, 'weight_decay': 6.498607086363869e-05, 'epochs': 242, 'loss': 'mae', 'optimizer': 'adam', 'graph_mode': 'cutoff', 'cutoff': 0.6528506544753551, 'grm_norm': 'cosine_then_gcn', 'self_loops': False}. Best is trial 17 with value: 0.2584227340138163.
[I 2025-10-22 11:24:01,239] Trial 46 finished with value: 0.2432936577355461 and parameters: {'model_type': 'gat', 'hidden_dims': '[512, 64]', 'dropout': 0.27123668742799384, 'batch_norm': False, 'gat_heads': 8, 'gat_attn_dropout': 0.44621643331185445, 'gat_concat_hidden': False, 'lr': 0.0002695628020970941, 'weight_decay': 0.00016467778892758535, 'epochs': 151, 'loss': 'mse', 'optimizer': 'adam', 'graph_mode': 'cutoff', 'cutoff': 0.7795882138913915, 'grm_norm': 'cosine_then_gcn', 'self_loops': True}. Best is trial 17 with value: 0.2584227340138163.
[I 2025-10-22 11:30:04,072] Trial 47 finished with value: 0.2211461248222589 and parameters: {'model_type': 'gat', 'hidden_dims': '[512, 256]', 'dropout': 0.2762416248016543, 'batch_norm': False, 'gat_heads': 8, 'gat_attn_dropout': 0.44563978977580937, 'gat_concat_hidden': False, 'lr': 5.3060957457684016e-05, 'weight_decay': 0.0004951127989263795, 'epochs': 140, 'loss': 'mse', 'optimizer': 'adam', 'graph_mode': 'cutoff', 'cutoff': 0.5475150596212209, 'grm_norm': 'cosine_then_gcn', 'self_loops': False}. Best is trial 17 with value: 0.2584227340138163.
[I 2025-10-22 11:37:00,713] Trial 48 finished with value: 0.2411382744930351 and parameters: {'model_type': 'gat', 'hidden_dims': '[512, 128]', 'dropout': 0.39238056397669313, 'batch_norm': False, 'gat_heads': 8, 'gat_attn_dropout': 0.4000808158096154, 'gat_concat_hidden': False, 'lr': 0.0007372646035373578, 'weight_decay': 0.0002031843398268757, 'epochs': 165, 'loss': 'mse', 'optimizer': 'adam', 'graph_mode': 'cutoff', 'cutoff': 0.676263901624888, 'grm_norm': 'cosine_then_gcn', 'self_loops': True}. Best is trial 17 with value: 0.2584227340138163.
[I 2025-10-22 11:39:34,188] Trial 49 finished with value: 0.21742495697640601 and parameters: {'model_type': 'gat', 'hidden_dims': '[512, 128]', 'dropout': 0.42559016666735466, 'batch_norm': True, 'gat_heads': 3, 'gat_attn_dropout': 0.4092409533043711, 'gat_concat_hidden': False, 'lr': 0.0006840490314528139, 'weight_decay': 0.00025035921029219833, 'epochs': 161, 'loss': 'mse', 'optimizer': 'adam', 'graph_mode': 'cutoff', 'cutoff': 0.6727019886484096, 'grm_norm': 'cosine_then_gcn', 'self_loops': False}. Best is trial 17 with value: 0.2584227340138163.
[I 2025-10-22 11:44:42,268] Trial 50 finished with value: 0.16245272929103255 and parameters: {'model_type': 'gat', 'hidden_dims': '[512, 128]', 'dropout': 0.4087872828905129, 'batch_norm': False, 'gat_heads': 8, 'gat_attn_dropout': 0.3502237146924502, 'gat_concat_hidden': False, 'lr': 0.0004115117430728448, 'weight_decay': 0.00014511127512463506, 'epochs': 112, 'loss': 'mse', 'optimizer': 'adam', 'graph_mode': 'knn', 'source': 'grm', 'knn_k': 7, 'weighted_edges': False, 'symmetrize_mode': 'union'}. Best is trial 17 with value: 0.2584227340138163.
[I 2025-10-22 11:51:04,507] Trial 51 finished with value: 0.23037866002125224 and parameters: {'model_type': 'gat', 'hidden_dims': '[512, 128]', 'dropout': 0.30036479593131754, 'batch_norm': False, 'gat_heads': 8, 'gat_attn_dropout': 0.4916013865273224, 'gat_concat_hidden': False, 'lr': 0.0002812043388784722, 'weight_decay': 0.0003787592979655986, 'epochs': 152, 'loss': 'mse', 'optimizer': 'adam', 'graph_mode': 'cutoff', 'cutoff': 0.7367311180011965, 'grm_norm': 'cosine_then_gcn', 'self_loops': True}. Best is trial 17 with value: 0.2584227340138163.
[I 2025-10-22 11:58:46,637] Trial 52 finished with value: 0.09603723673129086 and parameters: {'model_type': 'gat', 'hidden_dims': '[512, 128]', 'dropout': 0.3825430303784686, 'batch_norm': False, 'gat_heads': 8, 'gat_attn_dropout': 0.05958108576001467, 'gat_concat_hidden': False, 'lr': 0.0007957765471301095, 'weight_decay': 0.0005995019583972674, 'epochs': 183, 'loss': 'mse', 'optimizer': 'adam', 'graph_mode': 'cutoff', 'cutoff': 0.5913208593678327, 'grm_norm': 'cosine_then_gcn', 'self_loops': True}. Best is trial 17 with value: 0.2584227340138163.
[I 2025-10-22 12:01:45,830] Trial 53 finished with value: 0.217622316738261 and parameters: {'model_type': 'gat', 'hidden_dims': '[256, 128]', 'dropout': 0.3803479721709208, 'batch_norm': False, 'gat_heads': 7, 'gat_attn_dropout': 0.42588432823607364, 'gat_concat_hidden': False, 'lr': 0.0004562406438648143, 'weight_decay': 0.0001175555148257141, 'epochs': 165, 'loss': 'mse', 'optimizer': 'adam', 'graph_mode': 'cutoff', 'cutoff': 0.7880918013055521, 'grm_norm': 'cosine_then_gcn', 'self_loops': True}. Best is trial 17 with value: 0.2584227340138163.
[I 2025-10-22 12:10:13,845] Trial 54 finished with value: 0.22894257722667716 and parameters: {'model_type': 'gat', 'hidden_dims': '[512, 64]', 'dropout': 0.33342030689603136, 'batch_norm': False, 'gat_heads': 8, 'gat_attn_dropout': 0.2676741242227222, 'gat_concat_hidden': False, 'lr': 0.0002502121797859544, 'weight_decay': 0.00021261395817752393, 'epochs': 206, 'loss': 'mse', 'optimizer': 'adam', 'graph_mode': 'cutoff', 'cutoff': 0.7156005369245745, 'grm_norm': 'cosine', 'self_loops': True}. Best is trial 17 with value: 0.2584227340138163.
[I 2025-10-22 12:15:35,563] Trial 55 finished with value: 0.2521179459578117 and parameters: {'model_type': 'gat', 'hidden_dims': '[512, 64]', 'dropout': 0.4844811229773129, 'batch_norm': False, 'gat_heads': 7, 'gat_attn_dropout': 0.4687523688609014, 'gat_concat_hidden': False, 'lr': 8.923963498408062e-05, 'weight_decay': 4.81070569229582e-05, 'epochs': 145, 'loss': 'mse', 'optimizer': 'adam', 'graph_mode': 'cutoff', 'cutoff': 0.49827286244950564, 'grm_norm': 'none', 'self_loops': True}. Best is trial 17 with value: 0.2584227340138163.
[I 2025-10-22 12:18:44,684] Trial 56 finished with value: 0.21582659529437515 and parameters: {'model_type': 'gat', 'hidden_dims': '[256, 128, 64]', 'dropout': 0.47162068055203, 'batch_norm': False, 'gat_heads': 8, 'gat_attn_dropout': 0.3812090315105465, 'gat_concat_hidden': False, 'lr': 8.546423691160296e-05, 'weight_decay': 8.81110130715334e-05, 'epochs': 141, 'loss': 'mse', 'optimizer': 'adam', 'graph_mode': 'cutoff', 'cutoff': 0.4794092340499808, 'grm_norm': 'none', 'self_loops': False}. Best is trial 17 with value: 0.2584227340138163.
[I 2025-10-22 12:22:13,169] Trial 57 finished with value: 0.19044313083696016 and parameters: {'model_type': 'gat', 'hidden_dims': '[512, 64]', 'dropout': 0.5269802499288035, 'batch_norm': False, 'gat_heads': 5, 'gat_attn_dropout': 0.506029528730575, 'gat_concat_hidden': False, 'lr': 0.0003357064591653945, 'weight_decay': 3.981875868784143e-05, 'epochs': 125, 'loss': 'mse', 'optimizer': 'adam', 'graph_mode': 'cutoff', 'cutoff': 0.44725043342289383, 'grm_norm': 'none', 'self_loops': True}. Best is trial 17 with value: 0.2584227340138163.
[I 2025-10-22 12:26:25,188] Trial 58 finished with value: 0.22613761434026283 and parameters: {'model_type': 'gat', 'hidden_dims': '[512, 128]', 'dropout': 0.5173812024332782, 'batch_norm': False, 'gat_heads': 7, 'gat_attn_dropout': 0.34768618602849427, 'gat_concat_hidden': False, 'lr': 2.842109513198991e-05, 'weight_decay': 5.4761411913722186e-05, 'epochs': 107, 'loss': 'mse', 'optimizer': 'adam', 'graph_mode': 'cutoff', 'cutoff': 0.6243628516391914, 'grm_norm': 'none', 'self_loops': False}. Best is trial 17 with value: 0.2584227340138163.
[I 2025-10-22 12:31:12,830] Trial 59 finished with value: 0.2286033906299388 and parameters: {'model_type': 'gat', 'hidden_dims': '[512, 256]', 'dropout': 0.45127966897742533, 'batch_norm': False, 'gat_heads': 6, 'gat_attn_dropout': 0.5407974653715395, 'gat_concat_hidden': False, 'lr': 0.0005745484475207506, 'weight_decay': 0.0002863652745065914, 'epochs': 149, 'loss': 'mse', 'optimizer': 'adam', 'graph_mode': 'cutoff', 'cutoff': 0.4090219504205816, 'grm_norm': 'none', 'self_loops': True}. Best is trial 17 with value: 0.2584227340138163.
[I 2025-10-22 12:36:48,759] Trial 60 finished with value: 0.25350594963637485 and parameters: {'model_type': 'gat', 'hidden_dims': '[512, 64]', 'dropout': 0.49892033102278366, 'batch_norm': False, 'gat_heads': 8, 'gat_attn_dropout': 0.19764537400350657, 'gat_concat_hidden': False, 'lr': 0.00012212377367951113, 'weight_decay': 1.6869427425576233e-05, 'epochs': 129, 'loss': 'mse', 'optimizer': 'adam', 'graph_mode': 'cutoff', 'cutoff': 0.5305172898712743, 'grm_norm': 'none', 'self_loops': True}. Best is trial 17 with value: 0.2584227340138163.
[I 2025-10-22 12:40:58,116] Trial 61 finished with value: 0.2581413675846772 and parameters: {'model_type': 'gat', 'hidden_dims': '[512, 64]', 'dropout': 0.5023476677780265, 'batch_norm': False, 'gat_heads': 8, 'gat_attn_dropout': 0.17162328222272258, 'gat_concat_hidden': False, 'lr': 0.00010640037729271657, 'weight_decay': 1.727896092212043e-05, 'epochs': 92, 'loss': 'mse', 'optimizer': 'adam', 'graph_mode': 'cutoff', 'cutoff': 0.5287030228534353, 'grm_norm': 'none', 'self_loops': True}. Best is trial 17 with value: 0.2584227340138163.
[I 2025-10-22 12:44:37,278] Trial 62 finished with value: 0.26050427963988093 and parameters: {'model_type': 'gat', 'hidden_dims': '[512, 64]', 'dropout': 0.5606165343664947, 'batch_norm': False, 'gat_heads': 8, 'gat_attn_dropout': 0.1941702054730838, 'gat_concat_hidden': False, 'lr': 0.00011521213038247811, 'weight_decay': 1.7162445340530094e-05, 'epochs': 79, 'loss': 'mse', 'optimizer': 'adam', 'graph_mode': 'cutoff', 'cutoff': 0.5224911234422076, 'grm_norm': 'none', 'self_loops': True}. Best is trial 62 with value: 0.26050427963988093.
[I 2025-10-22 12:48:09,073] Trial 63 finished with value: 0.25626204861606494 and parameters: {'model_type': 'gat', 'hidden_dims': '[512, 64]', 'dropout': 0.5654540309647713, 'batch_norm': False, 'gat_heads': 8, 'gat_attn_dropout': 0.16663679360150274, 'gat_concat_hidden': False, 'lr': 0.00010642068517916003, 'weight_decay': 1.855607873625488e-05, 'epochs': 76, 'loss': 'mse', 'optimizer': 'adam', 'graph_mode': 'cutoff', 'cutoff': 0.5318332696543869, 'grm_norm': 'none', 'self_loops': True}. Best is trial 62 with value: 0.26050427963988093.
[I 2025-10-22 12:51:29,359] Trial 64 finished with value: 0.26384417785035613 and parameters: {'model_type': 'gat', 'hidden_dims': '[512, 64]', 'dropout': 0.5580958515324497, 'batch_norm': False, 'gat_heads': 8, 'gat_attn_dropout': 0.16751837109779472, 'gat_concat_hidden': False, 'lr': 6.374395553569308e-05, 'weight_decay': 1.900085766539785e-05, 'epochs': 71, 'loss': 'mse', 'optimizer': 'adam', 'graph_mode': 'cutoff', 'cutoff': 0.5174647151731322, 'grm_norm': 'none', 'self_loops': True}. Best is trial 64 with value: 0.26384417785035613.
[I 2025-10-22 12:54:52,015] Trial 65 finished with value: 0.2596357161051242 and parameters: {'model_type': 'gat', 'hidden_dims': '[512, 64]', 'dropout': 0.5605410958975194, 'batch_norm': False, 'gat_heads': 8, 'gat_attn_dropout': 0.17956592025069498, 'gat_concat_hidden': False, 'lr': 6.0066290537455704e-05, 'weight_decay': 1.692132550974158e-05, 'epochs': 72, 'loss': 'mse', 'optimizer': 'adam', 'graph_mode': 'cutoff', 'cutoff': 0.527842299765225, 'grm_norm': 'none', 'self_loops': False}. Best is trial 64 with value: 0.26384417785035613.
[I 2025-10-22 12:58:07,484] Trial 66 finished with value: 0.2505476979758619 and parameters: {'model_type': 'gat', 'hidden_dims': '[512, 64]', 'dropout': 0.5562229476136246, 'batch_norm': False, 'gat_heads': 8, 'gat_attn_dropout': 0.18286733196431615, 'gat_concat_hidden': False, 'lr': 5.024334766506576e-05, 'weight_decay': 3.0381267727306727e-05, 'epochs': 69, 'loss': 'mse', 'optimizer': 'adam', 'graph_mode': 'cutoff', 'cutoff': 0.5320548464210407, 'grm_norm': 'none', 'self_loops': True}. Best is trial 64 with value: 0.26384417785035613.
[I 2025-10-22 13:00:30,043] Trial 67 finished with value: 0.22650883920325565 and parameters: {'model_type': 'gat', 'hidden_dims': '[512, 64]', 'dropout': 0.569391238445203, 'batch_norm': False, 'gat_heads': 8, 'gat_attn_dropout': 0.19050517121059637, 'gat_concat_hidden': False, 'lr': 6.651262019790715e-05, 'weight_decay': 1.7809531239681868e-05, 'epochs': 46, 'loss': 'mse', 'optimizer': 'adam', 'graph_mode': 'cutoff', 'cutoff': 0.4643424983774871, 'grm_norm': 'none', 'self_loops': False}. Best is trial 64 with value: 0.26384417785035613.
[I 2025-10-22 13:04:35,087] Trial 68 finished with value: 0.21388854894028922 and parameters: {'model_type': 'gat', 'hidden_dims': '[512, 64]', 'dropout': 0.5051015723625369, 'batch_norm': False, 'gat_heads': 8, 'gat_attn_dropout': 0.1438897352220489, 'gat_concat_hidden': False, 'lr': 1.6714224994649467e-05, 'weight_decay': 1.005689944193271e-05, 'epochs': 89, 'loss': 'mse', 'optimizer': 'adam', 'graph_mode': 'knn', 'source': 'grm', 'knn_k': 3, 'weighted_edges': True, 'symmetrize_mode': 'mutual'}. Best is trial 64 with value: 0.26384417785035613.
[I 2025-10-22 13:08:01,099] Trial 69 finished with value: 0.2278697535940016 and parameters: {'model_type': 'gat', 'hidden_dims': '[512, 64]', 'dropout': 0.5479324946967449, 'batch_norm': True, 'gat_heads': 8, 'gat_attn_dropout': 0.20824606987085995, 'gat_concat_hidden': False, 'lr': 0.00011537434109957705, 'weight_decay': 1.1872576591023141e-05, 'epochs': 73, 'loss': 'mse', 'optimizer': 'adam', 'graph_mode': 'cutoff', 'cutoff': 0.5744864971608584, 'grm_norm': 'none', 'self_loops': True}. Best is trial 64 with value: 0.26384417785035613.
[I 2025-10-22 13:10:55,626] Trial 70 finished with value: 0.25844014614180594 and parameters: {'model_type': 'gat', 'hidden_dims': '[512, 64]', 'dropout': 0.5965342161386793, 'batch_norm': False, 'gat_heads': 8, 'gat_attn_dropout': 0.16002346260803563, 'gat_concat_hidden': False, 'lr': 3.357362109297602e-05, 'weight_decay': 2.1758710389267136e-05, 'epochs': 60, 'loss': 'mse', 'optimizer': 'adam', 'graph_mode': 'cutoff', 'cutoff': 0.5261873477893344, 'grm_norm': 'none', 'self_loops': True}. Best is trial 64 with value: 0.26384417785035613.
[I 2025-10-22 13:13:33,877] Trial 71 finished with value: 0.2581539188847143 and parameters: {'model_type': 'gat', 'hidden_dims': '[512, 64]', 'dropout': 0.590172042241925, 'batch_norm': False, 'gat_heads': 8, 'gat_attn_dropout': 0.09985345723630017, 'gat_concat_hidden': False, 'lr': 3.737448918650722e-05, 'weight_decay': 2.11449903332861e-05, 'epochs': 53, 'loss': 'mse', 'optimizer': 'adam', 'graph_mode': 'cutoff', 'cutoff': 0.5247456738212637, 'grm_norm': 'none', 'self_loops': True}. Best is trial 64 with value: 0.26384417785035613.
[I 2025-10-22 13:16:16,164] Trial 72 finished with value: 0.25480123339993466 and parameters: {'model_type': 'gat', 'hidden_dims': '[512, 64]', 'dropout': 0.5972732934497247, 'batch_norm': False, 'gat_heads': 8, 'gat_attn_dropout': 0.09569188961932457, 'gat_concat_hidden': False, 'lr': 3.235380437688715e-05, 'weight_decay': 2.128272981888962e-05, 'epochs': 55, 'loss': 'mse', 'optimizer': 'adam', 'graph_mode': 'cutoff', 'cutoff': 0.5625953170381579, 'grm_norm': 'none', 'self_loops': True}. Best is trial 64 with value: 0.26384417785035613.
[I 2025-10-22 13:19:17,302] Trial 73 finished with value: 0.2669303256570533 and parameters: {'model_type': 'gat', 'hidden_dims': '[512, 64]', 'dropout': 0.5798534807316118, 'batch_norm': False, 'gat_heads': 8, 'gat_attn_dropout': 0.1531032466797606, 'gat_concat_hidden': False, 'lr': 2.3979468405227354e-05, 'weight_decay': 2.8978240226312956e-05, 'epochs': 62, 'loss': 'mse', 'optimizer': 'adam', 'graph_mode': 'cutoff', 'cutoff': 0.437439190651926, 'grm_norm': 'none', 'self_loops': True}. Best is trial 73 with value: 0.2669303256570533.
[I 2025-10-22 13:22:16,391] Trial 74 finished with value: 0.2586924050872721 and parameters: {'model_type': 'gat', 'hidden_dims': '[512, 64]', 'dropout': 0.5804923313353231, 'batch_norm': False, 'gat_heads': 8, 'gat_attn_dropout': 0.12403930177085537, 'gat_concat_hidden': False, 'lr': 1.4854939847433008e-05, 'weight_decay': 3.571830868141134e-05, 'epochs': 61, 'loss': 'mse', 'optimizer': 'adam', 'graph_mode': 'cutoff', 'cutoff': 0.4243795152713151, 'grm_norm': 'none', 'self_loops': True}. Best is trial 73 with value: 0.2669303256570533.
[I 2025-10-22 13:23:03,456] Trial 75 finished with value: 0.25460214678899423 and parameters: {'model_type': 'gat', 'hidden_dims': '[128, 64]', 'dropout': 0.5810216986988231, 'batch_norm': False, 'gat_heads': 8, 'gat_attn_dropout': 0.09665714707093728, 'gat_concat_hidden': False, 'lr': 1.2521262690785271e-05, 'weight_decay': 4.0622415760116634e-05, 'epochs': 63, 'loss': 'mse', 'optimizer': 'adam', 'graph_mode': 'cutoff', 'cutoff': 0.37822766139262076, 'grm_norm': 'none', 'self_loops': True}. Best is trial 73 with value: 0.2669303256570533.
