[I 2025-10-22 14:53:56,180] Trial 116 finished with value: 0.2251370191466116 and parameters: {'model_type': 'gat', 'hidden_dims': '[256, 128]', 'dropout': 0.46304170534590594, 'batch_norm': False, 'gat_heads': 7, 'gat_attn_dropout': 0.10332987916210062, 'gat_concat_hidden': False, 'lr': 4.239990029420269e-05, 'weight_decay': 6.5447099317930125e-06, 'epochs': 57, 'loss': 'mse', 'optimizer': 'adam', 'graph_mode': 'cutoff', 'cutoff': 0.28421509399457784, 'grm_norm': 'none', 'self_loops': True}. Best is trial 81 with value: 0.2707388309772711.
[I 2025-10-22 14:55:02,103] Trial 117 finished with value: 0.27102647823932424 and parameters: {'model_type': 'gat', 'hidden_dims': '[256, 128]', 'dropout': 0.4414099364095796, 'batch_norm': False, 'gat_heads': 7, 'gat_attn_dropout': 0.09231179133406975, 'gat_concat_hidden': False, 'lr': 3.134363399564328e-05, 'weight_decay': 1.1036459564806592e-05, 'epochs': 50, 'loss': 'mse', 'optimizer': 'adam', 'graph_mode': 'cutoff', 'cutoff': 0.5649292398703721, 'grm_norm': 'none', 'self_loops': True}. Best is trial 117 with value: 0.27102647823932424.
[I 2025-10-22 14:56:12,381] Trial 118 finished with value: 0.23865627811639975 and parameters: {'model_type': 'gat', 'hidden_dims': '[256, 128]', 'dropout': 0.443190152663675, 'batch_norm': False, 'gat_heads': 6, 'gat_attn_dropout': 0.06715364726644821, 'gat_concat_hidden': False, 'lr': 2.275928188898874e-05, 'weight_decay': 3.5758686872778615e-06, 'epochs': 65, 'loss': 'mse', 'optimizer': 'adam', 'graph_mode': 'knn', 'source': 'grm', 'knn_k': 2, 'weighted_edges': True, 'symmetrize_mode': 'mutual'}. Best is trial 117 with value: 0.27102647823932424.
[I 2025-10-22 14:57:18,895] Trial 119 finished with value: 0.18192020444758286 and parameters: {'model_type': 'gat', 'hidden_dims': '[256, 128]', 'dropout': 0.47478472272500694, 'batch_norm': True, 'gat_heads': 7, 'gat_attn_dropout': 0.08979496995805297, 'gat_concat_hidden': False, 'lr': 2.8616626691461094e-05, 'weight_decay': 4.989929137743791e-06, 'epochs': 50, 'loss': 'mse', 'optimizer': 'adam', 'graph_mode': 'cutoff', 'cutoff': 0.6182936875428962, 'grm_norm': 'none', 'self_loops': True}. Best is trial 117 with value: 0.27102647823932424.
[I 2025-10-22 15:02:58,783] Trial 120 finished with value: 0.22500895171078744 and parameters: {'model_type': 'gat', 'hidden_dims': '[256, 128]', 'dropout': 0.43272608222164205, 'batch_norm': False, 'gat_heads': 7, 'gat_attn_dropout': 0.04338246006787509, 'gat_concat_hidden': False, 'lr': 5.303522804407194e-05, 'weight_decay': 9.983365406163107e-06, 'epochs': 321, 'loss': 'mse', 'optimizer': 'adam', 'graph_mode': 'cutoff', 'cutoff': 0.5745214157410323, 'grm_norm': 'none', 'self_loops': True}. Best is trial 117 with value: 0.27102647823932424.
[I 2025-10-22 15:03:55,696] Trial 121 finished with value: 0.25178766432213134 and parameters: {'model_type': 'gat', 'hidden_dims': '[256, 128]', 'dropout': 0.49592381784255113, 'batch_norm': False, 'gat_heads': 7, 'gat_attn_dropout': 0.1114322010871715, 'gat_concat_hidden': False, 'lr': 3.703826623695218e-05, 'weight_decay': 1.18208752087581e-05, 'epochs': 41, 'loss': 'mse', 'optimizer': 'adam', 'graph_mode': 'cutoff', 'cutoff': 0.5183905071973315, 'grm_norm': 'none', 'self_loops': True}. Best is trial 117 with value: 0.27102647823932424.
[I 2025-10-22 15:05:06,670] Trial 122 finished with value: 0.25969772477542463 and parameters: {'model_type': 'gat', 'hidden_dims': '[256, 128]', 'dropout': 0.459613363295728, 'batch_norm': False, 'gat_heads': 7, 'gat_attn_dropout': 0.14543107943992653, 'gat_concat_hidden': False, 'lr': 1.9527786606205354e-05, 'weight_decay': 8.568147470372873e-06, 'epochs': 55, 'loss': 'mse', 'optimizer': 'adam', 'graph_mode': 'cutoff', 'cutoff': 0.5426632746219093, 'grm_norm': 'none', 'self_loops': True}. Best is trial 117 with value: 0.27102647823932424.
[I 2025-10-22 15:06:12,953] Trial 123 finished with value: 0.2571351662895073 and parameters: {'model_type': 'gat', 'hidden_dims': '[256, 128]', 'dropout': 0.5174467104821144, 'batch_norm': False, 'gat_heads': 7, 'gat_attn_dropout': 0.131671751969224, 'gat_concat_hidden': False, 'lr': 4.3488187177347956e-05, 'weight_decay': 1.4814030066705179e-05, 'epochs': 50, 'loss': 'mse', 'optimizer': 'adam', 'graph_mode': 'cutoff', 'cutoff': 0.5021537336098972, 'grm_norm': 'none', 'self_loops': True}. Best is trial 117 with value: 0.27102647823932424.
[I 2025-10-22 15:07:45,689] Trial 124 finished with value: 0.23870009010789817 and parameters: {'model_type': 'gat', 'hidden_dims': '[256, 128]', 'dropout': 0.4778915446638, 'batch_norm': False, 'gat_heads': 7, 'gat_attn_dropout': 0.1713445862509352, 'gat_concat_hidden': False, 'lr': 3.1345227583806976e-05, 'weight_decay': 6.627618498572164e-06, 'epochs': 75, 'loss': 'mse', 'optimizer': 'adam', 'graph_mode': 'cutoff', 'cutoff': 0.469369138985037, 'grm_norm': 'none', 'self_loops': True}. Best is trial 117 with value: 0.27102647823932424.
[I 2025-10-22 15:08:59,514] Trial 125 finished with value: 0.24403431781066404 and parameters: {'model_type': 'gat', 'hidden_dims': '[256, 128]', 'dropout': 0.5097388595679013, 'batch_norm': False, 'gat_heads': 7, 'gat_attn_dropout': 0.1506213889892655, 'gat_concat_hidden': False, 'lr': 3.5687104532579985e-05, 'weight_decay': 1.995987893457095e-05, 'epochs': 58, 'loss': 'mse', 'optimizer': 'adam', 'graph_mode': 'cutoff', 'cutoff': 0.6067548991879578, 'grm_norm': 'none', 'self_loops': True}. Best is trial 117 with value: 0.27102647823932424.
[I 2025-10-22 15:10:10,693] Trial 126 finished with value: 0.2515747263543412 and parameters: {'model_type': 'gat', 'hidden_dims': '[256, 128]', 'dropout': 0.46967076861274637, 'batch_norm': False, 'gat_heads': 6, 'gat_attn_dropout': 0.09932884287908866, 'gat_concat_hidden': False, 'lr': 6.629602822740753e-05, 'weight_decay': 1.0928424353786264e-05, 'epochs': 65, 'loss': 'mse', 'optimizer': 'adam', 'graph_mode': 'cutoff', 'cutoff': 0.5598660297400576, 'grm_norm': 'none', 'self_loops': True}. Best is trial 117 with value: 0.27102647823932424.
[I 2025-10-22 15:11:11,993] Trial 127 finished with value: 0.2594985529297378 and parameters: {'model_type': 'gat', 'hidden_dims': '[256, 128]', 'dropout': 0.4056211142083235, 'batch_norm': False, 'gat_heads': 7, 'gat_attn_dropout': 0.11309939768922836, 'gat_concat_hidden': False, 'lr': 2.6805193168112536e-05, 'weight_decay': 1.3897095818512427e-05, 'epochs': 45, 'loss': 'mse', 'optimizer': 'adam', 'graph_mode': 'cutoff', 'cutoff': 0.5120127888709121, 'grm_norm': 'none', 'self_loops': True}. Best is trial 117 with value: 0.27102647823932424.
[I 2025-10-22 15:12:34,035] Trial 128 finished with value: 0.24994439745942643 and parameters: {'model_type': 'gat', 'hidden_dims': '[256, 128]', 'dropout': 0.5330152908543818, 'batch_norm': False, 'gat_heads': 8, 'gat_attn_dropout': 0.052769931114580906, 'gat_concat_hidden': False, 'lr': 5.602063707925866e-05, 'weight_decay': 8.149607126636528e-06, 'epochs': 54, 'loss': 'mse', 'optimizer': 'adam', 'graph_mode': 'cutoff', 'cutoff': 0.48847208435610995, 'grm_norm': 'none', 'self_loops': True}. Best is trial 117 with value: 0.27102647823932424.
[I 2025-10-22 15:14:02,283] Trial 129 finished with value: 0.25044980501379904 and parameters: {'model_type': 'gat', 'hidden_dims': '[256, 128]', 'dropout': 0.4393089332972163, 'batch_norm': False, 'gat_heads': 7, 'gat_attn_dropout': 0.024049552151181874, 'gat_concat_hidden': False, 'lr': 2.2197059742698013e-05, 'weight_decay': 3.0295270338454405e-05, 'epochs': 72, 'loss': 'mse', 'optimizer': 'adam', 'graph_mode': 'cutoff', 'cutoff': 0.5821448470810154, 'grm_norm': 'none', 'self_loops': True}. Best is trial 117 with value: 0.27102647823932424.
[I 2025-10-22 15:16:01,699] Trial 130 finished with value: 0.24012344394867427 and parameters: {'model_type': 'gat', 'hidden_dims': '[256, 128]', 'dropout': 0.4914132389911766, 'batch_norm': False, 'gat_heads': 8, 'gat_attn_dropout': 0.08112987450183491, 'gat_concat_hidden': False, 'lr': 4.5448962316294524e-05, 'weight_decay': 1.5100796421650252e-05, 'epochs': 86, 'loss': 'mse', 'optimizer': 'adam', 'graph_mode': 'cutoff', 'cutoff': 0.5383494927987627, 'grm_norm': 'none', 'self_loops': True}. Best is trial 117 with value: 0.27102647823932424.
[I 2025-10-22 15:17:54,184] Trial 131 finished with value: 0.2612642552578622 and parameters: {'model_type': 'gat', 'hidden_dims': '[256, 128]', 'dropout': 0.5228870427631107, 'batch_norm': False, 'gat_heads': 8, 'gat_attn_dropout': 0.133039623660456, 'gat_concat_hidden': False, 'lr': 3.172692778148276e-05, 'weight_decay': 2.0669686955299196e-05, 'epochs': 80, 'loss': 'mse', 'optimizer': 'adam', 'graph_mode': 'cutoff', 'cutoff': 0.5172295616564091, 'grm_norm': 'none', 'self_loops': True}. Best is trial 117 with value: 0.27102647823932424.
[I 2025-10-22 15:19:45,446] Trial 132 finished with value: 0.25984158184321543 and parameters: {'model_type': 'gat', 'hidden_dims': '[256, 128]', 'dropout': 0.5204524884324139, 'batch_norm': False, 'gat_heads': 8, 'gat_attn_dropout': 0.13603289963046855, 'gat_concat_hidden': False, 'lr': 3.120976659392253e-05, 'weight_decay': 1.0078004854783392e-07, 'epochs': 79, 'loss': 'mse', 'optimizer': 'adam', 'graph_mode': 'cutoff', 'cutoff': 0.5129369415186822, 'grm_norm': 'none', 'self_loops': True}. Best is trial 117 with value: 0.27102647823932424.
[I 2025-10-22 15:21:14,856] Trial 133 finished with value: 0.2632907329645839 and parameters: {'model_type': 'gat', 'hidden_dims': '[256, 128]', 'dropout': 0.5065528203050372, 'batch_norm': False, 'gat_heads': 8, 'gat_attn_dropout': 0.12456733604753195, 'gat_concat_hidden': False, 'lr': 4.0677079429985176e-05, 'weight_decay': 2.32614605073876e-05, 'epochs': 61, 'loss': 'mse', 'optimizer': 'adam', 'graph_mode': 'cutoff', 'cutoff': 0.564959323440696, 'grm_norm': 'none', 'self_loops': True}. Best is trial 117 with value: 0.27102647823932424.
[I 2025-10-22 15:22:46,660] Trial 134 finished with value: 0.26356984257917726 and parameters: {'model_type': 'gat', 'hidden_dims': '[256, 128]', 'dropout': 0.5070914443480996, 'batch_norm': False, 'gat_heads': 8, 'gat_attn_dropout': 0.11930879609476885, 'gat_concat_hidden': False, 'lr': 3.2672857009939436e-05, 'weight_decay': 2.4294331977058045e-05, 'epochs': 63, 'loss': 'mse', 'optimizer': 'adam', 'graph_mode': 'cutoff', 'cutoff': 0.562323535348301, 'grm_norm': 'none', 'self_loops': True}. Best is trial 117 with value: 0.27102647823932424.
[I 2025-10-22 15:25:49,047] Trial 135 finished with value: 0.25142084734866577 and parameters: {'model_type': 'gat', 'hidden_dims': '[512, 256]', 'dropout': 0.51129539341209, 'batch_norm': False, 'gat_heads': 8, 'gat_attn_dropout': 0.09791154142211052, 'gat_concat_hidden': False, 'lr': 2.5830782116631704e-05, 'weight_decay': 2.4512717222138317e-05, 'epochs': 63, 'loss': 'mse', 'optimizer': 'adam', 'graph_mode': 'cutoff', 'cutoff': 0.5662453370008065, 'grm_norm': 'none', 'self_loops': True}. Best is trial 117 with value: 0.27102647823932424.
[I 2025-10-22 15:26:53,351] Trial 136 finished with value: 0.25893316750755624 and parameters: {'model_type': 'gat', 'hidden_dims': '[256, 128]', 'dropout': 0.502656149535118, 'batch_norm': False, 'gat_heads': 8, 'gat_attn_dropout': 0.12086540843122281, 'gat_concat_hidden': False, 'lr': 4.047848545470946e-05, 'weight_decay': 4.4825798259877536e-05, 'epochs': 40, 'loss': 'mse', 'optimizer': 'adam', 'graph_mode': 'cutoff', 'cutoff': 0.6067607755565999, 'grm_norm': 'none', 'self_loops': True}. Best is trial 117 with value: 0.27102647823932424.
[I 2025-10-22 15:27:35,810] Trial 137 finished with value: 0.2619452731415376 and parameters: {'model_type': 'gat', 'hidden_dims': '[128, 64]', 'dropout': 0.5385504814730112, 'batch_norm': False, 'gat_heads': 8, 'gat_attn_dropout': 0.07156206410243895, 'gat_concat_hidden': False, 'lr': 4.72894722683112e-05, 'weight_decay': 3.362008194379273e-05, 'epochs': 57, 'loss': 'mse', 'optimizer': 'adam', 'graph_mode': 'cutoff', 'cutoff': 0.555076111865586, 'grm_norm': 'none', 'self_loops': True}. Best is trial 117 with value: 0.27102647823932424.
[I 2025-10-22 15:29:15,541] Trial 138 finished with value: 0.21138014740273597 and parameters: {'model_type': 'gat', 'hidden_dims': '[256, 128]', 'dropout': 0.4663009943268174, 'batch_norm': False, 'gat_heads': 8, 'gat_attn_dropout': 0.11426474235353669, 'gat_concat_hidden': False, 'lr': 5.434759758852023e-05, 'weight_decay': 2.039485167296201e-06, 'epochs': 68, 'loss': 'mse', 'optimizer': 'adam', 'graph_mode': 'knn', 'source': 'grm', 'knn_k': 5, 'weighted_edges': False, 'symmetrize_mode': 'mutual'}. Best is trial 117 with value: 0.27102647823932424.
[I 2025-10-22 15:31:20,814] Trial 139 finished with value: 0.19922972570858524 and parameters: {'model_type': 'gat', 'hidden_dims': '[256, 128]', 'dropout': 0.5042960730752423, 'batch_norm': True, 'gat_heads': 8, 'gat_attn_dropout': 0.16406255071408699, 'gat_concat_hidden': False, 'lr': 7.809795476555852e-05, 'weight_decay': 4.0963808705569945e-05, 'epochs': 90, 'loss': 'mse', 'optimizer': 'adam', 'graph_mode': 'cutoff', 'cutoff': 0.5377130406529759, 'grm_norm': 'none', 'self_loops': True}. Best is trial 117 with value: 0.27102647823932424.
[I 2025-10-22 15:32:48,332] Trial 140 finished with value: 0.2571640001056708 and parameters: {'model_type': 'gat', 'hidden_dims': '[256, 128, 64]', 'dropout': 0.530022163441561, 'batch_norm': False, 'gat_heads': 8, 'gat_attn_dropout': 0.0949230283543537, 'gat_concat_hidden': False, 'lr': 2.5195641218630197e-05, 'weight_decay': 2.6883489847723575e-05, 'epochs': 59, 'loss': 'mse', 'optimizer': 'adam', 'graph_mode': 'cutoff', 'cutoff': 0.6352150522282498, 'grm_norm': 'none', 'self_loops': True}. Best is trial 117 with value: 0.27102647823932424.
[I 2025-10-22 15:33:29,557] Trial 141 finished with value: 0.2536642490511421 and parameters: {'model_type': 'gat', 'hidden_dims': '[128, 64]', 'dropout': 0.5424394243048433, 'batch_norm': False, 'gat_heads': 8, 'gat_attn_dropout': 0.06809368966854405, 'gat_concat_hidden': False, 'lr': 4.9262296976762e-05, 'weight_decay': 3.212676203579128e-05, 'epochs': 55, 'loss': 'mse', 'optimizer': 'adam', 'graph_mode': 'cutoff', 'cutoff': 0.5587158265637301, 'grm_norm': 'none', 'self_loops': True}. Best is trial 117 with value: 0.27102647823932424.
[I 2025-10-22 15:34:20,154] Trial 142 finished with value: 0.24998984538339478 and parameters: {'model_type': 'gat', 'hidden_dims': '[128, 64]', 'dropout': 0.5524418269583102, 'batch_norm': False, 'gat_heads': 8, 'gat_attn_dropout': 0.07987019438910685, 'gat_concat_hidden': False, 'lr': 6.528008851060634e-05, 'weight_decay': 1.8878944109617048e-05, 'epochs': 71, 'loss': 'mse', 'optimizer': 'adam', 'graph_mode': 'cutoff', 'cutoff': 0.5461511235018633, 'grm_norm': 'none', 'self_loops': True}. Best is trial 117 with value: 0.27102647823932424.
[I 2025-10-22 15:34:57,946] Trial 143 finished with value: 0.25736446855212913 and parameters: {'model_type': 'gat', 'hidden_dims': '[128, 64]', 'dropout': 0.5707439785000354, 'batch_norm': False, 'gat_heads': 8, 'gat_attn_dropout': 0.10622412296378975, 'gat_concat_hidden': False, 'lr': 3.2888521805550037e-05, 'weight_decay': 2.3453336074807202e-05, 'epochs': 49, 'loss': 'mse', 'optimizer': 'adam', 'graph_mode': 'cutoff', 'cutoff': 0.5897625450755921, 'grm_norm': 'none', 'self_loops': True}. Best is trial 117 with value: 0.27102647823932424.
[I 2025-10-22 15:35:43,941] Trial 144 finished with value: 0.07453381296689984 and parameters: {'model_type': 'gat', 'hidden_dims': '[128, 64]', 'dropout': 0.5406014059367751, 'batch_norm': False, 'gat_heads': 8, 'gat_attn_dropout': 0.128111776176655, 'gat_concat_hidden': False, 'lr': 1.056979515736987e-06, 'weight_decay': 3.588444446086024e-05, 'epochs': 63, 'loss': 'mse', 'optimizer': 'adam', 'graph_mode': 'cutoff', 'cutoff': 0.5753253896236167, 'grm_norm': 'none', 'self_loops': True}. Best is trial 117 with value: 0.27102647823932424.
[I 2025-10-22 15:36:26,190] Trial 145 finished with value: 0.26402097030592053 and parameters: {'model_type': 'gat', 'hidden_dims': '[128, 64]', 'dropout': 0.5273911032958266, 'batch_norm': False, 'gat_heads': 8, 'gat_attn_dropout': 0.1479610101752426, 'gat_concat_hidden': False, 'lr': 4.252006890698741e-05, 'weight_decay': 5.023496137484858e-05, 'epochs': 56, 'loss': 'mse', 'optimizer': 'adam', 'graph_mode': 'cutoff', 'cutoff': 0.4971128421925825, 'grm_norm': 'none', 'self_loops': True}. Best is trial 117 with value: 0.27102647823932424.
[I 2025-10-22 15:38:13,469] Trial 146 finished with value: 0.24112026307528595 and parameters: {'model_type': 'gat', 'hidden_dims': '[256, 128]', 'dropout': 0.5138539494765341, 'batch_norm': False, 'gat_heads': 8, 'gat_attn_dropout': 0.15196088043722783, 'gat_concat_hidden': False, 'lr': 3.897995216979424e-05, 'weight_decay': 1.7045708610271223e-05, 'epochs': 75, 'loss': 'mse', 'optimizer': 'adam', 'graph_mode': 'cutoff', 'cutoff': 0.48462001193745086, 'grm_norm': 'none', 'self_loops': True}. Best is trial 117 with value: 0.27102647823932424.
[I 2025-10-22 15:39:24,082] Trial 147 finished with value: 0.25010757867522504 and parameters: {'model_type': 'gat', 'hidden_dims': '[256, 128]', 'dropout': 0.49742244277791303, 'batch_norm': False, 'gat_heads': 8, 'gat_attn_dropout': 0.14747554299266913, 'gat_concat_hidden': False, 'lr': 1.810379485657485e-05, 'weight_decay': 4.983064260143094e-05, 'epochs': 44, 'loss': 'mse', 'optimizer': 'adam', 'graph_mode': 'cutoff', 'cutoff': 0.45458825943713344, 'grm_norm': 'none', 'self_loops': True}. Best is trial 117 with value: 0.27102647823932424.
[I 2025-10-22 15:39:45,828] Trial 148 finished with value: 0.26357404825117847 and parameters: {'model_type': 'gat', 'hidden_dims': '[256, 128]', 'dropout': 0.47633190827378363, 'batch_norm': False, 'gat_heads': 2, 'gat_attn_dropout': 0.1902866263076577, 'gat_concat_hidden': False, 'lr': 4.2284076874402396e-05, 'weight_decay': 1.1519648990741045e-05, 'epochs': 52, 'loss': 'mse', 'optimizer': 'adam', 'graph_mode': 'cutoff', 'cutoff': 0.49944409491851033, 'grm_norm': 'none', 'self_loops': True}. Best is trial 117 with value: 0.27102647823932424.
[I 2025-10-22 15:40:04,788] Trial 149 finished with value: 0.23270091379461855 and parameters: {'model_type': 'gat', 'hidden_dims': '[128, 64]', 'dropout': 0.48082742146757923, 'batch_norm': False, 'gat_heads': 3, 'gat_attn_dropout': 0.17092747995701504, 'gat_concat_hidden': False, 'lr': 4.341423212603393e-05, 'weight_decay': 1.1407143232952367e-05, 'epochs': 55, 'loss': 'mse', 'optimizer': 'adam', 'graph_mode': 'cutoff', 'cutoff': 0.49361710670165504, 'grm_norm': 'none', 'self_loops': True}. Best is trial 117 with value: 0.27102647823932424.
[I 2025-10-22 15:40:39,331] Trial 0 finished with value: 0.13686889544500777 and parameters: {'model_type': 'gat', 'hidden_dims': '[128, 64]', 'dropout': 0.199031432379812, 'batch_norm': True, 'gat_heads': 1, 'gat_attn_dropout': 0.41121589102067835, 'gat_concat_hidden': True, 'lr': 3.4401453323286906e-05, 'weight_decay': 0.00017802616915745114, 'epochs': 230, 'loss': 'mse', 'optimizer': 'adam', 'graph_mode': 'knn', 'source': 'grm', 'knn_k': 6, 'weighted_edges': True, 'symmetrize_mode': 'mutual'}. Best is trial 0 with value: 0.13686889544500777.
[I 2025-10-22 15:41:52,011] Trial 1 finished with value: 0.16423814249689545 and parameters: {'model_type': 'gat', 'hidden_dims': '[512, 64]', 'dropout': 0.36082357619681704, 'batch_norm': True, 'gat_heads': 1, 'gat_attn_dropout': 0.18042003398172202, 'gat_concat_hidden': False, 'lr': 1.3825758230956745e-06, 'weight_decay': 3.199989794411411e-05, 'epochs': 210, 'loss': 'mse', 'optimizer': 'adam', 'graph_mode': 'knn', 'source': 'grm', 'knn_k': 8, 'weighted_edges': True, 'symmetrize_mode': 'mutual'}. Best is trial 1 with value: 0.16423814249689545.
[I 2025-10-22 15:44:23,224] Trial 2 finished with value: 0.17308616320526288 and parameters: {'model_type': 'gat', 'hidden_dims': '[512, 64]', 'dropout': 0.5938127374509361, 'batch_norm': False, 'gat_heads': 3, 'gat_attn_dropout': 0.3584229889385306, 'gat_concat_hidden': True, 'lr': 5.8966328690006356e-05, 'weight_decay': 1.4359095002909625e-07, 'epochs': 151, 'loss': 'mae', 'optimizer': 'adam', 'graph_mode': 'cutoff', 'cutoff': 0.22797144608298409, 'grm_norm': 'none', 'self_loops': False}. Best is trial 2 with value: 0.17308616320526288.
[I 2025-10-22 15:45:00,686] Trial 3 finished with value: 0.1708461279512669 and parameters: {'model_type': 'gat', 'hidden_dims': '[256, 128]', 'dropout': 0.23110783056597514, 'batch_norm': True, 'gat_heads': 3, 'gat_attn_dropout': 0.14524552524211642, 'gat_concat_hidden': False, 'lr': 2.6631568299397822e-05, 'weight_decay': 1.4831733219640837e-06, 'epochs': 59, 'loss': 'mse', 'optimizer': 'adam', 'graph_mode': 'cutoff', 'cutoff': 0.5085416774304665, 'grm_norm': 'cosine_then_gcn', 'self_loops': False}. Best is trial 2 with value: 0.17308616320526288.
[I 2025-10-22 15:45:32,255] Trial 4 finished with value: 0.11442597514420197 and parameters: {'model_type': 'gat', 'hidden_dims': '[128, 64]', 'dropout': 0.24986493621228142, 'batch_norm': False, 'gat_heads': 2, 'gat_attn_dropout': 0.03028660209239857, 'gat_concat_hidden': True, 'lr': 3.4411882055364858e-06, 'weight_decay': 0.00034938832175517785, 'epochs': 153, 'loss': 'mae', 'optimizer': 'adam', 'graph_mode': 'cutoff', 'cutoff': 0.5288497054083461, 'grm_norm': 'cosine_then_gcn', 'self_loops': False}. Best is trial 2 with value: 0.17308616320526288.
[I 2025-10-22 15:46:55,646] Trial 5 finished with value: 0.1664681318398158 and parameters: {'model_type': 'gat', 'hidden_dims': '[256, 128, 64]', 'dropout': 0.3667354424945013, 'batch_norm': False, 'gat_heads': 5, 'gat_attn_dropout': 0.47505419776597435, 'gat_concat_hidden': False, 'lr': 5.6570170227139244e-05, 'weight_decay': 6.845407486393404e-05, 'epochs': 86, 'loss': 'mae', 'optimizer': 'adam', 'graph_mode': 'cutoff', 'cutoff': 0.3163415033931736, 'grm_norm': 'cosine', 'self_loops': False}. Best is trial 2 with value: 0.17308616320526288.
