[I 2025-10-22 06:48:05,934] Trial 107 finished with value: 0.2569520110311566 and parameters: {'model_type': 'gat', 'hidden_dims': '[512, 128]', 'dropout': 0.3374677632171237, 'batch_norm': False, 'gat_heads': 4, 'gat_attn_dropout': 0.17677438826090625, 'gat_concat_hidden': False, 'lr': 0.00037173068011070936, 'weight_decay': 2.806461198232381e-06, 'epochs': 68, 'loss': 'mae', 'optimizer': 'adam', 'graph_mode': 'cutoff', 'cutoff': 0.7934645663827361, 'grm_norm': 'gcn', 'self_loops': False}. Best is trial 107 with value: 0.2569520110311566.
[I 2025-10-22 06:48:53,977] Trial 108 finished with value: 0.21767155779680256 and parameters: {'model_type': 'gat', 'hidden_dims': '[256, 128]', 'dropout': 0.3814707174262194, 'batch_norm': False, 'gat_heads': 4, 'gat_attn_dropout': 0.17196066838921317, 'gat_concat_hidden': False, 'lr': 0.0003615091564447416, 'weight_decay': 2.7283974107037744e-06, 'epochs': 68, 'loss': 'mse', 'optimizer': 'adam', 'graph_mode': 'cutoff', 'cutoff': 0.8827399403505634, 'grm_norm': 'gcn', 'self_loops': False}. Best is trial 107 with value: 0.2569520110311566.
[I 2025-10-22 06:51:01,135] Trial 109 finished with value: 0.24381307413529543 and parameters: {'model_type': 'gat', 'hidden_dims': '[512, 128]', 'dropout': 0.33786831623987834, 'batch_norm': False, 'gat_heads': 4, 'gat_attn_dropout': 0.2336645900699526, 'gat_concat_hidden': False, 'lr': 0.00031191305434977233, 'weight_decay': 4.54524263297958e-06, 'epochs': 94, 'loss': 'mae', 'optimizer': 'adam', 'graph_mode': 'cutoff', 'cutoff': 0.7910577797075466, 'grm_norm': 'gcn', 'self_loops': False}. Best is trial 107 with value: 0.2569520110311566.
[I 2025-10-22 06:52:26,090] Trial 110 finished with value: 0.2231104701418909 and parameters: {'model_type': 'gat', 'hidden_dims': '[512, 64]', 'dropout': 0.4435494289965609, 'batch_norm': False, 'gat_heads': 4, 'gat_attn_dropout': 0.2708885515167798, 'gat_concat_hidden': False, 'lr': 0.00020771479119651196, 'weight_decay': 1.2284576783968819e-05, 'epochs': 58, 'loss': 'mae', 'optimizer': 'adam', 'graph_mode': 'cutoff', 'cutoff': 0.735408563779814, 'grm_norm': 'gcn', 'self_loops': False}. Best is trial 107 with value: 0.2569520110311566.
[I 2025-10-22 06:54:08,232] Trial 111 finished with value: 0.20632571527457877 and parameters: {'model_type': 'gat', 'hidden_dims': '[512, 128]', 'dropout': 0.31201757446533734, 'batch_norm': False, 'gat_heads': 3, 'gat_attn_dropout': 0.20388686558686173, 'gat_concat_hidden': False, 'lr': 2.5777303415357676e-06, 'weight_decay': 3.528505975586896e-06, 'epochs': 103, 'loss': 'mae', 'optimizer': 'adam', 'graph_mode': 'cutoff', 'cutoff': 0.8406870131566858, 'grm_norm': 'gcn', 'self_loops': False}. Best is trial 107 with value: 0.2569520110311566.
[I 2025-10-22 06:56:00,772] Trial 112 finished with value: 0.24473081079696005 and parameters: {'model_type': 'gat', 'hidden_dims': '[512, 128]', 'dropout': 0.29446347147695234, 'batch_norm': False, 'gat_heads': 4, 'gat_attn_dropout': 0.17987158763325728, 'gat_concat_hidden': False, 'lr': 0.00042924606566176323, 'weight_decay': 7.832357641942256e-06, 'epochs': 83, 'loss': 'mae', 'optimizer': 'adam', 'graph_mode': 'cutoff', 'cutoff': 0.8649007903543576, 'grm_norm': 'cosine_then_gcn', 'self_loops': False}. Best is trial 107 with value: 0.2569520110311566.
[I 2025-10-22 06:57:49,693] Trial 113 finished with value: 0.22480805702393614 and parameters: {'model_type': 'gat', 'hidden_dims': '[512, 128]', 'dropout': 0.28314972467941907, 'batch_norm': False, 'gat_heads': 4, 'gat_attn_dropout': 0.17688521927793627, 'gat_concat_hidden': False, 'lr': 0.000372539811272074, 'weight_decay': 8.122560360685977e-06, 'epochs': 80, 'loss': 'mae', 'optimizer': 'adam', 'graph_mode': 'cutoff', 'cutoff': 0.8574908992475113, 'grm_norm': 'cosine_then_gcn', 'self_loops': False}. Best is trial 107 with value: 0.2569520110311566.
[I 2025-10-22 06:59:21,312] Trial 114 finished with value: 0.24047791999757867 and parameters: {'model_type': 'gat', 'hidden_dims': '[512, 128]', 'dropout': 0.29891085428406644, 'batch_norm': False, 'gat_heads': 4, 'gat_attn_dropout': 0.216941338117801, 'gat_concat_hidden': False, 'lr': 0.00042982839581910323, 'weight_decay': 5.433371114220943e-06, 'epochs': 65, 'loss': 'mae', 'optimizer': 'adam', 'graph_mode': 'cutoff', 'cutoff': 0.8630429719803087, 'grm_norm': 'cosine_then_gcn', 'self_loops': False}. Best is trial 107 with value: 0.2569520110311566.
[I 2025-10-22 07:01:15,976] Trial 115 finished with value: 0.23634308602817206 and parameters: {'model_type': 'gat', 'hidden_dims': '[512, 128]', 'dropout': 0.36201098675159726, 'batch_norm': False, 'gat_heads': 4, 'gat_attn_dropout': 0.1977338902785159, 'gat_concat_hidden': False, 'lr': 0.00023616353955348854, 'weight_decay': 9.913946213461607e-06, 'epochs': 85, 'loss': 'mae', 'optimizer': 'adam', 'graph_mode': 'cutoff', 'cutoff': 0.8764423235914225, 'grm_norm': 'cosine_then_gcn', 'self_loops': False}. Best is trial 107 with value: 0.2569520110311566.
[I 2025-10-22 07:02:34,576] Trial 116 finished with value: 0.22735186334669027 and parameters: {'model_type': 'gat', 'hidden_dims': '[512, 128]', 'dropout': 0.4597739119642139, 'batch_norm': False, 'gat_heads': 3, 'gat_attn_dropout': 0.2506035954472078, 'gat_concat_hidden': False, 'lr': 0.000271946889728186, 'weight_decay': 7.003354127069443e-06, 'epochs': 75, 'loss': 'mae', 'optimizer': 'adam', 'graph_mode': 'knn', 'source': 'grm', 'knn_k': 2, 'weighted_edges': True, 'symmetrize_mode': 'mutual'}. Best is trial 107 with value: 0.2569520110311566.
[I 2025-10-22 07:03:37,612] Trial 117 finished with value: 0.23471198177839728 and parameters: {'model_type': 'gat', 'hidden_dims': '[512, 128]', 'dropout': 0.410033470725564, 'batch_norm': False, 'gat_heads': 3, 'gat_attn_dropout': 0.29168749568254726, 'gat_concat_hidden': False, 'lr': 0.0003292015204659557, 'weight_decay': 1.4158769252422873e-05, 'epochs': 59, 'loss': 'mae', 'optimizer': 'adam', 'graph_mode': 'cutoff', 'cutoff': 0.8257309182985131, 'grm_norm': 'cosine_then_gcn', 'self_loops': False}. Best is trial 107 with value: 0.2569520110311566.
[I 2025-10-22 07:05:47,610] Trial 118 finished with value: 0.24153661763773293 and parameters: {'model_type': 'gat', 'hidden_dims': '[512, 128]', 'dropout': 0.26449186410532294, 'batch_norm': False, 'gat_heads': 4, 'gat_attn_dropout': 0.18474965898297463, 'gat_concat_hidden': False, 'lr': 0.00015756760736842092, 'weight_decay': 1.8257134068261784e-06, 'epochs': 98, 'loss': 'mae', 'optimizer': 'adam', 'graph_mode': 'cutoff', 'cutoff': 0.8388442941720595, 'grm_norm': 'cosine_then_gcn', 'self_loops': False}. Best is trial 107 with value: 0.2569520110311566.
[I 2025-10-22 07:07:00,973] Trial 119 finished with value: 0.09423909109547457 and parameters: {'model_type': 'gat', 'hidden_dims': '[512, 128]', 'dropout': 0.3736377415827995, 'batch_norm': False, 'gat_heads': 4, 'gat_attn_dropout': 0.24045492343216737, 'gat_concat_hidden': False, 'lr': 0.0007408762631383889, 'weight_decay': 9.056919515667989e-07, 'epochs': 49, 'loss': 'mae', 'optimizer': 'adam', 'graph_mode': 'cutoff', 'cutoff': 0.8091265816819001, 'grm_norm': 'cosine_then_gcn', 'self_loops': False}. Best is trial 107 with value: 0.2569520110311566.
[I 2025-10-22 07:07:51,356] Trial 120 finished with value: 0.23203166497742692 and parameters: {'model_type': 'gat', 'hidden_dims': '[128, 64]', 'dropout': 0.4279207506646325, 'batch_norm': False, 'gat_heads': 5, 'gat_attn_dropout': 0.1674008152389343, 'gat_concat_hidden': False, 'lr': 0.0003811317834835221, 'weight_decay': 3.1855572161023392e-06, 'epochs': 107, 'loss': 'mae', 'optimizer': 'adam', 'graph_mode': 'cutoff', 'cutoff': 0.8682865028249609, 'grm_norm': 'cosine_then_gcn', 'self_loops': False}. Best is trial 107 with value: 0.2569520110311566.
[I 2025-10-22 07:09:46,528] Trial 121 finished with value: 0.23413652807596264 and parameters: {'model_type': 'gat', 'hidden_dims': '[512, 128]', 'dropout': 0.3148943355412185, 'batch_norm': False, 'gat_heads': 3, 'gat_attn_dropout': 0.14971083481321984, 'gat_concat_hidden': False, 'lr': 0.0005138192850234042, 'weight_decay': 2.3280732964623956e-06, 'epochs': 120, 'loss': 'mae', 'optimizer': 'adam', 'graph_mode': 'cutoff', 'cutoff': 0.8491922165993219, 'grm_norm': 'none', 'self_loops': False}. Best is trial 107 with value: 0.2569520110311566.
[I 2025-10-22 07:12:36,787] Trial 122 finished with value: 0.24167557737129536 and parameters: {'model_type': 'gat', 'hidden_dims': '[512, 128]', 'dropout': 0.3276812382794383, 'batch_norm': False, 'gat_heads': 4, 'gat_attn_dropout': 0.13510573468300852, 'gat_concat_hidden': False, 'lr': 0.000560155294102502, 'weight_decay': 6.784383324200487e-07, 'epochs': 133, 'loss': 'mae', 'optimizer': 'adam', 'graph_mode': 'cutoff', 'cutoff': 0.8860853030881894, 'grm_norm': 'none', 'self_loops': False}. Best is trial 107 with value: 0.2569520110311566.
[I 2025-10-22 07:13:26,766] Trial 123 finished with value: 0.24400046780051682 and parameters: {'model_type': 'gat', 'hidden_dims': '[512, 128]', 'dropout': 0.34789548685813937, 'batch_norm': False, 'gat_heads': 2, 'gat_attn_dropout': 0.20819782458411132, 'gat_concat_hidden': False, 'lr': 0.00044007194097068066, 'weight_decay': 4.261723011452931e-06, 'epochs': 71, 'loss': 'mae', 'optimizer': 'adam', 'graph_mode': 'cutoff', 'cutoff': 0.800118333133955, 'grm_norm': 'none', 'self_loops': False}. Best is trial 107 with value: 0.2569520110311566.
[I 2025-10-22 07:14:39,916] Trial 124 finished with value: 0.25801883227884304 and parameters: {'model_type': 'gat', 'hidden_dims': '[512, 128]', 'dropout': 0.3504151391993059, 'batch_norm': False, 'gat_heads': 3, 'gat_attn_dropout': 0.22307459489322135, 'gat_concat_hidden': False, 'lr': 0.0002867068694273024, 'weight_decay': 4.337031185563643e-06, 'epochs': 71, 'loss': 'mae', 'optimizer': 'adam', 'graph_mode': 'cutoff', 'cutoff': 0.7972393555902291, 'grm_norm': 'cosine_then_gcn', 'self_loops': False}. Best is trial 124 with value: 0.25801883227884304.
[I 2025-10-22 07:16:08,134] Trial 125 finished with value: 0.24617463751272975 and parameters: {'model_type': 'gat', 'hidden_dims': '[512, 128]', 'dropout': 0.33480379579787534, 'batch_norm': False, 'gat_heads': 3, 'gat_attn_dropout': 0.22081732487445205, 'gat_concat_hidden': False, 'lr': 0.0002858319522568638, 'weight_decay': 5.7844554646442334e-06, 'epochs': 88, 'loss': 'mae', 'optimizer': 'adam', 'graph_mode': 'cutoff', 'cutoff': 0.6972723106877803, 'grm_norm': 'cosine_then_gcn', 'self_loops': False}. Best is trial 124 with value: 0.25801883227884304.
[I 2025-10-22 07:16:56,407] Trial 126 finished with value: 0.18085556973102357 and parameters: {'model_type': 'gat', 'hidden_dims': '[512, 128]', 'dropout': 0.3331722234244191, 'batch_norm': False, 'gat_heads': 3, 'gat_attn_dropout': 0.221161183554358, 'gat_concat_hidden': False, 'lr': 0.00028294681445493216, 'weight_decay': 1.0995935853857671e-05, 'epochs': 41, 'loss': 'mae', 'optimizer': 'adam', 'graph_mode': 'cutoff', 'cutoff': 0.6976434959808933, 'grm_norm': 'cosine_then_gcn', 'self_loops': False}. Best is trial 124 with value: 0.25801883227884304.
[I 2025-10-22 07:18:27,086] Trial 127 finished with value: 0.2466233456697129 and parameters: {'model_type': 'gat', 'hidden_dims': '[512, 128]', 'dropout': 0.296558219874896, 'batch_norm': False, 'gat_heads': 3, 'gat_attn_dropout': 0.18787117346699175, 'gat_concat_hidden': False, 'lr': 0.00020146210158570883, 'weight_decay': 8.049415544364635e-06, 'epochs': 91, 'loss': 'mae', 'optimizer': 'adam', 'graph_mode': 'cutoff', 'cutoff': 0.785195202213189, 'grm_norm': 'cosine_then_gcn', 'self_loops': False}. Best is trial 124 with value: 0.25801883227884304.
[I 2025-10-22 07:19:59,002] Trial 128 finished with value: 0.234222053420936 and parameters: {'model_type': 'gat', 'hidden_dims': '[512, 128]', 'dropout': 0.3053683178900045, 'batch_norm': False, 'gat_heads': 3, 'gat_attn_dropout': 0.2304224199891771, 'gat_concat_hidden': False, 'lr': 0.00019099739535065604, 'weight_decay': 5.943896582092037e-06, 'epochs': 93, 'loss': 'mse', 'optimizer': 'adam', 'graph_mode': 'cutoff', 'cutoff': 0.7924295115099382, 'grm_norm': 'cosine_then_gcn', 'self_loops': False}. Best is trial 124 with value: 0.25801883227884304.
[I 2025-10-22 07:24:02,693] Trial 129 finished with value: 0.22413092391161035 and parameters: {'model_type': 'gat', 'hidden_dims': '[512, 128]', 'dropout': 0.35805186780060005, 'batch_norm': False, 'gat_heads': 3, 'gat_attn_dropout': 0.1924430909418803, 'gat_concat_hidden': False, 'lr': 0.0002294457679416883, 'weight_decay': 1.7159923915832078e-05, 'epochs': 272, 'loss': 'mae', 'optimizer': 'adam', 'graph_mode': 'cutoff', 'cutoff': 0.7825206551968457, 'grm_norm': 'cosine_then_gcn', 'self_loops': False}. Best is trial 124 with value: 0.25801883227884304.
[I 2025-10-22 07:25:20,441] Trial 130 finished with value: 0.24506224822724257 and parameters: {'model_type': 'gat', 'hidden_dims': '[512, 128]', 'dropout': 0.34519074398799193, 'batch_norm': False, 'gat_heads': 3, 'gat_attn_dropout': 0.205314478836755, 'gat_concat_hidden': False, 'lr': 0.00016649597255278273, 'weight_decay': 2.6637623881291282e-06, 'epochs': 76, 'loss': 'mae', 'optimizer': 'adam', 'graph_mode': 'cutoff', 'cutoff': 0.7345962701059445, 'grm_norm': 'cosine_then_gcn', 'self_loops': False}. Best is trial 124 with value: 0.25801883227884304.
[I 2025-10-22 07:26:39,131] Trial 131 finished with value: 0.2302219792519188 and parameters: {'model_type': 'gat', 'hidden_dims': '[512, 128]', 'dropout': 0.3413628805951626, 'batch_norm': False, 'gat_heads': 3, 'gat_attn_dropout': 0.20301216310986184, 'gat_concat_hidden': False, 'lr': 0.00017386335245331164, 'weight_decay': 1.377116431049759e-06, 'epochs': 77, 'loss': 'mae', 'optimizer': 'adam', 'graph_mode': 'cutoff', 'cutoff': 0.7315146984724602, 'grm_norm': 'cosine_then_gcn', 'self_loops': False}. Best is trial 124 with value: 0.25801883227884304.
[I 2025-10-22 07:28:08,188] Trial 132 finished with value: 0.24059062486823946 and parameters: {'model_type': 'gat', 'hidden_dims': '[512, 128]', 'dropout': 0.35135383650487456, 'batch_norm': False, 'gat_heads': 3, 'gat_attn_dropout': 0.22432069238163005, 'gat_concat_hidden': False, 'lr': 0.00013976037840195197, 'weight_decay': 2.8151832534056804e-06, 'epochs': 89, 'loss': 'mae', 'optimizer': 'adam', 'graph_mode': 'cutoff', 'cutoff': 0.7137301250906934, 'grm_norm': 'cosine_then_gcn', 'self_loops': False}. Best is trial 124 with value: 0.25801883227884304.
[I 2025-10-22 07:29:14,149] Trial 133 finished with value: 0.25269228994316045 and parameters: {'model_type': 'gat', 'hidden_dims': '[512, 128]', 'dropout': 0.3329594102251497, 'batch_norm': False, 'gat_heads': 3, 'gat_attn_dropout': 0.24016545698707437, 'gat_concat_hidden': False, 'lr': 0.0003075024640058935, 'weight_decay': 4.49730541235264e-06, 'epochs': 62, 'loss': 'mae', 'optimizer': 'adam', 'graph_mode': 'cutoff', 'cutoff': 0.7436832503952295, 'grm_norm': 'cosine_then_gcn', 'self_loops': False}. Best is trial 124 with value: 0.25801883227884304.
[I 2025-10-22 07:29:57,016] Trial 134 finished with value: 0.2548556931802238 and parameters: {'model_type': 'gat', 'hidden_dims': '[256, 128, 64]', 'dropout': 0.2805274418588045, 'batch_norm': False, 'gat_heads': 3, 'gat_attn_dropout': 0.23866873691510046, 'gat_concat_hidden': False, 'lr': 0.0002989344030839886, 'weight_decay': 3.4163319844422103e-06, 'epochs': 70, 'loss': 'mae', 'optimizer': 'adam', 'graph_mode': 'cutoff', 'cutoff': 0.7609584686250095, 'grm_norm': 'cosine_then_gcn', 'self_loops': False}. Best is trial 124 with value: 0.25801883227884304.
[I 2025-10-22 07:30:31,809] Trial 135 finished with value: 0.2581454551753229 and parameters: {'model_type': 'gat', 'hidden_dims': '[256, 128, 64]', 'dropout': 0.27370029757283687, 'batch_norm': False, 'gat_heads': 3, 'gat_attn_dropout': 0.24937733672669807, 'gat_concat_hidden': False, 'lr': 0.00023917146890296826, 'weight_decay': 3.756856162203274e-06, 'epochs': 54, 'loss': 'mae', 'optimizer': 'adam', 'graph_mode': 'cutoff', 'cutoff': 0.7648365498786983, 'grm_norm': 'cosine_then_gcn', 'self_loops': False}. Best is trial 135 with value: 0.2581454551753229.
[I 2025-10-22 07:31:10,611] Trial 136 finished with value: 0.2538116124629206 and parameters: {'model_type': 'gat', 'hidden_dims': '[256, 128, 64]', 'dropout': 0.2766803801813282, 'batch_norm': False, 'gat_heads': 3, 'gat_attn_dropout': 0.25171685727679943, 'gat_concat_hidden': False, 'lr': 0.0002467142860243245, 'weight_decay': 3.626478691373285e-06, 'epochs': 62, 'loss': 'mae', 'optimizer': 'adam', 'graph_mode': 'cutoff', 'cutoff': 0.7481317893755046, 'grm_norm': 'cosine_then_gcn', 'self_loops': False}. Best is trial 135 with value: 0.2581454551753229.
[I 2025-10-22 07:31:44,869] Trial 137 finished with value: 0.25090239469684783 and parameters: {'model_type': 'gat', 'hidden_dims': '[256, 128, 64]', 'dropout': 0.2653333476571895, 'batch_norm': False, 'gat_heads': 3, 'gat_attn_dropout': 0.25449039018561337, 'gat_concat_hidden': False, 'lr': 0.00031509093828281654, 'weight_decay': 3.5174692992860603e-06, 'epochs': 53, 'loss': 'mae', 'optimizer': 'adam', 'graph_mode': 'cutoff', 'cutoff': 0.7441164828167139, 'grm_norm': 'cosine_then_gcn', 'self_loops': False}. Best is trial 135 with value: 0.2581454551753229.
[I 2025-10-22 07:32:24,071] Trial 138 finished with value: 0.1908496774391693 and parameters: {'model_type': 'gat', 'hidden_dims': '[256, 128, 64]', 'dropout': 0.21852787427057546, 'batch_norm': False, 'gat_heads': 3, 'gat_attn_dropout': 0.28156382662336366, 'gat_concat_hidden': False, 'lr': 0.0003006315604543182, 'weight_decay': 3.4310137040634144e-06, 'epochs': 61, 'loss': 'mae', 'optimizer': 'adam', 'graph_mode': 'knn', 'source': 'grm', 'knn_k': 5, 'weighted_edges': False, 'symmetrize_mode': 'mutual'}. Best is trial 135 with value: 0.2581454551753229.
[I 2025-10-22 07:32:57,830] Trial 139 finished with value: 0.25043008713983494 and parameters: {'model_type': 'gat', 'hidden_dims': '[256, 128, 64]', 'dropout': 0.2570956470104891, 'batch_norm': False, 'gat_heads': 3, 'gat_attn_dropout': 0.2534357547698647, 'gat_concat_hidden': False, 'lr': 0.00031899055736114715, 'weight_decay': 4.680125581994827e-06, 'epochs': 52, 'loss': 'mae', 'optimizer': 'adam', 'graph_mode': 'cutoff', 'cutoff': 0.7519077269324773, 'grm_norm': 'cosine_then_gcn', 'self_loops': False}. Best is trial 135 with value: 0.2581454551753229.
[I 2025-10-22 07:33:32,122] Trial 140 finished with value: 0.24377625675948011 and parameters: {'model_type': 'gat', 'hidden_dims': '[256, 128, 64]', 'dropout': 0.24199497698694733, 'batch_norm': False, 'gat_heads': 3, 'gat_attn_dropout': 0.2612101821265621, 'gat_concat_hidden': False, 'lr': 0.0002501267466177315, 'weight_decay': 3.6697435340554306e-06, 'epochs': 53, 'loss': 'mae', 'optimizer': 'adam', 'graph_mode': 'cutoff', 'cutoff': 0.745179187211553, 'grm_norm': 'cosine_then_gcn', 'self_loops': False}. Best is trial 135 with value: 0.2581454551753229.
[I 2025-10-22 07:34:01,841] Trial 141 finished with value: 0.24205435393163027 and parameters: {'model_type': 'gat', 'hidden_dims': '[256, 128, 64]', 'dropout': 0.26018225451295096, 'batch_norm': False, 'gat_heads': 3, 'gat_attn_dropout': 0.24052144686747323, 'gat_concat_hidden': False, 'lr': 0.0003318462447900284, 'weight_decay': 4.416260169716811e-06, 'epochs': 44, 'loss': 'mae', 'optimizer': 'adam', 'graph_mode': 'cutoff', 'cutoff': 0.7576541356093165, 'grm_norm': 'cosine_then_gcn', 'self_loops': False}. Best is trial 135 with value: 0.2581454551753229.
[I 2025-10-22 07:34:37,115] Trial 142 finished with value: 0.24881893080812273 and parameters: {'model_type': 'gat', 'hidden_dims': '[256, 128, 64]', 'dropout': 0.2749478942110668, 'batch_norm': False, 'gat_heads': 3, 'gat_attn_dropout': 0.25355014577979235, 'gat_concat_hidden': False, 'lr': 0.0003278747864930683, 'weight_decay': 3.0777998574643543e-06, 'epochs': 55, 'loss': 'mae', 'optimizer': 'adam', 'graph_mode': 'cutoff', 'cutoff': 0.7746368318319131, 'grm_norm': 'cosine_then_gcn', 'self_loops': False}. Best is trial 135 with value: 0.2581454551753229.
[I 2025-10-22 07:35:11,851] Trial 143 finished with value: 0.25767889936108956 and parameters: {'model_type': 'gat', 'hidden_dims': '[256, 128, 64]', 'dropout': 0.28009308095754, 'batch_norm': False, 'gat_heads': 3, 'gat_attn_dropout': 0.2495142503654129, 'gat_concat_hidden': False, 'lr': 0.00030283396732631683, 'weight_decay': 3.2013260610553703e-06, 'epochs': 54, 'loss': 'mae', 'optimizer': 'adam', 'graph_mode': 'cutoff', 'cutoff': 0.7689128157939967, 'grm_norm': 'cosine_then_gcn', 'self_loops': False}. Best is trial 135 with value: 0.2581454551753229.
[I 2025-10-22 07:35:45,616] Trial 144 finished with value: 0.25250874900488585 and parameters: {'model_type': 'gat', 'hidden_dims': '[256, 128, 64]', 'dropout': 0.2781924961359564, 'batch_norm': False, 'gat_heads': 3, 'gat_attn_dropout': 0.2533038383072831, 'gat_concat_hidden': False, 'lr': 0.00022631511267745443, 'weight_decay': 3.301722097158388e-06, 'epochs': 52, 'loss': 'mae', 'optimizer': 'adam', 'graph_mode': 'cutoff', 'cutoff': 0.7678815995568012, 'grm_norm': 'cosine_then_gcn', 'self_loops': False}. Best is trial 135 with value: 0.2581454551753229.
[I 2025-10-22 07:36:17,856] Trial 145 finished with value: 0.24988166165490105 and parameters: {'model_type': 'gat', 'hidden_dims': '[256, 128, 64]', 'dropout': 0.23528053202618848, 'batch_norm': False, 'gat_heads': 3, 'gat_attn_dropout': 0.27487641529719137, 'gat_concat_hidden': False, 'lr': 0.0002197304811653908, 'weight_decay': 1.8343489171342184e-06, 'epochs': 49, 'loss': 'mae', 'optimizer': 'adam', 'graph_mode': 'cutoff', 'cutoff': 0.7484608177419917, 'grm_norm': 'cosine_then_gcn', 'self_loops': False}. Best is trial 135 with value: 0.2581454551753229.
