[I 2025-11-03 12:30:56,480] Trial 74 finished with value: 0.11094080542961819 and parameters: {'model_type': 'gcn', 'hidden_dims': '[256, 128]', 'dropout': 0.4752142607854943, 'batch_norm': True, 'lr': 0.0008013792143787304, 'weight_decay': 5.07011951274744e-05, 'epochs': 261, 'loss': 'mae', 'optimizer': 'adam', 'graph_mode': 'cutoff', 'cutoff': 0.543912391596032, 'grm_norm': 'cosine_then_gcn', 'self_loops': False, 'use_snp_selection': False}. Best is trial 71 with value: 0.12877151477969082.
[I 2025-11-03 12:30:58,513] Trial 75 finished with value: 0.11953549392596782 and parameters: {'model_type': 'gcn', 'hidden_dims': '[256, 128]', 'dropout': 0.17568204182024147, 'batch_norm': True, 'lr': 0.0005725149504000023, 'weight_decay': 7.844577722141915e-05, 'epochs': 238, 'loss': 'mae', 'optimizer': 'adam', 'graph_mode': 'cutoff', 'cutoff': 0.5920954795405073, 'grm_norm': 'cosine', 'self_loops': False, 'use_snp_selection': False}. Best is trial 71 with value: 0.12877151477969082.
[I 2025-11-03 12:31:00,676] Trial 76 finished with value: 0.1277199425868429 and parameters: {'model_type': 'gcn', 'hidden_dims': '[256, 128]', 'dropout': 0.5080472588019829, 'batch_norm': True, 'lr': 0.0008090395621940173, 'weight_decay': 3.542085708475736e-05, 'epochs': 271, 'loss': 'mse', 'optimizer': 'adam', 'graph_mode': 'cutoff', 'cutoff': 0.6378656783065273, 'grm_norm': 'cosine_then_gcn', 'self_loops': False, 'use_snp_selection': False}. Best is trial 71 with value: 0.12877151477969082.
[I 2025-11-03 12:31:03,544] Trial 77 finished with value: 0.08894574001711256 and parameters: {'model_type': 'gcn', 'hidden_dims': '[256, 128]', 'dropout': 0.5080317711970878, 'batch_norm': False, 'lr': 0.000782952983212597, 'weight_decay': 3.333982041156617e-05, 'epochs': 270, 'loss': 'mse', 'optimizer': 'adam', 'graph_mode': 'cutoff', 'cutoff': 0.6395878118206918, 'grm_norm': 'none', 'self_loops': False, 'use_snp_selection': True, 'num_snps': 37102}. Best is trial 71 with value: 0.12877151477969082.
[I 2025-11-03 12:31:05,707] Trial 78 finished with value: 0.09287033103967485 and parameters: {'model_type': 'gcn', 'hidden_dims': '[256, 128]', 'dropout': 0.5813545132402128, 'batch_norm': True, 'lr': 0.0005221927031798431, 'weight_decay': 1.5383503917704654e-05, 'epochs': 249, 'loss': 'mse', 'optimizer': 'adam', 'graph_mode': 'knn', 'source': 'grm', 'knn_k': 5, 'weighted_edges': False, 'symmetrize_mode': 'union', 'use_snp_selection': False}. Best is trial 71 with value: 0.12877151477969082.
[I 2025-11-03 12:31:07,210] Trial 79 finished with value: 0.020600553507564054 and parameters: {'model_type': 'gcn', 'hidden_dims': '[256, 128]', 'dropout': 0.450486030154712, 'batch_norm': True, 'lr': 2.504466880138962e-06, 'weight_decay': 2.363458800267352e-05, 'epochs': 105, 'loss': 'mse', 'optimizer': 'adam', 'graph_mode': 'cutoff', 'cutoff': 0.6951881723071123, 'grm_norm': 'cosine_then_gcn', 'self_loops': False, 'use_snp_selection': False}. Best is trial 71 with value: 0.12877151477969082.
[I 2025-11-03 12:31:09,179] Trial 80 finished with value: 0.12695128287790747 and parameters: {'model_type': 'gcn', 'hidden_dims': '[256, 128]', 'dropout': 0.5153001712121676, 'batch_norm': True, 'lr': 0.0008861265278147574, 'weight_decay': 1.0293110462733473e-07, 'epochs': 222, 'loss': 'mse', 'optimizer': 'adam', 'graph_mode': 'cutoff', 'cutoff': 0.7948140087626019, 'grm_norm': 'cosine_then_gcn', 'self_loops': False, 'use_snp_selection': False}. Best is trial 71 with value: 0.12877151477969082.
[I 2025-11-03 12:31:11,186] Trial 81 finished with value: 0.1306264314936647 and parameters: {'model_type': 'gcn', 'hidden_dims': '[256, 128]', 'dropout': 0.5157900129800884, 'batch_norm': True, 'lr': 0.0008284840883055024, 'weight_decay': 1.1943326605109048e-07, 'epochs': 231, 'loss': 'mse', 'optimizer': 'adam', 'graph_mode': 'cutoff', 'cutoff': 0.8096037052228994, 'grm_norm': 'cosine_then_gcn', 'self_loops': False, 'use_snp_selection': False}. Best is trial 81 with value: 0.1306264314936647.
[I 2025-11-03 12:31:13,118] Trial 82 finished with value: 0.11637790633187756 and parameters: {'model_type': 'gcn', 'hidden_dims': '[256, 128]', 'dropout': 0.5482128547933214, 'batch_norm': True, 'lr': 0.000871272406155649, 'weight_decay': 1.107059578698605e-07, 'epochs': 213, 'loss': 'mse', 'optimizer': 'adam', 'graph_mode': 'cutoff', 'cutoff': 0.8367959823257082, 'grm_norm': 'cosine_then_gcn', 'self_loops': False, 'use_snp_selection': False}. Best is trial 81 with value: 0.1306264314936647.
[I 2025-11-03 12:31:15,119] Trial 83 finished with value: 0.1224394546448667 and parameters: {'model_type': 'gcn', 'hidden_dims': '[256, 128]', 'dropout': 0.5214193158709975, 'batch_norm': True, 'lr': 0.0006565498389190283, 'weight_decay': 2.1811410103172423e-07, 'epochs': 230, 'loss': 'mse', 'optimizer': 'adam', 'graph_mode': 'cutoff', 'cutoff': 0.7985241845128098, 'grm_norm': 'cosine_then_gcn', 'self_loops': False, 'use_snp_selection': False}. Best is trial 81 with value: 0.1306264314936647.
[I 2025-11-03 12:31:16,969] Trial 84 finished with value: 0.10552163781538565 and parameters: {'model_type': 'gcn', 'hidden_dims': '[256, 128]', 'dropout': 0.5120320496418524, 'batch_norm': True, 'lr': 0.0006164450125799165, 'weight_decay': 3.1472634532350337e-07, 'epochs': 192, 'loss': 'mse', 'optimizer': 'adam', 'graph_mode': 'cutoff', 'cutoff': 0.7546529497991903, 'grm_norm': 'cosine_then_gcn', 'self_loops': False, 'use_snp_selection': False}. Best is trial 81 with value: 0.1306264314936647.
[I 2025-11-03 12:31:18,913] Trial 85 finished with value: 0.10126671073136502 and parameters: {'model_type': 'gcn', 'hidden_dims': '[256, 128]', 'dropout': 0.5746438335372203, 'batch_norm': True, 'lr': 0.0008663651594872093, 'weight_decay': 1.3960108590104546e-07, 'epochs': 219, 'loss': 'mse', 'optimizer': 'adam', 'graph_mode': 'cutoff', 'cutoff': 0.833921602187012, 'grm_norm': 'gcn', 'self_loops': False, 'use_snp_selection': False}. Best is trial 81 with value: 0.1306264314936647.
[I 2025-11-03 12:31:21,036] Trial 86 finished with value: 0.11984842808254179 and parameters: {'model_type': 'gcn', 'hidden_dims': '[256, 128]', 'dropout': 0.5331400410354359, 'batch_norm': True, 'lr': 0.0004683022908428456, 'weight_decay': 2.1395977065286023e-07, 'epochs': 260, 'loss': 'mse', 'optimizer': 'adam', 'graph_mode': 'cutoff', 'cutoff': 0.7752534322210693, 'grm_norm': 'cosine_then_gcn', 'self_loops': True, 'use_snp_selection': False}. Best is trial 81 with value: 0.1306264314936647.
[I 2025-11-03 12:31:22,941] Trial 87 finished with value: 0.12037668169537387 and parameters: {'model_type': 'gcn', 'hidden_dims': '[256, 128]', 'dropout': 0.2964579071204891, 'batch_norm': True, 'lr': 0.0007317449157034289, 'weight_decay': 9.036333828118563e-07, 'epochs': 206, 'loss': 'mse', 'optimizer': 'adam', 'graph_mode': 'cutoff', 'cutoff': 0.5716366511015175, 'grm_norm': 'cosine_then_gcn', 'self_loops': False, 'use_snp_selection': False}. Best is trial 81 with value: 0.1306264314936647.
[I 2025-11-03 12:31:24,969] Trial 88 finished with value: 0.11628506605326543 and parameters: {'model_type': 'gcn', 'hidden_dims': '[256, 128]', 'dropout': 0.19739911943470953, 'batch_norm': True, 'lr': 0.0005279786694244512, 'weight_decay': 1.613700956529143e-07, 'epochs': 237, 'loss': 'mse', 'optimizer': 'adam', 'graph_mode': 'cutoff', 'cutoff': 0.6675432567278572, 'grm_norm': 'cosine_then_gcn', 'self_loops': False, 'use_snp_selection': False}. Best is trial 81 with value: 0.1306264314936647.
[I 2025-11-03 12:31:26,715] Trial 89 finished with value: 0.10987134593200597 and parameters: {'model_type': 'gcn', 'hidden_dims': '[256, 128]', 'dropout': 0.3403609980828141, 'batch_norm': True, 'lr': 0.00038273405537584787, 'weight_decay': 8.853524818309051e-05, 'epochs': 166, 'loss': 'mse', 'optimizer': 'adam', 'graph_mode': 'cutoff', 'cutoff': 0.8313388787560152, 'grm_norm': 'cosine_then_gcn', 'self_loops': False, 'use_snp_selection': False}. Best is trial 81 with value: 0.1306264314936647.
[I 2025-11-03 12:31:28,856] Trial 90 finished with value: 0.0030870015968823858 and parameters: {'model_type': 'gcn', 'hidden_dims': '[256, 128, 64]', 'dropout': 0.5895363577785477, 'batch_norm': False, 'lr': 1.8190015153872833e-05, 'weight_decay': 1.1311973629774028e-07, 'epochs': 251, 'loss': 'mse', 'optimizer': 'adam', 'graph_mode': 'cutoff', 'cutoff': 0.5308963552938524, 'grm_norm': 'cosine', 'self_loops': False, 'use_snp_selection': True, 'num_snps': 8278}. Best is trial 81 with value: 0.1306264314936647.
[I 2025-11-03 12:31:30,800] Trial 91 finished with value: 0.11573821697135234 and parameters: {'model_type': 'gcn', 'hidden_dims': '[256, 128]', 'dropout': 0.5201220272095155, 'batch_norm': True, 'lr': 0.0006881748566457884, 'weight_decay': 2.3262345741333751e-07, 'epochs': 207, 'loss': 'mse', 'optimizer': 'adam', 'graph_mode': 'cutoff', 'cutoff': 0.8041248715925197, 'grm_norm': 'cosine_then_gcn', 'self_loops': False, 'use_snp_selection': False}. Best is trial 81 with value: 0.1306264314936647.
[I 2025-11-03 12:31:32,808] Trial 92 finished with value: 0.12944838861689117 and parameters: {'model_type': 'gcn', 'hidden_dims': '[256, 128]', 'dropout': 0.55299745424699, 'batch_norm': True, 'lr': 0.0009775549566382092, 'weight_decay': 5.011213357740359e-07, 'epochs': 228, 'loss': 'mse', 'optimizer': 'adam', 'graph_mode': 'cutoff', 'cutoff': 0.8558102996951146, 'grm_norm': 'cosine_then_gcn', 'self_loops': False, 'use_snp_selection': False}. Best is trial 81 with value: 0.1306264314936647.
[I 2025-11-03 12:31:34,845] Trial 93 finished with value: 0.13116085585435272 and parameters: {'model_type': 'gcn', 'hidden_dims': '[256, 128]', 'dropout': 0.5513788983729834, 'batch_norm': True, 'lr': 0.0009314656442038537, 'weight_decay': 5.511382322884514e-07, 'epochs': 243, 'loss': 'mse', 'optimizer': 'adam', 'graph_mode': 'cutoff', 'cutoff': 0.898401781160867, 'grm_norm': 'cosine_then_gcn', 'self_loops': False, 'use_snp_selection': False}. Best is trial 93 with value: 0.13116085585435272.
[I 2025-11-03 12:31:36,830] Trial 94 finished with value: 0.11555683190842353 and parameters: {'model_type': 'gcn', 'hidden_dims': '[256, 128]', 'dropout': 0.5562962810913531, 'batch_norm': True, 'lr': 0.0008040726005136867, 'weight_decay': 3.075317144573851e-07, 'epochs': 228, 'loss': 'mse', 'optimizer': 'adam', 'graph_mode': 'cutoff', 'cutoff': 0.8537358626650752, 'grm_norm': 'cosine_then_gcn', 'self_loops': False, 'use_snp_selection': False}. Best is trial 93 with value: 0.13116085585435272.
[I 2025-11-03 12:31:38,880] Trial 95 finished with value: 0.10837345994317688 and parameters: {'model_type': 'gcn', 'hidden_dims': '[256, 128]', 'dropout': 0.5708107519774448, 'batch_norm': True, 'lr': 0.0005923528341709399, 'weight_decay': 5.044648850267848e-07, 'epochs': 244, 'loss': 'mse', 'optimizer': 'adam', 'graph_mode': 'cutoff', 'cutoff': 0.8063418388083267, 'grm_norm': 'cosine_then_gcn', 'self_loops': False, 'use_snp_selection': False}. Best is trial 93 with value: 0.13116085585435272.
[I 2025-11-03 12:31:41,033] Trial 96 finished with value: 0.11537770834464976 and parameters: {'model_type': 'gcn', 'hidden_dims': '[256, 128]', 'dropout': 0.5420711459310904, 'batch_norm': True, 'lr': 0.000990760250380959, 'weight_decay': 9.143661202472591e-07, 'epochs': 272, 'loss': 'mse', 'optimizer': 'adam', 'graph_mode': 'cutoff', 'cutoff': 0.8913073833241373, 'grm_norm': 'cosine_then_gcn', 'self_loops': False, 'use_snp_selection': False}. Best is trial 93 with value: 0.13116085585435272.
[I 2025-11-03 12:31:43,504] Trial 97 finished with value: 0.012938352101653741 and parameters: {'model_type': 'gcn', 'hidden_dims': '[256, 128]', 'dropout': 0.5867273232287717, 'batch_norm': True, 'lr': 0.0008522559599240483, 'weight_decay': 1.5391604826833314e-06, 'epochs': 255, 'loss': 'mse', 'optimizer': 'adam', 'graph_mode': 'knn', 'source': 'grm', 'knn_k': 9, 'weighted_edges': False, 'symmetrize_mode': 'union', 'use_snp_selection': False}. Best is trial 93 with value: 0.13116085585435272.
[I 2025-11-03 12:31:45,563] Trial 98 finished with value: 0.11373904686800161 and parameters: {'model_type': 'gcn', 'hidden_dims': '[256, 128]', 'dropout': 0.4952579163663649, 'batch_norm': True, 'lr': 0.0009856393147422515, 'weight_decay': 4.7197514166303076e-05, 'epochs': 240, 'loss': 'mse', 'optimizer': 'adam', 'graph_mode': 'cutoff', 'cutoff': 0.8644598985396603, 'grm_norm': 'cosine_then_gcn', 'self_loops': False, 'use_snp_selection': False}. Best is trial 93 with value: 0.13116085585435272.
[I 2025-11-03 12:31:47,540] Trial 99 finished with value: 0.11921146801061279 and parameters: {'model_type': 'gcn', 'hidden_dims': '[256, 128]', 'dropout': 0.5539631194948128, 'batch_norm': True, 'lr': 0.0007032358737400115, 'weight_decay': 4.974666656639018e-07, 'epochs': 223, 'loss': 'mse', 'optimizer': 'adam', 'graph_mode': 'cutoff', 'cutoff': 0.8735759481434731, 'grm_norm': 'gcn', 'self_loops': True, 'use_snp_selection': False}. Best is trial 93 with value: 0.13116085585435272.
[I 2025-11-03 12:31:50,190] Trial 100 finished with value: 0.1006357317851305 and parameters: {'model_type': 'gcn', 'hidden_dims': '[512, 128]', 'dropout': 0.5987302465550286, 'batch_norm': True, 'lr': 0.0004437921697109597, 'weight_decay': 0.00014319048047229432, 'epochs': 233, 'loss': 'mse', 'optimizer': 'adam', 'graph_mode': 'cutoff', 'cutoff': 0.737460336212899, 'grm_norm': 'cosine_then_gcn', 'self_loops': False, 'use_snp_selection': False}. Best is trial 93 with value: 0.13116085585435272.
[I 2025-11-03 12:31:53,027] Trial 101 finished with value: 0.13007689987680926 and parameters: {'model_type': 'gcn', 'hidden_dims': '[512, 256]', 'dropout': 0.10297242467191395, 'batch_norm': True, 'lr': 0.00035925332262628086, 'weight_decay': 6.575052817645786e-05, 'epochs': 264, 'loss': 'mse', 'optimizer': 'adam', 'graph_mode': 'cutoff', 'cutoff': 0.5532074378846933, 'grm_norm': 'cosine_then_gcn', 'self_loops': False, 'use_snp_selection': False}. Best is trial 93 with value: 0.13116085585435272.
[I 2025-11-03 12:31:55,824] Trial 102 finished with value: 0.10496785552243675 and parameters: {'model_type': 'gcn', 'hidden_dims': '[512, 256]', 'dropout': 0.5086112114409408, 'batch_norm': True, 'lr': 0.00034199675769285806, 'weight_decay': 5.824241487087784e-05, 'epochs': 260, 'loss': 'mse', 'optimizer': 'adam', 'graph_mode': 'cutoff', 'cutoff': 0.7738466930031884, 'grm_norm': 'cosine_then_gcn', 'self_loops': False, 'use_snp_selection': False}. Best is trial 93 with value: 0.13116085585435272.
[I 2025-11-03 12:31:58,673] Trial 103 finished with value: 0.09873305280732164 and parameters: {'model_type': 'gcn', 'hidden_dims': '[512, 256]', 'dropout': 0.5290618505623144, 'batch_norm': True, 'lr': 0.0005422055486746949, 'weight_decay': 0.00010681485319799542, 'epochs': 267, 'loss': 'mse', 'optimizer': 'adam', 'graph_mode': 'cutoff', 'cutoff': 0.6255244189890209, 'grm_norm': 'cosine_then_gcn', 'self_loops': False, 'use_snp_selection': False}. Best is trial 93 with value: 0.13116085585435272.
[I 2025-11-03 12:32:01,698] Trial 104 finished with value: 0.12527578680935428 and parameters: {'model_type': 'gcn', 'hidden_dims': '[512, 256]', 'dropout': 0.48249661443160374, 'batch_norm': True, 'lr': 0.0008999659806958947, 'weight_decay': 1.0013182449075629e-07, 'epochs': 296, 'loss': 'mse', 'optimizer': 'adam', 'graph_mode': 'cutoff', 'cutoff': 0.8218050117227251, 'grm_norm': 'cosine_then_gcn', 'self_loops': False, 'use_snp_selection': False}. Best is trial 93 with value: 0.13116085585435272.
[I 2025-11-03 12:32:04,593] Trial 105 finished with value: 0.12897748707765472 and parameters: {'model_type': 'gcn', 'hidden_dims': '[512, 256]', 'dropout': 0.4756409204116517, 'batch_norm': True, 'lr': 0.0008446777710293049, 'weight_decay': 1.9537611062187996e-07, 'epochs': 282, 'loss': 'mse', 'optimizer': 'adam', 'graph_mode': 'cutoff', 'cutoff': 0.8185576522881225, 'grm_norm': 'cosine_then_gcn', 'self_loops': False, 'use_snp_selection': False}. Best is trial 93 with value: 0.13116085585435272.
[I 2025-11-03 12:32:07,412] Trial 106 finished with value: 0.12895600866514417 and parameters: {'model_type': 'gcn', 'hidden_dims': '[512, 256]', 'dropout': 0.47671194454299526, 'batch_norm': True, 'lr': 0.0008710811947188913, 'weight_decay': 1.054699807581338e-07, 'epochs': 276, 'loss': 'mse', 'optimizer': 'adam', 'graph_mode': 'cutoff', 'cutoff': 0.8227965925799906, 'grm_norm': 'none', 'self_loops': False, 'use_snp_selection': False}. Best is trial 93 with value: 0.13116085585435272.
[I 2025-11-03 12:32:10,225] Trial 107 finished with value: 0.12869384269664896 and parameters: {'model_type': 'gcn', 'hidden_dims': '[512, 256]', 'dropout': 0.47056624227909494, 'batch_norm': True, 'lr': 0.0007172355060603039, 'weight_decay': 1.3064883731763731e-07, 'epochs': 277, 'loss': 'mse', 'optimizer': 'adam', 'graph_mode': 'cutoff', 'cutoff': 0.8633062110696375, 'grm_norm': 'none', 'self_loops': False, 'use_snp_selection': False}. Best is trial 93 with value: 0.13116085585435272.
[I 2025-11-03 12:32:13,055] Trial 108 finished with value: 0.12308400672762145 and parameters: {'model_type': 'gcn', 'hidden_dims': '[512, 256]', 'dropout': 0.4610661561469789, 'batch_norm': True, 'lr': 0.0007263121573794195, 'weight_decay': 1.3793188561712245e-07, 'epochs': 277, 'loss': 'mse', 'optimizer': 'adam', 'graph_mode': 'cutoff', 'cutoff': 0.853318447022219, 'grm_norm': 'none', 'self_loops': False, 'use_snp_selection': False}. Best is trial 93 with value: 0.13116085585435272.
[I 2025-11-03 12:32:15,896] Trial 109 finished with value: 0.13600402080253834 and parameters: {'model_type': 'gcn', 'hidden_dims': '[512, 256]', 'dropout': 0.47330177356995934, 'batch_norm': True, 'lr': 0.0006335860906280711, 'weight_decay': 1.7416287240017993e-07, 'epochs': 281, 'loss': 'mse', 'optimizer': 'adam', 'graph_mode': 'cutoff', 'cutoff': 0.878005883463466, 'grm_norm': 'none', 'self_loops': False, 'use_snp_selection': False}. Best is trial 109 with value: 0.13600402080253834.
[I 2025-11-03 12:32:18,751] Trial 110 finished with value: 0.13502613189703622 and parameters: {'model_type': 'gcn', 'hidden_dims': '[512, 256]', 'dropout': 0.3660404481807573, 'batch_norm': True, 'lr': 0.0006471433201795904, 'weight_decay': 1.9371892542906667e-07, 'epochs': 284, 'loss': 'mse', 'optimizer': 'adam', 'graph_mode': 'cutoff', 'cutoff': 0.8967248186438387, 'grm_norm': 'none', 'self_loops': False, 'use_snp_selection': False}. Best is trial 109 with value: 0.13600402080253834.
[I 2025-11-03 12:32:21,619] Trial 111 finished with value: 0.12868849047793587 and parameters: {'model_type': 'gcn', 'hidden_dims': '[512, 256]', 'dropout': 0.4387000978142386, 'batch_norm': True, 'lr': 0.0006211677699772337, 'weight_decay': 1.8337649137644312e-07, 'epochs': 284, 'loss': 'mse', 'optimizer': 'adam', 'graph_mode': 'cutoff', 'cutoff': 0.8956169831356274, 'grm_norm': 'none', 'self_loops': False, 'use_snp_selection': False}. Best is trial 109 with value: 0.13600402080253834.
[I 2025-11-03 12:32:24,522] Trial 112 finished with value: 0.13018958441452466 and parameters: {'model_type': 'gcn', 'hidden_dims': '[512, 256]', 'dropout': 0.36136864332663154, 'batch_norm': True, 'lr': 0.000488319096355536, 'weight_decay': 1.8212234870594678e-07, 'epochs': 293, 'loss': 'mse', 'optimizer': 'adam', 'graph_mode': 'cutoff', 'cutoff': 0.887357370059987, 'grm_norm': 'none', 'self_loops': False, 'use_snp_selection': False}. Best is trial 109 with value: 0.13600402080253834.
[I 2025-11-03 12:32:27,441] Trial 113 finished with value: 0.12269497587548057 and parameters: {'model_type': 'gcn', 'hidden_dims': '[512, 256]', 'dropout': 0.3649922337026179, 'batch_norm': True, 'lr': 0.0006151923591678449, 'weight_decay': 1.848762948666087e-07, 'epochs': 295, 'loss': 'mse', 'optimizer': 'adam', 'graph_mode': 'cutoff', 'cutoff': 0.8988081333817843, 'grm_norm': 'none', 'self_loops': False, 'use_snp_selection': False}. Best is trial 109 with value: 0.13600402080253834.
[I 2025-11-03 12:32:30,321] Trial 114 finished with value: 0.1286168283673599 and parameters: {'model_type': 'gcn', 'hidden_dims': '[512, 256]', 'dropout': 0.3212373371335386, 'batch_norm': True, 'lr': 0.0005148176939478641, 'weight_decay': 2.6943752617205725e-07, 'epochs': 283, 'loss': 'mse', 'optimizer': 'adam', 'graph_mode': 'cutoff', 'cutoff': 0.8791067893008826, 'grm_norm': 'none', 'self_loops': False, 'use_snp_selection': False}. Best is trial 109 with value: 0.13600402080253834.
[I 2025-11-03 12:32:33,282] Trial 115 finished with value: 0.13069038501391678 and parameters: {'model_type': 'gcn', 'hidden_dims': '[512, 256]', 'dropout': 0.4134665368464534, 'batch_norm': True, 'lr': 0.0006612587297142715, 'weight_decay': 1.2654247022790158e-07, 'epochs': 291, 'loss': 'mse', 'optimizer': 'adam', 'graph_mode': 'cutoff', 'cutoff': 0.8559314099376831, 'grm_norm': 'none', 'self_loops': False, 'use_snp_selection': False}. Best is trial 109 with value: 0.13600402080253834.
[I 2025-11-03 12:32:37,521] Trial 116 finished with value: 0.12337525065757471 and parameters: {'model_type': 'gcn', 'hidden_dims': '[512, 256]', 'dropout': 0.3762646618696816, 'batch_norm': True, 'lr': 0.0006688972448659066, 'weight_decay': 1.3083884229763598e-07, 'epochs': 292, 'loss': 'mse', 'optimizer': 'adam', 'graph_mode': 'cutoff', 'cutoff': 0.8556827227421309, 'grm_norm': 'none', 'self_loops': False, 'use_snp_selection': True, 'num_snps': 51639}. Best is trial 109 with value: 0.13600402080253834.
[I 2025-11-03 12:32:40,470] Trial 117 finished with value: 0.037446912316883685 and parameters: {'model_type': 'gcn', 'hidden_dims': '[512, 256]', 'dropout': 0.41152269449149026, 'batch_norm': False, 'lr': 0.0007320316531381762, 'weight_decay': 1.6654819475450916e-07, 'epochs': 277, 'loss': 'mse', 'optimizer': 'adam', 'graph_mode': 'knn', 'source': 'grm', 'knn_k': 6, 'weighted_edges': True, 'symmetrize_mode': 'mutual', 'use_snp_selection': False}. Best is trial 109 with value: 0.13600402080253834.
