[I 2025-11-03 13:24:47,677] Trial 19 finished with value: 0.05022273659910543 and parameters: {'model_type': 'graphsage', 'hidden_dims': '[512, 128]', 'dropout': 0.2576618820495021, 'batch_norm': True, 'lr': 6.737609472447898e-05, 'weight_decay': 1.1091984056739118e-07, 'epochs': 302, 'loss': 'mae', 'optimizer': 'adam', 'graph_mode': 'knn', 'source': 'grm', 'knn_k': 5, 'weighted_edges': False, 'symmetrize_mode': 'union', 'use_snp_selection': False}. Best is trial 13 with value: 0.0757744699208202.
[I 2025-11-03 13:24:50,255] Trial 20 finished with value: -0.017228502594611117 and parameters: {'model_type': 'graphsage', 'hidden_dims': '[256, 128, 64]', 'dropout': 0.46201114806835597, 'batch_norm': True, 'lr': 1.1404538928812465e-06, 'weight_decay': 5.42446846577069e-06, 'epochs': 216, 'loss': 'mae', 'optimizer': 'adam', 'graph_mode': 'knn', 'source': 'grm', 'knn_k': 2, 'weighted_edges': True, 'symmetrize_mode': 'union', 'use_snp_selection': False}. Best is trial 13 with value: 0.0757744699208202.
[I 2025-11-03 13:24:54,590] Trial 21 finished with value: 0.07595283982719275 and parameters: {'model_type': 'graphsage', 'hidden_dims': '[512, 256]', 'dropout': 0.34247328906529323, 'batch_norm': True, 'lr': 0.0008863984109111238, 'weight_decay': 8.870417362839002e-07, 'epochs': 267, 'loss': 'mae', 'optimizer': 'adam', 'graph_mode': 'knn', 'source': 'grm', 'knn_k': 1, 'weighted_edges': True, 'symmetrize_mode': 'union', 'use_snp_selection': False}. Best is trial 21 with value: 0.07595283982719275.
[I 2025-11-03 13:24:58,964] Trial 22 finished with value: 0.06328099099031642 and parameters: {'model_type': 'graphsage', 'hidden_dims': '[512, 64]', 'dropout': 0.32415744626445275, 'batch_norm': True, 'lr': 0.00029381514620400887, 'weight_decay': 6.832093206574712e-07, 'epochs': 265, 'loss': 'mae', 'optimizer': 'adam', 'graph_mode': 'knn', 'source': 'grm', 'knn_k': 2, 'weighted_edges': True, 'symmetrize_mode': 'union', 'use_snp_selection': False}. Best is trial 21 with value: 0.07595283982719275.
[I 2025-11-03 13:25:03,648] Trial 23 finished with value: 0.05972672420512269 and parameters: {'model_type': 'graphsage', 'hidden_dims': '[512, 64]', 'dropout': 0.3860063293990835, 'batch_norm': True, 'lr': 0.00037469170820467304, 'weight_decay': 2.1245629441199231e-07, 'epochs': 303, 'loss': 'mae', 'optimizer': 'adam', 'graph_mode': 'knn', 'source': 'grm', 'knn_k': 2, 'weighted_edges': True, 'symmetrize_mode': 'union', 'use_snp_selection': False}. Best is trial 21 with value: 0.07595283982719275.
[I 2025-11-03 13:25:08,383] Trial 24 finished with value: 0.06205721447008301 and parameters: {'model_type': 'graphsage', 'hidden_dims': '[512, 256]', 'dropout': 0.24570577372247895, 'batch_norm': True, 'lr': 0.0009449307307779176, 'weight_decay': 6.101560436931356e-07, 'epochs': 287, 'loss': 'mae', 'optimizer': 'adam', 'graph_mode': 'knn', 'source': 'grm', 'knn_k': 4, 'weighted_edges': True, 'symmetrize_mode': 'union', 'use_snp_selection': False}. Best is trial 21 with value: 0.07595283982719275.
[I 2025-11-03 13:25:12,841] Trial 25 finished with value: 0.06975530342432018 and parameters: {'model_type': 'graphsage', 'hidden_dims': '[512, 64]', 'dropout': 0.4402342822844292, 'batch_norm': True, 'lr': 0.0002072629498328227, 'weight_decay': 9.498291269488468e-07, 'epochs': 250, 'loss': 'mae', 'optimizer': 'adam', 'graph_mode': 'knn', 'source': 'grm', 'knn_k': 5, 'weighted_edges': True, 'symmetrize_mode': 'union', 'use_snp_selection': False}. Best is trial 21 with value: 0.07595283982719275.
[I 2025-11-03 13:25:18,868] Trial 26 finished with value: 0.009498905450367183 and parameters: {'model_type': 'graphsage', 'hidden_dims': '[512, 128]', 'dropout': 0.5250525842587597, 'batch_norm': False, 'lr': 0.00047685365862298824, 'weight_decay': 2.7575164478481107e-07, 'epochs': 323, 'loss': 'mae', 'optimizer': 'adam', 'graph_mode': 'cutoff', 'cutoff': 0.8765009073803762, 'grm_norm': 'none', 'self_loops': True, 'use_snp_selection': True, 'num_snps': 59005}. Best is trial 21 with value: 0.07595283982719275.
[I 2025-11-03 13:25:21,573] Trial 27 finished with value: 0.05544027004641771 and parameters: {'model_type': 'graphsage', 'hidden_dims': '[256, 128]', 'dropout': 0.33797751448016666, 'batch_norm': True, 'lr': 1.5018497626654092e-05, 'weight_decay': 3.513957310170298e-06, 'epochs': 240, 'loss': 'mae', 'optimizer': 'adam', 'graph_mode': 'knn', 'source': 'grm', 'knn_k': 2, 'weighted_edges': True, 'symmetrize_mode': 'union', 'use_snp_selection': False}. Best is trial 21 with value: 0.07595283982719275.
[I 2025-11-03 13:25:24,100] Trial 28 finished with value: 0.05329464303856061 and parameters: {'model_type': 'graphsage', 'hidden_dims': '[256, 128, 64]', 'dropout': 0.4883126803406223, 'batch_norm': True, 'lr': 0.00098044035569326, 'weight_decay': 1.9507633421799747e-07, 'epochs': 205, 'loss': 'mae', 'optimizer': 'adam', 'graph_mode': 'knn', 'source': 'grm', 'knn_k': 3, 'weighted_edges': False, 'symmetrize_mode': 'mutual', 'use_snp_selection': False}. Best is trial 21 with value: 0.07595283982719275.
[I 2025-11-03 13:25:28,858] Trial 29 finished with value: 0.05827044247191277 and parameters: {'model_type': 'graphsage', 'hidden_dims': '[512, 256]', 'dropout': 0.1881763221627633, 'batch_norm': True, 'lr': 6.829316196832362e-05, 'weight_decay': 8.368908757919724e-05, 'epochs': 319, 'loss': 'mae', 'optimizer': 'adam', 'graph_mode': 'knn', 'source': 'grm', 'knn_k': 1, 'weighted_edges': True, 'symmetrize_mode': 'union', 'use_snp_selection': False}. Best is trial 21 with value: 0.07595283982719275.
[I 2025-11-03 13:25:33,521] Trial 30 finished with value: -0.024158386204936915 and parameters: {'model_type': 'graphsage', 'hidden_dims': '[512, 64]', 'dropout': 0.5677785423201455, 'batch_norm': True, 'lr': 3.635227410629533e-06, 'weight_decay': 0.00020511462460338128, 'epochs': 262, 'loss': 'mae', 'optimizer': 'adam', 'graph_mode': 'knn', 'source': 'grm', 'knn_k': 6, 'weighted_edges': True, 'symmetrize_mode': 'union', 'use_snp_selection': False}. Best is trial 21 with value: 0.07595283982719275.
[I 2025-11-03 13:25:37,893] Trial 31 finished with value: 0.06764753599679307 and parameters: {'model_type': 'graphsage', 'hidden_dims': '[512, 256]', 'dropout': 0.3716081310069049, 'batch_norm': True, 'lr': 0.0006863819588707739, 'weight_decay': 1.5137341415320467e-06, 'epochs': 277, 'loss': 'mae', 'optimizer': 'adam', 'graph_mode': 'knn', 'source': 'grm', 'knn_k': 1, 'weighted_edges': True, 'symmetrize_mode': 'union', 'use_snp_selection': False}. Best is trial 21 with value: 0.07595283982719275.
[I 2025-11-03 13:25:42,450] Trial 32 finished with value: 0.05744714206611981 and parameters: {'model_type': 'graphsage', 'hidden_dims': '[512, 256]', 'dropout': 0.37382148172057916, 'batch_norm': True, 'lr': 0.0004910589853969482, 'weight_decay': 2.786844443415281e-06, 'epochs': 283, 'loss': 'mae', 'optimizer': 'adam', 'graph_mode': 'knn', 'source': 'grm', 'knn_k': 2, 'weighted_edges': True, 'symmetrize_mode': 'union', 'use_snp_selection': False}. Best is trial 21 with value: 0.07595283982719275.
[I 2025-11-03 13:25:47,246] Trial 33 finished with value: 0.07324426157938119 and parameters: {'model_type': 'graphsage', 'hidden_dims': '[512, 256]', 'dropout': 0.42585486843332127, 'batch_norm': True, 'lr': 0.0006765772218318893, 'weight_decay': 1.2104753330422556e-06, 'epochs': 324, 'loss': 'mae', 'optimizer': 'adam', 'graph_mode': 'knn', 'source': 'grm', 'knn_k': 1, 'weighted_edges': True, 'symmetrize_mode': 'union', 'use_snp_selection': False}. Best is trial 21 with value: 0.07595283982719275.
[I 2025-11-03 13:25:52,427] Trial 34 finished with value: 0.06794347318531145 and parameters: {'model_type': 'graphsage', 'hidden_dims': '[512, 256]', 'dropout': 0.4278475567572242, 'batch_norm': True, 'lr': 0.0005575604644609341, 'weight_decay': 4.7399395325548765e-07, 'epochs': 347, 'loss': 'mae', 'optimizer': 'adam', 'graph_mode': 'knn', 'source': 'grm', 'knn_k': 3, 'weighted_edges': True, 'symmetrize_mode': 'union', 'use_snp_selection': False}. Best is trial 21 with value: 0.07595283982719275.
[I 2025-11-03 13:25:54,512] Trial 35 finished with value: -0.021902921659865186 and parameters: {'model_type': 'graphsage', 'hidden_dims': '[128, 64]', 'dropout': 0.48840392305105235, 'batch_norm': False, 'lr': 0.0003482759116164647, 'weight_decay': 1.1039069161252982e-06, 'epochs': 318, 'loss': 'mae', 'optimizer': 'adam', 'graph_mode': 'knn', 'source': 'grm', 'knn_k': 2, 'weighted_edges': True, 'symmetrize_mode': 'union', 'use_snp_selection': True, 'num_snps': 2074}. Best is trial 21 with value: 0.07595283982719275.
[I 2025-11-03 13:25:57,673] Trial 36 finished with value: 0.056272349812077946 and parameters: {'model_type': 'graphsage', 'hidden_dims': '[256, 128]', 'dropout': 0.5500835043704291, 'batch_norm': True, 'lr': 0.00015952577916111027, 'weight_decay': 6.751445833830697e-06, 'epochs': 300, 'loss': 'mse', 'optimizer': 'adam', 'graph_mode': 'cutoff', 'cutoff': 0.42596163795855535, 'grm_norm': 'cosine', 'self_loops': True, 'use_snp_selection': False}. Best is trial 21 with value: 0.07595283982719275.
[I 2025-11-03 13:26:00,682] Trial 37 finished with value: 0.023884519976747245 and parameters: {'model_type': 'graphsage', 'hidden_dims': '[256, 128, 64]', 'dropout': 0.4123672909084528, 'batch_norm': False, 'lr': 0.0005903646635415503, 'weight_decay': 1.9708928812127517e-07, 'epochs': 330, 'loss': 'mae', 'optimizer': 'adam', 'graph_mode': 'knn', 'source': 'grm', 'knn_k': 9, 'weighted_edges': True, 'symmetrize_mode': 'mutual', 'use_snp_selection': True, 'num_snps': 15344}. Best is trial 21 with value: 0.07595283982719275.
[I 2025-11-03 13:26:04,370] Trial 38 finished with value: 0.06774545533051951 and parameters: {'model_type': 'graphsage', 'hidden_dims': '[512, 256]', 'dropout': 0.44505563441099255, 'batch_norm': True, 'lr': 0.00019031754328969718, 'weight_decay': 5.579862112500881e-07, 'epochs': 170, 'loss': 'mae', 'optimizer': 'adam', 'graph_mode': 'knn', 'source': 'grm', 'knn_k': 4, 'weighted_edges': True, 'symmetrize_mode': 'union', 'use_snp_selection': False}. Best is trial 21 with value: 0.07595283982719275.
[I 2025-11-03 13:26:08,133] Trial 39 finished with value: -0.004074201025910407 and parameters: {'model_type': 'graphsage', 'hidden_dims': '[128, 64]', 'dropout': 0.4889048404723612, 'batch_norm': False, 'lr': 0.0003634988672651121, 'weight_decay': 0.0006513368993264923, 'epochs': 256, 'loss': 'mse', 'optimizer': 'adam', 'graph_mode': 'cutoff', 'cutoff': 0.8982975816958216, 'grm_norm': 'cosine_then_gcn', 'self_loops': True, 'use_snp_selection': True, 'num_snps': 58379}. Best is trial 21 with value: 0.07595283982719275.
[I 2025-11-03 13:26:12,494] Trial 40 finished with value: 0.06041356285783476 and parameters: {'model_type': 'graphsage', 'hidden_dims': '[512, 64]', 'dropout': 0.3957072013353796, 'batch_norm': True, 'lr': 0.0007146551665531876, 'weight_decay': 1.1357352088898854e-06, 'epochs': 224, 'loss': 'mae', 'optimizer': 'adam', 'graph_mode': 'knn', 'source': 'grm', 'knn_k': 7, 'weighted_edges': True, 'symmetrize_mode': 'union', 'use_snp_selection': False}. Best is trial 21 with value: 0.07595283982719275.
[I 2025-11-03 13:26:16,814] Trial 41 finished with value: 0.06243682715706059 and parameters: {'model_type': 'graphsage', 'hidden_dims': '[512, 256]', 'dropout': 0.34776580713232086, 'batch_norm': True, 'lr': 0.0007784150728948434, 'weight_decay': 3.231871939475821e-06, 'epochs': 271, 'loss': 'mae', 'optimizer': 'adam', 'graph_mode': 'knn', 'source': 'grm', 'knn_k': 1, 'weighted_edges': True, 'symmetrize_mode': 'union', 'use_snp_selection': False}. Best is trial 21 with value: 0.07595283982719275.
[I 2025-11-03 13:26:21,352] Trial 42 finished with value: 0.07314856018357249 and parameters: {'model_type': 'graphsage', 'hidden_dims': '[512, 256]', 'dropout': 0.31086614342855273, 'batch_norm': True, 'lr': 0.0007514686427451255, 'weight_decay': 2.051845908302461e-06, 'epochs': 291, 'loss': 'mae', 'optimizer': 'adam', 'graph_mode': 'knn', 'source': 'grm', 'knn_k': 1, 'weighted_edges': True, 'symmetrize_mode': 'union', 'use_snp_selection': False}. Best is trial 21 with value: 0.07595283982719275.
[I 2025-11-03 13:26:25,875] Trial 43 finished with value: 0.06493504036319887 and parameters: {'model_type': 'graphsage', 'hidden_dims': '[512, 256]', 'dropout': 0.28569459251928997, 'batch_norm': True, 'lr': 0.0004735787035863839, 'weight_decay': 1.324825222814785e-05, 'epochs': 289, 'loss': 'mae', 'optimizer': 'adam', 'graph_mode': 'knn', 'source': 'grm', 'knn_k': 1, 'weighted_edges': False, 'symmetrize_mode': 'union', 'use_snp_selection': False}. Best is trial 21 with value: 0.07595283982719275.
[I 2025-11-03 13:26:28,813] Trial 44 finished with value: 0.05467576602510577 and parameters: {'model_type': 'graphsage', 'hidden_dims': '[512, 256]', 'dropout': 0.3114235324451349, 'batch_norm': True, 'lr': 0.00027167222851844954, 'weight_decay': 7.893953904116566e-07, 'epochs': 100, 'loss': 'mae', 'optimizer': 'adam', 'graph_mode': 'knn', 'source': 'grm', 'knn_k': 2, 'weighted_edges': True, 'symmetrize_mode': 'mutual', 'use_snp_selection': False}. Best is trial 21 with value: 0.07595283982719275.
[I 2025-11-03 13:26:33,707] Trial 45 finished with value: 0.06797532970372565 and parameters: {'model_type': 'graphsage', 'hidden_dims': '[512, 256]', 'dropout': 0.2647683213009973, 'batch_norm': True, 'lr': 0.0007434228854142581, 'weight_decay': 3.4107967725321634e-05, 'epochs': 311, 'loss': 'mse', 'optimizer': 'adam', 'graph_mode': 'cutoff', 'cutoff': 0.4585737354176531, 'grm_norm': 'cosine', 'self_loops': False, 'use_snp_selection': False}. Best is trial 21 with value: 0.07595283982719275.
[I 2025-11-03 13:26:36,762] Trial 46 finished with value: 0.07994171952257709 and parameters: {'model_type': 'graphsage', 'hidden_dims': '[256, 128]', 'dropout': 0.19457645035421856, 'batch_norm': True, 'lr': 0.00042031888886062875, 'weight_decay': 6.218025823104799e-06, 'epochs': 338, 'loss': 'mae', 'optimizer': 'adam', 'graph_mode': 'knn', 'source': 'grm', 'knn_k': 1, 'weighted_edges': True, 'symmetrize_mode': 'union', 'use_snp_selection': False}. Best is trial 46 with value: 0.07994171952257709.
[I 2025-11-03 13:26:39,744] Trial 47 finished with value: 0.05457497534305701 and parameters: {'model_type': 'graphsage', 'hidden_dims': '[256, 128]', 'dropout': 0.18169960925450587, 'batch_norm': True, 'lr': 0.00010126680127720387, 'weight_decay': 8.308850364539464e-06, 'epochs': 335, 'loss': 'mae', 'optimizer': 'adam', 'graph_mode': 'knn', 'source': 'grm', 'knn_k': 1, 'weighted_edges': True, 'symmetrize_mode': 'mutual', 'use_snp_selection': False}. Best is trial 46 with value: 0.07994171952257709.
[I 2025-11-03 13:26:43,557] Trial 48 finished with value: 0.053570620446985545 and parameters: {'model_type': 'graphsage', 'hidden_dims': '[256, 128]', 'dropout': 0.162807255326434, 'batch_norm': False, 'lr': 0.00040440347773083954, 'weight_decay': 1.6255108155653534e-07, 'epochs': 332, 'loss': 'mae', 'optimizer': 'adam', 'graph_mode': 'knn', 'source': 'grm', 'knn_k': 2, 'weighted_edges': False, 'symmetrize_mode': 'union', 'use_snp_selection': True, 'num_snps': 42595}. Best is trial 46 with value: 0.07994171952257709.
[I 2025-11-03 13:26:47,074] Trial 49 finished with value: 0.0755842347212457 and parameters: {'model_type': 'graphsage', 'hidden_dims': '[256, 128]', 'dropout': 0.13548166811241938, 'batch_norm': True, 'lr': 0.0009676431138626852, 'weight_decay': 5.262223327791891e-06, 'epochs': 344, 'loss': 'mse', 'optimizer': 'adam', 'graph_mode': 'knn', 'source': 'grm', 'knn_k': 5, 'weighted_edges': True, 'symmetrize_mode': 'union', 'use_snp_selection': False}. Best is trial 46 with value: 0.07994171952257709.
[I 2025-11-03 13:26:54,042] Trial 50 finished with value: 0.04895287376524929 and parameters: {'model_type': 'graphsage', 'hidden_dims': '[256, 128]', 'dropout': 0.22615370900345247, 'batch_norm': True, 'lr': 0.0009998574899590755, 'weight_decay': 3.192577224729498e-05, 'epochs': 343, 'loss': 'mse', 'optimizer': 'adam', 'graph_mode': 'cutoff', 'cutoff': 0.20628834676422192, 'grm_norm': 'none', 'self_loops': True, 'use_snp_selection': False}. Best is trial 46 with value: 0.07994171952257709.
[I 2025-11-03 13:26:57,773] Trial 51 finished with value: 0.0459979178725749 and parameters: {'model_type': 'graphsage', 'hidden_dims': '[256, 128]', 'dropout': 0.10983106432726795, 'batch_norm': True, 'lr': 0.000536082683446192, 'weight_decay': 4.190490436440621e-06, 'epochs': 350, 'loss': 'mse', 'optimizer': 'adam', 'graph_mode': 'knn', 'source': 'grm', 'knn_k': 7, 'weighted_edges': True, 'symmetrize_mode': 'union', 'use_snp_selection': False}. Best is trial 46 with value: 0.07994171952257709.
[I 2025-11-03 13:27:01,089] Trial 52 finished with value: 0.06543431866591551 and parameters: {'model_type': 'graphsage', 'hidden_dims': '[256, 128]', 'dropout': 0.13610497403519237, 'batch_norm': True, 'lr': 0.0006286647519741411, 'weight_decay': 2.768351400465458e-07, 'epochs': 315, 'loss': 'mse', 'optimizer': 'adam', 'graph_mode': 'knn', 'source': 'grm', 'knn_k': 5, 'weighted_edges': True, 'symmetrize_mode': 'union', 'use_snp_selection': False}. Best is trial 46 with value: 0.07994171952257709.
[I 2025-11-03 13:27:04,574] Trial 53 finished with value: 0.06452889077598954 and parameters: {'model_type': 'graphsage', 'hidden_dims': '[256, 128]', 'dropout': 0.13980428875170783, 'batch_norm': True, 'lr': 0.000317943907667932, 'weight_decay': 1.4793038146652079e-05, 'epochs': 329, 'loss': 'mse', 'optimizer': 'adam', 'graph_mode': 'knn', 'source': 'grm', 'knn_k': 6, 'weighted_edges': True, 'symmetrize_mode': 'union', 'use_snp_selection': False}. Best is trial 46 with value: 0.07994171952257709.
[I 2025-11-03 13:27:08,863] Trial 54 finished with value: 0.06710897098318032 and parameters: {'model_type': 'graphsage', 'hidden_dims': '[512, 128]', 'dropout': 0.21701954028399495, 'batch_norm': True, 'lr': 0.0004373202537171511, 'weight_decay': 2.45822928089571e-06, 'epochs': 238, 'loss': 'mse', 'optimizer': 'adam', 'graph_mode': 'knn', 'source': 'grm', 'knn_k': 4, 'weighted_edges': True, 'symmetrize_mode': 'union', 'use_snp_selection': False}. Best is trial 46 with value: 0.07994171952257709.
[I 2025-11-03 13:27:13,609] Trial 55 finished with value: 0.06964803351558202 and parameters: {'model_type': 'graphsage', 'hidden_dims': '[512, 64]', 'dropout': 0.15785991647025083, 'batch_norm': True, 'lr': 0.0009910736090139813, 'weight_decay': 5.204256852192851e-06, 'epochs': 294, 'loss': 'mae', 'optimizer': 'adam', 'graph_mode': 'knn', 'source': 'grm', 'knn_k': 3, 'weighted_edges': True, 'symmetrize_mode': 'union', 'use_snp_selection': False}. Best is trial 46 with value: 0.07994171952257709.
[I 2025-11-03 13:27:16,546] Trial 56 finished with value: 0.030880643228739166 and parameters: {'model_type': 'graphsage', 'hidden_dims': '[256, 128]', 'dropout': 0.46812012026557415, 'batch_norm': True, 'lr': 2.8447836518732854e-05, 'weight_decay': 9.529086264902571e-06, 'epochs': 306, 'loss': 'mse', 'optimizer': 'adam', 'graph_mode': 'knn', 'source': 'grm', 'knn_k': 1, 'weighted_edges': True, 'symmetrize_mode': 'union', 'use_snp_selection': False}. Best is trial 46 with value: 0.07994171952257709.
[I 2025-11-03 13:27:20,568] Trial 57 finished with value: 0.07164897206779251 and parameters: {'model_type': 'graphsage', 'hidden_dims': '[512, 64]', 'dropout': 0.5107707109284275, 'batch_norm': True, 'lr': 0.00022155651072326102, 'weight_decay': 1.030946108144546e-07, 'epochs': 199, 'loss': 'mae', 'optimizer': 'adam', 'graph_mode': 'knn', 'source': 'grm', 'knn_k': 5, 'weighted_edges': True, 'symmetrize_mode': 'union', 'use_snp_selection': False}. Best is trial 46 with value: 0.07994171952257709.
[I 2025-11-03 13:27:23,040] Trial 58 finished with value: 0.05318857454115983 and parameters: {'model_type': 'graphsage', 'hidden_dims': '[128, 64]', 'dropout': 0.1017433434913463, 'batch_norm': True, 'lr': 0.0008038815578707271, 'weight_decay': 1.399435305729364e-06, 'epochs': 337, 'loss': 'mae', 'optimizer': 'adam', 'graph_mode': 'knn', 'source': 'grm', 'knn_k': 3, 'weighted_edges': False, 'symmetrize_mode': 'mutual', 'use_snp_selection': False}. Best is trial 46 with value: 0.07994171952257709.
[I 2025-11-03 13:27:27,614] Trial 59 finished with value: 0.05710528461457783 and parameters: {'model_type': 'graphsage', 'hidden_dims': '[512, 64]', 'dropout': 0.4430864794103119, 'batch_norm': True, 'lr': 0.0006352999675800423, 'weight_decay': 3.953611912616053e-07, 'epochs': 271, 'loss': 'mae', 'optimizer': 'adam', 'graph_mode': 'knn', 'source': 'grm', 'knn_k': 4, 'weighted_edges': True, 'symmetrize_mode': 'union', 'use_snp_selection': False}. Best is trial 46 with value: 0.07994171952257709.
[I 2025-11-03 13:27:29,949] Trial 60 finished with value: 0.0013331728972574332 and parameters: {'model_type': 'graphsage', 'hidden_dims': '[256, 128]', 'dropout': 0.2120899125851953, 'batch_norm': False, 'lr': 1.711007240128535e-05, 'weight_decay': 2.0071733235662777e-05, 'epochs': 185, 'loss': 'mae', 'optimizer': 'adam', 'graph_mode': 'knn', 'source': 'grm', 'knn_k': 7, 'weighted_edges': True, 'symmetrize_mode': 'union', 'use_snp_selection': True, 'num_snps': 19019}. Best is trial 46 with value: 0.07994171952257709.
[I 2025-11-03 13:27:34,513] Trial 61 finished with value: 0.07566782898698596 and parameters: {'model_type': 'graphsage', 'hidden_dims': '[512, 256]', 'dropout': 0.3167716061205105, 'batch_norm': True, 'lr': 0.0007500211077767016, 'weight_decay': 2.3976007807967742e-06, 'epochs': 294, 'loss': 'mae', 'optimizer': 'adam', 'graph_mode': 'knn', 'source': 'grm', 'knn_k': 1, 'weighted_edges': True, 'symmetrize_mode': 'union', 'use_snp_selection': False}. Best is trial 46 with value: 0.07994171952257709.
