[I 2025-11-03 12:14:55,359] Trial 134 finished with value: 0.0023528445547078406 and parameters: {'model_type': 'gcn', 'hidden_dims': '[256, 128, 64]', 'dropout': 0.3167851793513146, 'batch_norm': True, 'lr': 6.999456596210492e-05, 'weight_decay': 0.0009351450537735186, 'epochs': 159, 'loss': 'mae', 'optimizer': 'adam', 'graph_mode': 'off', 'use_snp_selection': False}. Best is trial 121 with value: 0.06354767617060408.
[I 2025-11-03 12:14:56,583] Trial 135 finished with value: 0.029733517562692935 and parameters: {'model_type': 'gcn', 'hidden_dims': '[256, 128, 64]', 'dropout': 0.3490583902789021, 'batch_norm': True, 'lr': 4.8680869774206354e-05, 'weight_decay': 0.0006802797418088456, 'epochs': 135, 'loss': 'mae', 'optimizer': 'adam', 'graph_mode': 'off', 'use_snp_selection': False}. Best is trial 121 with value: 0.06354767617060408.
[I 2025-11-03 12:14:57,900] Trial 136 finished with value: 0.027425866130239514 and parameters: {'model_type': 'gcn', 'hidden_dims': '[256, 128, 64]', 'dropout': 0.36629170066332206, 'batch_norm': True, 'lr': 5.62476567910208e-05, 'weight_decay': 0.0004599710294158659, 'epochs': 152, 'loss': 'mae', 'optimizer': 'adam', 'graph_mode': 'off', 'use_snp_selection': False}. Best is trial 121 with value: 0.06354767617060408.
[I 2025-11-03 12:14:59,703] Trial 137 finished with value: 0.04265280628032474 and parameters: {'model_type': 'gcn', 'hidden_dims': '[512, 64]', 'dropout': 0.1230843544558306, 'batch_norm': True, 'lr': 4.6300096691487e-05, 'weight_decay': 0.0006667929492891881, 'epochs': 176, 'loss': 'mae', 'optimizer': 'adam', 'graph_mode': 'off', 'use_snp_selection': False}. Best is trial 121 with value: 0.06354767617060408.
[I 2025-11-03 12:15:01,489] Trial 138 finished with value: 0.044372575631304007 and parameters: {'model_type': 'gcn', 'hidden_dims': '[512, 64]', 'dropout': 0.12805006462260532, 'batch_norm': True, 'lr': 4.255707162123497e-05, 'weight_decay': 0.0004972264403588199, 'epochs': 171, 'loss': 'mae', 'optimizer': 'adam', 'graph_mode': 'off', 'use_snp_selection': False}. Best is trial 121 with value: 0.06354767617060408.
[I 2025-11-03 12:15:03,294] Trial 139 finished with value: 0.02524323367477245 and parameters: {'model_type': 'gcn', 'hidden_dims': '[512, 256]', 'dropout': 0.11582771101071761, 'batch_norm': True, 'lr': 4.373445005658654e-05, 'weight_decay': 0.0006779650601774952, 'epochs': 174, 'loss': 'mae', 'optimizer': 'adam', 'graph_mode': 'off', 'use_snp_selection': False}. Best is trial 121 with value: 0.06354767617060408.
[I 2025-11-03 12:15:05,074] Trial 140 finished with value: 0.04395996217620638 and parameters: {'model_type': 'gcn', 'hidden_dims': '[512, 64]', 'dropout': 0.13093187343178952, 'batch_norm': True, 'lr': 3.7539847899145055e-05, 'weight_decay': 0.0005906751288658623, 'epochs': 167, 'loss': 'mae', 'optimizer': 'adam', 'graph_mode': 'off', 'use_snp_selection': False}. Best is trial 121 with value: 0.06354767617060408.
[I 2025-11-03 12:15:06,824] Trial 141 finished with value: 0.002152105466018005 and parameters: {'model_type': 'gcn', 'hidden_dims': '[512, 64]', 'dropout': 0.12929375524099723, 'batch_norm': True, 'lr': 3.524574034014272e-05, 'weight_decay': 0.0005228124021570351, 'epochs': 166, 'loss': 'mae', 'optimizer': 'adam', 'graph_mode': 'off', 'use_snp_selection': False}. Best is trial 121 with value: 0.06354767617060408.
[I 2025-11-03 12:15:08,642] Trial 142 finished with value: 0.010503217687353149 and parameters: {'model_type': 'gcn', 'hidden_dims': '[512, 64]', 'dropout': 0.1283954133802182, 'batch_norm': True, 'lr': 6.237514459654512e-05, 'weight_decay': 0.0004277530002032238, 'epochs': 180, 'loss': 'mae', 'optimizer': 'adam', 'graph_mode': 'off', 'use_snp_selection': False}. Best is trial 121 with value: 0.06354767617060408.
[I 2025-11-03 12:15:10,321] Trial 143 finished with value: 0.0003174646389759743 and parameters: {'model_type': 'gcn', 'hidden_dims': '[512, 64]', 'dropout': 0.15255900928444396, 'batch_norm': True, 'lr': 4.041635135372684e-05, 'weight_decay': 0.0007361504942922185, 'epochs': 157, 'loss': 'mae', 'optimizer': 'adam', 'graph_mode': 'off', 'use_snp_selection': False}. Best is trial 121 with value: 0.06354767617060408.
[I 2025-11-03 12:15:12,109] Trial 144 finished with value: 0.033444851639893254 and parameters: {'model_type': 'gcn', 'hidden_dims': '[512, 64]', 'dropout': 0.1607723849300889, 'batch_norm': True, 'lr': 4.8488476351770895e-05, 'weight_decay': 0.0006300749601605592, 'epochs': 168, 'loss': 'mae', 'optimizer': 'adam', 'graph_mode': 'off', 'use_snp_selection': False}. Best is trial 121 with value: 0.06354767617060408.
[I 2025-11-03 12:15:13,906] Trial 145 finished with value: 0.018224256092564162 and parameters: {'model_type': 'gcn', 'hidden_dims': '[512, 64]', 'dropout': 0.12526446061883312, 'batch_norm': True, 'lr': 3.2666308039080756e-05, 'weight_decay': 0.000994873618007261, 'epochs': 175, 'loss': 'mae', 'optimizer': 'adam', 'graph_mode': 'off', 'use_snp_selection': False}. Best is trial 121 with value: 0.06354767617060408.
[I 2025-11-03 12:15:15,602] Trial 146 finished with value: 0.00732133680572916 and parameters: {'model_type': 'gcn', 'hidden_dims': '[512, 64]', 'dropout': 0.14339610914492398, 'batch_norm': True, 'lr': 0.00010738228956968921, 'weight_decay': 0.0004920598062814488, 'epochs': 141, 'loss': 'mae', 'optimizer': 'adam', 'graph_mode': 'off', 'use_snp_selection': False}. Best is trial 121 with value: 0.06354767617060408.
[I 2025-11-03 12:15:17,290] Trial 147 finished with value: 0.01331777472137012 and parameters: {'model_type': 'gcn', 'hidden_dims': '[512, 64]', 'dropout': 0.14166865237654203, 'batch_norm': True, 'lr': 6.260622677307829e-05, 'weight_decay': 0.0002649022147976441, 'epochs': 153, 'loss': 'mae', 'optimizer': 'adam', 'graph_mode': 'off', 'use_snp_selection': False}. Best is trial 121 with value: 0.06354767617060408.
[I 2025-11-03 12:15:19,094] Trial 148 finished with value: 0.008123054885290042 and parameters: {'model_type': 'gcn', 'hidden_dims': '[512, 64]', 'dropout': 0.11795836145439088, 'batch_norm': True, 'lr': 5.283769355176815e-05, 'weight_decay': 0.000814542611226266, 'epochs': 161, 'loss': 'mae', 'optimizer': 'adam', 'graph_mode': 'off', 'use_snp_selection': False}. Best is trial 121 with value: 0.06354767617060408.
[I 2025-11-03 12:15:21,066] Trial 149 finished with value: -0.026519335087219667 and parameters: {'model_type': 'gcn', 'hidden_dims': '[512, 64]', 'dropout': 0.487485221200691, 'batch_norm': True, 'lr': 3.729827479831066e-05, 'weight_decay': 0.0003904363345865929, 'epochs': 146, 'loss': 'mae', 'optimizer': 'adam', 'graph_mode': 'off', 'use_snp_selection': True, 'num_snps': 38518}. Best is trial 121 with value: 0.06354767617060408.
[I 2025-11-03 12:15:23,090] Trial 0 finished with value: 0.016680091159470372 and parameters: {'model_type': 'gcn', 'hidden_dims': '[128, 64]', 'dropout': 0.199031432379812, 'batch_norm': True, 'lr': 1.8408544111075837e-06, 'weight_decay': 5.5136510071208614e-05, 'epochs': 336, 'loss': 'mae', 'optimizer': 'adam', 'graph_mode': 'off', 'use_snp_selection': True, 'num_snps': 43862}. Best is trial 0 with value: 0.016680091159470372.
[I 2025-11-03 12:15:24,593] Trial 1 finished with value: 0.08280046436649242 and parameters: {'model_type': 'gcn', 'hidden_dims': '[256, 128]', 'dropout': 0.4370668075331726, 'batch_norm': True, 'lr': 7.133471581159139e-05, 'weight_decay': 1.128633586803549e-05, 'epochs': 242, 'loss': 'mae', 'optimizer': 'adam', 'graph_mode': 'off', 'use_snp_selection': False}. Best is trial 1 with value: 0.08280046436649242.
[I 2025-11-03 12:15:25,655] Trial 2 finished with value: 0.04590210997089495 and parameters: {'model_type': 'gcn', 'hidden_dims': '[256, 128, 64]', 'dropout': 0.41314357415569625, 'batch_norm': False, 'lr': 3.952233718592101e-06, 'weight_decay': 0.00026754769258252603, 'epochs': 149, 'loss': 'mse', 'optimizer': 'adam', 'graph_mode': 'off', 'use_snp_selection': True, 'num_snps': 11571}. Best is trial 1 with value: 0.08280046436649242.
[I 2025-11-03 12:15:27,910] Trial 3 finished with value: 0.016600954453009777 and parameters: {'model_type': 'gcn', 'hidden_dims': '[512, 64]', 'dropout': 0.5938127374509361, 'batch_norm': False, 'lr': 5.67704586114731e-06, 'weight_decay': 2.4518087630137052e-05, 'epochs': 320, 'loss': 'mae', 'optimizer': 'adam', 'graph_mode': 'off', 'use_snp_selection': False}. Best is trial 1 with value: 0.08280046436649242.
[I 2025-11-03 12:15:30,098] Trial 4 finished with value: 0.015488962356272106 and parameters: {'model_type': 'gcn', 'hidden_dims': '[512, 128]', 'dropout': 0.25746343592134413, 'batch_norm': True, 'lr': 1.3467657668402788e-06, 'weight_decay': 0.00033087251918647806, 'epochs': 277, 'loss': 'mse', 'optimizer': 'adam', 'graph_mode': 'off', 'use_snp_selection': True, 'num_snps': 36675}. Best is trial 1 with value: 0.08280046436649242.
[I 2025-11-03 12:15:31,697] Trial 5 finished with value: 0.016930621869394133 and parameters: {'model_type': 'gcn', 'hidden_dims': '[512, 64]', 'dropout': 0.38275350994408375, 'batch_norm': True, 'lr': 1.5586664309232824e-06, 'weight_decay': 0.0008227664668621182, 'epochs': 145, 'loss': 'mae', 'optimizer': 'adam', 'graph_mode': 'off', 'use_snp_selection': True, 'num_snps': 32148}. Best is trial 1 with value: 0.08280046436649242.
[I 2025-11-03 12:15:32,940] Trial 6 finished with value: 0.04695713864726019 and parameters: {'model_type': 'gcn', 'hidden_dims': '[256, 128]', 'dropout': 0.3930109900265879, 'batch_norm': False, 'lr': 4.892964372128395e-05, 'weight_decay': 1.5809549317992182e-06, 'epochs': 199, 'loss': 'mse', 'optimizer': 'adam', 'graph_mode': 'off', 'use_snp_selection': False}. Best is trial 1 with value: 0.08280046436649242.
[I 2025-11-03 12:15:34,140] Trial 7 finished with value: 0.10410420071973245 and parameters: {'model_type': 'gcn', 'hidden_dims': '[512, 256]', 'dropout': 0.15343979219678458, 'batch_norm': True, 'lr': 6.234003099047341e-05, 'weight_decay': 3.894760610535477e-07, 'epochs': 97, 'loss': 'mse', 'optimizer': 'adam', 'graph_mode': 'off', 'use_snp_selection': False}. Best is trial 7 with value: 0.10410420071973245.
[I 2025-11-03 12:15:36,419] Trial 8 finished with value: 0.11845447630756352 and parameters: {'model_type': 'gcn', 'hidden_dims': '[512, 128]', 'dropout': 0.10743001231661406, 'batch_norm': True, 'lr': 0.00023728538449271062, 'weight_decay': 1.7629071578048637e-05, 'epochs': 312, 'loss': 'mae', 'optimizer': 'adam', 'graph_mode': 'off', 'use_snp_selection': False}. Best is trial 8 with value: 0.11845447630756352.
[I 2025-11-03 12:15:38,047] Trial 9 finished with value: 0.11385546814852783 and parameters: {'model_type': 'gcn', 'hidden_dims': '[512, 64]', 'dropout': 0.14505336736221927, 'batch_norm': True, 'lr': 5.8619638388111826e-05, 'weight_decay': 6.200156172669308e-07, 'epochs': 175, 'loss': 'mse', 'optimizer': 'adam', 'graph_mode': 'off', 'use_snp_selection': False}. Best is trial 8 with value: 0.11845447630756352.
[I 2025-11-03 12:15:39,158] Trial 10 finished with value: 0.020131588512014725 and parameters: {'model_type': 'gcn', 'hidden_dims': '[512, 128]', 'dropout': 0.2800030442581858, 'batch_norm': False, 'lr': 0.0004919806695968257, 'weight_decay': 2.9953888095455486e-06, 'epochs': 55, 'loss': 'mae', 'optimizer': 'adam', 'graph_mode': 'off', 'use_snp_selection': False}. Best is trial 8 with value: 0.11845447630756352.
[I 2025-11-03 12:15:40,977] Trial 11 finished with value: 0.1465910463303249 and parameters: {'model_type': 'gcn', 'hidden_dims': '[512, 128]', 'dropout': 0.10095648685224448, 'batch_norm': True, 'lr': 0.0003411435764085616, 'weight_decay': 1.2045055692919657e-07, 'epochs': 216, 'loss': 'mse', 'optimizer': 'adam', 'graph_mode': 'off', 'use_snp_selection': False}. Best is trial 11 with value: 0.1465910463303249.
[I 2025-11-03 12:15:43,006] Trial 12 finished with value: 0.12530850084137737 and parameters: {'model_type': 'gcn', 'hidden_dims': '[512, 128]', 'dropout': 0.10344600881777158, 'batch_norm': True, 'lr': 0.0006674532614549997, 'weight_decay': 1.3081036432574914e-07, 'epochs': 255, 'loss': 'mae', 'optimizer': 'adam', 'graph_mode': 'off', 'use_snp_selection': False}. Best is trial 11 with value: 0.1465910463303249.
[I 2025-11-03 12:15:44,960] Trial 13 finished with value: 0.1325926216115159 and parameters: {'model_type': 'gcn', 'hidden_dims': '[512, 128]', 'dropout': 0.22096278001553593, 'batch_norm': True, 'lr': 0.0005692918571972218, 'weight_decay': 1.0885943577911259e-07, 'epochs': 236, 'loss': 'mse', 'optimizer': 'adam', 'graph_mode': 'off', 'use_snp_selection': False}. Best is trial 11 with value: 0.1465910463303249.
[I 2025-11-03 12:15:46,808] Trial 14 finished with value: 0.1138028390293707 and parameters: {'model_type': 'gcn', 'hidden_dims': '[512, 128]', 'dropout': 0.23392465516112823, 'batch_norm': True, 'lr': 0.0002108574938852793, 'weight_decay': 1.0444671845585217e-07, 'epochs': 217, 'loss': 'mse', 'optimizer': 'adam', 'graph_mode': 'off', 'use_snp_selection': False}. Best is trial 11 with value: 0.1465910463303249.
[I 2025-11-03 12:15:48,061] Trial 15 finished with value: 0.13170711509988153 and parameters: {'model_type': 'gcn', 'hidden_dims': '[128, 64]', 'dropout': 0.316654910482128, 'batch_norm': True, 'lr': 0.00020129884303790978, 'weight_decay': 3.799898316093095e-07, 'epochs': 288, 'loss': 'mse', 'optimizer': 'adam', 'graph_mode': 'off', 'use_snp_selection': False}. Best is trial 11 with value: 0.1465910463303249.
[I 2025-11-03 12:15:49,593] Trial 16 finished with value: 0.03194988068092687 and parameters: {'model_type': 'gcn', 'hidden_dims': '[256, 128, 64]', 'dropout': 0.1939926453793234, 'batch_norm': True, 'lr': 1.9769161257438765e-05, 'weight_decay': 1.528022915982662e-06, 'epochs': 223, 'loss': 'mse', 'optimizer': 'adam', 'graph_mode': 'off', 'use_snp_selection': False}. Best is trial 11 with value: 0.1465910463303249.
[I 2025-11-03 12:15:51,101] Trial 17 finished with value: 0.13921316198800213 and parameters: {'model_type': 'gcn', 'hidden_dims': '[512, 256]', 'dropout': 0.31793710483525317, 'batch_norm': True, 'lr': 0.000906375209920231, 'weight_decay': 2.5801072347044834e-07, 'epochs': 153, 'loss': 'mse', 'optimizer': 'adam', 'graph_mode': 'off', 'use_snp_selection': False}. Best is trial 11 with value: 0.1465910463303249.
[I 2025-11-03 12:15:53,305] Trial 18 finished with value: 0.0742231683478797 and parameters: {'model_type': 'gcn', 'hidden_dims': '[512, 256]', 'dropout': 0.4995113903096453, 'batch_norm': False, 'lr': 0.000990842629404931, 'weight_decay': 4.109412643182285e-06, 'epochs': 120, 'loss': 'mse', 'optimizer': 'adam', 'graph_mode': 'off', 'use_snp_selection': True, 'num_snps': 58241}. Best is trial 11 with value: 0.1465910463303249.
[I 2025-11-03 12:15:54,489] Trial 19 finished with value: 0.06974256186037855 and parameters: {'model_type': 'gcn', 'hidden_dims': '[512, 256]', 'dropout': 0.5244439216129158, 'batch_norm': True, 'lr': 0.00013346863904656342, 'weight_decay': 3.039310891206856e-07, 'epochs': 77, 'loss': 'mse', 'optimizer': 'adam', 'graph_mode': 'off', 'use_snp_selection': False}. Best is trial 11 with value: 0.1465910463303249.
[I 2025-11-03 12:15:56,116] Trial 20 finished with value: 0.030583450813024785 and parameters: {'model_type': 'gcn', 'hidden_dims': '[512, 256]', 'dropout': 0.32401365594299525, 'batch_norm': True, 'lr': 1.6465519595683603e-05, 'weight_decay': 1.2770202695761685e-06, 'epochs': 173, 'loss': 'mse', 'optimizer': 'adam', 'graph_mode': 'off', 'use_snp_selection': False}. Best is trial 11 with value: 0.1465910463303249.
[I 2025-11-03 12:15:57,782] Trial 21 finished with value: 0.12988545095410484 and parameters: {'model_type': 'gcn', 'hidden_dims': '[512, 128]', 'dropout': 0.20190815228980746, 'batch_norm': True, 'lr': 0.00041815773207717823, 'weight_decay': 1.9437011809239585e-07, 'epochs': 192, 'loss': 'mse', 'optimizer': 'adam', 'graph_mode': 'off', 'use_snp_selection': False}. Best is trial 11 with value: 0.1465910463303249.
[I 2025-11-03 12:15:59,708] Trial 22 finished with value: 0.12705989761073894 and parameters: {'model_type': 'gcn', 'hidden_dims': '[512, 128]', 'dropout': 0.298388823040876, 'batch_norm': True, 'lr': 0.0009148532821511736, 'weight_decay': 1.0790082404688784e-07, 'epochs': 235, 'loss': 'mse', 'optimizer': 'adam', 'graph_mode': 'off', 'use_snp_selection': False}. Best is trial 11 with value: 0.1465910463303249.
[I 2025-11-03 12:16:01,812] Trial 23 finished with value: 0.12169198106906401 and parameters: {'model_type': 'gcn', 'hidden_dims': '[512, 256]', 'dropout': 0.35319312099558187, 'batch_norm': True, 'lr': 0.00038381777875267964, 'weight_decay': 7.257501053304995e-07, 'epochs': 268, 'loss': 'mse', 'optimizer': 'adam', 'graph_mode': 'off', 'use_snp_selection': False}. Best is trial 11 with value: 0.1465910463303249.
[I 2025-11-03 12:16:03,333] Trial 24 finished with value: 0.12126930193142643 and parameters: {'model_type': 'gcn', 'hidden_dims': '[512, 128]', 'dropout': 0.24308458480614367, 'batch_norm': True, 'lr': 0.00012933696064794652, 'weight_decay': 2.3537769977222593e-07, 'epochs': 142, 'loss': 'mse', 'optimizer': 'adam', 'graph_mode': 'off', 'use_snp_selection': False}. Best is trial 11 with value: 0.1465910463303249.
[I 2025-11-03 12:16:04,669] Trial 25 finished with value: 0.12217043008618525 and parameters: {'model_type': 'gcn', 'hidden_dims': '[256, 128, 64]', 'dropout': 0.14438997107218368, 'batch_norm': True, 'lr': 0.00034217070030822817, 'weight_decay': 6.213405133522597e-07, 'epochs': 178, 'loss': 'mse', 'optimizer': 'adam', 'graph_mode': 'off', 'use_snp_selection': False}. Best is trial 11 with value: 0.1465910463303249.
[I 2025-11-03 12:16:05,590] Trial 26 finished with value: 0.0805186656784477 and parameters: {'model_type': 'gcn', 'hidden_dims': '[256, 128]', 'dropout': 0.18801805298203636, 'batch_norm': False, 'lr': 0.00012591450479871113, 'weight_decay': 1.914686940375147e-07, 'epochs': 212, 'loss': 'mse', 'optimizer': 'adam', 'graph_mode': 'off', 'use_snp_selection': True, 'num_snps': 3842}. Best is trial 11 with value: 0.1465910463303249.
[I 2025-11-03 12:16:06,406] Trial 27 finished with value: 0.0959818608116218 and parameters: {'model_type': 'gcn', 'hidden_dims': '[128, 64]', 'dropout': 0.35241119811033617, 'batch_norm': True, 'lr': 0.0006455166402732144, 'weight_decay': 4.881339110858778e-06, 'epochs': 112, 'loss': 'mse', 'optimizer': 'adam', 'graph_mode': 'off', 'use_snp_selection': False}. Best is trial 11 with value: 0.1465910463303249.
[I 2025-11-03 12:16:07,952] Trial 28 finished with value: 0.11461433295146632 and parameters: {'model_type': 'gcn', 'hidden_dims': '[512, 256]', 'dropout': 0.2667359562450607, 'batch_norm': True, 'lr': 0.0002815071575084282, 'weight_decay': 8.74418883788382e-07, 'epochs': 160, 'loss': 'mse', 'optimizer': 'adam', 'graph_mode': 'off', 'use_snp_selection': False}. Best is trial 11 with value: 0.1465910463303249.
[I 2025-11-03 12:16:09,389] Trial 29 finished with value: 0.11960234970856869 and parameters: {'model_type': 'gcn', 'hidden_dims': '[128, 64]', 'dropout': 0.17145735929053066, 'batch_norm': True, 'lr': 0.0006450544435374301, 'weight_decay': 5.522710335772491e-05, 'epochs': 294, 'loss': 'mse', 'optimizer': 'adam', 'graph_mode': 'off', 'use_snp_selection': True, 'num_snps': 19468}. Best is trial 11 with value: 0.1465910463303249.
[I 2025-11-03 12:16:11,362] Trial 30 finished with value: 0.06330611672325809 and parameters: {'model_type': 'gcn', 'hidden_dims': '[512, 128]', 'dropout': 0.23115511282450416, 'batch_norm': True, 'lr': 2.45999333475399e-05, 'weight_decay': 4.166153154596443e-07, 'epochs': 251, 'loss': 'mse', 'optimizer': 'adam', 'graph_mode': 'off', 'use_snp_selection': False}. Best is trial 11 with value: 0.1465910463303249.
[I 2025-11-03 12:16:12,766] Trial 31 finished with value: 0.11055463819625168 and parameters: {'model_type': 'gcn', 'hidden_dims': '[128, 64]', 'dropout': 0.30598689677544066, 'batch_norm': True, 'lr': 0.00017662389674855466, 'weight_decay': 2.306768064291122e-07, 'epochs': 337, 'loss': 'mse', 'optimizer': 'adam', 'graph_mode': 'off', 'use_snp_selection': False}. Best is trial 11 with value: 0.1465910463303249.
[I 2025-11-03 12:16:14,050] Trial 32 finished with value: 0.10247490666573615 and parameters: {'model_type': 'gcn', 'hidden_dims': '[128, 64]', 'dropout': 0.3164105669063845, 'batch_norm': True, 'lr': 9.30035717734808e-05, 'weight_decay': 4.1034465945658916e-07, 'epochs': 292, 'loss': 'mse', 'optimizer': 'adam', 'graph_mode': 'off', 'use_snp_selection': False}. Best is trial 11 with value: 0.1465910463303249.
[I 2025-11-03 12:16:15,195] Trial 33 finished with value: 0.10476853555149863 and parameters: {'model_type': 'gcn', 'hidden_dims': '[128, 64]', 'dropout': 0.43753188496362744, 'batch_norm': True, 'lr': 0.000547490228793058, 'weight_decay': 1.4303558564523898e-07, 'epochs': 242, 'loss': 'mse', 'optimizer': 'adam', 'graph_mode': 'off', 'use_snp_selection': False}. Best is trial 11 with value: 0.1465910463303249.
[I 2025-11-03 12:16:16,254] Trial 34 finished with value: 0.03656395287286628 and parameters: {'model_type': 'gcn', 'hidden_dims': '[128, 64]', 'dropout': 0.21891863511888576, 'batch_norm': True, 'lr': 1.1338103788346778e-05, 'weight_decay': 3.610959429358163e-07, 'epochs': 201, 'loss': 'mae', 'optimizer': 'adam', 'graph_mode': 'off', 'use_snp_selection': False}. Best is trial 11 with value: 0.1465910463303249.
[I 2025-11-03 12:16:17,704] Trial 35 finished with value: 0.08421867649492537 and parameters: {'model_type': 'gcn', 'hidden_dims': '[256, 128]', 'dropout': 0.4544759458916864, 'batch_norm': False, 'lr': 0.00029864640513781394, 'weight_decay': 1.996167689846049e-06, 'epochs': 276, 'loss': 'mse', 'optimizer': 'adam', 'graph_mode': 'off', 'use_snp_selection': False}. Best is trial 11 with value: 0.1465910463303249.
