[I 2025-11-03 13:55:33,391] Trial 61 finished with value: 0.08952865585428985 and parameters: {'model_type': 'gcn', 'hidden_dims': '[512, 256]', 'dropout': 0.2870089372420074, 'batch_norm': True, 'lr': 0.0009627478831405281, 'weight_decay': 6.114231316007446e-05, 'epochs': 91, 'loss': 'mse', 'optimizer': 'adam', 'graph_mode': 'knn', 'source': 'grm', 'knn_k': 10, 'weighted_edges': False, 'symmetrize_mode': 'mutual', 'use_snp_selection': False}. Best is trial 11 with value: 0.1282886373815262.
[I 2025-11-03 13:55:34,550] Trial 62 finished with value: 0.11605181181241014 and parameters: {'model_type': 'gcn', 'hidden_dims': '[128, 64]', 'dropout': 0.2570964600662787, 'batch_norm': True, 'lr': 0.000811484526992717, 'weight_decay': 3.8830364308360286e-05, 'epochs': 55, 'loss': 'mse', 'optimizer': 'adam', 'graph_mode': 'knn', 'source': 'grm', 'knn_k': 7, 'weighted_edges': False, 'symmetrize_mode': 'mutual', 'use_snp_selection': False}. Best is trial 11 with value: 0.1282886373815262.
[I 2025-11-03 13:55:36,626] Trial 63 finished with value: 0.0780095611780099 and parameters: {'model_type': 'gcn', 'hidden_dims': '[512, 256]', 'dropout': 0.3527019101115694, 'batch_norm': True, 'lr': 0.0006143807774342511, 'weight_decay': 1.234520272986005e-05, 'epochs': 158, 'loss': 'mse', 'optimizer': 'adam', 'graph_mode': 'knn', 'source': 'grm', 'knn_k': 2, 'weighted_edges': False, 'symmetrize_mode': 'mutual', 'use_snp_selection': False}. Best is trial 11 with value: 0.1282886373815262.
[I 2025-11-03 13:55:38,871] Trial 64 finished with value: 0.09824334155972791 and parameters: {'model_type': 'gcn', 'hidden_dims': '[512, 256]', 'dropout': 0.3682389389991415, 'batch_norm': True, 'lr': 0.00046069626913577554, 'weight_decay': 8.867481370029064e-05, 'epochs': 195, 'loss': 'mse', 'optimizer': 'adam', 'graph_mode': 'knn', 'source': 'grm', 'knn_k': 9, 'weighted_edges': False, 'symmetrize_mode': 'mutual', 'use_snp_selection': False}. Best is trial 11 with value: 0.1282886373815262.
[I 2025-11-03 13:55:40,444] Trial 65 finished with value: 0.09781883601937703 and parameters: {'model_type': 'gcn', 'hidden_dims': '[256, 128, 64]', 'dropout': 0.4264605355400241, 'batch_norm': True, 'lr': 0.0007555445314483744, 'weight_decay': 4.632653168593456e-06, 'epochs': 105, 'loss': 'mse', 'optimizer': 'adam', 'graph_mode': 'knn', 'source': 'grm', 'knn_k': 8, 'weighted_edges': False, 'symmetrize_mode': 'mutual', 'use_snp_selection': False}. Best is trial 11 with value: 0.1282886373815262.
[I 2025-11-03 13:55:42,318] Trial 66 finished with value: 0.06279705211265767 and parameters: {'model_type': 'gcn', 'hidden_dims': '[512, 64]', 'dropout': 0.45916151648000253, 'batch_norm': True, 'lr': 0.0005629309776669195, 'weight_decay': 1.6872622673834366e-05, 'epochs': 119, 'loss': 'mae', 'optimizer': 'adam', 'graph_mode': 'knn', 'source': 'grm', 'knn_k': 6, 'weighted_edges': True, 'symmetrize_mode': 'mutual', 'use_snp_selection': False}. Best is trial 11 with value: 0.1282886373815262.
[I 2025-11-03 13:55:43,747] Trial 67 finished with value: 0.019747200714789297 and parameters: {'model_type': 'gcn', 'hidden_dims': '[512, 256]', 'dropout': 0.2313690561942176, 'batch_norm': True, 'lr': 2.865433062445272e-06, 'weight_decay': 8.144644929289122e-06, 'epochs': 40, 'loss': 'mse', 'optimizer': 'adam', 'graph_mode': 'cutoff', 'cutoff': 0.8172216591524022, 'grm_norm': 'gcn', 'self_loops': False, 'use_snp_selection': False}. Best is trial 11 with value: 0.1282886373815262.
[I 2025-11-03 13:55:45,332] Trial 68 finished with value: 0.01033609525579535 and parameters: {'model_type': 'gcn', 'hidden_dims': '[512, 64]', 'dropout': 0.32178054096333303, 'batch_norm': True, 'lr': 0.00023865511139071585, 'weight_decay': 4.1970206955979893e-05, 'epochs': 59, 'loss': 'mse', 'optimizer': 'adam', 'graph_mode': 'knn', 'source': 'grm', 'knn_k': 10, 'weighted_edges': False, 'symmetrize_mode': 'union', 'use_snp_selection': False}. Best is trial 11 with value: 0.1282886373815262.
[I 2025-11-03 13:55:46,669] Trial 69 finished with value: 0.09877477791400452 and parameters: {'model_type': 'gcn', 'hidden_dims': '[512, 256]', 'dropout': 0.3019434308294358, 'batch_norm': True, 'lr': 0.00040217678798175696, 'weight_decay': 0.0009284540808322837, 'epochs': 9, 'loss': 'mse', 'optimizer': 'adam', 'graph_mode': 'knn', 'source': 'grm', 'knn_k': 5, 'weighted_edges': True, 'symmetrize_mode': 'mutual', 'use_snp_selection': False}. Best is trial 11 with value: 0.1282886373815262.
[I 2025-11-03 13:55:47,854] Trial 70 finished with value: 0.09106404807358932 and parameters: {'model_type': 'gcn', 'hidden_dims': '[128, 64]', 'dropout': 0.3796359375927557, 'batch_norm': True, 'lr': 0.000978918874897597, 'weight_decay': 2.7812495570474892e-05, 'epochs': 83, 'loss': 'mse', 'optimizer': 'adam', 'graph_mode': 'cutoff', 'cutoff': 0.6564988153455706, 'grm_norm': 'none', 'self_loops': False, 'use_snp_selection': False}. Best is trial 11 with value: 0.1282886373815262.
[I 2025-11-03 13:55:49,006] Trial 71 finished with value: 0.1006304989013771 and parameters: {'model_type': 'gcn', 'hidden_dims': '[128, 64]', 'dropout': 0.24796853466084506, 'batch_norm': True, 'lr': 0.0007688601313816003, 'weight_decay': 3.7986969729459905e-05, 'epochs': 53, 'loss': 'mse', 'optimizer': 'adam', 'graph_mode': 'knn', 'source': 'grm', 'knn_k': 7, 'weighted_edges': False, 'symmetrize_mode': 'mutual', 'use_snp_selection': False}. Best is trial 11 with value: 0.1282886373815262.
[I 2025-11-03 13:55:50,188] Trial 72 finished with value: 0.10626515339457869 and parameters: {'model_type': 'gcn', 'hidden_dims': '[128, 64]', 'dropout': 0.2842943621092648, 'batch_norm': True, 'lr': 0.0005416135975855454, 'weight_decay': 2.248374558829055e-05, 'epochs': 62, 'loss': 'mse', 'optimizer': 'adam', 'graph_mode': 'knn', 'source': 'grm', 'knn_k': 7, 'weighted_edges': False, 'symmetrize_mode': 'mutual', 'use_snp_selection': False}. Best is trial 11 with value: 0.1282886373815262.
[I 2025-11-03 13:55:52,224] Trial 73 finished with value: 0.0762224022084248 and parameters: {'model_type': 'gcn', 'hidden_dims': '[128, 64]', 'dropout': 0.18111125281372187, 'batch_norm': True, 'lr': 0.0008267475767789502, 'weight_decay': 5.774924782181936e-07, 'epochs': 350, 'loss': 'mse', 'optimizer': 'adam', 'graph_mode': 'knn', 'source': 'grm', 'knn_k': 8, 'weighted_edges': False, 'symmetrize_mode': 'mutual', 'use_snp_selection': False}. Best is trial 11 with value: 0.1282886373815262.
[I 2025-11-03 13:55:53,519] Trial 74 finished with value: 0.011712711710382599 and parameters: {'model_type': 'gcn', 'hidden_dims': '[128, 64]', 'dropout': 0.26501758743496684, 'batch_norm': True, 'lr': 0.0006805265144356064, 'weight_decay': 5.2517158985600617e-05, 'epochs': 99, 'loss': 'mse', 'optimizer': 'adam', 'graph_mode': 'knn', 'source': 'grm', 'knn_k': 8, 'weighted_edges': False, 'symmetrize_mode': 'union', 'use_snp_selection': False}. Best is trial 11 with value: 0.1282886373815262.
[I 2025-11-03 13:55:55,068] Trial 75 finished with value: 0.08704693668562798 and parameters: {'model_type': 'gcn', 'hidden_dims': '[512, 64]', 'dropout': 0.2192780003891231, 'batch_norm': True, 'lr': 0.0004064049145497251, 'weight_decay': 1.6531736505280336e-06, 'epochs': 49, 'loss': 'mse', 'optimizer': 'adam', 'graph_mode': 'knn', 'source': 'grm', 'knn_k': 9, 'weighted_edges': True, 'symmetrize_mode': 'mutual', 'use_snp_selection': False}. Best is trial 11 with value: 0.1282886373815262.
[I 2025-11-03 13:55:56,538] Trial 76 finished with value: 0.042010349213210875 and parameters: {'model_type': 'gcn', 'hidden_dims': '[512, 256]', 'dropout': 0.34760008666733333, 'batch_norm': True, 'lr': 0.0003420740351986564, 'weight_decay': 7.778211410981834e-05, 'epochs': 37, 'loss': 'mse', 'optimizer': 'adam', 'graph_mode': 'knn', 'source': 'grm', 'knn_k': 6, 'weighted_edges': False, 'symmetrize_mode': 'union', 'use_snp_selection': False}. Best is trial 11 with value: 0.1282886373815262.
[I 2025-11-03 13:55:59,223] Trial 77 finished with value: 0.07618887584257736 and parameters: {'model_type': 'gcn', 'hidden_dims': '[512, 64]', 'dropout': 0.48688895877539545, 'batch_norm': True, 'lr': 0.0008415972717505583, 'weight_decay': 6.633151980576224e-06, 'epochs': 298, 'loss': 'mae', 'optimizer': 'adam', 'graph_mode': 'cutoff', 'cutoff': 0.8102391005208964, 'grm_norm': 'cosine_then_gcn', 'self_loops': False, 'use_snp_selection': False}. Best is trial 11 with value: 0.1282886373815262.
[I 2025-11-03 13:56:02,178] Trial 78 finished with value: 0.022274016097321186 and parameters: {'model_type': 'gcn', 'hidden_dims': '[512, 128]', 'dropout': 0.4008263951215053, 'batch_norm': False, 'lr': 0.0006448390910866648, 'weight_decay': 1.523895042474113e-05, 'epochs': 112, 'loss': 'mse', 'optimizer': 'adam', 'graph_mode': 'knn', 'source': 'grm', 'knn_k': 9, 'weighted_edges': True, 'symmetrize_mode': 'mutual', 'use_snp_selection': True, 'num_snps': 49628}. Best is trial 11 with value: 0.1282886373815262.
[I 2025-11-03 13:56:03,906] Trial 79 finished with value: 0.040192961742502725 and parameters: {'model_type': 'gcn', 'hidden_dims': '[256, 128, 64]', 'dropout': 0.32864657075055803, 'batch_norm': True, 'lr': 7.899140011217064e-06, 'weight_decay': 3.9386531645807544e-07, 'epochs': 133, 'loss': 'mse', 'optimizer': 'adam', 'graph_mode': 'knn', 'source': 'grm', 'knn_k': 10, 'weighted_edges': False, 'symmetrize_mode': 'union', 'use_snp_selection': False}. Best is trial 11 with value: 0.1282886373815262.
[I 2025-11-03 13:56:05,535] Trial 80 finished with value: 0.1127802645286185 and parameters: {'model_type': 'gcn', 'hidden_dims': '[512, 256]', 'dropout': 0.4360436423269217, 'batch_norm': True, 'lr': 0.0004835810974294421, 'weight_decay': 1.0731937871047186e-05, 'epochs': 80, 'loss': 'mse', 'optimizer': 'adam', 'graph_mode': 'cutoff', 'cutoff': 0.7429069869955576, 'grm_norm': 'cosine_then_gcn', 'self_loops': True, 'use_snp_selection': False}. Best is trial 11 with value: 0.1282886373815262.
[I 2025-11-03 13:56:07,480] Trial 81 finished with value: 0.12379121400237321 and parameters: {'model_type': 'gcn', 'hidden_dims': '[512, 256]', 'dropout': 0.3228607658625735, 'batch_norm': True, 'lr': 0.0007982174806732631, 'weight_decay': 2.3262914895189585e-05, 'epochs': 134, 'loss': 'mse', 'optimizer': 'adam', 'graph_mode': 'knn', 'source': 'grm', 'knn_k': 7, 'weighted_edges': False, 'symmetrize_mode': 'mutual', 'use_snp_selection': False}. Best is trial 11 with value: 0.1282886373815262.
[I 2025-11-03 13:56:09,477] Trial 82 finished with value: 0.12371618412513562 and parameters: {'model_type': 'gcn', 'hidden_dims': '[512, 256]', 'dropout': 0.2658293584748287, 'batch_norm': True, 'lr': 0.0008451918027080877, 'weight_decay': 3.3816439855800725e-05, 'epochs': 145, 'loss': 'mse', 'optimizer': 'adam', 'graph_mode': 'knn', 'source': 'grm', 'knn_k': 7, 'weighted_edges': False, 'symmetrize_mode': 'mutual', 'use_snp_selection': False}. Best is trial 11 with value: 0.1282886373815262.
[I 2025-11-03 13:56:11,460] Trial 83 finished with value: 0.10590346772630757 and parameters: {'model_type': 'gcn', 'hidden_dims': '[512, 256]', 'dropout': 0.31211106465182475, 'batch_norm': True, 'lr': 0.0005876543953609685, 'weight_decay': 2.0820920668393587e-05, 'epochs': 144, 'loss': 'mse', 'optimizer': 'adam', 'graph_mode': 'knn', 'source': 'grm', 'knn_k': 8, 'weighted_edges': False, 'symmetrize_mode': 'mutual', 'use_snp_selection': False}. Best is trial 11 with value: 0.1282886373815262.
[I 2025-11-03 13:56:13,483] Trial 84 finished with value: 0.023577560447864316 and parameters: {'model_type': 'gcn', 'hidden_dims': '[512, 256]', 'dropout': 0.29569817609547927, 'batch_norm': True, 'lr': 1.3151983900963192e-05, 'weight_decay': 2.8705092822281024e-05, 'epochs': 151, 'loss': 'mse', 'optimizer': 'adam', 'graph_mode': 'knn', 'source': 'grm', 'knn_k': 7, 'weighted_edges': False, 'symmetrize_mode': 'mutual', 'use_snp_selection': False}. Best is trial 11 with value: 0.1282886373815262.
[I 2025-11-03 13:56:15,588] Trial 85 finished with value: 0.12547285131925093 and parameters: {'model_type': 'gcn', 'hidden_dims': '[512, 256]', 'dropout': 0.34031676576311287, 'batch_norm': True, 'lr': 0.000681869847203558, 'weight_decay': 2.4227425396023645e-07, 'epochs': 169, 'loss': 'mse', 'optimizer': 'adam', 'graph_mode': 'knn', 'source': 'grm', 'knn_k': 6, 'weighted_edges': False, 'symmetrize_mode': 'mutual', 'use_snp_selection': False}. Best is trial 11 with value: 0.1282886373815262.
[I 2025-11-03 13:56:17,693] Trial 86 finished with value: 0.09304204927648535 and parameters: {'model_type': 'gcn', 'hidden_dims': '[512, 256]', 'dropout': 0.3637604353494069, 'batch_norm': True, 'lr': 0.00028432021370324565, 'weight_decay': 2.6473092006207557e-07, 'epochs': 168, 'loss': 'mse', 'optimizer': 'adam', 'graph_mode': 'knn', 'source': 'grm', 'knn_k': 6, 'weighted_edges': False, 'symmetrize_mode': 'mutual', 'use_snp_selection': False}. Best is trial 11 with value: 0.1282886373815262.
[I 2025-11-03 13:56:19,896] Trial 87 finished with value: 0.11108315084847237 and parameters: {'model_type': 'gcn', 'hidden_dims': '[512, 256]', 'dropout': 0.14026385052202797, 'batch_norm': True, 'lr': 0.000684592867572556, 'weight_decay': 3.729608594493335e-06, 'epochs': 189, 'loss': 'mse', 'optimizer': 'adam', 'graph_mode': 'knn', 'source': 'grm', 'knn_k': 5, 'weighted_edges': False, 'symmetrize_mode': 'mutual', 'use_snp_selection': False}. Best is trial 11 with value: 0.1282886373815262.
[I 2025-11-03 13:56:21,981] Trial 88 finished with value: 0.10516829554456336 and parameters: {'model_type': 'gcn', 'hidden_dims': '[512, 256]', 'dropout': 0.3440082417110312, 'batch_norm': True, 'lr': 0.0005207680126637027, 'weight_decay': 3.3353206082846565e-05, 'epochs': 164, 'loss': 'mse', 'optimizer': 'adam', 'graph_mode': 'knn', 'source': 'grm', 'knn_k': 6, 'weighted_edges': False, 'symmetrize_mode': 'mutual', 'use_snp_selection': False}. Best is trial 11 with value: 0.1282886373815262.
[I 2025-11-03 13:56:24,326] Trial 89 finished with value: 0.11064801957445676 and parameters: {'model_type': 'gcn', 'hidden_dims': '[512, 256]', 'dropout': 0.3722768697587481, 'batch_norm': True, 'lr': 0.0008640393212864078, 'weight_decay': 1.7403928548692252e-07, 'epochs': 215, 'loss': 'mae', 'optimizer': 'adam', 'graph_mode': 'knn', 'source': 'grm', 'knn_k': 8, 'weighted_edges': False, 'symmetrize_mode': 'mutual', 'use_snp_selection': False}. Best is trial 11 with value: 0.1282886373815262.
[I 2025-11-03 13:56:25,676] Trial 90 finished with value: 0.04236310924477756 and parameters: {'model_type': 'gcn', 'hidden_dims': '[512, 256]', 'dropout': 0.3840326125070243, 'batch_norm': False, 'lr': 0.0004301413691848296, 'weight_decay': 4.754097053805737e-05, 'epochs': 176, 'loss': 'mse', 'optimizer': 'adam', 'graph_mode': 'knn', 'source': 'grm', 'knn_k': 7, 'weighted_edges': True, 'symmetrize_mode': 'mutual', 'use_snp_selection': True, 'num_snps': 3647}. Best is trial 11 with value: 0.1282886373815262.
[I 2025-11-03 13:56:27,741] Trial 91 finished with value: 0.11542513150141279 and parameters: {'model_type': 'gcn', 'hidden_dims': '[512, 256]', 'dropout': 0.2677186831403844, 'batch_norm': True, 'lr': 0.0009331105978453696, 'weight_decay': 9.203467962493282e-07, 'epochs': 155, 'loss': 'mse', 'optimizer': 'adam', 'graph_mode': 'knn', 'source': 'grm', 'knn_k': 7, 'weighted_edges': False, 'symmetrize_mode': 'mutual', 'use_snp_selection': False}. Best is trial 11 with value: 0.1282886373815262.
[I 2025-11-03 13:56:29,654] Trial 92 finished with value: -0.004755422263495094 and parameters: {'model_type': 'gcn', 'hidden_dims': '[512, 256]', 'dropout': 0.3140126310509516, 'batch_norm': True, 'lr': 0.000999501656095004, 'weight_decay': 3.2085797815410483e-07, 'epochs': 130, 'loss': 'mse', 'optimizer': 'adam', 'graph_mode': 'knn', 'source': 'grm', 'knn_k': 8, 'weighted_edges': False, 'symmetrize_mode': 'union', 'use_snp_selection': False}. Best is trial 11 with value: 0.1282886373815262.
[I 2025-11-03 13:56:31,585] Trial 93 finished with value: 0.08360129951840542 and parameters: {'model_type': 'gcn', 'hidden_dims': '[512, 256]', 'dropout': 0.3362177703467732, 'batch_norm': True, 'lr': 0.0007216330302633597, 'weight_decay': 1.6130297578594487e-07, 'epochs': 134, 'loss': 'mse', 'optimizer': 'adam', 'graph_mode': 'knn', 'source': 'grm', 'knn_k': 9, 'weighted_edges': False, 'symmetrize_mode': 'mutual', 'use_snp_selection': False}. Best is trial 11 with value: 0.1282886373815262.
[I 2025-11-03 13:56:33,400] Trial 94 finished with value: 0.10648999088436 and parameters: {'model_type': 'gcn', 'hidden_dims': '[512, 64]', 'dropout': 0.3535905156577227, 'batch_norm': True, 'lr': 0.0005944748142214618, 'weight_decay': 2.0836230828359148e-07, 'epochs': 116, 'loss': 'mse', 'optimizer': 'adam', 'graph_mode': 'knn', 'source': 'grm', 'knn_k': 7, 'weighted_edges': False, 'symmetrize_mode': 'mutual', 'use_snp_selection': False}. Best is trial 11 with value: 0.1282886373815262.
[I 2025-11-03 13:56:35,330] Trial 95 finished with value: 0.0808862622122744 and parameters: {'model_type': 'gcn', 'hidden_dims': '[512, 256]', 'dropout': 0.4029188393150369, 'batch_norm': True, 'lr': 0.0007028159676967381, 'weight_decay': 2.3487770072424072e-05, 'epochs': 148, 'loss': 'mse', 'optimizer': 'adam', 'graph_mode': 'cutoff', 'cutoff': 0.5288160440866023, 'grm_norm': 'gcn', 'self_loops': False, 'use_snp_selection': False}. Best is trial 11 with value: 0.1282886373815262.
[I 2025-11-03 13:56:37,068] Trial 96 finished with value: 0.11280672874697387 and parameters: {'model_type': 'gcn', 'hidden_dims': '[512, 256]', 'dropout': 0.291895472343069, 'batch_norm': True, 'lr': 0.0003367234521685679, 'weight_decay': 0.00011206376329686702, 'epochs': 98, 'loss': 'mse', 'optimizer': 'adam', 'graph_mode': 'knn', 'source': 'grm', 'knn_k': 6, 'weighted_edges': True, 'symmetrize_mode': 'mutual', 'use_snp_selection': False}. Best is trial 11 with value: 0.1282886373815262.
[I 2025-11-03 13:56:38,412] Trial 97 finished with value: 0.0965458447977211 and parameters: {'model_type': 'gcn', 'hidden_dims': '[512, 64]', 'dropout': 0.2763220247922456, 'batch_norm': True, 'lr': 0.0008276963413411397, 'weight_decay': 1.5027836268217586e-05, 'epochs': 18, 'loss': 'mse', 'optimizer': 'adam', 'graph_mode': 'knn', 'source': 'grm', 'knn_k': 9, 'weighted_edges': False, 'symmetrize_mode': 'mutual', 'use_snp_selection': False}. Best is trial 11 with value: 0.1282886373815262.
[I 2025-11-03 13:56:40,470] Trial 98 finished with value: -0.00968283450374465 and parameters: {'model_type': 'gcn', 'hidden_dims': '[512, 256]', 'dropout': 0.24231723167923205, 'batch_norm': True, 'lr': 0.00046977636447997857, 'weight_decay': 1.2536337138992425e-05, 'epochs': 160, 'loss': 'mse', 'optimizer': 'adam', 'graph_mode': 'knn', 'source': 'grm', 'knn_k': 8, 'weighted_edges': False, 'symmetrize_mode': 'union', 'use_snp_selection': False}. Best is trial 11 with value: 0.1282886373815262.
[I 2025-11-03 13:56:42,323] Trial 99 finished with value: 0.0718701815768582 and parameters: {'model_type': 'gcn', 'hidden_dims': '[512, 128]', 'dropout': 0.3128988224420039, 'batch_norm': True, 'lr': 4.810523765787428e-05, 'weight_decay': 1.201144617956549e-06, 'epochs': 125, 'loss': 'mse', 'optimizer': 'adam', 'graph_mode': 'knn', 'source': 'grm', 'knn_k': 5, 'weighted_edges': False, 'symmetrize_mode': 'mutual', 'use_snp_selection': False}. Best is trial 11 with value: 0.1282886373815262.
[I 2025-11-03 13:56:44,212] Trial 100 finished with value: 0.07227374248412528 and parameters: {'model_type': 'gcn', 'hidden_dims': '[512, 256]', 'dropout': 0.4173410109278682, 'batch_norm': True, 'lr': 0.0006037234839907885, 'weight_decay': 1.0895165484500824e-07, 'epochs': 143, 'loss': 'mse', 'optimizer': 'adam', 'graph_mode': 'cutoff', 'cutoff': 0.6324049401918144, 'grm_norm': 'none', 'self_loops': True, 'use_snp_selection': False}. Best is trial 11 with value: 0.1282886373815262.
[I 2025-11-03 13:56:45,317] Trial 101 finished with value: 0.11052456883237219 and parameters: {'model_type': 'gcn', 'hidden_dims': '[128, 64]', 'dropout': 0.22568669400250319, 'batch_norm': True, 'lr': 0.0008762798131256189, 'weight_decay': 1.912190709076565e-05, 'epochs': 50, 'loss': 'mse', 'optimizer': 'adam', 'graph_mode': 'knn', 'source': 'grm', 'knn_k': 7, 'weighted_edges': False, 'symmetrize_mode': 'mutual', 'use_snp_selection': False}. Best is trial 11 with value: 0.1282886373815262.
[I 2025-11-03 13:56:46,750] Trial 102 finished with value: 0.11263361249035442 and parameters: {'model_type': 'gcn', 'hidden_dims': '[512, 256]', 'dropout': 0.2592012582845656, 'batch_norm': True, 'lr': 0.000773633271107524, 'weight_decay': 3.7399665992620955e-05, 'epochs': 33, 'loss': 'mse', 'optimizer': 'adam', 'graph_mode': 'knn', 'source': 'grm', 'knn_k': 7, 'weighted_edges': False, 'symmetrize_mode': 'mutual', 'use_snp_selection': False}. Best is trial 11 with value: 0.1282886373815262.
[I 2025-11-03 13:56:48,325] Trial 103 finished with value: 0.12472286316194275 and parameters: {'model_type': 'gcn', 'hidden_dims': '[512, 64]', 'dropout': 0.27456587987966447, 'batch_norm': True, 'lr': 0.0005217019684148808, 'weight_decay': 6.197329283671765e-05, 'epochs': 65, 'loss': 'mse', 'optimizer': 'adam', 'graph_mode': 'knn', 'source': 'grm', 'knn_k': 8, 'weighted_edges': False, 'symmetrize_mode': 'mutual', 'use_snp_selection': False}. Best is trial 11 with value: 0.1282886373815262.
[I 2025-11-03 13:56:49,894] Trial 104 finished with value: 0.0956111955013462 and parameters: {'model_type': 'gcn', 'hidden_dims': '[512, 64]', 'dropout': 0.2778852473294269, 'batch_norm': True, 'lr': 0.0005262733442836113, 'weight_decay': 9.835668153035015e-06, 'epochs': 65, 'loss': 'mse', 'optimizer': 'adam', 'graph_mode': 'knn', 'source': 'grm', 'knn_k': 8, 'weighted_edges': False, 'symmetrize_mode': 'mutual', 'use_snp_selection': False}. Best is trial 11 with value: 0.1282886373815262.
