[I 2025-11-03 12:34:33,585] Trial 103 finished with value: 0.060254318982209135 and parameters: {'model_type': 'gcn', 'hidden_dims': '[512, 64]', 'dropout': 0.26597943263627494, 'batch_norm': False, 'lr': 1.547635207952325e-05, 'weight_decay': 5.370748683818225e-06, 'epochs': 87, 'loss': 'mse', 'optimizer': 'adam', 'graph_mode': 'off', 'use_snp_selection': True, 'num_snps': 13298}. Best is trial 67 with value: 0.07704791879056022.
[I 2025-11-03 12:34:34,468] Trial 104 finished with value: 0.0011944485796619797 and parameters: {'model_type': 'gcn', 'hidden_dims': '[512, 64]', 'dropout': 0.27541766608150114, 'batch_norm': True, 'lr': 1.7209310612852903e-05, 'weight_decay': 9.656015578083845e-06, 'epochs': 46, 'loss': 'mse', 'optimizer': 'adam', 'graph_mode': 'off', 'use_snp_selection': True, 'num_snps': 13640}. Best is trial 67 with value: 0.07704791879056022.
[I 2025-11-03 12:34:35,542] Trial 105 finished with value: 0.05984686087855554 and parameters: {'model_type': 'gcn', 'hidden_dims': '[512, 64]', 'dropout': 0.24010847096682503, 'batch_norm': True, 'lr': 7.385498209565174e-06, 'weight_decay': 5.036620056882906e-06, 'epochs': 93, 'loss': 'mse', 'optimizer': 'adam', 'graph_mode': 'off', 'use_snp_selection': True, 'num_snps': 16172}. Best is trial 67 with value: 0.07704791879056022.
[I 2025-11-03 12:34:36,624] Trial 106 finished with value: 0.018863134980412484 and parameters: {'model_type': 'gcn', 'hidden_dims': '[512, 64]', 'dropout': 0.24668543471798007, 'batch_norm': True, 'lr': 1.1111869456549476e-05, 'weight_decay': 5.251621034642276e-06, 'epochs': 91, 'loss': 'mse', 'optimizer': 'adam', 'graph_mode': 'off', 'use_snp_selection': True, 'num_snps': 15922}. Best is trial 67 with value: 0.07704791879056022.
[I 2025-11-03 12:34:37,570] Trial 107 finished with value: 0.04549614110001697 and parameters: {'model_type': 'gcn', 'hidden_dims': '[512, 64]', 'dropout': 0.23531900438997008, 'batch_norm': True, 'lr': 7.3727710336016604e-06, 'weight_decay': 4.15667296344803e-06, 'epochs': 85, 'loss': 'mse', 'optimizer': 'adam', 'graph_mode': 'off', 'use_snp_selection': True, 'num_snps': 12660}. Best is trial 67 with value: 0.07704791879056022.
[I 2025-11-03 12:34:38,790] Trial 108 finished with value: 0.04864694685417162 and parameters: {'model_type': 'gcn', 'hidden_dims': '[512, 64]', 'dropout': 0.22392776279912438, 'batch_norm': True, 'lr': 5.431591210246335e-06, 'weight_decay': 6.567924903685511e-06, 'epochs': 99, 'loss': 'mse', 'optimizer': 'adam', 'graph_mode': 'off', 'use_snp_selection': True, 'num_snps': 20099}. Best is trial 67 with value: 0.07704791879056022.
[I 2025-11-03 12:34:39,731] Trial 109 finished with value: 0.06790682182420521 and parameters: {'model_type': 'gcn', 'hidden_dims': '[512, 256]', 'dropout': 0.2673055764827879, 'batch_norm': True, 'lr': 3.3157736247357283e-06, 'weight_decay': 5.064342935435958e-06, 'epochs': 109, 'loss': 'mse', 'optimizer': 'adam', 'graph_mode': 'off', 'use_snp_selection': True, 'num_snps': 10231}. Best is trial 67 with value: 0.07704791879056022.
[I 2025-11-03 12:34:41,131] Trial 110 finished with value: 0.0332448283257777 and parameters: {'model_type': 'gcn', 'hidden_dims': '[512, 256]', 'dropout': 0.2666182095479843, 'batch_norm': True, 'lr': 2.2226815860150207e-06, 'weight_decay': 3.4187596115759734e-06, 'epochs': 106, 'loss': 'mse', 'optimizer': 'adam', 'graph_mode': 'off', 'use_snp_selection': False}. Best is trial 67 with value: 0.07704791879056022.
[I 2025-11-03 12:34:42,059] Trial 111 finished with value: 0.04058961837362887 and parameters: {'model_type': 'gcn', 'hidden_dims': '[512, 256]', 'dropout': 0.2881222435219186, 'batch_norm': True, 'lr': 4.04434499419459e-06, 'weight_decay': 5.353397268232671e-06, 'epochs': 114, 'loss': 'mse', 'optimizer': 'adam', 'graph_mode': 'off', 'use_snp_selection': True, 'num_snps': 9145}. Best is trial 67 with value: 0.07704791879056022.
[I 2025-11-03 12:34:42,946] Trial 112 finished with value: 0.04238888013330426 and parameters: {'model_type': 'gcn', 'hidden_dims': '[512, 256]', 'dropout': 0.26440228700253626, 'batch_norm': True, 'lr': 1.8382491319594925e-06, 'weight_decay': 1.3700144162137022e-05, 'epochs': 80, 'loss': 'mse', 'optimizer': 'adam', 'graph_mode': 'off', 'use_snp_selection': True, 'num_snps': 10639}. Best is trial 67 with value: 0.07704791879056022.
[I 2025-11-03 12:34:44,041] Trial 113 finished with value: 0.02420186586630812 and parameters: {'model_type': 'gcn', 'hidden_dims': '[512, 256]', 'dropout': 0.23249427614292523, 'batch_norm': True, 'lr': 9.45421203337024e-06, 'weight_decay': 7.926494343725023e-06, 'epochs': 97, 'loss': 'mse', 'optimizer': 'adam', 'graph_mode': 'off', 'use_snp_selection': True, 'num_snps': 17604}. Best is trial 67 with value: 0.07704791879056022.
[I 2025-11-03 12:34:44,985] Trial 114 finished with value: 0.028309546152144968 and parameters: {'model_type': 'gcn', 'hidden_dims': '[512, 64]', 'dropout': 0.24650158692622465, 'batch_norm': True, 'lr': 3.159298411044535e-06, 'weight_decay': 1.76235284926986e-05, 'epochs': 87, 'loss': 'mse', 'optimizer': 'adam', 'graph_mode': 'off', 'use_snp_selection': True, 'num_snps': 12215}. Best is trial 67 with value: 0.07704791879056022.
[I 2025-11-03 12:34:46,256] Trial 115 finished with value: 0.02710461782818059 and parameters: {'model_type': 'gcn', 'hidden_dims': '[512, 256]', 'dropout': 0.2945081759942895, 'batch_norm': True, 'lr': 1.5092022455654305e-05, 'weight_decay': 4.565813773885234e-06, 'epochs': 278, 'loss': 'mse', 'optimizer': 'adam', 'graph_mode': 'off', 'use_snp_selection': True, 'num_snps': 7754}. Best is trial 67 with value: 0.07704791879056022.
[I 2025-11-03 12:34:47,288] Trial 116 finished with value: 0.018896346346447532 and parameters: {'model_type': 'gcn', 'hidden_dims': '[256, 128, 64]', 'dropout': 0.208048965472819, 'batch_norm': True, 'lr': 2.8843982856252622e-06, 'weight_decay': 2.6266858380371452e-06, 'epochs': 152, 'loss': 'mse', 'optimizer': 'adam', 'graph_mode': 'off', 'use_snp_selection': True, 'num_snps': 4080}. Best is trial 67 with value: 0.07704791879056022.
[I 2025-11-03 12:34:48,318] Trial 117 finished with value: 0.04649645127976686 and parameters: {'model_type': 'gcn', 'hidden_dims': '[512, 256]', 'dropout': 0.2514553771128669, 'batch_norm': True, 'lr': 6.818893096441404e-06, 'weight_decay': 9.718151266568154e-06, 'epochs': 74, 'loss': 'mse', 'optimizer': 'adam', 'graph_mode': 'off', 'use_snp_selection': True, 'num_snps': 16089}. Best is trial 67 with value: 0.07704791879056022.
[I 2025-11-03 12:34:49,608] Trial 118 finished with value: 0.039167370049050396 and parameters: {'model_type': 'gcn', 'hidden_dims': '[512, 64]', 'dropout': 0.33194133027842215, 'batch_norm': True, 'lr': 1.476914548277898e-06, 'weight_decay': 5.978853118790886e-06, 'epochs': 109, 'loss': 'mse', 'optimizer': 'adam', 'graph_mode': 'off', 'use_snp_selection': True, 'num_snps': 22054}. Best is trial 67 with value: 0.07704791879056022.
[I 2025-11-03 12:34:50,613] Trial 119 finished with value: 0.02270076449424989 and parameters: {'model_type': 'gcn', 'hidden_dims': '[512, 128]', 'dropout': 0.28478934364042185, 'batch_norm': False, 'lr': 2.0701288333651284e-05, 'weight_decay': 4.103019781685212e-06, 'epochs': 93, 'loss': 'mse', 'optimizer': 'adam', 'graph_mode': 'off', 'use_snp_selection': True, 'num_snps': 14173}. Best is trial 67 with value: 0.07704791879056022.
[I 2025-11-03 12:34:51,550] Trial 120 finished with value: 0.02131456922694401 and parameters: {'model_type': 'gcn', 'hidden_dims': '[512, 256]', 'dropout': 0.30229137267280964, 'batch_norm': False, 'lr': 1.192946826091615e-05, 'weight_decay': 7.3000433939355705e-06, 'epochs': 118, 'loss': 'mse', 'optimizer': 'adam', 'graph_mode': 'off', 'use_snp_selection': True, 'num_snps': 10159}. Best is trial 67 with value: 0.07704791879056022.
[I 2025-11-03 12:34:52,587] Trial 121 finished with value: 0.04928740772894131 and parameters: {'model_type': 'gcn', 'hidden_dims': '[512, 64]', 'dropout': 0.2786501457724058, 'batch_norm': False, 'lr': 5.854062337891551e-05, 'weight_decay': 1.1228542209512034e-06, 'epochs': 64, 'loss': 'mse', 'optimizer': 'adam', 'graph_mode': 'off', 'use_snp_selection': True, 'num_snps': 18276}. Best is trial 67 with value: 0.07704791879056022.
[I 2025-11-03 12:34:53,652] Trial 122 finished with value: 0.03140548899327776 and parameters: {'model_type': 'gcn', 'hidden_dims': '[512, 64]', 'dropout': 0.27017444199211704, 'batch_norm': False, 'lr': 4.611363690872945e-06, 'weight_decay': 1.9264357449965524e-06, 'epochs': 103, 'loss': 'mae', 'optimizer': 'adam', 'graph_mode': 'off', 'use_snp_selection': True, 'num_snps': 15356}. Best is trial 67 with value: 0.07704791879056022.
[I 2025-11-03 12:34:54,583] Trial 123 finished with value: 0.020820740783722546 and parameters: {'model_type': 'gcn', 'hidden_dims': '[512, 64]', 'dropout': 0.25646843808450603, 'batch_norm': False, 'lr': 4.87127224905636e-05, 'weight_decay': 3.1205150725122026e-06, 'epochs': 81, 'loss': 'mse', 'optimizer': 'adam', 'graph_mode': 'off', 'use_snp_selection': True, 'num_snps': 13067}. Best is trial 67 with value: 0.07704791879056022.
[I 2025-11-03 12:34:55,477] Trial 124 finished with value: 0.06076015498588335 and parameters: {'model_type': 'gcn', 'hidden_dims': '[512, 64]', 'dropout': 0.3165438617558741, 'batch_norm': False, 'lr': 1.6633121489177095e-05, 'weight_decay': 5.757024440100446e-07, 'epochs': 123, 'loss': 'mse', 'optimizer': 'adam', 'graph_mode': 'off', 'use_snp_selection': True, 'num_snps': 8320}. Best is trial 67 with value: 0.07704791879056022.
[I 2025-11-03 12:34:56,378] Trial 125 finished with value: 0.0418941191262019 and parameters: {'model_type': 'gcn', 'hidden_dims': '[512, 64]', 'dropout': 0.32358646368068755, 'batch_norm': False, 'lr': 1.4692573765253273e-05, 'weight_decay': 5.852099508364966e-07, 'epochs': 123, 'loss': 'mse', 'optimizer': 'adam', 'graph_mode': 'off', 'use_snp_selection': True, 'num_snps': 8588}. Best is trial 67 with value: 0.07704791879056022.
[I 2025-11-03 12:34:57,262] Trial 126 finished with value: 0.001070085342454623 and parameters: {'model_type': 'gcn', 'hidden_dims': '[512, 128]', 'dropout': 0.2985134822314011, 'batch_norm': False, 'lr': 1.108649548489758e-06, 'weight_decay': 4.8320995421905605e-06, 'epochs': 135, 'loss': 'mse', 'optimizer': 'adam', 'graph_mode': 'off', 'use_snp_selection': True, 'num_snps': 6532}. Best is trial 67 with value: 0.07704791879056022.
[I 2025-11-03 12:34:58,216] Trial 127 finished with value: 0.01947892503195032 and parameters: {'model_type': 'gcn', 'hidden_dims': '[512, 64]', 'dropout': 0.31357572624512986, 'batch_norm': False, 'lr': 1.779995944854497e-05, 'weight_decay': 3.52220040475234e-07, 'epochs': 114, 'loss': 'mse', 'optimizer': 'adam', 'graph_mode': 'off', 'use_snp_selection': True, 'num_snps': 11302}. Best is trial 67 with value: 0.07704791879056022.
[I 2025-11-03 12:34:59,013] Trial 128 finished with value: -0.006009631745369487 and parameters: {'model_type': 'gcn', 'hidden_dims': '[256, 128]', 'dropout': 0.23316254153518498, 'batch_norm': False, 'lr': 2.3318299633173917e-05, 'weight_decay': 3.6606901593501833e-06, 'epochs': 98, 'loss': 'mse', 'optimizer': 'adam', 'graph_mode': 'off', 'use_snp_selection': True, 'num_snps': 6855}. Best is trial 67 with value: 0.07704791879056022.
[I 2025-11-03 12:35:00,336] Trial 129 finished with value: 0.02062947399120589 and parameters: {'model_type': 'gcn', 'hidden_dims': '[512, 256]', 'dropout': 0.3557028994850688, 'batch_norm': True, 'lr': 1.0303697418920836e-05, 'weight_decay': 2.5283666405096973e-07, 'epochs': 89, 'loss': 'mse', 'optimizer': 'adam', 'graph_mode': 'off', 'use_snp_selection': False}. Best is trial 67 with value: 0.07704791879056022.
[I 2025-11-03 12:35:01,039] Trial 130 finished with value: 0.028191711377884215 and parameters: {'model_type': 'gcn', 'hidden_dims': '[512, 128]', 'dropout': 0.26215567748588536, 'batch_norm': False, 'lr': 1.620849324147992e-05, 'weight_decay': 9.024595338259902e-06, 'epochs': 73, 'loss': 'mse', 'optimizer': 'adam', 'graph_mode': 'off', 'use_snp_selection': True, 'num_snps': 4825}. Best is trial 67 with value: 0.07704791879056022.
[I 2025-11-03 12:35:01,666] Trial 131 finished with value: -0.023192913941101283 and parameters: {'model_type': 'gcn', 'hidden_dims': '[512, 64]', 'dropout': 0.2755294998128012, 'batch_norm': False, 'lr': 3.611511816997715e-05, 'weight_decay': 1.6419598679483164e-06, 'epochs': 58, 'loss': 'mse', 'optimizer': 'adam', 'graph_mode': 'off', 'use_snp_selection': True, 'num_snps': 2850}. Best is trial 67 with value: 0.07704791879056022.
[I 2025-11-03 12:35:02,735] Trial 132 finished with value: 0.04633572415646896 and parameters: {'model_type': 'gcn', 'hidden_dims': '[512, 64]', 'dropout': 0.24640449768087663, 'batch_norm': False, 'lr': 1.3245029683543314e-05, 'weight_decay': 1.2704119507979432e-06, 'epochs': 108, 'loss': 'mae', 'optimizer': 'adam', 'graph_mode': 'off', 'use_snp_selection': True, 'num_snps': 14847}. Best is trial 67 with value: 0.07704791879056022.
[I 2025-11-03 12:35:03,690] Trial 133 finished with value: 0.044817895193171225 and parameters: {'model_type': 'gcn', 'hidden_dims': '[512, 64]', 'dropout': 0.2855471142001375, 'batch_norm': False, 'lr': 3.148668930371713e-05, 'weight_decay': 2.434836251922889e-06, 'epochs': 101, 'loss': 'mse', 'optimizer': 'adam', 'graph_mode': 'off', 'use_snp_selection': True, 'num_snps': 12169}. Best is trial 67 with value: 0.07704791879056022.
[I 2025-11-03 12:35:04,699] Trial 134 finished with value: 0.06737694597465137 and parameters: {'model_type': 'gcn', 'hidden_dims': '[512, 64]', 'dropout': 0.2693243375464946, 'batch_norm': False, 'lr': 2.5505243631840265e-05, 'weight_decay': 8.577669349372884e-07, 'epochs': 66, 'loss': 'mse', 'optimizer': 'adam', 'graph_mode': 'off', 'use_snp_selection': True, 'num_snps': 16906}. Best is trial 67 with value: 0.07704791879056022.
[I 2025-11-03 12:35:06,300] Trial 135 finished with value: 0.04646210772068294 and parameters: {'model_type': 'gcn', 'hidden_dims': '[512, 64]', 'dropout': 0.3059506392060668, 'batch_norm': False, 'lr': 2.0752559886744237e-05, 'weight_decay': 7.774349833321463e-07, 'epochs': 250, 'loss': 'mse', 'optimizer': 'adam', 'graph_mode': 'off', 'use_snp_selection': True, 'num_snps': 19723}. Best is trial 67 with value: 0.07704791879056022.
[I 2025-11-03 12:35:07,291] Trial 136 finished with value: 0.014686188435266125 and parameters: {'model_type': 'gcn', 'hidden_dims': '[256, 128]', 'dropout': 0.23839338359229398, 'batch_norm': False, 'lr': 2.50783319112793e-05, 'weight_decay': 4.989629726266843e-07, 'epochs': 85, 'loss': 'mse', 'optimizer': 'adam', 'graph_mode': 'off', 'use_snp_selection': True, 'num_snps': 17970}. Best is trial 67 with value: 0.07704791879056022.
[I 2025-11-03 12:35:08,273] Trial 137 finished with value: 0.044617080379403325 and parameters: {'model_type': 'gcn', 'hidden_dims': '[256, 128, 64]', 'dropout': 0.21515428119396746, 'batch_norm': False, 'lr': 1.8469648928760115e-05, 'weight_decay': 6.503489439719978e-06, 'epochs': 67, 'loss': 'mse', 'optimizer': 'adam', 'graph_mode': 'off', 'use_snp_selection': True, 'num_snps': 16526}. Best is trial 67 with value: 0.07704791879056022.
[I 2025-11-03 12:35:09,614] Trial 138 finished with value: 0.05051400368745029 and parameters: {'model_type': 'gcn', 'hidden_dims': '[512, 128]', 'dropout': 0.2619592693421414, 'batch_norm': False, 'lr': 4.006888266963823e-05, 'weight_decay': 6.482213534624169e-07, 'epochs': 129, 'loss': 'mse', 'optimizer': 'adam', 'graph_mode': 'off', 'use_snp_selection': True, 'num_snps': 21020}. Best is trial 67 with value: 0.07704791879056022.
[I 2025-11-03 12:35:10,499] Trial 139 finished with value: 0.0028342110398833515 and parameters: {'model_type': 'gcn', 'hidden_dims': '[512, 64]', 'dropout': 0.25266336197686023, 'batch_norm': False, 'lr': 8.132559252109326e-06, 'weight_decay': 9.417789708917771e-07, 'epochs': 93, 'loss': 'mse', 'optimizer': 'adam', 'graph_mode': 'off', 'use_snp_selection': True, 'num_snps': 10249}. Best is trial 67 with value: 0.07704791879056022.
[I 2025-11-03 12:35:11,287] Trial 140 finished with value: 0.003982701242193434 and parameters: {'model_type': 'gcn', 'hidden_dims': '[512, 256]', 'dropout': 0.5211397604380901, 'batch_norm': False, 'lr': 2.91954150434357e-05, 'weight_decay': 4.3849455067526763e-07, 'epochs': 78, 'loss': 'mse', 'optimizer': 'adam', 'graph_mode': 'off', 'use_snp_selection': True, 'num_snps': 8324}. Best is trial 67 with value: 0.07704791879056022.
[I 2025-11-03 12:35:12,210] Trial 141 finished with value: -0.007435797266426686 and parameters: {'model_type': 'gcn', 'hidden_dims': '[512, 64]', 'dropout': 0.2814197566742676, 'batch_norm': False, 'lr': 4.772783483295018e-05, 'weight_decay': 1.486703711523337e-06, 'epochs': 62, 'loss': 'mse', 'optimizer': 'adam', 'graph_mode': 'off', 'use_snp_selection': True, 'num_snps': 14077}. Best is trial 67 with value: 0.07704791879056022.
[I 2025-11-03 12:35:13,161] Trial 142 finished with value: 0.033326733884158175 and parameters: {'model_type': 'gcn', 'hidden_dims': '[512, 64]', 'dropout': 0.27168455248001805, 'batch_norm': False, 'lr': 2.417415300537819e-05, 'weight_decay': 1.097842380044834e-06, 'epochs': 52, 'loss': 'mse', 'optimizer': 'adam', 'graph_mode': 'off', 'use_snp_selection': True, 'num_snps': 16509}. Best is trial 67 with value: 0.07704791879056022.
[I 2025-11-03 12:35:14,052] Trial 143 finished with value: 0.047452197650012864 and parameters: {'model_type': 'gcn', 'hidden_dims': '[512, 64]', 'dropout': 0.29126353527806154, 'batch_norm': False, 'lr': 6.262422877668405e-05, 'weight_decay': 0.0009467736956614264, 'epochs': 40, 'loss': 'mse', 'optimizer': 'adam', 'graph_mode': 'off', 'use_snp_selection': True, 'num_snps': 15311}. Best is trial 67 with value: 0.07704791879056022.
[I 2025-11-03 12:35:14,760] Trial 144 finished with value: 0.03496974363617516 and parameters: {'model_type': 'gcn', 'hidden_dims': '[256, 128]', 'dropout': 0.26500244460885075, 'batch_norm': False, 'lr': 7.5433764052689e-05, 'weight_decay': 1.9709815196294842e-06, 'epochs': 71, 'loss': 'mae', 'optimizer': 'adam', 'graph_mode': 'off', 'use_snp_selection': True, 'num_snps': 5604}. Best is trial 67 with value: 0.07704791879056022.
[I 2025-11-03 12:35:15,891] Trial 145 finished with value: 0.02805461506618588 and parameters: {'model_type': 'gcn', 'hidden_dims': '[512, 64]', 'dropout': 0.3842889506707784, 'batch_norm': True, 'lr': 5.9973814769572375e-06, 'weight_decay': 5.580644344574365e-06, 'epochs': 86, 'loss': 'mse', 'optimizer': 'adam', 'graph_mode': 'off', 'use_snp_selection': True, 'num_snps': 18269}. Best is trial 67 with value: 0.07704791879056022.
[I 2025-11-03 12:35:16,823] Trial 146 finished with value: 0.022142636656610773 and parameters: {'model_type': 'gcn', 'hidden_dims': '[512, 128]', 'dropout': 0.24454574315980165, 'batch_norm': False, 'lr': 9.011667561808859e-05, 'weight_decay': 1.1790849097035273e-05, 'epochs': 76, 'loss': 'mse', 'optimizer': 'adam', 'graph_mode': 'off', 'use_snp_selection': True, 'num_snps': 13423}. Best is trial 67 with value: 0.07704791879056022.
[I 2025-11-03 12:35:18,190] Trial 147 finished with value: 0.0044941888324893375 and parameters: {'model_type': 'gcn', 'hidden_dims': '[512, 64]', 'dropout': 0.5618375033309109, 'batch_norm': False, 'lr': 1.2915989997248067e-05, 'weight_decay': 2.977627058052885e-06, 'epochs': 120, 'loss': 'mse', 'optimizer': 'adam', 'graph_mode': 'off', 'use_snp_selection': True, 'num_snps': 23740}. Best is trial 67 with value: 0.07704791879056022.
[I 2025-11-03 12:35:19,033] Trial 148 finished with value: -0.03934212311245032 and parameters: {'model_type': 'gcn', 'hidden_dims': '[256, 128]', 'dropout': 0.5884877012332346, 'batch_norm': False, 'lr': 3.2672317549927774e-05, 'weight_decay': 3.521189960840958e-07, 'epochs': 95, 'loss': 'mse', 'optimizer': 'adam', 'graph_mode': 'off', 'use_snp_selection': True, 'num_snps': 9245}. Best is trial 67 with value: 0.07704791879056022.
[I 2025-11-03 12:35:20,025] Trial 149 finished with value: 0.04620245660341411 and parameters: {'model_type': 'gcn', 'hidden_dims': '[512, 256]', 'dropout': 0.2751559389151712, 'batch_norm': True, 'lr': 4.221750585515997e-05, 'weight_decay': 8.806046089332139e-07, 'epochs': 107, 'loss': 'mse', 'optimizer': 'adam', 'graph_mode': 'off', 'use_snp_selection': True, 'num_snps': 12079}. Best is trial 67 with value: 0.07704791879056022.
[I 2025-11-03 12:35:22,050] Trial 0 finished with value: 0.014497345765523877 and parameters: {'model_type': 'gcn', 'hidden_dims': '[128, 64]', 'dropout': 0.199031432379812, 'batch_norm': True, 'lr': 1.8408544111075837e-06, 'weight_decay': 5.5136510071208614e-05, 'epochs': 336, 'loss': 'mae', 'optimizer': 'adam', 'graph_mode': 'off', 'use_snp_selection': True, 'num_snps': 43862}. Best is trial 0 with value: 0.014497345765523877.
[I 2025-11-03 12:35:23,626] Trial 1 finished with value: 0.04186362546518932 and parameters: {'model_type': 'gcn', 'hidden_dims': '[256, 128]', 'dropout': 0.4370668075331726, 'batch_norm': True, 'lr': 7.133471581159139e-05, 'weight_decay': 1.128633586803549e-05, 'epochs': 242, 'loss': 'mae', 'optimizer': 'adam', 'graph_mode': 'off', 'use_snp_selection': False}. Best is trial 1 with value: 0.04186362546518932.
[I 2025-11-03 12:35:24,706] Trial 2 finished with value: 0.03434652625470174 and parameters: {'model_type': 'gcn', 'hidden_dims': '[256, 128, 64]', 'dropout': 0.41314357415569625, 'batch_norm': False, 'lr': 3.952233718592101e-06, 'weight_decay': 0.00026754769258252603, 'epochs': 149, 'loss': 'mse', 'optimizer': 'adam', 'graph_mode': 'off', 'use_snp_selection': True, 'num_snps': 11571}. Best is trial 1 with value: 0.04186362546518932.
