[I 2025-11-13 15:20:22,211] Trial 51 finished with value: 0.27095843627655913 and parameters: {'model_type': 'graphsage', 'hidden_dims': '[256, 128, 64]', 'dropout': 0.15228231099515815, 'batch_norm': False, 'lr': 2.0699628102960762e-05, 'weight_decay': 0.0006416908157969017, 'epochs': 81, 'loss': 'mae', 'optimizer': 'adam', 'graph_mode': 'cutoff', 'cutoff': 0.5415978617898451, 'grm_norm': 'none', 'self_loops': False, 'use_snp_selection': True, 'num_snps': 34653}. Best is trial 19 with value: 0.30021150341023195.
[I 2025-11-13 15:22:14,219] Trial 52 finished with value: 0.260922611229952 and parameters: {'model_type': 'graphsage', 'hidden_dims': '[256, 128, 64]', 'dropout': 0.23413090749637053, 'batch_norm': False, 'lr': 9.95694242036188e-06, 'weight_decay': 0.0004233863005412608, 'epochs': 137, 'loss': 'mae', 'optimizer': 'adam', 'graph_mode': 'cutoff', 'cutoff': 0.3245975632416079, 'grm_norm': 'none', 'self_loops': False, 'use_snp_selection': True, 'num_snps': 32005}. Best is trial 19 with value: 0.30021150341023195.
[I 2025-11-13 15:25:58,480] Trial 53 finished with value: 0.27090028444816 and parameters: {'model_type': 'graphsage', 'hidden_dims': '[256, 128, 64]', 'dropout': 0.184008373351121, 'batch_norm': False, 'lr': 4.644406740342471e-05, 'weight_decay': 0.00018207520728339246, 'epochs': 207, 'loss': 'mae', 'optimizer': 'adam', 'graph_mode': 'cutoff', 'cutoff': 0.2500513996879331, 'grm_norm': 'none', 'self_loops': False, 'use_snp_selection': True, 'num_snps': 36484}. Best is trial 19 with value: 0.30021150341023195.
[I 2025-11-13 15:27:45,393] Trial 54 finished with value: 0.24677830861247715 and parameters: {'model_type': 'graphsage', 'hidden_dims': '[512, 128]', 'dropout': 0.48546968887585995, 'batch_norm': False, 'lr': 2.796142788098834e-05, 'weight_decay': 1.5973021088296795e-06, 'epochs': 224, 'loss': 'mae', 'optimizer': 'adam', 'graph_mode': 'cutoff', 'cutoff': 0.376479806137376, 'grm_norm': 'cosine', 'self_loops': False, 'use_snp_selection': True, 'num_snps': 20151}. Best is trial 19 with value: 0.30021150341023195.
[I 2025-11-13 15:30:13,797] Trial 55 finished with value: 0.2671597444126277 and parameters: {'model_type': 'graphsage', 'hidden_dims': '[256, 128, 64]', 'dropout': 0.5718371399472962, 'batch_norm': False, 'lr': 6.0908588328431164e-06, 'weight_decay': 0.0009890204963225737, 'epochs': 161, 'loss': 'mae', 'optimizer': 'adam', 'graph_mode': 'cutoff', 'cutoff': 0.3952614121057819, 'grm_norm': 'none', 'self_loops': True, 'use_snp_selection': True, 'num_snps': 45554}. Best is trial 19 with value: 0.30021150341023195.
[I 2025-11-13 15:31:19,061] Trial 56 finished with value: 0.22113281490765307 and parameters: {'model_type': 'graphsage', 'hidden_dims': '[256, 128]', 'dropout': 0.19998560936570603, 'batch_norm': True, 'lr': 1.779842865720273e-05, 'weight_decay': 4.669873546251136e-06, 'epochs': 107, 'loss': 'mse', 'optimizer': 'adam', 'graph_mode': 'cutoff', 'cutoff': 0.4449816300933718, 'grm_norm': 'none', 'self_loops': False, 'use_snp_selection': False}. Best is trial 19 with value: 0.30021150341023195.
[I 2025-11-13 15:32:31,938] Trial 57 finished with value: 0.2528588643385896 and parameters: {'model_type': 'graphsage', 'hidden_dims': '[256, 128, 64]', 'dropout': 0.5207422556317638, 'batch_norm': False, 'lr': 5.6305943518973224e-06, 'weight_decay': 2.44594496480007e-06, 'epochs': 145, 'loss': 'mae', 'optimizer': 'adam', 'graph_mode': 'cutoff', 'cutoff': 0.7156385214360498, 'grm_norm': 'none', 'self_loops': True, 'use_snp_selection': True, 'num_snps': 25675}. Best is trial 19 with value: 0.30021150341023195.
[I 2025-11-13 15:34:36,797] Trial 58 finished with value: 0.2626593508085724 and parameters: {'model_type': 'graphsage', 'hidden_dims': '[256, 128, 64]', 'dropout': 0.12115454130664594, 'batch_norm': False, 'lr': 3.5563351925393305e-05, 'weight_decay': 1.5509324689325076e-07, 'epochs': 124, 'loss': 'mae', 'optimizer': 'adam', 'graph_mode': 'knn', 'source': 'grm', 'knn_k': 8, 'weighted_edges': False, 'symmetrize_mode': 'mutual', 'use_snp_selection': True, 'num_snps': 39322}. Best is trial 19 with value: 0.30021150341023195.
[I 2025-11-13 15:38:20,099] Trial 59 finished with value: 0.25524126692299137 and parameters: {'model_type': 'graphsage', 'hidden_dims': '[512, 128]', 'dropout': 0.10011121704501813, 'batch_norm': False, 'lr': 1.3450320876321765e-05, 'weight_decay': 0.00035351676391529724, 'epochs': 270, 'loss': 'mse', 'optimizer': 'adam', 'graph_mode': 'cutoff', 'cutoff': 0.41774058479031373, 'grm_norm': 'cosine', 'self_loops': False, 'use_snp_selection': True, 'num_snps': 41946}. Best is trial 19 with value: 0.30021150341023195.
[I 2025-11-13 15:39:16,516] Trial 60 finished with value: 0.23921132792497352 and parameters: {'model_type': 'graphsage', 'hidden_dims': '[256, 128, 64]', 'dropout': 0.15738088216017423, 'batch_norm': False, 'lr': 8.1805056151289e-06, 'weight_decay': 8.389056471545963e-06, 'epochs': 190, 'loss': 'mae', 'optimizer': 'adam', 'graph_mode': 'cutoff', 'cutoff': 0.5326667614385653, 'grm_norm': 'none', 'self_loops': False, 'use_snp_selection': True, 'num_snps': 9159}. Best is trial 19 with value: 0.30021150341023195.
[I 2025-11-13 15:41:16,899] Trial 61 finished with value: 0.282948590709949 and parameters: {'model_type': 'graphsage', 'hidden_dims': '[256, 128, 64]', 'dropout': 0.1771517895163752, 'batch_norm': False, 'lr': 8.449236477071677e-05, 'weight_decay': 0.0006168789763153545, 'epochs': 243, 'loss': 'mae', 'optimizer': 'adam', 'graph_mode': 'cutoff', 'cutoff': 0.49241147447733696, 'grm_norm': 'none', 'self_loops': False, 'use_snp_selection': True, 'num_snps': 33723}. Best is trial 19 with value: 0.30021150341023195.
[I 2025-11-13 15:43:11,052] Trial 62 finished with value: 0.2684726089350275 and parameters: {'model_type': 'graphsage', 'hidden_dims': '[256, 128, 64]', 'dropout': 0.20906654119070106, 'batch_norm': False, 'lr': 8.244472149744229e-05, 'weight_decay': 0.0006182508362412109, 'epochs': 246, 'loss': 'mae', 'optimizer': 'adam', 'graph_mode': 'cutoff', 'cutoff': 0.49763265318213373, 'grm_norm': 'none', 'self_loops': False, 'use_snp_selection': True, 'num_snps': 31977}. Best is trial 19 with value: 0.30021150341023195.
[I 2025-11-13 15:44:57,109] Trial 63 finished with value: 0.27281074174207987 and parameters: {'model_type': 'graphsage', 'hidden_dims': '[256, 128, 64]', 'dropout': 0.1551742556542633, 'batch_norm': False, 'lr': 4.992061458164301e-05, 'weight_decay': 0.0006941706675792605, 'epochs': 224, 'loss': 'mae', 'optimizer': 'adam', 'graph_mode': 'cutoff', 'cutoff': 0.5659322850654561, 'grm_norm': 'none', 'self_loops': False, 'use_snp_selection': True, 'num_snps': 37407}. Best is trial 19 with value: 0.30021150341023195.
[I 2025-11-13 15:46:41,187] Trial 64 finished with value: 0.27318171509743444 and parameters: {'model_type': 'graphsage', 'hidden_dims': '[256, 128, 64]', 'dropout': 0.18768433389494354, 'batch_norm': False, 'lr': 8.045300591948677e-05, 'weight_decay': 1.3401299878574305e-05, 'epochs': 205, 'loss': 'mae', 'optimizer': 'adam', 'graph_mode': 'cutoff', 'cutoff': 0.4531093419369355, 'grm_norm': 'none', 'self_loops': False, 'use_snp_selection': True, 'num_snps': 28071}. Best is trial 19 with value: 0.30021150341023195.
[I 2025-11-13 15:50:48,187] Trial 65 finished with value: 0.2670323581586361 and parameters: {'model_type': 'graphsage', 'hidden_dims': '[512, 64]', 'dropout': 0.3499378042197507, 'batch_norm': False, 'lr': 0.00015631365875518256, 'weight_decay': 7.968666618190574e-05, 'epochs': 239, 'loss': 'mae', 'optimizer': 'adam', 'graph_mode': 'cutoff', 'cutoff': 0.49583821376288706, 'grm_norm': 'none', 'self_loops': False, 'use_snp_selection': True, 'num_snps': 55797}. Best is trial 19 with value: 0.30021150341023195.
[I 2025-11-13 15:53:06,668] Trial 66 finished with value: 0.26226255321444225 and parameters: {'model_type': 'graphsage', 'hidden_dims': '[256, 128, 64]', 'dropout': 0.17677809229537947, 'batch_norm': True, 'lr': 0.0004076761035518866, 'weight_decay': 2.7745495331549485e-05, 'epochs': 254, 'loss': 'mae', 'optimizer': 'adam', 'graph_mode': 'cutoff', 'cutoff': 0.4078103126099412, 'grm_norm': 'gcn', 'self_loops': True, 'use_snp_selection': False}. Best is trial 19 with value: 0.30021150341023195.
[I 2025-11-13 15:57:53,436] Trial 67 finished with value: 0.26098681783691224 and parameters: {'model_type': 'graphsage', 'hidden_dims': '[256, 128, 64]', 'dropout': 0.24529140328256527, 'batch_norm': False, 'lr': 6.247546598261781e-05, 'weight_decay': 4.862970531777341e-05, 'epochs': 350, 'loss': 'mae', 'optimizer': 'adam', 'graph_mode': 'cutoff', 'cutoff': 0.3457554550100267, 'grm_norm': 'none', 'self_loops': False, 'use_snp_selection': True, 'num_snps': 48634}. Best is trial 19 with value: 0.30021150341023195.
[I 2025-11-13 16:02:32,929] Trial 68 finished with value: 0.26594647944616473 and parameters: {'model_type': 'graphsage', 'hidden_dims': '[256, 128, 64]', 'dropout': 0.12805309772943652, 'batch_norm': False, 'lr': 1.6470705113019713e-05, 'weight_decay': 0.00020461589554132865, 'epochs': 215, 'loss': 'mae', 'optimizer': 'adam', 'graph_mode': 'cutoff', 'cutoff': 0.2507794474656336, 'grm_norm': 'cosine_then_gcn', 'self_loops': False, 'use_snp_selection': True, 'num_snps': 44544}. Best is trial 19 with value: 0.30021150341023195.
[I 2025-11-13 16:04:05,118] Trial 69 finished with value: 0.2337940256643948 and parameters: {'model_type': 'graphsage', 'hidden_dims': '[512, 256]', 'dropout': 0.14262871427671464, 'batch_norm': False, 'lr': 3.857207197880345e-05, 'weight_decay': 0.00013938800257155004, 'epochs': 180, 'loss': 'mae', 'optimizer': 'adam', 'graph_mode': 'knn', 'source': 'grm', 'knn_k': 3, 'weighted_edges': True, 'symmetrize_mode': 'union', 'use_snp_selection': True, 'num_snps': 17600}. Best is trial 19 with value: 0.30021150341023195.
[I 2025-11-13 16:05:34,965] Trial 70 finished with value: 0.23253526857109869 and parameters: {'model_type': 'graphsage', 'hidden_dims': '[128, 64]', 'dropout': 0.20059279997852733, 'batch_norm': False, 'lr': 2.2666218635103263e-05, 'weight_decay': 0.00038201921831462326, 'epochs': 297, 'loss': 'mse', 'optimizer': 'adam', 'graph_mode': 'cutoff', 'cutoff': 0.6207353437152032, 'grm_norm': 'cosine', 'self_loops': False, 'use_snp_selection': True, 'num_snps': 33361}. Best is trial 19 with value: 0.30021150341023195.
[I 2025-11-13 16:07:34,084] Trial 71 finished with value: 0.2784003725051094 and parameters: {'model_type': 'graphsage', 'hidden_dims': '[256, 128, 64]', 'dropout': 0.16262465636327933, 'batch_norm': False, 'lr': 2.611357259317202e-05, 'weight_decay': 0.00048696689106413987, 'epochs': 230, 'loss': 'mae', 'optimizer': 'adam', 'graph_mode': 'cutoff', 'cutoff': 0.4994715401045191, 'grm_norm': 'none', 'self_loops': False, 'use_snp_selection': True, 'num_snps': 35492}. Best is trial 19 with value: 0.30021150341023195.
[I 2025-11-13 16:09:43,274] Trial 72 finished with value: 0.2710525163152668 and parameters: {'model_type': 'graphsage', 'hidden_dims': '[256, 128, 64]', 'dropout': 0.23095725901649822, 'batch_norm': False, 'lr': 2.8276535451952442e-05, 'weight_decay': 0.0002591256777698257, 'epochs': 273, 'loss': 'mae', 'optimizer': 'adam', 'graph_mode': 'cutoff', 'cutoff': 0.5138633597548977, 'grm_norm': 'none', 'self_loops': False, 'use_snp_selection': True, 'num_snps': 37977}. Best is trial 19 with value: 0.30021150341023195.
[I 2025-11-13 16:11:36,476] Trial 73 finished with value: 0.2824579440684817 and parameters: {'model_type': 'graphsage', 'hidden_dims': '[256, 128, 64]', 'dropout': 0.16960035025435014, 'batch_norm': False, 'lr': 0.00012148521780967243, 'weight_decay': 0.0005079801196895753, 'epochs': 168, 'loss': 'mae', 'optimizer': 'adam', 'graph_mode': 'cutoff', 'cutoff': 0.4770272379576078, 'grm_norm': 'none', 'self_loops': False, 'use_snp_selection': True, 'num_snps': 36135}. Best is trial 19 with value: 0.30021150341023195.
[I 2025-11-13 16:13:14,740] Trial 74 finished with value: 0.2680839166068057 and parameters: {'model_type': 'graphsage', 'hidden_dims': '[256, 128, 64]', 'dropout': 0.4212975535914896, 'batch_norm': False, 'lr': 0.00011688157109654601, 'weight_decay': 0.0007151593615326799, 'epochs': 165, 'loss': 'mae', 'optimizer': 'adam', 'graph_mode': 'cutoff', 'cutoff': 0.468296045301217, 'grm_norm': 'none', 'self_loops': False, 'use_snp_selection': True, 'num_snps': 31095}. Best is trial 19 with value: 0.30021150341023195.
[I 2025-11-13 16:15:13,968] Trial 75 finished with value: 0.2722018252402296 and parameters: {'model_type': 'graphsage', 'hidden_dims': '[256, 128]', 'dropout': 0.11336437842069616, 'batch_norm': False, 'lr': 0.00022337538576025633, 'weight_decay': 0.0009388685022201516, 'epochs': 150, 'loss': 'mae', 'optimizer': 'adam', 'graph_mode': 'cutoff', 'cutoff': 0.4418390109242922, 'grm_norm': 'cosine_then_gcn', 'self_loops': False, 'use_snp_selection': True, 'num_snps': 39717}. Best is trial 19 with value: 0.30021150341023195.
[I 2025-11-13 16:16:53,239] Trial 76 finished with value: 0.2749210256121167 and parameters: {'model_type': 'graphsage', 'hidden_dims': '[256, 128, 64]', 'dropout': 0.18642875417951654, 'batch_norm': False, 'lr': 0.00019442690481138856, 'weight_decay': 0.0004119956806607285, 'epochs': 198, 'loss': 'mae', 'optimizer': 'adam', 'graph_mode': 'cutoff', 'cutoff': 0.5223656619050422, 'grm_norm': 'none', 'self_loops': False, 'use_snp_selection': True, 'num_snps': 33622}. Best is trial 19 with value: 0.30021150341023195.
[I 2025-11-13 16:18:39,152] Trial 77 finished with value: 0.2645627856724649 and parameters: {'model_type': 'graphsage', 'hidden_dims': '[512, 256]', 'dropout': 0.14326919567090193, 'batch_norm': False, 'lr': 0.00012101150115404754, 'weight_decay': 6.150343449777956e-06, 'epochs': 128, 'loss': 'mae', 'optimizer': 'adam', 'graph_mode': 'cutoff', 'cutoff': 0.35865010170800465, 'grm_norm': 'none', 'self_loops': False, 'use_snp_selection': True, 'num_snps': 27711}. Best is trial 19 with value: 0.30021150341023195.
[I 2025-11-13 16:20:40,695] Trial 78 finished with value: 0.24956398915649344 and parameters: {'model_type': 'graphsage', 'hidden_dims': '[512, 128]', 'dropout': 0.4774290467111912, 'batch_norm': False, 'lr': 2.654076505319463e-06, 'weight_decay': 1.0759501123391277e-06, 'epochs': 172, 'loss': 'mae', 'optimizer': 'adam', 'graph_mode': 'cutoff', 'cutoff': 0.8842025222699779, 'grm_norm': 'none', 'self_loops': True, 'use_snp_selection': True, 'num_snps': 36729}. Best is trial 19 with value: 0.30021150341023195.
[I 2025-11-13 16:22:16,942] Trial 79 finished with value: 0.2504613565177531 and parameters: {'model_type': 'graphsage', 'hidden_dims': '[256, 128, 64]', 'dropout': 0.17139691100802404, 'batch_norm': True, 'lr': 6.856958309389279e-05, 'weight_decay': 3.3460999125107762e-06, 'epochs': 218, 'loss': 'mae', 'optimizer': 'adam', 'graph_mode': 'cutoff', 'cutoff': 0.5498824680785376, 'grm_norm': 'cosine_then_gcn', 'self_loops': False, 'use_snp_selection': False}. Best is trial 19 with value: 0.30021150341023195.
[I 2025-11-13 16:24:32,482] Trial 80 finished with value: 0.2507105782885646 and parameters: {'model_type': 'graphsage', 'hidden_dims': '[256, 128, 64]', 'dropout': 0.5728576775388806, 'batch_norm': False, 'lr': 9.00733433999229e-05, 'weight_decay': 0.00011128425267592165, 'epochs': 186, 'loss': 'mae', 'optimizer': 'adam', 'graph_mode': 'knn', 'source': 'grm', 'knn_k': 5, 'weighted_edges': True, 'symmetrize_mode': 'union', 'use_snp_selection': True, 'num_snps': 30081}. Best is trial 19 with value: 0.30021150341023195.
[I 2025-11-13 16:26:26,396] Trial 81 finished with value: 0.2833880587084595 and parameters: {'model_type': 'graphsage', 'hidden_dims': '[256, 128, 64]', 'dropout': 0.16415230324835842, 'batch_norm': False, 'lr': 5.618657719947866e-05, 'weight_decay': 0.0005643196336825713, 'epochs': 228, 'loss': 'mae', 'optimizer': 'adam', 'graph_mode': 'cutoff', 'cutoff': 0.5093689901463314, 'grm_norm': 'none', 'self_loops': False, 'use_snp_selection': True, 'num_snps': 35613}. Best is trial 19 with value: 0.30021150341023195.
[I 2025-11-13 16:28:53,763] Trial 82 finished with value: 0.2784485526179963 and parameters: {'model_type': 'graphsage', 'hidden_dims': '[256, 128, 64]', 'dropout': 0.15097737209794004, 'batch_norm': False, 'lr': 5.4827240643780594e-05, 'weight_decay': 0.000587530065742997, 'epochs': 207, 'loss': 'mae', 'optimizer': 'adam', 'graph_mode': 'cutoff', 'cutoff': 0.47885519878541927, 'grm_norm': 'none', 'self_loops': False, 'use_snp_selection': True, 'num_snps': 42590}. Best is trial 19 with value: 0.30021150341023195.
[I 2025-11-13 16:30:37,520] Trial 83 finished with value: 0.2606169243482058 and parameters: {'model_type': 'graphsage', 'hidden_dims': '[256, 128, 64]', 'dropout': 0.20729099098105724, 'batch_norm': False, 'lr': 0.0003266795564651101, 'weight_decay': 0.00030566977448300274, 'epochs': 244, 'loss': 'mae', 'optimizer': 'adam', 'graph_mode': 'cutoff', 'cutoff': 0.5881152307199439, 'grm_norm': 'none', 'self_loops': False, 'use_snp_selection': True, 'num_snps': 33812}. Best is trial 19 with value: 0.30021150341023195.
[I 2025-11-13 16:33:22,788] Trial 84 finished with value: 0.2690781606102054 and parameters: {'model_type': 'graphsage', 'hidden_dims': '[256, 128, 64]', 'dropout': 0.1350915062147482, 'batch_norm': False, 'lr': 5.221137217330373e-05, 'weight_decay': 0.0007859974881734235, 'epochs': 179, 'loss': 'mae', 'optimizer': 'adam', 'graph_mode': 'cutoff', 'cutoff': 0.31102277800536376, 'grm_norm': 'none', 'self_loops': False, 'use_snp_selection': True, 'num_snps': 39022}. Best is trial 19 with value: 0.30021150341023195.
[I 2025-11-13 16:35:12,886] Trial 85 finished with value: 0.27535340126843794 and parameters: {'model_type': 'graphsage', 'hidden_dims': '[256, 128, 64]', 'dropout': 0.17203543960681336, 'batch_norm': False, 'lr': 6.955272262999745e-05, 'weight_decay': 0.0005332172372663636, 'epochs': 193, 'loss': 'mae', 'optimizer': 'adam', 'graph_mode': 'cutoff', 'cutoff': 0.46264412440959557, 'grm_norm': 'none', 'self_loops': False, 'use_snp_selection': True, 'num_snps': 32217}. Best is trial 19 with value: 0.30021150341023195.
[I 2025-11-13 16:37:52,588] Trial 86 finished with value: 0.2683246575233947 and parameters: {'model_type': 'graphsage', 'hidden_dims': '[512, 256]', 'dropout': 0.1797498427772285, 'batch_norm': False, 'lr': 3.6825053600817944e-05, 'weight_decay': 1.653980218403741e-05, 'epochs': 263, 'loss': 'mae', 'optimizer': 'adam', 'graph_mode': 'cutoff', 'cutoff': 0.5195123512819598, 'grm_norm': 'none', 'self_loops': False, 'use_snp_selection': True, 'num_snps': 36035}. Best is trial 19 with value: 0.30021150341023195.
[I 2025-11-13 16:39:55,066] Trial 87 finished with value: 0.2775176234975504 and parameters: {'model_type': 'graphsage', 'hidden_dims': '[512, 64]', 'dropout': 0.5247690403896165, 'batch_norm': False, 'lr': 9.541664836261099e-05, 'weight_decay': 0.00016004031777235356, 'epochs': 165, 'loss': 'mae', 'optimizer': 'adam', 'graph_mode': 'cutoff', 'cutoff': 0.431417081383767, 'grm_norm': 'gcn', 'self_loops': False, 'use_snp_selection': True, 'num_snps': 30508}. Best is trial 19 with value: 0.30021150341023195.
[I 2025-11-13 16:43:28,891] Trial 88 finished with value: 0.2568483109549395 and parameters: {'model_type': 'graphsage', 'hidden_dims': '[256, 128, 64]', 'dropout': 0.29339491066902945, 'batch_norm': False, 'lr': 0.00012794424928521902, 'weight_decay': 0.0009940707210051771, 'epochs': 224, 'loss': 'mse', 'optimizer': 'adam', 'graph_mode': 'cutoff', 'cutoff': 0.4832598690301192, 'grm_norm': 'none', 'self_loops': False, 'use_snp_selection': True, 'num_snps': 59944}. Best is trial 19 with value: 0.30021150341023195.
[I 2025-11-13 16:44:26,496] Trial 89 finished with value: 0.23631343286685524 and parameters: {'model_type': 'graphsage', 'hidden_dims': '[128, 64]', 'dropout': 0.32194304392398954, 'batch_norm': False, 'lr': 1.5115161846393108e-05, 'weight_decay': 0.0003767478115704306, 'epochs': 41, 'loss': 'mae', 'optimizer': 'adam', 'graph_mode': 'cutoff', 'cutoff': 0.5681949859603438, 'grm_norm': 'cosine_then_gcn', 'self_loops': False, 'use_snp_selection': True, 'num_snps': 24348}. Best is trial 19 with value: 0.30021150341023195.
[I 2025-11-13 16:46:47,289] Trial 90 finished with value: 0.25815457958236304 and parameters: {'model_type': 'graphsage', 'hidden_dims': '[256, 128, 64]', 'dropout': 0.19415408393546368, 'batch_norm': False, 'lr': 2.047331888417767e-05, 'weight_decay': 9.719184839822635e-06, 'epochs': 202, 'loss': 'mae', 'optimizer': 'adam', 'graph_mode': 'cutoff', 'cutoff': 0.402884913328351, 'grm_norm': 'none', 'self_loops': False, 'use_snp_selection': True, 'num_snps': 37531}. Best is trial 19 with value: 0.30021150341023195.
[I 2025-11-13 16:49:09,745] Trial 91 finished with value: 0.2689841099436464 and parameters: {'model_type': 'graphsage', 'hidden_dims': '[256, 128, 64]', 'dropout': 0.148495007533509, 'batch_norm': False, 'lr': 5.8604457165728596e-05, 'weight_decay': 0.0005765229875453801, 'epochs': 211, 'loss': 'mae', 'optimizer': 'adam', 'graph_mode': 'cutoff', 'cutoff': 0.4875795500762156, 'grm_norm': 'none', 'self_loops': False, 'use_snp_selection': True, 'num_snps': 42055}. Best is trial 19 with value: 0.30021150341023195.
[I 2025-11-13 16:50:56,121] Trial 92 finished with value: 0.2503886151907261 and parameters: {'model_type': 'graphsage', 'hidden_dims': '[256, 128, 64]', 'dropout': 0.12647287630063278, 'batch_norm': False, 'lr': 5.047800760387813e-05, 'weight_decay': 0.00023652328119366762, 'epochs': 210, 'loss': 'mae', 'optimizer': 'adam', 'graph_mode': 'cutoff', 'cutoff': 0.8487206760131896, 'grm_norm': 'none', 'self_loops': False, 'use_snp_selection': True, 'num_snps': 40279}. Best is trial 19 with value: 0.30021150341023195.
