[I 2025-11-03 14:54:24,315] Trial 51 finished with value: 0.1123106076075708 and parameters: {'model_type': 'graphsage', 'hidden_dims': '[512, 256]', 'dropout': 0.12093131169240601, 'batch_norm': True, 'lr': 9.139402334190602e-05, 'weight_decay': 1.9077792808914706e-07, 'epochs': 188, 'loss': 'mse', 'optimizer': 'adam', 'graph_mode': 'cutoff', 'cutoff': 0.6401462295749585, 'grm_norm': 'gcn', 'self_loops': False, 'use_snp_selection': False}. Best is trial 7 with value: 0.12018701237006751.
[I 2025-11-03 14:54:28,286] Trial 52 finished with value: 0.08957278530264254 and parameters: {'model_type': 'graphsage', 'hidden_dims': '[512, 256]', 'dropout': 0.1501367185063014, 'batch_norm': True, 'lr': 6.101392333670961e-05, 'weight_decay': 5.880837265656203e-07, 'epochs': 240, 'loss': 'mse', 'optimizer': 'adam', 'graph_mode': 'cutoff', 'cutoff': 0.7565281378839781, 'grm_norm': 'gcn', 'self_loops': False, 'use_snp_selection': False}. Best is trial 7 with value: 0.12018701237006751.
[I 2025-11-03 14:54:32,004] Trial 53 finished with value: 0.06805044956920936 and parameters: {'model_type': 'graphsage', 'hidden_dims': '[512, 256]', 'dropout': 0.11879823582982116, 'batch_norm': True, 'lr': 8.179934983439036e-06, 'weight_decay': 2.5933777338674173e-06, 'epochs': 211, 'loss': 'mse', 'optimizer': 'adam', 'graph_mode': 'cutoff', 'cutoff': 0.8143968652707814, 'grm_norm': 'gcn', 'self_loops': False, 'use_snp_selection': False}. Best is trial 7 with value: 0.12018701237006751.
[I 2025-11-03 14:54:35,351] Trial 54 finished with value: 0.11809757150264352 and parameters: {'model_type': 'graphsage', 'hidden_dims': '[512, 256]', 'dropout': 0.20744893177362486, 'batch_norm': True, 'lr': 0.00020194295599137646, 'weight_decay': 1.0618516088992912e-05, 'epochs': 162, 'loss': 'mse', 'optimizer': 'adam', 'graph_mode': 'cutoff', 'cutoff': 0.5172539294723739, 'grm_norm': 'none', 'self_loops': True, 'use_snp_selection': False}. Best is trial 7 with value: 0.12018701237006751.
[I 2025-11-03 14:54:37,660] Trial 55 finished with value: 0.11735346909958805 and parameters: {'model_type': 'graphsage', 'hidden_dims': '[256, 128, 64]', 'dropout': 0.22612377102819636, 'batch_norm': True, 'lr': 0.00021755942384052334, 'weight_decay': 2.5770408938039077e-05, 'epochs': 171, 'loss': 'mse', 'optimizer': 'adam', 'graph_mode': 'cutoff', 'cutoff': 0.5065560672395157, 'grm_norm': 'none', 'self_loops': True, 'use_snp_selection': False}. Best is trial 7 with value: 0.12018701237006751.
[I 2025-11-03 14:54:39,839] Trial 56 finished with value: 0.11311585592690952 and parameters: {'model_type': 'graphsage', 'hidden_dims': '[256, 128, 64]', 'dropout': 0.2179655245772069, 'batch_norm': True, 'lr': 0.00023004659676650606, 'weight_decay': 2.8061138794577398e-05, 'epochs': 145, 'loss': 'mse', 'optimizer': 'adam', 'graph_mode': 'cutoff', 'cutoff': 0.513194646223098, 'grm_norm': 'none', 'self_loops': True, 'use_snp_selection': False}. Best is trial 7 with value: 0.12018701237006751.
[I 2025-11-03 14:54:42,127] Trial 57 finished with value: 0.08712126377406355 and parameters: {'model_type': 'graphsage', 'hidden_dims': '[256, 128, 64]', 'dropout': 0.31960655274396493, 'batch_norm': True, 'lr': 0.00031749203726616975, 'weight_decay': 1.8111502890170228e-05, 'epochs': 167, 'loss': 'mse', 'optimizer': 'adam', 'graph_mode': 'cutoff', 'cutoff': 0.4987356926592299, 'grm_norm': 'none', 'self_loops': True, 'use_snp_selection': False}. Best is trial 7 with value: 0.12018701237006751.
[I 2025-11-03 14:54:44,503] Trial 58 finished with value: 0.08976511745876387 and parameters: {'model_type': 'graphsage', 'hidden_dims': '[256, 128, 64]', 'dropout': 0.2307797556705368, 'batch_norm': True, 'lr': 0.0002024910620239891, 'weight_decay': 7.927827742188628e-05, 'epochs': 186, 'loss': 'mse', 'optimizer': 'adam', 'graph_mode': 'cutoff', 'cutoff': 0.6082405243874608, 'grm_norm': 'none', 'self_loops': True, 'use_snp_selection': False}. Best is trial 7 with value: 0.12018701237006751.
[I 2025-11-03 14:54:46,563] Trial 59 finished with value: 0.10126749182417258 and parameters: {'model_type': 'graphsage', 'hidden_dims': '[256, 128, 64]', 'dropout': 0.2644447436584363, 'batch_norm': True, 'lr': 0.00011518694046947406, 'weight_decay': 1.0683866423140824e-05, 'epochs': 118, 'loss': 'mse', 'optimizer': 'adam', 'graph_mode': 'cutoff', 'cutoff': 0.3801509956174913, 'grm_norm': 'none', 'self_loops': True, 'use_snp_selection': False}. Best is trial 7 with value: 0.12018701237006751.
[I 2025-11-03 14:54:48,860] Trial 60 finished with value: 0.0766830599100589 and parameters: {'model_type': 'graphsage', 'hidden_dims': '[512, 64]', 'dropout': 0.20195040564229708, 'batch_norm': False, 'lr': 1.711007240128535e-05, 'weight_decay': 4.7810999987075165e-05, 'epochs': 134, 'loss': 'mae', 'optimizer': 'adam', 'graph_mode': 'cutoff', 'cutoff': 0.4790081389866959, 'grm_norm': 'none', 'self_loops': True, 'use_snp_selection': True, 'num_snps': 19019}. Best is trial 7 with value: 0.12018701237006751.
[I 2025-11-03 14:54:52,297] Trial 61 finished with value: 0.11209707631244457 and parameters: {'model_type': 'graphsage', 'hidden_dims': '[512, 256]', 'dropout': 0.17204020468146625, 'batch_norm': True, 'lr': 0.0001665392733550222, 'weight_decay': 1.5330283568061543e-05, 'epochs': 173, 'loss': 'mse', 'optimizer': 'adam', 'graph_mode': 'cutoff', 'cutoff': 0.5553675131368858, 'grm_norm': 'none', 'self_loops': True, 'use_snp_selection': False}. Best is trial 7 with value: 0.12018701237006751.
[I 2025-11-03 14:54:55,784] Trial 62 finished with value: 0.1092710640382542 and parameters: {'model_type': 'graphsage', 'hidden_dims': '[512, 128]', 'dropout': 0.19204588832334904, 'batch_norm': True, 'lr': 0.00026363595159428906, 'weight_decay': 3.2594145804848494e-05, 'epochs': 181, 'loss': 'mse', 'optimizer': 'adam', 'graph_mode': 'cutoff', 'cutoff': 0.7188827555801048, 'grm_norm': 'none', 'self_loops': True, 'use_snp_selection': False}. Best is trial 7 with value: 0.12018701237006751.
[I 2025-11-03 14:54:59,078] Trial 63 finished with value: 0.12672616425155095 and parameters: {'model_type': 'graphsage', 'hidden_dims': '[512, 256]', 'dropout': 0.14772279095398227, 'batch_norm': True, 'lr': 0.00041618838358254166, 'weight_decay': 6.498573831335188e-06, 'epochs': 156, 'loss': 'mse', 'optimizer': 'adam', 'graph_mode': 'cutoff', 'cutoff': 0.5534422894920609, 'grm_norm': 'gcn', 'self_loops': True, 'use_snp_selection': False}. Best is trial 63 with value: 0.12672616425155095.
[I 2025-11-03 14:55:02,366] Trial 64 finished with value: 0.1096024816074593 and parameters: {'model_type': 'graphsage', 'hidden_dims': '[512, 256]', 'dropout': 0.2048805861157058, 'batch_norm': True, 'lr': 0.0006583269959006626, 'weight_decay': 1.0545230406487251e-06, 'epochs': 153, 'loss': 'mse', 'optimizer': 'adam', 'graph_mode': 'cutoff', 'cutoff': 0.560415934657803, 'grm_norm': 'gcn', 'self_loops': True, 'use_snp_selection': False}. Best is trial 63 with value: 0.12672616425155095.
[I 2025-11-03 14:55:04,041] Trial 65 finished with value: 0.09868063187673425 and parameters: {'model_type': 'graphsage', 'hidden_dims': '[128, 64]', 'dropout': 0.1465179906466822, 'batch_norm': True, 'lr': 0.0003772567551116546, 'weight_decay': 6.269963373801486e-06, 'epochs': 135, 'loss': 'mse', 'optimizer': 'adam', 'graph_mode': 'cutoff', 'cutoff': 0.6388254933626896, 'grm_norm': 'gcn', 'self_loops': True, 'use_snp_selection': False}. Best is trial 63 with value: 0.12672616425155095.
[I 2025-11-03 14:55:07,038] Trial 66 finished with value: 0.11770957659448784 and parameters: {'model_type': 'graphsage', 'hidden_dims': '[512, 256]', 'dropout': 0.2307619353383019, 'batch_norm': True, 'lr': 0.0004372817484695638, 'weight_decay': 3.770548349383617e-06, 'epochs': 119, 'loss': 'mse', 'optimizer': 'adam', 'graph_mode': 'cutoff', 'cutoff': 0.45761621650190276, 'grm_norm': 'gcn', 'self_loops': True, 'use_snp_selection': False}. Best is trial 63 with value: 0.12672616425155095.
[I 2025-11-03 14:55:09,019] Trial 67 finished with value: 0.11007247404188325 and parameters: {'model_type': 'graphsage', 'hidden_dims': '[256, 128, 64]', 'dropout': 0.23476770885026038, 'batch_norm': True, 'lr': 0.0004429052983600739, 'weight_decay': 3.4788498061830994e-06, 'epochs': 107, 'loss': 'mse', 'optimizer': 'adam', 'graph_mode': 'cutoff', 'cutoff': 0.4549045829853388, 'grm_norm': 'gcn', 'self_loops': True, 'use_snp_selection': False}. Best is trial 63 with value: 0.12672616425155095.
[I 2025-11-03 14:55:11,676] Trial 68 finished with value: 0.11414175327320314 and parameters: {'model_type': 'graphsage', 'hidden_dims': '[512, 256]', 'dropout': 0.25479291242250574, 'batch_norm': True, 'lr': 0.0007832133154163039, 'weight_decay': 1.9113985169367717e-05, 'epochs': 74, 'loss': 'mse', 'optimizer': 'adam', 'graph_mode': 'cutoff', 'cutoff': 0.409172017850701, 'grm_norm': 'gcn', 'self_loops': True, 'use_snp_selection': False}. Best is trial 63 with value: 0.12672616425155095.
[I 2025-11-03 14:55:13,809] Trial 69 finished with value: 0.11959263666289312 and parameters: {'model_type': 'graphsage', 'hidden_dims': '[256, 128]', 'dropout': 0.17181666974090604, 'batch_norm': True, 'lr': 0.0005743748060249823, 'weight_decay': 9.147172475739742e-06, 'epochs': 165, 'loss': 'mse', 'optimizer': 'adam', 'graph_mode': 'cutoff', 'cutoff': 0.5372026032307621, 'grm_norm': 'gcn', 'self_loops': True, 'use_snp_selection': False}. Best is trial 63 with value: 0.12672616425155095.
[I 2025-11-03 14:55:16,642] Trial 70 finished with value: 0.10729747555200916 and parameters: {'model_type': 'graphsage', 'hidden_dims': '[512, 256]', 'dropout': 0.16888447550719904, 'batch_norm': True, 'lr': 0.0005752363837061543, 'weight_decay': 4.073896531409042e-06, 'epochs': 94, 'loss': 'mse', 'optimizer': 'adam', 'graph_mode': 'cutoff', 'cutoff': 0.3416024074458104, 'grm_norm': 'gcn', 'self_loops': True, 'use_snp_selection': False}. Best is trial 63 with value: 0.12672616425155095.
[I 2025-11-03 14:55:18,762] Trial 71 finished with value: 0.11491103749955484 and parameters: {'model_type': 'graphsage', 'hidden_dims': '[256, 128]', 'dropout': 0.2837050489729377, 'batch_norm': True, 'lr': 0.0004892432312226621, 'weight_decay': 1.1227398526577733e-05, 'epochs': 162, 'loss': 'mse', 'optimizer': 'adam', 'graph_mode': 'cutoff', 'cutoff': 0.5497567907297126, 'grm_norm': 'gcn', 'self_loops': True, 'use_snp_selection': False}. Best is trial 63 with value: 0.12672616425155095.
[I 2025-11-03 14:55:20,781] Trial 72 finished with value: 0.07903516932275956 and parameters: {'model_type': 'graphsage', 'hidden_dims': '[256, 128]', 'dropout': 0.17996713971604264, 'batch_norm': True, 'lr': 2.9216711768038415e-05, 'weight_decay': 8.830281743614106e-06, 'epochs': 138, 'loss': 'mse', 'optimizer': 'adam', 'graph_mode': 'cutoff', 'cutoff': 0.5220140212076919, 'grm_norm': 'gcn', 'self_loops': True, 'use_snp_selection': False}. Best is trial 63 with value: 0.12672616425155095.
[I 2025-11-03 14:55:22,752] Trial 73 finished with value: 0.10931739666683117 and parameters: {'model_type': 'graphsage', 'hidden_dims': '[256, 128]', 'dropout': 0.2034617162022155, 'batch_norm': True, 'lr': 0.000841010017981296, 'weight_decay': 5.115907814774062e-06, 'epochs': 122, 'loss': 'mse', 'optimizer': 'adam', 'graph_mode': 'cutoff', 'cutoff': 0.45653913173237654, 'grm_norm': 'gcn', 'self_loops': True, 'use_snp_selection': False}. Best is trial 63 with value: 0.12672616425155095.
[I 2025-11-03 14:55:24,865] Trial 74 finished with value: 0.10923928075485748 and parameters: {'model_type': 'graphsage', 'hidden_dims': '[256, 128]', 'dropout': 0.15323020583381264, 'batch_norm': True, 'lr': 0.00031321343880643553, 'weight_decay': 6.411290061406393e-06, 'epochs': 159, 'loss': 'mse', 'optimizer': 'adam', 'graph_mode': 'cutoff', 'cutoff': 0.8460404203804859, 'grm_norm': 'cosine', 'self_loops': True, 'use_snp_selection': False}. Best is trial 63 with value: 0.12672616425155095.
[I 2025-11-03 14:55:26,697] Trial 75 finished with value: 0.08531964963046716 and parameters: {'model_type': 'graphsage', 'hidden_dims': '[128, 64]', 'dropout': 0.12816250719114772, 'batch_norm': True, 'lr': 4.546663971910751e-05, 'weight_decay': 5.852466317466701e-05, 'epochs': 178, 'loss': 'mse', 'optimizer': 'adam', 'graph_mode': 'cutoff', 'cutoff': 0.5867999394439908, 'grm_norm': 'cosine_then_gcn', 'self_loops': True, 'use_snp_selection': False}. Best is trial 63 with value: 0.12672616425155095.
[I 2025-11-03 14:55:30,334] Trial 76 finished with value: 0.10495179452966473 and parameters: {'model_type': 'graphsage', 'hidden_dims': '[512, 256]', 'dropout': 0.1599282806732695, 'batch_norm': True, 'lr': 0.0005881965407315557, 'weight_decay': 1.9140718657786947e-06, 'epochs': 201, 'loss': 'mse', 'optimizer': 'adam', 'graph_mode': 'cutoff', 'cutoff': 0.5326566435885954, 'grm_norm': 'gcn', 'self_loops': True, 'use_snp_selection': False}. Best is trial 63 with value: 0.12672616425155095.
[I 2025-11-03 14:55:33,726] Trial 77 finished with value: 0.10992478848638734 and parameters: {'model_type': 'graphsage', 'hidden_dims': '[512, 128]', 'dropout': 0.4277030202812725, 'batch_norm': True, 'lr': 0.0004200574638123725, 'weight_decay': 1.704148773320416e-05, 'epochs': 169, 'loss': 'mse', 'optimizer': 'adam', 'graph_mode': 'cutoff', 'cutoff': 0.49073405253472063, 'grm_norm': 'gcn', 'self_loops': False, 'use_snp_selection': False}. Best is trial 63 with value: 0.12672616425155095.
[I 2025-11-03 14:55:37,966] Trial 78 finished with value: 0.044418917405849044 and parameters: {'model_type': 'graphsage', 'hidden_dims': '[512, 256]', 'dropout': 0.13940264794649096, 'batch_norm': False, 'lr': 0.00022683451935996902, 'weight_decay': 8.65473695317431e-06, 'epochs': 151, 'loss': 'mse', 'optimizer': 'adam', 'graph_mode': 'cutoff', 'cutoff': 0.6415675557432494, 'grm_norm': 'gcn', 'self_loops': True, 'use_snp_selection': True, 'num_snps': 49628}. Best is trial 63 with value: 0.12672616425155095.
[I 2025-11-03 14:55:41,568] Trial 79 finished with value: 0.10582849539424537 and parameters: {'model_type': 'graphsage', 'hidden_dims': '[512, 64]', 'dropout': 0.2490912705819641, 'batch_norm': True, 'lr': 7.418990469269481e-05, 'weight_decay': 1.3187863286187171e-05, 'epochs': 191, 'loss': 'mae', 'optimizer': 'adam', 'graph_mode': 'cutoff', 'cutoff': 0.4748475390764995, 'grm_norm': 'cosine', 'self_loops': False, 'use_snp_selection': False}. Best is trial 63 with value: 0.12672616425155095.
[I 2025-11-03 14:55:43,591] Trial 80 finished with value: 0.10357857321865858 and parameters: {'model_type': 'graphsage', 'hidden_dims': '[256, 128]', 'dropout': 0.2261898335934025, 'batch_norm': True, 'lr': 0.00028281975056565955, 'weight_decay': 2.76510591255676e-05, 'epochs': 126, 'loss': 'mse', 'optimizer': 'adam', 'graph_mode': 'cutoff', 'cutoff': 0.6858471309546619, 'grm_norm': 'cosine_then_gcn', 'self_loops': True, 'use_snp_selection': False}. Best is trial 63 with value: 0.12672616425155095.
[I 2025-11-03 14:55:47,113] Trial 81 finished with value: 0.1201458729878935 and parameters: {'model_type': 'graphsage', 'hidden_dims': '[512, 256]', 'dropout': 0.2087372782653568, 'batch_norm': True, 'lr': 0.0003541631798632638, 'weight_decay': 6.541201490260133e-07, 'epochs': 182, 'loss': 'mse', 'optimizer': 'adam', 'graph_mode': 'cutoff', 'cutoff': 0.427657701625788, 'grm_norm': 'none', 'self_loops': False, 'use_snp_selection': False}. Best is trial 63 with value: 0.12672616425155095.
[I 2025-11-03 14:55:50,331] Trial 82 finished with value: 0.11624207593301158 and parameters: {'model_type': 'graphsage', 'hidden_dims': '[512, 256]', 'dropout': 0.21214960039133934, 'batch_norm': True, 'lr': 0.00037417610499864394, 'weight_decay': 7.571801726557699e-07, 'epochs': 143, 'loss': 'mse', 'optimizer': 'adam', 'graph_mode': 'cutoff', 'cutoff': 0.41498210056998774, 'grm_norm': 'none', 'self_loops': False, 'use_snp_selection': False}. Best is trial 63 with value: 0.12672616425155095.
[I 2025-11-03 14:55:54,051] Trial 83 finished with value: 0.12234709092696619 and parameters: {'model_type': 'graphsage', 'hidden_dims': '[512, 256]', 'dropout': 0.19436915198563415, 'batch_norm': True, 'lr': 0.0006750357551918774, 'weight_decay': 1.6373386015649398e-06, 'epochs': 206, 'loss': 'mse', 'optimizer': 'adam', 'graph_mode': 'cutoff', 'cutoff': 0.37016331490842136, 'grm_norm': 'none', 'self_loops': False, 'use_snp_selection': False}. Best is trial 63 with value: 0.12672616425155095.
[I 2025-11-03 14:55:57,026] Trial 84 finished with value: 0.10491115121439204 and parameters: {'model_type': 'graphsage', 'hidden_dims': '[512, 256]', 'dropout': 0.18462972685107437, 'batch_norm': True, 'lr': 0.0007014579368574324, 'weight_decay': 1.652693508262843e-06, 'epochs': 111, 'loss': 'mse', 'optimizer': 'adam', 'graph_mode': 'cutoff', 'cutoff': 0.31569162508808923, 'grm_norm': 'none', 'self_loops': False, 'use_snp_selection': False}. Best is trial 63 with value: 0.12672616425155095.
[I 2025-11-03 14:56:00,699] Trial 85 finished with value: 0.10728406801373151 and parameters: {'model_type': 'graphsage', 'hidden_dims': '[512, 256]', 'dropout': 0.19449882549221467, 'batch_norm': True, 'lr': 0.0005110163542018951, 'weight_decay': 2.814183348354399e-06, 'epochs': 207, 'loss': 'mse', 'optimizer': 'adam', 'graph_mode': 'cutoff', 'cutoff': 0.39617297957245867, 'grm_norm': 'none', 'self_loops': False, 'use_snp_selection': False}. Best is trial 63 with value: 0.12672616425155095.
[I 2025-11-03 14:56:04,278] Trial 86 finished with value: 0.11181640238946006 and parameters: {'model_type': 'graphsage', 'hidden_dims': '[512, 256]', 'dropout': 0.11736470884167664, 'batch_norm': True, 'lr': 0.0006721091531416676, 'weight_decay': 2.647309200620755e-07, 'epochs': 187, 'loss': 'mse', 'optimizer': 'adam', 'graph_mode': 'cutoff', 'cutoff': 0.3640331241976577, 'grm_norm': 'gcn', 'self_loops': False, 'use_snp_selection': False}. Best is trial 63 with value: 0.12672616425155095.
[I 2025-11-03 14:56:08,152] Trial 87 finished with value: 0.1072560604088839 and parameters: {'model_type': 'graphsage', 'hidden_dims': '[512, 256]', 'dropout': 0.17871355360615604, 'batch_norm': True, 'lr': 0.0009225081844294134, 'weight_decay': 1.318801425446589e-06, 'epochs': 226, 'loss': 'mse', 'optimizer': 'adam', 'graph_mode': 'cutoff', 'cutoff': 0.278331497446642, 'grm_norm': 'gcn', 'self_loops': False, 'use_snp_selection': False}. Best is trial 63 with value: 0.12672616425155095.
[I 2025-11-03 14:56:11,641] Trial 88 finished with value: 0.10303100953189255 and parameters: {'model_type': 'graphsage', 'hidden_dims': '[512, 256]', 'dropout': 0.1646570575788299, 'batch_norm': True, 'lr': 0.00043512156607537327, 'weight_decay': 7.264075386165088e-07, 'epochs': 182, 'loss': 'mse', 'optimizer': 'adam', 'graph_mode': 'cutoff', 'cutoff': 0.8378616265459262, 'grm_norm': 'none', 'self_loops': False, 'use_snp_selection': False}. Best is trial 63 with value: 0.12672616425155095.
[I 2025-11-03 14:56:13,435] Trial 89 finished with value: 0.08984919118160277 and parameters: {'model_type': 'graphsage', 'hidden_dims': '[512, 256]', 'dropout': 0.14793796896283828, 'batch_norm': False, 'lr': 1.2455623823069429e-05, 'weight_decay': 2.0629782405975473e-06, 'epochs': 196, 'loss': 'mse', 'optimizer': 'adam', 'graph_mode': 'cutoff', 'cutoff': 0.4426942341908723, 'grm_norm': 'gcn', 'self_loops': False, 'use_snp_selection': True, 'num_snps': 3785}. Best is trial 63 with value: 0.12672616425155095.
[I 2025-11-03 14:56:15,363] Trial 90 finished with value: 0.10223435217562794 and parameters: {'model_type': 'graphsage', 'hidden_dims': '[128, 64]', 'dropout': 0.306581475332539, 'batch_norm': True, 'lr': 0.0003241901229537892, 'weight_decay': 4.730717331828018e-07, 'epochs': 204, 'loss': 'mse', 'optimizer': 'adam', 'graph_mode': 'cutoff', 'cutoff': 0.7604669479596087, 'grm_norm': 'cosine', 'self_loops': False, 'use_snp_selection': False}. Best is trial 63 with value: 0.12672616425155095.
[I 2025-11-03 14:56:18,742] Trial 91 finished with value: 0.10760139156350122 and parameters: {'model_type': 'graphsage', 'hidden_dims': '[512, 256]', 'dropout': 0.27646535436500186, 'batch_norm': True, 'lr': 0.000582137978407821, 'weight_decay': 3.968938390970262e-06, 'epochs': 166, 'loss': 'mse', 'optimizer': 'adam', 'graph_mode': 'cutoff', 'cutoff': 0.43956663488126474, 'grm_norm': 'none', 'self_loops': False, 'use_snp_selection': False}. Best is trial 63 with value: 0.12672616425155095.
[I 2025-11-03 14:56:20,940] Trial 92 finished with value: 0.10458450124532041 and parameters: {'model_type': 'graphsage', 'hidden_dims': '[256, 128, 64]', 'dropout': 0.21325171406633153, 'batch_norm': True, 'lr': 0.00017661808583554068, 'weight_decay': 2.095059143478498e-05, 'epochs': 154, 'loss': 'mse', 'optimizer': 'adam', 'graph_mode': 'cutoff', 'cutoff': 0.4753609002602771, 'grm_norm': 'none', 'self_loops': False, 'use_snp_selection': False}. Best is trial 63 with value: 0.12672616425155095.
[I 2025-11-03 14:56:24,350] Trial 93 finished with value: 0.11201238894379492 and parameters: {'model_type': 'graphsage', 'hidden_dims': '[512, 256]', 'dropout': 0.24517743698278252, 'batch_norm': True, 'lr': 0.0002613399450160823, 'weight_decay': 5.252908744688065e-06, 'epochs': 172, 'loss': 'mse', 'optimizer': 'adam', 'graph_mode': 'cutoff', 'cutoff': 0.7277759108257645, 'grm_norm': 'none', 'self_loops': True, 'use_snp_selection': False}. Best is trial 63 with value: 0.12672616425155095.
[I 2025-11-03 14:56:27,804] Trial 94 finished with value: 0.07188662404480776 and parameters: {'model_type': 'graphsage', 'hidden_dims': '[512, 256]', 'dropout': 0.2323396451093433, 'batch_norm': True, 'lr': 2.5330502492621975e-05, 'weight_decay': 7.769542779667156e-06, 'epochs': 178, 'loss': 'mse', 'optimizer': 'adam', 'graph_mode': 'cutoff', 'cutoff': 0.5312953368864527, 'grm_norm': 'none', 'self_loops': False, 'use_snp_selection': False}. Best is trial 63 with value: 0.12672616425155095.
