[I 2025-11-03 12:56:33,062] Trial 144 finished with value: 0.1114338774343168 and parameters: {'model_type': 'graphsage', 'hidden_dims': '[128, 64]', 'dropout': 0.3994464970624031, 'batch_norm': True, 'lr': 0.0001147548415371872, 'weight_decay': 6.1870260937341005e-06, 'epochs': 174, 'loss': 'mae', 'optimizer': 'adam', 'graph_mode': 'knn', 'source': 'grm', 'knn_k': 6, 'weighted_edges': True, 'symmetrize_mode': 'mutual', 'use_snp_selection': True, 'num_snps': 58773}. Best is trial 123 with value: 0.13247668684539143.
[I 2025-11-03 12:56:35,840] Trial 145 finished with value: 0.048056614578453005 and parameters: {'model_type': 'graphsage', 'hidden_dims': '[128, 64]', 'dropout': 0.13556504668953262, 'batch_norm': True, 'lr': 2.8958224826279026e-05, 'weight_decay': 2.042829918922122e-06, 'epochs': 142, 'loss': 'mae', 'optimizer': 'adam', 'graph_mode': 'knn', 'source': 'grm', 'knn_k': 6, 'weighted_edges': True, 'symmetrize_mode': 'mutual', 'use_snp_selection': True, 'num_snps': 28478}. Best is trial 123 with value: 0.13247668684539143.
[I 2025-11-03 12:56:39,926] Trial 146 finished with value: 0.1051250449910089 and parameters: {'model_type': 'graphsage', 'hidden_dims': '[128, 64]', 'dropout': 0.3900990439156381, 'batch_norm': True, 'lr': 0.00030382417307849393, 'weight_decay': 2.994167631357957e-06, 'epochs': 164, 'loss': 'mse', 'optimizer': 'adam', 'graph_mode': 'knn', 'source': 'grm', 'knn_k': 7, 'weighted_edges': True, 'symmetrize_mode': 'mutual', 'use_snp_selection': True, 'num_snps': 56310}. Best is trial 123 with value: 0.13247668684539143.
[I 2025-11-03 12:56:45,004] Trial 147 finished with value: 0.11922829804453063 and parameters: {'model_type': 'graphsage', 'hidden_dims': '[256, 128]', 'dropout': 0.1545021105277961, 'batch_norm': False, 'lr': 0.00019209970427112275, 'weight_decay': 3.2874465791389045e-07, 'epochs': 334, 'loss': 'mae', 'optimizer': 'adam', 'graph_mode': 'cutoff', 'cutoff': 0.7672362970726193, 'grm_norm': 'none', 'self_loops': True, 'use_snp_selection': True, 'num_snps': 54410}. Best is trial 123 with value: 0.13247668684539143.
[I 2025-11-03 12:56:48,771] Trial 148 finished with value: 0.09445772967002809 and parameters: {'model_type': 'graphsage', 'hidden_dims': '[128, 64]', 'dropout': 0.34580056371575396, 'batch_norm': True, 'lr': 0.0002788053841435888, 'weight_decay': 4.07985906075978e-06, 'epochs': 113, 'loss': 'mae', 'optimizer': 'adam', 'graph_mode': 'knn', 'source': 'grm', 'knn_k': 4, 'weighted_edges': False, 'symmetrize_mode': 'union', 'use_snp_selection': True, 'num_snps': 53045}. Best is trial 123 with value: 0.13247668684539143.
[I 2025-11-03 12:56:52,602] Trial 149 finished with value: 0.0862751146473066 and parameters: {'model_type': 'graphsage', 'hidden_dims': '[128, 64]', 'dropout': 0.36104130454217703, 'batch_norm': False, 'lr': 0.0005103070404924783, 'weight_decay': 2.3873326350129498e-06, 'epochs': 342, 'loss': 'mae', 'optimizer': 'adam', 'graph_mode': 'cutoff', 'cutoff': 0.6059048618715163, 'grm_norm': 'cosine_then_gcn', 'self_loops': False, 'use_snp_selection': True, 'num_snps': 45433}. Best is trial 123 with value: 0.13247668684539143.
[I 2025-11-03 12:56:55,416] Trial 0 finished with value: -0.03690088622645453 and parameters: {'model_type': 'graphsage', 'hidden_dims': '[128, 64]', 'dropout': 0.199031432379812, 'batch_norm': True, 'lr': 1.8408544111075837e-06, 'weight_decay': 5.5136510071208614e-05, 'epochs': 336, 'loss': 'mae', 'optimizer': 'adam', 'graph_mode': 'knn', 'source': 'grm', 'knn_k': 8, 'weighted_edges': True, 'symmetrize_mode': 'mutual', 'use_snp_selection': False}. Best is trial 0 with value: -0.03690088622645453.
[I 2025-11-03 12:56:57,058] Trial 1 finished with value: 0.034906957581619456 and parameters: {'model_type': 'graphsage', 'hidden_dims': '[128, 64]', 'dropout': 0.40051947670227217, 'batch_norm': True, 'lr': 0.0005320428882732732, 'weight_decay': 1.89210117736594e-06, 'epochs': 68, 'loss': 'mse', 'optimizer': 'adam', 'graph_mode': 'knn', 'source': 'grm', 'knn_k': 7, 'weighted_edges': True, 'symmetrize_mode': 'union', 'use_snp_selection': False}. Best is trial 1 with value: 0.034906957581619456.
[I 2025-11-03 12:56:59,704] Trial 2 finished with value: 0.036136474185786506 and parameters: {'model_type': 'graphsage', 'hidden_dims': '[256, 128]', 'dropout': 0.5105528289184642, 'batch_norm': False, 'lr': 0.0006804279372404962, 'weight_decay': 0.0008922815224257085, 'epochs': 181, 'loss': 'mse', 'optimizer': 'adam', 'graph_mode': 'cutoff', 'cutoff': 0.5741905641612706, 'grm_norm': 'gcn', 'self_loops': False, 'use_snp_selection': True, 'num_snps': 26910}. Best is trial 2 with value: 0.036136474185786506.
[I 2025-11-03 12:57:02,518] Trial 3 finished with value: -0.028449758463692465 and parameters: {'model_type': 'graphsage', 'hidden_dims': '[256, 128, 64]', 'dropout': 0.5390483213624292, 'batch_norm': False, 'lr': 3.4705625989073525e-05, 'weight_decay': 2.4623319020131338e-05, 'epochs': 121, 'loss': 'mse', 'optimizer': 'adam', 'graph_mode': 'knn', 'source': 'grm', 'knn_k': 6, 'weighted_edges': False, 'symmetrize_mode': 'mutual', 'use_snp_selection': True, 'num_snps': 30713}. Best is trial 2 with value: 0.036136474185786506.
[I 2025-11-03 12:57:05,280] Trial 4 finished with value: 0.005236181221694069 and parameters: {'model_type': 'graphsage', 'hidden_dims': '[128, 64]', 'dropout': 0.13404863676897502, 'batch_norm': False, 'lr': 0.0001431556295367288, 'weight_decay': 2.2084517750726675e-05, 'epochs': 51, 'loss': 'mae', 'optimizer': 'adam', 'graph_mode': 'cutoff', 'cutoff': 0.6714268476993044, 'grm_norm': 'none', 'self_loops': False, 'use_snp_selection': True, 'num_snps': 45645}. Best is trial 2 with value: 0.036136474185786506.
[I 2025-11-03 12:57:08,723] Trial 5 finished with value: 0.01165293276118955 and parameters: {'model_type': 'graphsage', 'hidden_dims': '[256, 128]', 'dropout': 0.42253606323412096, 'batch_norm': False, 'lr': 4.238630400638805e-05, 'weight_decay': 8.074086040046576e-07, 'epochs': 158, 'loss': 'mae', 'optimizer': 'adam', 'graph_mode': 'knn', 'source': 'grm', 'knn_k': 1, 'weighted_edges': False, 'symmetrize_mode': 'mutual', 'use_snp_selection': True, 'num_snps': 43113}. Best is trial 2 with value: 0.036136474185786506.
[I 2025-11-03 12:57:13,109] Trial 6 finished with value: 0.026190052837387817 and parameters: {'model_type': 'graphsage', 'hidden_dims': '[512, 256]', 'dropout': 0.3534893146320237, 'batch_norm': True, 'lr': 0.000251307964226932, 'weight_decay': 1.821819791794022e-05, 'epochs': 223, 'loss': 'mae', 'optimizer': 'adam', 'graph_mode': 'knn', 'source': 'grm', 'knn_k': 1, 'weighted_edges': True, 'symmetrize_mode': 'mutual', 'use_snp_selection': False}. Best is trial 2 with value: 0.036136474185786506.
[I 2025-11-03 12:57:17,017] Trial 7 finished with value: 0.009106795489622205 and parameters: {'model_type': 'graphsage', 'hidden_dims': '[512, 256]', 'dropout': 0.1105825955860775, 'batch_norm': True, 'lr': 2.374338412754043e-05, 'weight_decay': 1.1284721123340274e-05, 'epochs': 190, 'loss': 'mse', 'optimizer': 'adam', 'graph_mode': 'cutoff', 'cutoff': 0.719872204109604, 'grm_norm': 'gcn', 'self_loops': False, 'use_snp_selection': False}. Best is trial 2 with value: 0.036136474185786506.
[I 2025-11-03 12:57:20,419] Trial 8 finished with value: 0.04026032760669233 and parameters: {'model_type': 'graphsage', 'hidden_dims': '[512, 128]', 'dropout': 0.5066580418354021, 'batch_norm': True, 'lr': 0.00039213678276659976, 'weight_decay': 3.43655320802934e-06, 'epochs': 120, 'loss': 'mse', 'optimizer': 'adam', 'graph_mode': 'cutoff', 'cutoff': 0.34923059576505366, 'grm_norm': 'cosine', 'self_loops': True, 'use_snp_selection': False}. Best is trial 8 with value: 0.04026032760669233.
[I 2025-11-03 12:57:22,589] Trial 9 finished with value: 0.031973733739450595 and parameters: {'model_type': 'graphsage', 'hidden_dims': '[512, 256]', 'dropout': 0.301734920240333, 'batch_norm': False, 'lr': 6.650961854953448e-06, 'weight_decay': 6.861575656590315e-05, 'epochs': 150, 'loss': 'mae', 'optimizer': 'adam', 'graph_mode': 'cutoff', 'cutoff': 0.2857569870061939, 'grm_norm': 'cosine_then_gcn', 'self_loops': False, 'use_snp_selection': True, 'num_snps': 12722}. Best is trial 8 with value: 0.04026032760669233.
[I 2025-11-03 12:57:27,758] Trial 10 finished with value: 0.041181875302267676 and parameters: {'model_type': 'graphsage', 'hidden_dims': '[512, 128]', 'dropout': 0.5885461262002587, 'batch_norm': True, 'lr': 0.0001051230339774825, 'weight_decay': 1.3387352389235743e-07, 'epochs': 258, 'loss': 'mse', 'optimizer': 'adam', 'graph_mode': 'cutoff', 'cutoff': 0.2684196492120865, 'grm_norm': 'cosine', 'self_loops': True, 'use_snp_selection': False}. Best is trial 10 with value: 0.041181875302267676.
[I 2025-11-03 12:57:33,160] Trial 11 finished with value: 0.0018080087290050938 and parameters: {'model_type': 'graphsage', 'hidden_dims': '[512, 128]', 'dropout': 0.5890754684622632, 'batch_norm': True, 'lr': 0.00012623783700890367, 'weight_decay': 1.508061538813527e-07, 'epochs': 274, 'loss': 'mse', 'optimizer': 'adam', 'graph_mode': 'cutoff', 'cutoff': 0.24497725304786427, 'grm_norm': 'cosine', 'self_loops': True, 'use_snp_selection': False}. Best is trial 10 with value: 0.041181875302267676.
[I 2025-11-03 12:57:37,983] Trial 12 finished with value: 0.039499667770371984 and parameters: {'model_type': 'graphsage', 'hidden_dims': '[512, 128]', 'dropout': 0.48657806717860913, 'batch_norm': True, 'lr': 8.196071574687759e-05, 'weight_decay': 1.0694400602640794e-07, 'epochs': 258, 'loss': 'mse', 'optimizer': 'adam', 'graph_mode': 'cutoff', 'cutoff': 0.3951864557300021, 'grm_norm': 'cosine', 'self_loops': True, 'use_snp_selection': False}. Best is trial 10 with value: 0.041181875302267676.
[I 2025-11-03 12:57:43,527] Trial 13 finished with value: 0.039269785757527424 and parameters: {'model_type': 'graphsage', 'hidden_dims': '[512, 64]', 'dropout': 0.5967498725775604, 'batch_norm': True, 'lr': 0.0009837066213935635, 'weight_decay': 1.5710469218501838e-06, 'epochs': 322, 'loss': 'mse', 'optimizer': 'adam', 'graph_mode': 'cutoff', 'cutoff': 0.4034781585441799, 'grm_norm': 'cosine', 'self_loops': True, 'use_snp_selection': False}. Best is trial 10 with value: 0.041181875302267676.
[I 2025-11-03 12:57:46,620] Trial 14 finished with value: 0.018182863804890734 and parameters: {'model_type': 'graphsage', 'hidden_dims': '[512, 128]', 'dropout': 0.46331204072013044, 'batch_norm': True, 'lr': 0.00031836913199459504, 'weight_decay': 5.047506669423763e-07, 'epochs': 98, 'loss': 'mse', 'optimizer': 'adam', 'graph_mode': 'cutoff', 'cutoff': 0.41885087293307355, 'grm_norm': 'cosine', 'self_loops': True, 'use_snp_selection': False}. Best is trial 10 with value: 0.041181875302267676.
[I 2025-11-03 12:57:51,623] Trial 15 finished with value: -0.012584170455708475 and parameters: {'model_type': 'graphsage', 'hidden_dims': '[512, 128]', 'dropout': 0.5556886357208262, 'batch_norm': True, 'lr': 1.2566698097454751e-05, 'weight_decay': 3.770527062665264e-06, 'epochs': 237, 'loss': 'mse', 'optimizer': 'adam', 'graph_mode': 'cutoff', 'cutoff': 0.24559053421123542, 'grm_norm': 'cosine', 'self_loops': True, 'use_snp_selection': False}. Best is trial 10 with value: 0.041181875302267676.
[I 2025-11-03 12:57:56,724] Trial 16 finished with value: 0.02974519255089901 and parameters: {'model_type': 'graphsage', 'hidden_dims': '[512, 128]', 'dropout': 0.2726150356380067, 'batch_norm': True, 'lr': 0.0002564590487494194, 'weight_decay': 3.056734616307358e-07, 'epochs': 302, 'loss': 'mse', 'optimizer': 'adam', 'graph_mode': 'cutoff', 'cutoff': 0.5306559631517289, 'grm_norm': 'none', 'self_loops': True, 'use_snp_selection': False}. Best is trial 10 with value: 0.041181875302267676.
[I 2025-11-03 12:57:58,991] Trial 17 finished with value: 0.026587378942126618 and parameters: {'model_type': 'graphsage', 'hidden_dims': '[256, 128, 64]', 'dropout': 0.4337768631587977, 'batch_norm': True, 'lr': 6.064683608957368e-05, 'weight_decay': 0.000370619721626372, 'epochs': 115, 'loss': 'mse', 'optimizer': 'adam', 'graph_mode': 'cutoff', 'cutoff': 0.34267444791405843, 'grm_norm': 'cosine_then_gcn', 'self_loops': True, 'use_snp_selection': False}. Best is trial 10 with value: 0.041181875302267676.
[I 2025-11-03 12:58:03,220] Trial 18 finished with value: -0.012433483384888807 and parameters: {'model_type': 'graphsage', 'hidden_dims': '[512, 64]', 'dropout': 0.517960646566452, 'batch_norm': True, 'lr': 3.2431520417433524e-06, 'weight_decay': 4.050507030272314e-06, 'epochs': 220, 'loss': 'mse', 'optimizer': 'adam', 'graph_mode': 'cutoff', 'cutoff': 0.8809443877091867, 'grm_norm': 'cosine', 'self_loops': True, 'use_snp_selection': False}. Best is trial 10 with value: 0.041181875302267676.
[I 2025-11-03 12:58:07,293] Trial 19 finished with value: 0.03981214074123091 and parameters: {'model_type': 'graphsage', 'hidden_dims': '[512, 128]', 'dropout': 0.560479900034549, 'batch_norm': True, 'lr': 0.00010470823344866871, 'weight_decay': 2.4644390399106306e-07, 'epochs': 149, 'loss': 'mse', 'optimizer': 'adam', 'graph_mode': 'cutoff', 'cutoff': 0.2104909088252689, 'grm_norm': 'cosine', 'self_loops': True, 'use_snp_selection': False}. Best is trial 10 with value: 0.041181875302267676.
[I 2025-11-03 12:58:12,462] Trial 20 finished with value: 0.03042865691669277 and parameters: {'model_type': 'graphsage', 'hidden_dims': '[512, 128]', 'dropout': 0.3589734382138713, 'batch_norm': True, 'lr': 0.00040094003381886163, 'weight_decay': 4.303705038788151e-06, 'epochs': 294, 'loss': 'mse', 'optimizer': 'adam', 'graph_mode': 'cutoff', 'cutoff': 0.4775623436621876, 'grm_norm': 'cosine', 'self_loops': True, 'use_snp_selection': False}. Best is trial 10 with value: 0.041181875302267676.
[I 2025-11-03 12:58:16,470] Trial 21 finished with value: 0.02410877037676084 and parameters: {'model_type': 'graphsage', 'hidden_dims': '[512, 128]', 'dropout': 0.5611051494749881, 'batch_norm': True, 'lr': 0.00012149302224684786, 'weight_decay': 1.5468636186749147e-07, 'epochs': 145, 'loss': 'mse', 'optimizer': 'adam', 'graph_mode': 'cutoff', 'cutoff': 0.21060784125582288, 'grm_norm': 'cosine', 'self_loops': True, 'use_snp_selection': False}. Best is trial 10 with value: 0.041181875302267676.
[I 2025-11-03 12:58:19,574] Trial 22 finished with value: 0.030135809777476246 and parameters: {'model_type': 'graphsage', 'hidden_dims': '[512, 128]', 'dropout': 0.4707975462462328, 'batch_norm': True, 'lr': 0.0001773355929056985, 'weight_decay': 3.2764883262850427e-07, 'epochs': 95, 'loss': 'mse', 'optimizer': 'adam', 'graph_mode': 'cutoff', 'cutoff': 0.32440120204890044, 'grm_norm': 'cosine', 'self_loops': True, 'use_snp_selection': False}. Best is trial 10 with value: 0.041181875302267676.
[I 2025-11-03 12:58:23,654] Trial 23 finished with value: 0.029497376564991303 and parameters: {'model_type': 'graphsage', 'hidden_dims': '[512, 128]', 'dropout': 0.5903455919355906, 'batch_norm': True, 'lr': 2.2289621616980545e-05, 'weight_decay': 9.229792661718245e-07, 'epochs': 181, 'loss': 'mse', 'optimizer': 'adam', 'graph_mode': 'cutoff', 'cutoff': 0.3120320605635817, 'grm_norm': 'cosine', 'self_loops': True, 'use_snp_selection': False}. Best is trial 10 with value: 0.041181875302267676.
[I 2025-11-03 12:58:27,412] Trial 24 finished with value: 0.015779102049667225 and parameters: {'model_type': 'graphsage', 'hidden_dims': '[512, 128]', 'dropout': 0.5194748294827642, 'batch_norm': True, 'lr': 7.291439404418622e-05, 'weight_decay': 2.4595778185078066e-07, 'epochs': 128, 'loss': 'mse', 'optimizer': 'adam', 'graph_mode': 'cutoff', 'cutoff': 0.2195370164258142, 'grm_norm': 'none', 'self_loops': True, 'use_snp_selection': False}. Best is trial 10 with value: 0.041181875302267676.
[I 2025-11-03 12:58:31,738] Trial 25 finished with value: 0.02772255045688501 and parameters: {'model_type': 'graphsage', 'hidden_dims': '[512, 128]', 'dropout': 0.5431951012244061, 'batch_norm': True, 'lr': 0.00020278106489926738, 'weight_decay': 7.533061816636384e-07, 'epochs': 208, 'loss': 'mse', 'optimizer': 'adam', 'graph_mode': 'cutoff', 'cutoff': 0.3582384018923035, 'grm_norm': 'cosine_then_gcn', 'self_loops': True, 'use_snp_selection': False}. Best is trial 10 with value: 0.041181875302267676.
[I 2025-11-03 12:58:39,114] Trial 26 finished with value: 0.005702223385878849 and parameters: {'model_type': 'graphsage', 'hidden_dims': '[512, 64]', 'dropout': 0.4879947978178224, 'batch_norm': False, 'lr': 0.000101756821886843, 'weight_decay': 2.4087227472880682e-06, 'epochs': 249, 'loss': 'mae', 'optimizer': 'adam', 'graph_mode': 'knn', 'source': 'grm', 'knn_k': 10, 'weighted_edges': False, 'symmetrize_mode': 'union', 'use_snp_selection': True, 'num_snps': 59005}. Best is trial 10 with value: 0.041181875302267676.
[I 2025-11-03 12:58:41,157] Trial 27 finished with value: 0.02015871262656589 and parameters: {'model_type': 'graphsage', 'hidden_dims': '[256, 128]', 'dropout': 0.39718437991802474, 'batch_norm': True, 'lr': 0.00044274871956956455, 'weight_decay': 1.0399382503955779e-07, 'epochs': 73, 'loss': 'mse', 'optimizer': 'adam', 'graph_mode': 'cutoff', 'cutoff': 0.26818647864690104, 'grm_norm': 'gcn', 'self_loops': True, 'use_snp_selection': False}. Best is trial 10 with value: 0.041181875302267676.
[I 2025-11-03 12:58:44,122] Trial 28 finished with value: 0.004193244428470604 and parameters: {'model_type': 'graphsage', 'hidden_dims': '[256, 128, 64]', 'dropout': 0.44199901913530043, 'batch_norm': True, 'lr': 5.1169544187166864e-05, 'weight_decay': 5.200271216550413e-07, 'epochs': 168, 'loss': 'mse', 'optimizer': 'adam', 'graph_mode': 'cutoff', 'cutoff': 0.20351799713310584, 'grm_norm': 'cosine', 'self_loops': False, 'use_snp_selection': False}. Best is trial 10 with value: 0.041181875302267676.
[I 2025-11-03 12:58:46,102] Trial 29 finished with value: 0.02576100704265656 and parameters: {'model_type': 'graphsage', 'hidden_dims': '[128, 64]', 'dropout': 0.22487044772394038, 'batch_norm': True, 'lr': 1.501610026096526e-05, 'weight_decay': 8.368908757919724e-05, 'epochs': 138, 'loss': 'mae', 'optimizer': 'adam', 'graph_mode': 'knn', 'source': 'grm', 'knn_k': 5, 'weighted_edges': False, 'symmetrize_mode': 'union', 'use_snp_selection': False}. Best is trial 10 with value: 0.041181875302267676.
[I 2025-11-03 12:58:51,660] Trial 30 finished with value: 0.03236097933997833 and parameters: {'model_type': 'graphsage', 'hidden_dims': '[512, 128]', 'dropout': 0.5720193895428857, 'batch_norm': True, 'lr': 1.296380227364303e-06, 'weight_decay': 0.00013207810398242485, 'epochs': 332, 'loss': 'mse', 'optimizer': 'adam', 'graph_mode': 'cutoff', 'cutoff': 0.4536423107431603, 'grm_norm': 'cosine', 'self_loops': True, 'use_snp_selection': False}. Best is trial 10 with value: 0.041181875302267676.
[I 2025-11-03 12:58:56,562] Trial 31 finished with value: 0.011375337782592032 and parameters: {'model_type': 'graphsage', 'hidden_dims': '[512, 128]', 'dropout': 0.49918424070810424, 'batch_norm': True, 'lr': 9.608224397769238e-05, 'weight_decay': 1.0333443791484643e-07, 'epochs': 263, 'loss': 'mse', 'optimizer': 'adam', 'graph_mode': 'cutoff', 'cutoff': 0.38686379473717647, 'grm_norm': 'cosine', 'self_loops': True, 'use_snp_selection': False}. Best is trial 10 with value: 0.041181875302267676.
[I 2025-11-03 12:59:01,931] Trial 32 finished with value: 0.03683826592870945 and parameters: {'model_type': 'graphsage', 'hidden_dims': '[512, 128]', 'dropout': 0.5365976387608841, 'batch_norm': True, 'lr': 7.150657991626589e-05, 'weight_decay': 1.900843110027169e-07, 'epochs': 297, 'loss': 'mse', 'optimizer': 'adam', 'graph_mode': 'cutoff', 'cutoff': 0.3062468595869957, 'grm_norm': 'cosine', 'self_loops': True, 'use_snp_selection': False}. Best is trial 10 with value: 0.041181875302267676.
[I 2025-11-03 12:59:06,791] Trial 33 finished with value: 0.02613761364246618 and parameters: {'model_type': 'graphsage', 'hidden_dims': '[512, 128]', 'dropout': 0.47582420443605866, 'batch_norm': True, 'lr': 0.0005973638363573698, 'weight_decay': 3.3441703677843005e-07, 'epochs': 272, 'loss': 'mse', 'optimizer': 'adam', 'graph_mode': 'cutoff', 'cutoff': 0.49504618232601644, 'grm_norm': 'cosine', 'self_loops': True, 'use_snp_selection': False}. Best is trial 10 with value: 0.041181875302267676.
[I 2025-11-03 12:59:09,692] Trial 34 finished with value: 0.002462978732954194 and parameters: {'model_type': 'graphsage', 'hidden_dims': '[128, 64]', 'dropout': 0.3995653422682014, 'batch_norm': True, 'lr': 0.0001693284227771559, 'weight_decay': 1.066992972153602e-07, 'epochs': 347, 'loss': 'mse', 'optimizer': 'adam', 'graph_mode': 'knn', 'source': 'grm', 'knn_k': 4, 'weighted_edges': True, 'symmetrize_mode': 'union', 'use_snp_selection': False}. Best is trial 10 with value: 0.041181875302267676.
[I 2025-11-03 12:59:11,522] Trial 35 finished with value: -0.018804109133868405 and parameters: {'model_type': 'graphsage', 'hidden_dims': '[512, 128]', 'dropout': 0.511032845767093, 'batch_norm': False, 'lr': 3.355712030103278e-05, 'weight_decay': 1.5154361716276852e-06, 'epochs': 208, 'loss': 'mse', 'optimizer': 'adam', 'graph_mode': 'cutoff', 'cutoff': 0.3659630050152689, 'grm_norm': 'cosine', 'self_loops': True, 'use_snp_selection': True, 'num_snps': 2074}. Best is trial 10 with value: 0.041181875302267676.
[I 2025-11-03 12:59:14,231] Trial 36 finished with value: 0.018829491556792456 and parameters: {'model_type': 'graphsage', 'hidden_dims': '[256, 128]', 'dropout': 0.5667295498170541, 'batch_norm': True, 'lr': 0.00033725925456157377, 'weight_decay': 7.196974678904329e-06, 'epochs': 170, 'loss': 'mse', 'optimizer': 'adam', 'graph_mode': 'cutoff', 'cutoff': 0.28410667776810133, 'grm_norm': 'cosine', 'self_loops': True, 'use_snp_selection': False}. Best is trial 10 with value: 0.041181875302267676.
