[I 2025-11-03 13:29:50,587] Trial 105 finished with value: 0.06329825713075515 and parameters: {'model_type': 'graphsage', 'hidden_dims': '[512, 256]', 'dropout': 0.2088373024515249, 'batch_norm': True, 'lr': 0.00044266164753314826, 'weight_decay': 7.509011665187408e-06, 'epochs': 203, 'loss': 'mse', 'optimizer': 'adam', 'graph_mode': 'knn', 'source': 'grm', 'knn_k': 1, 'weighted_edges': True, 'symmetrize_mode': 'union', 'use_snp_selection': False}. Best is trial 46 with value: 0.07994171952257709.
[I 2025-11-03 13:29:54,237] Trial 106 finished with value: 0.06478841988708421 and parameters: {'model_type': 'graphsage', 'hidden_dims': '[512, 128]', 'dropout': 0.14465868137319196, 'batch_norm': True, 'lr': 0.00022229896459666706, 'weight_decay': 3.006396931089098e-07, 'epochs': 165, 'loss': 'mse', 'optimizer': 'adam', 'graph_mode': 'knn', 'source': 'grm', 'knn_k': 5, 'weighted_edges': False, 'symmetrize_mode': 'union', 'use_snp_selection': False}. Best is trial 46 with value: 0.07994171952257709.
[I 2025-11-03 13:29:57,361] Trial 107 finished with value: 0.02310259658236071 and parameters: {'model_type': 'graphsage', 'hidden_dims': '[256, 128]', 'dropout': 0.1698835388493827, 'batch_norm': False, 'lr': 0.0005303083705748441, 'weight_decay': 1.18404757307561e-06, 'epochs': 193, 'loss': 'mae', 'optimizer': 'adam', 'graph_mode': 'knn', 'source': 'grm', 'knn_k': 4, 'weighted_edges': True, 'symmetrize_mode': 'union', 'use_snp_selection': True, 'num_snps': 37397}. Best is trial 46 with value: 0.07994171952257709.
[I 2025-11-03 13:29:59,983] Trial 108 finished with value: 0.05832689567489808 and parameters: {'model_type': 'graphsage', 'hidden_dims': '[256, 128, 64]', 'dropout': 0.3834168760025225, 'batch_norm': True, 'lr': 0.0008837590841787118, 'weight_decay': 3.952010037706762e-06, 'epochs': 213, 'loss': 'mse', 'optimizer': 'adam', 'graph_mode': 'knn', 'source': 'grm', 'knn_k': 3, 'weighted_edges': True, 'symmetrize_mode': 'mutual', 'use_snp_selection': False}. Best is trial 46 with value: 0.07994171952257709.
[I 2025-11-03 13:30:02,147] Trial 109 finished with value: 0.062499110755007026 and parameters: {'model_type': 'graphsage', 'hidden_dims': '[128, 64]', 'dropout': 0.5218926338565493, 'batch_norm': True, 'lr': 0.0006226102084699379, 'weight_decay': 2.2282340482432632e-07, 'epochs': 245, 'loss': 'mae', 'optimizer': 'adam', 'graph_mode': 'knn', 'source': 'grm', 'knn_k': 2, 'weighted_edges': True, 'symmetrize_mode': 'union', 'use_snp_selection': False}. Best is trial 46 with value: 0.07994171952257709.
[I 2025-11-03 13:30:06,629] Trial 110 finished with value: 0.044125122474208904 and parameters: {'model_type': 'graphsage', 'hidden_dims': '[512, 256]', 'dropout': 0.3643228030870042, 'batch_norm': True, 'lr': 0.00038121037147441405, 'weight_decay': 5.838538236753449e-06, 'epochs': 283, 'loss': 'mse', 'optimizer': 'adam', 'graph_mode': 'cutoff', 'cutoff': 0.588241284427438, 'grm_norm': 'none', 'self_loops': False, 'use_snp_selection': False}. Best is trial 46 with value: 0.07994171952257709.
[I 2025-11-03 13:30:11,497] Trial 111 finished with value: 0.07246982115808814 and parameters: {'model_type': 'graphsage', 'hidden_dims': '[512, 256]', 'dropout': 0.403676756535752, 'batch_norm': True, 'lr': 0.000752983640185349, 'weight_decay': 2.0767336480436028e-06, 'epochs': 332, 'loss': 'mae', 'optimizer': 'adam', 'graph_mode': 'knn', 'source': 'grm', 'knn_k': 1, 'weighted_edges': True, 'symmetrize_mode': 'union', 'use_snp_selection': False}. Best is trial 46 with value: 0.07994171952257709.
[I 2025-11-03 13:30:16,316] Trial 112 finished with value: 0.06456865293807366 and parameters: {'model_type': 'graphsage', 'hidden_dims': '[512, 256]', 'dropout': 0.4477014016540225, 'batch_norm': True, 'lr': 0.0006693686730266413, 'weight_decay': 1.2149163601353091e-06, 'epochs': 324, 'loss': 'mae', 'optimizer': 'adam', 'graph_mode': 'knn', 'source': 'grm', 'knn_k': 1, 'weighted_edges': True, 'symmetrize_mode': 'union', 'use_snp_selection': False}. Best is trial 46 with value: 0.07994171952257709.
[I 2025-11-03 13:30:21,308] Trial 113 finished with value: 0.07062157969145394 and parameters: {'model_type': 'graphsage', 'hidden_dims': '[512, 256]', 'dropout': 0.4362630399847857, 'batch_norm': True, 'lr': 0.000993509047649567, 'weight_decay': 8.268258155960849e-07, 'epochs': 346, 'loss': 'mae', 'optimizer': 'adam', 'graph_mode': 'knn', 'source': 'grm', 'knn_k': 1, 'weighted_edges': True, 'symmetrize_mode': 'union', 'use_snp_selection': False}. Best is trial 46 with value: 0.07994171952257709.
[I 2025-11-03 13:30:25,967] Trial 114 finished with value: 0.07524432620315713 and parameters: {'model_type': 'graphsage', 'hidden_dims': '[512, 64]', 'dropout': 0.5042450294601559, 'batch_norm': True, 'lr': 0.0004905161807886024, 'weight_decay': 9.57463144387478e-07, 'epochs': 299, 'loss': 'mae', 'optimizer': 'adam', 'graph_mode': 'knn', 'source': 'grm', 'knn_k': 2, 'weighted_edges': True, 'symmetrize_mode': 'union', 'use_snp_selection': False}. Best is trial 46 with value: 0.07994171952257709.
[I 2025-11-03 13:30:30,734] Trial 115 finished with value: 0.06824322447220012 and parameters: {'model_type': 'graphsage', 'hidden_dims': '[512, 64]', 'dropout': 0.29917872521899236, 'batch_norm': True, 'lr': 0.00048101778335255977, 'weight_decay': 5.84453928112235e-07, 'epochs': 312, 'loss': 'mae', 'optimizer': 'adam', 'graph_mode': 'knn', 'source': 'grm', 'knn_k': 2, 'weighted_edges': True, 'symmetrize_mode': 'union', 'use_snp_selection': False}. Best is trial 46 with value: 0.07994171952257709.
[I 2025-11-03 13:30:35,170] Trial 116 finished with value: 0.06554803938395753 and parameters: {'model_type': 'graphsage', 'hidden_dims': '[512, 64]', 'dropout': 0.5049205377153175, 'batch_norm': True, 'lr': 0.0005738285653198958, 'weight_decay': 1.5647025922271534e-06, 'epochs': 263, 'loss': 'mae', 'optimizer': 'adam', 'graph_mode': 'knn', 'source': 'grm', 'knn_k': 3, 'weighted_edges': True, 'symmetrize_mode': 'union', 'use_snp_selection': False}. Best is trial 46 with value: 0.07994171952257709.
[I 2025-11-03 13:30:39,857] Trial 117 finished with value: 0.06928564411993376 and parameters: {'model_type': 'graphsage', 'hidden_dims': '[512, 64]', 'dropout': 0.326168192418498, 'batch_norm': True, 'lr': 0.0003298405183890803, 'weight_decay': 9.770941671738061e-06, 'epochs': 301, 'loss': 'mae', 'optimizer': 'adam', 'graph_mode': 'knn', 'source': 'grm', 'knn_k': 2, 'weighted_edges': True, 'symmetrize_mode': 'union', 'use_snp_selection': False}. Best is trial 46 with value: 0.07994171952257709.
[I 2025-11-03 13:30:43,999] Trial 118 finished with value: -0.0065676307719198385 and parameters: {'model_type': 'graphsage', 'hidden_dims': '[512, 64]', 'dropout': 0.4974750735601653, 'batch_norm': True, 'lr': 1.0734192924881945e-06, 'weight_decay': 4.6611698732632754e-06, 'epochs': 231, 'loss': 'mse', 'optimizer': 'adam', 'graph_mode': 'knn', 'source': 'grm', 'knn_k': 3, 'weighted_edges': True, 'symmetrize_mode': 'union', 'use_snp_selection': False}. Best is trial 46 with value: 0.07994171952257709.
[I 2025-11-03 13:30:46,839] Trial 119 finished with value: 0.04858908957018834 and parameters: {'model_type': 'graphsage', 'hidden_dims': '[256, 128]', 'dropout': 0.45979802912679985, 'batch_norm': True, 'lr': 0.0002585954193873879, 'weight_decay': 2.8383383942997427e-06, 'epochs': 276, 'loss': 'mae', 'optimizer': 'adam', 'graph_mode': 'knn', 'source': 'grm', 'knn_k': 2, 'weighted_edges': True, 'symmetrize_mode': 'union', 'use_snp_selection': False}. Best is trial 46 with value: 0.07994171952257709.
[I 2025-11-03 13:30:51,499] Trial 120 finished with value: 0.06424294307435868 and parameters: {'model_type': 'graphsage', 'hidden_dims': '[512, 64]', 'dropout': 0.5135155977191267, 'batch_norm': True, 'lr': 0.0007775042269118541, 'weight_decay': 1.0460324410948428e-06, 'epochs': 294, 'loss': 'mse', 'optimizer': 'adam', 'graph_mode': 'knn', 'source': 'grm', 'knn_k': 3, 'weighted_edges': True, 'symmetrize_mode': 'union', 'use_snp_selection': False}. Best is trial 46 with value: 0.07994171952257709.
[I 2025-11-03 13:30:56,272] Trial 121 finished with value: 0.07803742442294247 and parameters: {'model_type': 'graphsage', 'hidden_dims': '[512, 256]', 'dropout': 0.41957435148853167, 'batch_norm': True, 'lr': 0.000674213926601204, 'weight_decay': 7.292714187228214e-07, 'epochs': 320, 'loss': 'mae', 'optimizer': 'adam', 'graph_mode': 'knn', 'source': 'grm', 'knn_k': 1, 'weighted_edges': True, 'symmetrize_mode': 'union', 'use_snp_selection': False}. Best is trial 46 with value: 0.07994171952257709.
[I 2025-11-03 13:31:00,888] Trial 122 finished with value: 0.08378642422721401 and parameters: {'model_type': 'graphsage', 'hidden_dims': '[512, 256]', 'dropout': 0.4233504933229409, 'batch_norm': True, 'lr': 0.0008711644490411144, 'weight_decay': 7.245607907897911e-07, 'epochs': 306, 'loss': 'mae', 'optimizer': 'adam', 'graph_mode': 'knn', 'source': 'grm', 'knn_k': 1, 'weighted_edges': True, 'symmetrize_mode': 'union', 'use_snp_selection': False}. Best is trial 122 with value: 0.08378642422721401.
[I 2025-11-03 13:31:05,474] Trial 123 finished with value: 0.08018206110885845 and parameters: {'model_type': 'graphsage', 'hidden_dims': '[512, 256]', 'dropout': 0.42346663069498747, 'batch_norm': True, 'lr': 0.0008687200742343293, 'weight_decay': 7.100718928664679e-07, 'epochs': 302, 'loss': 'mae', 'optimizer': 'adam', 'graph_mode': 'knn', 'source': 'grm', 'knn_k': 1, 'weighted_edges': True, 'symmetrize_mode': 'union', 'use_snp_selection': False}. Best is trial 122 with value: 0.08378642422721401.
[I 2025-11-03 13:31:10,094] Trial 124 finished with value: 0.06791873926756005 and parameters: {'model_type': 'graphsage', 'hidden_dims': '[512, 256]', 'dropout': 0.40672589800622255, 'batch_norm': True, 'lr': 0.0009101924083574396, 'weight_decay': 7.49198698036135e-07, 'epochs': 306, 'loss': 'mae', 'optimizer': 'adam', 'graph_mode': 'knn', 'source': 'grm', 'knn_k': 1, 'weighted_edges': True, 'symmetrize_mode': 'union', 'use_snp_selection': False}. Best is trial 122 with value: 0.08378642422721401.
[I 2025-11-03 13:31:14,797] Trial 125 finished with value: 0.07561045284632127 and parameters: {'model_type': 'graphsage', 'hidden_dims': '[512, 256]', 'dropout': 0.423992561475817, 'batch_norm': True, 'lr': 0.0008033024292349593, 'weight_decay': 4.677361384563087e-07, 'epochs': 316, 'loss': 'mae', 'optimizer': 'adam', 'graph_mode': 'knn', 'source': 'grm', 'knn_k': 1, 'weighted_edges': True, 'symmetrize_mode': 'union', 'use_snp_selection': False}. Best is trial 122 with value: 0.08378642422721401.
[I 2025-11-03 13:31:19,492] Trial 126 finished with value: 0.07159316663475782 and parameters: {'model_type': 'graphsage', 'hidden_dims': '[512, 256]', 'dropout': 0.4205773336688574, 'batch_norm': True, 'lr': 0.0007942446346152744, 'weight_decay': 3.9033145185659695e-07, 'epochs': 315, 'loss': 'mae', 'optimizer': 'adam', 'graph_mode': 'knn', 'source': 'grm', 'knn_k': 1, 'weighted_edges': True, 'symmetrize_mode': 'union', 'use_snp_selection': False}. Best is trial 122 with value: 0.08378642422721401.
[I 2025-11-03 13:31:24,083] Trial 127 finished with value: 0.0661023924752359 and parameters: {'model_type': 'graphsage', 'hidden_dims': '[512, 256]', 'dropout': 0.3966651376966708, 'batch_norm': True, 'lr': 0.0006349411493234018, 'weight_decay': 5.961925493322176e-07, 'epochs': 298, 'loss': 'mae', 'optimizer': 'adam', 'graph_mode': 'knn', 'source': 'grm', 'knn_k': 1, 'weighted_edges': False, 'symmetrize_mode': 'union', 'use_snp_selection': False}. Best is trial 122 with value: 0.08378642422721401.
[I 2025-11-03 13:31:27,268] Trial 128 finished with value: 0.03614610729572384 and parameters: {'model_type': 'graphsage', 'hidden_dims': '[512, 256]', 'dropout': 0.38196011784445194, 'batch_norm': False, 'lr': 0.0008679237767551123, 'weight_decay': 4.038039012764485e-07, 'epochs': 320, 'loss': 'mae', 'optimizer': 'adam', 'graph_mode': 'knn', 'source': 'grm', 'knn_k': 1, 'weighted_edges': True, 'symmetrize_mode': 'union', 'use_snp_selection': True, 'num_snps': 23993}. Best is trial 122 with value: 0.08378642422721401.
[I 2025-11-03 13:31:31,901] Trial 129 finished with value: 0.04664645451686154 and parameters: {'model_type': 'graphsage', 'hidden_dims': '[512, 256]', 'dropout': 0.4251031166994257, 'batch_norm': True, 'lr': 0.0007009797321445537, 'weight_decay': 5.060423006209811e-07, 'epochs': 309, 'loss': 'mae', 'optimizer': 'adam', 'graph_mode': 'knn', 'source': 'grm', 'knn_k': 1, 'weighted_edges': True, 'symmetrize_mode': 'mutual', 'use_snp_selection': False}. Best is trial 122 with value: 0.08378642422721401.
[I 2025-11-03 13:31:36,847] Trial 130 finished with value: 0.08283145362266214 and parameters: {'model_type': 'graphsage', 'hidden_dims': '[512, 256]', 'dropout': 0.3920380935849035, 'batch_norm': True, 'lr': 6.737895592582034e-05, 'weight_decay': 8.981481096732136e-07, 'epochs': 338, 'loss': 'mae', 'optimizer': 'adam', 'graph_mode': 'knn', 'source': 'grm', 'knn_k': 1, 'weighted_edges': True, 'symmetrize_mode': 'union', 'use_snp_selection': False}. Best is trial 122 with value: 0.08378642422721401.
[I 2025-11-03 13:31:41,764] Trial 131 finished with value: 0.06945510562248293 and parameters: {'model_type': 'graphsage', 'hidden_dims': '[512, 256]', 'dropout': 0.39129129281600294, 'batch_norm': True, 'lr': 0.0007786302386692727, 'weight_decay': 9.187497296497004e-07, 'epochs': 337, 'loss': 'mae', 'optimizer': 'adam', 'graph_mode': 'knn', 'source': 'grm', 'knn_k': 1, 'weighted_edges': True, 'symmetrize_mode': 'union', 'use_snp_selection': False}. Best is trial 122 with value: 0.08378642422721401.
[I 2025-11-03 13:31:46,565] Trial 132 finished with value: 0.06789269525708327 and parameters: {'model_type': 'graphsage', 'hidden_dims': '[512, 256]', 'dropout': 0.40946222964065737, 'batch_norm': True, 'lr': 4.890742647144973e-05, 'weight_decay': 7.003433590250041e-07, 'epochs': 328, 'loss': 'mae', 'optimizer': 'adam', 'graph_mode': 'knn', 'source': 'grm', 'knn_k': 1, 'weighted_edges': True, 'symmetrize_mode': 'union', 'use_snp_selection': False}. Best is trial 122 with value: 0.08378642422721401.
[I 2025-11-03 13:31:51,485] Trial 133 finished with value: 0.029446813564866375 and parameters: {'model_type': 'graphsage', 'hidden_dims': '[512, 256]', 'dropout': 0.435329946606454, 'batch_norm': True, 'lr': 1.2803277001628841e-05, 'weight_decay': 8.857946238763551e-07, 'epochs': 342, 'loss': 'mae', 'optimizer': 'adam', 'graph_mode': 'knn', 'source': 'grm', 'knn_k': 1, 'weighted_edges': True, 'symmetrize_mode': 'union', 'use_snp_selection': False}. Best is trial 122 with value: 0.08378642422721401.
[I 2025-11-03 13:31:56,042] Trial 134 finished with value: 0.08084288592354452 and parameters: {'model_type': 'graphsage', 'hidden_dims': '[512, 256]', 'dropout': 0.3717314860964521, 'batch_norm': True, 'lr': 0.000117545744133064, 'weight_decay': 3.362871465811377e-07, 'epochs': 293, 'loss': 'mae', 'optimizer': 'adam', 'graph_mode': 'knn', 'source': 'grm', 'knn_k': 1, 'weighted_edges': True, 'symmetrize_mode': 'union', 'use_snp_selection': False}. Best is trial 122 with value: 0.08378642422721401.
[I 2025-11-03 13:32:00,527] Trial 135 finished with value: 0.04019311337074136 and parameters: {'model_type': 'graphsage', 'hidden_dims': '[512, 256]', 'dropout': 0.37258672870936116, 'batch_norm': True, 'lr': 8.927136695226513e-05, 'weight_decay': 3.182893335931185e-07, 'epochs': 290, 'loss': 'mae', 'optimizer': 'adam', 'graph_mode': 'knn', 'source': 'grm', 'knn_k': 1, 'weighted_edges': True, 'symmetrize_mode': 'union', 'use_snp_selection': False}. Best is trial 122 with value: 0.08378642422721401.
[I 2025-11-03 13:32:05,183] Trial 136 finished with value: 0.04149829949487505 and parameters: {'model_type': 'graphsage', 'hidden_dims': '[512, 256]', 'dropout': 0.3597653832098933, 'batch_norm': True, 'lr': 6.13078772356052e-05, 'weight_decay': 4.97253077521347e-07, 'epochs': 304, 'loss': 'mae', 'optimizer': 'adam', 'graph_mode': 'knn', 'source': 'grm', 'knn_k': 1, 'weighted_edges': True, 'symmetrize_mode': 'union', 'use_snp_selection': False}. Best is trial 122 with value: 0.08378642422721401.
[I 2025-11-03 13:32:12,373] Trial 137 finished with value: 0.0380241977067676 and parameters: {'model_type': 'graphsage', 'hidden_dims': '[512, 256]', 'dropout': 0.3473993802559282, 'batch_norm': True, 'lr': 3.80554976457919e-05, 'weight_decay': 6.440989076699485e-07, 'epochs': 284, 'loss': 'mae', 'optimizer': 'adam', 'graph_mode': 'cutoff', 'cutoff': 0.20317799620059307, 'grm_norm': 'cosine', 'self_loops': True, 'use_snp_selection': False}. Best is trial 122 with value: 0.08378642422721401.
[I 2025-11-03 13:32:17,085] Trial 138 finished with value: 0.07850476619992373 and parameters: {'model_type': 'graphsage', 'hidden_dims': '[512, 256]', 'dropout': 0.4177616637579856, 'batch_norm': True, 'lr': 0.00011532111879255665, 'weight_decay': 4.326670903208901e-07, 'epochs': 316, 'loss': 'mae', 'optimizer': 'adam', 'graph_mode': 'knn', 'source': 'grm', 'knn_k': 1, 'weighted_edges': True, 'symmetrize_mode': 'union', 'use_snp_selection': False}. Best is trial 122 with value: 0.08378642422721401.
[I 2025-11-03 13:32:21,836] Trial 139 finished with value: 0.04329289203771466 and parameters: {'model_type': 'graphsage', 'hidden_dims': '[512, 256]', 'dropout': 0.42084634031223406, 'batch_norm': True, 'lr': 9.294394540741179e-05, 'weight_decay': 3.1948821593594313e-07, 'epochs': 317, 'loss': 'mae', 'optimizer': 'adam', 'graph_mode': 'knn', 'source': 'grm', 'knn_k': 1, 'weighted_edges': True, 'symmetrize_mode': 'union', 'use_snp_selection': False}. Best is trial 122 with value: 0.08378642422721401.
[I 2025-11-03 13:32:26,686] Trial 140 finished with value: 0.07078849716341531 and parameters: {'model_type': 'graphsage', 'hidden_dims': '[512, 256]', 'dropout': 0.4027299937801217, 'batch_norm': True, 'lr': 0.00015006675033585565, 'weight_decay': 4.3062799210941464e-07, 'epochs': 326, 'loss': 'mae', 'optimizer': 'adam', 'graph_mode': 'knn', 'source': 'grm', 'knn_k': 1, 'weighted_edges': True, 'symmetrize_mode': 'union', 'use_snp_selection': False}. Best is trial 122 with value: 0.08378642422721401.
[I 2025-11-03 13:32:31,728] Trial 141 finished with value: 0.07873126328932516 and parameters: {'model_type': 'graphsage', 'hidden_dims': '[512, 256]', 'dropout': 0.37523425209719463, 'batch_norm': True, 'lr': 0.00013098980654394795, 'weight_decay': 5.522953750299464e-07, 'epochs': 349, 'loss': 'mae', 'optimizer': 'adam', 'graph_mode': 'knn', 'source': 'grm', 'knn_k': 1, 'weighted_edges': True, 'symmetrize_mode': 'union', 'use_snp_selection': False}. Best is trial 122 with value: 0.08378642422721401.
[I 2025-11-03 13:32:36,760] Trial 142 finished with value: 0.07175696676121791 and parameters: {'model_type': 'graphsage', 'hidden_dims': '[512, 256]', 'dropout': 0.3777963546356013, 'batch_norm': True, 'lr': 0.0001288585953380126, 'weight_decay': 5.371276700904194e-07, 'epochs': 348, 'loss': 'mae', 'optimizer': 'adam', 'graph_mode': 'knn', 'source': 'grm', 'knn_k': 1, 'weighted_edges': True, 'symmetrize_mode': 'union', 'use_snp_selection': False}. Best is trial 122 with value: 0.08378642422721401.
[I 2025-11-03 13:32:41,686] Trial 143 finished with value: 0.06081498832572877 and parameters: {'model_type': 'graphsage', 'hidden_dims': '[512, 256]', 'dropout': 0.39404177750103814, 'batch_norm': True, 'lr': 0.0001104203205746929, 'weight_decay': 2.247456108738816e-07, 'epochs': 335, 'loss': 'mae', 'optimizer': 'adam', 'graph_mode': 'knn', 'source': 'grm', 'knn_k': 1, 'weighted_edges': True, 'symmetrize_mode': 'union', 'use_snp_selection': False}. Best is trial 122 with value: 0.08378642422721401.
[I 2025-11-03 13:32:46,641] Trial 144 finished with value: 0.08001341316123914 and parameters: {'model_type': 'graphsage', 'hidden_dims': '[512, 256]', 'dropout': 0.41621333322016174, 'batch_norm': True, 'lr': 0.00018666474125544332, 'weight_decay': 3.63212517149036e-07, 'epochs': 341, 'loss': 'mae', 'optimizer': 'adam', 'graph_mode': 'knn', 'source': 'grm', 'knn_k': 1, 'weighted_edges': True, 'symmetrize_mode': 'union', 'use_snp_selection': False}. Best is trial 122 with value: 0.08378642422721401.
[I 2025-11-03 13:32:51,689] Trial 145 finished with value: 0.06902699895455162 and parameters: {'model_type': 'graphsage', 'hidden_dims': '[512, 256]', 'dropout': 0.4095138518177075, 'batch_norm': True, 'lr': 0.00017310080271202503, 'weight_decay': 2.6717348363783154e-07, 'epochs': 350, 'loss': 'mae', 'optimizer': 'adam', 'graph_mode': 'knn', 'source': 'grm', 'knn_k': 1, 'weighted_edges': True, 'symmetrize_mode': 'union', 'use_snp_selection': False}. Best is trial 122 with value: 0.08378642422721401.
[I 2025-11-03 13:32:56,593] Trial 146 finished with value: 0.07769737291251326 and parameters: {'model_type': 'graphsage', 'hidden_dims': '[512, 256]', 'dropout': 0.4173644036047104, 'batch_norm': True, 'lr': 0.0001170030389322474, 'weight_decay': 3.994473473131839e-07, 'epochs': 333, 'loss': 'mae', 'optimizer': 'adam', 'graph_mode': 'knn', 'source': 'grm', 'knn_k': 1, 'weighted_edges': True, 'symmetrize_mode': 'union', 'use_snp_selection': False}. Best is trial 122 with value: 0.08378642422721401.
[I 2025-11-03 13:33:01,384] Trial 147 finished with value: 0.07921224792509252 and parameters: {'model_type': 'graphsage', 'hidden_dims': '[512, 256]', 'dropout': 0.35712130865310976, 'batch_norm': True, 'lr': 7.204590369641984e-05, 'weight_decay': 3.262314621052935e-07, 'epochs': 322, 'loss': 'mae', 'optimizer': 'adam', 'graph_mode': 'knn', 'source': 'grm', 'knn_k': 1, 'weighted_edges': True, 'symmetrize_mode': 'union', 'use_snp_selection': False}. Best is trial 122 with value: 0.08378642422721401.
