[I 2025-11-03 13:51:40,621] Trial 82 finished with value: 0.09243341211282861 and parameters: {'model_type': 'gcn', 'hidden_dims': '[512, 64]', 'dropout': 0.20556252850813186, 'batch_norm': True, 'lr': 0.0006361900668047798, 'weight_decay': 1.0144660953136883e-07, 'epochs': 349, 'loss': 'mse', 'optimizer': 'adam', 'graph_mode': 'off', 'use_snp_selection': False}. Best is trial 22 with value: 0.11094395980680749.
[I 2025-11-03 13:51:43,009] Trial 83 finished with value: 0.08885086525236645 and parameters: {'model_type': 'gcn', 'hidden_dims': '[512, 64]', 'dropout': 0.33144933706195495, 'batch_norm': True, 'lr': 0.00041124098712052963, 'weight_decay': 2.927825818940727e-07, 'epochs': 327, 'loss': 'mse', 'optimizer': 'adam', 'graph_mode': 'off', 'use_snp_selection': False}. Best is trial 22 with value: 0.11094395980680749.
[I 2025-11-03 13:51:45,469] Trial 84 finished with value: 0.1041257000033831 and parameters: {'model_type': 'gcn', 'hidden_dims': '[512, 64]', 'dropout': 0.43529587836984446, 'batch_norm': True, 'lr': 0.0008189303770625372, 'weight_decay': 4.269213832790458e-07, 'epochs': 333, 'loss': 'mse', 'optimizer': 'adam', 'graph_mode': 'off', 'use_snp_selection': False}. Best is trial 22 with value: 0.11094395980680749.
[I 2025-11-03 13:51:47,884] Trial 85 finished with value: 0.07882798663866836 and parameters: {'model_type': 'gcn', 'hidden_dims': '[512, 64]', 'dropout': 0.3777026233804489, 'batch_norm': True, 'lr': 0.00019574106068483076, 'weight_decay': 6.01574480568772e-07, 'epochs': 340, 'loss': 'mse', 'optimizer': 'adam', 'graph_mode': 'off', 'use_snp_selection': False}. Best is trial 22 with value: 0.11094395980680749.
[I 2025-11-03 13:51:49,195] Trial 86 finished with value: 0.10401546195561512 and parameters: {'model_type': 'gcn', 'hidden_dims': '[128, 64]', 'dropout': 0.2362052194985992, 'batch_norm': True, 'lr': 0.0005040666222071932, 'weight_decay': 2.3463033205912302e-07, 'epochs': 305, 'loss': 'mse', 'optimizer': 'adam', 'graph_mode': 'off', 'use_snp_selection': False}. Best is trial 22 with value: 0.11094395980680749.
[I 2025-11-03 13:51:51,657] Trial 87 finished with value: 0.10115296714000874 and parameters: {'model_type': 'gcn', 'hidden_dims': '[512, 64]', 'dropout': 0.26977361253799054, 'batch_norm': True, 'lr': 0.00012618820287302053, 'weight_decay': 7.85574311638184e-06, 'epochs': 270, 'loss': 'mse', 'optimizer': 'adam', 'graph_mode': 'off', 'use_snp_selection': True, 'num_snps': 43141}. Best is trial 22 with value: 0.11094395980680749.
[I 2025-11-03 13:51:53,096] Trial 88 finished with value: 0.10335702103103313 and parameters: {'model_type': 'gcn', 'hidden_dims': '[256, 128]', 'dropout': 0.35012416728358714, 'batch_norm': True, 'lr': 0.0003070390357289745, 'weight_decay': 1.395400188625809e-07, 'epochs': 251, 'loss': 'mse', 'optimizer': 'adam', 'graph_mode': 'off', 'use_snp_selection': False}. Best is trial 22 with value: 0.11094395980680749.
[I 2025-11-03 13:51:55,592] Trial 89 finished with value: 0.10078622537186105 and parameters: {'model_type': 'gcn', 'hidden_dims': '[512, 64]', 'dropout': 0.4748494066078954, 'batch_norm': True, 'lr': 0.0006789064351886693, 'weight_decay': 3.517672235164477e-07, 'epochs': 350, 'loss': 'mae', 'optimizer': 'adam', 'graph_mode': 'off', 'use_snp_selection': False}. Best is trial 22 with value: 0.11094395980680749.
[I 2025-11-03 13:51:57,967] Trial 90 finished with value: 0.08339450468720723 and parameters: {'model_type': 'gcn', 'hidden_dims': '[512, 64]', 'dropout': 0.4518256979962294, 'batch_norm': True, 'lr': 0.00023903915440746912, 'weight_decay': 1.725655510918304e-06, 'epochs': 326, 'loss': 'mse', 'optimizer': 'adam', 'graph_mode': 'off', 'use_snp_selection': False}. Best is trial 22 with value: 0.11094395980680749.
[I 2025-11-03 13:52:00,071] Trial 91 finished with value: 0.09910187841104227 and parameters: {'model_type': 'gcn', 'hidden_dims': '[512, 256]', 'dropout': 0.3548019875223942, 'batch_norm': True, 'lr': 0.0004071041665483104, 'weight_decay': 1.3510960602411126e-06, 'epochs': 268, 'loss': 'mse', 'optimizer': 'adam', 'graph_mode': 'off', 'use_snp_selection': False}. Best is trial 22 with value: 0.11094395980680749.
[I 2025-11-03 13:52:01,065] Trial 92 finished with value: 0.09037714658050887 and parameters: {'model_type': 'gcn', 'hidden_dims': '[512, 256]', 'dropout': 0.3252832541169375, 'batch_norm': True, 'lr': 0.0009969714164696436, 'weight_decay': 1.016286860209742e-06, 'epochs': 51, 'loss': 'mse', 'optimizer': 'adam', 'graph_mode': 'off', 'use_snp_selection': False}. Best is trial 22 with value: 0.11094395980680749.
[I 2025-11-03 13:52:03,316] Trial 93 finished with value: 0.09126522208549581 and parameters: {'model_type': 'gcn', 'hidden_dims': '[512, 256]', 'dropout': 0.3682831617446812, 'batch_norm': True, 'lr': 0.0004918534141306172, 'weight_decay': 6.679125973806462e-07, 'epochs': 294, 'loss': 'mse', 'optimizer': 'adam', 'graph_mode': 'off', 'use_snp_selection': False}. Best is trial 22 with value: 0.11094395980680749.
[I 2025-11-03 13:52:05,604] Trial 94 finished with value: 0.03731947779954188 and parameters: {'model_type': 'gcn', 'hidden_dims': '[512, 256]', 'dropout': 0.39064910530778674, 'batch_norm': True, 'lr': 1.213815449664428e-05, 'weight_decay': 4.910305152308592e-07, 'epochs': 312, 'loss': 'mse', 'optimizer': 'adam', 'graph_mode': 'off', 'use_snp_selection': False}. Best is trial 22 with value: 0.11094395980680749.
[I 2025-11-03 13:52:07,724] Trial 95 finished with value: 0.10949867897435982 and parameters: {'model_type': 'gcn', 'hidden_dims': '[256, 128, 64]', 'dropout': 0.3109699247108981, 'batch_norm': True, 'lr': 0.0006480848970181457, 'weight_decay': 3.948943178349214e-06, 'epochs': 280, 'loss': 'mse', 'optimizer': 'adam', 'graph_mode': 'off', 'use_snp_selection': False}. Best is trial 22 with value: 0.11094395980680749.
[I 2025-11-03 13:52:09,504] Trial 96 finished with value: 0.08692160602358033 and parameters: {'model_type': 'gcn', 'hidden_dims': '[256, 128, 64]', 'dropout': 0.28340357991687, 'batch_norm': True, 'lr': 0.000644120956544971, 'weight_decay': 5.513252555755651e-06, 'epochs': 282, 'loss': 'mse', 'optimizer': 'adam', 'graph_mode': 'off', 'use_snp_selection': False}. Best is trial 22 with value: 0.11094395980680749.
[I 2025-11-03 13:52:11,397] Trial 97 finished with value: 0.07768373898986641 and parameters: {'model_type': 'gcn', 'hidden_dims': '[256, 128, 64]', 'dropout': 0.2668978607537229, 'batch_norm': False, 'lr': 0.0008334203546278184, 'weight_decay': 2.2967194280189915e-06, 'epochs': 322, 'loss': 'mse', 'optimizer': 'adam', 'graph_mode': 'off', 'use_snp_selection': False}. Best is trial 22 with value: 0.11094395980680749.
[I 2025-11-03 13:52:13,438] Trial 98 finished with value: 0.09088993614179247 and parameters: {'model_type': 'gcn', 'hidden_dims': '[256, 128, 64]', 'dropout': 0.31076551711982314, 'batch_norm': True, 'lr': 0.0007160467889624319, 'weight_decay': 7.248141113094498e-07, 'epochs': 339, 'loss': 'mse', 'optimizer': 'adam', 'graph_mode': 'off', 'use_snp_selection': False}. Best is trial 22 with value: 0.11094395980680749.
[I 2025-11-03 13:52:15,297] Trial 99 finished with value: 0.09963701758272198 and parameters: {'model_type': 'gcn', 'hidden_dims': '[256, 128, 64]', 'dropout': 0.3438404393049833, 'batch_norm': True, 'lr': 0.000565010281317066, 'weight_decay': 3.845375525481364e-06, 'epochs': 300, 'loss': 'mse', 'optimizer': 'adam', 'graph_mode': 'off', 'use_snp_selection': False}. Best is trial 22 with value: 0.11094395980680749.
[I 2025-11-03 13:52:17,189] Trial 100 finished with value: 0.09311684079772582 and parameters: {'model_type': 'gcn', 'hidden_dims': '[512, 64]', 'dropout': 0.29384173124610125, 'batch_norm': True, 'lr': 0.0003419146186670089, 'weight_decay': 1.3458378756354172e-05, 'epochs': 237, 'loss': 'mse', 'optimizer': 'adam', 'graph_mode': 'off', 'use_snp_selection': False}. Best is trial 22 with value: 0.11094395980680749.
[I 2025-11-03 13:52:19,333] Trial 101 finished with value: 0.09240796262702161 and parameters: {'model_type': 'gcn', 'hidden_dims': '[512, 256]', 'dropout': 0.5987742026777311, 'batch_norm': True, 'lr': 0.0004269648995766298, 'weight_decay': 1.2368270760205513e-06, 'epochs': 258, 'loss': 'mse', 'optimizer': 'adam', 'graph_mode': 'off', 'use_snp_selection': False}. Best is trial 22 with value: 0.11094395980680749.
[I 2025-11-03 13:52:21,460] Trial 102 finished with value: 0.0988647806626754 and parameters: {'model_type': 'gcn', 'hidden_dims': '[512, 64]', 'dropout': 0.42122856046362267, 'batch_norm': True, 'lr': 0.000538452748992905, 'weight_decay': 8.606851775279626e-07, 'epochs': 273, 'loss': 'mse', 'optimizer': 'adam', 'graph_mode': 'off', 'use_snp_selection': False}. Best is trial 22 with value: 0.11094395980680749.
[I 2025-11-03 13:52:22,406] Trial 103 finished with value: 0.07971623908584476 and parameters: {'model_type': 'gcn', 'hidden_dims': '[512, 64]', 'dropout': 0.36155475220449695, 'batch_norm': True, 'lr': 0.00026276594511158685, 'weight_decay': 1.053336030955576e-06, 'epochs': 46, 'loss': 'mse', 'optimizer': 'adam', 'graph_mode': 'off', 'use_snp_selection': False}. Best is trial 22 with value: 0.11094395980680749.
[I 2025-11-03 13:52:24,567] Trial 104 finished with value: 0.08909630046296567 and parameters: {'model_type': 'gcn', 'hidden_dims': '[512, 128]', 'dropout': 0.4021803760874934, 'batch_norm': True, 'lr': 0.0008560275539226324, 'weight_decay': 1.5839869138160812e-06, 'epochs': 282, 'loss': 'mse', 'optimizer': 'adam', 'graph_mode': 'off', 'use_snp_selection': False}. Best is trial 22 with value: 0.11094395980680749.
[I 2025-11-03 13:52:26,611] Trial 105 finished with value: 0.08843608784321272 and parameters: {'model_type': 'gcn', 'hidden_dims': '[512, 64]', 'dropout': 0.3307550209466648, 'batch_norm': True, 'lr': 0.0004748655030245867, 'weight_decay': 3.229676340974034e-06, 'epochs': 265, 'loss': 'mse', 'optimizer': 'adam', 'graph_mode': 'off', 'use_snp_selection': False}. Best is trial 22 with value: 0.11094395980680749.
[I 2025-11-03 13:52:28,431] Trial 106 finished with value: 0.08717335269897976 and parameters: {'model_type': 'gcn', 'hidden_dims': '[256, 128, 64]', 'dropout': 0.3197918898759645, 'batch_norm': True, 'lr': 0.0006813259084196645, 'weight_decay': 1.67484272077703e-07, 'epochs': 286, 'loss': 'mse', 'optimizer': 'adam', 'graph_mode': 'off', 'use_snp_selection': False}. Best is trial 22 with value: 0.11094395980680749.
[I 2025-11-03 13:52:31,637] Trial 107 finished with value: 0.0923376038531814 and parameters: {'model_type': 'gcn', 'hidden_dims': '[512, 64]', 'dropout': 0.3798948188458202, 'batch_norm': True, 'lr': 0.0003572554325379795, 'weight_decay': 1.9185200394763005e-06, 'epochs': 331, 'loss': 'mae', 'optimizer': 'adam', 'graph_mode': 'off', 'use_snp_selection': True, 'num_snps': 51403}. Best is trial 22 with value: 0.11094395980680749.
[I 2025-11-03 13:52:32,678] Trial 108 finished with value: 0.09484632805695076 and parameters: {'model_type': 'gcn', 'hidden_dims': '[128, 64]', 'dropout': 0.11932618863906695, 'batch_norm': True, 'lr': 0.0004099222213847687, 'weight_decay': 3.287454017318071e-07, 'epochs': 176, 'loss': 'mse', 'optimizer': 'adam', 'graph_mode': 'off', 'use_snp_selection': False}. Best is trial 22 with value: 0.11094395980680749.
[I 2025-11-03 13:52:34,944] Trial 109 finished with value: 0.07898953372943246 and parameters: {'model_type': 'gcn', 'hidden_dims': '[512, 64]', 'dropout': 0.3050483372209078, 'batch_norm': True, 'lr': 0.00021161646390036672, 'weight_decay': 4.437451503472766e-07, 'epochs': 313, 'loss': 'mse', 'optimizer': 'adam', 'graph_mode': 'off', 'use_snp_selection': False}. Best is trial 22 with value: 0.11094395980680749.
[I 2025-11-03 13:52:36,094] Trial 110 finished with value: 0.011380461821343205 and parameters: {'model_type': 'gcn', 'hidden_dims': '[256, 128]', 'dropout': 0.4277030202812725, 'batch_norm': False, 'lr': 0.0006223751339122063, 'weight_decay': 2.413378082792481e-07, 'epochs': 188, 'loss': 'mse', 'optimizer': 'adam', 'graph_mode': 'off', 'use_snp_selection': False}. Best is trial 22 with value: 0.11094395980680749.
[I 2025-11-03 13:52:37,086] Trial 111 finished with value: 0.08908827217046127 and parameters: {'model_type': 'gcn', 'hidden_dims': '[512, 64]', 'dropout': 0.1671146602024663, 'batch_norm': True, 'lr': 0.0009753522106392029, 'weight_decay': 1.7806759684325864e-07, 'epochs': 57, 'loss': 'mse', 'optimizer': 'adam', 'graph_mode': 'off', 'use_snp_selection': False}. Best is trial 22 with value: 0.11094395980680749.
[I 2025-11-03 13:52:38,103] Trial 112 finished with value: 0.09266367629650343 and parameters: {'model_type': 'gcn', 'hidden_dims': '[512, 64]', 'dropout': 0.21096207851891552, 'batch_norm': True, 'lr': 0.0007408203379310703, 'weight_decay': 1.895664107929496e-07, 'epochs': 45, 'loss': 'mse', 'optimizer': 'adam', 'graph_mode': 'off', 'use_snp_selection': False}. Best is trial 22 with value: 0.11094395980680749.
[I 2025-11-03 13:52:39,136] Trial 113 finished with value: 0.10549280092799587 and parameters: {'model_type': 'gcn', 'hidden_dims': '[512, 64]', 'dropout': 0.19156753269899435, 'batch_norm': True, 'lr': 0.0008580864495308949, 'weight_decay': 1.2668813144180524e-07, 'epochs': 67, 'loss': 'mse', 'optimizer': 'adam', 'graph_mode': 'off', 'use_snp_selection': False}. Best is trial 22 with value: 0.11094395980680749.
[I 2025-11-03 13:52:40,052] Trial 114 finished with value: 0.1011520461739751 and parameters: {'model_type': 'gcn', 'hidden_dims': '[512, 64]', 'dropout': 0.1671565435766624, 'batch_norm': True, 'lr': 0.0005091046425686736, 'weight_decay': 5.961459982109078e-07, 'epochs': 41, 'loss': 'mse', 'optimizer': 'adam', 'graph_mode': 'off', 'use_snp_selection': False}. Best is trial 22 with value: 0.11094395980680749.
[I 2025-11-03 13:52:41,154] Trial 115 finished with value: 0.09267418721125176 and parameters: {'model_type': 'gcn', 'hidden_dims': '[512, 64]', 'dropout': 0.25439604853931125, 'batch_norm': True, 'lr': 0.0003050659655374534, 'weight_decay': 2.551535525308916e-07, 'epochs': 82, 'loss': 'mse', 'optimizer': 'adam', 'graph_mode': 'off', 'use_snp_selection': False}. Best is trial 22 with value: 0.11094395980680749.
[I 2025-11-03 13:52:42,224] Trial 116 finished with value: 0.09893539458359496 and parameters: {'model_type': 'gcn', 'hidden_dims': '[512, 64]', 'dropout': 0.4121653005319967, 'batch_norm': True, 'lr': 0.0006116593062986598, 'weight_decay': 3.711780653720065e-07, 'epochs': 72, 'loss': 'mse', 'optimizer': 'adam', 'graph_mode': 'off', 'use_snp_selection': False}. Best is trial 22 with value: 0.11094395980680749.
[I 2025-11-03 13:52:43,237] Trial 117 finished with value: 0.11228804973545106 and parameters: {'model_type': 'gcn', 'hidden_dims': '[512, 64]', 'dropout': 0.22414799841393096, 'batch_norm': True, 'lr': 0.0009276601528996912, 'weight_decay': 7.757814577928633e-07, 'epochs': 63, 'loss': 'mse', 'optimizer': 'adam', 'graph_mode': 'off', 'use_snp_selection': False}. Best is trial 117 with value: 0.11228804973545106.
[I 2025-11-03 13:52:45,658] Trial 118 finished with value: 0.09917027489361115 and parameters: {'model_type': 'gcn', 'hidden_dims': '[512, 64]', 'dropout': 0.22239545156718815, 'batch_norm': True, 'lr': 0.0007630146962673259, 'weight_decay': 7.570111424972807e-07, 'epochs': 344, 'loss': 'mse', 'optimizer': 'adam', 'graph_mode': 'off', 'use_snp_selection': False}. Best is trial 117 with value: 0.11228804973545106.
[I 2025-11-03 13:52:47,390] Trial 119 finished with value: 0.10775227825164525 and parameters: {'model_type': 'gcn', 'hidden_dims': '[512, 256]', 'dropout': 0.3378606623965916, 'batch_norm': True, 'lr': 0.00042993744399819853, 'weight_decay': 9.096676269813285e-07, 'epochs': 209, 'loss': 'mse', 'optimizer': 'adam', 'graph_mode': 'off', 'use_snp_selection': False}. Best is trial 117 with value: 0.11228804973545106.
[I 2025-11-03 13:52:48,967] Trial 120 finished with value: 0.11513711209619745 and parameters: {'model_type': 'gcn', 'hidden_dims': '[512, 64]', 'dropout': 0.34253340475017363, 'batch_norm': True, 'lr': 0.0004711312849517475, 'weight_decay': 9.268638747440792e-07, 'epochs': 168, 'loss': 'mse', 'optimizer': 'adam', 'graph_mode': 'off', 'use_snp_selection': False}. Best is trial 120 with value: 0.11513711209619745.
[I 2025-11-03 13:52:50,111] Trial 121 finished with value: 0.08643608995380378 and parameters: {'model_type': 'gcn', 'hidden_dims': '[512, 64]', 'dropout': 0.34760936367621526, 'batch_norm': True, 'lr': 0.00046272811060055343, 'weight_decay': 1.0190436272957702e-06, 'epochs': 91, 'loss': 'mse', 'optimizer': 'adam', 'graph_mode': 'off', 'use_snp_selection': False}. Best is trial 120 with value: 0.11513711209619745.
[I 2025-11-03 13:52:51,518] Trial 122 finished with value: 0.09395149186888256 and parameters: {'model_type': 'gcn', 'hidden_dims': '[512, 64]', 'dropout': 0.33660510853148423, 'batch_norm': True, 'lr': 0.000539740955207982, 'weight_decay': 6.191465631398447e-07, 'epochs': 140, 'loss': 'mse', 'optimizer': 'adam', 'graph_mode': 'off', 'use_snp_selection': False}. Best is trial 120 with value: 0.11513711209619745.
[I 2025-11-03 13:52:52,992] Trial 123 finished with value: 0.11006671734745324 and parameters: {'model_type': 'gcn', 'hidden_dims': '[512, 64]', 'dropout': 0.3683336454416242, 'batch_norm': True, 'lr': 0.0006233332318219551, 'weight_decay': 0.0004191883027406746, 'epochs': 155, 'loss': 'mse', 'optimizer': 'adam', 'graph_mode': 'off', 'use_snp_selection': False}. Best is trial 120 with value: 0.11513711209619745.
[I 2025-11-03 13:52:54,498] Trial 124 finished with value: 0.1049812146108161 and parameters: {'model_type': 'gcn', 'hidden_dims': '[512, 64]', 'dropout': 0.3708693619030515, 'batch_norm': True, 'lr': 0.0008880825904837397, 'weight_decay': 0.00010771423380520555, 'epochs': 157, 'loss': 'mse', 'optimizer': 'adam', 'graph_mode': 'off', 'use_snp_selection': False}. Best is trial 120 with value: 0.11513711209619745.
[I 2025-11-03 13:52:55,835] Trial 125 finished with value: 0.08936334003616676 and parameters: {'model_type': 'gcn', 'hidden_dims': '[512, 64]', 'dropout': 0.3590328628785893, 'batch_norm': True, 'lr': 0.0003725701539166107, 'weight_decay': 0.0006413942832991275, 'epochs': 116, 'loss': 'mse', 'optimizer': 'adam', 'graph_mode': 'off', 'use_snp_selection': False}. Best is trial 120 with value: 0.11513711209619745.
[I 2025-11-03 13:52:57,388] Trial 126 finished with value: 0.09677470049928906 and parameters: {'model_type': 'gcn', 'hidden_dims': '[512, 64]', 'dropout': 0.3866799204610369, 'batch_norm': True, 'lr': 0.0006545021407943789, 'weight_decay': 8.976073453338361e-07, 'epochs': 182, 'loss': 'mse', 'optimizer': 'adam', 'graph_mode': 'off', 'use_snp_selection': True, 'num_snps': 28304}. Best is trial 120 with value: 0.11513711209619745.
[I 2025-11-03 13:52:58,860] Trial 127 finished with value: 0.09024376861887136 and parameters: {'model_type': 'gcn', 'hidden_dims': '[256, 128, 64]', 'dropout': 0.4435451960625226, 'batch_norm': True, 'lr': 0.0004555643232582196, 'weight_decay': 5.34967892436036e-07, 'epochs': 213, 'loss': 'mse', 'optimizer': 'adam', 'graph_mode': 'off', 'use_snp_selection': False}. Best is trial 120 with value: 0.11513711209619745.
[I 2025-11-03 13:53:00,351] Trial 128 finished with value: 0.08664770681908616 and parameters: {'model_type': 'gcn', 'hidden_dims': '[512, 256]', 'dropout': 0.3248996420589123, 'batch_norm': True, 'lr': 0.0007523959163747527, 'weight_decay': 0.00011352433161891272, 'epochs': 156, 'loss': 'mae', 'optimizer': 'adam', 'graph_mode': 'off', 'use_snp_selection': False}. Best is trial 120 with value: 0.11513711209619745.
[I 2025-11-03 13:53:01,732] Trial 129 finished with value: 0.0911526881306837 and parameters: {'model_type': 'gcn', 'hidden_dims': '[512, 64]', 'dropout': 0.3985448716776884, 'batch_norm': True, 'lr': 0.0006255530444074823, 'weight_decay': 2.2922628804879007e-05, 'epochs': 138, 'loss': 'mse', 'optimizer': 'adam', 'graph_mode': 'off', 'use_snp_selection': False}. Best is trial 120 with value: 0.11513711209619745.
[I 2025-11-03 13:53:03,279] Trial 130 finished with value: 0.09972437820862674 and parameters: {'model_type': 'gcn', 'hidden_dims': '[512, 128]', 'dropout': 0.3435711792350447, 'batch_norm': True, 'lr': 0.00016226739877500906, 'weight_decay': 4.1190463082576846e-05, 'epochs': 170, 'loss': 'mse', 'optimizer': 'adam', 'graph_mode': 'off', 'use_snp_selection': False}. Best is trial 120 with value: 0.11513711209619745.
[I 2025-11-03 13:53:04,315] Trial 131 finished with value: 0.08379754632614653 and parameters: {'model_type': 'gcn', 'hidden_dims': '[512, 64]', 'dropout': 0.283697388153981, 'batch_norm': True, 'lr': 0.00032871894318194637, 'weight_decay': 0.00018276465531320038, 'epochs': 59, 'loss': 'mse', 'optimizer': 'adam', 'graph_mode': 'off', 'use_snp_selection': False}. Best is trial 120 with value: 0.11513711209619745.
[I 2025-11-03 13:53:06,037] Trial 132 finished with value: 0.09292952913251372 and parameters: {'model_type': 'gcn', 'hidden_dims': '[512, 64]', 'dropout': 0.31320816117905875, 'batch_norm': True, 'lr': 0.0005635750470810216, 'weight_decay': 7.61457387995534e-07, 'epochs': 203, 'loss': 'mse', 'optimizer': 'adam', 'graph_mode': 'off', 'use_snp_selection': False}. Best is trial 120 with value: 0.11513711209619745.
[I 2025-11-03 13:53:07,842] Trial 133 finished with value: 0.09566658459055177 and parameters: {'model_type': 'gcn', 'hidden_dims': '[512, 64]', 'dropout': 0.3325973933346134, 'batch_norm': True, 'lr': 0.0007865223108929318, 'weight_decay': 0.0004989355397862435, 'epochs': 224, 'loss': 'mse', 'optimizer': 'adam', 'graph_mode': 'off', 'use_snp_selection': False}. Best is trial 120 with value: 0.11513711209619745.
