[I 2025-11-03 12:03:35,045] Trial 110 finished with value: 0.07419272548108244 and parameters: {'model_type': 'gcn', 'hidden_dims': '[128, 64]', 'dropout': 0.12889202749226422, 'batch_norm': False, 'lr': 0.0002913639013037917, 'weight_decay': 2.9564258107916686e-05, 'epochs': 135, 'loss': 'mae', 'optimizer': 'adam', 'graph_mode': 'cutoff', 'cutoff': 0.8376029546960324, 'grm_norm': 'gcn', 'self_loops': True, 'use_snp_selection': True, 'num_snps': 50362}. Best is trial 40 with value: 0.10707079639337991.
[I 2025-11-03 12:03:38,410] Trial 111 finished with value: 0.07768444438626826 and parameters: {'model_type': 'gcn', 'hidden_dims': '[128, 64]', 'dropout': 0.1505165022222783, 'batch_norm': False, 'lr': 0.00022296769618427822, 'weight_decay': 3.7105021035516145e-06, 'epochs': 165, 'loss': 'mae', 'optimizer': 'adam', 'graph_mode': 'cutoff', 'cutoff': 0.8588279809386349, 'grm_norm': 'gcn', 'self_loops': True, 'use_snp_selection': True, 'num_snps': 54008}. Best is trial 40 with value: 0.10707079639337991.
[I 2025-11-03 12:03:43,795] Trial 112 finished with value: 0.0863498306184869 and parameters: {'model_type': 'gcn', 'hidden_dims': '[512, 128]', 'dropout': 0.14135694105109115, 'batch_norm': False, 'lr': 0.0002640723369503498, 'weight_decay': 1.0550123701922784e-06, 'epochs': 300, 'loss': 'mae', 'optimizer': 'adam', 'graph_mode': 'cutoff', 'cutoff': 0.8870723234655847, 'grm_norm': 'none', 'self_loops': True, 'use_snp_selection': True, 'num_snps': 57052}. Best is trial 40 with value: 0.10707079639337991.
[I 2025-11-03 12:03:47,834] Trial 113 finished with value: 0.0821483490711143 and parameters: {'model_type': 'gcn', 'hidden_dims': '[128, 64]', 'dropout': 0.18128752195207679, 'batch_norm': False, 'lr': 0.00019290003166901864, 'weight_decay': 1.9791463627341206e-06, 'epochs': 350, 'loss': 'mae', 'optimizer': 'adam', 'graph_mode': 'cutoff', 'cutoff': 0.7999803531773327, 'grm_norm': 'gcn', 'self_loops': True, 'use_snp_selection': True, 'num_snps': 56175}. Best is trial 40 with value: 0.10707079639337991.
[I 2025-11-03 12:03:53,396] Trial 114 finished with value: 0.08191684949204932 and parameters: {'model_type': 'gcn', 'hidden_dims': '[512, 128]', 'dropout': 0.16535430027918974, 'batch_norm': False, 'lr': 0.00034030843250509207, 'weight_decay': 0.0002563375416364233, 'epochs': 320, 'loss': 'mae', 'optimizer': 'adam', 'graph_mode': 'cutoff', 'cutoff': 0.830471217072801, 'grm_norm': 'none', 'self_loops': False, 'use_snp_selection': True, 'num_snps': 58228}. Best is trial 40 with value: 0.10707079639337991.
[I 2025-11-03 12:03:57,690] Trial 115 finished with value: 0.09333024632701993 and parameters: {'model_type': 'gcn', 'hidden_dims': '[512, 256]', 'dropout': 0.15456946351034898, 'batch_norm': False, 'lr': 0.00010026908340049286, 'weight_decay': 0.00020118431458546066, 'epochs': 181, 'loss': 'mae', 'optimizer': 'adam', 'graph_mode': 'cutoff', 'cutoff': 0.7442140728140647, 'grm_norm': 'gcn', 'self_loops': True, 'use_snp_selection': True, 'num_snps': 53073}. Best is trial 40 with value: 0.10707079639337991.
[I 2025-11-03 12:04:01,579] Trial 116 finished with value: 0.04582120663269945 and parameters: {'model_type': 'gcn', 'hidden_dims': '[512, 256]', 'dropout': 0.10014496803024965, 'batch_norm': False, 'lr': 7.712543036874661e-05, 'weight_decay': 0.00018384394651225876, 'epochs': 187, 'loss': 'mae', 'optimizer': 'adam', 'graph_mode': 'cutoff', 'cutoff': 0.7567359064602851, 'grm_norm': 'gcn', 'self_loops': False, 'use_snp_selection': True, 'num_snps': 44446}. Best is trial 40 with value: 0.10707079639337991.
[I 2025-11-03 12:04:05,045] Trial 117 finished with value: 0.0789769789967723 and parameters: {'model_type': 'gcn', 'hidden_dims': '[512, 256]', 'dropout': 0.11893413456620432, 'batch_norm': False, 'lr': 0.00010635093027191352, 'weight_decay': 0.00014671429858208182, 'epochs': 58, 'loss': 'mae', 'optimizer': 'adam', 'graph_mode': 'cutoff', 'cutoff': 0.7345850294966917, 'grm_norm': 'gcn', 'self_loops': True, 'use_snp_selection': True, 'num_snps': 53103}. Best is trial 40 with value: 0.10707079639337991.
[I 2025-11-03 12:04:09,390] Trial 118 finished with value: 0.07516754322304865 and parameters: {'model_type': 'gcn', 'hidden_dims': '[512, 256]', 'dropout': 0.13264198815433834, 'batch_norm': False, 'lr': 8.504723852079712e-05, 'weight_decay': 1.994691403083541e-05, 'epochs': 170, 'loss': 'mae', 'optimizer': 'adam', 'graph_mode': 'cutoff', 'cutoff': 0.6914799253165235, 'grm_norm': 'gcn', 'self_loops': True, 'use_snp_selection': True, 'num_snps': 54741}. Best is trial 40 with value: 0.10707079639337991.
[I 2025-11-03 12:04:11,196] Trial 119 finished with value: 0.09188158212624592 and parameters: {'model_type': 'gcn', 'hidden_dims': '[512, 256]', 'dropout': 0.15437371605494427, 'batch_norm': False, 'lr': 0.00014321824664292044, 'weight_decay': 0.00011655528016851598, 'epochs': 117, 'loss': 'mae', 'optimizer': 'adam', 'graph_mode': 'cutoff', 'cutoff': 0.8566585204373597, 'grm_norm': 'gcn', 'self_loops': False, 'use_snp_selection': True, 'num_snps': 8592}. Best is trial 40 with value: 0.10707079639337991.
[I 2025-11-03 12:04:15,543] Trial 120 finished with value: 0.06805357904997027 and parameters: {'model_type': 'gcn', 'hidden_dims': '[512, 128]', 'dropout': 0.1419154685989541, 'batch_norm': False, 'lr': 6.935902955849196e-05, 'weight_decay': 0.00036562298992924146, 'epochs': 201, 'loss': 'mae', 'optimizer': 'adam', 'graph_mode': 'cutoff', 'cutoff': 0.7713589708814625, 'grm_norm': 'gcn', 'self_loops': True, 'use_snp_selection': True, 'num_snps': 51398}. Best is trial 40 with value: 0.10707079639337991.
[I 2025-11-03 12:04:17,284] Trial 121 finished with value: 0.03734775980159682 and parameters: {'model_type': 'gcn', 'hidden_dims': '[512, 256]', 'dropout': 0.15480934502609964, 'batch_norm': False, 'lr': 0.00013091447674540342, 'weight_decay': 0.000295216150084233, 'epochs': 114, 'loss': 'mae', 'optimizer': 'adam', 'graph_mode': 'cutoff', 'cutoff': 0.853027041529095, 'grm_norm': 'gcn', 'self_loops': False, 'use_snp_selection': True, 'num_snps': 7425}. Best is trial 40 with value: 0.10707079639337991.
[I 2025-11-03 12:04:19,025] Trial 122 finished with value: 0.03451240501320649 and parameters: {'model_type': 'gcn', 'hidden_dims': '[512, 256]', 'dropout': 0.170802370034552, 'batch_norm': False, 'lr': 0.00016364650104675924, 'weight_decay': 6.0333615302249e-05, 'epochs': 153, 'loss': 'mae', 'optimizer': 'adam', 'graph_mode': 'cutoff', 'cutoff': 0.5140066897176433, 'grm_norm': 'gcn', 'self_loops': False, 'use_snp_selection': True, 'num_snps': 5909}. Best is trial 40 with value: 0.10707079639337991.
[I 2025-11-03 12:04:21,326] Trial 123 finished with value: 0.03321730551376192 and parameters: {'model_type': 'gcn', 'hidden_dims': '[512, 256]', 'dropout': 0.14973653052239969, 'batch_norm': False, 'lr': 9.955837548658301e-05, 'weight_decay': 0.00010012910161433472, 'epochs': 180, 'loss': 'mae', 'optimizer': 'adam', 'graph_mode': 'cutoff', 'cutoff': 0.8773111467933771, 'grm_norm': 'gcn', 'self_loops': False, 'use_snp_selection': True, 'num_snps': 15558}. Best is trial 40 with value: 0.10707079639337991.
[I 2025-11-03 12:04:26,752] Trial 124 finished with value: 0.08723922151298205 and parameters: {'model_type': 'gcn', 'hidden_dims': '[512, 256]', 'dropout': 0.13137743465794088, 'batch_norm': False, 'lr': 0.00014277568888122655, 'weight_decay': 0.00018910105583329532, 'epochs': 287, 'loss': 'mae', 'optimizer': 'adam', 'graph_mode': 'cutoff', 'cutoff': 0.8323669439914212, 'grm_norm': 'gcn', 'self_loops': False, 'use_snp_selection': True, 'num_snps': 58935}. Best is trial 40 with value: 0.10707079639337991.
[I 2025-11-03 12:04:29,325] Trial 125 finished with value: 0.050821918125384835 and parameters: {'model_type': 'gcn', 'hidden_dims': '[128, 64]', 'dropout': 0.1583716085023334, 'batch_norm': False, 'lr': 0.0001163828438958819, 'weight_decay': 0.00016201576838884566, 'epochs': 147, 'loss': 'mae', 'optimizer': 'adam', 'graph_mode': 'cutoff', 'cutoff': 0.7915761474210372, 'grm_norm': 'gcn', 'self_loops': False, 'use_snp_selection': True, 'num_snps': 33083}. Best is trial 40 with value: 0.10707079639337991.
[I 2025-11-03 12:04:31,786] Trial 126 finished with value: 0.05420996124552982 and parameters: {'model_type': 'gcn', 'hidden_dims': '[512, 128]', 'dropout': 0.11984104629986597, 'batch_norm': False, 'lr': 0.00023017289715887218, 'weight_decay': 0.00023177489552584027, 'epochs': 94, 'loss': 'mse', 'optimizer': 'adam', 'graph_mode': 'cutoff', 'cutoff': 0.8605612147656027, 'grm_norm': 'cosine', 'self_loops': False, 'use_snp_selection': True, 'num_snps': 25261}. Best is trial 40 with value: 0.10707079639337991.
[I 2025-11-03 12:04:35,790] Trial 127 finished with value: 0.09117733977116814 and parameters: {'model_type': 'gcn', 'hidden_dims': '[512, 128]', 'dropout': 0.10841237532509387, 'batch_norm': False, 'lr': 0.00017058491457726827, 'weight_decay': 3.6053279569013015e-05, 'epochs': 277, 'loss': 'mae', 'optimizer': 'adam', 'graph_mode': 'cutoff', 'cutoff': 0.8456878356901489, 'grm_norm': 'cosine_then_gcn', 'self_loops': True, 'use_snp_selection': True, 'num_snps': 37578}. Best is trial 40 with value: 0.10707079639337991.
[I 2025-11-03 12:04:41,190] Trial 128 finished with value: 0.08843221085443015 and parameters: {'model_type': 'gcn', 'hidden_dims': '[512, 256]', 'dropout': 0.18895277723880133, 'batch_norm': False, 'lr': 6.164502379044833e-05, 'weight_decay': 0.0001171238560487356, 'epochs': 338, 'loss': 'mae', 'optimizer': 'adam', 'graph_mode': 'cutoff', 'cutoff': 0.8931110914858211, 'grm_norm': 'none', 'self_loops': True, 'use_snp_selection': True, 'num_snps': 52886}. Best is trial 40 with value: 0.10707079639337991.
[I 2025-11-03 12:04:44,518] Trial 129 finished with value: 0.03122496033229907 and parameters: {'model_type': 'gcn', 'hidden_dims': '[128, 64]', 'dropout': 0.14100061773854983, 'batch_norm': False, 'lr': 8.387781775940542e-05, 'weight_decay': 6.993202641293727e-06, 'epochs': 139, 'loss': 'mae', 'optimizer': 'adam', 'graph_mode': 'cutoff', 'cutoff': 0.7444224892806413, 'grm_norm': 'gcn', 'self_loops': False, 'use_snp_selection': True, 'num_snps': 54905}. Best is trial 40 with value: 0.10707079639337991.
[I 2025-11-03 12:04:46,467] Trial 130 finished with value: 0.059411841727380184 and parameters: {'model_type': 'gcn', 'hidden_dims': '[256, 128]', 'dropout': 0.17608327264238893, 'batch_norm': False, 'lr': 4.503044413834652e-05, 'weight_decay': 7.714343447840984e-05, 'epochs': 48, 'loss': 'mae', 'optimizer': 'adam', 'graph_mode': 'cutoff', 'cutoff': 0.7217519879422266, 'grm_norm': 'none', 'self_loops': True, 'use_snp_selection': True, 'num_snps': 21513}. Best is trial 40 with value: 0.10707079639337991.
[I 2025-11-03 12:04:50,218] Trial 131 finished with value: 0.07362769296382075 and parameters: {'model_type': 'gcn', 'hidden_dims': '[512, 128]', 'dropout': 0.11124754865731429, 'batch_norm': False, 'lr': 0.00017739065651600595, 'weight_decay': 4.5629737266971553e-05, 'epochs': 273, 'loss': 'mae', 'optimizer': 'adam', 'graph_mode': 'cutoff', 'cutoff': 0.8448727220716246, 'grm_norm': 'cosine_then_gcn', 'self_loops': True, 'use_snp_selection': True, 'num_snps': 34396}. Best is trial 40 with value: 0.10707079639337991.
[I 2025-11-03 12:04:54,175] Trial 132 finished with value: 0.1000244953214231 and parameters: {'model_type': 'gcn', 'hidden_dims': '[512, 128]', 'dropout': 0.12820680794446135, 'batch_norm': False, 'lr': 0.0001963116890693755, 'weight_decay': 1.5004644060865245e-05, 'epochs': 245, 'loss': 'mae', 'optimizer': 'adam', 'graph_mode': 'cutoff', 'cutoff': 0.819863037644947, 'grm_norm': 'cosine_then_gcn', 'self_loops': True, 'use_snp_selection': True, 'num_snps': 39347}. Best is trial 40 with value: 0.10707079639337991.
[I 2025-11-03 12:04:57,045] Trial 133 finished with value: 0.06535400441307632 and parameters: {'model_type': 'gcn', 'hidden_dims': '[512, 128]', 'dropout': 0.12802904334072499, 'batch_norm': False, 'lr': 0.00019758022286449424, 'weight_decay': 1.4128902814244532e-05, 'epochs': 117, 'loss': 'mae', 'optimizer': 'adam', 'graph_mode': 'cutoff', 'cutoff': 0.8727401763430936, 'grm_norm': 'cosine_then_gcn', 'self_loops': True, 'use_snp_selection': True, 'num_snps': 31828}. Best is trial 40 with value: 0.10707079639337991.
[I 2025-11-03 12:05:02,061] Trial 134 finished with value: 0.07759525969860188 and parameters: {'model_type': 'gcn', 'hidden_dims': '[512, 128]', 'dropout': 0.15866482599561327, 'batch_norm': False, 'lr': 0.0002999798695726155, 'weight_decay': 1.1535830472089657e-05, 'epochs': 243, 'loss': 'mae', 'optimizer': 'adam', 'graph_mode': 'cutoff', 'cutoff': 0.8218830588290756, 'grm_norm': 'cosine_then_gcn', 'self_loops': True, 'use_snp_selection': True, 'num_snps': 57032}. Best is trial 40 with value: 0.10707079639337991.
[I 2025-11-03 12:05:07,081] Trial 135 finished with value: 0.10037257903819193 and parameters: {'model_type': 'gcn', 'hidden_dims': '[512, 128]', 'dropout': 0.1475618359616493, 'batch_norm': False, 'lr': 0.0002590184641479101, 'weight_decay': 9.437095284956105e-06, 'epochs': 258, 'loss': 'mae', 'optimizer': 'adam', 'graph_mode': 'cutoff', 'cutoff': 0.7784277559672607, 'grm_norm': 'cosine_then_gcn', 'self_loops': True, 'use_snp_selection': True, 'num_snps': 55589}. Best is trial 40 with value: 0.10707079639337991.
[I 2025-11-03 12:05:12,110] Trial 136 finished with value: 0.08288425990795883 and parameters: {'model_type': 'gcn', 'hidden_dims': '[512, 128]', 'dropout': 0.13670443131815727, 'batch_norm': False, 'lr': 0.00024845904007015116, 'weight_decay': 1.6792057572982925e-05, 'epochs': 260, 'loss': 'mae', 'optimizer': 'adam', 'graph_mode': 'cutoff', 'cutoff': 0.7869249082766478, 'grm_norm': 'cosine_then_gcn', 'self_loops': True, 'use_snp_selection': True, 'num_snps': 55650}. Best is trial 40 with value: 0.10707079639337991.
[I 2025-11-03 12:05:16,167] Trial 137 finished with value: 0.08025985554941996 and parameters: {'model_type': 'gcn', 'hidden_dims': '[512, 128]', 'dropout': 0.1241153977824108, 'batch_norm': False, 'lr': 0.0002103936986478228, 'weight_decay': 8.991226435291889e-06, 'epochs': 286, 'loss': 'mse', 'optimizer': 'adam', 'graph_mode': 'cutoff', 'cutoff': 0.7741284737017465, 'grm_norm': 'cosine_then_gcn', 'self_loops': True, 'use_snp_selection': True, 'num_snps': 37869}. Best is trial 40 with value: 0.10707079639337991.
[I 2025-11-03 12:05:21,140] Trial 138 finished with value: 0.09723559250655987 and parameters: {'model_type': 'gcn', 'hidden_dims': '[512, 128]', 'dropout': 0.14350096356405198, 'batch_norm': False, 'lr': 0.00041128833711981524, 'weight_decay': 1.0168526953130951e-05, 'epochs': 224, 'loss': 'mae', 'optimizer': 'adam', 'graph_mode': 'cutoff', 'cutoff': 0.8102073402302068, 'grm_norm': 'cosine_then_gcn', 'self_loops': True, 'use_snp_selection': True, 'num_snps': 59048}. Best is trial 40 with value: 0.10707079639337991.
[I 2025-11-03 12:05:26,110] Trial 139 finished with value: 0.08806049609366502 and parameters: {'model_type': 'gcn', 'hidden_dims': '[512, 128]', 'dropout': 0.14657542679082036, 'batch_norm': False, 'lr': 0.0005866500813908966, 'weight_decay': 2.3996874258159816e-05, 'epochs': 221, 'loss': 'mae', 'optimizer': 'adam', 'graph_mode': 'cutoff', 'cutoff': 0.6180755671189629, 'grm_norm': 'cosine_then_gcn', 'self_loops': True, 'use_snp_selection': True, 'num_snps': 59409}. Best is trial 40 with value: 0.10707079639337991.
[I 2025-11-03 12:05:31,109] Trial 140 finished with value: 0.05253313392598863 and parameters: {'model_type': 'gcn', 'hidden_dims': '[512, 128]', 'dropout': 0.47868763322560304, 'batch_norm': False, 'lr': 0.0004085767679546337, 'weight_decay': 6.874581617816689e-06, 'epochs': 241, 'loss': 'mae', 'optimizer': 'adam', 'graph_mode': 'cutoff', 'cutoff': 0.8115821529501, 'grm_norm': 'cosine_then_gcn', 'self_loops': True, 'use_snp_selection': True, 'num_snps': 57608}. Best is trial 40 with value: 0.10707079639337991.
[I 2025-11-03 12:05:35,089] Trial 141 finished with value: 0.040074567492860556 and parameters: {'model_type': 'gcn', 'hidden_dims': '[512, 128]', 'dropout': 0.16961731410692854, 'batch_norm': False, 'lr': 0.0008454402075906196, 'weight_decay': 1.0546227890228503e-05, 'epochs': 251, 'loss': 'mae', 'optimizer': 'adam', 'graph_mode': 'cutoff', 'cutoff': 0.3552920228608863, 'grm_norm': 'cosine_then_gcn', 'self_loops': True, 'use_snp_selection': True, 'num_snps': 39451}. Best is trial 40 with value: 0.10707079639337991.
[I 2025-11-03 12:05:39,994] Trial 142 finished with value: 0.07750517464744922 and parameters: {'model_type': 'gcn', 'hidden_dims': '[512, 128]', 'dropout': 0.13294740918043615, 'batch_norm': False, 'lr': 0.0003172994633190876, 'weight_decay': 4.962687537959154e-06, 'epochs': 250, 'loss': 'mae', 'optimizer': 'adam', 'graph_mode': 'cutoff', 'cutoff': 0.7656857741928742, 'grm_norm': 'cosine_then_gcn', 'self_loops': True, 'use_snp_selection': True, 'num_snps': 54274}. Best is trial 40 with value: 0.10707079639337991.
[I 2025-11-03 12:05:44,817] Trial 143 finished with value: 0.09106531348862583 and parameters: {'model_type': 'gcn', 'hidden_dims': '[512, 128]', 'dropout': 0.11633132324770223, 'batch_norm': False, 'lr': 0.0002586564181845826, 'weight_decay': 1.9639264257146587e-05, 'epochs': 232, 'loss': 'mae', 'optimizer': 'adam', 'graph_mode': 'cutoff', 'cutoff': 0.7541022684538145, 'grm_norm': 'none', 'self_loops': True, 'use_snp_selection': True, 'num_snps': 56035}. Best is trial 40 with value: 0.10707079639337991.
[I 2025-11-03 12:05:49,964] Trial 144 finished with value: 0.10134215678518062 and parameters: {'model_type': 'gcn', 'hidden_dims': '[512, 128]', 'dropout': 0.16281083113617606, 'batch_norm': False, 'lr': 5.497900850277218e-05, 'weight_decay': 2.5735159002083855e-05, 'epochs': 264, 'loss': 'mae', 'optimizer': 'adam', 'graph_mode': 'cutoff', 'cutoff': 0.7975321000777529, 'grm_norm': 'cosine_then_gcn', 'self_loops': True, 'use_snp_selection': True, 'num_snps': 57328}. Best is trial 40 with value: 0.10707079639337991.
[I 2025-11-03 12:05:53,827] Trial 145 finished with value: 0.08341732934109936 and parameters: {'model_type': 'gcn', 'hidden_dims': '[128, 64]', 'dropout': 0.14342347540685582, 'batch_norm': False, 'lr': 0.0005195059046648084, 'weight_decay': 2.7371720188101286e-05, 'epochs': 263, 'loss': 'mae', 'optimizer': 'adam', 'graph_mode': 'cutoff', 'cutoff': 0.8053328597716346, 'grm_norm': 'cosine_then_gcn', 'self_loops': True, 'use_snp_selection': True, 'num_snps': 58457}. Best is trial 40 with value: 0.10707079639337991.
[I 2025-11-03 12:05:58,931] Trial 146 finished with value: 0.08337105147186288 and parameters: {'model_type': 'gcn', 'hidden_dims': '[512, 128]', 'dropout': 0.1630525693997928, 'batch_norm': False, 'lr': 0.0003985041077699103, 'weight_decay': 1.2474931615599019e-05, 'epochs': 256, 'loss': 'mae', 'optimizer': 'adam', 'graph_mode': 'cutoff', 'cutoff': 0.57027642839886, 'grm_norm': 'cosine_then_gcn', 'self_loops': True, 'use_snp_selection': True, 'num_snps': 57169}. Best is trial 40 with value: 0.10707079639337991.
[I 2025-11-03 12:06:03,865] Trial 147 finished with value: 0.09807691333990627 and parameters: {'model_type': 'gcn', 'hidden_dims': '[512, 128]', 'dropout': 0.14992853016327784, 'batch_norm': False, 'lr': 5.4852116290312384e-05, 'weight_decay': 3.342268222871931e-05, 'epochs': 214, 'loss': 'mae', 'optimizer': 'adam', 'graph_mode': 'cutoff', 'cutoff': 0.8300301222648013, 'grm_norm': 'cosine_then_gcn', 'self_loops': True, 'use_snp_selection': True, 'num_snps': 59791}. Best is trial 40 with value: 0.10707079639337991.
[I 2025-11-03 12:06:07,507] Trial 148 finished with value: 0.03868433952882803 and parameters: {'model_type': 'gcn', 'hidden_dims': '[512, 128]', 'dropout': 0.14791704448506962, 'batch_norm': False, 'lr': 3.5765728097940567e-06, 'weight_decay': 3.382543284298716e-05, 'epochs': 226, 'loss': 'mae', 'optimizer': 'adam', 'graph_mode': 'cutoff', 'cutoff': 0.8264182617645952, 'grm_norm': 'cosine_then_gcn', 'self_loops': True, 'use_snp_selection': True, 'num_snps': 35758}. Best is trial 40 with value: 0.10707079639337991.
[I 2025-11-03 12:06:12,372] Trial 149 finished with value: 0.06828153772540882 and parameters: {'model_type': 'gcn', 'hidden_dims': '[512, 128]', 'dropout': 0.5367707519042538, 'batch_norm': False, 'lr': 0.00027389090948575396, 'weight_decay': 1.5097267487713046e-05, 'epochs': 207, 'loss': 'mae', 'optimizer': 'adam', 'graph_mode': 'cutoff', 'cutoff': 0.8366328089918091, 'grm_norm': 'cosine_then_gcn', 'self_loops': True, 'use_snp_selection': True, 'num_snps': 59915}. Best is trial 40 with value: 0.10707079639337991.
[I 2025-11-03 12:06:15,057] Trial 0 finished with value: 0.04673942526391339 and parameters: {'model_type': 'gcn', 'hidden_dims': '[128, 64]', 'dropout': 0.199031432379812, 'batch_norm': True, 'lr': 1.8408544111075837e-06, 'weight_decay': 5.5136510071208614e-05, 'epochs': 334, 'loss': 'mae', 'optimizer': 'adam', 'graph_mode': 'knn', 'source': 'grm', 'knn_k': 8, 'weighted_edges': True, 'symmetrize_mode': 'mutual', 'use_snp_selection': False}. Best is trial 0 with value: 0.04673942526391339.
[I 2025-11-03 12:06:16,190] Trial 1 finished with value: 0.12529637793613801 and parameters: {'model_type': 'gcn', 'hidden_dims': '[128, 64]', 'dropout': 0.40051947670227217, 'batch_norm': True, 'lr': 0.0005320428882732732, 'weight_decay': 1.89210117736594e-06, 'epochs': 32, 'loss': 'mse', 'optimizer': 'adam', 'graph_mode': 'knn', 'source': 'grm', 'knn_k': 7, 'weighted_edges': True, 'symmetrize_mode': 'union', 'use_snp_selection': False}. Best is trial 1 with value: 0.12529637793613801.
