[I 2025-11-03 12:20:33,884] Trial 106 finished with value: 0.07177079916656305 and parameters: {'model_type': 'graphsage', 'hidden_dims': '[512, 128]', 'dropout': 0.363025411457715, 'batch_norm': False, 'lr': 0.0005358447256523511, 'weight_decay': 0.00016020988046602, 'epochs': 310, 'loss': 'mae', 'optimizer': 'adam', 'graph_mode': 'cutoff', 'cutoff': 0.5227706339579435, 'grm_norm': 'cosine_then_gcn', 'self_loops': False, 'use_snp_selection': True, 'num_snps': 46989}. Best is trial 95 with value: 0.10468386800364146.
[I 2025-11-03 12:20:42,119] Trial 107 finished with value: 0.11409765987497401 and parameters: {'model_type': 'graphsage', 'hidden_dims': '[512, 128]', 'dropout': 0.21773714726525772, 'batch_norm': False, 'lr': 0.00038478834209558277, 'weight_decay': 0.0003231476546559829, 'epochs': 293, 'loss': 'mae', 'optimizer': 'adam', 'graph_mode': 'cutoff', 'cutoff': 0.579513976998695, 'grm_norm': 'cosine_then_gcn', 'self_loops': False, 'use_snp_selection': True, 'num_snps': 57086}. Best is trial 107 with value: 0.11409765987497401.
[I 2025-11-03 12:20:50,133] Trial 108 finished with value: 0.0735290807423692 and parameters: {'model_type': 'graphsage', 'hidden_dims': '[512, 128]', 'dropout': 0.21777954861628068, 'batch_norm': False, 'lr': 0.00035897129318186114, 'weight_decay': 8.930900574438161e-05, 'epochs': 291, 'loss': 'mae', 'optimizer': 'adam', 'graph_mode': 'cutoff', 'cutoff': 0.5777347549594802, 'grm_norm': 'cosine_then_gcn', 'self_loops': False, 'use_snp_selection': True, 'num_snps': 55730}. Best is trial 107 with value: 0.11409765987497401.
[I 2025-11-03 12:20:56,870] Trial 109 finished with value: 0.07364061801787883 and parameters: {'model_type': 'graphsage', 'hidden_dims': '[512, 128]', 'dropout': 0.23050750164123, 'batch_norm': False, 'lr': 0.0001681667020647832, 'weight_decay': 0.00047128180339971003, 'epochs': 302, 'loss': 'mae', 'optimizer': 'adam', 'graph_mode': 'cutoff', 'cutoff': 0.632924625442228, 'grm_norm': 'cosine_then_gcn', 'self_loops': False, 'use_snp_selection': True, 'num_snps': 43434}. Best is trial 107 with value: 0.11409765987497401.
[I 2025-11-03 12:21:04,723] Trial 110 finished with value: 0.09149876431767529 and parameters: {'model_type': 'graphsage', 'hidden_dims': '[512, 64]', 'dropout': 0.24658695230842298, 'batch_norm': False, 'lr': 0.0002586358521024307, 'weight_decay': 0.00035044462787186875, 'epochs': 318, 'loss': 'mae', 'optimizer': 'adam', 'graph_mode': 'cutoff', 'cutoff': 0.5588434563909187, 'grm_norm': 'cosine_then_gcn', 'self_loops': False, 'use_snp_selection': True, 'num_snps': 51515}. Best is trial 107 with value: 0.11409765987497401.
[I 2025-11-03 12:21:12,967] Trial 111 finished with value: 0.09366744049047336 and parameters: {'model_type': 'graphsage', 'hidden_dims': '[512, 128]', 'dropout': 0.12850401871672815, 'batch_norm': False, 'lr': 0.0004185332388113754, 'weight_decay': 0.0002738489793629123, 'epochs': 297, 'loss': 'mae', 'optimizer': 'adam', 'graph_mode': 'cutoff', 'cutoff': 0.6092428804239122, 'grm_norm': 'cosine_then_gcn', 'self_loops': False, 'use_snp_selection': True, 'num_snps': 57364}. Best is trial 107 with value: 0.11409765987497401.
[I 2025-11-03 12:21:21,420] Trial 112 finished with value: 0.0826368794612616 and parameters: {'model_type': 'graphsage', 'hidden_dims': '[512, 128]', 'dropout': 0.20238061284325304, 'batch_norm': False, 'lr': 0.00048521838371486624, 'weight_decay': 0.000221283306020488, 'epochs': 308, 'loss': 'mae', 'optimizer': 'adam', 'graph_mode': 'cutoff', 'cutoff': 0.5944028034549609, 'grm_norm': 'cosine_then_gcn', 'self_loops': False, 'use_snp_selection': True, 'num_snps': 57808}. Best is trial 107 with value: 0.11409765987497401.
[I 2025-11-03 12:21:29,243] Trial 113 finished with value: 0.03464716333482048 and parameters: {'model_type': 'graphsage', 'hidden_dims': '[512, 128]', 'dropout': 0.29813216983033647, 'batch_norm': False, 'lr': 0.0007394747999560237, 'weight_decay': 0.00029772445721449914, 'epochs': 275, 'loss': 'mae', 'optimizer': 'adam', 'graph_mode': 'cutoff', 'cutoff': 0.6464815044473271, 'grm_norm': 'cosine_then_gcn', 'self_loops': False, 'use_snp_selection': True, 'num_snps': 56531}. Best is trial 107 with value: 0.11409765987497401.
[I 2025-11-03 12:21:36,914] Trial 114 finished with value: 0.07933210801316087 and parameters: {'model_type': 'graphsage', 'hidden_dims': '[512, 128]', 'dropout': 0.26045005423357687, 'batch_norm': False, 'lr': 0.0003209642808161422, 'weight_decay': 0.0004973157920304368, 'epochs': 286, 'loss': 'mae', 'optimizer': 'adam', 'graph_mode': 'cutoff', 'cutoff': 0.5422600999105559, 'grm_norm': 'cosine_then_gcn', 'self_loops': False, 'use_snp_selection': True, 'num_snps': 53487}. Best is trial 107 with value: 0.11409765987497401.
[I 2025-11-03 12:21:45,740] Trial 115 finished with value: 0.04993144922625276 and parameters: {'model_type': 'graphsage', 'hidden_dims': '[512, 128]', 'dropout': 0.2774709790660424, 'batch_norm': False, 'lr': 0.0009881175205848484, 'weight_decay': 0.00014264565417048574, 'epochs': 325, 'loss': 'mae', 'optimizer': 'adam', 'graph_mode': 'cutoff', 'cutoff': 0.5805112383009167, 'grm_norm': 'cosine_then_gcn', 'self_loops': False, 'use_snp_selection': True, 'num_snps': 58984}. Best is trial 107 with value: 0.11409765987497401.
[I 2025-11-03 12:21:52,790] Trial 116 finished with value: 0.07140449436877766 and parameters: {'model_type': 'graphsage', 'hidden_dims': '[512, 128]', 'dropout': 0.1932036563881259, 'batch_norm': True, 'lr': 0.0006279349494472276, 'weight_decay': 0.00019502888868043678, 'epochs': 315, 'loss': 'mae', 'optimizer': 'adam', 'graph_mode': 'cutoff', 'cutoff': 0.7024321778258344, 'grm_norm': 'none', 'self_loops': False, 'use_snp_selection': False}. Best is trial 107 with value: 0.11409765987497401.
[I 2025-11-03 12:22:01,232] Trial 117 finished with value: 0.0802176000383666 and parameters: {'model_type': 'graphsage', 'hidden_dims': '[512, 128]', 'dropout': 0.2365175559036474, 'batch_norm': False, 'lr': 3.5954969700590626e-05, 'weight_decay': 0.0003491675675873367, 'epochs': 337, 'loss': 'mae', 'optimizer': 'adam', 'graph_mode': 'cutoff', 'cutoff': 0.6281940566215886, 'grm_norm': 'cosine', 'self_loops': False, 'use_snp_selection': True, 'num_snps': 55082}. Best is trial 107 with value: 0.11409765987497401.
[I 2025-11-03 12:22:08,549] Trial 118 finished with value: 0.08198873436007746 and parameters: {'model_type': 'graphsage', 'hidden_dims': '[512, 128]', 'dropout': 0.3184538333674843, 'batch_norm': False, 'lr': 0.0004735390785921576, 'weight_decay': 0.00026411976195517885, 'epochs': 295, 'loss': 'mae', 'optimizer': 'adam', 'graph_mode': 'cutoff', 'cutoff': 0.6042446615576671, 'grm_norm': 'gcn', 'self_loops': True, 'use_snp_selection': True, 'num_snps': 49361}. Best is trial 107 with value: 0.11409765987497401.
[I 2025-11-03 12:22:17,015] Trial 119 finished with value: 0.09523800184353916 and parameters: {'model_type': 'graphsage', 'hidden_dims': '[512, 256]', 'dropout': 0.26915105094833625, 'batch_norm': False, 'lr': 0.00020545764430568965, 'weight_decay': 0.00021139857516387235, 'epochs': 323, 'loss': 'mae', 'optimizer': 'adam', 'graph_mode': 'cutoff', 'cutoff': 0.8307724104764063, 'grm_norm': 'cosine_then_gcn', 'self_loops': False, 'use_snp_selection': True, 'num_snps': 56355}. Best is trial 107 with value: 0.11409765987497401.
[I 2025-11-03 12:22:24,904] Trial 120 finished with value: 0.08715883751990773 and parameters: {'model_type': 'graphsage', 'hidden_dims': '[512, 128]', 'dropout': 0.14032386191214824, 'batch_norm': False, 'lr': 0.00035622660772306454, 'weight_decay': 6.938784157270083e-05, 'epochs': 313, 'loss': 'mae', 'optimizer': 'adam', 'graph_mode': 'cutoff', 'cutoff': 0.5652728539726501, 'grm_norm': 'cosine_then_gcn', 'self_loops': False, 'use_snp_selection': True, 'num_snps': 52359}. Best is trial 107 with value: 0.11409765987497401.
[I 2025-11-03 12:22:33,265] Trial 121 finished with value: 0.10145699528857882 and parameters: {'model_type': 'graphsage', 'hidden_dims': '[512, 128]', 'dropout': 0.14708040078168688, 'batch_norm': False, 'lr': 0.0002458076756481625, 'weight_decay': 1.4571143181506588e-05, 'epochs': 332, 'loss': 'mae', 'optimizer': 'adam', 'graph_mode': 'cutoff', 'cutoff': 0.605092572357264, 'grm_norm': 'cosine_then_gcn', 'self_loops': False, 'use_snp_selection': True, 'num_snps': 54282}. Best is trial 107 with value: 0.11409765987497401.
[I 2025-11-03 12:22:41,622] Trial 122 finished with value: 0.09609149940271913 and parameters: {'model_type': 'graphsage', 'hidden_dims': '[512, 128]', 'dropout': 0.13130266947985883, 'batch_norm': False, 'lr': 0.0002753669324857293, 'weight_decay': 1.199391885825798e-05, 'epochs': 332, 'loss': 'mae', 'optimizer': 'adam', 'graph_mode': 'cutoff', 'cutoff': 0.6034500450707068, 'grm_norm': 'cosine_then_gcn', 'self_loops': False, 'use_snp_selection': True, 'num_snps': 54087}. Best is trial 107 with value: 0.11409765987497401.
[I 2025-11-03 12:22:49,985] Trial 123 finished with value: 0.09191344443658572 and parameters: {'model_type': 'graphsage', 'hidden_dims': '[512, 128]', 'dropout': 0.15806755037695808, 'batch_norm': False, 'lr': 0.000442502803359625, 'weight_decay': 1.554222421518705e-05, 'epochs': 304, 'loss': 'mae', 'optimizer': 'adam', 'graph_mode': 'cutoff', 'cutoff': 0.588639017458325, 'grm_norm': 'cosine_then_gcn', 'self_loops': False, 'use_snp_selection': True, 'num_snps': 57501}. Best is trial 107 with value: 0.11409765987497401.
[I 2025-11-03 12:22:58,901] Trial 124 finished with value: 0.07985806377913733 and parameters: {'model_type': 'graphsage', 'hidden_dims': '[512, 128]', 'dropout': 0.18102464020463127, 'batch_norm': False, 'lr': 0.0003089386010695451, 'weight_decay': 2.976963678292043e-06, 'epochs': 328, 'loss': 'mae', 'optimizer': 'adam', 'graph_mode': 'cutoff', 'cutoff': 0.6673012777935049, 'grm_norm': 'cosine_then_gcn', 'self_loops': False, 'use_snp_selection': True, 'num_snps': 59850}. Best is trial 107 with value: 0.11409765987497401.
[I 2025-11-03 12:23:03,416] Trial 125 finished with value: 0.08256489540537693 and parameters: {'model_type': 'graphsage', 'hidden_dims': '[128, 64]', 'dropout': 0.21161653331656122, 'batch_norm': False, 'lr': 0.0002403954486272579, 'weight_decay': 0.00011426422486017538, 'epochs': 339, 'loss': 'mse', 'optimizer': 'adam', 'graph_mode': 'cutoff', 'cutoff': 0.6284287663153388, 'grm_norm': 'cosine_then_gcn', 'self_loops': False, 'use_snp_selection': True, 'num_snps': 50897}. Best is trial 107 with value: 0.11409765987497401.
[I 2025-11-03 12:23:11,650] Trial 126 finished with value: 0.08402012571215658 and parameters: {'model_type': 'graphsage', 'hidden_dims': '[512, 128]', 'dropout': 0.11931012413359626, 'batch_norm': False, 'lr': 0.0003728354778927205, 'weight_decay': 0.0003971296237086694, 'epochs': 319, 'loss': 'mae', 'optimizer': 'adam', 'graph_mode': 'cutoff', 'cutoff': 0.5541949685680688, 'grm_norm': 'cosine_then_gcn', 'self_loops': False, 'use_snp_selection': True, 'num_snps': 54266}. Best is trial 107 with value: 0.11409765987497401.
[I 2025-11-03 12:23:15,391] Trial 127 finished with value: 0.0872326687759236 and parameters: {'model_type': 'graphsage', 'hidden_dims': '[512, 128]', 'dropout': 0.14773615005523735, 'batch_norm': False, 'lr': 0.00021231625309037108, 'weight_decay': 2.5185450754665503e-05, 'epochs': 308, 'loss': 'mae', 'optimizer': 'adam', 'graph_mode': 'cutoff', 'cutoff': 0.5780920310640294, 'grm_norm': 'cosine_then_gcn', 'self_loops': False, 'use_snp_selection': True, 'num_snps': 16988}. Best is trial 107 with value: 0.11409765987497401.
[I 2025-11-03 12:23:21,272] Trial 128 finished with value: 0.06982230988329373 and parameters: {'model_type': 'graphsage', 'hidden_dims': '[256, 128, 64]', 'dropout': 0.30384071285856856, 'batch_norm': False, 'lr': 0.00015418645885132603, 'weight_decay': 0.0001680422679394208, 'epochs': 294, 'loss': 'mae', 'optimizer': 'adam', 'graph_mode': 'cutoff', 'cutoff': 0.6845440900100318, 'grm_norm': 'cosine_then_gcn', 'self_loops': False, 'use_snp_selection': True, 'num_snps': 56045}. Best is trial 107 with value: 0.11409765987497401.
[I 2025-11-03 12:23:29,788] Trial 129 finished with value: 0.09747665026199541 and parameters: {'model_type': 'graphsage', 'hidden_dims': '[512, 128]', 'dropout': 0.28895820485543106, 'batch_norm': False, 'lr': 0.00029667585502927334, 'weight_decay': 0.0003138965401807659, 'epochs': 315, 'loss': 'mae', 'optimizer': 'adam', 'graph_mode': 'cutoff', 'cutoff': 0.6118650250975604, 'grm_norm': 'cosine_then_gcn', 'self_loops': False, 'use_snp_selection': True, 'num_snps': 58004}. Best is trial 107 with value: 0.11409765987497401.
[I 2025-11-03 12:23:38,929] Trial 130 finished with value: 0.08338508645529931 and parameters: {'model_type': 'graphsage', 'hidden_dims': '[512, 128]', 'dropout': 0.28595992300801165, 'batch_norm': False, 'lr': 9.663142021710035e-05, 'weight_decay': 0.00056888491572749, 'epochs': 322, 'loss': 'mae', 'optimizer': 'adam', 'graph_mode': 'cutoff', 'cutoff': 0.4991295826109156, 'grm_norm': 'cosine_then_gcn', 'self_loops': False, 'use_snp_selection': True, 'num_snps': 58612}. Best is trial 107 with value: 0.11409765987497401.
[I 2025-11-03 12:23:47,265] Trial 131 finished with value: 0.059895920950780446 and parameters: {'model_type': 'graphsage', 'hidden_dims': '[512, 128]', 'dropout': 0.3362317028118845, 'batch_norm': False, 'lr': 0.0002837070764569008, 'weight_decay': 0.00032913697345133045, 'epochs': 303, 'loss': 'mae', 'optimizer': 'adam', 'graph_mode': 'cutoff', 'cutoff': 0.6429499873050873, 'grm_norm': 'cosine_then_gcn', 'self_loops': False, 'use_snp_selection': True, 'num_snps': 57767}. Best is trial 107 with value: 0.11409765987497401.
[I 2025-11-03 12:23:55,585] Trial 132 finished with value: 0.08337171061182609 and parameters: {'model_type': 'graphsage', 'hidden_dims': '[512, 128]', 'dropout': 0.29381786997149917, 'batch_norm': False, 'lr': 0.00018592233505551858, 'weight_decay': 0.0002488752287860198, 'epochs': 313, 'loss': 'mae', 'optimizer': 'adam', 'graph_mode': 'cutoff', 'cutoff': 0.6112785838878989, 'grm_norm': 'cosine_then_gcn', 'self_loops': False, 'use_snp_selection': True, 'num_snps': 56737}. Best is trial 107 with value: 0.11409765987497401.
[I 2025-11-03 12:24:04,016] Trial 133 finished with value: 0.06227646754428847 and parameters: {'model_type': 'graphsage', 'hidden_dims': '[512, 128]', 'dropout': 0.2566892668098439, 'batch_norm': False, 'lr': 0.00042048580136014405, 'weight_decay': 0.00044299763874553844, 'epochs': 331, 'loss': 'mae', 'optimizer': 'adam', 'graph_mode': 'cutoff', 'cutoff': 0.5685582713738327, 'grm_norm': 'cosine_then_gcn', 'self_loops': False, 'use_snp_selection': True, 'num_snps': 55207}. Best is trial 107 with value: 0.11409765987497401.
[I 2025-11-03 12:24:11,552] Trial 134 finished with value: 0.09923724640353809 and parameters: {'model_type': 'graphsage', 'hidden_dims': '[512, 128]', 'dropout': 0.16793844018785453, 'batch_norm': False, 'lr': 0.0002447735506641461, 'weight_decay': 7.250552801369528e-06, 'epochs': 284, 'loss': 'mae', 'optimizer': 'adam', 'graph_mode': 'cutoff', 'cutoff': 0.5954979028444742, 'grm_norm': 'cosine_then_gcn', 'self_loops': False, 'use_snp_selection': True, 'num_snps': 52733}. Best is trial 107 with value: 0.11409765987497401.
[I 2025-11-03 12:24:18,686] Trial 135 finished with value: 0.08380154331627741 and parameters: {'model_type': 'graphsage', 'hidden_dims': '[512, 128]', 'dropout': 0.27424352486052456, 'batch_norm': False, 'lr': 0.00023881317335667645, 'weight_decay': 7.009836258356797e-06, 'epochs': 251, 'loss': 'mae', 'optimizer': 'adam', 'graph_mode': 'cutoff', 'cutoff': 0.6191379821213546, 'grm_norm': 'cosine_then_gcn', 'self_loops': False, 'use_snp_selection': True, 'num_snps': 52601}. Best is trial 107 with value: 0.11409765987497401.
[I 2025-11-03 12:24:26,504] Trial 136 finished with value: 0.06635521451434175 and parameters: {'model_type': 'graphsage', 'hidden_dims': '[512, 128]', 'dropout': 0.16982438347873272, 'batch_norm': False, 'lr': 0.0003095360346292812, 'weight_decay': 1.109269670061041e-05, 'epochs': 287, 'loss': 'mae', 'optimizer': 'adam', 'graph_mode': 'cutoff', 'cutoff': 0.5400190871657647, 'grm_norm': 'none', 'self_loops': False, 'use_snp_selection': True, 'num_snps': 53741}. Best is trial 107 with value: 0.11409765987497401.
[I 2025-11-03 12:24:33,018] Trial 137 finished with value: 0.07889348325286799 and parameters: {'model_type': 'graphsage', 'hidden_dims': '[512, 128]', 'dropout': 0.3099429518619364, 'batch_norm': True, 'lr': 0.000168713359378565, 'weight_decay': 8.886229817412282e-06, 'epochs': 275, 'loss': 'mae', 'optimizer': 'adam', 'graph_mode': 'cutoff', 'cutoff': 0.5867518549771358, 'grm_norm': 'cosine_then_gcn', 'self_loops': True, 'use_snp_selection': False}. Best is trial 107 with value: 0.11409765987497401.
[I 2025-11-03 12:24:39,800] Trial 138 finished with value: 0.06244136088312256 and parameters: {'model_type': 'graphsage', 'hidden_dims': '[512, 64]', 'dropout': 0.2473603490520093, 'batch_norm': False, 'lr': 0.00021325621464690568, 'weight_decay': 4.200649403529454e-05, 'epochs': 234, 'loss': 'mae', 'optimizer': 'adam', 'graph_mode': 'cutoff', 'cutoff': 0.5281410233516518, 'grm_norm': 'cosine', 'self_loops': False, 'use_snp_selection': True, 'num_snps': 50433}. Best is trial 107 with value: 0.11409765987497401.
[I 2025-11-03 12:24:49,219] Trial 139 finished with value: 0.06229610770627994 and parameters: {'model_type': 'graphsage', 'hidden_dims': '[512, 256]', 'dropout': 0.28255507070760044, 'batch_norm': False, 'lr': 0.00026180039348220013, 'weight_decay': 1.4768550647586796e-05, 'epochs': 299, 'loss': 'mae', 'optimizer': 'adam', 'graph_mode': 'knn', 'source': 'grm', 'knn_k': 9, 'weighted_edges': True, 'symmetrize_mode': 'union', 'use_snp_selection': True, 'num_snps': 48083}. Best is trial 107 with value: 0.11409765987497401.
[I 2025-11-03 12:24:57,870] Trial 140 finished with value: 0.04541321616023319 and parameters: {'model_type': 'graphsage', 'hidden_dims': '[512, 128]', 'dropout': 0.32179125308178025, 'batch_norm': False, 'lr': 0.0003270466425913266, 'weight_decay': 4.18394951611687e-06, 'epochs': 317, 'loss': 'mse', 'optimizer': 'adam', 'graph_mode': 'cutoff', 'cutoff': 0.6250794104168824, 'grm_norm': 'cosine_then_gcn', 'self_loops': False, 'use_snp_selection': True, 'num_snps': 58836}. Best is trial 107 with value: 0.11409765987497401.
[I 2025-11-03 12:25:05,998] Trial 141 finished with value: 0.09522084826460926 and parameters: {'model_type': 'graphsage', 'hidden_dims': '[512, 128]', 'dropout': 0.15082983590177013, 'batch_norm': False, 'lr': 0.0005578677011292696, 'weight_decay': 0.0002972381089447367, 'epochs': 310, 'loss': 'mae', 'optimizer': 'adam', 'graph_mode': 'cutoff', 'cutoff': 0.597404076981136, 'grm_norm': 'cosine_then_gcn', 'self_loops': False, 'use_snp_selection': True, 'num_snps': 54919}. Best is trial 107 with value: 0.11409765987497401.
[I 2025-11-03 12:25:14,502] Trial 142 finished with value: 0.09186285565809739 and parameters: {'model_type': 'graphsage', 'hidden_dims': '[512, 128]', 'dropout': 0.16431571635266107, 'batch_norm': False, 'lr': 0.00037655088397900574, 'weight_decay': 0.00022726908429628284, 'epochs': 326, 'loss': 'mae', 'optimizer': 'adam', 'graph_mode': 'cutoff', 'cutoff': 0.6036186835725975, 'grm_norm': 'cosine_then_gcn', 'self_loops': False, 'use_snp_selection': True, 'num_snps': 56593}. Best is trial 107 with value: 0.11409765987497401.
[I 2025-11-03 12:25:22,214] Trial 143 finished with value: 0.08814228425200815 and parameters: {'model_type': 'graphsage', 'hidden_dims': '[512, 128]', 'dropout': 0.10042182040355443, 'batch_norm': False, 'lr': 0.00023637730718673315, 'weight_decay': 5.366826749450108e-06, 'epochs': 305, 'loss': 'mae', 'optimizer': 'adam', 'graph_mode': 'cutoff', 'cutoff': 0.6542863466098363, 'grm_norm': 'cosine_then_gcn', 'self_loops': False, 'use_snp_selection': True, 'num_snps': 52211}. Best is trial 107 with value: 0.11409765987497401.
[I 2025-11-03 12:25:30,447] Trial 144 finished with value: 0.08766093190265317 and parameters: {'model_type': 'graphsage', 'hidden_dims': '[512, 128]', 'dropout': 0.1905214725964182, 'batch_norm': False, 'lr': 0.00027063899193645064, 'weight_decay': 0.00017655565530335377, 'epochs': 280, 'loss': 'mae', 'optimizer': 'adam', 'graph_mode': 'cutoff', 'cutoff': 0.5634268700943034, 'grm_norm': 'cosine_then_gcn', 'self_loops': False, 'use_snp_selection': True, 'num_snps': 59270}. Best is trial 107 with value: 0.11409765987497401.
[I 2025-11-03 12:25:38,673] Trial 145 finished with value: 0.0668157246459667 and parameters: {'model_type': 'graphsage', 'hidden_dims': '[512, 128]', 'dropout': 0.3003010889068298, 'batch_norm': False, 'lr': 0.0004482581616013947, 'weight_decay': 0.000380820946480099, 'epochs': 294, 'loss': 'mae', 'optimizer': 'adam', 'graph_mode': 'cutoff', 'cutoff': 0.5854119850853153, 'grm_norm': 'gcn', 'self_loops': False, 'use_snp_selection': True, 'num_snps': 57383}. Best is trial 107 with value: 0.11409765987497401.
[I 2025-11-03 12:25:44,563] Trial 146 finished with value: 0.05562630375657299 and parameters: {'model_type': 'graphsage', 'hidden_dims': '[256, 128]', 'dropout': 0.2659544978097668, 'batch_norm': False, 'lr': 1.4414555563139109e-05, 'weight_decay': 0.00013248679346525137, 'epochs': 334, 'loss': 'mae', 'optimizer': 'adam', 'graph_mode': 'cutoff', 'cutoff': 0.6367348399689198, 'grm_norm': 'cosine_then_gcn', 'self_loops': False, 'use_snp_selection': True, 'num_snps': 53225}. Best is trial 107 with value: 0.11409765987497401.
