[I 2025-11-03 11:50:57,290] Trial 1 finished with value: 0.08157570597177372 and parameters: {'model_type': 'gcn', 'hidden_dims': '[128, 64]', 'dropout': 0.40051947670227217, 'batch_norm': True, 'lr': 0.0005320428882732732, 'weight_decay': 1.89210117736594e-06, 'epochs': 32, 'loss': 'mse', 'optimizer': 'adam', 'graph_mode': 'knn', 'source': 'grm', 'knn_k': 7, 'weighted_edges': True, 'symmetrize_mode': 'union', 'use_snp_selection': False}. Best is trial 1 with value: 0.08157570597177372.
[I 2025-11-03 11:50:59,372] Trial 2 finished with value: 0.06328505878957322 and parameters: {'model_type': 'gcn', 'hidden_dims': '[256, 128]', 'dropout': 0.5105528289184642, 'batch_norm': False, 'lr': 0.0006804279372404962, 'weight_decay': 0.0008922815224257085, 'epochs': 160, 'loss': 'mse', 'optimizer': 'adam', 'graph_mode': 'cutoff', 'cutoff': 0.5741905641612706, 'grm_norm': 'gcn', 'self_loops': False, 'use_snp_selection': True, 'num_snps': 26910}. Best is trial 1 with value: 0.08157570597177372.
[I 2025-11-03 11:51:01,537] Trial 3 finished with value: 0.003142448567795669 and parameters: {'model_type': 'gcn', 'hidden_dims': '[256, 128, 64]', 'dropout': 0.5390483213624292, 'batch_norm': False, 'lr': 3.4705625989073525e-05, 'weight_decay': 2.4623319020131338e-05, 'epochs': 92, 'loss': 'mse', 'optimizer': 'adam', 'graph_mode': 'knn', 'source': 'grm', 'knn_k': 6, 'weighted_edges': False, 'symmetrize_mode': 'mutual', 'use_snp_selection': True, 'num_snps': 30713}. Best is trial 1 with value: 0.08157570597177372.
[I 2025-11-03 11:51:03,710] Trial 4 finished with value: -0.008142084915194017 and parameters: {'model_type': 'gcn', 'hidden_dims': '[128, 64]', 'dropout': 0.13404863676897502, 'batch_norm': False, 'lr': 0.0001431556295367288, 'weight_decay': 2.2084517750726675e-05, 'epochs': 13, 'loss': 'mae', 'optimizer': 'adam', 'graph_mode': 'cutoff', 'cutoff': 0.6714268476993044, 'grm_norm': 'none', 'self_loops': False, 'use_snp_selection': True, 'num_snps': 45645}. Best is trial 1 with value: 0.08157570597177372.
[I 2025-11-03 11:51:06,387] Trial 5 finished with value: 0.0363810832065046 and parameters: {'model_type': 'gcn', 'hidden_dims': '[256, 128]', 'dropout': 0.42253606323412096, 'batch_norm': False, 'lr': 4.238630400638805e-05, 'weight_decay': 8.074086040046576e-07, 'epochs': 134, 'loss': 'mae', 'optimizer': 'adam', 'graph_mode': 'knn', 'source': 'grm', 'knn_k': 1, 'weighted_edges': False, 'symmetrize_mode': 'mutual', 'use_snp_selection': True, 'num_snps': 43113}. Best is trial 1 with value: 0.08157570597177372.
[I 2025-11-03 11:51:08,962] Trial 6 finished with value: 0.014700161200172115 and parameters: {'model_type': 'gcn', 'hidden_dims': '[512, 256]', 'dropout': 0.3534893146320237, 'batch_norm': True, 'lr': 0.000251307964226932, 'weight_decay': 1.821819791794022e-05, 'epochs': 207, 'loss': 'mae', 'optimizer': 'adam', 'graph_mode': 'knn', 'source': 'grm', 'knn_k': 1, 'weighted_edges': True, 'symmetrize_mode': 'mutual', 'use_snp_selection': False}. Best is trial 1 with value: 0.08157570597177372.
[I 2025-11-03 11:51:11,220] Trial 7 finished with value: 0.05453965598151219 and parameters: {'model_type': 'gcn', 'hidden_dims': '[512, 256]', 'dropout': 0.1105825955860775, 'batch_norm': True, 'lr': 2.374338412754043e-05, 'weight_decay': 1.1284721123340274e-05, 'epochs': 170, 'loss': 'mse', 'optimizer': 'adam', 'graph_mode': 'cutoff', 'cutoff': 0.719872204109604, 'grm_norm': 'gcn', 'self_loops': False, 'use_snp_selection': False}. Best is trial 1 with value: 0.08157570597177372.
[I 2025-11-03 11:51:12,997] Trial 8 finished with value: 0.04956802236320074 and parameters: {'model_type': 'gcn', 'hidden_dims': '[512, 128]', 'dropout': 0.5066580418354021, 'batch_norm': True, 'lr': 0.00039213678276659976, 'weight_decay': 3.43655320802934e-06, 'epochs': 91, 'loss': 'mse', 'optimizer': 'adam', 'graph_mode': 'cutoff', 'cutoff': 0.34923059576505366, 'grm_norm': 'cosine', 'self_loops': True, 'use_snp_selection': False}. Best is trial 1 with value: 0.08157570597177372.
[I 2025-11-03 11:51:14,604] Trial 9 finished with value: 0.04735448614207679 and parameters: {'model_type': 'gcn', 'hidden_dims': '[512, 256]', 'dropout': 0.301734920240333, 'batch_norm': False, 'lr': 6.650961854953448e-06, 'weight_decay': 6.861575656590315e-05, 'epochs': 125, 'loss': 'mae', 'optimizer': 'adam', 'graph_mode': 'cutoff', 'cutoff': 0.2857569870061939, 'grm_norm': 'cosine_then_gcn', 'self_loops': False, 'use_snp_selection': True, 'num_snps': 12722}. Best is trial 1 with value: 0.08157570597177372.
[I 2025-11-03 11:51:15,912] Trial 10 finished with value: 0.017114720616346783 and parameters: {'model_type': 'gcn', 'hidden_dims': '[512, 64]', 'dropout': 0.2923745636750988, 'batch_norm': True, 'lr': 0.0001000196697725585, 'weight_decay': 1.2618827301366646e-07, 'epochs': 2, 'loss': 'mse', 'optimizer': 'adam', 'graph_mode': 'knn', 'source': 'grm', 'knn_k': 10, 'weighted_edges': True, 'symmetrize_mode': 'union', 'use_snp_selection': False}. Best is trial 1 with value: 0.08157570597177372.
[I 2025-11-03 11:51:17,905] Trial 11 finished with value: 0.04576801070295275 and parameters: {'model_type': 'gcn', 'hidden_dims': '[256, 128]', 'dropout': 0.4214049075657615, 'batch_norm': False, 'lr': 0.0008778492892841868, 'weight_decay': 0.000992538435964661, 'epochs': 244, 'loss': 'mse', 'optimizer': 'adam', 'graph_mode': 'cutoff', 'cutoff': 0.8773959711672632, 'grm_norm': 'gcn', 'self_loops': True, 'use_snp_selection': True, 'num_snps': 16589}. Best is trial 1 with value: 0.08157570597177372.
[I 2025-11-03 11:51:21,739] Trial 12 finished with value: 0.0618306429292218 and parameters: {'model_type': 'gcn', 'hidden_dims': '[256, 128]', 'dropout': 0.568426629270592, 'batch_norm': True, 'lr': 0.0008875187780684412, 'weight_decay': 0.0004898513914360714, 'epochs': 283, 'loss': 'mse', 'optimizer': 'adam', 'graph_mode': 'cutoff', 'cutoff': 0.48181782223539704, 'grm_norm': 'gcn', 'self_loops': False, 'use_snp_selection': True, 'num_snps': 58791}. Best is trial 1 with value: 0.08157570597177372.
[I 2025-11-03 11:51:22,898] Trial 13 finished with value: 0.026037601936744204 and parameters: {'model_type': 'gcn', 'hidden_dims': '[128, 64]', 'dropout': 0.463149119497691, 'batch_norm': False, 'lr': 0.0003914729386696084, 'weight_decay': 1.556479003340889e-06, 'epochs': 51, 'loss': 'mse', 'optimizer': 'adam', 'graph_mode': 'knn', 'source': 'grm', 'knn_k': 5, 'weighted_edges': True, 'symmetrize_mode': 'union', 'use_snp_selection': False}. Best is trial 1 with value: 0.08157570597177372.
[I 2025-11-03 11:51:24,897] Trial 14 finished with value: 0.01957093973628632 and parameters: {'model_type': 'gcn', 'hidden_dims': '[256, 128, 64]', 'dropout': 0.37027437095992005, 'batch_norm': False, 'lr': 0.0009838853509145783, 'weight_decay': 2.612499763810861e-07, 'epochs': 192, 'loss': 'mse', 'optimizer': 'adam', 'graph_mode': 'cutoff', 'cutoff': 0.531893423667369, 'grm_norm': 'cosine_then_gcn', 'self_loops': False, 'use_snp_selection': False}. Best is trial 1 with value: 0.08157570597177372.
[I 2025-11-03 11:51:26,916] Trial 15 finished with value: 0.06557600288415828 and parameters: {'model_type': 'gcn', 'hidden_dims': '[512, 64]', 'dropout': 0.5960169427877031, 'batch_norm': True, 'lr': 0.0001068912485398381, 'weight_decay': 3.525194351311951e-06, 'epochs': 73, 'loss': 'mse', 'optimizer': 'adam', 'graph_mode': 'knn', 'source': 'grm', 'knn_k': 5, 'weighted_edges': True, 'symmetrize_mode': 'union', 'use_snp_selection': True, 'num_snps': 25832}. Best is trial 1 with value: 0.08157570597177372.
[I 2025-11-03 11:51:28,527] Trial 16 finished with value: 0.03744449837767217 and parameters: {'model_type': 'gcn', 'hidden_dims': '[512, 64]', 'dropout': 0.581477624217881, 'batch_norm': True, 'lr': 0.00010054379044807005, 'weight_decay': 2.7313199986375637e-06, 'epochs': 53, 'loss': 'mse', 'optimizer': 'adam', 'graph_mode': 'knn', 'source': 'grm', 'knn_k': 5, 'weighted_edges': True, 'symmetrize_mode': 'union', 'use_snp_selection': False}. Best is trial 1 with value: 0.08157570597177372.
[I 2025-11-03 11:51:29,730] Trial 17 finished with value: 0.019801746586373438 and parameters: {'model_type': 'gcn', 'hidden_dims': '[512, 64]', 'dropout': 0.22452150772383464, 'batch_norm': True, 'lr': 7.483073567339846e-06, 'weight_decay': 5.197825203858167e-07, 'epochs': 53, 'loss': 'mse', 'optimizer': 'adam', 'graph_mode': 'knn', 'source': 'grm', 'knn_k': 7, 'weighted_edges': True, 'symmetrize_mode': 'union', 'use_snp_selection': True, 'num_snps': 4957}. Best is trial 1 with value: 0.08157570597177372.
[I 2025-11-03 11:51:31,600] Trial 18 finished with value: 0.0745345982594294 and parameters: {'model_type': 'gcn', 'hidden_dims': '[512, 128]', 'dropout': 0.46791232531457033, 'batch_norm': True, 'lr': 0.00017211584770669025, 'weight_decay': 5.106836458478829e-06, 'epochs': 90, 'loss': 'mse', 'optimizer': 'adam', 'graph_mode': 'knn', 'source': 'grm', 'knn_k': 3, 'weighted_edges': True, 'symmetrize_mode': 'union', 'use_snp_selection': False}. Best is trial 1 with value: 0.08157570597177372.
[I 2025-11-03 11:51:33,573] Trial 19 finished with value: 0.04384638772937812 and parameters: {'model_type': 'gcn', 'hidden_dims': '[512, 128]', 'dropout': 0.41728047269073704, 'batch_norm': True, 'lr': 0.00027160015272997747, 'weight_decay': 5.5778768848812285e-06, 'epochs': 118, 'loss': 'mse', 'optimizer': 'adam', 'graph_mode': 'knn', 'source': 'grm', 'knn_k': 3, 'weighted_edges': False, 'symmetrize_mode': 'union', 'use_snp_selection': False}. Best is trial 1 with value: 0.08157570597177372.
[I 2025-11-03 11:51:35,033] Trial 20 finished with value: 0.043565609490635857 and parameters: {'model_type': 'gcn', 'hidden_dims': '[512, 128]', 'dropout': 0.4625341785504176, 'batch_norm': True, 'lr': 5.860071435171585e-05, 'weight_decay': 1.369952141303372e-06, 'epochs': 31, 'loss': 'mse', 'optimizer': 'adam', 'graph_mode': 'knn', 'source': 'grm', 'knn_k': 3, 'weighted_edges': True, 'symmetrize_mode': 'union', 'use_snp_selection': False}. Best is trial 1 with value: 0.08157570597177372.
[I 2025-11-03 11:51:36,835] Trial 21 finished with value: 0.036295584939559894 and parameters: {'model_type': 'gcn', 'hidden_dims': '[512, 64]', 'dropout': 0.4836628490219156, 'batch_norm': True, 'lr': 0.00020769248358805647, 'weight_decay': 7.537757512062761e-06, 'epochs': 89, 'loss': 'mse', 'optimizer': 'adam', 'graph_mode': 'knn', 'source': 'grm', 'knn_k': 3, 'weighted_edges': True, 'symmetrize_mode': 'union', 'use_snp_selection': False}. Best is trial 1 with value: 0.08157570597177372.
[I 2025-11-03 11:51:38,047] Trial 22 finished with value: 0.04011028563052853 and parameters: {'model_type': 'gcn', 'hidden_dims': '[128, 64]', 'dropout': 0.5973324729107732, 'batch_norm': True, 'lr': 1.9430333498537155e-05, 'weight_decay': 2.58452856373514e-06, 'epochs': 75, 'loss': 'mse', 'optimizer': 'adam', 'graph_mode': 'knn', 'source': 'grm', 'knn_k': 4, 'weighted_edges': True, 'symmetrize_mode': 'union', 'use_snp_selection': False}. Best is trial 1 with value: 0.08157570597177372.
[I 2025-11-03 11:51:39,727] Trial 23 finished with value: -0.0003052299829007714 and parameters: {'model_type': 'gcn', 'hidden_dims': '[512, 128]', 'dropout': 0.3807716375701576, 'batch_norm': True, 'lr': 7.193003868959744e-05, 'weight_decay': 4.393937727763676e-07, 'epochs': 27, 'loss': 'mse', 'optimizer': 'adam', 'graph_mode': 'knn', 'source': 'grm', 'knn_k': 8, 'weighted_edges': True, 'symmetrize_mode': 'union', 'use_snp_selection': True, 'num_snps': 20938}. Best is trial 1 with value: 0.08157570597177372.
[I 2025-11-03 11:51:41,472] Trial 24 finished with value: 0.061950794728455834 and parameters: {'model_type': 'gcn', 'hidden_dims': '[512, 64]', 'dropout': 0.2930283223373026, 'batch_norm': True, 'lr': 0.00045422425120756477, 'weight_decay': 4.189426638370817e-06, 'epochs': 70, 'loss': 'mse', 'optimizer': 'adam', 'graph_mode': 'knn', 'source': 'grm', 'knn_k': 6, 'weighted_edges': True, 'symmetrize_mode': 'union', 'use_snp_selection': False}. Best is trial 1 with value: 0.08157570597177372.
[I 2025-11-03 11:51:42,790] Trial 25 finished with value: 0.06480337490773283 and parameters: {'model_type': 'gcn', 'hidden_dims': '[128, 64]', 'dropout': 0.5414499485992518, 'batch_norm': True, 'lr': 0.00013512286299386273, 'weight_decay': 1.475883985183647e-06, 'epochs': 110, 'loss': 'mse', 'optimizer': 'adam', 'graph_mode': 'knn', 'source': 'grm', 'knn_k': 4, 'weighted_edges': True, 'symmetrize_mode': 'union', 'use_snp_selection': False}. Best is trial 1 with value: 0.08157570597177372.
[I 2025-11-03 11:51:45,810] Trial 26 finished with value: 0.05387772381143723 and parameters: {'model_type': 'gcn', 'hidden_dims': '[512, 128]', 'dropout': 0.3213696628831063, 'batch_norm': True, 'lr': 0.00019568287256932542, 'weight_decay': 6.289354516638318e-05, 'epochs': 144, 'loss': 'mse', 'optimizer': 'adam', 'graph_mode': 'knn', 'source': 'grm', 'knn_k': 7, 'weighted_edges': False, 'symmetrize_mode': 'union', 'use_snp_selection': True, 'num_snps': 43136}. Best is trial 1 with value: 0.08157570597177372.
[I 2025-11-03 11:51:47,168] Trial 27 finished with value: 0.023956205779068 and parameters: {'model_type': 'gcn', 'hidden_dims': '[256, 128, 64]', 'dropout': 0.39720846225939416, 'batch_norm': True, 'lr': 1.569899103548917e-05, 'weight_decay': 9.375113222636938e-06, 'epochs': 42, 'loss': 'mae', 'optimizer': 'adam', 'graph_mode': 'knn', 'source': 'grm', 'knn_k': 10, 'weighted_edges': True, 'symmetrize_mode': 'union', 'use_snp_selection': False}. Best is trial 1 with value: 0.08157570597177372.
[I 2025-11-03 11:51:48,142] Trial 28 finished with value: 0.010367399168273181 and parameters: {'model_type': 'gcn', 'hidden_dims': '[128, 64]', 'dropout': 0.4610160500320218, 'batch_norm': True, 'lr': 0.0005329974175762215, 'weight_decay': 0.0001342154225322901, 'epochs': 1, 'loss': 'mse', 'optimizer': 'adam', 'graph_mode': 'knn', 'source': 'grm', 'knn_k': 2, 'weighted_edges': True, 'symmetrize_mode': 'union', 'use_snp_selection': True, 'num_snps': 3079}. Best is trial 1 with value: 0.08157570597177372.
[I 2025-11-03 11:51:51,292] Trial 29 finished with value: 0.06699212476446803 and parameters: {'model_type': 'gcn', 'hidden_dims': '[512, 64]', 'dropout': 0.5432684489414391, 'batch_norm': True, 'lr': 6.752941532961774e-05, 'weight_decay': 8.296518244515818e-07, 'epochs': 305, 'loss': 'mae', 'optimizer': 'adam', 'graph_mode': 'knn', 'source': 'grm', 'knn_k': 4, 'weighted_edges': True, 'symmetrize_mode': 'union', 'use_snp_selection': False}. Best is trial 1 with value: 0.08157570597177372.
[I 2025-11-03 11:51:54,621] Trial 30 finished with value: 0.009217551123444684 and parameters: {'model_type': 'gcn', 'hidden_dims': '[512, 128]', 'dropout': 0.22659780417258904, 'batch_norm': True, 'lr': 1.4562785383138403e-06, 'weight_decay': 1.6344856739923036e-07, 'epochs': 343, 'loss': 'mae', 'optimizer': 'adam', 'graph_mode': 'knn', 'source': 'grm', 'knn_k': 4, 'weighted_edges': False, 'symmetrize_mode': 'mutual', 'use_snp_selection': False}. Best is trial 1 with value: 0.08157570597177372.
[I 2025-11-03 11:51:57,718] Trial 31 finished with value: 0.04227765048061868 and parameters: {'model_type': 'gcn', 'hidden_dims': '[512, 64]', 'dropout': 0.545851816978378, 'batch_norm': True, 'lr': 6.278399937196956e-05, 'weight_decay': 7.530474458329434e-07, 'epochs': 303, 'loss': 'mae', 'optimizer': 'adam', 'graph_mode': 'knn', 'source': 'grm', 'knn_k': 5, 'weighted_edges': True, 'symmetrize_mode': 'union', 'use_snp_selection': False}. Best is trial 1 with value: 0.08157570597177372.
[I 2025-11-03 11:52:00,383] Trial 32 finished with value: -0.012645778005588635 and parameters: {'model_type': 'gcn', 'hidden_dims': '[512, 64]', 'dropout': 0.5112291436107191, 'batch_norm': True, 'lr': 0.000131034662214589, 'weight_decay': 1.8954822082350452e-06, 'epochs': 230, 'loss': 'mae', 'optimizer': 'adam', 'graph_mode': 'knn', 'source': 'grm', 'knn_k': 7, 'weighted_edges': True, 'symmetrize_mode': 'union', 'use_snp_selection': False}. Best is trial 1 with value: 0.08157570597177372.
[I 2025-11-03 11:52:03,534] Trial 33 finished with value: 0.05214134611394657 and parameters: {'model_type': 'gcn', 'hidden_dims': '[512, 64]', 'dropout': 0.5595600423374965, 'batch_norm': True, 'lr': 0.0003137260370630934, 'weight_decay': 8.202700547415015e-07, 'epochs': 314, 'loss': 'mae', 'optimizer': 'adam', 'graph_mode': 'knn', 'source': 'grm', 'knn_k': 2, 'weighted_edges': True, 'symmetrize_mode': 'union', 'use_snp_selection': False}. Best is trial 1 with value: 0.08157570597177372.
[I 2025-11-03 11:52:04,999] Trial 34 finished with value: 0.07200815946803413 and parameters: {'model_type': 'gcn', 'hidden_dims': '[128, 64]', 'dropout': 0.5085796778737509, 'batch_norm': True, 'lr': 3.796118099955677e-05, 'weight_decay': 3.384247640071543e-07, 'epochs': 157, 'loss': 'mae', 'optimizer': 'adam', 'graph_mode': 'knn', 'source': 'grm', 'knn_k': 4, 'weighted_edges': True, 'symmetrize_mode': 'union', 'use_snp_selection': False}. Best is trial 1 with value: 0.08157570597177372.
[I 2025-11-03 11:52:06,465] Trial 35 finished with value: 0.026416874135851868 and parameters: {'model_type': 'gcn', 'hidden_dims': '[128, 64]', 'dropout': 0.5095146872792989, 'batch_norm': True, 'lr': 3.9948589770953345e-05, 'weight_decay': 2.74784907054379e-07, 'epochs': 157, 'loss': 'mae', 'optimizer': 'adam', 'graph_mode': 'knn', 'source': 'grm', 'knn_k': 4, 'weighted_edges': True, 'symmetrize_mode': 'union', 'use_snp_selection': False}. Best is trial 1 with value: 0.08157570597177372.
[I 2025-11-03 11:52:08,236] Trial 36 finished with value: 0.0019831618644246232 and parameters: {'model_type': 'gcn', 'hidden_dims': '[128, 64]', 'dropout': 0.4470454929696658, 'batch_norm': True, 'lr': 1.0948355451303202e-05, 'weight_decay': 2.9184102113380314e-07, 'epochs': 260, 'loss': 'mae', 'optimizer': 'adam', 'graph_mode': 'knn', 'source': 'grm', 'knn_k': 2, 'weighted_edges': True, 'symmetrize_mode': 'union', 'use_snp_selection': False}. Best is trial 1 with value: 0.08157570597177372.
[I 2025-11-03 11:52:09,551] Trial 37 finished with value: 0.05843753212069518 and parameters: {'model_type': 'gcn', 'hidden_dims': '[128, 64]', 'dropout': 0.48567054108179863, 'batch_norm': True, 'lr': 2.8821050099621663e-05, 'weight_decay': 8.645558643378955e-07, 'epochs': 108, 'loss': 'mae', 'optimizer': 'adam', 'graph_mode': 'knn', 'source': 'grm', 'knn_k': 3, 'weighted_edges': True, 'symmetrize_mode': 'union', 'use_snp_selection': False}. Best is trial 1 with value: 0.08157570597177372.
[I 2025-11-03 11:52:11,113] Trial 38 finished with value: 0.028670398179058795 and parameters: {'model_type': 'gcn', 'hidden_dims': '[128, 64]', 'dropout': 0.5245387558969616, 'batch_norm': False, 'lr': 4.7674835615758504e-05, 'weight_decay': 2.8484501184018403e-05, 'epochs': 202, 'loss': 'mae', 'optimizer': 'adam', 'graph_mode': 'knn', 'source': 'grm', 'knn_k': 8, 'weighted_edges': True, 'symmetrize_mode': 'mutual', 'use_snp_selection': False}. Best is trial 1 with value: 0.08157570597177372.
[I 2025-11-03 11:52:13,432] Trial 39 finished with value: 0.08094339904035736 and parameters: {'model_type': 'gcn', 'hidden_dims': '[512, 256]', 'dropout': 0.48450216576776306, 'batch_norm': True, 'lr': 0.0006357941031228059, 'weight_decay': 1.614122036885397e-05, 'epochs': 171, 'loss': 'mae', 'optimizer': 'adam', 'graph_mode': 'knn', 'source': 'grm', 'knn_k': 9, 'weighted_edges': True, 'symmetrize_mode': 'union', 'use_snp_selection': False}. Best is trial 1 with value: 0.08157570597177372.
[I 2025-11-03 11:52:15,761] Trial 40 finished with value: 0.0427515229910309 and parameters: {'model_type': 'gcn', 'hidden_dims': '[512, 256]', 'dropout': 0.42804710080754693, 'batch_norm': True, 'lr': 3.4590135707013163e-06, 'weight_decay': 1.8383328806530753e-05, 'epochs': 184, 'loss': 'mae', 'optimizer': 'adam', 'graph_mode': 'cutoff', 'cutoff': 0.2193819224884085, 'grm_norm': 'none', 'self_loops': True, 'use_snp_selection': False}. Best is trial 1 with value: 0.08157570597177372.
[I 2025-11-03 11:52:17,995] Trial 41 finished with value: 0.07088207398236815 and parameters: {'model_type': 'gcn', 'hidden_dims': '[512, 256]', 'dropout': 0.4904930299776094, 'batch_norm': True, 'lr': 0.0006139640626558678, 'weight_decay': 3.674464580876507e-05, 'epochs': 156, 'loss': 'mae', 'optimizer': 'adam', 'graph_mode': 'knn', 'source': 'grm', 'knn_k': 9, 'weighted_edges': True, 'symmetrize_mode': 'union', 'use_snp_selection': False}. Best is trial 1 with value: 0.08157570597177372.
[I 2025-11-03 11:52:20,189] Trial 42 finished with value: 0.07209535716204529 and parameters: {'model_type': 'gcn', 'hidden_dims': '[512, 256]', 'dropout': 0.4896740878442404, 'batch_norm': True, 'lr': 0.0005269388463255212, 'weight_decay': 3.8786199274965945e-05, 'epochs': 150, 'loss': 'mae', 'optimizer': 'adam', 'graph_mode': 'knn', 'source': 'grm', 'knn_k': 9, 'weighted_edges': True, 'symmetrize_mode': 'union', 'use_snp_selection': False}. Best is trial 1 with value: 0.08157570597177372.
[I 2025-11-03 11:52:22,283] Trial 43 finished with value: 0.04429406024828372 and parameters: {'model_type': 'gcn', 'hidden_dims': '[512, 256]', 'dropout': 0.44102935585665143, 'batch_norm': True, 'lr': 0.0006015033514387892, 'weight_decay': 0.00015557452998412545, 'epochs': 135, 'loss': 'mae', 'optimizer': 'adam', 'graph_mode': 'knn', 'source': 'grm', 'knn_k': 9, 'weighted_edges': False, 'symmetrize_mode': 'mutual', 'use_snp_selection': False}. Best is trial 1 with value: 0.08157570597177372.
[I 2025-11-03 11:52:24,891] Trial 44 finished with value: 0.04743696113511135 and parameters: {'model_type': 'gcn', 'hidden_dims': '[512, 256]', 'dropout': 0.3363442443023169, 'batch_norm': False, 'lr': 0.00035799635674878505, 'weight_decay': 1.3182018523109726e-05, 'epochs': 226, 'loss': 'mae', 'optimizer': 'adam', 'graph_mode': 'knn', 'source': 'grm', 'knn_k': 9, 'weighted_edges': True, 'symmetrize_mode': 'union', 'use_snp_selection': False}. Best is trial 1 with value: 0.08157570597177372.
