[I 2025-11-03 13:16:32,827] Trial 90 finished with value: 0.06500372267960709 and parameters: {'model_type': 'gcn', 'hidden_dims': '[512, 128]', 'dropout': 0.3348862957037628, 'batch_norm': True, 'lr': 0.0003254379221639787, 'weight_decay': 1.1431672601437798e-06, 'epochs': 259, 'loss': 'mse', 'optimizer': 'adam', 'graph_mode': 'off', 'use_snp_selection': False}. Best is trial 71 with value: 0.07153641871066653.
[I 2025-11-03 13:16:34,713] Trial 91 finished with value: 0.056118548504862975 and parameters: {'model_type': 'gcn', 'hidden_dims': '[512, 128]', 'dropout': 0.3400466991684041, 'batch_norm': True, 'lr': 0.0003106267824561317, 'weight_decay': 2.4265883132400716e-06, 'epochs': 261, 'loss': 'mse', 'optimizer': 'adam', 'graph_mode': 'off', 'use_snp_selection': False}. Best is trial 71 with value: 0.07153641871066653.
[I 2025-11-03 13:16:36,489] Trial 92 finished with value: 0.049960791246767305 and parameters: {'model_type': 'gcn', 'hidden_dims': '[512, 128]', 'dropout': 0.38280562275516616, 'batch_norm': True, 'lr': 0.00015371720237237018, 'weight_decay': 8.457192142213983e-07, 'epochs': 236, 'loss': 'mse', 'optimizer': 'adam', 'graph_mode': 'off', 'use_snp_selection': False}. Best is trial 71 with value: 0.07153641871066653.
[I 2025-11-03 13:16:38,241] Trial 93 finished with value: 0.057856153215415186 and parameters: {'model_type': 'gcn', 'hidden_dims': '[512, 128]', 'dropout': 0.32762251359957817, 'batch_norm': True, 'lr': 0.0004306819830717463, 'weight_decay': 1.2177258420821778e-06, 'epochs': 226, 'loss': 'mse', 'optimizer': 'adam', 'graph_mode': 'off', 'use_snp_selection': False}. Best is trial 71 with value: 0.07153641871066653.
[I 2025-11-03 13:16:40,119] Trial 94 finished with value: 0.05292386287620848 and parameters: {'model_type': 'gcn', 'hidden_dims': '[512, 128]', 'dropout': 0.35391986146077764, 'batch_norm': True, 'lr': 0.0006326386653917001, 'weight_decay': 2.0905832910412263e-07, 'epochs': 251, 'loss': 'mse', 'optimizer': 'adam', 'graph_mode': 'off', 'use_snp_selection': False}. Best is trial 71 with value: 0.07153641871066653.
[I 2025-11-03 13:16:41,155] Trial 95 finished with value: 0.05690874821569084 and parameters: {'model_type': 'gcn', 'hidden_dims': '[128, 64]', 'dropout': 0.39936132941694563, 'batch_norm': True, 'lr': 0.0002295215901483423, 'weight_decay': 3.797014272850061e-07, 'epochs': 209, 'loss': 'mse', 'optimizer': 'adam', 'graph_mode': 'off', 'use_snp_selection': False}. Best is trial 71 with value: 0.07153641871066653.
[I 2025-11-03 13:16:42,646] Trial 96 finished with value: 0.0620904550598962 and parameters: {'model_type': 'gcn', 'hidden_dims': '[512, 256]', 'dropout': 0.15350569810775375, 'batch_norm': True, 'lr': 0.0003490090192308232, 'weight_decay': 1.1986265386557223e-07, 'epochs': 171, 'loss': 'mse', 'optimizer': 'adam', 'graph_mode': 'off', 'use_snp_selection': False}. Best is trial 71 with value: 0.07153641871066653.
[I 2025-11-03 13:16:44,556] Trial 97 finished with value: 0.052486964580909116 and parameters: {'model_type': 'gcn', 'hidden_dims': '[512, 256]', 'dropout': 0.42019492485261584, 'batch_norm': True, 'lr': 0.0005792186255462624, 'weight_decay': 5.233037390454423e-07, 'epochs': 267, 'loss': 'mse', 'optimizer': 'adam', 'graph_mode': 'off', 'use_snp_selection': False}. Best is trial 71 with value: 0.07153641871066653.
[I 2025-11-03 13:16:45,492] Trial 98 finished with value: 0.022830717293300037 and parameters: {'model_type': 'gcn', 'hidden_dims': '[256, 128, 64]', 'dropout': 0.5710895889899552, 'batch_norm': True, 'lr': 0.00018474539383309333, 'weight_decay': 1.5937472656761112e-05, 'epochs': 89, 'loss': 'mse', 'optimizer': 'adam', 'graph_mode': 'off', 'use_snp_selection': False}. Best is trial 71 with value: 0.07153641871066653.
[I 2025-11-03 13:16:47,525] Trial 99 finished with value: 0.018798775699243715 and parameters: {'model_type': 'gcn', 'hidden_dims': '[512, 256]', 'dropout': 0.28639135007393324, 'batch_norm': False, 'lr': 0.0002980747680288284, 'weight_decay': 1.5460214607334593e-07, 'epochs': 296, 'loss': 'mae', 'optimizer': 'adam', 'graph_mode': 'off', 'use_snp_selection': False}. Best is trial 71 with value: 0.07153641871066653.
[I 2025-11-03 13:16:49,384] Trial 100 finished with value: 0.06112495578214102 and parameters: {'model_type': 'gcn', 'hidden_dims': '[512, 64]', 'dropout': 0.30862217172794504, 'batch_norm': True, 'lr': 8.926301382560767e-05, 'weight_decay': 1.8795897930174827e-06, 'epochs': 256, 'loss': 'mse', 'optimizer': 'adam', 'graph_mode': 'off', 'use_snp_selection': False}. Best is trial 71 with value: 0.07153641871066653.
[I 2025-11-03 13:16:50,849] Trial 101 finished with value: 0.05892532089238431 and parameters: {'model_type': 'gcn', 'hidden_dims': '[512, 256]', 'dropout': 0.15219766854142877, 'batch_norm': True, 'lr': 0.00035496299104359957, 'weight_decay': 1.2346767855027628e-07, 'epochs': 164, 'loss': 'mse', 'optimizer': 'adam', 'graph_mode': 'off', 'use_snp_selection': False}. Best is trial 71 with value: 0.07153641871066653.
[I 2025-11-03 13:16:52,706] Trial 102 finished with value: 0.03978663623979503 and parameters: {'model_type': 'gcn', 'hidden_dims': '[512, 256]', 'dropout': 0.1914720747126695, 'batch_norm': True, 'lr': 0.0002711802580448427, 'weight_decay': 1.7213503665825776e-07, 'epochs': 242, 'loss': 'mse', 'optimizer': 'adam', 'graph_mode': 'off', 'use_snp_selection': False}. Best is trial 71 with value: 0.07153641871066653.
[I 2025-11-03 13:16:53,736] Trial 103 finished with value: 0.03980910991541016 and parameters: {'model_type': 'gcn', 'hidden_dims': '[512, 256]', 'dropout': 0.14349709260872565, 'batch_norm': True, 'lr': 0.0003560924308869597, 'weight_decay': 1.1248050580140313e-07, 'epochs': 73, 'loss': 'mse', 'optimizer': 'adam', 'graph_mode': 'off', 'use_snp_selection': False}. Best is trial 71 with value: 0.07153641871066653.
[I 2025-11-03 13:16:55,431] Trial 104 finished with value: 0.0693627354403611 and parameters: {'model_type': 'gcn', 'hidden_dims': '[512, 256]', 'dropout': 0.2211962189551191, 'batch_norm': True, 'lr': 0.0007627300792049282, 'weight_decay': 2.2407850118697262e-07, 'epochs': 217, 'loss': 'mse', 'optimizer': 'adam', 'graph_mode': 'off', 'use_snp_selection': False}. Best is trial 71 with value: 0.07153641871066653.
[I 2025-11-03 13:16:57,172] Trial 105 finished with value: 0.056200170214409026 and parameters: {'model_type': 'gcn', 'hidden_dims': '[512, 256]', 'dropout': 0.21904463264892973, 'batch_norm': True, 'lr': 0.0006998860995118658, 'weight_decay': 2.3206774573353624e-07, 'epochs': 218, 'loss': 'mse', 'optimizer': 'adam', 'graph_mode': 'off', 'use_snp_selection': False}. Best is trial 71 with value: 0.07153641871066653.
[I 2025-11-03 13:16:58,783] Trial 106 finished with value: 0.055755358996697736 and parameters: {'model_type': 'gcn', 'hidden_dims': '[512, 128]', 'dropout': 0.33306965430915325, 'batch_norm': True, 'lr': 0.0008407994664957308, 'weight_decay': 3.296603653671329e-07, 'epochs': 232, 'loss': 'mse', 'optimizer': 'adam', 'graph_mode': 'off', 'use_snp_selection': True, 'num_snps': 25957}. Best is trial 71 with value: 0.07153641871066653.
[I 2025-11-03 13:17:01,109] Trial 107 finished with value: 0.05522649678951334 and parameters: {'model_type': 'gcn', 'hidden_dims': '[512, 256]', 'dropout': 0.2416922705602905, 'batch_norm': True, 'lr': 0.0004907837730809239, 'weight_decay': 1.2341655238483388e-05, 'epochs': 350, 'loss': 'mse', 'optimizer': 'adam', 'graph_mode': 'off', 'use_snp_selection': False}. Best is trial 71 with value: 0.07153641871066653.
[I 2025-11-03 13:17:03,387] Trial 108 finished with value: 0.03714710022199767 and parameters: {'model_type': 'gcn', 'hidden_dims': '[512, 256]', 'dropout': 0.2652896133171027, 'batch_norm': True, 'lr': 1.1914856927658073e-05, 'weight_decay': 7.141703226371706e-06, 'epochs': 339, 'loss': 'mse', 'optimizer': 'adam', 'graph_mode': 'off', 'use_snp_selection': False}. Best is trial 71 with value: 0.07153641871066653.
[I 2025-11-03 13:17:05,073] Trial 109 finished with value: 0.04734366844864588 and parameters: {'model_type': 'gcn', 'hidden_dims': '[512, 256]', 'dropout': 0.22682530192947434, 'batch_norm': True, 'lr': 0.0009751986213382514, 'weight_decay': 2.0269457729324684e-05, 'epochs': 206, 'loss': 'mse', 'optimizer': 'adam', 'graph_mode': 'off', 'use_snp_selection': False}. Best is trial 71 with value: 0.07153641871066653.
[I 2025-11-03 13:17:06,022] Trial 110 finished with value: 0.046087011106783135 and parameters: {'model_type': 'gcn', 'hidden_dims': '[512, 256]', 'dropout': 0.32082528222293427, 'batch_norm': True, 'lr': 0.0007493314065631276, 'weight_decay': 2.7950593038873047e-07, 'epochs': 53, 'loss': 'mse', 'optimizer': 'adam', 'graph_mode': 'off', 'use_snp_selection': False}. Best is trial 71 with value: 0.07153641871066653.
[I 2025-11-03 13:17:06,976] Trial 111 finished with value: 0.05240762257549525 and parameters: {'model_type': 'gcn', 'hidden_dims': '[512, 256]', 'dropout': 0.17646047522900507, 'batch_norm': True, 'lr': 0.0004089712336391298, 'weight_decay': 1.2270741404625134e-07, 'epochs': 45, 'loss': 'mse', 'optimizer': 'adam', 'graph_mode': 'off', 'use_snp_selection': False}. Best is trial 71 with value: 0.07153641871066653.
[I 2025-11-03 13:17:08,947] Trial 112 finished with value: 0.03276048108212731 and parameters: {'model_type': 'gcn', 'hidden_dims': '[512, 256]', 'dropout': 0.1169216597638772, 'batch_norm': True, 'lr': 0.00012735296062559321, 'weight_decay': 2.0106874726628717e-07, 'epochs': 276, 'loss': 'mse', 'optimizer': 'adam', 'graph_mode': 'off', 'use_snp_selection': False}. Best is trial 71 with value: 0.07153641871066653.
[I 2025-11-03 13:17:10,704] Trial 113 finished with value: 0.06408633921716927 and parameters: {'model_type': 'gcn', 'hidden_dims': '[512, 256]', 'dropout': 0.1313075098742463, 'batch_norm': True, 'lr': 0.0005414092811016541, 'weight_decay': 1.735581493351521e-07, 'epochs': 223, 'loss': 'mse', 'optimizer': 'adam', 'graph_mode': 'off', 'use_snp_selection': False}. Best is trial 71 with value: 0.07153641871066653.
[I 2025-11-03 13:17:12,457] Trial 114 finished with value: 0.05583344539497976 and parameters: {'model_type': 'gcn', 'hidden_dims': '[512, 256]', 'dropout': 0.13541910492328108, 'batch_norm': True, 'lr': 0.0006010774210538398, 'weight_decay': 1.723621526897643e-07, 'epochs': 223, 'loss': 'mse', 'optimizer': 'adam', 'graph_mode': 'off', 'use_snp_selection': False}. Best is trial 71 with value: 0.07153641871066653.
[I 2025-11-03 13:17:13,698] Trial 115 finished with value: 0.05801270969774963 and parameters: {'model_type': 'gcn', 'hidden_dims': '[256, 128]', 'dropout': 0.36429396365718547, 'batch_norm': True, 'lr': 0.00048211133681762036, 'weight_decay': 5.052582269332121e-07, 'epochs': 213, 'loss': 'mse', 'optimizer': 'adam', 'graph_mode': 'off', 'use_snp_selection': False}. Best is trial 71 with value: 0.07153641871066653.
[I 2025-11-03 13:17:15,510] Trial 116 finished with value: 0.06672258373938939 and parameters: {'model_type': 'gcn', 'hidden_dims': '[512, 256]', 'dropout': 0.19815967672163895, 'batch_norm': True, 'lr': 0.00016044212727628294, 'weight_decay': 2.947098424092203e-05, 'epochs': 238, 'loss': 'mse', 'optimizer': 'adam', 'graph_mode': 'off', 'use_snp_selection': False}. Best is trial 71 with value: 0.07153641871066653.
[I 2025-11-03 13:17:17,313] Trial 117 finished with value: 0.04043169834113993 and parameters: {'model_type': 'gcn', 'hidden_dims': '[512, 256]', 'dropout': 0.1984563622593352, 'batch_norm': True, 'lr': 0.00022254525688828895, 'weight_decay': 2.9522175314495173e-05, 'epochs': 240, 'loss': 'mse', 'optimizer': 'adam', 'graph_mode': 'off', 'use_snp_selection': False}. Best is trial 71 with value: 0.07153641871066653.
[I 2025-11-03 13:17:19,168] Trial 118 finished with value: 0.06346925743781959 and parameters: {'model_type': 'gcn', 'hidden_dims': '[512, 256]', 'dropout': 0.1692459257492629, 'batch_norm': True, 'lr': 0.00015063677287807661, 'weight_decay': 4.207465892521322e-05, 'epochs': 245, 'loss': 'mse', 'optimizer': 'adam', 'graph_mode': 'off', 'use_snp_selection': False}. Best is trial 71 with value: 0.07153641871066653.
[I 2025-11-03 13:17:20,553] Trial 119 finished with value: 0.029125455395906923 and parameters: {'model_type': 'gcn', 'hidden_dims': '[256, 128, 64]', 'dropout': 0.3777597614671135, 'batch_norm': True, 'lr': 6.795496732702403e-05, 'weight_decay': 2.7193404919012056e-05, 'epochs': 199, 'loss': 'mse', 'optimizer': 'adam', 'graph_mode': 'off', 'use_snp_selection': False}. Best is trial 71 with value: 0.07153641871066653.
[I 2025-11-03 13:17:21,650] Trial 120 finished with value: 0.03859233848772674 and parameters: {'model_type': 'gcn', 'hidden_dims': '[128, 64]', 'dropout': 0.15695698983526904, 'batch_norm': False, 'lr': 0.00017473411501048606, 'weight_decay': 1.88360655066483e-05, 'epochs': 267, 'loss': 'mse', 'optimizer': 'adam', 'graph_mode': 'off', 'use_snp_selection': False}. Best is trial 71 with value: 0.07153641871066653.
[I 2025-11-03 13:17:23,503] Trial 121 finished with value: 0.042472053360433644 and parameters: {'model_type': 'gcn', 'hidden_dims': '[512, 256]', 'dropout': 0.1656320494006379, 'batch_norm': True, 'lr': 0.00014900577811858504, 'weight_decay': 7.825039996880815e-05, 'epochs': 244, 'loss': 'mse', 'optimizer': 'adam', 'graph_mode': 'off', 'use_snp_selection': False}. Best is trial 71 with value: 0.07153641871066653.
[I 2025-11-03 13:17:25,312] Trial 122 finished with value: 0.08173724304199678 and parameters: {'model_type': 'gcn', 'hidden_dims': '[512, 256]', 'dropout': 0.18369222536095375, 'batch_norm': True, 'lr': 0.00011781597075693872, 'weight_decay': 4.704412687737668e-05, 'epochs': 230, 'loss': 'mse', 'optimizer': 'adam', 'graph_mode': 'off', 'use_snp_selection': False}. Best is trial 122 with value: 0.08173724304199678.
[I 2025-11-03 13:17:27,086] Trial 123 finished with value: 0.049707882672452144 and parameters: {'model_type': 'gcn', 'hidden_dims': '[512, 256]', 'dropout': 0.18858138288190524, 'batch_norm': True, 'lr': 0.00011533444379629956, 'weight_decay': 3.484713771499688e-05, 'epochs': 229, 'loss': 'mse', 'optimizer': 'adam', 'graph_mode': 'off', 'use_snp_selection': False}. Best is trial 122 with value: 0.08173724304199678.
[I 2025-11-03 13:17:28,924] Trial 124 finished with value: 0.067423504003928 and parameters: {'model_type': 'gcn', 'hidden_dims': '[512, 256]', 'dropout': 0.13239674038588445, 'batch_norm': True, 'lr': 0.00013326887468049993, 'weight_decay': 6.213557607066715e-05, 'epochs': 235, 'loss': 'mae', 'optimizer': 'adam', 'graph_mode': 'off', 'use_snp_selection': False}. Best is trial 122 with value: 0.08173724304199678.
[I 2025-11-03 13:17:30,751] Trial 125 finished with value: 0.039168010618525435 and parameters: {'model_type': 'gcn', 'hidden_dims': '[512, 256]', 'dropout': 0.12904915499733452, 'batch_norm': True, 'lr': 9.963058364825453e-05, 'weight_decay': 9.191843405575386e-05, 'epochs': 234, 'loss': 'mae', 'optimizer': 'adam', 'graph_mode': 'off', 'use_snp_selection': False}. Best is trial 122 with value: 0.08173724304199678.
[I 2025-11-03 13:17:32,580] Trial 126 finished with value: 0.030744152796948976 and parameters: {'model_type': 'gcn', 'hidden_dims': '[512, 256]', 'dropout': 0.21076921748891736, 'batch_norm': True, 'lr': 9.106462362499115e-05, 'weight_decay': 5.804147639723708e-05, 'epochs': 249, 'loss': 'mae', 'optimizer': 'adam', 'graph_mode': 'off', 'use_snp_selection': False}. Best is trial 122 with value: 0.08173724304199678.
[I 2025-11-03 13:17:34,459] Trial 127 finished with value: 0.06670230199783603 and parameters: {'model_type': 'gcn', 'hidden_dims': '[512, 128]', 'dropout': 0.1440025038273468, 'batch_norm': True, 'lr': 0.00013127613746054246, 'weight_decay': 6.96606166960703e-05, 'epochs': 224, 'loss': 'mae', 'optimizer': 'adam', 'graph_mode': 'off', 'use_snp_selection': True, 'num_snps': 37223}. Best is trial 122 with value: 0.08173724304199678.
[I 2025-11-03 13:17:36,399] Trial 128 finished with value: 0.056629962617579827 and parameters: {'model_type': 'gcn', 'hidden_dims': '[512, 128]', 'dropout': 0.11233695521517395, 'batch_norm': True, 'lr': 0.00012096329679177583, 'weight_decay': 4.493095797096033e-05, 'epochs': 256, 'loss': 'mae', 'optimizer': 'adam', 'graph_mode': 'off', 'use_snp_selection': True, 'num_snps': 36071}. Best is trial 122 with value: 0.08173724304199678.
[I 2025-11-03 13:17:38,792] Trial 129 finished with value: 0.0338510499714852 and parameters: {'model_type': 'gcn', 'hidden_dims': '[512, 128]', 'dropout': 0.14415332220822458, 'batch_norm': True, 'lr': 0.00013110661049005798, 'weight_decay': 5.415034974133551e-05, 'epochs': 236, 'loss': 'mae', 'optimizer': 'adam', 'graph_mode': 'off', 'use_snp_selection': True, 'num_snps': 48903}. Best is trial 122 with value: 0.08173724304199678.
[I 2025-11-03 13:17:40,150] Trial 130 finished with value: 0.0026722171827915824 and parameters: {'model_type': 'gcn', 'hidden_dims': '[512, 128]', 'dropout': 0.18559085960217503, 'batch_norm': True, 'lr': 0.00016865266703195242, 'weight_decay': 9.469431652593137e-05, 'epochs': 41, 'loss': 'mae', 'optimizer': 'adam', 'graph_mode': 'off', 'use_snp_selection': True, 'num_snps': 37878}. Best is trial 122 with value: 0.08173724304199678.
[I 2025-11-03 13:17:41,791] Trial 131 finished with value: 0.05281445474050556 and parameters: {'model_type': 'gcn', 'hidden_dims': '[512, 128]', 'dropout': 0.1742937684294176, 'batch_norm': True, 'lr': 0.00010312991170710375, 'weight_decay': 7.220098396704611e-05, 'epochs': 216, 'loss': 'mae', 'optimizer': 'adam', 'graph_mode': 'off', 'use_snp_selection': True, 'num_snps': 27811}. Best is trial 122 with value: 0.08173724304199678.
[I 2025-11-03 13:17:44,482] Trial 132 finished with value: 0.05275165292595638 and parameters: {'model_type': 'gcn', 'hidden_dims': '[512, 256]', 'dropout': 0.13641465569738878, 'batch_norm': True, 'lr': 0.0002085175640934886, 'weight_decay': 0.0001570681255677298, 'epochs': 227, 'loss': 'mae', 'optimizer': 'adam', 'graph_mode': 'off', 'use_snp_selection': True, 'num_snps': 59266}. Best is trial 122 with value: 0.08173724304199678.
[I 2025-11-03 13:17:46,171] Trial 133 finished with value: 0.04368553140959517 and parameters: {'model_type': 'gcn', 'hidden_dims': '[512, 64]', 'dropout': 0.15712384685122524, 'batch_norm': True, 'lr': 0.00013511037553476743, 'weight_decay': 4.116263763771067e-05, 'epochs': 209, 'loss': 'mae', 'optimizer': 'adam', 'graph_mode': 'off', 'use_snp_selection': False}. Best is trial 122 with value: 0.08173724304199678.
[I 2025-11-03 13:17:47,945] Trial 134 finished with value: 0.054428351480315273 and parameters: {'model_type': 'gcn', 'hidden_dims': '[512, 256]', 'dropout': 0.12705147743262346, 'batch_norm': True, 'lr': 7.663382048452327e-05, 'weight_decay': 2.390679775134813e-07, 'epochs': 236, 'loss': 'mae', 'optimizer': 'adam', 'graph_mode': 'off', 'use_snp_selection': False}. Best is trial 122 with value: 0.08173724304199678.
[I 2025-11-03 13:17:49,354] Trial 135 finished with value: 0.03171574867955045 and parameters: {'model_type': 'gcn', 'hidden_dims': '[512, 256]', 'dropout': 0.14971514164944355, 'batch_norm': True, 'lr': 0.00015833179254787436, 'weight_decay': 1.0031428952088471e-07, 'epochs': 152, 'loss': 'mae', 'optimizer': 'adam', 'graph_mode': 'off', 'use_snp_selection': False}. Best is trial 122 with value: 0.08173724304199678.
[I 2025-11-03 13:17:51,086] Trial 136 finished with value: 0.054445941005932995 and parameters: {'model_type': 'gcn', 'hidden_dims': '[512, 128]', 'dropout': 0.2023623742445732, 'batch_norm': True, 'lr': 0.00018314235654496035, 'weight_decay': 3.92825395370932e-07, 'epochs': 224, 'loss': 'mse', 'optimizer': 'adam', 'graph_mode': 'off', 'use_snp_selection': False}. Best is trial 122 with value: 0.08173724304199678.
[I 2025-11-03 13:17:52,368] Trial 137 finished with value: -0.020717604026762322 and parameters: {'model_type': 'gcn', 'hidden_dims': '[512, 256]', 'dropout': 0.106321152816313, 'batch_norm': True, 'lr': 3.222941645818041e-06, 'weight_decay': 7.513851689459337e-07, 'epochs': 195, 'loss': 'mse', 'optimizer': 'adam', 'graph_mode': 'off', 'use_snp_selection': True, 'num_snps': 18355}. Best is trial 122 with value: 0.08173724304199678.
[I 2025-11-03 13:17:53,403] Trial 138 finished with value: 0.060921888568830566 and parameters: {'model_type': 'gcn', 'hidden_dims': '[512, 256]', 'dropout': 0.16104803258927083, 'batch_norm': True, 'lr': 0.00011115606705605054, 'weight_decay': 6.480943928763274e-05, 'epochs': 63, 'loss': 'mse', 'optimizer': 'adam', 'graph_mode': 'off', 'use_snp_selection': False}. Best is trial 122 with value: 0.08173724304199678.
[I 2025-11-03 13:17:55,077] Trial 139 finished with value: 0.05827644138757915 and parameters: {'model_type': 'gcn', 'hidden_dims': '[512, 256]', 'dropout': 0.34636268068657666, 'batch_norm': False, 'lr': 0.00025509666211319756, 'weight_decay': 2.4665588659076977e-05, 'epochs': 216, 'loss': 'mae', 'optimizer': 'adam', 'graph_mode': 'off', 'use_snp_selection': False}. Best is trial 122 with value: 0.08173724304199678.
[I 2025-11-03 13:17:55,997] Trial 140 finished with value: 0.05337891335532009 and parameters: {'model_type': 'gcn', 'hidden_dims': '[256, 128]', 'dropout': 0.12208876823467936, 'batch_norm': True, 'lr': 5.428123567514049e-05, 'weight_decay': 1.4545692551995877e-07, 'epochs': 121, 'loss': 'mse', 'optimizer': 'adam', 'graph_mode': 'off', 'use_snp_selection': False}. Best is trial 122 with value: 0.08173724304199678.
[I 2025-11-03 13:17:57,883] Trial 141 finished with value: 0.050128642450035836 and parameters: {'model_type': 'gcn', 'hidden_dims': '[512, 256]', 'dropout': 0.3873279561375057, 'batch_norm': True, 'lr': 0.00019532973413764428, 'weight_decay': 3.433431242333213e-05, 'epochs': 256, 'loss': 'mse', 'optimizer': 'adam', 'graph_mode': 'off', 'use_snp_selection': False}. Best is trial 122 with value: 0.08173724304199678.
