[I 2025-11-03 11:55:47,187] Trial 131 finished with value: 0.09780258862879676 and parameters: {'model_type': 'gcn', 'hidden_dims': '[512, 128]', 'dropout': 0.47119847665361553, 'batch_norm': True, 'lr': 0.0007573902943329641, 'weight_decay': 0.0005065290569247722, 'epochs': 91, 'loss': 'mae', 'optimizer': 'adam', 'graph_mode': 'knn', 'source': 'grm', 'knn_k': 10, 'weighted_edges': True, 'symmetrize_mode': 'union', 'use_snp_selection': True, 'num_snps': 46793}. Best is trial 131 with value: 0.09780258862879676.
[I 2025-11-03 11:55:50,246] Trial 132 finished with value: 0.05847250886013314 and parameters: {'model_type': 'gcn', 'hidden_dims': '[512, 128]', 'dropout': 0.46447501677682757, 'batch_norm': True, 'lr': 0.000602360692058616, 'weight_decay': 0.0005252340108644465, 'epochs': 93, 'loss': 'mae', 'optimizer': 'adam', 'graph_mode': 'knn', 'source': 'grm', 'knn_k': 10, 'weighted_edges': True, 'symmetrize_mode': 'union', 'use_snp_selection': True, 'num_snps': 47852}. Best is trial 131 with value: 0.09780258862879676.
[I 2025-11-03 11:55:53,467] Trial 133 finished with value: 0.07535823807691976 and parameters: {'model_type': 'gcn', 'hidden_dims': '[512, 128]', 'dropout': 0.4918852387247929, 'batch_norm': True, 'lr': 0.0007319499321692233, 'weight_decay': 0.0005419050738360533, 'epochs': 109, 'loss': 'mae', 'optimizer': 'adam', 'graph_mode': 'knn', 'source': 'grm', 'knn_k': 10, 'weighted_edges': True, 'symmetrize_mode': 'union', 'use_snp_selection': True, 'num_snps': 50154}. Best is trial 131 with value: 0.09780258862879676.
[I 2025-11-03 11:55:56,630] Trial 134 finished with value: 0.09214620042438583 and parameters: {'model_type': 'gcn', 'hidden_dims': '[512, 128]', 'dropout': 0.5109910144274326, 'batch_norm': True, 'lr': 0.0004756473697964201, 'weight_decay': 0.0004543460341508683, 'epochs': 73, 'loss': 'mae', 'optimizer': 'adam', 'graph_mode': 'knn', 'source': 'grm', 'knn_k': 10, 'weighted_edges': True, 'symmetrize_mode': 'union', 'use_snp_selection': True, 'num_snps': 53016}. Best is trial 131 with value: 0.09780258862879676.
[I 2025-11-03 11:55:59,892] Trial 135 finished with value: 0.008069880055201852 and parameters: {'model_type': 'gcn', 'hidden_dims': '[512, 128]', 'dropout': 0.473153979722421, 'batch_norm': True, 'lr': 7.198443328402823e-06, 'weight_decay': 0.0006840042652341493, 'epochs': 86, 'loss': 'mae', 'optimizer': 'adam', 'graph_mode': 'knn', 'source': 'grm', 'knn_k': 10, 'weighted_edges': True, 'symmetrize_mode': 'union', 'use_snp_selection': True, 'num_snps': 53413}. Best is trial 131 with value: 0.09780258862879676.
[I 2025-11-03 11:56:02,774] Trial 136 finished with value: 0.061604107658394844 and parameters: {'model_type': 'gcn', 'hidden_dims': '[512, 128]', 'dropout': 0.4949053977344426, 'batch_norm': True, 'lr': 0.000472818436025184, 'weight_decay': 0.00043710619830832965, 'epochs': 101, 'loss': 'mae', 'optimizer': 'adam', 'graph_mode': 'knn', 'source': 'grm', 'knn_k': 10, 'weighted_edges': True, 'symmetrize_mode': 'union', 'use_snp_selection': True, 'num_snps': 42334}. Best is trial 131 with value: 0.09780258862879676.
[I 2025-11-03 11:56:06,402] Trial 137 finished with value: 0.07838223725245173 and parameters: {'model_type': 'gcn', 'hidden_dims': '[512, 128]', 'dropout': 0.5056369136174259, 'batch_norm': True, 'lr': 0.0008022888253342676, 'weight_decay': 0.0002992523433431775, 'epochs': 122, 'loss': 'mae', 'optimizer': 'adam', 'graph_mode': 'knn', 'source': 'grm', 'knn_k': 10, 'weighted_edges': True, 'symmetrize_mode': 'union', 'use_snp_selection': True, 'num_snps': 57420}. Best is trial 131 with value: 0.09780258862879676.
[I 2025-11-03 11:56:09,954] Trial 138 finished with value: 0.016600984389092945 and parameters: {'model_type': 'gcn', 'hidden_dims': '[512, 128]', 'dropout': 0.563252868121236, 'batch_norm': True, 'lr': 2.684846576778607e-05, 'weight_decay': 0.0002841532980803998, 'epochs': 124, 'loss': 'mae', 'optimizer': 'adam', 'graph_mode': 'knn', 'source': 'grm', 'knn_k': 10, 'weighted_edges': True, 'symmetrize_mode': 'union', 'use_snp_selection': True, 'num_snps': 55250}. Best is trial 131 with value: 0.09780258862879676.
[I 2025-11-03 11:56:13,562] Trial 139 finished with value: 0.0616082593346621 and parameters: {'model_type': 'gcn', 'hidden_dims': '[512, 128]', 'dropout': 0.5451251034548694, 'batch_norm': True, 'lr': 0.0005654588588793504, 'weight_decay': 0.0002133757911439933, 'epochs': 115, 'loss': 'mae', 'optimizer': 'adam', 'graph_mode': 'knn', 'source': 'grm', 'knn_k': 10, 'weighted_edges': True, 'symmetrize_mode': 'union', 'use_snp_selection': True, 'num_snps': 58021}. Best is trial 131 with value: 0.09780258862879676.
[I 2025-11-03 11:56:16,966] Trial 140 finished with value: 0.0006503988476848925 and parameters: {'model_type': 'gcn', 'hidden_dims': '[512, 128]', 'dropout': 0.5221645191831712, 'batch_norm': False, 'lr': 0.0006796894084424975, 'weight_decay': 0.0004056407941489958, 'epochs': 134, 'loss': 'mae', 'optimizer': 'adam', 'graph_mode': 'knn', 'source': 'grm', 'knn_k': 10, 'weighted_edges': True, 'symmetrize_mode': 'mutual', 'use_snp_selection': True, 'num_snps': 51870}. Best is trial 131 with value: 0.09780258862879676.
[I 2025-11-03 11:56:20,170] Trial 141 finished with value: 0.08063665437763544 and parameters: {'model_type': 'gcn', 'hidden_dims': '[512, 128]', 'dropout': 0.5032374561371967, 'batch_norm': True, 'lr': 0.0008125392194626193, 'weight_decay': 0.0006481842656381561, 'epochs': 76, 'loss': 'mae', 'optimizer': 'adam', 'graph_mode': 'knn', 'source': 'grm', 'knn_k': 10, 'weighted_edges': True, 'symmetrize_mode': 'union', 'use_snp_selection': True, 'num_snps': 53459}. Best is trial 131 with value: 0.09780258862879676.
[I 2025-11-03 11:56:23,446] Trial 142 finished with value: 0.05007407950050615 and parameters: {'model_type': 'gcn', 'hidden_dims': '[512, 128]', 'dropout': 0.5092540347825455, 'batch_norm': True, 'lr': 0.0008609767418300083, 'weight_decay': 0.0005991211840028136, 'epochs': 89, 'loss': 'mae', 'optimizer': 'adam', 'graph_mode': 'knn', 'source': 'grm', 'knn_k': 10, 'weighted_edges': True, 'symmetrize_mode': 'union', 'use_snp_selection': True, 'num_snps': 53597}. Best is trial 131 with value: 0.09780258862879676.
[I 2025-11-03 11:56:27,100] Trial 143 finished with value: 0.05885168593512998 and parameters: {'model_type': 'gcn', 'hidden_dims': '[512, 128]', 'dropout': 0.49970244238810435, 'batch_norm': True, 'lr': 0.000798424541595976, 'weight_decay': 0.00032289112353443464, 'epochs': 120, 'loss': 'mae', 'optimizer': 'adam', 'graph_mode': 'knn', 'source': 'grm', 'knn_k': 10, 'weighted_edges': True, 'symmetrize_mode': 'union', 'use_snp_selection': True, 'num_snps': 57894}. Best is trial 131 with value: 0.09780258862879676.
[I 2025-11-03 11:56:30,425] Trial 144 finished with value: 0.05911441466738505 and parameters: {'model_type': 'gcn', 'hidden_dims': '[512, 128]', 'dropout': 0.4876107654917733, 'batch_norm': True, 'lr': 0.0006392384345820025, 'weight_decay': 0.0009834703133969947, 'epochs': 77, 'loss': 'mae', 'optimizer': 'adam', 'graph_mode': 'knn', 'source': 'grm', 'knn_k': 10, 'weighted_edges': True, 'symmetrize_mode': 'union', 'use_snp_selection': True, 'num_snps': 55669}. Best is trial 131 with value: 0.09780258862879676.
[I 2025-11-03 11:56:33,762] Trial 145 finished with value: 0.07533559461293797 and parameters: {'model_type': 'gcn', 'hidden_dims': '[512, 64]', 'dropout': 0.5361492787605153, 'batch_norm': True, 'lr': 0.0005133348256602009, 'weight_decay': 0.0002486320345504986, 'epochs': 128, 'loss': 'mae', 'optimizer': 'adam', 'graph_mode': 'knn', 'source': 'grm', 'knn_k': 9, 'weighted_edges': True, 'symmetrize_mode': 'union', 'use_snp_selection': True, 'num_snps': 50518}. Best is trial 131 with value: 0.09780258862879676.
[I 2025-11-03 11:56:37,098] Trial 146 finished with value: 0.06654156152217881 and parameters: {'model_type': 'gcn', 'hidden_dims': '[512, 128]', 'dropout': 0.5049366192114023, 'batch_norm': True, 'lr': 0.0007353587344087692, 'weight_decay': 0.0003636588061947577, 'epochs': 106, 'loss': 'mse', 'optimizer': 'adam', 'graph_mode': 'knn', 'source': 'grm', 'knn_k': 10, 'weighted_edges': True, 'symmetrize_mode': 'union', 'use_snp_selection': True, 'num_snps': 52741}. Best is trial 131 with value: 0.09780258862879676.
[I 2025-11-03 11:56:40,479] Trial 147 finished with value: 0.034118352091369694 and parameters: {'model_type': 'gcn', 'hidden_dims': '[512, 128]', 'dropout': 0.5279575200804911, 'batch_norm': True, 'lr': 0.00043502409342268316, 'weight_decay': 0.00045940233428379604, 'epochs': 146, 'loss': 'mae', 'optimizer': 'adam', 'graph_mode': 'knn', 'source': 'grm', 'knn_k': 9, 'weighted_edges': False, 'symmetrize_mode': 'union', 'use_snp_selection': True, 'num_snps': 49413}. Best is trial 131 with value: 0.09780258862879676.
[I 2025-11-03 11:56:43,551] Trial 148 finished with value: 0.11633088627727622 and parameters: {'model_type': 'gcn', 'hidden_dims': '[256, 128, 64]', 'dropout': 0.5147794422035494, 'batch_norm': True, 'lr': 0.0008720547226185901, 'weight_decay': 0.000744518605059992, 'epochs': 74, 'loss': 'mae', 'optimizer': 'adam', 'graph_mode': 'knn', 'source': 'grm', 'knn_k': 10, 'weighted_edges': True, 'symmetrize_mode': 'union', 'use_snp_selection': True, 'num_snps': 55006}. Best is trial 148 with value: 0.11633088627727622.
[I 2025-11-03 11:56:47,203] Trial 149 finished with value: 0.036830630678070214 and parameters: {'model_type': 'gcn', 'hidden_dims': '[256, 128, 64]', 'dropout': 0.5125778286561179, 'batch_norm': True, 'lr': 5.322811344950772e-05, 'weight_decay': 0.0006769097955185238, 'epochs': 162, 'loss': 'mae', 'optimizer': 'adam', 'graph_mode': 'knn', 'source': 'grm', 'knn_k': 10, 'weighted_edges': True, 'symmetrize_mode': 'mutual', 'use_snp_selection': True, 'num_snps': 59608}. Best is trial 148 with value: 0.11633088627727622.
[I 2025-11-03 11:56:49,490] Trial 0 finished with value: 0.026481830106285506 and parameters: {'model_type': 'gcn', 'hidden_dims': '[128, 64]', 'dropout': 0.199031432379812, 'batch_norm': True, 'lr': 1.8408544111075837e-06, 'weight_decay': 5.5136510071208614e-05, 'epochs': 334, 'loss': 'mae', 'optimizer': 'adam', 'graph_mode': 'knn', 'source': 'grm', 'knn_k': 8, 'weighted_edges': True, 'symmetrize_mode': 'mutual', 'use_snp_selection': False}. Best is trial 0 with value: 0.026481830106285506.
[I 2025-11-03 11:56:50,591] Trial 1 finished with value: 0.026194457007549233 and parameters: {'model_type': 'gcn', 'hidden_dims': '[128, 64]', 'dropout': 0.40051947670227217, 'batch_norm': True, 'lr': 0.0005320428882732732, 'weight_decay': 1.89210117736594e-06, 'epochs': 32, 'loss': 'mse', 'optimizer': 'adam', 'graph_mode': 'knn', 'source': 'grm', 'knn_k': 7, 'weighted_edges': True, 'symmetrize_mode': 'union', 'use_snp_selection': False}. Best is trial 0 with value: 0.026481830106285506.
[I 2025-11-03 11:56:53,039] Trial 2 finished with value: 0.06377400706360609 and parameters: {'model_type': 'gcn', 'hidden_dims': '[256, 128]', 'dropout': 0.5105528289184642, 'batch_norm': False, 'lr': 0.0006804279372404962, 'weight_decay': 0.0008922815224257085, 'epochs': 160, 'loss': 'mse', 'optimizer': 'adam', 'graph_mode': 'cutoff', 'cutoff': 0.5741905641612706, 'grm_norm': 'gcn', 'self_loops': False, 'use_snp_selection': True, 'num_snps': 26910}. Best is trial 2 with value: 0.06377400706360609.
[I 2025-11-03 11:56:55,614] Trial 3 finished with value: 0.030670433892326283 and parameters: {'model_type': 'gcn', 'hidden_dims': '[256, 128, 64]', 'dropout': 0.5390483213624292, 'batch_norm': False, 'lr': 3.4705625989073525e-05, 'weight_decay': 2.4623319020131338e-05, 'epochs': 92, 'loss': 'mse', 'optimizer': 'adam', 'graph_mode': 'knn', 'source': 'grm', 'knn_k': 6, 'weighted_edges': False, 'symmetrize_mode': 'mutual', 'use_snp_selection': True, 'num_snps': 30713}. Best is trial 2 with value: 0.06377400706360609.
[I 2025-11-03 11:56:58,124] Trial 4 finished with value: -0.015323556699179468 and parameters: {'model_type': 'gcn', 'hidden_dims': '[128, 64]', 'dropout': 0.13404863676897502, 'batch_norm': False, 'lr': 0.0001431556295367288, 'weight_decay': 2.2084517750726675e-05, 'epochs': 13, 'loss': 'mae', 'optimizer': 'adam', 'graph_mode': 'cutoff', 'cutoff': 0.6714268476993044, 'grm_norm': 'none', 'self_loops': False, 'use_snp_selection': True, 'num_snps': 45645}. Best is trial 2 with value: 0.06377400706360609.
[I 2025-11-03 11:57:01,238] Trial 5 finished with value: 0.026438309093083732 and parameters: {'model_type': 'gcn', 'hidden_dims': '[256, 128]', 'dropout': 0.42253606323412096, 'batch_norm': False, 'lr': 4.238630400638805e-05, 'weight_decay': 8.074086040046576e-07, 'epochs': 134, 'loss': 'mae', 'optimizer': 'adam', 'graph_mode': 'knn', 'source': 'grm', 'knn_k': 1, 'weighted_edges': False, 'symmetrize_mode': 'mutual', 'use_snp_selection': True, 'num_snps': 43113}. Best is trial 2 with value: 0.06377400706360609.
[I 2025-11-03 11:57:04,346] Trial 6 finished with value: 0.06768937163650074 and parameters: {'model_type': 'gcn', 'hidden_dims': '[512, 256]', 'dropout': 0.3534893146320237, 'batch_norm': True, 'lr': 0.000251307964226932, 'weight_decay': 1.821819791794022e-05, 'epochs': 207, 'loss': 'mae', 'optimizer': 'adam', 'graph_mode': 'knn', 'source': 'grm', 'knn_k': 1, 'weighted_edges': True, 'symmetrize_mode': 'mutual', 'use_snp_selection': False}. Best is trial 6 with value: 0.06768937163650074.
[I 2025-11-03 11:57:07,033] Trial 7 finished with value: 0.04551215569900587 and parameters: {'model_type': 'gcn', 'hidden_dims': '[512, 256]', 'dropout': 0.1105825955860775, 'batch_norm': True, 'lr': 2.374338412754043e-05, 'weight_decay': 1.1284721123340274e-05, 'epochs': 170, 'loss': 'mse', 'optimizer': 'adam', 'graph_mode': 'cutoff', 'cutoff': 0.719872204109604, 'grm_norm': 'gcn', 'self_loops': False, 'use_snp_selection': False}. Best is trial 6 with value: 0.06768937163650074.
[I 2025-11-03 11:57:09,042] Trial 8 finished with value: 0.04079168417832478 and parameters: {'model_type': 'gcn', 'hidden_dims': '[512, 128]', 'dropout': 0.5066580418354021, 'batch_norm': True, 'lr': 0.00039213678276659976, 'weight_decay': 3.43655320802934e-06, 'epochs': 91, 'loss': 'mse', 'optimizer': 'adam', 'graph_mode': 'cutoff', 'cutoff': 0.34923059576505366, 'grm_norm': 'cosine', 'self_loops': True, 'use_snp_selection': False}. Best is trial 6 with value: 0.06768937163650074.
[I 2025-11-03 11:57:11,007] Trial 9 finished with value: 0.02802875778304594 and parameters: {'model_type': 'gcn', 'hidden_dims': '[512, 256]', 'dropout': 0.301734920240333, 'batch_norm': False, 'lr': 6.650961854953448e-06, 'weight_decay': 6.861575656590315e-05, 'epochs': 125, 'loss': 'mae', 'optimizer': 'adam', 'graph_mode': 'cutoff', 'cutoff': 0.2857569870061939, 'grm_norm': 'cosine_then_gcn', 'self_loops': False, 'use_snp_selection': True, 'num_snps': 12722}. Best is trial 6 with value: 0.06768937163650074.
[I 2025-11-03 11:57:14,584] Trial 10 finished with value: 0.07189534390976066 and parameters: {'model_type': 'gcn', 'hidden_dims': '[512, 64]', 'dropout': 0.2833599465317005, 'batch_norm': True, 'lr': 0.00016916760584270694, 'weight_decay': 1.7866650996308468e-07, 'epochs': 266, 'loss': 'mae', 'optimizer': 'adam', 'graph_mode': 'knn', 'source': 'grm', 'knn_k': 1, 'weighted_edges': True, 'symmetrize_mode': 'union', 'use_snp_selection': False}. Best is trial 10 with value: 0.07189534390976066.
[I 2025-11-03 11:57:18,153] Trial 11 finished with value: 0.08386365619448015 and parameters: {'model_type': 'gcn', 'hidden_dims': '[512, 64]', 'dropout': 0.2859699507705008, 'batch_norm': True, 'lr': 0.00012623783700890367, 'weight_decay': 1.6805209943987688e-07, 'epochs': 265, 'loss': 'mae', 'optimizer': 'adam', 'graph_mode': 'knn', 'source': 'grm', 'knn_k': 1, 'weighted_edges': True, 'symmetrize_mode': 'union', 'use_snp_selection': False}. Best is trial 11 with value: 0.08386365619448015.
[I 2025-11-03 11:57:21,781] Trial 12 finished with value: 0.05716305331380784 and parameters: {'model_type': 'gcn', 'hidden_dims': '[512, 64]', 'dropout': 0.26266132038870743, 'batch_norm': True, 'lr': 9.336280153487897e-05, 'weight_decay': 1.0551808429767219e-07, 'epochs': 270, 'loss': 'mae', 'optimizer': 'adam', 'graph_mode': 'knn', 'source': 'grm', 'knn_k': 3, 'weighted_edges': True, 'symmetrize_mode': 'union', 'use_snp_selection': False}. Best is trial 11 with value: 0.08386365619448015.
[I 2025-11-03 11:57:25,247] Trial 13 finished with value: 0.02477448026264399 and parameters: {'model_type': 'gcn', 'hidden_dims': '[512, 64]', 'dropout': 0.2687736708759205, 'batch_norm': True, 'lr': 8.732942663241711e-05, 'weight_decay': 1.1697174867672891e-07, 'epochs': 251, 'loss': 'mae', 'optimizer': 'adam', 'graph_mode': 'knn', 'source': 'grm', 'knn_k': 4, 'weighted_edges': True, 'symmetrize_mode': 'union', 'use_snp_selection': False}. Best is trial 11 with value: 0.08386365619448015.
[I 2025-11-03 11:57:29,565] Trial 14 finished with value: -0.002384155826864561 and parameters: {'model_type': 'gcn', 'hidden_dims': '[512, 64]', 'dropout': 0.19696847261698813, 'batch_norm': True, 'lr': 1.2586985041154999e-05, 'weight_decay': 3.8054513427732407e-07, 'epochs': 349, 'loss': 'mae', 'optimizer': 'adam', 'graph_mode': 'knn', 'source': 'grm', 'knn_k': 3, 'weighted_edges': True, 'symmetrize_mode': 'union', 'use_snp_selection': False}. Best is trial 11 with value: 0.08386365619448015.
[I 2025-11-03 11:57:33,282] Trial 15 finished with value: 0.08058672848314655 and parameters: {'model_type': 'gcn', 'hidden_dims': '[512, 64]', 'dropout': 0.32182199730807426, 'batch_norm': True, 'lr': 0.00016454300965981406, 'weight_decay': 4.3750989597912334e-07, 'epochs': 282, 'loss': 'mae', 'optimizer': 'adam', 'graph_mode': 'knn', 'source': 'grm', 'knn_k': 1, 'weighted_edges': True, 'symmetrize_mode': 'union', 'use_snp_selection': False}. Best is trial 11 with value: 0.08386365619448015.
[I 2025-11-03 11:57:37,291] Trial 16 finished with value: 0.02382408846541954 and parameters: {'model_type': 'gcn', 'hidden_dims': '[512, 64]', 'dropout': 0.3912763499396328, 'batch_norm': True, 'lr': 5.8155244500770475e-05, 'weight_decay': 6.966019491522892e-07, 'epochs': 309, 'loss': 'mae', 'optimizer': 'adam', 'graph_mode': 'knn', 'source': 'grm', 'knn_k': 10, 'weighted_edges': False, 'symmetrize_mode': 'union', 'use_snp_selection': False}. Best is trial 11 with value: 0.08386365619448015.
[I 2025-11-03 11:57:40,464] Trial 17 finished with value: 0.033993549219185376 and parameters: {'model_type': 'gcn', 'hidden_dims': '[512, 128]', 'dropout': 0.46671086169925924, 'batch_norm': True, 'lr': 0.00028616129463827076, 'weight_decay': 3.107383290096833e-06, 'epochs': 218, 'loss': 'mae', 'optimizer': 'adam', 'graph_mode': 'knn', 'source': 'grm', 'knn_k': 3, 'weighted_edges': True, 'symmetrize_mode': 'union', 'use_snp_selection': False}. Best is trial 11 with value: 0.08386365619448015.
[I 2025-11-03 11:57:43,449] Trial 18 finished with value: 0.038078385973111264 and parameters: {'model_type': 'gcn', 'hidden_dims': '[256, 128, 64]', 'dropout': 0.20588978637538785, 'batch_norm': True, 'lr': 0.0009303712567709796, 'weight_decay': 3.293863322548928e-07, 'epochs': 296, 'loss': 'mae', 'optimizer': 'adam', 'graph_mode': 'knn', 'source': 'grm', 'knn_k': 5, 'weighted_edges': True, 'symmetrize_mode': 'union', 'use_snp_selection': False}. Best is trial 11 with value: 0.08386365619448015.
[I 2025-11-03 11:57:46,730] Trial 19 finished with value: 0.020202003507372893 and parameters: {'model_type': 'gcn', 'hidden_dims': '[512, 64]', 'dropout': 0.3428635050089619, 'batch_norm': True, 'lr': 1.4712248825400985e-05, 'weight_decay': 9.172787270771911e-07, 'epochs': 231, 'loss': 'mae', 'optimizer': 'adam', 'graph_mode': 'knn', 'source': 'grm', 'knn_k': 2, 'weighted_edges': True, 'symmetrize_mode': 'union', 'use_snp_selection': False}. Best is trial 11 with value: 0.08386365619448015.
[I 2025-11-03 11:57:50,639] Trial 20 finished with value: 0.019993693082117698 and parameters: {'model_type': 'gcn', 'hidden_dims': '[512, 64]', 'dropout': 0.5741974551696398, 'batch_norm': True, 'lr': 3.6318419901982732e-06, 'weight_decay': 0.0006285794524056533, 'epochs': 304, 'loss': 'mae', 'optimizer': 'adam', 'graph_mode': 'knn', 'source': 'grm', 'knn_k': 2, 'weighted_edges': False, 'symmetrize_mode': 'union', 'use_snp_selection': False}. Best is trial 11 with value: 0.08386365619448015.
[I 2025-11-03 11:57:54,256] Trial 21 finished with value: 0.06898444400337075 and parameters: {'model_type': 'gcn', 'hidden_dims': '[512, 64]', 'dropout': 0.3083258386798514, 'batch_norm': True, 'lr': 0.0001552429523774223, 'weight_decay': 2.648419205762322e-07, 'epochs': 270, 'loss': 'mae', 'optimizer': 'adam', 'graph_mode': 'knn', 'source': 'grm', 'knn_k': 1, 'weighted_edges': True, 'symmetrize_mode': 'union', 'use_snp_selection': False}. Best is trial 11 with value: 0.08386365619448015.
[I 2025-11-03 11:57:57,791] Trial 22 finished with value: 0.07645366399713548 and parameters: {'model_type': 'gcn', 'hidden_dims': '[512, 64]', 'dropout': 0.25708963804467383, 'batch_norm': True, 'lr': 9.54426629859464e-05, 'weight_decay': 1.780227002140273e-07, 'epochs': 262, 'loss': 'mae', 'optimizer': 'adam', 'graph_mode': 'knn', 'source': 'grm', 'knn_k': 1, 'weighted_edges': True, 'symmetrize_mode': 'union', 'use_snp_selection': False}. Best is trial 11 with value: 0.08386365619448015.
[I 2025-11-03 11:58:00,768] Trial 23 finished with value: 0.019839368251074484 and parameters: {'model_type': 'gcn', 'hidden_dims': '[512, 64]', 'dropout': 0.24536749107209174, 'batch_norm': True, 'lr': 0.00010489823833160659, 'weight_decay': 4.6189691673337585e-07, 'epochs': 197, 'loss': 'mae', 'optimizer': 'adam', 'graph_mode': 'knn', 'source': 'grm', 'knn_k': 2, 'weighted_edges': True, 'symmetrize_mode': 'union', 'use_snp_selection': False}. Best is trial 11 with value: 0.08386365619448015.
