[I 2025-10-20 23:55:34,191] Trial 119 finished with value: 0.2506489507689704 and parameters: {'model_type': 'gat', 'hidden_dims': '[256, 128]', 'dropout': 0.2660678992376047, 'batch_norm': False, 'gat_heads': 7, 'gat_attn_dropout': 0.15835146958577234, 'gat_concat_hidden': True, 'lr': 7.680664364733443e-05, 'weight_decay': 4.8223726612066545e-06, 'epochs': 252, 'loss': 'mae', 'optimizer': 'adam', 'graph_mode': 'cutoff', 'cutoff': 0.859082988904001, 'grm_norm': 'none', 'self_loops': True}. Best is trial 39 with value: 0.2716230464692288.
[I 2025-10-21 00:07:30,657] Trial 120 finished with value: 0.25382645015067423 and parameters: {'model_type': 'gat', 'hidden_dims': '[512, 64]', 'dropout': 0.306220019083413, 'batch_norm': False, 'gat_heads': 8, 'gat_attn_dropout': 0.1354583171617745, 'gat_concat_hidden': True, 'lr': 0.00010127292711800452, 'weight_decay': 4.20031111087229e-06, 'epochs': 294, 'loss': 'mae', 'optimizer': 'adam', 'graph_mode': 'cutoff', 'cutoff': 0.8308968618523306, 'grm_norm': 'none', 'self_loops': True}. Best is trial 39 with value: 0.2716230464692288.
[I 2025-10-21 00:14:13,371] Trial 121 finished with value: 0.2521158039554579 and parameters: {'model_type': 'gat', 'hidden_dims': '[512, 64]', 'dropout': 0.2636862439067103, 'batch_norm': False, 'gat_heads': 6, 'gat_attn_dropout': 0.22507411750536283, 'gat_concat_hidden': True, 'lr': 8.718399520612418e-05, 'weight_decay': 1.142695350812218e-05, 'epochs': 217, 'loss': 'mae', 'optimizer': 'adam', 'graph_mode': 'cutoff', 'cutoff': 0.4593421633569261, 'grm_norm': 'none', 'self_loops': True}. Best is trial 39 with value: 0.2716230464692288.
[I 2025-10-21 00:22:34,523] Trial 122 finished with value: 0.2526052169113312 and parameters: {'model_type': 'gat', 'hidden_dims': '[512, 64]', 'dropout': 0.2839634244127635, 'batch_norm': False, 'gat_heads': 7, 'gat_attn_dropout': 0.2056138007697172, 'gat_concat_hidden': True, 'lr': 4.9433335158309606e-05, 'weight_decay': 1.5108893858207837e-05, 'epochs': 239, 'loss': 'mae', 'optimizer': 'adam', 'graph_mode': 'cutoff', 'cutoff': 0.8802776201301046, 'grm_norm': 'none', 'self_loops': True}. Best is trial 39 with value: 0.2716230464692288.
[I 2025-10-21 00:29:22,472] Trial 123 finished with value: 0.250478188426153 and parameters: {'model_type': 'gat', 'hidden_dims': '[512, 64]', 'dropout': 0.35871530244486327, 'batch_norm': False, 'gat_heads': 6, 'gat_attn_dropout': 0.1702500916444291, 'gat_concat_hidden': False, 'lr': 3.682181772827995e-05, 'weight_decay': 7.009690658224053e-06, 'epochs': 228, 'loss': 'mae', 'optimizer': 'adam', 'graph_mode': 'cutoff', 'cutoff': 0.8647377663526982, 'grm_norm': 'none', 'self_loops': True}. Best is trial 39 with value: 0.2716230464692288.
[I 2025-10-21 00:36:01,036] Trial 124 finished with value: 0.253043562567922 and parameters: {'model_type': 'gat', 'hidden_dims': '[512, 64]', 'dropout': 0.2558759329262133, 'batch_norm': False, 'gat_heads': 5, 'gat_attn_dropout': 0.24648942873646926, 'gat_concat_hidden': False, 'lr': 0.00010913354023636862, 'weight_decay': 9.226955638151968e-06, 'epochs': 263, 'loss': 'mae', 'optimizer': 'adam', 'graph_mode': 'cutoff', 'cutoff': 0.8990538837024372, 'grm_norm': 'none', 'self_loops': True}. Best is trial 39 with value: 0.2716230464692288.
[I 2025-10-21 00:43:22,036] Trial 125 finished with value: 0.25227854923490767 and parameters: {'model_type': 'gat', 'hidden_dims': '[512, 256]', 'dropout': 0.352544046201844, 'batch_norm': False, 'gat_heads': 6, 'gat_attn_dropout': 0.2688926804468441, 'gat_concat_hidden': False, 'lr': 0.0001370005392021521, 'weight_decay': 1.776258267664358e-05, 'epochs': 247, 'loss': 'mae', 'optimizer': 'adam', 'graph_mode': 'cutoff', 'cutoff': 0.8484809113722318, 'grm_norm': 'none', 'self_loops': True}. Best is trial 39 with value: 0.2716230464692288.
[I 2025-10-21 00:53:52,275] Trial 126 finished with value: 0.26083982816240703 and parameters: {'model_type': 'gat', 'hidden_dims': '[512, 64]', 'dropout': 0.3090003876238716, 'batch_norm': False, 'gat_heads': 8, 'gat_attn_dropout': 0.3101938235420174, 'gat_concat_hidden': True, 'lr': 8.433801205664249e-05, 'weight_decay': 3.143645095827914e-06, 'epochs': 257, 'loss': 'mae', 'optimizer': 'adam', 'graph_mode': 'cutoff', 'cutoff': 0.8161440204186785, 'grm_norm': 'none', 'self_loops': True}. Best is trial 39 with value: 0.2716230464692288.
[I 2025-10-21 01:04:21,019] Trial 127 finished with value: 0.09520281402707069 and parameters: {'model_type': 'gat', 'hidden_dims': '[512, 64]', 'dropout': 0.30996119751871576, 'batch_norm': False, 'gat_heads': 8, 'gat_attn_dropout': 0.30519057249512116, 'gat_concat_hidden': True, 'lr': 0.0001737066743230864, 'weight_decay': 2.045981310510267e-06, 'epochs': 256, 'loss': 'mse', 'optimizer': 'adam', 'graph_mode': 'cutoff', 'cutoff': 0.8056444022596092, 'grm_norm': 'none', 'self_loops': True}. Best is trial 39 with value: 0.2716230464692288.
[I 2025-10-21 01:15:42,904] Trial 128 finished with value: 0.252671978606067 and parameters: {'model_type': 'gat', 'hidden_dims': '[512, 64]', 'dropout': 0.3332734715568764, 'batch_norm': False, 'gat_heads': 8, 'gat_attn_dropout': 0.25551793945737095, 'gat_concat_hidden': True, 'lr': 0.00011628363485942418, 'weight_decay': 3.825287780798498e-06, 'epochs': 279, 'loss': 'mae', 'optimizer': 'adam', 'graph_mode': 'cutoff', 'cutoff': 0.8182760450335479, 'grm_norm': 'none', 'self_loops': True}. Best is trial 39 with value: 0.2716230464692288.
[I 2025-10-21 01:26:50,930] Trial 129 finished with value: 0.2583638181185977 and parameters: {'model_type': 'gat', 'hidden_dims': '[512, 64]', 'dropout': 0.2937399961139453, 'batch_norm': False, 'gat_heads': 8, 'gat_attn_dropout': 0.3257186277150926, 'gat_concat_hidden': True, 'lr': 5.6735041514311714e-05, 'weight_decay': 5.439675706008284e-05, 'epochs': 272, 'loss': 'mae', 'optimizer': 'adam', 'graph_mode': 'cutoff', 'cutoff': 0.7821919976506614, 'grm_norm': 'none', 'self_loops': True}. Best is trial 39 with value: 0.2716230464692288.
[I 2025-10-21 01:39:36,959] Trial 130 finished with value: 0.25378687284794893 and parameters: {'model_type': 'gat', 'hidden_dims': '[512, 64]', 'dropout': 0.27862284004705207, 'batch_norm': False, 'gat_heads': 8, 'gat_attn_dropout': 0.33772760038846944, 'gat_concat_hidden': True, 'lr': 5.40362977456841e-05, 'weight_decay': 5.852041702271084e-05, 'epochs': 314, 'loss': 'mae', 'optimizer': 'adam', 'graph_mode': 'cutoff', 'cutoff': 0.7863673494145668, 'grm_norm': 'none', 'self_loops': True}. Best is trial 39 with value: 0.2716230464692288.
[I 2025-10-21 01:50:44,684] Trial 131 finished with value: 0.25867933884893324 and parameters: {'model_type': 'gat', 'hidden_dims': '[512, 64]', 'dropout': 0.2926800972684611, 'batch_norm': False, 'gat_heads': 8, 'gat_attn_dropout': 0.31321951804280573, 'gat_concat_hidden': True, 'lr': 6.4366999078734e-05, 'weight_decay': 3.641872611604107e-05, 'epochs': 272, 'loss': 'mae', 'optimizer': 'adam', 'graph_mode': 'cutoff', 'cutoff': 0.7915151953065185, 'grm_norm': 'none', 'self_loops': True}. Best is trial 39 with value: 0.2716230464692288.
[I 2025-10-21 02:02:01,911] Trial 132 finished with value: 0.2566471363852011 and parameters: {'model_type': 'gat', 'hidden_dims': '[512, 64]', 'dropout': 0.29884318979716, 'batch_norm': False, 'gat_heads': 8, 'gat_attn_dropout': 0.34694039518092945, 'gat_concat_hidden': True, 'lr': 6.725984264976893e-05, 'weight_decay': 3.848893864394368e-05, 'epochs': 276, 'loss': 'mae', 'optimizer': 'adam', 'graph_mode': 'cutoff', 'cutoff': 0.7732279742521146, 'grm_norm': 'none', 'self_loops': True}. Best is trial 39 with value: 0.2716230464692288.
[I 2025-10-21 02:12:52,939] Trial 133 finished with value: 0.2570952440524759 and parameters: {'model_type': 'gat', 'hidden_dims': '[512, 64]', 'dropout': 0.291945947162454, 'batch_norm': False, 'gat_heads': 8, 'gat_attn_dropout': 0.31172331853014634, 'gat_concat_hidden': True, 'lr': 7.703608155726821e-05, 'weight_decay': 2.2240745336756507e-05, 'epochs': 263, 'loss': 'mae', 'optimizer': 'adam', 'graph_mode': 'cutoff', 'cutoff': 0.5661898207518391, 'grm_norm': 'none', 'self_loops': True}. Best is trial 39 with value: 0.2716230464692288.
[I 2025-10-21 02:23:56,589] Trial 134 finished with value: 0.25106399894581327 and parameters: {'model_type': 'gat', 'hidden_dims': '[512, 64]', 'dropout': 0.31835868035594095, 'batch_norm': False, 'gat_heads': 8, 'gat_attn_dropout': 0.2943258931434866, 'gat_concat_hidden': True, 'lr': 6.042670833616627e-05, 'weight_decay': 2.7143748899025073e-05, 'epochs': 270, 'loss': 'mae', 'optimizer': 'adam', 'graph_mode': 'cutoff', 'cutoff': 0.7951575262845628, 'grm_norm': 'none', 'self_loops': True}. Best is trial 39 with value: 0.2716230464692288.
[I 2025-10-21 02:35:45,925] Trial 135 finished with value: 0.2548409368225283 and parameters: {'model_type': 'gat', 'hidden_dims': '[512, 64]', 'dropout': 0.312432455475262, 'batch_norm': False, 'gat_heads': 8, 'gat_attn_dropout': 0.27304228901427935, 'gat_concat_hidden': True, 'lr': 7.8809760604534e-05, 'weight_decay': 5.412472884184556e-05, 'epochs': 291, 'loss': 'mae', 'optimizer': 'adam', 'graph_mode': 'cutoff', 'cutoff': 0.8339004098713823, 'grm_norm': 'none', 'self_loops': True}. Best is trial 39 with value: 0.2716230464692288.
[I 2025-10-21 02:44:34,647] Trial 136 finished with value: 0.2620955669380028 and parameters: {'model_type': 'gat', 'hidden_dims': '[512, 64]', 'dropout': 0.23273518068311858, 'batch_norm': False, 'gat_heads': 7, 'gat_attn_dropout': 0.25938982087727774, 'gat_concat_hidden': True, 'lr': 9.264229715833427e-05, 'weight_decay': 3.428561058696045e-05, 'epochs': 254, 'loss': 'mae', 'optimizer': 'adam', 'graph_mode': 'cutoff', 'cutoff': 0.8172778781485743, 'grm_norm': 'cosine_then_gcn', 'self_loops': True}. Best is trial 39 with value: 0.2716230464692288.
[I 2025-10-21 02:46:22,743] Trial 137 finished with value: 0.13488217169309916 and parameters: {'model_type': 'gat', 'hidden_dims': '[512, 64]', 'dropout': 0.24934292806410557, 'batch_norm': False, 'gat_heads': 7, 'gat_attn_dropout': 0.26463010576006113, 'gat_concat_hidden': True, 'lr': 9.582188850627965e-05, 'weight_decay': 3.215279672939471e-05, 'epochs': 40, 'loss': 'mae', 'optimizer': 'adam', 'graph_mode': 'cutoff', 'cutoff': 0.8211514921497458, 'grm_norm': 'cosine_then_gcn', 'self_loops': True}. Best is trial 39 with value: 0.2716230464692288.
[I 2025-10-21 02:50:53,230] Trial 138 finished with value: 0.25289822215186586 and parameters: {'model_type': 'gat', 'hidden_dims': '[256, 128]', 'dropout': 0.23326774026647387, 'batch_norm': False, 'gat_heads': 7, 'gat_attn_dropout': 0.21085731680674374, 'gat_concat_hidden': True, 'lr': 0.00012175139319436526, 'weight_decay': 2.3861211213771543e-06, 'epochs': 255, 'loss': 'mae', 'optimizer': 'adam', 'graph_mode': 'cutoff', 'cutoff': 0.848821845867183, 'grm_norm': 'cosine_then_gcn', 'self_loops': True}. Best is trial 39 with value: 0.2716230464692288.
[I 2025-10-21 02:52:37,500] Trial 139 finished with value: 0.272271961453579 and parameters: {'model_type': 'gat', 'hidden_dims': '[128, 64]', 'dropout': 0.26949485715398347, 'batch_norm': False, 'gat_heads': 5, 'gat_attn_dropout': 0.28088134344587773, 'gat_concat_hidden': True, 'lr': 0.0001479720130273006, 'weight_decay': 7.696102553749427e-06, 'epochs': 241, 'loss': 'mae', 'optimizer': 'adam', 'graph_mode': 'cutoff', 'cutoff': 0.8703578986570222, 'grm_norm': 'cosine_then_gcn', 'self_loops': True}. Best is trial 139 with value: 0.272271961453579.
[I 2025-10-21 02:54:19,447] Trial 140 finished with value: 0.24389602441720304 and parameters: {'model_type': 'gat', 'hidden_dims': '[128, 64]', 'dropout': 0.20814111272451208, 'batch_norm': False, 'gat_heads': 5, 'gat_attn_dropout': 0.2903266901710583, 'gat_concat_hidden': True, 'lr': 8.75342265991616e-05, 'weight_decay': 2.0557065171988764e-05, 'epochs': 235, 'loss': 'mae', 'optimizer': 'adam', 'graph_mode': 'cutoff', 'cutoff': 0.8671419697884116, 'grm_norm': 'cosine_then_gcn', 'self_loops': True}. Best is trial 139 with value: 0.272271961453579.
[I 2025-10-21 02:56:07,148] Trial 141 finished with value: 0.2583267244656954 and parameters: {'model_type': 'gat', 'hidden_dims': '[128, 64]', 'dropout': 0.27290114282307576, 'batch_norm': False, 'gat_heads': 5, 'gat_attn_dropout': 0.24031225325361952, 'gat_concat_hidden': True, 'lr': 0.00014647220026384343, 'weight_decay': 6.148669357068527e-06, 'epochs': 250, 'loss': 'mae', 'optimizer': 'adam', 'graph_mode': 'cutoff', 'cutoff': 0.8816205421558974, 'grm_norm': 'cosine_then_gcn', 'self_loops': True}. Best is trial 139 with value: 0.272271961453579.
[I 2025-10-21 02:57:50,676] Trial 142 finished with value: 0.2329687436302271 and parameters: {'model_type': 'gat', 'hidden_dims': '[128, 64]', 'dropout': 0.254327091010552, 'batch_norm': False, 'gat_heads': 5, 'gat_attn_dropout': 0.31566459077357856, 'gat_concat_hidden': True, 'lr': 0.0002424056175543397, 'weight_decay': 8.068467205584256e-06, 'epochs': 240, 'loss': 'mae', 'optimizer': 'adam', 'graph_mode': 'cutoff', 'cutoff': 0.8571351775073405, 'grm_norm': 'cosine_then_gcn', 'self_loops': True}. Best is trial 139 with value: 0.272271961453579.
[I 2025-10-21 02:59:26,313] Trial 143 finished with value: 0.24266363681313283 and parameters: {'model_type': 'gat', 'hidden_dims': '[128, 64]', 'dropout': 0.327623178037198, 'batch_norm': False, 'gat_heads': 5, 'gat_attn_dropout': 0.2755827913523932, 'gat_concat_hidden': True, 'lr': 0.00017108751846698188, 'weight_decay': 1.4848849422874385e-05, 'epochs': 220, 'loss': 'mae', 'optimizer': 'adam', 'graph_mode': 'cutoff', 'cutoff': 0.8003749362654557, 'grm_norm': 'cosine_then_gcn', 'self_loops': True}. Best is trial 139 with value: 0.272271961453579.
[I 2025-10-21 03:08:01,413] Trial 144 finished with value: 0.25942600824386536 and parameters: {'model_type': 'gat', 'hidden_dims': '[512, 64]', 'dropout': 0.22015208234845662, 'batch_norm': False, 'gat_heads': 7, 'gat_attn_dropout': 0.25746332276448425, 'gat_concat_hidden': True, 'lr': 0.00012426747041281296, 'weight_decay': 1.107763024999842e-05, 'epochs': 247, 'loss': 'mae', 'optimizer': 'adam', 'graph_mode': 'cutoff', 'cutoff': 0.8316860494729124, 'grm_norm': 'cosine', 'self_loops': True}. Best is trial 139 with value: 0.272271961453579.
[I 2025-10-21 03:17:00,451] Trial 145 finished with value: 0.2541525099384769 and parameters: {'model_type': 'gat', 'hidden_dims': '[512, 64]', 'dropout': 0.2129188325000123, 'batch_norm': False, 'gat_heads': 7, 'gat_attn_dropout': 0.35267711454782247, 'gat_concat_hidden': True, 'lr': 0.00011065267835108732, 'weight_decay': 1.8783466948379356e-05, 'epochs': 259, 'loss': 'mae', 'optimizer': 'adam', 'graph_mode': 'cutoff', 'cutoff': 0.8296186706995337, 'grm_norm': 'cosine', 'self_loops': True}. Best is trial 139 with value: 0.272271961453579.
[I 2025-10-21 03:25:27,437] Trial 146 finished with value: 0.16458953472950805 and parameters: {'model_type': 'gat', 'hidden_dims': '[512, 128]', 'dropout': 0.24094963235919992, 'batch_norm': False, 'gat_heads': 7, 'gat_attn_dropout': 0.26175920269624897, 'gat_concat_hidden': True, 'lr': 6.832455180313475e-05, 'weight_decay': 1.250364125025385e-06, 'epochs': 232, 'loss': 'mae', 'optimizer': 'adam', 'graph_mode': 'knn', 'source': 'grm', 'knn_k': 2, 'weighted_edges': True, 'symmetrize_mode': 'union'}. Best is trial 139 with value: 0.272271961453579.
[I 2025-10-21 03:32:53,138] Trial 147 finished with value: 0.24744418712433527 and parameters: {'model_type': 'gat', 'hidden_dims': '[512, 64]', 'dropout': 0.19629951868351161, 'batch_norm': False, 'gat_heads': 7, 'gat_attn_dropout': 0.29776474730366576, 'gat_concat_hidden': True, 'lr': 0.00012072258503697199, 'weight_decay': 3.4000858906475565e-05, 'epochs': 212, 'loss': 'mae', 'optimizer': 'adam', 'graph_mode': 'cutoff', 'cutoff': 0.8856473700471359, 'grm_norm': 'cosine', 'self_loops': True}. Best is trial 139 with value: 0.272271961453579.
[I 2025-10-21 03:42:41,907] Trial 148 finished with value: 0.25375698339625546 and parameters: {'model_type': 'gat', 'hidden_dims': '[512, 64]', 'dropout': 0.19415410990116277, 'batch_norm': False, 'gat_heads': 7, 'gat_attn_dropout': 0.3308517803693142, 'gat_concat_hidden': True, 'lr': 9.735676423515355e-05, 'weight_decay': 1.1355731237038491e-05, 'epochs': 285, 'loss': 'mae', 'optimizer': 'adam', 'graph_mode': 'cutoff', 'cutoff': 0.8155258835246466, 'grm_norm': 'cosine', 'self_loops': True}. Best is trial 139 with value: 0.272271961453579.
[I 2025-10-21 03:49:53,668] Trial 149 finished with value: 0.2322770747927286 and parameters: {'model_type': 'gat', 'hidden_dims': '[512, 64]', 'dropout': 0.3834310382638325, 'batch_norm': False, 'gat_heads': 6, 'gat_attn_dropout': 0.2799919626043566, 'gat_concat_hidden': True, 'lr': 0.0003246139905079821, 'weight_decay': 2.507929187747706e-05, 'epochs': 242, 'loss': 'mae', 'optimizer': 'adam', 'graph_mode': 'cutoff', 'cutoff': 0.8693875959259214, 'grm_norm': 'cosine', 'self_loops': True}. Best is trial 139 with value: 0.272271961453579.
[I 2025-10-21 03:50:31,974] Trial 0 finished with value: 0.08071954106990545 and parameters: {'model_type': 'gat', 'hidden_dims': '[128, 64]', 'dropout': 0.199031432379812, 'batch_norm': True, 'gat_heads': 1, 'gat_attn_dropout': 0.41121589102067835, 'gat_concat_hidden': True, 'lr': 3.4401453323286906e-05, 'weight_decay': 0.00017802616915745114, 'epochs': 230, 'loss': 'mse', 'optimizer': 'adam', 'graph_mode': 'knn', 'source': 'grm', 'knn_k': 6, 'weighted_edges': True, 'symmetrize_mode': 'mutual'}. Best is trial 0 with value: 0.08071954106990545.
[I 2025-10-21 03:51:43,822] Trial 1 finished with value: 0.10068198017646464 and parameters: {'model_type': 'gat', 'hidden_dims': '[512, 64]', 'dropout': 0.36082357619681704, 'batch_norm': True, 'gat_heads': 1, 'gat_attn_dropout': 0.18042003398172202, 'gat_concat_hidden': False, 'lr': 1.3825758230956745e-06, 'weight_decay': 3.199989794411411e-05, 'epochs': 210, 'loss': 'mse', 'optimizer': 'adam', 'graph_mode': 'knn', 'source': 'grm', 'knn_k': 8, 'weighted_edges': True, 'symmetrize_mode': 'mutual'}. Best is trial 1 with value: 0.10068198017646464.
[I 2025-10-21 03:54:13,623] Trial 2 finished with value: 0.17017154688852065 and parameters: {'model_type': 'gat', 'hidden_dims': '[512, 64]', 'dropout': 0.5938127374509361, 'batch_norm': False, 'gat_heads': 3, 'gat_attn_dropout': 0.3584229889385306, 'gat_concat_hidden': True, 'lr': 5.8966328690006356e-05, 'weight_decay': 1.4359095002909625e-07, 'epochs': 151, 'loss': 'mae', 'optimizer': 'adam', 'graph_mode': 'cutoff', 'cutoff': 0.22797144608298409, 'grm_norm': 'none', 'self_loops': False}. Best is trial 2 with value: 0.17017154688852065.
[I 2025-10-21 03:54:50,789] Trial 3 finished with value: 0.10945862939228564 and parameters: {'model_type': 'gat', 'hidden_dims': '[256, 128]', 'dropout': 0.23110783056597514, 'batch_norm': True, 'gat_heads': 3, 'gat_attn_dropout': 0.14524552524211642, 'gat_concat_hidden': False, 'lr': 2.6631568299397822e-05, 'weight_decay': 1.4831733219640837e-06, 'epochs': 59, 'loss': 'mse', 'optimizer': 'adam', 'graph_mode': 'cutoff', 'cutoff': 0.5085416774304665, 'grm_norm': 'cosine_then_gcn', 'self_loops': False}. Best is trial 2 with value: 0.17017154688852065.
[I 2025-10-21 03:55:22,146] Trial 4 finished with value: 0.1861338261124123 and parameters: {'model_type': 'gat', 'hidden_dims': '[128, 64]', 'dropout': 0.24986493621228142, 'batch_norm': False, 'gat_heads': 2, 'gat_attn_dropout': 0.03028660209239857, 'gat_concat_hidden': True, 'lr': 3.4411882055364858e-06, 'weight_decay': 0.00034938832175517785, 'epochs': 153, 'loss': 'mae', 'optimizer': 'adam', 'graph_mode': 'cutoff', 'cutoff': 0.5288497054083461, 'grm_norm': 'cosine_then_gcn', 'self_loops': False}. Best is trial 4 with value: 0.1861338261124123.
[I 2025-10-21 03:56:44,847] Trial 5 finished with value: 0.19692025427945242 and parameters: {'model_type': 'gat', 'hidden_dims': '[256, 128, 64]', 'dropout': 0.3667354424945013, 'batch_norm': False, 'gat_heads': 5, 'gat_attn_dropout': 0.47505419776597435, 'gat_concat_hidden': False, 'lr': 5.6570170227139244e-05, 'weight_decay': 6.845407486393404e-05, 'epochs': 86, 'loss': 'mae', 'optimizer': 'adam', 'graph_mode': 'cutoff', 'cutoff': 0.3163415033931736, 'grm_norm': 'cosine', 'self_loops': False}. Best is trial 5 with value: 0.19692025427945242.
[I 2025-10-21 03:59:40,472] Trial 6 finished with value: 0.1389928748497931 and parameters: {'model_type': 'gat', 'hidden_dims': '[512, 64]', 'dropout': 0.4724320384750339, 'batch_norm': True, 'gat_heads': 2, 'gat_attn_dropout': 0.5029567924222157, 'gat_concat_hidden': False, 'lr': 0.00035117819773722113, 'weight_decay': 2.586139236899202e-05, 'epochs': 282, 'loss': 'mse', 'optimizer': 'adam', 'graph_mode': 'knn', 'source': 'grm', 'knn_k': 5, 'weighted_edges': False, 'symmetrize_mode': 'mutual'}. Best is trial 5 with value: 0.19692025427945242.
[I 2025-10-21 04:00:11,404] Trial 7 finished with value: 0.13362197581861307 and parameters: {'model_type': 'gat', 'hidden_dims': '[256, 128]', 'dropout': 0.26933956649466984, 'batch_norm': False, 'gat_heads': 1, 'gat_attn_dropout': 0.12357015502138351, 'gat_concat_hidden': True, 'lr': 9.272145288974393e-05, 'weight_decay': 0.0001637847231599168, 'epochs': 149, 'loss': 'mae', 'optimizer': 'adam', 'graph_mode': 'knn', 'source': 'grm', 'knn_k': 9, 'weighted_edges': False, 'symmetrize_mode': 'mutual'}. Best is trial 5 with value: 0.19692025427945242.
[I 2025-10-21 04:00:30,971] Trial 8 finished with value: 0.1493663405519854 and parameters: {'model_type': 'gat', 'hidden_dims': '[256, 128, 64]', 'dropout': 0.5327763091136416, 'batch_norm': True, 'gat_heads': 1, 'gat_attn_dropout': 0.11077610280855929, 'gat_concat_hidden': False, 'lr': 0.0005504846263330393, 'weight_decay': 6.7826287729705615e-06, 'epochs': 80, 'loss': 'mse', 'optimizer': 'adam', 'graph_mode': 'cutoff', 'cutoff': 0.39200637331077737, 'grm_norm': 'cosine_then_gcn', 'self_loops': False}. Best is trial 5 with value: 0.19692025427945242.
