[I 2025-11-03 12:36:31,213] Trial 82 finished with value: 0.16293109077880005 and parameters: {'model_type': 'graphsage', 'hidden_dims': '[512, 128]', 'dropout': 0.3853018989247988, 'batch_norm': True, 'lr': 0.0009644575674185606, 'weight_decay': 9.367271255064732e-05, 'epochs': 267, 'loss': 'mse', 'optimizer': 'adam', 'graph_mode': 'knn', 'source': 'grm', 'knn_k': 8, 'weighted_edges': True, 'symmetrize_mode': 'mutual', 'use_snp_selection': False}. Best is trial 78 with value: 0.19144233510547573.
[I 2025-11-03 12:36:42,731] Trial 83 finished with value: 0.1613800181921982 and parameters: {'model_type': 'graphsage', 'hidden_dims': '[512, 128]', 'dropout': 0.3531879626093065, 'batch_norm': True, 'lr': 0.0005248528576946007, 'weight_decay': 3.9245790452281186e-05, 'epochs': 292, 'loss': 'mse', 'optimizer': 'adam', 'graph_mode': 'knn', 'source': 'grm', 'knn_k': 8, 'weighted_edges': True, 'symmetrize_mode': 'mutual', 'use_snp_selection': False}. Best is trial 78 with value: 0.19144233510547573.
[I 2025-11-03 12:36:49,524] Trial 84 finished with value: 0.16378300257092834 and parameters: {'model_type': 'graphsage', 'hidden_dims': '[512, 128]', 'dropout': 0.32544715718359346, 'batch_norm': True, 'lr': 0.00044207708869854615, 'weight_decay': 6.283220704756961e-05, 'epochs': 153, 'loss': 'mse', 'optimizer': 'adam', 'graph_mode': 'knn', 'source': 'grm', 'knn_k': 6, 'weighted_edges': True, 'symmetrize_mode': 'mutual', 'use_snp_selection': False}. Best is trial 78 with value: 0.19144233510547573.
[I 2025-11-03 12:37:00,181] Trial 85 finished with value: 0.17106371752899657 and parameters: {'model_type': 'graphsage', 'hidden_dims': '[512, 128]', 'dropout': 0.3947336240327446, 'batch_norm': True, 'lr': 0.0007861382896657758, 'weight_decay': 2.8703973561208677e-05, 'epochs': 274, 'loss': 'mse', 'optimizer': 'adam', 'graph_mode': 'knn', 'source': 'grm', 'knn_k': 7, 'weighted_edges': True, 'symmetrize_mode': 'mutual', 'use_snp_selection': False}. Best is trial 78 with value: 0.19144233510547573.
[I 2025-11-03 12:37:03,248] Trial 86 finished with value: 0.004005299737868718 and parameters: {'model_type': 'graphsage', 'hidden_dims': '[128, 64]', 'dropout': 0.42406265360086803, 'batch_norm': True, 'lr': 3.08627548218769e-06, 'weight_decay': 1.1297785998391168e-05, 'epochs': 129, 'loss': 'mse', 'optimizer': 'adam', 'graph_mode': 'knn', 'source': 'grm', 'knn_k': 7, 'weighted_edges': True, 'symmetrize_mode': 'mutual', 'use_snp_selection': False}. Best is trial 78 with value: 0.19144233510547573.
[I 2025-11-03 12:37:10,629] Trial 87 finished with value: 0.13343324831842907 and parameters: {'model_type': 'graphsage', 'hidden_dims': '[512, 128]', 'dropout': 0.5216658465649514, 'batch_norm': True, 'lr': 0.0002225027136773886, 'weight_decay': 1.821766101717679e-05, 'epochs': 173, 'loss': 'mse', 'optimizer': 'adam', 'graph_mode': 'cutoff', 'cutoff': 0.32945070822330813, 'grm_norm': 'gcn', 'self_loops': False, 'use_snp_selection': False}. Best is trial 78 with value: 0.19144233510547573.
[I 2025-11-03 12:37:20,488] Trial 88 finished with value: 0.16364780107107355 and parameters: {'model_type': 'graphsage', 'hidden_dims': '[512, 128]', 'dropout': 0.10868218346594885, 'batch_norm': True, 'lr': 0.00034339694755526975, 'weight_decay': 5.961932298393059e-06, 'epochs': 242, 'loss': 'mse', 'optimizer': 'adam', 'graph_mode': 'knn', 'source': 'grm', 'knn_k': 8, 'weighted_edges': True, 'symmetrize_mode': 'mutual', 'use_snp_selection': False}. Best is trial 78 with value: 0.19144233510547573.
[I 2025-11-03 12:37:27,248] Trial 89 finished with value: 0.16117840934478683 and parameters: {'model_type': 'graphsage', 'hidden_dims': '[256, 128, 64]', 'dropout': 0.3652273194109689, 'batch_norm': True, 'lr': 0.0002868270746253081, 'weight_decay': 5.199987868914572e-05, 'epochs': 256, 'loss': 'mse', 'optimizer': 'adam', 'graph_mode': 'knn', 'source': 'grm', 'knn_k': 7, 'weighted_edges': True, 'symmetrize_mode': 'mutual', 'use_snp_selection': False}. Best is trial 78 with value: 0.19144233510547573.
[I 2025-11-03 12:37:33,944] Trial 90 finished with value: 0.16362094891235784 and parameters: {'model_type': 'graphsage', 'hidden_dims': '[512, 128]', 'dropout': 0.40577692176539426, 'batch_norm': True, 'lr': 0.0006080821563193564, 'weight_decay': 0.00018444247036240844, 'epochs': 143, 'loss': 'mse', 'optimizer': 'adam', 'graph_mode': 'knn', 'source': 'grm', 'knn_k': 8, 'weighted_edges': True, 'symmetrize_mode': 'mutual', 'use_snp_selection': False}. Best is trial 78 with value: 0.19144233510547573.
[I 2025-11-03 12:37:42,784] Trial 91 finished with value: 0.16945739901927484 and parameters: {'model_type': 'graphsage', 'hidden_dims': '[512, 128]', 'dropout': 0.3511682072997873, 'batch_norm': True, 'lr': 0.00018641404096082534, 'weight_decay': 8.915005821597356e-05, 'epochs': 222, 'loss': 'mse', 'optimizer': 'adam', 'graph_mode': 'knn', 'source': 'grm', 'knn_k': 6, 'weighted_edges': True, 'symmetrize_mode': 'mutual', 'use_snp_selection': False}. Best is trial 78 with value: 0.19144233510547573.
[I 2025-11-03 12:37:47,554] Trial 92 finished with value: 0.1565721628155387 and parameters: {'model_type': 'graphsage', 'hidden_dims': '[128, 64]', 'dropout': 0.33656133565187357, 'batch_norm': True, 'lr': 0.00015958856901631365, 'weight_decay': 1.2414689142836228e-05, 'epochs': 235, 'loss': 'mse', 'optimizer': 'adam', 'graph_mode': 'knn', 'source': 'grm', 'knn_k': 8, 'weighted_edges': True, 'symmetrize_mode': 'mutual', 'use_snp_selection': False}. Best is trial 78 with value: 0.19144233510547573.
[I 2025-11-03 12:37:57,496] Trial 93 finished with value: 0.18036134493023728 and parameters: {'model_type': 'graphsage', 'hidden_dims': '[512, 256]', 'dropout': 0.3772077405165523, 'batch_norm': True, 'lr': 8.774134120020595e-05, 'weight_decay': 2.261624557884108e-05, 'epochs': 251, 'loss': 'mse', 'optimizer': 'adam', 'graph_mode': 'knn', 'source': 'grm', 'knn_k': 7, 'weighted_edges': True, 'symmetrize_mode': 'mutual', 'use_snp_selection': False}. Best is trial 78 with value: 0.19144233510547573.
[I 2025-11-03 12:38:08,386] Trial 94 finished with value: 0.175815703504261 and parameters: {'model_type': 'graphsage', 'hidden_dims': '[512, 256]', 'dropout': 0.38015021060861776, 'batch_norm': True, 'lr': 8.318338024691575e-05, 'weight_decay': 2.4768734202084194e-05, 'epochs': 282, 'loss': 'mse', 'optimizer': 'adam', 'graph_mode': 'knn', 'source': 'grm', 'knn_k': 7, 'weighted_edges': True, 'symmetrize_mode': 'mutual', 'use_snp_selection': False}. Best is trial 78 with value: 0.19144233510547573.
[I 2025-11-03 12:38:18,379] Trial 95 finished with value: 0.15288817882415567 and parameters: {'model_type': 'graphsage', 'hidden_dims': '[512, 256]', 'dropout': 0.39043105238770565, 'batch_norm': True, 'lr': 0.00011621577927313768, 'weight_decay': 3.957647381155295e-05, 'epochs': 261, 'loss': 'mse', 'optimizer': 'adam', 'graph_mode': 'knn', 'source': 'grm', 'knn_k': 6, 'weighted_edges': True, 'symmetrize_mode': 'mutual', 'use_snp_selection': False}. Best is trial 78 with value: 0.19144233510547573.
[I 2025-11-03 12:38:28,587] Trial 96 finished with value: 0.13392932112774134 and parameters: {'model_type': 'graphsage', 'hidden_dims': '[512, 256]', 'dropout': 0.3775253314834445, 'batch_norm': True, 'lr': 6.362142534553246e-05, 'weight_decay': 2.558099669410906e-05, 'epochs': 278, 'loss': 'mse', 'optimizer': 'adam', 'graph_mode': 'cutoff', 'cutoff': 0.46240551584630135, 'grm_norm': 'cosine_then_gcn', 'self_loops': False, 'use_snp_selection': False}. Best is trial 78 with value: 0.19144233510547573.
[I 2025-11-03 12:38:40,166] Trial 97 finished with value: 0.17720769290591276 and parameters: {'model_type': 'graphsage', 'hidden_dims': '[512, 256]', 'dropout': 0.29803505239431116, 'batch_norm': True, 'lr': 0.00044359660037641567, 'weight_decay': 2.2748343336354525e-05, 'epochs': 303, 'loss': 'mse', 'optimizer': 'adam', 'graph_mode': 'knn', 'source': 'grm', 'knn_k': 7, 'weighted_edges': True, 'symmetrize_mode': 'mutual', 'use_snp_selection': False}. Best is trial 78 with value: 0.19144233510547573.
[I 2025-11-03 12:38:51,513] Trial 98 finished with value: 0.12978621517049801 and parameters: {'model_type': 'graphsage', 'hidden_dims': '[512, 256]', 'dropout': 0.28208223182019226, 'batch_norm': False, 'lr': 0.00025826883903039375, 'weight_decay': 1.9427319893268916e-05, 'epochs': 301, 'loss': 'mse', 'optimizer': 'adam', 'graph_mode': 'knn', 'source': 'grm', 'knn_k': 7, 'weighted_edges': True, 'symmetrize_mode': 'mutual', 'use_snp_selection': False}. Best is trial 78 with value: 0.19144233510547573.
[I 2025-11-03 12:39:03,472] Trial 99 finished with value: 0.15306282026485485 and parameters: {'model_type': 'graphsage', 'hidden_dims': '[512, 256]', 'dropout': 0.31891583589349276, 'batch_norm': True, 'lr': 3.939845055070622e-05, 'weight_decay': 3.658564426851965e-05, 'epochs': 316, 'loss': 'mse', 'optimizer': 'adam', 'graph_mode': 'knn', 'source': 'grm', 'knn_k': 7, 'weighted_edges': True, 'symmetrize_mode': 'mutual', 'use_snp_selection': False}. Best is trial 78 with value: 0.19144233510547573.
[I 2025-11-03 12:39:16,387] Trial 100 finished with value: 0.15929198157775343 and parameters: {'model_type': 'graphsage', 'hidden_dims': '[512, 256]', 'dropout': 0.24799863064210015, 'batch_norm': True, 'lr': 8.77917538723947e-05, 'weight_decay': 8.815474155019063e-06, 'epochs': 286, 'loss': 'mse', 'optimizer': 'adam', 'graph_mode': 'cutoff', 'cutoff': 0.24239722915710188, 'grm_norm': 'none', 'self_loops': True, 'use_snp_selection': False}. Best is trial 78 with value: 0.19144233510547573.
[I 2025-11-03 12:39:27,798] Trial 101 finished with value: 0.17096445143237435 and parameters: {'model_type': 'graphsage', 'hidden_dims': '[512, 256]', 'dropout': 0.35490907658130494, 'batch_norm': True, 'lr': 0.0005141287305813583, 'weight_decay': 7.502829785820976e-05, 'epochs': 300, 'loss': 'mse', 'optimizer': 'adam', 'graph_mode': 'knn', 'source': 'grm', 'knn_k': 7, 'weighted_edges': True, 'symmetrize_mode': 'mutual', 'use_snp_selection': False}. Best is trial 78 with value: 0.19144233510547573.
[I 2025-11-03 12:39:38,156] Trial 102 finished with value: 0.17358623433722173 and parameters: {'model_type': 'graphsage', 'hidden_dims': '[512, 256]', 'dropout': 0.2985441698688074, 'batch_norm': True, 'lr': 0.00043772024901445777, 'weight_decay': 2.357988031299533e-05, 'epochs': 272, 'loss': 'mse', 'optimizer': 'adam', 'graph_mode': 'knn', 'source': 'grm', 'knn_k': 6, 'weighted_edges': True, 'symmetrize_mode': 'mutual', 'use_snp_selection': False}. Best is trial 78 with value: 0.19144233510547573.
[I 2025-11-03 12:39:48,442] Trial 103 finished with value: 0.16907399341973192 and parameters: {'model_type': 'graphsage', 'hidden_dims': '[512, 256]', 'dropout': 0.30122451332698674, 'batch_norm': True, 'lr': 0.0003412797696028572, 'weight_decay': 1.5469145231859752e-05, 'epochs': 270, 'loss': 'mse', 'optimizer': 'adam', 'graph_mode': 'knn', 'source': 'grm', 'knn_k': 6, 'weighted_edges': True, 'symmetrize_mode': 'mutual', 'use_snp_selection': False}. Best is trial 78 with value: 0.19144233510547573.
[I 2025-11-03 12:39:57,956] Trial 104 finished with value: 0.16947757000997893 and parameters: {'model_type': 'graphsage', 'hidden_dims': '[512, 256]', 'dropout': 0.29675759098302645, 'batch_norm': True, 'lr': 0.0004077458245488354, 'weight_decay': 2.384740667045744e-05, 'epochs': 252, 'loss': 'mse', 'optimizer': 'adam', 'graph_mode': 'knn', 'source': 'grm', 'knn_k': 5, 'weighted_edges': True, 'symmetrize_mode': 'mutual', 'use_snp_selection': False}. Best is trial 78 with value: 0.19144233510547573.
[I 2025-11-03 12:40:10,195] Trial 105 finished with value: 0.17834578908133325 and parameters: {'model_type': 'graphsage', 'hidden_dims': '[512, 256]', 'dropout': 0.36874010696787674, 'batch_norm': True, 'lr': 0.000105906581225437, 'weight_decay': 2.8345186314430552e-05, 'epochs': 324, 'loss': 'mse', 'optimizer': 'adam', 'graph_mode': 'knn', 'source': 'grm', 'knn_k': 7, 'weighted_edges': True, 'symmetrize_mode': 'mutual', 'use_snp_selection': False}. Best is trial 78 with value: 0.19144233510547573.
[I 2025-11-03 12:40:22,944] Trial 106 finished with value: 0.17823386931053029 and parameters: {'model_type': 'graphsage', 'hidden_dims': '[512, 256]', 'dropout': 0.3710053325740061, 'batch_norm': True, 'lr': 9.884335260744414e-05, 'weight_decay': 2.8491520183092712e-05, 'epochs': 341, 'loss': 'mse', 'optimizer': 'adam', 'graph_mode': 'knn', 'source': 'grm', 'knn_k': 7, 'weighted_edges': True, 'symmetrize_mode': 'mutual', 'use_snp_selection': False}. Best is trial 78 with value: 0.19144233510547573.
[I 2025-11-03 12:40:35,937] Trial 107 finished with value: 0.18375646237893112 and parameters: {'model_type': 'graphsage', 'hidden_dims': '[512, 256]', 'dropout': 0.3674619878182598, 'batch_norm': True, 'lr': 7.644011948386127e-05, 'weight_decay': 3.137498844418304e-05, 'epochs': 349, 'loss': 'mse', 'optimizer': 'adam', 'graph_mode': 'knn', 'source': 'grm', 'knn_k': 7, 'weighted_edges': True, 'symmetrize_mode': 'mutual', 'use_snp_selection': False}. Best is trial 78 with value: 0.19144233510547573.
[I 2025-11-03 12:40:48,869] Trial 108 finished with value: 0.1729690143300211 and parameters: {'model_type': 'graphsage', 'hidden_dims': '[512, 256]', 'dropout': 0.37144819644701643, 'batch_norm': True, 'lr': 4.8917259166548024e-05, 'weight_decay': 3.0056763487021104e-05, 'epochs': 346, 'loss': 'mse', 'optimizer': 'adam', 'graph_mode': 'knn', 'source': 'grm', 'knn_k': 7, 'weighted_edges': True, 'symmetrize_mode': 'mutual', 'use_snp_selection': False}. Best is trial 78 with value: 0.19144233510547573.
[I 2025-11-03 12:41:01,781] Trial 109 finished with value: 0.16860881860631047 and parameters: {'model_type': 'graphsage', 'hidden_dims': '[512, 256]', 'dropout': 0.340487012810336, 'batch_norm': True, 'lr': 6.914597353148366e-05, 'weight_decay': 1.924203566572655e-05, 'epochs': 336, 'loss': 'mse', 'optimizer': 'adam', 'graph_mode': 'knn', 'source': 'grm', 'knn_k': 8, 'weighted_edges': True, 'symmetrize_mode': 'mutual', 'use_snp_selection': False}. Best is trial 78 with value: 0.19144233510547573.
[I 2025-11-03 12:41:11,949] Trial 110 finished with value: 0.11916910168178335 and parameters: {'model_type': 'graphsage', 'hidden_dims': '[512, 256]', 'dropout': 0.4114325854189115, 'batch_norm': False, 'lr': 0.00010248952176913589, 'weight_decay': 4.51368562425811e-05, 'epochs': 328, 'loss': 'mse', 'optimizer': 'adam', 'graph_mode': 'cutoff', 'cutoff': 0.6104204032614184, 'grm_norm': 'cosine', 'self_loops': False, 'use_snp_selection': False}. Best is trial 78 with value: 0.19144233510547573.
[I 2025-11-03 12:41:24,016] Trial 111 finished with value: 0.16138148396752278 and parameters: {'model_type': 'graphsage', 'hidden_dims': '[512, 256]', 'dropout': 0.3804591931002237, 'batch_norm': True, 'lr': 8.054898063847323e-05, 'weight_decay': 1.4683903881980886e-05, 'epochs': 319, 'loss': 'mse', 'optimizer': 'adam', 'graph_mode': 'knn', 'source': 'grm', 'knn_k': 7, 'weighted_edges': True, 'symmetrize_mode': 'mutual', 'use_snp_selection': False}. Best is trial 78 with value: 0.19144233510547573.
[I 2025-11-03 12:41:36,995] Trial 112 finished with value: 0.1684546706363582 and parameters: {'model_type': 'graphsage', 'hidden_dims': '[512, 256]', 'dropout': 0.3661664874368877, 'batch_norm': True, 'lr': 5.912827336567675e-05, 'weight_decay': 3.00735929421118e-05, 'epochs': 348, 'loss': 'mse', 'optimizer': 'adam', 'graph_mode': 'knn', 'source': 'grm', 'knn_k': 7, 'weighted_edges': True, 'symmetrize_mode': 'mutual', 'use_snp_selection': False}. Best is trial 78 with value: 0.19144233510547573.
[I 2025-11-03 12:41:49,754] Trial 113 finished with value: 0.17714967693741646 and parameters: {'model_type': 'graphsage', 'hidden_dims': '[512, 256]', 'dropout': 0.3873852433494867, 'batch_norm': True, 'lr': 0.00011037726931705659, 'weight_decay': 1.2416017581306175e-05, 'epochs': 341, 'loss': 'mse', 'optimizer': 'adam', 'graph_mode': 'knn', 'source': 'grm', 'knn_k': 7, 'weighted_edges': True, 'symmetrize_mode': 'mutual', 'use_snp_selection': False}. Best is trial 78 with value: 0.19144233510547573.
[I 2025-11-03 12:42:02,269] Trial 114 finished with value: 0.17222684571525218 and parameters: {'model_type': 'graphsage', 'hidden_dims': '[512, 256]', 'dropout': 0.3278222568522485, 'batch_norm': True, 'lr': 0.00011528027606818832, 'weight_decay': 5.8450001101330355e-06, 'epochs': 342, 'loss': 'mse', 'optimizer': 'adam', 'graph_mode': 'knn', 'source': 'grm', 'knn_k': 6, 'weighted_edges': True, 'symmetrize_mode': 'mutual', 'use_snp_selection': False}. Best is trial 78 with value: 0.19144233510547573.
[I 2025-11-03 12:42:14,534] Trial 115 finished with value: 0.1706903440864938 and parameters: {'model_type': 'graphsage', 'hidden_dims': '[512, 256]', 'dropout': 0.3940371295120023, 'batch_norm': True, 'lr': 0.00013966493997338554, 'weight_decay': 5.5878405212774585e-05, 'epochs': 324, 'loss': 'mse', 'optimizer': 'adam', 'graph_mode': 'knn', 'source': 'grm', 'knn_k': 7, 'weighted_edges': True, 'symmetrize_mode': 'mutual', 'use_snp_selection': False}. Best is trial 78 with value: 0.19144233510547573.
[I 2025-11-03 12:42:27,288] Trial 116 finished with value: 0.18085199627995274 and parameters: {'model_type': 'graphsage', 'hidden_dims': '[512, 256]', 'dropout': 0.36525918563353, 'batch_norm': True, 'lr': 0.00010057738881043157, 'weight_decay': 8.746317885615201e-06, 'epochs': 341, 'loss': 'mse', 'optimizer': 'adam', 'graph_mode': 'knn', 'source': 'grm', 'knn_k': 7, 'weighted_edges': True, 'symmetrize_mode': 'mutual', 'use_snp_selection': False}. Best is trial 78 with value: 0.19144233510547573.
[I 2025-11-03 12:42:40,045] Trial 117 finished with value: 0.17818827582680904 and parameters: {'model_type': 'graphsage', 'hidden_dims': '[512, 256]', 'dropout': 0.3480755305216853, 'batch_norm': True, 'lr': 0.00010000651124356357, 'weight_decay': 1.195379760139513e-05, 'epochs': 340, 'loss': 'mse', 'optimizer': 'adam', 'graph_mode': 'knn', 'source': 'grm', 'knn_k': 7, 'weighted_edges': True, 'symmetrize_mode': 'mutual', 'use_snp_selection': False}. Best is trial 78 with value: 0.19144233510547573.
[I 2025-11-03 12:42:52,816] Trial 118 finished with value: 0.15867960452815033 and parameters: {'model_type': 'graphsage', 'hidden_dims': '[512, 256]', 'dropout': 0.36021998954839074, 'batch_norm': True, 'lr': 4.395476473738165e-05, 'weight_decay': 8.595750742387264e-06, 'epochs': 331, 'loss': 'mse', 'optimizer': 'adam', 'graph_mode': 'knn', 'source': 'grm', 'knn_k': 8, 'weighted_edges': True, 'symmetrize_mode': 'mutual', 'use_snp_selection': False}. Best is trial 78 with value: 0.19144233510547573.
[I 2025-11-03 12:43:05,372] Trial 119 finished with value: 0.15002964686687922 and parameters: {'model_type': 'graphsage', 'hidden_dims': '[512, 256]', 'dropout': 0.34700434906567323, 'batch_norm': True, 'lr': 7.490425361741522e-05, 'weight_decay': 2.2016064475028403e-06, 'epochs': 336, 'loss': 'mse', 'optimizer': 'adam', 'graph_mode': 'knn', 'source': 'grm', 'knn_k': 7, 'weighted_edges': True, 'symmetrize_mode': 'mutual', 'use_snp_selection': False}. Best is trial 78 with value: 0.19144233510547573.
[I 2025-11-03 12:43:13,020] Trial 120 finished with value: 0.13022546659853645 and parameters: {'model_type': 'graphsage', 'hidden_dims': '[256, 128, 64]', 'dropout': 0.40084407311257675, 'batch_norm': True, 'lr': 2.941482962306727e-05, 'weight_decay': 3.464071472204358e-06, 'epochs': 312, 'loss': 'mse', 'optimizer': 'adam', 'graph_mode': 'knn', 'source': 'grm', 'knn_k': 6, 'weighted_edges': True, 'symmetrize_mode': 'mutual', 'use_snp_selection': False}. Best is trial 78 with value: 0.19144233510547573.
[I 2025-11-03 12:43:26,053] Trial 121 finished with value: 0.19083091311731348 and parameters: {'model_type': 'graphsage', 'hidden_dims': '[512, 256]', 'dropout': 0.38582038979463806, 'batch_norm': True, 'lr': 9.27594570273649e-05, 'weight_decay': 1.1716742353850303e-05, 'epochs': 350, 'loss': 'mse', 'optimizer': 'adam', 'graph_mode': 'knn', 'source': 'grm', 'knn_k': 7, 'weighted_edges': True, 'symmetrize_mode': 'mutual', 'use_snp_selection': False}. Best is trial 78 with value: 0.19144233510547573.
[I 2025-11-03 12:43:38,219] Trial 122 finished with value: 0.19334342359748394 and parameters: {'model_type': 'graphsage', 'hidden_dims': '[512, 256]', 'dropout': 0.37447640140025923, 'batch_norm': True, 'lr': 9.421848785000456e-05, 'weight_decay': 5.430232426734954e-06, 'epochs': 321, 'loss': 'mse', 'optimizer': 'adam', 'graph_mode': 'knn', 'source': 'grm', 'knn_k': 7, 'weighted_edges': True, 'symmetrize_mode': 'mutual', 'use_snp_selection': False}. Best is trial 122 with value: 0.19334342359748394.
[I 2025-11-03 12:43:51,262] Trial 123 finished with value: 0.19216350401016527 and parameters: {'model_type': 'graphsage', 'hidden_dims': '[512, 256]', 'dropout': 0.37314180311571643, 'batch_norm': True, 'lr': 9.414393469444646e-05, 'weight_decay': 6.763557752580731e-06, 'epochs': 350, 'loss': 'mse', 'optimizer': 'adam', 'graph_mode': 'knn', 'source': 'grm', 'knn_k': 7, 'weighted_edges': True, 'symmetrize_mode': 'mutual', 'use_snp_selection': False}. Best is trial 122 with value: 0.19334342359748394.
[I 2025-11-03 12:44:03,400] Trial 124 finished with value: 0.13532283706130532 and parameters: {'model_type': 'graphsage', 'hidden_dims': '[512, 256]', 'dropout': 0.3701357059962381, 'batch_norm': True, 'lr': 5.528890855322799e-05, 'weight_decay': 4.750099028910096e-06, 'epochs': 320, 'loss': 'mse', 'optimizer': 'adam', 'graph_mode': 'knn', 'source': 'grm', 'knn_k': 7, 'weighted_edges': True, 'symmetrize_mode': 'mutual', 'use_snp_selection': False}. Best is trial 122 with value: 0.19334342359748394.
