[I 2025-10-21 09:57:23,236] Trial 129 finished with value: 0.241438188593026 and parameters: {'model_type': 'gat', 'hidden_dims': '[128, 64]', 'dropout': 0.5898180845616539, 'batch_norm': False, 'gat_heads': 5, 'gat_attn_dropout': 0.06661559017572198, 'gat_concat_hidden': False, 'lr': 6.250710785643586e-06, 'weight_decay': 0.0001616619911986095, 'epochs': 190, 'loss': 'mae', 'optimizer': 'adam', 'graph_mode': 'cutoff', 'cutoff': 0.5483126114705021, 'grm_norm': 'none', 'self_loops': True}. Best is trial 111 with value: 0.2683083377048384.
[I 2025-10-21 09:59:32,641] Trial 130 finished with value: 0.24410038594659103 and parameters: {'model_type': 'gat', 'hidden_dims': '[256, 128]', 'dropout': 0.3650093996188145, 'batch_norm': False, 'gat_heads': 5, 'gat_attn_dropout': 0.10673582198158317, 'gat_concat_hidden': False, 'lr': 9.73923616146499e-06, 'weight_decay': 0.0002518708322789118, 'epochs': 146, 'loss': 'mae', 'optimizer': 'adam', 'graph_mode': 'cutoff', 'cutoff': 0.5120485778376829, 'grm_norm': 'gcn', 'self_loops': True}. Best is trial 111 with value: 0.2683083377048384.
[I 2025-10-21 10:00:54,029] Trial 131 finished with value: 0.2631589017758781 and parameters: {'model_type': 'gat', 'hidden_dims': '[128, 64]', 'dropout': 0.4803161571649127, 'batch_norm': False, 'gat_heads': 5, 'gat_attn_dropout': 0.1735272785019726, 'gat_concat_hidden': False, 'lr': 1.9054263871991336e-05, 'weight_decay': 0.00011073754841547314, 'epochs': 179, 'loss': 'mae', 'optimizer': 'adam', 'graph_mode': 'cutoff', 'cutoff': 0.5613140706600086, 'grm_norm': 'gcn', 'self_loops': True}. Best is trial 111 with value: 0.2683083377048384.
[I 2025-10-21 10:02:14,309] Trial 132 finished with value: 0.24965863797708088 and parameters: {'model_type': 'gat', 'hidden_dims': '[128, 64]', 'dropout': 0.43906276373672987, 'batch_norm': False, 'gat_heads': 5, 'gat_attn_dropout': 0.1569506463521397, 'gat_concat_hidden': False, 'lr': 2.00588242948556e-05, 'weight_decay': 0.00011702637084286763, 'epochs': 177, 'loss': 'mae', 'optimizer': 'adam', 'graph_mode': 'cutoff', 'cutoff': 0.579844733631794, 'grm_norm': 'gcn', 'self_loops': True}. Best is trial 111 with value: 0.2683083377048384.
[I 2025-10-21 10:03:38,320] Trial 133 finished with value: 0.25960381445486336 and parameters: {'model_type': 'gat', 'hidden_dims': '[128, 64]', 'dropout': 0.472859954762526, 'batch_norm': False, 'gat_heads': 5, 'gat_attn_dropout': 0.18037443242673, 'gat_concat_hidden': False, 'lr': 1.6372120063044422e-05, 'weight_decay': 7.561584440051575e-05, 'epochs': 186, 'loss': 'mae', 'optimizer': 'adam', 'graph_mode': 'cutoff', 'cutoff': 0.56281248341926, 'grm_norm': 'gcn', 'self_loops': True}. Best is trial 111 with value: 0.2683083377048384.
[I 2025-10-21 10:05:01,494] Trial 134 finished with value: 0.2570043068571184 and parameters: {'model_type': 'gat', 'hidden_dims': '[128, 64]', 'dropout': 0.47278588099003094, 'batch_norm': False, 'gat_heads': 5, 'gat_attn_dropout': 0.17874490805831939, 'gat_concat_hidden': False, 'lr': 1.7115363015721725e-05, 'weight_decay': 7.488074737311807e-05, 'epochs': 184, 'loss': 'mae', 'optimizer': 'adam', 'graph_mode': 'cutoff', 'cutoff': 0.5608854302374, 'grm_norm': 'gcn', 'self_loops': True}. Best is trial 111 with value: 0.2683083377048384.
[I 2025-10-21 10:06:31,409] Trial 135 finished with value: 0.24185007177191858 and parameters: {'model_type': 'gat', 'hidden_dims': '[128, 64]', 'dropout': 0.4734936556017382, 'batch_norm': False, 'gat_heads': 5, 'gat_attn_dropout': 0.1985557948401548, 'gat_concat_hidden': False, 'lr': 1.70972118574853e-05, 'weight_decay': 7.727186953934633e-05, 'epochs': 200, 'loss': 'mae', 'optimizer': 'adam', 'graph_mode': 'cutoff', 'cutoff': 0.5391832526943616, 'grm_norm': 'gcn', 'self_loops': True}. Best is trial 111 with value: 0.2683083377048384.
[I 2025-10-21 10:07:58,060] Trial 136 finished with value: 0.2493900254023091 and parameters: {'model_type': 'gat', 'hidden_dims': '[128, 64]', 'dropout': 0.4850418243644468, 'batch_norm': False, 'gat_heads': 5, 'gat_attn_dropout': 0.18095327175362633, 'gat_concat_hidden': False, 'lr': 1.2175428738290067e-05, 'weight_decay': 0.00014221136833029177, 'epochs': 192, 'loss': 'mae', 'optimizer': 'adam', 'graph_mode': 'cutoff', 'cutoff': 0.5584284586566839, 'grm_norm': 'none', 'self_loops': True}. Best is trial 111 with value: 0.2683083377048384.
[I 2025-10-21 10:09:14,132] Trial 137 finished with value: 0.23943557799987802 and parameters: {'model_type': 'gat', 'hidden_dims': '[128, 64]', 'dropout': 0.5008366938726158, 'batch_norm': False, 'gat_heads': 5, 'gat_attn_dropout': 0.21600747338659274, 'gat_concat_hidden': False, 'lr': 2.6051275160047327e-05, 'weight_decay': 4.606045960166792e-05, 'epochs': 167, 'loss': 'mae', 'optimizer': 'adam', 'graph_mode': 'cutoff', 'cutoff': 0.6043162104478338, 'grm_norm': 'gcn', 'self_loops': True}. Best is trial 111 with value: 0.2683083377048384.
[I 2025-10-21 10:10:50,191] Trial 138 finished with value: 0.24507626542533037 and parameters: {'model_type': 'gat', 'hidden_dims': '[128, 64]', 'dropout': 0.46823671033538244, 'batch_norm': False, 'gat_heads': 5, 'gat_attn_dropout': 0.1685139262873621, 'gat_concat_hidden': False, 'lr': 2.1704425763250435e-05, 'weight_decay': 6.78706281212676e-05, 'epochs': 213, 'loss': 'mae', 'optimizer': 'adam', 'graph_mode': 'cutoff', 'cutoff': 0.5009809514935077, 'grm_norm': 'none', 'self_loops': False}. Best is trial 111 with value: 0.2683083377048384.
[I 2025-10-21 10:12:12,235] Trial 139 finished with value: 0.25519055917608247 and parameters: {'model_type': 'gat', 'hidden_dims': '[128, 64]', 'dropout': 0.4831787793017698, 'batch_norm': False, 'gat_heads': 5, 'gat_attn_dropout': 0.18180206950822947, 'gat_concat_hidden': False, 'lr': 1.1285743017903197e-05, 'weight_decay': 3.0084720292409063e-05, 'epochs': 181, 'loss': 'mae', 'optimizer': 'adam', 'graph_mode': 'cutoff', 'cutoff': 0.5840081709634478, 'grm_norm': 'gcn', 'self_loops': True}. Best is trial 111 with value: 0.2683083377048384.
[I 2025-10-21 10:13:44,606] Trial 140 finished with value: 0.23756991188919724 and parameters: {'model_type': 'gat', 'hidden_dims': '[128, 64]', 'dropout': 0.28314596669709935, 'batch_norm': False, 'gat_heads': 5, 'gat_attn_dropout': 0.19034861551451096, 'gat_concat_hidden': False, 'lr': 1.710991859722394e-05, 'weight_decay': 0.00010759901879172322, 'epochs': 205, 'loss': 'mae', 'optimizer': 'adam', 'graph_mode': 'cutoff', 'cutoff': 0.5202169090794669, 'grm_norm': 'none', 'self_loops': True}. Best is trial 111 with value: 0.2683083377048384.
[I 2025-10-21 10:15:07,482] Trial 141 finished with value: 0.24603437656836014 and parameters: {'model_type': 'gat', 'hidden_dims': '[128, 64]', 'dropout': 0.4873630950889315, 'batch_norm': False, 'gat_heads': 5, 'gat_attn_dropout': 0.1811590067301087, 'gat_concat_hidden': False, 'lr': 1.1436222918903421e-05, 'weight_decay': 3.92186278019972e-05, 'epochs': 183, 'loss': 'mae', 'optimizer': 'adam', 'graph_mode': 'cutoff', 'cutoff': 0.5851412065428326, 'grm_norm': 'gcn', 'self_loops': True}. Best is trial 111 with value: 0.2683083377048384.
[I 2025-10-21 10:16:28,766] Trial 142 finished with value: 0.2436058784031389 and parameters: {'model_type': 'gat', 'hidden_dims': '[128, 64]', 'dropout': 0.4646213795332359, 'batch_norm': False, 'gat_heads': 5, 'gat_attn_dropout': 0.16119836969977608, 'gat_concat_hidden': False, 'lr': 8.512542734748583e-06, 'weight_decay': 0.00019788461656737282, 'epochs': 179, 'loss': 'mae', 'optimizer': 'adam', 'graph_mode': 'cutoff', 'cutoff': 0.572035758067233, 'grm_norm': 'gcn', 'self_loops': True}. Best is trial 111 with value: 0.2683083377048384.
[I 2025-10-21 10:17:47,696] Trial 143 finished with value: 0.24623433759607144 and parameters: {'model_type': 'gat', 'hidden_dims': '[128, 64]', 'dropout': 0.4784246348767975, 'batch_norm': False, 'gat_heads': 5, 'gat_attn_dropout': 0.20723063100226083, 'gat_concat_hidden': False, 'lr': 1.3237303052315868e-05, 'weight_decay': 3.3151581041340437e-07, 'epochs': 173, 'loss': 'mae', 'optimizer': 'adam', 'graph_mode': 'cutoff', 'cutoff': 0.5463716928572129, 'grm_norm': 'gcn', 'self_loops': True}. Best is trial 111 with value: 0.2683083377048384.
[I 2025-10-21 10:19:13,927] Trial 144 finished with value: 0.25704581071533317 and parameters: {'model_type': 'gat', 'hidden_dims': '[128, 64]', 'dropout': 0.5132757513521536, 'batch_norm': False, 'gat_heads': 5, 'gat_attn_dropout': 0.1761277140692107, 'gat_concat_hidden': False, 'lr': 7.105355365686545e-06, 'weight_decay': 2.8169627570218883e-05, 'epochs': 191, 'loss': 'mae', 'optimizer': 'adam', 'graph_mode': 'cutoff', 'cutoff': 0.5638812560315329, 'grm_norm': 'gcn', 'self_loops': True}. Best is trial 111 with value: 0.2683083377048384.
[I 2025-10-21 10:24:16,718] Trial 145 finished with value: 0.24044658663217558 and parameters: {'model_type': 'gat', 'hidden_dims': '[512, 256]', 'dropout': 0.44621248233234295, 'batch_norm': False, 'gat_heads': 5, 'gat_attn_dropout': 0.15017674520837476, 'gat_concat_hidden': False, 'lr': 9.627384080293013e-06, 'weight_decay': 5.946237966610843e-05, 'epochs': 190, 'loss': 'mae', 'optimizer': 'adam', 'graph_mode': 'cutoff', 'cutoff': 0.558482982371565, 'grm_norm': 'gcn', 'self_loops': True}. Best is trial 111 with value: 0.2683083377048384.
[I 2025-10-21 10:25:45,335] Trial 146 finished with value: 0.2572439137050652 and parameters: {'model_type': 'gat', 'hidden_dims': '[128, 64]', 'dropout': 0.5148610268283996, 'batch_norm': False, 'gat_heads': 5, 'gat_attn_dropout': 0.1712545094793828, 'gat_concat_hidden': False, 'lr': 6.946233445710396e-06, 'weight_decay': 1.3750648221254375e-05, 'epochs': 196, 'loss': 'mae', 'optimizer': 'adam', 'graph_mode': 'cutoff', 'cutoff': 0.5344549333753874, 'grm_norm': 'cosine_then_gcn', 'self_loops': True}. Best is trial 111 with value: 0.2683083377048384.
[I 2025-10-21 10:27:14,453] Trial 147 finished with value: 0.24164498354996028 and parameters: {'model_type': 'gat', 'hidden_dims': '[128, 64]', 'dropout': 0.5355149040141814, 'batch_norm': False, 'gat_heads': 5, 'gat_attn_dropout': 0.17076845188722842, 'gat_concat_hidden': False, 'lr': 6.816692142788236e-06, 'weight_decay': 1.3606559635805769e-05, 'epochs': 198, 'loss': 'mse', 'optimizer': 'adam', 'graph_mode': 'cutoff', 'cutoff': 0.5668747721356011, 'grm_norm': 'gcn', 'self_loops': True}. Best is trial 111 with value: 0.2683083377048384.
[I 2025-10-21 10:28:53,996] Trial 148 finished with value: 0.2024546658402854 and parameters: {'model_type': 'gat', 'hidden_dims': '[128, 64]', 'dropout': 0.5131904406574801, 'batch_norm': False, 'gat_heads': 5, 'gat_attn_dropout': 0.19448343185481087, 'gat_concat_hidden': True, 'lr': 7.009153266276152e-06, 'weight_decay': 8.161708566535683e-06, 'epochs': 223, 'loss': 'mae', 'optimizer': 'adam', 'graph_mode': 'cutoff', 'cutoff': 0.6004879936014426, 'grm_norm': 'none', 'self_loops': True}. Best is trial 111 with value: 0.2683083377048384.
[I 2025-10-21 10:30:25,850] Trial 149 finished with value: 0.2508406718698037 and parameters: {'model_type': 'gat', 'hidden_dims': '[128, 64]', 'dropout': 0.43430940921830824, 'batch_norm': False, 'gat_heads': 5, 'gat_attn_dropout': 0.15127141530960087, 'gat_concat_hidden': False, 'lr': 4.825121359892687e-06, 'weight_decay': 1.9097611313349486e-05, 'epochs': 204, 'loss': 'mae', 'optimizer': 'adam', 'graph_mode': 'cutoff', 'cutoff': 0.5300418656731004, 'grm_norm': 'gcn', 'self_loops': True}. Best is trial 111 with value: 0.2683083377048384.
[I 2025-10-21 10:31:01,899] Trial 0 finished with value: 0.13646260863413145 and parameters: {'model_type': 'gat', 'hidden_dims': '[128, 64]', 'dropout': 0.199031432379812, 'batch_norm': True, 'gat_heads': 1, 'gat_attn_dropout': 0.41121589102067835, 'gat_concat_hidden': True, 'lr': 3.4401453323286906e-05, 'weight_decay': 0.00017802616915745114, 'epochs': 230, 'loss': 'mse', 'optimizer': 'adam', 'graph_mode': 'knn', 'source': 'grm', 'knn_k': 6, 'weighted_edges': True, 'symmetrize_mode': 'mutual'}. Best is trial 0 with value: 0.13646260863413145.
[I 2025-10-21 10:32:13,649] Trial 1 finished with value: 0.158552994604291 and parameters: {'model_type': 'gat', 'hidden_dims': '[512, 64]', 'dropout': 0.36082357619681704, 'batch_norm': True, 'gat_heads': 1, 'gat_attn_dropout': 0.18042003398172202, 'gat_concat_hidden': False, 'lr': 1.3825758230956745e-06, 'weight_decay': 3.199989794411411e-05, 'epochs': 210, 'loss': 'mse', 'optimizer': 'adam', 'graph_mode': 'knn', 'source': 'grm', 'knn_k': 8, 'weighted_edges': True, 'symmetrize_mode': 'mutual'}. Best is trial 1 with value: 0.158552994604291.
[I 2025-10-21 10:34:43,139] Trial 2 finished with value: 0.1869656737732575 and parameters: {'model_type': 'gat', 'hidden_dims': '[512, 64]', 'dropout': 0.5938127374509361, 'batch_norm': False, 'gat_heads': 3, 'gat_attn_dropout': 0.3584229889385306, 'gat_concat_hidden': True, 'lr': 5.8966328690006356e-05, 'weight_decay': 1.4359095002909625e-07, 'epochs': 151, 'loss': 'mae', 'optimizer': 'adam', 'graph_mode': 'cutoff', 'cutoff': 0.22797144608298409, 'grm_norm': 'none', 'self_loops': False}. Best is trial 2 with value: 0.1869656737732575.
[I 2025-10-21 10:35:20,219] Trial 3 finished with value: 0.14782310144129954 and parameters: {'model_type': 'gat', 'hidden_dims': '[256, 128]', 'dropout': 0.23110783056597514, 'batch_norm': True, 'gat_heads': 3, 'gat_attn_dropout': 0.14524552524211642, 'gat_concat_hidden': False, 'lr': 2.6631568299397822e-05, 'weight_decay': 1.4831733219640837e-06, 'epochs': 59, 'loss': 'mse', 'optimizer': 'adam', 'graph_mode': 'cutoff', 'cutoff': 0.5085416774304665, 'grm_norm': 'cosine_then_gcn', 'self_loops': False}. Best is trial 2 with value: 0.1869656737732575.
[I 2025-10-21 10:35:51,518] Trial 4 finished with value: 0.198189285427592 and parameters: {'model_type': 'gat', 'hidden_dims': '[128, 64]', 'dropout': 0.24986493621228142, 'batch_norm': False, 'gat_heads': 2, 'gat_attn_dropout': 0.03028660209239857, 'gat_concat_hidden': True, 'lr': 3.4411882055364858e-06, 'weight_decay': 0.00034938832175517785, 'epochs': 153, 'loss': 'mae', 'optimizer': 'adam', 'graph_mode': 'cutoff', 'cutoff': 0.5288497054083461, 'grm_norm': 'cosine_then_gcn', 'self_loops': False}. Best is trial 4 with value: 0.198189285427592.
[I 2025-10-21 10:37:14,737] Trial 5 finished with value: 0.2133058381671556 and parameters: {'model_type': 'gat', 'hidden_dims': '[256, 128, 64]', 'dropout': 0.3667354424945013, 'batch_norm': False, 'gat_heads': 5, 'gat_attn_dropout': 0.47505419776597435, 'gat_concat_hidden': False, 'lr': 5.6570170227139244e-05, 'weight_decay': 6.845407486393404e-05, 'epochs': 86, 'loss': 'mae', 'optimizer': 'adam', 'graph_mode': 'cutoff', 'cutoff': 0.3163415033931736, 'grm_norm': 'cosine', 'self_loops': False}. Best is trial 5 with value: 0.2133058381671556.
[I 2025-10-21 10:40:12,454] Trial 6 finished with value: 0.11168224768089167 and parameters: {'model_type': 'gat', 'hidden_dims': '[512, 64]', 'dropout': 0.4724320384750339, 'batch_norm': True, 'gat_heads': 2, 'gat_attn_dropout': 0.5029567924222157, 'gat_concat_hidden': False, 'lr': 0.00035117819773722113, 'weight_decay': 2.586139236899202e-05, 'epochs': 282, 'loss': 'mse', 'optimizer': 'adam', 'graph_mode': 'knn', 'source': 'grm', 'knn_k': 5, 'weighted_edges': False, 'symmetrize_mode': 'mutual'}. Best is trial 5 with value: 0.2133058381671556.
[I 2025-10-21 10:40:43,750] Trial 7 finished with value: 0.21387360784023784 and parameters: {'model_type': 'gat', 'hidden_dims': '[256, 128]', 'dropout': 0.26933956649466984, 'batch_norm': False, 'gat_heads': 1, 'gat_attn_dropout': 0.12357015502138351, 'gat_concat_hidden': True, 'lr': 9.272145288974393e-05, 'weight_decay': 0.0001637847231599168, 'epochs': 149, 'loss': 'mae', 'optimizer': 'adam', 'graph_mode': 'knn', 'source': 'grm', 'knn_k': 9, 'weighted_edges': False, 'symmetrize_mode': 'mutual'}. Best is trial 7 with value: 0.21387360784023784.
[I 2025-10-21 10:41:03,451] Trial 8 finished with value: 0.09707118738103182 and parameters: {'model_type': 'gat', 'hidden_dims': '[256, 128, 64]', 'dropout': 0.5327763091136416, 'batch_norm': True, 'gat_heads': 1, 'gat_attn_dropout': 0.11077610280855929, 'gat_concat_hidden': False, 'lr': 0.0005504846263330393, 'weight_decay': 6.7826287729705615e-06, 'epochs': 80, 'loss': 'mse', 'optimizer': 'adam', 'graph_mode': 'cutoff', 'cutoff': 0.39200637331077737, 'grm_norm': 'cosine_then_gcn', 'self_loops': False}. Best is trial 7 with value: 0.21387360784023784.
[I 2025-10-21 10:42:25,207] Trial 9 finished with value: 0.21882187456390995 and parameters: {'model_type': 'gat', 'hidden_dims': '[256, 128, 64]', 'dropout': 0.29822093943922523, 'batch_norm': True, 'gat_heads': 2, 'gat_attn_dropout': 0.5041483896530343, 'gat_concat_hidden': True, 'lr': 0.0009262984185468379, 'weight_decay': 8.224875501038066e-07, 'epochs': 231, 'loss': 'mae', 'optimizer': 'adam', 'graph_mode': 'cutoff', 'cutoff': 0.40177719715455146, 'grm_norm': 'none', 'self_loops': True}. Best is trial 9 with value: 0.21882187456390995.
[I 2025-10-21 10:54:44,037] Trial 10 finished with value: 0.21815606200628346 and parameters: {'model_type': 'gat', 'hidden_dims': '[512, 256]', 'dropout': 0.11372025982957354, 'batch_norm': True, 'gat_heads': 7, 'gat_attn_dropout': 0.5599540289166529, 'gat_concat_hidden': True, 'lr': 0.0009650491902216229, 'weight_decay': 1.3004302134392705e-07, 'epochs': 339, 'loss': 'mae', 'optimizer': 'adam', 'graph_mode': 'cutoff', 'cutoff': 0.7605475530345412, 'grm_norm': 'gcn', 'self_loops': True}. Best is trial 9 with value: 0.21882187456390995.
[I 2025-10-21 11:09:36,713] Trial 11 finished with value: 0.22916937832301013 and parameters: {'model_type': 'gat', 'hidden_dims': '[512, 256]', 'dropout': 0.10254502285057247, 'batch_norm': True, 'gat_heads': 8, 'gat_attn_dropout': 0.5935696129988, 'gat_concat_hidden': True, 'lr': 0.0009039246077153928, 'weight_decay': 1.014091185981818e-07, 'epochs': 348, 'loss': 'mae', 'optimizer': 'adam', 'graph_mode': 'cutoff', 'cutoff': 0.8795382731036935, 'grm_norm': 'gcn', 'self_loops': True}. Best is trial 11 with value: 0.22916937832301013.
[I 2025-10-21 11:23:47,133] Trial 12 finished with value: 0.23121987606901212 and parameters: {'model_type': 'gat', 'hidden_dims': '[512, 256]', 'dropout': 0.12075505276198942, 'batch_norm': True, 'gat_heads': 8, 'gat_attn_dropout': 0.5936622869810394, 'gat_concat_hidden': True, 'lr': 0.00021857214966676538, 'weight_decay': 8.770271014299939e-07, 'epochs': 331, 'loss': 'mae', 'optimizer': 'adam', 'graph_mode': 'cutoff', 'cutoff': 0.8992428150946725, 'grm_norm': 'gcn', 'self_loops': True}. Best is trial 12 with value: 0.23121987606901212.
[I 2025-10-21 11:38:08,072] Trial 13 finished with value: 0.2313536021562515 and parameters: {'model_type': 'gat', 'hidden_dims': '[512, 256]', 'dropout': 0.10079190261590662, 'batch_norm': True, 'gat_heads': 8, 'gat_attn_dropout': 0.5971336107168009, 'gat_concat_hidden': True, 'lr': 0.00019793009590144092, 'weight_decay': 6.31493865874628e-07, 'epochs': 335, 'loss': 'mae', 'optimizer': 'adam', 'graph_mode': 'cutoff', 'cutoff': 0.8983720152991655, 'grm_norm': 'gcn', 'self_loops': True}. Best is trial 13 with value: 0.2313536021562515.
[I 2025-10-21 11:47:13,409] Trial 14 finished with value: 0.19885607948818665 and parameters: {'model_type': 'gat', 'hidden_dims': '[512, 128]', 'dropout': 0.15882897236971796, 'batch_norm': True, 'gat_heads': 6, 'gat_attn_dropout': 0.2810064922470583, 'gat_concat_hidden': True, 'lr': 0.0001779075227074746, 'weight_decay': 1.3895754626324957e-06, 'epochs': 296, 'loss': 'mae', 'optimizer': 'adam', 'graph_mode': 'cutoff', 'cutoff': 0.899540168047546, 'grm_norm': 'gcn', 'self_loops': True}. Best is trial 13 with value: 0.2313536021562515.
[I 2025-10-21 12:00:04,331] Trial 15 finished with value: 0.1766347834360909 and parameters: {'model_type': 'gat', 'hidden_dims': '[512, 256]', 'dropout': 0.16104587108836052, 'batch_norm': True, 'gat_heads': 8, 'gat_attn_dropout': 0.2703038396936633, 'gat_concat_hidden': True, 'lr': 1.0948955842261321e-05, 'weight_decay': 5.131337323895793e-06, 'epochs': 297, 'loss': 'mae', 'optimizer': 'adam', 'graph_mode': 'cutoff', 'cutoff': 0.7273119035736783, 'grm_norm': 'gcn', 'self_loops': True}. Best is trial 13 with value: 0.2313536021562515.
[I 2025-10-21 12:10:00,491] Trial 16 finished with value: 0.22516162260257028 and parameters: {'model_type': 'gat', 'hidden_dims': '[512, 256]', 'dropout': 0.4337768631587977, 'batch_norm': True, 'gat_heads': 7, 'gat_attn_dropout': 0.4018416659062471, 'gat_concat_hidden': True, 'lr': 0.00021656515447261105, 'weight_decay': 6.294115413653126e-07, 'epochs': 271, 'loss': 'mae', 'optimizer': 'adam', 'graph_mode': 'cutoff', 'cutoff': 0.7284136237525245, 'grm_norm': 'gcn', 'self_loops': True}. Best is trial 13 with value: 0.2313536021562515.
[I 2025-10-21 12:19:54,479] Trial 17 finished with value: 0.22916713466095154 and parameters: {'model_type': 'gat', 'hidden_dims': '[512, 256]', 'dropout': 0.1777553924266397, 'batch_norm': True, 'gat_heads': 6, 'gat_attn_dropout': 0.5922008908636825, 'gat_concat_hidden': True, 'lr': 0.00014926929977578926, 'weight_decay': 3.593091447495541e-07, 'epochs': 321, 'loss': 'mae', 'optimizer': 'adam', 'graph_mode': 'cutoff', 'cutoff': 0.8009478678291103, 'grm_norm': 'cosine', 'self_loops': True}. Best is trial 13 with value: 0.2313536021562515.
[I 2025-10-21 12:29:10,128] Trial 18 finished with value: 0.1747574717049587 and parameters: {'model_type': 'gat', 'hidden_dims': '[512, 128]', 'dropout': 0.30817865657449356, 'batch_norm': False, 'gat_heads': 7, 'gat_attn_dropout': 0.4526613878381632, 'gat_concat_hidden': True, 'lr': 1.4229742500153306e-05, 'weight_decay': 3.489385186163325e-06, 'epochs': 255, 'loss': 'mae', 'optimizer': 'adam', 'graph_mode': 'knn', 'source': 'grm', 'knn_k': 1, 'weighted_edges': False, 'symmetrize_mode': 'union'}. Best is trial 13 with value: 0.2313536021562515.
