[I 2025-11-03 15:20:02,067] Trial 118 finished with value: 0.04173496896087345 and parameters: {'model_type': 'graphsage', 'hidden_dims': '[512, 64]', 'dropout': 0.16210258200203548, 'batch_norm': True, 'lr': 0.00027646021042026185, 'weight_decay': 3.427775186704344e-06, 'epochs': 169, 'loss': 'mae', 'optimizer': 'adam', 'graph_mode': 'knn', 'source': 'grm', 'knn_k': 1, 'weighted_edges': False, 'symmetrize_mode': 'union', 'use_snp_selection': False}. Best is trial 58 with value: 0.08637900504762047.
[I 2025-11-03 15:20:05,449] Trial 119 finished with value: 0.05691172483309829 and parameters: {'model_type': 'graphsage', 'hidden_dims': '[512, 64]', 'dropout': 0.5152760285587732, 'batch_norm': True, 'lr': 0.0005009746630082792, 'weight_decay': 1.9277707369756813e-06, 'epochs': 189, 'loss': 'mse', 'optimizer': 'adam', 'graph_mode': 'knn', 'source': 'grm', 'knn_k': 1, 'weighted_edges': False, 'symmetrize_mode': 'union', 'use_snp_selection': False}. Best is trial 58 with value: 0.08637900504762047.
[I 2025-11-03 15:20:09,148] Trial 120 finished with value: 0.03680836931696442 and parameters: {'model_type': 'graphsage', 'hidden_dims': '[512, 64]', 'dropout': 0.5994763935116105, 'batch_norm': True, 'lr': 0.0002422602019756985, 'weight_decay': 4.2206635443469845e-06, 'epochs': 241, 'loss': 'mse', 'optimizer': 'adam', 'graph_mode': 'cutoff', 'cutoff': 0.5305251536143429, 'grm_norm': 'none', 'self_loops': True, 'use_snp_selection': False}. Best is trial 58 with value: 0.08637900504762047.
[I 2025-11-03 15:20:12,636] Trial 121 finished with value: 0.04862956241102433 and parameters: {'model_type': 'graphsage', 'hidden_dims': '[512, 64]', 'dropout': 0.1478464404754274, 'batch_norm': True, 'lr': 0.0003348201497581386, 'weight_decay': 1.4372887567615358e-06, 'epochs': 198, 'loss': 'mse', 'optimizer': 'adam', 'graph_mode': 'knn', 'source': 'grm', 'knn_k': 1, 'weighted_edges': False, 'symmetrize_mode': 'union', 'use_snp_selection': False}. Best is trial 58 with value: 0.08637900504762047.
[I 2025-11-03 15:20:15,981] Trial 122 finished with value: 0.09035969840513271 and parameters: {'model_type': 'graphsage', 'hidden_dims': '[512, 64]', 'dropout': 0.14336366214158033, 'batch_norm': True, 'lr': 3.230051209716521e-05, 'weight_decay': 2.451858973091347e-06, 'epochs': 178, 'loss': 'mse', 'optimizer': 'adam', 'graph_mode': 'knn', 'source': 'grm', 'knn_k': 1, 'weighted_edges': False, 'symmetrize_mode': 'union', 'use_snp_selection': False}. Best is trial 122 with value: 0.09035969840513271.
[I 2025-11-03 15:20:19,620] Trial 123 finished with value: 0.07509317099597383 and parameters: {'model_type': 'graphsage', 'hidden_dims': '[512, 64]', 'dropout': 0.17695699901369388, 'batch_norm': True, 'lr': 3.0965465076797236e-05, 'weight_decay': 1.146612473003859e-06, 'epochs': 219, 'loss': 'mse', 'optimizer': 'adam', 'graph_mode': 'knn', 'source': 'grm', 'knn_k': 1, 'weighted_edges': False, 'symmetrize_mode': 'union', 'use_snp_selection': False}. Best is trial 122 with value: 0.09035969840513271.
[I 2025-11-03 15:20:23,319] Trial 124 finished with value: 0.05389308057260912 and parameters: {'model_type': 'graphsage', 'hidden_dims': '[512, 64]', 'dropout': 0.13818458790756302, 'batch_norm': True, 'lr': 3.088840684952678e-05, 'weight_decay': 1.0162462291553907e-06, 'epochs': 228, 'loss': 'mse', 'optimizer': 'adam', 'graph_mode': 'knn', 'source': 'grm', 'knn_k': 1, 'weighted_edges': False, 'symmetrize_mode': 'union', 'use_snp_selection': False}. Best is trial 122 with value: 0.09035969840513271.
[I 2025-11-03 15:20:26,669] Trial 125 finished with value: 0.07174040639734544 and parameters: {'model_type': 'graphsage', 'hidden_dims': '[512, 64]', 'dropout': 0.17672395589699005, 'batch_norm': True, 'lr': 4.0921816264572065e-05, 'weight_decay': 1.1402361950806e-06, 'epochs': 177, 'loss': 'mse', 'optimizer': 'adam', 'graph_mode': 'knn', 'source': 'grm', 'knn_k': 1, 'weighted_edges': False, 'symmetrize_mode': 'union', 'use_snp_selection': False}. Best is trial 122 with value: 0.09035969840513271.
[I 2025-11-03 15:20:30,091] Trial 126 finished with value: 0.04786785473972108 and parameters: {'model_type': 'graphsage', 'hidden_dims': '[512, 64]', 'dropout': 0.16675457982456288, 'batch_norm': True, 'lr': 4.0097400181842687e-05, 'weight_decay': 1.2693312203937905e-06, 'epochs': 190, 'loss': 'mse', 'optimizer': 'adam', 'graph_mode': 'knn', 'source': 'grm', 'knn_k': 1, 'weighted_edges': False, 'symmetrize_mode': 'union', 'use_snp_selection': False}. Best is trial 122 with value: 0.09035969840513271.
[I 2025-11-03 15:20:33,650] Trial 127 finished with value: 0.06573837067249175 and parameters: {'model_type': 'graphsage', 'hidden_dims': '[512, 64]', 'dropout': 0.19023944074014873, 'batch_norm': True, 'lr': 2.4299286823533548e-05, 'weight_decay': 1.7092996528875301e-06, 'epochs': 209, 'loss': 'mse', 'optimizer': 'adam', 'graph_mode': 'knn', 'source': 'grm', 'knn_k': 1, 'weighted_edges': False, 'symmetrize_mode': 'union', 'use_snp_selection': False}. Best is trial 122 with value: 0.09035969840513271.
[I 2025-11-03 15:20:37,278] Trial 128 finished with value: 0.026938031749663624 and parameters: {'model_type': 'graphsage', 'hidden_dims': '[512, 64]', 'dropout': 0.18253661094081688, 'batch_norm': True, 'lr': 1.5703923296813023e-05, 'weight_decay': 1.8211178745787584e-06, 'epochs': 216, 'loss': 'mse', 'optimizer': 'adam', 'graph_mode': 'knn', 'source': 'grm', 'knn_k': 1, 'weighted_edges': True, 'symmetrize_mode': 'union', 'use_snp_selection': False}. Best is trial 122 with value: 0.09035969840513271.
[I 2025-11-03 15:20:40,836] Trial 129 finished with value: 0.03717243818099583 and parameters: {'model_type': 'graphsage', 'hidden_dims': '[512, 64]', 'dropout': 0.1750988000854243, 'batch_norm': True, 'lr': 2.389489167692357e-05, 'weight_decay': 2.700335341711824e-06, 'epochs': 207, 'loss': 'mse', 'optimizer': 'adam', 'graph_mode': 'knn', 'source': 'grm', 'knn_k': 1, 'weighted_edges': False, 'symmetrize_mode': 'union', 'use_snp_selection': False}. Best is trial 122 with value: 0.09035969840513271.
[I 2025-11-03 15:20:44,512] Trial 130 finished with value: 0.0024126822471377614 and parameters: {'model_type': 'graphsage', 'hidden_dims': '[512, 64]', 'dropout': 0.15529609271136918, 'batch_norm': False, 'lr': 5.02623248279183e-05, 'weight_decay': 2.1991235721776463e-06, 'epochs': 225, 'loss': 'mse', 'optimizer': 'adam', 'graph_mode': 'cutoff', 'cutoff': 0.31460017473403357, 'grm_norm': 'none', 'self_loops': False, 'use_snp_selection': True, 'num_snps': 39251}. Best is trial 122 with value: 0.09035969840513271.
[I 2025-11-03 15:20:48,166] Trial 131 finished with value: 0.06529598517589853 and parameters: {'model_type': 'graphsage', 'hidden_dims': '[512, 64]', 'dropout': 0.1874744588169931, 'batch_norm': True, 'lr': 3.313813962346641e-05, 'weight_decay': 8.88412304682505e-07, 'epochs': 220, 'loss': 'mse', 'optimizer': 'adam', 'graph_mode': 'knn', 'source': 'grm', 'knn_k': 1, 'weighted_edges': False, 'symmetrize_mode': 'union', 'use_snp_selection': False}. Best is trial 122 with value: 0.09035969840513271.
[I 2025-11-03 15:20:51,825] Trial 132 finished with value: 0.06382448791335527 and parameters: {'model_type': 'graphsage', 'hidden_dims': '[512, 64]', 'dropout': 0.19567955179899826, 'batch_norm': True, 'lr': 3.148499398893805e-05, 'weight_decay': 1.1019517015780881e-06, 'epochs': 222, 'loss': 'mse', 'optimizer': 'adam', 'graph_mode': 'knn', 'source': 'grm', 'knn_k': 1, 'weighted_edges': False, 'symmetrize_mode': 'union', 'use_snp_selection': False}. Best is trial 122 with value: 0.09035969840513271.
[I 2025-11-03 15:20:55,479] Trial 133 finished with value: 0.04580573758230608 and parameters: {'model_type': 'graphsage', 'hidden_dims': '[512, 64]', 'dropout': 0.20022070672765707, 'batch_norm': True, 'lr': 1.9403562574401954e-05, 'weight_decay': 1.0867524791411288e-06, 'epochs': 222, 'loss': 'mse', 'optimizer': 'adam', 'graph_mode': 'knn', 'source': 'grm', 'knn_k': 1, 'weighted_edges': False, 'symmetrize_mode': 'union', 'use_snp_selection': False}. Best is trial 122 with value: 0.09035969840513271.
[I 2025-11-03 15:20:59,255] Trial 134 finished with value: 0.04464848673466413 and parameters: {'model_type': 'graphsage', 'hidden_dims': '[512, 64]', 'dropout': 0.1943631787859292, 'batch_norm': True, 'lr': 2.754020481890704e-05, 'weight_decay': 8.186022978332226e-07, 'epochs': 238, 'loss': 'mse', 'optimizer': 'adam', 'graph_mode': 'knn', 'source': 'grm', 'knn_k': 1, 'weighted_edges': False, 'symmetrize_mode': 'union', 'use_snp_selection': False}. Best is trial 122 with value: 0.09035969840513271.
[I 2025-11-03 15:21:02,821] Trial 135 finished with value: 0.04142929811073133 and parameters: {'model_type': 'graphsage', 'hidden_dims': '[512, 64]', 'dropout': 0.1868624198957402, 'batch_norm': True, 'lr': 3.251222820312169e-05, 'weight_decay': 1.6382988819397698e-06, 'epochs': 209, 'loss': 'mse', 'optimizer': 'adam', 'graph_mode': 'knn', 'source': 'grm', 'knn_k': 1, 'weighted_edges': False, 'symmetrize_mode': 'union', 'use_snp_selection': False}. Best is trial 122 with value: 0.09035969840513271.
[I 2025-11-03 15:21:06,682] Trial 136 finished with value: 0.054713288937642456 and parameters: {'model_type': 'graphsage', 'hidden_dims': '[512, 64]', 'dropout': 0.12967075310396972, 'batch_norm': True, 'lr': 3.5812367971564435e-05, 'weight_decay': 1.291614577679717e-06, 'epochs': 254, 'loss': 'mse', 'optimizer': 'adam', 'graph_mode': 'knn', 'source': 'grm', 'knn_k': 1, 'weighted_edges': False, 'symmetrize_mode': 'union', 'use_snp_selection': False}. Best is trial 122 with value: 0.09035969840513271.
[I 2025-11-03 15:21:10,228] Trial 137 finished with value: 0.03843458812744365 and parameters: {'model_type': 'graphsage', 'hidden_dims': '[512, 64]', 'dropout': 0.2373230410898838, 'batch_norm': True, 'lr': 2.391941661490273e-05, 'weight_decay': 1.1166482118025418e-06, 'epochs': 200, 'loss': 'mse', 'optimizer': 'adam', 'graph_mode': 'knn', 'source': 'grm', 'knn_k': 2, 'weighted_edges': False, 'symmetrize_mode': 'union', 'use_snp_selection': False}. Best is trial 122 with value: 0.09035969840513271.
[I 2025-11-03 15:21:13,817] Trial 138 finished with value: 0.02054952733921497 and parameters: {'model_type': 'graphsage', 'hidden_dims': '[512, 64]', 'dropout': 0.1743172910564967, 'batch_norm': True, 'lr': 3.104725389635499e-05, 'weight_decay': 7.04585926918076e-07, 'epochs': 217, 'loss': 'mse', 'optimizer': 'adam', 'graph_mode': 'knn', 'source': 'grm', 'knn_k': 1, 'weighted_edges': False, 'symmetrize_mode': 'union', 'use_snp_selection': False}. Best is trial 122 with value: 0.09035969840513271.
[I 2025-11-03 15:21:17,176] Trial 139 finished with value: 0.04525581017703231 and parameters: {'model_type': 'graphsage', 'hidden_dims': '[512, 64]', 'dropout': 0.20972266165613657, 'batch_norm': True, 'lr': 5.344747778780953e-05, 'weight_decay': 9.426421982190625e-07, 'epochs': 176, 'loss': 'mse', 'optimizer': 'adam', 'graph_mode': 'knn', 'source': 'grm', 'knn_k': 2, 'weighted_edges': False, 'symmetrize_mode': 'union', 'use_snp_selection': False}. Best is trial 122 with value: 0.09035969840513271.
[I 2025-11-03 15:21:20,632] Trial 140 finished with value: 0.040805696068576425 and parameters: {'model_type': 'graphsage', 'hidden_dims': '[512, 64]', 'dropout': 0.16408148140922893, 'batch_norm': True, 'lr': 4.231830500229355e-05, 'weight_decay': 2.348794003935926e-06, 'epochs': 194, 'loss': 'mae', 'optimizer': 'adam', 'graph_mode': 'knn', 'source': 'grm', 'knn_k': 1, 'weighted_edges': False, 'symmetrize_mode': 'union', 'use_snp_selection': False}. Best is trial 122 with value: 0.09035969840513271.
[I 2025-11-03 15:21:24,043] Trial 141 finished with value: 0.07979588746938562 and parameters: {'model_type': 'graphsage', 'hidden_dims': '[512, 64]', 'dropout': 0.15410239432036799, 'batch_norm': True, 'lr': 3.3716906009269934e-05, 'weight_decay': 1.496505737581529e-06, 'epochs': 184, 'loss': 'mse', 'optimizer': 'adam', 'graph_mode': 'knn', 'source': 'grm', 'knn_k': 2, 'weighted_edges': False, 'symmetrize_mode': 'union', 'use_snp_selection': False}. Best is trial 122 with value: 0.09035969840513271.
[I 2025-11-03 15:21:27,657] Trial 142 finished with value: 0.0437815020663831 and parameters: {'model_type': 'graphsage', 'hidden_dims': '[512, 64]', 'dropout': 0.1555822646253753, 'batch_norm': True, 'lr': 2.794178901860676e-05, 'weight_decay': 1.810130286975901e-06, 'epochs': 211, 'loss': 'mse', 'optimizer': 'adam', 'graph_mode': 'knn', 'source': 'grm', 'knn_k': 2, 'weighted_edges': False, 'symmetrize_mode': 'union', 'use_snp_selection': False}. Best is trial 122 with value: 0.09035969840513271.
[I 2025-11-03 15:21:31,034] Trial 143 finished with value: 0.05266458526905123 and parameters: {'model_type': 'graphsage', 'hidden_dims': '[512, 64]', 'dropout': 0.1799774588263084, 'batch_norm': True, 'lr': 1.6052244324933466e-05, 'weight_decay': 1.4514959422321538e-06, 'epochs': 184, 'loss': 'mse', 'optimizer': 'adam', 'graph_mode': 'knn', 'source': 'grm', 'knn_k': 1, 'weighted_edges': False, 'symmetrize_mode': 'union', 'use_snp_selection': False}. Best is trial 122 with value: 0.09035969840513271.
[I 2025-11-03 15:21:35,072] Trial 144 finished with value: 0.0643233676999214 and parameters: {'model_type': 'graphsage', 'hidden_dims': '[512, 64]', 'dropout': 0.19317777367853015, 'batch_norm': True, 'lr': 2.0481441365011124e-05, 'weight_decay': 1.1611981181335919e-06, 'epochs': 265, 'loss': 'mse', 'optimizer': 'adam', 'graph_mode': 'knn', 'source': 'grm', 'knn_k': 2, 'weighted_edges': False, 'symmetrize_mode': 'union', 'use_snp_selection': False}. Best is trial 122 with value: 0.09035969840513271.
[I 2025-11-03 15:21:39,089] Trial 145 finished with value: 0.052971587652829305 and parameters: {'model_type': 'graphsage', 'hidden_dims': '[512, 64]', 'dropout': 0.15565366737768935, 'batch_norm': True, 'lr': 1.87089731735158e-05, 'weight_decay': 8.344558597168775e-07, 'epochs': 263, 'loss': 'mse', 'optimizer': 'adam', 'graph_mode': 'knn', 'source': 'grm', 'knn_k': 2, 'weighted_edges': False, 'symmetrize_mode': 'union', 'use_snp_selection': False}. Best is trial 122 with value: 0.09035969840513271.
[I 2025-11-03 15:21:42,983] Trial 146 finished with value: 0.06649133295340384 and parameters: {'model_type': 'graphsage', 'hidden_dims': '[512, 64]', 'dropout': 0.1403384577097043, 'batch_norm': True, 'lr': 2.1644830477443638e-05, 'weight_decay': 1.6200384783854677e-06, 'epochs': 246, 'loss': 'mse', 'optimizer': 'adam', 'graph_mode': 'knn', 'source': 'grm', 'knn_k': 2, 'weighted_edges': False, 'symmetrize_mode': 'union', 'use_snp_selection': False}. Best is trial 122 with value: 0.09035969840513271.
[I 2025-11-03 15:21:46,835] Trial 147 finished with value: 0.022430241651408927 and parameters: {'model_type': 'graphsage', 'hidden_dims': '[512, 64]', 'dropout': 0.13527735246083927, 'batch_norm': True, 'lr': 1.3328041823854633e-05, 'weight_decay': 2.762802409106909e-06, 'epochs': 247, 'loss': 'mse', 'optimizer': 'adam', 'graph_mode': 'knn', 'source': 'grm', 'knn_k': 2, 'weighted_edges': False, 'symmetrize_mode': 'union', 'use_snp_selection': False}. Best is trial 122 with value: 0.09035969840513271.
[I 2025-11-03 15:21:49,414] Trial 148 finished with value: 0.050266722195198905 and parameters: {'model_type': 'graphsage', 'hidden_dims': '[256, 128, 64]', 'dropout': 0.12351953875439402, 'batch_norm': True, 'lr': 3.8594900512765556e-05, 'weight_decay': 1.6628682144843066e-06, 'epochs': 233, 'loss': 'mse', 'optimizer': 'adam', 'graph_mode': 'knn', 'source': 'grm', 'knn_k': 1, 'weighted_edges': False, 'symmetrize_mode': 'union', 'use_snp_selection': False}. Best is trial 122 with value: 0.09035969840513271.
[I 2025-11-03 15:21:52,902] Trial 149 finished with value: 0.050081156222099854 and parameters: {'model_type': 'graphsage', 'hidden_dims': '[512, 64]', 'dropout': 0.11261005205645917, 'batch_norm': True, 'lr': 4.6907850799813586e-05, 'weight_decay': 1.4338670778703321e-06, 'epochs': 194, 'loss': 'mse', 'optimizer': 'adam', 'graph_mode': 'knn', 'source': 'grm', 'knn_k': 2, 'weighted_edges': False, 'symmetrize_mode': 'union', 'use_snp_selection': False}. Best is trial 122 with value: 0.09035969840513271.
[I 2025-11-03 15:21:55,310] Trial 0 finished with value: 0.02905580965514785 and parameters: {'model_type': 'graphsage', 'hidden_dims': '[128, 64]', 'dropout': 0.199031432379812, 'batch_norm': True, 'lr': 1.8408544111075837e-06, 'weight_decay': 5.5136510071208614e-05, 'epochs': 336, 'loss': 'mae', 'optimizer': 'adam', 'graph_mode': 'knn', 'source': 'grm', 'knn_k': 8, 'weighted_edges': True, 'symmetrize_mode': 'mutual', 'use_snp_selection': False}. Best is trial 0 with value: 0.02905580965514785.
[I 2025-11-03 15:21:56,772] Trial 1 finished with value: 0.07770680355561108 and parameters: {'model_type': 'graphsage', 'hidden_dims': '[128, 64]', 'dropout': 0.40051947670227217, 'batch_norm': True, 'lr': 0.0005320428882732732, 'weight_decay': 1.89210117736594e-06, 'epochs': 68, 'loss': 'mse', 'optimizer': 'adam', 'graph_mode': 'knn', 'source': 'grm', 'knn_k': 7, 'weighted_edges': True, 'symmetrize_mode': 'union', 'use_snp_selection': False}. Best is trial 1 with value: 0.07770680355561108.
[I 2025-11-03 15:21:59,108] Trial 2 finished with value: 0.017949399428624144 and parameters: {'model_type': 'graphsage', 'hidden_dims': '[256, 128]', 'dropout': 0.5105528289184642, 'batch_norm': False, 'lr': 0.0006804279372404962, 'weight_decay': 0.0008922815224257085, 'epochs': 181, 'loss': 'mse', 'optimizer': 'adam', 'graph_mode': 'cutoff', 'cutoff': 0.5741905641612706, 'grm_norm': 'gcn', 'self_loops': False, 'use_snp_selection': True, 'num_snps': 26910}. Best is trial 1 with value: 0.07770680355561108.
[I 2025-11-03 15:22:01,602] Trial 3 finished with value: -0.0069442381862005464 and parameters: {'model_type': 'graphsage', 'hidden_dims': '[256, 128, 64]', 'dropout': 0.5390483213624292, 'batch_norm': False, 'lr': 3.4705625989073525e-05, 'weight_decay': 2.4623319020131338e-05, 'epochs': 121, 'loss': 'mse', 'optimizer': 'adam', 'graph_mode': 'knn', 'source': 'grm', 'knn_k': 6, 'weighted_edges': False, 'symmetrize_mode': 'mutual', 'use_snp_selection': True, 'num_snps': 30713}. Best is trial 1 with value: 0.07770680355561108.
[I 2025-11-03 15:22:04,004] Trial 4 finished with value: 0.059285324673362796 and parameters: {'model_type': 'graphsage', 'hidden_dims': '[128, 64]', 'dropout': 0.13404863676897502, 'batch_norm': False, 'lr': 0.0001431556295367288, 'weight_decay': 2.2084517750726675e-05, 'epochs': 51, 'loss': 'mae', 'optimizer': 'adam', 'graph_mode': 'cutoff', 'cutoff': 0.6714268476993044, 'grm_norm': 'none', 'self_loops': False, 'use_snp_selection': True, 'num_snps': 45645}. Best is trial 1 with value: 0.07770680355561108.
[I 2025-11-03 15:22:06,943] Trial 5 finished with value: 0.028302425044612542 and parameters: {'model_type': 'graphsage', 'hidden_dims': '[256, 128]', 'dropout': 0.42253606323412096, 'batch_norm': False, 'lr': 4.238630400638805e-05, 'weight_decay': 8.074086040046576e-07, 'epochs': 158, 'loss': 'mae', 'optimizer': 'adam', 'graph_mode': 'knn', 'source': 'grm', 'knn_k': 1, 'weighted_edges': False, 'symmetrize_mode': 'mutual', 'use_snp_selection': True, 'num_snps': 43113}. Best is trial 1 with value: 0.07770680355561108.
[I 2025-11-03 15:22:10,436] Trial 6 finished with value: 0.0997794959163622 and parameters: {'model_type': 'graphsage', 'hidden_dims': '[512, 256]', 'dropout': 0.3534893146320237, 'batch_norm': True, 'lr': 0.000251307964226932, 'weight_decay': 1.821819791794022e-05, 'epochs': 223, 'loss': 'mae', 'optimizer': 'adam', 'graph_mode': 'knn', 'source': 'grm', 'knn_k': 1, 'weighted_edges': True, 'symmetrize_mode': 'mutual', 'use_snp_selection': False}. Best is trial 6 with value: 0.0997794959163622.
[I 2025-11-03 15:22:13,631] Trial 7 finished with value: 0.08481136710134446 and parameters: {'model_type': 'graphsage', 'hidden_dims': '[512, 256]', 'dropout': 0.1105825955860775, 'batch_norm': True, 'lr': 2.374338412754043e-05, 'weight_decay': 1.1284721123340274e-05, 'epochs': 190, 'loss': 'mse', 'optimizer': 'adam', 'graph_mode': 'cutoff', 'cutoff': 0.719872204109604, 'grm_norm': 'gcn', 'self_loops': False, 'use_snp_selection': False}. Best is trial 6 with value: 0.0997794959163622.
[I 2025-11-03 15:22:16,464] Trial 8 finished with value: 0.0714017116559982 and parameters: {'model_type': 'graphsage', 'hidden_dims': '[512, 128]', 'dropout': 0.5066580418354021, 'batch_norm': True, 'lr': 0.00039213678276659976, 'weight_decay': 3.43655320802934e-06, 'epochs': 120, 'loss': 'mse', 'optimizer': 'adam', 'graph_mode': 'cutoff', 'cutoff': 0.34923059576505366, 'grm_norm': 'cosine', 'self_loops': True, 'use_snp_selection': False}. Best is trial 6 with value: 0.0997794959163622.
[I 2025-11-03 15:22:18,366] Trial 9 finished with value: 0.0376627075279474 and parameters: {'model_type': 'graphsage', 'hidden_dims': '[512, 256]', 'dropout': 0.301734920240333, 'batch_norm': False, 'lr': 6.650961854953448e-06, 'weight_decay': 6.861575656590315e-05, 'epochs': 150, 'loss': 'mae', 'optimizer': 'adam', 'graph_mode': 'cutoff', 'cutoff': 0.2857569870061939, 'grm_norm': 'cosine_then_gcn', 'self_loops': False, 'use_snp_selection': True, 'num_snps': 12722}. Best is trial 6 with value: 0.0997794959163622.
[I 2025-11-03 15:22:22,235] Trial 10 finished with value: 0.09729652708939723 and parameters: {'model_type': 'graphsage', 'hidden_dims': '[512, 64]', 'dropout': 0.2833599465317005, 'batch_norm': True, 'lr': 0.00016916760584270694, 'weight_decay': 1.7866650996308468e-07, 'epochs': 275, 'loss': 'mae', 'optimizer': 'adam', 'graph_mode': 'knn', 'source': 'grm', 'knn_k': 1, 'weighted_edges': True, 'symmetrize_mode': 'union', 'use_snp_selection': False}. Best is trial 6 with value: 0.0997794959163622.
