[I 2025-11-03 14:11:42,464] Trial 1 finished with value: 0.12626565631834744 and parameters: {'model_type': 'gcn', 'hidden_dims': '[128, 64]', 'dropout': 0.40051947670227217, 'batch_norm': True, 'lr': 0.0005320428882732732, 'weight_decay': 1.89210117736594e-06, 'epochs': 32, 'loss': 'mse', 'optimizer': 'adam', 'graph_mode': 'knn', 'source': 'grm', 'knn_k': 7, 'weighted_edges': True, 'symmetrize_mode': 'union', 'use_snp_selection': False}. Best is trial 1 with value: 0.12626565631834744.
[I 2025-11-03 14:11:45,667] Trial 2 finished with value: 0.0938700673707686 and parameters: {'model_type': 'gcn', 'hidden_dims': '[256, 128]', 'dropout': 0.5105528289184642, 'batch_norm': False, 'lr': 0.0006804279372404962, 'weight_decay': 0.0008922815224257085, 'epochs': 160, 'loss': 'mse', 'optimizer': 'adam', 'graph_mode': 'cutoff', 'cutoff': 0.5741905641612706, 'grm_norm': 'gcn', 'self_loops': False, 'use_snp_selection': True, 'num_snps': 26910}. Best is trial 1 with value: 0.12626565631834744.
[I 2025-11-03 14:11:48,866] Trial 3 finished with value: 0.06684505821530655 and parameters: {'model_type': 'gcn', 'hidden_dims': '[256, 128, 64]', 'dropout': 0.5390483213624292, 'batch_norm': False, 'lr': 3.4705625989073525e-05, 'weight_decay': 2.4623319020131338e-05, 'epochs': 92, 'loss': 'mse', 'optimizer': 'adam', 'graph_mode': 'knn', 'source': 'grm', 'knn_k': 6, 'weighted_edges': False, 'symmetrize_mode': 'mutual', 'use_snp_selection': True, 'num_snps': 30713}. Best is trial 1 with value: 0.12626565631834744.
[I 2025-11-03 14:11:51,885] Trial 4 finished with value: -0.01450327105869859 and parameters: {'model_type': 'gcn', 'hidden_dims': '[128, 64]', 'dropout': 0.13404863676897502, 'batch_norm': False, 'lr': 0.0001431556295367288, 'weight_decay': 2.2084517750726675e-05, 'epochs': 13, 'loss': 'mae', 'optimizer': 'adam', 'graph_mode': 'cutoff', 'cutoff': 0.6714268476993044, 'grm_norm': 'none', 'self_loops': False, 'use_snp_selection': True, 'num_snps': 45645}. Best is trial 1 with value: 0.12626565631834744.
[I 2025-11-03 14:11:55,703] Trial 5 finished with value: 0.11619480682591389 and parameters: {'model_type': 'gcn', 'hidden_dims': '[256, 128]', 'dropout': 0.42253606323412096, 'batch_norm': False, 'lr': 4.238630400638805e-05, 'weight_decay': 8.074086040046576e-07, 'epochs': 134, 'loss': 'mae', 'optimizer': 'adam', 'graph_mode': 'knn', 'source': 'grm', 'knn_k': 1, 'weighted_edges': False, 'symmetrize_mode': 'mutual', 'use_snp_selection': True, 'num_snps': 43113}. Best is trial 1 with value: 0.12626565631834744.
[I 2025-11-03 14:11:59,596] Trial 6 finished with value: 0.17098581349310818 and parameters: {'model_type': 'gcn', 'hidden_dims': '[512, 256]', 'dropout': 0.3534893146320237, 'batch_norm': True, 'lr': 0.000251307964226932, 'weight_decay': 1.821819791794022e-05, 'epochs': 207, 'loss': 'mae', 'optimizer': 'adam', 'graph_mode': 'knn', 'source': 'grm', 'knn_k': 1, 'weighted_edges': True, 'symmetrize_mode': 'mutual', 'use_snp_selection': False}. Best is trial 6 with value: 0.17098581349310818.
[I 2025-11-03 14:12:02,937] Trial 7 finished with value: 0.08403814520125101 and parameters: {'model_type': 'gcn', 'hidden_dims': '[512, 256]', 'dropout': 0.1105825955860775, 'batch_norm': True, 'lr': 2.374338412754043e-05, 'weight_decay': 1.1284721123340274e-05, 'epochs': 170, 'loss': 'mse', 'optimizer': 'adam', 'graph_mode': 'cutoff', 'cutoff': 0.719872204109604, 'grm_norm': 'gcn', 'self_loops': False, 'use_snp_selection': False}. Best is trial 6 with value: 0.17098581349310818.
[I 2025-11-03 14:12:05,316] Trial 8 finished with value: 0.13768859425703542 and parameters: {'model_type': 'gcn', 'hidden_dims': '[512, 128]', 'dropout': 0.5066580418354021, 'batch_norm': True, 'lr': 0.00039213678276659976, 'weight_decay': 3.43655320802934e-06, 'epochs': 91, 'loss': 'mse', 'optimizer': 'adam', 'graph_mode': 'cutoff', 'cutoff': 0.34923059576505366, 'grm_norm': 'cosine', 'self_loops': True, 'use_snp_selection': False}. Best is trial 6 with value: 0.17098581349310818.
[I 2025-11-03 14:12:07,985] Trial 9 finished with value: 0.08805890474041783 and parameters: {'model_type': 'gcn', 'hidden_dims': '[512, 256]', 'dropout': 0.301734920240333, 'batch_norm': False, 'lr': 6.650961854953448e-06, 'weight_decay': 6.861575656590315e-05, 'epochs': 125, 'loss': 'mae', 'optimizer': 'adam', 'graph_mode': 'cutoff', 'cutoff': 0.2857569870061939, 'grm_norm': 'cosine_then_gcn', 'self_loops': False, 'use_snp_selection': True, 'num_snps': 12722}. Best is trial 6 with value: 0.17098581349310818.
[I 2025-11-03 14:12:12,582] Trial 10 finished with value: 0.14895606077022458 and parameters: {'model_type': 'gcn', 'hidden_dims': '[512, 64]', 'dropout': 0.2833599465317005, 'batch_norm': True, 'lr': 0.00016916760584270694, 'weight_decay': 1.7866650996308468e-07, 'epochs': 266, 'loss': 'mae', 'optimizer': 'adam', 'graph_mode': 'knn', 'source': 'grm', 'knn_k': 1, 'weighted_edges': True, 'symmetrize_mode': 'union', 'use_snp_selection': False}. Best is trial 6 with value: 0.17098581349310818.
[I 2025-11-03 14:12:17,170] Trial 11 finished with value: 0.14463479599267082 and parameters: {'model_type': 'gcn', 'hidden_dims': '[512, 64]', 'dropout': 0.2859699507705008, 'batch_norm': True, 'lr': 0.00012623783700890367, 'weight_decay': 1.6805209943987688e-07, 'epochs': 265, 'loss': 'mae', 'optimizer': 'adam', 'graph_mode': 'knn', 'source': 'grm', 'knn_k': 1, 'weighted_edges': True, 'symmetrize_mode': 'union', 'use_snp_selection': False}. Best is trial 6 with value: 0.17098581349310818.
[I 2025-11-03 14:12:21,482] Trial 12 finished with value: 0.16887230584551804 and parameters: {'model_type': 'gcn', 'hidden_dims': '[512, 64]', 'dropout': 0.2516138819478735, 'batch_norm': True, 'lr': 0.00016473964335013254, 'weight_decay': 1.0888016761521717e-07, 'epochs': 241, 'loss': 'mae', 'optimizer': 'adam', 'graph_mode': 'knn', 'source': 'grm', 'knn_k': 3, 'weighted_edges': True, 'symmetrize_mode': 'union', 'use_snp_selection': False}. Best is trial 6 with value: 0.17098581349310818.
[I 2025-11-03 14:12:25,632] Trial 13 finished with value: 0.1303367365303335 and parameters: {'model_type': 'gcn', 'hidden_dims': '[512, 64]', 'dropout': 0.3597295172492356, 'batch_norm': True, 'lr': 7.689848153447392e-05, 'weight_decay': 0.000399947667615736, 'epochs': 229, 'loss': 'mae', 'optimizer': 'adam', 'graph_mode': 'knn', 'source': 'grm', 'knn_k': 4, 'weighted_edges': True, 'symmetrize_mode': 'mutual', 'use_snp_selection': False}. Best is trial 6 with value: 0.17098581349310818.
[I 2025-11-03 14:12:29,649] Trial 14 finished with value: 0.14822494317369797 and parameters: {'model_type': 'gcn', 'hidden_dims': '[512, 256]', 'dropout': 0.21126359993861654, 'batch_norm': True, 'lr': 0.0002367337458131251, 'weight_decay': 9.061559471970189e-07, 'epochs': 217, 'loss': 'mae', 'optimizer': 'adam', 'graph_mode': 'knn', 'source': 'grm', 'knn_k': 4, 'weighted_edges': True, 'symmetrize_mode': 'union', 'use_snp_selection': False}. Best is trial 6 with value: 0.17098581349310818.
[I 2025-11-03 14:12:35,198] Trial 15 finished with value: 0.14648630493934967 and parameters: {'model_type': 'gcn', 'hidden_dims': '[512, 128]', 'dropout': 0.44099154398585816, 'batch_norm': True, 'lr': 0.00094645867610948, 'weight_decay': 0.00013722890470534003, 'epochs': 340, 'loss': 'mae', 'optimizer': 'adam', 'graph_mode': 'knn', 'source': 'grm', 'knn_k': 3, 'weighted_edges': True, 'symmetrize_mode': 'union', 'use_snp_selection': False}. Best is trial 6 with value: 0.17098581349310818.
[I 2025-11-03 14:12:38,227] Trial 16 finished with value: 0.034044864291780524 and parameters: {'model_type': 'gcn', 'hidden_dims': '[256, 128, 64]', 'dropout': 0.21908549744794698, 'batch_norm': True, 'lr': 1.0655602571820844e-05, 'weight_decay': 4.832222602312157e-06, 'epochs': 215, 'loss': 'mae', 'optimizer': 'adam', 'graph_mode': 'knn', 'source': 'grm', 'knn_k': 3, 'weighted_edges': False, 'symmetrize_mode': 'mutual', 'use_snp_selection': False}. Best is trial 6 with value: 0.17098581349310818.
[I 2025-11-03 14:12:43,250] Trial 17 finished with value: 0.1335836422201454 and parameters: {'model_type': 'gcn', 'hidden_dims': '[512, 64]', 'dropout': 0.3282079163030167, 'batch_norm': True, 'lr': 6.670040555727496e-05, 'weight_decay': 5.045462661453517e-07, 'epochs': 300, 'loss': 'mae', 'optimizer': 'adam', 'graph_mode': 'knn', 'source': 'grm', 'knn_k': 3, 'weighted_edges': True, 'symmetrize_mode': 'mutual', 'use_snp_selection': False}. Best is trial 6 with value: 0.17098581349310818.
[I 2025-11-03 14:12:47,882] Trial 18 finished with value: 0.14022984242104047 and parameters: {'model_type': 'gcn', 'hidden_dims': '[512, 256]', 'dropout': 0.2476817484965013, 'batch_norm': True, 'lr': 0.0002978173720575952, 'weight_decay': 1.1176835248479296e-05, 'epochs': 260, 'loss': 'mae', 'optimizer': 'adam', 'graph_mode': 'knn', 'source': 'grm', 'knn_k': 10, 'weighted_edges': True, 'symmetrize_mode': 'union', 'use_snp_selection': False}. Best is trial 6 with value: 0.17098581349310818.
[I 2025-11-03 14:12:51,504] Trial 19 finished with value: 0.07663231323624685 and parameters: {'model_type': 'gcn', 'hidden_dims': '[512, 64]', 'dropout': 0.3742774197693131, 'batch_norm': True, 'lr': 1.4712248825400985e-05, 'weight_decay': 1.197839835149131e-07, 'epochs': 187, 'loss': 'mae', 'optimizer': 'adam', 'graph_mode': 'knn', 'source': 'grm', 'knn_k': 2, 'weighted_edges': True, 'symmetrize_mode': 'mutual', 'use_snp_selection': False}. Best is trial 6 with value: 0.17098581349310818.
[I 2025-11-03 14:12:56,633] Trial 20 finished with value: 0.14208306177249597 and parameters: {'model_type': 'gcn', 'hidden_dims': '[512, 256]', 'dropout': 0.1623483198100928, 'batch_norm': True, 'lr': 7.814216929352608e-05, 'weight_decay': 4.303705038788151e-06, 'epochs': 305, 'loss': 'mae', 'optimizer': 'adam', 'graph_mode': 'knn', 'source': 'grm', 'knn_k': 5, 'weighted_edges': False, 'symmetrize_mode': 'union', 'use_snp_selection': False}. Best is trial 6 with value: 0.17098581349310818.
[I 2025-11-03 14:13:01,127] Trial 21 finished with value: 0.15463655751094352 and parameters: {'model_type': 'gcn', 'hidden_dims': '[512, 64]', 'dropout': 0.26773844876799047, 'batch_norm': True, 'lr': 0.0001777965336876473, 'weight_decay': 2.8775357835999634e-07, 'epochs': 259, 'loss': 'mae', 'optimizer': 'adam', 'graph_mode': 'knn', 'source': 'grm', 'knn_k': 1, 'weighted_edges': True, 'symmetrize_mode': 'union', 'use_snp_selection': False}. Best is trial 6 with value: 0.17098581349310818.
[I 2025-11-03 14:13:05,401] Trial 22 finished with value: 0.15258379720943166 and parameters: {'model_type': 'gcn', 'hidden_dims': '[512, 64]', 'dropout': 0.2556120914896494, 'batch_norm': True, 'lr': 0.0004654899141828642, 'weight_decay': 4.1382557577323254e-07, 'epochs': 239, 'loss': 'mae', 'optimizer': 'adam', 'graph_mode': 'knn', 'source': 'grm', 'knn_k': 2, 'weighted_edges': True, 'symmetrize_mode': 'union', 'use_snp_selection': False}. Best is trial 6 with value: 0.17098581349310818.
[I 2025-11-03 14:13:09,144] Trial 23 finished with value: 0.14282024436553295 and parameters: {'model_type': 'gcn', 'hidden_dims': '[512, 64]', 'dropout': 0.3317376039204736, 'batch_norm': True, 'lr': 0.0001788093954232471, 'weight_decay': 3.743610451243045e-07, 'epochs': 196, 'loss': 'mae', 'optimizer': 'adam', 'graph_mode': 'knn', 'source': 'grm', 'knn_k': 2, 'weighted_edges': True, 'symmetrize_mode': 'union', 'use_snp_selection': False}. Best is trial 6 with value: 0.17098581349310818.
[I 2025-11-03 14:13:14,014] Trial 24 finished with value: 0.16007987026727954 and parameters: {'model_type': 'gcn', 'hidden_dims': '[512, 64]', 'dropout': 0.45914131400428215, 'batch_norm': True, 'lr': 0.00028794000644456215, 'weight_decay': 1.0284448196550431e-07, 'epochs': 288, 'loss': 'mae', 'optimizer': 'adam', 'graph_mode': 'knn', 'source': 'grm', 'knn_k': 1, 'weighted_edges': True, 'symmetrize_mode': 'union', 'use_snp_selection': False}. Best is trial 6 with value: 0.17098581349310818.
[I 2025-11-03 14:13:17,820] Trial 25 finished with value: 0.13328077597648905 and parameters: {'model_type': 'gcn', 'hidden_dims': '[256, 128, 64]', 'dropout': 0.45843557261648266, 'batch_norm': True, 'lr': 0.0009781454116176084, 'weight_decay': 1.3233991819523772e-06, 'epochs': 301, 'loss': 'mae', 'optimizer': 'adam', 'graph_mode': 'knn', 'source': 'grm', 'knn_k': 2, 'weighted_edges': True, 'symmetrize_mode': 'union', 'use_snp_selection': False}. Best is trial 6 with value: 0.17098581349310818.
[I 2025-11-03 14:13:24,959] Trial 26 finished with value: 0.11457821903678209 and parameters: {'model_type': 'gcn', 'hidden_dims': '[512, 128]', 'dropout': 0.5989010380530413, 'batch_norm': False, 'lr': 0.0003557393545783579, 'weight_decay': 2.5961438750364377e-06, 'epochs': 291, 'loss': 'mae', 'optimizer': 'adam', 'graph_mode': 'knn', 'source': 'grm', 'knn_k': 4, 'weighted_edges': True, 'symmetrize_mode': 'mutual', 'use_snp_selection': True, 'num_snps': 59005}. Best is trial 6 with value: 0.17098581349310818.
[I 2025-11-03 14:13:27,586] Trial 27 finished with value: 0.14452702467071804 and parameters: {'model_type': 'gcn', 'hidden_dims': '[256, 128]', 'dropout': 0.38479298819473334, 'batch_norm': True, 'lr': 0.00011190656687973586, 'weight_decay': 1.0209055852717655e-07, 'epochs': 202, 'loss': 'mse', 'optimizer': 'adam', 'graph_mode': 'cutoff', 'cutoff': 0.8907049599927799, 'grm_norm': 'none', 'self_loops': True, 'use_snp_selection': False}. Best is trial 6 with value: 0.17098581349310818.
[I 2025-11-03 14:13:31,849] Trial 28 finished with value: -0.003157840544666144 and parameters: {'model_type': 'gcn', 'hidden_dims': '[512, 256]', 'dropout': 0.4766506959585789, 'batch_norm': True, 'lr': 1.172392540014445e-06, 'weight_decay': 0.00017406942460314084, 'epochs': 239, 'loss': 'mae', 'optimizer': 'adam', 'graph_mode': 'knn', 'source': 'grm', 'knn_k': 1, 'weighted_edges': False, 'symmetrize_mode': 'union', 'use_snp_selection': False}. Best is trial 6 with value: 0.17098581349310818.
[I 2025-11-03 14:13:34,568] Trial 29 finished with value: 0.1073106186417676 and parameters: {'model_type': 'gcn', 'hidden_dims': '[128, 64]', 'dropout': 0.1881763221627633, 'batch_norm': True, 'lr': 5.965551113016721e-05, 'weight_decay': 3.18257793468402e-05, 'epochs': 328, 'loss': 'mae', 'optimizer': 'adam', 'graph_mode': 'knn', 'source': 'grm', 'knn_k': 3, 'weighted_edges': True, 'symmetrize_mode': 'mutual', 'use_snp_selection': False}. Best is trial 6 with value: 0.17098581349310818.
[I 2025-11-03 14:13:39,398] Trial 30 finished with value: 0.15006720918135985 and parameters: {'model_type': 'gcn', 'hidden_dims': '[512, 64]', 'dropout': 0.40613571624268474, 'batch_norm': True, 'lr': 0.00029220735795704487, 'weight_decay': 6.560859181474708e-06, 'epochs': 282, 'loss': 'mae', 'optimizer': 'adam', 'graph_mode': 'knn', 'source': 'grm', 'knn_k': 5, 'weighted_edges': True, 'symmetrize_mode': 'union', 'use_snp_selection': False}. Best is trial 6 with value: 0.17098581349310818.
[I 2025-11-03 14:13:43,817] Trial 31 finished with value: 0.17643153876650486 and parameters: {'model_type': 'gcn', 'hidden_dims': '[512, 64]', 'dropout': 0.25866284115068366, 'batch_norm': True, 'lr': 0.000260543344008694, 'weight_decay': 2.5332157395009307e-07, 'epochs': 252, 'loss': 'mae', 'optimizer': 'adam', 'graph_mode': 'knn', 'source': 'grm', 'knn_k': 1, 'weighted_edges': True, 'symmetrize_mode': 'union', 'use_snp_selection': False}. Best is trial 31 with value: 0.17643153876650486.
[I 2025-11-03 14:13:49,070] Trial 32 finished with value: 0.15535557949429676 and parameters: {'model_type': 'gcn', 'hidden_dims': '[512, 64]', 'dropout': 0.3141813032131386, 'batch_norm': True, 'lr': 0.0005901224803799996, 'weight_decay': 2.16571880973445e-07, 'epochs': 319, 'loss': 'mae', 'optimizer': 'adam', 'graph_mode': 'knn', 'source': 'grm', 'knn_k': 2, 'weighted_edges': True, 'symmetrize_mode': 'union', 'use_snp_selection': False}. Best is trial 31 with value: 0.17643153876650486.
[I 2025-11-03 14:13:52,230] Trial 33 finished with value: 0.16251006323624861 and parameters: {'model_type': 'gcn', 'hidden_dims': '[512, 64]', 'dropout': 0.23197838659483025, 'batch_norm': True, 'lr': 0.0002460806292933934, 'weight_decay': 1.0085132595718538e-07, 'epochs': 151, 'loss': 'mae', 'optimizer': 'adam', 'graph_mode': 'knn', 'source': 'grm', 'knn_k': 1, 'weighted_edges': True, 'symmetrize_mode': 'union', 'use_snp_selection': False}. Best is trial 31 with value: 0.17643153876650486.
[I 2025-11-03 14:13:55,370] Trial 34 finished with value: 0.11973640304030914 and parameters: {'model_type': 'gcn', 'hidden_dims': '[512, 64]', 'dropout': 0.22680568608060012, 'batch_norm': True, 'lr': 9.880444637960728e-05, 'weight_decay': 6.763092306449468e-07, 'epochs': 149, 'loss': 'mse', 'optimizer': 'adam', 'graph_mode': 'knn', 'source': 'grm', 'knn_k': 2, 'weighted_edges': True, 'symmetrize_mode': 'union', 'use_snp_selection': False}. Best is trial 31 with value: 0.17643153876650486.
[I 2025-11-03 14:13:57,406] Trial 35 finished with value: 0.07968510909716521 and parameters: {'model_type': 'gcn', 'hidden_dims': '[128, 64]', 'dropout': 0.1755953806519785, 'batch_norm': False, 'lr': 0.0006314374759648859, 'weight_decay': 1.6206200433427097e-06, 'epochs': 100, 'loss': 'mae', 'optimizer': 'adam', 'graph_mode': 'knn', 'source': 'grm', 'knn_k': 1, 'weighted_edges': True, 'symmetrize_mode': 'union', 'use_snp_selection': True, 'num_snps': 2074}. Best is trial 31 with value: 0.17643153876650486.
[I 2025-11-03 14:13:58,997] Trial 36 finished with value: 0.04260219742753916 and parameters: {'model_type': 'gcn', 'hidden_dims': '[256, 128]', 'dropout': 0.14919848852980405, 'batch_norm': True, 'lr': 4.509713883479375e-06, 'weight_decay': 2.3701577811065651e-07, 'epochs': 60, 'loss': 'mse', 'optimizer': 'adam', 'graph_mode': 'cutoff', 'cutoff': 0.42596163795855535, 'grm_norm': 'cosine', 'self_loops': True, 'use_snp_selection': False}. Best is trial 31 with value: 0.17643153876650486.
[I 2025-11-03 14:14:02,054] Trial 37 finished with value: 0.11182315470746151 and parameters: {'model_type': 'gcn', 'hidden_dims': '[256, 128, 64]', 'dropout': 0.23520910760573294, 'batch_norm': False, 'lr': 4.205696629296654e-05, 'weight_decay': 1.7866424610011896e-05, 'epochs': 180, 'loss': 'mae', 'optimizer': 'adam', 'graph_mode': 'knn', 'source': 'grm', 'knn_k': 9, 'weighted_edges': True, 'symmetrize_mode': 'mutual', 'use_snp_selection': True, 'num_snps': 15344}. Best is trial 31 with value: 0.17643153876650486.
[I 2025-11-03 14:14:05,177] Trial 38 finished with value: 0.13074954493082466 and parameters: {'model_type': 'gcn', 'hidden_dims': '[512, 64]', 'dropout': 0.3390740006710154, 'batch_norm': True, 'lr': 0.0002207706731817684, 'weight_decay': 6.597277287654207e-05, 'epochs': 147, 'loss': 'mse', 'optimizer': 'adam', 'graph_mode': 'cutoff', 'cutoff': 0.2236606579884875, 'grm_norm': 'cosine_then_gcn', 'self_loops': True, 'use_snp_selection': False}. Best is trial 31 with value: 0.17643153876650486.
[I 2025-11-03 14:14:10,226] Trial 39 finished with value: 0.06074206544245681 and parameters: {'model_type': 'gcn', 'hidden_dims': '[512, 256]', 'dropout': 0.10540304217788027, 'batch_norm': False, 'lr': 0.0004533042215995461, 'weight_decay': 1.49934249413222e-07, 'epochs': 112, 'loss': 'mae', 'optimizer': 'adam', 'graph_mode': 'knn', 'source': 'grm', 'knn_k': 3, 'weighted_edges': True, 'symmetrize_mode': 'union', 'use_snp_selection': True, 'num_snps': 58379}. Best is trial 31 with value: 0.17643153876650486.
[I 2025-11-03 14:14:12,098] Trial 40 finished with value: 0.03574037606900212 and parameters: {'model_type': 'gcn', 'hidden_dims': '[128, 64]', 'dropout': 0.2988686264816237, 'batch_norm': True, 'lr': 2.9207371358404036e-05, 'weight_decay': 2.8194205744277863e-07, 'epochs': 165, 'loss': 'mae', 'optimizer': 'adam', 'graph_mode': 'cutoff', 'cutoff': 0.8775832147217085, 'grm_norm': 'cosine', 'self_loops': True, 'use_snp_selection': False}. Best is trial 31 with value: 0.17643153876650486.
[I 2025-11-03 14:14:16,437] Trial 41 finished with value: 0.148861383750602 and parameters: {'model_type': 'gcn', 'hidden_dims': '[512, 64]', 'dropout': 0.5349970331173369, 'batch_norm': True, 'lr': 0.00024055969844976948, 'weight_decay': 1.0001250254386132e-07, 'epochs': 246, 'loss': 'mae', 'optimizer': 'adam', 'graph_mode': 'knn', 'source': 'grm', 'knn_k': 1, 'weighted_edges': True, 'symmetrize_mode': 'union', 'use_snp_selection': False}. Best is trial 31 with value: 0.17643153876650486.
[I 2025-11-03 14:14:20,472] Trial 42 finished with value: 0.1491324367933139 and parameters: {'model_type': 'gcn', 'hidden_dims': '[512, 64]', 'dropout': 0.2671911276709862, 'batch_norm': True, 'lr': 0.0001399843547088193, 'weight_decay': 1.757099902061044e-07, 'epochs': 221, 'loss': 'mae', 'optimizer': 'adam', 'graph_mode': 'knn', 'source': 'grm', 'knn_k': 2, 'weighted_edges': True, 'symmetrize_mode': 'union', 'use_snp_selection': False}. Best is trial 31 with value: 0.17643153876650486.
[I 2025-11-03 14:14:25,211] Trial 43 finished with value: 0.15696278473095054 and parameters: {'model_type': 'gcn', 'hidden_dims': '[512, 64]', 'dropout': 0.19160040647764648, 'batch_norm': True, 'lr': 0.00037054909456031115, 'weight_decay': 5.600351073411146e-07, 'epochs': 278, 'loss': 'mae', 'optimizer': 'adam', 'graph_mode': 'knn', 'source': 'grm', 'knn_k': 1, 'weighted_edges': True, 'symmetrize_mode': 'union', 'use_snp_selection': False}. Best is trial 31 with value: 0.17643153876650486.
[I 2025-11-03 14:14:29,084] Trial 44 finished with value: 0.13772138885437557 and parameters: {'model_type': 'gcn', 'hidden_dims': '[512, 64]', 'dropout': 0.49404839574260306, 'batch_norm': True, 'lr': 0.00010296127397454019, 'weight_decay': 1.0751209233947367e-06, 'epochs': 205, 'loss': 'mae', 'optimizer': 'adam', 'graph_mode': 'knn', 'source': 'grm', 'knn_k': 6, 'weighted_edges': False, 'symmetrize_mode': 'union', 'use_snp_selection': False}. Best is trial 31 with value: 0.17643153876650486.
