[I 2025-11-03 13:31:49,839] Trial 9 finished with value: 0.14217024178933366 and parameters: {'model_type': 'gcn', 'hidden_dims': '[512, 64]', 'dropout': 0.14505336736221927, 'batch_norm': True, 'lr': 5.8619638388111826e-05, 'weight_decay': 6.200156172669308e-07, 'epochs': 175, 'loss': 'mse', 'optimizer': 'adam', 'graph_mode': 'off', 'use_snp_selection': False}. Best is trial 8 with value: 0.1765874713065526.
[I 2025-11-03 13:31:51,182] Trial 10 finished with value: 0.018582224734194682 and parameters: {'model_type': 'gcn', 'hidden_dims': '[512, 128]', 'dropout': 0.2800030442581858, 'batch_norm': False, 'lr': 0.0004919806695968257, 'weight_decay': 2.9953888095455486e-06, 'epochs': 55, 'loss': 'mae', 'optimizer': 'adam', 'graph_mode': 'off', 'use_snp_selection': False}. Best is trial 8 with value: 0.1765874713065526.
[I 2025-11-03 13:31:54,387] Trial 11 finished with value: 0.16016582784225492 and parameters: {'model_type': 'gcn', 'hidden_dims': '[512, 128]', 'dropout': 0.10095648685224448, 'batch_norm': True, 'lr': 0.0003411435764085616, 'weight_decay': 1.2045055692919657e-07, 'epochs': 216, 'loss': 'mse', 'optimizer': 'adam', 'graph_mode': 'off', 'use_snp_selection': False}. Best is trial 8 with value: 0.1765874713065526.
[I 2025-11-03 13:31:58,006] Trial 12 finished with value: 0.18004558573078439 and parameters: {'model_type': 'gcn', 'hidden_dims': '[512, 128]', 'dropout': 0.10344600881777158, 'batch_norm': True, 'lr': 0.0006674532614549997, 'weight_decay': 1.3081036432574914e-07, 'epochs': 255, 'loss': 'mae', 'optimizer': 'adam', 'graph_mode': 'off', 'use_snp_selection': False}. Best is trial 12 with value: 0.18004558573078439.
[I 2025-11-03 13:32:01,966] Trial 13 finished with value: 0.16123161285449844 and parameters: {'model_type': 'gcn', 'hidden_dims': '[512, 128]', 'dropout': 0.2429461314891602, 'batch_norm': True, 'lr': 0.00020263148232071683, 'weight_decay': 5.014770300041101e-06, 'epochs': 285, 'loss': 'mae', 'optimizer': 'adam', 'graph_mode': 'off', 'use_snp_selection': False}. Best is trial 12 with value: 0.18004558573078439.
[I 2025-11-03 13:32:05,867] Trial 14 finished with value: 0.15805723390178306 and parameters: {'model_type': 'gcn', 'hidden_dims': '[512, 128]', 'dropout': 0.3221595656802847, 'batch_norm': True, 'lr': 0.0009218940720367965, 'weight_decay': 5.724103314313124e-05, 'epochs': 271, 'loss': 'mae', 'optimizer': 'adam', 'graph_mode': 'off', 'use_snp_selection': False}. Best is trial 12 with value: 0.18004558573078439.
[I 2025-11-03 13:32:07,723] Trial 15 finished with value: 0.15587943984805375 and parameters: {'model_type': 'gcn', 'hidden_dims': '[128, 64]', 'dropout': 0.10515697852451877, 'batch_norm': True, 'lr': 0.0001637201916360417, 'weight_decay': 1.232049712459595e-07, 'epochs': 302, 'loss': 'mae', 'optimizer': 'adam', 'graph_mode': 'off', 'use_snp_selection': False}. Best is trial 12 with value: 0.18004558573078439.
[I 2025-11-03 13:32:11,083] Trial 16 finished with value: 0.11746236520823332 and parameters: {'model_type': 'gcn', 'hidden_dims': '[256, 128, 64]', 'dropout': 0.19236941781656602, 'batch_norm': True, 'lr': 1.2586985041154999e-05, 'weight_decay': 1.3401995465726466e-05, 'epochs': 350, 'loss': 'mae', 'optimizer': 'adam', 'graph_mode': 'off', 'use_snp_selection': False}. Best is trial 12 with value: 0.18004558573078439.
[I 2025-11-03 13:32:14,525] Trial 17 finished with value: 0.16728415338434385 and parameters: {'model_type': 'gcn', 'hidden_dims': '[512, 256]', 'dropout': 0.5434692890636532, 'batch_norm': True, 'lr': 0.000906375209920231, 'weight_decay': 7.521380152599298e-07, 'epochs': 239, 'loss': 'mae', 'optimizer': 'adam', 'graph_mode': 'off', 'use_snp_selection': False}. Best is trial 12 with value: 0.18004558573078439.
[I 2025-11-03 13:32:19,023] Trial 18 finished with value: 0.0795355468549826 and parameters: {'model_type': 'gcn', 'hidden_dims': '[512, 128]', 'dropout': 0.46470375425664523, 'batch_norm': False, 'lr': 0.00017553303054964982, 'weight_decay': 5.1284909832915915e-05, 'epochs': 252, 'loss': 'mae', 'optimizer': 'adam', 'graph_mode': 'off', 'use_snp_selection': True, 'num_snps': 58241}. Best is trial 12 with value: 0.18004558573078439.
[I 2025-11-03 13:32:23,310] Trial 19 finished with value: 0.0944968362528072 and parameters: {'model_type': 'gcn', 'hidden_dims': '[512, 128]', 'dropout': 0.31848849517917976, 'batch_norm': True, 'lr': 2.2599578696439803e-05, 'weight_decay': 4.683851500825195e-06, 'epochs': 312, 'loss': 'mae', 'optimizer': 'adam', 'graph_mode': 'off', 'use_snp_selection': False}. Best is trial 12 with value: 0.18004558573078439.
[I 2025-11-03 13:32:26,528] Trial 20 finished with value: 0.1558311308647037 and parameters: {'model_type': 'gcn', 'hidden_dims': '[512, 128]', 'dropout': 0.19812532526213855, 'batch_norm': True, 'lr': 0.00035168368573293434, 'weight_decay': 0.00012479819807205216, 'epochs': 222, 'loss': 'mae', 'optimizer': 'adam', 'graph_mode': 'off', 'use_snp_selection': False}. Best is trial 12 with value: 0.18004558573078439.
[I 2025-11-03 13:32:30,138] Trial 21 finished with value: 0.1560697370238078 and parameters: {'model_type': 'gcn', 'hidden_dims': '[512, 256]', 'dropout': 0.5162996618861398, 'batch_norm': True, 'lr': 0.0007176877839503087, 'weight_decay': 4.430291566051547e-07, 'epochs': 250, 'loss': 'mae', 'optimizer': 'adam', 'graph_mode': 'off', 'use_snp_selection': False}. Best is trial 12 with value: 0.18004558573078439.
[I 2025-11-03 13:32:34,197] Trial 22 finished with value: 0.14982072758536993 and parameters: {'model_type': 'gcn', 'hidden_dims': '[512, 256]', 'dropout': 0.570073388571711, 'batch_norm': True, 'lr': 0.0009057382771942691, 'weight_decay': 1.1573763221280737e-06, 'epochs': 290, 'loss': 'mae', 'optimizer': 'adam', 'graph_mode': 'off', 'use_snp_selection': False}. Best is trial 12 with value: 0.18004558573078439.
[I 2025-11-03 13:32:37,534] Trial 23 finished with value: 0.13797863079690556 and parameters: {'model_type': 'gcn', 'hidden_dims': '[512, 256]', 'dropout': 0.507527472488856, 'batch_norm': True, 'lr': 0.00011807398412846949, 'weight_decay': 2.2228375859915765e-07, 'epochs': 232, 'loss': 'mae', 'optimizer': 'adam', 'graph_mode': 'off', 'use_snp_selection': False}. Best is trial 12 with value: 0.18004558573078439.
[I 2025-11-03 13:32:40,246] Trial 24 finished with value: 0.17515731434187334 and parameters: {'model_type': 'gcn', 'hidden_dims': '[512, 256]', 'dropout': 0.1531704111145522, 'batch_norm': True, 'lr': 0.00041954039173243104, 'weight_decay': 1.3169436449445738e-06, 'epochs': 173, 'loss': 'mae', 'optimizer': 'adam', 'graph_mode': 'off', 'use_snp_selection': False}. Best is trial 12 with value: 0.18004558573078439.
[I 2025-11-03 13:32:42,143] Trial 25 finished with value: 0.16290735146196533 and parameters: {'model_type': 'gcn', 'hidden_dims': '[256, 128, 64]', 'dropout': 0.14480207989864707, 'batch_norm': True, 'lr': 0.00036106181086903796, 'weight_decay': 1.5642496545158997e-06, 'epochs': 172, 'loss': 'mae', 'optimizer': 'adam', 'graph_mode': 'off', 'use_snp_selection': False}. Best is trial 12 with value: 0.18004558573078439.
[I 2025-11-03 13:32:43,131] Trial 26 finished with value: 0.06899295231875852 and parameters: {'model_type': 'gcn', 'hidden_dims': '[256, 128]', 'dropout': 0.15707600889806317, 'batch_norm': False, 'lr': 0.0005489069526781346, 'weight_decay': 2.4757082441940512e-05, 'epochs': 124, 'loss': 'mae', 'optimizer': 'adam', 'graph_mode': 'off', 'use_snp_selection': True, 'num_snps': 3842}. Best is trial 12 with value: 0.18004558573078439.
[I 2025-11-03 13:32:44,547] Trial 27 finished with value: 0.1599297148655989 and parameters: {'model_type': 'gcn', 'hidden_dims': '[128, 64]', 'dropout': 0.10626963325270646, 'batch_norm': True, 'lr': 0.0002697755830431438, 'weight_decay': 2.346816827942184e-07, 'epochs': 199, 'loss': 'mae', 'optimizer': 'adam', 'graph_mode': 'off', 'use_snp_selection': False}. Best is trial 12 with value: 0.18004558573078439.
[I 2025-11-03 13:32:48,298] Trial 28 finished with value: 0.15580120035914502 and parameters: {'model_type': 'gcn', 'hidden_dims': '[512, 256]', 'dropout': 0.219196935871986, 'batch_norm': True, 'lr': 0.00011955193262015558, 'weight_decay': 3.837562706531341e-06, 'epochs': 265, 'loss': 'mae', 'optimizer': 'adam', 'graph_mode': 'off', 'use_snp_selection': False}. Best is trial 12 with value: 0.18004558573078439.
[I 2025-11-03 13:32:50,161] Trial 29 finished with value: 0.09311924851916116 and parameters: {'model_type': 'gcn', 'hidden_dims': '[128, 64]', 'dropout': 0.17149148098179187, 'batch_norm': True, 'lr': 2.901200083872717e-05, 'weight_decay': 7.655937171768707e-06, 'epochs': 322, 'loss': 'mae', 'optimizer': 'adam', 'graph_mode': 'off', 'use_snp_selection': True, 'num_snps': 19468}. Best is trial 12 with value: 0.18004558573078439.
[I 2025-11-03 13:32:52,129] Trial 30 finished with value: 0.16138355245628275 and parameters: {'model_type': 'gcn', 'hidden_dims': '[512, 128]', 'dropout': 0.12238068156363889, 'batch_norm': True, 'lr': 9.211997506615095e-05, 'weight_decay': 1.9618211806268537e-06, 'epochs': 108, 'loss': 'mae', 'optimizer': 'adam', 'graph_mode': 'off', 'use_snp_selection': False}. Best is trial 12 with value: 0.18004558573078439.
[I 2025-11-03 13:32:54,904] Trial 31 finished with value: 0.17640164627005506 and parameters: {'model_type': 'gcn', 'hidden_dims': '[512, 256]', 'dropout': 0.2320287559747517, 'batch_norm': True, 'lr': 0.0005086555576817915, 'weight_decay': 6.621651467636224e-07, 'epochs': 177, 'loss': 'mae', 'optimizer': 'adam', 'graph_mode': 'off', 'use_snp_selection': False}. Best is trial 12 with value: 0.18004558573078439.
[I 2025-11-03 13:32:57,627] Trial 32 finished with value: 0.16198477951631737 and parameters: {'model_type': 'gcn', 'hidden_dims': '[512, 256]', 'dropout': 0.22502520725082184, 'batch_norm': True, 'lr': 0.0004888579687161814, 'weight_decay': 2.551974274028588e-07, 'epochs': 175, 'loss': 'mae', 'optimizer': 'adam', 'graph_mode': 'off', 'use_snp_selection': False}. Best is trial 12 with value: 0.18004558573078439.
[I 2025-11-03 13:33:00,118] Trial 33 finished with value: 0.17247842846607353 and parameters: {'model_type': 'gcn', 'hidden_dims': '[512, 256]', 'dropout': 0.17552053982314111, 'batch_norm': True, 'lr': 0.00025387802141863463, 'weight_decay': 8.720615206651679e-07, 'epochs': 154, 'loss': 'mae', 'optimizer': 'adam', 'graph_mode': 'off', 'use_snp_selection': False}. Best is trial 12 with value: 0.18004558573078439.
[I 2025-11-03 13:33:03,271] Trial 34 finished with value: 0.16617813288358188 and parameters: {'model_type': 'gcn', 'hidden_dims': '[512, 256]', 'dropout': 0.13127711275490922, 'batch_norm': True, 'lr': 0.0005325904940890814, 'weight_decay': 9.740716931435373e-06, 'epochs': 211, 'loss': 'mae', 'optimizer': 'adam', 'graph_mode': 'off', 'use_snp_selection': False}. Best is trial 12 with value: 0.18004558573078439.
[I 2025-11-03 13:33:04,836] Trial 35 finished with value: 0.13119579617862223 and parameters: {'model_type': 'gcn', 'hidden_dims': '[256, 128]', 'dropout': 0.2826207372395131, 'batch_norm': False, 'lr': 0.0002590481372474694, 'weight_decay': 1.777090815322593e-05, 'epochs': 136, 'loss': 'mae', 'optimizer': 'adam', 'graph_mode': 'off', 'use_snp_selection': False}. Best is trial 12 with value: 0.18004558573078439.
[I 2025-11-03 13:33:10,240] Trial 36 finished with value: 0.16376863301960565 and parameters: {'model_type': 'gcn', 'hidden_dims': '[512, 64]', 'dropout': 0.1882189102153798, 'batch_norm': True, 'lr': 0.0006147860773597516, 'weight_decay': 4.322821625346065e-07, 'epochs': 340, 'loss': 'mse', 'optimizer': 'adam', 'graph_mode': 'off', 'use_snp_selection': True, 'num_snps': 58661}. Best is trial 12 with value: 0.18004558573078439.
[I 2025-11-03 13:33:12,264] Trial 37 finished with value: 0.06914438533364202 and parameters: {'model_type': 'gcn', 'hidden_dims': '[256, 128, 64]', 'dropout': 0.22700031966568696, 'batch_norm': True, 'lr': 2.8148739480114657e-06, 'weight_decay': 2.6413523896522914e-06, 'epochs': 186, 'loss': 'mae', 'optimizer': 'adam', 'graph_mode': 'off', 'use_snp_selection': False}. Best is trial 12 with value: 0.18004558573078439.
[I 2025-11-03 13:33:14,089] Trial 38 finished with value: 0.07822821545482693 and parameters: {'model_type': 'gcn', 'hidden_dims': '[512, 128]', 'dropout': 0.12066465182248384, 'batch_norm': False, 'lr': 1.1665792017271946e-05, 'weight_decay': 1.0761329285806799e-07, 'epochs': 159, 'loss': 'mse', 'optimizer': 'adam', 'graph_mode': 'off', 'use_snp_selection': True, 'num_snps': 19911}. Best is trial 12 with value: 0.18004558573078439.
[I 2025-11-03 13:33:17,031] Trial 39 finished with value: 0.16777629189698562 and parameters: {'model_type': 'gcn', 'hidden_dims': '[512, 256]', 'dropout': 0.15911280457868648, 'batch_norm': True, 'lr': 0.0003818374163420357, 'weight_decay': 3.845501833996926e-05, 'epochs': 194, 'loss': 'mae', 'optimizer': 'adam', 'graph_mode': 'off', 'use_snp_selection': False}. Best is trial 12 with value: 0.18004558573078439.
[I 2025-11-03 13:33:18,368] Trial 40 finished with value: 0.12718805263119284 and parameters: {'model_type': 'gcn', 'hidden_dims': '[512, 64]', 'dropout': 0.2678613174050407, 'batch_norm': True, 'lr': 0.00010299837783030175, 'weight_decay': 2.1039416253898663e-07, 'epochs': 56, 'loss': 'mse', 'optimizer': 'adam', 'graph_mode': 'off', 'use_snp_selection': False}. Best is trial 12 with value: 0.18004558573078439.
[I 2025-11-03 13:33:20,912] Trial 41 finished with value: 0.16225035407231433 and parameters: {'model_type': 'gcn', 'hidden_dims': '[512, 256]', 'dropout': 0.18129599469457772, 'batch_norm': True, 'lr': 0.00023172768449382405, 'weight_decay': 9.97217197749143e-07, 'epochs': 162, 'loss': 'mae', 'optimizer': 'adam', 'graph_mode': 'off', 'use_snp_selection': False}. Best is trial 12 with value: 0.18004558573078439.
[I 2025-11-03 13:33:23,142] Trial 42 finished with value: 0.14851497832873328 and parameters: {'model_type': 'gcn', 'hidden_dims': '[512, 256]', 'dropout': 0.1394264403895248, 'batch_norm': True, 'lr': 0.0001529596109831101, 'weight_decay': 7.791239533581231e-07, 'epochs': 132, 'loss': 'mae', 'optimizer': 'adam', 'graph_mode': 'off', 'use_snp_selection': False}. Best is trial 12 with value: 0.18004558573078439.
[I 2025-11-03 13:33:25,587] Trial 43 finished with value: 0.1794950993445491 and parameters: {'model_type': 'gcn', 'hidden_dims': '[512, 256]', 'dropout': 0.21116654487922398, 'batch_norm': True, 'lr': 0.0003003766172490841, 'weight_decay': 5.436695111092751e-07, 'epochs': 149, 'loss': 'mae', 'optimizer': 'adam', 'graph_mode': 'off', 'use_snp_selection': False}. Best is trial 12 with value: 0.18004558573078439.
[I 2025-11-03 13:33:27,203] Trial 44 finished with value: 0.16979331597741606 and parameters: {'model_type': 'gcn', 'hidden_dims': '[512, 256]', 'dropout': 0.21102045728508564, 'batch_norm': True, 'lr': 0.0007152863501682374, 'weight_decay': 3.4858283820072117e-07, 'epochs': 78, 'loss': 'mae', 'optimizer': 'adam', 'graph_mode': 'off', 'use_snp_selection': False}. Best is trial 12 with value: 0.18004558573078439.
[I 2025-11-03 13:33:29,175] Trial 45 finished with value: 0.16126149025882575 and parameters: {'model_type': 'gcn', 'hidden_dims': '[512, 128]', 'dropout': 0.24487437974169957, 'batch_norm': True, 'lr': 0.00040559413392303543, 'weight_decay': 1.6045516302737872e-07, 'epochs': 110, 'loss': 'mae', 'optimizer': 'adam', 'graph_mode': 'off', 'use_snp_selection': False}. Best is trial 12 with value: 0.18004558573078439.
[I 2025-11-03 13:33:30,965] Trial 46 finished with value: 0.059983301074741466 and parameters: {'model_type': 'gcn', 'hidden_dims': '[256, 128]', 'dropout': 0.3211087048286993, 'batch_norm': False, 'lr': 0.0009886247524054145, 'weight_decay': 6.230356920227046e-06, 'epochs': 184, 'loss': 'mae', 'optimizer': 'adam', 'graph_mode': 'off', 'use_snp_selection': False}. Best is trial 12 with value: 0.18004558573078439.
[I 2025-11-03 13:33:33,323] Trial 47 finished with value: 0.12544901073064224 and parameters: {'model_type': 'gcn', 'hidden_dims': '[512, 128]', 'dropout': 0.10036690793987725, 'batch_norm': True, 'lr': 4.0613451860567e-05, 'weight_decay': 5.190156433958664e-07, 'epochs': 143, 'loss': 'mse', 'optimizer': 'adam', 'graph_mode': 'off', 'use_snp_selection': False}. Best is trial 12 with value: 0.18004558573078439.
[I 2025-11-03 13:33:36,420] Trial 48 finished with value: 0.12124872433878964 and parameters: {'model_type': 'gcn', 'hidden_dims': '[512, 256]', 'dropout': 0.16271170628926843, 'batch_norm': True, 'lr': 7.942715516950661e-05, 'weight_decay': 1.3592601985505525e-06, 'epochs': 207, 'loss': 'mae', 'optimizer': 'adam', 'graph_mode': 'off', 'use_snp_selection': False}. Best is trial 12 with value: 0.18004558573078439.
[I 2025-11-03 13:33:38,737] Trial 49 finished with value: 0.1327049326410728 and parameters: {'model_type': 'gcn', 'hidden_dims': '[128, 64]', 'dropout': 0.36167318450128966, 'batch_norm': True, 'lr': 0.00030256543490836635, 'weight_decay': 3.2498667772136975e-07, 'epochs': 223, 'loss': 'mae', 'optimizer': 'adam', 'graph_mode': 'off', 'use_snp_selection': True, 'num_snps': 46888}. Best is trial 12 with value: 0.18004558573078439.
[I 2025-11-03 13:33:43,180] Trial 50 finished with value: 0.15792926925381665 and parameters: {'model_type': 'gcn', 'hidden_dims': '[512, 128]', 'dropout': 0.2926438063823539, 'batch_norm': True, 'lr': 0.00015071821537880067, 'weight_decay': 2.1450655925168465e-06, 'epochs': 326, 'loss': 'mae', 'optimizer': 'adam', 'graph_mode': 'off', 'use_snp_selection': False}. Best is trial 12 with value: 0.18004558573078439.
[I 2025-11-03 13:33:45,655] Trial 51 finished with value: 0.16548251367057976 and parameters: {'model_type': 'gcn', 'hidden_dims': '[512, 256]', 'dropout': 0.17808971499853032, 'batch_norm': True, 'lr': 0.00019038901476546723, 'weight_decay': 8.210261186621991e-07, 'epochs': 153, 'loss': 'mae', 'optimizer': 'adam', 'graph_mode': 'off', 'use_snp_selection': False}. Best is trial 12 with value: 0.18004558573078439.
[I 2025-11-03 13:33:48,302] Trial 52 finished with value: 0.042955306813572215 and parameters: {'model_type': 'gcn', 'hidden_dims': '[512, 256]', 'dropout': 0.13787779616727308, 'batch_norm': True, 'lr': 1.0921708743861942e-06, 'weight_decay': 1.451989270172464e-07, 'epochs': 168, 'loss': 'mae', 'optimizer': 'adam', 'graph_mode': 'off', 'use_snp_selection': False}. Best is trial 12 with value: 0.18004558573078439.
[I 2025-11-03 13:33:50,369] Trial 53 finished with value: 0.15953834833516375 and parameters: {'model_type': 'gcn', 'hidden_dims': '[512, 256]', 'dropout': 0.20738318824932278, 'batch_norm': True, 'lr': 0.00044467847388197625, 'weight_decay': 5.597256380123431e-07, 'epochs': 121, 'loss': 'mae', 'optimizer': 'adam', 'graph_mode': 'off', 'use_snp_selection': False}. Best is trial 12 with value: 0.18004558573078439.
[I 2025-11-03 13:33:52,779] Trial 54 finished with value: 0.16127457554558014 and parameters: {'model_type': 'gcn', 'hidden_dims': '[512, 256]', 'dropout': 0.2435910028369231, 'batch_norm': True, 'lr': 0.0007152197426150983, 'weight_decay': 0.0004926813436281597, 'epochs': 147, 'loss': 'mae', 'optimizer': 'adam', 'graph_mode': 'off', 'use_snp_selection': False}. Best is trial 12 with value: 0.18004558573078439.
[I 2025-11-03 13:33:55,670] Trial 55 finished with value: 0.15621640440810122 and parameters: {'model_type': 'gcn', 'hidden_dims': '[256, 128, 64]', 'dropout': 0.12016822219286213, 'batch_norm': True, 'lr': 0.00022093082518087593, 'weight_decay': 1.0003301757760351e-06, 'epochs': 296, 'loss': 'mae', 'optimizer': 'adam', 'graph_mode': 'off', 'use_snp_selection': False}. Best is trial 12 with value: 0.18004558573078439.
[I 2025-11-03 13:33:59,365] Trial 56 finished with value: 0.1654663272590746 and parameters: {'model_type': 'gcn', 'hidden_dims': '[512, 64]', 'dropout': 0.19785130093751718, 'batch_norm': True, 'lr': 0.0003022166538721441, 'weight_decay': 5.975438356258403e-07, 'epochs': 260, 'loss': 'mae', 'optimizer': 'adam', 'graph_mode': 'off', 'use_snp_selection': False}. Best is trial 12 with value: 0.18004558573078439.
[I 2025-11-03 13:34:03,173] Trial 57 finished with value: 0.149217043490548 and parameters: {'model_type': 'gcn', 'hidden_dims': '[512, 128]', 'dropout': 0.15182241286980905, 'batch_norm': False, 'lr': 0.0006717561997077316, 'weight_decay': 3.697332290176384e-06, 'epochs': 277, 'loss': 'mae', 'optimizer': 'adam', 'graph_mode': 'off', 'use_snp_selection': False}. Best is trial 12 with value: 0.18004558573078439.
[I 2025-11-03 13:34:06,082] Trial 58 finished with value: 0.15202618111772623 and parameters: {'model_type': 'gcn', 'hidden_dims': '[512, 256]', 'dropout': 0.40228275019692983, 'batch_norm': True, 'lr': 0.00045443327250999056, 'weight_decay': 0.00012493496388280289, 'epochs': 183, 'loss': 'mse', 'optimizer': 'adam', 'graph_mode': 'off', 'use_snp_selection': False}. Best is trial 12 with value: 0.18004558573078439.
[I 2025-11-03 13:34:10,320] Trial 59 finished with value: 0.15363687752826582 and parameters: {'model_type': 'gcn', 'hidden_dims': '[512, 256]', 'dropout': 0.17357825362023763, 'batch_norm': True, 'lr': 0.0003086156986018153, 'weight_decay': 1.560056633905117e-05, 'epochs': 310, 'loss': 'mae', 'optimizer': 'adam', 'graph_mode': 'off', 'use_snp_selection': False}. Best is trial 12 with value: 0.18004558573078439.
[I 2025-11-03 13:34:12,523] Trial 60 finished with value: 0.15360564616295813 and parameters: {'model_type': 'gcn', 'hidden_dims': '[512, 128]', 'dropout': 0.1151532287420955, 'batch_norm': True, 'lr': 0.00013842492117855867, 'weight_decay': 3.2627458825632254e-07, 'epochs': 196, 'loss': 'mae', 'optimizer': 'adam', 'graph_mode': 'off', 'use_snp_selection': True, 'num_snps': 24139}. Best is trial 12 with value: 0.18004558573078439.
