[I 2025-11-03 12:47:54,379] Trial 18 finished with value: 0.12844001782559744 and parameters: {'model_type': 'graphsage', 'hidden_dims': '[128, 64]', 'dropout': 0.260826986789204, 'batch_norm': True, 'lr': 0.0002872602330967449, 'weight_decay': 3.019156654015594e-07, 'epochs': 82, 'loss': 'mae', 'optimizer': 'adam', 'graph_mode': 'knn', 'source': 'grm', 'knn_k': 4, 'weighted_edges': True, 'symmetrize_mode': 'mutual', 'use_snp_selection': True, 'num_snps': 43118}. Best is trial 18 with value: 0.12844001782559744.
[I 2025-11-03 12:47:57,280] Trial 19 finished with value: 0.10739652560709956 and parameters: {'model_type': 'graphsage', 'hidden_dims': '[128, 64]', 'dropout': 0.16570688101669787, 'batch_norm': False, 'lr': 1.0339930351440496e-05, 'weight_decay': 2.2024308691724977e-07, 'epochs': 78, 'loss': 'mae', 'optimizer': 'adam', 'graph_mode': 'cutoff', 'cutoff': 0.6947432934611805, 'grm_norm': 'cosine_then_gcn', 'self_loops': False, 'use_snp_selection': True, 'num_snps': 43978}. Best is trial 18 with value: 0.12844001782559744.
[I 2025-11-03 12:48:00,277] Trial 20 finished with value: 0.07654060901523882 and parameters: {'model_type': 'graphsage', 'hidden_dims': '[128, 64]', 'dropout': 0.2692240082131382, 'batch_norm': False, 'lr': 3.0285052641203154e-06, 'weight_decay': 1.0524263272203653e-07, 'epochs': 57, 'loss': 'mae', 'optimizer': 'adam', 'graph_mode': 'cutoff', 'cutoff': 0.8791400569230253, 'grm_norm': 'none', 'self_loops': True, 'use_snp_selection': True, 'num_snps': 49001}. Best is trial 18 with value: 0.12844001782559744.
[I 2025-11-03 12:48:03,040] Trial 21 finished with value: 0.10390878825659403 and parameters: {'model_type': 'graphsage', 'hidden_dims': '[128, 64]', 'dropout': 0.3512290260963689, 'batch_norm': True, 'lr': 0.0002805443463745102, 'weight_decay': 4.233724638884995e-06, 'epochs': 100, 'loss': 'mae', 'optimizer': 'adam', 'graph_mode': 'knn', 'source': 'grm', 'knn_k': 3, 'weighted_edges': True, 'symmetrize_mode': 'mutual', 'use_snp_selection': True, 'num_snps': 35535}. Best is trial 18 with value: 0.12844001782559744.
[I 2025-11-03 12:48:05,849] Trial 22 finished with value: 0.06729515779947697 and parameters: {'model_type': 'graphsage', 'hidden_dims': '[512, 256]', 'dropout': 0.26384546608190157, 'batch_norm': True, 'lr': 6.048238866619405e-05, 'weight_decay': 2.681260412364732e-05, 'epochs': 87, 'loss': 'mae', 'optimizer': 'adam', 'graph_mode': 'knn', 'source': 'grm', 'knn_k': 4, 'weighted_edges': True, 'symmetrize_mode': 'mutual', 'use_snp_selection': True, 'num_snps': 23495}. Best is trial 18 with value: 0.12844001782559744.
[I 2025-11-03 12:48:07,298] Trial 23 finished with value: 0.08502574180391939 and parameters: {'model_type': 'graphsage', 'hidden_dims': '[128, 64]', 'dropout': 0.16757864816894258, 'batch_norm': True, 'lr': 0.0002654925036737052, 'weight_decay': 6.402988542701696e-07, 'epochs': 42, 'loss': 'mae', 'optimizer': 'adam', 'graph_mode': 'knn', 'source': 'grm', 'knn_k': 2, 'weighted_edges': True, 'symmetrize_mode': 'mutual', 'use_snp_selection': False}. Best is trial 18 with value: 0.12844001782559744.
[I 2025-11-03 12:48:10,579] Trial 24 finished with value: 0.12519028217653327 and parameters: {'model_type': 'graphsage', 'hidden_dims': '[256, 128]', 'dropout': 0.3579398799368945, 'batch_norm': True, 'lr': 0.0004486365315483002, 'weight_decay': 2.1337712952905285e-06, 'epochs': 146, 'loss': 'mae', 'optimizer': 'adam', 'graph_mode': 'knn', 'source': 'grm', 'knn_k': 5, 'weighted_edges': True, 'symmetrize_mode': 'mutual', 'use_snp_selection': True, 'num_snps': 36683}. Best is trial 18 with value: 0.12844001782559744.
[I 2025-11-03 12:48:14,091] Trial 25 finished with value: 0.10659848184317694 and parameters: {'model_type': 'graphsage', 'hidden_dims': '[256, 128]', 'dropout': 0.267133067366247, 'batch_norm': True, 'lr': 0.0009944490231724027, 'weight_decay': 1.8257725595523456e-06, 'epochs': 153, 'loss': 'mae', 'optimizer': 'adam', 'graph_mode': 'knn', 'source': 'grm', 'knn_k': 5, 'weighted_edges': False, 'symmetrize_mode': 'union', 'use_snp_selection': True, 'num_snps': 36356}. Best is trial 18 with value: 0.12844001782559744.
[I 2025-11-03 12:48:17,380] Trial 26 finished with value: 0.11158283174896279 and parameters: {'model_type': 'graphsage', 'hidden_dims': '[256, 128]', 'dropout': 0.10957049162012841, 'batch_norm': True, 'lr': 0.00044382378134590734, 'weight_decay': 4.3610598431073017e-07, 'epochs': 133, 'loss': 'mse', 'optimizer': 'adam', 'graph_mode': 'knn', 'source': 'grm', 'knn_k': 6, 'weighted_edges': True, 'symmetrize_mode': 'mutual', 'use_snp_selection': True, 'num_snps': 36963}. Best is trial 18 with value: 0.12844001782559744.
[I 2025-11-03 12:48:21,135] Trial 27 finished with value: 0.10852286639118681 and parameters: {'model_type': 'graphsage', 'hidden_dims': '[256, 128]', 'dropout': 0.18520757443270897, 'batch_norm': True, 'lr': 0.00015032762363955163, 'weight_decay': 1.797829460704943e-06, 'epochs': 85, 'loss': 'mae', 'optimizer': 'adam', 'graph_mode': 'knn', 'source': 'grm', 'knn_k': 8, 'weighted_edges': True, 'symmetrize_mode': 'mutual', 'use_snp_selection': True, 'num_snps': 49799}. Best is trial 18 with value: 0.12844001782559744.
[I 2025-11-03 12:48:23,253] Trial 28 finished with value: 0.08748021555818365 and parameters: {'model_type': 'graphsage', 'hidden_dims': '[256, 128, 64]', 'dropout': 0.22487044772394038, 'batch_norm': False, 'lr': 0.0005435131674045486, 'weight_decay': 5.031253182890263e-06, 'epochs': 59, 'loss': 'mae', 'optimizer': 'adam', 'graph_mode': 'cutoff', 'cutoff': 0.4270537486623217, 'grm_norm': 'none', 'self_loops': False, 'use_snp_selection': True, 'num_snps': 19271}. Best is trial 18 with value: 0.12844001782559744.
[I 2025-11-03 12:48:26,317] Trial 29 finished with value: 0.009146727779851581 and parameters: {'model_type': 'graphsage', 'hidden_dims': '[128, 64]', 'dropout': 0.15128987274546815, 'batch_norm': True, 'lr': 1.0661807028389818e-06, 'weight_decay': 4.0950571919008457e-07, 'epochs': 138, 'loss': 'mae', 'optimizer': 'adam', 'graph_mode': 'knn', 'source': 'grm', 'knn_k': 5, 'weighted_edges': True, 'symmetrize_mode': 'mutual', 'use_snp_selection': True, 'num_snps': 39923}. Best is trial 18 with value: 0.12844001782559744.
[I 2025-11-03 12:48:27,984] Trial 30 finished with value: 0.08976581211569569 and parameters: {'model_type': 'graphsage', 'hidden_dims': '[512, 64]', 'dropout': 0.20232601509126283, 'batch_norm': True, 'lr': 5.284043737688885e-05, 'weight_decay': 1.167503568660755e-07, 'epochs': 98, 'loss': 'mae', 'optimizer': 'adam', 'graph_mode': 'knn', 'source': 'grm', 'knn_k': 4, 'weighted_edges': False, 'symmetrize_mode': 'union', 'use_snp_selection': True, 'num_snps': 2512}. Best is trial 18 with value: 0.12844001782559744.
[I 2025-11-03 12:48:34,307] Trial 31 finished with value: 0.10912195036694078 and parameters: {'model_type': 'graphsage', 'hidden_dims': '[512, 128]', 'dropout': 0.3669508459741252, 'batch_norm': True, 'lr': 0.00021549388426397956, 'weight_decay': 3.3854062289685316e-05, 'epochs': 343, 'loss': 'mae', 'optimizer': 'adam', 'graph_mode': 'knn', 'source': 'grm', 'knn_k': 2, 'weighted_edges': True, 'symmetrize_mode': 'mutual', 'use_snp_selection': False}. Best is trial 18 with value: 0.12844001782559744.
[I 2025-11-03 12:48:36,283] Trial 32 finished with value: 0.11587989275143704 and parameters: {'model_type': 'graphsage', 'hidden_dims': '[128, 64]', 'dropout': 0.4285227871398442, 'batch_norm': True, 'lr': 0.00035020987575212797, 'weight_decay': 1.32468623391763e-05, 'epochs': 171, 'loss': 'mae', 'optimizer': 'adam', 'graph_mode': 'knn', 'source': 'grm', 'knn_k': 3, 'weighted_edges': True, 'symmetrize_mode': 'mutual', 'use_snp_selection': False}. Best is trial 18 with value: 0.12844001782559744.
[I 2025-11-03 12:48:40,756] Trial 33 finished with value: 0.12254968458678328 and parameters: {'model_type': 'graphsage', 'hidden_dims': '[256, 128]', 'dropout': 0.3616748754051666, 'batch_norm': True, 'lr': 0.0006621951090899116, 'weight_decay': 2.589205338350052e-06, 'epochs': 218, 'loss': 'mae', 'optimizer': 'adam', 'graph_mode': 'knn', 'source': 'grm', 'knn_k': 7, 'weighted_edges': True, 'symmetrize_mode': 'mutual', 'use_snp_selection': True, 'num_snps': 47771}. Best is trial 18 with value: 0.12844001782559744.
[I 2025-11-03 12:48:45,752] Trial 34 finished with value: 0.11903093817211574 and parameters: {'model_type': 'graphsage', 'hidden_dims': '[256, 128]', 'dropout': 0.3895091826103456, 'batch_norm': True, 'lr': 0.0005925350330093194, 'weight_decay': 2.6701265700418054e-06, 'epochs': 296, 'loss': 'mse', 'optimizer': 'adam', 'graph_mode': 'knn', 'source': 'grm', 'knn_k': 7, 'weighted_edges': True, 'symmetrize_mode': 'mutual', 'use_snp_selection': True, 'num_snps': 47883}. Best is trial 18 with value: 0.12844001782559744.
[I 2025-11-03 12:48:50,772] Trial 35 finished with value: 0.11577926080795106 and parameters: {'model_type': 'graphsage', 'hidden_dims': '[256, 128]', 'dropout': 0.45853468653671337, 'batch_norm': True, 'lr': 0.0008080241609627325, 'weight_decay': 6.63429550794443e-06, 'epochs': 199, 'loss': 'mae', 'optimizer': 'adam', 'graph_mode': 'knn', 'source': 'grm', 'knn_k': 10, 'weighted_edges': True, 'symmetrize_mode': 'mutual', 'use_snp_selection': True, 'num_snps': 55129}. Best is trial 18 with value: 0.12844001782559744.
[I 2025-11-03 12:48:54,214] Trial 36 finished with value: 0.0267447880455801 and parameters: {'model_type': 'graphsage', 'hidden_dims': '[256, 128]', 'dropout': 0.28863212412089667, 'batch_norm': False, 'lr': 0.000509879943930318, 'weight_decay': 1.095459559229954e-06, 'epochs': 71, 'loss': 'mse', 'optimizer': 'adam', 'graph_mode': 'knn', 'source': 'grm', 'knn_k': 7, 'weighted_edges': True, 'symmetrize_mode': 'mutual', 'use_snp_selection': True, 'num_snps': 46429}. Best is trial 18 with value: 0.12844001782559744.
[I 2025-11-03 12:48:57,407] Trial 37 finished with value: 0.09809806271083267 and parameters: {'model_type': 'graphsage', 'hidden_dims': '[256, 128]', 'dropout': 0.3746235681696816, 'batch_norm': True, 'lr': 0.00010878386987390078, 'weight_decay': 3.8088171022828995e-07, 'epochs': 175, 'loss': 'mae', 'optimizer': 'adam', 'graph_mode': 'knn', 'source': 'grm', 'knn_k': 5, 'weighted_edges': True, 'symmetrize_mode': 'mutual', 'use_snp_selection': True, 'num_snps': 31192}. Best is trial 18 with value: 0.12844001782559744.
[I 2025-11-03 12:49:01,398] Trial 38 finished with value: 0.12609431022918885 and parameters: {'model_type': 'graphsage', 'hidden_dims': '[256, 128]', 'dropout': 0.3363614997170074, 'batch_norm': False, 'lr': 2.7366772837750903e-05, 'weight_decay': 1.4879688784097208e-06, 'epochs': 119, 'loss': 'mse', 'optimizer': 'adam', 'graph_mode': 'cutoff', 'cutoff': 0.6194139971559796, 'grm_norm': 'cosine_then_gcn', 'self_loops': False, 'use_snp_selection': True, 'num_snps': 53021}. Best is trial 18 with value: 0.12844001782559744.
[I 2025-11-03 12:49:05,702] Trial 39 finished with value: 0.0624603215623747 and parameters: {'model_type': 'graphsage', 'hidden_dims': '[256, 128, 64]', 'dropout': 0.3344857740453415, 'batch_norm': False, 'lr': 2.043950423899666e-05, 'weight_decay': 1.591428749231025e-06, 'epochs': 113, 'loss': 'mse', 'optimizer': 'adam', 'graph_mode': 'cutoff', 'cutoff': 0.6263127618954708, 'grm_norm': 'cosine_then_gcn', 'self_loops': False, 'use_snp_selection': True, 'num_snps': 54212}. Best is trial 18 with value: 0.12844001782559744.
[I 2025-11-03 12:49:09,490] Trial 40 finished with value: 0.08501859234970886 and parameters: {'model_type': 'graphsage', 'hidden_dims': '[128, 64]', 'dropout': 0.41138610892051397, 'batch_norm': False, 'lr': 3.333690836219556e-05, 'weight_decay': 1.8396888422821521e-07, 'epochs': 133, 'loss': 'mse', 'optimizer': 'adam', 'graph_mode': 'cutoff', 'cutoff': 0.47580435781412866, 'grm_norm': 'cosine_then_gcn', 'self_loops': False, 'use_snp_selection': True, 'num_snps': 58813}. Best is trial 18 with value: 0.12844001782559744.
[I 2025-11-03 12:49:12,935] Trial 41 finished with value: 0.07043461085760322 and parameters: {'model_type': 'graphsage', 'hidden_dims': '[256, 128]', 'dropout': 0.4530807805502882, 'batch_norm': False, 'lr': 0.000384855779014982, 'weight_decay': 2.6850273281220415e-06, 'epochs': 53, 'loss': 'mse', 'optimizer': 'adam', 'graph_mode': 'cutoff', 'cutoff': 0.6488586896204173, 'grm_norm': 'cosine_then_gcn', 'self_loops': False, 'use_snp_selection': True, 'num_snps': 51490}. Best is trial 18 with value: 0.12844001782559744.
[I 2025-11-03 12:49:16,280] Trial 42 finished with value: 0.07573837216792476 and parameters: {'model_type': 'graphsage', 'hidden_dims': '[256, 128]', 'dropout': 0.3457916855646327, 'batch_norm': False, 'lr': 0.0006610416534887969, 'weight_decay': 7.472381675908379e-06, 'epochs': 162, 'loss': 'mse', 'optimizer': 'adam', 'graph_mode': 'cutoff', 'cutoff': 0.8195256423876455, 'grm_norm': 'gcn', 'self_loops': False, 'use_snp_selection': True, 'num_snps': 39502}. Best is trial 18 with value: 0.12844001782559744.
[I 2025-11-03 12:49:19,651] Trial 43 finished with value: 0.08360773374970207 and parameters: {'model_type': 'graphsage', 'hidden_dims': '[256, 128]', 'dropout': 0.28965357037605144, 'batch_norm': False, 'lr': 0.00017307263743930452, 'weight_decay': 1.215676311701931e-06, 'epochs': 94, 'loss': 'mse', 'optimizer': 'adam', 'graph_mode': 'cutoff', 'cutoff': 0.5178007311249213, 'grm_norm': 'cosine', 'self_loops': False, 'use_snp_selection': True, 'num_snps': 44781}. Best is trial 18 with value: 0.12844001782559744.
[I 2025-11-03 12:49:22,724] Trial 44 finished with value: 0.09226557570624082 and parameters: {'model_type': 'graphsage', 'hidden_dims': '[256, 128]', 'dropout': 0.3758884164756795, 'batch_norm': True, 'lr': 4.52468778473252e-05, 'weight_decay': 5.810986504194032e-07, 'epochs': 189, 'loss': 'mse', 'optimizer': 'adam', 'graph_mode': 'cutoff', 'cutoff': 0.7765293706533852, 'grm_norm': 'none', 'self_loops': True, 'use_snp_selection': True, 'num_snps': 32617}. Best is trial 18 with value: 0.12844001782559744.
[I 2025-11-03 12:49:26,558] Trial 45 finished with value: 0.06932539449079046 and parameters: {'model_type': 'graphsage', 'hidden_dims': '[256, 128]', 'dropout': 0.25355267492640887, 'batch_norm': False, 'lr': 2.435049157330609e-05, 'weight_decay': 4.695137116175952e-05, 'epochs': 75, 'loss': 'mae', 'optimizer': 'adam', 'graph_mode': 'knn', 'source': 'grm', 'knn_k': 9, 'weighted_edges': False, 'symmetrize_mode': 'union', 'use_snp_selection': True, 'num_snps': 41942}. Best is trial 18 with value: 0.12844001782559744.
[I 2025-11-03 12:49:32,014] Trial 46 finished with value: 0.12073766756442536 and parameters: {'model_type': 'graphsage', 'hidden_dims': '[512, 64]', 'dropout': 0.3175091496149953, 'batch_norm': True, 'lr': 5.806640839110018e-06, 'weight_decay': 3.0891061438143296e-06, 'epochs': 236, 'loss': 'mae', 'optimizer': 'adam', 'graph_mode': 'cutoff', 'cutoff': 0.6277480705455729, 'grm_norm': 'cosine_then_gcn', 'self_loops': False, 'use_snp_selection': True, 'num_snps': 46554}. Best is trial 18 with value: 0.12844001782559744.
[I 2025-11-03 12:49:36,284] Trial 47 finished with value: 0.05487786638972897 and parameters: {'model_type': 'graphsage', 'hidden_dims': '[512, 128]', 'dropout': 0.33056700157983643, 'batch_norm': False, 'lr': 0.000354580554402519, 'weight_decay': 7.376785436718862e-07, 'epochs': 121, 'loss': 'mae', 'optimizer': 'adam', 'graph_mode': 'knn', 'source': 'grm', 'knn_k': 6, 'weighted_edges': True, 'symmetrize_mode': 'mutual', 'use_snp_selection': True, 'num_snps': 39659}. Best is trial 18 with value: 0.12844001782559744.
[I 2025-11-03 12:49:40,545] Trial 48 finished with value: 0.1275294446289814 and parameters: {'model_type': 'graphsage', 'hidden_dims': '[128, 64]', 'dropout': 0.43046750125658584, 'batch_norm': True, 'lr': 8.778935459150375e-05, 'weight_decay': 2.859968269833288e-07, 'epochs': 286, 'loss': 'mae', 'optimizer': 'adam', 'graph_mode': 'cutoff', 'cutoff': 0.6971006503930545, 'grm_norm': 'none', 'self_loops': False, 'use_snp_selection': True, 'num_snps': 56438}. Best is trial 18 with value: 0.12844001782559744.
[I 2025-11-03 12:49:44,919] Trial 49 finished with value: 0.09754527906276779 and parameters: {'model_type': 'graphsage', 'hidden_dims': '[128, 64]', 'dropout': 0.49168498820764195, 'batch_norm': False, 'lr': 8.719224763130256e-05, 'weight_decay': 2.4900030196357817e-07, 'epochs': 328, 'loss': 'mse', 'optimizer': 'adam', 'graph_mode': 'cutoff', 'cutoff': 0.6845450694173258, 'grm_norm': 'none', 'self_loops': False, 'use_snp_selection': True, 'num_snps': 59871}. Best is trial 18 with value: 0.12844001782559744.
[I 2025-11-03 12:49:49,087] Trial 50 finished with value: 0.12346854730942915 and parameters: {'model_type': 'graphsage', 'hidden_dims': '[128, 64]', 'dropout': 0.42882808552354557, 'batch_norm': True, 'lr': 0.0001960227214021648, 'weight_decay': 3.117752743386648e-07, 'epochs': 272, 'loss': 'mae', 'optimizer': 'adam', 'graph_mode': 'cutoff', 'cutoff': 0.6007463206570971, 'grm_norm': 'none', 'self_loops': False, 'use_snp_selection': True, 'num_snps': 55989}. Best is trial 18 with value: 0.12844001782559744.
[I 2025-11-03 12:49:53,307] Trial 51 finished with value: 0.1166711885468486 and parameters: {'model_type': 'graphsage', 'hidden_dims': '[128, 64]', 'dropout': 0.43288391374249147, 'batch_norm': True, 'lr': 0.00012665286508470043, 'weight_decay': 3.106879714410092e-07, 'epochs': 283, 'loss': 'mae', 'optimizer': 'adam', 'graph_mode': 'cutoff', 'cutoff': 0.6184610021546542, 'grm_norm': 'none', 'self_loops': False, 'use_snp_selection': True, 'num_snps': 55988}. Best is trial 18 with value: 0.12844001782559744.
[I 2025-11-03 12:49:57,335] Trial 52 finished with value: 0.0987230033412505 and parameters: {'model_type': 'graphsage', 'hidden_dims': '[128, 64]', 'dropout': 0.4760154955297401, 'batch_norm': True, 'lr': 0.0002214135691450403, 'weight_decay': 1.7748982824558997e-07, 'epochs': 266, 'loss': 'mae', 'optimizer': 'adam', 'graph_mode': 'cutoff', 'cutoff': 0.5731031770843265, 'grm_norm': 'none', 'self_loops': False, 'use_snp_selection': True, 'num_snps': 52536}. Best is trial 18 with value: 0.12844001782559744.
[I 2025-11-03 12:50:01,742] Trial 53 finished with value: 0.11948695123861366 and parameters: {'model_type': 'graphsage', 'hidden_dims': '[128, 64]', 'dropout': 0.5356701739994623, 'batch_norm': True, 'lr': 7.967807587943753e-05, 'weight_decay': 5.997436557880407e-07, 'epochs': 324, 'loss': 'mae', 'optimizer': 'adam', 'graph_mode': 'cutoff', 'cutoff': 0.7551191387981241, 'grm_norm': 'none', 'self_loops': False, 'use_snp_selection': True, 'num_snps': 56838}. Best is trial 18 with value: 0.12844001782559744.
[I 2025-11-03 12:50:05,794] Trial 54 finished with value: 0.10933288918644947 and parameters: {'model_type': 'graphsage', 'hidden_dims': '[128, 64]', 'dropout': 0.4330641349689797, 'batch_norm': True, 'lr': 0.0001824121427881317, 'weight_decay': 1.428213607343486e-07, 'epochs': 288, 'loss': 'mae', 'optimizer': 'adam', 'graph_mode': 'cutoff', 'cutoff': 0.6918815215495466, 'grm_norm': 'none', 'self_loops': False, 'use_snp_selection': True, 'num_snps': 50604}. Best is trial 18 with value: 0.12844001782559744.
[I 2025-11-03 12:50:10,006] Trial 55 finished with value: 0.10114964420286537 and parameters: {'model_type': 'graphsage', 'hidden_dims': '[128, 64]', 'dropout': 0.4049044891114452, 'batch_norm': True, 'lr': 0.00011382771257943494, 'weight_decay': 2.5913096575692645e-07, 'epochs': 307, 'loss': 'mae', 'optimizer': 'adam', 'graph_mode': 'cutoff', 'cutoff': 0.5312603491448299, 'grm_norm': 'none', 'self_loops': False, 'use_snp_selection': True, 'num_snps': 52667}. Best is trial 18 with value: 0.12844001782559744.
[I 2025-11-03 12:50:14,073] Trial 56 finished with value: 0.10458524581806974 and parameters: {'model_type': 'graphsage', 'hidden_dims': '[128, 64]', 'dropout': 0.13341690438734916, 'batch_norm': False, 'lr': 6.649729079579272e-05, 'weight_decay': 1.7090185687159565e-05, 'epochs': 267, 'loss': 'mae', 'optimizer': 'adam', 'graph_mode': 'cutoff', 'cutoff': 0.6534793032880766, 'grm_norm': 'none', 'self_loops': False, 'use_snp_selection': True, 'num_snps': 57172}. Best is trial 18 with value: 0.12844001782559744.
[I 2025-11-03 12:50:17,016] Trial 57 finished with value: 0.02056656170821583 and parameters: {'model_type': 'graphsage', 'hidden_dims': '[128, 64]', 'dropout': 0.5168262543693298, 'batch_norm': True, 'lr': 1.4385172820262379e-05, 'weight_decay': 8.945475258369685e-07, 'epochs': 63, 'loss': 'mae', 'optimizer': 'adam', 'graph_mode': 'cutoff', 'cutoff': 0.5959603913349307, 'grm_norm': 'cosine_then_gcn', 'self_loops': False, 'use_snp_selection': True, 'num_snps': 43660}. Best is trial 18 with value: 0.12844001782559744.
[I 2025-11-03 12:50:20,370] Trial 58 finished with value: 0.11157924113333352 and parameters: {'model_type': 'graphsage', 'hidden_dims': '[512, 256]', 'dropout': 0.3948505284415258, 'batch_norm': True, 'lr': 0.00029855281983017586, 'weight_decay': 0.00010096430846144506, 'epochs': 106, 'loss': 'mae', 'optimizer': 'adam', 'graph_mode': 'cutoff', 'cutoff': 0.7301256112986991, 'grm_norm': 'gcn', 'self_loops': False, 'use_snp_selection': False}. Best is trial 18 with value: 0.12844001782559744.
[I 2025-11-03 12:50:23,318] Trial 59 finished with value: 0.07440315295084998 and parameters: {'model_type': 'graphsage', 'hidden_dims': '[256, 128, 64]', 'dropout': 0.5793752988168288, 'batch_norm': False, 'lr': 3.956025501840552e-05, 'weight_decay': 0.00056731081341894, 'epochs': 141, 'loss': 'mae', 'optimizer': 'adam', 'graph_mode': 'cutoff', 'cutoff': 0.49496887076538937, 'grm_norm': 'none', 'self_loops': False, 'use_snp_selection': True, 'num_snps': 28683}. Best is trial 18 with value: 0.12844001782559744.
