[I 2025-11-03 13:51:09,148] Trial 36 finished with value: 0.009979853127318567 and parameters: {'model_type': 'graphsage', 'hidden_dims': '[128, 64]', 'dropout': 0.40884353447469957, 'batch_norm': False, 'lr': 2.4684387983886195e-05, 'weight_decay': 9.888903692769788e-07, 'epochs': 86, 'loss': 'mae', 'optimizer': 'adam', 'graph_mode': 'knn', 'source': 'grm', 'knn_k': 9, 'weighted_edges': False, 'symmetrize_mode': 'union', 'use_snp_selection': True, 'num_snps': 52888}. Best is trial 27 with value: 0.08246652821033469.
[I 2025-11-03 13:51:13,111] Trial 37 finished with value: 0.049059907617499704 and parameters: {'model_type': 'graphsage', 'hidden_dims': '[512, 128]', 'dropout': 0.337043305407594, 'batch_norm': False, 'lr': 4.900058824281818e-06, 'weight_decay': 3.1065420505885372e-06, 'epochs': 173, 'loss': 'mae', 'optimizer': 'adam', 'graph_mode': 'knn', 'source': 'grm', 'knn_k': 7, 'weighted_edges': True, 'symmetrize_mode': 'union', 'use_snp_selection': True, 'num_snps': 37125}. Best is trial 27 with value: 0.08246652821033469.
[I 2025-11-03 13:51:16,872] Trial 38 finished with value: 0.03554263042845875 and parameters: {'model_type': 'graphsage', 'hidden_dims': '[256, 128]', 'dropout': 0.4941730510100251, 'batch_norm': False, 'lr': 1.817789981622396e-05, 'weight_decay': 6.965507821731437e-07, 'epochs': 54, 'loss': 'mae', 'optimizer': 'adam', 'graph_mode': 'knn', 'source': 'grm', 'knn_k': 10, 'weighted_edges': False, 'symmetrize_mode': 'mutual', 'use_snp_selection': True, 'num_snps': 59877}. Best is trial 27 with value: 0.08246652821033469.
[I 2025-11-03 13:51:19,757] Trial 39 finished with value: 0.0068000532162137434 and parameters: {'model_type': 'graphsage', 'hidden_dims': '[512, 128]', 'dropout': 0.561570764643825, 'batch_norm': False, 'lr': 2.721673332709407e-06, 'weight_decay': 6.063300634483245e-06, 'epochs': 209, 'loss': 'mae', 'optimizer': 'adam', 'graph_mode': 'knn', 'source': 'grm', 'knn_k': 4, 'weighted_edges': True, 'symmetrize_mode': 'union', 'use_snp_selection': True, 'num_snps': 22815}. Best is trial 27 with value: 0.08246652821033469.
[I 2025-11-03 13:51:24,721] Trial 40 finished with value: 0.05958906908215352 and parameters: {'model_type': 'graphsage', 'hidden_dims': '[512, 256]', 'dropout': 0.37613997473655847, 'batch_norm': False, 'lr': 3.9317653741995206e-05, 'weight_decay': 1.5386893819405905e-05, 'epochs': 136, 'loss': 'mae', 'optimizer': 'adam', 'graph_mode': 'knn', 'source': 'grm', 'knn_k': 8, 'weighted_edges': False, 'symmetrize_mode': 'union', 'use_snp_selection': True, 'num_snps': 53972}. Best is trial 27 with value: 0.08246652821033469.
[I 2025-11-03 13:51:29,297] Trial 41 finished with value: 0.007832867948611788 and parameters: {'model_type': 'graphsage', 'hidden_dims': '[512, 128]', 'dropout': 0.3162231326631373, 'batch_norm': False, 'lr': 1.2500539463815452e-05, 'weight_decay': 2.7230501976961254e-06, 'epochs': 84, 'loss': 'mae', 'optimizer': 'adam', 'graph_mode': 'knn', 'source': 'grm', 'knn_k': 8, 'weighted_edges': False, 'symmetrize_mode': 'union', 'use_snp_selection': True, 'num_snps': 56134}. Best is trial 27 with value: 0.08246652821033469.
[I 2025-11-03 13:51:33,730] Trial 42 finished with value: 0.055922287206945996 and parameters: {'model_type': 'graphsage', 'hidden_dims': '[512, 128]', 'dropout': 0.33336602773134416, 'batch_norm': False, 'lr': 5.975283820261778e-06, 'weight_decay': 2.6821518357558695e-06, 'epochs': 119, 'loss': 'mae', 'optimizer': 'adam', 'graph_mode': 'knn', 'source': 'grm', 'knn_k': 9, 'weighted_edges': False, 'symmetrize_mode': 'union', 'use_snp_selection': True, 'num_snps': 48427}. Best is trial 27 with value: 0.08246652821033469.
[I 2025-11-03 13:51:37,199] Trial 43 finished with value: 0.015341116865237172 and parameters: {'model_type': 'graphsage', 'hidden_dims': '[512, 128]', 'dropout': 0.3119877354458315, 'batch_norm': False, 'lr': 1.1431423427315183e-05, 'weight_decay': 1.8335494925263442e-06, 'epochs': 60, 'loss': 'mae', 'optimizer': 'adam', 'graph_mode': 'knn', 'source': 'grm', 'knn_k': 8, 'weighted_edges': False, 'symmetrize_mode': 'union', 'use_snp_selection': True, 'num_snps': 40904}. Best is trial 27 with value: 0.08246652821033469.
[I 2025-11-03 13:51:42,192] Trial 44 finished with value: 0.046324858359284016 and parameters: {'model_type': 'graphsage', 'hidden_dims': '[512, 128]', 'dropout': 0.3848941463424286, 'batch_norm': False, 'lr': 9.782125202628588e-06, 'weight_decay': 3.216477656440282e-05, 'epochs': 93, 'loss': 'mae', 'optimizer': 'adam', 'graph_mode': 'knn', 'source': 'grm', 'knn_k': 10, 'weighted_edges': False, 'symmetrize_mode': 'union', 'use_snp_selection': True, 'num_snps': 59546}. Best is trial 27 with value: 0.08246652821033469.
[I 2025-11-03 13:51:45,559] Trial 45 finished with value: 0.017315418489416496 and parameters: {'model_type': 'graphsage', 'hidden_dims': '[256, 128, 64]', 'dropout': 0.4154115692723892, 'batch_norm': False, 'lr': 2.919666052546705e-05, 'weight_decay': 1.294091687569356e-06, 'epochs': 80, 'loss': 'mae', 'optimizer': 'adam', 'graph_mode': 'knn', 'source': 'grm', 'knn_k': 5, 'weighted_edges': False, 'symmetrize_mode': 'union', 'use_snp_selection': True, 'num_snps': 49280}. Best is trial 27 with value: 0.08246652821033469.
[I 2025-11-03 13:51:49,050] Trial 46 finished with value: 0.028264506718283886 and parameters: {'model_type': 'graphsage', 'hidden_dims': '[128, 64]', 'dropout': 0.36206346966934144, 'batch_norm': False, 'lr': 1.770911738423581e-05, 'weight_decay': 5.759779218785577e-07, 'epochs': 119, 'loss': 'mae', 'optimizer': 'adam', 'graph_mode': 'knn', 'source': 'grm', 'knn_k': 8, 'weighted_edges': True, 'symmetrize_mode': 'mutual', 'use_snp_selection': True, 'num_snps': 55740}. Best is trial 27 with value: 0.08246652821033469.
[I 2025-11-03 13:51:52,386] Trial 47 finished with value: 0.055453712179744534 and parameters: {'model_type': 'graphsage', 'hidden_dims': '[512, 256]', 'dropout': 0.2755819338608425, 'batch_norm': True, 'lr': 7.119554905710905e-05, 'weight_decay': 1.004912921481287e-05, 'epochs': 106, 'loss': 'mse', 'optimizer': 'adam', 'graph_mode': 'knn', 'source': 'grm', 'knn_k': 7, 'weighted_edges': False, 'symmetrize_mode': 'union', 'use_snp_selection': False}. Best is trial 27 with value: 0.08246652821033469.
[I 2025-11-03 13:51:56,473] Trial 48 finished with value: 0.07852611154999102 and parameters: {'model_type': 'graphsage', 'hidden_dims': '[512, 128]', 'dropout': 0.20778831999783684, 'batch_norm': True, 'lr': 3.375830427246962e-05, 'weight_decay': 3.627232060835456e-06, 'epochs': 170, 'loss': 'mse', 'optimizer': 'adam', 'graph_mode': 'knn', 'source': 'grm', 'knn_k': 9, 'weighted_edges': True, 'symmetrize_mode': 'union', 'use_snp_selection': False}. Best is trial 27 with value: 0.08246652821033469.
[I 2025-11-03 13:51:59,164] Trial 49 finished with value: 0.02809543768576914 and parameters: {'model_type': 'graphsage', 'hidden_dims': '[256, 128]', 'dropout': 0.1238554718914207, 'batch_norm': True, 'lr': 5.260256354484004e-05, 'weight_decay': 4.160122382497272e-06, 'epochs': 184, 'loss': 'mse', 'optimizer': 'adam', 'graph_mode': 'knn', 'source': 'grm', 'knn_k': 9, 'weighted_edges': True, 'symmetrize_mode': 'mutual', 'use_snp_selection': False}. Best is trial 27 with value: 0.08246652821033469.
[I 2025-11-03 13:52:03,421] Trial 50 finished with value: 0.03338045355237055 and parameters: {'model_type': 'graphsage', 'hidden_dims': '[512, 128]', 'dropout': 0.14697638469460608, 'batch_norm': True, 'lr': 0.00015877967008725083, 'weight_decay': 7.912908562647834e-07, 'epochs': 250, 'loss': 'mse', 'optimizer': 'adam', 'graph_mode': 'cutoff', 'cutoff': 0.6241792736509315, 'grm_norm': 'cosine_then_gcn', 'self_loops': False, 'use_snp_selection': False}. Best is trial 27 with value: 0.08246652821033469.
[I 2025-11-03 13:52:07,550] Trial 51 finished with value: -0.002225372859519214 and parameters: {'model_type': 'graphsage', 'hidden_dims': '[512, 128]', 'dropout': 0.25040837625976387, 'batch_norm': True, 'lr': 6.177097651103902e-06, 'weight_decay': 2.5162329231296484e-06, 'epochs': 167, 'loss': 'mse', 'optimizer': 'adam', 'graph_mode': 'knn', 'source': 'grm', 'knn_k': 9, 'weighted_edges': True, 'symmetrize_mode': 'union', 'use_snp_selection': False}. Best is trial 27 with value: 0.08246652821033469.
[I 2025-11-03 13:52:10,368] Trial 52 finished with value: -0.000501135881181935 and parameters: {'model_type': 'graphsage', 'hidden_dims': '[512, 128]', 'dropout': 0.22187910992593812, 'batch_norm': True, 'lr': 1.8010303803535604e-05, 'weight_decay': 4.0978356073352184e-06, 'epochs': 60, 'loss': 'mse', 'optimizer': 'adam', 'graph_mode': 'knn', 'source': 'grm', 'knn_k': 8, 'weighted_edges': True, 'symmetrize_mode': 'union', 'use_snp_selection': False}. Best is trial 27 with value: 0.08246652821033469.
[I 2025-11-03 13:52:13,462] Trial 53 finished with value: 0.01706900609127885 and parameters: {'model_type': 'graphsage', 'hidden_dims': '[512, 128]', 'dropout': 0.29955763195089763, 'batch_norm': True, 'lr': 8.504608484382755e-06, 'weight_decay': 7.638203224739128e-06, 'epochs': 92, 'loss': 'mse', 'optimizer': 'adam', 'graph_mode': 'knn', 'source': 'grm', 'knn_k': 6, 'weighted_edges': True, 'symmetrize_mode': 'union', 'use_snp_selection': False}. Best is trial 27 with value: 0.08246652821033469.
[I 2025-11-03 13:52:17,267] Trial 54 finished with value: 0.06360965024881593 and parameters: {'model_type': 'graphsage', 'hidden_dims': '[512, 128]', 'dropout': 0.2047834429494156, 'batch_norm': True, 'lr': 0.0003629846818393682, 'weight_decay': 0.00015821480207467312, 'epochs': 141, 'loss': 'mse', 'optimizer': 'adam', 'graph_mode': 'knn', 'source': 'grm', 'knn_k': 10, 'weighted_edges': True, 'symmetrize_mode': 'union', 'use_snp_selection': False}. Best is trial 27 with value: 0.08246652821033469.
[I 2025-11-03 13:52:20,887] Trial 55 finished with value: 0.053142937449021925 and parameters: {'model_type': 'graphsage', 'hidden_dims': '[512, 64]', 'dropout': 0.2036885124200277, 'batch_norm': True, 'lr': 0.000550049750754345, 'weight_decay': 0.00032474569988725393, 'epochs': 141, 'loss': 'mse', 'optimizer': 'adam', 'graph_mode': 'knn', 'source': 'grm', 'knn_k': 10, 'weighted_edges': True, 'symmetrize_mode': 'mutual', 'use_snp_selection': False}. Best is trial 27 with value: 0.08246652821033469.
[I 2025-11-03 13:52:23,400] Trial 56 finished with value: 0.0225830614571772 and parameters: {'model_type': 'graphsage', 'hidden_dims': '[256, 128, 64]', 'dropout': 0.20873766647706013, 'batch_norm': True, 'lr': 0.0004391252848566264, 'weight_decay': 8.561856664166225e-05, 'epochs': 206, 'loss': 'mse', 'optimizer': 'adam', 'graph_mode': 'cutoff', 'cutoff': 0.78625680360032, 'grm_norm': 'gcn', 'self_loops': False, 'use_snp_selection': False}. Best is trial 27 with value: 0.08246652821033469.
[I 2025-11-03 13:52:27,571] Trial 57 finished with value: 0.06465982129833805 and parameters: {'model_type': 'graphsage', 'hidden_dims': '[512, 128]', 'dropout': 0.1688648980170265, 'batch_norm': True, 'lr': 0.00021698050742393284, 'weight_decay': 0.00015412291717593088, 'epochs': 167, 'loss': 'mse', 'optimizer': 'adam', 'graph_mode': 'knn', 'source': 'grm', 'knn_k': 10, 'weighted_edges': True, 'symmetrize_mode': 'union', 'use_snp_selection': False}. Best is trial 27 with value: 0.08246652821033469.
[I 2025-11-03 13:52:31,217] Trial 58 finished with value: 0.03203714617341785 and parameters: {'model_type': 'graphsage', 'hidden_dims': '[512, 64]', 'dropout': 0.16482809531419595, 'batch_norm': True, 'lr': 9.003797603917432e-05, 'weight_decay': 1.8535853649417604e-07, 'epochs': 161, 'loss': 'mse', 'optimizer': 'adam', 'graph_mode': 'cutoff', 'cutoff': 0.2128090438325312, 'grm_norm': 'none', 'self_loops': True, 'use_snp_selection': False}. Best is trial 27 with value: 0.08246652821033469.
[I 2025-11-03 13:52:36,355] Trial 59 finished with value: 0.04405111698799227 and parameters: {'model_type': 'graphsage', 'hidden_dims': '[512, 256]', 'dropout': 0.1482429548425215, 'batch_norm': True, 'lr': 0.0007035534796283042, 'weight_decay': 1.564004085591632e-05, 'epochs': 254, 'loss': 'mse', 'optimizer': 'adam', 'graph_mode': 'knn', 'source': 'grm', 'knn_k': 10, 'weighted_edges': True, 'symmetrize_mode': 'union', 'use_snp_selection': False}. Best is trial 27 with value: 0.08246652821033469.
[I 2025-11-03 13:52:40,406] Trial 60 finished with value: 0.032740196178830595 and parameters: {'model_type': 'graphsage', 'hidden_dims': '[512, 64]', 'dropout': 0.4636055268707085, 'batch_norm': True, 'lr': 0.00015120482798078972, 'weight_decay': 4.902941808422253e-07, 'epochs': 228, 'loss': 'mse', 'optimizer': 'adam', 'graph_mode': 'cutoff', 'cutoff': 0.6565572584738402, 'grm_norm': 'none', 'self_loops': False, 'use_snp_selection': False}. Best is trial 27 with value: 0.08246652821033469.
[I 2025-11-03 13:52:44,948] Trial 61 finished with value: 0.07244198550986332 and parameters: {'model_type': 'graphsage', 'hidden_dims': '[512, 128]', 'dropout': 0.1884592091043958, 'batch_norm': True, 'lr': 0.0003156070703410986, 'weight_decay': 0.00011486097430121204, 'epochs': 199, 'loss': 'mse', 'optimizer': 'adam', 'graph_mode': 'knn', 'source': 'grm', 'knn_k': 10, 'weighted_edges': True, 'symmetrize_mode': 'union', 'use_snp_selection': False}. Best is trial 27 with value: 0.08246652821033469.
[I 2025-11-03 13:52:48,909] Trial 62 finished with value: 0.0391909925096852 and parameters: {'model_type': 'graphsage', 'hidden_dims': '[512, 128]', 'dropout': 0.19034547186042888, 'batch_norm': True, 'lr': 0.000704969583623202, 'weight_decay': 0.0009144635349580363, 'epochs': 197, 'loss': 'mse', 'optimizer': 'adam', 'graph_mode': 'knn', 'source': 'grm', 'knn_k': 2, 'weighted_edges': True, 'symmetrize_mode': 'union', 'use_snp_selection': False}. Best is trial 27 with value: 0.08246652821033469.
[I 2025-11-03 13:52:53,845] Trial 63 finished with value: 0.052326503591582564 and parameters: {'model_type': 'graphsage', 'hidden_dims': '[512, 128]', 'dropout': 0.10125293682216412, 'batch_norm': True, 'lr': 0.00029509113716568483, 'weight_decay': 0.00021309521073937786, 'epochs': 238, 'loss': 'mse', 'optimizer': 'adam', 'graph_mode': 'knn', 'source': 'grm', 'knn_k': 9, 'weighted_edges': True, 'symmetrize_mode': 'union', 'use_snp_selection': False}. Best is trial 27 with value: 0.08246652821033469.
[I 2025-11-03 13:52:58,071] Trial 64 finished with value: 0.07111656387254245 and parameters: {'model_type': 'graphsage', 'hidden_dims': '[512, 128]', 'dropout': 0.16095839520627866, 'batch_norm': True, 'lr': 0.00021185205540123823, 'weight_decay': 0.0006953951258746524, 'epochs': 176, 'loss': 'mse', 'optimizer': 'adam', 'graph_mode': 'knn', 'source': 'grm', 'knn_k': 10, 'weighted_edges': True, 'symmetrize_mode': 'union', 'use_snp_selection': False}. Best is trial 27 with value: 0.08246652821033469.
[I 2025-11-03 13:53:02,464] Trial 65 finished with value: 0.05591737043529015 and parameters: {'model_type': 'graphsage', 'hidden_dims': '[512, 128]', 'dropout': 0.1596506278160016, 'batch_norm': True, 'lr': 0.00021515698507671178, 'weight_decay': 0.0006066699559479144, 'epochs': 189, 'loss': 'mse', 'optimizer': 'adam', 'graph_mode': 'knn', 'source': 'grm', 'knn_k': 10, 'weighted_edges': True, 'symmetrize_mode': 'union', 'use_snp_selection': False}. Best is trial 27 with value: 0.08246652821033469.
[I 2025-11-03 13:53:06,647] Trial 66 finished with value: 0.055994574237418125 and parameters: {'model_type': 'graphsage', 'hidden_dims': '[512, 128]', 'dropout': 0.12624653253922902, 'batch_norm': True, 'lr': 0.00017665851017658354, 'weight_decay': 9.161004668568559e-05, 'epochs': 171, 'loss': 'mse', 'optimizer': 'adam', 'graph_mode': 'knn', 'source': 'grm', 'knn_k': 10, 'weighted_edges': True, 'symmetrize_mode': 'union', 'use_snp_selection': False}. Best is trial 27 with value: 0.08246652821033469.
[I 2025-11-03 13:53:11,111] Trial 67 finished with value: 0.050029742558494086 and parameters: {'model_type': 'graphsage', 'hidden_dims': '[512, 128]', 'dropout': 0.1817023438579801, 'batch_norm': True, 'lr': 0.00020303343070761582, 'weight_decay': 0.0006711171103124866, 'epochs': 201, 'loss': 'mse', 'optimizer': 'adam', 'graph_mode': 'knn', 'source': 'grm', 'knn_k': 9, 'weighted_edges': True, 'symmetrize_mode': 'union', 'use_snp_selection': False}. Best is trial 27 with value: 0.08246652821033469.
[I 2025-11-03 13:53:15,373] Trial 68 finished with value: 0.05701263244053946 and parameters: {'model_type': 'graphsage', 'hidden_dims': '[512, 128]', 'dropout': 0.2579378765375044, 'batch_norm': True, 'lr': 0.0003403455775937089, 'weight_decay': 0.0001634270905328134, 'epochs': 179, 'loss': 'mse', 'optimizer': 'adam', 'graph_mode': 'knn', 'source': 'grm', 'knn_k': 10, 'weighted_edges': True, 'symmetrize_mode': 'union', 'use_snp_selection': False}. Best is trial 27 with value: 0.08246652821033469.
[I 2025-11-03 13:53:20,692] Trial 69 finished with value: 0.03685414380570645 and parameters: {'model_type': 'graphsage', 'hidden_dims': '[512, 128]', 'dropout': 0.14208353907970167, 'batch_norm': True, 'lr': 0.00011202760209680223, 'weight_decay': 0.000390134256869764, 'epochs': 268, 'loss': 'mse', 'optimizer': 'adam', 'graph_mode': 'knn', 'source': 'grm', 'knn_k': 10, 'weighted_edges': True, 'symmetrize_mode': 'union', 'use_snp_selection': False}. Best is trial 27 with value: 0.08246652821033469.
[I 2025-11-03 13:53:25,295] Trial 70 finished with value: 0.04909209805815394 and parameters: {'model_type': 'graphsage', 'hidden_dims': '[512, 128]', 'dropout': 0.21792849608689613, 'batch_norm': True, 'lr': 0.00044702232476679705, 'weight_decay': 2.899466089115212e-05, 'epochs': 213, 'loss': 'mse', 'optimizer': 'adam', 'graph_mode': 'knn', 'source': 'grm', 'knn_k': 9, 'weighted_edges': True, 'symmetrize_mode': 'union', 'use_snp_selection': False}. Best is trial 27 with value: 0.08246652821033469.
[I 2025-11-03 13:53:28,273] Trial 71 finished with value: 0.029490835574056358 and parameters: {'model_type': 'graphsage', 'hidden_dims': '[512, 64]', 'dropout': 0.166509242152552, 'batch_norm': True, 'lr': 3.2092540276534655e-05, 'weight_decay': 5.142220368082837e-05, 'epochs': 72, 'loss': 'mse', 'optimizer': 'adam', 'graph_mode': 'knn', 'source': 'grm', 'knn_k': 9, 'weighted_edges': True, 'symmetrize_mode': 'union', 'use_snp_selection': False}. Best is trial 27 with value: 0.08246652821033469.
[I 2025-11-03 13:53:30,463] Trial 72 finished with value: 0.037213336961205164 and parameters: {'model_type': 'graphsage', 'hidden_dims': '[128, 64]', 'dropout': 0.4338391090838828, 'batch_norm': True, 'lr': 1.4252574291988725e-05, 'weight_decay': 5.3226452109522945e-06, 'epochs': 154, 'loss': 'mse', 'optimizer': 'adam', 'graph_mode': 'knn', 'source': 'grm', 'knn_k': 10, 'weighted_edges': True, 'symmetrize_mode': 'union', 'use_snp_selection': False}. Best is trial 27 with value: 0.08246652821033469.
[I 2025-11-03 13:53:32,168] Trial 73 finished with value: 0.03659298922940121 and parameters: {'model_type': 'graphsage', 'hidden_dims': '[256, 128]', 'dropout': 0.48824770770577397, 'batch_norm': True, 'lr': 0.00011002731667742904, 'weight_decay': 1.3670007428632665e-06, 'epochs': 47, 'loss': 'mse', 'optimizer': 'adam', 'graph_mode': 'cutoff', 'cutoff': 0.8260251982083212, 'grm_norm': 'cosine_then_gcn', 'self_loops': True, 'use_snp_selection': False}. Best is trial 27 with value: 0.08246652821033469.
[I 2025-11-03 13:53:36,856] Trial 74 finished with value: 0.046519191678500625 and parameters: {'model_type': 'graphsage', 'hidden_dims': '[512, 64]', 'dropout': 0.5330142243618562, 'batch_norm': True, 'lr': 0.0008272805557689257, 'weight_decay': 0.00026677423146619935, 'epochs': 219, 'loss': 'mse', 'optimizer': 'adam', 'graph_mode': 'knn', 'source': 'grm', 'knn_k': 9, 'weighted_edges': True, 'symmetrize_mode': 'union', 'use_snp_selection': False}. Best is trial 27 with value: 0.08246652821033469.
[I 2025-11-03 13:53:40,814] Trial 75 finished with value: 0.020121080656193828 and parameters: {'model_type': 'graphsage', 'hidden_dims': '[512, 128]', 'dropout': 0.23900859535945929, 'batch_norm': True, 'lr': 7.396522570939054e-06, 'weight_decay': 0.00010518120406054107, 'epochs': 180, 'loss': 'mse', 'optimizer': 'adam', 'graph_mode': 'knn', 'source': 'grm', 'knn_k': 10, 'weighted_edges': True, 'symmetrize_mode': 'mutual', 'use_snp_selection': False}. Best is trial 27 with value: 0.08246652821033469.
[I 2025-11-03 13:53:44,791] Trial 76 finished with value: 0.0480048348394153 and parameters: {'model_type': 'graphsage', 'hidden_dims': '[512, 128]', 'dropout': 0.28203707946937445, 'batch_norm': True, 'lr': 2.152049337714449e-05, 'weight_decay': 2.198907354496004e-06, 'epochs': 163, 'loss': 'mse', 'optimizer': 'adam', 'graph_mode': 'knn', 'source': 'grm', 'knn_k': 9, 'weighted_edges': True, 'symmetrize_mode': 'union', 'use_snp_selection': False}. Best is trial 27 with value: 0.08246652821033469.
[I 2025-11-03 13:53:47,014] Trial 77 finished with value: 0.023919022647847833 and parameters: {'model_type': 'graphsage', 'hidden_dims': '[256, 128, 64]', 'dropout': 0.34237287751723555, 'batch_norm': True, 'lr': 0.00047994183385837585, 'weight_decay': 0.0005508395625177391, 'epochs': 147, 'loss': 'mse', 'optimizer': 'adam', 'graph_mode': 'cutoff', 'cutoff': 0.49954380610820026, 'grm_norm': 'gcn', 'self_loops': False, 'use_snp_selection': False}. Best is trial 27 with value: 0.08246652821033469.
[I 2025-11-03 13:53:53,062] Trial 78 finished with value: 0.05961030478134471 and parameters: {'model_type': 'graphsage', 'hidden_dims': '[512, 64]', 'dropout': 0.19302519319507605, 'batch_norm': True, 'lr': 0.0002429259820918793, 'weight_decay': 4.226292310685565e-05, 'epochs': 331, 'loss': 'mse', 'optimizer': 'adam', 'graph_mode': 'knn', 'source': 'grm', 'knn_k': 10, 'weighted_edges': True, 'symmetrize_mode': 'union', 'use_snp_selection': False}. Best is trial 27 with value: 0.08246652821033469.
