[I 2025-11-03 13:05:44,981] Trial 47 finished with value: 0.07056374446070748 and parameters: {'model_type': 'gcn', 'hidden_dims': '[512, 256]', 'dropout': 0.3988011195932626, 'batch_norm': True, 'lr': 3.728217093913036e-05, 'weight_decay': 2.1754683207609956e-06, 'epochs': 272, 'loss': 'mse', 'optimizer': 'adam', 'graph_mode': 'cutoff', 'cutoff': 0.45201883088528805, 'grm_norm': 'cosine', 'self_loops': True, 'use_snp_selection': False}. Best is trial 39 with value: 0.09449081425448297.
[I 2025-11-03 13:05:47,681] Trial 48 finished with value: 0.07769248345706699 and parameters: {'model_type': 'gcn', 'hidden_dims': '[256, 128]', 'dropout': 0.27709523792005136, 'batch_norm': True, 'lr': 7.525409423172638e-05, 'weight_decay': 6.370168595645037e-06, 'epochs': 295, 'loss': 'mse', 'optimizer': 'adam', 'graph_mode': 'knn', 'source': 'grm', 'knn_k': 5, 'weighted_edges': False, 'symmetrize_mode': 'mutual', 'use_snp_selection': False}. Best is trial 39 with value: 0.09449081425448297.
[I 2025-11-03 13:05:51,246] Trial 49 finished with value: 0.04823094787528505 and parameters: {'model_type': 'gcn', 'hidden_dims': '[256, 128]', 'dropout': 0.2810342125324329, 'batch_norm': False, 'lr': 5.250059223132448e-05, 'weight_decay': 7.487152439729105e-06, 'epochs': 296, 'loss': 'mae', 'optimizer': 'adam', 'graph_mode': 'knn', 'source': 'grm', 'knn_k': 6, 'weighted_edges': False, 'symmetrize_mode': 'mutual', 'use_snp_selection': True, 'num_snps': 36048}. Best is trial 39 with value: 0.09449081425448297.
[I 2025-11-03 13:05:53,576] Trial 50 finished with value: 0.03536386293892044 and parameters: {'model_type': 'gcn', 'hidden_dims': '[256, 128]', 'dropout': 0.3089390731988593, 'batch_norm': True, 'lr': 7.18694837136479e-05, 'weight_decay': 3.3396706683069515e-05, 'epochs': 213, 'loss': 'mse', 'optimizer': 'adam', 'graph_mode': 'knn', 'source': 'grm', 'knn_k': 8, 'weighted_edges': False, 'symmetrize_mode': 'mutual', 'use_snp_selection': False}. Best is trial 39 with value: 0.09449081425448297.
[I 2025-11-03 13:05:56,242] Trial 51 finished with value: 0.06120842165894623 and parameters: {'model_type': 'gcn', 'hidden_dims': '[256, 128]', 'dropout': 0.3350400936440835, 'batch_norm': True, 'lr': 0.00010450573640921386, 'weight_decay': 3.316051217321748e-07, 'epochs': 287, 'loss': 'mse', 'optimizer': 'adam', 'graph_mode': 'knn', 'source': 'grm', 'knn_k': 5, 'weighted_edges': False, 'symmetrize_mode': 'mutual', 'use_snp_selection': False}. Best is trial 39 with value: 0.09449081425448297.
[I 2025-11-03 13:05:59,804] Trial 52 finished with value: 0.07789363709651709 and parameters: {'model_type': 'gcn', 'hidden_dims': '[512, 128]', 'dropout': 0.25474719979756916, 'batch_norm': True, 'lr': 8.571394420735865e-05, 'weight_decay': 0.00015876436044732893, 'epochs': 258, 'loss': 'mse', 'optimizer': 'adam', 'graph_mode': 'knn', 'source': 'grm', 'knn_k': 1, 'weighted_edges': False, 'symmetrize_mode': 'mutual', 'use_snp_selection': False}. Best is trial 39 with value: 0.09449081425448297.
[I 2025-11-03 13:06:03,345] Trial 53 finished with value: 0.06451267917656324 and parameters: {'model_type': 'gcn', 'hidden_dims': '[512, 128]', 'dropout': 0.27380078672606045, 'batch_norm': True, 'lr': 8.468019176300071e-05, 'weight_decay': 0.00019600593415788374, 'epochs': 253, 'loss': 'mse', 'optimizer': 'adam', 'graph_mode': 'knn', 'source': 'grm', 'knn_k': 7, 'weighted_edges': False, 'symmetrize_mode': 'mutual', 'use_snp_selection': False}. Best is trial 39 with value: 0.09449081425448297.
[I 2025-11-03 13:06:04,991] Trial 54 finished with value: 0.05817770719510171 and parameters: {'model_type': 'gcn', 'hidden_dims': '[512, 128]', 'dropout': 0.2978430048981606, 'batch_norm': True, 'lr': 0.0001239279184140864, 'weight_decay': 0.0004190731139035651, 'epochs': 38, 'loss': 'mse', 'optimizer': 'adam', 'graph_mode': 'knn', 'source': 'grm', 'knn_k': 1, 'weighted_edges': False, 'symmetrize_mode': 'mutual', 'use_snp_selection': False}. Best is trial 39 with value: 0.09449081425448297.
[I 2025-11-03 13:06:09,063] Trial 55 finished with value: 0.030872450709715154 and parameters: {'model_type': 'gcn', 'hidden_dims': '[512, 128]', 'dropout': 0.2584051306738624, 'batch_norm': True, 'lr': 5.865068575599249e-05, 'weight_decay': 1.4524062835615853e-05, 'epochs': 315, 'loss': 'mae', 'optimizer': 'adam', 'graph_mode': 'knn', 'source': 'grm', 'knn_k': 3, 'weighted_edges': False, 'symmetrize_mode': 'mutual', 'use_snp_selection': False}. Best is trial 39 with value: 0.09449081425448297.
[I 2025-11-03 13:06:12,997] Trial 56 finished with value: -0.008790500440065734 and parameters: {'model_type': 'gcn', 'hidden_dims': '[512, 128]', 'dropout': 0.32100005548413635, 'batch_norm': True, 'lr': 8.423546092171197e-06, 'weight_decay': 4.871578759086655e-06, 'epochs': 298, 'loss': 'mae', 'optimizer': 'adam', 'graph_mode': 'knn', 'source': 'grm', 'knn_k': 2, 'weighted_edges': False, 'symmetrize_mode': 'mutual', 'use_snp_selection': False}. Best is trial 39 with value: 0.09449081425448297.
[I 2025-11-03 13:06:16,335] Trial 57 finished with value: 0.044393247232215875 and parameters: {'model_type': 'gcn', 'hidden_dims': '[512, 64]', 'dropout': 0.3538334625814546, 'batch_norm': True, 'lr': 2.4734287908974785e-05, 'weight_decay': 8.243268271737184e-05, 'epochs': 233, 'loss': 'mse', 'optimizer': 'adam', 'graph_mode': 'knn', 'source': 'grm', 'knn_k': 1, 'weighted_edges': False, 'symmetrize_mode': 'mutual', 'use_snp_selection': False}. Best is trial 39 with value: 0.09449081425448297.
[I 2025-11-03 13:06:18,914] Trial 58 finished with value: 0.09116450370965411 and parameters: {'model_type': 'gcn', 'hidden_dims': '[256, 128]', 'dropout': 0.1802179165553644, 'batch_norm': True, 'lr': 0.00017468417056542705, 'weight_decay': 0.00032186252347723055, 'epochs': 277, 'loss': 'mae', 'optimizer': 'adam', 'graph_mode': 'cutoff', 'cutoff': 0.6810019459465925, 'grm_norm': 'cosine_then_gcn', 'self_loops': True, 'use_snp_selection': False}. Best is trial 39 with value: 0.09449081425448297.
[I 2025-11-03 13:06:21,498] Trial 59 finished with value: 0.030663754144264248 and parameters: {'model_type': 'gcn', 'hidden_dims': '[256, 128]', 'dropout': 0.15644506269827121, 'batch_norm': True, 'lr': 1.6390151755396363e-05, 'weight_decay': 0.00024007057016504633, 'epochs': 279, 'loss': 'mae', 'optimizer': 'adam', 'graph_mode': 'cutoff', 'cutoff': 0.6939926392432259, 'grm_norm': 'cosine_then_gcn', 'self_loops': True, 'use_snp_selection': False}. Best is trial 39 with value: 0.09449081425448297.
[I 2025-11-03 13:06:24,215] Trial 60 finished with value: 0.07996542394310681 and parameters: {'model_type': 'gcn', 'hidden_dims': '[256, 128]', 'dropout': 0.11025269156459458, 'batch_norm': True, 'lr': 9.433728342015298e-05, 'weight_decay': 3.452322760018426e-05, 'epochs': 309, 'loss': 'mse', 'optimizer': 'adam', 'graph_mode': 'cutoff', 'cutoff': 0.782560308122618, 'grm_norm': 'cosine_then_gcn', 'self_loops': True, 'use_snp_selection': False}. Best is trial 39 with value: 0.09449081425448297.
[I 2025-11-03 13:06:27,024] Trial 61 finished with value: 0.0934472397012856 and parameters: {'model_type': 'gcn', 'hidden_dims': '[256, 128]', 'dropout': 0.1855900721835242, 'batch_norm': True, 'lr': 9.48027533847148e-05, 'weight_decay': 4.1963062778354466e-05, 'epochs': 324, 'loss': 'mse', 'optimizer': 'adam', 'graph_mode': 'cutoff', 'cutoff': 0.7980541078558867, 'grm_norm': 'cosine_then_gcn', 'self_loops': True, 'use_snp_selection': False}. Best is trial 39 with value: 0.09449081425448297.
[I 2025-11-03 13:06:29,825] Trial 62 finished with value: 0.07432831001212327 and parameters: {'model_type': 'gcn', 'hidden_dims': '[256, 128]', 'dropout': 0.11197790961996333, 'batch_norm': True, 'lr': 0.00010537790745737344, 'weight_decay': 3.2418991833601916e-05, 'epochs': 322, 'loss': 'mse', 'optimizer': 'adam', 'graph_mode': 'cutoff', 'cutoff': 0.8168565710174082, 'grm_norm': 'cosine_then_gcn', 'self_loops': True, 'use_snp_selection': False}. Best is trial 39 with value: 0.09449081425448297.
[I 2025-11-03 13:06:32,735] Trial 63 finished with value: 0.06799866213523567 and parameters: {'model_type': 'gcn', 'hidden_dims': '[256, 128]', 'dropout': 0.13771477957251918, 'batch_norm': True, 'lr': 3.916742139136549e-05, 'weight_decay': 6.0227955778763166e-05, 'epochs': 342, 'loss': 'mse', 'optimizer': 'adam', 'graph_mode': 'cutoff', 'cutoff': 0.7793348678831817, 'grm_norm': 'cosine_then_gcn', 'self_loops': True, 'use_snp_selection': False}. Best is trial 39 with value: 0.09449081425448297.
[I 2025-11-03 13:06:35,462] Trial 64 finished with value: 0.07266492259768702 and parameters: {'model_type': 'gcn', 'hidden_dims': '[256, 128]', 'dropout': 0.1889833543691709, 'batch_norm': True, 'lr': 0.00018449145044136404, 'weight_decay': 9.701942434690382e-05, 'epochs': 308, 'loss': 'mse', 'optimizer': 'adam', 'graph_mode': 'cutoff', 'cutoff': 0.7449650750715078, 'grm_norm': 'cosine_then_gcn', 'self_loops': True, 'use_snp_selection': False}. Best is trial 39 with value: 0.09449081425448297.
[I 2025-11-03 13:06:38,040] Trial 65 finished with value: 0.07285213399104512 and parameters: {'model_type': 'gcn', 'hidden_dims': '[256, 128]', 'dropout': 0.16644911648136743, 'batch_norm': True, 'lr': 0.0002713620494670721, 'weight_decay': 0.0009384284677540003, 'epochs': 267, 'loss': 'mae', 'optimizer': 'adam', 'graph_mode': 'cutoff', 'cutoff': 0.644369114236794, 'grm_norm': 'cosine_then_gcn', 'self_loops': True, 'use_snp_selection': False}. Best is trial 39 with value: 0.09449081425448297.
[I 2025-11-03 13:06:40,761] Trial 66 finished with value: 0.06369372742548131 and parameters: {'model_type': 'gcn', 'hidden_dims': '[256, 128]', 'dropout': 0.10073663554215811, 'batch_norm': True, 'lr': 6.111075175896292e-05, 'weight_decay': 0.00042410541303273224, 'epochs': 307, 'loss': 'mae', 'optimizer': 'adam', 'graph_mode': 'cutoff', 'cutoff': 0.8333292953339582, 'grm_norm': 'cosine_then_gcn', 'self_loops': True, 'use_snp_selection': False}. Best is trial 39 with value: 0.09449081425448297.
[I 2025-11-03 13:06:43,910] Trial 67 finished with value: 0.08051307948271483 and parameters: {'model_type': 'gcn', 'hidden_dims': '[256, 128, 64]', 'dropout': 0.13993790746628493, 'batch_norm': True, 'lr': 0.00012376306275694977, 'weight_decay': 4.2590738132041584e-05, 'epochs': 327, 'loss': 'mse', 'optimizer': 'adam', 'graph_mode': 'cutoff', 'cutoff': 0.8991599932060468, 'grm_norm': 'cosine_then_gcn', 'self_loops': True, 'use_snp_selection': False}. Best is trial 39 with value: 0.09449081425448297.
[I 2025-11-03 13:06:47,151] Trial 68 finished with value: 0.05517165571436457 and parameters: {'model_type': 'gcn', 'hidden_dims': '[256, 128, 64]', 'dropout': 0.12280390807980181, 'batch_norm': True, 'lr': 0.00013129503830133397, 'weight_decay': 2.188026559957784e-05, 'epochs': 338, 'loss': 'mae', 'optimizer': 'adam', 'graph_mode': 'cutoff', 'cutoff': 0.8869781831083821, 'grm_norm': 'cosine_then_gcn', 'self_loops': True, 'use_snp_selection': False}. Best is trial 39 with value: 0.09449081425448297.
[I 2025-11-03 13:06:49,569] Trial 69 finished with value: 0.045716595411639485 and parameters: {'model_type': 'gcn', 'hidden_dims': '[256, 128, 64]', 'dropout': 0.13535064411918538, 'batch_norm': False, 'lr': 0.00018117726147191734, 'weight_decay': 4.081576598548321e-05, 'epochs': 328, 'loss': 'mse', 'optimizer': 'adam', 'graph_mode': 'cutoff', 'cutoff': 0.8328341512876756, 'grm_norm': 'cosine_then_gcn', 'self_loops': True, 'use_snp_selection': True, 'num_snps': 3082}. Best is trial 39 with value: 0.09449081425448297.
[I 2025-11-03 13:06:51,563] Trial 70 finished with value: 0.07804761797871211 and parameters: {'model_type': 'gcn', 'hidden_dims': '[256, 128, 64]', 'dropout': 0.14736363017688142, 'batch_norm': True, 'lr': 0.0001101376356781805, 'weight_decay': 1.4410573044780579e-05, 'epochs': 133, 'loss': 'mae', 'optimizer': 'adam', 'graph_mode': 'cutoff', 'cutoff': 0.898002370082719, 'grm_norm': 'cosine_then_gcn', 'self_loops': True, 'use_snp_selection': False}. Best is trial 39 with value: 0.09449081425448297.
[I 2025-11-03 13:06:54,643] Trial 71 finished with value: 0.07372723187125305 and parameters: {'model_type': 'gcn', 'hidden_dims': '[256, 128, 64]', 'dropout': 0.17642903067812282, 'batch_norm': True, 'lr': 0.0001512059340137304, 'weight_decay': 1.155160865388072e-05, 'epochs': 313, 'loss': 'mae', 'optimizer': 'adam', 'graph_mode': 'cutoff', 'cutoff': 0.8990117438901907, 'grm_norm': 'cosine_then_gcn', 'self_loops': True, 'use_snp_selection': False}. Best is trial 39 with value: 0.09449081425448297.
[I 2025-11-03 13:06:56,763] Trial 72 finished with value: 0.08180108124109499 and parameters: {'model_type': 'gcn', 'hidden_dims': '[256, 128, 64]', 'dropout': 0.14682859390409617, 'batch_norm': True, 'lr': 0.00011184197262487078, 'weight_decay': 4.8063236496631175e-05, 'epochs': 163, 'loss': 'mae', 'optimizer': 'adam', 'graph_mode': 'cutoff', 'cutoff': 0.7968883672743637, 'grm_norm': 'cosine_then_gcn', 'self_loops': True, 'use_snp_selection': False}. Best is trial 39 with value: 0.09449081425448297.
[I 2025-11-03 13:06:58,624] Trial 73 finished with value: 0.060727270462099865 and parameters: {'model_type': 'gcn', 'hidden_dims': '[256, 128, 64]', 'dropout': 0.2086743035865482, 'batch_norm': True, 'lr': 0.0002247982826751391, 'weight_decay': 4.5151998628583115e-05, 'epochs': 119, 'loss': 'mae', 'optimizer': 'adam', 'graph_mode': 'cutoff', 'cutoff': 0.7790901346008284, 'grm_norm': 'cosine_then_gcn', 'self_loops': True, 'use_snp_selection': False}. Best is trial 39 with value: 0.09449081425448297.
[I 2025-11-03 13:07:00,953] Trial 74 finished with value: 0.0752898261303302 and parameters: {'model_type': 'gcn', 'hidden_dims': '[256, 128, 64]', 'dropout': 0.12453409873269977, 'batch_norm': True, 'lr': 0.00031282838130986787, 'weight_decay': 2.6320478180176562e-05, 'epochs': 193, 'loss': 'mae', 'optimizer': 'adam', 'graph_mode': 'cutoff', 'cutoff': 0.8149203746949201, 'grm_norm': 'cosine_then_gcn', 'self_loops': True, 'use_snp_selection': False}. Best is trial 39 with value: 0.09449081425448297.
[I 2025-11-03 13:07:03,109] Trial 75 finished with value: 0.055293637927596846 and parameters: {'model_type': 'gcn', 'hidden_dims': '[256, 128, 64]', 'dropout': 0.1489172391283763, 'batch_norm': True, 'lr': 0.0001001487068102941, 'weight_decay': 0.00011937500589585305, 'epochs': 167, 'loss': 'mae', 'optimizer': 'adam', 'graph_mode': 'cutoff', 'cutoff': 0.7307975212730338, 'grm_norm': 'cosine_then_gcn', 'self_loops': True, 'use_snp_selection': False}. Best is trial 39 with value: 0.09449081425448297.
[I 2025-11-03 13:07:07,206] Trial 76 finished with value: 0.03869811021873193 and parameters: {'model_type': 'gcn', 'hidden_dims': '[512, 256]', 'dropout': 0.22522676470258512, 'batch_norm': True, 'lr': 3.0026713882992315e-05, 'weight_decay': 4.7506302604443316e-05, 'epochs': 321, 'loss': 'mae', 'optimizer': 'adam', 'graph_mode': 'cutoff', 'cutoff': 0.8458913378636194, 'grm_norm': 'gcn', 'self_loops': True, 'use_snp_selection': False}. Best is trial 39 with value: 0.09449081425448297.
[I 2025-11-03 13:07:11,437] Trial 77 finished with value: 0.05634412729103579 and parameters: {'model_type': 'gcn', 'hidden_dims': '[512, 64]', 'dropout': 0.1726336365104846, 'batch_norm': True, 'lr': 6.218566918595454e-05, 'weight_decay': 8.003144410632861e-05, 'epochs': 337, 'loss': 'mse', 'optimizer': 'adam', 'graph_mode': 'cutoff', 'cutoff': 0.647515025433675, 'grm_norm': 'cosine_then_gcn', 'self_loops': True, 'use_snp_selection': False}. Best is trial 39 with value: 0.09449081425448297.
[I 2025-11-03 13:07:15,769] Trial 78 finished with value: 0.03847970369077189 and parameters: {'model_type': 'gcn', 'hidden_dims': '[256, 128]', 'dropout': 0.18588937468598676, 'batch_norm': False, 'lr': 4.4385329245346775e-05, 'weight_decay': 0.00033503051977664376, 'epochs': 289, 'loss': 'mae', 'optimizer': 'adam', 'graph_mode': 'cutoff', 'cutoff': 0.7787273858723849, 'grm_norm': 'cosine_then_gcn', 'self_loops': False, 'use_snp_selection': True, 'num_snps': 52924}. Best is trial 39 with value: 0.09449081425448297.
[I 2025-11-03 13:07:18,677] Trial 79 finished with value: 0.055483896591413374 and parameters: {'model_type': 'gcn', 'hidden_dims': '[256, 128, 64]', 'dropout': 0.11906252663785227, 'batch_norm': True, 'lr': 8.583107138199714e-05, 'weight_decay': 1.9359481752994602e-05, 'epochs': 276, 'loss': 'mse', 'optimizer': 'adam', 'graph_mode': 'cutoff', 'cutoff': 0.6970534484503578, 'grm_norm': 'none', 'self_loops': True, 'use_snp_selection': False}. Best is trial 39 with value: 0.09449081425448297.
[I 2025-11-03 13:07:21,233] Trial 80 finished with value: 0.06376967457445094 and parameters: {'model_type': 'gcn', 'hidden_dims': '[512, 64]', 'dropout': 0.10156832919071063, 'batch_norm': True, 'lr': 0.00016588734118045333, 'weight_decay': 2.9261007653633932e-05, 'epochs': 142, 'loss': 'mae', 'optimizer': 'adam', 'graph_mode': 'cutoff', 'cutoff': 0.8574814679316591, 'grm_norm': 'gcn', 'self_loops': False, 'use_snp_selection': False}. Best is trial 39 with value: 0.09449081425448297.
[I 2025-11-03 13:07:23,153] Trial 81 finished with value: 0.09436135163598691 and parameters: {'model_type': 'gcn', 'hidden_dims': '[256, 128, 64]', 'dropout': 0.14652464883397334, 'batch_norm': True, 'lr': 0.00012439600306952408, 'weight_decay': 1.3771125442391594e-05, 'epochs': 126, 'loss': 'mae', 'optimizer': 'adam', 'graph_mode': 'cutoff', 'cutoff': 0.8995557383539171, 'grm_norm': 'cosine_then_gcn', 'self_loops': True, 'use_snp_selection': False}. Best is trial 39 with value: 0.09449081425448297.
[I 2025-11-03 13:07:25,039] Trial 82 finished with value: 0.06759049823316382 and parameters: {'model_type': 'gcn', 'hidden_dims': '[256, 128, 64]', 'dropout': 0.19820901876429756, 'batch_norm': True, 'lr': 0.00012613973769900759, 'weight_decay': 8.701805319668277e-06, 'epochs': 119, 'loss': 'mae', 'optimizer': 'adam', 'graph_mode': 'cutoff', 'cutoff': 0.8028389902551145, 'grm_norm': 'cosine_then_gcn', 'self_loops': True, 'use_snp_selection': False}. Best is trial 39 with value: 0.09449081425448297.
[I 2025-11-03 13:07:26,687] Trial 83 finished with value: 0.07381696317691906 and parameters: {'model_type': 'gcn', 'hidden_dims': '[256, 128, 64]', 'dropout': 0.16317660130249056, 'batch_norm': True, 'lr': 0.0001976678810402023, 'weight_decay': 5.8127822844341886e-05, 'epochs': 82, 'loss': 'mae', 'optimizer': 'adam', 'graph_mode': 'cutoff', 'cutoff': 0.8594808216885531, 'grm_norm': 'cosine_then_gcn', 'self_loops': True, 'use_snp_selection': False}. Best is trial 39 with value: 0.09449081425448297.
[I 2025-11-03 13:07:28,698] Trial 84 finished with value: 0.03687936012990627 and parameters: {'model_type': 'gcn', 'hidden_dims': '[256, 128, 64]', 'dropout': 0.5307910630980908, 'batch_norm': True, 'lr': 0.00014328812404317714, 'weight_decay': 1.481588493298051e-05, 'epochs': 140, 'loss': 'mae', 'optimizer': 'adam', 'graph_mode': 'cutoff', 'cutoff': 0.7442045374989474, 'grm_norm': 'cosine', 'self_loops': True, 'use_snp_selection': False}. Best is trial 39 with value: 0.09449081425448297.
[I 2025-11-03 13:07:31,408] Trial 85 finished with value: 0.05727853015910933 and parameters: {'model_type': 'gcn', 'hidden_dims': '[256, 128]', 'dropout': 0.43947707220205867, 'batch_norm': True, 'lr': 9.274705797924892e-05, 'weight_decay': 0.0001071974625341641, 'epochs': 300, 'loss': 'mae', 'optimizer': 'adam', 'graph_mode': 'cutoff', 'cutoff': 0.8594509451384741, 'grm_norm': 'cosine_then_gcn', 'self_loops': True, 'use_snp_selection': False}. Best is trial 39 with value: 0.09449081425448297.
[I 2025-11-03 13:07:33,866] Trial 86 finished with value: 0.09740689525741682 and parameters: {'model_type': 'gcn', 'hidden_dims': '[512, 64]', 'dropout': 0.1450394837069263, 'batch_norm': False, 'lr': 0.0001223226207198832, 'weight_decay': 1.0322265232004378e-05, 'epochs': 109, 'loss': 'mse', 'optimizer': 'adam', 'graph_mode': 'cutoff', 'cutoff': 0.5458643424239664, 'grm_norm': 'cosine_then_gcn', 'self_loops': True, 'use_snp_selection': True, 'num_snps': 21561}. Best is trial 86 with value: 0.09740689525741682.
[I 2025-11-03 13:07:36,226] Trial 87 finished with value: 0.05602242499231886 and parameters: {'model_type': 'gcn', 'hidden_dims': '[512, 64]', 'dropout': 0.14259557929607433, 'batch_norm': False, 'lr': 0.00023669877005655024, 'weight_decay': 1.0503846105046013e-05, 'epochs': 99, 'loss': 'mae', 'optimizer': 'adam', 'graph_mode': 'cutoff', 'cutoff': 0.5582295376315023, 'grm_norm': 'cosine_then_gcn', 'self_loops': False, 'use_snp_selection': True, 'num_snps': 19542}. Best is trial 86 with value: 0.09740689525741682.
[I 2025-11-03 13:07:38,177] Trial 88 finished with value: 0.025271393035292713 and parameters: {'model_type': 'gcn', 'hidden_dims': '[512, 64]', 'dropout': 0.2177593081137183, 'batch_norm': False, 'lr': 3.129853429166974e-06, 'weight_decay': 3.571857982295585e-06, 'epochs': 105, 'loss': 'mse', 'optimizer': 'adam', 'graph_mode': 'cutoff', 'cutoff': 0.5989315044296051, 'grm_norm': 'none', 'self_loops': True, 'use_snp_selection': True, 'num_snps': 11075}. Best is trial 86 with value: 0.09740689525741682.
[I 2025-11-03 13:07:40,689] Trial 89 finished with value: 0.03213115254923102 and parameters: {'model_type': 'gcn', 'hidden_dims': '[512, 64]', 'dropout': 0.47058521310283674, 'batch_norm': False, 'lr': 7.056415604346187e-05, 'weight_decay': 4.460310311339405e-06, 'epochs': 67, 'loss': 'mae', 'optimizer': 'adam', 'graph_mode': 'cutoff', 'cutoff': 0.525850365350947, 'grm_norm': 'cosine_then_gcn', 'self_loops': True, 'use_snp_selection': True, 'num_snps': 26037}. Best is trial 86 with value: 0.09740689525741682.
