[I 2025-11-03 15:29:15,202] Trial 140 finished with value: 0.09642873046147833 and parameters: {'model_type': 'graphsage', 'hidden_dims': '[128, 64]', 'dropout': 0.10873034431867795, 'batch_norm': True, 'lr': 0.0002022558298121321, 'weight_decay': 0.0001979037564245167, 'epochs': 343, 'loss': 'mse', 'optimizer': 'adam', 'graph_mode': 'cutoff', 'cutoff': 0.2693346484951815, 'grm_norm': 'none', 'self_loops': False, 'use_snp_selection': False}. Best is trial 129 with value: 0.12163089581621105.
[I 2025-11-03 15:29:17,376] Trial 141 finished with value: 0.10772736499143681 and parameters: {'model_type': 'graphsage', 'hidden_dims': '[128, 64]', 'dropout': 0.1519181807285223, 'batch_norm': True, 'lr': 0.0002732651485893087, 'weight_decay': 0.0001465640579397052, 'epochs': 292, 'loss': 'mse', 'optimizer': 'adam', 'graph_mode': 'cutoff', 'cutoff': 0.34496239576638205, 'grm_norm': 'none', 'self_loops': False, 'use_snp_selection': False}. Best is trial 129 with value: 0.12163089581621105.
[I 2025-11-03 15:29:19,587] Trial 142 finished with value: 0.1068779606811589 and parameters: {'model_type': 'graphsage', 'hidden_dims': '[128, 64]', 'dropout': 0.12537556929600313, 'batch_norm': True, 'lr': 0.00031351369003213204, 'weight_decay': 0.00024012456607790204, 'epochs': 305, 'loss': 'mse', 'optimizer': 'adam', 'graph_mode': 'cutoff', 'cutoff': 0.4079539268580192, 'grm_norm': 'none', 'self_loops': False, 'use_snp_selection': False}. Best is trial 129 with value: 0.12163089581621105.
[I 2025-11-03 15:29:21,722] Trial 143 finished with value: 0.09137095468738213 and parameters: {'model_type': 'graphsage', 'hidden_dims': '[128, 64]', 'dropout': 0.11513228855055432, 'batch_norm': True, 'lr': 0.0004442572749830544, 'weight_decay': 0.00039615989569361285, 'epochs': 286, 'loss': 'mse', 'optimizer': 'adam', 'graph_mode': 'cutoff', 'cutoff': 0.5145374310157799, 'grm_norm': 'none', 'self_loops': False, 'use_snp_selection': False}. Best is trial 129 with value: 0.12163089581621105.
[I 2025-11-03 15:29:23,227] Trial 144 finished with value: 0.0872266734238415 and parameters: {'model_type': 'graphsage', 'hidden_dims': '[128, 64]', 'dropout': 0.13577367715135882, 'batch_norm': True, 'lr': 0.0005313298143714584, 'weight_decay': 0.00046406954995989566, 'epochs': 99, 'loss': 'mse', 'optimizer': 'adam', 'graph_mode': 'cutoff', 'cutoff': 0.4440530404109119, 'grm_norm': 'gcn', 'self_loops': False, 'use_snp_selection': False}. Best is trial 129 with value: 0.12163089581621105.
[I 2025-11-03 15:29:25,649] Trial 145 finished with value: 0.10121733186549228 and parameters: {'model_type': 'graphsage', 'hidden_dims': '[256, 128]', 'dropout': 0.17190458422453125, 'batch_norm': True, 'lr': 0.00034869046418036913, 'weight_decay': 0.00030480378882318145, 'epochs': 275, 'loss': 'mse', 'optimizer': 'adam', 'graph_mode': 'cutoff', 'cutoff': 0.46519913150682984, 'grm_norm': 'none', 'self_loops': False, 'use_snp_selection': False}. Best is trial 129 with value: 0.12163089581621105.
[I 2025-11-03 15:29:27,403] Trial 146 finished with value: 0.099593242724751 and parameters: {'model_type': 'graphsage', 'hidden_dims': '[128, 64]', 'dropout': 0.21848484772914414, 'batch_norm': True, 'lr': 0.0006321655960116993, 'weight_decay': 0.00019541296053759047, 'epochs': 168, 'loss': 'mse', 'optimizer': 'adam', 'graph_mode': 'cutoff', 'cutoff': 0.3839378221971149, 'grm_norm': 'cosine', 'self_loops': False, 'use_snp_selection': False}. Best is trial 129 with value: 0.12163089581621105.
[I 2025-11-03 15:29:31,313] Trial 147 finished with value: 0.10193183514208459 and parameters: {'model_type': 'graphsage', 'hidden_dims': '[512, 256]', 'dropout': 0.2561772343299409, 'batch_norm': True, 'lr': 0.0008654584034411547, 'weight_decay': 0.00015304173671029233, 'epochs': 296, 'loss': 'mse', 'optimizer': 'adam', 'graph_mode': 'cutoff', 'cutoff': 0.5548809639540463, 'grm_norm': 'cosine_then_gcn', 'self_loops': False, 'use_snp_selection': False}. Best is trial 129 with value: 0.12163089581621105.
[I 2025-11-03 15:29:33,644] Trial 148 finished with value: 0.09830391561218864 and parameters: {'model_type': 'graphsage', 'hidden_dims': '[128, 64]', 'dropout': 0.22549249679020458, 'batch_norm': True, 'lr': 0.00046133564252950297, 'weight_decay': 0.0005471247457513126, 'epochs': 331, 'loss': 'mse', 'optimizer': 'adam', 'graph_mode': 'cutoff', 'cutoff': 0.2997860057214352, 'grm_norm': 'gcn', 'self_loops': True, 'use_snp_selection': False}. Best is trial 129 with value: 0.12163089581621105.
[I 2025-11-03 15:29:35,839] Trial 149 finished with value: 0.08159554212249838 and parameters: {'model_type': 'graphsage', 'hidden_dims': '[128, 64]', 'dropout': 0.2014066788091108, 'batch_norm': True, 'lr': 0.0007819896607716769, 'weight_decay': 0.00021896507506319866, 'epochs': 301, 'loss': 'mse', 'optimizer': 'adam', 'graph_mode': 'cutoff', 'cutoff': 0.4291065825675278, 'grm_norm': 'none', 'self_loops': False, 'use_snp_selection': False}. Best is trial 129 with value: 0.12163089581621105.
[I 2025-11-03 15:29:38,314] Trial 0 finished with value: -0.0324312943384496 and parameters: {'model_type': 'graphsage', 'hidden_dims': '[128, 64]', 'dropout': 0.199031432379812, 'batch_norm': True, 'lr': 1.8408544111075837e-06, 'weight_decay': 5.5136510071208614e-05, 'epochs': 336, 'loss': 'mae', 'optimizer': 'adam', 'graph_mode': 'knn', 'source': 'grm', 'knn_k': 8, 'weighted_edges': True, 'symmetrize_mode': 'mutual', 'use_snp_selection': False}. Best is trial 0 with value: -0.0324312943384496.
[I 2025-11-03 15:29:39,834] Trial 1 finished with value: 0.04506357478074916 and parameters: {'model_type': 'graphsage', 'hidden_dims': '[128, 64]', 'dropout': 0.40051947670227217, 'batch_norm': True, 'lr': 0.0005320428882732732, 'weight_decay': 1.89210117736594e-06, 'epochs': 68, 'loss': 'mse', 'optimizer': 'adam', 'graph_mode': 'knn', 'source': 'grm', 'knn_k': 7, 'weighted_edges': True, 'symmetrize_mode': 'union', 'use_snp_selection': False}. Best is trial 1 with value: 0.04506357478074916.
[I 2025-11-03 15:29:42,312] Trial 2 finished with value: 0.05026528446745232 and parameters: {'model_type': 'graphsage', 'hidden_dims': '[256, 128]', 'dropout': 0.5105528289184642, 'batch_norm': False, 'lr': 0.0006804279372404962, 'weight_decay': 0.0008922815224257085, 'epochs': 181, 'loss': 'mse', 'optimizer': 'adam', 'graph_mode': 'cutoff', 'cutoff': 0.5741905641612706, 'grm_norm': 'gcn', 'self_loops': False, 'use_snp_selection': True, 'num_snps': 26910}. Best is trial 2 with value: 0.05026528446745232.
[I 2025-11-03 15:29:44,894] Trial 3 finished with value: 0.03948571584220262 and parameters: {'model_type': 'graphsage', 'hidden_dims': '[256, 128, 64]', 'dropout': 0.5390483213624292, 'batch_norm': False, 'lr': 3.4705625989073525e-05, 'weight_decay': 2.4623319020131338e-05, 'epochs': 121, 'loss': 'mse', 'optimizer': 'adam', 'graph_mode': 'knn', 'source': 'grm', 'knn_k': 6, 'weighted_edges': False, 'symmetrize_mode': 'mutual', 'use_snp_selection': True, 'num_snps': 30713}. Best is trial 2 with value: 0.05026528446745232.
[I 2025-11-03 15:29:47,426] Trial 4 finished with value: 0.015460662524596205 and parameters: {'model_type': 'graphsage', 'hidden_dims': '[128, 64]', 'dropout': 0.13404863676897502, 'batch_norm': False, 'lr': 0.0001431556295367288, 'weight_decay': 2.2084517750726675e-05, 'epochs': 51, 'loss': 'mae', 'optimizer': 'adam', 'graph_mode': 'cutoff', 'cutoff': 0.6714268476993044, 'grm_norm': 'none', 'self_loops': False, 'use_snp_selection': True, 'num_snps': 45645}. Best is trial 2 with value: 0.05026528446745232.
[I 2025-11-03 15:29:50,597] Trial 5 finished with value: -0.006448379891465003 and parameters: {'model_type': 'graphsage', 'hidden_dims': '[256, 128]', 'dropout': 0.42253606323412096, 'batch_norm': False, 'lr': 4.238630400638805e-05, 'weight_decay': 8.074086040046576e-07, 'epochs': 158, 'loss': 'mae', 'optimizer': 'adam', 'graph_mode': 'knn', 'source': 'grm', 'knn_k': 1, 'weighted_edges': False, 'symmetrize_mode': 'mutual', 'use_snp_selection': True, 'num_snps': 43113}. Best is trial 2 with value: 0.05026528446745232.
[I 2025-11-03 15:29:54,657] Trial 6 finished with value: 0.04142595909736527 and parameters: {'model_type': 'graphsage', 'hidden_dims': '[512, 256]', 'dropout': 0.3534893146320237, 'batch_norm': True, 'lr': 0.000251307964226932, 'weight_decay': 1.821819791794022e-05, 'epochs': 223, 'loss': 'mae', 'optimizer': 'adam', 'graph_mode': 'knn', 'source': 'grm', 'knn_k': 1, 'weighted_edges': True, 'symmetrize_mode': 'mutual', 'use_snp_selection': False}. Best is trial 2 with value: 0.05026528446745232.
[I 2025-11-03 15:29:58,361] Trial 7 finished with value: 0.04996804173334291 and parameters: {'model_type': 'graphsage', 'hidden_dims': '[512, 256]', 'dropout': 0.1105825955860775, 'batch_norm': True, 'lr': 2.374338412754043e-05, 'weight_decay': 1.1284721123340274e-05, 'epochs': 190, 'loss': 'mse', 'optimizer': 'adam', 'graph_mode': 'cutoff', 'cutoff': 0.719872204109604, 'grm_norm': 'gcn', 'self_loops': False, 'use_snp_selection': False}. Best is trial 2 with value: 0.05026528446745232.
[I 2025-11-03 15:30:01,472] Trial 8 finished with value: 0.04316512422284193 and parameters: {'model_type': 'graphsage', 'hidden_dims': '[512, 128]', 'dropout': 0.5066580418354021, 'batch_norm': True, 'lr': 0.00039213678276659976, 'weight_decay': 3.43655320802934e-06, 'epochs': 120, 'loss': 'mse', 'optimizer': 'adam', 'graph_mode': 'cutoff', 'cutoff': 0.34923059576505366, 'grm_norm': 'cosine', 'self_loops': True, 'use_snp_selection': False}. Best is trial 2 with value: 0.05026528446745232.
[I 2025-11-03 15:30:03,499] Trial 9 finished with value: 0.045172455584782174 and parameters: {'model_type': 'graphsage', 'hidden_dims': '[512, 256]', 'dropout': 0.301734920240333, 'batch_norm': False, 'lr': 6.650961854953448e-06, 'weight_decay': 6.861575656590315e-05, 'epochs': 150, 'loss': 'mae', 'optimizer': 'adam', 'graph_mode': 'cutoff', 'cutoff': 0.2857569870061939, 'grm_norm': 'cosine_then_gcn', 'self_loops': False, 'use_snp_selection': True, 'num_snps': 12722}. Best is trial 2 with value: 0.05026528446745232.
[I 2025-11-03 15:30:05,898] Trial 10 finished with value: -0.00021614356497068487 and parameters: {'model_type': 'graphsage', 'hidden_dims': '[256, 128]', 'dropout': 0.5885461262002587, 'batch_norm': False, 'lr': 9.558525641285997e-05, 'weight_decay': 0.0005507714381092994, 'epochs': 275, 'loss': 'mse', 'optimizer': 'adam', 'graph_mode': 'cutoff', 'cutoff': 0.8740100033033124, 'grm_norm': 'gcn', 'self_loops': True, 'use_snp_selection': True, 'num_snps': 16208}. Best is trial 2 with value: 0.05026528446745232.
[I 2025-11-03 15:30:09,953] Trial 11 finished with value: 0.04377429477142935 and parameters: {'model_type': 'graphsage', 'hidden_dims': '[512, 64]', 'dropout': 0.21793782338681206, 'batch_norm': True, 'lr': 8.84080837161809e-06, 'weight_decay': 1.0655358607693621e-07, 'epochs': 229, 'loss': 'mse', 'optimizer': 'adam', 'graph_mode': 'cutoff', 'cutoff': 0.6381011026671695, 'grm_norm': 'gcn', 'self_loops': False, 'use_snp_selection': False}. Best is trial 2 with value: 0.05026528446745232.
[I 2025-11-03 15:30:15,162] Trial 12 finished with value: 0.02663205200707061 and parameters: {'model_type': 'graphsage', 'hidden_dims': '[512, 256]', 'dropout': 0.4756977406231021, 'batch_norm': True, 'lr': 0.000888309368450138, 'weight_decay': 0.0007127978646614935, 'epochs': 187, 'loss': 'mse', 'optimizer': 'adam', 'graph_mode': 'cutoff', 'cutoff': 0.5150825229446039, 'grm_norm': 'gcn', 'self_loops': False, 'use_snp_selection': True, 'num_snps': 58791}. Best is trial 2 with value: 0.05026528446745232.
[I 2025-11-03 15:30:17,886] Trial 13 finished with value: 0.040733865916458084 and parameters: {'model_type': 'graphsage', 'hidden_dims': '[256, 128]', 'dropout': 0.27844034435124754, 'batch_norm': False, 'lr': 1.3114161153261625e-05, 'weight_decay': 0.0001518235200729782, 'epochs': 267, 'loss': 'mse', 'optimizer': 'adam', 'graph_mode': 'cutoff', 'cutoff': 0.828571404652888, 'grm_norm': 'gcn', 'self_loops': False, 'use_snp_selection': False}. Best is trial 2 with value: 0.05026528446745232.
[I 2025-11-03 15:30:19,785] Trial 14 finished with value: 0.009117819544791395 and parameters: {'model_type': 'graphsage', 'hidden_dims': '[256, 128, 64]', 'dropout': 0.1062256058813002, 'batch_norm': False, 'lr': 2.3778797293575146e-06, 'weight_decay': 1.6237969896107907e-07, 'epochs': 198, 'loss': 'mse', 'optimizer': 'adam', 'graph_mode': 'cutoff', 'cutoff': 0.5176091002879237, 'grm_norm': 'gcn', 'self_loops': False, 'use_snp_selection': True, 'num_snps': 2338}. Best is trial 2 with value: 0.05026528446745232.
[I 2025-11-03 15:30:24,213] Trial 15 finished with value: 0.05128524634064799 and parameters: {'model_type': 'graphsage', 'hidden_dims': '[512, 64]', 'dropout': 0.5949512611966763, 'batch_norm': True, 'lr': 7.22632211160111e-05, 'weight_decay': 0.0001762917469298768, 'epochs': 270, 'loss': 'mse', 'optimizer': 'adam', 'graph_mode': 'cutoff', 'cutoff': 0.7136471235620301, 'grm_norm': 'cosine', 'self_loops': False, 'use_snp_selection': False}. Best is trial 15 with value: 0.05128524634064799.
[I 2025-11-03 15:30:29,406] Trial 16 finished with value: 0.052214761853149355 and parameters: {'model_type': 'graphsage', 'hidden_dims': '[512, 64]', 'dropout': 0.5901987633066186, 'batch_norm': True, 'lr': 0.00014480884863926242, 'weight_decay': 0.00018357578514959844, 'epochs': 347, 'loss': 'mse', 'optimizer': 'adam', 'graph_mode': 'cutoff', 'cutoff': 0.43357126852662536, 'grm_norm': 'cosine', 'self_loops': True, 'use_snp_selection': False}. Best is trial 16 with value: 0.052214761853149355.
[I 2025-11-03 15:30:34,393] Trial 17 finished with value: 0.010615060097921077 and parameters: {'model_type': 'graphsage', 'hidden_dims': '[512, 64]', 'dropout': 0.5928746349572604, 'batch_norm': True, 'lr': 7.319882891783797e-05, 'weight_decay': 0.00017722218731587998, 'epochs': 332, 'loss': 'mse', 'optimizer': 'adam', 'graph_mode': 'cutoff', 'cutoff': 0.41461087487564086, 'grm_norm': 'cosine', 'self_loops': True, 'use_snp_selection': False}. Best is trial 16 with value: 0.052214761853149355.
[I 2025-11-03 15:30:39,288] Trial 18 finished with value: 0.028620708268935074 and parameters: {'model_type': 'graphsage', 'hidden_dims': '[512, 64]', 'dropout': 0.4530182576853596, 'batch_norm': True, 'lr': 0.00016964646564976765, 'weight_decay': 0.0002038034231978222, 'epochs': 298, 'loss': 'mse', 'optimizer': 'adam', 'graph_mode': 'cutoff', 'cutoff': 0.2042761276710801, 'grm_norm': 'cosine', 'self_loops': True, 'use_snp_selection': False}. Best is trial 16 with value: 0.052214761853149355.
[I 2025-11-03 15:30:43,903] Trial 19 finished with value: 0.013722818798058253 and parameters: {'model_type': 'graphsage', 'hidden_dims': '[512, 64]', 'dropout': 0.5678971085583604, 'batch_norm': True, 'lr': 6.513389774570146e-05, 'weight_decay': 4.940939928818347e-06, 'epochs': 297, 'loss': 'mse', 'optimizer': 'adam', 'graph_mode': 'cutoff', 'cutoff': 0.7385445279851665, 'grm_norm': 'cosine', 'self_loops': True, 'use_snp_selection': False}. Best is trial 16 with value: 0.052214761853149355.
[I 2025-11-03 15:30:49,067] Trial 20 finished with value: 0.04432286452197601 and parameters: {'model_type': 'graphsage', 'hidden_dims': '[512, 64]', 'dropout': 0.5464699517347481, 'batch_norm': True, 'lr': 0.00028403407906676557, 'weight_decay': 0.00031981986362457213, 'epochs': 346, 'loss': 'mse', 'optimizer': 'adam', 'graph_mode': 'cutoff', 'cutoff': 0.434935239317374, 'grm_norm': 'cosine', 'self_loops': True, 'use_snp_selection': False}. Best is trial 16 with value: 0.052214761853149355.
[I 2025-11-03 15:30:52,257] Trial 21 finished with value: 0.015133545514730071 and parameters: {'model_type': 'graphsage', 'hidden_dims': '[512, 128]', 'dropout': 0.5157394886322773, 'batch_norm': False, 'lr': 0.0008500785716167921, 'weight_decay': 0.0008568378972394753, 'epochs': 243, 'loss': 'mse', 'optimizer': 'adam', 'graph_mode': 'cutoff', 'cutoff': 0.5771477522100064, 'grm_norm': 'none', 'self_loops': False, 'use_snp_selection': True, 'num_snps': 28150}. Best is trial 16 with value: 0.052214761853149355.
[I 2025-11-03 15:30:55,203] Trial 22 finished with value: 0.0488507697343129 and parameters: {'model_type': 'graphsage', 'hidden_dims': '[256, 128]', 'dropout': 0.5994921570093881, 'batch_norm': True, 'lr': 0.00016430825967337747, 'weight_decay': 7.926152183478548e-05, 'epochs': 305, 'loss': 'mse', 'optimizer': 'adam', 'graph_mode': 'cutoff', 'cutoff': 0.5945196868133478, 'grm_norm': 'cosine_then_gcn', 'self_loops': False, 'use_snp_selection': False}. Best is trial 16 with value: 0.052214761853149355.
[I 2025-11-03 15:30:58,041] Trial 23 finished with value: 0.020416693793769054 and parameters: {'model_type': 'graphsage', 'hidden_dims': '[512, 64]', 'dropout': 0.4881942691423198, 'batch_norm': False, 'lr': 0.0004138035917894054, 'weight_decay': 0.00034452010261132814, 'epochs': 271, 'loss': 'mse', 'optimizer': 'adam', 'graph_mode': 'cutoff', 'cutoff': 0.44550539147005574, 'grm_norm': 'cosine', 'self_loops': True, 'use_snp_selection': True, 'num_snps': 21600}. Best is trial 16 with value: 0.052214761853149355.
[I 2025-11-03 15:31:02,252] Trial 24 finished with value: 0.04001636014665238 and parameters: {'model_type': 'graphsage', 'hidden_dims': '[512, 64]', 'dropout': 0.540360545692928, 'batch_norm': True, 'lr': 1.8963427099496003e-05, 'weight_decay': 9.906346864712294e-05, 'epochs': 246, 'loss': 'mse', 'optimizer': 'adam', 'graph_mode': 'cutoff', 'cutoff': 0.7657085401375116, 'grm_norm': 'cosine', 'self_loops': False, 'use_snp_selection': False}. Best is trial 16 with value: 0.052214761853149355.
[I 2025-11-03 15:31:05,233] Trial 25 finished with value: 0.023346692343681384 and parameters: {'model_type': 'graphsage', 'hidden_dims': '[256, 128]', 'dropout': 0.44217896042275084, 'batch_norm': True, 'lr': 9.342369461222095e-05, 'weight_decay': 0.00041010668884450827, 'epochs': 311, 'loss': 'mse', 'optimizer': 'adam', 'graph_mode': 'cutoff', 'cutoff': 0.49427968996705945, 'grm_norm': 'cosine', 'self_loops': False, 'use_snp_selection': False}. Best is trial 16 with value: 0.052214761853149355.
[I 2025-11-03 15:31:09,261] Trial 26 finished with value: 0.01678536240341098 and parameters: {'model_type': 'graphsage', 'hidden_dims': '[512, 64]', 'dropout': 0.36873432358875735, 'batch_norm': False, 'lr': 4.5061578441716185e-05, 'weight_decay': 4.0636211471441204e-05, 'epochs': 156, 'loss': 'mae', 'optimizer': 'adam', 'graph_mode': 'knn', 'source': 'grm', 'knn_k': 3, 'weighted_edges': False, 'symmetrize_mode': 'union', 'use_snp_selection': True, 'num_snps': 43800}. Best is trial 16 with value: 0.052214761853149355.
[I 2025-11-03 15:31:13,183] Trial 27 finished with value: 0.015866370510840985 and parameters: {'model_type': 'graphsage', 'hidden_dims': '[512, 128]', 'dropout': 0.5555956974929349, 'batch_norm': True, 'lr': 0.0006201741366930885, 'weight_decay': 0.0001947428824357868, 'epochs': 220, 'loss': 'mse', 'optimizer': 'adam', 'graph_mode': 'cutoff', 'cutoff': 0.6419045603377636, 'grm_norm': 'none', 'self_loops': True, 'use_snp_selection': False}. Best is trial 16 with value: 0.052214761853149355.
[I 2025-11-03 15:31:15,616] Trial 28 finished with value: 0.02870943593381055 and parameters: {'model_type': 'graphsage', 'hidden_dims': '[256, 128, 64]', 'dropout': 0.5047625073139225, 'batch_norm': False, 'lr': 0.0002397045260916638, 'weight_decay': 0.0005380512766778791, 'epochs': 316, 'loss': 'mse', 'optimizer': 'adam', 'graph_mode': 'cutoff', 'cutoff': 0.3569784715855907, 'grm_norm': 'cosine_then_gcn', 'self_loops': False, 'use_snp_selection': True, 'num_snps': 3079}. Best is trial 16 with value: 0.052214761853149355.
[I 2025-11-03 15:31:18,787] Trial 29 finished with value: 0.028964488507714905 and parameters: {'model_type': 'graphsage', 'hidden_dims': '[128, 64]', 'dropout': 0.5728882690163566, 'batch_norm': True, 'lr': 0.00012279939567233448, 'weight_decay': 3.9653575645788376e-05, 'epochs': 332, 'loss': 'mae', 'optimizer': 'adam', 'graph_mode': 'knn', 'source': 'grm', 'knn_k': 10, 'weighted_edges': True, 'symmetrize_mode': 'union', 'use_snp_selection': False}. Best is trial 16 with value: 0.052214761853149355.
[I 2025-11-03 15:31:21,453] Trial 30 finished with value: -0.014564359046723905 and parameters: {'model_type': 'graphsage', 'hidden_dims': '[256, 128]', 'dropout': 0.4729361819306964, 'batch_norm': True, 'lr': 1.4562785383138401e-06, 'weight_decay': 0.00012263643851095817, 'epochs': 261, 'loss': 'mse', 'optimizer': 'adam', 'graph_mode': 'cutoff', 'cutoff': 0.5708852465138943, 'grm_norm': 'cosine', 'self_loops': True, 'use_snp_selection': False}. Best is trial 16 with value: 0.052214761853149355.
[I 2025-11-03 15:31:25,134] Trial 31 finished with value: 0.02116751472976473 and parameters: {'model_type': 'graphsage', 'hidden_dims': '[512, 256]', 'dropout': 0.2778647813434486, 'batch_norm': True, 'lr': 2.1357631846332107e-05, 'weight_decay': 0.000978454542486614, 'epochs': 191, 'loss': 'mse', 'optimizer': 'adam', 'graph_mode': 'cutoff', 'cutoff': 0.7407419450352679, 'grm_norm': 'gcn', 'self_loops': False, 'use_snp_selection': False}. Best is trial 16 with value: 0.052214761853149355.
[I 2025-11-03 15:31:28,638] Trial 32 finished with value: 0.013185840807379003 and parameters: {'model_type': 'graphsage', 'hidden_dims': '[512, 256]', 'dropout': 0.15510252339402444, 'batch_norm': True, 'lr': 4.586586106157188e-06, 'weight_decay': 8.386121713082529e-07, 'epochs': 172, 'loss': 'mse', 'optimizer': 'adam', 'graph_mode': 'cutoff', 'cutoff': 0.6739953370745334, 'grm_norm': 'gcn', 'self_loops': False, 'use_snp_selection': False}. Best is trial 16 with value: 0.052214761853149355.
