[I 2025-11-03 14:01:24,941] Trial 85 finished with value: 0.06939613675235286 and parameters: {'model_type': 'gcn', 'hidden_dims': '[512, 128]', 'dropout': 0.434913312828462, 'batch_norm': False, 'lr': 0.0006778174927198764, 'weight_decay': 7.246644650542767e-06, 'epochs': 330, 'loss': 'mae', 'optimizer': 'adam', 'graph_mode': 'cutoff', 'cutoff': 0.4235555883179968, 'grm_norm': 'cosine', 'self_loops': True, 'use_snp_selection': True, 'num_snps': 26755}. Best is trial 47 with value: 0.08946651587739919.
[I 2025-11-03 14:01:27,967] Trial 86 finished with value: 0.0017327943407218123 and parameters: {'model_type': 'gcn', 'hidden_dims': '[512, 128]', 'dropout': 0.3673739586333876, 'batch_norm': False, 'lr': 0.000695822937181236, 'weight_decay': 1.3773506026420743e-07, 'epochs': 323, 'loss': 'mae', 'optimizer': 'adam', 'graph_mode': 'cutoff', 'cutoff': 0.6111301053586484, 'grm_norm': 'none', 'self_loops': True, 'use_snp_selection': True, 'num_snps': 27135}. Best is trial 47 with value: 0.08946651587739919.
[I 2025-11-03 14:01:31,380] Trial 87 finished with value: 0.010333635739344479 and parameters: {'model_type': 'gcn', 'hidden_dims': '[512, 128]', 'dropout': 0.4362465435407178, 'batch_norm': False, 'lr': 0.0004745834065616149, 'weight_decay': 6.250268368779624e-06, 'epochs': 332, 'loss': 'mse', 'optimizer': 'adam', 'graph_mode': 'cutoff', 'cutoff': 0.5409378257667186, 'grm_norm': 'cosine', 'self_loops': True, 'use_snp_selection': True, 'num_snps': 33881}. Best is trial 47 with value: 0.08946651587739919.
[I 2025-11-03 14:01:33,500] Trial 88 finished with value: 0.006797904159632443 and parameters: {'model_type': 'gcn', 'hidden_dims': '[512, 64]', 'dropout': 0.5006931714277646, 'batch_norm': False, 'lr': 0.0005721393392431755, 'weight_decay': 0.0009456817780415135, 'epochs': 115, 'loss': 'mae', 'optimizer': 'adam', 'graph_mode': 'cutoff', 'cutoff': 0.36561416300437133, 'grm_norm': 'cosine', 'self_loops': True, 'use_snp_selection': True, 'num_snps': 22963}. Best is trial 47 with value: 0.08946651587739919.
[I 2025-11-03 14:01:35,194] Trial 89 finished with value: 0.02338829923723906 and parameters: {'model_type': 'gcn', 'hidden_dims': '[512, 256]', 'dropout': 0.38922974673749483, 'batch_norm': False, 'lr': 0.000884875671475277, 'weight_decay': 2.455319027760351e-06, 'epochs': 166, 'loss': 'mae', 'optimizer': 'adam', 'graph_mode': 'cutoff', 'cutoff': 0.4760314800090732, 'grm_norm': 'cosine', 'self_loops': True, 'use_snp_selection': True, 'num_snps': 10182}. Best is trial 47 with value: 0.08946651587739919.
[I 2025-11-03 14:01:38,142] Trial 90 finished with value: -0.009052936828656717 and parameters: {'model_type': 'gcn', 'hidden_dims': '[512, 128]', 'dropout': 0.4099979580578225, 'batch_norm': False, 'lr': 0.00036217908117534126, 'weight_decay': 2.840135965955625e-05, 'epochs': 302, 'loss': 'mae', 'optimizer': 'adam', 'graph_mode': 'cutoff', 'cutoff': 0.3244609103126335, 'grm_norm': 'none', 'self_loops': True, 'use_snp_selection': True, 'num_snps': 27882}. Best is trial 47 with value: 0.08946651587739919.
[I 2025-11-03 14:01:40,663] Trial 91 finished with value: 0.05626188724405418 and parameters: {'model_type': 'gcn', 'hidden_dims': '[512, 128]', 'dropout': 0.4614403465049576, 'batch_norm': False, 'lr': 0.0002560505803744319, 'weight_decay': 1.1880799827724708e-05, 'epochs': 279, 'loss': 'mae', 'optimizer': 'adam', 'graph_mode': 'cutoff', 'cutoff': 0.42710908120805535, 'grm_norm': 'cosine', 'self_loops': True, 'use_snp_selection': True, 'num_snps': 20882}. Best is trial 47 with value: 0.08946651587739919.
[I 2025-11-03 14:01:43,023] Trial 92 finished with value: 0.04722611556536839 and parameters: {'model_type': 'gcn', 'hidden_dims': '[512, 128]', 'dropout': 0.4809630933235639, 'batch_norm': False, 'lr': 0.00029742716456473305, 'weight_decay': 1.7107591264175713e-05, 'epochs': 318, 'loss': 'mae', 'optimizer': 'adam', 'graph_mode': 'cutoff', 'cutoff': 0.4084181867735008, 'grm_norm': 'cosine', 'self_loops': True, 'use_snp_selection': True, 'num_snps': 15876}. Best is trial 47 with value: 0.08946651587739919.
[I 2025-11-03 14:01:45,489] Trial 93 finished with value: 0.02816013712725384 and parameters: {'model_type': 'gcn', 'hidden_dims': '[512, 128]', 'dropout': 0.4460603755865125, 'batch_norm': False, 'lr': 0.00047020080236586596, 'weight_decay': 1.4264769789077375e-05, 'epochs': 298, 'loss': 'mae', 'optimizer': 'adam', 'graph_mode': 'cutoff', 'cutoff': 0.49159266219802955, 'grm_norm': 'cosine', 'self_loops': True, 'use_snp_selection': True, 'num_snps': 18981}. Best is trial 47 with value: 0.08946651587739919.
[I 2025-11-03 14:01:48,392] Trial 94 finished with value: -0.008659385365894088 and parameters: {'model_type': 'gcn', 'hidden_dims': '[512, 128]', 'dropout': 0.4707982567153824, 'batch_norm': False, 'lr': 7.687196318789903e-06, 'weight_decay': 1.9486824321696953e-07, 'epochs': 339, 'loss': 'mae', 'optimizer': 'adam', 'graph_mode': 'cutoff', 'cutoff': 0.45279433768362404, 'grm_norm': 'cosine', 'self_loops': True, 'use_snp_selection': True, 'num_snps': 25853}. Best is trial 47 with value: 0.08946651587739919.
[I 2025-11-03 14:01:50,962] Trial 95 finished with value: 0.017906795380512774 and parameters: {'model_type': 'gcn', 'hidden_dims': '[128, 64]', 'dropout': 0.427925348273081, 'batch_norm': False, 'lr': 0.000224733250972596, 'weight_decay': 1.0089429045364788e-07, 'epochs': 309, 'loss': 'mae', 'optimizer': 'adam', 'graph_mode': 'knn', 'source': 'grm', 'knn_k': 5, 'weighted_edges': True, 'symmetrize_mode': 'union', 'use_snp_selection': True, 'num_snps': 29246}. Best is trial 47 with value: 0.08946651587739919.
[I 2025-11-03 14:01:53,256] Trial 96 finished with value: 0.053658042096125284 and parameters: {'model_type': 'gcn', 'hidden_dims': '[512, 128]', 'dropout': 0.3399677829654657, 'batch_norm': False, 'lr': 0.0007725322175479435, 'weight_decay': 2.3162109955940792e-05, 'epochs': 200, 'loss': 'mae', 'optimizer': 'adam', 'graph_mode': 'cutoff', 'cutoff': 0.40193831392844986, 'grm_norm': 'gcn', 'self_loops': True, 'use_snp_selection': True, 'num_snps': 22489}. Best is trial 47 with value: 0.08946651587739919.
[I 2025-11-03 14:01:55,961] Trial 97 finished with value: 0.04285090959745524 and parameters: {'model_type': 'gcn', 'hidden_dims': '[128, 64]', 'dropout': 0.3125796916512039, 'batch_norm': False, 'lr': 1.075187584608377e-05, 'weight_decay': 1.044639442446652e-05, 'epochs': 330, 'loss': 'mae', 'optimizer': 'adam', 'graph_mode': 'cutoff', 'cutoff': 0.2722474649942721, 'grm_norm': 'cosine_then_gcn', 'self_loops': True, 'use_snp_selection': True, 'num_snps': 32792}. Best is trial 47 with value: 0.08946651587739919.
[I 2025-11-03 14:01:58,331] Trial 98 finished with value: -0.009358461887144533 and parameters: {'model_type': 'gcn', 'hidden_dims': '[256, 128, 64]', 'dropout': 0.4967338788629516, 'batch_norm': False, 'lr': 0.00041283834986174207, 'weight_decay': 3.967980059959945e-06, 'epochs': 258, 'loss': 'mae', 'optimizer': 'adam', 'graph_mode': 'knn', 'source': 'grm', 'knn_k': 6, 'weighted_edges': False, 'symmetrize_mode': 'union', 'use_snp_selection': True, 'num_snps': 17521}. Best is trial 47 with value: 0.08946651587739919.
[I 2025-11-03 14:02:00,641] Trial 99 finished with value: -0.00651855958571497 and parameters: {'model_type': 'gcn', 'hidden_dims': '[128, 64]', 'dropout': 0.5083000091818148, 'batch_norm': False, 'lr': 0.0001500791988310803, 'weight_decay': 3.2644637636942294e-07, 'epochs': 320, 'loss': 'mae', 'optimizer': 'adam', 'graph_mode': 'cutoff', 'cutoff': 0.3236665676711614, 'grm_norm': 'cosine', 'self_loops': False, 'use_snp_selection': True, 'num_snps': 21555}. Best is trial 47 with value: 0.08946651587739919.
[I 2025-11-03 14:02:03,394] Trial 100 finished with value: 0.014713709026240343 and parameters: {'model_type': 'gcn', 'hidden_dims': '[512, 128]', 'dropout': 0.4426231142635083, 'batch_norm': False, 'lr': 0.0005789300204926165, 'weight_decay': 6.794116976236994e-06, 'epochs': 95, 'loss': 'mse', 'optimizer': 'adam', 'graph_mode': 'cutoff', 'cutoff': 0.3683218660936208, 'grm_norm': 'cosine_then_gcn', 'self_loops': True, 'use_snp_selection': True, 'num_snps': 41020}. Best is trial 47 with value: 0.08946651587739919.
[I 2025-11-03 14:02:05,769] Trial 101 finished with value: 0.041676394301260876 and parameters: {'model_type': 'gcn', 'hidden_dims': '[512, 128]', 'dropout': 0.4590792585710677, 'batch_norm': False, 'lr': 0.00022991017910963237, 'weight_decay': 4.7486726507272185e-07, 'epochs': 288, 'loss': 'mae', 'optimizer': 'adam', 'graph_mode': 'cutoff', 'cutoff': 0.5217467260967695, 'grm_norm': 'cosine', 'self_loops': True, 'use_snp_selection': True, 'num_snps': 18497}. Best is trial 47 with value: 0.08946651587739919.
[I 2025-11-03 14:02:09,026] Trial 102 finished with value: -0.002467006178379359 and parameters: {'model_type': 'gcn', 'hidden_dims': '[512, 128]', 'dropout': 0.47376028650692215, 'batch_norm': False, 'lr': 0.00019870086081957258, 'weight_decay': 1.3602068649572026e-07, 'epochs': 294, 'loss': 'mae', 'optimizer': 'adam', 'graph_mode': 'cutoff', 'cutoff': 0.47153637463051445, 'grm_norm': 'cosine', 'self_loops': True, 'use_snp_selection': True, 'num_snps': 35948}. Best is trial 47 with value: 0.08946651587739919.
[I 2025-11-03 14:02:11,966] Trial 103 finished with value: 0.05519666613556513 and parameters: {'model_type': 'gcn', 'hidden_dims': '[512, 128]', 'dropout': 0.4074110086909875, 'batch_norm': False, 'lr': 0.00012888803552559821, 'weight_decay': 1.6242902480649102e-07, 'epochs': 341, 'loss': 'mae', 'optimizer': 'adam', 'graph_mode': 'cutoff', 'cutoff': 0.454878175935158, 'grm_norm': 'cosine', 'self_loops': True, 'use_snp_selection': True, 'num_snps': 25204}. Best is trial 47 with value: 0.08946651587739919.
[I 2025-11-03 14:02:14,523] Trial 104 finished with value: 0.05085421562373251 and parameters: {'model_type': 'gcn', 'hidden_dims': '[512, 128]', 'dropout': 0.4826485106258665, 'batch_norm': False, 'lr': 0.00034324145217212097, 'weight_decay': 2.7837538148904856e-07, 'epochs': 326, 'loss': 'mae', 'optimizer': 'adam', 'graph_mode': 'cutoff', 'cutoff': 0.4859334962908493, 'grm_norm': 'cosine', 'self_loops': False, 'use_snp_selection': True, 'num_snps': 19362}. Best is trial 47 with value: 0.08946651587739919.
[I 2025-11-03 14:02:16,610] Trial 105 finished with value: -0.015230812467501468 and parameters: {'model_type': 'gcn', 'hidden_dims': '[512, 64]', 'dropout': 0.4521042160505661, 'batch_norm': False, 'lr': 0.000286518810425877, 'weight_decay': 2.2942338613693524e-07, 'epochs': 274, 'loss': 'mae', 'optimizer': 'adam', 'graph_mode': 'cutoff', 'cutoff': 0.4178682407252631, 'grm_norm': 'cosine_then_gcn', 'self_loops': True, 'use_snp_selection': True, 'num_snps': 12852}. Best is trial 47 with value: 0.08946651587739919.
[I 2025-11-03 14:02:19,196] Trial 106 finished with value: 0.006952010053065388 and parameters: {'model_type': 'gcn', 'hidden_dims': '[128, 64]', 'dropout': 0.525976981104706, 'batch_norm': False, 'lr': 1.702185678543247e-05, 'weight_decay': 5.101067835268078e-07, 'epochs': 262, 'loss': 'mae', 'optimizer': 'adam', 'graph_mode': 'knn', 'source': 'grm', 'knn_k': 7, 'weighted_edges': True, 'symmetrize_mode': 'union', 'use_snp_selection': True, 'num_snps': 31707}. Best is trial 47 with value: 0.08946651587739919.
[I 2025-11-03 14:02:21,419] Trial 107 finished with value: 0.019395032972867682 and parameters: {'model_type': 'gcn', 'hidden_dims': '[512, 256]', 'dropout': 0.4322379527508386, 'batch_norm': False, 'lr': 0.00020349550404197362, 'weight_decay': 4.211117770108413e-05, 'epochs': 288, 'loss': 'mae', 'optimizer': 'adam', 'graph_mode': 'cutoff', 'cutoff': 0.5436226846704513, 'grm_norm': 'cosine_then_gcn', 'self_loops': False, 'use_snp_selection': True, 'num_snps': 14259}. Best is trial 47 with value: 0.08946651587739919.
[I 2025-11-03 14:02:24,986] Trial 108 finished with value: 0.009468225741394914 and parameters: {'model_type': 'gcn', 'hidden_dims': '[512, 128]', 'dropout': 0.5451258608423415, 'batch_norm': False, 'lr': 0.00046469336453344555, 'weight_decay': 7.140738031932812e-07, 'epochs': 225, 'loss': 'mae', 'optimizer': 'adam', 'graph_mode': 'cutoff', 'cutoff': 0.7206277690605606, 'grm_norm': 'cosine', 'self_loops': False, 'use_snp_selection': True, 'num_snps': 46797}. Best is trial 47 with value: 0.08946651587739919.
[I 2025-11-03 14:02:28,632] Trial 109 finished with value: -0.005544667832321559 and parameters: {'model_type': 'gcn', 'hidden_dims': '[128, 64]', 'dropout': 0.5034949066565653, 'batch_norm': False, 'lr': 0.00017551967671627298, 'weight_decay': 1.1902352643595145e-06, 'epochs': 315, 'loss': 'mae', 'optimizer': 'adam', 'graph_mode': 'knn', 'source': 'grm', 'knn_k': 4, 'weighted_edges': False, 'symmetrize_mode': 'union', 'use_snp_selection': True, 'num_snps': 54462}. Best is trial 47 with value: 0.08946651587739919.
[I 2025-11-03 14:02:31,094] Trial 110 finished with value: 0.027944387845269623 and parameters: {'model_type': 'gcn', 'hidden_dims': '[256, 128]', 'dropout': 0.37812880323336695, 'batch_norm': True, 'lr': 2.2443740060489394e-05, 'weight_decay': 2.9419761852889413e-05, 'epochs': 307, 'loss': 'mae', 'optimizer': 'adam', 'graph_mode': 'cutoff', 'cutoff': 0.4410420375229151, 'grm_norm': 'gcn', 'self_loops': True, 'use_snp_selection': False}. Best is trial 47 with value: 0.08946651587739919.
[I 2025-11-03 14:02:33,716] Trial 111 finished with value: 0.03674328601053425 and parameters: {'model_type': 'gcn', 'hidden_dims': '[256, 128]', 'dropout': 0.5746853371058324, 'batch_norm': True, 'lr': 0.0002700754928398484, 'weight_decay': 5.677536230533921e-05, 'epochs': 349, 'loss': 'mae', 'optimizer': 'adam', 'graph_mode': 'cutoff', 'cutoff': 0.37009923771217773, 'grm_norm': 'cosine_then_gcn', 'self_loops': False, 'use_snp_selection': False}. Best is trial 47 with value: 0.08946651587739919.
[I 2025-11-03 14:02:36,308] Trial 112 finished with value: 0.026816808130217893 and parameters: {'model_type': 'gcn', 'hidden_dims': '[256, 128]', 'dropout': 0.5177065752791992, 'batch_norm': True, 'lr': 9.874999026239824e-05, 'weight_decay': 1.8086767206491732e-05, 'epochs': 343, 'loss': 'mae', 'optimizer': 'adam', 'graph_mode': 'cutoff', 'cutoff': 0.3996912863193475, 'grm_norm': 'cosine_then_gcn', 'self_loops': False, 'use_snp_selection': False}. Best is trial 47 with value: 0.08946651587739919.
[I 2025-11-03 14:02:38,840] Trial 113 finished with value: 0.0247303712448371 and parameters: {'model_type': 'gcn', 'hidden_dims': '[256, 128]', 'dropout': 0.4915214876885708, 'batch_norm': True, 'lr': 2.5440734111133343e-05, 'weight_decay': 3.6433493210395195e-05, 'epochs': 331, 'loss': 'mae', 'optimizer': 'adam', 'graph_mode': 'cutoff', 'cutoff': 0.5056514992847726, 'grm_norm': 'cosine_then_gcn', 'self_loops': False, 'use_snp_selection': False}. Best is trial 47 with value: 0.08946651587739919.
[I 2025-11-03 14:02:41,412] Trial 114 finished with value: -0.015463640086055117 and parameters: {'model_type': 'gcn', 'hidden_dims': '[256, 128]', 'dropout': 0.595544622197894, 'batch_norm': True, 'lr': 3.175048399316803e-05, 'weight_decay': 1.2188146063029922e-07, 'epochs': 337, 'loss': 'mae', 'optimizer': 'adam', 'graph_mode': 'cutoff', 'cutoff': 0.38135245094773734, 'grm_norm': 'cosine_then_gcn', 'self_loops': False, 'use_snp_selection': False}. Best is trial 47 with value: 0.08946651587739919.
[I 2025-11-03 14:02:43,548] Trial 115 finished with value: 0.03791319906964505 and parameters: {'model_type': 'gcn', 'hidden_dims': '[128, 64]', 'dropout': 0.5428091866857171, 'batch_norm': True, 'lr': 0.00010741974664958124, 'weight_decay': 4.591535478112976e-05, 'epochs': 325, 'loss': 'mae', 'optimizer': 'adam', 'graph_mode': 'cutoff', 'cutoff': 0.4309781493439149, 'grm_norm': 'cosine_then_gcn', 'self_loops': False, 'use_snp_selection': False}. Best is trial 47 with value: 0.08946651587739919.
[I 2025-11-03 14:02:46,304] Trial 116 finished with value: 0.027034055980726106 and parameters: {'model_type': 'gcn', 'hidden_dims': '[512, 128]', 'dropout': 0.5834377708063951, 'batch_norm': False, 'lr': 4.421013594277441e-05, 'weight_decay': 2.296905886753174e-05, 'epochs': 298, 'loss': 'mae', 'optimizer': 'adam', 'graph_mode': 'cutoff', 'cutoff': 0.45298051853172233, 'grm_norm': 'gcn', 'self_loops': False, 'use_snp_selection': True, 'num_snps': 23988}. Best is trial 47 with value: 0.08946651587739919.
[I 2025-11-03 14:02:48,158] Trial 117 finished with value: 0.04067745889252172 and parameters: {'model_type': 'gcn', 'hidden_dims': '[256, 128]', 'dropout': 0.559642012895747, 'batch_norm': True, 'lr': 5.143028381400427e-05, 'weight_decay': 0.00010672875517618046, 'epochs': 179, 'loss': 'mae', 'optimizer': 'adam', 'graph_mode': 'cutoff', 'cutoff': 0.8260963644574612, 'grm_norm': 'cosine', 'self_loops': False, 'use_snp_selection': False}. Best is trial 47 with value: 0.08946651587739919.
[I 2025-11-03 14:02:50,440] Trial 118 finished with value: 0.04092222040514669 and parameters: {'model_type': 'gcn', 'hidden_dims': '[128, 64]', 'dropout': 0.46969887684054684, 'batch_norm': False, 'lr': 5.8624833965478035e-05, 'weight_decay': 1.3066713389937276e-05, 'epochs': 152, 'loss': 'mae', 'optimizer': 'adam', 'graph_mode': 'knn', 'source': 'grm', 'knn_k': 9, 'weighted_edges': True, 'symmetrize_mode': 'union', 'use_snp_selection': True, 'num_snps': 29255}. Best is trial 47 with value: 0.08946651587739919.
[I 2025-11-03 14:02:53,288] Trial 119 finished with value: 0.036665433528343144 and parameters: {'model_type': 'gcn', 'hidden_dims': '[512, 128]', 'dropout': 0.5333337231838899, 'batch_norm': True, 'lr': 0.0001597098051943921, 'weight_decay': 8.478157841170952e-05, 'epochs': 242, 'loss': 'mse', 'optimizer': 'adam', 'graph_mode': 'cutoff', 'cutoff': 0.30293314211463446, 'grm_norm': 'cosine_then_gcn', 'self_loops': True, 'use_snp_selection': False}. Best is trial 47 with value: 0.08946651587739919.
[I 2025-11-03 14:02:55,220] Trial 120 finished with value: 0.05443023873796968 and parameters: {'model_type': 'gcn', 'hidden_dims': '[256, 128, 64]', 'dropout': 0.41463144364079924, 'batch_norm': False, 'lr': 7.860933329741619e-05, 'weight_decay': 1.6564392387333867e-06, 'epochs': 124, 'loss': 'mae', 'optimizer': 'adam', 'graph_mode': 'cutoff', 'cutoff': 0.485889341947265, 'grm_norm': 'none', 'self_loops': False, 'use_snp_selection': True, 'num_snps': 17174}. Best is trial 47 with value: 0.08946651587739919.
[I 2025-11-03 14:02:57,514] Trial 121 finished with value: 0.028530220025352222 and parameters: {'model_type': 'gcn', 'hidden_dims': '[128, 64]', 'dropout': 0.190208700387077, 'batch_norm': True, 'lr': 2.921304529423018e-06, 'weight_decay': 3.3550495259375966e-05, 'epochs': 344, 'loss': 'mae', 'optimizer': 'adam', 'graph_mode': 'knn', 'source': 'grm', 'knn_k': 8, 'weighted_edges': True, 'symmetrize_mode': 'union', 'use_snp_selection': False}. Best is trial 47 with value: 0.08946651587739919.
[I 2025-11-03 14:02:59,652] Trial 122 finished with value: 0.042249746891067426 and parameters: {'model_type': 'gcn', 'hidden_dims': '[128, 64]', 'dropout': 0.23283274081524452, 'batch_norm': True, 'lr': 3.751473194239364e-05, 'weight_decay': 5.87551067583434e-05, 'epochs': 313, 'loss': 'mae', 'optimizer': 'adam', 'graph_mode': 'knn', 'source': 'grm', 'knn_k': 7, 'weighted_edges': True, 'symmetrize_mode': 'mutual', 'use_snp_selection': False}. Best is trial 47 with value: 0.08946651587739919.
[I 2025-11-03 14:03:01,885] Trial 123 finished with value: 0.049348855132694276 and parameters: {'model_type': 'gcn', 'hidden_dims': '[128, 64]', 'dropout': 0.14193144936102403, 'batch_norm': True, 'lr': 0.00037043670681296024, 'weight_decay': 0.0006239469849247729, 'epochs': 333, 'loss': 'mae', 'optimizer': 'adam', 'graph_mode': 'knn', 'source': 'grm', 'knn_k': 10, 'weighted_edges': True, 'symmetrize_mode': 'union', 'use_snp_selection': False}. Best is trial 47 with value: 0.08946651587739919.
[I 2025-11-03 14:03:04,066] Trial 124 finished with value: -0.004317882391911418 and parameters: {'model_type': 'gcn', 'hidden_dims': '[128, 64]', 'dropout': 0.15749758778330245, 'batch_norm': True, 'lr': 1.704093905025939e-06, 'weight_decay': 7.577053355074017e-05, 'epochs': 321, 'loss': 'mae', 'optimizer': 'adam', 'graph_mode': 'knn', 'source': 'grm', 'knn_k': 8, 'weighted_edges': True, 'symmetrize_mode': 'mutual', 'use_snp_selection': False}. Best is trial 47 with value: 0.08946651587739919.
[I 2025-11-03 14:03:06,719] Trial 125 finished with value: 0.05250606209837155 and parameters: {'model_type': 'gcn', 'hidden_dims': '[256, 128]', 'dropout': 0.4596354635676596, 'batch_norm': True, 'lr': 1.014428293863567e-06, 'weight_decay': 1.9915581758709153e-05, 'epochs': 349, 'loss': 'mae', 'optimizer': 'adam', 'graph_mode': 'knn', 'source': 'grm', 'knn_k': 9, 'weighted_edges': True, 'symmetrize_mode': 'mutual', 'use_snp_selection': False}. Best is trial 47 with value: 0.08946651587739919.
[I 2025-11-03 14:03:08,225] Trial 126 finished with value: -0.010800381453441196 and parameters: {'model_type': 'gcn', 'hidden_dims': '[128, 64]', 'dropout': 0.17572174793680673, 'batch_norm': False, 'lr': 1.9582648240276158e-05, 'weight_decay': 4.851341304163917e-05, 'epochs': 138, 'loss': 'mae', 'optimizer': 'adam', 'graph_mode': 'cutoff', 'cutoff': 0.3509407694444603, 'grm_norm': 'cosine', 'self_loops': False, 'use_snp_selection': True, 'num_snps': 7070}. Best is trial 47 with value: 0.08946651587739919.
[I 2025-11-03 14:03:11,552] Trial 127 finished with value: 0.04990510463767281 and parameters: {'model_type': 'gcn', 'hidden_dims': '[512, 128]', 'dropout': 0.48261782009232373, 'batch_norm': True, 'lr': 0.0005481217425623633, 'weight_decay': 8.77762578461706e-06, 'epochs': 305, 'loss': 'mae', 'optimizer': 'adam', 'graph_mode': 'knn', 'source': 'grm', 'knn_k': 10, 'weighted_edges': True, 'symmetrize_mode': 'mutual', 'use_snp_selection': False}. Best is trial 47 with value: 0.08946651587739919.
