[I 2025-11-13 16:53:07,530] Trial 93 finished with value: 0.2781304234136592 and parameters: {'model_type': 'graphsage', 'hidden_dims': '[256, 128, 64]', 'dropout': 0.15973593400443312, 'batch_norm': False, 'lr': 4.2332384487741965e-05, 'weight_decay': 0.0006702251308077537, 'epochs': 230, 'loss': 'mae', 'optimizer': 'adam', 'graph_mode': 'cutoff', 'cutoff': 0.4654760175925458, 'grm_norm': 'none', 'self_loops': False, 'use_snp_selection': True, 'num_snps': 34821}. Best is trial 19 with value: 0.30021150341023195.
[I 2025-11-13 16:55:17,867] Trial 94 finished with value: 0.27242541887430854 and parameters: {'model_type': 'graphsage', 'hidden_dims': '[256, 128, 64]', 'dropout': 0.43853122465065747, 'batch_norm': False, 'lr': 3.143413089216169e-05, 'weight_decay': 0.0008280481643600597, 'epochs': 239, 'loss': 'mae', 'optimizer': 'adam', 'graph_mode': 'cutoff', 'cutoff': 0.5352232973579263, 'grm_norm': 'none', 'self_loops': False, 'use_snp_selection': True, 'num_snps': 43009}. Best is trial 19 with value: 0.30021150341023195.
[I 2025-11-13 16:57:01,146] Trial 95 finished with value: 0.283747691277659 and parameters: {'model_type': 'graphsage', 'hidden_dims': '[256, 128, 64]', 'dropout': 0.4045804768236837, 'batch_norm': False, 'lr': 6.895132559842918e-05, 'weight_decay': 0.00047349253204976427, 'epochs': 156, 'loss': 'mae', 'optimizer': 'adam', 'graph_mode': 'cutoff', 'cutoff': 0.5055881946001073, 'grm_norm': 'none', 'self_loops': False, 'use_snp_selection': True, 'num_snps': 38364}. Best is trial 19 with value: 0.30021150341023195.
[I 2025-11-13 16:58:38,455] Trial 96 finished with value: 0.2833352789438474 and parameters: {'model_type': 'graphsage', 'hidden_dims': '[256, 128]', 'dropout': 0.40391185876642544, 'batch_norm': False, 'lr': 1.0386074563107186e-05, 'weight_decay': 0.0002895162681263799, 'epochs': 144, 'loss': 'mae', 'optimizer': 'adam', 'graph_mode': 'cutoff', 'cutoff': 0.5082151367238781, 'grm_norm': 'cosine', 'self_loops': False, 'use_snp_selection': True, 'num_snps': 38397}. Best is trial 19 with value: 0.30021150341023195.
[I 2025-11-13 16:59:31,718] Trial 97 finished with value: 0.22929712281775166 and parameters: {'model_type': 'graphsage', 'hidden_dims': '[256, 128]', 'dropout': 0.40725561562601154, 'batch_norm': True, 'lr': 9.749025482868024e-06, 'weight_decay': 0.0002780099758478866, 'epochs': 97, 'loss': 'mae', 'optimizer': 'adam', 'graph_mode': 'cutoff', 'cutoff': 0.5189494191789618, 'grm_norm': 'cosine', 'self_loops': False, 'use_snp_selection': False}. Best is trial 19 with value: 0.30021150341023195.
[I 2025-11-13 17:01:47,969] Trial 98 finished with value: 0.2770510575392927 and parameters: {'model_type': 'graphsage', 'hidden_dims': '[256, 128]', 'dropout': 0.37800087932849347, 'batch_norm': False, 'lr': 7.173049773904046e-05, 'weight_decay': 0.00048751398633237967, 'epochs': 146, 'loss': 'mae', 'optimizer': 'adam', 'graph_mode': 'knn', 'source': 'grm', 'knn_k': 9, 'weighted_edges': False, 'symmetrize_mode': 'mutual', 'use_snp_selection': True, 'num_snps': 37731}. Best is trial 19 with value: 0.30021150341023195.
[I 2025-11-13 17:03:39,570] Trial 99 finished with value: 0.2752879636898671 and parameters: {'model_type': 'graphsage', 'hidden_dims': '[256, 128]', 'dropout': 0.3952522871291034, 'batch_norm': False, 'lr': 5.029227653519978e-06, 'weight_decay': 0.0003386559349290583, 'epochs': 157, 'loss': 'mae', 'optimizer': 'adam', 'graph_mode': 'cutoff', 'cutoff': 0.5498780816381241, 'grm_norm': 'cosine', 'self_loops': True, 'use_snp_selection': True, 'num_snps': 47727}. Best is trial 19 with value: 0.30021150341023195.
[I 2025-11-13 17:05:02,726] Trial 100 finished with value: 0.19254493944103715 and parameters: {'model_type': 'graphsage', 'hidden_dims': '[256, 128]', 'dropout': 0.3705372325045887, 'batch_norm': False, 'lr': 1.367278574901623e-06, 'weight_decay': 0.00044381400473174234, 'epochs': 110, 'loss': 'mae', 'optimizer': 'adam', 'graph_mode': 'cutoff', 'cutoff': 0.5047291018695154, 'grm_norm': 'cosine', 'self_loops': False, 'use_snp_selection': True, 'num_snps': 33783}. Best is trial 19 with value: 0.30021150341023195.
[I 2025-11-13 17:06:57,185] Trial 101 finished with value: 0.27044930962727287 and parameters: {'model_type': 'graphsage', 'hidden_dims': '[256, 128, 64]', 'dropout': 0.432571155621757, 'batch_norm': False, 'lr': 1.1753803823738686e-05, 'weight_decay': 0.0007701786093138751, 'epochs': 175, 'loss': 'mae', 'optimizer': 'adam', 'graph_mode': 'cutoff', 'cutoff': 0.4554080581300237, 'grm_norm': 'cosine', 'self_loops': False, 'use_snp_selection': True, 'num_snps': 35636}. Best is trial 19 with value: 0.30021150341023195.
[I 2025-11-13 17:09:49,892] Trial 102 finished with value: 0.279975212498162 and parameters: {'model_type': 'graphsage', 'hidden_dims': '[512, 256]', 'dropout': 0.46092446778588453, 'batch_norm': False, 'lr': 4.0873557451070296e-05, 'weight_decay': 5.784686307645505e-05, 'epochs': 189, 'loss': 'mae', 'optimizer': 'adam', 'graph_mode': 'cutoff', 'cutoff': 0.375476204825705, 'grm_norm': 'none', 'self_loops': False, 'use_snp_selection': True, 'num_snps': 38346}. Best is trial 19 with value: 0.30021150341023195.
[I 2025-11-13 17:12:41,301] Trial 103 finished with value: 0.2687702289430634 and parameters: {'model_type': 'graphsage', 'hidden_dims': '[512, 256]', 'dropout': 0.4648307096108593, 'batch_norm': False, 'lr': 8.381023629209385e-05, 'weight_decay': 0.00020958157185130028, 'epochs': 190, 'loss': 'mae', 'optimizer': 'adam', 'graph_mode': 'cutoff', 'cutoff': 0.4214612274697458, 'grm_norm': 'none', 'self_loops': False, 'use_snp_selection': True, 'num_snps': 39263}. Best is trial 19 with value: 0.30021150341023195.
[I 2025-11-13 17:15:09,425] Trial 104 finished with value: 0.26720093792281535 and parameters: {'model_type': 'graphsage', 'hidden_dims': '[512, 256]', 'dropout': 0.40434825985494044, 'batch_norm': False, 'lr': 3.761254603694789e-05, 'weight_decay': 0.0006342807077108699, 'epochs': 198, 'loss': 'mae', 'optimizer': 'adam', 'graph_mode': 'cutoff', 'cutoff': 0.3846558344168523, 'grm_norm': 'none', 'self_loops': False, 'use_snp_selection': True, 'num_snps': 31929}. Best is trial 19 with value: 0.30021150341023195.
[I 2025-11-13 17:16:43,496] Trial 105 finished with value: 0.27555552267978844 and parameters: {'model_type': 'graphsage', 'hidden_dims': '[512, 256]', 'dropout': 0.3432448455887218, 'batch_norm': False, 'lr': 4.531938807887579e-05, 'weight_decay': 6.991782564389876e-05, 'epochs': 74, 'loss': 'mae', 'optimizer': 'adam', 'graph_mode': 'cutoff', 'cutoff': 0.5064596347273842, 'grm_norm': 'cosine_then_gcn', 'self_loops': False, 'use_snp_selection': True, 'num_snps': 37793}. Best is trial 19 with value: 0.30021150341023195.
[I 2025-11-13 17:17:34,841] Trial 106 finished with value: 0.2143357232035638 and parameters: {'model_type': 'graphsage', 'hidden_dims': '[512, 256]', 'dropout': 0.3615621627164224, 'batch_norm': False, 'lr': 3.56454298973652e-06, 'weight_decay': 2.4631642787324187e-05, 'epochs': 168, 'loss': 'mse', 'optimizer': 'adam', 'graph_mode': 'cutoff', 'cutoff': 0.5333696644894979, 'grm_norm': 'cosine', 'self_loops': False, 'use_snp_selection': True, 'num_snps': 2830}. Best is trial 19 with value: 0.30021150341023195.
[I 2025-11-13 17:19:30,876] Trial 107 finished with value: 0.2561157464608092 and parameters: {'model_type': 'graphsage', 'hidden_dims': '[512, 128]', 'dropout': 0.45093228592882006, 'batch_norm': False, 'lr': 9.977890728325679e-05, 'weight_decay': 0.0003949230708212807, 'epochs': 131, 'loss': 'mae', 'optimizer': 'adam', 'graph_mode': 'cutoff', 'cutoff': 0.6082709072399188, 'grm_norm': 'none', 'self_loops': False, 'use_snp_selection': True, 'num_snps': 41031}. Best is trial 19 with value: 0.30021150341023195.
[I 2025-11-13 17:21:30,363] Trial 108 finished with value: 0.2591446448404765 and parameters: {'model_type': 'graphsage', 'hidden_dims': '[512, 256]', 'dropout': 0.38189406154981104, 'batch_norm': False, 'lr': 2.966328959347153e-06, 'weight_decay': 0.0005331022634789526, 'epochs': 143, 'loss': 'mae', 'optimizer': 'adam', 'graph_mode': 'cutoff', 'cutoff': 0.4794062343683, 'grm_norm': 'none', 'self_loops': False, 'use_snp_selection': True, 'num_snps': 32575}. Best is trial 19 with value: 0.30021150341023195.
[I 2025-11-13 17:23:46,523] Trial 109 finished with value: 0.2444610613806289 and parameters: {'model_type': 'graphsage', 'hidden_dims': '[256, 128]', 'dropout': 0.4545353807771664, 'batch_norm': False, 'lr': 1.9951800071310787e-06, 'weight_decay': 3.796198634658605e-05, 'epochs': 154, 'loss': 'mae', 'optimizer': 'adam', 'graph_mode': 'cutoff', 'cutoff': 0.4453447776245306, 'grm_norm': 'gcn', 'self_loops': False, 'use_snp_selection': True, 'num_snps': 44548}. Best is trial 19 with value: 0.30021150341023195.
[I 2025-11-13 17:25:54,035] Trial 110 finished with value: 0.2539847306633781 and parameters: {'model_type': 'graphsage', 'hidden_dims': '[512, 64]', 'dropout': 0.4161514175758545, 'batch_norm': False, 'lr': 3.126647890269457e-05, 'weight_decay': 0.00030758759458226163, 'epochs': 249, 'loss': 'mae', 'optimizer': 'adam', 'graph_mode': 'cutoff', 'cutoff': 0.5724131281211214, 'grm_norm': 'none', 'self_loops': False, 'use_snp_selection': True, 'num_snps': 29043}. Best is trial 19 with value: 0.30021150341023195.
[I 2025-11-13 17:28:03,633] Trial 111 finished with value: 0.27397842933826566 and parameters: {'model_type': 'graphsage', 'hidden_dims': '[256, 128, 64]', 'dropout': 0.4317937482318044, 'batch_norm': False, 'lr': 1.8372809374341728e-05, 'weight_decay': 5.0252105288384964e-05, 'epochs': 158, 'loss': 'mae', 'optimizer': 'adam', 'graph_mode': 'cutoff', 'cutoff': 0.3252173879336189, 'grm_norm': 'none', 'self_loops': False, 'use_snp_selection': True, 'num_snps': 35120}. Best is trial 19 with value: 0.30021150341023195.
[I 2025-11-13 17:30:22,697] Trial 112 finished with value: 0.2718746338524888 and parameters: {'model_type': 'graphsage', 'hidden_dims': '[256, 128, 64]', 'dropout': 0.3907252920483481, 'batch_norm': False, 'lr': 7.302626389788591e-06, 'weight_decay': 8.938395788220312e-05, 'epochs': 185, 'loss': 'mae', 'optimizer': 'adam', 'graph_mode': 'cutoff', 'cutoff': 0.35901619277596253, 'grm_norm': 'none', 'self_loops': False, 'use_snp_selection': True, 'num_snps': 36375}. Best is trial 19 with value: 0.30021150341023195.
[I 2025-11-13 17:33:12,523] Trial 113 finished with value: 0.276542231344051 and parameters: {'model_type': 'graphsage', 'hidden_dims': '[256, 128, 64]', 'dropout': 0.16740059019815373, 'batch_norm': False, 'lr': 2.1604446897121196e-05, 'weight_decay': 6.137078470894666e-05, 'epochs': 171, 'loss': 'mae', 'optimizer': 'adam', 'graph_mode': 'cutoff', 'cutoff': 0.28885084402828287, 'grm_norm': 'none', 'self_loops': False, 'use_snp_selection': True, 'num_snps': 38922}. Best is trial 19 with value: 0.30021150341023195.
[I 2025-11-13 17:35:12,988] Trial 114 finished with value: 0.2705393876325909 and parameters: {'model_type': 'graphsage', 'hidden_dims': '[256, 128, 64]', 'dropout': 0.49961013687387545, 'batch_norm': False, 'lr': 2.58709408232976e-05, 'weight_decay': 0.00012628367272819898, 'epochs': 182, 'loss': 'mae', 'optimizer': 'adam', 'graph_mode': 'cutoff', 'cutoff': 0.3705689961051664, 'grm_norm': 'none', 'self_loops': False, 'use_snp_selection': True, 'num_snps': 33975}. Best is trial 19 with value: 0.30021150341023195.
[I 2025-11-13 17:37:02,944] Trial 115 finished with value: 0.2722219401620054 and parameters: {'model_type': 'graphsage', 'hidden_dims': '[256, 128, 64]', 'dropout': 0.5616426083645736, 'batch_norm': True, 'lr': 6.572351341555183e-05, 'weight_decay': 0.0007071907496584573, 'epochs': 176, 'loss': 'mae', 'optimizer': 'adam', 'graph_mode': 'cutoff', 'cutoff': 0.3362372605339222, 'grm_norm': 'none', 'self_loops': False, 'use_snp_selection': False}. Best is trial 19 with value: 0.30021150341023195.
[I 2025-11-13 17:42:39,844] Trial 116 finished with value: 0.27073932300601267 and parameters: {'model_type': 'graphsage', 'hidden_dims': '[128, 64]', 'dropout': 0.5930893740675962, 'batch_norm': False, 'lr': 4.024820544099972e-05, 'weight_decay': 1.335898861722802e-05, 'epochs': 220, 'loss': 'mae', 'optimizer': 'adam', 'graph_mode': 'cutoff', 'cutoff': 0.25598081270621287, 'grm_norm': 'cosine_then_gcn', 'self_loops': True, 'use_snp_selection': True, 'num_snps': 57007}. Best is trial 19 with value: 0.30021150341023195.
[I 2025-11-13 17:44:06,024] Trial 117 finished with value: 0.24928510706793658 and parameters: {'model_type': 'graphsage', 'hidden_dims': '[256, 128, 64]', 'dropout': 0.3321262814851535, 'batch_norm': False, 'lr': 7.611287479954187e-05, 'weight_decay': 0.0008557814133649029, 'epochs': 140, 'loss': 'mae', 'optimizer': 'adam', 'graph_mode': 'knn', 'source': 'grm', 'knn_k': 2, 'weighted_edges': True, 'symmetrize_mode': 'union', 'use_snp_selection': True, 'num_snps': 27118}. Best is trial 19 with value: 0.30021150341023195.
[I 2025-11-13 17:46:32,156] Trial 118 finished with value: 0.27146551633487476 and parameters: {'model_type': 'graphsage', 'hidden_dims': '[512, 256]', 'dropout': 0.11672531806616987, 'batch_norm': False, 'lr': 5.518931434539835e-05, 'weight_decay': 6.537938837279248e-06, 'epochs': 191, 'loss': 'mae', 'optimizer': 'adam', 'graph_mode': 'cutoff', 'cutoff': 0.4945082346560026, 'grm_norm': 'none', 'self_loops': False, 'use_snp_selection': True, 'num_snps': 36774}. Best is trial 19 with value: 0.30021150341023195.
[I 2025-11-13 17:48:05,325] Trial 119 finished with value: 0.24768417806520898 and parameters: {'model_type': 'graphsage', 'hidden_dims': '[256, 128, 64]', 'dropout': 0.541972334111229, 'batch_norm': False, 'lr': 0.00015148019256039748, 'weight_decay': 0.0004518535687490997, 'epochs': 86, 'loss': 'mae', 'optimizer': 'adam', 'graph_mode': 'cutoff', 'cutoff': 0.3040190228345394, 'grm_norm': 'none', 'self_loops': False, 'use_snp_selection': True, 'num_snps': 31196}. Best is trial 19 with value: 0.30021150341023195.
[I 2025-11-13 17:49:35,553] Trial 120 finished with value: 0.25431278910586974 and parameters: {'model_type': 'graphsage', 'hidden_dims': '[256, 128, 64]', 'dropout': 0.21307422885445573, 'batch_norm': False, 'lr': 3.453381748747315e-05, 'weight_decay': 4.551673821560467e-06, 'epochs': 119, 'loss': 'mse', 'optimizer': 'adam', 'graph_mode': 'cutoff', 'cutoff': 0.5478680457620434, 'grm_norm': 'none', 'self_loops': False, 'use_snp_selection': True, 'num_snps': 40447}. Best is trial 19 with value: 0.30021150341023195.
[I 2025-11-13 17:51:57,983] Trial 121 finished with value: 0.275622654221528 and parameters: {'model_type': 'graphsage', 'hidden_dims': '[256, 128, 64]', 'dropout': 0.1565003322908212, 'batch_norm': False, 'lr': 5.485122060099349e-05, 'weight_decay': 0.0005818198458153606, 'epochs': 205, 'loss': 'mae', 'optimizer': 'adam', 'graph_mode': 'cutoff', 'cutoff': 0.48322239199198463, 'grm_norm': 'none', 'self_loops': False, 'use_snp_selection': True, 'num_snps': 41600}. Best is trial 19 with value: 0.30021150341023195.
[I 2025-11-13 17:53:57,670] Trial 122 finished with value: 0.26960621687722874 and parameters: {'model_type': 'graphsage', 'hidden_dims': '[256, 128, 64]', 'dropout': 0.14237759386983306, 'batch_norm': False, 'lr': 4.6045128860743674e-05, 'weight_decay': 0.0005731367162907595, 'epochs': 212, 'loss': 'mae', 'optimizer': 'adam', 'graph_mode': 'cutoff', 'cutoff': 0.47567878460885443, 'grm_norm': 'none', 'self_loops': False, 'use_snp_selection': True, 'num_snps': 34630}. Best is trial 19 with value: 0.30021150341023195.
[I 2025-11-13 17:55:53,791] Trial 123 finished with value: 0.2796835858638179 and parameters: {'model_type': 'graphsage', 'hidden_dims': '[256, 128, 64]', 'dropout': 0.15001133686847853, 'batch_norm': False, 'lr': 6.120480943719997e-05, 'weight_decay': 5.022061135967764e-07, 'epochs': 228, 'loss': 'mae', 'optimizer': 'adam', 'graph_mode': 'cutoff', 'cutoff': 0.5250916724869253, 'grm_norm': 'none', 'self_loops': False, 'use_snp_selection': True, 'num_snps': 38517}. Best is trial 19 with value: 0.30021150341023195.
[I 2025-11-13 17:57:51,672] Trial 124 finished with value: 0.26630707623300787 and parameters: {'model_type': 'graphsage', 'hidden_dims': '[256, 128, 64]', 'dropout': 0.18283664994397422, 'batch_norm': False, 'lr': 2.4216122597366693e-05, 'weight_decay': 3.5281225095050454e-07, 'epochs': 227, 'loss': 'mae', 'optimizer': 'adam', 'graph_mode': 'cutoff', 'cutoff': 0.5287303451419288, 'grm_norm': 'none', 'self_loops': False, 'use_snp_selection': True, 'num_snps': 38982}. Best is trial 19 with value: 0.30021150341023195.
[I 2025-11-13 17:59:49,113] Trial 125 finished with value: 0.2782684643057446 and parameters: {'model_type': 'graphsage', 'hidden_dims': '[256, 128, 64]', 'dropout': 0.13337700589127366, 'batch_norm': False, 'lr': 8.861373814516152e-05, 'weight_decay': 5.331635100725152e-07, 'epochs': 235, 'loss': 'mae', 'optimizer': 'adam', 'graph_mode': 'cutoff', 'cutoff': 0.5115229100937345, 'grm_norm': 'none', 'self_loops': False, 'use_snp_selection': True, 'num_snps': 36205}. Best is trial 19 with value: 0.30021150341023195.
[I 2025-11-13 18:01:15,654] Trial 126 finished with value: 0.2584792254811131 and parameters: {'model_type': 'graphsage', 'hidden_dims': '[256, 128, 64]', 'dropout': 0.10676347984487769, 'batch_norm': False, 'lr': 0.00013028305123293613, 'weight_decay': 3.476225616401802e-05, 'epochs': 150, 'loss': 'mae', 'optimizer': 'adam', 'graph_mode': 'cutoff', 'cutoff': 0.5556995172856851, 'grm_norm': 'cosine', 'self_loops': False, 'use_snp_selection': True, 'num_snps': 32759}. Best is trial 19 with value: 0.30021150341023195.
[I 2025-11-13 18:04:24,169] Trial 127 finished with value: 0.2653479042067684 and parameters: {'model_type': 'graphsage', 'hidden_dims': '[512, 128]', 'dropout': 0.1912025209602328, 'batch_norm': False, 'lr': 0.0001104410396542955, 'weight_decay': 4.3983390340423737e-05, 'epochs': 241, 'loss': 'mae', 'optimizer': 'adam', 'graph_mode': 'cutoff', 'cutoff': 0.43364264785547796, 'grm_norm': 'none', 'self_loops': False, 'use_snp_selection': True, 'num_snps': 38530}. Best is trial 19 with value: 0.30021150341023195.
[I 2025-11-13 18:06:23,522] Trial 128 finished with value: 0.2809722035711106 and parameters: {'model_type': 'graphsage', 'hidden_dims': '[256, 128, 64]', 'dropout': 0.16566292422937806, 'batch_norm': False, 'lr': 2.8611244559240004e-05, 'weight_decay': 2.0146346299099094e-06, 'epochs': 217, 'loss': 'mae', 'optimizer': 'adam', 'graph_mode': 'cutoff', 'cutoff': 0.4957685984730951, 'grm_norm': 'cosine_then_gcn', 'self_loops': False, 'use_snp_selection': True, 'num_snps': 37041}. Best is trial 19 with value: 0.30021150341023195.
[I 2025-11-13 18:09:05,058] Trial 129 finished with value: 0.2823234776183396 and parameters: {'model_type': 'graphsage', 'hidden_dims': '[256, 128]', 'dropout': 0.17576909951578548, 'batch_norm': False, 'lr': 2.942438692965739e-05, 'weight_decay': 2.0152087259401953e-07, 'epochs': 220, 'loss': 'mae', 'optimizer': 'adam', 'graph_mode': 'cutoff', 'cutoff': 0.4972291288441306, 'grm_norm': 'cosine_then_gcn', 'self_loops': False, 'use_snp_selection': True, 'num_snps': 54429}. Best is trial 19 with value: 0.30021150341023195.
[I 2025-11-13 18:12:19,033] Trial 130 finished with value: 0.2735612618440261 and parameters: {'model_type': 'graphsage', 'hidden_dims': '[256, 128]', 'dropout': 0.17721126660673855, 'batch_norm': False, 'lr': 6.191799647976164e-05, 'weight_decay': 1.2703744285724212e-07, 'epochs': 221, 'loss': 'mae', 'optimizer': 'adam', 'graph_mode': 'cutoff', 'cutoff': 0.45617546323981456, 'grm_norm': 'cosine_then_gcn', 'self_loops': False, 'use_snp_selection': True, 'num_snps': 54803}. Best is trial 19 with value: 0.30021150341023195.
[I 2025-11-13 18:15:06,168] Trial 131 finished with value: 0.2779044538332371 and parameters: {'model_type': 'graphsage', 'hidden_dims': '[256, 128]', 'dropout': 0.20157350213396888, 'batch_norm': False, 'lr': 2.9890233983057505e-05, 'weight_decay': 2.2264945343199948e-07, 'epochs': 202, 'loss': 'mae', 'optimizer': 'adam', 'graph_mode': 'cutoff', 'cutoff': 0.5028508079379508, 'grm_norm': 'cosine_then_gcn', 'self_loops': False, 'use_snp_selection': True, 'num_snps': 58374}. Best is trial 19 with value: 0.30021150341023195.
[I 2025-11-13 18:17:02,547] Trial 132 finished with value: 0.26937737397190026 and parameters: {'model_type': 'graphsage', 'hidden_dims': '[256, 128]', 'dropout': 0.1628759326898255, 'batch_norm': False, 'lr': 4.770852832676267e-05, 'weight_decay': 6.957685413024689e-07, 'epochs': 254, 'loss': 'mae', 'optimizer': 'adam', 'graph_mode': 'cutoff', 'cutoff': 0.5225651207177461, 'grm_norm': 'cosine_then_gcn', 'self_loops': False, 'use_snp_selection': True, 'num_snps': 36783}. Best is trial 19 with value: 0.30021150341023195.
[I 2025-11-13 18:19:37,646] Trial 133 finished with value: 0.2844415781605443 and parameters: {'model_type': 'graphsage', 'hidden_dims': '[256, 128]', 'dropout': 0.16940592110566968, 'batch_norm': False, 'lr': 3.520792830392227e-05, 'weight_decay': 2.5799861545467475e-07, 'epochs': 216, 'loss': 'mae', 'optimizer': 'adam', 'graph_mode': 'cutoff', 'cutoff': 0.49654346673758654, 'grm_norm': 'cosine_then_gcn', 'self_loops': False, 'use_snp_selection': True, 'num_snps': 50066}. Best is trial 19 with value: 0.30021150341023195.
[I 2025-11-13 18:22:20,358] Trial 134 finished with value: 0.27587950202618144 and parameters: {'model_type': 'graphsage', 'hidden_dims': '[256, 128]', 'dropout': 0.17101340296797807, 'batch_norm': False, 'lr': 3.717635970662542e-05, 'weight_decay': 2.32359341174287e-07, 'epochs': 216, 'loss': 'mae', 'optimizer': 'adam', 'graph_mode': 'cutoff', 'cutoff': 0.493695185402266, 'grm_norm': 'cosine_then_gcn', 'self_loops': False, 'use_snp_selection': True, 'num_snps': 54487}. Best is trial 19 with value: 0.30021150341023195.
