[I 2025-11-03 13:29:37,239] Trial 107 finished with value: 0.09363092308146419 and parameters: {'model_type': 'gcn', 'hidden_dims': '[512, 256]', 'dropout': 0.11895833576234646, 'batch_norm': False, 'lr': 0.0004544707722939299, 'weight_decay': 0.00023347133003773584, 'epochs': 256, 'loss': 'mae', 'optimizer': 'adam', 'graph_mode': 'off', 'use_snp_selection': False}. Best is trial 35 with value: 0.12334639703087553.
[I 2025-11-03 13:29:40,208] Trial 108 finished with value: 0.06538793680376685 and parameters: {'model_type': 'gcn', 'hidden_dims': '[512, 128]', 'dropout': 0.459353303381998, 'batch_norm': False, 'lr': 0.0005448207524330262, 'weight_decay': 0.0003235212413157933, 'epochs': 274, 'loss': 'mae', 'optimizer': 'adam', 'graph_mode': 'off', 'use_snp_selection': False}. Best is trial 35 with value: 0.12334639703087553.
[I 2025-11-03 13:29:43,356] Trial 109 finished with value: 0.11272457467129247 and parameters: {'model_type': 'gcn', 'hidden_dims': '[512, 64]', 'dropout': 0.14357562680465544, 'batch_norm': False, 'lr': 0.000293936131164002, 'weight_decay': 8.337556225891334e-05, 'epochs': 296, 'loss': 'mae', 'optimizer': 'adam', 'graph_mode': 'off', 'use_snp_selection': False}. Best is trial 35 with value: 0.12334639703087553.
[I 2025-11-03 13:29:45,509] Trial 110 finished with value: 0.08973167413323759 and parameters: {'model_type': 'gcn', 'hidden_dims': '[256, 128]', 'dropout': 0.18450492826300283, 'batch_norm': False, 'lr': 0.0003050768364969854, 'weight_decay': 9.840210708761509e-05, 'epochs': 328, 'loss': 'mae', 'optimizer': 'adam', 'graph_mode': 'off', 'use_snp_selection': False}. Best is trial 35 with value: 0.12334639703087553.
[I 2025-11-03 13:29:48,597] Trial 111 finished with value: 0.10151302979851334 and parameters: {'model_type': 'gcn', 'hidden_dims': '[512, 64]', 'dropout': 0.1435836310971646, 'batch_norm': False, 'lr': 0.0002508499159826919, 'weight_decay': 8.437864214437244e-05, 'epochs': 294, 'loss': 'mae', 'optimizer': 'adam', 'graph_mode': 'off', 'use_snp_selection': False}. Best is trial 35 with value: 0.12334639703087553.
[I 2025-11-03 13:29:51,579] Trial 112 finished with value: 0.09789921763164613 and parameters: {'model_type': 'gcn', 'hidden_dims': '[512, 64]', 'dropout': 0.15021539542764453, 'batch_norm': False, 'lr': 0.00016791169821282317, 'weight_decay': 5.9407345802552956e-05, 'epochs': 281, 'loss': 'mae', 'optimizer': 'adam', 'graph_mode': 'off', 'use_snp_selection': False}. Best is trial 35 with value: 0.12334639703087553.
[I 2025-11-03 13:29:54,886] Trial 113 finished with value: 0.03582622524740832 and parameters: {'model_type': 'gcn', 'hidden_dims': '[512, 64]', 'dropout': 0.1639793804399598, 'batch_norm': False, 'lr': 7.449501820390425e-06, 'weight_decay': 0.00011544068002865484, 'epochs': 319, 'loss': 'mae', 'optimizer': 'adam', 'graph_mode': 'off', 'use_snp_selection': False}. Best is trial 35 with value: 0.12334639703087553.
[I 2025-11-03 13:29:58,045] Trial 114 finished with value: 0.09280935256888642 and parameters: {'model_type': 'gcn', 'hidden_dims': '[512, 64]', 'dropout': 0.11565717159765554, 'batch_norm': False, 'lr': 0.00040427146557599995, 'weight_decay': 2.1609200377542998e-05, 'epochs': 297, 'loss': 'mae', 'optimizer': 'adam', 'graph_mode': 'off', 'use_snp_selection': False}. Best is trial 35 with value: 0.12334639703087553.
[I 2025-11-03 13:30:01,067] Trial 115 finished with value: 0.11037403716978895 and parameters: {'model_type': 'gcn', 'hidden_dims': '[512, 256]', 'dropout': 0.12457350163994313, 'batch_norm': False, 'lr': 0.00021362703675879293, 'weight_decay': 0.00037943464847592644, 'epochs': 286, 'loss': 'mae', 'optimizer': 'adam', 'graph_mode': 'off', 'use_snp_selection': False}. Best is trial 35 with value: 0.12334639703087553.
[I 2025-11-03 13:30:04,108] Trial 116 finished with value: 0.08315785678605397 and parameters: {'model_type': 'gcn', 'hidden_dims': '[512, 256]', 'dropout': 0.2034679593417021, 'batch_norm': False, 'lr': 0.00020132633379090194, 'weight_decay': 0.0001335497361640783, 'epochs': 288, 'loss': 'mae', 'optimizer': 'adam', 'graph_mode': 'off', 'use_snp_selection': False}. Best is trial 35 with value: 0.12334639703087553.
[I 2025-11-03 13:30:07,390] Trial 117 finished with value: 0.08480439440072127 and parameters: {'model_type': 'gcn', 'hidden_dims': '[512, 256]', 'dropout': 0.17432190235083642, 'batch_norm': False, 'lr': 0.00012831456298870218, 'weight_decay': 0.00040191265820861926, 'epochs': 316, 'loss': 'mae', 'optimizer': 'adam', 'graph_mode': 'off', 'use_snp_selection': False}. Best is trial 35 with value: 0.12334639703087553.
[I 2025-11-03 13:30:10,659] Trial 118 finished with value: 0.10855495580288366 and parameters: {'model_type': 'gcn', 'hidden_dims': '[512, 256]', 'dropout': 0.13894620053580084, 'batch_norm': False, 'lr': 0.0002819271832059637, 'weight_decay': 0.00016697713520397178, 'epochs': 304, 'loss': 'mae', 'optimizer': 'adam', 'graph_mode': 'off', 'use_snp_selection': False}. Best is trial 35 with value: 0.12334639703087553.
[I 2025-11-03 13:30:12,992] Trial 119 finished with value: 0.12110673111747827 and parameters: {'model_type': 'gcn', 'hidden_dims': '[512, 256]', 'dropout': 0.16214726595412673, 'batch_norm': False, 'lr': 0.00023252799045048137, 'weight_decay': 4.535343684578811e-05, 'epochs': 194, 'loss': 'mae', 'optimizer': 'adam', 'graph_mode': 'off', 'use_snp_selection': False}. Best is trial 35 with value: 0.12334639703087553.
[I 2025-11-03 13:30:15,300] Trial 120 finished with value: 0.09445943710097754 and parameters: {'model_type': 'gcn', 'hidden_dims': '[512, 256]', 'dropout': 0.22261627209841378, 'batch_norm': False, 'lr': 0.0003303263056617666, 'weight_decay': 7.649064545182732e-05, 'epochs': 197, 'loss': 'mae', 'optimizer': 'adam', 'graph_mode': 'off', 'use_snp_selection': False}. Best is trial 35 with value: 0.12334639703087553.
[I 2025-11-03 13:30:18,239] Trial 121 finished with value: 0.11581790981560333 and parameters: {'model_type': 'gcn', 'hidden_dims': '[512, 256]', 'dropout': 0.15754361739576336, 'batch_norm': False, 'lr': 0.00022695196324268267, 'weight_decay': 6.028964464145287e-05, 'epochs': 282, 'loss': 'mae', 'optimizer': 'adam', 'graph_mode': 'off', 'use_snp_selection': False}. Best is trial 35 with value: 0.12334639703087553.
[I 2025-11-03 13:30:20,522] Trial 122 finished with value: 0.08867292517966877 and parameters: {'model_type': 'gcn', 'hidden_dims': '[512, 256]', 'dropout': 0.16379291325505707, 'batch_norm': False, 'lr': 0.00023686765665730444, 'weight_decay': 4.713524758366033e-05, 'epochs': 192, 'loss': 'mae', 'optimizer': 'adam', 'graph_mode': 'off', 'use_snp_selection': False}. Best is trial 35 with value: 0.12334639703087553.
[I 2025-11-03 13:30:22,909] Trial 123 finished with value: 0.11639700267223213 and parameters: {'model_type': 'gcn', 'hidden_dims': '[512, 256]', 'dropout': 0.1523577816995642, 'batch_norm': False, 'lr': 0.00028604586211195134, 'weight_decay': 2.882002924083543e-05, 'epochs': 204, 'loss': 'mae', 'optimizer': 'adam', 'graph_mode': 'off', 'use_snp_selection': False}. Best is trial 35 with value: 0.12334639703087553.
[I 2025-11-03 13:30:25,420] Trial 124 finished with value: 0.1099873343475586 and parameters: {'model_type': 'gcn', 'hidden_dims': '[512, 256]', 'dropout': 0.14809325193991563, 'batch_norm': False, 'lr': 0.0003686592287802405, 'weight_decay': 2.426770176436433e-05, 'epochs': 222, 'loss': 'mae', 'optimizer': 'adam', 'graph_mode': 'off', 'use_snp_selection': False}. Best is trial 35 with value: 0.12334639703087553.
[I 2025-11-03 13:30:27,825] Trial 125 finished with value: 0.07917898540036876 and parameters: {'model_type': 'gcn', 'hidden_dims': '[512, 256]', 'dropout': 0.18551003058179155, 'batch_norm': False, 'lr': 0.00014575501761085574, 'weight_decay': 1.5633540303207236e-05, 'epochs': 206, 'loss': 'mae', 'optimizer': 'adam', 'graph_mode': 'off', 'use_snp_selection': False}. Best is trial 35 with value: 0.12334639703087553.
[I 2025-11-03 13:30:30,293] Trial 126 finished with value: -0.008055085957926351 and parameters: {'model_type': 'gcn', 'hidden_dims': '[512, 256]', 'dropout': 0.1542602198930119, 'batch_norm': False, 'lr': 2.1746722938210624e-06, 'weight_decay': 4.315948678427194e-05, 'epochs': 216, 'loss': 'mae', 'optimizer': 'adam', 'graph_mode': 'off', 'use_snp_selection': False}. Best is trial 35 with value: 0.12334639703087553.
[I 2025-11-03 13:30:31,346] Trial 127 finished with value: 0.08160390823752789 and parameters: {'model_type': 'gcn', 'hidden_dims': '[128, 64]', 'dropout': 0.17690315973686072, 'batch_norm': False, 'lr': 0.00017940292649994084, 'weight_decay': 6.493291663644234e-05, 'epochs': 173, 'loss': 'mae', 'optimizer': 'adam', 'graph_mode': 'off', 'use_snp_selection': False}. Best is trial 35 with value: 0.12334639703087553.
[I 2025-11-03 13:30:32,801] Trial 128 finished with value: 0.076964373319149 and parameters: {'model_type': 'gcn', 'hidden_dims': '[256, 128]', 'dropout': 0.3653114200814037, 'batch_norm': False, 'lr': 0.0002904297699328013, 'weight_decay': 5.0745808190841165e-05, 'epochs': 183, 'loss': 'mae', 'optimizer': 'adam', 'graph_mode': 'off', 'use_snp_selection': False}. Best is trial 35 with value: 0.12334639703087553.
[I 2025-11-03 13:30:35,415] Trial 129 finished with value: 0.10753022976586624 and parameters: {'model_type': 'gcn', 'hidden_dims': '[512, 256]', 'dropout': 0.13815309156285804, 'batch_norm': False, 'lr': 0.00024872727448889935, 'weight_decay': 3.2359670958226546e-05, 'epochs': 234, 'loss': 'mae', 'optimizer': 'adam', 'graph_mode': 'off', 'use_snp_selection': False}. Best is trial 35 with value: 0.12334639703087553.
[I 2025-11-03 13:30:38,161] Trial 130 finished with value: 0.11527387313749655 and parameters: {'model_type': 'gcn', 'hidden_dims': '[512, 256]', 'dropout': 0.1929498585977799, 'batch_norm': False, 'lr': 9.139173416915118e-05, 'weight_decay': 5.786182939324756e-05, 'epochs': 249, 'loss': 'mae', 'optimizer': 'adam', 'graph_mode': 'off', 'use_snp_selection': False}. Best is trial 35 with value: 0.12334639703087553.
[I 2025-11-03 13:30:40,977] Trial 131 finished with value: 0.09504820890556653 and parameters: {'model_type': 'gcn', 'hidden_dims': '[512, 256]', 'dropout': 0.19556856831482597, 'batch_norm': False, 'lr': 9.822732255226133e-05, 'weight_decay': 8.855106977429248e-05, 'epochs': 262, 'loss': 'mae', 'optimizer': 'adam', 'graph_mode': 'off', 'use_snp_selection': False}. Best is trial 35 with value: 0.12334639703087553.
[I 2025-11-03 13:30:43,696] Trial 132 finished with value: 0.08493897092286365 and parameters: {'model_type': 'gcn', 'hidden_dims': '[512, 256]', 'dropout': 0.21379800388416523, 'batch_norm': False, 'lr': 7.226623551829888e-05, 'weight_decay': 2.6886505407180753e-05, 'epochs': 248, 'loss': 'mae', 'optimizer': 'adam', 'graph_mode': 'off', 'use_snp_selection': False}. Best is trial 35 with value: 0.12334639703087553.
[I 2025-11-03 13:30:46,408] Trial 133 finished with value: 0.10357506439706743 and parameters: {'model_type': 'gcn', 'hidden_dims': '[512, 256]', 'dropout': 0.15614761844337888, 'batch_norm': False, 'lr': 5.056426944146346e-05, 'weight_decay': 5.969279846499063e-05, 'epochs': 246, 'loss': 'mae', 'optimizer': 'adam', 'graph_mode': 'off', 'use_snp_selection': False}. Best is trial 35 with value: 0.12334639703087553.
[I 2025-11-03 13:30:49,192] Trial 134 finished with value: 0.058968478049837354 and parameters: {'model_type': 'gcn', 'hidden_dims': '[512, 256]', 'dropout': 0.1281969731322538, 'batch_norm': False, 'lr': 3.6374582112884955e-05, 'weight_decay': 3.7325872013860865e-05, 'epochs': 255, 'loss': 'mae', 'optimizer': 'adam', 'graph_mode': 'off', 'use_snp_selection': False}. Best is trial 35 with value: 0.12334639703087553.
[I 2025-11-03 13:30:52,162] Trial 135 finished with value: 0.09411083710951673 and parameters: {'model_type': 'gcn', 'hidden_dims': '[512, 256]', 'dropout': 0.16829294465973865, 'batch_norm': False, 'lr': 0.00011708337842653848, 'weight_decay': 5.0712647481146266e-05, 'epochs': 280, 'loss': 'mae', 'optimizer': 'adam', 'graph_mode': 'off', 'use_snp_selection': False}. Best is trial 35 with value: 0.12334639703087553.
[I 2025-11-03 13:30:53,867] Trial 136 finished with value: 0.13079192440508616 and parameters: {'model_type': 'gcn', 'hidden_dims': '[256, 128]', 'dropout': 0.14179287863527124, 'batch_norm': False, 'lr': 0.00021628671402915356, 'weight_decay': 7.753245963781703e-05, 'epochs': 237, 'loss': 'mae', 'optimizer': 'adam', 'graph_mode': 'off', 'use_snp_selection': False}. Best is trial 136 with value: 0.13079192440508616.
[I 2025-11-03 13:30:55,580] Trial 137 finished with value: 0.09843572078492266 and parameters: {'model_type': 'gcn', 'hidden_dims': '[256, 128]', 'dropout': 0.18470874038357668, 'batch_norm': False, 'lr': 8.879044690338891e-05, 'weight_decay': 7.762640702773092e-05, 'epochs': 238, 'loss': 'mae', 'optimizer': 'adam', 'graph_mode': 'off', 'use_snp_selection': False}. Best is trial 136 with value: 0.13079192440508616.
[I 2025-11-03 13:30:57,469] Trial 138 finished with value: 0.07475316111497111 and parameters: {'model_type': 'gcn', 'hidden_dims': '[256, 128]', 'dropout': 0.11120789307929607, 'batch_norm': True, 'lr': 0.0001707749777445293, 'weight_decay': 8.801183790861903e-05, 'epochs': 267, 'loss': 'mae', 'optimizer': 'adam', 'graph_mode': 'off', 'use_snp_selection': False}. Best is trial 136 with value: 0.13079192440508616.
[I 2025-11-03 13:30:59,035] Trial 139 finished with value: 0.09944145546495438 and parameters: {'model_type': 'gcn', 'hidden_dims': '[256, 128]', 'dropout': 0.14819647457680982, 'batch_norm': False, 'lr': 0.00022772710310351417, 'weight_decay': 6.806919383817992e-05, 'epochs': 204, 'loss': 'mae', 'optimizer': 'adam', 'graph_mode': 'off', 'use_snp_selection': False}. Best is trial 136 with value: 0.13079192440508616.
[I 2025-11-03 13:31:00,705] Trial 140 finished with value: 0.09741653344463484 and parameters: {'model_type': 'gcn', 'hidden_dims': '[256, 128]', 'dropout': 0.17374685270465404, 'batch_norm': False, 'lr': 0.00021015651352466333, 'weight_decay': 4.437760405757141e-05, 'epochs': 223, 'loss': 'mae', 'optimizer': 'adam', 'graph_mode': 'off', 'use_snp_selection': False}. Best is trial 136 with value: 0.13079192440508616.
[I 2025-11-03 13:31:02,717] Trial 141 finished with value: 0.1040859333642333 and parameters: {'model_type': 'gcn', 'hidden_dims': '[256, 128, 64]', 'dropout': 0.1416729674711385, 'batch_norm': False, 'lr': 0.000334299013124482, 'weight_decay': 0.00014392590785479643, 'epochs': 258, 'loss': 'mae', 'optimizer': 'adam', 'graph_mode': 'off', 'use_snp_selection': False}. Best is trial 136 with value: 0.13079192440508616.
[I 2025-11-03 13:31:05,953] Trial 142 finished with value: 0.08996228992109045 and parameters: {'model_type': 'gcn', 'hidden_dims': '[512, 256]', 'dropout': 0.12844224360997264, 'batch_norm': False, 'lr': 0.00015740221218305946, 'weight_decay': 0.00010314725050304724, 'epochs': 307, 'loss': 'mae', 'optimizer': 'adam', 'graph_mode': 'off', 'use_snp_selection': False}. Best is trial 136 with value: 0.13079192440508616.
[I 2025-11-03 13:31:07,957] Trial 143 finished with value: 0.0910986336461505 and parameters: {'model_type': 'gcn', 'hidden_dims': '[256, 128]', 'dropout': 0.1589009684603221, 'batch_norm': False, 'lr': 0.0002705972466749402, 'weight_decay': 5.525633878483561e-05, 'epochs': 296, 'loss': 'mae', 'optimizer': 'adam', 'graph_mode': 'off', 'use_snp_selection': False}. Best is trial 136 with value: 0.13079192440508616.
[I 2025-11-03 13:31:10,682] Trial 144 finished with value: 0.1184088335621987 and parameters: {'model_type': 'gcn', 'hidden_dims': '[512, 256]', 'dropout': 0.13961550505576073, 'batch_norm': False, 'lr': 0.00019162105372721094, 'weight_decay': 3.7760535965472014e-05, 'epochs': 243, 'loss': 'mae', 'optimizer': 'adam', 'graph_mode': 'off', 'use_snp_selection': False}. Best is trial 136 with value: 0.13079192440508616.
[I 2025-11-03 13:31:13,392] Trial 145 finished with value: 0.10454176986565417 and parameters: {'model_type': 'gcn', 'hidden_dims': '[512, 128]', 'dropout': 0.10188307935216016, 'batch_norm': False, 'lr': 0.00019984497464046132, 'weight_decay': 3.9524650583683974e-05, 'epochs': 248, 'loss': 'mae', 'optimizer': 'adam', 'graph_mode': 'off', 'use_snp_selection': False}. Best is trial 136 with value: 0.13079192440508616.
[I 2025-11-03 13:31:15,955] Trial 146 finished with value: 0.09684613989122313 and parameters: {'model_type': 'gcn', 'hidden_dims': '[512, 256]', 'dropout': 0.13312606007170974, 'batch_norm': False, 'lr': 0.00015167162552113712, 'weight_decay': 3.2715643837649354e-05, 'epochs': 228, 'loss': 'mse', 'optimizer': 'adam', 'graph_mode': 'off', 'use_snp_selection': False}. Best is trial 136 with value: 0.13079192440508616.
[I 2025-11-03 13:31:17,737] Trial 147 finished with value: 0.10621029630143534 and parameters: {'model_type': 'gcn', 'hidden_dims': '[256, 128]', 'dropout': 0.16640667255809766, 'batch_norm': False, 'lr': 0.00035823455655679775, 'weight_decay': 2.637738107633301e-05, 'epochs': 240, 'loss': 'mae', 'optimizer': 'adam', 'graph_mode': 'off', 'use_snp_selection': False}. Best is trial 136 with value: 0.13079192440508616.
[I 2025-11-03 13:31:20,188] Trial 148 finished with value: 0.09686099240933606 and parameters: {'model_type': 'gcn', 'hidden_dims': '[512, 256]', 'dropout': 0.12291296831541118, 'batch_norm': False, 'lr': 0.00013138860125795583, 'weight_decay': 0.00011851579957059966, 'epochs': 216, 'loss': 'mae', 'optimizer': 'adam', 'graph_mode': 'off', 'use_snp_selection': False}. Best is trial 136 with value: 0.13079192440508616.
[I 2025-11-03 13:31:22,824] Trial 149 finished with value: 0.0874760110138485 and parameters: {'model_type': 'gcn', 'hidden_dims': '[512, 256]', 'dropout': 0.1956361389193494, 'batch_norm': False, 'lr': 0.0004129679024197098, 'weight_decay': 6.474559534814733e-05, 'epochs': 236, 'loss': 'mae', 'optimizer': 'adam', 'graph_mode': 'off', 'use_snp_selection': False}. Best is trial 136 with value: 0.13079192440508616.
[I 2025-11-03 13:31:25,475] Trial 0 finished with value: -0.024169596723093628 and parameters: {'model_type': 'gcn', 'hidden_dims': '[128, 64]', 'dropout': 0.199031432379812, 'batch_norm': True, 'lr': 1.8408544111075837e-06, 'weight_decay': 5.5136510071208614e-05, 'epochs': 336, 'loss': 'mae', 'optimizer': 'adam', 'graph_mode': 'off', 'use_snp_selection': True, 'num_snps': 43862}. Best is trial 0 with value: -0.024169596723093628.
[I 2025-11-03 13:31:27,711] Trial 1 finished with value: 0.12228641799969624 and parameters: {'model_type': 'gcn', 'hidden_dims': '[256, 128]', 'dropout': 0.4370668075331726, 'batch_norm': True, 'lr': 7.133471581159139e-05, 'weight_decay': 1.128633586803549e-05, 'epochs': 242, 'loss': 'mae', 'optimizer': 'adam', 'graph_mode': 'off', 'use_snp_selection': False}. Best is trial 1 with value: 0.12228641799969624.
[I 2025-11-03 13:31:29,082] Trial 2 finished with value: 0.04562379015392292 and parameters: {'model_type': 'gcn', 'hidden_dims': '[256, 128, 64]', 'dropout': 0.41314357415569625, 'batch_norm': False, 'lr': 3.952233718592101e-06, 'weight_decay': 0.00026754769258252603, 'epochs': 149, 'loss': 'mse', 'optimizer': 'adam', 'graph_mode': 'off', 'use_snp_selection': True, 'num_snps': 11571}. Best is trial 1 with value: 0.12228641799969624.
[I 2025-11-03 13:31:33,403] Trial 3 finished with value: 0.03628645693214399 and parameters: {'model_type': 'gcn', 'hidden_dims': '[512, 64]', 'dropout': 0.5938127374509361, 'batch_norm': False, 'lr': 5.67704586114731e-06, 'weight_decay': 2.4518087630137052e-05, 'epochs': 320, 'loss': 'mae', 'optimizer': 'adam', 'graph_mode': 'off', 'use_snp_selection': False}. Best is trial 1 with value: 0.12228641799969624.
[I 2025-11-03 13:31:36,828] Trial 4 finished with value: 0.1047746457934208 and parameters: {'model_type': 'gcn', 'hidden_dims': '[512, 128]', 'dropout': 0.25746343592134413, 'batch_norm': True, 'lr': 1.3467657668402788e-06, 'weight_decay': 0.00033087251918647806, 'epochs': 277, 'loss': 'mse', 'optimizer': 'adam', 'graph_mode': 'off', 'use_snp_selection': True, 'num_snps': 36675}. Best is trial 1 with value: 0.12228641799969624.
[I 2025-11-03 13:31:39,113] Trial 5 finished with value: 0.03035530549742724 and parameters: {'model_type': 'gcn', 'hidden_dims': '[512, 64]', 'dropout': 0.38275350994408375, 'batch_norm': True, 'lr': 1.5586664309232824e-06, 'weight_decay': 0.0008227664668621182, 'epochs': 145, 'loss': 'mae', 'optimizer': 'adam', 'graph_mode': 'off', 'use_snp_selection': True, 'num_snps': 32148}. Best is trial 1 with value: 0.12228641799969624.
[I 2025-11-03 13:31:41,002] Trial 6 finished with value: 0.09680369602630363 and parameters: {'model_type': 'gcn', 'hidden_dims': '[256, 128]', 'dropout': 0.3930109900265879, 'batch_norm': False, 'lr': 4.892964372128395e-05, 'weight_decay': 1.5809549317992182e-06, 'epochs': 199, 'loss': 'mse', 'optimizer': 'adam', 'graph_mode': 'off', 'use_snp_selection': False}. Best is trial 1 with value: 0.12228641799969624.
[I 2025-11-03 13:31:42,841] Trial 7 finished with value: 0.11345714924022315 and parameters: {'model_type': 'gcn', 'hidden_dims': '[512, 256]', 'dropout': 0.15343979219678458, 'batch_norm': True, 'lr': 6.234003099047341e-05, 'weight_decay': 3.894760610535477e-07, 'epochs': 97, 'loss': 'mse', 'optimizer': 'adam', 'graph_mode': 'off', 'use_snp_selection': False}. Best is trial 1 with value: 0.12228641799969624.
[I 2025-11-03 13:31:47,141] Trial 8 finished with value: 0.1765874713065526 and parameters: {'model_type': 'gcn', 'hidden_dims': '[512, 128]', 'dropout': 0.10743001231661406, 'batch_norm': True, 'lr': 0.00023728538449271062, 'weight_decay': 1.7629071578048637e-05, 'epochs': 312, 'loss': 'mae', 'optimizer': 'adam', 'graph_mode': 'off', 'use_snp_selection': False}. Best is trial 8 with value: 0.1765874713065526.
