[I 2025-11-03 13:47:18,418] Trial 76 finished with value: 0.12645598744194184 and parameters: {'model_type': 'gcn', 'hidden_dims': '[512, 128]', 'dropout': 0.15232922805107926, 'batch_norm': True, 'lr': 0.0009987973236279559, 'weight_decay': 4.2512732574403886e-07, 'epochs': 193, 'loss': 'mse', 'optimizer': 'adam', 'graph_mode': 'off', 'use_snp_selection': False}. Best is trial 62 with value: 0.13653384210920258.
[I 2025-11-03 13:47:20,114] Trial 77 finished with value: 0.1273326054681233 and parameters: {'model_type': 'gcn', 'hidden_dims': '[512, 256]', 'dropout': 0.1378675269269118, 'batch_norm': True, 'lr': 0.0009631392710804173, 'weight_decay': 4.634783394364804e-07, 'epochs': 193, 'loss': 'mse', 'optimizer': 'adam', 'graph_mode': 'off', 'use_snp_selection': False}. Best is trial 62 with value: 0.13653384210920258.
[I 2025-11-03 13:47:21,030] Trial 78 finished with value: 0.02515473346886837 and parameters: {'model_type': 'gcn', 'hidden_dims': '[512, 256]', 'dropout': 0.1204191694714703, 'batch_norm': True, 'lr': 0.00024038137639882198, 'weight_decay': 7.415869413170803e-07, 'epochs': 192, 'loss': 'mse', 'optimizer': 'adam', 'graph_mode': 'off', 'use_snp_selection': True, 'num_snps': 2246}. Best is trial 62 with value: 0.13653384210920258.
[I 2025-11-03 13:47:22,691] Trial 79 finished with value: 0.11383659013069976 and parameters: {'model_type': 'gcn', 'hidden_dims': '[512, 256]', 'dropout': 0.20006487065236905, 'batch_norm': True, 'lr': 0.0004876923195977383, 'weight_decay': 8.544857661292562e-06, 'epochs': 179, 'loss': 'mse', 'optimizer': 'adam', 'graph_mode': 'off', 'use_snp_selection': False}. Best is trial 62 with value: 0.13653384210920258.
[I 2025-11-03 13:47:24,739] Trial 80 finished with value: 0.11618530309998769 and parameters: {'model_type': 'gcn', 'hidden_dims': '[512, 256]', 'dropout': 0.22478823644391224, 'batch_norm': True, 'lr': 0.0005879915219412178, 'weight_decay': 2.0724550635296057e-07, 'epochs': 252, 'loss': 'mse', 'optimizer': 'adam', 'graph_mode': 'off', 'use_snp_selection': False}. Best is trial 62 with value: 0.13653384210920258.
[I 2025-11-03 13:47:26,547] Trial 81 finished with value: 0.11774948038467928 and parameters: {'model_type': 'gcn', 'hidden_dims': '[512, 256]', 'dropout': 0.1359942634347441, 'batch_norm': True, 'lr': 0.000966736281827976, 'weight_decay': 4.356396527885516e-07, 'epochs': 221, 'loss': 'mse', 'optimizer': 'adam', 'graph_mode': 'off', 'use_snp_selection': False}. Best is trial 62 with value: 0.13653384210920258.
[I 2025-11-03 13:47:28,326] Trial 82 finished with value: 0.13428889122711554 and parameters: {'model_type': 'gcn', 'hidden_dims': '[512, 128]', 'dropout': 0.14983324677231752, 'batch_norm': True, 'lr': 0.0006944503440034278, 'weight_decay': 3.2587570227872173e-07, 'epochs': 212, 'loss': 'mse', 'optimizer': 'adam', 'graph_mode': 'off', 'use_snp_selection': False}. Best is trial 62 with value: 0.13653384210920258.
[I 2025-11-03 13:47:29,929] Trial 83 finished with value: 0.12888458718405038 and parameters: {'model_type': 'gcn', 'hidden_dims': '[512, 128]', 'dropout': 0.15029888450011103, 'batch_norm': True, 'lr': 0.000681307162442945, 'weight_decay': 3.149265438047786e-07, 'epochs': 173, 'loss': 'mse', 'optimizer': 'adam', 'graph_mode': 'off', 'use_snp_selection': False}. Best is trial 62 with value: 0.13653384210920258.
[I 2025-11-03 13:47:31,572] Trial 84 finished with value: 0.1093184298637409 and parameters: {'model_type': 'gcn', 'hidden_dims': '[512, 64]', 'dropout': 0.18443413042970533, 'batch_norm': True, 'lr': 0.00045182483941515596, 'weight_decay': 3.220825490633205e-07, 'epochs': 174, 'loss': 'mse', 'optimizer': 'adam', 'graph_mode': 'off', 'use_snp_selection': False}. Best is trial 62 with value: 0.13653384210920258.
[I 2025-11-03 13:47:33,269] Trial 85 finished with value: 0.12109141471413912 and parameters: {'model_type': 'gcn', 'hidden_dims': '[512, 128]', 'dropout': 0.1528515961413655, 'batch_norm': True, 'lr': 0.0006641561679830679, 'weight_decay': 9.239414044651022e-07, 'epochs': 196, 'loss': 'mse', 'optimizer': 'adam', 'graph_mode': 'off', 'use_snp_selection': False}. Best is trial 62 with value: 0.13653384210920258.
[I 2025-11-03 13:47:34,772] Trial 86 finished with value: 0.061119176810407544 and parameters: {'model_type': 'gcn', 'hidden_dims': '[512, 128]', 'dropout': 0.17363300354169486, 'batch_norm': False, 'lr': 0.0003518387612227245, 'weight_decay': 5.328216754419343e-07, 'epochs': 156, 'loss': 'mse', 'optimizer': 'adam', 'graph_mode': 'off', 'use_snp_selection': False}. Best is trial 62 with value: 0.13653384210920258.
[I 2025-11-03 13:47:36,370] Trial 87 finished with value: 0.13044690527782274 and parameters: {'model_type': 'gcn', 'hidden_dims': '[512, 256]', 'dropout': 0.1661618607959325, 'batch_norm': True, 'lr': 0.0005863828017020778, 'weight_decay': 3.964714093184669e-06, 'epochs': 169, 'loss': 'mse', 'optimizer': 'adam', 'graph_mode': 'off', 'use_snp_selection': False}. Best is trial 62 with value: 0.13653384210920258.
[I 2025-11-03 13:47:37,980] Trial 88 finished with value: 0.07372089417754579 and parameters: {'model_type': 'gcn', 'hidden_dims': '[512, 256]', 'dropout': 0.1662450057092275, 'batch_norm': True, 'lr': 7.713892775275903e-06, 'weight_decay': 4.482772036764857e-06, 'epochs': 170, 'loss': 'mse', 'optimizer': 'adam', 'graph_mode': 'off', 'use_snp_selection': False}. Best is trial 62 with value: 0.13653384210920258.
[I 2025-11-03 13:47:39,437] Trial 89 finished with value: 0.03490069324431508 and parameters: {'model_type': 'gcn', 'hidden_dims': '[512, 256]', 'dropout': 0.12585559175021255, 'batch_norm': True, 'lr': 1.9334669185138083e-06, 'weight_decay': 3.0819559424092664e-06, 'epochs': 142, 'loss': 'mse', 'optimizer': 'adam', 'graph_mode': 'off', 'use_snp_selection': False}. Best is trial 62 with value: 0.13653384210920258.
[I 2025-11-03 13:47:41,560] Trial 90 finished with value: 0.10587563473162771 and parameters: {'model_type': 'gcn', 'hidden_dims': '[512, 256]', 'dropout': 0.45889900964263414, 'batch_norm': True, 'lr': 0.0005660720086852325, 'weight_decay': 1.1815461821115395e-06, 'epochs': 164, 'loss': 'mse', 'optimizer': 'adam', 'graph_mode': 'off', 'use_snp_selection': True, 'num_snps': 48165}. Best is trial 62 with value: 0.13653384210920258.
[I 2025-11-03 13:47:42,740] Trial 91 finished with value: 0.12127959956944125 and parameters: {'model_type': 'gcn', 'hidden_dims': '[256, 128]', 'dropout': 0.14810827704115112, 'batch_norm': True, 'lr': 0.0008568592952407013, 'weight_decay': 5.868512064303428e-06, 'epochs': 181, 'loss': 'mse', 'optimizer': 'adam', 'graph_mode': 'off', 'use_snp_selection': False}. Best is trial 62 with value: 0.13653384210920258.
[I 2025-11-03 13:47:44,505] Trial 92 finished with value: 0.12119620399841508 and parameters: {'model_type': 'gcn', 'hidden_dims': '[512, 256]', 'dropout': 0.19268887573680454, 'batch_norm': True, 'lr': 0.0006761385746262046, 'weight_decay': 2.5726205358111923e-07, 'epochs': 216, 'loss': 'mse', 'optimizer': 'adam', 'graph_mode': 'off', 'use_snp_selection': False}. Best is trial 62 with value: 0.13653384210920258.
[I 2025-11-03 13:47:45,518] Trial 93 finished with value: 0.12828803442763248 and parameters: {'model_type': 'gcn', 'hidden_dims': '[128, 64]', 'dropout': 0.20469521769877316, 'batch_norm': True, 'lr': 0.0008493021918814762, 'weight_decay': 2.005723928503866e-06, 'epochs': 193, 'loss': 'mse', 'optimizer': 'adam', 'graph_mode': 'off', 'use_snp_selection': False}. Best is trial 62 with value: 0.13653384210920258.
[I 2025-11-03 13:47:46,497] Trial 94 finished with value: 0.12098312493742094 and parameters: {'model_type': 'gcn', 'hidden_dims': '[128, 64]', 'dropout': 0.1434227858445747, 'batch_norm': True, 'lr': 0.0004111780515273039, 'weight_decay': 2.1774414861968594e-06, 'epochs': 191, 'loss': 'mse', 'optimizer': 'adam', 'graph_mode': 'off', 'use_snp_selection': False}. Best is trial 62 with value: 0.13653384210920258.
[I 2025-11-03 13:47:47,606] Trial 95 finished with value: 0.0966690643115327 and parameters: {'model_type': 'gcn', 'hidden_dims': '[128, 64]', 'dropout': 0.1702043318371598, 'batch_norm': True, 'lr': 0.0007164742546565802, 'weight_decay': 1.4080290791346213e-06, 'epochs': 239, 'loss': 'mse', 'optimizer': 'adam', 'graph_mode': 'off', 'use_snp_selection': False}. Best is trial 62 with value: 0.13653384210920258.
[I 2025-11-03 13:47:48,412] Trial 96 finished with value: 0.11003325282481007 and parameters: {'model_type': 'gcn', 'hidden_dims': '[128, 64]', 'dropout': 0.2056767178056904, 'batch_norm': True, 'lr': 0.0002854444235718562, 'weight_decay': 6.847097582111877e-07, 'epochs': 124, 'loss': 'mse', 'optimizer': 'adam', 'graph_mode': 'off', 'use_snp_selection': False}. Best is trial 62 with value: 0.13653384210920258.
[I 2025-11-03 13:47:49,511] Trial 97 finished with value: 0.11878001558582982 and parameters: {'model_type': 'gcn', 'hidden_dims': '[128, 64]', 'dropout': 0.15746737545908118, 'batch_norm': True, 'lr': 0.000571884650205351, 'weight_decay': 1.7749014267402685e-06, 'epochs': 229, 'loss': 'mse', 'optimizer': 'adam', 'graph_mode': 'off', 'use_snp_selection': False}. Best is trial 62 with value: 0.13653384210920258.
[I 2025-11-03 13:47:50,900] Trial 98 finished with value: 0.12327593887701756 and parameters: {'model_type': 'gcn', 'hidden_dims': '[256, 128, 64]', 'dropout': 0.1296706777348657, 'batch_norm': True, 'lr': 0.0008537046250782004, 'weight_decay': 3.1585693334366596e-06, 'epochs': 196, 'loss': 'mse', 'optimizer': 'adam', 'graph_mode': 'off', 'use_snp_selection': False}. Best is trial 62 with value: 0.13653384210920258.
[I 2025-11-03 13:47:52,456] Trial 99 finished with value: 0.04726460084390836 and parameters: {'model_type': 'gcn', 'hidden_dims': '[512, 256]', 'dropout': 0.11809773518080416, 'batch_norm': True, 'lr': 3.466336330419348e-05, 'weight_decay': 2.5619634164315362e-06, 'epochs': 177, 'loss': 'mse', 'optimizer': 'adam', 'graph_mode': 'off', 'use_snp_selection': False}. Best is trial 62 with value: 0.13653384210920258.
[I 2025-11-03 13:47:53,445] Trial 100 finished with value: 0.100767419797693 and parameters: {'model_type': 'gcn', 'hidden_dims': '[128, 64]', 'dropout': 0.18849566467129678, 'batch_norm': False, 'lr': 0.0004622587705249055, 'weight_decay': 6.1943565959485555e-06, 'epochs': 214, 'loss': 'mse', 'optimizer': 'adam', 'graph_mode': 'off', 'use_snp_selection': False}. Best is trial 62 with value: 0.13653384210920258.
[I 2025-11-03 13:47:55,093] Trial 101 finished with value: 0.10744950366705228 and parameters: {'model_type': 'gcn', 'hidden_dims': '[512, 128]', 'dropout': 0.24696649745466445, 'batch_norm': True, 'lr': 0.0009928635218469355, 'weight_decay': 1.3575291007507801e-05, 'epochs': 184, 'loss': 'mse', 'optimizer': 'adam', 'graph_mode': 'off', 'use_snp_selection': False}. Best is trial 62 with value: 0.13653384210920258.
[I 2025-11-03 13:47:56,650] Trial 102 finished with value: 0.12489232451905402 and parameters: {'model_type': 'gcn', 'hidden_dims': '[512, 128]', 'dropout': 0.33975189074939044, 'batch_norm': True, 'lr': 0.0006792460532485764, 'weight_decay': 3.5768092683058196e-07, 'epochs': 167, 'loss': 'mse', 'optimizer': 'adam', 'graph_mode': 'off', 'use_snp_selection': False}. Best is trial 62 with value: 0.13653384210920258.
[I 2025-11-03 13:47:58,748] Trial 103 finished with value: 0.12899976576349445 and parameters: {'model_type': 'gcn', 'hidden_dims': '[512, 128]', 'dropout': 0.21703984623130643, 'batch_norm': True, 'lr': 0.000852258619385578, 'weight_decay': 1.8946854799344274e-07, 'epochs': 272, 'loss': 'mse', 'optimizer': 'adam', 'graph_mode': 'off', 'use_snp_selection': False}. Best is trial 62 with value: 0.13653384210920258.
[I 2025-11-03 13:48:00,582] Trial 104 finished with value: 0.10680228145833216 and parameters: {'model_type': 'gcn', 'hidden_dims': '[512, 128]', 'dropout': 0.5527019540758918, 'batch_norm': True, 'lr': 0.0008577436180590589, 'weight_decay': 5.031800148760132e-07, 'epochs': 225, 'loss': 'mse', 'optimizer': 'adam', 'graph_mode': 'off', 'use_snp_selection': False}. Best is trial 62 with value: 0.13653384210920258.
[I 2025-11-03 13:48:02,349] Trial 105 finished with value: 0.1238862644736284 and parameters: {'model_type': 'gcn', 'hidden_dims': '[512, 128]', 'dropout': 0.1731630717851872, 'batch_norm': True, 'lr': 0.0005165122816166551, 'weight_decay': 1.8825129540056796e-07, 'epochs': 209, 'loss': 'mse', 'optimizer': 'adam', 'graph_mode': 'off', 'use_snp_selection': False}. Best is trial 62 with value: 0.13653384210920258.
[I 2025-11-03 13:48:04,411] Trial 106 finished with value: 0.11576776181661695 and parameters: {'model_type': 'gcn', 'hidden_dims': '[512, 128]', 'dropout': 0.2744455150579376, 'batch_norm': True, 'lr': 0.0006218111555352108, 'weight_decay': 3.6086567968233646e-06, 'epochs': 270, 'loss': 'mse', 'optimizer': 'adam', 'graph_mode': 'off', 'use_snp_selection': False}. Best is trial 62 with value: 0.13653384210920258.
[I 2025-11-03 13:48:05,939] Trial 107 finished with value: 0.11579329753907551 and parameters: {'model_type': 'gcn', 'hidden_dims': '[512, 64]', 'dropout': 0.14158793834452513, 'batch_norm': True, 'lr': 0.0007434517505469086, 'weight_decay': 2.6989635334425394e-07, 'epochs': 157, 'loss': 'mse', 'optimizer': 'adam', 'graph_mode': 'off', 'use_snp_selection': False}. Best is trial 62 with value: 0.13653384210920258.
[I 2025-11-03 13:48:07,854] Trial 108 finished with value: 0.1266795311778403 and parameters: {'model_type': 'gcn', 'hidden_dims': '[512, 128]', 'dropout': 0.11188970354974384, 'batch_norm': True, 'lr': 0.0008612506513084651, 'weight_decay': 6.586493811957471e-07, 'epochs': 245, 'loss': 'mse', 'optimizer': 'adam', 'graph_mode': 'off', 'use_snp_selection': False}. Best is trial 62 with value: 0.13653384210920258.
[I 2025-11-03 13:48:09,843] Trial 109 finished with value: 0.12720106349414542 and parameters: {'model_type': 'gcn', 'hidden_dims': '[512, 128]', 'dropout': 0.11169630410204948, 'batch_norm': True, 'lr': 0.0008204288841108912, 'weight_decay': 6.776428325917502e-07, 'epochs': 259, 'loss': 'mse', 'optimizer': 'adam', 'graph_mode': 'off', 'use_snp_selection': False}. Best is trial 62 with value: 0.13653384210920258.
[I 2025-11-03 13:48:11,572] Trial 110 finished with value: 0.09910779189982638 and parameters: {'model_type': 'gcn', 'hidden_dims': '[512, 128]', 'dropout': 0.3847628244086992, 'batch_norm': True, 'lr': 0.0003872073349991525, 'weight_decay': 9.22488743073627e-07, 'epochs': 260, 'loss': 'mse', 'optimizer': 'adam', 'graph_mode': 'off', 'use_snp_selection': True, 'num_snps': 26398}. Best is trial 62 with value: 0.13653384210920258.
[I 2025-11-03 13:48:13,513] Trial 111 finished with value: 0.11697521100202539 and parameters: {'model_type': 'gcn', 'hidden_dims': '[512, 128]', 'dropout': 0.11323839614851404, 'batch_norm': True, 'lr': 0.0008209157223090977, 'weight_decay': 6.637001311882019e-07, 'epochs': 246, 'loss': 'mse', 'optimizer': 'adam', 'graph_mode': 'off', 'use_snp_selection': False}. Best is trial 62 with value: 0.13653384210920258.
[I 2025-11-03 13:48:15,527] Trial 112 finished with value: 0.12100953433515779 and parameters: {'model_type': 'gcn', 'hidden_dims': '[512, 128]', 'dropout': 0.12342649184754799, 'batch_norm': True, 'lr': 0.0006136675414865596, 'weight_decay': 3.353058285932023e-07, 'epochs': 254, 'loss': 'mse', 'optimizer': 'adam', 'graph_mode': 'off', 'use_snp_selection': False}. Best is trial 62 with value: 0.13653384210920258.
[I 2025-11-03 13:48:17,412] Trial 113 finished with value: 0.12151933346050574 and parameters: {'model_type': 'gcn', 'hidden_dims': '[512, 128]', 'dropout': 0.13470957758283797, 'batch_norm': True, 'lr': 0.0007240326430389419, 'weight_decay': 1.227231331171561e-06, 'epochs': 236, 'loss': 'mse', 'optimizer': 'adam', 'graph_mode': 'off', 'use_snp_selection': False}. Best is trial 62 with value: 0.13653384210920258.
[I 2025-11-03 13:48:19,685] Trial 114 finished with value: 0.11106106947971668 and parameters: {'model_type': 'gcn', 'hidden_dims': '[512, 128]', 'dropout': 0.10972023850801199, 'batch_norm': True, 'lr': 0.0005161661897087129, 'weight_decay': 5.845786514529438e-07, 'epochs': 301, 'loss': 'mse', 'optimizer': 'adam', 'graph_mode': 'off', 'use_snp_selection': False}. Best is trial 62 with value: 0.13653384210920258.
[I 2025-11-03 13:48:21,228] Trial 115 finished with value: 0.11622501075728348 and parameters: {'model_type': 'gcn', 'hidden_dims': '[256, 128]', 'dropout': 0.21987236818730668, 'batch_norm': True, 'lr': 0.0008658970791169071, 'weight_decay': 8.443675090713657e-07, 'epochs': 288, 'loss': 'mse', 'optimizer': 'adam', 'graph_mode': 'off', 'use_snp_selection': False}. Best is trial 62 with value: 0.13653384210920258.
[I 2025-11-03 13:48:25,612] Trial 116 finished with value: 0.07534697853017633 and parameters: {'model_type': 'gcn', 'hidden_dims': '[512, 128]', 'dropout': 0.15929962481643714, 'batch_norm': True, 'lr': 1.7790035000005204e-05, 'weight_decay': 1.7762244294906945e-06, 'epochs': 276, 'loss': 'mse', 'optimizer': 'adam', 'graph_mode': 'off', 'use_snp_selection': False}. Best is trial 62 with value: 0.13653384210920258.
[I 2025-11-03 13:48:27,612] Trial 117 finished with value: 0.12184522972646433 and parameters: {'model_type': 'gcn', 'hidden_dims': '[512, 128]', 'dropout': 0.13175410066301982, 'batch_norm': True, 'lr': 0.0006659263248600786, 'weight_decay': 2.276711314554489e-07, 'epochs': 242, 'loss': 'mse', 'optimizer': 'adam', 'graph_mode': 'off', 'use_snp_selection': False}. Best is trial 62 with value: 0.13653384210920258.
[I 2025-11-03 13:48:29,284] Trial 118 finished with value: 0.12065926611274198 and parameters: {'model_type': 'gcn', 'hidden_dims': '[512, 256]', 'dropout': 0.14169344778446138, 'batch_norm': True, 'lr': 0.0005654273948639384, 'weight_decay': 1.5018164991186767e-07, 'epochs': 201, 'loss': 'mse', 'optimizer': 'adam', 'graph_mode': 'off', 'use_snp_selection': False}. Best is trial 62 with value: 0.13653384210920258.
[I 2025-11-03 13:48:31,082] Trial 119 finished with value: 0.11285950313468524 and parameters: {'model_type': 'gcn', 'hidden_dims': '[512, 128]', 'dropout': 0.2013415066714216, 'batch_norm': True, 'lr': 0.0007523044334539607, 'weight_decay': 5.173305262427499e-07, 'epochs': 220, 'loss': 'mse', 'optimizer': 'adam', 'graph_mode': 'off', 'use_snp_selection': False}. Best is trial 62 with value: 0.13653384210920258.
[I 2025-11-03 13:48:33,023] Trial 120 finished with value: -0.04103588731127515 and parameters: {'model_type': 'gcn', 'hidden_dims': '[512, 128]', 'dropout': 0.11929271688931557, 'batch_norm': False, 'lr': 0.00046646618991583806, 'weight_decay': 1.9353099727180266e-07, 'epochs': 267, 'loss': 'mse', 'optimizer': 'adam', 'graph_mode': 'off', 'use_snp_selection': False}. Best is trial 62 with value: 0.13653384210920258.
[I 2025-11-03 13:48:34,633] Trial 121 finished with value: 0.10927065827444747 and parameters: {'model_type': 'gcn', 'hidden_dims': '[512, 128]', 'dropout': 0.14945667893148723, 'batch_norm': True, 'lr': 0.0009267361022741515, 'weight_decay': 4.065694254363962e-07, 'epochs': 186, 'loss': 'mse', 'optimizer': 'adam', 'graph_mode': 'off', 'use_snp_selection': False}. Best is trial 62 with value: 0.13653384210920258.
[I 2025-11-03 13:48:36,288] Trial 122 finished with value: 0.12702766368912435 and parameters: {'model_type': 'gcn', 'hidden_dims': '[512, 128]', 'dropout': 0.15604377971815675, 'batch_norm': True, 'lr': 0.000975344388004, 'weight_decay': 2.896580938998809e-07, 'epochs': 192, 'loss': 'mse', 'optimizer': 'adam', 'graph_mode': 'off', 'use_snp_selection': False}. Best is trial 62 with value: 0.13653384210920258.
[I 2025-11-03 13:48:38,286] Trial 123 finished with value: 0.11016262226397805 and parameters: {'model_type': 'gcn', 'hidden_dims': '[512, 128]', 'dropout': 0.11086524543282714, 'batch_norm': True, 'lr': 0.0007933330945756192, 'weight_decay': 2.900133485828645e-07, 'epochs': 257, 'loss': 'mse', 'optimizer': 'adam', 'graph_mode': 'off', 'use_snp_selection': False}. Best is trial 62 with value: 0.13653384210920258.
[I 2025-11-03 13:48:40,147] Trial 124 finished with value: 0.12194222954562212 and parameters: {'model_type': 'gcn', 'hidden_dims': '[512, 128]', 'dropout': 0.16885002172953165, 'batch_norm': True, 'lr': 0.000642720058632301, 'weight_decay': 2.428583857560881e-07, 'epochs': 229, 'loss': 'mse', 'optimizer': 'adam', 'graph_mode': 'off', 'use_snp_selection': False}. Best is trial 62 with value: 0.13653384210920258.
[I 2025-11-03 13:48:41,461] Trial 125 finished with value: 0.1245322959309747 and parameters: {'model_type': 'gcn', 'hidden_dims': '[256, 128, 64]', 'dropout': 0.1588471148880996, 'batch_norm': True, 'lr': 0.0007856581816097344, 'weight_decay': 3.5724054572825977e-07, 'epochs': 174, 'loss': 'mse', 'optimizer': 'adam', 'graph_mode': 'off', 'use_snp_selection': False}. Best is trial 62 with value: 0.13653384210920258.
[I 2025-11-03 13:48:43,544] Trial 126 finished with value: 0.11329395870187958 and parameters: {'model_type': 'gcn', 'hidden_dims': '[512, 128]', 'dropout': 0.12827706207080153, 'batch_norm': True, 'lr': 0.0008728063120870366, 'weight_decay': 1.09989509144601e-07, 'epochs': 278, 'loss': 'mse', 'optimizer': 'adam', 'graph_mode': 'off', 'use_snp_selection': False}. Best is trial 62 with value: 0.13653384210920258.
[I 2025-11-03 13:48:44,591] Trial 127 finished with value: 0.10413872382285166 and parameters: {'model_type': 'gcn', 'hidden_dims': '[128, 64]', 'dropout': 0.1760437494611472, 'batch_norm': True, 'lr': 0.0005404696204826395, 'weight_decay': 0.0002331336243630608, 'epochs': 208, 'loss': 'mse', 'optimizer': 'adam', 'graph_mode': 'off', 'use_snp_selection': False}. Best is trial 62 with value: 0.13653384210920258.
