[I 2025-11-03 13:39:13,910] Trial 67 finished with value: -0.0013857295742267023 and parameters: {'model_type': 'gcn', 'hidden_dims': '[128, 64]', 'dropout': 0.16168726810606915, 'batch_norm': True, 'lr': 1.0387880921401811e-06, 'weight_decay': 0.00010629255727546249, 'epochs': 86, 'loss': 'mae', 'optimizer': 'adam', 'graph_mode': 'off', 'use_snp_selection': False}. Best is trial 41 with value: 0.14668912833758807.
[I 2025-11-03 13:39:14,743] Trial 68 finished with value: 0.12255145781127658 and parameters: {'model_type': 'gcn', 'hidden_dims': '[128, 64]', 'dropout': 0.41003159246147036, 'batch_norm': True, 'lr': 0.00011682519985409949, 'weight_decay': 0.0002403622624218492, 'epochs': 122, 'loss': 'mae', 'optimizer': 'adam', 'graph_mode': 'off', 'use_snp_selection': False}. Best is trial 41 with value: 0.14668912833758807.
[I 2025-11-03 13:39:15,600] Trial 69 finished with value: 0.09625934494394768 and parameters: {'model_type': 'gcn', 'hidden_dims': '[128, 64]', 'dropout': 0.1909527598202756, 'batch_norm': False, 'lr': 0.00032418554836732084, 'weight_decay': 0.0006342464576608265, 'epochs': 138, 'loss': 'mae', 'optimizer': 'adam', 'graph_mode': 'off', 'use_snp_selection': False}. Best is trial 41 with value: 0.14668912833758807.
[I 2025-11-03 13:39:17,413] Trial 70 finished with value: 0.13991617675047235 and parameters: {'model_type': 'gcn', 'hidden_dims': '[512, 256]', 'dropout': 0.26973109476289087, 'batch_norm': True, 'lr': 0.0007497281582598598, 'weight_decay': 0.0003679447727179543, 'epochs': 166, 'loss': 'mae', 'optimizer': 'adam', 'graph_mode': 'off', 'use_snp_selection': False}. Best is trial 41 with value: 0.14668912833758807.
[I 2025-11-03 13:39:19,672] Trial 71 finished with value: 0.1340647098048343 and parameters: {'model_type': 'gcn', 'hidden_dims': '[512, 128]', 'dropout': 0.11367493478545472, 'batch_norm': True, 'lr': 0.000747933935605212, 'weight_decay': 3.7514741867160666e-06, 'epochs': 233, 'loss': 'mae', 'optimizer': 'adam', 'graph_mode': 'off', 'use_snp_selection': False}. Best is trial 41 with value: 0.14668912833758807.
[I 2025-11-03 13:39:20,595] Trial 72 finished with value: 0.1284479075125954 and parameters: {'model_type': 'gcn', 'hidden_dims': '[128, 64]', 'dropout': 0.13367507099270642, 'batch_norm': True, 'lr': 0.00045059920663971054, 'weight_decay': 9.126312102312814e-06, 'epochs': 152, 'loss': 'mae', 'optimizer': 'adam', 'graph_mode': 'off', 'use_snp_selection': False}. Best is trial 41 with value: 0.14668912833758807.
[I 2025-11-03 13:39:22,548] Trial 73 finished with value: 0.14108263160266057 and parameters: {'model_type': 'gcn', 'hidden_dims': '[512, 128]', 'dropout': 0.152651323263012, 'batch_norm': True, 'lr': 0.0005950987766227862, 'weight_decay': 0.0009723175659163881, 'epochs': 189, 'loss': 'mae', 'optimizer': 'adam', 'graph_mode': 'off', 'use_snp_selection': False}. Best is trial 41 with value: 0.14668912833758807.
[I 2025-11-03 13:39:23,548] Trial 74 finished with value: 0.1318332418564082 and parameters: {'model_type': 'gcn', 'hidden_dims': '[128, 64]', 'dropout': 0.154995616822206, 'batch_norm': True, 'lr': 0.0005616574570761802, 'weight_decay': 0.0009410971723619422, 'epochs': 174, 'loss': 'mae', 'optimizer': 'adam', 'graph_mode': 'off', 'use_snp_selection': False}. Best is trial 41 with value: 0.14668912833758807.
[I 2025-11-03 13:39:25,316] Trial 75 finished with value: 0.1340572294439794 and parameters: {'model_type': 'gcn', 'hidden_dims': '[512, 64]', 'dropout': 0.1752555086807897, 'batch_norm': True, 'lr': 0.0003543934510926692, 'weight_decay': 0.0006577897357766757, 'epochs': 165, 'loss': 'mae', 'optimizer': 'adam', 'graph_mode': 'off', 'use_snp_selection': False}. Best is trial 41 with value: 0.14668912833758807.
[I 2025-11-03 13:39:26,276] Trial 76 finished with value: 0.11956473202378036 and parameters: {'model_type': 'gcn', 'hidden_dims': '[512, 128]', 'dropout': 0.24271936659393825, 'batch_norm': True, 'lr': 0.0007782432912743928, 'weight_decay': 0.0004781387369101173, 'epochs': 187, 'loss': 'mae', 'optimizer': 'adam', 'graph_mode': 'off', 'use_snp_selection': True, 'num_snps': 3325}. Best is trial 41 with value: 0.14668912833758807.
[I 2025-11-03 13:39:27,171] Trial 77 finished with value: 0.12485921281402557 and parameters: {'model_type': 'gcn', 'hidden_dims': '[128, 64]', 'dropout': 0.13114116630826228, 'batch_norm': True, 'lr': 0.000604313520057489, 'weight_decay': 0.0001569633083291692, 'epochs': 139, 'loss': 'mae', 'optimizer': 'adam', 'graph_mode': 'off', 'use_snp_selection': False}. Best is trial 41 with value: 0.14668912833758807.
[I 2025-11-03 13:39:28,746] Trial 78 finished with value: 0.12185455087831551 and parameters: {'model_type': 'gcn', 'hidden_dims': '[256, 128, 64]', 'dropout': 0.5356701739994624, 'batch_norm': True, 'lr': 0.0008406772080865, 'weight_decay': 2.862963686334522e-05, 'epochs': 199, 'loss': 'mse', 'optimizer': 'adam', 'graph_mode': 'off', 'use_snp_selection': False}. Best is trial 41 with value: 0.14668912833758807.
[I 2025-11-03 13:39:31,268] Trial 79 finished with value: 0.13189545534976022 and parameters: {'model_type': 'gcn', 'hidden_dims': '[512, 128]', 'dropout': 0.22518184180651055, 'batch_norm': True, 'lr': 0.0003139743227807389, 'weight_decay': 9.540849505324967e-05, 'epochs': 278, 'loss': 'mae', 'optimizer': 'adam', 'graph_mode': 'off', 'use_snp_selection': False}. Best is trial 41 with value: 0.14668912833758807.
[I 2025-11-03 13:39:33,373] Trial 80 finished with value: 0.10971737810182147 and parameters: {'model_type': 'gcn', 'hidden_dims': '[512, 256]', 'dropout': 0.5999652431159568, 'batch_norm': False, 'lr': 0.00015297396130553183, 'weight_decay': 4.274965251925516e-05, 'epochs': 217, 'loss': 'mae', 'optimizer': 'adam', 'graph_mode': 'off', 'use_snp_selection': False}. Best is trial 41 with value: 0.14668912833758807.
[I 2025-11-03 13:39:35,744] Trial 81 finished with value: 0.14024373197629536 and parameters: {'model_type': 'gcn', 'hidden_dims': '[512, 128]', 'dropout': 0.10996901611693767, 'batch_norm': True, 'lr': 0.0005019807683843333, 'weight_decay': 1.345471595000761e-06, 'epochs': 253, 'loss': 'mae', 'optimizer': 'adam', 'graph_mode': 'off', 'use_snp_selection': False}. Best is trial 41 with value: 0.14668912833758807.
[I 2025-11-03 13:39:38,032] Trial 82 finished with value: 0.1412308891957714 and parameters: {'model_type': 'gcn', 'hidden_dims': '[512, 128]', 'dropout': 0.14694048221900824, 'batch_norm': True, 'lr': 0.0009777702010475796, 'weight_decay': 2.310746567290308e-06, 'epochs': 240, 'loss': 'mae', 'optimizer': 'adam', 'graph_mode': 'off', 'use_snp_selection': False}. Best is trial 41 with value: 0.14668912833758807.
[I 2025-11-03 13:39:40,295] Trial 83 finished with value: 0.13955694669985355 and parameters: {'model_type': 'gcn', 'hidden_dims': '[512, 128]', 'dropout': 0.15101352779411606, 'batch_norm': True, 'lr': 0.0009753831363854487, 'weight_decay': 8.115072380640454e-07, 'epochs': 237, 'loss': 'mae', 'optimizer': 'adam', 'graph_mode': 'off', 'use_snp_selection': False}. Best is trial 41 with value: 0.14668912833758807.
[I 2025-11-03 13:39:42,158] Trial 84 finished with value: 0.13145653645943628 and parameters: {'model_type': 'gcn', 'hidden_dims': '[512, 128]', 'dropout': 0.18054663049151726, 'batch_norm': True, 'lr': 0.0006924880748095872, 'weight_decay': 0.0007321646290931491, 'epochs': 174, 'loss': 'mae', 'optimizer': 'adam', 'graph_mode': 'off', 'use_snp_selection': False}. Best is trial 41 with value: 0.14668912833758807.
[I 2025-11-03 13:39:43,548] Trial 85 finished with value: 0.1205921970204754 and parameters: {'model_type': 'gcn', 'hidden_dims': '[128, 64]', 'dropout': 0.30071479550015157, 'batch_norm': True, 'lr': 0.00040908979284235846, 'weight_decay': 0.0004650493782552056, 'epochs': 308, 'loss': 'mae', 'optimizer': 'adam', 'graph_mode': 'off', 'use_snp_selection': False}. Best is trial 41 with value: 0.14668912833758807.
[I 2025-11-03 13:39:45,301] Trial 86 finished with value: 0.13426871303999816 and parameters: {'model_type': 'gcn', 'hidden_dims': '[512, 128]', 'dropout': 0.33342030689603136, 'batch_norm': True, 'lr': 0.0008442941180843855, 'weight_decay': 1.4462448402818641e-05, 'epochs': 157, 'loss': 'mae', 'optimizer': 'adam', 'graph_mode': 'off', 'use_snp_selection': False}. Best is trial 41 with value: 0.14668912833758807.
[I 2025-11-03 13:39:46,553] Trial 87 finished with value: 0.1405671425339462 and parameters: {'model_type': 'gcn', 'hidden_dims': '[128, 64]', 'dropout': 0.16633294741265567, 'batch_norm': True, 'lr': 0.000617852305594812, 'weight_decay': 0.00031628767843022823, 'epochs': 252, 'loss': 'mae', 'optimizer': 'adam', 'graph_mode': 'off', 'use_snp_selection': False}. Best is trial 41 with value: 0.14668912833758807.
[I 2025-11-03 13:39:49,126] Trial 88 finished with value: 0.13872482538943237 and parameters: {'model_type': 'gcn', 'hidden_dims': '[512, 128]', 'dropout': 0.14071647528036174, 'batch_norm': True, 'lr': 0.0005355627674094054, 'weight_decay': 1.7332948669133633e-06, 'epochs': 226, 'loss': 'mse', 'optimizer': 'adam', 'graph_mode': 'off', 'use_snp_selection': True, 'num_snps': 48766}. Best is trial 41 with value: 0.14668912833758807.
[I 2025-11-03 13:39:51,135] Trial 89 finished with value: 0.1036226753164276 and parameters: {'model_type': 'gcn', 'hidden_dims': '[512, 64]', 'dropout': 0.12293008102953819, 'batch_norm': True, 'lr': 2.2200550873473723e-05, 'weight_decay': 4.535398001365761e-07, 'epochs': 192, 'loss': 'mae', 'optimizer': 'adam', 'graph_mode': 'off', 'use_snp_selection': False}. Best is trial 41 with value: 0.14668912833758807.
[I 2025-11-03 13:39:52,005] Trial 90 finished with value: 0.11054545193813421 and parameters: {'model_type': 'gcn', 'hidden_dims': '[128, 64]', 'dropout': 0.20285603045733952, 'batch_norm': True, 'lr': 0.00020512511063486099, 'weight_decay': 5.230502211271359e-06, 'epochs': 123, 'loss': 'mae', 'optimizer': 'adam', 'graph_mode': 'off', 'use_snp_selection': False}. Best is trial 41 with value: 0.14668912833758807.
[I 2025-11-03 13:39:54,095] Trial 91 finished with value: 0.10922370967189371 and parameters: {'model_type': 'gcn', 'hidden_dims': '[512, 128]', 'dropout': 0.11304881531569551, 'batch_norm': True, 'lr': 7.591804750216678e-05, 'weight_decay': 2.644546657791743e-06, 'epochs': 208, 'loss': 'mae', 'optimizer': 'adam', 'graph_mode': 'off', 'use_snp_selection': False}. Best is trial 41 with value: 0.14668912833758807.
[I 2025-11-03 13:39:56,155] Trial 92 finished with value: 0.13090099262252142 and parameters: {'model_type': 'gcn', 'hidden_dims': '[512, 128]', 'dropout': 0.12862238456941005, 'batch_norm': True, 'lr': 0.0006706728450803563, 'weight_decay': 3.949170955090386e-06, 'epochs': 206, 'loss': 'mae', 'optimizer': 'adam', 'graph_mode': 'off', 'use_snp_selection': False}. Best is trial 41 with value: 0.14668912833758807.
[I 2025-11-03 13:39:58,255] Trial 93 finished with value: 0.14757597189767274 and parameters: {'model_type': 'gcn', 'hidden_dims': '[512, 128]', 'dropout': 0.14669407733508935, 'batch_norm': True, 'lr': 0.0009993248904801193, 'weight_decay': 2.0040678445330237e-06, 'epochs': 213, 'loss': 'mae', 'optimizer': 'adam', 'graph_mode': 'off', 'use_snp_selection': False}. Best is trial 93 with value: 0.14757597189767274.
[I 2025-11-03 13:40:00,416] Trial 94 finished with value: 0.14363248065373527 and parameters: {'model_type': 'gcn', 'hidden_dims': '[512, 128]', 'dropout': 0.14769002775148207, 'batch_norm': True, 'lr': 0.0008785633687204469, 'weight_decay': 2.1609779523858254e-06, 'epochs': 214, 'loss': 'mae', 'optimizer': 'adam', 'graph_mode': 'off', 'use_snp_selection': False}. Best is trial 93 with value: 0.14757597189767274.
[I 2025-11-03 13:40:02,546] Trial 95 finished with value: 0.1412763281732991 and parameters: {'model_type': 'gcn', 'hidden_dims': '[512, 128]', 'dropout': 0.16650220912929872, 'batch_norm': True, 'lr': 0.0009961954963632357, 'weight_decay': 1.1099651066148962e-06, 'epochs': 212, 'loss': 'mae', 'optimizer': 'adam', 'graph_mode': 'off', 'use_snp_selection': False}. Best is trial 93 with value: 0.14757597189767274.
[I 2025-11-03 13:40:04,243] Trial 96 finished with value: 0.12772491715905177 and parameters: {'model_type': 'gcn', 'hidden_dims': '[256, 128, 64]', 'dropout': 0.18934047048621702, 'batch_norm': True, 'lr': 0.0008049812014690169, 'weight_decay': 1.2332656404573467e-06, 'epochs': 213, 'loss': 'mae', 'optimizer': 'adam', 'graph_mode': 'off', 'use_snp_selection': False}. Best is trial 93 with value: 0.14757597189767274.
[I 2025-11-03 13:40:05,368] Trial 97 finished with value: 0.1379765995834936 and parameters: {'model_type': 'gcn', 'hidden_dims': '[128, 64]', 'dropout': 0.1708882714444876, 'batch_norm': True, 'lr': 0.0004657933915466235, 'weight_decay': 9.159549924091002e-07, 'epochs': 217, 'loss': 'mae', 'optimizer': 'adam', 'graph_mode': 'off', 'use_snp_selection': False}. Best is trial 93 with value: 0.14757597189767274.
[I 2025-11-03 13:40:07,566] Trial 98 finished with value: 0.11559298572901852 and parameters: {'model_type': 'gcn', 'hidden_dims': '[512, 128]', 'dropout': 0.3456701791353259, 'batch_norm': False, 'lr': 0.0008628377574088396, 'weight_decay': 1.9877370158760618e-06, 'epochs': 231, 'loss': 'mae', 'optimizer': 'adam', 'graph_mode': 'off', 'use_snp_selection': False}. Best is trial 93 with value: 0.14757597189767274.
[I 2025-11-03 13:40:08,898] Trial 99 finished with value: 0.07704887309524054 and parameters: {'model_type': 'gcn', 'hidden_dims': '[256, 128]', 'dropout': 0.13503317048281188, 'batch_norm': True, 'lr': 2.3294687156157485e-06, 'weight_decay': 2.931024893768131e-06, 'epochs': 180, 'loss': 'mae', 'optimizer': 'adam', 'graph_mode': 'off', 'use_snp_selection': False}. Best is trial 93 with value: 0.14757597189767274.
[I 2025-11-03 13:40:09,781] Trial 100 finished with value: 0.12569288712300583 and parameters: {'model_type': 'gcn', 'hidden_dims': '[128, 64]', 'dropout': 0.25803231325318815, 'batch_norm': True, 'lr': 0.0007411004978619564, 'weight_decay': 5.147242175299727e-07, 'epochs': 133, 'loss': 'mae', 'optimizer': 'adam', 'graph_mode': 'off', 'use_snp_selection': False}. Best is trial 93 with value: 0.14757597189767274.
[I 2025-11-03 13:40:12,105] Trial 101 finished with value: 0.14414479360131238 and parameters: {'model_type': 'gcn', 'hidden_dims': '[512, 128]', 'dropout': 0.14215496492084767, 'batch_norm': True, 'lr': 0.0009961056381607416, 'weight_decay': 1.513568232693649e-06, 'epochs': 244, 'loss': 'mae', 'optimizer': 'adam', 'graph_mode': 'off', 'use_snp_selection': False}. Best is trial 93 with value: 0.14757597189767274.
[I 2025-11-03 13:40:14,122] Trial 102 finished with value: 0.1368105102571576 and parameters: {'model_type': 'gcn', 'hidden_dims': '[512, 128]', 'dropout': 0.1611533822096943, 'batch_norm': True, 'lr': 0.0008910686763450783, 'weight_decay': 2.9666228523154957e-07, 'epochs': 198, 'loss': 'mae', 'optimizer': 'adam', 'graph_mode': 'off', 'use_snp_selection': False}. Best is trial 93 with value: 0.14757597189767274.
[I 2025-11-03 13:40:16,296] Trial 103 finished with value: 0.15081495201159137 and parameters: {'model_type': 'gcn', 'hidden_dims': '[512, 128]', 'dropout': 0.2107372335768397, 'batch_norm': True, 'lr': 0.0009975119880286125, 'weight_decay': 1.0367417063203509e-06, 'epochs': 222, 'loss': 'mae', 'optimizer': 'adam', 'graph_mode': 'off', 'use_snp_selection': False}. Best is trial 103 with value: 0.15081495201159137.
[I 2025-11-03 13:40:18,509] Trial 104 finished with value: 0.13607495283685053 and parameters: {'model_type': 'gcn', 'hidden_dims': '[512, 128]', 'dropout': 0.2336747342338183, 'batch_norm': True, 'lr': 0.0006703975079343567, 'weight_decay': 7.017819311678255e-07, 'epochs': 224, 'loss': 'mae', 'optimizer': 'adam', 'graph_mode': 'off', 'use_snp_selection': False}. Best is trial 103 with value: 0.15081495201159137.
[I 2025-11-03 13:40:19,749] Trial 105 finished with value: 0.13453685775448604 and parameters: {'model_type': 'gcn', 'hidden_dims': '[128, 64]', 'dropout': 0.1855463138286781, 'batch_norm': True, 'lr': 0.0005283326605392404, 'weight_decay': 1.5940209453627744e-06, 'epochs': 248, 'loss': 'mae', 'optimizer': 'adam', 'graph_mode': 'off', 'use_snp_selection': False}. Best is trial 103 with value: 0.15081495201159137.
[I 2025-11-03 13:40:22,269] Trial 106 finished with value: 0.14339517462881288 and parameters: {'model_type': 'gcn', 'hidden_dims': '[512, 256]', 'dropout': 0.21237557653032743, 'batch_norm': True, 'lr': 0.0003897520233180197, 'weight_decay': 5.6174278087226215e-05, 'epochs': 270, 'loss': 'mae', 'optimizer': 'adam', 'graph_mode': 'off', 'use_snp_selection': False}. Best is trial 103 with value: 0.15081495201159137.
[I 2025-11-03 13:40:24,722] Trial 107 finished with value: 0.03642054487417086 and parameters: {'model_type': 'gcn', 'hidden_dims': '[512, 256]', 'dropout': 0.20611794871140415, 'batch_norm': True, 'lr': 9.440290549629086e-06, 'weight_decay': 9.159982801660665e-06, 'epochs': 267, 'loss': 'mse', 'optimizer': 'adam', 'graph_mode': 'off', 'use_snp_selection': False}. Best is trial 103 with value: 0.15081495201159137.
[I 2025-11-03 13:40:25,930] Trial 108 finished with value: 0.13180864753393576 and parameters: {'model_type': 'gcn', 'hidden_dims': '[512, 256]', 'dropout': 0.20095603943843213, 'batch_norm': True, 'lr': 0.00038233493332814894, 'weight_decay': 1.0132954582612213e-06, 'epochs': 202, 'loss': 'mae', 'optimizer': 'adam', 'graph_mode': 'off', 'use_snp_selection': True, 'num_snps': 11322}. Best is trial 103 with value: 0.15081495201159137.
[I 2025-11-03 13:40:28,472] Trial 109 finished with value: 0.1375876249904353 and parameters: {'model_type': 'gcn', 'hidden_dims': '[512, 256]', 'dropout': 0.21951995632557014, 'batch_norm': True, 'lr': 0.0008503461461236658, 'weight_decay': 2.376805489380238e-05, 'epochs': 278, 'loss': 'mae', 'optimizer': 'adam', 'graph_mode': 'off', 'use_snp_selection': False}. Best is trial 103 with value: 0.15081495201159137.
[I 2025-11-03 13:40:31,152] Trial 110 finished with value: 0.1332403326227265 and parameters: {'model_type': 'gcn', 'hidden_dims': '[512, 256]', 'dropout': 0.10011532073674137, 'batch_norm': True, 'lr': 0.0006602723318503859, 'weight_decay': 1.3558093156995963e-06, 'epochs': 298, 'loss': 'mae', 'optimizer': 'adam', 'graph_mode': 'off', 'use_snp_selection': False}. Best is trial 103 with value: 0.15081495201159137.
[I 2025-11-03 13:40:33,584] Trial 111 finished with value: 0.13541833454291713 and parameters: {'model_type': 'gcn', 'hidden_dims': '[512, 128]', 'dropout': 0.11803256377453959, 'batch_norm': True, 'lr': 0.0004273716725469921, 'weight_decay': 7.666854363148673e-05, 'epochs': 260, 'loss': 'mae', 'optimizer': 'adam', 'graph_mode': 'off', 'use_snp_selection': False}. Best is trial 103 with value: 0.15081495201159137.
[I 2025-11-03 13:40:34,864] Trial 112 finished with value: 0.140579925265172 and parameters: {'model_type': 'gcn', 'hidden_dims': '[128, 64]', 'dropout': 0.5098268685059626, 'batch_norm': True, 'lr': 0.0007503811557349545, 'weight_decay': 1.941910260013106e-06, 'epochs': 271, 'loss': 'mae', 'optimizer': 'adam', 'graph_mode': 'off', 'use_snp_selection': False}. Best is trial 103 with value: 0.15081495201159137.
[I 2025-11-03 13:40:36,442] Trial 113 finished with value: 0.1438115332413703 and parameters: {'model_type': 'gcn', 'hidden_dims': '[256, 128]', 'dropout': 0.36668718305804854, 'batch_norm': True, 'lr': 0.0005752688594805629, 'weight_decay': 6.17977231783874e-05, 'epochs': 236, 'loss': 'mae', 'optimizer': 'adam', 'graph_mode': 'off', 'use_snp_selection': False}. Best is trial 103 with value: 0.15081495201159137.
[I 2025-11-03 13:40:38,012] Trial 114 finished with value: 0.13362529314120417 and parameters: {'model_type': 'gcn', 'hidden_dims': '[256, 128]', 'dropout': 0.37231517933426905, 'batch_norm': True, 'lr': 0.0005693021280339525, 'weight_decay': 6.28726716969453e-05, 'epochs': 235, 'loss': 'mae', 'optimizer': 'adam', 'graph_mode': 'off', 'use_snp_selection': False}. Best is trial 103 with value: 0.15081495201159137.
[I 2025-11-03 13:40:39,589] Trial 115 finished with value: 0.14080187140577452 and parameters: {'model_type': 'gcn', 'hidden_dims': '[256, 128]', 'dropout': 0.21344212179776817, 'batch_norm': True, 'lr': 0.000501194076953619, 'weight_decay': 4.951447466436017e-05, 'epochs': 243, 'loss': 'mae', 'optimizer': 'adam', 'graph_mode': 'off', 'use_snp_selection': False}. Best is trial 103 with value: 0.15081495201159137.
[I 2025-11-03 13:40:41,115] Trial 116 finished with value: 0.14395401467457614 and parameters: {'model_type': 'gcn', 'hidden_dims': '[256, 128]', 'dropout': 0.40246055622525106, 'batch_norm': True, 'lr': 0.0007945508797888222, 'weight_decay': 3.4910800706911686e-05, 'epochs': 228, 'loss': 'mae', 'optimizer': 'adam', 'graph_mode': 'off', 'use_snp_selection': False}. Best is trial 103 with value: 0.15081495201159137.
[I 2025-11-03 13:40:42,631] Trial 117 finished with value: 0.13958956445796913 and parameters: {'model_type': 'gcn', 'hidden_dims': '[256, 128]', 'dropout': 0.3799559563117744, 'batch_norm': True, 'lr': 0.0007851063745085957, 'weight_decay': 3.313382504510252e-05, 'epochs': 227, 'loss': 'mae', 'optimizer': 'adam', 'graph_mode': 'off', 'use_snp_selection': False}. Best is trial 103 with value: 0.15081495201159137.
[I 2025-11-03 13:40:44,123] Trial 118 finished with value: 0.1389339533208351 and parameters: {'model_type': 'gcn', 'hidden_dims': '[256, 128]', 'dropout': 0.4653566073451138, 'batch_norm': True, 'lr': 0.0008994884704136854, 'weight_decay': 3.744096928830148e-05, 'epochs': 221, 'loss': 'mae', 'optimizer': 'adam', 'graph_mode': 'off', 'use_snp_selection': False}. Best is trial 103 with value: 0.15081495201159137.
