[I 2025-11-03 13:48:31,519] Trial 142 finished with value: 0.07059572773874684 and parameters: {'model_type': 'gcn', 'hidden_dims': '[512, 256]', 'dropout': 0.3583606165037801, 'batch_norm': True, 'lr': 0.0008573400802231849, 'weight_decay': 0.00012627160640653977, 'epochs': 190, 'loss': 'mae', 'optimizer': 'adam', 'graph_mode': 'cutoff', 'cutoff': 0.2349857694954549, 'grm_norm': 'cosine_then_gcn', 'self_loops': True, 'use_snp_selection': False}. Best is trial 109 with value: 0.07413610610422695.
[I 2025-11-03 13:48:33,916] Trial 143 finished with value: 0.062247810384988535 and parameters: {'model_type': 'gcn', 'hidden_dims': '[512, 256]', 'dropout': 0.3588400563186473, 'batch_norm': True, 'lr': 0.0008381526542738839, 'weight_decay': 9.634055917838902e-05, 'epochs': 191, 'loss': 'mae', 'optimizer': 'adam', 'graph_mode': 'cutoff', 'cutoff': 0.2385559048378838, 'grm_norm': 'cosine_then_gcn', 'self_loops': True, 'use_snp_selection': False}. Best is trial 109 with value: 0.07413610610422695.
[I 2025-11-03 13:48:36,343] Trial 144 finished with value: 0.06966982325291375 and parameters: {'model_type': 'gcn', 'hidden_dims': '[512, 256]', 'dropout': 0.3459544330941263, 'batch_norm': True, 'lr': 0.0008895081511434322, 'weight_decay': 8.639306406683818e-05, 'epochs': 192, 'loss': 'mae', 'optimizer': 'adam', 'graph_mode': 'cutoff', 'cutoff': 0.23695148103140168, 'grm_norm': 'cosine_then_gcn', 'self_loops': True, 'use_snp_selection': False}. Best is trial 109 with value: 0.07413610610422695.
[I 2025-11-03 13:48:38,728] Trial 145 finished with value: 0.061935920933546336 and parameters: {'model_type': 'gcn', 'hidden_dims': '[512, 256]', 'dropout': 0.3579416776603268, 'batch_norm': True, 'lr': 0.0008355066134323567, 'weight_decay': 8.03805135567136e-05, 'epochs': 191, 'loss': 'mae', 'optimizer': 'adam', 'graph_mode': 'cutoff', 'cutoff': 0.24055353331206944, 'grm_norm': 'cosine_then_gcn', 'self_loops': True, 'use_snp_selection': False}. Best is trial 109 with value: 0.07413610610422695.
[I 2025-11-03 13:48:41,206] Trial 146 finished with value: 0.06970417574501145 and parameters: {'model_type': 'gcn', 'hidden_dims': '[512, 256]', 'dropout': 0.3533401607921282, 'batch_norm': True, 'lr': 0.0009196190760951662, 'weight_decay': 8.275030240748495e-05, 'epochs': 192, 'loss': 'mae', 'optimizer': 'adam', 'graph_mode': 'cutoff', 'cutoff': 0.24992419220538503, 'grm_norm': 'cosine_then_gcn', 'self_loops': True, 'use_snp_selection': False}. Best is trial 109 with value: 0.07413610610422695.
[I 2025-11-03 13:48:43,660] Trial 147 finished with value: 0.05791766586779247 and parameters: {'model_type': 'gcn', 'hidden_dims': '[512, 256]', 'dropout': 0.3436445285367892, 'batch_norm': True, 'lr': 0.0009217410129634254, 'weight_decay': 8.598817597607662e-05, 'epochs': 189, 'loss': 'mae', 'optimizer': 'adam', 'graph_mode': 'cutoff', 'cutoff': 0.25219367992691893, 'grm_norm': 'cosine_then_gcn', 'self_loops': True, 'use_snp_selection': False}. Best is trial 109 with value: 0.07413610610422695.
[I 2025-11-03 13:48:45,973] Trial 148 finished with value: 0.049561705298565406 and parameters: {'model_type': 'gcn', 'hidden_dims': '[512, 256]', 'dropout': 0.3481446524848094, 'batch_norm': True, 'lr': 0.0007426918954343567, 'weight_decay': 5.66234322837266e-05, 'epochs': 180, 'loss': 'mae', 'optimizer': 'adam', 'graph_mode': 'cutoff', 'cutoff': 0.2863709055817472, 'grm_norm': 'cosine_then_gcn', 'self_loops': True, 'use_snp_selection': False}. Best is trial 109 with value: 0.07413610610422695.
[I 2025-11-03 13:48:48,379] Trial 149 finished with value: 0.05440442788142616 and parameters: {'model_type': 'gcn', 'hidden_dims': '[512, 256]', 'dropout': 0.3869391304306613, 'batch_norm': True, 'lr': 0.0008432055628811124, 'weight_decay': 4.6750542866690706e-05, 'epochs': 194, 'loss': 'mae', 'optimizer': 'adam', 'graph_mode': 'cutoff', 'cutoff': 0.21663805887845763, 'grm_norm': 'cosine_then_gcn', 'self_loops': True, 'use_snp_selection': False}. Best is trial 109 with value: 0.07413610610422695.
[I 2025-11-03 13:49:03,088] Trial 0 finished with value: 0.027157953522674503 and parameters: {'model_type': 'gcn', 'hidden_dims': '[128, 64]', 'dropout': 0.199031432379812, 'batch_norm': True, 'lr': 1.8408544111075837e-06, 'weight_decay': 5.5136510071208614e-05, 'epochs': 334, 'loss': 'mae', 'optimizer': 'adam', 'graph_mode': 'knn', 'source': 'grm', 'knn_k': 8, 'weighted_edges': True, 'symmetrize_mode': 'mutual', 'use_snp_selection': False}. Best is trial 0 with value: 0.027157953522674503.
[I 2025-11-03 13:49:04,170] Trial 1 finished with value: 0.023977691230115446 and parameters: {'model_type': 'gcn', 'hidden_dims': '[128, 64]', 'dropout': 0.40051947670227217, 'batch_norm': True, 'lr': 0.0005320428882732732, 'weight_decay': 1.89210117736594e-06, 'epochs': 32, 'loss': 'mse', 'optimizer': 'adam', 'graph_mode': 'knn', 'source': 'grm', 'knn_k': 7, 'weighted_edges': True, 'symmetrize_mode': 'union', 'use_snp_selection': False}. Best is trial 0 with value: 0.027157953522674503.
[I 2025-11-03 13:49:06,128] Trial 2 finished with value: 0.020750314079376952 and parameters: {'model_type': 'gcn', 'hidden_dims': '[256, 128]', 'dropout': 0.5105528289184642, 'batch_norm': False, 'lr': 0.0006804279372404962, 'weight_decay': 0.0008922815224257085, 'epochs': 160, 'loss': 'mse', 'optimizer': 'adam', 'graph_mode': 'cutoff', 'cutoff': 0.5741905641612706, 'grm_norm': 'gcn', 'self_loops': False, 'use_snp_selection': True, 'num_snps': 26910}. Best is trial 0 with value: 0.027157953522674503.
[I 2025-11-03 13:49:08,202] Trial 3 finished with value: -0.03528552518999325 and parameters: {'model_type': 'gcn', 'hidden_dims': '[256, 128, 64]', 'dropout': 0.5390483213624292, 'batch_norm': False, 'lr': 3.4705625989073525e-05, 'weight_decay': 2.4623319020131338e-05, 'epochs': 92, 'loss': 'mse', 'optimizer': 'adam', 'graph_mode': 'knn', 'source': 'grm', 'knn_k': 6, 'weighted_edges': False, 'symmetrize_mode': 'mutual', 'use_snp_selection': True, 'num_snps': 30713}. Best is trial 0 with value: 0.027157953522674503.
[I 2025-11-03 13:49:10,297] Trial 4 finished with value: -0.006839269132767082 and parameters: {'model_type': 'gcn', 'hidden_dims': '[128, 64]', 'dropout': 0.13404863676897502, 'batch_norm': False, 'lr': 0.0001431556295367288, 'weight_decay': 2.2084517750726675e-05, 'epochs': 13, 'loss': 'mae', 'optimizer': 'adam', 'graph_mode': 'cutoff', 'cutoff': 0.6714268476993044, 'grm_norm': 'none', 'self_loops': False, 'use_snp_selection': True, 'num_snps': 45645}. Best is trial 0 with value: 0.027157953522674503.
[I 2025-11-03 13:49:12,828] Trial 5 finished with value: 0.01540349910058368 and parameters: {'model_type': 'gcn', 'hidden_dims': '[256, 128]', 'dropout': 0.42253606323412096, 'batch_norm': False, 'lr': 4.238630400638805e-05, 'weight_decay': 8.074086040046576e-07, 'epochs': 134, 'loss': 'mae', 'optimizer': 'adam', 'graph_mode': 'knn', 'source': 'grm', 'knn_k': 1, 'weighted_edges': False, 'symmetrize_mode': 'mutual', 'use_snp_selection': True, 'num_snps': 43113}. Best is trial 0 with value: 0.027157953522674503.
[I 2025-11-03 13:49:15,178] Trial 6 finished with value: 0.028314226775637566 and parameters: {'model_type': 'gcn', 'hidden_dims': '[512, 256]', 'dropout': 0.3534893146320237, 'batch_norm': True, 'lr': 0.000251307964226932, 'weight_decay': 1.821819791794022e-05, 'epochs': 207, 'loss': 'mae', 'optimizer': 'adam', 'graph_mode': 'knn', 'source': 'grm', 'knn_k': 1, 'weighted_edges': True, 'symmetrize_mode': 'mutual', 'use_snp_selection': False}. Best is trial 6 with value: 0.028314226775637566.
[I 2025-11-03 13:49:17,275] Trial 7 finished with value: 0.04310872164205957 and parameters: {'model_type': 'gcn', 'hidden_dims': '[512, 256]', 'dropout': 0.1105825955860775, 'batch_norm': True, 'lr': 2.374338412754043e-05, 'weight_decay': 1.1284721123340274e-05, 'epochs': 170, 'loss': 'mse', 'optimizer': 'adam', 'graph_mode': 'cutoff', 'cutoff': 0.719872204109604, 'grm_norm': 'gcn', 'self_loops': False, 'use_snp_selection': False}. Best is trial 7 with value: 0.04310872164205957.
[I 2025-11-03 13:49:19,451] Trial 8 finished with value: 0.05148263655654173 and parameters: {'model_type': 'gcn', 'hidden_dims': '[512, 128]', 'dropout': 0.5066580418354021, 'batch_norm': True, 'lr': 0.00039213678276659976, 'weight_decay': 3.43655320802934e-06, 'epochs': 91, 'loss': 'mse', 'optimizer': 'adam', 'graph_mode': 'cutoff', 'cutoff': 0.34923059576505366, 'grm_norm': 'cosine', 'self_loops': True, 'use_snp_selection': False}. Best is trial 8 with value: 0.05148263655654173.
[I 2025-11-03 13:49:21,032] Trial 9 finished with value: -0.00016648361314207459 and parameters: {'model_type': 'gcn', 'hidden_dims': '[512, 256]', 'dropout': 0.301734920240333, 'batch_norm': False, 'lr': 6.650961854953448e-06, 'weight_decay': 6.861575656590315e-05, 'epochs': 125, 'loss': 'mae', 'optimizer': 'adam', 'graph_mode': 'cutoff', 'cutoff': 0.2857569870061939, 'grm_norm': 'cosine_then_gcn', 'self_loops': False, 'use_snp_selection': True, 'num_snps': 12722}. Best is trial 8 with value: 0.05148263655654173.
[I 2025-11-03 13:49:23,533] Trial 10 finished with value: 0.04646463450885472 and parameters: {'model_type': 'gcn', 'hidden_dims': '[512, 128]', 'dropout': 0.5885461262002587, 'batch_norm': True, 'lr': 0.00010512303397748249, 'weight_decay': 1.3387352389235743e-07, 'epochs': 246, 'loss': 'mse', 'optimizer': 'adam', 'graph_mode': 'cutoff', 'cutoff': 0.26841964921208644, 'grm_norm': 'cosine', 'self_loops': True, 'use_snp_selection': False}. Best is trial 8 with value: 0.05148263655654173.
[I 2025-11-03 13:49:26,370] Trial 11 finished with value: 0.03439744979399443 and parameters: {'model_type': 'gcn', 'hidden_dims': '[512, 128]', 'dropout': 0.5890754684622632, 'batch_norm': True, 'lr': 0.00012623783700890367, 'weight_decay': 1.508061538813527e-07, 'epochs': 265, 'loss': 'mse', 'optimizer': 'adam', 'graph_mode': 'cutoff', 'cutoff': 0.24497725304786427, 'grm_norm': 'cosine', 'self_loops': True, 'use_snp_selection': False}. Best is trial 8 with value: 0.05148263655654173.
[I 2025-11-03 13:49:28,865] Trial 12 finished with value: 0.07544054689754426 and parameters: {'model_type': 'gcn', 'hidden_dims': '[512, 128]', 'dropout': 0.48657806717860913, 'batch_norm': True, 'lr': 8.196071574687757e-05, 'weight_decay': 1.0694400602640794e-07, 'epochs': 246, 'loss': 'mse', 'optimizer': 'adam', 'graph_mode': 'cutoff', 'cutoff': 0.3951864557300021, 'grm_norm': 'cosine', 'self_loops': True, 'use_snp_selection': False}. Best is trial 12 with value: 0.07544054689754426.
[I 2025-11-03 13:49:31,733] Trial 13 finished with value: 0.03603071508542813 and parameters: {'model_type': 'gcn', 'hidden_dims': '[512, 64]', 'dropout': 0.47621684277778986, 'batch_norm': True, 'lr': 0.000979768418505984, 'weight_decay': 1.6927349386092573e-06, 'epochs': 318, 'loss': 'mse', 'optimizer': 'adam', 'graph_mode': 'cutoff', 'cutoff': 0.4427120712791082, 'grm_norm': 'cosine', 'self_loops': True, 'use_snp_selection': False}. Best is trial 12 with value: 0.07544054689754426.
[I 2025-11-03 13:49:33,306] Trial 14 finished with value: -0.015768088061070898 and parameters: {'model_type': 'gcn', 'hidden_dims': '[512, 128]', 'dropout': 0.4563774405951741, 'batch_norm': True, 'lr': 1.2586985041154999e-05, 'weight_decay': 4.976879363687129e-07, 'epochs': 66, 'loss': 'mse', 'optimizer': 'adam', 'graph_mode': 'cutoff', 'cutoff': 0.4372781624482427, 'grm_norm': 'cosine', 'self_loops': True, 'use_snp_selection': False}. Best is trial 12 with value: 0.07544054689754426.
[I 2025-11-03 13:49:35,685] Trial 15 finished with value: 0.02256331802384336 and parameters: {'model_type': 'gcn', 'hidden_dims': '[512, 128]', 'dropout': 0.2877306837888016, 'batch_norm': True, 'lr': 0.00036454208506623816, 'weight_decay': 3.853985169759058e-06, 'epochs': 223, 'loss': 'mse', 'optimizer': 'adam', 'graph_mode': 'cutoff', 'cutoff': 0.4112328726888204, 'grm_norm': 'cosine', 'self_loops': True, 'use_snp_selection': False}. Best is trial 12 with value: 0.07544054689754426.
[I 2025-11-03 13:49:38,412] Trial 16 finished with value: 0.00027953746385549823 and parameters: {'model_type': 'gcn', 'hidden_dims': '[512, 128]', 'dropout': 0.5132065773767474, 'batch_norm': True, 'lr': 5.0122390074737124e-05, 'weight_decay': 0.00028467518820800373, 'epochs': 295, 'loss': 'mse', 'optimizer': 'adam', 'graph_mode': 'cutoff', 'cutoff': 0.36475512980226676, 'grm_norm': 'none', 'self_loops': True, 'use_snp_selection': False}. Best is trial 12 with value: 0.07544054689754426.
[I 2025-11-03 13:49:39,860] Trial 17 finished with value: 0.05574443013096085 and parameters: {'model_type': 'gcn', 'hidden_dims': '[256, 128, 64]', 'dropout': 0.3804849951650412, 'batch_norm': True, 'lr': 0.0002129163278244221, 'weight_decay': 3.6316897726738695e-07, 'epochs': 85, 'loss': 'mse', 'optimizer': 'adam', 'graph_mode': 'cutoff', 'cutoff': 0.551711412694861, 'grm_norm': 'cosine_then_gcn', 'self_loops': True, 'use_snp_selection': False}. Best is trial 12 with value: 0.07544054689754426.
[I 2025-11-03 13:49:41,783] Trial 18 finished with value: 0.062065775198750416 and parameters: {'model_type': 'gcn', 'hidden_dims': '[256, 128, 64]', 'dropout': 0.3649194047451613, 'batch_norm': True, 'lr': 0.00010401892361401969, 'weight_decay': 3.293863322548928e-07, 'epochs': 201, 'loss': 'mse', 'optimizer': 'adam', 'graph_mode': 'cutoff', 'cutoff': 0.8809443877091867, 'grm_norm': 'cosine_then_gcn', 'self_loops': True, 'use_snp_selection': False}. Best is trial 12 with value: 0.07544054689754426.
[I 2025-11-03 13:49:43,789] Trial 19 finished with value: 0.0313283025026762 and parameters: {'model_type': 'gcn', 'hidden_dims': '[256, 128, 64]', 'dropout': 0.30274986193769954, 'batch_norm': True, 'lr': 7.196733253377151e-05, 'weight_decay': 1.203657568792361e-07, 'epochs': 203, 'loss': 'mse', 'optimizer': 'adam', 'graph_mode': 'cutoff', 'cutoff': 0.8542664300796621, 'grm_norm': 'cosine_then_gcn', 'self_loops': True, 'use_snp_selection': False}. Best is trial 12 with value: 0.07544054689754426.
[I 2025-11-03 13:49:46,409] Trial 20 finished with value: 0.02192083548683559 and parameters: {'model_type': 'gcn', 'hidden_dims': '[512, 64]', 'dropout': 0.23625106462823903, 'batch_norm': True, 'lr': 1.7572329395263622e-05, 'weight_decay': 3.2142617024985187e-07, 'epochs': 278, 'loss': 'mse', 'optimizer': 'adam', 'graph_mode': 'cutoff', 'cutoff': 0.8261593543689125, 'grm_norm': 'cosine_then_gcn', 'self_loops': True, 'use_snp_selection': False}. Best is trial 12 with value: 0.07544054689754426.
[I 2025-11-03 13:49:48,457] Trial 21 finished with value: 0.04407686853747064 and parameters: {'model_type': 'gcn', 'hidden_dims': '[256, 128, 64]', 'dropout': 0.373050530698777, 'batch_norm': True, 'lr': 0.0002015559689136887, 'weight_decay': 3.615089401397482e-07, 'epochs': 226, 'loss': 'mse', 'optimizer': 'adam', 'graph_mode': 'cutoff', 'cutoff': 0.5396507275330086, 'grm_norm': 'cosine_then_gcn', 'self_loops': True, 'use_snp_selection': False}. Best is trial 12 with value: 0.07544054689754426.
[I 2025-11-03 13:49:50,351] Trial 22 finished with value: 0.03220010343831486 and parameters: {'model_type': 'gcn', 'hidden_dims': '[256, 128, 64]', 'dropout': 0.4293456732477995, 'batch_norm': True, 'lr': 0.00010204312149162238, 'weight_decay': 8.438217051811144e-07, 'epochs': 193, 'loss': 'mse', 'optimizer': 'adam', 'graph_mode': 'cutoff', 'cutoff': 0.5306917207180627, 'grm_norm': 'cosine_then_gcn', 'self_loops': True, 'use_snp_selection': False}. Best is trial 12 with value: 0.07544054689754426.
[I 2025-11-03 13:49:51,929] Trial 23 finished with value: 0.027830010188086025 and parameters: {'model_type': 'gcn', 'hidden_dims': '[256, 128, 64]', 'dropout': 0.382870634834064, 'batch_norm': True, 'lr': 6.397816442511934e-05, 'weight_decay': 2.471702928304443e-07, 'epochs': 124, 'loss': 'mse', 'optimizer': 'adam', 'graph_mode': 'cutoff', 'cutoff': 0.7461666307671178, 'grm_norm': 'cosine_then_gcn', 'self_loops': True, 'use_snp_selection': False}. Best is trial 12 with value: 0.07544054689754426.
[I 2025-11-03 13:49:54,092] Trial 24 finished with value: 0.04915938190866976 and parameters: {'model_type': 'gcn', 'hidden_dims': '[256, 128, 64]', 'dropout': 0.32660345863929896, 'batch_norm': True, 'lr': 0.0002454434413350544, 'weight_decay': 1.0695237458720149e-07, 'epochs': 254, 'loss': 'mse', 'optimizer': 'adam', 'graph_mode': 'cutoff', 'cutoff': 0.6242274847688618, 'grm_norm': 'cosine_then_gcn', 'self_loops': True, 'use_snp_selection': False}. Best is trial 12 with value: 0.07544054689754426.
[I 2025-11-03 13:49:55,825] Trial 25 finished with value: 0.05465618445510463 and parameters: {'model_type': 'gcn', 'hidden_dims': '[256, 128, 64]', 'dropout': 0.2537656839085002, 'batch_norm': True, 'lr': 0.00018125078682039623, 'weight_decay': 7.786156113108157e-07, 'epochs': 156, 'loss': 'mse', 'optimizer': 'adam', 'graph_mode': 'cutoff', 'cutoff': 0.7937184551697524, 'grm_norm': 'cosine_then_gcn', 'self_loops': True, 'use_snp_selection': False}. Best is trial 12 with value: 0.07544054689754426.
[I 2025-11-03 13:49:58,669] Trial 26 finished with value: 0.003940598205187803 and parameters: {'model_type': 'gcn', 'hidden_dims': '[256, 128, 64]', 'dropout': 0.4343945647569451, 'batch_norm': False, 'lr': 7.439720432390876e-06, 'weight_decay': 1.5691686260313837e-06, 'epochs': 67, 'loss': 'mae', 'optimizer': 'adam', 'graph_mode': 'knn', 'source': 'grm', 'knn_k': 10, 'weighted_edges': False, 'symmetrize_mode': 'union', 'use_snp_selection': True, 'num_snps': 59005}. Best is trial 12 with value: 0.07544054689754426.
[I 2025-11-03 13:50:00,697] Trial 27 finished with value: -0.03624690389010262 and parameters: {'model_type': 'gcn', 'hidden_dims': '[256, 128]', 'dropout': 0.3413789333414695, 'batch_norm': True, 'lr': 1.293065678896477e-06, 'weight_decay': 2.3822503339540053e-07, 'epochs': 294, 'loss': 'mse', 'optimizer': 'adam', 'graph_mode': 'cutoff', 'cutoff': 0.8949011931044426, 'grm_norm': 'none', 'self_loops': True, 'use_snp_selection': False}. Best is trial 12 with value: 0.07544054689754426.
[I 2025-11-03 13:50:02,834] Trial 28 finished with value: 0.043152677807173516 and parameters: {'model_type': 'gcn', 'hidden_dims': '[512, 64]', 'dropout': 0.47203209495873455, 'batch_norm': True, 'lr': 7.6064013123235e-05, 'weight_decay': 4.977979952500835e-06, 'epochs': 187, 'loss': 'mse', 'optimizer': 'adam', 'graph_mode': 'cutoff', 'cutoff': 0.5088584871257702, 'grm_norm': 'gcn', 'self_loops': False, 'use_snp_selection': False}. Best is trial 12 with value: 0.07544054689754426.
[I 2025-11-03 13:50:04,494] Trial 29 finished with value: 0.023480226556195548 and parameters: {'model_type': 'gcn', 'hidden_dims': '[128, 64]', 'dropout': 0.1881763221627633, 'batch_norm': True, 'lr': 2.2101749857651216e-05, 'weight_decay': 5.574678055336397e-07, 'epochs': 238, 'loss': 'mae', 'optimizer': 'adam', 'graph_mode': 'knn', 'source': 'grm', 'knn_k': 5, 'weighted_edges': False, 'symmetrize_mode': 'union', 'use_snp_selection': False}. Best is trial 12 with value: 0.07544054689754426.
[I 2025-11-03 13:50:06,990] Trial 30 finished with value: -0.03195138331735821 and parameters: {'model_type': 'gcn', 'hidden_dims': '[256, 128, 64]', 'dropout': 0.5521663168740693, 'batch_norm': True, 'lr': 3.4089919431550333e-06, 'weight_decay': 2.0281681036185783e-07, 'epochs': 330, 'loss': 'mse', 'optimizer': 'adam', 'graph_mode': 'cutoff', 'cutoff': 0.20867502491096857, 'grm_norm': 'cosine_then_gcn', 'self_loops': True, 'use_snp_selection': False}. Best is trial 12 with value: 0.07544054689754426.
[I 2025-11-03 13:50:08,694] Trial 31 finished with value: 0.0476094743514004 and parameters: {'model_type': 'gcn', 'hidden_dims': '[256, 128, 64]', 'dropout': 0.2468802020751001, 'batch_norm': True, 'lr': 0.00017974318712970827, 'weight_decay': 7.022036610622218e-07, 'epochs': 156, 'loss': 'mse', 'optimizer': 'adam', 'graph_mode': 'cutoff', 'cutoff': 0.7844091545815767, 'grm_norm': 'cosine_then_gcn', 'self_loops': True, 'use_snp_selection': False}. Best is trial 12 with value: 0.07544054689754426.
[I 2025-11-03 13:50:10,343] Trial 32 finished with value: 0.04456920144714143 and parameters: {'model_type': 'gcn', 'hidden_dims': '[256, 128, 64]', 'dropout': 0.2508378925211112, 'batch_norm': True, 'lr': 0.0004044190125699723, 'weight_decay': 1.1622985342332562e-06, 'epochs': 143, 'loss': 'mse', 'optimizer': 'adam', 'graph_mode': 'cutoff', 'cutoff': 0.8837302360421116, 'grm_norm': 'cosine_then_gcn', 'self_loops': True, 'use_snp_selection': False}. Best is trial 12 with value: 0.07544054689754426.
[I 2025-11-03 13:50:11,815] Trial 33 finished with value: 0.03309015715486171 and parameters: {'model_type': 'gcn', 'hidden_dims': '[256, 128, 64]', 'dropout': 0.18965044343534487, 'batch_norm': True, 'lr': 0.000277233287321072, 'weight_decay': 3.7296862708707057e-07, 'epochs': 103, 'loss': 'mse', 'optimizer': 'adam', 'graph_mode': 'cutoff', 'cutoff': 0.7894941933245905, 'grm_norm': 'cosine_then_gcn', 'self_loops': True, 'use_snp_selection': False}. Best is trial 12 with value: 0.07544054689754426.
[I 2025-11-03 13:50:13,015] Trial 34 finished with value: 0.024280482576953977 and parameters: {'model_type': 'gcn', 'hidden_dims': '[256, 128, 64]', 'dropout': 0.3952876768966064, 'batch_norm': True, 'lr': 9.510442159092827e-05, 'weight_decay': 2.1372836674619942e-07, 'epochs': 34, 'loss': 'mse', 'optimizer': 'adam', 'graph_mode': 'knn', 'source': 'grm', 'knn_k': 4, 'weighted_edges': True, 'symmetrize_mode': 'union', 'use_snp_selection': False}. Best is trial 12 with value: 0.07544054689754426.
