[I 2025-11-03 14:39:33,768] Trial 97 finished with value: 0.11852653689313034 and parameters: {'model_type': 'graphsage', 'hidden_dims': '[512, 256]', 'dropout': 0.5751817178258657, 'batch_norm': True, 'lr': 0.0008352645376937854, 'weight_decay': 2.6967339844629652e-05, 'epochs': 277, 'loss': 'mse', 'optimizer': 'adam', 'graph_mode': 'knn', 'source': 'grm', 'knn_k': 6, 'weighted_edges': True, 'symmetrize_mode': 'mutual', 'use_snp_selection': False}. Best is trial 24 with value: 0.1360864241733849.
[I 2025-11-03 14:39:39,908] Trial 98 finished with value: 0.11764922705642768 and parameters: {'model_type': 'graphsage', 'hidden_dims': '[512, 256]', 'dropout': 0.5118578195692424, 'batch_norm': True, 'lr': 0.0003111679903724184, 'weight_decay': 6.304692274593101e-05, 'epochs': 291, 'loss': 'mse', 'optimizer': 'adam', 'graph_mode': 'knn', 'source': 'grm', 'knn_k': 7, 'weighted_edges': False, 'symmetrize_mode': 'mutual', 'use_snp_selection': False}. Best is trial 24 with value: 0.1360864241733849.
[I 2025-11-03 14:39:46,453] Trial 99 finished with value: 0.10932826919466138 and parameters: {'model_type': 'graphsage', 'hidden_dims': '[512, 256]', 'dropout': 0.5201872642853371, 'batch_norm': True, 'lr': 0.00041683821287093176, 'weight_decay': 6.777804609868772e-06, 'epochs': 333, 'loss': 'mse', 'optimizer': 'adam', 'graph_mode': 'knn', 'source': 'grm', 'knn_k': 5, 'weighted_edges': True, 'symmetrize_mode': 'mutual', 'use_snp_selection': False}. Best is trial 24 with value: 0.1360864241733849.
[I 2025-11-03 14:39:50,305] Trial 100 finished with value: 0.11771605955235989 and parameters: {'model_type': 'graphsage', 'hidden_dims': '[256, 128]', 'dropout': 0.454374296066164, 'batch_norm': True, 'lr': 0.0005402117588191607, 'weight_decay': 1.889266966039787e-05, 'epochs': 274, 'loss': 'mse', 'optimizer': 'adam', 'graph_mode': 'knn', 'source': 'grm', 'knn_k': 8, 'weighted_edges': True, 'symmetrize_mode': 'mutual', 'use_snp_selection': False}. Best is trial 24 with value: 0.1360864241733849.
[I 2025-11-03 14:39:55,890] Trial 101 finished with value: 0.1096339960969338 and parameters: {'model_type': 'graphsage', 'hidden_dims': '[512, 256]', 'dropout': 0.41017272302718877, 'batch_norm': True, 'lr': 0.0006991835151289083, 'weight_decay': 1.2505590064821907e-05, 'epochs': 261, 'loss': 'mse', 'optimizer': 'adam', 'graph_mode': 'knn', 'source': 'grm', 'knn_k': 5, 'weighted_edges': True, 'symmetrize_mode': 'mutual', 'use_snp_selection': False}. Best is trial 24 with value: 0.1360864241733849.
[I 2025-11-03 14:40:00,874] Trial 102 finished with value: 0.10706777481875934 and parameters: {'model_type': 'graphsage', 'hidden_dims': '[512, 256]', 'dropout': 0.48533807645250837, 'batch_norm': True, 'lr': 0.0008952111298168984, 'weight_decay': 1.3996211043220205e-05, 'epochs': 219, 'loss': 'mse', 'optimizer': 'adam', 'graph_mode': 'knn', 'source': 'grm', 'knn_k': 4, 'weighted_edges': True, 'symmetrize_mode': 'mutual', 'use_snp_selection': False}. Best is trial 24 with value: 0.1360864241733849.
[I 2025-11-03 14:40:06,147] Trial 103 finished with value: 0.11768427898241186 and parameters: {'model_type': 'graphsage', 'hidden_dims': '[512, 256]', 'dropout': 0.38778371938068684, 'batch_norm': True, 'lr': 0.0007162687241776125, 'weight_decay': 2.3145400002312502e-05, 'epochs': 232, 'loss': 'mse', 'optimizer': 'adam', 'graph_mode': 'knn', 'source': 'grm', 'knn_k': 6, 'weighted_edges': True, 'symmetrize_mode': 'mutual', 'use_snp_selection': False}. Best is trial 24 with value: 0.1360864241733849.
[I 2025-11-03 14:40:11,674] Trial 104 finished with value: 0.11784448830072138 and parameters: {'model_type': 'graphsage', 'hidden_dims': '[512, 256]', 'dropout': 0.4427450848257193, 'batch_norm': True, 'lr': 0.00046423260881863436, 'weight_decay': 3.732585034530741e-06, 'epochs': 255, 'loss': 'mse', 'optimizer': 'adam', 'graph_mode': 'knn', 'source': 'grm', 'knn_k': 5, 'weighted_edges': True, 'symmetrize_mode': 'mutual', 'use_snp_selection': False}. Best is trial 24 with value: 0.1360864241733849.
[I 2025-11-03 14:40:16,466] Trial 105 finished with value: 0.12068347676888264 and parameters: {'model_type': 'graphsage', 'hidden_dims': '[512, 256]', 'dropout': 0.42434978922187283, 'batch_norm': True, 'lr': 0.0009946964385158538, 'weight_decay': 3.175774315512884e-05, 'epochs': 202, 'loss': 'mse', 'optimizer': 'adam', 'graph_mode': 'knn', 'source': 'grm', 'knn_k': 5, 'weighted_edges': False, 'symmetrize_mode': 'mutual', 'use_snp_selection': False}. Best is trial 24 with value: 0.1360864241733849.
[I 2025-11-03 14:40:21,286] Trial 106 finished with value: 0.08122067458264856 and parameters: {'model_type': 'graphsage', 'hidden_dims': '[512, 256]', 'dropout': 0.4722094272395061, 'batch_norm': False, 'lr': 1.4501111425437144e-05, 'weight_decay': 8.96558141001808e-06, 'epochs': 237, 'loss': 'mse', 'optimizer': 'adam', 'graph_mode': 'knn', 'source': 'grm', 'knn_k': 4, 'weighted_edges': True, 'symmetrize_mode': 'mutual', 'use_snp_selection': True, 'num_snps': 37269}. Best is trial 24 with value: 0.1360864241733849.
[I 2025-11-03 14:40:27,050] Trial 107 finished with value: 0.12306994112749213 and parameters: {'model_type': 'graphsage', 'hidden_dims': '[512, 256]', 'dropout': 0.36535368716502115, 'batch_norm': True, 'lr': 0.00035869538346689986, 'weight_decay': 0.0003638567259736832, 'epochs': 284, 'loss': 'mse', 'optimizer': 'adam', 'graph_mode': 'knn', 'source': 'grm', 'knn_k': 3, 'weighted_edges': True, 'symmetrize_mode': 'mutual', 'use_snp_selection': False}. Best is trial 24 with value: 0.1360864241733849.
[I 2025-11-03 14:40:30,647] Trial 108 finished with value: 0.12248874047022978 and parameters: {'model_type': 'graphsage', 'hidden_dims': '[256, 128, 64]', 'dropout': 0.37058719498742015, 'batch_norm': True, 'lr': 0.00028683233806300407, 'weight_decay': 0.00021427403002936338, 'epochs': 304, 'loss': 'mse', 'optimizer': 'adam', 'graph_mode': 'knn', 'source': 'grm', 'knn_k': 1, 'weighted_edges': True, 'symmetrize_mode': 'mutual', 'use_snp_selection': False}. Best is trial 24 with value: 0.1360864241733849.
[I 2025-11-03 14:40:36,229] Trial 109 finished with value: 0.12685841873432327 and parameters: {'model_type': 'graphsage', 'hidden_dims': '[512, 256]', 'dropout': 0.3501980530141996, 'batch_norm': True, 'lr': 0.00038362362745871496, 'weight_decay': 4.051601481741471e-05, 'epochs': 278, 'loss': 'mse', 'optimizer': 'adam', 'graph_mode': 'knn', 'source': 'grm', 'knn_k': 2, 'weighted_edges': True, 'symmetrize_mode': 'mutual', 'use_snp_selection': False}. Best is trial 24 with value: 0.1360864241733849.
[I 2025-11-03 14:40:42,315] Trial 110 finished with value: 0.10474110426746841 and parameters: {'model_type': 'graphsage', 'hidden_dims': '[512, 256]', 'dropout': 0.35019812225332786, 'batch_norm': True, 'lr': 3.946777912552912e-05, 'weight_decay': 3.69909346843813e-05, 'epochs': 318, 'loss': 'mse', 'optimizer': 'adam', 'graph_mode': 'knn', 'source': 'grm', 'knn_k': 2, 'weighted_edges': False, 'symmetrize_mode': 'mutual', 'use_snp_selection': False}. Best is trial 24 with value: 0.1360864241733849.
[I 2025-11-03 14:40:48,047] Trial 111 finished with value: 0.12005277459332728 and parameters: {'model_type': 'graphsage', 'hidden_dims': '[512, 256]', 'dropout': 0.39905469525502063, 'batch_norm': True, 'lr': 0.00035893325151072406, 'weight_decay': 0.0005795779008427052, 'epochs': 283, 'loss': 'mse', 'optimizer': 'adam', 'graph_mode': 'knn', 'source': 'grm', 'knn_k': 3, 'weighted_edges': True, 'symmetrize_mode': 'mutual', 'use_snp_selection': False}. Best is trial 24 with value: 0.1360864241733849.
[I 2025-11-03 14:40:53,566] Trial 112 finished with value: 0.11584053603030507 and parameters: {'model_type': 'graphsage', 'hidden_dims': '[512, 256]', 'dropout': 0.3663305097879386, 'batch_norm': True, 'lr': 0.0005671120214288742, 'weight_decay': 0.0003245103737191107, 'epochs': 270, 'loss': 'mse', 'optimizer': 'adam', 'graph_mode': 'knn', 'source': 'grm', 'knn_k': 2, 'weighted_edges': True, 'symmetrize_mode': 'mutual', 'use_snp_selection': False}. Best is trial 24 with value: 0.1360864241733849.
[I 2025-11-03 14:40:59,247] Trial 113 finished with value: 0.11428055302783464 and parameters: {'model_type': 'graphsage', 'hidden_dims': '[512, 256]', 'dropout': 0.41549844708947137, 'batch_norm': True, 'lr': 0.0003810731949766045, 'weight_decay': 1.7729809051473253e-05, 'epochs': 285, 'loss': 'mse', 'optimizer': 'adam', 'graph_mode': 'knn', 'source': 'grm', 'knn_k': 2, 'weighted_edges': True, 'symmetrize_mode': 'mutual', 'use_snp_selection': False}. Best is trial 24 with value: 0.1360864241733849.
[I 2025-11-03 14:41:04,958] Trial 114 finished with value: 0.12674606041621886 and parameters: {'model_type': 'graphsage', 'hidden_dims': '[512, 128]', 'dropout': 0.35259501427462264, 'batch_norm': True, 'lr': 0.000437446747774121, 'weight_decay': 2.5698678927191095e-05, 'epochs': 296, 'loss': 'mse', 'optimizer': 'adam', 'graph_mode': 'knn', 'source': 'grm', 'knn_k': 1, 'weighted_edges': True, 'symmetrize_mode': 'mutual', 'use_snp_selection': False}. Best is trial 24 with value: 0.1360864241733849.
[I 2025-11-03 14:41:10,719] Trial 115 finished with value: 0.11581226134967339 and parameters: {'model_type': 'graphsage', 'hidden_dims': '[512, 128]', 'dropout': 0.3851044057564867, 'batch_norm': True, 'lr': 0.0004657714164801632, 'weight_decay': 4.8158565372370626e-05, 'epochs': 298, 'loss': 'mse', 'optimizer': 'adam', 'graph_mode': 'knn', 'source': 'grm', 'knn_k': 1, 'weighted_edges': True, 'symmetrize_mode': 'mutual', 'use_snp_selection': False}. Best is trial 24 with value: 0.1360864241733849.
[I 2025-11-03 14:41:16,691] Trial 116 finished with value: 0.11944934263959588 and parameters: {'model_type': 'graphsage', 'hidden_dims': '[512, 128]', 'dropout': 0.11553388088906338, 'batch_norm': True, 'lr': 0.0007790919437847164, 'weight_decay': 2.4510786956594844e-05, 'epochs': 307, 'loss': 'mse', 'optimizer': 'adam', 'graph_mode': 'knn', 'source': 'grm', 'knn_k': 1, 'weighted_edges': True, 'symmetrize_mode': 'union', 'use_snp_selection': False}. Best is trial 24 with value: 0.1360864241733849.
[I 2025-11-03 14:41:22,823] Trial 117 finished with value: 0.12394302628087514 and parameters: {'model_type': 'graphsage', 'hidden_dims': '[512, 128]', 'dropout': 0.33110969009381575, 'batch_norm': True, 'lr': 0.0006439034746709846, 'weight_decay': 7.023135049969406e-05, 'epochs': 329, 'loss': 'mse', 'optimizer': 'adam', 'graph_mode': 'knn', 'source': 'grm', 'knn_k': 1, 'weighted_edges': True, 'symmetrize_mode': 'mutual', 'use_snp_selection': False}. Best is trial 24 with value: 0.1360864241733849.
[I 2025-11-03 14:41:28,818] Trial 118 finished with value: 0.12271161367871791 and parameters: {'model_type': 'graphsage', 'hidden_dims': '[512, 128]', 'dropout': 0.3475276212562155, 'batch_norm': True, 'lr': 0.0006159190014635673, 'weight_decay': 9.722736885457099e-05, 'epochs': 320, 'loss': 'mse', 'optimizer': 'adam', 'graph_mode': 'knn', 'source': 'grm', 'knn_k': 1, 'weighted_edges': False, 'symmetrize_mode': 'mutual', 'use_snp_selection': False}. Best is trial 24 with value: 0.1360864241733849.
[I 2025-11-03 14:41:34,912] Trial 119 finished with value: 0.04825887219270596 and parameters: {'model_type': 'graphsage', 'hidden_dims': '[512, 128]', 'dropout': 0.3296474975425807, 'batch_norm': True, 'lr': 3.729147918697618e-06, 'weight_decay': 8.45127940271118e-05, 'epochs': 327, 'loss': 'mse', 'optimizer': 'adam', 'graph_mode': 'knn', 'source': 'grm', 'knn_k': 1, 'weighted_edges': True, 'symmetrize_mode': 'mutual', 'use_snp_selection': False}. Best is trial 24 with value: 0.1360864241733849.
[I 2025-11-03 14:41:41,218] Trial 120 finished with value: 0.11656018317625036 and parameters: {'model_type': 'graphsage', 'hidden_dims': '[512, 128]', 'dropout': 0.557198696346354, 'batch_norm': True, 'lr': 0.000509693861617373, 'weight_decay': 7.442910206887375e-05, 'epochs': 345, 'loss': 'mse', 'optimizer': 'adam', 'graph_mode': 'knn', 'source': 'grm', 'knn_k': 1, 'weighted_edges': True, 'symmetrize_mode': 'mutual', 'use_snp_selection': False}. Best is trial 24 with value: 0.1360864241733849.
[I 2025-11-03 14:41:46,810] Trial 121 finished with value: 0.11507583578696133 and parameters: {'model_type': 'graphsage', 'hidden_dims': '[512, 128]', 'dropout': 0.35454373377976234, 'batch_norm': True, 'lr': 0.0006692164432501903, 'weight_decay': 1.4617402065825897e-05, 'epochs': 277, 'loss': 'mse', 'optimizer': 'adam', 'graph_mode': 'knn', 'source': 'grm', 'knn_k': 2, 'weighted_edges': True, 'symmetrize_mode': 'mutual', 'use_snp_selection': False}. Best is trial 24 with value: 0.1360864241733849.
[I 2025-11-03 14:41:52,138] Trial 122 finished with value: 0.11470558430963933 and parameters: {'model_type': 'graphsage', 'hidden_dims': '[512, 128]', 'dropout': 0.4046865659748154, 'batch_norm': True, 'lr': 0.00025858824323970954, 'weight_decay': 3.5744541134201246e-05, 'epochs': 264, 'loss': 'mse', 'optimizer': 'adam', 'graph_mode': 'knn', 'source': 'grm', 'knn_k': 1, 'weighted_edges': True, 'symmetrize_mode': 'mutual', 'use_snp_selection': False}. Best is trial 24 with value: 0.1360864241733849.
[I 2025-11-03 14:41:57,675] Trial 123 finished with value: 0.11193914536593993 and parameters: {'model_type': 'graphsage', 'hidden_dims': '[512, 64]', 'dropout': 0.16502369238496223, 'batch_norm': True, 'lr': 0.0004425190194219997, 'weight_decay': 2.7275648688542676e-05, 'epochs': 250, 'loss': 'mse', 'optimizer': 'adam', 'graph_mode': 'knn', 'source': 'grm', 'knn_k': 6, 'weighted_edges': True, 'symmetrize_mode': 'mutual', 'use_snp_selection': False}. Best is trial 24 with value: 0.1360864241733849.
[I 2025-11-03 14:42:01,465] Trial 124 finished with value: 0.11897511345131634 and parameters: {'model_type': 'graphsage', 'hidden_dims': '[256, 128, 64]', 'dropout': 0.458390797144416, 'batch_norm': True, 'lr': 0.0008464063858553209, 'weight_decay': 5.4121716581117976e-05, 'epochs': 332, 'loss': 'mse', 'optimizer': 'adam', 'graph_mode': 'knn', 'source': 'grm', 'knn_k': 1, 'weighted_edges': True, 'symmetrize_mode': 'mutual', 'use_snp_selection': False}. Best is trial 24 with value: 0.1360864241733849.
[I 2025-11-03 14:42:07,015] Trial 125 finished with value: 0.11620973995618684 and parameters: {'model_type': 'graphsage', 'hidden_dims': '[512, 128]', 'dropout': 0.3396763450237459, 'batch_norm': True, 'lr': 0.00031191305434977233, 'weight_decay': 1.1075670623961343e-05, 'epochs': 212, 'loss': 'mse', 'optimizer': 'adam', 'graph_mode': 'knn', 'source': 'grm', 'knn_k': 7, 'weighted_edges': True, 'symmetrize_mode': 'union', 'use_snp_selection': False}. Best is trial 24 with value: 0.1360864241733849.
[I 2025-11-03 14:42:10,808] Trial 126 finished with value: -0.0009069753690798281 and parameters: {'model_type': 'graphsage', 'hidden_dims': '[256, 128]', 'dropout': 0.3798612360397259, 'batch_norm': True, 'lr': 1.0013725580650348e-06, 'weight_decay': 0.0001282671567339836, 'epochs': 291, 'loss': 'mse', 'optimizer': 'adam', 'graph_mode': 'knn', 'source': 'grm', 'knn_k': 5, 'weighted_edges': False, 'symmetrize_mode': 'mutual', 'use_snp_selection': False}. Best is trial 24 with value: 0.1360864241733849.
[I 2025-11-03 14:42:18,079] Trial 127 finished with value: 0.04863346747086643 and parameters: {'model_type': 'graphsage', 'hidden_dims': '[512, 256]', 'dropout': 0.4415666781448101, 'batch_norm': False, 'lr': 0.0005350923341313322, 'weight_decay': 2.051587249203668e-05, 'epochs': 342, 'loss': 'mse', 'optimizer': 'adam', 'graph_mode': 'knn', 'source': 'grm', 'knn_k': 6, 'weighted_edges': True, 'symmetrize_mode': 'mutual', 'use_snp_selection': True, 'num_snps': 50364}. Best is trial 24 with value: 0.1360864241733849.
[I 2025-11-03 14:42:24,131] Trial 128 finished with value: 0.11122741295174096 and parameters: {'model_type': 'graphsage', 'hidden_dims': '[512, 256]', 'dropout': 0.3927293042954062, 'batch_norm': True, 'lr': 0.000752343939353417, 'weight_decay': 4.1524891848522256e-05, 'epochs': 313, 'loss': 'mse', 'optimizer': 'adam', 'graph_mode': 'knn', 'source': 'grm', 'knn_k': 2, 'weighted_edges': True, 'symmetrize_mode': 'mutual', 'use_snp_selection': False}. Best is trial 24 with value: 0.1360864241733849.
[I 2025-11-03 14:42:29,934] Trial 129 finished with value: 0.10961071386571153 and parameters: {'model_type': 'graphsage', 'hidden_dims': '[512, 256]', 'dropout': 0.41739942136685626, 'batch_norm': True, 'lr': 0.0006332756145400991, 'weight_decay': 6.202600411037023e-06, 'epochs': 258, 'loss': 'mse', 'optimizer': 'adam', 'graph_mode': 'knn', 'source': 'grm', 'knn_k': 8, 'weighted_edges': True, 'symmetrize_mode': 'mutual', 'use_snp_selection': False}. Best is trial 24 with value: 0.1360864241733849.
[I 2025-11-03 14:42:36,443] Trial 130 finished with value: 0.12023279644453301 and parameters: {'model_type': 'graphsage', 'hidden_dims': '[512, 256]', 'dropout': 0.32442003971340094, 'batch_norm': True, 'lr': 0.0004146606993536122, 'weight_decay': 8.7078616828993e-06, 'epochs': 328, 'loss': 'mse', 'optimizer': 'adam', 'graph_mode': 'knn', 'source': 'grm', 'knn_k': 5, 'weighted_edges': False, 'symmetrize_mode': 'mutual', 'use_snp_selection': False}. Best is trial 24 with value: 0.1360864241733849.
[I 2025-11-03 14:42:41,980] Trial 131 finished with value: 0.12148187096515876 and parameters: {'model_type': 'graphsage', 'hidden_dims': '[512, 256]', 'dropout': 0.3601610743754984, 'batch_norm': True, 'lr': 0.0003362007051106981, 'weight_decay': 0.0003379945836511832, 'epochs': 279, 'loss': 'mse', 'optimizer': 'adam', 'graph_mode': 'knn', 'source': 'grm', 'knn_k': 1, 'weighted_edges': True, 'symmetrize_mode': 'mutual', 'use_snp_selection': False}. Best is trial 24 with value: 0.1360864241733849.
[I 2025-11-03 14:42:47,955] Trial 132 finished with value: 0.11318891064091097 and parameters: {'model_type': 'graphsage', 'hidden_dims': '[512, 256]', 'dropout': 0.3817679099016729, 'batch_norm': True, 'lr': 0.0002106838018670329, 'weight_decay': 1.362880048541759e-05, 'epochs': 302, 'loss': 'mse', 'optimizer': 'adam', 'graph_mode': 'knn', 'source': 'grm', 'knn_k': 3, 'weighted_edges': True, 'symmetrize_mode': 'mutual', 'use_snp_selection': False}. Best is trial 24 with value: 0.1360864241733849.
[I 2025-11-03 14:42:53,465] Trial 133 finished with value: 0.10583435972222964 and parameters: {'model_type': 'graphsage', 'hidden_dims': '[512, 256]', 'dropout': 0.3652665998040669, 'batch_norm': True, 'lr': 0.0003679622684207758, 'weight_decay': 0.0008269694481811671, 'epochs': 271, 'loss': 'mse', 'optimizer': 'adam', 'graph_mode': 'knn', 'source': 'grm', 'knn_k': 2, 'weighted_edges': True, 'symmetrize_mode': 'mutual', 'use_snp_selection': False}. Best is trial 24 with value: 0.1360864241733849.
[I 2025-11-03 14:42:59,435] Trial 134 finished with value: 0.10458133364531046 and parameters: {'model_type': 'graphsage', 'hidden_dims': '[512, 256]', 'dropout': 0.43323802775223674, 'batch_norm': True, 'lr': 2.5926301509102592e-05, 'weight_decay': 2.0130451862962905e-05, 'epochs': 289, 'loss': 'mse', 'optimizer': 'adam', 'graph_mode': 'knn', 'source': 'grm', 'knn_k': 5, 'weighted_edges': True, 'symmetrize_mode': 'mutual', 'use_snp_selection': False}. Best is trial 24 with value: 0.1360864241733849.
[I 2025-11-03 14:43:02,869] Trial 135 finished with value: 0.09485230084510247 and parameters: {'model_type': 'graphsage', 'hidden_dims': '[256, 128, 64]', 'dropout': 0.4058273112270199, 'batch_norm': True, 'lr': 0.0005568497683772161, 'weight_decay': 2.524920307853787e-05, 'epochs': 227, 'loss': 'mse', 'optimizer': 'adam', 'graph_mode': 'knn', 'source': 'grm', 'knn_k': 3, 'weighted_edges': True, 'symmetrize_mode': 'union', 'use_snp_selection': False}. Best is trial 24 with value: 0.1360864241733849.
[I 2025-11-03 14:43:09,578] Trial 136 finished with value: 0.10786184857627919 and parameters: {'model_type': 'graphsage', 'hidden_dims': '[512, 256]', 'dropout': 0.37470459999011296, 'batch_norm': True, 'lr': 0.0002799881455377878, 'weight_decay': 1.64045804491925e-05, 'epochs': 350, 'loss': 'mae', 'optimizer': 'adam', 'graph_mode': 'knn', 'source': 'grm', 'knn_k': 4, 'weighted_edges': True, 'symmetrize_mode': 'mutual', 'use_snp_selection': False}. Best is trial 24 with value: 0.1360864241733849.
[I 2025-11-03 14:43:15,716] Trial 137 finished with value: 0.124805020557173 and parameters: {'model_type': 'graphsage', 'hidden_dims': '[512, 256]', 'dropout': 0.3396222346750298, 'batch_norm': True, 'lr': 0.0008820067409568116, 'weight_decay': 0.00042819850609763566, 'epochs': 295, 'loss': 'mse', 'optimizer': 'adam', 'graph_mode': 'knn', 'source': 'grm', 'knn_k': 6, 'weighted_edges': True, 'symmetrize_mode': 'mutual', 'use_snp_selection': False}. Best is trial 24 with value: 0.1360864241733849.
[I 2025-11-03 14:43:22,120] Trial 138 finished with value: 0.10770783908263368 and parameters: {'model_type': 'graphsage', 'hidden_dims': '[512, 128]', 'dropout': 0.3421851194632449, 'batch_norm': True, 'lr': 0.0008613080078249477, 'weight_decay': 4.764422506952829e-06, 'epochs': 313, 'loss': 'mse', 'optimizer': 'adam', 'graph_mode': 'knn', 'source': 'grm', 'knn_k': 6, 'weighted_edges': True, 'symmetrize_mode': 'mutual', 'use_snp_selection': False}. Best is trial 24 with value: 0.1360864241733849.
[I 2025-11-03 14:43:28,287] Trial 139 finished with value: 0.11842633147074626 and parameters: {'model_type': 'graphsage', 'hidden_dims': '[512, 64]', 'dropout': 0.3319655239956862, 'batch_norm': True, 'lr': 0.0007232595906414324, 'weight_decay': 1.0594587211915678e-05, 'epochs': 297, 'loss': 'mae', 'optimizer': 'adam', 'graph_mode': 'knn', 'source': 'grm', 'knn_k': 6, 'weighted_edges': True, 'symmetrize_mode': 'mutual', 'use_snp_selection': False}. Best is trial 24 with value: 0.1360864241733849.
