[I 2025-11-03 13:37:20,975] Trial 137 finished with value: 0.02098271586507834 and parameters: {'model_type': 'gcn', 'hidden_dims': '[512, 256]', 'dropout': 0.29900955645695526, 'batch_norm': False, 'lr': 0.0005583468230804615, 'weight_decay': 9.95214645919459e-07, 'epochs': 106, 'loss': 'mse', 'optimizer': 'adam', 'graph_mode': 'knn', 'source': 'grm', 'knn_k': 1, 'weighted_edges': False, 'symmetrize_mode': 'mutual', 'use_snp_selection': False}. Best is trial 90 with value: 0.12385554697147882.
[I 2025-11-03 13:37:22,998] Trial 138 finished with value: 0.09916793953652582 and parameters: {'model_type': 'gcn', 'hidden_dims': '[512, 64]', 'dropout': 0.35701634339227134, 'batch_norm': True, 'lr': 0.000879819312206136, 'weight_decay': 3.1194298547884493e-07, 'epochs': 132, 'loss': 'mse', 'optimizer': 'adam', 'graph_mode': 'knn', 'source': 'grm', 'knn_k': 2, 'weighted_edges': False, 'symmetrize_mode': 'mutual', 'use_snp_selection': False}. Best is trial 90 with value: 0.12385554697147882.
[I 2025-11-03 13:37:24,298] Trial 139 finished with value: 0.09404143944854765 and parameters: {'model_type': 'gcn', 'hidden_dims': '[256, 128]', 'dropout': 0.39402900268391344, 'batch_norm': True, 'lr': 0.0005830111993222365, 'weight_decay': 6.092372681494581e-07, 'epochs': 56, 'loss': 'mse', 'optimizer': 'adam', 'graph_mode': 'knn', 'source': 'grm', 'knn_k': 1, 'weighted_edges': False, 'symmetrize_mode': 'mutual', 'use_snp_selection': False}. Best is trial 90 with value: 0.12385554697147882.
[I 2025-11-03 13:37:26,155] Trial 140 finished with value: 0.08992588925139475 and parameters: {'model_type': 'gcn', 'hidden_dims': '[512, 256]', 'dropout': 0.37238965061912777, 'batch_norm': True, 'lr': 0.0004081562237296911, 'weight_decay': 1.7329461665689066e-05, 'epochs': 97, 'loss': 'mse', 'optimizer': 'adam', 'graph_mode': 'knn', 'source': 'grm', 'knn_k': 3, 'weighted_edges': False, 'symmetrize_mode': 'mutual', 'use_snp_selection': False}. Best is trial 90 with value: 0.12385554697147882.
[I 2025-11-03 13:37:27,839] Trial 141 finished with value: 0.10308983034947718 and parameters: {'model_type': 'gcn', 'hidden_dims': '[512, 256]', 'dropout': 0.3117227349270377, 'batch_norm': True, 'lr': 0.0007658232717255499, 'weight_decay': 4.620551466343931e-07, 'epochs': 74, 'loss': 'mse', 'optimizer': 'adam', 'graph_mode': 'knn', 'source': 'grm', 'knn_k': 1, 'weighted_edges': False, 'symmetrize_mode': 'mutual', 'use_snp_selection': False}. Best is trial 90 with value: 0.12385554697147882.
[I 2025-11-03 13:37:29,598] Trial 142 finished with value: 0.11587381183399631 and parameters: {'model_type': 'gcn', 'hidden_dims': '[512, 256]', 'dropout': 0.32970568419878765, 'batch_norm': True, 'lr': 0.0007200427337949197, 'weight_decay': 7.285116133922806e-07, 'epochs': 87, 'loss': 'mse', 'optimizer': 'adam', 'graph_mode': 'knn', 'source': 'grm', 'knn_k': 1, 'weighted_edges': False, 'symmetrize_mode': 'mutual', 'use_snp_selection': False}. Best is trial 90 with value: 0.12385554697147882.
[I 2025-11-03 13:37:31,366] Trial 143 finished with value: 0.11233799054712604 and parameters: {'model_type': 'gcn', 'hidden_dims': '[512, 256]', 'dropout': 0.3327076267419757, 'batch_norm': True, 'lr': 0.0006438174915590208, 'weight_decay': 8.322891989400318e-07, 'epochs': 88, 'loss': 'mse', 'optimizer': 'adam', 'graph_mode': 'knn', 'source': 'grm', 'knn_k': 1, 'weighted_edges': False, 'symmetrize_mode': 'mutual', 'use_snp_selection': False}. Best is trial 90 with value: 0.12385554697147882.
[I 2025-11-03 13:37:33,124] Trial 144 finished with value: 0.12260183147455818 and parameters: {'model_type': 'gcn', 'hidden_dims': '[512, 256]', 'dropout': 0.3373179672551679, 'batch_norm': True, 'lr': 0.0006498721598701397, 'weight_decay': 8.562992728731442e-07, 'epochs': 87, 'loss': 'mse', 'optimizer': 'adam', 'graph_mode': 'knn', 'source': 'grm', 'knn_k': 1, 'weighted_edges': False, 'symmetrize_mode': 'mutual', 'use_snp_selection': False}. Best is trial 90 with value: 0.12385554697147882.
[I 2025-11-03 13:37:34,881] Trial 145 finished with value: 0.10459822095583232 and parameters: {'model_type': 'gcn', 'hidden_dims': '[512, 256]', 'dropout': 0.32791661358261726, 'batch_norm': True, 'lr': 0.000869373522349777, 'weight_decay': 6.95629532560439e-07, 'epochs': 86, 'loss': 'mse', 'optimizer': 'adam', 'graph_mode': 'knn', 'source': 'grm', 'knn_k': 1, 'weighted_edges': False, 'symmetrize_mode': 'mutual', 'use_snp_selection': False}. Best is trial 90 with value: 0.12385554697147882.
[I 2025-11-03 13:37:36,630] Trial 146 finished with value: 0.10336529287797729 and parameters: {'model_type': 'gcn', 'hidden_dims': '[512, 256]', 'dropout': 0.3400933544399776, 'batch_norm': True, 'lr': 0.0006795317074830607, 'weight_decay': 8.60963803815531e-07, 'epochs': 85, 'loss': 'mse', 'optimizer': 'adam', 'graph_mode': 'knn', 'source': 'grm', 'knn_k': 1, 'weighted_edges': False, 'symmetrize_mode': 'mutual', 'use_snp_selection': False}. Best is trial 90 with value: 0.12385554697147882.
[I 2025-11-03 13:37:38,347] Trial 147 finished with value: 0.09004809688034912 and parameters: {'model_type': 'gcn', 'hidden_dims': '[512, 256]', 'dropout': 0.3476306182420762, 'batch_norm': True, 'lr': 0.0007468845681299432, 'weight_decay': 1.2761302506370713e-06, 'epochs': 78, 'loss': 'mse', 'optimizer': 'adam', 'graph_mode': 'knn', 'source': 'grm', 'knn_k': 2, 'weighted_edges': False, 'symmetrize_mode': 'mutual', 'use_snp_selection': False}. Best is trial 90 with value: 0.12385554697147882.
[I 2025-11-03 13:37:40,629] Trial 148 finished with value: 0.10928513070339471 and parameters: {'model_type': 'gcn', 'hidden_dims': '[512, 256]', 'dropout': 0.30776657410256225, 'batch_norm': True, 'lr': 0.0005755194396184275, 'weight_decay': 7.654696183837288e-07, 'epochs': 88, 'loss': 'mse', 'optimizer': 'adam', 'graph_mode': 'knn', 'source': 'grm', 'knn_k': 1, 'weighted_edges': False, 'symmetrize_mode': 'mutual', 'use_snp_selection': True, 'num_snps': 32376}. Best is trial 90 with value: 0.12385554697147882.
[I 2025-11-03 13:37:42,524] Trial 149 finished with value: 0.017709340096723942 and parameters: {'model_type': 'gcn', 'hidden_dims': '[512, 256]', 'dropout': 0.3352946843459357, 'batch_norm': False, 'lr': 0.0009838092398084081, 'weight_decay': 1.0168946200825922e-06, 'epochs': 110, 'loss': 'mse', 'optimizer': 'adam', 'graph_mode': 'knn', 'source': 'grm', 'knn_k': 1, 'weighted_edges': False, 'symmetrize_mode': 'mutual', 'use_snp_selection': False}. Best is trial 90 with value: 0.12385554697147882.
[I 2025-11-03 13:37:44,537] Trial 0 finished with value: -0.036114387775034035 and parameters: {'model_type': 'gcn', 'hidden_dims': '[128, 64]', 'dropout': 0.199031432379812, 'batch_norm': True, 'lr': 1.8408544111075837e-06, 'weight_decay': 5.5136510071208614e-05, 'epochs': 334, 'loss': 'mae', 'optimizer': 'adam', 'graph_mode': 'knn', 'source': 'grm', 'knn_k': 8, 'weighted_edges': True, 'symmetrize_mode': 'mutual', 'use_snp_selection': False}. Best is trial 0 with value: -0.036114387775034035.
[I 2025-11-03 13:37:45,637] Trial 1 finished with value: 0.08255014104353356 and parameters: {'model_type': 'gcn', 'hidden_dims': '[128, 64]', 'dropout': 0.40051947670227217, 'batch_norm': True, 'lr': 0.0005320428882732732, 'weight_decay': 1.89210117736594e-06, 'epochs': 32, 'loss': 'mse', 'optimizer': 'adam', 'graph_mode': 'knn', 'source': 'grm', 'knn_k': 7, 'weighted_edges': True, 'symmetrize_mode': 'union', 'use_snp_selection': False}. Best is trial 1 with value: 0.08255014104353356.
[I 2025-11-03 13:37:47,729] Trial 2 finished with value: 0.01725810403907746 and parameters: {'model_type': 'gcn', 'hidden_dims': '[256, 128]', 'dropout': 0.5105528289184642, 'batch_norm': False, 'lr': 0.0006804279372404962, 'weight_decay': 0.0008922815224257085, 'epochs': 160, 'loss': 'mse', 'optimizer': 'adam', 'graph_mode': 'cutoff', 'cutoff': 0.5741905641612706, 'grm_norm': 'gcn', 'self_loops': False, 'use_snp_selection': True, 'num_snps': 26910}. Best is trial 1 with value: 0.08255014104353356.
[I 2025-11-03 13:37:49,918] Trial 3 finished with value: 0.06448125369070316 and parameters: {'model_type': 'gcn', 'hidden_dims': '[256, 128, 64]', 'dropout': 0.5390483213624292, 'batch_norm': False, 'lr': 3.4705625989073525e-05, 'weight_decay': 2.4623319020131338e-05, 'epochs': 92, 'loss': 'mse', 'optimizer': 'adam', 'graph_mode': 'knn', 'source': 'grm', 'knn_k': 6, 'weighted_edges': False, 'symmetrize_mode': 'mutual', 'use_snp_selection': True, 'num_snps': 30713}. Best is trial 1 with value: 0.08255014104353356.
[I 2025-11-03 13:37:52,168] Trial 4 finished with value: -0.005721320081158756 and parameters: {'model_type': 'gcn', 'hidden_dims': '[128, 64]', 'dropout': 0.13404863676897502, 'batch_norm': False, 'lr': 0.0001431556295367288, 'weight_decay': 2.2084517750726675e-05, 'epochs': 13, 'loss': 'mae', 'optimizer': 'adam', 'graph_mode': 'cutoff', 'cutoff': 0.6714268476993044, 'grm_norm': 'none', 'self_loops': False, 'use_snp_selection': True, 'num_snps': 45645}. Best is trial 1 with value: 0.08255014104353356.
[I 2025-11-03 13:37:54,834] Trial 5 finished with value: 0.042703605116688394 and parameters: {'model_type': 'gcn', 'hidden_dims': '[256, 128]', 'dropout': 0.42253606323412096, 'batch_norm': False, 'lr': 4.238630400638805e-05, 'weight_decay': 8.074086040046576e-07, 'epochs': 134, 'loss': 'mae', 'optimizer': 'adam', 'graph_mode': 'knn', 'source': 'grm', 'knn_k': 1, 'weighted_edges': False, 'symmetrize_mode': 'mutual', 'use_snp_selection': True, 'num_snps': 43113}. Best is trial 1 with value: 0.08255014104353356.
[I 2025-11-03 13:37:57,326] Trial 6 finished with value: 0.061747947877781054 and parameters: {'model_type': 'gcn', 'hidden_dims': '[512, 256]', 'dropout': 0.3534893146320237, 'batch_norm': True, 'lr': 0.000251307964226932, 'weight_decay': 1.821819791794022e-05, 'epochs': 207, 'loss': 'mae', 'optimizer': 'adam', 'graph_mode': 'knn', 'source': 'grm', 'knn_k': 1, 'weighted_edges': True, 'symmetrize_mode': 'mutual', 'use_snp_selection': False}. Best is trial 1 with value: 0.08255014104353356.
[I 2025-11-03 13:37:59,516] Trial 7 finished with value: 0.04275934871401539 and parameters: {'model_type': 'gcn', 'hidden_dims': '[512, 256]', 'dropout': 0.1105825955860775, 'batch_norm': True, 'lr': 2.374338412754043e-05, 'weight_decay': 1.1284721123340274e-05, 'epochs': 170, 'loss': 'mse', 'optimizer': 'adam', 'graph_mode': 'cutoff', 'cutoff': 0.719872204109604, 'grm_norm': 'gcn', 'self_loops': False, 'use_snp_selection': False}. Best is trial 1 with value: 0.08255014104353356.
[I 2025-11-03 13:38:01,280] Trial 8 finished with value: 0.07056648541850312 and parameters: {'model_type': 'gcn', 'hidden_dims': '[512, 128]', 'dropout': 0.5066580418354021, 'batch_norm': True, 'lr': 0.00039213678276659976, 'weight_decay': 3.43655320802934e-06, 'epochs': 91, 'loss': 'mse', 'optimizer': 'adam', 'graph_mode': 'cutoff', 'cutoff': 0.34923059576505366, 'grm_norm': 'cosine', 'self_loops': True, 'use_snp_selection': False}. Best is trial 1 with value: 0.08255014104353356.
[I 2025-11-03 13:38:02,874] Trial 9 finished with value: 0.059536127019937476 and parameters: {'model_type': 'gcn', 'hidden_dims': '[512, 256]', 'dropout': 0.301734920240333, 'batch_norm': False, 'lr': 6.650961854953448e-06, 'weight_decay': 6.861575656590315e-05, 'epochs': 125, 'loss': 'mae', 'optimizer': 'adam', 'graph_mode': 'cutoff', 'cutoff': 0.2857569870061939, 'grm_norm': 'cosine_then_gcn', 'self_loops': False, 'use_snp_selection': True, 'num_snps': 12722}. Best is trial 1 with value: 0.08255014104353356.
[I 2025-11-03 13:38:04,223] Trial 10 finished with value: 0.021007292898498033 and parameters: {'model_type': 'gcn', 'hidden_dims': '[512, 64]', 'dropout': 0.2923745636750988, 'batch_norm': True, 'lr': 0.0001000196697725585, 'weight_decay': 1.2618827301366646e-07, 'epochs': 2, 'loss': 'mse', 'optimizer': 'adam', 'graph_mode': 'knn', 'source': 'grm', 'knn_k': 10, 'weighted_edges': True, 'symmetrize_mode': 'union', 'use_snp_selection': False}. Best is trial 1 with value: 0.08255014104353356.
[I 2025-11-03 13:38:05,899] Trial 11 finished with value: 0.07612813175273465 and parameters: {'model_type': 'gcn', 'hidden_dims': '[512, 128]', 'dropout': 0.4214049075657615, 'batch_norm': True, 'lr': 0.0008079808143806397, 'weight_decay': 1.818759407283773e-06, 'epochs': 65, 'loss': 'mse', 'optimizer': 'adam', 'graph_mode': 'cutoff', 'cutoff': 0.27687267525456005, 'grm_norm': 'cosine', 'self_loops': True, 'use_snp_selection': False}. Best is trial 1 with value: 0.08255014104353356.
[I 2025-11-03 13:38:07,452] Trial 12 finished with value: 0.060802058066619286 and parameters: {'model_type': 'gcn', 'hidden_dims': '[512, 128]', 'dropout': 0.38018633523546363, 'batch_norm': True, 'lr': 0.0005941284936785953, 'weight_decay': 1.574117856284058e-06, 'epochs': 50, 'loss': 'mse', 'optimizer': 'adam', 'graph_mode': 'cutoff', 'cutoff': 0.2158009400902668, 'grm_norm': 'cosine', 'self_loops': True, 'use_snp_selection': False}. Best is trial 1 with value: 0.08255014104353356.
[I 2025-11-03 13:38:10,089] Trial 13 finished with value: 0.08890949430380493 and parameters: {'model_type': 'gcn', 'hidden_dims': '[512, 128]', 'dropout': 0.43999058883580466, 'batch_norm': True, 'lr': 0.0009956721055247276, 'weight_decay': 2.9888124075076557e-07, 'epochs': 240, 'loss': 'mse', 'optimizer': 'adam', 'graph_mode': 'knn', 'source': 'grm', 'knn_k': 5, 'weighted_edges': True, 'symmetrize_mode': 'union', 'use_snp_selection': False}. Best is trial 13 with value: 0.08890949430380493.
[I 2025-11-03 13:38:11,822] Trial 14 finished with value: 0.042847621213481075 and parameters: {'model_type': 'gcn', 'hidden_dims': '[128, 64]', 'dropout': 0.4723237857193205, 'batch_norm': True, 'lr': 0.00016407367861739832, 'weight_decay': 1.2989685499381173e-07, 'epochs': 246, 'loss': 'mse', 'optimizer': 'adam', 'graph_mode': 'knn', 'source': 'grm', 'knn_k': 5, 'weighted_edges': True, 'symmetrize_mode': 'union', 'use_snp_selection': False}. Best is trial 13 with value: 0.08890949430380493.
[I 2025-11-03 13:38:14,677] Trial 15 finished with value: 0.04480191914878335 and parameters: {'model_type': 'gcn', 'hidden_dims': '[512, 64]', 'dropout': 0.5974922991705405, 'batch_norm': True, 'lr': 0.00094645867610948, 'weight_decay': 6.028960267768269e-07, 'epochs': 281, 'loss': 'mse', 'optimizer': 'adam', 'graph_mode': 'knn', 'source': 'grm', 'knn_k': 5, 'weighted_edges': True, 'symmetrize_mode': 'union', 'use_snp_selection': False}. Best is trial 13 with value: 0.08890949430380493.
[I 2025-11-03 13:38:16,871] Trial 16 finished with value: 0.028860470065217907 and parameters: {'model_type': 'gcn', 'hidden_dims': '[256, 128, 64]', 'dropout': 0.2511024935036179, 'batch_norm': True, 'lr': 6.282769623314533e-05, 'weight_decay': 3.9391581443712917e-07, 'epochs': 230, 'loss': 'mse', 'optimizer': 'adam', 'graph_mode': 'knn', 'source': 'grm', 'knn_k': 7, 'weighted_edges': True, 'symmetrize_mode': 'union', 'use_snp_selection': False}. Best is trial 13 with value: 0.08890949430380493.
[I 2025-11-03 13:38:19,824] Trial 17 finished with value: 0.07465616715769202 and parameters: {'model_type': 'gcn', 'hidden_dims': '[512, 128]', 'dropout': 0.4337768631587977, 'batch_norm': True, 'lr': 0.0003081004534464581, 'weight_decay': 5.337356660855023e-06, 'epochs': 299, 'loss': 'mse', 'optimizer': 'adam', 'graph_mode': 'knn', 'source': 'grm', 'knn_k': 3, 'weighted_edges': True, 'symmetrize_mode': 'union', 'use_snp_selection': False}. Best is trial 13 with value: 0.08890949430380493.
[I 2025-11-03 13:38:21,426] Trial 18 finished with value: 0.03460308890978974 and parameters: {'model_type': 'gcn', 'hidden_dims': '[128, 64]', 'dropout': 0.5792221915945404, 'batch_norm': True, 'lr': 1.2734139370044252e-05, 'weight_decay': 3.293863322548928e-07, 'epochs': 201, 'loss': 'mse', 'optimizer': 'adam', 'graph_mode': 'knn', 'source': 'grm', 'knn_k': 9, 'weighted_edges': False, 'symmetrize_mode': 'union', 'use_snp_selection': False}. Best is trial 13 with value: 0.08890949430380493.
[I 2025-11-03 13:38:24,148] Trial 19 finished with value: 0.0005793177493044793 and parameters: {'model_type': 'gcn', 'hidden_dims': '[512, 128]', 'dropout': 0.36652929749836805, 'batch_norm': True, 'lr': 1.3261425572023469e-06, 'weight_decay': 0.00041829659285156685, 'epochs': 256, 'loss': 'mse', 'optimizer': 'adam', 'graph_mode': 'knn', 'source': 'grm', 'knn_k': 4, 'weighted_edges': True, 'symmetrize_mode': 'union', 'use_snp_selection': False}. Best is trial 13 with value: 0.08890949430380493.
[I 2025-11-03 13:38:26,180] Trial 20 finished with value: -0.003846056696251333 and parameters: {'model_type': 'gcn', 'hidden_dims': '[128, 64]', 'dropout': 0.2991404676677661, 'batch_norm': True, 'lr': 3.6318419901982732e-06, 'weight_decay': 1.3585468705187433e-06, 'epochs': 346, 'loss': 'mse', 'optimizer': 'adam', 'graph_mode': 'knn', 'source': 'grm', 'knn_k': 7, 'weighted_edges': True, 'symmetrize_mode': 'union', 'use_snp_selection': False}. Best is trial 13 with value: 0.08890949430380493.
[I 2025-11-03 13:38:27,713] Trial 21 finished with value: 0.08043218564488212 and parameters: {'model_type': 'gcn', 'hidden_dims': '[512, 128]', 'dropout': 0.4187329869648595, 'batch_norm': True, 'lr': 0.0008937533885326577, 'weight_decay': 2.8866973590466394e-06, 'epochs': 51, 'loss': 'mse', 'optimizer': 'adam', 'graph_mode': 'cutoff', 'cutoff': 0.8711843999194891, 'grm_norm': 'cosine', 'self_loops': True, 'use_snp_selection': False}. Best is trial 13 with value: 0.08890949430380493.
[I 2025-11-03 13:38:29,164] Trial 22 finished with value: 0.04576182800007605 and parameters: {'model_type': 'gcn', 'hidden_dims': '[512, 128]', 'dropout': 0.4462272456768068, 'batch_norm': True, 'lr': 0.0004654899141828642, 'weight_decay': 3.622561252939943e-06, 'epochs': 34, 'loss': 'mse', 'optimizer': 'adam', 'graph_mode': 'cutoff', 'cutoff': 0.8762950586680227, 'grm_norm': 'cosine_then_gcn', 'self_loops': True, 'use_snp_selection': False}. Best is trial 13 with value: 0.08890949430380493.
[I 2025-11-03 13:38:30,865] Trial 23 finished with value: 0.06398099149558516 and parameters: {'model_type': 'gcn', 'hidden_dims': '[512, 128]', 'dropout': 0.3948206552342809, 'batch_norm': True, 'lr': 0.00018810636083061339, 'weight_decay': 6.42710958976235e-06, 'epochs': 83, 'loss': 'mse', 'optimizer': 'adam', 'graph_mode': 'cutoff', 'cutoff': 0.8930344636249535, 'grm_norm': 'none', 'self_loops': True, 'use_snp_selection': False}. Best is trial 13 with value: 0.08890949430380493.
[I 2025-11-03 13:38:32,877] Trial 24 finished with value: 0.07265237303742533 and parameters: {'model_type': 'gcn', 'hidden_dims': '[512, 128]', 'dropout': 0.4785487880221861, 'batch_norm': True, 'lr': 0.0003945872554247684, 'weight_decay': 3.3344419538469e-07, 'epochs': 129, 'loss': 'mse', 'optimizer': 'adam', 'graph_mode': 'knn', 'source': 'grm', 'knn_k': 3, 'weighted_edges': True, 'symmetrize_mode': 'union', 'use_snp_selection': False}. Best is trial 13 with value: 0.08890949430380493.
[I 2025-11-03 13:38:34,208] Trial 25 finished with value: 0.04688577379115262 and parameters: {'model_type': 'gcn', 'hidden_dims': '[256, 128, 64]', 'dropout': 0.33180154000606216, 'batch_norm': True, 'lr': 0.0009781454116176084, 'weight_decay': 2.173446953716572e-07, 'epochs': 46, 'loss': 'mse', 'optimizer': 'adam', 'graph_mode': 'knn', 'source': 'grm', 'knn_k': 7, 'weighted_edges': False, 'symmetrize_mode': 'union', 'use_snp_selection': False}. Best is trial 13 with value: 0.08890949430380493.
[I 2025-11-03 13:38:37,617] Trial 26 finished with value: 0.044682976343152894 and parameters: {'model_type': 'gcn', 'hidden_dims': '[256, 128]', 'dropout': 0.3969526431124534, 'batch_norm': False, 'lr': 9.463121802318847e-05, 'weight_decay': 8.180972185883256e-07, 'epochs': 199, 'loss': 'mae', 'optimizer': 'adam', 'graph_mode': 'cutoff', 'cutoff': 0.4378985733102677, 'grm_norm': 'cosine', 'self_loops': True, 'use_snp_selection': True, 'num_snps': 59005}. Best is trial 13 with value: 0.08890949430380493.
[I 2025-11-03 13:38:38,722] Trial 27 finished with value: 0.035322144941431294 and parameters: {'model_type': 'gcn', 'hidden_dims': '[128, 64]', 'dropout': 0.5564797190138333, 'batch_norm': True, 'lr': 0.0002651509348751299, 'weight_decay': 2.2892314675649324e-06, 'epochs': 29, 'loss': 'mse', 'optimizer': 'adam', 'graph_mode': 'knn', 'source': 'grm', 'knn_k': 6, 'weighted_edges': True, 'symmetrize_mode': 'union', 'use_snp_selection': False}. Best is trial 13 with value: 0.08890949430380493.
[I 2025-11-03 13:38:40,621] Trial 28 finished with value: 0.08123719751630708 and parameters: {'model_type': 'gcn', 'hidden_dims': '[512, 64]', 'dropout': 0.47198068169107965, 'batch_norm': True, 'lr': 0.0005185242997618435, 'weight_decay': 7.253535165997649e-07, 'epochs': 114, 'loss': 'mse', 'optimizer': 'adam', 'graph_mode': 'cutoff', 'cutoff': 0.7613419213869919, 'grm_norm': 'cosine', 'self_loops': True, 'use_snp_selection': False}. Best is trial 13 with value: 0.08890949430380493.
[I 2025-11-03 13:38:42,756] Trial 29 finished with value: 0.05906287237255966 and parameters: {'model_type': 'gcn', 'hidden_dims': '[512, 64]', 'dropout': 0.476387323734642, 'batch_norm': True, 'lr': 0.0004905853835257014, 'weight_decay': 1.0146551022334224e-06, 'epochs': 153, 'loss': 'mae', 'optimizer': 'adam', 'graph_mode': 'knn', 'source': 'grm', 'knn_k': 3, 'weighted_edges': True, 'symmetrize_mode': 'union', 'use_snp_selection': False}. Best is trial 13 with value: 0.08890949430380493.
[I 2025-11-03 13:38:44,638] Trial 30 finished with value: 0.029674461036428415 and parameters: {'model_type': 'gcn', 'hidden_dims': '[512, 64]', 'dropout': 0.21870368123902434, 'batch_norm': True, 'lr': 1.7835342454676136e-05, 'weight_decay': 4.777293192376937e-07, 'epochs': 107, 'loss': 'mse', 'optimizer': 'adam', 'graph_mode': 'knn', 'source': 'grm', 'knn_k': 9, 'weighted_edges': False, 'symmetrize_mode': 'mutual', 'use_snp_selection': False}. Best is trial 13 with value: 0.08890949430380493.
