[I 2025-11-03 13:47:13,928] Trial 101 finished with value: 0.0025327873590830653 and parameters: {'model_type': 'graphsage', 'hidden_dims': '[512, 128]', 'dropout': 0.36462008968439535, 'batch_norm': False, 'lr': 3.83660818797506e-06, 'weight_decay': 1.7532189930515726e-06, 'epochs': 47, 'loss': 'mse', 'optimizer': 'adam', 'graph_mode': 'cutoff', 'cutoff': 0.709954210957584, 'grm_norm': 'none', 'self_loops': True, 'use_snp_selection': True, 'num_snps': 45340}. Best is trial 14 with value: 0.07089940486947045.
[I 2025-11-03 13:47:19,268] Trial 102 finished with value: 0.040606270842116536 and parameters: {'model_type': 'graphsage', 'hidden_dims': '[512, 128]', 'dropout': 0.307688616071916, 'batch_norm': False, 'lr': 9.855404594184395e-06, 'weight_decay': 1.1216224810495234e-06, 'epochs': 294, 'loss': 'mse', 'optimizer': 'adam', 'graph_mode': 'cutoff', 'cutoff': 0.7615803401741364, 'grm_norm': 'none', 'self_loops': True, 'use_snp_selection': True, 'num_snps': 43172}. Best is trial 14 with value: 0.07089940486947045.
[I 2025-11-03 13:47:25,116] Trial 103 finished with value: 0.022685408040153714 and parameters: {'model_type': 'graphsage', 'hidden_dims': '[512, 128]', 'dropout': 0.40321795577873687, 'batch_norm': False, 'lr': 6.006720871649348e-06, 'weight_decay': 1.4246479142447153e-06, 'epochs': 275, 'loss': 'mse', 'optimizer': 'adam', 'graph_mode': 'cutoff', 'cutoff': 0.6580810076947938, 'grm_norm': 'none', 'self_loops': True, 'use_snp_selection': True, 'num_snps': 50458}. Best is trial 14 with value: 0.07089940486947045.
[I 2025-11-03 13:47:27,928] Trial 104 finished with value: 0.03493876857314396 and parameters: {'model_type': 'graphsage', 'hidden_dims': '[256, 128]', 'dropout': 0.47463055336613824, 'batch_norm': False, 'lr': 7.576398117246974e-06, 'weight_decay': 4.493944643023604e-07, 'epochs': 315, 'loss': 'mse', 'optimizer': 'adam', 'graph_mode': 'cutoff', 'cutoff': 0.685512602239819, 'grm_norm': 'none', 'self_loops': False, 'use_snp_selection': True, 'num_snps': 15374}. Best is trial 14 with value: 0.07089940486947045.
[I 2025-11-03 13:47:31,622] Trial 105 finished with value: 0.00942440902037717 and parameters: {'model_type': 'graphsage', 'hidden_dims': '[256, 128, 64]', 'dropout': 0.2492748880736576, 'batch_norm': False, 'lr': 0.00041028278317845496, 'weight_decay': 6.896398720931091e-07, 'epochs': 203, 'loss': 'mse', 'optimizer': 'adam', 'graph_mode': 'knn', 'source': 'grm', 'knn_k': 5, 'weighted_edges': False, 'symmetrize_mode': 'mutual', 'use_snp_selection': True, 'num_snps': 39691}. Best is trial 14 with value: 0.07089940486947045.
[I 2025-11-03 13:47:34,415] Trial 106 finished with value: 0.04717428305824951 and parameters: {'model_type': 'graphsage', 'hidden_dims': '[512, 128]', 'dropout': 0.3729833874726074, 'batch_norm': False, 'lr': 2.741079542116704e-06, 'weight_decay': 1.60551333273577e-07, 'epochs': 161, 'loss': 'mse', 'optimizer': 'adam', 'graph_mode': 'cutoff', 'cutoff': 0.7380319361433618, 'grm_norm': 'none', 'self_loops': True, 'use_snp_selection': True, 'num_snps': 21741}. Best is trial 14 with value: 0.07089940486947045.
[I 2025-11-03 13:47:39,932] Trial 107 finished with value: -0.0008384392678690968 and parameters: {'model_type': 'graphsage', 'hidden_dims': '[512, 128]', 'dropout': 0.3545150354861967, 'batch_norm': False, 'lr': 2.1157338587245674e-06, 'weight_decay': 7.444426498356573e-06, 'epochs': 284, 'loss': 'mse', 'optimizer': 'adam', 'graph_mode': 'cutoff', 'cutoff': 0.7236717902277202, 'grm_norm': 'gcn', 'self_loops': False, 'use_snp_selection': True, 'num_snps': 45974}. Best is trial 14 with value: 0.07089940486947045.
[I 2025-11-03 13:47:41,376] Trial 108 finished with value: 0.05235972015933399 and parameters: {'model_type': 'graphsage', 'hidden_dims': '[512, 256]', 'dropout': 0.39025306430080314, 'batch_norm': False, 'lr': 0.00011474176550421417, 'weight_decay': 2.351296517090809e-07, 'epochs': 41, 'loss': 'mse', 'optimizer': 'adam', 'graph_mode': 'cutoff', 'cutoff': 0.7032740974622981, 'grm_norm': 'none', 'self_loops': False, 'use_snp_selection': True, 'num_snps': 3522}. Best is trial 14 with value: 0.07089940486947045.
[I 2025-11-03 13:47:43,183] Trial 109 finished with value: 0.03900853047363512 and parameters: {'model_type': 'graphsage', 'hidden_dims': '[512, 256]', 'dropout': 0.3473931404655569, 'batch_norm': False, 'lr': 0.0001283999335117357, 'weight_decay': 2.3201084348156066e-07, 'epochs': 146, 'loss': 'mse', 'optimizer': 'adam', 'graph_mode': 'cutoff', 'cutoff': 0.8327780570662492, 'grm_norm': 'none', 'self_loops': False, 'use_snp_selection': True, 'num_snps': 3430}. Best is trial 14 with value: 0.07089940486947045.
[I 2025-11-03 13:47:44,851] Trial 110 finished with value: 0.010023368035265899 and parameters: {'model_type': 'graphsage', 'hidden_dims': '[512, 256]', 'dropout': 0.43838950371871815, 'batch_norm': False, 'lr': 8.97224969106748e-06, 'weight_decay': 4.225559602109659e-07, 'epochs': 64, 'loss': 'mse', 'optimizer': 'adam', 'graph_mode': 'cutoff', 'cutoff': 0.7722039899394075, 'grm_norm': 'cosine', 'self_loops': True, 'use_snp_selection': True, 'num_snps': 6252}. Best is trial 14 with value: 0.07089940486947045.
[I 2025-11-03 13:47:46,648] Trial 111 finished with value: 0.012145105721123354 and parameters: {'model_type': 'graphsage', 'hidden_dims': '[512, 256]', 'dropout': 0.3922256596910662, 'batch_norm': False, 'lr': 0.00024547959246149127, 'weight_decay': 8.003277969558408e-07, 'epochs': 44, 'loss': 'mse', 'optimizer': 'adam', 'graph_mode': 'cutoff', 'cutoff': 0.7041198717530837, 'grm_norm': 'none', 'self_loops': False, 'use_snp_selection': True, 'num_snps': 11070}. Best is trial 14 with value: 0.07089940486947045.
[I 2025-11-03 13:47:48,804] Trial 112 finished with value: 0.018355672955091655 and parameters: {'model_type': 'graphsage', 'hidden_dims': '[512, 64]', 'dropout': 0.38416831586989014, 'batch_norm': False, 'lr': 0.00015072695313802386, 'weight_decay': 1.9006898653660377e-07, 'epochs': 55, 'loss': 'mse', 'optimizer': 'adam', 'graph_mode': 'cutoff', 'cutoff': 0.6726569968417224, 'grm_norm': 'none', 'self_loops': False, 'use_snp_selection': True, 'num_snps': 17830}. Best is trial 14 with value: 0.07089940486947045.
[I 2025-11-03 13:47:50,181] Trial 113 finished with value: 0.05290719041917558 and parameters: {'model_type': 'graphsage', 'hidden_dims': '[512, 256]', 'dropout': 0.18552506338760066, 'batch_norm': False, 'lr': 0.00011195310168656449, 'weight_decay': 0.00039127020033886457, 'epochs': 41, 'loss': 'mse', 'optimizer': 'adam', 'graph_mode': 'cutoff', 'cutoff': 0.7458790381087452, 'grm_norm': 'none', 'self_loops': False, 'use_snp_selection': True, 'num_snps': 2015}. Best is trial 14 with value: 0.07089940486947045.
[I 2025-11-03 13:47:51,742] Trial 114 finished with value: 0.020590136549353752 and parameters: {'model_type': 'graphsage', 'hidden_dims': '[512, 256]', 'dropout': 0.21319361647350688, 'batch_norm': False, 'lr': 4.820961670470168e-06, 'weight_decay': 0.0006858621050227566, 'epochs': 41, 'loss': 'mse', 'optimizer': 'adam', 'graph_mode': 'cutoff', 'cutoff': 0.7530753027642699, 'grm_norm': 'none', 'self_loops': False, 'use_snp_selection': True, 'num_snps': 6153}. Best is trial 14 with value: 0.07089940486947045.
[I 2025-11-03 13:47:54,001] Trial 115 finished with value: 0.041735921416316824 and parameters: {'model_type': 'graphsage', 'hidden_dims': '[512, 256]', 'dropout': 0.18484297598840746, 'batch_norm': False, 'lr': 7.752148469180079e-05, 'weight_decay': 0.0004163260568022894, 'epochs': 265, 'loss': 'mse', 'optimizer': 'adam', 'graph_mode': 'cutoff', 'cutoff': 0.7333113798020161, 'grm_norm': 'none', 'self_loops': False, 'use_snp_selection': True, 'num_snps': 4538}. Best is trial 14 with value: 0.07089940486947045.
[I 2025-11-03 13:47:55,545] Trial 116 finished with value: 0.05992105129387253 and parameters: {'model_type': 'graphsage', 'hidden_dims': '[512, 256]', 'dropout': 0.1991682521985675, 'batch_norm': False, 'lr': 8.961439046741272e-05, 'weight_decay': 0.00032709897365477953, 'epochs': 75, 'loss': 'mse', 'optimizer': 'adam', 'graph_mode': 'cutoff', 'cutoff': 0.6938384516167863, 'grm_norm': 'none', 'self_loops': False, 'use_snp_selection': True, 'num_snps': 3369}. Best is trial 14 with value: 0.07089940486947045.
[I 2025-11-03 13:47:57,047] Trial 117 finished with value: 0.05645518540151589 and parameters: {'model_type': 'graphsage', 'hidden_dims': '[512, 256]', 'dropout': 0.2320040026615022, 'batch_norm': False, 'lr': 0.00011498375538996025, 'weight_decay': 0.0003503330470551599, 'epochs': 52, 'loss': 'mse', 'optimizer': 'adam', 'graph_mode': 'cutoff', 'cutoff': 0.6926667974553113, 'grm_norm': 'none', 'self_loops': False, 'use_snp_selection': True, 'num_snps': 4264}. Best is trial 14 with value: 0.07089940486947045.
[I 2025-11-03 13:47:58,561] Trial 118 finished with value: 0.025768442995404865 and parameters: {'model_type': 'graphsage', 'hidden_dims': '[512, 256]', 'dropout': 0.2257907289858599, 'batch_norm': False, 'lr': 0.0001007930966479764, 'weight_decay': 0.00033435608455075985, 'epochs': 50, 'loss': 'mse', 'optimizer': 'adam', 'graph_mode': 'cutoff', 'cutoff': 0.6885863628382294, 'grm_norm': 'none', 'self_loops': False, 'use_snp_selection': True, 'num_snps': 4658}. Best is trial 14 with value: 0.07089940486947045.
[I 2025-11-03 13:48:00,016] Trial 119 finished with value: 0.06800766639653513 and parameters: {'model_type': 'graphsage', 'hidden_dims': '[512, 256]', 'dropout': 0.19693028232575624, 'batch_norm': False, 'lr': 6.473024119628412e-05, 'weight_decay': 0.0004757434996818203, 'epochs': 64, 'loss': 'mse', 'optimizer': 'adam', 'graph_mode': 'cutoff', 'cutoff': 0.6411733113912992, 'grm_norm': 'none', 'self_loops': False, 'use_snp_selection': True, 'num_snps': 2194}. Best is trial 14 with value: 0.07089940486947045.
[I 2025-11-03 13:48:01,513] Trial 120 finished with value: 0.022618554400627273 and parameters: {'model_type': 'graphsage', 'hidden_dims': '[512, 256]', 'dropout': 0.23389578512950654, 'batch_norm': False, 'lr': 8.777074869021386e-05, 'weight_decay': 0.0006151857481218224, 'epochs': 76, 'loss': 'mse', 'optimizer': 'adam', 'graph_mode': 'cutoff', 'cutoff': 0.6046170072721769, 'grm_norm': 'none', 'self_loops': False, 'use_snp_selection': True, 'num_snps': 2185}. Best is trial 14 with value: 0.07089940486947045.
[I 2025-11-03 13:48:02,968] Trial 121 finished with value: 0.04918041179858442 and parameters: {'model_type': 'graphsage', 'hidden_dims': '[512, 256]', 'dropout': 0.19337221757429188, 'batch_norm': False, 'lr': 0.0001193591284641569, 'weight_decay': 0.00020441529296904532, 'epochs': 60, 'loss': 'mse', 'optimizer': 'adam', 'graph_mode': 'cutoff', 'cutoff': 0.6548396613747635, 'grm_norm': 'none', 'self_loops': False, 'use_snp_selection': True, 'num_snps': 2521}. Best is trial 14 with value: 0.07089940486947045.
[I 2025-11-03 13:48:04,698] Trial 122 finished with value: 0.04286820500889551 and parameters: {'model_type': 'graphsage', 'hidden_dims': '[512, 256]', 'dropout': 0.16942178957866388, 'batch_norm': False, 'lr': 6.499371068912543e-05, 'weight_decay': 0.0004616581634454919, 'epochs': 63, 'loss': 'mse', 'optimizer': 'adam', 'graph_mode': 'cutoff', 'cutoff': 0.7065969169459608, 'grm_norm': 'none', 'self_loops': False, 'use_snp_selection': True, 'num_snps': 8181}. Best is trial 14 with value: 0.07089940486947045.
[I 2025-11-03 13:48:06,239] Trial 123 finished with value: 0.03644218443844857 and parameters: {'model_type': 'graphsage', 'hidden_dims': '[512, 256]', 'dropout': 0.19591343845821046, 'batch_norm': False, 'lr': 0.0001631964711064009, 'weight_decay': 0.0002548020889883745, 'epochs': 40, 'loss': 'mse', 'optimizer': 'adam', 'graph_mode': 'cutoff', 'cutoff': 0.6288874304260466, 'grm_norm': 'none', 'self_loops': False, 'use_snp_selection': True, 'num_snps': 5768}. Best is trial 14 with value: 0.07089940486947045.
[I 2025-11-03 13:48:07,680] Trial 124 finished with value: 0.04795200613205587 and parameters: {'model_type': 'graphsage', 'hidden_dims': '[512, 256]', 'dropout': 0.2194479594439172, 'batch_norm': False, 'lr': 9.583763117812891e-05, 'weight_decay': 0.0007969451632345678, 'epochs': 52, 'loss': 'mse', 'optimizer': 'adam', 'graph_mode': 'cutoff', 'cutoff': 0.6720804872821319, 'grm_norm': 'none', 'self_loops': False, 'use_snp_selection': True, 'num_snps': 3110}. Best is trial 14 with value: 0.07089940486947045.
[I 2025-11-03 13:48:09,452] Trial 125 finished with value: 0.036555105423700156 and parameters: {'model_type': 'graphsage', 'hidden_dims': '[512, 256]', 'dropout': 0.15342779496736864, 'batch_norm': False, 'lr': 5.874639223380435e-05, 'weight_decay': 0.00036761213063985426, 'epochs': 70, 'loss': 'mse', 'optimizer': 'adam', 'graph_mode': 'cutoff', 'cutoff': 0.7455049184609454, 'grm_norm': 'none', 'self_loops': False, 'use_snp_selection': True, 'num_snps': 8585}. Best is trial 14 with value: 0.07089940486947045.
[I 2025-11-03 13:48:11,032] Trial 126 finished with value: 0.017124805435770392 and parameters: {'model_type': 'graphsage', 'hidden_dims': '[512, 256]', 'dropout': 0.1795441552508179, 'batch_norm': False, 'lr': 4.891730640341261e-05, 'weight_decay': 0.0004904345267732828, 'epochs': 56, 'loss': 'mse', 'optimizer': 'adam', 'graph_mode': 'knn', 'source': 'grm', 'knn_k': 6, 'weighted_edges': True, 'symmetrize_mode': 'union', 'use_snp_selection': True, 'num_snps': 3993}. Best is trial 14 with value: 0.07089940486947045.
[I 2025-11-03 13:48:12,968] Trial 127 finished with value: 0.054636068933858105 and parameters: {'model_type': 'graphsage', 'hidden_dims': '[512, 256]', 'dropout': 0.21197710714371126, 'batch_norm': False, 'lr': 0.00011728839456366053, 'weight_decay': 0.00030151930434681775, 'epochs': 75, 'loss': 'mse', 'optimizer': 'adam', 'graph_mode': 'cutoff', 'cutoff': 0.6991787370885114, 'grm_norm': 'none', 'self_loops': False, 'use_snp_selection': True, 'num_snps': 11690}. Best is trial 14 with value: 0.07089940486947045.
[I 2025-11-03 13:48:14,843] Trial 128 finished with value: 0.04170858264206394 and parameters: {'model_type': 'graphsage', 'hidden_dims': '[512, 256]', 'dropout': 0.20318991823624746, 'batch_norm': False, 'lr': 7.577312139756688e-05, 'weight_decay': 0.00030498539486292753, 'epochs': 66, 'loss': 'mse', 'optimizer': 'adam', 'graph_mode': 'cutoff', 'cutoff': 0.6916919051431544, 'grm_norm': 'none', 'self_loops': False, 'use_snp_selection': True, 'num_snps': 10849}. Best is trial 14 with value: 0.07089940486947045.
[I 2025-11-03 13:48:16,492] Trial 129 finished with value: 0.050271630044271605 and parameters: {'model_type': 'graphsage', 'hidden_dims': '[512, 256]', 'dropout': 0.2447234547387856, 'batch_norm': False, 'lr': 0.00012373851845828748, 'weight_decay': 0.00018149347467902638, 'epochs': 84, 'loss': 'mse', 'optimizer': 'adam', 'graph_mode': 'cutoff', 'cutoff': 0.6478579393371979, 'grm_norm': 'none', 'self_loops': False, 'use_snp_selection': True, 'num_snps': 4610}. Best is trial 14 with value: 0.07089940486947045.
[I 2025-11-03 13:48:18,399] Trial 130 finished with value: 0.0428803373325661 and parameters: {'model_type': 'graphsage', 'hidden_dims': '[512, 256]', 'dropout': 0.261754587581696, 'batch_norm': False, 'lr': 0.00017859569962229725, 'weight_decay': 0.0006121034405045552, 'epochs': 47, 'loss': 'mse', 'optimizer': 'adam', 'graph_mode': 'cutoff', 'cutoff': 0.7022600680189766, 'grm_norm': 'none', 'self_loops': False, 'use_snp_selection': True, 'num_snps': 13072}. Best is trial 14 with value: 0.07089940486947045.
[I 2025-11-03 13:48:20,242] Trial 131 finished with value: 0.02281643011548842 and parameters: {'model_type': 'graphsage', 'hidden_dims': '[512, 256]', 'dropout': 0.23285746496959758, 'batch_norm': False, 'lr': 0.00013852788158615003, 'weight_decay': 0.00030626346056194603, 'epochs': 74, 'loss': 'mse', 'optimizer': 'adam', 'graph_mode': 'cutoff', 'cutoff': 0.7244706746444532, 'grm_norm': 'none', 'self_loops': False, 'use_snp_selection': True, 'num_snps': 9580}. Best is trial 14 with value: 0.07089940486947045.
[I 2025-11-03 13:48:21,649] Trial 132 finished with value: 0.030821276557588442 and parameters: {'model_type': 'graphsage', 'hidden_dims': '[512, 256]', 'dropout': 0.18811016114334747, 'batch_norm': False, 'lr': 9.679364839588144e-05, 'weight_decay': 0.0002536839035172754, 'epochs': 58, 'loss': 'mse', 'optimizer': 'adam', 'graph_mode': 'cutoff', 'cutoff': 0.6663557887324624, 'grm_norm': 'none', 'self_loops': False, 'use_snp_selection': True, 'num_snps': 2053}. Best is trial 14 with value: 0.07089940486947045.
[I 2025-11-03 13:48:24,302] Trial 133 finished with value: 0.028162419733578574 and parameters: {'model_type': 'graphsage', 'hidden_dims': '[512, 256]', 'dropout': 0.21409896546504664, 'batch_norm': False, 'lr': 6.37460779147651e-05, 'weight_decay': 0.0004249614804365999, 'epochs': 48, 'loss': 'mse', 'optimizer': 'adam', 'graph_mode': 'cutoff', 'cutoff': 0.7402749241449358, 'grm_norm': 'none', 'self_loops': False, 'use_snp_selection': True, 'num_snps': 26356}. Best is trial 14 with value: 0.07089940486947045.
[I 2025-11-03 13:48:26,478] Trial 134 finished with value: 0.034171568458553736 and parameters: {'model_type': 'graphsage', 'hidden_dims': '[256, 128]', 'dropout': 0.2033193473329575, 'batch_norm': False, 'lr': 8.65497386199957e-05, 'weight_decay': 0.00014143044244632682, 'epochs': 89, 'loss': 'mse', 'optimizer': 'adam', 'graph_mode': 'cutoff', 'cutoff': 0.6805900383714223, 'grm_norm': 'none', 'self_loops': False, 'use_snp_selection': True, 'num_snps': 19388}. Best is trial 14 with value: 0.07089940486947045.
[I 2025-11-03 13:48:27,999] Trial 135 finished with value: 0.03608903058886416 and parameters: {'model_type': 'graphsage', 'hidden_dims': '[512, 256]', 'dropout': 0.22496028150419023, 'batch_norm': False, 'lr': 0.00015799522849309995, 'weight_decay': 0.00037331975505924467, 'epochs': 40, 'loss': 'mse', 'optimizer': 'adam', 'graph_mode': 'cutoff', 'cutoff': 0.7099274735468698, 'grm_norm': 'none', 'self_loops': False, 'use_snp_selection': True, 'num_snps': 5287}. Best is trial 14 with value: 0.07089940486947045.
[I 2025-11-03 13:48:29,726] Trial 136 finished with value: 0.03071728665704918 and parameters: {'model_type': 'graphsage', 'hidden_dims': '[512, 256]', 'dropout': 0.21295568827803196, 'batch_norm': False, 'lr': 0.00022313392414561483, 'weight_decay': 0.00019213967333528507, 'epochs': 77, 'loss': 'mse', 'optimizer': 'adam', 'graph_mode': 'cutoff', 'cutoff': 0.7552966212162789, 'grm_norm': 'gcn', 'self_loops': False, 'use_snp_selection': True, 'num_snps': 6704}. Best is trial 14 with value: 0.07089940486947045.
[I 2025-11-03 13:48:32,555] Trial 137 finished with value: 0.0017606972553518964 and parameters: {'model_type': 'graphsage', 'hidden_dims': '[512, 256]', 'dropout': 0.2543779517719897, 'batch_norm': False, 'lr': 0.00011089120855193673, 'weight_decay': 0.0009367220969789202, 'epochs': 52, 'loss': 'mse', 'optimizer': 'adam', 'graph_mode': 'cutoff', 'cutoff': 0.7814780992447901, 'grm_norm': 'none', 'self_loops': False, 'use_snp_selection': True, 'num_snps': 29821}. Best is trial 14 with value: 0.07089940486947045.
[I 2025-11-03 13:48:35,706] Trial 138 finished with value: 0.029537075085198095 and parameters: {'model_type': 'graphsage', 'hidden_dims': '[512, 256]', 'dropout': 0.1631145165175856, 'batch_norm': False, 'lr': 6.895323487346596e-05, 'weight_decay': 0.0005061044109519524, 'epochs': 67, 'loss': 'mse', 'optimizer': 'adam', 'graph_mode': 'cutoff', 'cutoff': 0.6906495571905158, 'grm_norm': 'none', 'self_loops': False, 'use_snp_selection': True, 'num_snps': 33462}. Best is trial 14 with value: 0.07089940486947045.
[I 2025-11-03 13:48:38,228] Trial 139 finished with value: 0.0241269654777196 and parameters: {'model_type': 'graphsage', 'hidden_dims': '[256, 128, 64]', 'dropout': 0.181556138300833, 'batch_norm': False, 'lr': 0.00013301512315039488, 'weight_decay': 0.00023006432526174214, 'epochs': 174, 'loss': 'mse', 'optimizer': 'adam', 'graph_mode': 'cutoff', 'cutoff': 0.7301626865158443, 'grm_norm': 'none', 'self_loops': False, 'use_snp_selection': True, 'num_snps': 14594}. Best is trial 14 with value: 0.07089940486947045.
[I 2025-11-03 13:48:40,619] Trial 140 finished with value: 0.02777960002477695 and parameters: {'model_type': 'graphsage', 'hidden_dims': '[512, 128]', 'dropout': 0.19435287095475412, 'batch_norm': False, 'lr': 6.850404222285687e-06, 'weight_decay': 0.00028774752329231045, 'epochs': 198, 'loss': 'mse', 'optimizer': 'adam', 'graph_mode': 'cutoff', 'cutoff': 0.7986027107151781, 'grm_norm': 'none', 'self_loops': False, 'use_snp_selection': True, 'num_snps': 12145}. Best is trial 14 with value: 0.07089940486947045.
[I 2025-11-03 13:48:45,485] Trial 141 finished with value: 0.050577810060126856 and parameters: {'model_type': 'graphsage', 'hidden_dims': '[512, 128]', 'dropout': 0.36509060560590095, 'batch_norm': False, 'lr': 0.00010684012281828207, 'weight_decay': 1.0445190291305128e-06, 'epochs': 217, 'loss': 'mse', 'optimizer': 'adam', 'graph_mode': 'cutoff', 'cutoff': 0.716466637974459, 'grm_norm': 'none', 'self_loops': True, 'use_snp_selection': True, 'num_snps': 44119}. Best is trial 14 with value: 0.07089940486947045.
[I 2025-11-03 13:48:48,945] Trial 142 finished with value: 0.05106109624315522 and parameters: {'model_type': 'graphsage', 'hidden_dims': '[512, 128]', 'dropout': 0.3996373001963035, 'batch_norm': False, 'lr': 3.774143645131608e-05, 'weight_decay': 8.632223594191638e-07, 'epochs': 278, 'loss': 'mse', 'optimizer': 'adam', 'graph_mode': 'cutoff', 'cutoff': 0.7029159340803773, 'grm_norm': 'none', 'self_loops': True, 'use_snp_selection': True, 'num_snps': 23446}. Best is trial 14 with value: 0.07089940486947045.
