[I 2025-11-03 13:23:51,753] Trial 94 finished with value: 0.10119920260058603 and parameters: {'model_type': 'gcn', 'hidden_dims': '[128, 64]', 'dropout': 0.2450723546865681, 'batch_norm': True, 'lr': 0.0008636116548632626, 'weight_decay': 6.486608457844729e-06, 'epochs': 277, 'loss': 'mae', 'optimizer': 'adam', 'graph_mode': 'knn', 'source': 'grm', 'knn_k': 1, 'weighted_edges': False, 'symmetrize_mode': 'mutual', 'use_snp_selection': False}. Best is trial 53 with value: 0.12552284880403508.
[I 2025-11-03 13:23:54,730] Trial 95 finished with value: 0.11567298634433859 and parameters: {'model_type': 'gcn', 'hidden_dims': '[512, 128]', 'dropout': 0.21535962419119087, 'batch_norm': True, 'lr': 0.0003598485185440035, 'weight_decay': 2.0129477767843207e-06, 'epochs': 236, 'loss': 'mae', 'optimizer': 'adam', 'graph_mode': 'knn', 'source': 'grm', 'knn_k': 1, 'weighted_edges': False, 'symmetrize_mode': 'mutual', 'use_snp_selection': False}. Best is trial 53 with value: 0.12552284880403508.
[I 2025-11-03 13:23:57,707] Trial 96 finished with value: 0.09206196407265023 and parameters: {'model_type': 'gcn', 'hidden_dims': '[512, 128]', 'dropout': 0.213509243828977, 'batch_norm': True, 'lr': 0.00036735059068238913, 'weight_decay': 4.1820461110265867e-07, 'epochs': 235, 'loss': 'mse', 'optimizer': 'adam', 'graph_mode': 'cutoff', 'cutoff': 0.21937547952392722, 'grm_norm': 'cosine_then_gcn', 'self_loops': True, 'use_snp_selection': False}. Best is trial 53 with value: 0.12552284880403508.
[I 2025-11-03 13:24:00,801] Trial 97 finished with value: 0.0824902909780014 and parameters: {'model_type': 'gcn', 'hidden_dims': '[512, 128]', 'dropout': 0.19856647656230647, 'batch_norm': True, 'lr': 0.00015204483986828491, 'weight_decay': 1.942708261397077e-06, 'epochs': 251, 'loss': 'mae', 'optimizer': 'adam', 'graph_mode': 'knn', 'source': 'grm', 'knn_k': 1, 'weighted_edges': True, 'symmetrize_mode': 'mutual', 'use_snp_selection': False}. Best is trial 53 with value: 0.12552284880403508.
[I 2025-11-03 13:24:03,726] Trial 98 finished with value: 0.08432903184262006 and parameters: {'model_type': 'gcn', 'hidden_dims': '[512, 128]', 'dropout': 0.5710747645547377, 'batch_norm': True, 'lr': 0.00027236121621885347, 'weight_decay': 1.1264024617277557e-05, 'epochs': 226, 'loss': 'mae', 'optimizer': 'adam', 'graph_mode': 'knn', 'source': 'grm', 'knn_k': 2, 'weighted_edges': False, 'symmetrize_mode': 'mutual', 'use_snp_selection': False}. Best is trial 53 with value: 0.12552284880403508.
[I 2025-11-03 13:24:05,228] Trial 99 finished with value: 0.08937342171353245 and parameters: {'model_type': 'gcn', 'hidden_dims': '[512, 128]', 'dropout': 0.32123730402979733, 'batch_norm': True, 'lr': 0.00011421932356399096, 'weight_decay': 1.594590345143739e-06, 'epochs': 25, 'loss': 'mae', 'optimizer': 'adam', 'graph_mode': 'knn', 'source': 'grm', 'knn_k': 1, 'weighted_edges': False, 'symmetrize_mode': 'mutual', 'use_snp_selection': False}. Best is trial 53 with value: 0.12552284880403508.
[I 2025-11-03 13:24:07,366] Trial 100 finished with value: 0.0645891664127402 and parameters: {'model_type': 'gcn', 'hidden_dims': '[256, 128]', 'dropout': 0.2650083283004458, 'batch_norm': True, 'lr': 0.0005201054510241173, 'weight_decay': 7.96896163514497e-07, 'epochs': 214, 'loss': 'mae', 'optimizer': 'adam', 'graph_mode': 'knn', 'source': 'grm', 'knn_k': 1, 'weighted_edges': False, 'symmetrize_mode': 'union', 'use_snp_selection': False}. Best is trial 53 with value: 0.12552284880403508.
[I 2025-11-03 13:24:09,295] Trial 101 finished with value: 0.1128792617713955 and parameters: {'model_type': 'gcn', 'hidden_dims': '[128, 64]', 'dropout': 0.11108356381654229, 'batch_norm': True, 'lr': 0.0007310312901379558, 'weight_decay': 2.7491650125833423e-06, 'epochs': 267, 'loss': 'mae', 'optimizer': 'adam', 'graph_mode': 'knn', 'source': 'grm', 'knn_k': 1, 'weighted_edges': False, 'symmetrize_mode': 'mutual', 'use_snp_selection': False}. Best is trial 53 with value: 0.12552284880403508.
[I 2025-11-03 13:24:11,154] Trial 102 finished with value: 0.11076323974166308 and parameters: {'model_type': 'gcn', 'hidden_dims': '[128, 64]', 'dropout': 0.28160862674031223, 'batch_norm': True, 'lr': 0.0006231713521039768, 'weight_decay': 3.6508151103481316e-06, 'epochs': 246, 'loss': 'mae', 'optimizer': 'adam', 'graph_mode': 'knn', 'source': 'grm', 'knn_k': 1, 'weighted_edges': False, 'symmetrize_mode': 'mutual', 'use_snp_selection': False}. Best is trial 53 with value: 0.12552284880403508.
[I 2025-11-03 13:24:13,052] Trial 103 finished with value: 0.09940694103655964 and parameters: {'model_type': 'gcn', 'hidden_dims': '[128, 64]', 'dropout': 0.23102534110455336, 'batch_norm': True, 'lr': 0.0009917393687819804, 'weight_decay': 4.741450215424114e-06, 'epochs': 259, 'loss': 'mae', 'optimizer': 'adam', 'graph_mode': 'knn', 'source': 'grm', 'knn_k': 1, 'weighted_edges': False, 'symmetrize_mode': 'mutual', 'use_snp_selection': False}. Best is trial 53 with value: 0.12552284880403508.
[I 2025-11-03 13:24:16,375] Trial 104 finished with value: 0.07512854826861516 and parameters: {'model_type': 'gcn', 'hidden_dims': '[512, 128]', 'dropout': 0.13286792611331213, 'batch_norm': True, 'lr': 0.0004211298439783993, 'weight_decay': 1.0242857450407147e-06, 'epochs': 281, 'loss': 'mae', 'optimizer': 'adam', 'graph_mode': 'knn', 'source': 'grm', 'knn_k': 2, 'weighted_edges': False, 'symmetrize_mode': 'mutual', 'use_snp_selection': False}. Best is trial 53 with value: 0.12552284880403508.
[I 2025-11-03 13:24:19,210] Trial 105 finished with value: 0.10385138732701789 and parameters: {'model_type': 'gcn', 'hidden_dims': '[256, 128, 64]', 'dropout': 0.16199557166190912, 'batch_norm': True, 'lr': 0.0008439541966020928, 'weight_decay': 1.991487134667949e-06, 'epochs': 299, 'loss': 'mae', 'optimizer': 'adam', 'graph_mode': 'knn', 'source': 'grm', 'knn_k': 1, 'weighted_edges': False, 'symmetrize_mode': 'mutual', 'use_snp_selection': False}. Best is trial 53 with value: 0.12552284880403508.
[I 2025-11-03 13:24:21,148] Trial 106 finished with value: 0.10513115367942721 and parameters: {'model_type': 'gcn', 'hidden_dims': '[128, 64]', 'dropout': 0.31064185659050264, 'batch_norm': True, 'lr': 0.0003439018831060348, 'weight_decay': 6.225142129279795e-07, 'epochs': 271, 'loss': 'mae', 'optimizer': 'adam', 'graph_mode': 'knn', 'source': 'grm', 'knn_k': 1, 'weighted_edges': False, 'symmetrize_mode': 'mutual', 'use_snp_selection': False}. Best is trial 53 with value: 0.12552284880403508.
[I 2025-11-03 13:24:22,966] Trial 107 finished with value: 0.08376642928472743 and parameters: {'model_type': 'gcn', 'hidden_dims': '[128, 64]', 'dropout': 0.3003679727924166, 'batch_norm': True, 'lr': 0.0005472561639424024, 'weight_decay': 1.426530403437156e-06, 'epochs': 235, 'loss': 'mae', 'optimizer': 'adam', 'graph_mode': 'knn', 'source': 'grm', 'knn_k': 2, 'weighted_edges': False, 'symmetrize_mode': 'mutual', 'use_snp_selection': False}. Best is trial 53 with value: 0.12552284880403508.
[I 2025-11-03 13:24:25,760] Trial 108 finished with value: 0.0943948122346204 and parameters: {'model_type': 'gcn', 'hidden_dims': '[512, 64]', 'dropout': 0.24398740391694904, 'batch_norm': False, 'lr': 0.0007283977138280062, 'weight_decay': 8.980559422557896e-06, 'epochs': 309, 'loss': 'mae', 'optimizer': 'adam', 'graph_mode': 'knn', 'source': 'grm', 'knn_k': 1, 'weighted_edges': False, 'symmetrize_mode': 'mutual', 'use_snp_selection': True, 'num_snps': 19468}. Best is trial 53 with value: 0.12552284880403508.
[I 2025-11-03 13:24:27,631] Trial 109 finished with value: 0.09114299223955658 and parameters: {'model_type': 'gcn', 'hidden_dims': '[128, 64]', 'dropout': 0.18994556663368956, 'batch_norm': True, 'lr': 0.00046139705503281815, 'weight_decay': 1.1331823685496556e-06, 'epochs': 253, 'loss': 'mse', 'optimizer': 'adam', 'graph_mode': 'knn', 'source': 'grm', 'knn_k': 1, 'weighted_edges': True, 'symmetrize_mode': 'mutual', 'use_snp_selection': False}. Best is trial 53 with value: 0.12552284880403508.
[I 2025-11-03 13:24:29,526] Trial 110 finished with value: 0.10499554147909071 and parameters: {'model_type': 'gcn', 'hidden_dims': '[128, 64]', 'dropout': 0.2190654372467642, 'batch_norm': True, 'lr': 0.0008868470752718175, 'weight_decay': 3.4100104317377155e-06, 'epochs': 263, 'loss': 'mae', 'optimizer': 'adam', 'graph_mode': 'cutoff', 'cutoff': 0.7563140617120634, 'grm_norm': 'none', 'self_loops': True, 'use_snp_selection': False}. Best is trial 53 with value: 0.12552284880403508.
[I 2025-11-03 13:24:31,555] Trial 111 finished with value: 0.09557199310133446 and parameters: {'model_type': 'gcn', 'hidden_dims': '[128, 64]', 'dropout': 0.13179754557468035, 'batch_norm': True, 'lr': 0.0007319958376017448, 'weight_decay': 2.6120575542935998e-06, 'epochs': 282, 'loss': 'mae', 'optimizer': 'adam', 'graph_mode': 'knn', 'source': 'grm', 'knn_k': 1, 'weighted_edges': False, 'symmetrize_mode': 'mutual', 'use_snp_selection': False}. Best is trial 53 with value: 0.12552284880403508.
[I 2025-11-03 13:24:33,529] Trial 112 finished with value: 0.10174805038999617 and parameters: {'model_type': 'gcn', 'hidden_dims': '[128, 64]', 'dropout': 0.10387009111477524, 'batch_norm': True, 'lr': 0.0006085519743175841, 'weight_decay': 6.193913688659127e-06, 'epochs': 266, 'loss': 'mae', 'optimizer': 'adam', 'graph_mode': 'knn', 'source': 'grm', 'knn_k': 1, 'weighted_edges': False, 'symmetrize_mode': 'mutual', 'use_snp_selection': False}. Best is trial 53 with value: 0.12552284880403508.
[I 2025-11-03 13:24:35,579] Trial 113 finished with value: 0.0924361194236609 and parameters: {'model_type': 'gcn', 'hidden_dims': '[128, 64]', 'dropout': 0.3351017711051306, 'batch_norm': True, 'lr': 0.0007753190147494765, 'weight_decay': 2.747022803465366e-06, 'epochs': 289, 'loss': 'mae', 'optimizer': 'adam', 'graph_mode': 'knn', 'source': 'grm', 'knn_k': 1, 'weighted_edges': False, 'symmetrize_mode': 'mutual', 'use_snp_selection': False}. Best is trial 53 with value: 0.12552284880403508.
[I 2025-11-03 13:24:37,751] Trial 114 finished with value: 0.08969242335365052 and parameters: {'model_type': 'gcn', 'hidden_dims': '[128, 64]', 'dropout': 0.11572499771890497, 'batch_norm': True, 'lr': 0.0009846579417389961, 'weight_decay': 2.2070826589434926e-06, 'epochs': 322, 'loss': 'mae', 'optimizer': 'adam', 'graph_mode': 'knn', 'source': 'grm', 'knn_k': 4, 'weighted_edges': False, 'symmetrize_mode': 'mutual', 'use_snp_selection': False}. Best is trial 53 with value: 0.12552284880403508.
[I 2025-11-03 13:24:40,809] Trial 115 finished with value: 0.08567864399960194 and parameters: {'model_type': 'gcn', 'hidden_dims': '[512, 256]', 'dropout': 0.10893717896394006, 'batch_norm': True, 'lr': 0.0006411448037047064, 'weight_decay': 3.921455839417627e-06, 'epochs': 239, 'loss': 'mae', 'optimizer': 'adam', 'graph_mode': 'knn', 'source': 'grm', 'knn_k': 2, 'weighted_edges': False, 'symmetrize_mode': 'mutual', 'use_snp_selection': False}. Best is trial 53 with value: 0.12552284880403508.
[I 2025-11-03 13:24:42,755] Trial 116 finished with value: 0.09284452598534859 and parameters: {'model_type': 'gcn', 'hidden_dims': '[128, 64]', 'dropout': 0.2043886813469996, 'batch_norm': True, 'lr': 0.00022301140259042872, 'weight_decay': 1.61609158080003e-06, 'epochs': 275, 'loss': 'mae', 'optimizer': 'adam', 'graph_mode': 'knn', 'source': 'grm', 'knn_k': 1, 'weighted_edges': False, 'symmetrize_mode': 'mutual', 'use_snp_selection': False}. Best is trial 53 with value: 0.12552284880403508.
[I 2025-11-03 13:24:44,682] Trial 117 finished with value: 0.10718577247686091 and parameters: {'model_type': 'gcn', 'hidden_dims': '[128, 64]', 'dropout': 0.25558574537676904, 'batch_norm': True, 'lr': 0.0005196028044732969, 'weight_decay': 5.014670390504636e-06, 'epochs': 271, 'loss': 'mae', 'optimizer': 'adam', 'graph_mode': 'knn', 'source': 'grm', 'knn_k': 1, 'weighted_edges': False, 'symmetrize_mode': 'mutual', 'use_snp_selection': False}. Best is trial 53 with value: 0.12552284880403508.
[I 2025-11-03 13:24:46,594] Trial 118 finished with value: 0.060523579050335424 and parameters: {'model_type': 'gcn', 'hidden_dims': '[128, 64]', 'dropout': 0.13861809851737594, 'batch_norm': True, 'lr': 0.00018166525947733303, 'weight_decay': 2.9432135416887063e-06, 'epochs': 262, 'loss': 'mae', 'optimizer': 'adam', 'graph_mode': 'knn', 'source': 'grm', 'knn_k': 2, 'weighted_edges': False, 'symmetrize_mode': 'union', 'use_snp_selection': False}. Best is trial 53 with value: 0.12552284880403508.
[I 2025-11-03 13:24:49,689] Trial 119 finished with value: 0.10593946956234879 and parameters: {'model_type': 'gcn', 'hidden_dims': '[512, 128]', 'dropout': 0.27354028224721616, 'batch_norm': True, 'lr': 0.0004272549512988135, 'weight_decay': 1.8216083650774068e-06, 'epochs': 248, 'loss': 'mae', 'optimizer': 'adam', 'graph_mode': 'knn', 'source': 'grm', 'knn_k': 1, 'weighted_edges': False, 'symmetrize_mode': 'mutual', 'use_snp_selection': False}. Best is trial 53 with value: 0.12552284880403508.
[I 2025-11-03 13:24:51,692] Trial 120 finished with value: 0.05534144454922236 and parameters: {'model_type': 'gcn', 'hidden_dims': '[128, 64]', 'dropout': 0.29352242853360855, 'batch_norm': True, 'lr': 4.1147880781944115e-05, 'weight_decay': 1.299859242110507e-06, 'epochs': 293, 'loss': 'mae', 'optimizer': 'adam', 'graph_mode': 'knn', 'source': 'grm', 'knn_k': 1, 'weighted_edges': False, 'symmetrize_mode': 'mutual', 'use_snp_selection': False}. Best is trial 53 with value: 0.12552284880403508.
[I 2025-11-03 13:24:53,616] Trial 121 finished with value: 0.11235755931529076 and parameters: {'model_type': 'gcn', 'hidden_dims': '[128, 64]', 'dropout': 0.1815172386894191, 'batch_norm': True, 'lr': 0.0007687028725077777, 'weight_decay': 4.69892245643877e-06, 'epochs': 266, 'loss': 'mae', 'optimizer': 'adam', 'graph_mode': 'knn', 'source': 'grm', 'knn_k': 1, 'weighted_edges': False, 'symmetrize_mode': 'mutual', 'use_snp_selection': False}. Best is trial 53 with value: 0.12552284880403508.
[I 2025-11-03 13:24:55,514] Trial 122 finished with value: 0.106473961138437 and parameters: {'model_type': 'gcn', 'hidden_dims': '[128, 64]', 'dropout': 0.16661604808883512, 'batch_norm': True, 'lr': 0.0007696179876821734, 'weight_decay': 7.6090497608154085e-06, 'epochs': 259, 'loss': 'mae', 'optimizer': 'adam', 'graph_mode': 'knn', 'source': 'grm', 'knn_k': 1, 'weighted_edges': False, 'symmetrize_mode': 'mutual', 'use_snp_selection': False}. Best is trial 53 with value: 0.12552284880403508.
[I 2025-11-03 13:24:57,491] Trial 123 finished with value: 0.11849748355911781 and parameters: {'model_type': 'gcn', 'hidden_dims': '[128, 64]', 'dropout': 0.1493373172248004, 'batch_norm': True, 'lr': 0.0008757748252019778, 'weight_decay': 2.2062626327886312e-06, 'epochs': 284, 'loss': 'mae', 'optimizer': 'adam', 'graph_mode': 'knn', 'source': 'grm', 'knn_k': 1, 'weighted_edges': False, 'symmetrize_mode': 'mutual', 'use_snp_selection': False}. Best is trial 53 with value: 0.12552284880403508.
[I 2025-11-03 13:24:59,472] Trial 124 finished with value: 0.08748840038797184 and parameters: {'model_type': 'gcn', 'hidden_dims': '[128, 64]', 'dropout': 0.15216720709720943, 'batch_norm': True, 'lr': 0.0008975908363393532, 'weight_decay': 2.483282825068801e-06, 'epochs': 283, 'loss': 'mae', 'optimizer': 'adam', 'graph_mode': 'knn', 'source': 'grm', 'knn_k': 2, 'weighted_edges': False, 'symmetrize_mode': 'mutual', 'use_snp_selection': False}. Best is trial 53 with value: 0.12552284880403508.
[I 2025-11-03 13:25:01,564] Trial 125 finished with value: 0.03382597044114885 and parameters: {'model_type': 'gcn', 'hidden_dims': '[128, 64]', 'dropout': 0.11855726354215339, 'batch_norm': True, 'lr': 0.0005971173860901077, 'weight_decay': 7.953529013461512e-07, 'epochs': 306, 'loss': 'mae', 'optimizer': 'adam', 'graph_mode': 'knn', 'source': 'grm', 'knn_k': 7, 'weighted_edges': False, 'symmetrize_mode': 'mutual', 'use_snp_selection': False}. Best is trial 53 with value: 0.12552284880403508.
[I 2025-11-03 13:25:04,083] Trial 126 finished with value: 0.11489332239395443 and parameters: {'model_type': 'gcn', 'hidden_dims': '[256, 128]', 'dropout': 0.19453026856783448, 'batch_norm': True, 'lr': 0.0006686508964320353, 'weight_decay': 2.1613670805015127e-06, 'epochs': 288, 'loss': 'mae', 'optimizer': 'adam', 'graph_mode': 'knn', 'source': 'grm', 'knn_k': 1, 'weighted_edges': False, 'symmetrize_mode': 'mutual', 'use_snp_selection': False}. Best is trial 53 with value: 0.12552284880403508.
[I 2025-11-03 13:25:07,328] Trial 127 finished with value: 0.09988479234235918 and parameters: {'model_type': 'gcn', 'hidden_dims': '[256, 128]', 'dropout': 0.19097950854988094, 'batch_norm': False, 'lr': 0.0006690134170411549, 'weight_decay': 2.0737802461223824e-06, 'epochs': 275, 'loss': 'mae', 'optimizer': 'adam', 'graph_mode': 'knn', 'source': 'grm', 'knn_k': 1, 'weighted_edges': False, 'symmetrize_mode': 'mutual', 'use_snp_selection': True, 'num_snps': 36747}. Best is trial 53 with value: 0.12552284880403508.
[I 2025-11-03 13:25:09,902] Trial 128 finished with value: 0.11025681259969258 and parameters: {'model_type': 'gcn', 'hidden_dims': '[256, 128]', 'dropout': 0.20963996633051601, 'batch_norm': True, 'lr': 0.0009933180490419252, 'weight_decay': 1.493717414063746e-06, 'epochs': 290, 'loss': 'mae', 'optimizer': 'adam', 'graph_mode': 'knn', 'source': 'grm', 'knn_k': 1, 'weighted_edges': False, 'symmetrize_mode': 'mutual', 'use_snp_selection': False}. Best is trial 53 with value: 0.12552284880403508.
[I 2025-11-03 13:25:12,459] Trial 129 finished with value: 0.09441039417111635 and parameters: {'model_type': 'gcn', 'hidden_dims': '[256, 128]', 'dropout': 0.1785391378047334, 'batch_norm': True, 'lr': 0.0004922721860299222, 'weight_decay': 1.673092979925858e-05, 'epochs': 299, 'loss': 'mse', 'optimizer': 'adam', 'graph_mode': 'knn', 'source': 'grm', 'knn_k': 2, 'weighted_edges': True, 'symmetrize_mode': 'mutual', 'use_snp_selection': False}. Best is trial 53 with value: 0.12552284880403508.
[I 2025-11-03 13:25:15,387] Trial 130 finished with value: 0.11100481773909854 and parameters: {'model_type': 'gcn', 'hidden_dims': '[256, 128, 64]', 'dropout': 0.23279202684736977, 'batch_norm': True, 'lr': 0.0008586163599412165, 'weight_decay': 9.77529556069936e-07, 'epochs': 317, 'loss': 'mae', 'optimizer': 'adam', 'graph_mode': 'cutoff', 'cutoff': 0.8218876712286414, 'grm_norm': 'cosine_then_gcn', 'self_loops': False, 'use_snp_selection': False}. Best is trial 53 with value: 0.12552284880403508.
[I 2025-11-03 13:25:17,062] Trial 131 finished with value: 0.10568505449997533 and parameters: {'model_type': 'gcn', 'hidden_dims': '[128, 64]', 'dropout': 0.2632522211779718, 'batch_norm': True, 'lr': 0.0006853459620053565, 'weight_decay': 3.1239062577177664e-06, 'epochs': 184, 'loss': 'mae', 'optimizer': 'adam', 'graph_mode': 'knn', 'source': 'grm', 'knn_k': 1, 'weighted_edges': False, 'symmetrize_mode': 'mutual', 'use_snp_selection': False}. Best is trial 53 with value: 0.12552284880403508.
[I 2025-11-03 13:25:19,469] Trial 132 finished with value: 0.113708423755088 and parameters: {'model_type': 'gcn', 'hidden_dims': '[256, 128]', 'dropout': 0.10033809424485123, 'batch_norm': True, 'lr': 0.0005559272371548178, 'weight_decay': 1.881041042476749e-06, 'epochs': 256, 'loss': 'mae', 'optimizer': 'adam', 'graph_mode': 'knn', 'source': 'grm', 'knn_k': 1, 'weighted_edges': False, 'symmetrize_mode': 'mutual', 'use_snp_selection': False}. Best is trial 53 with value: 0.12552284880403508.
[I 2025-11-03 13:25:21,862] Trial 133 finished with value: 0.10374275324933646 and parameters: {'model_type': 'gcn', 'hidden_dims': '[256, 128]', 'dropout': 0.1712306898428064, 'batch_norm': True, 'lr': 0.0005815599076753109, 'weight_decay': 1.7398196624314138e-06, 'epochs': 253, 'loss': 'mae', 'optimizer': 'adam', 'graph_mode': 'knn', 'source': 'grm', 'knn_k': 1, 'weighted_edges': False, 'symmetrize_mode': 'mutual', 'use_snp_selection': False}. Best is trial 53 with value: 0.12552284880403508.
[I 2025-11-03 13:25:24,415] Trial 134 finished with value: 0.1053153963195013 and parameters: {'model_type': 'gcn', 'hidden_dims': '[256, 128]', 'dropout': 0.14353354127675752, 'batch_norm': True, 'lr': 0.0003542845711450932, 'weight_decay': 1.2035790533330086e-06, 'epochs': 285, 'loss': 'mae', 'optimizer': 'adam', 'graph_mode': 'knn', 'source': 'grm', 'knn_k': 1, 'weighted_edges': False, 'symmetrize_mode': 'mutual', 'use_snp_selection': False}. Best is trial 53 with value: 0.12552284880403508.
[I 2025-11-03 13:25:26,778] Trial 135 finished with value: 0.10866007017931431 and parameters: {'model_type': 'gcn', 'hidden_dims': '[256, 128]', 'dropout': 0.2249791200939538, 'batch_norm': True, 'lr': 0.0002754460494708901, 'weight_decay': 1.9884651461218695e-06, 'epochs': 246, 'loss': 'mae', 'optimizer': 'adam', 'graph_mode': 'knn', 'source': 'grm', 'knn_k': 1, 'weighted_edges': False, 'symmetrize_mode': 'mutual', 'use_snp_selection': False}. Best is trial 53 with value: 0.12552284880403508.
[I 2025-11-03 13:25:29,300] Trial 136 finished with value: 0.12546232902160054 and parameters: {'model_type': 'gcn', 'hidden_dims': '[256, 128]', 'dropout': 0.34979464288607276, 'batch_norm': True, 'lr': 0.0004097032420679704, 'weight_decay': 3.514717657483173e-06, 'epochs': 279, 'loss': 'mae', 'optimizer': 'adam', 'graph_mode': 'knn', 'source': 'grm', 'knn_k': 1, 'weighted_edges': False, 'symmetrize_mode': 'mutual', 'use_snp_selection': False}. Best is trial 53 with value: 0.12552284880403508.
