[I 2025-11-03 13:22:30,283] Trial 126 finished with value: 0.06288579877830032 and parameters: {'model_type': 'graphsage', 'hidden_dims': '[256, 128]', 'dropout': 0.5174167865593691, 'batch_norm': True, 'lr': 5.8892045072886095e-05, 'weight_decay': 0.0005358192319312446, 'epochs': 241, 'loss': 'mse', 'optimizer': 'adam', 'graph_mode': 'knn', 'source': 'grm', 'knn_k': 6, 'weighted_edges': True, 'symmetrize_mode': 'mutual', 'use_snp_selection': False}. Best is trial 75 with value: 0.1225689324935553.
[I 2025-11-03 13:22:34,261] Trial 127 finished with value: 0.0681539347058307 and parameters: {'model_type': 'graphsage', 'hidden_dims': '[512, 256]', 'dropout': 0.23404786901295918, 'batch_norm': True, 'lr': 7.202034189272694e-05, 'weight_decay': 0.0007372936658736455, 'epochs': 223, 'loss': 'mae', 'optimizer': 'adam', 'graph_mode': 'knn', 'source': 'grm', 'knn_k': 1, 'weighted_edges': False, 'symmetrize_mode': 'union', 'use_snp_selection': False}. Best is trial 75 with value: 0.1225689324935553.
[I 2025-11-03 13:22:36,920] Trial 128 finished with value: 0.058752785561682425 and parameters: {'model_type': 'graphsage', 'hidden_dims': '[512, 64]', 'dropout': 0.3133762791244291, 'batch_norm': True, 'lr': 0.00017243458013872505, 'weight_decay': 0.0004712761540795059, 'epochs': 63, 'loss': 'mse', 'optimizer': 'adam', 'graph_mode': 'knn', 'source': 'grm', 'knn_k': 1, 'weighted_edges': False, 'symmetrize_mode': 'union', 'use_snp_selection': False}. Best is trial 75 with value: 0.1225689324935553.
[I 2025-11-03 13:22:39,663] Trial 129 finished with value: 0.06958344193450107 and parameters: {'model_type': 'graphsage', 'hidden_dims': '[256, 128]', 'dropout': 0.10186690068297088, 'batch_norm': True, 'lr': 0.0003410671902691493, 'weight_decay': 0.00013830271717157292, 'epochs': 268, 'loss': 'mae', 'optimizer': 'adam', 'graph_mode': 'knn', 'source': 'grm', 'knn_k': 2, 'weighted_edges': True, 'symmetrize_mode': 'mutual', 'use_snp_selection': False}. Best is trial 75 with value: 0.1225689324935553.
[I 2025-11-03 13:22:42,520] Trial 130 finished with value: 0.0682433515258715 and parameters: {'model_type': 'graphsage', 'hidden_dims': '[256, 128, 64]', 'dropout': 0.29116983575942773, 'batch_norm': True, 'lr': 0.0005402194719131729, 'weight_decay': 1.0474595552824572e-06, 'epochs': 251, 'loss': 'mse', 'optimizer': 'adam', 'graph_mode': 'knn', 'source': 'grm', 'knn_k': 3, 'weighted_edges': False, 'symmetrize_mode': 'union', 'use_snp_selection': False}. Best is trial 75 with value: 0.1225689324935553.
[I 2025-11-03 13:22:45,251] Trial 131 finished with value: 0.08919587577224407 and parameters: {'model_type': 'graphsage', 'hidden_dims': '[256, 128]', 'dropout': 0.35823352205494147, 'batch_norm': True, 'lr': 0.0007072125145842769, 'weight_decay': 0.00034793544297962115, 'epochs': 274, 'loss': 'mse', 'optimizer': 'adam', 'graph_mode': 'knn', 'source': 'grm', 'knn_k': 1, 'weighted_edges': False, 'symmetrize_mode': 'mutual', 'use_snp_selection': False}. Best is trial 75 with value: 0.1225689324935553.
[I 2025-11-03 13:22:48,057] Trial 132 finished with value: 0.08887773793851145 and parameters: {'model_type': 'graphsage', 'hidden_dims': '[256, 128]', 'dropout': 0.32425292208411244, 'batch_norm': True, 'lr': 0.0004368364441460691, 'weight_decay': 0.0002163168807056232, 'epochs': 291, 'loss': 'mse', 'optimizer': 'adam', 'graph_mode': 'knn', 'source': 'grm', 'knn_k': 1, 'weighted_edges': False, 'symmetrize_mode': 'mutual', 'use_snp_selection': False}. Best is trial 75 with value: 0.1225689324935553.
[I 2025-11-03 13:22:50,710] Trial 133 finished with value: 0.023819172036002992 and parameters: {'model_type': 'graphsage', 'hidden_dims': '[256, 128]', 'dropout': 0.3715210797752925, 'batch_norm': True, 'lr': 1.2386501240365834e-06, 'weight_decay': 0.0003905436365414283, 'epochs': 256, 'loss': 'mse', 'optimizer': 'adam', 'graph_mode': 'knn', 'source': 'grm', 'knn_k': 1, 'weighted_edges': False, 'symmetrize_mode': 'mutual', 'use_snp_selection': False}. Best is trial 75 with value: 0.1225689324935553.
[I 2025-11-03 13:22:53,472] Trial 134 finished with value: 0.0857645252909551 and parameters: {'model_type': 'graphsage', 'hidden_dims': '[256, 128]', 'dropout': 0.41332395026890967, 'batch_norm': True, 'lr': 0.0002498514163820843, 'weight_decay': 0.0002785575028192539, 'epochs': 281, 'loss': 'mse', 'optimizer': 'adam', 'graph_mode': 'knn', 'source': 'grm', 'knn_k': 1, 'weighted_edges': False, 'symmetrize_mode': 'mutual', 'use_snp_selection': False}. Best is trial 75 with value: 0.1225689324935553.
[I 2025-11-03 13:22:56,149] Trial 135 finished with value: 0.01976722834272399 and parameters: {'model_type': 'graphsage', 'hidden_dims': '[256, 128]', 'dropout': 0.39159316375701514, 'batch_norm': False, 'lr': 0.0003872159512382543, 'weight_decay': 0.0001853157684863925, 'epochs': 266, 'loss': 'mse', 'optimizer': 'adam', 'graph_mode': 'knn', 'source': 'grm', 'knn_k': 1, 'weighted_edges': False, 'symmetrize_mode': 'mutual', 'use_snp_selection': False}. Best is trial 75 with value: 0.1225689324935553.
[I 2025-11-03 13:22:59,028] Trial 136 finished with value: 0.09070879919988542 and parameters: {'model_type': 'graphsage', 'hidden_dims': '[512, 128]', 'dropout': 0.3402258802105046, 'batch_norm': True, 'lr': 0.00010578010971078784, 'weight_decay': 0.000608931682141544, 'epochs': 259, 'loss': 'mae', 'optimizer': 'adam', 'graph_mode': 'cutoff', 'cutoff': 0.2036362039131785, 'grm_norm': 'cosine', 'self_loops': True, 'use_snp_selection': True, 'num_snps': 19682}. Best is trial 75 with value: 0.1225689324935553.
[I 2025-11-03 13:23:01,913] Trial 137 finished with value: 0.07405705600842255 and parameters: {'model_type': 'graphsage', 'hidden_dims': '[512, 128]', 'dropout': 0.33895691901761427, 'batch_norm': True, 'lr': 0.00010414848490284212, 'weight_decay': 0.0006441964721167352, 'epochs': 246, 'loss': 'mae', 'optimizer': 'adam', 'graph_mode': 'cutoff', 'cutoff': 0.3903588266393221, 'grm_norm': 'cosine', 'self_loops': True, 'use_snp_selection': True, 'num_snps': 20905}. Best is trial 75 with value: 0.1225689324935553.
[I 2025-11-03 13:23:04,484] Trial 138 finished with value: 0.05692989166739119 and parameters: {'model_type': 'graphsage', 'hidden_dims': '[512, 128]', 'dropout': 0.3039870625391776, 'batch_norm': True, 'lr': 0.00015282698785580763, 'weight_decay': 0.0008917952119424763, 'epochs': 234, 'loss': 'mae', 'optimizer': 'adam', 'graph_mode': 'cutoff', 'cutoff': 0.2520538723075082, 'grm_norm': 'cosine', 'self_loops': True, 'use_snp_selection': True, 'num_snps': 15254}. Best is trial 75 with value: 0.1225689324935553.
[I 2025-11-03 13:23:06,852] Trial 139 finished with value: 0.06651231436188153 and parameters: {'model_type': 'graphsage', 'hidden_dims': '[512, 128]', 'dropout': 0.331671091416677, 'batch_norm': True, 'lr': 8.675524274860462e-05, 'weight_decay': 0.0004701354492533799, 'epochs': 261, 'loss': 'mae', 'optimizer': 'adam', 'graph_mode': 'cutoff', 'cutoff': 0.2565574063648891, 'grm_norm': 'cosine', 'self_loops': True, 'use_snp_selection': True, 'num_snps': 8852}. Best is trial 75 with value: 0.1225689324935553.
[I 2025-11-03 13:23:09,852] Trial 140 finished with value: 0.07439551463089561 and parameters: {'model_type': 'graphsage', 'hidden_dims': '[512, 128]', 'dropout': 0.48660545147764805, 'batch_norm': True, 'lr': 0.00019386355876154304, 'weight_decay': 0.0003097049709275076, 'epochs': 257, 'loss': 'mae', 'optimizer': 'adam', 'graph_mode': 'cutoff', 'cutoff': 0.4049792217993434, 'grm_norm': 'cosine', 'self_loops': True, 'use_snp_selection': True, 'num_snps': 23428}. Best is trial 75 with value: 0.1225689324935553.
[I 2025-11-03 13:23:12,712] Trial 141 finished with value: 0.08929521104214287 and parameters: {'model_type': 'graphsage', 'hidden_dims': '[512, 256]', 'dropout': 0.43817585403744264, 'batch_norm': True, 'lr': 0.00012947151971641217, 'weight_decay': 0.000422673162592766, 'epochs': 274, 'loss': 'mae', 'optimizer': 'adam', 'graph_mode': 'cutoff', 'cutoff': 0.5288826533069608, 'grm_norm': 'cosine', 'self_loops': True, 'use_snp_selection': True, 'num_snps': 18753}. Best is trial 75 with value: 0.1225689324935553.
[I 2025-11-03 13:23:15,379] Trial 142 finished with value: 0.08371573233142691 and parameters: {'model_type': 'graphsage', 'hidden_dims': '[256, 128]', 'dropout': 0.3563396189593405, 'batch_norm': True, 'lr': 0.0006388238180743727, 'weight_decay': 0.000560988398759724, 'epochs': 247, 'loss': 'mae', 'optimizer': 'adam', 'graph_mode': 'knn', 'source': 'grm', 'knn_k': 2, 'weighted_edges': False, 'symmetrize_mode': 'mutual', 'use_snp_selection': False}. Best is trial 75 with value: 0.1225689324935553.
[I 2025-11-03 13:23:17,683] Trial 143 finished with value: 0.08172616110488747 and parameters: {'model_type': 'graphsage', 'hidden_dims': '[128, 64]', 'dropout': 0.31387087027283755, 'batch_norm': True, 'lr': 0.0005263698245364821, 'weight_decay': 0.000749516694637817, 'epochs': 301, 'loss': 'mse', 'optimizer': 'adam', 'graph_mode': 'knn', 'source': 'grm', 'knn_k': 1, 'weighted_edges': True, 'symmetrize_mode': 'union', 'use_snp_selection': False}. Best is trial 75 with value: 0.1225689324935553.
[I 2025-11-03 13:23:20,914] Trial 144 finished with value: 0.09183518429827386 and parameters: {'model_type': 'graphsage', 'hidden_dims': '[512, 128]', 'dropout': 0.34143715301671923, 'batch_norm': True, 'lr': 0.0009172868743125038, 'weight_decay': 0.0002398473220126983, 'epochs': 267, 'loss': 'mae', 'optimizer': 'adam', 'graph_mode': 'knn', 'source': 'grm', 'knn_k': 2, 'weighted_edges': False, 'symmetrize_mode': 'union', 'use_snp_selection': True, 'num_snps': 26482}. Best is trial 75 with value: 0.1225689324935553.
[I 2025-11-03 13:23:24,228] Trial 145 finished with value: 0.09109276855821213 and parameters: {'model_type': 'graphsage', 'hidden_dims': '[512, 128]', 'dropout': 0.34641757558635755, 'batch_norm': True, 'lr': 0.0009611744311181547, 'weight_decay': 7.079556381774983e-05, 'epochs': 252, 'loss': 'mae', 'optimizer': 'adam', 'graph_mode': 'knn', 'source': 'grm', 'knn_k': 2, 'weighted_edges': False, 'symmetrize_mode': 'union', 'use_snp_selection': True, 'num_snps': 26685}. Best is trial 75 with value: 0.1225689324935553.
[I 2025-11-03 13:23:27,420] Trial 146 finished with value: 0.10022084060130183 and parameters: {'model_type': 'graphsage', 'hidden_dims': '[512, 128]', 'dropout': 0.3788213841778142, 'batch_norm': True, 'lr': 0.0009785676245589658, 'weight_decay': 9.525486433561517e-05, 'epochs': 240, 'loss': 'mae', 'optimizer': 'adam', 'graph_mode': 'knn', 'source': 'grm', 'knn_k': 2, 'weighted_edges': False, 'symmetrize_mode': 'union', 'use_snp_selection': True, 'num_snps': 25954}. Best is trial 75 with value: 0.1225689324935553.
[I 2025-11-03 13:23:30,709] Trial 147 finished with value: 0.08128508202348567 and parameters: {'model_type': 'graphsage', 'hidden_dims': '[512, 128]', 'dropout': 0.37849459816198733, 'batch_norm': True, 'lr': 0.0009770968014786636, 'weight_decay': 6.924769512492837e-05, 'epochs': 241, 'loss': 'mae', 'optimizer': 'adam', 'graph_mode': 'knn', 'source': 'grm', 'knn_k': 2, 'weighted_edges': False, 'symmetrize_mode': 'union', 'use_snp_selection': True, 'num_snps': 27283}. Best is trial 75 with value: 0.1225689324935553.
[I 2025-11-03 13:23:34,568] Trial 148 finished with value: 0.1030375380925695 and parameters: {'model_type': 'graphsage', 'hidden_dims': '[512, 128]', 'dropout': 0.3496659648171313, 'batch_norm': True, 'lr': 0.0008297336397915274, 'weight_decay': 9.21860200859175e-05, 'epochs': 267, 'loss': 'mae', 'optimizer': 'adam', 'graph_mode': 'knn', 'source': 'grm', 'knn_k': 2, 'weighted_edges': False, 'symmetrize_mode': 'union', 'use_snp_selection': True, 'num_snps': 33033}. Best is trial 75 with value: 0.1225689324935553.
[I 2025-11-03 13:23:38,355] Trial 149 finished with value: 0.06288224958299245 and parameters: {'model_type': 'graphsage', 'hidden_dims': '[512, 128]', 'dropout': 0.35848608509390806, 'batch_norm': False, 'lr': 0.0007616353390591899, 'weight_decay': 0.0001586735023743956, 'epochs': 269, 'loss': 'mae', 'optimizer': 'adam', 'graph_mode': 'knn', 'source': 'grm', 'knn_k': 2, 'weighted_edges': False, 'symmetrize_mode': 'union', 'use_snp_selection': True, 'num_snps': 32456}. Best is trial 75 with value: 0.1225689324935553.
[I 2025-11-03 13:23:40,864] Trial 0 finished with value: -0.03374551258064998 and parameters: {'model_type': 'graphsage', 'hidden_dims': '[128, 64]', 'dropout': 0.199031432379812, 'batch_norm': True, 'lr': 1.8408544111075837e-06, 'weight_decay': 5.5136510071208614e-05, 'epochs': 336, 'loss': 'mae', 'optimizer': 'adam', 'graph_mode': 'knn', 'source': 'grm', 'knn_k': 8, 'weighted_edges': True, 'symmetrize_mode': 'mutual', 'use_snp_selection': False}. Best is trial 0 with value: -0.03374551258064998.
[I 2025-11-03 13:23:42,411] Trial 1 finished with value: 0.0434460513516787 and parameters: {'model_type': 'graphsage', 'hidden_dims': '[128, 64]', 'dropout': 0.40051947670227217, 'batch_norm': True, 'lr': 0.0005320428882732732, 'weight_decay': 1.89210117736594e-06, 'epochs': 68, 'loss': 'mse', 'optimizer': 'adam', 'graph_mode': 'knn', 'source': 'grm', 'knn_k': 7, 'weighted_edges': True, 'symmetrize_mode': 'union', 'use_snp_selection': False}. Best is trial 1 with value: 0.0434460513516787.
[I 2025-11-03 13:23:44,939] Trial 2 finished with value: 0.0073033213160325254 and parameters: {'model_type': 'graphsage', 'hidden_dims': '[256, 128]', 'dropout': 0.5105528289184642, 'batch_norm': False, 'lr': 0.0006804279372404962, 'weight_decay': 0.0008922815224257085, 'epochs': 181, 'loss': 'mse', 'optimizer': 'adam', 'graph_mode': 'cutoff', 'cutoff': 0.5741905641612706, 'grm_norm': 'gcn', 'self_loops': False, 'use_snp_selection': True, 'num_snps': 26910}. Best is trial 1 with value: 0.0434460513516787.
[I 2025-11-03 13:23:47,657] Trial 3 finished with value: -0.008272586373019078 and parameters: {'model_type': 'graphsage', 'hidden_dims': '[256, 128, 64]', 'dropout': 0.5390483213624292, 'batch_norm': False, 'lr': 3.4705625989073525e-05, 'weight_decay': 2.4623319020131338e-05, 'epochs': 121, 'loss': 'mse', 'optimizer': 'adam', 'graph_mode': 'knn', 'source': 'grm', 'knn_k': 6, 'weighted_edges': False, 'symmetrize_mode': 'mutual', 'use_snp_selection': True, 'num_snps': 30713}. Best is trial 1 with value: 0.0434460513516787.
[I 2025-11-03 13:23:50,324] Trial 4 finished with value: -0.001123279853929851 and parameters: {'model_type': 'graphsage', 'hidden_dims': '[128, 64]', 'dropout': 0.13404863676897502, 'batch_norm': False, 'lr': 0.0001431556295367288, 'weight_decay': 2.2084517750726675e-05, 'epochs': 51, 'loss': 'mae', 'optimizer': 'adam', 'graph_mode': 'cutoff', 'cutoff': 0.6714268476993044, 'grm_norm': 'none', 'self_loops': False, 'use_snp_selection': True, 'num_snps': 45645}. Best is trial 1 with value: 0.0434460513516787.
[I 2025-11-03 13:23:53,561] Trial 5 finished with value: 0.018502694216119504 and parameters: {'model_type': 'graphsage', 'hidden_dims': '[256, 128]', 'dropout': 0.42253606323412096, 'batch_norm': False, 'lr': 4.238630400638805e-05, 'weight_decay': 8.074086040046576e-07, 'epochs': 158, 'loss': 'mae', 'optimizer': 'adam', 'graph_mode': 'knn', 'source': 'grm', 'knn_k': 1, 'weighted_edges': False, 'symmetrize_mode': 'mutual', 'use_snp_selection': True, 'num_snps': 43113}. Best is trial 1 with value: 0.0434460513516787.
[I 2025-11-03 13:23:57,472] Trial 6 finished with value: 0.04271293247733442 and parameters: {'model_type': 'graphsage', 'hidden_dims': '[512, 256]', 'dropout': 0.3534893146320237, 'batch_norm': True, 'lr': 0.000251307964226932, 'weight_decay': 1.821819791794022e-05, 'epochs': 223, 'loss': 'mae', 'optimizer': 'adam', 'graph_mode': 'knn', 'source': 'grm', 'knn_k': 1, 'weighted_edges': True, 'symmetrize_mode': 'mutual', 'use_snp_selection': False}. Best is trial 1 with value: 0.0434460513516787.
[I 2025-11-03 13:24:01,032] Trial 7 finished with value: 0.01171626088038389 and parameters: {'model_type': 'graphsage', 'hidden_dims': '[512, 256]', 'dropout': 0.1105825955860775, 'batch_norm': True, 'lr': 2.374338412754043e-05, 'weight_decay': 1.1284721123340274e-05, 'epochs': 190, 'loss': 'mse', 'optimizer': 'adam', 'graph_mode': 'cutoff', 'cutoff': 0.719872204109604, 'grm_norm': 'gcn', 'self_loops': False, 'use_snp_selection': False}. Best is trial 1 with value: 0.0434460513516787.
[I 2025-11-03 13:24:04,331] Trial 8 finished with value: 0.042299646161397225 and parameters: {'model_type': 'graphsage', 'hidden_dims': '[512, 128]', 'dropout': 0.5066580418354021, 'batch_norm': True, 'lr': 0.00039213678276659976, 'weight_decay': 3.43655320802934e-06, 'epochs': 120, 'loss': 'mse', 'optimizer': 'adam', 'graph_mode': 'cutoff', 'cutoff': 0.34923059576505366, 'grm_norm': 'cosine', 'self_loops': True, 'use_snp_selection': False}. Best is trial 1 with value: 0.0434460513516787.
[I 2025-11-03 13:24:06,404] Trial 9 finished with value: -0.008551824248022255 and parameters: {'model_type': 'graphsage', 'hidden_dims': '[512, 256]', 'dropout': 0.301734920240333, 'batch_norm': False, 'lr': 6.650961854953448e-06, 'weight_decay': 6.861575656590315e-05, 'epochs': 150, 'loss': 'mae', 'optimizer': 'adam', 'graph_mode': 'cutoff', 'cutoff': 0.2857569870061939, 'grm_norm': 'cosine_then_gcn', 'self_loops': False, 'use_snp_selection': True, 'num_snps': 12722}. Best is trial 1 with value: 0.0434460513516787.
[I 2025-11-03 13:24:09,046] Trial 10 finished with value: 0.039660039557895314 and parameters: {'model_type': 'graphsage', 'hidden_dims': '[512, 64]', 'dropout': 0.2923745636750988, 'batch_norm': True, 'lr': 0.00010001966977255833, 'weight_decay': 1.2618827301366646e-07, 'epochs': 41, 'loss': 'mse', 'optimizer': 'adam', 'graph_mode': 'knn', 'source': 'grm', 'knn_k': 10, 'weighted_edges': True, 'symmetrize_mode': 'union', 'use_snp_selection': False}. Best is trial 1 with value: 0.0434460513516787.
[I 2025-11-03 13:24:13,388] Trial 11 finished with value: 0.07129118959427481 and parameters: {'model_type': 'graphsage', 'hidden_dims': '[512, 256]', 'dropout': 0.3719635790172371, 'batch_norm': True, 'lr': 0.000791308626346835, 'weight_decay': 1.8187594072837697e-06, 'epochs': 269, 'loss': 'mae', 'optimizer': 'adam', 'graph_mode': 'knn', 'source': 'grm', 'knn_k': 1, 'weighted_edges': True, 'symmetrize_mode': 'union', 'use_snp_selection': False}. Best is trial 11 with value: 0.07129118959427481.
[I 2025-11-03 13:24:15,648] Trial 12 finished with value: 0.04454351960714915 and parameters: {'model_type': 'graphsage', 'hidden_dims': '[128, 64]', 'dropout': 0.4114983712460624, 'batch_norm': True, 'lr': 0.0005914978871227773, 'weight_decay': 1.5741178562840553e-06, 'epochs': 278, 'loss': 'mse', 'optimizer': 'adam', 'graph_mode': 'knn', 'source': 'grm', 'knn_k': 4, 'weighted_edges': True, 'symmetrize_mode': 'union', 'use_snp_selection': False}. Best is trial 11 with value: 0.07129118959427481.
[I 2025-11-03 13:24:20,205] Trial 13 finished with value: 0.0757744699208202 and parameters: {'model_type': 'graphsage', 'hidden_dims': '[512, 64]', 'dropout': 0.44423422221137054, 'batch_norm': True, 'lr': 0.0009925104274780495, 'weight_decay': 2.988812407507651e-07, 'epochs': 277, 'loss': 'mae', 'optimizer': 'adam', 'graph_mode': 'knn', 'source': 'grm', 'knn_k': 3, 'weighted_edges': True, 'symmetrize_mode': 'union', 'use_snp_selection': False}. Best is trial 13 with value: 0.0757744699208202.
[I 2025-11-03 13:24:24,536] Trial 14 finished with value: 0.07453339211420627 and parameters: {'model_type': 'graphsage', 'hidden_dims': '[512, 64]', 'dropout': 0.47521485302291866, 'batch_norm': True, 'lr': 0.00087719484653171, 'weight_decay': 1.2989685499381173e-07, 'epochs': 258, 'loss': 'mae', 'optimizer': 'adam', 'graph_mode': 'knn', 'source': 'grm', 'knn_k': 3, 'weighted_edges': True, 'symmetrize_mode': 'union', 'use_snp_selection': False}. Best is trial 13 with value: 0.0757744699208202.
[I 2025-11-03 13:24:29,695] Trial 15 finished with value: 0.059860895858456616 and parameters: {'model_type': 'graphsage', 'hidden_dims': '[512, 64]', 'dropout': 0.5982861018683392, 'batch_norm': True, 'lr': 0.00013430849147500002, 'weight_decay': 1.3107791335304096e-07, 'epochs': 342, 'loss': 'mae', 'optimizer': 'adam', 'graph_mode': 'knn', 'source': 'grm', 'knn_k': 4, 'weighted_edges': True, 'symmetrize_mode': 'union', 'use_snp_selection': False}. Best is trial 13 with value: 0.0757744699208202.
[I 2025-11-03 13:24:33,938] Trial 16 finished with value: 0.06618063495064758 and parameters: {'model_type': 'graphsage', 'hidden_dims': '[512, 64]', 'dropout': 0.4664186972232017, 'batch_norm': True, 'lr': 0.00024549718616224947, 'weight_decay': 3.939158144371285e-07, 'epochs': 248, 'loss': 'mae', 'optimizer': 'adam', 'graph_mode': 'knn', 'source': 'grm', 'knn_k': 3, 'weighted_edges': False, 'symmetrize_mode': 'union', 'use_snp_selection': False}. Best is trial 13 with value: 0.0757744699208202.
[I 2025-11-03 13:24:38,683] Trial 17 finished with value: 0.04614994053369182 and parameters: {'model_type': 'graphsage', 'hidden_dims': '[512, 64]', 'dropout': 0.46107817922956246, 'batch_norm': True, 'lr': 7.881627024579695e-06, 'weight_decay': 3.5784207547012366e-07, 'epochs': 305, 'loss': 'mae', 'optimizer': 'adam', 'graph_mode': 'knn', 'source': 'grm', 'knn_k': 3, 'weighted_edges': True, 'symmetrize_mode': 'union', 'use_snp_selection': False}. Best is trial 13 with value: 0.0757744699208202.
[I 2025-11-03 13:24:42,797] Trial 18 finished with value: 0.06683503952917708 and parameters: {'model_type': 'graphsage', 'hidden_dims': '[512, 64]', 'dropout': 0.5852162980061596, 'batch_norm': True, 'lr': 0.0009796863677650923, 'weight_decay': 3.293863322548928e-07, 'epochs': 233, 'loss': 'mae', 'optimizer': 'adam', 'graph_mode': 'knn', 'source': 'grm', 'knn_k': 3, 'weighted_edges': True, 'symmetrize_mode': 'union', 'use_snp_selection': False}. Best is trial 13 with value: 0.0757744699208202.
