[I 2025-11-03 11:50:52,866] Trial 131 finished with value: 0.10912180431706524 and parameters: {'model_type': 'graphsage', 'hidden_dims': '[512, 256]', 'dropout': 0.23920297525726372, 'batch_norm': True, 'lr': 0.00037854121399315694, 'weight_decay': 3.563584263411632e-06, 'epochs': 215, 'loss': 'mse', 'optimizer': 'adam', 'graph_mode': 'cutoff', 'cutoff': 0.6673018004028128, 'grm_norm': 'none', 'self_loops': True, 'use_snp_selection': False}. Best is trial 95 with value: 0.12915900749773812.
[I 2025-11-03 11:50:56,332] Trial 132 finished with value: 0.10427123898408268 and parameters: {'model_type': 'graphsage', 'hidden_dims': '[512, 256]', 'dropout': 0.24863090023498072, 'batch_norm': True, 'lr': 0.00028638078616601275, 'weight_decay': 1.0146871027766286e-06, 'epochs': 222, 'loss': 'mse', 'optimizer': 'adam', 'graph_mode': 'cutoff', 'cutoff': 0.594042283073193, 'grm_norm': 'none', 'self_loops': True, 'use_snp_selection': False}. Best is trial 95 with value: 0.12915900749773812.
[I 2025-11-03 11:50:59,541] Trial 133 finished with value: 0.10410409338080204 and parameters: {'model_type': 'graphsage', 'hidden_dims': '[512, 256]', 'dropout': 0.2056104652579623, 'batch_norm': True, 'lr': 0.00042062963895505206, 'weight_decay': 8.381443959207585e-07, 'epochs': 184, 'loss': 'mse', 'optimizer': 'adam', 'graph_mode': 'cutoff', 'cutoff': 0.7141462872498978, 'grm_norm': 'none', 'self_loops': True, 'use_snp_selection': False}. Best is trial 95 with value: 0.12915900749773812.
[I 2025-11-03 11:51:02,965] Trial 134 finished with value: 0.13169710374486915 and parameters: {'model_type': 'graphsage', 'hidden_dims': '[512, 256]', 'dropout': 0.2265645667528843, 'batch_norm': True, 'lr': 0.0005048926345008263, 'weight_decay': 2.122424220064928e-06, 'epochs': 197, 'loss': 'mse', 'optimizer': 'adam', 'graph_mode': 'cutoff', 'cutoff': 0.270594661748074, 'grm_norm': 'none', 'self_loops': False, 'use_snp_selection': False}. Best is trial 134 with value: 0.13169710374486915.
[I 2025-11-03 11:51:06,310] Trial 135 finished with value: 0.12124606683759752 and parameters: {'model_type': 'graphsage', 'hidden_dims': '[512, 256]', 'dropout': 0.22759013063731084, 'batch_norm': True, 'lr': 0.0005084897796283392, 'weight_decay': 2.242043627641242e-06, 'epochs': 196, 'loss': 'mse', 'optimizer': 'adam', 'graph_mode': 'cutoff', 'cutoff': 0.29549442684683597, 'grm_norm': 'gcn', 'self_loops': False, 'use_snp_selection': False}. Best is trial 134 with value: 0.13169710374486915.
[I 2025-11-03 11:51:09,658] Trial 136 finished with value: 0.09900087684867608 and parameters: {'model_type': 'graphsage', 'hidden_dims': '[512, 256]', 'dropout': 0.19524028061681925, 'batch_norm': True, 'lr': 0.0008314546342494747, 'weight_decay': 2.371292858415984e-06, 'epochs': 194, 'loss': 'mae', 'optimizer': 'adam', 'graph_mode': 'cutoff', 'cutoff': 0.2789317401112798, 'grm_norm': 'gcn', 'self_loops': False, 'use_snp_selection': False}. Best is trial 134 with value: 0.13169710374486915.
[I 2025-11-03 11:51:11,785] Trial 137 finished with value: 0.11427332163461533 and parameters: {'model_type': 'graphsage', 'hidden_dims': '[256, 128]', 'dropout': 0.23156501193856158, 'batch_norm': True, 'lr': 0.0005190148929797554, 'weight_decay': 4.897530300077294e-06, 'epochs': 173, 'loss': 'mse', 'optimizer': 'adam', 'graph_mode': 'cutoff', 'cutoff': 0.28230612575531494, 'grm_norm': 'none', 'self_loops': False, 'use_snp_selection': False}. Best is trial 134 with value: 0.13169710374486915.
[I 2025-11-03 11:51:15,201] Trial 138 finished with value: 0.09669411847292844 and parameters: {'model_type': 'graphsage', 'hidden_dims': '[512, 256]', 'dropout': 0.22042411954088412, 'batch_norm': True, 'lr': 0.0006428079817316806, 'weight_decay': 2.082924326206402e-06, 'epochs': 179, 'loss': 'mse', 'optimizer': 'adam', 'graph_mode': 'knn', 'source': 'grm', 'knn_k': 7, 'weighted_edges': False, 'symmetrize_mode': 'union', 'use_snp_selection': False}. Best is trial 134 with value: 0.13169710374486915.
[I 2025-11-03 11:51:17,449] Trial 139 finished with value: 0.09066514353977448 and parameters: {'model_type': 'graphsage', 'hidden_dims': '[256, 128, 64]', 'dropout': 0.2564331933533635, 'batch_norm': True, 'lr': 0.00047692807379876826, 'weight_decay': 3.0619304321457783e-06, 'epochs': 154, 'loss': 'mse', 'optimizer': 'adam', 'graph_mode': 'cutoff', 'cutoff': 0.25979853557185395, 'grm_norm': 'gcn', 'self_loops': False, 'use_snp_selection': False}. Best is trial 134 with value: 0.13169710374486915.
[I 2025-11-03 11:51:20,510] Trial 140 finished with value: 0.12640099826534756 and parameters: {'model_type': 'graphsage', 'hidden_dims': '[512, 256]', 'dropout': 0.34227639856169195, 'batch_norm': True, 'lr': 0.0007839510471462856, 'weight_decay': 4.200001038871348e-06, 'epochs': 165, 'loss': 'mse', 'optimizer': 'adam', 'graph_mode': 'cutoff', 'cutoff': 0.8090536133439549, 'grm_norm': 'gcn', 'self_loops': False, 'use_snp_selection': False}. Best is trial 134 with value: 0.13169710374486915.
[I 2025-11-03 11:51:23,637] Trial 141 finished with value: 0.11156979703743408 and parameters: {'model_type': 'graphsage', 'hidden_dims': '[512, 256]', 'dropout': 0.36476954175519727, 'batch_norm': True, 'lr': 0.0007073145228978715, 'weight_decay': 7.650638127502414e-06, 'epochs': 163, 'loss': 'mse', 'optimizer': 'adam', 'graph_mode': 'cutoff', 'cutoff': 0.34798339428913816, 'grm_norm': 'gcn', 'self_loops': False, 'use_snp_selection': False}. Best is trial 134 with value: 0.13169710374486915.
[I 2025-11-03 11:51:26,840] Trial 142 finished with value: 0.13100259989713622 and parameters: {'model_type': 'graphsage', 'hidden_dims': '[512, 256]', 'dropout': 0.33878621402148806, 'batch_norm': True, 'lr': 0.0008121250688293889, 'weight_decay': 4.435574747689486e-06, 'epochs': 170, 'loss': 'mse', 'optimizer': 'adam', 'graph_mode': 'cutoff', 'cutoff': 0.3208571172169547, 'grm_norm': 'gcn', 'self_loops': False, 'use_snp_selection': False}. Best is trial 134 with value: 0.13169710374486915.
[I 2025-11-03 11:51:29,992] Trial 143 finished with value: 0.11084056273071613 and parameters: {'model_type': 'graphsage', 'hidden_dims': '[512, 256]', 'dropout': 0.31961261234937044, 'batch_norm': True, 'lr': 0.0007981123061665166, 'weight_decay': 3.972788115295451e-06, 'epochs': 169, 'loss': 'mse', 'optimizer': 'adam', 'graph_mode': 'cutoff', 'cutoff': 0.318056861559918, 'grm_norm': 'gcn', 'self_loops': False, 'use_snp_selection': False}. Best is trial 134 with value: 0.13169710374486915.
[I 2025-11-03 11:51:33,054] Trial 144 finished with value: 0.1295003005284045 and parameters: {'model_type': 'graphsage', 'hidden_dims': '[512, 256]', 'dropout': 0.35717391615977817, 'batch_norm': True, 'lr': 0.0008565793586757702, 'weight_decay': 5.90908690214044e-06, 'epochs': 147, 'loss': 'mse', 'optimizer': 'adam', 'graph_mode': 'cutoff', 'cutoff': 0.23969473229582, 'grm_norm': 'gcn', 'self_loops': False, 'use_snp_selection': False}. Best is trial 134 with value: 0.13169710374486915.
[I 2025-11-03 11:51:35,984] Trial 145 finished with value: 0.10084201932591669 and parameters: {'model_type': 'graphsage', 'hidden_dims': '[512, 256]', 'dropout': 0.35512597001042767, 'batch_norm': True, 'lr': 0.0009327005299807517, 'weight_decay': 9.34057894225299e-06, 'epochs': 145, 'loss': 'mse', 'optimizer': 'adam', 'graph_mode': 'cutoff', 'cutoff': 0.8695644270675851, 'grm_norm': 'gcn', 'self_loops': False, 'use_snp_selection': False}. Best is trial 134 with value: 0.13169710374486915.
[I 2025-11-03 11:51:38,900] Trial 146 finished with value: 0.11282069143502785 and parameters: {'model_type': 'graphsage', 'hidden_dims': '[512, 256]', 'dropout': 0.3437212104882788, 'batch_norm': True, 'lr': 0.00081394986649059, 'weight_decay': 3.332287971749607e-06, 'epochs': 139, 'loss': 'mse', 'optimizer': 'adam', 'graph_mode': 'cutoff', 'cutoff': 0.7645901321105788, 'grm_norm': 'gcn', 'self_loops': False, 'use_snp_selection': False}. Best is trial 134 with value: 0.13169710374486915.
[I 2025-11-03 11:51:41,978] Trial 147 finished with value: 0.11098518980528385 and parameters: {'model_type': 'graphsage', 'hidden_dims': '[512, 256]', 'dropout': 0.33358385612194125, 'batch_norm': True, 'lr': 0.0009755518558895817, 'weight_decay': 5.79275322720049e-06, 'epochs': 151, 'loss': 'mae', 'optimizer': 'adam', 'graph_mode': 'cutoff', 'cutoff': 0.2517664824934855, 'grm_norm': 'gcn', 'self_loops': False, 'use_snp_selection': False}. Best is trial 134 with value: 0.13169710374486915.
[I 2025-11-03 11:51:45,153] Trial 148 finished with value: 0.13453050267301211 and parameters: {'model_type': 'graphsage', 'hidden_dims': '[512, 256]', 'dropout': 0.37371059915679256, 'batch_norm': True, 'lr': 0.0006217025437671667, 'weight_decay': 4.54550497465456e-06, 'epochs': 161, 'loss': 'mse', 'optimizer': 'adam', 'graph_mode': 'cutoff', 'cutoff': 0.22969022593792554, 'grm_norm': 'gcn', 'self_loops': False, 'use_snp_selection': False}. Best is trial 148 with value: 0.13453050267301211.
[I 2025-11-03 11:51:48,203] Trial 149 finished with value: 0.10505265270556471 and parameters: {'model_type': 'graphsage', 'hidden_dims': '[512, 256]', 'dropout': 0.3723991752424971, 'batch_norm': True, 'lr': 0.0007262475815758212, 'weight_decay': 4.714343735317785e-06, 'epochs': 126, 'loss': 'mse', 'optimizer': 'adam', 'graph_mode': 'knn', 'source': 'grm', 'knn_k': 8, 'weighted_edges': False, 'symmetrize_mode': 'union', 'use_snp_selection': False}. Best is trial 148 with value: 0.13453050267301211.
[I 2025-11-03 11:51:51,130] Trial 0 finished with value: 0.028213981889339514 and parameters: {'model_type': 'graphsage', 'hidden_dims': '[128, 64]', 'dropout': 0.199031432379812, 'batch_norm': True, 'lr': 1.8408544111075837e-06, 'weight_decay': 5.5136510071208614e-05, 'epochs': 336, 'loss': 'mae', 'optimizer': 'adam', 'graph_mode': 'knn', 'source': 'grm', 'knn_k': 8, 'weighted_edges': True, 'symmetrize_mode': 'mutual', 'use_snp_selection': False}. Best is trial 0 with value: 0.028213981889339514.
[I 2025-11-03 11:51:52,807] Trial 1 finished with value: 0.04767414647244149 and parameters: {'model_type': 'graphsage', 'hidden_dims': '[128, 64]', 'dropout': 0.40051947670227217, 'batch_norm': True, 'lr': 0.0005320428882732732, 'weight_decay': 1.89210117736594e-06, 'epochs': 68, 'loss': 'mse', 'optimizer': 'adam', 'graph_mode': 'knn', 'source': 'grm', 'knn_k': 7, 'weighted_edges': True, 'symmetrize_mode': 'union', 'use_snp_selection': False}. Best is trial 1 with value: 0.04767414647244149.
[I 2025-11-03 11:51:55,497] Trial 2 finished with value: 0.030892917891424287 and parameters: {'model_type': 'graphsage', 'hidden_dims': '[256, 128]', 'dropout': 0.5105528289184642, 'batch_norm': False, 'lr': 0.0006804279372404962, 'weight_decay': 0.0008922815224257085, 'epochs': 181, 'loss': 'mse', 'optimizer': 'adam', 'graph_mode': 'cutoff', 'cutoff': 0.5741905641612706, 'grm_norm': 'gcn', 'self_loops': False, 'use_snp_selection': True, 'num_snps': 26910}. Best is trial 1 with value: 0.04767414647244149.
[I 2025-11-03 11:51:58,351] Trial 3 finished with value: 0.019134575968174757 and parameters: {'model_type': 'graphsage', 'hidden_dims': '[256, 128, 64]', 'dropout': 0.5390483213624292, 'batch_norm': False, 'lr': 3.4705625989073525e-05, 'weight_decay': 2.4623319020131338e-05, 'epochs': 121, 'loss': 'mse', 'optimizer': 'adam', 'graph_mode': 'knn', 'source': 'grm', 'knn_k': 6, 'weighted_edges': False, 'symmetrize_mode': 'mutual', 'use_snp_selection': True, 'num_snps': 30713}. Best is trial 1 with value: 0.04767414647244149.
[I 2025-11-03 11:52:01,069] Trial 4 finished with value: 0.0567629505970646 and parameters: {'model_type': 'graphsage', 'hidden_dims': '[128, 64]', 'dropout': 0.13404863676897502, 'batch_norm': False, 'lr': 0.0001431556295367288, 'weight_decay': 2.2084517750726675e-05, 'epochs': 51, 'loss': 'mae', 'optimizer': 'adam', 'graph_mode': 'cutoff', 'cutoff': 0.6714268476993044, 'grm_norm': 'none', 'self_loops': False, 'use_snp_selection': True, 'num_snps': 45645}. Best is trial 4 with value: 0.0567629505970646.
[I 2025-11-03 11:52:04,517] Trial 5 finished with value: 0.029237587820434514 and parameters: {'model_type': 'graphsage', 'hidden_dims': '[256, 128]', 'dropout': 0.42253606323412096, 'batch_norm': False, 'lr': 4.238630400638805e-05, 'weight_decay': 8.074086040046576e-07, 'epochs': 158, 'loss': 'mae', 'optimizer': 'adam', 'graph_mode': 'knn', 'source': 'grm', 'knn_k': 1, 'weighted_edges': False, 'symmetrize_mode': 'mutual', 'use_snp_selection': True, 'num_snps': 43113}. Best is trial 4 with value: 0.0567629505970646.
[I 2025-11-03 11:52:09,103] Trial 6 finished with value: 0.03432061809085653 and parameters: {'model_type': 'graphsage', 'hidden_dims': '[512, 256]', 'dropout': 0.3534893146320237, 'batch_norm': True, 'lr': 0.000251307964226932, 'weight_decay': 1.821819791794022e-05, 'epochs': 223, 'loss': 'mae', 'optimizer': 'adam', 'graph_mode': 'knn', 'source': 'grm', 'knn_k': 1, 'weighted_edges': True, 'symmetrize_mode': 'mutual', 'use_snp_selection': False}. Best is trial 4 with value: 0.0567629505970646.
[I 2025-11-03 11:52:13,249] Trial 7 finished with value: 0.035072789948207984 and parameters: {'model_type': 'graphsage', 'hidden_dims': '[512, 256]', 'dropout': 0.1105825955860775, 'batch_norm': True, 'lr': 2.374338412754043e-05, 'weight_decay': 1.1284721123340274e-05, 'epochs': 190, 'loss': 'mse', 'optimizer': 'adam', 'graph_mode': 'cutoff', 'cutoff': 0.719872204109604, 'grm_norm': 'gcn', 'self_loops': False, 'use_snp_selection': False}. Best is trial 4 with value: 0.0567629505970646.
[I 2025-11-03 11:52:16,732] Trial 8 finished with value: 0.039312955070268586 and parameters: {'model_type': 'graphsage', 'hidden_dims': '[512, 128]', 'dropout': 0.5066580418354021, 'batch_norm': True, 'lr': 0.00039213678276659976, 'weight_decay': 3.43655320802934e-06, 'epochs': 120, 'loss': 'mse', 'optimizer': 'adam', 'graph_mode': 'cutoff', 'cutoff': 0.34923059576505366, 'grm_norm': 'cosine', 'self_loops': True, 'use_snp_selection': False}. Best is trial 4 with value: 0.0567629505970646.
[I 2025-11-03 11:52:18,938] Trial 9 finished with value: 0.054092281225114225 and parameters: {'model_type': 'graphsage', 'hidden_dims': '[512, 256]', 'dropout': 0.301734920240333, 'batch_norm': False, 'lr': 6.650961854953448e-06, 'weight_decay': 6.861575656590315e-05, 'epochs': 150, 'loss': 'mae', 'optimizer': 'adam', 'graph_mode': 'cutoff', 'cutoff': 0.2857569870061939, 'grm_norm': 'cosine_then_gcn', 'self_loops': False, 'use_snp_selection': True, 'num_snps': 12722}. Best is trial 4 with value: 0.0567629505970646.
[I 2025-11-03 11:52:23,173] Trial 10 finished with value: 0.003127336100798062 and parameters: {'model_type': 'graphsage', 'hidden_dims': '[512, 64]', 'dropout': 0.22492338276159776, 'batch_norm': False, 'lr': 0.00014233761188460356, 'weight_decay': 1.8772904431456567e-07, 'epochs': 41, 'loss': 'mae', 'optimizer': 'adam', 'graph_mode': 'cutoff', 'cutoff': 0.8740100033033124, 'grm_norm': 'none', 'self_loops': True, 'use_snp_selection': True, 'num_snps': 58960}. Best is trial 4 with value: 0.0567629505970646.
[I 2025-11-03 11:52:25,489] Trial 11 finished with value: 0.04355253117562679 and parameters: {'model_type': 'graphsage', 'hidden_dims': '[128, 64]', 'dropout': 0.23879924216512757, 'batch_norm': False, 'lr': 3.1730969601519765e-06, 'weight_decay': 0.00018467653946554991, 'epochs': 254, 'loss': 'mae', 'optimizer': 'adam', 'graph_mode': 'cutoff', 'cutoff': 0.20190156779348867, 'grm_norm': 'cosine_then_gcn', 'self_loops': False, 'use_snp_selection': True, 'num_snps': 10369}. Best is trial 4 with value: 0.0567629505970646.
[I 2025-11-03 11:52:27,073] Trial 12 finished with value: 0.03917265472818063 and parameters: {'model_type': 'graphsage', 'hidden_dims': '[512, 256]', 'dropout': 0.10070859634525933, 'batch_norm': False, 'lr': 8.313753911922747e-06, 'weight_decay': 0.000133333526948601, 'epochs': 107, 'loss': 'mae', 'optimizer': 'adam', 'graph_mode': 'cutoff', 'cutoff': 0.5012009858727229, 'grm_norm': 'none', 'self_loops': False, 'use_snp_selection': True, 'num_snps': 3222}. Best is trial 4 with value: 0.0567629505970646.
[I 2025-11-03 11:52:32,454] Trial 13 finished with value: 0.06581675801211566 and parameters: {'model_type': 'graphsage', 'hidden_dims': '[512, 64]', 'dropout': 0.29043694625393646, 'batch_norm': False, 'lr': 9.358496046614984e-05, 'weight_decay': 0.0004398078832163521, 'epochs': 277, 'loss': 'mae', 'optimizer': 'adam', 'graph_mode': 'cutoff', 'cutoff': 0.6413515058900656, 'grm_norm': 'cosine_then_gcn', 'self_loops': False, 'use_snp_selection': True, 'num_snps': 45389}. Best is trial 13 with value: 0.06581675801211566.
[I 2025-11-03 11:52:38,297] Trial 14 finished with value: 0.059764834492462046 and parameters: {'model_type': 'graphsage', 'hidden_dims': '[512, 64]', 'dropout': 0.1553438900722138, 'batch_norm': False, 'lr': 9.270214256676846e-05, 'weight_decay': 0.0007317338984173277, 'epochs': 313, 'loss': 'mae', 'optimizer': 'adam', 'graph_mode': 'cutoff', 'cutoff': 0.6604954967745874, 'grm_norm': 'none', 'self_loops': False, 'use_snp_selection': True, 'num_snps': 47666}. Best is trial 13 with value: 0.06581675801211566.
[I 2025-11-03 11:52:44,281] Trial 15 finished with value: 0.0405685297035466 and parameters: {'model_type': 'graphsage', 'hidden_dims': '[512, 64]', 'dropout': 0.2919525311213587, 'batch_norm': False, 'lr': 8.675681887984805e-05, 'weight_decay': 0.0008123085288536146, 'epochs': 313, 'loss': 'mae', 'optimizer': 'adam', 'graph_mode': 'cutoff', 'cutoff': 0.818160343848454, 'grm_norm': 'cosine_then_gcn', 'self_loops': False, 'use_snp_selection': True, 'num_snps': 49160}. Best is trial 13 with value: 0.06581675801211566.
[I 2025-11-03 11:52:50,907] Trial 16 finished with value: 0.04330584119211916 and parameters: {'model_type': 'graphsage', 'hidden_dims': '[512, 64]', 'dropout': 0.1777078481377637, 'batch_norm': False, 'lr': 7.621416779927401e-05, 'weight_decay': 0.0002894601132264991, 'epochs': 287, 'loss': 'mae', 'optimizer': 'adam', 'graph_mode': 'cutoff', 'cutoff': 0.518607937819263, 'grm_norm': 'cosine', 'self_loops': True, 'use_snp_selection': True, 'num_snps': 57703}. Best is trial 13 with value: 0.06581675801211566.
[I 2025-11-03 11:52:55,661] Trial 17 finished with value: 0.02955295602662852 and parameters: {'model_type': 'graphsage', 'hidden_dims': '[512, 64]', 'dropout': 0.2702037781903839, 'batch_norm': False, 'lr': 1.0036170171726128e-05, 'weight_decay': 0.00042503225052475024, 'epochs': 270, 'loss': 'mae', 'optimizer': 'adam', 'graph_mode': 'cutoff', 'cutoff': 0.6666526598918401, 'grm_norm': 'none', 'self_loops': False, 'use_snp_selection': True, 'num_snps': 39135}. Best is trial 13 with value: 0.06581675801211566.
[I 2025-11-03 11:52:59,975] Trial 18 finished with value: 0.05558994645995541 and parameters: {'model_type': 'graphsage', 'hidden_dims': '[512, 64]', 'dropout': 0.16889985278784186, 'batch_norm': False, 'lr': 2.2465963456090454e-05, 'weight_decay': 8.570629214193366e-05, 'epochs': 230, 'loss': 'mae', 'optimizer': 'adam', 'graph_mode': 'cutoff', 'cutoff': 0.7588107049586159, 'grm_norm': 'cosine_then_gcn', 'self_loops': False, 'use_snp_selection': True, 'num_snps': 36444}. Best is trial 13 with value: 0.06581675801211566.
[I 2025-11-03 11:53:04,666] Trial 19 finished with value: 0.03808204838676263 and parameters: {'model_type': 'graphsage', 'hidden_dims': '[256, 128, 64]', 'dropout': 0.3563039748091528, 'batch_norm': False, 'lr': 0.00022942412371558117, 'weight_decay': 0.0004096246316291737, 'epochs': 349, 'loss': 'mae', 'optimizer': 'adam', 'graph_mode': 'cutoff', 'cutoff': 0.5728806853825955, 'grm_norm': 'cosine_then_gcn', 'self_loops': True, 'use_snp_selection': True, 'num_snps': 50467}. Best is trial 13 with value: 0.06581675801211566.
[I 2025-11-03 11:53:08,398] Trial 20 finished with value: 0.03656316240563607 and parameters: {'model_type': 'graphsage', 'hidden_dims': '[512, 128]', 'dropout': 0.31766750875585814, 'batch_norm': False, 'lr': 0.0009993970833969358, 'weight_decay': 0.0009130028791041096, 'epochs': 304, 'loss': 'mae', 'optimizer': 'adam', 'graph_mode': 'cutoff', 'cutoff': 0.4417119593379008, 'grm_norm': 'none', 'self_loops': False, 'use_snp_selection': True, 'num_snps': 25263}. Best is trial 13 with value: 0.06581675801211566.
[I 2025-11-03 11:53:11,924] Trial 21 finished with value: 0.04429695298790422 and parameters: {'model_type': 'graphsage', 'hidden_dims': '[128, 64]', 'dropout': 0.14604979130057535, 'batch_norm': False, 'lr': 8.358424734776933e-05, 'weight_decay': 3.6283888566115365e-05, 'epochs': 247, 'loss': 'mae', 'optimizer': 'adam', 'graph_mode': 'cutoff', 'cutoff': 0.6391791439144262, 'grm_norm': 'none', 'self_loops': False, 'use_snp_selection': True, 'num_snps': 50195}. Best is trial 13 with value: 0.06581675801211566.
[I 2025-11-03 11:53:17,508] Trial 22 finished with value: 0.04071946436491111 and parameters: {'model_type': 'graphsage', 'hidden_dims': '[512, 64]', 'dropout': 0.13464646048995027, 'batch_norm': False, 'lr': 0.00016931569189849316, 'weight_decay': 5.477826278520157e-06, 'epochs': 319, 'loss': 'mae', 'optimizer': 'adam', 'graph_mode': 'cutoff', 'cutoff': 0.6426135677682135, 'grm_norm': 'none', 'self_loops': False, 'use_snp_selection': True, 'num_snps': 44268}. Best is trial 13 with value: 0.06581675801211566.
[I 2025-11-03 11:53:22,140] Trial 23 finished with value: 0.04368406072568094 and parameters: {'model_type': 'graphsage', 'hidden_dims': '[512, 64]', 'dropout': 0.24133449624847222, 'batch_norm': False, 'lr': 5.725990409015195e-05, 'weight_decay': 0.00017899974473924388, 'epochs': 281, 'loss': 'mae', 'optimizer': 'adam', 'graph_mode': 'cutoff', 'cutoff': 0.7399342599938701, 'grm_norm': 'none', 'self_loops': False, 'use_snp_selection': True, 'num_snps': 36834}. Best is trial 13 with value: 0.06581675801211566.
