[I 2025-11-03 12:27:16,732] Trial 137 finished with value: 0.04426804788870334 and parameters: {'model_type': 'gcn', 'hidden_dims': '[512, 128]', 'dropout': 0.4955894855360661, 'batch_norm': False, 'lr': 0.00021484170638766658, 'weight_decay': 6.913964808233832e-06, 'epochs': 309, 'loss': 'mse', 'optimizer': 'adam', 'graph_mode': 'knn', 'source': 'grm', 'knn_k': 10, 'weighted_edges': False, 'symmetrize_mode': 'mutual', 'use_snp_selection': True, 'num_snps': 24550}. Best is trial 106 with value: 0.07318840908067875.
[I 2025-11-03 12:27:18,763] Trial 138 finished with value: 0.0439799879485677 and parameters: {'model_type': 'gcn', 'hidden_dims': '[512, 128]', 'dropout': 0.2227713434301138, 'batch_norm': False, 'lr': 0.0001946798751422067, 'weight_decay': 5.403190697527507e-07, 'epochs': 122, 'loss': 'mae', 'optimizer': 'adam', 'graph_mode': 'knn', 'source': 'grm', 'knn_k': 8, 'weighted_edges': False, 'symmetrize_mode': 'mutual', 'use_snp_selection': True, 'num_snps': 20298}. Best is trial 106 with value: 0.07318840908067875.
[I 2025-11-03 12:27:21,327] Trial 139 finished with value: 0.04073487009963691 and parameters: {'model_type': 'gcn', 'hidden_dims': '[512, 128]', 'dropout': 0.1845053221777478, 'batch_norm': False, 'lr': 7.74139667311514e-05, 'weight_decay': 4.5204947548408126e-07, 'epochs': 261, 'loss': 'mae', 'optimizer': 'adam', 'graph_mode': 'knn', 'source': 'grm', 'knn_k': 9, 'weighted_edges': False, 'symmetrize_mode': 'mutual', 'use_snp_selection': True, 'num_snps': 22125}. Best is trial 106 with value: 0.07318840908067875.
[I 2025-11-03 12:27:23,014] Trial 140 finished with value: 0.015140098396016365 and parameters: {'model_type': 'gcn', 'hidden_dims': '[512, 64]', 'dropout': 0.2755552954953438, 'batch_norm': False, 'lr': 0.00039423914950110106, 'weight_decay': 2.3775409362457508e-05, 'epochs': 250, 'loss': 'mse', 'optimizer': 'adam', 'graph_mode': 'knn', 'source': 'grm', 'knn_k': 10, 'weighted_edges': False, 'symmetrize_mode': 'mutual', 'use_snp_selection': True, 'num_snps': 3281}. Best is trial 106 with value: 0.07318840908067875.
[I 2025-11-03 12:27:25,419] Trial 141 finished with value: 0.009830639559392654 and parameters: {'model_type': 'gcn', 'hidden_dims': '[256, 128, 64]', 'dropout': 0.1322361588915148, 'batch_norm': False, 'lr': 0.00010340381449046257, 'weight_decay': 2.9184947512453053e-07, 'epochs': 274, 'loss': 'mse', 'optimizer': 'adam', 'graph_mode': 'knn', 'source': 'grm', 'knn_k': 9, 'weighted_edges': False, 'symmetrize_mode': 'mutual', 'use_snp_selection': True, 'num_snps': 16706}. Best is trial 106 with value: 0.07318840908067875.
[I 2025-11-03 12:27:27,502] Trial 142 finished with value: 0.0374357686393966 and parameters: {'model_type': 'gcn', 'hidden_dims': '[256, 128]', 'dropout': 0.17038070996477686, 'batch_norm': False, 'lr': 0.00011628164876050748, 'weight_decay': 1.5387044740937438e-06, 'epochs': 287, 'loss': 'mse', 'optimizer': 'adam', 'graph_mode': 'knn', 'source': 'grm', 'knn_k': 9, 'weighted_edges': False, 'symmetrize_mode': 'mutual', 'use_snp_selection': True, 'num_snps': 14261}. Best is trial 106 with value: 0.07318840908067875.
[I 2025-11-03 12:27:29,519] Trial 143 finished with value: 0.019367105693006887 and parameters: {'model_type': 'gcn', 'hidden_dims': '[512, 128]', 'dropout': 0.15380626758559066, 'batch_norm': False, 'lr': 0.00013334510186315993, 'weight_decay': 1.7605084972243734e-05, 'epochs': 280, 'loss': 'mse', 'optimizer': 'adam', 'graph_mode': 'knn', 'source': 'grm', 'knn_k': 10, 'weighted_edges': False, 'symmetrize_mode': 'mutual', 'use_snp_selection': True, 'num_snps': 11161}. Best is trial 106 with value: 0.07318840908067875.
[I 2025-11-03 12:27:32,030] Trial 144 finished with value: 0.04800299527263745 and parameters: {'model_type': 'gcn', 'hidden_dims': '[512, 128]', 'dropout': 0.5474240831025836, 'batch_norm': False, 'lr': 2.936659689496137e-05, 'weight_decay': 1.1442632172695158e-06, 'epochs': 298, 'loss': 'mse', 'optimizer': 'adam', 'graph_mode': 'knn', 'source': 'grm', 'knn_k': 8, 'weighted_edges': False, 'symmetrize_mode': 'mutual', 'use_snp_selection': True, 'num_snps': 19282}. Best is trial 106 with value: 0.07318840908067875.
[I 2025-11-03 12:27:34,031] Trial 145 finished with value: 0.019201873851754373 and parameters: {'model_type': 'gcn', 'hidden_dims': '[512, 128]', 'dropout': 0.23575094760066503, 'batch_norm': True, 'lr': 6.990676869721416e-05, 'weight_decay': 9.859270886170203e-06, 'epochs': 109, 'loss': 'mse', 'optimizer': 'adam', 'graph_mode': 'knn', 'source': 'grm', 'knn_k': 9, 'weighted_edges': False, 'symmetrize_mode': 'mutual', 'use_snp_selection': False}. Best is trial 106 with value: 0.07318840908067875.
[I 2025-11-03 12:27:36,708] Trial 146 finished with value: 0.006722666695693602 and parameters: {'model_type': 'gcn', 'hidden_dims': '[256, 128, 64]', 'dropout': 0.25249850946681973, 'batch_norm': False, 'lr': 0.00015029517900249693, 'weight_decay': 0.0006847164243568015, 'epochs': 118, 'loss': 'mae', 'optimizer': 'adam', 'graph_mode': 'knn', 'source': 'grm', 'knn_k': 6, 'weighted_edges': False, 'symmetrize_mode': 'mutual', 'use_snp_selection': True, 'num_snps': 39670}. Best is trial 106 with value: 0.07318840908067875.
[I 2025-11-03 12:27:38,524] Trial 147 finished with value: 0.039193444179115536 and parameters: {'model_type': 'gcn', 'hidden_dims': '[512, 128]', 'dropout': 0.20183175218385208, 'batch_norm': False, 'lr': 9.793201217544969e-05, 'weight_decay': 2.3342779146701042e-06, 'epochs': 160, 'loss': 'mae', 'optimizer': 'adam', 'graph_mode': 'knn', 'source': 'grm', 'knn_k': 10, 'weighted_edges': False, 'symmetrize_mode': 'mutual', 'use_snp_selection': True, 'num_snps': 12428}. Best is trial 106 with value: 0.07318840908067875.
[I 2025-11-03 12:27:41,208] Trial 148 finished with value: 0.028138263292998494 and parameters: {'model_type': 'gcn', 'hidden_dims': '[512, 128]', 'dropout': 0.17665887251940748, 'batch_norm': False, 'lr': 0.0005211122836766939, 'weight_decay': 0.00043481192950368746, 'epochs': 318, 'loss': 'mse', 'optimizer': 'adam', 'graph_mode': 'knn', 'source': 'grm', 'knn_k': 9, 'weighted_edges': True, 'symmetrize_mode': 'mutual', 'use_snp_selection': True, 'num_snps': 21463}. Best is trial 106 with value: 0.07318840908067875.
[I 2025-11-03 12:27:45,268] Trial 149 finished with value: 0.04369652047796868 and parameters: {'model_type': 'gcn', 'hidden_dims': '[512, 128]', 'dropout': 0.16084063708451815, 'batch_norm': False, 'lr': 0.0002556462818670875, 'weight_decay': 8.103896186528596e-06, 'epochs': 263, 'loss': 'mae', 'optimizer': 'adam', 'graph_mode': 'knn', 'source': 'grm', 'knn_k': 10, 'weighted_edges': False, 'symmetrize_mode': 'mutual', 'use_snp_selection': True, 'num_snps': 49623}. Best is trial 106 with value: 0.07318840908067875.
[I 2025-11-03 12:27:47,283] Trial 0 finished with value: 0.013779956511634378 and parameters: {'model_type': 'gcn', 'hidden_dims': '[128, 64]', 'dropout': 0.199031432379812, 'batch_norm': True, 'lr': 1.8408544111075837e-06, 'weight_decay': 5.5136510071208614e-05, 'epochs': 334, 'loss': 'mae', 'optimizer': 'adam', 'graph_mode': 'knn', 'source': 'grm', 'knn_k': 8, 'weighted_edges': True, 'symmetrize_mode': 'mutual', 'use_snp_selection': False}. Best is trial 0 with value: 0.013779956511634378.
[I 2025-11-03 12:27:48,367] Trial 1 finished with value: 0.031808967102496005 and parameters: {'model_type': 'gcn', 'hidden_dims': '[128, 64]', 'dropout': 0.40051947670227217, 'batch_norm': True, 'lr': 0.0005320428882732732, 'weight_decay': 1.89210117736594e-06, 'epochs': 32, 'loss': 'mse', 'optimizer': 'adam', 'graph_mode': 'knn', 'source': 'grm', 'knn_k': 7, 'weighted_edges': True, 'symmetrize_mode': 'union', 'use_snp_selection': False}. Best is trial 1 with value: 0.031808967102496005.
[I 2025-11-03 12:27:50,414] Trial 2 finished with value: 0.11321757453243689 and parameters: {'model_type': 'gcn', 'hidden_dims': '[256, 128]', 'dropout': 0.5105528289184642, 'batch_norm': False, 'lr': 0.0006804279372404962, 'weight_decay': 0.0008922815224257085, 'epochs': 160, 'loss': 'mse', 'optimizer': 'adam', 'graph_mode': 'cutoff', 'cutoff': 0.5741905641612706, 'grm_norm': 'gcn', 'self_loops': False, 'use_snp_selection': True, 'num_snps': 26910}. Best is trial 2 with value: 0.11321757453243689.
[I 2025-11-03 12:27:52,554] Trial 3 finished with value: 0.03682020080961736 and parameters: {'model_type': 'gcn', 'hidden_dims': '[256, 128, 64]', 'dropout': 0.5390483213624292, 'batch_norm': False, 'lr': 3.4705625989073525e-05, 'weight_decay': 2.4623319020131338e-05, 'epochs': 92, 'loss': 'mse', 'optimizer': 'adam', 'graph_mode': 'knn', 'source': 'grm', 'knn_k': 6, 'weighted_edges': False, 'symmetrize_mode': 'mutual', 'use_snp_selection': True, 'num_snps': 30713}. Best is trial 2 with value: 0.11321757453243689.
[I 2025-11-03 12:27:54,745] Trial 4 finished with value: 0.0014864648888490003 and parameters: {'model_type': 'gcn', 'hidden_dims': '[128, 64]', 'dropout': 0.13404863676897502, 'batch_norm': False, 'lr': 0.0001431556295367288, 'weight_decay': 2.2084517750726675e-05, 'epochs': 13, 'loss': 'mae', 'optimizer': 'adam', 'graph_mode': 'cutoff', 'cutoff': 0.6714268476993044, 'grm_norm': 'none', 'self_loops': False, 'use_snp_selection': True, 'num_snps': 45645}. Best is trial 2 with value: 0.11321757453243689.
[I 2025-11-03 12:27:57,336] Trial 5 finished with value: 0.06744967913779185 and parameters: {'model_type': 'gcn', 'hidden_dims': '[256, 128]', 'dropout': 0.42253606323412096, 'batch_norm': False, 'lr': 4.238630400638805e-05, 'weight_decay': 8.074086040046576e-07, 'epochs': 134, 'loss': 'mae', 'optimizer': 'adam', 'graph_mode': 'knn', 'source': 'grm', 'knn_k': 1, 'weighted_edges': False, 'symmetrize_mode': 'mutual', 'use_snp_selection': True, 'num_snps': 43113}. Best is trial 2 with value: 0.11321757453243689.
[I 2025-11-03 12:27:59,761] Trial 6 finished with value: 0.10894404971700763 and parameters: {'model_type': 'gcn', 'hidden_dims': '[512, 256]', 'dropout': 0.3534893146320237, 'batch_norm': True, 'lr': 0.000251307964226932, 'weight_decay': 1.821819791794022e-05, 'epochs': 207, 'loss': 'mae', 'optimizer': 'adam', 'graph_mode': 'knn', 'source': 'grm', 'knn_k': 1, 'weighted_edges': True, 'symmetrize_mode': 'mutual', 'use_snp_selection': False}. Best is trial 2 with value: 0.11321757453243689.
[I 2025-11-03 12:28:01,901] Trial 7 finished with value: 0.07893995817189596 and parameters: {'model_type': 'gcn', 'hidden_dims': '[512, 256]', 'dropout': 0.1105825955860775, 'batch_norm': True, 'lr': 2.374338412754043e-05, 'weight_decay': 1.1284721123340274e-05, 'epochs': 170, 'loss': 'mse', 'optimizer': 'adam', 'graph_mode': 'cutoff', 'cutoff': 0.719872204109604, 'grm_norm': 'gcn', 'self_loops': False, 'use_snp_selection': False}. Best is trial 2 with value: 0.11321757453243689.
[I 2025-11-03 12:28:03,620] Trial 8 finished with value: 0.10420720990308233 and parameters: {'model_type': 'gcn', 'hidden_dims': '[512, 128]', 'dropout': 0.5066580418354021, 'batch_norm': True, 'lr': 0.00039213678276659976, 'weight_decay': 3.43655320802934e-06, 'epochs': 91, 'loss': 'mse', 'optimizer': 'adam', 'graph_mode': 'cutoff', 'cutoff': 0.34923059576505366, 'grm_norm': 'cosine', 'self_loops': True, 'use_snp_selection': False}. Best is trial 2 with value: 0.11321757453243689.
[I 2025-11-03 12:28:05,178] Trial 9 finished with value: 0.08166572342168528 and parameters: {'model_type': 'gcn', 'hidden_dims': '[512, 256]', 'dropout': 0.301734920240333, 'batch_norm': False, 'lr': 6.650961854953448e-06, 'weight_decay': 6.861575656590315e-05, 'epochs': 125, 'loss': 'mae', 'optimizer': 'adam', 'graph_mode': 'cutoff', 'cutoff': 0.2857569870061939, 'grm_norm': 'cosine_then_gcn', 'self_loops': False, 'use_snp_selection': True, 'num_snps': 12722}. Best is trial 2 with value: 0.11321757453243689.
[I 2025-11-03 12:28:07,132] Trial 10 finished with value: 0.039885306730947846 and parameters: {'model_type': 'gcn', 'hidden_dims': '[256, 128]', 'dropout': 0.5885461262002587, 'batch_norm': False, 'lr': 9.558525641285997e-05, 'weight_decay': 0.0005507714381092994, 'epochs': 266, 'loss': 'mse', 'optimizer': 'adam', 'graph_mode': 'cutoff', 'cutoff': 0.8740100033033126, 'grm_norm': 'gcn', 'self_loops': True, 'use_snp_selection': True, 'num_snps': 16208}. Best is trial 2 with value: 0.11321757453243689.
[I 2025-11-03 12:28:09,675] Trial 11 finished with value: 0.10732811660470196 and parameters: {'model_type': 'gcn', 'hidden_dims': '[512, 64]', 'dropout': 0.28662674491963874, 'batch_norm': True, 'lr': 0.000993464184224348, 'weight_decay': 1.0655358607693621e-07, 'epochs': 228, 'loss': 'mae', 'optimizer': 'adam', 'graph_mode': 'knn', 'source': 'grm', 'knn_k': 1, 'weighted_edges': True, 'symmetrize_mode': 'union', 'use_snp_selection': False}. Best is trial 2 with value: 0.11321757453243689.
[I 2025-11-03 12:28:13,769] Trial 12 finished with value: 0.08656679332881759 and parameters: {'model_type': 'gcn', 'hidden_dims': '[512, 256]', 'dropout': 0.43189401499478725, 'batch_norm': True, 'lr': 0.00022827207082888324, 'weight_decay': 0.0007351014287437782, 'epochs': 232, 'loss': 'mae', 'optimizer': 'adam', 'graph_mode': 'knn', 'source': 'grm', 'knn_k': 3, 'weighted_edges': True, 'symmetrize_mode': 'mutual', 'use_snp_selection': True, 'num_snps': 58791}. Best is trial 2 with value: 0.11321757453243689.
[I 2025-11-03 12:28:15,522] Trial 13 finished with value: 0.05542392539297651 and parameters: {'model_type': 'gcn', 'hidden_dims': '[256, 128]', 'dropout': 0.33212846078805314, 'batch_norm': False, 'lr': 0.000990157751533555, 'weight_decay': 0.00018004872141209714, 'epochs': 198, 'loss': 'mse', 'optimizer': 'adam', 'graph_mode': 'cutoff', 'cutoff': 0.4773775536648144, 'grm_norm': 'gcn', 'self_loops': False, 'use_snp_selection': False}. Best is trial 2 with value: 0.11321757453243689.
[I 2025-11-03 12:28:17,489] Trial 14 finished with value: 0.04477440843082555 and parameters: {'model_type': 'gcn', 'hidden_dims': '[256, 128, 64]', 'dropout': 0.4873120737718566, 'batch_norm': False, 'lr': 8.58951060331143e-05, 'weight_decay': 0.00018915635152688608, 'epochs': 298, 'loss': 'mse', 'optimizer': 'adam', 'graph_mode': 'knn', 'source': 'grm', 'knn_k': 10, 'weighted_edges': True, 'symmetrize_mode': 'mutual', 'use_snp_selection': True, 'num_snps': 2338}. Best is trial 2 with value: 0.11321757453243689.
[I 2025-11-03 12:28:19,752] Trial 15 finished with value: 0.12250249074614396 and parameters: {'model_type': 'gcn', 'hidden_dims': '[512, 64]', 'dropout': 0.23353036104087477, 'batch_norm': True, 'lr': 0.000311153694350118, 'weight_decay': 3.9753994850250073e-07, 'epochs': 177, 'loss': 'mae', 'optimizer': 'adam', 'graph_mode': 'cutoff', 'cutoff': 0.5222336348323294, 'grm_norm': 'cosine_then_gcn', 'self_loops': False, 'use_snp_selection': False}. Best is trial 15 with value: 0.12250249074614396.
[I 2025-11-03 12:28:21,905] Trial 16 finished with value: 0.05610069933529424 and parameters: {'model_type': 'gcn', 'hidden_dims': '[512, 64]', 'dropout': 0.22683554587822735, 'batch_norm': True, 'lr': 1.1449207807915307e-05, 'weight_decay': 1.2886959472068226e-07, 'epochs': 166, 'loss': 'mae', 'optimizer': 'adam', 'graph_mode': 'cutoff', 'cutoff': 0.5222089449784458, 'grm_norm': 'cosine_then_gcn', 'self_loops': False, 'use_snp_selection': False}. Best is trial 15 with value: 0.12250249074614396.
[I 2025-11-03 12:28:23,905] Trial 17 finished with value: 0.08789244269914048 and parameters: {'model_type': 'gcn', 'hidden_dims': '[512, 64]', 'dropout': 0.22071679383663048, 'batch_norm': False, 'lr': 0.0004769821658105636, 'weight_decay': 3.666673469859633e-07, 'epochs': 82, 'loss': 'mse', 'optimizer': 'adam', 'graph_mode': 'cutoff', 'cutoff': 0.44938233121127463, 'grm_norm': 'cosine_then_gcn', 'self_loops': False, 'use_snp_selection': True, 'num_snps': 27292}. Best is trial 15 with value: 0.12250249074614396.
[I 2025-11-03 12:28:26,784] Trial 18 finished with value: 0.1032607954171744 and parameters: {'model_type': 'gcn', 'hidden_dims': '[512, 128]', 'dropout': 0.17824657843474276, 'batch_norm': True, 'lr': 8.136375735707035e-05, 'weight_decay': 4.018935341270846e-06, 'epochs': 137, 'loss': 'mse', 'optimizer': 'adam', 'graph_mode': 'cutoff', 'cutoff': 0.6455107194927096, 'grm_norm': 'cosine', 'self_loops': False, 'use_snp_selection': True, 'num_snps': 42324}. Best is trial 15 with value: 0.12250249074614396.
[I 2025-11-03 12:28:29,408] Trial 19 finished with value: 0.061049660877330464 and parameters: {'model_type': 'gcn', 'hidden_dims': '[512, 64]', 'dropout': 0.5789220302597518, 'batch_norm': False, 'lr': 0.0003494653952376257, 'weight_decay': 4.5436455201136146e-07, 'epochs': 259, 'loss': 'mae', 'optimizer': 'adam', 'graph_mode': 'cutoff', 'cutoff': 0.6001390012371233, 'grm_norm': 'none', 'self_loops': True, 'use_snp_selection': False}. Best is trial 15 with value: 0.12250249074614396.
[I 2025-11-03 12:28:31,008] Trial 20 finished with value: 0.04238825166549684 and parameters: {'model_type': 'gcn', 'hidden_dims': '[256, 128]', 'dropout': 0.270383077459837, 'batch_norm': False, 'lr': 1.1277956545809076e-06, 'weight_decay': 1.0918643891931186e-06, 'epochs': 64, 'loss': 'mse', 'optimizer': 'adam', 'graph_mode': 'cutoff', 'cutoff': 0.7853479193322711, 'grm_norm': 'cosine_then_gcn', 'self_loops': False, 'use_snp_selection': True, 'num_snps': 20304}. Best is trial 15 with value: 0.12250249074614396.
[I 2025-11-03 12:28:33,397] Trial 21 finished with value: 0.04992915654756748 and parameters: {'model_type': 'gcn', 'hidden_dims': '[512, 256]', 'dropout': 0.3584552620036948, 'batch_norm': True, 'lr': 0.0002023716099255282, 'weight_decay': 4.881339110858778e-06, 'epochs': 195, 'loss': 'mae', 'optimizer': 'adam', 'graph_mode': 'knn', 'source': 'grm', 'knn_k': 4, 'weighted_edges': False, 'symmetrize_mode': 'union', 'use_snp_selection': False}. Best is trial 15 with value: 0.12250249074614396.
[I 2025-11-03 12:28:35,858] Trial 22 finished with value: 0.11560681849435905 and parameters: {'model_type': 'gcn', 'hidden_dims': '[512, 256]', 'dropout': 0.4642559717701788, 'batch_norm': True, 'lr': 0.0006492768971053543, 'weight_decay': 0.0002182983937743865, 'epochs': 224, 'loss': 'mae', 'optimizer': 'adam', 'graph_mode': 'cutoff', 'cutoff': 0.3894896401555086, 'grm_norm': 'gcn', 'self_loops': False, 'use_snp_selection': False}. Best is trial 15 with value: 0.12250249074614396.
[I 2025-11-03 12:28:37,478] Trial 23 finished with value: 0.11247866316439442 and parameters: {'model_type': 'gcn', 'hidden_dims': '[256, 128]', 'dropout': 0.46731903628277444, 'batch_norm': True, 'lr': 0.0007549876920569501, 'weight_decay': 0.0003052490750799027, 'epochs': 158, 'loss': 'mae', 'optimizer': 'adam', 'graph_mode': 'cutoff', 'cutoff': 0.37889340178144637, 'grm_norm': 'gcn', 'self_loops': False, 'use_snp_selection': False}. Best is trial 15 with value: 0.12250249074614396.
[I 2025-11-03 12:28:40,116] Trial 24 finished with value: 0.08618825129098177 and parameters: {'model_type': 'gcn', 'hidden_dims': '[512, 64]', 'dropout': 0.5439624555334867, 'batch_norm': True, 'lr': 0.0005756701309319635, 'weight_decay': 0.0009848659446540602, 'epochs': 257, 'loss': 'mae', 'optimizer': 'adam', 'graph_mode': 'cutoff', 'cutoff': 0.20159452757767088, 'grm_norm': 'gcn', 'self_loops': False, 'use_snp_selection': False}. Best is trial 15 with value: 0.12250249074614396.
[I 2025-11-03 12:28:42,576] Trial 25 finished with value: 0.1050166742075305 and parameters: {'model_type': 'gcn', 'hidden_dims': '[512, 128]', 'dropout': 0.4528495851743799, 'batch_norm': True, 'lr': 0.00015356518042972922, 'weight_decay': 7.44078951628326e-05, 'epochs': 225, 'loss': 'mae', 'optimizer': 'adam', 'graph_mode': 'cutoff', 'cutoff': 0.5577300802509612, 'grm_norm': 'gcn', 'self_loops': False, 'use_snp_selection': False}. Best is trial 15 with value: 0.12250249074614396.
[I 2025-11-03 12:28:45,008] Trial 26 finished with value: 0.10116031247367105 and parameters: {'model_type': 'gcn', 'hidden_dims': '[256, 128, 64]', 'dropout': 0.3873571080807541, 'batch_norm': True, 'lr': 0.0003298447131766222, 'weight_decay': 0.00032657250057073603, 'epochs': 297, 'loss': 'mae', 'optimizer': 'adam', 'graph_mode': 'cutoff', 'cutoff': 0.4362812570353728, 'grm_norm': 'gcn', 'self_loops': False, 'use_snp_selection': False}. Best is trial 15 with value: 0.12250249074614396.
[I 2025-11-03 12:28:47,271] Trial 27 finished with value: 0.11593547565787245 and parameters: {'model_type': 'gcn', 'hidden_dims': '[512, 64]', 'dropout': 0.5121532667132019, 'batch_norm': True, 'lr': 0.0006465592568370604, 'weight_decay': 0.000129435246153812, 'epochs': 186, 'loss': 'mae', 'optimizer': 'adam', 'graph_mode': 'cutoff', 'cutoff': 0.5612315601002048, 'grm_norm': 'cosine_then_gcn', 'self_loops': True, 'use_snp_selection': False}. Best is trial 15 with value: 0.12250249074614396.
[I 2025-11-03 12:28:49,604] Trial 28 finished with value: 0.09706751741335438 and parameters: {'model_type': 'gcn', 'hidden_dims': '[512, 64]', 'dropout': 0.538932884905182, 'batch_norm': True, 'lr': 0.00014183887479832092, 'weight_decay': 0.0001341827105675341, 'epochs': 199, 'loss': 'mae', 'optimizer': 'adam', 'graph_mode': 'cutoff', 'cutoff': 0.3748186268135165, 'grm_norm': 'cosine_then_gcn', 'self_loops': True, 'use_snp_selection': False}. Best is trial 15 with value: 0.12250249074614396.
[I 2025-11-03 12:28:52,505] Trial 29 finished with value: 0.08952521066709518 and parameters: {'model_type': 'gcn', 'hidden_dims': '[512, 64]', 'dropout': 0.2598384392699715, 'batch_norm': True, 'lr': 5.1649319991380764e-05, 'weight_decay': 3.9526963781331124e-05, 'epochs': 303, 'loss': 'mae', 'optimizer': 'adam', 'graph_mode': 'cutoff', 'cutoff': 0.47609767868962616, 'grm_norm': 'cosine_then_gcn', 'self_loops': True, 'use_snp_selection': False}. Best is trial 15 with value: 0.12250249074614396.
