[I 2025-11-12 22:52:15,575] Trial 97 finished with value: 0.23064662420086282 and parameters: {'model_type': 'graphsage', 'hidden_dims': '[256, 128]', 'dropout': 0.4447690482420379, 'batch_norm': False, 'lr': 0.0001361965796990246, 'weight_decay': 1.8554929087062788e-07, 'epochs': 203, 'loss': 'mae', 'optimizer': 'adam', 'graph_mode': 'cutoff', 'cutoff': 0.4815945167602115, 'grm_norm': 'cosine', 'self_loops': True, 'use_snp_selection': True, 'num_snps': 59915}. Best is trial 27 with value: 0.24569925586503844.
[I 2025-11-12 22:54:17,840] Trial 98 finished with value: 0.25308949405017456 and parameters: {'model_type': 'graphsage', 'hidden_dims': '[256, 128]', 'dropout': 0.5088612269612138, 'batch_norm': False, 'lr': 3.9074243303515666e-05, 'weight_decay': 1.521263531371663e-07, 'epochs': 193, 'loss': 'mae', 'optimizer': 'adam', 'graph_mode': 'cutoff', 'cutoff': 0.3765372461028753, 'grm_norm': 'cosine', 'self_loops': True, 'use_snp_selection': True, 'num_snps': 52088}. Best is trial 98 with value: 0.25308949405017456.
[I 2025-11-12 22:56:11,849] Trial 99 finished with value: 0.22212262892116655 and parameters: {'model_type': 'graphsage', 'hidden_dims': '[256, 128]', 'dropout': 0.4246640504508739, 'batch_norm': False, 'lr': 5.093034543676989e-05, 'weight_decay': 1.4866494318183205e-07, 'epochs': 174, 'loss': 'mae', 'optimizer': 'adam', 'graph_mode': 'cutoff', 'cutoff': 0.3157451562609885, 'grm_norm': 'cosine', 'self_loops': True, 'use_snp_selection': True, 'num_snps': 44741}. Best is trial 98 with value: 0.25308949405017456.
[I 2025-11-12 22:58:15,379] Trial 100 finished with value: 0.21811330643775168 and parameters: {'model_type': 'graphsage', 'hidden_dims': '[128, 64]', 'dropout': 0.5545988520780225, 'batch_norm': False, 'lr': 2.816183856460751e-05, 'weight_decay': 1.1258917205273507e-07, 'epochs': 193, 'loss': 'mae', 'optimizer': 'adam', 'graph_mode': 'knn', 'source': 'grm', 'knn_k': 8, 'weighted_edges': True, 'symmetrize_mode': 'mutual', 'use_snp_selection': True, 'num_snps': 51801}. Best is trial 98 with value: 0.25308949405017456.
[I 2025-11-12 23:00:27,317] Trial 101 finished with value: 0.24057560056606014 and parameters: {'model_type': 'graphsage', 'hidden_dims': '[256, 128]', 'dropout': 0.4846480749510781, 'batch_norm': False, 'lr': 3.793890221076727e-05, 'weight_decay': 1.850155833191142e-07, 'epochs': 186, 'loss': 'mae', 'optimizer': 'adam', 'graph_mode': 'cutoff', 'cutoff': 0.4017463866638716, 'grm_norm': 'cosine', 'self_loops': True, 'use_snp_selection': True, 'num_snps': 57444}. Best is trial 98 with value: 0.25308949405017456.
[I 2025-11-12 23:02:54,618] Trial 102 finished with value: 0.2520354789555779 and parameters: {'model_type': 'graphsage', 'hidden_dims': '[256, 128]', 'dropout': 0.4912875852430044, 'batch_norm': False, 'lr': 3.4041280047903e-05, 'weight_decay': 1.8824403114406178e-07, 'epochs': 212, 'loss': 'mae', 'optimizer': 'adam', 'graph_mode': 'cutoff', 'cutoff': 0.37098891759712177, 'grm_norm': 'cosine', 'self_loops': True, 'use_snp_selection': True, 'num_snps': 57243}. Best is trial 98 with value: 0.25308949405017456.
[I 2025-11-12 23:04:56,727] Trial 103 finished with value: 0.2063875877306168 and parameters: {'model_type': 'graphsage', 'hidden_dims': '[256, 128]', 'dropout': 0.48775710213045637, 'batch_norm': False, 'lr': 0.0002225532149594023, 'weight_decay': 1.77074171040574e-07, 'epochs': 187, 'loss': 'mae', 'optimizer': 'adam', 'graph_mode': 'cutoff', 'cutoff': 0.39581881814085135, 'grm_norm': 'cosine', 'self_loops': True, 'use_snp_selection': True, 'num_snps': 53869}. Best is trial 98 with value: 0.25308949405017456.
[I 2025-11-12 23:06:57,384] Trial 104 finished with value: 0.24319283936497915 and parameters: {'model_type': 'graphsage', 'hidden_dims': '[256, 128]', 'dropout': 0.5106007587540555, 'batch_norm': False, 'lr': 3.7713166181245844e-05, 'weight_decay': 2.3688081441211666e-07, 'epochs': 211, 'loss': 'mae', 'optimizer': 'adam', 'graph_mode': 'cutoff', 'cutoff': 0.4115250923744035, 'grm_norm': 'cosine', 'self_loops': True, 'use_snp_selection': True, 'num_snps': 51443}. Best is trial 98 with value: 0.25308949405017456.
[I 2025-11-12 23:08:53,365] Trial 105 finished with value: 0.2276560060174424 and parameters: {'model_type': 'graphsage', 'hidden_dims': '[256, 128]', 'dropout': 0.5091474610639729, 'batch_norm': False, 'lr': 3.8728628469637686e-05, 'weight_decay': 2.4604595325176264e-07, 'epochs': 214, 'loss': 'mae', 'optimizer': 'adam', 'graph_mode': 'cutoff', 'cutoff': 0.4139348201443426, 'grm_norm': 'cosine', 'self_loops': True, 'use_snp_selection': True, 'num_snps': 47957}. Best is trial 98 with value: 0.25308949405017456.
[I 2025-11-12 23:11:04,133] Trial 106 finished with value: 0.2304915316269182 and parameters: {'model_type': 'graphsage', 'hidden_dims': '[256, 128]', 'dropout': 0.4843668272347841, 'batch_norm': False, 'lr': 3.252014045244948e-05, 'weight_decay': 1.0202756771323828e-07, 'epochs': 210, 'loss': 'mae', 'optimizer': 'adam', 'graph_mode': 'cutoff', 'cutoff': 0.36486904714027735, 'grm_norm': 'cosine', 'self_loops': True, 'use_snp_selection': True, 'num_snps': 50119}. Best is trial 98 with value: 0.25308949405017456.
[I 2025-11-12 23:13:26,159] Trial 107 finished with value: 0.08539621549563631 and parameters: {'model_type': 'graphsage', 'hidden_dims': '[256, 128]', 'dropout': 0.523159047606891, 'batch_norm': False, 'lr': 0.0005661183966653687, 'weight_decay': 1.3318279233831634e-07, 'epochs': 223, 'loss': 'mae', 'optimizer': 'adam', 'graph_mode': 'cutoff', 'cutoff': 0.4399109204139477, 'grm_norm': 'cosine', 'self_loops': True, 'use_snp_selection': True, 'num_snps': 57411}. Best is trial 98 with value: 0.25308949405017456.
[I 2025-11-12 23:14:28,920] Trial 108 finished with value: 0.2194138365597691 and parameters: {'model_type': 'graphsage', 'hidden_dims': '[256, 128]', 'dropout': 0.46949466116545446, 'batch_norm': True, 'lr': 4.317799101389985e-05, 'weight_decay': 2.057542390972328e-07, 'epochs': 202, 'loss': 'mae', 'optimizer': 'adam', 'graph_mode': 'cutoff', 'cutoff': 0.8461489050691939, 'grm_norm': 'cosine', 'self_loops': True, 'use_snp_selection': False}. Best is trial 98 with value: 0.25308949405017456.
[I 2025-11-12 23:16:50,906] Trial 109 finished with value: 0.21289717437766936 and parameters: {'model_type': 'graphsage', 'hidden_dims': '[256, 128]', 'dropout': 0.5076381715351125, 'batch_norm': False, 'lr': 5.872991802944773e-05, 'weight_decay': 1.6620351307653083e-07, 'epochs': 185, 'loss': 'mse', 'optimizer': 'adam', 'graph_mode': 'cutoff', 'cutoff': 0.2774602070261913, 'grm_norm': 'cosine', 'self_loops': True, 'use_snp_selection': True, 'num_snps': 46131}. Best is trial 98 with value: 0.25308949405017456.
[I 2025-11-12 23:18:45,192] Trial 110 finished with value: 0.23270441681652093 and parameters: {'model_type': 'graphsage', 'hidden_dims': '[256, 128]', 'dropout': 0.4521297153361994, 'batch_norm': False, 'lr': 3.3774811470864135e-05, 'weight_decay': 2.6414644123254575e-07, 'epochs': 173, 'loss': 'mae', 'optimizer': 'adam', 'graph_mode': 'cutoff', 'cutoff': 0.40442933466705827, 'grm_norm': 'cosine', 'self_loops': True, 'use_snp_selection': True, 'num_snps': 52685}. Best is trial 98 with value: 0.25308949405017456.
[I 2025-11-12 23:20:47,644] Trial 111 finished with value: 0.2303247662258733 and parameters: {'model_type': 'graphsage', 'hidden_dims': '[256, 128]', 'dropout': 0.48992289434800795, 'batch_norm': False, 'lr': 2.185495129150884e-05, 'weight_decay': 3.9533532954182833e-07, 'epochs': 197, 'loss': 'mae', 'optimizer': 'adam', 'graph_mode': 'cutoff', 'cutoff': 0.38207958613196835, 'grm_norm': 'cosine', 'self_loops': True, 'use_snp_selection': True, 'num_snps': 51187}. Best is trial 98 with value: 0.25308949405017456.
[I 2025-11-12 23:23:20,861] Trial 112 finished with value: 0.24638422491385215 and parameters: {'model_type': 'graphsage', 'hidden_dims': '[512, 256]', 'dropout': 0.5320430347794435, 'batch_norm': False, 'lr': 2.6231664663340947e-05, 'weight_decay': 3.1209100394965175e-07, 'epochs': 193, 'loss': 'mae', 'optimizer': 'adam', 'graph_mode': 'cutoff', 'cutoff': 0.35951318937802057, 'grm_norm': 'cosine', 'self_loops': True, 'use_snp_selection': True, 'num_snps': 49294}. Best is trial 98 with value: 0.25308949405017456.
[I 2025-11-12 23:25:40,675] Trial 113 finished with value: 0.2382539504588292 and parameters: {'model_type': 'graphsage', 'hidden_dims': '[512, 256]', 'dropout': 0.5724843182315292, 'batch_norm': False, 'lr': 3.7378386647870276e-05, 'weight_decay': 3.374591927481252e-07, 'epochs': 163, 'loss': 'mae', 'optimizer': 'adam', 'graph_mode': 'cutoff', 'cutoff': 0.35489834438149753, 'grm_norm': 'cosine', 'self_loops': True, 'use_snp_selection': True, 'num_snps': 49138}. Best is trial 98 with value: 0.25308949405017456.
[I 2025-11-12 23:28:42,347] Trial 114 finished with value: 0.24908289425145883 and parameters: {'model_type': 'graphsage', 'hidden_dims': '[512, 256]', 'dropout': 0.5322386858598189, 'batch_norm': False, 'lr': 2.5909070395578603e-05, 'weight_decay': 1.7605830935601982e-07, 'epochs': 218, 'loss': 'mae', 'optimizer': 'adam', 'graph_mode': 'cutoff', 'cutoff': 0.3455314251531658, 'grm_norm': 'cosine', 'self_loops': True, 'use_snp_selection': True, 'num_snps': 54519}. Best is trial 98 with value: 0.25308949405017456.
[I 2025-11-12 23:32:23,329] Trial 115 finished with value: 0.22889834450083996 and parameters: {'model_type': 'graphsage', 'hidden_dims': '[512, 256]', 'dropout': 0.5405705744520288, 'batch_norm': False, 'lr': 2.602283303497881e-05, 'weight_decay': 2.0450741696423038e-07, 'epochs': 240, 'loss': 'mae', 'optimizer': 'adam', 'graph_mode': 'cutoff', 'cutoff': 0.3012910488152293, 'grm_norm': 'cosine', 'self_loops': True, 'use_snp_selection': True, 'num_snps': 54533}. Best is trial 98 with value: 0.25308949405017456.
[I 2025-11-12 23:35:58,304] Trial 116 finished with value: 0.23894196902983897 and parameters: {'model_type': 'graphsage', 'hidden_dims': '[512, 256]', 'dropout': 0.5315798979862544, 'batch_norm': False, 'lr': 1.718005827599272e-05, 'weight_decay': 1.570594656558379e-07, 'epochs': 228, 'loss': 'mae', 'optimizer': 'adam', 'graph_mode': 'cutoff', 'cutoff': 0.32705917144802293, 'grm_norm': 'cosine', 'self_loops': True, 'use_snp_selection': True, 'num_snps': 57183}. Best is trial 98 with value: 0.25308949405017456.
[I 2025-11-12 23:39:04,106] Trial 117 finished with value: 0.23133705431138224 and parameters: {'model_type': 'graphsage', 'hidden_dims': '[512, 256]', 'dropout': 0.49921091514001337, 'batch_norm': False, 'lr': 2.832271636021052e-05, 'weight_decay': 2.967414492833082e-07, 'epochs': 222, 'loss': 'mae', 'optimizer': 'adam', 'graph_mode': 'cutoff', 'cutoff': 0.3486699550884624, 'grm_norm': 'cosine', 'self_loops': True, 'use_snp_selection': True, 'num_snps': 53637}. Best is trial 98 with value: 0.25308949405017456.
[I 2025-11-12 23:40:56,938] Trial 118 finished with value: 0.22093030131737165 and parameters: {'model_type': 'graphsage', 'hidden_dims': '[512, 256]', 'dropout': 0.4779680071141539, 'batch_norm': False, 'lr': 4.227284631487701e-05, 'weight_decay': 2.457145369073612e-07, 'epochs': 218, 'loss': 'mae', 'optimizer': 'adam', 'graph_mode': 'cutoff', 'cutoff': 0.38477721138561166, 'grm_norm': 'cosine', 'self_loops': True, 'use_snp_selection': True, 'num_snps': 33822}. Best is trial 98 with value: 0.25308949405017456.
[I 2025-11-12 23:43:21,322] Trial 119 finished with value: 0.23417911208440106 and parameters: {'model_type': 'graphsage', 'hidden_dims': '[512, 256]', 'dropout': 0.5129268480679595, 'batch_norm': False, 'lr': 3.446208019076888e-05, 'weight_decay': 1.780443666279684e-07, 'epochs': 208, 'loss': 'mae', 'optimizer': 'adam', 'graph_mode': 'cutoff', 'cutoff': 0.4294034612981894, 'grm_norm': 'cosine', 'self_loops': True, 'use_snp_selection': True, 'num_snps': 47499}. Best is trial 98 with value: 0.25308949405017456.
[I 2025-11-12 23:45:47,731] Trial 120 finished with value: 0.22910421460528707 and parameters: {'model_type': 'graphsage', 'hidden_dims': '[512, 256]', 'dropout': 0.5542130141279208, 'batch_norm': False, 'lr': 1.9642485124046846e-05, 'weight_decay': 3.9848739577526267e-07, 'epochs': 203, 'loss': 'mae', 'optimizer': 'adam', 'graph_mode': 'knn', 'source': 'grm', 'knn_k': 2, 'weighted_edges': True, 'symmetrize_mode': 'mutual', 'use_snp_selection': True, 'num_snps': 56558}. Best is trial 98 with value: 0.25308949405017456.
[I 2025-11-12 23:47:55,355] Trial 121 finished with value: 0.20495647345481238 and parameters: {'model_type': 'graphsage', 'hidden_dims': '[256, 128]', 'dropout': 0.5700215642691251, 'batch_norm': False, 'lr': 0.0001072948376323636, 'weight_decay': 1.1508974162321767e-07, 'epochs': 195, 'loss': 'mae', 'optimizer': 'adam', 'graph_mode': 'cutoff', 'cutoff': 0.3662100755113066, 'grm_norm': 'cosine', 'self_loops': True, 'use_snp_selection': True, 'num_snps': 52027}. Best is trial 98 with value: 0.25308949405017456.
[I 2025-11-12 23:50:36,092] Trial 122 finished with value: 0.23494830844788953 and parameters: {'model_type': 'graphsage', 'hidden_dims': '[512, 64]', 'dropout': 0.5452488969996149, 'batch_norm': False, 'lr': 2.2080634911132e-05, 'weight_decay': 1.3232915692105966e-07, 'epochs': 182, 'loss': 'mae', 'optimizer': 'adam', 'graph_mode': 'cutoff', 'cutoff': 0.34466642117613977, 'grm_norm': 'cosine', 'self_loops': True, 'use_snp_selection': True, 'num_snps': 54624}. Best is trial 98 with value: 0.25308949405017456.
[I 2025-11-12 23:52:36,220] Trial 123 finished with value: 0.16945505475676542 and parameters: {'model_type': 'graphsage', 'hidden_dims': '[256, 128]', 'dropout': 0.45751702844749503, 'batch_norm': False, 'lr': 0.00039654517966580664, 'weight_decay': 2.2418438284078497e-07, 'epochs': 213, 'loss': 'mae', 'optimizer': 'adam', 'graph_mode': 'cutoff', 'cutoff': 0.40566112045459757, 'grm_norm': 'cosine', 'self_loops': True, 'use_snp_selection': True, 'num_snps': 48774}. Best is trial 98 with value: 0.25308949405017456.
[I 2025-11-12 23:55:47,963] Trial 124 finished with value: 0.2379915912313329 and parameters: {'model_type': 'graphsage', 'hidden_dims': '[512, 256]', 'dropout': 0.5199337657579632, 'batch_norm': False, 'lr': 7.278301547545939e-05, 'weight_decay': 3.1097178857931115e-07, 'epochs': 228, 'loss': 'mae', 'optimizer': 'adam', 'graph_mode': 'cutoff', 'cutoff': 0.3221013956378623, 'grm_norm': 'cosine', 'self_loops': True, 'use_snp_selection': True, 'num_snps': 50983}. Best is trial 98 with value: 0.25308949405017456.
[I 2025-11-12 23:58:29,797] Trial 125 finished with value: 0.23567318901498954 and parameters: {'model_type': 'graphsage', 'hidden_dims': '[512, 64]', 'dropout': 0.4957495864395219, 'batch_norm': False, 'lr': 4.8243441450511615e-05, 'weight_decay': 1.6410405738840714e-07, 'epochs': 190, 'loss': 'mae', 'optimizer': 'adam', 'graph_mode': 'cutoff', 'cutoff': 0.37848045911937683, 'grm_norm': 'cosine_then_gcn', 'self_loops': True, 'use_snp_selection': True, 'num_snps': 53198}. Best is trial 98 with value: 0.25308949405017456.
[I 2025-11-13 00:01:04,515] Trial 126 finished with value: 0.2437030582763918 and parameters: {'model_type': 'graphsage', 'hidden_dims': '[256, 128]', 'dropout': 0.5280066756920485, 'batch_norm': False, 'lr': 2.881200414959258e-05, 'weight_decay': 1.336289952879609e-07, 'epochs': 238, 'loss': 'mae', 'optimizer': 'adam', 'graph_mode': 'cutoff', 'cutoff': 0.36169201652337396, 'grm_norm': 'cosine', 'self_loops': True, 'use_snp_selection': True, 'num_snps': 55590}. Best is trial 98 with value: 0.25308949405017456.
[I 2025-11-13 00:04:42,639] Trial 127 finished with value: 0.2460983089570088 and parameters: {'model_type': 'graphsage', 'hidden_dims': '[512, 256]', 'dropout': 0.5325193764398495, 'batch_norm': False, 'lr': 2.875353275973836e-05, 'weight_decay': 1.995201937435882e-07, 'epochs': 238, 'loss': 'mae', 'optimizer': 'adam', 'graph_mode': 'cutoff', 'cutoff': 0.34342232820450325, 'grm_norm': 'cosine', 'self_loops': True, 'use_snp_selection': True, 'num_snps': 58507}. Best is trial 98 with value: 0.25308949405017456.
[I 2025-11-13 00:07:12,926] Trial 128 finished with value: 0.2461200218387524 and parameters: {'model_type': 'graphsage', 'hidden_dims': '[512, 256]', 'dropout': 0.59869045082371, 'batch_norm': False, 'lr': 2.716696737469629e-05, 'weight_decay': 2.6837081465876447e-07, 'epochs': 240, 'loss': 'mae', 'optimizer': 'adam', 'graph_mode': 'cutoff', 'cutoff': 0.3399456895918383, 'grm_norm': 'cosine', 'self_loops': True, 'use_snp_selection': False}. Best is trial 98 with value: 0.25308949405017456.
[I 2025-11-13 00:09:51,211] Trial 129 finished with value: 0.20477681043597934 and parameters: {'model_type': 'graphsage', 'hidden_dims': '[512, 256]', 'dropout': 0.5926339023203843, 'batch_norm': True, 'lr': 2.8374095510026933e-05, 'weight_decay': 2.656516276832053e-07, 'epochs': 239, 'loss': 'mse', 'optimizer': 'adam', 'graph_mode': 'cutoff', 'cutoff': 0.3168740682946258, 'grm_norm': 'cosine', 'self_loops': True, 'use_snp_selection': False}. Best is trial 98 with value: 0.25308949405017456.
[I 2025-11-13 00:12:30,329] Trial 130 finished with value: 0.23412142059161228 and parameters: {'model_type': 'graphsage', 'hidden_dims': '[512, 256]', 'dropout': 0.5646277462564102, 'batch_norm': False, 'lr': 2.414955066178632e-05, 'weight_decay': 1.032374903595077e-07, 'epochs': 255, 'loss': 'mae', 'optimizer': 'adam', 'graph_mode': 'cutoff', 'cutoff': 0.33853694887297786, 'grm_norm': 'cosine', 'self_loops': True, 'use_snp_selection': False}. Best is trial 98 with value: 0.25308949405017456.
[I 2025-11-13 00:15:12,514] Trial 131 finished with value: 0.23482798162605006 and parameters: {'model_type': 'graphsage', 'hidden_dims': '[512, 256]', 'dropout': 0.5322041627368329, 'batch_norm': False, 'lr': 3.127910307166081e-05, 'weight_decay': 3.410325039560654e-07, 'epochs': 233, 'loss': 'mae', 'optimizer': 'adam', 'graph_mode': 'cutoff', 'cutoff': 0.28784372001104874, 'grm_norm': 'cosine', 'self_loops': True, 'use_snp_selection': False}. Best is trial 98 with value: 0.25308949405017456.
[I 2025-11-13 00:17:41,884] Trial 132 finished with value: 0.23881979742123982 and parameters: {'model_type': 'graphsage', 'hidden_dims': '[512, 256]', 'dropout': 0.5139202789085627, 'batch_norm': False, 'lr': 1.6184195515246465e-05, 'weight_decay': 2.0995612233862153e-07, 'epochs': 244, 'loss': 'mae', 'optimizer': 'adam', 'graph_mode': 'cutoff', 'cutoff': 0.3664222207144739, 'grm_norm': 'cosine', 'self_loops': True, 'use_snp_selection': False}. Best is trial 98 with value: 0.25308949405017456.
[I 2025-11-13 00:19:59,526] Trial 133 finished with value: 0.24339249361814813 and parameters: {'model_type': 'graphsage', 'hidden_dims': '[512, 256]', 'dropout': 0.5800280209628532, 'batch_norm': False, 'lr': 2.0977605491147068e-05, 'weight_decay': 2.651517305725925e-07, 'epochs': 218, 'loss': 'mae', 'optimizer': 'adam', 'graph_mode': 'cutoff', 'cutoff': 0.34652773745037907, 'grm_norm': 'cosine', 'self_loops': True, 'use_snp_selection': False}. Best is trial 98 with value: 0.25308949405017456.
[I 2025-11-13 00:22:18,949] Trial 134 finished with value: 0.24163908975516568 and parameters: {'model_type': 'graphsage', 'hidden_dims': '[512, 256]', 'dropout': 0.5748387989692334, 'batch_norm': False, 'lr': 1.882851696291312e-05, 'weight_decay': 1.539752115707758e-07, 'epochs': 221, 'loss': 'mae', 'optimizer': 'adam', 'graph_mode': 'cutoff', 'cutoff': 0.3451542935198786, 'grm_norm': 'cosine', 'self_loops': True, 'use_snp_selection': False}. Best is trial 98 with value: 0.25308949405017456.
[I 2025-11-13 00:24:50,318] Trial 135 finished with value: 0.24612786785249732 and parameters: {'model_type': 'graphsage', 'hidden_dims': '[512, 256]', 'dropout': 0.5887194913722126, 'batch_norm': False, 'lr': 2.323358772576831e-05, 'weight_decay': 2.6249005394896944e-07, 'epochs': 236, 'loss': 'mae', 'optimizer': 'adam', 'graph_mode': 'cutoff', 'cutoff': 0.327820752340856, 'grm_norm': 'cosine', 'self_loops': True, 'use_snp_selection': False}. Best is trial 98 with value: 0.25308949405017456.
[I 2025-11-13 00:27:27,624] Trial 136 finished with value: 0.236881190996251 and parameters: {'model_type': 'graphsage', 'hidden_dims': '[512, 256]', 'dropout': 0.5969066543191425, 'batch_norm': False, 'lr': 2.447316569826647e-05, 'weight_decay': 2.4310083362806223e-07, 'epochs': 237, 'loss': 'mae', 'optimizer': 'adam', 'graph_mode': 'cutoff', 'cutoff': 0.30744577056730027, 'grm_norm': 'cosine', 'self_loops': True, 'use_snp_selection': False}. Best is trial 98 with value: 0.25308949405017456.
[I 2025-11-13 00:29:49,050] Trial 137 finished with value: 0.24131889535975098 and parameters: {'model_type': 'graphsage', 'hidden_dims': '[512, 256]', 'dropout': 0.5823317647771792, 'batch_norm': False, 'lr': 5.787966166136438e-06, 'weight_decay': 1.971448284043185e-07, 'epochs': 217, 'loss': 'mae', 'optimizer': 'adam', 'graph_mode': 'cutoff', 'cutoff': 0.3283568546535287, 'grm_norm': 'cosine', 'self_loops': True, 'use_snp_selection': False}. Best is trial 98 with value: 0.25308949405017456.
[I 2025-11-13 00:31:58,444] Trial 138 finished with value: 0.24220636894897374 and parameters: {'model_type': 'graphsage', 'hidden_dims': '[512, 256]', 'dropout': 0.5488677514161343, 'batch_norm': False, 'lr': 1.2061079201944147e-05, 'weight_decay': 2.826638131661642e-07, 'epochs': 209, 'loss': 'mae', 'optimizer': 'adam', 'graph_mode': 'cutoff', 'cutoff': 0.38298634631789835, 'grm_norm': 'cosine', 'self_loops': True, 'use_snp_selection': False}. Best is trial 98 with value: 0.25308949405017456.
