[I 2025-11-03 14:27:36,487] Trial 9 finished with value: -0.028564551554372493 and parameters: {'model_type': 'gcn', 'hidden_dims': '[512, 256]', 'dropout': 0.301734920240333, 'batch_norm': False, 'lr': 6.650961854953448e-06, 'weight_decay': 6.861575656590315e-05, 'epochs': 125, 'loss': 'mae', 'optimizer': 'adam', 'graph_mode': 'cutoff', 'cutoff': 0.2857569870061939, 'grm_norm': 'cosine_then_gcn', 'self_loops': False, 'use_snp_selection': True, 'num_snps': 12722}. Best is trial 0 with value: 0.030534265503344798.
[I 2025-11-03 14:27:40,044] Trial 10 finished with value: -0.01291327974448279 and parameters: {'model_type': 'gcn', 'hidden_dims': '[512, 64]', 'dropout': 0.22492338276159776, 'batch_norm': True, 'lr': 1.0627684039560866e-06, 'weight_decay': 0.000250012967435051, 'epochs': 341, 'loss': 'mae', 'optimizer': 'adam', 'graph_mode': 'knn', 'source': 'grm', 'knn_k': 10, 'weighted_edges': True, 'symmetrize_mode': 'union', 'use_snp_selection': False}. Best is trial 0 with value: 0.030534265503344798.
[I 2025-11-03 14:27:42,118] Trial 11 finished with value: 0.007257209279336425 and parameters: {'model_type': 'gcn', 'hidden_dims': '[256, 128]', 'dropout': 0.23881572197829581, 'batch_norm': False, 'lr': 1.4359514564783258e-06, 'weight_decay': 0.000995109761317218, 'epochs': 265, 'loss': 'mse', 'optimizer': 'adam', 'graph_mode': 'cutoff', 'cutoff': 0.8773959711672632, 'grm_norm': 'gcn', 'self_loops': True, 'use_snp_selection': True, 'num_snps': 16589}. Best is trial 0 with value: 0.030534265503344798.
[I 2025-11-03 14:27:45,940] Trial 12 finished with value: 0.039546135837983595 and parameters: {'model_type': 'gcn', 'hidden_dims': '[256, 128]', 'dropout': 0.568426629270592, 'batch_norm': True, 'lr': 7.902744370633635e-06, 'weight_decay': 1.4656842536317848e-07, 'epochs': 259, 'loss': 'mse', 'optimizer': 'adam', 'graph_mode': 'cutoff', 'cutoff': 0.48181782223539704, 'grm_norm': 'gcn', 'self_loops': False, 'use_snp_selection': True, 'num_snps': 58791}. Best is trial 12 with value: 0.039546135837983595.
[I 2025-11-03 14:27:48,075] Trial 13 finished with value: 0.014966758127077385 and parameters: {'model_type': 'gcn', 'hidden_dims': '[128, 64]', 'dropout': 0.5994574928289451, 'batch_norm': True, 'lr': 5.663582361282379e-06, 'weight_decay': 2.491073547524578e-07, 'epochs': 344, 'loss': 'mae', 'optimizer': 'adam', 'graph_mode': 'knn', 'source': 'grm', 'knn_k': 10, 'weighted_edges': True, 'symmetrize_mode': 'mutual', 'use_snp_selection': False}. Best is trial 12 with value: 0.039546135837983595.
[I 2025-11-03 14:27:50,478] Trial 14 finished with value: 0.010423752218102711 and parameters: {'model_type': 'gcn', 'hidden_dims': '[256, 128, 64]', 'dropout': 0.22530335948448305, 'batch_norm': True, 'lr': 3.6412766581046954e-06, 'weight_decay': 1.0867448101806978e-07, 'epochs': 265, 'loss': 'mse', 'optimizer': 'adam', 'graph_mode': 'cutoff', 'cutoff': 0.441913953178348, 'grm_norm': 'none', 'self_loops': False, 'use_snp_selection': False}. Best is trial 12 with value: 0.039546135837983595.
[I 2025-11-03 14:27:55,194] Trial 15 finished with value: 0.043107538838864826 and parameters: {'model_type': 'gcn', 'hidden_dims': '[512, 64]', 'dropout': 0.2926853016614418, 'batch_norm': True, 'lr': 1.3386419425187287e-05, 'weight_decay': 5.741153303248133e-05, 'epochs': 280, 'loss': 'mae', 'optimizer': 'adam', 'graph_mode': 'knn', 'source': 'grm', 'knn_k': 8, 'weighted_edges': True, 'symmetrize_mode': 'mutual', 'use_snp_selection': True, 'num_snps': 58152}. Best is trial 15 with value: 0.043107538838864826.
[I 2025-11-03 14:27:59,608] Trial 16 finished with value: -0.013463885992575376 and parameters: {'model_type': 'gcn', 'hidden_dims': '[512, 64]', 'dropout': 0.3011556646570977, 'batch_norm': True, 'lr': 1.3415777597950932e-05, 'weight_decay': 0.0001818380786918247, 'epochs': 250, 'loss': 'mae', 'optimizer': 'adam', 'graph_mode': 'cutoff', 'cutoff': 0.20962793972343124, 'grm_norm': 'cosine', 'self_loops': True, 'use_snp_selection': True, 'num_snps': 55948}. Best is trial 15 with value: 0.043107538838864826.
[I 2025-11-03 14:28:04,530] Trial 17 finished with value: 0.01816589176632958 and parameters: {'model_type': 'gcn', 'hidden_dims': '[512, 64]', 'dropout': 0.42224083023241127, 'batch_norm': True, 'lr': 0.00010014902752430644, 'weight_decay': 3.542681763171875e-06, 'epochs': 299, 'loss': 'mse', 'optimizer': 'adam', 'graph_mode': 'knn', 'source': 'grm', 'knn_k': 4, 'weighted_edges': False, 'symmetrize_mode': 'union', 'use_snp_selection': True, 'num_snps': 59605}. Best is trial 15 with value: 0.043107538838864826.
[I 2025-11-03 14:28:08,323] Trial 18 finished with value: -0.047469200473056736 and parameters: {'model_type': 'gcn', 'hidden_dims': '[512, 128]', 'dropout': 0.3120428180676207, 'batch_norm': True, 'lr': 1.5462679274051712e-05, 'weight_decay': 5.646676663578362e-07, 'epochs': 217, 'loss': 'mae', 'optimizer': 'adam', 'graph_mode': 'knn', 'source': 'grm', 'knn_k': 4, 'weighted_edges': True, 'symmetrize_mode': 'mutual', 'use_snp_selection': True, 'num_snps': 46461}. Best is trial 15 with value: 0.043107538838864826.
[I 2025-11-03 14:28:12,759] Trial 19 finished with value: 0.023852918413087943 and parameters: {'model_type': 'gcn', 'hidden_dims': '[512, 64]', 'dropout': 0.36793652278561645, 'batch_norm': True, 'lr': 6.982534395949632e-05, 'weight_decay': 4.5653865984667256e-06, 'epochs': 293, 'loss': 'mse', 'optimizer': 'adam', 'graph_mode': 'cutoff', 'cutoff': 0.45488672081676146, 'grm_norm': 'cosine_then_gcn', 'self_loops': False, 'use_snp_selection': True, 'num_snps': 52354}. Best is trial 15 with value: 0.043107538838864826.
[I 2025-11-03 14:28:15,676] Trial 20 finished with value: 0.07082609450133819 and parameters: {'model_type': 'gcn', 'hidden_dims': '[256, 128]', 'dropout': 0.4594359080586444, 'batch_norm': True, 'lr': 1.1242172288002499e-05, 'weight_decay': 0.00012046480565973243, 'epochs': 218, 'loss': 'mse', 'optimizer': 'adam', 'graph_mode': 'cutoff', 'cutoff': 0.5730561584524783, 'grm_norm': 'gcn', 'self_loops': True, 'use_snp_selection': True, 'num_snps': 38757}. Best is trial 20 with value: 0.07082609450133819.
[I 2025-11-03 14:28:18,529] Trial 21 finished with value: -0.020007654840504673 and parameters: {'model_type': 'gcn', 'hidden_dims': '[256, 128]', 'dropout': 0.47329126695903945, 'batch_norm': True, 'lr': 9.607126594070252e-06, 'weight_decay': 0.00021134793380667637, 'epochs': 230, 'loss': 'mse', 'optimizer': 'adam', 'graph_mode': 'cutoff', 'cutoff': 0.5565502109202812, 'grm_norm': 'gcn', 'self_loops': True, 'use_snp_selection': True, 'num_snps': 36783}. Best is trial 20 with value: 0.07082609450133819.
[I 2025-11-03 14:28:22,183] Trial 22 finished with value: 0.03964194305136279 and parameters: {'model_type': 'gcn', 'hidden_dims': '[256, 128]', 'dropout': 0.5463475612069749, 'batch_norm': True, 'lr': 4.662287443618611e-06, 'weight_decay': 6.448081032638972e-05, 'epochs': 199, 'loss': 'mse', 'optimizer': 'adam', 'graph_mode': 'cutoff', 'cutoff': 0.6794951991853809, 'grm_norm': 'gcn', 'self_loops': True, 'use_snp_selection': True, 'num_snps': 59672}. Best is trial 20 with value: 0.07082609450133819.
[I 2025-11-03 14:28:25,400] Trial 23 finished with value: -0.0031310654166115935 and parameters: {'model_type': 'gcn', 'hidden_dims': '[256, 128]', 'dropout': 0.46656072566908013, 'batch_norm': True, 'lr': 3.6270228790031525e-06, 'weight_decay': 6.786425623421959e-05, 'epochs': 195, 'loss': 'mse', 'optimizer': 'adam', 'graph_mode': 'cutoff', 'cutoff': 0.733993535236827, 'grm_norm': 'gcn', 'self_loops': True, 'use_snp_selection': True, 'num_snps': 49557}. Best is trial 20 with value: 0.07082609450133819.
[I 2025-11-03 14:28:26,971] Trial 24 finished with value: 0.029440024739167722 and parameters: {'model_type': 'gcn', 'hidden_dims': '[256, 128]', 'dropout': 0.44637973396991887, 'batch_norm': True, 'lr': 3.0302085299986986e-06, 'weight_decay': 0.00011190849869556531, 'epochs': 187, 'loss': 'mse', 'optimizer': 'adam', 'graph_mode': 'cutoff', 'cutoff': 0.8464051048601546, 'grm_norm': 'gcn', 'self_loops': True, 'use_snp_selection': True, 'num_snps': 4185}. Best is trial 20 with value: 0.07082609450133819.
[I 2025-11-03 14:28:30,627] Trial 25 finished with value: -0.004413327139524496 and parameters: {'model_type': 'gcn', 'hidden_dims': '[512, 64]', 'dropout': 0.5154847840390941, 'batch_norm': True, 'lr': 1.5080260024678275e-05, 'weight_decay': 0.0003665351997624353, 'epochs': 294, 'loss': 'mse', 'optimizer': 'adam', 'graph_mode': 'cutoff', 'cutoff': 0.657301020814983, 'grm_norm': 'gcn', 'self_loops': True, 'use_snp_selection': True, 'num_snps': 39344}. Best is trial 20 with value: 0.07082609450133819.
[I 2025-11-03 14:28:34,263] Trial 26 finished with value: 0.048482826669045874 and parameters: {'model_type': 'gcn', 'hidden_dims': '[256, 128]', 'dropout': 0.5564797190138333, 'batch_norm': True, 'lr': 1.9937354098458108e-05, 'weight_decay': 4.0740261691822264e-05, 'epochs': 234, 'loss': 'mae', 'optimizer': 'adam', 'graph_mode': 'knn', 'source': 'grm', 'knn_k': 8, 'weighted_edges': False, 'symmetrize_mode': 'union', 'use_snp_selection': True, 'num_snps': 54061}. Best is trial 20 with value: 0.07082609450133819.
[I 2025-11-03 14:28:38,444] Trial 27 finished with value: 0.02260258297467531 and parameters: {'model_type': 'gcn', 'hidden_dims': '[512, 128]', 'dropout': 0.5933390213721812, 'batch_norm': True, 'lr': 5.201743481540422e-05, 'weight_decay': 3.136208030397979e-05, 'epochs': 232, 'loss': 'mae', 'optimizer': 'adam', 'graph_mode': 'knn', 'source': 'grm', 'knn_k': 8, 'weighted_edges': False, 'symmetrize_mode': 'union', 'use_snp_selection': True, 'num_snps': 52407}. Best is trial 20 with value: 0.07082609450133819.
[I 2025-11-03 14:28:41,922] Trial 28 finished with value: 0.022708121789276847 and parameters: {'model_type': 'gcn', 'hidden_dims': '[256, 128, 64]', 'dropout': 0.3709838327299436, 'batch_norm': True, 'lr': 2.242763922870474e-05, 'weight_decay': 7.929565237056103e-06, 'epochs': 310, 'loss': 'mae', 'optimizer': 'adam', 'graph_mode': 'knn', 'source': 'grm', 'knn_k': 8, 'weighted_edges': False, 'symmetrize_mode': 'union', 'use_snp_selection': True, 'num_snps': 35874}. Best is trial 20 with value: 0.07082609450133819.
[I 2025-11-03 14:28:44,680] Trial 29 finished with value: -0.04540525800560838 and parameters: {'model_type': 'gcn', 'hidden_dims': '[512, 64]', 'dropout': 0.17433012434726633, 'batch_norm': True, 'lr': 2.3967349598920142e-05, 'weight_decay': 0.0004349248592375836, 'epochs': 240, 'loss': 'mae', 'optimizer': 'adam', 'graph_mode': 'knn', 'source': 'grm', 'knn_k': 5, 'weighted_edges': False, 'symmetrize_mode': 'union', 'use_snp_selection': True, 'num_snps': 24331}. Best is trial 20 with value: 0.07082609450133819.
[I 2025-11-03 14:28:48,450] Trial 30 finished with value: -0.0014811201305672077 and parameters: {'model_type': 'gcn', 'hidden_dims': '[256, 128]', 'dropout': 0.2664811213635398, 'batch_norm': True, 'lr': 1.0512769834248446e-05, 'weight_decay': 4.1055030915310045e-05, 'epochs': 276, 'loss': 'mae', 'optimizer': 'adam', 'graph_mode': 'knn', 'source': 'grm', 'knn_k': 9, 'weighted_edges': True, 'symmetrize_mode': 'mutual', 'use_snp_selection': True, 'num_snps': 52949}. Best is trial 20 with value: 0.07082609450133819.
[I 2025-11-03 14:28:52,700] Trial 31 finished with value: 0.023267277424240045 and parameters: {'model_type': 'gcn', 'hidden_dims': '[256, 128]', 'dropout': 0.5516593872747997, 'batch_norm': True, 'lr': 2.3220259295773634e-06, 'weight_decay': 9.461266017891966e-05, 'epochs': 320, 'loss': 'mae', 'optimizer': 'adam', 'graph_mode': 'knn', 'source': 'grm', 'knn_k': 6, 'weighted_edges': False, 'symmetrize_mode': 'union', 'use_snp_selection': True, 'num_snps': 59470}. Best is trial 20 with value: 0.07082609450133819.
[I 2025-11-03 14:28:56,338] Trial 32 finished with value: 0.005630050659786604 and parameters: {'model_type': 'gcn', 'hidden_dims': '[256, 128]', 'dropout': 0.47923701642515504, 'batch_norm': True, 'lr': 7.098923883911376e-06, 'weight_decay': 0.00012029568181025512, 'epochs': 210, 'loss': 'mae', 'optimizer': 'adam', 'graph_mode': 'knn', 'source': 'grm', 'knn_k': 7, 'weighted_edges': False, 'symmetrize_mode': 'union', 'use_snp_selection': True, 'num_snps': 55192}. Best is trial 20 with value: 0.07082609450133819.
[I 2025-11-03 14:28:59,557] Trial 33 finished with value: -0.009142609250665268 and parameters: {'model_type': 'gcn', 'hidden_dims': '[256, 128]', 'dropout': 0.5324076312398506, 'batch_norm': True, 'lr': 4.9794697013777255e-06, 'weight_decay': 5.0896058519412984e-05, 'epochs': 146, 'loss': 'mse', 'optimizer': 'adam', 'graph_mode': 'knn', 'source': 'grm', 'knn_k': 9, 'weighted_edges': True, 'symmetrize_mode': 'mutual', 'use_snp_selection': True, 'num_snps': 50174}. Best is trial 20 with value: 0.07082609450133819.
[I 2025-11-03 14:29:02,536] Trial 34 finished with value: -0.01835813130000332 and parameters: {'model_type': 'gcn', 'hidden_dims': '[256, 128]', 'dropout': 0.5651156821200438, 'batch_norm': True, 'lr': 1.995653399766863e-05, 'weight_decay': 1.1443906973879577e-05, 'epochs': 192, 'loss': 'mse', 'optimizer': 'adam', 'graph_mode': 'cutoff', 'cutoff': 0.6277854668572554, 'grm_norm': 'none', 'self_loops': True, 'use_snp_selection': True, 'num_snps': 42541}. Best is trial 20 with value: 0.07082609450133819.
[I 2025-11-03 14:29:05,484] Trial 35 finished with value: 0.05428820916941856 and parameters: {'model_type': 'gcn', 'hidden_dims': '[128, 64]', 'dropout': 0.3985796193153415, 'batch_norm': False, 'lr': 3.3134136285340237e-05, 'weight_decay': 0.0005176095203593711, 'epochs': 164, 'loss': 'mae', 'optimizer': 'adam', 'graph_mode': 'knn', 'source': 'grm', 'knn_k': 7, 'weighted_edges': True, 'symmetrize_mode': 'mutual', 'use_snp_selection': True, 'num_snps': 48197}. Best is trial 20 with value: 0.07082609450133819.
[I 2025-11-03 14:29:08,402] Trial 36 finished with value: 0.0041743776701733525 and parameters: {'model_type': 'gcn', 'hidden_dims': '[128, 64]', 'dropout': 0.39919923431169807, 'batch_norm': False, 'lr': 3.7268911374272975e-05, 'weight_decay': 0.0005346674131447084, 'epochs': 161, 'loss': 'mae', 'optimizer': 'adam', 'graph_mode': 'knn', 'source': 'grm', 'knn_k': 7, 'weighted_edges': True, 'symmetrize_mode': 'mutual', 'use_snp_selection': True, 'num_snps': 47549}. Best is trial 20 with value: 0.07082609450133819.
[I 2025-11-03 14:29:10,959] Trial 37 finished with value: 0.0026404958375846983 and parameters: {'model_type': 'gcn', 'hidden_dims': '[128, 64]', 'dropout': 0.3291670703759127, 'batch_norm': False, 'lr': 0.00011929229772790794, 'weight_decay': 0.00014897734730436686, 'epochs': 107, 'loss': 'mae', 'optimizer': 'adam', 'graph_mode': 'knn', 'source': 'grm', 'knn_k': 9, 'weighted_edges': True, 'symmetrize_mode': 'mutual', 'use_snp_selection': True, 'num_snps': 41155}. Best is trial 20 with value: 0.07082609450133819.
[I 2025-11-03 14:29:13,552] Trial 38 finished with value: 0.003287046190964451 and parameters: {'model_type': 'gcn', 'hidden_dims': '[128, 64]', 'dropout': 0.39627245528562033, 'batch_norm': False, 'lr': 3.110120188239982e-05, 'weight_decay': 0.000526724271068635, 'epochs': 222, 'loss': 'mae', 'optimizer': 'adam', 'graph_mode': 'knn', 'source': 'grm', 'knn_k': 5, 'weighted_edges': True, 'symmetrize_mode': 'mutual', 'use_snp_selection': True, 'num_snps': 32537}. Best is trial 20 with value: 0.07082609450133819.
[I 2025-11-03 14:29:14,793] Trial 39 finished with value: -0.027844949572425733 and parameters: {'model_type': 'gcn', 'hidden_dims': '[128, 64]', 'dropout': 0.44084371299720937, 'batch_norm': False, 'lr': 6.241329183975405e-05, 'weight_decay': 1.8883733919746335e-05, 'epochs': 61, 'loss': 'mae', 'optimizer': 'adam', 'graph_mode': 'knn', 'source': 'grm', 'knn_k': 7, 'weighted_edges': True, 'symmetrize_mode': 'mutual', 'use_snp_selection': False}. Best is trial 20 with value: 0.07082609450133819.
[I 2025-11-03 14:29:18,305] Trial 40 finished with value: 0.035365241630604394 and parameters: {'model_type': 'gcn', 'hidden_dims': '[512, 256]', 'dropout': 0.2706188460349023, 'batch_norm': False, 'lr': 1.2253126993182139e-05, 'weight_decay': 0.00032207581645407385, 'epochs': 176, 'loss': 'mae', 'optimizer': 'adam', 'graph_mode': 'knn', 'source': 'grm', 'knn_k': 8, 'weighted_edges': False, 'symmetrize_mode': 'union', 'use_snp_selection': True, 'num_snps': 45371}. Best is trial 20 with value: 0.07082609450133819.
[I 2025-11-03 14:29:21,613] Trial 41 finished with value: 0.014314202735526848 and parameters: {'model_type': 'gcn', 'hidden_dims': '[256, 128]', 'dropout': 0.5006397065080772, 'batch_norm': False, 'lr': 4.703309738219281e-06, 'weight_decay': 4.0055030975593566e-05, 'epochs': 148, 'loss': 'mse', 'optimizer': 'adam', 'graph_mode': 'cutoff', 'cutoff': 0.7799466908945105, 'grm_norm': 'cosine', 'self_loops': True, 'use_snp_selection': True, 'num_snps': 55932}. Best is trial 20 with value: 0.07082609450133819.
[I 2025-11-03 14:29:25,593] Trial 42 finished with value: 0.0544870515867262 and parameters: {'model_type': 'gcn', 'hidden_dims': '[256, 128, 64]', 'dropout': 0.5382550915983237, 'batch_norm': False, 'lr': 2.9222085552646743e-05, 'weight_decay': 7.704426229369772e-05, 'epochs': 243, 'loss': 'mae', 'optimizer': 'adam', 'graph_mode': 'knn', 'source': 'grm', 'knn_k': 6, 'weighted_edges': True, 'symmetrize_mode': 'mutual', 'use_snp_selection': True, 'num_snps': 56198}. Best is trial 20 with value: 0.07082609450133819.
[I 2025-11-03 14:29:29,536] Trial 43 finished with value: 0.012931728101990583 and parameters: {'model_type': 'gcn', 'hidden_dims': '[256, 128, 64]', 'dropout': 0.4975320057445411, 'batch_norm': False, 'lr': 3.8035373967066614e-05, 'weight_decay': 2.4487149914721128e-05, 'epochs': 281, 'loss': 'mae', 'optimizer': 'adam', 'graph_mode': 'knn', 'source': 'grm', 'knn_k': 6, 'weighted_edges': True, 'symmetrize_mode': 'mutual', 'use_snp_selection': True, 'num_snps': 50522}. Best is trial 20 with value: 0.07082609450133819.
[I 2025-11-03 14:29:33,516] Trial 44 finished with value: 0.04662789594014577 and parameters: {'model_type': 'gcn', 'hidden_dims': '[256, 128, 64]', 'dropout': 0.42040553399205094, 'batch_norm': False, 'lr': 2.7837786909335725e-05, 'weight_decay': 0.0007328089464180851, 'epochs': 249, 'loss': 'mae', 'optimizer': 'adam', 'graph_mode': 'knn', 'source': 'grm', 'knn_k': 7, 'weighted_edges': True, 'symmetrize_mode': 'mutual', 'use_snp_selection': True, 'num_snps': 55062}. Best is trial 20 with value: 0.07082609450133819.
[I 2025-11-03 14:29:37,482] Trial 45 finished with value: -0.014299135500041506 and parameters: {'model_type': 'gcn', 'hidden_dims': '[256, 128, 64]', 'dropout': 0.4327145071308226, 'batch_norm': False, 'lr': 7.729834826128672e-05, 'weight_decay': 0.0006078951289795158, 'epochs': 244, 'loss': 'mae', 'optimizer': 'adam', 'graph_mode': 'knn', 'source': 'grm', 'knn_k': 5, 'weighted_edges': True, 'symmetrize_mode': 'mutual', 'use_snp_selection': True, 'num_snps': 54658}. Best is trial 20 with value: 0.07082609450133819.
[I 2025-11-03 14:29:39,933] Trial 46 finished with value: 0.0034970451949859977 and parameters: {'model_type': 'gcn', 'hidden_dims': '[256, 128, 64]', 'dropout': 0.524504138790688, 'batch_norm': False, 'lr': 0.00019751536394454672, 'weight_decay': 0.000732405258299341, 'epochs': 253, 'loss': 'mae', 'optimizer': 'adam', 'graph_mode': 'knn', 'source': 'grm', 'knn_k': 6, 'weighted_edges': True, 'symmetrize_mode': 'mutual', 'use_snp_selection': False}. Best is trial 20 with value: 0.07082609450133819.
[I 2025-11-03 14:29:43,215] Trial 47 finished with value: 0.01271138208965421 and parameters: {'model_type': 'gcn', 'hidden_dims': '[256, 128, 64]', 'dropout': 0.41214082981102573, 'batch_norm': False, 'lr': 2.879268436932091e-05, 'weight_decay': 0.0002933255874375401, 'epochs': 176, 'loss': 'mae', 'optimizer': 'adam', 'graph_mode': 'knn', 'source': 'grm', 'knn_k': 4, 'weighted_edges': True, 'symmetrize_mode': 'mutual', 'use_snp_selection': True, 'num_snps': 47660}. Best is trial 20 with value: 0.07082609450133819.
[I 2025-11-03 14:29:45,486] Trial 48 finished with value: 0.0484935357894727 and parameters: {'model_type': 'gcn', 'hidden_dims': '[256, 128, 64]', 'dropout': 0.4557493794568279, 'batch_norm': False, 'lr': 5.2310677044128876e-05, 'weight_decay': 0.00019196020494424048, 'epochs': 213, 'loss': 'mae', 'optimizer': 'adam', 'graph_mode': 'knn', 'source': 'grm', 'knn_k': 7, 'weighted_edges': True, 'symmetrize_mode': 'mutual', 'use_snp_selection': False}. Best is trial 20 with value: 0.07082609450133819.
[I 2025-11-03 14:29:47,675] Trial 49 finished with value: -0.05154834861734264 and parameters: {'model_type': 'gcn', 'hidden_dims': '[256, 128, 64]', 'dropout': 0.45932077072611144, 'batch_norm': False, 'lr': 4.951970320818291e-05, 'weight_decay': 9.305649374356132e-05, 'epochs': 213, 'loss': 'mae', 'optimizer': 'adam', 'graph_mode': 'knn', 'source': 'grm', 'knn_k': 3, 'weighted_edges': True, 'symmetrize_mode': 'mutual', 'use_snp_selection': False}. Best is trial 20 with value: 0.07082609450133819.
[I 2025-11-03 14:29:49,778] Trial 50 finished with value: 0.022979804807151068 and parameters: {'model_type': 'gcn', 'hidden_dims': '[512, 256]', 'dropout': 0.5015793560962579, 'batch_norm': False, 'lr': 1.72214420441431e-05, 'weight_decay': 0.00018881144081855073, 'epochs': 119, 'loss': 'mae', 'optimizer': 'adam', 'graph_mode': 'knn', 'source': 'grm', 'knn_k': 7, 'weighted_edges': False, 'symmetrize_mode': 'union', 'use_snp_selection': False}. Best is trial 20 with value: 0.07082609450133819.
