[I 2025-11-03 13:17:50,164] Trial 40 finished with value: 0.0714090403012953 and parameters: {'model_type': 'graphsage', 'hidden_dims': '[512, 256]', 'dropout': 0.16223189280165148, 'batch_norm': True, 'lr': 1.729677267468725e-05, 'weight_decay': 8.209480708087439e-05, 'epochs': 186, 'loss': 'mae', 'optimizer': 'adam', 'graph_mode': 'knn', 'source': 'grm', 'knn_k': 5, 'weighted_edges': True, 'symmetrize_mode': 'union', 'use_snp_selection': False}. Best is trial 22 with value: 0.09749254593739673.
[I 2025-11-03 13:17:54,237] Trial 41 finished with value: 0.0919923597627905 and parameters: {'model_type': 'graphsage', 'hidden_dims': '[512, 256]', 'dropout': 0.3336597510659313, 'batch_norm': True, 'lr': 0.00010228761171382722, 'weight_decay': 0.0002921754844144008, 'epochs': 245, 'loss': 'mae', 'optimizer': 'adam', 'graph_mode': 'knn', 'source': 'grm', 'knn_k': 1, 'weighted_edges': True, 'symmetrize_mode': 'union', 'use_snp_selection': False}. Best is trial 22 with value: 0.09749254593739673.
[I 2025-11-03 13:17:58,177] Trial 42 finished with value: 0.06827062829140151 and parameters: {'model_type': 'graphsage', 'hidden_dims': '[512, 256]', 'dropout': 0.2755687241676763, 'batch_norm': True, 'lr': 4.725468659498228e-05, 'weight_decay': 0.00029336394357444296, 'epochs': 225, 'loss': 'mae', 'optimizer': 'adam', 'graph_mode': 'knn', 'source': 'grm', 'knn_k': 1, 'weighted_edges': True, 'symmetrize_mode': 'union', 'use_snp_selection': False}. Best is trial 22 with value: 0.09749254593739673.
[I 2025-11-03 13:18:02,510] Trial 43 finished with value: 0.09289149360485555 and parameters: {'model_type': 'graphsage', 'hidden_dims': '[512, 256]', 'dropout': 0.3441457045545558, 'batch_norm': True, 'lr': 0.00017939547565105945, 'weight_decay': 0.0005800495467743367, 'epochs': 261, 'loss': 'mae', 'optimizer': 'adam', 'graph_mode': 'knn', 'source': 'grm', 'knn_k': 2, 'weighted_edges': False, 'symmetrize_mode': 'union', 'use_snp_selection': False}. Best is trial 22 with value: 0.09749254593739673.
[I 2025-11-03 13:18:06,412] Trial 44 finished with value: 0.05155899805918501 and parameters: {'model_type': 'graphsage', 'hidden_dims': '[512, 256]', 'dropout': 0.34540018278702284, 'batch_norm': True, 'lr': 0.00028127984927797873, 'weight_decay': 0.0005437570665596862, 'epochs': 203, 'loss': 'mae', 'optimizer': 'adam', 'graph_mode': 'cutoff', 'cutoff': 0.20223379762510418, 'grm_norm': 'cosine', 'self_loops': True, 'use_snp_selection': False}. Best is trial 22 with value: 0.09749254593739673.
[I 2025-11-03 13:18:09,073] Trial 45 finished with value: 0.09534192850172463 and parameters: {'model_type': 'graphsage', 'hidden_dims': '[256, 128]', 'dropout': 0.3259974914196952, 'batch_norm': True, 'lr': 0.0001768270108369237, 'weight_decay': 0.00015760545125237502, 'epochs': 263, 'loss': 'mse', 'optimizer': 'adam', 'graph_mode': 'knn', 'source': 'grm', 'knn_k': 1, 'weighted_edges': False, 'symmetrize_mode': 'mutual', 'use_snp_selection': False}. Best is trial 22 with value: 0.09749254593739673.
[I 2025-11-03 13:18:11,736] Trial 46 finished with value: 0.09269382406778186 and parameters: {'model_type': 'graphsage', 'hidden_dims': '[256, 128]', 'dropout': 0.40464408553533593, 'batch_norm': True, 'lr': 0.0005518999718436473, 'weight_decay': 0.00013672952338682784, 'epochs': 267, 'loss': 'mse', 'optimizer': 'adam', 'graph_mode': 'knn', 'source': 'grm', 'knn_k': 1, 'weighted_edges': False, 'symmetrize_mode': 'mutual', 'use_snp_selection': False}. Best is trial 22 with value: 0.09749254593739673.
[I 2025-11-03 13:18:14,509] Trial 47 finished with value: 0.07634152553298754 and parameters: {'model_type': 'graphsage', 'hidden_dims': '[256, 128]', 'dropout': 0.45039412086616293, 'batch_norm': True, 'lr': 0.0005975294575369043, 'weight_decay': 0.00015243726840422357, 'epochs': 292, 'loss': 'mse', 'optimizer': 'adam', 'graph_mode': 'cutoff', 'cutoff': 0.4756036843430652, 'grm_norm': 'cosine_then_gcn', 'self_loops': True, 'use_snp_selection': False}. Best is trial 22 with value: 0.09749254593739673.
[I 2025-11-03 13:18:18,016] Trial 48 finished with value: 0.012982620534057389 and parameters: {'model_type': 'graphsage', 'hidden_dims': '[256, 128]', 'dropout': 0.40579093371131597, 'batch_norm': False, 'lr': 0.0009529124319708706, 'weight_decay': 8.943111560422986e-06, 'epochs': 273, 'loss': 'mse', 'optimizer': 'adam', 'graph_mode': 'knn', 'source': 'grm', 'knn_k': 1, 'weighted_edges': False, 'symmetrize_mode': 'mutual', 'use_snp_selection': True, 'num_snps': 42595}. Best is trial 22 with value: 0.09749254593739673.
[I 2025-11-03 13:18:19,995] Trial 49 finished with value: 0.08179234311585744 and parameters: {'model_type': 'graphsage', 'hidden_dims': '[256, 128]', 'dropout': 0.37243539892647715, 'batch_norm': True, 'lr': 0.00038911598023966455, 'weight_decay': 2.0661733125004774e-06, 'epochs': 90, 'loss': 'mse', 'optimizer': 'adam', 'graph_mode': 'knn', 'source': 'grm', 'knn_k': 1, 'weighted_edges': False, 'symmetrize_mode': 'mutual', 'use_snp_selection': False}. Best is trial 22 with value: 0.09749254593739673.
[I 2025-11-03 13:18:22,900] Trial 50 finished with value: 0.07068185689500381 and parameters: {'model_type': 'graphsage', 'hidden_dims': '[256, 128]', 'dropout': 0.49496617784257807, 'batch_norm': True, 'lr': 0.00017937217464342758, 'weight_decay': 0.0005712428636467793, 'epochs': 314, 'loss': 'mse', 'optimizer': 'adam', 'graph_mode': 'knn', 'source': 'grm', 'knn_k': 1, 'weighted_edges': False, 'symmetrize_mode': 'mutual', 'use_snp_selection': False}. Best is trial 22 with value: 0.09749254593739673.
[I 2025-11-03 13:18:25,581] Trial 51 finished with value: 0.09758214507615709 and parameters: {'model_type': 'graphsage', 'hidden_dims': '[256, 128]', 'dropout': 0.32847519613847587, 'batch_norm': True, 'lr': 0.0007407470363184389, 'weight_decay': 0.0004150154691045213, 'epochs': 263, 'loss': 'mse', 'optimizer': 'adam', 'graph_mode': 'knn', 'source': 'grm', 'knn_k': 1, 'weighted_edges': False, 'symmetrize_mode': 'mutual', 'use_snp_selection': False}. Best is trial 51 with value: 0.09758214507615709.
[I 2025-11-03 13:18:28,253] Trial 52 finished with value: 0.06799867326227342 and parameters: {'model_type': 'graphsage', 'hidden_dims': '[256, 128]', 'dropout': 0.40755349926879697, 'batch_norm': True, 'lr': 0.0007586369225044947, 'weight_decay': 0.0007113457710547281, 'epochs': 261, 'loss': 'mse', 'optimizer': 'adam', 'graph_mode': 'knn', 'source': 'grm', 'knn_k': 1, 'weighted_edges': False, 'symmetrize_mode': 'mutual', 'use_snp_selection': False}. Best is trial 51 with value: 0.09758214507615709.
[I 2025-11-03 13:18:31,000] Trial 53 finished with value: 0.09006277039401378 and parameters: {'model_type': 'graphsage', 'hidden_dims': '[256, 128]', 'dropout': 0.35692187542892606, 'batch_norm': True, 'lr': 0.0004398819824448749, 'weight_decay': 0.0003819489426213942, 'epochs': 278, 'loss': 'mse', 'optimizer': 'adam', 'graph_mode': 'knn', 'source': 'grm', 'knn_k': 1, 'weighted_edges': False, 'symmetrize_mode': 'mutual', 'use_snp_selection': False}. Best is trial 51 with value: 0.09758214507615709.
[I 2025-11-03 13:18:33,812] Trial 54 finished with value: 0.07741168870740715 and parameters: {'model_type': 'graphsage', 'hidden_dims': '[256, 128]', 'dropout': 0.33336032419344785, 'batch_norm': True, 'lr': 0.0004884955010065876, 'weight_decay': 0.00011970789823027557, 'epochs': 285, 'loss': 'mse', 'optimizer': 'adam', 'graph_mode': 'knn', 'source': 'grm', 'knn_k': 2, 'weighted_edges': False, 'symmetrize_mode': 'mutual', 'use_snp_selection': False}. Best is trial 51 with value: 0.09758214507615709.
[I 2025-11-03 13:18:36,669] Trial 55 finished with value: 0.08218466523870636 and parameters: {'model_type': 'graphsage', 'hidden_dims': '[256, 128]', 'dropout': 0.3824329151220671, 'batch_norm': True, 'lr': 0.0006173684320728154, 'weight_decay': 0.00017664046526477242, 'epochs': 303, 'loss': 'mse', 'optimizer': 'adam', 'graph_mode': 'knn', 'source': 'grm', 'knn_k': 1, 'weighted_edges': False, 'symmetrize_mode': 'mutual', 'use_snp_selection': False}. Best is trial 51 with value: 0.09758214507615709.
[I 2025-11-03 13:18:40,680] Trial 56 finished with value: 0.07780029015438432 and parameters: {'model_type': 'graphsage', 'hidden_dims': '[512, 128]', 'dropout': 0.32865474974004655, 'batch_norm': True, 'lr': 0.0002770110308949554, 'weight_decay': 0.000369939433293149, 'epochs': 241, 'loss': 'mse', 'optimizer': 'adam', 'graph_mode': 'cutoff', 'cutoff': 0.6348143251083176, 'grm_norm': 'cosine_then_gcn', 'self_loops': True, 'use_snp_selection': False}. Best is trial 51 with value: 0.09758214507615709.
[I 2025-11-03 13:18:43,392] Trial 57 finished with value: 0.08880793506487433 and parameters: {'model_type': 'graphsage', 'hidden_dims': '[256, 128]', 'dropout': 0.3593917177372243, 'batch_norm': True, 'lr': 0.0007211022409323927, 'weight_decay': 0.0005995317211697978, 'epochs': 263, 'loss': 'mse', 'optimizer': 'adam', 'graph_mode': 'knn', 'source': 'grm', 'knn_k': 2, 'weighted_edges': False, 'symmetrize_mode': 'mutual', 'use_snp_selection': False}. Best is trial 51 with value: 0.09758214507615709.
[I 2025-11-03 13:18:45,937] Trial 58 finished with value: 0.10702293360901656 and parameters: {'model_type': 'graphsage', 'hidden_dims': '[256, 128]', 'dropout': 0.44376089714823996, 'batch_norm': True, 'lr': 0.0001478806957554295, 'weight_decay': 5.927054045539615e-05, 'epochs': 232, 'loss': 'mse', 'optimizer': 'adam', 'graph_mode': 'knn', 'source': 'grm', 'knn_k': 1, 'weighted_edges': False, 'symmetrize_mode': 'mutual', 'use_snp_selection': False}. Best is trial 58 with value: 0.10702293360901656.
[I 2025-11-03 13:18:48,528] Trial 59 finished with value: 0.08216063042881228 and parameters: {'model_type': 'graphsage', 'hidden_dims': '[256, 128]', 'dropout': 0.4703426637144336, 'batch_norm': True, 'lr': 0.00022793966148580006, 'weight_decay': 6.097060501846239e-05, 'epochs': 228, 'loss': 'mse', 'optimizer': 'adam', 'graph_mode': 'knn', 'source': 'grm', 'knn_k': 3, 'weighted_edges': False, 'symmetrize_mode': 'mutual', 'use_snp_selection': False}. Best is trial 58 with value: 0.10702293360901656.
[I 2025-11-03 13:18:51,074] Trial 60 finished with value: 0.09888354991632547 and parameters: {'model_type': 'graphsage', 'hidden_dims': '[256, 128]', 'dropout': 0.5275372845126998, 'batch_norm': False, 'lr': 0.0003298006576638847, 'weight_decay': 2.658148121623754e-05, 'epochs': 256, 'loss': 'mse', 'optimizer': 'adam', 'graph_mode': 'knn', 'source': 'grm', 'knn_k': 1, 'weighted_edges': False, 'symmetrize_mode': 'mutual', 'use_snp_selection': True, 'num_snps': 19019}. Best is trial 58 with value: 0.10702293360901656.
[I 2025-11-03 13:18:53,581] Trial 61 finished with value: 0.08880729102457777 and parameters: {'model_type': 'graphsage', 'hidden_dims': '[256, 128]', 'dropout': 0.5511188859227385, 'batch_norm': False, 'lr': 0.00031880724189869416, 'weight_decay': 1.2411582031748908e-05, 'epochs': 257, 'loss': 'mse', 'optimizer': 'adam', 'graph_mode': 'knn', 'source': 'grm', 'knn_k': 1, 'weighted_edges': False, 'symmetrize_mode': 'mutual', 'use_snp_selection': True, 'num_snps': 18538}. Best is trial 58 with value: 0.10702293360901656.
[I 2025-11-03 13:18:55,633] Trial 62 finished with value: 0.026453733078212187 and parameters: {'model_type': 'graphsage', 'hidden_dims': '[256, 128]', 'dropout': 0.48564394370906666, 'batch_norm': False, 'lr': 0.0001563373245674391, 'weight_decay': 2.614158228700914e-05, 'epochs': 270, 'loss': 'mse', 'optimizer': 'adam', 'graph_mode': 'knn', 'source': 'grm', 'knn_k': 2, 'weighted_edges': False, 'symmetrize_mode': 'mutual', 'use_snp_selection': True, 'num_snps': 2782}. Best is trial 58 with value: 0.10702293360901656.
[I 2025-11-03 13:18:58,285] Trial 63 finished with value: 0.06051794463202295 and parameters: {'model_type': 'graphsage', 'hidden_dims': '[256, 128]', 'dropout': 0.5888029859754771, 'batch_norm': False, 'lr': 0.0009961993361235744, 'weight_decay': 9.329060590102237e-05, 'epochs': 252, 'loss': 'mse', 'optimizer': 'adam', 'graph_mode': 'knn', 'source': 'grm', 'knn_k': 1, 'weighted_edges': False, 'symmetrize_mode': 'mutual', 'use_snp_selection': True, 'num_snps': 21764}. Best is trial 58 with value: 0.10702293360901656.
[I 2025-11-03 13:19:01,619] Trial 64 finished with value: 0.04508117759216324 and parameters: {'model_type': 'graphsage', 'hidden_dims': '[256, 128]', 'dropout': 0.5496085943390916, 'batch_norm': False, 'lr': 0.0003808219499550218, 'weight_decay': 1.589712628478452e-05, 'epochs': 281, 'loss': 'mse', 'optimizer': 'adam', 'graph_mode': 'knn', 'source': 'grm', 'knn_k': 2, 'weighted_edges': False, 'symmetrize_mode': 'mutual', 'use_snp_selection': True, 'num_snps': 36983}. Best is trial 58 with value: 0.10702293360901656.
[I 2025-11-03 13:19:03,653] Trial 65 finished with value: 0.045457762279017044 and parameters: {'model_type': 'graphsage', 'hidden_dims': '[256, 128]', 'dropout': 0.4367993173985189, 'batch_norm': False, 'lr': 0.00020420198157770236, 'weight_decay': 3.0002517484852026e-05, 'epochs': 213, 'loss': 'mse', 'optimizer': 'adam', 'graph_mode': 'knn', 'source': 'grm', 'knn_k': 1, 'weighted_edges': False, 'symmetrize_mode': 'mutual', 'use_snp_selection': True, 'num_snps': 8871}. Best is trial 58 with value: 0.10702293360901656.
[I 2025-11-03 13:19:06,295] Trial 66 finished with value: 0.06883046974440095 and parameters: {'model_type': 'graphsage', 'hidden_dims': '[256, 128]', 'dropout': 0.40696513370282184, 'batch_norm': True, 'lr': 0.0006713490438338417, 'weight_decay': 6.242119699860482e-05, 'epochs': 233, 'loss': 'mse', 'optimizer': 'adam', 'graph_mode': 'knn', 'source': 'grm', 'knn_k': 2, 'weighted_edges': False, 'symmetrize_mode': 'mutual', 'use_snp_selection': False}. Best is trial 58 with value: 0.10702293360901656.
[I 2025-11-03 13:19:09,272] Trial 67 finished with value: 0.07502240031307338 and parameters: {'model_type': 'graphsage', 'hidden_dims': '[256, 128, 64]', 'dropout': 0.5134173934311365, 'batch_norm': True, 'lr': 0.0005065239691207428, 'weight_decay': 0.00022933873805295436, 'epochs': 295, 'loss': 'mse', 'optimizer': 'adam', 'graph_mode': 'knn', 'source': 'grm', 'knn_k': 1, 'weighted_edges': False, 'symmetrize_mode': 'mutual', 'use_snp_selection': False}. Best is trial 58 with value: 0.10702293360901656.
[I 2025-11-03 13:19:11,711] Trial 68 finished with value: 0.07603540896658471 and parameters: {'model_type': 'graphsage', 'hidden_dims': '[512, 128]', 'dropout': 0.5261655148680383, 'batch_norm': True, 'lr': 0.0008611716381622822, 'weight_decay': 0.0001186461710019463, 'epochs': 45, 'loss': 'mse', 'optimizer': 'adam', 'graph_mode': 'cutoff', 'cutoff': 0.7695254472293385, 'grm_norm': 'cosine', 'self_loops': False, 'use_snp_selection': False}. Best is trial 58 with value: 0.10702293360901656.
[I 2025-11-03 13:19:14,682] Trial 69 finished with value: 0.08145437390401186 and parameters: {'model_type': 'graphsage', 'hidden_dims': '[256, 128]', 'dropout': 0.4489718726262057, 'batch_norm': True, 'lr': 0.00012905664438870668, 'weight_decay': 0.00016137079611394127, 'epochs': 310, 'loss': 'mse', 'optimizer': 'adam', 'graph_mode': 'knn', 'source': 'grm', 'knn_k': 3, 'weighted_edges': False, 'symmetrize_mode': 'mutual', 'use_snp_selection': False}. Best is trial 58 with value: 0.10702293360901656.
[I 2025-11-03 13:19:17,501] Trial 70 finished with value: 0.08510187648672017 and parameters: {'model_type': 'graphsage', 'hidden_dims': '[256, 128]', 'dropout': 0.3185729516632795, 'batch_norm': False, 'lr': 0.0003411619548727658, 'weight_decay': 5.00115305847323e-05, 'epochs': 271, 'loss': 'mse', 'optimizer': 'adam', 'graph_mode': 'knn', 'source': 'grm', 'knn_k': 2, 'weighted_edges': False, 'symmetrize_mode': 'mutual', 'use_snp_selection': True, 'num_snps': 24697}. Best is trial 58 with value: 0.10702293360901656.
[I 2025-11-03 13:19:21,568] Trial 71 finished with value: 0.07692719256859938 and parameters: {'model_type': 'graphsage', 'hidden_dims': '[512, 256]', 'dropout': 0.27524906556107154, 'batch_norm': True, 'lr': 0.00010060283346773836, 'weight_decay': 0.00023749216326637187, 'epochs': 239, 'loss': 'mse', 'optimizer': 'adam', 'graph_mode': 'knn', 'source': 'grm', 'knn_k': 1, 'weighted_edges': False, 'symmetrize_mode': 'mutual', 'use_snp_selection': False}. Best is trial 58 with value: 0.10702293360901656.
[I 2025-11-03 13:19:25,657] Trial 72 finished with value: 0.0898209781262908 and parameters: {'model_type': 'graphsage', 'hidden_dims': '[512, 256]', 'dropout': 0.3428018442089437, 'batch_norm': True, 'lr': 0.0002640828837635568, 'weight_decay': 0.00042518221997356, 'epochs': 243, 'loss': 'mse', 'optimizer': 'adam', 'graph_mode': 'knn', 'source': 'grm', 'knn_k': 1, 'weighted_edges': False, 'symmetrize_mode': 'mutual', 'use_snp_selection': False}. Best is trial 58 with value: 0.10702293360901656.
[I 2025-11-03 13:19:27,776] Trial 73 finished with value: 0.08044117783339803 and parameters: {'model_type': 'graphsage', 'hidden_dims': '[128, 64]', 'dropout': 0.3748264882436633, 'batch_norm': True, 'lr': 0.00018452846172080085, 'weight_decay': 0.0003048872401797897, 'epochs': 246, 'loss': 'mse', 'optimizer': 'adam', 'graph_mode': 'knn', 'source': 'grm', 'knn_k': 1, 'weighted_edges': False, 'symmetrize_mode': 'mutual', 'use_snp_selection': False}. Best is trial 58 with value: 0.10702293360901656.
[I 2025-11-03 13:19:32,043] Trial 74 finished with value: 0.07234337421199712 and parameters: {'model_type': 'graphsage', 'hidden_dims': '[512, 256]', 'dropout': 0.2941727422482803, 'batch_norm': True, 'lr': 8.804719916148191e-05, 'weight_decay': 0.00013184350180486326, 'epochs': 265, 'loss': 'mse', 'optimizer': 'adam', 'graph_mode': 'knn', 'source': 'grm', 'knn_k': 2, 'weighted_edges': False, 'symmetrize_mode': 'mutual', 'use_snp_selection': False}. Best is trial 58 with value: 0.10702293360901656.
[I 2025-11-03 13:19:34,807] Trial 75 finished with value: 0.1225689324935553 and parameters: {'model_type': 'graphsage', 'hidden_dims': '[256, 128, 64]', 'dropout': 0.5707778349143708, 'batch_norm': True, 'lr': 0.00015587119488195817, 'weight_decay': 0.0007364076973120722, 'epochs': 255, 'loss': 'mae', 'optimizer': 'adam', 'graph_mode': 'knn', 'source': 'grm', 'knn_k': 1, 'weighted_edges': False, 'symmetrize_mode': 'union', 'use_snp_selection': False}. Best is trial 75 with value: 0.1225689324935553.
[I 2025-11-03 13:19:37,578] Trial 76 finished with value: 0.06873322380066624 and parameters: {'model_type': 'graphsage', 'hidden_dims': '[256, 128, 64]', 'dropout': 0.5669033477950665, 'batch_norm': True, 'lr': 0.00014431447787992307, 'weight_decay': 0.0007974738179639421, 'epochs': 259, 'loss': 'mse', 'optimizer': 'adam', 'graph_mode': 'knn', 'source': 'grm', 'knn_k': 2, 'weighted_edges': False, 'symmetrize_mode': 'mutual', 'use_snp_selection': False}. Best is trial 75 with value: 0.1225689324935553.
[I 2025-11-03 13:19:40,048] Trial 77 finished with value: 0.0866332357482425 and parameters: {'model_type': 'graphsage', 'hidden_dims': '[256, 128, 64]', 'dropout': 0.5268093302677933, 'batch_norm': True, 'lr': 0.0005905736552923879, 'weight_decay': 0.0009355790018536446, 'epochs': 196, 'loss': 'mae', 'optimizer': 'adam', 'graph_mode': 'knn', 'source': 'grm', 'knn_k': 1, 'weighted_edges': False, 'symmetrize_mode': 'union', 'use_snp_selection': False}. Best is trial 75 with value: 0.1225689324935553.
[I 2025-11-03 13:19:42,977] Trial 78 finished with value: 0.05804842946340051 and parameters: {'model_type': 'graphsage', 'hidden_dims': '[256, 128, 64]', 'dropout': 0.5746466255126836, 'batch_norm': True, 'lr': 0.0002453360588311111, 'weight_decay': 0.0004712658125797466, 'epochs': 286, 'loss': 'mae', 'optimizer': 'adam', 'graph_mode': 'knn', 'source': 'grm', 'knn_k': 2, 'weighted_edges': False, 'symmetrize_mode': 'union', 'use_snp_selection': False}. Best is trial 75 with value: 0.1225689324935553.
[I 2025-11-03 13:19:45,706] Trial 79 finished with value: 0.08360543209242538 and parameters: {'model_type': 'graphsage', 'hidden_dims': '[256, 128, 64]', 'dropout': 0.4212793651433407, 'batch_norm': True, 'lr': 0.0004059432017965012, 'weight_decay': 8.200938472919199e-05, 'epochs': 252, 'loss': 'mse', 'optimizer': 'adam', 'graph_mode': 'knn', 'source': 'grm', 'knn_k': 1, 'weighted_edges': False, 'symmetrize_mode': 'mutual', 'use_snp_selection': False}. Best is trial 75 with value: 0.1225689324935553.
[I 2025-11-03 13:19:50,723] Trial 80 finished with value: 0.02460132196713254 and parameters: {'model_type': 'graphsage', 'hidden_dims': '[512, 64]', 'dropout': 0.4776614390463572, 'batch_norm': False, 'lr': 0.0007711996906547345, 'weight_decay': 0.0006816365556306886, 'epochs': 218, 'loss': 'mae', 'optimizer': 'adam', 'graph_mode': 'knn', 'source': 'grm', 'knn_k': 3, 'weighted_edges': False, 'symmetrize_mode': 'union', 'use_snp_selection': True, 'num_snps': 51689}. Best is trial 75 with value: 0.1225689324935553.
[I 2025-11-03 13:19:54,681] Trial 81 finished with value: 0.05640017187990888 and parameters: {'model_type': 'graphsage', 'hidden_dims': '[512, 256]', 'dropout': 0.3108233884208784, 'batch_norm': True, 'lr': 7.506815375891053e-05, 'weight_decay': 0.0002079727767454189, 'epochs': 227, 'loss': 'mae', 'optimizer': 'adam', 'graph_mode': 'knn', 'source': 'grm', 'knn_k': 1, 'weighted_edges': False, 'symmetrize_mode': 'union', 'use_snp_selection': False}. Best is trial 75 with value: 0.1225689324935553.
[I 2025-11-03 13:19:57,346] Trial 82 finished with value: 0.09132308881324908 and parameters: {'model_type': 'graphsage', 'hidden_dims': '[256, 128]', 'dropout': 0.3473338661869481, 'batch_norm': True, 'lr': 5.456876291012276e-05, 'weight_decay': 0.0003373238163621855, 'epochs': 250, 'loss': 'mae', 'optimizer': 'adam', 'graph_mode': 'knn', 'source': 'grm', 'knn_k': 1, 'weighted_edges': False, 'symmetrize_mode': 'union', 'use_snp_selection': False}. Best is trial 75 with value: 0.1225689324935553.
