[I 2025-11-03 13:34:13,751] Trial 61 finished with value: 0.15672242512195594 and parameters: {'model_type': 'gcn', 'hidden_dims': '[512, 256]', 'dropout': 0.208587189189505, 'batch_norm': True, 'lr': 0.0007828354663482748, 'weight_decay': 3.5359338265246786e-07, 'epochs': 43, 'loss': 'mae', 'optimizer': 'adam', 'graph_mode': 'off', 'use_snp_selection': False}. Best is trial 12 with value: 0.18004558573078439.
[I 2025-11-03 13:34:15,428] Trial 62 finished with value: 0.162821604987183 and parameters: {'model_type': 'gcn', 'hidden_dims': '[512, 256]', 'dropout': 0.2622563828008761, 'batch_norm': True, 'lr': 0.0006417972212233602, 'weight_decay': 1.7243570082049429e-07, 'epochs': 85, 'loss': 'mae', 'optimizer': 'adam', 'graph_mode': 'off', 'use_snp_selection': False}. Best is trial 12 with value: 0.18004558573078439.
[I 2025-11-03 13:34:17,109] Trial 63 finished with value: 0.1740171563198868 and parameters: {'model_type': 'gcn', 'hidden_dims': '[512, 256]', 'dropout': 0.301090380462756, 'batch_norm': True, 'lr': 0.0005432319593127119, 'weight_decay': 2.867431356820358e-07, 'epochs': 83, 'loss': 'mae', 'optimizer': 'adam', 'graph_mode': 'off', 'use_snp_selection': False}. Best is trial 12 with value: 0.18004558573078439.
[I 2025-11-03 13:34:20,480] Trial 64 finished with value: 0.14351359273047162 and parameters: {'model_type': 'gcn', 'hidden_dims': '[512, 256]', 'dropout': 0.35733202971212913, 'batch_norm': True, 'lr': 0.00020595544752259474, 'weight_decay': 2.6070728714301803e-07, 'epochs': 235, 'loss': 'mae', 'optimizer': 'adam', 'graph_mode': 'off', 'use_snp_selection': False}. Best is trial 12 with value: 0.18004558573078439.
[I 2025-11-03 13:34:22,066] Trial 65 finished with value: 0.15527074616425918 and parameters: {'model_type': 'gcn', 'hidden_dims': '[512, 256]', 'dropout': 0.30067685193015803, 'batch_norm': True, 'lr': 0.000496708151046961, 'weight_decay': 2.570612182261741e-05, 'epochs': 76, 'loss': 'mae', 'optimizer': 'adam', 'graph_mode': 'off', 'use_snp_selection': False}. Best is trial 12 with value: 0.18004558573078439.
[I 2025-11-03 13:34:23,315] Trial 66 finished with value: 0.14150475907193258 and parameters: {'model_type': 'gcn', 'hidden_dims': '[256, 128]', 'dropout': 0.2328353485582626, 'batch_norm': True, 'lr': 0.0003674945579557773, 'weight_decay': 7.282025967733933e-07, 'epochs': 101, 'loss': 'mae', 'optimizer': 'adam', 'graph_mode': 'off', 'use_snp_selection': False}. Best is trial 12 with value: 0.18004558573078439.
[I 2025-11-03 13:34:24,511] Trial 67 finished with value: 0.15997557102797239 and parameters: {'model_type': 'gcn', 'hidden_dims': '[128, 64]', 'dropout': 0.1327714604591717, 'batch_norm': True, 'lr': 0.00025879827738726726, 'weight_decay': 1.0029969640641982e-07, 'epochs': 157, 'loss': 'mae', 'optimizer': 'adam', 'graph_mode': 'off', 'use_snp_selection': False}. Best is trial 12 with value: 0.18004558573078439.
[I 2025-11-03 13:34:26,757] Trial 68 finished with value: 0.13839400854758385 and parameters: {'model_type': 'gcn', 'hidden_dims': '[512, 128]', 'dropout': 0.33959695428389175, 'batch_norm': False, 'lr': 0.0005511280769585186, 'weight_decay': 1.6658528709117979e-06, 'epochs': 136, 'loss': 'mae', 'optimizer': 'adam', 'graph_mode': 'off', 'use_snp_selection': False}. Best is trial 12 with value: 0.18004558573078439.
[I 2025-11-03 13:34:28,316] Trial 69 finished with value: 0.11806394566250598 and parameters: {'model_type': 'gcn', 'hidden_dims': '[256, 128, 64]', 'dropout': 0.15263109196352656, 'batch_norm': True, 'lr': 5.739108186902761e-05, 'weight_decay': 1.1763524435779575e-06, 'epochs': 126, 'loss': 'mae', 'optimizer': 'adam', 'graph_mode': 'off', 'use_snp_selection': False}. Best is trial 12 with value: 0.18004558573078439.
[I 2025-11-03 13:34:31,867] Trial 70 finished with value: 0.16243063126835888 and parameters: {'model_type': 'gcn', 'hidden_dims': '[512, 256]', 'dropout': 0.1690629810944949, 'batch_norm': True, 'lr': 0.0008443648285875865, 'weight_decay': 5.061363355227848e-07, 'epochs': 251, 'loss': 'mse', 'optimizer': 'adam', 'graph_mode': 'off', 'use_snp_selection': False}. Best is trial 12 with value: 0.18004558573078439.
[I 2025-11-03 13:34:33,564] Trial 71 finished with value: 0.1752818895567235 and parameters: {'model_type': 'gcn', 'hidden_dims': '[512, 256]', 'dropout': 0.2110589697906376, 'batch_norm': True, 'lr': 0.00056113530078528, 'weight_decay': 3.918500092091913e-07, 'epochs': 86, 'loss': 'mae', 'optimizer': 'adam', 'graph_mode': 'off', 'use_snp_selection': False}. Best is trial 12 with value: 0.18004558573078439.
[I 2025-11-03 13:34:35,336] Trial 72 finished with value: 0.16000840133483502 and parameters: {'model_type': 'gcn', 'hidden_dims': '[512, 256]', 'dropout': 0.18580951469143137, 'batch_norm': True, 'lr': 0.0005638644261241509, 'weight_decay': 1.9026632965523276e-07, 'epochs': 91, 'loss': 'mae', 'optimizer': 'adam', 'graph_mode': 'off', 'use_snp_selection': False}. Best is trial 12 with value: 0.18004558573078439.
[I 2025-11-03 13:34:37,936] Trial 73 finished with value: 0.15958630312432057 and parameters: {'model_type': 'gcn', 'hidden_dims': '[512, 256]', 'dropout': 0.25893915768442605, 'batch_norm': True, 'lr': 0.0004246184025999452, 'weight_decay': 2.546319073332884e-07, 'epochs': 167, 'loss': 'mae', 'optimizer': 'adam', 'graph_mode': 'off', 'use_snp_selection': False}. Best is trial 12 with value: 0.18004558573078439.
[I 2025-11-03 13:34:39,279] Trial 74 finished with value: 0.16559378648089515 and parameters: {'model_type': 'gcn', 'hidden_dims': '[512, 256]', 'dropout': 0.19684403918097182, 'batch_norm': True, 'lr': 0.00036656208747653217, 'weight_decay': 4.3110772344212007e-07, 'epochs': 57, 'loss': 'mae', 'optimizer': 'adam', 'graph_mode': 'off', 'use_snp_selection': False}. Best is trial 12 with value: 0.18004558573078439.
[I 2025-11-03 13:34:40,764] Trial 75 finished with value: 0.06046756117463422 and parameters: {'model_type': 'gcn', 'hidden_dims': '[512, 256]', 'dropout': 0.45138215410925625, 'batch_norm': True, 'lr': 6.52498741310575e-06, 'weight_decay': 9.697190886745726e-07, 'epochs': 70, 'loss': 'mae', 'optimizer': 'adam', 'graph_mode': 'off', 'use_snp_selection': False}. Best is trial 12 with value: 0.18004558573078439.
[I 2025-11-03 13:34:41,766] Trial 76 finished with value: 0.062259923310361516 and parameters: {'model_type': 'gcn', 'hidden_dims': '[512, 128]', 'dropout': 0.2741646266833088, 'batch_norm': True, 'lr': 0.0009941333483100422, 'weight_decay': 1.4106187442413234e-07, 'epochs': 115, 'loss': 'mae', 'optimizer': 'adam', 'graph_mode': 'off', 'use_snp_selection': True, 'num_snps': 3325}. Best is trial 12 with value: 0.18004558573078439.
[I 2025-11-03 13:34:44,486] Trial 77 finished with value: 0.1690780858717559 and parameters: {'model_type': 'gcn', 'hidden_dims': '[512, 256]', 'dropout': 0.10993276608959583, 'batch_norm': True, 'lr': 0.0002511239444302668, 'weight_decay': 9.40757995921625e-06, 'epochs': 175, 'loss': 'mae', 'optimizer': 'adam', 'graph_mode': 'off', 'use_snp_selection': False}. Best is trial 12 with value: 0.18004558573078439.
[I 2025-11-03 13:34:47,581] Trial 78 finished with value: 0.1566290912003496 and parameters: {'model_type': 'gcn', 'hidden_dims': '[512, 256]', 'dropout': 0.2353814706899718, 'batch_norm': True, 'lr': 0.0006043856641800442, 'weight_decay': 7.051562383896798e-07, 'epochs': 204, 'loss': 'mae', 'optimizer': 'adam', 'graph_mode': 'off', 'use_snp_selection': False}. Best is trial 12 with value: 0.18004558573078439.
[I 2025-11-03 13:34:50,410] Trial 79 finished with value: 0.1449284891643637 and parameters: {'model_type': 'gcn', 'hidden_dims': '[512, 64]', 'dropout': 0.21934252645445995, 'batch_norm': False, 'lr': 0.0003127250992710885, 'weight_decay': 3.5440696586496004e-05, 'epochs': 190, 'loss': 'mae', 'optimizer': 'adam', 'graph_mode': 'off', 'use_snp_selection': False}. Best is trial 12 with value: 0.18004558573078439.
[I 2025-11-03 13:34:51,671] Trial 80 finished with value: 0.1545900983614934 and parameters: {'model_type': 'gcn', 'hidden_dims': '[256, 128]', 'dropout': 0.12781505955839198, 'batch_norm': True, 'lr': 0.0007830893507871791, 'weight_decay': 2.3586387449911e-06, 'epochs': 100, 'loss': 'mae', 'optimizer': 'adam', 'graph_mode': 'off', 'use_snp_selection': False}. Best is trial 12 with value: 0.18004558573078439.
[I 2025-11-03 13:34:53,266] Trial 81 finished with value: 0.1720139347280362 and parameters: {'model_type': 'gcn', 'hidden_dims': '[512, 256]', 'dropout': 0.21061005789809695, 'batch_norm': True, 'lr': 0.0004607994971319999, 'weight_decay': 3.0332215274254753e-07, 'epochs': 76, 'loss': 'mae', 'optimizer': 'adam', 'graph_mode': 'off', 'use_snp_selection': False}. Best is trial 12 with value: 0.18004558573078439.
[I 2025-11-03 13:34:54,705] Trial 82 finished with value: 0.14998414717237052 and parameters: {'model_type': 'gcn', 'hidden_dims': '[512, 256]', 'dropout': 0.24941308459982042, 'batch_norm': True, 'lr': 0.00038957062203680146, 'weight_decay': 2.892410861945577e-07, 'epochs': 66, 'loss': 'mae', 'optimizer': 'adam', 'graph_mode': 'off', 'use_snp_selection': False}. Best is trial 12 with value: 0.18004558573078439.
[I 2025-11-03 13:34:57,989] Trial 83 finished with value: 0.16819449454524707 and parameters: {'model_type': 'gcn', 'hidden_dims': '[512, 256]', 'dropout': 0.14168241335438092, 'batch_norm': True, 'lr': 0.00048451782851793656, 'weight_decay': 3.8983339883635836e-07, 'epochs': 218, 'loss': 'mae', 'optimizer': 'adam', 'graph_mode': 'off', 'use_snp_selection': False}. Best is trial 12 with value: 0.18004558573078439.
[I 2025-11-03 13:34:59,194] Trial 84 finished with value: 0.157909961803128 and parameters: {'model_type': 'gcn', 'hidden_dims': '[512, 256]', 'dropout': 0.1873921899934822, 'batch_norm': True, 'lr': 0.00018809714737068805, 'weight_decay': 2.1974707835605155e-07, 'epochs': 45, 'loss': 'mae', 'optimizer': 'adam', 'graph_mode': 'off', 'use_snp_selection': False}. Best is trial 12 with value: 0.18004558573078439.
[I 2025-11-03 13:35:00,909] Trial 85 finished with value: 0.07991640559752906 and parameters: {'model_type': 'gcn', 'hidden_dims': '[512, 128]', 'dropout': 0.21305844001833638, 'batch_norm': True, 'lr': 1.9357913149218693e-05, 'weight_decay': 1.2614147032507267e-07, 'epochs': 86, 'loss': 'mae', 'optimizer': 'adam', 'graph_mode': 'off', 'use_snp_selection': False}. Best is trial 12 with value: 0.18004558573078439.
[I 2025-11-03 13:35:03,238] Trial 86 finished with value: 0.1508875023794574 and parameters: {'model_type': 'gcn', 'hidden_dims': '[512, 256]', 'dropout': 0.16055151662873302, 'batch_norm': True, 'lr': 0.0002924171601823185, 'weight_decay': 4.7556866833205354e-07, 'epochs': 143, 'loss': 'mae', 'optimizer': 'adam', 'graph_mode': 'off', 'use_snp_selection': False}. Best is trial 12 with value: 0.18004558573078439.
[I 2025-11-03 13:35:06,311] Trial 87 finished with value: 0.14971764921265654 and parameters: {'model_type': 'gcn', 'hidden_dims': '[512, 256]', 'dropout': 0.37919380767450356, 'batch_norm': True, 'lr': 0.0005982387409663024, 'weight_decay': 5.995723788455756e-07, 'epochs': 181, 'loss': 'mse', 'optimizer': 'adam', 'graph_mode': 'off', 'use_snp_selection': True, 'num_snps': 43141}. Best is trial 12 with value: 0.18004558573078439.
[I 2025-11-03 13:35:07,090] Trial 88 finished with value: 0.16316095525751792 and parameters: {'model_type': 'gcn', 'hidden_dims': '[128, 64]', 'dropout': 0.29289450270669526, 'batch_norm': True, 'lr': 0.0004404295074716816, 'weight_decay': 1.3467302859039299e-06, 'epochs': 64, 'loss': 'mae', 'optimizer': 'adam', 'graph_mode': 'off', 'use_snp_selection': False}. Best is trial 12 with value: 0.18004558573078439.
[I 2025-11-03 13:35:10,266] Trial 89 finished with value: 0.15486792025399912 and parameters: {'model_type': 'gcn', 'hidden_dims': '[256, 128, 64]', 'dropout': 0.169792972476634, 'batch_norm': True, 'lr': 0.00013024942736376298, 'weight_decay': 1.8953772650736985e-07, 'epochs': 332, 'loss': 'mae', 'optimizer': 'adam', 'graph_mode': 'off', 'use_snp_selection': False}. Best is trial 12 with value: 0.18004558573078439.
[I 2025-11-03 13:35:14,179] Trial 90 finished with value: 0.16686329382595583 and parameters: {'model_type': 'gcn', 'hidden_dims': '[512, 128]', 'dropout': 0.2051690899354683, 'batch_norm': True, 'lr': 0.00032911357138050836, 'weight_decay': 2.956439487448789e-07, 'epochs': 280, 'loss': 'mae', 'optimizer': 'adam', 'graph_mode': 'off', 'use_snp_selection': False}. Best is trial 12 with value: 0.18004558573078439.
[I 2025-11-03 13:35:15,796] Trial 91 finished with value: 0.1637577612055539 and parameters: {'model_type': 'gcn', 'hidden_dims': '[512, 256]', 'dropout': 0.21817412450481521, 'batch_norm': True, 'lr': 0.0007221816416297814, 'weight_decay': 3.903287255376325e-07, 'epochs': 77, 'loss': 'mae', 'optimizer': 'adam', 'graph_mode': 'off', 'use_snp_selection': False}. Best is trial 12 with value: 0.18004558573078439.
[I 2025-11-03 13:35:20,510] Trial 92 finished with value: 0.16004682332090037 and parameters: {'model_type': 'gcn', 'hidden_dims': '[512, 256]', 'dropout': 0.23004055202811766, 'batch_norm': True, 'lr': 0.0008163459714084055, 'weight_decay': 7.902815544925959e-07, 'epochs': 350, 'loss': 'mae', 'optimizer': 'adam', 'graph_mode': 'off', 'use_snp_selection': False}. Best is trial 12 with value: 0.18004558573078439.
[I 2025-11-03 13:35:22,314] Trial 93 finished with value: 0.16442873019430895 and parameters: {'model_type': 'gcn', 'hidden_dims': '[512, 256]', 'dropout': 0.19462639627037187, 'batch_norm': True, 'lr': 0.0005279383158144316, 'weight_decay': 3.417845729501121e-07, 'epochs': 91, 'loss': 'mae', 'optimizer': 'adam', 'graph_mode': 'off', 'use_snp_selection': False}. Best is trial 12 with value: 0.18004558573078439.
[I 2025-11-03 13:35:24,247] Trial 94 finished with value: 0.18051859857720093 and parameters: {'model_type': 'gcn', 'hidden_dims': '[512, 256]', 'dropout': 0.2522299531459268, 'batch_norm': True, 'lr': 0.0006924073422441726, 'weight_decay': 5.194252431528502e-07, 'epochs': 108, 'loss': 'mae', 'optimizer': 'adam', 'graph_mode': 'off', 'use_snp_selection': False}. Best is trial 94 with value: 0.18051859857720093.
[I 2025-11-03 13:35:26,187] Trial 95 finished with value: 0.165685856023574 and parameters: {'model_type': 'gcn', 'hidden_dims': '[512, 256]', 'dropout': 0.2383735240653786, 'batch_norm': True, 'lr': 0.0002314631272631412, 'weight_decay': 9.65554609103704e-07, 'epochs': 108, 'loss': 'mae', 'optimizer': 'adam', 'graph_mode': 'off', 'use_snp_selection': False}. Best is trial 94 with value: 0.18051859857720093.
[I 2025-11-03 13:35:28,812] Trial 96 finished with value: 0.1668059992766412 and parameters: {'model_type': 'gcn', 'hidden_dims': '[512, 256]', 'dropout': 0.25024116202747887, 'batch_norm': True, 'lr': 0.00041572613900581456, 'weight_decay': 6.436758811725817e-07, 'epochs': 162, 'loss': 'mae', 'optimizer': 'adam', 'graph_mode': 'off', 'use_snp_selection': False}. Best is trial 94 with value: 0.18051859857720093.
[I 2025-11-03 13:35:31,235] Trial 97 finished with value: 0.02399988299236103 and parameters: {'model_type': 'gcn', 'hidden_dims': '[512, 64]', 'dropout': 0.3007211998401225, 'batch_norm': False, 'lr': 0.0006335865453266343, 'weight_decay': 8.210498558227192e-05, 'epochs': 151, 'loss': 'mae', 'optimizer': 'adam', 'graph_mode': 'off', 'use_snp_selection': False}. Best is trial 94 with value: 0.18051859857720093.
[I 2025-11-03 13:35:33,472] Trial 98 finished with value: 0.15167665793809587 and parameters: {'model_type': 'gcn', 'hidden_dims': '[512, 256]', 'dropout': 0.27023173520090593, 'batch_norm': True, 'lr': 0.00016286043279323725, 'weight_decay': 1.1739185257522746e-05, 'epochs': 132, 'loss': 'mae', 'optimizer': 'adam', 'graph_mode': 'off', 'use_snp_selection': False}. Best is trial 94 with value: 0.18051859857720093.
[I 2025-11-03 13:35:35,270] Trial 99 finished with value: 0.16236427195583727 and parameters: {'model_type': 'gcn', 'hidden_dims': '[512, 128]', 'dropout': 0.18034184988501759, 'batch_norm': True, 'lr': 0.000869455072290643, 'weight_decay': 1.926620706172976e-05, 'epochs': 93, 'loss': 'mse', 'optimizer': 'adam', 'graph_mode': 'off', 'use_snp_selection': False}. Best is trial 94 with value: 0.18051859857720093.
[I 2025-11-03 13:35:38,137] Trial 100 finished with value: 0.17033540529437918 and parameters: {'model_type': 'gcn', 'hidden_dims': '[512, 256]', 'dropout': 0.11300031997299353, 'batch_norm': True, 'lr': 0.0004919946047724708, 'weight_decay': 4.80636345973349e-07, 'epochs': 116, 'loss': 'mae', 'optimizer': 'adam', 'graph_mode': 'off', 'use_snp_selection': True, 'num_snps': 50880}. Best is trial 94 with value: 0.18051859857720093.
[I 2025-11-03 13:35:41,077] Trial 101 finished with value: 0.16764165730864747 and parameters: {'model_type': 'gcn', 'hidden_dims': '[512, 256]', 'dropout': 0.10592528337359972, 'batch_norm': True, 'lr': 0.0005047899349440765, 'weight_decay': 5.380051486827534e-07, 'epochs': 121, 'loss': 'mae', 'optimizer': 'adam', 'graph_mode': 'off', 'use_snp_selection': True, 'num_snps': 52820}. Best is trial 94 with value: 0.18051859857720093.
[I 2025-11-03 13:35:43,356] Trial 102 finished with value: 0.17910400528238266 and parameters: {'model_type': 'gcn', 'hidden_dims': '[512, 256]', 'dropout': 0.11471004812390259, 'batch_norm': True, 'lr': 0.00034609187583048575, 'weight_decay': 4.5347518135687806e-07, 'epochs': 111, 'loss': 'mae', 'optimizer': 'adam', 'graph_mode': 'off', 'use_snp_selection': True, 'num_snps': 37782}. Best is trial 94 with value: 0.18051859857720093.
[I 2025-11-03 13:35:45,364] Trial 103 finished with value: 0.15629668039606426 and parameters: {'model_type': 'gcn', 'hidden_dims': '[512, 256]', 'dropout': 0.1302829119176532, 'batch_norm': True, 'lr': 0.0003596221235120266, 'weight_decay': 8.679455245948191e-07, 'epochs': 82, 'loss': 'mae', 'optimizer': 'adam', 'graph_mode': 'off', 'use_snp_selection': True, 'num_snps': 35965}. Best is trial 94 with value: 0.18051859857720093.
[I 2025-11-03 13:35:47,180] Trial 104 finished with value: 0.161318031582957 and parameters: {'model_type': 'gcn', 'hidden_dims': '[512, 256]', 'dropout': 0.14295327632044408, 'batch_norm': True, 'lr': 0.00027197173973622304, 'weight_decay': 1.7428548594621568e-06, 'epochs': 103, 'loss': 'mae', 'optimizer': 'adam', 'graph_mode': 'off', 'use_snp_selection': True, 'num_snps': 25759}. Best is trial 94 with value: 0.18051859857720093.
[I 2025-11-03 13:35:50,978] Trial 105 finished with value: 0.15660953709858996 and parameters: {'model_type': 'gcn', 'hidden_dims': '[512, 256]', 'dropout': 0.15208210381688517, 'batch_norm': True, 'lr': 0.0003371645941108941, 'weight_decay': 1.2875192621680492e-06, 'epochs': 309, 'loss': 'mae', 'optimizer': 'adam', 'graph_mode': 'off', 'use_snp_selection': True, 'num_snps': 37594}. Best is trial 94 with value: 0.18051859857720093.
[I 2025-11-03 13:35:52,037] Trial 106 finished with value: 0.15730278683892596 and parameters: {'model_type': 'gcn', 'hidden_dims': '[256, 128]', 'dropout': 0.3300521525252054, 'batch_norm': True, 'lr': 0.0006941961858874942, 'weight_decay': 2.5646213591984233e-07, 'epochs': 70, 'loss': 'mae', 'optimizer': 'adam', 'graph_mode': 'off', 'use_snp_selection': False}. Best is trial 94 with value: 0.18051859857720093.
[I 2025-11-03 13:35:54,347] Trial 107 finished with value: 0.16681889643486725 and parameters: {'model_type': 'gcn', 'hidden_dims': '[512, 256]', 'dropout': 0.16517034273885076, 'batch_norm': True, 'lr': 0.00043268322708039567, 'weight_decay': 4.112460787451387e-07, 'epochs': 140, 'loss': 'mae', 'optimizer': 'adam', 'graph_mode': 'off', 'use_snp_selection': False}. Best is trial 94 with value: 0.18051859857720093.
[I 2025-11-03 13:35:56,998] Trial 108 finished with value: 0.16472803738095035 and parameters: {'model_type': 'gcn', 'hidden_dims': '[512, 128]', 'dropout': 0.11664513627790059, 'batch_norm': True, 'lr': 0.00021609942141072338, 'weight_decay': 1.479891204784473e-07, 'epochs': 166, 'loss': 'mae', 'optimizer': 'adam', 'graph_mode': 'off', 'use_snp_selection': False}. Best is trial 94 with value: 0.18051859857720093.
[I 2025-11-03 13:35:58,536] Trial 109 finished with value: 0.14364406843235966 and parameters: {'model_type': 'gcn', 'hidden_dims': '[512, 256]', 'dropout': 0.2217752212995524, 'batch_norm': True, 'lr': 0.0005703236201597012, 'weight_decay': 6.266235117519581e-07, 'epochs': 129, 'loss': 'mae', 'optimizer': 'adam', 'graph_mode': 'off', 'use_snp_selection': True, 'num_snps': 14950}. Best is trial 94 with value: 0.18051859857720093.
[I 2025-11-03 13:36:00,053] Trial 110 finished with value: 0.11950932641996784 and parameters: {'model_type': 'gcn', 'hidden_dims': '[128, 64]', 'dropout': 0.12415205806402131, 'batch_norm': True, 'lr': 0.00010527770923374774, 'weight_decay': 2.1904593762189773e-07, 'epochs': 228, 'loss': 'mae', 'optimizer': 'adam', 'graph_mode': 'off', 'use_snp_selection': False}. Best is trial 94 with value: 0.18051859857720093.
[I 2025-11-03 13:36:02,811] Trial 111 finished with value: 0.1801146372735045 and parameters: {'model_type': 'gcn', 'hidden_dims': '[512, 256]', 'dropout': 0.10053898055022681, 'batch_norm': True, 'lr': 0.00047790666556814444, 'weight_decay': 4.5080523383728796e-07, 'epochs': 117, 'loss': 'mae', 'optimizer': 'adam', 'graph_mode': 'off', 'use_snp_selection': True, 'num_snps': 47880}. Best is trial 94 with value: 0.18051859857720093.
[I 2025-11-03 13:36:04,821] Trial 112 finished with value: 0.18151155069920277 and parameters: {'model_type': 'gcn', 'hidden_dims': '[512, 256]', 'dropout': 0.10559161358415742, 'batch_norm': True, 'lr': 0.00040047685741621505, 'weight_decay': 2.887543183442192e-07, 'epochs': 113, 'loss': 'mae', 'optimizer': 'adam', 'graph_mode': 'off', 'use_snp_selection': True, 'num_snps': 29301}. Best is trial 112 with value: 0.18151155069920277.
