[I 2025-11-03 15:53:48,943] Trial 143 finished with value: 0.0854803692659239 and parameters: {'model_type': 'graphsage', 'hidden_dims': '[512, 128]', 'dropout': 0.5512159460138164, 'batch_norm': True, 'lr': 0.0005339597984855135, 'weight_decay': 1.3452573714964268e-05, 'epochs': 325, 'loss': 'mae', 'optimizer': 'adam', 'graph_mode': 'knn', 'source': 'grm', 'knn_k': 1, 'weighted_edges': True, 'symmetrize_mode': 'union', 'use_snp_selection': False}. Best is trial 72 with value: 0.11572043655915205.
[I 2025-11-03 15:53:56,279] Trial 144 finished with value: 0.09561837983580299 and parameters: {'model_type': 'graphsage', 'hidden_dims': '[512, 128]', 'dropout': 0.5826199992873702, 'batch_norm': True, 'lr': 0.0003748464756948699, 'weight_decay': 1.8534141678948954e-07, 'epochs': 312, 'loss': 'mae', 'optimizer': 'adam', 'graph_mode': 'knn', 'source': 'grm', 'knn_k': 1, 'weighted_edges': True, 'symmetrize_mode': 'union', 'use_snp_selection': False}. Best is trial 72 with value: 0.11572043655915205.
[I 2025-11-03 15:54:00,212] Trial 145 finished with value: 0.08580229135770462 and parameters: {'model_type': 'graphsage', 'hidden_dims': '[256, 128, 64]', 'dropout': 0.5628956402289406, 'batch_norm': True, 'lr': 0.0008548546346528221, 'weight_decay': 1.1316356108810994e-05, 'epochs': 263, 'loss': 'mae', 'optimizer': 'adam', 'graph_mode': 'knn', 'source': 'grm', 'knn_k': 1, 'weighted_edges': True, 'symmetrize_mode': 'union', 'use_snp_selection': False}. Best is trial 72 with value: 0.11572043655915205.
[I 2025-11-03 15:54:07,581] Trial 146 finished with value: 0.10119184530862357 and parameters: {'model_type': 'graphsage', 'hidden_dims': '[512, 128]', 'dropout': 0.31191120316553855, 'batch_norm': False, 'lr': 0.00024717079648788986, 'weight_decay': 0.00010171192717071742, 'epochs': 320, 'loss': 'mae', 'optimizer': 'adam', 'graph_mode': 'knn', 'source': 'grm', 'knn_k': 1, 'weighted_edges': True, 'symmetrize_mode': 'union', 'use_snp_selection': False}. Best is trial 72 with value: 0.11572043655915205.
[I 2025-11-03 15:54:11,488] Trial 147 finished with value: 0.10767494374965804 and parameters: {'model_type': 'graphsage', 'hidden_dims': '[512, 128]', 'dropout': 0.31395398573087235, 'batch_norm': False, 'lr': 0.0002587696016549004, 'weight_decay': 0.0001576099248274386, 'epochs': 319, 'loss': 'mse', 'optimizer': 'adam', 'graph_mode': 'knn', 'source': 'grm', 'knn_k': 1, 'weighted_edges': True, 'symmetrize_mode': 'union', 'use_snp_selection': True, 'num_snps': 18940}. Best is trial 72 with value: 0.11572043655915205.
[I 2025-11-03 15:54:15,816] Trial 148 finished with value: 0.12059693638114807 and parameters: {'model_type': 'graphsage', 'hidden_dims': '[512, 128]', 'dropout': 0.3245141263018791, 'batch_norm': False, 'lr': 0.0002336331015580094, 'weight_decay': 0.00019185831365669607, 'epochs': 321, 'loss': 'mse', 'optimizer': 'adam', 'graph_mode': 'knn', 'source': 'grm', 'knn_k': 1, 'weighted_edges': True, 'symmetrize_mode': 'union', 'use_snp_selection': True, 'num_snps': 21648}. Best is trial 148 with value: 0.12059693638114807.
[I 2025-11-03 15:54:20,155] Trial 149 finished with value: 0.10821272061058058 and parameters: {'model_type': 'graphsage', 'hidden_dims': '[512, 128]', 'dropout': 0.31053183653531286, 'batch_norm': False, 'lr': 0.00024344707016548425, 'weight_decay': 0.0001550559694690339, 'epochs': 320, 'loss': 'mse', 'optimizer': 'adam', 'graph_mode': 'knn', 'source': 'grm', 'knn_k': 1, 'weighted_edges': True, 'symmetrize_mode': 'union', 'use_snp_selection': True, 'num_snps': 22613}. Best is trial 148 with value: 0.12059693638114807.
[I 2025-11-03 15:54:26,378] Trial 0 finished with value: 0.10122822311220886 and parameters: {'model_type': 'graphsage', 'hidden_dims': '[128, 64]', 'dropout': 0.199031432379812, 'batch_norm': True, 'lr': 1.8408544111075837e-06, 'weight_decay': 5.5136510071208614e-05, 'epochs': 336, 'loss': 'mae', 'optimizer': 'adam', 'graph_mode': 'knn', 'source': 'grm', 'knn_k': 8, 'weighted_edges': True, 'symmetrize_mode': 'mutual', 'use_snp_selection': False}. Best is trial 0 with value: 0.10122822311220886.
[I 2025-11-03 15:54:28,925] Trial 1 finished with value: 0.17738091980546125 and parameters: {'model_type': 'graphsage', 'hidden_dims': '[128, 64]', 'dropout': 0.40051947670227217, 'batch_norm': True, 'lr': 0.0005320428882732732, 'weight_decay': 1.89210117736594e-06, 'epochs': 68, 'loss': 'mse', 'optimizer': 'adam', 'graph_mode': 'knn', 'source': 'grm', 'knn_k': 7, 'weighted_edges': True, 'symmetrize_mode': 'union', 'use_snp_selection': False}. Best is trial 1 with value: 0.17738091980546125.
[I 2025-11-03 15:54:32,805] Trial 2 finished with value: 0.10451163659416099 and parameters: {'model_type': 'graphsage', 'hidden_dims': '[256, 128]', 'dropout': 0.5105528289184642, 'batch_norm': False, 'lr': 0.0006804279372404962, 'weight_decay': 0.0008922815224257085, 'epochs': 181, 'loss': 'mse', 'optimizer': 'adam', 'graph_mode': 'cutoff', 'cutoff': 0.5741905641612706, 'grm_norm': 'gcn', 'self_loops': False, 'use_snp_selection': True, 'num_snps': 26910}. Best is trial 1 with value: 0.17738091980546125.
[I 2025-11-03 15:54:37,001] Trial 3 finished with value: 0.12424392923530414 and parameters: {'model_type': 'graphsage', 'hidden_dims': '[256, 128, 64]', 'dropout': 0.5390483213624292, 'batch_norm': False, 'lr': 3.4705625989073525e-05, 'weight_decay': 2.4623319020131338e-05, 'epochs': 121, 'loss': 'mse', 'optimizer': 'adam', 'graph_mode': 'knn', 'source': 'grm', 'knn_k': 6, 'weighted_edges': False, 'symmetrize_mode': 'mutual', 'use_snp_selection': True, 'num_snps': 30713}. Best is trial 1 with value: 0.17738091980546125.
[I 2025-11-03 15:54:40,614] Trial 4 finished with value: 0.09721371475112468 and parameters: {'model_type': 'graphsage', 'hidden_dims': '[128, 64]', 'dropout': 0.13404863676897502, 'batch_norm': False, 'lr': 0.0001431556295367288, 'weight_decay': 2.2084517750726675e-05, 'epochs': 51, 'loss': 'mae', 'optimizer': 'adam', 'graph_mode': 'cutoff', 'cutoff': 0.6714268476993044, 'grm_norm': 'none', 'self_loops': False, 'use_snp_selection': True, 'num_snps': 45645}. Best is trial 1 with value: 0.17738091980546125.
[I 2025-11-03 15:54:45,625] Trial 5 finished with value: 0.1518778481389409 and parameters: {'model_type': 'graphsage', 'hidden_dims': '[256, 128]', 'dropout': 0.42253606323412096, 'batch_norm': False, 'lr': 4.238630400638805e-05, 'weight_decay': 8.074086040046576e-07, 'epochs': 158, 'loss': 'mae', 'optimizer': 'adam', 'graph_mode': 'knn', 'source': 'grm', 'knn_k': 1, 'weighted_edges': False, 'symmetrize_mode': 'mutual', 'use_snp_selection': True, 'num_snps': 43113}. Best is trial 1 with value: 0.17738091980546125.
[I 2025-11-03 15:54:53,370] Trial 6 finished with value: 0.1751166474420691 and parameters: {'model_type': 'graphsage', 'hidden_dims': '[512, 256]', 'dropout': 0.3534893146320237, 'batch_norm': True, 'lr': 0.000251307964226932, 'weight_decay': 1.821819791794022e-05, 'epochs': 223, 'loss': 'mae', 'optimizer': 'adam', 'graph_mode': 'knn', 'source': 'grm', 'knn_k': 1, 'weighted_edges': True, 'symmetrize_mode': 'mutual', 'use_snp_selection': False}. Best is trial 1 with value: 0.17738091980546125.
[I 2025-11-03 15:55:00,107] Trial 7 finished with value: 0.15417863171760365 and parameters: {'model_type': 'graphsage', 'hidden_dims': '[512, 256]', 'dropout': 0.1105825955860775, 'batch_norm': True, 'lr': 2.374338412754043e-05, 'weight_decay': 1.1284721123340274e-05, 'epochs': 190, 'loss': 'mse', 'optimizer': 'adam', 'graph_mode': 'cutoff', 'cutoff': 0.719872204109604, 'grm_norm': 'gcn', 'self_loops': False, 'use_snp_selection': False}. Best is trial 1 with value: 0.17738091980546125.
[I 2025-11-03 15:55:05,663] Trial 8 finished with value: 0.1530709953348035 and parameters: {'model_type': 'graphsage', 'hidden_dims': '[512, 128]', 'dropout': 0.5066580418354021, 'batch_norm': True, 'lr': 0.00039213678276659976, 'weight_decay': 3.43655320802934e-06, 'epochs': 120, 'loss': 'mse', 'optimizer': 'adam', 'graph_mode': 'cutoff', 'cutoff': 0.34923059576505366, 'grm_norm': 'cosine', 'self_loops': True, 'use_snp_selection': False}. Best is trial 1 with value: 0.17738091980546125.
[I 2025-11-03 15:55:09,253] Trial 9 finished with value: 0.07019174022955238 and parameters: {'model_type': 'graphsage', 'hidden_dims': '[512, 256]', 'dropout': 0.301734920240333, 'batch_norm': False, 'lr': 6.650961854953448e-06, 'weight_decay': 6.861575656590315e-05, 'epochs': 150, 'loss': 'mae', 'optimizer': 'adam', 'graph_mode': 'cutoff', 'cutoff': 0.2857569870061939, 'grm_norm': 'cosine_then_gcn', 'self_loops': False, 'use_snp_selection': True, 'num_snps': 12722}. Best is trial 1 with value: 0.17738091980546125.
[I 2025-11-03 15:55:13,097] Trial 10 finished with value: 0.17128521197912422 and parameters: {'model_type': 'graphsage', 'hidden_dims': '[512, 64]', 'dropout': 0.2923745636750988, 'batch_norm': True, 'lr': 0.00010001966977255833, 'weight_decay': 1.2618827301366646e-07, 'epochs': 41, 'loss': 'mse', 'optimizer': 'adam', 'graph_mode': 'knn', 'source': 'grm', 'knn_k': 10, 'weighted_edges': True, 'symmetrize_mode': 'union', 'use_snp_selection': False}. Best is trial 1 with value: 0.17738091980546125.
[I 2025-11-03 15:55:22,327] Trial 11 finished with value: 0.17569190900731946 and parameters: {'model_type': 'graphsage', 'hidden_dims': '[512, 256]', 'dropout': 0.3719635790172371, 'batch_norm': True, 'lr': 0.000791308626346835, 'weight_decay': 1.8187594072837697e-06, 'epochs': 269, 'loss': 'mae', 'optimizer': 'adam', 'graph_mode': 'knn', 'source': 'grm', 'knn_k': 1, 'weighted_edges': True, 'symmetrize_mode': 'union', 'use_snp_selection': False}. Best is trial 1 with value: 0.17738091980546125.
[I 2025-11-03 15:55:27,741] Trial 12 finished with value: 0.16411142173820503 and parameters: {'model_type': 'graphsage', 'hidden_dims': '[128, 64]', 'dropout': 0.4114983712460624, 'batch_norm': True, 'lr': 0.0005914978871227773, 'weight_decay': 1.5741178562840553e-06, 'epochs': 278, 'loss': 'mse', 'optimizer': 'adam', 'graph_mode': 'knn', 'source': 'grm', 'knn_k': 4, 'weighted_edges': True, 'symmetrize_mode': 'union', 'use_snp_selection': False}. Best is trial 1 with value: 0.17738091980546125.
[I 2025-11-03 15:55:38,302] Trial 13 finished with value: 0.16604490312152498 and parameters: {'model_type': 'graphsage', 'hidden_dims': '[512, 64]', 'dropout': 0.43999058883580466, 'batch_norm': True, 'lr': 0.0009956278186051537, 'weight_decay': 2.988812407507651e-07, 'epochs': 254, 'loss': 'mae', 'optimizer': 'adam', 'graph_mode': 'knn', 'source': 'grm', 'knn_k': 5, 'weighted_edges': True, 'symmetrize_mode': 'union', 'use_snp_selection': False}. Best is trial 1 with value: 0.17738091980546125.
[I 2025-11-03 15:55:48,771] Trial 14 finished with value: 0.1687985089566722 and parameters: {'model_type': 'graphsage', 'hidden_dims': '[256, 128, 64]', 'dropout': 0.3414866003634439, 'batch_norm': True, 'lr': 0.00014934944154064707, 'weight_decay': 1.3863650262743942e-06, 'epochs': 337, 'loss': 'mae', 'optimizer': 'adam', 'graph_mode': 'knn', 'source': 'grm', 'knn_k': 7, 'weighted_edges': True, 'symmetrize_mode': 'union', 'use_snp_selection': False}. Best is trial 1 with value: 0.17738091980546125.
[I 2025-11-03 15:55:59,431] Trial 15 finished with value: 0.07416293876167974 and parameters: {'model_type': 'graphsage', 'hidden_dims': '[512, 128]', 'dropout': 0.5939963865950504, 'batch_norm': True, 'lr': 1.0694073836019868e-05, 'weight_decay': 3.149174918256126e-06, 'epochs': 287, 'loss': 'mse', 'optimizer': 'adam', 'graph_mode': 'knn', 'source': 'grm', 'knn_k': 3, 'weighted_edges': True, 'symmetrize_mode': 'union', 'use_snp_selection': False}. Best is trial 1 with value: 0.17738091980546125.
[I 2025-11-03 15:56:02,501] Trial 16 finished with value: 0.1595332860087123 and parameters: {'model_type': 'graphsage', 'hidden_dims': '[128, 64]', 'dropout': 0.23287613659291662, 'batch_norm': True, 'lr': 0.0003034597816991226, 'weight_decay': 3.939158144371285e-07, 'epochs': 85, 'loss': 'mae', 'optimizer': 'adam', 'graph_mode': 'knn', 'source': 'grm', 'knn_k': 8, 'weighted_edges': False, 'symmetrize_mode': 'union', 'use_snp_selection': False}. Best is trial 1 with value: 0.17738091980546125.
[I 2025-11-03 15:56:11,604] Trial 17 finished with value: 0.14628618636802115 and parameters: {'model_type': 'graphsage', 'hidden_dims': '[512, 256]', 'dropout': 0.3809662175512878, 'batch_norm': True, 'lr': 6.385792704803881e-05, 'weight_decay': 4.566380259056179e-06, 'epochs': 235, 'loss': 'mse', 'optimizer': 'adam', 'graph_mode': 'knn', 'source': 'grm', 'knn_k': 3, 'weighted_edges': True, 'symmetrize_mode': 'union', 'use_snp_selection': False}. Best is trial 1 with value: 0.17738091980546125.
[I 2025-11-03 15:56:20,636] Trial 18 finished with value: 0.15812158417128497 and parameters: {'model_type': 'graphsage', 'hidden_dims': '[128, 64]', 'dropout': 0.4603741939916354, 'batch_norm': True, 'lr': 0.0009613815251426439, 'weight_decay': 0.00027433185255019526, 'epochs': 304, 'loss': 'mse', 'optimizer': 'adam', 'graph_mode': 'knn', 'source': 'grm', 'knn_k': 10, 'weighted_edges': True, 'symmetrize_mode': 'union', 'use_snp_selection': False}. Best is trial 1 with value: 0.17738091980546125.
[I 2025-11-03 15:56:25,287] Trial 19 finished with value: 0.04647275100658385 and parameters: {'model_type': 'graphsage', 'hidden_dims': '[512, 256]', 'dropout': 0.2719607917559539, 'batch_norm': True, 'lr': 1.3261425572023469e-06, 'weight_decay': 5.048578067134592e-07, 'epochs': 75, 'loss': 'mae', 'optimizer': 'adam', 'graph_mode': 'knn', 'source': 'grm', 'knn_k': 6, 'weighted_edges': False, 'symmetrize_mode': 'union', 'use_snp_selection': False}. Best is trial 1 with value: 0.17738091980546125.
[I 2025-11-03 15:56:35,742] Trial 20 finished with value: 0.17407509788195744 and parameters: {'model_type': 'graphsage', 'hidden_dims': '[512, 64]', 'dropout': 0.36632281441920655, 'batch_norm': True, 'lr': 0.00020358683920256474, 'weight_decay': 1.0870950901969905e-07, 'epochs': 214, 'loss': 'mse', 'optimizer': 'adam', 'graph_mode': 'knn', 'source': 'grm', 'knn_k': 8, 'weighted_edges': True, 'symmetrize_mode': 'union', 'use_snp_selection': False}. Best is trial 1 with value: 0.17738091980546125.
[I 2025-11-03 15:56:43,792] Trial 21 finished with value: 0.16886193103079605 and parameters: {'model_type': 'graphsage', 'hidden_dims': '[512, 256]', 'dropout': 0.3341260843549548, 'batch_norm': True, 'lr': 0.00034081512289532435, 'weight_decay': 8.301673085457391e-06, 'epochs': 238, 'loss': 'mae', 'optimizer': 'adam', 'graph_mode': 'knn', 'source': 'grm', 'knn_k': 1, 'weighted_edges': True, 'symmetrize_mode': 'mutual', 'use_snp_selection': False}. Best is trial 1 with value: 0.17738091980546125.
[I 2025-11-03 15:56:51,505] Trial 22 finished with value: 0.15703163099463793 and parameters: {'model_type': 'graphsage', 'hidden_dims': '[512, 256]', 'dropout': 0.39149031592691064, 'batch_norm': True, 'lr': 0.0004654899141828642, 'weight_decay': 1.6604792473659405e-06, 'epochs': 214, 'loss': 'mae', 'optimizer': 'adam', 'graph_mode': 'knn', 'source': 'grm', 'knn_k': 2, 'weighted_edges': True, 'symmetrize_mode': 'mutual', 'use_snp_selection': False}. Best is trial 1 with value: 0.17738091980546125.
[I 2025-11-03 15:57:00,445] Trial 23 finished with value: 0.15812262392469045 and parameters: {'model_type': 'graphsage', 'hidden_dims': '[512, 256]', 'dropout': 0.4703840332369766, 'batch_norm': True, 'lr': 0.00028273750052368936, 'weight_decay': 8.538191975409846e-06, 'epochs': 259, 'loss': 'mae', 'optimizer': 'adam', 'graph_mode': 'knn', 'source': 'grm', 'knn_k': 2, 'weighted_edges': True, 'symmetrize_mode': 'mutual', 'use_snp_selection': False}. Best is trial 1 with value: 0.17738091980546125.
[I 2025-11-03 15:57:10,032] Trial 24 finished with value: 0.16679867369727985 and parameters: {'model_type': 'graphsage', 'hidden_dims': '[512, 256]', 'dropout': 0.3292882734684936, 'batch_norm': True, 'lr': 0.00021159382985603214, 'weight_decay': 4.0741322476652046e-05, 'epochs': 295, 'loss': 'mae', 'optimizer': 'adam', 'graph_mode': 'knn', 'source': 'grm', 'knn_k': 1, 'weighted_edges': True, 'symmetrize_mode': 'mutual', 'use_snp_selection': False}. Best is trial 1 with value: 0.17738091980546125.
[I 2025-11-03 15:57:16,010] Trial 25 finished with value: 0.14879095683956942 and parameters: {'model_type': 'graphsage', 'hidden_dims': '[256, 128, 64]', 'dropout': 0.2603818781823218, 'batch_norm': True, 'lr': 8.493109052498981e-05, 'weight_decay': 4.353089676480585e-06, 'epochs': 211, 'loss': 'mae', 'optimizer': 'adam', 'graph_mode': 'knn', 'source': 'grm', 'knn_k': 4, 'weighted_edges': True, 'symmetrize_mode': 'union', 'use_snp_selection': False}. Best is trial 1 with value: 0.17738091980546125.
[I 2025-11-03 15:57:24,322] Trial 26 finished with value: 0.143961359223862 and parameters: {'model_type': 'graphsage', 'hidden_dims': '[512, 128]', 'dropout': 0.21136550024794662, 'batch_norm': False, 'lr': 0.0006377917447951632, 'weight_decay': 0.00010500176777277181, 'epochs': 166, 'loss': 'mae', 'optimizer': 'adam', 'graph_mode': 'cutoff', 'cutoff': 0.8765009073803762, 'grm_norm': 'none', 'self_loops': True, 'use_snp_selection': True, 'num_snps': 59005}. Best is trial 1 with value: 0.17738091980546125.
[I 2025-11-03 15:57:27,932] Trial 27 finished with value: 0.11129607668527397 and parameters: {'model_type': 'graphsage', 'hidden_dims': '[256, 128]', 'dropout': 0.3704153787917566, 'batch_norm': True, 'lr': 1.9937354098458108e-05, 'weight_decay': 1.6277889118009595e-05, 'epochs': 134, 'loss': 'mae', 'optimizer': 'adam', 'graph_mode': 'knn', 'source': 'grm', 'knn_k': 2, 'weighted_edges': True, 'symmetrize_mode': 'mutual', 'use_snp_selection': False}. Best is trial 1 with value: 0.17738091980546125.
[I 2025-11-03 15:57:34,566] Trial 28 finished with value: 0.14972419065475892 and parameters: {'model_type': 'graphsage', 'hidden_dims': '[128, 64]', 'dropout': 0.31120165925128157, 'batch_norm': True, 'lr': 0.0009772542494824238, 'weight_decay': 0.0001479459369197861, 'epochs': 321, 'loss': 'mse', 'optimizer': 'adam', 'graph_mode': 'knn', 'source': 'grm', 'knn_k': 5, 'weighted_edges': True, 'symmetrize_mode': 'union', 'use_snp_selection': False}. Best is trial 1 with value: 0.17738091980546125.
[I 2025-11-03 15:57:37,051] Trial 29 finished with value: 0.11754955655468992 and parameters: {'model_type': 'graphsage', 'hidden_dims': '[128, 64]', 'dropout': 0.18494675235288924, 'batch_norm': True, 'lr': 4.678972292298275e-06, 'weight_decay': 2.1843064585203454e-06, 'epochs': 93, 'loss': 'mae', 'optimizer': 'adam', 'graph_mode': 'knn', 'source': 'grm', 'knn_k': 7, 'weighted_edges': False, 'symmetrize_mode': 'mutual', 'use_snp_selection': False}. Best is trial 1 with value: 0.17738091980546125.
[I 2025-11-03 15:57:47,044] Trial 30 finished with value: 0.1526262245741287 and parameters: {'model_type': 'graphsage', 'hidden_dims': '[512, 256]', 'dropout': 0.4026852487332551, 'batch_norm': True, 'lr': 0.00012041568935991959, 'weight_decay': 8.469755052867261e-07, 'epochs': 261, 'loss': 'mae', 'optimizer': 'adam', 'graph_mode': 'knn', 'source': 'grm', 'knn_k': 3, 'weighted_edges': True, 'symmetrize_mode': 'union', 'use_snp_selection': False}. Best is trial 1 with value: 0.17738091980546125.
[I 2025-11-03 15:57:57,891] Trial 31 finished with value: 0.16444703161598045 and parameters: {'model_type': 'graphsage', 'hidden_dims': '[512, 64]', 'dropout': 0.36008366353025895, 'batch_norm': True, 'lr': 0.0002095394984464353, 'weight_decay': 1.0271309577723602e-07, 'epochs': 215, 'loss': 'mse', 'optimizer': 'adam', 'graph_mode': 'knn', 'source': 'grm', 'knn_k': 9, 'weighted_edges': True, 'symmetrize_mode': 'union', 'use_snp_selection': False}. Best is trial 1 with value: 0.17738091980546125.
[I 2025-11-03 15:58:06,899] Trial 32 finished with value: 0.15362790264625267 and parameters: {'model_type': 'graphsage', 'hidden_dims': '[512, 64]', 'dropout': 0.4421539630877481, 'batch_norm': True, 'lr': 0.00023031916216923148, 'weight_decay': 1.6658743722506235e-07, 'epochs': 179, 'loss': 'mse', 'optimizer': 'adam', 'graph_mode': 'knn', 'source': 'grm', 'knn_k': 8, 'weighted_edges': True, 'symmetrize_mode': 'union', 'use_snp_selection': False}. Best is trial 1 with value: 0.17738091980546125.
[I 2025-11-03 15:58:17,750] Trial 33 finished with value: 0.1716164389395803 and parameters: {'model_type': 'graphsage', 'hidden_dims': '[512, 64]', 'dropout': 0.36307228637087363, 'batch_norm': True, 'lr': 0.0005476658308852209, 'weight_decay': 2.4422900264188405e-07, 'epochs': 236, 'loss': 'mse', 'optimizer': 'adam', 'graph_mode': 'knn', 'source': 'grm', 'knn_k': 7, 'weighted_edges': True, 'symmetrize_mode': 'union', 'use_snp_selection': False}. Best is trial 1 with value: 0.17738091980546125.
[I 2025-11-03 15:58:20,386] Trial 34 finished with value: 0.10155268987209423 and parameters: {'model_type': 'graphsage', 'hidden_dims': '[512, 64]', 'dropout': 0.3983373963347957, 'batch_norm': False, 'lr': 0.00017231855827434827, 'weight_decay': 3.9258011383803916e-05, 'epochs': 202, 'loss': 'mse', 'optimizer': 'adam', 'graph_mode': 'cutoff', 'cutoff': 0.4293218411855253, 'grm_norm': 'cosine', 'self_loops': True, 'use_snp_selection': True, 'num_snps': 3631}. Best is trial 1 with value: 0.17738091980546125.
[I 2025-11-03 15:58:25,626] Trial 35 finished with value: 0.11174886864071443 and parameters: {'model_type': 'graphsage', 'hidden_dims': '[256, 128]', 'dropout': 0.49017685080120904, 'batch_norm': False, 'lr': 6.247789122268717e-05, 'weight_decay': 5.410012080762999e-07, 'epochs': 273, 'loss': 'mse', 'optimizer': 'adam', 'graph_mode': 'knn', 'source': 'grm', 'knn_k': 9, 'weighted_edges': True, 'symmetrize_mode': 'union', 'use_snp_selection': True, 'num_snps': 17571}. Best is trial 1 with value: 0.17738091980546125.
