[I 2025-11-12 19:35:01,044] Trial 13 finished with value: 0.22145174184135744 and parameters: {'model_type': 'graphsage', 'hidden_dims': '[512, 64]', 'dropout': 0.29043694625393646, 'batch_norm': False, 'lr': 9.358496046614984e-05, 'weight_decay': 0.0004398078832163521, 'epochs': 277, 'loss': 'mae', 'optimizer': 'adam', 'graph_mode': 'cutoff', 'cutoff': 0.6413515058900656, 'grm_norm': 'cosine_then_gcn', 'self_loops': False, 'use_snp_selection': True, 'num_snps': 45389}. Best is trial 4 with value: 0.22769278779740576.
[I 2025-11-12 19:35:51,535] Trial 14 finished with value: 0.19607361231766898 and parameters: {'model_type': 'graphsage', 'hidden_dims': '[512, 128]', 'dropout': 0.15859826720011727, 'batch_norm': False, 'lr': 1.0458019545480193e-05, 'weight_decay': 6.719896347015955e-05, 'epochs': 82, 'loss': 'mae', 'optimizer': 'adam', 'graph_mode': 'cutoff', 'cutoff': 0.39723224435083626, 'grm_norm': 'none', 'self_loops': False, 'use_snp_selection': True, 'num_snps': 17175}. Best is trial 4 with value: 0.22769278779740576.
[I 2025-11-12 19:37:05,889] Trial 15 finished with value: 0.234522930375645 and parameters: {'model_type': 'graphsage', 'hidden_dims': '[256, 128, 64]', 'dropout': 0.3166335484868066, 'batch_norm': False, 'lr': 6.9082542699866905e-06, 'weight_decay': 4.734211958324838e-06, 'epochs': 156, 'loss': 'mae', 'optimizer': 'adam', 'graph_mode': 'cutoff', 'cutoff': 0.7444247917328474, 'grm_norm': 'cosine_then_gcn', 'self_loops': False, 'use_snp_selection': True, 'num_snps': 44226}. Best is trial 15 with value: 0.234522930375645.
[I 2025-11-12 19:38:01,132] Trial 16 finished with value: 0.027456153581970066 and parameters: {'model_type': 'graphsage', 'hidden_dims': '[256, 128, 64]', 'dropout': 0.45888706612159014, 'batch_norm': False, 'lr': 1.0614361104305858e-06, 'weight_decay': 4.750582389587588e-06, 'epochs': 41, 'loss': 'mae', 'optimizer': 'adam', 'graph_mode': 'cutoff', 'cutoff': 0.7683094650930375, 'grm_norm': 'cosine', 'self_loops': True, 'use_snp_selection': True, 'num_snps': 46202}. Best is trial 15 with value: 0.234522930375645.
[I 2025-11-12 19:39:42,149] Trial 17 finished with value: 0.2231200977009237 and parameters: {'model_type': 'graphsage', 'hidden_dims': '[256, 128, 64]', 'dropout': 0.2915680488206245, 'batch_norm': False, 'lr': 0.00012788021761198608, 'weight_decay': 5.75212296692497e-07, 'epochs': 223, 'loss': 'mae', 'optimizer': 'adam', 'graph_mode': 'cutoff', 'cutoff': 0.8915096983047559, 'grm_norm': 'none', 'self_loops': False, 'use_snp_selection': True, 'num_snps': 56938}. Best is trial 15 with value: 0.234522930375645.
[I 2025-11-12 19:40:40,339] Trial 18 finished with value: 0.1992876599324349 and parameters: {'model_type': 'graphsage', 'hidden_dims': '[256, 128, 64]', 'dropout': 0.16889985278784186, 'batch_norm': False, 'lr': 1.8310772363863654e-05, 'weight_decay': 5.4206502712183754e-06, 'epochs': 87, 'loss': 'mae', 'optimizer': 'adam', 'graph_mode': 'cutoff', 'cutoff': 0.7373226460997507, 'grm_norm': 'cosine_then_gcn', 'self_loops': False, 'use_snp_selection': True, 'num_snps': 38108}. Best is trial 15 with value: 0.234522930375645.
[I 2025-11-12 19:42:07,736] Trial 19 finished with value: 0.18974153090620743 and parameters: {'model_type': 'graphsage', 'hidden_dims': '[128, 64]', 'dropout': 0.590086706833771, 'batch_norm': False, 'lr': 7.883834861563871e-05, 'weight_decay': 1.088097971313289e-07, 'epochs': 314, 'loss': 'mae', 'optimizer': 'adam', 'graph_mode': 'cutoff', 'cutoff': 0.6383496584278348, 'grm_norm': 'none', 'self_loops': True, 'use_snp_selection': True, 'num_snps': 52890}. Best is trial 15 with value: 0.234522930375645.
[I 2025-11-12 19:43:07,408] Trial 20 finished with value: 0.23489586336490847 and parameters: {'model_type': 'graphsage', 'hidden_dims': '[128, 64]', 'dropout': 0.35170831748483783, 'batch_norm': False, 'lr': 3.93692482201822e-06, 'weight_decay': 1.0193475496882375e-06, 'epochs': 152, 'loss': 'mae', 'optimizer': 'adam', 'graph_mode': 'cutoff', 'cutoff': 0.5051306861842828, 'grm_norm': 'cosine_then_gcn', 'self_loops': False, 'use_snp_selection': True, 'num_snps': 37038}. Best is trial 20 with value: 0.23489586336490847.
[I 2025-11-12 19:44:08,085] Trial 21 finished with value: 0.1955077866105151 and parameters: {'model_type': 'graphsage', 'hidden_dims': '[128, 64]', 'dropout': 0.3447944197970667, 'batch_norm': False, 'lr': 3.602646714683626e-06, 'weight_decay': 8.986187725856181e-07, 'epochs': 149, 'loss': 'mae', 'optimizer': 'adam', 'graph_mode': 'cutoff', 'cutoff': 0.49320047514527815, 'grm_norm': 'cosine_then_gcn', 'self_loops': False, 'use_snp_selection': True, 'num_snps': 35885}. Best is trial 20 with value: 0.23489586336490847.
[I 2025-11-12 19:45:20,906] Trial 22 finished with value: 0.2134533903369972 and parameters: {'model_type': 'graphsage', 'hidden_dims': '[128, 64]', 'dropout': 0.3594345211682787, 'batch_norm': False, 'lr': 3.1163165928533037e-06, 'weight_decay': 2.0690557149786135e-06, 'epochs': 216, 'loss': 'mae', 'optimizer': 'adam', 'graph_mode': 'cutoff', 'cutoff': 0.6414054481248157, 'grm_norm': 'cosine_then_gcn', 'self_loops': False, 'use_snp_selection': True, 'num_snps': 51021}. Best is trial 20 with value: 0.23489586336490847.
[I 2025-11-12 19:46:18,423] Trial 23 finished with value: 0.22093030321400392 and parameters: {'model_type': 'graphsage', 'hidden_dims': '[128, 64]', 'dropout': 0.25745364467505755, 'batch_norm': False, 'lr': 1.3838364407283202e-05, 'weight_decay': 2.9310702303566687e-07, 'epochs': 168, 'loss': 'mae', 'optimizer': 'adam', 'graph_mode': 'cutoff', 'cutoff': 0.805322134420298, 'grm_norm': 'cosine_then_gcn', 'self_loops': False, 'use_snp_selection': True, 'num_snps': 38045}. Best is trial 20 with value: 0.23489586336490847.
[I 2025-11-12 19:47:13,542] Trial 24 finished with value: 0.20796335755794337 and parameters: {'model_type': 'graphsage', 'hidden_dims': '[256, 128, 64]', 'dropout': 0.40418929851945423, 'batch_norm': False, 'lr': 6.5804829107980854e-06, 'weight_decay': 1.0068147306331986e-05, 'epochs': 131, 'loss': 'mae', 'optimizer': 'adam', 'graph_mode': 'cutoff', 'cutoff': 0.5529376662559986, 'grm_norm': 'cosine_then_gcn', 'self_loops': False, 'use_snp_selection': True, 'num_snps': 27194}. Best is trial 20 with value: 0.23489586336490847.
[I 2025-11-12 19:48:49,124] Trial 25 finished with value: 0.2346534764374022 and parameters: {'model_type': 'graphsage', 'hidden_dims': '[128, 64]', 'dropout': 0.3252183069057155, 'batch_norm': False, 'lr': 4.790604262999692e-05, 'weight_decay': 2.6213764752666e-05, 'epochs': 201, 'loss': 'mae', 'optimizer': 'adam', 'graph_mode': 'cutoff', 'cutoff': 0.4471365622395294, 'grm_norm': 'gcn', 'self_loops': False, 'use_snp_selection': True, 'num_snps': 49285}. Best is trial 20 with value: 0.23489586336490847.
[I 2025-11-12 19:51:05,821] Trial 26 finished with value: 0.19256907081410132 and parameters: {'model_type': 'graphsage', 'hidden_dims': '[256, 128]', 'dropout': 0.3356746632620092, 'batch_norm': True, 'lr': 5.386553834227075e-05, 'weight_decay': 1.5805548484509577e-06, 'epochs': 206, 'loss': 'mse', 'optimizer': 'adam', 'graph_mode': 'knn', 'source': 'grm', 'knn_k': 10, 'weighted_edges': False, 'symmetrize_mode': 'union', 'use_snp_selection': False}. Best is trial 20 with value: 0.23489586336490847.
[I 2025-11-12 19:54:09,019] Trial 27 finished with value: 0.24569925586503844 and parameters: {'model_type': 'graphsage', 'hidden_dims': '[512, 128]', 'dropout': 0.44612503446026697, 'batch_norm': False, 'lr': 4.446294938689988e-06, 'weight_decay': 4.458181100325959e-07, 'epochs': 254, 'loss': 'mae', 'optimizer': 'adam', 'graph_mode': 'cutoff', 'cutoff': 0.45078130634751495, 'grm_norm': 'gcn', 'self_loops': False, 'use_snp_selection': True, 'num_snps': 50717}. Best is trial 27 with value: 0.24569925586503844.
[I 2025-11-12 19:57:25,470] Trial 28 finished with value: 0.2339429935341549 and parameters: {'model_type': 'graphsage', 'hidden_dims': '[512, 128]', 'dropout': 0.4757700737759548, 'batch_norm': False, 'lr': 1.6753437611132277e-06, 'weight_decay': 1.6971515376807993e-07, 'epochs': 251, 'loss': 'mae', 'optimizer': 'adam', 'graph_mode': 'cutoff', 'cutoff': 0.4279535097375591, 'grm_norm': 'gcn', 'self_loops': False, 'use_snp_selection': True, 'num_snps': 52782}. Best is trial 27 with value: 0.24569925586503844.
[I 2025-11-12 20:01:02,552] Trial 29 finished with value: 0.1841138218397068 and parameters: {'model_type': 'graphsage', 'hidden_dims': '[512, 128]', 'dropout': 0.38498928664110277, 'batch_norm': True, 'lr': 4.5718492870849826e-06, 'weight_decay': 4.218118474654477e-07, 'epochs': 336, 'loss': 'mae', 'optimizer': 'adam', 'graph_mode': 'knn', 'source': 'grm', 'knn_k': 4, 'weighted_edges': True, 'symmetrize_mode': 'union', 'use_snp_selection': False}. Best is trial 27 with value: 0.24569925586503844.
[I 2025-11-12 20:04:08,697] Trial 30 finished with value: 0.2284108987259231 and parameters: {'model_type': 'graphsage', 'hidden_dims': '[512, 128]', 'dropout': 0.41607488472723764, 'batch_norm': False, 'lr': 2.0708343995195303e-06, 'weight_decay': 1.0310900163147868e-06, 'epochs': 288, 'loss': 'mae', 'optimizer': 'adam', 'graph_mode': 'cutoff', 'cutoff': 0.47942823224091347, 'grm_norm': 'gcn', 'self_loops': True, 'use_snp_selection': True, 'num_snps': 49578}. Best is trial 27 with value: 0.24569925586503844.
[I 2025-11-12 20:05:43,155] Trial 31 finished with value: 0.23259785731827462 and parameters: {'model_type': 'graphsage', 'hidden_dims': '[128, 64]', 'dropout': 0.322268604154465, 'batch_norm': False, 'lr': 2.0651000924395156e-05, 'weight_decay': 2.8583408587876254e-06, 'epochs': 243, 'loss': 'mae', 'optimizer': 'adam', 'graph_mode': 'cutoff', 'cutoff': 0.4133700246574123, 'grm_norm': 'gcn', 'self_loops': False, 'use_snp_selection': True, 'num_snps': 41755}. Best is trial 27 with value: 0.24569925586503844.
[I 2025-11-12 20:07:32,007] Trial 32 finished with value: 0.21168934771987793 and parameters: {'model_type': 'graphsage', 'hidden_dims': '[512, 64]', 'dropout': 0.45136477855496404, 'batch_norm': False, 'lr': 5.403960732886884e-06, 'weight_decay': 7.492867581635218e-06, 'epochs': 181, 'loss': 'mae', 'optimizer': 'adam', 'graph_mode': 'cutoff', 'cutoff': 0.33769062478330497, 'grm_norm': 'gcn', 'self_loops': False, 'use_snp_selection': True, 'num_snps': 33780}. Best is trial 27 with value: 0.24569925586503844.
[I 2025-11-12 20:08:50,133] Trial 33 finished with value: 0.2174354029857124 and parameters: {'model_type': 'graphsage', 'hidden_dims': '[128, 64]', 'dropout': 0.38341231361706846, 'batch_norm': False, 'lr': 1.1683297170288814e-05, 'weight_decay': 4.153229461130294e-05, 'epochs': 200, 'loss': 'mae', 'optimizer': 'adam', 'graph_mode': 'cutoff', 'cutoff': 0.45520604392543773, 'grm_norm': 'gcn', 'self_loops': False, 'use_snp_selection': True, 'num_snps': 40297}. Best is trial 27 with value: 0.24569925586503844.
[I 2025-11-12 20:10:55,407] Trial 34 finished with value: 0.18452516679397876 and parameters: {'model_type': 'graphsage', 'hidden_dims': '[256, 128, 64]', 'dropout': 0.27873517172592593, 'batch_norm': False, 'lr': 1.680169956628358e-06, 'weight_decay': 3.832370011320966e-07, 'epochs': 169, 'loss': 'mse', 'optimizer': 'adam', 'graph_mode': 'knn', 'source': 'grm', 'knn_k': 4, 'weighted_edges': False, 'symmetrize_mode': 'union', 'use_snp_selection': True, 'num_snps': 48810}. Best is trial 27 with value: 0.24569925586503844.
[I 2025-11-12 20:12:49,038] Trial 35 finished with value: 0.2362589548710771 and parameters: {'model_type': 'graphsage', 'hidden_dims': '[512, 128]', 'dropout': 0.3735342581109239, 'batch_norm': False, 'lr': 2.9537622954642845e-05, 'weight_decay': 1.5101496650358735e-06, 'epochs': 138, 'loss': 'mae', 'optimizer': 'adam', 'graph_mode': 'cutoff', 'cutoff': 0.5506493685906538, 'grm_norm': 'gcn', 'self_loops': False, 'use_snp_selection': True, 'num_snps': 55905}. Best is trial 27 with value: 0.24569925586503844.
[I 2025-11-12 20:14:11,759] Trial 36 finished with value: 0.22380531732145892 and parameters: {'model_type': 'graphsage', 'hidden_dims': '[512, 128]', 'dropout': 0.43895142023088585, 'batch_norm': True, 'lr': 5.520871736938555e-05, 'weight_decay': 1.3237030686052894e-06, 'epochs': 137, 'loss': 'mse', 'optimizer': 'adam', 'graph_mode': 'cutoff', 'cutoff': 0.5761170487669439, 'grm_norm': 'gcn', 'self_loops': False, 'use_snp_selection': False}. Best is trial 27 with value: 0.24569925586503844.
[I 2025-11-12 20:16:26,041] Trial 37 finished with value: 0.23155062935720777 and parameters: {'model_type': 'graphsage', 'hidden_dims': '[512, 128]', 'dropout': 0.37548395429601666, 'batch_norm': False, 'lr': 2.5169275110260313e-05, 'weight_decay': 6.268023203043323e-07, 'epochs': 104, 'loss': 'mae', 'optimizer': 'adam', 'graph_mode': 'knn', 'source': 'grm', 'knn_k': 10, 'weighted_edges': True, 'symmetrize_mode': 'mutual', 'use_snp_selection': True, 'num_snps': 56018}. Best is trial 27 with value: 0.24569925586503844.
[I 2025-11-12 20:18:16,506] Trial 38 finished with value: 0.23972775725412104 and parameters: {'model_type': 'graphsage', 'hidden_dims': '[256, 128]', 'dropout': 0.5037524232951647, 'batch_norm': False, 'lr': 1.4686787522082483e-05, 'weight_decay': 1.631256791889701e-05, 'epochs': 233, 'loss': 'mae', 'optimizer': 'adam', 'graph_mode': 'cutoff', 'cutoff': 0.5315053517271702, 'grm_norm': 'gcn', 'self_loops': False, 'use_snp_selection': True, 'num_snps': 55992}. Best is trial 27 with value: 0.24569925586503844.
[I 2025-11-12 20:19:40,610] Trial 39 finished with value: 0.22034235380545622 and parameters: {'model_type': 'graphsage', 'hidden_dims': '[256, 128]', 'dropout': 0.5468233155565247, 'batch_norm': True, 'lr': 3.218262151185718e-05, 'weight_decay': 2.541105425678833e-06, 'epochs': 272, 'loss': 'mse', 'optimizer': 'adam', 'graph_mode': 'cutoff', 'cutoff': 0.5565787466856831, 'grm_norm': 'gcn', 'self_loops': False, 'use_snp_selection': False}. Best is trial 27 with value: 0.24569925586503844.
[I 2025-11-12 20:22:09,569] Trial 40 finished with value: 0.22499429785400787 and parameters: {'model_type': 'graphsage', 'hidden_dims': '[256, 128]', 'dropout': 0.4917283223600363, 'batch_norm': False, 'lr': 1.5019328394763217e-05, 'weight_decay': 1.413653745445936e-05, 'epochs': 237, 'loss': 'mae', 'optimizer': 'adam', 'graph_mode': 'knn', 'source': 'grm', 'knn_k': 3, 'weighted_edges': False, 'symmetrize_mode': 'union', 'use_snp_selection': True, 'num_snps': 54422}. Best is trial 27 with value: 0.24569925586503844.
[I 2025-11-12 20:23:52,062] Trial 41 finished with value: 0.21305776945680632 and parameters: {'model_type': 'graphsage', 'hidden_dims': '[256, 128]', 'dropout': 0.5340572584755311, 'batch_norm': False, 'lr': 4.284192187753782e-05, 'weight_decay': 4.4988159561727956e-05, 'epochs': 186, 'loss': 'mae', 'optimizer': 'adam', 'graph_mode': 'cutoff', 'cutoff': 0.5331252998847783, 'grm_norm': 'gcn', 'self_loops': False, 'use_snp_selection': True, 'num_snps': 57939}. Best is trial 27 with value: 0.24569925586503844.
[I 2025-11-12 20:26:06,225] Trial 42 finished with value: 0.22592185739916165 and parameters: {'model_type': 'graphsage', 'hidden_dims': '[512, 128]', 'dropout': 0.4252301414003218, 'batch_norm': False, 'lr': 2.9428942540462556e-05, 'weight_decay': 2.8766591148662924e-05, 'epochs': 229, 'loss': 'mae', 'optimizer': 'adam', 'graph_mode': 'cutoff', 'cutoff': 0.5869919085526354, 'grm_norm': 'gcn', 'self_loops': False, 'use_snp_selection': True, 'num_snps': 48967}. Best is trial 27 with value: 0.24569925586503844.
[I 2025-11-12 20:27:12,208] Trial 43 finished with value: 0.2080329104269516 and parameters: {'model_type': 'graphsage', 'hidden_dims': '[256, 128]', 'dropout': 0.5717416410530615, 'batch_norm': False, 'lr': 9.506819932889095e-06, 'weight_decay': 1.8683714240423404e-05, 'epochs': 267, 'loss': 'mae', 'optimizer': 'adam', 'graph_mode': 'cutoff', 'cutoff': 0.5212573564829266, 'grm_norm': 'gcn', 'self_loops': False, 'use_snp_selection': True, 'num_snps': 23152}. Best is trial 27 with value: 0.24569925586503844.
[I 2025-11-12 20:29:06,117] Trial 44 finished with value: 0.13818934683125372 and parameters: {'model_type': 'graphsage', 'hidden_dims': '[128, 64]', 'dropout': 0.5157413550068778, 'batch_norm': False, 'lr': 0.0001994074163211982, 'weight_decay': 2.985535276801357e-05, 'epochs': 177, 'loss': 'mae', 'optimizer': 'adam', 'graph_mode': 'cutoff', 'cutoff': 0.4448510500515336, 'grm_norm': 'gcn', 'self_loops': False, 'use_snp_selection': True, 'num_snps': 59898}. Best is trial 27 with value: 0.24569925586503844.
[I 2025-11-12 20:31:59,491] Trial 45 finished with value: 0.2384539661344231 and parameters: {'model_type': 'graphsage', 'hidden_dims': '[512, 128]', 'dropout': 0.4787855375718424, 'batch_norm': False, 'lr': 7.766763055552445e-05, 'weight_decay': 7.815303154137273e-06, 'epochs': 208, 'loss': 'mae', 'optimizer': 'adam', 'graph_mode': 'cutoff', 'cutoff': 0.3600645277495348, 'grm_norm': 'cosine', 'self_loops': False, 'use_snp_selection': True, 'num_snps': 54658}. Best is trial 27 with value: 0.24569925586503844.
[I 2025-11-12 20:36:11,056] Trial 46 finished with value: 0.12044864370714459 and parameters: {'model_type': 'graphsage', 'hidden_dims': '[512, 128]', 'dropout': 0.4749086643626909, 'batch_norm': False, 'lr': 0.000958203671719048, 'weight_decay': 1.2645825991724136e-06, 'epochs': 294, 'loss': 'mae', 'optimizer': 'adam', 'graph_mode': 'cutoff', 'cutoff': 0.32100512805217196, 'grm_norm': 'cosine', 'self_loops': False, 'use_snp_selection': True, 'num_snps': 54980}. Best is trial 27 with value: 0.24569925586503844.
[I 2025-11-12 20:38:49,609] Trial 47 finished with value: 0.2220500914462536 and parameters: {'model_type': 'graphsage', 'hidden_dims': '[512, 128]', 'dropout': 0.4948980278245151, 'batch_norm': True, 'lr': 7.95428842668925e-05, 'weight_decay': 2.7136376568875866e-07, 'epochs': 261, 'loss': 'mse', 'optimizer': 'adam', 'graph_mode': 'cutoff', 'cutoff': 0.3841214193586739, 'grm_norm': 'cosine', 'self_loops': True, 'use_snp_selection': False}. Best is trial 27 with value: 0.24569925586503844.
[I 2025-11-12 20:43:04,577] Trial 48 finished with value: 0.21493686172467807 and parameters: {'model_type': 'graphsage', 'hidden_dims': '[512, 128]', 'dropout': 0.4317409125781706, 'batch_norm': False, 'lr': 0.00033822113581997385, 'weight_decay': 7.079207094468813e-07, 'epochs': 213, 'loss': 'mae', 'optimizer': 'adam', 'graph_mode': 'cutoff', 'cutoff': 0.2499131448828324, 'grm_norm': 'cosine', 'self_loops': False, 'use_snp_selection': True, 'num_snps': 52951}. Best is trial 27 with value: 0.24569925586503844.
[I 2025-11-12 20:46:39,643] Trial 49 finished with value: 0.2328134552516825 and parameters: {'model_type': 'graphsage', 'hidden_dims': '[512, 256]', 'dropout': 0.45951469007808626, 'batch_norm': False, 'lr': 3.7383420033957845e-06, 'weight_decay': 7.197217929850853e-06, 'epochs': 236, 'loss': 'mae', 'optimizer': 'adam', 'graph_mode': 'cutoff', 'cutoff': 0.3714559433799621, 'grm_norm': 'cosine', 'self_loops': False, 'use_snp_selection': True, 'num_snps': 59577}. Best is trial 27 with value: 0.24569925586503844.
[I 2025-11-12 20:48:02,751] Trial 50 finished with value: 0.2001066131606742 and parameters: {'model_type': 'graphsage', 'hidden_dims': '[512, 128]', 'dropout': 0.4003629025611743, 'batch_norm': False, 'lr': 1.0199206865405907e-06, 'weight_decay': 9.319080389032125e-05, 'epochs': 112, 'loss': 'mae', 'optimizer': 'adam', 'graph_mode': 'cutoff', 'cutoff': 0.29396116660039345, 'grm_norm': 'cosine', 'self_loops': False, 'use_snp_selection': True, 'num_snps': 29873}. Best is trial 27 with value: 0.24569925586503844.
[I 2025-11-12 20:50:21,572] Trial 51 finished with value: 0.23282276039070687 and parameters: {'model_type': 'graphsage', 'hidden_dims': '[512, 64]', 'dropout': 0.36029183762258765, 'batch_norm': False, 'lr': 4.6184885313792474e-05, 'weight_decay': 1.4205716685669223e-05, 'epochs': 198, 'loss': 'mae', 'optimizer': 'adam', 'graph_mode': 'cutoff', 'cutoff': 0.46491478800493574, 'grm_norm': 'gcn', 'self_loops': False, 'use_snp_selection': True, 'num_snps': 47089}. Best is trial 27 with value: 0.24569925586503844.
[I 2025-11-12 20:51:25,633] Trial 52 finished with value: 0.22670300509741606 and parameters: {'model_type': 'graphsage', 'hidden_dims': '[128, 64]', 'dropout': 0.32072262736465795, 'batch_norm': False, 'lr': 7.738499536556904e-05, 'weight_decay': 4.002378553873178e-06, 'epochs': 141, 'loss': 'mae', 'optimizer': 'adam', 'graph_mode': 'cutoff', 'cutoff': 0.6024353788093428, 'grm_norm': 'gcn', 'self_loops': False, 'use_snp_selection': True, 'num_snps': 50824}. Best is trial 27 with value: 0.24569925586503844.
[I 2025-11-12 20:53:34,275] Trial 53 finished with value: 0.23146492222711873 and parameters: {'model_type': 'graphsage', 'hidden_dims': '[512, 128]', 'dropout': 0.5393581957946805, 'batch_norm': False, 'lr': 2.5403362877634584e-06, 'weight_decay': 0.00030628360677456876, 'epochs': 166, 'loss': 'mae', 'optimizer': 'adam', 'graph_mode': 'cutoff', 'cutoff': 0.5224196488112953, 'grm_norm': 'gcn', 'self_loops': False, 'use_snp_selection': True, 'num_snps': 56368}. Best is trial 27 with value: 0.24569925586503844.
[I 2025-11-12 20:55:17,418] Trial 54 finished with value: 0.23050534548408536 and parameters: {'model_type': 'graphsage', 'hidden_dims': '[256, 128]', 'dropout': 0.26402615544292185, 'batch_norm': False, 'lr': 0.00011845574879296901, 'weight_decay': 8.222262610433584e-06, 'epochs': 213, 'loss': 'mae', 'optimizer': 'adam', 'graph_mode': 'cutoff', 'cutoff': 0.4978424997444013, 'grm_norm': 'gcn', 'self_loops': False, 'use_snp_selection': True, 'num_snps': 46780}. Best is trial 27 with value: 0.24569925586503844.
