[I 2025-10-20 20:55:03,462] Trial 79 finished with value: 0.18980860700700142 and parameters: {'model_type': 'gat', 'hidden_dims': '[256, 128]', 'dropout': 0.38705688866360877, 'batch_norm': False, 'gat_heads': 4, 'gat_attn_dropout': 0.2359169263729332, 'gat_concat_hidden': False, 'lr': 0.0006248601106596273, 'weight_decay': 0.0003169293073343791, 'epochs': 190, 'loss': 'mae', 'optimizer': 'adam', 'graph_mode': 'cutoff', 'cutoff': 0.29215792374288413, 'grm_norm': 'gcn', 'self_loops': True}. Best is trial 39 with value: 0.2716230464692288.
[I 2025-10-20 20:56:00,860] Trial 80 finished with value: 0.14345315630298955 and parameters: {'model_type': 'gat', 'hidden_dims': '[256, 128, 64]', 'dropout': 0.5562287432260378, 'batch_norm': True, 'gat_heads': 1, 'gat_attn_dropout': 0.5712122495641748, 'gat_concat_hidden': False, 'lr': 0.0005112455822899292, 'weight_decay': 9.637268973301385e-07, 'epochs': 273, 'loss': 'mae', 'optimizer': 'adam', 'graph_mode': 'cutoff', 'cutoff': 0.8242480074700648, 'grm_norm': 'cosine_then_gcn', 'self_loops': True}. Best is trial 39 with value: 0.2716230464692288.
[I 2025-10-20 20:57:54,695] Trial 81 finished with value: 0.21564667599254062 and parameters: {'model_type': 'gat', 'hidden_dims': '[512, 64]', 'dropout': 0.5096373313506006, 'batch_norm': True, 'gat_heads': 2, 'gat_attn_dropout': 0.4146736609672759, 'gat_concat_hidden': False, 'lr': 0.00047796906798403124, 'weight_decay': 0.0009872482422282373, 'epochs': 181, 'loss': 'mae', 'optimizer': 'adam', 'graph_mode': 'cutoff', 'cutoff': 0.7498506114157304, 'grm_norm': 'gcn', 'self_loops': True}. Best is trial 39 with value: 0.2716230464692288.
[I 2025-10-20 21:00:20,953] Trial 82 finished with value: 0.24464882994843795 and parameters: {'model_type': 'gat', 'hidden_dims': '[512, 64]', 'dropout': 0.49842835660878404, 'batch_norm': True, 'gat_heads': 2, 'gat_attn_dropout': 0.4341088468228702, 'gat_concat_hidden': False, 'lr': 0.00087160744878922, 'weight_decay': 0.0008351809070518422, 'epochs': 237, 'loss': 'mae', 'optimizer': 'adam', 'graph_mode': 'cutoff', 'cutoff': 0.7268032197201302, 'grm_norm': 'gcn', 'self_loops': True}. Best is trial 39 with value: 0.2716230464692288.
[I 2025-10-20 21:02:57,684] Trial 83 finished with value: 0.2500440186332067 and parameters: {'model_type': 'gat', 'hidden_dims': '[512, 64]', 'dropout': 0.47828199095794627, 'batch_norm': True, 'gat_heads': 3, 'gat_attn_dropout': 0.4918957836006828, 'gat_concat_hidden': False, 'lr': 0.0007043455070255512, 'weight_decay': 0.0005653315962451738, 'epochs': 168, 'loss': 'mae', 'optimizer': 'adam', 'graph_mode': 'cutoff', 'cutoff': 0.7640109714231812, 'grm_norm': 'gcn', 'self_loops': True}. Best is trial 39 with value: 0.2716230464692288.
[I 2025-10-20 21:05:15,464] Trial 84 finished with value: 0.24686783951014676 and parameters: {'model_type': 'gat', 'hidden_dims': '[512, 64]', 'dropout': 0.473599171554117, 'batch_norm': True, 'gat_heads': 3, 'gat_attn_dropout': 0.49046773113914793, 'gat_concat_hidden': False, 'lr': 0.0007496216115462738, 'weight_decay': 0.00046966892357670135, 'epochs': 146, 'loss': 'mae', 'optimizer': 'adam', 'graph_mode': 'cutoff', 'cutoff': 0.872564194476215, 'grm_norm': 'gcn', 'self_loops': True}. Best is trial 39 with value: 0.2716230464692288.
[I 2025-10-20 21:07:50,189] Trial 85 finished with value: 0.2529844817076193 and parameters: {'model_type': 'gat', 'hidden_dims': '[512, 64]', 'dropout': 0.4504760423158245, 'batch_norm': True, 'gat_heads': 3, 'gat_attn_dropout': 0.5090610437881194, 'gat_concat_hidden': False, 'lr': 0.0006816520070377532, 'weight_decay': 0.0005505334279422467, 'epochs': 166, 'loss': 'mae', 'optimizer': 'adam', 'graph_mode': 'cutoff', 'cutoff': 0.6812352632926046, 'grm_norm': 'gcn', 'self_loops': False}. Best is trial 39 with value: 0.2716230464692288.
[I 2025-10-20 21:11:00,924] Trial 86 finished with value: 0.19842198382591375 and parameters: {'model_type': 'gat', 'hidden_dims': '[512, 64]', 'dropout': 0.4568318736943485, 'batch_norm': False, 'gat_heads': 3, 'gat_attn_dropout': 0.5312887556891082, 'gat_concat_hidden': False, 'lr': 0.0009649414592336966, 'weight_decay': 0.0004126513754543683, 'epochs': 210, 'loss': 'mae', 'optimizer': 'adam', 'graph_mode': 'cutoff', 'cutoff': 0.6886468366904899, 'grm_norm': 'gcn', 'self_loops': False}. Best is trial 39 with value: 0.2716230464692288.
[I 2025-10-20 21:19:08,964] Trial 87 finished with value: 0.23820572436974632 and parameters: {'model_type': 'gat', 'hidden_dims': '[512, 64]', 'dropout': 0.28928013764122434, 'batch_norm': True, 'gat_heads': 8, 'gat_attn_dropout': 0.5090958006761623, 'gat_concat_hidden': False, 'lr': 0.00043066244668408344, 'weight_decay': 0.00026523943049867166, 'epochs': 196, 'loss': 'mae', 'optimizer': 'adam', 'graph_mode': 'cutoff', 'cutoff': 0.799393829443143, 'grm_norm': 'gcn', 'self_loops': False}. Best is trial 39 with value: 0.2716230464692288.
[I 2025-10-20 21:21:12,510] Trial 88 finished with value: 0.18551529526890492 and parameters: {'model_type': 'gat', 'hidden_dims': '[256, 128, 64]', 'dropout': 0.5820996901827996, 'batch_norm': True, 'gat_heads': 3, 'gat_attn_dropout': 0.5820989006772898, 'gat_concat_hidden': False, 'lr': 0.00037092177070490535, 'weight_decay': 0.0007840164565534132, 'epochs': 227, 'loss': 'mse', 'optimizer': 'adam', 'graph_mode': 'cutoff', 'cutoff': 0.7255764228409152, 'grm_norm': 'gcn', 'self_loops': False}. Best is trial 39 with value: 0.2716230464692288.
[I 2025-10-20 21:23:52,016] Trial 89 finished with value: 0.23893844250119356 and parameters: {'model_type': 'gat', 'hidden_dims': '[512, 64]', 'dropout': 0.4114848615070545, 'batch_norm': False, 'gat_heads': 4, 'gat_attn_dropout': 0.5587438447116827, 'gat_concat_hidden': False, 'lr': 0.000571894224464853, 'weight_decay': 0.0005720556107494594, 'epochs': 124, 'loss': 'mae', 'optimizer': 'adam', 'graph_mode': 'cutoff', 'cutoff': 0.8311907988258987, 'grm_norm': 'gcn', 'self_loops': False}. Best is trial 39 with value: 0.2716230464692288.
[I 2025-10-20 21:25:49,099] Trial 90 finished with value: 0.24405304704643158 and parameters: {'model_type': 'gat', 'hidden_dims': '[256, 128, 64]', 'dropout': 0.3430698687855186, 'batch_norm': True, 'gat_heads': 3, 'gat_attn_dropout': 0.450713159634067, 'gat_concat_hidden': True, 'lr': 0.00012721327999308868, 'weight_decay': 0.00035258868618744696, 'epochs': 213, 'loss': 'mae', 'optimizer': 'adam', 'graph_mode': 'cutoff', 'cutoff': 0.6913674280291382, 'grm_norm': 'cosine', 'self_loops': True}. Best is trial 39 with value: 0.2716230464692288.
[I 2025-10-20 21:28:21,409] Trial 91 finished with value: 0.24929410331577326 and parameters: {'model_type': 'gat', 'hidden_dims': '[512, 64]', 'dropout': 0.4821241631014659, 'batch_norm': True, 'gat_heads': 3, 'gat_attn_dropout': 0.4787333975935433, 'gat_concat_hidden': False, 'lr': 0.0006828313297102102, 'weight_decay': 0.000573751145181992, 'epochs': 163, 'loss': 'mae', 'optimizer': 'adam', 'graph_mode': 'cutoff', 'cutoff': 0.7519381065571581, 'grm_norm': 'gcn', 'self_loops': True}. Best is trial 39 with value: 0.2716230464692288.
[I 2025-10-20 21:30:55,998] Trial 92 finished with value: 0.24941765516426498 and parameters: {'model_type': 'gat', 'hidden_dims': '[512, 64]', 'dropout': 0.44424072031777895, 'batch_norm': True, 'gat_heads': 3, 'gat_attn_dropout': 0.5376463330536296, 'gat_concat_hidden': False, 'lr': 0.0008281806633828338, 'weight_decay': 0.00044052487425329186, 'epochs': 166, 'loss': 'mae', 'optimizer': 'adam', 'graph_mode': 'cutoff', 'cutoff': 0.7760449577302012, 'grm_norm': 'gcn', 'self_loops': True}. Best is trial 39 with value: 0.2716230464692288.
[I 2025-10-20 21:33:02,361] Trial 93 finished with value: 0.25584043477108953 and parameters: {'model_type': 'gat', 'hidden_dims': '[512, 64]', 'dropout': 0.5207655309160315, 'batch_norm': True, 'gat_heads': 2, 'gat_attn_dropout': 0.5027566806375942, 'gat_concat_hidden': False, 'lr': 0.0006412163237288071, 'weight_decay': 0.0007905300305220073, 'epochs': 203, 'loss': 'mae', 'optimizer': 'adam', 'graph_mode': 'cutoff', 'cutoff': 0.8834806245055686, 'grm_norm': 'gcn', 'self_loops': True}. Best is trial 39 with value: 0.2716230464692288.
[I 2025-10-20 21:35:09,337] Trial 94 finished with value: 0.18199924543554452 and parameters: {'model_type': 'gat', 'hidden_dims': '[512, 64]', 'dropout': 0.5309755432821646, 'batch_norm': True, 'gat_heads': 2, 'gat_attn_dropout': 0.5156144136350799, 'gat_concat_hidden': False, 'lr': 0.0002758481700520479, 'weight_decay': 0.0007789351798111738, 'epochs': 204, 'loss': 'mae', 'optimizer': 'adam', 'graph_mode': 'cutoff', 'cutoff': 0.8782156278787753, 'grm_norm': 'gcn', 'self_loops': True}. Best is trial 39 with value: 0.2716230464692288.
[I 2025-10-20 21:35:49,839] Trial 95 finished with value: 0.24218199354330902 and parameters: {'model_type': 'gat', 'hidden_dims': '[256, 128]', 'dropout': 0.5179760791658787, 'batch_norm': True, 'gat_heads': 1, 'gat_attn_dropout': 0.547457735114391, 'gat_concat_hidden': False, 'lr': 0.0005447994858173089, 'weight_decay': 2.4710972861549026e-07, 'epochs': 201, 'loss': 'mae', 'optimizer': 'adam', 'graph_mode': 'cutoff', 'cutoff': 0.8959423020628673, 'grm_norm': 'gcn', 'self_loops': True}. Best is trial 39 with value: 0.2716230464692288.
[I 2025-10-20 21:37:45,605] Trial 96 finished with value: 0.2558585228787422 and parameters: {'model_type': 'gat', 'hidden_dims': '[512, 64]', 'dropout': 0.46676548430100007, 'batch_norm': False, 'gat_heads': 2, 'gat_attn_dropout': 0.2899422377707408, 'gat_concat_hidden': False, 'lr': 7.200448594279896e-05, 'weight_decay': 0.0006617804242246216, 'epochs': 187, 'loss': 'mae', 'optimizer': 'adam', 'graph_mode': 'cutoff', 'cutoff': 0.8108275323721336, 'grm_norm': 'gcn', 'self_loops': True}. Best is trial 39 with value: 0.2716230464692288.
[I 2025-10-20 21:38:35,781] Trial 97 finished with value: 0.22588503305015398 and parameters: {'model_type': 'gat', 'hidden_dims': '[128, 64]', 'dropout': 0.5399196235600981, 'batch_norm': False, 'gat_heads': 2, 'gat_attn_dropout': 0.30436935319023867, 'gat_concat_hidden': False, 'lr': 6.72975915038853e-05, 'weight_decay': 0.000731197385760555, 'epochs': 260, 'loss': 'mae', 'optimizer': 'adam', 'graph_mode': 'cutoff', 'cutoff': 0.8401575227975783, 'grm_norm': 'gcn', 'self_loops': True}. Best is trial 39 with value: 0.2716230464692288.
[I 2025-10-20 21:39:56,526] Trial 98 finished with value: 0.23725049636960255 and parameters: {'model_type': 'gat', 'hidden_dims': '[256, 128, 64]', 'dropout': 0.16062274185143124, 'batch_norm': False, 'gat_heads': 2, 'gat_attn_dropout': 0.25606382082951523, 'gat_concat_hidden': True, 'lr': 8.56553999096105e-05, 'weight_decay': 8.221268468818069e-06, 'epochs': 239, 'loss': 'mae', 'optimizer': 'adam', 'graph_mode': 'cutoff', 'cutoff': 0.8142370753659973, 'grm_norm': 'gcn', 'self_loops': True}. Best is trial 39 with value: 0.2716230464692288.
[I 2025-10-20 21:42:12,774] Trial 99 finished with value: 0.25946043155499926 and parameters: {'model_type': 'gat', 'hidden_dims': '[512, 64]', 'dropout': 0.36996257319757797, 'batch_norm': False, 'gat_heads': 2, 'gat_attn_dropout': 0.27020860307948935, 'gat_concat_hidden': False, 'lr': 0.00019012669364295835, 'weight_decay': 2.4280302561934607e-05, 'epochs': 224, 'loss': 'mae', 'optimizer': 'adam', 'graph_mode': 'cutoff', 'cutoff': 0.8719653164403356, 'grm_norm': 'none', 'self_loops': True}. Best is trial 39 with value: 0.2716230464692288.
[I 2025-10-20 21:47:54,258] Trial 100 finished with value: 0.25771158972551794 and parameters: {'model_type': 'gat', 'hidden_dims': '[512, 64]', 'dropout': 0.3720515257265877, 'batch_norm': False, 'gat_heads': 5, 'gat_attn_dropout': 0.2835469373317796, 'gat_concat_hidden': False, 'lr': 0.0001518105468516092, 'weight_decay': 7.735559119346087e-05, 'epochs': 224, 'loss': 'mae', 'optimizer': 'adam', 'graph_mode': 'cutoff', 'cutoff': 0.8769994623499112, 'grm_norm': 'none', 'self_loops': True}. Best is trial 39 with value: 0.2716230464692288.
[I 2025-10-20 21:54:04,470] Trial 101 finished with value: 0.2570193902281799 and parameters: {'model_type': 'gat', 'hidden_dims': '[512, 64]', 'dropout': 0.32131742398968743, 'batch_norm': False, 'gat_heads': 5, 'gat_attn_dropout': 0.2844218200793422, 'gat_concat_hidden': False, 'lr': 0.0001967667068050582, 'weight_decay': 2.4058844533791193e-05, 'epochs': 244, 'loss': 'mae', 'optimizer': 'adam', 'graph_mode': 'cutoff', 'cutoff': 0.8761480372203406, 'grm_norm': 'none', 'self_loops': True}. Best is trial 39 with value: 0.2716230464692288.
[I 2025-10-20 22:00:21,504] Trial 102 finished with value: 0.2602546897346322 and parameters: {'model_type': 'gat', 'hidden_dims': '[512, 64]', 'dropout': 0.36176022199738095, 'batch_norm': False, 'gat_heads': 5, 'gat_attn_dropout': 0.27636546567631165, 'gat_concat_hidden': False, 'lr': 0.00010565855977337672, 'weight_decay': 1.3494903013555648e-05, 'epochs': 248, 'loss': 'mae', 'optimizer': 'adam', 'graph_mode': 'cutoff', 'cutoff': 0.8637715097015523, 'grm_norm': 'none', 'self_loops': True}. Best is trial 39 with value: 0.2716230464692288.
[I 2025-10-20 22:06:43,899] Trial 103 finished with value: 0.2517544412824121 and parameters: {'model_type': 'gat', 'hidden_dims': '[512, 64]', 'dropout': 0.36164737119797974, 'batch_norm': False, 'gat_heads': 5, 'gat_attn_dropout': 0.27424599414747364, 'gat_concat_hidden': False, 'lr': 0.00010518591409169877, 'weight_decay': 2.116520718846956e-05, 'epochs': 251, 'loss': 'mae', 'optimizer': 'adam', 'graph_mode': 'cutoff', 'cutoff': 0.8636737425628389, 'grm_norm': 'none', 'self_loops': True}. Best is trial 39 with value: 0.2716230464692288.
[I 2025-10-20 22:13:02,886] Trial 104 finished with value: 0.2586677435388628 and parameters: {'model_type': 'gat', 'hidden_dims': '[512, 64]', 'dropout': 0.3239287322663603, 'batch_norm': False, 'gat_heads': 5, 'gat_attn_dropout': 0.2395847518721044, 'gat_concat_hidden': False, 'lr': 0.00013826164439709957, 'weight_decay': 1.1889422737498157e-05, 'epochs': 247, 'loss': 'mae', 'optimizer': 'adam', 'graph_mode': 'cutoff', 'cutoff': 0.847414215157819, 'grm_norm': 'none', 'self_loops': True}. Best is trial 39 with value: 0.2716230464692288.
[I 2025-10-20 22:19:17,436] Trial 105 finished with value: 0.24959781497015482 and parameters: {'model_type': 'gat', 'hidden_dims': '[512, 64]', 'dropout': 0.3237446931079119, 'batch_norm': False, 'gat_heads': 5, 'gat_attn_dropout': 0.24089814039263216, 'gat_concat_hidden': False, 'lr': 0.00015051939066199386, 'weight_decay': 2.9751821694501547e-05, 'epochs': 245, 'loss': 'mae', 'optimizer': 'adam', 'graph_mode': 'cutoff', 'cutoff': 0.8459780547976763, 'grm_norm': 'none', 'self_loops': True}. Best is trial 39 with value: 0.2716230464692288.
[I 2025-10-20 22:25:57,174] Trial 106 finished with value: 0.2619775005714958 and parameters: {'model_type': 'gat', 'hidden_dims': '[512, 64]', 'dropout': 0.3719244782241543, 'batch_norm': False, 'gat_heads': 5, 'gat_attn_dropout': 0.22946266680021643, 'gat_concat_hidden': False, 'lr': 0.00018479129143122636, 'weight_decay': 1.3187760205781137e-05, 'epochs': 264, 'loss': 'mae', 'optimizer': 'adam', 'graph_mode': 'cutoff', 'cutoff': 0.8997170656419713, 'grm_norm': 'none', 'self_loops': True}. Best is trial 39 with value: 0.2716230464692288.
[I 2025-10-20 22:33:11,038] Trial 107 finished with value: 0.25632517295279156 and parameters: {'model_type': 'gat', 'hidden_dims': '[512, 64]', 'dropout': 0.30108043779999555, 'batch_norm': False, 'gat_heads': 5, 'gat_attn_dropout': 0.2322023749112226, 'gat_concat_hidden': True, 'lr': 0.00013763275990800268, 'weight_decay': 1.2237641737714543e-05, 'epochs': 286, 'loss': 'mse', 'optimizer': 'adam', 'graph_mode': 'cutoff', 'cutoff': 0.8811942226803252, 'grm_norm': 'none', 'self_loops': True}. Best is trial 39 with value: 0.2716230464692288.
[I 2025-10-20 22:39:53,084] Trial 108 finished with value: 0.253791738555185 and parameters: {'model_type': 'gat', 'hidden_dims': '[512, 64]', 'dropout': 0.24970561111462905, 'batch_norm': False, 'gat_heads': 5, 'gat_attn_dropout': 0.26550623891853486, 'gat_concat_hidden': False, 'lr': 0.00018166030080531733, 'weight_decay': 5.117925249984585e-06, 'epochs': 264, 'loss': 'mae', 'optimizer': 'adam', 'graph_mode': 'cutoff', 'cutoff': 0.8458227126674227, 'grm_norm': 'none', 'self_loops': True}. Best is trial 39 with value: 0.2716230464692288.
[I 2025-10-20 22:47:49,745] Trial 109 finished with value: 0.2537499016390992 and parameters: {'model_type': 'gat', 'hidden_dims': '[512, 128]', 'dropout': 0.3443988485550356, 'batch_norm': False, 'gat_heads': 6, 'gat_attn_dropout': 0.1969992353089236, 'gat_concat_hidden': False, 'lr': 0.0001193937088225372, 'weight_decay': 1.3102760902433915e-05, 'epochs': 270, 'loss': 'mae', 'optimizer': 'adam', 'graph_mode': 'cutoff', 'cutoff': 0.8675942366497735, 'grm_norm': 'none', 'self_loops': True}. Best is trial 39 with value: 0.2716230464692288.
[I 2025-10-20 22:53:44,574] Trial 110 finished with value: 0.26222397621248394 and parameters: {'model_type': 'gat', 'hidden_dims': '[512, 64]', 'dropout': 0.3174468981658756, 'batch_norm': False, 'gat_heads': 5, 'gat_attn_dropout': 0.3195687619853099, 'gat_concat_hidden': False, 'lr': 0.00021218530534974485, 'weight_decay': 4.3730593624295976e-05, 'epochs': 233, 'loss': 'mae', 'optimizer': 'adam', 'graph_mode': 'cutoff', 'cutoff': 0.8973192726229695, 'grm_norm': 'none', 'self_loops': True}. Best is trial 39 with value: 0.2716230464692288.
[I 2025-10-20 23:00:45,060] Trial 111 finished with value: 0.24819850880875585 and parameters: {'model_type': 'gat', 'hidden_dims': '[512, 64]', 'dropout': 0.3205957176789489, 'batch_norm': False, 'gat_heads': 5, 'gat_attn_dropout': 0.3200969599809373, 'gat_concat_hidden': False, 'lr': 0.00021909256026767584, 'weight_decay': 4.0318040090496314e-05, 'epochs': 279, 'loss': 'mae', 'optimizer': 'adam', 'graph_mode': 'cutoff', 'cutoff': 0.8948371460378785, 'grm_norm': 'none', 'self_loops': True}. Best is trial 39 with value: 0.2716230464692288.
[I 2025-10-20 23:06:38,984] Trial 112 finished with value: 0.2631320349294502 and parameters: {'model_type': 'gat', 'hidden_dims': '[512, 64]', 'dropout': 0.28611020695343214, 'batch_norm': False, 'gat_heads': 5, 'gat_attn_dropout': 0.24935777311795784, 'gat_concat_hidden': False, 'lr': 0.00010146288001170974, 'weight_decay': 2.2482506987562805e-05, 'epochs': 232, 'loss': 'mae', 'optimizer': 'adam', 'graph_mode': 'cutoff', 'cutoff': 0.8999082750608398, 'grm_norm': 'none', 'self_loops': True}. Best is trial 39 with value: 0.2716230464692288.
[I 2025-10-20 23:12:38,745] Trial 113 finished with value: 0.2546079188966527 and parameters: {'model_type': 'gat', 'hidden_dims': '[512, 64]', 'dropout': 0.33433599088127597, 'batch_norm': False, 'gat_heads': 5, 'gat_attn_dropout': 0.2502625946017241, 'gat_concat_hidden': False, 'lr': 9.899799442735348e-05, 'weight_decay': 1.7797837269570765e-05, 'epochs': 235, 'loss': 'mae', 'optimizer': 'adam', 'graph_mode': 'cutoff', 'cutoff': 0.8558902596282504, 'grm_norm': 'none', 'self_loops': True}. Best is trial 39 with value: 0.2716230464692288.
[I 2025-10-20 23:19:26,617] Trial 114 finished with value: 0.25778234926231053 and parameters: {'model_type': 'gat', 'hidden_dims': '[512, 64]', 'dropout': 0.35520801362111926, 'batch_norm': False, 'gat_heads': 6, 'gat_attn_dropout': 0.22425381340917383, 'gat_concat_hidden': False, 'lr': 8.99377573717304e-05, 'weight_decay': 9.686631064432027e-06, 'epochs': 228, 'loss': 'mae', 'optimizer': 'adam', 'graph_mode': 'cutoff', 'cutoff': 0.8985874190894363, 'grm_norm': 'none', 'self_loops': True}. Best is trial 39 with value: 0.2716230464692288.
[I 2025-10-20 23:26:15,091] Trial 115 finished with value: 0.26186137561088324 and parameters: {'model_type': 'gat', 'hidden_dims': '[512, 64]', 'dropout': 0.28292154531375524, 'batch_norm': False, 'gat_heads': 6, 'gat_attn_dropout': 0.23074755852092046, 'gat_concat_hidden': False, 'lr': 8.72230217022867e-05, 'weight_decay': 9.116607493922924e-06, 'epochs': 229, 'loss': 'mae', 'optimizer': 'adam', 'graph_mode': 'cutoff', 'cutoff': 0.8962620922654515, 'grm_norm': 'none', 'self_loops': True}. Best is trial 39 with value: 0.2716230464692288.
[I 2025-10-20 23:33:09,131] Trial 116 finished with value: 0.25730200477051524 and parameters: {'model_type': 'gat', 'hidden_dims': '[512, 64]', 'dropout': 0.28662026911124205, 'batch_norm': False, 'gat_heads': 6, 'gat_attn_dropout': 0.22144211850519832, 'gat_concat_hidden': False, 'lr': 4.5820797758039185e-05, 'weight_decay': 9.59947874477613e-06, 'epochs': 232, 'loss': 'mae', 'optimizer': 'adam', 'graph_mode': 'cutoff', 'cutoff': 0.8988175771247647, 'grm_norm': 'none', 'self_loops': True}. Best is trial 39 with value: 0.2716230464692288.
[I 2025-10-20 23:42:04,421] Trial 117 finished with value: 0.26061738990254935 and parameters: {'model_type': 'gat', 'hidden_dims': '[512, 64]', 'dropout': 0.26566969157901416, 'batch_norm': False, 'gat_heads': 7, 'gat_attn_dropout': 0.1752075762483705, 'gat_concat_hidden': True, 'lr': 8.412590666621293e-05, 'weight_decay': 6.777604622208997e-06, 'epochs': 256, 'loss': 'mae', 'optimizer': 'adam', 'graph_mode': 'cutoff', 'cutoff': 0.8382070975395042, 'grm_norm': 'none', 'self_loops': True}. Best is trial 39 with value: 0.2716230464692288.
[I 2025-10-20 23:51:04,350] Trial 118 finished with value: 0.25138555549921554 and parameters: {'model_type': 'gat', 'hidden_dims': '[512, 64]', 'dropout': 0.23569825991815696, 'batch_norm': False, 'gat_heads': 7, 'gat_attn_dropout': 0.18292439232407684, 'gat_concat_hidden': True, 'lr': 6.139424875777313e-05, 'weight_decay': 6.871071457904406e-06, 'epochs': 258, 'loss': 'mae', 'optimizer': 'adam', 'graph_mode': 'cutoff', 'cutoff': 0.8392488665967099, 'grm_norm': 'none', 'self_loops': True}. Best is trial 39 with value: 0.2716230464692288.
