[I 2025-11-03 12:20:25,062] Trial 42 finished with value: 0.08284993652329387 and parameters: {'model_type': 'gcn', 'hidden_dims': '[128, 64]', 'dropout': 0.21058149830709855, 'batch_norm': True, 'lr': 0.0004096242412204179, 'weight_decay': 6.723155433674688e-05, 'epochs': 330, 'loss': 'mae', 'optimizer': 'adam', 'graph_mode': 'off', 'use_snp_selection': True, 'num_snps': 21670}. Best is trial 15 with value: 0.0881143438101052.
[I 2025-11-03 12:20:27,099] Trial 43 finished with value: 0.0703089563893609 and parameters: {'model_type': 'gcn', 'hidden_dims': '[128, 64]', 'dropout': 0.40897737503282433, 'batch_norm': True, 'lr': 0.0007693106965133105, 'weight_decay': 4.037113805745219e-05, 'epochs': 307, 'loss': 'mae', 'optimizer': 'adam', 'graph_mode': 'off', 'use_snp_selection': True, 'num_snps': 47515}. Best is trial 15 with value: 0.0881143438101052.
[I 2025-11-03 12:20:29,080] Trial 44 finished with value: -0.0130991443151965 and parameters: {'model_type': 'gcn', 'hidden_dims': '[512, 64]', 'dropout': 0.3736753405945532, 'batch_norm': True, 'lr': 2.471558655518794e-06, 'weight_decay': 2.0185651242805425e-05, 'epochs': 327, 'loss': 'mse', 'optimizer': 'adam', 'graph_mode': 'off', 'use_snp_selection': True, 'num_snps': 27389}. Best is trial 15 with value: 0.0881143438101052.
[I 2025-11-03 12:20:30,405] Trial 45 finished with value: 0.07418143401947164 and parameters: {'model_type': 'gcn', 'hidden_dims': '[512, 128]', 'dropout': 0.17109225521736554, 'batch_norm': True, 'lr': 0.0004723645520181165, 'weight_decay': 0.00022177012419635224, 'epochs': 348, 'loss': 'mae', 'optimizer': 'adam', 'graph_mode': 'off', 'use_snp_selection': True, 'num_snps': 4580}. Best is trial 15 with value: 0.0881143438101052.
[I 2025-11-03 12:20:31,728] Trial 46 finished with value: 0.0767111181181049 and parameters: {'model_type': 'gcn', 'hidden_dims': '[256, 128]', 'dropout': 0.2985188373889829, 'batch_norm': True, 'lr': 0.0002945793824699969, 'weight_decay': 6.309638129666989e-06, 'epochs': 275, 'loss': 'mae', 'optimizer': 'adam', 'graph_mode': 'off', 'use_snp_selection': True, 'num_snps': 13378}. Best is trial 15 with value: 0.0881143438101052.
[I 2025-11-03 12:20:32,358] Trial 47 finished with value: 0.047951230705436144 and parameters: {'model_type': 'gcn', 'hidden_dims': '[128, 64]', 'dropout': 0.5213330421225544, 'batch_norm': False, 'lr': 4.671205697181117e-05, 'weight_decay': 0.0005654244372561071, 'epochs': 44, 'loss': 'mae', 'optimizer': 'adam', 'graph_mode': 'off', 'use_snp_selection': False}. Best is trial 15 with value: 0.0881143438101052.
[I 2025-11-03 12:20:33,114] Trial 48 finished with value: 0.01606647664699927 and parameters: {'model_type': 'gcn', 'hidden_dims': '[128, 64]', 'dropout': 0.3364709282928492, 'batch_norm': True, 'lr': 8.282265831808429e-06, 'weight_decay': 3.2040662388231857e-06, 'epochs': 98, 'loss': 'mse', 'optimizer': 'adam', 'graph_mode': 'off', 'use_snp_selection': False}. Best is trial 15 with value: 0.0881143438101052.
[I 2025-11-03 12:20:35,120] Trial 49 finished with value: 0.07150465085710271 and parameters: {'model_type': 'gcn', 'hidden_dims': '[512, 64]', 'dropout': 0.4762113293761181, 'batch_norm': True, 'lr': 0.0006260213784186446, 'weight_decay': 1.1618835753570404e-05, 'epochs': 248, 'loss': 'mae', 'optimizer': 'adam', 'graph_mode': 'off', 'use_snp_selection': False}. Best is trial 15 with value: 0.0881143438101052.
[I 2025-11-03 12:20:37,179] Trial 50 finished with value: 0.07506814602537332 and parameters: {'model_type': 'gcn', 'hidden_dims': '[512, 128]', 'dropout': 0.43463951799907347, 'batch_norm': True, 'lr': 0.00020999374871604167, 'weight_decay': 2.43511716951711e-05, 'epochs': 192, 'loss': 'mae', 'optimizer': 'adam', 'graph_mode': 'off', 'use_snp_selection': True, 'num_snps': 41478}. Best is trial 15 with value: 0.0881143438101052.
[I 2025-11-03 12:20:38,824] Trial 51 finished with value: 0.08302885443067719 and parameters: {'model_type': 'gcn', 'hidden_dims': '[128, 64]', 'dropout': 0.36128267783888846, 'batch_norm': True, 'lr': 0.000687760283045712, 'weight_decay': 6.476644895390962e-05, 'epochs': 328, 'loss': 'mae', 'optimizer': 'adam', 'graph_mode': 'off', 'use_snp_selection': True, 'num_snps': 22844}. Best is trial 15 with value: 0.0881143438101052.
[I 2025-11-03 12:20:40,259] Trial 52 finished with value: 0.06400515640046567 and parameters: {'model_type': 'gcn', 'hidden_dims': '[128, 64]', 'dropout': 0.3053342686479211, 'batch_norm': True, 'lr': 0.0005503903171734918, 'weight_decay': 4.505222298774053e-05, 'epochs': 335, 'loss': 'mae', 'optimizer': 'adam', 'graph_mode': 'off', 'use_snp_selection': True, 'num_snps': 13872}. Best is trial 15 with value: 0.0881143438101052.
[I 2025-11-03 12:20:41,846] Trial 53 finished with value: 0.08485807761633558 and parameters: {'model_type': 'gcn', 'hidden_dims': '[128, 64]', 'dropout': 0.3753226458550961, 'batch_norm': True, 'lr': 0.0004125648303316922, 'weight_decay': 8.127546012173968e-05, 'epochs': 287, 'loss': 'mae', 'optimizer': 'adam', 'graph_mode': 'off', 'use_snp_selection': True, 'num_snps': 29468}. Best is trial 15 with value: 0.0881143438101052.
[I 2025-11-03 12:20:43,471] Trial 54 finished with value: 0.08969683603280788 and parameters: {'model_type': 'gcn', 'hidden_dims': '[128, 64]', 'dropout': 0.38039828061038916, 'batch_norm': True, 'lr': 0.00039039587555067404, 'weight_decay': 0.00012648068115914148, 'epochs': 287, 'loss': 'mae', 'optimizer': 'adam', 'graph_mode': 'off', 'use_snp_selection': True, 'num_snps': 29890}. Best is trial 54 with value: 0.08969683603280788.
[I 2025-11-03 12:20:45,120] Trial 55 finished with value: 0.07911262859053839 and parameters: {'model_type': 'gcn', 'hidden_dims': '[128, 64]', 'dropout': 0.38955041647085603, 'batch_norm': True, 'lr': 0.0009789102058087014, 'weight_decay': 0.0001241223840254434, 'epochs': 291, 'loss': 'mae', 'optimizer': 'adam', 'graph_mode': 'off', 'use_snp_selection': True, 'num_snps': 30728}. Best is trial 54 with value: 0.08969683603280788.
[I 2025-11-03 12:20:46,692] Trial 56 finished with value: 0.07798627616375975 and parameters: {'model_type': 'gcn', 'hidden_dims': '[128, 64]', 'dropout': 0.40400794953063296, 'batch_norm': True, 'lr': 0.000375257363692193, 'weight_decay': 0.0002800677097203663, 'epochs': 272, 'loss': 'mae', 'optimizer': 'adam', 'graph_mode': 'off', 'use_snp_selection': True, 'num_snps': 27227}. Best is trial 54 with value: 0.08969683603280788.
[I 2025-11-03 12:20:48,755] Trial 57 finished with value: 0.08588659740025338 and parameters: {'model_type': 'gcn', 'hidden_dims': '[256, 128, 64]', 'dropout': 0.34349291823246847, 'batch_norm': False, 'lr': 0.00046586323709031625, 'weight_decay': 9.014818766405294e-05, 'epochs': 307, 'loss': 'mae', 'optimizer': 'adam', 'graph_mode': 'off', 'use_snp_selection': True, 'num_snps': 35685}. Best is trial 54 with value: 0.08969683603280788.
[I 2025-11-03 12:20:50,921] Trial 58 finished with value: 0.03244384052922519 and parameters: {'model_type': 'gcn', 'hidden_dims': '[256, 128, 64]', 'dropout': 0.42268538670317435, 'batch_norm': False, 'lr': 0.0008085218823040401, 'weight_decay': 0.00013356496303005303, 'epochs': 309, 'loss': 'mse', 'optimizer': 'adam', 'graph_mode': 'off', 'use_snp_selection': True, 'num_snps': 37772}. Best is trial 54 with value: 0.08969683603280788.
[I 2025-11-03 12:20:53,396] Trial 59 finished with value: 0.03304928972822873 and parameters: {'model_type': 'gcn', 'hidden_dims': '[256, 128, 64]', 'dropout': 0.338939000714307, 'batch_norm': False, 'lr': 0.00014723298657361625, 'weight_decay': 0.0004956110471054357, 'epochs': 314, 'loss': 'mae', 'optimizer': 'adam', 'graph_mode': 'off', 'use_snp_selection': True, 'num_snps': 49224}. Best is trial 54 with value: 0.08969683603280788.
[I 2025-11-03 12:20:55,585] Trial 60 finished with value: 0.06997686429858477 and parameters: {'model_type': 'gcn', 'hidden_dims': '[256, 128, 64]', 'dropout': 0.4557764753301127, 'batch_norm': False, 'lr': 0.0002717152939282089, 'weight_decay': 0.00019385804001574044, 'epochs': 340, 'loss': 'mae', 'optimizer': 'adam', 'graph_mode': 'off', 'use_snp_selection': True, 'num_snps': 35134}. Best is trial 54 with value: 0.08969683603280788.
[I 2025-11-03 12:20:57,360] Trial 61 finished with value: 0.06571954227094433 and parameters: {'model_type': 'gcn', 'hidden_dims': '[256, 128, 64]', 'dropout': 0.370707851405929, 'batch_norm': False, 'lr': 0.0004514292401255416, 'weight_decay': 9.48731344569408e-05, 'epochs': 281, 'loss': 'mae', 'optimizer': 'adam', 'graph_mode': 'off', 'use_snp_selection': True, 'num_snps': 26770}. Best is trial 54 with value: 0.08969683603280788.
[I 2025-11-03 12:20:59,388] Trial 62 finished with value: 0.04750574405955735 and parameters: {'model_type': 'gcn', 'hidden_dims': '[512, 256]', 'dropout': 0.38207852708005374, 'batch_norm': False, 'lr': 0.00032589323968961007, 'weight_decay': 7.363536229935043e-05, 'epochs': 299, 'loss': 'mae', 'optimizer': 'adam', 'graph_mode': 'off', 'use_snp_selection': True, 'num_snps': 31826}. Best is trial 54 with value: 0.08969683603280788.
[I 2025-11-03 12:21:00,995] Trial 63 finished with value: 0.08125556872156152 and parameters: {'model_type': 'gcn', 'hidden_dims': '[128, 64]', 'dropout': 0.34593674052455997, 'batch_norm': True, 'lr': 0.0005394295165591267, 'weight_decay': 5.284066556376146e-05, 'epochs': 319, 'loss': 'mae', 'optimizer': 'adam', 'graph_mode': 'off', 'use_snp_selection': True, 'num_snps': 24946}. Best is trial 54 with value: 0.08969683603280788.
[I 2025-11-03 12:21:02,265] Trial 64 finished with value: 0.06946706157159338 and parameters: {'model_type': 'gcn', 'hidden_dims': '[128, 64]', 'dropout': 0.5735813712228018, 'batch_norm': True, 'lr': 0.0008086693207412631, 'weight_decay': 3.6977027917730995e-05, 'epochs': 235, 'loss': 'mae', 'optimizer': 'adam', 'graph_mode': 'off', 'use_snp_selection': True, 'num_snps': 17214}. Best is trial 54 with value: 0.08969683603280788.
[I 2025-11-03 12:21:04,273] Trial 65 finished with value: 0.0663381461919995 and parameters: {'model_type': 'gcn', 'hidden_dims': '[128, 64]', 'dropout': 0.5455121713142029, 'batch_norm': True, 'lr': 0.000415282631690264, 'weight_decay': 0.00010545026148523117, 'epochs': 323, 'loss': 'mae', 'optimizer': 'adam', 'graph_mode': 'off', 'use_snp_selection': True, 'num_snps': 41464}. Best is trial 54 with value: 0.08969683603280788.
[I 2025-11-03 12:21:06,244] Trial 66 finished with value: 0.054329328547274625 and parameters: {'model_type': 'gcn', 'hidden_dims': '[512, 64]', 'dropout': 0.49796765208769894, 'batch_norm': False, 'lr': 0.00022782325447155103, 'weight_decay': 0.000271022642049824, 'epochs': 289, 'loss': 'mae', 'optimizer': 'adam', 'graph_mode': 'off', 'use_snp_selection': True, 'num_snps': 30849}. Best is trial 54 with value: 0.08969683603280788.
[I 2025-11-03 12:21:08,074] Trial 67 finished with value: 0.07678933432610285 and parameters: {'model_type': 'gcn', 'hidden_dims': '[128, 64]', 'dropout': 0.2802325698903319, 'batch_norm': True, 'lr': 0.0009681363157282143, 'weight_decay': 1.8887617650671362e-07, 'epochs': 306, 'loss': 'mae', 'optimizer': 'adam', 'graph_mode': 'off', 'use_snp_selection': True, 'num_snps': 38975}. Best is trial 54 with value: 0.08969683603280788.
[I 2025-11-03 12:21:09,807] Trial 68 finished with value: 0.08423725393229545 and parameters: {'model_type': 'gcn', 'hidden_dims': '[256, 128]', 'dropout': 0.3155428922749941, 'batch_norm': True, 'lr': 0.000559077907052252, 'weight_decay': 0.00015840592172558523, 'epochs': 339, 'loss': 'mae', 'optimizer': 'adam', 'graph_mode': 'off', 'use_snp_selection': False}. Best is trial 54 with value: 0.08969683603280788.
[I 2025-11-03 12:21:11,786] Trial 69 finished with value: 0.07448110550687975 and parameters: {'model_type': 'gcn', 'hidden_dims': '[512, 128]', 'dropout': 0.4462987875102283, 'batch_norm': True, 'lr': 0.0003220814581030015, 'weight_decay': 7.98918604184377e-05, 'epochs': 248, 'loss': 'mae', 'optimizer': 'adam', 'graph_mode': 'off', 'use_snp_selection': True, 'num_snps': 34611}. Best is trial 54 with value: 0.08969683603280788.
[I 2025-11-03 12:21:13,864] Trial 70 finished with value: 0.04655386890152974 and parameters: {'model_type': 'gcn', 'hidden_dims': '[256, 128, 64]', 'dropout': 0.3241696993307933, 'batch_norm': True, 'lr': 2.3867273321235663e-05, 'weight_decay': 2.5884424633281254e-05, 'epochs': 350, 'loss': 'mae', 'optimizer': 'adam', 'graph_mode': 'off', 'use_snp_selection': False}. Best is trial 54 with value: 0.08969683603280788.
[I 2025-11-03 12:21:15,086] Trial 71 finished with value: 0.05949346368809097 and parameters: {'model_type': 'gcn', 'hidden_dims': '[128, 64]', 'dropout': 0.26121854560279384, 'batch_norm': True, 'lr': 0.0001710518038778317, 'weight_decay': 2.2946629527471187e-06, 'epochs': 265, 'loss': 'mae', 'optimizer': 'adam', 'graph_mode': 'off', 'use_snp_selection': False}. Best is trial 54 with value: 0.08969683603280788.
[I 2025-11-03 12:21:16,322] Trial 72 finished with value: 0.06293826378310999 and parameters: {'model_type': 'gcn', 'hidden_dims': '[128, 64]', 'dropout': 0.23776452435825726, 'batch_norm': True, 'lr': 0.00011849996455534505, 'weight_decay': 5.302185731218603e-05, 'epochs': 275, 'loss': 'mae', 'optimizer': 'adam', 'graph_mode': 'off', 'use_snp_selection': False}. Best is trial 54 with value: 0.08969683603280788.
[I 2025-11-03 12:21:17,623] Trial 73 finished with value: 0.07267487440303164 and parameters: {'model_type': 'gcn', 'hidden_dims': '[128, 64]', 'dropout': 0.13152145419563893, 'batch_norm': True, 'lr': 0.0004359144708755894, 'weight_decay': 0.00011393274188783629, 'epochs': 285, 'loss': 'mae', 'optimizer': 'adam', 'graph_mode': 'off', 'use_snp_selection': False}. Best is trial 54 with value: 0.08969683603280788.
[I 2025-11-03 12:21:18,918] Trial 74 finished with value: 0.08730229444748568 and parameters: {'model_type': 'gcn', 'hidden_dims': '[128, 64]', 'dropout': 0.4148885299612553, 'batch_norm': True, 'lr': 0.00024107697780393998, 'weight_decay': 1.3906880051591781e-06, 'epochs': 300, 'loss': 'mae', 'optimizer': 'adam', 'graph_mode': 'off', 'use_snp_selection': False}. Best is trial 54 with value: 0.08969683603280788.
[I 2025-11-03 12:21:20,213] Trial 75 finished with value: 0.06747483143080427 and parameters: {'model_type': 'gcn', 'hidden_dims': '[128, 64]', 'dropout': 0.4705825021801835, 'batch_norm': True, 'lr': 0.00025701836686122133, 'weight_decay': 5.659151785955014e-07, 'epochs': 302, 'loss': 'mae', 'optimizer': 'adam', 'graph_mode': 'off', 'use_snp_selection': False}. Best is trial 54 with value: 0.08969683603280788.
[I 2025-11-03 12:21:21,543] Trial 76 finished with value: 0.062051814358765785 and parameters: {'model_type': 'gcn', 'hidden_dims': '[128, 64]', 'dropout': 0.42243687010137476, 'batch_norm': True, 'lr': 7.056882896053526e-05, 'weight_decay': 3.3078332427191904e-05, 'epochs': 314, 'loss': 'mae', 'optimizer': 'adam', 'graph_mode': 'off', 'use_snp_selection': False}. Best is trial 54 with value: 0.08969683603280788.
[I 2025-11-03 12:21:22,774] Trial 77 finished with value: 0.020781837317609766 and parameters: {'model_type': 'gcn', 'hidden_dims': '[128, 64]', 'dropout': 0.3730307494016709, 'batch_norm': False, 'lr': 0.000690713058204461, 'weight_decay': 0.00019327055217075977, 'epochs': 293, 'loss': 'mse', 'optimizer': 'adam', 'graph_mode': 'off', 'use_snp_selection': False}. Best is trial 54 with value: 0.08969683603280788.
[I 2025-11-03 12:21:24,794] Trial 78 finished with value: 0.06195352014769168 and parameters: {'model_type': 'gcn', 'hidden_dims': '[128, 64]', 'dropout': 0.3543905448907384, 'batch_norm': True, 'lr': 0.00035793933857071263, 'weight_decay': 1.2696203290404692e-06, 'epochs': 321, 'loss': 'mae', 'optimizer': 'adam', 'graph_mode': 'off', 'use_snp_selection': True, 'num_snps': 44640}. Best is trial 54 with value: 0.08969683603280788.
[I 2025-11-03 12:21:26,183] Trial 79 finished with value: 0.08674205286157959 and parameters: {'model_type': 'gcn', 'hidden_dims': '[512, 256]', 'dropout': 0.4008385079069857, 'batch_norm': True, 'lr': 0.0005440525344198071, 'weight_decay': 0.00015593361065309165, 'epochs': 125, 'loss': 'mae', 'optimizer': 'adam', 'graph_mode': 'off', 'use_snp_selection': False}. Best is trial 54 with value: 0.08969683603280788.
[I 2025-11-03 12:21:27,498] Trial 80 finished with value: 0.07430663993786256 and parameters: {'model_type': 'gcn', 'hidden_dims': '[512, 256]', 'dropout': 0.4101940185722729, 'batch_norm': True, 'lr': 0.0007820901906405666, 'weight_decay': 0.0004283453224605833, 'epochs': 110, 'loss': 'mae', 'optimizer': 'adam', 'graph_mode': 'off', 'use_snp_selection': False}. Best is trial 54 with value: 0.08969683603280788.
[I 2025-11-03 12:21:29,022] Trial 81 finished with value: 0.08038991486426547 and parameters: {'model_type': 'gcn', 'hidden_dims': '[512, 256]', 'dropout': 0.39599444955506713, 'batch_norm': True, 'lr': 0.0005863608195220444, 'weight_decay': 9.137751263470444e-05, 'epochs': 157, 'loss': 'mae', 'optimizer': 'adam', 'graph_mode': 'off', 'use_snp_selection': False}. Best is trial 54 with value: 0.08969683603280788.
[I 2025-11-03 12:21:29,856] Trial 82 finished with value: 0.06960751624642238 and parameters: {'model_type': 'gcn', 'hidden_dims': '[128, 64]', 'dropout': 0.382753408459198, 'batch_norm': True, 'lr': 0.0004793155465281386, 'weight_decay': 0.00016004723381675333, 'epochs': 130, 'loss': 'mae', 'optimizer': 'adam', 'graph_mode': 'off', 'use_snp_selection': False}. Best is trial 54 with value: 0.08969683603280788.
[I 2025-11-03 12:21:30,935] Trial 83 finished with value: 0.07344818153364487 and parameters: {'model_type': 'gcn', 'hidden_dims': '[512, 256]', 'dropout': 0.3680793437638069, 'batch_norm': True, 'lr': 0.00039468899609734125, 'weight_decay': 0.0001290163059231082, 'epochs': 70, 'loss': 'mae', 'optimizer': 'adam', 'graph_mode': 'off', 'use_snp_selection': False}. Best is trial 54 with value: 0.08969683603280788.
[I 2025-11-03 12:21:33,400] Trial 84 finished with value: 0.07550707477763743 and parameters: {'model_type': 'gcn', 'hidden_dims': '[512, 256]', 'dropout': 0.33976593078414674, 'batch_norm': True, 'lr': 0.00018813243730582006, 'weight_decay': 6.323703515912808e-05, 'epochs': 336, 'loss': 'mae', 'optimizer': 'adam', 'graph_mode': 'off', 'use_snp_selection': False}. Best is trial 54 with value: 0.08969683603280788.
[I 2025-11-03 12:21:34,863] Trial 85 finished with value: 0.0861116876869849 and parameters: {'model_type': 'gcn', 'hidden_dims': '[256, 128, 64]', 'dropout': 0.4416621365511806, 'batch_norm': True, 'lr': 0.000633801836070936, 'weight_decay': 0.00022830510965897078, 'epochs': 198, 'loss': 'mae', 'optimizer': 'adam', 'graph_mode': 'off', 'use_snp_selection': False}. Best is trial 54 with value: 0.08969683603280788.
[I 2025-11-03 12:21:36,159] Trial 86 finished with value: 0.07619020492393175 and parameters: {'model_type': 'gcn', 'hidden_dims': '[256, 128, 64]', 'dropout': 0.44301481660662745, 'batch_norm': True, 'lr': 0.0008861203324953399, 'weight_decay': 0.0002187223906474945, 'epochs': 166, 'loss': 'mae', 'optimizer': 'adam', 'graph_mode': 'off', 'use_snp_selection': False}. Best is trial 54 with value: 0.08969683603280788.
[I 2025-11-03 12:21:37,676] Trial 87 finished with value: 0.08818996051925078 and parameters: {'model_type': 'gcn', 'hidden_dims': '[256, 128, 64]', 'dropout': 0.4966151704635551, 'batch_norm': True, 'lr': 0.0007269304995108074, 'weight_decay': 0.00035054039286822557, 'epochs': 208, 'loss': 'mae', 'optimizer': 'adam', 'graph_mode': 'off', 'use_snp_selection': False}. Best is trial 54 with value: 0.08969683603280788.
[I 2025-11-03 12:21:39,139] Trial 88 finished with value: 0.0850813795732746 and parameters: {'model_type': 'gcn', 'hidden_dims': '[256, 128, 64]', 'dropout': 0.48909499132089024, 'batch_norm': True, 'lr': 0.0007122364246358888, 'weight_decay': 0.0003502111137524281, 'epochs': 200, 'loss': 'mae', 'optimizer': 'adam', 'graph_mode': 'off', 'use_snp_selection': False}. Best is trial 54 with value: 0.08969683603280788.
[I 2025-11-03 12:21:40,661] Trial 89 finished with value: 0.08276015877501994 and parameters: {'model_type': 'gcn', 'hidden_dims': '[256, 128, 64]', 'dropout': 0.4656286258771134, 'batch_norm': True, 'lr': 0.0006104683727043808, 'weight_decay': 0.0002711528635948168, 'epochs': 205, 'loss': 'mse', 'optimizer': 'adam', 'graph_mode': 'off', 'use_snp_selection': False}. Best is trial 54 with value: 0.08969683603280788.
[I 2025-11-03 12:21:41,751] Trial 90 finished with value: 0.07484997576563418 and parameters: {'model_type': 'gcn', 'hidden_dims': '[256, 128]', 'dropout': 0.5045335779459745, 'batch_norm': True, 'lr': 0.0008944865616610175, 'weight_decay': 0.0001626259093596398, 'epochs': 140, 'loss': 'mae', 'optimizer': 'adam', 'graph_mode': 'off', 'use_snp_selection': False}. Best is trial 54 with value: 0.08969683603280788.
[I 2025-11-03 12:21:43,261] Trial 91 finished with value: 0.07410236876565321 and parameters: {'model_type': 'gcn', 'hidden_dims': '[256, 128, 64]', 'dropout': 0.43209507208682923, 'batch_norm': True, 'lr': 0.0005019385529045456, 'weight_decay': 0.000803199965416006, 'epochs': 206, 'loss': 'mae', 'optimizer': 'adam', 'graph_mode': 'off', 'use_snp_selection': False}. Best is trial 54 with value: 0.08969683603280788.
[I 2025-11-03 12:21:44,634] Trial 92 finished with value: 0.014694866915881963 and parameters: {'model_type': 'gcn', 'hidden_dims': '[256, 128, 64]', 'dropout': 0.5376292116260163, 'batch_norm': True, 'lr': 1.1163089600728259e-06, 'weight_decay': 0.00022702083445979567, 'epochs': 183, 'loss': 'mae', 'optimizer': 'adam', 'graph_mode': 'off', 'use_snp_selection': False}. Best is trial 54 with value: 0.08969683603280788.
