[I 2025-11-03 13:03:24,966] Trial 4 finished with value: -0.012268006557712683 and parameters: {'model_type': 'gcn', 'hidden_dims': '[128, 64]', 'dropout': 0.13404863676897502, 'batch_norm': False, 'lr': 0.0001431556295367288, 'weight_decay': 2.2084517750726675e-05, 'epochs': 13, 'loss': 'mae', 'optimizer': 'adam', 'graph_mode': 'cutoff', 'cutoff': 0.6714268476993044, 'grm_norm': 'none', 'self_loops': False, 'use_snp_selection': True, 'num_snps': 45645}. Best is trial 2 with value: 0.05336149130664805.
[I 2025-11-03 13:03:28,139] Trial 5 finished with value: 0.014174671317335756 and parameters: {'model_type': 'gcn', 'hidden_dims': '[256, 128]', 'dropout': 0.42253606323412096, 'batch_norm': False, 'lr': 4.238630400638805e-05, 'weight_decay': 8.074086040046576e-07, 'epochs': 134, 'loss': 'mae', 'optimizer': 'adam', 'graph_mode': 'knn', 'source': 'grm', 'knn_k': 1, 'weighted_edges': False, 'symmetrize_mode': 'mutual', 'use_snp_selection': True, 'num_snps': 43113}. Best is trial 2 with value: 0.05336149130664805.
[I 2025-11-03 13:03:31,287] Trial 6 finished with value: 0.05650481296773042 and parameters: {'model_type': 'gcn', 'hidden_dims': '[512, 256]', 'dropout': 0.3534893146320237, 'batch_norm': True, 'lr': 0.000251307964226932, 'weight_decay': 1.821819791794022e-05, 'epochs': 207, 'loss': 'mae', 'optimizer': 'adam', 'graph_mode': 'knn', 'source': 'grm', 'knn_k': 1, 'weighted_edges': True, 'symmetrize_mode': 'mutual', 'use_snp_selection': False}. Best is trial 6 with value: 0.05650481296773042.
[I 2025-11-03 13:03:34,007] Trial 7 finished with value: 0.052432932576711035 and parameters: {'model_type': 'gcn', 'hidden_dims': '[512, 256]', 'dropout': 0.1105825955860775, 'batch_norm': True, 'lr': 2.374338412754043e-05, 'weight_decay': 1.1284721123340274e-05, 'epochs': 170, 'loss': 'mse', 'optimizer': 'adam', 'graph_mode': 'cutoff', 'cutoff': 0.719872204109604, 'grm_norm': 'gcn', 'self_loops': False, 'use_snp_selection': False}. Best is trial 6 with value: 0.05650481296773042.
[I 2025-11-03 13:03:36,054] Trial 8 finished with value: 0.002848300309777899 and parameters: {'model_type': 'gcn', 'hidden_dims': '[512, 128]', 'dropout': 0.5066580418354021, 'batch_norm': True, 'lr': 0.00039213678276659976, 'weight_decay': 3.43655320802934e-06, 'epochs': 91, 'loss': 'mse', 'optimizer': 'adam', 'graph_mode': 'cutoff', 'cutoff': 0.34923059576505366, 'grm_norm': 'cosine', 'self_loops': True, 'use_snp_selection': False}. Best is trial 6 with value: 0.05650481296773042.
[I 2025-11-03 13:03:38,060] Trial 9 finished with value: -0.02068548080504225 and parameters: {'model_type': 'gcn', 'hidden_dims': '[512, 256]', 'dropout': 0.301734920240333, 'batch_norm': False, 'lr': 6.650961854953448e-06, 'weight_decay': 6.861575656590315e-05, 'epochs': 125, 'loss': 'mae', 'optimizer': 'adam', 'graph_mode': 'cutoff', 'cutoff': 0.2857569870061939, 'grm_norm': 'cosine_then_gcn', 'self_loops': False, 'use_snp_selection': True, 'num_snps': 12722}. Best is trial 6 with value: 0.05650481296773042.
[I 2025-11-03 13:03:41,652] Trial 10 finished with value: 0.06796657225033238 and parameters: {'model_type': 'gcn', 'hidden_dims': '[512, 64]', 'dropout': 0.2833599465317005, 'batch_norm': True, 'lr': 0.00016916760584270694, 'weight_decay': 1.7866650996308468e-07, 'epochs': 266, 'loss': 'mae', 'optimizer': 'adam', 'graph_mode': 'knn', 'source': 'grm', 'knn_k': 1, 'weighted_edges': True, 'symmetrize_mode': 'union', 'use_snp_selection': False}. Best is trial 10 with value: 0.06796657225033238.
[I 2025-11-03 13:03:45,249] Trial 11 finished with value: 0.0715429090143222 and parameters: {'model_type': 'gcn', 'hidden_dims': '[512, 64]', 'dropout': 0.2859699507705008, 'batch_norm': True, 'lr': 0.00012623783700890367, 'weight_decay': 1.6805209943987688e-07, 'epochs': 265, 'loss': 'mae', 'optimizer': 'adam', 'graph_mode': 'knn', 'source': 'grm', 'knn_k': 1, 'weighted_edges': True, 'symmetrize_mode': 'union', 'use_snp_selection': False}. Best is trial 11 with value: 0.0715429090143222.
[I 2025-11-03 13:03:48,923] Trial 12 finished with value: 0.020767623915524683 and parameters: {'model_type': 'gcn', 'hidden_dims': '[512, 64]', 'dropout': 0.26266132038870743, 'batch_norm': True, 'lr': 9.336280153487897e-05, 'weight_decay': 1.0551808429767219e-07, 'epochs': 270, 'loss': 'mae', 'optimizer': 'adam', 'graph_mode': 'knn', 'source': 'grm', 'knn_k': 3, 'weighted_edges': True, 'symmetrize_mode': 'union', 'use_snp_selection': False}. Best is trial 11 with value: 0.0715429090143222.
[I 2025-11-03 13:03:52,479] Trial 13 finished with value: 0.022705259094790722 and parameters: {'model_type': 'gcn', 'hidden_dims': '[512, 64]', 'dropout': 0.2687736708759205, 'batch_norm': True, 'lr': 8.732942663241711e-05, 'weight_decay': 1.1697174867672891e-07, 'epochs': 251, 'loss': 'mae', 'optimizer': 'adam', 'graph_mode': 'knn', 'source': 'grm', 'knn_k': 4, 'weighted_edges': True, 'symmetrize_mode': 'union', 'use_snp_selection': False}. Best is trial 11 with value: 0.0715429090143222.
[I 2025-11-03 13:03:56,884] Trial 14 finished with value: -0.010281829487433376 and parameters: {'model_type': 'gcn', 'hidden_dims': '[512, 64]', 'dropout': 0.19696847261698813, 'batch_norm': True, 'lr': 1.2586985041154999e-05, 'weight_decay': 3.8054513427732407e-07, 'epochs': 349, 'loss': 'mae', 'optimizer': 'adam', 'graph_mode': 'knn', 'source': 'grm', 'knn_k': 3, 'weighted_edges': True, 'symmetrize_mode': 'union', 'use_snp_selection': False}. Best is trial 11 with value: 0.0715429090143222.
[I 2025-11-03 13:04:00,692] Trial 15 finished with value: 0.06869210894632793 and parameters: {'model_type': 'gcn', 'hidden_dims': '[512, 64]', 'dropout': 0.32182199730807426, 'batch_norm': True, 'lr': 0.00016454300965981406, 'weight_decay': 4.3750989597912334e-07, 'epochs': 282, 'loss': 'mae', 'optimizer': 'adam', 'graph_mode': 'knn', 'source': 'grm', 'knn_k': 1, 'weighted_edges': True, 'symmetrize_mode': 'union', 'use_snp_selection': False}. Best is trial 11 with value: 0.0715429090143222.
[I 2025-11-03 13:04:04,792] Trial 16 finished with value: 0.06785295755014835 and parameters: {'model_type': 'gcn', 'hidden_dims': '[512, 64]', 'dropout': 0.3912763499396328, 'batch_norm': True, 'lr': 5.8155244500770475e-05, 'weight_decay': 6.966019491522892e-07, 'epochs': 309, 'loss': 'mae', 'optimizer': 'adam', 'graph_mode': 'knn', 'source': 'grm', 'knn_k': 10, 'weighted_edges': False, 'symmetrize_mode': 'union', 'use_snp_selection': False}. Best is trial 11 with value: 0.0715429090143222.
[I 2025-11-03 13:04:08,044] Trial 17 finished with value: 0.029512053509611398 and parameters: {'model_type': 'gcn', 'hidden_dims': '[512, 128]', 'dropout': 0.46671086169925924, 'batch_norm': True, 'lr': 0.00028616129463827076, 'weight_decay': 3.107383290096833e-06, 'epochs': 218, 'loss': 'mae', 'optimizer': 'adam', 'graph_mode': 'knn', 'source': 'grm', 'knn_k': 3, 'weighted_edges': True, 'symmetrize_mode': 'union', 'use_snp_selection': False}. Best is trial 11 with value: 0.0715429090143222.
[I 2025-11-03 13:04:11,118] Trial 18 finished with value: 0.04020991295311491 and parameters: {'model_type': 'gcn', 'hidden_dims': '[256, 128, 64]', 'dropout': 0.20588978637538785, 'batch_norm': True, 'lr': 0.0009303712567709796, 'weight_decay': 3.293863322548928e-07, 'epochs': 296, 'loss': 'mae', 'optimizer': 'adam', 'graph_mode': 'knn', 'source': 'grm', 'knn_k': 5, 'weighted_edges': True, 'symmetrize_mode': 'union', 'use_snp_selection': False}. Best is trial 11 with value: 0.0715429090143222.
[I 2025-11-03 13:04:14,487] Trial 19 finished with value: -0.001182784384843091 and parameters: {'model_type': 'gcn', 'hidden_dims': '[512, 64]', 'dropout': 0.3428635050089619, 'batch_norm': True, 'lr': 1.4712248825400985e-05, 'weight_decay': 9.172787270771911e-07, 'epochs': 231, 'loss': 'mae', 'optimizer': 'adam', 'graph_mode': 'knn', 'source': 'grm', 'knn_k': 2, 'weighted_edges': True, 'symmetrize_mode': 'union', 'use_snp_selection': False}. Best is trial 11 with value: 0.0715429090143222.
[I 2025-11-03 13:04:18,488] Trial 20 finished with value: -0.024913995472667105 and parameters: {'model_type': 'gcn', 'hidden_dims': '[512, 64]', 'dropout': 0.5741974551696398, 'batch_norm': True, 'lr': 3.6318419901982732e-06, 'weight_decay': 0.0006285794524056533, 'epochs': 304, 'loss': 'mae', 'optimizer': 'adam', 'graph_mode': 'knn', 'source': 'grm', 'knn_k': 2, 'weighted_edges': False, 'symmetrize_mode': 'union', 'use_snp_selection': False}. Best is trial 11 with value: 0.0715429090143222.
[I 2025-11-03 13:04:22,177] Trial 21 finished with value: 0.08109177717975395 and parameters: {'model_type': 'gcn', 'hidden_dims': '[512, 64]', 'dropout': 0.3083258386798514, 'batch_norm': True, 'lr': 0.0001552429523774223, 'weight_decay': 2.648419205762322e-07, 'epochs': 270, 'loss': 'mae', 'optimizer': 'adam', 'graph_mode': 'knn', 'source': 'grm', 'knn_k': 1, 'weighted_edges': True, 'symmetrize_mode': 'union', 'use_snp_selection': False}. Best is trial 21 with value: 0.08109177717975395.
[I 2025-11-03 13:04:25,976] Trial 22 finished with value: 0.08527901872374605 and parameters: {'model_type': 'gcn', 'hidden_dims': '[512, 64]', 'dropout': 0.33091637792526796, 'batch_norm': True, 'lr': 0.00010044183852457175, 'weight_decay': 2.6279122945689714e-07, 'epochs': 282, 'loss': 'mae', 'optimizer': 'adam', 'graph_mode': 'knn', 'source': 'grm', 'knn_k': 1, 'weighted_edges': True, 'symmetrize_mode': 'union', 'use_snp_selection': False}. Best is trial 22 with value: 0.08527901872374605.
[I 2025-11-03 13:04:29,069] Trial 23 finished with value: 0.030628126863657273 and parameters: {'model_type': 'gcn', 'hidden_dims': '[512, 64]', 'dropout': 0.24953667572137572, 'batch_norm': True, 'lr': 0.00010489823833160659, 'weight_decay': 2.2801355383610187e-07, 'epochs': 200, 'loss': 'mae', 'optimizer': 'adam', 'graph_mode': 'knn', 'source': 'grm', 'knn_k': 2, 'weighted_edges': True, 'symmetrize_mode': 'union', 'use_snp_selection': False}. Best is trial 22 with value: 0.08527901872374605.
[I 2025-11-03 13:04:32,539] Trial 24 finished with value: 0.04103572097202732 and parameters: {'model_type': 'gcn', 'hidden_dims': '[512, 64]', 'dropout': 0.3684417703060361, 'batch_norm': True, 'lr': 7.027385715537277e-05, 'weight_decay': 1.4413568717177363e-06, 'epochs': 243, 'loss': 'mae', 'optimizer': 'adam', 'graph_mode': 'knn', 'source': 'grm', 'knn_k': 4, 'weighted_edges': True, 'symmetrize_mode': 'union', 'use_snp_selection': False}. Best is trial 22 with value: 0.08527901872374605.
[I 2025-11-03 13:04:36,640] Trial 25 finished with value: 0.037911029152826875 and parameters: {'model_type': 'gcn', 'hidden_dims': '[512, 64]', 'dropout': 0.44614313778408476, 'batch_norm': True, 'lr': 0.0002536957127283572, 'weight_decay': 2.173446953716572e-07, 'epochs': 316, 'loss': 'mae', 'optimizer': 'adam', 'graph_mode': 'knn', 'source': 'grm', 'knn_k': 2, 'weighted_edges': True, 'symmetrize_mode': 'union', 'use_snp_selection': False}. Best is trial 22 with value: 0.08527901872374605.
[I 2025-11-03 13:04:41,520] Trial 26 finished with value: 0.03939913893348049 and parameters: {'model_type': 'gcn', 'hidden_dims': '[512, 128]', 'dropout': 0.23622811250342768, 'batch_norm': False, 'lr': 4.8852837949567745e-05, 'weight_decay': 2.9301961351187663e-06, 'epochs': 192, 'loss': 'mae', 'optimizer': 'adam', 'graph_mode': 'cutoff', 'cutoff': 0.8765009073803762, 'grm_norm': 'none', 'self_loops': True, 'use_snp_selection': True, 'num_snps': 59005}. Best is trial 22 with value: 0.08527901872374605.
[I 2025-11-03 13:04:44,027] Trial 27 finished with value: 0.04007580353461239 and parameters: {'model_type': 'gcn', 'hidden_dims': '[256, 128]', 'dropout': 0.3184969027292452, 'batch_norm': True, 'lr': 1.9937354098458108e-05, 'weight_decay': 5.80944391997584e-06, 'epochs': 251, 'loss': 'mse', 'optimizer': 'adam', 'graph_mode': 'knn', 'source': 'grm', 'knn_k': 4, 'weighted_edges': True, 'symmetrize_mode': 'union', 'use_snp_selection': False}. Best is trial 22 with value: 0.08527901872374605.
[I 2025-11-03 13:04:46,918] Trial 28 finished with value: 0.05114220858744863 and parameters: {'model_type': 'gcn', 'hidden_dims': '[256, 128, 64]', 'dropout': 0.1574132891495136, 'batch_norm': True, 'lr': 0.00012252517590803497, 'weight_decay': 4.978608910271034e-07, 'epochs': 278, 'loss': 'mae', 'optimizer': 'adam', 'graph_mode': 'knn', 'source': 'grm', 'knn_k': 1, 'weighted_edges': False, 'symmetrize_mode': 'mutual', 'use_snp_selection': False}. Best is trial 22 with value: 0.08527901872374605.
[I 2025-11-03 13:04:49,193] Trial 29 finished with value: 0.04177581339374561 and parameters: {'model_type': 'gcn', 'hidden_dims': '[128, 64]', 'dropout': 0.2121274797039934, 'batch_norm': True, 'lr': 0.00040514225370335633, 'weight_decay': 0.0001366364095145868, 'epochs': 326, 'loss': 'mae', 'optimizer': 'adam', 'graph_mode': 'knn', 'source': 'grm', 'knn_k': 3, 'weighted_edges': True, 'symmetrize_mode': 'union', 'use_snp_selection': False}. Best is trial 22 with value: 0.08527901872374605.
[I 2025-11-03 13:04:53,412] Trial 30 finished with value: -0.0002175728999902806 and parameters: {'model_type': 'gcn', 'hidden_dims': '[512, 64]', 'dropout': 0.17940421197475795, 'batch_norm': True, 'lr': 1.2963802273643008e-06, 'weight_decay': 1.2964541139416464e-06, 'epochs': 331, 'loss': 'mae', 'optimizer': 'adam', 'graph_mode': 'knn', 'source': 'grm', 'knn_k': 2, 'weighted_edges': True, 'symmetrize_mode': 'union', 'use_snp_selection': False}. Best is trial 22 with value: 0.08527901872374605.
[I 2025-11-03 13:04:57,233] Trial 31 finished with value: 0.06306232636299347 and parameters: {'model_type': 'gcn', 'hidden_dims': '[512, 64]', 'dropout': 0.33000682582515134, 'batch_norm': True, 'lr': 0.00018766993694704467, 'weight_decay': 5.048478262965818e-07, 'epochs': 288, 'loss': 'mae', 'optimizer': 'adam', 'graph_mode': 'knn', 'source': 'grm', 'knn_k': 1, 'weighted_edges': True, 'symmetrize_mode': 'union', 'use_snp_selection': False}. Best is trial 22 with value: 0.08527901872374605.
[I 2025-11-03 13:05:00,534] Trial 32 finished with value: 0.07489145932973255 and parameters: {'model_type': 'gcn', 'hidden_dims': '[512, 64]', 'dropout': 0.2894061551237061, 'batch_norm': True, 'lr': 0.00015144433406055725, 'weight_decay': 1.5672816989897965e-07, 'epochs': 229, 'loss': 'mae', 'optimizer': 'adam', 'graph_mode': 'knn', 'source': 'grm', 'knn_k': 1, 'weighted_edges': True, 'symmetrize_mode': 'union', 'use_snp_selection': False}. Best is trial 22 with value: 0.08527901872374605.
[I 2025-11-03 13:05:03,812] Trial 33 finished with value: 0.04550465278932119 and parameters: {'model_type': 'gcn', 'hidden_dims': '[512, 64]', 'dropout': 0.2925637099143021, 'batch_norm': True, 'lr': 7.340476446867706e-05, 'weight_decay': 1.0037529315233012e-07, 'epochs': 225, 'loss': 'mae', 'optimizer': 'adam', 'graph_mode': 'knn', 'source': 'grm', 'knn_k': 2, 'weighted_edges': True, 'symmetrize_mode': 'union', 'use_snp_selection': False}. Best is trial 22 with value: 0.08527901872374605.
[I 2025-11-03 13:05:05,828] Trial 34 finished with value: 0.0745588832839841 and parameters: {'model_type': 'gcn', 'hidden_dims': '[128, 64]', 'dropout': 0.2412019004825905, 'batch_norm': True, 'lr': 0.0004358738195211114, 'weight_decay': 1.96498088897341e-07, 'epochs': 264, 'loss': 'mse', 'optimizer': 'adam', 'graph_mode': 'knn', 'source': 'grm', 'knn_k': 1, 'weighted_edges': True, 'symmetrize_mode': 'union', 'use_snp_selection': False}. Best is trial 22 with value: 0.08527901872374605.
[I 2025-11-03 13:05:07,737] Trial 35 finished with value: 0.027780769605768793 and parameters: {'model_type': 'gcn', 'hidden_dims': '[128, 64]', 'dropout': 0.37730336715431556, 'batch_norm': False, 'lr': 0.000538452439705902, 'weight_decay': 2.754339028752041e-07, 'epochs': 242, 'loss': 'mse', 'optimizer': 'adam', 'graph_mode': 'knn', 'source': 'grm', 'knn_k': 2, 'weighted_edges': True, 'symmetrize_mode': 'union', 'use_snp_selection': True, 'num_snps': 2074}. Best is trial 22 with value: 0.08527901872374605.
[I 2025-11-03 13:05:09,474] Trial 36 finished with value: 0.035131962937884266 and parameters: {'model_type': 'gcn', 'hidden_dims': '[128, 64]', 'dropout': 0.24520239286074283, 'batch_norm': True, 'lr': 0.0008361544022646172, 'weight_decay': 1.7363148388644174e-07, 'epochs': 179, 'loss': 'mse', 'optimizer': 'adam', 'graph_mode': 'cutoff', 'cutoff': 0.42596163795855535, 'grm_norm': 'cosine', 'self_loops': True, 'use_snp_selection': False}. Best is trial 22 with value: 0.08527901872374605.
[I 2025-11-03 13:05:11,593] Trial 37 finished with value: 0.020537727498788447 and parameters: {'model_type': 'gcn', 'hidden_dims': '[128, 64]', 'dropout': 0.42628978914321797, 'batch_norm': False, 'lr': 0.0003788475514620766, 'weight_decay': 7.896462742503025e-07, 'epochs': 154, 'loss': 'mse', 'optimizer': 'adam', 'graph_mode': 'knn', 'source': 'grm', 'knn_k': 9, 'weighted_edges': True, 'symmetrize_mode': 'mutual', 'use_snp_selection': True, 'num_snps': 15344}. Best is trial 22 with value: 0.08527901872374605.
[I 2025-11-03 13:05:14,593] Trial 38 finished with value: 0.06530099483534109 and parameters: {'model_type': 'gcn', 'hidden_dims': '[256, 128]', 'dropout': 0.3579995117663685, 'batch_norm': True, 'lr': 0.0005619803716433027, 'weight_decay': 1.6951352472635053e-06, 'epochs': 348, 'loss': 'mse', 'optimizer': 'adam', 'graph_mode': 'knn', 'source': 'grm', 'knn_k': 7, 'weighted_edges': True, 'symmetrize_mode': 'union', 'use_snp_selection': False}. Best is trial 22 with value: 0.08527901872374605.
[I 2025-11-03 13:05:18,488] Trial 39 finished with value: 0.09449081425448297 and parameters: {'model_type': 'gcn', 'hidden_dims': '[128, 64]', 'dropout': 0.4069344897331388, 'batch_norm': False, 'lr': 3.878867323885904e-05, 'weight_decay': 3.0438855855485137e-07, 'epochs': 212, 'loss': 'mse', 'optimizer': 'adam', 'graph_mode': 'cutoff', 'cutoff': 0.8982975816958216, 'grm_norm': 'cosine_then_gcn', 'self_loops': True, 'use_snp_selection': True, 'num_snps': 58379}. Best is trial 39 with value: 0.09449081425448297.
[I 2025-11-03 13:05:23,564] Trial 40 finished with value: 0.07195285236104021 and parameters: {'model_type': 'gcn', 'hidden_dims': '[512, 256]', 'dropout': 0.40965983714019283, 'batch_norm': False, 'lr': 3.285949303875746e-05, 'weight_decay': 1.0431032625588088e-06, 'epochs': 205, 'loss': 'mse', 'optimizer': 'adam', 'graph_mode': 'cutoff', 'cutoff': 0.8875764307398776, 'grm_norm': 'cosine_then_gcn', 'self_loops': True, 'use_snp_selection': True, 'num_snps': 59879}. Best is trial 39 with value: 0.09449081425448297.
[I 2025-11-03 13:05:26,916] Trial 41 finished with value: 0.05140999629770605 and parameters: {'model_type': 'gcn', 'hidden_dims': '[128, 64]', 'dropout': 0.3061055953852687, 'batch_norm': False, 'lr': 0.00022394827959673042, 'weight_decay': 3.132735519280451e-07, 'epochs': 223, 'loss': 'mse', 'optimizer': 'adam', 'graph_mode': 'cutoff', 'cutoff': 0.7700586866142018, 'grm_norm': 'cosine_then_gcn', 'self_loops': True, 'use_snp_selection': True, 'num_snps': 44926}. Best is trial 39 with value: 0.09449081425448297.
[I 2025-11-03 13:05:30,644] Trial 42 finished with value: 0.04695494228256769 and parameters: {'model_type': 'gcn', 'hidden_dims': '[128, 64]', 'dropout': 0.4799059247431678, 'batch_norm': False, 'lr': 4.713263094603128e-05, 'weight_decay': 1.4170127107636784e-07, 'epochs': 259, 'loss': 'mse', 'optimizer': 'adam', 'graph_mode': 'cutoff', 'cutoff': 0.5050305200022434, 'grm_norm': 'cosine_then_gcn', 'self_loops': True, 'use_snp_selection': True, 'num_snps': 50926}. Best is trial 39 with value: 0.09449081425448297.
[I 2025-11-03 13:05:33,769] Trial 43 finished with value: 0.01911804010546406 and parameters: {'model_type': 'gcn', 'hidden_dims': '[128, 64]', 'dropout': 0.2257698066421108, 'batch_norm': False, 'lr': 2.601040551149344e-05, 'weight_decay': 6.649074829494368e-07, 'epochs': 236, 'loss': 'mse', 'optimizer': 'adam', 'graph_mode': 'cutoff', 'cutoff': 0.6045493969258031, 'grm_norm': 'cosine_then_gcn', 'self_loops': True, 'use_snp_selection': True, 'num_snps': 37235}. Best is trial 39 with value: 0.09449081425448297.
[I 2025-11-03 13:05:36,178] Trial 44 finished with value: 0.018262346317908504 and parameters: {'model_type': 'gcn', 'hidden_dims': '[128, 64]', 'dropout': 0.34404678124437377, 'batch_norm': False, 'lr': 0.00033099893050119757, 'weight_decay': 2.2904863559291518e-07, 'epochs': 182, 'loss': 'mse', 'optimizer': 'adam', 'graph_mode': 'cutoff', 'cutoff': 0.22520863414774667, 'grm_norm': 'gcn', 'self_loops': True, 'use_snp_selection': True, 'num_snps': 22374}. Best is trial 39 with value: 0.09449081425448297.
[I 2025-11-03 13:05:37,807] Trial 45 finished with value: 0.04707339376861312 and parameters: {'model_type': 'gcn', 'hidden_dims': '[256, 128, 64]', 'dropout': 0.2684821373873741, 'batch_norm': True, 'lr': 0.00014568488354429603, 'weight_decay': 5.006211404544863e-07, 'epochs': 81, 'loss': 'mse', 'optimizer': 'adam', 'graph_mode': 'cutoff', 'cutoff': 0.8225011275330951, 'grm_norm': 'none', 'self_loops': False, 'use_snp_selection': False}. Best is trial 39 with value: 0.09449081425448297.
[I 2025-11-03 13:05:41,272] Trial 46 finished with value: 0.017846153429902353 and parameters: {'model_type': 'gcn', 'hidden_dims': '[128, 64]', 'dropout': 0.37235035215640105, 'batch_norm': False, 'lr': 0.000213511638693278, 'weight_decay': 1.5074908188868936e-07, 'epochs': 155, 'loss': 'mse', 'optimizer': 'adam', 'graph_mode': 'knn', 'source': 'grm', 'knn_k': 1, 'weighted_edges': True, 'symmetrize_mode': 'union', 'use_snp_selection': True, 'num_snps': 52869}. Best is trial 39 with value: 0.09449081425448297.
