[I 2025-11-03 12:25:52,949] Trial 147 finished with value: 0.099873066393021 and parameters: {'model_type': 'graphsage', 'hidden_dims': '[512, 128]', 'dropout': 0.2365739091662615, 'batch_norm': False, 'lr': 0.00012279647451701568, 'weight_decay': 5.4863083687754554e-06, 'epochs': 320, 'loss': 'mae', 'optimizer': 'adam', 'graph_mode': 'cutoff', 'cutoff': 0.6109181348913509, 'grm_norm': 'cosine_then_gcn', 'self_loops': False, 'use_snp_selection': True, 'num_snps': 55789}. Best is trial 107 with value: 0.11409765987497401.
[I 2025-11-03 12:26:01,310] Trial 148 finished with value: 0.09149079329394179 and parameters: {'model_type': 'graphsage', 'hidden_dims': '[512, 128]', 'dropout': 0.23706490234325708, 'batch_norm': False, 'lr': 0.00018388189196809633, 'weight_decay': 6.040746941513396e-06, 'epochs': 321, 'loss': 'mae', 'optimizer': 'adam', 'graph_mode': 'cutoff', 'cutoff': 0.5735420159035975, 'grm_norm': 'cosine_then_gcn', 'self_loops': False, 'use_snp_selection': True, 'num_snps': 55423}. Best is trial 107 with value: 0.11409765987497401.
[I 2025-11-03 12:26:09,947] Trial 149 finished with value: 0.08714480322287492 and parameters: {'model_type': 'graphsage', 'hidden_dims': '[512, 128]', 'dropout': 0.21592332258221725, 'batch_norm': False, 'lr': 0.0001295615435366807, 'weight_decay': 4.1775268214753515e-06, 'epochs': 349, 'loss': 'mae', 'optimizer': 'adam', 'graph_mode': 'cutoff', 'cutoff': 0.5508706151498356, 'grm_norm': 'cosine_then_gcn', 'self_loops': False, 'use_snp_selection': True, 'num_snps': 54274}. Best is trial 107 with value: 0.11409765987497401.
[I 2025-11-03 12:26:16,292] Trial 0 finished with value: 0.055961538155853856 and parameters: {'model_type': 'graphsage', 'hidden_dims': '[128, 64]', 'dropout': 0.199031432379812, 'batch_norm': True, 'lr': 1.8408544111075837e-06, 'weight_decay': 5.5136510071208614e-05, 'epochs': 336, 'loss': 'mae', 'optimizer': 'adam', 'graph_mode': 'knn', 'source': 'grm', 'knn_k': 8, 'weighted_edges': True, 'symmetrize_mode': 'mutual', 'use_snp_selection': False}. Best is trial 0 with value: 0.055961538155853856.
[I 2025-11-03 12:26:18,926] Trial 1 finished with value: 0.1593555494337987 and parameters: {'model_type': 'graphsage', 'hidden_dims': '[128, 64]', 'dropout': 0.40051947670227217, 'batch_norm': True, 'lr': 0.0005320428882732732, 'weight_decay': 1.89210117736594e-06, 'epochs': 68, 'loss': 'mse', 'optimizer': 'adam', 'graph_mode': 'knn', 'source': 'grm', 'knn_k': 7, 'weighted_edges': True, 'symmetrize_mode': 'union', 'use_snp_selection': False}. Best is trial 1 with value: 0.1593555494337987.
[I 2025-11-03 12:26:23,019] Trial 2 finished with value: 0.08574198627510991 and parameters: {'model_type': 'graphsage', 'hidden_dims': '[256, 128]', 'dropout': 0.5105528289184642, 'batch_norm': False, 'lr': 0.0006804279372404962, 'weight_decay': 0.0008922815224257085, 'epochs': 181, 'loss': 'mse', 'optimizer': 'adam', 'graph_mode': 'cutoff', 'cutoff': 0.5741905641612706, 'grm_norm': 'gcn', 'self_loops': False, 'use_snp_selection': True, 'num_snps': 26910}. Best is trial 1 with value: 0.1593555494337987.
[I 2025-11-03 12:26:27,461] Trial 3 finished with value: 0.04839459967290724 and parameters: {'model_type': 'graphsage', 'hidden_dims': '[256, 128, 64]', 'dropout': 0.5390483213624292, 'batch_norm': False, 'lr': 3.4705625989073525e-05, 'weight_decay': 2.4623319020131338e-05, 'epochs': 121, 'loss': 'mse', 'optimizer': 'adam', 'graph_mode': 'knn', 'source': 'grm', 'knn_k': 6, 'weighted_edges': False, 'symmetrize_mode': 'mutual', 'use_snp_selection': True, 'num_snps': 30713}. Best is trial 1 with value: 0.1593555494337987.
[I 2025-11-03 12:26:31,355] Trial 4 finished with value: 0.03227646314414584 and parameters: {'model_type': 'graphsage', 'hidden_dims': '[128, 64]', 'dropout': 0.13404863676897502, 'batch_norm': False, 'lr': 0.0001431556295367288, 'weight_decay': 2.2084517750726675e-05, 'epochs': 51, 'loss': 'mae', 'optimizer': 'adam', 'graph_mode': 'cutoff', 'cutoff': 0.6714268476993044, 'grm_norm': 'none', 'self_loops': False, 'use_snp_selection': True, 'num_snps': 45645}. Best is trial 1 with value: 0.1593555494337987.
[I 2025-11-03 12:26:36,635] Trial 5 finished with value: 0.1702301026917181 and parameters: {'model_type': 'graphsage', 'hidden_dims': '[256, 128]', 'dropout': 0.42253606323412096, 'batch_norm': False, 'lr': 4.238630400638805e-05, 'weight_decay': 8.074086040046576e-07, 'epochs': 158, 'loss': 'mae', 'optimizer': 'adam', 'graph_mode': 'knn', 'source': 'grm', 'knn_k': 1, 'weighted_edges': False, 'symmetrize_mode': 'mutual', 'use_snp_selection': True, 'num_snps': 43113}. Best is trial 5 with value: 0.1702301026917181.
[I 2025-11-03 12:26:44,408] Trial 6 finished with value: 0.17598734759364715 and parameters: {'model_type': 'graphsage', 'hidden_dims': '[512, 256]', 'dropout': 0.3534893146320237, 'batch_norm': True, 'lr': 0.000251307964226932, 'weight_decay': 1.821819791794022e-05, 'epochs': 223, 'loss': 'mae', 'optimizer': 'adam', 'graph_mode': 'knn', 'source': 'grm', 'knn_k': 1, 'weighted_edges': True, 'symmetrize_mode': 'mutual', 'use_snp_selection': False}. Best is trial 6 with value: 0.17598734759364715.
[I 2025-11-03 12:26:51,228] Trial 7 finished with value: 0.12048088794052964 and parameters: {'model_type': 'graphsage', 'hidden_dims': '[512, 256]', 'dropout': 0.1105825955860775, 'batch_norm': True, 'lr': 2.374338412754043e-05, 'weight_decay': 1.1284721123340274e-05, 'epochs': 190, 'loss': 'mse', 'optimizer': 'adam', 'graph_mode': 'cutoff', 'cutoff': 0.719872204109604, 'grm_norm': 'gcn', 'self_loops': False, 'use_snp_selection': False}. Best is trial 6 with value: 0.17598734759364715.
[I 2025-11-03 12:26:56,899] Trial 8 finished with value: 0.15731731008191693 and parameters: {'model_type': 'graphsage', 'hidden_dims': '[512, 128]', 'dropout': 0.5066580418354021, 'batch_norm': True, 'lr': 0.00039213678276659976, 'weight_decay': 3.43655320802934e-06, 'epochs': 120, 'loss': 'mse', 'optimizer': 'adam', 'graph_mode': 'cutoff', 'cutoff': 0.34923059576505366, 'grm_norm': 'cosine', 'self_loops': True, 'use_snp_selection': False}. Best is trial 6 with value: 0.17598734759364715.
[I 2025-11-03 12:27:00,659] Trial 9 finished with value: 0.07536849300131372 and parameters: {'model_type': 'graphsage', 'hidden_dims': '[512, 256]', 'dropout': 0.301734920240333, 'batch_norm': False, 'lr': 6.650961854953448e-06, 'weight_decay': 6.861575656590315e-05, 'epochs': 150, 'loss': 'mae', 'optimizer': 'adam', 'graph_mode': 'cutoff', 'cutoff': 0.2857569870061939, 'grm_norm': 'cosine_then_gcn', 'self_loops': False, 'use_snp_selection': True, 'num_snps': 12722}. Best is trial 6 with value: 0.17598734759364715.
[I 2025-11-03 12:27:10,151] Trial 10 finished with value: 0.169315073346827 and parameters: {'model_type': 'graphsage', 'hidden_dims': '[512, 64]', 'dropout': 0.2833599465317005, 'batch_norm': True, 'lr': 0.00016916760584270694, 'weight_decay': 1.7866650996308468e-07, 'epochs': 275, 'loss': 'mae', 'optimizer': 'adam', 'graph_mode': 'knn', 'source': 'grm', 'knn_k': 1, 'weighted_edges': True, 'symmetrize_mode': 'union', 'use_snp_selection': False}. Best is trial 6 with value: 0.17598734759364715.
[I 2025-11-03 12:27:17,818] Trial 11 finished with value: 0.16134136580527786 and parameters: {'model_type': 'graphsage', 'hidden_dims': '[256, 128]', 'dropout': 0.39027096638017356, 'batch_norm': False, 'lr': 4.996739774699493e-05, 'weight_decay': 2.0841571202758476e-07, 'epochs': 245, 'loss': 'mae', 'optimizer': 'adam', 'graph_mode': 'knn', 'source': 'grm', 'knn_k': 1, 'weighted_edges': False, 'symmetrize_mode': 'mutual', 'use_snp_selection': True, 'num_snps': 57977}. Best is trial 6 with value: 0.17598734759364715.
[I 2025-11-03 12:27:27,144] Trial 12 finished with value: 0.17060511224291755 and parameters: {'model_type': 'graphsage', 'hidden_dims': '[512, 256]', 'dropout': 0.4338395499929968, 'batch_norm': True, 'lr': 0.00012059085553112924, 'weight_decay': 1.2429457001038862e-06, 'epochs': 245, 'loss': 'mae', 'optimizer': 'adam', 'graph_mode': 'knn', 'source': 'grm', 'knn_k': 3, 'weighted_edges': False, 'symmetrize_mode': 'mutual', 'use_snp_selection': True, 'num_snps': 46224}. Best is trial 6 with value: 0.17598734759364715.
[I 2025-11-03 12:27:36,578] Trial 13 finished with value: 0.1582375013699783 and parameters: {'model_type': 'graphsage', 'hidden_dims': '[512, 256]', 'dropout': 0.5987664447608956, 'batch_norm': True, 'lr': 0.00015509465507198577, 'weight_decay': 0.0002890374972950083, 'epochs': 258, 'loss': 'mae', 'optimizer': 'adam', 'graph_mode': 'knn', 'source': 'grm', 'knn_k': 4, 'weighted_edges': False, 'symmetrize_mode': 'mutual', 'use_snp_selection': False}. Best is trial 6 with value: 0.17598734759364715.
[I 2025-11-03 12:27:47,353] Trial 14 finished with value: 0.16741944917438106 and parameters: {'model_type': 'graphsage', 'hidden_dims': '[512, 256]', 'dropout': 0.3221305920488654, 'batch_norm': True, 'lr': 0.00010963576836616192, 'weight_decay': 3.2502196524136146e-06, 'epochs': 304, 'loss': 'mae', 'optimizer': 'adam', 'graph_mode': 'knn', 'source': 'grm', 'knn_k': 4, 'weighted_edges': True, 'symmetrize_mode': 'mutual', 'use_snp_selection': False}. Best is trial 6 with value: 0.17598734759364715.
[I 2025-11-03 12:27:50,484] Trial 15 finished with value: 0.08986614518214492 and parameters: {'model_type': 'graphsage', 'hidden_dims': '[512, 256]', 'dropout': 0.4578984132187882, 'batch_norm': True, 'lr': 0.00030461115256337316, 'weight_decay': 6.943573812609469e-07, 'epochs': 233, 'loss': 'mae', 'optimizer': 'adam', 'graph_mode': 'knn', 'source': 'grm', 'knn_k': 3, 'weighted_edges': True, 'symmetrize_mode': 'mutual', 'use_snp_selection': True, 'num_snps': 4426}. Best is trial 6 with value: 0.17598734759364715.
[I 2025-11-03 12:28:02,226] Trial 16 finished with value: 0.10514958592053161 and parameters: {'model_type': 'graphsage', 'hidden_dims': '[512, 64]', 'dropout': 0.22683554587822735, 'batch_norm': True, 'lr': 1.1988270245928045e-05, 'weight_decay': 6.027706971212316e-06, 'epochs': 224, 'loss': 'mae', 'optimizer': 'adam', 'graph_mode': 'knn', 'source': 'grm', 'knn_k': 10, 'weighted_edges': False, 'symmetrize_mode': 'union', 'use_snp_selection': False}. Best is trial 6 with value: 0.17598734759364715.
[I 2025-11-03 12:28:11,841] Trial 17 finished with value: 0.1394683424476569 and parameters: {'model_type': 'graphsage', 'hidden_dims': '[256, 128, 64]', 'dropout': 0.36019534065748227, 'batch_norm': True, 'lr': 6.354539374008195e-05, 'weight_decay': 1.050580996676227e-06, 'epochs': 293, 'loss': 'mae', 'optimizer': 'adam', 'graph_mode': 'knn', 'source': 'grm', 'knn_k': 3, 'weighted_edges': True, 'symmetrize_mode': 'mutual', 'use_snp_selection': True, 'num_snps': 59561}. Best is trial 6 with value: 0.17598734759364715.
[I 2025-11-03 12:28:19,634] Trial 18 finished with value: 0.15986981541920778 and parameters: {'model_type': 'graphsage', 'hidden_dims': '[512, 128]', 'dropout': 0.46464024168360696, 'batch_norm': True, 'lr': 0.0009214602117878008, 'weight_decay': 0.00013350290016222785, 'epochs': 210, 'loss': 'mae', 'optimizer': 'adam', 'graph_mode': 'knn', 'source': 'grm', 'knn_k': 3, 'weighted_edges': False, 'symmetrize_mode': 'mutual', 'use_snp_selection': False}. Best is trial 6 with value: 0.17598734759364715.
[I 2025-11-03 12:28:29,892] Trial 19 finished with value: 0.04191621053344067 and parameters: {'model_type': 'graphsage', 'hidden_dims': '[512, 256]', 'dropout': 0.23291490221721556, 'batch_norm': True, 'lr': 1.0732177328169674e-06, 'weight_decay': 1.357980837877316e-05, 'epochs': 307, 'loss': 'mae', 'optimizer': 'adam', 'graph_mode': 'knn', 'source': 'grm', 'knn_k': 2, 'weighted_edges': False, 'symmetrize_mode': 'union', 'use_snp_selection': True, 'num_snps': 43014}. Best is trial 6 with value: 0.17598734759364715.
[I 2025-11-03 12:28:36,109] Trial 20 finished with value: 0.1445103955535554 and parameters: {'model_type': 'graphsage', 'hidden_dims': '[512, 256]', 'dropout': 0.3527866234106657, 'batch_norm': True, 'lr': 0.0002672177378674416, 'weight_decay': 3.581391189911312e-07, 'epochs': 333, 'loss': 'mae', 'optimizer': 'adam', 'graph_mode': 'knn', 'source': 'grm', 'knn_k': 5, 'weighted_edges': True, 'symmetrize_mode': 'mutual', 'use_snp_selection': True, 'num_snps': 20304}. Best is trial 6 with value: 0.17598734759364715.
[I 2025-11-03 12:28:41,359] Trial 21 finished with value: 0.11568535708333595 and parameters: {'model_type': 'graphsage', 'hidden_dims': '[256, 128]', 'dropout': 0.4154761330579586, 'batch_norm': False, 'lr': 1.695690112755187e-05, 'weight_decay': 6.777086077327474e-07, 'epochs': 151, 'loss': 'mae', 'optimizer': 'adam', 'graph_mode': 'knn', 'source': 'grm', 'knn_k': 1, 'weighted_edges': False, 'symmetrize_mode': 'mutual', 'use_snp_selection': True, 'num_snps': 44285}. Best is trial 6 with value: 0.17598734759364715.
[I 2025-11-03 12:28:46,401] Trial 22 finished with value: 0.12737831011096834 and parameters: {'model_type': 'graphsage', 'hidden_dims': '[256, 128]', 'dropout': 0.4500637979447354, 'batch_norm': False, 'lr': 7.841600267465217e-05, 'weight_decay': 1.3171377347478318e-06, 'epochs': 174, 'loss': 'mae', 'optimizer': 'adam', 'graph_mode': 'knn', 'source': 'grm', 'knn_k': 2, 'weighted_edges': False, 'symmetrize_mode': 'mutual', 'use_snp_selection': True, 'num_snps': 37861}. Best is trial 6 with value: 0.17598734759364715.
[I 2025-11-03 12:28:53,195] Trial 23 finished with value: 0.10867728847088746 and parameters: {'model_type': 'graphsage', 'hidden_dims': '[256, 128]', 'dropout': 0.42090919894240003, 'batch_norm': False, 'lr': 8.032435869272236e-06, 'weight_decay': 4.832712742572469e-06, 'epochs': 209, 'loss': 'mae', 'optimizer': 'adam', 'graph_mode': 'knn', 'source': 'grm', 'knn_k': 2, 'weighted_edges': False, 'symmetrize_mode': 'mutual', 'use_snp_selection': True, 'num_snps': 51186}. Best is trial 6 with value: 0.17598734759364715.
[I 2025-11-03 12:28:58,216] Trial 24 finished with value: 0.1297342770929908 and parameters: {'model_type': 'graphsage', 'hidden_dims': '[512, 256]', 'dropout': 0.3579398799368945, 'batch_norm': False, 'lr': 3.985155678447025e-05, 'weight_decay': 1.1503155575049963e-07, 'epochs': 91, 'loss': 'mae', 'optimizer': 'adam', 'graph_mode': 'knn', 'source': 'grm', 'knn_k': 1, 'weighted_edges': False, 'symmetrize_mode': 'mutual', 'use_snp_selection': True, 'num_snps': 36683}. Best is trial 6 with value: 0.17598734759364715.
[I 2025-11-03 12:29:08,459] Trial 25 finished with value: 0.1350418840048849 and parameters: {'model_type': 'graphsage', 'hidden_dims': '[512, 64]', 'dropout': 0.5636636952382231, 'batch_norm': True, 'lr': 0.00023945742587491494, 'weight_decay': 3.9744630597987984e-07, 'epochs': 266, 'loss': 'mae', 'optimizer': 'adam', 'graph_mode': 'knn', 'source': 'grm', 'knn_k': 2, 'weighted_edges': False, 'symmetrize_mode': 'mutual', 'use_snp_selection': True, 'num_snps': 51628}. Best is trial 6 with value: 0.17598734759364715.
[I 2025-11-03 12:29:14,399] Trial 26 finished with value: 0.11344016932414173 and parameters: {'model_type': 'graphsage', 'hidden_dims': '[512, 128]', 'dropout': 0.4765625079717057, 'batch_norm': False, 'lr': 8.68773140024024e-05, 'weight_decay': 1.864946714117745e-06, 'epochs': 158, 'loss': 'mse', 'optimizer': 'adam', 'graph_mode': 'cutoff', 'cutoff': 0.8708622394452445, 'grm_norm': 'none', 'self_loops': True, 'use_snp_selection': False}. Best is trial 6 with value: 0.17598734759364715.
[I 2025-11-03 12:29:19,108] Trial 27 finished with value: 0.0184300400092955 and parameters: {'model_type': 'graphsage', 'hidden_dims': '[256, 128, 64]', 'dropout': 0.31765992593770553, 'batch_norm': True, 'lr': 3.7361880433235126e-06, 'weight_decay': 8.053831022247675e-06, 'epochs': 115, 'loss': 'mae', 'optimizer': 'adam', 'graph_mode': 'knn', 'source': 'grm', 'knn_k': 4, 'weighted_edges': True, 'symmetrize_mode': 'mutual', 'use_snp_selection': True, 'num_snps': 36359}. Best is trial 6 with value: 0.17598734759364715.
[I 2025-11-03 12:29:23,601] Trial 28 finished with value: 0.1398897924151699 and parameters: {'model_type': 'graphsage', 'hidden_dims': '[256, 128]', 'dropout': 0.38152120752732793, 'batch_norm': False, 'lr': 2.123452979153628e-05, 'weight_decay': 3.76165766899813e-05, 'epochs': 201, 'loss': 'mae', 'optimizer': 'adam', 'graph_mode': 'knn', 'source': 'grm', 'knn_k': 1, 'weighted_edges': False, 'symmetrize_mode': 'mutual', 'use_snp_selection': False}. Best is trial 6 with value: 0.17598734759364715.
[I 2025-11-03 12:29:29,467] Trial 29 finished with value: 0.13241749055340285 and parameters: {'model_type': 'graphsage', 'hidden_dims': '[128, 64]', 'dropout': 0.2657017520545595, 'batch_norm': True, 'lr': 4.89159997043453e-05, 'weight_decay': 7.2769541568749e-05, 'epochs': 344, 'loss': 'mae', 'optimizer': 'adam', 'graph_mode': 'knn', 'source': 'grm', 'knn_k': 3, 'weighted_edges': True, 'symmetrize_mode': 'union', 'use_snp_selection': False}. Best is trial 6 with value: 0.17598734759364715.
[I 2025-11-03 12:29:39,716] Trial 30 finished with value: 0.16501050029624625 and parameters: {'model_type': 'graphsage', 'hidden_dims': '[512, 256]', 'dropout': 0.4291688754511707, 'batch_norm': True, 'lr': 0.00011350655220944167, 'weight_decay': 2.7058369222047155e-06, 'epochs': 227, 'loss': 'mae', 'optimizer': 'adam', 'graph_mode': 'knn', 'source': 'grm', 'knn_k': 5, 'weighted_edges': False, 'symmetrize_mode': 'mutual', 'use_snp_selection': True, 'num_snps': 52102}. Best is trial 6 with value: 0.17598734759364715.
[I 2025-11-03 12:29:49,003] Trial 31 finished with value: 0.1694980711912776 and parameters: {'model_type': 'graphsage', 'hidden_dims': '[512, 64]', 'dropout': 0.27852187488200314, 'batch_norm': True, 'lr': 0.00017803980977514747, 'weight_decay': 1.4224948891931047e-07, 'epochs': 267, 'loss': 'mae', 'optimizer': 'adam', 'graph_mode': 'knn', 'source': 'grm', 'knn_k': 1, 'weighted_edges': True, 'symmetrize_mode': 'union', 'use_snp_selection': False}. Best is trial 6 with value: 0.17598734759364715.
[I 2025-11-03 12:29:59,173] Trial 32 finished with value: 0.16185503313488106 and parameters: {'model_type': 'graphsage', 'hidden_dims': '[512, 64]', 'dropout': 0.17093816551235222, 'batch_norm': True, 'lr': 0.0002028631883481083, 'weight_decay': 1.0039180008071745e-07, 'epochs': 282, 'loss': 'mae', 'optimizer': 'adam', 'graph_mode': 'knn', 'source': 'grm', 'knn_k': 2, 'weighted_edges': True, 'symmetrize_mode': 'union', 'use_snp_selection': False}. Best is trial 6 with value: 0.17598734759364715.
[I 2025-11-03 12:30:08,053] Trial 33 finished with value: 0.16675929002888926 and parameters: {'model_type': 'graphsage', 'hidden_dims': '[512, 64]', 'dropout': 0.24957766105045603, 'batch_norm': True, 'lr': 0.0004358738195211114, 'weight_decay': 3.6988801772909117e-07, 'epochs': 252, 'loss': 'mae', 'optimizer': 'adam', 'graph_mode': 'knn', 'source': 'grm', 'knn_k': 1, 'weighted_edges': True, 'symmetrize_mode': 'union', 'use_snp_selection': False}. Best is trial 6 with value: 0.17598734759364715.
[I 2025-11-03 12:30:15,106] Trial 34 finished with value: 0.1517245375526164 and parameters: {'model_type': 'graphsage', 'hidden_dims': '[512, 64]', 'dropout': 0.3301905075512911, 'batch_norm': True, 'lr': 0.0006010384038378122, 'weight_decay': 6.8467209730396e-07, 'epochs': 172, 'loss': 'mse', 'optimizer': 'adam', 'graph_mode': 'knn', 'source': 'grm', 'knn_k': 2, 'weighted_edges': True, 'symmetrize_mode': 'union', 'use_snp_selection': False}. Best is trial 6 with value: 0.17598734759364715.
[I 2025-11-03 12:30:18,778] Trial 35 finished with value: 0.14343693088541215 and parameters: {'model_type': 'graphsage', 'hidden_dims': '[128, 64]', 'dropout': 0.49033937151931534, 'batch_norm': True, 'lr': 8.226661030149887e-05, 'weight_decay': 2.1278412650593534e-07, 'epochs': 240, 'loss': 'mae', 'optimizer': 'adam', 'graph_mode': 'knn', 'source': 'grm', 'knn_k': 1, 'weighted_edges': True, 'symmetrize_mode': 'union', 'use_snp_selection': False}. Best is trial 6 with value: 0.17598734759364715.
[I 2025-11-03 12:30:26,185] Trial 36 finished with value: 0.12222228553048191 and parameters: {'model_type': 'graphsage', 'hidden_dims': '[256, 128]', 'dropout': 0.3836817975166949, 'batch_norm': False, 'lr': 0.0001308829397165997, 'weight_decay': 1.4650109091872653e-05, 'epochs': 326, 'loss': 'mse', 'optimizer': 'adam', 'graph_mode': 'cutoff', 'cutoff': 0.4257983408103817, 'grm_norm': 'cosine_then_gcn', 'self_loops': True, 'use_snp_selection': False}. Best is trial 6 with value: 0.17598734759364715.
[I 2025-11-03 12:30:30,400] Trial 37 finished with value: 0.11176767691824015 and parameters: {'model_type': 'graphsage', 'hidden_dims': '[256, 128, 64]', 'dropout': 0.19439477289664353, 'batch_norm': True, 'lr': 2.719217859795128e-05, 'weight_decay': 1.523637285372678e-06, 'epochs': 194, 'loss': 'mae', 'optimizer': 'adam', 'graph_mode': 'knn', 'source': 'grm', 'knn_k': 3, 'weighted_edges': True, 'symmetrize_mode': 'mutual', 'use_snp_selection': True, 'num_snps': 23123}. Best is trial 6 with value: 0.17598734759364715.
[I 2025-11-03 12:30:37,791] Trial 38 finished with value: 0.13006869197212237 and parameters: {'model_type': 'graphsage', 'hidden_dims': '[512, 256]', 'dropout': 0.5163985353267294, 'batch_norm': False, 'lr': 0.0003826823837947793, 'weight_decay': 2.9406840355543855e-05, 'epochs': 216, 'loss': 'mse', 'optimizer': 'adam', 'graph_mode': 'cutoff', 'cutoff': 0.895418681623901, 'grm_norm': 'cosine', 'self_loops': True, 'use_snp_selection': False}. Best is trial 6 with value: 0.17598734759364715.
