[I 2025-11-03 15:22:26,107] Trial 11 finished with value: 0.10025797621365745 and parameters: {'model_type': 'graphsage', 'hidden_dims': '[512, 64]', 'dropout': 0.2859699507705008, 'batch_norm': True, 'lr': 0.00012623783700890367, 'weight_decay': 1.680520994398766e-07, 'epochs': 274, 'loss': 'mae', 'optimizer': 'adam', 'graph_mode': 'knn', 'source': 'grm', 'knn_k': 1, 'weighted_edges': True, 'symmetrize_mode': 'union', 'use_snp_selection': False}. Best is trial 11 with value: 0.10025797621365745.
[I 2025-11-03 15:22:29,886] Trial 12 finished with value: 0.08834049164608496 and parameters: {'model_type': 'graphsage', 'hidden_dims': '[512, 64]', 'dropout': 0.2516138819478735, 'batch_norm': True, 'lr': 0.00011934893004304496, 'weight_decay': 1.0887150741139413e-07, 'epochs': 253, 'loss': 'mae', 'optimizer': 'adam', 'graph_mode': 'knn', 'source': 'grm', 'knn_k': 3, 'weighted_edges': True, 'symmetrize_mode': 'union', 'use_snp_selection': False}. Best is trial 11 with value: 0.10025797621365745.
[I 2025-11-03 15:22:33,609] Trial 13 finished with value: 0.0659472201104355 and parameters: {'model_type': 'graphsage', 'hidden_dims': '[512, 64]', 'dropout': 0.3597295172492356, 'batch_norm': True, 'lr': 7.689848153447392e-05, 'weight_decay': 0.000399947667615736, 'epochs': 251, 'loss': 'mae', 'optimizer': 'adam', 'graph_mode': 'knn', 'source': 'grm', 'knn_k': 4, 'weighted_edges': True, 'symmetrize_mode': 'mutual', 'use_snp_selection': False}. Best is trial 11 with value: 0.10025797621365745.
[I 2025-11-03 15:22:37,772] Trial 14 finished with value: 0.068456703695471 and parameters: {'model_type': 'graphsage', 'hidden_dims': '[512, 256]', 'dropout': 0.44076965942752383, 'batch_norm': True, 'lr': 1.2586985041154999e-05, 'weight_decay': 8.665907472910647e-07, 'epochs': 303, 'loss': 'mae', 'optimizer': 'adam', 'graph_mode': 'knn', 'source': 'grm', 'knn_k': 3, 'weighted_edges': True, 'symmetrize_mode': 'union', 'use_snp_selection': False}. Best is trial 11 with value: 0.10025797621365745.
[I 2025-11-03 15:22:41,305] Trial 15 finished with value: 0.09862206333214804 and parameters: {'model_type': 'graphsage', 'hidden_dims': '[512, 128]', 'dropout': 0.3355876786391346, 'batch_norm': True, 'lr': 0.0002980455072267111, 'weight_decay': 0.00013722890470534003, 'epochs': 221, 'loss': 'mae', 'optimizer': 'adam', 'graph_mode': 'knn', 'source': 'grm', 'knn_k': 1, 'weighted_edges': True, 'symmetrize_mode': 'union', 'use_snp_selection': False}. Best is trial 11 with value: 0.10025797621365745.
[I 2025-11-03 15:22:44,454] Trial 16 finished with value: 0.10136815160040041 and parameters: {'model_type': 'graphsage', 'hidden_dims': '[256, 128, 64]', 'dropout': 0.21340045660836107, 'batch_norm': True, 'lr': 0.0008000134635777176, 'weight_decay': 5.085827627871818e-06, 'epochs': 331, 'loss': 'mae', 'optimizer': 'adam', 'graph_mode': 'knn', 'source': 'grm', 'knn_k': 10, 'weighted_edges': False, 'symmetrize_mode': 'mutual', 'use_snp_selection': False}. Best is trial 16 with value: 0.10136815160040041.
[I 2025-11-03 15:22:47,716] Trial 17 finished with value: 0.08728726922848548 and parameters: {'model_type': 'graphsage', 'hidden_dims': '[256, 128, 64]', 'dropout': 0.19841826544391264, 'batch_norm': True, 'lr': 0.0006123078691199631, 'weight_decay': 3.0426162657947337e-07, 'epochs': 349, 'loss': 'mae', 'optimizer': 'adam', 'graph_mode': 'knn', 'source': 'grm', 'knn_k': 9, 'weighted_edges': False, 'symmetrize_mode': 'union', 'use_snp_selection': False}. Best is trial 16 with value: 0.10136815160040041.
[I 2025-11-03 15:22:50,776] Trial 18 finished with value: 0.0887739622531337 and parameters: {'model_type': 'graphsage', 'hidden_dims': '[256, 128, 64]', 'dropout': 0.20588978637538785, 'batch_norm': True, 'lr': 0.0009547680064404149, 'weight_decay': 5.071526406113485e-06, 'epochs': 310, 'loss': 'mae', 'optimizer': 'adam', 'graph_mode': 'knn', 'source': 'grm', 'knn_k': 10, 'weighted_edges': False, 'symmetrize_mode': 'mutual', 'use_snp_selection': False}. Best is trial 16 with value: 0.10136815160040041.
[I 2025-11-03 15:22:54,857] Trial 19 finished with value: 0.08642114275548846 and parameters: {'model_type': 'graphsage', 'hidden_dims': '[512, 64]', 'dropout': 0.2453710254687989, 'batch_norm': True, 'lr': 7.196733253377153e-05, 'weight_decay': 5.066251508789654e-07, 'epochs': 302, 'loss': 'mae', 'optimizer': 'adam', 'graph_mode': 'knn', 'source': 'grm', 'knn_k': 5, 'weighted_edges': False, 'symmetrize_mode': 'mutual', 'use_snp_selection': False}. Best is trial 16 with value: 0.10136815160040041.
[I 2025-11-03 15:22:57,810] Trial 20 finished with value: 0.01280848344487425 and parameters: {'model_type': 'graphsage', 'hidden_dims': '[256, 128, 64]', 'dropout': 0.14696804701319324, 'batch_norm': True, 'lr': 3.6318419901982732e-06, 'weight_decay': 1.5058591877802172e-06, 'epochs': 278, 'loss': 'mae', 'optimizer': 'adam', 'graph_mode': 'knn', 'source': 'grm', 'knn_k': 10, 'weighted_edges': False, 'symmetrize_mode': 'union', 'use_snp_selection': False}. Best is trial 16 with value: 0.10136815160040041.
[I 2025-11-03 15:23:01,383] Trial 21 finished with value: 0.09263165701365778 and parameters: {'model_type': 'graphsage', 'hidden_dims': '[512, 256]', 'dropout': 0.5980780865101266, 'batch_norm': True, 'lr': 0.0002525474707554901, 'weight_decay': 8.123541358635357e-06, 'epochs': 231, 'loss': 'mae', 'optimizer': 'adam', 'graph_mode': 'knn', 'source': 'grm', 'knn_k': 2, 'weighted_edges': True, 'symmetrize_mode': 'mutual', 'use_snp_selection': False}. Best is trial 16 with value: 0.10136815160040041.
[I 2025-11-03 15:23:04,907] Trial 22 finished with value: 0.09525035089724768 and parameters: {'model_type': 'graphsage', 'hidden_dims': '[512, 256]', 'dropout': 0.35045826018414344, 'batch_norm': True, 'lr': 0.00023870928550702978, 'weight_decay': 1.6698817850355373e-05, 'epochs': 218, 'loss': 'mae', 'optimizer': 'adam', 'graph_mode': 'knn', 'source': 'grm', 'knn_k': 3, 'weighted_edges': True, 'symmetrize_mode': 'mutual', 'use_snp_selection': False}. Best is trial 16 with value: 0.10136815160040041.
[I 2025-11-03 15:23:07,974] Trial 23 finished with value: 0.06412431532051825 and parameters: {'model_type': 'graphsage', 'hidden_dims': '[256, 128, 64]', 'dropout': 0.27530306466070964, 'batch_norm': True, 'lr': 7.087687099939902e-05, 'weight_decay': 3.0978399500788733e-06, 'epochs': 318, 'loss': 'mae', 'optimizer': 'adam', 'graph_mode': 'knn', 'source': 'grm', 'knn_k': 5, 'weighted_edges': False, 'symmetrize_mode': 'mutual', 'use_snp_selection': False}. Best is trial 16 with value: 0.10136815160040041.
[I 2025-11-03 15:23:11,857] Trial 24 finished with value: 0.10630196334703168 and parameters: {'model_type': 'graphsage', 'hidden_dims': '[512, 64]', 'dropout': 0.3166636549411996, 'batch_norm': True, 'lr': 0.0008620776378615861, 'weight_decay': 4.214722044453563e-05, 'epochs': 282, 'loss': 'mae', 'optimizer': 'adam', 'graph_mode': 'knn', 'source': 'grm', 'knn_k': 2, 'weighted_edges': True, 'symmetrize_mode': 'mutual', 'use_snp_selection': False}. Best is trial 24 with value: 0.10630196334703168.
[I 2025-11-03 15:23:15,862] Trial 25 finished with value: 0.10407277503149147 and parameters: {'model_type': 'graphsage', 'hidden_dims': '[512, 64]', 'dropout': 0.2259325604638872, 'batch_norm': True, 'lr': 0.0009781454116176084, 'weight_decay': 0.00016102971387036612, 'epochs': 279, 'loss': 'mae', 'optimizer': 'adam', 'graph_mode': 'knn', 'source': 'grm', 'knn_k': 7, 'weighted_edges': True, 'symmetrize_mode': 'mutual', 'use_snp_selection': False}. Best is trial 24 with value: 0.10630196334703168.
[I 2025-11-03 15:23:21,309] Trial 26 finished with value: 0.030192394125622777 and parameters: {'model_type': 'graphsage', 'hidden_dims': '[512, 64]', 'dropout': 0.17147459245592978, 'batch_norm': False, 'lr': 0.0009588184831282251, 'weight_decay': 0.00014870846814663683, 'epochs': 337, 'loss': 'mse', 'optimizer': 'adam', 'graph_mode': 'cutoff', 'cutoff': 0.8765009073803762, 'grm_norm': 'none', 'self_loops': True, 'use_snp_selection': True, 'num_snps': 59005}. Best is trial 24 with value: 0.10630196334703168.
[I 2025-11-03 15:23:25,350] Trial 27 finished with value: 0.10760918263957125 and parameters: {'model_type': 'graphsage', 'hidden_dims': '[512, 64]', 'dropout': 0.2345809414781316, 'batch_norm': True, 'lr': 0.00046032525475963264, 'weight_decay': 4.8709941661839905e-05, 'epochs': 286, 'loss': 'mae', 'optimizer': 'adam', 'graph_mode': 'knn', 'source': 'grm', 'knn_k': 7, 'weighted_edges': False, 'symmetrize_mode': 'mutual', 'use_snp_selection': False}. Best is trial 27 with value: 0.10760918263957125.
[I 2025-11-03 15:23:29,382] Trial 28 finished with value: 0.11009652069915928 and parameters: {'model_type': 'graphsage', 'hidden_dims': '[512, 64]', 'dropout': 0.3098336641534178, 'batch_norm': True, 'lr': 0.0005158471758907266, 'weight_decay': 4.564518906431656e-05, 'epochs': 289, 'loss': 'mae', 'optimizer': 'adam', 'graph_mode': 'knn', 'source': 'grm', 'knn_k': 7, 'weighted_edges': True, 'symmetrize_mode': 'mutual', 'use_snp_selection': False}. Best is trial 28 with value: 0.11009652069915928.
[I 2025-11-03 15:23:33,089] Trial 29 finished with value: 0.11467665111710319 and parameters: {'model_type': 'graphsage', 'hidden_dims': '[512, 64]', 'dropout': 0.31627210356243496, 'batch_norm': True, 'lr': 0.00044414604540745766, 'weight_decay': 4.618937242167516e-05, 'epochs': 242, 'loss': 'mae', 'optimizer': 'adam', 'graph_mode': 'knn', 'source': 'grm', 'knn_k': 7, 'weighted_edges': False, 'symmetrize_mode': 'mutual', 'use_snp_selection': False}. Best is trial 29 with value: 0.11467665111710319.
[I 2025-11-03 15:23:36,885] Trial 30 finished with value: 0.05191095225147665 and parameters: {'model_type': 'graphsage', 'hidden_dims': '[512, 64]', 'dropout': 0.39467047916215325, 'batch_norm': True, 'lr': 1.296380227364303e-06, 'weight_decay': 6.093318681040771e-05, 'epochs': 249, 'loss': 'mae', 'optimizer': 'adam', 'graph_mode': 'knn', 'source': 'grm', 'knn_k': 7, 'weighted_edges': False, 'symmetrize_mode': 'mutual', 'use_snp_selection': False}. Best is trial 29 with value: 0.11467665111710319.
[I 2025-11-03 15:23:41,011] Trial 31 finished with value: 0.09252959996694651 and parameters: {'model_type': 'graphsage', 'hidden_dims': '[512, 64]', 'dropout': 0.32854977352727405, 'batch_norm': True, 'lr': 0.00038061635361010654, 'weight_decay': 3.738385257871676e-05, 'epochs': 293, 'loss': 'mae', 'optimizer': 'adam', 'graph_mode': 'knn', 'source': 'grm', 'knn_k': 8, 'weighted_edges': False, 'symmetrize_mode': 'mutual', 'use_snp_selection': False}. Best is trial 29 with value: 0.11467665111710319.
[I 2025-11-03 15:23:44,897] Trial 32 finished with value: 0.09609714840893797 and parameters: {'model_type': 'graphsage', 'hidden_dims': '[512, 64]', 'dropout': 0.3137239636673354, 'batch_norm': True, 'lr': 0.00044575180735150524, 'weight_decay': 9.585028587933253e-05, 'epochs': 264, 'loss': 'mae', 'optimizer': 'adam', 'graph_mode': 'knn', 'source': 'grm', 'knn_k': 6, 'weighted_edges': False, 'symmetrize_mode': 'mutual', 'use_snp_selection': False}. Best is trial 29 with value: 0.11467665111710319.
[I 2025-11-03 15:23:46,995] Trial 33 finished with value: 0.09985825800524842 and parameters: {'model_type': 'graphsage', 'hidden_dims': '[128, 64]', 'dropout': 0.38893190207299544, 'batch_norm': True, 'lr': 0.0005386314318927553, 'weight_decay': 0.0003258335550339888, 'epochs': 244, 'loss': 'mae', 'optimizer': 'adam', 'graph_mode': 'knn', 'source': 'grm', 'knn_k': 8, 'weighted_edges': False, 'symmetrize_mode': 'mutual', 'use_snp_selection': False}. Best is trial 29 with value: 0.11467665111710319.
[I 2025-11-03 15:23:50,411] Trial 34 finished with value: 0.10569387013649977 and parameters: {'model_type': 'graphsage', 'hidden_dims': '[512, 64]', 'dropout': 0.25305452541893053, 'batch_norm': True, 'lr': 0.00048481341225602745, 'weight_decay': 3.7546235496267035e-05, 'epochs': 205, 'loss': 'mse', 'optimizer': 'adam', 'graph_mode': 'knn', 'source': 'grm', 'knn_k': 6, 'weighted_edges': False, 'symmetrize_mode': 'mutual', 'use_snp_selection': False}. Best is trial 29 with value: 0.11467665111710319.
[I 2025-11-03 15:23:52,280] Trial 35 finished with value: 0.04619040367886812 and parameters: {'model_type': 'graphsage', 'hidden_dims': '[256, 128]', 'dropout': 0.3082101303040491, 'batch_norm': False, 'lr': 0.000620397392106433, 'weight_decay': 3.3248241971557954e-05, 'epochs': 293, 'loss': 'mae', 'optimizer': 'adam', 'graph_mode': 'knn', 'source': 'grm', 'knn_k': 7, 'weighted_edges': True, 'symmetrize_mode': 'mutual', 'use_snp_selection': True, 'num_snps': 2074}. Best is trial 29 with value: 0.11467665111710319.
[I 2025-11-03 15:23:56,469] Trial 36 finished with value: 0.08342033287030386 and parameters: {'model_type': 'graphsage', 'hidden_dims': '[512, 64]', 'dropout': 0.4527817139816478, 'batch_norm': True, 'lr': 0.00019516631469516346, 'weight_decay': 9.377126257455682e-05, 'epochs': 330, 'loss': 'mse', 'optimizer': 'adam', 'graph_mode': 'cutoff', 'cutoff': 0.42596163795855535, 'grm_norm': 'cosine', 'self_loops': True, 'use_snp_selection': False}. Best is trial 29 with value: 0.11467665111710319.
[I 2025-11-03 15:23:58,565] Trial 37 finished with value: 0.02637230838604525 and parameters: {'model_type': 'graphsage', 'hidden_dims': '[128, 64]', 'dropout': 0.17510081237687208, 'batch_norm': False, 'lr': 0.00034401209571438616, 'weight_decay': 0.00033025927953977415, 'epochs': 235, 'loss': 'mae', 'optimizer': 'adam', 'graph_mode': 'knn', 'source': 'grm', 'knn_k': 8, 'weighted_edges': True, 'symmetrize_mode': 'mutual', 'use_snp_selection': True, 'num_snps': 15344}. Best is trial 29 with value: 0.11467665111710319.
[I 2025-11-03 15:24:01,809] Trial 38 finished with value: 0.08770284612660555 and parameters: {'model_type': 'graphsage', 'hidden_dims': '[512, 64]', 'dropout': 0.36473893238364224, 'batch_norm': True, 'lr': 0.00010262075413745138, 'weight_decay': 1.0282697357790994e-05, 'epochs': 175, 'loss': 'mae', 'optimizer': 'adam', 'graph_mode': 'knn', 'source': 'grm', 'knn_k': 5, 'weighted_edges': False, 'symmetrize_mode': 'mutual', 'use_snp_selection': False}. Best is trial 29 with value: 0.11467665111710319.
[I 2025-11-03 15:24:05,599] Trial 39 finished with value: 0.07168327337637556 and parameters: {'model_type': 'graphsage', 'hidden_dims': '[256, 128]', 'dropout': 0.27196542332756124, 'batch_norm': False, 'lr': 4.5978629280325886e-05, 'weight_decay': 0.0006513368993264923, 'epochs': 267, 'loss': 'mse', 'optimizer': 'adam', 'graph_mode': 'cutoff', 'cutoff': 0.8982975816958216, 'grm_norm': 'cosine_then_gcn', 'self_loops': True, 'use_snp_selection': True, 'num_snps': 58379}. Best is trial 29 with value: 0.11467665111710319.
[I 2025-11-03 15:24:09,096] Trial 40 finished with value: 0.044677969914917855 and parameters: {'model_type': 'graphsage', 'hidden_dims': '[512, 64]', 'dropout': 0.37764418267144423, 'batch_norm': True, 'lr': 2.1460724072749175e-05, 'weight_decay': 2.4471515307110205e-05, 'epochs': 202, 'loss': 'mae', 'optimizer': 'adam', 'graph_mode': 'knn', 'source': 'grm', 'knn_k': 9, 'weighted_edges': True, 'symmetrize_mode': 'mutual', 'use_snp_selection': False}. Best is trial 29 with value: 0.11467665111710319.
[I 2025-11-03 15:24:13,078] Trial 41 finished with value: 0.11551663568743284 and parameters: {'model_type': 'graphsage', 'hidden_dims': '[512, 64]', 'dropout': 0.24308604624146654, 'batch_norm': True, 'lr': 0.0005047198724630382, 'weight_decay': 4.7525796252711007e-05, 'epochs': 289, 'loss': 'mse', 'optimizer': 'adam', 'graph_mode': 'knn', 'source': 'grm', 'knn_k': 6, 'weighted_edges': False, 'symmetrize_mode': 'mutual', 'use_snp_selection': False}. Best is trial 41 with value: 0.11551663568743284.
[I 2025-11-03 15:24:17,070] Trial 42 finished with value: 0.10250945980114015 and parameters: {'model_type': 'graphsage', 'hidden_dims': '[512, 128]', 'dropout': 0.22917782126058978, 'batch_norm': True, 'lr': 0.0006505079933275328, 'weight_decay': 6.605431857596735e-05, 'epochs': 290, 'loss': 'mse', 'optimizer': 'adam', 'graph_mode': 'knn', 'source': 'grm', 'knn_k': 6, 'weighted_edges': False, 'symmetrize_mode': 'mutual', 'use_snp_selection': False}. Best is trial 41 with value: 0.11551663568743284.
[I 2025-11-03 15:24:21,247] Trial 43 finished with value: 0.10151116777121681 and parameters: {'model_type': 'graphsage', 'hidden_dims': '[512, 64]', 'dropout': 0.3202159781987101, 'batch_norm': True, 'lr': 0.00017939547565105945, 'weight_decay': 4.116197318565861e-05, 'epochs': 315, 'loss': 'mse', 'optimizer': 'adam', 'graph_mode': 'knn', 'source': 'grm', 'knn_k': 7, 'weighted_edges': False, 'symmetrize_mode': 'mutual', 'use_snp_selection': False}. Best is trial 41 with value: 0.11551663568743284.
[I 2025-11-03 15:24:25,025] Trial 44 finished with value: 0.1113537617440794 and parameters: {'model_type': 'graphsage', 'hidden_dims': '[512, 64]', 'dropout': 0.29070366088217475, 'batch_norm': True, 'lr': 0.0003356214332320771, 'weight_decay': 1.5576877914416153e-05, 'epochs': 259, 'loss': 'mse', 'optimizer': 'adam', 'graph_mode': 'knn', 'source': 'grm', 'knn_k': 6, 'weighted_edges': False, 'symmetrize_mode': 'mutual', 'use_snp_selection': False}. Best is trial 41 with value: 0.11551663568743284.
[I 2025-11-03 15:24:28,739] Trial 45 finished with value: 0.09003491623963716 and parameters: {'model_type': 'graphsage', 'hidden_dims': '[512, 64]', 'dropout': 0.2917399210418099, 'batch_norm': True, 'lr': 0.0003015732669503519, 'weight_decay': 1.3116083869453321e-05, 'epochs': 262, 'loss': 'mse', 'optimizer': 'adam', 'graph_mode': 'cutoff', 'cutoff': 0.4585737354176531, 'grm_norm': 'cosine', 'self_loops': False, 'use_snp_selection': False}. Best is trial 41 with value: 0.11551663568743284.
[I 2025-11-03 15:24:31,478] Trial 46 finished with value: 0.10469588152106167 and parameters: {'model_type': 'graphsage', 'hidden_dims': '[512, 64]', 'dropout': 0.26140405111093323, 'batch_norm': True, 'lr': 0.00037074354665516404, 'weight_decay': 2.1794849229152845e-05, 'epochs': 106, 'loss': 'mse', 'optimizer': 'adam', 'graph_mode': 'knn', 'source': 'grm', 'knn_k': 6, 'weighted_edges': False, 'symmetrize_mode': 'mutual', 'use_snp_selection': False}. Best is trial 41 with value: 0.11551663568743284.
[I 2025-11-03 15:24:33,588] Trial 47 finished with value: 0.11190000322696576 and parameters: {'model_type': 'graphsage', 'hidden_dims': '[128, 64]', 'dropout': 0.180693699808715, 'batch_norm': True, 'lr': 0.0004817983075974737, 'weight_decay': 9.545856503347431e-05, 'epochs': 255, 'loss': 'mse', 'optimizer': 'adam', 'graph_mode': 'knn', 'source': 'grm', 'knn_k': 7, 'weighted_edges': False, 'symmetrize_mode': 'mutual', 'use_snp_selection': False}. Best is trial 41 with value: 0.11551663568743284.
[I 2025-11-03 15:24:36,585] Trial 48 finished with value: 0.0591981585826143 and parameters: {'model_type': 'graphsage', 'hidden_dims': '[128, 64]', 'dropout': 0.14552056315908551, 'batch_norm': False, 'lr': 0.00015555950019086002, 'weight_decay': 0.00022981334448537766, 'epochs': 239, 'loss': 'mse', 'optimizer': 'adam', 'graph_mode': 'knn', 'source': 'grm', 'knn_k': 8, 'weighted_edges': False, 'symmetrize_mode': 'mutual', 'use_snp_selection': True, 'num_snps': 42595}. Best is trial 41 with value: 0.11551663568743284.
[I 2025-11-03 15:24:38,708] Trial 49 finished with value: 0.09006180438726145 and parameters: {'model_type': 'graphsage', 'hidden_dims': '[128, 64]', 'dropout': 0.18591478747311424, 'batch_norm': True, 'lr': 0.00024319614552793619, 'weight_decay': 9.746911902456692e-05, 'epochs': 258, 'loss': 'mse', 'optimizer': 'adam', 'graph_mode': 'knn', 'source': 'grm', 'knn_k': 6, 'weighted_edges': False, 'symmetrize_mode': 'mutual', 'use_snp_selection': False}. Best is trial 41 with value: 0.11551663568743284.
[I 2025-11-03 15:24:40,533] Trial 50 finished with value: 0.0966220713615476 and parameters: {'model_type': 'graphsage', 'hidden_dims': '[128, 64]', 'dropout': 0.4125520245066142, 'batch_norm': True, 'lr': 0.0007009600843950642, 'weight_decay': 1.5535294052122908e-05, 'epochs': 184, 'loss': 'mse', 'optimizer': 'adam', 'graph_mode': 'cutoff', 'cutoff': 0.20628834676422192, 'grm_norm': 'none', 'self_loops': True, 'use_snp_selection': False}. Best is trial 41 with value: 0.11551663568743284.
[I 2025-11-03 15:24:44,038] Trial 51 finished with value: 0.09673622276147006 and parameters: {'model_type': 'graphsage', 'hidden_dims': '[512, 128]', 'dropout': 0.12068848510401017, 'batch_norm': True, 'lr': 0.0004655000917925002, 'weight_decay': 2.8462785471642308e-05, 'epochs': 214, 'loss': 'mse', 'optimizer': 'adam', 'graph_mode': 'knn', 'source': 'grm', 'knn_k': 7, 'weighted_edges': False, 'symmetrize_mode': 'mutual', 'use_snp_selection': False}. Best is trial 41 with value: 0.11551663568743284.
[I 2025-11-03 15:24:48,097] Trial 52 finished with value: 0.10328635508718177 and parameters: {'model_type': 'graphsage', 'hidden_dims': '[512, 64]', 'dropout': 0.239595892939501, 'batch_norm': True, 'lr': 0.0005147875538452813, 'weight_decay': 5.506912684878426e-05, 'epochs': 298, 'loss': 'mse', 'optimizer': 'adam', 'graph_mode': 'knn', 'source': 'grm', 'knn_k': 7, 'weighted_edges': False, 'symmetrize_mode': 'mutual', 'use_snp_selection': False}. Best is trial 41 with value: 0.11551663568743284.
[I 2025-11-03 15:24:50,603] Trial 53 finished with value: 0.09614458282829438 and parameters: {'model_type': 'graphsage', 'hidden_dims': '[256, 128]', 'dropout': 0.2912107026912623, 'batch_norm': True, 'lr': 0.00030749967726646104, 'weight_decay': 8.27179823651459e-06, 'epochs': 270, 'loss': 'mse', 'optimizer': 'adam', 'graph_mode': 'knn', 'source': 'grm', 'knn_k': 6, 'weighted_edges': False, 'symmetrize_mode': 'mutual', 'use_snp_selection': False}. Best is trial 41 with value: 0.11551663568743284.
