[I 2025-11-03 13:27:41,530] Trial 55 finished with value: 0.07528640675650905 and parameters: {'model_type': 'gcn', 'hidden_dims': '[256, 128]', 'dropout': 0.15224289733179883, 'batch_norm': False, 'lr': 0.00012394359802595783, 'weight_decay': 3.377941594096999e-07, 'epochs': 208, 'loss': 'mae', 'optimizer': 'adam', 'graph_mode': 'off', 'use_snp_selection': False}. Best is trial 35 with value: 0.12334639703087553.
[I 2025-11-03 13:27:43,357] Trial 56 finished with value: 0.10008789830582733 and parameters: {'model_type': 'gcn', 'hidden_dims': '[512, 256]', 'dropout': 0.18143955031786346, 'batch_norm': False, 'lr': 3.9778712351780466e-05, 'weight_decay': 0.00014027332983116705, 'epochs': 136, 'loss': 'mae', 'optimizer': 'adam', 'graph_mode': 'off', 'use_snp_selection': False}. Best is trial 35 with value: 0.12334639703087553.
[I 2025-11-03 13:27:44,370] Trial 57 finished with value: 0.07324495214087096 and parameters: {'model_type': 'gcn', 'hidden_dims': '[128, 64]', 'dropout': 0.23707747259674342, 'batch_norm': False, 'lr': 0.0005127625277267714, 'weight_decay': 1.1092312885916249e-05, 'epochs': 158, 'loss': 'mae', 'optimizer': 'adam', 'graph_mode': 'off', 'use_snp_selection': False}. Best is trial 35 with value: 0.12334639703087553.
[I 2025-11-03 13:27:46,287] Trial 58 finished with value: 0.07000221859526401 and parameters: {'model_type': 'gcn', 'hidden_dims': '[256, 128, 64]', 'dropout': 0.30300492478228547, 'batch_norm': False, 'lr': 5.4989116106302454e-05, 'weight_decay': 3.6243531539993496e-05, 'epochs': 241, 'loss': 'mae', 'optimizer': 'adam', 'graph_mode': 'off', 'use_snp_selection': False}. Best is trial 35 with value: 0.12334639703087553.
[I 2025-11-03 13:27:47,492] Trial 59 finished with value: 0.03089729380240276 and parameters: {'model_type': 'gcn', 'hidden_dims': '[512, 64]', 'dropout': 0.10607089402120531, 'batch_norm': False, 'lr': 0.00019009897315385644, 'weight_decay': 7.880215732164159e-07, 'epochs': 57, 'loss': 'mae', 'optimizer': 'adam', 'graph_mode': 'off', 'use_snp_selection': False}. Best is trial 35 with value: 0.12334639703087553.
[I 2025-11-03 13:27:49,620] Trial 60 finished with value: 0.08478168575608434 and parameters: {'model_type': 'gcn', 'hidden_dims': '[256, 128]', 'dropout': 0.26678711820352324, 'batch_norm': False, 'lr': 0.00013554588825089996, 'weight_decay': 1.581431171109205e-06, 'epochs': 323, 'loss': 'mae', 'optimizer': 'adam', 'graph_mode': 'off', 'use_snp_selection': False}. Best is trial 35 with value: 0.12334639703087553.
[I 2025-11-03 13:27:51,688] Trial 61 finished with value: 0.11753041463497621 and parameters: {'model_type': 'gcn', 'hidden_dims': '[512, 256]', 'dropout': 0.25211758643080096, 'batch_norm': False, 'lr': 0.0002464053169346049, 'weight_decay': 0.00019336323449859632, 'epochs': 170, 'loss': 'mae', 'optimizer': 'adam', 'graph_mode': 'off', 'use_snp_selection': False}. Best is trial 35 with value: 0.12334639703087553.
[I 2025-11-03 13:27:53,933] Trial 62 finished with value: 0.11084476856739588 and parameters: {'model_type': 'gcn', 'hidden_dims': '[512, 256]', 'dropout': 0.16228595037644555, 'batch_norm': False, 'lr': 0.0002921546904399617, 'weight_decay': 0.0005869445042642525, 'epochs': 189, 'loss': 'mae', 'optimizer': 'adam', 'graph_mode': 'off', 'use_snp_selection': False}. Best is trial 35 with value: 0.12334639703087553.
[I 2025-11-03 13:27:56,207] Trial 63 finished with value: 0.08070552310319032 and parameters: {'model_type': 'gcn', 'hidden_dims': '[512, 256]', 'dropout': 0.32038162233795503, 'batch_norm': False, 'lr': 0.00032106927806057744, 'weight_decay': 0.0006415658554618184, 'epochs': 191, 'loss': 'mae', 'optimizer': 'adam', 'graph_mode': 'off', 'use_snp_selection': False}. Best is trial 35 with value: 0.12334639703087553.
[I 2025-11-03 13:27:58,290] Trial 64 finished with value: 0.09296383616766385 and parameters: {'model_type': 'gcn', 'hidden_dims': '[512, 256]', 'dropout': 0.22042053660000885, 'batch_norm': False, 'lr': 0.0005734915956601797, 'weight_decay': 0.0002770790644638568, 'epochs': 167, 'loss': 'mae', 'optimizer': 'adam', 'graph_mode': 'off', 'use_snp_selection': False}. Best is trial 35 with value: 0.12334639703087553.
[I 2025-11-03 13:28:00,539] Trial 65 finished with value: 0.1139690740897953 and parameters: {'model_type': 'gcn', 'hidden_dims': '[512, 256]', 'dropout': 0.1353781160905428, 'batch_norm': False, 'lr': 0.00033298565127514145, 'weight_decay': 6.745591825354948e-05, 'epochs': 185, 'loss': 'mae', 'optimizer': 'adam', 'graph_mode': 'off', 'use_snp_selection': False}. Best is trial 35 with value: 0.12334639703087553.
[I 2025-11-03 13:28:02,720] Trial 66 finished with value: 0.10751496638327038 and parameters: {'model_type': 'gcn', 'hidden_dims': '[512, 256]', 'dropout': 0.13186463364758344, 'batch_norm': False, 'lr': 0.000685368629833436, 'weight_decay': 0.0004946590312578435, 'epochs': 180, 'loss': 'mae', 'optimizer': 'adam', 'graph_mode': 'off', 'use_snp_selection': False}. Best is trial 35 with value: 0.12334639703087553.
[I 2025-11-03 13:28:04,494] Trial 67 finished with value: 0.10764259189766429 and parameters: {'model_type': 'gcn', 'hidden_dims': '[512, 256]', 'dropout': 0.13289390417835056, 'batch_norm': False, 'lr': 0.00036999494608915294, 'weight_decay': 0.0005270765944164508, 'epochs': 209, 'loss': 'mae', 'optimizer': 'adam', 'graph_mode': 'off', 'use_snp_selection': True, 'num_snps': 22951}. Best is trial 35 with value: 0.12334639703087553.
[I 2025-11-03 13:28:06,232] Trial 68 finished with value: 0.11487354794505378 and parameters: {'model_type': 'gcn', 'hidden_dims': '[512, 256]', 'dropout': 0.13367704295197427, 'batch_norm': False, 'lr': 0.0007676452032273881, 'weight_decay': 0.0006756215900121532, 'epochs': 206, 'loss': 'mae', 'optimizer': 'adam', 'graph_mode': 'off', 'use_snp_selection': True, 'num_snps': 22632}. Best is trial 35 with value: 0.12334639703087553.
[I 2025-11-03 13:28:08,026] Trial 69 finished with value: 0.09096452521579355 and parameters: {'model_type': 'gcn', 'hidden_dims': '[512, 256]', 'dropout': 0.16210093684600468, 'batch_norm': False, 'lr': 0.0007847728364759509, 'weight_decay': 0.0009868045209927576, 'epochs': 212, 'loss': 'mae', 'optimizer': 'adam', 'graph_mode': 'off', 'use_snp_selection': True, 'num_snps': 22991}. Best is trial 35 with value: 0.12334639703087553.
[I 2025-11-03 13:28:10,077] Trial 70 finished with value: 0.10176426930891581 and parameters: {'model_type': 'gcn', 'hidden_dims': '[512, 256]', 'dropout': 0.13774108595967668, 'batch_norm': False, 'lr': 0.00036034300482381946, 'weight_decay': 0.0005085090024178929, 'epochs': 239, 'loss': 'mae', 'optimizer': 'adam', 'graph_mode': 'off', 'use_snp_selection': True, 'num_snps': 26876}. Best is trial 35 with value: 0.12334639703087553.
[I 2025-11-03 13:28:11,369] Trial 71 finished with value: 0.07286309069593774 and parameters: {'model_type': 'gcn', 'hidden_dims': '[512, 256]', 'dropout': 0.11782776096888359, 'batch_norm': False, 'lr': 0.0006494258104255732, 'weight_decay': 0.0006217728491047525, 'epochs': 196, 'loss': 'mae', 'optimizer': 'adam', 'graph_mode': 'off', 'use_snp_selection': True, 'num_snps': 11811}. Best is trial 35 with value: 0.12334639703087553.
[I 2025-11-03 13:28:14,335] Trial 72 finished with value: 0.10314110295127293 and parameters: {'model_type': 'gcn', 'hidden_dims': '[512, 256]', 'dropout': 0.10276371366824064, 'batch_norm': False, 'lr': 0.000980494355358266, 'weight_decay': 0.00025203882172062405, 'epochs': 350, 'loss': 'mae', 'optimizer': 'adam', 'graph_mode': 'off', 'use_snp_selection': True, 'num_snps': 35939}. Best is trial 35 with value: 0.12334639703087553.
[I 2025-11-03 13:28:15,644] Trial 73 finished with value: 0.08127436908318629 and parameters: {'model_type': 'gcn', 'hidden_dims': '[512, 256]', 'dropout': 0.13543829439412702, 'batch_norm': False, 'lr': 0.0005818630725592693, 'weight_decay': 0.0004700393229454606, 'epochs': 185, 'loss': 'mae', 'optimizer': 'adam', 'graph_mode': 'off', 'use_snp_selection': True, 'num_snps': 12966}. Best is trial 35 with value: 0.12334639703087553.
[I 2025-11-03 13:28:16,654] Trial 74 finished with value: 0.06613146561828608 and parameters: {'model_type': 'gcn', 'hidden_dims': '[512, 256]', 'dropout': 0.16009494232746133, 'batch_norm': False, 'lr': 0.00043460818230349967, 'weight_decay': 0.0007603296170443813, 'epochs': 200, 'loss': 'mae', 'optimizer': 'adam', 'graph_mode': 'off', 'use_snp_selection': True, 'num_snps': 4172}. Best is trial 35 with value: 0.12334639703087553.
[I 2025-11-03 13:28:18,699] Trial 75 finished with value: 0.08519560344295157 and parameters: {'model_type': 'gcn', 'hidden_dims': '[512, 256]', 'dropout': 0.1223608400774985, 'batch_norm': False, 'lr': 0.000790910026219745, 'weight_decay': 0.0003263630418331953, 'epochs': 230, 'loss': 'mae', 'optimizer': 'adam', 'graph_mode': 'off', 'use_snp_selection': True, 'num_snps': 27031}. Best is trial 35 with value: 0.12334639703087553.
[I 2025-11-03 13:28:21,553] Trial 76 finished with value: 0.08515538682262612 and parameters: {'model_type': 'gcn', 'hidden_dims': '[512, 256]', 'dropout': 0.1803464656234835, 'batch_norm': False, 'lr': 0.0003298446279013993, 'weight_decay': 0.00043397143161468904, 'epochs': 252, 'loss': 'mae', 'optimizer': 'adam', 'graph_mode': 'off', 'use_snp_selection': True, 'num_snps': 42747}. Best is trial 35 with value: 0.12334639703087553.
[I 2025-11-03 13:28:23,830] Trial 77 finished with value: 0.09530327366467752 and parameters: {'model_type': 'gcn', 'hidden_dims': '[512, 256]', 'dropout': 0.13277793643677557, 'batch_norm': False, 'lr': 0.0005143323626329736, 'weight_decay': 0.000672424715555633, 'epochs': 285, 'loss': 'mae', 'optimizer': 'adam', 'graph_mode': 'off', 'use_snp_selection': True, 'num_snps': 28073}. Best is trial 35 with value: 0.12334639703087553.
[I 2025-11-03 13:28:25,249] Trial 78 finished with value: 0.0885098935447426 and parameters: {'model_type': 'gcn', 'hidden_dims': '[512, 256]', 'dropout': 0.15166703844213322, 'batch_norm': False, 'lr': 0.00040411720351996705, 'weight_decay': 7.206770994553178e-05, 'epochs': 165, 'loss': 'mae', 'optimizer': 'adam', 'graph_mode': 'off', 'use_snp_selection': True, 'num_snps': 16997}. Best is trial 35 with value: 0.12334639703087553.
[I 2025-11-03 13:28:27,282] Trial 79 finished with value: 0.07191604013861679 and parameters: {'model_type': 'gcn', 'hidden_dims': '[128, 64]', 'dropout': 0.1718037093717708, 'batch_norm': False, 'lr': 0.00023552328315463067, 'weight_decay': 0.00022224726169907096, 'epochs': 204, 'loss': 'mae', 'optimizer': 'adam', 'graph_mode': 'off', 'use_snp_selection': True, 'num_snps': 50945}. Best is trial 35 with value: 0.12334639703087553.
[I 2025-11-03 13:28:29,787] Trial 80 finished with value: 0.09643005451985816 and parameters: {'model_type': 'gcn', 'hidden_dims': '[512, 256]', 'dropout': 0.11030172380618126, 'batch_norm': False, 'lr': 0.0008648111028634602, 'weight_decay': 0.00010861258180522339, 'epochs': 220, 'loss': 'mae', 'optimizer': 'adam', 'graph_mode': 'off', 'use_snp_selection': False}. Best is trial 35 with value: 0.12334639703087553.
[I 2025-11-03 13:28:32,063] Trial 81 finished with value: 0.06764976926652949 and parameters: {'model_type': 'gcn', 'hidden_dims': '[512, 64]', 'dropout': 0.14607112834647623, 'batch_norm': False, 'lr': 0.0006298652049770077, 'weight_decay': 0.00034605426425597186, 'epochs': 188, 'loss': 'mae', 'optimizer': 'adam', 'graph_mode': 'off', 'use_snp_selection': False}. Best is trial 35 with value: 0.12334639703087553.
[I 2025-11-03 13:28:34,584] Trial 82 finished with value: 0.07446990161597815 and parameters: {'model_type': 'gcn', 'hidden_dims': '[512, 64]', 'dropout': 0.12950200338716694, 'batch_norm': False, 'lr': 0.000299365482997022, 'weight_decay': 0.00028649612499925304, 'epochs': 215, 'loss': 'mae', 'optimizer': 'adam', 'graph_mode': 'off', 'use_snp_selection': False}. Best is trial 35 with value: 0.12334639703087553.
[I 2025-11-03 13:28:36,109] Trial 83 finished with value: 0.09670312160444428 and parameters: {'model_type': 'gcn', 'hidden_dims': '[256, 128, 64]', 'dropout': 0.19196099409011547, 'batch_norm': False, 'lr': 0.00022169233709543095, 'weight_decay': 0.0001725241765310543, 'epochs': 174, 'loss': 'mae', 'optimizer': 'adam', 'graph_mode': 'off', 'use_snp_selection': False}. Best is trial 35 with value: 0.12334639703087553.
[I 2025-11-03 13:28:37,984] Trial 84 finished with value: 0.09550372586251 and parameters: {'model_type': 'gcn', 'hidden_dims': '[512, 256]', 'dropout': 0.20768466616502013, 'batch_norm': False, 'lr': 7.093660809087049e-05, 'weight_decay': 0.0004176861062696358, 'epochs': 143, 'loss': 'mse', 'optimizer': 'adam', 'graph_mode': 'off', 'use_snp_selection': False}. Best is trial 35 with value: 0.12334639703087553.
[I 2025-11-03 13:28:41,134] Trial 85 finished with value: 0.09464569075070622 and parameters: {'model_type': 'gcn', 'hidden_dims': '[512, 256]', 'dropout': 0.14038157343825197, 'batch_norm': False, 'lr': 0.00010102458474811211, 'weight_decay': 0.0008362359745032568, 'epochs': 302, 'loss': 'mae', 'optimizer': 'adam', 'graph_mode': 'off', 'use_snp_selection': False}. Best is trial 35 with value: 0.12334639703087553.
[I 2025-11-03 13:28:43,997] Trial 86 finished with value: 0.11765432391643306 and parameters: {'model_type': 'gcn', 'hidden_dims': '[512, 64]', 'dropout': 0.1602006128248605, 'batch_norm': False, 'lr': 0.0003816256907638515, 'weight_decay': 7.153943364061833e-05, 'epochs': 268, 'loss': 'mae', 'optimizer': 'adam', 'graph_mode': 'off', 'use_snp_selection': False}. Best is trial 35 with value: 0.12334639703087553.
[I 2025-11-03 13:28:47,181] Trial 87 finished with value: 0.09599752500560858 and parameters: {'model_type': 'gcn', 'hidden_dims': '[512, 128]', 'dropout': 0.16067304205665753, 'batch_norm': False, 'lr': 0.0003564200743278403, 'weight_decay': 6.974532092527333e-05, 'epochs': 310, 'loss': 'mae', 'optimizer': 'adam', 'graph_mode': 'off', 'use_snp_selection': False}. Best is trial 35 with value: 0.12334639703087553.
[I 2025-11-03 13:28:50,059] Trial 88 finished with value: 0.11027868984586514 and parameters: {'model_type': 'gcn', 'hidden_dims': '[512, 64]', 'dropout': 0.11860784353387771, 'batch_norm': False, 'lr': 0.0004377000195282055, 'weight_decay': 0.0005734187545416902, 'epochs': 271, 'loss': 'mae', 'optimizer': 'adam', 'graph_mode': 'off', 'use_snp_selection': False}. Best is trial 35 with value: 0.12334639703087553.
[I 2025-11-03 13:28:52,572] Trial 89 finished with value: 0.0948977102038886 and parameters: {'model_type': 'gcn', 'hidden_dims': '[512, 64]', 'dropout': 0.1856181725482649, 'batch_norm': False, 'lr': 0.0004160146842141179, 'weight_decay': 0.00010678321200199926, 'epochs': 280, 'loss': 'mae', 'optimizer': 'adam', 'graph_mode': 'off', 'use_snp_selection': True, 'num_snps': 34250}. Best is trial 35 with value: 0.12334639703087553.
[I 2025-11-03 13:28:55,422] Trial 90 finished with value: 0.10352110755249996 and parameters: {'model_type': 'gcn', 'hidden_dims': '[512, 64]', 'dropout': 0.11520279146772056, 'batch_norm': False, 'lr': 0.0004998068498790528, 'weight_decay': 5.7808438705135926e-05, 'epochs': 266, 'loss': 'mae', 'optimizer': 'adam', 'graph_mode': 'off', 'use_snp_selection': False}. Best is trial 35 with value: 0.12334639703087553.
[I 2025-11-03 13:28:58,489] Trial 91 finished with value: 0.08732754177574995 and parameters: {'model_type': 'gcn', 'hidden_dims': '[512, 64]', 'dropout': 0.1317984983247316, 'batch_norm': False, 'lr': 0.0007156316100062876, 'weight_decay': 0.00059306405140519, 'epochs': 290, 'loss': 'mae', 'optimizer': 'adam', 'graph_mode': 'off', 'use_snp_selection': False}. Best is trial 35 with value: 0.12334639703087553.
[I 2025-11-03 13:29:01,415] Trial 92 finished with value: 0.10632515422264154 and parameters: {'model_type': 'gcn', 'hidden_dims': '[512, 64]', 'dropout': 0.15466065030469758, 'batch_norm': False, 'lr': 0.00019599130503512041, 'weight_decay': 0.00022502729481997959, 'epochs': 270, 'loss': 'mae', 'optimizer': 'adam', 'graph_mode': 'off', 'use_snp_selection': False}. Best is trial 35 with value: 0.12334639703087553.
[I 2025-11-03 13:29:04,756] Trial 93 finished with value: 0.11134463569784342 and parameters: {'model_type': 'gcn', 'hidden_dims': '[512, 256]', 'dropout': 0.14329627505996703, 'batch_norm': False, 'lr': 0.0002797806990949387, 'weight_decay': 0.0005409758444716154, 'epochs': 327, 'loss': 'mae', 'optimizer': 'adam', 'graph_mode': 'off', 'use_snp_selection': False}. Best is trial 35 with value: 0.12334639703087553.
[I 2025-11-03 13:29:06,290] Trial 94 finished with value: 0.07481239049414885 and parameters: {'model_type': 'gcn', 'hidden_dims': '[128, 64]', 'dropout': 0.44277048613685227, 'batch_norm': False, 'lr': 0.000264168354568266, 'weight_decay': 0.0007729986278375736, 'epochs': 326, 'loss': 'mae', 'optimizer': 'adam', 'graph_mode': 'off', 'use_snp_selection': False}. Best is trial 35 with value: 0.12334639703087553.
[I 2025-11-03 13:29:08,268] Trial 95 finished with value: 0.11817083950344563 and parameters: {'model_type': 'gcn', 'hidden_dims': '[256, 128]', 'dropout': 0.17223373889231244, 'batch_norm': False, 'lr': 0.00037243711285899736, 'weight_decay': 0.0003949791510694645, 'epochs': 294, 'loss': 'mae', 'optimizer': 'adam', 'graph_mode': 'off', 'use_snp_selection': False}. Best is trial 35 with value: 0.12334639703087553.
[I 2025-11-03 13:29:10,338] Trial 96 finished with value: 0.10290930740757408 and parameters: {'model_type': 'gcn', 'hidden_dims': '[256, 128]', 'dropout': 0.1704725631074257, 'batch_norm': False, 'lr': 0.00017186968245513822, 'weight_decay': 0.00016797563912750196, 'epochs': 301, 'loss': 'mae', 'optimizer': 'adam', 'graph_mode': 'off', 'use_snp_selection': False}. Best is trial 35 with value: 0.12334639703087553.
[I 2025-11-03 13:29:12,495] Trial 97 finished with value: 0.097634572183721 and parameters: {'model_type': 'gcn', 'hidden_dims': '[256, 128]', 'dropout': 0.1969662668678649, 'batch_norm': False, 'lr': 0.00023619883824824322, 'weight_decay': 0.0002915535544874749, 'epochs': 331, 'loss': 'mae', 'optimizer': 'adam', 'graph_mode': 'off', 'use_snp_selection': False}. Best is trial 35 with value: 0.12334639703087553.
[I 2025-11-03 13:29:14,533] Trial 98 finished with value: 0.10017483258405765 and parameters: {'model_type': 'gcn', 'hidden_dims': '[256, 128]', 'dropout': 0.1002418502329132, 'batch_norm': False, 'lr': 0.00020574472568188828, 'weight_decay': 0.0003830320208132658, 'epochs': 303, 'loss': 'mae', 'optimizer': 'adam', 'graph_mode': 'off', 'use_snp_selection': False}. Best is trial 35 with value: 0.12334639703087553.
[I 2025-11-03 13:29:16,297] Trial 99 finished with value: 0.08598598249980204 and parameters: {'model_type': 'gcn', 'hidden_dims': '[256, 128]', 'dropout': 0.1435504146128004, 'batch_norm': False, 'lr': 0.0003054890626110894, 'weight_decay': 0.00012655205124285557, 'epochs': 251, 'loss': 'mae', 'optimizer': 'adam', 'graph_mode': 'off', 'use_snp_selection': False}. Best is trial 35 with value: 0.12334639703087553.
[I 2025-11-03 13:29:19,244] Trial 100 finished with value: 0.06672198401135067 and parameters: {'model_type': 'gcn', 'hidden_dims': '[512, 64]', 'dropout': 0.17253617506020846, 'batch_norm': False, 'lr': 0.0004679701201386586, 'weight_decay': 8.260364772627694e-06, 'epochs': 276, 'loss': 'mae', 'optimizer': 'adam', 'graph_mode': 'off', 'use_snp_selection': False}. Best is trial 35 with value: 0.12334639703087553.
[I 2025-11-03 13:29:22,508] Trial 101 finished with value: 0.0527781056345764 and parameters: {'model_type': 'gcn', 'hidden_dims': '[512, 256]', 'dropout': 0.5855422969912376, 'batch_norm': False, 'lr': 0.0005646587443870886, 'weight_decay': 0.0005473421873858532, 'epochs': 311, 'loss': 'mae', 'optimizer': 'adam', 'graph_mode': 'off', 'use_snp_selection': False}. Best is trial 35 with value: 0.12334639703087553.
[I 2025-11-03 13:29:24,459] Trial 102 finished with value: 0.10184733837937007 and parameters: {'model_type': 'gcn', 'hidden_dims': '[256, 128]', 'dropout': 0.12562776427496597, 'batch_norm': False, 'lr': 0.0003370929778550287, 'weight_decay': 0.0006731392922289608, 'epochs': 291, 'loss': 'mae', 'optimizer': 'adam', 'graph_mode': 'off', 'use_snp_selection': False}. Best is trial 35 with value: 0.12334639703087553.
[I 2025-11-03 13:29:27,726] Trial 103 finished with value: 0.06527691553523463 and parameters: {'model_type': 'gcn', 'hidden_dims': '[512, 256]', 'dropout': 0.4045840106584313, 'batch_norm': False, 'lr': 0.00038517521374609306, 'weight_decay': 0.0009421858606302684, 'epochs': 317, 'loss': 'mae', 'optimizer': 'adam', 'graph_mode': 'off', 'use_snp_selection': False}. Best is trial 35 with value: 0.12334639703087553.
[I 2025-11-03 13:29:30,175] Trial 104 finished with value: 0.10091436503665235 and parameters: {'model_type': 'gcn', 'hidden_dims': '[256, 128, 64]', 'dropout': 0.15644353646215836, 'batch_norm': False, 'lr': 0.00026660354761016877, 'weight_decay': 3.965305231128227e-05, 'epochs': 337, 'loss': 'mae', 'optimizer': 'adam', 'graph_mode': 'off', 'use_snp_selection': False}. Best is trial 35 with value: 0.12334639703087553.
[I 2025-11-03 13:29:32,780] Trial 105 finished with value: 0.11614785739966374 and parameters: {'model_type': 'gcn', 'hidden_dims': '[512, 256]', 'dropout': 0.1132893750794778, 'batch_norm': False, 'lr': 0.0004389941070243503, 'weight_decay': 0.00020106422329960354, 'epochs': 233, 'loss': 'mae', 'optimizer': 'adam', 'graph_mode': 'off', 'use_snp_selection': False}. Best is trial 35 with value: 0.12334639703087553.
[I 2025-11-03 13:29:34,466] Trial 106 finished with value: 0.08963456150747386 and parameters: {'model_type': 'gcn', 'hidden_dims': '[256, 128]', 'dropout': 0.1097830465091392, 'batch_norm': False, 'lr': 0.000140431016633822, 'weight_decay': 0.0001868567491748047, 'epochs': 232, 'loss': 'mae', 'optimizer': 'adam', 'graph_mode': 'off', 'use_snp_selection': False}. Best is trial 35 with value: 0.12334639703087553.
