[I 2025-10-21 04:01:51,734] Trial 9 finished with value: 0.180161115715754 and parameters: {'model_type': 'gat', 'hidden_dims': '[256, 128, 64]', 'dropout': 0.29822093943922523, 'batch_norm': True, 'gat_heads': 2, 'gat_attn_dropout': 0.5041483896530343, 'gat_concat_hidden': True, 'lr': 0.0009262984185468379, 'weight_decay': 8.224875501038066e-07, 'epochs': 231, 'loss': 'mae', 'optimizer': 'adam', 'graph_mode': 'cutoff', 'cutoff': 0.40177719715455146, 'grm_norm': 'none', 'self_loops': True}. Best is trial 5 with value: 0.19692025427945242.
[I 2025-10-21 04:13:34,802] Trial 10 finished with value: 0.22428866718899382 and parameters: {'model_type': 'gat', 'hidden_dims': '[512, 256]', 'dropout': 0.11372025982957354, 'batch_norm': False, 'gat_heads': 7, 'gat_attn_dropout': 0.5550621320257056, 'gat_concat_hidden': False, 'lr': 7.716508611549555e-06, 'weight_decay': 7.270968159185769e-06, 'epochs': 339, 'loss': 'mae', 'optimizer': 'adam', 'graph_mode': 'cutoff', 'cutoff': 0.7104214854133502, 'grm_norm': 'cosine', 'self_loops': True}. Best is trial 10 with value: 0.22428866718899382.
[I 2025-10-21 04:25:35,188] Trial 11 finished with value: 0.21827256373260906 and parameters: {'model_type': 'gat', 'hidden_dims': '[512, 256]', 'dropout': 0.10311933668439195, 'batch_norm': False, 'gat_heads': 7, 'gat_attn_dropout': 0.5935696129988, 'gat_concat_hidden': False, 'lr': 8.50557861777386e-06, 'weight_decay': 6.4761620005448075e-06, 'epochs': 348, 'loss': 'mae', 'optimizer': 'adam', 'graph_mode': 'cutoff', 'cutoff': 0.8729660832135235, 'grm_norm': 'cosine', 'self_loops': True}. Best is trial 10 with value: 0.22428866718899382.
[I 2025-10-21 04:39:17,500] Trial 12 finished with value: 0.23467673010783593 and parameters: {'model_type': 'gat', 'hidden_dims': '[512, 256]', 'dropout': 0.11857901220728463, 'batch_norm': False, 'gat_heads': 8, 'gat_attn_dropout': 0.5936622869810394, 'gat_concat_hidden': False, 'lr': 5.263981859210881e-06, 'weight_decay': 4.86619283279954e-06, 'epochs': 338, 'loss': 'mae', 'optimizer': 'adam', 'graph_mode': 'cutoff', 'cutoff': 0.8590846692280266, 'grm_norm': 'cosine', 'self_loops': True}. Best is trial 12 with value: 0.23467673010783593.
[I 2025-10-21 04:52:52,146] Trial 13 finished with value: 0.21731504670135945 and parameters: {'model_type': 'gat', 'hidden_dims': '[512, 256]', 'dropout': 0.10085201161116182, 'batch_norm': False, 'gat_heads': 8, 'gat_attn_dropout': 0.5971207519099235, 'gat_concat_hidden': False, 'lr': 9.933777278644612e-06, 'weight_decay': 1.701265975243763e-06, 'epochs': 335, 'loss': 'mae', 'optimizer': 'adam', 'graph_mode': 'cutoff', 'cutoff': 0.7981170050027426, 'grm_norm': 'cosine', 'self_loops': True}. Best is trial 12 with value: 0.23467673010783593.
[I 2025-10-21 05:01:33,986] Trial 14 finished with value: 0.2472160653727916 and parameters: {'model_type': 'gat', 'hidden_dims': '[512, 128]', 'dropout': 0.16027048655350537, 'batch_norm': False, 'gat_heads': 6, 'gat_attn_dropout': 0.2810064922470583, 'gat_concat_hidden': False, 'lr': 1.027645518414327e-06, 'weight_decay': 0.000929256360284688, 'epochs': 292, 'loss': 'mae', 'optimizer': 'adam', 'graph_mode': 'cutoff', 'cutoff': 0.7168906073388602, 'grm_norm': 'gcn', 'self_loops': True}. Best is trial 14 with value: 0.2472160653727916.
[I 2025-10-21 05:10:04,708] Trial 15 finished with value: 0.2423504116553432 and parameters: {'model_type': 'gat', 'hidden_dims': '[512, 128]', 'dropout': 0.1743114341652514, 'batch_norm': False, 'gat_heads': 6, 'gat_attn_dropout': 0.2703038396936633, 'gat_concat_hidden': False, 'lr': 1.096456752535017e-06, 'weight_decay': 0.000627269841783525, 'epochs': 286, 'loss': 'mae', 'optimizer': 'adam', 'graph_mode': 'cutoff', 'cutoff': 0.6824841193772697, 'grm_norm': 'gcn', 'self_loops': True}. Best is trial 14 with value: 0.2472160653727916.
[I 2025-10-21 05:17:16,836] Trial 16 finished with value: 0.21609552268550822 and parameters: {'model_type': 'gat', 'hidden_dims': '[512, 128]', 'dropout': 0.18082902639799048, 'batch_norm': False, 'gat_heads': 5, 'gat_attn_dropout': 0.22732926106832296, 'gat_concat_hidden': False, 'lr': 1.0405515997940893e-06, 'weight_decay': 0.0008698082981005729, 'epochs': 281, 'loss': 'mae', 'optimizer': 'adam', 'graph_mode': 'cutoff', 'cutoff': 0.6891673938283641, 'grm_norm': 'gcn', 'self_loops': True}. Best is trial 14 with value: 0.2472160653727916.
[I 2025-10-21 05:25:57,342] Trial 17 finished with value: 0.25228541052703135 and parameters: {'model_type': 'gat', 'hidden_dims': '[512, 128]', 'dropout': 0.4095462695028446, 'batch_norm': False, 'gat_heads': 6, 'gat_attn_dropout': 0.2804540882848254, 'gat_concat_hidden': False, 'lr': 2.290415298231591e-06, 'weight_decay': 0.0008568502804838022, 'epochs': 292, 'loss': 'mae', 'optimizer': 'adam', 'graph_mode': 'cutoff', 'cutoff': 0.6572803544193749, 'grm_norm': 'gcn', 'self_loops': True}. Best is trial 17 with value: 0.25228541052703135.
[I 2025-10-21 05:33:58,943] Trial 18 finished with value: 0.17498154774271937 and parameters: {'model_type': 'gat', 'hidden_dims': '[512, 128]', 'dropout': 0.43527665299574014, 'batch_norm': False, 'gat_heads': 6, 'gat_attn_dropout': 0.33210648632164685, 'gat_concat_hidden': False, 'lr': 2.6550739044292763e-06, 'weight_decay': 0.0009920629629302494, 'epochs': 265, 'loss': 'mae', 'optimizer': 'adam', 'graph_mode': 'knn', 'source': 'grm', 'knn_k': 1, 'weighted_edges': False, 'symmetrize_mode': 'union'}. Best is trial 17 with value: 0.25228541052703135.
[I 2025-10-21 05:39:10,514] Trial 19 finished with value: 0.23416920243991135 and parameters: {'model_type': 'gat', 'hidden_dims': '[512, 128]', 'dropout': 0.41351899471153286, 'batch_norm': False, 'gat_heads': 4, 'gat_attn_dropout': 0.2558175325651533, 'gat_concat_hidden': False, 'lr': 2.347263296591268e-06, 'weight_decay': 0.00015265805543382736, 'epochs': 251, 'loss': 'mae', 'optimizer': 'adam', 'graph_mode': 'cutoff', 'cutoff': 0.5906221921854384, 'grm_norm': 'gcn', 'self_loops': True}. Best is trial 17 with value: 0.25228541052703135.
[I 2025-10-21 05:48:14,323] Trial 20 finished with value: 0.21803302873754454 and parameters: {'model_type': 'gat', 'hidden_dims': '[512, 128]', 'dropout': 0.2942643737520185, 'batch_norm': False, 'gat_heads': 6, 'gat_attn_dropout': 0.3794100610476286, 'gat_concat_hidden': False, 'lr': 2.1142159841250904e-05, 'weight_decay': 4.974449164680726e-05, 'epochs': 305, 'loss': 'mae', 'optimizer': 'adam', 'graph_mode': 'cutoff', 'cutoff': 0.6071152419132223, 'grm_norm': 'gcn', 'self_loops': True}. Best is trial 17 with value: 0.25228541052703135.
[I 2025-10-21 05:56:48,922] Trial 21 finished with value: 0.22904204816679266 and parameters: {'model_type': 'gat', 'hidden_dims': '[512, 128]', 'dropout': 0.1650033567237871, 'batch_norm': False, 'gat_heads': 6, 'gat_attn_dropout': 0.2931253701863752, 'gat_concat_hidden': False, 'lr': 1.029879872139429e-06, 'weight_decay': 0.00044345834938333073, 'epochs': 288, 'loss': 'mae', 'optimizer': 'adam', 'graph_mode': 'cutoff', 'cutoff': 0.7214104203006508, 'grm_norm': 'gcn', 'self_loops': True}. Best is trial 17 with value: 0.25228541052703135.
[I 2025-10-21 06:07:26,774] Trial 22 finished with value: 0.24107609516322653 and parameters: {'model_type': 'gat', 'hidden_dims': '[512, 128]', 'dropout': 0.325926476496521, 'batch_norm': False, 'gat_heads': 7, 'gat_attn_dropout': 0.2636684992387669, 'gat_concat_hidden': False, 'lr': 1.99345520744986e-06, 'weight_decay': 0.0004210355547757469, 'epochs': 307, 'loss': 'mae', 'optimizer': 'adam', 'graph_mode': 'cutoff', 'cutoff': 0.6734686172297757, 'grm_norm': 'gcn', 'self_loops': True}. Best is trial 17 with value: 0.25228541052703135.
[I 2025-10-21 06:12:18,529] Trial 23 finished with value: 0.23041490398258793 and parameters: {'model_type': 'gat', 'hidden_dims': '[512, 128]', 'dropout': 0.1619345113683863, 'batch_norm': False, 'gat_heads': 5, 'gat_attn_dropout': 0.2220872990605436, 'gat_concat_hidden': False, 'lr': 4.7661156854031555e-06, 'weight_decay': 0.0008962473808224906, 'epochs': 185, 'loss': 'mae', 'optimizer': 'adam', 'graph_mode': 'cutoff', 'cutoff': 0.6336388873482874, 'grm_norm': 'gcn', 'self_loops': True}. Best is trial 17 with value: 0.25228541052703135.
[I 2025-10-21 06:21:24,953] Trial 24 finished with value: 0.23643020034987883 and parameters: {'model_type': 'gat', 'hidden_dims': '[512, 128]', 'dropout': 0.4047068456870746, 'batch_norm': False, 'gat_heads': 6, 'gat_attn_dropout': 0.3124373545333742, 'gat_concat_hidden': False, 'lr': 1.46686473386718e-06, 'weight_decay': 0.0002787739388436743, 'epochs': 308, 'loss': 'mae', 'optimizer': 'adam', 'graph_mode': 'cutoff', 'cutoff': 0.795909970781705, 'grm_norm': 'gcn', 'self_loops': True}. Best is trial 17 with value: 0.25228541052703135.
[I 2025-10-21 06:25:34,538] Trial 25 finished with value: 0.23428878425394833 and parameters: {'model_type': 'gat', 'hidden_dims': '[512, 128]', 'dropout': 0.22008461545849536, 'batch_norm': False, 'gat_heads': 4, 'gat_attn_dropout': 0.4088436116494092, 'gat_concat_hidden': False, 'lr': 3.4111069607696502e-06, 'weight_decay': 8.828112855940889e-05, 'epochs': 199, 'loss': 'mae', 'optimizer': 'adam', 'graph_mode': 'cutoff', 'cutoff': 0.7610183370659034, 'grm_norm': 'gcn', 'self_loops': True}. Best is trial 17 with value: 0.25228541052703135.
[I 2025-10-21 06:34:49,679] Trial 26 finished with value: 0.19084975849689378 and parameters: {'model_type': 'gat', 'hidden_dims': '[512, 128]', 'dropout': 0.4891528799213, 'batch_norm': False, 'gat_heads': 7, 'gat_attn_dropout': 0.21259049647352407, 'gat_concat_hidden': True, 'lr': 2.027272747741826e-06, 'weight_decay': 1.8534027399653654e-05, 'epochs': 256, 'loss': 'mae', 'optimizer': 'adam', 'graph_mode': 'cutoff', 'cutoff': 0.4838804415020722, 'grm_norm': 'gcn', 'self_loops': True}. Best is trial 17 with value: 0.25228541052703135.
[I 2025-10-21 06:44:13,013] Trial 27 finished with value: 0.14631106973595687 and parameters: {'model_type': 'gat', 'hidden_dims': '[512, 128]', 'dropout': 0.14622810777618814, 'batch_norm': False, 'gat_heads': 6, 'gat_attn_dropout': 0.28917525312508346, 'gat_concat_hidden': False, 'lr': 1.4657566115168331e-05, 'weight_decay': 0.0005028430298470528, 'epochs': 313, 'loss': 'mse', 'optimizer': 'adam', 'graph_mode': 'knn', 'source': 'grm', 'knn_k': 1, 'weighted_edges': True, 'symmetrize_mode': 'union'}. Best is trial 17 with value: 0.25228541052703135.
[I 2025-10-21 06:45:54,409] Trial 28 finished with value: 0.24260452251301348 and parameters: {'model_type': 'gat', 'hidden_dims': '[128, 64]', 'dropout': 0.32185213612762237, 'batch_norm': False, 'gat_heads': 5, 'gat_attn_dropout': 0.07311147148725566, 'gat_concat_hidden': False, 'lr': 4.5057609603657674e-06, 'weight_decay': 0.00011872203619798135, 'epochs': 227, 'loss': 'mae', 'optimizer': 'adam', 'graph_mode': 'cutoff', 'cutoff': 0.6364244007228164, 'grm_norm': 'gcn', 'self_loops': True}. Best is trial 17 with value: 0.25228541052703135.
[I 2025-10-21 06:47:10,097] Trial 29 finished with value: 0.1106486781009652 and parameters: {'model_type': 'gat', 'hidden_dims': '[128, 64]', 'dropout': 0.38194140709769003, 'batch_norm': True, 'gat_heads': 4, 'gat_attn_dropout': 0.026370800745456724, 'gat_concat_hidden': True, 'lr': 4.530578592802516e-06, 'weight_decay': 0.00017334579180628876, 'epochs': 221, 'loss': 'mse', 'optimizer': 'adam', 'graph_mode': 'knn', 'source': 'grm', 'knn_k': 4, 'weighted_edges': False, 'symmetrize_mode': 'union'}. Best is trial 17 with value: 0.25228541052703135.
[I 2025-10-21 06:48:29,585] Trial 30 finished with value: 0.25766497844033504 and parameters: {'model_type': 'gat', 'hidden_dims': '[128, 64]', 'dropout': 0.46236805637446704, 'batch_norm': False, 'gat_heads': 5, 'gat_attn_dropout': 0.07681712183867495, 'gat_concat_hidden': False, 'lr': 1.4158575004826487e-05, 'weight_decay': 9.666988532358212e-05, 'epochs': 175, 'loss': 'mae', 'optimizer': 'adam', 'graph_mode': 'cutoff', 'cutoff': 0.5872636391675288, 'grm_norm': 'none', 'self_loops': True}. Best is trial 30 with value: 0.25766497844033504.
[I 2025-10-21 06:49:49,548] Trial 31 finished with value: 0.25620256782484313 and parameters: {'model_type': 'gat', 'hidden_dims': '[128, 64]', 'dropout': 0.46163630470858696, 'batch_norm': False, 'gat_heads': 5, 'gat_attn_dropout': 0.08926027976838995, 'gat_concat_hidden': False, 'lr': 1.318630779398186e-05, 'weight_decay': 0.00025593237520599133, 'epochs': 176, 'loss': 'mae', 'optimizer': 'adam', 'graph_mode': 'cutoff', 'cutoff': 0.5771478661264844, 'grm_norm': 'none', 'self_loops': True}. Best is trial 30 with value: 0.25766497844033504.
[I 2025-10-21 06:51:10,747] Trial 32 finished with value: 0.2586181751914642 and parameters: {'model_type': 'gat', 'hidden_dims': '[128, 64]', 'dropout': 0.45647885620974277, 'batch_norm': False, 'gat_heads': 5, 'gat_attn_dropout': 0.1687960428720161, 'gat_concat_hidden': False, 'lr': 0.0001313720149434028, 'weight_decay': 0.00035459434051670816, 'epochs': 180, 'loss': 'mae', 'optimizer': 'adam', 'graph_mode': 'cutoff', 'cutoff': 0.5625523810976666, 'grm_norm': 'none', 'self_loops': True}. Best is trial 32 with value: 0.2586181751914642.
[I 2025-10-21 06:52:30,724] Trial 33 finished with value: 0.24995891207748175 and parameters: {'model_type': 'gat', 'hidden_dims': '[128, 64]', 'dropout': 0.4683276744424127, 'batch_norm': False, 'gat_heads': 5, 'gat_attn_dropout': 0.18327821037520908, 'gat_concat_hidden': False, 'lr': 0.00017260467324825828, 'weight_decay': 0.00024601620798300993, 'epochs': 177, 'loss': 'mae', 'optimizer': 'adam', 'graph_mode': 'cutoff', 'cutoff': 0.5703791331535089, 'grm_norm': 'none', 'self_loops': True}. Best is trial 32 with value: 0.2586181751914642.
[I 2025-10-21 06:53:13,133] Trial 34 finished with value: 0.08139461087829654 and parameters: {'model_type': 'gat', 'hidden_dims': '[128, 64]', 'dropout': 0.5289259356085642, 'batch_norm': True, 'gat_heads': 4, 'gat_attn_dropout': 0.0840686711478635, 'gat_concat_hidden': False, 'lr': 4.17109400872418e-05, 'weight_decay': 4.738010147980117e-05, 'epochs': 118, 'loss': 'mse', 'optimizer': 'adam', 'graph_mode': 'cutoff', 'cutoff': 0.42327986595209693, 'grm_norm': 'none', 'self_loops': True}. Best is trial 32 with value: 0.2586181751914642.
[I 2025-10-21 06:54:00,907] Trial 35 finished with value: 0.20694319137571054 and parameters: {'model_type': 'gat', 'hidden_dims': '[128, 64]', 'dropout': 0.5114910965127553, 'batch_norm': False, 'gat_heads': 3, 'gat_attn_dropout': 0.16090813023527584, 'gat_concat_hidden': False, 'lr': 0.00015006961989412671, 'weight_decay': 0.00024252645089538295, 'epochs': 167, 'loss': 'mae', 'optimizer': 'adam', 'graph_mode': 'cutoff', 'cutoff': 0.4758501189145115, 'grm_norm': 'none', 'self_loops': True}. Best is trial 32 with value: 0.2586181751914642.
[I 2025-10-21 06:55:04,603] Trial 36 finished with value: 0.1768012436370282 and parameters: {'model_type': 'gat', 'hidden_dims': '[128, 64]', 'dropout': 0.43318950369245224, 'batch_norm': False, 'gat_heads': 5, 'gat_attn_dropout': 0.06647798268180549, 'gat_concat_hidden': True, 'lr': 1.4752494887159163e-05, 'weight_decay': 1.0780314763292428e-07, 'epochs': 129, 'loss': 'mae', 'optimizer': 'adam', 'graph_mode': 'knn', 'source': 'grm', 'knn_k': 10, 'weighted_edges': True, 'symmetrize_mode': 'union'}. Best is trial 32 with value: 0.2586181751914642.
[I 2025-10-21 06:56:01,625] Trial 37 finished with value: 0.2562964942063221 and parameters: {'model_type': 'gat', 'hidden_dims': '[128, 64]', 'dropout': 0.5876371813531511, 'batch_norm': False, 'gat_heads': 3, 'gat_attn_dropout': 0.11759993943786842, 'gat_concat_hidden': False, 'lr': 3.26422212642471e-05, 'weight_decay': 9.663233330932542e-05, 'epochs': 203, 'loss': 'mae', 'optimizer': 'adam', 'graph_mode': 'cutoff', 'cutoff': 0.5552981078520216, 'grm_norm': 'none', 'self_loops': True}. Best is trial 32 with value: 0.2586181751914642.
[I 2025-10-21 06:56:58,170] Trial 38 finished with value: 0.1552494501916099 and parameters: {'model_type': 'gat', 'hidden_dims': '[128, 64]', 'dropout': 0.5990729612712297, 'batch_norm': True, 'gat_heads': 3, 'gat_attn_dropout': 0.018574713627651784, 'gat_concat_hidden': False, 'lr': 3.5346989082728883e-05, 'weight_decay': 1.540730044687987e-05, 'epochs': 198, 'loss': 'mse', 'optimizer': 'adam', 'graph_mode': 'cutoff', 'cutoff': 0.5567850446999959, 'grm_norm': 'none', 'self_loops': False}. Best is trial 32 with value: 0.2586181751914642.
[I 2025-10-21 06:57:46,889] Trial 39 finished with value: 0.20503894722505223 and parameters: {'model_type': 'gat', 'hidden_dims': '[128, 64]', 'dropout': 0.56558078189971, 'batch_norm': False, 'gat_heads': 4, 'gat_attn_dropout': 0.13819951674553901, 'gat_concat_hidden': True, 'lr': 8.236686781216064e-05, 'weight_decay': 8.626240583665693e-05, 'epochs': 140, 'loss': 'mae', 'optimizer': 'adam', 'graph_mode': 'knn', 'source': 'grm', 'knn_k': 3, 'weighted_edges': True, 'symmetrize_mode': 'mutual'}. Best is trial 32 with value: 0.2586181751914642.
[I 2025-10-21 06:59:06,474] Trial 40 finished with value: 0.14064663420939083 and parameters: {'model_type': 'gat', 'hidden_dims': '[256, 128]', 'dropout': 0.5759556720372566, 'batch_norm': True, 'gat_heads': 4, 'gat_attn_dropout': 0.10377143553417474, 'gat_concat_hidden': False, 'lr': 2.5004300640373395e-05, 'weight_decay': 4.828796643008937e-05, 'epochs': 113, 'loss': 'mae', 'optimizer': 'adam', 'graph_mode': 'cutoff', 'cutoff': 0.21721052459148776, 'grm_norm': 'none', 'self_loops': True}. Best is trial 32 with value: 0.2586181751914642.
[I 2025-10-21 07:03:28,178] Trial 41 finished with value: 0.23556288991256008 and parameters: {'model_type': 'gat', 'hidden_dims': '[512, 64]', 'dropout': 0.4606264367952596, 'batch_norm': False, 'gat_heads': 5, 'gat_attn_dropout': 0.05302364582998351, 'gat_concat_hidden': False, 'lr': 0.00022485198451606948, 'weight_decay': 0.00028929316338103964, 'epochs': 166, 'loss': 'mae', 'optimizer': 'adam', 'graph_mode': 'cutoff', 'cutoff': 0.6158116329658523, 'grm_norm': 'none', 'self_loops': True}. Best is trial 32 with value: 0.2586181751914642.
[I 2025-10-21 07:04:26,048] Trial 42 finished with value: 0.24471873089933555 and parameters: {'model_type': 'gat', 'hidden_dims': '[128, 64]', 'dropout': 0.5047223747335309, 'batch_norm': False, 'gat_heads': 3, 'gat_attn_dropout': 0.16071233916491634, 'gat_concat_hidden': False, 'lr': 5.497406966283882e-05, 'weight_decay': 9.912429949369765e-05, 'epochs': 206, 'loss': 'mae', 'optimizer': 'adam', 'graph_mode': 'cutoff', 'cutoff': 0.5298872735312744, 'grm_norm': 'none', 'self_loops': True}. Best is trial 32 with value: 0.2586181751914642.
[I 2025-10-21 07:05:50,461] Trial 43 finished with value: 0.2094136994898368 and parameters: {'model_type': 'gat', 'hidden_dims': '[128, 64]', 'dropout': 0.3788937729649832, 'batch_norm': False, 'gat_heads': 5, 'gat_attn_dropout': 0.0033053925142385032, 'gat_concat_hidden': False, 'lr': 1.7759471448513187e-05, 'weight_decay': 0.0004958664609374429, 'epochs': 185, 'loss': 'mae', 'optimizer': 'adam', 'graph_mode': 'cutoff', 'cutoff': 0.4765527146311309, 'grm_norm': 'none', 'self_loops': False}. Best is trial 32 with value: 0.2586181751914642.
[I 2025-10-21 07:06:23,368] Trial 44 finished with value: 0.2190193236117597 and parameters: {'model_type': 'gat', 'hidden_dims': '[128, 64]', 'dropout': 0.35090273192319177, 'batch_norm': False, 'gat_heads': 2, 'gat_attn_dropout': 0.1890498793486325, 'gat_concat_hidden': False, 'lr': 1.1811370596355759e-05, 'weight_decay': 0.0001589770711975372, 'epochs': 162, 'loss': 'mae', 'optimizer': 'adam', 'graph_mode': 'cutoff', 'cutoff': 0.5431713596001388, 'grm_norm': 'none', 'self_loops': True}. Best is trial 32 with value: 0.2586181751914642.
[I 2025-10-21 07:07:51,274] Trial 45 finished with value: 0.21172186781320415 and parameters: {'model_type': 'gat', 'hidden_dims': '[256, 128, 64]', 'dropout': 0.4431224284989263, 'batch_norm': False, 'gat_heads': 5, 'gat_attn_dropout': 0.1063528708327408, 'gat_concat_hidden': False, 'lr': 6.676659758960979e-06, 'weight_decay': 3.798313488173503e-05, 'epochs': 94, 'loss': 'mae', 'optimizer': 'adam', 'graph_mode': 'cutoff', 'cutoff': 0.6508272913627811, 'grm_norm': 'cosine_then_gcn', 'self_loops': False}. Best is trial 32 with value: 0.2586181751914642.
[I 2025-10-21 07:16:13,819] Trial 46 finished with value: 0.22382991508164407 and parameters: {'model_type': 'gat', 'hidden_dims': '[512, 64]', 'dropout': 0.5529807517175404, 'batch_norm': False, 'gat_heads': 7, 'gat_attn_dropout': 0.04863668473453059, 'gat_concat_hidden': False, 'lr': 9.727889833517847e-05, 'weight_decay': 3.2798848106355273e-07, 'epochs': 238, 'loss': 'mse', 'optimizer': 'adam', 'graph_mode': 'cutoff', 'cutoff': 0.5047965622934737, 'grm_norm': 'none', 'self_loops': True}. Best is trial 32 with value: 0.2586181751914642.
[I 2025-10-21 07:16:33,935] Trial 47 finished with value: 0.14103870687314357 and parameters: {'model_type': 'gat', 'hidden_dims': '[256, 128]', 'dropout': 0.4079939394135082, 'batch_norm': False, 'gat_heads': 2, 'gat_attn_dropout': 0.12521639113389546, 'gat_concat_hidden': True, 'lr': 2.834756183871014e-05, 'weight_decay': 0.0006270442645121363, 'epochs': 47, 'loss': 'mae', 'optimizer': 'adam', 'graph_mode': 'cutoff', 'cutoff': 0.3359142693004078, 'grm_norm': 'none', 'self_loops': False}. Best is trial 32 with value: 0.2586181751914642.
[I 2025-10-21 07:17:44,233] Trial 48 finished with value: 0.13769221756468436 and parameters: {'model_type': 'gat', 'hidden_dims': '[128, 64]', 'dropout': 0.48809925100401985, 'batch_norm': False, 'gat_heads': 4, 'gat_attn_dropout': 0.09041084995025583, 'gat_concat_hidden': False, 'lr': 0.0004101207316643369, 'weight_decay': 2.698462385338884e-05, 'epochs': 213, 'loss': 'mae', 'optimizer': 'adam', 'graph_mode': 'cutoff', 'cutoff': 0.5761875427328851, 'grm_norm': 'none', 'self_loops': True}. Best is trial 32 with value: 0.2586181751914642.
