[I 2025-11-03 13:18:00,045] Trial 142 finished with value: 0.05836511695688194 and parameters: {'model_type': 'gcn', 'hidden_dims': '[512, 256]', 'dropout': 0.370693833404354, 'batch_norm': True, 'lr': 0.00022790224533229854, 'weight_decay': 5.54542777555698e-05, 'epochs': 315, 'loss': 'mse', 'optimizer': 'adam', 'graph_mode': 'off', 'use_snp_selection': False}. Best is trial 122 with value: 0.08173724304199678.
[I 2025-11-03 13:18:01,844] Trial 143 finished with value: 0.03937919275437731 and parameters: {'model_type': 'gcn', 'hidden_dims': '[512, 256]', 'dropout': 0.3592124321118646, 'batch_norm': True, 'lr': 0.00028848712657132306, 'weight_decay': 2.5060812562260374e-05, 'epochs': 246, 'loss': 'mse', 'optimizer': 'adam', 'graph_mode': 'off', 'use_snp_selection': False}. Best is trial 122 with value: 0.08173724304199678.
[I 2025-11-03 13:18:03,586] Trial 144 finished with value: 0.04586429873708539 and parameters: {'model_type': 'gcn', 'hidden_dims': '[512, 256]', 'dropout': 0.14457750147748571, 'batch_norm': True, 'lr': 0.00014208410412638894, 'weight_decay': 1.4369064108376682e-05, 'epochs': 231, 'loss': 'mse', 'optimizer': 'adam', 'graph_mode': 'off', 'use_snp_selection': False}. Best is trial 122 with value: 0.08173724304199678.
[I 2025-11-03 13:18:05,362] Trial 145 finished with value: 0.06661784114782332 and parameters: {'model_type': 'gcn', 'hidden_dims': '[512, 256]', 'dropout': 0.4048028744227906, 'batch_norm': True, 'lr': 0.00041709561081675024, 'weight_decay': 0.00011904363975277654, 'epochs': 222, 'loss': 'mse', 'optimizer': 'adam', 'graph_mode': 'off', 'use_snp_selection': False}. Best is trial 122 with value: 0.08173724304199678.
[I 2025-11-03 13:18:07,115] Trial 146 finished with value: 0.06723445721491544 and parameters: {'model_type': 'gcn', 'hidden_dims': '[512, 256]', 'dropout': 0.40298574511631063, 'batch_norm': True, 'lr': 0.0006674264254368458, 'weight_decay': 9.652634768941893e-05, 'epochs': 224, 'loss': 'mse', 'optimizer': 'adam', 'graph_mode': 'off', 'use_snp_selection': False}. Best is trial 122 with value: 0.08173724304199678.
[I 2025-11-03 13:18:08,691] Trial 147 finished with value: 0.05674953935477119 and parameters: {'model_type': 'gcn', 'hidden_dims': '[512, 128]', 'dropout': 0.4386978007216111, 'batch_norm': True, 'lr': 0.0007998735220761049, 'weight_decay': 0.00013414773626368724, 'epochs': 185, 'loss': 'mse', 'optimizer': 'adam', 'graph_mode': 'off', 'use_snp_selection': False}. Best is trial 122 with value: 0.08173724304199678.
[I 2025-11-03 13:18:10,344] Trial 148 finished with value: 0.06563012341912913 and parameters: {'model_type': 'gcn', 'hidden_dims': '[512, 256]', 'dropout': 0.40314085623309853, 'batch_norm': True, 'lr': 0.0006684292635894646, 'weight_decay': 0.00011964778051833927, 'epochs': 204, 'loss': 'mse', 'optimizer': 'adam', 'graph_mode': 'off', 'use_snp_selection': False}. Best is trial 122 with value: 0.08173724304199678.
[I 2025-11-03 13:18:11,966] Trial 149 finished with value: 0.05163789901903903 and parameters: {'model_type': 'gcn', 'hidden_dims': '[512, 256]', 'dropout': 0.3988460716037401, 'batch_norm': True, 'lr': 0.0006430348328498443, 'weight_decay': 0.00016955487272525077, 'epochs': 204, 'loss': 'mse', 'optimizer': 'adam', 'graph_mode': 'off', 'use_snp_selection': False}. Best is trial 122 with value: 0.08173724304199678.
[I 2025-11-03 13:18:13,925] Trial 0 finished with value: 0.04773450131112465 and parameters: {'model_type': 'gcn', 'hidden_dims': '[128, 64]', 'dropout': 0.199031432379812, 'batch_norm': True, 'lr': 1.8408544111075837e-06, 'weight_decay': 5.5136510071208614e-05, 'epochs': 336, 'loss': 'mae', 'optimizer': 'adam', 'graph_mode': 'off', 'use_snp_selection': True, 'num_snps': 43862}. Best is trial 0 with value: 0.04773450131112465.
[I 2025-11-03 13:18:15,260] Trial 1 finished with value: 0.04309382657707951 and parameters: {'model_type': 'gcn', 'hidden_dims': '[256, 128]', 'dropout': 0.4370668075331726, 'batch_norm': True, 'lr': 7.133471581159139e-05, 'weight_decay': 1.128633586803549e-05, 'epochs': 242, 'loss': 'mae', 'optimizer': 'adam', 'graph_mode': 'off', 'use_snp_selection': False}. Best is trial 0 with value: 0.04773450131112465.
[I 2025-11-03 13:18:16,249] Trial 2 finished with value: 0.01404291365101006 and parameters: {'model_type': 'gcn', 'hidden_dims': '[256, 128, 64]', 'dropout': 0.41314357415569625, 'batch_norm': False, 'lr': 3.952233718592101e-06, 'weight_decay': 0.00026754769258252603, 'epochs': 149, 'loss': 'mse', 'optimizer': 'adam', 'graph_mode': 'off', 'use_snp_selection': True, 'num_snps': 11571}. Best is trial 0 with value: 0.04773450131112465.
[I 2025-11-03 13:18:18,237] Trial 3 finished with value: -0.0041296691191296435 and parameters: {'model_type': 'gcn', 'hidden_dims': '[512, 64]', 'dropout': 0.5938127374509361, 'batch_norm': False, 'lr': 5.67704586114731e-06, 'weight_decay': 2.4518087630137052e-05, 'epochs': 320, 'loss': 'mae', 'optimizer': 'adam', 'graph_mode': 'off', 'use_snp_selection': False}. Best is trial 0 with value: 0.04773450131112465.
[I 2025-11-03 13:18:20,194] Trial 4 finished with value: 0.04065591463606163 and parameters: {'model_type': 'gcn', 'hidden_dims': '[512, 128]', 'dropout': 0.25746343592134413, 'batch_norm': True, 'lr': 1.3467657668402788e-06, 'weight_decay': 0.00033087251918647806, 'epochs': 277, 'loss': 'mse', 'optimizer': 'adam', 'graph_mode': 'off', 'use_snp_selection': True, 'num_snps': 36675}. Best is trial 0 with value: 0.04773450131112465.
[I 2025-11-03 13:18:21,631] Trial 5 finished with value: -0.003127246118973124 and parameters: {'model_type': 'gcn', 'hidden_dims': '[512, 64]', 'dropout': 0.38275350994408375, 'batch_norm': True, 'lr': 1.5586664309232824e-06, 'weight_decay': 0.0008227664668621182, 'epochs': 145, 'loss': 'mae', 'optimizer': 'adam', 'graph_mode': 'off', 'use_snp_selection': True, 'num_snps': 32148}. Best is trial 0 with value: 0.04773450131112465.
[I 2025-11-03 13:18:22,751] Trial 6 finished with value: 0.03143312751994853 and parameters: {'model_type': 'gcn', 'hidden_dims': '[256, 128]', 'dropout': 0.3930109900265879, 'batch_norm': False, 'lr': 4.892964372128395e-05, 'weight_decay': 1.5809549317992182e-06, 'epochs': 199, 'loss': 'mse', 'optimizer': 'adam', 'graph_mode': 'off', 'use_snp_selection': False}. Best is trial 0 with value: 0.04773450131112465.
[I 2025-11-03 13:18:23,874] Trial 7 finished with value: 0.0622706627867915 and parameters: {'model_type': 'gcn', 'hidden_dims': '[512, 256]', 'dropout': 0.15343979219678458, 'batch_norm': True, 'lr': 6.234003099047341e-05, 'weight_decay': 3.894760610535477e-07, 'epochs': 97, 'loss': 'mse', 'optimizer': 'adam', 'graph_mode': 'off', 'use_snp_selection': False}. Best is trial 7 with value: 0.0622706627867915.
[I 2025-11-03 13:18:25,909] Trial 8 finished with value: 0.09380519345423338 and parameters: {'model_type': 'gcn', 'hidden_dims': '[512, 128]', 'dropout': 0.10743001231661406, 'batch_norm': True, 'lr': 0.00023728538449271062, 'weight_decay': 1.7629071578048637e-05, 'epochs': 312, 'loss': 'mae', 'optimizer': 'adam', 'graph_mode': 'off', 'use_snp_selection': False}. Best is trial 8 with value: 0.09380519345423338.
[I 2025-11-03 13:18:27,386] Trial 9 finished with value: 0.06923779826902246 and parameters: {'model_type': 'gcn', 'hidden_dims': '[512, 64]', 'dropout': 0.14505336736221927, 'batch_norm': True, 'lr': 5.8619638388111826e-05, 'weight_decay': 6.200156172669308e-07, 'epochs': 175, 'loss': 'mse', 'optimizer': 'adam', 'graph_mode': 'off', 'use_snp_selection': False}. Best is trial 8 with value: 0.09380519345423338.
[I 2025-11-03 13:18:28,332] Trial 10 finished with value: 0.06430787088041301 and parameters: {'model_type': 'gcn', 'hidden_dims': '[512, 128]', 'dropout': 0.2800030442581858, 'batch_norm': False, 'lr': 0.0004919806695968257, 'weight_decay': 2.9953888095455486e-06, 'epochs': 55, 'loss': 'mae', 'optimizer': 'adam', 'graph_mode': 'off', 'use_snp_selection': False}. Best is trial 8 with value: 0.09380519345423338.
[I 2025-11-03 13:18:29,959] Trial 11 finished with value: 0.09166348768140176 and parameters: {'model_type': 'gcn', 'hidden_dims': '[512, 128]', 'dropout': 0.10095648685224448, 'batch_norm': True, 'lr': 0.0003411435764085616, 'weight_decay': 1.2045055692919657e-07, 'epochs': 216, 'loss': 'mse', 'optimizer': 'adam', 'graph_mode': 'off', 'use_snp_selection': False}. Best is trial 8 with value: 0.09380519345423338.
[I 2025-11-03 13:18:31,761] Trial 12 finished with value: 0.10260280416614226 and parameters: {'model_type': 'gcn', 'hidden_dims': '[512, 128]', 'dropout': 0.10344600881777158, 'batch_norm': True, 'lr': 0.0006674532614549997, 'weight_decay': 1.3081036432574914e-07, 'epochs': 255, 'loss': 'mae', 'optimizer': 'adam', 'graph_mode': 'off', 'use_snp_selection': False}. Best is trial 12 with value: 0.10260280416614226.
[I 2025-11-03 13:18:33,706] Trial 13 finished with value: 0.08293927420194797 and parameters: {'model_type': 'gcn', 'hidden_dims': '[512, 128]', 'dropout': 0.2429461314891602, 'batch_norm': True, 'lr': 0.00020263148232071683, 'weight_decay': 5.014770300041101e-06, 'epochs': 285, 'loss': 'mae', 'optimizer': 'adam', 'graph_mode': 'off', 'use_snp_selection': False}. Best is trial 12 with value: 0.10260280416614226.
[I 2025-11-03 13:18:35,558] Trial 14 finished with value: 0.09387168338718897 and parameters: {'model_type': 'gcn', 'hidden_dims': '[512, 128]', 'dropout': 0.3221595656802847, 'batch_norm': True, 'lr': 0.0009218940720367965, 'weight_decay': 5.724103314313124e-05, 'epochs': 271, 'loss': 'mae', 'optimizer': 'adam', 'graph_mode': 'off', 'use_snp_selection': False}. Best is trial 12 with value: 0.10260280416614226.
[I 2025-11-03 13:18:36,696] Trial 15 finished with value: 0.10803986111032476 and parameters: {'model_type': 'gcn', 'hidden_dims': '[128, 64]', 'dropout': 0.4919686891470565, 'batch_norm': True, 'lr': 0.0008103149488870867, 'weight_decay': 7.886437726517413e-05, 'epochs': 253, 'loss': 'mae', 'optimizer': 'adam', 'graph_mode': 'off', 'use_snp_selection': False}. Best is trial 15 with value: 0.10803986111032476.
[I 2025-11-03 13:18:37,797] Trial 16 finished with value: 0.04757283980798371 and parameters: {'model_type': 'gcn', 'hidden_dims': '[128, 64]', 'dropout': 0.4989870674302199, 'batch_norm': True, 'lr': 1.4261500238484739e-05, 'weight_decay': 1.0590314199196095e-07, 'epochs': 240, 'loss': 'mae', 'optimizer': 'adam', 'graph_mode': 'off', 'use_snp_selection': False}. Best is trial 15 with value: 0.10803986111032476.
[I 2025-11-03 13:18:38,893] Trial 17 finished with value: 0.0754036274655361 and parameters: {'model_type': 'gcn', 'hidden_dims': '[128, 64]', 'dropout': 0.544698840411329, 'batch_norm': True, 'lr': 0.000906375209920231, 'weight_decay': 0.00010091812082803722, 'epochs': 239, 'loss': 'mae', 'optimizer': 'adam', 'graph_mode': 'off', 'use_snp_selection': False}. Best is trial 15 with value: 0.10803986111032476.
[I 2025-11-03 13:18:41,180] Trial 18 finished with value: 0.05322468001284839 and parameters: {'model_type': 'gcn', 'hidden_dims': '[512, 256]', 'dropout': 0.46639138202298713, 'batch_norm': False, 'lr': 0.00016784743392938832, 'weight_decay': 1.0815722596945956e-06, 'epochs': 172, 'loss': 'mae', 'optimizer': 'adam', 'graph_mode': 'off', 'use_snp_selection': True, 'num_snps': 58241}. Best is trial 15 with value: 0.10803986111032476.
[I 2025-11-03 13:18:42,911] Trial 19 finished with value: 0.03681518194900282 and parameters: {'model_type': 'gcn', 'hidden_dims': '[256, 128, 64]', 'dropout': 0.32543878309904495, 'batch_norm': True, 'lr': 2.2574049817606828e-05, 'weight_decay': 2.7141958802400986e-07, 'epochs': 297, 'loss': 'mae', 'optimizer': 'adam', 'graph_mode': 'off', 'use_snp_selection': False}. Best is trial 15 with value: 0.10803986111032476.
[I 2025-11-03 13:18:44,049] Trial 20 finished with value: 0.07279264611625401 and parameters: {'model_type': 'gcn', 'hidden_dims': '[128, 64]', 'dropout': 0.5167012511542723, 'batch_norm': True, 'lr': 0.00012257064336456587, 'weight_decay': 4.8427762877930775e-06, 'epochs': 256, 'loss': 'mae', 'optimizer': 'adam', 'graph_mode': 'off', 'use_snp_selection': False}. Best is trial 15 with value: 0.10803986111032476.
[I 2025-11-03 13:18:45,917] Trial 21 finished with value: 0.09616464519565156 and parameters: {'model_type': 'gcn', 'hidden_dims': '[512, 128]', 'dropout': 0.3401153594809116, 'batch_norm': True, 'lr': 0.0007571470607526515, 'weight_decay': 6.0570677046817906e-05, 'epochs': 269, 'loss': 'mae', 'optimizer': 'adam', 'graph_mode': 'off', 'use_snp_selection': False}. Best is trial 15 with value: 0.10803986111032476.
[I 2025-11-03 13:18:47,540] Trial 22 finished with value: 0.10365992252773978 and parameters: {'model_type': 'gcn', 'hidden_dims': '[512, 128]', 'dropout': 0.20356677161731937, 'batch_norm': True, 'lr': 0.000511247071469508, 'weight_decay': 0.00013797217143100076, 'epochs': 217, 'loss': 'mae', 'optimizer': 'adam', 'graph_mode': 'off', 'use_snp_selection': False}. Best is trial 15 with value: 0.10803986111032476.
[I 2025-11-03 13:18:48,586] Trial 23 finished with value: 0.07807528040870998 and parameters: {'model_type': 'gcn', 'hidden_dims': '[128, 64]', 'dropout': 0.20190404085516683, 'batch_norm': True, 'lr': 0.0004483762858665026, 'weight_decay': 0.00021045211838690772, 'epochs': 213, 'loss': 'mae', 'optimizer': 'adam', 'graph_mode': 'off', 'use_snp_selection': False}. Best is trial 15 with value: 0.10803986111032476.
[I 2025-11-03 13:18:50,038] Trial 24 finished with value: 0.09512337518707142 and parameters: {'model_type': 'gcn', 'hidden_dims': '[512, 128]', 'dropout': 0.19025330548954295, 'batch_norm': True, 'lr': 0.0004509492432321706, 'weight_decay': 0.000124619129001452, 'epochs': 179, 'loss': 'mae', 'optimizer': 'adam', 'graph_mode': 'off', 'use_snp_selection': False}. Best is trial 15 with value: 0.10803986111032476.
[I 2025-11-03 13:18:51,633] Trial 25 finished with value: 0.09484625877098124 and parameters: {'model_type': 'gcn', 'hidden_dims': '[512, 256]', 'dropout': 0.14443998379051493, 'batch_norm': True, 'lr': 0.00012698879513939904, 'weight_decay': 0.0008835998501523608, 'epochs': 211, 'loss': 'mae', 'optimizer': 'adam', 'graph_mode': 'off', 'use_snp_selection': False}. Best is trial 15 with value: 0.10803986111032476.
[I 2025-11-03 13:18:52,740] Trial 26 finished with value: 0.037778863604489135 and parameters: {'model_type': 'gcn', 'hidden_dims': '[256, 128, 64]', 'dropout': 0.2929823880061965, 'batch_norm': False, 'lr': 0.0006158498495906296, 'weight_decay': 2.2055849144318457e-05, 'epochs': 231, 'loss': 'mae', 'optimizer': 'adam', 'graph_mode': 'off', 'use_snp_selection': True, 'num_snps': 3842}. Best is trial 15 with value: 0.10803986111032476.
[I 2025-11-03 13:18:54,150] Trial 27 finished with value: 0.08631565469979913 and parameters: {'model_type': 'gcn', 'hidden_dims': '[256, 128]', 'dropout': 0.2275037758581882, 'batch_norm': True, 'lr': 0.0003784104596736771, 'weight_decay': 3.7728781986273995e-05, 'epochs': 258, 'loss': 'mae', 'optimizer': 'adam', 'graph_mode': 'off', 'use_snp_selection': False}. Best is trial 15 with value: 0.10803986111032476.
[I 2025-11-03 13:18:55,524] Trial 28 finished with value: 0.09230999624264102 and parameters: {'model_type': 'gcn', 'hidden_dims': '[128, 64]', 'dropout': 0.5998525938512065, 'batch_norm': True, 'lr': 0.0003165735008604312, 'weight_decay': 0.0005147486060291718, 'epochs': 348, 'loss': 'mae', 'optimizer': 'adam', 'graph_mode': 'off', 'use_snp_selection': False}. Best is trial 15 with value: 0.10803986111032476.
[I 2025-11-03 13:18:56,564] Trial 29 finished with value: 0.04035150804479954 and parameters: {'model_type': 'gcn', 'hidden_dims': '[128, 64]', 'dropout': 0.17488450823237117, 'batch_norm': True, 'lr': 9.603380354241073e-05, 'weight_decay': 0.00012363202694194868, 'epochs': 143, 'loss': 'mae', 'optimizer': 'adam', 'graph_mode': 'off', 'use_snp_selection': True, 'num_snps': 19468}. Best is trial 15 with value: 0.10803986111032476.
[I 2025-11-03 13:18:58,556] Trial 30 finished with value: 0.09640953243744328 and parameters: {'model_type': 'gcn', 'hidden_dims': '[512, 128]', 'dropout': 0.21333016152611234, 'batch_norm': True, 'lr': 0.0006776235810913744, 'weight_decay': 7.936293724844838e-06, 'epochs': 299, 'loss': 'mae', 'optimizer': 'adam', 'graph_mode': 'off', 'use_snp_selection': False}. Best is trial 15 with value: 0.10803986111032476.
[I 2025-11-03 13:19:00,584] Trial 31 finished with value: 0.10655627095397273 and parameters: {'model_type': 'gcn', 'hidden_dims': '[512, 128]', 'dropout': 0.23169368944728969, 'batch_norm': True, 'lr': 0.0006635818750912337, 'weight_decay': 8.974280790259746e-06, 'epochs': 307, 'loss': 'mae', 'optimizer': 'adam', 'graph_mode': 'off', 'use_snp_selection': False}. Best is trial 15 with value: 0.10803986111032476.
[I 2025-11-03 13:19:02,730] Trial 32 finished with value: 0.10453344765451532 and parameters: {'model_type': 'gcn', 'hidden_dims': '[512, 128]', 'dropout': 0.27987054587568866, 'batch_norm': True, 'lr': 0.0002619639956343358, 'weight_decay': 3.6703596203591356e-05, 'epochs': 331, 'loss': 'mae', 'optimizer': 'adam', 'graph_mode': 'off', 'use_snp_selection': False}. Best is trial 15 with value: 0.10803986111032476.
[I 2025-11-03 13:19:04,849] Trial 33 finished with value: 0.08009818886893136 and parameters: {'model_type': 'gcn', 'hidden_dims': '[512, 128]', 'dropout': 0.28525956711764544, 'batch_norm': True, 'lr': 0.00027367783548882347, 'weight_decay': 1.3937451153840371e-05, 'epochs': 331, 'loss': 'mae', 'optimizer': 'adam', 'graph_mode': 'off', 'use_snp_selection': False}. Best is trial 15 with value: 0.10803986111032476.
[I 2025-11-03 13:19:06,406] Trial 34 finished with value: 0.10318638527167599 and parameters: {'model_type': 'gcn', 'hidden_dims': '[256, 128]', 'dropout': 0.3685687117236634, 'batch_norm': True, 'lr': 0.0002006621239600688, 'weight_decay': 3.6322105385245414e-05, 'epochs': 322, 'loss': 'mae', 'optimizer': 'adam', 'graph_mode': 'off', 'use_snp_selection': False}. Best is trial 15 with value: 0.10803986111032476.
[I 2025-11-03 13:19:08,343] Trial 35 finished with value: 0.040716619271784174 and parameters: {'model_type': 'gcn', 'hidden_dims': '[512, 128]', 'dropout': 0.43024169205778806, 'batch_norm': False, 'lr': 0.0005303200647615773, 'weight_decay': 0.00019473493821710918, 'epochs': 295, 'loss': 'mae', 'optimizer': 'adam', 'graph_mode': 'off', 'use_snp_selection': False}. Best is trial 15 with value: 0.10803986111032476.
[I 2025-11-03 13:19:11,279] Trial 36 finished with value: 0.046259377714795095 and parameters: {'model_type': 'gcn', 'hidden_dims': '[512, 64]', 'dropout': 0.25983541712835195, 'batch_norm': True, 'lr': 4.8467383110969695e-06, 'weight_decay': 8.427812425604493e-05, 'epochs': 339, 'loss': 'mse', 'optimizer': 'adam', 'graph_mode': 'off', 'use_snp_selection': True, 'num_snps': 58661}. Best is trial 15 with value: 0.10803986111032476.
[I 2025-11-03 13:19:13,066] Trial 37 finished with value: 0.10340458138265667 and parameters: {'model_type': 'gcn', 'hidden_dims': '[256, 128, 64]', 'dropout': 0.30171263345590194, 'batch_norm': True, 'lr': 0.0009520265488503753, 'weight_decay': 9.055116683521898e-06, 'epochs': 314, 'loss': 'mae', 'optimizer': 'adam', 'graph_mode': 'off', 'use_snp_selection': False}. Best is trial 15 with value: 0.10803986111032476.
[I 2025-11-03 13:19:14,566] Trial 38 finished with value: 0.04030766724067489 and parameters: {'model_type': 'gcn', 'hidden_dims': '[512, 128]', 'dropout': 0.25165496032490087, 'batch_norm': False, 'lr': 1.1665792017271946e-05, 'weight_decay': 3.034551792785833e-05, 'epochs': 285, 'loss': 'mse', 'optimizer': 'adam', 'graph_mode': 'off', 'use_snp_selection': True, 'num_snps': 19911}. Best is trial 15 with value: 0.10803986111032476.
[I 2025-11-03 13:19:16,763] Trial 39 finished with value: 0.10300051515042667 and parameters: {'model_type': 'gcn', 'hidden_dims': '[512, 128]', 'dropout': 0.17473359198041757, 'batch_norm': True, 'lr': 0.00014918059669291885, 'weight_decay': 0.0004946820064475046, 'epochs': 346, 'loss': 'mae', 'optimizer': 'adam', 'graph_mode': 'off', 'use_snp_selection': False}. Best is trial 15 with value: 0.10803986111032476.
[I 2025-11-03 13:19:18,483] Trial 40 finished with value: 0.03034018891637898 and parameters: {'model_type': 'gcn', 'hidden_dims': '[512, 256]', 'dropout': 0.570394383375138, 'batch_norm': True, 'lr': 3.424826932066893e-05, 'weight_decay': 5.8592729526540195e-05, 'epochs': 227, 'loss': 'mae', 'optimizer': 'adam', 'graph_mode': 'off', 'use_snp_selection': False}. Best is trial 15 with value: 0.10803986111032476.
[I 2025-11-03 13:19:20,355] Trial 41 finished with value: -0.0013571373451398078 and parameters: {'model_type': 'gcn', 'hidden_dims': '[256, 128, 64]', 'dropout': 0.3027292559592328, 'batch_norm': True, 'lr': 2.320370617557869e-06, 'weight_decay': 9.000671889758086e-06, 'epochs': 317, 'loss': 'mae', 'optimizer': 'adam', 'graph_mode': 'off', 'use_snp_selection': False}. Best is trial 15 with value: 0.10803986111032476.
[I 2025-11-03 13:19:22,147] Trial 42 finished with value: 0.09470601213853046 and parameters: {'model_type': 'gcn', 'hidden_dims': '[256, 128, 64]', 'dropout': 0.36682030508917746, 'batch_norm': True, 'lr': 0.0009405139388933562, 'weight_decay': 2.4879018819447254e-06, 'epochs': 308, 'loss': 'mae', 'optimizer': 'adam', 'graph_mode': 'off', 'use_snp_selection': False}. Best is trial 15 with value: 0.10803986111032476.
[I 2025-11-03 13:19:24,016] Trial 43 finished with value: 0.09807728900426392 and parameters: {'model_type': 'gcn', 'hidden_dims': '[256, 128, 64]', 'dropout': 0.2649379705754889, 'batch_norm': True, 'lr': 0.0003497668817211065, 'weight_decay': 1.391306332108982e-05, 'epochs': 331, 'loss': 'mae', 'optimizer': 'adam', 'graph_mode': 'off', 'use_snp_selection': False}. Best is trial 15 with value: 0.10803986111032476.
