[I 2025-11-03 13:05:06,457] Trial 130 finished with value: 0.1065356029887869 and parameters: {'model_type': 'gcn', 'hidden_dims': '[256, 128]', 'dropout': 0.187777041645724, 'batch_norm': True, 'lr': 0.0003391385346216434, 'weight_decay': 1.8689124443923006e-07, 'epochs': 239, 'loss': 'mse', 'optimizer': 'adam', 'graph_mode': 'off', 'use_snp_selection': False}. Best is trial 74 with value: 0.1266375421692321.
[I 2025-11-03 13:05:08,230] Trial 131 finished with value: 0.09774589290479986 and parameters: {'model_type': 'gcn', 'hidden_dims': '[512, 128]', 'dropout': 0.17495633603889585, 'batch_norm': True, 'lr': 0.0005679130742184313, 'weight_decay': 3.3809852896084e-07, 'epochs': 207, 'loss': 'mse', 'optimizer': 'adam', 'graph_mode': 'off', 'use_snp_selection': False}. Best is trial 74 with value: 0.1266375421692321.
[I 2025-11-03 13:05:10,113] Trial 132 finished with value: 0.11085311371261823 and parameters: {'model_type': 'gcn', 'hidden_dims': '[512, 128]', 'dropout': 0.19903275234922427, 'batch_norm': True, 'lr': 0.0004306790209423751, 'weight_decay': 1.465454910728458e-07, 'epochs': 227, 'loss': 'mse', 'optimizer': 'adam', 'graph_mode': 'off', 'use_snp_selection': False}. Best is trial 74 with value: 0.1266375421692321.
[I 2025-11-03 13:05:11,919] Trial 133 finished with value: 0.08879408195611055 and parameters: {'model_type': 'gcn', 'hidden_dims': '[512, 128]', 'dropout': 0.3759752063270185, 'batch_norm': True, 'lr': 0.0002540811399709463, 'weight_decay': 2.2181128817094778e-07, 'epochs': 216, 'loss': 'mse', 'optimizer': 'adam', 'graph_mode': 'off', 'use_snp_selection': False}. Best is trial 74 with value: 0.1266375421692321.
[I 2025-11-03 13:05:13,813] Trial 134 finished with value: 0.10411294941784979 and parameters: {'model_type': 'gcn', 'hidden_dims': '[512, 128]', 'dropout': 0.36020865766897486, 'batch_norm': True, 'lr': 0.00029848864935920466, 'weight_decay': 2.952775821196093e-07, 'epochs': 232, 'loss': 'mse', 'optimizer': 'adam', 'graph_mode': 'off', 'use_snp_selection': False}. Best is trial 74 with value: 0.1266375421692321.
[I 2025-11-03 13:05:14,987] Trial 135 finished with value: 0.10088278763220931 and parameters: {'model_type': 'gcn', 'hidden_dims': '[128, 64]', 'dropout': 0.31099614244334534, 'batch_norm': True, 'lr': 0.00041081936834712855, 'weight_decay': 3.725718881081886e-07, 'epochs': 258, 'loss': 'mse', 'optimizer': 'adam', 'graph_mode': 'off', 'use_snp_selection': False}. Best is trial 74 with value: 0.1266375421692321.
[I 2025-11-03 13:05:17,071] Trial 136 finished with value: 0.10847470571756435 and parameters: {'model_type': 'gcn', 'hidden_dims': '[512, 128]', 'dropout': 0.16277233027232937, 'batch_norm': True, 'lr': 0.00022481356107841016, 'weight_decay': 1.7291487411717026e-07, 'epochs': 240, 'loss': 'mse', 'optimizer': 'adam', 'graph_mode': 'off', 'use_snp_selection': True, 'num_snps': 38577}. Best is trial 74 with value: 0.1266375421692321.
[I 2025-11-03 13:05:19,026] Trial 137 finished with value: 0.0028334802245016193 and parameters: {'model_type': 'gcn', 'hidden_dims': '[512, 128]', 'dropout': 0.3423432985186522, 'batch_norm': True, 'lr': 2.2975734365990353e-06, 'weight_decay': 0.00012982942195214985, 'epochs': 244, 'loss': 'mse', 'optimizer': 'adam', 'graph_mode': 'off', 'use_snp_selection': False}. Best is trial 74 with value: 0.1266375421692321.
[I 2025-11-03 13:05:21,065] Trial 138 finished with value: 0.11433823234768371 and parameters: {'model_type': 'gcn', 'hidden_dims': '[512, 128]', 'dropout': 0.20755556324200033, 'batch_norm': True, 'lr': 0.0005046675076622937, 'weight_decay': 4.427222875405359e-07, 'epochs': 266, 'loss': 'mse', 'optimizer': 'adam', 'graph_mode': 'off', 'use_snp_selection': False}. Best is trial 74 with value: 0.1266375421692321.
[I 2025-11-03 13:05:23,298] Trial 139 finished with value: 0.09434218534839821 and parameters: {'model_type': 'gcn', 'hidden_dims': '[512, 128]', 'dropout': 0.20861109626297214, 'batch_norm': True, 'lr': 0.00010080272641542997, 'weight_decay': 5.63682552898474e-07, 'epochs': 280, 'loss': 'mse', 'optimizer': 'adam', 'graph_mode': 'off', 'use_snp_selection': False}. Best is trial 74 with value: 0.1266375421692321.
[I 2025-11-03 13:05:25,378] Trial 140 finished with value: 0.11219904356230076 and parameters: {'model_type': 'gcn', 'hidden_dims': '[512, 128]', 'dropout': 0.19283678403111343, 'batch_norm': True, 'lr': 0.0003595025837339091, 'weight_decay': 4.74625685293007e-07, 'epochs': 272, 'loss': 'mse', 'optimizer': 'adam', 'graph_mode': 'off', 'use_snp_selection': False}. Best is trial 74 with value: 0.1266375421692321.
[I 2025-11-03 13:05:27,415] Trial 141 finished with value: 0.09561340496478346 and parameters: {'model_type': 'gcn', 'hidden_dims': '[512, 128]', 'dropout': 0.22924027282879347, 'batch_norm': True, 'lr': 0.0005172326387750015, 'weight_decay': 2.3587883161844121e-07, 'epochs': 264, 'loss': 'mse', 'optimizer': 'adam', 'graph_mode': 'off', 'use_snp_selection': False}. Best is trial 74 with value: 0.1266375421692321.
[I 2025-11-03 13:05:29,624] Trial 142 finished with value: 0.10762406963331277 and parameters: {'model_type': 'gcn', 'hidden_dims': '[512, 128]', 'dropout': 0.1777213297427022, 'batch_norm': True, 'lr': 0.0006260807278274653, 'weight_decay': 3.1854311897126327e-07, 'epochs': 293, 'loss': 'mse', 'optimizer': 'adam', 'graph_mode': 'off', 'use_snp_selection': False}. Best is trial 74 with value: 0.1266375421692321.
[I 2025-11-03 13:05:31,272] Trial 143 finished with value: 0.09228349534477885 and parameters: {'model_type': 'gcn', 'hidden_dims': '[256, 128, 64]', 'dropout': 0.25019363873255623, 'batch_norm': True, 'lr': 0.0004745354364240076, 'weight_decay': 1.3883344151933882e-07, 'epochs': 253, 'loss': 'mse', 'optimizer': 'adam', 'graph_mode': 'off', 'use_snp_selection': False}. Best is trial 74 with value: 0.1266375421692321.
[I 2025-11-03 13:05:33,245] Trial 144 finished with value: 0.10686296194598971 and parameters: {'model_type': 'gcn', 'hidden_dims': '[512, 128]', 'dropout': 0.1407943490873451, 'batch_norm': True, 'lr': 0.00037390858705061943, 'weight_decay': 4.474396457628662e-07, 'epochs': 249, 'loss': 'mse', 'optimizer': 'adam', 'graph_mode': 'off', 'use_snp_selection': False}. Best is trial 74 with value: 0.1266375421692321.
[I 2025-11-03 13:05:34,967] Trial 145 finished with value: 0.11038522364703321 and parameters: {'model_type': 'gcn', 'hidden_dims': '[512, 128]', 'dropout': 0.1267040763347448, 'batch_norm': True, 'lr': 0.00032780292052245316, 'weight_decay': 2.6767405003947644e-07, 'epochs': 198, 'loss': 'mse', 'optimizer': 'adam', 'graph_mode': 'off', 'use_snp_selection': False}. Best is trial 74 with value: 0.1266375421692321.
[I 2025-11-03 13:05:36,815] Trial 146 finished with value: 0.08735150689509381 and parameters: {'model_type': 'gcn', 'hidden_dims': '[512, 128]', 'dropout': 0.2171614098685043, 'batch_norm': True, 'lr': 0.00015661658026726929, 'weight_decay': 2.0312480171269655e-07, 'epochs': 211, 'loss': 'mse', 'optimizer': 'adam', 'graph_mode': 'off', 'use_snp_selection': False}. Best is trial 74 with value: 0.1266375421692321.
[I 2025-11-03 13:05:38,666] Trial 147 finished with value: 0.11215165203947114 and parameters: {'model_type': 'gcn', 'hidden_dims': '[512, 128]', 'dropout': 0.18562170858913804, 'batch_norm': True, 'lr': 0.0009586364523164176, 'weight_decay': 3.7751416688776345e-07, 'epochs': 222, 'loss': 'mse', 'optimizer': 'adam', 'graph_mode': 'off', 'use_snp_selection': False}. Best is trial 74 with value: 0.1266375421692321.
[I 2025-11-03 13:05:40,702] Trial 148 finished with value: 0.0772641964895374 and parameters: {'model_type': 'gcn', 'hidden_dims': '[512, 128]', 'dropout': 0.1553727976577094, 'batch_norm': False, 'lr': 0.0006006917639441947, 'weight_decay': 5.933985552197283e-07, 'epochs': 265, 'loss': 'mse', 'optimizer': 'adam', 'graph_mode': 'off', 'use_snp_selection': False}. Best is trial 74 with value: 0.1266375421692321.
[I 2025-11-03 13:05:42,609] Trial 149 finished with value: 0.11025168721827273 and parameters: {'model_type': 'gcn', 'hidden_dims': '[512, 128]', 'dropout': 0.20053618643771695, 'batch_norm': True, 'lr': 0.0007565937671796136, 'weight_decay': 0.0002918639147682043, 'epochs': 234, 'loss': 'mse', 'optimizer': 'adam', 'graph_mode': 'off', 'use_snp_selection': False}. Best is trial 74 with value: 0.1266375421692321.
[I 2025-11-03 13:05:44,696] Trial 0 finished with value: 0.05228316747287765 and parameters: {'model_type': 'gcn', 'hidden_dims': '[128, 64]', 'dropout': 0.199031432379812, 'batch_norm': True, 'lr': 1.8408544111075837e-06, 'weight_decay': 5.5136510071208614e-05, 'epochs': 336, 'loss': 'mae', 'optimizer': 'adam', 'graph_mode': 'off', 'use_snp_selection': True, 'num_snps': 43862}. Best is trial 0 with value: 0.05228316747287765.
[I 2025-11-03 13:05:46,101] Trial 1 finished with value: 0.07017085802720106 and parameters: {'model_type': 'gcn', 'hidden_dims': '[256, 128]', 'dropout': 0.4370668075331726, 'batch_norm': True, 'lr': 7.133471581159139e-05, 'weight_decay': 1.128633586803549e-05, 'epochs': 242, 'loss': 'mae', 'optimizer': 'adam', 'graph_mode': 'off', 'use_snp_selection': False}. Best is trial 1 with value: 0.07017085802720106.
[I 2025-11-03 13:05:47,149] Trial 2 finished with value: -0.007751810915261636 and parameters: {'model_type': 'gcn', 'hidden_dims': '[256, 128, 64]', 'dropout': 0.41314357415569625, 'batch_norm': False, 'lr': 3.952233718592101e-06, 'weight_decay': 0.00026754769258252603, 'epochs': 149, 'loss': 'mse', 'optimizer': 'adam', 'graph_mode': 'off', 'use_snp_selection': True, 'num_snps': 11571}. Best is trial 1 with value: 0.07017085802720106.
[I 2025-11-03 13:05:49,455] Trial 3 finished with value: 0.025556947529301224 and parameters: {'model_type': 'gcn', 'hidden_dims': '[512, 64]', 'dropout': 0.5938127374509361, 'batch_norm': False, 'lr': 5.67704586114731e-06, 'weight_decay': 2.4518087630137052e-05, 'epochs': 320, 'loss': 'mae', 'optimizer': 'adam', 'graph_mode': 'off', 'use_snp_selection': False}. Best is trial 1 with value: 0.07017085802720106.
[I 2025-11-03 13:05:51,605] Trial 4 finished with value: 0.0280800162928321 and parameters: {'model_type': 'gcn', 'hidden_dims': '[512, 128]', 'dropout': 0.25746343592134413, 'batch_norm': True, 'lr': 1.3467657668402788e-06, 'weight_decay': 0.00033087251918647806, 'epochs': 277, 'loss': 'mse', 'optimizer': 'adam', 'graph_mode': 'off', 'use_snp_selection': True, 'num_snps': 36675}. Best is trial 1 with value: 0.07017085802720106.
[I 2025-11-03 13:05:53,145] Trial 5 finished with value: -0.05110645699571984 and parameters: {'model_type': 'gcn', 'hidden_dims': '[512, 64]', 'dropout': 0.38275350994408375, 'batch_norm': True, 'lr': 1.5586664309232824e-06, 'weight_decay': 0.0008227664668621182, 'epochs': 145, 'loss': 'mae', 'optimizer': 'adam', 'graph_mode': 'off', 'use_snp_selection': True, 'num_snps': 32148}. Best is trial 1 with value: 0.07017085802720106.
[I 2025-11-03 13:05:54,379] Trial 6 finished with value: 0.052970559670773784 and parameters: {'model_type': 'gcn', 'hidden_dims': '[256, 128]', 'dropout': 0.3930109900265879, 'batch_norm': False, 'lr': 4.892964372128395e-05, 'weight_decay': 1.5809549317992182e-06, 'epochs': 199, 'loss': 'mse', 'optimizer': 'adam', 'graph_mode': 'off', 'use_snp_selection': False}. Best is trial 1 with value: 0.07017085802720106.
[I 2025-11-03 13:05:55,682] Trial 7 finished with value: 0.04166530012934356 and parameters: {'model_type': 'gcn', 'hidden_dims': '[512, 256]', 'dropout': 0.15343979219678458, 'batch_norm': True, 'lr': 6.234003099047341e-05, 'weight_decay': 3.894760610535477e-07, 'epochs': 97, 'loss': 'mse', 'optimizer': 'adam', 'graph_mode': 'off', 'use_snp_selection': False}. Best is trial 1 with value: 0.07017085802720106.
[I 2025-11-03 13:05:57,988] Trial 8 finished with value: 0.06599750882417946 and parameters: {'model_type': 'gcn', 'hidden_dims': '[512, 128]', 'dropout': 0.10743001231661406, 'batch_norm': True, 'lr': 0.00023728538449271062, 'weight_decay': 1.7629071578048637e-05, 'epochs': 312, 'loss': 'mae', 'optimizer': 'adam', 'graph_mode': 'off', 'use_snp_selection': False}. Best is trial 1 with value: 0.07017085802720106.
[I 2025-11-03 13:05:59,624] Trial 9 finished with value: 0.056621101406050714 and parameters: {'model_type': 'gcn', 'hidden_dims': '[512, 64]', 'dropout': 0.14505336736221927, 'batch_norm': True, 'lr': 5.8619638388111826e-05, 'weight_decay': 6.200156172669308e-07, 'epochs': 175, 'loss': 'mse', 'optimizer': 'adam', 'graph_mode': 'off', 'use_snp_selection': False}. Best is trial 1 with value: 0.07017085802720106.
[I 2025-11-03 13:06:00,963] Trial 10 finished with value: 0.05286894182736383 and parameters: {'model_type': 'gcn', 'hidden_dims': '[256, 128]', 'dropout': 0.5365714961141473, 'batch_norm': False, 'lr': 0.00032955828969150844, 'weight_decay': 3.381683344261174e-06, 'epochs': 236, 'loss': 'mae', 'optimizer': 'adam', 'graph_mode': 'off', 'use_snp_selection': False}. Best is trial 1 with value: 0.07017085802720106.
[I 2025-11-03 13:06:03,210] Trial 11 finished with value: 0.07595181720921317 and parameters: {'model_type': 'gcn', 'hidden_dims': '[512, 128]', 'dropout': 0.2851700052976396, 'batch_norm': True, 'lr': 0.0005194831231105461, 'weight_decay': 7.086980259133291e-06, 'epochs': 292, 'loss': 'mae', 'optimizer': 'adam', 'graph_mode': 'off', 'use_snp_selection': False}. Best is trial 11 with value: 0.07595181720921317.
[I 2025-11-03 13:06:05,194] Trial 12 finished with value: 0.07840993530653555 and parameters: {'model_type': 'gcn', 'hidden_dims': '[512, 128]', 'dropout': 0.29386241765791155, 'batch_norm': True, 'lr': 0.0006753264773209732, 'weight_decay': 4.7184344796598436e-06, 'epochs': 254, 'loss': 'mae', 'optimizer': 'adam', 'graph_mode': 'off', 'use_snp_selection': False}. Best is trial 12 with value: 0.07840993530653555.
[I 2025-11-03 13:06:07,241] Trial 13 finished with value: 0.08400405797328957 and parameters: {'model_type': 'gcn', 'hidden_dims': '[512, 128]', 'dropout': 0.2824024357189308, 'batch_norm': True, 'lr': 0.0005708634147974784, 'weight_decay': 1.3573000760324605e-07, 'epochs': 258, 'loss': 'mae', 'optimizer': 'adam', 'graph_mode': 'off', 'use_snp_selection': False}. Best is trial 13 with value: 0.08400405797328957.
[I 2025-11-03 13:06:08,232] Trial 14 finished with value: 0.07347321332057094 and parameters: {'model_type': 'gcn', 'hidden_dims': '[512, 128]', 'dropout': 0.3012984444538551, 'batch_norm': True, 'lr': 0.0008794651485426854, 'weight_decay': 1.0714307132691479e-07, 'epochs': 42, 'loss': 'mae', 'optimizer': 'adam', 'graph_mode': 'off', 'use_snp_selection': False}. Best is trial 13 with value: 0.08400405797328957.
[I 2025-11-03 13:06:10,278] Trial 15 finished with value: 0.04653058449691113 and parameters: {'model_type': 'gcn', 'hidden_dims': '[512, 128]', 'dropout': 0.33039918739984625, 'batch_norm': True, 'lr': 0.0001572871022003765, 'weight_decay': 1.195778569890065e-07, 'epochs': 252, 'loss': 'mae', 'optimizer': 'adam', 'graph_mode': 'off', 'use_snp_selection': False}. Best is trial 13 with value: 0.08400405797328957.
[I 2025-11-03 13:06:11,755] Trial 16 finished with value: 0.02855486928882348 and parameters: {'model_type': 'gcn', 'hidden_dims': '[256, 128, 64]', 'dropout': 0.2322523821205404, 'batch_norm': True, 'lr': 1.2586985041154999e-05, 'weight_decay': 6.468215272245557e-07, 'epochs': 206, 'loss': 'mae', 'optimizer': 'adam', 'graph_mode': 'off', 'use_snp_selection': False}. Best is trial 13 with value: 0.08400405797328957.
[I 2025-11-03 13:06:13,197] Trial 17 finished with value: 0.05991055334163756 and parameters: {'model_type': 'gcn', 'hidden_dims': '[128, 64]', 'dropout': 0.47258608104628735, 'batch_norm': True, 'lr': 0.0009232343718746423, 'weight_decay': 5.5664160819729205e-05, 'epochs': 349, 'loss': 'mae', 'optimizer': 'adam', 'graph_mode': 'off', 'use_snp_selection': False}. Best is trial 13 with value: 0.08400405797328957.
[I 2025-11-03 13:06:16,104] Trial 18 finished with value: 0.04074494730436605 and parameters: {'model_type': 'gcn', 'hidden_dims': '[512, 256]', 'dropout': 0.3447511065236248, 'batch_norm': False, 'lr': 0.0001629083154105072, 'weight_decay': 2.59352713325815e-06, 'epochs': 268, 'loss': 'mae', 'optimizer': 'adam', 'graph_mode': 'off', 'use_snp_selection': True, 'num_snps': 58241}. Best is trial 13 with value: 0.08400405797328957.
[I 2025-11-03 13:06:17,974] Trial 19 finished with value: 0.008811305759736557 and parameters: {'model_type': 'gcn', 'hidden_dims': '[512, 128]', 'dropout': 0.20576173823771962, 'batch_norm': True, 'lr': 1.725931429091624e-05, 'weight_decay': 2.7141958802400986e-07, 'epochs': 220, 'loss': 'mae', 'optimizer': 'adam', 'graph_mode': 'off', 'use_snp_selection': False}. Best is trial 13 with value: 0.08400405797328957.
[I 2025-11-03 13:06:20,222] Trial 20 finished with value: 0.07095050206126755 and parameters: {'model_type': 'gcn', 'hidden_dims': '[512, 128]', 'dropout': 0.29174091611568514, 'batch_norm': True, 'lr': 0.00041341180889758995, 'weight_decay': 1.123825922261302e-06, 'epochs': 292, 'loss': 'mae', 'optimizer': 'adam', 'graph_mode': 'off', 'use_snp_selection': False}. Best is trial 13 with value: 0.08400405797328957.
[I 2025-11-03 13:06:22,470] Trial 21 finished with value: 0.0729028672375524 and parameters: {'model_type': 'gcn', 'hidden_dims': '[512, 128]', 'dropout': 0.276350454413655, 'batch_norm': True, 'lr': 0.0004908910784870497, 'weight_decay': 5.679824336273863e-06, 'epochs': 294, 'loss': 'mae', 'optimizer': 'adam', 'graph_mode': 'off', 'use_snp_selection': False}. Best is trial 13 with value: 0.08400405797328957.
[I 2025-11-03 13:06:24,630] Trial 22 finished with value: 0.0784706408206653 and parameters: {'model_type': 'gcn', 'hidden_dims': '[512, 128]', 'dropout': 0.315478326219905, 'batch_norm': True, 'lr': 0.0006252377167996335, 'weight_decay': 6.469390209426272e-06, 'epochs': 257, 'loss': 'mae', 'optimizer': 'adam', 'graph_mode': 'off', 'use_snp_selection': False}. Best is trial 13 with value: 0.08400405797328957.
[I 2025-11-03 13:06:26,698] Trial 23 finished with value: 0.04743798868380095 and parameters: {'model_type': 'gcn', 'hidden_dims': '[512, 128]', 'dropout': 0.343688780933159, 'batch_norm': True, 'lr': 0.00011701149758776566, 'weight_decay': 3.871374174824454e-05, 'epochs': 258, 'loss': 'mae', 'optimizer': 'adam', 'graph_mode': 'off', 'use_snp_selection': False}. Best is trial 13 with value: 0.08400405797328957.
[I 2025-11-03 13:06:28,278] Trial 24 finished with value: 0.07206178298086284 and parameters: {'model_type': 'gcn', 'hidden_dims': '[512, 128]', 'dropout': 0.21946298953845958, 'batch_norm': True, 'lr': 0.0008850034446210797, 'weight_decay': 3.906432518505317e-06, 'epochs': 169, 'loss': 'mae', 'optimizer': 'adam', 'graph_mode': 'off', 'use_snp_selection': False}. Best is trial 13 with value: 0.08400405797328957.
[I 2025-11-03 13:06:30,104] Trial 25 finished with value: 0.06178336929171307 and parameters: {'model_type': 'gcn', 'hidden_dims': '[512, 128]', 'dropout': 0.3174346533989975, 'batch_norm': True, 'lr': 0.0002472775127998259, 'weight_decay': 0.00012473478026078205, 'epochs': 210, 'loss': 'mae', 'optimizer': 'adam', 'graph_mode': 'off', 'use_snp_selection': False}. Best is trial 13 with value: 0.08400405797328957.
[I 2025-11-03 13:06:31,280] Trial 26 finished with value: 0.08910794720524956 and parameters: {'model_type': 'gcn', 'hidden_dims': '[256, 128, 64]', 'dropout': 0.36390855244908726, 'batch_norm': False, 'lr': 0.0006176945212545079, 'weight_decay': 1.616580197945035e-06, 'epochs': 236, 'loss': 'mse', 'optimizer': 'adam', 'graph_mode': 'off', 'use_snp_selection': True, 'num_snps': 3842}. Best is trial 26 with value: 0.08910794720524956.
[I 2025-11-03 13:06:32,395] Trial 27 finished with value: 0.0322299987457135 and parameters: {'model_type': 'gcn', 'hidden_dims': '[256, 128, 64]', 'dropout': 0.4443753459369567, 'batch_norm': False, 'lr': 0.00011237756456508869, 'weight_decay': 2.365336790259821e-07, 'epochs': 224, 'loss': 'mse', 'optimizer': 'adam', 'graph_mode': 'off', 'use_snp_selection': True, 'num_snps': 2812}. Best is trial 26 with value: 0.08910794720524956.
[I 2025-11-03 13:06:33,492] Trial 28 finished with value: 0.012330511007386684 and parameters: {'model_type': 'gcn', 'hidden_dims': '[128, 64]', 'dropout': 0.37160849270289903, 'batch_norm': False, 'lr': 0.00024257185353044008, 'weight_decay': 1.137554163463357e-06, 'epochs': 179, 'loss': 'mse', 'optimizer': 'adam', 'graph_mode': 'off', 'use_snp_selection': True, 'num_snps': 16664}. Best is trial 26 with value: 0.08910794720524956.
[I 2025-11-03 13:06:35,242] Trial 29 finished with value: -0.02332052086087279 and parameters: {'model_type': 'gcn', 'hidden_dims': '[256, 128, 64]', 'dropout': 0.49284114971059745, 'batch_norm': False, 'lr': 2.6967592922913056e-05, 'weight_decay': 2.0690557149786135e-06, 'epochs': 321, 'loss': 'mse', 'optimizer': 'adam', 'graph_mode': 'off', 'use_snp_selection': True, 'num_snps': 19668}. Best is trial 26 with value: 0.08910794720524956.
[I 2025-11-03 13:06:36,533] Trial 30 finished with value: 0.06169851309890881 and parameters: {'model_type': 'gcn', 'hidden_dims': '[256, 128, 64]', 'dropout': 0.24688627031486826, 'batch_norm': False, 'lr': 0.00037452327203167435, 'weight_decay': 1.089970593035507e-05, 'epochs': 278, 'loss': 'mse', 'optimizer': 'adam', 'graph_mode': 'off', 'use_snp_selection': True, 'num_snps': 3639}. Best is trial 26 with value: 0.08910794720524956.
[I 2025-11-03 13:06:38,249] Trial 31 finished with value: 0.08650551596072698 and parameters: {'model_type': 'gcn', 'hidden_dims': '[512, 256]', 'dropout': 0.3722075450738005, 'batch_norm': True, 'lr': 0.0006108098984990378, 'weight_decay': 6.111095119876781e-06, 'epochs': 242, 'loss': 'mae', 'optimizer': 'adam', 'graph_mode': 'off', 'use_snp_selection': True, 'num_snps': 25403}. Best is trial 26 with value: 0.08910794720524956.
