[I 2025-11-03 12:57:12,915] Trial 128 finished with value: -0.02450260862541597 and parameters: {'model_type': 'gcn', 'hidden_dims': '[128, 64]', 'dropout': 0.307099653176327, 'batch_norm': False, 'lr': 0.00017822238038516915, 'weight_decay': 7.289978856604411e-05, 'epochs': 243, 'loss': 'mse', 'optimizer': 'adam', 'graph_mode': 'cutoff', 'cutoff': 0.24530959316576667, 'grm_norm': 'gcn', 'self_loops': True, 'use_snp_selection': True, 'num_snps': 37420}. Best is trial 71 with value: 0.06901665353648391.
[I 2025-11-03 12:57:14,724] Trial 129 finished with value: 1.0774087315649742e-05 and parameters: {'model_type': 'gcn', 'hidden_dims': '[512, 128]', 'dropout': 0.16023973910913725, 'batch_norm': True, 'lr': 2.9571409898980628e-05, 'weight_decay': 0.00011910337601336107, 'epochs': 69, 'loss': 'mse', 'optimizer': 'adam', 'graph_mode': 'cutoff', 'cutoff': 0.5198388625942858, 'grm_norm': 'none', 'self_loops': False, 'use_snp_selection': False}. Best is trial 71 with value: 0.06901665353648391.
[I 2025-11-03 12:57:16,753] Trial 130 finished with value: 0.04185837760919594 and parameters: {'model_type': 'gcn', 'hidden_dims': '[256, 128, 64]', 'dropout': 0.2539875325918238, 'batch_norm': True, 'lr': 1.9296259800830652e-05, 'weight_decay': 9.783728553237241e-06, 'epochs': 157, 'loss': 'mae', 'optimizer': 'adam', 'graph_mode': 'cutoff', 'cutoff': 0.6500359070854262, 'grm_norm': 'cosine_then_gcn', 'self_loops': True, 'use_snp_selection': False}. Best is trial 71 with value: 0.06901665353648391.
[I 2025-11-03 12:57:18,785] Trial 131 finished with value: 0.017278547659311402 and parameters: {'model_type': 'gcn', 'hidden_dims': '[128, 64]', 'dropout': 0.1653548422765739, 'batch_norm': True, 'lr': 0.00015503827479570038, 'weight_decay': 0.0001260788434748811, 'epochs': 313, 'loss': 'mse', 'optimizer': 'adam', 'graph_mode': 'cutoff', 'cutoff': 0.8190290667261739, 'grm_norm': 'cosine', 'self_loops': False, 'use_snp_selection': False}. Best is trial 71 with value: 0.06901665353648391.
[I 2025-11-03 12:57:20,810] Trial 132 finished with value: 0.026734099144120962 and parameters: {'model_type': 'gcn', 'hidden_dims': '[128, 64]', 'dropout': 0.2002997733551799, 'batch_norm': True, 'lr': 7.728363298515161e-05, 'weight_decay': 0.00010445596447802947, 'epochs': 324, 'loss': 'mse', 'optimizer': 'adam', 'graph_mode': 'cutoff', 'cutoff': 0.8000796993814066, 'grm_norm': 'cosine', 'self_loops': False, 'use_snp_selection': False}. Best is trial 71 with value: 0.06901665353648391.
[I 2025-11-03 12:57:22,754] Trial 133 finished with value: 0.016365687172148473 and parameters: {'model_type': 'gcn', 'hidden_dims': '[128, 64]', 'dropout': 0.17675041654735654, 'batch_norm': True, 'lr': 0.00021385356517094307, 'weight_decay': 5.736870752854659e-05, 'epochs': 297, 'loss': 'mse', 'optimizer': 'adam', 'graph_mode': 'cutoff', 'cutoff': 0.8578159261903845, 'grm_norm': 'cosine', 'self_loops': False, 'use_snp_selection': False}. Best is trial 71 with value: 0.06901665353648391.
[I 2025-11-03 12:57:24,841] Trial 134 finished with value: 0.027292200650994178 and parameters: {'model_type': 'gcn', 'hidden_dims': '[128, 64]', 'dropout': 0.23355324482277653, 'batch_norm': True, 'lr': 0.00014003019818301752, 'weight_decay': 0.0002578264876730052, 'epochs': 341, 'loss': 'mse', 'optimizer': 'adam', 'graph_mode': 'cutoff', 'cutoff': 0.8301909539651724, 'grm_norm': 'cosine', 'self_loops': False, 'use_snp_selection': False}. Best is trial 71 with value: 0.06901665353648391.
[I 2025-11-03 12:57:26,049] Trial 135 finished with value: 0.003154338380761008 and parameters: {'model_type': 'gcn', 'hidden_dims': '[128, 64]', 'dropout': 0.32577980706924375, 'batch_norm': True, 'lr': 0.00010838299367618454, 'weight_decay': 1.6336636363661298e-05, 'epochs': 60, 'loss': 'mse', 'optimizer': 'adam', 'graph_mode': 'cutoff', 'cutoff': 0.770284545248453, 'grm_norm': 'cosine', 'self_loops': False, 'use_snp_selection': False}. Best is trial 71 with value: 0.06901665353648391.
[I 2025-11-03 12:57:28,016] Trial 136 finished with value: 0.02320443707964521 and parameters: {'model_type': 'gcn', 'hidden_dims': '[128, 64]', 'dropout': 0.10030747974251193, 'batch_norm': True, 'lr': 5.054108730849757e-05, 'weight_decay': 3.380736705846825e-05, 'epochs': 304, 'loss': 'mse', 'optimizer': 'adam', 'graph_mode': 'cutoff', 'cutoff': 0.6273082136210313, 'grm_norm': 'gcn', 'self_loops': True, 'use_snp_selection': False}. Best is trial 71 with value: 0.06901665353648391.
[I 2025-11-03 12:57:29,523] Trial 137 finished with value: 0.016490938303248704 and parameters: {'model_type': 'gcn', 'hidden_dims': '[512, 64]', 'dropout': 0.5891930808323285, 'batch_norm': True, 'lr': 0.0002867890260848309, 'weight_decay': 0.00014128039782873456, 'epochs': 27, 'loss': 'mse', 'optimizer': 'adam', 'graph_mode': 'cutoff', 'cutoff': 0.7855440927909518, 'grm_norm': 'cosine_then_gcn', 'self_loops': False, 'use_snp_selection': False}. Best is trial 71 with value: 0.06901665353648391.
[I 2025-11-03 12:57:31,128] Trial 138 finished with value: 0.021872962001231903 and parameters: {'model_type': 'gcn', 'hidden_dims': '[128, 64]', 'dropout': 0.2200001209357503, 'batch_norm': True, 'lr': 1.7056670970254984e-05, 'weight_decay': 0.0005027577184197401, 'epochs': 188, 'loss': 'mse', 'optimizer': 'adam', 'graph_mode': 'cutoff', 'cutoff': 0.8832360002171004, 'grm_norm': 'gcn', 'self_loops': True, 'use_snp_selection': False}. Best is trial 71 with value: 0.06901665353648391.
[I 2025-11-03 12:57:33,773] Trial 139 finished with value: 0.041785988294501385 and parameters: {'model_type': 'gcn', 'hidden_dims': '[512, 256]', 'dropout': 0.14678657299728703, 'batch_norm': False, 'lr': 2.164708345416774e-05, 'weight_decay': 8.102185439435376e-05, 'epochs': 217, 'loss': 'mse', 'optimizer': 'adam', 'graph_mode': 'cutoff', 'cutoff': 0.7462204448129571, 'grm_norm': 'cosine', 'self_loops': False, 'use_snp_selection': True, 'num_snps': 24298}. Best is trial 71 with value: 0.06901665353648391.
[I 2025-11-03 12:57:35,247] Trial 140 finished with value: 0.031178175214794608 and parameters: {'model_type': 'gcn', 'hidden_dims': '[256, 128]', 'dropout': 0.11819289124943416, 'batch_norm': True, 'lr': 3.4530880452489754e-05, 'weight_decay': 0.00017846377330967404, 'epochs': 78, 'loss': 'mse', 'optimizer': 'adam', 'graph_mode': 'cutoff', 'cutoff': 0.8039491312203392, 'grm_norm': 'cosine_then_gcn', 'self_loops': True, 'use_snp_selection': False}. Best is trial 71 with value: 0.06901665353648391.
[I 2025-11-03 12:57:36,321] Trial 141 finished with value: 0.026942390409841914 and parameters: {'model_type': 'gcn', 'hidden_dims': '[128, 64]', 'dropout': 0.2993760139516324, 'batch_norm': True, 'lr': 5.851745677810275e-05, 'weight_decay': 1.930987643879906e-05, 'epochs': 18, 'loss': 'mse', 'optimizer': 'adam', 'graph_mode': 'cutoff', 'cutoff': 0.7463157668147047, 'grm_norm': 'none', 'self_loops': True, 'use_snp_selection': False}. Best is trial 71 with value: 0.06901665353648391.
[I 2025-11-03 12:57:37,365] Trial 142 finished with value: 0.03683010885035162 and parameters: {'model_type': 'gcn', 'hidden_dims': '[128, 64]', 'dropout': 0.34133545938688026, 'batch_norm': True, 'lr': 7.344549046973165e-05, 'weight_decay': 2.9414240534461543e-05, 'epochs': 7, 'loss': 'mse', 'optimizer': 'adam', 'graph_mode': 'cutoff', 'cutoff': 0.7297187676368877, 'grm_norm': 'none', 'self_loops': True, 'use_snp_selection': False}. Best is trial 71 with value: 0.06901665353648391.
[I 2025-11-03 12:57:38,531] Trial 143 finished with value: 0.02827362556323676 and parameters: {'model_type': 'gcn', 'hidden_dims': '[128, 64]', 'dropout': 0.2676171226183095, 'batch_norm': True, 'lr': 9.492181846986818e-05, 'weight_decay': 2.573737454457498e-05, 'epochs': 44, 'loss': 'mse', 'optimizer': 'adam', 'graph_mode': 'cutoff', 'cutoff': 0.7050841763119252, 'grm_norm': 'none', 'self_loops': True, 'use_snp_selection': False}. Best is trial 71 with value: 0.06901665353648391.
[I 2025-11-03 12:57:39,856] Trial 144 finished with value: 0.03602202932912318 and parameters: {'model_type': 'gcn', 'hidden_dims': '[128, 64]', 'dropout': 0.31071166331280503, 'batch_norm': True, 'lr': 8.327596509579726e-05, 'weight_decay': 4.7329556124120774e-05, 'epochs': 87, 'loss': 'mse', 'optimizer': 'adam', 'graph_mode': 'cutoff', 'cutoff': 0.6874192384744959, 'grm_norm': 'none', 'self_loops': True, 'use_snp_selection': False}. Best is trial 71 with value: 0.06901665353648391.
[I 2025-11-03 12:57:41,590] Trial 145 finished with value: 0.023356633377211153 and parameters: {'model_type': 'gcn', 'hidden_dims': '[512, 128]', 'dropout': 0.18555280723041312, 'batch_norm': True, 'lr': 0.00016025754674521862, 'weight_decay': 0.0007106516297943961, 'epochs': 66, 'loss': 'mse', 'optimizer': 'adam', 'graph_mode': 'cutoff', 'cutoff': 0.7412011141426381, 'grm_norm': 'none', 'self_loops': True, 'use_snp_selection': False}. Best is trial 71 with value: 0.06901665353648391.
[I 2025-11-03 12:57:42,727] Trial 146 finished with value: 0.03926419543049345 and parameters: {'model_type': 'gcn', 'hidden_dims': '[128, 64]', 'dropout': 0.13250292549402648, 'batch_norm': True, 'lr': 1.2108006256034936e-05, 'weight_decay': 1.2651137154387727e-05, 'epochs': 36, 'loss': 'mse', 'optimizer': 'adam', 'graph_mode': 'cutoff', 'cutoff': 0.8246555008131603, 'grm_norm': 'cosine_then_gcn', 'self_loops': True, 'use_snp_selection': False}. Best is trial 71 with value: 0.06901665353648391.
[I 2025-11-03 12:57:43,833] Trial 147 finished with value: 0.018951293838190716 and parameters: {'model_type': 'gcn', 'hidden_dims': '[128, 64]', 'dropout': 0.28428027154387886, 'batch_norm': True, 'lr': 0.00011506511724747429, 'weight_decay': 2.1936034739338223e-07, 'epochs': 21, 'loss': 'mse', 'optimizer': 'adam', 'graph_mode': 'cutoff', 'cutoff': 0.6640170375984293, 'grm_norm': 'gcn', 'self_loops': False, 'use_snp_selection': False}. Best is trial 71 with value: 0.06901665353648391.
[I 2025-11-03 12:57:44,885] Trial 148 finished with value: 0.00896950768220946 and parameters: {'model_type': 'gcn', 'hidden_dims': '[128, 64]', 'dropout': 0.20817322363772034, 'batch_norm': True, 'lr': 4.048082575746984e-05, 'weight_decay': 3.839243503665948e-05, 'epochs': 12, 'loss': 'mse', 'optimizer': 'adam', 'graph_mode': 'cutoff', 'cutoff': 0.7621504744924302, 'grm_norm': 'none', 'self_loops': True, 'use_snp_selection': False}. Best is trial 71 with value: 0.06901665353648391.
[I 2025-11-03 12:57:46,630] Trial 149 finished with value: 0.07300682134326374 and parameters: {'model_type': 'gcn', 'hidden_dims': '[512, 128]', 'dropout': 0.1931718494549922, 'batch_norm': True, 'lr': 1.547204335633941e-05, 'weight_decay': 3.5549520688642533e-07, 'epochs': 59, 'loss': 'mse', 'optimizer': 'adam', 'graph_mode': 'cutoff', 'cutoff': 0.717182613317255, 'grm_norm': 'cosine', 'self_loops': True, 'use_snp_selection': False}. Best is trial 149 with value: 0.07300682134326374.
[I 2025-11-03 12:57:48,695] Trial 0 finished with value: 0.01228623827942233 and parameters: {'model_type': 'gcn', 'hidden_dims': '[128, 64]', 'dropout': 0.199031432379812, 'batch_norm': True, 'lr': 1.8408544111075837e-06, 'weight_decay': 5.5136510071208614e-05, 'epochs': 334, 'loss': 'mae', 'optimizer': 'adam', 'graph_mode': 'knn', 'source': 'grm', 'knn_k': 8, 'weighted_edges': True, 'symmetrize_mode': 'mutual', 'use_snp_selection': False}. Best is trial 0 with value: 0.01228623827942233.
[I 2025-11-03 12:57:49,846] Trial 1 finished with value: 0.007445669441956717 and parameters: {'model_type': 'gcn', 'hidden_dims': '[128, 64]', 'dropout': 0.40051947670227217, 'batch_norm': True, 'lr': 0.0005320428882732732, 'weight_decay': 1.89210117736594e-06, 'epochs': 32, 'loss': 'mse', 'optimizer': 'adam', 'graph_mode': 'knn', 'source': 'grm', 'knn_k': 7, 'weighted_edges': True, 'symmetrize_mode': 'union', 'use_snp_selection': False}. Best is trial 0 with value: 0.01228623827942233.
[I 2025-11-03 12:57:52,069] Trial 2 finished with value: -0.0011730991422643873 and parameters: {'model_type': 'gcn', 'hidden_dims': '[256, 128]', 'dropout': 0.5105528289184642, 'batch_norm': False, 'lr': 0.0006804279372404962, 'weight_decay': 0.0008922815224257085, 'epochs': 160, 'loss': 'mse', 'optimizer': 'adam', 'graph_mode': 'cutoff', 'cutoff': 0.5741905641612706, 'grm_norm': 'gcn', 'self_loops': False, 'use_snp_selection': True, 'num_snps': 26910}. Best is trial 0 with value: 0.01228623827942233.
[I 2025-11-03 12:57:54,397] Trial 3 finished with value: 0.0016229574699655007 and parameters: {'model_type': 'gcn', 'hidden_dims': '[256, 128, 64]', 'dropout': 0.5390483213624292, 'batch_norm': False, 'lr': 3.4705625989073525e-05, 'weight_decay': 2.4623319020131338e-05, 'epochs': 92, 'loss': 'mse', 'optimizer': 'adam', 'graph_mode': 'knn', 'source': 'grm', 'knn_k': 6, 'weighted_edges': False, 'symmetrize_mode': 'mutual', 'use_snp_selection': True, 'num_snps': 30713}. Best is trial 0 with value: 0.01228623827942233.
[I 2025-11-03 12:57:56,747] Trial 4 finished with value: -0.007330892469407534 and parameters: {'model_type': 'gcn', 'hidden_dims': '[128, 64]', 'dropout': 0.13404863676897502, 'batch_norm': False, 'lr': 0.0001431556295367288, 'weight_decay': 2.2084517750726675e-05, 'epochs': 13, 'loss': 'mae', 'optimizer': 'adam', 'graph_mode': 'cutoff', 'cutoff': 0.6714268476993044, 'grm_norm': 'none', 'self_loops': False, 'use_snp_selection': True, 'num_snps': 45645}. Best is trial 0 with value: 0.01228623827942233.
[I 2025-11-03 12:57:59,586] Trial 5 finished with value: 0.009379241387375989 and parameters: {'model_type': 'gcn', 'hidden_dims': '[256, 128]', 'dropout': 0.42253606323412096, 'batch_norm': False, 'lr': 4.238630400638805e-05, 'weight_decay': 8.074086040046576e-07, 'epochs': 134, 'loss': 'mae', 'optimizer': 'adam', 'graph_mode': 'knn', 'source': 'grm', 'knn_k': 1, 'weighted_edges': False, 'symmetrize_mode': 'mutual', 'use_snp_selection': True, 'num_snps': 43113}. Best is trial 0 with value: 0.01228623827942233.
[I 2025-11-03 12:58:02,194] Trial 6 finished with value: 0.02390738972519924 and parameters: {'model_type': 'gcn', 'hidden_dims': '[512, 256]', 'dropout': 0.3534893146320237, 'batch_norm': True, 'lr': 0.000251307964226932, 'weight_decay': 1.821819791794022e-05, 'epochs': 207, 'loss': 'mae', 'optimizer': 'adam', 'graph_mode': 'knn', 'source': 'grm', 'knn_k': 1, 'weighted_edges': True, 'symmetrize_mode': 'mutual', 'use_snp_selection': False}. Best is trial 6 with value: 0.02390738972519924.
[I 2025-11-03 12:58:04,492] Trial 7 finished with value: 0.041112876834094224 and parameters: {'model_type': 'gcn', 'hidden_dims': '[512, 256]', 'dropout': 0.1105825955860775, 'batch_norm': True, 'lr': 2.374338412754043e-05, 'weight_decay': 1.1284721123340274e-05, 'epochs': 170, 'loss': 'mse', 'optimizer': 'adam', 'graph_mode': 'cutoff', 'cutoff': 0.719872204109604, 'grm_norm': 'gcn', 'self_loops': False, 'use_snp_selection': False}. Best is trial 7 with value: 0.041112876834094224.
[I 2025-11-03 12:58:06,319] Trial 8 finished with value: 0.05474269930920262 and parameters: {'model_type': 'gcn', 'hidden_dims': '[512, 128]', 'dropout': 0.5066580418354021, 'batch_norm': True, 'lr': 0.00039213678276659976, 'weight_decay': 3.43655320802934e-06, 'epochs': 91, 'loss': 'mse', 'optimizer': 'adam', 'graph_mode': 'cutoff', 'cutoff': 0.34923059576505366, 'grm_norm': 'cosine', 'self_loops': True, 'use_snp_selection': False}. Best is trial 8 with value: 0.05474269930920262.
[I 2025-11-03 12:58:07,998] Trial 9 finished with value: 0.010012741137465664 and parameters: {'model_type': 'gcn', 'hidden_dims': '[512, 256]', 'dropout': 0.301734920240333, 'batch_norm': False, 'lr': 6.650961854953448e-06, 'weight_decay': 6.861575656590315e-05, 'epochs': 125, 'loss': 'mae', 'optimizer': 'adam', 'graph_mode': 'cutoff', 'cutoff': 0.2857569870061939, 'grm_norm': 'cosine_then_gcn', 'self_loops': False, 'use_snp_selection': True, 'num_snps': 12722}. Best is trial 8 with value: 0.05474269930920262.
[I 2025-11-03 12:58:10,771] Trial 10 finished with value: 0.06851731265986186 and parameters: {'model_type': 'gcn', 'hidden_dims': '[512, 128]', 'dropout': 0.5885461262002587, 'batch_norm': True, 'lr': 0.00010512303397748249, 'weight_decay': 1.3387352389235743e-07, 'epochs': 246, 'loss': 'mse', 'optimizer': 'adam', 'graph_mode': 'cutoff', 'cutoff': 0.26841964921208644, 'grm_norm': 'cosine', 'self_loops': True, 'use_snp_selection': False}. Best is trial 10 with value: 0.06851731265986186.
[I 2025-11-03 12:58:13,661] Trial 11 finished with value: 0.04930413140595986 and parameters: {'model_type': 'gcn', 'hidden_dims': '[512, 128]', 'dropout': 0.5890754684622632, 'batch_norm': True, 'lr': 0.00012623783700890367, 'weight_decay': 1.508061538813527e-07, 'epochs': 265, 'loss': 'mse', 'optimizer': 'adam', 'graph_mode': 'cutoff', 'cutoff': 0.24497725304786427, 'grm_norm': 'cosine', 'self_loops': True, 'use_snp_selection': False}. Best is trial 10 with value: 0.06851731265986186.
[I 2025-11-03 12:58:16,438] Trial 12 finished with value: 0.02496395541518272 and parameters: {'model_type': 'gcn', 'hidden_dims': '[512, 128]', 'dropout': 0.48657806717860913, 'batch_norm': True, 'lr': 8.196071574687757e-05, 'weight_decay': 1.0694400602640794e-07, 'epochs': 246, 'loss': 'mse', 'optimizer': 'adam', 'graph_mode': 'cutoff', 'cutoff': 0.3951864557300021, 'grm_norm': 'cosine', 'self_loops': True, 'use_snp_selection': False}. Best is trial 10 with value: 0.06851731265986186.
[I 2025-11-03 12:58:19,646] Trial 13 finished with value: 0.041276800751797016 and parameters: {'model_type': 'gcn', 'hidden_dims': '[512, 64]', 'dropout': 0.5967498725775604, 'batch_norm': True, 'lr': 0.0009837066213935635, 'weight_decay': 1.5710469218501838e-06, 'epochs': 318, 'loss': 'mse', 'optimizer': 'adam', 'graph_mode': 'cutoff', 'cutoff': 0.4034781585441799, 'grm_norm': 'cosine', 'self_loops': True, 'use_snp_selection': False}. Best is trial 10 with value: 0.06851731265986186.
[I 2025-11-03 12:58:21,346] Trial 14 finished with value: 0.05375800318657107 and parameters: {'model_type': 'gcn', 'hidden_dims': '[512, 128]', 'dropout': 0.46331204072013044, 'batch_norm': True, 'lr': 0.000318369131994595, 'weight_decay': 5.047506669423763e-07, 'epochs': 66, 'loss': 'mse', 'optimizer': 'adam', 'graph_mode': 'cutoff', 'cutoff': 0.41885087293307366, 'grm_norm': 'cosine', 'self_loops': True, 'use_snp_selection': False}. Best is trial 10 with value: 0.06851731265986186.
[I 2025-11-03 12:58:23,989] Trial 15 finished with value: -0.003477493419810134 and parameters: {'model_type': 'gcn', 'hidden_dims': '[512, 128]', 'dropout': 0.5556886357208262, 'batch_norm': True, 'lr': 1.2566698097454751e-05, 'weight_decay': 3.7705270626652646e-06, 'epochs': 223, 'loss': 'mse', 'optimizer': 'adam', 'graph_mode': 'cutoff', 'cutoff': 0.24559053421123542, 'grm_norm': 'cosine', 'self_loops': True, 'use_snp_selection': False}. Best is trial 10 with value: 0.06851731265986186.
[I 2025-11-03 12:58:27,040] Trial 16 finished with value: 0.04163218486392104 and parameters: {'model_type': 'gcn', 'hidden_dims': '[512, 128]', 'dropout': 0.2726150356380067, 'batch_norm': True, 'lr': 0.0002564590487494194, 'weight_decay': 3.056734616307358e-07, 'epochs': 295, 'loss': 'mse', 'optimizer': 'adam', 'graph_mode': 'cutoff', 'cutoff': 0.5306559631517289, 'grm_norm': 'none', 'self_loops': True, 'use_snp_selection': False}. Best is trial 10 with value: 0.06851731265986186.
[I 2025-11-03 12:58:28,604] Trial 17 finished with value: 0.04356195893338612 and parameters: {'model_type': 'gcn', 'hidden_dims': '[256, 128, 64]', 'dropout': 0.4337768631587977, 'batch_norm': True, 'lr': 6.064683608957369e-05, 'weight_decay': 0.00037061972162637203, 'epochs': 85, 'loss': 'mse', 'optimizer': 'adam', 'graph_mode': 'cutoff', 'cutoff': 0.34267444791405843, 'grm_norm': 'cosine_then_gcn', 'self_loops': True, 'use_snp_selection': False}. Best is trial 10 with value: 0.06851731265986186.
[I 2025-11-03 12:58:31,121] Trial 18 finished with value: -0.0013522351502211266 and parameters: {'model_type': 'gcn', 'hidden_dims': '[512, 64]', 'dropout': 0.517960646566452, 'batch_norm': True, 'lr': 3.2431520417433524e-06, 'weight_decay': 4.050507030272307e-06, 'epochs': 204, 'loss': 'mse', 'optimizer': 'adam', 'graph_mode': 'cutoff', 'cutoff': 0.8809443877091867, 'grm_norm': 'cosine', 'self_loops': True, 'use_snp_selection': False}. Best is trial 10 with value: 0.06851731265986186.
[I 2025-11-03 12:58:33,189] Trial 19 finished with value: 0.03807751905146639 and parameters: {'model_type': 'gcn', 'hidden_dims': '[512, 128]', 'dropout': 0.560479900034549, 'batch_norm': True, 'lr': 0.00010470823344866871, 'weight_decay': 2.4644390399106306e-07, 'epochs': 124, 'loss': 'mse', 'optimizer': 'adam', 'graph_mode': 'cutoff', 'cutoff': 0.2104909088252689, 'grm_norm': 'cosine', 'self_loops': True, 'use_snp_selection': False}. Best is trial 10 with value: 0.06851731265986186.
[I 2025-11-03 12:58:36,213] Trial 20 finished with value: 0.0415347033929172 and parameters: {'model_type': 'gcn', 'hidden_dims': '[512, 128]', 'dropout': 0.3589734382138713, 'batch_norm': True, 'lr': 0.00040094003381886163, 'weight_decay': 4.303705038788151e-06, 'epochs': 287, 'loss': 'mse', 'optimizer': 'adam', 'graph_mode': 'cutoff', 'cutoff': 0.4775623436621876, 'grm_norm': 'cosine', 'self_loops': True, 'use_snp_selection': False}. Best is trial 10 with value: 0.06851731265986186.
[I 2025-11-03 12:58:37,861] Trial 21 finished with value: 0.03347930276241935 and parameters: {'model_type': 'gcn', 'hidden_dims': '[512, 128]', 'dropout': 0.47231055671098787, 'batch_norm': True, 'lr': 0.0002455747487169859, 'weight_decay': 5.702501483591905e-07, 'epochs': 58, 'loss': 'mse', 'optimizer': 'adam', 'graph_mode': 'cutoff', 'cutoff': 0.3645544814604488, 'grm_norm': 'cosine', 'self_loops': True, 'use_snp_selection': False}. Best is trial 10 with value: 0.06851731265986186.
