[I 2025-11-03 13:00:12,102] Trial 74 finished with value: -0.021751070445593188 and parameters: {'model_type': 'gcn', 'hidden_dims': '[512, 128]', 'dropout': 0.558777522563456, 'batch_norm': False, 'lr': 0.0002156363509078747, 'weight_decay': 0.0005235434657436893, 'epochs': 78, 'loss': 'mae', 'optimizer': 'adam', 'graph_mode': 'off', 'use_snp_selection': False}. Best is trial 16 with value: 0.050243356640524144.
[I 2025-11-03 13:00:13,399] Trial 75 finished with value: -0.004003779644392299 and parameters: {'model_type': 'gcn', 'hidden_dims': '[512, 128]', 'dropout': 0.46851047665029955, 'batch_norm': False, 'lr': 3.4368043409758115e-05, 'weight_decay': 0.0002477600338796294, 'epochs': 95, 'loss': 'mae', 'optimizer': 'adam', 'graph_mode': 'off', 'use_snp_selection': False}. Best is trial 16 with value: 0.050243356640524144.
[I 2025-11-03 13:00:14,411] Trial 76 finished with value: 0.005548072987815584 and parameters: {'model_type': 'gcn', 'hidden_dims': '[512, 128]', 'dropout': 0.4476589646164016, 'batch_norm': False, 'lr': 0.0003784685668161133, 'weight_decay': 5.183735182059618e-06, 'epochs': 40, 'loss': 'mae', 'optimizer': 'adam', 'graph_mode': 'off', 'use_snp_selection': False}. Best is trial 16 with value: 0.050243356640524144.
[I 2025-11-03 13:00:15,867] Trial 77 finished with value: 0.023068819644852183 and parameters: {'model_type': 'gcn', 'hidden_dims': '[512, 128]', 'dropout': 0.33797815799987996, 'batch_norm': False, 'lr': 0.0005173587374952335, 'weight_decay': 3.981172785200946e-06, 'epochs': 124, 'loss': 'mae', 'optimizer': 'adam', 'graph_mode': 'off', 'use_snp_selection': False}. Best is trial 16 with value: 0.050243356640524144.
[I 2025-11-03 13:00:17,096] Trial 78 finished with value: -0.00921807162229588 and parameters: {'model_type': 'gcn', 'hidden_dims': '[512, 256]', 'dropout': 0.5723623561168152, 'batch_norm': False, 'lr': 7.112881469641473e-05, 'weight_decay': 0.0002799566939920982, 'epochs': 84, 'loss': 'mse', 'optimizer': 'adam', 'graph_mode': 'off', 'use_snp_selection': False}. Best is trial 16 with value: 0.050243356640524144.
[I 2025-11-03 13:00:18,561] Trial 79 finished with value: -0.004077915660531792 and parameters: {'model_type': 'gcn', 'hidden_dims': '[512, 128]', 'dropout': 0.5053376561068069, 'batch_norm': False, 'lr': 0.0007063891833710565, 'weight_decay': 1.0116962000269902e-06, 'epochs': 132, 'loss': 'mae', 'optimizer': 'adam', 'graph_mode': 'off', 'use_snp_selection': False}. Best is trial 16 with value: 0.050243356640524144.
[I 2025-11-03 13:00:19,690] Trial 80 finished with value: 0.018159989830103206 and parameters: {'model_type': 'gcn', 'hidden_dims': '[512, 64]', 'dropout': 0.47836463185755895, 'batch_norm': False, 'lr': 3.5870023903826146e-06, 'weight_decay': 0.00041767678020231976, 'epochs': 61, 'loss': 'mae', 'optimizer': 'adam', 'graph_mode': 'off', 'use_snp_selection': False}. Best is trial 16 with value: 0.050243356640524144.
[I 2025-11-03 13:00:20,754] Trial 81 finished with value: 0.029078978516863738 and parameters: {'model_type': 'gcn', 'hidden_dims': '[256, 128, 64]', 'dropout': 0.5380641396302346, 'batch_norm': False, 'lr': 0.00017831274851373021, 'weight_decay': 0.00014891017306608106, 'epochs': 109, 'loss': 'mae', 'optimizer': 'adam', 'graph_mode': 'off', 'use_snp_selection': False}. Best is trial 16 with value: 0.050243356640524144.
[I 2025-11-03 13:00:21,835] Trial 82 finished with value: -0.01087676257896743 and parameters: {'model_type': 'gcn', 'hidden_dims': '[256, 128, 64]', 'dropout': 0.5434152213942717, 'batch_norm': False, 'lr': 0.00016646156727454086, 'weight_decay': 0.0001743025750777349, 'epochs': 112, 'loss': 'mae', 'optimizer': 'adam', 'graph_mode': 'off', 'use_snp_selection': False}. Best is trial 16 with value: 0.050243356640524144.
[I 2025-11-03 13:00:22,970] Trial 83 finished with value: -0.004412700794830859 and parameters: {'model_type': 'gcn', 'hidden_dims': '[256, 128, 64]', 'dropout': 0.5297360615240359, 'batch_norm': False, 'lr': 0.000328986610485628, 'weight_decay': 0.00015056702000044165, 'epochs': 127, 'loss': 'mae', 'optimizer': 'adam', 'graph_mode': 'off', 'use_snp_selection': False}. Best is trial 16 with value: 0.050243356640524144.
[I 2025-11-03 13:00:23,885] Trial 84 finished with value: -0.007095943763655462 and parameters: {'model_type': 'gcn', 'hidden_dims': '[256, 128]', 'dropout': 0.5221543633309552, 'batch_norm': False, 'lr': 0.0002083705461489273, 'weight_decay': 0.00011492955053171982, 'epochs': 89, 'loss': 'mae', 'optimizer': 'adam', 'graph_mode': 'off', 'use_snp_selection': False}. Best is trial 16 with value: 0.050243356640524144.
[I 2025-11-03 13:00:24,942] Trial 85 finished with value: -0.028698442209422255 and parameters: {'model_type': 'gcn', 'hidden_dims': '[256, 128, 64]', 'dropout': 0.578559937592191, 'batch_norm': False, 'lr': 0.0001093412935725127, 'weight_decay': 0.0006912448398699229, 'epochs': 100, 'loss': 'mae', 'optimizer': 'adam', 'graph_mode': 'off', 'use_snp_selection': False}. Best is trial 16 with value: 0.050243356640524144.
[I 2025-11-03 13:00:25,559] Trial 86 finished with value: 0.017601277383445912 and parameters: {'model_type': 'gcn', 'hidden_dims': '[128, 64]', 'dropout': 0.5636869276956724, 'batch_norm': False, 'lr': 0.00014038583926278894, 'weight_decay': 0.0002618076271653056, 'epochs': 50, 'loss': 'mae', 'optimizer': 'adam', 'graph_mode': 'off', 'use_snp_selection': False}. Best is trial 16 with value: 0.050243356640524144.
[I 2025-11-03 13:00:26,925] Trial 87 finished with value: -0.0016364453324022189 and parameters: {'model_type': 'gcn', 'hidden_dims': '[512, 128]', 'dropout': 0.38215653455817716, 'batch_norm': False, 'lr': 2.2989093914599723e-05, 'weight_decay': 2.2367225092960206e-06, 'epochs': 111, 'loss': 'mae', 'optimizer': 'adam', 'graph_mode': 'off', 'use_snp_selection': False}. Best is trial 16 with value: 0.050243356640524144.
[I 2025-11-03 13:00:28,122] Trial 88 finished with value: 0.014571032380017402 and parameters: {'model_type': 'gcn', 'hidden_dims': '[512, 64]', 'dropout': 0.4166295766937932, 'batch_norm': True, 'lr': 5.3676244606038873e-05, 'weight_decay': 7.619927213224079e-06, 'epochs': 73, 'loss': 'mae', 'optimizer': 'adam', 'graph_mode': 'off', 'use_snp_selection': False}. Best is trial 16 with value: 0.050243356640524144.
[I 2025-11-03 13:00:29,154] Trial 89 finished with value: 0.005582487737740804 and parameters: {'model_type': 'gcn', 'hidden_dims': '[256, 128, 64]', 'dropout': 0.5872980043582767, 'batch_norm': False, 'lr': 8.671640672532695e-05, 'weight_decay': 7.870460370281658e-05, 'epochs': 99, 'loss': 'mae', 'optimizer': 'adam', 'graph_mode': 'off', 'use_snp_selection': False}. Best is trial 16 with value: 0.050243356640524144.
[I 2025-11-03 13:00:30,253] Trial 90 finished with value: -0.006278551204563217 and parameters: {'model_type': 'gcn', 'hidden_dims': '[256, 128]', 'dropout': 0.5090234195284588, 'batch_norm': False, 'lr': 0.00024616689532805077, 'weight_decay': 1.252004199561062e-06, 'epochs': 141, 'loss': 'mse', 'optimizer': 'adam', 'graph_mode': 'off', 'use_snp_selection': False}. Best is trial 16 with value: 0.050243356640524144.
[I 2025-11-03 13:00:32,275] Trial 91 finished with value: -0.00931236602630023 and parameters: {'model_type': 'gcn', 'hidden_dims': '[256, 128, 64]', 'dropout': 0.55538597742059, 'batch_norm': False, 'lr': 0.00018032963973866275, 'weight_decay': 4.9158733479089076e-05, 'epochs': 227, 'loss': 'mae', 'optimizer': 'adam', 'graph_mode': 'off', 'use_snp_selection': True, 'num_snps': 40063}. Best is trial 16 with value: 0.050243356640524144.
[I 2025-11-03 13:00:34,503] Trial 92 finished with value: -0.0033168254225819835 and parameters: {'model_type': 'gcn', 'hidden_dims': '[256, 128, 64]', 'dropout': 0.5411762192093794, 'batch_norm': False, 'lr': 0.00013630522241749542, 'weight_decay': 3.3682460302328826e-05, 'epochs': 205, 'loss': 'mae', 'optimizer': 'adam', 'graph_mode': 'off', 'use_snp_selection': True, 'num_snps': 51263}. Best is trial 16 with value: 0.050243356640524144.
[I 2025-11-03 13:00:36,106] Trial 93 finished with value: -0.014446342745184058 and parameters: {'model_type': 'gcn', 'hidden_dims': '[256, 128, 64]', 'dropout': 0.4933547157126785, 'batch_norm': False, 'lr': 0.00028233740406458904, 'weight_decay': 0.00013821470532881386, 'epochs': 165, 'loss': 'mae', 'optimizer': 'adam', 'graph_mode': 'off', 'use_snp_selection': True, 'num_snps': 31287}. Best is trial 16 with value: 0.050243356640524144.
[I 2025-11-03 13:00:37,027] Trial 94 finished with value: 0.04000824827416663 and parameters: {'model_type': 'gcn', 'hidden_dims': '[256, 128, 64]', 'dropout': 0.4647455077066761, 'batch_norm': False, 'lr': 4.065780504440048e-05, 'weight_decay': 0.00020499863236317316, 'epochs': 65, 'loss': 'mae', 'optimizer': 'adam', 'graph_mode': 'off', 'use_snp_selection': False}. Best is trial 16 with value: 0.050243356640524144.
[I 2025-11-03 13:00:37,925] Trial 95 finished with value: 0.006618427516384566 and parameters: {'model_type': 'gcn', 'hidden_dims': '[256, 128, 64]', 'dropout': 0.4645364308668083, 'batch_norm': False, 'lr': 3.035048756301115e-05, 'weight_decay': 0.00019126270855262867, 'epochs': 64, 'loss': 'mae', 'optimizer': 'adam', 'graph_mode': 'off', 'use_snp_selection': False}. Best is trial 16 with value: 0.050243356640524144.
[I 2025-11-03 13:00:38,977] Trial 96 finished with value: 0.026368920905160218 and parameters: {'model_type': 'gcn', 'hidden_dims': '[512, 256]', 'dropout': 0.48385521736081877, 'batch_norm': False, 'lr': 1.729835142771431e-05, 'weight_decay': 0.00042694119545374235, 'epochs': 58, 'loss': 'mae', 'optimizer': 'adam', 'graph_mode': 'off', 'use_snp_selection': False}. Best is trial 16 with value: 0.050243356640524144.
[I 2025-11-03 13:00:40,183] Trial 97 finished with value: -0.016018049528708125 and parameters: {'model_type': 'gcn', 'hidden_dims': '[512, 64]', 'dropout': 0.4380393165106293, 'batch_norm': False, 'lr': 3.867405743464005e-05, 'weight_decay': 0.00022723780643566725, 'epochs': 79, 'loss': 'mae', 'optimizer': 'adam', 'graph_mode': 'off', 'use_snp_selection': False}. Best is trial 16 with value: 0.050243356640524144.
[I 2025-11-03 13:00:41,320] Trial 98 finished with value: 0.01018050755831728 and parameters: {'model_type': 'gcn', 'hidden_dims': '[256, 128, 64]', 'dropout': 0.4539336069908089, 'batch_norm': False, 'lr': 2.5509414221411016e-05, 'weight_decay': 0.0003020570834851983, 'epochs': 118, 'loss': 'mae', 'optimizer': 'adam', 'graph_mode': 'off', 'use_snp_selection': False}. Best is trial 16 with value: 0.050243356640524144.
[I 2025-11-03 13:00:42,584] Trial 99 finished with value: -0.01644657823722381 and parameters: {'model_type': 'gcn', 'hidden_dims': '[512, 128]', 'dropout': 0.47305034923168904, 'batch_norm': True, 'lr': 4.6778179024608375e-05, 'weight_decay': 9.72579918140473e-05, 'epochs': 88, 'loss': 'mae', 'optimizer': 'adam', 'graph_mode': 'off', 'use_snp_selection': False}. Best is trial 16 with value: 0.050243356640524144.
[I 2025-11-03 13:00:43,382] Trial 100 finished with value: 0.04658358779076488 and parameters: {'model_type': 'gcn', 'hidden_dims': '[256, 128, 64]', 'dropout': 0.523538570245584, 'batch_norm': False, 'lr': 0.00010690649657714237, 'weight_decay': 1.7235808603779976e-05, 'epochs': 48, 'loss': 'mae', 'optimizer': 'adam', 'graph_mode': 'off', 'use_snp_selection': False}. Best is trial 16 with value: 0.050243356640524144.
[I 2025-11-03 13:00:44,213] Trial 101 finished with value: -0.0034889425632710696 and parameters: {'model_type': 'gcn', 'hidden_dims': '[256, 128, 64]', 'dropout': 0.5037990530400156, 'batch_norm': False, 'lr': 0.00011433653648539141, 'weight_decay': 1.7110192435385102e-05, 'epochs': 54, 'loss': 'mae', 'optimizer': 'adam', 'graph_mode': 'off', 'use_snp_selection': False}. Best is trial 16 with value: 0.050243356640524144.
[I 2025-11-03 13:00:45,097] Trial 102 finished with value: 0.007851229406154901 and parameters: {'model_type': 'gcn', 'hidden_dims': '[256, 128, 64]', 'dropout': 0.10989189687296735, 'batch_norm': False, 'lr': 9.771961494276705e-05, 'weight_decay': 6.2270601947084875e-06, 'epochs': 67, 'loss': 'mae', 'optimizer': 'adam', 'graph_mode': 'off', 'use_snp_selection': False}. Best is trial 16 with value: 0.050243356640524144.
[I 2025-11-03 13:00:45,881] Trial 103 finished with value: -0.011288783202438125 and parameters: {'model_type': 'gcn', 'hidden_dims': '[256, 128, 64]', 'dropout': 0.5220065428503504, 'batch_norm': False, 'lr': 7.809889875233579e-05, 'weight_decay': 1.3622860793022388e-05, 'epochs': 43, 'loss': 'mae', 'optimizer': 'adam', 'graph_mode': 'off', 'use_snp_selection': False}. Best is trial 16 with value: 0.050243356640524144.
[I 2025-11-03 13:00:46,680] Trial 104 finished with value: -0.007445733304088639 and parameters: {'model_type': 'gcn', 'hidden_dims': '[256, 128, 64]', 'dropout': 0.49223960564159547, 'batch_norm': False, 'lr': 0.00022388378726765718, 'weight_decay': 3.6121112672000755e-06, 'epochs': 48, 'loss': 'mae', 'optimizer': 'adam', 'graph_mode': 'off', 'use_snp_selection': False}. Best is trial 16 with value: 0.050243356640524144.
[I 2025-11-03 13:00:47,612] Trial 105 finished with value: -0.04029741852121624 and parameters: {'model_type': 'gcn', 'hidden_dims': '[256, 128, 64]', 'dropout': 0.598759860613204, 'batch_norm': False, 'lr': 0.00014677034118456043, 'weight_decay': 8.67990701422743e-06, 'epochs': 78, 'loss': 'mae', 'optimizer': 'adam', 'graph_mode': 'off', 'use_snp_selection': False}. Best is trial 16 with value: 0.050243356640524144.
[I 2025-11-03 13:00:48,789] Trial 106 finished with value: -0.011074982447466242 and parameters: {'model_type': 'gcn', 'hidden_dims': '[512, 64]', 'dropout': 0.5371035892463114, 'batch_norm': False, 'lr': 6.138526748004324e-05, 'weight_decay': 2.233751413214647e-05, 'epochs': 71, 'loss': 'mae', 'optimizer': 'adam', 'graph_mode': 'off', 'use_snp_selection': False}. Best is trial 16 with value: 0.050243356640524144.
[I 2025-11-03 13:00:49,575] Trial 107 finished with value: -0.02358366038539954 and parameters: {'model_type': 'gcn', 'hidden_dims': '[256, 128]', 'dropout': 0.5505051262023095, 'batch_norm': False, 'lr': 0.00017980114471611062, 'weight_decay': 1.0595514208786226e-05, 'epochs': 58, 'loss': 'mae', 'optimizer': 'adam', 'graph_mode': 'off', 'use_snp_selection': False}. Best is trial 16 with value: 0.050243356640524144.
[I 2025-11-03 13:00:50,572] Trial 108 finished with value: 0.012496879101086546 and parameters: {'model_type': 'gcn', 'hidden_dims': '[256, 128, 64]', 'dropout': 0.5091746721266951, 'batch_norm': False, 'lr': 0.00044235782151375643, 'weight_decay': 4.706254447031391e-06, 'epochs': 92, 'loss': 'mae', 'optimizer': 'adam', 'graph_mode': 'off', 'use_snp_selection': False}. Best is trial 16 with value: 0.050243356640524144.
[I 2025-11-03 13:00:52,149] Trial 109 finished with value: 0.025163003977480065 and parameters: {'model_type': 'gcn', 'hidden_dims': '[512, 128]', 'dropout': 0.4245637718214879, 'batch_norm': False, 'lr': 1.020668267491768e-05, 'weight_decay': 2.5815814114051134e-06, 'epochs': 151, 'loss': 'mse', 'optimizer': 'adam', 'graph_mode': 'off', 'use_snp_selection': False}. Best is trial 16 with value: 0.050243356640524144.
[I 2025-11-03 13:00:52,938] Trial 110 finished with value: 0.011165881297633247 and parameters: {'model_type': 'gcn', 'hidden_dims': '[128, 64]', 'dropout': 0.2906647220687021, 'batch_norm': False, 'lr': 0.0003647809667802003, 'weight_decay': 7.728656243858195e-05, 'epochs': 107, 'loss': 'mae', 'optimizer': 'adam', 'graph_mode': 'off', 'use_snp_selection': False}. Best is trial 16 with value: 0.050243356640524144.
[I 2025-11-03 13:00:54,151] Trial 111 finished with value: 0.02570035466784996 and parameters: {'model_type': 'gcn', 'hidden_dims': '[256, 128, 64]', 'dropout': 0.5237728518756533, 'batch_norm': False, 'lr': 0.00024812436848241067, 'weight_decay': 0.00013431735390515552, 'epochs': 243, 'loss': 'mae', 'optimizer': 'adam', 'graph_mode': 'off', 'use_snp_selection': True, 'num_snps': 3022}. Best is trial 16 with value: 0.050243356640524144.
[I 2025-11-03 13:00:56,091] Trial 112 finished with value: -0.00939928997546056 and parameters: {'model_type': 'gcn', 'hidden_dims': '[256, 128, 64]', 'dropout': 0.5339463151519586, 'batch_norm': False, 'lr': 0.00012536323551776572, 'weight_decay': 1.2149766000857582e-07, 'epochs': 337, 'loss': 'mae', 'optimizer': 'adam', 'graph_mode': 'off', 'use_snp_selection': True, 'num_snps': 23246}. Best is trial 16 with value: 0.050243356640524144.
[I 2025-11-03 13:00:57,423] Trial 113 finished with value: 0.009554259314757873 and parameters: {'model_type': 'gcn', 'hidden_dims': '[256, 128, 64]', 'dropout': 0.564416038406282, 'batch_norm': False, 'lr': 0.00015912234843988072, 'weight_decay': 6.81180039267709e-05, 'epochs': 82, 'loss': 'mae', 'optimizer': 'adam', 'graph_mode': 'off', 'use_snp_selection': True, 'num_snps': 29146}. Best is trial 16 with value: 0.050243356640524144.
[I 2025-11-03 13:00:58,335] Trial 114 finished with value: -0.012136789200247211 and parameters: {'model_type': 'gcn', 'hidden_dims': '[256, 128, 64]', 'dropout': 0.4773490509355455, 'batch_norm': False, 'lr': 0.00010480033999914411, 'weight_decay': 4.63127406077744e-05, 'epochs': 46, 'loss': 'mae', 'optimizer': 'adam', 'graph_mode': 'off', 'use_snp_selection': False}. Best is trial 16 with value: 0.050243356640524144.
[I 2025-11-03 13:01:00,135] Trial 115 finished with value: 0.003037833447816795 and parameters: {'model_type': 'gcn', 'hidden_dims': '[512, 64]', 'dropout': 0.49037972070285757, 'batch_norm': False, 'lr': 0.0001905736091167855, 'weight_decay': 0.00010356519670756067, 'epochs': 184, 'loss': 'mae', 'optimizer': 'adam', 'graph_mode': 'off', 'use_snp_selection': False}. Best is trial 16 with value: 0.050243356640524144.
[I 2025-11-03 13:01:02,426] Trial 116 finished with value: -0.011899703589000494 and parameters: {'model_type': 'gcn', 'hidden_dims': '[256, 128, 64]', 'dropout': 0.5860397075330663, 'batch_norm': False, 'lr': 7.982249636200779e-05, 'weight_decay': 0.00015648543862155313, 'epochs': 274, 'loss': 'mae', 'optimizer': 'adam', 'graph_mode': 'off', 'use_snp_selection': True, 'num_snps': 44838}. Best is trial 16 with value: 0.050243356640524144.
[I 2025-11-03 13:01:04,976] Trial 117 finished with value: -0.0085182436217565 and parameters: {'model_type': 'gcn', 'hidden_dims': '[512, 128]', 'dropout': 0.5542290510176463, 'batch_norm': False, 'lr': 0.00029195889659144474, 'weight_decay': 0.0002045175653419394, 'epochs': 312, 'loss': 'mae', 'optimizer': 'adam', 'graph_mode': 'off', 'use_snp_selection': False}. Best is trial 16 with value: 0.050243356640524144.
[I 2025-11-03 13:01:05,999] Trial 118 finished with value: -0.014850901070931573 and parameters: {'model_type': 'gcn', 'hidden_dims': '[256, 128, 64]', 'dropout': 0.46487612215993823, 'batch_norm': True, 'lr': 0.0006025441109919047, 'weight_decay': 2.9861115526000674e-06, 'epochs': 74, 'loss': 'mae', 'optimizer': 'adam', 'graph_mode': 'off', 'use_snp_selection': False}. Best is trial 16 with value: 0.050243356640524144.
[I 2025-11-03 13:01:06,854] Trial 119 finished with value: 0.011801816599584772 and parameters: {'model_type': 'gcn', 'hidden_dims': '[256, 128]', 'dropout': 0.5139915709183486, 'batch_norm': False, 'lr': 3.9134129399381606e-05, 'weight_decay': 0.0003369532715140054, 'epochs': 55, 'loss': 'mae', 'optimizer': 'adam', 'graph_mode': 'off', 'use_snp_selection': False}. Best is trial 16 with value: 0.050243356640524144.
[I 2025-11-03 13:01:07,730] Trial 120 finished with value: 0.0455664051982967 and parameters: {'model_type': 'gcn', 'hidden_dims': '[512, 256]', 'dropout': 0.5726111354151779, 'batch_norm': False, 'lr': 1.433703579156928e-05, 'weight_decay': 1.2243679715213343e-05, 'epochs': 68, 'loss': 'mae', 'optimizer': 'adam', 'graph_mode': 'off', 'use_snp_selection': True, 'num_snps': 13138}. Best is trial 16 with value: 0.050243356640524144.
[I 2025-11-03 13:01:08,575] Trial 121 finished with value: -0.0230724596289898 and parameters: {'model_type': 'gcn', 'hidden_dims': '[512, 256]', 'dropout': 0.5488926894562497, 'batch_norm': False, 'lr': 1.4436181831767911e-05, 'weight_decay': 1.163805657254617e-05, 'epochs': 70, 'loss': 'mae', 'optimizer': 'adam', 'graph_mode': 'off', 'use_snp_selection': True, 'num_snps': 11378}. Best is trial 16 with value: 0.050243356640524144.
[I 2025-11-03 13:01:09,471] Trial 122 finished with value: 0.01606228218911515 and parameters: {'model_type': 'gcn', 'hidden_dims': '[512, 256]', 'dropout': 0.5748543771490893, 'batch_norm': False, 'lr': 1.0057562018007757e-05, 'weight_decay': 2.6397757473479402e-05, 'epochs': 62, 'loss': 'mae', 'optimizer': 'adam', 'graph_mode': 'off', 'use_snp_selection': True, 'num_snps': 14187}. Best is trial 16 with value: 0.050243356640524144.
[I 2025-11-03 13:01:10,629] Trial 123 finished with value: 0.061587640670861275 and parameters: {'model_type': 'gcn', 'hidden_dims': '[512, 256]', 'dropout': 0.5634996145012497, 'batch_norm': False, 'lr': 2.6839080013947804e-05, 'weight_decay': 1.811240307444459e-05, 'epochs': 265, 'loss': 'mae', 'optimizer': 'adam', 'graph_mode': 'off', 'use_snp_selection': True, 'num_snps': 7794}. Best is trial 123 with value: 0.061587640670861275.
[I 2025-11-03 13:01:11,787] Trial 124 finished with value: 0.03872663475908448 and parameters: {'model_type': 'gcn', 'hidden_dims': '[512, 256]', 'dropout': 0.5644922160597885, 'batch_norm': False, 'lr': 1.3692897170360102e-05, 'weight_decay': 1.3523000849157659e-05, 'epochs': 261, 'loss': 'mae', 'optimizer': 'adam', 'graph_mode': 'off', 'use_snp_selection': True, 'num_snps': 7542}. Best is trial 123 with value: 0.061587640670861275.
