[I 2025-11-12 07:38:50,709] Trial 42 finished with value: 0.22734843089663834 and parameters: {'model_type': 'graphsage', 'hidden_dims': '[256, 128, 64]', 'dropout': 0.22795406174449928, 'batch_norm': False, 'lr': 3.222943266866501e-05, 'weight_decay': 3.843720264507053e-06, 'epochs': 79, 'loss': 'mae', 'optimizer': 'adam', 'graph_mode': 'cutoff', 'cutoff': 0.46793362613232237, 'grm_norm': 'gcn', 'self_loops': False, 'use_snp_selection': True, 'num_snps': 19460}. Best is trial 37 with value: 0.27261143821280315.
[I 2025-11-12 07:39:47,892] Trial 43 finished with value: 0.24251655707351757 and parameters: {'model_type': 'graphsage', 'hidden_dims': '[256, 128, 64]', 'dropout': 0.2647464066621233, 'batch_norm': False, 'lr': 2.361903021053989e-05, 'weight_decay': 1.2771635099948968e-05, 'epochs': 99, 'loss': 'mae', 'optimizer': 'adam', 'graph_mode': 'cutoff', 'cutoff': 0.5689394840713163, 'grm_norm': 'gcn', 'self_loops': False, 'use_snp_selection': True, 'num_snps': 15774}. Best is trial 37 with value: 0.27261143821280315.
[I 2025-11-12 07:40:46,162] Trial 44 finished with value: 0.2609239945990821 and parameters: {'model_type': 'graphsage', 'hidden_dims': '[256, 128, 64]', 'dropout': 0.36682455799329916, 'batch_norm': False, 'lr': 0.0004367725838204039, 'weight_decay': 2.5160624729835476e-05, 'epochs': 56, 'loss': 'mae', 'optimizer': 'adam', 'graph_mode': 'cutoff', 'cutoff': 0.6943807854821608, 'grm_norm': 'gcn', 'self_loops': False, 'use_snp_selection': True, 'num_snps': 23039}. Best is trial 37 with value: 0.27261143821280315.
[I 2025-11-12 07:41:42,991] Trial 45 finished with value: 0.2507912771689082 and parameters: {'model_type': 'graphsage', 'hidden_dims': '[256, 128, 64]', 'dropout': 0.3340584550307984, 'batch_norm': False, 'lr': 0.00044156068634707815, 'weight_decay': 1.6720269785452765e-06, 'epochs': 52, 'loss': 'mae', 'optimizer': 'adam', 'graph_mode': 'cutoff', 'cutoff': 0.7132200134709411, 'grm_norm': 'gcn', 'self_loops': False, 'use_snp_selection': True, 'num_snps': 21941}. Best is trial 37 with value: 0.27261143821280315.
[I 2025-11-12 07:42:55,378] Trial 46 finished with value: 0.25695473389347734 and parameters: {'model_type': 'graphsage', 'hidden_dims': '[256, 128, 64]', 'dropout': 0.30338245968288935, 'batch_norm': False, 'lr': 1.8414529546930747e-05, 'weight_decay': 3.186157258979596e-06, 'epochs': 136, 'loss': 'mae', 'optimizer': 'adam', 'graph_mode': 'cutoff', 'cutoff': 0.8334919103539659, 'grm_norm': 'gcn', 'self_loops': False, 'use_snp_selection': True, 'num_snps': 27329}. Best is trial 37 with value: 0.27261143821280315.
[I 2025-11-12 07:44:45,209] Trial 47 finished with value: 0.24903319599457158 and parameters: {'model_type': 'graphsage', 'hidden_dims': '[256, 128, 64]', 'dropout': 0.3666661513910815, 'batch_norm': True, 'lr': 5.644937124298211e-05, 'weight_decay': 2.712388575127033e-05, 'epochs': 189, 'loss': 'mse', 'optimizer': 'adam', 'graph_mode': 'cutoff', 'cutoff': 0.35328320649213724, 'grm_norm': 'gcn', 'self_loops': True, 'use_snp_selection': False}. Best is trial 37 with value: 0.27261143821280315.
[I 2025-11-12 07:45:35,002] Trial 48 finished with value: 0.1644901889132957 and parameters: {'model_type': 'graphsage', 'hidden_dims': '[256, 128, 64]', 'dropout': 0.37282373079596065, 'batch_norm': False, 'lr': 4.661719143582066e-06, 'weight_decay': 8.25038297806728e-06, 'epochs': 116, 'loss': 'mae', 'optimizer': 'adam', 'graph_mode': 'cutoff', 'cutoff': 0.6137063490706507, 'grm_norm': 'gcn', 'self_loops': False, 'use_snp_selection': True, 'num_snps': 7232}. Best is trial 37 with value: 0.27261143821280315.
[I 2025-11-12 07:46:53,719] Trial 49 finished with value: 0.23342968952624626 and parameters: {'model_type': 'graphsage', 'hidden_dims': '[512, 128]', 'dropout': 0.4804768441718221, 'batch_norm': False, 'lr': 1.3685751101991857e-05, 'weight_decay': 8.901532961222177e-05, 'epochs': 160, 'loss': 'mae', 'optimizer': 'adam', 'graph_mode': 'cutoff', 'cutoff': 0.5350725576497266, 'grm_norm': 'cosine', 'self_loops': False, 'use_snp_selection': True, 'num_snps': 17988}. Best is trial 37 with value: 0.27261143821280315.
[I 2025-11-12 07:47:53,967] Trial 50 finished with value: 0.2168433919864663 and parameters: {'model_type': 'graphsage', 'hidden_dims': '[512, 64]', 'dropout': 0.4114234838163504, 'batch_norm': False, 'lr': 2.9870731241693224e-06, 'weight_decay': 1.3065474659294716e-05, 'epochs': 88, 'loss': 'mae', 'optimizer': 'adam', 'graph_mode': 'cutoff', 'cutoff': 0.7457950506843107, 'grm_norm': 'gcn', 'self_loops': False, 'use_snp_selection': True, 'num_snps': 14245}. Best is trial 37 with value: 0.27261143821280315.
[I 2025-11-12 07:49:04,814] Trial 51 finished with value: 0.24747349179130212 and parameters: {'model_type': 'graphsage', 'hidden_dims': '[256, 128, 64]', 'dropout': 0.31234428657739993, 'batch_norm': False, 'lr': 1.828957612822611e-05, 'weight_decay': 2.848811615604602e-06, 'epochs': 128, 'loss': 'mae', 'optimizer': 'adam', 'graph_mode': 'cutoff', 'cutoff': 0.8274007992619778, 'grm_norm': 'gcn', 'self_loops': False, 'use_snp_selection': True, 'num_snps': 26358}. Best is trial 37 with value: 0.27261143821280315.
[I 2025-11-12 07:50:20,019] Trial 52 finished with value: 0.2506958721024247 and parameters: {'model_type': 'graphsage', 'hidden_dims': '[256, 128, 64]', 'dropout': 0.28853855312400106, 'batch_norm': False, 'lr': 9.419892592764967e-06, 'weight_decay': 5.396428288619224e-06, 'epochs': 140, 'loss': 'mae', 'optimizer': 'adam', 'graph_mode': 'cutoff', 'cutoff': 0.8313159346422756, 'grm_norm': 'gcn', 'self_loops': False, 'use_snp_selection': True, 'num_snps': 28594}. Best is trial 37 with value: 0.27261143821280315.
[I 2025-11-12 07:51:33,422] Trial 53 finished with value: 0.22908395822238042 and parameters: {'model_type': 'graphsage', 'hidden_dims': '[256, 128, 64]', 'dropout': 0.341333631321573, 'batch_norm': False, 'lr': 2.606864974568526e-05, 'weight_decay': 4.561112196940773e-05, 'epochs': 177, 'loss': 'mae', 'optimizer': 'adam', 'graph_mode': 'cutoff', 'cutoff': 0.7858460281951269, 'grm_norm': 'gcn', 'self_loops': False, 'use_snp_selection': True, 'num_snps': 23388}. Best is trial 37 with value: 0.27261143821280315.
[I 2025-11-12 07:52:55,982] Trial 54 finished with value: 0.23905181308565865 and parameters: {'model_type': 'graphsage', 'hidden_dims': '[256, 128, 64]', 'dropout': 0.24247473868237862, 'batch_norm': False, 'lr': 1.805594765883722e-05, 'weight_decay': 9.926163593852896e-07, 'epochs': 151, 'loss': 'mae', 'optimizer': 'adam', 'graph_mode': 'cutoff', 'cutoff': 0.8563491379858917, 'grm_norm': 'gcn', 'self_loops': False, 'use_snp_selection': True, 'num_snps': 33089}. Best is trial 37 with value: 0.27261143821280315.
[I 2025-11-12 07:54:01,089] Trial 55 finished with value: 0.23688036488937309 and parameters: {'model_type': 'graphsage', 'hidden_dims': '[256, 128, 64]', 'dropout': 0.28542542433822077, 'batch_norm': False, 'lr': 0.0002565818017274623, 'weight_decay': 4.698700138640107e-07, 'epochs': 136, 'loss': 'mae', 'optimizer': 'adam', 'graph_mode': 'cutoff', 'cutoff': 0.6563615795246286, 'grm_norm': 'cosine_then_gcn', 'self_loops': True, 'use_snp_selection': True, 'num_snps': 19167}. Best is trial 37 with value: 0.27261143821280315.
[I 2025-11-12 07:54:58,278] Trial 56 finished with value: 0.24849828160858983 and parameters: {'model_type': 'graphsage', 'hidden_dims': '[256, 128]', 'dropout': 0.2192757169697674, 'batch_norm': False, 'lr': 1.2247656997817119e-05, 'weight_decay': 3.847663052159113e-06, 'epochs': 40, 'loss': 'mae', 'optimizer': 'adam', 'graph_mode': 'cutoff', 'cutoff': 0.7105457554536201, 'grm_norm': 'cosine_then_gcn', 'self_loops': False, 'use_snp_selection': True, 'num_snps': 21483}. Best is trial 37 with value: 0.27261143821280315.
[I 2025-11-12 07:56:12,575] Trial 57 finished with value: 0.2505390827276897 and parameters: {'model_type': 'graphsage', 'hidden_dims': '[256, 128, 64]', 'dropout': 0.30603371377326216, 'batch_norm': False, 'lr': 7.478354365488308e-06, 'weight_decay': 2.483775703928956e-06, 'epochs': 113, 'loss': 'mae', 'optimizer': 'adam', 'graph_mode': 'cutoff', 'cutoff': 0.4398128539611643, 'grm_norm': 'gcn', 'self_loops': False, 'use_snp_selection': True, 'num_snps': 25291}. Best is trial 37 with value: 0.27261143821280315.
[I 2025-11-12 07:57:36,673] Trial 58 finished with value: 0.21725048159452692 and parameters: {'model_type': 'graphsage', 'hidden_dims': '[256, 128, 64]', 'dropout': 0.349292043509469, 'batch_norm': False, 'lr': 4.604413467518041e-05, 'weight_decay': 1.2915376994279156e-06, 'epochs': 237, 'loss': 'mae', 'optimizer': 'adam', 'graph_mode': 'knn', 'source': 'grm', 'knn_k': 8, 'weighted_edges': True, 'symmetrize_mode': 'union', 'use_snp_selection': True, 'num_snps': 12452}. Best is trial 37 with value: 0.27261143821280315.
[I 2025-11-12 07:58:40,196] Trial 59 finished with value: 0.22963257936246922 and parameters: {'model_type': 'graphsage', 'hidden_dims': '[512, 128]', 'dropout': 0.265041696437676, 'batch_norm': False, 'lr': 2.9049747511305166e-05, 'weight_decay': 1.8100819899152236e-05, 'epochs': 88, 'loss': 'mae', 'optimizer': 'adam', 'graph_mode': 'cutoff', 'cutoff': 0.7563601648505843, 'grm_norm': 'cosine', 'self_loops': False, 'use_snp_selection': True, 'num_snps': 17193}. Best is trial 37 with value: 0.27261143821280315.
[I 2025-11-12 07:59:45,432] Trial 60 finished with value: 0.1954899059355908 and parameters: {'model_type': 'graphsage', 'hidden_dims': '[512, 64]', 'dropout': 0.25213002451315664, 'batch_norm': True, 'lr': 5.339402990901305e-06, 'weight_decay': 5.6261171670750415e-06, 'epochs': 74, 'loss': 'mse', 'optimizer': 'adam', 'graph_mode': 'cutoff', 'cutoff': 0.7941884285455577, 'grm_norm': 'cosine_then_gcn', 'self_loops': False, 'use_snp_selection': False}. Best is trial 37 with value: 0.27261143821280315.
[I 2025-11-12 08:00:51,195] Trial 61 finished with value: 0.2166862497365008 and parameters: {'model_type': 'graphsage', 'hidden_dims': '[128, 64]', 'dropout': 0.29628981179552477, 'batch_norm': False, 'lr': 0.00017248710585590052, 'weight_decay': 3.511541218639716e-05, 'epochs': 46, 'loss': 'mae', 'optimizer': 'adam', 'graph_mode': 'cutoff', 'cutoff': 0.6686886656253237, 'grm_norm': 'none', 'self_loops': False, 'use_snp_selection': True, 'num_snps': 45300}. Best is trial 37 with value: 0.27261143821280315.
[I 2025-11-12 08:02:01,041] Trial 62 finished with value: 0.2586604767884129 and parameters: {'model_type': 'graphsage', 'hidden_dims': '[128, 64]', 'dropout': 0.12164147343853034, 'batch_norm': False, 'lr': 0.0003108015576574541, 'weight_decay': 9.697877561777502e-06, 'epochs': 58, 'loss': 'mae', 'optimizer': 'adam', 'graph_mode': 'cutoff', 'cutoff': 0.5939345468697945, 'grm_norm': 'none', 'self_loops': False, 'use_snp_selection': True, 'num_snps': 47729}. Best is trial 37 with value: 0.27261143821280315.
[I 2025-11-12 08:03:14,504] Trial 63 finished with value: 0.0 and parameters: {'model_type': 'graphsage', 'hidden_dims': '[128, 64]', 'dropout': 0.5459927660285757, 'batch_norm': False, 'lr': 0.0006512785465242238, 'weight_decay': 9.425989394128519e-06, 'epochs': 58, 'loss': 'mae', 'optimizer': 'adam', 'graph_mode': 'cutoff', 'cutoff': 0.5965459296982748, 'grm_norm': 'none', 'self_loops': False, 'use_snp_selection': True, 'num_snps': 53490}. Best is trial 37 with value: 0.27261143821280315.
[I 2025-11-12 08:04:53,205] Trial 64 finished with value: 0.27644310778039577 and parameters: {'model_type': 'graphsage', 'hidden_dims': '[256, 128, 64]', 'dropout': 0.14315057473149842, 'batch_norm': False, 'lr': 9.410119453296717e-05, 'weight_decay': 1.935539586796105e-05, 'epochs': 95, 'loss': 'mae', 'optimizer': 'adam', 'graph_mode': 'cutoff', 'cutoff': 0.49662263571842397, 'grm_norm': 'cosine_then_gcn', 'self_loops': False, 'use_snp_selection': True, 'num_snps': 48455}. Best is trial 64 with value: 0.27644310778039577.
[I 2025-11-12 08:06:18,142] Trial 65 finished with value: 0.2636117702603328 and parameters: {'model_type': 'graphsage', 'hidden_dims': '[256, 128, 64]', 'dropout': 0.14186289872079477, 'batch_norm': False, 'lr': 0.00010859860008951749, 'weight_decay': 2.4939701797868055e-05, 'epochs': 70, 'loss': 'mae', 'optimizer': 'adam', 'graph_mode': 'cutoff', 'cutoff': 0.5093745870079114, 'grm_norm': 'cosine_then_gcn', 'self_loops': True, 'use_snp_selection': True, 'num_snps': 48302}. Best is trial 64 with value: 0.27644310778039577.
[I 2025-11-12 08:07:42,024] Trial 66 finished with value: 0.2700965128641612 and parameters: {'model_type': 'graphsage', 'hidden_dims': '[256, 128]', 'dropout': 0.12554468474485117, 'batch_norm': False, 'lr': 0.00010361113278722812, 'weight_decay': 2.3423584223260175e-05, 'epochs': 69, 'loss': 'mae', 'optimizer': 'adam', 'graph_mode': 'cutoff', 'cutoff': 0.5068367834144898, 'grm_norm': 'cosine_then_gcn', 'self_loops': True, 'use_snp_selection': True, 'num_snps': 47960}. Best is trial 64 with value: 0.27644310778039577.
[I 2025-11-12 08:09:13,976] Trial 67 finished with value: 0.2662542205785724 and parameters: {'model_type': 'graphsage', 'hidden_dims': '[256, 128]', 'dropout': 0.1415136970417307, 'batch_norm': False, 'lr': 9.563808572581659e-05, 'weight_decay': 2.2169659720750574e-05, 'epochs': 94, 'loss': 'mae', 'optimizer': 'adam', 'graph_mode': 'cutoff', 'cutoff': 0.5174128303569364, 'grm_norm': 'cosine_then_gcn', 'self_loops': True, 'use_snp_selection': True, 'num_snps': 49287}. Best is trial 64 with value: 0.27644310778039577.
[I 2025-11-12 08:10:51,920] Trial 68 finished with value: 0.27181622525952787 and parameters: {'model_type': 'graphsage', 'hidden_dims': '[256, 128]', 'dropout': 0.13450598210967457, 'batch_norm': False, 'lr': 0.00010344733172741367, 'weight_decay': 2.265746259448298e-05, 'epochs': 96, 'loss': 'mae', 'optimizer': 'adam', 'graph_mode': 'cutoff', 'cutoff': 0.4999506133887043, 'grm_norm': 'cosine_then_gcn', 'self_loops': True, 'use_snp_selection': True, 'num_snps': 48931}. Best is trial 64 with value: 0.27644310778039577.
[I 2025-11-12 08:12:27,828] Trial 69 finished with value: 0.26160276876170274 and parameters: {'model_type': 'graphsage', 'hidden_dims': '[256, 128]', 'dropout': 0.14969296412530153, 'batch_norm': False, 'lr': 9.075435130595509e-05, 'weight_decay': 4.9720498236505355e-05, 'epochs': 100, 'loss': 'mae', 'optimizer': 'adam', 'graph_mode': 'cutoff', 'cutoff': 0.5027424230591852, 'grm_norm': 'cosine_then_gcn', 'self_loops': True, 'use_snp_selection': True, 'num_snps': 47962}. Best is trial 64 with value: 0.27644310778039577.
[I 2025-11-12 08:13:56,636] Trial 70 finished with value: 0.25293866383936553 and parameters: {'model_type': 'graphsage', 'hidden_dims': '[256, 128]', 'dropout': 0.17816537401571847, 'batch_norm': False, 'lr': 0.00013040217236051294, 'weight_decay': 0.00010367518068925834, 'epochs': 93, 'loss': 'mae', 'optimizer': 'adam', 'graph_mode': 'knn', 'source': 'grm', 'knn_k': 3, 'weighted_edges': False, 'symmetrize_mode': 'mutual', 'use_snp_selection': True, 'num_snps': 41726}. Best is trial 64 with value: 0.27644310778039577.
[I 2025-11-12 08:15:36,143] Trial 71 finished with value: 0.27769131151746956 and parameters: {'model_type': 'graphsage', 'hidden_dims': '[256, 128]', 'dropout': 0.14922007330194764, 'batch_norm': False, 'lr': 8.671911274120089e-05, 'weight_decay': 5.1213711586219655e-05, 'epochs': 109, 'loss': 'mae', 'optimizer': 'adam', 'graph_mode': 'cutoff', 'cutoff': 0.5013306235413649, 'grm_norm': 'cosine_then_gcn', 'self_loops': True, 'use_snp_selection': True, 'num_snps': 47407}. Best is trial 71 with value: 0.27769131151746956.
[I 2025-11-12 08:17:23,604] Trial 72 finished with value: 0.2649298961277927 and parameters: {'model_type': 'graphsage', 'hidden_dims': '[256, 128]', 'dropout': 0.10208270411762564, 'batch_norm': False, 'lr': 7.064064128676246e-05, 'weight_decay': 3.726620745001082e-05, 'epochs': 79, 'loss': 'mae', 'optimizer': 'adam', 'graph_mode': 'cutoff', 'cutoff': 0.45660982394317284, 'grm_norm': 'cosine_then_gcn', 'self_loops': True, 'use_snp_selection': True, 'num_snps': 55992}. Best is trial 71 with value: 0.27769131151746956.
[I 2025-11-12 08:19:07,224] Trial 73 finished with value: 0.25506917124218426 and parameters: {'model_type': 'graphsage', 'hidden_dims': '[256, 128]', 'dropout': 0.10960727211029896, 'batch_norm': False, 'lr': 0.00010172934955343118, 'weight_decay': 6.288590460635534e-05, 'epochs': 72, 'loss': 'mae', 'optimizer': 'adam', 'graph_mode': 'cutoff', 'cutoff': 0.47405173949280244, 'grm_norm': 'cosine_then_gcn', 'self_loops': True, 'use_snp_selection': True, 'num_snps': 55839}. Best is trial 71 with value: 0.27769131151746956.
[I 2025-11-12 08:20:57,595] Trial 74 finished with value: 0.2750599691525239 and parameters: {'model_type': 'graphsage', 'hidden_dims': '[256, 128]', 'dropout': 0.14433186283226324, 'batch_norm': False, 'lr': 6.91359026943102e-05, 'weight_decay': 2.167863629687247e-05, 'epochs': 109, 'loss': 'mae', 'optimizer': 'adam', 'graph_mode': 'cutoff', 'cutoff': 0.5237354912513801, 'grm_norm': 'cosine_then_gcn', 'self_loops': True, 'use_snp_selection': True, 'num_snps': 59070}. Best is trial 71 with value: 0.27769131151746956.
[I 2025-11-12 08:23:16,675] Trial 75 finished with value: 0.2713104487609319 and parameters: {'model_type': 'graphsage', 'hidden_dims': '[256, 128]', 'dropout': 0.12289746158198742, 'batch_norm': False, 'lr': 6.63228193139973e-05, 'weight_decay': 1.7879515405737257e-05, 'epochs': 110, 'loss': 'mae', 'optimizer': 'adam', 'graph_mode': 'cutoff', 'cutoff': 0.42367168595575705, 'grm_norm': 'cosine_then_gcn', 'self_loops': True, 'use_snp_selection': True, 'num_snps': 58960}. Best is trial 71 with value: 0.27769131151746956.
[I 2025-11-12 08:25:32,653] Trial 76 finished with value: 0.27014653279354894 and parameters: {'model_type': 'graphsage', 'hidden_dims': '[256, 128]', 'dropout': 0.12686204679555807, 'batch_norm': False, 'lr': 7.532071451624698e-05, 'weight_decay': 1.35757244239264e-05, 'epochs': 107, 'loss': 'mae', 'optimizer': 'adam', 'graph_mode': 'cutoff', 'cutoff': 0.41285224044028285, 'grm_norm': 'cosine_then_gcn', 'self_loops': True, 'use_snp_selection': True, 'num_snps': 58929}. Best is trial 71 with value: 0.27769131151746956.
[I 2025-11-12 08:26:40,041] Trial 77 finished with value: 0.2658446161733944 and parameters: {'model_type': 'graphsage', 'hidden_dims': '[256, 128]', 'dropout': 0.12557270142307744, 'batch_norm': True, 'lr': 0.00017504965961323825, 'weight_decay': 1.4346428986399852e-05, 'epochs': 112, 'loss': 'mae', 'optimizer': 'adam', 'graph_mode': 'cutoff', 'cutoff': 0.4046292808781805, 'grm_norm': 'cosine_then_gcn', 'self_loops': True, 'use_snp_selection': False}. Best is trial 71 with value: 0.27769131151746956.
[I 2025-11-12 08:28:56,934] Trial 78 finished with value: 0.2646863431810251 and parameters: {'model_type': 'graphsage', 'hidden_dims': '[256, 128]', 'dropout': 0.18271124781590392, 'batch_norm': False, 'lr': 6.603177114005969e-05, 'weight_decay': 2.0082032508628786e-05, 'epochs': 107, 'loss': 'mse', 'optimizer': 'adam', 'graph_mode': 'cutoff', 'cutoff': 0.4124697061227622, 'grm_norm': 'cosine_then_gcn', 'self_loops': True, 'use_snp_selection': True, 'num_snps': 59756}. Best is trial 71 with value: 0.27769131151746956.
[I 2025-11-12 08:31:17,738] Trial 79 finished with value: 0.26915534056605706 and parameters: {'model_type': 'graphsage', 'hidden_dims': '[256, 128]', 'dropout': 0.15708115629584435, 'batch_norm': False, 'lr': 4.475116209060591e-05, 'weight_decay': 1.1983681771849305e-05, 'epochs': 105, 'loss': 'mae', 'optimizer': 'adam', 'graph_mode': 'cutoff', 'cutoff': 0.35968115331959, 'grm_norm': 'cosine_then_gcn', 'self_loops': True, 'use_snp_selection': True, 'num_snps': 58219}. Best is trial 71 with value: 0.27769131151746956.
[I 2025-11-12 08:33:21,573] Trial 80 finished with value: 0.25391549001707714 and parameters: {'model_type': 'graphsage', 'hidden_dims': '[256, 128]', 'dropout': 0.12214118507385255, 'batch_norm': False, 'lr': 7.974141044367706e-05, 'weight_decay': 2.9807832281090865e-05, 'epochs': 123, 'loss': 'mae', 'optimizer': 'adam', 'graph_mode': 'cutoff', 'cutoff': 0.48166370269303854, 'grm_norm': 'cosine_then_gcn', 'self_loops': True, 'use_snp_selection': True, 'num_snps': 54591}. Best is trial 71 with value: 0.27769131151746956.
[I 2025-11-12 08:35:41,421] Trial 81 finished with value: 0.2724585212198033 and parameters: {'model_type': 'graphsage', 'hidden_dims': '[256, 128]', 'dropout': 0.16207767940671292, 'batch_norm': False, 'lr': 4.045758575414667e-05, 'weight_decay': 1.1568370458565752e-05, 'epochs': 106, 'loss': 'mae', 'optimizer': 'adam', 'graph_mode': 'cutoff', 'cutoff': 0.3787170127217758, 'grm_norm': 'cosine_then_gcn', 'self_loops': True, 'use_snp_selection': True, 'num_snps': 57841}. Best is trial 71 with value: 0.27769131151746956.
[I 2025-11-12 08:37:38,636] Trial 82 finished with value: 0.27443681578355833 and parameters: {'model_type': 'graphsage', 'hidden_dims': '[256, 128]', 'dropout': 0.17319080645423118, 'batch_norm': False, 'lr': 5.583769666655971e-05, 'weight_decay': 1.6346266219209914e-05, 'epochs': 83, 'loss': 'mae', 'optimizer': 'adam', 'graph_mode': 'cutoff', 'cutoff': 0.43453773635502885, 'grm_norm': 'cosine_then_gcn', 'self_loops': True, 'use_snp_selection': True, 'num_snps': 57191}. Best is trial 71 with value: 0.27769131151746956.
[I 2025-11-12 08:39:46,567] Trial 83 finished with value: 0.25512075931006206 and parameters: {'model_type': 'graphsage', 'hidden_dims': '[256, 128]', 'dropout': 0.18044013337693154, 'batch_norm': False, 'lr': 5.4595105510286314e-05, 'weight_decay': 1.857354975234446e-05, 'epochs': 117, 'loss': 'mae', 'optimizer': 'adam', 'graph_mode': 'cutoff', 'cutoff': 0.3800532750806489, 'grm_norm': 'cosine_then_gcn', 'self_loops': True, 'use_snp_selection': True, 'num_snps': 51463}. Best is trial 71 with value: 0.27769131151746956.
