[I 2025-11-03 15:48:52,565] Trial 100 finished with value: 0.07035045436963486 and parameters: {'model_type': 'graphsage', 'hidden_dims': '[512, 128]', 'dropout': 0.5636972843814928, 'batch_norm': True, 'lr': 0.0002887117787938622, 'weight_decay': 4.1509135236625787e-07, 'epochs': 300, 'loss': 'mae', 'optimizer': 'adam', 'graph_mode': 'knn', 'source': 'grm', 'knn_k': 7, 'weighted_edges': True, 'symmetrize_mode': 'union', 'use_snp_selection': False}. Best is trial 72 with value: 0.11572043655915205.
[I 2025-11-03 15:48:59,752] Trial 101 finished with value: 0.09879900218495778 and parameters: {'model_type': 'graphsage', 'hidden_dims': '[512, 128]', 'dropout': 0.5841352208047113, 'batch_norm': True, 'lr': 0.0003869038905652106, 'weight_decay': 5.587424102310959e-07, 'epochs': 307, 'loss': 'mae', 'optimizer': 'adam', 'graph_mode': 'knn', 'source': 'grm', 'knn_k': 1, 'weighted_edges': True, 'symmetrize_mode': 'union', 'use_snp_selection': False}. Best is trial 72 with value: 0.11572043655915205.
[I 2025-11-03 15:49:07,247] Trial 102 finished with value: 0.10297241058562517 and parameters: {'model_type': 'graphsage', 'hidden_dims': '[512, 128]', 'dropout': 0.5512887963703761, 'batch_norm': True, 'lr': 0.0006497496999559142, 'weight_decay': 1.7903287157478427e-07, 'epochs': 320, 'loss': 'mae', 'optimizer': 'adam', 'graph_mode': 'knn', 'source': 'grm', 'knn_k': 1, 'weighted_edges': True, 'symmetrize_mode': 'union', 'use_snp_selection': False}. Best is trial 72 with value: 0.11572043655915205.
[I 2025-11-03 15:49:14,848] Trial 103 finished with value: 0.10104924560780917 and parameters: {'model_type': 'graphsage', 'hidden_dims': '[512, 128]', 'dropout': 0.5524063588057939, 'batch_norm': True, 'lr': 0.0006645771776510878, 'weight_decay': 1.645430403799053e-07, 'epochs': 327, 'loss': 'mae', 'optimizer': 'adam', 'graph_mode': 'knn', 'source': 'grm', 'knn_k': 1, 'weighted_edges': True, 'symmetrize_mode': 'union', 'use_snp_selection': False}. Best is trial 72 with value: 0.11572043655915205.
[I 2025-11-03 15:49:22,468] Trial 104 finished with value: 0.09630949814892138 and parameters: {'model_type': 'graphsage', 'hidden_dims': '[512, 128]', 'dropout': 0.5510122805759193, 'batch_norm': True, 'lr': 0.0006591063528341188, 'weight_decay': 1.8320756767146567e-07, 'epochs': 327, 'loss': 'mae', 'optimizer': 'adam', 'graph_mode': 'knn', 'source': 'grm', 'knn_k': 1, 'weighted_edges': True, 'symmetrize_mode': 'union', 'use_snp_selection': False}. Best is trial 72 with value: 0.11572043655915205.
[I 2025-11-03 15:49:30,950] Trial 105 finished with value: 0.06751499192904464 and parameters: {'model_type': 'graphsage', 'hidden_dims': '[512, 128]', 'dropout': 0.5704902938310644, 'batch_norm': True, 'lr': 0.000528504331387204, 'weight_decay': 3.410874663282895e-07, 'epochs': 328, 'loss': 'mae', 'optimizer': 'adam', 'graph_mode': 'knn', 'source': 'grm', 'knn_k': 4, 'weighted_edges': True, 'symmetrize_mode': 'union', 'use_snp_selection': False}. Best is trial 72 with value: 0.11572043655915205.
[I 2025-11-03 15:49:35,623] Trial 106 finished with value: 0.08221029281573032 and parameters: {'model_type': 'graphsage', 'hidden_dims': '[256, 128, 64]', 'dropout': 0.5290821648671296, 'batch_norm': True, 'lr': 0.0007715695332114982, 'weight_decay': 1.207066872174313e-07, 'epochs': 338, 'loss': 'mae', 'optimizer': 'adam', 'graph_mode': 'knn', 'source': 'grm', 'knn_k': 1, 'weighted_edges': True, 'symmetrize_mode': 'union', 'use_snp_selection': False}. Best is trial 72 with value: 0.11572043655915205.
[I 2025-11-03 15:49:43,403] Trial 107 finished with value: 0.09160512206317671 and parameters: {'model_type': 'graphsage', 'hidden_dims': '[512, 128]', 'dropout': 0.5555196835306417, 'batch_norm': True, 'lr': 0.0006317309621680925, 'weight_decay': 1.4992616206197102e-07, 'epochs': 320, 'loss': 'mae', 'optimizer': 'adam', 'graph_mode': 'knn', 'source': 'grm', 'knn_k': 2, 'weighted_edges': True, 'symmetrize_mode': 'union', 'use_snp_selection': False}. Best is trial 72 with value: 0.11572043655915205.
[I 2025-11-03 15:49:50,765] Trial 108 finished with value: 0.09284728050536623 and parameters: {'model_type': 'graphsage', 'hidden_dims': '[512, 128]', 'dropout': 0.5159878844349601, 'batch_norm': True, 'lr': 0.000832541959432069, 'weight_decay': 2.8039749778977217e-07, 'epochs': 314, 'loss': 'mae', 'optimizer': 'adam', 'graph_mode': 'knn', 'source': 'grm', 'knn_k': 1, 'weighted_edges': True, 'symmetrize_mode': 'union', 'use_snp_selection': False}. Best is trial 72 with value: 0.11572043655915205.
[I 2025-11-03 15:49:58,460] Trial 109 finished with value: 0.08243084098328463 and parameters: {'model_type': 'graphsage', 'hidden_dims': '[512, 64]', 'dropout': 0.5808943739554702, 'batch_norm': True, 'lr': 0.00012498681208590522, 'weight_decay': 1.7148746546428343e-07, 'epochs': 333, 'loss': 'mae', 'optimizer': 'adam', 'graph_mode': 'knn', 'source': 'grm', 'knn_k': 1, 'weighted_edges': True, 'symmetrize_mode': 'union', 'use_snp_selection': False}. Best is trial 72 with value: 0.11572043655915205.
[I 2025-11-03 15:50:05,678] Trial 110 finished with value: 0.08012584804277134 and parameters: {'model_type': 'graphsage', 'hidden_dims': '[512, 128]', 'dropout': 0.501419835947501, 'batch_norm': True, 'lr': 0.0005810522288535559, 'weight_decay': 2.4342956249744705e-07, 'epochs': 290, 'loss': 'mae', 'optimizer': 'adam', 'graph_mode': 'knn', 'source': 'grm', 'knn_k': 2, 'weighted_edges': True, 'symmetrize_mode': 'union', 'use_snp_selection': False}. Best is trial 72 with value: 0.11572043655915205.
[I 2025-11-03 15:50:12,957] Trial 111 finished with value: 0.09926635735848754 and parameters: {'model_type': 'graphsage', 'hidden_dims': '[512, 128]', 'dropout': 0.5772721210442027, 'batch_norm': True, 'lr': 0.0004104781892469518, 'weight_decay': 4.352903427611126e-07, 'epochs': 308, 'loss': 'mae', 'optimizer': 'adam', 'graph_mode': 'knn', 'source': 'grm', 'knn_k': 1, 'weighted_edges': True, 'symmetrize_mode': 'union', 'use_snp_selection': False}. Best is trial 72 with value: 0.11572043655915205.
[I 2025-11-03 15:50:20,059] Trial 112 finished with value: 0.09996164394677678 and parameters: {'model_type': 'graphsage', 'hidden_dims': '[512, 128]', 'dropout': 0.5721474328374742, 'batch_norm': True, 'lr': 0.0004972601325232265, 'weight_decay': 3.525811442895909e-07, 'epochs': 298, 'loss': 'mae', 'optimizer': 'adam', 'graph_mode': 'knn', 'source': 'grm', 'knn_k': 1, 'weighted_edges': True, 'symmetrize_mode': 'union', 'use_snp_selection': False}. Best is trial 72 with value: 0.11572043655915205.
[I 2025-11-03 15:50:27,911] Trial 113 finished with value: 0.10031805361129222 and parameters: {'model_type': 'graphsage', 'hidden_dims': '[512, 128]', 'dropout': 0.5617312052949068, 'batch_norm': True, 'lr': 0.0004941846942516445, 'weight_decay': 3.590923042483931e-07, 'epochs': 343, 'loss': 'mae', 'optimizer': 'adam', 'graph_mode': 'knn', 'source': 'grm', 'knn_k': 1, 'weighted_edges': True, 'symmetrize_mode': 'union', 'use_snp_selection': False}. Best is trial 72 with value: 0.11572043655915205.
[I 2025-11-03 15:50:35,430] Trial 114 finished with value: 0.09172788657442879 and parameters: {'model_type': 'graphsage', 'hidden_dims': '[512, 128]', 'dropout': 0.5469465437620734, 'batch_norm': True, 'lr': 0.0006972357157394081, 'weight_decay': 2.841806517592105e-07, 'epochs': 323, 'loss': 'mae', 'optimizer': 'adam', 'graph_mode': 'knn', 'source': 'grm', 'knn_k': 1, 'weighted_edges': True, 'symmetrize_mode': 'union', 'use_snp_selection': False}. Best is trial 72 with value: 0.11572043655915205.
[I 2025-11-03 15:50:38,598] Trial 115 finished with value: 0.09919708038427442 and parameters: {'model_type': 'graphsage', 'hidden_dims': '[128, 64]', 'dropout': 0.5613884710070374, 'batch_norm': True, 'lr': 0.0002997043592900714, 'weight_decay': 0.0007258239259776766, 'epochs': 337, 'loss': 'mae', 'optimizer': 'adam', 'graph_mode': 'knn', 'source': 'grm', 'knn_k': 1, 'weighted_edges': True, 'symmetrize_mode': 'union', 'use_snp_selection': False}. Best is trial 72 with value: 0.11572043655915205.
[I 2025-11-03 15:50:43,282] Trial 116 finished with value: 0.09590205423349368 and parameters: {'model_type': 'graphsage', 'hidden_dims': '[256, 128]', 'dropout': 0.5990588647315196, 'batch_norm': True, 'lr': 0.00022172178579781972, 'weight_decay': 2.078079678015843e-07, 'epochs': 345, 'loss': 'mae', 'optimizer': 'adam', 'graph_mode': 'knn', 'source': 'grm', 'knn_k': 1, 'weighted_edges': False, 'symmetrize_mode': 'union', 'use_snp_selection': False}. Best is trial 72 with value: 0.11572043655915205.
[I 2025-11-03 15:50:48,593] Trial 117 finished with value: 0.07991834940945913 and parameters: {'model_type': 'graphsage', 'hidden_dims': '[512, 128]', 'dropout': 0.5340196203295532, 'batch_norm': True, 'lr': 0.0003412232253137497, 'weight_decay': 1.2902860563316542e-07, 'epochs': 179, 'loss': 'mae', 'optimizer': 'adam', 'graph_mode': 'knn', 'source': 'grm', 'knn_k': 2, 'weighted_edges': True, 'symmetrize_mode': 'union', 'use_snp_selection': False}. Best is trial 72 with value: 0.11572043655915205.
[I 2025-11-03 15:50:56,929] Trial 118 finished with value: 0.07343083978912947 and parameters: {'model_type': 'graphsage', 'hidden_dims': '[512, 128]', 'dropout': 0.1051282327608054, 'batch_norm': True, 'lr': 0.000257505858867192, 'weight_decay': 1.7806734103094446e-07, 'epochs': 343, 'loss': 'mae', 'optimizer': 'adam', 'graph_mode': 'cutoff', 'cutoff': 0.4450834457290769, 'grm_norm': 'cosine', 'self_loops': False, 'use_snp_selection': False}. Best is trial 72 with value: 0.11572043655915205.
[I 2025-11-03 15:51:04,116] Trial 119 finished with value: 0.05990565290635372 and parameters: {'model_type': 'graphsage', 'hidden_dims': '[512, 128]', 'dropout': 0.5194723971739446, 'batch_norm': True, 'lr': 3.641561644025146e-05, 'weight_decay': 2.2629148265181406e-07, 'epochs': 318, 'loss': 'mae', 'optimizer': 'adam', 'graph_mode': 'knn', 'source': 'grm', 'knn_k': 1, 'weighted_edges': True, 'symmetrize_mode': 'mutual', 'use_snp_selection': False}. Best is trial 72 with value: 0.11572043655915205.
[I 2025-11-03 15:51:12,054] Trial 120 finished with value: 0.08743414224277475 and parameters: {'model_type': 'graphsage', 'hidden_dims': '[512, 128]', 'dropout': 0.5490957041753466, 'batch_norm': True, 'lr': 0.0005667537174160393, 'weight_decay': 4.641406420081669e-07, 'epochs': 330, 'loss': 'mae', 'optimizer': 'adam', 'graph_mode': 'knn', 'source': 'grm', 'knn_k': 2, 'weighted_edges': True, 'symmetrize_mode': 'union', 'use_snp_selection': False}. Best is trial 72 with value: 0.11572043655915205.
[I 2025-11-03 15:51:19,090] Trial 121 finished with value: 0.09083532131202793 and parameters: {'model_type': 'graphsage', 'hidden_dims': '[512, 128]', 'dropout': 0.5695878227301976, 'batch_norm': True, 'lr': 0.0004952877827882638, 'weight_decay': 3.6011607604730724e-07, 'epochs': 299, 'loss': 'mae', 'optimizer': 'adam', 'graph_mode': 'knn', 'source': 'grm', 'knn_k': 1, 'weighted_edges': True, 'symmetrize_mode': 'union', 'use_snp_selection': False}. Best is trial 72 with value: 0.11572043655915205.
[I 2025-11-03 15:51:26,392] Trial 122 finished with value: 0.0940517141817812 and parameters: {'model_type': 'graphsage', 'hidden_dims': '[512, 128]', 'dropout': 0.5618946524406152, 'batch_norm': True, 'lr': 0.0004832219453960606, 'weight_decay': 3.1348715151925774e-07, 'epochs': 311, 'loss': 'mae', 'optimizer': 'adam', 'graph_mode': 'knn', 'source': 'grm', 'knn_k': 1, 'weighted_edges': True, 'symmetrize_mode': 'union', 'use_snp_selection': False}. Best is trial 72 with value: 0.11572043655915205.
[I 2025-11-03 15:51:33,304] Trial 123 finished with value: 0.098555497742008 and parameters: {'model_type': 'graphsage', 'hidden_dims': '[512, 128]', 'dropout': 0.5756568292467494, 'batch_norm': True, 'lr': 0.0006955559090781568, 'weight_decay': 2.4773388159948313e-07, 'epochs': 289, 'loss': 'mae', 'optimizer': 'adam', 'graph_mode': 'knn', 'source': 'grm', 'knn_k': 1, 'weighted_edges': True, 'symmetrize_mode': 'union', 'use_snp_selection': False}. Best is trial 72 with value: 0.11572043655915205.
[I 2025-11-03 15:51:40,511] Trial 124 finished with value: 0.09622062821520652 and parameters: {'model_type': 'graphsage', 'hidden_dims': '[512, 128]', 'dropout': 0.5371709183281266, 'batch_norm': True, 'lr': 0.0008497067697503059, 'weight_decay': 7.286134566644022e-07, 'epochs': 304, 'loss': 'mae', 'optimizer': 'adam', 'graph_mode': 'knn', 'source': 'grm', 'knn_k': 1, 'weighted_edges': True, 'symmetrize_mode': 'union', 'use_snp_selection': False}. Best is trial 72 with value: 0.11572043655915205.
[I 2025-11-03 15:51:47,292] Trial 125 finished with value: 0.0771838851630804 and parameters: {'model_type': 'graphsage', 'hidden_dims': '[512, 128]', 'dropout': 0.5896620632700234, 'batch_norm': True, 'lr': 0.0003946760239567301, 'weight_decay': 3.835605569192209e-07, 'epochs': 281, 'loss': 'mae', 'optimizer': 'adam', 'graph_mode': 'knn', 'source': 'grm', 'knn_k': 1, 'weighted_edges': True, 'symmetrize_mode': 'union', 'use_snp_selection': False}. Best is trial 72 with value: 0.11572043655915205.
[I 2025-11-03 15:51:49,308] Trial 126 finished with value: 0.047512890120040646 and parameters: {'model_type': 'graphsage', 'hidden_dims': '[512, 128]', 'dropout': 0.12817426367963633, 'batch_norm': False, 'lr': 0.0001781499500782249, 'weight_decay': 1.5506105250923538e-07, 'epochs': 102, 'loss': 'mse', 'optimizer': 'adam', 'graph_mode': 'knn', 'source': 'grm', 'knn_k': 1, 'weighted_edges': True, 'symmetrize_mode': 'union', 'use_snp_selection': True, 'num_snps': 7154}. Best is trial 72 with value: 0.11572043655915205.
[I 2025-11-03 15:51:53,553] Trial 127 finished with value: 0.0971291616137789 and parameters: {'model_type': 'graphsage', 'hidden_dims': '[256, 128, 64]', 'dropout': 0.5694456372734137, 'batch_norm': True, 'lr': 0.0004510195896203184, 'weight_decay': 3.1365032338420807e-07, 'epochs': 296, 'loss': 'mae', 'optimizer': 'adam', 'graph_mode': 'knn', 'source': 'grm', 'knn_k': 1, 'weighted_edges': True, 'symmetrize_mode': 'union', 'use_snp_selection': False}. Best is trial 72 with value: 0.11572043655915205.
[I 2025-11-03 15:52:00,478] Trial 128 finished with value: 0.0774818537246185 and parameters: {'model_type': 'graphsage', 'hidden_dims': '[512, 128]', 'dropout': 0.5563447565100037, 'batch_norm': True, 'lr': 0.0006120235106958849, 'weight_decay': 1.9649218804229294e-07, 'epochs': 275, 'loss': 'mae', 'optimizer': 'adam', 'graph_mode': 'knn', 'source': 'grm', 'knn_k': 2, 'weighted_edges': True, 'symmetrize_mode': 'union', 'use_snp_selection': False}. Best is trial 72 with value: 0.11572043655915205.
[I 2025-11-03 15:52:07,888] Trial 129 finished with value: 0.10333011862451252 and parameters: {'model_type': 'graphsage', 'hidden_dims': '[512, 128]', 'dropout': 0.5464457610849032, 'batch_norm': True, 'lr': 0.0003282987798025066, 'weight_decay': 8.993293021627978e-07, 'epochs': 317, 'loss': 'mae', 'optimizer': 'adam', 'graph_mode': 'knn', 'source': 'grm', 'knn_k': 1, 'weighted_edges': True, 'symmetrize_mode': 'union', 'use_snp_selection': False}. Best is trial 72 with value: 0.11572043655915205.
[I 2025-11-03 15:52:15,289] Trial 130 finished with value: 0.0977719928290332 and parameters: {'model_type': 'graphsage', 'hidden_dims': '[512, 128]', 'dropout': 0.5444568024796355, 'batch_norm': True, 'lr': 0.00031971743154828004, 'weight_decay': 1.0185206503069635e-06, 'epochs': 318, 'loss': 'mae', 'optimizer': 'adam', 'graph_mode': 'knn', 'source': 'grm', 'knn_k': 1, 'weighted_edges': True, 'symmetrize_mode': 'union', 'use_snp_selection': False}. Best is trial 72 with value: 0.11572043655915205.
[I 2025-11-03 15:52:22,440] Trial 131 finished with value: 0.10301554566737015 and parameters: {'model_type': 'graphsage', 'hidden_dims': '[512, 128]', 'dropout': 0.5798665912110214, 'batch_norm': True, 'lr': 0.0005162740270520277, 'weight_decay': 2.578789916930827e-07, 'epochs': 302, 'loss': 'mae', 'optimizer': 'adam', 'graph_mode': 'knn', 'source': 'grm', 'knn_k': 1, 'weighted_edges': True, 'symmetrize_mode': 'union', 'use_snp_selection': False}. Best is trial 72 with value: 0.11572043655915205.
[I 2025-11-03 15:52:29,958] Trial 132 finished with value: 0.1036952953451836 and parameters: {'model_type': 'graphsage', 'hidden_dims': '[512, 128]', 'dropout': 0.592238904794886, 'batch_norm': True, 'lr': 0.00036501712073663513, 'weight_decay': 3.568350977169292e-05, 'epochs': 324, 'loss': 'mae', 'optimizer': 'adam', 'graph_mode': 'knn', 'source': 'grm', 'knn_k': 1, 'weighted_edges': True, 'symmetrize_mode': 'union', 'use_snp_selection': False}. Best is trial 72 with value: 0.11572043655915205.
[I 2025-11-03 15:52:37,279] Trial 133 finished with value: 0.09400681207087042 and parameters: {'model_type': 'graphsage', 'hidden_dims': '[512, 128]', 'dropout': 0.5915968489063467, 'batch_norm': True, 'lr': 0.00021240554166941772, 'weight_decay': 3.2375871248642066e-05, 'epochs': 311, 'loss': 'mae', 'optimizer': 'adam', 'graph_mode': 'knn', 'source': 'grm', 'knn_k': 1, 'weighted_edges': True, 'symmetrize_mode': 'union', 'use_snp_selection': False}. Best is trial 72 with value: 0.11572043655915205.
[I 2025-11-03 15:52:44,750] Trial 134 finished with value: 0.07690852535063239 and parameters: {'model_type': 'graphsage', 'hidden_dims': '[512, 128]', 'dropout': 0.599638571888964, 'batch_norm': True, 'lr': 0.00026248709416108013, 'weight_decay': 3.6861500556286916e-05, 'epochs': 305, 'loss': 'mae', 'optimizer': 'adam', 'graph_mode': 'knn', 'source': 'grm', 'knn_k': 2, 'weighted_edges': True, 'symmetrize_mode': 'union', 'use_snp_selection': False}. Best is trial 72 with value: 0.11572043655915205.
[I 2025-11-03 15:52:52,252] Trial 135 finished with value: 0.0995623560913277 and parameters: {'model_type': 'graphsage', 'hidden_dims': '[512, 128]', 'dropout': 0.5785751199051352, 'batch_norm': True, 'lr': 0.0003793974878952305, 'weight_decay': 2.4862787393612804e-07, 'epochs': 323, 'loss': 'mae', 'optimizer': 'adam', 'graph_mode': 'knn', 'source': 'grm', 'knn_k': 1, 'weighted_edges': True, 'symmetrize_mode': 'union', 'use_snp_selection': False}. Best is trial 72 with value: 0.11572043655915205.
[I 2025-11-03 15:53:01,421] Trial 136 finished with value: 0.06644460483303972 and parameters: {'model_type': 'graphsage', 'hidden_dims': '[512, 128]', 'dropout': 0.5533629476267804, 'batch_norm': True, 'lr': 0.0003417965143718003, 'weight_decay': 1.2566860755163033e-07, 'epochs': 287, 'loss': 'mae', 'optimizer': 'adam', 'graph_mode': 'knn', 'source': 'grm', 'knn_k': 10, 'weighted_edges': False, 'symmetrize_mode': 'union', 'use_snp_selection': False}. Best is trial 72 with value: 0.11572043655915205.
[I 2025-11-03 15:53:11,692] Trial 137 finished with value: -0.003264989888868563 and parameters: {'model_type': 'graphsage', 'hidden_dims': '[512, 64]', 'dropout': 0.5250170578230327, 'batch_norm': True, 'lr': 1.337428173669777e-06, 'weight_decay': 1.9834456385485464e-05, 'epochs': 315, 'loss': 'mae', 'optimizer': 'adam', 'graph_mode': 'cutoff', 'cutoff': 0.21101621478764143, 'grm_norm': 'none', 'self_loops': False, 'use_snp_selection': False}. Best is trial 72 with value: 0.11572043655915205.
[I 2025-11-03 15:53:18,630] Trial 138 finished with value: 0.09234253975100358 and parameters: {'model_type': 'graphsage', 'hidden_dims': '[512, 128]', 'dropout': 0.5841254928181429, 'batch_norm': True, 'lr': 0.00029084062079629436, 'weight_decay': 6.286361511134584e-05, 'epochs': 293, 'loss': 'mae', 'optimizer': 'adam', 'graph_mode': 'knn', 'source': 'grm', 'knn_k': 1, 'weighted_edges': True, 'symmetrize_mode': 'union', 'use_snp_selection': False}. Best is trial 72 with value: 0.11572043655915205.
[I 2025-11-03 15:53:23,133] Trial 139 finished with value: 0.09198795940454427 and parameters: {'model_type': 'graphsage', 'hidden_dims': '[256, 128]', 'dropout': 0.2244494689882497, 'batch_norm': True, 'lr': 0.0004396526613581392, 'weight_decay': 5.3368564270792655e-06, 'epochs': 328, 'loss': 'mae', 'optimizer': 'adam', 'graph_mode': 'knn', 'source': 'grm', 'knn_k': 1, 'weighted_edges': True, 'symmetrize_mode': 'union', 'use_snp_selection': False}. Best is trial 72 with value: 0.11572043655915205.
[I 2025-11-03 15:53:26,015] Trial 140 finished with value: 0.07631471570713827 and parameters: {'model_type': 'graphsage', 'hidden_dims': '[128, 64]', 'dropout': 0.5386798043846812, 'batch_norm': True, 'lr': 0.0007355393347999256, 'weight_decay': 0.00010490832157286246, 'epochs': 303, 'loss': 'mae', 'optimizer': 'adam', 'graph_mode': 'knn', 'source': 'grm', 'knn_k': 2, 'weighted_edges': True, 'symmetrize_mode': 'mutual', 'use_snp_selection': False}. Best is trial 72 with value: 0.11572043655915205.
[I 2025-11-03 15:53:33,773] Trial 141 finished with value: 0.10533992787061001 and parameters: {'model_type': 'graphsage', 'hidden_dims': '[512, 128]', 'dropout': 0.5663112813829859, 'batch_norm': True, 'lr': 0.0005770493520221902, 'weight_decay': 8.767429749681744e-06, 'epochs': 337, 'loss': 'mae', 'optimizer': 'adam', 'graph_mode': 'knn', 'source': 'grm', 'knn_k': 1, 'weighted_edges': True, 'symmetrize_mode': 'union', 'use_snp_selection': False}. Best is trial 72 with value: 0.11572043655915205.
[I 2025-11-03 15:53:41,411] Trial 142 finished with value: 0.09350377683466893 and parameters: {'model_type': 'graphsage', 'hidden_dims': '[512, 128]', 'dropout': 0.5702522484161862, 'batch_norm': True, 'lr': 0.0005857874908331897, 'weight_decay': 1.6871165297392193e-05, 'epochs': 332, 'loss': 'mae', 'optimizer': 'adam', 'graph_mode': 'knn', 'source': 'grm', 'knn_k': 1, 'weighted_edges': True, 'symmetrize_mode': 'union', 'use_snp_selection': False}. Best is trial 72 with value: 0.11572043655915205.
