[I 2025-11-03 12:04:02,581] Trial 43 finished with value: 0.03244004188119071 and parameters: {'model_type': 'graphsage', 'hidden_dims': '[256, 128]', 'dropout': 0.48505735021388874, 'batch_norm': True, 'lr': 4.7304083862633295e-05, 'weight_decay': 1.729488764163361e-05, 'epochs': 95, 'loss': 'mse', 'optimizer': 'adam', 'graph_mode': 'knn', 'source': 'grm', 'knn_k': 7, 'weighted_edges': True, 'symmetrize_mode': 'union', 'use_snp_selection': False}. Best is trial 35 with value: 0.0779451337096595.
[I 2025-11-03 12:04:05,123] Trial 44 finished with value: 0.01919841351032912 and parameters: {'model_type': 'graphsage', 'hidden_dims': '[256, 128, 64]', 'dropout': 0.5765499681714832, 'batch_norm': True, 'lr': 2.8868941486670765e-05, 'weight_decay': 2.8307776236279067e-06, 'epochs': 146, 'loss': 'mse', 'optimizer': 'adam', 'graph_mode': 'knn', 'source': 'grm', 'knn_k': 6, 'weighted_edges': True, 'symmetrize_mode': 'union', 'use_snp_selection': False}. Best is trial 35 with value: 0.0779451337096595.
[I 2025-11-03 12:04:07,124] Trial 45 finished with value: 0.010252276655739835 and parameters: {'model_type': 'graphsage', 'hidden_dims': '[256, 128]', 'dropout': 0.5202716386438138, 'batch_norm': True, 'lr': 1.840676789394992e-05, 'weight_decay': 9.479003697566527e-06, 'epochs': 72, 'loss': 'mae', 'optimizer': 'adam', 'graph_mode': 'knn', 'source': 'grm', 'knn_k': 9, 'weighted_edges': True, 'symmetrize_mode': 'mutual', 'use_snp_selection': False}. Best is trial 35 with value: 0.0779451337096595.
[I 2025-11-03 12:04:08,597] Trial 46 finished with value: 0.07186228403521157 and parameters: {'model_type': 'graphsage', 'hidden_dims': '[128, 64]', 'dropout': 0.19191174878270298, 'batch_norm': True, 'lr': 0.0006376199749788896, 'weight_decay': 1.5088027796311063e-06, 'epochs': 58, 'loss': 'mse', 'optimizer': 'adam', 'graph_mode': 'cutoff', 'cutoff': 0.40790076288144383, 'grm_norm': 'cosine_then_gcn', 'self_loops': True, 'use_snp_selection': False}. Best is trial 35 with value: 0.0779451337096595.
[I 2025-11-03 12:04:10,820] Trial 47 finished with value: 0.044541190046420626 and parameters: {'model_type': 'graphsage', 'hidden_dims': '[128, 64]', 'dropout': 0.16394179844397158, 'batch_norm': False, 'lr': 0.0005292695974962006, 'weight_decay': 1.2378629442989845e-06, 'epochs': 54, 'loss': 'mae', 'optimizer': 'adam', 'graph_mode': 'cutoff', 'cutoff': 0.41945756976481774, 'grm_norm': 'cosine_then_gcn', 'self_loops': True, 'use_snp_selection': True, 'num_snps': 28991}. Best is trial 35 with value: 0.0779451337096595.
[I 2025-11-03 12:04:12,367] Trial 48 finished with value: 0.04407850273249682 and parameters: {'model_type': 'graphsage', 'hidden_dims': '[128, 64]', 'dropout': 0.2600165056426841, 'batch_norm': True, 'lr': 0.0005982198617671481, 'weight_decay': 4.311701449826277e-07, 'epochs': 66, 'loss': 'mse', 'optimizer': 'adam', 'graph_mode': 'cutoff', 'cutoff': 0.23736779696055169, 'grm_norm': 'cosine_then_gcn', 'self_loops': True, 'use_snp_selection': False}. Best is trial 35 with value: 0.0779451337096595.
[I 2025-11-03 12:04:15,570] Trial 49 finished with value: 0.039966893716230155 and parameters: {'model_type': 'graphsage', 'hidden_dims': '[128, 64]', 'dropout': 0.42464273708099204, 'batch_norm': False, 'lr': 0.0003565789556591418, 'weight_decay': 4.721338721874944e-07, 'epochs': 307, 'loss': 'mse', 'optimizer': 'adam', 'graph_mode': 'cutoff', 'cutoff': 0.44339568121713935, 'grm_norm': 'cosine_then_gcn', 'self_loops': True, 'use_snp_selection': True, 'num_snps': 34744}. Best is trial 35 with value: 0.0779451337096595.
[I 2025-11-03 12:04:18,090] Trial 50 finished with value: -0.007423586992008914 and parameters: {'model_type': 'graphsage', 'hidden_dims': '[512, 256]', 'dropout': 0.24461165045127164, 'batch_norm': False, 'lr': 1.6232899351822286e-06, 'weight_decay': 0.00014762359827789453, 'epochs': 83, 'loss': 'mse', 'optimizer': 'adam', 'graph_mode': 'cutoff', 'cutoff': 0.3769718999724775, 'grm_norm': 'cosine_then_gcn', 'self_loops': True, 'use_snp_selection': True, 'num_snps': 24537}. Best is trial 35 with value: 0.0779451337096595.
[I 2025-11-03 12:04:20,151] Trial 51 finished with value: 0.0493475707469844 and parameters: {'model_type': 'graphsage', 'hidden_dims': '[256, 128, 64]', 'dropout': 0.14054857443194282, 'batch_norm': True, 'lr': 0.0007943632911513716, 'weight_decay': 5.247884273322084e-06, 'epochs': 109, 'loss': 'mse', 'optimizer': 'adam', 'graph_mode': 'cutoff', 'cutoff': 0.5249136657776756, 'grm_norm': 'gcn', 'self_loops': True, 'use_snp_selection': False}. Best is trial 35 with value: 0.0779451337096595.
[I 2025-11-03 12:04:22,098] Trial 52 finished with value: 0.01293989893731005 and parameters: {'model_type': 'graphsage', 'hidden_dims': '[128, 64]', 'dropout': 0.4939827527192969, 'batch_norm': True, 'lr': 9.67658350972499e-06, 'weight_decay': 1.4011875199250878e-06, 'epochs': 192, 'loss': 'mse', 'optimizer': 'adam', 'graph_mode': 'cutoff', 'cutoff': 0.2135018545626602, 'grm_norm': 'cosine', 'self_loops': True, 'use_snp_selection': False}. Best is trial 35 with value: 0.0779451337096595.
[I 2025-11-03 12:04:24,251] Trial 53 finished with value: 0.05286045934210667 and parameters: {'model_type': 'graphsage', 'hidden_dims': '[256, 128]', 'dropout': 0.20323578514588053, 'batch_norm': True, 'lr': 0.000980739238602684, 'weight_decay': 4.941710760906022e-05, 'epochs': 95, 'loss': 'mse', 'optimizer': 'adam', 'graph_mode': 'knn', 'source': 'grm', 'knn_k': 5, 'weighted_edges': True, 'symmetrize_mode': 'union', 'use_snp_selection': False}. Best is trial 35 with value: 0.0779451337096595.
[I 2025-11-03 12:04:26,583] Trial 54 finished with value: 0.012811378762801202 and parameters: {'model_type': 'graphsage', 'hidden_dims': '[256, 128, 64]', 'dropout': 0.5705093459692578, 'batch_norm': True, 'lr': 8.746858700289804e-05, 'weight_decay': 3.3724389902877658e-06, 'epochs': 120, 'loss': 'mse', 'optimizer': 'adam', 'graph_mode': 'knn', 'source': 'grm', 'knn_k': 10, 'weighted_edges': False, 'symmetrize_mode': 'mutual', 'use_snp_selection': False}. Best is trial 35 with value: 0.0779451337096595.
[I 2025-11-03 12:04:29,094] Trial 55 finished with value: 0.0453862634587133 and parameters: {'model_type': 'graphsage', 'hidden_dims': '[512, 128]', 'dropout': 0.33353891675621594, 'batch_norm': True, 'lr': 5.4645974877327005e-06, 'weight_decay': 3.0662045468631415e-05, 'epochs': 52, 'loss': 'mse', 'optimizer': 'adam', 'graph_mode': 'cutoff', 'cutoff': 0.7532977027140237, 'grm_norm': 'cosine_then_gcn', 'self_loops': True, 'use_snp_selection': False}. Best is trial 35 with value: 0.0779451337096595.
[I 2025-11-03 12:04:32,915] Trial 56 finished with value: 0.043623097619449734 and parameters: {'model_type': 'graphsage', 'hidden_dims': '[128, 64]', 'dropout': 0.46899330905561565, 'batch_norm': False, 'lr': 0.0001497394885319628, 'weight_decay': 6.927622261066153e-06, 'epochs': 135, 'loss': 'mae', 'optimizer': 'adam', 'graph_mode': 'knn', 'source': 'grm', 'knn_k': 8, 'weighted_edges': True, 'symmetrize_mode': 'union', 'use_snp_selection': True, 'num_snps': 59205}. Best is trial 35 with value: 0.0779451337096595.
[I 2025-11-03 12:04:36,273] Trial 57 finished with value: 0.033791132423190436 and parameters: {'model_type': 'graphsage', 'hidden_dims': '[256, 128, 64]', 'dropout': 0.532849464292901, 'batch_norm': False, 'lr': 2.1587785968103638e-05, 'weight_decay': 1.672865354411576e-05, 'epochs': 87, 'loss': 'mse', 'optimizer': 'adam', 'graph_mode': 'knn', 'source': 'grm', 'knn_k': 4, 'weighted_edges': False, 'symmetrize_mode': 'mutual', 'use_snp_selection': True, 'num_snps': 50278}. Best is trial 35 with value: 0.0779451337096595.
[I 2025-11-03 12:04:39,128] Trial 58 finished with value: 0.04111237494879364 and parameters: {'model_type': 'graphsage', 'hidden_dims': '[512, 128]', 'dropout': 0.45029147650749035, 'batch_norm': True, 'lr': 1.3257508210270295e-05, 'weight_decay': 6.413179266079909e-05, 'epochs': 73, 'loss': 'mse', 'optimizer': 'adam', 'graph_mode': 'knn', 'source': 'grm', 'knn_k': 7, 'weighted_edges': False, 'symmetrize_mode': 'mutual', 'use_snp_selection': False}. Best is trial 35 with value: 0.0779451337096595.
[I 2025-11-03 12:04:42,563] Trial 59 finished with value: 0.018925043549678836 and parameters: {'model_type': 'graphsage', 'hidden_dims': '[512, 256]', 'dropout': 0.5999695978373081, 'batch_norm': False, 'lr': 0.00027816045657456045, 'weight_decay': 2.3065718289719523e-05, 'epochs': 176, 'loss': 'mse', 'optimizer': 'adam', 'graph_mode': 'cutoff', 'cutoff': 0.5815688044496978, 'grm_norm': 'cosine_then_gcn', 'self_loops': True, 'use_snp_selection': True, 'num_snps': 33632}. Best is trial 35 with value: 0.0779451337096595.
[I 2025-11-03 12:04:44,886] Trial 60 finished with value: 0.029543645602103447 and parameters: {'model_type': 'graphsage', 'hidden_dims': '[256, 128]', 'dropout': 0.5564258815611913, 'batch_norm': True, 'lr': 0.00011916562091399592, 'weight_decay': 1.3639860432374267e-05, 'epochs': 108, 'loss': 'mse', 'optimizer': 'adam', 'graph_mode': 'knn', 'source': 'grm', 'knn_k': 6, 'weighted_edges': True, 'symmetrize_mode': 'union', 'use_snp_selection': False}. Best is trial 35 with value: 0.0779451337096595.
[I 2025-11-03 12:04:48,502] Trial 61 finished with value: 0.04827103944711091 and parameters: {'model_type': 'graphsage', 'hidden_dims': '[512, 128]', 'dropout': 0.4791458799743154, 'batch_norm': True, 'lr': 5.463709364890184e-05, 'weight_decay': 3.716303783692057e-05, 'epochs': 142, 'loss': 'mse', 'optimizer': 'adam', 'graph_mode': 'knn', 'source': 'grm', 'knn_k': 6, 'weighted_edges': True, 'symmetrize_mode': 'union', 'use_snp_selection': False}. Best is trial 35 with value: 0.0779451337096595.
[I 2025-11-03 12:04:52,223] Trial 62 finished with value: 0.04024396510723597 and parameters: {'model_type': 'graphsage', 'hidden_dims': '[512, 128]', 'dropout': 0.4372241818577748, 'batch_norm': True, 'lr': 3.25921686378105e-05, 'weight_decay': 3.726708397985135e-05, 'epochs': 157, 'loss': 'mse', 'optimizer': 'adam', 'graph_mode': 'knn', 'source': 'grm', 'knn_k': 5, 'weighted_edges': True, 'symmetrize_mode': 'union', 'use_snp_selection': False}. Best is trial 35 with value: 0.0779451337096595.
[I 2025-11-03 12:04:55,523] Trial 63 finished with value: 0.046274018584825306 and parameters: {'model_type': 'graphsage', 'hidden_dims': '[512, 128]', 'dropout': 0.41209839047092267, 'batch_norm': True, 'lr': 5.1653936123097627e-05, 'weight_decay': 4.272639198011382e-06, 'epochs': 120, 'loss': 'mse', 'optimizer': 'adam', 'graph_mode': 'knn', 'source': 'grm', 'knn_k': 4, 'weighted_edges': True, 'symmetrize_mode': 'union', 'use_snp_selection': False}. Best is trial 35 with value: 0.0779451337096595.
[I 2025-11-03 12:04:59,035] Trial 64 finished with value: 0.04412062428060106 and parameters: {'model_type': 'graphsage', 'hidden_dims': '[512, 128]', 'dropout': 0.37775746518015196, 'batch_norm': True, 'lr': 4.177726667537931e-05, 'weight_decay': 2.8518613956945474e-05, 'epochs': 132, 'loss': 'mse', 'optimizer': 'adam', 'graph_mode': 'knn', 'source': 'grm', 'knn_k': 6, 'weighted_edges': False, 'symmetrize_mode': 'union', 'use_snp_selection': False}. Best is trial 35 with value: 0.0779451337096595.
[I 2025-11-03 12:05:03,114] Trial 65 finished with value: 0.018662469647395128 and parameters: {'model_type': 'graphsage', 'hidden_dims': '[512, 128]', 'dropout': 0.5063713814428087, 'batch_norm': False, 'lr': 7.648373384685404e-05, 'weight_decay': 0.00045013444938012907, 'epochs': 164, 'loss': 'mse', 'optimizer': 'adam', 'graph_mode': 'knn', 'source': 'grm', 'knn_k': 7, 'weighted_edges': True, 'symmetrize_mode': 'mutual', 'use_snp_selection': True, 'num_snps': 41182}. Best is trial 35 with value: 0.0779451337096595.
[I 2025-11-03 12:05:06,600] Trial 66 finished with value: 0.0275194190214906 and parameters: {'model_type': 'graphsage', 'hidden_dims': '[512, 128]', 'dropout': 0.4553035393815317, 'batch_norm': True, 'lr': 6.353795017392501e-05, 'weight_decay': 9.841652753730635e-06, 'epochs': 149, 'loss': 'mse', 'optimizer': 'adam', 'graph_mode': 'knn', 'source': 'grm', 'knn_k': 2, 'weighted_edges': False, 'symmetrize_mode': 'mutual', 'use_snp_selection': False}. Best is trial 35 with value: 0.0779451337096595.
[I 2025-11-03 12:05:08,562] Trial 67 finished with value: -0.046764117411079414 and parameters: {'model_type': 'graphsage', 'hidden_dims': '[256, 128, 64]', 'dropout': 0.39399704561968985, 'batch_norm': True, 'lr': 1.9180768529921498e-05, 'weight_decay': 2.538961532959002e-06, 'epochs': 63, 'loss': 'mse', 'optimizer': 'adam', 'graph_mode': 'knn', 'source': 'grm', 'knn_k': 5, 'weighted_edges': False, 'symmetrize_mode': 'union', 'use_snp_selection': False}. Best is trial 35 with value: 0.0779451337096595.
[I 2025-11-03 12:05:11,347] Trial 68 finished with value: 0.027475754531026287 and parameters: {'model_type': 'graphsage', 'hidden_dims': '[256, 128]', 'dropout': 0.4394616163615811, 'batch_norm': False, 'lr': 0.00010067009335111385, 'weight_decay': 6.572454055974054e-07, 'epochs': 204, 'loss': 'mae', 'optimizer': 'adam', 'graph_mode': 'knn', 'source': 'grm', 'knn_k': 8, 'weighted_edges': True, 'symmetrize_mode': 'mutual', 'use_snp_selection': True, 'num_snps': 26619}. Best is trial 35 with value: 0.0779451337096595.
[I 2025-11-03 12:05:14,614] Trial 69 finished with value: 0.0019391464980607867 and parameters: {'model_type': 'graphsage', 'hidden_dims': '[512, 128]', 'dropout': 0.49937818402255685, 'batch_norm': True, 'lr': 2.950229894151507e-06, 'weight_decay': 7.693424171349115e-05, 'epochs': 100, 'loss': 'mse', 'optimizer': 'adam', 'graph_mode': 'knn', 'source': 'grm', 'knn_k': 6, 'weighted_edges': False, 'symmetrize_mode': 'union', 'use_snp_selection': False}. Best is trial 35 with value: 0.0779451337096595.
[I 2025-11-03 12:05:16,893] Trial 70 finished with value: 0.021060834991834494 and parameters: {'model_type': 'graphsage', 'hidden_dims': '[512, 64]', 'dropout': 0.5415110269274869, 'batch_norm': False, 'lr': 8.726375010678138e-06, 'weight_decay': 0.00014915599362756428, 'epochs': 123, 'loss': 'mse', 'optimizer': 'adam', 'graph_mode': 'knn', 'source': 'grm', 'knn_k': 4, 'weighted_edges': True, 'symmetrize_mode': 'mutual', 'use_snp_selection': True, 'num_snps': 16941}. Best is trial 35 with value: 0.0779451337096595.
[I 2025-11-03 12:05:21,866] Trial 71 finished with value: 0.06868211587902662 and parameters: {'model_type': 'graphsage', 'hidden_dims': '[512, 128]', 'dropout': 0.32817409490937544, 'batch_norm': True, 'lr': 0.00040912588108896224, 'weight_decay': 7.303092054177588e-06, 'epochs': 250, 'loss': 'mse', 'optimizer': 'adam', 'graph_mode': 'knn', 'source': 'grm', 'knn_k': 8, 'weighted_edges': True, 'symmetrize_mode': 'union', 'use_snp_selection': False}. Best is trial 35 with value: 0.0779451337096595.
[I 2025-11-03 12:05:26,441] Trial 72 finished with value: 0.059204198501300306 and parameters: {'model_type': 'graphsage', 'hidden_dims': '[512, 128]', 'dropout': 0.2335364389087833, 'batch_norm': True, 'lr': 0.00036600192615446965, 'weight_decay': 1.540774599398203e-06, 'epochs': 213, 'loss': 'mse', 'optimizer': 'adam', 'graph_mode': 'knn', 'source': 'grm', 'knn_k': 9, 'weighted_edges': True, 'symmetrize_mode': 'union', 'use_snp_selection': False}. Best is trial 35 with value: 0.0779451337096595.
[I 2025-11-03 12:05:30,645] Trial 73 finished with value: 0.05469733369392875 and parameters: {'model_type': 'graphsage', 'hidden_dims': '[512, 128]', 'dropout': 0.18051870996458683, 'batch_norm': True, 'lr': 0.0005105953138497569, 'weight_decay': 6.762179412667757e-06, 'epochs': 185, 'loss': 'mse', 'optimizer': 'adam', 'graph_mode': 'knn', 'source': 'grm', 'knn_k': 8, 'weighted_edges': True, 'symmetrize_mode': 'union', 'use_snp_selection': False}. Best is trial 35 with value: 0.0779451337096595.
[I 2025-11-03 12:05:35,978] Trial 74 finished with value: 0.04578268884800771 and parameters: {'model_type': 'graphsage', 'hidden_dims': '[512, 128]', 'dropout': 0.35535422823085383, 'batch_norm': True, 'lr': 0.000213701922789726, 'weight_decay': 1.3412827000808674e-05, 'epochs': 296, 'loss': 'mse', 'optimizer': 'adam', 'graph_mode': 'knn', 'source': 'grm', 'knn_k': 7, 'weighted_edges': True, 'symmetrize_mode': 'union', 'use_snp_selection': False}. Best is trial 35 with value: 0.0779451337096595.
[I 2025-11-03 12:05:38,663] Trial 75 finished with value: 0.06250055276374829 and parameters: {'model_type': 'graphsage', 'hidden_dims': '[128, 64]', 'dropout': 0.288153446746539, 'batch_norm': True, 'lr': 0.0004289701771134461, 'weight_decay': 5.855653135434748e-05, 'epochs': 244, 'loss': 'mse', 'optimizer': 'adam', 'graph_mode': 'knn', 'source': 'grm', 'knn_k': 10, 'weighted_edges': True, 'symmetrize_mode': 'union', 'use_snp_selection': False}. Best is trial 35 with value: 0.0779451337096595.
[I 2025-11-03 12:05:41,377] Trial 76 finished with value: 0.07457643797102825 and parameters: {'model_type': 'graphsage', 'hidden_dims': '[128, 64]', 'dropout': 0.2907562816571385, 'batch_norm': True, 'lr': 0.0004509988780051739, 'weight_decay': 4.919258979680999e-05, 'epochs': 246, 'loss': 'mse', 'optimizer': 'adam', 'graph_mode': 'knn', 'source': 'grm', 'knn_k': 10, 'weighted_edges': False, 'symmetrize_mode': 'union', 'use_snp_selection': False}. Best is trial 35 with value: 0.0779451337096595.
[I 2025-11-03 12:05:44,077] Trial 77 finished with value: 0.08732210053952931 and parameters: {'model_type': 'graphsage', 'hidden_dims': '[128, 64]', 'dropout': 0.27353839155904996, 'batch_norm': True, 'lr': 0.00039912245686195844, 'weight_decay': 5.346247066901226e-05, 'epochs': 244, 'loss': 'mse', 'optimizer': 'adam', 'graph_mode': 'knn', 'source': 'grm', 'knn_k': 10, 'weighted_edges': False, 'symmetrize_mode': 'union', 'use_snp_selection': False}. Best is trial 77 with value: 0.08732210053952931.
[I 2025-11-03 12:05:46,816] Trial 78 finished with value: 0.062242929958701336 and parameters: {'model_type': 'graphsage', 'hidden_dims': '[128, 64]', 'dropout': 0.29335261717856104, 'batch_norm': True, 'lr': 0.000300475285098513, 'weight_decay': 5.251648664703859e-05, 'epochs': 251, 'loss': 'mse', 'optimizer': 'adam', 'graph_mode': 'knn', 'source': 'grm', 'knn_k': 10, 'weighted_edges': False, 'symmetrize_mode': 'union', 'use_snp_selection': False}. Best is trial 77 with value: 0.08732210053952931.
[I 2025-11-03 12:05:49,549] Trial 79 finished with value: 0.05291930706647298 and parameters: {'model_type': 'graphsage', 'hidden_dims': '[128, 64]', 'dropout': 0.32150112461827296, 'batch_norm': True, 'lr': 0.00046749585794350103, 'weight_decay': 0.0001000089257942084, 'epochs': 254, 'loss': 'mse', 'optimizer': 'adam', 'graph_mode': 'knn', 'source': 'grm', 'knn_k': 10, 'weighted_edges': False, 'symmetrize_mode': 'union', 'use_snp_selection': False}. Best is trial 77 with value: 0.08732210053952931.
[I 2025-11-03 12:05:51,643] Trial 80 finished with value: 0.05029799834532131 and parameters: {'model_type': 'graphsage', 'hidden_dims': '[128, 64]', 'dropout': 0.268568180374096, 'batch_norm': True, 'lr': 0.0004377291252512619, 'weight_decay': 2.2184590513906145e-05, 'epochs': 242, 'loss': 'mse', 'optimizer': 'adam', 'graph_mode': 'cutoff', 'cutoff': 0.47233361121365014, 'grm_norm': 'cosine', 'self_loops': True, 'use_snp_selection': False}. Best is trial 77 with value: 0.08732210053952931.
[I 2025-11-03 12:05:54,492] Trial 81 finished with value: 0.05708661471360657 and parameters: {'model_type': 'graphsage', 'hidden_dims': '[128, 64]', 'dropout': 0.3142198691870617, 'batch_norm': True, 'lr': 0.000659786983967484, 'weight_decay': 5.896069385520064e-05, 'epochs': 275, 'loss': 'mse', 'optimizer': 'adam', 'graph_mode': 'knn', 'source': 'grm', 'knn_k': 10, 'weighted_edges': False, 'symmetrize_mode': 'union', 'use_snp_selection': False}. Best is trial 77 with value: 0.08732210053952931.
[I 2025-11-03 12:05:57,025] Trial 82 finished with value: 0.06257725292878029 and parameters: {'model_type': 'graphsage', 'hidden_dims': '[128, 64]', 'dropout': 0.2755120376113387, 'batch_norm': True, 'lr': 0.0003220777971127383, 'weight_decay': 4.2663871058111824e-05, 'epochs': 228, 'loss': 'mse', 'optimizer': 'adam', 'graph_mode': 'knn', 'source': 'grm', 'knn_k': 9, 'weighted_edges': False, 'symmetrize_mode': 'union', 'use_snp_selection': False}. Best is trial 77 with value: 0.08732210053952931.
[I 2025-11-03 12:05:59,542] Trial 83 finished with value: 0.05358014149285756 and parameters: {'model_type': 'graphsage', 'hidden_dims': '[128, 64]', 'dropout': 0.28546521034549516, 'batch_norm': True, 'lr': 0.0004044836900040968, 'weight_decay': 8.417208741610355e-05, 'epochs': 233, 'loss': 'mse', 'optimizer': 'adam', 'graph_mode': 'knn', 'source': 'grm', 'knn_k': 9, 'weighted_edges': False, 'symmetrize_mode': 'union', 'use_snp_selection': False}. Best is trial 77 with value: 0.08732210053952931.
[I 2025-11-03 12:06:02,267] Trial 84 finished with value: 0.03887052437654474 and parameters: {'model_type': 'graphsage', 'hidden_dims': '[128, 64]', 'dropout': 0.25848323047407396, 'batch_norm': True, 'lr': 0.0008205757983131832, 'weight_decay': 4.796112682020429e-05, 'epochs': 268, 'loss': 'mse', 'optimizer': 'adam', 'graph_mode': 'knn', 'source': 'grm', 'knn_k': 9, 'weighted_edges': False, 'symmetrize_mode': 'union', 'use_snp_selection': False}. Best is trial 77 with value: 0.08732210053952931.
[I 2025-11-03 12:06:04,855] Trial 85 finished with value: 0.06051342649636626 and parameters: {'model_type': 'graphsage', 'hidden_dims': '[128, 64]', 'dropout': 0.27643211118268074, 'batch_norm': True, 'lr': 0.0003137855603470832, 'weight_decay': 0.00015320226310061312, 'epochs': 227, 'loss': 'mse', 'optimizer': 'adam', 'graph_mode': 'knn', 'source': 'grm', 'knn_k': 10, 'weighted_edges': False, 'symmetrize_mode': 'union', 'use_snp_selection': False}. Best is trial 77 with value: 0.08732210053952931.
