[I 2025-11-03 13:58:34,273] Trial 15 finished with value: 0.018194444534595712 and parameters: {'model_type': 'graphsage', 'hidden_dims': '[512, 64]', 'dropout': 0.5966139043150231, 'batch_norm': True, 'lr': 3.941816400215875e-06, 'weight_decay': 5.3911274877625476e-06, 'epochs': 269, 'loss': 'mse', 'optimizer': 'adam', 'graph_mode': 'cutoff', 'cutoff': 0.700008243195548, 'grm_norm': 'cosine', 'self_loops': False, 'use_snp_selection': False}. Best is trial 11 with value: 0.08290441338579799.
[I 2025-11-03 13:58:39,293] Trial 16 finished with value: 0.07677993269651211 and parameters: {'model_type': 'graphsage', 'hidden_dims': '[256, 128, 64]', 'dropout': 0.19002765538727348, 'batch_norm': True, 'lr': 2.2409738695048403e-05, 'weight_decay': 3.939158144371285e-07, 'epochs': 320, 'loss': 'mae', 'optimizer': 'adam', 'graph_mode': 'cutoff', 'cutoff': 0.44543870555027765, 'grm_norm': 'none', 'self_loops': True, 'use_snp_selection': False}. Best is trial 11 with value: 0.08290441338579799.
[I 2025-11-03 13:58:45,252] Trial 17 finished with value: 0.041913887687614663 and parameters: {'model_type': 'graphsage', 'hidden_dims': '[512, 128]', 'dropout': 0.4337768631587977, 'batch_norm': True, 'lr': 6.346599103005697e-05, 'weight_decay': 7.4244179631570506e-06, 'epochs': 196, 'loss': 'mse', 'optimizer': 'adam', 'graph_mode': 'knn', 'source': 'grm', 'knn_k': 4, 'weighted_edges': False, 'symmetrize_mode': 'union', 'use_snp_selection': False}. Best is trial 11 with value: 0.08290441338579799.
[I 2025-11-03 13:58:51,174] Trial 18 finished with value: 0.04721726635261387 and parameters: {'model_type': 'graphsage', 'hidden_dims': '[512, 256]', 'dropout': 0.15863399887461743, 'batch_norm': True, 'lr': 2.0333275007608283e-05, 'weight_decay': 8.2766143075351e-05, 'epochs': 243, 'loss': 'mse', 'optimizer': 'adam', 'graph_mode': 'cutoff', 'cutoff': 0.7074628960861822, 'grm_norm': 'cosine_then_gcn', 'self_loops': False, 'use_snp_selection': False}. Best is trial 11 with value: 0.08290441338579799.
[I 2025-11-03 13:58:58,205] Trial 19 finished with value: 0.05968513529447079 and parameters: {'model_type': 'graphsage', 'hidden_dims': '[512, 256]', 'dropout': 0.2735396040401765, 'batch_norm': True, 'lr': 0.000208608004252853, 'weight_decay': 0.0001902697414774843, 'epochs': 196, 'loss': 'mae', 'optimizer': 'adam', 'graph_mode': 'knn', 'source': 'grm', 'knn_k': 10, 'weighted_edges': True, 'symmetrize_mode': 'union', 'use_snp_selection': False}. Best is trial 11 with value: 0.08290441338579799.
[I 2025-11-03 13:59:01,873] Trial 20 finished with value: 0.006350447308378699 and parameters: {'model_type': 'graphsage', 'hidden_dims': '[512, 256]', 'dropout': 0.3544041004882811, 'batch_norm': True, 'lr': 1.5825920569852538e-06, 'weight_decay': 1.328170963180864e-06, 'epochs': 97, 'loss': 'mse', 'optimizer': 'adam', 'graph_mode': 'cutoff', 'cutoff': 0.5095587587193762, 'grm_norm': 'gcn', 'self_loops': True, 'use_snp_selection': False}. Best is trial 11 with value: 0.08290441338579799.
[I 2025-11-03 13:59:07,484] Trial 21 finished with value: 0.05447641209323527 and parameters: {'model_type': 'graphsage', 'hidden_dims': '[512, 256]', 'dropout': 0.37334490395053427, 'batch_norm': True, 'lr': 0.00025869753876340136, 'weight_decay': 1.6267284920975185e-05, 'epochs': 214, 'loss': 'mae', 'optimizer': 'adam', 'graph_mode': 'knn', 'source': 'grm', 'knn_k': 1, 'weighted_edges': True, 'symmetrize_mode': 'mutual', 'use_snp_selection': False}. Best is trial 11 with value: 0.08290441338579799.
[I 2025-11-03 13:59:13,823] Trial 22 finished with value: 0.0719987504114171 and parameters: {'model_type': 'graphsage', 'hidden_dims': '[512, 256]', 'dropout': 0.32107150903935167, 'batch_norm': True, 'lr': 0.0009504256200287419, 'weight_decay': 1.3983453065394456e-05, 'epochs': 252, 'loss': 'mae', 'optimizer': 'adam', 'graph_mode': 'knn', 'source': 'grm', 'knn_k': 2, 'weighted_edges': True, 'symmetrize_mode': 'mutual', 'use_snp_selection': False}. Best is trial 11 with value: 0.08290441338579799.
[I 2025-11-03 13:59:21,661] Trial 23 finished with value: 0.04565865633146549 and parameters: {'model_type': 'graphsage', 'hidden_dims': '[512, 256]', 'dropout': 0.4703840332369766, 'batch_norm': True, 'lr': 0.00014225168590649236, 'weight_decay': 2.9810908049603094e-05, 'epochs': 303, 'loss': 'mae', 'optimizer': 'adam', 'graph_mode': 'knn', 'source': 'grm', 'knn_k': 3, 'weighted_edges': True, 'symmetrize_mode': 'union', 'use_snp_selection': False}. Best is trial 11 with value: 0.08290441338579799.
[I 2025-11-03 13:59:26,530] Trial 24 finished with value: 0.059698331884311395 and parameters: {'model_type': 'graphsage', 'hidden_dims': '[512, 256]', 'dropout': 0.3501430009945521, 'batch_norm': True, 'lr': 0.00031183221362854547, 'weight_decay': 3.0336621085979384e-06, 'epochs': 167, 'loss': 'mae', 'optimizer': 'adam', 'graph_mode': 'knn', 'source': 'grm', 'knn_k': 1, 'weighted_edges': True, 'symmetrize_mode': 'mutual', 'use_snp_selection': False}. Best is trial 11 with value: 0.08290441338579799.
[I 2025-11-03 13:59:30,358] Trial 25 finished with value: 0.0707417333574064 and parameters: {'model_type': 'graphsage', 'hidden_dims': '[256, 128, 64]', 'dropout': 0.39685499316223427, 'batch_norm': True, 'lr': 4.8162107716406836e-05, 'weight_decay': 0.000449389981710027, 'epochs': 214, 'loss': 'mae', 'optimizer': 'adam', 'graph_mode': 'knn', 'source': 'grm', 'knn_k': 5, 'weighted_edges': False, 'symmetrize_mode': 'mutual', 'use_snp_selection': False}. Best is trial 11 with value: 0.08290441338579799.
[I 2025-11-03 13:59:38,850] Trial 26 finished with value: 0.06049074288982857 and parameters: {'model_type': 'graphsage', 'hidden_dims': '[512, 128]', 'dropout': 0.26846010033471246, 'batch_norm': False, 'lr': 0.00013468618914733727, 'weight_decay': 8.285700753750502e-06, 'epochs': 262, 'loss': 'mae', 'optimizer': 'adam', 'graph_mode': 'knn', 'source': 'grm', 'knn_k': 2, 'weighted_edges': True, 'symmetrize_mode': 'union', 'use_snp_selection': True, 'num_snps': 59005}. Best is trial 11 with value: 0.08290441338579799.
[I 2025-11-03 13:59:41,617] Trial 27 finished with value: 0.062233151777730006 and parameters: {'model_type': 'graphsage', 'hidden_dims': '[256, 128]', 'dropout': 0.16989830283646706, 'batch_norm': True, 'lr': 2.1831409694255255e-05, 'weight_decay': 0.000109760479900398, 'epochs': 134, 'loss': 'mae', 'optimizer': 'adam', 'graph_mode': 'knn', 'source': 'grm', 'knn_k': 2, 'weighted_edges': True, 'symmetrize_mode': 'mutual', 'use_snp_selection': False}. Best is trial 11 with value: 0.08290441338579799.
[I 2025-11-03 13:59:46,483] Trial 28 finished with value: 0.06843259851546049 and parameters: {'model_type': 'graphsage', 'hidden_dims': '[512, 64]', 'dropout': 0.44822410791224665, 'batch_norm': True, 'lr': 8.07214556000928e-05, 'weight_decay': 3.9941100340228784e-05, 'epochs': 175, 'loss': 'mse', 'optimizer': 'adam', 'graph_mode': 'cutoff', 'cutoff': 0.7613419213869919, 'grm_norm': 'gcn', 'self_loops': False, 'use_snp_selection': False}. Best is trial 11 with value: 0.08290441338579799.
[I 2025-11-03 13:59:50,626] Trial 29 finished with value: 0.06253117588148846 and parameters: {'model_type': 'graphsage', 'hidden_dims': '[128, 64]', 'dropout': 0.2121274797039934, 'batch_norm': True, 'lr': 0.0001894222325740051, 'weight_decay': 3.772236595817027e-05, 'epochs': 225, 'loss': 'mae', 'optimizer': 'adam', 'graph_mode': 'knn', 'source': 'grm', 'knn_k': 9, 'weighted_edges': True, 'symmetrize_mode': 'union', 'use_snp_selection': False}. Best is trial 11 with value: 0.08290441338579799.
[I 2025-11-03 13:59:59,437] Trial 30 finished with value: 0.012214182565830154 and parameters: {'model_type': 'graphsage', 'hidden_dims': '[512, 256]', 'dropout': 0.2448090411520119, 'batch_norm': True, 'lr': 3.0275376902620186e-06, 'weight_decay': 0.0009392240944351203, 'epochs': 332, 'loss': 'mae', 'optimizer': 'adam', 'graph_mode': 'knn', 'source': 'grm', 'knn_k': 5, 'weighted_edges': False, 'symmetrize_mode': 'union', 'use_snp_selection': False}. Best is trial 11 with value: 0.08290441338579799.
[I 2025-11-03 14:00:04,551] Trial 31 finished with value: 0.03431651474198944 and parameters: {'model_type': 'graphsage', 'hidden_dims': '[256, 128, 64]', 'dropout': 0.1831388644290863, 'batch_norm': True, 'lr': 2.3429975749741424e-05, 'weight_decay': 1.0439801987206942e-07, 'epochs': 332, 'loss': 'mae', 'optimizer': 'adam', 'graph_mode': 'cutoff', 'cutoff': 0.449275992003849, 'grm_norm': 'none', 'self_loops': True, 'use_snp_selection': False}. Best is trial 11 with value: 0.08290441338579799.
[I 2025-11-03 14:00:09,599] Trial 32 finished with value: 0.05229298868218067 and parameters: {'model_type': 'graphsage', 'hidden_dims': '[256, 128, 64]', 'dropout': 0.1066955986805495, 'batch_norm': True, 'lr': 1.4181329781362798e-05, 'weight_decay': 4.0791280698302834e-07, 'epochs': 316, 'loss': 'mae', 'optimizer': 'adam', 'graph_mode': 'cutoff', 'cutoff': 0.39423006276131556, 'grm_norm': 'none', 'self_loops': True, 'use_snp_selection': False}. Best is trial 11 with value: 0.08290441338579799.
[I 2025-11-03 14:00:13,618] Trial 33 finished with value: 0.05435738674678346 and parameters: {'model_type': 'graphsage', 'hidden_dims': '[256, 128, 64]', 'dropout': 0.1395512784154471, 'batch_norm': True, 'lr': 0.00048237951245500796, 'weight_decay': 4.006298424471473e-07, 'epochs': 293, 'loss': 'mae', 'optimizer': 'adam', 'graph_mode': 'cutoff', 'cutoff': 0.5958169930526278, 'grm_norm': 'none', 'self_loops': True, 'use_snp_selection': False}. Best is trial 11 with value: 0.08290441338579799.
[I 2025-11-03 14:00:18,418] Trial 34 finished with value: 0.07963608802996626 and parameters: {'model_type': 'graphsage', 'hidden_dims': '[256, 128, 64]', 'dropout': 0.2072074083424595, 'batch_norm': True, 'lr': 3.066707203998419e-05, 'weight_decay': 1.5376182166039249e-06, 'epochs': 198, 'loss': 'mae', 'optimizer': 'adam', 'graph_mode': 'cutoff', 'cutoff': 0.23824598940802583, 'grm_norm': 'none', 'self_loops': True, 'use_snp_selection': False}. Best is trial 11 with value: 0.08290441338579799.
[I 2025-11-03 14:00:20,495] Trial 35 finished with value: -0.0010367140101320183 and parameters: {'model_type': 'graphsage', 'hidden_dims': '[128, 64]', 'dropout': 0.32153168988473046, 'batch_norm': False, 'lr': 3.2377857910099595e-05, 'weight_decay': 1.3506857098507675e-06, 'epochs': 191, 'loss': 'mse', 'optimizer': 'adam', 'graph_mode': 'cutoff', 'cutoff': 0.2848423490566526, 'grm_norm': 'cosine', 'self_loops': True, 'use_snp_selection': True, 'num_snps': 2074}. Best is trial 11 with value: 0.08290441338579799.
[I 2025-11-03 14:00:25,688] Trial 36 finished with value: 0.026861213324503183 and parameters: {'model_type': 'graphsage', 'hidden_dims': '[256, 128]', 'dropout': 0.3874282694198903, 'batch_norm': True, 'lr': 5.675115717694392e-05, 'weight_decay': 3.4206127886161772e-06, 'epochs': 204, 'loss': 'mae', 'optimizer': 'adam', 'graph_mode': 'cutoff', 'cutoff': 0.2183642510338119, 'grm_norm': 'cosine_then_gcn', 'self_loops': False, 'use_snp_selection': False}. Best is trial 11 with value: 0.08290441338579799.
[I 2025-11-03 14:00:28,738] Trial 37 finished with value: 0.08813280198460283 and parameters: {'model_type': 'graphsage', 'hidden_dims': '[256, 128, 64]', 'dropout': 0.13980196808039705, 'batch_norm': False, 'lr': 0.000764379660250244, 'weight_decay': 1.3635477499232294e-05, 'epochs': 239, 'loss': 'mse', 'optimizer': 'adam', 'graph_mode': 'knn', 'source': 'grm', 'knn_k': 3, 'weighted_edges': True, 'symmetrize_mode': 'mutual', 'use_snp_selection': True, 'num_snps': 15344}. Best is trial 37 with value: 0.08813280198460283.
[I 2025-11-03 14:00:31,401] Trial 38 finished with value: 0.07636268174673765 and parameters: {'model_type': 'graphsage', 'hidden_dims': '[256, 128, 64]', 'dropout': 0.13557972324613185, 'batch_norm': False, 'lr': 0.000716491532784372, 'weight_decay': 1.9235470082597966e-06, 'epochs': 179, 'loss': 'mse', 'optimizer': 'adam', 'graph_mode': 'cutoff', 'cutoff': 0.6295565082487884, 'grm_norm': 'gcn', 'self_loops': False, 'use_snp_selection': True, 'num_snps': 13533}. Best is trial 37 with value: 0.08813280198460283.
[I 2025-11-03 14:00:34,143] Trial 39 finished with value: 0.019942168546106465 and parameters: {'model_type': 'graphsage', 'hidden_dims': '[256, 128, 64]', 'dropout': 0.15336120226649094, 'batch_norm': False, 'lr': 5.827212923362778e-06, 'weight_decay': 1.1525487792874405e-05, 'epochs': 146, 'loss': 'mse', 'optimizer': 'adam', 'graph_mode': 'knn', 'source': 'grm', 'knn_k': 3, 'weighted_edges': True, 'symmetrize_mode': 'union', 'use_snp_selection': True, 'num_snps': 17106}. Best is trial 37 with value: 0.08813280198460283.
[I 2025-11-03 14:00:36,715] Trial 40 finished with value: 0.06326661275276452 and parameters: {'model_type': 'graphsage', 'hidden_dims': '[256, 128, 64]', 'dropout': 0.1197071539954368, 'batch_norm': False, 'lr': 3.991543138213693e-05, 'weight_decay': 5.076863013905562e-06, 'epochs': 237, 'loss': 'mse', 'optimizer': 'adam', 'graph_mode': 'cutoff', 'cutoff': 0.7969663494979176, 'grm_norm': 'none', 'self_loops': True, 'use_snp_selection': True, 'num_snps': 4693}. Best is trial 37 with value: 0.08813280198460283.
[I 2025-11-03 14:00:39,952] Trial 41 finished with value: 0.08773738789515309 and parameters: {'model_type': 'graphsage', 'hidden_dims': '[256, 128, 64]', 'dropout': 0.21316612364169188, 'batch_norm': False, 'lr': 0.00042715519926979053, 'weight_decay': 2.1842037227720264e-05, 'epochs': 229, 'loss': 'mse', 'optimizer': 'adam', 'graph_mode': 'knn', 'source': 'grm', 'knn_k': 1, 'weighted_edges': True, 'symmetrize_mode': 'mutual', 'use_snp_selection': True, 'num_snps': 20942}. Best is trial 37 with value: 0.08813280198460283.
[I 2025-11-03 14:00:43,430] Trial 42 finished with value: 0.08114872836690647 and parameters: {'model_type': 'graphsage', 'hidden_dims': '[256, 128, 64]', 'dropout': 0.20331727198518712, 'batch_norm': False, 'lr': 0.0006856620109077756, 'weight_decay': 6.100888590808997e-05, 'epochs': 256, 'loss': 'mse', 'optimizer': 'adam', 'graph_mode': 'knn', 'source': 'grm', 'knn_k': 2, 'weighted_edges': True, 'symmetrize_mode': 'mutual', 'use_snp_selection': True, 'num_snps': 23197}. Best is trial 37 with value: 0.08813280198460283.
[I 2025-11-03 14:00:46,810] Trial 43 finished with value: 0.08701268555870924 and parameters: {'model_type': 'graphsage', 'hidden_dims': '[256, 128, 64]', 'dropout': 0.10024644567341941, 'batch_norm': False, 'lr': 0.0006049888843885517, 'weight_decay': 5.2920663724892065e-05, 'epochs': 252, 'loss': 'mse', 'optimizer': 'adam', 'graph_mode': 'knn', 'source': 'grm', 'knn_k': 2, 'weighted_edges': True, 'symmetrize_mode': 'mutual', 'use_snp_selection': True, 'num_snps': 21489}. Best is trial 37 with value: 0.08813280198460283.
[I 2025-11-03 14:00:50,189] Trial 44 finished with value: 0.09080245885307509 and parameters: {'model_type': 'graphsage', 'hidden_dims': '[256, 128, 64]', 'dropout': 0.1734409587738124, 'batch_norm': False, 'lr': 0.0006325981216591796, 'weight_decay': 5.385089399491752e-05, 'epochs': 254, 'loss': 'mse', 'optimizer': 'adam', 'graph_mode': 'knn', 'source': 'grm', 'knn_k': 2, 'weighted_edges': True, 'symmetrize_mode': 'mutual', 'use_snp_selection': True, 'num_snps': 22163}. Best is trial 44 with value: 0.09080245885307509.
[I 2025-11-03 14:00:53,603] Trial 45 finished with value: 0.10287748043634418 and parameters: {'model_type': 'graphsage', 'hidden_dims': '[256, 128, 64]', 'dropout': 0.10008712350589612, 'batch_norm': False, 'lr': 0.00040961031529320146, 'weight_decay': 0.0003587569306115677, 'epochs': 282, 'loss': 'mse', 'optimizer': 'adam', 'graph_mode': 'knn', 'source': 'grm', 'knn_k': 2, 'weighted_edges': True, 'symmetrize_mode': 'mutual', 'use_snp_selection': True, 'num_snps': 19422}. Best is trial 45 with value: 0.10287748043634418.
[I 2025-11-03 14:00:57,063] Trial 46 finished with value: 0.09149343065771862 and parameters: {'model_type': 'graphsage', 'hidden_dims': '[256, 128, 64]', 'dropout': 0.14135048910880074, 'batch_norm': False, 'lr': 0.0004090983403997956, 'weight_decay': 4.553738086831692e-05, 'epochs': 282, 'loss': 'mse', 'optimizer': 'adam', 'graph_mode': 'knn', 'source': 'grm', 'knn_k': 3, 'weighted_edges': True, 'symmetrize_mode': 'mutual', 'use_snp_selection': True, 'num_snps': 20392}. Best is trial 45 with value: 0.10287748043634418.
[I 2025-11-03 14:01:00,425] Trial 47 finished with value: 0.0662033121780918 and parameters: {'model_type': 'graphsage', 'hidden_dims': '[256, 128, 64]', 'dropout': 0.17411801707468322, 'batch_norm': False, 'lr': 0.0009270307613548513, 'weight_decay': 2.2715418776481942e-05, 'epochs': 279, 'loss': 'mse', 'optimizer': 'adam', 'graph_mode': 'knn', 'source': 'grm', 'knn_k': 3, 'weighted_edges': True, 'symmetrize_mode': 'mutual', 'use_snp_selection': True, 'num_snps': 18114}. Best is trial 45 with value: 0.10287748043634418.
[I 2025-11-03 14:01:03,551] Trial 48 finished with value: 0.0583291114036604 and parameters: {'model_type': 'graphsage', 'hidden_dims': '[256, 128, 64]', 'dropout': 0.1435600910462052, 'batch_norm': False, 'lr': 0.0003790880421576463, 'weight_decay': 0.000568142019533265, 'epochs': 280, 'loss': 'mse', 'optimizer': 'adam', 'graph_mode': 'knn', 'source': 'grm', 'knn_k': 4, 'weighted_edges': True, 'symmetrize_mode': 'mutual', 'use_snp_selection': True, 'num_snps': 11599}. Best is trial 45 with value: 0.10287748043634418.
[I 2025-11-03 14:01:07,250] Trial 49 finished with value: 0.09270369892858571 and parameters: {'model_type': 'graphsage', 'hidden_dims': '[256, 128, 64]', 'dropout': 0.1252139447408055, 'batch_norm': False, 'lr': 0.0004998237898105817, 'weight_decay': 0.00010679813449454995, 'epochs': 299, 'loss': 'mse', 'optimizer': 'adam', 'graph_mode': 'knn', 'source': 'grm', 'knn_k': 3, 'weighted_edges': True, 'symmetrize_mode': 'mutual', 'use_snp_selection': True, 'num_snps': 23964}. Best is trial 45 with value: 0.10287748043634418.
[I 2025-11-03 14:01:11,123] Trial 50 finished with value: 0.0927794328048592 and parameters: {'model_type': 'graphsage', 'hidden_dims': '[256, 128, 64]', 'dropout': 0.12474754245503095, 'batch_norm': False, 'lr': 0.0003191477158029466, 'weight_decay': 0.000133344102947063, 'epochs': 304, 'loss': 'mse', 'optimizer': 'adam', 'graph_mode': 'knn', 'source': 'grm', 'knn_k': 3, 'weighted_edges': True, 'symmetrize_mode': 'mutual', 'use_snp_selection': True, 'num_snps': 26310}. Best is trial 45 with value: 0.10287748043634418.
[I 2025-11-03 14:01:15,272] Trial 51 finished with value: 0.08009439223936671 and parameters: {'model_type': 'graphsage', 'hidden_dims': '[256, 128, 64]', 'dropout': 0.12356760362456384, 'batch_norm': False, 'lr': 0.00032325430221003383, 'weight_decay': 0.00015405578742863705, 'epochs': 345, 'loss': 'mse', 'optimizer': 'adam', 'graph_mode': 'knn', 'source': 'grm', 'knn_k': 3, 'weighted_edges': True, 'symmetrize_mode': 'mutual', 'use_snp_selection': True, 'num_snps': 27695}. Best is trial 45 with value: 0.10287748043634418.
[I 2025-11-03 14:01:19,028] Trial 52 finished with value: 0.08487136613294423 and parameters: {'model_type': 'graphsage', 'hidden_dims': '[256, 128, 64]', 'dropout': 0.16503890139888658, 'batch_norm': False, 'lr': 0.0005514028532744716, 'weight_decay': 0.00010459813730841443, 'epochs': 305, 'loss': 'mse', 'optimizer': 'adam', 'graph_mode': 'knn', 'source': 'grm', 'knn_k': 4, 'weighted_edges': True, 'symmetrize_mode': 'mutual', 'use_snp_selection': True, 'num_snps': 24397}. Best is trial 45 with value: 0.10287748043634418.
[I 2025-11-03 14:01:23,358] Trial 53 finished with value: 0.06913970184952822 and parameters: {'model_type': 'graphsage', 'hidden_dims': '[256, 128, 64]', 'dropout': 0.12693493427480126, 'batch_norm': False, 'lr': 0.0007800603312694784, 'weight_decay': 0.00032462473706265725, 'epochs': 296, 'loss': 'mse', 'optimizer': 'adam', 'graph_mode': 'knn', 'source': 'grm', 'knn_k': 3, 'weighted_edges': True, 'symmetrize_mode': 'mutual', 'use_snp_selection': True, 'num_snps': 32274}. Best is trial 45 with value: 0.10287748043634418.
[I 2025-11-03 14:01:26,884] Trial 54 finished with value: 0.09889491795321087 and parameters: {'model_type': 'graphsage', 'hidden_dims': '[256, 128, 64]', 'dropout': 0.15502493420320912, 'batch_norm': False, 'lr': 0.00021958849404483968, 'weight_decay': 0.00012416994701742478, 'epochs': 318, 'loss': 'mse', 'optimizer': 'adam', 'graph_mode': 'knn', 'source': 'grm', 'knn_k': 2, 'weighted_edges': True, 'symmetrize_mode': 'mutual', 'use_snp_selection': True, 'num_snps': 17991}. Best is trial 45 with value: 0.10287748043634418.
[I 2025-11-03 14:01:32,640] Trial 55 finished with value: 0.07872265910627327 and parameters: {'model_type': 'graphsage', 'hidden_dims': '[512, 64]', 'dropout': 0.10080319608257698, 'batch_norm': False, 'lr': 0.0001936048681036989, 'weight_decay': 0.00013791359275349915, 'epochs': 315, 'loss': 'mse', 'optimizer': 'adam', 'graph_mode': 'knn', 'source': 'grm', 'knn_k': 2, 'weighted_edges': True, 'symmetrize_mode': 'mutual', 'use_snp_selection': True, 'num_snps': 33725}. Best is trial 45 with value: 0.10287748043634418.
[I 2025-11-03 14:01:37,256] Trial 56 finished with value: 0.07678591431489525 and parameters: {'model_type': 'graphsage', 'hidden_dims': '[512, 128]', 'dropout': 0.18832855860586464, 'batch_norm': False, 'lr': 0.00026190479794248176, 'weight_decay': 0.00029468026483731356, 'epochs': 325, 'loss': 'mse', 'optimizer': 'adam', 'graph_mode': 'knn', 'source': 'grm', 'knn_k': 7, 'weighted_edges': True, 'symmetrize_mode': 'mutual', 'use_snp_selection': True, 'num_snps': 20491}. Best is trial 45 with value: 0.10287748043634418.
