[I 2025-11-03 13:40:45,605] Trial 119 finished with value: 0.06400932316226512 and parameters: {'model_type': 'gcn', 'hidden_dims': '[256, 128]', 'dropout': 0.40225102726844303, 'batch_norm': False, 'lr': 0.0006122362198002128, 'weight_decay': 1.7311795742900342e-05, 'epochs': 220, 'loss': 'mae', 'optimizer': 'adam', 'graph_mode': 'off', 'use_snp_selection': False}. Best is trial 103 with value: 0.15081495201159137.
[I 2025-11-03 13:40:47,234] Trial 120 finished with value: 0.13190442106913325 and parameters: {'model_type': 'gcn', 'hidden_dims': '[256, 128]', 'dropout': 0.42831280361720175, 'batch_norm': True, 'lr': 0.0007010052449814647, 'weight_decay': 8.89026818634478e-05, 'epochs': 249, 'loss': 'mae', 'optimizer': 'adam', 'graph_mode': 'off', 'use_snp_selection': False}. Best is trial 103 with value: 0.15081495201159137.
[I 2025-11-03 13:40:48,883] Trial 121 finished with value: 0.1347738077347698 and parameters: {'model_type': 'gcn', 'hidden_dims': '[256, 128]', 'dropout': 0.1422276557895691, 'batch_norm': True, 'lr': 0.000977891335180891, 'weight_decay': 2.683697870593604e-05, 'epochs': 258, 'loss': 'mae', 'optimizer': 'adam', 'graph_mode': 'off', 'use_snp_selection': False}. Best is trial 103 with value: 0.15081495201159137.
[I 2025-11-03 13:40:50,426] Trial 122 finished with value: 0.139091390608515 and parameters: {'model_type': 'gcn', 'hidden_dims': '[256, 128]', 'dropout': 0.36077189420868233, 'batch_norm': True, 'lr': 0.0008319209237358773, 'weight_decay': 5.638982492140033e-05, 'epochs': 232, 'loss': 'mae', 'optimizer': 'adam', 'graph_mode': 'off', 'use_snp_selection': False}. Best is trial 103 with value: 0.15081495201159137.
[I 2025-11-03 13:40:52,716] Trial 123 finished with value: 0.13465322444432049 and parameters: {'model_type': 'gcn', 'hidden_dims': '[512, 128]', 'dropout': 0.39180910713759387, 'batch_norm': True, 'lr': 0.000472167994503359, 'weight_decay': 3.7374144862363233e-06, 'epochs': 238, 'loss': 'mae', 'optimizer': 'adam', 'graph_mode': 'off', 'use_snp_selection': False}. Best is trial 103 with value: 0.15081495201159137.
[I 2025-11-03 13:40:54,739] Trial 124 finished with value: 0.1366918403128815 and parameters: {'model_type': 'gcn', 'hidden_dims': '[512, 64]', 'dropout': 0.4151420586719883, 'batch_norm': True, 'lr': 0.0005514163254198047, 'weight_decay': 0.00015044934026943278, 'epochs': 202, 'loss': 'mae', 'optimizer': 'adam', 'graph_mode': 'off', 'use_snp_selection': False}. Best is trial 103 with value: 0.15081495201159137.
[I 2025-11-03 13:40:56,857] Trial 125 finished with value: 0.1467884686491688 and parameters: {'model_type': 'gcn', 'hidden_dims': '[512, 256]', 'dropout': 0.30957746159181937, 'batch_norm': True, 'lr': 0.0006594611644880712, 'weight_decay': 2.8121218308170483e-06, 'epochs': 214, 'loss': 'mae', 'optimizer': 'adam', 'graph_mode': 'off', 'use_snp_selection': False}. Best is trial 103 with value: 0.15081495201159137.
[I 2025-11-03 13:40:58,984] Trial 126 finished with value: 0.12960069337534233 and parameters: {'model_type': 'gcn', 'hidden_dims': '[512, 256]', 'dropout': 0.3518497589020031, 'batch_norm': True, 'lr': 0.0002592883103188233, 'weight_decay': 2.5000830789394093e-06, 'epochs': 213, 'loss': 'mae', 'optimizer': 'adam', 'graph_mode': 'off', 'use_snp_selection': False}. Best is trial 103 with value: 0.15081495201159137.
[I 2025-11-03 13:41:00,966] Trial 127 finished with value: 0.14337831405138557 and parameters: {'model_type': 'gcn', 'hidden_dims': '[512, 256]', 'dropout': 0.2981542957737715, 'batch_norm': True, 'lr': 0.00030642237613986214, 'weight_decay': 2.3088622515112964e-05, 'epochs': 193, 'loss': 'mae', 'optimizer': 'adam', 'graph_mode': 'off', 'use_snp_selection': False}. Best is trial 103 with value: 0.15081495201159137.
[I 2025-11-03 13:41:02,964] Trial 128 finished with value: 0.12937534766710543 and parameters: {'model_type': 'gcn', 'hidden_dims': '[512, 256]', 'dropout': 0.30046677885173967, 'batch_norm': True, 'lr': 0.00033337747458236363, 'weight_decay': 5.887221098573011e-06, 'epochs': 195, 'loss': 'mse', 'optimizer': 'adam', 'graph_mode': 'off', 'use_snp_selection': False}. Best is trial 103 with value: 0.15081495201159137.
[I 2025-11-03 13:41:05,263] Trial 129 finished with value: 0.12832879128719654 and parameters: {'model_type': 'gcn', 'hidden_dims': '[512, 256]', 'dropout': 0.31826664248882197, 'batch_norm': True, 'lr': 0.00037509236511571326, 'weight_decay': 2.194165029933962e-05, 'epochs': 226, 'loss': 'mae', 'optimizer': 'adam', 'graph_mode': 'off', 'use_snp_selection': True, 'num_snps': 38804}. Best is trial 103 with value: 0.15081495201159137.
[I 2025-11-03 13:41:07,411] Trial 130 finished with value: 0.13052062902972034 and parameters: {'model_type': 'gcn', 'hidden_dims': '[512, 256]', 'dropout': 0.31215029173792835, 'batch_norm': True, 'lr': 0.0003086732882525784, 'weight_decay': 1.57428126035952e-05, 'epochs': 217, 'loss': 'mae', 'optimizer': 'adam', 'graph_mode': 'off', 'use_snp_selection': False}. Best is trial 103 with value: 0.15081495201159137.
[I 2025-11-03 13:41:09,487] Trial 131 finished with value: 0.14204362382716104 and parameters: {'model_type': 'gcn', 'hidden_dims': '[512, 256]', 'dropout': 0.33594148110034616, 'batch_norm': True, 'lr': 0.0006803838720602396, 'weight_decay': 1.1641366064695552e-05, 'epochs': 206, 'loss': 'mae', 'optimizer': 'adam', 'graph_mode': 'off', 'use_snp_selection': False}. Best is trial 103 with value: 0.15081495201159137.
[I 2025-11-03 13:41:11,153] Trial 132 finished with value: 0.13021644339359814 and parameters: {'model_type': 'gcn', 'hidden_dims': '[512, 256]', 'dropout': 0.28675275370521675, 'batch_norm': True, 'lr': 0.0009994981344995666, 'weight_decay': 3.453166698839752e-05, 'epochs': 140, 'loss': 'mae', 'optimizer': 'adam', 'graph_mode': 'off', 'use_snp_selection': False}. Best is trial 103 with value: 0.15081495201159137.
[I 2025-11-03 13:41:13,278] Trial 133 finished with value: 0.12737224817649373 and parameters: {'model_type': 'gcn', 'hidden_dims': '[512, 256]', 'dropout': 0.2733857735825085, 'batch_norm': True, 'lr': 0.0007765188331150575, 'weight_decay': 4.5580677940895364e-05, 'epochs': 213, 'loss': 'mae', 'optimizer': 'adam', 'graph_mode': 'off', 'use_snp_selection': False}. Best is trial 103 with value: 0.15081495201159137.
[I 2025-11-03 13:41:15,228] Trial 134 finished with value: 0.14249678870042273 and parameters: {'model_type': 'gcn', 'hidden_dims': '[512, 256]', 'dropout': 0.13039163059002093, 'batch_norm': True, 'lr': 0.00060730027263449, 'weight_decay': 2.1105437608802414e-05, 'epochs': 190, 'loss': 'mae', 'optimizer': 'adam', 'graph_mode': 'off', 'use_snp_selection': False}. Best is trial 103 with value: 0.15081495201159137.
[I 2025-11-03 13:41:17,654] Trial 135 finished with value: 0.1427904277298225 and parameters: {'model_type': 'gcn', 'hidden_dims': '[256, 128, 64]', 'dropout': 0.3284419332194175, 'batch_norm': True, 'lr': 0.0004514094516871101, 'weight_decay': 1.5443579223646636e-06, 'epochs': 329, 'loss': 'mae', 'optimizer': 'adam', 'graph_mode': 'off', 'use_snp_selection': False}. Best is trial 103 with value: 0.15081495201159137.
[I 2025-11-03 13:41:19,272] Trial 136 finished with value: 0.1433211387091352 and parameters: {'model_type': 'gcn', 'hidden_dims': '[256, 128]', 'dropout': 0.15774159448366304, 'batch_norm': True, 'lr': 0.0008171452954884504, 'weight_decay': 2.791220192712713e-05, 'epochs': 242, 'loss': 'mae', 'optimizer': 'adam', 'graph_mode': 'off', 'use_snp_selection': False}. Best is trial 103 with value: 0.15081495201159137.
[I 2025-11-03 13:41:20,865] Trial 137 finished with value: 0.1349604628876256 and parameters: {'model_type': 'gcn', 'hidden_dims': '[256, 128]', 'dropout': 0.15326354027105082, 'batch_norm': True, 'lr': 0.0008823696839127728, 'weight_decay': 2.7838639165774985e-05, 'epochs': 242, 'loss': 'mae', 'optimizer': 'adam', 'graph_mode': 'off', 'use_snp_selection': False}. Best is trial 103 with value: 0.15081495201159137.
[I 2025-11-03 13:41:22,500] Trial 138 finished with value: 0.1478701883693188 and parameters: {'model_type': 'gcn', 'hidden_dims': '[256, 128]', 'dropout': 0.3060460579188688, 'batch_norm': True, 'lr': 0.0005436013416461067, 'weight_decay': 1.386451421143969e-05, 'epochs': 254, 'loss': 'mae', 'optimizer': 'adam', 'graph_mode': 'off', 'use_snp_selection': False}. Best is trial 103 with value: 0.15081495201159137.
[I 2025-11-03 13:41:24,219] Trial 139 finished with value: 0.13310618848074995 and parameters: {'model_type': 'gcn', 'hidden_dims': '[256, 128]', 'dropout': 0.3092447557433445, 'batch_norm': True, 'lr': 0.0005609289405781072, 'weight_decay': 4.473900386212183e-06, 'epochs': 272, 'loss': 'mae', 'optimizer': 'adam', 'graph_mode': 'off', 'use_snp_selection': False}. Best is trial 103 with value: 0.15081495201159137.
[I 2025-11-03 13:41:25,815] Trial 140 finished with value: 0.14831844205312353 and parameters: {'model_type': 'gcn', 'hidden_dims': '[256, 128]', 'dropout': 0.2948647103859879, 'batch_norm': False, 'lr': 0.0005017954755229828, 'weight_decay': 8.042213830470497e-06, 'epochs': 255, 'loss': 'mae', 'optimizer': 'adam', 'graph_mode': 'off', 'use_snp_selection': False}. Best is trial 103 with value: 0.15081495201159137.
[I 2025-11-03 13:41:27,436] Trial 141 finished with value: 0.08843945281892797 and parameters: {'model_type': 'gcn', 'hidden_dims': '[256, 128]', 'dropout': 0.2958444634402456, 'batch_norm': False, 'lr': 0.00039096921095497627, 'weight_decay': 1.1464873694018521e-05, 'epochs': 252, 'loss': 'mae', 'optimizer': 'adam', 'graph_mode': 'off', 'use_snp_selection': False}. Best is trial 103 with value: 0.15081495201159137.
[I 2025-11-03 13:41:29,060] Trial 142 finished with value: 0.11886264746205501 and parameters: {'model_type': 'gcn', 'hidden_dims': '[256, 128]', 'dropout': 0.32072805560047607, 'batch_norm': False, 'lr': 0.0004980455045606416, 'weight_decay': 3.2098735219929275e-06, 'epochs': 263, 'loss': 'mae', 'optimizer': 'adam', 'graph_mode': 'off', 'use_snp_selection': False}. Best is trial 103 with value: 0.15081495201159137.
[I 2025-11-03 13:41:30,689] Trial 143 finished with value: 0.0963819767216997 and parameters: {'model_type': 'gcn', 'hidden_dims': '[256, 128]', 'dropout': 0.2795875225328607, 'batch_norm': False, 'lr': 0.0006543916098302872, 'weight_decay': 8.840599000183625e-06, 'epochs': 258, 'loss': 'mae', 'optimizer': 'adam', 'graph_mode': 'off', 'use_snp_selection': False}. Best is trial 103 with value: 0.15081495201159137.
[I 2025-11-03 13:41:32,241] Trial 144 finished with value: 0.11122386680206375 and parameters: {'model_type': 'gcn', 'hidden_dims': '[256, 128]', 'dropout': 0.3465558638049574, 'batch_norm': False, 'lr': 0.0004617792670354631, 'weight_decay': 1.9065941833474267e-06, 'epochs': 233, 'loss': 'mae', 'optimizer': 'adam', 'graph_mode': 'off', 'use_snp_selection': False}. Best is trial 103 with value: 0.15081495201159137.
[I 2025-11-03 13:41:33,739] Trial 145 finished with value: 0.12909696802600243 and parameters: {'model_type': 'gcn', 'hidden_dims': '[256, 128]', 'dropout': 0.29068199561056596, 'batch_norm': False, 'lr': 0.0005829297446784334, 'weight_decay': 1.4911431275207261e-05, 'epochs': 225, 'loss': 'mae', 'optimizer': 'adam', 'graph_mode': 'off', 'use_snp_selection': False}. Best is trial 103 with value: 0.15081495201159137.
[I 2025-11-03 13:41:35,382] Trial 146 finished with value: 0.12703127714279924 and parameters: {'model_type': 'gcn', 'hidden_dims': '[256, 128]', 'dropout': 0.36637585516599086, 'batch_norm': True, 'lr': 5.183087453505393e-05, 'weight_decay': 1.7776868673367447e-05, 'epochs': 247, 'loss': 'mae', 'optimizer': 'adam', 'graph_mode': 'off', 'use_snp_selection': False}. Best is trial 103 with value: 0.15081495201159137.
[I 2025-11-03 13:41:37,925] Trial 147 finished with value: 0.14064135757163884 and parameters: {'model_type': 'gcn', 'hidden_dims': '[512, 256]', 'dropout': 0.2605399676678354, 'batch_norm': True, 'lr': 0.0006963457243342404, 'weight_decay': 2.258691803252677e-06, 'epochs': 277, 'loss': 'mae', 'optimizer': 'adam', 'graph_mode': 'off', 'use_snp_selection': False}. Best is trial 103 with value: 0.15081495201159137.
[I 2025-11-03 13:41:39,957] Trial 148 finished with value: 0.13613208218317036 and parameters: {'model_type': 'gcn', 'hidden_dims': '[512, 128]', 'dropout': 0.3047914533537266, 'batch_norm': True, 'lr': 0.00041607401627974025, 'weight_decay': 1.0395074734261019e-05, 'epochs': 201, 'loss': 'mae', 'optimizer': 'adam', 'graph_mode': 'off', 'use_snp_selection': False}. Best is trial 103 with value: 0.15081495201159137.
[I 2025-11-03 13:41:41,768] Trial 149 finished with value: 0.13164685517628244 and parameters: {'model_type': 'gcn', 'hidden_dims': '[256, 128]', 'dropout': 0.11167099482302113, 'batch_norm': True, 'lr': 0.00029041149210893907, 'weight_decay': 4.266856386124514e-05, 'epochs': 292, 'loss': 'mae', 'optimizer': 'adam', 'graph_mode': 'off', 'use_snp_selection': False}. Best is trial 103 with value: 0.15081495201159137.
[I 2025-11-03 13:41:43,752] Trial 0 finished with value: 0.013483107516096908 and parameters: {'model_type': 'gcn', 'hidden_dims': '[128, 64]', 'dropout': 0.199031432379812, 'batch_norm': True, 'lr': 1.8408544111075837e-06, 'weight_decay': 5.5136510071208614e-05, 'epochs': 336, 'loss': 'mae', 'optimizer': 'adam', 'graph_mode': 'off', 'use_snp_selection': True, 'num_snps': 43862}. Best is trial 0 with value: 0.013483107516096908.
[I 2025-11-03 13:41:45,211] Trial 1 finished with value: 0.01869358299745332 and parameters: {'model_type': 'gcn', 'hidden_dims': '[256, 128]', 'dropout': 0.4370668075331726, 'batch_norm': True, 'lr': 7.133471581159139e-05, 'weight_decay': 1.128633586803549e-05, 'epochs': 242, 'loss': 'mae', 'optimizer': 'adam', 'graph_mode': 'off', 'use_snp_selection': False}. Best is trial 1 with value: 0.01869358299745332.
[I 2025-11-03 13:41:46,254] Trial 2 finished with value: 0.028397616696490886 and parameters: {'model_type': 'gcn', 'hidden_dims': '[256, 128, 64]', 'dropout': 0.41314357415569625, 'batch_norm': False, 'lr': 3.952233718592101e-06, 'weight_decay': 0.00026754769258252603, 'epochs': 149, 'loss': 'mse', 'optimizer': 'adam', 'graph_mode': 'off', 'use_snp_selection': True, 'num_snps': 11571}. Best is trial 2 with value: 0.028397616696490886.
[I 2025-11-03 13:41:48,804] Trial 3 finished with value: 0.04437937268203857 and parameters: {'model_type': 'gcn', 'hidden_dims': '[512, 64]', 'dropout': 0.5938127374509361, 'batch_norm': False, 'lr': 5.67704586114731e-06, 'weight_decay': 2.4518087630137052e-05, 'epochs': 320, 'loss': 'mae', 'optimizer': 'adam', 'graph_mode': 'off', 'use_snp_selection': False}. Best is trial 3 with value: 0.04437937268203857.
[I 2025-11-03 13:41:51,077] Trial 4 finished with value: 0.00921948753784111 and parameters: {'model_type': 'gcn', 'hidden_dims': '[512, 128]', 'dropout': 0.25746343592134413, 'batch_norm': True, 'lr': 1.3467657668402788e-06, 'weight_decay': 0.00033087251918647806, 'epochs': 277, 'loss': 'mse', 'optimizer': 'adam', 'graph_mode': 'off', 'use_snp_selection': True, 'num_snps': 36675}. Best is trial 3 with value: 0.04437937268203857.
[I 2025-11-03 13:41:52,675] Trial 5 finished with value: -0.03018588302735197 and parameters: {'model_type': 'gcn', 'hidden_dims': '[512, 64]', 'dropout': 0.38275350994408375, 'batch_norm': True, 'lr': 1.5586664309232824e-06, 'weight_decay': 0.0008227664668621182, 'epochs': 145, 'loss': 'mae', 'optimizer': 'adam', 'graph_mode': 'off', 'use_snp_selection': True, 'num_snps': 32148}. Best is trial 3 with value: 0.04437937268203857.
[I 2025-11-03 13:41:53,957] Trial 6 finished with value: -0.02310896093702444 and parameters: {'model_type': 'gcn', 'hidden_dims': '[256, 128]', 'dropout': 0.3930109900265879, 'batch_norm': False, 'lr': 4.892964372128395e-05, 'weight_decay': 1.5809549317992182e-06, 'epochs': 199, 'loss': 'mse', 'optimizer': 'adam', 'graph_mode': 'off', 'use_snp_selection': False}. Best is trial 3 with value: 0.04437937268203857.
[I 2025-11-03 13:41:55,282] Trial 7 finished with value: 0.020761896854901055 and parameters: {'model_type': 'gcn', 'hidden_dims': '[512, 256]', 'dropout': 0.15343979219678458, 'batch_norm': True, 'lr': 6.234003099047341e-05, 'weight_decay': 3.894760610535477e-07, 'epochs': 97, 'loss': 'mse', 'optimizer': 'adam', 'graph_mode': 'off', 'use_snp_selection': False}. Best is trial 3 with value: 0.04437937268203857.
[I 2025-11-03 13:41:57,842] Trial 8 finished with value: -0.005758267348665669 and parameters: {'model_type': 'gcn', 'hidden_dims': '[512, 128]', 'dropout': 0.10743001231661406, 'batch_norm': True, 'lr': 0.00023728538449271062, 'weight_decay': 1.7629071578048637e-05, 'epochs': 312, 'loss': 'mae', 'optimizer': 'adam', 'graph_mode': 'off', 'use_snp_selection': False}. Best is trial 3 with value: 0.04437937268203857.
[I 2025-11-03 13:41:59,559] Trial 9 finished with value: -0.0009871308940365728 and parameters: {'model_type': 'gcn', 'hidden_dims': '[512, 64]', 'dropout': 0.14505336736221927, 'batch_norm': True, 'lr': 5.8619638388111826e-05, 'weight_decay': 6.200156172669308e-07, 'epochs': 175, 'loss': 'mse', 'optimizer': 'adam', 'graph_mode': 'off', 'use_snp_selection': False}. Best is trial 3 with value: 0.04437937268203857.
[I 2025-11-03 13:42:00,583] Trial 10 finished with value: -0.014616051337326704 and parameters: {'model_type': 'gcn', 'hidden_dims': '[512, 64]', 'dropout': 0.5885461262002587, 'batch_norm': False, 'lr': 8.769366258768696e-06, 'weight_decay': 2.78273193871783e-06, 'epochs': 55, 'loss': 'mae', 'optimizer': 'adam', 'graph_mode': 'off', 'use_snp_selection': False}. Best is trial 3 with value: 0.04437937268203857.
[I 2025-11-03 13:42:01,763] Trial 11 finished with value: 0.013173273590403208 and parameters: {'model_type': 'gcn', 'hidden_dims': '[256, 128, 64]', 'dropout': 0.5856267066773996, 'batch_norm': False, 'lr': 8.596969843802065e-06, 'weight_decay': 7.644279067619571e-05, 'epochs': 222, 'loss': 'mse', 'optimizer': 'adam', 'graph_mode': 'off', 'use_snp_selection': True, 'num_snps': 5419}. Best is trial 3 with value: 0.04437937268203857.
[I 2025-11-03 13:42:02,748] Trial 12 finished with value: 0.026149140257824183 and parameters: {'model_type': 'gcn', 'hidden_dims': '[256, 128, 64]', 'dropout': 0.4954131800639115, 'batch_norm': False, 'lr': 8.040010782675621e-06, 'weight_decay': 0.00012297995556334715, 'epochs': 147, 'loss': 'mae', 'optimizer': 'adam', 'graph_mode': 'off', 'use_snp_selection': True, 'num_snps': 7003}. Best is trial 3 with value: 0.04437937268203857.
[I 2025-11-03 13:42:05,576] Trial 13 finished with value: -0.0002641710542333976 and parameters: {'model_type': 'gcn', 'hidden_dims': '[256, 128, 64]', 'dropout': 0.29125366674822484, 'batch_norm': False, 'lr': 5.160505268156064e-06, 'weight_decay': 3.1999034495941446e-05, 'epochs': 282, 'loss': 'mse', 'optimizer': 'adam', 'graph_mode': 'off', 'use_snp_selection': True, 'num_snps': 59978}. Best is trial 3 with value: 0.04437937268203857.
[I 2025-11-03 13:42:06,328] Trial 14 finished with value: 0.005692562380086203 and parameters: {'model_type': 'gcn', 'hidden_dims': '[128, 64]', 'dropout': 0.47880568694936143, 'batch_norm': False, 'lr': 0.0009967274619366718, 'weight_decay': 0.0002568680042184745, 'epochs': 105, 'loss': 'mae', 'optimizer': 'adam', 'graph_mode': 'off', 'use_snp_selection': False}. Best is trial 3 with value: 0.04437937268203857.
[I 2025-11-03 13:42:08,113] Trial 15 finished with value: 0.016574658124757738 and parameters: {'model_type': 'gcn', 'hidden_dims': '[512, 256]', 'dropout': 0.5303211456902688, 'batch_norm': False, 'lr': 1.9864828875357438e-05, 'weight_decay': 3.7977950845608818e-06, 'epochs': 347, 'loss': 'mse', 'optimizer': 'adam', 'graph_mode': 'off', 'use_snp_selection': True, 'num_snps': 19093}. Best is trial 3 with value: 0.04437937268203857.
[I 2025-11-03 13:42:10,229] Trial 16 finished with value: -0.012997640249601884 and parameters: {'model_type': 'gcn', 'hidden_dims': '[512, 64]', 'dropout': 0.33587209601766577, 'batch_norm': False, 'lr': 3.284888101997687e-06, 'weight_decay': 0.0007812431650451949, 'epochs': 243, 'loss': 'mae', 'optimizer': 'adam', 'graph_mode': 'off', 'use_snp_selection': False}. Best is trial 3 with value: 0.04437937268203857.
[I 2025-11-03 13:42:11,104] Trial 17 finished with value: -0.014487969359240781 and parameters: {'model_type': 'gcn', 'hidden_dims': '[256, 128, 64]', 'dropout': 0.5387456221645408, 'batch_norm': False, 'lr': 1.8081964730854778e-05, 'weight_decay': 1.40022675967374e-07, 'epochs': 45, 'loss': 'mse', 'optimizer': 'adam', 'graph_mode': 'off', 'use_snp_selection': True, 'num_snps': 18228}. Best is trial 3 with value: 0.04437937268203857.
[I 2025-11-03 13:42:12,357] Trial 18 finished with value: 0.028052630647746348 and parameters: {'model_type': 'gcn', 'hidden_dims': '[256, 128, 64]', 'dropout': 0.4460705703142783, 'batch_norm': False, 'lr': 3.0160351840952206e-06, 'weight_decay': 0.00016137076761448376, 'epochs': 146, 'loss': 'mse', 'optimizer': 'adam', 'graph_mode': 'off', 'use_snp_selection': True, 'num_snps': 20445}. Best is trial 3 with value: 0.04437937268203857.
[I 2025-11-03 13:42:13,702] Trial 19 finished with value: 0.02667519433677846 and parameters: {'model_type': 'gcn', 'hidden_dims': '[512, 64]', 'dropout': 0.3225190164399214, 'batch_norm': False, 'lr': 2.189531033008616e-05, 'weight_decay': 2.965638484156022e-05, 'epochs': 110, 'loss': 'mae', 'optimizer': 'adam', 'graph_mode': 'off', 'use_snp_selection': False}. Best is trial 3 with value: 0.04437937268203857.
[I 2025-11-03 13:42:15,539] Trial 20 finished with value: 0.008967207234716055 and parameters: {'model_type': 'gcn', 'hidden_dims': '[512, 128]', 'dropout': 0.24943597987893662, 'batch_norm': False, 'lr': 0.00014715045903500657, 'weight_decay': 6.646777320363833e-06, 'epochs': 193, 'loss': 'mae', 'optimizer': 'adam', 'graph_mode': 'off', 'use_snp_selection': False}. Best is trial 3 with value: 0.04437937268203857.
