[I 2025-10-22 13:24:13,367] Trial 76 finished with value: 0.2468391109459497 and parameters: {'model_type': 'gat', 'hidden_dims': '[256, 128, 64]', 'dropout': 0.5413125858979642, 'batch_norm': False, 'gat_heads': 7, 'gat_attn_dropout': 0.1339414622619719, 'gat_concat_hidden': False, 'lr': 2.139785491603101e-05, 'weight_decay': 3.5039876460950184e-05, 'epochs': 52, 'loss': 'mse', 'optimizer': 'adam', 'graph_mode': 'cutoff', 'cutoff': 0.43987605171521044, 'grm_norm': 'none', 'self_loops': False}. Best is trial 73 with value: 0.2669303256570533.
[I 2025-10-22 13:26:54,085] Trial 77 finished with value: 0.21755771516316819 and parameters: {'model_type': 'gat', 'hidden_dims': '[512, 64]', 'dropout': 0.5726512908562931, 'batch_norm': False, 'gat_heads': 7, 'gat_attn_dropout': 0.06389688946429808, 'gat_concat_hidden': False, 'lr': 4.84821441265557e-06, 'weight_decay': 3.031004235737236e-05, 'epochs': 64, 'loss': 'mse', 'optimizer': 'adam', 'graph_mode': 'cutoff', 'cutoff': 0.33931180677086936, 'grm_norm': 'none', 'self_loops': True}. Best is trial 73 with value: 0.2669303256570533.
[I 2025-10-22 13:29:02,424] Trial 78 finished with value: 0.23173221257996462 and parameters: {'model_type': 'gat', 'hidden_dims': '[512, 64]', 'dropout': 0.5941593089296415, 'batch_norm': False, 'gat_heads': 8, 'gat_attn_dropout': 0.2231740777156352, 'gat_concat_hidden': False, 'lr': 4.092614884424157e-05, 'weight_decay': 8.794542443843857e-06, 'epochs': 40, 'loss': 'mse', 'optimizer': 'adam', 'graph_mode': 'cutoff', 'cutoff': 0.4796179298468936, 'grm_norm': 'none', 'self_loops': True}. Best is trial 73 with value: 0.2669303256570533.
[I 2025-10-22 13:29:54,387] Trial 79 finished with value: 0.23887917572471365 and parameters: {'model_type': 'gat', 'hidden_dims': '[256, 128]', 'dropout': 0.5823109226227446, 'batch_norm': False, 'gat_heads': 3, 'gat_attn_dropout': 0.15597732851456547, 'gat_concat_hidden': False, 'lr': 1.5669060500611884e-05, 'weight_decay': 1.3185132541288425e-05, 'epochs': 81, 'loss': 'mse', 'optimizer': 'adam', 'graph_mode': 'knn', 'source': 'grm', 'knn_k': 10, 'weighted_edges': False, 'symmetrize_mode': 'union'}. Best is trial 73 with value: 0.2669303256570533.
[I 2025-10-22 13:32:37,560] Trial 80 finished with value: 0.20856570245817188 and parameters: {'model_type': 'gat', 'hidden_dims': '[512, 64]', 'dropout': 0.5508369716781398, 'batch_norm': True, 'gat_heads': 8, 'gat_attn_dropout': 0.1214652331808824, 'gat_concat_hidden': False, 'lr': 8.813324918662984e-06, 'weight_decay': 5.804204714051644e-06, 'epochs': 54, 'loss': 'mse', 'optimizer': 'adam', 'graph_mode': 'cutoff', 'cutoff': 0.4202158064870365, 'grm_norm': 'none', 'self_loops': False}. Best is trial 73 with value: 0.2669303256570533.
[I 2025-10-22 13:36:46,025] Trial 81 finished with value: 0.2707388309772711 and parameters: {'model_type': 'gat', 'hidden_dims': '[512, 64]', 'dropout': 0.5327941994641513, 'batch_norm': False, 'gat_heads': 8, 'gat_attn_dropout': 0.10397960615628433, 'gat_concat_hidden': False, 'lr': 2.7904157761256616e-05, 'weight_decay': 2.175647838001755e-05, 'epochs': 91, 'loss': 'mse', 'optimizer': 'adam', 'graph_mode': 'cutoff', 'cutoff': 0.5065404301182331, 'grm_norm': 'none', 'self_loops': True}. Best is trial 81 with value: 0.2707388309772711.
[I 2025-10-22 13:40:37,624] Trial 82 finished with value: 0.2552569773597304 and parameters: {'model_type': 'gat', 'hidden_dims': '[512, 64]', 'dropout': 0.5592457171331777, 'batch_norm': False, 'gat_heads': 8, 'gat_attn_dropout': 0.07172539769354691, 'gat_concat_hidden': False, 'lr': 2.4353332882944925e-05, 'weight_decay': 2.1462111108396195e-05, 'epochs': 83, 'loss': 'mse', 'optimizer': 'adam', 'graph_mode': 'cutoff', 'cutoff': 0.38088856488424916, 'grm_norm': 'none', 'self_loops': True}. Best is trial 81 with value: 0.2707388309772711.
[I 2025-10-22 13:45:11,286] Trial 83 finished with value: 0.2629779338335204 and parameters: {'model_type': 'gat', 'hidden_dims': '[512, 64]', 'dropout': 0.5314337704738166, 'batch_norm': False, 'gat_heads': 8, 'gat_attn_dropout': 0.10819132111612856, 'gat_concat_hidden': False, 'lr': 3.451842027164127e-05, 'weight_decay': 2.5770687055453622e-05, 'epochs': 102, 'loss': 'mse', 'optimizer': 'adam', 'graph_mode': 'cutoff', 'cutoff': 0.5150343127482938, 'grm_norm': 'none', 'self_loops': True}. Best is trial 81 with value: 0.2707388309772711.
[I 2025-10-22 13:49:38,068] Trial 84 finished with value: 0.26565677953020633 and parameters: {'model_type': 'gat', 'hidden_dims': '[512, 64]', 'dropout': 0.5275339690487383, 'batch_norm': False, 'gat_heads': 8, 'gat_attn_dropout': 0.15100351001171075, 'gat_concat_hidden': False, 'lr': 4.809899406989391e-05, 'weight_decay': 2.7727016183079322e-05, 'epochs': 99, 'loss': 'mse', 'optimizer': 'adam', 'graph_mode': 'cutoff', 'cutoff': 0.504033459088326, 'grm_norm': 'cosine', 'self_loops': True}. Best is trial 81 with value: 0.2707388309772711.
[I 2025-10-22 13:54:02,629] Trial 85 finished with value: 0.25585700967875497 and parameters: {'model_type': 'gat', 'hidden_dims': '[512, 64]', 'dropout': 0.5288626063653314, 'batch_norm': False, 'gat_heads': 8, 'gat_attn_dropout': 0.042947440230422795, 'gat_concat_hidden': False, 'lr': 2.8862296137167867e-05, 'weight_decay': 8.090199178219384e-05, 'epochs': 98, 'loss': 'mse', 'optimizer': 'adam', 'graph_mode': 'cutoff', 'cutoff': 0.5047749370139633, 'grm_norm': 'cosine', 'self_loops': True}. Best is trial 81 with value: 0.2707388309772711.
[I 2025-10-22 13:58:40,504] Trial 86 finished with value: 0.2591652891305233 and parameters: {'model_type': 'gat', 'hidden_dims': '[512, 64]', 'dropout': 0.5352767037897996, 'batch_norm': False, 'gat_heads': 8, 'gat_attn_dropout': 0.12084933744764946, 'gat_concat_hidden': False, 'lr': 5.0619893985414116e-05, 'weight_decay': 2.5829914246624457e-05, 'epochs': 103, 'loss': 'mse', 'optimizer': 'adam', 'graph_mode': 'cutoff', 'cutoff': 0.47922923926062777, 'grm_norm': 'cosine', 'self_loops': True}. Best is trial 81 with value: 0.2707388309772711.
[I 2025-10-22 13:59:17,971] Trial 87 finished with value: 0.2047040469911276 and parameters: {'model_type': 'gat', 'hidden_dims': '[512, 64]', 'dropout': 0.5401070002739707, 'batch_norm': False, 'gat_heads': 1, 'gat_attn_dropout': 0.12195000268640596, 'gat_concat_hidden': False, 'lr': 4.9150055451703e-05, 'weight_decay': 5.555164786372804e-05, 'epochs': 101, 'loss': 'mse', 'optimizer': 'adam', 'graph_mode': 'cutoff', 'cutoff': 0.44715134827980474, 'grm_norm': 'cosine', 'self_loops': True}. Best is trial 81 with value: 0.2707388309772711.
[I 2025-10-22 14:02:57,506] Trial 88 finished with value: 0.24516526084291584 and parameters: {'model_type': 'gat', 'hidden_dims': '[512, 256]', 'dropout': 0.4863531016014985, 'batch_norm': False, 'gat_heads': 7, 'gat_attn_dropout': 0.07795469724279744, 'gat_concat_hidden': False, 'lr': 6.115659645639782e-05, 'weight_decay': 2.878645994043916e-05, 'epochs': 93, 'loss': 'mse', 'optimizer': 'adam', 'graph_mode': 'cutoff', 'cutoff': 0.473374165707264, 'grm_norm': 'cosine', 'self_loops': True}. Best is trial 81 with value: 0.2707388309772711.
[I 2025-10-22 14:06:18,110] Trial 89 finished with value: 0.2570854354110442 and parameters: {'model_type': 'gat', 'hidden_dims': '[512, 64]', 'dropout': 0.5164672592015754, 'batch_norm': False, 'gat_heads': 8, 'gat_attn_dropout': 0.1412459576688265, 'gat_concat_hidden': False, 'lr': 1.3244689150302085e-05, 'weight_decay': 4.753340922865795e-05, 'epochs': 70, 'loss': 'mse', 'optimizer': 'adam', 'graph_mode': 'cutoff', 'cutoff': 0.42496097398350685, 'grm_norm': 'cosine', 'self_loops': True}. Best is trial 81 with value: 0.2707388309772711.
[I 2025-10-22 14:07:28,284] Trial 90 finished with value: 0.24133117601042944 and parameters: {'model_type': 'gat', 'hidden_dims': '[512, 64]', 'dropout': 0.5371097692056339, 'batch_norm': False, 'gat_heads': 2, 'gat_attn_dropout': 0.1109921070445972, 'gat_concat_hidden': False, 'lr': 4.47977095864256e-05, 'weight_decay': 1.2695664094306433e-05, 'epochs': 104, 'loss': 'mse', 'optimizer': 'adam', 'graph_mode': 'cutoff', 'cutoff': 0.5542743947569567, 'grm_norm': 'cosine', 'self_loops': True}. Best is trial 81 with value: 0.2707388309772711.
[I 2025-10-22 14:10:28,667] Trial 91 finished with value: 0.2546238422128956 and parameters: {'model_type': 'gat', 'hidden_dims': '[512, 64]', 'dropout': 0.5194961031942812, 'batch_norm': False, 'gat_heads': 8, 'gat_attn_dropout': 0.1552634540286974, 'gat_concat_hidden': False, 'lr': 3.322357261776541e-05, 'weight_decay': 2.4147416199743812e-05, 'epochs': 62, 'loss': 'mse', 'optimizer': 'adam', 'graph_mode': 'cutoff', 'cutoff': 0.4925824347292375, 'grm_norm': 'none', 'self_loops': True}. Best is trial 81 with value: 0.2707388309772711.
[I 2025-10-22 14:14:10,298] Trial 92 finished with value: 0.24169743012933367 and parameters: {'model_type': 'gat', 'hidden_dims': '[512, 64]', 'dropout': 0.57647979344854, 'batch_norm': False, 'gat_heads': 8, 'gat_attn_dropout': 0.20904611735998416, 'gat_concat_hidden': False, 'lr': 2.021466792003257e-05, 'weight_decay': 2.5708437281913585e-05, 'epochs': 79, 'loss': 'mse', 'optimizer': 'adam', 'graph_mode': 'cutoff', 'cutoff': 0.4607177888692053, 'grm_norm': 'none', 'self_loops': True}. Best is trial 81 with value: 0.2707388309772711.
[I 2025-10-22 14:18:06,264] Trial 93 finished with value: 0.25531196978803194 and parameters: {'model_type': 'gat', 'hidden_dims': '[512, 64]', 'dropout': 0.5622593118602657, 'batch_norm': False, 'gat_heads': 8, 'gat_attn_dropout': 0.16436550486654494, 'gat_concat_hidden': False, 'lr': 2.5210251649513945e-05, 'weight_decay': 3.4660773541436895e-05, 'epochs': 86, 'loss': 'mse', 'optimizer': 'adam', 'graph_mode': 'cutoff', 'cutoff': 0.5139217539500708, 'grm_norm': 'cosine', 'self_loops': True}. Best is trial 81 with value: 0.2707388309772711.
[I 2025-10-22 14:23:15,377] Trial 94 finished with value: 0.2462203343077797 and parameters: {'model_type': 'gat', 'hidden_dims': '[512, 64]', 'dropout': 0.5489477614471572, 'batch_norm': False, 'gat_heads': 8, 'gat_attn_dropout': 0.08742059537189362, 'gat_concat_hidden': False, 'lr': 7.448765521834141e-05, 'weight_decay': 1.4707220004254021e-05, 'epochs': 118, 'loss': 'mse', 'optimizer': 'adam', 'graph_mode': 'cutoff', 'cutoff': 0.5921384524783844, 'grm_norm': 'none', 'self_loops': True}. Best is trial 81 with value: 0.2707388309772711.
[I 2025-10-22 14:24:04,110] Trial 95 finished with value: 0.2659430250584986 and parameters: {'model_type': 'gat', 'hidden_dims': '[128, 64]', 'dropout': 0.5859855939936541, 'batch_norm': False, 'gat_heads': 7, 'gat_attn_dropout': 0.13136429925603393, 'gat_concat_hidden': False, 'lr': 5.700979935249175e-05, 'weight_decay': 1.064132976159131e-05, 'epochs': 69, 'loss': 'mse', 'optimizer': 'adam', 'graph_mode': 'cutoff', 'cutoff': 0.5514075304219863, 'grm_norm': 'none', 'self_loops': True}. Best is trial 81 with value: 0.2707388309772711.
[I 2025-10-22 14:25:08,678] Trial 96 finished with value: 0.24009108481715544 and parameters: {'model_type': 'gat', 'hidden_dims': '[128, 64]', 'dropout': 0.5801688809869906, 'batch_norm': False, 'gat_heads': 7, 'gat_attn_dropout': 0.0029535881016683474, 'gat_concat_hidden': False, 'lr': 5.8104974650577054e-05, 'weight_decay': 1.0725455933831911e-05, 'epochs': 95, 'loss': 'mse', 'optimizer': 'adam', 'graph_mode': 'cutoff', 'cutoff': 0.4878553314840522, 'grm_norm': 'cosine', 'self_loops': True}. Best is trial 81 with value: 0.2707388309772711.
[I 2025-10-22 14:25:57,523] Trial 97 finished with value: 0.25243921194990443 and parameters: {'model_type': 'gat', 'hidden_dims': '[128, 64]', 'dropout': 0.528092215688495, 'batch_norm': False, 'gat_heads': 7, 'gat_attn_dropout': 0.13402778537445692, 'gat_concat_hidden': False, 'lr': 7.13368205654961e-05, 'weight_decay': 7.674174944240399e-06, 'epochs': 69, 'loss': 'mse', 'optimizer': 'adam', 'graph_mode': 'cutoff', 'cutoff': 0.5511645988546942, 'grm_norm': 'none', 'self_loops': True}. Best is trial 81 with value: 0.2707388309772711.
[I 2025-10-22 14:26:37,102] Trial 98 finished with value: 0.14977006888455754 and parameters: {'model_type': 'gat', 'hidden_dims': '[128, 64]', 'dropout': 0.44813760147465936, 'batch_norm': True, 'gat_heads': 8, 'gat_attn_dropout': 0.11354904180840313, 'gat_concat_hidden': False, 'lr': 3.80060859162849e-05, 'weight_decay': 3.5526389356439354e-05, 'epochs': 48, 'loss': 'mse', 'optimizer': 'adam', 'graph_mode': 'knn', 'source': 'grm', 'knn_k': 7, 'weighted_edges': False, 'symmetrize_mode': 'union'}. Best is trial 81 with value: 0.2707388309772711.
[I 2025-10-22 14:27:53,564] Trial 99 finished with value: 0.23036169762878994 and parameters: {'model_type': 'gat', 'hidden_dims': '[128, 64]', 'dropout': 0.5631561763781298, 'batch_norm': False, 'gat_heads': 8, 'gat_attn_dropout': 0.23430889785282127, 'gat_concat_hidden': False, 'lr': 4.803201560630863e-05, 'weight_decay': 7.344423708612857e-05, 'epochs': 112, 'loss': 'mse', 'optimizer': 'adam', 'graph_mode': 'cutoff', 'cutoff': 0.35695177231780917, 'grm_norm': 'none', 'self_loops': True}. Best is trial 81 with value: 0.2707388309772711.
[I 2025-10-22 14:29:38,169] Trial 100 finished with value: 0.2421687185801679 and parameters: {'model_type': 'gat', 'hidden_dims': '[256, 128, 64]', 'dropout': 0.5093069576836013, 'batch_norm': False, 'gat_heads': 7, 'gat_attn_dropout': 0.2742412232582799, 'gat_concat_hidden': False, 'lr': 5.986301172811232e-06, 'weight_decay': 1.6077385902430422e-05, 'epochs': 86, 'loss': 'mse', 'optimizer': 'adam', 'graph_mode': 'cutoff', 'cutoff': 0.510217753556226, 'grm_norm': 'none', 'self_loops': True}. Best is trial 81 with value: 0.2707388309772711.
[I 2025-10-22 14:32:29,874] Trial 101 finished with value: 0.25141783888353164 and parameters: {'model_type': 'gat', 'hidden_dims': '[512, 64]', 'dropout': 0.5974974576443146, 'batch_norm': False, 'gat_heads': 8, 'gat_attn_dropout': 0.17961163266591265, 'gat_concat_hidden': False, 'lr': 2.919027515441692e-05, 'weight_decay': 2.405884453379115e-05, 'epochs': 59, 'loss': 'mse', 'optimizer': 'adam', 'graph_mode': 'cutoff', 'cutoff': 0.5653240048722444, 'grm_norm': 'none', 'self_loops': True}. Best is trial 81 with value: 0.2707388309772711.
[I 2025-10-22 14:36:03,902] Trial 102 finished with value: 0.24639566769662155 and parameters: {'model_type': 'gat', 'hidden_dims': '[512, 64]', 'dropout': 0.5842751586025009, 'batch_norm': False, 'gat_heads': 8, 'gat_attn_dropout': 0.15647933673819137, 'gat_concat_hidden': False, 'lr': 2.387443144280842e-05, 'weight_decay': 5.6075249893760355e-05, 'epochs': 76, 'loss': 'mse', 'optimizer': 'adam', 'graph_mode': 'cutoff', 'cutoff': 0.5428825205205111, 'grm_norm': 'none', 'self_loops': True}. Best is trial 81 with value: 0.2707388309772711.
[I 2025-10-22 14:37:39,886] Trial 103 finished with value: 0.2627467098457804 and parameters: {'model_type': 'gat', 'hidden_dims': '[256, 128]', 'dropout': 0.5715935760337052, 'batch_norm': False, 'gat_heads': 8, 'gat_attn_dropout': 0.12710297851934615, 'gat_concat_hidden': False, 'lr': 3.563781399983594e-05, 'weight_decay': 1.9360399531548993e-05, 'epochs': 66, 'loss': 'mse', 'optimizer': 'adam', 'graph_mode': 'cutoff', 'cutoff': 0.513783374822904, 'grm_norm': 'none', 'self_loops': True}. Best is trial 81 with value: 0.2707388309772711.
[I 2025-10-22 14:39:19,244] Trial 104 finished with value: 0.2540006214380587 and parameters: {'model_type': 'gat', 'hidden_dims': '[256, 128]', 'dropout': 0.5455441492095618, 'batch_norm': False, 'gat_heads': 8, 'gat_attn_dropout': 0.13716447493450507, 'gat_concat_hidden': False, 'lr': 1.817855135744298e-05, 'weight_decay': 2.884551229263697e-05, 'epochs': 68, 'loss': 'mse', 'optimizer': 'adam', 'graph_mode': 'cutoff', 'cutoff': 0.4328186364791507, 'grm_norm': 'none', 'self_loops': True}. Best is trial 81 with value: 0.2707388309772711.
[I 2025-10-22 14:40:32,528] Trial 105 finished with value: 0.24236885132705982 and parameters: {'model_type': 'gat', 'hidden_dims': '[256, 128]', 'dropout': 0.5539571743180217, 'batch_norm': False, 'gat_heads': 4, 'gat_attn_dropout': 0.12558156143577953, 'gat_concat_hidden': False, 'lr': 5.93350084254521e-05, 'weight_decay': 8.983898385597309e-06, 'epochs': 108, 'loss': 'mse', 'optimizer': 'adam', 'graph_mode': 'cutoff', 'cutoff': 0.45841254705095813, 'grm_norm': 'cosine', 'self_loops': True}. Best is trial 81 with value: 0.2707388309772711.
[I 2025-10-22 14:43:19,345] Trial 106 finished with value: 0.19852205451257116 and parameters: {'model_type': 'gat', 'hidden_dims': '[256, 128]', 'dropout': 0.5685996774544274, 'batch_norm': False, 'gat_heads': 8, 'gat_attn_dropout': 0.04880022368688542, 'gat_concat_hidden': False, 'lr': 8.562529519488657e-05, 'weight_decay': 1.3187760205781137e-05, 'epochs': 119, 'loss': 'mse', 'optimizer': 'adam', 'graph_mode': 'cutoff', 'cutoff': 0.24442895435545403, 'grm_norm': 'none', 'self_loops': True}. Best is trial 81 with value: 0.2707388309772711.
[I 2025-10-22 14:44:31,286] Trial 107 finished with value: 0.26537529362992063 and parameters: {'model_type': 'gat', 'hidden_dims': '[256, 128]', 'dropout': 0.486434449851002, 'batch_norm': False, 'gat_heads': 8, 'gat_attn_dropout': 0.1042497894448676, 'gat_concat_hidden': False, 'lr': 3.68794876830992e-05, 'weight_decay': 1.9249493769559638e-05, 'epochs': 46, 'loss': 'mse', 'optimizer': 'adam', 'graph_mode': 'cutoff', 'cutoff': 0.5102632134995151, 'grm_norm': 'none', 'self_loops': True}. Best is trial 81 with value: 0.2707388309772711.
[I 2025-10-22 14:45:31,199] Trial 108 finished with value: 0.26398887886253036 and parameters: {'model_type': 'gat', 'hidden_dims': '[256, 128]', 'dropout': 0.49310937679184724, 'batch_norm': False, 'gat_heads': 7, 'gat_attn_dropout': 0.10373664882534006, 'gat_concat_hidden': False, 'lr': 4.328183515056463e-05, 'weight_decay': 1.8714033089829607e-05, 'epochs': 44, 'loss': 'mse', 'optimizer': 'adam', 'graph_mode': 'cutoff', 'cutoff': 0.5124765548311019, 'grm_norm': 'none', 'self_loops': True}. Best is trial 81 with value: 0.2707388309772711.
[I 2025-10-22 14:46:31,789] Trial 109 finished with value: 0.2555991371604767 and parameters: {'model_type': 'gat', 'hidden_dims': '[256, 128]', 'dropout': 0.4968091598457304, 'batch_norm': False, 'gat_heads': 7, 'gat_attn_dropout': 0.08628675344417222, 'gat_concat_hidden': False, 'lr': 4.450723713723026e-05, 'weight_decay': 1.859341504992171e-05, 'epochs': 45, 'loss': 'mse', 'optimizer': 'adam', 'graph_mode': 'cutoff', 'cutoff': 0.592424898291771, 'grm_norm': 'none', 'self_loops': True}. Best is trial 81 with value: 0.2707388309772711.
[I 2025-10-22 14:47:35,818] Trial 110 finished with value: 0.26114265173263124 and parameters: {'model_type': 'gat', 'hidden_dims': '[256, 128]', 'dropout': 0.48686960664689233, 'batch_norm': False, 'gat_heads': 7, 'gat_attn_dropout': 0.1766593414009455, 'gat_concat_hidden': False, 'lr': 3.855049767110529e-05, 'weight_decay': 1.4396868364023646e-05, 'epochs': 48, 'loss': 'mse', 'optimizer': 'adam', 'graph_mode': 'cutoff', 'cutoff': 0.5139754254147988, 'grm_norm': 'none', 'self_loops': True}. Best is trial 81 with value: 0.2707388309772711.
[I 2025-10-22 14:48:41,071] Trial 111 finished with value: 0.26479765101991015 and parameters: {'model_type': 'gat', 'hidden_dims': '[256, 128]', 'dropout': 0.487680450548896, 'batch_norm': False, 'gat_heads': 7, 'gat_attn_dropout': 0.10575649418714107, 'gat_concat_hidden': False, 'lr': 3.652015138852626e-05, 'weight_decay': 6.025434308605366e-06, 'epochs': 49, 'loss': 'mse', 'optimizer': 'adam', 'graph_mode': 'cutoff', 'cutoff': 0.5102613358671924, 'grm_norm': 'none', 'self_loops': True}. Best is trial 81 with value: 0.2707388309772711.
[I 2025-10-22 14:49:38,044] Trial 112 finished with value: 0.26824795332984996 and parameters: {'model_type': 'gat', 'hidden_dims': '[256, 128]', 'dropout': 0.45632297917858355, 'batch_norm': False, 'gat_heads': 7, 'gat_attn_dropout': 0.150126435692428, 'gat_concat_hidden': False, 'lr': 3.810351908766891e-05, 'weight_decay': 4.459057496588514e-06, 'epochs': 41, 'loss': 'mse', 'optimizer': 'adam', 'graph_mode': 'cutoff', 'cutoff': 0.5151054937047003, 'grm_norm': 'none', 'self_loops': True}. Best is trial 81 with value: 0.2707388309772711.
[I 2025-10-22 14:50:34,228] Trial 113 finished with value: 0.25546265145196156 and parameters: {'model_type': 'gat', 'hidden_dims': '[256, 128]', 'dropout': 0.4820953776877048, 'batch_norm': False, 'gat_heads': 7, 'gat_attn_dropout': 0.10706353458155443, 'gat_concat_hidden': False, 'lr': 3.7177891357662024e-05, 'weight_decay': 4.26575880593965e-06, 'epochs': 40, 'loss': 'mse', 'optimizer': 'adam', 'graph_mode': 'cutoff', 'cutoff': 0.5052965618403187, 'grm_norm': 'none', 'self_loops': True}. Best is trial 81 with value: 0.2707388309772711.
[I 2025-10-22 14:51:35,056] Trial 114 finished with value: 0.2604808006557724 and parameters: {'model_type': 'gat', 'hidden_dims': '[256, 128]', 'dropout': 0.4541823688492058, 'batch_norm': False, 'gat_heads': 7, 'gat_attn_dropout': 0.1455949266251122, 'gat_concat_hidden': False, 'lr': 2.7770982913870917e-05, 'weight_decay': 3.0269505777230584e-06, 'epochs': 45, 'loss': 'mse', 'optimizer': 'adam', 'graph_mode': 'cutoff', 'cutoff': 0.5448871825591205, 'grm_norm': 'none', 'self_loops': True}. Best is trial 81 with value: 0.2707388309772711.
[I 2025-10-22 14:52:40,528] Trial 115 finished with value: 0.255879678855213 and parameters: {'model_type': 'gat', 'hidden_dims': '[256, 128]', 'dropout': 0.489460833753607, 'batch_norm': False, 'gat_heads': 7, 'gat_attn_dropout': 0.08001430389665698, 'gat_concat_hidden': False, 'lr': 3.411206783663455e-05, 'weight_decay': 5.804005507047334e-06, 'epochs': 49, 'loss': 'mse', 'optimizer': 'adam', 'graph_mode': 'cutoff', 'cutoff': 0.4899123394740995, 'grm_norm': 'none', 'self_loops': True}. Best is trial 81 with value: 0.2707388309772711.
