[I 2025-11-03 13:07:44,147] Trial 90 finished with value: 0.08664880361234224 and parameters: {'model_type': 'gcn', 'hidden_dims': '[512, 64]', 'dropout': 0.1285861684088465, 'batch_norm': False, 'lr': 0.0001660234355687106, 'weight_decay': 7.977452052560934e-06, 'epochs': 170, 'loss': 'mse', 'optimizer': 'adam', 'graph_mode': 'cutoff', 'cutoff': 0.5069943182090798, 'grm_norm': 'cosine', 'self_loops': True, 'use_snp_selection': True, 'num_snps': 35340}. Best is trial 86 with value: 0.09740689525741682.
[I 2025-11-03 13:07:47,516] Trial 91 finished with value: 0.03681282687313843 and parameters: {'model_type': 'gcn', 'hidden_dims': '[512, 64]', 'dropout': 0.3845516047408, 'batch_norm': False, 'lr': 0.00011908887269588887, 'weight_decay': 2.261438134272834e-06, 'epochs': 151, 'loss': 'mse', 'optimizer': 'adam', 'graph_mode': 'cutoff', 'cutoff': 0.47984333418044306, 'grm_norm': 'cosine', 'self_loops': True, 'use_snp_selection': True, 'num_snps': 35589}. Best is trial 86 with value: 0.09740689525741682.
[I 2025-11-03 13:07:50,139] Trial 92 finished with value: 0.07798672472122142 and parameters: {'model_type': 'gcn', 'hidden_dims': '[512, 64]', 'dropout': 0.12900193009257024, 'batch_norm': False, 'lr': 0.00016039880616214598, 'weight_decay': 4.300224958590206e-07, 'epochs': 184, 'loss': 'mse', 'optimizer': 'adam', 'graph_mode': 'cutoff', 'cutoff': 0.5326196836292106, 'grm_norm': 'cosine', 'self_loops': True, 'use_snp_selection': True, 'num_snps': 18174}. Best is trial 86 with value: 0.09740689525741682.
[I 2025-11-03 13:07:53,401] Trial 93 finished with value: 0.04887760900612204 and parameters: {'model_type': 'gcn', 'hidden_dims': '[512, 64]', 'dropout': 0.15487983312979178, 'batch_norm': False, 'lr': 0.0001414163834966294, 'weight_decay': 0.0006997501135948811, 'epochs': 173, 'loss': 'mse', 'optimizer': 'adam', 'graph_mode': 'cutoff', 'cutoff': 0.4270160141672158, 'grm_norm': 'cosine', 'self_loops': True, 'use_snp_selection': True, 'num_snps': 31064}. Best is trial 86 with value: 0.09740689525741682.
[I 2025-11-03 13:07:57,018] Trial 94 finished with value: 0.07543613677015427 and parameters: {'model_type': 'gcn', 'hidden_dims': '[512, 64]', 'dropout': 0.18899492633674692, 'batch_norm': False, 'lr': 0.0002841207580828602, 'weight_decay': 2.3361876637057107e-05, 'epochs': 160, 'loss': 'mse', 'optimizer': 'adam', 'graph_mode': 'cutoff', 'cutoff': 0.6074270318408327, 'grm_norm': 'cosine', 'self_loops': True, 'use_snp_selection': True, 'num_snps': 40464}. Best is trial 86 with value: 0.09740689525741682.
[I 2025-11-03 13:07:58,841] Trial 95 finished with value: 0.06278138289945107 and parameters: {'model_type': 'gcn', 'hidden_dims': '[512, 256]', 'dropout': 0.16739883068543496, 'batch_norm': False, 'lr': 0.00019762809594813286, 'weight_decay': 1.729244112062485e-05, 'epochs': 111, 'loss': 'mse', 'optimizer': 'adam', 'graph_mode': 'cutoff', 'cutoff': 0.5712607800484673, 'grm_norm': 'cosine_then_gcn', 'self_loops': True, 'use_snp_selection': True, 'num_snps': 7706}. Best is trial 86 with value: 0.09740689525741682.
[I 2025-11-03 13:08:01,640] Trial 96 finished with value: 0.027874412783966716 and parameters: {'model_type': 'gcn', 'hidden_dims': '[512, 64]', 'dropout': 0.5945446905065848, 'batch_norm': False, 'lr': 7.794619925317767e-05, 'weight_decay': 2.798492611976568e-07, 'epochs': 196, 'loss': 'mse', 'optimizer': 'adam', 'graph_mode': 'cutoff', 'cutoff': 0.5016729906409885, 'grm_norm': 'cosine_then_gcn', 'self_loops': True, 'use_snp_selection': True, 'num_snps': 22996}. Best is trial 86 with value: 0.09740689525741682.
[I 2025-11-03 13:08:04,865] Trial 97 finished with value: 0.040493264856300844 and parameters: {'model_type': 'gcn', 'hidden_dims': '[256, 128, 64]', 'dropout': 0.41134116434392, 'batch_norm': False, 'lr': 0.00011838476565230174, 'weight_decay': 5.648038136651154e-07, 'epochs': 246, 'loss': 'mae', 'optimizer': 'adam', 'graph_mode': 'cutoff', 'cutoff': 0.3632719668336981, 'grm_norm': 'cosine_then_gcn', 'self_loops': True, 'use_snp_selection': True, 'num_snps': 28885}. Best is trial 86 with value: 0.09740689525741682.
[I 2025-11-03 13:08:07,983] Trial 98 finished with value: 0.06148423287745782 and parameters: {'model_type': 'gcn', 'hidden_dims': '[128, 64]', 'dropout': 0.1373201170366924, 'batch_norm': False, 'lr': 0.00016714028911360266, 'weight_decay': 7.807684072332796e-06, 'epochs': 129, 'loss': 'mse', 'optimizer': 'adam', 'graph_mode': 'cutoff', 'cutoff': 0.8773814013928248, 'grm_norm': 'gcn', 'self_loops': False, 'use_snp_selection': True, 'num_snps': 47952}. Best is trial 86 with value: 0.09740689525741682.
[I 2025-11-03 13:08:11,119] Trial 99 finished with value: 0.06902777260625606 and parameters: {'model_type': 'gcn', 'hidden_dims': '[512, 64]', 'dropout': 0.15115470359899666, 'batch_norm': False, 'lr': 5.376130627747859e-05, 'weight_decay': 1.2035889472336107e-07, 'epochs': 142, 'loss': 'mae', 'optimizer': 'adam', 'graph_mode': 'cutoff', 'cutoff': 0.6914630080572981, 'grm_norm': 'cosine_then_gcn', 'self_loops': True, 'use_snp_selection': True, 'num_snps': 32526}. Best is trial 86 with value: 0.09740689525741682.
[I 2025-11-03 13:08:13,528] Trial 100 finished with value: 0.07700455345523713 and parameters: {'model_type': 'gcn', 'hidden_dims': '[256, 128, 64]', 'dropout': 0.11172875214005824, 'batch_norm': True, 'lr': 0.00010510691997345273, 'weight_decay': 7.152566357304608e-05, 'epochs': 203, 'loss': 'mse', 'optimizer': 'adam', 'graph_mode': 'cutoff', 'cutoff': 0.6468926420252147, 'grm_norm': 'none', 'self_loops': True, 'use_snp_selection': False}. Best is trial 86 with value: 0.09740689525741682.
[I 2025-11-03 13:08:15,768] Trial 101 finished with value: 0.07755040330659815 and parameters: {'model_type': 'gcn', 'hidden_dims': '[256, 128]', 'dropout': 0.11802183178893536, 'batch_norm': True, 'lr': 8.758294055976994e-05, 'weight_decay': 3.488333522090449e-05, 'epochs': 213, 'loss': 'mse', 'optimizer': 'adam', 'graph_mode': 'cutoff', 'cutoff': 0.7978952596100592, 'grm_norm': 'cosine_then_gcn', 'self_loops': True, 'use_snp_selection': False}. Best is trial 86 with value: 0.09740689525741682.
[I 2025-11-03 13:08:18,397] Trial 102 finished with value: 0.04820358258444202 and parameters: {'model_type': 'gcn', 'hidden_dims': '[256, 128]', 'dropout': 0.13112336097309113, 'batch_norm': True, 'lr': 6.410513338564813e-05, 'weight_decay': 1.2473218184364212e-05, 'epochs': 287, 'loss': 'mse', 'optimizer': 'adam', 'graph_mode': 'cutoff', 'cutoff': 0.8692916384307222, 'grm_norm': 'cosine_then_gcn', 'self_loops': True, 'use_snp_selection': False}. Best is trial 86 with value: 0.09740689525741682.
[I 2025-11-03 13:08:21,203] Trial 103 finished with value: 0.07652896948665755 and parameters: {'model_type': 'gcn', 'hidden_dims': '[256, 128]', 'dropout': 0.16210328265926732, 'batch_norm': True, 'lr': 0.00013823113369042993, 'weight_decay': 4.5724409531846055e-05, 'epochs': 321, 'loss': 'mse', 'optimizer': 'adam', 'graph_mode': 'cutoff', 'cutoff': 0.7574695101663091, 'grm_norm': 'cosine_then_gcn', 'self_loops': True, 'use_snp_selection': False}. Best is trial 86 with value: 0.09740689525741682.
[I 2025-11-03 13:08:25,533] Trial 104 finished with value: 0.07480813229815188 and parameters: {'model_type': 'gcn', 'hidden_dims': '[512, 64]', 'dropout': 0.3642508958282534, 'batch_norm': True, 'lr': 9.191834188572982e-05, 'weight_decay': 3.6758869249404196e-05, 'epochs': 350, 'loss': 'mse', 'optimizer': 'adam', 'graph_mode': 'cutoff', 'cutoff': 0.7209813883036522, 'grm_norm': 'cosine_then_gcn', 'self_loops': True, 'use_snp_selection': False}. Best is trial 86 with value: 0.09740689525741682.
[I 2025-11-03 13:08:27,142] Trial 105 finished with value: 0.07458327803293546 and parameters: {'model_type': 'gcn', 'hidden_dims': '[128, 64]', 'dropout': 0.14196744813486809, 'batch_norm': True, 'lr': 0.0001156999790566702, 'weight_decay': 2.340189553357356e-07, 'epochs': 164, 'loss': 'mse', 'optimizer': 'adam', 'graph_mode': 'cutoff', 'cutoff': 0.8285024802613749, 'grm_norm': 'cosine_then_gcn', 'self_loops': True, 'use_snp_selection': False}. Best is trial 86 with value: 0.09740689525741682.
[I 2025-11-03 13:08:29,228] Trial 106 finished with value: 0.06600880200302285 and parameters: {'model_type': 'gcn', 'hidden_dims': '[256, 128]', 'dropout': 0.17953126682082976, 'batch_norm': True, 'lr': 0.0002018032790989716, 'weight_decay': 1.1523346436370674e-06, 'epochs': 186, 'loss': 'mse', 'optimizer': 'adam', 'graph_mode': 'cutoff', 'cutoff': 0.8985641243824102, 'grm_norm': 'cosine_then_gcn', 'self_loops': True, 'use_snp_selection': False}. Best is trial 86 with value: 0.09740689525741682.
[I 2025-11-03 13:08:32,418] Trial 107 finished with value: 0.06555634963125724 and parameters: {'model_type': 'gcn', 'hidden_dims': '[256, 128, 64]', 'dropout': 0.10990022525392905, 'batch_norm': True, 'lr': 0.00024831701821870385, 'weight_decay': 1.7481953928928176e-05, 'epochs': 332, 'loss': 'mae', 'optimizer': 'adam', 'graph_mode': 'cutoff', 'cutoff': 0.8012366971612415, 'grm_norm': 'cosine', 'self_loops': True, 'use_snp_selection': False}. Best is trial 86 with value: 0.09740689525741682.
[I 2025-11-03 13:08:36,321] Trial 108 finished with value: 0.06703574998389145 and parameters: {'model_type': 'gcn', 'hidden_dims': '[512, 64]', 'dropout': 0.49123897873256916, 'batch_norm': True, 'lr': 0.00035609885731224415, 'weight_decay': 2.7466808203838856e-05, 'epochs': 302, 'loss': 'mse', 'optimizer': 'adam', 'graph_mode': 'cutoff', 'cutoff': 0.850864090737516, 'grm_norm': 'cosine_then_gcn', 'self_loops': True, 'use_snp_selection': False}. Best is trial 86 with value: 0.09740689525741682.
[I 2025-11-03 13:08:38,650] Trial 109 finished with value: 0.06021572702494396 and parameters: {'model_type': 'gcn', 'hidden_dims': '[256, 128]', 'dropout': 0.33565314149457476, 'batch_norm': False, 'lr': 0.000469302449905535, 'weight_decay': 5.244298645241001e-05, 'epochs': 90, 'loss': 'mae', 'optimizer': 'adam', 'graph_mode': 'cutoff', 'cutoff': 0.484127989274306, 'grm_norm': 'cosine_then_gcn', 'self_loops': True, 'use_snp_selection': True, 'num_snps': 25985}. Best is trial 86 with value: 0.09740689525741682.
[I 2025-11-03 13:08:42,715] Trial 110 finished with value: 0.015363232024490294 and parameters: {'model_type': 'gcn', 'hidden_dims': '[512, 256]', 'dropout': 0.12591020860027236, 'batch_norm': True, 'lr': 1.0944336171854157e-05, 'weight_decay': 3.800197657210061e-07, 'epochs': 312, 'loss': 'mse', 'optimizer': 'adam', 'graph_mode': 'cutoff', 'cutoff': 0.8376473859492348, 'grm_norm': 'cosine_then_gcn', 'self_loops': True, 'use_snp_selection': False}. Best is trial 86 with value: 0.09740689525741682.
[I 2025-11-03 13:08:44,675] Trial 111 finished with value: 0.07252675228570654 and parameters: {'model_type': 'gcn', 'hidden_dims': '[256, 128, 64]', 'dropout': 0.14450681659801834, 'batch_norm': True, 'lr': 0.00010659563202694538, 'weight_decay': 6.631049067821686e-06, 'epochs': 134, 'loss': 'mae', 'optimizer': 'adam', 'graph_mode': 'cutoff', 'cutoff': 0.8992117232583836, 'grm_norm': 'cosine_then_gcn', 'self_loops': True, 'use_snp_selection': False}. Best is trial 86 with value: 0.09740689525741682.
[I 2025-11-03 13:08:46,551] Trial 112 finished with value: 0.06092042778023591 and parameters: {'model_type': 'gcn', 'hidden_dims': '[256, 128, 64]', 'dropout': 0.15146084051458597, 'batch_norm': True, 'lr': 7.952736600672585e-05, 'weight_decay': 1.374462208807037e-05, 'epochs': 122, 'loss': 'mae', 'optimizer': 'adam', 'graph_mode': 'cutoff', 'cutoff': 0.8188429480790094, 'grm_norm': 'cosine_then_gcn', 'self_loops': True, 'use_snp_selection': False}. Best is trial 86 with value: 0.09740689525741682.
[I 2025-11-03 13:08:48,612] Trial 113 finished with value: 0.05262097403314119 and parameters: {'model_type': 'gcn', 'hidden_dims': '[256, 128, 64]', 'dropout': 0.2010286382439763, 'batch_norm': True, 'lr': 0.000131066781346694, 'weight_decay': 9.802639335125535e-06, 'epochs': 151, 'loss': 'mae', 'optimizer': 'adam', 'graph_mode': 'cutoff', 'cutoff': 0.8830191514381096, 'grm_norm': 'cosine_then_gcn', 'self_loops': True, 'use_snp_selection': False}. Best is trial 86 with value: 0.09740689525741682.
[I 2025-11-03 13:08:50,542] Trial 114 finished with value: 0.08481183639867479 and parameters: {'model_type': 'gcn', 'hidden_dims': '[256, 128, 64]', 'dropout': 0.17561959699343957, 'batch_norm': True, 'lr': 0.00016798283297360736, 'weight_decay': 0.0001664383967146468, 'epochs': 129, 'loss': 'mae', 'optimizer': 'adam', 'graph_mode': 'cutoff', 'cutoff': 0.7872911580306775, 'grm_norm': 'cosine_then_gcn', 'self_loops': True, 'use_snp_selection': False}. Best is trial 86 with value: 0.09740689525741682.
[I 2025-11-03 13:08:52,375] Trial 115 finished with value: 0.05902373742682981 and parameters: {'model_type': 'gcn', 'hidden_dims': '[256, 128, 64]', 'dropout': 0.17598938982687323, 'batch_norm': True, 'lr': 0.00015052407030382477, 'weight_decay': 0.0002657151063978941, 'epochs': 112, 'loss': 'mae', 'optimizer': 'adam', 'graph_mode': 'cutoff', 'cutoff': 0.7725499638368666, 'grm_norm': 'cosine_then_gcn', 'self_loops': True, 'use_snp_selection': False}. Best is trial 86 with value: 0.09740689525741682.
[I 2025-11-03 13:08:56,005] Trial 116 finished with value: 0.06560936263551796 and parameters: {'model_type': 'gcn', 'hidden_dims': '[512, 64]', 'dropout': 0.1008120361406311, 'batch_norm': True, 'lr': 0.00018891812985092108, 'weight_decay': 0.00036676154882332805, 'epochs': 270, 'loss': 'mae', 'optimizer': 'adam', 'graph_mode': 'cutoff', 'cutoff': 0.7497462646770361, 'grm_norm': 'gcn', 'self_loops': True, 'use_snp_selection': False}. Best is trial 86 with value: 0.09740689525741682.
[I 2025-11-03 13:08:58,032] Trial 117 finished with value: 0.036226859070932566 and parameters: {'model_type': 'gcn', 'hidden_dims': '[128, 64]', 'dropout': 0.19163591564093416, 'batch_norm': True, 'lr': 0.00017269921090323315, 'weight_decay': 0.00019489791558759446, 'epochs': 262, 'loss': 'mae', 'optimizer': 'adam', 'graph_mode': 'knn', 'source': 'grm', 'knn_k': 6, 'weighted_edges': True, 'symmetrize_mode': 'union', 'use_snp_selection': False}. Best is trial 86 with value: 0.09740689525741682.
[I 2025-11-03 13:09:01,286] Trial 118 finished with value: 0.07824862273376404 and parameters: {'model_type': 'gcn', 'hidden_dims': '[256, 128, 64]', 'dropout': 0.1695668689473064, 'batch_norm': True, 'lr': 9.805551347503142e-05, 'weight_decay': 0.00017194656908285457, 'epochs': 342, 'loss': 'mse', 'optimizer': 'adam', 'graph_mode': 'cutoff', 'cutoff': 0.8029777894273443, 'grm_norm': 'cosine_then_gcn', 'self_loops': False, 'use_snp_selection': False}. Best is trial 86 with value: 0.09740689525741682.
[I 2025-11-03 13:09:02,744] Trial 119 finished with value: 0.04821254529920201 and parameters: {'model_type': 'gcn', 'hidden_dims': '[256, 128]', 'dropout': 0.13352726722062366, 'batch_norm': True, 'lr': 0.0002154314769041067, 'weight_decay': 9.759798779128633e-05, 'epochs': 65, 'loss': 'mae', 'optimizer': 'adam', 'graph_mode': 'cutoff', 'cutoff': 0.6721414079654636, 'grm_norm': 'cosine_then_gcn', 'self_loops': True, 'use_snp_selection': False}. Best is trial 86 with value: 0.09740689525741682.
[I 2025-11-03 13:09:08,125] Trial 120 finished with value: 0.02653937817576585 and parameters: {'model_type': 'gcn', 'hidden_dims': '[512, 64]', 'dropout': 0.23180303481481734, 'batch_norm': False, 'lr': 0.00016180156800513838, 'weight_decay': 0.00013671105871863087, 'epochs': 283, 'loss': 'mse', 'optimizer': 'adam', 'graph_mode': 'knn', 'source': 'grm', 'knn_k': 4, 'weighted_edges': True, 'symmetrize_mode': 'union', 'use_snp_selection': True, 'num_snps': 55832}. Best is trial 86 with value: 0.09740689525741682.
[I 2025-11-03 13:09:11,440] Trial 121 finished with value: 0.04432096249374865 and parameters: {'model_type': 'gcn', 'hidden_dims': '[256, 128, 64]', 'dropout': 0.16059597278640947, 'batch_norm': True, 'lr': 9.735208661360931e-05, 'weight_decay': 0.00017528608444123927, 'epochs': 343, 'loss': 'mse', 'optimizer': 'adam', 'graph_mode': 'cutoff', 'cutoff': 0.7965604107117621, 'grm_norm': 'cosine_then_gcn', 'self_loops': False, 'use_snp_selection': False}. Best is trial 86 with value: 0.09740689525741682.
[I 2025-11-03 13:09:14,589] Trial 122 finished with value: 0.06762415468272952 and parameters: {'model_type': 'gcn', 'hidden_dims': '[256, 128, 64]', 'dropout': 0.18042115001952094, 'batch_norm': True, 'lr': 0.00013080912603053091, 'weight_decay': 0.00023004547235967195, 'epochs': 324, 'loss': 'mse', 'optimizer': 'adam', 'graph_mode': 'cutoff', 'cutoff': 0.8692342902850119, 'grm_norm': 'cosine_then_gcn', 'self_loops': False, 'use_snp_selection': False}. Best is trial 86 with value: 0.09740689525741682.
[I 2025-11-03 13:09:17,801] Trial 123 finished with value: 0.0256714220137063 and parameters: {'model_type': 'gcn', 'hidden_dims': '[256, 128, 64]', 'dropout': 0.1687096973523379, 'batch_norm': True, 'lr': 6.551210558070113e-05, 'weight_decay': 0.0005537768447915709, 'epochs': 331, 'loss': 'mse', 'optimizer': 'adam', 'graph_mode': 'cutoff', 'cutoff': 0.7836687112434101, 'grm_norm': 'cosine_then_gcn', 'self_loops': False, 'use_snp_selection': False}. Best is trial 86 with value: 0.09740689525741682.
[I 2025-11-03 13:09:20,022] Trial 124 finished with value: 0.06200731025264453 and parameters: {'model_type': 'gcn', 'hidden_dims': '[256, 128, 64]', 'dropout': 0.11683901054496208, 'batch_norm': True, 'lr': 0.00011519913596050467, 'weight_decay': 6.474264939623158e-05, 'epochs': 174, 'loss': 'mse', 'optimizer': 'adam', 'graph_mode': 'cutoff', 'cutoff': 0.844095088460086, 'grm_norm': 'cosine_then_gcn', 'self_loops': False, 'use_snp_selection': False}. Best is trial 86 with value: 0.09740689525741682.
[I 2025-11-03 13:09:23,135] Trial 125 finished with value: 0.07392636389478698 and parameters: {'model_type': 'gcn', 'hidden_dims': '[256, 128, 64]', 'dropout': 0.44323563723837056, 'batch_norm': True, 'lr': 9.377915290427659e-05, 'weight_decay': 0.00027918585412810634, 'epochs': 316, 'loss': 'mse', 'optimizer': 'adam', 'graph_mode': 'cutoff', 'cutoff': 0.5299627722186606, 'grm_norm': 'cosine', 'self_loops': True, 'use_snp_selection': False}. Best is trial 86 with value: 0.09740689525741682.
[I 2025-11-03 13:09:26,110] Trial 126 finished with value: 0.0686371393323153 and parameters: {'model_type': 'gcn', 'hidden_dims': '[256, 128, 64]', 'dropout': 0.3169001796022551, 'batch_norm': True, 'lr': 7.671083172873484e-05, 'weight_decay': 2.0191553830979237e-05, 'epochs': 295, 'loss': 'mae', 'optimizer': 'adam', 'graph_mode': 'cutoff', 'cutoff': 0.7084901503273628, 'grm_norm': 'cosine_then_gcn', 'self_loops': False, 'use_snp_selection': False}. Best is trial 86 with value: 0.09740689525741682.
[I 2025-11-03 13:09:30,360] Trial 127 finished with value: 0.07192598975282506 and parameters: {'model_type': 'gcn', 'hidden_dims': '[512, 128]', 'dropout': 0.15542244830882485, 'batch_norm': True, 'lr': 0.0003042924682129334, 'weight_decay': 8.212776090873052e-05, 'epochs': 343, 'loss': 'mse', 'optimizer': 'adam', 'graph_mode': 'cutoff', 'cutoff': 0.7635962870436303, 'grm_norm': 'none', 'self_loops': True, 'use_snp_selection': False}. Best is trial 86 with value: 0.09740689525741682.
[I 2025-11-03 13:09:33,603] Trial 128 finished with value: 0.06569069434922606 and parameters: {'model_type': 'gcn', 'hidden_dims': '[512, 64]', 'dropout': 0.21441830022294825, 'batch_norm': False, 'lr': 5.1291866462144845e-05, 'weight_decay': 4.202334340564455e-05, 'epochs': 98, 'loss': 'mae', 'optimizer': 'adam', 'graph_mode': 'cutoff', 'cutoff': 0.7330997598599356, 'grm_norm': 'cosine_then_gcn', 'self_loops': True, 'use_snp_selection': True, 'num_snps': 39916}. Best is trial 86 with value: 0.09740689525741682.
[I 2025-11-03 13:09:36,469] Trial 129 finished with value: 0.03358335584674676 and parameters: {'model_type': 'gcn', 'hidden_dims': '[256, 128]', 'dropout': 0.20065826067522688, 'batch_norm': True, 'lr': 0.0002638314842579148, 'weight_decay': 0.00013160774724891867, 'epochs': 307, 'loss': 'mse', 'optimizer': 'adam', 'graph_mode': 'knn', 'source': 'grm', 'knn_k': 9, 'weighted_edges': True, 'symmetrize_mode': 'union', 'use_snp_selection': False}. Best is trial 86 with value: 0.09740689525741682.
[I 2025-11-03 13:09:38,032] Trial 130 finished with value: 0.0693676106763511 and parameters: {'model_type': 'gcn', 'hidden_dims': '[128, 64]', 'dropout': 0.12799332361592047, 'batch_norm': True, 'lr': 0.00014049779533222638, 'weight_decay': 0.00015100365261741622, 'epochs': 148, 'loss': 'mae', 'optimizer': 'adam', 'graph_mode': 'cutoff', 'cutoff': 0.4549878167811268, 'grm_norm': 'cosine_then_gcn', 'self_loops': True, 'use_snp_selection': False}. Best is trial 86 with value: 0.09740689525741682.
[I 2025-11-03 13:09:39,936] Trial 131 finished with value: 0.08724975994248158 and parameters: {'model_type': 'gcn', 'hidden_dims': '[256, 128, 64]', 'dropout': 0.14238179575471333, 'batch_norm': True, 'lr': 0.00010729826126483499, 'weight_decay': 1.9408507825375863e-07, 'epochs': 127, 'loss': 'mae', 'optimizer': 'adam', 'graph_mode': 'cutoff', 'cutoff': 0.812837757761021, 'grm_norm': 'cosine_then_gcn', 'self_loops': True, 'use_snp_selection': False}. Best is trial 86 with value: 0.09740689525741682.
[I 2025-11-03 13:09:41,765] Trial 132 finished with value: 0.05523199553666958 and parameters: {'model_type': 'gcn', 'hidden_dims': '[256, 128, 64]', 'dropout': 0.14396956895845847, 'batch_norm': True, 'lr': 0.00010721598156677962, 'weight_decay': 2.5052497247558934e-05, 'epochs': 113, 'loss': 'mae', 'optimizer': 'adam', 'graph_mode': 'cutoff', 'cutoff': 0.8112277359513734, 'grm_norm': 'cosine_then_gcn', 'self_loops': True, 'use_snp_selection': False}. Best is trial 86 with value: 0.09740689525741682.
