[I 2025-11-03 13:22:11,416] Trial 50 finished with value: 0.08287479209390183 and parameters: {'model_type': 'gcn', 'hidden_dims': '[256, 128, 64]', 'dropout': 0.1898616085986071, 'batch_norm': True, 'lr': 0.00013869805059222, 'weight_decay': 7.215995287085553e-06, 'epochs': 305, 'loss': 'mae', 'optimizer': 'adam', 'graph_mode': 'knn', 'source': 'grm', 'knn_k': 8, 'weighted_edges': True, 'symmetrize_mode': 'mutual', 'use_snp_selection': False}. Best is trial 29 with value: 0.12547224693859224.
[I 2025-11-03 13:22:13,532] Trial 51 finished with value: 0.09314000516655009 and parameters: {'model_type': 'gcn', 'hidden_dims': '[128, 64]', 'dropout': 0.20979202796696295, 'batch_norm': True, 'lr': 0.00047939325677098316, 'weight_decay': 2.4085548269482546e-06, 'epochs': 326, 'loss': 'mae', 'optimizer': 'adam', 'graph_mode': 'knn', 'source': 'grm', 'knn_k': 1, 'weighted_edges': False, 'symmetrize_mode': 'mutual', 'use_snp_selection': False}. Best is trial 29 with value: 0.12547224693859224.
[I 2025-11-03 13:22:15,483] Trial 52 finished with value: 0.12074379728134904 and parameters: {'model_type': 'gcn', 'hidden_dims': '[128, 64]', 'dropout': 0.2511511755248455, 'batch_norm': True, 'lr': 0.0008133900750851765, 'weight_decay': 1.2370433471744115e-06, 'epochs': 272, 'loss': 'mae', 'optimizer': 'adam', 'graph_mode': 'knn', 'source': 'grm', 'knn_k': 1, 'weighted_edges': False, 'symmetrize_mode': 'mutual', 'use_snp_selection': False}. Best is trial 29 with value: 0.12547224693859224.
[I 2025-11-03 13:22:17,426] Trial 53 finished with value: 0.12552284880403508 and parameters: {'model_type': 'gcn', 'hidden_dims': '[128, 64]', 'dropout': 0.27560488050670107, 'batch_norm': True, 'lr': 0.0009927727266822186, 'weight_decay': 8.144862846239387e-06, 'epochs': 267, 'loss': 'mae', 'optimizer': 'adam', 'graph_mode': 'knn', 'source': 'grm', 'knn_k': 1, 'weighted_edges': False, 'symmetrize_mode': 'mutual', 'use_snp_selection': False}. Best is trial 53 with value: 0.12552284880403508.
[I 2025-11-03 13:22:19,273] Trial 54 finished with value: 0.08807520001904227 and parameters: {'model_type': 'gcn', 'hidden_dims': '[128, 64]', 'dropout': 0.2723613894255576, 'batch_norm': True, 'lr': 0.00024136217491644673, 'weight_decay': 7.400031069954245e-06, 'epochs': 241, 'loss': 'mae', 'optimizer': 'adam', 'graph_mode': 'knn', 'source': 'grm', 'knn_k': 2, 'weighted_edges': False, 'symmetrize_mode': 'mutual', 'use_snp_selection': False}. Best is trial 53 with value: 0.12552284880403508.
[I 2025-11-03 13:22:22,140] Trial 55 finished with value: 0.1058335025877312 and parameters: {'model_type': 'gcn', 'hidden_dims': '[512, 256]', 'dropout': 0.24380866600601592, 'batch_norm': True, 'lr': 0.0006969707785784056, 'weight_decay': 9.631707408685795e-07, 'epochs': 216, 'loss': 'mae', 'optimizer': 'adam', 'graph_mode': 'knn', 'source': 'grm', 'knn_k': 1, 'weighted_edges': False, 'symmetrize_mode': 'mutual', 'use_snp_selection': False}. Best is trial 53 with value: 0.12552284880403508.
[I 2025-11-03 13:22:24,105] Trial 56 finished with value: 0.09161409877895671 and parameters: {'model_type': 'gcn', 'hidden_dims': '[128, 64]', 'dropout': 0.30894612437679536, 'batch_norm': True, 'lr': 0.0003631727630971098, 'weight_decay': 1.854381129814183e-06, 'epochs': 276, 'loss': 'mae', 'optimizer': 'adam', 'graph_mode': 'knn', 'source': 'grm', 'knn_k': 1, 'weighted_edges': True, 'symmetrize_mode': 'union', 'use_snp_selection': False}. Best is trial 53 with value: 0.12552284880403508.
[I 2025-11-03 13:22:26,824] Trial 57 finished with value: 0.07146464107554662 and parameters: {'model_type': 'gcn', 'hidden_dims': '[512, 64]', 'dropout': 0.2670239078188833, 'batch_norm': True, 'lr': 0.0007639510271134371, 'weight_decay': 7.149168070691659e-07, 'epochs': 193, 'loss': 'mae', 'optimizer': 'adam', 'graph_mode': 'knn', 'source': 'grm', 'knn_k': 6, 'weighted_edges': False, 'symmetrize_mode': 'mutual', 'use_snp_selection': False}. Best is trial 53 with value: 0.12552284880403508.
[I 2025-11-03 13:22:28,911] Trial 58 finished with value: 0.08916897199508036 and parameters: {'model_type': 'gcn', 'hidden_dims': '[128, 64]', 'dropout': 0.2248055360677999, 'batch_norm': True, 'lr': 0.0009626356424779532, 'weight_decay': 3.0567707698233082e-06, 'epochs': 309, 'loss': 'mae', 'optimizer': 'adam', 'graph_mode': 'knn', 'source': 'grm', 'knn_k': 2, 'weighted_edges': False, 'symmetrize_mode': 'mutual', 'use_snp_selection': False}. Best is trial 53 with value: 0.12552284880403508.
[I 2025-11-03 13:22:30,951] Trial 59 finished with value: 0.07079111093893224 and parameters: {'model_type': 'gcn', 'hidden_dims': '[128, 64]', 'dropout': 0.28748829741202325, 'batch_norm': True, 'lr': 0.00024268926078601023, 'weight_decay': 1.338824591027723e-05, 'epochs': 294, 'loss': 'mae', 'optimizer': 'adam', 'graph_mode': 'knn', 'source': 'grm', 'knn_k': 3, 'weighted_edges': False, 'symmetrize_mode': 'mutual', 'use_snp_selection': False}. Best is trial 53 with value: 0.12552284880403508.
[I 2025-11-03 13:22:32,545] Trial 60 finished with value: -0.0013440725352260967 and parameters: {'model_type': 'gcn', 'hidden_dims': '[128, 64]', 'dropout': 0.2548818670244355, 'batch_norm': True, 'lr': 4.3926934558235344e-05, 'weight_decay': 8.196022747613849e-06, 'epochs': 169, 'loss': 'mae', 'optimizer': 'adam', 'graph_mode': 'knn', 'source': 'grm', 'knn_k': 1, 'weighted_edges': False, 'symmetrize_mode': 'union', 'use_snp_selection': False}. Best is trial 53 with value: 0.12552284880403508.
[I 2025-11-03 13:22:34,412] Trial 61 finished with value: 0.09574154331095958 and parameters: {'model_type': 'gcn', 'hidden_dims': '[128, 64]', 'dropout': 0.12134929780962612, 'batch_norm': True, 'lr': 0.0006333362660381659, 'weight_decay': 4.104641952010544e-06, 'epochs': 262, 'loss': 'mae', 'optimizer': 'adam', 'graph_mode': 'knn', 'source': 'grm', 'knn_k': 1, 'weighted_edges': False, 'symmetrize_mode': 'mutual', 'use_snp_selection': False}. Best is trial 53 with value: 0.12552284880403508.
[I 2025-11-03 13:22:36,222] Trial 62 finished with value: 0.12069218221307482 and parameters: {'model_type': 'gcn', 'hidden_dims': '[128, 64]', 'dropout': 0.30623769098506143, 'batch_norm': True, 'lr': 0.0008353597736072521, 'weight_decay': 1.6038412083867065e-06, 'epochs': 244, 'loss': 'mae', 'optimizer': 'adam', 'graph_mode': 'knn', 'source': 'grm', 'knn_k': 1, 'weighted_edges': False, 'symmetrize_mode': 'mutual', 'use_snp_selection': False}. Best is trial 53 with value: 0.12552284880403508.
[I 2025-11-03 13:22:38,045] Trial 63 finished with value: 0.10670327871787864 and parameters: {'model_type': 'gcn', 'hidden_dims': '[128, 64]', 'dropout': 0.30968058160526923, 'batch_norm': True, 'lr': 0.0004447143484545973, 'weight_decay': 1.572154765443685e-06, 'epochs': 249, 'loss': 'mae', 'optimizer': 'adam', 'graph_mode': 'knn', 'source': 'grm', 'knn_k': 1, 'weighted_edges': False, 'symmetrize_mode': 'mutual', 'use_snp_selection': False}. Best is trial 53 with value: 0.12552284880403508.
[I 2025-11-03 13:22:39,792] Trial 64 finished with value: 0.09583525275515094 and parameters: {'model_type': 'gcn', 'hidden_dims': '[128, 64]', 'dropout': 0.2803677379237684, 'batch_norm': True, 'lr': 0.0007805110932157446, 'weight_decay': 2.2022758528448105e-06, 'epochs': 223, 'loss': 'mae', 'optimizer': 'adam', 'graph_mode': 'knn', 'source': 'grm', 'knn_k': 2, 'weighted_edges': False, 'symmetrize_mode': 'mutual', 'use_snp_selection': False}. Best is trial 53 with value: 0.12552284880403508.
[I 2025-11-03 13:22:42,461] Trial 65 finished with value: 0.052436061826640956 and parameters: {'model_type': 'gcn', 'hidden_dims': '[256, 128, 64]', 'dropout': 0.33340641574042074, 'batch_norm': True, 'lr': 1.856715237389633e-05, 'weight_decay': 1.051534901189903e-06, 'epochs': 277, 'loss': 'mae', 'optimizer': 'adam', 'graph_mode': 'knn', 'source': 'grm', 'knn_k': 1, 'weighted_edges': False, 'symmetrize_mode': 'mutual', 'use_snp_selection': False}. Best is trial 53 with value: 0.12552284880403508.
[I 2025-11-03 13:22:45,470] Trial 66 finished with value: 0.0918217753269611 and parameters: {'model_type': 'gcn', 'hidden_dims': '[512, 64]', 'dropout': 0.35855287457656193, 'batch_norm': True, 'lr': 0.000577631257746667, 'weight_decay': 3.2593551207031e-05, 'epochs': 240, 'loss': 'mae', 'optimizer': 'adam', 'graph_mode': 'knn', 'source': 'grm', 'knn_k': 2, 'weighted_edges': True, 'symmetrize_mode': 'mutual', 'use_snp_selection': False}. Best is trial 53 with value: 0.12552284880403508.
[I 2025-11-03 13:22:48,806] Trial 67 finished with value: 0.10132674672829822 and parameters: {'model_type': 'gcn', 'hidden_dims': '[512, 256]', 'dropout': 0.21811635597427864, 'batch_norm': True, 'lr': 0.0002912695397912469, 'weight_decay': 6.716425383295885e-07, 'epochs': 288, 'loss': 'mae', 'optimizer': 'adam', 'graph_mode': 'knn', 'source': 'grm', 'knn_k': 1, 'weighted_edges': False, 'symmetrize_mode': 'mutual', 'use_snp_selection': False}. Best is trial 53 with value: 0.12552284880403508.
[I 2025-11-03 13:22:49,963] Trial 68 finished with value: 0.05374381489139083 and parameters: {'model_type': 'gcn', 'hidden_dims': '[128, 64]', 'dropout': 0.2576015422531336, 'batch_norm': False, 'lr': 0.00037587623079280585, 'weight_decay': 1.4005273464110116e-06, 'epochs': 7, 'loss': 'mae', 'optimizer': 'adam', 'graph_mode': 'knn', 'source': 'grm', 'knn_k': 9, 'weighted_edges': False, 'symmetrize_mode': 'mutual', 'use_snp_selection': True, 'num_snps': 2366}. Best is trial 53 with value: 0.12552284880403508.
[I 2025-11-03 13:22:51,889] Trial 69 finished with value: 0.03360064561007763 and parameters: {'model_type': 'gcn', 'hidden_dims': '[128, 64]', 'dropout': 0.3024789526540943, 'batch_norm': True, 'lr': 0.0009890086810934345, 'weight_decay': 3.74098694240546e-07, 'epochs': 258, 'loss': 'mae', 'optimizer': 'adam', 'graph_mode': 'knn', 'source': 'grm', 'knn_k': 3, 'weighted_edges': False, 'symmetrize_mode': 'union', 'use_snp_selection': False}. Best is trial 53 with value: 0.12552284880403508.
[I 2025-11-03 13:22:53,903] Trial 70 finished with value: 0.07858899491562296 and parameters: {'model_type': 'gcn', 'hidden_dims': '[128, 64]', 'dropout': 0.23951635378196592, 'batch_norm': True, 'lr': 0.0005470448027584466, 'weight_decay': 2.8806357358587535e-06, 'epochs': 302, 'loss': 'mae', 'optimizer': 'adam', 'graph_mode': 'knn', 'source': 'grm', 'knn_k': 2, 'weighted_edges': False, 'symmetrize_mode': 'mutual', 'use_snp_selection': False}. Best is trial 53 with value: 0.12552284880403508.
[I 2025-11-03 13:22:55,791] Trial 71 finished with value: 0.1121672417392207 and parameters: {'model_type': 'gcn', 'hidden_dims': '[128, 64]', 'dropout': 0.1854686393358821, 'batch_norm': True, 'lr': 0.0008115342284398542, 'weight_decay': 4.545843854013972e-06, 'epochs': 267, 'loss': 'mae', 'optimizer': 'adam', 'graph_mode': 'knn', 'source': 'grm', 'knn_k': 1, 'weighted_edges': False, 'symmetrize_mode': 'mutual', 'use_snp_selection': False}. Best is trial 53 with value: 0.12552284880403508.
[I 2025-11-03 13:22:57,734] Trial 72 finished with value: 0.10956816424117678 and parameters: {'model_type': 'gcn', 'hidden_dims': '[128, 64]', 'dropout': 0.16236975128285155, 'batch_norm': True, 'lr': 0.0007708169737815086, 'weight_decay': 5.6750819516740175e-06, 'epochs': 284, 'loss': 'mae', 'optimizer': 'adam', 'graph_mode': 'knn', 'source': 'grm', 'knn_k': 1, 'weighted_edges': False, 'symmetrize_mode': 'mutual', 'use_snp_selection': False}. Best is trial 53 with value: 0.12552284880403508.
[I 2025-11-03 13:22:59,574] Trial 73 finished with value: 0.12227031811108399 and parameters: {'model_type': 'gcn', 'hidden_dims': '[128, 64]', 'dropout': 0.19315441188544324, 'batch_norm': True, 'lr': 0.0006306908162665553, 'weight_decay': 2.1642083583666547e-06, 'epochs': 249, 'loss': 'mae', 'optimizer': 'adam', 'graph_mode': 'knn', 'source': 'grm', 'knn_k': 1, 'weighted_edges': False, 'symmetrize_mode': 'mutual', 'use_snp_selection': False}. Best is trial 53 with value: 0.12552284880403508.
[I 2025-11-03 13:23:01,461] Trial 74 finished with value: 0.11113565842960475 and parameters: {'model_type': 'gcn', 'hidden_dims': '[128, 64]', 'dropout': 0.20321182278576924, 'batch_norm': True, 'lr': 0.0004653746688211361, 'weight_decay': 8.681173579509348e-07, 'epochs': 251, 'loss': 'mae', 'optimizer': 'adam', 'graph_mode': 'knn', 'source': 'grm', 'knn_k': 1, 'weighted_edges': False, 'symmetrize_mode': 'mutual', 'use_snp_selection': False}. Best is trial 53 with value: 0.12552284880403508.
[I 2025-11-03 13:23:03,187] Trial 75 finished with value: 0.08114865953165123 and parameters: {'model_type': 'gcn', 'hidden_dims': '[128, 64]', 'dropout': 0.2211207705743147, 'batch_norm': True, 'lr': 0.000640658738054121, 'weight_decay': 1.9402122454970837e-06, 'epochs': 203, 'loss': 'mae', 'optimizer': 'adam', 'graph_mode': 'knn', 'source': 'grm', 'knn_k': 2, 'weighted_edges': False, 'symmetrize_mode': 'mutual', 'use_snp_selection': False}. Best is trial 53 with value: 0.12552284880403508.
[I 2025-11-03 13:23:05,293] Trial 76 finished with value: 0.10711446499859471 and parameters: {'model_type': 'gcn', 'hidden_dims': '[128, 64]', 'dropout': 0.19564783326742052, 'batch_norm': True, 'lr': 0.0005671184118637764, 'weight_decay': 3.042765571318848e-06, 'epochs': 313, 'loss': 'mae', 'optimizer': 'adam', 'graph_mode': 'knn', 'source': 'grm', 'knn_k': 1, 'weighted_edges': False, 'symmetrize_mode': 'mutual', 'use_snp_selection': False}. Best is trial 53 with value: 0.12552284880403508.
[I 2025-11-03 13:23:07,647] Trial 77 finished with value: 0.04294187316225926 and parameters: {'model_type': 'gcn', 'hidden_dims': '[256, 128, 64]', 'dropout': 0.317279527457326, 'batch_norm': False, 'lr': 0.00040093560257055167, 'weight_decay': 1.1273892527561916e-06, 'epochs': 219, 'loss': 'mae', 'optimizer': 'adam', 'graph_mode': 'knn', 'source': 'grm', 'knn_k': 2, 'weighted_edges': False, 'symmetrize_mode': 'mutual', 'use_snp_selection': False}. Best is trial 53 with value: 0.12552284880403508.
[I 2025-11-03 13:23:11,780] Trial 78 finished with value: 0.06465364925825756 and parameters: {'model_type': 'gcn', 'hidden_dims': '[256, 128]', 'dropout': 0.28686788279944386, 'batch_norm': True, 'lr': 3.94005095610388e-06, 'weight_decay': 1.5747345033224712e-06, 'epochs': 331, 'loss': 'mae', 'optimizer': 'adam', 'graph_mode': 'knn', 'source': 'grm', 'knn_k': 1, 'weighted_edges': True, 'symmetrize_mode': 'mutual', 'use_snp_selection': True, 'num_snps': 51796}. Best is trial 53 with value: 0.12552284880403508.
[I 2025-11-03 13:23:13,712] Trial 79 finished with value: 0.04799606461485647 and parameters: {'model_type': 'gcn', 'hidden_dims': '[128, 64]', 'dropout': 0.3435310290160136, 'batch_norm': True, 'lr': 0.00020193837218993244, 'weight_decay': 8.819605351206153e-06, 'epochs': 242, 'loss': 'mae', 'optimizer': 'adam', 'graph_mode': 'knn', 'source': 'grm', 'knn_k': 7, 'weighted_edges': False, 'symmetrize_mode': 'mutual', 'use_snp_selection': False}. Best is trial 53 with value: 0.12552284880403508.
[I 2025-11-03 13:23:15,678] Trial 80 finished with value: 0.060123994082840415 and parameters: {'model_type': 'gcn', 'hidden_dims': '[128, 64]', 'dropout': 0.1729962870790496, 'batch_norm': True, 'lr': 1.5727948184488365e-06, 'weight_decay': 5.657538525031952e-07, 'epochs': 276, 'loss': 'mse', 'optimizer': 'adam', 'graph_mode': 'knn', 'source': 'grm', 'knn_k': 2, 'weighted_edges': False, 'symmetrize_mode': 'union', 'use_snp_selection': False}. Best is trial 53 with value: 0.12552284880403508.
[I 2025-11-03 13:23:17,630] Trial 81 finished with value: 0.11196396689664584 and parameters: {'model_type': 'gcn', 'hidden_dims': '[128, 64]', 'dropout': 0.14751186046738346, 'batch_norm': True, 'lr': 0.0008337890484218082, 'weight_decay': 2.2100287352707106e-06, 'epochs': 270, 'loss': 'mae', 'optimizer': 'adam', 'graph_mode': 'knn', 'source': 'grm', 'knn_k': 1, 'weighted_edges': False, 'symmetrize_mode': 'mutual', 'use_snp_selection': False}. Best is trial 53 with value: 0.12552284880403508.
[I 2025-11-03 13:23:19,534] Trial 82 finished with value: 0.10524805385326715 and parameters: {'model_type': 'gcn', 'hidden_dims': '[128, 64]', 'dropout': 0.23512185764959675, 'batch_norm': True, 'lr': 0.000980396570096044, 'weight_decay': 5.444769702739196e-06, 'epochs': 256, 'loss': 'mae', 'optimizer': 'adam', 'graph_mode': 'knn', 'source': 'grm', 'knn_k': 1, 'weighted_edges': False, 'symmetrize_mode': 'mutual', 'use_snp_selection': False}. Best is trial 53 with value: 0.12552284880403508.
[I 2025-11-03 13:23:21,351] Trial 83 finished with value: 0.09655778088394379 and parameters: {'model_type': 'gcn', 'hidden_dims': '[128, 64]', 'dropout': 0.12282760472082258, 'batch_norm': True, 'lr': 0.0006916491537341637, 'weight_decay': 3.2503200633008086e-06, 'epochs': 230, 'loss': 'mae', 'optimizer': 'adam', 'graph_mode': 'knn', 'source': 'grm', 'knn_k': 1, 'weighted_edges': False, 'symmetrize_mode': 'mutual', 'use_snp_selection': False}. Best is trial 53 with value: 0.12552284880403508.
[I 2025-11-03 13:23:24,822] Trial 84 finished with value: 0.11586514044681213 and parameters: {'model_type': 'gcn', 'hidden_dims': '[512, 128]', 'dropout': 0.2664140214595477, 'batch_norm': True, 'lr': 0.0008481245132215908, 'weight_decay': 2.515525217897569e-06, 'epochs': 298, 'loss': 'mae', 'optimizer': 'adam', 'graph_mode': 'knn', 'source': 'grm', 'knn_k': 1, 'weighted_edges': False, 'symmetrize_mode': 'mutual', 'use_snp_selection': False}. Best is trial 53 with value: 0.12552284880403508.
[I 2025-11-03 13:23:28,220] Trial 85 finished with value: 0.11177464283758387 and parameters: {'model_type': 'gcn', 'hidden_dims': '[512, 128]', 'dropout': 0.29538513995759075, 'batch_norm': True, 'lr': 0.00047084057871701256, 'weight_decay': 1.788691753633126e-06, 'epochs': 294, 'loss': 'mae', 'optimizer': 'adam', 'graph_mode': 'cutoff', 'cutoff': 0.7992196221536069, 'grm_norm': 'none', 'self_loops': True, 'use_snp_selection': False}. Best is trial 53 with value: 0.12552284880403508.
[I 2025-11-03 13:23:31,937] Trial 86 finished with value: 0.08308680405208696 and parameters: {'model_type': 'gcn', 'hidden_dims': '[512, 128]', 'dropout': 0.2612414308992999, 'batch_norm': True, 'lr': 0.0006015433993580961, 'weight_decay': 2.505998841697073e-06, 'epochs': 339, 'loss': 'mae', 'optimizer': 'adam', 'graph_mode': 'knn', 'source': 'grm', 'knn_k': 2, 'weighted_edges': False, 'symmetrize_mode': 'mutual', 'use_snp_selection': False}. Best is trial 53 with value: 0.12552284880403508.
[I 2025-11-03 13:23:35,475] Trial 87 finished with value: 0.03534853881800712 and parameters: {'model_type': 'gcn', 'hidden_dims': '[512, 128]', 'dropout': 0.27477099757668527, 'batch_norm': True, 'lr': 1.0392405679632392e-05, 'weight_decay': 1.2449092058259456e-06, 'epochs': 315, 'loss': 'mae', 'optimizer': 'adam', 'graph_mode': 'knn', 'source': 'grm', 'knn_k': 1, 'weighted_edges': False, 'symmetrize_mode': 'mutual', 'use_snp_selection': False}. Best is trial 53 with value: 0.12552284880403508.
[I 2025-11-03 13:23:38,843] Trial 88 finished with value: 0.07671209695734567 and parameters: {'model_type': 'gcn', 'hidden_dims': '[512, 128]', 'dropout': 0.24986956286622308, 'batch_norm': True, 'lr': 0.00031233405962036154, 'weight_decay': 0.0002536759118722567, 'epochs': 291, 'loss': 'mae', 'optimizer': 'adam', 'graph_mode': 'knn', 'source': 'grm', 'knn_k': 2, 'weighted_edges': False, 'symmetrize_mode': 'mutual', 'use_snp_selection': False}. Best is trial 53 with value: 0.12552284880403508.
[I 2025-11-03 13:23:40,998] Trial 89 finished with value: 0.10465134455007837 and parameters: {'model_type': 'gcn', 'hidden_dims': '[512, 64]', 'dropout': 0.37669676879603003, 'batch_norm': False, 'lr': 0.0008484664717307565, 'weight_decay': 9.096426076322677e-07, 'epochs': 301, 'loss': 'mae', 'optimizer': 'adam', 'graph_mode': 'knn', 'source': 'grm', 'knn_k': 1, 'weighted_edges': False, 'symmetrize_mode': 'mutual', 'use_snp_selection': True, 'num_snps': 10144}. Best is trial 53 with value: 0.12552284880403508.
[I 2025-11-03 13:23:44,310] Trial 90 finished with value: 0.06950158199103036 and parameters: {'model_type': 'gcn', 'hidden_dims': '[512, 256]', 'dropout': 0.40824244103439666, 'batch_norm': True, 'lr': 0.0007016872296549729, 'weight_decay': 1.3766739481965991e-06, 'epochs': 284, 'loss': 'mae', 'optimizer': 'adam', 'graph_mode': 'knn', 'source': 'grm', 'knn_k': 2, 'weighted_edges': False, 'symmetrize_mode': 'mutual', 'use_snp_selection': False}. Best is trial 53 with value: 0.12552284880403508.
[I 2025-11-03 13:23:46,106] Trial 91 finished with value: 0.10282725370037452 and parameters: {'model_type': 'gcn', 'hidden_dims': '[128, 64]', 'dropout': 0.2272638056725672, 'batch_norm': True, 'lr': 0.0008575024136770179, 'weight_decay': 4.264421441107063e-06, 'epochs': 244, 'loss': 'mae', 'optimizer': 'adam', 'graph_mode': 'knn', 'source': 'grm', 'knn_k': 1, 'weighted_edges': False, 'symmetrize_mode': 'mutual', 'use_snp_selection': False}. Best is trial 53 with value: 0.12552284880403508.
[I 2025-11-03 13:23:47,989] Trial 92 finished with value: 0.10572443395995429 and parameters: {'model_type': 'gcn', 'hidden_dims': '[128, 64]', 'dropout': 0.17979890900012463, 'batch_norm': True, 'lr': 0.0005130743548463091, 'weight_decay': 3.622778562443577e-06, 'epochs': 270, 'loss': 'mae', 'optimizer': 'adam', 'graph_mode': 'knn', 'source': 'grm', 'knn_k': 1, 'weighted_edges': False, 'symmetrize_mode': 'mutual', 'use_snp_selection': False}. Best is trial 53 with value: 0.12552284880403508.
[I 2025-11-03 13:23:49,849] Trial 93 finished with value: 0.06032480614191411 and parameters: {'model_type': 'gcn', 'hidden_dims': '[128, 64]', 'dropout': 0.15502719557939448, 'batch_norm': True, 'lr': 0.0006678359309096857, 'weight_decay': 2.445407114922876e-06, 'epochs': 258, 'loss': 'mae', 'optimizer': 'adam', 'graph_mode': 'knn', 'source': 'grm', 'knn_k': 5, 'weighted_edges': False, 'symmetrize_mode': 'mutual', 'use_snp_selection': False}. Best is trial 53 with value: 0.12552284880403508.
