[I 2025-11-03 12:11:04,666] Trial 90 finished with value: -0.0018463581072054537 and parameters: {'model_type': 'gcn', 'hidden_dims': '[256, 128, 64]', 'dropout': 0.28765932255662996, 'batch_norm': False, 'lr': 9.020245328201042e-06, 'weight_decay': 0.00023278661488211207, 'epochs': 35, 'loss': 'mae', 'optimizer': 'adam', 'graph_mode': 'cutoff', 'cutoff': 0.6896187193227834, 'grm_norm': 'none', 'self_loops': True, 'use_snp_selection': True, 'num_snps': 3647}. Best is trial 73 with value: 0.17893980951458158.
[I 2025-11-03 12:11:06,148] Trial 91 finished with value: 0.1520378752236602 and parameters: {'model_type': 'gcn', 'hidden_dims': '[128, 64]', 'dropout': 0.23173342258824164, 'batch_norm': True, 'lr': 0.0007124714587756536, 'weight_decay': 0.00014471620798687214, 'epochs': 55, 'loss': 'mae', 'optimizer': 'adam', 'graph_mode': 'knn', 'source': 'grm', 'knn_k': 1, 'weighted_edges': True, 'symmetrize_mode': 'mutual', 'use_snp_selection': False}. Best is trial 73 with value: 0.17893980951458158.
[I 2025-11-03 12:11:09,542] Trial 92 finished with value: 0.1770819919112928 and parameters: {'model_type': 'gcn', 'hidden_dims': '[512, 64]', 'dropout': 0.3404023956805172, 'batch_norm': True, 'lr': 0.0005415394866402156, 'weight_decay': 0.00018499307596854547, 'epochs': 157, 'loss': 'mae', 'optimizer': 'adam', 'graph_mode': 'knn', 'source': 'grm', 'knn_k': 1, 'weighted_edges': True, 'symmetrize_mode': 'mutual', 'use_snp_selection': False}. Best is trial 73 with value: 0.17893980951458158.
[I 2025-11-03 12:11:12,854] Trial 93 finished with value: 0.15056222693775254 and parameters: {'model_type': 'gcn', 'hidden_dims': '[512, 128]', 'dropout': 0.259136930582383, 'batch_norm': True, 'lr': 0.00041751177422881227, 'weight_decay': 0.0003787409337238969, 'epochs': 151, 'loss': 'mae', 'optimizer': 'adam', 'graph_mode': 'knn', 'source': 'grm', 'knn_k': 1, 'weighted_edges': True, 'symmetrize_mode': 'mutual', 'use_snp_selection': False}. Best is trial 73 with value: 0.17893980951458158.
[I 2025-11-03 12:11:15,247] Trial 94 finished with value: 0.1424483158072699 and parameters: {'model_type': 'gcn', 'hidden_dims': '[512, 128]', 'dropout': 0.18769933950175327, 'batch_norm': True, 'lr': 0.0005248792743733343, 'weight_decay': 5.2180051536228686e-05, 'epochs': 81, 'loss': 'mae', 'optimizer': 'adam', 'graph_mode': 'knn', 'source': 'grm', 'knn_k': 1, 'weighted_edges': True, 'symmetrize_mode': 'mutual', 'use_snp_selection': False}. Best is trial 73 with value: 0.17893980951458158.
[I 2025-11-03 12:11:17,497] Trial 95 finished with value: 0.14014778771260825 and parameters: {'model_type': 'gcn', 'hidden_dims': '[256, 128]', 'dropout': 0.2440907572226426, 'batch_norm': True, 'lr': 0.0003204929440620631, 'weight_decay': 0.0001883100854144218, 'epochs': 138, 'loss': 'mae', 'optimizer': 'adam', 'graph_mode': 'knn', 'source': 'grm', 'knn_k': 2, 'weighted_edges': True, 'symmetrize_mode': 'mutual', 'use_snp_selection': False}. Best is trial 73 with value: 0.17893980951458158.
[I 2025-11-03 12:11:20,155] Trial 96 finished with value: 0.119054821501993 and parameters: {'model_type': 'gcn', 'hidden_dims': '[512, 64]', 'dropout': 0.3449128836368726, 'batch_norm': True, 'lr': 0.0002793442058980198, 'weight_decay': 2.0566457626821734e-05, 'epochs': 103, 'loss': 'mae', 'optimizer': 'adam', 'graph_mode': 'knn', 'source': 'grm', 'knn_k': 2, 'weighted_edges': False, 'symmetrize_mode': 'mutual', 'use_snp_selection': False}. Best is trial 73 with value: 0.17893980951458158.
[I 2025-11-03 12:11:22,600] Trial 97 finished with value: 0.1440454899396611 and parameters: {'model_type': 'gcn', 'hidden_dims': '[512, 128]', 'dropout': 0.5751817178258657, 'batch_norm': True, 'lr': 0.0008629581264471504, 'weight_decay': 3.805686894909101e-05, 'epochs': 92, 'loss': 'mae', 'optimizer': 'adam', 'graph_mode': 'knn', 'source': 'grm', 'knn_k': 1, 'weighted_edges': True, 'symmetrize_mode': 'mutual', 'use_snp_selection': False}. Best is trial 73 with value: 0.17893980951458158.
[I 2025-11-03 12:11:27,878] Trial 98 finished with value: 0.12135540430179786 and parameters: {'model_type': 'gcn', 'hidden_dims': '[512, 64]', 'dropout': 0.4573757998889893, 'batch_norm': True, 'lr': 0.00020351978064426666, 'weight_decay': 0.00010279824607021919, 'epochs': 315, 'loss': 'mae', 'optimizer': 'adam', 'graph_mode': 'knn', 'source': 'grm', 'knn_k': 9, 'weighted_edges': True, 'symmetrize_mode': 'mutual', 'use_snp_selection': False}. Best is trial 73 with value: 0.17893980951458158.
[I 2025-11-03 12:11:29,630] Trial 99 finished with value: 0.1455989179975358 and parameters: {'model_type': 'gcn', 'hidden_dims': '[256, 128, 64]', 'dropout': 0.27473429447594583, 'batch_norm': True, 'lr': 0.0006135437569648671, 'weight_decay': 0.00025705229512011413, 'epochs': 68, 'loss': 'mae', 'optimizer': 'adam', 'graph_mode': 'knn', 'source': 'grm', 'knn_k': 1, 'weighted_edges': True, 'symmetrize_mode': 'mutual', 'use_snp_selection': False}. Best is trial 73 with value: 0.17893980951458158.
[I 2025-11-03 12:11:31,514] Trial 100 finished with value: 0.13121859314790715 and parameters: {'model_type': 'gcn', 'hidden_dims': '[128, 64]', 'dropout': 0.20882091767549718, 'batch_norm': True, 'lr': 0.0007589524297699474, 'weight_decay': 7.272940895467289e-05, 'epochs': 161, 'loss': 'mae', 'optimizer': 'adam', 'graph_mode': 'knn', 'source': 'grm', 'knn_k': 2, 'weighted_edges': True, 'symmetrize_mode': 'mutual', 'use_snp_selection': False}. Best is trial 73 with value: 0.17893980951458158.
[I 2025-11-03 12:11:34,479] Trial 101 finished with value: 0.1572252380522759 and parameters: {'model_type': 'gcn', 'hidden_dims': '[512, 64]', 'dropout': 0.3559923966413064, 'batch_norm': True, 'lr': 0.000682523904839763, 'weight_decay': 0.00012710046321617492, 'epochs': 132, 'loss': 'mae', 'optimizer': 'adam', 'graph_mode': 'knn', 'source': 'grm', 'knn_k': 1, 'weighted_edges': True, 'symmetrize_mode': 'union', 'use_snp_selection': False}. Best is trial 73 with value: 0.17893980951458158.
[I 2025-11-03 12:11:36,761] Trial 102 finished with value: 0.16204333163045176 and parameters: {'model_type': 'gcn', 'hidden_dims': '[512, 64]', 'dropout': 0.33703606073270953, 'batch_norm': True, 'lr': 0.0005258844484840459, 'weight_decay': 0.00017343259880398158, 'epochs': 76, 'loss': 'mae', 'optimizer': 'adam', 'graph_mode': 'knn', 'source': 'grm', 'knn_k': 1, 'weighted_edges': True, 'symmetrize_mode': 'mutual', 'use_snp_selection': False}. Best is trial 73 with value: 0.17893980951458158.
[I 2025-11-03 12:11:39,583] Trial 103 finished with value: 0.16220067294465623 and parameters: {'model_type': 'gcn', 'hidden_dims': '[512, 64]', 'dropout': 0.1582304321071194, 'batch_norm': True, 'lr': 0.00038195686554496234, 'weight_decay': 0.0003149335684738263, 'epochs': 119, 'loss': 'mae', 'optimizer': 'adam', 'graph_mode': 'knn', 'source': 'grm', 'knn_k': 1, 'weighted_edges': True, 'symmetrize_mode': 'mutual', 'use_snp_selection': False}. Best is trial 73 with value: 0.17893980951458158.
[I 2025-11-03 12:11:42,362] Trial 104 finished with value: 0.1678398786272036 and parameters: {'model_type': 'gcn', 'hidden_dims': '[512, 64]', 'dropout': 0.39039081492778205, 'batch_norm': True, 'lr': 0.00037597339933637965, 'weight_decay': 0.0005983668891826045, 'epochs': 116, 'loss': 'mae', 'optimizer': 'adam', 'graph_mode': 'knn', 'source': 'grm', 'knn_k': 1, 'weighted_edges': True, 'symmetrize_mode': 'mutual', 'use_snp_selection': False}. Best is trial 73 with value: 0.17893980951458158.
[I 2025-11-03 12:11:45,134] Trial 105 finished with value: 0.13346828762982177 and parameters: {'model_type': 'gcn', 'hidden_dims': '[512, 64]', 'dropout': 0.37947851771166374, 'batch_norm': True, 'lr': 0.00036860092491815185, 'weight_decay': 0.0007600822155200416, 'epochs': 116, 'loss': 'mae', 'optimizer': 'adam', 'graph_mode': 'knn', 'source': 'grm', 'knn_k': 5, 'weighted_edges': True, 'symmetrize_mode': 'mutual', 'use_snp_selection': False}. Best is trial 73 with value: 0.17893980951458158.
[I 2025-11-03 12:11:47,792] Trial 106 finished with value: 0.16707649082907905 and parameters: {'model_type': 'gcn', 'hidden_dims': '[512, 64]', 'dropout': 0.41396655301294877, 'batch_norm': True, 'lr': 0.0004566191726855522, 'weight_decay': 0.0005207369243529449, 'epochs': 109, 'loss': 'mae', 'optimizer': 'adam', 'graph_mode': 'knn', 'source': 'grm', 'knn_k': 1, 'weighted_edges': True, 'symmetrize_mode': 'mutual', 'use_snp_selection': False}. Best is trial 73 with value: 0.17893980951458158.
[I 2025-11-03 12:11:50,938] Trial 107 finished with value: 0.14907273726107773 and parameters: {'model_type': 'gcn', 'hidden_dims': '[512, 64]', 'dropout': 0.3948723050982753, 'batch_norm': True, 'lr': 0.0004417292877889524, 'weight_decay': 0.0004829432089291822, 'epochs': 146, 'loss': 'mae', 'optimizer': 'adam', 'graph_mode': 'knn', 'source': 'grm', 'knn_k': 1, 'weighted_edges': True, 'symmetrize_mode': 'mutual', 'use_snp_selection': False}. Best is trial 73 with value: 0.17893980951458158.
[I 2025-11-03 12:11:53,641] Trial 108 finished with value: 0.159824085563694 and parameters: {'model_type': 'gcn', 'hidden_dims': '[512, 64]', 'dropout': 0.4142064253858874, 'batch_norm': True, 'lr': 0.0004857519889793588, 'weight_decay': 0.0008432843658939696, 'epochs': 105, 'loss': 'mae', 'optimizer': 'adam', 'graph_mode': 'knn', 'source': 'grm', 'knn_k': 1, 'weighted_edges': True, 'symmetrize_mode': 'mutual', 'use_snp_selection': False}. Best is trial 73 with value: 0.17893980951458158.
[I 2025-11-03 12:11:57,937] Trial 109 finished with value: 0.059419886951908536 and parameters: {'model_type': 'gcn', 'hidden_dims': '[512, 64]', 'dropout': 0.4323698771375229, 'batch_norm': False, 'lr': 0.0002508750863055415, 'weight_decay': 0.000637205907930107, 'epochs': 125, 'loss': 'mse', 'optimizer': 'adam', 'graph_mode': 'cutoff', 'cutoff': 0.5430592562300799, 'grm_norm': 'cosine_then_gcn', 'self_loops': True, 'use_snp_selection': True, 'num_snps': 37760}. Best is trial 73 with value: 0.17893980951458158.
[I 2025-11-03 12:12:00,899] Trial 110 finished with value: 0.14787375609276243 and parameters: {'model_type': 'gcn', 'hidden_dims': '[512, 64]', 'dropout': 0.5114185005135649, 'batch_norm': True, 'lr': 0.00035488707948336885, 'weight_decay': 0.0005196151742732922, 'epochs': 118, 'loss': 'mae', 'optimizer': 'adam', 'graph_mode': 'knn', 'source': 'grm', 'knn_k': 1, 'weighted_edges': True, 'symmetrize_mode': 'mutual', 'use_snp_selection': False}. Best is trial 73 with value: 0.17893980951458158.
[I 2025-11-03 12:12:03,467] Trial 111 finished with value: 0.1451305528576395 and parameters: {'model_type': 'gcn', 'hidden_dims': '[512, 64]', 'dropout': 0.4749697814831201, 'batch_norm': True, 'lr': 0.000890824354123526, 'weight_decay': 0.00029945406862721946, 'epochs': 89, 'loss': 'mae', 'optimizer': 'adam', 'graph_mode': 'knn', 'source': 'grm', 'knn_k': 2, 'weighted_edges': True, 'symmetrize_mode': 'mutual', 'use_snp_selection': False}. Best is trial 73 with value: 0.17893980951458158.
[I 2025-11-03 12:12:06,207] Trial 112 finished with value: 0.14989332483878734 and parameters: {'model_type': 'gcn', 'hidden_dims': '[512, 64]', 'dropout': 0.15587165379884238, 'batch_norm': True, 'lr': 0.0005385802811973819, 'weight_decay': 0.00034541059396128796, 'epochs': 110, 'loss': 'mae', 'optimizer': 'adam', 'graph_mode': 'knn', 'source': 'grm', 'knn_k': 1, 'weighted_edges': True, 'symmetrize_mode': 'mutual', 'use_snp_selection': False}. Best is trial 73 with value: 0.17893980951458158.
[I 2025-11-03 12:12:08,628] Trial 113 finished with value: 0.14922239206298832 and parameters: {'model_type': 'gcn', 'hidden_dims': '[512, 64]', 'dropout': 0.4440077993960176, 'batch_norm': True, 'lr': 0.0005394185063948929, 'weight_decay': 0.00017774088700256964, 'epochs': 83, 'loss': 'mae', 'optimizer': 'adam', 'graph_mode': 'knn', 'source': 'grm', 'knn_k': 2, 'weighted_edges': True, 'symmetrize_mode': 'mutual', 'use_snp_selection': False}. Best is trial 73 with value: 0.17893980951458158.
[I 2025-11-03 12:12:11,209] Trial 114 finished with value: 0.15313194435476185 and parameters: {'model_type': 'gcn', 'hidden_dims': '[512, 64]', 'dropout': 0.3636413956021621, 'batch_norm': True, 'lr': 0.00043490619516976537, 'weight_decay': 0.0004016590227141792, 'epochs': 96, 'loss': 'mae', 'optimizer': 'adam', 'graph_mode': 'knn', 'source': 'grm', 'knn_k': 1, 'weighted_edges': True, 'symmetrize_mode': 'mutual', 'use_snp_selection': False}. Best is trial 73 with value: 0.17893980951458158.
[I 2025-11-03 12:12:14,303] Trial 115 finished with value: 0.1512511870001609 and parameters: {'model_type': 'gcn', 'hidden_dims': '[512, 64]', 'dropout': 0.4050433159103199, 'batch_norm': True, 'lr': 0.0007233876172334981, 'weight_decay': 0.00041376131873618985, 'epochs': 133, 'loss': 'mae', 'optimizer': 'adam', 'graph_mode': 'knn', 'source': 'grm', 'knn_k': 1, 'weighted_edges': True, 'symmetrize_mode': 'mutual', 'use_snp_selection': False}. Best is trial 73 with value: 0.17893980951458158.
[I 2025-11-03 12:12:16,473] Trial 116 finished with value: 0.14109042307340822 and parameters: {'model_type': 'gcn', 'hidden_dims': '[512, 64]', 'dropout': 0.1692842996981912, 'batch_norm': True, 'lr': 0.0009935197942825067, 'weight_decay': 0.0002266161091875625, 'epochs': 61, 'loss': 'mae', 'optimizer': 'adam', 'graph_mode': 'knn', 'source': 'grm', 'knn_k': 2, 'weighted_edges': False, 'symmetrize_mode': 'mutual', 'use_snp_selection': False}. Best is trial 73 with value: 0.17893980951458158.
[I 2025-11-03 12:12:19,770] Trial 117 finished with value: 0.15608596274664363 and parameters: {'model_type': 'gcn', 'hidden_dims': '[512, 64]', 'dropout': 0.41929025368636935, 'batch_norm': True, 'lr': 0.00040649345491472916, 'weight_decay': 0.0006204552994205567, 'epochs': 155, 'loss': 'mae', 'optimizer': 'adam', 'graph_mode': 'cutoff', 'cutoff': 0.6091080970679702, 'grm_norm': 'cosine_then_gcn', 'self_loops': False, 'use_snp_selection': False}. Best is trial 73 with value: 0.17893980951458158.
[I 2025-11-03 12:12:21,851] Trial 118 finished with value: 0.015626246577379287 and parameters: {'model_type': 'gcn', 'hidden_dims': '[512, 64]', 'dropout': 0.38911836510825304, 'batch_norm': True, 'lr': 1.0734192924881945e-06, 'weight_decay': 0.00026959546532657477, 'epochs': 53, 'loss': 'mae', 'optimizer': 'adam', 'graph_mode': 'knn', 'source': 'grm', 'knn_k': 1, 'weighted_edges': True, 'symmetrize_mode': 'mutual', 'use_snp_selection': False}. Best is trial 73 with value: 0.17893980951458158.
[I 2025-11-03 12:12:24,756] Trial 119 finished with value: 0.1656117660543732 and parameters: {'model_type': 'gcn', 'hidden_dims': '[512, 256]', 'dropout': 0.10150361144252193, 'batch_norm': True, 'lr': 0.0006238832633607869, 'weight_decay': 6.075704725239309e-05, 'epochs': 122, 'loss': 'mae', 'optimizer': 'adam', 'graph_mode': 'knn', 'source': 'grm', 'knn_k': 1, 'weighted_edges': True, 'symmetrize_mode': 'mutual', 'use_snp_selection': False}. Best is trial 73 with value: 0.17893980951458158.
[I 2025-11-03 12:12:27,644] Trial 120 finished with value: 0.1734713707571139 and parameters: {'model_type': 'gcn', 'hidden_dims': '[512, 256]', 'dropout': 0.11667794462828619, 'batch_norm': True, 'lr': 0.0003250364629246538, 'weight_decay': 6.37915389977178e-05, 'epochs': 121, 'loss': 'mae', 'optimizer': 'adam', 'graph_mode': 'knn', 'source': 'grm', 'knn_k': 1, 'weighted_edges': True, 'symmetrize_mode': 'mutual', 'use_snp_selection': False}. Best is trial 73 with value: 0.17893980951458158.
[I 2025-11-03 12:12:30,462] Trial 121 finished with value: 0.1599673487179557 and parameters: {'model_type': 'gcn', 'hidden_dims': '[512, 256]', 'dropout': 0.12058850676564387, 'batch_norm': True, 'lr': 0.00027230523049313524, 'weight_decay': 5.703790765519857e-05, 'epochs': 121, 'loss': 'mae', 'optimizer': 'adam', 'graph_mode': 'knn', 'source': 'grm', 'knn_k': 1, 'weighted_edges': True, 'symmetrize_mode': 'mutual', 'use_snp_selection': False}. Best is trial 73 with value: 0.17893980951458158.
[I 2025-11-03 12:12:33,095] Trial 122 finished with value: 0.15049359308182977 and parameters: {'model_type': 'gcn', 'hidden_dims': '[512, 256]', 'dropout': 0.10005988869639301, 'batch_norm': True, 'lr': 0.000588647969362748, 'weight_decay': 9.248335167765685e-05, 'epochs': 107, 'loss': 'mae', 'optimizer': 'adam', 'graph_mode': 'knn', 'source': 'grm', 'knn_k': 1, 'weighted_edges': True, 'symmetrize_mode': 'mutual', 'use_snp_selection': False}. Best is trial 73 with value: 0.17893980951458158.
[I 2025-11-03 12:12:35,549] Trial 123 finished with value: 0.15983137991118224 and parameters: {'model_type': 'gcn', 'hidden_dims': '[512, 256]', 'dropout': 0.13517369722826375, 'batch_norm': True, 'lr': 0.00032484426951453327, 'weight_decay': 3.0208435977118332e-05, 'epochs': 93, 'loss': 'mae', 'optimizer': 'adam', 'graph_mode': 'knn', 'source': 'grm', 'knn_k': 1, 'weighted_edges': True, 'symmetrize_mode': 'mutual', 'use_snp_selection': False}. Best is trial 73 with value: 0.17893980951458158.
[I 2025-11-03 12:12:38,438] Trial 124 finished with value: 0.16623254545930918 and parameters: {'model_type': 'gcn', 'hidden_dims': '[512, 256]', 'dropout': 0.10779243450050394, 'batch_norm': True, 'lr': 0.000474627876016988, 'weight_decay': 4.284964007057368e-05, 'epochs': 128, 'loss': 'mae', 'optimizer': 'adam', 'graph_mode': 'knn', 'source': 'grm', 'knn_k': 1, 'weighted_edges': True, 'symmetrize_mode': 'mutual', 'use_snp_selection': False}. Best is trial 73 with value: 0.17893980951458158.
[I 2025-11-03 12:12:41,353] Trial 125 finished with value: 0.15917776344097453 and parameters: {'model_type': 'gcn', 'hidden_dims': '[512, 256]', 'dropout': 0.1113016690983182, 'batch_norm': True, 'lr': 0.0004681296161692551, 'weight_decay': 4.258066120394505e-05, 'epochs': 130, 'loss': 'mae', 'optimizer': 'adam', 'graph_mode': 'knn', 'source': 'grm', 'knn_k': 1, 'weighted_edges': True, 'symmetrize_mode': 'mutual', 'use_snp_selection': False}. Best is trial 73 with value: 0.17893980951458158.
[I 2025-11-03 12:12:44,426] Trial 126 finished with value: 0.1379110759155655 and parameters: {'model_type': 'gcn', 'hidden_dims': '[512, 256]', 'dropout': 0.12131249213043789, 'batch_norm': True, 'lr': 0.00039034176474176985, 'weight_decay': 2.3591071339710335e-05, 'epochs': 143, 'loss': 'mae', 'optimizer': 'adam', 'graph_mode': 'cutoff', 'cutoff': 0.2901393798364619, 'grm_norm': 'cosine_then_gcn', 'self_loops': True, 'use_snp_selection': False}. Best is trial 73 with value: 0.17893980951458158.
[I 2025-11-03 12:12:47,115] Trial 127 finished with value: 0.15867695378602165 and parameters: {'model_type': 'gcn', 'hidden_dims': '[512, 256]', 'dropout': 0.11027737827507222, 'batch_norm': True, 'lr': 0.0006483681237293851, 'weight_decay': 3.349096151499051e-05, 'epochs': 112, 'loss': 'mae', 'optimizer': 'adam', 'graph_mode': 'knn', 'source': 'grm', 'knn_k': 1, 'weighted_edges': True, 'symmetrize_mode': 'mutual', 'use_snp_selection': False}. Best is trial 73 with value: 0.17893980951458158.
[I 2025-11-03 12:12:50,487] Trial 128 finished with value: 0.07876812967193313 and parameters: {'model_type': 'gcn', 'hidden_dims': '[512, 256]', 'dropout': 0.1452187065237058, 'batch_norm': True, 'lr': 2.750692266780379e-05, 'weight_decay': 4.881723718533686e-05, 'epochs': 167, 'loss': 'mse', 'optimizer': 'adam', 'graph_mode': 'knn', 'source': 'grm', 'knn_k': 2, 'weighted_edges': True, 'symmetrize_mode': 'mutual', 'use_snp_selection': False}. Best is trial 73 with value: 0.17893980951458158.
[I 2025-11-03 12:12:53,868] Trial 129 finished with value: 0.1102872586459549 and parameters: {'model_type': 'gcn', 'hidden_dims': '[512, 256]', 'dropout': 0.15727375888209175, 'batch_norm': False, 'lr': 0.00021910022048603567, 'weight_decay': 1.1870833109722636e-05, 'epochs': 101, 'loss': 'mae', 'optimizer': 'adam', 'graph_mode': 'knn', 'source': 'grm', 'knn_k': 6, 'weighted_edges': True, 'symmetrize_mode': 'mutual', 'use_snp_selection': True, 'num_snps': 27400}. Best is trial 73 with value: 0.17893980951458158.
[I 2025-11-03 12:12:56,644] Trial 130 finished with value: 0.16157621635552907 and parameters: {'model_type': 'gcn', 'hidden_dims': '[512, 256]', 'dropout': 0.13748877869754467, 'batch_norm': True, 'lr': 0.00032659723291091135, 'weight_decay': 6.845995397259743e-05, 'epochs': 122, 'loss': 'mae', 'optimizer': 'adam', 'graph_mode': 'cutoff', 'cutoff': 0.7548604541172323, 'grm_norm': 'cosine', 'self_loops': True, 'use_snp_selection': False}. Best is trial 73 with value: 0.17893980951458158.
[I 2025-11-03 12:12:59,658] Trial 131 finished with value: 0.16695739895907516 and parameters: {'model_type': 'gcn', 'hidden_dims': '[512, 256]', 'dropout': 0.10705467940311175, 'batch_norm': True, 'lr': 0.0005171496506497425, 'weight_decay': 6.213754705816253e-05, 'epochs': 136, 'loss': 'mae', 'optimizer': 'adam', 'graph_mode': 'knn', 'source': 'grm', 'knn_k': 1, 'weighted_edges': True, 'symmetrize_mode': 'mutual', 'use_snp_selection': False}. Best is trial 73 with value: 0.17893980951458158.
[I 2025-11-03 12:13:02,650] Trial 132 finished with value: 0.1667568676334094 and parameters: {'model_type': 'gcn', 'hidden_dims': '[512, 256]', 'dropout': 0.10229308183357916, 'batch_norm': True, 'lr': 0.0005702547958036615, 'weight_decay': 6.164909138509787e-05, 'epochs': 134, 'loss': 'mae', 'optimizer': 'adam', 'graph_mode': 'knn', 'source': 'grm', 'knn_k': 1, 'weighted_edges': True, 'symmetrize_mode': 'mutual', 'use_snp_selection': False}. Best is trial 73 with value: 0.17893980951458158.
[I 2025-11-03 12:13:05,689] Trial 133 finished with value: 0.16593186444322855 and parameters: {'model_type': 'gcn', 'hidden_dims': '[512, 256]', 'dropout': 0.10622992976663222, 'batch_norm': True, 'lr': 0.0005950748192396966, 'weight_decay': 6.079805226562547e-05, 'epochs': 135, 'loss': 'mae', 'optimizer': 'adam', 'graph_mode': 'knn', 'source': 'grm', 'knn_k': 1, 'weighted_edges': True, 'symmetrize_mode': 'mutual', 'use_snp_selection': False}. Best is trial 73 with value: 0.17893980951458158.
