[I 2025-11-12 13:33:07,847] Trial 60 finished with value: 0.22588318504770225 and parameters: {'model_type': 'graphsage', 'hidden_dims': '[512, 64]', 'dropout': 0.5177277789447104, 'batch_norm': True, 'lr': 5.832380228467872e-05, 'weight_decay': 4.722665103765808e-05, 'epochs': 63, 'loss': 'mse', 'optimizer': 'adam', 'graph_mode': 'cutoff', 'cutoff': 0.6097335468141188, 'grm_norm': 'gcn', 'self_loops': False, 'use_snp_selection': False}. Best is trial 52 with value: 0.2676437601376995.
[I 2025-11-12 13:34:12,427] Trial 61 finished with value: 0.2407889767330631 and parameters: {'model_type': 'graphsage', 'hidden_dims': '[512, 64]', 'dropout': 0.5353025562027105, 'batch_norm': False, 'lr': 0.0001336589528383337, 'weight_decay': 6.386734187698552e-06, 'epochs': 72, 'loss': 'mae', 'optimizer': 'adam', 'graph_mode': 'cutoff', 'cutoff': 0.49873412938299966, 'grm_norm': 'gcn', 'self_loops': False, 'use_snp_selection': True, 'num_snps': 17437}. Best is trial 52 with value: 0.2676437601376995.
[I 2025-11-12 13:35:39,506] Trial 62 finished with value: 0.04550229569366819 and parameters: {'model_type': 'graphsage', 'hidden_dims': '[512, 64]', 'dropout': 0.4678472980932538, 'batch_norm': False, 'lr': 0.0002861404966591776, 'weight_decay': 4.583576765665819e-06, 'epochs': 54, 'loss': 'mae', 'optimizer': 'adam', 'graph_mode': 'cutoff', 'cutoff': 0.3673305896827145, 'grm_norm': 'gcn', 'self_loops': False, 'use_snp_selection': True, 'num_snps': 33904}. Best is trial 52 with value: 0.2676437601376995.
[I 2025-11-12 13:37:06,196] Trial 63 finished with value: 0.24635398826518257 and parameters: {'model_type': 'graphsage', 'hidden_dims': '[512, 64]', 'dropout': 0.5719865435798758, 'batch_norm': False, 'lr': 9.572049885866087e-05, 'weight_decay': 1.0592757383196406e-05, 'epochs': 108, 'loss': 'mae', 'optimizer': 'adam', 'graph_mode': 'cutoff', 'cutoff': 0.40978404758815457, 'grm_norm': 'gcn', 'self_loops': False, 'use_snp_selection': True, 'num_snps': 24536}. Best is trial 52 with value: 0.2676437601376995.
[I 2025-11-12 13:38:29,118] Trial 64 finished with value: 0.2599988342456606 and parameters: {'model_type': 'graphsage', 'hidden_dims': '[512, 64]', 'dropout': 0.5598104966112815, 'batch_norm': False, 'lr': 9.917315335335956e-05, 'weight_decay': 3.068248113258608e-05, 'epochs': 86, 'loss': 'mae', 'optimizer': 'adam', 'graph_mode': 'cutoff', 'cutoff': 0.4051010646427975, 'grm_norm': 'gcn', 'self_loops': False, 'use_snp_selection': True, 'num_snps': 25708}. Best is trial 52 with value: 0.2676437601376995.
[I 2025-11-12 13:39:54,510] Trial 65 finished with value: 0.2173386873784891 and parameters: {'model_type': 'graphsage', 'hidden_dims': '[512, 64]', 'dropout': 0.5521988945698827, 'batch_norm': False, 'lr': 0.000149357545946875, 'weight_decay': 2.7970822910262737e-05, 'epochs': 85, 'loss': 'mae', 'optimizer': 'adam', 'graph_mode': 'cutoff', 'cutoff': 0.5025412433130568, 'grm_norm': 'gcn', 'self_loops': False, 'use_snp_selection': True, 'num_snps': 30066}. Best is trial 52 with value: 0.2676437601376995.
[I 2025-11-12 13:41:09,700] Trial 66 finished with value: 0.24250405907663639 and parameters: {'model_type': 'graphsage', 'hidden_dims': '[512, 64]', 'dropout': 0.4895549404820604, 'batch_norm': False, 'lr': 6.231618921052869e-05, 'weight_decay': 0.00024951946166460815, 'epochs': 89, 'loss': 'mae', 'optimizer': 'adam', 'graph_mode': 'cutoff', 'cutoff': 0.311909063394784, 'grm_norm': 'gcn', 'self_loops': False, 'use_snp_selection': True, 'num_snps': 19254}. Best is trial 52 with value: 0.2676437601376995.
[I 2025-11-12 13:42:24,108] Trial 67 finished with value: 0.04776575193732972 and parameters: {'model_type': 'graphsage', 'hidden_dims': '[512, 64]', 'dropout': 0.5782736917072876, 'batch_norm': False, 'lr': 0.00046126942227549787, 'weight_decay': 1.9513577081636066e-05, 'epochs': 55, 'loss': 'mae', 'optimizer': 'adam', 'graph_mode': 'cutoff', 'cutoff': 0.42865967575178715, 'grm_norm': 'gcn', 'self_loops': False, 'use_snp_selection': True, 'num_snps': 26377}. Best is trial 52 with value: 0.2676437601376995.
[I 2025-11-12 13:43:41,143] Trial 68 finished with value: 0.25730982958983345 and parameters: {'model_type': 'graphsage', 'hidden_dims': '[512, 64]', 'dropout': 0.5075154650648914, 'batch_norm': False, 'lr': 3.113481751896563e-05, 'weight_decay': 3.4301955811704146e-05, 'epochs': 73, 'loss': 'mae', 'optimizer': 'adam', 'graph_mode': 'cutoff', 'cutoff': 0.4044308635892617, 'grm_norm': 'cosine_then_gcn', 'self_loops': False, 'use_snp_selection': True, 'num_snps': 23097}. Best is trial 52 with value: 0.2676437601376995.
[I 2025-11-12 13:44:45,066] Trial 69 finished with value: 0.23967688927352815 and parameters: {'model_type': 'graphsage', 'hidden_dims': '[256, 128, 64]', 'dropout': 0.5237277162085592, 'batch_norm': False, 'lr': 2.730022697406723e-05, 'weight_decay': 3.2594217121352696e-05, 'epochs': 49, 'loss': 'mae', 'optimizer': 'adam', 'graph_mode': 'cutoff', 'cutoff': 0.3891810066387898, 'grm_norm': 'cosine_then_gcn', 'self_loops': False, 'use_snp_selection': True, 'num_snps': 23669}. Best is trial 52 with value: 0.2676437601376995.
[I 2025-11-12 13:46:27,092] Trial 70 finished with value: 0.23718716897100856 and parameters: {'model_type': 'graphsage', 'hidden_dims': '[512, 64]', 'dropout': 0.503582426565366, 'batch_norm': False, 'lr': 3.236719580649291e-05, 'weight_decay': 7.639667747534464e-05, 'epochs': 68, 'loss': 'mae', 'optimizer': 'adam', 'graph_mode': 'cutoff', 'cutoff': 0.30553510739003636, 'grm_norm': 'cosine_then_gcn', 'self_loops': False, 'use_snp_selection': True, 'num_snps': 35259}. Best is trial 52 with value: 0.2676437601376995.
[I 2025-11-12 13:47:36,127] Trial 71 finished with value: 0.24464862130351017 and parameters: {'model_type': 'graphsage', 'hidden_dims': '[512, 64]', 'dropout': 0.555608895798597, 'batch_norm': False, 'lr': 4.513303571931908e-05, 'weight_decay': 6.119315457961007e-05, 'epochs': 75, 'loss': 'mae', 'optimizer': 'adam', 'graph_mode': 'cutoff', 'cutoff': 0.607208140878361, 'grm_norm': 'cosine_then_gcn', 'self_loops': False, 'use_snp_selection': True, 'num_snps': 21352}. Best is trial 52 with value: 0.2676437601376995.
[I 2025-11-12 13:48:46,813] Trial 72 finished with value: 0.23542071759359223 and parameters: {'model_type': 'graphsage', 'hidden_dims': '[512, 64]', 'dropout': 0.5290501576787049, 'batch_norm': False, 'lr': 0.0002369073623762204, 'weight_decay': 1.3865083367048903e-05, 'epochs': 102, 'loss': 'mae', 'optimizer': 'adam', 'graph_mode': 'cutoff', 'cutoff': 0.5120937213169214, 'grm_norm': 'cosine', 'self_loops': False, 'use_snp_selection': True, 'num_snps': 18150}. Best is trial 52 with value: 0.2676437601376995.
[I 2025-11-12 13:49:49,412] Trial 73 finished with value: 0.24647731619058116 and parameters: {'model_type': 'graphsage', 'hidden_dims': '[512, 64]', 'dropout': 0.4784932413050123, 'batch_norm': False, 'lr': 8.851170607910127e-05, 'weight_decay': 2.387136753668744e-05, 'epochs': 91, 'loss': 'mae', 'optimizer': 'adam', 'graph_mode': 'cutoff', 'cutoff': 0.46686662544710733, 'grm_norm': 'gcn', 'self_loops': False, 'use_snp_selection': True, 'num_snps': 13043}. Best is trial 52 with value: 0.2676437601376995.
[I 2025-11-12 13:51:02,512] Trial 74 finished with value: 0.16522991257900876 and parameters: {'model_type': 'graphsage', 'hidden_dims': '[512, 64]', 'dropout': 0.5846788872561554, 'batch_norm': False, 'lr': 0.0003268707399853738, 'weight_decay': 8.986007161593999e-06, 'epochs': 127, 'loss': 'mae', 'optimizer': 'adam', 'graph_mode': 'cutoff', 'cutoff': 0.40506313353381074, 'grm_norm': 'gcn', 'self_loops': False, 'use_snp_selection': True, 'num_snps': 15504}. Best is trial 52 with value: 0.2676437601376995.
[I 2025-11-12 13:52:20,235] Trial 75 finished with value: 0.24214561645562832 and parameters: {'model_type': 'graphsage', 'hidden_dims': '[512, 256]', 'dropout': 0.5444106043464597, 'batch_norm': False, 'lr': 0.0001865369166419341, 'weight_decay': 1.7421852860678088e-05, 'epochs': 77, 'loss': 'mae', 'optimizer': 'adam', 'graph_mode': 'cutoff', 'cutoff': 0.5663948774337384, 'grm_norm': 'cosine_then_gcn', 'self_loops': False, 'use_snp_selection': True, 'num_snps': 27274}. Best is trial 52 with value: 0.2676437601376995.
[I 2025-11-12 13:53:52,253] Trial 76 finished with value: 0.2410435736002156 and parameters: {'model_type': 'graphsage', 'hidden_dims': '[512, 128]', 'dropout': 0.5650745187171067, 'batch_norm': False, 'lr': 0.00010435099775826733, 'weight_decay': 3.8264975708849434e-05, 'epochs': 112, 'loss': 'mae', 'optimizer': 'adam', 'graph_mode': 'cutoff', 'cutoff': 0.655224691786906, 'grm_norm': 'gcn', 'self_loops': False, 'use_snp_selection': True, 'num_snps': 32076}. Best is trial 52 with value: 0.2676437601376995.
[I 2025-11-12 13:54:20,702] Trial 77 finished with value: 0.21886725967243126 and parameters: {'model_type': 'graphsage', 'hidden_dims': '[128, 64]', 'dropout': 0.5073993503951484, 'batch_norm': True, 'lr': 0.00012870911996832273, 'weight_decay': 4.440500217795019e-06, 'epochs': 46, 'loss': 'mae', 'optimizer': 'adam', 'graph_mode': 'cutoff', 'cutoff': 0.4742947072503116, 'grm_norm': 'cosine', 'self_loops': False, 'use_snp_selection': False}. Best is trial 52 with value: 0.2676437601376995.
[I 2025-11-12 13:56:21,434] Trial 78 finished with value: 0.24907751290034258 and parameters: {'model_type': 'graphsage', 'hidden_dims': '[512, 64]', 'dropout': 0.5598926824073167, 'batch_norm': False, 'lr': 5.8747954257024824e-05, 'weight_decay': 2.5958532029023402e-06, 'epochs': 95, 'loss': 'mse', 'optimizer': 'adam', 'graph_mode': 'cutoff', 'cutoff': 0.3369759559100488, 'grm_norm': 'gcn', 'self_loops': False, 'use_snp_selection': True, 'num_snps': 38030}. Best is trial 52 with value: 0.2676437601376995.
[I 2025-11-12 13:58:48,894] Trial 79 finished with value: 0.2498778462833901 and parameters: {'model_type': 'graphsage', 'hidden_dims': '[512, 64]', 'dropout': 0.5865079926625972, 'batch_norm': False, 'lr': 5.463252338912338e-05, 'weight_decay': 2.646911719879668e-06, 'epochs': 95, 'loss': 'mse', 'optimizer': 'adam', 'graph_mode': 'cutoff', 'cutoff': 0.2574398954206061, 'grm_norm': 'cosine_then_gcn', 'self_loops': True, 'use_snp_selection': True, 'num_snps': 37878}. Best is trial 52 with value: 0.2676437601376995.
[I 2025-11-12 14:01:30,328] Trial 80 finished with value: 0.23838319120380952 and parameters: {'model_type': 'graphsage', 'hidden_dims': '[512, 64]', 'dropout': 0.5860340862607488, 'batch_norm': False, 'lr': 5.5787143319930054e-05, 'weight_decay': 2.8358251739143985e-06, 'epochs': 98, 'loss': 'mse', 'optimizer': 'adam', 'graph_mode': 'cutoff', 'cutoff': 0.23429810737262302, 'grm_norm': 'cosine_then_gcn', 'self_loops': True, 'use_snp_selection': True, 'num_snps': 37640}. Best is trial 52 with value: 0.2676437601376995.
[I 2025-11-12 14:03:12,542] Trial 81 finished with value: 0.09923616798225046 and parameters: {'model_type': 'graphsage', 'hidden_dims': '[512, 64]', 'dropout': 0.5953758132551219, 'batch_norm': False, 'lr': 6.778421706063223e-05, 'weight_decay': 5.4513295782412495e-06, 'epochs': 64, 'loss': 'mse', 'optimizer': 'adam', 'graph_mode': 'cutoff', 'cutoff': 0.27751356163485996, 'grm_norm': 'cosine_then_gcn', 'self_loops': True, 'use_snp_selection': True, 'num_snps': 34414}. Best is trial 52 with value: 0.2676437601376995.
[I 2025-11-12 14:05:10,374] Trial 82 finished with value: 0.24214877351510547 and parameters: {'model_type': 'graphsage', 'hidden_dims': '[512, 64]', 'dropout': 0.5569413079712852, 'batch_norm': False, 'lr': 4.355215769019614e-05, 'weight_decay': 1.4792787987476247e-06, 'epochs': 91, 'loss': 'mse', 'optimizer': 'adam', 'graph_mode': 'cutoff', 'cutoff': 0.3303494073379748, 'grm_norm': 'none', 'self_loops': True, 'use_snp_selection': True, 'num_snps': 37468}. Best is trial 52 with value: 0.2676437601376995.
[I 2025-11-12 14:07:53,447] Trial 83 finished with value: 0.2551773960098469 and parameters: {'model_type': 'graphsage', 'hidden_dims': '[512, 64]', 'dropout': 0.5678288698845215, 'batch_norm': False, 'lr': 3.203503516011434e-05, 'weight_decay': 2.2512586438097507e-06, 'epochs': 100, 'loss': 'mse', 'optimizer': 'adam', 'graph_mode': 'cutoff', 'cutoff': 0.2607731744366236, 'grm_norm': 'cosine_then_gcn', 'self_loops': True, 'use_snp_selection': True, 'num_snps': 40872}. Best is trial 52 with value: 0.2676437601376995.
[I 2025-11-12 14:10:44,509] Trial 84 finished with value: 0.23088926332947474 and parameters: {'model_type': 'graphsage', 'hidden_dims': '[512, 64]', 'dropout': 0.5722817583935719, 'batch_norm': False, 'lr': 2.995337193744957e-05, 'weight_decay': 3.7307075141110804e-06, 'epochs': 125, 'loss': 'mse', 'optimizer': 'adam', 'graph_mode': 'cutoff', 'cutoff': 0.20066477153999873, 'grm_norm': 'cosine_then_gcn', 'self_loops': True, 'use_snp_selection': True, 'num_snps': 29026}. Best is trial 52 with value: 0.2676437601376995.
[I 2025-11-12 14:13:25,294] Trial 85 finished with value: 0.25288229971800685 and parameters: {'model_type': 'graphsage', 'hidden_dims': '[512, 64]', 'dropout': 0.5334211126427474, 'batch_norm': False, 'lr': 3.4528228568928e-05, 'weight_decay': 1.8790906107867957e-06, 'epochs': 107, 'loss': 'mse', 'optimizer': 'adam', 'graph_mode': 'cutoff', 'cutoff': 0.2725705447651044, 'grm_norm': 'cosine_then_gcn', 'self_loops': True, 'use_snp_selection': True, 'num_snps': 40907}. Best is trial 52 with value: 0.2676437601376995.
[I 2025-11-12 14:16:09,058] Trial 86 finished with value: 0.24690989728398677 and parameters: {'model_type': 'graphsage', 'hidden_dims': '[512, 64]', 'dropout': 0.5120256637357329, 'batch_norm': False, 'lr': 2.0183929516951276e-05, 'weight_decay': 1.5586274239008698e-06, 'epochs': 111, 'loss': 'mse', 'optimizer': 'adam', 'graph_mode': 'cutoff', 'cutoff': 0.2752662137068902, 'grm_norm': 'cosine_then_gcn', 'self_loops': True, 'use_snp_selection': True, 'num_snps': 40858}. Best is trial 52 with value: 0.2676437601376995.
[I 2025-11-12 14:19:10,579] Trial 87 finished with value: 0.15167035398482562 and parameters: {'model_type': 'graphsage', 'hidden_dims': '[512, 64]', 'dropout': 0.5294841686316427, 'batch_norm': False, 'lr': 7.83610588558346e-05, 'weight_decay': 2.0482988275263272e-06, 'epochs': 105, 'loss': 'mse', 'optimizer': 'adam', 'graph_mode': 'cutoff', 'cutoff': 0.25642939462136277, 'grm_norm': 'cosine_then_gcn', 'self_loops': True, 'use_snp_selection': True, 'num_snps': 43676}. Best is trial 52 with value: 0.2676437601376995.
[I 2025-11-12 14:21:04,168] Trial 88 finished with value: 0.25396447276882567 and parameters: {'model_type': 'graphsage', 'hidden_dims': '[256, 128, 64]', 'dropout': 0.5977998399640675, 'batch_norm': False, 'lr': 3.1782505195370605e-05, 'weight_decay': 4.889794078435121e-05, 'epochs': 69, 'loss': 'mse', 'optimizer': 'adam', 'graph_mode': 'cutoff', 'cutoff': 0.2094884186517205, 'grm_norm': 'cosine_then_gcn', 'self_loops': True, 'use_snp_selection': True, 'num_snps': 31956}. Best is trial 52 with value: 0.2676437601376995.
[I 2025-11-12 14:22:24,341] Trial 89 finished with value: 0.20550363786100617 and parameters: {'model_type': 'graphsage', 'hidden_dims': '[256, 128, 64]', 'dropout': 0.5944573845399719, 'batch_norm': True, 'lr': 3.586199122560762e-05, 'weight_decay': 0.00017026016982352356, 'epochs': 58, 'loss': 'mse', 'optimizer': 'adam', 'graph_mode': 'cutoff', 'cutoff': 0.20132623436206332, 'grm_norm': 'cosine_then_gcn', 'self_loops': True, 'use_snp_selection': False}. Best is trial 52 with value: 0.2676437601376995.
[I 2025-11-12 14:24:20,182] Trial 90 finished with value: 0.24987808596208078 and parameters: {'model_type': 'graphsage', 'hidden_dims': '[256, 128, 64]', 'dropout': 0.5703362307870515, 'batch_norm': False, 'lr': 2.12936487024511e-05, 'weight_decay': 5.3014083016852694e-05, 'epochs': 75, 'loss': 'mse', 'optimizer': 'adam', 'graph_mode': 'cutoff', 'cutoff': 0.22275179750516835, 'grm_norm': 'cosine_then_gcn', 'self_loops': True, 'use_snp_selection': True, 'num_snps': 32573}. Best is trial 52 with value: 0.2676437601376995.
[I 2025-11-12 14:26:08,148] Trial 91 finished with value: 0.23710489300207765 and parameters: {'model_type': 'graphsage', 'hidden_dims': '[256, 128, 64]', 'dropout': 0.5692032420804863, 'batch_norm': False, 'lr': 1.5013374340823574e-05, 'weight_decay': 5.6775138105959514e-05, 'epochs': 72, 'loss': 'mse', 'optimizer': 'adam', 'graph_mode': 'cutoff', 'cutoff': 0.23754058210088383, 'grm_norm': 'cosine_then_gcn', 'self_loops': True, 'use_snp_selection': True, 'num_snps': 32570}. Best is trial 52 with value: 0.2676437601376995.
[I 2025-11-12 14:28:02,646] Trial 92 finished with value: 0.23428747509029027 and parameters: {'model_type': 'graphsage', 'hidden_dims': '[256, 128, 64]', 'dropout': 0.5843358875695203, 'batch_norm': False, 'lr': 2.143052908739493e-05, 'weight_decay': 5.0227768145593233e-05, 'epochs': 81, 'loss': 'mse', 'optimizer': 'adam', 'graph_mode': 'cutoff', 'cutoff': 0.26139355493159977, 'grm_norm': 'cosine_then_gcn', 'self_loops': True, 'use_snp_selection': True, 'num_snps': 36504}. Best is trial 52 with value: 0.2676437601376995.
[I 2025-11-12 14:31:51,756] Trial 93 finished with value: 0.2204221880903899 and parameters: {'model_type': 'graphsage', 'hidden_dims': '[256, 128, 64]', 'dropout': 0.5456019483249, 'batch_norm': False, 'lr': 2.7678693162325632e-05, 'weight_decay': 3.2895505615294644e-05, 'epochs': 326, 'loss': 'mse', 'optimizer': 'adam', 'graph_mode': 'cutoff', 'cutoff': 0.22262617019829928, 'grm_norm': 'cosine_then_gcn', 'self_loops': True, 'use_snp_selection': True, 'num_snps': 25014}. Best is trial 52 with value: 0.2676437601376995.
[I 2025-11-12 14:33:26,587] Trial 94 finished with value: 0.2438844532367354 and parameters: {'model_type': 'graphsage', 'hidden_dims': '[256, 128, 64]', 'dropout': 0.5716776732028804, 'batch_norm': False, 'lr': 3.998583535133847e-05, 'weight_decay': 9.113590934139026e-05, 'epochs': 65, 'loss': 'mse', 'optimizer': 'adam', 'graph_mode': 'cutoff', 'cutoff': 0.30871598225782465, 'grm_norm': 'cosine_then_gcn', 'self_loops': True, 'use_snp_selection': True, 'num_snps': 39367}. Best is trial 52 with value: 0.2676437601376995.
[I 2025-11-12 14:35:06,060] Trial 95 finished with value: 0.2261434493273879 and parameters: {'model_type': 'graphsage', 'hidden_dims': '[256, 128, 64]', 'dropout': 0.599423277203695, 'batch_norm': False, 'lr': 3.187494978387174e-05, 'weight_decay': 2.7299262940216527e-05, 'epochs': 76, 'loss': 'mse', 'optimizer': 'adam', 'graph_mode': 'cutoff', 'cutoff': 0.22103370753331678, 'grm_norm': 'cosine_then_gcn', 'self_loops': True, 'use_snp_selection': True, 'num_snps': 28184}. Best is trial 52 with value: 0.2676437601376995.
[I 2025-11-12 14:36:23,151] Trial 96 finished with value: 0.22808105610567778 and parameters: {'model_type': 'graphsage', 'hidden_dims': '[256, 128, 64]', 'dropout': 0.5299098479813912, 'batch_norm': False, 'lr': 1.8232550658331325e-05, 'weight_decay': 4.3307077442091304e-05, 'epochs': 99, 'loss': 'mse', 'optimizer': 'adam', 'graph_mode': 'cutoff', 'cutoff': 0.7543601311642788, 'grm_norm': 'cosine_then_gcn', 'self_loops': True, 'use_snp_selection': True, 'num_snps': 34132}. Best is trial 52 with value: 0.2676437601376995.
[I 2025-11-12 14:37:53,443] Trial 97 finished with value: 0.24197524217638247 and parameters: {'model_type': 'graphsage', 'hidden_dims': '[512, 256]', 'dropout': 0.5610861535273073, 'batch_norm': False, 'lr': 4.7610958051439254e-05, 'weight_decay': 0.0001341345172527439, 'epochs': 120, 'loss': 'mse', 'optimizer': 'adam', 'graph_mode': 'cutoff', 'cutoff': 0.36152274709069404, 'grm_norm': 'none', 'self_loops': True, 'use_snp_selection': True, 'num_snps': 23173}. Best is trial 52 with value: 0.2676437601376995.
[I 2025-11-12 14:40:13,148] Trial 98 finished with value: 0.240386856193681 and parameters: {'model_type': 'graphsage', 'hidden_dims': '[512, 128]', 'dropout': 0.5888251454981951, 'batch_norm': False, 'lr': 2.235456271331698e-05, 'weight_decay': 6.512766306896966e-05, 'epochs': 84, 'loss': 'mse', 'optimizer': 'adam', 'graph_mode': 'cutoff', 'cutoff': 0.2917270597953803, 'grm_norm': 'cosine_then_gcn', 'self_loops': True, 'use_snp_selection': True, 'num_snps': 44045}. Best is trial 52 with value: 0.2676437601376995.
[I 2025-11-12 14:42:03,278] Trial 99 finished with value: 0.24113813918160934 and parameters: {'model_type': 'graphsage', 'hidden_dims': '[128, 64]', 'dropout': 0.5004817626349134, 'batch_norm': False, 'lr': 3.651583351429168e-05, 'weight_decay': 1.6673489846114647e-05, 'epochs': 70, 'loss': 'mse', 'optimizer': 'adam', 'graph_mode': 'cutoff', 'cutoff': 0.24907021289598125, 'grm_norm': 'cosine_then_gcn', 'self_loops': True, 'use_snp_selection': True, 'num_snps': 39208}. Best is trial 52 with value: 0.2676437601376995.
[I 2025-11-12 14:43:24,667] Trial 100 finished with value: 0.23000648213443636 and parameters: {'model_type': 'graphsage', 'hidden_dims': '[256, 128, 64]', 'dropout': 0.5153299724407246, 'batch_norm': False, 'lr': 1.3645673045978395e-05, 'weight_decay': 9.45470607693218e-07, 'epochs': 46, 'loss': 'mse', 'optimizer': 'adam', 'graph_mode': 'cutoff', 'cutoff': 0.39150897375508953, 'grm_norm': 'cosine_then_gcn', 'self_loops': True, 'use_snp_selection': True, 'num_snps': 41862}. Best is trial 52 with value: 0.2676437601376995.
[I 2025-11-12 14:44:59,187] Trial 101 finished with value: 0.24764660106584052 and parameters: {'model_type': 'graphsage', 'hidden_dims': '[512, 64]', 'dropout': 0.5386730241587459, 'batch_norm': False, 'lr': 2.5806718059954338e-05, 'weight_decay': 3.435819123419135e-06, 'epochs': 94, 'loss': 'mse', 'optimizer': 'adam', 'graph_mode': 'cutoff', 'cutoff': 0.4380270923696004, 'grm_norm': 'cosine_then_gcn', 'self_loops': True, 'use_snp_selection': True, 'num_snps': 30426}. Best is trial 52 with value: 0.2676437601376995.
