[I 2025-10-22 07:36:55,689] Trial 146 finished with value: 0.22536391524799076 and parameters: {'model_type': 'gat', 'hidden_dims': '[256, 128, 64]', 'dropout': 0.28519467671027, 'batch_norm': False, 'gat_heads': 3, 'gat_attn_dropout': 0.3088016723326133, 'gat_concat_hidden': False, 'lr': 0.0002690554449534057, 'weight_decay': 2.269130208863946e-06, 'epochs': 60, 'loss': 'mae', 'optimizer': 'adam', 'graph_mode': 'cutoff', 'cutoff': 0.7651732492832454, 'grm_norm': 'cosine_then_gcn', 'self_loops': False}. Best is trial 135 with value: 0.2581454551753229.
[I 2025-10-22 07:37:22,369] Trial 147 finished with value: 0.23669868095481522 and parameters: {'model_type': 'gat', 'hidden_dims': '[256, 128, 64]', 'dropout': 0.26805783913240505, 'batch_norm': False, 'gat_heads': 2, 'gat_attn_dropout': 0.3336663710985363, 'gat_concat_hidden': False, 'lr': 0.00024202549423683152, 'weight_decay': 5.003247561135757e-06, 'epochs': 66, 'loss': 'mae', 'optimizer': 'adam', 'graph_mode': 'cutoff', 'cutoff': 0.6740820236997286, 'grm_norm': 'cosine_then_gcn', 'self_loops': False}. Best is trial 135 with value: 0.2581454551753229.
[I 2025-10-22 07:37:53,197] Trial 148 finished with value: 0.2502408263552428 and parameters: {'model_type': 'gat', 'hidden_dims': '[256, 128, 64]', 'dropout': 0.2551908659574466, 'batch_norm': False, 'gat_heads': 3, 'gat_attn_dropout': 0.28712930315826873, 'gat_concat_hidden': False, 'lr': 0.00029638268605605353, 'weight_decay': 3.830679267821179e-06, 'epochs': 46, 'loss': 'mae', 'optimizer': 'adam', 'graph_mode': 'cutoff', 'cutoff': 0.7156591922890867, 'grm_norm': 'cosine_then_gcn', 'self_loops': False}. Best is trial 135 with value: 0.2581454551753229.
[I 2025-10-22 07:38:20,931] Trial 149 finished with value: 0.2385176273766711 and parameters: {'model_type': 'gat', 'hidden_dims': '[256, 128, 64]', 'dropout': 0.22271243963509962, 'batch_norm': False, 'gat_heads': 3, 'gat_attn_dropout': 0.24407651543253275, 'gat_concat_hidden': False, 'lr': 0.0002010847022877318, 'weight_decay': 3.072100886379276e-06, 'epochs': 40, 'loss': 'mae', 'optimizer': 'adam', 'graph_mode': 'cutoff', 'cutoff': 0.7463429578069312, 'grm_norm': 'gcn', 'self_loops': False}. Best is trial 135 with value: 0.2581454551753229.
[I 2025-10-22 07:38:52,116] Trial 0 finished with value: 0.13638010994965954 and parameters: {'model_type': 'gat', 'hidden_dims': '[128, 64]', 'dropout': 0.199031432379812, 'batch_norm': True, 'gat_heads': 1, 'gat_attn_dropout': 0.41121589102067835, 'gat_concat_hidden': True, 'lr': 3.4401453323286906e-05, 'weight_decay': 0.00017802616915745114, 'epochs': 230, 'loss': 'mse', 'optimizer': 'adam', 'graph_mode': 'knn', 'source': 'grm', 'knn_k': 6, 'weighted_edges': True, 'symmetrize_mode': 'mutual'}. Best is trial 0 with value: 0.13638010994965954.
[I 2025-10-22 07:40:04,695] Trial 1 finished with value: 0.05716143482856715 and parameters: {'model_type': 'gat', 'hidden_dims': '[512, 64]', 'dropout': 0.36082357619681704, 'batch_norm': True, 'gat_heads': 1, 'gat_attn_dropout': 0.18042003398172202, 'gat_concat_hidden': False, 'lr': 1.3825758230956745e-06, 'weight_decay': 3.199989794411411e-05, 'epochs': 210, 'loss': 'mse', 'optimizer': 'adam', 'graph_mode': 'knn', 'source': 'grm', 'knn_k': 8, 'weighted_edges': True, 'symmetrize_mode': 'mutual'}. Best is trial 0 with value: 0.13638010994965954.
[I 2025-10-22 07:42:35,645] Trial 2 finished with value: 0.22257380711708624 and parameters: {'model_type': 'gat', 'hidden_dims': '[512, 64]', 'dropout': 0.5938127374509361, 'batch_norm': False, 'gat_heads': 3, 'gat_attn_dropout': 0.3584229889385306, 'gat_concat_hidden': True, 'lr': 5.8966328690006356e-05, 'weight_decay': 1.4359095002909625e-07, 'epochs': 151, 'loss': 'mae', 'optimizer': 'adam', 'graph_mode': 'cutoff', 'cutoff': 0.22797144608298409, 'grm_norm': 'none', 'self_loops': False}. Best is trial 2 with value: 0.22257380711708624.
[I 2025-10-22 07:43:13,018] Trial 3 finished with value: 0.17532094857168198 and parameters: {'model_type': 'gat', 'hidden_dims': '[256, 128]', 'dropout': 0.23110783056597514, 'batch_norm': True, 'gat_heads': 3, 'gat_attn_dropout': 0.14524552524211642, 'gat_concat_hidden': False, 'lr': 2.6631568299397822e-05, 'weight_decay': 1.4831733219640837e-06, 'epochs': 59, 'loss': 'mse', 'optimizer': 'adam', 'graph_mode': 'cutoff', 'cutoff': 0.5085416774304665, 'grm_norm': 'cosine_then_gcn', 'self_loops': False}. Best is trial 2 with value: 0.22257380711708624.
[I 2025-10-22 07:43:44,540] Trial 4 finished with value: 0.155053749268487 and parameters: {'model_type': 'gat', 'hidden_dims': '[128, 64]', 'dropout': 0.24986493621228142, 'batch_norm': False, 'gat_heads': 2, 'gat_attn_dropout': 0.03028660209239857, 'gat_concat_hidden': True, 'lr': 3.4411882055364858e-06, 'weight_decay': 0.00034938832175517785, 'epochs': 153, 'loss': 'mae', 'optimizer': 'adam', 'graph_mode': 'cutoff', 'cutoff': 0.5288497054083461, 'grm_norm': 'cosine_then_gcn', 'self_loops': False}. Best is trial 2 with value: 0.22257380711708624.
[I 2025-10-22 07:45:07,865] Trial 5 finished with value: 0.21594393932961448 and parameters: {'model_type': 'gat', 'hidden_dims': '[256, 128, 64]', 'dropout': 0.3667354424945013, 'batch_norm': False, 'gat_heads': 5, 'gat_attn_dropout': 0.47505419776597435, 'gat_concat_hidden': False, 'lr': 5.6570170227139244e-05, 'weight_decay': 6.845407486393404e-05, 'epochs': 86, 'loss': 'mae', 'optimizer': 'adam', 'graph_mode': 'cutoff', 'cutoff': 0.3163415033931736, 'grm_norm': 'cosine', 'self_loops': False}. Best is trial 2 with value: 0.22257380711708624.
[I 2025-10-22 07:48:04,665] Trial 6 finished with value: 0.15416507454236458 and parameters: {'model_type': 'gat', 'hidden_dims': '[512, 64]', 'dropout': 0.4724320384750339, 'batch_norm': True, 'gat_heads': 2, 'gat_attn_dropout': 0.5029567924222157, 'gat_concat_hidden': False, 'lr': 0.00035117819773722113, 'weight_decay': 2.586139236899202e-05, 'epochs': 282, 'loss': 'mse', 'optimizer': 'adam', 'graph_mode': 'knn', 'source': 'grm', 'knn_k': 5, 'weighted_edges': False, 'symmetrize_mode': 'mutual'}. Best is trial 2 with value: 0.22257380711708624.
[I 2025-10-22 07:48:35,718] Trial 7 finished with value: 0.1670050928625547 and parameters: {'model_type': 'gat', 'hidden_dims': '[256, 128]', 'dropout': 0.26933956649466984, 'batch_norm': False, 'gat_heads': 1, 'gat_attn_dropout': 0.12357015502138351, 'gat_concat_hidden': True, 'lr': 9.272145288974393e-05, 'weight_decay': 0.0001637847231599168, 'epochs': 149, 'loss': 'mae', 'optimizer': 'adam', 'graph_mode': 'knn', 'source': 'grm', 'knn_k': 9, 'weighted_edges': False, 'symmetrize_mode': 'mutual'}. Best is trial 2 with value: 0.22257380711708624.
[I 2025-10-22 07:48:55,337] Trial 8 finished with value: 0.21386849076171693 and parameters: {'model_type': 'gat', 'hidden_dims': '[256, 128, 64]', 'dropout': 0.5327763091136416, 'batch_norm': True, 'gat_heads': 1, 'gat_attn_dropout': 0.11077610280855929, 'gat_concat_hidden': False, 'lr': 0.0005504846263330393, 'weight_decay': 6.7826287729705615e-06, 'epochs': 80, 'loss': 'mse', 'optimizer': 'adam', 'graph_mode': 'cutoff', 'cutoff': 0.39200637331077737, 'grm_norm': 'cosine_then_gcn', 'self_loops': False}. Best is trial 2 with value: 0.22257380711708624.
[I 2025-10-22 07:50:16,668] Trial 9 finished with value: 0.19359879225532367 and parameters: {'model_type': 'gat', 'hidden_dims': '[256, 128, 64]', 'dropout': 0.29822093943922523, 'batch_norm': True, 'gat_heads': 2, 'gat_attn_dropout': 0.5041483896530343, 'gat_concat_hidden': True, 'lr': 0.0009262984185468379, 'weight_decay': 8.224875501038066e-07, 'epochs': 231, 'loss': 'mae', 'optimizer': 'adam', 'graph_mode': 'cutoff', 'cutoff': 0.40177719715455146, 'grm_norm': 'none', 'self_loops': True}. Best is trial 2 with value: 0.22257380711708624.
[I 2025-10-22 08:02:32,365] Trial 10 finished with value: 0.2054950751154096 and parameters: {'model_type': 'gat', 'hidden_dims': '[512, 256]', 'dropout': 0.11372025982957354, 'batch_norm': False, 'gat_heads': 7, 'gat_attn_dropout': 0.3209474202032679, 'gat_concat_hidden': True, 'lr': 7.716508611549555e-06, 'weight_decay': 1.2275552774590528e-07, 'epochs': 339, 'loss': 'mae', 'optimizer': 'adam', 'graph_mode': 'cutoff', 'cutoff': 0.7630101661786219, 'grm_norm': 'gcn', 'self_loops': True}. Best is trial 2 with value: 0.22257380711708624.
[I 2025-10-22 08:05:55,573] Trial 11 finished with value: 0.20728681641488728 and parameters: {'model_type': 'gat', 'hidden_dims': '[512, 128]', 'dropout': 0.4188393640717828, 'batch_norm': False, 'gat_heads': 5, 'gat_attn_dropout': 0.5935696129988, 'gat_concat_hidden': False, 'lr': 0.00011519385025436597, 'weight_decay': 1.9223979254073354e-07, 'epochs': 116, 'loss': 'mae', 'optimizer': 'adam', 'graph_mode': 'cutoff', 'cutoff': 0.21108952210872212, 'grm_norm': 'cosine', 'self_loops': False}. Best is trial 2 with value: 0.22257380711708624.
[I 2025-10-22 08:06:43,107] Trial 12 finished with value: 0.17721048265561817 and parameters: {'model_type': 'gat', 'hidden_dims': '[256, 128, 64]', 'dropout': 0.582253907725045, 'batch_norm': False, 'gat_heads': 5, 'gat_attn_dropout': 0.3195055886569863, 'gat_concat_hidden': False, 'lr': 2.2553200376683994e-05, 'weight_decay': 5.1605544418448e-06, 'epochs': 42, 'loss': 'mae', 'optimizer': 'adam', 'graph_mode': 'cutoff', 'cutoff': 0.2490466259773666, 'grm_norm': 'cosine', 'self_loops': False}. Best is trial 2 with value: 0.22257380711708624.
[I 2025-10-22 08:11:09,750] Trial 13 finished with value: 0.20688018468704555 and parameters: {'model_type': 'gat', 'hidden_dims': '[512, 64]', 'dropout': 0.46611551853759325, 'batch_norm': False, 'gat_heads': 7, 'gat_attn_dropout': 0.4077729210902066, 'gat_concat_hidden': True, 'lr': 0.00010188205659961246, 'weight_decay': 4.3753586002790624e-05, 'epochs': 115, 'loss': 'mae', 'optimizer': 'adam', 'graph_mode': 'cutoff', 'cutoff': 0.33095919133621937, 'grm_norm': 'none', 'self_loops': False}. Best is trial 2 with value: 0.22257380711708624.
[I 2025-10-22 08:14:32,747] Trial 14 finished with value: 0.18640946668444092 and parameters: {'model_type': 'gat', 'hidden_dims': '[512, 256]', 'dropout': 0.5913889433548571, 'batch_norm': False, 'gat_heads': 4, 'gat_attn_dropout': 0.41433079981076465, 'gat_concat_hidden': True, 'lr': 1.0454076764627182e-05, 'weight_decay': 0.000929256360284688, 'epochs': 156, 'loss': 'mae', 'optimizer': 'adam', 'graph_mode': 'cutoff', 'cutoff': 0.7575352535140574, 'grm_norm': 'cosine', 'self_loops': False}. Best is trial 2 with value: 0.22257380711708624.
[I 2025-10-22 08:16:53,547] Trial 15 finished with value: 0.20112138195068113 and parameters: {'model_type': 'gat', 'hidden_dims': '[512, 128]', 'dropout': 0.3485185322357207, 'batch_norm': False, 'gat_heads': 4, 'gat_attn_dropout': 0.24642078220265135, 'gat_concat_hidden': False, 'lr': 6.188872153910064e-05, 'weight_decay': 5.880132564398769e-07, 'epochs': 98, 'loss': 'mae', 'optimizer': 'adam', 'graph_mode': 'cutoff', 'cutoff': 0.2060419002924092, 'grm_norm': 'none', 'self_loops': True}. Best is trial 2 with value: 0.22257380711708624.
[I 2025-10-22 08:19:39,476] Trial 16 finished with value: 0.22935398288959452 and parameters: {'model_type': 'gat', 'hidden_dims': '[256, 128, 64]', 'dropout': 0.14841121991308817, 'batch_norm': False, 'gat_heads': 6, 'gat_attn_dropout': 0.49176058951476675, 'gat_concat_hidden': True, 'lr': 0.0002228020772219899, 'weight_decay': 2.1488702798612586e-06, 'epochs': 173, 'loss': 'mae', 'optimizer': 'adam', 'graph_mode': 'cutoff', 'cutoff': 0.6499665279457246, 'grm_norm': 'gcn', 'self_loops': False}. Best is trial 16 with value: 0.22935398288959452.
[I 2025-10-22 08:25:30,070] Trial 17 finished with value: 0.2584227340138163 and parameters: {'model_type': 'gat', 'hidden_dims': '[512, 64]', 'dropout': 0.12605878090297307, 'batch_norm': False, 'gat_heads': 6, 'gat_attn_dropout': 0.5852771426917108, 'gat_concat_hidden': True, 'lr': 0.00024910643160677183, 'weight_decay': 2.3247625203276105e-06, 'epochs': 190, 'loss': 'mae', 'optimizer': 'adam', 'graph_mode': 'cutoff', 'cutoff': 0.6573702710552439, 'grm_norm': 'gcn', 'self_loops': False}. Best is trial 17 with value: 0.2584227340138163.
[I 2025-10-22 08:31:11,574] Trial 18 finished with value: 0.12698486033496362 and parameters: {'model_type': 'gat', 'hidden_dims': '[256, 128, 64]', 'dropout': 0.11137922711018722, 'batch_norm': False, 'gat_heads': 8, 'gat_attn_dropout': 0.5884130921418489, 'gat_concat_hidden': True, 'lr': 0.00027403848734632594, 'weight_decay': 3.1516006082099775e-06, 'epochs': 263, 'loss': 'mae', 'optimizer': 'adam', 'graph_mode': 'knn', 'source': 'grm', 'knn_k': 1, 'weighted_edges': False, 'symmetrize_mode': 'union'}. Best is trial 17 with value: 0.2584227340138163.
[I 2025-10-22 08:36:53,976] Trial 19 finished with value: 0.25331499537393565 and parameters: {'model_type': 'gat', 'hidden_dims': '[512, 64]', 'dropout': 0.16972845733321162, 'batch_norm': False, 'gat_heads': 6, 'gat_attn_dropout': 0.545104297852812, 'gat_concat_hidden': True, 'lr': 0.00019891319343444473, 'weight_decay': 1.4349200990328626e-05, 'epochs': 186, 'loss': 'mae', 'optimizer': 'adam', 'graph_mode': 'cutoff', 'cutoff': 0.6581869800643618, 'grm_norm': 'gcn', 'self_loops': False}. Best is trial 17 with value: 0.2584227340138163.
[I 2025-10-22 08:42:45,466] Trial 20 finished with value: 0.23963683882618966 and parameters: {'model_type': 'gat', 'hidden_dims': '[512, 64]', 'dropout': 0.19401431588173643, 'batch_norm': False, 'gat_heads': 6, 'gat_attn_dropout': 0.5704026963298592, 'gat_concat_hidden': True, 'lr': 0.00018569044120503683, 'weight_decay': 7.764689010874712e-06, 'epochs': 193, 'loss': 'mae', 'optimizer': 'adam', 'graph_mode': 'cutoff', 'cutoff': 0.8951448489246829, 'grm_norm': 'gcn', 'self_loops': True}. Best is trial 17 with value: 0.2584227340138163.
[I 2025-10-22 08:48:27,444] Trial 21 finished with value: 0.24723903490019924 and parameters: {'model_type': 'gat', 'hidden_dims': '[512, 64]', 'dropout': 0.17346136088812608, 'batch_norm': False, 'gat_heads': 6, 'gat_attn_dropout': 0.5421342394779298, 'gat_concat_hidden': True, 'lr': 0.00020545130463637718, 'weight_decay': 1.5041242030339749e-05, 'epochs': 187, 'loss': 'mae', 'optimizer': 'adam', 'graph_mode': 'cutoff', 'cutoff': 0.8733752801168795, 'grm_norm': 'gcn', 'self_loops': True}. Best is trial 17 with value: 0.2584227340138163.
[I 2025-10-22 08:54:19,868] Trial 22 finished with value: 0.10119529353721932 and parameters: {'model_type': 'gat', 'hidden_dims': '[512, 64]', 'dropout': 0.16180692732048868, 'batch_norm': False, 'gat_heads': 6, 'gat_attn_dropout': 0.5247423341868067, 'gat_concat_hidden': True, 'lr': 0.0005390953429193503, 'weight_decay': 1.4965954180289939e-05, 'epochs': 191, 'loss': 'mae', 'optimizer': 'adam', 'graph_mode': 'cutoff', 'cutoff': 0.6283845165564041, 'grm_norm': 'gcn', 'self_loops': True}. Best is trial 17 with value: 0.2584227340138163.
[I 2025-10-22 09:03:26,304] Trial 23 finished with value: 0.22236718568787278 and parameters: {'model_type': 'gat', 'hidden_dims': '[512, 64]', 'dropout': 0.178757315419542, 'batch_norm': False, 'gat_heads': 7, 'gat_attn_dropout': 0.5509372214768489, 'gat_concat_hidden': True, 'lr': 0.0001804984345606257, 'weight_decay': 1.2838455510256962e-05, 'epochs': 261, 'loss': 'mae', 'optimizer': 'adam', 'graph_mode': 'cutoff', 'cutoff': 0.899436395474515, 'grm_norm': 'gcn', 'self_loops': True}. Best is trial 17 with value: 0.2584227340138163.
[I 2025-10-22 09:12:57,340] Trial 24 finished with value: 0.08579072114251819 and parameters: {'model_type': 'gat', 'hidden_dims': '[512, 64]', 'dropout': 0.13769223262350044, 'batch_norm': False, 'gat_heads': 8, 'gat_attn_dropout': 0.45177973276283334, 'gat_concat_hidden': True, 'lr': 0.0009606394559577252, 'weight_decay': 3.6736426899713245e-06, 'epochs': 230, 'loss': 'mae', 'optimizer': 'adam', 'graph_mode': 'cutoff', 'cutoff': 0.7151830488813702, 'grm_norm': 'gcn', 'self_loops': True}. Best is trial 17 with value: 0.2584227340138163.
[I 2025-10-22 09:16:59,094] Trial 25 finished with value: 0.21560263731567222 and parameters: {'model_type': 'gat', 'hidden_dims': '[512, 64]', 'dropout': 0.10172248915271283, 'batch_norm': False, 'gat_heads': 6, 'gat_attn_dropout': 0.5445252010683073, 'gat_concat_hidden': True, 'lr': 0.0004046407946842654, 'weight_decay': 4.497612642070493e-07, 'epochs': 128, 'loss': 'mae', 'optimizer': 'adam', 'graph_mode': 'cutoff', 'cutoff': 0.8268728107306251, 'grm_norm': 'gcn', 'self_loops': False}. Best is trial 17 with value: 0.2584227340138163.
[I 2025-10-22 09:24:24,725] Trial 26 finished with value: 0.22248691378467073 and parameters: {'model_type': 'gat', 'hidden_dims': '[512, 64]', 'dropout': 0.30773554631819655, 'batch_norm': False, 'gat_heads': 7, 'gat_attn_dropout': 0.43139940834145196, 'gat_concat_hidden': True, 'lr': 0.00013445458086178743, 'weight_decay': 2.1175658069337995e-05, 'epochs': 208, 'loss': 'mae', 'optimizer': 'adam', 'graph_mode': 'cutoff', 'cutoff': 0.6067289492722734, 'grm_norm': 'gcn', 'self_loops': True}. Best is trial 17 with value: 0.2584227340138163.
[I 2025-10-22 09:29:50,012] Trial 27 finished with value: 0.02708115606801744 and parameters: {'model_type': 'gat', 'hidden_dims': '[512, 64]', 'dropout': 0.21985772710121101, 'batch_norm': False, 'gat_heads': 6, 'gat_attn_dropout': 0.37611877103974095, 'gat_concat_hidden': True, 'lr': 0.0003195655995791942, 'weight_decay': 6.4795961663809e-05, 'epochs': 173, 'loss': 'mse', 'optimizer': 'adam', 'graph_mode': 'knn', 'source': 'grm', 'knn_k': 1, 'weighted_edges': True, 'symmetrize_mode': 'union'}. Best is trial 17 with value: 0.2584227340138163.
[I 2025-10-22 09:31:54,416] Trial 28 finished with value: 0.07755101789123263 and parameters: {'model_type': 'gat', 'hidden_dims': '[128, 64]', 'dropout': 0.14767184879430173, 'batch_norm': False, 'gat_heads': 5, 'gat_attn_dropout': 0.54132801933423, 'gat_concat_hidden': True, 'lr': 0.0007042282673572494, 'weight_decay': 1.4536670189552617e-06, 'epochs': 283, 'loss': 'mae', 'optimizer': 'adam', 'graph_mode': 'cutoff', 'cutoff': 0.6876396406930166, 'grm_norm': 'gcn', 'self_loops': False}. Best is trial 17 with value: 0.2584227340138163.
[I 2025-10-22 09:36:58,465] Trial 29 finished with value: 0.15209717588385724 and parameters: {'model_type': 'gat', 'hidden_dims': '[256, 128]', 'dropout': 0.1966637589196792, 'batch_norm': True, 'gat_heads': 8, 'gat_attn_dropout': 0.24404353867415401, 'gat_concat_hidden': True, 'lr': 4.182157938267207e-05, 'weight_decay': 1.1242775518654942e-05, 'epochs': 229, 'loss': 'mse', 'optimizer': 'adam', 'graph_mode': 'knn', 'source': 'grm', 'knn_k': 4, 'weighted_edges': False, 'symmetrize_mode': 'union'}. Best is trial 17 with value: 0.2584227340138163.
[I 2025-10-22 09:40:48,856] Trial 30 finished with value: 0.22107987951615055 and parameters: {'model_type': 'gat', 'hidden_dims': '[512, 256]', 'dropout': 0.27556738241852197, 'batch_norm': False, 'gat_heads': 4, 'gat_attn_dropout': 0.596679300517606, 'gat_concat_hidden': True, 'lr': 1.8930534923223328e-05, 'weight_decay': 0.00010414989943947905, 'epochs': 177, 'loss': 'mae', 'optimizer': 'adam', 'graph_mode': 'cutoff', 'cutoff': 0.5787728767786348, 'grm_norm': 'gcn', 'self_loops': True}. Best is trial 17 with value: 0.2584227340138163.
[I 2025-10-22 09:46:48,030] Trial 31 finished with value: 0.23703592216836172 and parameters: {'model_type': 'gat', 'hidden_dims': '[512, 64]', 'dropout': 0.2015162495773577, 'batch_norm': False, 'gat_heads': 6, 'gat_attn_dropout': 0.57134177395456, 'gat_concat_hidden': True, 'lr': 0.00020115333087117768, 'weight_decay': 7.42251457032125e-06, 'epochs': 197, 'loss': 'mae', 'optimizer': 'adam', 'graph_mode': 'cutoff', 'cutoff': 0.8985090565820821, 'grm_norm': 'gcn', 'self_loops': True}. Best is trial 17 with value: 0.2584227340138163.
[I 2025-10-22 09:54:27,886] Trial 32 finished with value: 0.2407114101299986 and parameters: {'model_type': 'gat', 'hidden_dims': '[512, 64]', 'dropout': 0.18080729728469935, 'batch_norm': False, 'gat_heads': 7, 'gat_attn_dropout': 0.4695050451123818, 'gat_concat_hidden': True, 'lr': 0.00015136862025801162, 'weight_decay': 4.4827280534964014e-06, 'epochs': 216, 'loss': 'mae', 'optimizer': 'adam', 'graph_mode': 'cutoff', 'cutoff': 0.8196426314505763, 'grm_norm': 'gcn', 'self_loops': True}. Best is trial 17 with value: 0.2584227340138163.
[I 2025-10-22 10:02:13,475] Trial 33 finished with value: 0.22408263441965742 and parameters: {'model_type': 'gat', 'hidden_dims': '[512, 64]', 'dropout': 0.16729803549725586, 'batch_norm': False, 'gat_heads': 7, 'gat_attn_dropout': 0.5163941057991878, 'gat_concat_hidden': True, 'lr': 7.256939589529786e-05, 'weight_decay': 4.150575058624529e-06, 'epochs': 218, 'loss': 'mae', 'optimizer': 'adam', 'graph_mode': 'cutoff', 'cutoff': 0.7763329318115424, 'grm_norm': 'gcn', 'self_loops': True}. Best is trial 17 with value: 0.2584227340138163.
[I 2025-10-22 10:11:18,208] Trial 34 finished with value: 0.22802977543190192 and parameters: {'model_type': 'gat', 'hidden_dims': '[512, 64]', 'dropout': 0.23399855833568298, 'batch_norm': True, 'gat_heads': 7, 'gat_attn_dropout': 0.47087694143043823, 'gat_concat_hidden': True, 'lr': 0.00013014227049383577, 'weight_decay': 1.8404911237542476e-06, 'epochs': 254, 'loss': 'mse', 'optimizer': 'adam', 'graph_mode': 'cutoff', 'cutoff': 0.8171018596870951, 'grm_norm': 'gcn', 'self_loops': True}. Best is trial 17 with value: 0.2584227340138163.
[I 2025-10-22 10:12:22,045] Trial 35 finished with value: 0.2022756567238916 and parameters: {'model_type': 'gat', 'hidden_dims': '[128, 64]', 'dropout': 0.13352554932798916, 'batch_norm': False, 'gat_heads': 5, 'gat_attn_dropout': 0.4526004068605979, 'gat_concat_hidden': True, 'lr': 0.0004632769178348578, 'weight_decay': 1.8273930277453648e-05, 'epochs': 136, 'loss': 'mae', 'optimizer': 'adam', 'graph_mode': 'cutoff', 'cutoff': 0.8195812702823689, 'grm_norm': 'gcn', 'self_loops': False}. Best is trial 17 with value: 0.2584227340138163.
