[I 2025-11-03 12:53:10,820] Trial 19 finished with value: 0.05345833625711974 and parameters: {'model_type': 'gcn', 'hidden_dims': '[512, 128]', 'dropout': 0.520299837989321, 'batch_norm': True, 'lr': 1.352570837276448e-05, 'weight_decay': 5.5269312676552045e-05, 'epochs': 119, 'loss': 'mse', 'optimizer': 'adam', 'graph_mode': 'off', 'use_snp_selection': False}. Best is trial 7 with value: 0.1134701291649533.
[I 2025-11-03 12:53:13,102] Trial 20 finished with value: 0.12083633948363534 and parameters: {'model_type': 'gcn', 'hidden_dims': '[512, 256]', 'dropout': 0.25316953857911023, 'batch_norm': True, 'lr': 0.00037529980299544406, 'weight_decay': 5.783402506345549e-06, 'epochs': 237, 'loss': 'mse', 'optimizer': 'adam', 'graph_mode': 'off', 'use_snp_selection': False}. Best is trial 20 with value: 0.12083633948363534.
[I 2025-11-03 12:53:15,553] Trial 21 finished with value: 0.1104303684339257 and parameters: {'model_type': 'gcn', 'hidden_dims': '[512, 256]', 'dropout': 0.2540528556258962, 'batch_norm': True, 'lr': 0.00036599173777772886, 'weight_decay': 5.754416062856246e-06, 'epochs': 249, 'loss': 'mse', 'optimizer': 'adam', 'graph_mode': 'off', 'use_snp_selection': False}. Best is trial 20 with value: 0.12083633948363534.
[I 2025-11-03 12:53:17,838] Trial 22 finished with value: 0.11740297455781404 and parameters: {'model_type': 'gcn', 'hidden_dims': '[512, 256]', 'dropout': 0.24683341504162934, 'batch_norm': True, 'lr': 0.0003773143973180808, 'weight_decay': 7.66362776954091e-06, 'epochs': 238, 'loss': 'mse', 'optimizer': 'adam', 'graph_mode': 'off', 'use_snp_selection': False}. Best is trial 20 with value: 0.12083633948363534.
[I 2025-11-03 12:53:20,088] Trial 23 finished with value: 0.08985996829316505 and parameters: {'model_type': 'gcn', 'hidden_dims': '[512, 256]', 'dropout': 0.1864882487184501, 'batch_norm': True, 'lr': 0.00011658625616502242, 'weight_decay': 3.8999740731290755e-05, 'epochs': 231, 'loss': 'mse', 'optimizer': 'adam', 'graph_mode': 'off', 'use_snp_selection': False}. Best is trial 20 with value: 0.12083633948363534.
[I 2025-11-03 12:53:22,731] Trial 24 finished with value: 0.10923740660892263 and parameters: {'model_type': 'gcn', 'hidden_dims': '[512, 256]', 'dropout': 0.15780482060551002, 'batch_norm': True, 'lr': 0.0003368051915148214, 'weight_decay': 9.342207618591488e-06, 'epochs': 272, 'loss': 'mse', 'optimizer': 'adam', 'graph_mode': 'off', 'use_snp_selection': False}. Best is trial 20 with value: 0.12083633948363534.
[I 2025-11-03 12:53:24,967] Trial 25 finished with value: 0.045637529172911785 and parameters: {'model_type': 'gcn', 'hidden_dims': '[512, 256]', 'dropout': 0.23760790054091283, 'batch_norm': True, 'lr': 3.354954304681308e-05, 'weight_decay': 1.007773466594241e-06, 'epochs': 225, 'loss': 'mse', 'optimizer': 'adam', 'graph_mode': 'off', 'use_snp_selection': False}. Best is trial 20 with value: 0.12083633948363534.
[I 2025-11-03 12:53:26,131] Trial 26 finished with value: 0.07184910699611786 and parameters: {'model_type': 'gcn', 'hidden_dims': '[512, 256]', 'dropout': 0.15240049198609767, 'batch_norm': False, 'lr': 0.0001874899767065073, 'weight_decay': 9.516657810025634e-05, 'epochs': 295, 'loss': 'mse', 'optimizer': 'adam', 'graph_mode': 'off', 'use_snp_selection': True, 'num_snps': 3842}. Best is trial 20 with value: 0.12083633948363534.
[I 2025-11-03 12:53:28,122] Trial 27 finished with value: 0.10254892322831884 and parameters: {'model_type': 'gcn', 'hidden_dims': '[512, 256]', 'dropout': 0.334707354546351, 'batch_norm': True, 'lr': 0.0004977229149268819, 'weight_decay': 2.0650093875153098e-07, 'epochs': 190, 'loss': 'mse', 'optimizer': 'adam', 'graph_mode': 'off', 'use_snp_selection': False}. Best is trial 20 with value: 0.12083633948363534.
[I 2025-11-03 12:53:30,528] Trial 28 finished with value: 0.112447798030122 and parameters: {'model_type': 'gcn', 'hidden_dims': '[512, 256]', 'dropout': 0.2236026338806106, 'batch_norm': True, 'lr': 0.00010538041813357954, 'weight_decay': 9.239098623381396e-06, 'epochs': 258, 'loss': 'mse', 'optimizer': 'adam', 'graph_mode': 'off', 'use_snp_selection': False}. Best is trial 20 with value: 0.12083633948363534.
[I 2025-11-03 12:53:31,884] Trial 29 finished with value: 0.09988591356876914 and parameters: {'model_type': 'gcn', 'hidden_dims': '[128, 64]', 'dropout': 0.17506263398251654, 'batch_norm': True, 'lr': 0.0004654304212244046, 'weight_decay': 0.00010774073487650334, 'epochs': 215, 'loss': 'mse', 'optimizer': 'adam', 'graph_mode': 'off', 'use_snp_selection': True, 'num_snps': 19468}. Best is trial 20 with value: 0.12083633948363534.
[I 2025-11-03 12:53:33,355] Trial 30 finished with value: 0.08892383653334435 and parameters: {'model_type': 'gcn', 'hidden_dims': '[256, 128, 64]', 'dropout': 0.2892700210123465, 'batch_norm': True, 'lr': 0.0002112315242904584, 'weight_decay': 1.8477400084330255e-06, 'epochs': 174, 'loss': 'mse', 'optimizer': 'adam', 'graph_mode': 'off', 'use_snp_selection': False}. Best is trial 20 with value: 0.12083633948363534.
[I 2025-11-03 12:53:36,423] Trial 31 finished with value: 0.09017140901271495 and parameters: {'model_type': 'gcn', 'hidden_dims': '[512, 256]', 'dropout': 0.21926564044457994, 'batch_norm': True, 'lr': 0.0001094429487743635, 'weight_decay': 8.974280790259746e-06, 'epochs': 348, 'loss': 'mse', 'optimizer': 'adam', 'graph_mode': 'off', 'use_snp_selection': False}. Best is trial 20 with value: 0.12083633948363534.
[I 2025-11-03 12:53:38,112] Trial 32 finished with value: 0.11309083826640724 and parameters: {'model_type': 'gcn', 'hidden_dims': '[256, 128]', 'dropout': 0.22623460501333545, 'batch_norm': True, 'lr': 7.316157698394862e-05, 'weight_decay': 1.8811555384911824e-05, 'epochs': 257, 'loss': 'mse', 'optimizer': 'adam', 'graph_mode': 'off', 'use_snp_selection': False}. Best is trial 20 with value: 0.12083633948363534.
[I 2025-11-03 12:53:39,842] Trial 33 finished with value: 0.08933120080078105 and parameters: {'model_type': 'gcn', 'hidden_dims': '[256, 128]', 'dropout': 0.3613899791583047, 'batch_norm': True, 'lr': 3.4353357427771924e-05, 'weight_decay': 1.9182714595160514e-05, 'epochs': 272, 'loss': 'mse', 'optimizer': 'adam', 'graph_mode': 'off', 'use_snp_selection': False}. Best is trial 20 with value: 0.12083633948363534.
[I 2025-11-03 12:53:41,436] Trial 34 finished with value: 0.07902061629453834 and parameters: {'model_type': 'gcn', 'hidden_dims': '[256, 128]', 'dropout': 0.24794958206660025, 'batch_norm': True, 'lr': 7.256731653875788e-05, 'weight_decay': 3.333901822404754e-05, 'epochs': 241, 'loss': 'mse', 'optimizer': 'adam', 'graph_mode': 'off', 'use_snp_selection': False}. Best is trial 20 with value: 0.12083633948363534.
[I 2025-11-03 12:53:43,255] Trial 35 finished with value: 0.06629153452574633 and parameters: {'model_type': 'gcn', 'hidden_dims': '[256, 128]', 'dropout': 0.13568952040940624, 'batch_norm': False, 'lr': 2.0463570704610496e-05, 'weight_decay': 1.479685008262644e-05, 'epochs': 298, 'loss': 'mse', 'optimizer': 'adam', 'graph_mode': 'off', 'use_snp_selection': False}. Best is trial 20 with value: 0.12083633948363534.
[I 2025-11-03 12:53:45,976] Trial 36 finished with value: 0.059630470908597445 and parameters: {'model_type': 'gcn', 'hidden_dims': '[256, 128]', 'dropout': 0.2734280946342912, 'batch_norm': True, 'lr': 3.931743950978389e-06, 'weight_decay': 6.886876803351276e-05, 'epochs': 260, 'loss': 'mse', 'optimizer': 'adam', 'graph_mode': 'off', 'use_snp_selection': True, 'num_snps': 58661}. Best is trial 20 with value: 0.12083633948363534.
[I 2025-11-03 12:53:47,272] Trial 37 finished with value: 0.06882383306932212 and parameters: {'model_type': 'gcn', 'hidden_dims': '[128, 64]', 'dropout': 0.20254798039039498, 'batch_norm': True, 'lr': 7.449642930106745e-05, 'weight_decay': 0.00022771750477299966, 'epochs': 215, 'loss': 'mse', 'optimizer': 'adam', 'graph_mode': 'off', 'use_snp_selection': False}. Best is trial 20 with value: 0.12083633948363534.
[I 2025-11-03 12:53:49,069] Trial 38 finished with value: 0.11167886082076652 and parameters: {'model_type': 'gcn', 'hidden_dims': '[512, 64]', 'dropout': 0.1682295810969206, 'batch_norm': False, 'lr': 4.642355957045609e-05, 'weight_decay': 6.499948841112052e-06, 'epochs': 290, 'loss': 'mse', 'optimizer': 'adam', 'graph_mode': 'off', 'use_snp_selection': True, 'num_snps': 19911}. Best is trial 20 with value: 0.12083633948363534.
[I 2025-11-03 12:53:51,048] Trial 39 finished with value: 0.12162519084845412 and parameters: {'model_type': 'gcn', 'hidden_dims': '[256, 128]', 'dropout': 0.13115457074402587, 'batch_norm': True, 'lr': 0.0002602688642300185, 'weight_decay': 3.1454796673030104e-05, 'epochs': 324, 'loss': 'mse', 'optimizer': 'adam', 'graph_mode': 'off', 'use_snp_selection': False}. Best is trial 39 with value: 0.12162519084845412.
[I 2025-11-03 12:53:53,934] Trial 40 finished with value: 0.10832497545121823 and parameters: {'model_type': 'gcn', 'hidden_dims': '[512, 256]', 'dropout': 0.1347702124573376, 'batch_norm': True, 'lr': 0.00025626272347533253, 'weight_decay': 3.2882072521516707e-05, 'epochs': 325, 'loss': 'mse', 'optimizer': 'adam', 'graph_mode': 'off', 'use_snp_selection': False}. Best is trial 39 with value: 0.12162519084845412.
[I 2025-11-03 12:53:55,838] Trial 41 finished with value: 0.10538914159824402 and parameters: {'model_type': 'gcn', 'hidden_dims': '[256, 128]', 'dropout': 0.18303903031133284, 'batch_norm': True, 'lr': 0.0005089089593143393, 'weight_decay': 0.00016807320533150004, 'epochs': 313, 'loss': 'mse', 'optimizer': 'adam', 'graph_mode': 'off', 'use_snp_selection': False}. Best is trial 39 with value: 0.12162519084845412.
[I 2025-11-03 12:53:57,244] Trial 42 finished with value: 0.09924681696530777 and parameters: {'model_type': 'gcn', 'hidden_dims': '[256, 128]', 'dropout': 0.23011392401367825, 'batch_norm': True, 'lr': 0.00015055442578184555, 'weight_decay': 0.0005654865083000713, 'epochs': 168, 'loss': 'mse', 'optimizer': 'adam', 'graph_mode': 'off', 'use_snp_selection': False}. Best is trial 39 with value: 0.12162519084845412.
[I 2025-11-03 12:53:59,243] Trial 43 finished with value: 0.10402721616035103 and parameters: {'model_type': 'gcn', 'hidden_dims': '[256, 128]', 'dropout': 0.11458446291837418, 'batch_norm': True, 'lr': 0.0002857076530240369, 'weight_decay': 2.566127311721628e-05, 'epochs': 335, 'loss': 'mse', 'optimizer': 'adam', 'graph_mode': 'off', 'use_snp_selection': False}. Best is trial 39 with value: 0.12162519084845412.
[I 2025-11-03 12:54:00,856] Trial 44 finished with value: 0.09831487281589085 and parameters: {'model_type': 'gcn', 'hidden_dims': '[256, 128]', 'dropout': 0.12599236508566952, 'batch_norm': True, 'lr': 8.380557455945833e-05, 'weight_decay': 1.4194408847465386e-05, 'epochs': 235, 'loss': 'mse', 'optimizer': 'adam', 'graph_mode': 'off', 'use_snp_selection': False}. Best is trial 39 with value: 0.12162519084845412.
[I 2025-11-03 12:54:02,807] Trial 45 finished with value: 0.10376124912134399 and parameters: {'model_type': 'gcn', 'hidden_dims': '[256, 128, 64]', 'dropout': 0.2867234420995289, 'batch_norm': True, 'lr': 0.0006932482846947018, 'weight_decay': 2.4056330499721463e-06, 'epochs': 262, 'loss': 'mse', 'optimizer': 'adam', 'graph_mode': 'off', 'use_snp_selection': False}. Best is trial 39 with value: 0.12162519084845412.
[I 2025-11-03 12:54:04,103] Trial 46 finished with value: 0.06326800951590243 and parameters: {'model_type': 'gcn', 'hidden_dims': '[256, 128]', 'dropout': 0.4197311708046557, 'batch_norm': False, 'lr': 4.779801877876163e-05, 'weight_decay': 6.75380820913455e-06, 'epochs': 157, 'loss': 'mse', 'optimizer': 'adam', 'graph_mode': 'off', 'use_snp_selection': False}. Best is trial 39 with value: 0.12162519084845412.
[I 2025-11-03 12:54:06,134] Trial 47 finished with value: 0.1064913123074664 and parameters: {'model_type': 'gcn', 'hidden_dims': '[512, 64]', 'dropout': 0.2665995103742908, 'batch_norm': True, 'lr': 0.00017480022675546656, 'weight_decay': 1.0451859217288149e-07, 'epochs': 194, 'loss': 'mae', 'optimizer': 'adam', 'graph_mode': 'off', 'use_snp_selection': False}. Best is trial 39 with value: 0.12162519084845412.
[I 2025-11-03 12:54:08,339] Trial 48 finished with value: 0.11132498694526463 and parameters: {'model_type': 'gcn', 'hidden_dims': '[512, 256]', 'dropout': 0.1887169389036746, 'batch_norm': True, 'lr': 0.00038131544737185757, 'weight_decay': 8.722393844293176e-07, 'epochs': 210, 'loss': 'mse', 'optimizer': 'adam', 'graph_mode': 'off', 'use_snp_selection': False}. Best is trial 39 with value: 0.12162519084845412.
[I 2025-11-03 12:54:10,398] Trial 49 finished with value: 0.09689737297882531 and parameters: {'model_type': 'gcn', 'hidden_dims': '[128, 64]', 'dropout': 0.36167318450128966, 'batch_norm': True, 'lr': 0.0005494084647854611, 'weight_decay': 2.3218009173855445e-05, 'epochs': 286, 'loss': 'mae', 'optimizer': 'adam', 'graph_mode': 'off', 'use_snp_selection': True, 'num_snps': 46888}. Best is trial 39 with value: 0.12162519084845412.
[I 2025-11-03 12:54:11,982] Trial 50 finished with value: 0.09688185587078109 and parameters: {'model_type': 'gcn', 'hidden_dims': '[512, 256]', 'dropout': 0.15450171717933625, 'batch_norm': True, 'lr': 0.000251136920638015, 'weight_decay': 1.2891305020216796e-05, 'epochs': 132, 'loss': 'mse', 'optimizer': 'adam', 'graph_mode': 'off', 'use_snp_selection': False}. Best is trial 39 with value: 0.12162519084845412.
[I 2025-11-03 12:54:14,398] Trial 51 finished with value: 0.11109571220260475 and parameters: {'model_type': 'gcn', 'hidden_dims': '[512, 256]', 'dropout': 0.2206943452742331, 'batch_norm': True, 'lr': 0.00010072619600397444, 'weight_decay': 7.836397804351335e-06, 'epochs': 253, 'loss': 'mse', 'optimizer': 'adam', 'graph_mode': 'off', 'use_snp_selection': False}. Best is trial 39 with value: 0.12162519084845412.
[I 2025-11-03 12:54:17,119] Trial 52 finished with value: 0.07397034139883114 and parameters: {'model_type': 'gcn', 'hidden_dims': '[512, 256]', 'dropout': 0.21447745353301895, 'batch_norm': True, 'lr': 5.250489131115816e-05, 'weight_decay': 4.781305697211309e-06, 'epochs': 304, 'loss': 'mse', 'optimizer': 'adam', 'graph_mode': 'off', 'use_snp_selection': False}. Best is trial 39 with value: 0.12162519084845412.
[I 2025-11-03 12:54:18,233] Trial 53 finished with value: 0.09455034956341223 and parameters: {'model_type': 'gcn', 'hidden_dims': '[512, 256]', 'dropout': 0.2434011388042065, 'batch_norm': True, 'lr': 0.00013375604063424907, 'weight_decay': 4.763772695340701e-05, 'epochs': 41, 'loss': 'mse', 'optimizer': 'adam', 'graph_mode': 'off', 'use_snp_selection': False}. Best is trial 39 with value: 0.12162519084845412.
[I 2025-11-03 12:54:20,450] Trial 54 finished with value: 0.09653822793807355 and parameters: {'model_type': 'gcn', 'hidden_dims': '[512, 256]', 'dropout': 0.5554305273428004, 'batch_norm': True, 'lr': 9.969121454771943e-05, 'weight_decay': 3.557701513863864e-06, 'epochs': 223, 'loss': 'mse', 'optimizer': 'adam', 'graph_mode': 'off', 'use_snp_selection': False}. Best is trial 39 with value: 0.12162519084845412.
[I 2025-11-03 12:54:22,802] Trial 55 finished with value: 0.06607839850039064 and parameters: {'model_type': 'gcn', 'hidden_dims': '[512, 64]', 'dropout': 0.3010724061925984, 'batch_norm': True, 'lr': 2.4814204734460637e-05, 'weight_decay': 1.1427895018104246e-05, 'epochs': 245, 'loss': 'mse', 'optimizer': 'adam', 'graph_mode': 'off', 'use_snp_selection': False}. Best is trial 39 with value: 0.12162519084845412.
[I 2025-11-03 12:54:23,835] Trial 56 finished with value: 0.09114537931058184 and parameters: {'model_type': 'gcn', 'hidden_dims': '[256, 128, 64]', 'dropout': 0.17000180209866878, 'batch_norm': True, 'lr': 0.00021378898284082922, 'weight_decay': 3.3946345169696245e-07, 'epochs': 85, 'loss': 'mse', 'optimizer': 'adam', 'graph_mode': 'off', 'use_snp_selection': False}. Best is trial 39 with value: 0.12162519084845412.
[I 2025-11-03 12:54:26,411] Trial 57 finished with value: 0.08575573937631523 and parameters: {'model_type': 'gcn', 'hidden_dims': '[512, 256]', 'dropout': 0.20018051738048984, 'batch_norm': False, 'lr': 5.9984832102124096e-05, 'weight_decay': 1.486712869254651e-06, 'epochs': 283, 'loss': 'mae', 'optimizer': 'adam', 'graph_mode': 'off', 'use_snp_selection': False}. Best is trial 39 with value: 0.12162519084845412.
[I 2025-11-03 12:54:28,890] Trial 58 finished with value: 0.12489917561762844 and parameters: {'model_type': 'gcn', 'hidden_dims': '[512, 128]', 'dropout': 0.12138194032107816, 'batch_norm': True, 'lr': 0.00037929702975892857, 'weight_decay': 2.1129404400731706e-05, 'epochs': 261, 'loss': 'mse', 'optimizer': 'adam', 'graph_mode': 'off', 'use_snp_selection': False}. Best is trial 58 with value: 0.12489917561762844.
[I 2025-11-03 12:54:31,371] Trial 59 finished with value: 0.10680079906635011 and parameters: {'model_type': 'gcn', 'hidden_dims': '[512, 128]', 'dropout': 0.11468421399707694, 'batch_norm': True, 'lr': 0.0003907171479278641, 'weight_decay': 7.575545755570967e-05, 'epochs': 269, 'loss': 'mse', 'optimizer': 'adam', 'graph_mode': 'off', 'use_snp_selection': False}. Best is trial 58 with value: 0.12489917561762844.
[I 2025-11-03 12:54:33,341] Trial 60 finished with value: 0.10422421323266368 and parameters: {'model_type': 'gcn', 'hidden_dims': '[512, 128]', 'dropout': 0.1337576883540848, 'batch_norm': True, 'lr': 0.0007782734948550143, 'weight_decay': 2.170924656030518e-05, 'epochs': 186, 'loss': 'mse', 'optimizer': 'adam', 'graph_mode': 'off', 'use_snp_selection': False}. Best is trial 58 with value: 0.12489917561762844.
[I 2025-11-03 12:54:35,905] Trial 61 finished with value: 0.11179575734332091 and parameters: {'model_type': 'gcn', 'hidden_dims': '[512, 128]', 'dropout': 0.15845572976096628, 'batch_norm': True, 'lr': 0.00030551998852815286, 'weight_decay': 2.7076508476882947e-05, 'epochs': 262, 'loss': 'mse', 'optimizer': 'adam', 'graph_mode': 'off', 'use_snp_selection': False}. Best is trial 58 with value: 0.12489917561762844.
[I 2025-11-03 12:54:38,277] Trial 62 finished with value: 0.10861157449961806 and parameters: {'model_type': 'gcn', 'hidden_dims': '[512, 128]', 'dropout': 0.10411492674585204, 'batch_norm': True, 'lr': 0.0001453158818052554, 'weight_decay': 1.7024993695752258e-05, 'epochs': 252, 'loss': 'mse', 'optimizer': 'adam', 'graph_mode': 'off', 'use_snp_selection': False}. Best is trial 58 with value: 0.12489917561762844.
[I 2025-11-03 12:54:40,564] Trial 63 finished with value: 0.12067352998504394 and parameters: {'model_type': 'gcn', 'hidden_dims': '[512, 256]', 'dropout': 0.26303272157613156, 'batch_norm': True, 'lr': 0.00040961031529320146, 'weight_decay': 1.0354029432988371e-05, 'epochs': 235, 'loss': 'mse', 'optimizer': 'adam', 'graph_mode': 'off', 'use_snp_selection': False}. Best is trial 58 with value: 0.12489917561762844.
[I 2025-11-03 12:54:42,133] Trial 64 finished with value: 0.11342128879021615 and parameters: {'model_type': 'gcn', 'hidden_dims': '[256, 128]', 'dropout': 0.28719099460041037, 'batch_norm': True, 'lr': 0.0005995946683877636, 'weight_decay': 4.5473950023016055e-05, 'epochs': 228, 'loss': 'mse', 'optimizer': 'adam', 'graph_mode': 'off', 'use_snp_selection': False}. Best is trial 58 with value: 0.12489917561762844.
[I 2025-11-03 12:54:44,250] Trial 65 finished with value: 0.11082604051199894 and parameters: {'model_type': 'gcn', 'hidden_dims': '[512, 256]', 'dropout': 0.33390897653352364, 'batch_norm': True, 'lr': 0.0005783051319796091, 'weight_decay': 2.5602075151305146e-06, 'epochs': 206, 'loss': 'mse', 'optimizer': 'adam', 'graph_mode': 'off', 'use_snp_selection': False}. Best is trial 58 with value: 0.12489917561762844.
[I 2025-11-03 12:54:45,978] Trial 66 finished with value: 0.11203379152323 and parameters: {'model_type': 'gcn', 'hidden_dims': '[512, 128]', 'dropout': 0.28974451182736144, 'batch_norm': True, 'lr': 0.0004130909021980889, 'weight_decay': 4.2729456352797426e-05, 'epochs': 225, 'loss': 'mse', 'optimizer': 'adam', 'graph_mode': 'off', 'use_snp_selection': True, 'num_snps': 22881}. Best is trial 58 with value: 0.12489917561762844.
[I 2025-11-03 12:54:48,295] Trial 67 finished with value: 0.026202827171375603 and parameters: {'model_type': 'gcn', 'hidden_dims': '[512, 256]', 'dropout': 0.2613678301632569, 'batch_norm': True, 'lr': 1.0387880921401811e-06, 'weight_decay': 6.62409700007719e-05, 'epochs': 237, 'loss': 'mae', 'optimizer': 'adam', 'graph_mode': 'off', 'use_snp_selection': False}. Best is trial 58 with value: 0.12489917561762844.
[I 2025-11-03 12:54:49,712] Trial 68 finished with value: 0.11274882522661972 and parameters: {'model_type': 'gcn', 'hidden_dims': '[256, 128]', 'dropout': 0.31275037907913195, 'batch_norm': True, 'lr': 0.0007979955817771018, 'weight_decay': 0.00011378294176111693, 'epochs': 184, 'loss': 'mse', 'optimizer': 'adam', 'graph_mode': 'off', 'use_snp_selection': False}. Best is trial 58 with value: 0.12489917561762844.
[I 2025-11-03 12:54:50,833] Trial 69 finished with value: -0.0014739861878862483 and parameters: {'model_type': 'gcn', 'hidden_dims': '[512, 256]', 'dropout': 0.39194318482199175, 'batch_norm': False, 'lr': 0.0009384603279853671, 'weight_decay': 5.395519207215827e-06, 'epochs': 56, 'loss': 'mse', 'optimizer': 'adam', 'graph_mode': 'off', 'use_snp_selection': False}. Best is trial 58 with value: 0.12489917561762844.
[I 2025-11-03 12:54:51,984] Trial 70 finished with value: 0.10881549492356796 and parameters: {'model_type': 'gcn', 'hidden_dims': '[128, 64]', 'dropout': 0.251554455915566, 'batch_norm': True, 'lr': 0.00033381344771468344, 'weight_decay': 1.100000945219484e-05, 'epochs': 220, 'loss': 'mse', 'optimizer': 'adam', 'graph_mode': 'off', 'use_snp_selection': False}. Best is trial 58 with value: 0.12489917561762844.
