[I 2025-11-03 14:24:35,761] Trial 71 finished with value: 0.11564364763022754 and parameters: {'model_type': 'gcn', 'hidden_dims': '[256, 128]', 'dropout': 0.4547427282384404, 'batch_norm': True, 'lr': 0.0008289036829171015, 'weight_decay': 9.902339654326237e-06, 'epochs': 130, 'loss': 'mse', 'optimizer': 'adam', 'graph_mode': 'knn', 'source': 'grm', 'knn_k': 1, 'weighted_edges': True, 'symmetrize_mode': 'union', 'use_snp_selection': False}. Best is trial 49 with value: 0.14342353120882104.
[I 2025-11-03 14:24:37,453] Trial 72 finished with value: 0.12447385914074752 and parameters: {'model_type': 'gcn', 'hidden_dims': '[256, 128]', 'dropout': 0.42093084029580463, 'batch_norm': True, 'lr': 0.0004748154720569941, 'weight_decay': 8.611361379856362e-06, 'epochs': 140, 'loss': 'mse', 'optimizer': 'adam', 'graph_mode': 'knn', 'source': 'grm', 'knn_k': 1, 'weighted_edges': True, 'symmetrize_mode': 'union', 'use_snp_selection': False}. Best is trial 49 with value: 0.14342353120882104.
[I 2025-11-03 14:24:39,020] Trial 73 finished with value: 0.132792702417481 and parameters: {'model_type': 'gcn', 'hidden_dims': '[256, 128]', 'dropout': 0.4645732164119318, 'batch_norm': True, 'lr': 0.0009873557295058616, 'weight_decay': 1.284620847962341e-05, 'epochs': 112, 'loss': 'mse', 'optimizer': 'adam', 'graph_mode': 'knn', 'source': 'grm', 'knn_k': 1, 'weighted_edges': True, 'symmetrize_mode': 'union', 'use_snp_selection': False}. Best is trial 49 with value: 0.14342353120882104.
[I 2025-11-03 14:24:40,591] Trial 74 finished with value: 0.11422943305380234 and parameters: {'model_type': 'gcn', 'hidden_dims': '[256, 128]', 'dropout': 0.47048614993117543, 'batch_norm': True, 'lr': 0.0006098395345160894, 'weight_decay': 5.2517158985600617e-05, 'epochs': 112, 'loss': 'mse', 'optimizer': 'adam', 'graph_mode': 'knn', 'source': 'grm', 'knn_k': 2, 'weighted_edges': True, 'symmetrize_mode': 'union', 'use_snp_selection': False}. Best is trial 49 with value: 0.14342353120882104.
[I 2025-11-03 14:24:42,215] Trial 75 finished with value: 0.12204645871091377 and parameters: {'model_type': 'gcn', 'hidden_dims': '[256, 128, 64]', 'dropout': 0.3599855137339034, 'batch_norm': True, 'lr': 0.0003501944072778982, 'weight_decay': 1.3273672992539883e-05, 'epochs': 101, 'loss': 'mse', 'optimizer': 'adam', 'graph_mode': 'knn', 'source': 'grm', 'knn_k': 1, 'weighted_edges': True, 'symmetrize_mode': 'union', 'use_snp_selection': False}. Best is trial 49 with value: 0.14342353120882104.
[I 2025-11-03 14:24:43,682] Trial 76 finished with value: 0.10570761402216791 and parameters: {'model_type': 'gcn', 'hidden_dims': '[256, 128]', 'dropout': 0.4983493130640589, 'batch_norm': True, 'lr': 0.0007873910517193877, 'weight_decay': 5.1480812388990186e-06, 'epochs': 89, 'loss': 'mse', 'optimizer': 'adam', 'graph_mode': 'knn', 'source': 'grm', 'knn_k': 2, 'weighted_edges': True, 'symmetrize_mode': 'union', 'use_snp_selection': False}. Best is trial 49 with value: 0.14342353120882104.
[I 2025-11-03 14:24:45,025] Trial 77 finished with value: 0.09027982226543697 and parameters: {'model_type': 'gcn', 'hidden_dims': '[256, 128]', 'dropout': 0.521570160928122, 'batch_norm': True, 'lr': 0.00047081920151922945, 'weight_decay': 1.4956075791528646e-07, 'epochs': 63, 'loss': 'mse', 'optimizer': 'adam', 'graph_mode': 'knn', 'source': 'grm', 'knn_k': 1, 'weighted_edges': False, 'symmetrize_mode': 'union', 'use_snp_selection': False}. Best is trial 49 with value: 0.14342353120882104.
[I 2025-11-03 14:24:47,597] Trial 78 finished with value: 0.09815612342473781 and parameters: {'model_type': 'gcn', 'hidden_dims': '[512, 64]', 'dropout': 0.5539654871427189, 'batch_norm': True, 'lr': 0.0008029826399487636, 'weight_decay': 2.1918142505836097e-06, 'epochs': 187, 'loss': 'mse', 'optimizer': 'adam', 'graph_mode': 'knn', 'source': 'grm', 'knn_k': 3, 'weighted_edges': True, 'symmetrize_mode': 'union', 'use_snp_selection': False}. Best is trial 49 with value: 0.14342353120882104.
[I 2025-11-03 14:24:48,822] Trial 79 finished with value: 0.09092998630750787 and parameters: {'model_type': 'gcn', 'hidden_dims': '[256, 128]', 'dropout': 0.4370074581705563, 'batch_norm': False, 'lr': 0.0006375398436793254, 'weight_decay': 1.619803734303371e-05, 'epochs': 47, 'loss': 'mse', 'optimizer': 'adam', 'graph_mode': 'knn', 'source': 'grm', 'knn_k': 1, 'weighted_edges': True, 'symmetrize_mode': 'union', 'use_snp_selection': True, 'num_snps': 3682}. Best is trial 49 with value: 0.14342353120882104.
[I 2025-11-03 14:24:50,060] Trial 80 finished with value: 0.112240636884203 and parameters: {'model_type': 'gcn', 'hidden_dims': '[128, 64]', 'dropout': 0.4840564064626268, 'batch_norm': True, 'lr': 0.0005492007299844057, 'weight_decay': 7.916559676205478e-06, 'epochs': 72, 'loss': 'mse', 'optimizer': 'adam', 'graph_mode': 'knn', 'source': 'grm', 'knn_k': 1, 'weighted_edges': True, 'symmetrize_mode': 'union', 'use_snp_selection': False}. Best is trial 49 with value: 0.14342353120882104.
[I 2025-11-03 14:24:51,726] Trial 81 finished with value: 0.11883348456269023 and parameters: {'model_type': 'gcn', 'hidden_dims': '[256, 128]', 'dropout': 0.45735953184378236, 'batch_norm': True, 'lr': 0.0009529949229333063, 'weight_decay': 2.3018965839795334e-05, 'epochs': 131, 'loss': 'mse', 'optimizer': 'adam', 'graph_mode': 'knn', 'source': 'grm', 'knn_k': 1, 'weighted_edges': True, 'symmetrize_mode': 'union', 'use_snp_selection': False}. Best is trial 49 with value: 0.14342353120882104.
[I 2025-11-03 14:24:53,322] Trial 82 finished with value: 0.10062561961332783 and parameters: {'model_type': 'gcn', 'hidden_dims': '[256, 128]', 'dropout': 0.44693797869513663, 'batch_norm': True, 'lr': 0.0009149655675587013, 'weight_decay': 1.1496213312280274e-05, 'epochs': 116, 'loss': 'mse', 'optimizer': 'adam', 'graph_mode': 'knn', 'source': 'grm', 'knn_k': 2, 'weighted_edges': True, 'symmetrize_mode': 'union', 'use_snp_selection': False}. Best is trial 49 with value: 0.14342353120882104.
[I 2025-11-03 14:24:55,059] Trial 83 finished with value: 0.1101107879417562 and parameters: {'model_type': 'gcn', 'hidden_dims': '[256, 128]', 'dropout': 0.4207225205395213, 'batch_norm': True, 'lr': 0.0007258103948119228, 'weight_decay': 2.9899090510208246e-06, 'epochs': 148, 'loss': 'mse', 'optimizer': 'adam', 'graph_mode': 'knn', 'source': 'grm', 'knn_k': 2, 'weighted_edges': True, 'symmetrize_mode': 'union', 'use_snp_selection': False}. Best is trial 49 with value: 0.14342353120882104.
[I 2025-11-03 14:24:57,009] Trial 84 finished with value: 0.12336876401310588 and parameters: {'model_type': 'gcn', 'hidden_dims': '[256, 128]', 'dropout': 0.3656369288214119, 'batch_norm': True, 'lr': 0.0004107283852817064, 'weight_decay': 5.23730656053125e-06, 'epochs': 196, 'loss': 'mse', 'optimizer': 'adam', 'graph_mode': 'knn', 'source': 'grm', 'knn_k': 1, 'weighted_edges': True, 'symmetrize_mode': 'union', 'use_snp_selection': False}. Best is trial 49 with value: 0.14342353120882104.
[I 2025-11-03 14:24:58,801] Trial 85 finished with value: 0.1293512003547099 and parameters: {'model_type': 'gcn', 'hidden_dims': '[256, 128]', 'dropout': 0.4666084321944886, 'batch_norm': True, 'lr': 0.0009556947384017993, 'weight_decay': 7.392189700622585e-06, 'epochs': 161, 'loss': 'mse', 'optimizer': 'adam', 'graph_mode': 'knn', 'source': 'grm', 'knn_k': 1, 'weighted_edges': True, 'symmetrize_mode': 'union', 'use_snp_selection': False}. Best is trial 49 with value: 0.14342353120882104.
[I 2025-11-03 14:24:59,809] Trial 86 finished with value: 0.10720939340978614 and parameters: {'model_type': 'gcn', 'hidden_dims': '[128, 64]', 'dropout': 0.3928616390512922, 'batch_norm': True, 'lr': 0.0006328953632534005, 'weight_decay': 1.058823579171305e-05, 'epochs': 22, 'loss': 'mse', 'optimizer': 'adam', 'graph_mode': 'cutoff', 'cutoff': 0.5571830703099423, 'grm_norm': 'cosine_then_gcn', 'self_loops': True, 'use_snp_selection': False}. Best is trial 49 with value: 0.14342353120882104.
[I 2025-11-03 14:25:01,700] Trial 87 finished with value: 0.08936213414320436 and parameters: {'model_type': 'gcn', 'hidden_dims': '[256, 128]', 'dropout': 0.5065813308533768, 'batch_norm': True, 'lr': 0.0003485696920008627, 'weight_decay': 1.7655339494956588e-05, 'epochs': 173, 'loss': 'mse', 'optimizer': 'adam', 'graph_mode': 'knn', 'source': 'grm', 'knn_k': 1, 'weighted_edges': False, 'symmetrize_mode': 'union', 'use_snp_selection': False}. Best is trial 49 with value: 0.14342353120882104.
[I 2025-11-03 14:25:03,501] Trial 88 finished with value: 0.10699491032525965 and parameters: {'model_type': 'gcn', 'hidden_dims': '[256, 128, 64]', 'dropout': 0.49044089921111833, 'batch_norm': True, 'lr': 0.0009893223179278778, 'weight_decay': 3.3977155767096407e-06, 'epochs': 132, 'loss': 'mse', 'optimizer': 'adam', 'graph_mode': 'knn', 'source': 'grm', 'knn_k': 2, 'weighted_edges': True, 'symmetrize_mode': 'union', 'use_snp_selection': False}. Best is trial 49 with value: 0.14342353120882104.
[I 2025-11-03 14:25:05,058] Trial 89 finished with value: 0.07332459288892351 and parameters: {'model_type': 'gcn', 'hidden_dims': '[256, 128]', 'dropout': 0.3248996420589123, 'batch_norm': True, 'lr': 0.000238388646216693, 'weight_decay': 5.228484727402923e-07, 'epochs': 105, 'loss': 'mse', 'optimizer': 'adam', 'graph_mode': 'knn', 'source': 'grm', 'knn_k': 6, 'weighted_edges': True, 'symmetrize_mode': 'union', 'use_snp_selection': False}. Best is trial 49 with value: 0.14342353120882104.
[I 2025-11-03 14:25:06,728] Trial 90 finished with value: 0.05706121073527174 and parameters: {'model_type': 'gcn', 'hidden_dims': '[128, 64]', 'dropout': 0.44280787512804504, 'batch_norm': True, 'lr': 0.0005239065803039788, 'weight_decay': 2.926971047989083e-05, 'epochs': 209, 'loss': 'mse', 'optimizer': 'adam', 'graph_mode': 'knn', 'source': 'grm', 'knn_k': 10, 'weighted_edges': True, 'symmetrize_mode': 'union', 'use_snp_selection': False}. Best is trial 49 with value: 0.14342353120882104.
[I 2025-11-03 14:25:08,530] Trial 91 finished with value: 0.13490883719673452 and parameters: {'model_type': 'gcn', 'hidden_dims': '[256, 128]', 'dropout': 0.4595659764335082, 'batch_norm': True, 'lr': 0.0009783206300413051, 'weight_decay': 8.14702327334894e-06, 'epochs': 163, 'loss': 'mse', 'optimizer': 'adam', 'graph_mode': 'knn', 'source': 'grm', 'knn_k': 1, 'weighted_edges': True, 'symmetrize_mode': 'union', 'use_snp_selection': False}. Best is trial 49 with value: 0.14342353120882104.
[I 2025-11-03 14:25:10,299] Trial 92 finished with value: 0.14016095292638453 and parameters: {'model_type': 'gcn', 'hidden_dims': '[256, 128]', 'dropout': 0.45532354540212167, 'batch_norm': True, 'lr': 0.0007731120534742221, 'weight_decay': 6.652091982324495e-06, 'epochs': 155, 'loss': 'mse', 'optimizer': 'adam', 'graph_mode': 'knn', 'source': 'grm', 'knn_k': 1, 'weighted_edges': True, 'symmetrize_mode': 'union', 'use_snp_selection': False}. Best is trial 49 with value: 0.14342353120882104.
[I 2025-11-03 14:25:12,061] Trial 93 finished with value: 0.13053327315125388 and parameters: {'model_type': 'gcn', 'hidden_dims': '[256, 128]', 'dropout': 0.46086262688874335, 'batch_norm': True, 'lr': 0.0008086433580453755, 'weight_decay': 4.461360948701371e-06, 'epochs': 154, 'loss': 'mse', 'optimizer': 'adam', 'graph_mode': 'knn', 'source': 'grm', 'knn_k': 1, 'weighted_edges': True, 'symmetrize_mode': 'union', 'use_snp_selection': False}. Best is trial 49 with value: 0.14342353120882104.
[I 2025-11-03 14:25:13,950] Trial 94 finished with value: 0.13499814979269234 and parameters: {'model_type': 'gcn', 'hidden_dims': '[256, 128]', 'dropout': 0.47921292908721225, 'batch_norm': True, 'lr': 0.0006556591624282689, 'weight_decay': 5.964092237362417e-06, 'epochs': 181, 'loss': 'mse', 'optimizer': 'adam', 'graph_mode': 'knn', 'source': 'grm', 'knn_k': 1, 'weighted_edges': True, 'symmetrize_mode': 'union', 'use_snp_selection': False}. Best is trial 49 with value: 0.14342353120882104.
[I 2025-11-03 14:25:16,020] Trial 95 finished with value: 0.11470591522365822 and parameters: {'model_type': 'gcn', 'hidden_dims': '[256, 128]', 'dropout': 0.5721940130551803, 'batch_norm': True, 'lr': 0.0006686796303187575, 'weight_decay': 5.78380664251965e-06, 'epochs': 221, 'loss': 'mse', 'optimizer': 'adam', 'graph_mode': 'knn', 'source': 'grm', 'knn_k': 1, 'weighted_edges': True, 'symmetrize_mode': 'union', 'use_snp_selection': False}. Best is trial 49 with value: 0.14342353120882104.
[I 2025-11-03 14:25:19,572] Trial 96 finished with value: -0.01610467529048037 and parameters: {'model_type': 'gcn', 'hidden_dims': '[512, 64]', 'dropout': 0.4746294698518143, 'batch_norm': False, 'lr': 0.0007391738128295857, 'weight_decay': 2.114590423653383e-06, 'epochs': 163, 'loss': 'mse', 'optimizer': 'adam', 'graph_mode': 'knn', 'source': 'grm', 'knn_k': 2, 'weighted_edges': True, 'symmetrize_mode': 'union', 'use_snp_selection': True, 'num_snps': 49724}. Best is trial 49 with value: 0.14342353120882104.
[I 2025-11-03 14:25:21,519] Trial 97 finished with value: 0.12092411332531171 and parameters: {'model_type': 'gcn', 'hidden_dims': '[256, 128]', 'dropout': 0.5256899663901836, 'batch_norm': True, 'lr': 0.000574749201079559, 'weight_decay': 6.681082508171282e-06, 'epochs': 182, 'loss': 'mse', 'optimizer': 'adam', 'graph_mode': 'knn', 'source': 'grm', 'knn_k': 1, 'weighted_edges': True, 'symmetrize_mode': 'mutual', 'use_snp_selection': False}. Best is trial 49 with value: 0.14342353120882104.
[I 2025-11-03 14:25:23,011] Trial 98 finished with value: 0.09024938799426896 and parameters: {'model_type': 'gcn', 'hidden_dims': '[128, 64]', 'dropout': 0.4948958001375746, 'batch_norm': True, 'lr': 0.0008355675149842626, 'weight_decay': 1.3451795975634734e-05, 'epochs': 172, 'loss': 'mse', 'optimizer': 'adam', 'graph_mode': 'cutoff', 'cutoff': 0.4505412639275435, 'grm_norm': 'cosine_then_gcn', 'self_loops': False, 'use_snp_selection': False}. Best is trial 49 with value: 0.14342353120882104.
[I 2025-11-03 14:25:24,955] Trial 99 finished with value: 0.13625418007350476 and parameters: {'model_type': 'gcn', 'hidden_dims': '[256, 128]', 'dropout': 0.4777277982297, 'batch_norm': True, 'lr': 0.0004332871646902806, 'weight_decay': 3.575152260975151e-06, 'epochs': 192, 'loss': 'mse', 'optimizer': 'adam', 'graph_mode': 'knn', 'source': 'grm', 'knn_k': 1, 'weighted_edges': True, 'symmetrize_mode': 'union', 'use_snp_selection': False}. Best is trial 49 with value: 0.14342353120882104.
[I 2025-11-03 14:25:26,911] Trial 100 finished with value: 0.115519849813744 and parameters: {'model_type': 'gcn', 'hidden_dims': '[256, 128]', 'dropout': 0.5450632941389238, 'batch_norm': True, 'lr': 0.0004204407320619278, 'weight_decay': 3.3154943151375345e-06, 'epochs': 193, 'loss': 'mse', 'optimizer': 'adam', 'graph_mode': 'knn', 'source': 'grm', 'knn_k': 4, 'weighted_edges': True, 'symmetrize_mode': 'union', 'use_snp_selection': False}. Best is trial 49 with value: 0.14342353120882104.
[I 2025-11-03 14:25:28,803] Trial 101 finished with value: 0.11793818909219483 and parameters: {'model_type': 'gcn', 'hidden_dims': '[256, 128]', 'dropout': 0.5097382538375999, 'batch_norm': True, 'lr': 0.0005581489676388204, 'weight_decay': 1.3013278113493146e-06, 'epochs': 183, 'loss': 'mse', 'optimizer': 'adam', 'graph_mode': 'knn', 'source': 'grm', 'knn_k': 1, 'weighted_edges': True, 'symmetrize_mode': 'union', 'use_snp_selection': False}. Best is trial 49 with value: 0.14342353120882104.
[I 2025-11-03 14:25:30,516] Trial 102 finished with value: 0.11428516489693721 and parameters: {'model_type': 'gcn', 'hidden_dims': '[256, 128]', 'dropout': 0.48061744040471005, 'batch_norm': True, 'lr': 0.00030758916838839046, 'weight_decay': 8.74452901312652e-06, 'epochs': 144, 'loss': 'mse', 'optimizer': 'adam', 'graph_mode': 'knn', 'source': 'grm', 'knn_k': 1, 'weighted_edges': True, 'symmetrize_mode': 'union', 'use_snp_selection': False}. Best is trial 49 with value: 0.14342353120882104.
[I 2025-11-03 14:25:32,337] Trial 103 finished with value: 0.10304975887323785 and parameters: {'model_type': 'gcn', 'hidden_dims': '[256, 128]', 'dropout': 0.4621071531344129, 'batch_norm': True, 'lr': 0.0006609546958143864, 'weight_decay': 5.023390917863593e-06, 'epochs': 166, 'loss': 'mse', 'optimizer': 'adam', 'graph_mode': 'knn', 'source': 'grm', 'knn_k': 2, 'weighted_edges': True, 'symmetrize_mode': 'union', 'use_snp_selection': False}. Best is trial 49 with value: 0.14342353120882104.
[I 2025-11-03 14:25:34,360] Trial 104 finished with value: 0.11716638777835423 and parameters: {'model_type': 'gcn', 'hidden_dims': '[256, 128]', 'dropout': 0.4315005097206259, 'batch_norm': True, 'lr': 0.00043760614528779866, 'weight_decay': 7.069618812609607e-06, 'epochs': 204, 'loss': 'mse', 'optimizer': 'adam', 'graph_mode': 'knn', 'source': 'grm', 'knn_k': 9, 'weighted_edges': True, 'symmetrize_mode': 'union', 'use_snp_selection': False}. Best is trial 49 with value: 0.14342353120882104.
[I 2025-11-03 14:25:36,115] Trial 105 finished with value: 0.09672875772633159 and parameters: {'model_type': 'gcn', 'hidden_dims': '[256, 128]', 'dropout': 0.4903426087345979, 'batch_norm': True, 'lr': 0.0008508258208269673, 'weight_decay': 2.040525778633742e-05, 'epochs': 152, 'loss': 'mse', 'optimizer': 'adam', 'graph_mode': 'knn', 'source': 'grm', 'knn_k': 1, 'weighted_edges': False, 'symmetrize_mode': 'union', 'use_snp_selection': False}. Best is trial 49 with value: 0.14342353120882104.
[I 2025-11-03 14:25:37,668] Trial 106 finished with value: 0.10905005657883812 and parameters: {'model_type': 'gcn', 'hidden_dims': '[128, 64]', 'dropout': 0.4727986194477761, 'batch_norm': True, 'lr': 0.0005021579068484062, 'weight_decay': 1.5166093200473335e-05, 'epochs': 180, 'loss': 'mse', 'optimizer': 'adam', 'graph_mode': 'knn', 'source': 'grm', 'knn_k': 5, 'weighted_edges': True, 'symmetrize_mode': 'mutual', 'use_snp_selection': False}. Best is trial 49 with value: 0.14342353120882104.
[I 2025-11-03 14:25:39,536] Trial 107 finished with value: 0.12760148500187093 and parameters: {'model_type': 'gcn', 'hidden_dims': '[256, 128]', 'dropout': 0.5005404492692943, 'batch_norm': True, 'lr': 0.000722536577271799, 'weight_decay': 4.100522295310204e-06, 'epochs': 175, 'loss': 'mse', 'optimizer': 'adam', 'graph_mode': 'knn', 'source': 'grm', 'knn_k': 2, 'weighted_edges': True, 'symmetrize_mode': 'union', 'use_snp_selection': False}. Best is trial 49 with value: 0.14342353120882104.
[I 2025-11-03 14:25:41,574] Trial 108 finished with value: 0.11090814246460987 and parameters: {'model_type': 'gcn', 'hidden_dims': '[256, 128]', 'dropout': 0.5328183184745641, 'batch_norm': True, 'lr': 0.0003389738344244021, 'weight_decay': 1.0602843003990063e-05, 'epochs': 215, 'loss': 'mse', 'optimizer': 'adam', 'graph_mode': 'knn', 'source': 'grm', 'knn_k': 1, 'weighted_edges': True, 'symmetrize_mode': 'union', 'use_snp_selection': False}. Best is trial 49 with value: 0.14342353120882104.
[I 2025-11-03 14:25:43,719] Trial 109 finished with value: 0.05595302092300859 and parameters: {'model_type': 'gcn', 'hidden_dims': '[256, 128, 64]', 'dropout': 0.2649791512389633, 'batch_norm': True, 'lr': 1.426218021422399e-05, 'weight_decay': 2.5896048942221076e-06, 'epochs': 194, 'loss': 'mse', 'optimizer': 'adam', 'graph_mode': 'knn', 'source': 'grm', 'knn_k': 1, 'weighted_edges': True, 'symmetrize_mode': 'union', 'use_snp_selection': False}. Best is trial 49 with value: 0.14342353120882104.
[I 2025-11-03 14:25:46,268] Trial 110 finished with value: 0.09760338479281502 and parameters: {'model_type': 'gcn', 'hidden_dims': '[256, 128]', 'dropout': 0.453059220212626, 'batch_norm': False, 'lr': 0.0006237029905044959, 'weight_decay': 5.597879621549071e-06, 'epochs': 143, 'loss': 'mse', 'optimizer': 'adam', 'graph_mode': 'knn', 'source': 'grm', 'knn_k': 2, 'weighted_edges': True, 'symmetrize_mode': 'union', 'use_snp_selection': True, 'num_snps': 36174}. Best is trial 49 with value: 0.14342353120882104.
[I 2025-11-03 14:25:47,945] Trial 111 finished with value: 0.12849799120018654 and parameters: {'model_type': 'gcn', 'hidden_dims': '[256, 128]', 'dropout': 0.41724496932117683, 'batch_norm': True, 'lr': 0.00047923485309408755, 'weight_decay': 1.88049258167189e-07, 'epochs': 125, 'loss': 'mse', 'optimizer': 'adam', 'graph_mode': 'knn', 'source': 'grm', 'knn_k': 1, 'weighted_edges': True, 'symmetrize_mode': 'union', 'use_snp_selection': False}. Best is trial 49 with value: 0.14342353120882104.
[I 2025-11-03 14:25:49,733] Trial 112 finished with value: 0.07748211709564844 and parameters: {'model_type': 'gcn', 'hidden_dims': '[256, 128]', 'dropout': 0.4378092149849382, 'batch_norm': True, 'lr': 5.052939539398918e-05, 'weight_decay': 1.222422784321794e-05, 'epochs': 159, 'loss': 'mse', 'optimizer': 'adam', 'graph_mode': 'knn', 'source': 'grm', 'knn_k': 1, 'weighted_edges': True, 'symmetrize_mode': 'union', 'use_snp_selection': False}. Best is trial 49 with value: 0.14342353120882104.
[I 2025-11-03 14:25:51,645] Trial 113 finished with value: 0.13659083538815053 and parameters: {'model_type': 'gcn', 'hidden_dims': '[256, 128]', 'dropout': 0.4054725311170494, 'batch_norm': True, 'lr': 0.0008501624216903411, 'weight_decay': 9.025730001079645e-06, 'epochs': 187, 'loss': 'mse', 'optimizer': 'adam', 'graph_mode': 'knn', 'source': 'grm', 'knn_k': 1, 'weighted_edges': True, 'symmetrize_mode': 'union', 'use_snp_selection': False}. Best is trial 49 with value: 0.14342353120882104.
[I 2025-11-03 14:25:53,472] Trial 114 finished with value: 0.1463315428789703 and parameters: {'model_type': 'gcn', 'hidden_dims': '[256, 128]', 'dropout': 0.39808425423004606, 'batch_norm': True, 'lr': 0.0008450910406753215, 'weight_decay': 9.163841103577947e-06, 'epochs': 169, 'loss': 'mse', 'optimizer': 'adam', 'graph_mode': 'knn', 'source': 'grm', 'knn_k': 1, 'weighted_edges': True, 'symmetrize_mode': 'union', 'use_snp_selection': False}. Best is trial 114 with value: 0.1463315428789703.
