[I 2025-11-03 12:58:57,250] Trial 23 finished with value: 0.010735527858506866 and parameters: {'model_type': 'gcn', 'hidden_dims': '[256, 128, 64]', 'dropout': 0.5541698195336024, 'batch_norm': False, 'lr': 0.0003201005980594528, 'weight_decay': 7.456646650358112e-06, 'epochs': 122, 'loss': 'mae', 'optimizer': 'adam', 'graph_mode': 'off', 'use_snp_selection': False}. Best is trial 16 with value: 0.050243356640524144.
[I 2025-11-03 12:58:58,533] Trial 24 finished with value: -0.01438183153728497 and parameters: {'model_type': 'gcn', 'hidden_dims': '[256, 128, 64]', 'dropout': 0.5459552055641331, 'batch_norm': False, 'lr': 0.00012896103420799324, 'weight_decay': 9.506986537196083e-07, 'epochs': 159, 'loss': 'mae', 'optimizer': 'adam', 'graph_mode': 'off', 'use_snp_selection': False}. Best is trial 16 with value: 0.050243356640524144.
[I 2025-11-03 12:58:59,681] Trial 25 finished with value: 0.010002567710047698 and parameters: {'model_type': 'gcn', 'hidden_dims': '[512, 256]', 'dropout': 0.45739803389971934, 'batch_norm': False, 'lr': 0.0009812468705016437, 'weight_decay': 2.986269599076725e-05, 'epochs': 70, 'loss': 'mae', 'optimizer': 'adam', 'graph_mode': 'off', 'use_snp_selection': False}. Best is trial 16 with value: 0.050243356640524144.
[I 2025-11-03 12:59:00,401] Trial 26 finished with value: -0.023156665233081606 and parameters: {'model_type': 'gcn', 'hidden_dims': '[256, 128]', 'dropout': 0.49699549398759146, 'batch_norm': False, 'lr': 0.00011410574000316558, 'weight_decay': 9.087933899446608e-06, 'epochs': 105, 'loss': 'mse', 'optimizer': 'adam', 'graph_mode': 'off', 'use_snp_selection': True, 'num_snps': 3842}. Best is trial 16 with value: 0.050243356640524144.
[I 2025-11-03 12:59:01,111] Trial 27 finished with value: -0.013149777210293893 and parameters: {'model_type': 'gcn', 'hidden_dims': '[128, 64]', 'dropout': 0.32023734664657355, 'batch_norm': False, 'lr': 0.00046756215915624334, 'weight_decay': 2.6410302901848064e-07, 'epochs': 76, 'loss': 'mae', 'optimizer': 'adam', 'graph_mode': 'off', 'use_snp_selection': False}. Best is trial 16 with value: 0.050243356640524144.
[I 2025-11-03 12:59:02,610] Trial 28 finished with value: 0.03172431976026158 and parameters: {'model_type': 'gcn', 'hidden_dims': '[512, 128]', 'dropout': 0.4228674374734418, 'batch_norm': False, 'lr': 3.288663963712057e-05, 'weight_decay': 1.4290722032942833e-05, 'epochs': 135, 'loss': 'mae', 'optimizer': 'adam', 'graph_mode': 'off', 'use_snp_selection': False}. Best is trial 16 with value: 0.050243356640524144.
[I 2025-11-03 12:59:03,754] Trial 29 finished with value: -0.01937998175100688 and parameters: {'model_type': 'gcn', 'hidden_dims': '[128, 64]', 'dropout': 0.5175273804193905, 'batch_norm': False, 'lr': 2.8966762461994946e-06, 'weight_decay': 3.9737970054018675e-05, 'epochs': 175, 'loss': 'mae', 'optimizer': 'adam', 'graph_mode': 'off', 'use_snp_selection': True, 'num_snps': 19468}. Best is trial 16 with value: 0.050243356640524144.
[I 2025-11-03 12:59:04,619] Trial 30 finished with value: -0.006184058483867674 and parameters: {'model_type': 'gcn', 'hidden_dims': '[256, 128, 64]', 'dropout': 0.5622943377862464, 'batch_norm': False, 'lr': 0.0004238782003875733, 'weight_decay': 0.00010803940086829997, 'epochs': 62, 'loss': 'mae', 'optimizer': 'adam', 'graph_mode': 'off', 'use_snp_selection': False}. Best is trial 16 with value: 0.050243356640524144.
[I 2025-11-03 12:59:06,140] Trial 31 finished with value: -0.011057537576712882 and parameters: {'model_type': 'gcn', 'hidden_dims': '[512, 128]', 'dropout': 0.41789444592073977, 'batch_norm': False, 'lr': 2.9313159478733854e-05, 'weight_decay': 1.4023545167331217e-05, 'epochs': 136, 'loss': 'mae', 'optimizer': 'adam', 'graph_mode': 'off', 'use_snp_selection': False}. Best is trial 16 with value: 0.050243356640524144.
[I 2025-11-03 12:59:07,520] Trial 32 finished with value: -8.972624963872851e-05 and parameters: {'model_type': 'gcn', 'hidden_dims': '[512, 128]', 'dropout': 0.3710895270964269, 'batch_norm': False, 'lr': 4.1613518730103274e-05, 'weight_decay': 4.8946048910688525e-06, 'epochs': 112, 'loss': 'mae', 'optimizer': 'adam', 'graph_mode': 'off', 'use_snp_selection': False}. Best is trial 16 with value: 0.050243356640524144.
[I 2025-11-03 12:59:08,797] Trial 33 finished with value: 0.01785636223985094 and parameters: {'model_type': 'gcn', 'hidden_dims': '[512, 128]', 'dropout': 0.42384043529448484, 'batch_norm': False, 'lr': 9.163030604082865e-05, 'weight_decay': 1.5635330685963498e-05, 'epochs': 92, 'loss': 'mae', 'optimizer': 'adam', 'graph_mode': 'off', 'use_snp_selection': False}. Best is trial 16 with value: 0.050243356640524144.
[I 2025-11-03 12:59:10,016] Trial 34 finished with value: -0.0310022290638691 and parameters: {'model_type': 'gcn', 'hidden_dims': '[512, 128]', 'dropout': 0.4706231952080577, 'batch_norm': False, 'lr': 2.05689560554885e-05, 'weight_decay': 0.00021789696171438828, 'epochs': 82, 'loss': 'mae', 'optimizer': 'adam', 'graph_mode': 'off', 'use_snp_selection': False}. Best is trial 16 with value: 0.050243356640524144.
[I 2025-11-03 12:59:11,190] Trial 35 finished with value: -0.03519444832280035 and parameters: {'model_type': 'gcn', 'hidden_dims': '[256, 128]', 'dropout': 0.4452176016300068, 'batch_norm': True, 'lr': 1.1930999099557241e-05, 'weight_decay': 4.051326897899674e-05, 'epochs': 160, 'loss': 'mae', 'optimizer': 'adam', 'graph_mode': 'off', 'use_snp_selection': False}. Best is trial 16 with value: 0.050243356640524144.
[I 2025-11-03 12:59:13,710] Trial 36 finished with value: 0.006179965856587432 and parameters: {'model_type': 'gcn', 'hidden_dims': '[512, 64]', 'dropout': 0.5715807961383151, 'batch_norm': False, 'lr': 2.2595649246158207e-06, 'weight_decay': 0.0005684977343047863, 'epochs': 136, 'loss': 'mse', 'optimizer': 'adam', 'graph_mode': 'off', 'use_snp_selection': True, 'num_snps': 58661}. Best is trial 16 with value: 0.050243356640524144.
[I 2025-11-03 12:59:15,321] Trial 37 finished with value: 0.02399091394489215 and parameters: {'model_type': 'gcn', 'hidden_dims': '[256, 128, 64]', 'dropout': 0.2612604744121134, 'batch_norm': False, 'lr': 5.223294063645015e-06, 'weight_decay': 5.0714729142582555e-06, 'epochs': 236, 'loss': 'mae', 'optimizer': 'adam', 'graph_mode': 'off', 'use_snp_selection': False}. Best is trial 16 with value: 0.050243356640524144.
[I 2025-11-03 12:59:16,386] Trial 38 finished with value: 0.010562945807732923 and parameters: {'model_type': 'gcn', 'hidden_dims': '[512, 128]', 'dropout': 0.4017370061717641, 'batch_norm': True, 'lr': 0.0006618907619764019, 'weight_decay': 1.297503964615086e-06, 'epochs': 53, 'loss': 'mse', 'optimizer': 'adam', 'graph_mode': 'off', 'use_snp_selection': True, 'num_snps': 19911}. Best is trial 16 with value: 0.050243356640524144.
[I 2025-11-03 12:59:17,751] Trial 39 finished with value: 0.02449458101068085 and parameters: {'model_type': 'gcn', 'hidden_dims': '[512, 64]', 'dropout': 0.514294682519367, 'batch_norm': False, 'lr': 0.0002691978762929912, 'weight_decay': 9.846222019340155e-06, 'epochs': 105, 'loss': 'mae', 'optimizer': 'adam', 'graph_mode': 'off', 'use_snp_selection': False}. Best is trial 16 with value: 0.050243356640524144.
[I 2025-11-03 12:59:20,197] Trial 40 finished with value: -0.01842400192698881 and parameters: {'model_type': 'gcn', 'hidden_dims': '[512, 256]', 'dropout': 0.4871850774885829, 'batch_norm': True, 'lr': 8.68682373940585e-06, 'weight_decay': 6.226469933011026e-05, 'epochs': 284, 'loss': 'mae', 'optimizer': 'adam', 'graph_mode': 'off', 'use_snp_selection': False}. Best is trial 16 with value: 0.050243356640524144.
[I 2025-11-03 12:59:22,603] Trial 41 finished with value: -0.021515120092593733 and parameters: {'model_type': 'gcn', 'hidden_dims': '[256, 128, 64]', 'dropout': 0.5345753497225971, 'batch_norm': False, 'lr': 0.00016786784271370303, 'weight_decay': 6.0823119808690506e-05, 'epochs': 218, 'loss': 'mae', 'optimizer': 'adam', 'graph_mode': 'off', 'use_snp_selection': True, 'num_snps': 54855}. Best is trial 16 with value: 0.050243356640524144.
[I 2025-11-03 12:59:24,809] Trial 42 finished with value: 0.004474424076191631 and parameters: {'model_type': 'gcn', 'hidden_dims': '[256, 128, 64]', 'dropout': 0.5664484267334152, 'batch_norm': False, 'lr': 9.407945931718734e-05, 'weight_decay': 2.0547740091958633e-05, 'epochs': 192, 'loss': 'mae', 'optimizer': 'adam', 'graph_mode': 'off', 'use_snp_selection': True, 'num_snps': 47526}. Best is trial 16 with value: 0.050243356640524144.
[I 2025-11-03 12:59:27,087] Trial 43 finished with value: 0.017254800825806417 and parameters: {'model_type': 'gcn', 'hidden_dims': '[256, 128, 64]', 'dropout': 0.43148623239202777, 'batch_norm': False, 'lr': 0.00015521107215560846, 'weight_decay': 2.6161343536390527e-06, 'epochs': 250, 'loss': 'mae', 'optimizer': 'adam', 'graph_mode': 'off', 'use_snp_selection': True, 'num_snps': 44522}. Best is trial 16 with value: 0.050243356640524144.
[I 2025-11-03 12:59:29,171] Trial 44 finished with value: 0.04142904400432173 and parameters: {'model_type': 'gcn', 'hidden_dims': '[256, 128, 64]', 'dropout': 0.5314138916711336, 'batch_norm': False, 'lr': 0.00031928556337988787, 'weight_decay': 0.00021924396852284413, 'epochs': 348, 'loss': 'mae', 'optimizer': 'adam', 'graph_mode': 'off', 'use_snp_selection': True, 'num_snps': 27389}. Best is trial 16 with value: 0.050243356640524144.
[I 2025-11-03 12:59:30,803] Trial 45 finished with value: -0.016329431386440933 and parameters: {'model_type': 'gcn', 'hidden_dims': '[256, 128]', 'dropout': 0.368968872971084, 'batch_norm': False, 'lr': 0.000334549191984831, 'weight_decay': 0.00037248461265569464, 'epochs': 321, 'loss': 'mse', 'optimizer': 'adam', 'graph_mode': 'off', 'use_snp_selection': True, 'num_snps': 24235}. Best is trial 16 with value: 0.050243356640524144.
[I 2025-11-03 12:59:32,138] Trial 46 finished with value: 0.0011217626071072795 and parameters: {'model_type': 'gcn', 'hidden_dims': '[512, 64]', 'dropout': 0.5927382615337966, 'batch_norm': True, 'lr': 4.505700368974512e-05, 'weight_decay': 0.00019420605492074806, 'epochs': 85, 'loss': 'mae', 'optimizer': 'adam', 'graph_mode': 'off', 'use_snp_selection': True, 'num_snps': 27921}. Best is trial 16 with value: 0.050243356640524144.
[I 2025-11-03 12:59:34,859] Trial 47 finished with value: -0.0010985225040028208 and parameters: {'model_type': 'gcn', 'hidden_dims': '[512, 128]', 'dropout': 0.5152905166341607, 'batch_norm': False, 'lr': 0.000728224468786012, 'weight_decay': 0.0009669331628569803, 'epochs': 345, 'loss': 'mae', 'optimizer': 'adam', 'graph_mode': 'off', 'use_snp_selection': False}. Best is trial 16 with value: 0.050243356640524144.
[I 2025-11-03 12:59:35,705] Trial 48 finished with value: -0.05622629205029588 and parameters: {'model_type': 'gcn', 'hidden_dims': '[256, 128, 64]', 'dropout': 0.47068123726704064, 'batch_norm': False, 'lr': 1.0136033966680256e-06, 'weight_decay': 0.00034738817961141446, 'epochs': 59, 'loss': 'mae', 'optimizer': 'adam', 'graph_mode': 'off', 'use_snp_selection': False}. Best is trial 16 with value: 0.050243356640524144.
[I 2025-11-03 12:59:37,969] Trial 49 finished with value: -0.01971522800376994 and parameters: {'model_type': 'gcn', 'hidden_dims': '[512, 64]', 'dropout': 0.5817853096800363, 'batch_norm': False, 'lr': 7.918495049550974e-05, 'weight_decay': 0.000549108645952784, 'epochs': 271, 'loss': 'mse', 'optimizer': 'adam', 'graph_mode': 'off', 'use_snp_selection': False}. Best is trial 16 with value: 0.050243356640524144.
[I 2025-11-03 12:59:38,684] Trial 50 finished with value: 0.010456603299286125 and parameters: {'model_type': 'gcn', 'hidden_dims': '[128, 64]', 'dropout': 0.2077662138022255, 'batch_norm': False, 'lr': 0.0002377294455717346, 'weight_decay': 0.00017043188375268862, 'epochs': 42, 'loss': 'mae', 'optimizer': 'adam', 'graph_mode': 'off', 'use_snp_selection': True, 'num_snps': 10563}. Best is trial 16 with value: 0.050243356640524144.
[I 2025-11-03 12:59:40,808] Trial 51 finished with value: -0.042033599778110116 and parameters: {'model_type': 'gcn', 'hidden_dims': '[256, 128, 64]', 'dropout': 0.5383574974893076, 'batch_norm': False, 'lr': 0.00036731563468578467, 'weight_decay': 8.9846232636837e-05, 'epochs': 295, 'loss': 'mae', 'optimizer': 'adam', 'graph_mode': 'off', 'use_snp_selection': True, 'num_snps': 34795}. Best is trial 16 with value: 0.050243356640524144.
[I 2025-11-03 12:59:42,731] Trial 52 finished with value: -0.0044527296563888034 and parameters: {'model_type': 'gcn', 'hidden_dims': '[256, 128, 64]', 'dropout': 0.5157055287937969, 'batch_norm': False, 'lr': 0.0005648180756825218, 'weight_decay': 5.758462742285383e-05, 'epochs': 214, 'loss': 'mae', 'optimizer': 'adam', 'graph_mode': 'off', 'use_snp_selection': True, 'num_snps': 39914}. Best is trial 16 with value: 0.050243356640524144.
[I 2025-11-03 12:59:45,270] Trial 53 finished with value: 0.015577381551118668 and parameters: {'model_type': 'gcn', 'hidden_dims': '[256, 128, 64]', 'dropout': 0.5476692174818273, 'batch_norm': False, 'lr': 0.0001995434532267795, 'weight_decay': 1.2536397593991073e-05, 'epochs': 259, 'loss': 'mae', 'optimizer': 'adam', 'graph_mode': 'off', 'use_snp_selection': True, 'num_snps': 51892}. Best is trial 16 with value: 0.050243356640524144.
[I 2025-11-03 12:59:47,220] Trial 54 finished with value: 0.00393416231784929 and parameters: {'model_type': 'gcn', 'hidden_dims': '[256, 128, 64]', 'dropout': 0.4851659561471957, 'batch_norm': False, 'lr': 0.00014111333984906103, 'weight_decay': 0.00012277963410676332, 'epochs': 325, 'loss': 'mae', 'optimizer': 'adam', 'graph_mode': 'off', 'use_snp_selection': True, 'num_snps': 26277}. Best is trial 16 with value: 0.050243356640524144.
[I 2025-11-03 12:59:48,454] Trial 55 finished with value: -0.026009051586886975 and parameters: {'model_type': 'gcn', 'hidden_dims': '[256, 128, 64]', 'dropout': 0.46000567611389453, 'batch_norm': False, 'lr': 0.00028228409325255894, 'weight_decay': 6.581178848295151e-06, 'epochs': 148, 'loss': 'mae', 'optimizer': 'adam', 'graph_mode': 'off', 'use_snp_selection': False}. Best is trial 16 with value: 0.050243356640524144.
[I 2025-11-03 12:59:49,356] Trial 56 finished with value: -0.0005514488043255436 and parameters: {'model_type': 'gcn', 'hidden_dims': '[256, 128, 64]', 'dropout': 0.5968771161674353, 'batch_norm': False, 'lr': 5.39872553077178e-05, 'weight_decay': 2.6976405865130228e-05, 'epochs': 69, 'loss': 'mae', 'optimizer': 'adam', 'graph_mode': 'off', 'use_snp_selection': False}. Best is trial 16 with value: 0.050243356640524144.
[I 2025-11-03 12:59:52,783] Trial 57 finished with value: -0.011223931522018619 and parameters: {'model_type': 'gcn', 'hidden_dims': '[512, 256]', 'dropout': 0.5020281710673721, 'batch_norm': True, 'lr': 0.00019895661233651005, 'weight_decay': 3.4766968249835603e-06, 'epochs': 302, 'loss': 'mae', 'optimizer': 'adam', 'graph_mode': 'off', 'use_snp_selection': True, 'num_snps': 59681}. Best is trial 16 with value: 0.050243356640524144.
[I 2025-11-03 12:59:54,544] Trial 58 finished with value: -0.000606454144317154 and parameters: {'model_type': 'gcn', 'hidden_dims': '[512, 64]', 'dropout': 0.5732898167110874, 'batch_norm': False, 'lr': 3.407655811736927e-05, 'weight_decay': 4.084562299971923e-05, 'epochs': 180, 'loss': 'mae', 'optimizer': 'adam', 'graph_mode': 'off', 'use_snp_selection': False}. Best is trial 16 with value: 0.050243356640524144.
[I 2025-11-03 12:59:55,650] Trial 59 finished with value: -0.029419894486211684 and parameters: {'model_type': 'gcn', 'hidden_dims': '[256, 128, 64]', 'dropout': 0.5299456819748317, 'batch_norm': False, 'lr': 2.150087513010233e-05, 'weight_decay': 1.874668239168278e-06, 'epochs': 103, 'loss': 'mae', 'optimizer': 'adam', 'graph_mode': 'off', 'use_snp_selection': False}. Best is trial 16 with value: 0.050243356640524144.
[I 2025-11-03 12:59:56,807] Trial 60 finished with value: -0.009734869677181868 and parameters: {'model_type': 'gcn', 'hidden_dims': '[512, 128]', 'dropout': 0.39517510743516526, 'batch_norm': False, 'lr': 7.020999234678024e-06, 'weight_decay': 7.966948796174944e-05, 'epochs': 135, 'loss': 'mae', 'optimizer': 'adam', 'graph_mode': 'off', 'use_snp_selection': True, 'num_snps': 16602}. Best is trial 16 with value: 0.050243356640524144.
[I 2025-11-03 12:59:58,217] Trial 61 finished with value: -0.00430844434521137 and parameters: {'model_type': 'gcn', 'hidden_dims': '[512, 64]', 'dropout': 0.5144959031446856, 'batch_norm': False, 'lr': 0.00025564486188246397, 'weight_decay': 1.0410319453677907e-05, 'epochs': 116, 'loss': 'mae', 'optimizer': 'adam', 'graph_mode': 'off', 'use_snp_selection': False}. Best is trial 16 with value: 0.050243356640524144.
[I 2025-11-03 12:59:59,509] Trial 62 finished with value: 0.008711012483641794 and parameters: {'model_type': 'gcn', 'hidden_dims': '[512, 64]', 'dropout': 0.5499750293549118, 'batch_norm': False, 'lr': 0.00041271042326430137, 'weight_decay': 2.0219973291621503e-05, 'epochs': 92, 'loss': 'mae', 'optimizer': 'adam', 'graph_mode': 'off', 'use_snp_selection': False}. Best is trial 16 with value: 0.050243356640524144.
[I 2025-11-03 13:00:00,910] Trial 63 finished with value: -0.002731992963427147 and parameters: {'model_type': 'gcn', 'hidden_dims': '[512, 64]', 'dropout': 0.44221022748644345, 'batch_norm': False, 'lr': 0.00029863570956762065, 'weight_decay': 8.987403443554564e-06, 'epochs': 106, 'loss': 'mae', 'optimizer': 'adam', 'graph_mode': 'off', 'use_snp_selection': False}. Best is trial 16 with value: 0.050243356640524144.
[I 2025-11-03 13:00:02,091] Trial 64 finished with value: 0.041967259399017263 and parameters: {'model_type': 'gcn', 'hidden_dims': '[512, 64]', 'dropout': 0.48250140404258346, 'batch_norm': False, 'lr': 0.00011643170153196221, 'weight_decay': 3.5669816916637398e-06, 'epochs': 76, 'loss': 'mae', 'optimizer': 'adam', 'graph_mode': 'off', 'use_snp_selection': False}. Best is trial 16 with value: 0.050243356640524144.
[I 2025-11-03 13:00:02,864] Trial 65 finished with value: 0.03796452735806241 and parameters: {'model_type': 'gcn', 'hidden_dims': '[256, 128]', 'dropout': 0.48200173105962046, 'batch_norm': False, 'lr': 0.00010010531863918258, 'weight_decay': 2.4366546974746834e-06, 'epochs': 52, 'loss': 'mae', 'optimizer': 'adam', 'graph_mode': 'off', 'use_snp_selection': False}. Best is trial 16 with value: 0.050243356640524144.
[I 2025-11-03 13:00:03,643] Trial 66 finished with value: -0.02804694513376878 and parameters: {'model_type': 'gcn', 'hidden_dims': '[256, 128]', 'dropout': 0.48235560370994834, 'batch_norm': False, 'lr': 6.584602604053494e-05, 'weight_decay': 9.61589829263932e-07, 'epochs': 49, 'loss': 'mae', 'optimizer': 'adam', 'graph_mode': 'off', 'use_snp_selection': False}. Best is trial 16 with value: 0.050243356640524144.
[I 2025-11-03 13:00:04,492] Trial 67 finished with value: 0.01620072042007248 and parameters: {'model_type': 'gcn', 'hidden_dims': '[256, 128]', 'dropout': 0.45743798933093804, 'batch_norm': False, 'lr': 0.00011472637262107101, 'weight_decay': 4.009412854518288e-06, 'epochs': 74, 'loss': 'mse', 'optimizer': 'adam', 'graph_mode': 'off', 'use_snp_selection': False}. Best is trial 16 with value: 0.050243356640524144.
[I 2025-11-03 13:00:05,304] Trial 68 finished with value: 0.021857764315349037 and parameters: {'model_type': 'gcn', 'hidden_dims': '[256, 128]', 'dropout': 0.49458780715549516, 'batch_norm': False, 'lr': 9.47956616916159e-05, 'weight_decay': 2.265869599426109e-06, 'epochs': 63, 'loss': 'mae', 'optimizer': 'adam', 'graph_mode': 'off', 'use_snp_selection': False}. Best is trial 16 with value: 0.050243356640524144.
[I 2025-11-03 13:00:06,195] Trial 69 finished with value: -0.0252950959896576 and parameters: {'model_type': 'gcn', 'hidden_dims': '[256, 128]', 'dropout': 0.4054309488030147, 'batch_norm': False, 'lr': 1.5691307398766536e-05, 'weight_decay': 5.153852148068731e-07, 'epochs': 85, 'loss': 'mae', 'optimizer': 'adam', 'graph_mode': 'off', 'use_snp_selection': False}. Best is trial 16 with value: 0.050243356640524144.
[I 2025-11-03 13:00:06,853] Trial 70 finished with value: -0.01263856746363702 and parameters: {'model_type': 'gcn', 'hidden_dims': '[128, 64]', 'dropout': 0.4310159400916857, 'batch_norm': True, 'lr': 1.1593697707581995e-05, 'weight_decay': 6.074366415026385e-06, 'epochs': 54, 'loss': 'mae', 'optimizer': 'adam', 'graph_mode': 'off', 'use_snp_selection': False}. Best is trial 16 with value: 0.050243356640524144.
[I 2025-11-03 13:00:08,138] Trial 71 finished with value: -0.02301578448481399 and parameters: {'model_type': 'gcn', 'hidden_dims': '[256, 128, 64]', 'dropout': 0.5276582224781068, 'batch_norm': False, 'lr': 0.000169950503112382, 'weight_decay': 1.5285687964786858e-06, 'epochs': 159, 'loss': 'mae', 'optimizer': 'adam', 'graph_mode': 'off', 'use_snp_selection': False}. Best is trial 16 with value: 0.050243356640524144.
[I 2025-11-03 13:00:09,292] Trial 72 finished with value: -0.023378704155668673 and parameters: {'model_type': 'gcn', 'hidden_dims': '[512, 64]', 'dropout': 0.4989081890702968, 'batch_norm': False, 'lr': 0.00012442666378073886, 'weight_decay': 2.889486096768726e-06, 'epochs': 68, 'loss': 'mae', 'optimizer': 'adam', 'graph_mode': 'off', 'use_snp_selection': False}. Best is trial 16 with value: 0.050243356640524144.
[I 2025-11-03 13:00:10,788] Trial 73 finished with value: 0.04066462514183441 and parameters: {'model_type': 'gcn', 'hidden_dims': '[512, 128]', 'dropout': 0.5597391696763443, 'batch_norm': False, 'lr': 0.000212130759420746, 'weight_decay': 0.00026558043232871044, 'epochs': 128, 'loss': 'mae', 'optimizer': 'adam', 'graph_mode': 'off', 'use_snp_selection': False}. Best is trial 16 with value: 0.050243356640524144.
