[I 2025-11-12 01:23:13,392] Trial 131 finished with value: 0.275498083097078 and parameters: {'model_type': 'graphsage', 'hidden_dims': '[256, 128]', 'dropout': 0.5183316364466264, 'batch_norm': True, 'lr': 0.0002639542836657713, 'weight_decay': 5.178040469382791e-05, 'epochs': 63, 'loss': 'mae', 'optimizer': 'adam', 'graph_mode': 'cutoff', 'cutoff': 0.252850053609851, 'grm_norm': 'gcn', 'self_loops': False, 'use_snp_selection': False}. Best is trial 127 with value: 0.28085608979509497.
[I 2025-11-12 01:24:08,676] Trial 132 finished with value: 0.25682406699469473 and parameters: {'model_type': 'graphsage', 'hidden_dims': '[256, 128]', 'dropout': 0.519844001239343, 'batch_norm': True, 'lr': 0.0002741625439203264, 'weight_decay': 4.439597806804028e-05, 'epochs': 47, 'loss': 'mae', 'optimizer': 'adam', 'graph_mode': 'cutoff', 'cutoff': 0.25620657862110074, 'grm_norm': 'gcn', 'self_loops': False, 'use_snp_selection': False}. Best is trial 127 with value: 0.28085608979509497.
[I 2025-11-12 01:25:21,240] Trial 133 finished with value: 0.27317907654964235 and parameters: {'model_type': 'graphsage', 'hidden_dims': '[256, 128]', 'dropout': 0.5022322747100454, 'batch_norm': True, 'lr': 0.00034268926502308933, 'weight_decay': 9.358891008201496e-05, 'epochs': 63, 'loss': 'mae', 'optimizer': 'adam', 'graph_mode': 'cutoff', 'cutoff': 0.24701190875709111, 'grm_norm': 'gcn', 'self_loops': False, 'use_snp_selection': False}. Best is trial 127 with value: 0.28085608979509497.
[I 2025-11-12 01:26:17,573] Trial 134 finished with value: 0.27604742950188876 and parameters: {'model_type': 'graphsage', 'hidden_dims': '[256, 128]', 'dropout': 0.5002197952483489, 'batch_norm': True, 'lr': 0.000354609563303177, 'weight_decay': 0.00010567879529810153, 'epochs': 63, 'loss': 'mae', 'optimizer': 'adam', 'graph_mode': 'cutoff', 'cutoff': 0.28665483083352206, 'grm_norm': 'gcn', 'self_loops': False, 'use_snp_selection': False}. Best is trial 127 with value: 0.28085608979509497.
[I 2025-11-12 01:27:07,405] Trial 135 finished with value: 0.26053103165749986 and parameters: {'model_type': 'graphsage', 'hidden_dims': '[256, 128]', 'dropout': 0.4989141357038753, 'batch_norm': True, 'lr': 0.0002591563698954703, 'weight_decay': 0.0001196550379169186, 'epochs': 54, 'loss': 'mae', 'optimizer': 'adam', 'graph_mode': 'cutoff', 'cutoff': 0.2919075684360768, 'grm_norm': 'gcn', 'self_loops': False, 'use_snp_selection': False}. Best is trial 127 with value: 0.28085608979509497.
[I 2025-11-12 01:28:07,806] Trial 136 finished with value: 0.26277653886358326 and parameters: {'model_type': 'graphsage', 'hidden_dims': '[256, 128]', 'dropout': 0.48459354760257056, 'batch_norm': True, 'lr': 0.00037016894270768105, 'weight_decay': 9.45033856399327e-05, 'epochs': 65, 'loss': 'mae', 'optimizer': 'adam', 'graph_mode': 'cutoff', 'cutoff': 0.2719891794209237, 'grm_norm': 'gcn', 'self_loops': False, 'use_snp_selection': False}. Best is trial 127 with value: 0.28085608979509497.
[I 2025-11-12 01:29:06,767] Trial 137 finished with value: 0.26902786597229184 and parameters: {'model_type': 'graphsage', 'hidden_dims': '[256, 128]', 'dropout': 0.4631190002526621, 'batch_norm': True, 'lr': 0.00029435917504630217, 'weight_decay': 6.535795898315208e-05, 'epochs': 48, 'loss': 'mae', 'optimizer': 'adam', 'graph_mode': 'cutoff', 'cutoff': 0.24745625820177214, 'grm_norm': 'gcn', 'self_loops': False, 'use_snp_selection': False}. Best is trial 127 with value: 0.28085608979509497.
[I 2025-11-12 01:30:13,235] Trial 138 finished with value: 0.28183798870429 and parameters: {'model_type': 'graphsage', 'hidden_dims': '[256, 128]', 'dropout': 0.5121035285112243, 'batch_norm': True, 'lr': 0.0002513605439667415, 'weight_decay': 0.00013451312582945255, 'epochs': 63, 'loss': 'mae', 'optimizer': 'adam', 'graph_mode': 'knn', 'source': 'grm', 'knn_k': 2, 'weighted_edges': True, 'symmetrize_mode': 'mutual', 'use_snp_selection': True, 'num_snps': 24232}. Best is trial 138 with value: 0.28183798870429.
[I 2025-11-12 01:31:18,201] Trial 139 finished with value: 0.25827909185058634 and parameters: {'model_type': 'graphsage', 'hidden_dims': '[256, 128]', 'dropout': 0.510656544864171, 'batch_norm': True, 'lr': 0.00025332651126387846, 'weight_decay': 0.00014097647628124783, 'epochs': 64, 'loss': 'mae', 'optimizer': 'adam', 'graph_mode': 'knn', 'source': 'grm', 'knn_k': 2, 'weighted_edges': True, 'symmetrize_mode': 'mutual', 'use_snp_selection': True, 'num_snps': 22689}. Best is trial 138 with value: 0.28183798870429.
[I 2025-11-12 01:32:37,283] Trial 140 finished with value: 0.22961996340760532 and parameters: {'model_type': 'graphsage', 'hidden_dims': '[256, 128]', 'dropout': 0.4984424745455754, 'batch_norm': False, 'lr': 0.00018211617153640253, 'weight_decay': 0.00019345468935797963, 'epochs': 71, 'loss': 'mae', 'optimizer': 'adam', 'graph_mode': 'knn', 'source': 'grm', 'knn_k': 3, 'weighted_edges': True, 'symmetrize_mode': 'mutual', 'use_snp_selection': True, 'num_snps': 34449}. Best is trial 138 with value: 0.28183798870429.
[I 2025-11-12 01:33:48,657] Trial 141 finished with value: 0.259162626013285 and parameters: {'model_type': 'graphsage', 'hidden_dims': '[256, 128]', 'dropout': 0.47973229932591044, 'batch_norm': True, 'lr': 0.0003072740016715692, 'weight_decay': 8.862345870175724e-05, 'epochs': 56, 'loss': 'mae', 'optimizer': 'adam', 'graph_mode': 'knn', 'source': 'grm', 'knn_k': 5, 'weighted_edges': True, 'symmetrize_mode': 'mutual', 'use_snp_selection': True, 'num_snps': 26971}. Best is trial 138 with value: 0.28183798870429.
[I 2025-11-12 01:34:39,859] Trial 142 finished with value: 0.2421177565986658 and parameters: {'model_type': 'graphsage', 'hidden_dims': '[256, 128]', 'dropout': 0.5096461763456717, 'batch_norm': True, 'lr': 0.0003556984971908281, 'weight_decay': 0.00021386855469129358, 'epochs': 40, 'loss': 'mae', 'optimizer': 'adam', 'graph_mode': 'knn', 'source': 'grm', 'knn_k': 2, 'weighted_edges': True, 'symmetrize_mode': 'mutual', 'use_snp_selection': True, 'num_snps': 7538}. Best is trial 138 with value: 0.28183798870429.
[I 2025-11-12 01:35:40,079] Trial 143 finished with value: 0.246985085182013 and parameters: {'model_type': 'graphsage', 'hidden_dims': '[256, 128]', 'dropout': 0.49502250021291616, 'batch_norm': True, 'lr': 0.00038838313051293494, 'weight_decay': 3.893973208637337e-05, 'epochs': 51, 'loss': 'mae', 'optimizer': 'adam', 'graph_mode': 'knn', 'source': 'grm', 'knn_k': 4, 'weighted_edges': True, 'symmetrize_mode': 'mutual', 'use_snp_selection': True, 'num_snps': 16570}. Best is trial 138 with value: 0.28183798870429.
[I 2025-11-12 01:36:36,284] Trial 144 finished with value: 0.28122324674863636 and parameters: {'model_type': 'graphsage', 'hidden_dims': '[256, 128]', 'dropout': 0.525204222987373, 'batch_norm': True, 'lr': 0.0003142023165122799, 'weight_decay': 6.371200533871434e-05, 'epochs': 63, 'loss': 'mae', 'optimizer': 'adam', 'graph_mode': 'cutoff', 'cutoff': 0.2859277927548209, 'grm_norm': 'gcn', 'self_loops': False, 'use_snp_selection': False}. Best is trial 138 with value: 0.28183798870429.
[I 2025-11-12 01:37:33,320] Trial 145 finished with value: 0.2693584484828414 and parameters: {'model_type': 'graphsage', 'hidden_dims': '[256, 128]', 'dropout': 0.5067935788852471, 'batch_norm': True, 'lr': 0.00024054704922124074, 'weight_decay': 6.7677452382931e-05, 'epochs': 63, 'loss': 'mae', 'optimizer': 'adam', 'graph_mode': 'cutoff', 'cutoff': 0.2823200274684673, 'grm_norm': 'gcn', 'self_loops': False, 'use_snp_selection': False}. Best is trial 138 with value: 0.28183798870429.
[I 2025-11-12 01:38:15,757] Trial 146 finished with value: 0.2673318670462235 and parameters: {'model_type': 'graphsage', 'hidden_dims': '[256, 128]', 'dropout': 0.5300744385574984, 'batch_norm': True, 'lr': 0.0002957067589867533, 'weight_decay': 5.15638509022942e-05, 'epochs': 74, 'loss': 'mae', 'optimizer': 'adam', 'graph_mode': 'cutoff', 'cutoff': 0.6226725702842557, 'grm_norm': 'gcn', 'self_loops': False, 'use_snp_selection': False}. Best is trial 138 with value: 0.28183798870429.
[I 2025-11-12 01:39:04,914] Trial 147 finished with value: 0.2723720846593786 and parameters: {'model_type': 'graphsage', 'hidden_dims': '[256, 128]', 'dropout': 0.47248793203356726, 'batch_norm': True, 'lr': 0.000473065169847378, 'weight_decay': 0.000100159621745599, 'epochs': 45, 'loss': 'mae', 'optimizer': 'adam', 'graph_mode': 'cutoff', 'cutoff': 0.2682556222939125, 'grm_norm': 'gcn', 'self_loops': False, 'use_snp_selection': False}. Best is trial 138 with value: 0.28183798870429.
[I 2025-11-12 01:39:41,872] Trial 148 finished with value: 0.25706335980394035 and parameters: {'model_type': 'graphsage', 'hidden_dims': '[256, 128]', 'dropout': 0.46911767433330065, 'batch_norm': True, 'lr': 0.0002505287680330579, 'weight_decay': 8.370533181295309e-05, 'epochs': 60, 'loss': 'mae', 'optimizer': 'adam', 'graph_mode': 'cutoff', 'cutoff': 0.757613907387278, 'grm_norm': 'gcn', 'self_loops': False, 'use_snp_selection': False}. Best is trial 138 with value: 0.28183798870429.
[I 2025-11-12 01:40:42,714] Trial 149 finished with value: 0.25286001008954156 and parameters: {'model_type': 'graphsage', 'hidden_dims': '[256, 128]', 'dropout': 0.4593740169114046, 'batch_norm': True, 'lr': 0.00046330209002963985, 'weight_decay': 2.580589530517836e-05, 'epochs': 68, 'loss': 'mae', 'optimizer': 'adam', 'graph_mode': 'knn', 'source': 'grm', 'knn_k': 2, 'weighted_edges': True, 'symmetrize_mode': 'mutual', 'use_snp_selection': True, 'num_snps': 16718}. Best is trial 138 with value: 0.28183798870429.
[I 2025-11-12 01:43:19,866] Trial 0 finished with value: 0.14309443656420134 and parameters: {'model_type': 'graphsage', 'hidden_dims': '[128, 64]', 'dropout': 0.199031432379812, 'batch_norm': True, 'lr': 1.8408544111075837e-06, 'weight_decay': 5.5136510071208614e-05, 'epochs': 336, 'loss': 'mae', 'optimizer': 'adam', 'graph_mode': 'knn', 'source': 'grm', 'knn_k': 8, 'weighted_edges': True, 'symmetrize_mode': 'mutual', 'use_snp_selection': False}. Best is trial 0 with value: 0.14309443656420134.
[I 2025-11-12 01:44:14,450] Trial 1 finished with value: 0.2196206972918741 and parameters: {'model_type': 'graphsage', 'hidden_dims': '[128, 64]', 'dropout': 0.40051947670227217, 'batch_norm': True, 'lr': 0.0005320428882732732, 'weight_decay': 1.89210117736594e-06, 'epochs': 68, 'loss': 'mse', 'optimizer': 'adam', 'graph_mode': 'knn', 'source': 'grm', 'knn_k': 7, 'weighted_edges': True, 'symmetrize_mode': 'union', 'use_snp_selection': False}. Best is trial 1 with value: 0.2196206972918741.
[I 2025-11-12 01:45:38,731] Trial 2 finished with value: 0.15594136210710402 and parameters: {'model_type': 'graphsage', 'hidden_dims': '[256, 128]', 'dropout': 0.5105528289184642, 'batch_norm': False, 'lr': 0.0006804279372404962, 'weight_decay': 0.0008922815224257085, 'epochs': 181, 'loss': 'mse', 'optimizer': 'adam', 'graph_mode': 'cutoff', 'cutoff': 0.5741905641612706, 'grm_norm': 'gcn', 'self_loops': False, 'use_snp_selection': True, 'num_snps': 26910}. Best is trial 1 with value: 0.2196206972918741.
[I 2025-11-12 01:47:14,776] Trial 3 finished with value: 0.20743269931535419 and parameters: {'model_type': 'graphsage', 'hidden_dims': '[256, 128, 64]', 'dropout': 0.5390483213624292, 'batch_norm': False, 'lr': 3.4705625989073525e-05, 'weight_decay': 2.4623319020131338e-05, 'epochs': 121, 'loss': 'mse', 'optimizer': 'adam', 'graph_mode': 'knn', 'source': 'grm', 'knn_k': 6, 'weighted_edges': False, 'symmetrize_mode': 'mutual', 'use_snp_selection': True, 'num_snps': 30713}. Best is trial 1 with value: 0.2196206972918741.
[I 2025-11-12 01:48:26,633] Trial 4 finished with value: 0.23427965175039037 and parameters: {'model_type': 'graphsage', 'hidden_dims': '[128, 64]', 'dropout': 0.13404863676897502, 'batch_norm': False, 'lr': 0.0001431556295367288, 'weight_decay': 2.2084517750726675e-05, 'epochs': 51, 'loss': 'mae', 'optimizer': 'adam', 'graph_mode': 'cutoff', 'cutoff': 0.6714268476993044, 'grm_norm': 'none', 'self_loops': False, 'use_snp_selection': True, 'num_snps': 45645}. Best is trial 4 with value: 0.23427965175039037.
[I 2025-11-12 01:50:12,364] Trial 5 finished with value: 0.23034184621413928 and parameters: {'model_type': 'graphsage', 'hidden_dims': '[256, 128]', 'dropout': 0.42253606323412096, 'batch_norm': False, 'lr': 4.238630400638805e-05, 'weight_decay': 8.074086040046576e-07, 'epochs': 158, 'loss': 'mae', 'optimizer': 'adam', 'graph_mode': 'knn', 'source': 'grm', 'knn_k': 1, 'weighted_edges': False, 'symmetrize_mode': 'mutual', 'use_snp_selection': True, 'num_snps': 43113}. Best is trial 4 with value: 0.23427965175039037.
[I 2025-11-12 01:52:57,319] Trial 6 finished with value: 0.22171958229806843 and parameters: {'model_type': 'graphsage', 'hidden_dims': '[512, 256]', 'dropout': 0.3534893146320237, 'batch_norm': True, 'lr': 0.000251307964226932, 'weight_decay': 1.821819791794022e-05, 'epochs': 223, 'loss': 'mae', 'optimizer': 'adam', 'graph_mode': 'knn', 'source': 'grm', 'knn_k': 1, 'weighted_edges': True, 'symmetrize_mode': 'mutual', 'use_snp_selection': False}. Best is trial 4 with value: 0.23427965175039037.
[I 2025-11-12 01:55:17,458] Trial 7 finished with value: 0.21448028892282212 and parameters: {'model_type': 'graphsage', 'hidden_dims': '[512, 256]', 'dropout': 0.1105825955860775, 'batch_norm': True, 'lr': 2.374338412754043e-05, 'weight_decay': 1.1284721123340274e-05, 'epochs': 190, 'loss': 'mse', 'optimizer': 'adam', 'graph_mode': 'cutoff', 'cutoff': 0.719872204109604, 'grm_norm': 'gcn', 'self_loops': False, 'use_snp_selection': False}. Best is trial 4 with value: 0.23427965175039037.
[I 2025-11-12 01:57:14,221] Trial 8 finished with value: 0.23111075588788194 and parameters: {'model_type': 'graphsage', 'hidden_dims': '[512, 128]', 'dropout': 0.5066580418354021, 'batch_norm': True, 'lr': 0.00039213678276659976, 'weight_decay': 3.43655320802934e-06, 'epochs': 120, 'loss': 'mse', 'optimizer': 'adam', 'graph_mode': 'cutoff', 'cutoff': 0.34923059576505366, 'grm_norm': 'cosine', 'self_loops': True, 'use_snp_selection': False}. Best is trial 4 with value: 0.23427965175039037.
[I 2025-11-12 01:58:34,880] Trial 9 finished with value: 0.2173510197336012 and parameters: {'model_type': 'graphsage', 'hidden_dims': '[512, 256]', 'dropout': 0.301734920240333, 'batch_norm': False, 'lr': 6.650961854953448e-06, 'weight_decay': 6.861575656590315e-05, 'epochs': 150, 'loss': 'mae', 'optimizer': 'adam', 'graph_mode': 'cutoff', 'cutoff': 0.2857569870061939, 'grm_norm': 'cosine_then_gcn', 'self_loops': False, 'use_snp_selection': True, 'num_snps': 12722}. Best is trial 4 with value: 0.23427965175039037.
[I 2025-11-12 02:00:15,641] Trial 10 finished with value: 0.0588824546702975 and parameters: {'model_type': 'graphsage', 'hidden_dims': '[512, 64]', 'dropout': 0.22492338276159776, 'batch_norm': False, 'lr': 0.00014233761188460356, 'weight_decay': 1.8772904431456567e-07, 'epochs': 41, 'loss': 'mae', 'optimizer': 'adam', 'graph_mode': 'cutoff', 'cutoff': 0.8740100033033124, 'grm_norm': 'none', 'self_loops': True, 'use_snp_selection': True, 'num_snps': 58960}. Best is trial 4 with value: 0.23427965175039037.
[I 2025-11-12 02:01:59,549] Trial 11 finished with value: 0.22119401008447706 and parameters: {'model_type': 'graphsage', 'hidden_dims': '[512, 128]', 'dropout': 0.5943244604783169, 'batch_norm': True, 'lr': 0.00022678321371763163, 'weight_decay': 1.7907629222345464e-06, 'epochs': 94, 'loss': 'mse', 'optimizer': 'adam', 'graph_mode': 'cutoff', 'cutoff': 0.2962190508493978, 'grm_norm': 'cosine', 'self_loops': True, 'use_snp_selection': False}. Best is trial 4 with value: 0.23427965175039037.
[I 2025-11-12 02:06:33,008] Trial 12 finished with value: 0.22111875429796496 and parameters: {'model_type': 'graphsage', 'hidden_dims': '[512, 128]', 'dropout': 0.48177341517384403, 'batch_norm': True, 'lr': 0.00011120232078697283, 'weight_decay': 0.00028303623505598777, 'epochs': 254, 'loss': 'mse', 'optimizer': 'adam', 'graph_mode': 'cutoff', 'cutoff': 0.48181782223539704, 'grm_norm': 'cosine', 'self_loops': True, 'use_snp_selection': True, 'num_snps': 53389}. Best is trial 4 with value: 0.23427965175039037.
[I 2025-11-12 02:08:06,444] Trial 13 finished with value: 0.13456828483310215 and parameters: {'model_type': 'graphsage', 'hidden_dims': '[512, 128]', 'dropout': 0.13503330426954757, 'batch_norm': False, 'lr': 0.0009737420347470426, 'weight_decay': 3.9084467537793925e-06, 'epochs': 100, 'loss': 'mae', 'optimizer': 'adam', 'graph_mode': 'cutoff', 'cutoff': 0.4773775536648144, 'grm_norm': 'none', 'self_loops': True, 'use_snp_selection': False}. Best is trial 4 with value: 0.23427965175039037.
[I 2025-11-12 02:09:14,666] Trial 14 finished with value: 0.2400685449657995 and parameters: {'model_type': 'graphsage', 'hidden_dims': '[128, 64]', 'dropout': 0.2775121090395169, 'batch_norm': False, 'lr': 7.324298401379444e-05, 'weight_decay': 3.826299217360769e-07, 'epochs': 43, 'loss': 'mse', 'optimizer': 'adam', 'graph_mode': 'cutoff', 'cutoff': 0.6586941310443425, 'grm_norm': 'none', 'self_loops': False, 'use_snp_selection': True, 'num_snps': 42499}. Best is trial 14 with value: 0.2400685449657995.
[I 2025-11-12 02:10:24,226] Trial 15 finished with value: 0.2427388530519657 and parameters: {'model_type': 'graphsage', 'hidden_dims': '[128, 64]', 'dropout': 0.25409131021422954, 'batch_norm': False, 'lr': 7.22632211160111e-05, 'weight_decay': 1.7114848211498188e-07, 'epochs': 55, 'loss': 'mae', 'optimizer': 'adam', 'graph_mode': 'cutoff', 'cutoff': 0.6908417343921863, 'grm_norm': 'none', 'self_loops': False, 'use_snp_selection': True, 'num_snps': 42513}. Best is trial 15 with value: 0.2427388530519657.
[I 2025-11-12 02:11:58,771] Trial 16 finished with value: 0.20630462344741235 and parameters: {'model_type': 'graphsage', 'hidden_dims': '[128, 64]', 'dropout': 0.27191537571234997, 'batch_norm': False, 'lr': 1.1782586308270228e-05, 'weight_decay': 2.0535814099673041e-07, 'epochs': 297, 'loss': 'mse', 'optimizer': 'adam', 'graph_mode': 'cutoff', 'cutoff': 0.7778330127562771, 'grm_norm': 'none', 'self_loops': False, 'use_snp_selection': True, 'num_snps': 36110}. Best is trial 15 with value: 0.2427388530519657.
[I 2025-11-12 02:12:55,638] Trial 17 finished with value: 0.2317552723875556 and parameters: {'model_type': 'graphsage', 'hidden_dims': '[128, 64]', 'dropout': 0.21535591796920178, 'batch_norm': False, 'lr': 6.013866380031043e-05, 'weight_decay': 4.374107799934137e-07, 'epochs': 67, 'loss': 'mae', 'optimizer': 'adam', 'graph_mode': 'cutoff', 'cutoff': 0.6081803309027821, 'grm_norm': 'none', 'self_loops': False, 'use_snp_selection': True, 'num_snps': 20291}. Best is trial 15 with value: 0.2427388530519657.
[I 2025-11-12 02:14:42,194] Trial 18 finished with value: 0.24038259801275635 and parameters: {'model_type': 'graphsage', 'hidden_dims': '[512, 64]', 'dropout': 0.3045189702444525, 'batch_norm': False, 'lr': 1.3967454683621258e-05, 'weight_decay': 5.510758464862352e-07, 'epochs': 87, 'loss': 'mae', 'optimizer': 'adam', 'graph_mode': 'cutoff', 'cutoff': 0.8240814684048325, 'grm_norm': 'cosine_then_gcn', 'self_loops': False, 'use_snp_selection': True, 'num_snps': 44481}. Best is trial 15 with value: 0.2427388530519657.
[I 2025-11-12 02:16:38,982] Trial 19 finished with value: 0.23180926748004188 and parameters: {'model_type': 'graphsage', 'hidden_dims': '[512, 64]', 'dropout': 0.3385954852851283, 'batch_norm': False, 'lr': 4.4812936612874436e-06, 'weight_decay': 7.391097453311152e-07, 'epochs': 92, 'loss': 'mae', 'optimizer': 'adam', 'graph_mode': 'cutoff', 'cutoff': 0.8891370257572954, 'grm_norm': 'cosine_then_gcn', 'self_loops': False, 'use_snp_selection': True, 'num_snps': 49258}. Best is trial 15 with value: 0.2427388530519657.
[I 2025-11-12 02:17:30,222] Trial 20 finished with value: 0.20563337713452512 and parameters: {'model_type': 'graphsage', 'hidden_dims': '[512, 64]', 'dropout': 0.178846288169674, 'batch_norm': False, 'lr': 1.5168740829362934e-05, 'weight_decay': 1.4419895513831678e-07, 'epochs': 147, 'loss': 'mae', 'optimizer': 'adam', 'graph_mode': 'cutoff', 'cutoff': 0.793390742797716, 'grm_norm': 'cosine_then_gcn', 'self_loops': False, 'use_snp_selection': True, 'num_snps': 2878}. Best is trial 15 with value: 0.2427388530519657.
[I 2025-11-12 02:18:43,044] Trial 21 finished with value: 0.2484728945141111 and parameters: {'model_type': 'graphsage', 'hidden_dims': '[256, 128, 64]', 'dropout': 0.2731107776310069, 'batch_norm': False, 'lr': 7.87133044623323e-05, 'weight_decay': 4.0259893895922514e-07, 'epochs': 42, 'loss': 'mae', 'optimizer': 'adam', 'graph_mode': 'cutoff', 'cutoff': 0.6811074960703483, 'grm_norm': 'cosine_then_gcn', 'self_loops': False, 'use_snp_selection': True, 'num_snps': 39516}. Best is trial 21 with value: 0.2484728945141111.
[I 2025-11-12 02:20:04,406] Trial 22 finished with value: 0.23573213678870206 and parameters: {'model_type': 'graphsage', 'hidden_dims': '[256, 128, 64]', 'dropout': 0.32195194040372804, 'batch_norm': False, 'lr': 2.1119710010662764e-05, 'weight_decay': 1.0719205634980658e-07, 'epochs': 77, 'loss': 'mae', 'optimizer': 'adam', 'graph_mode': 'cutoff', 'cutoff': 0.8047254661752418, 'grm_norm': 'cosine_then_gcn', 'self_loops': False, 'use_snp_selection': True, 'num_snps': 40745}. Best is trial 21 with value: 0.2484728945141111.
[I 2025-11-12 02:21:29,359] Trial 23 finished with value: 0.24561075326016174 and parameters: {'model_type': 'graphsage', 'hidden_dims': '[256, 128, 64]', 'dropout': 0.2635601258551538, 'batch_norm': False, 'lr': 5.657832489870996e-06, 'weight_decay': 5.044303843144968e-07, 'epochs': 112, 'loss': 'mae', 'optimizer': 'adam', 'graph_mode': 'cutoff', 'cutoff': 0.7228779027399905, 'grm_norm': 'cosine_then_gcn', 'self_loops': False, 'use_snp_selection': True, 'num_snps': 36988}. Best is trial 21 with value: 0.2484728945141111.
