[I 2025-10-20 19:39:44,182] Trial 39 finished with value: 0.2716230464692288 and parameters: {'model_type': 'gat', 'hidden_dims': '[512, 64]', 'dropout': 0.4567856546258868, 'batch_norm': False, 'gat_heads': 3, 'gat_attn_dropout': 0.457947019776391, 'gat_concat_hidden': False, 'lr': 0.0005153527633879617, 'weight_decay': 0.0009816029296718213, 'epochs': 129, 'loss': 'mae', 'optimizer': 'adam', 'graph_mode': 'cutoff', 'cutoff': 0.7352821681853476, 'grm_norm': 'gcn', 'self_loops': True}. Best is trial 39 with value: 0.2716230464692288.
[I 2025-10-20 19:41:26,307] Trial 40 finished with value: 0.2430212239675324 and parameters: {'model_type': 'gat', 'hidden_dims': '[512, 64]', 'dropout': 0.46266150324381733, 'batch_norm': True, 'gat_heads': 2, 'gat_attn_dropout': 0.4428801607572403, 'gat_concat_hidden': False, 'lr': 0.0004811921172182447, 'weight_decay': 0.0007902160051521551, 'epochs': 161, 'loss': 'mae', 'optimizer': 'adam', 'graph_mode': 'cutoff', 'cutoff': 0.7455760551954769, 'grm_norm': 'gcn', 'self_loops': True}. Best is trial 39 with value: 0.2716230464692288.
[I 2025-10-20 19:43:09,596] Trial 41 finished with value: 0.23552056142060335 and parameters: {'model_type': 'gat', 'hidden_dims': '[512, 64]', 'dropout': 0.4662036442648848, 'batch_norm': True, 'gat_heads': 2, 'gat_attn_dropout': 0.45596061048306785, 'gat_concat_hidden': False, 'lr': 0.00043943793386409287, 'weight_decay': 0.0009313915330214261, 'epochs': 163, 'loss': 'mae', 'optimizer': 'adam', 'graph_mode': 'cutoff', 'cutoff': 0.7438743539840497, 'grm_norm': 'gcn', 'self_loops': True}. Best is trial 39 with value: 0.2716230464692288.
[I 2025-10-20 19:45:16,696] Trial 42 finished with value: 0.25367120087363404 and parameters: {'model_type': 'gat', 'hidden_dims': '[512, 64]', 'dropout': 0.4665159349435225, 'batch_norm': True, 'gat_heads': 2, 'gat_attn_dropout': 0.45394660313329543, 'gat_concat_hidden': False, 'lr': 0.0005101919526062139, 'weight_decay': 0.0009323256183420593, 'epochs': 204, 'loss': 'mae', 'optimizer': 'adam', 'graph_mode': 'cutoff', 'cutoff': 0.7381790374628012, 'grm_norm': 'gcn', 'self_loops': True}. Best is trial 39 with value: 0.2716230464692288.
[I 2025-10-20 19:47:24,895] Trial 43 finished with value: 0.24597927331721117 and parameters: {'model_type': 'gat', 'hidden_dims': '[512, 64]', 'dropout': 0.5952901596765774, 'batch_norm': True, 'gat_heads': 2, 'gat_attn_dropout': 0.44260938340258943, 'gat_concat_hidden': False, 'lr': 0.0006738349418422536, 'weight_decay': 0.00048491224441447395, 'epochs': 206, 'loss': 'mae', 'optimizer': 'adam', 'graph_mode': 'cutoff', 'cutoff': 0.7243904038552619, 'grm_norm': 'gcn', 'self_loops': True}. Best is trial 39 with value: 0.2716230464692288.
[I 2025-10-20 19:48:34,866] Trial 44 finished with value: 0.18763643056809967 and parameters: {'model_type': 'gat', 'hidden_dims': '[512, 64]', 'dropout': 0.5948662903864346, 'batch_norm': True, 'gat_heads': 1, 'gat_attn_dropout': 0.5417700754492087, 'gat_concat_hidden': False, 'lr': 0.0007364897843853963, 'weight_decay': 0.0004919026753620904, 'epochs': 208, 'loss': 'mae', 'optimizer': 'adam', 'graph_mode': 'cutoff', 'cutoff': 0.7188224616080502, 'grm_norm': 'gcn', 'self_loops': True}. Best is trial 39 with value: 0.2716230464692288.
[I 2025-10-20 19:51:48,505] Trial 45 finished with value: 0.16377527778250425 and parameters: {'model_type': 'gat', 'hidden_dims': '[512, 64]', 'dropout': 0.5612022031031381, 'batch_norm': True, 'gat_heads': 3, 'gat_attn_dropout': 0.36387944054427657, 'gat_concat_hidden': False, 'lr': 0.00022686960089149185, 'weight_decay': 0.00036179648848507927, 'epochs': 211, 'loss': 'mae', 'optimizer': 'adam', 'graph_mode': 'cutoff', 'cutoff': 0.6865457674512879, 'grm_norm': 'gcn', 'self_loops': True}. Best is trial 39 with value: 0.2716230464692288.
[I 2025-10-20 19:54:11,029] Trial 46 finished with value: 0.22403159651781288 and parameters: {'model_type': 'gat', 'hidden_dims': '[512, 64]', 'dropout': 0.5166309712148149, 'batch_norm': True, 'gat_heads': 2, 'gat_attn_dropout': 0.49956787650948553, 'gat_concat_hidden': False, 'lr': 0.0006846861085909995, 'weight_decay': 3.2798848106355273e-07, 'epochs': 231, 'loss': 'mse', 'optimizer': 'adam', 'graph_mode': 'cutoff', 'cutoff': 0.8216911738137151, 'grm_norm': 'gcn', 'self_loops': True}. Best is trial 39 with value: 0.2716230464692288.
[I 2025-10-20 19:56:22,133] Trial 47 finished with value: 0.19363186763693208 and parameters: {'model_type': 'gat', 'hidden_dims': '[512, 64]', 'dropout': 0.5741258584815638, 'batch_norm': True, 'gat_heads': 3, 'gat_attn_dropout': 0.43357163816041033, 'gat_concat_hidden': False, 'lr': 0.0003858029629280062, 'weight_decay': 0.0009876115207456304, 'epochs': 138, 'loss': 'mae', 'optimizer': 'adam', 'graph_mode': 'cutoff', 'cutoff': 0.6295435120625741, 'grm_norm': 'gcn', 'self_loops': True}. Best is trial 39 with value: 0.2716230464692288.
[I 2025-10-20 19:57:24,453] Trial 48 finished with value: 0.18779182053521984 and parameters: {'model_type': 'gat', 'hidden_dims': '[512, 64]', 'dropout': 0.4885809395973342, 'batch_norm': True, 'gat_heads': 1, 'gat_attn_dropout': 0.3653977296759775, 'gat_concat_hidden': False, 'lr': 0.00023671864115408544, 'weight_decay': 0.00046821740764245396, 'epochs': 183, 'loss': 'mae', 'optimizer': 'adam', 'graph_mode': 'cutoff', 'cutoff': 0.7986867387034694, 'grm_norm': 'gcn', 'self_loops': True}. Best is trial 39 with value: 0.2716230464692288.
[I 2025-10-20 19:59:30,287] Trial 49 finished with value: 0.23450658899608984 and parameters: {'model_type': 'gat', 'hidden_dims': '[512, 64]', 'dropout': 0.2754149947844989, 'batch_norm': True, 'gat_heads': 2, 'gat_attn_dropout': 0.48205020415450717, 'gat_concat_hidden': False, 'lr': 0.0006704758112306586, 'weight_decay': 0.0003057464280490823, 'epochs': 202, 'loss': 'mae', 'optimizer': 'adam', 'graph_mode': 'cutoff', 'cutoff': 0.6396107555148827, 'grm_norm': 'gcn', 'self_loops': True}. Best is trial 39 with value: 0.2716230464692288.
[I 2025-10-20 20:01:41,804] Trial 50 finished with value: 0.2581553401613433 and parameters: {'model_type': 'gat', 'hidden_dims': '[256, 128, 64]', 'dropout': 0.5294635174587603, 'batch_norm': True, 'gat_heads': 3, 'gat_attn_dropout': 0.5380175894562566, 'gat_concat_hidden': False, 'lr': 0.0009509217104949111, 'weight_decay': 0.0006631630103599385, 'epochs': 243, 'loss': 'mae', 'optimizer': 'adam', 'graph_mode': 'cutoff', 'cutoff': 0.8992837380343205, 'grm_norm': 'gcn', 'self_loops': True}. Best is trial 39 with value: 0.2716230464692288.
[I 2025-10-20 20:03:43,340] Trial 51 finished with value: 0.2562639430426635 and parameters: {'model_type': 'gat', 'hidden_dims': '[256, 128, 64]', 'dropout': 0.5362967052100212, 'batch_norm': True, 'gat_heads': 3, 'gat_attn_dropout': 0.5436072155088321, 'gat_concat_hidden': False, 'lr': 0.0008563974932168806, 'weight_decay': 0.0006490665942953457, 'epochs': 223, 'loss': 'mae', 'optimizer': 'adam', 'graph_mode': 'cutoff', 'cutoff': 0.8864663168288323, 'grm_norm': 'gcn', 'self_loops': True}. Best is trial 39 with value: 0.2716230464692288.
[I 2025-10-20 20:05:55,946] Trial 52 finished with value: 0.25751672774903467 and parameters: {'model_type': 'gat', 'hidden_dims': '[256, 128, 64]', 'dropout': 0.5231514933421872, 'batch_norm': True, 'gat_heads': 3, 'gat_attn_dropout': 0.5412622734722858, 'gat_concat_hidden': False, 'lr': 0.000993212364811413, 'weight_decay': 0.000679440583500463, 'epochs': 245, 'loss': 'mae', 'optimizer': 'adam', 'graph_mode': 'cutoff', 'cutoff': 0.8954465114503823, 'grm_norm': 'gcn', 'self_loops': True}. Best is trial 39 with value: 0.2716230464692288.
[I 2025-10-20 20:08:10,603] Trial 53 finished with value: 0.24298961343703226 and parameters: {'model_type': 'gat', 'hidden_dims': '[256, 128, 64]', 'dropout': 0.5438858319879063, 'batch_norm': True, 'gat_heads': 3, 'gat_attn_dropout': 0.5580911434990374, 'gat_concat_hidden': False, 'lr': 0.0008008723486369736, 'weight_decay': 0.0006677592814244993, 'epochs': 249, 'loss': 'mae', 'optimizer': 'adam', 'graph_mode': 'cutoff', 'cutoff': 0.8964356348617936, 'grm_norm': 'cosine', 'self_loops': True}. Best is trial 39 with value: 0.2716230464692288.
[I 2025-10-20 20:10:11,587] Trial 54 finished with value: 0.149555865051205 and parameters: {'model_type': 'gat', 'hidden_dims': '[256, 128, 64]', 'dropout': 0.5222865834973061, 'batch_norm': True, 'gat_heads': 3, 'gat_attn_dropout': 0.5409017361000653, 'gat_concat_hidden': False, 'lr': 0.0009995822386731682, 'weight_decay': 3.2128460859524718e-06, 'epochs': 222, 'loss': 'mae', 'optimizer': 'adam', 'graph_mode': 'cutoff', 'cutoff': 0.8253584237124455, 'grm_norm': 'gcn', 'self_loops': True}. Best is trial 39 with value: 0.2716230464692288.
[I 2025-10-20 20:12:23,116] Trial 55 finished with value: 0.18390890784966976 and parameters: {'model_type': 'gat', 'hidden_dims': '[256, 128, 64]', 'dropout': 0.5093365525155071, 'batch_norm': True, 'gat_heads': 3, 'gat_attn_dropout': 0.5930143990792488, 'gat_concat_hidden': False, 'lr': 0.0003397254865451513, 'weight_decay': 0.0006625740229536623, 'epochs': 243, 'loss': 'mae', 'optimizer': 'adam', 'graph_mode': 'cutoff', 'cutoff': 0.8965611678040064, 'grm_norm': 'gcn', 'self_loops': True}. Best is trial 39 with value: 0.2716230464692288.
[I 2025-10-20 20:15:08,828] Trial 56 finished with value: 0.22665025128333172 and parameters: {'model_type': 'gat', 'hidden_dims': '[256, 128, 64]', 'dropout': 0.5671789659902478, 'batch_norm': True, 'gat_heads': 4, 'gat_attn_dropout': 0.564803130450957, 'gat_concat_hidden': False, 'lr': 0.00016746985713294807, 'weight_decay': 0.0004125743270934608, 'epochs': 265, 'loss': 'mae', 'optimizer': 'adam', 'graph_mode': 'cutoff', 'cutoff': 0.8095389699130624, 'grm_norm': 'gcn', 'self_loops': True}. Best is trial 39 with value: 0.2716230464692288.
[I 2025-10-20 20:17:10,189] Trial 57 finished with value: 0.2463547571403352 and parameters: {'model_type': 'gat', 'hidden_dims': '[256, 128, 64]', 'dropout': 0.48717153621550646, 'batch_norm': True, 'gat_heads': 3, 'gat_attn_dropout': 0.5273648844944816, 'gat_concat_hidden': False, 'lr': 0.0005808846112553777, 'weight_decay': 0.00026132141879416207, 'epochs': 223, 'loss': 'mae', 'optimizer': 'adam', 'graph_mode': 'cutoff', 'cutoff': 0.8579318214792586, 'grm_norm': 'gcn', 'self_loops': True}. Best is trial 39 with value: 0.2716230464692288.
[I 2025-10-20 20:19:19,988] Trial 58 finished with value: 0.02734934127748139 and parameters: {'model_type': 'gat', 'hidden_dims': '[256, 128, 64]', 'dropout': 0.543385354033232, 'batch_norm': True, 'gat_heads': 3, 'gat_attn_dropout': 0.5130975024812349, 'gat_concat_hidden': False, 'lr': 1.544359083588279e-06, 'weight_decay': 0.0006754532488337397, 'epochs': 239, 'loss': 'mae', 'optimizer': 'adam', 'graph_mode': 'cutoff', 'cutoff': 0.781893669041006, 'grm_norm': 'gcn', 'self_loops': True}. Best is trial 39 with value: 0.2716230464692288.
[I 2025-10-20 20:22:04,302] Trial 59 finished with value: 0.23664573979892647 and parameters: {'model_type': 'gat', 'hidden_dims': '[256, 128, 64]', 'dropout': 0.4404486995099306, 'batch_norm': False, 'gat_heads': 4, 'gat_attn_dropout': 0.47351659551471403, 'gat_concat_hidden': False, 'lr': 0.000388738384563184, 'weight_decay': 0.00020961801528584077, 'epochs': 268, 'loss': 'mae', 'optimizer': 'adam', 'graph_mode': 'cutoff', 'cutoff': 0.8550731311525591, 'grm_norm': 'gcn', 'self_loops': True}. Best is trial 39 with value: 0.2716230464692288.
[I 2025-10-20 20:25:04,654] Trial 60 finished with value: 0.09535250535691778 and parameters: {'model_type': 'gat', 'hidden_dims': '[256, 128, 64]', 'dropout': 0.5280152503427553, 'batch_norm': False, 'gat_heads': 4, 'gat_attn_dropout': 0.41464172210386085, 'gat_concat_hidden': False, 'lr': 0.0009939311418502286, 'weight_decay': 0.0003087682669834649, 'epochs': 297, 'loss': 'mse', 'optimizer': 'adam', 'graph_mode': 'cutoff', 'cutoff': 0.8878569334022749, 'grm_norm': 'cosine', 'self_loops': True}. Best is trial 39 with value: 0.2716230464692288.
[I 2025-10-20 20:26:10,283] Trial 61 finished with value: 0.2599577300804275 and parameters: {'model_type': 'gat', 'hidden_dims': '[256, 128]', 'dropout': 0.4562990908828186, 'batch_norm': True, 'gat_heads': 2, 'gat_attn_dropout': 0.5734208219698255, 'gat_concat_hidden': False, 'lr': 0.0005079095824754294, 'weight_decay': 0.0009473090648233869, 'epochs': 194, 'loss': 'mae', 'optimizer': 'adam', 'graph_mode': 'cutoff', 'cutoff': 0.7788617837707179, 'grm_norm': 'gcn', 'self_loops': True}. Best is trial 39 with value: 0.2716230464692288.
[I 2025-10-20 20:26:57,967] Trial 62 finished with value: 0.24768837745135194 and parameters: {'model_type': 'gat', 'hidden_dims': '[256, 128]', 'dropout': 0.4063392260075959, 'batch_norm': True, 'gat_heads': 2, 'gat_attn_dropout': 0.5740416541768799, 'gat_concat_hidden': False, 'lr': 0.0005815700201407898, 'weight_decay': 0.0006463258801292699, 'epochs': 136, 'loss': 'mae', 'optimizer': 'adam', 'graph_mode': 'cutoff', 'cutoff': 0.797181261321816, 'grm_norm': 'none', 'self_loops': True}. Best is trial 39 with value: 0.2716230464692288.
[I 2025-10-20 20:27:20,232] Trial 63 finished with value: 0.24399761471748374 and parameters: {'model_type': 'gat', 'hidden_dims': '[256, 128]', 'dropout': 0.4513598980963818, 'batch_norm': True, 'gat_heads': 1, 'gat_attn_dropout': 0.523505362924274, 'gat_concat_hidden': False, 'lr': 0.0008179773104230846, 'weight_decay': 0.0009688050254253622, 'epochs': 102, 'loss': 'mae', 'optimizer': 'adam', 'graph_mode': 'cutoff', 'cutoff': 0.8378608971183318, 'grm_norm': 'gcn', 'self_loops': True}. Best is trial 39 with value: 0.2716230464692288.
[I 2025-10-20 20:29:03,556] Trial 64 finished with value: 0.22640640204772117 and parameters: {'model_type': 'gat', 'hidden_dims': '[256, 128]', 'dropout': 0.3704035663335256, 'batch_norm': True, 'gat_heads': 3, 'gat_attn_dropout': 0.4861446580842, 'gat_concat_hidden': False, 'lr': 0.00022325102663992027, 'weight_decay': 0.0004924797483334181, 'epochs': 192, 'loss': 'mae', 'optimizer': 'adam', 'graph_mode': 'cutoff', 'cutoff': 0.8999232411826519, 'grm_norm': 'gcn', 'self_loops': True}. Best is trial 39 with value: 0.2716230464692288.
[I 2025-10-20 20:31:10,944] Trial 65 finished with value: 0.21263089390515705 and parameters: {'model_type': 'gat', 'hidden_dims': '[256, 128, 64]', 'dropout': 0.35328718468877596, 'batch_norm': True, 'gat_heads': 3, 'gat_attn_dropout': 0.3267039529738043, 'gat_concat_hidden': False, 'lr': 0.0004462556367532765, 'weight_decay': 0.0007368939549958426, 'epochs': 234, 'loss': 'mae', 'optimizer': 'adam', 'graph_mode': 'cutoff', 'cutoff': 0.7847551696764004, 'grm_norm': 'gcn', 'self_loops': True}. Best is trial 39 with value: 0.2716230464692288.
[I 2025-10-20 20:32:21,961] Trial 66 finished with value: 0.0 and parameters: {'model_type': 'gat', 'hidden_dims': '[256, 128]', 'dropout': 0.4971633512631423, 'batch_norm': False, 'gat_heads': 2, 'gat_attn_dropout': 0.5457934887393869, 'gat_concat_hidden': False, 'lr': 0.0003095720336067453, 'weight_decay': 0.0003932593348434494, 'epochs': 219, 'loss': 'mae', 'optimizer': 'adam', 'graph_mode': 'cutoff', 'cutoff': 0.8600705817272113, 'grm_norm': 'cosine_then_gcn', 'self_loops': False}. Best is trial 39 with value: 0.2716230464692288.
[I 2025-10-20 20:34:58,444] Trial 67 finished with value: 0.08309898313925479 and parameters: {'model_type': 'gat', 'hidden_dims': '[256, 128, 64]', 'dropout': 0.42245294896988317, 'batch_norm': False, 'gat_heads': 4, 'gat_attn_dropout': 0.5814574656188816, 'gat_concat_hidden': False, 'lr': 0.0006038103273419412, 'weight_decay': 0.00015074658050798028, 'epochs': 255, 'loss': 'mae', 'optimizer': 'adam', 'graph_mode': 'cutoff', 'cutoff': 0.8504365888810996, 'grm_norm': 'none', 'self_loops': False}. Best is trial 39 with value: 0.2716230464692288.
[I 2025-10-20 20:35:42,027] Trial 68 finished with value: 0.14218190191155328 and parameters: {'model_type': 'gat', 'hidden_dims': '[256, 128, 64]', 'dropout': 0.5744420420438314, 'batch_norm': True, 'gat_heads': 3, 'gat_attn_dropout': 0.49641867742651236, 'gat_concat_hidden': False, 'lr': 0.0003991661918996661, 'weight_decay': 9.451910969303056e-05, 'epochs': 71, 'loss': 'mae', 'optimizer': 'adam', 'graph_mode': 'cutoff', 'cutoff': 0.7811389186630194, 'grm_norm': 'gcn', 'self_loops': True}. Best is trial 39 with value: 0.2716230464692288.
[I 2025-10-20 20:36:25,309] Trial 69 finished with value: 0.23024836727384163 and parameters: {'model_type': 'gat', 'hidden_dims': '[128, 64]', 'dropout': 0.4760949699076593, 'batch_norm': False, 'gat_heads': 3, 'gat_attn_dropout': 0.2985743090752061, 'gat_concat_hidden': False, 'lr': 0.00015898899389841313, 'weight_decay': 0.0002651159129520135, 'epochs': 149, 'loss': 'mae', 'optimizer': 'adam', 'graph_mode': 'cutoff', 'cutoff': 0.4845359767934268, 'grm_norm': 'cosine_then_gcn', 'self_loops': True}. Best is trial 39 with value: 0.2716230464692288.
[I 2025-10-20 20:37:02,483] Trial 70 finished with value: 0.0 and parameters: {'model_type': 'gat', 'hidden_dims': '[256, 128]', 'dropout': 0.5310204877760236, 'batch_norm': False, 'gat_heads': 2, 'gat_attn_dropout': 0.5266947095471101, 'gat_concat_hidden': False, 'lr': 0.00025977594171790967, 'weight_decay': 0.0007346444569024871, 'epochs': 106, 'loss': 'mae', 'optimizer': 'adam', 'graph_mode': 'cutoff', 'cutoff': 0.8594078236344567, 'grm_norm': 'gcn', 'self_loops': False}. Best is trial 39 with value: 0.2716230464692288.
[I 2025-10-20 20:39:13,244] Trial 71 finished with value: 0.16244570685524853 and parameters: {'model_type': 'gat', 'hidden_dims': '[512, 64]', 'dropout': 0.3391489259648884, 'batch_norm': True, 'gat_heads': 2, 'gat_attn_dropout': 0.5984785711768585, 'gat_concat_hidden': False, 'lr': 0.0005007700484963944, 'weight_decay': 0.0009451027864584146, 'epochs': 198, 'loss': 'mae', 'optimizer': 'adam', 'graph_mode': 'cutoff', 'cutoff': 0.20517049434190548, 'grm_norm': 'gcn', 'self_loops': True}. Best is trial 39 with value: 0.2716230464692288.
[I 2025-10-20 20:39:57,768] Trial 72 finished with value: 0.19820818824274872 and parameters: {'model_type': 'gat', 'hidden_dims': '[512, 64]', 'dropout': 0.47716898646719275, 'batch_norm': True, 'gat_heads': 1, 'gat_attn_dropout': 0.46688807986706005, 'gat_concat_hidden': False, 'lr': 0.0008245795772964762, 'weight_decay': 0.0005563264167424038, 'epochs': 126, 'loss': 'mae', 'optimizer': 'adam', 'graph_mode': 'cutoff', 'cutoff': 0.6631097275495532, 'grm_norm': 'gcn', 'self_loops': True}. Best is trial 39 with value: 0.2716230464692288.
[I 2025-10-20 20:41:52,039] Trial 73 finished with value: 0.24929406844060575 and parameters: {'model_type': 'gat', 'hidden_dims': '[512, 64]', 'dropout': 0.5068439637869784, 'batch_norm': True, 'gat_heads': 2, 'gat_attn_dropout': 0.4199149844173982, 'gat_concat_hidden': False, 'lr': 0.0004956832908185222, 'weight_decay': 0.0009531232388842449, 'epochs': 182, 'loss': 'mae', 'optimizer': 'adam', 'graph_mode': 'cutoff', 'cutoff': 0.7532906005192461, 'grm_norm': 'gcn', 'self_loops': True}. Best is trial 39 with value: 0.2716230464692288.
[I 2025-10-20 20:44:33,202] Trial 74 finished with value: 0.20399032386916155 and parameters: {'model_type': 'gat', 'hidden_dims': '[512, 64]', 'dropout': 0.45775621313462, 'batch_norm': True, 'gat_heads': 3, 'gat_attn_dropout': 0.3796500557483545, 'gat_concat_hidden': False, 'lr': 0.00019467834805175083, 'weight_decay': 0.0005636580117340357, 'epochs': 173, 'loss': 'mae', 'optimizer': 'adam', 'graph_mode': 'cutoff', 'cutoff': 0.7068366867503147, 'grm_norm': 'gcn', 'self_loops': True}. Best is trial 39 with value: 0.2716230464692288.
[I 2025-10-20 20:46:49,973] Trial 75 finished with value: 0.20345093900460182 and parameters: {'model_type': 'gat', 'hidden_dims': '[256, 128, 64]', 'dropout': 0.550626295751963, 'batch_norm': True, 'gat_heads': 4, 'gat_attn_dropout': 0.5533091404610974, 'gat_concat_hidden': False, 'lr': 0.00034291735314328033, 'weight_decay': 0.0004138436091496825, 'epochs': 216, 'loss': 'mae', 'optimizer': 'adam', 'graph_mode': 'cutoff', 'cutoff': 0.7607550062753998, 'grm_norm': 'cosine', 'self_loops': True}. Best is trial 39 with value: 0.2716230464692288.
[I 2025-10-20 20:47:35,463] Trial 76 finished with value: 0.17288839880409987 and parameters: {'model_type': 'gat', 'hidden_dims': '[128, 64]', 'dropout': 0.4231396419641053, 'batch_norm': True, 'gat_heads': 2, 'gat_attn_dropout': 0.4589517650902354, 'gat_concat_hidden': False, 'lr': 6.022676215698616e-05, 'weight_decay': 0.0006826308181196694, 'epochs': 228, 'loss': 'mse', 'optimizer': 'adam', 'graph_mode': 'cutoff', 'cutoff': 0.5843293360119397, 'grm_norm': 'gcn', 'self_loops': True}. Best is trial 39 with value: 0.2716230464692288.
[I 2025-10-20 20:51:19,676] Trial 77 finished with value: 0.16074799999695413 and parameters: {'model_type': 'gat', 'hidden_dims': '[512, 64]', 'dropout': 0.39308460046099863, 'batch_norm': False, 'gat_heads': 3, 'gat_attn_dropout': 0.34190417531515144, 'gat_concat_hidden': False, 'lr': 0.0007750153866369749, 'weight_decay': 0.00019598776136516076, 'epochs': 251, 'loss': 'mae', 'optimizer': 'adam', 'graph_mode': 'cutoff', 'cutoff': 0.8263488631667582, 'grm_norm': 'gcn', 'self_loops': True}. Best is trial 39 with value: 0.2716230464692288.
[I 2025-10-20 20:53:00,835] Trial 78 finished with value: 0.20211381402844686 and parameters: {'model_type': 'gat', 'hidden_dims': '[512, 64]', 'dropout': 0.43844429716057515, 'batch_norm': True, 'gat_heads': 2, 'gat_attn_dropout': 0.514126197458529, 'gat_concat_hidden': False, 'lr': 2.730788550523955e-05, 'weight_decay': 0.0007941440099572859, 'epochs': 159, 'loss': 'mae', 'optimizer': 'adam', 'graph_mode': 'cutoff', 'cutoff': 0.871920536802699, 'grm_norm': 'none', 'self_loops': True}. Best is trial 39 with value: 0.2716230464692288.
