[I 2025-11-03 13:00:06,229] Trial 66 finished with value: 0.022155439805360843 and parameters: {'model_type': 'gcn', 'hidden_dims': '[512, 128]', 'dropout': 0.24734731680013458, 'batch_norm': True, 'lr': 0.00016120839231217638, 'weight_decay': 1.1296299512602797e-06, 'epochs': 64, 'loss': 'mae', 'optimizer': 'adam', 'graph_mode': 'cutoff', 'cutoff': 0.3903087878444299, 'grm_norm': 'cosine', 'self_loops': False, 'use_snp_selection': False}. Best is trial 29 with value: 0.0909837172005828.
[I 2025-11-03 13:00:07,639] Trial 67 finished with value: 0.043600068106580465 and parameters: {'model_type': 'gcn', 'hidden_dims': '[128, 64]', 'dropout': 0.3061043752392101, 'batch_norm': True, 'lr': 0.0005534573134248741, 'weight_decay': 2.142720645136611e-06, 'epochs': 120, 'loss': 'mse', 'optimizer': 'adam', 'graph_mode': 'cutoff', 'cutoff': 0.35337260148078803, 'grm_norm': 'cosine', 'self_loops': False, 'use_snp_selection': False}. Best is trial 29 with value: 0.0909837172005828.
[I 2025-11-03 13:00:09,474] Trial 68 finished with value: 0.059181039766633865 and parameters: {'model_type': 'gcn', 'hidden_dims': '[256, 128]', 'dropout': 0.5150384791598537, 'batch_norm': True, 'lr': 0.0003529602694722725, 'weight_decay': 7.511903102076347e-07, 'epochs': 157, 'loss': 'mse', 'optimizer': 'adam', 'graph_mode': 'knn', 'source': 'grm', 'knn_k': 7, 'weighted_edges': False, 'symmetrize_mode': 'union', 'use_snp_selection': False}. Best is trial 29 with value: 0.0909837172005828.
[I 2025-11-03 13:00:11,275] Trial 69 finished with value: -0.015141507634783256 and parameters: {'model_type': 'gcn', 'hidden_dims': '[256, 128]', 'dropout': 0.5174629826061368, 'batch_norm': True, 'lr': 1.4332102166917253e-05, 'weight_decay': 0.0009284540808322837, 'epochs': 147, 'loss': 'mae', 'optimizer': 'adam', 'graph_mode': 'knn', 'source': 'grm', 'knn_k': 7, 'weighted_edges': False, 'symmetrize_mode': 'union', 'use_snp_selection': False}. Best is trial 29 with value: 0.0909837172005828.
[I 2025-11-03 13:00:13,169] Trial 70 finished with value: 0.04016096508582737 and parameters: {'model_type': 'gcn', 'hidden_dims': '[256, 128]', 'dropout': 0.562501509512644, 'batch_norm': True, 'lr': 0.0007308627793845946, 'weight_decay': 4.15827784238873e-06, 'epochs': 175, 'loss': 'mse', 'optimizer': 'adam', 'graph_mode': 'knn', 'source': 'grm', 'knn_k': 5, 'weighted_edges': False, 'symmetrize_mode': 'union', 'use_snp_selection': False}. Best is trial 29 with value: 0.0909837172005828.
[I 2025-11-03 13:00:15,043] Trial 71 finished with value: 0.04428073805950821 and parameters: {'model_type': 'gcn', 'hidden_dims': '[256, 128]', 'dropout': 0.4537150227105133, 'batch_norm': True, 'lr': 0.00037948827802835087, 'weight_decay': 2.728625239357824e-07, 'epochs': 166, 'loss': 'mse', 'optimizer': 'adam', 'graph_mode': 'knn', 'source': 'grm', 'knn_k': 7, 'weighted_edges': False, 'symmetrize_mode': 'union', 'use_snp_selection': False}. Best is trial 29 with value: 0.0909837172005828.
[I 2025-11-03 13:00:16,658] Trial 72 finished with value: 0.04206720717970408 and parameters: {'model_type': 'gcn', 'hidden_dims': '[256, 128]', 'dropout': 0.47871784476509627, 'batch_norm': True, 'lr': 0.00028598828855080845, 'weight_decay': 7.397262241165464e-07, 'epochs': 106, 'loss': 'mse', 'optimizer': 'adam', 'graph_mode': 'knn', 'source': 'grm', 'knn_k': 8, 'weighted_edges': False, 'symmetrize_mode': 'union', 'use_snp_selection': False}. Best is trial 29 with value: 0.0909837172005828.
[I 2025-11-03 13:00:18,559] Trial 73 finished with value: 0.040058392953667026 and parameters: {'model_type': 'gcn', 'hidden_dims': '[512, 128]', 'dropout': 0.5163041515670956, 'batch_norm': True, 'lr': 0.0002060868762118376, 'weight_decay': 6.15949415827619e-07, 'epochs': 88, 'loss': 'mse', 'optimizer': 'adam', 'graph_mode': 'knn', 'source': 'grm', 'knn_k': 3, 'weighted_edges': False, 'symmetrize_mode': 'union', 'use_snp_selection': False}. Best is trial 29 with value: 0.0909837172005828.
[I 2025-11-03 13:00:20,402] Trial 74 finished with value: 0.04332688631698943 and parameters: {'model_type': 'gcn', 'hidden_dims': '[512, 128]', 'dropout': 0.5011452940088692, 'batch_norm': True, 'lr': 0.0004869097650442178, 'weight_decay': 9.408652465527946e-07, 'epochs': 77, 'loss': 'mse', 'optimizer': 'adam', 'graph_mode': 'knn', 'source': 'grm', 'knn_k': 6, 'weighted_edges': False, 'symmetrize_mode': 'union', 'use_snp_selection': False}. Best is trial 29 with value: 0.0909837172005828.
[I 2025-11-03 13:00:22,661] Trial 75 finished with value: 0.03682833590802394 and parameters: {'model_type': 'gcn', 'hidden_dims': '[256, 128, 64]', 'dropout': 0.5295626818041231, 'batch_norm': True, 'lr': 0.0003612327551000957, 'weight_decay': 2.1493087492930658e-07, 'epochs': 212, 'loss': 'mse', 'optimizer': 'adam', 'graph_mode': 'cutoff', 'cutoff': 0.23624576716757648, 'grm_norm': 'cosine', 'self_loops': False, 'use_snp_selection': False}. Best is trial 29 with value: 0.0909837172005828.
[I 2025-11-03 13:00:24,070] Trial 76 finished with value: 0.04062719672130044 and parameters: {'model_type': 'gcn', 'hidden_dims': '[128, 64]', 'dropout': 0.45982245024592827, 'batch_norm': False, 'lr': 0.00025022913472823007, 'weight_decay': 6.865529669847395e-06, 'epochs': 130, 'loss': 'mae', 'optimizer': 'adam', 'graph_mode': 'cutoff', 'cutoff': 0.29972742227600363, 'grm_norm': 'none', 'self_loops': True, 'use_snp_selection': True, 'num_snps': 5307}. Best is trial 29 with value: 0.0909837172005828.
[I 2025-11-03 13:00:25,432] Trial 77 finished with value: 0.059123403382074495 and parameters: {'model_type': 'gcn', 'hidden_dims': '[256, 128]', 'dropout': 0.19567276009699616, 'batch_norm': True, 'lr': 0.00016641257671050642, 'weight_decay': 3.559705952920518e-07, 'epochs': 37, 'loss': 'mse', 'optimizer': 'adam', 'graph_mode': 'knn', 'source': 'grm', 'knn_k': 5, 'weighted_edges': False, 'symmetrize_mode': 'union', 'use_snp_selection': False}. Best is trial 29 with value: 0.0909837172005828.
[I 2025-11-03 13:00:26,767] Trial 78 finished with value: -1.8796406778715584e-05 and parameters: {'model_type': 'gcn', 'hidden_dims': '[256, 128]', 'dropout': 0.20085688218830736, 'batch_norm': True, 'lr': 0.00015368301267351257, 'weight_decay': 1.279266007800842e-07, 'epochs': 35, 'loss': 'mse', 'optimizer': 'adam', 'graph_mode': 'knn', 'source': 'grm', 'knn_k': 5, 'weighted_edges': False, 'symmetrize_mode': 'union', 'use_snp_selection': False}. Best is trial 29 with value: 0.0909837172005828.
[I 2025-11-03 13:00:28,184] Trial 79 finished with value: 0.05270972446341923 and parameters: {'model_type': 'gcn', 'hidden_dims': '[256, 128]', 'dropout': 0.16097011813564255, 'batch_norm': True, 'lr': 6.721076611738371e-05, 'weight_decay': 1.6936154396895777e-06, 'epochs': 59, 'loss': 'mse', 'optimizer': 'adam', 'graph_mode': 'knn', 'source': 'grm', 'knn_k': 3, 'weighted_edges': False, 'symmetrize_mode': 'union', 'use_snp_selection': False}. Best is trial 29 with value: 0.0909837172005828.
[I 2025-11-03 13:00:29,524] Trial 80 finished with value: 0.04647657009749275 and parameters: {'model_type': 'gcn', 'hidden_dims': '[256, 128]', 'dropout': 0.2256199635459333, 'batch_norm': True, 'lr': 0.00012304734900243602, 'weight_decay': 2.1244438554654294e-07, 'epochs': 41, 'loss': 'mse', 'optimizer': 'adam', 'graph_mode': 'knn', 'source': 'grm', 'knn_k': 6, 'weighted_edges': False, 'symmetrize_mode': 'union', 'use_snp_selection': False}. Best is trial 29 with value: 0.0909837172005828.
[I 2025-11-03 13:00:31,102] Trial 81 finished with value: 0.04461479529971302 and parameters: {'model_type': 'gcn', 'hidden_dims': '[256, 128]', 'dropout': 0.18580635037482768, 'batch_norm': True, 'lr': 0.00026912854889434733, 'weight_decay': 4.102084945808894e-07, 'epochs': 99, 'loss': 'mse', 'optimizer': 'adam', 'graph_mode': 'knn', 'source': 'grm', 'knn_k': 5, 'weighted_edges': False, 'symmetrize_mode': 'union', 'use_snp_selection': False}. Best is trial 29 with value: 0.0909837172005828.
[I 2025-11-03 13:00:32,870] Trial 82 finished with value: 0.05182315670472308 and parameters: {'model_type': 'gcn', 'hidden_dims': '[512, 128]', 'dropout': 0.34552351060730174, 'batch_norm': True, 'lr': 0.0001972841535055492, 'weight_decay': 3.464886250664272e-07, 'epochs': 65, 'loss': 'mse', 'optimizer': 'adam', 'graph_mode': 'knn', 'source': 'grm', 'knn_k': 7, 'weighted_edges': True, 'symmetrize_mode': 'mutual', 'use_snp_selection': False}. Best is trial 29 with value: 0.0909837172005828.
[I 2025-11-03 13:00:34,516] Trial 83 finished with value: 0.02298857130216121 and parameters: {'model_type': 'gcn', 'hidden_dims': '[512, 64]', 'dropout': 0.5472743488069179, 'batch_norm': True, 'lr': 0.0004434230603394495, 'weight_decay': 1.0617092389607916e-06, 'epochs': 54, 'loss': 'mse', 'optimizer': 'adam', 'graph_mode': 'cutoff', 'cutoff': 0.43363732524564613, 'grm_norm': 'cosine', 'self_loops': True, 'use_snp_selection': False}. Best is trial 29 with value: 0.0909837172005828.
[I 2025-11-03 13:00:36,000] Trial 84 finished with value: 0.02498824747860357 and parameters: {'model_type': 'gcn', 'hidden_dims': '[512, 128]', 'dropout': 0.4941653542304733, 'batch_norm': True, 'lr': 0.00034679064577542053, 'weight_decay': 5.786448873209639e-07, 'epochs': 25, 'loss': 'mse', 'optimizer': 'adam', 'graph_mode': 'cutoff', 'cutoff': 0.46616240886947036, 'grm_norm': 'cosine_then_gcn', 'self_loops': False, 'use_snp_selection': False}. Best is trial 29 with value: 0.0909837172005828.
[I 2025-11-03 13:00:38,589] Trial 85 finished with value: 0.04613535006480436 and parameters: {'model_type': 'gcn', 'hidden_dims': '[512, 256]', 'dropout': 0.3189666296909935, 'batch_norm': True, 'lr': 0.0005556113816386524, 'weight_decay': 1.3351735824092216e-06, 'epochs': 191, 'loss': 'mae', 'optimizer': 'adam', 'graph_mode': 'knn', 'source': 'grm', 'knn_k': 4, 'weighted_edges': False, 'symmetrize_mode': 'union', 'use_snp_selection': False}. Best is trial 29 with value: 0.0909837172005828.
[I 2025-11-03 13:00:40,591] Trial 86 finished with value: 0.0454905075360769 and parameters: {'model_type': 'gcn', 'hidden_dims': '[512, 128]', 'dropout': 0.43798411861576286, 'batch_norm': True, 'lr': 0.0008259686966664322, 'weight_decay': 3.1399461106624238e-06, 'epochs': 113, 'loss': 'mse', 'optimizer': 'adam', 'graph_mode': 'cutoff', 'cutoff': 0.5762922107668051, 'grm_norm': 'cosine', 'self_loops': True, 'use_snp_selection': False}. Best is trial 29 with value: 0.0909837172005828.
[I 2025-11-03 13:00:41,887] Trial 87 finished with value: 0.02161216846864189 and parameters: {'model_type': 'gcn', 'hidden_dims': '[128, 64]', 'dropout': 0.2334713350399613, 'batch_norm': True, 'lr': 0.00021852461627711565, 'weight_decay': 4.6475814959324583e-07, 'epochs': 90, 'loss': 'mse', 'optimizer': 'adam', 'graph_mode': 'cutoff', 'cutoff': 0.8859155013881856, 'grm_norm': 'cosine', 'self_loops': True, 'use_snp_selection': False}. Best is trial 29 with value: 0.0909837172005828.
[I 2025-11-03 13:00:44,334] Trial 88 finished with value: -0.017797768437639312 and parameters: {'model_type': 'gcn', 'hidden_dims': '[256, 128]', 'dropout': 0.42364046707826036, 'batch_norm': False, 'lr': 0.0004377651480963285, 'weight_decay': 1.6317109268621735e-05, 'epochs': 71, 'loss': 'mse', 'optimizer': 'adam', 'graph_mode': 'knn', 'source': 'grm', 'knn_k': 9, 'weighted_edges': True, 'symmetrize_mode': 'union', 'use_snp_selection': True, 'num_snps': 37039}. Best is trial 29 with value: 0.0909837172005828.
[I 2025-11-03 13:00:45,954] Trial 89 finished with value: 0.04104664376030773 and parameters: {'model_type': 'gcn', 'hidden_dims': '[512, 128]', 'dropout': 0.19697122976908313, 'batch_norm': True, 'lr': 0.00017082058160899279, 'weight_decay': 7.984674897591139e-07, 'epochs': 42, 'loss': 'mae', 'optimizer': 'adam', 'graph_mode': 'cutoff', 'cutoff': 0.33253105214974155, 'grm_norm': 'cosine', 'self_loops': False, 'use_snp_selection': False}. Best is trial 29 with value: 0.0909837172005828.
[I 2025-11-03 13:00:48,676] Trial 90 finished with value: 0.05864101932064661 and parameters: {'model_type': 'gcn', 'hidden_dims': '[512, 128]', 'dropout': 0.28801233902273005, 'batch_norm': True, 'lr': 0.0006481610764735783, 'weight_decay': 1.0036984674134266e-05, 'epochs': 235, 'loss': 'mse', 'optimizer': 'adam', 'graph_mode': 'cutoff', 'cutoff': 0.49997398725627634, 'grm_norm': 'cosine', 'self_loops': True, 'use_snp_selection': False}. Best is trial 29 with value: 0.0909837172005828.
[I 2025-11-03 13:00:51,499] Trial 91 finished with value: 0.065497747426896 and parameters: {'model_type': 'gcn', 'hidden_dims': '[512, 128]', 'dropout': 0.2940845208677449, 'batch_norm': True, 'lr': 0.0006690826715501116, 'weight_decay': 2.7218684325896523e-05, 'epochs': 256, 'loss': 'mse', 'optimizer': 'adam', 'graph_mode': 'cutoff', 'cutoff': 0.4023243965562265, 'grm_norm': 'cosine', 'self_loops': True, 'use_snp_selection': False}. Best is trial 29 with value: 0.0909837172005828.
[I 2025-11-03 13:00:54,286] Trial 92 finished with value: 0.02947505587053429 and parameters: {'model_type': 'gcn', 'hidden_dims': '[512, 128]', 'dropout': 0.29242243525413897, 'batch_norm': True, 'lr': 0.0009994832815085504, 'weight_decay': 2.1920289784135832e-05, 'epochs': 251, 'loss': 'mse', 'optimizer': 'adam', 'graph_mode': 'cutoff', 'cutoff': 0.7095803534984643, 'grm_norm': 'cosine', 'self_loops': True, 'use_snp_selection': False}. Best is trial 29 with value: 0.0909837172005828.
[I 2025-11-03 13:00:56,959] Trial 93 finished with value: 0.0412189344483007 and parameters: {'model_type': 'gcn', 'hidden_dims': '[512, 128]', 'dropout': 0.35788267245391153, 'batch_norm': True, 'lr': 0.0006797260033016884, 'weight_decay': 2.560599354957163e-05, 'epochs': 233, 'loss': 'mse', 'optimizer': 'adam', 'graph_mode': 'cutoff', 'cutoff': 0.3716914171293695, 'grm_norm': 'cosine', 'self_loops': True, 'use_snp_selection': False}. Best is trial 29 with value: 0.0909837172005828.
[I 2025-11-03 13:00:59,805] Trial 94 finished with value: 0.015374168399666923 and parameters: {'model_type': 'gcn', 'hidden_dims': '[512, 128]', 'dropout': 0.13862483695502675, 'batch_norm': True, 'lr': 0.0006113408399034505, 'weight_decay': 5.400363100063812e-05, 'epochs': 258, 'loss': 'mse', 'optimizer': 'adam', 'graph_mode': 'cutoff', 'cutoff': 0.5067042807017551, 'grm_norm': 'cosine', 'self_loops': True, 'use_snp_selection': False}. Best is trial 29 with value: 0.0909837172005828.
[I 2025-11-03 13:01:02,502] Trial 95 finished with value: 0.044685144284465655 and parameters: {'model_type': 'gcn', 'hidden_dims': '[512, 128]', 'dropout': 0.2612493944109544, 'batch_norm': True, 'lr': 0.0008414823473413213, 'weight_decay': 6.714007378852513e-06, 'epochs': 235, 'loss': 'mse', 'optimizer': 'adam', 'graph_mode': 'cutoff', 'cutoff': 0.5560129041047697, 'grm_norm': 'cosine', 'self_loops': True, 'use_snp_selection': False}. Best is trial 29 with value: 0.0909837172005828.
[I 2025-11-03 13:01:05,499] Trial 96 finished with value: 0.05343963497186439 and parameters: {'model_type': 'gcn', 'hidden_dims': '[512, 128]', 'dropout': 0.24133127433628881, 'batch_norm': True, 'lr': 0.0007282677813697457, 'weight_decay': 1.1343378704930048e-05, 'epochs': 284, 'loss': 'mse', 'optimizer': 'adam', 'graph_mode': 'cutoff', 'cutoff': 0.4066229392832072, 'grm_norm': 'gcn', 'self_loops': True, 'use_snp_selection': False}. Best is trial 29 with value: 0.0909837172005828.
[I 2025-11-03 13:01:07,709] Trial 97 finished with value: 0.045282993853233186 and parameters: {'model_type': 'gcn', 'hidden_dims': '[256, 128, 64]', 'dropout': 0.27608219887163576, 'batch_norm': True, 'lr': 0.0004498960815477519, 'weight_decay': 8.994339599188828e-06, 'epochs': 220, 'loss': 'mse', 'optimizer': 'adam', 'graph_mode': 'cutoff', 'cutoff': 0.25070468723353223, 'grm_norm': 'cosine', 'self_loops': True, 'use_snp_selection': False}. Best is trial 29 with value: 0.0909837172005828.
[I 2025-11-03 13:01:10,259] Trial 98 finished with value: 0.010756954327316472 and parameters: {'model_type': 'gcn', 'hidden_dims': '[512, 128]', 'dropout': 0.36719856933622835, 'batch_norm': True, 'lr': 0.0005181463586161213, 'weight_decay': 3.1534094601626236e-05, 'epochs': 202, 'loss': 'mse', 'optimizer': 'adam', 'graph_mode': 'knn', 'source': 'grm', 'knn_k': 6, 'weighted_edges': False, 'symmetrize_mode': 'mutual', 'use_snp_selection': False}. Best is trial 29 with value: 0.0909837172005828.
[I 2025-11-03 13:01:12,157] Trial 99 finished with value: 0.04989708756833639 and parameters: {'model_type': 'gcn', 'hidden_dims': '[128, 64]', 'dropout': 0.31751148327856654, 'batch_norm': True, 'lr': 0.0003298233092877476, 'weight_decay': 4.678041019760183e-06, 'epochs': 301, 'loss': 'mse', 'optimizer': 'adam', 'graph_mode': 'cutoff', 'cutoff': 0.5949917137743068, 'grm_norm': 'none', 'self_loops': True, 'use_snp_selection': False}. Best is trial 29 with value: 0.0909837172005828.
[I 2025-11-03 13:01:15,012] Trial 100 finished with value: 0.04217080483407964 and parameters: {'model_type': 'gcn', 'hidden_dims': '[512, 64]', 'dropout': 0.21061355147800906, 'batch_norm': True, 'lr': 9.944298659834168e-05, 'weight_decay': 3.7073416391105933e-06, 'epochs': 257, 'loss': 'mae', 'optimizer': 'adam', 'graph_mode': 'cutoff', 'cutoff': 0.30503870619806434, 'grm_norm': 'cosine', 'self_loops': True, 'use_snp_selection': False}. Best is trial 29 with value: 0.0909837172005828.
[I 2025-11-03 13:01:16,809] Trial 101 finished with value: 0.04362766658891055 and parameters: {'model_type': 'gcn', 'hidden_dims': '[512, 128]', 'dropout': 0.17855255895468758, 'batch_norm': True, 'lr': 0.0002963294243990642, 'weight_decay': 8.881064539424086e-05, 'epochs': 81, 'loss': 'mse', 'optimizer': 'adam', 'graph_mode': 'cutoff', 'cutoff': 0.457768930306481, 'grm_norm': 'cosine', 'self_loops': True, 'use_snp_selection': False}. Best is trial 29 with value: 0.0909837172005828.
[I 2025-11-03 13:01:19,536] Trial 102 finished with value: 0.047492491603346676 and parameters: {'model_type': 'gcn', 'hidden_dims': '[512, 128]', 'dropout': 0.507728145387536, 'batch_norm': True, 'lr': 0.00038403752682284554, 'weight_decay': 1.5009710145715536e-05, 'epochs': 244, 'loss': 'mse', 'optimizer': 'adam', 'graph_mode': 'cutoff', 'cutoff': 0.425054579794768, 'grm_norm': 'cosine', 'self_loops': True, 'use_snp_selection': False}. Best is trial 29 with value: 0.0909837172005828.
[I 2025-11-03 13:01:21,101] Trial 103 finished with value: 0.023842733684193554 and parameters: {'model_type': 'gcn', 'hidden_dims': '[512, 128]', 'dropout': 0.5320515426464018, 'batch_norm': True, 'lr': 0.000617159914752031, 'weight_decay': 2.448878903320706e-06, 'epochs': 48, 'loss': 'mse', 'optimizer': 'adam', 'graph_mode': 'cutoff', 'cutoff': 0.34384605849599864, 'grm_norm': 'cosine', 'self_loops': True, 'use_snp_selection': False}. Best is trial 29 with value: 0.0909837172005828.
[I 2025-11-03 13:01:22,719] Trial 104 finished with value: 0.04407613672735365 and parameters: {'model_type': 'gcn', 'hidden_dims': '[512, 128]', 'dropout': 0.4769740449827047, 'batch_norm': True, 'lr': 0.0002679611908774074, 'weight_decay': 1.115964781370447e-07, 'epochs': 58, 'loss': 'mse', 'optimizer': 'adam', 'graph_mode': 'cutoff', 'cutoff': 0.2875228633167263, 'grm_norm': 'cosine', 'self_loops': True, 'use_snp_selection': False}. Best is trial 29 with value: 0.0909837172005828.
[I 2025-11-03 13:01:25,595] Trial 105 finished with value: 0.0700061169232538 and parameters: {'model_type': 'gcn', 'hidden_dims': '[512, 256]', 'dropout': 0.3458668252490339, 'batch_norm': True, 'lr': 0.0005044498082884434, 'weight_decay': 9.886761809166061e-06, 'epochs': 269, 'loss': 'mse', 'optimizer': 'adam', 'graph_mode': 'cutoff', 'cutoff': 0.40354783960994306, 'grm_norm': 'cosine', 'self_loops': True, 'use_snp_selection': False}. Best is trial 29 with value: 0.0909837172005828.
[I 2025-11-03 13:01:28,521] Trial 106 finished with value: 0.04140629076075894 and parameters: {'model_type': 'gcn', 'hidden_dims': '[512, 256]', 'dropout': 0.37609167320603726, 'batch_norm': True, 'lr': 0.0005492132568136432, 'weight_decay': 1.0835204881088664e-05, 'epochs': 274, 'loss': 'mse', 'optimizer': 'adam', 'graph_mode': 'cutoff', 'cutoff': 0.21272089299568503, 'grm_norm': 'cosine_then_gcn', 'self_loops': True, 'use_snp_selection': False}. Best is trial 29 with value: 0.0909837172005828.
[I 2025-11-03 13:01:32,356] Trial 107 finished with value: -0.02988438433637233 and parameters: {'model_type': 'gcn', 'hidden_dims': '[512, 256]', 'dropout': 0.29297974235719854, 'batch_norm': False, 'lr': 0.0008975539295768431, 'weight_decay': 8.516051426767988e-06, 'epochs': 240, 'loss': 'mse', 'optimizer': 'adam', 'graph_mode': 'knn', 'source': 'grm', 'knn_k': 7, 'weighted_edges': False, 'symmetrize_mode': 'union', 'use_snp_selection': True, 'num_snps': 49946}. Best is trial 29 with value: 0.0909837172005828.
[I 2025-11-03 13:01:35,451] Trial 108 finished with value: 0.05548628590310109 and parameters: {'model_type': 'gcn', 'hidden_dims': '[512, 256]', 'dropout': 0.3980543529632059, 'batch_norm': True, 'lr': 0.0006482271716624291, 'weight_decay': 2.0535377760032025e-05, 'epochs': 291, 'loss': 'mse', 'optimizer': 'adam', 'graph_mode': 'cutoff', 'cutoff': 0.3691854297356048, 'grm_norm': 'cosine', 'self_loops': False, 'use_snp_selection': False}. Best is trial 29 with value: 0.0909837172005828.
[I 2025-11-03 13:01:38,473] Trial 109 finished with value: 0.04603349242053136 and parameters: {'model_type': 'gcn', 'hidden_dims': '[512, 256]', 'dropout': 0.3993048703758686, 'batch_norm': True, 'lr': 0.0007009445337404121, 'weight_decay': 1.3933936691681645e-05, 'epochs': 289, 'loss': 'mse', 'optimizer': 'adam', 'graph_mode': 'cutoff', 'cutoff': 0.4024692833036071, 'grm_norm': 'cosine', 'self_loops': False, 'use_snp_selection': False}. Best is trial 29 with value: 0.0909837172005828.
