[I 2025-11-03 12:36:46,249] Trial 55 finished with value: 0.05864834092876595 and parameters: {'model_type': 'gcn', 'hidden_dims': '[128, 64]', 'dropout': 0.17576637808254264, 'batch_norm': True, 'lr': 0.00022685337777875777, 'weight_decay': 4.929025937244458e-07, 'epochs': 61, 'loss': 'mse', 'optimizer': 'adam', 'graph_mode': 'off', 'use_snp_selection': False}. Best is trial 7 with value: 0.06904423868437312.
[I 2025-11-03 12:36:47,520] Trial 56 finished with value: 0.047299528487681625 and parameters: {'model_type': 'gcn', 'hidden_dims': '[512, 64]', 'dropout': 0.3365219580141145, 'batch_norm': True, 'lr': 7.82679980507764e-05, 'weight_decay': 1.4343220533199783e-07, 'epochs': 228, 'loss': 'mse', 'optimizer': 'adam', 'graph_mode': 'off', 'use_snp_selection': True, 'num_snps': 12849}. Best is trial 7 with value: 0.06904423868437312.
[I 2025-11-03 12:36:49,714] Trial 57 finished with value: 0.03900751249874229 and parameters: {'model_type': 'gcn', 'hidden_dims': '[512, 256]', 'dropout': 0.1627196021056351, 'batch_norm': True, 'lr': 2.6772672963316834e-05, 'weight_decay': 7.072901442972214e-07, 'epochs': 261, 'loss': 'mse', 'optimizer': 'adam', 'graph_mode': 'off', 'use_snp_selection': False}. Best is trial 7 with value: 0.06904423868437312.
[I 2025-11-03 12:36:50,602] Trial 58 finished with value: 0.0497473286596021 and parameters: {'model_type': 'gcn', 'hidden_dims': '[128, 64]', 'dropout': 0.21206726338552806, 'batch_norm': True, 'lr': 3.1324670055580316e-05, 'weight_decay': 2.9227896543644593e-07, 'epochs': 134, 'loss': 'mae', 'optimizer': 'adam', 'graph_mode': 'off', 'use_snp_selection': False}. Best is trial 7 with value: 0.06904423868437312.
[I 2025-11-03 12:36:52,731] Trial 59 finished with value: 0.025348990682329372 and parameters: {'model_type': 'gcn', 'hidden_dims': '[512, 128]', 'dropout': 0.3676150668696646, 'batch_norm': False, 'lr': 1.684054068594747e-05, 'weight_decay': 7.190541526647866e-06, 'epochs': 210, 'loss': 'mse', 'optimizer': 'adam', 'graph_mode': 'off', 'use_snp_selection': True, 'num_snps': 40458}. Best is trial 7 with value: 0.06904423868437312.
[I 2025-11-03 12:36:55,040] Trial 60 finished with value: 0.027151950240591752 and parameters: {'model_type': 'gcn', 'hidden_dims': '[512, 256]', 'dropout': 0.23781942965251116, 'batch_norm': True, 'lr': 0.0004325568737496858, 'weight_decay': 3.3049367453973304e-05, 'epochs': 296, 'loss': 'mse', 'optimizer': 'adam', 'graph_mode': 'off', 'use_snp_selection': False}. Best is trial 7 with value: 0.06904423868437312.
[I 2025-11-03 12:36:55,730] Trial 61 finished with value: 0.037550708826749685 and parameters: {'model_type': 'gcn', 'hidden_dims': '[128, 64]', 'dropout': 0.18724413863075912, 'batch_norm': True, 'lr': 0.0002082761356145373, 'weight_decay': 4.739419391373889e-07, 'epochs': 61, 'loss': 'mse', 'optimizer': 'adam', 'graph_mode': 'off', 'use_snp_selection': False}. Best is trial 7 with value: 0.06904423868437312.
[I 2025-11-03 12:36:56,536] Trial 62 finished with value: 0.043896064072036084 and parameters: {'model_type': 'gcn', 'hidden_dims': '[128, 64]', 'dropout': 0.17033563023782602, 'batch_norm': True, 'lr': 0.00023662526740786513, 'weight_decay': 3.534497519314854e-07, 'epochs': 74, 'loss': 'mse', 'optimizer': 'adam', 'graph_mode': 'off', 'use_snp_selection': False}. Best is trial 7 with value: 0.06904423868437312.
[I 2025-11-03 12:36:57,200] Trial 63 finished with value: 0.06387433269725383 and parameters: {'model_type': 'gcn', 'hidden_dims': '[128, 64]', 'dropout': 0.145950863160613, 'batch_norm': True, 'lr': 0.000310490662084303, 'weight_decay': 1.0778800755035009e-06, 'epochs': 42, 'loss': 'mse', 'optimizer': 'adam', 'graph_mode': 'off', 'use_snp_selection': False}. Best is trial 7 with value: 0.06904423868437312.
[I 2025-11-03 12:36:57,828] Trial 64 finished with value: 0.04323311312385502 and parameters: {'model_type': 'gcn', 'hidden_dims': '[128, 64]', 'dropout': 0.12678835564350513, 'batch_norm': True, 'lr': 0.00032177175345231523, 'weight_decay': 9.466590392105891e-07, 'epochs': 40, 'loss': 'mse', 'optimizer': 'adam', 'graph_mode': 'off', 'use_snp_selection': False}. Best is trial 7 with value: 0.06904423868437312.
[I 2025-11-03 12:36:58,500] Trial 65 finished with value: 0.049805140188231796 and parameters: {'model_type': 'gcn', 'hidden_dims': '[128, 64]', 'dropout': 0.14904628194410852, 'batch_norm': True, 'lr': 0.0006301146178507684, 'weight_decay': 1.1079470407560923e-06, 'epochs': 53, 'loss': 'mse', 'optimizer': 'adam', 'graph_mode': 'off', 'use_snp_selection': False}. Best is trial 7 with value: 0.06904423868437312.
[I 2025-11-03 12:36:59,275] Trial 66 finished with value: -0.014288979388517475 and parameters: {'model_type': 'gcn', 'hidden_dims': '[128, 64]', 'dropout': 0.10074090175013034, 'batch_norm': True, 'lr': 1.2823987559783833e-05, 'weight_decay': 3.0983041183039437e-06, 'epochs': 88, 'loss': 'mse', 'optimizer': 'adam', 'graph_mode': 'off', 'use_snp_selection': False}. Best is trial 7 with value: 0.06904423868437312.
[I 2025-11-03 12:37:00,744] Trial 67 finished with value: 0.03234365806321498 and parameters: {'model_type': 'gcn', 'hidden_dims': '[512, 256]', 'dropout': 0.20826517659749846, 'batch_norm': True, 'lr': 0.00013521852604775098, 'weight_decay': 1.7884365124851087e-06, 'epochs': 115, 'loss': 'mae', 'optimizer': 'adam', 'graph_mode': 'off', 'use_snp_selection': False}. Best is trial 7 with value: 0.06904423868437312.
[I 2025-11-03 12:37:02,800] Trial 68 finished with value: 0.04522453849556813 and parameters: {'model_type': 'gcn', 'hidden_dims': '[256, 128, 64]', 'dropout': 0.13909737194442834, 'batch_norm': True, 'lr': 4.518902477454078e-05, 'weight_decay': 0.000565904666235749, 'epochs': 319, 'loss': 'mse', 'optimizer': 'adam', 'graph_mode': 'off', 'use_snp_selection': False}. Best is trial 7 with value: 0.06904423868437312.
[I 2025-11-03 12:37:03,752] Trial 69 finished with value: 0.04671776938223137 and parameters: {'model_type': 'gcn', 'hidden_dims': '[128, 64]', 'dropout': 0.11638485745223469, 'batch_norm': True, 'lr': 0.0004811832047716563, 'weight_decay': 2.2851320135599436e-07, 'epochs': 162, 'loss': 'mae', 'optimizer': 'adam', 'graph_mode': 'off', 'use_snp_selection': False}. Best is trial 7 with value: 0.06904423868437312.
[I 2025-11-03 12:37:05,406] Trial 70 finished with value: 0.014062238795423834 and parameters: {'model_type': 'gcn', 'hidden_dims': '[256, 128]', 'dropout': 0.309916750656596, 'batch_norm': False, 'lr': 0.0007938415401291532, 'weight_decay': 1.102268002770905e-07, 'epochs': 70, 'loss': 'mse', 'optimizer': 'adam', 'graph_mode': 'off', 'use_snp_selection': True, 'num_snps': 49907}. Best is trial 7 with value: 0.06904423868437312.
[I 2025-11-03 12:37:06,164] Trial 71 finished with value: 0.04313203644999551 and parameters: {'model_type': 'gcn', 'hidden_dims': '[128, 64]', 'dropout': 0.17996011226673003, 'batch_norm': True, 'lr': 0.00035550410377544806, 'weight_decay': 5.702294402563066e-07, 'epochs': 67, 'loss': 'mse', 'optimizer': 'adam', 'graph_mode': 'off', 'use_snp_selection': False}. Best is trial 7 with value: 0.06904423868437312.
[I 2025-11-03 12:37:06,862] Trial 72 finished with value: 0.0562727896564778 and parameters: {'model_type': 'gcn', 'hidden_dims': '[128, 64]', 'dropout': 0.16528575776256296, 'batch_norm': True, 'lr': 0.0002805223497497873, 'weight_decay': 4.6965982082111027e-07, 'epochs': 54, 'loss': 'mse', 'optimizer': 'adam', 'graph_mode': 'off', 'use_snp_selection': False}. Best is trial 7 with value: 0.06904423868437312.
[I 2025-11-03 12:37:07,596] Trial 73 finished with value: 0.057996372100427615 and parameters: {'model_type': 'gcn', 'hidden_dims': '[128, 64]', 'dropout': 0.37755682723189443, 'batch_norm': True, 'lr': 0.00018436986435695624, 'weight_decay': 7.183320007211615e-07, 'epochs': 84, 'loss': 'mse', 'optimizer': 'adam', 'graph_mode': 'off', 'use_snp_selection': False}. Best is trial 7 with value: 0.06904423868437312.
[I 2025-11-03 12:37:08,615] Trial 74 finished with value: 0.03601612797005341 and parameters: {'model_type': 'gcn', 'hidden_dims': '[128, 64]', 'dropout': 0.19388488825568262, 'batch_norm': True, 'lr': 0.00023350312551715337, 'weight_decay': 1.5319467803652736e-07, 'epochs': 190, 'loss': 'mse', 'optimizer': 'adam', 'graph_mode': 'off', 'use_snp_selection': False}. Best is trial 7 with value: 0.06904423868437312.
[I 2025-11-03 12:37:10,936] Trial 75 finished with value: 0.05136268159115635 and parameters: {'model_type': 'gcn', 'hidden_dims': '[512, 256]', 'dropout': 0.3458695375465531, 'batch_norm': True, 'lr': 9.915590827943117e-05, 'weight_decay': 3.1412783022752426e-07, 'epochs': 284, 'loss': 'mse', 'optimizer': 'adam', 'graph_mode': 'off', 'use_snp_selection': False}. Best is trial 7 with value: 0.06904423868437312.
[I 2025-11-03 12:37:11,765] Trial 76 finished with value: 0.02704752306035922 and parameters: {'model_type': 'gcn', 'hidden_dims': '[256, 128, 64]', 'dropout': 0.13504598714161317, 'batch_norm': True, 'lr': 2.8100300847858356e-05, 'weight_decay': 4.0686746274239123e-07, 'epochs': 48, 'loss': 'mse', 'optimizer': 'adam', 'graph_mode': 'off', 'use_snp_selection': False}. Best is trial 7 with value: 0.06904423868437312.
[I 2025-11-03 12:37:12,547] Trial 77 finished with value: 0.026694978520081885 and parameters: {'model_type': 'gcn', 'hidden_dims': '[128, 64]', 'dropout': 0.15429716410324654, 'batch_norm': True, 'lr': 0.0003935374214457102, 'weight_decay': 2.2392688820479304e-07, 'epochs': 94, 'loss': 'mae', 'optimizer': 'adam', 'graph_mode': 'off', 'use_snp_selection': False}. Best is trial 7 with value: 0.06904423868437312.
[I 2025-11-03 12:37:14,004] Trial 78 finished with value: -0.0031618991843842138 and parameters: {'model_type': 'gcn', 'hidden_dims': '[512, 64]', 'dropout': 0.21866789067751136, 'batch_norm': False, 'lr': 2.1782873778254123e-05, 'weight_decay': 0.00014511127512463454, 'epochs': 110, 'loss': 'mse', 'optimizer': 'adam', 'graph_mode': 'off', 'use_snp_selection': True, 'num_snps': 29876}. Best is trial 7 with value: 0.06904423868437312.
[I 2025-11-03 12:37:15,152] Trial 79 finished with value: -0.012893442392398655 and parameters: {'model_type': 'gcn', 'hidden_dims': '[512, 256]', 'dropout': 0.17528891223464368, 'batch_norm': True, 'lr': 9.806359332519156e-06, 'weight_decay': 5.472129588106725e-07, 'epochs': 66, 'loss': 'mae', 'optimizer': 'adam', 'graph_mode': 'off', 'use_snp_selection': False}. Best is trial 7 with value: 0.06904423868437312.
[I 2025-11-03 12:37:16,586] Trial 80 finished with value: 0.04257790983521925 and parameters: {'model_type': 'gcn', 'hidden_dims': '[128, 64]', 'dropout': 0.44467635910851044, 'batch_norm': True, 'lr': 3.7837650372958834e-05, 'weight_decay': 8.643284564634113e-07, 'epochs': 340, 'loss': 'mse', 'optimizer': 'adam', 'graph_mode': 'off', 'use_snp_selection': False}. Best is trial 7 with value: 0.06904423868437312.
[I 2025-11-03 12:37:17,376] Trial 81 finished with value: 0.0010895920406963262 and parameters: {'model_type': 'gcn', 'hidden_dims': '[128, 64]', 'dropout': 0.40575530364320234, 'batch_norm': True, 'lr': 0.0001789786605712369, 'weight_decay': 7.268805119848954e-07, 'epochs': 84, 'loss': 'mse', 'optimizer': 'adam', 'graph_mode': 'off', 'use_snp_selection': False}. Best is trial 7 with value: 0.06904423868437312.
[I 2025-11-03 12:37:18,131] Trial 82 finished with value: 0.045753121915642236 and parameters: {'model_type': 'gcn', 'hidden_dims': '[128, 64]', 'dropout': 0.372737137175416, 'batch_norm': True, 'lr': 0.0005260492766360761, 'weight_decay': 1.4150372952782385e-06, 'epochs': 81, 'loss': 'mse', 'optimizer': 'adam', 'graph_mode': 'off', 'use_snp_selection': False}. Best is trial 7 with value: 0.06904423868437312.
[I 2025-11-03 12:37:18,919] Trial 83 finished with value: 0.011022970955673594 and parameters: {'model_type': 'gcn', 'hidden_dims': '[128, 64]', 'dropout': 0.330080489766621, 'batch_norm': True, 'lr': 0.0001875408697656653, 'weight_decay': 1.0822140754886782e-06, 'epochs': 96, 'loss': 'mse', 'optimizer': 'adam', 'graph_mode': 'off', 'use_snp_selection': False}. Best is trial 7 with value: 0.06904423868437312.
[I 2025-11-03 12:37:20,298] Trial 84 finished with value: 0.010607521245681107 and parameters: {'model_type': 'gcn', 'hidden_dims': '[128, 64]', 'dropout': 0.42236733275975147, 'batch_norm': True, 'lr': 0.0002851807879010492, 'weight_decay': 2.0254117950127252e-06, 'epochs': 307, 'loss': 'mse', 'optimizer': 'adam', 'graph_mode': 'off', 'use_snp_selection': False}. Best is trial 7 with value: 0.06904423868437312.
[I 2025-11-03 12:37:21,402] Trial 85 finished with value: 0.05978024700087987 and parameters: {'model_type': 'gcn', 'hidden_dims': '[512, 128]', 'dropout': 0.3861652937768477, 'batch_norm': True, 'lr': 0.0001505225440145267, 'weight_decay': 1.7252095055945318e-07, 'epochs': 55, 'loss': 'mse', 'optimizer': 'adam', 'graph_mode': 'off', 'use_snp_selection': False}. Best is trial 7 with value: 0.06904423868437312.
[I 2025-11-03 12:37:22,372] Trial 86 finished with value: 0.04322466128354804 and parameters: {'model_type': 'gcn', 'hidden_dims': '[512, 128]', 'dropout': 0.3956809201823084, 'batch_norm': False, 'lr': 0.0006969232109956166, 'weight_decay': 1.0359542862417441e-07, 'epochs': 54, 'loss': 'mse', 'optimizer': 'adam', 'graph_mode': 'off', 'use_snp_selection': True, 'num_snps': 18075}. Best is trial 7 with value: 0.06904423868437312.
[I 2025-11-03 12:37:23,386] Trial 87 finished with value: 0.03995154494389432 and parameters: {'model_type': 'gcn', 'hidden_dims': '[512, 128]', 'dropout': 0.11578218677139582, 'batch_norm': True, 'lr': 6.788723611183155e-05, 'weight_decay': 1.7951095986345473e-07, 'epochs': 47, 'loss': 'mae', 'optimizer': 'adam', 'graph_mode': 'off', 'use_snp_selection': False}. Best is trial 7 with value: 0.06904423868437312.
[I 2025-11-03 12:37:24,528] Trial 88 finished with value: 0.04317487480487604 and parameters: {'model_type': 'gcn', 'hidden_dims': '[512, 128]', 'dropout': 0.35547263446898425, 'batch_norm': True, 'lr': 0.0001128015790474157, 'weight_decay': 1.728711161222631e-07, 'epochs': 74, 'loss': 'mse', 'optimizer': 'adam', 'graph_mode': 'off', 'use_snp_selection': True, 'num_snps': 23930}. Best is trial 7 with value: 0.06904423868437312.
[I 2025-11-03 12:37:25,486] Trial 89 finished with value: 0.015482444751233258 and parameters: {'model_type': 'gcn', 'hidden_dims': '[512, 128]', 'dropout': 0.28867232326282777, 'batch_norm': True, 'lr': 0.00013938567656498305, 'weight_decay': 2.392149783635988e-07, 'epochs': 40, 'loss': 'mse', 'optimizer': 'adam', 'graph_mode': 'off', 'use_snp_selection': False}. Best is trial 7 with value: 0.06904423868437312.
[I 2025-11-03 12:37:27,266] Trial 90 finished with value: -0.0018396391490553322 and parameters: {'model_type': 'gcn', 'hidden_dims': '[256, 128]', 'dropout': 0.5925486154209962, 'batch_norm': False, 'lr': 0.00024532266812909775, 'weight_decay': 2.815583640133324e-07, 'epochs': 325, 'loss': 'mae', 'optimizer': 'adam', 'graph_mode': 'off', 'use_snp_selection': False}. Best is trial 7 with value: 0.06904423868437312.
[I 2025-11-03 12:37:28,182] Trial 91 finished with value: 0.032009685059689486 and parameters: {'model_type': 'gcn', 'hidden_dims': '[256, 128, 64]', 'dropout': 0.3718148891527524, 'batch_norm': True, 'lr': 0.00030441306520255957, 'weight_decay': 6.23311814851859e-07, 'epochs': 59, 'loss': 'mse', 'optimizer': 'adam', 'graph_mode': 'off', 'use_snp_selection': False}. Best is trial 7 with value: 0.06904423868437312.
[I 2025-11-03 12:37:29,350] Trial 92 finished with value: 0.03646383374185363 and parameters: {'model_type': 'gcn', 'hidden_dims': '[512, 256]', 'dropout': 0.3823354966994545, 'batch_norm': True, 'lr': 0.00015976827174467247, 'weight_decay': 3.93682782551946e-07, 'epochs': 63, 'loss': 'mse', 'optimizer': 'adam', 'graph_mode': 'off', 'use_snp_selection': False}. Best is trial 7 with value: 0.06904423868437312.
[I 2025-11-03 12:37:30,696] Trial 93 finished with value: 0.02628453274671129 and parameters: {'model_type': 'gcn', 'hidden_dims': '[512, 128]', 'dropout': 0.3838600526249589, 'batch_norm': True, 'lr': 0.00037987256823199744, 'weight_decay': 6.592493695085148e-07, 'epochs': 104, 'loss': 'mse', 'optimizer': 'adam', 'graph_mode': 'off', 'use_snp_selection': False}. Best is trial 7 with value: 0.06904423868437312.
[I 2025-11-03 12:37:31,415] Trial 94 finished with value: 0.039608897263808764 and parameters: {'model_type': 'gcn', 'hidden_dims': '[128, 64]', 'dropout': 0.4199253954099016, 'batch_norm': True, 'lr': 0.000211858131739083, 'weight_decay': 3.2735406746616486e-07, 'epochs': 73, 'loss': 'mse', 'optimizer': 'adam', 'graph_mode': 'off', 'use_snp_selection': False}. Best is trial 7 with value: 0.06904423868437312.
[I 2025-11-03 12:37:32,834] Trial 95 finished with value: 0.06935101396569539 and parameters: {'model_type': 'gcn', 'hidden_dims': '[128, 64]', 'dropout': 0.3169401733488159, 'batch_norm': True, 'lr': 5.444759709747681e-05, 'weight_decay': 1.3528286194492614e-07, 'epochs': 314, 'loss': 'mse', 'optimizer': 'adam', 'graph_mode': 'off', 'use_snp_selection': False}. Best is trial 95 with value: 0.06935101396569539.
[I 2025-11-03 12:37:35,833] Trial 96 finished with value: 0.03079361560869226 and parameters: {'model_type': 'gcn', 'hidden_dims': '[512, 256]', 'dropout': 0.3237437207808126, 'batch_norm': True, 'lr': 8.745048426712241e-05, 'weight_decay': 1.1974298754349561e-07, 'epochs': 316, 'loss': 'mse', 'optimizer': 'adam', 'graph_mode': 'off', 'use_snp_selection': True, 'num_snps': 50557}. Best is trial 95 with value: 0.06935101396569539.
[I 2025-11-03 12:37:38,425] Trial 97 finished with value: 0.057700135661915355 and parameters: {'model_type': 'gcn', 'hidden_dims': '[512, 128]', 'dropout': 0.3515726963315914, 'batch_norm': True, 'lr': 5.2971103956359564e-05, 'weight_decay': 1.5156214766399762e-07, 'epochs': 336, 'loss': 'mse', 'optimizer': 'adam', 'graph_mode': 'off', 'use_snp_selection': False}. Best is trial 95 with value: 0.06935101396569539.
[I 2025-11-03 12:37:40,345] Trial 98 finished with value: 0.037121947515581094 and parameters: {'model_type': 'gcn', 'hidden_dims': '[256, 128, 64]', 'dropout': 0.1598108454474609, 'batch_norm': True, 'lr': 4.183690053780602e-05, 'weight_decay': 2.1632383681790297e-07, 'epochs': 289, 'loss': 'mae', 'optimizer': 'adam', 'graph_mode': 'off', 'use_snp_selection': False}. Best is trial 95 with value: 0.06935101396569539.
[I 2025-11-03 12:37:41,644] Trial 99 finished with value: -0.020563952171788906 and parameters: {'model_type': 'gcn', 'hidden_dims': '[512, 64]', 'dropout': 0.2670430628863295, 'batch_norm': True, 'lr': 1.7186770871470245e-05, 'weight_decay': 4.4091614326064193e-07, 'epochs': 301, 'loss': 'mse', 'optimizer': 'adam', 'graph_mode': 'off', 'use_snp_selection': True, 'num_snps': 7119}. Best is trial 95 with value: 0.06935101396569539.
[I 2025-11-03 12:37:42,844] Trial 100 finished with value: 0.020388206725582267 and parameters: {'model_type': 'gcn', 'hidden_dims': '[128, 64]', 'dropout': 0.30740838343056953, 'batch_norm': False, 'lr': 3.225721356999774e-05, 'weight_decay': 1.2729885574685194e-07, 'epochs': 276, 'loss': 'mse', 'optimizer': 'adam', 'graph_mode': 'off', 'use_snp_selection': False}. Best is trial 95 with value: 0.06935101396569539.
[I 2025-11-03 12:37:44,195] Trial 101 finished with value: 0.033340912140610295 and parameters: {'model_type': 'gcn', 'hidden_dims': '[128, 64]', 'dropout': 0.12927719568794743, 'batch_norm': True, 'lr': 0.0004567117667045131, 'weight_decay': 5.150608771357303e-07, 'epochs': 310, 'loss': 'mse', 'optimizer': 'adam', 'graph_mode': 'off', 'use_snp_selection': False}. Best is trial 95 with value: 0.06935101396569539.
[I 2025-11-03 12:37:44,850] Trial 102 finished with value: -0.03056740743353649 and parameters: {'model_type': 'gcn', 'hidden_dims': '[128, 64]', 'dropout': 0.14410078814067892, 'batch_norm': True, 'lr': 6.06053518585585e-05, 'weight_decay': 2.678372481692062e-07, 'epochs': 47, 'loss': 'mse', 'optimizer': 'adam', 'graph_mode': 'off', 'use_snp_selection': False}. Best is trial 95 with value: 0.06935101396569539.
[I 2025-11-03 12:37:46,240] Trial 103 finished with value: 0.03494126008464746 and parameters: {'model_type': 'gcn', 'hidden_dims': '[128, 64]', 'dropout': 0.3368241205787187, 'batch_norm': True, 'lr': 0.00012694513499530587, 'weight_decay': 8.405117724278135e-07, 'epochs': 325, 'loss': 'mse', 'optimizer': 'adam', 'graph_mode': 'off', 'use_snp_selection': False}. Best is trial 95 with value: 0.06935101396569539.
[I 2025-11-03 12:37:46,919] Trial 104 finished with value: 0.016247973602360594 and parameters: {'model_type': 'gcn', 'hidden_dims': '[128, 64]', 'dropout': 0.3978665017625754, 'batch_norm': True, 'lr': 2.0342360753566813e-05, 'weight_decay': 1.4533402829058028e-05, 'epochs': 55, 'loss': 'mse', 'optimizer': 'adam', 'graph_mode': 'off', 'use_snp_selection': False}. Best is trial 95 with value: 0.06935101396569539.
[I 2025-11-03 12:37:47,668] Trial 105 finished with value: 0.02977644558490094 and parameters: {'model_type': 'gcn', 'hidden_dims': '[128, 64]', 'dropout': 0.1858087664272548, 'batch_norm': True, 'lr': 1.4694778919250919e-05, 'weight_decay': 1.7677465443633733e-07, 'epochs': 80, 'loss': 'mse', 'optimizer': 'adam', 'graph_mode': 'off', 'use_snp_selection': False}. Best is trial 95 with value: 0.06935101396569539.
[I 2025-11-03 12:37:48,828] Trial 106 finished with value: 0.05149797108169381 and parameters: {'model_type': 'gcn', 'hidden_dims': '[512, 256]', 'dropout': 0.23755902856247024, 'batch_norm': True, 'lr': 0.0002445162764404004, 'weight_decay': 1.258103060887579e-06, 'epochs': 66, 'loss': 'mse', 'optimizer': 'adam', 'graph_mode': 'off', 'use_snp_selection': False}. Best is trial 95 with value: 0.06935101396569539.
