[I 2025-11-03 12:35:27,162] Trial 3 finished with value: 0.0070694792267645135 and parameters: {'model_type': 'gcn', 'hidden_dims': '[512, 64]', 'dropout': 0.5938127374509361, 'batch_norm': False, 'lr': 5.67704586114731e-06, 'weight_decay': 2.4518087630137052e-05, 'epochs': 320, 'loss': 'mae', 'optimizer': 'adam', 'graph_mode': 'off', 'use_snp_selection': False}. Best is trial 1 with value: 0.04186362546518932.
[I 2025-11-03 12:35:29,376] Trial 4 finished with value: 0.018648958223286313 and parameters: {'model_type': 'gcn', 'hidden_dims': '[512, 128]', 'dropout': 0.25746343592134413, 'batch_norm': True, 'lr': 1.3467657668402788e-06, 'weight_decay': 0.00033087251918647806, 'epochs': 277, 'loss': 'mse', 'optimizer': 'adam', 'graph_mode': 'off', 'use_snp_selection': True, 'num_snps': 36675}. Best is trial 1 with value: 0.04186362546518932.
[I 2025-11-03 12:35:31,039] Trial 5 finished with value: 0.000508923973766393 and parameters: {'model_type': 'gcn', 'hidden_dims': '[512, 64]', 'dropout': 0.38275350994408375, 'batch_norm': True, 'lr': 1.5586664309232824e-06, 'weight_decay': 0.0008227664668621182, 'epochs': 145, 'loss': 'mae', 'optimizer': 'adam', 'graph_mode': 'off', 'use_snp_selection': True, 'num_snps': 32148}. Best is trial 1 with value: 0.04186362546518932.
[I 2025-11-03 12:35:32,401] Trial 6 finished with value: 0.01772084629894976 and parameters: {'model_type': 'gcn', 'hidden_dims': '[256, 128]', 'dropout': 0.3930109900265879, 'batch_norm': False, 'lr': 4.892964372128395e-05, 'weight_decay': 1.5809549317992182e-06, 'epochs': 199, 'loss': 'mse', 'optimizer': 'adam', 'graph_mode': 'off', 'use_snp_selection': False}. Best is trial 1 with value: 0.04186362546518932.
[I 2025-11-03 12:35:33,718] Trial 7 finished with value: 0.06904423868437312 and parameters: {'model_type': 'gcn', 'hidden_dims': '[512, 256]', 'dropout': 0.15343979219678458, 'batch_norm': True, 'lr': 6.234003099047341e-05, 'weight_decay': 3.894760610535477e-07, 'epochs': 97, 'loss': 'mse', 'optimizer': 'adam', 'graph_mode': 'off', 'use_snp_selection': False}. Best is trial 7 with value: 0.06904423868437312.
[I 2025-11-03 12:35:36,114] Trial 8 finished with value: 0.049910598508317305 and parameters: {'model_type': 'gcn', 'hidden_dims': '[512, 128]', 'dropout': 0.10743001231661406, 'batch_norm': True, 'lr': 0.00023728538449271062, 'weight_decay': 1.7629071578048637e-05, 'epochs': 312, 'loss': 'mae', 'optimizer': 'adam', 'graph_mode': 'off', 'use_snp_selection': False}. Best is trial 7 with value: 0.06904423868437312.
[I 2025-11-03 12:35:37,798] Trial 9 finished with value: 0.01995689713781712 and parameters: {'model_type': 'gcn', 'hidden_dims': '[512, 64]', 'dropout': 0.14505336736221927, 'batch_norm': True, 'lr': 5.8619638388111826e-05, 'weight_decay': 6.200156172669308e-07, 'epochs': 175, 'loss': 'mse', 'optimizer': 'adam', 'graph_mode': 'off', 'use_snp_selection': False}. Best is trial 7 with value: 0.06904423868437312.
[I 2025-11-03 12:35:38,778] Trial 10 finished with value: -0.03585580352719642 and parameters: {'model_type': 'gcn', 'hidden_dims': '[512, 256]', 'dropout': 0.2736992815328032, 'batch_norm': False, 'lr': 0.00032393778075602147, 'weight_decay': 1.1511946696017091e-07, 'epochs': 41, 'loss': 'mse', 'optimizer': 'adam', 'graph_mode': 'off', 'use_snp_selection': False}. Best is trial 7 with value: 0.06904423868437312.
[I 2025-11-03 12:35:39,934] Trial 11 finished with value: 0.02503285840418833 and parameters: {'model_type': 'gcn', 'hidden_dims': '[512, 128]', 'dropout': 0.10095648685224448, 'batch_norm': True, 'lr': 0.0007666984023899754, 'weight_decay': 2.512571353186099e-06, 'epochs': 70, 'loss': 'mae', 'optimizer': 'adam', 'graph_mode': 'off', 'use_snp_selection': False}. Best is trial 7 with value: 0.06904423868437312.
[I 2025-11-03 12:35:41,294] Trial 12 finished with value: 0.04316175478449521 and parameters: {'model_type': 'gcn', 'hidden_dims': '[512, 256]', 'dropout': 0.18206399419301494, 'batch_norm': True, 'lr': 0.00026576228959612443, 'weight_decay': 1.3081036432574914e-07, 'epochs': 88, 'loss': 'mae', 'optimizer': 'adam', 'graph_mode': 'off', 'use_snp_selection': False}. Best is trial 7 with value: 0.06904423868437312.
[I 2025-11-03 12:35:43,371] Trial 13 finished with value: 0.03365668640215727 and parameters: {'model_type': 'gcn', 'hidden_dims': '[512, 128]', 'dropout': 0.28178980110198326, 'batch_norm': True, 'lr': 1.620313997304389e-05, 'weight_decay': 3.475237872468419e-06, 'epochs': 237, 'loss': 'mse', 'optimizer': 'adam', 'graph_mode': 'off', 'use_snp_selection': False}. Best is trial 7 with value: 0.06904423868437312.
[I 2025-11-03 12:35:44,798] Trial 14 finished with value: 0.017102725241583787 and parameters: {'model_type': 'gcn', 'hidden_dims': '[512, 256]', 'dropout': 0.12319334351899142, 'batch_norm': True, 'lr': 0.00017558188744418174, 'weight_decay': 6.057825071170492e-05, 'epochs': 119, 'loss': 'mse', 'optimizer': 'adam', 'graph_mode': 'off', 'use_snp_selection': False}. Best is trial 7 with value: 0.06904423868437312.
[I 2025-11-03 12:35:46,098] Trial 15 finished with value: 0.06202969686119374 and parameters: {'model_type': 'gcn', 'hidden_dims': '[128, 64]', 'dropout': 0.2144644905818855, 'batch_norm': True, 'lr': 2.002944590579291e-05, 'weight_decay': 5.056071213029491e-07, 'epochs': 297, 'loss': 'mae', 'optimizer': 'adam', 'graph_mode': 'off', 'use_snp_selection': False}. Best is trial 7 with value: 0.06904423868437312.
[I 2025-11-03 12:35:47,211] Trial 16 finished with value: -0.007618228500174882 and parameters: {'model_type': 'gcn', 'hidden_dims': '[128, 64]', 'dropout': 0.22222337490690977, 'batch_norm': True, 'lr': 1.4098012456697182e-05, 'weight_decay': 4.833299252951357e-07, 'epochs': 220, 'loss': 'mae', 'optimizer': 'adam', 'graph_mode': 'off', 'use_snp_selection': False}. Best is trial 7 with value: 0.06904423868437312.
[I 2025-11-03 12:35:48,491] Trial 17 finished with value: 0.06596042685841977 and parameters: {'model_type': 'gcn', 'hidden_dims': '[128, 64]', 'dropout': 0.32888830259108426, 'batch_norm': True, 'lr': 2.349300150160791e-05, 'weight_decay': 3.6392708945165584e-07, 'epochs': 275, 'loss': 'mse', 'optimizer': 'adam', 'graph_mode': 'off', 'use_snp_selection': False}. Best is trial 7 with value: 0.06904423868437312.
[I 2025-11-03 12:35:51,240] Trial 18 finished with value: 0.008007135336358731 and parameters: {'model_type': 'gcn', 'hidden_dims': '[256, 128, 64]', 'dropout': 0.5098431992326697, 'batch_norm': False, 'lr': 0.00010178167867639588, 'weight_decay': 2.680011579634876e-07, 'epochs': 282, 'loss': 'mse', 'optimizer': 'adam', 'graph_mode': 'off', 'use_snp_selection': True, 'num_snps': 58241}. Best is trial 7 with value: 0.06904423868437312.
[I 2025-11-03 12:35:53,495] Trial 19 finished with value: 0.02881664973540337 and parameters: {'model_type': 'gcn', 'hidden_dims': '[512, 256]', 'dropout': 0.29993820199550675, 'batch_norm': True, 'lr': 8.454451687914326e-06, 'weight_decay': 1.168291716430933e-06, 'epochs': 264, 'loss': 'mse', 'optimizer': 'adam', 'graph_mode': 'off', 'use_snp_selection': False}. Best is trial 7 with value: 0.06904423868437312.
[I 2025-11-03 12:35:54,295] Trial 20 finished with value: 0.046187846408555985 and parameters: {'model_type': 'gcn', 'hidden_dims': '[128, 64]', 'dropout': 0.3252670246638479, 'batch_norm': True, 'lr': 0.00010819146253297384, 'weight_decay': 6.309204605485818e-06, 'epochs': 101, 'loss': 'mse', 'optimizer': 'adam', 'graph_mode': 'off', 'use_snp_selection': False}. Best is trial 7 with value: 0.06904423868437312.
[I 2025-11-03 12:35:55,632] Trial 21 finished with value: 0.03672538589228407 and parameters: {'model_type': 'gcn', 'hidden_dims': '[128, 64]', 'dropout': 0.17234043601674545, 'batch_norm': True, 'lr': 2.4256837794722004e-05, 'weight_decay': 2.9522547562483733e-07, 'epochs': 300, 'loss': 'mse', 'optimizer': 'adam', 'graph_mode': 'off', 'use_snp_selection': False}. Best is trial 7 with value: 0.06904423868437312.
[I 2025-11-03 12:35:57,121] Trial 22 finished with value: 0.039626878562786017 and parameters: {'model_type': 'gcn', 'hidden_dims': '[128, 64]', 'dropout': 0.22830956223891405, 'batch_norm': True, 'lr': 3.511276726977528e-05, 'weight_decay': 9.606832583545451e-07, 'epochs': 343, 'loss': 'mse', 'optimizer': 'adam', 'graph_mode': 'off', 'use_snp_selection': False}. Best is trial 7 with value: 0.06904423868437312.
[I 2025-11-03 12:35:58,215] Trial 23 finished with value: -0.004851116268278492 and parameters: {'model_type': 'gcn', 'hidden_dims': '[128, 64]', 'dropout': 0.34088252117266327, 'batch_norm': True, 'lr': 2.4248918724717124e-05, 'weight_decay': 3.1926204881669935e-07, 'epochs': 195, 'loss': 'mae', 'optimizer': 'adam', 'graph_mode': 'off', 'use_snp_selection': False}. Best is trial 7 with value: 0.06904423868437312.
[I 2025-11-03 12:35:59,444] Trial 24 finished with value: 0.00398949576985479 and parameters: {'model_type': 'gcn', 'hidden_dims': '[128, 64]', 'dropout': 0.4665499643689637, 'batch_norm': True, 'lr': 1.0430486430183148e-05, 'weight_decay': 1.8846898409572718e-07, 'epochs': 269, 'loss': 'mse', 'optimizer': 'adam', 'graph_mode': 'off', 'use_snp_selection': False}. Best is trial 7 with value: 0.06904423868437312.
[I 2025-11-03 12:36:01,561] Trial 25 finished with value: 0.0014057940407939588 and parameters: {'model_type': 'gcn', 'hidden_dims': '[512, 256]', 'dropout': 0.15306942726151015, 'batch_norm': True, 'lr': 3.3188968866763148e-06, 'weight_decay': 5.36572116618383e-07, 'epochs': 245, 'loss': 'mse', 'optimizer': 'adam', 'graph_mode': 'off', 'use_snp_selection': False}. Best is trial 7 with value: 0.06904423868437312.
[I 2025-11-03 12:36:02,690] Trial 26 finished with value: 0.04320253581194224 and parameters: {'model_type': 'gcn', 'hidden_dims': '[128, 64]', 'dropout': 0.22847972007378098, 'batch_norm': False, 'lr': 3.5652153356401597e-05, 'weight_decay': 2.443643243280606e-06, 'epochs': 304, 'loss': 'mae', 'optimizer': 'adam', 'graph_mode': 'off', 'use_snp_selection': True, 'num_snps': 3842}. Best is trial 7 with value: 0.06904423868437312.
[I 2025-11-03 12:36:03,998] Trial 27 finished with value: 0.0001355419547685452 and parameters: {'model_type': 'gcn', 'hidden_dims': '[256, 128, 64]', 'dropout': 0.31656586791272134, 'batch_norm': True, 'lr': 2.1551193220774986e-05, 'weight_decay': 4.881339110858778e-06, 'epochs': 151, 'loss': 'mse', 'optimizer': 'adam', 'graph_mode': 'off', 'use_snp_selection': False}. Best is trial 7 with value: 0.06904423868437312.
[I 2025-11-03 12:36:05,413] Trial 28 finished with value: 0.05731684473004231 and parameters: {'model_type': 'gcn', 'hidden_dims': '[256, 128]', 'dropout': 0.2490946780573995, 'batch_norm': True, 'lr': 0.00011687648315930771, 'weight_decay': 1.0017153046308686e-07, 'epochs': 219, 'loss': 'mae', 'optimizer': 'adam', 'graph_mode': 'off', 'use_snp_selection': False}. Best is trial 7 with value: 0.06904423868437312.
[I 2025-11-03 12:36:06,999] Trial 29 finished with value: 0.036893386597824485 and parameters: {'model_type': 'gcn', 'hidden_dims': '[128, 64]', 'dropout': 0.1958213788434965, 'batch_norm': True, 'lr': 8.789070392656497e-06, 'weight_decay': 7.804766413410713e-07, 'epochs': 332, 'loss': 'mae', 'optimizer': 'adam', 'graph_mode': 'off', 'use_snp_selection': True, 'num_snps': 19468}. Best is trial 7 with value: 0.06904423868437312.
[I 2025-11-03 12:36:08,148] Trial 30 finished with value: 0.06012043093221794 and parameters: {'model_type': 'gcn', 'hidden_dims': '[512, 256]', 'dropout': 0.3703193551092706, 'batch_norm': True, 'lr': 0.00047204887109720867, 'weight_decay': 1.6086554048019708e-06, 'epochs': 55, 'loss': 'mse', 'optimizer': 'adam', 'graph_mode': 'off', 'use_snp_selection': False}. Best is trial 7 with value: 0.06904423868437312.
[I 2025-11-03 12:36:09,257] Trial 31 finished with value: 0.022958561046177103 and parameters: {'model_type': 'gcn', 'hidden_dims': '[512, 256]', 'dropout': 0.3625343468344834, 'batch_norm': True, 'lr': 4.3301618344493593e-05, 'weight_decay': 3.8808773789166806e-07, 'epochs': 48, 'loss': 'mse', 'optimizer': 'adam', 'graph_mode': 'off', 'use_snp_selection': False}. Best is trial 7 with value: 0.06904423868437312.
[I 2025-11-03 12:36:10,448] Trial 32 finished with value: 0.04600580573433248 and parameters: {'model_type': 'gcn', 'hidden_dims': '[512, 256]', 'dropout': 0.3620870687489563, 'batch_norm': True, 'lr': 8.535248413076551e-05, 'weight_decay': 1.6582544382773876e-06, 'epochs': 78, 'loss': 'mse', 'optimizer': 'adam', 'graph_mode': 'off', 'use_snp_selection': False}. Best is trial 7 with value: 0.06904423868437312.
[I 2025-11-03 12:36:11,627] Trial 33 finished with value: 0.04188908316371962 and parameters: {'model_type': 'gcn', 'hidden_dims': '[512, 256]', 'dropout': 0.44249286652327036, 'batch_norm': True, 'lr': 0.0008627157621744145, 'weight_decay': 1.9437687383595705e-07, 'epochs': 58, 'loss': 'mse', 'optimizer': 'adam', 'graph_mode': 'off', 'use_snp_selection': False}. Best is trial 7 with value: 0.06904423868437312.
[I 2025-11-03 12:36:13,050] Trial 34 finished with value: 0.03711766880331363 and parameters: {'model_type': 'gcn', 'hidden_dims': '[512, 256]', 'dropout': 0.4776495763450488, 'batch_norm': True, 'lr': 5.2894203542714856e-06, 'weight_decay': 9.04936246058431e-07, 'epochs': 118, 'loss': 'mse', 'optimizer': 'adam', 'graph_mode': 'off', 'use_snp_selection': False}. Best is trial 7 with value: 0.06904423868437312.
[I 2025-11-03 12:36:13,836] Trial 35 finished with value: 0.01952056105479432 and parameters: {'model_type': 'gcn', 'hidden_dims': '[128, 64]', 'dropout': 0.5435990875561582, 'batch_norm': False, 'lr': 0.000548123363523585, 'weight_decay': 1.4389949873466957e-06, 'epochs': 107, 'loss': 'mse', 'optimizer': 'adam', 'graph_mode': 'off', 'use_snp_selection': False}. Best is trial 7 with value: 0.06904423868437312.
[I 2025-11-03 12:36:16,486] Trial 36 finished with value: 0.031163745521005235 and parameters: {'model_type': 'gcn', 'hidden_dims': '[256, 128]', 'dropout': 0.42135761521501813, 'batch_norm': True, 'lr': 2.3553881172249647e-06, 'weight_decay': 1.0687295154404784e-05, 'epochs': 293, 'loss': 'mae', 'optimizer': 'adam', 'graph_mode': 'off', 'use_snp_selection': True, 'num_snps': 58661}. Best is trial 7 with value: 0.06904423868437312.
[I 2025-11-03 12:36:18,632] Trial 37 finished with value: 0.005557849828876344 and parameters: {'model_type': 'gcn', 'hidden_dims': '[512, 64]', 'dropout': 0.3887363289493524, 'batch_norm': True, 'lr': 6.368928505430746e-05, 'weight_decay': 9.096918760018813e-05, 'epochs': 253, 'loss': 'mse', 'optimizer': 'adam', 'graph_mode': 'off', 'use_snp_selection': False}. Best is trial 7 with value: 0.06904423868437312.
[I 2025-11-03 12:36:20,427] Trial 38 finished with value: 0.06351106014785435 and parameters: {'model_type': 'gcn', 'hidden_dims': '[256, 128, 64]', 'dropout': 0.14692182076121468, 'batch_norm': False, 'lr': 0.0004196596870412131, 'weight_decay': 1.99639041322149e-07, 'epochs': 325, 'loss': 'mae', 'optimizer': 'adam', 'graph_mode': 'off', 'use_snp_selection': True, 'num_snps': 19911}. Best is trial 7 with value: 0.06904423868437312.
[I 2025-11-03 12:36:22,284] Trial 39 finished with value: 0.03283609855260779 and parameters: {'model_type': 'gcn', 'hidden_dims': '[256, 128, 64]', 'dropout': 0.14352992319171737, 'batch_norm': False, 'lr': 1.2611836918515903e-05, 'weight_decay': 1.93264832727009e-07, 'epochs': 326, 'loss': 'mae', 'optimizer': 'adam', 'graph_mode': 'off', 'use_snp_selection': True, 'num_snps': 21018}. Best is trial 7 with value: 0.06904423868437312.
[I 2025-11-03 12:36:24,065] Trial 40 finished with value: -0.0038064346956057076 and parameters: {'model_type': 'gcn', 'hidden_dims': '[256, 128, 64]', 'dropout': 0.20802961186177668, 'batch_norm': False, 'lr': 6.537978219563666e-06, 'weight_decay': 5.576643988890523e-07, 'epochs': 286, 'loss': 'mae', 'optimizer': 'adam', 'graph_mode': 'off', 'use_snp_selection': True, 'num_snps': 24090}. Best is trial 7 with value: 0.06904423868437312.
[I 2025-11-03 12:36:26,589] Trial 41 finished with value: 0.045005434107638104 and parameters: {'model_type': 'gcn', 'hidden_dims': '[256, 128, 64]', 'dropout': 0.1609262262393797, 'batch_norm': False, 'lr': 0.00046033460508155557, 'weight_decay': 1.9038550875119965e-07, 'epochs': 318, 'loss': 'mae', 'optimizer': 'adam', 'graph_mode': 'off', 'use_snp_selection': True, 'num_snps': 45129}. Best is trial 7 with value: 0.06904423868437312.
[I 2025-11-03 12:36:28,079] Trial 42 finished with value: 0.04251434754899372 and parameters: {'model_type': 'gcn', 'hidden_dims': '[256, 128, 64]', 'dropout': 0.12848887345227683, 'batch_norm': False, 'lr': 0.00015456110770886312, 'weight_decay': 7.045876733186981e-07, 'epochs': 346, 'loss': 'mae', 'optimizer': 'adam', 'graph_mode': 'off', 'use_snp_selection': True, 'num_snps': 2308}. Best is trial 7 with value: 0.06904423868437312.
[I 2025-11-03 12:36:29,223] Trial 43 finished with value: 0.023050809040700927 and parameters: {'model_type': 'gcn', 'hidden_dims': '[512, 64]', 'dropout': 0.2518441811919994, 'batch_norm': False, 'lr': 0.0004016093472547104, 'weight_decay': 4.202235566285927e-07, 'epochs': 136, 'loss': 'mae', 'optimizer': 'adam', 'graph_mode': 'off', 'use_snp_selection': True, 'num_snps': 16325}. Best is trial 7 with value: 0.06904423868437312.
[I 2025-11-03 12:36:30,946] Trial 44 finished with value: 0.034150465463686316 and parameters: {'model_type': 'gcn', 'hidden_dims': '[512, 256]', 'dropout': 0.1939207909706418, 'batch_norm': True, 'lr': 0.0006691072905861328, 'weight_decay': 2.1440448277175587e-06, 'epochs': 174, 'loss': 'mse', 'optimizer': 'adam', 'graph_mode': 'off', 'use_snp_selection': False}. Best is trial 7 with value: 0.06904423868437312.
[I 2025-11-03 12:36:31,768] Trial 45 finished with value: 0.034725261010655845 and parameters: {'model_type': 'gcn', 'hidden_dims': '[256, 128]', 'dropout': 0.29270084865233775, 'batch_norm': False, 'lr': 0.0002030715662361342, 'weight_decay': 2.001058852841678e-05, 'epochs': 62, 'loss': 'mae', 'optimizer': 'adam', 'graph_mode': 'off', 'use_snp_selection': False}. Best is trial 7 with value: 0.06904423868437312.
[I 2025-11-03 12:36:33,083] Trial 46 finished with value: 0.059023640346598696 and parameters: {'model_type': 'gcn', 'hidden_dims': '[512, 128]', 'dropout': 0.11818397376828055, 'batch_norm': True, 'lr': 0.00028169936915328466, 'weight_decay': 1.4860690410229993e-07, 'epochs': 82, 'loss': 'mse', 'optimizer': 'adam', 'graph_mode': 'off', 'use_snp_selection': True, 'num_snps': 27921}. Best is trial 7 with value: 0.06904423868437312.
[I 2025-11-03 12:36:34,412] Trial 47 finished with value: 0.04332040649716488 and parameters: {'model_type': 'gcn', 'hidden_dims': '[128, 64]', 'dropout': 0.40624627970907007, 'batch_norm': True, 'lr': 1.8973033396797805e-05, 'weight_decay': 0.0009669331628569803, 'epochs': 309, 'loss': 'mae', 'optimizer': 'adam', 'graph_mode': 'off', 'use_snp_selection': False}. Best is trial 7 with value: 0.06904423868437312.
[I 2025-11-03 12:36:36,582] Trial 48 finished with value: 0.025701452629413632 and parameters: {'model_type': 'gcn', 'hidden_dims': '[512, 256]', 'dropout': 0.26778710366310965, 'batch_norm': False, 'lr': 5.215950653303106e-05, 'weight_decay': 2.6727024298002333e-07, 'epochs': 274, 'loss': 'mse', 'optimizer': 'adam', 'graph_mode': 'off', 'use_snp_selection': False}. Best is trial 7 with value: 0.06904423868437312.
[I 2025-11-03 12:36:38,708] Trial 49 finished with value: 0.04560326972097966 and parameters: {'model_type': 'gcn', 'hidden_dims': '[256, 128, 64]', 'dropout': 0.17731917157374005, 'batch_norm': True, 'lr': 0.0009635799803023094, 'weight_decay': 4.335885074069929e-06, 'epochs': 331, 'loss': 'mae', 'optimizer': 'adam', 'graph_mode': 'off', 'use_snp_selection': False}. Best is trial 7 with value: 0.06904423868437312.
[I 2025-11-03 12:36:39,564] Trial 50 finished with value: 0.025349954749453917 and parameters: {'model_type': 'gcn', 'hidden_dims': '[512, 128]', 'dropout': 0.13636213801829794, 'batch_norm': True, 'lr': 1.0591954813809393e-06, 'weight_decay': 1.2692071368986726e-06, 'epochs': 96, 'loss': 'mse', 'optimizer': 'adam', 'graph_mode': 'off', 'use_snp_selection': True, 'num_snps': 9659}. Best is trial 7 with value: 0.06904423868437312.
[I 2025-11-03 12:36:40,858] Trial 51 finished with value: 0.057213194062600364 and parameters: {'model_type': 'gcn', 'hidden_dims': '[512, 128]', 'dropout': 0.11095687764627721, 'batch_norm': True, 'lr': 0.00028690904864626406, 'weight_decay': 1.3056368485716362e-07, 'epochs': 78, 'loss': 'mse', 'optimizer': 'adam', 'graph_mode': 'off', 'use_snp_selection': True, 'num_snps': 26754}. Best is trial 7 with value: 0.06904423868437312.
[I 2025-11-03 12:36:42,264] Trial 52 finished with value: 0.0346728956363671 and parameters: {'model_type': 'gcn', 'hidden_dims': '[512, 128]', 'dropout': 0.12209555060463911, 'batch_norm': True, 'lr': 0.0005648180756825218, 'weight_decay': 1.5044062855840493e-07, 'epochs': 46, 'loss': 'mse', 'optimizer': 'adam', 'graph_mode': 'off', 'use_snp_selection': True, 'num_snps': 34797}. Best is trial 7 with value: 0.06904423868437312.
[I 2025-11-03 12:36:43,963] Trial 53 finished with value: 0.034829079949856574 and parameters: {'model_type': 'gcn', 'hidden_dims': '[512, 128]', 'dropout': 0.14914098426783873, 'batch_norm': True, 'lr': 0.00015047108325967666, 'weight_decay': 3.5527959261611423e-07, 'epochs': 87, 'loss': 'mse', 'optimizer': 'adam', 'graph_mode': 'off', 'use_snp_selection': True, 'num_snps': 42608}. Best is trial 7 with value: 0.06904423868437312.
[I 2025-11-03 12:36:45,556] Trial 54 finished with value: 0.05019836300297945 and parameters: {'model_type': 'gcn', 'hidden_dims': '[512, 128]', 'dropout': 0.10663872648157655, 'batch_norm': True, 'lr': 0.0003468635071066443, 'weight_decay': 2.3152531685083315e-07, 'epochs': 170, 'loss': 'mse', 'optimizer': 'adam', 'graph_mode': 'off', 'use_snp_selection': True, 'num_snps': 27971}. Best is trial 7 with value: 0.06904423868437312.
