[I 2025-11-13 03:07:49,512] Trial 74 finished with value: 0.23105274326678074 and parameters: {'model_type': 'graphsage', 'hidden_dims': '[512, 64]', 'dropout': 0.14542634709837546, 'batch_norm': False, 'lr': 4.4638408715234944e-05, 'weight_decay': 1.3063318121146393e-05, 'epochs': 127, 'loss': 'mae', 'optimizer': 'adam', 'graph_mode': 'cutoff', 'cutoff': 0.6660788016361443, 'grm_norm': 'cosine', 'self_loops': True, 'use_snp_selection': True, 'num_snps': 53274}. Best is trial 51 with value: 0.24954735194865255.
[I 2025-11-13 03:09:26,132] Trial 75 finished with value: 0.18416080034335203 and parameters: {'model_type': 'graphsage', 'hidden_dims': '[512, 256]', 'dropout': 0.37041870165547397, 'batch_norm': False, 'lr': 0.00012804610036764745, 'weight_decay': 1.15788807380443e-06, 'epochs': 48, 'loss': 'mae', 'optimizer': 'adam', 'graph_mode': 'cutoff', 'cutoff': 0.6257588682770145, 'grm_norm': 'cosine', 'self_loops': True, 'use_snp_selection': True, 'num_snps': 57186}. Best is trial 51 with value: 0.24954735194865255.
[I 2025-11-13 03:10:52,412] Trial 76 finished with value: 0.21384332080312918 and parameters: {'model_type': 'graphsage', 'hidden_dims': '[512, 64]', 'dropout': 0.11483256231970362, 'batch_norm': True, 'lr': 3.464705527151702e-05, 'weight_decay': 8.244082979678517e-06, 'epochs': 112, 'loss': 'mae', 'optimizer': 'adam', 'graph_mode': 'cutoff', 'cutoff': 0.7138389000892273, 'grm_norm': 'cosine', 'self_loops': True, 'use_snp_selection': False}. Best is trial 51 with value: 0.24954735194865255.
[I 2025-11-13 03:12:23,918] Trial 77 finished with value: 0.14795118888338277 and parameters: {'model_type': 'graphsage', 'hidden_dims': '[512, 64]', 'dropout': 0.21750718193436486, 'batch_norm': False, 'lr': 9.086601906518307e-05, 'weight_decay': 4.683829326837975e-06, 'epochs': 59, 'loss': 'mse', 'optimizer': 'adam', 'graph_mode': 'cutoff', 'cutoff': 0.7465596068545013, 'grm_norm': 'cosine', 'self_loops': True, 'use_snp_selection': True, 'num_snps': 48134}. Best is trial 51 with value: 0.24954735194865255.
[I 2025-11-13 03:14:38,754] Trial 78 finished with value: 0.22799743966389152 and parameters: {'model_type': 'graphsage', 'hidden_dims': '[512, 64]', 'dropout': 0.16157291492414974, 'batch_norm': False, 'lr': 1.960056292363324e-05, 'weight_decay': 1.0419009937233936e-05, 'epochs': 185, 'loss': 'mae', 'optimizer': 'adam', 'graph_mode': 'cutoff', 'cutoff': 0.7829348630592022, 'grm_norm': 'cosine', 'self_loops': True, 'use_snp_selection': True, 'num_snps': 43115}. Best is trial 51 with value: 0.24954735194865255.
[I 2025-11-13 03:16:43,610] Trial 79 finished with value: 0.15579984141742093 and parameters: {'model_type': 'graphsage', 'hidden_dims': '[512, 64]', 'dropout': 0.20149948248552185, 'batch_norm': False, 'lr': 0.00021110590994815912, 'weight_decay': 3.0471043355209156e-05, 'epochs': 100, 'loss': 'mae', 'optimizer': 'adam', 'graph_mode': 'knn', 'source': 'grm', 'knn_k': 3, 'weighted_edges': False, 'symmetrize_mode': 'mutual', 'use_snp_selection': True, 'num_snps': 50833}. Best is trial 51 with value: 0.24954735194865255.
[I 2025-11-13 03:18:32,665] Trial 80 finished with value: 0.25207288460346516 and parameters: {'model_type': 'graphsage', 'hidden_dims': '[512, 64]', 'dropout': 0.26605682270397346, 'batch_norm': False, 'lr': 5.432934106768498e-05, 'weight_decay': 1.7001260969713056e-06, 'epochs': 82, 'loss': 'mae', 'optimizer': 'adam', 'graph_mode': 'cutoff', 'cutoff': 0.6495715540842378, 'grm_norm': 'cosine_then_gcn', 'self_loops': True, 'use_snp_selection': True, 'num_snps': 53853}. Best is trial 80 with value: 0.25207288460346516.
[I 2025-11-13 03:20:21,689] Trial 81 finished with value: 0.22575279324987435 and parameters: {'model_type': 'graphsage', 'hidden_dims': '[512, 64]', 'dropout': 0.26260422302850794, 'batch_norm': False, 'lr': 6.995259705067567e-05, 'weight_decay': 1.7195581707270604e-06, 'epochs': 82, 'loss': 'mae', 'optimizer': 'adam', 'graph_mode': 'cutoff', 'cutoff': 0.6528315343913541, 'grm_norm': 'cosine_then_gcn', 'self_loops': True, 'use_snp_selection': True, 'num_snps': 54383}. Best is trial 80 with value: 0.25207288460346516.
[I 2025-11-13 03:22:11,696] Trial 82 finished with value: 0.22378593018827728 and parameters: {'model_type': 'graphsage', 'hidden_dims': '[512, 64]', 'dropout': 0.1754930501284665, 'batch_norm': False, 'lr': 5.379766669562857e-05, 'weight_decay': 3.836013000907524e-06, 'epochs': 72, 'loss': 'mae', 'optimizer': 'adam', 'graph_mode': 'cutoff', 'cutoff': 0.7052732601905376, 'grm_norm': 'cosine_then_gcn', 'self_loops': True, 'use_snp_selection': True, 'num_snps': 58191}. Best is trial 80 with value: 0.25207288460346516.
[I 2025-11-13 03:24:07,653] Trial 83 finished with value: 0.24345205303707745 and parameters: {'model_type': 'graphsage', 'hidden_dims': '[512, 64]', 'dropout': 0.2998244148759761, 'batch_norm': False, 'lr': 4.1963257173219824e-05, 'weight_decay': 7.515495655192979e-07, 'epochs': 90, 'loss': 'mae', 'optimizer': 'adam', 'graph_mode': 'cutoff', 'cutoff': 0.6731146311796855, 'grm_norm': 'cosine_then_gcn', 'self_loops': True, 'use_snp_selection': True, 'num_snps': 55548}. Best is trial 80 with value: 0.25207288460346516.
[I 2025-11-13 03:26:11,510] Trial 84 finished with value: 0.20211903715051632 and parameters: {'model_type': 'graphsage', 'hidden_dims': '[512, 64]', 'dropout': 0.3294127167103364, 'batch_norm': False, 'lr': 0.00015233125731330097, 'weight_decay': 5.567879756516427e-06, 'epochs': 116, 'loss': 'mae', 'optimizer': 'adam', 'graph_mode': 'cutoff', 'cutoff': 0.5958682770144371, 'grm_norm': 'cosine_then_gcn', 'self_loops': True, 'use_snp_selection': True, 'num_snps': 51957}. Best is trial 80 with value: 0.25207288460346516.
[I 2025-11-13 03:27:53,315] Trial 85 finished with value: 0.23894306386035896 and parameters: {'model_type': 'graphsage', 'hidden_dims': '[512, 64]', 'dropout': 0.22112382468083983, 'batch_norm': False, 'lr': 1.2395110097448074e-05, 'weight_decay': 9.897484935172894e-07, 'epochs': 66, 'loss': 'mae', 'optimizer': 'adam', 'graph_mode': 'cutoff', 'cutoff': 0.6180018139921813, 'grm_norm': 'cosine', 'self_loops': True, 'use_snp_selection': True, 'num_snps': 53611}. Best is trial 80 with value: 0.25207288460346516.
[I 2025-11-13 03:29:36,014] Trial 86 finished with value: 0.25176826548283526 and parameters: {'model_type': 'graphsage', 'hidden_dims': '[512, 128]', 'dropout': 0.1436314782181623, 'batch_norm': False, 'lr': 2.7617935109753424e-05, 'weight_decay': 5.448107619362127e-05, 'epochs': 80, 'loss': 'mae', 'optimizer': 'adam', 'graph_mode': 'cutoff', 'cutoff': 0.6467393023707512, 'grm_norm': 'none', 'self_loops': False, 'use_snp_selection': True, 'num_snps': 49787}. Best is trial 80 with value: 0.25207288460346516.
[I 2025-11-13 03:31:16,093] Trial 87 finished with value: 0.23135639033276562 and parameters: {'model_type': 'graphsage', 'hidden_dims': '[512, 128]', 'dropout': 0.13451958682918355, 'batch_norm': False, 'lr': 2.8563708307509817e-05, 'weight_decay': 3.936501262698479e-05, 'epochs': 83, 'loss': 'mae', 'optimizer': 'adam', 'graph_mode': 'cutoff', 'cutoff': 0.7319694799474501, 'grm_norm': 'none', 'self_loops': False, 'use_snp_selection': True, 'num_snps': 47445}. Best is trial 80 with value: 0.25207288460346516.
[I 2025-11-13 03:32:10,178] Trial 88 finished with value: 0.2020151288356665 and parameters: {'model_type': 'graphsage', 'hidden_dims': '[512, 128]', 'dropout': 0.11391701438605636, 'batch_norm': True, 'lr': 3.4014656153205456e-05, 'weight_decay': 5.99983739262578e-05, 'epochs': 57, 'loss': 'mae', 'optimizer': 'adam', 'graph_mode': 'cutoff', 'cutoff': 0.6452002975223882, 'grm_norm': 'none', 'self_loops': False, 'use_snp_selection': False}. Best is trial 80 with value: 0.25207288460346516.
[I 2025-11-13 03:33:26,434] Trial 89 finished with value: 0.2434078368109077 and parameters: {'model_type': 'graphsage', 'hidden_dims': '[512, 128]', 'dropout': 0.13985239499966692, 'batch_norm': False, 'lr': 2.5975622875355255e-05, 'weight_decay': 1.9770808172820834e-06, 'epochs': 40, 'loss': 'mse', 'optimizer': 'adam', 'graph_mode': 'cutoff', 'cutoff': 0.6278144474042571, 'grm_norm': 'none', 'self_loops': False, 'use_snp_selection': True, 'num_snps': 41091}. Best is trial 80 with value: 0.25207288460346516.
[I 2025-11-13 03:36:32,486] Trial 90 finished with value: 0.22136780718672214 and parameters: {'model_type': 'graphsage', 'hidden_dims': '[512, 128]', 'dropout': 0.42982893783460385, 'batch_norm': False, 'lr': 1.767454114838779e-05, 'weight_decay': 2.74767373851417e-06, 'epochs': 286, 'loss': 'mae', 'optimizer': 'adam', 'graph_mode': 'cutoff', 'cutoff': 0.5389618212284015, 'grm_norm': 'none', 'self_loops': False, 'use_snp_selection': True, 'num_snps': 44605}. Best is trial 80 with value: 0.25207288460346516.
[I 2025-11-13 03:38:01,662] Trial 91 finished with value: 0.23207390895003527 and parameters: {'model_type': 'graphsage', 'hidden_dims': '[256, 128, 64]', 'dropout': 0.15551052648970473, 'batch_norm': False, 'lr': 1.343312090133295e-05, 'weight_decay': 2.1866456078041355e-05, 'epochs': 104, 'loss': 'mae', 'optimizer': 'adam', 'graph_mode': 'cutoff', 'cutoff': 0.6829118597856527, 'grm_norm': 'none', 'self_loops': False, 'use_snp_selection': True, 'num_snps': 49679}. Best is trial 80 with value: 0.25207288460346516.
[I 2025-11-13 03:39:35,308] Trial 92 finished with value: 0.23199915151191997 and parameters: {'model_type': 'graphsage', 'hidden_dims': '[512, 256]', 'dropout': 0.18759351345225603, 'batch_norm': False, 'lr': 7.338072691116355e-05, 'weight_decay': 7.242536211388529e-06, 'epochs': 95, 'loss': 'mae', 'optimizer': 'adam', 'graph_mode': 'cutoff', 'cutoff': 0.6554778532896237, 'grm_norm': 'cosine', 'self_loops': False, 'use_snp_selection': True, 'num_snps': 38431}. Best is trial 80 with value: 0.25207288460346516.
[I 2025-11-13 03:40:43,956] Trial 93 finished with value: 0.23940405089841788 and parameters: {'model_type': 'graphsage', 'hidden_dims': '[512, 64]', 'dropout': 0.1690978215270301, 'batch_norm': False, 'lr': 4.724923750862896e-05, 'weight_decay': 5.022103799952772e-05, 'epochs': 73, 'loss': 'mae', 'optimizer': 'adam', 'graph_mode': 'cutoff', 'cutoff': 0.6814207229433256, 'grm_norm': 'cosine_then_gcn', 'self_loops': False, 'use_snp_selection': True, 'num_snps': 23614}. Best is trial 80 with value: 0.25207288460346516.
[I 2025-11-13 03:42:07,170] Trial 94 finished with value: 0.24008787441944773 and parameters: {'model_type': 'graphsage', 'hidden_dims': '[256, 128]', 'dropout': 0.10292902750912403, 'batch_norm': False, 'lr': 9.514782425823678e-05, 'weight_decay': 1.2361684915389703e-06, 'epochs': 79, 'loss': 'mae', 'optimizer': 'adam', 'graph_mode': 'cutoff', 'cutoff': 0.7050765330931964, 'grm_norm': 'none', 'self_loops': True, 'use_snp_selection': True, 'num_snps': 50618}. Best is trial 80 with value: 0.25207288460346516.
[I 2025-11-13 03:43:29,974] Trial 95 finished with value: 0.22488435270114202 and parameters: {'model_type': 'graphsage', 'hidden_dims': '[512, 64]', 'dropout': 0.12833400218727725, 'batch_norm': False, 'lr': 9.268974291846834e-06, 'weight_decay': 5.250482394472569e-06, 'epochs': 203, 'loss': 'mae', 'optimizer': 'adam', 'graph_mode': 'cutoff', 'cutoff': 0.5735625498632858, 'grm_norm': 'cosine', 'self_loops': False, 'use_snp_selection': True, 'num_snps': 18013}. Best is trial 80 with value: 0.25207288460346516.
[I 2025-11-13 03:45:38,979] Trial 96 finished with value: 0.2127589555047047 and parameters: {'model_type': 'graphsage', 'hidden_dims': '[512, 64]', 'dropout': 0.23511840488757485, 'batch_norm': False, 'lr': 5.6546679254257804e-05, 'weight_decay': 1.73272301234126e-05, 'epochs': 64, 'loss': 'mae', 'optimizer': 'adam', 'graph_mode': 'knn', 'source': 'grm', 'knn_k': 6, 'weighted_edges': True, 'symmetrize_mode': 'union', 'use_snp_selection': True, 'num_snps': 46680}. Best is trial 80 with value: 0.25207288460346516.
[I 2025-11-13 03:47:45,673] Trial 97 finished with value: 0.24222504439577347 and parameters: {'model_type': 'graphsage', 'hidden_dims': '[512, 64]', 'dropout': 0.14964597953376102, 'batch_norm': False, 'lr': 3.922103526300729e-05, 'weight_decay': 3.2028595161977407e-06, 'epochs': 110, 'loss': 'mae', 'optimizer': 'adam', 'graph_mode': 'cutoff', 'cutoff': 0.5977048641395327, 'grm_norm': 'cosine', 'self_loops': True, 'use_snp_selection': True, 'num_snps': 55946}. Best is trial 80 with value: 0.25207288460346516.
[I 2025-11-13 03:49:45,077] Trial 98 finished with value: 0.2225946009498665 and parameters: {'model_type': 'graphsage', 'hidden_dims': '[512, 128]', 'dropout': 0.21164973736970133, 'batch_norm': False, 'lr': 2.0829443220649506e-05, 'weight_decay': 0.00011135275626950492, 'epochs': 89, 'loss': 'mae', 'optimizer': 'adam', 'graph_mode': 'cutoff', 'cutoff': 0.772166269552234, 'grm_norm': 'none', 'self_loops': False, 'use_snp_selection': True, 'num_snps': 58717}. Best is trial 80 with value: 0.25207288460346516.
[I 2025-11-13 03:51:16,115] Trial 99 finished with value: 0.1947999054078014 and parameters: {'model_type': 'graphsage', 'hidden_dims': '[512, 64]', 'dropout': 0.2904081411748439, 'batch_norm': False, 'lr': 7.522933519945097e-05, 'weight_decay': 1.316339141800552e-05, 'epochs': 56, 'loss': 'mae', 'optimizer': 'adam', 'graph_mode': 'cutoff', 'cutoff': 0.7282642124197463, 'grm_norm': 'cosine', 'self_loops': False, 'use_snp_selection': True, 'num_snps': 48739}. Best is trial 80 with value: 0.25207288460346516.
[I 2025-11-13 03:52:32,977] Trial 100 finished with value: 0.2491044439710482 and parameters: {'model_type': 'graphsage', 'hidden_dims': '[256, 128, 64]', 'dropout': 0.251216496233973, 'batch_norm': False, 'lr': 5.909888222876293e-05, 'weight_decay': 8.713668503925997e-06, 'epochs': 47, 'loss': 'mae', 'optimizer': 'adam', 'graph_mode': 'cutoff', 'cutoff': 0.7444413053293569, 'grm_norm': 'gcn', 'self_loops': True, 'use_snp_selection': True, 'num_snps': 53921}. Best is trial 80 with value: 0.25207288460346516.
[I 2025-11-13 03:53:49,295] Trial 101 finished with value: 0.23693121572200737 and parameters: {'model_type': 'graphsage', 'hidden_dims': '[256, 128, 64]', 'dropout': 0.2581628419056543, 'batch_norm': False, 'lr': 5.7171943447653584e-05, 'weight_decay': 9.268550772583279e-06, 'epochs': 47, 'loss': 'mae', 'optimizer': 'adam', 'graph_mode': 'cutoff', 'cutoff': 0.7407876083362659, 'grm_norm': 'gcn', 'self_loops': True, 'use_snp_selection': True, 'num_snps': 53227}. Best is trial 80 with value: 0.25207288460346516.
[I 2025-11-13 03:55:10,504] Trial 102 finished with value: 0.24469859077121017 and parameters: {'model_type': 'graphsage', 'hidden_dims': '[256, 128, 64]', 'dropout': 0.28151179528698367, 'batch_norm': False, 'lr': 4.750892975971378e-05, 'weight_decay': 3.992947607933175e-06, 'epochs': 63, 'loss': 'mae', 'optimizer': 'adam', 'graph_mode': 'cutoff', 'cutoff': 0.6973968036908248, 'grm_norm': 'gcn', 'self_loops': True, 'use_snp_selection': True, 'num_snps': 54200}. Best is trial 80 with value: 0.25207288460346516.
[I 2025-11-13 03:56:32,364] Trial 103 finished with value: 0.24740091440247367 and parameters: {'model_type': 'graphsage', 'hidden_dims': '[256, 128, 64]', 'dropout': 0.27006599645117024, 'batch_norm': False, 'lr': 5.0468576921192905e-05, 'weight_decay': 3.960024411231822e-06, 'epochs': 64, 'loss': 'mae', 'optimizer': 'adam', 'graph_mode': 'cutoff', 'cutoff': 0.7980778771329802, 'grm_norm': 'gcn', 'self_loops': True, 'use_snp_selection': True, 'num_snps': 54689}. Best is trial 80 with value: 0.25207288460346516.
[I 2025-11-13 03:57:53,262] Trial 104 finished with value: 0.24754630999306357 and parameters: {'model_type': 'graphsage', 'hidden_dims': '[256, 128, 64]', 'dropout': 0.2379544273331748, 'batch_norm': False, 'lr': 3.2585828370870685e-05, 'weight_decay': 2.2219377843642743e-06, 'epochs': 63, 'loss': 'mae', 'optimizer': 'adam', 'graph_mode': 'cutoff', 'cutoff': 0.8480544024246768, 'grm_norm': 'gcn', 'self_loops': True, 'use_snp_selection': True, 'num_snps': 54356}. Best is trial 80 with value: 0.25207288460346516.
[I 2025-11-13 03:59:14,353] Trial 105 finished with value: 0.2485949929625879 and parameters: {'model_type': 'graphsage', 'hidden_dims': '[256, 128, 64]', 'dropout': 0.24157738551017055, 'batch_norm': False, 'lr': 3.343567452342678e-05, 'weight_decay': 1.598627567599107e-06, 'epochs': 64, 'loss': 'mae', 'optimizer': 'adam', 'graph_mode': 'cutoff', 'cutoff': 0.8573791879956753, 'grm_norm': 'gcn', 'self_loops': True, 'use_snp_selection': True, 'num_snps': 54475}. Best is trial 80 with value: 0.25207288460346516.
[I 2025-11-13 04:00:30,858] Trial 106 finished with value: 0.2420027698753075 and parameters: {'model_type': 'graphsage', 'hidden_dims': '[256, 128, 64]', 'dropout': 0.24341969383316098, 'batch_norm': False, 'lr': 2.8831650638091543e-05, 'weight_decay': 1.553734491217757e-06, 'epochs': 47, 'loss': 'mae', 'optimizer': 'adam', 'graph_mode': 'cutoff', 'cutoff': 0.8697053075540728, 'grm_norm': 'gcn', 'self_loops': True, 'use_snp_selection': True, 'num_snps': 54477}. Best is trial 80 with value: 0.25207288460346516.
[I 2025-11-13 04:01:54,938] Trial 107 finished with value: 0.23203750264745593 and parameters: {'model_type': 'graphsage', 'hidden_dims': '[256, 128, 64]', 'dropout': 0.2808465823691346, 'batch_norm': False, 'lr': 3.204258535110927e-05, 'weight_decay': 2.2307334431980752e-06, 'epochs': 63, 'loss': 'mae', 'optimizer': 'adam', 'graph_mode': 'cutoff', 'cutoff': 0.8324773832125978, 'grm_norm': 'gcn', 'self_loops': True, 'use_snp_selection': True, 'num_snps': 57295}. Best is trial 80 with value: 0.25207288460346516.
[I 2025-11-13 04:02:32,536] Trial 108 finished with value: 0.21629679642985292 and parameters: {'model_type': 'graphsage', 'hidden_dims': '[256, 128, 64]', 'dropout': 0.25496188075661785, 'batch_norm': True, 'lr': 4.673629690567051e-05, 'weight_decay': 7.102967433204849e-07, 'epochs': 69, 'loss': 'mse', 'optimizer': 'adam', 'graph_mode': 'cutoff', 'cutoff': 0.8680977301601788, 'grm_norm': 'gcn', 'self_loops': True, 'use_snp_selection': False}. Best is trial 80 with value: 0.25207288460346516.
[I 2025-11-13 04:03:55,390] Trial 109 finished with value: 0.25003546418930783 and parameters: {'model_type': 'graphsage', 'hidden_dims': '[256, 128, 64]', 'dropout': 0.22898631061926505, 'batch_norm': False, 'lr': 2.5858068784046244e-05, 'weight_decay': 2.4263894293169486e-06, 'epochs': 52, 'loss': 'mae', 'optimizer': 'adam', 'graph_mode': 'cutoff', 'cutoff': 0.8077786940456525, 'grm_norm': 'gcn', 'self_loops': True, 'use_snp_selection': True, 'num_snps': 59436}. Best is trial 80 with value: 0.25207288460346516.
[I 2025-11-13 04:05:18,927] Trial 110 finished with value: 0.2271459147578327 and parameters: {'model_type': 'graphsage', 'hidden_dims': '[256, 128, 64]', 'dropout': 0.2327077180255971, 'batch_norm': False, 'lr': 2.5323408152394103e-05, 'weight_decay': 1.7726302517066742e-06, 'epochs': 53, 'loss': 'mae', 'optimizer': 'adam', 'graph_mode': 'cutoff', 'cutoff': 0.8046828154746504, 'grm_norm': 'gcn', 'self_loops': True, 'use_snp_selection': True, 'num_snps': 59603}. Best is trial 80 with value: 0.25207288460346516.
[I 2025-11-13 04:06:43,752] Trial 111 finished with value: 0.24501284319317995 and parameters: {'model_type': 'graphsage', 'hidden_dims': '[256, 128, 64]', 'dropout': 0.2709129024112653, 'batch_norm': False, 'lr': 3.7046007367295085e-05, 'weight_decay': 2.416271114319437e-06, 'epochs': 61, 'loss': 'mae', 'optimizer': 'adam', 'graph_mode': 'cutoff', 'cutoff': 0.8053977065991202, 'grm_norm': 'gcn', 'self_loops': True, 'use_snp_selection': True, 'num_snps': 58405}. Best is trial 80 with value: 0.25207288460346516.
[I 2025-11-13 04:08:03,331] Trial 112 finished with value: 0.22651972910493895 and parameters: {'model_type': 'graphsage', 'hidden_dims': '[256, 128, 64]', 'dropout': 0.26992075663882414, 'batch_norm': False, 'lr': 2.3046530994604e-05, 'weight_decay': 2.9077000359883053e-06, 'epochs': 45, 'loss': 'mae', 'optimizer': 'adam', 'graph_mode': 'cutoff', 'cutoff': 0.895815203656489, 'grm_norm': 'gcn', 'self_loops': True, 'use_snp_selection': True, 'num_snps': 58251}. Best is trial 80 with value: 0.25207288460346516.
[I 2025-11-13 04:09:31,336] Trial 113 finished with value: 0.23143647222266361 and parameters: {'model_type': 'graphsage', 'hidden_dims': '[256, 128, 64]', 'dropout': 0.24777981545126176, 'batch_norm': False, 'lr': 3.631501609829381e-05, 'weight_decay': 2.3704070364309876e-06, 'epochs': 79, 'loss': 'mae', 'optimizer': 'adam', 'graph_mode': 'cutoff', 'cutoff': 0.8178432238307526, 'grm_norm': 'gcn', 'self_loops': True, 'use_snp_selection': True, 'num_snps': 56653}. Best is trial 80 with value: 0.25207288460346516.
[I 2025-11-13 04:10:57,084] Trial 114 finished with value: 0.2292960355883074 and parameters: {'model_type': 'graphsage', 'hidden_dims': '[256, 128, 64]', 'dropout': 0.2240453625446703, 'batch_norm': False, 'lr': 3.203295194748091e-05, 'weight_decay': 1.36626809872465e-06, 'epochs': 60, 'loss': 'mae', 'optimizer': 'adam', 'graph_mode': 'cutoff', 'cutoff': 0.8481673981868585, 'grm_norm': 'gcn', 'self_loops': True, 'use_snp_selection': True, 'num_snps': 59989}. Best is trial 80 with value: 0.25207288460346516.
[I 2025-11-13 04:12:16,136] Trial 115 finished with value: 0.23810197905987923 and parameters: {'model_type': 'graphsage', 'hidden_dims': '[256, 128, 64]', 'dropout': 0.2589423265827881, 'batch_norm': False, 'lr': 3.924057490836407e-05, 'weight_decay': 1.8049256353812747e-06, 'epochs': 53, 'loss': 'mae', 'optimizer': 'adam', 'graph_mode': 'cutoff', 'cutoff': 0.7949064738118078, 'grm_norm': 'gcn', 'self_loops': True, 'use_snp_selection': True, 'num_snps': 55117}. Best is trial 80 with value: 0.25207288460346516.
