[I 2025-11-03 12:02:49,150] Trial 71 finished with value: 0.16093411614866668 and parameters: {'model_type': 'gcn', 'hidden_dims': '[512, 128]', 'dropout': 0.10899654874785848, 'batch_norm': True, 'lr': 0.000828551947672981, 'weight_decay': 1.4654339333980785e-07, 'epochs': 238, 'loss': 'mae', 'optimizer': 'adam', 'graph_mode': 'off', 'use_snp_selection': False}. Best is trial 11 with value: 0.16785372169072177.
[I 2025-11-03 12:02:52,680] Trial 72 finished with value: 0.15801654472330726 and parameters: {'model_type': 'gcn', 'hidden_dims': '[512, 128]', 'dropout': 0.11786878959301403, 'batch_norm': True, 'lr': 0.0008399918912202915, 'weight_decay': 5.645580625776849e-06, 'epochs': 241, 'loss': 'mae', 'optimizer': 'adam', 'graph_mode': 'off', 'use_snp_selection': False}. Best is trial 11 with value: 0.16785372169072177.
[I 2025-11-03 12:02:55,427] Trial 73 finished with value: 0.16257407392271 and parameters: {'model_type': 'gcn', 'hidden_dims': '[512, 128]', 'dropout': 0.5398361910493122, 'batch_norm': True, 'lr': 0.0005315367559626828, 'weight_decay': 3.2577321970268293e-07, 'epochs': 174, 'loss': 'mae', 'optimizer': 'adam', 'graph_mode': 'off', 'use_snp_selection': False}. Best is trial 11 with value: 0.16785372169072177.
[I 2025-11-03 12:02:58,249] Trial 74 finished with value: 0.1399391625081021 and parameters: {'model_type': 'gcn', 'hidden_dims': '[512, 128]', 'dropout': 0.5350605369682256, 'batch_norm': True, 'lr': 0.0009508443730109732, 'weight_decay': 3.234024393426145e-07, 'epochs': 182, 'loss': 'mae', 'optimizer': 'adam', 'graph_mode': 'off', 'use_snp_selection': False}. Best is trial 11 with value: 0.16785372169072177.
[I 2025-11-03 12:03:01,315] Trial 75 finished with value: 0.13882041108930054 and parameters: {'model_type': 'gcn', 'hidden_dims': '[512, 128]', 'dropout': 0.5763033534485096, 'batch_norm': True, 'lr': 0.0004958747650096306, 'weight_decay': 2.2109333159350724e-07, 'epochs': 200, 'loss': 'mae', 'optimizer': 'adam', 'graph_mode': 'off', 'use_snp_selection': False}. Best is trial 11 with value: 0.16785372169072177.
[I 2025-11-03 12:03:04,013] Trial 76 finished with value: 0.1440939487867218 and parameters: {'model_type': 'gcn', 'hidden_dims': '[512, 128]', 'dropout': 0.5481434280442701, 'batch_norm': True, 'lr': 0.0007001827663592097, 'weight_decay': 5.073778229580561e-07, 'epochs': 170, 'loss': 'mse', 'optimizer': 'adam', 'graph_mode': 'off', 'use_snp_selection': False}. Best is trial 11 with value: 0.16785372169072177.
[I 2025-11-03 12:03:06,860] Trial 77 finished with value: 0.16447319155951154 and parameters: {'model_type': 'gcn', 'hidden_dims': '[512, 128]', 'dropout': 0.4682467734043008, 'batch_norm': True, 'lr': 0.0002056088763682243, 'weight_decay': 1.578855848100795e-05, 'epochs': 182, 'loss': 'mae', 'optimizer': 'adam', 'graph_mode': 'off', 'use_snp_selection': False}. Best is trial 11 with value: 0.16785372169072177.
[I 2025-11-03 12:03:08,027] Trial 78 finished with value: 0.00296811401962307 and parameters: {'model_type': 'gcn', 'hidden_dims': '[512, 128]', 'dropout': 0.46608046301172174, 'batch_norm': True, 'lr': 1.0087771566710256e-06, 'weight_decay': 0.0004508963126038782, 'epochs': 180, 'loss': 'mae', 'optimizer': 'adam', 'graph_mode': 'off', 'use_snp_selection': True, 'num_snps': 2246}. Best is trial 11 with value: 0.16785372169072177.
[I 2025-11-03 12:03:10,381] Trial 79 finished with value: 0.13758738901558798 and parameters: {'model_type': 'gcn', 'hidden_dims': '[512, 128]', 'dropout': 0.4948997576328488, 'batch_norm': True, 'lr': 0.00032599875515934606, 'weight_decay': 2.375078855638367e-06, 'epochs': 138, 'loss': 'mae', 'optimizer': 'adam', 'graph_mode': 'off', 'use_snp_selection': False}. Best is trial 11 with value: 0.16785372169072177.
[I 2025-11-03 12:03:12,978] Trial 80 finished with value: 0.15499249766049641 and parameters: {'model_type': 'gcn', 'hidden_dims': '[512, 128]', 'dropout': 0.4379389112841335, 'batch_norm': True, 'lr': 0.00020796005002992747, 'weight_decay': 1.25777102031532e-07, 'epochs': 163, 'loss': 'mse', 'optimizer': 'adam', 'graph_mode': 'off', 'use_snp_selection': False}. Best is trial 11 with value: 0.16785372169072177.
[I 2025-11-03 12:03:16,150] Trial 81 finished with value: 0.15653554350851095 and parameters: {'model_type': 'gcn', 'hidden_dims': '[512, 128]', 'dropout': 0.5199782496795805, 'batch_norm': True, 'lr': 0.0002887935937991727, 'weight_decay': 1.5936386996895583e-05, 'epochs': 209, 'loss': 'mae', 'optimizer': 'adam', 'graph_mode': 'off', 'use_snp_selection': False}. Best is trial 11 with value: 0.16785372169072177.
[I 2025-11-03 12:03:19,519] Trial 82 finished with value: 0.15973142869655754 and parameters: {'model_type': 'gcn', 'hidden_dims': '[512, 128]', 'dropout': 0.567408459054289, 'batch_norm': True, 'lr': 0.0006154971946192026, 'weight_decay': 1.2675450201768094e-06, 'epochs': 223, 'loss': 'mae', 'optimizer': 'adam', 'graph_mode': 'off', 'use_snp_selection': False}. Best is trial 11 with value: 0.16785372169072177.
[I 2025-11-03 12:03:22,967] Trial 83 finished with value: 0.1683173492107372 and parameters: {'model_type': 'gcn', 'hidden_dims': '[512, 128]', 'dropout': 0.10975443669349032, 'batch_norm': True, 'lr': 0.0004953118683265864, 'weight_decay': 3.3318641879311505e-05, 'epochs': 233, 'loss': 'mae', 'optimizer': 'adam', 'graph_mode': 'off', 'use_snp_selection': False}. Best is trial 83 with value: 0.1683173492107372.
[I 2025-11-03 12:03:26,360] Trial 84 finished with value: 0.16537370277749122 and parameters: {'model_type': 'gcn', 'hidden_dims': '[512, 128]', 'dropout': 0.11278338804304604, 'batch_norm': True, 'lr': 0.0005047581080122683, 'weight_decay': 2.5443242012710894e-05, 'epochs': 230, 'loss': 'mae', 'optimizer': 'adam', 'graph_mode': 'off', 'use_snp_selection': False}. Best is trial 83 with value: 0.1683173492107372.
[I 2025-11-03 12:03:29,720] Trial 85 finished with value: 0.15117480296738348 and parameters: {'model_type': 'gcn', 'hidden_dims': '[512, 128]', 'dropout': 0.2902818575683862, 'batch_norm': True, 'lr': 0.00048115170146229756, 'weight_decay': 3.082854113174719e-05, 'epochs': 228, 'loss': 'mae', 'optimizer': 'adam', 'graph_mode': 'off', 'use_snp_selection': False}. Best is trial 83 with value: 0.1683173492107372.
[I 2025-11-03 12:03:33,372] Trial 86 finished with value: 0.12606953657685055 and parameters: {'model_type': 'gcn', 'hidden_dims': '[512, 128]', 'dropout': 0.15774527614842732, 'batch_norm': False, 'lr': 0.0003627738284036122, 'weight_decay': 5.7187345154797504e-05, 'epochs': 253, 'loss': 'mae', 'optimizer': 'adam', 'graph_mode': 'off', 'use_snp_selection': False}. Best is trial 83 with value: 0.1683173492107372.
[I 2025-11-03 12:03:35,936] Trial 87 finished with value: 0.1588297037764315 and parameters: {'model_type': 'gcn', 'hidden_dims': '[512, 128]', 'dropout': 0.14065709019891875, 'batch_norm': True, 'lr': 0.00042725461866933024, 'weight_decay': 4.0831431691568644e-05, 'epochs': 154, 'loss': 'mae', 'optimizer': 'adam', 'graph_mode': 'off', 'use_snp_selection': False}. Best is trial 83 with value: 0.1683173492107372.
[I 2025-11-03 12:03:38,059] Trial 88 finished with value: 0.15355365349976866 and parameters: {'model_type': 'gcn', 'hidden_dims': '[256, 128, 64]', 'dropout': 0.11030208054252424, 'batch_norm': True, 'lr': 0.0005507961460296095, 'weight_decay': 0.00011793998160462939, 'epochs': 194, 'loss': 'mae', 'optimizer': 'adam', 'graph_mode': 'off', 'use_snp_selection': False}. Best is trial 83 with value: 0.1683173492107372.
[I 2025-11-03 12:03:41,400] Trial 89 finished with value: 0.15607041034845637 and parameters: {'model_type': 'gcn', 'hidden_dims': '[512, 128]', 'dropout': 0.14058286888402757, 'batch_norm': True, 'lr': 0.00020270439730931162, 'weight_decay': 8.597805834122569e-05, 'epochs': 191, 'loss': 'mae', 'optimizer': 'adam', 'graph_mode': 'off', 'use_snp_selection': True, 'num_snps': 45058}. Best is trial 83 with value: 0.1683173492107372.
[I 2025-11-03 12:03:46,093] Trial 90 finished with value: 0.15992447053045927 and parameters: {'model_type': 'gcn', 'hidden_dims': '[512, 64]', 'dropout': 0.17374405053783254, 'batch_norm': True, 'lr': 0.0002657152301445092, 'weight_decay': 2.1791741917496685e-05, 'epochs': 342, 'loss': 'mse', 'optimizer': 'adam', 'graph_mode': 'off', 'use_snp_selection': False}. Best is trial 83 with value: 0.1683173492107372.
[I 2025-11-03 12:03:49,548] Trial 91 finished with value: 0.15788704352435023 and parameters: {'model_type': 'gcn', 'hidden_dims': '[512, 128]', 'dropout': 0.1003013497087357, 'batch_norm': True, 'lr': 0.0007148939022210605, 'weight_decay': 3.0845608863908625e-05, 'epochs': 237, 'loss': 'mae', 'optimizer': 'adam', 'graph_mode': 'off', 'use_snp_selection': False}. Best is trial 83 with value: 0.1683173492107372.
[I 2025-11-03 12:03:52,993] Trial 92 finished with value: 0.14817392273015295 and parameters: {'model_type': 'gcn', 'hidden_dims': '[512, 128]', 'dropout': 0.11561160046581884, 'batch_norm': True, 'lr': 0.000835475151565697, 'weight_decay': 4.0088791308189994e-05, 'epochs': 231, 'loss': 'mae', 'optimizer': 'adam', 'graph_mode': 'off', 'use_snp_selection': False}. Best is trial 83 with value: 0.1683173492107372.
[I 2025-11-03 12:03:56,604] Trial 93 finished with value: 0.16000627496722677 and parameters: {'model_type': 'gcn', 'hidden_dims': '[512, 128]', 'dropout': 0.11372906054142881, 'batch_norm': True, 'lr': 0.0009967975191847792, 'weight_decay': 1.7154848396721933e-07, 'epochs': 243, 'loss': 'mae', 'optimizer': 'adam', 'graph_mode': 'off', 'use_snp_selection': False}. Best is trial 83 with value: 0.1683173492107372.
[I 2025-11-03 12:03:59,868] Trial 94 finished with value: 0.15396082713032128 and parameters: {'model_type': 'gcn', 'hidden_dims': '[512, 128]', 'dropout': 0.13046770015236106, 'batch_norm': True, 'lr': 0.0006018298459848388, 'weight_decay': 3.2229684237657867e-07, 'epochs': 215, 'loss': 'mae', 'optimizer': 'adam', 'graph_mode': 'off', 'use_snp_selection': False}. Best is trial 83 with value: 0.1683173492107372.
[I 2025-11-03 12:04:03,817] Trial 95 finished with value: 0.15629147283068978 and parameters: {'model_type': 'gcn', 'hidden_dims': '[512, 128]', 'dropout': 0.15288991792443152, 'batch_norm': True, 'lr': 0.00033286438532428993, 'weight_decay': 7.069366965099772e-06, 'epochs': 277, 'loss': 'mae', 'optimizer': 'adam', 'graph_mode': 'off', 'use_snp_selection': False}. Best is trial 83 with value: 0.1683173492107372.
[I 2025-11-03 12:04:07,620] Trial 96 finished with value: 0.1575803280439239 and parameters: {'model_type': 'gcn', 'hidden_dims': '[512, 128]', 'dropout': 0.11034209722594476, 'batch_norm': True, 'lr': 0.0004052350655446703, 'weight_decay': 1.908055824542618e-05, 'epochs': 264, 'loss': 'mae', 'optimizer': 'adam', 'graph_mode': 'off', 'use_snp_selection': False}. Best is trial 83 with value: 0.1683173492107372.
[I 2025-11-03 12:04:10,393] Trial 97 finished with value: 0.1505283151197408 and parameters: {'model_type': 'gcn', 'hidden_dims': '[512, 128]', 'dropout': 0.469631664785921, 'batch_norm': True, 'lr': 0.0005071326986111358, 'weight_decay': 1.2926730394000998e-07, 'epochs': 173, 'loss': 'mae', 'optimizer': 'adam', 'graph_mode': 'off', 'use_snp_selection': False}. Best is trial 83 with value: 0.1683173492107372.
[I 2025-11-03 12:04:12,743] Trial 98 finished with value: 0.1559180511958342 and parameters: {'model_type': 'gcn', 'hidden_dims': '[256, 128]', 'dropout': 0.5032394721567941, 'batch_norm': True, 'lr': 0.0007451826948773796, 'weight_decay': 2.609942981869427e-07, 'epochs': 257, 'loss': 'mae', 'optimizer': 'adam', 'graph_mode': 'off', 'use_snp_selection': False}. Best is trial 83 with value: 0.1683173492107372.
[I 2025-11-03 12:04:15,628] Trial 99 finished with value: 0.12794519341983757 and parameters: {'model_type': 'gcn', 'hidden_dims': '[512, 128]', 'dropout': 0.1287037151006831, 'batch_norm': False, 'lr': 0.0002349430970211961, 'weight_decay': 4.0653364567669257e-07, 'epochs': 187, 'loss': 'mae', 'optimizer': 'adam', 'graph_mode': 'off', 'use_snp_selection': False}. Best is trial 83 with value: 0.1683173492107372.
[I 2025-11-03 12:04:17,129] Trial 100 finished with value: 0.1367255944933049 and parameters: {'model_type': 'gcn', 'hidden_dims': '[128, 64]', 'dropout': 0.3702599170999101, 'batch_norm': True, 'lr': 0.0004649443351551555, 'weight_decay': 1.7926282624736227e-07, 'epochs': 198, 'loss': 'mse', 'optimizer': 'adam', 'graph_mode': 'off', 'use_snp_selection': False}. Best is trial 83 with value: 0.1683173492107372.
[I 2025-11-03 12:04:20,243] Trial 101 finished with value: 0.13990470541844902 and parameters: {'model_type': 'gcn', 'hidden_dims': '[512, 256]', 'dropout': 0.5382386963242115, 'batch_norm': True, 'lr': 0.00014922625923778312, 'weight_decay': 1.5213757379884172e-05, 'epochs': 208, 'loss': 'mae', 'optimizer': 'adam', 'graph_mode': 'off', 'use_snp_selection': False}. Best is trial 83 with value: 0.1683173492107372.
[I 2025-11-03 12:04:22,594] Trial 102 finished with value: 0.10733058005027463 and parameters: {'model_type': 'gcn', 'hidden_dims': '[256, 128, 64]', 'dropout': 0.520848801576399, 'batch_norm': True, 'lr': 0.00010642068517916003, 'weight_decay': 1.0987001779790365e-05, 'epochs': 223, 'loss': 'mae', 'optimizer': 'adam', 'graph_mode': 'off', 'use_snp_selection': False}. Best is trial 83 with value: 0.1683173492107372.
[I 2025-11-03 12:04:25,686] Trial 103 finished with value: 0.13910398482764127 and parameters: {'model_type': 'gcn', 'hidden_dims': '[512, 256]', 'dropout': 0.1018387659987146, 'batch_norm': True, 'lr': 8.427082884538237e-05, 'weight_decay': 4.271294068898256e-05, 'epochs': 202, 'loss': 'mae', 'optimizer': 'adam', 'graph_mode': 'off', 'use_snp_selection': False}. Best is trial 83 with value: 0.1683173492107372.
[I 2025-11-03 12:04:28,589] Trial 104 finished with value: 0.13924416521134722 and parameters: {'model_type': 'gcn', 'hidden_dims': '[512, 128]', 'dropout': 0.5105588692734584, 'batch_norm': True, 'lr': 0.00030495033588603547, 'weight_decay': 6.704609023991801e-07, 'epochs': 183, 'loss': 'mae', 'optimizer': 'adam', 'graph_mode': 'off', 'use_snp_selection': False}. Best is trial 83 with value: 0.1683173492107372.
[I 2025-11-03 12:04:31,718] Trial 105 finished with value: 0.1693502671945205 and parameters: {'model_type': 'gcn', 'hidden_dims': '[512, 64]', 'dropout': 0.16069162026029135, 'batch_norm': True, 'lr': 0.00037583553597472433, 'weight_decay': 1.8740052179524705e-05, 'epochs': 209, 'loss': 'mae', 'optimizer': 'adam', 'graph_mode': 'off', 'use_snp_selection': False}. Best is trial 105 with value: 0.1693502671945205.
[I 2025-11-03 12:04:33,777] Trial 106 finished with value: 0.1568808265758855 and parameters: {'model_type': 'gcn', 'hidden_dims': '[512, 128]', 'dropout': 0.13451928143507846, 'batch_norm': True, 'lr': 0.00038183572884876977, 'weight_decay': 2.0733917016498018e-05, 'epochs': 110, 'loss': 'mae', 'optimizer': 'adam', 'graph_mode': 'off', 'use_snp_selection': False}. Best is trial 105 with value: 0.1693502671945205.
[I 2025-11-03 12:04:37,915] Trial 107 finished with value: 0.15958438036754075 and parameters: {'model_type': 'gcn', 'hidden_dims': '[512, 64]', 'dropout': 0.16662429482857471, 'batch_norm': True, 'lr': 0.0006462765963872132, 'weight_decay': 2.8832556366640036e-05, 'epochs': 293, 'loss': 'mae', 'optimizer': 'adam', 'graph_mode': 'off', 'use_snp_selection': False}. Best is trial 105 with value: 0.1693502671945205.
[I 2025-11-03 12:04:42,221] Trial 108 finished with value: 0.1557584768660211 and parameters: {'model_type': 'gcn', 'hidden_dims': '[512, 64]', 'dropout': 0.12471466957378916, 'batch_norm': True, 'lr': 0.0005712203214874246, 'weight_decay': 2.4856910347539024e-05, 'epochs': 312, 'loss': 'mae', 'optimizer': 'adam', 'graph_mode': 'off', 'use_snp_selection': False}. Best is trial 105 with value: 0.1693502671945205.
[I 2025-11-03 12:04:44,881] Trial 109 finished with value: 0.15528463225363617 and parameters: {'model_type': 'gcn', 'hidden_dims': '[512, 64]', 'dropout': 0.1107925945890301, 'batch_norm': True, 'lr': 0.0008103363177205989, 'weight_decay': 8.38782073733637e-07, 'epochs': 219, 'loss': 'mae', 'optimizer': 'adam', 'graph_mode': 'off', 'use_snp_selection': True, 'num_snps': 28308}. Best is trial 105 with value: 0.1693502671945205.
[I 2025-11-03 12:04:48,348] Trial 110 finished with value: 0.14575739582496663 and parameters: {'model_type': 'gcn', 'hidden_dims': '[512, 64]', 'dropout': 0.1458726299629899, 'batch_norm': True, 'lr': 0.0004502182979420147, 'weight_decay': 8.935695351061886e-06, 'epochs': 236, 'loss': 'mse', 'optimizer': 'adam', 'graph_mode': 'off', 'use_snp_selection': False}. Best is trial 105 with value: 0.1693502671945205.
[I 2025-11-03 12:04:51,480] Trial 111 finished with value: 0.09705257093499325 and parameters: {'model_type': 'gcn', 'hidden_dims': '[512, 256]', 'dropout': 0.484997005900273, 'batch_norm': True, 'lr': 5.1079683740765656e-05, 'weight_decay': 1.3717444609228538e-05, 'epochs': 207, 'loss': 'mae', 'optimizer': 'adam', 'graph_mode': 'off', 'use_snp_selection': False}. Best is trial 105 with value: 0.1693502671945205.
[I 2025-11-03 12:04:55,057] Trial 112 finished with value: 0.15344716643026174 and parameters: {'model_type': 'gcn', 'hidden_dims': '[512, 128]', 'dropout': 0.2132208998822689, 'batch_norm': True, 'lr': 0.000287010273511637, 'weight_decay': 1.2954631346462636e-07, 'epochs': 246, 'loss': 'mae', 'optimizer': 'adam', 'graph_mode': 'off', 'use_snp_selection': False}. Best is trial 105 with value: 0.1693502671945205.
[I 2025-11-03 12:04:58,076] Trial 113 finished with value: 0.14912944063672426 and parameters: {'model_type': 'gcn', 'hidden_dims': '[512, 256]', 'dropout': 0.5302997642478788, 'batch_norm': True, 'lr': 0.00033436655963668785, 'weight_decay': 1.574970697095721e-05, 'epochs': 197, 'loss': 'mae', 'optimizer': 'adam', 'graph_mode': 'off', 'use_snp_selection': False}. Best is trial 105 with value: 0.1693502671945205.
[I 2025-11-03 12:05:01,271] Trial 114 finished with value: 0.14289714086576202 and parameters: {'model_type': 'gcn', 'hidden_dims': '[512, 128]', 'dropout': 0.46145046953580604, 'batch_norm': True, 'lr': 0.0001990702388777067, 'weight_decay': 2.2174504611491086e-07, 'epochs': 214, 'loss': 'mae', 'optimizer': 'adam', 'graph_mode': 'off', 'use_snp_selection': False}. Best is trial 105 with value: 0.1693502671945205.
[I 2025-11-03 12:05:03,112] Trial 115 finished with value: 0.14266608686250468 and parameters: {'model_type': 'gcn', 'hidden_dims': '[256, 128]', 'dropout': 0.5427799734980844, 'batch_norm': True, 'lr': 0.0002385844048245328, 'weight_decay': 1.7523696344048204e-05, 'epochs': 178, 'loss': 'mae', 'optimizer': 'adam', 'graph_mode': 'off', 'use_snp_selection': False}. Best is trial 105 with value: 0.1693502671945205.
[I 2025-11-03 12:05:06,284] Trial 116 finished with value: 0.14728695964442318 and parameters: {'model_type': 'gcn', 'hidden_dims': '[512, 128]', 'dropout': 0.12151524554676145, 'batch_norm': True, 'lr': 0.00039209209058224545, 'weight_decay': 2.447852629074044e-05, 'epochs': 210, 'loss': 'mae', 'optimizer': 'adam', 'graph_mode': 'off', 'use_snp_selection': False}. Best is trial 105 with value: 0.1693502671945205.
[I 2025-11-03 12:05:09,618] Trial 117 finished with value: 0.12055239466696031 and parameters: {'model_type': 'gcn', 'hidden_dims': '[512, 64]', 'dropout': 0.10762959374715106, 'batch_norm': True, 'lr': 2.4708101643798716e-05, 'weight_decay': 1.1395195441715181e-07, 'epochs': 227, 'loss': 'mae', 'optimizer': 'adam', 'graph_mode': 'off', 'use_snp_selection': False}. Best is trial 105 with value: 0.1693502671945205.
[I 2025-11-03 12:05:14,204] Trial 118 finished with value: 0.1169606134026897 and parameters: {'model_type': 'gcn', 'hidden_dims': '[512, 256]', 'dropout': 0.31423227419176747, 'batch_norm': False, 'lr': 0.0005080029372154651, 'weight_decay': 1.6132476100680568e-07, 'epochs': 338, 'loss': 'mae', 'optimizer': 'adam', 'graph_mode': 'off', 'use_snp_selection': False}. Best is trial 105 with value: 0.1693502671945205.
[I 2025-11-03 12:05:16,986] Trial 119 finished with value: 0.11895299688576319 and parameters: {'model_type': 'gcn', 'hidden_dims': '[512, 128]', 'dropout': 0.3957343103631256, 'batch_norm': True, 'lr': 0.00012570533174592944, 'weight_decay': 3.8403153615489196e-05, 'epochs': 168, 'loss': 'mae', 'optimizer': 'adam', 'graph_mode': 'off', 'use_snp_selection': False}. Best is trial 105 with value: 0.1693502671945205.
[I 2025-11-03 12:05:18,317] Trial 120 finished with value: 0.13306838259094328 and parameters: {'model_type': 'gcn', 'hidden_dims': '[128, 64]', 'dropout': 0.43128507094428403, 'batch_norm': True, 'lr': 0.0001788379576978441, 'weight_decay': 3.171993116604173e-07, 'epochs': 187, 'loss': 'mse', 'optimizer': 'adam', 'graph_mode': 'off', 'use_snp_selection': False}. Best is trial 105 with value: 0.1693502671945205.
[I 2025-11-03 12:05:22,810] Trial 121 finished with value: 0.1620822875242598 and parameters: {'model_type': 'gcn', 'hidden_dims': '[512, 256]', 'dropout': 0.13262528363969361, 'batch_norm': True, 'lr': 0.00044868824549486785, 'weight_decay': 1.4742176859663107e-07, 'epochs': 329, 'loss': 'mae', 'optimizer': 'adam', 'graph_mode': 'off', 'use_snp_selection': False}. Best is trial 105 with value: 0.1693502671945205.
[I 2025-11-03 12:05:25,119] Trial 122 finished with value: 0.15982686520456532 and parameters: {'model_type': 'gcn', 'hidden_dims': '[512, 256]', 'dropout': 0.1600288532272578, 'batch_norm': True, 'lr': 0.00035898653041630647, 'weight_decay': 1.0047842061766346e-07, 'epochs': 140, 'loss': 'mae', 'optimizer': 'adam', 'graph_mode': 'off', 'use_snp_selection': False}. Best is trial 105 with value: 0.1693502671945205.
