[I 2025-11-03 13:57:17,012] Trial 140 finished with value: 0.0597012677254085 and parameters: {'model_type': 'gcn', 'hidden_dims': '[256, 128]', 'dropout': 0.4596574803717886, 'batch_norm': True, 'lr': 0.0005086407443537684, 'weight_decay': 3.173310343172721e-06, 'epochs': 185, 'loss': 'mse', 'optimizer': 'adam', 'graph_mode': 'off', 'use_snp_selection': False}. Best is trial 121 with value: 0.08695958387848404.
[I 2025-11-03 13:57:18,345] Trial 141 finished with value: 0.06936315579053592 and parameters: {'model_type': 'gcn', 'hidden_dims': '[256, 128]', 'dropout': 0.4404163627368806, 'batch_norm': True, 'lr': 0.0009176337339471333, 'weight_decay': 6.8465276877034005e-06, 'epochs': 222, 'loss': 'mse', 'optimizer': 'adam', 'graph_mode': 'off', 'use_snp_selection': False}. Best is trial 121 with value: 0.08695958387848404.
[I 2025-11-03 13:57:19,727] Trial 142 finished with value: 0.0659069764181139 and parameters: {'model_type': 'gcn', 'hidden_dims': '[256, 128]', 'dropout': 0.41932556310682084, 'batch_norm': True, 'lr': 0.0006265966584298789, 'weight_decay': 4.219535390669305e-06, 'epochs': 249, 'loss': 'mse', 'optimizer': 'adam', 'graph_mode': 'off', 'use_snp_selection': False}. Best is trial 121 with value: 0.08695958387848404.
[I 2025-11-03 13:57:21,079] Trial 143 finished with value: 0.06304310751402108 and parameters: {'model_type': 'gcn', 'hidden_dims': '[256, 128]', 'dropout': 0.5006990106370302, 'batch_norm': True, 'lr': 0.0007718831602037388, 'weight_decay': 1.0308786582445113e-05, 'epochs': 240, 'loss': 'mse', 'optimizer': 'adam', 'graph_mode': 'off', 'use_snp_selection': False}. Best is trial 121 with value: 0.08695958387848404.
[I 2025-11-03 13:57:22,552] Trial 144 finished with value: 0.058591473303730046 and parameters: {'model_type': 'gcn', 'hidden_dims': '[256, 128]', 'dropout': 0.5271882684821939, 'batch_norm': True, 'lr': 0.0006999488767615383, 'weight_decay': 7.672142362858251e-06, 'epochs': 262, 'loss': 'mse', 'optimizer': 'adam', 'graph_mode': 'off', 'use_snp_selection': False}. Best is trial 121 with value: 0.08695958387848404.
[I 2025-11-03 13:57:23,914] Trial 145 finished with value: 0.062297795466951814 and parameters: {'model_type': 'gcn', 'hidden_dims': '[256, 128]', 'dropout': 0.555346187766045, 'batch_norm': True, 'lr': 0.0008803994533222656, 'weight_decay': 4.78865061245573e-06, 'epochs': 233, 'loss': 'mse', 'optimizer': 'adam', 'graph_mode': 'off', 'use_snp_selection': False}. Best is trial 121 with value: 0.08695958387848404.
[I 2025-11-03 13:57:25,650] Trial 146 finished with value: 0.06661573389662677 and parameters: {'model_type': 'gcn', 'hidden_dims': '[512, 128]', 'dropout': 0.47284831158845747, 'batch_norm': True, 'lr': 0.0005764527800976527, 'weight_decay': 5.9564588329913e-06, 'epochs': 197, 'loss': 'mse', 'optimizer': 'adam', 'graph_mode': 'off', 'use_snp_selection': False}. Best is trial 121 with value: 0.08695958387848404.
[I 2025-11-03 13:57:26,713] Trial 147 finished with value: 0.05987606328715453 and parameters: {'model_type': 'gcn', 'hidden_dims': '[128, 64]', 'dropout': 0.512803933743929, 'batch_norm': True, 'lr': 0.0009962990368527194, 'weight_decay': 1.5963665227966724e-06, 'epochs': 216, 'loss': 'mse', 'optimizer': 'adam', 'graph_mode': 'off', 'use_snp_selection': False}. Best is trial 121 with value: 0.08695958387848404.
[I 2025-11-03 13:57:28,280] Trial 148 finished with value: 0.05361520841721021 and parameters: {'model_type': 'gcn', 'hidden_dims': '[512, 64]', 'dropout': 0.5762500890889488, 'batch_norm': True, 'lr': 0.0003712204351564554, 'weight_decay': 1.0670469430165966e-06, 'epochs': 172, 'loss': 'mae', 'optimizer': 'adam', 'graph_mode': 'off', 'use_snp_selection': False}. Best is trial 121 with value: 0.08695958387848404.
[I 2025-11-03 13:57:29,883] Trial 149 finished with value: 0.07914719269369944 and parameters: {'model_type': 'gcn', 'hidden_dims': '[256, 128, 64]', 'dropout': 0.18597864354767618, 'batch_norm': True, 'lr': 0.0008084745160486507, 'weight_decay': 3.2224101588278497e-07, 'epochs': 179, 'loss': 'mse', 'optimizer': 'adam', 'graph_mode': 'off', 'use_snp_selection': True, 'num_snps': 29744}. Best is trial 121 with value: 0.08695958387848404.
[I 2025-11-03 13:57:46,492] Trial 0 finished with value: 0.036404766598047734 and parameters: {'model_type': 'gcn', 'hidden_dims': '[128, 64]', 'dropout': 0.199031432379812, 'batch_norm': True, 'lr': 1.8408544111075837e-06, 'weight_decay': 5.5136510071208614e-05, 'epochs': 336, 'loss': 'mae', 'optimizer': 'adam', 'graph_mode': 'off', 'use_snp_selection': True, 'num_snps': 43862}. Best is trial 0 with value: 0.036404766598047734.
[I 2025-11-03 13:57:47,852] Trial 1 finished with value: 0.03179501930042336 and parameters: {'model_type': 'gcn', 'hidden_dims': '[256, 128]', 'dropout': 0.4370668075331726, 'batch_norm': True, 'lr': 7.133471581159139e-05, 'weight_decay': 1.128633586803549e-05, 'epochs': 242, 'loss': 'mae', 'optimizer': 'adam', 'graph_mode': 'off', 'use_snp_selection': False}. Best is trial 0 with value: 0.036404766598047734.
[I 2025-11-03 13:57:48,887] Trial 2 finished with value: 0.037348149907137904 and parameters: {'model_type': 'gcn', 'hidden_dims': '[256, 128, 64]', 'dropout': 0.41314357415569625, 'batch_norm': False, 'lr': 3.952233718592101e-06, 'weight_decay': 0.00026754769258252603, 'epochs': 149, 'loss': 'mse', 'optimizer': 'adam', 'graph_mode': 'off', 'use_snp_selection': True, 'num_snps': 11571}. Best is trial 2 with value: 0.037348149907137904.
[I 2025-11-03 13:57:51,030] Trial 3 finished with value: -0.007515763986901242 and parameters: {'model_type': 'gcn', 'hidden_dims': '[512, 64]', 'dropout': 0.5938127374509361, 'batch_norm': False, 'lr': 5.67704586114731e-06, 'weight_decay': 2.4518087630137052e-05, 'epochs': 320, 'loss': 'mae', 'optimizer': 'adam', 'graph_mode': 'off', 'use_snp_selection': False}. Best is trial 2 with value: 0.037348149907137904.
[I 2025-11-03 13:57:53,081] Trial 4 finished with value: 0.01039639713477951 and parameters: {'model_type': 'gcn', 'hidden_dims': '[512, 128]', 'dropout': 0.25746343592134413, 'batch_norm': True, 'lr': 1.3467657668402788e-06, 'weight_decay': 0.00033087251918647806, 'epochs': 277, 'loss': 'mse', 'optimizer': 'adam', 'graph_mode': 'off', 'use_snp_selection': True, 'num_snps': 36675}. Best is trial 2 with value: 0.037348149907137904.
[I 2025-11-03 13:57:54,598] Trial 5 finished with value: -0.002801846438343846 and parameters: {'model_type': 'gcn', 'hidden_dims': '[512, 64]', 'dropout': 0.38275350994408375, 'batch_norm': True, 'lr': 1.5586664309232824e-06, 'weight_decay': 0.0008227664668621182, 'epochs': 145, 'loss': 'mae', 'optimizer': 'adam', 'graph_mode': 'off', 'use_snp_selection': True, 'num_snps': 32148}. Best is trial 2 with value: 0.037348149907137904.
[I 2025-11-03 13:57:55,769] Trial 6 finished with value: 0.027065941223334035 and parameters: {'model_type': 'gcn', 'hidden_dims': '[256, 128]', 'dropout': 0.3930109900265879, 'batch_norm': False, 'lr': 4.892964372128395e-05, 'weight_decay': 1.5809549317992182e-06, 'epochs': 199, 'loss': 'mse', 'optimizer': 'adam', 'graph_mode': 'off', 'use_snp_selection': False}. Best is trial 2 with value: 0.037348149907137904.
[I 2025-11-03 13:57:57,026] Trial 7 finished with value: 0.032094240858616126 and parameters: {'model_type': 'gcn', 'hidden_dims': '[512, 256]', 'dropout': 0.15343979219678458, 'batch_norm': True, 'lr': 6.234003099047341e-05, 'weight_decay': 3.894760610535477e-07, 'epochs': 97, 'loss': 'mse', 'optimizer': 'adam', 'graph_mode': 'off', 'use_snp_selection': False}. Best is trial 2 with value: 0.037348149907137904.
[I 2025-11-03 13:57:59,203] Trial 8 finished with value: 0.05180318964230932 and parameters: {'model_type': 'gcn', 'hidden_dims': '[512, 128]', 'dropout': 0.10743001231661406, 'batch_norm': True, 'lr': 0.00023728538449271062, 'weight_decay': 1.7629071578048637e-05, 'epochs': 312, 'loss': 'mae', 'optimizer': 'adam', 'graph_mode': 'off', 'use_snp_selection': False}. Best is trial 8 with value: 0.05180318964230932.
[I 2025-11-03 13:58:00,784] Trial 9 finished with value: 0.03700033514792346 and parameters: {'model_type': 'gcn', 'hidden_dims': '[512, 64]', 'dropout': 0.14505336736221927, 'batch_norm': True, 'lr': 5.8619638388111826e-05, 'weight_decay': 6.200156172669308e-07, 'epochs': 175, 'loss': 'mse', 'optimizer': 'adam', 'graph_mode': 'off', 'use_snp_selection': False}. Best is trial 8 with value: 0.05180318964230932.
[I 2025-11-03 13:58:01,809] Trial 10 finished with value: 0.029829123236754754 and parameters: {'model_type': 'gcn', 'hidden_dims': '[512, 128]', 'dropout': 0.2800030442581858, 'batch_norm': False, 'lr': 0.0004919806695968257, 'weight_decay': 2.9953888095455486e-06, 'epochs': 55, 'loss': 'mae', 'optimizer': 'adam', 'graph_mode': 'off', 'use_snp_selection': False}. Best is trial 8 with value: 0.05180318964230932.
[I 2025-11-03 13:58:02,659] Trial 11 finished with value: 0.002011598069470714 and parameters: {'model_type': 'gcn', 'hidden_dims': '[256, 128, 64]', 'dropout': 0.5025533409127559, 'batch_norm': False, 'lr': 0.0007607980626791682, 'weight_decay': 0.0001406697790036823, 'epochs': 126, 'loss': 'mse', 'optimizer': 'adam', 'graph_mode': 'off', 'use_snp_selection': True, 'num_snps': 5419}. Best is trial 8 with value: 0.05180318964230932.
[I 2025-11-03 13:58:03,910] Trial 12 finished with value: -0.016702792607752173 and parameters: {'model_type': 'gcn', 'hidden_dims': '[256, 128, 64]', 'dropout': 0.2985579868967523, 'batch_norm': False, 'lr': 1.0187182670446934e-05, 'weight_decay': 1.1699709816131563e-07, 'epochs': 248, 'loss': 'mae', 'optimizer': 'adam', 'graph_mode': 'off', 'use_snp_selection': True, 'num_snps': 7003}. Best is trial 8 with value: 0.05180318964230932.
[I 2025-11-03 13:58:06,256] Trial 13 finished with value: 0.014133999384206718 and parameters: {'model_type': 'gcn', 'hidden_dims': '[256, 128, 64]', 'dropout': 0.5151620731612123, 'batch_norm': False, 'lr': 0.00023404670002693276, 'weight_decay': 8.909310568982078e-05, 'epochs': 195, 'loss': 'mse', 'optimizer': 'adam', 'graph_mode': 'off', 'use_snp_selection': True, 'num_snps': 59978}. Best is trial 8 with value: 0.05180318964230932.
[I 2025-11-03 13:58:08,363] Trial 14 finished with value: 0.040897156202406665 and parameters: {'model_type': 'gcn', 'hidden_dims': '[512, 128]', 'dropout': 0.10437255616795911, 'batch_norm': True, 'lr': 1.654830350010746e-05, 'weight_decay': 6.640575344275937e-06, 'epochs': 286, 'loss': 'mae', 'optimizer': 'adam', 'graph_mode': 'off', 'use_snp_selection': False}. Best is trial 8 with value: 0.05180318964230932.
[I 2025-11-03 13:58:10,496] Trial 15 finished with value: 0.02074805347430449 and parameters: {'model_type': 'gcn', 'hidden_dims': '[512, 128]', 'dropout': 0.10611620677315546, 'batch_norm': True, 'lr': 1.8900422129051304e-05, 'weight_decay': 4.9753520566839795e-06, 'epochs': 288, 'loss': 'mae', 'optimizer': 'adam', 'graph_mode': 'off', 'use_snp_selection': False}. Best is trial 8 with value: 0.05180318964230932.
[I 2025-11-03 13:58:12,809] Trial 16 finished with value: 0.05301661947257374 and parameters: {'model_type': 'gcn', 'hidden_dims': '[512, 128]', 'dropout': 0.21047262736679628, 'batch_norm': True, 'lr': 0.0001750044791717841, 'weight_decay': 1.2125523872543358e-05, 'epochs': 343, 'loss': 'mae', 'optimizer': 'adam', 'graph_mode': 'off', 'use_snp_selection': False}. Best is trial 16 with value: 0.05301661947257374.
[I 2025-11-03 13:58:15,268] Trial 17 finished with value: 0.05736261786013899 and parameters: {'model_type': 'gcn', 'hidden_dims': '[512, 128]', 'dropout': 0.20887304022297282, 'batch_norm': True, 'lr': 0.00018700678709789086, 'weight_decay': 2.4859418587381615e-05, 'epochs': 348, 'loss': 'mae', 'optimizer': 'adam', 'graph_mode': 'off', 'use_snp_selection': False}. Best is trial 17 with value: 0.05736261786013899.
[I 2025-11-03 13:58:17,619] Trial 18 finished with value: 0.061711559737005296 and parameters: {'model_type': 'gcn', 'hidden_dims': '[512, 256]', 'dropout': 0.2253083777351058, 'batch_norm': True, 'lr': 0.00020218164267963939, 'weight_decay': 4.269407808797873e-05, 'epochs': 347, 'loss': 'mae', 'optimizer': 'adam', 'graph_mode': 'off', 'use_snp_selection': False}. Best is trial 18 with value: 0.061711559737005296.
[I 2025-11-03 13:58:19,471] Trial 19 finished with value: 0.054543257141501864 and parameters: {'model_type': 'gcn', 'hidden_dims': '[512, 256]', 'dropout': 0.22683554587822735, 'batch_norm': True, 'lr': 0.0001571812083060501, 'weight_decay': 5.292759845908549e-05, 'epochs': 235, 'loss': 'mae', 'optimizer': 'adam', 'graph_mode': 'off', 'use_snp_selection': False}. Best is trial 18 with value: 0.061711559737005296.
[I 2025-11-03 13:58:21,773] Trial 20 finished with value: 0.04698978354504338 and parameters: {'model_type': 'gcn', 'hidden_dims': '[512, 256]', 'dropout': 0.31517349485738777, 'batch_norm': True, 'lr': 0.0006685194454324531, 'weight_decay': 3.478583204302473e-05, 'epochs': 346, 'loss': 'mae', 'optimizer': 'adam', 'graph_mode': 'off', 'use_snp_selection': False}. Best is trial 18 with value: 0.061711559737005296.
[I 2025-11-03 13:58:23,653] Trial 21 finished with value: 0.044099397336636294 and parameters: {'model_type': 'gcn', 'hidden_dims': '[512, 256]', 'dropout': 0.22205851262499143, 'batch_norm': True, 'lr': 0.00017038427193669084, 'weight_decay': 6.240828532429687e-05, 'epochs': 243, 'loss': 'mae', 'optimizer': 'adam', 'graph_mode': 'off', 'use_snp_selection': False}. Best is trial 18 with value: 0.061711559737005296.
[I 2025-11-03 13:58:25,778] Trial 22 finished with value: 0.04957839993262042 and parameters: {'model_type': 'gcn', 'hidden_dims': '[512, 256]', 'dropout': 0.33927889732096017, 'batch_norm': True, 'lr': 0.00011657289831669769, 'weight_decay': 0.00013651383827201053, 'epochs': 303, 'loss': 'mae', 'optimizer': 'adam', 'graph_mode': 'off', 'use_snp_selection': False}. Best is trial 18 with value: 0.061711559737005296.
[I 2025-11-03 13:58:27,758] Trial 23 finished with value: 0.053678393937985465 and parameters: {'model_type': 'gcn', 'hidden_dims': '[512, 256]', 'dropout': 0.24482306677580912, 'batch_norm': True, 'lr': 0.0003823203445690662, 'weight_decay': 3.11906355468153e-05, 'epochs': 260, 'loss': 'mae', 'optimizer': 'adam', 'graph_mode': 'off', 'use_snp_selection': False}. Best is trial 18 with value: 0.061711559737005296.
[I 2025-11-03 13:58:28,845] Trial 24 finished with value: 0.05095994532702 and parameters: {'model_type': 'gcn', 'hidden_dims': '[128, 64]', 'dropout': 0.17195204936635608, 'batch_norm': True, 'lr': 0.0003504605191975463, 'weight_decay': 0.00042786622877850195, 'epochs': 213, 'loss': 'mae', 'optimizer': 'adam', 'graph_mode': 'off', 'use_snp_selection': False}. Best is trial 18 with value: 0.061711559737005296.
[I 2025-11-03 13:58:31,091] Trial 25 finished with value: 0.06353090452544591 and parameters: {'model_type': 'gcn', 'hidden_dims': '[512, 256]', 'dropout': 0.18747566538805813, 'batch_norm': True, 'lr': 3.023694406407434e-05, 'weight_decay': 0.00013261310153196365, 'epochs': 320, 'loss': 'mae', 'optimizer': 'adam', 'graph_mode': 'off', 'use_snp_selection': False}. Best is trial 25 with value: 0.06353090452544591.
[I 2025-11-03 13:58:33,335] Trial 26 finished with value: 0.03288460114604416 and parameters: {'model_type': 'gcn', 'hidden_dims': '[512, 256]', 'dropout': 0.18030691531102003, 'batch_norm': True, 'lr': 3.1453077304906486e-05, 'weight_decay': 0.00016483764295525157, 'epochs': 321, 'loss': 'mae', 'optimizer': 'adam', 'graph_mode': 'off', 'use_snp_selection': False}. Best is trial 25 with value: 0.06353090452544591.
[I 2025-11-03 13:58:35,722] Trial 27 finished with value: 0.059053628499937054 and parameters: {'model_type': 'gcn', 'hidden_dims': '[512, 256]', 'dropout': 0.25806304776443595, 'batch_norm': True, 'lr': 2.336930258501824e-05, 'weight_decay': 0.0005590843988882475, 'epochs': 350, 'loss': 'mae', 'optimizer': 'adam', 'graph_mode': 'off', 'use_snp_selection': False}. Best is trial 25 with value: 0.06353090452544591.
[I 2025-11-03 13:58:37,893] Trial 28 finished with value: 0.03960153276255 and parameters: {'model_type': 'gcn', 'hidden_dims': '[512, 256]', 'dropout': 0.27316533533046816, 'batch_norm': True, 'lr': 2.8847469491962777e-05, 'weight_decay': 0.0009168585479306149, 'epochs': 302, 'loss': 'mae', 'optimizer': 'adam', 'graph_mode': 'off', 'use_snp_selection': False}. Best is trial 25 with value: 0.06353090452544591.
[I 2025-11-03 13:58:39,268] Trial 29 finished with value: 0.018035862792692942 and parameters: {'model_type': 'gcn', 'hidden_dims': '[128, 64]', 'dropout': 0.1853183729305355, 'batch_norm': True, 'lr': 9.661446043094534e-06, 'weight_decay': 0.0005781058138585832, 'epochs': 327, 'loss': 'mae', 'optimizer': 'adam', 'graph_mode': 'off', 'use_snp_selection': False}. Best is trial 25 with value: 0.06353090452544591.
[I 2025-11-03 13:58:41,297] Trial 30 finished with value: 0.015965636896542054 and parameters: {'model_type': 'gcn', 'hidden_dims': '[512, 256]', 'dropout': 0.3554658908410553, 'batch_norm': True, 'lr': 3.2052906907956053e-06, 'weight_decay': 0.00020791879831049808, 'epochs': 267, 'loss': 'mae', 'optimizer': 'adam', 'graph_mode': 'off', 'use_snp_selection': False}. Best is trial 25 with value: 0.06353090452544591.
[I 2025-11-03 13:58:43,631] Trial 31 finished with value: 0.04116616802628161 and parameters: {'model_type': 'gcn', 'hidden_dims': '[512, 256]', 'dropout': 0.24338025991864726, 'batch_norm': True, 'lr': 0.00010100393750920054, 'weight_decay': 7.605890876624987e-05, 'epochs': 350, 'loss': 'mae', 'optimizer': 'adam', 'graph_mode': 'off', 'use_snp_selection': False}. Best is trial 25 with value: 0.06353090452544591.
[I 2025-11-03 13:58:45,270] Trial 32 finished with value: 0.03804682849760674 and parameters: {'model_type': 'gcn', 'hidden_dims': '[256, 128]', 'dropout': 0.14358737782312178, 'batch_norm': True, 'lr': 1.842594960897042e-05, 'weight_decay': 4.413851575565221e-05, 'epochs': 331, 'loss': 'mae', 'optimizer': 'adam', 'graph_mode': 'off', 'use_snp_selection': False}. Best is trial 25 with value: 0.06353090452544591.
[I 2025-11-03 13:58:47,673] Trial 33 finished with value: 0.0025640220875815514 and parameters: {'model_type': 'gcn', 'hidden_dims': '[512, 256]', 'dropout': 0.21302742992307394, 'batch_norm': True, 'lr': 4.3391016281259366e-05, 'weight_decay': 0.00011203987810529761, 'epochs': 350, 'loss': 'mae', 'optimizer': 'adam', 'graph_mode': 'off', 'use_snp_selection': False}. Best is trial 25 with value: 0.06353090452544591.
[I 2025-11-03 13:58:48,969] Trial 34 finished with value: 0.024044078143659227 and parameters: {'model_type': 'gcn', 'hidden_dims': '[128, 64]', 'dropout': 0.28592749423942987, 'batch_norm': True, 'lr': 9.951043762129878e-05, 'weight_decay': 0.00028113605928715946, 'epochs': 301, 'loss': 'mae', 'optimizer': 'adam', 'graph_mode': 'off', 'use_snp_selection': False}. Best is trial 25 with value: 0.06353090452544591.
[I 2025-11-03 13:58:50,620] Trial 35 finished with value: 0.036199284626821426 and parameters: {'model_type': 'gcn', 'hidden_dims': '[256, 128]', 'dropout': 0.32964604986413154, 'batch_norm': True, 'lr': 2.8600193361045736e-05, 'weight_decay': 1.747908128558782e-05, 'epochs': 331, 'loss': 'mae', 'optimizer': 'adam', 'graph_mode': 'off', 'use_snp_selection': False}. Best is trial 25 with value: 0.06353090452544591.
[I 2025-11-03 13:58:53,699] Trial 36 finished with value: 0.01881360750022571 and parameters: {'model_type': 'gcn', 'hidden_dims': '[512, 256]', 'dropout': 0.2495797402665533, 'batch_norm': True, 'lr': 1.0293821538494041e-05, 'weight_decay': 0.0005162161059793631, 'epochs': 316, 'loss': 'mae', 'optimizer': 'adam', 'graph_mode': 'off', 'use_snp_selection': True, 'num_snps': 58661}. Best is trial 25 with value: 0.06353090452544591.
[I 2025-11-03 13:58:55,764] Trial 37 finished with value: 0.002900041362965284 and parameters: {'model_type': 'gcn', 'hidden_dims': '[512, 64]', 'dropout': 0.19527128112786996, 'batch_norm': True, 'lr': 4.446294938689988e-06, 'weight_decay': 2.0776743473624837e-05, 'epochs': 289, 'loss': 'mae', 'optimizer': 'adam', 'graph_mode': 'off', 'use_snp_selection': False}. Best is trial 25 with value: 0.06353090452544591.
[I 2025-11-03 13:58:57,393] Trial 38 finished with value: 0.04462982846840993 and parameters: {'model_type': 'gcn', 'hidden_dims': '[512, 128]', 'dropout': 0.15468267201640745, 'batch_norm': False, 'lr': 8.70777277418241e-05, 'weight_decay': 0.00023910671212369554, 'epochs': 333, 'loss': 'mse', 'optimizer': 'adam', 'graph_mode': 'off', 'use_snp_selection': True, 'num_snps': 19911}. Best is trial 25 with value: 0.06353090452544591.
[I 2025-11-03 13:58:59,184] Trial 39 finished with value: 0.06568810899207723 and parameters: {'model_type': 'gcn', 'hidden_dims': '[512, 256]', 'dropout': 0.44531430787069004, 'batch_norm': True, 'lr': 4.5487236874853005e-05, 'weight_decay': 9.623330912207145e-06, 'epochs': 223, 'loss': 'mae', 'optimizer': 'adam', 'graph_mode': 'off', 'use_snp_selection': False}. Best is trial 39 with value: 0.06568810899207723.
[I 2025-11-03 13:59:01,002] Trial 40 finished with value: 0.04864851574110537 and parameters: {'model_type': 'gcn', 'hidden_dims': '[512, 256]', 'dropout': 0.45508287869446773, 'batch_norm': True, 'lr': 4.2448508225212285e-05, 'weight_decay': 8.809369788455472e-06, 'epochs': 225, 'loss': 'mae', 'optimizer': 'adam', 'graph_mode': 'off', 'use_snp_selection': False}. Best is trial 39 with value: 0.06568810899207723.
[I 2025-11-03 13:59:03,173] Trial 41 finished with value: 0.039484085476483195 and parameters: {'model_type': 'gcn', 'hidden_dims': '[512, 256]', 'dropout': 0.4189363413871183, 'batch_norm': True, 'lr': 2.1765314452408003e-05, 'weight_decay': 4.186010005023668e-06, 'epochs': 310, 'loss': 'mae', 'optimizer': 'adam', 'graph_mode': 'off', 'use_snp_selection': False}. Best is trial 39 with value: 0.06568810899207723.
