[I 2025-11-03 12:17:46,157] Trial 88 finished with value: 0.13007992744021432 and parameters: {'model_type': 'gcn', 'hidden_dims': '[256, 128]', 'dropout': 0.1758710518532695, 'batch_norm': True, 'lr': 0.0002111198810840813, 'weight_decay': 1.6000444218100157e-07, 'epochs': 160, 'loss': 'mse', 'optimizer': 'adam', 'graph_mode': 'off', 'use_snp_selection': False}. Best is trial 11 with value: 0.1465910463303249.
[I 2025-11-03 12:17:48,042] Trial 89 finished with value: 0.05273067652590335 and parameters: {'model_type': 'gcn', 'hidden_dims': '[512, 128]', 'dropout': 0.35649302566891966, 'batch_norm': False, 'lr': 0.0005490694951020478, 'weight_decay': 4.0000009140998247e-07, 'epochs': 233, 'loss': 'mse', 'optimizer': 'adam', 'graph_mode': 'off', 'use_snp_selection': False}. Best is trial 11 with value: 0.1465910463303249.
[I 2025-11-03 12:17:49,707] Trial 90 finished with value: 0.11508830342813733 and parameters: {'model_type': 'gcn', 'hidden_dims': '[256, 128, 64]', 'dropout': 0.29554512477287265, 'batch_norm': True, 'lr': 0.0007035386736755044, 'weight_decay': 2.1495628971606548e-07, 'epochs': 255, 'loss': 'mae', 'optimizer': 'adam', 'graph_mode': 'off', 'use_snp_selection': False}. Best is trial 11 with value: 0.1465910463303249.
[I 2025-11-03 12:17:50,856] Trial 91 finished with value: 0.12108794598814916 and parameters: {'model_type': 'gcn', 'hidden_dims': '[256, 128]', 'dropout': 0.10172712242629177, 'batch_norm': True, 'lr': 0.00020507403447014085, 'weight_decay': 1.6148640657107696e-07, 'epochs': 159, 'loss': 'mse', 'optimizer': 'adam', 'graph_mode': 'off', 'use_snp_selection': False}. Best is trial 11 with value: 0.1465910463303249.
[I 2025-11-03 12:17:51,938] Trial 92 finished with value: 0.11348329457568947 and parameters: {'model_type': 'gcn', 'hidden_dims': '[256, 128]', 'dropout': 0.15546323927486738, 'batch_norm': True, 'lr': 0.00010816699588221809, 'weight_decay': 3.035719713175999e-07, 'epochs': 148, 'loss': 'mse', 'optimizer': 'adam', 'graph_mode': 'off', 'use_snp_selection': False}. Best is trial 11 with value: 0.1465910463303249.
[I 2025-11-03 12:17:53,592] Trial 93 finished with value: 0.1218362591256173 and parameters: {'model_type': 'gcn', 'hidden_dims': '[256, 128]', 'dropout': 0.18127749198597803, 'batch_norm': True, 'lr': 0.00032113689585738423, 'weight_decay': 1.5224065069940357e-07, 'epochs': 327, 'loss': 'mse', 'optimizer': 'adam', 'graph_mode': 'off', 'use_snp_selection': False}. Best is trial 11 with value: 0.1465910463303249.
[I 2025-11-03 12:17:54,643] Trial 94 finished with value: 0.10577098512158337 and parameters: {'model_type': 'gcn', 'hidden_dims': '[128, 64]', 'dropout': 0.2033469366738819, 'batch_norm': True, 'lr': 8.799326353458753e-05, 'weight_decay': 1.0621985363415656e-07, 'epochs': 206, 'loss': 'mse', 'optimizer': 'adam', 'graph_mode': 'off', 'use_snp_selection': False}. Best is trial 11 with value: 0.1465910463303249.
[I 2025-11-03 12:17:55,961] Trial 95 finished with value: 0.11069139400809919 and parameters: {'model_type': 'gcn', 'hidden_dims': '[256, 128]', 'dropout': 0.33699794635617175, 'batch_norm': True, 'lr': 0.0004050483788983939, 'weight_decay': 5.690659122860802e-07, 'epochs': 222, 'loss': 'mse', 'optimizer': 'adam', 'graph_mode': 'off', 'use_snp_selection': False}. Best is trial 11 with value: 0.1465910463303249.
[I 2025-11-03 12:17:57,630] Trial 96 finished with value: 0.11935143811447833 and parameters: {'model_type': 'gcn', 'hidden_dims': '[512, 128]', 'dropout': 0.23436409343955283, 'batch_norm': True, 'lr': 0.00023927076616646093, 'weight_decay': 2.45107492628802e-07, 'epochs': 191, 'loss': 'mse', 'optimizer': 'adam', 'graph_mode': 'off', 'use_snp_selection': False}. Best is trial 11 with value: 0.1465910463303249.
[I 2025-11-03 12:17:58,793] Trial 97 finished with value: 0.08604035328851047 and parameters: {'model_type': 'gcn', 'hidden_dims': '[256, 128]', 'dropout': 0.11682613134147826, 'batch_norm': True, 'lr': 3.296122579386303e-05, 'weight_decay': 2.041396966910757e-07, 'epochs': 165, 'loss': 'mse', 'optimizer': 'adam', 'graph_mode': 'off', 'use_snp_selection': False}. Best is trial 11 with value: 0.1465910463303249.
[I 2025-11-03 12:18:00,442] Trial 98 finished with value: 0.137168881605514 and parameters: {'model_type': 'gcn', 'hidden_dims': '[512, 256]', 'dropout': 0.13236719220148038, 'batch_norm': True, 'lr': 0.0009875625370769602, 'weight_decay': 1.0951160739928957e-06, 'epochs': 180, 'loss': 'mse', 'optimizer': 'adam', 'graph_mode': 'off', 'use_snp_selection': False}. Best is trial 11 with value: 0.1465910463303249.
[I 2025-11-03 12:18:02,015] Trial 99 finished with value: 0.10475507824390068 and parameters: {'model_type': 'gcn', 'hidden_dims': '[512, 256]', 'dropout': 0.32075519372284333, 'batch_norm': False, 'lr': 0.0008333759118290362, 'weight_decay': 1.0825659060785585e-06, 'epochs': 177, 'loss': 'mae', 'optimizer': 'adam', 'graph_mode': 'off', 'use_snp_selection': False}. Best is trial 11 with value: 0.1465910463303249.
[I 2025-11-03 12:18:04,593] Trial 100 finished with value: 0.12847732079245083 and parameters: {'model_type': 'gcn', 'hidden_dims': '[512, 256]', 'dropout': 0.13447449926946886, 'batch_norm': True, 'lr': 0.0009017108551051866, 'weight_decay': 8.80352430456595e-07, 'epochs': 246, 'loss': 'mse', 'optimizer': 'adam', 'graph_mode': 'off', 'use_snp_selection': True, 'num_snps': 50880}. Best is trial 11 with value: 0.1465910463303249.
[I 2025-11-03 12:18:06,143] Trial 101 finished with value: 0.13257753620783772 and parameters: {'model_type': 'gcn', 'hidden_dims': '[512, 256]', 'dropout': 0.1324259891207608, 'batch_norm': True, 'lr': 0.0005075517764740368, 'weight_decay': 7.185572646036171e-07, 'epochs': 155, 'loss': 'mse', 'optimizer': 'adam', 'graph_mode': 'off', 'use_snp_selection': False}. Best is trial 11 with value: 0.1465910463303249.
[I 2025-11-03 12:18:07,651] Trial 102 finished with value: 0.1328956335569662 and parameters: {'model_type': 'gcn', 'hidden_dims': '[512, 256]', 'dropout': 0.15594528141165964, 'batch_norm': True, 'lr': 0.0009840531680895537, 'weight_decay': 1.3893322271013887e-06, 'epochs': 153, 'loss': 'mse', 'optimizer': 'adam', 'graph_mode': 'off', 'use_snp_selection': False}. Best is trial 11 with value: 0.1465910463303249.
[I 2025-11-03 12:18:09,138] Trial 103 finished with value: 0.13079940988222546 and parameters: {'model_type': 'gcn', 'hidden_dims': '[512, 256]', 'dropout': 0.165021293646465, 'batch_norm': True, 'lr': 0.0005781441392015933, 'weight_decay': 2.6430298144604326e-06, 'epochs': 141, 'loss': 'mse', 'optimizer': 'adam', 'graph_mode': 'off', 'use_snp_selection': False}. Best is trial 11 with value: 0.1465910463303249.
[I 2025-11-03 12:18:10,657] Trial 104 finished with value: 0.12445831680854377 and parameters: {'model_type': 'gcn', 'hidden_dims': '[512, 256]', 'dropout': 0.11124994696938743, 'batch_norm': True, 'lr': 0.0009962370145794553, 'weight_decay': 1.8999674727230095e-06, 'epochs': 153, 'loss': 'mse', 'optimizer': 'adam', 'graph_mode': 'off', 'use_snp_selection': False}. Best is trial 11 with value: 0.1465910463303249.
[I 2025-11-03 12:18:12,058] Trial 105 finished with value: 0.11106897743752168 and parameters: {'model_type': 'gcn', 'hidden_dims': '[512, 256]', 'dropout': 0.13666942882569755, 'batch_norm': True, 'lr': 0.0004889698832976928, 'weight_decay': 1.4505413127733714e-06, 'epochs': 127, 'loss': 'mse', 'optimizer': 'adam', 'graph_mode': 'off', 'use_snp_selection': False}. Best is trial 11 with value: 0.1465910463303249.
[I 2025-11-03 12:18:13,521] Trial 106 finished with value: 0.14657998356229687 and parameters: {'model_type': 'gcn', 'hidden_dims': '[512, 256]', 'dropout': 0.14615081162124666, 'batch_norm': True, 'lr': 0.0006865354525775254, 'weight_decay': 3.445759273233233e-06, 'epochs': 137, 'loss': 'mse', 'optimizer': 'adam', 'graph_mode': 'off', 'use_snp_selection': False}. Best is trial 11 with value: 0.1465910463303249.
[I 2025-11-03 12:18:14,962] Trial 107 finished with value: 0.11602747973614155 and parameters: {'model_type': 'gcn', 'hidden_dims': '[512, 256]', 'dropout': 0.10845634154797613, 'batch_norm': True, 'lr': 0.0007123123427809583, 'weight_decay': 6.11178912791054e-06, 'epochs': 139, 'loss': 'mse', 'optimizer': 'adam', 'graph_mode': 'off', 'use_snp_selection': False}. Best is trial 11 with value: 0.1465910463303249.
[I 2025-11-03 12:18:16,898] Trial 108 finished with value: 0.11957379238668077 and parameters: {'model_type': 'gcn', 'hidden_dims': '[512, 256]', 'dropout': 0.15982360749710875, 'batch_norm': True, 'lr': 0.0007743721718762566, 'weight_decay': 9.64460434273969e-06, 'epochs': 238, 'loss': 'mse', 'optimizer': 'adam', 'graph_mode': 'off', 'use_snp_selection': False}. Best is trial 11 with value: 0.1465910463303249.
[I 2025-11-03 12:18:18,756] Trial 109 finished with value: 0.11875472798959345 and parameters: {'model_type': 'gcn', 'hidden_dims': '[512, 256]', 'dropout': 0.12588105546743553, 'batch_norm': True, 'lr': 0.0006282524414215455, 'weight_decay': 2.340983523036884e-06, 'epochs': 226, 'loss': 'mae', 'optimizer': 'adam', 'graph_mode': 'off', 'use_snp_selection': False}. Best is trial 11 with value: 0.1465910463303249.
[I 2025-11-03 12:18:20,060] Trial 110 finished with value: 0.0658553116100879 and parameters: {'model_type': 'gcn', 'hidden_dims': '[512, 256]', 'dropout': 0.1458726299629899, 'batch_norm': False, 'lr': 0.0008478642055789021, 'weight_decay': 1.8674239257387084e-06, 'epochs': 110, 'loss': 'mse', 'optimizer': 'adam', 'graph_mode': 'off', 'use_snp_selection': False}. Best is trial 11 with value: 0.1465910463303249.
[I 2025-11-03 12:18:21,557] Trial 111 finished with value: 0.12532366229597208 and parameters: {'model_type': 'gcn', 'hidden_dims': '[512, 256]', 'dropout': 0.13618095998999927, 'batch_norm': True, 'lr': 0.00049626109013989, 'weight_decay': 3.3521062558876727e-06, 'epochs': 148, 'loss': 'mse', 'optimizer': 'adam', 'graph_mode': 'off', 'use_snp_selection': False}. Best is trial 11 with value: 0.1465910463303249.
[I 2025-11-03 12:18:23,176] Trial 112 finished with value: 0.12289551998479865 and parameters: {'model_type': 'gcn', 'hidden_dims': '[512, 256]', 'dropout': 0.15209579333926637, 'batch_norm': True, 'lr': 0.00037733587007281416, 'weight_decay': 6.732369739198777e-07, 'epochs': 168, 'loss': 'mse', 'optimizer': 'adam', 'graph_mode': 'off', 'use_snp_selection': False}. Best is trial 11 with value: 0.1465910463303249.
[I 2025-11-03 12:18:24,828] Trial 113 finished with value: 0.12990388227635916 and parameters: {'model_type': 'gcn', 'hidden_dims': '[512, 256]', 'dropout': 0.19516252189721636, 'batch_norm': True, 'lr': 0.0006763863190078559, 'weight_decay': 1.227231331171561e-06, 'epochs': 181, 'loss': 'mse', 'optimizer': 'adam', 'graph_mode': 'off', 'use_snp_selection': False}. Best is trial 11 with value: 0.1465910463303249.
[I 2025-11-03 12:18:26,640] Trial 114 finished with value: 0.12432582085984561 and parameters: {'model_type': 'gcn', 'hidden_dims': '[512, 256]', 'dropout': 0.12286480430178423, 'batch_norm': True, 'lr': 0.0009887788180460205, 'weight_decay': 8.49487833675238e-07, 'epochs': 214, 'loss': 'mse', 'optimizer': 'adam', 'graph_mode': 'off', 'use_snp_selection': False}. Best is trial 11 with value: 0.1465910463303249.
[I 2025-11-03 12:18:28,039] Trial 115 finished with value: 0.11630247409842134 and parameters: {'model_type': 'gcn', 'hidden_dims': '[512, 64]', 'dropout': 0.44986257704309973, 'batch_norm': True, 'lr': 0.0004417996681936835, 'weight_decay': 4.789882989859775e-07, 'epochs': 134, 'loss': 'mse', 'optimizer': 'adam', 'graph_mode': 'off', 'use_snp_selection': False}. Best is trial 11 with value: 0.1465910463303249.
[I 2025-11-03 12:18:29,353] Trial 116 finished with value: 0.1141626147074391 and parameters: {'model_type': 'gcn', 'hidden_dims': '[512, 128]', 'dropout': 0.13378183483278153, 'batch_norm': True, 'lr': 0.0005662849277138048, 'weight_decay': 1.5383515985854926e-06, 'epochs': 119, 'loss': 'mse', 'optimizer': 'adam', 'graph_mode': 'off', 'use_snp_selection': False}. Best is trial 11 with value: 0.1465910463303249.
[I 2025-11-03 12:18:30,926] Trial 117 finished with value: 0.11694262372134268 and parameters: {'model_type': 'gcn', 'hidden_dims': '[512, 256]', 'dropout': 0.11317281262729793, 'batch_norm': True, 'lr': 0.0007306379677193217, 'weight_decay': 3.270101354083997e-06, 'epochs': 163, 'loss': 'mse', 'optimizer': 'adam', 'graph_mode': 'off', 'use_snp_selection': False}. Best is trial 11 with value: 0.1465910463303249.
[I 2025-11-03 12:18:32,552] Trial 118 finished with value: 0.12245462983123484 and parameters: {'model_type': 'gcn', 'hidden_dims': '[512, 64]', 'dropout': 0.17428829857708866, 'batch_norm': True, 'lr': 0.0005043361782501408, 'weight_decay': 5.173196242980922e-06, 'epochs': 172, 'loss': 'mse', 'optimizer': 'adam', 'graph_mode': 'off', 'use_snp_selection': False}. Best is trial 11 with value: 0.1465910463303249.
[I 2025-11-03 12:18:34,077] Trial 119 finished with value: 0.11358592650102639 and parameters: {'model_type': 'gcn', 'hidden_dims': '[512, 128]', 'dropout': 0.5990127129355302, 'batch_norm': True, 'lr': 0.0003510734741345989, 'weight_decay': 1.108506362472053e-06, 'epochs': 155, 'loss': 'mse', 'optimizer': 'adam', 'graph_mode': 'off', 'use_snp_selection': False}. Best is trial 11 with value: 0.1465910463303249.
[I 2025-11-03 12:18:35,832] Trial 120 finished with value: 0.11446752907422303 and parameters: {'model_type': 'gcn', 'hidden_dims': '[512, 256]', 'dropout': 0.16383194214711075, 'batch_norm': False, 'lr': 0.00027092101592300524, 'weight_decay': 3.307549123665722e-07, 'epochs': 200, 'loss': 'mae', 'optimizer': 'adam', 'graph_mode': 'off', 'use_snp_selection': False}. Best is trial 11 with value: 0.1465910463303249.
[I 2025-11-03 12:18:36,718] Trial 121 finished with value: 0.11401349479973225 and parameters: {'model_type': 'gcn', 'hidden_dims': '[128, 64]', 'dropout': 0.3440140183302168, 'batch_norm': True, 'lr': 0.0008772487534047834, 'weight_decay': 5.630892680288409e-07, 'epochs': 143, 'loss': 'mse', 'optimizer': 'adam', 'graph_mode': 'off', 'use_snp_selection': False}. Best is trial 11 with value: 0.1465910463303249.
[I 2025-11-03 12:18:38,403] Trial 122 finished with value: 0.1262050528550505 and parameters: {'model_type': 'gcn', 'hidden_dims': '[512, 128]', 'dropout': 0.32666138729517685, 'batch_norm': True, 'lr': 0.000634298255460353, 'weight_decay': 7.216796824410097e-07, 'epochs': 189, 'loss': 'mse', 'optimizer': 'adam', 'graph_mode': 'off', 'use_snp_selection': False}. Best is trial 11 with value: 0.1465910463303249.
[I 2025-11-03 12:18:40,697] Trial 123 finished with value: 0.12422566215548916 and parameters: {'model_type': 'gcn', 'hidden_dims': '[512, 64]', 'dropout': 0.31259642998748816, 'batch_norm': True, 'lr': 0.00042614208361571793, 'weight_decay': 3.8540150439381156e-07, 'epochs': 309, 'loss': 'mse', 'optimizer': 'adam', 'graph_mode': 'off', 'use_snp_selection': False}. Best is trial 11 with value: 0.1465910463303249.
[I 2025-11-03 12:18:42,866] Trial 124 finished with value: 0.12100625706790735 and parameters: {'model_type': 'gcn', 'hidden_dims': '[512, 256]', 'dropout': 0.30480296505373444, 'batch_norm': True, 'lr': 0.00030151221924060406, 'weight_decay': 1.242655153402477e-07, 'epochs': 289, 'loss': 'mse', 'optimizer': 'adam', 'graph_mode': 'off', 'use_snp_selection': False}. Best is trial 11 with value: 0.1465910463303249.
[I 2025-11-03 12:18:44,291] Trial 125 finished with value: 0.07451280831286235 and parameters: {'model_type': 'gcn', 'hidden_dims': '[256, 128, 64]', 'dropout': 0.2715786879283993, 'batch_norm': True, 'lr': 0.00016605461384550064, 'weight_decay': 9.389469587289984e-07, 'epochs': 230, 'loss': 'mse', 'optimizer': 'adam', 'graph_mode': 'off', 'use_snp_selection': True, 'num_snps': 12134}. Best is trial 11 with value: 0.1465910463303249.
[I 2025-11-03 12:18:46,148] Trial 126 finished with value: 0.12876329219504623 and parameters: {'model_type': 'gcn', 'hidden_dims': '[512, 128]', 'dropout': 0.2551987657265542, 'batch_norm': True, 'lr': 0.0003730760152453376, 'weight_decay': 0.00023622549761761336, 'epochs': 218, 'loss': 'mse', 'optimizer': 'adam', 'graph_mode': 'off', 'use_snp_selection': False}. Best is trial 11 with value: 0.1465910463303249.
[I 2025-11-03 12:18:47,840] Trial 127 finished with value: 0.11899716559303404 and parameters: {'model_type': 'gcn', 'hidden_dims': '[512, 64]', 'dropout': 0.40350366521527303, 'batch_norm': True, 'lr': 0.0007746098327121222, 'weight_decay': 4.6439396491501155e-07, 'epochs': 183, 'loss': 'mse', 'optimizer': 'adam', 'graph_mode': 'off', 'use_snp_selection': False}. Best is trial 11 with value: 0.1465910463303249.
[I 2025-11-03 12:18:48,886] Trial 128 finished with value: -0.002672945087345575 and parameters: {'model_type': 'gcn', 'hidden_dims': '[128, 64]', 'dropout': 0.3760309627309499, 'batch_norm': True, 'lr': 2.3732095640054574e-06, 'weight_decay': 3.89668459324963e-06, 'epochs': 208, 'loss': 'mse', 'optimizer': 'adam', 'graph_mode': 'off', 'use_snp_selection': False}. Best is trial 11 with value: 0.1465910463303249.
[I 2025-11-03 12:18:50,578] Trial 129 finished with value: 0.1074453145124194 and parameters: {'model_type': 'gcn', 'hidden_dims': '[512, 128]', 'dropout': 0.14247997911731883, 'batch_norm': True, 'lr': 0.0003305031187052052, 'weight_decay': 1.947915141949363e-05, 'epochs': 197, 'loss': 'mse', 'optimizer': 'adam', 'graph_mode': 'off', 'use_snp_selection': False}. Best is trial 11 with value: 0.1465910463303249.
[I 2025-11-03 12:18:52,072] Trial 130 finished with value: 0.11957644518881712 and parameters: {'model_type': 'gcn', 'hidden_dims': '[512, 256]', 'dropout': 0.43199029285217305, 'batch_norm': True, 'lr': 0.0005571932820202841, 'weight_decay': 2.7332606751868073e-07, 'epochs': 148, 'loss': 'mae', 'optimizer': 'adam', 'graph_mode': 'off', 'use_snp_selection': False}. Best is trial 11 with value: 0.1465910463303249.
[I 2025-11-03 12:18:53,488] Trial 131 finished with value: 0.11997908016464025 and parameters: {'model_type': 'gcn', 'hidden_dims': '[512, 256]', 'dropout': 0.1035875799755245, 'batch_norm': True, 'lr': 0.000591337802872096, 'weight_decay': 2.0658781215208314e-06, 'epochs': 138, 'loss': 'mse', 'optimizer': 'adam', 'graph_mode': 'off', 'use_snp_selection': False}. Best is trial 11 with value: 0.1465910463303249.
[I 2025-11-03 12:18:54,843] Trial 132 finished with value: 0.1312090111126081 and parameters: {'model_type': 'gcn', 'hidden_dims': '[512, 256]', 'dropout': 0.18357703419593308, 'batch_norm': True, 'lr': 0.00046290657266748214, 'weight_decay': 2.5423850065601844e-06, 'epochs': 128, 'loss': 'mse', 'optimizer': 'adam', 'graph_mode': 'off', 'use_snp_selection': False}. Best is trial 11 with value: 0.1465910463303249.
[I 2025-11-03 12:18:56,118] Trial 133 finished with value: 0.1171962381024878 and parameters: {'model_type': 'gcn', 'hidden_dims': '[512, 256]', 'dropout': 0.18607571518060903, 'batch_norm': True, 'lr': 0.000439466689846428, 'weight_decay': 1.3935416280779964e-06, 'epochs': 104, 'loss': 'mse', 'optimizer': 'adam', 'graph_mode': 'off', 'use_snp_selection': False}. Best is trial 11 with value: 0.1465910463303249.
[I 2025-11-03 12:18:57,525] Trial 134 finished with value: 0.12533429717940595 and parameters: {'model_type': 'gcn', 'hidden_dims': '[512, 256]', 'dropout': 0.14956602815553344, 'batch_norm': True, 'lr': 0.0002390368529074384, 'weight_decay': 1.7423179752622335e-06, 'epochs': 131, 'loss': 'mse', 'optimizer': 'adam', 'graph_mode': 'off', 'use_snp_selection': False}. Best is trial 11 with value: 0.1465910463303249.
[I 2025-11-03 12:18:58,893] Trial 135 finished with value: 0.141436048856613 and parameters: {'model_type': 'gcn', 'hidden_dims': '[512, 64]', 'dropout': 0.21178383239584359, 'batch_norm': True, 'lr': 0.0002794193190631547, 'weight_decay': 1.0031811558353084e-07, 'epochs': 121, 'loss': 'mse', 'optimizer': 'adam', 'graph_mode': 'off', 'use_snp_selection': False}. Best is trial 11 with value: 0.1465910463303249.
[I 2025-11-03 12:19:00,505] Trial 136 finished with value: 0.03151313113209923 and parameters: {'model_type': 'gcn', 'hidden_dims': '[512, 64]', 'dropout': 0.3332458292267563, 'batch_norm': False, 'lr': 0.00027585520652492225, 'weight_decay': 1.0453757196650099e-07, 'epochs': 174, 'loss': 'mse', 'optimizer': 'adam', 'graph_mode': 'off', 'use_snp_selection': False}. Best is trial 11 with value: 0.1465910463303249.
[I 2025-11-03 12:19:01,774] Trial 137 finished with value: 0.13490169619152736 and parameters: {'model_type': 'gcn', 'hidden_dims': '[512, 64]', 'dropout': 0.211963222695808, 'batch_norm': True, 'lr': 0.00020355560315573045, 'weight_decay': 1.8642647651494355e-07, 'epochs': 98, 'loss': 'mse', 'optimizer': 'adam', 'graph_mode': 'off', 'use_snp_selection': False}. Best is trial 11 with value: 0.1465910463303249.
[I 2025-11-03 12:19:03,030] Trial 138 finished with value: 0.12150431823592774 and parameters: {'model_type': 'gcn', 'hidden_dims': '[512, 64]', 'dropout': 0.20666591224725808, 'batch_norm': True, 'lr': 0.00014933289828012038, 'weight_decay': 1.8385867102287887e-07, 'epochs': 102, 'loss': 'mse', 'optimizer': 'adam', 'graph_mode': 'off', 'use_snp_selection': False}. Best is trial 11 with value: 0.1465910463303249.
[I 2025-11-03 12:19:04,267] Trial 139 finished with value: 0.15288717154233947 and parameters: {'model_type': 'gcn', 'hidden_dims': '[512, 64]', 'dropout': 0.22675685985498248, 'batch_norm': True, 'lr': 0.00018560482144034716, 'weight_decay': 1.5164282526685405e-07, 'epochs': 91, 'loss': 'mse', 'optimizer': 'adam', 'graph_mode': 'off', 'use_snp_selection': False}. Best is trial 139 with value: 0.15288717154233947.
