[I 2025-11-03 13:56:00,158] Trial 88 finished with value: 0.008263136346255785 and parameters: {'model_type': 'gcn', 'hidden_dims': '[512, 64]', 'dropout': 0.31479619527687497, 'batch_norm': True, 'lr': 5.187195575667634e-05, 'weight_decay': 1.917256509332968e-05, 'epochs': 235, 'loss': 'mse', 'optimizer': 'adam', 'graph_mode': 'off', 'use_snp_selection': False}. Best is trial 58 with value: 0.08659301246794728.
[I 2025-11-03 13:56:01,614] Trial 89 finished with value: 0.03882059709529733 and parameters: {'model_type': 'gcn', 'hidden_dims': '[256, 128]', 'dropout': 0.39548064595615623, 'batch_norm': True, 'lr': 8.75508523106255e-06, 'weight_decay': 3.594114497501496e-06, 'epochs': 76, 'loss': 'mse', 'optimizer': 'adam', 'graph_mode': 'off', 'use_snp_selection': True, 'num_snps': 45058}. Best is trial 58 with value: 0.08659301246794728.
[I 2025-11-03 13:56:03,113] Trial 90 finished with value: 0.05424482582840999 and parameters: {'model_type': 'gcn', 'hidden_dims': '[256, 128]', 'dropout': 0.36769308558153524, 'batch_norm': True, 'lr': 0.0003132294139212315, 'weight_decay': 1.6154964770090444e-07, 'epochs': 265, 'loss': 'mse', 'optimizer': 'adam', 'graph_mode': 'off', 'use_snp_selection': False}. Best is trial 58 with value: 0.08659301246794728.
[I 2025-11-03 13:56:04,622] Trial 91 finished with value: 0.05672484199098577 and parameters: {'model_type': 'gcn', 'hidden_dims': '[256, 128, 64]', 'dropout': 0.31219711802746164, 'batch_norm': True, 'lr': 0.0008626432943086909, 'weight_decay': 1.5070531855025566e-06, 'epochs': 211, 'loss': 'mse', 'optimizer': 'adam', 'graph_mode': 'off', 'use_snp_selection': False}. Best is trial 58 with value: 0.08659301246794728.
[I 2025-11-03 13:56:06,227] Trial 92 finished with value: 0.06277379031840218 and parameters: {'model_type': 'gcn', 'hidden_dims': '[256, 128, 64]', 'dropout': 0.2895675615426388, 'batch_norm': True, 'lr': 0.0006868734689615106, 'weight_decay': 2.935257699822564e-06, 'epochs': 247, 'loss': 'mse', 'optimizer': 'adam', 'graph_mode': 'off', 'use_snp_selection': False}. Best is trial 58 with value: 0.08659301246794728.
[I 2025-11-03 13:56:07,311] Trial 93 finished with value: 0.05598512161123973 and parameters: {'model_type': 'gcn', 'hidden_dims': '[128, 64]', 'dropout': 0.24746313671564138, 'batch_norm': True, 'lr': 0.0009995535476869718, 'weight_decay': 2.2875879386960887e-06, 'epochs': 226, 'loss': 'mse', 'optimizer': 'adam', 'graph_mode': 'off', 'use_snp_selection': False}. Best is trial 58 with value: 0.08659301246794728.
[I 2025-11-03 13:56:08,731] Trial 94 finished with value: 0.06771975332292103 and parameters: {'model_type': 'gcn', 'hidden_dims': '[256, 128, 64]', 'dropout': 0.5820326777890601, 'batch_norm': True, 'lr': 0.00045321368027112215, 'weight_decay': 2.6925513296224514e-07, 'epochs': 205, 'loss': 'mse', 'optimizer': 'adam', 'graph_mode': 'off', 'use_snp_selection': False}. Best is trial 58 with value: 0.08659301246794728.
[I 2025-11-03 13:56:10,044] Trial 95 finished with value: 0.05703868408462878 and parameters: {'model_type': 'gcn', 'hidden_dims': '[256, 128]', 'dropout': 0.33331867447894387, 'batch_norm': True, 'lr': 0.0005909442850671013, 'weight_decay': 4.005540623540991e-06, 'epochs': 218, 'loss': 'mse', 'optimizer': 'adam', 'graph_mode': 'off', 'use_snp_selection': False}. Best is trial 58 with value: 0.08659301246794728.
[I 2025-11-03 13:56:11,381] Trial 96 finished with value: 0.0016836568562429734 and parameters: {'model_type': 'gcn', 'hidden_dims': '[256, 128, 64]', 'dropout': 0.5601961162440288, 'batch_norm': False, 'lr': 0.0007216160670979899, 'weight_decay': 6.565549534417503e-07, 'epochs': 191, 'loss': 'mse', 'optimizer': 'adam', 'graph_mode': 'off', 'use_snp_selection': False}. Best is trial 58 with value: 0.08659301246794728.
[I 2025-11-03 13:56:12,873] Trial 97 finished with value: 0.06054232986322799 and parameters: {'model_type': 'gcn', 'hidden_dims': '[256, 128, 64]', 'dropout': 0.4170645166915307, 'batch_norm': True, 'lr': 0.0008157388885797654, 'weight_decay': 1.7999054708953715e-06, 'epochs': 212, 'loss': 'mse', 'optimizer': 'adam', 'graph_mode': 'off', 'use_snp_selection': False}. Best is trial 58 with value: 0.08659301246794728.
[I 2025-11-03 13:56:14,599] Trial 98 finished with value: 0.069404146617468 and parameters: {'model_type': 'gcn', 'hidden_dims': '[512, 128]', 'dropout': 0.5290836468478899, 'batch_norm': True, 'lr': 0.0004185492012599413, 'weight_decay': 1.179159261057785e-06, 'epochs': 200, 'loss': 'mse', 'optimizer': 'adam', 'graph_mode': 'off', 'use_snp_selection': False}. Best is trial 58 with value: 0.08659301246794728.
[I 2025-11-03 13:56:16,514] Trial 99 finished with value: 0.044536566513226725 and parameters: {'model_type': 'gcn', 'hidden_dims': '[512, 256]', 'dropout': 0.3005141250928264, 'batch_norm': True, 'lr': 9.196505922392742e-05, 'weight_decay': 5.759000731092008e-06, 'epochs': 239, 'loss': 'mse', 'optimizer': 'adam', 'graph_mode': 'off', 'use_snp_selection': False}. Best is trial 58 with value: 0.08659301246794728.
[I 2025-11-03 13:56:17,650] Trial 100 finished with value: 0.08008406005943845 and parameters: {'model_type': 'gcn', 'hidden_dims': '[256, 128]', 'dropout': 0.4731540078105053, 'batch_norm': True, 'lr': 0.0005067495831968811, 'weight_decay': 7.245462700388375e-06, 'epochs': 168, 'loss': 'mse', 'optimizer': 'adam', 'graph_mode': 'off', 'use_snp_selection': False}. Best is trial 58 with value: 0.08659301246794728.
[I 2025-11-03 13:56:18,745] Trial 101 finished with value: 0.06993212226043133 and parameters: {'model_type': 'gcn', 'hidden_dims': '[256, 128]', 'dropout': 0.468610649325733, 'batch_norm': True, 'lr': 0.0008661280479888609, 'weight_decay': 7.465119019598418e-06, 'epochs': 153, 'loss': 'mse', 'optimizer': 'adam', 'graph_mode': 'off', 'use_snp_selection': False}. Best is trial 58 with value: 0.08659301246794728.
[I 2025-11-03 13:56:19,896] Trial 102 finished with value: 0.06477314245917523 and parameters: {'model_type': 'gcn', 'hidden_dims': '[256, 128]', 'dropout': 0.5087342239194281, 'batch_norm': True, 'lr': 0.0005255852476744602, 'weight_decay': 9.44355079319491e-06, 'epochs': 171, 'loss': 'mse', 'optimizer': 'adam', 'graph_mode': 'off', 'use_snp_selection': False}. Best is trial 58 with value: 0.08659301246794728.
[I 2025-11-03 13:56:21,074] Trial 103 finished with value: 0.07713760813707354 and parameters: {'model_type': 'gcn', 'hidden_dims': '[256, 128]', 'dropout': 0.5227031130872907, 'batch_norm': True, 'lr': 0.000606418706177257, 'weight_decay': 3.870914248474156e-06, 'epochs': 184, 'loss': 'mse', 'optimizer': 'adam', 'graph_mode': 'off', 'use_snp_selection': False}. Best is trial 58 with value: 0.08659301246794728.
[I 2025-11-03 13:56:22,259] Trial 104 finished with value: 0.06570029870269185 and parameters: {'model_type': 'gcn', 'hidden_dims': '[256, 128]', 'dropout': 0.5189984952268069, 'batch_norm': True, 'lr': 0.0006491493091043593, 'weight_decay': 4.268364765389386e-06, 'epochs': 179, 'loss': 'mse', 'optimizer': 'adam', 'graph_mode': 'off', 'use_snp_selection': False}. Best is trial 58 with value: 0.08659301246794728.
[I 2025-11-03 13:56:23,345] Trial 105 finished with value: 0.059691685432651895 and parameters: {'model_type': 'gcn', 'hidden_dims': '[256, 128]', 'dropout': 0.5394574115692194, 'batch_norm': True, 'lr': 0.0004975730794915161, 'weight_decay': 6.9290256008916536e-06, 'epochs': 158, 'loss': 'mse', 'optimizer': 'adam', 'graph_mode': 'off', 'use_snp_selection': False}. Best is trial 58 with value: 0.08659301246794728.
[I 2025-11-03 13:56:24,452] Trial 106 finished with value: 0.021843470068450815 and parameters: {'model_type': 'gcn', 'hidden_dims': '[256, 128]', 'dropout': 0.5554935774826685, 'batch_norm': False, 'lr': 0.0003830890911570132, 'weight_decay': 1.0977323258110684e-05, 'epochs': 170, 'loss': 'mse', 'optimizer': 'adam', 'graph_mode': 'off', 'use_snp_selection': False}. Best is trial 58 with value: 0.08659301246794728.
[I 2025-11-03 13:56:25,704] Trial 107 finished with value: 0.03312039240333871 and parameters: {'model_type': 'gcn', 'hidden_dims': '[256, 128]', 'dropout': 0.48050604391489976, 'batch_norm': True, 'lr': 0.00020174964202144968, 'weight_decay': 5.3963347867979475e-06, 'epochs': 192, 'loss': 'mse', 'optimizer': 'adam', 'graph_mode': 'off', 'use_snp_selection': False}. Best is trial 58 with value: 0.08659301246794728.
[I 2025-11-03 13:56:26,755] Trial 108 finished with value: 0.05020862332495955 and parameters: {'model_type': 'gcn', 'hidden_dims': '[256, 128]', 'dropout': 0.5159694896989413, 'batch_norm': True, 'lr': 0.0005910245513122608, 'weight_decay': 2.900280973418095e-06, 'epochs': 187, 'loss': 'mae', 'optimizer': 'adam', 'graph_mode': 'off', 'use_snp_selection': True, 'num_snps': 11322}. Best is trial 58 with value: 0.08659301246794728.
[I 2025-11-03 13:56:28,371] Trial 109 finished with value: -0.03321673887744487 and parameters: {'model_type': 'gcn', 'hidden_dims': '[512, 128]', 'dropout': 0.391151701643203, 'batch_norm': True, 'lr': 1.998551315667493e-05, 'weight_decay': 3.584194023499334e-06, 'epochs': 178, 'loss': 'mse', 'optimizer': 'adam', 'graph_mode': 'off', 'use_snp_selection': False}. Best is trial 58 with value: 0.08659301246794728.
[I 2025-11-03 13:56:30,119] Trial 110 finished with value: 0.07907370166402397 and parameters: {'model_type': 'gcn', 'hidden_dims': '[512, 64]', 'dropout': 0.49120067371272225, 'batch_norm': True, 'lr': 0.0007337603767428277, 'weight_decay': 2.82646521721938e-07, 'epochs': 206, 'loss': 'mse', 'optimizer': 'adam', 'graph_mode': 'off', 'use_snp_selection': False}. Best is trial 58 with value: 0.08659301246794728.
[I 2025-11-03 13:56:31,746] Trial 111 finished with value: 0.06257414965602554 and parameters: {'model_type': 'gcn', 'hidden_dims': '[512, 64]', 'dropout': 0.495705227015289, 'batch_norm': True, 'lr': 0.0007429828984683434, 'weight_decay': 2.7300740469885394e-07, 'epochs': 186, 'loss': 'mse', 'optimizer': 'adam', 'graph_mode': 'off', 'use_snp_selection': False}. Best is trial 58 with value: 0.08659301246794728.
[I 2025-11-03 13:56:33,463] Trial 112 finished with value: 0.05704217633049188 and parameters: {'model_type': 'gcn', 'hidden_dims': '[512, 64]', 'dropout': 0.49283766020592684, 'batch_norm': True, 'lr': 0.0008521452686995119, 'weight_decay': 4.2968879325587716e-07, 'epochs': 197, 'loss': 'mse', 'optimizer': 'adam', 'graph_mode': 'off', 'use_snp_selection': False}. Best is trial 58 with value: 0.08659301246794728.
[I 2025-11-03 13:56:34,891] Trial 113 finished with value: 0.04705435566749296 and parameters: {'model_type': 'gcn', 'hidden_dims': '[256, 128]', 'dropout': 0.5392560826432348, 'batch_norm': True, 'lr': 0.0007011815889515622, 'weight_decay': 1.7069251113695075e-07, 'epochs': 257, 'loss': 'mse', 'optimizer': 'adam', 'graph_mode': 'off', 'use_snp_selection': False}. Best is trial 58 with value: 0.08659301246794728.
[I 2025-11-03 13:56:36,624] Trial 114 finished with value: 0.060999407919511466 and parameters: {'model_type': 'gcn', 'hidden_dims': '[512, 64]', 'dropout': 0.44863019515344976, 'batch_norm': True, 'lr': 0.0005859548392961996, 'weight_decay': 6.055530259558729e-07, 'epochs': 206, 'loss': 'mse', 'optimizer': 'adam', 'graph_mode': 'off', 'use_snp_selection': False}. Best is trial 58 with value: 0.08659301246794728.
[I 2025-11-03 13:56:38,440] Trial 115 finished with value: 0.059664700502917514 and parameters: {'model_type': 'gcn', 'hidden_dims': '[512, 64]', 'dropout': 0.5319316810559502, 'batch_norm': True, 'lr': 0.00045779421270167304, 'weight_decay': 2.951279044993748e-07, 'epochs': 225, 'loss': 'mse', 'optimizer': 'adam', 'graph_mode': 'off', 'use_snp_selection': False}. Best is trial 58 with value: 0.08659301246794728.
[I 2025-11-03 13:56:39,802] Trial 116 finished with value: 0.04843470728975984 and parameters: {'model_type': 'gcn', 'hidden_dims': '[256, 128]', 'dropout': 0.47196222562470275, 'batch_norm': True, 'lr': 0.0007641385298947791, 'weight_decay': 1.9898863582179595e-07, 'epochs': 236, 'loss': 'mae', 'optimizer': 'adam', 'graph_mode': 'off', 'use_snp_selection': False}. Best is trial 58 with value: 0.08659301246794728.
[I 2025-11-03 13:56:41,342] Trial 117 finished with value: -0.0007602083827683634 and parameters: {'model_type': 'gcn', 'hidden_dims': '[512, 128]', 'dropout': 0.27618051111163977, 'batch_norm': False, 'lr': 0.0008713661007668847, 'weight_decay': 3.5964610452927354e-07, 'epochs': 166, 'loss': 'mse', 'optimizer': 'adam', 'graph_mode': 'off', 'use_snp_selection': False}. Best is trial 58 with value: 0.08659301246794728.
[I 2025-11-03 13:56:42,673] Trial 118 finished with value: 0.05381594093174491 and parameters: {'model_type': 'gcn', 'hidden_dims': '[256, 128]', 'dropout': 0.433899181132029, 'batch_norm': True, 'lr': 0.0003175995354778123, 'weight_decay': 1.3767224990488733e-07, 'epochs': 230, 'loss': 'mse', 'optimizer': 'adam', 'graph_mode': 'off', 'use_snp_selection': False}. Best is trial 58 with value: 0.08659301246794728.
[I 2025-11-03 13:56:43,958] Trial 119 finished with value: 0.060723237006839556 and parameters: {'model_type': 'gcn', 'hidden_dims': '[256, 128]', 'dropout': 0.5062693704633636, 'batch_norm': True, 'lr': 0.0005117558367756913, 'weight_decay': 8.351140187400024e-06, 'epochs': 218, 'loss': 'mse', 'optimizer': 'adam', 'graph_mode': 'off', 'use_snp_selection': False}. Best is trial 58 with value: 0.08659301246794728.
[I 2025-11-03 13:56:44,955] Trial 120 finished with value: 0.04674850923415348 and parameters: {'model_type': 'gcn', 'hidden_dims': '[128, 64]', 'dropout': 0.3673007511550518, 'batch_norm': True, 'lr': 0.0006386289000097211, 'weight_decay': 1.2882971508947492e-05, 'epochs': 198, 'loss': 'mae', 'optimizer': 'adam', 'graph_mode': 'off', 'use_snp_selection': False}. Best is trial 58 with value: 0.08659301246794728.
[I 2025-11-03 13:56:46,447] Trial 121 finished with value: 0.08695958387848404 and parameters: {'model_type': 'gcn', 'hidden_dims': '[256, 128, 64]', 'dropout': 0.4017510840242601, 'batch_norm': True, 'lr': 0.0009896396319348014, 'weight_decay': 1.5152903246527447e-06, 'epochs': 213, 'loss': 'mse', 'optimizer': 'adam', 'graph_mode': 'off', 'use_snp_selection': False}. Best is trial 121 with value: 0.08695958387848404.
[I 2025-11-03 13:56:47,924] Trial 122 finished with value: 0.025881503499984092 and parameters: {'model_type': 'gcn', 'hidden_dims': '[256, 128, 64]', 'dropout': 0.35304246039857495, 'batch_norm': True, 'lr': 3.5579187264105846e-05, 'weight_decay': 9.321699175873069e-07, 'epochs': 209, 'loss': 'mse', 'optimizer': 'adam', 'graph_mode': 'off', 'use_snp_selection': False}. Best is trial 121 with value: 0.08695958387848404.
[I 2025-11-03 13:56:49,275] Trial 123 finished with value: 0.07194111044311559 and parameters: {'model_type': 'gcn', 'hidden_dims': '[256, 128, 64]', 'dropout': 0.40017410247155144, 'batch_norm': True, 'lr': 0.000987119926507636, 'weight_decay': 2.4055627779540093e-06, 'epochs': 186, 'loss': 'mse', 'optimizer': 'adam', 'graph_mode': 'off', 'use_snp_selection': False}. Best is trial 121 with value: 0.08695958387848404.
[I 2025-11-03 13:56:51,211] Trial 124 finished with value: 0.07679578973401152 and parameters: {'model_type': 'gcn', 'hidden_dims': '[512, 64]', 'dropout': 0.40877416548929124, 'batch_norm': True, 'lr': 0.0008811545693241217, 'weight_decay': 4.724694761351124e-06, 'epochs': 245, 'loss': 'mse', 'optimizer': 'adam', 'graph_mode': 'off', 'use_snp_selection': False}. Best is trial 121 with value: 0.08695958387848404.
[I 2025-11-03 13:56:53,381] Trial 125 finished with value: 0.07021734216793987 and parameters: {'model_type': 'gcn', 'hidden_dims': '[512, 64]', 'dropout': 0.407327497304834, 'batch_norm': True, 'lr': 0.0007305589839605064, 'weight_decay': 4.6443568030510025e-06, 'epochs': 282, 'loss': 'mse', 'optimizer': 'adam', 'graph_mode': 'off', 'use_snp_selection': False}. Best is trial 121 with value: 0.08695958387848404.
[I 2025-11-03 13:56:55,115] Trial 126 finished with value: 0.05869519366179966 and parameters: {'model_type': 'gcn', 'hidden_dims': '[512, 64]', 'dropout': 0.38448777956926794, 'batch_norm': True, 'lr': 0.0005821673645232803, 'weight_decay': 1.2956630738347517e-06, 'epochs': 203, 'loss': 'mse', 'optimizer': 'adam', 'graph_mode': 'off', 'use_snp_selection': False}. Best is trial 121 with value: 0.08695958387848404.
[I 2025-11-03 13:56:57,083] Trial 127 finished with value: 0.06519709436276494 and parameters: {'model_type': 'gcn', 'hidden_dims': '[512, 64]', 'dropout': 0.5171688769677, 'batch_norm': True, 'lr': 0.0008643304517852549, 'weight_decay': 1.9088325907195017e-06, 'epochs': 245, 'loss': 'mse', 'optimizer': 'adam', 'graph_mode': 'off', 'use_snp_selection': False}. Best is trial 121 with value: 0.08695958387848404.
[I 2025-11-03 13:56:59,647] Trial 128 finished with value: 0.008696937407658204 and parameters: {'model_type': 'gcn', 'hidden_dims': '[512, 64]', 'dropout': 0.41977858321676237, 'batch_norm': False, 'lr': 0.0006718219300932519, 'weight_decay': 2.9876468154370886e-06, 'epochs': 271, 'loss': 'mse', 'optimizer': 'adam', 'graph_mode': 'off', 'use_snp_selection': True, 'num_snps': 51726}. Best is trial 121 with value: 0.08695958387848404.
[I 2025-11-03 13:57:01,137] Trial 129 finished with value: 0.04828423519030962 and parameters: {'model_type': 'gcn', 'hidden_dims': '[256, 128, 64]', 'dropout': 0.4104320504601299, 'batch_norm': True, 'lr': 0.00041472436604539863, 'weight_decay': 5.166598955273955e-07, 'epochs': 215, 'loss': 'mae', 'optimizer': 'adam', 'graph_mode': 'off', 'use_snp_selection': False}. Best is trial 121 with value: 0.08695958387848404.
[I 2025-11-03 13:57:02,532] Trial 130 finished with value: 0.04448575636953159 and parameters: {'model_type': 'gcn', 'hidden_dims': '[512, 128]', 'dropout': 0.4826042146650313, 'batch_norm': True, 'lr': 4.059526129946736e-06, 'weight_decay': 3.945856802419479e-06, 'epochs': 140, 'loss': 'mse', 'optimizer': 'adam', 'graph_mode': 'off', 'use_snp_selection': False}. Best is trial 121 with value: 0.08695958387848404.
[I 2025-11-03 13:57:04,549] Trial 131 finished with value: 0.05909172264435474 and parameters: {'model_type': 'gcn', 'hidden_dims': '[512, 256]', 'dropout': 0.3418737862642688, 'batch_norm': True, 'lr': 0.0008821354135023305, 'weight_decay': 6.27874280899941e-06, 'epochs': 254, 'loss': 'mse', 'optimizer': 'adam', 'graph_mode': 'off', 'use_snp_selection': False}. Best is trial 121 with value: 0.08695958387848404.
[I 2025-11-03 13:57:06,078] Trial 132 finished with value: 0.04736233394585449 and parameters: {'model_type': 'gcn', 'hidden_dims': '[256, 128, 64]', 'dropout': 0.3624877289949905, 'batch_norm': True, 'lr': 0.0009998068361097105, 'weight_decay': 5.196621403235324e-06, 'epochs': 226, 'loss': 'mse', 'optimizer': 'adam', 'graph_mode': 'off', 'use_snp_selection': False}. Best is trial 121 with value: 0.08695958387848404.
[I 2025-11-03 13:57:07,311] Trial 133 finished with value: 0.07481925431292527 and parameters: {'model_type': 'gcn', 'hidden_dims': '[256, 128]', 'dropout': 0.43861965210310844, 'batch_norm': True, 'lr': 0.0007734646445834593, 'weight_decay': 6.378675812188308e-06, 'epochs': 193, 'loss': 'mse', 'optimizer': 'adam', 'graph_mode': 'off', 'use_snp_selection': False}. Best is trial 121 with value: 0.08695958387848404.
[I 2025-11-03 13:57:09,019] Trial 134 finished with value: 0.06539272426128956 and parameters: {'model_type': 'gcn', 'hidden_dims': '[512, 64]', 'dropout': 0.43808250985634706, 'batch_norm': True, 'lr': 0.0007692590580068813, 'weight_decay': 3.6556168672820807e-06, 'epochs': 193, 'loss': 'mse', 'optimizer': 'adam', 'graph_mode': 'off', 'use_snp_selection': False}. Best is trial 121 with value: 0.08695958387848404.
[I 2025-11-03 13:57:10,176] Trial 135 finished with value: 0.07272670879145995 and parameters: {'model_type': 'gcn', 'hidden_dims': '[256, 128]', 'dropout': 0.4566035649619923, 'batch_norm': True, 'lr': 0.0005487870469686142, 'weight_decay': 7.322565073164645e-07, 'epochs': 177, 'loss': 'mse', 'optimizer': 'adam', 'graph_mode': 'off', 'use_snp_selection': False}. Best is trial 121 with value: 0.08695958387848404.
[I 2025-11-03 13:57:11,932] Trial 136 finished with value: 0.0704889839503757 and parameters: {'model_type': 'gcn', 'hidden_dims': '[512, 128]', 'dropout': 0.4026885961913012, 'batch_norm': True, 'lr': 0.0006507770346671559, 'weight_decay': 2.2565597075977232e-07, 'epochs': 202, 'loss': 'mse', 'optimizer': 'adam', 'graph_mode': 'off', 'use_snp_selection': False}. Best is trial 121 with value: 0.08695958387848404.
[I 2025-11-03 13:57:13,185] Trial 137 finished with value: 0.06530961654763243 and parameters: {'model_type': 'gcn', 'hidden_dims': '[256, 128, 64]', 'dropout': 0.4275949265939063, 'batch_norm': True, 'lr': 0.0007524419193314051, 'weight_decay': 8.65312517385888e-06, 'epochs': 163, 'loss': 'mse', 'optimizer': 'adam', 'graph_mode': 'off', 'use_snp_selection': False}. Best is trial 121 with value: 0.08695958387848404.
[I 2025-11-03 13:57:14,409] Trial 138 finished with value: 0.060345426565485215 and parameters: {'model_type': 'gcn', 'hidden_dims': '[256, 128]', 'dropout': 0.3719208786097761, 'batch_norm': True, 'lr': 0.0008483656194946921, 'weight_decay': 2.2813533479836405e-06, 'epochs': 193, 'loss': 'mae', 'optimizer': 'adam', 'graph_mode': 'off', 'use_snp_selection': False}. Best is trial 121 with value: 0.08695958387848404.
[I 2025-11-03 13:57:15,829] Trial 139 finished with value: 0.060276645740675865 and parameters: {'model_type': 'gcn', 'hidden_dims': '[256, 128, 64]', 'dropout': 0.3893767822285351, 'batch_norm': False, 'lr': 0.000450951219733985, 'weight_decay': 5.582412612096813e-06, 'epochs': 208, 'loss': 'mse', 'optimizer': 'adam', 'graph_mode': 'off', 'use_snp_selection': False}. Best is trial 121 with value: 0.08695958387848404.
