[I 2025-11-03 12:15:28,248] Trial 28 finished with value: 0.0041787406946629585 and parameters: {'model_type': 'gcn', 'hidden_dims': '[256, 128, 64]', 'dropout': 0.1574132891495136, 'batch_norm': True, 'lr': 5.82763665667071e-06, 'weight_decay': 5.000512563478479e-07, 'epochs': 334, 'loss': 'mae', 'optimizer': 'adam', 'graph_mode': 'knn', 'source': 'grm', 'knn_k': 1, 'weighted_edges': False, 'symmetrize_mode': 'mutual', 'use_snp_selection': False}. Best is trial 15 with value: 0.10244797408842266.
[I 2025-11-03 12:15:30,409] Trial 29 finished with value: 0.08109405870895087 and parameters: {'model_type': 'gcn', 'hidden_dims': '[128, 64]', 'dropout': 0.2227690130646757, 'batch_norm': True, 'lr': 0.00041867566128821014, 'weight_decay': 9.759564253024096e-05, 'epochs': 283, 'loss': 'mae', 'optimizer': 'adam', 'graph_mode': 'knn', 'source': 'grm', 'knn_k': 3, 'weighted_edges': True, 'symmetrize_mode': 'union', 'use_snp_selection': False}. Best is trial 15 with value: 0.10244797408842266.
[I 2025-11-03 12:15:34,311] Trial 30 finished with value: 0.077923088144491 and parameters: {'model_type': 'gcn', 'hidden_dims': '[512, 64]', 'dropout': 0.3621269752553935, 'batch_norm': True, 'lr': 2.8408704662466022e-05, 'weight_decay': 0.00020511462460338166, 'epochs': 330, 'loss': 'mae', 'optimizer': 'adam', 'graph_mode': 'knn', 'source': 'grm', 'knn_k': 2, 'weighted_edges': True, 'symmetrize_mode': 'union', 'use_snp_selection': False}. Best is trial 15 with value: 0.10244797408842266.
[I 2025-11-03 12:15:37,686] Trial 31 finished with value: 0.07137517230744847 and parameters: {'model_type': 'gcn', 'hidden_dims': '[512, 64]', 'dropout': 0.2961448616607328, 'batch_norm': True, 'lr': 0.0001179004213009031, 'weight_decay': 1.7510640731259243e-07, 'epochs': 261, 'loss': 'mae', 'optimizer': 'adam', 'graph_mode': 'knn', 'source': 'grm', 'knn_k': 1, 'weighted_edges': True, 'symmetrize_mode': 'union', 'use_snp_selection': False}. Best is trial 15 with value: 0.10244797408842266.
[I 2025-11-03 12:15:40,963] Trial 32 finished with value: 0.1359998317137015 and parameters: {'model_type': 'gcn', 'hidden_dims': '[512, 64]', 'dropout': 0.2934660725578642, 'batch_norm': True, 'lr': 0.0001779867232684176, 'weight_decay': 1.5703902354106335e-07, 'epochs': 248, 'loss': 'mae', 'optimizer': 'adam', 'graph_mode': 'knn', 'source': 'grm', 'knn_k': 1, 'weighted_edges': True, 'symmetrize_mode': 'union', 'use_snp_selection': False}. Best is trial 32 with value: 0.1359998317137015.
[I 2025-11-03 12:15:44,080] Trial 33 finished with value: 0.0727789955247758 and parameters: {'model_type': 'gcn', 'hidden_dims': '[512, 64]', 'dropout': 0.32044963594347037, 'batch_norm': True, 'lr': 0.0002028142625970746, 'weight_decay': 1.0037573642535827e-07, 'epochs': 226, 'loss': 'mae', 'optimizer': 'adam', 'graph_mode': 'knn', 'source': 'grm', 'knn_k': 2, 'weighted_edges': True, 'symmetrize_mode': 'union', 'use_snp_selection': False}. Best is trial 32 with value: 0.1359998317137015.
[I 2025-11-03 12:15:46,082] Trial 34 finished with value: 0.11864462358751042 and parameters: {'model_type': 'gcn', 'hidden_dims': '[128, 64]', 'dropout': 0.1841410447502204, 'batch_norm': True, 'lr': 0.0008762972394272024, 'weight_decay': 1.4094445187370041e-06, 'epochs': 247, 'loss': 'mse', 'optimizer': 'adam', 'graph_mode': 'knn', 'source': 'grm', 'knn_k': 1, 'weighted_edges': True, 'symmetrize_mode': 'union', 'use_snp_selection': False}. Best is trial 32 with value: 0.1359998317137015.
[I 2025-11-03 12:15:48,068] Trial 35 finished with value: 0.04686951791634883 and parameters: {'model_type': 'gcn', 'hidden_dims': '[128, 64]', 'dropout': 0.1769224295908835, 'batch_norm': False, 'lr': 0.0008471947627448586, 'weight_decay': 7.944147898483608e-07, 'epochs': 250, 'loss': 'mse', 'optimizer': 'adam', 'graph_mode': 'knn', 'source': 'grm', 'knn_k': 2, 'weighted_edges': True, 'symmetrize_mode': 'union', 'use_snp_selection': True, 'num_snps': 2074}. Best is trial 32 with value: 0.1359998317137015.
[I 2025-11-03 12:15:50,244] Trial 36 finished with value: 0.08216905165668587 and parameters: {'model_type': 'gcn', 'hidden_dims': '[128, 64]', 'dropout': 0.2405502972759981, 'batch_norm': True, 'lr': 0.0006026032354165682, 'weight_decay': 1.466989720463421e-06, 'epochs': 288, 'loss': 'mse', 'optimizer': 'adam', 'graph_mode': 'cutoff', 'cutoff': 0.42596163795855535, 'grm_norm': 'cosine', 'self_loops': True, 'use_snp_selection': False}. Best is trial 32 with value: 0.1359998317137015.
[I 2025-11-03 12:15:52,410] Trial 37 finished with value: 0.09046029147751485 and parameters: {'model_type': 'gcn', 'hidden_dims': '[128, 64]', 'dropout': 0.14764966079088648, 'batch_norm': False, 'lr': 0.0005120089009850145, 'weight_decay': 1.92200799658679e-06, 'epochs': 154, 'loss': 'mse', 'optimizer': 'adam', 'graph_mode': 'knn', 'source': 'grm', 'knn_k': 9, 'weighted_edges': True, 'symmetrize_mode': 'mutual', 'use_snp_selection': True, 'num_snps': 15344}. Best is trial 32 with value: 0.1359998317137015.
[I 2025-11-03 12:15:54,705] Trial 38 finished with value: 0.07256412173510533 and parameters: {'model_type': 'gcn', 'hidden_dims': '[256, 128]', 'dropout': 0.10436832089269099, 'batch_norm': True, 'lr': 4.047094626082268e-05, 'weight_decay': 5.563873255700777e-07, 'epochs': 202, 'loss': 'mse', 'optimizer': 'adam', 'graph_mode': 'knn', 'source': 'grm', 'knn_k': 7, 'weighted_edges': True, 'symmetrize_mode': 'union', 'use_snp_selection': False}. Best is trial 32 with value: 0.1359998317137015.
[I 2025-11-03 12:15:58,622] Trial 39 finished with value: 0.07586470344891927 and parameters: {'model_type': 'gcn', 'hidden_dims': '[128, 64]', 'dropout': 0.36884827474099224, 'batch_norm': False, 'lr': 0.000278183224797393, 'weight_decay': 1.0812746688940515e-06, 'epochs': 236, 'loss': 'mse', 'optimizer': 'adam', 'graph_mode': 'cutoff', 'cutoff': 0.8982975816958216, 'grm_norm': 'cosine_then_gcn', 'self_loops': True, 'use_snp_selection': True, 'num_snps': 58379}. Best is trial 32 with value: 0.1359998317137015.
[I 2025-11-03 12:16:02,523] Trial 40 finished with value: 0.09577537772120756 and parameters: {'model_type': 'gcn', 'hidden_dims': '[512, 256]', 'dropout': 0.41464202064258304, 'batch_norm': True, 'lr': 0.0006543292792772078, 'weight_decay': 2.8194205744277863e-07, 'epochs': 321, 'loss': 'mse', 'optimizer': 'adam', 'graph_mode': 'knn', 'source': 'grm', 'knn_k': 3, 'weighted_edges': True, 'symmetrize_mode': 'union', 'use_snp_selection': False}. Best is trial 32 with value: 0.1359998317137015.
[I 2025-11-03 12:16:06,304] Trial 41 finished with value: 0.12449253679371676 and parameters: {'model_type': 'gcn', 'hidden_dims': '[512, 256]', 'dropout': 0.4295850523559392, 'batch_norm': True, 'lr': 0.0006404038812474716, 'weight_decay': 2.8528651672552305e-07, 'epochs': 316, 'loss': 'mse', 'optimizer': 'adam', 'graph_mode': 'knn', 'source': 'grm', 'knn_k': 1, 'weighted_edges': True, 'symmetrize_mode': 'union', 'use_snp_selection': False}. Best is trial 32 with value: 0.1359998317137015.
[I 2025-11-03 12:16:10,348] Trial 42 finished with value: 0.11619038423539793 and parameters: {'model_type': 'gcn', 'hidden_dims': '[512, 256]', 'dropout': 0.4477634824830431, 'batch_norm': True, 'lr': 0.0004699454004551678, 'weight_decay': 5.938818769864621e-06, 'epochs': 350, 'loss': 'mse', 'optimizer': 'adam', 'graph_mode': 'knn', 'source': 'grm', 'knn_k': 1, 'weighted_edges': True, 'symmetrize_mode': 'union', 'use_snp_selection': False}. Best is trial 32 with value: 0.1359998317137015.
[I 2025-11-03 12:16:14,353] Trial 43 finished with value: 0.08554133986951004 and parameters: {'model_type': 'gcn', 'hidden_dims': '[512, 256]', 'dropout': 0.4718359123301312, 'batch_norm': True, 'lr': 0.0004257468152955363, 'weight_decay': 6.213762710543486e-06, 'epochs': 345, 'loss': 'mse', 'optimizer': 'adam', 'graph_mode': 'knn', 'source': 'grm', 'knn_k': 1, 'weighted_edges': False, 'symmetrize_mode': 'union', 'use_snp_selection': False}. Best is trial 32 with value: 0.1359998317137015.
[I 2025-11-03 12:16:18,162] Trial 44 finished with value: 0.12589355377104228 and parameters: {'model_type': 'gcn', 'hidden_dims': '[512, 256]', 'dropout': 0.5138486891434473, 'batch_norm': True, 'lr': 0.0009443816677392135, 'weight_decay': 1.2615564542942791e-05, 'epochs': 319, 'loss': 'mse', 'optimizer': 'adam', 'graph_mode': 'knn', 'source': 'grm', 'knn_k': 2, 'weighted_edges': True, 'symmetrize_mode': 'mutual', 'use_snp_selection': False}. Best is trial 32 with value: 0.1359998317137015.
[I 2025-11-03 12:16:21,959] Trial 45 finished with value: 0.08415711900245475 and parameters: {'model_type': 'gcn', 'hidden_dims': '[512, 256]', 'dropout': 0.5109354771910284, 'batch_norm': True, 'lr': 0.000917590573143038, 'weight_decay': 1.062900025849677e-05, 'epochs': 322, 'loss': 'mse', 'optimizer': 'adam', 'graph_mode': 'cutoff', 'cutoff': 0.4585737354176531, 'grm_norm': 'cosine', 'self_loops': False, 'use_snp_selection': False}. Best is trial 32 with value: 0.1359998317137015.
[I 2025-11-03 12:16:23,938] Trial 46 finished with value: 0.09584871201042124 and parameters: {'model_type': 'gcn', 'hidden_dims': '[512, 256]', 'dropout': 0.5446436625236393, 'batch_norm': True, 'lr': 0.0006882589121959487, 'weight_decay': 1.766492555643474e-05, 'epochs': 76, 'loss': 'mse', 'optimizer': 'adam', 'graph_mode': 'knn', 'source': 'grm', 'knn_k': 2, 'weighted_edges': True, 'symmetrize_mode': 'mutual', 'use_snp_selection': False}. Best is trial 32 with value: 0.1359998317137015.
[I 2025-11-03 12:16:27,925] Trial 47 finished with value: 0.09760010456705064 and parameters: {'model_type': 'gcn', 'hidden_dims': '[512, 256]', 'dropout': 0.48534326099449554, 'batch_norm': True, 'lr': 0.00032087279613176857, 'weight_decay': 4.2539067278766624e-05, 'epochs': 340, 'loss': 'mse', 'optimizer': 'adam', 'graph_mode': 'knn', 'source': 'grm', 'knn_k': 6, 'weighted_edges': True, 'symmetrize_mode': 'mutual', 'use_snp_selection': False}. Best is trial 32 with value: 0.1359998317137015.
[I 2025-11-03 12:16:32,521] Trial 48 finished with value: 0.12154356234250366 and parameters: {'model_type': 'gcn', 'hidden_dims': '[512, 256]', 'dropout': 0.44984996416408396, 'batch_norm': False, 'lr': 0.0005292695974962006, 'weight_decay': 5.743603751539007e-06, 'epochs': 320, 'loss': 'mse', 'optimizer': 'adam', 'graph_mode': 'knn', 'source': 'grm', 'knn_k': 1, 'weighted_edges': False, 'symmetrize_mode': 'mutual', 'use_snp_selection': True, 'num_snps': 42595}. Best is trial 32 with value: 0.1359998317137015.
[I 2025-11-03 12:16:37,119] Trial 49 finished with value: 0.08124691431884451 and parameters: {'model_type': 'gcn', 'hidden_dims': '[512, 256]', 'dropout': 0.5239214917936725, 'batch_norm': False, 'lr': 0.0007557686179114566, 'weight_decay': 2.261847380568074e-06, 'epochs': 300, 'loss': 'mse', 'optimizer': 'adam', 'graph_mode': 'knn', 'source': 'grm', 'knn_k': 1, 'weighted_edges': False, 'symmetrize_mode': 'mutual', 'use_snp_selection': True, 'num_snps': 44510}. Best is trial 32 with value: 0.1359998317137015.
[I 2025-11-03 12:16:41,204] Trial 50 finished with value: 0.08311129174279372 and parameters: {'model_type': 'gcn', 'hidden_dims': '[512, 256]', 'dropout': 0.5590427564407053, 'batch_norm': False, 'lr': 0.0005968341207887076, 'weight_decay': 3.023225062619703e-05, 'epochs': 316, 'loss': 'mse', 'optimizer': 'adam', 'graph_mode': 'cutoff', 'cutoff': 0.24768638416140915, 'grm_norm': 'none', 'self_loops': True, 'use_snp_selection': True, 'num_snps': 35964}. Best is trial 32 with value: 0.1359998317137015.
[I 2025-11-03 12:16:44,448] Trial 51 finished with value: 0.11042693202402934 and parameters: {'model_type': 'gcn', 'hidden_dims': '[512, 256]', 'dropout': 0.43742594860127654, 'batch_norm': False, 'lr': 0.00043698263130705463, 'weight_decay': 6.074336111567719e-06, 'epochs': 350, 'loss': 'mse', 'optimizer': 'adam', 'graph_mode': 'knn', 'source': 'grm', 'knn_k': 1, 'weighted_edges': False, 'symmetrize_mode': 'mutual', 'use_snp_selection': True, 'num_snps': 20124}. Best is trial 32 with value: 0.1359998317137015.
[I 2025-11-03 12:16:49,657] Trial 52 finished with value: 0.07282526079242735 and parameters: {'model_type': 'gcn', 'hidden_dims': '[512, 256]', 'dropout': 0.44825839368036474, 'batch_norm': False, 'lr': 0.0009791654904104615, 'weight_decay': 8.120688125884247e-06, 'epochs': 326, 'loss': 'mse', 'optimizer': 'adam', 'graph_mode': 'knn', 'source': 'grm', 'knn_k': 1, 'weighted_edges': False, 'symmetrize_mode': 'mutual', 'use_snp_selection': True, 'num_snps': 51437}. Best is trial 32 with value: 0.1359998317137015.
[I 2025-11-03 12:16:53,719] Trial 53 finished with value: 0.11604832917631051 and parameters: {'model_type': 'gcn', 'hidden_dims': '[512, 256]', 'dropout': 0.4909084056630768, 'batch_norm': False, 'lr': 0.0005024543936059762, 'weight_decay': 1.2474509335072668e-05, 'epochs': 304, 'loss': 'mse', 'optimizer': 'adam', 'graph_mode': 'knn', 'source': 'grm', 'knn_k': 2, 'weighted_edges': False, 'symmetrize_mode': 'mutual', 'use_snp_selection': True, 'num_snps': 36063}. Best is trial 32 with value: 0.1359998317137015.
[I 2025-11-03 12:16:57,696] Trial 54 finished with value: 0.0912252489806494 and parameters: {'model_type': 'gcn', 'hidden_dims': '[512, 256]', 'dropout': 0.42447217324804376, 'batch_norm': True, 'lr': 0.0003377017222778981, 'weight_decay': 3.987782183286391e-06, 'epochs': 335, 'loss': 'mse', 'optimizer': 'adam', 'graph_mode': 'knn', 'source': 'grm', 'knn_k': 1, 'weighted_edges': True, 'symmetrize_mode': 'mutual', 'use_snp_selection': False}. Best is trial 32 with value: 0.1359998317137015.
[I 2025-11-03 12:17:00,767] Trial 55 finished with value: 0.09954310732556129 and parameters: {'model_type': 'gcn', 'hidden_dims': '[256, 128, 64]', 'dropout': 0.5885408369557974, 'batch_norm': True, 'lr': 0.00022146505687998486, 'weight_decay': 3.8042440770101585e-06, 'epochs': 294, 'loss': 'mse', 'optimizer': 'adam', 'graph_mode': 'knn', 'source': 'grm', 'knn_k': 2, 'weighted_edges': False, 'symmetrize_mode': 'mutual', 'use_snp_selection': False}. Best is trial 32 with value: 0.1359998317137015.
[I 2025-11-03 12:17:02,266] Trial 56 finished with value: 0.08910869970211693 and parameters: {'model_type': 'gcn', 'hidden_dims': '[512, 256]', 'dropout': 0.40663348919109066, 'batch_norm': True, 'lr': 0.0006879788198589796, 'weight_decay': 1.3298761417116107e-05, 'epochs': 11, 'loss': 'mse', 'optimizer': 'adam', 'graph_mode': 'knn', 'source': 'grm', 'knn_k': 3, 'weighted_edges': True, 'symmetrize_mode': 'mutual', 'use_snp_selection': False}. Best is trial 32 with value: 0.1359998317137015.
[I 2025-11-03 12:17:05,247] Trial 57 finished with value: 0.07551688648909653 and parameters: {'model_type': 'gcn', 'hidden_dims': '[512, 128]', 'dropout': 0.46024459678467083, 'batch_norm': False, 'lr': 0.0005186813341750866, 'weight_decay': 2.3097604886040866e-05, 'epochs': 244, 'loss': 'mse', 'optimizer': 'adam', 'graph_mode': 'knn', 'source': 'grm', 'knn_k': 1, 'weighted_edges': True, 'symmetrize_mode': 'mutual', 'use_snp_selection': True, 'num_snps': 24595}. Best is trial 32 with value: 0.1359998317137015.
[I 2025-11-03 12:17:06,886] Trial 58 finished with value: 0.10413770867276076 and parameters: {'model_type': 'gcn', 'hidden_dims': '[512, 256]', 'dropout': 0.4888920665359535, 'batch_norm': True, 'lr': 0.0007562676668080291, 'weight_decay': 4.734937117571464e-06, 'epochs': 35, 'loss': 'mse', 'optimizer': 'adam', 'graph_mode': 'knn', 'source': 'grm', 'knn_k': 2, 'weighted_edges': True, 'symmetrize_mode': 'mutual', 'use_snp_selection': False}. Best is trial 32 with value: 0.1359998317137015.
[I 2025-11-03 12:17:09,348] Trial 59 finished with value: 0.09087384298875728 and parameters: {'model_type': 'gcn', 'hidden_dims': '[256, 128]', 'dropout': 0.39314135479916945, 'batch_norm': True, 'lr': 0.0009846907360627599, 'weight_decay': 1.336978911053695e-07, 'epochs': 276, 'loss': 'mse', 'optimizer': 'adam', 'graph_mode': 'knn', 'source': 'grm', 'knn_k': 1, 'weighted_edges': False, 'symmetrize_mode': 'union', 'use_snp_selection': False}. Best is trial 32 with value: 0.1359998317137015.
[I 2025-11-03 12:17:11,491] Trial 60 finished with value: 0.087968299264084 and parameters: {'model_type': 'gcn', 'hidden_dims': '[128, 64]', 'dropout': 0.5263923846958293, 'batch_norm': True, 'lr': 0.0002905232650993401, 'weight_decay': 1.7354305000614154e-06, 'epochs': 313, 'loss': 'mse', 'optimizer': 'adam', 'graph_mode': 'knn', 'source': 'grm', 'knn_k': 3, 'weighted_edges': True, 'symmetrize_mode': 'union', 'use_snp_selection': False}. Best is trial 32 with value: 0.1359998317137015.
[I 2025-11-03 12:17:15,299] Trial 61 finished with value: 0.08225626151077903 and parameters: {'model_type': 'gcn', 'hidden_dims': '[512, 256]', 'dropout': 0.49215452966645934, 'batch_norm': False, 'lr': 0.0004575795993703518, 'weight_decay': 1.4502089133709897e-05, 'epochs': 300, 'loss': 'mse', 'optimizer': 'adam', 'graph_mode': 'knn', 'source': 'grm', 'knn_k': 2, 'weighted_edges': False, 'symmetrize_mode': 'mutual', 'use_snp_selection': True, 'num_snps': 37214}. Best is trial 32 with value: 0.1359998317137015.
[I 2025-11-03 12:17:19,210] Trial 62 finished with value: 0.06860696279868836 and parameters: {'model_type': 'gcn', 'hidden_dims': '[512, 256]', 'dropout': 0.4760242615329866, 'batch_norm': False, 'lr': 0.0005285082149635509, 'weight_decay': 9.570322484945294e-06, 'epochs': 311, 'loss': 'mse', 'optimizer': 'adam', 'graph_mode': 'knn', 'source': 'grm', 'knn_k': 1, 'weighted_edges': False, 'symmetrize_mode': 'mutual', 'use_snp_selection': True, 'num_snps': 37022}. Best is trial 32 with value: 0.1359998317137015.
[I 2025-11-03 12:17:24,070] Trial 63 finished with value: 0.08674575309496006 and parameters: {'model_type': 'gcn', 'hidden_dims': '[512, 256]', 'dropout': 0.5021582738476416, 'batch_norm': False, 'lr': 0.0005556650907171246, 'weight_decay': 3.320013913396415e-05, 'epochs': 331, 'loss': 'mse', 'optimizer': 'adam', 'graph_mode': 'knn', 'source': 'grm', 'knn_k': 2, 'weighted_edges': False, 'symmetrize_mode': 'mutual', 'use_snp_selection': True, 'num_snps': 50551}. Best is trial 32 with value: 0.1359998317137015.
[I 2025-11-03 12:17:27,586] Trial 64 finished with value: 0.0896844432813358 and parameters: {'model_type': 'gcn', 'hidden_dims': '[512, 256]', 'dropout': 0.43233392391587966, 'batch_norm': False, 'lr': 0.0003817774535870492, 'weight_decay': 7.897492617157826e-06, 'epochs': 291, 'loss': 'mse', 'optimizer': 'adam', 'graph_mode': 'knn', 'source': 'grm', 'knn_k': 1, 'weighted_edges': False, 'symmetrize_mode': 'mutual', 'use_snp_selection': True, 'num_snps': 32233}. Best is trial 32 with value: 0.1359998317137015.
[I 2025-11-03 12:17:32,602] Trial 65 finished with value: -0.02868327442508989 and parameters: {'model_type': 'gcn', 'hidden_dims': '[512, 256]', 'dropout': 0.4581579105641589, 'batch_norm': False, 'lr': 2.8256551879378743e-06, 'weight_decay': 7.824940134031446e-05, 'epochs': 342, 'loss': 'mse', 'optimizer': 'adam', 'graph_mode': 'knn', 'source': 'grm', 'knn_k': 2, 'weighted_edges': False, 'symmetrize_mode': 'union', 'use_snp_selection': True, 'num_snps': 52264}. Best is trial 32 with value: 0.1359998317137015.
[I 2025-11-03 12:17:35,986] Trial 66 finished with value: 0.103098285908259 and parameters: {'model_type': 'gcn', 'hidden_dims': '[512, 128]', 'dropout': 0.5182082479147825, 'batch_norm': True, 'lr': 0.00019293853811532032, 'weight_decay': 1.652574081783649e-05, 'epochs': 276, 'loss': 'mse', 'optimizer': 'adam', 'graph_mode': 'knn', 'source': 'grm', 'knn_k': 1, 'weighted_edges': True, 'symmetrize_mode': 'mutual', 'use_snp_selection': False}. Best is trial 32 with value: 0.1359998317137015.
[I 2025-11-03 12:17:39,370] Trial 67 finished with value: 0.0922393123207563 and parameters: {'model_type': 'gcn', 'hidden_dims': '[256, 128, 64]', 'dropout': 0.3814345194353671, 'batch_norm': False, 'lr': 0.00026462515243263823, 'weight_decay': 4.954347784114934e-06, 'epochs': 214, 'loss': 'mse', 'optimizer': 'adam', 'graph_mode': 'knn', 'source': 'grm', 'knn_k': 1, 'weighted_edges': True, 'symmetrize_mode': 'union', 'use_snp_selection': True, 'num_snps': 40781}. Best is trial 32 with value: 0.1359998317137015.
[I 2025-11-03 12:17:42,950] Trial 68 finished with value: 0.11650037419317731 and parameters: {'model_type': 'gcn', 'hidden_dims': '[512, 256]', 'dropout': 0.5470297784657929, 'batch_norm': True, 'lr': 0.0007936045202534006, 'weight_decay': 3.057283799630186e-06, 'epochs': 306, 'loss': 'mse', 'optimizer': 'adam', 'graph_mode': 'cutoff', 'cutoff': 0.7319833581248613, 'grm_norm': 'gcn', 'self_loops': False, 'use_snp_selection': False}. Best is trial 32 with value: 0.1359998317137015.
[I 2025-11-03 12:17:44,582] Trial 69 finished with value: 0.09893292090528863 and parameters: {'model_type': 'gcn', 'hidden_dims': '[128, 64]', 'dropout': 0.5523938685457648, 'batch_norm': True, 'lr': 0.0007388525005536505, 'weight_decay': 2.5439034806522326e-06, 'epochs': 184, 'loss': 'mse', 'optimizer': 'adam', 'graph_mode': 'cutoff', 'cutoff': 0.7229801840068215, 'grm_norm': 'gcn', 'self_loops': False, 'use_snp_selection': False}. Best is trial 32 with value: 0.1359998317137015.
[I 2025-11-03 12:17:47,754] Trial 70 finished with value: 0.1145980847760679 and parameters: {'model_type': 'gcn', 'hidden_dims': '[512, 256]', 'dropout': 0.5987742026777311, 'batch_norm': True, 'lr': 0.0008298929094697865, 'weight_decay': 6.230727395800821e-07, 'epochs': 259, 'loss': 'mse', 'optimizer': 'adam', 'graph_mode': 'cutoff', 'cutoff': 0.5913755409882876, 'grm_norm': 'gcn', 'self_loops': False, 'use_snp_selection': False}. Best is trial 32 with value: 0.1359998317137015.
