[I 2025-10-22 03:23:55,305] Trial 28 finished with value: 0.15768207546679153 and parameters: {'model_type': 'gat', 'hidden_dims': '[256, 128]', 'dropout': 0.5599688665519305, 'batch_norm': True, 'gat_heads': 5, 'gat_attn_dropout': 0.3837671793361547, 'gat_concat_hidden': True, 'lr': 3.501194492107072e-05, 'weight_decay': 0.0004177138619231628, 'epochs': 176, 'loss': 'mae', 'optimizer': 'adam', 'graph_mode': 'cutoff', 'cutoff': 0.5787310020936068, 'grm_norm': 'cosine', 'self_loops': True}. Best is trial 22 with value: 0.22300617294808017.
[I 2025-10-22 03:26:00,216] Trial 29 finished with value: 0.0879016588237479 and parameters: {'model_type': 'gat', 'hidden_dims': '[128, 64]', 'dropout': 0.47401313514776866, 'batch_norm': True, 'gat_heads': 6, 'gat_attn_dropout': 0.23948101795409737, 'gat_concat_hidden': True, 'lr': 0.0004909376598144764, 'weight_decay': 8.697533303831433e-05, 'epochs': 226, 'loss': 'mse', 'optimizer': 'adam', 'graph_mode': 'knn', 'source': 'grm', 'knn_k': 4, 'weighted_edges': False, 'symmetrize_mode': 'union'}. Best is trial 22 with value: 0.22300617294808017.
[I 2025-10-22 03:28:56,404] Trial 30 finished with value: 0.20080944636607362 and parameters: {'model_type': 'gat', 'hidden_dims': '[512, 256]', 'dropout': 0.392844167622061, 'batch_norm': True, 'gat_heads': 4, 'gat_attn_dropout': 0.46124866785181096, 'gat_concat_hidden': True, 'lr': 8.897411813591086e-06, 'weight_decay': 0.00025597907112762726, 'epochs': 131, 'loss': 'mae', 'optimizer': 'adam', 'graph_mode': 'cutoff', 'cutoff': 0.6876563954302591, 'grm_norm': 'cosine', 'self_loops': True}. Best is trial 22 with value: 0.22300617294808017.
[I 2025-10-22 03:35:08,395] Trial 31 finished with value: 0.2191107212343056 and parameters: {'model_type': 'gat', 'hidden_dims': '[512, 256]', 'dropout': 0.4518243646545257, 'batch_norm': True, 'gat_heads': 6, 'gat_attn_dropout': 0.5286294355729486, 'gat_concat_hidden': True, 'lr': 0.00012742714259472287, 'weight_decay': 1.7028305958591697e-05, 'epochs': 195, 'loss': 'mae', 'optimizer': 'adam', 'graph_mode': 'cutoff', 'cutoff': 0.801826345686197, 'grm_norm': 'cosine', 'self_loops': True}. Best is trial 22 with value: 0.22300617294808017.
[I 2025-10-22 03:42:36,358] Trial 32 finished with value: 0.1938900798656605 and parameters: {'model_type': 'gat', 'hidden_dims': '[512, 256]', 'dropout': 0.4627013192022137, 'batch_norm': True, 'gat_heads': 7, 'gat_attn_dropout': 0.4376742137210255, 'gat_concat_hidden': True, 'lr': 3.416878072133238e-05, 'weight_decay': 2.4102374431802537e-05, 'epochs': 199, 'loss': 'mae', 'optimizer': 'adam', 'graph_mode': 'cutoff', 'cutoff': 0.8025526054016505, 'grm_norm': 'cosine', 'self_loops': True}. Best is trial 22 with value: 0.22300617294808017.
[I 2025-10-22 03:47:45,087] Trial 33 finished with value: 0.19493259660392745 and parameters: {'model_type': 'gat', 'hidden_dims': '[512, 64]', 'dropout': 0.5362746144432176, 'batch_norm': True, 'gat_heads': 6, 'gat_attn_dropout': 0.3797285299092918, 'gat_concat_hidden': True, 'lr': 7.670759634183654e-05, 'weight_decay': 7.332143988912684e-05, 'epochs': 163, 'loss': 'mae', 'optimizer': 'adam', 'graph_mode': 'cutoff', 'cutoff': 0.56680686568291, 'grm_norm': 'cosine', 'self_loops': True}. Best is trial 22 with value: 0.22300617294808017.
[I 2025-10-22 03:53:51,838] Trial 34 finished with value: 0.1720201396150397 and parameters: {'model_type': 'gat', 'hidden_dims': '[512, 256]', 'dropout': 0.3194493080804421, 'batch_norm': True, 'gat_heads': 5, 'gat_attn_dropout': 0.49381499199407375, 'gat_concat_hidden': False, 'lr': 0.00011749251768798607, 'weight_decay': 0.0006766148556324905, 'epochs': 233, 'loss': 'mse', 'optimizer': 'adam', 'graph_mode': 'cutoff', 'cutoff': 0.6594977055757218, 'grm_norm': 'cosine', 'self_loops': True}. Best is trial 22 with value: 0.22300617294808017.
[I 2025-10-22 04:00:39,770] Trial 35 finished with value: 0.23345447785062814 and parameters: {'model_type': 'gat', 'hidden_dims': '[512, 256]', 'dropout': 0.5110206308084762, 'batch_norm': True, 'gat_heads': 6, 'gat_attn_dropout': 0.5559257227504025, 'gat_concat_hidden': True, 'lr': 4.70927509834406e-05, 'weight_decay': 1.4175338083862044e-05, 'epochs': 215, 'loss': 'mae', 'optimizer': 'adam', 'graph_mode': 'cutoff', 'cutoff': 0.8170373681901073, 'grm_norm': 'cosine', 'self_loops': True}. Best is trial 35 with value: 0.23345447785062814.
[I 2025-10-22 04:04:56,598] Trial 36 finished with value: 0.17858196150374334 and parameters: {'model_type': 'gat', 'hidden_dims': '[256, 128]', 'dropout': 0.5843792029693027, 'batch_norm': False, 'gat_heads': 7, 'gat_attn_dropout': 0.5483897186369595, 'gat_concat_hidden': True, 'lr': 4.5487521333466245e-05, 'weight_decay': 0.00025111174399507045, 'epochs': 219, 'loss': 'mae', 'optimizer': 'adam', 'graph_mode': 'knn', 'source': 'grm', 'knn_k': 10, 'weighted_edges': True, 'symmetrize_mode': 'union'}. Best is trial 35 with value: 0.23345447785062814.
[I 2025-10-22 04:11:26,482] Trial 37 finished with value: 0.16679817522636248 and parameters: {'model_type': 'gat', 'hidden_dims': '[512, 64]', 'dropout': 0.510823561475435, 'batch_norm': True, 'gat_heads': 5, 'gat_attn_dropout': 0.5591008187993466, 'gat_concat_hidden': False, 'lr': 2.1010491759117927e-05, 'weight_decay': 0.00011159660006274353, 'epochs': 250, 'loss': 'mae', 'optimizer': 'adam', 'graph_mode': 'cutoff', 'cutoff': 0.6682115964716895, 'grm_norm': 'none', 'self_loops': True}. Best is trial 35 with value: 0.23345447785062814.
[I 2025-10-22 04:12:46,529] Trial 38 finished with value: 0.21693543423577344 and parameters: {'model_type': 'gat', 'hidden_dims': '[128, 64]', 'dropout': 0.3788869471296572, 'batch_norm': False, 'gat_heads': 6, 'gat_attn_dropout': 0.48069312632530364, 'gat_concat_hidden': True, 'lr': 6.452183061049321e-05, 'weight_decay': 3.8125282036011026e-05, 'epochs': 143, 'loss': 'mse', 'optimizer': 'adam', 'graph_mode': 'cutoff', 'cutoff': 0.4607516427899594, 'grm_norm': 'none', 'self_loops': False}. Best is trial 35 with value: 0.23345447785062814.
[I 2025-10-22 04:14:22,056] Trial 39 finished with value: 0.09621831441797997 and parameters: {'model_type': 'gat', 'hidden_dims': '[256, 128, 64]', 'dropout': 0.33794664277484165, 'batch_norm': True, 'gat_heads': 3, 'gat_attn_dropout': 0.43586903042865566, 'gat_concat_hidden': False, 'lr': 2.6959752845855955e-05, 'weight_decay': 0.0004812924461148452, 'epochs': 169, 'loss': 'mae', 'optimizer': 'adam', 'graph_mode': 'knn', 'source': 'grm', 'knn_k': 3, 'weighted_edges': True, 'symmetrize_mode': 'mutual'}. Best is trial 35 with value: 0.23345447785062814.
[I 2025-10-22 04:20:07,926] Trial 40 finished with value: 0.10663222922307895 and parameters: {'model_type': 'gat', 'hidden_dims': '[512, 256]', 'dropout': 0.5963852627836751, 'batch_norm': True, 'gat_heads': 5, 'gat_attn_dropout': 0.021607400698068546, 'gat_concat_hidden': True, 'lr': 1.4051207943728179e-06, 'weight_decay': 4.699210670508844e-05, 'epochs': 198, 'loss': 'mae', 'optimizer': 'adam', 'graph_mode': 'cutoff', 'cutoff': 0.2172105245914876, 'grm_norm': 'cosine', 'self_loops': True}. Best is trial 35 with value: 0.23345447785062814.
[I 2025-10-22 04:26:11,536] Trial 41 finished with value: 0.21785867412804233 and parameters: {'model_type': 'gat', 'hidden_dims': '[512, 256]', 'dropout': 0.4480645457277675, 'batch_norm': True, 'gat_heads': 6, 'gat_attn_dropout': 0.51919832404902, 'gat_concat_hidden': True, 'lr': 4.753069173515951e-05, 'weight_decay': 1.707276512917317e-05, 'epochs': 190, 'loss': 'mae', 'optimizer': 'adam', 'graph_mode': 'cutoff', 'cutoff': 0.7883889448778537, 'grm_norm': 'cosine', 'self_loops': True}. Best is trial 35 with value: 0.23345447785062814.
[I 2025-10-22 04:34:04,836] Trial 42 finished with value: 0.21546130085906828 and parameters: {'model_type': 'gat', 'hidden_dims': '[512, 256]', 'dropout': 0.4880362926295326, 'batch_norm': True, 'gat_heads': 7, 'gat_attn_dropout': 0.571667629201647, 'gat_concat_hidden': True, 'lr': 0.00032117750907516973, 'weight_decay': 1.3130628968505943e-05, 'epochs': 212, 'loss': 'mae', 'optimizer': 'adam', 'graph_mode': 'cutoff', 'cutoff': 0.7482340056153362, 'grm_norm': 'cosine', 'self_loops': True}. Best is trial 35 with value: 0.23345447785062814.
[I 2025-10-22 04:39:16,659] Trial 43 finished with value: 0.22401944287568817 and parameters: {'model_type': 'gat', 'hidden_dims': '[512, 256]', 'dropout': 0.5146960541392774, 'batch_norm': True, 'gat_heads': 6, 'gat_attn_dropout': 0.5247209268389201, 'gat_concat_hidden': True, 'lr': 7.062658858696973e-05, 'weight_decay': 8.25800994505293e-06, 'epochs': 161, 'loss': 'mae', 'optimizer': 'adam', 'graph_mode': 'cutoff', 'cutoff': 0.8084580575273705, 'grm_norm': 'cosine_then_gcn', 'self_loops': False}. Best is trial 35 with value: 0.23345447785062814.
[I 2025-10-22 04:44:10,969] Trial 44 finished with value: 0.2165183947595409 and parameters: {'model_type': 'gat', 'hidden_dims': '[512, 256]', 'dropout': 0.5244898002704704, 'batch_norm': True, 'gat_heads': 6, 'gat_attn_dropout': 0.4967763016773159, 'gat_concat_hidden': True, 'lr': 8.39460719704589e-05, 'weight_decay': 3.03411708708235e-06, 'epochs': 151, 'loss': 'mae', 'optimizer': 'adam', 'graph_mode': 'cutoff', 'cutoff': 0.8257806357871961, 'grm_norm': 'cosine_then_gcn', 'self_loops': False}. Best is trial 35 with value: 0.23345447785062814.
[I 2025-10-22 04:46:40,006] Trial 45 finished with value: 0.23570509446629018 and parameters: {'model_type': 'gat', 'hidden_dims': '[256, 128, 64]', 'dropout': 0.5663294342797723, 'batch_norm': True, 'gat_heads': 5, 'gat_attn_dropout': 0.45937782609329353, 'gat_concat_hidden': True, 'lr': 6.310776800686968e-05, 'weight_decay': 0.0002610370962737569, 'epochs': 165, 'loss': 'mae', 'optimizer': 'adam', 'graph_mode': 'cutoff', 'cutoff': 0.5435944455650956, 'grm_norm': 'cosine_then_gcn', 'self_loops': False}. Best is trial 45 with value: 0.23570509446629018.
[I 2025-10-22 04:48:27,350] Trial 46 finished with value: 0.12008529050311083 and parameters: {'model_type': 'gat', 'hidden_dims': '[256, 128, 64]', 'dropout': 0.5652495361732206, 'batch_norm': False, 'gat_heads': 4, 'gat_attn_dropout': 0.3858932592817319, 'gat_concat_hidden': True, 'lr': 3.818920168063168e-05, 'weight_decay': 6.21380463413712e-06, 'epochs': 164, 'loss': 'mse', 'optimizer': 'adam', 'graph_mode': 'cutoff', 'cutoff': 0.5182976898763608, 'grm_norm': 'cosine_then_gcn', 'self_loops': False}. Best is trial 45 with value: 0.23570509446629018.
[I 2025-10-22 04:49:13,719] Trial 47 finished with value: 0.1290709819623657 and parameters: {'model_type': 'gat', 'hidden_dims': '[256, 128, 64]', 'dropout': 0.548537597538842, 'batch_norm': True, 'gat_heads': 5, 'gat_attn_dropout': 0.5778220551696196, 'gat_concat_hidden': True, 'lr': 5.807729871071246e-05, 'weight_decay': 0.000213515550773229, 'epochs': 42, 'loss': 'mae', 'optimizer': 'adam', 'graph_mode': 'cutoff', 'cutoff': 0.5593442357040179, 'grm_norm': 'cosine_then_gcn', 'self_loops': False}. Best is trial 45 with value: 0.23570509446629018.
[I 2025-10-22 04:51:15,280] Trial 48 finished with value: 0.11777520651200443 and parameters: {'model_type': 'gat', 'hidden_dims': '[256, 128, 64]', 'dropout': 0.5697633131278497, 'batch_norm': True, 'gat_heads': 7, 'gat_attn_dropout': 0.22255868949795032, 'gat_concat_hidden': False, 'lr': 6.712159227958709e-05, 'weight_decay': 0.00030131407178392023, 'epochs': 101, 'loss': 'mae', 'optimizer': 'adam', 'graph_mode': 'cutoff', 'cutoff': 0.41433889484031566, 'grm_norm': 'cosine_then_gcn', 'self_loops': False}. Best is trial 45 with value: 0.23570509446629018.
[I 2025-10-22 04:53:22,853] Trial 49 finished with value: 0.1677759341015058 and parameters: {'model_type': 'gat', 'hidden_dims': '[256, 128, 64]', 'dropout': 0.5288035539731741, 'batch_norm': True, 'gat_heads': 5, 'gat_attn_dropout': 0.5205153097160579, 'gat_concat_hidden': True, 'lr': 2.1099099599590066e-05, 'weight_decay': 1.60586045445342e-06, 'epochs': 136, 'loss': 'mae', 'optimizer': 'adam', 'graph_mode': 'cutoff', 'cutoff': 0.33129690025789177, 'grm_norm': 'cosine_then_gcn', 'self_loops': False}. Best is trial 45 with value: 0.23570509446629018.
[I 2025-10-22 05:03:54,776] Trial 50 finished with value: 0.14856645354467318 and parameters: {'model_type': 'gat', 'hidden_dims': '[512, 64]', 'dropout': 0.473817889097914, 'batch_norm': True, 'gat_heads': 8, 'gat_attn_dropout': 0.4675427935995714, 'gat_concat_hidden': True, 'lr': 0.00018545505778106556, 'weight_decay': 0.00014511127512463506, 'epochs': 242, 'loss': 'mae', 'optimizer': 'adam', 'graph_mode': 'knn', 'source': 'grm', 'knn_k': 7, 'weighted_edges': False, 'symmetrize_mode': 'union'}. Best is trial 45 with value: 0.23570509446629018.
[I 2025-10-22 05:09:02,263] Trial 51 finished with value: 0.22565340648151824 and parameters: {'model_type': 'gat', 'hidden_dims': '[512, 256]', 'dropout': 0.49772634428679263, 'batch_norm': True, 'gat_heads': 6, 'gat_attn_dropout': 0.32125477925095525, 'gat_concat_hidden': True, 'lr': 0.00011279202140384212, 'weight_decay': 0.0006642077768988461, 'epochs': 158, 'loss': 'mae', 'optimizer': 'adam', 'graph_mode': 'cutoff', 'cutoff': 0.6260595414238711, 'grm_norm': 'cosine_then_gcn', 'self_loops': False}. Best is trial 45 with value: 0.23570509446629018.
[I 2025-10-22 05:11:32,854] Trial 52 finished with value: 0.19548939910695057 and parameters: {'model_type': 'gat', 'hidden_dims': '[256, 128]', 'dropout': 0.5428077301768163, 'batch_norm': True, 'gat_heads': 6, 'gat_attn_dropout': 0.05958108576001467, 'gat_concat_hidden': True, 'lr': 0.0002590243594041782, 'weight_decay': 0.0005995019583972674, 'epochs': 155, 'loss': 'mae', 'optimizer': 'adam', 'graph_mode': 'cutoff', 'cutoff': 0.8956192384230273, 'grm_norm': 'cosine_then_gcn', 'self_loops': False}. Best is trial 45 with value: 0.23570509446629018.
[I 2025-10-22 05:15:01,970] Trial 53 finished with value: 0.2132662206861818 and parameters: {'model_type': 'gat', 'hidden_dims': '[512, 256]', 'dropout': 0.5156322208923354, 'batch_norm': True, 'gat_heads': 5, 'gat_attn_dropout': 0.4952398586379627, 'gat_concat_hidden': True, 'lr': 2.9182885854792478e-05, 'weight_decay': 7.433690978566526e-06, 'epochs': 123, 'loss': 'mae', 'optimizer': 'adam', 'graph_mode': 'cutoff', 'cutoff': 0.5879804600291345, 'grm_norm': 'cosine_then_gcn', 'self_loops': False}. Best is trial 45 with value: 0.23570509446629018.
[I 2025-10-22 05:20:23,123] Trial 54 finished with value: 0.2253120952113154 and parameters: {'model_type': 'gat', 'hidden_dims': '[512, 128]', 'dropout': 0.5010359259108949, 'batch_norm': True, 'gat_heads': 6, 'gat_attn_dropout': 0.5690132403315137, 'gat_concat_hidden': True, 'lr': 0.00015381147684477364, 'weight_decay': 0.0005977822982845987, 'epochs': 169, 'loss': 'mae', 'optimizer': 'adam', 'graph_mode': 'cutoff', 'cutoff': 0.5353761184344111, 'grm_norm': 'cosine_then_gcn', 'self_loops': False}. Best is trial 45 with value: 0.23570509446629018.
[I 2025-10-22 05:25:45,507] Trial 55 finished with value: 0.21207465160701489 and parameters: {'model_type': 'gat', 'hidden_dims': '[512, 128]', 'dropout': 0.22055604596079317, 'batch_norm': True, 'gat_heads': 6, 'gat_attn_dropout': 0.3166949427516578, 'gat_concat_hidden': True, 'lr': 0.00013303709220919348, 'weight_decay': 0.0003392322583980111, 'epochs': 169, 'loss': 'mae', 'optimizer': 'adam', 'graph_mode': 'cutoff', 'cutoff': 0.5220353922640568, 'grm_norm': 'cosine_then_gcn', 'self_loops': False}. Best is trial 45 with value: 0.23570509446629018.
[I 2025-10-22 05:31:43,007] Trial 56 finished with value: 0.20496714348401746 and parameters: {'model_type': 'gat', 'hidden_dims': '[512, 128]', 'dropout': 0.5717394896025042, 'batch_norm': True, 'gat_heads': 7, 'gat_attn_dropout': 0.5801063224889444, 'gat_concat_hidden': True, 'lr': 0.00015887037013632274, 'weight_decay': 0.0005422694561813032, 'epochs': 158, 'loss': 'mae', 'optimizer': 'adam', 'graph_mode': 'cutoff', 'cutoff': 0.48401692134842145, 'grm_norm': 'cosine_then_gcn', 'self_loops': False}. Best is trial 45 with value: 0.23570509446629018.
[I 2025-10-22 05:35:27,068] Trial 57 finished with value: 0.2296054887368913 and parameters: {'model_type': 'gat', 'hidden_dims': '[512, 128]', 'dropout': 0.4203844906807308, 'batch_norm': False, 'gat_heads': 5, 'gat_attn_dropout': 0.2110725962724153, 'gat_concat_hidden': True, 'lr': 0.000432605026917462, 'weight_decay': 3.1820469068206816e-06, 'epochs': 140, 'loss': 'mae', 'optimizer': 'adam', 'graph_mode': 'cutoff', 'cutoff': 0.8358774481435901, 'grm_norm': 'cosine_then_gcn', 'self_loops': False}. Best is trial 45 with value: 0.23570509446629018.
[I 2025-10-22 05:37:50,246] Trial 58 finished with value: 0.23318834060237698 and parameters: {'model_type': 'gat', 'hidden_dims': '[512, 128]', 'dropout': 0.40757186683487334, 'batch_norm': False, 'gat_heads': 4, 'gat_attn_dropout': 0.16074814606215593, 'gat_concat_hidden': True, 'lr': 0.0006133490477178665, 'weight_decay': 3.6375638286016032e-06, 'epochs': 109, 'loss': 'mae', 'optimizer': 'adam', 'graph_mode': 'cutoff', 'cutoff': 0.8439796699979438, 'grm_norm': 'cosine_then_gcn', 'self_loops': False}. Best is trial 45 with value: 0.23570509446629018.
[I 2025-10-22 05:39:13,352] Trial 59 finished with value: 0.2122122450440771 and parameters: {'model_type': 'gat', 'hidden_dims': '[512, 128]', 'dropout': 0.4169345262260933, 'batch_norm': False, 'gat_heads': 3, 'gat_attn_dropout': 0.17362830918023556, 'gat_concat_hidden': True, 'lr': 0.0005807335623575816, 'weight_decay': 2.997886219981681e-06, 'epochs': 82, 'loss': 'mae', 'optimizer': 'adam', 'graph_mode': 'cutoff', 'cutoff': 0.8440445575440934, 'grm_norm': 'cosine_then_gcn', 'self_loops': False}. Best is trial 45 with value: 0.23570509446629018.
[I 2025-10-22 05:41:34,520] Trial 60 finished with value: 0.010809285835199554 and parameters: {'model_type': 'gat', 'hidden_dims': '[512, 128]', 'dropout': 0.3529240881638269, 'batch_norm': False, 'gat_heads': 4, 'gat_attn_dropout': 0.13875355911644865, 'gat_concat_hidden': True, 'lr': 0.00042046311677809727, 'weight_decay': 2.009740471461027e-06, 'epochs': 107, 'loss': 'mse', 'optimizer': 'adam', 'graph_mode': 'cutoff', 'cutoff': 0.8627033135045267, 'grm_norm': 'cosine_then_gcn', 'self_loops': False}. Best is trial 45 with value: 0.23570509446629018.
[I 2025-10-22 05:44:10,608] Trial 61 finished with value: 0.22584259733298953 and parameters: {'model_type': 'gat', 'hidden_dims': '[512, 128]', 'dropout': 0.39019754092481973, 'batch_norm': False, 'gat_heads': 4, 'gat_attn_dropout': 0.08960582643388366, 'gat_concat_hidden': True, 'lr': 0.0006808109399926019, 'weight_decay': 4.42520341457162e-06, 'epochs': 120, 'loss': 'mae', 'optimizer': 'adam', 'graph_mode': 'cutoff', 'cutoff': 0.8295897202053844, 'grm_norm': 'cosine_then_gcn', 'self_loops': False}. Best is trial 45 with value: 0.23570509446629018.
[I 2025-10-22 05:45:42,938] Trial 62 finished with value: 0.030545837570543844 and parameters: {'model_type': 'gat', 'hidden_dims': '[512, 128]', 'dropout': 0.39365722076507464, 'batch_norm': False, 'gat_heads': 4, 'gat_attn_dropout': 0.05409564361574698, 'gat_concat_hidden': True, 'lr': 0.0006681810982110205, 'weight_decay': 4.709746931651573e-06, 'epochs': 65, 'loss': 'mae', 'optimizer': 'adam', 'graph_mode': 'cutoff', 'cutoff': 0.8965478579994242, 'grm_norm': 'cosine_then_gcn', 'self_loops': False}. Best is trial 45 with value: 0.23570509446629018.
[I 2025-10-22 05:46:44,990] Trial 63 finished with value: 0.12857620973745137 and parameters: {'model_type': 'gat', 'hidden_dims': '[512, 128]', 'dropout': 0.37079847361136786, 'batch_norm': False, 'gat_heads': 2, 'gat_attn_dropout': 0.10912289015275772, 'gat_concat_hidden': True, 'lr': 0.000749937320160826, 'weight_decay': 9.570423317815626e-07, 'epochs': 92, 'loss': 'mae', 'optimizer': 'adam', 'graph_mode': 'cutoff', 'cutoff': 0.7688806704920587, 'grm_norm': 'cosine_then_gcn', 'self_loops': False}. Best is trial 45 with value: 0.23570509446629018.
[I 2025-10-22 05:49:18,913] Trial 64 finished with value: 0.25109730294929067 and parameters: {'model_type': 'gat', 'hidden_dims': '[512, 128]', 'dropout': 0.4030474682981574, 'batch_norm': False, 'gat_heads': 4, 'gat_attn_dropout': 0.19953383596404534, 'gat_concat_hidden': True, 'lr': 0.0003668064324989718, 'weight_decay': 4.994497184845711e-06, 'epochs': 118, 'loss': 'mae', 'optimizer': 'adam', 'graph_mode': 'cutoff', 'cutoff': 0.8324935715341536, 'grm_norm': 'cosine_then_gcn', 'self_loops': False}. Best is trial 64 with value: 0.25109730294929067.
[I 2025-10-22 05:51:54,927] Trial 65 finished with value: 0.24655202976013385 and parameters: {'model_type': 'gat', 'hidden_dims': '[512, 128]', 'dropout': 0.4081039696487689, 'batch_norm': False, 'gat_heads': 4, 'gat_attn_dropout': 0.21124428015794908, 'gat_concat_hidden': True, 'lr': 0.00039946601009409414, 'weight_decay': 4.389171142110316e-06, 'epochs': 120, 'loss': 'mae', 'optimizer': 'adam', 'graph_mode': 'cutoff', 'cutoff': 0.8302124267090775, 'grm_norm': 'cosine_then_gcn', 'self_loops': False}. Best is trial 64 with value: 0.25109730294929067.
[I 2025-10-22 05:54:27,625] Trial 66 finished with value: 0.2470818873674038 and parameters: {'model_type': 'gat', 'hidden_dims': '[512, 128]', 'dropout': 0.4031369406331925, 'batch_norm': False, 'gat_heads': 4, 'gat_attn_dropout': 0.21618856810987977, 'gat_concat_hidden': True, 'lr': 0.00039635591720752844, 'weight_decay': 4.532452961759791e-06, 'epochs': 117, 'loss': 'mae', 'optimizer': 'adam', 'graph_mode': 'cutoff', 'cutoff': 0.8349258545715429, 'grm_norm': 'cosine_then_gcn', 'self_loops': False}. Best is trial 64 with value: 0.25109730294929067.
