[I 2025-11-13 13:25:36,876] Trial 9 finished with value: 0.2737553765751117 and parameters: {'model_type': 'graphsage', 'hidden_dims': '[512, 256]', 'dropout': 0.301734920240333, 'batch_norm': False, 'lr': 6.650961854953448e-06, 'weight_decay': 6.861575656590315e-05, 'epochs': 150, 'loss': 'mae', 'optimizer': 'adam', 'graph_mode': 'cutoff', 'cutoff': 0.2857569870061939, 'grm_norm': 'cosine_then_gcn', 'self_loops': False, 'use_snp_selection': True, 'num_snps': 12722}. Best is trial 9 with value: 0.2737553765751117.
[I 2025-11-13 13:26:41,182] Trial 10 finished with value: 0.2113064888776713 and parameters: {'model_type': 'graphsage', 'hidden_dims': '[512, 64]', 'dropout': 0.2549147281275221, 'batch_norm': False, 'lr': 2.3453406095863302e-06, 'weight_decay': 0.000250012967435051, 'epochs': 260, 'loss': 'mae', 'optimizer': 'adam', 'graph_mode': 'cutoff', 'cutoff': 0.22502730798645276, 'grm_norm': 'cosine_then_gcn', 'self_loops': True, 'use_snp_selection': True, 'num_snps': 3859}. Best is trial 9 with value: 0.2737553765751117.
[I 2025-11-13 13:28:42,064] Trial 11 finished with value: 0.21702928358662882 and parameters: {'model_type': 'graphsage', 'hidden_dims': '[512, 128]', 'dropout': 0.5993520479061458, 'batch_norm': True, 'lr': 8.807069823561703e-06, 'weight_decay': 1.0655358607693621e-07, 'epochs': 114, 'loss': 'mse', 'optimizer': 'adam', 'graph_mode': 'cutoff', 'cutoff': 0.2877982011630402, 'grm_norm': 'cosine', 'self_loops': True, 'use_snp_selection': False}. Best is trial 9 with value: 0.2737553765751117.
[I 2025-11-13 13:29:36,918] Trial 12 finished with value: 0.22216268528796884 and parameters: {'model_type': 'graphsage', 'hidden_dims': '[512, 128]', 'dropout': 0.2823860621087356, 'batch_norm': True, 'lr': 7.90274437063362e-06, 'weight_decay': 2.4223942502852527e-06, 'epochs': 117, 'loss': 'mae', 'optimizer': 'adam', 'graph_mode': 'cutoff', 'cutoff': 0.3930173877077592, 'grm_norm': 'cosine', 'self_loops': True, 'use_snp_selection': True, 'num_snps': 6176}. Best is trial 9 with value: 0.2737553765751117.
[I 2025-11-13 13:32:58,497] Trial 13 finished with value: 0.2576347939043636 and parameters: {'model_type': 'graphsage', 'hidden_dims': '[512, 128]', 'dropout': 0.4631491194976909, 'batch_norm': False, 'lr': 0.00011226062710438718, 'weight_decay': 0.0001341029631376562, 'epochs': 252, 'loss': 'mse', 'optimizer': 'adam', 'graph_mode': 'cutoff', 'cutoff': 0.4255627311797853, 'grm_norm': 'cosine_then_gcn', 'self_loops': False, 'use_snp_selection': False}. Best is trial 9 with value: 0.2737553765751117.
[I 2025-11-13 13:35:11,949] Trial 14 finished with value: 0.25267514723067763 and parameters: {'model_type': 'graphsage', 'hidden_dims': '[512, 256]', 'dropout': 0.31059632568416795, 'batch_norm': False, 'lr': 7.024454910645461e-06, 'weight_decay': 3.7692388178505354e-06, 'epochs': 151, 'loss': 'mse', 'optimizer': 'adam', 'graph_mode': 'cutoff', 'cutoff': 0.4144758651009211, 'grm_norm': 'cosine_then_gcn', 'self_loops': True, 'use_snp_selection': False}. Best is trial 9 with value: 0.2737553765751117.
[I 2025-11-13 13:36:16,635] Trial 15 finished with value: 0.12875948606874416 and parameters: {'model_type': 'graphsage', 'hidden_dims': '[512, 64]', 'dropout': 0.36758760077113106, 'batch_norm': True, 'lr': 1.1300392938059547e-06, 'weight_decay': 4.104169171058631e-07, 'epochs': 78, 'loss': 'mae', 'optimizer': 'adam', 'graph_mode': 'cutoff', 'cutoff': 0.8761100336741421, 'grm_norm': 'cosine', 'self_loops': True, 'use_snp_selection': True, 'num_snps': 17634}. Best is trial 9 with value: 0.2737553765751117.
[I 2025-11-13 13:37:31,586] Trial 16 finished with value: 0.1988904511122231 and parameters: {'model_type': 'graphsage', 'hidden_dims': '[256, 128, 64]', 'dropout': 0.2191985746433602, 'batch_norm': True, 'lr': 1.4096541097309903e-05, 'weight_decay': 7.43184304272184e-05, 'epochs': 102, 'loss': 'mae', 'optimizer': 'adam', 'graph_mode': 'cutoff', 'cutoff': 0.30943584937970026, 'grm_norm': 'none', 'self_loops': False, 'use_snp_selection': False}. Best is trial 9 with value: 0.2737553765751117.
[I 2025-11-13 13:44:38,308] Trial 17 finished with value: 0.2664986358893922 and parameters: {'model_type': 'graphsage', 'hidden_dims': '[512, 256]', 'dropout': 0.49287021542642234, 'batch_norm': False, 'lr': 3.866106682826752e-06, 'weight_decay': 5.094607380695369e-06, 'epochs': 154, 'loss': 'mse', 'optimizer': 'adam', 'graph_mode': 'cutoff', 'cutoff': 0.2023055894760914, 'grm_norm': 'cosine_then_gcn', 'self_loops': True, 'use_snp_selection': True, 'num_snps': 58012}. Best is trial 9 with value: 0.2737553765751117.
[I 2025-11-13 13:57:47,406] Trial 18 finished with value: 0.24429466964502594 and parameters: {'model_type': 'graphsage', 'hidden_dims': '[512, 256]', 'dropout': 0.45186844733341075, 'batch_norm': False, 'lr': 3.6625182414124624e-06, 'weight_decay': 0.00046653593955579554, 'epochs': 322, 'loss': 'mse', 'optimizer': 'adam', 'graph_mode': 'cutoff', 'cutoff': 0.2086784750121713, 'grm_norm': 'cosine_then_gcn', 'self_loops': False, 'use_snp_selection': True, 'num_snps': 58062}. Best is trial 9 with value: 0.2737553765751117.
[I 2025-11-13 14:01:47,529] Trial 19 finished with value: 0.30021150341023195 and parameters: {'model_type': 'graphsage', 'hidden_dims': '[512, 256]', 'dropout': 0.5723214760704808, 'batch_norm': False, 'lr': 4.2422289223037175e-06, 'weight_decay': 7.155673581155691e-06, 'epochs': 226, 'loss': 'mae', 'optimizer': 'adam', 'graph_mode': 'cutoff', 'cutoff': 0.5045367147810487, 'grm_norm': 'cosine_then_gcn', 'self_loops': False, 'use_snp_selection': True, 'num_snps': 59221}. Best is trial 19 with value: 0.30021150341023195.
[I 2025-11-13 14:03:17,642] Trial 20 finished with value: 0.24178747122470962 and parameters: {'model_type': 'graphsage', 'hidden_dims': '[512, 256]', 'dropout': 0.597871161320778, 'batch_norm': False, 'lr': 1.604558554825588e-05, 'weight_decay': 4.236322180026549e-05, 'epochs': 279, 'loss': 'mae', 'optimizer': 'adam', 'graph_mode': 'cutoff', 'cutoff': 0.5104708522619251, 'grm_norm': 'cosine_then_gcn', 'self_loops': False, 'use_snp_selection': True, 'num_snps': 13887}. Best is trial 19 with value: 0.30021150341023195.
[I 2025-11-13 14:13:00,711] Trial 21 finished with value: 0.27143419655667805 and parameters: {'model_type': 'graphsage', 'hidden_dims': '[512, 256]', 'dropout': 0.5450653768895379, 'batch_norm': False, 'lr': 4.1195138800466525e-06, 'weight_decay': 7.813532318841487e-06, 'epochs': 217, 'loss': 'mae', 'optimizer': 'adam', 'graph_mode': 'cutoff', 'cutoff': 0.20179276959125286, 'grm_norm': 'cosine_then_gcn', 'self_loops': False, 'use_snp_selection': True, 'num_snps': 59337}. Best is trial 19 with value: 0.30021150341023195.
[I 2025-11-13 14:16:00,016] Trial 22 finished with value: 0.2612740301082793 and parameters: {'model_type': 'graphsage', 'hidden_dims': '[512, 256]', 'dropout': 0.5537898204454332, 'batch_norm': False, 'lr': 4.285938473906988e-06, 'weight_decay': 6.7125001928372255e-06, 'epochs': 218, 'loss': 'mae', 'optimizer': 'adam', 'graph_mode': 'cutoff', 'cutoff': 0.5164027484107361, 'grm_norm': 'cosine_then_gcn', 'self_loops': False, 'use_snp_selection': True, 'num_snps': 47184}. Best is trial 19 with value: 0.30021150341023195.
[I 2025-11-13 14:21:44,410] Trial 23 finished with value: 0.27225167240868364 and parameters: {'model_type': 'graphsage', 'hidden_dims': '[512, 256]', 'dropout': 0.3181561059422362, 'batch_norm': False, 'lr': 1.6089607905080203e-06, 'weight_decay': 1.0967223967892848e-05, 'epochs': 234, 'loss': 'mae', 'optimizer': 'adam', 'graph_mode': 'cutoff', 'cutoff': 0.28172958929493397, 'grm_norm': 'cosine_then_gcn', 'self_loops': False, 'use_snp_selection': True, 'num_snps': 51986}. Best is trial 19 with value: 0.30021150341023195.
[I 2025-11-13 14:24:56,461] Trial 24 finished with value: 0.24407304135955066 and parameters: {'model_type': 'graphsage', 'hidden_dims': '[512, 256]', 'dropout': 0.30237417628677776, 'batch_norm': False, 'lr': 1.0358416982945375e-06, 'weight_decay': 0.00013957751402631714, 'epochs': 245, 'loss': 'mae', 'optimizer': 'adam', 'graph_mode': 'cutoff', 'cutoff': 0.5942663692440795, 'grm_norm': 'cosine_then_gcn', 'self_loops': False, 'use_snp_selection': True, 'num_snps': 50060}. Best is trial 19 with value: 0.30021150341023195.
[I 2025-11-13 14:28:34,221] Trial 25 finished with value: 0.24864796140075945 and parameters: {'model_type': 'graphsage', 'hidden_dims': '[512, 256]', 'dropout': 0.3350977509616037, 'batch_norm': False, 'lr': 1.7983351306884268e-06, 'weight_decay': 1.4523640422810352e-06, 'epochs': 285, 'loss': 'mae', 'optimizer': 'adam', 'graph_mode': 'cutoff', 'cutoff': 0.46405629857213865, 'grm_norm': 'cosine_then_gcn', 'self_loops': False, 'use_snp_selection': True, 'num_snps': 39046}. Best is trial 19 with value: 0.30021150341023195.
[I 2025-11-13 14:31:50,023] Trial 26 finished with value: 0.23882333990493687 and parameters: {'model_type': 'graphsage', 'hidden_dims': '[512, 256]', 'dropout': 0.24650698435754184, 'batch_norm': False, 'lr': 2.5348642705224112e-06, 'weight_decay': 1.2979787455534262e-05, 'epochs': 301, 'loss': 'mae', 'optimizer': 'adam', 'graph_mode': 'knn', 'source': 'grm', 'knn_k': 10, 'weighted_edges': False, 'symmetrize_mode': 'union', 'use_snp_selection': True, 'num_snps': 21547}. Best is trial 19 with value: 0.30021150341023195.
[I 2025-11-13 14:35:47,625] Trial 27 finished with value: 0.27414678128829006 and parameters: {'model_type': 'graphsage', 'hidden_dims': '[256, 128, 64]', 'dropout': 0.3813234875840291, 'batch_norm': False, 'lr': 5.799323691814563e-05, 'weight_decay': 3.3513600344862983e-05, 'epochs': 174, 'loss': 'mae', 'optimizer': 'adam', 'graph_mode': 'cutoff', 'cutoff': 0.29098167463133073, 'grm_norm': 'none', 'self_loops': False, 'use_snp_selection': True, 'num_snps': 52245}. Best is trial 19 with value: 0.30021150341023195.
[I 2025-11-13 14:37:55,241] Trial 28 finished with value: 0.28222629340848476 and parameters: {'model_type': 'graphsage', 'hidden_dims': '[256, 128, 64]', 'dropout': 0.3917195848251215, 'batch_norm': False, 'lr': 5.8466222209787875e-05, 'weight_decay': 3.9155081896795e-05, 'epochs': 175, 'loss': 'mae', 'optimizer': 'adam', 'graph_mode': 'cutoff', 'cutoff': 0.36412952523556535, 'grm_norm': 'none', 'self_loops': False, 'use_snp_selection': True, 'num_snps': 36182}. Best is trial 19 with value: 0.30021150341023195.
[I 2025-11-13 14:40:23,066] Trial 29 finished with value: 0.260265302468498 and parameters: {'model_type': 'graphsage', 'hidden_dims': '[256, 128, 64]', 'dropout': 0.41500451199053945, 'batch_norm': False, 'lr': 6.24567445766109e-05, 'weight_decay': 3.0910513980757966e-05, 'epochs': 182, 'loss': 'mae', 'optimizer': 'adam', 'graph_mode': 'knn', 'source': 'grm', 'knn_k': 4, 'weighted_edges': True, 'symmetrize_mode': 'union', 'use_snp_selection': True, 'num_snps': 37808}. Best is trial 19 with value: 0.30021150341023195.
[I 2025-11-13 14:43:45,281] Trial 30 finished with value: 0.2698884791581541 and parameters: {'model_type': 'graphsage', 'hidden_dims': '[256, 128, 64]', 'dropout': 0.3920046680640608, 'batch_norm': False, 'lr': 7.611805522057752e-05, 'weight_decay': 0.0001070155065049086, 'epochs': 200, 'loss': 'mae', 'optimizer': 'adam', 'graph_mode': 'cutoff', 'cutoff': 0.3843703096701701, 'grm_norm': 'none', 'self_loops': False, 'use_snp_selection': True, 'num_snps': 53683}. Best is trial 19 with value: 0.30021150341023195.
[I 2025-11-13 14:45:50,977] Trial 31 finished with value: 0.2786926476395041 and parameters: {'model_type': 'graphsage', 'hidden_dims': '[256, 128, 64]', 'dropout': 0.16721649992558796, 'batch_norm': False, 'lr': 1.960103849861632e-05, 'weight_decay': 5.033250542471398e-05, 'epochs': 164, 'loss': 'mae', 'optimizer': 'adam', 'graph_mode': 'cutoff', 'cutoff': 0.32553989460786487, 'grm_norm': 'none', 'self_loops': False, 'use_snp_selection': True, 'num_snps': 35641}. Best is trial 19 with value: 0.30021150341023195.
[I 2025-11-13 14:47:58,331] Trial 32 finished with value: 0.274001835376276 and parameters: {'model_type': 'graphsage', 'hidden_dims': '[256, 128, 64]', 'dropout': 0.1654951536136051, 'batch_norm': False, 'lr': 1.83858468635642e-05, 'weight_decay': 3.871513127676914e-05, 'epochs': 172, 'loss': 'mae', 'optimizer': 'adam', 'graph_mode': 'cutoff', 'cutoff': 0.3389070329949101, 'grm_norm': 'none', 'self_loops': False, 'use_snp_selection': True, 'num_snps': 35249}. Best is trial 19 with value: 0.30021150341023195.
[I 2025-11-13 14:49:54,909] Trial 33 finished with value: 0.2729089921134773 and parameters: {'model_type': 'graphsage', 'hidden_dims': '[256, 128, 64]', 'dropout': 0.3833540325880168, 'batch_norm': False, 'lr': 6.081406708222841e-05, 'weight_decay': 0.00021785112470887945, 'epochs': 212, 'loss': 'mae', 'optimizer': 'adam', 'graph_mode': 'cutoff', 'cutoff': 0.4454627601809379, 'grm_norm': 'none', 'self_loops': False, 'use_snp_selection': True, 'num_snps': 31460}. Best is trial 19 with value: 0.30021150341023195.
[I 2025-11-13 14:52:07,088] Trial 34 finished with value: 0.25227871593861606 and parameters: {'model_type': 'graphsage', 'hidden_dims': '[256, 128, 64]', 'dropout': 0.19658559703829262, 'batch_norm': False, 'lr': 0.00017533096098906625, 'weight_decay': 5.892913665117202e-05, 'epochs': 138, 'loss': 'mae', 'optimizer': 'adam', 'graph_mode': 'knn', 'source': 'grm', 'knn_k': 4, 'weighted_edges': False, 'symmetrize_mode': 'union', 'use_snp_selection': True, 'num_snps': 41025}. Best is trial 19 with value: 0.30021150341023195.
[I 2025-11-13 14:54:43,641] Trial 35 finished with value: 0.26619436958831705 and parameters: {'model_type': 'graphsage', 'hidden_dims': '[128, 64]', 'dropout': 0.4401204262732879, 'batch_norm': False, 'lr': 3.296521838852012e-05, 'weight_decay': 2.0332559536810654e-05, 'epochs': 173, 'loss': 'mae', 'optimizer': 'adam', 'graph_mode': 'cutoff', 'cutoff': 0.3647827673606248, 'grm_norm': 'none', 'self_loops': False, 'use_snp_selection': True, 'num_snps': 51986}. Best is trial 19 with value: 0.30021150341023195.
[I 2025-11-13 14:56:29,088] Trial 36 finished with value: 0.2891759837174426 and parameters: {'model_type': 'graphsage', 'hidden_dims': '[256, 128, 64]', 'dropout': 0.16142745868735, 'batch_norm': False, 'lr': 4.444757099509042e-05, 'weight_decay': 0.0004359283256572386, 'epochs': 200, 'loss': 'mae', 'optimizer': 'adam', 'graph_mode': 'cutoff', 'cutoff': 0.5011085731422729, 'grm_norm': 'none', 'self_loops': False, 'use_snp_selection': True, 'num_snps': 34124}. Best is trial 19 with value: 0.30021150341023195.
[I 2025-11-13 14:58:21,633] Trial 37 finished with value: 0.2593195940340499 and parameters: {'model_type': 'graphsage', 'hidden_dims': '[256, 128]', 'dropout': 0.17259876481652509, 'batch_norm': False, 'lr': 9.773519347311754e-05, 'weight_decay': 0.0007805500690024273, 'epochs': 135, 'loss': 'mae', 'optimizer': 'adam', 'graph_mode': 'knn', 'source': 'grm', 'knn_k': 10, 'weighted_edges': False, 'symmetrize_mode': 'union', 'use_snp_selection': True, 'num_snps': 24563}. Best is trial 19 with value: 0.30021150341023195.
[I 2025-11-13 15:00:01,813] Trial 38 finished with value: 0.27912537284681793 and parameters: {'model_type': 'graphsage', 'hidden_dims': '[256, 128, 64]', 'dropout': 0.13469369270300907, 'batch_norm': False, 'lr': 2.5991532841515935e-05, 'weight_decay': 0.0009706344823966005, 'epochs': 202, 'loss': 'mae', 'optimizer': 'adam', 'graph_mode': 'cutoff', 'cutoff': 0.49026661839236974, 'grm_norm': 'none', 'self_loops': False, 'use_snp_selection': True, 'num_snps': 28999}. Best is trial 19 with value: 0.30021150341023195.
[I 2025-11-13 15:01:29,146] Trial 39 finished with value: 0.2555431913692124 and parameters: {'model_type': 'graphsage', 'hidden_dims': '[256, 128, 64]', 'dropout': 0.13757549468583194, 'batch_norm': False, 'lr': 0.0009856797314608228, 'weight_decay': 0.000492863470873533, 'epochs': 196, 'loss': 'mae', 'optimizer': 'adam', 'graph_mode': 'cutoff', 'cutoff': 0.5859458516296658, 'grm_norm': 'gcn', 'self_loops': False, 'use_snp_selection': True, 'num_snps': 29909}. Best is trial 19 with value: 0.30021150341023195.
[I 2025-11-13 15:02:47,750] Trial 40 finished with value: 0.2580855294465726 and parameters: {'model_type': 'graphsage', 'hidden_dims': '[128, 64]', 'dropout': 0.10354389912427983, 'batch_norm': False, 'lr': 4.410472522399187e-05, 'weight_decay': 0.0009636670663050846, 'epochs': 206, 'loss': 'mae', 'optimizer': 'adam', 'graph_mode': 'knn', 'source': 'grm', 'knn_k': 3, 'weighted_edges': True, 'symmetrize_mode': 'mutual', 'use_snp_selection': True, 'num_snps': 26355}. Best is trial 19 with value: 0.30021150341023195.
[I 2025-11-13 15:04:51,251] Trial 41 finished with value: 0.2766554908383723 and parameters: {'model_type': 'graphsage', 'hidden_dims': '[256, 128, 64]', 'dropout': 0.16425258850229163, 'batch_norm': False, 'lr': 2.6169770592860517e-05, 'weight_decay': 0.000461298040905269, 'epochs': 236, 'loss': 'mae', 'optimizer': 'adam', 'graph_mode': 'cutoff', 'cutoff': 0.49434859895303096, 'grm_norm': 'none', 'self_loops': False, 'use_snp_selection': True, 'num_snps': 35030}. Best is trial 19 with value: 0.30021150341023195.
[I 2025-11-13 15:06:23,158] Trial 42 finished with value: 0.26466470661119984 and parameters: {'model_type': 'graphsage', 'hidden_dims': '[256, 128, 64]', 'dropout': 0.13015918584284336, 'batch_norm': False, 'lr': 2.2936159662828408e-05, 'weight_decay': 0.0002673566788604511, 'epochs': 185, 'loss': 'mae', 'optimizer': 'adam', 'graph_mode': 'cutoff', 'cutoff': 0.5596079022540493, 'grm_norm': 'none', 'self_loops': False, 'use_snp_selection': True, 'num_snps': 33288}. Best is trial 19 with value: 0.30021150341023195.
[I 2025-11-13 15:07:43,900] Trial 43 finished with value: 0.24580824068320947 and parameters: {'model_type': 'graphsage', 'hidden_dims': '[256, 128, 64]', 'dropout': 0.18726242688730704, 'batch_norm': False, 'lr': 1.159441977036158e-05, 'weight_decay': 0.0003071207306948294, 'epochs': 163, 'loss': 'mae', 'optimizer': 'adam', 'graph_mode': 'cutoff', 'cutoff': 0.6238206802519035, 'grm_norm': 'none', 'self_loops': False, 'use_snp_selection': True, 'num_snps': 29240}. Best is trial 19 with value: 0.30021150341023195.
[I 2025-11-13 15:08:59,275] Trial 44 finished with value: 0.24351128379742012 and parameters: {'model_type': 'graphsage', 'hidden_dims': '[256, 128]', 'dropout': 0.22314556232406835, 'batch_norm': False, 'lr': 0.00024183847153365972, 'weight_decay': 9.575953743314714e-05, 'epochs': 194, 'loss': 'mae', 'optimizer': 'adam', 'graph_mode': 'cutoff', 'cutoff': 0.6515892697105338, 'grm_norm': 'none', 'self_loops': False, 'use_snp_selection': True, 'num_snps': 23039}. Best is trial 19 with value: 0.30021150341023195.
[I 2025-11-13 15:12:26,227] Trial 45 finished with value: 0.27121083656171086 and parameters: {'model_type': 'graphsage', 'hidden_dims': '[512, 64]', 'dropout': 0.14106248046917538, 'batch_norm': False, 'lr': 4.186944950351205e-05, 'weight_decay': 0.00017363775002307582, 'epochs': 230, 'loss': 'mae', 'optimizer': 'adam', 'graph_mode': 'cutoff', 'cutoff': 0.4711335577954392, 'grm_norm': 'gcn', 'self_loops': False, 'use_snp_selection': True, 'num_snps': 43652}. Best is trial 19 with value: 0.30021150341023195.
[I 2025-11-13 15:14:19,294] Trial 46 finished with value: 0.25785092057443815 and parameters: {'model_type': 'graphsage', 'hidden_dims': '[256, 128, 64]', 'dropout': 0.26129152223099206, 'batch_norm': True, 'lr': 1.2422837637429864e-05, 'weight_decay': 1.7104663334599544e-05, 'epochs': 259, 'loss': 'mae', 'optimizer': 'adam', 'graph_mode': 'cutoff', 'cutoff': 0.5354357359974484, 'grm_norm': 'none', 'self_loops': False, 'use_snp_selection': False}. Best is trial 19 with value: 0.30021150341023195.
[I 2025-11-13 15:15:48,486] Trial 47 finished with value: 0.28286525703736504 and parameters: {'model_type': 'graphsage', 'hidden_dims': '[256, 128, 64]', 'dropout': 0.20941034377654189, 'batch_norm': False, 'lr': 2.185376712699811e-05, 'weight_decay': 0.0007259027571920441, 'epochs': 91, 'loss': 'mae', 'optimizer': 'adam', 'graph_mode': 'cutoff', 'cutoff': 0.4756714193856767, 'grm_norm': 'none', 'self_loops': False, 'use_snp_selection': True, 'num_snps': 37883}. Best is trial 19 with value: 0.30021150341023195.
[I 2025-11-13 15:16:25,165] Trial 48 finished with value: 0.22995259951540875 and parameters: {'model_type': 'graphsage', 'hidden_dims': '[256, 128, 64]', 'dropout': 0.21562198772700347, 'batch_norm': True, 'lr': 3.115643931537026e-05, 'weight_decay': 0.0005511205844051971, 'epochs': 61, 'loss': 'mse', 'optimizer': 'adam', 'graph_mode': 'cutoff', 'cutoff': 0.7219396374360219, 'grm_norm': 'none', 'self_loops': False, 'use_snp_selection': False}. Best is trial 19 with value: 0.30021150341023195.
[I 2025-11-13 15:17:33,973] Trial 49 finished with value: 0.2749645691392616 and parameters: {'model_type': 'graphsage', 'hidden_dims': '[128, 64]', 'dropout': 0.11877147398373805, 'batch_norm': False, 'lr': 0.0001442169601342552, 'weight_decay': 0.000801188937933368, 'epochs': 92, 'loss': 'mae', 'optimizer': 'adam', 'graph_mode': 'cutoff', 'cutoff': 0.4810452414096027, 'grm_norm': 'none', 'self_loops': False, 'use_snp_selection': True, 'num_snps': 28604}. Best is trial 19 with value: 0.30021150341023195.
[I 2025-11-13 15:19:08,193] Trial 50 finished with value: 0.18674278434122057 and parameters: {'model_type': 'graphsage', 'hidden_dims': '[512, 64]', 'dropout': 0.2738987445089666, 'batch_norm': False, 'lr': 0.00010414430010309531, 'weight_decay': 0.00031605285338759897, 'epochs': 52, 'loss': 'mae', 'optimizer': 'adam', 'graph_mode': 'cutoff', 'cutoff': 0.42953840082247285, 'grm_norm': 'gcn', 'self_loops': False, 'use_snp_selection': True, 'num_snps': 40726}. Best is trial 19 with value: 0.30021150341023195.
