[I 2025-11-03 12:19:05,437] Trial 140 finished with value: 0.10066188288186945 and parameters: {'model_type': 'gcn', 'hidden_dims': '[512, 64]', 'dropout': 0.23751728645460018, 'batch_norm': True, 'lr': 0.00012843084231684918, 'weight_decay': 1.4874504133821286e-07, 'epochs': 84, 'loss': 'mse', 'optimizer': 'adam', 'graph_mode': 'off', 'use_snp_selection': False}. Best is trial 139 with value: 0.15288717154233947.
[I 2025-11-03 12:19:06,631] Trial 141 finished with value: 0.10502024864784743 and parameters: {'model_type': 'gcn', 'hidden_dims': '[512, 64]', 'dropout': 0.20908617628356133, 'batch_norm': True, 'lr': 0.00019369017522062766, 'weight_decay': 1.2011887767470512e-07, 'epochs': 88, 'loss': 'mse', 'optimizer': 'adam', 'graph_mode': 'off', 'use_snp_selection': False}. Best is trial 139 with value: 0.15288717154233947.
[I 2025-11-03 12:19:07,751] Trial 142 finished with value: 0.119302679395179 and parameters: {'model_type': 'gcn', 'hidden_dims': '[512, 64]', 'dropout': 0.22548043745525198, 'batch_norm': True, 'lr': 0.00021453791580827833, 'weight_decay': 1.446241334617072e-07, 'epochs': 72, 'loss': 'mse', 'optimizer': 'adam', 'graph_mode': 'off', 'use_snp_selection': False}. Best is trial 139 with value: 0.15288717154233947.
[I 2025-11-03 12:19:09,117] Trial 143 finished with value: 0.127430438501966 and parameters: {'model_type': 'gcn', 'hidden_dims': '[512, 64]', 'dropout': 0.21662283345264155, 'batch_norm': True, 'lr': 0.00024329130325183843, 'weight_decay': 1.999352212429754e-07, 'epochs': 122, 'loss': 'mse', 'optimizer': 'adam', 'graph_mode': 'off', 'use_snp_selection': False}. Best is trial 139 with value: 0.15288717154233947.
[I 2025-11-03 12:19:10,267] Trial 144 finished with value: 0.12917819843417638 and parameters: {'model_type': 'gcn', 'hidden_dims': '[512, 64]', 'dropout': 0.20045618740184268, 'batch_norm': True, 'lr': 0.0009030969713615571, 'weight_decay': 1.7138441129574275e-07, 'epochs': 77, 'loss': 'mse', 'optimizer': 'adam', 'graph_mode': 'off', 'use_snp_selection': False}. Best is trial 139 with value: 0.15288717154233947.
[I 2025-11-03 12:19:11,345] Trial 145 finished with value: 0.13148443590508507 and parameters: {'model_type': 'gcn', 'hidden_dims': '[512, 64]', 'dropout': 0.24610768851022738, 'batch_norm': True, 'lr': 0.0003134856986285273, 'weight_decay': 2.2850313539340308e-07, 'epochs': 66, 'loss': 'mse', 'optimizer': 'adam', 'graph_mode': 'off', 'use_snp_selection': False}. Best is trial 139 with value: 0.15288717154233947.
[I 2025-11-03 12:19:12,609] Trial 146 finished with value: 0.11951526152947925 and parameters: {'model_type': 'gcn', 'hidden_dims': '[512, 64]', 'dropout': 0.2171614098685043, 'batch_norm': True, 'lr': 0.0007104180308042871, 'weight_decay': 1.297147412938766e-07, 'epochs': 99, 'loss': 'mse', 'optimizer': 'adam', 'graph_mode': 'off', 'use_snp_selection': False}. Best is trial 139 with value: 0.15288717154233947.
[I 2025-11-03 12:19:13,966] Trial 147 finished with value: 0.09512275990736681 and parameters: {'model_type': 'gcn', 'hidden_dims': '[512, 64]', 'dropout': 0.4172048625511232, 'batch_norm': True, 'lr': 0.00018258384121777355, 'weight_decay': 2.7365286547567103e-07, 'epochs': 109, 'loss': 'mse', 'optimizer': 'adam', 'graph_mode': 'off', 'use_snp_selection': True, 'num_snps': 28159}. Best is trial 139 with value: 0.15288717154233947.
[I 2025-11-03 12:19:15,142] Trial 148 finished with value: 0.045066624680883925 and parameters: {'model_type': 'gcn', 'hidden_dims': '[512, 64]', 'dropout': 0.19265559173620248, 'batch_norm': False, 'lr': 8.069927390363292e-06, 'weight_decay': 1.1224386374761198e-07, 'epochs': 88, 'loss': 'mse', 'optimizer': 'adam', 'graph_mode': 'off', 'use_snp_selection': False}. Best is trial 139 with value: 0.15288717154233947.
[I 2025-11-03 12:19:17,028] Trial 149 finished with value: 0.10218619269738972 and parameters: {'model_type': 'gcn', 'hidden_dims': '[512, 128]', 'dropout': 0.5401994396026173, 'batch_norm': True, 'lr': 0.0003884561442146628, 'weight_decay': 1.0376383257085211e-07, 'epochs': 238, 'loss': 'mae', 'optimizer': 'adam', 'graph_mode': 'off', 'use_snp_selection': False}. Best is trial 139 with value: 0.15288717154233947.
[I 2025-11-03 12:19:19,128] Trial 0 finished with value: 0.02170727213240056 and parameters: {'model_type': 'gcn', 'hidden_dims': '[128, 64]', 'dropout': 0.199031432379812, 'batch_norm': True, 'lr': 1.8408544111075837e-06, 'weight_decay': 5.5136510071208614e-05, 'epochs': 336, 'loss': 'mae', 'optimizer': 'adam', 'graph_mode': 'off', 'use_snp_selection': True, 'num_snps': 43862}. Best is trial 0 with value: 0.02170727213240056.
[I 2025-11-03 12:19:20,627] Trial 1 finished with value: 0.06787154714024196 and parameters: {'model_type': 'gcn', 'hidden_dims': '[256, 128]', 'dropout': 0.4370668075331726, 'batch_norm': True, 'lr': 7.133471581159139e-05, 'weight_decay': 1.128633586803549e-05, 'epochs': 242, 'loss': 'mae', 'optimizer': 'adam', 'graph_mode': 'off', 'use_snp_selection': False}. Best is trial 1 with value: 0.06787154714024196.
[I 2025-11-03 12:19:21,696] Trial 2 finished with value: 0.004877831700538475 and parameters: {'model_type': 'gcn', 'hidden_dims': '[256, 128, 64]', 'dropout': 0.41314357415569625, 'batch_norm': False, 'lr': 3.952233718592101e-06, 'weight_decay': 0.00026754769258252603, 'epochs': 149, 'loss': 'mse', 'optimizer': 'adam', 'graph_mode': 'off', 'use_snp_selection': True, 'num_snps': 11571}. Best is trial 1 with value: 0.06787154714024196.
[I 2025-11-03 12:19:24,009] Trial 3 finished with value: 0.040042240311614734 and parameters: {'model_type': 'gcn', 'hidden_dims': '[512, 64]', 'dropout': 0.5938127374509361, 'batch_norm': False, 'lr': 5.67704586114731e-06, 'weight_decay': 2.4518087630137052e-05, 'epochs': 320, 'loss': 'mae', 'optimizer': 'adam', 'graph_mode': 'off', 'use_snp_selection': False}. Best is trial 1 with value: 0.06787154714024196.
[I 2025-11-03 12:19:26,226] Trial 4 finished with value: 0.04677198133616248 and parameters: {'model_type': 'gcn', 'hidden_dims': '[512, 128]', 'dropout': 0.25746343592134413, 'batch_norm': True, 'lr': 1.3467657668402788e-06, 'weight_decay': 0.00033087251918647806, 'epochs': 277, 'loss': 'mse', 'optimizer': 'adam', 'graph_mode': 'off', 'use_snp_selection': True, 'num_snps': 36675}. Best is trial 1 with value: 0.06787154714024196.
[I 2025-11-03 12:19:27,819] Trial 5 finished with value: 0.02804254828051876 and parameters: {'model_type': 'gcn', 'hidden_dims': '[512, 64]', 'dropout': 0.38275350994408375, 'batch_norm': True, 'lr': 1.5586664309232824e-06, 'weight_decay': 0.0008227664668621182, 'epochs': 145, 'loss': 'mae', 'optimizer': 'adam', 'graph_mode': 'off', 'use_snp_selection': True, 'num_snps': 32148}. Best is trial 1 with value: 0.06787154714024196.
[I 2025-11-03 12:19:29,044] Trial 6 finished with value: 0.048416151485480265 and parameters: {'model_type': 'gcn', 'hidden_dims': '[256, 128]', 'dropout': 0.3930109900265879, 'batch_norm': False, 'lr': 4.892964372128395e-05, 'weight_decay': 1.5809549317992182e-06, 'epochs': 199, 'loss': 'mse', 'optimizer': 'adam', 'graph_mode': 'off', 'use_snp_selection': False}. Best is trial 1 with value: 0.06787154714024196.
[I 2025-11-03 12:19:30,327] Trial 7 finished with value: 0.058983402433730965 and parameters: {'model_type': 'gcn', 'hidden_dims': '[512, 256]', 'dropout': 0.15343979219678458, 'batch_norm': True, 'lr': 6.234003099047341e-05, 'weight_decay': 3.894760610535477e-07, 'epochs': 97, 'loss': 'mse', 'optimizer': 'adam', 'graph_mode': 'off', 'use_snp_selection': False}. Best is trial 1 with value: 0.06787154714024196.
[I 2025-11-03 12:19:32,655] Trial 8 finished with value: 0.07523851240317726 and parameters: {'model_type': 'gcn', 'hidden_dims': '[512, 128]', 'dropout': 0.10743001231661406, 'batch_norm': True, 'lr': 0.00023728538449271062, 'weight_decay': 1.7629071578048637e-05, 'epochs': 312, 'loss': 'mae', 'optimizer': 'adam', 'graph_mode': 'off', 'use_snp_selection': False}. Best is trial 8 with value: 0.07523851240317726.
[I 2025-11-03 12:19:34,295] Trial 9 finished with value: 0.06965454833807067 and parameters: {'model_type': 'gcn', 'hidden_dims': '[512, 64]', 'dropout': 0.14505336736221927, 'batch_norm': True, 'lr': 5.8619638388111826e-05, 'weight_decay': 6.200156172669308e-07, 'epochs': 175, 'loss': 'mse', 'optimizer': 'adam', 'graph_mode': 'off', 'use_snp_selection': False}. Best is trial 8 with value: 0.07523851240317726.
[I 2025-11-03 12:19:35,326] Trial 10 finished with value: -0.005638563266280335 and parameters: {'model_type': 'gcn', 'hidden_dims': '[512, 128]', 'dropout': 0.2800030442581858, 'batch_norm': False, 'lr': 0.0004919806695968257, 'weight_decay': 2.9953888095455486e-06, 'epochs': 55, 'loss': 'mae', 'optimizer': 'adam', 'graph_mode': 'off', 'use_snp_selection': False}. Best is trial 8 with value: 0.07523851240317726.
[I 2025-11-03 12:19:37,173] Trial 11 finished with value: 0.06869275251280291 and parameters: {'model_type': 'gcn', 'hidden_dims': '[512, 128]', 'dropout': 0.10095648685224448, 'batch_norm': True, 'lr': 0.0003411435764085616, 'weight_decay': 1.2045055692919657e-07, 'epochs': 216, 'loss': 'mse', 'optimizer': 'adam', 'graph_mode': 'off', 'use_snp_selection': False}. Best is trial 8 with value: 0.07523851240317726.
[I 2025-11-03 12:19:39,357] Trial 12 finished with value: 0.07375097101109764 and parameters: {'model_type': 'gcn', 'hidden_dims': '[512, 64]', 'dropout': 0.10344600881777158, 'batch_norm': True, 'lr': 0.00018400807026440393, 'weight_decay': 2.071258764988014e-06, 'epochs': 281, 'loss': 'mae', 'optimizer': 'adam', 'graph_mode': 'off', 'use_snp_selection': False}. Best is trial 8 with value: 0.07523851240317726.
[I 2025-11-03 12:19:40,616] Trial 13 finished with value: 0.08432955462108803 and parameters: {'model_type': 'gcn', 'hidden_dims': '[128, 64]', 'dropout': 0.2429461314891602, 'batch_norm': True, 'lr': 0.00020209017454184854, 'weight_decay': 4.439089487662091e-06, 'epochs': 285, 'loss': 'mae', 'optimizer': 'adam', 'graph_mode': 'off', 'use_snp_selection': False}. Best is trial 13 with value: 0.08432955462108803.
[I 2025-11-03 12:19:41,884] Trial 14 finished with value: 0.08041752757718067 and parameters: {'model_type': 'gcn', 'hidden_dims': '[128, 64]', 'dropout': 0.28397504683850705, 'batch_norm': True, 'lr': 0.0008504623530923608, 'weight_decay': 5.724103314313124e-05, 'epochs': 284, 'loss': 'mae', 'optimizer': 'adam', 'graph_mode': 'off', 'use_snp_selection': False}. Best is trial 13 with value: 0.08432955462108803.
[I 2025-11-03 12:19:43,171] Trial 15 finished with value: 0.0881143438101052 and parameters: {'model_type': 'gcn', 'hidden_dims': '[128, 64]', 'dropout': 0.31126623674851783, 'batch_norm': True, 'lr': 0.0007702526848444923, 'weight_decay': 7.886437726517413e-05, 'epochs': 263, 'loss': 'mae', 'optimizer': 'adam', 'graph_mode': 'off', 'use_snp_selection': False}. Best is trial 15 with value: 0.0881143438101052.
[I 2025-11-03 12:19:44,327] Trial 16 finished with value: 0.028012531748228462 and parameters: {'model_type': 'gcn', 'hidden_dims': '[128, 64]', 'dropout': 0.3266927922489094, 'batch_norm': True, 'lr': 1.2586985041154999e-05, 'weight_decay': 5.098763140321504e-06, 'epochs': 240, 'loss': 'mae', 'optimizer': 'adam', 'graph_mode': 'off', 'use_snp_selection': False}. Best is trial 15 with value: 0.0881143438101052.
[I 2025-11-03 12:19:45,766] Trial 17 finished with value: 0.08695108939426954 and parameters: {'model_type': 'gcn', 'hidden_dims': '[128, 64]', 'dropout': 0.48044412924673, 'batch_norm': True, 'lr': 0.000906375209920231, 'weight_decay': 9.63295931224254e-05, 'epochs': 349, 'loss': 'mae', 'optimizer': 'adam', 'graph_mode': 'off', 'use_snp_selection': False}. Best is trial 15 with value: 0.0881143438101052.
[I 2025-11-03 12:19:48,073] Trial 18 finished with value: 0.016385974689697366 and parameters: {'model_type': 'gcn', 'hidden_dims': '[128, 64]', 'dropout': 0.49272772146451266, 'batch_norm': False, 'lr': 0.0009914156507389736, 'weight_decay': 0.00010998658747879167, 'epochs': 343, 'loss': 'mae', 'optimizer': 'adam', 'graph_mode': 'off', 'use_snp_selection': True, 'num_snps': 58241}. Best is trial 15 with value: 0.0881143438101052.
[I 2025-11-03 12:19:50,063] Trial 19 finished with value: 0.03755874069383381 and parameters: {'model_type': 'gcn', 'hidden_dims': '[512, 256]', 'dropout': 0.5104871165727531, 'batch_norm': True, 'lr': 2.1350649005452523e-05, 'weight_decay': 0.00015775370697541577, 'epochs': 237, 'loss': 'mae', 'optimizer': 'adam', 'graph_mode': 'off', 'use_snp_selection': False}. Best is trial 15 with value: 0.0881143438101052.
[I 2025-11-03 12:19:51,936] Trial 20 finished with value: 0.058068854830085934 and parameters: {'model_type': 'gcn', 'hidden_dims': '[256, 128, 64]', 'dropout': 0.47902055051902853, 'batch_norm': True, 'lr': 0.00013020642192474667, 'weight_decay': 0.0005544982651878568, 'epochs': 301, 'loss': 'mae', 'optimizer': 'adam', 'graph_mode': 'off', 'use_snp_selection': False}. Best is trial 15 with value: 0.0881143438101052.
[I 2025-11-03 12:19:53,134] Trial 21 finished with value: 0.07532314214547671 and parameters: {'model_type': 'gcn', 'hidden_dims': '[128, 64]', 'dropout': 0.3316000179941726, 'batch_norm': True, 'lr': 0.0005125138049138867, 'weight_decay': 4.297056457959928e-05, 'epochs': 261, 'loss': 'mae', 'optimizer': 'adam', 'graph_mode': 'off', 'use_snp_selection': False}. Best is trial 15 with value: 0.0881143438101052.
[I 2025-11-03 12:19:54,550] Trial 22 finished with value: 0.08211146194748115 and parameters: {'model_type': 'gcn', 'hidden_dims': '[128, 64]', 'dropout': 0.23401318790425069, 'batch_norm': True, 'lr': 0.0005031173875560907, 'weight_decay': 7.136393224958231e-06, 'epochs': 342, 'loss': 'mae', 'optimizer': 'adam', 'graph_mode': 'off', 'use_snp_selection': False}. Best is trial 15 with value: 0.0881143438101052.
[I 2025-11-03 12:19:55,930] Trial 23 finished with value: 0.08622020939145217 and parameters: {'model_type': 'gcn', 'hidden_dims': '[128, 64]', 'dropout': 0.5968415406439916, 'batch_norm': True, 'lr': 0.0001172431332472623, 'weight_decay': 0.00010566170440963901, 'epochs': 304, 'loss': 'mae', 'optimizer': 'adam', 'graph_mode': 'off', 'use_snp_selection': False}. Best is trial 15 with value: 0.0881143438101052.
[I 2025-11-03 12:19:57,305] Trial 24 finished with value: 0.05257988546921771 and parameters: {'model_type': 'gcn', 'hidden_dims': '[128, 64]', 'dropout': 0.5804152108523322, 'batch_norm': True, 'lr': 0.00012933696064794652, 'weight_decay': 0.00010897195333243873, 'epochs': 311, 'loss': 'mae', 'optimizer': 'adam', 'graph_mode': 'off', 'use_snp_selection': False}. Best is trial 15 with value: 0.0881143438101052.
[I 2025-11-03 12:19:58,743] Trial 25 finished with value: 0.07769204864901816 and parameters: {'model_type': 'gcn', 'hidden_dims': '[128, 64]', 'dropout': 0.5468587037264471, 'batch_norm': True, 'lr': 0.0009622534216504965, 'weight_decay': 2.803756756762017e-05, 'epochs': 349, 'loss': 'mae', 'optimizer': 'adam', 'graph_mode': 'off', 'use_snp_selection': False}. Best is trial 15 with value: 0.0881143438101052.
[I 2025-11-03 12:19:59,763] Trial 26 finished with value: 0.050522691695613416 and parameters: {'model_type': 'gcn', 'hidden_dims': '[128, 64]', 'dropout': 0.5289327224345439, 'batch_norm': False, 'lr': 0.0003380421026673381, 'weight_decay': 0.00022123062859658268, 'epochs': 261, 'loss': 'mae', 'optimizer': 'adam', 'graph_mode': 'off', 'use_snp_selection': True, 'num_snps': 3842}. Best is trial 15 with value: 0.0881143438101052.
[I 2025-11-03 12:20:01,139] Trial 27 finished with value: 0.07402479752150518 and parameters: {'model_type': 'gcn', 'hidden_dims': '[128, 64]', 'dropout': 0.45576048238560835, 'batch_norm': True, 'lr': 0.00010175430906399701, 'weight_decay': 8.411503092769373e-05, 'epochs': 316, 'loss': 'mae', 'optimizer': 'adam', 'graph_mode': 'off', 'use_snp_selection': False}. Best is trial 15 with value: 0.0881143438101052.
[I 2025-11-03 12:20:03,423] Trial 28 finished with value: 0.053587260606221515 and parameters: {'model_type': 'gcn', 'hidden_dims': '[512, 256]', 'dropout': 0.5640236245548716, 'batch_norm': True, 'lr': 1.927978072220865e-05, 'weight_decay': 0.0004000280208811854, 'epochs': 298, 'loss': 'mae', 'optimizer': 'adam', 'graph_mode': 'off', 'use_snp_selection': False}. Best is trial 15 with value: 0.0881143438101052.
[I 2025-11-03 12:20:04,960] Trial 29 finished with value: 0.08402414283090719 and parameters: {'model_type': 'gcn', 'hidden_dims': '[128, 64]', 'dropout': 0.3609440405632093, 'batch_norm': True, 'lr': 0.0006210089281813499, 'weight_decay': 5.3975138759432314e-05, 'epochs': 329, 'loss': 'mae', 'optimizer': 'adam', 'graph_mode': 'off', 'use_snp_selection': True, 'num_snps': 19468}. Best is trial 15 with value: 0.0881143438101052.
[I 2025-11-03 12:20:06,670] Trial 30 finished with value: 0.05928052988198593 and parameters: {'model_type': 'gcn', 'hidden_dims': '[256, 128, 64]', 'dropout': 0.4531387291956453, 'batch_norm': True, 'lr': 0.0002816941364568497, 'weight_decay': 1.6711992450353462e-05, 'epochs': 261, 'loss': 'mae', 'optimizer': 'adam', 'graph_mode': 'off', 'use_snp_selection': False}. Best is trial 15 with value: 0.0881143438101052.
[I 2025-11-03 12:20:07,932] Trial 31 finished with value: 0.069421571122888 and parameters: {'model_type': 'gcn', 'hidden_dims': '[128, 64]', 'dropout': 0.21104068371056398, 'batch_norm': True, 'lr': 0.00019919672879291166, 'weight_decay': 3.281553190978736e-05, 'epochs': 285, 'loss': 'mae', 'optimizer': 'adam', 'graph_mode': 'off', 'use_snp_selection': False}. Best is trial 15 with value: 0.0881143438101052.
[I 2025-11-03 12:20:09,383] Trial 32 finished with value: 0.04704837012892714 and parameters: {'model_type': 'gcn', 'hidden_dims': '[256, 128]', 'dropout': 0.31604739953196276, 'batch_norm': True, 'lr': 3.6717700131613534e-05, 'weight_decay': 1.0220689245669501e-05, 'epochs': 220, 'loss': 'mae', 'optimizer': 'adam', 'graph_mode': 'off', 'use_snp_selection': False}. Best is trial 15 with value: 0.0881143438101052.
[I 2025-11-03 12:20:10,775] Trial 33 finished with value: 0.05618732569356593 and parameters: {'model_type': 'gcn', 'hidden_dims': '[128, 64]', 'dropout': 0.19198476340906395, 'batch_norm': True, 'lr': 9.300135938571817e-05, 'weight_decay': 0.0001822947810718667, 'epochs': 332, 'loss': 'mae', 'optimizer': 'adam', 'graph_mode': 'off', 'use_snp_selection': False}. Best is trial 15 with value: 0.0881143438101052.
[I 2025-11-03 12:20:12,097] Trial 34 finished with value: 0.06489755006173901 and parameters: {'model_type': 'gcn', 'hidden_dims': '[128, 64]', 'dropout': 0.42758399285182574, 'batch_norm': True, 'lr': 0.0006469738593339693, 'weight_decay': 8.750273341346809e-05, 'epochs': 299, 'loss': 'mae', 'optimizer': 'adam', 'graph_mode': 'off', 'use_snp_selection': False}. Best is trial 15 with value: 0.0881143438101052.
[I 2025-11-03 12:20:13,272] Trial 35 finished with value: 0.0030537415842560004 and parameters: {'model_type': 'gcn', 'hidden_dims': '[128, 64]', 'dropout': 0.2976323086628677, 'batch_norm': False, 'lr': 0.0003731869162380714, 'weight_decay': 4.565204135802274e-06, 'epochs': 255, 'loss': 'mae', 'optimizer': 'adam', 'graph_mode': 'off', 'use_snp_selection': False}. Best is trial 15 with value: 0.0881143438101052.
[I 2025-11-03 12:20:15,845] Trial 36 finished with value: 0.03958356646192473 and parameters: {'model_type': 'gcn', 'hidden_dims': '[256, 128]', 'dropout': 0.3555281033462293, 'batch_norm': True, 'lr': 0.00015937223723937115, 'weight_decay': 9.904908356402637e-07, 'epochs': 319, 'loss': 'mse', 'optimizer': 'adam', 'graph_mode': 'off', 'use_snp_selection': True, 'num_snps': 58661}. Best is trial 15 with value: 0.0881143438101052.
[I 2025-11-03 12:20:17,213] Trial 37 finished with value: 0.01291420593322403 and parameters: {'model_type': 'gcn', 'hidden_dims': '[256, 128, 64]', 'dropout': 0.24313524487717053, 'batch_norm': True, 'lr': 4.446294938689988e-06, 'weight_decay': 0.0008708344582962457, 'epochs': 174, 'loss': 'mae', 'optimizer': 'adam', 'graph_mode': 'off', 'use_snp_selection': False}. Best is trial 15 with value: 0.0881143438101052.
[I 2025-11-03 12:20:18,595] Trial 38 finished with value: 0.017026281320000617 and parameters: {'model_type': 'gcn', 'hidden_dims': '[128, 64]', 'dropout': 0.39619742159975696, 'batch_norm': False, 'lr': 9.033460451739279e-05, 'weight_decay': 1.531933439074874e-05, 'epochs': 293, 'loss': 'mse', 'optimizer': 'adam', 'graph_mode': 'off', 'use_snp_selection': True, 'num_snps': 19911}. Best is trial 15 with value: 0.0881143438101052.
[I 2025-11-03 12:20:19,717] Trial 39 finished with value: 0.0586212957827193 and parameters: {'model_type': 'gcn', 'hidden_dims': '[128, 64]', 'dropout': 0.5995295762254071, 'batch_norm': True, 'lr': 0.00024606663753099314, 'weight_decay': 0.0003510562062860189, 'epochs': 223, 'loss': 'mae', 'optimizer': 'adam', 'graph_mode': 'off', 'use_snp_selection': False}. Best is trial 15 with value: 0.0881143438101052.
[I 2025-11-03 12:20:21,843] Trial 40 finished with value: 0.08137952673430422 and parameters: {'model_type': 'gcn', 'hidden_dims': '[512, 256]', 'dropout': 0.2676576621123345, 'batch_norm': True, 'lr': 0.0006912610113251641, 'weight_decay': 0.00014903340125699323, 'epochs': 268, 'loss': 'mae', 'optimizer': 'adam', 'graph_mode': 'off', 'use_snp_selection': False}. Best is trial 15 with value: 0.0881143438101052.
[I 2025-11-03 12:20:23,459] Trial 41 finished with value: 0.08779193300435444 and parameters: {'model_type': 'gcn', 'hidden_dims': '[128, 64]', 'dropout': 0.3716081310069049, 'batch_norm': True, 'lr': 0.0006305322605307922, 'weight_decay': 5.965525147036067e-05, 'epochs': 332, 'loss': 'mae', 'optimizer': 'adam', 'graph_mode': 'off', 'use_snp_selection': True, 'num_snps': 22247}. Best is trial 15 with value: 0.0881143438101052.
