[I 2025-11-03 12:58:39,545] Trial 22 finished with value: 0.03399176216636902 and parameters: {'model_type': 'gcn', 'hidden_dims': '[512, 128]', 'dropout': 0.4680203294276966, 'batch_norm': True, 'lr': 0.0001773355929056985, 'weight_decay': 5.352084163880244e-07, 'epochs': 64, 'loss': 'mse', 'optimizer': 'adam', 'graph_mode': 'cutoff', 'cutoff': 0.4763641492970435, 'grm_norm': 'cosine', 'self_loops': True, 'use_snp_selection': False}. Best is trial 10 with value: 0.06851731265986186.
[I 2025-11-03 12:58:41,409] Trial 23 finished with value: 0.037978842478128286 and parameters: {'model_type': 'gcn', 'hidden_dims': '[512, 128]', 'dropout': 0.4567384828816058, 'batch_norm': True, 'lr': 0.00038666998480656455, 'weight_decay': 1.4072716494446519e-06, 'epochs': 92, 'loss': 'mse', 'optimizer': 'adam', 'graph_mode': 'cutoff', 'cutoff': 0.31127892082908626, 'grm_norm': 'cosine', 'self_loops': True, 'use_snp_selection': False}. Best is trial 10 with value: 0.06851731265986186.
[I 2025-11-03 12:58:42,953] Trial 24 finished with value: 0.04626420621414137 and parameters: {'model_type': 'gcn', 'hidden_dims': '[512, 128]', 'dropout': 0.39095887899890946, 'batch_norm': True, 'lr': 0.0009012652793310604, 'weight_decay': 2.4595778185078066e-07, 'epochs': 41, 'loss': 'mse', 'optimizer': 'adam', 'graph_mode': 'cutoff', 'cutoff': 0.43769740153451203, 'grm_norm': 'none', 'self_loops': True, 'use_snp_selection': False}. Best is trial 10 with value: 0.06851731265986186.
[I 2025-11-03 12:58:44,340] Trial 25 finished with value: 0.03415847344377418 and parameters: {'model_type': 'gcn', 'hidden_dims': '[512, 128]', 'dropout': 0.504054936725784, 'batch_norm': True, 'lr': 6.584944232798644e-05, 'weight_decay': 8.569961145673734e-07, 'epochs': 9, 'loss': 'mse', 'optimizer': 'adam', 'graph_mode': 'cutoff', 'cutoff': 0.29909030054976016, 'grm_norm': 'cosine_then_gcn', 'self_loops': True, 'use_snp_selection': False}. Best is trial 10 with value: 0.06851731265986186.
[I 2025-11-03 12:58:48,301] Trial 26 finished with value: -0.009333127483163275 and parameters: {'model_type': 'gcn', 'hidden_dims': '[512, 64]', 'dropout': 0.557167410006341, 'batch_norm': False, 'lr': 0.00044271668835814767, 'weight_decay': 3.6287981794017153e-07, 'epochs': 142, 'loss': 'mae', 'optimizer': 'adam', 'graph_mode': 'knn', 'source': 'grm', 'knn_k': 10, 'weighted_edges': False, 'symmetrize_mode': 'union', 'use_snp_selection': True, 'num_snps': 59005}. Best is trial 10 with value: 0.06851731265986186.
[I 2025-11-03 12:58:49,859] Trial 27 finished with value: 0.01635313388483077 and parameters: {'model_type': 'gcn', 'hidden_dims': '[256, 128]', 'dropout': 0.30719226013549417, 'batch_norm': True, 'lr': 1.9937354098458108e-05, 'weight_decay': 1.0493337042177009e-07, 'epochs': 107, 'loss': 'mse', 'optimizer': 'adam', 'graph_mode': 'cutoff', 'cutoff': 0.5609225778947537, 'grm_norm': 'gcn', 'self_loops': True, 'use_snp_selection': False}. Best is trial 10 with value: 0.06851731265986186.
[I 2025-11-03 12:58:51,894] Trial 28 finished with value: 0.02573231770094146 and parameters: {'model_type': 'gcn', 'hidden_dims': '[256, 128, 64]', 'dropout': 0.5995293644199655, 'batch_norm': True, 'lr': 0.0001828474181549684, 'weight_decay': 2.5923242666579103e-06, 'epochs': 187, 'loss': 'mse', 'optimizer': 'adam', 'graph_mode': 'cutoff', 'cutoff': 0.20351799713310584, 'grm_norm': 'cosine', 'self_loops': False, 'use_snp_selection': False}. Best is trial 10 with value: 0.06851731265986186.
[I 2025-11-03 12:58:53,155] Trial 29 finished with value: 0.0909837172005828 and parameters: {'model_type': 'gcn', 'hidden_dims': '[128, 64]', 'dropout': 0.22487044772394038, 'batch_norm': True, 'lr': 0.0003161066372303536, 'weight_decay': 7.237766307139736e-06, 'epochs': 68, 'loss': 'mae', 'optimizer': 'adam', 'graph_mode': 'knn', 'source': 'grm', 'knn_k': 5, 'weighted_edges': False, 'symmetrize_mode': 'union', 'use_snp_selection': False}. Best is trial 29 with value: 0.0909837172005828.
[I 2025-11-03 12:58:54,970] Trial 30 finished with value: 0.0012414711161479576 and parameters: {'model_type': 'gcn', 'hidden_dims': '[128, 64]', 'dropout': 0.21870368123902434, 'batch_norm': True, 'lr': 1.2963802273643008e-06, 'weight_decay': 4.2090463802883576e-05, 'epochs': 245, 'loss': 'mae', 'optimizer': 'adam', 'graph_mode': 'knn', 'source': 'grm', 'knn_k': 4, 'weighted_edges': False, 'symmetrize_mode': 'union', 'use_snp_selection': False}. Best is trial 29 with value: 0.0909837172005828.
[I 2025-11-03 12:58:56,183] Trial 31 finished with value: 0.019229694127730845 and parameters: {'model_type': 'gcn', 'hidden_dims': '[128, 64]', 'dropout': 0.21700589628212, 'batch_norm': True, 'lr': 0.0003210033421881766, 'weight_decay': 7.1596880971865045e-06, 'epochs': 59, 'loss': 'mae', 'optimizer': 'adam', 'graph_mode': 'knn', 'source': 'grm', 'knn_k': 4, 'weighted_edges': False, 'symmetrize_mode': 'union', 'use_snp_selection': False}. Best is trial 29 with value: 0.0909837172005828.
[I 2025-11-03 12:58:58,300] Trial 32 finished with value: 0.02430042121549013 and parameters: {'model_type': 'gcn', 'hidden_dims': '[128, 64]', 'dropout': 0.2676936224751063, 'batch_norm': True, 'lr': 0.0005901224803799996, 'weight_decay': 8.590889908397387e-06, 'epochs': 343, 'loss': 'mae', 'optimizer': 'adam', 'graph_mode': 'knn', 'source': 'grm', 'knn_k': 4, 'weighted_edges': False, 'symmetrize_mode': 'union', 'use_snp_selection': False}. Best is trial 29 with value: 0.0909837172005828.
[I 2025-11-03 12:58:59,468] Trial 33 finished with value: 0.022821166650433163 and parameters: {'model_type': 'gcn', 'hidden_dims': '[128, 64]', 'dropout': 0.17093816551235222, 'batch_norm': True, 'lr': 0.0006118625204125957, 'weight_decay': 0.00010040081007592979, 'epochs': 32, 'loss': 'mae', 'optimizer': 'adam', 'graph_mode': 'knn', 'source': 'grm', 'knn_k': 9, 'weighted_edges': True, 'symmetrize_mode': 'union', 'use_snp_selection': False}. Best is trial 29 with value: 0.0909837172005828.
[I 2025-11-03 12:59:01,298] Trial 34 finished with value: 0.017528842844985102 and parameters: {'model_type': 'gcn', 'hidden_dims': '[512, 128]', 'dropout': 0.5294180836569512, 'batch_norm': True, 'lr': 9.550920050432265e-05, 'weight_decay': 2.2775015896099297e-06, 'epochs': 75, 'loss': 'mae', 'optimizer': 'adam', 'graph_mode': 'knn', 'source': 'grm', 'knn_k': 3, 'weighted_edges': False, 'symmetrize_mode': 'union', 'use_snp_selection': False}. Best is trial 29 with value: 0.0909837172005828.
[I 2025-11-03 12:59:02,557] Trial 35 finished with value: 0.00934916162012114 and parameters: {'model_type': 'gcn', 'hidden_dims': '[128, 64]', 'dropout': 0.38825772414050186, 'batch_norm': False, 'lr': 0.00018784410031493664, 'weight_decay': 8.851651012306806e-07, 'epochs': 111, 'loss': 'mse', 'optimizer': 'adam', 'graph_mode': 'knn', 'source': 'grm', 'knn_k': 6, 'weighted_edges': False, 'symmetrize_mode': 'union', 'use_snp_selection': True, 'num_snps': 2074}. Best is trial 29 with value: 0.0909837172005828.
[I 2025-11-03 12:59:03,871] Trial 36 finished with value: 0.02921478463444514 and parameters: {'model_type': 'gcn', 'hidden_dims': '[256, 128]', 'dropout': 0.4371918405008146, 'batch_norm': True, 'lr': 5.536182967095384e-05, 'weight_decay': 1.7363148388644174e-07, 'epochs': 34, 'loss': 'mae', 'optimizer': 'adam', 'graph_mode': 'knn', 'source': 'grm', 'knn_k': 2, 'weighted_edges': True, 'symmetrize_mode': 'mutual', 'use_snp_selection': False}. Best is trial 29 with value: 0.0909837172005828.
[I 2025-11-03 12:59:05,806] Trial 37 finished with value: 0.01953842688511317 and parameters: {'model_type': 'gcn', 'hidden_dims': '[256, 128, 64]', 'dropout': 0.5018549685154492, 'batch_norm': False, 'lr': 0.0002991780015386373, 'weight_decay': 4.830936308591571e-07, 'epochs': 154, 'loss': 'mse', 'optimizer': 'adam', 'graph_mode': 'cutoff', 'cutoff': 0.35588334705258723, 'grm_norm': 'cosine', 'self_loops': True, 'use_snp_selection': True, 'num_snps': 15344}. Best is trial 29 with value: 0.0909837172005828.
[I 2025-11-03 12:59:07,185] Trial 38 finished with value: -0.0028646949467777635 and parameters: {'model_type': 'gcn', 'hidden_dims': '[128, 64]', 'dropout': 0.1494035386019554, 'batch_norm': True, 'lr': 0.0001397129778282715, 'weight_decay': 1.2294229563583221e-06, 'epochs': 100, 'loss': 'mae', 'optimizer': 'adam', 'graph_mode': 'knn', 'source': 'grm', 'knn_k': 5, 'weighted_edges': False, 'symmetrize_mode': 'union', 'use_snp_selection': False}. Best is trial 29 with value: 0.0909837172005828.
[I 2025-11-03 12:59:10,497] Trial 39 finished with value: -0.0340720252844722 and parameters: {'model_type': 'gcn', 'hidden_dims': '[512, 256]', 'dropout': 0.5415908334921539, 'batch_norm': False, 'lr': 0.0007674202897631579, 'weight_decay': 1.9778977026007647e-05, 'epochs': 48, 'loss': 'mse', 'optimizer': 'adam', 'graph_mode': 'cutoff', 'cutoff': 0.4844818357972437, 'grm_norm': 'cosine', 'self_loops': True, 'use_snp_selection': True, 'num_snps': 58379}. Best is trial 29 with value: 0.0909837172005828.
[I 2025-11-03 12:59:11,903] Trial 40 finished with value: 0.024518512258705532 and parameters: {'model_type': 'gcn', 'hidden_dims': '[512, 128]', 'dropout': 0.5716963120970138, 'batch_norm': True, 'lr': 3.979819661089794e-05, 'weight_decay': 1.2904082698211459e-05, 'epochs': 15, 'loss': 'mae', 'optimizer': 'adam', 'graph_mode': 'cutoff', 'cutoff': 0.41103059452153273, 'grm_norm': 'cosine', 'self_loops': True, 'use_snp_selection': False}. Best is trial 29 with value: 0.0909837172005828.
[I 2025-11-03 12:59:14,744] Trial 41 finished with value: 0.03876579102395055 and parameters: {'model_type': 'gcn', 'hidden_dims': '[512, 128]', 'dropout': 0.5789465430370062, 'batch_norm': True, 'lr': 0.00013398596942797378, 'weight_decay': 1.4789973110864436e-07, 'epochs': 250, 'loss': 'mse', 'optimizer': 'adam', 'graph_mode': 'cutoff', 'cutoff': 0.263107925471189, 'grm_norm': 'cosine', 'self_loops': True, 'use_snp_selection': False}. Best is trial 29 with value: 0.0909837172005828.
[I 2025-11-03 12:59:17,742] Trial 42 finished with value: 0.03895149695801576 and parameters: {'model_type': 'gcn', 'hidden_dims': '[512, 128]', 'dropout': 0.5260381008613211, 'batch_norm': True, 'lr': 0.00022762072055845293, 'weight_decay': 1.6626910437607164e-07, 'epochs': 279, 'loss': 'mse', 'optimizer': 'adam', 'graph_mode': 'cutoff', 'cutoff': 0.3218942946910991, 'grm_norm': 'cosine', 'self_loops': True, 'use_snp_selection': False}. Best is trial 29 with value: 0.0909837172005828.
[I 2025-11-03 12:59:20,667] Trial 43 finished with value: 0.05153880895166062 and parameters: {'model_type': 'gcn', 'hidden_dims': '[512, 128]', 'dropout': 0.5849634655953745, 'batch_norm': True, 'lr': 0.0004892123408573833, 'weight_decay': 5.614036048610602e-06, 'epochs': 267, 'loss': 'mse', 'optimizer': 'adam', 'graph_mode': 'cutoff', 'cutoff': 0.2735924114591053, 'grm_norm': 'cosine', 'self_loops': True, 'use_snp_selection': False}. Best is trial 29 with value: 0.0909837172005828.
[I 2025-11-03 12:59:23,346] Trial 44 finished with value: 0.04649957548988809 and parameters: {'model_type': 'gcn', 'hidden_dims': '[512, 128]', 'dropout': 0.4863424354209323, 'batch_norm': True, 'lr': 0.00048601242754702157, 'weight_decay': 2.956339881758632e-05, 'epochs': 229, 'loss': 'mse', 'optimizer': 'adam', 'graph_mode': 'cutoff', 'cutoff': 0.3604826993620791, 'grm_norm': 'cosine', 'self_loops': True, 'use_snp_selection': False}. Best is trial 29 with value: 0.0909837172005828.
[I 2025-11-03 12:59:25,715] Trial 45 finished with value: 0.04627067845722438 and parameters: {'model_type': 'gcn', 'hidden_dims': '[256, 128]', 'dropout': 0.5441042825318714, 'batch_norm': True, 'lr': 0.0006581324067099598, 'weight_decay': 4.9691263418135524e-06, 'epochs': 306, 'loss': 'mse', 'optimizer': 'adam', 'graph_mode': 'cutoff', 'cutoff': 0.28058776100416094, 'grm_norm': 'gcn', 'self_loops': False, 'use_snp_selection': False}. Best is trial 29 with value: 0.0909837172005828.
[I 2025-11-03 12:59:28,980] Trial 46 finished with value: 0.04467502131689906 and parameters: {'model_type': 'gcn', 'hidden_dims': '[512, 256]', 'dropout': 0.5785075687693123, 'batch_norm': True, 'lr': 0.0003122109494826367, 'weight_decay': 7.28681478726193e-06, 'epochs': 323, 'loss': 'mse', 'optimizer': 'adam', 'graph_mode': 'cutoff', 'cutoff': 0.6328479986843812, 'grm_norm': 'none', 'self_loops': True, 'use_snp_selection': False}. Best is trial 29 with value: 0.0909837172005828.
[I 2025-11-03 12:59:32,372] Trial 47 finished with value: 0.038867753647120286 and parameters: {'model_type': 'gcn', 'hidden_dims': '[512, 128]', 'dropout': 0.331687139161375, 'batch_norm': False, 'lr': 0.00042600685576795074, 'weight_decay': 2.5742363171332414e-06, 'epochs': 186, 'loss': 'mse', 'optimizer': 'adam', 'graph_mode': 'knn', 'source': 'grm', 'knn_k': 10, 'weighted_edges': False, 'symmetrize_mode': 'union', 'use_snp_selection': True, 'num_snps': 43485}. Best is trial 29 with value: 0.0909837172005828.
[I 2025-11-03 12:59:34,157] Trial 48 finished with value: 0.030547750121671966 and parameters: {'model_type': 'gcn', 'hidden_dims': '[512, 64]', 'dropout': 0.4195433224861293, 'batch_norm': True, 'lr': 8.398173853475174e-05, 'weight_decay': 1.230952239482992e-05, 'epochs': 71, 'loss': 'mse', 'optimizer': 'adam', 'graph_mode': 'cutoff', 'cutoff': 0.4469475626868716, 'grm_norm': 'cosine_then_gcn', 'self_loops': False, 'use_snp_selection': False}. Best is trial 29 with value: 0.0909837172005828.
[I 2025-11-03 12:59:37,157] Trial 49 finished with value: 0.05087597801678333 and parameters: {'model_type': 'gcn', 'hidden_dims': '[512, 128]', 'dropout': 0.26001650564268414, 'batch_norm': True, 'lr': 0.00019273685220235327, 'weight_decay': 5.525785742616602e-06, 'epochs': 272, 'loss': 'mae', 'optimizer': 'adam', 'graph_mode': 'cutoff', 'cutoff': 0.23511834464013753, 'grm_norm': 'gcn', 'self_loops': True, 'use_snp_selection': False}. Best is trial 29 with value: 0.0909837172005828.
[I 2025-11-03 12:59:38,971] Trial 50 finished with value: 0.06165046902620381 and parameters: {'model_type': 'gcn', 'hidden_dims': '[512, 128]', 'dropout': 0.49134943459321334, 'batch_norm': True, 'lr': 0.0009982539060060436, 'weight_decay': 2.996807586518131e-06, 'epochs': 83, 'loss': 'mse', 'optimizer': 'adam', 'graph_mode': 'cutoff', 'cutoff': 0.3092013193606816, 'grm_norm': 'cosine', 'self_loops': False, 'use_snp_selection': False}. Best is trial 29 with value: 0.0909837172005828.
[I 2025-11-03 12:59:41,022] Trial 51 finished with value: 0.035836547420322856 and parameters: {'model_type': 'gcn', 'hidden_dims': '[512, 128]', 'dropout': 0.4495683882531222, 'batch_norm': True, 'lr': 0.0008584681134070629, 'weight_decay': 3.3347201776409272e-06, 'epochs': 119, 'loss': 'mse', 'optimizer': 'adam', 'graph_mode': 'cutoff', 'cutoff': 0.3177567432557885, 'grm_norm': 'cosine', 'self_loops': False, 'use_snp_selection': False}. Best is trial 29 with value: 0.0909837172005828.
[I 2025-11-03 12:59:42,895] Trial 52 finished with value: 0.030241225028687115 and parameters: {'model_type': 'gcn', 'hidden_dims': '[512, 128]', 'dropout': 0.4924051477961186, 'batch_norm': True, 'lr': 0.000995084462513016, 'weight_decay': 1.6547510900703159e-06, 'epochs': 91, 'loss': 'mse', 'optimizer': 'adam', 'graph_mode': 'cutoff', 'cutoff': 0.2722233408454052, 'grm_norm': 'cosine', 'self_loops': False, 'use_snp_selection': False}. Best is trial 29 with value: 0.0909837172005828.
[I 2025-11-03 12:59:44,670] Trial 53 finished with value: 0.061757451977111834 and parameters: {'model_type': 'gcn', 'hidden_dims': '[512, 128]', 'dropout': 0.3718303349736981, 'batch_norm': True, 'lr': 0.0005050841866118084, 'weight_decay': 1.4741864937737955e-05, 'epochs': 76, 'loss': 'mse', 'optimizer': 'adam', 'graph_mode': 'cutoff', 'cutoff': 0.3701520008517238, 'grm_norm': 'cosine', 'self_loops': False, 'use_snp_selection': False}. Best is trial 29 with value: 0.0909837172005828.
[I 2025-11-03 12:59:46,469] Trial 54 finished with value: 0.03456517282919421 and parameters: {'model_type': 'gcn', 'hidden_dims': '[512, 128]', 'dropout': 0.363562963163708, 'batch_norm': True, 'lr': 0.0003490472003835481, 'weight_decay': 0.00016400181215057782, 'epochs': 81, 'loss': 'mse', 'optimizer': 'adam', 'graph_mode': 'cutoff', 'cutoff': 0.3890313731528121, 'grm_norm': 'cosine', 'self_loops': False, 'use_snp_selection': False}. Best is trial 29 with value: 0.0909837172005828.
[I 2025-11-03 12:59:47,733] Trial 55 finished with value: 0.032184271485039176 and parameters: {'model_type': 'gcn', 'hidden_dims': '[256, 128, 64]', 'dropout': 0.4064141285221578, 'batch_norm': True, 'lr': 0.0006385573914636363, 'weight_decay': 1.3136838931793368e-05, 'epochs': 25, 'loss': 'mse', 'optimizer': 'adam', 'graph_mode': 'cutoff', 'cutoff': 0.7598682446482334, 'grm_norm': 'cosine', 'self_loops': False, 'use_snp_selection': False}. Best is trial 29 with value: 0.0909837172005828.
[I 2025-11-03 12:59:49,946] Trial 56 finished with value: 0.030784826922572155 and parameters: {'model_type': 'gcn', 'hidden_dims': '[512, 128]', 'dropout': 0.32762469454380744, 'batch_norm': True, 'lr': 2.8447836518732854e-05, 'weight_decay': 3.69336382177606e-05, 'epochs': 138, 'loss': 'mse', 'optimizer': 'adam', 'graph_mode': 'cutoff', 'cutoff': 0.42104417214819895, 'grm_norm': 'none', 'self_loops': False, 'use_snp_selection': False}. Best is trial 29 with value: 0.0909837172005828.
[I 2025-11-03 12:59:51,586] Trial 57 finished with value: 0.06630144874857913 and parameters: {'model_type': 'gcn', 'hidden_dims': '[512, 128]', 'dropout': 0.37724805910155396, 'batch_norm': True, 'lr': 0.00024800037195049114, 'weight_decay': 1.183938564495766e-06, 'epochs': 55, 'loss': 'mse', 'optimizer': 'adam', 'graph_mode': 'cutoff', 'cutoff': 0.5134419729501003, 'grm_norm': 'cosine', 'self_loops': False, 'use_snp_selection': False}. Best is trial 29 with value: 0.0909837172005828.
[I 2025-11-03 12:59:53,223] Trial 58 finished with value: 0.05360592585701232 and parameters: {'model_type': 'gcn', 'hidden_dims': '[512, 256]', 'dropout': 0.38399864428546654, 'batch_norm': True, 'lr': 0.000254518158171766, 'weight_decay': 1.1861752335483691e-06, 'epochs': 50, 'loss': 'mse', 'optimizer': 'adam', 'graph_mode': 'cutoff', 'cutoff': 0.5258367549018461, 'grm_norm': 'cosine_then_gcn', 'self_loops': False, 'use_snp_selection': False}. Best is trial 29 with value: 0.0909837172005828.
[I 2025-11-03 12:59:54,555] Trial 59 finished with value: -0.0779619520429142 and parameters: {'model_type': 'gcn', 'hidden_dims': '[512, 64]', 'dropout': 0.1127235263915338, 'batch_norm': True, 'lr': 4.808053575771938e-06, 'weight_decay': 2.935156132134041e-06, 'epochs': 4, 'loss': 'mse', 'optimizer': 'adam', 'graph_mode': 'cutoff', 'cutoff': 0.3801509956174913, 'grm_norm': 'gcn', 'self_loops': False, 'use_snp_selection': False}. Best is trial 29 with value: 0.0909837172005828.
[I 2025-11-03 12:59:56,482] Trial 60 finished with value: 0.04175688938735286 and parameters: {'model_type': 'gcn', 'hidden_dims': '[512, 128]', 'dropout': 0.2839962688578053, 'batch_norm': False, 'lr': 0.0005287400395086429, 'weight_decay': 1.6657928246520755e-05, 'epochs': 81, 'loss': 'mse', 'optimizer': 'adam', 'graph_mode': 'knn', 'source': 'grm', 'knn_k': 8, 'weighted_edges': True, 'symmetrize_mode': 'mutual', 'use_snp_selection': True, 'num_snps': 19019}. Best is trial 29 with value: 0.0909837172005828.
[I 2025-11-03 12:59:58,235] Trial 61 finished with value: 0.04387348110198489 and parameters: {'model_type': 'gcn', 'hidden_dims': '[512, 128]', 'dropout': 0.3746250306908991, 'batch_norm': True, 'lr': 0.0007605250115924073, 'weight_decay': 1.8491456203642776e-06, 'epochs': 69, 'loss': 'mse', 'optimizer': 'adam', 'graph_mode': 'cutoff', 'cutoff': 0.6079186475827936, 'grm_norm': 'cosine', 'self_loops': False, 'use_snp_selection': False}. Best is trial 29 with value: 0.0909837172005828.
[I 2025-11-03 12:59:59,884] Trial 62 finished with value: 0.012312917008690263 and parameters: {'model_type': 'gcn', 'hidden_dims': '[512, 128]', 'dropout': 0.40853840176606615, 'batch_norm': True, 'lr': 0.0003053443410752911, 'weight_decay': 6.921644201171976e-07, 'epochs': 53, 'loss': 'mse', 'optimizer': 'adam', 'graph_mode': 'cutoff', 'cutoff': 0.33204050154660875, 'grm_norm': 'cosine', 'self_loops': False, 'use_snp_selection': False}. Best is trial 29 with value: 0.0909837172005828.
[I 2025-11-03 13:00:01,819] Trial 63 finished with value: 0.0075201236585111225 and parameters: {'model_type': 'gcn', 'hidden_dims': '[512, 128]', 'dropout': 0.47234031092185436, 'batch_norm': True, 'lr': 0.00040431090028531555, 'weight_decay': 3.116774105985853e-07, 'epochs': 99, 'loss': 'mse', 'optimizer': 'adam', 'graph_mode': 'cutoff', 'cutoff': 0.4949961625639401, 'grm_norm': 'cosine', 'self_loops': False, 'use_snp_selection': False}. Best is trial 29 with value: 0.0909837172005828.
[I 2025-11-03 13:00:02,915] Trial 64 finished with value: 0.020047069211859985 and parameters: {'model_type': 'gcn', 'hidden_dims': '[128, 64]', 'dropout': 0.33827428403487725, 'batch_norm': True, 'lr': 0.00011212765049857938, 'weight_decay': 4.291236851850153e-07, 'epochs': 21, 'loss': 'mse', 'optimizer': 'adam', 'graph_mode': 'cutoff', 'cutoff': 0.44849085367379077, 'grm_norm': 'cosine', 'self_loops': False, 'use_snp_selection': False}. Best is trial 29 with value: 0.0909837172005828.
[I 2025-11-03 13:00:04,518] Trial 65 finished with value: 0.022416370045332607 and parameters: {'model_type': 'gcn', 'hidden_dims': '[512, 128]', 'dropout': 0.4325996925663215, 'batch_norm': True, 'lr': 0.00022773065948329855, 'weight_decay': 9.09894179148907e-06, 'epochs': 42, 'loss': 'mse', 'optimizer': 'adam', 'graph_mode': 'cutoff', 'cutoff': 0.524704857053729, 'grm_norm': 'cosine', 'self_loops': False, 'use_snp_selection': False}. Best is trial 29 with value: 0.0909837172005828.
