[I 2025-11-03 15:39:41,619] Trial 14 finished with value: 0.06566409445447277 and parameters: {'model_type': 'graphsage', 'hidden_dims': '[512, 64]', 'dropout': 0.4723237857193205, 'batch_norm': True, 'lr': 0.00087719484653171, 'weight_decay': 1.2989685499381173e-07, 'epochs': 258, 'loss': 'mae', 'optimizer': 'adam', 'graph_mode': 'knn', 'source': 'grm', 'knn_k': 4, 'weighted_edges': True, 'symmetrize_mode': 'union', 'use_snp_selection': False}. Best is trial 11 with value: 0.09587298356876896.
[I 2025-11-03 15:39:49,673] Trial 15 finished with value: 0.08484899706838224 and parameters: {'model_type': 'graphsage', 'hidden_dims': '[512, 64]', 'dropout': 0.5974922991705405, 'batch_norm': True, 'lr': 0.00016168220206728715, 'weight_decay': 6.028960267768258e-07, 'epochs': 326, 'loss': 'mae', 'optimizer': 'adam', 'graph_mode': 'knn', 'source': 'grm', 'knn_k': 3, 'weighted_edges': True, 'symmetrize_mode': 'union', 'use_snp_selection': False}. Best is trial 11 with value: 0.09587298356876896.
[I 2025-11-03 15:39:57,082] Trial 16 finished with value: 0.06921323297933284 and parameters: {'model_type': 'graphsage', 'hidden_dims': '[512, 128]', 'dropout': 0.24813958618908383, 'batch_norm': True, 'lr': 9.265532876616068e-06, 'weight_decay': 3.939158144371285e-07, 'epochs': 291, 'loss': 'mae', 'optimizer': 'adam', 'graph_mode': 'knn', 'source': 'grm', 'knn_k': 3, 'weighted_edges': False, 'symmetrize_mode': 'union', 'use_snp_selection': False}. Best is trial 11 with value: 0.09587298356876896.
[I 2025-11-03 15:40:01,564] Trial 17 finished with value: 0.06770534518717622 and parameters: {'model_type': 'graphsage', 'hidden_dims': '[256, 128, 64]', 'dropout': 0.3546279424441013, 'batch_norm': True, 'lr': 6.510411739428148e-05, 'weight_decay': 5.170296782239028e-06, 'epochs': 234, 'loss': 'mae', 'optimizer': 'adam', 'graph_mode': 'knn', 'source': 'grm', 'knn_k': 5, 'weighted_edges': True, 'symmetrize_mode': 'union', 'use_snp_selection': False}. Best is trial 11 with value: 0.09587298356876896.
[I 2025-11-03 15:40:10,897] Trial 18 finished with value: 0.07874410529334797 and parameters: {'model_type': 'graphsage', 'hidden_dims': '[512, 64]', 'dropout': 0.4379228001458363, 'batch_norm': True, 'lr': 0.0002824124115605246, 'weight_decay': 3.293863322548928e-07, 'epochs': 296, 'loss': 'mae', 'optimizer': 'adam', 'graph_mode': 'knn', 'source': 'grm', 'knn_k': 10, 'weighted_edges': True, 'symmetrize_mode': 'union', 'use_snp_selection': False}. Best is trial 11 with value: 0.09587298356876896.
[I 2025-11-03 15:40:16,907] Trial 19 finished with value: 0.03625656943501386 and parameters: {'model_type': 'graphsage', 'hidden_dims': '[512, 256]', 'dropout': 0.3160942601561265, 'batch_norm': True, 'lr': 1.3261425572023469e-06, 'weight_decay': 0.0004088863535682676, 'epochs': 226, 'loss': 'mae', 'optimizer': 'adam', 'graph_mode': 'knn', 'source': 'grm', 'knn_k': 2, 'weighted_edges': False, 'symmetrize_mode': 'union', 'use_snp_selection': False}. Best is trial 11 with value: 0.09587298356876896.
[I 2025-11-03 15:40:25,075] Trial 20 finished with value: 0.07834495379427768 and parameters: {'model_type': 'graphsage', 'hidden_dims': '[512, 64]', 'dropout': 0.2390438024477444, 'batch_norm': True, 'lr': 0.0009285008786407599, 'weight_decay': 1.3208729501800877e-06, 'epochs': 265, 'loss': 'mae', 'optimizer': 'adam', 'graph_mode': 'knn', 'source': 'grm', 'knn_k': 8, 'weighted_edges': True, 'symmetrize_mode': 'union', 'use_snp_selection': False}. Best is trial 11 with value: 0.09587298356876896.
[I 2025-11-03 15:40:33,317] Trial 21 finished with value: 0.05411231872491961 and parameters: {'model_type': 'graphsage', 'hidden_dims': '[512, 64]', 'dropout': 0.5999881765572034, 'batch_norm': True, 'lr': 0.00016281907933575555, 'weight_decay': 4.861581582978914e-07, 'epochs': 335, 'loss': 'mae', 'optimizer': 'adam', 'graph_mode': 'knn', 'source': 'grm', 'knn_k': 3, 'weighted_edges': True, 'symmetrize_mode': 'union', 'use_snp_selection': False}. Best is trial 11 with value: 0.09587298356876896.
[I 2025-11-03 15:40:41,613] Trial 22 finished with value: 0.08621459901751771 and parameters: {'model_type': 'graphsage', 'hidden_dims': '[512, 64]', 'dropout': 0.5942176778164351, 'batch_norm': True, 'lr': 0.00026865062526070183, 'weight_decay': 2.89547975032696e-07, 'epochs': 350, 'loss': 'mae', 'optimizer': 'adam', 'graph_mode': 'knn', 'source': 'grm', 'knn_k': 2, 'weighted_edges': True, 'symmetrize_mode': 'union', 'use_snp_selection': False}. Best is trial 11 with value: 0.09587298356876896.
[I 2025-11-03 15:40:48,876] Trial 23 finished with value: 0.08953083760904249 and parameters: {'model_type': 'graphsage', 'hidden_dims': '[512, 64]', 'dropout': 0.5552454565256397, 'batch_norm': True, 'lr': 0.0003415366849061157, 'weight_decay': 2.357860271491006e-07, 'epochs': 307, 'loss': 'mae', 'optimizer': 'adam', 'graph_mode': 'knn', 'source': 'grm', 'knn_k': 1, 'weighted_edges': True, 'symmetrize_mode': 'union', 'use_snp_selection': False}. Best is trial 11 with value: 0.09587298356876896.
[I 2025-11-03 15:40:56,877] Trial 24 finished with value: 0.09119634592154219 and parameters: {'model_type': 'graphsage', 'hidden_dims': '[512, 256]', 'dropout': 0.55828854313799, 'batch_norm': True, 'lr': 0.0002636387678944316, 'weight_decay': 1.0465866416892841e-07, 'epochs': 350, 'loss': 'mae', 'optimizer': 'adam', 'graph_mode': 'knn', 'source': 'grm', 'knn_k': 1, 'weighted_edges': True, 'symmetrize_mode': 'union', 'use_snp_selection': False}. Best is trial 11 with value: 0.09587298356876896.
[I 2025-11-03 15:41:04,072] Trial 25 finished with value: 0.08878167217307285 and parameters: {'model_type': 'graphsage', 'hidden_dims': '[512, 256]', 'dropout': 0.5468639292837686, 'batch_norm': True, 'lr': 0.0003905978772986192, 'weight_decay': 1.0774195962014257e-07, 'epochs': 303, 'loss': 'mae', 'optimizer': 'adam', 'graph_mode': 'knn', 'source': 'grm', 'knn_k': 1, 'weighted_edges': True, 'symmetrize_mode': 'union', 'use_snp_selection': False}. Best is trial 11 with value: 0.09587298356876896.
[I 2025-11-03 15:41:12,343] Trial 26 finished with value: 0.06309139424823851 and parameters: {'model_type': 'graphsage', 'hidden_dims': '[512, 256]', 'dropout': 0.4833091053865556, 'batch_norm': False, 'lr': 7.93229502724426e-05, 'weight_decay': 1.6660268270930487e-07, 'epochs': 308, 'loss': 'mae', 'optimizer': 'adam', 'graph_mode': 'cutoff', 'cutoff': 0.8765009073803762, 'grm_norm': 'none', 'self_loops': True, 'use_snp_selection': True, 'num_snps': 59005}. Best is trial 11 with value: 0.09587298356876896.
[I 2025-11-03 15:41:20,044] Trial 27 finished with value: 0.0524062403752987 and parameters: {'model_type': 'graphsage', 'hidden_dims': '[512, 256]', 'dropout': 0.5564797190138333, 'batch_norm': True, 'lr': 1.9937354098458108e-05, 'weight_decay': 3.7999293317604666e-06, 'epochs': 318, 'loss': 'mae', 'optimizer': 'adam', 'graph_mode': 'knn', 'source': 'grm', 'knn_k': 2, 'weighted_edges': True, 'symmetrize_mode': 'union', 'use_snp_selection': False}. Best is trial 11 with value: 0.09587298356876896.
[I 2025-11-03 15:41:26,621] Trial 28 finished with value: 0.08129435251080189 and parameters: {'model_type': 'graphsage', 'hidden_dims': '[512, 256]', 'dropout': 0.37536967659703, 'batch_norm': True, 'lr': 0.000337357810963995, 'weight_decay': 8.685999114555106e-07, 'epochs': 279, 'loss': 'mae', 'optimizer': 'adam', 'graph_mode': 'knn', 'source': 'grm', 'knn_k': 1, 'weighted_edges': False, 'symmetrize_mode': 'mutual', 'use_snp_selection': False}. Best is trial 11 with value: 0.09587298356876896.
[I 2025-11-03 15:41:31,549] Trial 29 finished with value: 0.08761994026271584 and parameters: {'model_type': 'graphsage', 'hidden_dims': '[256, 128]', 'dropout': 0.1881763221627633, 'batch_norm': True, 'lr': 0.0001765801214594261, 'weight_decay': 8.368908757919724e-05, 'epochs': 341, 'loss': 'mae', 'optimizer': 'adam', 'graph_mode': 'knn', 'source': 'grm', 'knn_k': 2, 'weighted_edges': True, 'symmetrize_mode': 'union', 'use_snp_selection': False}. Best is trial 11 with value: 0.09587298356876896.
[I 2025-11-03 15:41:39,073] Trial 30 finished with value: 0.09183760688047103 and parameters: {'model_type': 'graphsage', 'hidden_dims': '[512, 128]', 'dropout': 0.4662544461132525, 'batch_norm': True, 'lr': 0.0005089449418785449, 'weight_decay': 2.5264626740180923e-07, 'epochs': 323, 'loss': 'mae', 'optimizer': 'adam', 'graph_mode': 'knn', 'source': 'grm', 'knn_k': 1, 'weighted_edges': True, 'symmetrize_mode': 'union', 'use_snp_selection': False}. Best is trial 11 with value: 0.09587298356876896.
[I 2025-11-03 15:41:46,713] Trial 31 finished with value: 0.08612356782922574 and parameters: {'model_type': 'graphsage', 'hidden_dims': '[512, 128]', 'dropout': 0.48284636632247857, 'batch_norm': True, 'lr': 0.0005089089593143393, 'weight_decay': 1.6102916413025524e-07, 'epochs': 330, 'loss': 'mae', 'optimizer': 'adam', 'graph_mode': 'knn', 'source': 'grm', 'knn_k': 1, 'weighted_edges': True, 'symmetrize_mode': 'union', 'use_snp_selection': False}. Best is trial 11 with value: 0.09587298356876896.
[I 2025-11-03 15:41:54,358] Trial 32 finished with value: 0.08745397119824622 and parameters: {'model_type': 'graphsage', 'hidden_dims': '[512, 128]', 'dropout': 0.5619744929196508, 'batch_norm': True, 'lr': 0.0005228408298522514, 'weight_decay': 2.2964732602161616e-07, 'epochs': 313, 'loss': 'mae', 'optimizer': 'adam', 'graph_mode': 'knn', 'source': 'grm', 'knn_k': 2, 'weighted_edges': True, 'symmetrize_mode': 'union', 'use_snp_selection': False}. Best is trial 11 with value: 0.09587298356876896.
[I 2025-11-03 15:42:02,320] Trial 33 finished with value: 0.09676577729337932 and parameters: {'model_type': 'graphsage', 'hidden_dims': '[512, 128]', 'dropout': 0.5186647173613457, 'batch_norm': True, 'lr': 0.00022881470329615212, 'weight_decay': 9.024732640059637e-07, 'epochs': 348, 'loss': 'mae', 'optimizer': 'adam', 'graph_mode': 'knn', 'source': 'grm', 'knn_k': 1, 'weighted_edges': True, 'symmetrize_mode': 'union', 'use_snp_selection': False}. Best is trial 33 with value: 0.09676577729337932.
[I 2025-11-03 15:42:10,889] Trial 34 finished with value: 0.006459253562566577 and parameters: {'model_type': 'graphsage', 'hidden_dims': '[512, 128]', 'dropout': 0.45720003078597327, 'batch_norm': True, 'lr': 3.018356737231735e-06, 'weight_decay': 2.7871120854759098e-06, 'epochs': 350, 'loss': 'mae', 'optimizer': 'adam', 'graph_mode': 'knn', 'source': 'grm', 'knn_k': 3, 'weighted_edges': True, 'symmetrize_mode': 'union', 'use_snp_selection': False}. Best is trial 33 with value: 0.09676577729337932.
[I 2025-11-03 15:42:13,517] Trial 35 finished with value: 0.053927596412974746 and parameters: {'model_type': 'graphsage', 'hidden_dims': '[512, 128]', 'dropout': 0.5149697219182819, 'batch_norm': False, 'lr': 0.00010209914261796258, 'weight_decay': 6.359895876866024e-06, 'epochs': 326, 'loss': 'mae', 'optimizer': 'adam', 'graph_mode': 'knn', 'source': 'grm', 'knn_k': 2, 'weighted_edges': True, 'symmetrize_mode': 'union', 'use_snp_selection': True, 'num_snps': 2074}. Best is trial 33 with value: 0.09676577729337932.
[I 2025-11-03 15:42:18,049] Trial 36 finished with value: 0.0754637667271169 and parameters: {'model_type': 'graphsage', 'hidden_dims': '[256, 128, 64]', 'dropout': 0.3931641193224241, 'batch_norm': True, 'lr': 0.0006504873232170507, 'weight_decay': 1.0352162198372672e-06, 'epochs': 277, 'loss': 'mse', 'optimizer': 'adam', 'graph_mode': 'cutoff', 'cutoff': 0.42596163795855535, 'grm_norm': 'cosine', 'self_loops': True, 'use_snp_selection': False}. Best is trial 33 with value: 0.09676577729337932.
[I 2025-11-03 15:42:21,280] Trial 37 finished with value: 0.07275473388041187 and parameters: {'model_type': 'graphsage', 'hidden_dims': '[512, 128]', 'dropout': 0.5222503285798541, 'batch_norm': False, 'lr': 0.0002037469393219143, 'weight_decay': 1.9750339846835316e-06, 'epochs': 292, 'loss': 'mae', 'optimizer': 'adam', 'graph_mode': 'knn', 'source': 'grm', 'knn_k': 1, 'weighted_edges': True, 'symmetrize_mode': 'mutual', 'use_snp_selection': True, 'num_snps': 15344}. Best is trial 33 with value: 0.09676577729337932.
[I 2025-11-03 15:42:24,513] Trial 38 finished with value: 0.08531556894935174 and parameters: {'model_type': 'graphsage', 'hidden_dims': '[128, 64]', 'dropout': 0.497292662302406, 'batch_norm': True, 'lr': 5.014162177573364e-05, 'weight_decay': 6.2164358520964e-07, 'epochs': 242, 'loss': 'mae', 'optimizer': 'adam', 'graph_mode': 'knn', 'source': 'grm', 'knn_k': 4, 'weighted_edges': True, 'symmetrize_mode': 'union', 'use_snp_selection': False}. Best is trial 33 with value: 0.09676577729337932.
[I 2025-11-03 15:42:30,667] Trial 39 finished with value: 0.0896619058550056 and parameters: {'model_type': 'graphsage', 'hidden_dims': '[256, 128]', 'dropout': 0.45840810527976256, 'batch_norm': False, 'lr': 0.00010866351455119964, 'weight_decay': 1.8684611007765339e-06, 'epochs': 349, 'loss': 'mse', 'optimizer': 'adam', 'graph_mode': 'cutoff', 'cutoff': 0.8982975816958216, 'grm_norm': 'cosine_then_gcn', 'self_loops': True, 'use_snp_selection': True, 'num_snps': 58379}. Best is trial 33 with value: 0.09676577729337932.
[I 2025-11-03 15:42:36,440] Trial 40 finished with value: 0.07180712174520683 and parameters: {'model_type': 'graphsage', 'hidden_dims': '[512, 128]', 'dropout': 0.5254323239189396, 'batch_norm': True, 'lr': 0.00046687637556038115, 'weight_decay': 9.081409116652437e-07, 'epochs': 209, 'loss': 'mae', 'optimizer': 'adam', 'graph_mode': 'knn', 'source': 'grm', 'knn_k': 2, 'weighted_edges': True, 'symmetrize_mode': 'union', 'use_snp_selection': False}. Best is trial 33 with value: 0.09676577729337932.
[I 2025-11-03 15:42:42,572] Trial 41 finished with value: 0.07244478709355981 and parameters: {'model_type': 'graphsage', 'hidden_dims': '[256, 128]', 'dropout': 0.4499340528398031, 'batch_norm': False, 'lr': 0.00010228761171382722, 'weight_decay': 9.23146552727559e-06, 'epochs': 350, 'loss': 'mse', 'optimizer': 'adam', 'graph_mode': 'cutoff', 'cutoff': 0.8901648147097074, 'grm_norm': 'cosine_then_gcn', 'self_loops': True, 'use_snp_selection': True, 'num_snps': 58268}. Best is trial 33 with value: 0.09676577729337932.
[I 2025-11-03 15:42:47,686] Trial 42 finished with value: 0.08016586691895176 and parameters: {'model_type': 'graphsage', 'hidden_dims': '[256, 128]', 'dropout': 0.3900739395271436, 'batch_norm': False, 'lr': 0.00012703690092479301, 'weight_decay': 2.3859103412618603e-06, 'epochs': 323, 'loss': 'mse', 'optimizer': 'adam', 'graph_mode': 'cutoff', 'cutoff': 0.728241428367697, 'grm_norm': 'cosine_then_gcn', 'self_loops': True, 'use_snp_selection': True, 'num_snps': 47331}. Best is trial 33 with value: 0.09676577729337932.
[I 2025-11-03 15:42:52,528] Trial 43 finished with value: 0.07577597202269462 and parameters: {'model_type': 'graphsage', 'hidden_dims': '[256, 128]', 'dropout': 0.41922672620189316, 'batch_norm': False, 'lr': 0.00021685119947344975, 'weight_decay': 1.4904496394070403e-06, 'epochs': 337, 'loss': 'mse', 'optimizer': 'adam', 'graph_mode': 'cutoff', 'cutoff': 0.49328587448787375, 'grm_norm': 'cosine_then_gcn', 'self_loops': True, 'use_snp_selection': True, 'num_snps': 37747}. Best is trial 33 with value: 0.09676577729337932.
[I 2025-11-03 15:42:57,493] Trial 44 finished with value: 0.004918348963053866 and parameters: {'model_type': 'graphsage', 'hidden_dims': '[512, 256]', 'dropout': 0.5731250380507567, 'batch_norm': False, 'lr': 0.000730039212244432, 'weight_decay': 4.868533148664109e-07, 'epochs': 99, 'loss': 'mse', 'optimizer': 'adam', 'graph_mode': 'cutoff', 'cutoff': 0.7976290777522358, 'grm_norm': 'cosine_then_gcn', 'self_loops': True, 'use_snp_selection': True, 'num_snps': 52548}. Best is trial 33 with value: 0.09676577729337932.
[I 2025-11-03 15:43:00,354] Trial 45 finished with value: 0.08678580344683089 and parameters: {'model_type': 'graphsage', 'hidden_dims': '[256, 128]', 'dropout': 0.33461614645633375, 'batch_norm': False, 'lr': 0.0002323004021955464, 'weight_decay': 1.8901752840981475e-07, 'epochs': 168, 'loss': 'mse', 'optimizer': 'adam', 'graph_mode': 'cutoff', 'cutoff': 0.5777202756326312, 'grm_norm': 'none', 'self_loops': True, 'use_snp_selection': True, 'num_snps': 25010}. Best is trial 33 with value: 0.09676577729337932.
[I 2025-11-03 15:43:03,911] Trial 46 finished with value: 0.08148564124955375 and parameters: {'model_type': 'graphsage', 'hidden_dims': '[128, 64]', 'dropout': 0.46577082891737676, 'batch_norm': False, 'lr': 2.63717351381935e-05, 'weight_decay': 1.61242940267585e-05, 'epochs': 317, 'loss': 'mse', 'optimizer': 'adam', 'graph_mode': 'cutoff', 'cutoff': 0.6385088238862441, 'grm_norm': 'cosine', 'self_loops': False, 'use_snp_selection': True, 'num_snps': 36313}. Best is trial 33 with value: 0.09676577729337932.
[I 2025-11-03 15:43:14,743] Trial 47 finished with value: 0.06880599475957636 and parameters: {'model_type': 'graphsage', 'hidden_dims': '[512, 256]', 'dropout': 0.5078292746463059, 'batch_norm': True, 'lr': 0.0004288254060247513, 'weight_decay': 6.451131941061329e-07, 'epochs': 341, 'loss': 'mse', 'optimizer': 'adam', 'graph_mode': 'cutoff', 'cutoff': 0.2179582163485172, 'grm_norm': 'gcn', 'self_loops': True, 'use_snp_selection': False}. Best is trial 33 with value: 0.09676577729337932.
[I 2025-11-03 15:43:22,169] Trial 48 finished with value: 0.06901084680896438 and parameters: {'model_type': 'graphsage', 'hidden_dims': '[512, 128]', 'dropout': 0.5316475459106527, 'batch_norm': True, 'lr': 0.0007184115559053885, 'weight_decay': 4.4626612278886306e-05, 'epochs': 287, 'loss': 'mae', 'optimizer': 'adam', 'graph_mode': 'knn', 'source': 'grm', 'knn_k': 7, 'weighted_edges': False, 'symmetrize_mode': 'mutual', 'use_snp_selection': False}. Best is trial 33 with value: 0.09676577729337932.
[I 2025-11-03 15:43:25,493] Trial 49 finished with value: 0.07383589770473632 and parameters: {'model_type': 'graphsage', 'hidden_dims': '[256, 128, 64]', 'dropout': 0.427873643400414, 'batch_norm': False, 'lr': 0.00012932564036862693, 'weight_decay': 4.384164729128978e-06, 'epochs': 267, 'loss': 'mae', 'optimizer': 'adam', 'graph_mode': 'knn', 'source': 'grm', 'knn_k': 1, 'weighted_edges': True, 'symmetrize_mode': 'union', 'use_snp_selection': True, 'num_snps': 18872}. Best is trial 33 with value: 0.09676577729337932.
[I 2025-11-03 15:43:30,962] Trial 50 finished with value: 0.07287403671837248 and parameters: {'model_type': 'graphsage', 'hidden_dims': '[512, 256]', 'dropout': 0.4957446767101259, 'batch_norm': True, 'lr': 0.00030337183095295654, 'weight_decay': 3.8052403993858695e-07, 'epochs': 203, 'loss': 'mse', 'optimizer': 'adam', 'graph_mode': 'knn', 'source': 'grm', 'knn_k': 3, 'weighted_edges': False, 'symmetrize_mode': 'mutual', 'use_snp_selection': False}. Best is trial 33 with value: 0.09676577729337932.
[I 2025-11-03 15:43:38,076] Trial 51 finished with value: 0.10350511250099614 and parameters: {'model_type': 'graphsage', 'hidden_dims': '[512, 128]', 'dropout': 0.5754654098384951, 'batch_norm': True, 'lr': 0.0003120491494518519, 'weight_decay': 2.399004502656014e-07, 'epochs': 304, 'loss': 'mae', 'optimizer': 'adam', 'graph_mode': 'knn', 'source': 'grm', 'knn_k': 1, 'weighted_edges': True, 'symmetrize_mode': 'union', 'use_snp_selection': False}. Best is trial 51 with value: 0.10350511250099614.
[I 2025-11-03 15:43:45,203] Trial 52 finished with value: 0.09136472452922816 and parameters: {'model_type': 'graphsage', 'hidden_dims': '[512, 128]', 'dropout': 0.5753179381099415, 'batch_norm': True, 'lr': 0.0006433626303001624, 'weight_decay': 1.0527974689833244e-07, 'epochs': 300, 'loss': 'mae', 'optimizer': 'adam', 'graph_mode': 'knn', 'source': 'grm', 'knn_k': 1, 'weighted_edges': True, 'symmetrize_mode': 'union', 'use_snp_selection': False}. Best is trial 51 with value: 0.10350511250099614.
[I 2025-11-03 15:43:51,464] Trial 53 finished with value: 0.0970076386695325 and parameters: {'model_type': 'graphsage', 'hidden_dims': '[512, 128]', 'dropout': 0.5752349065866864, 'batch_norm': True, 'lr': 0.0009979440003217554, 'weight_decay': 1.0537923404033802e-07, 'epochs': 249, 'loss': 'mae', 'optimizer': 'adam', 'graph_mode': 'knn', 'source': 'grm', 'knn_k': 1, 'weighted_edges': True, 'symmetrize_mode': 'union', 'use_snp_selection': False}. Best is trial 51 with value: 0.10350511250099614.
[I 2025-11-03 15:43:58,567] Trial 54 finished with value: 0.09479172775895789 and parameters: {'model_type': 'graphsage', 'hidden_dims': '[512, 128]', 'dropout': 0.5759582356136761, 'batch_norm': True, 'lr': 0.0008460860073781341, 'weight_decay': 1.7649707934022197e-07, 'epochs': 299, 'loss': 'mae', 'optimizer': 'adam', 'graph_mode': 'knn', 'source': 'grm', 'knn_k': 1, 'weighted_edges': True, 'symmetrize_mode': 'union', 'use_snp_selection': False}. Best is trial 51 with value: 0.10350511250099614.
[I 2025-11-03 15:44:05,120] Trial 55 finished with value: 0.09007619913975459 and parameters: {'model_type': 'graphsage', 'hidden_dims': '[512, 128]', 'dropout': 0.5760152583304604, 'batch_norm': True, 'lr': 0.0009797736137673334, 'weight_decay': 2.5166230104944793e-07, 'epochs': 254, 'loss': 'mae', 'optimizer': 'adam', 'graph_mode': 'knn', 'source': 'grm', 'knn_k': 2, 'weighted_edges': True, 'symmetrize_mode': 'union', 'use_snp_selection': False}. Best is trial 51 with value: 0.10350511250099614.
[I 2025-11-03 15:44:11,291] Trial 56 finished with value: 0.08741166076771084 and parameters: {'model_type': 'graphsage', 'hidden_dims': '[512, 128]', 'dropout': 0.5352857638144256, 'batch_norm': True, 'lr': 0.0007449961184860617, 'weight_decay': 1.564957413003542e-07, 'epochs': 243, 'loss': 'mae', 'optimizer': 'adam', 'graph_mode': 'knn', 'source': 'grm', 'knn_k': 1, 'weighted_edges': True, 'symmetrize_mode': 'union', 'use_snp_selection': False}. Best is trial 51 with value: 0.10350511250099614.
