[I 2025-11-03 14:04:39,785] Trial 98 finished with value: 0.058165268217865065 and parameters: {'model_type': 'graphsage', 'hidden_dims': '[512, 64]', 'dropout': 0.33444076315632876, 'batch_norm': False, 'lr': 0.00026958501134619636, 'weight_decay': 0.000230448475743826, 'epochs': 310, 'loss': 'mse', 'optimizer': 'adam', 'graph_mode': 'knn', 'source': 'grm', 'knn_k': 1, 'weighted_edges': True, 'symmetrize_mode': 'mutual', 'use_snp_selection': True, 'num_snps': 50023}. Best is trial 73 with value: 0.10606704674092371.
[I 2025-11-03 14:04:44,318] Trial 99 finished with value: 0.0831764641447881 and parameters: {'model_type': 'graphsage', 'hidden_dims': '[256, 128]', 'dropout': 0.2575661967061187, 'batch_norm': False, 'lr': 0.00044579426688018994, 'weight_decay': 0.0004396571640057943, 'epochs': 318, 'loss': 'mse', 'optimizer': 'adam', 'graph_mode': 'knn', 'source': 'grm', 'knn_k': 2, 'weighted_edges': False, 'symmetrize_mode': 'mutual', 'use_snp_selection': True, 'num_snps': 35497}. Best is trial 73 with value: 0.10606704674092371.
[I 2025-11-03 14:04:48,378] Trial 100 finished with value: 0.10500350695525798 and parameters: {'model_type': 'graphsage', 'hidden_dims': '[256, 128, 64]', 'dropout': 0.18400128108214564, 'batch_norm': False, 'lr': 0.00010404470883165526, 'weight_decay': 0.00015491921901881006, 'epochs': 262, 'loss': 'mse', 'optimizer': 'adam', 'graph_mode': 'knn', 'source': 'grm', 'knn_k': 3, 'weighted_edges': True, 'symmetrize_mode': 'mutual', 'use_snp_selection': True, 'num_snps': 31571}. Best is trial 73 with value: 0.10606704674092371.
[I 2025-11-03 14:04:52,509] Trial 101 finished with value: 0.08105010881854996 and parameters: {'model_type': 'graphsage', 'hidden_dims': '[256, 128, 64]', 'dropout': 0.18444106555606046, 'batch_norm': False, 'lr': 0.00021659260878722697, 'weight_decay': 0.0001562180374468354, 'epochs': 272, 'loss': 'mse', 'optimizer': 'adam', 'graph_mode': 'knn', 'source': 'grm', 'knn_k': 3, 'weighted_edges': True, 'symmetrize_mode': 'mutual', 'use_snp_selection': True, 'num_snps': 31488}. Best is trial 73 with value: 0.10606704674092371.
[I 2025-11-03 14:04:56,006] Trial 102 finished with value: 0.0875369588516913 and parameters: {'model_type': 'graphsage', 'hidden_dims': '[256, 128, 64]', 'dropout': 0.13121925375226187, 'batch_norm': False, 'lr': 6.130695229614497e-05, 'weight_decay': 7.786619524568642e-05, 'epochs': 263, 'loss': 'mse', 'optimizer': 'adam', 'graph_mode': 'knn', 'source': 'grm', 'knn_k': 2, 'weighted_edges': True, 'symmetrize_mode': 'mutual', 'use_snp_selection': True, 'num_snps': 23638}. Best is trial 73 with value: 0.10606704674092371.
[I 2025-11-03 14:04:59,536] Trial 103 finished with value: 0.0843760283602414 and parameters: {'model_type': 'graphsage', 'hidden_dims': '[256, 128, 64]', 'dropout': 0.16808053105457998, 'batch_norm': False, 'lr': 9.884688484677571e-05, 'weight_decay': 0.00028602209513858655, 'epochs': 287, 'loss': 'mse', 'optimizer': 'adam', 'graph_mode': 'knn', 'source': 'grm', 'knn_k': 3, 'weighted_edges': True, 'symmetrize_mode': 'mutual', 'use_snp_selection': True, 'num_snps': 21767}. Best is trial 73 with value: 0.10606704674092371.
[I 2025-11-03 14:05:04,240] Trial 104 finished with value: 0.08392471807482771 and parameters: {'model_type': 'graphsage', 'hidden_dims': '[256, 128, 64]', 'dropout': 0.23187086392245707, 'batch_norm': False, 'lr': 0.00033111222991775996, 'weight_decay': 0.000361305706565505, 'epochs': 280, 'loss': 'mse', 'optimizer': 'adam', 'graph_mode': 'knn', 'source': 'grm', 'knn_k': 2, 'weighted_edges': True, 'symmetrize_mode': 'mutual', 'use_snp_selection': True, 'num_snps': 39597}. Best is trial 73 with value: 0.10606704674092371.
[I 2025-11-03 14:05:09,120] Trial 105 finished with value: 0.08778840346167352 and parameters: {'model_type': 'graphsage', 'hidden_dims': '[256, 128, 64]', 'dropout': 0.1448551822085589, 'batch_norm': False, 'lr': 0.00012466341630324997, 'weight_decay': 0.00019092222784997256, 'epochs': 350, 'loss': 'mse', 'optimizer': 'adam', 'graph_mode': 'knn', 'source': 'grm', 'knn_k': 4, 'weighted_edges': True, 'symmetrize_mode': 'mutual', 'use_snp_selection': True, 'num_snps': 34558}. Best is trial 73 with value: 0.10606704674092371.
[I 2025-11-03 14:05:13,274] Trial 106 finished with value: 0.09146860269163082 and parameters: {'model_type': 'graphsage', 'hidden_dims': '[256, 128, 64]', 'dropout': 0.11995635232327082, 'batch_norm': False, 'lr': 7.261286614866396e-05, 'weight_decay': 0.0007960343359269745, 'epochs': 342, 'loss': 'mse', 'optimizer': 'adam', 'graph_mode': 'knn', 'source': 'grm', 'knn_k': 2, 'weighted_edges': False, 'symmetrize_mode': 'mutual', 'use_snp_selection': True, 'num_snps': 29132}. Best is trial 73 with value: 0.10606704674092371.
[I 2025-11-03 14:05:18,292] Trial 107 finished with value: 0.09177925697115946 and parameters: {'model_type': 'graphsage', 'hidden_dims': '[512, 64]', 'dropout': 0.19448639125716632, 'batch_norm': False, 'lr': 0.00014942164512258467, 'weight_decay': 0.00013359865619569163, 'epochs': 329, 'loss': 'mse', 'optimizer': 'adam', 'graph_mode': 'knn', 'source': 'grm', 'knn_k': 1, 'weighted_edges': True, 'symmetrize_mode': 'union', 'use_snp_selection': True, 'num_snps': 26313}. Best is trial 73 with value: 0.10606704674092371.
[I 2025-11-03 14:05:23,319] Trial 108 finished with value: 0.029440204659510236 and parameters: {'model_type': 'graphsage', 'hidden_dims': '[512, 128]', 'dropout': 0.15741736847160812, 'batch_norm': False, 'lr': 0.0006129670969735966, 'weight_decay': 0.00024185986472124635, 'epochs': 246, 'loss': 'mse', 'optimizer': 'adam', 'graph_mode': 'knn', 'source': 'grm', 'knn_k': 2, 'weighted_edges': False, 'symmetrize_mode': 'mutual', 'use_snp_selection': True, 'num_snps': 31795}. Best is trial 73 with value: 0.10606704674092371.
[I 2025-11-03 14:05:26,809] Trial 109 finished with value: 0.09103086052932377 and parameters: {'model_type': 'graphsage', 'hidden_dims': '[256, 128, 64]', 'dropout': 0.13492311972119694, 'batch_norm': False, 'lr': 0.00023831262083264575, 'weight_decay': 0.0005564695548730551, 'epochs': 298, 'loss': 'mse', 'optimizer': 'adam', 'graph_mode': 'knn', 'source': 'grm', 'knn_k': 3, 'weighted_edges': True, 'symmetrize_mode': 'mutual', 'use_snp_selection': True, 'num_snps': 18821}. Best is trial 73 with value: 0.10606704674092371.
[I 2025-11-03 14:05:30,051] Trial 110 finished with value: 0.09782675382257636 and parameters: {'model_type': 'graphsage', 'hidden_dims': '[256, 128]', 'dropout': 0.1011975072260988, 'batch_norm': False, 'lr': 0.0001787978745370781, 'weight_decay': 6.401228968159247e-05, 'epochs': 309, 'loss': 'mse', 'optimizer': 'adam', 'graph_mode': 'knn', 'source': 'grm', 'knn_k': 1, 'weighted_edges': False, 'symmetrize_mode': 'mutual', 'use_snp_selection': True, 'num_snps': 20544}. Best is trial 73 with value: 0.10606704674092371.
[I 2025-11-03 14:05:33,147] Trial 111 finished with value: 0.08143031937401485 and parameters: {'model_type': 'graphsage', 'hidden_dims': '[256, 128]', 'dropout': 0.1185724413350325, 'batch_norm': False, 'lr': 0.0001691978530597446, 'weight_decay': 8.935539592250061e-05, 'epochs': 308, 'loss': 'mse', 'optimizer': 'adam', 'graph_mode': 'knn', 'source': 'grm', 'knn_k': 1, 'weighted_edges': False, 'symmetrize_mode': 'mutual', 'use_snp_selection': True, 'num_snps': 16996}. Best is trial 73 with value: 0.10606704674092371.
[I 2025-11-03 14:05:36,460] Trial 112 finished with value: 0.08345070522319313 and parameters: {'model_type': 'graphsage', 'hidden_dims': '[256, 128]', 'dropout': 0.10219534203875404, 'batch_norm': False, 'lr': 0.0001058799850831929, 'weight_decay': 0.00011563514582236723, 'epochs': 325, 'loss': 'mse', 'optimizer': 'adam', 'graph_mode': 'knn', 'source': 'grm', 'knn_k': 1, 'weighted_edges': False, 'symmetrize_mode': 'mutual', 'use_snp_selection': True, 'num_snps': 20738}. Best is trial 73 with value: 0.10606704674092371.
[I 2025-11-03 14:05:40,008] Trial 113 finished with value: 0.08700879986406457 and parameters: {'model_type': 'graphsage', 'hidden_dims': '[256, 128]', 'dropout': 0.12665485994782824, 'batch_norm': False, 'lr': 0.0002973746866876838, 'weight_decay': 0.00019922839710850444, 'epochs': 336, 'loss': 'mse', 'optimizer': 'adam', 'graph_mode': 'knn', 'source': 'grm', 'knn_k': 1, 'weighted_edges': False, 'symmetrize_mode': 'mutual', 'use_snp_selection': True, 'num_snps': 23613}. Best is trial 73 with value: 0.10606704674092371.
[I 2025-11-03 14:05:43,250] Trial 114 finished with value: 0.09938851380709847 and parameters: {'model_type': 'graphsage', 'hidden_dims': '[256, 128]', 'dropout': 0.11129483260022685, 'batch_norm': False, 'lr': 0.0002028253259584048, 'weight_decay': 0.00016487017934919705, 'epochs': 315, 'loss': 'mse', 'optimizer': 'adam', 'graph_mode': 'knn', 'source': 'grm', 'knn_k': 2, 'weighted_edges': False, 'symmetrize_mode': 'mutual', 'use_snp_selection': True, 'num_snps': 19385}. Best is trial 73 with value: 0.10606704674092371.
[I 2025-11-03 14:05:46,229] Trial 115 finished with value: 0.07420648882822202 and parameters: {'model_type': 'graphsage', 'hidden_dims': '[256, 128]', 'dropout': 0.10993892225993245, 'batch_norm': False, 'lr': 0.00018874634361662902, 'weight_decay': 3.111336017720394e-05, 'epochs': 293, 'loss': 'mse', 'optimizer': 'adam', 'graph_mode': 'knn', 'source': 'grm', 'knn_k': 2, 'weighted_edges': False, 'symmetrize_mode': 'mutual', 'use_snp_selection': True, 'num_snps': 15156}. Best is trial 73 with value: 0.10606704674092371.
[I 2025-11-03 14:05:49,518] Trial 116 finished with value: 0.0791789946807284 and parameters: {'model_type': 'graphsage', 'hidden_dims': '[256, 128]', 'dropout': 0.1000635664552446, 'batch_norm': False, 'lr': 8.64301449035653e-05, 'weight_decay': 6.67417808938223e-05, 'epochs': 316, 'loss': 'mse', 'optimizer': 'adam', 'graph_mode': 'knn', 'source': 'grm', 'knn_k': 3, 'weighted_edges': False, 'symmetrize_mode': 'mutual', 'use_snp_selection': True, 'num_snps': 19525}. Best is trial 73 with value: 0.10606704674092371.
[I 2025-11-03 14:05:52,277] Trial 117 finished with value: 0.0704722344576378 and parameters: {'model_type': 'graphsage', 'hidden_dims': '[256, 128]', 'dropout': 0.11955754159675512, 'batch_norm': False, 'lr': 0.00014113232483692494, 'weight_decay': 0.00014616153588012024, 'epochs': 262, 'loss': 'mse', 'optimizer': 'adam', 'graph_mode': 'cutoff', 'cutoff': 0.8927053618931959, 'grm_norm': 'cosine_then_gcn', 'self_loops': True, 'use_snp_selection': True, 'num_snps': 12479}. Best is trial 73 with value: 0.10606704674092371.
[I 2025-11-03 14:05:55,456] Trial 118 finished with value: 0.07441776951234272 and parameters: {'model_type': 'graphsage', 'hidden_dims': '[256, 128]', 'dropout': 0.41653603607623707, 'batch_norm': False, 'lr': 0.0002521513150947883, 'weight_decay': 0.000162475092793538, 'epochs': 305, 'loss': 'mse', 'optimizer': 'adam', 'graph_mode': 'knn', 'source': 'grm', 'knn_k': 7, 'weighted_edges': False, 'symmetrize_mode': 'mutual', 'use_snp_selection': True, 'num_snps': 16780}. Best is trial 73 with value: 0.10606704674092371.
[I 2025-11-03 14:05:59,956] Trial 119 finished with value: 0.09213438542599317 and parameters: {'model_type': 'graphsage', 'hidden_dims': '[256, 128]', 'dropout': 0.14074024911764327, 'batch_norm': False, 'lr': 5.0525256559702114e-05, 'weight_decay': 0.00030879921940251965, 'epochs': 284, 'loss': 'mse', 'optimizer': 'adam', 'graph_mode': 'knn', 'source': 'grm', 'knn_k': 1, 'weighted_edges': False, 'symmetrize_mode': 'mutual', 'use_snp_selection': True, 'num_snps': 38023}. Best is trial 73 with value: 0.10606704674092371.
[I 2025-11-03 14:06:04,243] Trial 120 finished with value: 0.07430824215978349 and parameters: {'model_type': 'graphsage', 'hidden_dims': '[512, 256]', 'dropout': 0.5008445278097832, 'batch_norm': False, 'lr': 0.000205781251459135, 'weight_decay': 0.0002550465708021103, 'epochs': 295, 'loss': 'mse', 'optimizer': 'adam', 'graph_mode': 'knn', 'source': 'grm', 'knn_k': 2, 'weighted_edges': False, 'symmetrize_mode': 'mutual', 'use_snp_selection': True, 'num_snps': 21424}. Best is trial 73 with value: 0.10606704674092371.
[I 2025-11-03 14:06:08,772] Trial 121 finished with value: 0.07718456429041301 and parameters: {'model_type': 'graphsage', 'hidden_dims': '[256, 128, 64]', 'dropout': 0.28529726698322655, 'batch_norm': False, 'lr': 0.00038959569814575856, 'weight_decay': 0.00017925206947729704, 'epochs': 343, 'loss': 'mse', 'optimizer': 'adam', 'graph_mode': 'knn', 'source': 'grm', 'knn_k': 2, 'weighted_edges': False, 'symmetrize_mode': 'mutual', 'use_snp_selection': True, 'num_snps': 33468}. Best is trial 73 with value: 0.10606704674092371.
[I 2025-11-03 14:06:12,756] Trial 122 finished with value: 0.09539571433525164 and parameters: {'model_type': 'graphsage', 'hidden_dims': '[256, 128, 64]', 'dropout': 0.17416177326579643, 'batch_norm': False, 'lr': 0.00031086693366650666, 'weight_decay': 0.00021543934545637035, 'epochs': 333, 'loss': 'mse', 'optimizer': 'adam', 'graph_mode': 'knn', 'source': 'grm', 'knn_k': 2, 'weighted_edges': True, 'symmetrize_mode': 'mutual', 'use_snp_selection': True, 'num_snps': 27545}. Best is trial 73 with value: 0.10606704674092371.
[I 2025-11-03 14:06:19,142] Trial 123 finished with value: 0.09474614442933392 and parameters: {'model_type': 'graphsage', 'hidden_dims': '[256, 128, 64]', 'dropout': 0.14800697639724575, 'batch_norm': False, 'lr': 0.0002401328731773052, 'weight_decay': 0.0003650533633304732, 'epochs': 321, 'loss': 'mse', 'optimizer': 'adam', 'graph_mode': 'knn', 'source': 'grm', 'knn_k': 2, 'weighted_edges': False, 'symmetrize_mode': 'mutual', 'use_snp_selection': True, 'num_snps': 56865}. Best is trial 73 with value: 0.10606704674092371.
[I 2025-11-03 14:06:22,274] Trial 124 finished with value: 0.0812343115435375 and parameters: {'model_type': 'graphsage', 'hidden_dims': '[128, 64]', 'dropout': 0.1586227733366184, 'batch_norm': False, 'lr': 0.00044678249927663827, 'weight_decay': 0.00011230871184176858, 'epochs': 310, 'loss': 'mse', 'optimizer': 'adam', 'graph_mode': 'knn', 'source': 'grm', 'knn_k': 5, 'weighted_edges': True, 'symmetrize_mode': 'mutual', 'use_snp_selection': True, 'num_snps': 20289}. Best is trial 73 with value: 0.10606704674092371.
[I 2025-11-03 14:06:27,548] Trial 125 finished with value: 0.08809587019623193 and parameters: {'model_type': 'graphsage', 'hidden_dims': '[256, 128, 64]', 'dropout': 0.1312397275048368, 'batch_norm': False, 'lr': 0.0002962859749603221, 'weight_decay': 0.00042440266943272355, 'epochs': 301, 'loss': 'mse', 'optimizer': 'adam', 'graph_mode': 'knn', 'source': 'grm', 'knn_k': 3, 'weighted_edges': False, 'symmetrize_mode': 'mutual', 'use_snp_selection': True, 'num_snps': 43718}. Best is trial 73 with value: 0.10606704674092371.
[I 2025-11-03 14:06:30,771] Trial 126 finished with value: 0.07306807196151939 and parameters: {'model_type': 'graphsage', 'hidden_dims': '[256, 128]', 'dropout': 0.20583557767935964, 'batch_norm': False, 'lr': 0.00035053893848845666, 'weight_decay': 0.000281851105602715, 'epochs': 327, 'loss': 'mse', 'optimizer': 'adam', 'graph_mode': 'knn', 'source': 'grm', 'knn_k': 1, 'weighted_edges': True, 'symmetrize_mode': 'mutual', 'use_snp_selection': True, 'num_snps': 18321}. Best is trial 73 with value: 0.10606704674092371.
[I 2025-11-03 14:06:36,388] Trial 127 finished with value: 0.05595884109095436 and parameters: {'model_type': 'graphsage', 'hidden_dims': '[512, 64]', 'dropout': 0.1085148422661901, 'batch_norm': False, 'lr': 0.000541504064915144, 'weight_decay': 0.0001670355957948944, 'epochs': 314, 'loss': 'mse', 'optimizer': 'adam', 'graph_mode': 'knn', 'source': 'grm', 'knn_k': 2, 'weighted_edges': False, 'symmetrize_mode': 'union', 'use_snp_selection': True, 'num_snps': 30898}. Best is trial 73 with value: 0.10606704674092371.
[I 2025-11-03 14:06:40,056] Trial 128 finished with value: 0.0935426209187304 and parameters: {'model_type': 'graphsage', 'hidden_dims': '[256, 128, 64]', 'dropout': 0.12499591566681197, 'batch_norm': False, 'lr': 0.0001675680240129034, 'weight_decay': 0.0004937266843169395, 'epochs': 278, 'loss': 'mae', 'optimizer': 'adam', 'graph_mode': 'knn', 'source': 'grm', 'knn_k': 2, 'weighted_edges': True, 'symmetrize_mode': 'mutual', 'use_snp_selection': True, 'num_snps': 25344}. Best is trial 73 with value: 0.10606704674092371.
[I 2025-11-03 14:06:43,829] Trial 129 finished with value: 0.05941562840914795 and parameters: {'model_type': 'graphsage', 'hidden_dims': '[256, 128, 64]', 'dropout': 0.31370995118238704, 'batch_norm': False, 'lr': 1.6364553946382262e-05, 'weight_decay': 5.628862505358844e-07, 'epochs': 333, 'loss': 'mse', 'optimizer': 'adam', 'graph_mode': 'knn', 'source': 'grm', 'knn_k': 1, 'weighted_edges': True, 'symmetrize_mode': 'mutual', 'use_snp_selection': True, 'num_snps': 22774}. Best is trial 73 with value: 0.10606704674092371.
[I 2025-11-03 14:06:47,270] Trial 130 finished with value: 0.09295212998924268 and parameters: {'model_type': 'graphsage', 'hidden_dims': '[256, 128, 64]', 'dropout': 0.13753860345007718, 'batch_norm': False, 'lr': 0.00012776470667242508, 'weight_decay': 0.00023107300859234902, 'epochs': 317, 'loss': 'mse', 'optimizer': 'adam', 'graph_mode': 'knn', 'source': 'grm', 'knn_k': 2, 'weighted_edges': False, 'symmetrize_mode': 'mutual', 'use_snp_selection': True, 'num_snps': 15600}. Best is trial 73 with value: 0.10606704674092371.
[I 2025-11-03 14:06:51,250] Trial 131 finished with value: 0.09954849636170628 and parameters: {'model_type': 'graphsage', 'hidden_dims': '[256, 128, 64]', 'dropout': 0.17350279588154974, 'batch_norm': False, 'lr': 0.0002792666725749816, 'weight_decay': 0.00013728808518805326, 'epochs': 343, 'loss': 'mse', 'optimizer': 'adam', 'graph_mode': 'knn', 'source': 'grm', 'knn_k': 2, 'weighted_edges': True, 'symmetrize_mode': 'mutual', 'use_snp_selection': True, 'num_snps': 27355}. Best is trial 73 with value: 0.10606704674092371.
[I 2025-11-03 14:06:55,427] Trial 132 finished with value: 0.09225712385040823 and parameters: {'model_type': 'graphsage', 'hidden_dims': '[256, 128, 64]', 'dropout': 0.18470409540001428, 'batch_norm': False, 'lr': 0.0002608847848139105, 'weight_decay': 0.00013411200139123777, 'epochs': 344, 'loss': 'mse', 'optimizer': 'adam', 'graph_mode': 'knn', 'source': 'grm', 'knn_k': 2, 'weighted_edges': True, 'symmetrize_mode': 'mutual', 'use_snp_selection': True, 'num_snps': 29194}. Best is trial 73 with value: 0.10606704674092371.
[I 2025-11-03 14:06:59,387] Trial 133 finished with value: 0.09090198051665653 and parameters: {'model_type': 'graphsage', 'hidden_dims': '[256, 128, 64]', 'dropout': 0.1698483977205539, 'batch_norm': False, 'lr': 0.00019266534569022486, 'weight_decay': 0.00010196198416261761, 'epochs': 340, 'loss': 'mse', 'optimizer': 'adam', 'graph_mode': 'knn', 'source': 'grm', 'knn_k': 2, 'weighted_edges': True, 'symmetrize_mode': 'mutual', 'use_snp_selection': True, 'num_snps': 26988}. Best is trial 73 with value: 0.10606704674092371.
[I 2025-11-03 14:07:04,077] Trial 134 finished with value: 0.09048244666495692 and parameters: {'model_type': 'graphsage', 'hidden_dims': '[256, 128, 64]', 'dropout': 0.1120253223326053, 'batch_norm': False, 'lr': 0.00022632898223967876, 'weight_decay': 0.00032454162457331, 'epochs': 322, 'loss': 'mse', 'optimizer': 'adam', 'graph_mode': 'knn', 'source': 'grm', 'knn_k': 3, 'weighted_edges': True, 'symmetrize_mode': 'mutual', 'use_snp_selection': True, 'num_snps': 35570}. Best is trial 73 with value: 0.10606704674092371.
[I 2025-11-03 14:07:09,079] Trial 135 finished with value: 0.06769729837676082 and parameters: {'model_type': 'graphsage', 'hidden_dims': '[512, 64]', 'dropout': 0.15639180711777062, 'batch_norm': False, 'lr': 0.0003745055347494789, 'weight_decay': 0.00019901701092629858, 'epochs': 350, 'loss': 'mse', 'optimizer': 'adam', 'graph_mode': 'knn', 'source': 'grm', 'knn_k': 2, 'weighted_edges': True, 'symmetrize_mode': 'mutual', 'use_snp_selection': True, 'num_snps': 25017}. Best is trial 73 with value: 0.10606704674092371.
[I 2025-11-03 14:07:12,658] Trial 136 finished with value: 0.08539634593754582 and parameters: {'model_type': 'graphsage', 'hidden_dims': '[256, 128, 64]', 'dropout': 0.36202919361472047, 'batch_norm': False, 'lr': 0.0002903039104328336, 'weight_decay': 4.843340097240021e-05, 'epochs': 304, 'loss': 'mse', 'optimizer': 'adam', 'graph_mode': 'cutoff', 'cutoff': 0.4871723866818395, 'grm_norm': 'cosine', 'self_loops': False, 'use_snp_selection': True, 'num_snps': 21789}. Best is trial 73 with value: 0.10606704674092371.
[I 2025-11-03 14:07:15,825] Trial 137 finished with value: 0.10295348635096363 and parameters: {'model_type': 'graphsage', 'hidden_dims': '[256, 128]', 'dropout': 0.14692732596844194, 'batch_norm': False, 'lr': 0.0006935829428072955, 'weight_decay': 0.00014408810011815854, 'epochs': 289, 'loss': 'mse', 'optimizer': 'adam', 'graph_mode': 'knn', 'source': 'grm', 'knn_k': 2, 'weighted_edges': True, 'symmetrize_mode': 'mutual', 'use_snp_selection': True, 'num_snps': 19452}. Best is trial 73 with value: 0.10606704674092371.
[I 2025-11-03 14:07:19,022] Trial 138 finished with value: 0.09038298827268264 and parameters: {'model_type': 'graphsage', 'hidden_dims': '[256, 128]', 'dropout': 0.1462280988333964, 'batch_norm': False, 'lr': 0.0006475582045236493, 'weight_decay': 8.336986938909181e-05, 'epochs': 296, 'loss': 'mse', 'optimizer': 'adam', 'graph_mode': 'knn', 'source': 'grm', 'knn_k': 1, 'weighted_edges': True, 'symmetrize_mode': 'mutual', 'use_snp_selection': True, 'num_snps': 19667}. Best is trial 73 with value: 0.10606704674092371.
