[I 2025-11-03 13:58:08,330] Trial 149 finished with value: 0.1101174922650547 and parameters: {'model_type': 'gcn', 'hidden_dims': '[512, 128]', 'dropout': 0.20343725864091056, 'batch_norm': True, 'lr': 0.0008632773747530402, 'weight_decay': 0.00019842595442032626, 'epochs': 100, 'loss': 'mse', 'optimizer': 'adam', 'graph_mode': 'knn', 'source': 'grm', 'knn_k': 6, 'weighted_edges': False, 'symmetrize_mode': 'mutual', 'use_snp_selection': False}. Best is trial 148 with value: 0.1400873934416444.
[I 2025-11-03 13:58:10,286] Trial 0 finished with value: 0.056740164441107015 and parameters: {'model_type': 'gcn', 'hidden_dims': '[128, 64]', 'dropout': 0.199031432379812, 'batch_norm': True, 'lr': 1.8408544111075837e-06, 'weight_decay': 5.5136510071208614e-05, 'epochs': 334, 'loss': 'mae', 'optimizer': 'adam', 'graph_mode': 'knn', 'source': 'grm', 'knn_k': 8, 'weighted_edges': True, 'symmetrize_mode': 'mutual', 'use_snp_selection': False}. Best is trial 0 with value: 0.056740164441107015.
[I 2025-11-03 13:58:11,335] Trial 1 finished with value: 0.024089377914901136 and parameters: {'model_type': 'gcn', 'hidden_dims': '[128, 64]', 'dropout': 0.40051947670227217, 'batch_norm': True, 'lr': 0.0005320428882732732, 'weight_decay': 1.89210117736594e-06, 'epochs': 32, 'loss': 'mse', 'optimizer': 'adam', 'graph_mode': 'knn', 'source': 'grm', 'knn_k': 7, 'weighted_edges': True, 'symmetrize_mode': 'union', 'use_snp_selection': False}. Best is trial 0 with value: 0.056740164441107015.
[I 2025-11-03 13:58:13,385] Trial 2 finished with value: 0.012902594039599908 and parameters: {'model_type': 'gcn', 'hidden_dims': '[256, 128]', 'dropout': 0.5105528289184642, 'batch_norm': False, 'lr': 0.0006804279372404962, 'weight_decay': 0.0008922815224257085, 'epochs': 160, 'loss': 'mse', 'optimizer': 'adam', 'graph_mode': 'cutoff', 'cutoff': 0.5741905641612706, 'grm_norm': 'gcn', 'self_loops': False, 'use_snp_selection': True, 'num_snps': 26910}. Best is trial 0 with value: 0.056740164441107015.
[I 2025-11-03 13:58:15,460] Trial 3 finished with value: -0.004634987123984867 and parameters: {'model_type': 'gcn', 'hidden_dims': '[256, 128, 64]', 'dropout': 0.5390483213624292, 'batch_norm': False, 'lr': 3.4705625989073525e-05, 'weight_decay': 2.4623319020131338e-05, 'epochs': 92, 'loss': 'mse', 'optimizer': 'adam', 'graph_mode': 'knn', 'source': 'grm', 'knn_k': 6, 'weighted_edges': False, 'symmetrize_mode': 'mutual', 'use_snp_selection': True, 'num_snps': 30713}. Best is trial 0 with value: 0.056740164441107015.
[I 2025-11-03 13:58:17,567] Trial 4 finished with value: 0.015509503531587013 and parameters: {'model_type': 'gcn', 'hidden_dims': '[128, 64]', 'dropout': 0.13404863676897502, 'batch_norm': False, 'lr': 0.0001431556295367288, 'weight_decay': 2.2084517750726675e-05, 'epochs': 13, 'loss': 'mae', 'optimizer': 'adam', 'graph_mode': 'cutoff', 'cutoff': 0.6714268476993044, 'grm_norm': 'none', 'self_loops': False, 'use_snp_selection': True, 'num_snps': 45645}. Best is trial 0 with value: 0.056740164441107015.
[I 2025-11-03 13:58:20,135] Trial 5 finished with value: 0.05130411245595654 and parameters: {'model_type': 'gcn', 'hidden_dims': '[256, 128]', 'dropout': 0.42253606323412096, 'batch_norm': False, 'lr': 4.238630400638805e-05, 'weight_decay': 8.074086040046576e-07, 'epochs': 134, 'loss': 'mae', 'optimizer': 'adam', 'graph_mode': 'knn', 'source': 'grm', 'knn_k': 1, 'weighted_edges': False, 'symmetrize_mode': 'mutual', 'use_snp_selection': True, 'num_snps': 43113}. Best is trial 0 with value: 0.056740164441107015.
[I 2025-11-03 13:58:22,645] Trial 6 finished with value: -0.018020917232483693 and parameters: {'model_type': 'gcn', 'hidden_dims': '[512, 256]', 'dropout': 0.3534893146320237, 'batch_norm': True, 'lr': 0.000251307964226932, 'weight_decay': 1.821819791794022e-05, 'epochs': 207, 'loss': 'mae', 'optimizer': 'adam', 'graph_mode': 'knn', 'source': 'grm', 'knn_k': 1, 'weighted_edges': True, 'symmetrize_mode': 'mutual', 'use_snp_selection': False}. Best is trial 0 with value: 0.056740164441107015.
[I 2025-11-03 13:58:24,841] Trial 7 finished with value: 0.0033406238456726777 and parameters: {'model_type': 'gcn', 'hidden_dims': '[512, 256]', 'dropout': 0.1105825955860775, 'batch_norm': True, 'lr': 2.374338412754043e-05, 'weight_decay': 1.1284721123340274e-05, 'epochs': 170, 'loss': 'mse', 'optimizer': 'adam', 'graph_mode': 'cutoff', 'cutoff': 0.719872204109604, 'grm_norm': 'gcn', 'self_loops': False, 'use_snp_selection': False}. Best is trial 0 with value: 0.056740164441107015.
[I 2025-11-03 13:58:26,573] Trial 8 finished with value: 0.026590333372436686 and parameters: {'model_type': 'gcn', 'hidden_dims': '[512, 128]', 'dropout': 0.5066580418354021, 'batch_norm': True, 'lr': 0.00039213678276659976, 'weight_decay': 3.43655320802934e-06, 'epochs': 91, 'loss': 'mse', 'optimizer': 'adam', 'graph_mode': 'cutoff', 'cutoff': 0.34923059576505366, 'grm_norm': 'cosine', 'self_loops': True, 'use_snp_selection': False}. Best is trial 0 with value: 0.056740164441107015.
[I 2025-11-03 13:58:28,123] Trial 9 finished with value: 0.007710092357222745 and parameters: {'model_type': 'gcn', 'hidden_dims': '[512, 256]', 'dropout': 0.301734920240333, 'batch_norm': False, 'lr': 6.650961854953448e-06, 'weight_decay': 6.861575656590315e-05, 'epochs': 125, 'loss': 'mae', 'optimizer': 'adam', 'graph_mode': 'cutoff', 'cutoff': 0.2857569870061939, 'grm_norm': 'cosine_then_gcn', 'self_loops': False, 'use_snp_selection': True, 'num_snps': 12722}. Best is trial 0 with value: 0.056740164441107015.
[I 2025-11-03 13:58:31,428] Trial 10 finished with value: 0.027078815666105868 and parameters: {'model_type': 'gcn', 'hidden_dims': '[512, 64]', 'dropout': 0.22492338276159776, 'batch_norm': True, 'lr': 1.0627684039560866e-06, 'weight_decay': 0.000250012967435051, 'epochs': 341, 'loss': 'mae', 'optimizer': 'adam', 'graph_mode': 'knn', 'source': 'grm', 'knn_k': 10, 'weighted_edges': True, 'symmetrize_mode': 'union', 'use_snp_selection': False}. Best is trial 0 with value: 0.056740164441107015.
[I 2025-11-03 13:58:34,984] Trial 11 finished with value: 0.01125512376109398 and parameters: {'model_type': 'gcn', 'hidden_dims': '[256, 128]', 'dropout': 0.4214049075657615, 'batch_norm': False, 'lr': 1.434567979256578e-06, 'weight_decay': 1.841632436164752e-07, 'epochs': 265, 'loss': 'mae', 'optimizer': 'adam', 'graph_mode': 'knn', 'source': 'grm', 'knn_k': 1, 'weighted_edges': False, 'symmetrize_mode': 'mutual', 'use_snp_selection': True, 'num_snps': 57977}. Best is trial 0 with value: 0.056740164441107015.
[I 2025-11-03 13:58:38,428] Trial 12 finished with value: -0.01664709439421815 and parameters: {'model_type': 'gcn', 'hidden_dims': '[256, 128]', 'dropout': 0.22647944320852692, 'batch_norm': True, 'lr': 4.736133423705477e-05, 'weight_decay': 3.691254407288139e-07, 'epochs': 345, 'loss': 'mae', 'optimizer': 'adam', 'graph_mode': 'knn', 'source': 'grm', 'knn_k': 9, 'weighted_edges': False, 'symmetrize_mode': 'mutual', 'use_snp_selection': True, 'num_snps': 46224}. Best is trial 0 with value: 0.056740164441107015.
[I 2025-11-03 13:58:40,144] Trial 13 finished with value: 0.013262736490367376 and parameters: {'model_type': 'gcn', 'hidden_dims': '[128, 64]', 'dropout': 0.5985853779216309, 'batch_norm': False, 'lr': 2.7170381930476388e-06, 'weight_decay': 8.700619739607838e-07, 'epochs': 255, 'loss': 'mae', 'optimizer': 'adam', 'graph_mode': 'knn', 'source': 'grm', 'knn_k': 4, 'weighted_edges': False, 'symmetrize_mode': 'mutual', 'use_snp_selection': False}. Best is trial 0 with value: 0.056740164441107015.
[I 2025-11-03 13:58:42,394] Trial 14 finished with value: 0.036437141787733184 and parameters: {'model_type': 'gcn', 'hidden_dims': '[256, 128, 64]', 'dropout': 0.26083690600000925, 'batch_norm': False, 'lr': 1.184522341380707e-05, 'weight_decay': 9.856106242385333e-05, 'epochs': 252, 'loss': 'mae', 'optimizer': 'adam', 'graph_mode': 'knn', 'source': 'grm', 'knn_k': 4, 'weighted_edges': True, 'symmetrize_mode': 'mutual', 'use_snp_selection': False}. Best is trial 0 with value: 0.056740164441107015.
[I 2025-11-03 13:58:43,996] Trial 15 finished with value: 0.04384436530951646 and parameters: {'model_type': 'gcn', 'hidden_dims': '[512, 64]', 'dropout': 0.43812129875926853, 'batch_norm': True, 'lr': 9.165256363238983e-05, 'weight_decay': 5.205187683564767e-06, 'epochs': 215, 'loss': 'mae', 'optimizer': 'adam', 'graph_mode': 'knn', 'source': 'grm', 'knn_k': 8, 'weighted_edges': True, 'symmetrize_mode': 'mutual', 'use_snp_selection': True, 'num_snps': 4426}. Best is trial 0 with value: 0.056740164441107015.
[I 2025-11-03 13:58:47,098] Trial 16 finished with value: -0.013336098539025879 and parameters: {'model_type': 'gcn', 'hidden_dims': '[512, 128]', 'dropout': 0.17442542708353412, 'batch_norm': True, 'lr': 5.885968561840894e-06, 'weight_decay': 8.406362593964816e-07, 'epochs': 301, 'loss': 'mae', 'optimizer': 'adam', 'graph_mode': 'knn', 'source': 'grm', 'knn_k': 4, 'weighted_edges': False, 'symmetrize_mode': 'union', 'use_snp_selection': False}. Best is trial 0 with value: 0.056740164441107015.
[I 2025-11-03 13:58:49,534] Trial 17 finished with value: 0.06511496650400468 and parameters: {'model_type': 'gcn', 'hidden_dims': '[128, 64]', 'dropout': 0.3266067331473167, 'batch_norm': False, 'lr': 1.447032114699851e-05, 'weight_decay': 1.3230906698212144e-07, 'epochs': 120, 'loss': 'mae', 'optimizer': 'adam', 'graph_mode': 'knn', 'source': 'grm', 'knn_k': 3, 'weighted_edges': True, 'symmetrize_mode': 'mutual', 'use_snp_selection': True, 'num_snps': 44711}. Best is trial 17 with value: 0.06511496650400468.
[I 2025-11-03 13:58:50,677] Trial 18 finished with value: 0.019900465965641937 and parameters: {'model_type': 'gcn', 'hidden_dims': '[128, 64]', 'dropout': 0.32452146921936054, 'batch_norm': True, 'lr': 3.7514902086175608e-06, 'weight_decay': 1.4571366911164868e-07, 'epochs': 53, 'loss': 'mae', 'optimizer': 'adam', 'graph_mode': 'knn', 'source': 'grm', 'knn_k': 3, 'weighted_edges': True, 'symmetrize_mode': 'mutual', 'use_snp_selection': False}. Best is trial 17 with value: 0.06511496650400468.
[I 2025-11-03 13:58:53,851] Trial 19 finished with value: 0.01044514673524347 and parameters: {'model_type': 'gcn', 'hidden_dims': '[128, 64]', 'dropout': 0.19760647672387743, 'batch_norm': False, 'lr': 1.455488823935486e-05, 'weight_decay': 6.860840033016639e-05, 'epochs': 211, 'loss': 'mae', 'optimizer': 'adam', 'graph_mode': 'knn', 'source': 'grm', 'knn_k': 6, 'weighted_edges': True, 'symmetrize_mode': 'mutual', 'use_snp_selection': True, 'num_snps': 59687}. Best is trial 17 with value: 0.06511496650400468.
[I 2025-11-03 13:58:55,457] Trial 20 finished with value: 0.02092109232240577 and parameters: {'model_type': 'gcn', 'hidden_dims': '[128, 64]', 'dropout': 0.36931537904265704, 'batch_norm': False, 'lr': 2.0478352942675858e-06, 'weight_decay': 0.0003315106954073976, 'epochs': 83, 'loss': 'mae', 'optimizer': 'adam', 'graph_mode': 'knn', 'source': 'grm', 'knn_k': 8, 'weighted_edges': True, 'symmetrize_mode': 'union', 'use_snp_selection': True, 'num_snps': 20304}. Best is trial 17 with value: 0.06511496650400468.
[I 2025-11-03 13:58:58,035] Trial 21 finished with value: 0.023151548612917947 and parameters: {'model_type': 'gcn', 'hidden_dims': '[256, 128]', 'dropout': 0.2900451660326188, 'batch_norm': False, 'lr': 6.664982737937441e-05, 'weight_decay': 1.0144008438852464e-07, 'epochs': 137, 'loss': 'mae', 'optimizer': 'adam', 'graph_mode': 'knn', 'source': 'grm', 'knn_k': 2, 'weighted_edges': False, 'symmetrize_mode': 'mutual', 'use_snp_selection': True, 'num_snps': 43276}. Best is trial 17 with value: 0.06511496650400468.
[I 2025-11-03 13:59:00,294] Trial 22 finished with value: 0.05070886831642077 and parameters: {'model_type': 'gcn', 'hidden_dims': '[128, 64]', 'dropout': 0.46440809382111753, 'batch_norm': False, 'lr': 1.70967242072898e-05, 'weight_decay': 3.646765370549439e-07, 'epochs': 126, 'loss': 'mae', 'optimizer': 'adam', 'graph_mode': 'knn', 'source': 'grm', 'knn_k': 2, 'weighted_edges': True, 'symmetrize_mode': 'mutual', 'use_snp_selection': True, 'num_snps': 37861}. Best is trial 17 with value: 0.06511496650400468.
[I 2025-11-03 13:59:03,244] Trial 23 finished with value: -0.019459687291034335 and parameters: {'model_type': 'gcn', 'hidden_dims': '[256, 128]', 'dropout': 0.37927464303860725, 'batch_norm': False, 'lr': 8.032435869272236e-06, 'weight_decay': 3.9991520763939524e-07, 'epochs': 147, 'loss': 'mae', 'optimizer': 'adam', 'graph_mode': 'knn', 'source': 'grm', 'knn_k': 2, 'weighted_edges': True, 'symmetrize_mode': 'mutual', 'use_snp_selection': True, 'num_snps': 51546}. Best is trial 17 with value: 0.06511496650400468.
[I 2025-11-03 13:59:05,640] Trial 24 finished with value: 0.022977780350107817 and parameters: {'model_type': 'gcn', 'hidden_dims': '[128, 64]', 'dropout': 0.255454794132151, 'batch_norm': False, 'lr': 2.7054914810435258e-05, 'weight_decay': 1.3686933159333942e-06, 'epochs': 192, 'loss': 'mae', 'optimizer': 'adam', 'graph_mode': 'knn', 'source': 'grm', 'knn_k': 5, 'weighted_edges': False, 'symmetrize_mode': 'mutual', 'use_snp_selection': True, 'num_snps': 36683}. Best is trial 17 with value: 0.06511496650400468.
[I 2025-11-03 13:59:08,733] Trial 25 finished with value: 0.00018540452651215344 and parameters: {'model_type': 'gcn', 'hidden_dims': '[512, 64]', 'dropout': 0.33232066202842536, 'batch_norm': False, 'lr': 4.657930470582418e-06, 'weight_decay': 6.643702653208982e-06, 'epochs': 104, 'loss': 'mae', 'optimizer': 'adam', 'graph_mode': 'knn', 'source': 'grm', 'knn_k': 3, 'weighted_edges': True, 'symmetrize_mode': 'mutual', 'use_snp_selection': True, 'num_snps': 50891}. Best is trial 17 with value: 0.06511496650400468.
[I 2025-11-03 13:59:10,436] Trial 26 finished with value: 0.026131946825199624 and parameters: {'model_type': 'gcn', 'hidden_dims': '[512, 128]', 'dropout': 0.16086033612218928, 'batch_norm': True, 'lr': 0.00012313060310066947, 'weight_decay': 2.469790636413019e-07, 'epochs': 69, 'loss': 'mse', 'optimizer': 'adam', 'graph_mode': 'knn', 'source': 'grm', 'knn_k': 1, 'weighted_edges': False, 'symmetrize_mode': 'mutual', 'use_snp_selection': False}. Best is trial 17 with value: 0.06511496650400468.
[I 2025-11-03 13:59:13,559] Trial 27 finished with value: 0.02288096138741461 and parameters: {'model_type': 'gcn', 'hidden_dims': '[256, 128, 64]', 'dropout': 0.4621092276650331, 'batch_norm': False, 'lr': 4.7295786366017536e-05, 'weight_decay': 6.663199790156848e-07, 'epochs': 296, 'loss': 'mae', 'optimizer': 'adam', 'graph_mode': 'cutoff', 'cutoff': 0.8778115389427267, 'grm_norm': 'cosine_then_gcn', 'self_loops': True, 'use_snp_selection': True, 'num_snps': 38404}. Best is trial 17 with value: 0.06511496650400468.
[I 2025-11-03 13:59:15,379] Trial 28 finished with value: 0.014637855853068312 and parameters: {'model_type': 'gcn', 'hidden_dims': '[256, 128]', 'dropout': 0.2723745740074311, 'batch_norm': True, 'lr': 8.944888055223245e-06, 'weight_decay': 2.5793535536664097e-06, 'epochs': 175, 'loss': 'mae', 'optimizer': 'adam', 'graph_mode': 'knn', 'source': 'grm', 'knn_k': 10, 'weighted_edges': True, 'symmetrize_mode': 'union', 'use_snp_selection': False}. Best is trial 17 with value: 0.06511496650400468.
[I 2025-11-03 13:59:16,453] Trial 29 finished with value: 0.024122476248591176 and parameters: {'model_type': 'gcn', 'hidden_dims': '[128, 64]', 'dropout': 0.3991890275600054, 'batch_norm': True, 'lr': 2.8972917405896708e-06, 'weight_decay': 3.3069478781129615e-05, 'epochs': 39, 'loss': 'mse', 'optimizer': 'adam', 'graph_mode': 'knn', 'source': 'grm', 'knn_k': 3, 'weighted_edges': False, 'symmetrize_mode': 'mutual', 'use_snp_selection': False}. Best is trial 17 with value: 0.06511496650400468.
[I 2025-11-03 13:59:18,161] Trial 30 finished with value: 0.010560570141286587 and parameters: {'model_type': 'gcn', 'hidden_dims': '[128, 64]', 'dropout': 0.32185213612762237, 'batch_norm': False, 'lr': 0.00019641685539726353, 'weight_decay': 1.8044502609418975e-06, 'epochs': 3, 'loss': 'mae', 'optimizer': 'adam', 'graph_mode': 'knn', 'source': 'grm', 'knn_k': 5, 'weighted_edges': True, 'symmetrize_mode': 'mutual', 'use_snp_selection': True, 'num_snps': 29786}. Best is trial 17 with value: 0.06511496650400468.
[I 2025-11-03 13:59:20,443] Trial 31 finished with value: 0.015300722145929282 and parameters: {'model_type': 'gcn', 'hidden_dims': '[128, 64]', 'dropout': 0.47029150623104576, 'batch_norm': False, 'lr': 2.382060445242163e-05, 'weight_decay': 4.0791280698302834e-07, 'epochs': 118, 'loss': 'mae', 'optimizer': 'adam', 'graph_mode': 'knn', 'source': 'grm', 'knn_k': 2, 'weighted_edges': True, 'symmetrize_mode': 'mutual', 'use_snp_selection': True, 'num_snps': 39357}. Best is trial 17 with value: 0.06511496650400468.
[I 2025-11-03 13:59:22,787] Trial 32 finished with value: -0.005866275305247204 and parameters: {'model_type': 'gcn', 'hidden_dims': '[128, 64]', 'dropout': 0.4927902690726611, 'batch_norm': False, 'lr': 1.3962634326621995e-05, 'weight_decay': 1.1141330794024451e-07, 'epochs': 153, 'loss': 'mae', 'optimizer': 'adam', 'graph_mode': 'knn', 'source': 'grm', 'knn_k': 2, 'weighted_edges': True, 'symmetrize_mode': 'mutual', 'use_snp_selection': True, 'num_snps': 38504}. Best is trial 17 with value: 0.06511496650400468.
[I 2025-11-03 13:59:25,475] Trial 33 finished with value: 0.01740412705268416 and parameters: {'model_type': 'gcn', 'hidden_dims': '[128, 64]', 'dropout': 0.5398934640306774, 'batch_norm': False, 'lr': 1.6607968311923396e-05, 'weight_decay': 2.4090237378530423e-07, 'epochs': 118, 'loss': 'mae', 'optimizer': 'adam', 'graph_mode': 'knn', 'source': 'grm', 'knn_k': 1, 'weighted_edges': True, 'symmetrize_mode': 'mutual', 'use_snp_selection': True, 'num_snps': 51366}. Best is trial 17 with value: 0.06511496650400468.
[I 2025-11-03 13:59:27,072] Trial 34 finished with value: 0.04342509836500647 and parameters: {'model_type': 'gcn', 'hidden_dims': '[128, 64]', 'dropout': 0.42273113057758893, 'batch_norm': False, 'lr': 5.674955739569033e-05, 'weight_decay': 1.1747019351843289e-06, 'epochs': 75, 'loss': 'mse', 'optimizer': 'adam', 'graph_mode': 'cutoff', 'cutoff': 0.4102220369115638, 'grm_norm': 'none', 'self_loops': True, 'use_snp_selection': True, 'num_snps': 22924}. Best is trial 17 with value: 0.06511496650400468.
[I 2025-11-03 13:59:29,269] Trial 35 finished with value: 0.02385375101462485 and parameters: {'model_type': 'gcn', 'hidden_dims': '[256, 128]', 'dropout': 0.531100495693307, 'batch_norm': False, 'lr': 3.583903887189923e-05, 'weight_decay': 5.794750757473782e-07, 'epochs': 107, 'loss': 'mae', 'optimizer': 'adam', 'graph_mode': 'knn', 'source': 'grm', 'knn_k': 3, 'weighted_edges': True, 'symmetrize_mode': 'mutual', 'use_snp_selection': True, 'num_snps': 33926}. Best is trial 17 with value: 0.06511496650400468.
[I 2025-11-03 13:59:32,217] Trial 36 finished with value: 0.037195936546391244 and parameters: {'model_type': 'gcn', 'hidden_dims': '[256, 128, 64]', 'dropout': 0.39138239836394084, 'batch_norm': False, 'lr': 2.1169655710257775e-05, 'weight_decay': 0.0006162253712652542, 'epochs': 186, 'loss': 'mae', 'optimizer': 'adam', 'graph_mode': 'knn', 'source': 'grm', 'knn_k': 2, 'weighted_edges': True, 'symmetrize_mode': 'mutual', 'use_snp_selection': True, 'num_snps': 43392}. Best is trial 17 with value: 0.06511496650400468.
[I 2025-11-03 13:59:36,149] Trial 37 finished with value: 0.023726368484967633 and parameters: {'model_type': 'gcn', 'hidden_dims': '[512, 256]', 'dropout': 0.5751286530781992, 'batch_norm': False, 'lr': 1.023130727378972e-05, 'weight_decay': 2.5208611446104264e-07, 'epochs': 229, 'loss': 'mse', 'optimizer': 'adam', 'graph_mode': 'cutoff', 'cutoff': 0.20291476838281747, 'grm_norm': 'cosine', 'self_loops': True, 'use_snp_selection': True, 'num_snps': 53846}. Best is trial 17 with value: 0.06511496650400468.
[I 2025-11-03 13:59:37,603] Trial 38 finished with value: 0.06383587817620566 and parameters: {'model_type': 'gcn', 'hidden_dims': '[128, 64]', 'dropout': 0.10375591256873326, 'batch_norm': True, 'lr': 0.0005402355558187961, 'weight_decay': 1.4184549444932914e-05, 'epochs': 138, 'loss': 'mae', 'optimizer': 'adam', 'graph_mode': 'knn', 'source': 'grm', 'knn_k': 8, 'weighted_edges': True, 'symmetrize_mode': 'union', 'use_snp_selection': False}. Best is trial 17 with value: 0.06511496650400468.
[I 2025-11-03 13:59:39,732] Trial 39 finished with value: 0.040995155382445386 and parameters: {'model_type': 'gcn', 'hidden_dims': '[512, 128]', 'dropout': 0.10844742361890744, 'batch_norm': True, 'lr': 0.0008976100303544067, 'weight_decay': 1.4503798194440082e-05, 'epochs': 153, 'loss': 'mse', 'optimizer': 'adam', 'graph_mode': 'cutoff', 'cutoff': 0.8985383594573593, 'grm_norm': 'none', 'self_loops': True, 'use_snp_selection': False}. Best is trial 17 with value: 0.06511496650400468.
[I 2025-11-03 13:59:42,016] Trial 40 finished with value: 0.04529895643799178 and parameters: {'model_type': 'gcn', 'hidden_dims': '[512, 256]', 'dropout': 0.16245950007926993, 'batch_norm': True, 'lr': 0.00048594967429969394, 'weight_decay': 3.621278249104413e-05, 'epochs': 163, 'loss': 'mae', 'optimizer': 'adam', 'graph_mode': 'knn', 'source': 'grm', 'knn_k': 7, 'weighted_edges': True, 'symmetrize_mode': 'union', 'use_snp_selection': False}. Best is trial 17 with value: 0.06511496650400468.
[I 2025-11-03 13:59:43,420] Trial 41 finished with value: 0.019806142161292454 and parameters: {'model_type': 'gcn', 'hidden_dims': '[128, 64]', 'dropout': 0.14275140493562608, 'batch_norm': True, 'lr': 0.0002693700134674793, 'weight_decay': 7.86933797588762e-06, 'epochs': 134, 'loss': 'mae', 'optimizer': 'adam', 'graph_mode': 'knn', 'source': 'grm', 'knn_k': 7, 'weighted_edges': True, 'symmetrize_mode': 'union', 'use_snp_selection': False}. Best is trial 17 with value: 0.06511496650400468.
