[I 2025-11-03 14:58:38,747] Trial 138 finished with value: 0.10597592351748257 and parameters: {'model_type': 'graphsage', 'hidden_dims': '[256, 128]', 'dropout': 0.11105368992328585, 'batch_norm': True, 'lr': 0.0005503773398687297, 'weight_decay': 1.8492864724863937e-05, 'epochs': 112, 'loss': 'mse', 'optimizer': 'adam', 'graph_mode': 'knn', 'source': 'grm', 'knn_k': 1, 'weighted_edges': True, 'symmetrize_mode': 'mutual', 'use_snp_selection': False}. Best is trial 132 with value: 0.1359814845743888.
[I 2025-11-03 14:58:40,616] Trial 139 finished with value: 0.09474471784066009 and parameters: {'model_type': 'graphsage', 'hidden_dims': '[256, 128]', 'dropout': 0.13183370580617007, 'batch_norm': True, 'lr': 0.0004041281833681319, 'weight_decay': 2.1952715471117105e-05, 'epochs': 78, 'loss': 'mse', 'optimizer': 'adam', 'graph_mode': 'knn', 'source': 'grm', 'knn_k': 2, 'weighted_edges': True, 'symmetrize_mode': 'mutual', 'use_snp_selection': False}. Best is trial 132 with value: 0.1359814845743888.
[I 2025-11-03 14:58:42,584] Trial 140 finished with value: 0.11099093523203139 and parameters: {'model_type': 'graphsage', 'hidden_dims': '[256, 128]', 'dropout': 0.17235882672186756, 'batch_norm': True, 'lr': 0.0006236486417284224, 'weight_decay': 3.522205596150835e-05, 'epochs': 105, 'loss': 'mse', 'optimizer': 'adam', 'graph_mode': 'knn', 'source': 'grm', 'knn_k': 1, 'weighted_edges': True, 'symmetrize_mode': 'mutual', 'use_snp_selection': False}. Best is trial 132 with value: 0.1359814845743888.
[I 2025-11-03 14:58:44,480] Trial 141 finished with value: 0.11342720206829905 and parameters: {'model_type': 'graphsage', 'hidden_dims': '[256, 128]', 'dropout': 0.14728927483399626, 'batch_norm': True, 'lr': 0.0003272805513172919, 'weight_decay': 1.4482845122409293e-05, 'epochs': 88, 'loss': 'mse', 'optimizer': 'adam', 'graph_mode': 'knn', 'source': 'grm', 'knn_k': 1, 'weighted_edges': True, 'symmetrize_mode': 'mutual', 'use_snp_selection': False}. Best is trial 132 with value: 0.1359814845743888.
[I 2025-11-03 14:58:46,512] Trial 142 finished with value: 0.12295020863123425 and parameters: {'model_type': 'graphsage', 'hidden_dims': '[256, 128]', 'dropout': 0.11848470900168165, 'batch_norm': True, 'lr': 0.0004806614393899921, 'weight_decay': 1.1288870958277034e-05, 'epochs': 115, 'loss': 'mse', 'optimizer': 'adam', 'graph_mode': 'knn', 'source': 'grm', 'knn_k': 2, 'weighted_edges': True, 'symmetrize_mode': 'mutual', 'use_snp_selection': False}. Best is trial 132 with value: 0.1359814845743888.
[I 2025-11-03 14:58:48,553] Trial 143 finished with value: 0.10260112904400392 and parameters: {'model_type': 'graphsage', 'hidden_dims': '[256, 128]', 'dropout': 0.11602019696933376, 'batch_norm': True, 'lr': 0.00046819022659456803, 'weight_decay': 1.104297244415116e-05, 'epochs': 117, 'loss': 'mse', 'optimizer': 'adam', 'graph_mode': 'knn', 'source': 'grm', 'knn_k': 2, 'weighted_edges': True, 'symmetrize_mode': 'mutual', 'use_snp_selection': False}. Best is trial 132 with value: 0.1359814845743888.
[I 2025-11-03 14:58:50,648] Trial 144 finished with value: 0.11353669583528887 and parameters: {'model_type': 'graphsage', 'hidden_dims': '[256, 128]', 'dropout': 0.123564654340158, 'batch_norm': True, 'lr': 0.0007139879500651051, 'weight_decay': 9.103107495565887e-06, 'epochs': 129, 'loss': 'mse', 'optimizer': 'adam', 'graph_mode': 'knn', 'source': 'grm', 'knn_k': 2, 'weighted_edges': True, 'symmetrize_mode': 'mutual', 'use_snp_selection': False}. Best is trial 132 with value: 0.1359814845743888.
[I 2025-11-03 14:58:52,664] Trial 145 finished with value: 0.11979485613568633 and parameters: {'model_type': 'graphsage', 'hidden_dims': '[256, 128]', 'dropout': 0.1303704322836158, 'batch_norm': True, 'lr': 0.0005271980111530086, 'weight_decay': 1.5604083084159664e-05, 'epochs': 116, 'loss': 'mse', 'optimizer': 'adam', 'graph_mode': 'knn', 'source': 'grm', 'knn_k': 1, 'weighted_edges': True, 'symmetrize_mode': 'mutual', 'use_snp_selection': False}. Best is trial 132 with value: 0.1359814845743888.
[I 2025-11-03 14:58:54,556] Trial 146 finished with value: 0.11095430702111046 and parameters: {'model_type': 'graphsage', 'hidden_dims': '[256, 128]', 'dropout': 0.1337493301629718, 'batch_norm': True, 'lr': 0.0005311237863716314, 'weight_decay': 3.010002280248175e-05, 'epochs': 87, 'loss': 'mse', 'optimizer': 'adam', 'graph_mode': 'knn', 'source': 'grm', 'knn_k': 1, 'weighted_edges': True, 'symmetrize_mode': 'mutual', 'use_snp_selection': False}. Best is trial 132 with value: 0.1359814845743888.
[I 2025-11-03 14:58:56,499] Trial 147 finished with value: 0.10149128867891197 and parameters: {'model_type': 'graphsage', 'hidden_dims': '[256, 128]', 'dropout': 0.14023316029161348, 'batch_norm': True, 'lr': 0.00037746955492145814, 'weight_decay': 5.393493127488011e-05, 'epochs': 99, 'loss': 'mse', 'optimizer': 'adam', 'graph_mode': 'knn', 'source': 'grm', 'knn_k': 1, 'weighted_edges': True, 'symmetrize_mode': 'mutual', 'use_snp_selection': False}. Best is trial 132 with value: 0.1359814845743888.
[I 2025-11-03 14:58:58,527] Trial 148 finished with value: 0.11210335447735467 and parameters: {'model_type': 'graphsage', 'hidden_dims': '[256, 128]', 'dropout': 0.16064746865564009, 'batch_norm': True, 'lr': 0.0006597964455798254, 'weight_decay': 1.7180851416549315e-05, 'epochs': 114, 'loss': 'mse', 'optimizer': 'adam', 'graph_mode': 'knn', 'source': 'grm', 'knn_k': 2, 'weighted_edges': True, 'symmetrize_mode': 'mutual', 'use_snp_selection': False}. Best is trial 132 with value: 0.1359814845743888.
[I 2025-11-03 14:59:00,505] Trial 149 finished with value: 0.12778904291646595 and parameters: {'model_type': 'graphsage', 'hidden_dims': '[256, 128]', 'dropout': 0.10818982622165496, 'batch_norm': True, 'lr': 0.0002858258402122028, 'weight_decay': 1.2108378684249705e-05, 'epochs': 107, 'loss': 'mse', 'optimizer': 'adam', 'graph_mode': 'knn', 'source': 'grm', 'knn_k': 1, 'weighted_edges': True, 'symmetrize_mode': 'mutual', 'use_snp_selection': False}. Best is trial 132 with value: 0.1359814845743888.
[I 2025-11-03 14:59:02,992] Trial 0 finished with value: -0.014170619977535307 and parameters: {'model_type': 'graphsage', 'hidden_dims': '[128, 64]', 'dropout': 0.199031432379812, 'batch_norm': True, 'lr': 1.8408544111075837e-06, 'weight_decay': 5.5136510071208614e-05, 'epochs': 336, 'loss': 'mae', 'optimizer': 'adam', 'graph_mode': 'knn', 'source': 'grm', 'knn_k': 8, 'weighted_edges': True, 'symmetrize_mode': 'mutual', 'use_snp_selection': False}. Best is trial 0 with value: -0.014170619977535307.
[I 2025-11-03 14:59:04,534] Trial 1 finished with value: 0.04405142453514529 and parameters: {'model_type': 'graphsage', 'hidden_dims': '[128, 64]', 'dropout': 0.40051947670227217, 'batch_norm': True, 'lr': 0.0005320428882732732, 'weight_decay': 1.89210117736594e-06, 'epochs': 68, 'loss': 'mse', 'optimizer': 'adam', 'graph_mode': 'knn', 'source': 'grm', 'knn_k': 7, 'weighted_edges': True, 'symmetrize_mode': 'union', 'use_snp_selection': False}. Best is trial 1 with value: 0.04405142453514529.
[I 2025-11-03 14:59:07,019] Trial 2 finished with value: 0.009205040068074185 and parameters: {'model_type': 'graphsage', 'hidden_dims': '[256, 128]', 'dropout': 0.5105528289184642, 'batch_norm': False, 'lr': 0.0006804279372404962, 'weight_decay': 0.0008922815224257085, 'epochs': 181, 'loss': 'mse', 'optimizer': 'adam', 'graph_mode': 'cutoff', 'cutoff': 0.5741905641612706, 'grm_norm': 'gcn', 'self_loops': False, 'use_snp_selection': True, 'num_snps': 26910}. Best is trial 1 with value: 0.04405142453514529.
[I 2025-11-03 14:59:09,717] Trial 3 finished with value: 0.03080739833077153 and parameters: {'model_type': 'graphsage', 'hidden_dims': '[256, 128, 64]', 'dropout': 0.5390483213624292, 'batch_norm': False, 'lr': 3.4705625989073525e-05, 'weight_decay': 2.4623319020131338e-05, 'epochs': 121, 'loss': 'mse', 'optimizer': 'adam', 'graph_mode': 'knn', 'source': 'grm', 'knn_k': 6, 'weighted_edges': False, 'symmetrize_mode': 'mutual', 'use_snp_selection': True, 'num_snps': 30713}. Best is trial 1 with value: 0.04405142453514529.
[I 2025-11-03 14:59:12,383] Trial 4 finished with value: 0.03995250556033382 and parameters: {'model_type': 'graphsage', 'hidden_dims': '[128, 64]', 'dropout': 0.13404863676897502, 'batch_norm': False, 'lr': 0.0001431556295367288, 'weight_decay': 2.2084517750726675e-05, 'epochs': 51, 'loss': 'mae', 'optimizer': 'adam', 'graph_mode': 'cutoff', 'cutoff': 0.6714268476993044, 'grm_norm': 'none', 'self_loops': False, 'use_snp_selection': True, 'num_snps': 45645}. Best is trial 1 with value: 0.04405142453514529.
[I 2025-11-03 14:59:15,617] Trial 5 finished with value: 0.03258584689172 and parameters: {'model_type': 'graphsage', 'hidden_dims': '[256, 128]', 'dropout': 0.42253606323412096, 'batch_norm': False, 'lr': 4.238630400638805e-05, 'weight_decay': 8.074086040046576e-07, 'epochs': 158, 'loss': 'mae', 'optimizer': 'adam', 'graph_mode': 'knn', 'source': 'grm', 'knn_k': 1, 'weighted_edges': False, 'symmetrize_mode': 'mutual', 'use_snp_selection': True, 'num_snps': 43113}. Best is trial 1 with value: 0.04405142453514529.
[I 2025-11-03 14:59:19,514] Trial 6 finished with value: 0.06878346523960277 and parameters: {'model_type': 'graphsage', 'hidden_dims': '[512, 256]', 'dropout': 0.3534893146320237, 'batch_norm': True, 'lr': 0.000251307964226932, 'weight_decay': 1.821819791794022e-05, 'epochs': 223, 'loss': 'mae', 'optimizer': 'adam', 'graph_mode': 'knn', 'source': 'grm', 'knn_k': 1, 'weighted_edges': True, 'symmetrize_mode': 'mutual', 'use_snp_selection': False}. Best is trial 6 with value: 0.06878346523960277.
[I 2025-11-03 14:59:23,072] Trial 7 finished with value: 0.04478568660924118 and parameters: {'model_type': 'graphsage', 'hidden_dims': '[512, 256]', 'dropout': 0.1105825955860775, 'batch_norm': True, 'lr': 2.374338412754043e-05, 'weight_decay': 1.1284721123340274e-05, 'epochs': 190, 'loss': 'mse', 'optimizer': 'adam', 'graph_mode': 'cutoff', 'cutoff': 0.719872204109604, 'grm_norm': 'gcn', 'self_loops': False, 'use_snp_selection': False}. Best is trial 6 with value: 0.06878346523960277.
[I 2025-11-03 14:59:26,135] Trial 8 finished with value: 0.07071467241238154 and parameters: {'model_type': 'graphsage', 'hidden_dims': '[512, 128]', 'dropout': 0.5066580418354021, 'batch_norm': True, 'lr': 0.00039213678276659976, 'weight_decay': 3.43655320802934e-06, 'epochs': 120, 'loss': 'mse', 'optimizer': 'adam', 'graph_mode': 'cutoff', 'cutoff': 0.34923059576505366, 'grm_norm': 'cosine', 'self_loops': True, 'use_snp_selection': False}. Best is trial 8 with value: 0.07071467241238154.
[I 2025-11-03 14:59:28,202] Trial 9 finished with value: 0.039238530760061875 and parameters: {'model_type': 'graphsage', 'hidden_dims': '[512, 256]', 'dropout': 0.301734920240333, 'batch_norm': False, 'lr': 6.650961854953448e-06, 'weight_decay': 6.861575656590315e-05, 'epochs': 150, 'loss': 'mae', 'optimizer': 'adam', 'graph_mode': 'cutoff', 'cutoff': 0.2857569870061939, 'grm_norm': 'cosine_then_gcn', 'self_loops': False, 'use_snp_selection': True, 'num_snps': 12722}. Best is trial 8 with value: 0.07071467241238154.
[I 2025-11-03 14:59:32,489] Trial 10 finished with value: 0.07946892930394288 and parameters: {'model_type': 'graphsage', 'hidden_dims': '[512, 128]', 'dropout': 0.5885461262002587, 'batch_norm': True, 'lr': 0.0001051230339774825, 'weight_decay': 1.3387352389235743e-07, 'epochs': 258, 'loss': 'mse', 'optimizer': 'adam', 'graph_mode': 'cutoff', 'cutoff': 0.2684196492120865, 'grm_norm': 'cosine', 'self_loops': True, 'use_snp_selection': False}. Best is trial 10 with value: 0.07946892930394288.
[I 2025-11-03 14:59:36,949] Trial 11 finished with value: 0.08412495416808657 and parameters: {'model_type': 'graphsage', 'hidden_dims': '[512, 128]', 'dropout': 0.5890754684622632, 'batch_norm': True, 'lr': 0.00012623783700890367, 'weight_decay': 1.508061538813527e-07, 'epochs': 274, 'loss': 'mse', 'optimizer': 'adam', 'graph_mode': 'cutoff', 'cutoff': 0.24497725304786427, 'grm_norm': 'cosine', 'self_loops': True, 'use_snp_selection': False}. Best is trial 11 with value: 0.08412495416808657.
[I 2025-11-03 14:59:41,542] Trial 12 finished with value: 0.05638670762667096 and parameters: {'model_type': 'graphsage', 'hidden_dims': '[512, 128]', 'dropout': 0.5982500509908173, 'batch_norm': True, 'lr': 9.336280153487897e-05, 'weight_decay': 1.0886203784951442e-07, 'epochs': 270, 'loss': 'mse', 'optimizer': 'adam', 'graph_mode': 'cutoff', 'cutoff': 0.2157164950051649, 'grm_norm': 'cosine', 'self_loops': True, 'use_snp_selection': False}. Best is trial 11 with value: 0.08412495416808657.
[I 2025-11-03 14:59:45,963] Trial 13 finished with value: 0.07078291056307827 and parameters: {'model_type': 'graphsage', 'hidden_dims': '[512, 64]', 'dropout': 0.5967611014248035, 'batch_norm': True, 'lr': 0.00011794251245836268, 'weight_decay': 1.0952614467439647e-07, 'epochs': 279, 'loss': 'mse', 'optimizer': 'adam', 'graph_mode': 'cutoff', 'cutoff': 0.40883046333772116, 'grm_norm': 'cosine', 'self_loops': True, 'use_snp_selection': False}. Best is trial 11 with value: 0.08412495416808657.
[I 2025-11-03 14:59:50,157] Trial 14 finished with value: 0.04869241603668117 and parameters: {'model_type': 'graphsage', 'hidden_dims': '[512, 128]', 'dropout': 0.46358407447588684, 'batch_norm': True, 'lr': 1.2586985041154999e-05, 'weight_decay': 3.315063111115081e-07, 'epochs': 258, 'loss': 'mse', 'optimizer': 'adam', 'graph_mode': 'cutoff', 'cutoff': 0.47142846494447876, 'grm_norm': 'cosine', 'self_loops': True, 'use_snp_selection': False}. Best is trial 11 with value: 0.08412495416808657.
[I 2025-11-03 14:59:55,422] Trial 15 finished with value: 0.06983832567989286 and parameters: {'model_type': 'graphsage', 'hidden_dims': '[512, 128]', 'dropout': 0.555814584936773, 'batch_norm': True, 'lr': 7.092120321265845e-05, 'weight_decay': 4.4693611620695524e-07, 'epochs': 336, 'loss': 'mse', 'optimizer': 'adam', 'graph_mode': 'cutoff', 'cutoff': 0.24102919217122562, 'grm_norm': 'cosine', 'self_loops': True, 'use_snp_selection': False}. Best is trial 11 with value: 0.08412495416808657.
[I 2025-11-03 14:59:59,905] Trial 16 finished with value: 0.08213826303126262 and parameters: {'model_type': 'graphsage', 'hidden_dims': '[512, 128]', 'dropout': 0.24969688469720397, 'batch_norm': True, 'lr': 0.00019718973032819252, 'weight_decay': 2.431253659230589e-06, 'epochs': 302, 'loss': 'mse', 'optimizer': 'adam', 'graph_mode': 'cutoff', 'cutoff': 0.4753405587781906, 'grm_norm': 'none', 'self_loops': True, 'use_snp_selection': False}. Best is trial 11 with value: 0.08412495416808657.
[I 2025-11-03 15:00:02,855] Trial 17 finished with value: 0.0787354026794159 and parameters: {'model_type': 'graphsage', 'hidden_dims': '[256, 128, 64]', 'dropout': 0.26454902743462794, 'batch_norm': True, 'lr': 0.0002382411253222516, 'weight_decay': 3.107383290096833e-06, 'epochs': 305, 'loss': 'mse', 'optimizer': 'adam', 'graph_mode': 'cutoff', 'cutoff': 0.5534509752958635, 'grm_norm': 'none', 'self_loops': True, 'use_snp_selection': False}. Best is trial 11 with value: 0.08412495416808657.
[I 2025-11-03 15:00:06,704] Trial 18 finished with value: 0.0863116585456995 and parameters: {'model_type': 'graphsage', 'hidden_dims': '[512, 64]', 'dropout': 0.22813433292960555, 'batch_norm': True, 'lr': 0.0009303712567709796, 'weight_decay': 1.3312269949980426e-06, 'epochs': 225, 'loss': 'mse', 'optimizer': 'adam', 'graph_mode': 'cutoff', 'cutoff': 0.8809443877091867, 'grm_norm': 'none', 'self_loops': True, 'use_snp_selection': False}. Best is trial 18 with value: 0.0863116585456995.
[I 2025-11-03 15:00:10,590] Trial 19 finished with value: 0.09640836056287094 and parameters: {'model_type': 'graphsage', 'hidden_dims': '[512, 64]', 'dropout': 0.17699702298499004, 'batch_norm': True, 'lr': 0.0007664791858363743, 'weight_decay': 8.696899174700599e-07, 'epochs': 226, 'loss': 'mse', 'optimizer': 'adam', 'graph_mode': 'cutoff', 'cutoff': 0.8542664300796621, 'grm_norm': 'cosine_then_gcn', 'self_loops': True, 'use_snp_selection': False}. Best is trial 19 with value: 0.09640836056287094.
[I 2025-11-03 15:00:14,627] Trial 20 finished with value: 0.10068966775143183 and parameters: {'model_type': 'graphsage', 'hidden_dims': '[512, 64]', 'dropout': 0.1857085654938666, 'batch_norm': True, 'lr': 0.0008685617849592903, 'weight_decay': 9.591203210451866e-07, 'epochs': 243, 'loss': 'mse', 'optimizer': 'adam', 'graph_mode': 'cutoff', 'cutoff': 0.8957320141484659, 'grm_norm': 'cosine_then_gcn', 'self_loops': True, 'use_snp_selection': False}. Best is trial 20 with value: 0.10068966775143183.
[I 2025-11-03 15:00:18,522] Trial 21 finished with value: 0.09189279876392226 and parameters: {'model_type': 'graphsage', 'hidden_dims': '[512, 64]', 'dropout': 0.18663042517770168, 'batch_norm': True, 'lr': 0.0008857927447345777, 'weight_decay': 9.039467272692994e-07, 'epochs': 224, 'loss': 'mse', 'optimizer': 'adam', 'graph_mode': 'cutoff', 'cutoff': 0.8711843999194891, 'grm_norm': 'cosine_then_gcn', 'self_loops': True, 'use_snp_selection': False}. Best is trial 20 with value: 0.10068966775143183.
[I 2025-11-03 15:00:22,378] Trial 22 finished with value: 0.08616969953069392 and parameters: {'model_type': 'graphsage', 'hidden_dims': '[512, 64]', 'dropout': 0.17500960078488917, 'batch_norm': True, 'lr': 0.0009992458045056701, 'weight_decay': 5.939711452657033e-07, 'epochs': 221, 'loss': 'mse', 'optimizer': 'adam', 'graph_mode': 'cutoff', 'cutoff': 0.8934849434230426, 'grm_norm': 'cosine_then_gcn', 'self_loops': True, 'use_snp_selection': False}. Best is trial 20 with value: 0.10068966775143183.
[I 2025-11-03 15:00:26,285] Trial 23 finished with value: 0.08716474585344003 and parameters: {'model_type': 'graphsage', 'hidden_dims': '[512, 64]', 'dropout': 0.16092840053275612, 'batch_norm': True, 'lr': 0.000567238471299251, 'weight_decay': 6.42710958976235e-06, 'epochs': 228, 'loss': 'mse', 'optimizer': 'adam', 'graph_mode': 'cutoff', 'cutoff': 0.7919489126000179, 'grm_norm': 'cosine_then_gcn', 'self_loops': True, 'use_snp_selection': False}. Best is trial 20 with value: 0.10068966775143183.
[I 2025-11-03 15:00:29,969] Trial 24 finished with value: 0.0677954682423136 and parameters: {'model_type': 'graphsage', 'hidden_dims': '[512, 64]', 'dropout': 0.31473747230366117, 'batch_norm': True, 'lr': 0.00036277612406683557, 'weight_decay': 9.272305558564679e-07, 'epochs': 198, 'loss': 'mse', 'optimizer': 'adam', 'graph_mode': 'cutoff', 'cutoff': 0.8000628229146589, 'grm_norm': 'cosine_then_gcn', 'self_loops': True, 'use_snp_selection': False}. Best is trial 20 with value: 0.10068966775143183.
[I 2025-11-03 15:00:34,012] Trial 25 finished with value: 0.08716235500627845 and parameters: {'model_type': 'graphsage', 'hidden_dims': '[512, 64]', 'dropout': 0.2183721395074034, 'batch_norm': True, 'lr': 0.0003664431292825717, 'weight_decay': 2.931913677725665e-07, 'epochs': 244, 'loss': 'mse', 'optimizer': 'adam', 'graph_mode': 'cutoff', 'cutoff': 0.8078129262932703, 'grm_norm': 'cosine_then_gcn', 'self_loops': True, 'use_snp_selection': False}. Best is trial 20 with value: 0.10068966775143183.
[I 2025-11-03 15:00:40,949] Trial 26 finished with value: 0.053931172377687554 and parameters: {'model_type': 'graphsage', 'hidden_dims': '[512, 64]', 'dropout': 0.15363740679002197, 'batch_norm': False, 'lr': 1.2153807314991247e-06, 'weight_decay': 5.55866735625979e-06, 'epochs': 301, 'loss': 'mae', 'optimizer': 'adam', 'graph_mode': 'knn', 'source': 'grm', 'knn_k': 10, 'weighted_edges': False, 'symmetrize_mode': 'union', 'use_snp_selection': True, 'num_snps': 59005}. Best is trial 20 with value: 0.10068966775143183.
[I 2025-11-03 15:00:44,662] Trial 27 finished with value: 0.08060736381927662 and parameters: {'model_type': 'graphsage', 'hidden_dims': '[512, 64]', 'dropout': 0.10713972731905927, 'batch_norm': True, 'lr': 0.0008270243178719532, 'weight_decay': 1.338923769124515e-06, 'epochs': 209, 'loss': 'mse', 'optimizer': 'adam', 'graph_mode': 'cutoff', 'cutoff': 0.6988794013830896, 'grm_norm': 'cosine_then_gcn', 'self_loops': True, 'use_snp_selection': False}. Best is trial 20 with value: 0.10068966775143183.
[I 2025-11-03 15:00:48,110] Trial 28 finished with value: 0.018804165413377625 and parameters: {'model_type': 'graphsage', 'hidden_dims': '[512, 64]', 'dropout': 0.28957368567834063, 'batch_norm': True, 'lr': 4.612028253528466e-06, 'weight_decay': 2.731582799017013e-07, 'epochs': 170, 'loss': 'mse', 'optimizer': 'adam', 'graph_mode': 'cutoff', 'cutoff': 0.8523622860212858, 'grm_norm': 'cosine_then_gcn', 'self_loops': False, 'use_snp_selection': False}. Best is trial 20 with value: 0.10068966775143183.
[I 2025-11-03 15:00:52,498] Trial 29 finished with value: 0.06668034287609877 and parameters: {'model_type': 'graphsage', 'hidden_dims': '[512, 64]', 'dropout': 0.1881763221627632, 'batch_norm': True, 'lr': 0.0005253094236146594, 'weight_decay': 8.368908757919724e-05, 'epochs': 244, 'loss': 'mae', 'optimizer': 'adam', 'graph_mode': 'knn', 'source': 'grm', 'knn_k': 5, 'weighted_edges': False, 'symmetrize_mode': 'union', 'use_snp_selection': False}. Best is trial 20 with value: 0.10068966775143183.
[I 2025-11-03 15:00:57,172] Trial 30 finished with value: 0.0838523248759855 and parameters: {'model_type': 'graphsage', 'hidden_dims': '[512, 64]', 'dropout': 0.21870368123902434, 'batch_norm': True, 'lr': 0.0002920586134960126, 'weight_decay': 0.00020511462460338128, 'epochs': 332, 'loss': 'mse', 'optimizer': 'adam', 'graph_mode': 'cutoff', 'cutoff': 0.7587162589569211, 'grm_norm': 'cosine_then_gcn', 'self_loops': True, 'use_snp_selection': False}. Best is trial 20 with value: 0.10068966775143183.
