[I 2025-11-03 14:03:15,633] Trial 128 finished with value: -0.002863230106394218 and parameters: {'model_type': 'gcn', 'hidden_dims': '[512, 64]', 'dropout': 0.11905710199750563, 'batch_norm': False, 'lr': 4.134576398508913e-06, 'weight_decay': 2.5257487957688408e-05, 'epochs': 337, 'loss': 'mae', 'optimizer': 'adam', 'graph_mode': 'cutoff', 'cutoff': 0.5770380529042292, 'grm_norm': 'cosine_then_gcn', 'self_loops': True, 'use_snp_selection': True, 'num_snps': 43857}. Best is trial 47 with value: 0.08946651587739919.
[I 2025-11-03 14:03:18,875] Trial 129 finished with value: 0.03118499776336288 and parameters: {'model_type': 'gcn', 'hidden_dims': '[512, 256]', 'dropout': 0.3952264122474355, 'batch_norm': False, 'lr': 0.00022627916469924366, 'weight_decay': 1.7503345417095497e-07, 'epochs': 113, 'loss': 'mae', 'optimizer': 'adam', 'graph_mode': 'cutoff', 'cutoff': 0.5242792071236305, 'grm_norm': 'cosine', 'self_loops': False, 'use_snp_selection': True, 'num_snps': 48725}. Best is trial 47 with value: 0.08946651587739919.
[I 2025-11-03 14:03:21,973] Trial 130 finished with value: 0.015543129546844761 and parameters: {'model_type': 'gcn', 'hidden_dims': '[512, 128]', 'dropout': 0.509652256902738, 'batch_norm': True, 'lr': 6.1570653727941875e-06, 'weight_decay': 2.8866155693700934e-05, 'epochs': 275, 'loss': 'mae', 'optimizer': 'adam', 'graph_mode': 'cutoff', 'cutoff': 0.3345042387669957, 'grm_norm': 'gcn', 'self_loops': True, 'use_snp_selection': False}. Best is trial 47 with value: 0.08946651587739919.
[I 2025-11-03 14:03:24,525] Trial 131 finished with value: 0.032273105581795414 and parameters: {'model_type': 'gcn', 'hidden_dims': '[512, 128]', 'dropout': 0.46376793582211934, 'batch_norm': False, 'lr': 0.0002888663818833946, 'weight_decay': 1.0326424736173376e-05, 'epochs': 279, 'loss': 'mae', 'optimizer': 'adam', 'graph_mode': 'cutoff', 'cutoff': 0.4227576047845216, 'grm_norm': 'cosine', 'self_loops': True, 'use_snp_selection': True, 'num_snps': 20577}. Best is trial 47 with value: 0.08946651587739919.
[I 2025-11-03 14:03:27,166] Trial 132 finished with value: 0.0365960528462079 and parameters: {'model_type': 'gcn', 'hidden_dims': '[512, 128]', 'dropout': 0.4459607470756588, 'batch_norm': False, 'lr': 0.0001338783425582982, 'weight_decay': 1.3760670828998166e-05, 'epochs': 286, 'loss': 'mae', 'optimizer': 'adam', 'graph_mode': 'cutoff', 'cutoff': 0.39445011429550514, 'grm_norm': 'cosine', 'self_loops': True, 'use_snp_selection': True, 'num_snps': 21730}. Best is trial 47 with value: 0.08946651587739919.
[I 2025-11-03 14:03:30,680] Trial 133 finished with value: 0.021519588661858675 and parameters: {'model_type': 'gcn', 'hidden_dims': '[512, 128]', 'dropout': 0.49588069295437526, 'batch_norm': False, 'lr': 0.0002643487906174997, 'weight_decay': 1.6751295321518612e-05, 'epochs': 316, 'loss': 'mae', 'optimizer': 'adam', 'graph_mode': 'cutoff', 'cutoff': 0.44211780056596583, 'grm_norm': 'cosine', 'self_loops': True, 'use_snp_selection': True, 'num_snps': 35945}. Best is trial 47 with value: 0.08946651587739919.
[I 2025-11-03 14:03:33,063] Trial 134 finished with value: 0.029687853451152133 and parameters: {'model_type': 'gcn', 'hidden_dims': '[512, 128]', 'dropout': 0.47634343080618474, 'batch_norm': False, 'lr': 0.0006492167494808708, 'weight_decay': 1.1246836391893475e-05, 'epochs': 299, 'loss': 'mae', 'optimizer': 'adam', 'graph_mode': 'cutoff', 'cutoff': 0.41648331691029583, 'grm_norm': 'cosine', 'self_loops': True, 'use_snp_selection': True, 'num_snps': 15702}. Best is trial 47 with value: 0.08946651587739919.
[I 2025-11-03 14:03:35,703] Trial 135 finished with value: 0.03850793254850202 and parameters: {'model_type': 'gcn', 'hidden_dims': '[128, 64]', 'dropout': 0.45737931655120345, 'batch_norm': False, 'lr': 0.0007822519553361053, 'weight_decay': 4.0507145711956895e-05, 'epochs': 326, 'loss': 'mae', 'optimizer': 'adam', 'graph_mode': 'cutoff', 'cutoff': 0.46973687003751424, 'grm_norm': 'cosine', 'self_loops': True, 'use_snp_selection': True, 'num_snps': 26341}. Best is trial 47 with value: 0.08946651587739919.
[I 2025-11-03 14:03:37,503] Trial 136 finished with value: 0.0232972948036934 and parameters: {'model_type': 'gcn', 'hidden_dims': '[512, 128]', 'dropout': 0.4482321852577372, 'batch_norm': False, 'lr': 0.00019683676911708394, 'weight_decay': 1.0013845658358423e-07, 'epochs': 25, 'loss': 'mae', 'optimizer': 'adam', 'graph_mode': 'cutoff', 'cutoff': 0.38278578730953955, 'grm_norm': 'cosine_then_gcn', 'self_loops': True, 'use_snp_selection': True, 'num_snps': 23581}. Best is trial 47 with value: 0.08946651587739919.
[I 2025-11-03 14:03:40,020] Trial 137 finished with value: 0.021896608450569406 and parameters: {'model_type': 'gcn', 'hidden_dims': '[256, 128]', 'dropout': 0.20735167360463375, 'batch_norm': False, 'lr': 0.000997370570854785, 'weight_decay': 2.110167142018841e-05, 'epochs': 309, 'loss': 'mae', 'optimizer': 'adam', 'graph_mode': 'knn', 'source': 'grm', 'knn_k': 4, 'weighted_edges': False, 'symmetrize_mode': 'union', 'use_snp_selection': True, 'num_snps': 20843}. Best is trial 47 with value: 0.08946651587739919.
[I 2025-11-03 14:03:41,996] Trial 138 finished with value: 0.005301103014676135 and parameters: {'model_type': 'gcn', 'hidden_dims': '[128, 64]', 'dropout': 0.43850069467321395, 'batch_norm': False, 'lr': 0.00024246819754299685, 'weight_decay': 7.543494221763168e-06, 'epochs': 82, 'loss': 'mse', 'optimizer': 'adam', 'graph_mode': 'cutoff', 'cutoff': 0.49903837306014215, 'grm_norm': 'cosine', 'self_loops': False, 'use_snp_selection': True, 'num_snps': 28519}. Best is trial 47 with value: 0.08946651587739919.
[I 2025-11-03 14:03:45,189] Trial 139 finished with value: 0.02721896164012329 and parameters: {'model_type': 'gcn', 'hidden_dims': '[512, 128]', 'dropout': 0.27396188259558024, 'batch_norm': True, 'lr': 0.00031032733044891525, 'weight_decay': 9.697894742195649e-07, 'epochs': 292, 'loss': 'mae', 'optimizer': 'adam', 'graph_mode': 'cutoff', 'cutoff': 0.28620444728398164, 'grm_norm': 'cosine_then_gcn', 'self_loops': True, 'use_snp_selection': False}. Best is trial 47 with value: 0.08946651587739919.
[I 2025-11-03 14:03:48,446] Trial 140 finished with value: 0.04791081848908924 and parameters: {'model_type': 'gcn', 'hidden_dims': '[256, 128]', 'dropout': 0.46554345342576775, 'batch_norm': False, 'lr': 0.00042910983701637136, 'weight_decay': 5.04737440641373e-06, 'epochs': 333, 'loss': 'mae', 'optimizer': 'adam', 'graph_mode': 'cutoff', 'cutoff': 0.4598473993295623, 'grm_norm': 'cosine', 'self_loops': False, 'use_snp_selection': True, 'num_snps': 40027}. Best is trial 47 with value: 0.08946651587739919.
[I 2025-11-03 14:03:51,454] Trial 141 finished with value: 0.05185602749312644 and parameters: {'model_type': 'gcn', 'hidden_dims': '[512, 128]', 'dropout': 0.42047759165358317, 'batch_norm': False, 'lr': 0.0001703168828163742, 'weight_decay': 1.6306758689430874e-07, 'epochs': 338, 'loss': 'mae', 'optimizer': 'adam', 'graph_mode': 'cutoff', 'cutoff': 0.4408671263626505, 'grm_norm': 'cosine', 'self_loops': True, 'use_snp_selection': True, 'num_snps': 25310}. Best is trial 47 with value: 0.08946651587739919.
[I 2025-11-03 14:03:54,454] Trial 142 finished with value: 0.057009838191468494 and parameters: {'model_type': 'gcn', 'hidden_dims': '[512, 128]', 'dropout': 0.41072394256451383, 'batch_norm': False, 'lr': 0.00011965861268576823, 'weight_decay': 2.2387255919050848e-07, 'epochs': 343, 'loss': 'mae', 'optimizer': 'adam', 'graph_mode': 'cutoff', 'cutoff': 0.45438239219359755, 'grm_norm': 'cosine', 'self_loops': True, 'use_snp_selection': True, 'num_snps': 25216}. Best is trial 47 with value: 0.08946651587739919.
[I 2025-11-03 14:03:57,085] Trial 143 finished with value: 0.038450212349423 and parameters: {'model_type': 'gcn', 'hidden_dims': '[512, 128]', 'dropout': 0.4885448352558973, 'batch_norm': False, 'lr': 6.933442671919134e-05, 'weight_decay': 1.2465554417779054e-07, 'epochs': 324, 'loss': 'mae', 'optimizer': 'adam', 'graph_mode': 'cutoff', 'cutoff': 0.4106112366919451, 'grm_norm': 'cosine', 'self_loops': True, 'use_snp_selection': True, 'num_snps': 19498}. Best is trial 47 with value: 0.08946651587739919.
[I 2025-11-03 14:03:59,908] Trial 144 finished with value: 0.029580026585639223 and parameters: {'model_type': 'gcn', 'hidden_dims': '[512, 128]', 'dropout': 0.4276893109391561, 'batch_norm': False, 'lr': 0.00012177596228875925, 'weight_decay': 2.3343074866862352e-07, 'epochs': 343, 'loss': 'mae', 'optimizer': 'adam', 'graph_mode': 'cutoff', 'cutoff': 0.4288181620612124, 'grm_norm': 'cosine', 'self_loops': True, 'use_snp_selection': True, 'num_snps': 22041}. Best is trial 47 with value: 0.08946651587739919.
[I 2025-11-03 14:04:02,947] Trial 145 finished with value: 0.06459764117545251 and parameters: {'model_type': 'gcn', 'hidden_dims': '[512, 128]', 'dropout': 0.3625590129006072, 'batch_norm': False, 'lr': 0.00015445288599068717, 'weight_decay': 6.731633070016605e-05, 'epochs': 331, 'loss': 'mae', 'optimizer': 'adam', 'graph_mode': 'cutoff', 'cutoff': 0.4816049046797806, 'grm_norm': 'none', 'self_loops': True, 'use_snp_selection': True, 'num_snps': 27133}. Best is trial 47 with value: 0.08946651587739919.
[I 2025-11-03 14:04:05,970] Trial 146 finished with value: 0.01670911967039962 and parameters: {'model_type': 'gcn', 'hidden_dims': '[512, 128]', 'dropout': 0.38089861750533927, 'batch_norm': False, 'lr': 9.402901091457478e-05, 'weight_decay': 0.00013848544355181608, 'epochs': 329, 'loss': 'mae', 'optimizer': 'adam', 'graph_mode': 'cutoff', 'cutoff': 0.48591428827508343, 'grm_norm': 'none', 'self_loops': True, 'use_snp_selection': True, 'num_snps': 26583}. Best is trial 47 with value: 0.08946651587739919.
[I 2025-11-03 14:04:08,894] Trial 147 finished with value: 0.033863239585136144 and parameters: {'model_type': 'gcn', 'hidden_dims': '[128, 64]', 'dropout': 0.3004202775414263, 'batch_norm': False, 'lr': 0.0001563387813250335, 'weight_decay': 6.636741692453317e-05, 'epochs': 349, 'loss': 'mae', 'optimizer': 'adam', 'graph_mode': 'knn', 'source': 'grm', 'knn_k': 6, 'weighted_edges': True, 'symmetrize_mode': 'mutual', 'use_snp_selection': True, 'num_snps': 31193}. Best is trial 47 with value: 0.08946651587739919.
[I 2025-11-03 14:04:11,933] Trial 148 finished with value: 0.029787548580984827 and parameters: {'model_type': 'gcn', 'hidden_dims': '[256, 128, 64]', 'dropout': 0.35368393572695467, 'batch_norm': True, 'lr': 0.00014123270495724243, 'weight_decay': 5.453691586938707e-05, 'epochs': 341, 'loss': 'mae', 'optimizer': 'adam', 'graph_mode': 'cutoff', 'cutoff': 0.5077716894067111, 'grm_norm': 'none', 'self_loops': False, 'use_snp_selection': False}. Best is trial 47 with value: 0.08946651587739919.
[I 2025-11-03 14:04:14,931] Trial 149 finished with value: 0.026047593517495516 and parameters: {'model_type': 'gcn', 'hidden_dims': '[512, 128]', 'dropout': 0.3306063750337625, 'batch_norm': False, 'lr': 0.00010646747921121342, 'weight_decay': 3.8443229785951824e-07, 'epochs': 319, 'loss': 'mae', 'optimizer': 'adam', 'graph_mode': 'cutoff', 'cutoff': 0.5625026208787172, 'grm_norm': 'none', 'self_loops': True, 'use_snp_selection': True, 'num_snps': 27342}. Best is trial 47 with value: 0.08946651587739919.
[I 2025-11-03 14:04:17,320] Trial 0 finished with value: 0.0032825863586022335 and parameters: {'model_type': 'gcn', 'hidden_dims': '[128, 64]', 'dropout': 0.199031432379812, 'batch_norm': True, 'lr': 1.8408544111075837e-06, 'weight_decay': 5.5136510071208614e-05, 'epochs': 334, 'loss': 'mae', 'optimizer': 'adam', 'graph_mode': 'knn', 'source': 'grm', 'knn_k': 8, 'weighted_edges': True, 'symmetrize_mode': 'mutual', 'use_snp_selection': False}. Best is trial 0 with value: 0.0032825863586022335.
[I 2025-11-03 14:04:18,456] Trial 1 finished with value: 0.03502773789289952 and parameters: {'model_type': 'gcn', 'hidden_dims': '[128, 64]', 'dropout': 0.40051947670227217, 'batch_norm': True, 'lr': 0.0005320428882732732, 'weight_decay': 1.89210117736594e-06, 'epochs': 32, 'loss': 'mse', 'optimizer': 'adam', 'graph_mode': 'knn', 'source': 'grm', 'knn_k': 7, 'weighted_edges': True, 'symmetrize_mode': 'union', 'use_snp_selection': False}. Best is trial 1 with value: 0.03502773789289952.
[I 2025-11-03 14:04:21,060] Trial 2 finished with value: 0.03140842765741637 and parameters: {'model_type': 'gcn', 'hidden_dims': '[256, 128]', 'dropout': 0.5105528289184642, 'batch_norm': False, 'lr': 0.0006804279372404962, 'weight_decay': 0.0008922815224257085, 'epochs': 160, 'loss': 'mse', 'optimizer': 'adam', 'graph_mode': 'cutoff', 'cutoff': 0.5741905641612706, 'grm_norm': 'gcn', 'self_loops': False, 'use_snp_selection': True, 'num_snps': 26910}. Best is trial 1 with value: 0.03502773789289952.
[I 2025-11-03 14:04:23,715] Trial 3 finished with value: 0.030336538711289013 and parameters: {'model_type': 'gcn', 'hidden_dims': '[256, 128, 64]', 'dropout': 0.5390483213624292, 'batch_norm': False, 'lr': 3.4705625989073525e-05, 'weight_decay': 2.4623319020131338e-05, 'epochs': 92, 'loss': 'mse', 'optimizer': 'adam', 'graph_mode': 'knn', 'source': 'grm', 'knn_k': 6, 'weighted_edges': False, 'symmetrize_mode': 'mutual', 'use_snp_selection': True, 'num_snps': 30713}. Best is trial 1 with value: 0.03502773789289952.
[I 2025-11-03 14:04:26,267] Trial 4 finished with value: -0.003511909062136575 and parameters: {'model_type': 'gcn', 'hidden_dims': '[128, 64]', 'dropout': 0.13404863676897502, 'batch_norm': False, 'lr': 0.0001431556295367288, 'weight_decay': 2.2084517750726675e-05, 'epochs': 13, 'loss': 'mae', 'optimizer': 'adam', 'graph_mode': 'cutoff', 'cutoff': 0.6714268476993044, 'grm_norm': 'none', 'self_loops': False, 'use_snp_selection': True, 'num_snps': 45645}. Best is trial 1 with value: 0.03502773789289952.
[I 2025-11-03 14:04:29,408] Trial 5 finished with value: 0.056539950192165546 and parameters: {'model_type': 'gcn', 'hidden_dims': '[256, 128]', 'dropout': 0.42253606323412096, 'batch_norm': False, 'lr': 4.238630400638805e-05, 'weight_decay': 8.074086040046576e-07, 'epochs': 134, 'loss': 'mae', 'optimizer': 'adam', 'graph_mode': 'knn', 'source': 'grm', 'knn_k': 1, 'weighted_edges': False, 'symmetrize_mode': 'mutual', 'use_snp_selection': True, 'num_snps': 43113}. Best is trial 5 with value: 0.056539950192165546.
[I 2025-11-03 14:04:32,597] Trial 6 finished with value: 0.06312623544807393 and parameters: {'model_type': 'gcn', 'hidden_dims': '[512, 256]', 'dropout': 0.3534893146320237, 'batch_norm': True, 'lr': 0.000251307964226932, 'weight_decay': 1.821819791794022e-05, 'epochs': 207, 'loss': 'mae', 'optimizer': 'adam', 'graph_mode': 'knn', 'source': 'grm', 'knn_k': 1, 'weighted_edges': True, 'symmetrize_mode': 'mutual', 'use_snp_selection': False}. Best is trial 6 with value: 0.06312623544807393.
[I 2025-11-03 14:04:35,339] Trial 7 finished with value: 0.07728784515332716 and parameters: {'model_type': 'gcn', 'hidden_dims': '[512, 256]', 'dropout': 0.1105825955860775, 'batch_norm': True, 'lr': 2.374338412754043e-05, 'weight_decay': 1.1284721123340274e-05, 'epochs': 170, 'loss': 'mse', 'optimizer': 'adam', 'graph_mode': 'cutoff', 'cutoff': 0.719872204109604, 'grm_norm': 'gcn', 'self_loops': False, 'use_snp_selection': False}. Best is trial 7 with value: 0.07728784515332716.
[I 2025-11-03 14:04:37,383] Trial 8 finished with value: 0.046739172865516515 and parameters: {'model_type': 'gcn', 'hidden_dims': '[512, 128]', 'dropout': 0.5066580418354021, 'batch_norm': True, 'lr': 0.00039213678276659976, 'weight_decay': 3.43655320802934e-06, 'epochs': 91, 'loss': 'mse', 'optimizer': 'adam', 'graph_mode': 'cutoff', 'cutoff': 0.34923059576505366, 'grm_norm': 'cosine', 'self_loops': True, 'use_snp_selection': False}. Best is trial 7 with value: 0.07728784515332716.
[I 2025-11-03 14:04:39,404] Trial 9 finished with value: 0.06607579839756564 and parameters: {'model_type': 'gcn', 'hidden_dims': '[512, 256]', 'dropout': 0.301734920240333, 'batch_norm': False, 'lr': 6.650961854953448e-06, 'weight_decay': 6.861575656590315e-05, 'epochs': 125, 'loss': 'mae', 'optimizer': 'adam', 'graph_mode': 'cutoff', 'cutoff': 0.2857569870061939, 'grm_norm': 'cosine_then_gcn', 'self_loops': False, 'use_snp_selection': True, 'num_snps': 12722}. Best is trial 7 with value: 0.07728784515332716.
[I 2025-11-03 14:04:43,018] Trial 10 finished with value: -0.002314746577580007 and parameters: {'model_type': 'gcn', 'hidden_dims': '[512, 64]', 'dropout': 0.2491228540815774, 'batch_norm': True, 'lr': 1.080428984628536e-05, 'weight_decay': 1.6060239611529646e-07, 'epochs': 266, 'loss': 'mse', 'optimizer': 'adam', 'graph_mode': 'cutoff', 'cutoff': 0.8740100033033126, 'grm_norm': 'gcn', 'self_loops': True, 'use_snp_selection': False}. Best is trial 7 with value: 0.07728784515332716.
[I 2025-11-03 14:04:45,049] Trial 11 finished with value: 0.015135789147718879 and parameters: {'model_type': 'gcn', 'hidden_dims': '[512, 256]', 'dropout': 0.26952353799202866, 'batch_norm': False, 'lr': 4.693883898332168e-06, 'weight_decay': 0.000141270855536757, 'epochs': 231, 'loss': 'mae', 'optimizer': 'adam', 'graph_mode': 'cutoff', 'cutoff': 0.22041237716623763, 'grm_norm': 'cosine_then_gcn', 'self_loops': False, 'use_snp_selection': True, 'num_snps': 4239}. Best is trial 7 with value: 0.07728784515332716.
[I 2025-11-03 14:04:46,801] Trial 12 finished with value: 0.026749166804128848 and parameters: {'model_type': 'gcn', 'hidden_dims': '[512, 256]', 'dropout': 0.13331441087721543, 'batch_norm': True, 'lr': 1.0211842842699809e-05, 'weight_decay': 0.0002631875969528779, 'epochs': 112, 'loss': 'mae', 'optimizer': 'adam', 'graph_mode': 'cutoff', 'cutoff': 0.7506449451098667, 'grm_norm': 'cosine_then_gcn', 'self_loops': False, 'use_snp_selection': True, 'num_snps': 6176}. Best is trial 7 with value: 0.07728784515332716.
[I 2025-11-03 14:04:49,658] Trial 13 finished with value: 0.020230343207073627 and parameters: {'model_type': 'gcn', 'hidden_dims': '[512, 256]', 'dropout': 0.2715962303148582, 'batch_norm': False, 'lr': 1.326298862732185e-06, 'weight_decay': 6.170619169543884e-06, 'epochs': 183, 'loss': 'mse', 'optimizer': 'adam', 'graph_mode': 'cutoff', 'cutoff': 0.4255627311797853, 'grm_norm': 'cosine_then_gcn', 'self_loops': False, 'use_snp_selection': False}. Best is trial 7 with value: 0.07728784515332716.
[I 2025-11-03 14:04:53,240] Trial 14 finished with value: 0.08074930778243407 and parameters: {'model_type': 'gcn', 'hidden_dims': '[512, 256]', 'dropout': 0.1062256058813002, 'batch_norm': False, 'lr': 8.589510603311415e-05, 'weight_decay': 7.490452595670076e-05, 'epochs': 267, 'loss': 'mse', 'optimizer': 'adam', 'graph_mode': 'cutoff', 'cutoff': 0.5036725632153884, 'grm_norm': 'gcn', 'self_loops': False, 'use_snp_selection': False}. Best is trial 14 with value: 0.08074930778243407.
[I 2025-11-03 14:04:57,100] Trial 15 finished with value: 0.046564135368320145 and parameters: {'model_type': 'gcn', 'hidden_dims': '[512, 64]', 'dropout': 0.10099557212689217, 'batch_norm': True, 'lr': 8.671720671490045e-05, 'weight_decay': 0.0009038765422009597, 'epochs': 292, 'loss': 'mse', 'optimizer': 'adam', 'graph_mode': 'cutoff', 'cutoff': 0.506507847615884, 'grm_norm': 'gcn', 'self_loops': False, 'use_snp_selection': False}. Best is trial 14 with value: 0.08074930778243407.
[I 2025-11-03 14:04:59,863] Trial 16 finished with value: 0.08472591287703489 and parameters: {'model_type': 'gcn', 'hidden_dims': '[256, 128, 64]', 'dropout': 0.17885189440899932, 'batch_norm': True, 'lr': 7.460653704684379e-05, 'weight_decay': 1.004003515000234e-06, 'epochs': 252, 'loss': 'mse', 'optimizer': 'adam', 'graph_mode': 'cutoff', 'cutoff': 0.6569297376451858, 'grm_norm': 'gcn', 'self_loops': True, 'use_snp_selection': False}. Best is trial 16 with value: 0.08472591287703489.
[I 2025-11-03 14:05:03,120] Trial 17 finished with value: 0.10050485197380808 and parameters: {'model_type': 'gcn', 'hidden_dims': '[256, 128, 64]', 'dropout': 0.18912227771875717, 'batch_norm': False, 'lr': 0.00010852510389544578, 'weight_decay': 4.5817280187175797e-07, 'epochs': 342, 'loss': 'mse', 'optimizer': 'adam', 'graph_mode': 'cutoff', 'cutoff': 0.5710252056284084, 'grm_norm': 'gcn', 'self_loops': True, 'use_snp_selection': False}. Best is trial 17 with value: 0.10050485197380808.
[I 2025-11-03 14:05:06,547] Trial 18 finished with value: 0.06919367111409208 and parameters: {'model_type': 'gcn', 'hidden_dims': '[256, 128, 64]', 'dropout': 0.18516121820787293, 'batch_norm': True, 'lr': 0.00016243971368799654, 'weight_decay': 1.7098529118132968e-07, 'epochs': 349, 'loss': 'mse', 'optimizer': 'adam', 'graph_mode': 'cutoff', 'cutoff': 0.6265636881234904, 'grm_norm': 'cosine', 'self_loops': True, 'use_snp_selection': False}. Best is trial 17 with value: 0.10050485197380808.
[I 2025-11-03 14:05:09,580] Trial 19 finished with value: 0.08906308258569617 and parameters: {'model_type': 'gcn', 'hidden_dims': '[256, 128, 64]', 'dropout': 0.21893615854968707, 'batch_norm': False, 'lr': 5.902444856097072e-05, 'weight_decay': 5.429940027497301e-07, 'epochs': 308, 'loss': 'mse', 'optimizer': 'adam', 'graph_mode': 'cutoff', 'cutoff': 0.8283912521362767, 'grm_norm': 'none', 'self_loops': True, 'use_snp_selection': False}. Best is trial 17 with value: 0.10050485197380808.
[I 2025-11-03 14:05:12,594] Trial 20 finished with value: 0.0815368767702728 and parameters: {'model_type': 'gcn', 'hidden_dims': '[256, 128, 64]', 'dropout': 0.21897563708512607, 'batch_norm': False, 'lr': 2.0488321217773427e-05, 'weight_decay': 3.311087068933392e-07, 'epochs': 308, 'loss': 'mse', 'optimizer': 'adam', 'graph_mode': 'cutoff', 'cutoff': 0.8686485130436978, 'grm_norm': 'none', 'self_loops': True, 'use_snp_selection': False}. Best is trial 17 with value: 0.10050485197380808.
