[I 2025-11-03 15:01:01,148] Trial 31 finished with value: 0.08907139532664154 and parameters: {'model_type': 'graphsage', 'hidden_dims': '[512, 64]', 'dropout': 0.16534044017412347, 'batch_norm': True, 'lr': 0.000596939131546255, 'weight_decay': 5.755186574982408e-06, 'epochs': 238, 'loss': 'mse', 'optimizer': 'adam', 'graph_mode': 'cutoff', 'cutoff': 0.8233381862139885, 'grm_norm': 'cosine_then_gcn', 'self_loops': True, 'use_snp_selection': False}. Best is trial 20 with value: 0.10068966775143183.
[I 2025-11-03 15:01:03,214] Trial 32 finished with value: 0.0839370133056057 and parameters: {'model_type': 'graphsage', 'hidden_dims': '[128, 64]', 'dropout': 0.19752097343739577, 'batch_norm': True, 'lr': 0.0005901224803799996, 'weight_decay': 5.448091550447391e-06, 'epochs': 245, 'loss': 'mse', 'optimizer': 'adam', 'graph_mode': 'cutoff', 'cutoff': 0.829903410745741, 'grm_norm': 'cosine_then_gcn', 'self_loops': True, 'use_snp_selection': False}. Best is trial 20 with value: 0.10068966775143183.
[I 2025-11-03 15:01:06,925] Trial 33 finished with value: 0.0841072162215894 and parameters: {'model_type': 'graphsage', 'hidden_dims': '[512, 64]', 'dropout': 0.1387494521639348, 'batch_norm': True, 'lr': 0.0005171463429587194, 'weight_decay': 1.8114781168494046e-06, 'epochs': 205, 'loss': 'mse', 'optimizer': 'adam', 'graph_mode': 'cutoff', 'cutoff': 0.6418556431305991, 'grm_norm': 'cosine_then_gcn', 'self_loops': True, 'use_snp_selection': False}. Best is trial 20 with value: 0.10068966775143183.
[I 2025-11-03 15:01:09,139] Trial 34 finished with value: 0.08925017761917255 and parameters: {'model_type': 'graphsage', 'hidden_dims': '[256, 128]', 'dropout': 0.24957766105045603, 'batch_norm': True, 'lr': 0.000980387796164813, 'weight_decay': 7.199252255958424e-07, 'epochs': 133, 'loss': 'mse', 'optimizer': 'adam', 'graph_mode': 'knn', 'source': 'grm', 'knn_k': 4, 'weighted_edges': True, 'symmetrize_mode': 'union', 'use_snp_selection': False}. Best is trial 20 with value: 0.10068966775143183.
[I 2025-11-03 15:01:10,533] Trial 35 finished with value: 0.045316256570025054 and parameters: {'model_type': 'graphsage', 'hidden_dims': '[256, 128]', 'dropout': 0.35254414787958327, 'batch_norm': False, 'lr': 0.0009564407595029783, 'weight_decay': 6.809201630529157e-07, 'epochs': 90, 'loss': 'mse', 'optimizer': 'adam', 'graph_mode': 'knn', 'source': 'grm', 'knn_k': 4, 'weighted_edges': True, 'symmetrize_mode': 'union', 'use_snp_selection': True, 'num_snps': 2074}. Best is trial 20 with value: 0.10068966775143183.
[I 2025-11-03 15:01:12,827] Trial 36 finished with value: 0.0837726864638728 and parameters: {'model_type': 'graphsage', 'hidden_dims': '[256, 128]', 'dropout': 0.26223155735734405, 'batch_norm': True, 'lr': 0.00021238098253403622, 'weight_decay': 1.0239979696233885e-06, 'epochs': 141, 'loss': 'mse', 'optimizer': 'adam', 'graph_mode': 'knn', 'source': 'grm', 'knn_k': 3, 'weighted_edges': True, 'symmetrize_mode': 'union', 'use_snp_selection': False}. Best is trial 20 with value: 0.10068966775143183.
[I 2025-11-03 15:01:14,966] Trial 37 finished with value: 0.06503324404674143 and parameters: {'model_type': 'graphsage', 'hidden_dims': '[256, 128]', 'dropout': 0.24466295513076178, 'batch_norm': False, 'lr': 0.00043744240370334584, 'weight_decay': 2.0942342376380329e-07, 'epochs': 176, 'loss': 'mae', 'optimizer': 'adam', 'graph_mode': 'knn', 'source': 'grm', 'knn_k': 3, 'weighted_edges': True, 'symmetrize_mode': 'union', 'use_snp_selection': True, 'num_snps': 15344}. Best is trial 20 with value: 0.10068966775143183.
[I 2025-11-03 15:01:17,313] Trial 38 finished with value: 0.06806484475965997 and parameters: {'model_type': 'graphsage', 'hidden_dims': '[256, 128, 64]', 'dropout': 0.20183978081718168, 'batch_norm': True, 'lr': 5.932237204141354e-05, 'weight_decay': 5.075024467781556e-07, 'epochs': 99, 'loss': 'mse', 'optimizer': 'adam', 'graph_mode': 'knn', 'source': 'grm', 'knn_k': 10, 'weighted_edges': True, 'symmetrize_mode': 'union', 'use_snp_selection': False}. Best is trial 20 with value: 0.10068966775143183.
[I 2025-11-03 15:01:21,463] Trial 39 finished with value: -0.004325171986857409 and parameters: {'model_type': 'graphsage', 'hidden_dims': '[256, 128]', 'dropout': 0.12353203171085642, 'batch_norm': False, 'lr': 0.0007038468269975856, 'weight_decay': 0.0006513368993264923, 'epochs': 139, 'loss': 'mse', 'optimizer': 'adam', 'graph_mode': 'knn', 'source': 'grm', 'knn_k': 8, 'weighted_edges': True, 'symmetrize_mode': 'union', 'use_snp_selection': True, 'num_snps': 58379}. Best is trial 20 with value: 0.10068966775143183.
[I 2025-11-03 15:01:22,959] Trial 40 finished with value: 0.07741975283081534 and parameters: {'model_type': 'graphsage', 'hidden_dims': '[128, 64]', 'dropout': 0.3263538723567323, 'batch_norm': True, 'lr': 0.00018967435955558016, 'weight_decay': 1.5771845379648165e-06, 'epochs': 63, 'loss': 'mae', 'optimizer': 'adam', 'graph_mode': 'knn', 'source': 'grm', 'knn_k': 3, 'weighted_edges': False, 'symmetrize_mode': 'mutual', 'use_snp_selection': False}. Best is trial 20 with value: 0.10068966775143183.
[I 2025-11-03 15:01:26,498] Trial 41 finished with value: 0.08588079442665253 and parameters: {'model_type': 'graphsage', 'hidden_dims': '[512, 64]', 'dropout': 0.16654767836475037, 'batch_norm': True, 'lr': 0.0006657649016370635, 'weight_decay': 9.23146552727559e-06, 'epochs': 185, 'loss': 'mse', 'optimizer': 'adam', 'graph_mode': 'cutoff', 'cutoff': 0.8951967524091295, 'grm_norm': 'cosine_then_gcn', 'self_loops': True, 'use_snp_selection': False}. Best is trial 20 with value: 0.10068966775143183.
[I 2025-11-03 15:01:30,289] Trial 42 finished with value: 0.08127394267055861 and parameters: {'model_type': 'graphsage', 'hidden_dims': '[512, 256]', 'dropout': 0.13294822700135012, 'batch_norm': True, 'lr': 0.00030816319686152705, 'weight_decay': 3.339174584816727e-06, 'epochs': 213, 'loss': 'mse', 'optimizer': 'adam', 'graph_mode': 'cutoff', 'cutoff': 0.7574660653255281, 'grm_norm': 'cosine_then_gcn', 'self_loops': True, 'use_snp_selection': False}. Best is trial 20 with value: 0.10068966775143183.
[I 2025-11-03 15:01:33,108] Trial 43 finished with value: 0.07168904818406331 and parameters: {'model_type': 'graphsage', 'hidden_dims': '[256, 128]', 'dropout': 0.2799211755534325, 'batch_norm': True, 'lr': 0.0007296691237453778, 'weight_decay': 9.457421561394754e-07, 'epochs': 234, 'loss': 'mse', 'optimizer': 'adam', 'graph_mode': 'knn', 'source': 'grm', 'knn_k': 5, 'weighted_edges': True, 'symmetrize_mode': 'union', 'use_snp_selection': False}. Best is trial 20 with value: 0.10068966775143183.
[I 2025-11-03 15:01:36,448] Trial 44 finished with value: 0.09186177276171514 and parameters: {'model_type': 'graphsage', 'hidden_dims': '[512, 64]', 'dropout': 0.1797668860369315, 'batch_norm': True, 'lr': 0.00047001724465384323, 'weight_decay': 2.8766591148662978e-05, 'epochs': 165, 'loss': 'mse', 'optimizer': 'adam', 'graph_mode': 'cutoff', 'cutoff': 0.8434501884720846, 'grm_norm': 'cosine_then_gcn', 'self_loops': True, 'use_snp_selection': False}. Best is trial 20 with value: 0.10068966775143183.
[I 2025-11-03 15:01:38,464] Trial 45 finished with value: 0.0827981010385637 and parameters: {'model_type': 'graphsage', 'hidden_dims': '[256, 128, 64]', 'dropout': 0.20354883612410182, 'batch_norm': True, 'lr': 0.0004411888516143491, 'weight_decay': 2.4121709133918604e-05, 'epochs': 117, 'loss': 'mse', 'optimizer': 'adam', 'graph_mode': 'cutoff', 'cutoff': 0.8550159318253477, 'grm_norm': 'gcn', 'self_loops': False, 'use_snp_selection': False}. Best is trial 20 with value: 0.10068966775143183.
[I 2025-11-03 15:01:41,849] Trial 46 finished with value: 0.04833110127358062 and parameters: {'model_type': 'graphsage', 'hidden_dims': '[512, 64]', 'dropout': 0.18589170345825434, 'batch_norm': True, 'lr': 1.651797452058301e-05, 'weight_decay': 4.002329147867931e-05, 'epochs': 169, 'loss': 'mse', 'optimizer': 'adam', 'graph_mode': 'cutoff', 'cutoff': 0.6328479986843811, 'grm_norm': 'gcn', 'self_loops': True, 'use_snp_selection': False}. Best is trial 20 with value: 0.10068966775143183.
[I 2025-11-03 15:01:43,770] Trial 47 finished with value: 0.07216059469875703 and parameters: {'model_type': 'graphsage', 'hidden_dims': '[128, 64]', 'dropout': 0.14738372226816077, 'batch_norm': True, 'lr': 0.00016331147730572248, 'weight_decay': 1.5672875045939976e-05, 'epochs': 193, 'loss': 'mse', 'optimizer': 'adam', 'graph_mode': 'knn', 'source': 'grm', 'knn_k': 2, 'weighted_edges': True, 'symmetrize_mode': 'union', 'use_snp_selection': False}. Best is trial 20 with value: 0.10068966775143183.
[I 2025-11-03 15:01:46,874] Trial 48 finished with value: 0.07596940730479029 and parameters: {'model_type': 'graphsage', 'hidden_dims': '[256, 128]', 'dropout': 0.3847929068997826, 'batch_norm': False, 'lr': 0.0009943142099424198, 'weight_decay': 0.00011923931690653547, 'epochs': 152, 'loss': 'mae', 'optimizer': 'adam', 'graph_mode': 'cutoff', 'cutoff': 0.7583088887426845, 'grm_norm': 'cosine_then_gcn', 'self_loops': False, 'use_snp_selection': True, 'num_snps': 42595}. Best is trial 20 with value: 0.10068966775143183.
[I 2025-11-03 15:01:50,011] Trial 49 finished with value: 0.029311172053168206 and parameters: {'model_type': 'graphsage', 'hidden_dims': '[512, 256]', 'dropout': 0.2226433166906272, 'batch_norm': True, 'lr': 3.824619144218153e-06, 'weight_decay': 3.655279424253671e-05, 'epochs': 131, 'loss': 'mse', 'optimizer': 'adam', 'graph_mode': 'cutoff', 'cutoff': 0.7189485302120828, 'grm_norm': 'cosine_then_gcn', 'self_loops': True, 'use_snp_selection': False}. Best is trial 20 with value: 0.10068966775143183.
[I 2025-11-03 15:01:54,171] Trial 50 finished with value: 0.09343537531485352 and parameters: {'model_type': 'graphsage', 'hidden_dims': '[512, 64]', 'dropout': 0.24392083676645684, 'batch_norm': True, 'lr': 0.00027833065973291465, 'weight_decay': 4.0480028651240147e-07, 'epochs': 259, 'loss': 'mse', 'optimizer': 'adam', 'graph_mode': 'cutoff', 'cutoff': 0.6031442931533557, 'grm_norm': 'gcn', 'self_loops': False, 'use_snp_selection': False}. Best is trial 20 with value: 0.10068966775143183.
[I 2025-11-03 15:01:58,345] Trial 51 finished with value: 0.08558431560099707 and parameters: {'model_type': 'graphsage', 'hidden_dims': '[512, 64]', 'dropout': 0.23352556459934617, 'batch_norm': True, 'lr': 0.0002852066197310901, 'weight_decay': 1.9077792808914706e-07, 'epochs': 262, 'loss': 'mse', 'optimizer': 'adam', 'graph_mode': 'cutoff', 'cutoff': 0.601863502657861, 'grm_norm': 'gcn', 'self_loops': False, 'use_snp_selection': False}. Best is trial 20 with value: 0.10068966775143183.
[I 2025-11-03 15:02:01,679] Trial 52 finished with value: 0.07341769851223848 and parameters: {'model_type': 'graphsage', 'hidden_dims': '[512, 64]', 'dropout': 0.2637362250736864, 'batch_norm': True, 'lr': 0.0007118213287179827, 'weight_decay': 4.5105245577158933e-07, 'epochs': 160, 'loss': 'mse', 'optimizer': 'adam', 'graph_mode': 'cutoff', 'cutoff': 0.8698582619525923, 'grm_norm': 'gcn', 'self_loops': False, 'use_snp_selection': False}. Best is trial 20 with value: 0.10068966775143183.
[I 2025-11-03 15:02:06,039] Trial 53 finished with value: 0.08215969746468346 and parameters: {'model_type': 'graphsage', 'hidden_dims': '[512, 64]', 'dropout': 0.18364757795798342, 'batch_norm': True, 'lr': 0.00041894205951236666, 'weight_decay': 4.2534142016882795e-07, 'epochs': 286, 'loss': 'mse', 'optimizer': 'adam', 'graph_mode': 'cutoff', 'cutoff': 0.7781405428652722, 'grm_norm': 'gcn', 'self_loops': False, 'use_snp_selection': False}. Best is trial 20 with value: 0.10068966775143183.
[I 2025-11-03 15:02:10,134] Trial 54 finished with value: 0.08815044499259729 and parameters: {'model_type': 'graphsage', 'hidden_dims': '[512, 64]', 'dropout': 0.12177310654606743, 'batch_norm': True, 'lr': 0.0007856883414490091, 'weight_decay': 2.240487754121848e-06, 'epochs': 253, 'loss': 'mse', 'optimizer': 'adam', 'graph_mode': 'cutoff', 'cutoff': 0.8416149602828789, 'grm_norm': 'gcn', 'self_loops': False, 'use_snp_selection': False}. Best is trial 20 with value: 0.10068966775143183.
[I 2025-11-03 15:02:14,554] Trial 55 finished with value: 0.07762415575474836 and parameters: {'model_type': 'graphsage', 'hidden_dims': '[512, 64]', 'dropout': 0.24416710675410072, 'batch_norm': True, 'lr': 0.0004982414315481065, 'weight_decay': 7.428230434077944e-07, 'epochs': 291, 'loss': 'mse', 'optimizer': 'adam', 'graph_mode': 'cutoff', 'cutoff': 0.6857849744227992, 'grm_norm': 'cosine_then_gcn', 'self_loops': False, 'use_snp_selection': False}. Best is trial 20 with value: 0.10068966775143183.
[I 2025-11-03 15:02:17,510] Trial 56 finished with value: 0.08256275350653337 and parameters: {'model_type': 'graphsage', 'hidden_dims': '[512, 64]', 'dropout': 0.2151668979925781, 'batch_norm': True, 'lr': 2.8447836518732854e-05, 'weight_decay': 2.320558456130873e-07, 'epochs': 102, 'loss': 'mse', 'optimizer': 'adam', 'graph_mode': 'cutoff', 'cutoff': 0.3542010312882723, 'grm_norm': 'cosine_then_gcn', 'self_loops': False, 'use_snp_selection': False}. Best is trial 20 with value: 0.10068966775143183.
[I 2025-11-03 15:02:20,051] Trial 57 finished with value: 0.09049003618121626 and parameters: {'model_type': 'graphsage', 'hidden_dims': '[256, 128, 64]', 'dropout': 0.32887431707017756, 'batch_norm': True, 'lr': 0.00032881106797248835, 'weight_decay': 3.2305699982797444e-07, 'epochs': 216, 'loss': 'mse', 'optimizer': 'adam', 'graph_mode': 'cutoff', 'cutoff': 0.504553966158723, 'grm_norm': 'gcn', 'self_loops': True, 'use_snp_selection': False}. Best is trial 20 with value: 0.10068966775143183.
[I 2025-11-03 15:02:22,609] Trial 58 finished with value: 0.0704448397364691 and parameters: {'model_type': 'graphsage', 'hidden_dims': '[256, 128, 64]', 'dropout': 0.38399864428546654, 'batch_norm': True, 'lr': 0.00015048101585544404, 'weight_decay': 3.564374696380391e-07, 'epochs': 218, 'loss': 'mse', 'optimizer': 'adam', 'graph_mode': 'cutoff', 'cutoff': 0.5110742692974428, 'grm_norm': 'gcn', 'self_loops': True, 'use_snp_selection': False}. Best is trial 20 with value: 0.10068966775143183.
[I 2025-11-03 15:02:25,407] Trial 59 finished with value: 0.067002543837887 and parameters: {'model_type': 'graphsage', 'hidden_dims': '[256, 128, 64]', 'dropout': 0.4368091399693937, 'batch_norm': True, 'lr': 7.884641643959247e-05, 'weight_decay': 1.6605351977019379e-07, 'epochs': 267, 'loss': 'mse', 'optimizer': 'adam', 'graph_mode': 'cutoff', 'cutoff': 0.437164564467897, 'grm_norm': 'gcn', 'self_loops': True, 'use_snp_selection': False}. Best is trial 20 with value: 0.10068966775143183.
[I 2025-11-03 15:02:27,966] Trial 60 finished with value: 0.068209145826541 and parameters: {'model_type': 'graphsage', 'hidden_dims': '[256, 128, 64]', 'dropout': 0.3170485033433998, 'batch_norm': False, 'lr': 0.0003314512145327232, 'weight_decay': 1.1850971493680596e-06, 'epochs': 198, 'loss': 'mae', 'optimizer': 'adam', 'graph_mode': 'cutoff', 'cutoff': 0.526691700493617, 'grm_norm': 'gcn', 'self_loops': True, 'use_snp_selection': True, 'num_snps': 19019}. Best is trial 20 with value: 0.10068966775143183.
[I 2025-11-03 15:02:30,564] Trial 61 finished with value: 0.05933892713809849 and parameters: {'model_type': 'graphsage', 'hidden_dims': '[256, 128, 64]', 'dropout': 0.29107916689423696, 'batch_norm': True, 'lr': 0.00023722023437324744, 'weight_decay': 6.368937934564207e-07, 'epochs': 232, 'loss': 'mse', 'optimizer': 'adam', 'graph_mode': 'cutoff', 'cutoff': 0.5919417474615061, 'grm_norm': 'gcn', 'self_loops': True, 'use_snp_selection': False}. Best is trial 20 with value: 0.10068966775143183.
[I 2025-11-03 15:02:34,287] Trial 62 finished with value: 0.08562569063838496 and parameters: {'model_type': 'graphsage', 'hidden_dims': '[512, 64]', 'dropout': 0.10030798359434878, 'batch_norm': True, 'lr': 0.00038524213674780416, 'weight_decay': 3.118418363648342e-07, 'epochs': 203, 'loss': 'mse', 'optimizer': 'adam', 'graph_mode': 'cutoff', 'cutoff': 0.364355882262394, 'grm_norm': 'none', 'self_loops': True, 'use_snp_selection': False}. Best is trial 20 with value: 0.10068966775143183.
[I 2025-11-03 15:02:38,384] Trial 63 finished with value: 0.07432768847524371 and parameters: {'model_type': 'graphsage', 'hidden_dims': '[512, 256]', 'dropout': 0.20140849357317042, 'batch_norm': True, 'lr': 0.0008159552293253785, 'weight_decay': 1.1995380123175082e-07, 'epochs': 253, 'loss': 'mse', 'optimizer': 'adam', 'graph_mode': 'cutoff', 'cutoff': 0.870154023947135, 'grm_norm': 'cosine_then_gcn', 'self_loops': True, 'use_snp_selection': False}. Best is trial 20 with value: 0.10068966775143183.
[I 2025-11-03 15:02:41,978] Trial 64 finished with value: 0.07165090570060738 and parameters: {'model_type': 'graphsage', 'hidden_dims': '[512, 64]', 'dropout': 0.17552635554029727, 'batch_norm': True, 'lr': 0.0006355802589653669, 'weight_decay': 7.94660675011301e-07, 'epochs': 183, 'loss': 'mse', 'optimizer': 'adam', 'graph_mode': 'cutoff', 'cutoff': 0.3088776633750079, 'grm_norm': 'cosine', 'self_loops': True, 'use_snp_selection': False}. Best is trial 20 with value: 0.10068966775143183.
[I 2025-11-03 15:02:46,218] Trial 65 finished with value: 0.09076731078352974 and parameters: {'model_type': 'graphsage', 'hidden_dims': '[512, 128]', 'dropout': 0.3372938420633981, 'batch_norm': True, 'lr': 0.0005217784230784297, 'weight_decay': 2.520262194129683e-06, 'epochs': 276, 'loss': 'mse', 'optimizer': 'adam', 'graph_mode': 'cutoff', 'cutoff': 0.49604057035575294, 'grm_norm': 'none', 'self_loops': True, 'use_snp_selection': False}. Best is trial 20 with value: 0.10068966775143183.
[I 2025-11-03 15:02:50,486] Trial 66 finished with value: 0.07729222316919816 and parameters: {'model_type': 'graphsage', 'hidden_dims': '[512, 128]', 'dropout': 0.3436659374028077, 'batch_norm': True, 'lr': 4.472043267055695e-05, 'weight_decay': 2.373232988860042e-06, 'epochs': 274, 'loss': 'mse', 'optimizer': 'adam', 'graph_mode': 'cutoff', 'cutoff': 0.4680418489692798, 'grm_norm': 'none', 'self_loops': True, 'use_snp_selection': False}. Best is trial 20 with value: 0.10068966775143183.
[I 2025-11-03 15:02:54,301] Trial 67 finished with value: 0.06918212679803269 and parameters: {'model_type': 'graphsage', 'hidden_dims': '[512, 128]', 'dropout': 0.3371823692891704, 'batch_norm': True, 'lr': 0.0005077727020935035, 'weight_decay': 4.174634918652964e-06, 'epochs': 220, 'loss': 'mse', 'optimizer': 'adam', 'graph_mode': 'cutoff', 'cutoff': 0.5322082784323761, 'grm_norm': 'none', 'self_loops': True, 'use_snp_selection': False}. Best is trial 20 with value: 0.10068966775143183.
[I 2025-11-03 15:02:58,652] Trial 68 finished with value: 0.07402432843850376 and parameters: {'model_type': 'graphsage', 'hidden_dims': '[512, 128]', 'dropout': 0.3720852705213357, 'batch_norm': True, 'lr': 0.0002771009057096967, 'weight_decay': 9.974682934450256e-06, 'epochs': 282, 'loss': 'mse', 'optimizer': 'adam', 'graph_mode': 'cutoff', 'cutoff': 0.42990583141101435, 'grm_norm': 'none', 'self_loops': True, 'use_snp_selection': False}. Best is trial 20 with value: 0.10068966775143183.
[I 2025-11-03 15:03:02,696] Trial 69 finished with value: 0.06188564569308533 and parameters: {'model_type': 'graphsage', 'hidden_dims': '[512, 128]', 'dropout': 0.4185709477426973, 'batch_norm': True, 'lr': 0.00038564268987395945, 'weight_decay': 1.4740315689602105e-06, 'epochs': 245, 'loss': 'mse', 'optimizer': 'adam', 'graph_mode': 'cutoff', 'cutoff': 0.4866952075139726, 'grm_norm': 'none', 'self_loops': True, 'use_snp_selection': False}. Best is trial 20 with value: 0.10068966775143183.
[I 2025-11-03 15:03:07,225] Trial 70 finished with value: 0.08947395677404753 and parameters: {'model_type': 'graphsage', 'hidden_dims': '[512, 64]', 'dropout': 0.1518848456445044, 'batch_norm': True, 'lr': 0.0005714312901296996, 'weight_decay': 1.4523769131792575e-05, 'epochs': 308, 'loss': 'mse', 'optimizer': 'adam', 'graph_mode': 'cutoff', 'cutoff': 0.8902342184130894, 'grm_norm': 'cosine_then_gcn', 'self_loops': True, 'use_snp_selection': False}. Best is trial 20 with value: 0.10068966775143183.
[I 2025-11-03 15:03:11,900] Trial 71 finished with value: 0.08502177669683063 and parameters: {'model_type': 'graphsage', 'hidden_dims': '[512, 64]', 'dropout': 0.1507900041568116, 'batch_norm': True, 'lr': 0.0005924839729400024, 'weight_decay': 3.379077674335038e-05, 'epochs': 326, 'loss': 'mse', 'optimizer': 'adam', 'graph_mode': 'cutoff', 'cutoff': 0.8988347707674939, 'grm_norm': 'cosine_then_gcn', 'self_loops': True, 'use_snp_selection': False}. Best is trial 20 with value: 0.10068966775143183.
[I 2025-11-03 15:03:16,462] Trial 72 finished with value: 0.0734088353827496 and parameters: {'model_type': 'graphsage', 'hidden_dims': '[512, 64]', 'dropout': 0.1407800096519104, 'batch_norm': True, 'lr': 0.00047797400140328747, 'weight_decay': 1.9461553274050895e-05, 'epochs': 309, 'loss': 'mse', 'optimizer': 'adam', 'graph_mode': 'cutoff', 'cutoff': 0.5595192188802122, 'grm_norm': 'cosine_then_gcn', 'self_loops': True, 'use_snp_selection': False}. Best is trial 20 with value: 0.10068966775143183.
[I 2025-11-03 15:03:21,312] Trial 73 finished with value: 0.0882585549196888 and parameters: {'model_type': 'graphsage', 'hidden_dims': '[512, 64]', 'dropout': 0.1639366966427809, 'batch_norm': True, 'lr': 0.0008381992403963119, 'weight_decay': 1.3806575410317792e-05, 'epochs': 350, 'loss': 'mse', 'optimizer': 'adam', 'graph_mode': 'cutoff', 'cutoff': 0.8241137153589364, 'grm_norm': 'cosine_then_gcn', 'self_loops': True, 'use_snp_selection': False}. Best is trial 20 with value: 0.10068966775143183.
