[I 2025-11-03 13:12:21,633] Trial 103 finished with value: 0.12467938648733114 and parameters: {'model_type': 'graphsage', 'hidden_dims': '[512, 64]', 'dropout': 0.1133559710961183, 'batch_norm': True, 'lr': 0.0006375743078836031, 'weight_decay': 1.0106824361425066e-07, 'epochs': 57, 'loss': 'mse', 'optimizer': 'adam', 'graph_mode': 'cutoff', 'cutoff': 0.6115452756088041, 'grm_norm': 'cosine', 'self_loops': True, 'use_snp_selection': False}. Best is trial 72 with value: 0.1443334714521971.
[I 2025-11-03 13:12:26,305] Trial 104 finished with value: 0.11529356808611703 and parameters: {'model_type': 'graphsage', 'hidden_dims': '[512, 256]', 'dropout': 0.28110418255129294, 'batch_norm': True, 'lr': 0.000337448174287772, 'weight_decay': 2.0135012858868073e-06, 'epochs': 324, 'loss': 'mse', 'optimizer': 'adam', 'graph_mode': 'cutoff', 'cutoff': 0.30749510120864626, 'grm_norm': 'cosine', 'self_loops': False, 'use_snp_selection': False}. Best is trial 72 with value: 0.1443334714521971.
[I 2025-11-03 13:12:29,480] Trial 105 finished with value: 0.12626411340780186 and parameters: {'model_type': 'graphsage', 'hidden_dims': '[512, 128]', 'dropout': 0.32107339109439587, 'batch_norm': True, 'lr': 0.00015986396065450023, 'weight_decay': 3.3513338308980643e-06, 'epochs': 144, 'loss': 'mae', 'optimizer': 'adam', 'graph_mode': 'cutoff', 'cutoff': 0.5107351750229302, 'grm_norm': 'cosine', 'self_loops': True, 'use_snp_selection': False}. Best is trial 72 with value: 0.1443334714521971.
[I 2025-11-03 13:12:31,675] Trial 106 finished with value: 0.11036781674007096 and parameters: {'model_type': 'graphsage', 'hidden_dims': '[256, 128]', 'dropout': 0.18863227034068966, 'batch_norm': True, 'lr': 0.00045634077153718224, 'weight_decay': 2.5194921805682712e-06, 'epochs': 170, 'loss': 'mse', 'optimizer': 'adam', 'graph_mode': 'cutoff', 'cutoff': 0.6862364545741648, 'grm_norm': 'gcn', 'self_loops': True, 'use_snp_selection': False}. Best is trial 72 with value: 0.1443334714521971.
[I 2025-11-03 13:12:37,566] Trial 107 finished with value: 0.020881212173064274 and parameters: {'model_type': 'graphsage', 'hidden_dims': '[512, 256]', 'dropout': 0.22879491626302334, 'batch_norm': False, 'lr': 0.000983749478014446, 'weight_decay': 4.509791611710461e-06, 'epochs': 337, 'loss': 'mse', 'optimizer': 'adam', 'graph_mode': 'knn', 'source': 'grm', 'knn_k': 6, 'weighted_edges': False, 'symmetrize_mode': 'union', 'use_snp_selection': True, 'num_snps': 49946}. Best is trial 72 with value: 0.1443334714521971.
[I 2025-11-03 13:12:42,333] Trial 108 finished with value: 0.11574801266929056 and parameters: {'model_type': 'graphsage', 'hidden_dims': '[512, 128]', 'dropout': 0.15045829830375246, 'batch_norm': True, 'lr': 0.0002503531244752397, 'weight_decay': 9.240310447016986e-07, 'epochs': 344, 'loss': 'mse', 'optimizer': 'adam', 'graph_mode': 'cutoff', 'cutoff': 0.4542590632654995, 'grm_norm': 'cosine', 'self_loops': False, 'use_snp_selection': False}. Best is trial 72 with value: 0.1443334714521971.
[I 2025-11-03 13:12:43,931] Trial 109 finished with value: 0.10459047964386184 and parameters: {'model_type': 'graphsage', 'hidden_dims': '[128, 64]', 'dropout': 0.2423894745248903, 'batch_norm': True, 'lr': 7.359859671415168e-05, 'weight_decay': 1.2802363986061988e-06, 'epochs': 100, 'loss': 'mse', 'optimizer': 'adam', 'graph_mode': 'cutoff', 'cutoff': 0.3368604347398521, 'grm_norm': 'cosine_then_gcn', 'self_loops': True, 'use_snp_selection': False}. Best is trial 72 with value: 0.1443334714521971.
[I 2025-11-03 13:12:46,275] Trial 110 finished with value: 0.12443458675013283 and parameters: {'model_type': 'graphsage', 'hidden_dims': '[512, 64]', 'dropout': 0.3421303021836341, 'batch_norm': True, 'lr': 0.00038121037147441405, 'weight_decay': 1.78888936716365e-05, 'epochs': 41, 'loss': 'mae', 'optimizer': 'adam', 'graph_mode': 'cutoff', 'cutoff': 0.5490239155094928, 'grm_norm': 'cosine', 'self_loops': True, 'use_snp_selection': False}. Best is trial 72 with value: 0.1443334714521971.
[I 2025-11-03 13:12:48,608] Trial 111 finished with value: 0.141213974083319 and parameters: {'model_type': 'graphsage', 'hidden_dims': '[512, 64]', 'dropout': 0.1768880666021276, 'batch_norm': True, 'lr': 0.000707892528504904, 'weight_decay': 4.077992029601894e-07, 'epochs': 40, 'loss': 'mse', 'optimizer': 'adam', 'graph_mode': 'cutoff', 'cutoff': 0.5796438950678358, 'grm_norm': 'cosine', 'self_loops': True, 'use_snp_selection': False}. Best is trial 72 with value: 0.1443334714521971.
[I 2025-11-03 13:12:51,023] Trial 112 finished with value: 0.12838522441839692 and parameters: {'model_type': 'graphsage', 'hidden_dims': '[512, 64]', 'dropout': 0.20535202552356413, 'batch_norm': True, 'lr': 0.0007284021106893877, 'weight_decay': 2.4329611898872416e-07, 'epochs': 45, 'loss': 'mse', 'optimizer': 'adam', 'graph_mode': 'cutoff', 'cutoff': 0.5757090020288281, 'grm_norm': 'cosine', 'self_loops': True, 'use_snp_selection': False}. Best is trial 72 with value: 0.1443334714521971.
[I 2025-11-03 13:12:53,592] Trial 113 finished with value: 0.10461695388137932 and parameters: {'model_type': 'graphsage', 'hidden_dims': '[512, 64]', 'dropout': 0.17514355276862217, 'batch_norm': True, 'lr': 0.000641122703305942, 'weight_decay': 3.5193002003616375e-06, 'epochs': 64, 'loss': 'mse', 'optimizer': 'adam', 'graph_mode': 'cutoff', 'cutoff': 0.596683459018383, 'grm_norm': 'cosine', 'self_loops': True, 'use_snp_selection': False}. Best is trial 72 with value: 0.1443334714521971.
[I 2025-11-03 13:12:56,091] Trial 114 finished with value: 0.12362141765909124 and parameters: {'model_type': 'graphsage', 'hidden_dims': '[512, 64]', 'dropout': 0.12983181318173426, 'batch_norm': True, 'lr': 0.0002039972433971247, 'weight_decay': 4.194601794284253e-07, 'epochs': 57, 'loss': 'mse', 'optimizer': 'adam', 'graph_mode': 'cutoff', 'cutoff': 0.6315462818463196, 'grm_norm': 'cosine', 'self_loops': True, 'use_snp_selection': False}. Best is trial 72 with value: 0.1443334714521971.
[I 2025-11-03 13:12:58,828] Trial 115 finished with value: 0.12188839463259088 and parameters: {'model_type': 'graphsage', 'hidden_dims': '[256, 128]', 'dropout': 0.25643505509164266, 'batch_norm': True, 'lr': 0.000500225616957949, 'weight_decay': 3.303470224027158e-07, 'epochs': 305, 'loss': 'mse', 'optimizer': 'adam', 'graph_mode': 'cutoff', 'cutoff': 0.52843448648298, 'grm_norm': 'cosine', 'self_loops': False, 'use_snp_selection': False}. Best is trial 72 with value: 0.1443334714521971.
[I 2025-11-03 13:13:01,468] Trial 116 finished with value: 0.1241746892412842 and parameters: {'model_type': 'graphsage', 'hidden_dims': '[512, 256]', 'dropout': 0.18613584020551271, 'batch_norm': True, 'lr': 0.0007833775074663046, 'weight_decay': 1.8079871082838716e-06, 'epochs': 72, 'loss': 'mse', 'optimizer': 'adam', 'graph_mode': 'cutoff', 'cutoff': 0.37203510807367657, 'grm_norm': 'cosine', 'self_loops': True, 'use_snp_selection': False}. Best is trial 72 with value: 0.1443334714521971.
[I 2025-11-03 13:13:05,310] Trial 117 finished with value: 0.13251280385115213 and parameters: {'model_type': 'graphsage', 'hidden_dims': '[512, 128]', 'dropout': 0.1435808640495436, 'batch_norm': True, 'lr': 0.0005591740262966209, 'weight_decay': 1.5002839223867321e-06, 'epochs': 217, 'loss': 'mse', 'optimizer': 'adam', 'graph_mode': 'cutoff', 'cutoff': 0.5518933847759774, 'grm_norm': 'cosine', 'self_loops': True, 'use_snp_selection': False}. Best is trial 72 with value: 0.1443334714521971.
[I 2025-11-03 13:13:09,074] Trial 118 finished with value: 0.13105443799596245 and parameters: {'model_type': 'graphsage', 'hidden_dims': '[512, 64]', 'dropout': 0.14108247831731086, 'batch_norm': True, 'lr': 0.0005401234141891373, 'weight_decay': 1.1433811851555688e-06, 'epochs': 217, 'loss': 'mse', 'optimizer': 'adam', 'graph_mode': 'cutoff', 'cutoff': 0.5542288243451202, 'grm_norm': 'cosine', 'self_loops': True, 'use_snp_selection': False}. Best is trial 72 with value: 0.1443334714521971.
[I 2025-11-03 13:13:12,903] Trial 119 finished with value: 0.09549790474385486 and parameters: {'model_type': 'graphsage', 'hidden_dims': '[512, 128]', 'dropout': 0.11951347905077983, 'batch_norm': True, 'lr': 2.3046530994604e-05, 'weight_decay': 1.4783956408221952e-06, 'epochs': 230, 'loss': 'mse', 'optimizer': 'adam', 'graph_mode': 'cutoff', 'cutoff': 0.572487561940397, 'grm_norm': 'none', 'self_loops': True, 'use_snp_selection': False}. Best is trial 72 with value: 0.1443334714521971.
[I 2025-11-03 13:13:15,298] Trial 120 finished with value: 0.10687369949191884 and parameters: {'model_type': 'graphsage', 'hidden_dims': '[256, 128, 64]', 'dropout': 0.16383101303522354, 'batch_norm': True, 'lr': 0.00012083944156344337, 'weight_decay': 9.683576881205253e-07, 'epochs': 190, 'loss': 'mse', 'optimizer': 'adam', 'graph_mode': 'cutoff', 'cutoff': 0.5051965329963733, 'grm_norm': 'cosine', 'self_loops': False, 'use_snp_selection': False}. Best is trial 72 with value: 0.1443334714521971.
[I 2025-11-03 13:13:19,928] Trial 121 finished with value: 0.13653509768763164 and parameters: {'model_type': 'graphsage', 'hidden_dims': '[512, 128]', 'dropout': 0.10188671089981524, 'batch_norm': True, 'lr': 0.00029706678991674336, 'weight_decay': 2.7573243199465518e-06, 'epochs': 330, 'loss': 'mse', 'optimizer': 'adam', 'graph_mode': 'cutoff', 'cutoff': 0.6107967889930402, 'grm_norm': 'cosine', 'self_loops': True, 'use_snp_selection': False}. Best is trial 72 with value: 0.1443334714521971.
[I 2025-11-03 13:13:24,472] Trial 122 finished with value: 0.12020802678816835 and parameters: {'model_type': 'graphsage', 'hidden_dims': '[512, 128]', 'dropout': 0.10021794029219011, 'batch_norm': True, 'lr': 0.00031437822563593775, 'weight_decay': 2.775864128251559e-06, 'epochs': 318, 'loss': 'mse', 'optimizer': 'adam', 'graph_mode': 'cutoff', 'cutoff': 0.5879217152850542, 'grm_norm': 'cosine', 'self_loops': True, 'use_snp_selection': False}. Best is trial 72 with value: 0.1443334714521971.
[I 2025-11-03 13:13:29,106] Trial 123 finished with value: 0.141490651319195 and parameters: {'model_type': 'graphsage', 'hidden_dims': '[512, 128]', 'dropout': 0.12327425274013439, 'batch_norm': True, 'lr': 0.0004317840280208937, 'weight_decay': 7.723916706433289e-07, 'epochs': 334, 'loss': 'mse', 'optimizer': 'adam', 'graph_mode': 'cutoff', 'cutoff': 0.6102268738249657, 'grm_norm': 'cosine', 'self_loops': True, 'use_snp_selection': False}. Best is trial 72 with value: 0.1443334714521971.
[I 2025-11-03 13:13:33,041] Trial 124 finished with value: 0.1298855687849657 and parameters: {'model_type': 'graphsage', 'hidden_dims': '[512, 128]', 'dropout': 0.10927418467243875, 'batch_norm': True, 'lr': 0.00044143796666437787, 'weight_decay': 4.7565646458183646e-07, 'epochs': 245, 'loss': 'mse', 'optimizer': 'adam', 'graph_mode': 'cutoff', 'cutoff': 0.6102036587753235, 'grm_norm': 'cosine', 'self_loops': True, 'use_snp_selection': False}. Best is trial 72 with value: 0.1443334714521971.
[I 2025-11-03 13:13:37,422] Trial 125 finished with value: 0.12342914411983116 and parameters: {'model_type': 'graphsage', 'hidden_dims': '[512, 128]', 'dropout': 0.11875977610291803, 'batch_norm': True, 'lr': 0.000656511673829142, 'weight_decay': 7.683268068185547e-07, 'epochs': 297, 'loss': 'mse', 'optimizer': 'adam', 'graph_mode': 'cutoff', 'cutoff': 0.6668480168261578, 'grm_norm': 'cosine', 'self_loops': True, 'use_snp_selection': False}. Best is trial 72 with value: 0.1443334714521971.
[I 2025-11-03 13:13:42,054] Trial 126 finished with value: 0.12781486387196425 and parameters: {'model_type': 'graphsage', 'hidden_dims': '[512, 128]', 'dropout': 0.14506715951631544, 'batch_norm': True, 'lr': 0.0008819748471966453, 'weight_decay': 6.584392538489397e-07, 'epochs': 330, 'loss': 'mse', 'optimizer': 'adam', 'graph_mode': 'cutoff', 'cutoff': 0.6295854765970968, 'grm_norm': 'cosine', 'self_loops': True, 'use_snp_selection': False}. Best is trial 72 with value: 0.1443334714521971.
[I 2025-11-03 13:13:46,660] Trial 127 finished with value: 0.11430992734830918 and parameters: {'model_type': 'graphsage', 'hidden_dims': '[512, 128]', 'dropout': 0.12197351284703742, 'batch_norm': True, 'lr': 0.000574242963671042, 'weight_decay': 5.609787680783514e-07, 'epochs': 325, 'loss': 'mse', 'optimizer': 'adam', 'graph_mode': 'cutoff', 'cutoff': 0.5390126740666551, 'grm_norm': 'cosine_then_gcn', 'self_loops': True, 'use_snp_selection': False}. Best is trial 72 with value: 0.1443334714521971.
[I 2025-11-03 13:13:49,814] Trial 128 finished with value: 0.11469403126148316 and parameters: {'model_type': 'graphsage', 'hidden_dims': '[512, 128]', 'dropout': 0.15732447096300678, 'batch_norm': False, 'lr': 0.0003832903090695588, 'weight_decay': 8.320817791636708e-07, 'epochs': 315, 'loss': 'mae', 'optimizer': 'adam', 'graph_mode': 'knn', 'source': 'grm', 'knn_k': 2, 'weighted_edges': False, 'symmetrize_mode': 'union', 'use_snp_selection': True, 'num_snps': 23993}. Best is trial 72 with value: 0.1443334714521971.
[I 2025-11-03 13:13:54,162] Trial 129 finished with value: 0.12276071611199867 and parameters: {'model_type': 'graphsage', 'hidden_dims': '[512, 128]', 'dropout': 0.12716941835926796, 'batch_norm': True, 'lr': 0.0007345151124195503, 'weight_decay': 3.123960739791868e-07, 'epochs': 291, 'loss': 'mse', 'optimizer': 'adam', 'graph_mode': 'cutoff', 'cutoff': 0.6047337919389715, 'grm_norm': 'cosine', 'self_loops': True, 'use_snp_selection': False}. Best is trial 72 with value: 0.1443334714521971.
[I 2025-11-03 13:13:58,837] Trial 130 finished with value: 0.13741824913593892 and parameters: {'model_type': 'graphsage', 'hidden_dims': '[512, 256]', 'dropout': 0.1038928831127201, 'batch_norm': True, 'lr': 4.3092265638665944e-05, 'weight_decay': 2.440284865064593e-07, 'epochs': 334, 'loss': 'mse', 'optimizer': 'adam', 'graph_mode': 'cutoff', 'cutoff': 0.661057062335632, 'grm_norm': 'cosine', 'self_loops': True, 'use_snp_selection': False}. Best is trial 72 with value: 0.1443334714521971.
[I 2025-11-03 13:14:03,549] Trial 131 finished with value: 0.11125826387539534 and parameters: {'model_type': 'graphsage', 'hidden_dims': '[512, 256]', 'dropout': 0.11057061005598394, 'batch_norm': True, 'lr': 3.05319434638351e-05, 'weight_decay': 2.0795539401981362e-07, 'epochs': 335, 'loss': 'mse', 'optimizer': 'adam', 'graph_mode': 'cutoff', 'cutoff': 0.6517431722417665, 'grm_norm': 'cosine', 'self_loops': True, 'use_snp_selection': False}. Best is trial 72 with value: 0.1443334714521971.
[I 2025-11-03 13:14:08,190] Trial 132 finished with value: 0.1365374364876196 and parameters: {'model_type': 'graphsage', 'hidden_dims': '[512, 256]', 'dropout': 0.10210921680377678, 'batch_norm': True, 'lr': 4.890742647144973e-05, 'weight_decay': 1.589312657904793e-07, 'epochs': 329, 'loss': 'mse', 'optimizer': 'adam', 'graph_mode': 'cutoff', 'cutoff': 0.6195677562625098, 'grm_norm': 'cosine', 'self_loops': True, 'use_snp_selection': False}. Best is trial 72 with value: 0.1443334714521971.
[I 2025-11-03 13:14:12,938] Trial 133 finished with value: 0.11133168174392116 and parameters: {'model_type': 'graphsage', 'hidden_dims': '[512, 256]', 'dropout': 0.10620325987667507, 'batch_norm': True, 'lr': 2.3433258889548018e-05, 'weight_decay': 1.59065805804125e-07, 'epochs': 343, 'loss': 'mse', 'optimizer': 'adam', 'graph_mode': 'cutoff', 'cutoff': 0.6233329835584793, 'grm_norm': 'cosine', 'self_loops': True, 'use_snp_selection': False}. Best is trial 72 with value: 0.1443334714521971.
[I 2025-11-03 13:14:17,581] Trial 134 finished with value: 0.11197234551354675 and parameters: {'model_type': 'graphsage', 'hidden_dims': '[512, 256]', 'dropout': 0.14125120832687807, 'batch_norm': True, 'lr': 3.8235247426212645e-05, 'weight_decay': 2.189527047514209e-07, 'epochs': 327, 'loss': 'mse', 'optimizer': 'adam', 'graph_mode': 'cutoff', 'cutoff': 0.6369223820556283, 'grm_norm': 'cosine', 'self_loops': True, 'use_snp_selection': False}. Best is trial 72 with value: 0.1443334714521971.
[I 2025-11-03 13:14:22,252] Trial 135 finished with value: 0.09675852972207852 and parameters: {'model_type': 'graphsage', 'hidden_dims': '[512, 256]', 'dropout': 0.13458141753027, 'batch_norm': True, 'lr': 5.060518877992408e-05, 'weight_decay': 1.318621270270676e-07, 'epochs': 331, 'loss': 'mse', 'optimizer': 'adam', 'graph_mode': 'cutoff', 'cutoff': 0.6604332407215839, 'grm_norm': 'cosine', 'self_loops': True, 'use_snp_selection': False}. Best is trial 72 with value: 0.1443334714521971.
[I 2025-11-03 13:14:26,960] Trial 136 finished with value: 0.1172709774514004 and parameters: {'model_type': 'graphsage', 'hidden_dims': '[512, 256]', 'dropout': 0.1284275486590949, 'batch_norm': True, 'lr': 1.3417483547701153e-05, 'weight_decay': 2.720441339749369e-07, 'epochs': 337, 'loss': 'mse', 'optimizer': 'adam', 'graph_mode': 'cutoff', 'cutoff': 0.7014461712684134, 'grm_norm': 'cosine', 'self_loops': True, 'use_snp_selection': False}. Best is trial 72 with value: 0.1443334714521971.
[I 2025-11-03 13:14:31,541] Trial 137 finished with value: 0.10937407779859723 and parameters: {'model_type': 'graphsage', 'hidden_dims': '[512, 256]', 'dropout': 0.11763858913326819, 'batch_norm': True, 'lr': 4.584731233673453e-05, 'weight_decay': 3.5996167681344554e-07, 'epochs': 322, 'loss': 'mse', 'optimizer': 'adam', 'graph_mode': 'cutoff', 'cutoff': 0.5966854010293906, 'grm_norm': 'cosine', 'self_loops': True, 'use_snp_selection': False}. Best is trial 72 with value: 0.1443334714521971.
[I 2025-11-03 13:14:35,393] Trial 138 finished with value: 0.12606417144142856 and parameters: {'model_type': 'graphsage', 'hidden_dims': '[512, 256]', 'dropout': 0.10678016881643017, 'batch_norm': True, 'lr': 5.8571099893187206e-05, 'weight_decay': 1.1478038746346257e-07, 'epochs': 225, 'loss': 'mse', 'optimizer': 'adam', 'graph_mode': 'cutoff', 'cutoff': 0.6197325354184042, 'grm_norm': 'cosine', 'self_loops': True, 'use_snp_selection': False}. Best is trial 72 with value: 0.1443334714521971.
[I 2025-11-03 13:14:40,144] Trial 139 finished with value: 0.12790856792868854 and parameters: {'model_type': 'graphsage', 'hidden_dims': '[512, 256]', 'dropout': 0.10215198457404717, 'batch_norm': True, 'lr': 0.0005518650448061222, 'weight_decay': 1.6460521443324506e-07, 'epochs': 344, 'loss': 'mse', 'optimizer': 'adam', 'graph_mode': 'cutoff', 'cutoff': 0.6829513356724395, 'grm_norm': 'cosine', 'self_loops': True, 'use_snp_selection': False}. Best is trial 72 with value: 0.1443334714521971.
[I 2025-11-03 13:14:43,800] Trial 140 finished with value: 0.12938631185047592 and parameters: {'model_type': 'graphsage', 'hidden_dims': '[512, 64]', 'dropout': 0.14948429037745234, 'batch_norm': True, 'lr': 0.0006261311949814025, 'weight_decay': 2.956002918890789e-05, 'epochs': 203, 'loss': 'mse', 'optimizer': 'adam', 'graph_mode': 'cutoff', 'cutoff': 0.5790250448459973, 'grm_norm': 'gcn', 'self_loops': True, 'use_snp_selection': False}. Best is trial 72 with value: 0.1443334714521971.
[I 2025-11-03 13:14:48,262] Trial 141 finished with value: 0.130319650998579 and parameters: {'model_type': 'graphsage', 'hidden_dims': '[512, 128]', 'dropout': 0.1677628904076857, 'batch_norm': True, 'lr': 4.824605876163781e-05, 'weight_decay': 1.5552981626672249e-06, 'epochs': 306, 'loss': 'mse', 'optimizer': 'adam', 'graph_mode': 'cutoff', 'cutoff': 0.58509914018201, 'grm_norm': 'cosine', 'self_loops': True, 'use_snp_selection': False}. Best is trial 72 with value: 0.1443334714521971.
[I 2025-11-03 13:14:52,190] Trial 142 finished with value: 0.11783538206266266 and parameters: {'model_type': 'graphsage', 'hidden_dims': '[512, 256]', 'dropout': 0.35895617402215674, 'batch_norm': True, 'lr': 9.483755355604664e-05, 'weight_decay': 4.702950979892119e-05, 'epochs': 238, 'loss': 'mse', 'optimizer': 'adam', 'graph_mode': 'cutoff', 'cutoff': 0.5637477961616922, 'grm_norm': 'cosine', 'self_loops': True, 'use_snp_selection': False}. Best is trial 72 with value: 0.1443334714521971.
[I 2025-11-03 13:14:56,725] Trial 143 finished with value: 0.12829959246064948 and parameters: {'model_type': 'graphsage', 'hidden_dims': '[512, 128]', 'dropout': 0.379631297920053, 'batch_norm': True, 'lr': 6.352113728459579e-05, 'weight_decay': 2.4068624001712334e-07, 'epochs': 314, 'loss': 'mse', 'optimizer': 'adam', 'graph_mode': 'cutoff', 'cutoff': 0.6108181208979575, 'grm_norm': 'cosine', 'self_loops': True, 'use_snp_selection': False}. Best is trial 72 with value: 0.1443334714521971.
[I 2025-11-03 13:15:01,307] Trial 144 finished with value: 0.11304507477054987 and parameters: {'model_type': 'graphsage', 'hidden_dims': '[512, 64]', 'dropout': 0.12916725122114173, 'batch_norm': True, 'lr': 3.914778981705057e-05, 'weight_decay': 1.1623728264523147e-06, 'epochs': 322, 'loss': 'mse', 'optimizer': 'adam', 'graph_mode': 'cutoff', 'cutoff': 0.6409837235265243, 'grm_norm': 'cosine_then_gcn', 'self_loops': True, 'use_snp_selection': False}. Best is trial 72 with value: 0.1443334714521971.
[I 2025-11-03 13:15:05,361] Trial 145 finished with value: 0.1250266495954335 and parameters: {'model_type': 'graphsage', 'hidden_dims': '[512, 256]', 'dropout': 0.3292315801924477, 'batch_norm': True, 'lr': 0.00043665140121453174, 'weight_decay': 4.758086178342043e-07, 'epochs': 252, 'loss': 'mae', 'optimizer': 'adam', 'graph_mode': 'cutoff', 'cutoff': 0.5243956863663441, 'grm_norm': 'cosine', 'self_loops': True, 'use_snp_selection': False}. Best is trial 72 with value: 0.1443334714521971.
[I 2025-11-03 13:15:06,706] Trial 146 finished with value: 0.11206346650678498 and parameters: {'model_type': 'graphsage', 'hidden_dims': '[128, 64]', 'dropout': 0.15408942742799014, 'batch_norm': True, 'lr': 2.7106985418450033e-05, 'weight_decay': 2.0653045089875297e-06, 'epochs': 40, 'loss': 'mse', 'optimizer': 'adam', 'graph_mode': 'cutoff', 'cutoff': 0.5478374674813461, 'grm_norm': 'cosine', 'self_loops': True, 'use_snp_selection': False}. Best is trial 72 with value: 0.1443334714521971.
