[I 2025-11-03 14:46:08,794] Trial 32 finished with value: 0.05624840045269122 and parameters: {'model_type': 'graphsage', 'hidden_dims': '[128, 64]', 'dropout': 0.1567433544072247, 'batch_norm': False, 'lr': 0.0006091441560604309, 'weight_decay': 0.00046422969760274584, 'epochs': 70, 'loss': 'mse', 'optimizer': 'adam', 'graph_mode': 'knn', 'source': 'grm', 'knn_k': 7, 'weighted_edges': False, 'symmetrize_mode': 'union', 'use_snp_selection': True, 'num_snps': 26781}. Best is trial 32 with value: 0.05624840045269122.
[I 2025-11-03 14:46:11,448] Trial 33 finished with value: -0.03711132382557541 and parameters: {'model_type': 'graphsage', 'hidden_dims': '[128, 64]', 'dropout': 0.16249700265251724, 'batch_norm': False, 'lr': 0.00046067790949482715, 'weight_decay': 0.0005421699817453489, 'epochs': 68, 'loss': 'mse', 'optimizer': 'adam', 'graph_mode': 'knn', 'source': 'grm', 'knn_k': 7, 'weighted_edges': False, 'symmetrize_mode': 'union', 'use_snp_selection': True, 'num_snps': 35874}. Best is trial 32 with value: 0.05624840045269122.
[I 2025-11-03 14:46:14,412] Trial 34 finished with value: -0.015460997155035235 and parameters: {'model_type': 'graphsage', 'hidden_dims': '[128, 64]', 'dropout': 0.13387537175138856, 'batch_norm': False, 'lr': 0.00023769806604102546, 'weight_decay': 0.00014852156039804729, 'epochs': 62, 'loss': 'mse', 'optimizer': 'adam', 'graph_mode': 'knn', 'source': 'grm', 'knn_k': 6, 'weighted_edges': False, 'symmetrize_mode': 'union', 'use_snp_selection': True, 'num_snps': 44465}. Best is trial 32 with value: 0.05624840045269122.
[I 2025-11-03 14:46:16,613] Trial 35 finished with value: -0.013034361369395321 and parameters: {'model_type': 'graphsage', 'hidden_dims': '[128, 64]', 'dropout': 0.10011061071486482, 'batch_norm': False, 'lr': 0.0001146000178445889, 'weight_decay': 1.9562441212275415e-05, 'epochs': 82, 'loss': 'mse', 'optimizer': 'adam', 'graph_mode': 'knn', 'source': 'grm', 'knn_k': 7, 'weighted_edges': False, 'symmetrize_mode': 'union', 'use_snp_selection': True, 'num_snps': 22317}. Best is trial 32 with value: 0.05624840045269122.
[I 2025-11-03 14:46:19,213] Trial 36 finished with value: -0.004490637094561071 and parameters: {'model_type': 'graphsage', 'hidden_dims': '[128, 64]', 'dropout': 0.19888903872015715, 'batch_norm': False, 'lr': 0.0002866164816510173, 'weight_decay': 0.00037291710022228523, 'epochs': 111, 'loss': 'mae', 'optimizer': 'adam', 'graph_mode': 'knn', 'source': 'grm', 'knn_k': 4, 'weighted_edges': False, 'symmetrize_mode': 'union', 'use_snp_selection': True, 'num_snps': 31416}. Best is trial 32 with value: 0.05624840045269122.
[I 2025-11-03 14:46:21,365] Trial 37 finished with value: 0.008306320931770785 and parameters: {'model_type': 'graphsage', 'hidden_dims': '[128, 64]', 'dropout': 0.14201727508233145, 'batch_norm': False, 'lr': 0.0005488702238026851, 'weight_decay': 6.898335361815025e-05, 'epochs': 160, 'loss': 'mse', 'optimizer': 'adam', 'graph_mode': 'knn', 'source': 'grm', 'knn_k': 9, 'weighted_edges': False, 'symmetrize_mode': 'union', 'use_snp_selection': True, 'num_snps': 13914}. Best is trial 32 with value: 0.05624840045269122.
[I 2025-11-03 14:46:25,016] Trial 38 finished with value: -0.004075531685121829 and parameters: {'model_type': 'graphsage', 'hidden_dims': '[512, 256]', 'dropout': 0.25177196128504786, 'batch_norm': True, 'lr': 4.864016894671497e-05, 'weight_decay': 2.8144798944629676e-05, 'epochs': 126, 'loss': 'mae', 'optimizer': 'adam', 'graph_mode': 'knn', 'source': 'grm', 'knn_k': 5, 'weighted_edges': False, 'symmetrize_mode': 'union', 'use_snp_selection': False}. Best is trial 32 with value: 0.05624840045269122.
[I 2025-11-03 14:46:27,803] Trial 39 finished with value: -0.001345756137133299 and parameters: {'model_type': 'graphsage', 'hidden_dims': '[128, 64]', 'dropout': 0.2001207215263564, 'batch_norm': False, 'lr': 2.6958789636314826e-05, 'weight_decay': 1.512855751715602e-05, 'epochs': 203, 'loss': 'mse', 'optimizer': 'adam', 'graph_mode': 'knn', 'source': 'grm', 'knn_k': 6, 'weighted_edges': False, 'symmetrize_mode': 'union', 'use_snp_selection': True, 'num_snps': 27744}. Best is trial 32 with value: 0.05624840045269122.
[I 2025-11-03 14:46:29,317] Trial 40 finished with value: -0.018362571214129812 and parameters: {'model_type': 'graphsage', 'hidden_dims': '[128, 64]', 'dropout': 0.13350697272624662, 'batch_norm': True, 'lr': 4.720264478568186e-06, 'weight_decay': 5.883155537248816e-06, 'epochs': 57, 'loss': 'mae', 'optimizer': 'adam', 'graph_mode': 'knn', 'source': 'grm', 'knn_k': 3, 'weighted_edges': True, 'symmetrize_mode': 'mutual', 'use_snp_selection': False}. Best is trial 32 with value: 0.05624840045269122.
[I 2025-11-03 14:46:32,012] Trial 41 finished with value: 0.00026743786875838623 and parameters: {'model_type': 'graphsage', 'hidden_dims': '[256, 128]', 'dropout': 0.34663868204060266, 'batch_norm': False, 'lr': 0.000620981345623102, 'weight_decay': 0.0008932247436118846, 'epochs': 160, 'loss': 'mse', 'optimizer': 'adam', 'graph_mode': 'cutoff', 'cutoff': 0.5891068560868126, 'grm_norm': 'cosine_then_gcn', 'self_loops': False, 'use_snp_selection': True, 'num_snps': 27530}. Best is trial 32 with value: 0.05624840045269122.
[I 2025-11-03 14:46:37,278] Trial 42 finished with value: 0.006171094184692525 and parameters: {'model_type': 'graphsage', 'hidden_dims': '[512, 256]', 'dropout': 0.27096086950033144, 'batch_norm': False, 'lr': 0.00038790669308057073, 'weight_decay': 0.00048246669830899345, 'epochs': 243, 'loss': 'mse', 'optimizer': 'adam', 'graph_mode': 'knn', 'source': 'grm', 'knn_k': 9, 'weighted_edges': False, 'symmetrize_mode': 'union', 'use_snp_selection': True, 'num_snps': 40175}. Best is trial 32 with value: 0.05624840045269122.
[I 2025-11-03 14:46:39,837] Trial 43 finished with value: 0.043084756852222 and parameters: {'model_type': 'graphsage', 'hidden_dims': '[256, 128, 64]', 'dropout': 0.41683135908918434, 'batch_norm': False, 'lr': 0.0008952138285772197, 'weight_decay': 0.00022441161677620784, 'epochs': 85, 'loss': 'mse', 'optimizer': 'adam', 'graph_mode': 'knn', 'source': 'grm', 'knn_k': 7, 'weighted_edges': True, 'symmetrize_mode': 'union', 'use_snp_selection': True, 'num_snps': 26034}. Best is trial 32 with value: 0.05624840045269122.
[I 2025-11-03 14:46:42,045] Trial 44 finished with value: 0.010374551058571099 and parameters: {'model_type': 'graphsage', 'hidden_dims': '[256, 128, 64]', 'dropout': 0.4059184711726808, 'batch_norm': False, 'lr': 0.0009998705507138412, 'weight_decay': 9.444426156572971e-05, 'epochs': 84, 'loss': 'mse', 'optimizer': 'adam', 'graph_mode': 'knn', 'source': 'grm', 'knn_k': 7, 'weighted_edges': True, 'symmetrize_mode': 'union', 'use_snp_selection': True, 'num_snps': 16882}. Best is trial 32 with value: 0.05624840045269122.
[I 2025-11-03 14:46:44,351] Trial 45 finished with value: -0.00777329349964521 and parameters: {'model_type': 'graphsage', 'hidden_dims': '[256, 128, 64]', 'dropout': 0.3385083528275049, 'batch_norm': False, 'lr': 0.0007474532086572324, 'weight_decay': 0.00018367029354781933, 'epochs': 40, 'loss': 'mse', 'optimizer': 'adam', 'graph_mode': 'knn', 'source': 'grm', 'knn_k': 8, 'weighted_edges': True, 'symmetrize_mode': 'union', 'use_snp_selection': True, 'num_snps': 24671}. Best is trial 32 with value: 0.05624840045269122.
[I 2025-11-03 14:46:47,150] Trial 46 finished with value: -0.0006914145598463819 and parameters: {'model_type': 'graphsage', 'hidden_dims': '[256, 128, 64]', 'dropout': 0.15412750491722332, 'batch_norm': False, 'lr': 5.113961349783107e-05, 'weight_decay': 1.2665384510201782e-07, 'epochs': 104, 'loss': 'mse', 'optimizer': 'adam', 'graph_mode': 'knn', 'source': 'grm', 'knn_k': 6, 'weighted_edges': True, 'symmetrize_mode': 'union', 'use_snp_selection': True, 'num_snps': 29848}. Best is trial 32 with value: 0.05624840045269122.
[I 2025-11-03 14:46:50,850] Trial 47 finished with value: 0.0026922096020300904 and parameters: {'model_type': 'graphsage', 'hidden_dims': '[512, 128]', 'dropout': 0.18643223432297998, 'batch_norm': True, 'lr': 0.00012341370094678508, 'weight_decay': 0.0002591787421298467, 'epochs': 119, 'loss': 'mae', 'optimizer': 'adam', 'graph_mode': 'knn', 'source': 'grm', 'knn_k': 7, 'weighted_edges': True, 'symmetrize_mode': 'union', 'use_snp_selection': False}. Best is trial 32 with value: 0.05624840045269122.
[I 2025-11-03 14:46:54,671] Trial 48 finished with value: -0.011354765129182114 and parameters: {'model_type': 'graphsage', 'hidden_dims': '[256, 128, 64]', 'dropout': 0.24796934974607837, 'batch_norm': False, 'lr': 0.00021345272966214986, 'weight_decay': 0.0003406151292213004, 'epochs': 140, 'loss': 'mse', 'optimizer': 'adam', 'graph_mode': 'knn', 'source': 'grm', 'knn_k': 7, 'weighted_edges': True, 'symmetrize_mode': 'mutual', 'use_snp_selection': True, 'num_snps': 50080}. Best is trial 32 with value: 0.05624840045269122.
[I 2025-11-03 14:46:56,822] Trial 49 finished with value: -0.009767815449977076 and parameters: {'model_type': 'graphsage', 'hidden_dims': '[256, 128, 64]', 'dropout': 0.11903538908411916, 'batch_norm': True, 'lr': 0.00042912135294423864, 'weight_decay': 4.7929276674438746e-05, 'epochs': 71, 'loss': 'mse', 'optimizer': 'adam', 'graph_mode': 'knn', 'source': 'grm', 'knn_k': 5, 'weighted_edges': True, 'symmetrize_mode': 'union', 'use_snp_selection': False}. Best is trial 32 with value: 0.05624840045269122.
[I 2025-11-03 14:46:59,479] Trial 50 finished with value: -0.03501650213837834 and parameters: {'model_type': 'graphsage', 'hidden_dims': '[512, 64]', 'dropout': 0.20168355995668802, 'batch_norm': False, 'lr': 1.0513244484135264e-05, 'weight_decay': 2.110515740152481e-07, 'epochs': 93, 'loss': 'mae', 'optimizer': 'adam', 'graph_mode': 'knn', 'source': 'grm', 'knn_k': 8, 'weighted_edges': False, 'symmetrize_mode': 'mutual', 'use_snp_selection': True, 'num_snps': 23693}. Best is trial 32 with value: 0.05624840045269122.
[I 2025-11-03 14:47:02,156] Trial 51 finished with value: -0.0023017180199596038 and parameters: {'model_type': 'graphsage', 'hidden_dims': '[128, 64]', 'dropout': 0.5245211970472264, 'batch_norm': False, 'lr': 0.0006815546535943393, 'weight_decay': 0.000697390849736608, 'epochs': 114, 'loss': 'mse', 'optimizer': 'adam', 'graph_mode': 'cutoff', 'cutoff': 0.7794679057807071, 'grm_norm': 'cosine', 'self_loops': True, 'use_snp_selection': True, 'num_snps': 35497}. Best is trial 32 with value: 0.05624840045269122.
[I 2025-11-03 14:47:05,529] Trial 52 finished with value: 0.02556285535301696 and parameters: {'model_type': 'graphsage', 'hidden_dims': '[256, 128, 64]', 'dropout': 0.5804201226712684, 'batch_norm': False, 'lr': 0.000368283404146038, 'weight_decay': 0.000188598832480064, 'epochs': 262, 'loss': 'mse', 'optimizer': 'adam', 'graph_mode': 'knn', 'source': 'grm', 'knn_k': 6, 'weighted_edges': False, 'symmetrize_mode': 'union', 'use_snp_selection': True, 'num_snps': 25975}. Best is trial 32 with value: 0.05624840045269122.
[I 2025-11-03 14:47:09,214] Trial 53 finished with value: -0.011727884182011225 and parameters: {'model_type': 'graphsage', 'hidden_dims': '[256, 128, 64]', 'dropout': 0.5658713646468368, 'batch_norm': False, 'lr': 0.00033655366833421194, 'weight_decay': 8.766942640588803e-05, 'epochs': 291, 'loss': 'mse', 'optimizer': 'adam', 'graph_mode': 'knn', 'source': 'grm', 'knn_k': 6, 'weighted_edges': False, 'symmetrize_mode': 'union', 'use_snp_selection': True, 'num_snps': 30425}. Best is trial 32 with value: 0.05624840045269122.
[I 2025-11-03 14:47:12,405] Trial 54 finished with value: 0.019878743734397568 and parameters: {'model_type': 'graphsage', 'hidden_dims': '[256, 128, 64]', 'dropout': 0.5642223515306113, 'batch_norm': False, 'lr': 0.0004876561119638007, 'weight_decay': 0.0001752985655291209, 'epochs': 257, 'loss': 'mse', 'optimizer': 'adam', 'graph_mode': 'knn', 'source': 'grm', 'knn_k': 6, 'weighted_edges': False, 'symmetrize_mode': 'union', 'use_snp_selection': True, 'num_snps': 21812}. Best is trial 32 with value: 0.05624840045269122.
[I 2025-11-03 14:47:16,084] Trial 55 finished with value: -0.027009781665990495 and parameters: {'model_type': 'graphsage', 'hidden_dims': '[256, 128, 64]', 'dropout': 0.5869574650400474, 'batch_norm': False, 'lr': 0.0009889359555455405, 'weight_decay': 0.00021064386291837908, 'epochs': 333, 'loss': 'mse', 'optimizer': 'adam', 'graph_mode': 'knn', 'source': 'grm', 'knn_k': 7, 'weighted_edges': False, 'symmetrize_mode': 'union', 'use_snp_selection': True, 'num_snps': 24974}. Best is trial 32 with value: 0.05624840045269122.
[I 2025-11-03 14:47:21,347] Trial 56 finished with value: -0.00418299192872296 and parameters: {'model_type': 'graphsage', 'hidden_dims': '[256, 128, 64]', 'dropout': 0.4352072085370847, 'batch_norm': False, 'lr': 0.0002600051591718485, 'weight_decay': 0.00012977135277510426, 'epochs': 303, 'loss': 'mse', 'optimizer': 'adam', 'graph_mode': 'knn', 'source': 'grm', 'knn_k': 5, 'weighted_edges': False, 'symmetrize_mode': 'mutual', 'use_snp_selection': True, 'num_snps': 59634}. Best is trial 32 with value: 0.05624840045269122.
[I 2025-11-03 14:47:24,207] Trial 57 finished with value: -0.0064665005972517585 and parameters: {'model_type': 'graphsage', 'hidden_dims': '[128, 64]', 'dropout': 0.5111844796923553, 'batch_norm': False, 'lr': 2.18845017098505e-06, 'weight_decay': 3.7538723733705966e-05, 'epochs': 319, 'loss': 'mae', 'optimizer': 'adam', 'graph_mode': 'knn', 'source': 'grm', 'knn_k': 8, 'weighted_edges': True, 'symmetrize_mode': 'union', 'use_snp_selection': True, 'num_snps': 18210}. Best is trial 32 with value: 0.05624840045269122.
[I 2025-11-03 14:47:29,277] Trial 58 finished with value: -0.020467011193077127 and parameters: {'model_type': 'graphsage', 'hidden_dims': '[512, 128]', 'dropout': 0.4915167605463, 'batch_norm': True, 'lr': 0.0006920693809413952, 'weight_decay': 6.58593398220154e-05, 'epochs': 276, 'loss': 'mse', 'optimizer': 'adam', 'graph_mode': 'knn', 'source': 'grm', 'knn_k': 4, 'weighted_edges': False, 'symmetrize_mode': 'mutual', 'use_snp_selection': False}. Best is trial 32 with value: 0.05624840045269122.
[I 2025-11-03 14:47:33,738] Trial 59 finished with value: 0.008218207339975584 and parameters: {'model_type': 'graphsage', 'hidden_dims': '[512, 256]', 'dropout': 0.5378998893088244, 'batch_norm': False, 'lr': 1.3890351037865118e-05, 'weight_decay': 0.0004230724123148806, 'epochs': 262, 'loss': 'mse', 'optimizer': 'adam', 'graph_mode': 'knn', 'source': 'grm', 'knn_k': 6, 'weighted_edges': False, 'symmetrize_mode': 'union', 'use_snp_selection': True, 'num_snps': 33503}. Best is trial 32 with value: 0.05624840045269122.
[I 2025-11-03 14:47:36,477] Trial 60 finished with value: 0.011693383137469315 and parameters: {'model_type': 'graphsage', 'hidden_dims': '[512, 64]', 'dropout': 0.36239858889658405, 'batch_norm': False, 'lr': 0.00015224139476527386, 'weight_decay': 0.0006940340344539604, 'epochs': 349, 'loss': 'mse', 'optimizer': 'adam', 'graph_mode': 'knn', 'source': 'grm', 'knn_k': 7, 'weighted_edges': True, 'symmetrize_mode': 'mutual', 'use_snp_selection': True, 'num_snps': 7847}. Best is trial 32 with value: 0.05624840045269122.
[I 2025-11-03 14:47:39,620] Trial 61 finished with value: -0.033704885794710954 and parameters: {'model_type': 'graphsage', 'hidden_dims': '[256, 128, 64]', 'dropout': 0.5660595304601396, 'batch_norm': False, 'lr': 0.0004814096639510316, 'weight_decay': 0.00019436787307458195, 'epochs': 251, 'loss': 'mse', 'optimizer': 'adam', 'graph_mode': 'knn', 'source': 'grm', 'knn_k': 6, 'weighted_edges': False, 'symmetrize_mode': 'union', 'use_snp_selection': True, 'num_snps': 21312}. Best is trial 32 with value: 0.05624840045269122.
[I 2025-11-03 14:47:42,790] Trial 62 finished with value: -0.012844432421860017 and parameters: {'model_type': 'graphsage', 'hidden_dims': '[256, 128, 64]', 'dropout': 0.5817227335124655, 'batch_norm': False, 'lr': 0.00032588663144564973, 'weight_decay': 0.00028511529305143155, 'epochs': 225, 'loss': 'mse', 'optimizer': 'adam', 'graph_mode': 'knn', 'source': 'grm', 'knn_k': 5, 'weighted_edges': False, 'symmetrize_mode': 'union', 'use_snp_selection': True, 'num_snps': 24979}. Best is trial 32 with value: 0.05624840045269122.
[I 2025-11-03 14:47:46,434] Trial 63 finished with value: -0.02797018415691515 and parameters: {'model_type': 'graphsage', 'hidden_dims': '[256, 128, 64]', 'dropout': 0.5597789977234082, 'batch_norm': False, 'lr': 0.0005148368831282954, 'weight_decay': 0.00010892235835624592, 'epochs': 290, 'loss': 'mse', 'optimizer': 'adam', 'graph_mode': 'knn', 'source': 'grm', 'knn_k': 6, 'weighted_edges': False, 'symmetrize_mode': 'union', 'use_snp_selection': True, 'num_snps': 29070}. Best is trial 32 with value: 0.05624840045269122.
[I 2025-11-03 14:47:49,336] Trial 64 finished with value: 0.03667200276854017 and parameters: {'model_type': 'graphsage', 'hidden_dims': '[256, 128, 64]', 'dropout': 0.531723990847259, 'batch_norm': False, 'lr': 1.5455467495365288e-06, 'weight_decay': 6.843421656677236e-05, 'epochs': 209, 'loss': 'mse', 'optimizer': 'adam', 'graph_mode': 'knn', 'source': 'grm', 'knn_k': 8, 'weighted_edges': False, 'symmetrize_mode': 'union', 'use_snp_selection': True, 'num_snps': 19713}. Best is trial 32 with value: 0.05624840045269122.
[I 2025-11-03 14:47:53,095] Trial 65 finished with value: 0.0007855170342053255 and parameters: {'model_type': 'graphsage', 'hidden_dims': '[256, 128, 64]', 'dropout': 0.47222816505685516, 'batch_norm': False, 'lr': 1.3662313557771725e-06, 'weight_decay': 2.464126159955429e-05, 'epochs': 194, 'loss': 'mse', 'optimizer': 'adam', 'graph_mode': 'knn', 'source': 'grm', 'knn_k': 8, 'weighted_edges': False, 'symmetrize_mode': 'mutual', 'use_snp_selection': True, 'num_snps': 41714}. Best is trial 32 with value: 0.05624840045269122.
[I 2025-11-03 14:47:55,474] Trial 66 finished with value: 0.0011457089622120059 and parameters: {'model_type': 'graphsage', 'hidden_dims': '[128, 64]', 'dropout': 0.5251620013021312, 'batch_norm': True, 'lr': 4.019591239819494e-06, 'weight_decay': 6.949999211156276e-05, 'epochs': 152, 'loss': 'mae', 'optimizer': 'adam', 'graph_mode': 'knn', 'source': 'grm', 'knn_k': 9, 'weighted_edges': False, 'symmetrize_mode': 'union', 'use_snp_selection': False}. Best is trial 32 with value: 0.05624840045269122.
[I 2025-11-03 14:47:57,718] Trial 67 finished with value: 0.02134925667430239 and parameters: {'model_type': 'graphsage', 'hidden_dims': '[256, 128, 64]', 'dropout': 0.32152982836766086, 'batch_norm': False, 'lr': 2.00880730376492e-06, 'weight_decay': 4.3969192662800026e-05, 'epochs': 100, 'loss': 'mse', 'optimizer': 'adam', 'graph_mode': 'knn', 'source': 'grm', 'knn_k': 9, 'weighted_edges': True, 'symmetrize_mode': 'mutual', 'use_snp_selection': True, 'num_snps': 16668}. Best is trial 32 with value: 0.05624840045269122.
[I 2025-11-03 14:48:00,060] Trial 68 finished with value: -0.009213575534510169 and parameters: {'model_type': 'graphsage', 'hidden_dims': '[128, 64]', 'dropout': 0.49592638485470153, 'batch_norm': False, 'lr': 1.601299971474228e-06, 'weight_decay': 0.00013493797131659303, 'epochs': 213, 'loss': 'mse', 'optimizer': 'adam', 'graph_mode': 'knn', 'source': 'grm', 'knn_k': 7, 'weighted_edges': False, 'symmetrize_mode': 'union', 'use_snp_selection': True, 'num_snps': 14422}. Best is trial 32 with value: 0.05624840045269122.
[I 2025-11-03 14:48:02,182] Trial 69 finished with value: 0.031987480759085335 and parameters: {'model_type': 'graphsage', 'hidden_dims': '[128, 64]', 'dropout': 0.3984905933345896, 'batch_norm': True, 'lr': 1.0979814512520796e-06, 'weight_decay': 6.331483852266257e-05, 'epochs': 132, 'loss': 'mse', 'optimizer': 'adam', 'graph_mode': 'knn', 'source': 'grm', 'knn_k': 8, 'weighted_edges': False, 'symmetrize_mode': 'union', 'use_snp_selection': False}. Best is trial 32 with value: 0.05624840045269122.
[I 2025-11-03 14:48:04,620] Trial 70 finished with value: 0.03179624704782602 and parameters: {'model_type': 'graphsage', 'hidden_dims': '[128, 64]', 'dropout': 0.4141117426332383, 'batch_norm': True, 'lr': 1.0523002178846108e-06, 'weight_decay': 0.0003721824161730249, 'epochs': 182, 'loss': 'mse', 'optimizer': 'adam', 'graph_mode': 'knn', 'source': 'grm', 'knn_k': 8, 'weighted_edges': False, 'symmetrize_mode': 'union', 'use_snp_selection': False}. Best is trial 32 with value: 0.05624840045269122.
[I 2025-11-03 14:48:06,987] Trial 71 finished with value: -0.0019103254512698236 and parameters: {'model_type': 'graphsage', 'hidden_dims': '[128, 64]', 'dropout': 0.40692993322857257, 'batch_norm': True, 'lr': 1.1033656100251068e-06, 'weight_decay': 0.0005276539533291265, 'epochs': 171, 'loss': 'mse', 'optimizer': 'adam', 'graph_mode': 'knn', 'source': 'grm', 'knn_k': 8, 'weighted_edges': False, 'symmetrize_mode': 'union', 'use_snp_selection': False}. Best is trial 32 with value: 0.05624840045269122.
[I 2025-11-03 14:48:09,437] Trial 72 finished with value: 0.012571646808357116 and parameters: {'model_type': 'graphsage', 'hidden_dims': '[128, 64]', 'dropout': 0.3843235858758669, 'batch_norm': True, 'lr': 1.3188153416172817e-06, 'weight_decay': 0.0003297753810907394, 'epochs': 184, 'loss': 'mse', 'optimizer': 'adam', 'graph_mode': 'knn', 'source': 'grm', 'knn_k': 8, 'weighted_edges': False, 'symmetrize_mode': 'union', 'use_snp_selection': False}. Best is trial 32 with value: 0.05624840045269122.
[I 2025-11-03 14:48:11,544] Trial 73 finished with value: 0.015089420599635682 and parameters: {'model_type': 'graphsage', 'hidden_dims': '[128, 64]', 'dropout': 0.41953093806177455, 'batch_norm': True, 'lr': 1.0178437438783208e-06, 'weight_decay': 0.00041245039760087217, 'epochs': 130, 'loss': 'mse', 'optimizer': 'adam', 'graph_mode': 'knn', 'source': 'grm', 'knn_k': 8, 'weighted_edges': False, 'symmetrize_mode': 'union', 'use_snp_selection': False}. Best is trial 32 with value: 0.05624840045269122.
