[I 2025-11-03 13:37:54,884] Trial 82 finished with value: 0.011908163994353531 and parameters: {'model_type': 'graphsage', 'hidden_dims': '[256, 128, 64]', 'dropout': 0.3367136032995781, 'batch_norm': False, 'lr': 0.00011401989150622734, 'weight_decay': 1.7295102772156043e-05, 'epochs': 199, 'loss': 'mse', 'optimizer': 'adam', 'graph_mode': 'cutoff', 'cutoff': 0.5255581976692127, 'grm_norm': 'none', 'self_loops': False, 'use_snp_selection': True, 'num_snps': 9258}. Best is trial 19 with value: 0.09185206122090518.
[I 2025-11-03 13:37:57,428] Trial 83 finished with value: -0.022948730189617277 and parameters: {'model_type': 'graphsage', 'hidden_dims': '[256, 128, 64]', 'dropout': 0.35952424008124284, 'batch_norm': False, 'lr': 2.7976510658370644e-06, 'weight_decay': 3.4912949938981335e-06, 'epochs': 340, 'loss': 'mse', 'optimizer': 'adam', 'graph_mode': 'cutoff', 'cutoff': 0.4548047219026639, 'grm_norm': 'none', 'self_loops': False, 'use_snp_selection': True, 'num_snps': 4942}. Best is trial 19 with value: 0.09185206122090518.
[I 2025-11-03 13:38:00,153] Trial 84 finished with value: 0.01124602199058249 and parameters: {'model_type': 'graphsage', 'hidden_dims': '[512, 64]', 'dropout': 0.31647862809422644, 'batch_norm': False, 'lr': 0.0009096567684886762, 'weight_decay': 6.227815282584747e-06, 'epochs': 150, 'loss': 'mse', 'optimizer': 'adam', 'graph_mode': 'cutoff', 'cutoff': 0.4225730731931057, 'grm_norm': 'none', 'self_loops': False, 'use_snp_selection': True, 'num_snps': 27397}. Best is trial 19 with value: 0.09185206122090518.
[I 2025-11-03 13:38:02,500] Trial 85 finished with value: 0.02374832139704515 and parameters: {'model_type': 'graphsage', 'hidden_dims': '[256, 128, 64]', 'dropout': 0.3759328528890911, 'batch_norm': False, 'lr': 0.00023328136843681738, 'weight_decay': 1.1713113641125652e-05, 'epochs': 262, 'loss': 'mse', 'optimizer': 'adam', 'graph_mode': 'knn', 'source': 'grm', 'knn_k': 1, 'weighted_edges': True, 'symmetrize_mode': 'mutual', 'use_snp_selection': True, 'num_snps': 6925}. Best is trial 19 with value: 0.09185206122090518.
[I 2025-11-03 13:38:04,232] Trial 86 finished with value: -0.00282147411165223 and parameters: {'model_type': 'graphsage', 'hidden_dims': '[256, 128]', 'dropout': 0.49856588363209403, 'batch_norm': False, 'lr': 8.134408726081243e-06, 'weight_decay': 0.00012328073014580726, 'epochs': 211, 'loss': 'mse', 'optimizer': 'adam', 'graph_mode': 'cutoff', 'cutoff': 0.3623133211410767, 'grm_norm': 'cosine', 'self_loops': False, 'use_snp_selection': True, 'num_snps': 3586}. Best is trial 19 with value: 0.09185206122090518.
[I 2025-11-03 13:38:08,674] Trial 87 finished with value: 0.034838465167312066 and parameters: {'model_type': 'graphsage', 'hidden_dims': '[512, 256]', 'dropout': 0.45755841469499886, 'batch_norm': True, 'lr': 1.0937862073452588e-05, 'weight_decay': 0.00017519095575715116, 'epochs': 293, 'loss': 'mae', 'optimizer': 'adam', 'graph_mode': 'knn', 'source': 'grm', 'knn_k': 9, 'weighted_edges': True, 'symmetrize_mode': 'mutual', 'use_snp_selection': False}. Best is trial 19 with value: 0.09185206122090518.
[I 2025-11-03 13:38:11,736] Trial 88 finished with value: 0.029798568920885036 and parameters: {'model_type': 'graphsage', 'hidden_dims': '[256, 128, 64]', 'dropout': 0.15952124483840355, 'batch_norm': False, 'lr': 3.2428005109456215e-05, 'weight_decay': 2.9065462015629656e-05, 'epochs': 335, 'loss': 'mse', 'optimizer': 'adam', 'graph_mode': 'knn', 'source': 'grm', 'knn_k': 10, 'weighted_edges': False, 'symmetrize_mode': 'union', 'use_snp_selection': True, 'num_snps': 11661}. Best is trial 19 with value: 0.09185206122090518.
[I 2025-11-03 13:38:15,463] Trial 89 finished with value: 0.022486281727423403 and parameters: {'model_type': 'graphsage', 'hidden_dims': '[512, 64]', 'dropout': 0.4313594900837874, 'batch_norm': False, 'lr': 1.344352434559151e-05, 'weight_decay': 0.00034401545423604334, 'epochs': 174, 'loss': 'mse', 'optimizer': 'adam', 'graph_mode': 'cutoff', 'cutoff': 0.2905683218730673, 'grm_norm': 'cosine_then_gcn', 'self_loops': True, 'use_snp_selection': True, 'num_snps': 40326}. Best is trial 19 with value: 0.09185206122090518.
[I 2025-11-03 13:38:17,087] Trial 90 finished with value: -0.006452944931271852 and parameters: {'model_type': 'graphsage', 'hidden_dims': '[128, 64]', 'dropout': 0.3336902642145229, 'batch_norm': True, 'lr': 5.675553505641939e-06, 'weight_decay': 6.498252358350412e-05, 'epochs': 88, 'loss': 'mae', 'optimizer': 'adam', 'graph_mode': 'knn', 'source': 'grm', 'knn_k': 3, 'weighted_edges': True, 'symmetrize_mode': 'mutual', 'use_snp_selection': False}. Best is trial 19 with value: 0.09185206122090518.
[I 2025-11-03 13:38:21,436] Trial 91 finished with value: 0.038278762677844975 and parameters: {'model_type': 'graphsage', 'hidden_dims': '[512, 64]', 'dropout': 0.36458358229870774, 'batch_norm': True, 'lr': 0.00010999349565219733, 'weight_decay': 0.00023293343515795196, 'epochs': 311, 'loss': 'mae', 'optimizer': 'adam', 'graph_mode': 'knn', 'source': 'grm', 'knn_k': 1, 'weighted_edges': True, 'symmetrize_mode': 'mutual', 'use_snp_selection': False}. Best is trial 19 with value: 0.09185206122090518.
[I 2025-11-03 13:38:25,751] Trial 92 finished with value: 0.04626036111824556 and parameters: {'model_type': 'graphsage', 'hidden_dims': '[512, 64]', 'dropout': 0.4039567917737722, 'batch_norm': True, 'lr': 0.00014356576758470057, 'weight_decay': 0.00022699252288382665, 'epochs': 314, 'loss': 'mae', 'optimizer': 'adam', 'graph_mode': 'knn', 'source': 'grm', 'knn_k': 1, 'weighted_edges': True, 'symmetrize_mode': 'mutual', 'use_snp_selection': False}. Best is trial 19 with value: 0.09185206122090518.
[I 2025-11-03 13:38:28,803] Trial 93 finished with value: 0.028733353283849978 and parameters: {'model_type': 'graphsage', 'hidden_dims': '[512, 64]', 'dropout': 0.3871297382380333, 'batch_norm': True, 'lr': 0.00015423010392579258, 'weight_decay': 0.0005506808164487656, 'epochs': 133, 'loss': 'mae', 'optimizer': 'adam', 'graph_mode': 'knn', 'source': 'grm', 'knn_k': 2, 'weighted_edges': True, 'symmetrize_mode': 'mutual', 'use_snp_selection': False}. Best is trial 19 with value: 0.09185206122090518.
[I 2025-11-03 13:38:33,013] Trial 94 finished with value: 0.030263036895889286 and parameters: {'model_type': 'graphsage', 'hidden_dims': '[512, 64]', 'dropout': 0.41043690971913205, 'batch_norm': True, 'lr': 6.575407545311883e-05, 'weight_decay': 9.221952213996435e-05, 'epochs': 298, 'loss': 'mae', 'optimizer': 'adam', 'graph_mode': 'knn', 'source': 'grm', 'knn_k': 1, 'weighted_edges': True, 'symmetrize_mode': 'mutual', 'use_snp_selection': False}. Best is trial 19 with value: 0.09185206122090518.
[I 2025-11-03 13:38:37,586] Trial 95 finished with value: 0.039640224668749134 and parameters: {'model_type': 'graphsage', 'hidden_dims': '[512, 64]', 'dropout': 0.42211478323568413, 'batch_norm': True, 'lr': 0.0003332422882625452, 'weight_decay': 0.0001235316699955861, 'epochs': 342, 'loss': 'mae', 'optimizer': 'adam', 'graph_mode': 'knn', 'source': 'grm', 'knn_k': 1, 'weighted_edges': False, 'symmetrize_mode': 'union', 'use_snp_selection': False}. Best is trial 19 with value: 0.09185206122090518.
[I 2025-11-03 13:38:40,452] Trial 96 finished with value: 0.023134737880976843 and parameters: {'model_type': 'graphsage', 'hidden_dims': '[256, 128, 64]', 'dropout': 0.34510893381097624, 'batch_norm': False, 'lr': 8.711924274335492e-05, 'weight_decay': 0.0008588720792018649, 'epochs': 326, 'loss': 'mse', 'optimizer': 'adam', 'graph_mode': 'knn', 'source': 'grm', 'knn_k': 4, 'weighted_edges': True, 'symmetrize_mode': 'mutual', 'use_snp_selection': True, 'num_snps': 8670}. Best is trial 19 with value: 0.09185206122090518.
[I 2025-11-03 13:38:43,159] Trial 97 finished with value: 0.03760901963380445 and parameters: {'model_type': 'graphsage', 'hidden_dims': '[256, 128]', 'dropout': 0.37891074861211044, 'batch_norm': True, 'lr': 0.0001308406360636912, 'weight_decay': 0.00019601944803434757, 'epochs': 303, 'loss': 'mae', 'optimizer': 'adam', 'graph_mode': 'cutoff', 'cutoff': 0.4891146067063713, 'grm_norm': 'gcn', 'self_loops': False, 'use_snp_selection': False}. Best is trial 19 with value: 0.09185206122090518.
[I 2025-11-03 13:38:46,222] Trial 98 finished with value: 0.014889556620789736 and parameters: {'model_type': 'graphsage', 'hidden_dims': '[512, 256]', 'dropout': 0.5112659173478113, 'batch_norm': False, 'lr': 1.8999479261960538e-06, 'weight_decay': 0.0002928214680666969, 'epochs': 312, 'loss': 'mse', 'optimizer': 'adam', 'graph_mode': 'knn', 'source': 'grm', 'knn_k': 6, 'weighted_edges': True, 'symmetrize_mode': 'mutual', 'use_snp_selection': True, 'num_snps': 20376}. Best is trial 19 with value: 0.09185206122090518.
[I 2025-11-03 13:38:49,958] Trial 99 finished with value: 0.028064411417845644 and parameters: {'model_type': 'graphsage', 'hidden_dims': '[512, 128]', 'dropout': 0.40010502708414075, 'batch_norm': True, 'lr': 0.00017478651162954146, 'weight_decay': 0.00038681749591295373, 'epochs': 192, 'loss': 'mae', 'optimizer': 'adam', 'graph_mode': 'knn', 'source': 'grm', 'knn_k': 7, 'weighted_edges': False, 'symmetrize_mode': 'union', 'use_snp_selection': False}. Best is trial 19 with value: 0.09185206122090518.
[I 2025-11-03 13:38:52,243] Trial 100 finished with value: 0.027955744031080105 and parameters: {'model_type': 'graphsage', 'hidden_dims': '[512, 64]', 'dropout': 0.4687437424887619, 'batch_norm': False, 'lr': 4.220700495878873e-05, 'weight_decay': 8.269958890751762e-06, 'epochs': 321, 'loss': 'mse', 'optimizer': 'adam', 'graph_mode': 'cutoff', 'cutoff': 0.34085262797518034, 'grm_norm': 'none', 'self_loops': False, 'use_snp_selection': True, 'num_snps': 5017}. Best is trial 19 with value: 0.09185206122090518.
[I 2025-11-03 13:38:56,567] Trial 101 finished with value: 0.030098027220184804 and parameters: {'model_type': 'graphsage', 'hidden_dims': '[512, 64]', 'dropout': 0.36020440183011115, 'batch_norm': True, 'lr': 0.0002093713960654564, 'weight_decay': 0.00023795637995804837, 'epochs': 313, 'loss': 'mae', 'optimizer': 'adam', 'graph_mode': 'knn', 'source': 'grm', 'knn_k': 1, 'weighted_edges': True, 'symmetrize_mode': 'mutual', 'use_snp_selection': False}. Best is trial 19 with value: 0.09185206122090518.
[I 2025-11-03 13:39:01,067] Trial 102 finished with value: 0.053595970024167404 and parameters: {'model_type': 'graphsage', 'hidden_dims': '[512, 64]', 'dropout': 0.3736128948274921, 'batch_norm': True, 'lr': 0.0002641103025522251, 'weight_decay': 0.00016640872772961848, 'epochs': 333, 'loss': 'mae', 'optimizer': 'adam', 'graph_mode': 'knn', 'source': 'grm', 'knn_k': 2, 'weighted_edges': True, 'symmetrize_mode': 'mutual', 'use_snp_selection': False}. Best is trial 19 with value: 0.09185206122090518.
[I 2025-11-03 13:39:05,550] Trial 103 finished with value: 0.044266180450331254 and parameters: {'model_type': 'graphsage', 'hidden_dims': '[512, 64]', 'dropout': 0.442067174630624, 'batch_norm': True, 'lr': 0.00026804710784457186, 'weight_decay': 0.00016987338340074333, 'epochs': 333, 'loss': 'mae', 'optimizer': 'adam', 'graph_mode': 'knn', 'source': 'grm', 'knn_k': 2, 'weighted_edges': True, 'symmetrize_mode': 'mutual', 'use_snp_selection': False}. Best is trial 19 with value: 0.09185206122090518.
[I 2025-11-03 13:39:10,057] Trial 104 finished with value: 0.039941754729485274 and parameters: {'model_type': 'graphsage', 'hidden_dims': '[512, 64]', 'dropout': 0.44425888346060605, 'batch_norm': True, 'lr': 0.0002926120098423079, 'weight_decay': 0.00015971490762220893, 'epochs': 334, 'loss': 'mae', 'optimizer': 'adam', 'graph_mode': 'knn', 'source': 'grm', 'knn_k': 2, 'weighted_edges': True, 'symmetrize_mode': 'mutual', 'use_snp_selection': False}. Best is trial 19 with value: 0.09185206122090518.
[I 2025-11-03 13:39:14,675] Trial 105 finished with value: 0.010090729500993592 and parameters: {'model_type': 'graphsage', 'hidden_dims': '[512, 64]', 'dropout': 0.4352364754445947, 'batch_norm': True, 'lr': 4.187019726240882e-06, 'weight_decay': 0.00011961595575804275, 'epochs': 344, 'loss': 'mae', 'optimizer': 'adam', 'graph_mode': 'knn', 'source': 'grm', 'knn_k': 3, 'weighted_edges': True, 'symmetrize_mode': 'mutual', 'use_snp_selection': False}. Best is trial 19 with value: 0.09185206122090518.
[I 2025-11-03 13:39:19,139] Trial 106 finished with value: 0.023831667619314174 and parameters: {'model_type': 'graphsage', 'hidden_dims': '[512, 64]', 'dropout': 0.4765853341436594, 'batch_norm': True, 'lr': 0.0003710976371618689, 'weight_decay': 0.0001909385303986617, 'epochs': 328, 'loss': 'mae', 'optimizer': 'adam', 'graph_mode': 'knn', 'source': 'grm', 'knn_k': 2, 'weighted_edges': True, 'symmetrize_mode': 'mutual', 'use_snp_selection': False}. Best is trial 19 with value: 0.09185206122090518.
[I 2025-11-03 13:39:23,654] Trial 107 finished with value: 0.02794754078447708 and parameters: {'model_type': 'graphsage', 'hidden_dims': '[512, 64]', 'dropout': 0.4948459333344805, 'batch_norm': True, 'lr': 0.0004596297221256907, 'weight_decay': 0.00029538686798468084, 'epochs': 336, 'loss': 'mae', 'optimizer': 'adam', 'graph_mode': 'knn', 'source': 'grm', 'knn_k': 2, 'weighted_edges': True, 'symmetrize_mode': 'mutual', 'use_snp_selection': False}. Best is trial 19 with value: 0.09185206122090518.
[I 2025-11-03 13:39:26,751] Trial 108 finished with value: 0.012518871937905929 and parameters: {'model_type': 'graphsage', 'hidden_dims': '[512, 64]', 'dropout': 0.5235424955164377, 'batch_norm': False, 'lr': 0.00015474903347368726, 'weight_decay': 0.00013907146604494314, 'epochs': 345, 'loss': 'mse', 'optimizer': 'adam', 'graph_mode': 'knn', 'source': 'grm', 'knn_k': 10, 'weighted_edges': True, 'symmetrize_mode': 'mutual', 'use_snp_selection': True, 'num_snps': 18483}. Best is trial 19 with value: 0.09185206122090518.
[I 2025-11-03 13:39:29,984] Trial 109 finished with value: 0.03159000237068302 and parameters: {'model_type': 'graphsage', 'hidden_dims': '[256, 128, 64]', 'dropout': 0.41767308285436866, 'batch_norm': True, 'lr': 0.0006149823015070166, 'weight_decay': 0.0004630927970761509, 'epochs': 303, 'loss': 'mae', 'optimizer': 'adam', 'graph_mode': 'knn', 'source': 'grm', 'knn_k': 5, 'weighted_edges': True, 'symmetrize_mode': 'mutual', 'use_snp_selection': False}. Best is trial 19 with value: 0.09185206122090518.
[I 2025-11-03 13:39:33,201] Trial 110 finished with value: 0.02947989009623205 and parameters: {'model_type': 'graphsage', 'hidden_dims': '[512, 64]', 'dropout': 0.3889333943094632, 'batch_norm': False, 'lr': 0.00020265994433625738, 'weight_decay': 8.984862312532675e-05, 'epochs': 350, 'loss': 'mse', 'optimizer': 'adam', 'graph_mode': 'cutoff', 'cutoff': 0.20494700917153366, 'grm_norm': 'gcn', 'self_loops': True, 'use_snp_selection': True, 'num_snps': 22307}. Best is trial 19 with value: 0.09185206122090518.
[I 2025-11-03 13:39:35,748] Trial 111 finished with value: 0.04639621418833179 and parameters: {'model_type': 'graphsage', 'hidden_dims': '[128, 64]', 'dropout': 0.37027408850343796, 'batch_norm': True, 'lr': 0.0002587259975508744, 'weight_decay': 5.401295108217867e-06, 'epochs': 321, 'loss': 'mae', 'optimizer': 'adam', 'graph_mode': 'knn', 'source': 'grm', 'knn_k': 1, 'weighted_edges': True, 'symmetrize_mode': 'mutual', 'use_snp_selection': False}. Best is trial 19 with value: 0.09185206122090518.
[I 2025-11-03 13:39:38,294] Trial 112 finished with value: 0.039869123120167854 and parameters: {'model_type': 'graphsage', 'hidden_dims': '[128, 64]', 'dropout': 0.3727815197413278, 'batch_norm': True, 'lr': 0.00023782276990075987, 'weight_decay': 4.60442313653536e-06, 'epochs': 321, 'loss': 'mae', 'optimizer': 'adam', 'graph_mode': 'knn', 'source': 'grm', 'knn_k': 1, 'weighted_edges': True, 'symmetrize_mode': 'mutual', 'use_snp_selection': False}. Best is trial 19 with value: 0.09185206122090518.
[I 2025-11-03 13:39:40,878] Trial 113 finished with value: 0.03590209585777138 and parameters: {'model_type': 'graphsage', 'hidden_dims': '[128, 64]', 'dropout': 0.3977431441677047, 'batch_norm': True, 'lr': 0.0001257300211302035, 'weight_decay': 1.0959888027041952e-05, 'epochs': 328, 'loss': 'mae', 'optimizer': 'adam', 'graph_mode': 'knn', 'source': 'grm', 'knn_k': 2, 'weighted_edges': True, 'symmetrize_mode': 'mutual', 'use_snp_selection': False}. Best is trial 19 with value: 0.09185206122090518.
[I 2025-11-03 13:39:43,406] Trial 114 finished with value: 0.036271300128612044 and parameters: {'model_type': 'graphsage', 'hidden_dims': '[128, 64]', 'dropout': 0.10713251451041034, 'batch_norm': True, 'lr': 0.00031493298026703375, 'weight_decay': 5.3764010428890696e-06, 'epochs': 317, 'loss': 'mae', 'optimizer': 'adam', 'graph_mode': 'knn', 'source': 'grm', 'knn_k': 1, 'weighted_edges': True, 'symmetrize_mode': 'mutual', 'use_snp_selection': False}. Best is trial 19 with value: 0.09185206122090518.
[I 2025-11-03 13:39:46,017] Trial 115 finished with value: 0.03796650578784401 and parameters: {'model_type': 'graphsage', 'hidden_dims': '[128, 64]', 'dropout': 0.346541942800374, 'batch_norm': True, 'lr': 0.0002689570659134966, 'weight_decay': 0.0006702104371420657, 'epochs': 337, 'loss': 'mae', 'optimizer': 'adam', 'graph_mode': 'knn', 'source': 'grm', 'knn_k': 1, 'weighted_edges': True, 'symmetrize_mode': 'mutual', 'use_snp_selection': False}. Best is trial 19 with value: 0.09185206122090518.
[I 2025-11-03 13:39:49,412] Trial 116 finished with value: 0.020962948498858814 and parameters: {'model_type': 'graphsage', 'hidden_dims': '[256, 128, 64]', 'dropout': 0.46189497620842573, 'batch_norm': True, 'lr': 0.0005174428877229354, 'weight_decay': 2.6824421429825685e-06, 'epochs': 331, 'loss': 'mae', 'optimizer': 'adam', 'graph_mode': 'knn', 'source': 'grm', 'knn_k': 3, 'weighted_edges': False, 'symmetrize_mode': 'union', 'use_snp_selection': False}. Best is trial 19 with value: 0.09185206122090518.
[I 2025-11-03 13:39:52,253] Trial 117 finished with value: 0.027870673087914837 and parameters: {'model_type': 'graphsage', 'hidden_dims': '[512, 64]', 'dropout': 0.3858362521465463, 'batch_norm': False, 'lr': 0.00017045291532383043, 'weight_decay': 0.00033500159893110797, 'epochs': 342, 'loss': 'mse', 'optimizer': 'adam', 'graph_mode': 'knn', 'source': 'grm', 'knn_k': 1, 'weighted_edges': True, 'symmetrize_mode': 'mutual', 'use_snp_selection': True, 'num_snps': 14288}. Best is trial 19 with value: 0.09185206122090518.
[I 2025-11-03 13:39:54,440] Trial 118 finished with value: -0.00949555367042936 and parameters: {'model_type': 'graphsage', 'hidden_dims': '[256, 128]', 'dropout': 0.40608340124782427, 'batch_norm': True, 'lr': 2.210482965702537e-05, 'weight_decay': 0.00026261191263256354, 'epochs': 160, 'loss': 'mse', 'optimizer': 'adam', 'graph_mode': 'cutoff', 'cutoff': 0.6776341688190042, 'grm_norm': 'none', 'self_loops': False, 'use_snp_selection': True, 'num_snps': 15872}. Best is trial 19 with value: 0.09185206122090518.
[I 2025-11-03 13:39:56,813] Trial 119 finished with value: 0.017056727191577224 and parameters: {'model_type': 'graphsage', 'hidden_dims': '[128, 64]', 'dropout': 0.36985221444671934, 'batch_norm': False, 'lr': 0.0003835209256894435, 'weight_decay': 0.0002010905905052193, 'epochs': 304, 'loss': 'mae', 'optimizer': 'adam', 'graph_mode': 'knn', 'source': 'grm', 'knn_k': 8, 'weighted_edges': True, 'symmetrize_mode': 'mutual', 'use_snp_selection': False}. Best is trial 19 with value: 0.09185206122090518.
[I 2025-11-03 13:39:59,595] Trial 120 finished with value: 0.015906456143802778 and parameters: {'model_type': 'graphsage', 'hidden_dims': '[256, 128, 64]', 'dropout': 0.3550163914704695, 'batch_norm': False, 'lr': 0.0002581718976930235, 'weight_decay': 0.00040218784040445884, 'epochs': 323, 'loss': 'mse', 'optimizer': 'adam', 'graph_mode': 'knn', 'source': 'grm', 'knn_k': 2, 'weighted_edges': True, 'symmetrize_mode': 'mutual', 'use_snp_selection': True, 'num_snps': 7156}. Best is trial 19 with value: 0.09185206122090518.
[I 2025-11-03 13:40:03,718] Trial 121 finished with value: 0.040480252734362815 and parameters: {'model_type': 'graphsage', 'hidden_dims': '[512, 256]', 'dropout': 0.3307569859056688, 'batch_norm': True, 'lr': 0.00021998381158251344, 'weight_decay': 7.240392814277089e-06, 'epochs': 283, 'loss': 'mae', 'optimizer': 'adam', 'graph_mode': 'knn', 'source': 'grm', 'knn_k': 1, 'weighted_edges': True, 'symmetrize_mode': 'mutual', 'use_snp_selection': False}. Best is trial 19 with value: 0.09185206122090518.
[I 2025-11-03 13:40:07,105] Trial 122 finished with value: 0.01740452166565822 and parameters: {'model_type': 'graphsage', 'hidden_dims': '[512, 64]', 'dropout': 0.4845887564406809, 'batch_norm': True, 'lr': 0.00013725398560535408, 'weight_decay': 5.124001099635535e-05, 'epochs': 184, 'loss': 'mae', 'optimizer': 'adam', 'graph_mode': 'knn', 'source': 'grm', 'knn_k': 1, 'weighted_edges': True, 'symmetrize_mode': 'mutual', 'use_snp_selection': False}. Best is trial 19 with value: 0.09185206122090518.
[I 2025-11-03 13:40:10,021] Trial 123 finished with value: 0.03693574546274195 and parameters: {'model_type': 'graphsage', 'hidden_dims': '[256, 128, 64]', 'dropout': 0.3563930867887774, 'batch_norm': True, 'lr': 0.0002944978469435433, 'weight_decay': 0.00016504045590025457, 'epochs': 243, 'loss': 'mae', 'optimizer': 'adam', 'graph_mode': 'knn', 'source': 'grm', 'knn_k': 9, 'weighted_edges': True, 'symmetrize_mode': 'mutual', 'use_snp_selection': False}. Best is trial 19 with value: 0.09185206122090518.
[I 2025-11-03 13:40:12,559] Trial 124 finished with value: 0.03894283969393413 and parameters: {'model_type': 'graphsage', 'hidden_dims': '[128, 64]', 'dropout': 0.32368801523614266, 'batch_norm': True, 'lr': 0.00018338381477861623, 'weight_decay': 0.00010251057386500584, 'epochs': 315, 'loss': 'mae', 'optimizer': 'adam', 'graph_mode': 'knn', 'source': 'grm', 'knn_k': 2, 'weighted_edges': True, 'symmetrize_mode': 'mutual', 'use_snp_selection': False}. Best is trial 19 with value: 0.09185206122090518.
