[I 2025-11-03 15:36:36,032] Trial 121 finished with value: 0.03221645403270796 and parameters: {'model_type': 'graphsage', 'hidden_dims': '[512, 64]', 'dropout': 0.589018877707647, 'batch_norm': True, 'lr': 0.0002548227963388668, 'weight_decay': 0.00014381154479938278, 'epochs': 168, 'loss': 'mse', 'optimizer': 'adam', 'graph_mode': 'cutoff', 'cutoff': 0.42859736859280234, 'grm_norm': 'cosine', 'self_loops': True, 'use_snp_selection': False}. Best is trial 48 with value: 0.06346059432764593.
[I 2025-11-03 15:36:41,131] Trial 122 finished with value: 0.056845682759499305 and parameters: {'model_type': 'graphsage', 'hidden_dims': '[512, 64]', 'dropout': 0.5744188950059155, 'batch_norm': True, 'lr': 0.0003878260891733409, 'weight_decay': 5.6556993214277735e-05, 'epochs': 339, 'loss': 'mse', 'optimizer': 'adam', 'graph_mode': 'cutoff', 'cutoff': 0.35344119969514126, 'grm_norm': 'cosine', 'self_loops': True, 'use_snp_selection': False}. Best is trial 48 with value: 0.06346059432764593.
[I 2025-11-03 15:36:44,381] Trial 123 finished with value: 0.046676460582249606 and parameters: {'model_type': 'graphsage', 'hidden_dims': '[512, 64]', 'dropout': 0.5731559022312067, 'batch_norm': True, 'lr': 0.0004224352962902388, 'weight_decay': 5.871319251415534e-05, 'epochs': 142, 'loss': 'mse', 'optimizer': 'adam', 'graph_mode': 'cutoff', 'cutoff': 0.34895758854049774, 'grm_norm': 'cosine', 'self_loops': True, 'use_snp_selection': False}. Best is trial 48 with value: 0.06346059432764593.
[I 2025-11-03 15:36:47,970] Trial 124 finished with value: 0.049968113363982165 and parameters: {'model_type': 'graphsage', 'hidden_dims': '[512, 64]', 'dropout': 0.5536894919830696, 'batch_norm': True, 'lr': 0.0007071657899099549, 'weight_decay': 2.3430780096652536e-05, 'epochs': 177, 'loss': 'mse', 'optimizer': 'adam', 'graph_mode': 'cutoff', 'cutoff': 0.3004428973678375, 'grm_norm': 'cosine', 'self_loops': True, 'use_snp_selection': False}. Best is trial 48 with value: 0.06346059432764593.
[I 2025-11-03 15:36:52,700] Trial 125 finished with value: 0.0355287214168958 and parameters: {'model_type': 'graphsage', 'hidden_dims': '[512, 64]', 'dropout': 0.5238619022202561, 'batch_norm': True, 'lr': 0.0003588332440252068, 'weight_decay': 8.381651086314897e-05, 'epochs': 204, 'loss': 'mse', 'optimizer': 'adam', 'graph_mode': 'cutoff', 'cutoff': 0.37042414660558587, 'grm_norm': 'cosine', 'self_loops': False, 'use_snp_selection': True, 'num_snps': 51942}. Best is trial 48 with value: 0.06346059432764593.
[I 2025-11-03 15:36:56,454] Trial 126 finished with value: 0.04769138019392097 and parameters: {'model_type': 'graphsage', 'hidden_dims': '[512, 64]', 'dropout': 0.5336814256215545, 'batch_norm': True, 'lr': 0.0008979265416305096, 'weight_decay': 2.8617462383247526e-05, 'epochs': 192, 'loss': 'mse', 'optimizer': 'adam', 'graph_mode': 'cutoff', 'cutoff': 0.3315781354600182, 'grm_norm': 'cosine_then_gcn', 'self_loops': True, 'use_snp_selection': False}. Best is trial 48 with value: 0.06346059432764593.
[I 2025-11-03 15:36:59,852] Trial 127 finished with value: 0.009408944448493406 and parameters: {'model_type': 'graphsage', 'hidden_dims': '[512, 64]', 'dropout': 0.5634163405939792, 'batch_norm': True, 'lr': 1.0051205212777261e-06, 'weight_decay': 0.0005937394314768473, 'epochs': 166, 'loss': 'mse', 'optimizer': 'adam', 'graph_mode': 'cutoff', 'cutoff': 0.5611463585978541, 'grm_norm': 'none', 'self_loops': True, 'use_snp_selection': False}. Best is trial 48 with value: 0.06346059432764593.
[I 2025-11-03 15:37:02,269] Trial 128 finished with value: 0.027713879341026745 and parameters: {'model_type': 'graphsage', 'hidden_dims': '[256, 128, 64]', 'dropout': 0.40641256112131297, 'batch_norm': True, 'lr': 0.00021194158751694207, 'weight_decay': 0.000991202904531472, 'epochs': 187, 'loss': 'mse', 'optimizer': 'adam', 'graph_mode': 'cutoff', 'cutoff': 0.5803698179083332, 'grm_norm': 'gcn', 'self_loops': False, 'use_snp_selection': False}. Best is trial 48 with value: 0.06346059432764593.
[I 2025-11-03 15:37:05,662] Trial 129 finished with value: 0.03952667639036553 and parameters: {'model_type': 'graphsage', 'hidden_dims': '[512, 64]', 'dropout': 0.5893911297915934, 'batch_norm': True, 'lr': 0.0002884086384959021, 'weight_decay': 4.6302958953215844e-05, 'epochs': 159, 'loss': 'mae', 'optimizer': 'adam', 'graph_mode': 'cutoff', 'cutoff': 0.5377636230367662, 'grm_norm': 'gcn', 'self_loops': True, 'use_snp_selection': False}. Best is trial 48 with value: 0.06346059432764593.
[I 2025-11-03 15:37:10,618] Trial 130 finished with value: 0.063037632816245 and parameters: {'model_type': 'graphsage', 'hidden_dims': '[512, 256]', 'dropout': 0.4974771220539595, 'batch_norm': True, 'lr': 0.0004697440836071526, 'weight_decay': 1.724894058422099e-05, 'epochs': 323, 'loss': 'mse', 'optimizer': 'adam', 'graph_mode': 'cutoff', 'cutoff': 0.3577700501584679, 'grm_norm': 'gcn', 'self_loops': True, 'use_snp_selection': False}. Best is trial 48 with value: 0.06346059432764593.
[I 2025-11-03 15:37:15,553] Trial 131 finished with value: 0.054055478185492306 and parameters: {'model_type': 'graphsage', 'hidden_dims': '[512, 256]', 'dropout': 0.5109337053173527, 'batch_norm': True, 'lr': 0.0004844008257916687, 'weight_decay': 6.540253643989508e-05, 'epochs': 327, 'loss': 'mse', 'optimizer': 'adam', 'graph_mode': 'cutoff', 'cutoff': 0.382181549527741, 'grm_norm': 'gcn', 'self_loops': True, 'use_snp_selection': False}. Best is trial 48 with value: 0.06346059432764593.
[I 2025-11-03 15:37:20,563] Trial 132 finished with value: 0.04176935420079384 and parameters: {'model_type': 'graphsage', 'hidden_dims': '[512, 256]', 'dropout': 0.506588595152008, 'batch_norm': True, 'lr': 0.0005011496877808111, 'weight_decay': 7.53556265693134e-05, 'epochs': 335, 'loss': 'mse', 'optimizer': 'adam', 'graph_mode': 'cutoff', 'cutoff': 0.38133016641969997, 'grm_norm': 'gcn', 'self_loops': True, 'use_snp_selection': False}. Best is trial 48 with value: 0.06346059432764593.
[I 2025-11-03 15:37:25,456] Trial 133 finished with value: 0.04472575748413206 and parameters: {'model_type': 'graphsage', 'hidden_dims': '[512, 256]', 'dropout': 0.5037217513063703, 'batch_norm': True, 'lr': 0.0006283613183335134, 'weight_decay': 2.009930269154865e-05, 'epochs': 323, 'loss': 'mse', 'optimizer': 'adam', 'graph_mode': 'cutoff', 'cutoff': 0.41621712081800666, 'grm_norm': 'gcn', 'self_loops': True, 'use_snp_selection': False}. Best is trial 48 with value: 0.06346059432764593.
[I 2025-11-03 15:37:30,207] Trial 134 finished with value: 0.04742114417663734 and parameters: {'model_type': 'graphsage', 'hidden_dims': '[512, 256]', 'dropout': 0.4918692094596485, 'batch_norm': True, 'lr': 0.0007765723111205337, 'weight_decay': 1.1317049482340985e-05, 'epochs': 307, 'loss': 'mse', 'optimizer': 'adam', 'graph_mode': 'cutoff', 'cutoff': 0.39788048926643615, 'grm_norm': 'gcn', 'self_loops': True, 'use_snp_selection': False}. Best is trial 48 with value: 0.06346059432764593.
[I 2025-11-03 15:37:35,350] Trial 135 finished with value: 0.05228861699547059 and parameters: {'model_type': 'graphsage', 'hidden_dims': '[512, 256]', 'dropout': 0.4816843730939508, 'batch_norm': True, 'lr': 0.0005642532932029718, 'weight_decay': 6.4497776031788e-06, 'epochs': 342, 'loss': 'mse', 'optimizer': 'adam', 'graph_mode': 'cutoff', 'cutoff': 0.3538798821410397, 'grm_norm': 'gcn', 'self_loops': True, 'use_snp_selection': False}. Best is trial 48 with value: 0.06346059432764593.
[I 2025-11-03 15:37:40,421] Trial 136 finished with value: 0.052573754776024245 and parameters: {'model_type': 'graphsage', 'hidden_dims': '[512, 256]', 'dropout': 0.49567276046581193, 'batch_norm': True, 'lr': 0.000991413836595509, 'weight_decay': 5.658313824584867e-05, 'epochs': 342, 'loss': 'mse', 'optimizer': 'adam', 'graph_mode': 'cutoff', 'cutoff': 0.44555332206053205, 'grm_norm': 'cosine', 'self_loops': False, 'use_snp_selection': False}. Best is trial 48 with value: 0.06346059432764593.
[I 2025-11-03 15:37:45,164] Trial 137 finished with value: 0.03921004664875066 and parameters: {'model_type': 'graphsage', 'hidden_dims': '[512, 256]', 'dropout': 0.12104507793592006, 'batch_norm': True, 'lr': 0.0004581317480206736, 'weight_decay': 9.941923759173214e-05, 'epochs': 316, 'loss': 'mse', 'optimizer': 'adam', 'graph_mode': 'cutoff', 'cutoff': 0.6144550872115819, 'grm_norm': 'none', 'self_loops': True, 'use_snp_selection': False}. Best is trial 48 with value: 0.06346059432764593.
[I 2025-11-03 15:37:50,129] Trial 138 finished with value: 0.028968487726133054 and parameters: {'model_type': 'graphsage', 'hidden_dims': '[512, 256]', 'dropout': 0.5131846906893267, 'batch_norm': True, 'lr': 0.00030817417711462676, 'weight_decay': 3.8684800352370354e-05, 'epochs': 327, 'loss': 'mse', 'optimizer': 'adam', 'graph_mode': 'cutoff', 'cutoff': 0.45856185779495795, 'grm_norm': 'gcn', 'self_loops': True, 'use_snp_selection': False}. Best is trial 48 with value: 0.06346059432764593.
[I 2025-11-03 15:37:55,397] Trial 139 finished with value: 0.026073182360825755 and parameters: {'model_type': 'graphsage', 'hidden_dims': '[512, 256]', 'dropout': 0.5484967042242599, 'batch_norm': True, 'lr': 1.292606734838329e-05, 'weight_decay': 1.4917549745221596e-05, 'epochs': 330, 'loss': 'mse', 'optimizer': 'adam', 'graph_mode': 'knn', 'source': 'grm', 'knn_k': 3, 'weighted_edges': True, 'symmetrize_mode': 'union', 'use_snp_selection': False}. Best is trial 48 with value: 0.06346059432764593.
[I 2025-11-03 15:38:00,498] Trial 140 finished with value: 0.050357765840772485 and parameters: {'model_type': 'graphsage', 'hidden_dims': '[512, 256]', 'dropout': 0.44291228458708704, 'batch_norm': True, 'lr': 0.00035355678680293963, 'weight_decay': 2.947155568962077e-05, 'epochs': 339, 'loss': 'mse', 'optimizer': 'adam', 'graph_mode': 'cutoff', 'cutoff': 0.3757120041673709, 'grm_norm': 'gcn', 'self_loops': False, 'use_snp_selection': False}. Best is trial 48 with value: 0.06346059432764593.
[I 2025-11-03 15:38:04,377] Trial 141 finished with value: 0.044004044256288836 and parameters: {'model_type': 'graphsage', 'hidden_dims': '[512, 64]', 'dropout': 0.5759265229201526, 'batch_norm': True, 'lr': 0.0003987785199435978, 'weight_decay': 0.00017717259225837775, 'epochs': 209, 'loss': 'mse', 'optimizer': 'adam', 'graph_mode': 'cutoff', 'cutoff': 0.3180588032615916, 'grm_norm': 'gcn', 'self_loops': True, 'use_snp_selection': False}. Best is trial 48 with value: 0.06346059432764593.
[I 2025-11-03 15:38:09,520] Trial 142 finished with value: 0.0534833501041905 and parameters: {'model_type': 'graphsage', 'hidden_dims': '[512, 64]', 'dropout': 0.5242572653581066, 'batch_norm': True, 'lr': 0.0006669048906870233, 'weight_decay': 0.0006667096504402435, 'epochs': 350, 'loss': 'mse', 'optimizer': 'adam', 'graph_mode': 'cutoff', 'cutoff': 0.36543938884277904, 'grm_norm': 'gcn', 'self_loops': True, 'use_snp_selection': False}. Best is trial 48 with value: 0.06346059432764593.
[I 2025-11-03 15:38:14,644] Trial 143 finished with value: 0.04851842568290128 and parameters: {'model_type': 'graphsage', 'hidden_dims': '[512, 64]', 'dropout': 0.5227815344434315, 'batch_norm': True, 'lr': 0.0006782122766389514, 'weight_decay': 6.343317665791025e-05, 'epochs': 349, 'loss': 'mse', 'optimizer': 'adam', 'graph_mode': 'cutoff', 'cutoff': 0.3945825927144876, 'grm_norm': 'gcn', 'self_loops': True, 'use_snp_selection': False}. Best is trial 48 with value: 0.06346059432764593.
[I 2025-11-03 15:38:19,547] Trial 144 finished with value: 0.036679139990598936 and parameters: {'model_type': 'graphsage', 'hidden_dims': '[512, 128]', 'dropout': 0.5332950887582899, 'batch_norm': True, 'lr': 0.0008211234633715119, 'weight_decay': 0.00013585699750969912, 'epochs': 325, 'loss': 'mse', 'optimizer': 'adam', 'graph_mode': 'cutoff', 'cutoff': 0.43430454550525743, 'grm_norm': 'gcn', 'self_loops': True, 'use_snp_selection': False}. Best is trial 48 with value: 0.06346059432764593.
[I 2025-11-03 15:38:24,487] Trial 145 finished with value: 0.03773919192280087 and parameters: {'model_type': 'graphsage', 'hidden_dims': '[512, 64]', 'dropout': 0.4579382054085935, 'batch_norm': True, 'lr': 0.0005533144691633518, 'weight_decay': 0.0008064080571261654, 'epochs': 320, 'loss': 'mse', 'optimizer': 'adam', 'graph_mode': 'cutoff', 'cutoff': 0.3360071235088042, 'grm_norm': 'gcn', 'self_loops': True, 'use_snp_selection': False}. Best is trial 48 with value: 0.06346059432764593.
[I 2025-11-03 15:38:29,561] Trial 146 finished with value: 0.041602051891433636 and parameters: {'model_type': 'graphsage', 'hidden_dims': '[512, 64]', 'dropout': 0.5152115731994392, 'batch_norm': True, 'lr': 0.00046810879114382364, 'weight_decay': 0.0006690131922677058, 'epochs': 344, 'loss': 'mse', 'optimizer': 'adam', 'graph_mode': 'cutoff', 'cutoff': 0.4152190059530075, 'grm_norm': 'gcn', 'self_loops': True, 'use_snp_selection': False}. Best is trial 48 with value: 0.06346059432764593.
[I 2025-11-03 15:38:33,064] Trial 147 finished with value: 0.052355562950033026 and parameters: {'model_type': 'graphsage', 'hidden_dims': '[256, 128]', 'dropout': 0.5422341292429681, 'batch_norm': False, 'lr': 0.0006620487290042078, 'weight_decay': 0.00029760621570778736, 'epochs': 350, 'loss': 'mse', 'optimizer': 'adam', 'graph_mode': 'cutoff', 'cutoff': 0.3605192488326652, 'grm_norm': 'none', 'self_loops': True, 'use_snp_selection': True, 'num_snps': 37428}. Best is trial 48 with value: 0.06346059432764593.
[I 2025-11-03 15:38:35,336] Trial 148 finished with value: 0.05464939064153647 and parameters: {'model_type': 'graphsage', 'hidden_dims': '[128, 64]', 'dropout': 0.4960656681009334, 'batch_norm': True, 'lr': 0.0007533236281621014, 'weight_decay': 4.445298982926245e-05, 'epochs': 286, 'loss': 'mse', 'optimizer': 'adam', 'graph_mode': 'cutoff', 'cutoff': 0.38816139660553134, 'grm_norm': 'gcn', 'self_loops': True, 'use_snp_selection': False}. Best is trial 48 with value: 0.06346059432764593.
[I 2025-11-03 15:38:37,679] Trial 149 finished with value: 0.03589142616647331 and parameters: {'model_type': 'graphsage', 'hidden_dims': '[128, 64]', 'dropout': 0.25703192978796674, 'batch_norm': True, 'lr': 0.0008531348271549406, 'weight_decay': 3.4102263516610266e-05, 'epochs': 303, 'loss': 'mse', 'optimizer': 'adam', 'graph_mode': 'cutoff', 'cutoff': 0.4050977675646656, 'grm_norm': 'cosine', 'self_loops': False, 'use_snp_selection': False}. Best is trial 48 with value: 0.06346059432764593.
[I 2025-11-03 15:38:41,639] Trial 0 finished with value: 0.021453510710351342 and parameters: {'model_type': 'graphsage', 'hidden_dims': '[128, 64]', 'dropout': 0.199031432379812, 'batch_norm': True, 'lr': 1.8408544111075837e-06, 'weight_decay': 5.5136510071208614e-05, 'epochs': 336, 'loss': 'mae', 'optimizer': 'adam', 'graph_mode': 'knn', 'source': 'grm', 'knn_k': 8, 'weighted_edges': True, 'symmetrize_mode': 'mutual', 'use_snp_selection': False}. Best is trial 0 with value: 0.021453510710351342.
[I 2025-11-03 15:38:43,571] Trial 1 finished with value: 0.08019285081602102 and parameters: {'model_type': 'graphsage', 'hidden_dims': '[128, 64]', 'dropout': 0.40051947670227217, 'batch_norm': True, 'lr': 0.0005320428882732732, 'weight_decay': 1.89210117736594e-06, 'epochs': 68, 'loss': 'mse', 'optimizer': 'adam', 'graph_mode': 'knn', 'source': 'grm', 'knn_k': 7, 'weighted_edges': True, 'symmetrize_mode': 'union', 'use_snp_selection': False}. Best is trial 1 with value: 0.08019285081602102.
[I 2025-11-03 15:38:46,488] Trial 2 finished with value: 0.01925606215244736 and parameters: {'model_type': 'graphsage', 'hidden_dims': '[256, 128]', 'dropout': 0.5105528289184642, 'batch_norm': False, 'lr': 0.0006804279372404962, 'weight_decay': 0.0008922815224257085, 'epochs': 181, 'loss': 'mse', 'optimizer': 'adam', 'graph_mode': 'cutoff', 'cutoff': 0.5741905641612706, 'grm_norm': 'gcn', 'self_loops': False, 'use_snp_selection': True, 'num_snps': 26910}. Best is trial 1 with value: 0.08019285081602102.
[I 2025-11-03 15:38:49,683] Trial 3 finished with value: 0.048079011556318975 and parameters: {'model_type': 'graphsage', 'hidden_dims': '[256, 128, 64]', 'dropout': 0.5390483213624292, 'batch_norm': False, 'lr': 3.4705625989073525e-05, 'weight_decay': 2.4623319020131338e-05, 'epochs': 121, 'loss': 'mse', 'optimizer': 'adam', 'graph_mode': 'knn', 'source': 'grm', 'knn_k': 6, 'weighted_edges': False, 'symmetrize_mode': 'mutual', 'use_snp_selection': True, 'num_snps': 30713}. Best is trial 1 with value: 0.08019285081602102.
[I 2025-11-03 15:38:52,665] Trial 4 finished with value: 0.07730057034089231 and parameters: {'model_type': 'graphsage', 'hidden_dims': '[128, 64]', 'dropout': 0.13404863676897502, 'batch_norm': False, 'lr': 0.0001431556295367288, 'weight_decay': 2.2084517750726675e-05, 'epochs': 51, 'loss': 'mae', 'optimizer': 'adam', 'graph_mode': 'cutoff', 'cutoff': 0.6714268476993044, 'grm_norm': 'none', 'self_loops': False, 'use_snp_selection': True, 'num_snps': 45645}. Best is trial 1 with value: 0.08019285081602102.
[I 2025-11-03 15:38:56,612] Trial 5 finished with value: 0.06274500587261664 and parameters: {'model_type': 'graphsage', 'hidden_dims': '[256, 128]', 'dropout': 0.42253606323412096, 'batch_norm': False, 'lr': 4.238630400638805e-05, 'weight_decay': 8.074086040046576e-07, 'epochs': 158, 'loss': 'mae', 'optimizer': 'adam', 'graph_mode': 'knn', 'source': 'grm', 'knn_k': 1, 'weighted_edges': False, 'symmetrize_mode': 'mutual', 'use_snp_selection': True, 'num_snps': 43113}. Best is trial 1 with value: 0.08019285081602102.
[I 2025-11-03 15:39:02,301] Trial 6 finished with value: 0.07949671096508726 and parameters: {'model_type': 'graphsage', 'hidden_dims': '[512, 256]', 'dropout': 0.3534893146320237, 'batch_norm': True, 'lr': 0.000251307964226932, 'weight_decay': 1.821819791794022e-05, 'epochs': 223, 'loss': 'mae', 'optimizer': 'adam', 'graph_mode': 'knn', 'source': 'grm', 'knn_k': 1, 'weighted_edges': True, 'symmetrize_mode': 'mutual', 'use_snp_selection': False}. Best is trial 1 with value: 0.08019285081602102.
[I 2025-11-03 15:39:07,348] Trial 7 finished with value: 0.05870733189578806 and parameters: {'model_type': 'graphsage', 'hidden_dims': '[512, 256]', 'dropout': 0.1105825955860775, 'batch_norm': True, 'lr': 2.374338412754043e-05, 'weight_decay': 1.1284721123340274e-05, 'epochs': 190, 'loss': 'mse', 'optimizer': 'adam', 'graph_mode': 'cutoff', 'cutoff': 0.719872204109604, 'grm_norm': 'gcn', 'self_loops': False, 'use_snp_selection': False}. Best is trial 1 with value: 0.08019285081602102.
[I 2025-11-03 15:39:11,657] Trial 8 finished with value: 0.07811464498031205 and parameters: {'model_type': 'graphsage', 'hidden_dims': '[512, 128]', 'dropout': 0.5066580418354021, 'batch_norm': True, 'lr': 0.00039213678276659976, 'weight_decay': 3.43655320802934e-06, 'epochs': 120, 'loss': 'mse', 'optimizer': 'adam', 'graph_mode': 'cutoff', 'cutoff': 0.34923059576505366, 'grm_norm': 'cosine', 'self_loops': True, 'use_snp_selection': False}. Best is trial 1 with value: 0.08019285081602102.
[I 2025-11-03 15:39:14,269] Trial 9 finished with value: 0.050282917614967754 and parameters: {'model_type': 'graphsage', 'hidden_dims': '[512, 256]', 'dropout': 0.301734920240333, 'batch_norm': False, 'lr': 6.650961854953448e-06, 'weight_decay': 6.861575656590315e-05, 'epochs': 150, 'loss': 'mae', 'optimizer': 'adam', 'graph_mode': 'cutoff', 'cutoff': 0.2857569870061939, 'grm_norm': 'cosine_then_gcn', 'self_loops': False, 'use_snp_selection': True, 'num_snps': 12722}. Best is trial 1 with value: 0.08019285081602102.
[I 2025-11-03 15:39:17,399] Trial 10 finished with value: 0.05463376435197736 and parameters: {'model_type': 'graphsage', 'hidden_dims': '[512, 64]', 'dropout': 0.2923745636750988, 'batch_norm': True, 'lr': 0.00010001966977255833, 'weight_decay': 1.2618827301366646e-07, 'epochs': 41, 'loss': 'mse', 'optimizer': 'adam', 'graph_mode': 'knn', 'source': 'grm', 'knn_k': 10, 'weighted_edges': True, 'symmetrize_mode': 'union', 'use_snp_selection': False}. Best is trial 1 with value: 0.08019285081602102.
[I 2025-11-03 15:39:23,941] Trial 11 finished with value: 0.09587298356876896 and parameters: {'model_type': 'graphsage', 'hidden_dims': '[512, 256]', 'dropout': 0.3719635790172371, 'batch_norm': True, 'lr': 0.000791308626346835, 'weight_decay': 1.8187594072837697e-06, 'epochs': 269, 'loss': 'mae', 'optimizer': 'adam', 'graph_mode': 'knn', 'source': 'grm', 'knn_k': 1, 'weighted_edges': True, 'symmetrize_mode': 'union', 'use_snp_selection': False}. Best is trial 11 with value: 0.09587298356876896.
[I 2025-11-03 15:39:27,470] Trial 12 finished with value: 0.07052104031341247 and parameters: {'model_type': 'graphsage', 'hidden_dims': '[128, 64]', 'dropout': 0.4114983712460624, 'batch_norm': True, 'lr': 0.0005914978871227773, 'weight_decay': 1.5741178562840553e-06, 'epochs': 278, 'loss': 'mse', 'optimizer': 'adam', 'graph_mode': 'knn', 'source': 'grm', 'knn_k': 4, 'weighted_edges': True, 'symmetrize_mode': 'union', 'use_snp_selection': False}. Best is trial 11 with value: 0.09587298356876896.
[I 2025-11-03 15:39:34,601] Trial 13 finished with value: 0.0858057072755542 and parameters: {'model_type': 'graphsage', 'hidden_dims': '[512, 64]', 'dropout': 0.43999058883580466, 'batch_norm': True, 'lr': 0.0009956278186051537, 'weight_decay': 2.988812407507651e-07, 'epochs': 254, 'loss': 'mae', 'optimizer': 'adam', 'graph_mode': 'knn', 'source': 'grm', 'knn_k': 5, 'weighted_edges': True, 'symmetrize_mode': 'union', 'use_snp_selection': False}. Best is trial 11 with value: 0.09587298356876896.
