[I 2025-11-03 13:38:46,236] Trial 31 finished with value: 0.07200565791418838 and parameters: {'model_type': 'gcn', 'hidden_dims': '[512, 64]', 'dropout': 0.4480978565317902, 'batch_norm': True, 'lr': 0.0005988167296561029, 'weight_decay': 2.6547006755559354e-06, 'epochs': 65, 'loss': 'mse', 'optimizer': 'adam', 'graph_mode': 'cutoff', 'cutoff': 0.7745032509614005, 'grm_norm': 'cosine', 'self_loops': True, 'use_snp_selection': False}. Best is trial 13 with value: 0.08890949430380493.
[I 2025-11-03 13:38:47,872] Trial 32 finished with value: 0.08209989929267963 and parameters: {'model_type': 'gcn', 'hidden_dims': '[512, 64]', 'dropout': 0.5175531082892659, 'batch_norm': True, 'lr': 0.000987942973462945, 'weight_decay': 2.2797935520476807e-07, 'epochs': 72, 'loss': 'mse', 'optimizer': 'adam', 'graph_mode': 'cutoff', 'cutoff': 0.7866781700777594, 'grm_norm': 'cosine', 'self_loops': True, 'use_snp_selection': False}. Best is trial 13 with value: 0.08890949430380493.
[I 2025-11-03 13:38:50,819] Trial 33 finished with value: 0.07861377624738562 and parameters: {'model_type': 'gcn', 'hidden_dims': '[512, 64]', 'dropout': 0.5259695519788556, 'batch_norm': True, 'lr': 0.0006145525252676201, 'weight_decay': 2.0507265298565127e-07, 'epochs': 307, 'loss': 'mse', 'optimizer': 'adam', 'graph_mode': 'cutoff', 'cutoff': 0.5958169930526278, 'grm_norm': 'cosine', 'self_loops': True, 'use_snp_selection': False}. Best is trial 13 with value: 0.08890949430380493.
[I 2025-11-03 13:38:52,024] Trial 34 finished with value: 0.0278567501380484 and parameters: {'model_type': 'gcn', 'hidden_dims': '[512, 64]', 'dropout': 0.49029268944593285, 'batch_norm': False, 'lr': 0.00031192520483336956, 'weight_decay': 2.072951586364579e-07, 'epochs': 105, 'loss': 'mse', 'optimizer': 'adam', 'graph_mode': 'cutoff', 'cutoff': 0.7773112609055384, 'grm_norm': 'cosine', 'self_loops': True, 'use_snp_selection': True, 'num_snps': 3631}. Best is trial 13 with value: 0.08890949430380493.
[I 2025-11-03 13:38:53,930] Trial 35 finished with value: 0.050637250604214826 and parameters: {'model_type': 'gcn', 'hidden_dims': '[512, 64]', 'dropout': 0.5523635461787572, 'batch_norm': False, 'lr': 0.00013372658966344657, 'weight_decay': 1.003337652262011e-07, 'epochs': 149, 'loss': 'mse', 'optimizer': 'adam', 'graph_mode': 'cutoff', 'cutoff': 0.4973277365377077, 'grm_norm': 'gcn', 'self_loops': True, 'use_snp_selection': True, 'num_snps': 17571}. Best is trial 13 with value: 0.08890949430380493.
[I 2025-11-03 13:38:55,279] Trial 36 finished with value: 0.04267042053114553 and parameters: {'model_type': 'gcn', 'hidden_dims': '[256, 128]', 'dropout': 0.5164310668505161, 'batch_norm': True, 'lr': 0.0001945098211432831, 'weight_decay': 6.419590150366243e-07, 'epochs': 75, 'loss': 'mae', 'optimizer': 'adam', 'graph_mode': 'cutoff', 'cutoff': 0.6603189758162229, 'grm_norm': 'none', 'self_loops': True, 'use_snp_selection': False}. Best is trial 13 with value: 0.08890949430380493.
[I 2025-11-03 13:38:56,309] Trial 37 finished with value: 0.02890819446656358 and parameters: {'model_type': 'gcn', 'hidden_dims': '[128, 64]', 'dropout': 0.44879636458581607, 'batch_norm': True, 'lr': 5.269266671309004e-05, 'weight_decay': 1.103963246107643e-06, 'epochs': 15, 'loss': 'mse', 'optimizer': 'adam', 'graph_mode': 'cutoff', 'cutoff': 0.7901233721677359, 'grm_norm': 'cosine', 'self_loops': False, 'use_snp_selection': False}. Best is trial 13 with value: 0.08890949430380493.
[I 2025-11-03 13:38:59,958] Trial 38 finished with value: 0.008097055302758609 and parameters: {'model_type': 'gcn', 'hidden_dims': '[256, 128, 64]', 'dropout': 0.3390740006710154, 'batch_norm': False, 'lr': 0.0006566101093985454, 'weight_decay': 2.1613853219074742e-07, 'epochs': 176, 'loss': 'mse', 'optimizer': 'adam', 'graph_mode': 'knn', 'source': 'grm', 'knn_k': 4, 'weighted_edges': True, 'symmetrize_mode': 'union', 'use_snp_selection': True, 'num_snps': 58508}. Best is trial 13 with value: 0.08890949430380493.
[I 2025-11-03 13:39:01,867] Trial 39 finished with value: 0.06877418587027986 and parameters: {'model_type': 'gcn', 'hidden_dims': '[512, 256]', 'dropout': 0.49194127017548556, 'batch_norm': True, 'lr': 0.0004168956272768832, 'weight_decay': 4.864851955320911e-07, 'epochs': 105, 'loss': 'mae', 'optimizer': 'adam', 'graph_mode': 'cutoff', 'cutoff': 0.6799634789321025, 'grm_norm': 'cosine_then_gcn', 'self_loops': True, 'use_snp_selection': False}. Best is trial 13 with value: 0.08890949430380493.
[I 2025-11-03 13:39:03,339] Trial 40 finished with value: 0.05644437100540088 and parameters: {'model_type': 'gcn', 'hidden_dims': '[512, 64]', 'dropout': 0.5402223544330395, 'batch_norm': True, 'lr': 0.00021882955524351008, 'weight_decay': 5.304840845054719e-05, 'epochs': 27, 'loss': 'mse', 'optimizer': 'adam', 'graph_mode': 'knn', 'source': 'grm', 'knn_k': 8, 'weighted_edges': True, 'symmetrize_mode': 'union', 'use_snp_selection': False}. Best is trial 13 with value: 0.08890949430380493.
[I 2025-11-03 13:39:04,892] Trial 41 finished with value: 0.08277024941758777 and parameters: {'model_type': 'gcn', 'hidden_dims': '[512, 128]', 'dropout': 0.4623472041183019, 'batch_norm': True, 'lr': 0.0009779472922496896, 'weight_decay': 9.23146552727559e-06, 'epochs': 52, 'loss': 'mse', 'optimizer': 'adam', 'graph_mode': 'cutoff', 'cutoff': 0.8350392984457338, 'grm_norm': 'cosine', 'self_loops': True, 'use_snp_selection': False}. Best is trial 13 with value: 0.08890949430380493.
[I 2025-11-03 13:39:06,059] Trial 42 finished with value: 0.06766908140649341 and parameters: {'model_type': 'gcn', 'hidden_dims': '[128, 64]', 'dropout': 0.46257728151881716, 'batch_norm': True, 'lr': 0.0006662581888662441, 'weight_decay': 1.4373637339217944e-05, 'epochs': 57, 'loss': 'mse', 'optimizer': 'adam', 'graph_mode': 'cutoff', 'cutoff': 0.8228463721444266, 'grm_norm': 'cosine', 'self_loops': True, 'use_snp_selection': False}. Best is trial 13 with value: 0.08890949430380493.
[I 2025-11-03 13:39:07,339] Trial 43 finished with value: 0.03650798445605137 and parameters: {'model_type': 'gcn', 'hidden_dims': '[512, 128]', 'dropout': 0.40631525736495705, 'batch_norm': True, 'lr': 0.0003201464585770352, 'weight_decay': 6.029790514556128e-06, 'epochs': 2, 'loss': 'mse', 'optimizer': 'adam', 'graph_mode': 'cutoff', 'cutoff': 0.7392993779332637, 'grm_norm': 'cosine', 'self_loops': True, 'use_snp_selection': False}. Best is trial 13 with value: 0.08890949430380493.
[I 2025-11-03 13:39:08,733] Trial 44 finished with value: 0.07324938842156477 and parameters: {'model_type': 'gcn', 'hidden_dims': '[256, 128]', 'dropout': 0.5028547267599169, 'batch_norm': True, 'lr': 0.0009718493027251876, 'weight_decay': 2.8766591148662975e-05, 'epochs': 73, 'loss': 'mse', 'optimizer': 'adam', 'graph_mode': 'cutoff', 'cutoff': 0.8311468016288327, 'grm_norm': 'cosine', 'self_loops': True, 'use_snp_selection': False}. Best is trial 13 with value: 0.08890949430380493.
[I 2025-11-03 13:39:10,511] Trial 45 finished with value: 0.09999459353692468 and parameters: {'model_type': 'gcn', 'hidden_dims': '[512, 256]', 'dropout': 0.15760193683591667, 'batch_norm': True, 'lr': 0.0004874707614837833, 'weight_decay': 0.00014681168250841656, 'epochs': 90, 'loss': 'mse', 'optimizer': 'adam', 'graph_mode': 'cutoff', 'cutoff': 0.622569930825055, 'grm_norm': 'cosine', 'self_loops': True, 'use_snp_selection': False}. Best is trial 45 with value: 0.09999459353692468.
[I 2025-11-03 13:39:13,381] Trial 46 finished with value: 0.017719456173100813 and parameters: {'model_type': 'gcn', 'hidden_dims': '[512, 256]', 'dropout': 0.11522004249081291, 'batch_norm': False, 'lr': 0.0007429712647124103, 'weight_decay': 0.0003822875459739891, 'epochs': 93, 'loss': 'mse', 'optimizer': 'adam', 'graph_mode': 'cutoff', 'cutoff': 0.6328479986843811, 'grm_norm': 'cosine', 'self_loops': True, 'use_snp_selection': True, 'num_snps': 44397}. Best is trial 45 with value: 0.09999459353692468.
[I 2025-11-03 13:39:14,948] Trial 47 finished with value: 0.08747934444378504 and parameters: {'model_type': 'gcn', 'hidden_dims': '[512, 256]', 'dropout': 0.36289381187571024, 'batch_norm': True, 'lr': 0.0003462615691758366, 'weight_decay': 0.00011289910531718307, 'epochs': 37, 'loss': 'mae', 'optimizer': 'adam', 'graph_mode': 'cutoff', 'cutoff': 0.44640128465901413, 'grm_norm': 'cosine_then_gcn', 'self_loops': True, 'use_snp_selection': False}. Best is trial 45 with value: 0.09999459353692468.
[I 2025-11-03 13:39:16,515] Trial 48 finished with value: 0.06680693253210555 and parameters: {'model_type': 'gcn', 'hidden_dims': '[512, 256]', 'dropout': 0.1533817465406559, 'batch_norm': True, 'lr': 0.00013982008049500766, 'weight_decay': 0.0001517893121587825, 'epochs': 40, 'loss': 'mae', 'optimizer': 'adam', 'graph_mode': 'knn', 'source': 'grm', 'knn_k': 4, 'weighted_edges': False, 'symmetrize_mode': 'mutual', 'use_snp_selection': False}. Best is trial 45 with value: 0.09999459353692468.
[I 2025-11-03 13:39:17,913] Trial 49 finished with value: 0.06468296899391465 and parameters: {'model_type': 'gcn', 'hidden_dims': '[512, 256]', 'dropout': 0.26001650564268414, 'batch_norm': True, 'lr': 8.922345308717621e-05, 'weight_decay': 9.368220995376336e-05, 'epochs': 16, 'loss': 'mae', 'optimizer': 'adam', 'graph_mode': 'cutoff', 'cutoff': 0.4824678549172195, 'grm_norm': 'cosine_then_gcn', 'self_loops': False, 'use_snp_selection': False}. Best is trial 45 with value: 0.09999459353692468.
[I 2025-11-03 13:39:20,524] Trial 50 finished with value: 0.057946238896924594 and parameters: {'model_type': 'gcn', 'hidden_dims': '[512, 256]', 'dropout': 0.35960693313231185, 'batch_norm': True, 'lr': 0.00034821094694334286, 'weight_decay': 3.192577224729498e-05, 'epochs': 225, 'loss': 'mae', 'optimizer': 'adam', 'graph_mode': 'knn', 'source': 'grm', 'knn_k': 6, 'weighted_edges': True, 'symmetrize_mode': 'union', 'use_snp_selection': False}. Best is trial 45 with value: 0.09999459353692468.
[I 2025-11-03 13:39:22,164] Trial 51 finished with value: 0.06752867769809028 and parameters: {'model_type': 'gcn', 'hidden_dims': '[512, 256]', 'dropout': 0.32320112830599423, 'batch_norm': True, 'lr': 0.000742027525584967, 'weight_decay': 0.0001448927622709743, 'epochs': 59, 'loss': 'mae', 'optimizer': 'adam', 'graph_mode': 'cutoff', 'cutoff': 0.5178084991886727, 'grm_norm': 'cosine_then_gcn', 'self_loops': True, 'use_snp_selection': False}. Best is trial 45 with value: 0.09999459353692468.
[I 2025-11-03 13:39:23,957] Trial 52 finished with value: 0.05777473966375662 and parameters: {'model_type': 'gcn', 'hidden_dims': '[512, 256]', 'dropout': 0.3800198494013192, 'batch_norm': True, 'lr': 0.0004793922981476433, 'weight_decay': 0.0007737766883478641, 'epochs': 88, 'loss': 'mae', 'optimizer': 'adam', 'graph_mode': 'cutoff', 'cutoff': 0.4003417075001431, 'grm_norm': 'cosine_then_gcn', 'self_loops': True, 'use_snp_selection': False}. Best is trial 45 with value: 0.09999459353692468.
[I 2025-11-03 13:39:25,365] Trial 53 finished with value: 0.06775977657800329 and parameters: {'model_type': 'gcn', 'hidden_dims': '[512, 128]', 'dropout': 0.42453276606905266, 'batch_norm': True, 'lr': 0.0009917295402997039, 'weight_decay': 1.150023956378527e-05, 'epochs': 22, 'loss': 'mse', 'optimizer': 'adam', 'graph_mode': 'cutoff', 'cutoff': 0.587233909561889, 'grm_norm': 'gcn', 'self_loops': True, 'use_snp_selection': False}. Best is trial 45 with value: 0.09999459353692468.
[I 2025-11-03 13:39:27,047] Trial 54 finished with value: 0.085886281298761 and parameters: {'model_type': 'gcn', 'hidden_dims': '[512, 256]', 'dropout': 0.1846899656556063, 'batch_norm': True, 'lr': 0.0002386681226404741, 'weight_decay': 0.0002474736993697178, 'epochs': 69, 'loss': 'mse', 'optimizer': 'adam', 'graph_mode': 'cutoff', 'cutoff': 0.5707580089899243, 'grm_norm': 'cosine_then_gcn', 'self_loops': True, 'use_snp_selection': False}. Best is trial 45 with value: 0.09999459353692468.
[I 2025-11-03 13:39:29,837] Trial 55 finished with value: 0.05852870513949001 and parameters: {'model_type': 'gcn', 'hidden_dims': '[512, 256]', 'dropout': 0.1717302768380028, 'batch_norm': True, 'lr': 0.0002379267898390548, 'weight_decay': 0.0002517002394494396, 'epochs': 266, 'loss': 'mse', 'optimizer': 'adam', 'graph_mode': 'cutoff', 'cutoff': 0.4387374876750736, 'grm_norm': 'cosine_then_gcn', 'self_loops': False, 'use_snp_selection': False}. Best is trial 45 with value: 0.09999459353692468.
[I 2025-11-03 13:39:31,412] Trial 56 finished with value: 0.027807668726833046 and parameters: {'model_type': 'gcn', 'hidden_dims': '[512, 256]', 'dropout': 0.19373106639956175, 'batch_norm': True, 'lr': 2.8447836518732854e-05, 'weight_decay': 4.3625855956489325e-05, 'epochs': 42, 'loss': 'mae', 'optimizer': 'adam', 'graph_mode': 'knn', 'source': 'grm', 'knn_k': 2, 'weighted_edges': True, 'symmetrize_mode': 'union', 'use_snp_selection': False}. Best is trial 45 with value: 0.09999459353692468.
[I 2025-11-03 13:39:33,734] Trial 57 finished with value: 0.08822649705203618 and parameters: {'model_type': 'gcn', 'hidden_dims': '[512, 256]', 'dropout': 0.14136874802604685, 'batch_norm': True, 'lr': 0.000422217066797406, 'weight_decay': 8.343777467884658e-05, 'epochs': 183, 'loss': 'mse', 'optimizer': 'adam', 'graph_mode': 'cutoff', 'cutoff': 0.5683886877654138, 'grm_norm': 'cosine_then_gcn', 'self_loops': True, 'use_snp_selection': False}. Best is trial 45 with value: 0.09999459353692468.
[I 2025-11-03 13:39:36,049] Trial 58 finished with value: 0.09070016874466445 and parameters: {'model_type': 'gcn', 'hidden_dims': '[512, 256]', 'dropout': 0.10192332063096868, 'batch_norm': True, 'lr': 0.000382754446323794, 'weight_decay': 9.111276778057621e-05, 'epochs': 184, 'loss': 'mse', 'optimizer': 'adam', 'graph_mode': 'cutoff', 'cutoff': 0.5526637766362834, 'grm_norm': 'cosine_then_gcn', 'self_loops': True, 'use_snp_selection': False}. Best is trial 45 with value: 0.09999459353692468.
[I 2025-11-03 13:39:38,325] Trial 59 finished with value: 0.08050621663612462 and parameters: {'model_type': 'gcn', 'hidden_dims': '[512, 256]', 'dropout': 0.13305649651556833, 'batch_norm': True, 'lr': 0.0002616298468413822, 'weight_decay': 8.979408234596027e-05, 'epochs': 173, 'loss': 'mse', 'optimizer': 'adam', 'graph_mode': 'cutoff', 'cutoff': 0.5459660935378626, 'grm_norm': 'cosine_then_gcn', 'self_loops': True, 'use_snp_selection': False}. Best is trial 45 with value: 0.09999459353692468.
[I 2025-11-03 13:39:40,467] Trial 60 finished with value: 0.04318249545839283 and parameters: {'model_type': 'gcn', 'hidden_dims': '[512, 256]', 'dropout': 0.16328972415212423, 'batch_norm': False, 'lr': 0.00011105953476050954, 'weight_decay': 0.0001912276062599552, 'epochs': 212, 'loss': 'mse', 'optimizer': 'adam', 'graph_mode': 'cutoff', 'cutoff': 0.5655583543360897, 'grm_norm': 'cosine_then_gcn', 'self_loops': True, 'use_snp_selection': True, 'num_snps': 19019}. Best is trial 45 with value: 0.09999459353692468.
[I 2025-11-03 13:39:42,820] Trial 61 finished with value: 0.08962698770298629 and parameters: {'model_type': 'gcn', 'hidden_dims': '[512, 256]', 'dropout': 0.1088168393221678, 'batch_norm': True, 'lr': 0.00037903758347505043, 'weight_decay': 8.323507757538107e-05, 'epochs': 187, 'loss': 'mse', 'optimizer': 'adam', 'graph_mode': 'cutoff', 'cutoff': 0.6245160488691056, 'grm_norm': 'cosine_then_gcn', 'self_loops': True, 'use_snp_selection': False}. Best is trial 45 with value: 0.09999459353692468.
[I 2025-11-03 13:39:45,168] Trial 62 finished with value: 0.08394071542162657 and parameters: {'model_type': 'gcn', 'hidden_dims': '[512, 256]', 'dropout': 0.10012140497421126, 'batch_norm': True, 'lr': 0.00040433444161729363, 'weight_decay': 8.422032261246222e-05, 'epochs': 188, 'loss': 'mse', 'optimizer': 'adam', 'graph_mode': 'cutoff', 'cutoff': 0.613163192212092, 'grm_norm': 'cosine_then_gcn', 'self_loops': True, 'use_snp_selection': False}. Best is trial 45 with value: 0.09999459353692468.
[I 2025-11-03 13:39:47,232] Trial 63 finished with value: 0.08411642335319229 and parameters: {'model_type': 'gcn', 'hidden_dims': '[512, 256]', 'dropout': 0.13126427612898192, 'batch_norm': True, 'lr': 0.0003617615249410518, 'weight_decay': 0.000328994861083724, 'epochs': 138, 'loss': 'mse', 'optimizer': 'adam', 'graph_mode': 'cutoff', 'cutoff': 0.5382893693973182, 'grm_norm': 'cosine_then_gcn', 'self_loops': True, 'use_snp_selection': False}. Best is trial 45 with value: 0.09999459353692468.
[I 2025-11-03 13:39:49,766] Trial 64 finished with value: 0.06991782830378498 and parameters: {'model_type': 'gcn', 'hidden_dims': '[512, 256]', 'dropout': 0.19401679446444262, 'batch_norm': True, 'lr': 0.0001811121782055711, 'weight_decay': 0.0006183721020404402, 'epochs': 224, 'loss': 'mse', 'optimizer': 'adam', 'graph_mode': 'cutoff', 'cutoff': 0.6770360068323207, 'grm_norm': 'cosine_then_gcn', 'self_loops': False, 'use_snp_selection': False}. Best is trial 45 with value: 0.09999459353692468.
[I 2025-11-03 13:39:52,093] Trial 65 finished with value: 0.0818363027819081 and parameters: {'model_type': 'gcn', 'hidden_dims': '[512, 256]', 'dropout': 0.14676693807866556, 'batch_norm': True, 'lr': 0.0005080153278910946, 'weight_decay': 0.00012417561168200525, 'epochs': 186, 'loss': 'mse', 'optimizer': 'adam', 'graph_mode': 'cutoff', 'cutoff': 0.6347920512167777, 'grm_norm': 'cosine_then_gcn', 'self_loops': True, 'use_snp_selection': False}. Best is trial 45 with value: 0.09999459353692468.
[I 2025-11-03 13:39:54,294] Trial 66 finished with value: 0.0778336607682767 and parameters: {'model_type': 'gcn', 'hidden_dims': '[512, 256]', 'dropout': 0.2146637130335906, 'batch_norm': True, 'lr': 7.492592067309392e-05, 'weight_decay': 0.00022585379888227986, 'epochs': 160, 'loss': 'mse', 'optimizer': 'adam', 'graph_mode': 'cutoff', 'cutoff': 0.4680418489692798, 'grm_norm': 'cosine_then_gcn', 'self_loops': True, 'use_snp_selection': False}. Best is trial 45 with value: 0.09999459353692468.
[I 2025-11-03 13:39:56,777] Trial 67 finished with value: 0.03256084630319039 and parameters: {'model_type': 'gcn', 'hidden_dims': '[512, 256]', 'dropout': 0.1174726950034904, 'batch_norm': True, 'lr': 2.865433062445272e-06, 'weight_decay': 5.915780057827844e-05, 'epochs': 213, 'loss': 'mse', 'optimizer': 'adam', 'graph_mode': 'cutoff', 'cutoff': 0.7080815158558679, 'grm_norm': 'cosine_then_gcn', 'self_loops': True, 'use_snp_selection': False}. Best is trial 45 with value: 0.09999459353692468.
[I 2025-11-03 13:39:59,164] Trial 68 finished with value: 0.08522059620653101 and parameters: {'model_type': 'gcn', 'hidden_dims': '[512, 256]', 'dropout': 0.17525621581757275, 'batch_norm': True, 'lr': 0.0002786562111905452, 'weight_decay': 0.0005242848499202653, 'epochs': 198, 'loss': 'mse', 'optimizer': 'adam', 'graph_mode': 'cutoff', 'cutoff': 0.35561387639356273, 'grm_norm': 'none', 'self_loops': True, 'use_snp_selection': False}. Best is trial 45 with value: 0.09999459353692468.
[I 2025-11-03 13:40:01,455] Trial 69 finished with value: 0.07906955449616801 and parameters: {'model_type': 'gcn', 'hidden_dims': '[256, 128, 64]', 'dropout': 0.2647887829696034, 'batch_norm': True, 'lr': 0.0006055529318553228, 'weight_decay': 0.00011646387775473385, 'epochs': 249, 'loss': 'mae', 'optimizer': 'adam', 'graph_mode': 'cutoff', 'cutoff': 0.571926243149803, 'grm_norm': 'cosine_then_gcn', 'self_loops': True, 'use_snp_selection': False}. Best is trial 45 with value: 0.09999459353692468.
[I 2025-11-03 13:40:03,786] Trial 70 finished with value: 0.06471950616225569 and parameters: {'model_type': 'gcn', 'hidden_dims': '[512, 256]', 'dropout': 0.14506317258321297, 'batch_norm': True, 'lr': 0.00022592420245304683, 'weight_decay': 0.00029756596099654847, 'epochs': 186, 'loss': 'mse', 'optimizer': 'adam', 'graph_mode': 'cutoff', 'cutoff': 0.5143276449271619, 'grm_norm': 'cosine_then_gcn', 'self_loops': True, 'use_snp_selection': False}. Best is trial 45 with value: 0.09999459353692468.
[I 2025-11-03 13:40:06,210] Trial 71 finished with value: 0.07954051014822609 and parameters: {'model_type': 'gcn', 'hidden_dims': '[512, 256]', 'dropout': 0.18260184352751135, 'batch_norm': True, 'lr': 0.000273468618704582, 'weight_decay': 0.0005329689726865052, 'epochs': 204, 'loss': 'mse', 'optimizer': 'adam', 'graph_mode': 'cutoff', 'cutoff': 0.35366148870516434, 'grm_norm': 'none', 'self_loops': True, 'use_snp_selection': False}. Best is trial 45 with value: 0.09999459353692468.
[I 2025-11-03 13:40:08,822] Trial 72 finished with value: 0.04440477453052689 and parameters: {'model_type': 'gcn', 'hidden_dims': '[512, 256]', 'dropout': 0.12569902132357613, 'batch_norm': True, 'lr': 0.00016004339432942058, 'weight_decay': 0.0001848940310654219, 'epochs': 238, 'loss': 'mse', 'optimizer': 'adam', 'graph_mode': 'cutoff', 'cutoff': 0.2772127844943481, 'grm_norm': 'none', 'self_loops': True, 'use_snp_selection': False}. Best is trial 45 with value: 0.09999459353692468.
[I 2025-11-03 13:40:11,191] Trial 73 finished with value: 0.08159951234037967 and parameters: {'model_type': 'gcn', 'hidden_dims': '[512, 256]', 'dropout': 0.23168268929671568, 'batch_norm': True, 'lr': 0.00043208408862719776, 'weight_decay': 0.000909625247847297, 'epochs': 194, 'loss': 'mse', 'optimizer': 'adam', 'graph_mode': 'cutoff', 'cutoff': 0.3667133812760756, 'grm_norm': 'none', 'self_loops': True, 'use_snp_selection': False}. Best is trial 45 with value: 0.09999459353692468.
[I 2025-11-03 13:40:13,272] Trial 74 finished with value: 0.08195394571702272 and parameters: {'model_type': 'gcn', 'hidden_dims': '[512, 256]', 'dropout': 0.10296936258869058, 'batch_norm': True, 'lr': 0.0003171960512916728, 'weight_decay': 4.0254832100740536e-05, 'epochs': 144, 'loss': 'mse', 'optimizer': 'adam', 'graph_mode': 'cutoff', 'cutoff': 0.61808426182289, 'grm_norm': 'none', 'self_loops': True, 'use_snp_selection': False}. Best is trial 45 with value: 0.09999459353692468.
