[I 2025-11-03 12:29:46,227] Trial 49 finished with value: 0.03490401194969556 and parameters: {'model_type': 'gcn', 'hidden_dims': '[512, 128]', 'dropout': 0.11609342730861268, 'batch_norm': True, 'lr': 0.00045148590746760427, 'weight_decay': 6.199093906522159e-07, 'epochs': 228, 'loss': 'mse', 'optimizer': 'adam', 'graph_mode': 'off', 'use_snp_selection': False}. Best is trial 16 with value: 0.07665877140891061.
[I 2025-11-03 12:29:48,129] Trial 50 finished with value: 0.03477068748643489 and parameters: {'model_type': 'gcn', 'hidden_dims': '[512, 128]', 'dropout': 0.21503354894718946, 'batch_norm': True, 'lr': 0.0006252453708370276, 'weight_decay': 1.0238482235499193e-07, 'epochs': 246, 'loss': 'mse', 'optimizer': 'adam', 'graph_mode': 'off', 'use_snp_selection': False}. Best is trial 16 with value: 0.07665877140891061.
[I 2025-11-03 12:29:49,824] Trial 51 finished with value: 0.0426794207110309 and parameters: {'model_type': 'gcn', 'hidden_dims': '[512, 128]', 'dropout': 0.2488962082313303, 'batch_norm': True, 'lr': 0.0003001774692371238, 'weight_decay': 0.0006070452763416443, 'epochs': 203, 'loss': 'mse', 'optimizer': 'adam', 'graph_mode': 'off', 'use_snp_selection': False}. Best is trial 16 with value: 0.07665877140891061.
[I 2025-11-03 12:29:50,991] Trial 52 finished with value: 0.05160043061104194 and parameters: {'model_type': 'gcn', 'hidden_dims': '[256, 128]', 'dropout': 0.28505192144455854, 'batch_norm': True, 'lr': 0.00017955615385413317, 'weight_decay': 0.00030874376892716683, 'epochs': 177, 'loss': 'mse', 'optimizer': 'adam', 'graph_mode': 'off', 'use_snp_selection': False}. Best is trial 16 with value: 0.07665877140891061.
[I 2025-11-03 12:29:52,086] Trial 53 finished with value: 0.03375842324395682 and parameters: {'model_type': 'gcn', 'hidden_dims': '[256, 128]', 'dropout': 0.18533400330080188, 'batch_norm': True, 'lr': 0.00016768591888148074, 'weight_decay': 0.00029611211969854466, 'epochs': 160, 'loss': 'mse', 'optimizer': 'adam', 'graph_mode': 'off', 'use_snp_selection': False}. Best is trial 16 with value: 0.07665877140891061.
[I 2025-11-03 12:29:53,122] Trial 54 finished with value: 0.024333177632697447 and parameters: {'model_type': 'gcn', 'hidden_dims': '[256, 128]', 'dropout': 0.34467754073678486, 'batch_norm': True, 'lr': 0.00011824761484810405, 'weight_decay': 0.00022527218643343945, 'epochs': 139, 'loss': 'mse', 'optimizer': 'adam', 'graph_mode': 'off', 'use_snp_selection': False}. Best is trial 16 with value: 0.07665877140891061.
[I 2025-11-03 12:29:54,309] Trial 55 finished with value: 0.042584100609436876 and parameters: {'model_type': 'gcn', 'hidden_dims': '[256, 128]', 'dropout': 0.13962697013037764, 'batch_norm': True, 'lr': 0.0002513712036051546, 'weight_decay': 0.0004079394441332344, 'epochs': 180, 'loss': 'mse', 'optimizer': 'adam', 'graph_mode': 'off', 'use_snp_selection': False}. Best is trial 16 with value: 0.07665877140891061.
[I 2025-11-03 12:29:55,808] Trial 56 finished with value: 0.036932330476272465 and parameters: {'model_type': 'gcn', 'hidden_dims': '[256, 128]', 'dropout': 0.16218093822491716, 'batch_norm': True, 'lr': 0.000693437661275249, 'weight_decay': 1.5769315861824765e-07, 'epochs': 271, 'loss': 'mae', 'optimizer': 'adam', 'graph_mode': 'off', 'use_snp_selection': False}. Best is trial 16 with value: 0.07665877140891061.
[I 2025-11-03 12:29:57,660] Trial 57 finished with value: 0.034650077734600056 and parameters: {'model_type': 'gcn', 'hidden_dims': '[512, 128]', 'dropout': 0.37024849635858653, 'batch_norm': True, 'lr': 0.000203224205226064, 'weight_decay': 4.111659095889544e-05, 'epochs': 227, 'loss': 'mae', 'optimizer': 'adam', 'graph_mode': 'off', 'use_snp_selection': False}. Best is trial 16 with value: 0.07665877140891061.
[I 2025-11-03 12:29:58,714] Trial 58 finished with value: 0.03649316353381868 and parameters: {'model_type': 'gcn', 'hidden_dims': '[128, 64]', 'dropout': 0.3357766653652806, 'batch_norm': True, 'lr': 0.0004504455171857809, 'weight_decay': 0.0008508580367404705, 'epochs': 169, 'loss': 'mse', 'optimizer': 'adam', 'graph_mode': 'off', 'use_snp_selection': False}. Best is trial 16 with value: 0.07665877140891061.
[I 2025-11-03 12:29:59,840] Trial 59 finished with value: 0.03528702156415049 and parameters: {'model_type': 'gcn', 'hidden_dims': '[256, 128]', 'dropout': 0.27253935173909827, 'batch_norm': True, 'lr': 0.00016473373609445316, 'weight_decay': 8.885543935162559e-05, 'epochs': 118, 'loss': 'mae', 'optimizer': 'adam', 'graph_mode': 'off', 'use_snp_selection': True, 'num_snps': 22521}. Best is trial 16 with value: 0.07665877140891061.
[I 2025-11-03 12:30:01,499] Trial 60 finished with value: 0.031397590564440546 and parameters: {'model_type': 'gcn', 'hidden_dims': '[512, 256]', 'dropout': 0.301978490137315, 'batch_norm': True, 'lr': 0.0002765089500278139, 'weight_decay': 4.130425162408885e-06, 'epochs': 187, 'loss': 'mae', 'optimizer': 'adam', 'graph_mode': 'off', 'use_snp_selection': False}. Best is trial 16 with value: 0.07665877140891061.
[I 2025-11-03 12:30:02,897] Trial 61 finished with value: 0.005222052003705198 and parameters: {'model_type': 'gcn', 'hidden_dims': '[256, 128, 64]', 'dropout': 0.2926451239892532, 'batch_norm': True, 'lr': 2.0793825896556974e-05, 'weight_decay': 0.0006865136225032135, 'epochs': 198, 'loss': 'mse', 'optimizer': 'adam', 'graph_mode': 'off', 'use_snp_selection': False}. Best is trial 16 with value: 0.07665877140891061.
[I 2025-11-03 12:30:04,328] Trial 62 finished with value: -0.016013472528798214 and parameters: {'model_type': 'gcn', 'hidden_dims': '[256, 128, 64]', 'dropout': 0.25440284539229013, 'batch_norm': True, 'lr': 1.3938747247625936e-05, 'weight_decay': 0.0004412026796514159, 'epochs': 204, 'loss': 'mse', 'optimizer': 'adam', 'graph_mode': 'off', 'use_snp_selection': False}. Best is trial 16 with value: 0.07665877140891061.
[I 2025-11-03 12:30:05,923] Trial 63 finished with value: 0.04855045061131278 and parameters: {'model_type': 'gcn', 'hidden_dims': '[256, 128, 64]', 'dropout': 0.21986218878910155, 'batch_norm': True, 'lr': 5.638379612712667e-05, 'weight_decay': 1.56210005037735e-05, 'epochs': 243, 'loss': 'mse', 'optimizer': 'adam', 'graph_mode': 'off', 'use_snp_selection': False}. Best is trial 16 with value: 0.07665877140891061.
[I 2025-11-03 12:30:07,424] Trial 64 finished with value: 0.04767324233034895 and parameters: {'model_type': 'gcn', 'hidden_dims': '[256, 128, 64]', 'dropout': 0.21508512493693524, 'batch_norm': False, 'lr': 0.00012805622783774377, 'weight_decay': 1.626574627458507e-05, 'epochs': 238, 'loss': 'mse', 'optimizer': 'adam', 'graph_mode': 'off', 'use_snp_selection': False}. Best is trial 16 with value: 0.07665877140891061.
[I 2025-11-03 12:30:08,585] Trial 65 finished with value: 0.016709137592784487 and parameters: {'model_type': 'gcn', 'hidden_dims': '[128, 64]', 'dropout': 0.20077612401834422, 'batch_norm': True, 'lr': 6.222076814574517e-05, 'weight_decay': 3.343062447604764e-07, 'epochs': 250, 'loss': 'mse', 'optimizer': 'adam', 'graph_mode': 'off', 'use_snp_selection': False}. Best is trial 16 with value: 0.07665877140891061.
[I 2025-11-03 12:30:10,569] Trial 66 finished with value: 0.035851309597873526 and parameters: {'model_type': 'gcn', 'hidden_dims': '[512, 128]', 'dropout': 0.22665859285632695, 'batch_norm': True, 'lr': 8.269475149754085e-05, 'weight_decay': 2.722797965786987e-05, 'epochs': 261, 'loss': 'mae', 'optimizer': 'adam', 'graph_mode': 'off', 'use_snp_selection': False}. Best is trial 16 with value: 0.07665877140891061.
[I 2025-11-03 12:30:12,049] Trial 67 finished with value: 0.03700029069466486 and parameters: {'model_type': 'gcn', 'hidden_dims': '[256, 128, 64]', 'dropout': 0.1727394841844358, 'batch_norm': True, 'lr': 0.00019908496153661577, 'weight_decay': 2.344706761190221e-06, 'epochs': 212, 'loss': 'mse', 'optimizer': 'adam', 'graph_mode': 'off', 'use_snp_selection': False}. Best is trial 16 with value: 0.07665877140891061.
[I 2025-11-03 12:30:13,808] Trial 68 finished with value: 0.030880710025028426 and parameters: {'model_type': 'gcn', 'hidden_dims': '[512, 64]', 'dropout': 0.1916997119840153, 'batch_norm': True, 'lr': 0.00036415043065911226, 'weight_decay': 0.00017796694481567133, 'epochs': 225, 'loss': 'mae', 'optimizer': 'adam', 'graph_mode': 'off', 'use_snp_selection': True, 'num_snps': 31556}. Best is trial 16 with value: 0.07665877140891061.
[I 2025-11-03 12:30:14,791] Trial 69 finished with value: 0.007727170526575259 and parameters: {'model_type': 'gcn', 'hidden_dims': '[128, 64]', 'dropout': 0.24545843076835205, 'batch_norm': True, 'lr': 9.814908093787031e-05, 'weight_decay': 4.869422801300142e-07, 'epochs': 176, 'loss': 'mae', 'optimizer': 'adam', 'graph_mode': 'off', 'use_snp_selection': False}. Best is trial 16 with value: 0.07665877140891061.
[I 2025-11-03 12:30:16,191] Trial 70 finished with value: -0.030448144716934394 and parameters: {'model_type': 'gcn', 'hidden_dims': '[256, 128, 64]', 'dropout': 0.5696826530111565, 'batch_norm': False, 'lr': 5.422351253947279e-05, 'weight_decay': 1.0504385805006262e-06, 'epochs': 297, 'loss': 'mse', 'optimizer': 'adam', 'graph_mode': 'off', 'use_snp_selection': True, 'num_snps': 7254}. Best is trial 16 with value: 0.07665877140891061.
[I 2025-11-03 12:30:17,677] Trial 71 finished with value: 0.007075432008340339 and parameters: {'model_type': 'gcn', 'hidden_dims': '[256, 128, 64]', 'dropout': 0.22154401027506845, 'batch_norm': False, 'lr': 0.0001259362174872509, 'weight_decay': 8.87127038239984e-06, 'epochs': 238, 'loss': 'mse', 'optimizer': 'adam', 'graph_mode': 'off', 'use_snp_selection': False}. Best is trial 16 with value: 0.07665877140891061.
[I 2025-11-03 12:30:19,202] Trial 72 finished with value: 0.049185544817405606 and parameters: {'model_type': 'gcn', 'hidden_dims': '[256, 128, 64]', 'dropout': 0.26650223596844147, 'batch_norm': False, 'lr': 0.00013476545384714616, 'weight_decay': 1.6202858200676937e-05, 'epochs': 240, 'loss': 'mse', 'optimizer': 'adam', 'graph_mode': 'off', 'use_snp_selection': False}. Best is trial 16 with value: 0.07665877140891061.
[I 2025-11-03 12:30:20,752] Trial 73 finished with value: 0.03657333545728314 and parameters: {'model_type': 'gcn', 'hidden_dims': '[256, 128, 64]', 'dropout': 0.2666978289296562, 'batch_norm': False, 'lr': 0.00017271938780555774, 'weight_decay': 1.4839383381551645e-05, 'epochs': 254, 'loss': 'mse', 'optimizer': 'adam', 'graph_mode': 'off', 'use_snp_selection': False}. Best is trial 16 with value: 0.07665877140891061.
[I 2025-11-03 12:30:22,403] Trial 74 finished with value: 0.03357757080206261 and parameters: {'model_type': 'gcn', 'hidden_dims': '[256, 128, 64]', 'dropout': 0.20095506281753972, 'batch_norm': False, 'lr': 6.781087898106392e-05, 'weight_decay': 1.454909951140728e-07, 'epochs': 276, 'loss': 'mse', 'optimizer': 'adam', 'graph_mode': 'off', 'use_snp_selection': False}. Best is trial 16 with value: 0.07665877140891061.
[I 2025-11-03 12:30:23,877] Trial 75 finished with value: 0.012913081959666294 and parameters: {'model_type': 'gcn', 'hidden_dims': '[256, 128, 64]', 'dropout': 0.31171119310752293, 'batch_norm': False, 'lr': 3.706349005313947e-05, 'weight_decay': 3.3770591900215524e-05, 'epochs': 221, 'loss': 'mse', 'optimizer': 'adam', 'graph_mode': 'off', 'use_snp_selection': False}. Best is trial 16 with value: 0.07665877140891061.
[I 2025-11-03 12:30:25,467] Trial 76 finished with value: 0.043234114564794854 and parameters: {'model_type': 'gcn', 'hidden_dims': '[256, 128, 64]', 'dropout': 0.1372900899033202, 'batch_norm': False, 'lr': 0.00022700584678614705, 'weight_decay': 7.561624059632071e-05, 'epochs': 233, 'loss': 'mae', 'optimizer': 'adam', 'graph_mode': 'off', 'use_snp_selection': False}. Best is trial 16 with value: 0.07665877140891061.
[I 2025-11-03 12:30:26,628] Trial 77 finished with value: 0.04547711495656481 and parameters: {'model_type': 'gcn', 'hidden_dims': '[256, 128]', 'dropout': 0.32759258611539094, 'batch_norm': True, 'lr': 8.330421431496539e-05, 'weight_decay': 3.820878013869262e-06, 'epochs': 189, 'loss': 'mse', 'optimizer': 'adam', 'graph_mode': 'off', 'use_snp_selection': True, 'num_snps': 15594}. Best is trial 16 with value: 0.07665877140891061.
[I 2025-11-03 12:30:27,866] Trial 78 finished with value: 0.02676333921969355 and parameters: {'model_type': 'gcn', 'hidden_dims': '[128, 64]', 'dropout': 0.26299800840072535, 'batch_norm': True, 'lr': 2.4467631717368917e-05, 'weight_decay': 0.00013552152709847944, 'epochs': 270, 'loss': 'mae', 'optimizer': 'adam', 'graph_mode': 'off', 'use_snp_selection': False}. Best is trial 16 with value: 0.07665877140891061.
[I 2025-11-03 12:30:29,693] Trial 79 finished with value: -0.02937699781565321 and parameters: {'model_type': 'gcn', 'hidden_dims': '[512, 256]', 'dropout': 0.2763125279569957, 'batch_norm': True, 'lr': 1.3999803206686888e-06, 'weight_decay': 2.0527109349715882e-05, 'epochs': 206, 'loss': 'mse', 'optimizer': 'adam', 'graph_mode': 'off', 'use_snp_selection': False}. Best is trial 16 with value: 0.07665877140891061.
[I 2025-11-03 12:30:30,922] Trial 80 finished with value: 0.026305344975043367 and parameters: {'model_type': 'gcn', 'hidden_dims': '[256, 128, 64]', 'dropout': 0.2441016597487576, 'batch_norm': True, 'lr': 0.0001520171421555574, 'weight_decay': 1.2886530801785484e-05, 'epochs': 241, 'loss': 'mae', 'optimizer': 'adam', 'graph_mode': 'off', 'use_snp_selection': True, 'num_snps': 2151}. Best is trial 16 with value: 0.07665877140891061.
[I 2025-11-03 12:30:32,449] Trial 81 finished with value: 0.03744483381169365 and parameters: {'model_type': 'gcn', 'hidden_dims': '[256, 128, 64]', 'dropout': 0.10005120991529873, 'batch_norm': False, 'lr': 0.00010357790805802412, 'weight_decay': 9.08759063399148e-06, 'epochs': 234, 'loss': 'mse', 'optimizer': 'adam', 'graph_mode': 'off', 'use_snp_selection': False}. Best is trial 16 with value: 0.07665877140891061.
[I 2025-11-03 12:30:33,987] Trial 82 finished with value: 0.01641350044020219 and parameters: {'model_type': 'gcn', 'hidden_dims': '[256, 128, 64]', 'dropout': 0.22442587062368818, 'batch_norm': False, 'lr': 0.00012899863913158374, 'weight_decay': 1.8665943549892675e-07, 'epochs': 255, 'loss': 'mse', 'optimizer': 'adam', 'graph_mode': 'off', 'use_snp_selection': False}. Best is trial 16 with value: 0.07665877140891061.
[I 2025-11-03 12:30:35,517] Trial 83 finished with value: 0.013574599898830225 and parameters: {'model_type': 'gcn', 'hidden_dims': '[256, 128, 64]', 'dropout': 0.5086176389956804, 'batch_norm': False, 'lr': 0.00018631906339379884, 'weight_decay': 2.5806379768342036e-07, 'epochs': 242, 'loss': 'mse', 'optimizer': 'adam', 'graph_mode': 'off', 'use_snp_selection': False}. Best is trial 16 with value: 0.07665877140891061.
[I 2025-11-03 12:30:37,105] Trial 84 finished with value: 0.007470105882318927 and parameters: {'model_type': 'gcn', 'hidden_dims': '[256, 128, 64]', 'dropout': 0.21564894772208543, 'batch_norm': False, 'lr': 4.128493932194991e-05, 'weight_decay': 7.158418610421275e-06, 'epochs': 263, 'loss': 'mse', 'optimizer': 'adam', 'graph_mode': 'off', 'use_snp_selection': False}. Best is trial 16 with value: 0.07665877140891061.
[I 2025-11-03 12:30:38,842] Trial 85 finished with value: 0.029087250088279133 and parameters: {'model_type': 'gcn', 'hidden_dims': '[512, 128]', 'dropout': 0.17960585061804815, 'batch_norm': False, 'lr': 0.00011462861675135782, 'weight_decay': 1.81511919468727e-05, 'epochs': 217, 'loss': 'mse', 'optimizer': 'adam', 'graph_mode': 'off', 'use_snp_selection': False}. Best is trial 16 with value: 0.07665877140891061.
[I 2025-11-03 12:30:40,301] Trial 86 finished with value: 0.03433572153815445 and parameters: {'model_type': 'gcn', 'hidden_dims': '[512, 64]', 'dropout': 0.4432894838630084, 'batch_norm': False, 'lr': 0.00033562203830573813, 'weight_decay': 4.637820792963957e-05, 'epochs': 158, 'loss': 'mse', 'optimizer': 'adam', 'graph_mode': 'off', 'use_snp_selection': False}. Best is trial 16 with value: 0.07665877140891061.
[I 2025-11-03 12:30:41,482] Trial 87 finished with value: 0.03733999798671138 and parameters: {'model_type': 'gcn', 'hidden_dims': '[256, 128, 64]', 'dropout': 0.16129360631242892, 'batch_norm': True, 'lr': 0.00025905770907312106, 'weight_decay': 2.9617246971117627e-05, 'epochs': 136, 'loss': 'mse', 'optimizer': 'adam', 'graph_mode': 'off', 'use_snp_selection': False}. Best is trial 16 with value: 0.07665877140891061.
[I 2025-11-03 12:30:43,141] Trial 88 finished with value: 0.02682248820045467 and parameters: {'model_type': 'gcn', 'hidden_dims': '[256, 128, 64]', 'dropout': 0.29549012641359246, 'batch_norm': True, 'lr': 0.00014143122924313407, 'weight_decay': 1.6378019977417986e-05, 'epochs': 227, 'loss': 'mae', 'optimizer': 'adam', 'graph_mode': 'off', 'use_snp_selection': True, 'num_snps': 24013}. Best is trial 16 with value: 0.07665877140891061.
[I 2025-11-03 12:30:44,209] Trial 89 finished with value: 0.02427902620196994 and parameters: {'model_type': 'gcn', 'hidden_dims': '[256, 128]', 'dropout': 0.19574380691732757, 'batch_norm': True, 'lr': 5.420779788184671e-05, 'weight_decay': 0.00038606165974723166, 'epochs': 149, 'loss': 'mse', 'optimizer': 'adam', 'graph_mode': 'off', 'use_snp_selection': False}. Best is trial 16 with value: 0.07665877140891061.
[I 2025-11-03 12:30:45,244] Trial 90 finished with value: 0.046446010286639305 and parameters: {'model_type': 'gcn', 'hidden_dims': '[128, 64]', 'dropout': 0.2361187051309199, 'batch_norm': False, 'lr': 0.0005587318904678928, 'weight_decay': 6.844398729126908e-05, 'epochs': 210, 'loss': 'mae', 'optimizer': 'adam', 'graph_mode': 'off', 'use_snp_selection': False}. Best is trial 16 with value: 0.07665877140891061.
[I 2025-11-03 12:30:46,329] Trial 91 finished with value: 0.019261793560399736 and parameters: {'model_type': 'gcn', 'hidden_dims': '[128, 64]', 'dropout': 0.23069921345633834, 'batch_norm': False, 'lr': 0.0005428334321814131, 'weight_decay': 0.0002693935215000626, 'epochs': 247, 'loss': 'mae', 'optimizer': 'adam', 'graph_mode': 'off', 'use_snp_selection': False}. Best is trial 16 with value: 0.07665877140891061.
[I 2025-11-03 12:30:47,350] Trial 92 finished with value: 0.014926431755128165 and parameters: {'model_type': 'gcn', 'hidden_dims': '[128, 64]', 'dropout': 0.253076598384751, 'batch_norm': False, 'lr': 0.000419291996850541, 'weight_decay': 2.1166411854040063e-06, 'epochs': 211, 'loss': 'mae', 'optimizer': 'adam', 'graph_mode': 'off', 'use_snp_selection': False}. Best is trial 16 with value: 0.07665877140891061.
[I 2025-11-03 12:30:48,326] Trial 93 finished with value: 0.02737958599297917 and parameters: {'model_type': 'gcn', 'hidden_dims': '[128, 64]', 'dropout': 0.20928418077055355, 'batch_norm': False, 'lr': 0.000582898273154109, 'weight_decay': 0.0007542514046787932, 'epochs': 184, 'loss': 'mae', 'optimizer': 'adam', 'graph_mode': 'off', 'use_snp_selection': False}. Best is trial 16 with value: 0.07665877140891061.
[I 2025-11-03 12:30:49,373] Trial 94 finished with value: 0.01818611542248297 and parameters: {'model_type': 'gcn', 'hidden_dims': '[128, 64]', 'dropout': 0.23417872716388055, 'batch_norm': False, 'lr': 0.0007572640081441672, 'weight_decay': 2.2636910452340982e-05, 'epochs': 220, 'loss': 'mae', 'optimizer': 'adam', 'graph_mode': 'off', 'use_snp_selection': False}. Best is trial 16 with value: 0.07665877140891061.
[I 2025-11-03 12:30:50,800] Trial 95 finished with value: 0.04100068253481372 and parameters: {'model_type': 'gcn', 'hidden_dims': '[256, 128, 64]', 'dropout': 0.27495694943917454, 'batch_norm': True, 'lr': 0.0008844560462343837, 'weight_decay': 0.0002155575004433015, 'epochs': 192, 'loss': 'mae', 'optimizer': 'adam', 'graph_mode': 'off', 'use_snp_selection': False}. Best is trial 16 with value: 0.07665877140891061.
[I 2025-11-03 12:30:52,648] Trial 96 finished with value: 0.004853741993859229 and parameters: {'model_type': 'gcn', 'hidden_dims': '[512, 128]', 'dropout': 0.19200763912616634, 'batch_norm': False, 'lr': 0.00023069955124530546, 'weight_decay': 7.339670631799116e-05, 'epochs': 171, 'loss': 'mse', 'optimizer': 'adam', 'graph_mode': 'off', 'use_snp_selection': True, 'num_snps': 37707}. Best is trial 16 with value: 0.07665877140891061.
[I 2025-11-03 12:30:54,218] Trial 97 finished with value: 0.014182327084653149 and parameters: {'model_type': 'gcn', 'hidden_dims': '[256, 128, 64]', 'dropout': 0.25700772851880344, 'batch_norm': True, 'lr': 8.028387300621886e-05, 'weight_decay': 1.3088930939516712e-05, 'epochs': 235, 'loss': 'mae', 'optimizer': 'adam', 'graph_mode': 'off', 'use_snp_selection': False}. Best is trial 16 with value: 0.07665877140891061.
[I 2025-11-03 12:30:55,267] Trial 98 finished with value: 0.040702413110143054 and parameters: {'model_type': 'gcn', 'hidden_dims': '[128, 64]', 'dropout': 0.24020326786239302, 'batch_norm': True, 'lr': 0.0003198627840347126, 'weight_decay': 3.3911265765793624e-05, 'epochs': 200, 'loss': 'mse', 'optimizer': 'adam', 'graph_mode': 'off', 'use_snp_selection': False}. Best is trial 16 with value: 0.07665877140891061.
[I 2025-11-03 12:30:57,360] Trial 99 finished with value: 0.03926518112912171 and parameters: {'model_type': 'gcn', 'hidden_dims': '[512, 256]', 'dropout': 0.15676590974344679, 'batch_norm': True, 'lr': 0.00039524016792825175, 'weight_decay': 0.0004757025965768141, 'epochs': 162, 'loss': 'mae', 'optimizer': 'adam', 'graph_mode': 'off', 'use_snp_selection': True, 'num_snps': 47446}. Best is trial 16 with value: 0.07665877140891061.
[I 2025-11-03 12:30:58,612] Trial 100 finished with value: 0.051488154305917994 and parameters: {'model_type': 'gcn', 'hidden_dims': '[256, 128]', 'dropout': 0.3171008821524991, 'batch_norm': False, 'lr': 9.671379846461132e-05, 'weight_decay': 1.1494456156369383e-07, 'epochs': 210, 'loss': 'mse', 'optimizer': 'adam', 'graph_mode': 'off', 'use_snp_selection': False}. Best is trial 16 with value: 0.07665877140891061.
