[I 2025-11-03 14:48:13,180] Trial 74 finished with value: -0.007188739594598219 and parameters: {'model_type': 'graphsage', 'hidden_dims': '[128, 64]', 'dropout': 0.3840862537316614, 'batch_norm': True, 'lr': 2.4886592275922742e-06, 'weight_decay': 0.0002594609816204531, 'epochs': 51, 'loss': 'mse', 'optimizer': 'adam', 'graph_mode': 'knn', 'source': 'grm', 'knn_k': 9, 'weighted_edges': False, 'symmetrize_mode': 'union', 'use_snp_selection': False}. Best is trial 32 with value: 0.05624840045269122.
[I 2025-11-03 14:48:15,676] Trial 75 finished with value: 0.006950640060308797 and parameters: {'model_type': 'graphsage', 'hidden_dims': '[128, 64]', 'dropout': 0.4368414255717077, 'batch_norm': True, 'lr': 1.8276843084666867e-06, 'weight_decay': 9.23473397329131e-05, 'epochs': 206, 'loss': 'mse', 'optimizer': 'adam', 'graph_mode': 'knn', 'source': 'grm', 'knn_k': 7, 'weighted_edges': False, 'symmetrize_mode': 'union', 'use_snp_selection': False}. Best is trial 32 with value: 0.05624840045269122.
[I 2025-11-03 14:48:17,613] Trial 76 finished with value: 0.022853565157647977 and parameters: {'model_type': 'graphsage', 'hidden_dims': '[128, 64]', 'dropout': 0.2849936281313956, 'batch_norm': True, 'lr': 1.543663572013366e-06, 'weight_decay': 0.000637279607369559, 'epochs': 89, 'loss': 'mae', 'optimizer': 'adam', 'graph_mode': 'knn', 'source': 'grm', 'knn_k': 10, 'weighted_edges': False, 'symmetrize_mode': 'union', 'use_snp_selection': False}. Best is trial 32 with value: 0.05624840045269122.
[I 2025-11-03 14:48:20,507] Trial 77 finished with value: 0.0011204317169696307 and parameters: {'model_type': 'graphsage', 'hidden_dims': '[128, 64]', 'dropout': 0.4568793416893155, 'batch_norm': True, 'lr': 0.0008353868440333463, 'weight_decay': 0.00015898353578082272, 'epochs': 234, 'loss': 'mse', 'optimizer': 'adam', 'graph_mode': 'knn', 'source': 'grm', 'knn_k': 9, 'weighted_edges': True, 'symmetrize_mode': 'union', 'use_snp_selection': False}. Best is trial 32 with value: 0.05624840045269122.
[I 2025-11-03 14:48:22,258] Trial 78 finished with value: 0.02025186458034303 and parameters: {'model_type': 'graphsage', 'hidden_dims': '[128, 64]', 'dropout': 0.15477809997283226, 'batch_norm': True, 'lr': 2.962391638554622e-06, 'weight_decay': 0.00021726933317415132, 'epochs': 74, 'loss': 'mse', 'optimizer': 'adam', 'graph_mode': 'knn', 'source': 'grm', 'knn_k': 8, 'weighted_edges': False, 'symmetrize_mode': 'union', 'use_snp_selection': False}. Best is trial 32 with value: 0.05624840045269122.
[I 2025-11-03 14:48:24,516] Trial 79 finished with value: -0.026615735929325528 and parameters: {'model_type': 'graphsage', 'hidden_dims': '[128, 64]', 'dropout': 0.21035509860733245, 'batch_norm': True, 'lr': 1.3794464670446265e-06, 'weight_decay': 5.628053951919766e-05, 'epochs': 165, 'loss': 'mse', 'optimizer': 'adam', 'graph_mode': 'knn', 'source': 'grm', 'knn_k': 7, 'weighted_edges': True, 'symmetrize_mode': 'union', 'use_snp_selection': False}. Best is trial 32 with value: 0.05624840045269122.
[I 2025-11-03 14:48:28,068] Trial 80 finished with value: -0.02537894253466246 and parameters: {'model_type': 'graphsage', 'hidden_dims': '[512, 256]', 'dropout': 0.17938956883337365, 'batch_norm': True, 'lr': 2.420431752103623e-06, 'weight_decay': 3.319334486342966e-05, 'epochs': 145, 'loss': 'mae', 'optimizer': 'adam', 'graph_mode': 'knn', 'source': 'grm', 'knn_k': 1, 'weighted_edges': False, 'symmetrize_mode': 'union', 'use_snp_selection': False}. Best is trial 32 with value: 0.05624840045269122.
[I 2025-11-03 14:48:29,974] Trial 81 finished with value: 0.026167529368877968 and parameters: {'model_type': 'graphsage', 'hidden_dims': '[128, 64]', 'dropout': 0.2864985447644253, 'batch_norm': True, 'lr': 1.5139071762396358e-06, 'weight_decay': 0.0006474066863620807, 'epochs': 91, 'loss': 'mae', 'optimizer': 'adam', 'graph_mode': 'knn', 'source': 'grm', 'knn_k': 9, 'weighted_edges': False, 'symmetrize_mode': 'union', 'use_snp_selection': False}. Best is trial 32 with value: 0.05624840045269122.
[I 2025-11-03 14:48:31,684] Trial 82 finished with value: 0.012404310529859833 and parameters: {'model_type': 'graphsage', 'hidden_dims': '[128, 64]', 'dropout': 0.2259617930566819, 'batch_norm': True, 'lr': 1.1179093118484262e-06, 'weight_decay': 0.0009116467754178515, 'epochs': 57, 'loss': 'mae', 'optimizer': 'adam', 'graph_mode': 'knn', 'source': 'grm', 'knn_k': 10, 'weighted_edges': False, 'symmetrize_mode': 'union', 'use_snp_selection': False}. Best is trial 32 with value: 0.05624840045269122.
[I 2025-11-03 14:48:33,771] Trial 83 finished with value: -0.009272210757166784 and parameters: {'model_type': 'graphsage', 'hidden_dims': '[128, 64]', 'dropout': 0.36030215711034363, 'batch_norm': True, 'lr': 1.269237581729836e-06, 'weight_decay': 0.00046225271422223145, 'epochs': 115, 'loss': 'mae', 'optimizer': 'adam', 'graph_mode': 'knn', 'source': 'grm', 'knn_k': 9, 'weighted_edges': False, 'symmetrize_mode': 'union', 'use_snp_selection': False}. Best is trial 32 with value: 0.05624840045269122.
[I 2025-11-03 14:48:37,331] Trial 84 finished with value: 0.013480390999424038 and parameters: {'model_type': 'graphsage', 'hidden_dims': '[512, 128]', 'dropout': 0.32798054696035817, 'batch_norm': True, 'lr': 1.8654242434518884e-06, 'weight_decay': 0.0003811891796792777, 'epochs': 107, 'loss': 'mae', 'optimizer': 'adam', 'graph_mode': 'knn', 'source': 'grm', 'knn_k': 9, 'weighted_edges': False, 'symmetrize_mode': 'union', 'use_snp_selection': False}. Best is trial 32 with value: 0.05624840045269122.
[I 2025-11-03 14:48:39,166] Trial 85 finished with value: 0.009180020610925033 and parameters: {'model_type': 'graphsage', 'hidden_dims': '[128, 64]', 'dropout': 0.23798229917320063, 'batch_norm': True, 'lr': 5.797603182372451e-06, 'weight_decay': 0.0007970002559570453, 'epochs': 87, 'loss': 'mae', 'optimizer': 'adam', 'graph_mode': 'knn', 'source': 'grm', 'knn_k': 8, 'weighted_edges': False, 'symmetrize_mode': 'union', 'use_snp_selection': False}. Best is trial 32 with value: 0.05624840045269122.
[I 2025-11-03 14:48:42,500] Trial 86 finished with value: -0.0068287918244774246 and parameters: {'model_type': 'graphsage', 'hidden_dims': '[512, 64]', 'dropout': 0.2919101318920546, 'batch_norm': True, 'lr': 1.591725655183227e-06, 'weight_decay': 0.0005669507108096658, 'epochs': 136, 'loss': 'mse', 'optimizer': 'adam', 'graph_mode': 'cutoff', 'cutoff': 0.8859096794378045, 'grm_norm': 'none', 'self_loops': True, 'use_snp_selection': False}. Best is trial 32 with value: 0.05624840045269122.
[I 2025-11-03 14:48:44,264] Trial 87 finished with value: -0.006550459372083058 and parameters: {'model_type': 'graphsage', 'hidden_dims': '[128, 64]', 'dropout': 0.3938780259539233, 'batch_norm': True, 'lr': 0.00038277420063764816, 'weight_decay': 0.00028907497944362224, 'epochs': 75, 'loss': 'mae', 'optimizer': 'adam', 'graph_mode': 'knn', 'source': 'grm', 'knn_k': 8, 'weighted_edges': True, 'symmetrize_mode': 'union', 'use_snp_selection': False}. Best is trial 32 with value: 0.05624840045269122.
[I 2025-11-03 14:48:48,270] Trial 88 finished with value: -0.024102928592961953 and parameters: {'model_type': 'graphsage', 'hidden_dims': '[256, 128]', 'dropout': 0.41752086264968535, 'batch_norm': False, 'lr': 3.413197593158525e-06, 'weight_decay': 0.0001145716382112588, 'epochs': 96, 'loss': 'mse', 'optimizer': 'adam', 'graph_mode': 'knn', 'source': 'grm', 'knn_k': 7, 'weighted_edges': False, 'symmetrize_mode': 'union', 'use_snp_selection': True, 'num_snps': 55590}. Best is trial 32 with value: 0.05624840045269122.
[I 2025-11-03 14:48:50,929] Trial 89 finished with value: 0.00034001206842563 and parameters: {'model_type': 'graphsage', 'hidden_dims': '[128, 64]', 'dropout': 0.1609953822337715, 'batch_norm': True, 'lr': 0.0006027031731480205, 'weight_decay': 0.000331377136129561, 'epochs': 216, 'loss': 'mse', 'optimizer': 'adam', 'graph_mode': 'knn', 'source': 'grm', 'knn_k': 8, 'weighted_edges': False, 'symmetrize_mode': 'union', 'use_snp_selection': False}. Best is trial 32 with value: 0.05624840045269122.
[I 2025-11-03 14:48:52,796] Trial 90 finished with value: 0.01286017154373486 and parameters: {'model_type': 'graphsage', 'hidden_dims': '[128, 64]', 'dropout': 0.14270381112360278, 'batch_norm': False, 'lr': 2.246309985074169e-06, 'weight_decay': 1.6073095108783076e-05, 'epochs': 127, 'loss': 'mae', 'optimizer': 'adam', 'graph_mode': 'knn', 'source': 'grm', 'knn_k': 4, 'weighted_edges': True, 'symmetrize_mode': 'union', 'use_snp_selection': True, 'num_snps': 8552}. Best is trial 32 with value: 0.05624840045269122.
[I 2025-11-03 14:48:54,803] Trial 91 finished with value: 0.0035295812204352156 and parameters: {'model_type': 'graphsage', 'hidden_dims': '[128, 64]', 'dropout': 0.28921087650113125, 'batch_norm': True, 'lr': 1.521086477540683e-06, 'weight_decay': 0.00023808275249515327, 'epochs': 90, 'loss': 'mae', 'optimizer': 'adam', 'graph_mode': 'knn', 'source': 'grm', 'knn_k': 10, 'weighted_edges': False, 'symmetrize_mode': 'union', 'use_snp_selection': False}. Best is trial 32 with value: 0.05624840045269122.
[I 2025-11-03 14:48:56,572] Trial 92 finished with value: 0.014278575603048543 and parameters: {'model_type': 'graphsage', 'hidden_dims': '[128, 64]', 'dropout': 0.2136972067436947, 'batch_norm': True, 'lr': 1.626066660424237e-06, 'weight_decay': 0.0006253264614104872, 'epochs': 67, 'loss': 'mae', 'optimizer': 'adam', 'graph_mode': 'knn', 'source': 'grm', 'knn_k': 9, 'weighted_edges': False, 'symmetrize_mode': 'union', 'use_snp_selection': False}. Best is trial 32 with value: 0.05624840045269122.
[I 2025-11-03 14:48:58,465] Trial 93 finished with value: -0.017089604138226615 and parameters: {'model_type': 'graphsage', 'hidden_dims': '[128, 64]', 'dropout': 0.11982175024779113, 'batch_norm': True, 'lr': 1.2404159847744365e-06, 'weight_decay': 0.0005043605992821517, 'epochs': 82, 'loss': 'mae', 'optimizer': 'adam', 'graph_mode': 'knn', 'source': 'grm', 'knn_k': 10, 'weighted_edges': False, 'symmetrize_mode': 'union', 'use_snp_selection': False}. Best is trial 32 with value: 0.05624840045269122.
[I 2025-11-03 14:49:00,130] Trial 94 finished with value: -0.027409922082213333 and parameters: {'model_type': 'graphsage', 'hidden_dims': '[128, 64]', 'dropout': 0.2722986109831423, 'batch_norm': True, 'lr': 2.697275804379299e-06, 'weight_decay': 0.0007745497822108793, 'epochs': 48, 'loss': 'mae', 'optimizer': 'adam', 'graph_mode': 'knn', 'source': 'grm', 'knn_k': 10, 'weighted_edges': False, 'symmetrize_mode': 'union', 'use_snp_selection': False}. Best is trial 32 with value: 0.05624840045269122.
[I 2025-11-03 14:49:02,246] Trial 95 finished with value: -0.0216846181278202 and parameters: {'model_type': 'graphsage', 'hidden_dims': '[256, 128, 64]', 'dropout': 0.3721454945849759, 'batch_norm': True, 'lr': 0.0008417401325865527, 'weight_decay': 2.218083982095985e-06, 'epochs': 63, 'loss': 'mae', 'optimizer': 'adam', 'graph_mode': 'knn', 'source': 'grm', 'knn_k': 8, 'weighted_edges': False, 'symmetrize_mode': 'union', 'use_snp_selection': False}. Best is trial 32 with value: 0.05624840045269122.
[I 2025-11-03 14:49:06,050] Trial 96 finished with value: -0.0009509368420020201 and parameters: {'model_type': 'graphsage', 'hidden_dims': '[128, 64]', 'dropout': 0.1887647369461564, 'batch_norm': False, 'lr': 1.051846783376292e-06, 'weight_decay': 0.000612496789346144, 'epochs': 178, 'loss': 'mse', 'optimizer': 'adam', 'graph_mode': 'knn', 'source': 'grm', 'knn_k': 9, 'weighted_edges': False, 'symmetrize_mode': 'union', 'use_snp_selection': True, 'num_snps': 48356}. Best is trial 32 with value: 0.05624840045269122.
[I 2025-11-03 14:49:08,130] Trial 97 finished with value: 0.02242830617991007 and parameters: {'model_type': 'graphsage', 'hidden_dims': '[128, 64]', 'dropout': 0.34310391446899446, 'batch_norm': False, 'lr': 2.045791930027354e-06, 'weight_decay': 0.00016310358926959387, 'epochs': 100, 'loss': 'mse', 'optimizer': 'adam', 'graph_mode': 'cutoff', 'cutoff': 0.43485815061087063, 'grm_norm': 'cosine', 'self_loops': True, 'use_snp_selection': True, 'num_snps': 18645}. Best is trial 32 with value: 0.05624840045269122.
[I 2025-11-03 14:49:10,677] Trial 98 finished with value: 0.015188647101553938 and parameters: {'model_type': 'graphsage', 'hidden_dims': '[256, 128, 64]', 'dropout': 0.43397388220186145, 'batch_norm': True, 'lr': 3.7814840946998964e-06, 'weight_decay': 0.0004313840522644899, 'epochs': 107, 'loss': 'mae', 'optimizer': 'adam', 'graph_mode': 'knn', 'source': 'grm', 'knn_k': 7, 'weighted_edges': False, 'symmetrize_mode': 'union', 'use_snp_selection': False}. Best is trial 32 with value: 0.05624840045269122.
[I 2025-11-03 14:49:14,109] Trial 99 finished with value: -0.021294723452451203 and parameters: {'model_type': 'graphsage', 'hidden_dims': '[512, 128]', 'dropout': 0.16826498428461034, 'batch_norm': False, 'lr': 1.367946923759182e-06, 'weight_decay': 7.933361283944798e-05, 'epochs': 121, 'loss': 'mse', 'optimizer': 'adam', 'graph_mode': 'knn', 'source': 'grm', 'knn_k': 5, 'weighted_edges': True, 'symmetrize_mode': 'union', 'use_snp_selection': True, 'num_snps': 32600}. Best is trial 32 with value: 0.05624840045269122.
[I 2025-11-03 14:49:19,151] Trial 100 finished with value: 0.007549320484700818 and parameters: {'model_type': 'graphsage', 'hidden_dims': '[512, 256]', 'dropout': 0.25729117782607425, 'batch_norm': False, 'lr': 0.0007556751770902962, 'weight_decay': 0.0003291521325804942, 'epochs': 331, 'loss': 'mse', 'optimizer': 'adam', 'graph_mode': 'knn', 'source': 'grm', 'knn_k': 8, 'weighted_edges': False, 'symmetrize_mode': 'mutual', 'use_snp_selection': True, 'num_snps': 36035}. Best is trial 32 with value: 0.05624840045269122.
[I 2025-11-03 14:49:21,506] Trial 101 finished with value: 0.03191241082275578 and parameters: {'model_type': 'graphsage', 'hidden_dims': '[128, 64]', 'dropout': 0.34509630171587863, 'batch_norm': False, 'lr': 2.0586192414314188e-06, 'weight_decay': 0.00014716344008257437, 'epochs': 103, 'loss': 'mse', 'optimizer': 'adam', 'graph_mode': 'cutoff', 'cutoff': 0.3733712150142342, 'grm_norm': 'cosine', 'self_loops': True, 'use_snp_selection': True, 'num_snps': 26675}. Best is trial 32 with value: 0.05624840045269122.
[I 2025-11-03 14:49:23,774] Trial 102 finished with value: -0.01137802102808775 and parameters: {'model_type': 'graphsage', 'hidden_dims': '[128, 64]', 'dropout': 0.3119567836044676, 'batch_norm': False, 'lr': 8.62668934371385e-06, 'weight_decay': 0.00021602245326591274, 'epochs': 77, 'loss': 'mse', 'optimizer': 'adam', 'graph_mode': 'cutoff', 'cutoff': 0.23046432359189778, 'grm_norm': 'cosine', 'self_loops': True, 'use_snp_selection': True, 'num_snps': 25955}. Best is trial 32 with value: 0.05624840045269122.
[I 2025-11-03 14:49:25,826] Trial 103 finished with value: -0.028286561028609485 and parameters: {'model_type': 'graphsage', 'hidden_dims': '[128, 64]', 'dropout': 0.2855802939994965, 'batch_norm': False, 'lr': 1.474454751210958e-06, 'weight_decay': 0.0001399287373346816, 'epochs': 88, 'loss': 'mse', 'optimizer': 'adam', 'graph_mode': 'cutoff', 'cutoff': 0.34293074626826814, 'grm_norm': 'cosine', 'self_loops': True, 'use_snp_selection': True, 'num_snps': 19926}. Best is trial 32 with value: 0.05624840045269122.
[I 2025-11-03 14:49:28,222] Trial 104 finished with value: 0.0009498811572295847 and parameters: {'model_type': 'graphsage', 'hidden_dims': '[128, 64]', 'dropout': 0.550706956474721, 'batch_norm': False, 'lr': 1.9499250606986557e-06, 'weight_decay': 0.0002622580841585677, 'epochs': 114, 'loss': 'mse', 'optimizer': 'adam', 'graph_mode': 'cutoff', 'cutoff': 0.37057514117364737, 'grm_norm': 'cosine', 'self_loops': True, 'use_snp_selection': True, 'num_snps': 26852}. Best is trial 32 with value: 0.05624840045269122.
[I 2025-11-03 14:49:31,549] Trial 105 finished with value: 0.00495608854551943 and parameters: {'model_type': 'graphsage', 'hidden_dims': '[512, 64]', 'dropout': 0.32941883503869457, 'batch_norm': False, 'lr': 1.2119804420429643e-06, 'weight_decay': 5.980371724784466e-05, 'epochs': 268, 'loss': 'mse', 'optimizer': 'adam', 'graph_mode': 'cutoff', 'cutoff': 0.4693680101331644, 'grm_norm': 'cosine_then_gcn', 'self_loops': True, 'use_snp_selection': True, 'num_snps': 23290}. Best is trial 32 with value: 0.05624840045269122.
[I 2025-11-03 14:49:34,048] Trial 106 finished with value: -0.0331779696524122 and parameters: {'model_type': 'graphsage', 'hidden_dims': '[128, 64]', 'dropout': 0.23763662807284613, 'batch_norm': False, 'lr': 1.7129376483689512e-06, 'weight_decay': 4.355537115672862e-05, 'epochs': 100, 'loss': 'mse', 'optimizer': 'adam', 'graph_mode': 'knn', 'source': 'grm', 'knn_k': 7, 'weighted_edges': False, 'symmetrize_mode': 'union', 'use_snp_selection': True, 'num_snps': 28604}. Best is trial 32 with value: 0.05624840045269122.
[I 2025-11-03 14:49:37,243] Trial 107 finished with value: 0.011726158026186905 and parameters: {'model_type': 'graphsage', 'hidden_dims': '[256, 128, 64]', 'dropout': 0.4749697814831201, 'batch_norm': True, 'lr': 2.9225986637310022e-06, 'weight_decay': 0.00010575286616244316, 'epochs': 232, 'loss': 'mse', 'optimizer': 'adam', 'graph_mode': 'cutoff', 'cutoff': 0.2955394660888927, 'grm_norm': 'none', 'self_loops': True, 'use_snp_selection': False}. Best is trial 32 with value: 0.05624840045269122.
[I 2025-11-03 14:49:41,324] Trial 108 finished with value: -0.0017952446881372831 and parameters: {'model_type': 'graphsage', 'hidden_dims': '[256, 128]', 'dropout': 0.5838213371962239, 'batch_norm': False, 'lr': 1.9068612972509337e-05, 'weight_decay': 7.508218013375935e-05, 'epochs': 246, 'loss': 'mae', 'optimizer': 'adam', 'graph_mode': 'knn', 'source': 'grm', 'knn_k': 10, 'weighted_edges': True, 'symmetrize_mode': 'union', 'use_snp_selection': True, 'num_snps': 37659}. Best is trial 32 with value: 0.05624840045269122.
[I 2025-11-03 14:49:43,768] Trial 109 finished with value: 1.9235594485994545e-05 and parameters: {'model_type': 'graphsage', 'hidden_dims': '[128, 64]', 'dropout': 0.376460941087447, 'batch_norm': True, 'lr': 0.0006314382904859827, 'weight_decay': 0.00018479407125423359, 'epochs': 298, 'loss': 'mse', 'optimizer': 'adam', 'graph_mode': 'knn', 'source': 'grm', 'knn_k': 3, 'weighted_edges': False, 'symmetrize_mode': 'mutual', 'use_snp_selection': False}. Best is trial 32 with value: 0.05624840045269122.
[I 2025-11-03 14:49:46,218] Trial 110 finished with value: -0.04600121364150501 and parameters: {'model_type': 'graphsage', 'hidden_dims': '[256, 128, 64]', 'dropout': 0.30205503332867645, 'batch_norm': False, 'lr': 2.4624281796232203e-06, 'weight_decay': 0.000994400025141379, 'epochs': 152, 'loss': 'mse', 'optimizer': 'adam', 'graph_mode': 'knn', 'source': 'grm', 'knn_k': 9, 'weighted_edges': False, 'symmetrize_mode': 'union', 'use_snp_selection': True, 'num_snps': 15850}. Best is trial 32 with value: 0.05624840045269122.
[I 2025-11-03 14:49:48,294] Trial 111 finished with value: 0.032815582505474686 and parameters: {'model_type': 'graphsage', 'hidden_dims': '[128, 64]', 'dropout': 0.38933408721934903, 'batch_norm': False, 'lr': 1.9756470083280864e-06, 'weight_decay': 0.00017396186550243896, 'epochs': 99, 'loss': 'mse', 'optimizer': 'adam', 'graph_mode': 'cutoff', 'cutoff': 0.4273955047657225, 'grm_norm': 'cosine', 'self_loops': True, 'use_snp_selection': True, 'num_snps': 20232}. Best is trial 32 with value: 0.05624840045269122.
[I 2025-11-03 14:49:51,090] Trial 112 finished with value: -0.01119101138028677 and parameters: {'model_type': 'graphsage', 'hidden_dims': '[128, 64]', 'dropout': 0.4082507339674237, 'batch_norm': False, 'lr': 1.0118170127699772e-06, 'weight_decay': 0.0003589482789379966, 'epochs': 315, 'loss': 'mse', 'optimizer': 'adam', 'graph_mode': 'cutoff', 'cutoff': 0.5394532478198256, 'grm_norm': 'cosine', 'self_loops': True, 'use_snp_selection': True, 'num_snps': 19649}. Best is trial 32 with value: 0.05624840045269122.
[I 2025-11-03 14:49:53,208] Trial 113 finished with value: 0.0070900781978239175 and parameters: {'model_type': 'graphsage', 'hidden_dims': '[128, 64]', 'dropout': 0.39527155436104267, 'batch_norm': False, 'lr': 3.3873072203652744e-05, 'weight_decay': 0.0004613341049202664, 'epochs': 93, 'loss': 'mse', 'optimizer': 'adam', 'graph_mode': 'cutoff', 'cutoff': 0.40484696831450034, 'grm_norm': 'cosine', 'self_loops': True, 'use_snp_selection': True, 'num_snps': 22047}. Best is trial 32 with value: 0.05624840045269122.
[I 2025-11-03 14:49:54,940] Trial 114 finished with value: -0.004519160778902406 and parameters: {'model_type': 'graphsage', 'hidden_dims': '[128, 64]', 'dropout': 0.3519032220475801, 'batch_norm': False, 'lr': 1.7755145200282633e-06, 'weight_decay': 0.00016419856654224126, 'epochs': 80, 'loss': 'mse', 'optimizer': 'adam', 'graph_mode': 'cutoff', 'cutoff': 0.28951687494561107, 'grm_norm': 'cosine', 'self_loops': True, 'use_snp_selection': True, 'num_snps': 11436}. Best is trial 32 with value: 0.05624840045269122.
[I 2025-11-03 14:49:57,466] Trial 115 finished with value: 0.021472670305995666 and parameters: {'model_type': 'graphsage', 'hidden_dims': '[128, 64]', 'dropout': 0.3650827389369028, 'batch_norm': False, 'lr': 2.2039290714895985e-06, 'weight_decay': 0.0007131766059580313, 'epochs': 108, 'loss': 'mse', 'optimizer': 'adam', 'graph_mode': 'cutoff', 'cutoff': 0.5953318337759251, 'grm_norm': 'cosine', 'self_loops': True, 'use_snp_selection': True, 'num_snps': 31566}. Best is trial 32 with value: 0.05624840045269122.
