[I 2025-11-03 13:34:35,281] Trial 50 finished with value: 0.06324290206455102 and parameters: {'model_type': 'gcn', 'hidden_dims': '[512, 256]', 'dropout': 0.5167569953851979, 'batch_norm': True, 'lr': 0.00029826816389177924, 'weight_decay': 2.3185611947950154e-05, 'epochs': 184, 'loss': 'mae', 'optimizer': 'adam', 'graph_mode': 'knn', 'source': 'grm', 'knn_k': 7, 'weighted_edges': False, 'symmetrize_mode': 'mutual', 'use_snp_selection': False}. Best is trial 5 with value: 0.11004804627476908.
[I 2025-11-03 13:34:37,080] Trial 51 finished with value: 0.07753439394533199 and parameters: {'model_type': 'gcn', 'hidden_dims': '[128, 64]', 'dropout': 0.3331271805427852, 'batch_norm': True, 'lr': 0.0009658755983675046, 'weight_decay': 2.021471693117479e-06, 'epochs': 240, 'loss': 'mae', 'optimizer': 'adam', 'graph_mode': 'knn', 'source': 'grm', 'knn_k': 5, 'weighted_edges': True, 'symmetrize_mode': 'mutual', 'use_snp_selection': False}. Best is trial 5 with value: 0.11004804627476908.
[I 2025-11-03 13:34:38,805] Trial 52 finished with value: 0.1106663896635278 and parameters: {'model_type': 'gcn', 'hidden_dims': '[128, 64]', 'dropout': 0.3573378274923955, 'batch_norm': True, 'lr': 0.0007826622558714351, 'weight_decay': 7.038949021102769e-07, 'epochs': 218, 'loss': 'mae', 'optimizer': 'adam', 'graph_mode': 'knn', 'source': 'grm', 'knn_k': 5, 'weighted_edges': True, 'symmetrize_mode': 'mutual', 'use_snp_selection': False}. Best is trial 52 with value: 0.1106663896635278.
[I 2025-11-03 13:34:40,506] Trial 53 finished with value: 0.08463351623674077 and parameters: {'model_type': 'gcn', 'hidden_dims': '[128, 64]', 'dropout': 0.36043992846023687, 'batch_norm': True, 'lr': 0.0006301842032323025, 'weight_decay': 6.198076719954153e-07, 'epochs': 205, 'loss': 'mae', 'optimizer': 'adam', 'graph_mode': 'knn', 'source': 'grm', 'knn_k': 9, 'weighted_edges': True, 'symmetrize_mode': 'mutual', 'use_snp_selection': False}. Best is trial 52 with value: 0.1106663896635278.
[I 2025-11-03 13:34:42,232] Trial 54 finished with value: 0.09664854159318459 and parameters: {'model_type': 'gcn', 'hidden_dims': '[128, 64]', 'dropout': 0.4016596879087576, 'batch_norm': True, 'lr': 0.0004798966548681657, 'weight_decay': 2.0444210095434502e-07, 'epochs': 215, 'loss': 'mae', 'optimizer': 'adam', 'graph_mode': 'knn', 'source': 'grm', 'knn_k': 6, 'weighted_edges': True, 'symmetrize_mode': 'mutual', 'use_snp_selection': False}. Best is trial 52 with value: 0.1106663896635278.
[I 2025-11-03 13:34:44,120] Trial 55 finished with value: 0.08408522132847403 and parameters: {'model_type': 'gcn', 'hidden_dims': '[256, 128, 64]', 'dropout': 0.2778180839263369, 'batch_norm': True, 'lr': 0.000783503160330594, 'weight_decay': 1.0202004450295854e-06, 'epochs': 152, 'loss': 'mae', 'optimizer': 'adam', 'graph_mode': 'knn', 'source': 'grm', 'knn_k': 3, 'weighted_edges': True, 'symmetrize_mode': 'mutual', 'use_snp_selection': False}. Best is trial 52 with value: 0.1106663896635278.
[I 2025-11-03 13:34:46,149] Trial 56 finished with value: 0.0370727558835259 and parameters: {'model_type': 'gcn', 'hidden_dims': '[512, 128]', 'dropout': 0.42512384481790944, 'batch_norm': False, 'lr': 5.654578058853651e-05, 'weight_decay': 4.661052656620003e-07, 'epochs': 252, 'loss': 'mse', 'optimizer': 'adam', 'graph_mode': 'cutoff', 'cutoff': 0.5065241996553229, 'grm_norm': 'none', 'self_loops': False, 'use_snp_selection': True, 'num_snps': 13942}. Best is trial 52 with value: 0.1106663896635278.
[I 2025-11-03 13:34:47,693] Trial 57 finished with value: 0.10158534479394832 and parameters: {'model_type': 'gcn', 'hidden_dims': '[128, 64]', 'dropout': 0.322152361243071, 'batch_norm': True, 'lr': 0.0003803110772372285, 'weight_decay': 1.2013448465481708e-07, 'epochs': 163, 'loss': 'mse', 'optimizer': 'adam', 'graph_mode': 'knn', 'source': 'grm', 'knn_k': 6, 'weighted_edges': True, 'symmetrize_mode': 'mutual', 'use_snp_selection': False}. Best is trial 52 with value: 0.1106663896635278.
[I 2025-11-03 13:34:49,192] Trial 58 finished with value: 0.038373482553181286 and parameters: {'model_type': 'gcn', 'hidden_dims': '[128, 64]', 'dropout': 0.11439075000846363, 'batch_norm': True, 'lr': 5.823070714209575e-06, 'weight_decay': 1.2407852479955284e-07, 'epochs': 162, 'loss': 'mse', 'optimizer': 'adam', 'graph_mode': 'cutoff', 'cutoff': 0.6871126242110002, 'grm_norm': 'cosine_then_gcn', 'self_loops': True, 'use_snp_selection': False}. Best is trial 52 with value: 0.1106663896635278.
[I 2025-11-03 13:34:52,228] Trial 59 finished with value: 0.08765292769973282 and parameters: {'model_type': 'gcn', 'hidden_dims': '[128, 64]', 'dropout': 0.5555456665390804, 'batch_norm': True, 'lr': 0.0003601421123166316, 'weight_decay': 1.8597425301368518e-07, 'epochs': 124, 'loss': 'mse', 'optimizer': 'adam', 'graph_mode': 'knn', 'source': 'grm', 'knn_k': 6, 'weighted_edges': True, 'symmetrize_mode': 'union', 'use_snp_selection': True, 'num_snps': 53711}. Best is trial 52 with value: 0.1106663896635278.
[I 2025-11-03 13:34:54,116] Trial 60 finished with value: 0.038176065959539124 and parameters: {'model_type': 'gcn', 'hidden_dims': '[128, 64]', 'dropout': 0.2858330019702494, 'batch_norm': False, 'lr': 0.000742413708774946, 'weight_decay': 7.308259688635436e-07, 'epochs': 314, 'loss': 'mse', 'optimizer': 'adam', 'graph_mode': 'cutoff', 'cutoff': 0.8076910607693906, 'grm_norm': 'gcn', 'self_loops': False, 'use_snp_selection': False}. Best is trial 52 with value: 0.1106663896635278.
[I 2025-11-03 13:34:56,515] Trial 61 finished with value: 0.09286430266401842 and parameters: {'model_type': 'gcn', 'hidden_dims': '[512, 64]', 'dropout': 0.31992366521950305, 'batch_norm': True, 'lr': 0.00024434562918212803, 'weight_decay': 4.614100614903061e-06, 'epochs': 193, 'loss': 'mse', 'optimizer': 'adam', 'graph_mode': 'knn', 'source': 'grm', 'knn_k': 7, 'weighted_edges': True, 'symmetrize_mode': 'mutual', 'use_snp_selection': False}. Best is trial 52 with value: 0.1106663896635278.
[I 2025-11-03 13:34:58,327] Trial 62 finished with value: 0.0932627791434876 and parameters: {'model_type': 'gcn', 'hidden_dims': '[256, 128]', 'dropout': 0.3664210390902535, 'batch_norm': True, 'lr': 0.0004847509048817926, 'weight_decay': 4.2066819624752705e-07, 'epochs': 183, 'loss': 'mse', 'optimizer': 'adam', 'graph_mode': 'knn', 'source': 'grm', 'knn_k': 6, 'weighted_edges': True, 'symmetrize_mode': 'mutual', 'use_snp_selection': False}. Best is trial 52 with value: 0.1106663896635278.
[I 2025-11-03 13:34:59,884] Trial 63 finished with value: 0.06361745669400114 and parameters: {'model_type': 'gcn', 'hidden_dims': '[128, 64]', 'dropout': 0.4982852192559345, 'batch_norm': True, 'lr': 0.00030220806400436517, 'weight_decay': 1.4590154245938569e-06, 'epochs': 167, 'loss': 'mse', 'optimizer': 'adam', 'graph_mode': 'knn', 'source': 'grm', 'knn_k': 7, 'weighted_edges': True, 'symmetrize_mode': 'mutual', 'use_snp_selection': False}. Best is trial 52 with value: 0.1106663896635278.
[I 2025-11-03 13:35:01,966] Trial 64 finished with value: 0.048231014398119325 and parameters: {'model_type': 'gcn', 'hidden_dims': '[512, 256]', 'dropout': 0.5925486154209962, 'batch_norm': True, 'lr': 2.005867220903276e-05, 'weight_decay': 1.1426055452516674e-07, 'epochs': 138, 'loss': 'mae', 'optimizer': 'adam', 'graph_mode': 'knn', 'source': 'grm', 'knn_k': 1, 'weighted_edges': True, 'symmetrize_mode': 'mutual', 'use_snp_selection': False}. Best is trial 52 with value: 0.1106663896635278.
[I 2025-11-03 13:35:03,834] Trial 65 finished with value: 0.07824801860638057 and parameters: {'model_type': 'gcn', 'hidden_dims': '[512, 128]', 'dropout': 0.4714027586779706, 'batch_norm': True, 'lr': 0.0006005194138451294, 'weight_decay': 2.6398299151811016e-07, 'epochs': 100, 'loss': 'mse', 'optimizer': 'adam', 'graph_mode': 'knn', 'source': 'grm', 'knn_k': 5, 'weighted_edges': False, 'symmetrize_mode': 'mutual', 'use_snp_selection': False}. Best is trial 52 with value: 0.1106663896635278.
[I 2025-11-03 13:35:06,434] Trial 66 finished with value: 0.09593458613334567 and parameters: {'model_type': 'gcn', 'hidden_dims': '[512, 256]', 'dropout': 0.4441453165162079, 'batch_norm': True, 'lr': 0.00011318115607204438, 'weight_decay': 1.0682928088428124e-05, 'epochs': 222, 'loss': 'mae', 'optimizer': 'adam', 'graph_mode': 'knn', 'source': 'grm', 'knn_k': 4, 'weighted_edges': True, 'symmetrize_mode': 'mutual', 'use_snp_selection': False}. Best is trial 52 with value: 0.1106663896635278.
[I 2025-11-03 13:35:07,837] Trial 67 finished with value: 0.044206250218392265 and parameters: {'model_type': 'gcn', 'hidden_dims': '[256, 128]', 'dropout': 0.38100906589943073, 'batch_norm': True, 'lr': 3.3419697131336504e-05, 'weight_decay': 5.85223671724092e-06, 'epochs': 81, 'loss': 'mse', 'optimizer': 'adam', 'graph_mode': 'cutoff', 'cutoff': 0.20238592637743122, 'grm_norm': 'cosine', 'self_loops': True, 'use_snp_selection': False}. Best is trial 52 with value: 0.1106663896635278.
[I 2025-11-03 13:35:09,519] Trial 68 finished with value: 0.007673049316901052 and parameters: {'model_type': 'gcn', 'hidden_dims': '[128, 64]', 'dropout': 0.4118123646338586, 'batch_norm': True, 'lr': 4.462195067025847e-05, 'weight_decay': 7.699063246684567e-06, 'epochs': 204, 'loss': 'mae', 'optimizer': 'adam', 'graph_mode': 'knn', 'source': 'grm', 'knn_k': 9, 'weighted_edges': False, 'symmetrize_mode': 'union', 'use_snp_selection': False}. Best is trial 52 with value: 0.1106663896635278.
[I 2025-11-03 13:35:10,979] Trial 69 finished with value: 0.0840732013601099 and parameters: {'model_type': 'gcn', 'hidden_dims': '[256, 128, 64]', 'dropout': 0.31910489367806444, 'batch_norm': False, 'lr': 0.0004096843174295726, 'weight_decay': 4.248775031490538e-05, 'epochs': 150, 'loss': 'mse', 'optimizer': 'adam', 'graph_mode': 'cutoff', 'cutoff': 0.5556554287093574, 'grm_norm': 'cosine', 'self_loops': False, 'use_snp_selection': True, 'num_snps': 2794}. Best is trial 52 with value: 0.1106663896635278.
[I 2025-11-03 13:35:13,895] Trial 70 finished with value: 0.0756969386958075 and parameters: {'model_type': 'gcn', 'hidden_dims': '[512, 256]', 'dropout': 0.35071489606297374, 'batch_norm': True, 'lr': 0.00015487645625084448, 'weight_decay': 3.880586027099473e-06, 'epochs': 284, 'loss': 'mae', 'optimizer': 'adam', 'graph_mode': 'knn', 'source': 'grm', 'knn_k': 1, 'weighted_edges': True, 'symmetrize_mode': 'mutual', 'use_snp_selection': False}. Best is trial 52 with value: 0.1106663896635278.
[I 2025-11-03 13:35:15,671] Trial 71 finished with value: 0.0844088241131285 and parameters: {'model_type': 'gcn', 'hidden_dims': '[128, 64]', 'dropout': 0.2582336177997066, 'batch_norm': True, 'lr': 0.0009366583825281013, 'weight_decay': 1.5184565541685258e-06, 'epochs': 236, 'loss': 'mae', 'optimizer': 'adam', 'graph_mode': 'knn', 'source': 'grm', 'knn_k': 5, 'weighted_edges': True, 'symmetrize_mode': 'mutual', 'use_snp_selection': False}. Best is trial 52 with value: 0.1106663896635278.
[I 2025-11-03 13:35:17,401] Trial 72 finished with value: 0.09715307159979646 and parameters: {'model_type': 'gcn', 'hidden_dims': '[128, 64]', 'dropout': 0.2925716014187075, 'batch_norm': True, 'lr': 0.0009834611281900804, 'weight_decay': 1.3311706620132873e-05, 'epochs': 224, 'loss': 'mae', 'optimizer': 'adam', 'graph_mode': 'knn', 'source': 'grm', 'knn_k': 5, 'weighted_edges': True, 'symmetrize_mode': 'mutual', 'use_snp_selection': False}. Best is trial 52 with value: 0.1106663896635278.
[I 2025-11-03 13:35:18,984] Trial 73 finished with value: 0.09894981453152557 and parameters: {'model_type': 'gcn', 'hidden_dims': '[128, 64]', 'dropout': 0.5357984699493998, 'batch_norm': True, 'lr': 0.0008013146983024032, 'weight_decay': 9.011450461201711e-07, 'epochs': 177, 'loss': 'mae', 'optimizer': 'adam', 'graph_mode': 'knn', 'source': 'grm', 'knn_k': 4, 'weighted_edges': True, 'symmetrize_mode': 'mutual', 'use_snp_selection': False}. Best is trial 52 with value: 0.1106663896635278.
[I 2025-11-03 13:35:20,578] Trial 74 finished with value: 0.09830609730927165 and parameters: {'model_type': 'gcn', 'hidden_dims': '[128, 64]', 'dropout': 0.5339949152909721, 'batch_norm': True, 'lr': 0.000554675272324229, 'weight_decay': 8.162686437431992e-07, 'epochs': 179, 'loss': 'mae', 'optimizer': 'adam', 'graph_mode': 'knn', 'source': 'grm', 'knn_k': 4, 'weighted_edges': True, 'symmetrize_mode': 'mutual', 'use_snp_selection': False}. Best is trial 52 with value: 0.1106663896635278.
[I 2025-11-03 13:35:22,992] Trial 75 finished with value: 0.07210640225873158 and parameters: {'model_type': 'gcn', 'hidden_dims': '[512, 128]', 'dropout': 0.502427528200497, 'batch_norm': True, 'lr': 0.0007705939095730693, 'weight_decay': 4.7051195935361413e-07, 'epochs': 197, 'loss': 'mae', 'optimizer': 'adam', 'graph_mode': 'knn', 'source': 'grm', 'knn_k': 6, 'weighted_edges': False, 'symmetrize_mode': 'mutual', 'use_snp_selection': False}. Best is trial 52 with value: 0.1106663896635278.
[I 2025-11-03 13:35:24,442] Trial 76 finished with value: 0.07958786430774233 and parameters: {'model_type': 'gcn', 'hidden_dims': '[128, 64]', 'dropout': 0.5387378500318457, 'batch_norm': True, 'lr': 0.00021876214641940026, 'weight_decay': 1.1065101992842108e-06, 'epochs': 133, 'loss': 'mae', 'optimizer': 'adam', 'graph_mode': 'knn', 'source': 'grm', 'knn_k': 2, 'weighted_edges': True, 'symmetrize_mode': 'mutual', 'use_snp_selection': False}. Best is trial 52 with value: 0.1106663896635278.
[I 2025-11-03 13:35:27,001] Trial 77 finished with value: 0.037291763857394855 and parameters: {'model_type': 'gcn', 'hidden_dims': '[512, 64]', 'dropout': 0.2187755070997211, 'batch_norm': True, 'lr': 1.3931193754355551e-05, 'weight_decay': 1.8334779632848793e-05, 'epochs': 163, 'loss': 'mae', 'optimizer': 'adam', 'graph_mode': 'cutoff', 'cutoff': 0.37655090955996146, 'grm_norm': 'gcn', 'self_loops': True, 'use_snp_selection': True, 'num_snps': 31553}. Best is trial 52 with value: 0.1106663896635278.
[I 2025-11-03 13:35:28,767] Trial 78 finished with value: 0.02503860352743498 and parameters: {'model_type': 'gcn', 'hidden_dims': '[256, 128]', 'dropout': 0.5747637308941067, 'batch_norm': False, 'lr': 0.0003482757380258064, 'weight_decay': 2.3668888976628867e-06, 'epochs': 173, 'loss': 'mse', 'optimizer': 'adam', 'graph_mode': 'knn', 'source': 'grm', 'knn_k': 4, 'weighted_edges': False, 'symmetrize_mode': 'mutual', 'use_snp_selection': False}. Best is trial 52 with value: 0.1106663896635278.
[I 2025-11-03 13:35:30,702] Trial 79 finished with value: 0.04792840845504987 and parameters: {'model_type': 'gcn', 'hidden_dims': '[512, 256]', 'dropout': 0.47329441857109394, 'batch_norm': True, 'lr': 1.0614897468740697e-05, 'weight_decay': 1.4716707542070233e-07, 'epochs': 111, 'loss': 'mae', 'optimizer': 'adam', 'graph_mode': 'knn', 'source': 'grm', 'knn_k': 3, 'weighted_edges': True, 'symmetrize_mode': 'mutual', 'use_snp_selection': False}. Best is trial 52 with value: 0.1106663896635278.
[I 2025-11-03 13:35:31,897] Trial 80 finished with value: 0.09217893658403659 and parameters: {'model_type': 'gcn', 'hidden_dims': '[128, 64]', 'dropout': 0.5531949725596593, 'batch_norm': True, 'lr': 0.00043121256450562946, 'weight_decay': 0.0005191688547388655, 'epochs': 68, 'loss': 'mse', 'optimizer': 'adam', 'graph_mode': 'cutoff', 'cutoff': 0.6321440620353964, 'grm_norm': 'gcn', 'self_loops': False, 'use_snp_selection': False}. Best is trial 52 with value: 0.1106663896635278.
[I 2025-11-03 13:35:33,496] Trial 81 finished with value: 0.1225240826299363 and parameters: {'model_type': 'gcn', 'hidden_dims': '[128, 64]', 'dropout': 0.5244181418870134, 'batch_norm': True, 'lr': 0.0005630742396180453, 'weight_decay': 8.232979245077742e-07, 'epochs': 182, 'loss': 'mae', 'optimizer': 'adam', 'graph_mode': 'knn', 'source': 'grm', 'knn_k': 4, 'weighted_edges': True, 'symmetrize_mode': 'mutual', 'use_snp_selection': False}. Best is trial 81 with value: 0.1225240826299363.
[I 2025-11-03 13:35:35,121] Trial 82 finished with value: 0.08677370059629076 and parameters: {'model_type': 'gcn', 'hidden_dims': '[128, 64]', 'dropout': 0.5262623088106804, 'batch_norm': True, 'lr': 0.0005471991317439883, 'weight_decay': 5.560284363630672e-07, 'epochs': 188, 'loss': 'mae', 'optimizer': 'adam', 'graph_mode': 'knn', 'source': 'grm', 'knn_k': 4, 'weighted_edges': True, 'symmetrize_mode': 'mutual', 'use_snp_selection': False}. Best is trial 81 with value: 0.1225240826299363.
[I 2025-11-03 13:35:36,822] Trial 83 finished with value: 0.041615567580047946 and parameters: {'model_type': 'gcn', 'hidden_dims': '[128, 64]', 'dropout': 0.487416731938412, 'batch_norm': True, 'lr': 2.8636629307272317e-05, 'weight_decay': 2.2570158666122147e-07, 'epochs': 211, 'loss': 'mae', 'optimizer': 'adam', 'graph_mode': 'knn', 'source': 'grm', 'knn_k': 6, 'weighted_edges': True, 'symmetrize_mode': 'mutual', 'use_snp_selection': False}. Best is trial 81 with value: 0.1225240826299363.
[I 2025-11-03 13:35:38,333] Trial 84 finished with value: 0.09426612654563205 and parameters: {'model_type': 'gcn', 'hidden_dims': '[128, 64]', 'dropout': 0.14132179195788658, 'batch_norm': True, 'lr': 0.0002715902244216968, 'weight_decay': 3.827005686020209e-07, 'epochs': 151, 'loss': 'mae', 'optimizer': 'adam', 'graph_mode': 'knn', 'source': 'grm', 'knn_k': 3, 'weighted_edges': True, 'symmetrize_mode': 'mutual', 'use_snp_selection': False}. Best is trial 81 with value: 0.1225240826299363.
[I 2025-11-03 13:35:40,623] Trial 85 finished with value: 0.09719571851004362 and parameters: {'model_type': 'gcn', 'hidden_dims': '[512, 128]', 'dropout': 0.5122268959213483, 'batch_norm': True, 'lr': 0.0006939476420534885, 'weight_decay': 2.6789452952070484e-05, 'epochs': 175, 'loss': 'mae', 'optimizer': 'adam', 'graph_mode': 'knn', 'source': 'grm', 'knn_k': 5, 'weighted_edges': True, 'symmetrize_mode': 'union', 'use_snp_selection': False}. Best is trial 81 with value: 0.1225240826299363.
[I 2025-11-03 13:35:42,429] Trial 86 finished with value: 0.025972490338105614 and parameters: {'model_type': 'gcn', 'hidden_dims': '[128, 64]', 'dropout': 0.581282755159535, 'batch_norm': True, 'lr': 1.742637492268664e-05, 'weight_decay': 8.420040658198317e-07, 'epochs': 200, 'loss': 'mae', 'optimizer': 'adam', 'graph_mode': 'knn', 'source': 'grm', 'knn_k': 2, 'weighted_edges': True, 'symmetrize_mode': 'mutual', 'use_snp_selection': True, 'num_snps': 11964}. Best is trial 81 with value: 0.1225240826299363.
[I 2025-11-03 13:35:44,637] Trial 87 finished with value: 0.023152443408647798 and parameters: {'model_type': 'gcn', 'hidden_dims': '[512, 256]', 'dropout': 0.4108180012013986, 'batch_norm': False, 'lr': 0.0008728212085335776, 'weight_decay': 5.2634206263805435e-06, 'epochs': 157, 'loss': 'mae', 'optimizer': 'adam', 'graph_mode': 'knn', 'source': 'grm', 'knn_k': 4, 'weighted_edges': False, 'symmetrize_mode': 'mutual', 'use_snp_selection': False}. Best is trial 81 with value: 0.1225240826299363.
[I 2025-11-03 13:35:45,886] Trial 88 finished with value: 0.09891266485021508 and parameters: {'model_type': 'gcn', 'hidden_dims': '[256, 128]', 'dropout': 0.5631562963134359, 'batch_norm': True, 'lr': 0.00045849912927935926, 'weight_decay': 1.3937133372420722e-06, 'epochs': 44, 'loss': 'mae', 'optimizer': 'adam', 'graph_mode': 'cutoff', 'cutoff': 0.5772518965843138, 'grm_norm': 'cosine_then_gcn', 'self_loops': True, 'use_snp_selection': False}. Best is trial 81 with value: 0.1225240826299363.
[I 2025-11-03 13:35:47,664] Trial 89 finished with value: 0.039678707782508676 and parameters: {'model_type': 'gcn', 'hidden_dims': '[128, 64]', 'dropout': 0.10349021080027491, 'batch_norm': True, 'lr': 1.4034204615758382e-06, 'weight_decay': 2.5094031258626208e-06, 'epochs': 252, 'loss': 'mse', 'optimizer': 'adam', 'graph_mode': 'knn', 'source': 'grm', 'knn_k': 1, 'weighted_edges': True, 'symmetrize_mode': 'mutual', 'use_snp_selection': False}. Best is trial 81 with value: 0.1225240826299363.
[I 2025-11-03 13:35:49,475] Trial 90 finished with value: 0.12385554697147882 and parameters: {'model_type': 'gcn', 'hidden_dims': '[256, 128, 64]', 'dropout': 0.4427161736945483, 'batch_norm': True, 'lr': 0.0005529153480020176, 'weight_decay': 9.598678468745399e-06, 'epochs': 143, 'loss': 'mae', 'optimizer': 'adam', 'graph_mode': 'knn', 'source': 'grm', 'knn_k': 2, 'weighted_edges': True, 'symmetrize_mode': 'mutual', 'use_snp_selection': False}. Best is trial 90 with value: 0.12385554697147882.
[I 2025-11-03 13:35:51,173] Trial 91 finished with value: 0.0817076080897089 and parameters: {'model_type': 'gcn', 'hidden_dims': '[256, 128, 64]', 'dropout': 0.5998177953598351, 'batch_norm': True, 'lr': 0.000546360235608921, 'weight_decay': 1.551072627304888e-05, 'epochs': 119, 'loss': 'mae', 'optimizer': 'adam', 'graph_mode': 'knn', 'source': 'grm', 'knn_k': 2, 'weighted_edges': True, 'symmetrize_mode': 'mutual', 'use_snp_selection': False}. Best is trial 90 with value: 0.12385554697147882.
[I 2025-11-03 13:35:52,985] Trial 92 finished with value: 0.10651226612477104 and parameters: {'model_type': 'gcn', 'hidden_dims': '[256, 128, 64]', 'dropout': 0.4413097055717862, 'batch_norm': True, 'lr': 0.0006450040132181671, 'weight_decay': 1.1993498815841207e-05, 'epochs': 147, 'loss': 'mae', 'optimizer': 'adam', 'graph_mode': 'knn', 'source': 'grm', 'knn_k': 1, 'weighted_edges': True, 'symmetrize_mode': 'mutual', 'use_snp_selection': False}. Best is trial 90 with value: 0.12385554697147882.
[I 2025-11-03 13:35:54,755] Trial 93 finished with value: 0.09811028494393022 and parameters: {'model_type': 'gcn', 'hidden_dims': '[256, 128, 64]', 'dropout': 0.44086005841893267, 'batch_norm': True, 'lr': 0.0003194070787739519, 'weight_decay': 1.2325559863050442e-05, 'epochs': 141, 'loss': 'mae', 'optimizer': 'adam', 'graph_mode': 'knn', 'source': 'grm', 'knn_k': 1, 'weighted_edges': True, 'symmetrize_mode': 'mutual', 'use_snp_selection': False}. Best is trial 90 with value: 0.12385554697147882.
