[I 2025-11-03 15:24:52,808] Trial 54 finished with value: 0.11258069004324568 and parameters: {'model_type': 'graphsage', 'hidden_dims': '[128, 64]', 'dropout': 0.2197511813570297, 'batch_norm': True, 'lr': 0.00021408138694710668, 'weight_decay': 0.0002090384699045879, 'epochs': 285, 'loss': 'mse', 'optimizer': 'adam', 'graph_mode': 'knn', 'source': 'grm', 'knn_k': 5, 'weighted_edges': False, 'symmetrize_mode': 'mutual', 'use_snp_selection': False}. Best is trial 41 with value: 0.11551663568743284.
[I 2025-11-03 15:24:55,131] Trial 55 finished with value: 0.09869147288668254 and parameters: {'model_type': 'graphsage', 'hidden_dims': '[128, 64]', 'dropout': 0.1656857657221785, 'batch_norm': True, 'lr': 0.0002077963121199107, 'weight_decay': 0.0002217552466595807, 'epochs': 320, 'loss': 'mse', 'optimizer': 'adam', 'graph_mode': 'knn', 'source': 'grm', 'knn_k': 4, 'weighted_edges': False, 'symmetrize_mode': 'mutual', 'use_snp_selection': False}. Best is trial 41 with value: 0.11551663568743284.
[I 2025-11-03 15:24:57,147] Trial 56 finished with value: 0.09894272035054319 and parameters: {'model_type': 'graphsage', 'hidden_dims': '[128, 64]', 'dropout': 0.2111044209570275, 'batch_norm': True, 'lr': 0.00012690904910804605, 'weight_decay': 0.0005173432800330201, 'epochs': 230, 'loss': 'mse', 'optimizer': 'adam', 'graph_mode': 'knn', 'source': 'grm', 'knn_k': 5, 'weighted_edges': False, 'symmetrize_mode': 'mutual', 'use_snp_selection': False}. Best is trial 41 with value: 0.11551663568743284.
[I 2025-11-03 15:24:59,256] Trial 57 finished with value: 0.0933978771938862 and parameters: {'model_type': 'graphsage', 'hidden_dims': '[128, 64]', 'dropout': 0.26093830239573906, 'batch_norm': True, 'lr': 0.0007186638686808425, 'weight_decay': 0.00010702385264486042, 'epochs': 255, 'loss': 'mse', 'optimizer': 'adam', 'graph_mode': 'knn', 'source': 'grm', 'knn_k': 4, 'weighted_edges': False, 'symmetrize_mode': 'union', 'use_snp_selection': False}. Best is trial 41 with value: 0.11551663568743284.
[I 2025-11-03 15:25:01,544] Trial 58 finished with value: 0.10391141359554724 and parameters: {'model_type': 'graphsage', 'hidden_dims': '[128, 64]', 'dropout': 0.3367637368120094, 'batch_norm': True, 'lr': 9.882554280624943e-05, 'weight_decay': 0.00020601080369275976, 'epochs': 308, 'loss': 'mse', 'optimizer': 'adam', 'graph_mode': 'knn', 'source': 'grm', 'knn_k': 5, 'weighted_edges': False, 'symmetrize_mode': 'mutual', 'use_snp_selection': False}. Best is trial 41 with value: 0.11551663568743284.
[I 2025-11-03 15:25:03,002] Trial 59 finished with value: 0.10204817202815243 and parameters: {'model_type': 'graphsage', 'hidden_dims': '[128, 64]', 'dropout': 0.20048162387812665, 'batch_norm': True, 'lr': 0.00028086287682991493, 'weight_decay': 0.0009027309741001053, 'epochs': 66, 'loss': 'mse', 'optimizer': 'adam', 'graph_mode': 'knn', 'source': 'grm', 'knn_k': 9, 'weighted_edges': False, 'symmetrize_mode': 'mutual', 'use_snp_selection': False}. Best is trial 41 with value: 0.11551663568743284.
[I 2025-11-03 15:25:07,596] Trial 60 finished with value: 0.0744133325506226 and parameters: {'model_type': 'graphsage', 'hidden_dims': '[512, 256]', 'dropout': 0.2753491938976089, 'batch_norm': True, 'lr': 9.041963567346047e-06, 'weight_decay': 2.0071733235662777e-05, 'epochs': 350, 'loss': 'mse', 'optimizer': 'adam', 'graph_mode': 'knn', 'source': 'grm', 'knn_k': 6, 'weighted_edges': False, 'symmetrize_mode': 'union', 'use_snp_selection': False}. Best is trial 41 with value: 0.11551663568743284.
[I 2025-11-03 15:25:11,552] Trial 61 finished with value: 0.09614456717398931 and parameters: {'model_type': 'graphsage', 'hidden_dims': '[512, 64]', 'dropout': 0.23287728671625973, 'batch_norm': True, 'lr': 0.00040831667302033855, 'weight_decay': 5.294101729420744e-05, 'epochs': 283, 'loss': 'mse', 'optimizer': 'adam', 'graph_mode': 'knn', 'source': 'grm', 'knn_k': 7, 'weighted_edges': False, 'symmetrize_mode': 'mutual', 'use_snp_selection': False}. Best is trial 41 with value: 0.11551663568743284.
[I 2025-11-03 15:25:15,523] Trial 62 finished with value: 0.09528637287654369 and parameters: {'model_type': 'graphsage', 'hidden_dims': '[512, 64]', 'dropout': 0.2217793346889842, 'batch_norm': True, 'lr': 0.0005643715789351688, 'weight_decay': 7.231710522286779e-05, 'epochs': 285, 'loss': 'mse', 'optimizer': 'adam', 'graph_mode': 'knn', 'source': 'grm', 'knn_k': 7, 'weighted_edges': False, 'symmetrize_mode': 'mutual', 'use_snp_selection': False}. Best is trial 41 with value: 0.11551663568743284.
[I 2025-11-03 15:25:19,405] Trial 63 finished with value: 0.10739227975948734 and parameters: {'model_type': 'graphsage', 'hidden_dims': '[512, 64]', 'dropout': 0.3006290121401676, 'batch_norm': True, 'lr': 0.00036380796037749694, 'weight_decay': 0.00012546142560002413, 'epochs': 272, 'loss': 'mae', 'optimizer': 'adam', 'graph_mode': 'knn', 'source': 'grm', 'knn_k': 7, 'weighted_edges': False, 'symmetrize_mode': 'mutual', 'use_snp_selection': False}. Best is trial 41 with value: 0.11551663568743284.
[I 2025-11-03 15:25:23,541] Trial 64 finished with value: 0.09504865558687343 and parameters: {'model_type': 'graphsage', 'hidden_dims': '[512, 64]', 'dropout': 0.18181066699816165, 'batch_norm': True, 'lr': 0.0007715592426342318, 'weight_decay': 8.047689241999975e-05, 'epochs': 306, 'loss': 'mse', 'optimizer': 'adam', 'graph_mode': 'knn', 'source': 'grm', 'knn_k': 8, 'weighted_edges': False, 'symmetrize_mode': 'mutual', 'use_snp_selection': False}. Best is trial 41 with value: 0.11551663568743284.
[I 2025-11-03 15:25:27,728] Trial 65 finished with value: 0.08063870659287743 and parameters: {'model_type': 'graphsage', 'hidden_dims': '[512, 64]', 'dropout': 0.15320732575724183, 'batch_norm': True, 'lr': 0.00020863015130741228, 'weight_decay': 4.6768736321841224e-05, 'epochs': 325, 'loss': 'mae', 'optimizer': 'adam', 'graph_mode': 'knn', 'source': 'grm', 'knn_k': 4, 'weighted_edges': False, 'symmetrize_mode': 'mutual', 'use_snp_selection': False}. Best is trial 41 with value: 0.11551663568743284.
[I 2025-11-03 15:25:31,418] Trial 66 finished with value: 0.10055938847521863 and parameters: {'model_type': 'graphsage', 'hidden_dims': '[512, 128]', 'dropout': 0.10039229343289036, 'batch_norm': True, 'lr': 0.00041508265537730846, 'weight_decay': 0.00016739320873030832, 'epochs': 245, 'loss': 'mae', 'optimizer': 'adam', 'graph_mode': 'knn', 'source': 'grm', 'knn_k': 6, 'weighted_edges': True, 'symmetrize_mode': 'mutual', 'use_snp_selection': False}. Best is trial 41 with value: 0.11551663568743284.
[I 2025-11-03 15:25:34,163] Trial 67 finished with value: 0.06518144157239547 and parameters: {'model_type': 'graphsage', 'hidden_dims': '[256, 128, 64]', 'dropout': 0.24299343504821883, 'batch_norm': False, 'lr': 3.212076671454049e-06, 'weight_decay': 2.747261941017345e-05, 'epochs': 298, 'loss': 'mse', 'optimizer': 'adam', 'graph_mode': 'knn', 'source': 'grm', 'knn_k': 5, 'weighted_edges': False, 'symmetrize_mode': 'mutual', 'use_snp_selection': True, 'num_snps': 17897}. Best is trial 41 with value: 0.11551663568743284.
[I 2025-11-03 15:25:38,365] Trial 68 finished with value: 0.09967977554118597 and parameters: {'model_type': 'graphsage', 'hidden_dims': '[512, 64]', 'dropout': 0.33848659033151, 'batch_norm': True, 'lr': 0.0005675770773961257, 'weight_decay': 1.54218714202285e-05, 'epochs': 339, 'loss': 'mae', 'optimizer': 'adam', 'graph_mode': 'cutoff', 'cutoff': 0.7364324640933693, 'grm_norm': 'cosine_then_gcn', 'self_loops': True, 'use_snp_selection': False}. Best is trial 41 with value: 0.11551663568743284.
[I 2025-11-03 15:25:42,553] Trial 69 finished with value: 0.09743211203369793 and parameters: {'model_type': 'graphsage', 'hidden_dims': '[512, 64]', 'dropout': 0.2647887829696034, 'batch_norm': True, 'lr': 0.00027183010936669634, 'weight_decay': 4.133502549498298e-06, 'epochs': 277, 'loss': 'mse', 'optimizer': 'adam', 'graph_mode': 'knn', 'source': 'grm', 'knn_k': 8, 'weighted_edges': False, 'symmetrize_mode': 'union', 'use_snp_selection': False}. Best is trial 41 with value: 0.11551663568743284.
[I 2025-11-03 15:25:45,026] Trial 70 finished with value: 0.10629756432056554 and parameters: {'model_type': 'graphsage', 'hidden_dims': '[256, 128]', 'dropout': 0.1983831486919946, 'batch_norm': True, 'lr': 0.0007753254655553196, 'weight_decay': 3.209191433103482e-05, 'epochs': 256, 'loss': 'mae', 'optimizer': 'adam', 'graph_mode': 'knn', 'source': 'grm', 'knn_k': 6, 'weighted_edges': True, 'symmetrize_mode': 'mutual', 'use_snp_selection': False}. Best is trial 41 with value: 0.11551663568743284.
[I 2025-11-03 15:25:48,919] Trial 71 finished with value: 0.1094001006877297 and parameters: {'model_type': 'graphsage', 'hidden_dims': '[512, 64]', 'dropout': 0.3023058795095144, 'batch_norm': True, 'lr': 0.0003752053605420485, 'weight_decay': 0.00012834214409576683, 'epochs': 273, 'loss': 'mae', 'optimizer': 'adam', 'graph_mode': 'knn', 'source': 'grm', 'knn_k': 7, 'weighted_edges': False, 'symmetrize_mode': 'mutual', 'use_snp_selection': False}. Best is trial 41 with value: 0.11551663568743284.
[I 2025-11-03 15:25:52,783] Trial 72 finished with value: 0.10055593248858985 and parameters: {'model_type': 'graphsage', 'hidden_dims': '[512, 64]', 'dropout': 0.2836527605499099, 'batch_norm': True, 'lr': 0.00032698973367623437, 'weight_decay': 0.0001255732548629393, 'epochs': 269, 'loss': 'mae', 'optimizer': 'adam', 'graph_mode': 'knn', 'source': 'grm', 'knn_k': 7, 'weighted_edges': False, 'symmetrize_mode': 'mutual', 'use_snp_selection': False}. Best is trial 41 with value: 0.11551663568743284.
[I 2025-11-03 15:25:56,517] Trial 73 finished with value: 0.0874187698940533 and parameters: {'model_type': 'graphsage', 'hidden_dims': '[512, 64]', 'dropout': 0.2165962554870543, 'batch_norm': True, 'lr': 0.00046690922821884427, 'weight_decay': 0.0002538739161270064, 'epochs': 250, 'loss': 'mae', 'optimizer': 'adam', 'graph_mode': 'knn', 'source': 'grm', 'knn_k': 7, 'weighted_edges': False, 'symmetrize_mode': 'mutual', 'use_snp_selection': False}. Best is trial 41 with value: 0.11551663568743284.
[I 2025-11-03 15:26:00,546] Trial 74 finished with value: 0.096743227203407 and parameters: {'model_type': 'graphsage', 'hidden_dims': '[512, 64]', 'dropout': 0.3080706622508687, 'batch_norm': True, 'lr': 0.00022207641302123885, 'weight_decay': 7.639667747534464e-05, 'epochs': 290, 'loss': 'mae', 'optimizer': 'adam', 'graph_mode': 'knn', 'source': 'grm', 'knn_k': 8, 'weighted_edges': False, 'symmetrize_mode': 'mutual', 'use_snp_selection': False}. Best is trial 41 with value: 0.11551663568743284.
[I 2025-11-03 15:26:04,108] Trial 75 finished with value: 0.09614052460810231 and parameters: {'model_type': 'graphsage', 'hidden_dims': '[512, 256]', 'dropout': 0.3631215537729452, 'batch_norm': True, 'lr': 0.00014464887597100845, 'weight_decay': 5.0005274964361724e-05, 'epochs': 225, 'loss': 'mae', 'optimizer': 'adam', 'graph_mode': 'knn', 'source': 'grm', 'knn_k': 6, 'weighted_edges': False, 'symmetrize_mode': 'mutual', 'use_snp_selection': False}. Best is trial 41 with value: 0.11551663568743284.
[I 2025-11-03 15:26:07,815] Trial 76 finished with value: 0.11415573112573774 and parameters: {'model_type': 'graphsage', 'hidden_dims': '[512, 64]', 'dropout': 0.2522472786526022, 'batch_norm': True, 'lr': 0.0006351148594877163, 'weight_decay': 6.479057517409029e-06, 'epochs': 240, 'loss': 'mae', 'optimizer': 'adam', 'graph_mode': 'knn', 'source': 'grm', 'knn_k': 7, 'weighted_edges': False, 'symmetrize_mode': 'mutual', 'use_snp_selection': False}. Best is trial 41 with value: 0.11551663568743284.
[I 2025-11-03 15:26:09,880] Trial 77 finished with value: 0.09354963591487582 and parameters: {'model_type': 'graphsage', 'hidden_dims': '[128, 64]', 'dropout': 0.25171398528358996, 'batch_norm': True, 'lr': 0.0009229770155146675, 'weight_decay': 2.473893695969758e-06, 'epochs': 238, 'loss': 'mae', 'optimizer': 'adam', 'graph_mode': 'knn', 'source': 'grm', 'knn_k': 5, 'weighted_edges': True, 'symmetrize_mode': 'mutual', 'use_snp_selection': False}. Best is trial 41 with value: 0.11551663568743284.
[I 2025-11-03 15:26:14,091] Trial 78 finished with value: 0.01882279731765806 and parameters: {'model_type': 'graphsage', 'hidden_dims': '[512, 64]', 'dropout': 0.32108747513162433, 'batch_norm': False, 'lr': 0.0006342885286626779, 'weight_decay': 1.3631701246640808e-06, 'epochs': 211, 'loss': 'mae', 'optimizer': 'adam', 'graph_mode': 'knn', 'source': 'grm', 'knn_k': 7, 'weighted_edges': False, 'symmetrize_mode': 'mutual', 'use_snp_selection': True, 'num_snps': 49628}. Best is trial 41 with value: 0.11551663568743284.
[I 2025-11-03 15:26:17,911] Trial 79 finished with value: 0.11093184926397633 and parameters: {'model_type': 'graphsage', 'hidden_dims': '[512, 64]', 'dropout': 0.2990957050749797, 'batch_norm': True, 'lr': 0.0005846579350117191, 'weight_decay': 6.154071324699764e-06, 'epochs': 262, 'loss': 'mse', 'optimizer': 'adam', 'graph_mode': 'knn', 'source': 'grm', 'knn_k': 6, 'weighted_edges': False, 'symmetrize_mode': 'mutual', 'use_snp_selection': False}. Best is trial 41 with value: 0.11551663568743284.
[I 2025-11-03 15:26:20,574] Trial 80 finished with value: 0.09398192189087586 and parameters: {'model_type': 'graphsage', 'hidden_dims': '[256, 128, 64]', 'dropout': 0.2815287719351165, 'batch_norm': True, 'lr': 0.0005546401962445738, 'weight_decay': 4.830203249648339e-06, 'epochs': 261, 'loss': 'mse', 'optimizer': 'adam', 'graph_mode': 'cutoff', 'cutoff': 0.5743609294765462, 'grm_norm': 'gcn', 'self_loops': False, 'use_snp_selection': False}. Best is trial 41 with value: 0.11551663568743284.
[I 2025-11-03 15:26:24,286] Trial 81 finished with value: 0.10431530202054057 and parameters: {'model_type': 'graphsage', 'hidden_dims': '[512, 64]', 'dropout': 0.3436290919819017, 'batch_norm': True, 'lr': 0.00037375890352099746, 'weight_decay': 6.285716520112663e-06, 'epochs': 242, 'loss': 'mse', 'optimizer': 'adam', 'graph_mode': 'knn', 'source': 'grm', 'knn_k': 6, 'weighted_edges': False, 'symmetrize_mode': 'mutual', 'use_snp_selection': False}. Best is trial 41 with value: 0.11551663568743284.
[I 2025-11-03 15:26:28,186] Trial 82 finished with value: 0.10494610362634912 and parameters: {'model_type': 'graphsage', 'hidden_dims': '[512, 64]', 'dropout': 0.29921595382495275, 'batch_norm': True, 'lr': 0.0008098543066068141, 'weight_decay': 7.681609223265041e-06, 'epochs': 277, 'loss': 'mse', 'optimizer': 'adam', 'graph_mode': 'knn', 'source': 'grm', 'knn_k': 6, 'weighted_edges': False, 'symmetrize_mode': 'mutual', 'use_snp_selection': False}. Best is trial 41 with value: 0.11551663568743284.
[I 2025-11-03 15:26:31,762] Trial 83 finished with value: 0.09484773506692787 and parameters: {'model_type': 'graphsage', 'hidden_dims': '[512, 64]', 'dropout': 0.3254089894227636, 'batch_norm': True, 'lr': 0.0004405415432585844, 'weight_decay': 3.3596098133197997e-06, 'epochs': 227, 'loss': 'mse', 'optimizer': 'adam', 'graph_mode': 'knn', 'source': 'grm', 'knn_k': 7, 'weighted_edges': False, 'symmetrize_mode': 'mutual', 'use_snp_selection': False}. Best is trial 41 with value: 0.11551663568743284.
[I 2025-11-03 15:26:35,553] Trial 84 finished with value: 0.10610808034593723 and parameters: {'model_type': 'graphsage', 'hidden_dims': '[512, 64]', 'dropout': 0.2655803100220529, 'batch_norm': True, 'lr': 0.0006379759045618553, 'weight_decay': 0.00016930178100627, 'epochs': 263, 'loss': 'mse', 'optimizer': 'adam', 'graph_mode': 'knn', 'source': 'grm', 'knn_k': 5, 'weighted_edges': False, 'symmetrize_mode': 'mutual', 'use_snp_selection': False}. Best is trial 41 with value: 0.11551663568743284.
[I 2025-11-03 15:26:39,648] Trial 85 finished with value: 0.0941739973059679 and parameters: {'model_type': 'graphsage', 'hidden_dims': '[512, 64]', 'dropout': 0.29516852269897326, 'batch_norm': True, 'lr': 0.00030316364223392567, 'weight_decay': 1.0574361857445591e-05, 'epochs': 298, 'loss': 'mae', 'optimizer': 'adam', 'graph_mode': 'knn', 'source': 'grm', 'knn_k': 7, 'weighted_edges': True, 'symmetrize_mode': 'mutual', 'use_snp_selection': False}. Best is trial 41 with value: 0.11551663568743284.
[I 2025-11-03 15:26:43,380] Trial 86 finished with value: 0.0966516817699486 and parameters: {'model_type': 'graphsage', 'hidden_dims': '[512, 128]', 'dropout': 0.37738639710851085, 'batch_norm': True, 'lr': 5.466095873305285e-05, 'weight_decay': 1.2489668008935741e-05, 'epochs': 251, 'loss': 'mse', 'optimizer': 'adam', 'graph_mode': 'knn', 'source': 'grm', 'knn_k': 6, 'weighted_edges': False, 'symmetrize_mode': 'mutual', 'use_snp_selection': False}. Best is trial 41 with value: 0.11551663568743284.
[I 2025-11-03 15:26:45,749] Trial 87 finished with value: 0.05533582693180769 and parameters: {'model_type': 'graphsage', 'hidden_dims': '[128, 64]', 'dropout': 0.25026844283278643, 'batch_norm': True, 'lr': 2.3328310211159217e-05, 'weight_decay': 1.773448260068467e-05, 'epochs': 313, 'loss': 'mae', 'optimizer': 'adam', 'graph_mode': 'knn', 'source': 'grm', 'knn_k': 8, 'weighted_edges': False, 'symmetrize_mode': 'union', 'use_snp_selection': False}. Best is trial 41 with value: 0.11551663568743284.
[I 2025-11-03 15:26:49,595] Trial 88 finished with value: 0.10033247266001774 and parameters: {'model_type': 'graphsage', 'hidden_dims': '[512, 64]', 'dropout': 0.3135116210942526, 'batch_norm': True, 'lr': 0.0005144347000539222, 'weight_decay': 6.1445413418542185e-06, 'epochs': 269, 'loss': 'mse', 'optimizer': 'adam', 'graph_mode': 'knn', 'source': 'grm', 'knn_k': 5, 'weighted_edges': False, 'symmetrize_mode': 'mutual', 'use_snp_selection': False}. Best is trial 41 with value: 0.11551663568743284.
[I 2025-11-03 15:26:51,069] Trial 89 finished with value: 0.030646031751131356 and parameters: {'model_type': 'graphsage', 'hidden_dims': '[512, 64]', 'dropout': 0.34888981469396424, 'batch_norm': False, 'lr': 0.0002402946585437594, 'weight_decay': 2.639781939077699e-06, 'epochs': 140, 'loss': 'mse', 'optimizer': 'adam', 'graph_mode': 'knn', 'source': 'grm', 'knn_k': 6, 'weighted_edges': False, 'symmetrize_mode': 'mutual', 'use_snp_selection': True, 'num_snps': 3785}. Best is trial 41 with value: 0.11551663568743284.
[I 2025-11-03 15:26:53,128] Trial 90 finished with value: 0.10497349460372403 and parameters: {'model_type': 'graphsage', 'hidden_dims': '[128, 64]', 'dropout': 0.27800178715448964, 'batch_norm': True, 'lr': 0.0009860735125554454, 'weight_decay': 0.0002807295250866551, 'epochs': 234, 'loss': 'mae', 'optimizer': 'adam', 'graph_mode': 'knn', 'source': 'grm', 'knn_k': 7, 'weighted_edges': True, 'symmetrize_mode': 'mutual', 'use_snp_selection': False}. Best is trial 41 with value: 0.11551663568743284.
[I 2025-11-03 15:26:57,112] Trial 91 finished with value: 0.0886846544242692 and parameters: {'model_type': 'graphsage', 'hidden_dims': '[512, 64]', 'dropout': 0.23194670704847498, 'batch_norm': True, 'lr': 0.00043667462674274544, 'weight_decay': 0.00010780388119808706, 'epochs': 286, 'loss': 'mae', 'optimizer': 'adam', 'graph_mode': 'knn', 'source': 'grm', 'knn_k': 7, 'weighted_edges': False, 'symmetrize_mode': 'mutual', 'use_snp_selection': False}. Best is trial 41 with value: 0.11551663568743284.
[I 2025-11-03 15:27:01,046] Trial 92 finished with value: 0.08070667520333798 and parameters: {'model_type': 'graphsage', 'hidden_dims': '[512, 64]', 'dropout': 0.18610885328667165, 'batch_norm': True, 'lr': 2.8969353939223013e-05, 'weight_decay': 3.7804517543477535e-05, 'epochs': 279, 'loss': 'mae', 'optimizer': 'adam', 'graph_mode': 'knn', 'source': 'grm', 'knn_k': 7, 'weighted_edges': False, 'symmetrize_mode': 'mutual', 'use_snp_selection': False}. Best is trial 41 with value: 0.11551663568743284.
[I 2025-11-03 15:27:05,098] Trial 93 finished with value: 0.10271257029881116 and parameters: {'model_type': 'graphsage', 'hidden_dims': '[512, 64]', 'dropout': 0.2382078691992314, 'batch_norm': True, 'lr': 0.0006895880894703197, 'weight_decay': 6.15871848806559e-05, 'epochs': 293, 'loss': 'mae', 'optimizer': 'adam', 'graph_mode': 'knn', 'source': 'grm', 'knn_k': 6, 'weighted_edges': False, 'symmetrize_mode': 'mutual', 'use_snp_selection': False}. Best is trial 41 with value: 0.11551663568743284.
[I 2025-11-03 15:27:08,912] Trial 94 finished with value: 0.10561599078442499 and parameters: {'model_type': 'graphsage', 'hidden_dims': '[512, 64]', 'dropout': 0.20666644966029, 'batch_norm': True, 'lr': 0.00032283626045384383, 'weight_decay': 2.9067620987115613e-05, 'epochs': 259, 'loss': 'mae', 'optimizer': 'adam', 'graph_mode': 'knn', 'source': 'grm', 'knn_k': 8, 'weighted_edges': False, 'symmetrize_mode': 'mutual', 'use_snp_selection': False}. Best is trial 41 with value: 0.11551663568743284.
[I 2025-11-03 15:27:11,357] Trial 95 finished with value: 0.09304571957900397 and parameters: {'model_type': 'graphsage', 'hidden_dims': '[256, 128]', 'dropout': 0.30560117447964774, 'batch_norm': True, 'lr': 0.00017595612304784888, 'weight_decay': 9.144666488649656e-05, 'epochs': 245, 'loss': 'mae', 'optimizer': 'adam', 'graph_mode': 'knn', 'source': 'grm', 'knn_k': 7, 'weighted_edges': False, 'symmetrize_mode': 'mutual', 'use_snp_selection': False}. Best is trial 41 with value: 0.11551663568743284.
[I 2025-11-03 15:27:15,436] Trial 96 finished with value: 0.11401825226531982 and parameters: {'model_type': 'graphsage', 'hidden_dims': '[512, 64]', 'dropout': 0.22130267230378967, 'batch_norm': True, 'lr': 0.00038318421912200245, 'weight_decay': 8.849338785645861e-06, 'epochs': 303, 'loss': 'mse', 'optimizer': 'adam', 'graph_mode': 'knn', 'source': 'grm', 'knn_k': 6, 'weighted_edges': False, 'symmetrize_mode': 'mutual', 'use_snp_selection': False}. Best is trial 41 with value: 0.11551663568743284.
