[I 2025-11-03 12:00:10,216] Trial 19 finished with value: 0.11054886902225262 and parameters: {'model_type': 'gcn', 'hidden_dims': '[512, 128]', 'dropout': 0.31341549294012583, 'batch_norm': True, 'lr': 2.2599578696439803e-05, 'weight_decay': 7.205967523593867e-07, 'epochs': 154, 'loss': 'mse', 'optimizer': 'adam', 'graph_mode': 'off', 'use_snp_selection': False}. Best is trial 11 with value: 0.16785372169072177.
[I 2025-11-03 12:00:12,233] Trial 20 finished with value: 0.13997450210195195 and parameters: {'model_type': 'gcn', 'hidden_dims': '[512, 128]', 'dropout': 0.2333704671534715, 'batch_norm': True, 'lr': 0.00036610172740531927, 'weight_decay': 2.026749435220459e-07, 'epochs': 106, 'loss': 'mse', 'optimizer': 'adam', 'graph_mode': 'off', 'use_snp_selection': False}. Best is trial 11 with value: 0.16785372169072177.
[I 2025-11-03 12:00:15,841] Trial 21 finished with value: 0.12531400978625498 and parameters: {'model_type': 'gcn', 'hidden_dims': '[512, 128]', 'dropout': 0.20332493107682909, 'batch_norm': True, 'lr': 0.00013735478761934137, 'weight_decay': 1.0387569766350336e-07, 'epochs': 248, 'loss': 'mse', 'optimizer': 'adam', 'graph_mode': 'off', 'use_snp_selection': False}. Best is trial 11 with value: 0.16785372169072177.
[I 2025-11-03 12:00:19,206] Trial 22 finished with value: 0.153706640197255 and parameters: {'model_type': 'gcn', 'hidden_dims': '[512, 128]', 'dropout': 0.14533727051249942, 'batch_norm': True, 'lr': 0.0004795141589160418, 'weight_decay': 1.0790082404688784e-07, 'epochs': 227, 'loss': 'mse', 'optimizer': 'adam', 'graph_mode': 'off', 'use_snp_selection': False}. Best is trial 11 with value: 0.16785372169072177.
[I 2025-11-03 12:00:22,989] Trial 23 finished with value: 0.15633407606790042 and parameters: {'model_type': 'gcn', 'hidden_dims': '[512, 128]', 'dropout': 0.16791153422530064, 'batch_norm': True, 'lr': 0.00011571280691618019, 'weight_decay': 2.301058883636895e-07, 'epochs': 263, 'loss': 'mse', 'optimizer': 'adam', 'graph_mode': 'off', 'use_snp_selection': False}. Best is trial 11 with value: 0.16785372169072177.
[I 2025-11-03 12:00:26,800] Trial 24 finished with value: 0.1518507150076934 and parameters: {'model_type': 'gcn', 'hidden_dims': '[512, 128]', 'dropout': 0.1059475231704499, 'batch_norm': True, 'lr': 0.00012933696064794652, 'weight_decay': 2.665633902595842e-07, 'epochs': 267, 'loss': 'mse', 'optimizer': 'adam', 'graph_mode': 'off', 'use_snp_selection': False}. Best is trial 11 with value: 0.16785372169072177.
[I 2025-11-03 12:00:31,041] Trial 25 finished with value: 0.15770797982395374 and parameters: {'model_type': 'gcn', 'hidden_dims': '[512, 256]', 'dropout': 0.15362097645731598, 'batch_norm': True, 'lr': 0.00032528426098828617, 'weight_decay': 1.007773466594241e-06, 'epochs': 304, 'loss': 'mse', 'optimizer': 'adam', 'graph_mode': 'off', 'use_snp_selection': False}. Best is trial 11 with value: 0.16785372169072177.
[I 2025-11-03 12:00:32,508] Trial 26 finished with value: 0.1030180500081848 and parameters: {'model_type': 'gcn', 'hidden_dims': '[512, 256]', 'dropout': 0.13653183607745473, 'batch_norm': False, 'lr': 0.00030308904929809727, 'weight_decay': 9.948658980562194e-07, 'epochs': 307, 'loss': 'mae', 'optimizer': 'adam', 'graph_mode': 'off', 'use_snp_selection': True, 'num_snps': 3842}. Best is trial 11 with value: 0.16785372169072177.
[I 2025-11-03 12:00:35,375] Trial 27 finished with value: 0.14595360874193977 and parameters: {'model_type': 'gcn', 'hidden_dims': '[512, 256]', 'dropout': 0.34138114702841427, 'batch_norm': True, 'lr': 0.0006967970957490122, 'weight_decay': 2.6839309563155476e-06, 'epochs': 183, 'loss': 'mse', 'optimizer': 'adam', 'graph_mode': 'off', 'use_snp_selection': False}. Best is trial 11 with value: 0.16785372169072177.
[I 2025-11-03 12:00:40,114] Trial 28 finished with value: 0.15829111912399366 and parameters: {'model_type': 'gcn', 'hidden_dims': '[512, 256]', 'dropout': 0.10058916407425991, 'batch_norm': True, 'lr': 0.0003384032682708013, 'weight_decay': 5.39866699984622e-07, 'epochs': 344, 'loss': 'mae', 'optimizer': 'adam', 'graph_mode': 'off', 'use_snp_selection': False}. Best is trial 11 with value: 0.16785372169072177.
[I 2025-11-03 12:00:42,081] Trial 29 finished with value: 0.10140691008258877 and parameters: {'model_type': 'gcn', 'hidden_dims': '[128, 64]', 'dropout': 0.20079893670037424, 'batch_norm': True, 'lr': 9.003822319706083e-05, 'weight_decay': 5.522710335772491e-05, 'epochs': 341, 'loss': 'mae', 'optimizer': 'adam', 'graph_mode': 'off', 'use_snp_selection': True, 'num_snps': 19468}. Best is trial 11 with value: 0.16785372169072177.
[I 2025-11-03 12:00:45,270] Trial 30 finished with value: 0.07718590496689114 and parameters: {'model_type': 'gcn', 'hidden_dims': '[256, 128, 64]', 'dropout': 0.24859328400088787, 'batch_norm': True, 'lr': 1.3300897735609851e-05, 'weight_decay': 4.817113677703904e-07, 'epochs': 329, 'loss': 'mae', 'optimizer': 'adam', 'graph_mode': 'off', 'use_snp_selection': False}. Best is trial 11 with value: 0.16785372169072177.
[I 2025-11-03 12:00:50,066] Trial 31 finished with value: 0.16245398783217296 and parameters: {'model_type': 'gcn', 'hidden_dims': '[512, 256]', 'dropout': 0.10126391937142809, 'batch_norm': True, 'lr': 0.0002902227337079217, 'weight_decay': 9.525246023545692e-07, 'epochs': 350, 'loss': 'mae', 'optimizer': 'adam', 'graph_mode': 'off', 'use_snp_selection': False}. Best is trial 11 with value: 0.16785372169072177.
[I 2025-11-03 12:00:54,654] Trial 32 finished with value: 0.1570639427793031 and parameters: {'model_type': 'gcn', 'hidden_dims': '[512, 256]', 'dropout': 0.12207091586257426, 'batch_norm': True, 'lr': 0.00038875179288705127, 'weight_decay': 5.017172901575118e-06, 'epochs': 335, 'loss': 'mae', 'optimizer': 'adam', 'graph_mode': 'off', 'use_snp_selection': False}. Best is trial 11 with value: 0.16785372169072177.
[I 2025-11-03 12:00:57,687] Trial 33 finished with value: 0.144369998643058 and parameters: {'model_type': 'gcn', 'hidden_dims': '[256, 128]', 'dropout': 0.16830412902965813, 'batch_norm': True, 'lr': 0.0002108842877576103, 'weight_decay': 2.3824934893080808e-07, 'epochs': 349, 'loss': 'mae', 'optimizer': 'adam', 'graph_mode': 'off', 'use_snp_selection': False}. Best is trial 11 with value: 0.16785372169072177.
[I 2025-11-03 12:01:01,885] Trial 34 finished with value: 0.14952981501438878 and parameters: {'model_type': 'gcn', 'hidden_dims': '[512, 256]', 'dropout': 0.1846071971093426, 'batch_norm': True, 'lr': 0.000657243158651399, 'weight_decay': 2.030668338033996e-06, 'epochs': 299, 'loss': 'mae', 'optimizer': 'adam', 'graph_mode': 'off', 'use_snp_selection': False}. Best is trial 11 with value: 0.16785372169072177.
[I 2025-11-03 12:01:05,554] Trial 35 finished with value: 0.09386631766197914 and parameters: {'model_type': 'gcn', 'hidden_dims': '[512, 256]', 'dropout': 0.4544759458916864, 'batch_norm': False, 'lr': 0.0002939817198890117, 'weight_decay': 3.737008123171734e-07, 'epochs': 261, 'loss': 'mae', 'optimizer': 'adam', 'graph_mode': 'off', 'use_snp_selection': False}. Best is trial 11 with value: 0.16785372169072177.
[I 2025-11-03 12:01:08,838] Trial 36 finished with value: 0.08141413096709732 and parameters: {'model_type': 'gcn', 'hidden_dims': '[128, 64]', 'dropout': 0.10223964551782355, 'batch_norm': True, 'lr': 4.444630391797252e-06, 'weight_decay': 6.886876803351276e-05, 'epochs': 333, 'loss': 'mae', 'optimizer': 'adam', 'graph_mode': 'off', 'use_snp_selection': True, 'num_snps': 58661}. Best is trial 11 with value: 0.16785372169072177.
[I 2025-11-03 12:01:11,461] Trial 37 finished with value: 0.1369330441321613 and parameters: {'model_type': 'gcn', 'hidden_dims': '[256, 128]', 'dropout': 0.13159317001680454, 'batch_norm': True, 'lr': 4.350549331735279e-05, 'weight_decay': 7.671616070610523e-06, 'epochs': 294, 'loss': 'mae', 'optimizer': 'adam', 'graph_mode': 'off', 'use_snp_selection': False}. Best is trial 11 with value: 0.16785372169072177.
[I 2025-11-03 12:01:14,051] Trial 38 finished with value: 0.1159232068721821 and parameters: {'model_type': 'gcn', 'hidden_dims': '[512, 64]', 'dropout': 0.17225588303604628, 'batch_norm': False, 'lr': 9.068019986490889e-05, 'weight_decay': 1.8173465152338834e-07, 'epochs': 320, 'loss': 'mae', 'optimizer': 'adam', 'graph_mode': 'off', 'use_snp_selection': True, 'num_snps': 19911}. Best is trial 11 with value: 0.16785372169072177.
[I 2025-11-03 12:01:16,814] Trial 39 finished with value: 0.15479880208339625 and parameters: {'model_type': 'gcn', 'hidden_dims': '[512, 256]', 'dropout': 0.12139046799960652, 'batch_norm': True, 'lr': 0.0009709966205905918, 'weight_decay': 9.101180929703178e-07, 'epochs': 174, 'loss': 'mae', 'optimizer': 'adam', 'graph_mode': 'off', 'use_snp_selection': False}. Best is trial 11 with value: 0.16785372169072177.
[I 2025-11-03 12:01:21,586] Trial 40 finished with value: 0.11104691590976412 and parameters: {'model_type': 'gcn', 'hidden_dims': '[512, 256]', 'dropout': 0.21965766221381255, 'batch_norm': True, 'lr': 3.293260832366778e-05, 'weight_decay': 5.574324355164107e-07, 'epochs': 350, 'loss': 'mae', 'optimizer': 'adam', 'graph_mode': 'off', 'use_snp_selection': False}. Best is trial 11 with value: 0.16785372169072177.
[I 2025-11-03 12:01:25,855] Trial 41 finished with value: 0.08140049477180088 and parameters: {'model_type': 'gcn', 'hidden_dims': '[512, 256]', 'dropout': 0.15492250282417255, 'batch_norm': True, 'lr': 2.320370617557869e-06, 'weight_decay': 1.185366943468555e-06, 'epochs': 307, 'loss': 'mse', 'optimizer': 'adam', 'graph_mode': 'off', 'use_snp_selection': False}. Best is trial 11 with value: 0.16785372169072177.
[I 2025-11-03 12:01:30,352] Trial 42 finished with value: 0.1601722607823044 and parameters: {'model_type': 'gcn', 'hidden_dims': '[512, 256]', 'dropout': 0.1280815098228622, 'batch_norm': True, 'lr': 0.00041643377149204756, 'weight_decay': 1.4230354016319517e-07, 'epochs': 325, 'loss': 'mae', 'optimizer': 'adam', 'graph_mode': 'off', 'use_snp_selection': False}. Best is trial 11 with value: 0.16785372169072177.
[I 2025-11-03 12:01:33,440] Trial 43 finished with value: 0.15053333056995152 and parameters: {'model_type': 'gcn', 'hidden_dims': '[256, 128, 64]', 'dropout': 0.13285597095072954, 'batch_norm': True, 'lr': 0.0004192582910784438, 'weight_decay': 1.5026394490359136e-07, 'epochs': 319, 'loss': 'mae', 'optimizer': 'adam', 'graph_mode': 'off', 'use_snp_selection': False}. Best is trial 11 with value: 0.16785372169072177.
[I 2025-11-03 12:01:38,078] Trial 44 finished with value: 0.1656335824582501 and parameters: {'model_type': 'gcn', 'hidden_dims': '[512, 256]', 'dropout': 0.10158524074282312, 'batch_norm': True, 'lr': 0.0005660288415447848, 'weight_decay': 1.7774900171757539e-07, 'epochs': 325, 'loss': 'mae', 'optimizer': 'adam', 'graph_mode': 'off', 'use_snp_selection': False}. Best is trial 11 with value: 0.16785372169072177.
[I 2025-11-03 12:01:42,095] Trial 45 finished with value: 0.15872847989969616 and parameters: {'model_type': 'gcn', 'hidden_dims': '[512, 64]', 'dropout': 0.1209637568453093, 'batch_norm': True, 'lr': 0.0005461155580830256, 'weight_decay': 3.253718165677534e-07, 'epochs': 272, 'loss': 'mae', 'optimizer': 'adam', 'graph_mode': 'off', 'use_snp_selection': False}. Best is trial 11 with value: 0.16785372169072177.
[I 2025-11-03 12:01:44,191] Trial 46 finished with value: 0.15752508926517197 and parameters: {'model_type': 'gcn', 'hidden_dims': '[256, 128]', 'dropout': 0.14725798179106003, 'batch_norm': True, 'lr': 0.00017374467636944302, 'weight_decay': 1.5960781428087713e-07, 'epochs': 216, 'loss': 'mae', 'optimizer': 'adam', 'graph_mode': 'off', 'use_snp_selection': False}. Best is trial 11 with value: 0.16785372169072177.
[I 2025-11-03 12:01:48,705] Trial 47 finished with value: 0.13473978643388615 and parameters: {'model_type': 'gcn', 'hidden_dims': '[512, 256]', 'dropout': 0.12295102347240233, 'batch_norm': False, 'lr': 0.0007412986014515954, 'weight_decay': 3.184998275725864e-05, 'epochs': 327, 'loss': 'mae', 'optimizer': 'adam', 'graph_mode': 'off', 'use_snp_selection': False}. Best is trial 11 with value: 0.16785372169072177.
[I 2025-11-03 12:01:52,376] Trial 48 finished with value: 0.14325547853319326 and parameters: {'model_type': 'gcn', 'hidden_dims': '[512, 256]', 'dropout': 0.26436679529198076, 'batch_norm': True, 'lr': 0.00024275152782754722, 'weight_decay': 1.423221608496538e-07, 'epochs': 250, 'loss': 'mae', 'optimizer': 'adam', 'graph_mode': 'off', 'use_snp_selection': False}. Best is trial 11 with value: 0.16785372169072177.
[I 2025-11-03 12:01:55,009] Trial 49 finished with value: 0.14403013660076922 and parameters: {'model_type': 'gcn', 'hidden_dims': '[128, 64]', 'dropout': 0.1856228745665752, 'batch_norm': True, 'lr': 0.0005833011161811386, 'weight_decay': 3.7725613560208413e-07, 'epochs': 285, 'loss': 'mae', 'optimizer': 'adam', 'graph_mode': 'off', 'use_snp_selection': True, 'num_snps': 46888}. Best is trial 11 with value: 0.16785372169072177.
[I 2025-11-03 12:01:57,298] Trial 50 finished with value: 0.16186781054345467 and parameters: {'model_type': 'gcn', 'hidden_dims': '[512, 128]', 'dropout': 0.44169377741591825, 'batch_norm': True, 'lr': 0.0004523444494400151, 'weight_decay': 1.4388374737073097e-07, 'epochs': 132, 'loss': 'mae', 'optimizer': 'adam', 'graph_mode': 'off', 'use_snp_selection': False}. Best is trial 11 with value: 0.16785372169072177.
[I 2025-11-03 12:01:59,367] Trial 51 finished with value: 0.02582711717681732 and parameters: {'model_type': 'gcn', 'hidden_dims': '[512, 128]', 'dropout': 0.4531392887744962, 'batch_norm': True, 'lr': 8.26991777858618e-06, 'weight_decay': 1.5008495450496957e-07, 'epochs': 108, 'loss': 'mae', 'optimizer': 'adam', 'graph_mode': 'off', 'use_snp_selection': False}. Best is trial 11 with value: 0.16785372169072177.
[I 2025-11-03 12:02:00,711] Trial 52 finished with value: 0.14333514481503518 and parameters: {'model_type': 'gcn', 'hidden_dims': '[512, 128]', 'dropout': 0.41536528105579945, 'batch_norm': True, 'lr': 0.0004644249938385411, 'weight_decay': 2.835111395605426e-07, 'epochs': 50, 'loss': 'mae', 'optimizer': 'adam', 'graph_mode': 'off', 'use_snp_selection': False}. Best is trial 11 with value: 0.16785372169072177.
[I 2025-11-03 12:02:02,944] Trial 53 finished with value: 0.1409516980448632 and parameters: {'model_type': 'gcn', 'hidden_dims': '[512, 128]', 'dropout': 0.5045338212536602, 'batch_norm': True, 'lr': 0.0008434754111437233, 'weight_decay': 1.0961989468848264e-07, 'epochs': 127, 'loss': 'mae', 'optimizer': 'adam', 'graph_mode': 'off', 'use_snp_selection': False}. Best is trial 11 with value: 0.16785372169072177.
[I 2025-11-03 12:02:05,536] Trial 54 finished with value: 0.129396319085488 and parameters: {'model_type': 'gcn', 'hidden_dims': '[512, 128]', 'dropout': 0.3687496143113157, 'batch_norm': True, 'lr': 0.00017094057985229846, 'weight_decay': 1.9335633039350023e-07, 'epochs': 159, 'loss': 'mae', 'optimizer': 'adam', 'graph_mode': 'off', 'use_snp_selection': False}. Best is trial 11 with value: 0.16785372169072177.
[I 2025-11-03 12:02:08,545] Trial 55 finished with value: 0.1641589790018215 and parameters: {'model_type': 'gcn', 'hidden_dims': '[512, 128]', 'dropout': 0.4994272836177029, 'batch_norm': True, 'lr': 0.0002658623826980406, 'weight_decay': 6.906378681458306e-07, 'epochs': 193, 'loss': 'mae', 'optimizer': 'adam', 'graph_mode': 'off', 'use_snp_selection': False}. Best is trial 11 with value: 0.16785372169072177.
[I 2025-11-03 12:02:10,215] Trial 56 finished with value: 0.10335176294391984 and parameters: {'model_type': 'gcn', 'hidden_dims': '[256, 128, 64]', 'dropout': 0.5181544828762092, 'batch_norm': True, 'lr': 0.000255580339970136, 'weight_decay': 1.774947320057733e-06, 'epochs': 136, 'loss': 'mae', 'optimizer': 'adam', 'graph_mode': 'off', 'use_snp_selection': False}. Best is trial 11 with value: 0.16785372169072177.
[I 2025-11-03 12:02:13,152] Trial 57 finished with value: 0.1347751435939793 and parameters: {'model_type': 'gcn', 'hidden_dims': '[512, 128]', 'dropout': 0.47914584243201863, 'batch_norm': True, 'lr': 0.0004380969951739107, 'weight_decay': 8.030295994137693e-07, 'epochs': 190, 'loss': 'mae', 'optimizer': 'adam', 'graph_mode': 'off', 'use_snp_selection': False}. Best is trial 11 with value: 0.16785372169072177.
[I 2025-11-03 12:02:15,794] Trial 58 finished with value: 0.06333501208089096 and parameters: {'model_type': 'gcn', 'hidden_dims': '[512, 64]', 'dropout': 0.5542483448713429, 'batch_norm': False, 'lr': 0.00015815849377230314, 'weight_decay': 6.423845891523318e-07, 'epochs': 165, 'loss': 'mae', 'optimizer': 'adam', 'graph_mode': 'off', 'use_snp_selection': False}. Best is trial 11 with value: 0.16785372169072177.
[I 2025-11-03 12:02:17,593] Trial 59 finished with value: 0.11695667804378479 and parameters: {'model_type': 'gcn', 'hidden_dims': '[512, 128]', 'dropout': 0.5570528599243515, 'batch_norm': True, 'lr': 0.0002294418888577695, 'weight_decay': 0.00014144043448895884, 'epochs': 88, 'loss': 'mse', 'optimizer': 'adam', 'graph_mode': 'off', 'use_snp_selection': False}. Best is trial 11 with value: 0.16785372169072177.
[I 2025-11-03 12:02:20,713] Trial 60 finished with value: 0.160848076415774 and parameters: {'model_type': 'gcn', 'hidden_dims': '[512, 256]', 'dropout': 0.5305862307657205, 'batch_norm': True, 'lr': 0.00011381429673280913, 'weight_decay': 1.5748794346844987e-05, 'epochs': 204, 'loss': 'mae', 'optimizer': 'adam', 'graph_mode': 'off', 'use_snp_selection': False}. Best is trial 11 with value: 0.16785372169072177.
[I 2025-11-03 12:02:23,838] Trial 61 finished with value: 0.11437782107530887 and parameters: {'model_type': 'gcn', 'hidden_dims': '[512, 256]', 'dropout': 0.5879947719710729, 'batch_norm': True, 'lr': 0.00010770458458871469, 'weight_decay': 1.1892232567022598e-05, 'epochs': 204, 'loss': 'mae', 'optimizer': 'adam', 'graph_mode': 'off', 'use_snp_selection': False}. Best is trial 11 with value: 0.16785372169072177.
[I 2025-11-03 12:02:27,289] Trial 62 finished with value: 0.1548447989542992 and parameters: {'model_type': 'gcn', 'hidden_dims': '[512, 256]', 'dropout': 0.5173580540055182, 'batch_norm': True, 'lr': 0.0002921546904399617, 'weight_decay': 2.426488777942492e-05, 'epochs': 233, 'loss': 'mae', 'optimizer': 'adam', 'graph_mode': 'off', 'use_snp_selection': False}. Best is trial 11 with value: 0.16785372169072177.
[I 2025-11-03 12:02:30,586] Trial 63 finished with value: 0.12277548129179133 and parameters: {'model_type': 'gcn', 'hidden_dims': '[512, 256]', 'dropout': 0.47916338429338806, 'batch_norm': True, 'lr': 6.724448131314172e-05, 'weight_decay': 1.2713127105416494e-05, 'epochs': 221, 'loss': 'mae', 'optimizer': 'adam', 'graph_mode': 'off', 'use_snp_selection': False}. Best is trial 11 with value: 0.16785372169072177.
[I 2025-11-03 12:02:32,229] Trial 64 finished with value: 0.12350554786157714 and parameters: {'model_type': 'gcn', 'hidden_dims': '[512, 256]', 'dropout': 0.5345223585966367, 'batch_norm': True, 'lr': 0.00035454683704769804, 'weight_decay': 8.805196380681939e-06, 'epochs': 75, 'loss': 'mae', 'optimizer': 'adam', 'graph_mode': 'off', 'use_snp_selection': False}. Best is trial 11 with value: 0.16785372169072177.
[I 2025-11-03 12:02:35,207] Trial 65 finished with value: 0.14883694494065633 and parameters: {'model_type': 'gcn', 'hidden_dims': '[512, 128]', 'dropout': 0.4248987030672511, 'batch_norm': True, 'lr': 0.0005324181012238716, 'weight_decay': 1.0063384591544472e-07, 'epochs': 192, 'loss': 'mse', 'optimizer': 'adam', 'graph_mode': 'off', 'use_snp_selection': False}. Best is trial 11 with value: 0.16785372169072177.
[I 2025-11-03 12:02:37,375] Trial 66 finished with value: 0.14348424119815617 and parameters: {'model_type': 'gcn', 'hidden_dims': '[512, 256]', 'dropout': 0.3956170403084721, 'batch_norm': True, 'lr': 0.0001850544367046827, 'weight_decay': 0.0008281283468112786, 'epochs': 122, 'loss': 'mae', 'optimizer': 'adam', 'graph_mode': 'off', 'use_snp_selection': False}. Best is trial 11 with value: 0.16785372169072177.
[I 2025-11-03 12:02:38,938] Trial 67 finished with value: 0.11990879790743961 and parameters: {'model_type': 'gcn', 'hidden_dims': '[512, 128]', 'dropout': 0.48867266084809935, 'batch_norm': True, 'lr': 0.0002624650665611114, 'weight_decay': 3.904489584236257e-06, 'epochs': 65, 'loss': 'mae', 'optimizer': 'adam', 'graph_mode': 'off', 'use_snp_selection': True, 'num_snps': 22951}. Best is trial 11 with value: 0.16785372169072177.
[I 2025-11-03 12:02:41,364] Trial 68 finished with value: 0.1489158089542268 and parameters: {'model_type': 'gcn', 'hidden_dims': '[512, 256]', 'dropout': 0.3326798987697642, 'batch_norm': True, 'lr': 0.00013861978934608853, 'weight_decay': 4.5616743067161246e-07, 'epochs': 148, 'loss': 'mse', 'optimizer': 'adam', 'graph_mode': 'off', 'use_snp_selection': False}. Best is trial 11 with value: 0.16785372169072177.
[I 2025-11-03 12:02:44,172] Trial 69 finished with value: 0.14094018046094442 and parameters: {'model_type': 'gcn', 'hidden_dims': '[256, 128]', 'dropout': 0.5888672007979299, 'batch_norm': True, 'lr': 0.0006211060947739044, 'weight_decay': 2.7484958199673937e-07, 'epochs': 321, 'loss': 'mae', 'optimizer': 'adam', 'graph_mode': 'off', 'use_snp_selection': False}. Best is trial 11 with value: 0.16785372169072177.
[I 2025-11-03 12:02:45,648] Trial 70 finished with value: 0.0 and parameters: {'model_type': 'gcn', 'hidden_dims': '[128, 64]', 'dropout': 0.4473880348329219, 'batch_norm': False, 'lr': 0.0003822585889589598, 'weight_decay': 2.0871775104031776e-07, 'epochs': 213, 'loss': 'mae', 'optimizer': 'adam', 'graph_mode': 'off', 'use_snp_selection': False}. Best is trial 11 with value: 0.16785372169072177.
