[I 2025-11-03 13:35:44,036] Trial 40 finished with value: 0.012531266888546774 and parameters: {'model_type': 'graphsage', 'hidden_dims': '[256, 128, 64]', 'dropout': 0.5981081922624538, 'batch_norm': False, 'lr': 3.643971391819692e-05, 'weight_decay': 3.050664010024889e-05, 'epochs': 106, 'loss': 'mse', 'optimizer': 'adam', 'graph_mode': 'knn', 'source': 'grm', 'knn_k': 7, 'weighted_edges': False, 'symmetrize_mode': 'union', 'use_snp_selection': True, 'num_snps': 10626}. Best is trial 19 with value: 0.09185206122090518.
[I 2025-11-03 13:35:46,698] Trial 41 finished with value: 0.010480524193853641 and parameters: {'model_type': 'graphsage', 'hidden_dims': '[512, 64]', 'dropout': 0.354152105400173, 'batch_norm': False, 'lr': 2.2979229445493926e-06, 'weight_decay': 0.00010117704269710804, 'epochs': 284, 'loss': 'mse', 'optimizer': 'adam', 'graph_mode': 'knn', 'source': 'grm', 'knn_k': 3, 'weighted_edges': False, 'symmetrize_mode': 'union', 'use_snp_selection': True, 'num_snps': 14327}. Best is trial 19 with value: 0.09185206122090518.
[I 2025-11-03 13:35:49,005] Trial 42 finished with value: -0.03355269537894434 and parameters: {'model_type': 'graphsage', 'hidden_dims': '[512, 64]', 'dropout': 0.328748735265132, 'batch_norm': False, 'lr': 1.2534584908917986e-06, 'weight_decay': 0.0002039944153016125, 'epochs': 289, 'loss': 'mse', 'optimizer': 'adam', 'graph_mode': 'knn', 'source': 'grm', 'knn_k': 5, 'weighted_edges': False, 'symmetrize_mode': 'union', 'use_snp_selection': True, 'num_snps': 6253}. Best is trial 19 with value: 0.09185206122090518.
[I 2025-11-03 13:35:51,462] Trial 43 finished with value: 0.0283283307577899 and parameters: {'model_type': 'graphsage', 'hidden_dims': '[512, 64]', 'dropout': 0.4374805778669743, 'batch_norm': False, 'lr': 2.379687382292677e-06, 'weight_decay': 0.00010675784422108903, 'epochs': 259, 'loss': 'mse', 'optimizer': 'adam', 'graph_mode': 'knn', 'source': 'grm', 'knn_k': 10, 'weighted_edges': False, 'symmetrize_mode': 'union', 'use_snp_selection': True, 'num_snps': 11539}. Best is trial 19 with value: 0.09185206122090518.
[I 2025-11-03 13:35:53,723] Trial 44 finished with value: 0.02694172595330843 and parameters: {'model_type': 'graphsage', 'hidden_dims': '[512, 64]', 'dropout': 0.3659871071342775, 'batch_norm': True, 'lr': 3.933282340951212e-06, 'weight_decay': 0.0006174413891986542, 'epochs': 235, 'loss': 'mse', 'optimizer': 'adam', 'graph_mode': 'knn', 'source': 'grm', 'knn_k': 6, 'weighted_edges': False, 'symmetrize_mode': 'union', 'use_snp_selection': True, 'num_snps': 6065}. Best is trial 19 with value: 0.09185206122090518.
[I 2025-11-03 13:35:58,781] Trial 45 finished with value: 0.02687427340053328 and parameters: {'model_type': 'graphsage', 'hidden_dims': '[512, 256]', 'dropout': 0.40597356533812606, 'batch_norm': False, 'lr': 9.43616264131011e-06, 'weight_decay': 0.0009784965596460458, 'epochs': 335, 'loss': 'mae', 'optimizer': 'adam', 'graph_mode': 'knn', 'source': 'grm', 'knn_k': 9, 'weighted_edges': False, 'symmetrize_mode': 'union', 'use_snp_selection': False}. Best is trial 19 with value: 0.09185206122090518.
[I 2025-11-03 13:36:01,296] Trial 46 finished with value: 0.029213715157896964 and parameters: {'model_type': 'graphsage', 'hidden_dims': '[512, 128]', 'dropout': 0.3198980588125308, 'batch_norm': False, 'lr': 0.00014833424765689227, 'weight_decay': 8.264674740955973e-05, 'epochs': 303, 'loss': 'mse', 'optimizer': 'adam', 'graph_mode': 'cutoff', 'cutoff': 0.7453242789964398, 'grm_norm': 'none', 'self_loops': False, 'use_snp_selection': True, 'num_snps': 12272}. Best is trial 19 with value: 0.09185206122090518.
[I 2025-11-03 13:36:03,139] Trial 47 finished with value: 0.014749832572674704 and parameters: {'model_type': 'graphsage', 'hidden_dims': '[256, 128]', 'dropout': 0.26718100728711025, 'batch_norm': False, 'lr': 1.7118740861440323e-06, 'weight_decay': 4.753544575479359e-05, 'epochs': 60, 'loss': 'mse', 'optimizer': 'adam', 'graph_mode': 'knn', 'source': 'grm', 'knn_k': 3, 'weighted_edges': True, 'symmetrize_mode': 'mutual', 'use_snp_selection': True, 'num_snps': 17714}. Best is trial 19 with value: 0.09185206122090518.
[I 2025-11-03 13:36:06,723] Trial 48 finished with value: 0.037430045220465544 and parameters: {'model_type': 'graphsage', 'hidden_dims': '[512, 64]', 'dropout': 0.44434797782384716, 'batch_norm': True, 'lr': 6.88446490451195e-06, 'weight_decay': 0.00021100889335043927, 'epochs': 203, 'loss': 'mae', 'optimizer': 'adam', 'graph_mode': 'cutoff', 'cutoff': 0.39476293329481105, 'grm_norm': 'none', 'self_loops': False, 'use_snp_selection': False}. Best is trial 19 with value: 0.09185206122090518.
[I 2025-11-03 13:36:09,995] Trial 49 finished with value: 0.026466566440628864 and parameters: {'model_type': 'graphsage', 'hidden_dims': '[512, 256]', 'dropout': 0.5681420084410747, 'batch_norm': False, 'lr': 9.839290340710995e-06, 'weight_decay': 0.0004556468183867066, 'epochs': 319, 'loss': 'mse', 'optimizer': 'adam', 'graph_mode': 'knn', 'source': 'grm', 'knn_k': 8, 'weighted_edges': False, 'symmetrize_mode': 'union', 'use_snp_selection': True, 'num_snps': 24399}. Best is trial 19 with value: 0.09185206122090518.
[I 2025-11-03 13:36:12,526] Trial 50 finished with value: 0.023385995712728702 and parameters: {'model_type': 'graphsage', 'hidden_dims': '[256, 128, 64]', 'dropout': 0.5148393544900703, 'batch_norm': False, 'lr': 0.0007324970532850412, 'weight_decay': 7.177878362321335e-06, 'epochs': 336, 'loss': 'mse', 'optimizer': 'adam', 'graph_mode': 'cutoff', 'cutoff': 0.5839042200554263, 'grm_norm': 'gcn', 'self_loops': True, 'use_snp_selection': True, 'num_snps': 4892}. Best is trial 19 with value: 0.09185206122090518.
[I 2025-11-03 13:36:15,842] Trial 51 finished with value: 0.028634757880258568 and parameters: {'model_type': 'graphsage', 'hidden_dims': '[512, 256]', 'dropout': 0.3387372059910152, 'batch_norm': True, 'lr': 0.00027990727241112277, 'weight_decay': 1.8021278564217058e-06, 'epochs': 169, 'loss': 'mae', 'optimizer': 'adam', 'graph_mode': 'knn', 'source': 'grm', 'knn_k': 2, 'weighted_edges': True, 'symmetrize_mode': 'mutual', 'use_snp_selection': False}. Best is trial 19 with value: 0.09185206122090518.
[I 2025-11-03 13:36:18,919] Trial 52 finished with value: 0.034239529979590996 and parameters: {'model_type': 'graphsage', 'hidden_dims': '[512, 256]', 'dropout': 0.30997961847901095, 'batch_norm': True, 'lr': 0.00019234143963869668, 'weight_decay': 2.4183707617194605e-05, 'epochs': 141, 'loss': 'mae', 'optimizer': 'adam', 'graph_mode': 'knn', 'source': 'grm', 'knn_k': 2, 'weighted_edges': True, 'symmetrize_mode': 'mutual', 'use_snp_selection': False}. Best is trial 19 with value: 0.09185206122090518.
[I 2025-11-03 13:36:23,155] Trial 53 finished with value: 0.04059745174881624 and parameters: {'model_type': 'graphsage', 'hidden_dims': '[512, 256]', 'dropout': 0.3807625398934833, 'batch_norm': True, 'lr': 0.0004009713304594419, 'weight_decay': 1.4524062835615826e-05, 'epochs': 285, 'loss': 'mae', 'optimizer': 'adam', 'graph_mode': 'knn', 'source': 'grm', 'knn_k': 4, 'weighted_edges': True, 'symmetrize_mode': 'mutual', 'use_snp_selection': False}. Best is trial 19 with value: 0.09185206122090518.
[I 2025-11-03 13:36:26,067] Trial 54 finished with value: 0.013506885760216355 and parameters: {'model_type': 'graphsage', 'hidden_dims': '[256, 128, 64]', 'dropout': 0.3495945688045772, 'batch_norm': True, 'lr': 7.836050832060963e-05, 'weight_decay': 0.00012325235681344342, 'epochs': 270, 'loss': 'mae', 'optimizer': 'adam', 'graph_mode': 'knn', 'source': 'grm', 'knn_k': 7, 'weighted_edges': True, 'symmetrize_mode': 'mutual', 'use_snp_selection': False}. Best is trial 19 with value: 0.09185206122090518.
[I 2025-11-03 13:36:29,931] Trial 55 finished with value: 0.026290240509710076 and parameters: {'model_type': 'graphsage', 'hidden_dims': '[512, 256]', 'dropout': 0.46535593183958185, 'batch_norm': True, 'lr': 0.00040695554897080975, 'weight_decay': 5.3557200031621295e-05, 'epochs': 229, 'loss': 'mae', 'optimizer': 'adam', 'graph_mode': 'knn', 'source': 'grm', 'knn_k': 6, 'weighted_edges': True, 'symmetrize_mode': 'mutual', 'use_snp_selection': False}. Best is trial 19 with value: 0.09185206122090518.
[I 2025-11-03 13:36:33,008] Trial 56 finished with value: -0.015121744762703853 and parameters: {'model_type': 'graphsage', 'hidden_dims': '[256, 128]', 'dropout': 0.21773149830581837, 'batch_norm': False, 'lr': 0.0007254488060163191, 'weight_decay': 2.5920085422917065e-06, 'epochs': 251, 'loss': 'mse', 'optimizer': 'adam', 'graph_mode': 'knn', 'source': 'grm', 'knn_k': 8, 'weighted_edges': True, 'symmetrize_mode': 'mutual', 'use_snp_selection': True, 'num_snps': 33217}. Best is trial 19 with value: 0.09185206122090518.
[I 2025-11-03 13:36:35,712] Trial 57 finished with value: 0.024861528278893916 and parameters: {'model_type': 'graphsage', 'hidden_dims': '[256, 128, 64]', 'dropout': 0.5278994578827122, 'batch_norm': False, 'lr': 5.26339421618507e-05, 'weight_decay': 0.00039791984015239914, 'epochs': 299, 'loss': 'mse', 'optimizer': 'adam', 'graph_mode': 'cutoff', 'cutoff': 0.5144929148670448, 'grm_norm': 'cosine_then_gcn', 'self_loops': False, 'use_snp_selection': True, 'num_snps': 13123}. Best is trial 19 with value: 0.09185206122090518.
[I 2025-11-03 13:36:40,751] Trial 58 finished with value: 0.02266746383111984 and parameters: {'model_type': 'graphsage', 'hidden_dims': '[512, 128]', 'dropout': 0.27129489568654597, 'batch_norm': False, 'lr': 0.0002673840500188996, 'weight_decay': 0.000720056434356243, 'epochs': 324, 'loss': 'mse', 'optimizer': 'adam', 'graph_mode': 'knn', 'source': 'grm', 'knn_k': 4, 'weighted_edges': True, 'symmetrize_mode': 'mutual', 'use_snp_selection': True, 'num_snps': 47666}. Best is trial 19 with value: 0.09185206122090518.
[I 2025-11-03 13:36:45,084] Trial 59 finished with value: 0.04272553572246059 and parameters: {'model_type': 'graphsage', 'hidden_dims': '[512, 64]', 'dropout': 0.36539343354843457, 'batch_norm': True, 'lr': 0.00011308203631327021, 'weight_decay': 0.00023270821517839649, 'epochs': 310, 'loss': 'mae', 'optimizer': 'adam', 'graph_mode': 'knn', 'source': 'grm', 'knn_k': 1, 'weighted_edges': True, 'symmetrize_mode': 'mutual', 'use_snp_selection': False}. Best is trial 19 with value: 0.09185206122090518.
[I 2025-11-03 13:36:47,020] Trial 60 finished with value: -0.000933337544748684 and parameters: {'model_type': 'graphsage', 'hidden_dims': '[256, 128, 64]', 'dropout': 0.42170187545383336, 'batch_norm': False, 'lr': 1.6116055620519407e-05, 'weight_decay': 9.107110203389243e-06, 'epochs': 195, 'loss': 'mse', 'optimizer': 'adam', 'graph_mode': 'cutoff', 'cutoff': 0.652173994765198, 'grm_norm': 'cosine', 'self_loops': False, 'use_snp_selection': True, 'num_snps': 3823}. Best is trial 19 with value: 0.09185206122090518.
[I 2025-11-03 13:36:51,649] Trial 61 finished with value: 0.048275339489179545 and parameters: {'model_type': 'graphsage', 'hidden_dims': '[512, 64]', 'dropout': 0.3738494367072369, 'batch_norm': True, 'lr': 0.00019618136017836245, 'weight_decay': 0.00023153850673522568, 'epochs': 349, 'loss': 'mae', 'optimizer': 'adam', 'graph_mode': 'knn', 'source': 'grm', 'knn_k': 1, 'weighted_edges': True, 'symmetrize_mode': 'mutual', 'use_snp_selection': False}. Best is trial 19 with value: 0.09185206122090518.
[I 2025-11-03 13:36:56,324] Trial 62 finished with value: 0.037686651834509304 and parameters: {'model_type': 'graphsage', 'hidden_dims': '[512, 64]', 'dropout': 0.4031669777572447, 'batch_norm': True, 'lr': 7.903576450139644e-05, 'weight_decay': 0.00014160200176762904, 'epochs': 350, 'loss': 'mae', 'optimizer': 'adam', 'graph_mode': 'knn', 'source': 'grm', 'knn_k': 2, 'weighted_edges': True, 'symmetrize_mode': 'mutual', 'use_snp_selection': False}. Best is trial 19 with value: 0.09185206122090518.
[I 2025-11-03 13:37:00,897] Trial 63 finished with value: 0.03773811423693849 and parameters: {'model_type': 'graphsage', 'hidden_dims': '[512, 64]', 'dropout': 0.4782820112854072, 'batch_norm': True, 'lr': 0.00021157110807839337, 'weight_decay': 7.929478185573212e-05, 'epochs': 341, 'loss': 'mae', 'optimizer': 'adam', 'graph_mode': 'knn', 'source': 'grm', 'knn_k': 1, 'weighted_edges': True, 'symmetrize_mode': 'mutual', 'use_snp_selection': False}. Best is trial 19 with value: 0.09185206122090518.
[I 2025-11-03 13:37:05,419] Trial 64 finished with value: 0.029235337409284474 and parameters: {'model_type': 'graphsage', 'hidden_dims': '[512, 64]', 'dropout': 0.2944804843819078, 'batch_norm': True, 'lr': 0.00013254470955536982, 'weight_decay': 0.00028291213021791384, 'epochs': 329, 'loss': 'mae', 'optimizer': 'adam', 'graph_mode': 'knn', 'source': 'grm', 'knn_k': 2, 'weighted_edges': True, 'symmetrize_mode': 'mutual', 'use_snp_selection': False}. Best is trial 19 with value: 0.09185206122090518.
[I 2025-11-03 13:37:07,919] Trial 65 finished with value: 0.048844441865360376 and parameters: {'model_type': 'graphsage', 'hidden_dims': '[128, 64]', 'dropout': 0.3494163793131048, 'batch_norm': True, 'lr': 0.000338811345728363, 'weight_decay': 0.00017195928599183992, 'epochs': 342, 'loss': 'mae', 'optimizer': 'adam', 'graph_mode': 'knn', 'source': 'grm', 'knn_k': 1, 'weighted_edges': True, 'symmetrize_mode': 'mutual', 'use_snp_selection': False}. Best is trial 19 with value: 0.09185206122090518.
[I 2025-11-03 13:37:10,521] Trial 66 finished with value: 0.03840562918288352 and parameters: {'model_type': 'graphsage', 'hidden_dims': '[128, 64]', 'dropout': 0.378754237462535, 'batch_norm': True, 'lr': 0.00035078005048307657, 'weight_decay': 0.00019363927859333133, 'epochs': 339, 'loss': 'mae', 'optimizer': 'adam', 'graph_mode': 'knn', 'source': 'grm', 'knn_k': 10, 'weighted_edges': False, 'symmetrize_mode': 'union', 'use_snp_selection': False}. Best is trial 19 with value: 0.09185206122090518.
[I 2025-11-03 13:37:13,044] Trial 67 finished with value: 0.023684564735350907 and parameters: {'model_type': 'graphsage', 'hidden_dims': '[128, 64]', 'dropout': 0.4494817846512024, 'batch_norm': False, 'lr': 0.00018395817060630322, 'weight_decay': 0.000344983872502759, 'epochs': 317, 'loss': 'mse', 'optimizer': 'adam', 'graph_mode': 'knn', 'source': 'grm', 'knn_k': 9, 'weighted_edges': True, 'symmetrize_mode': 'mutual', 'use_snp_selection': True, 'num_snps': 16158}. Best is trial 19 with value: 0.09185206122090518.
[I 2025-11-03 13:37:17,012] Trial 68 finished with value: 0.005702331465318051 and parameters: {'model_type': 'graphsage', 'hidden_dims': '[128, 64]', 'dropout': 0.30731527718194973, 'batch_norm': False, 'lr': 0.0007569747641450516, 'weight_decay': 0.00044580762634004384, 'epochs': 346, 'loss': 'mse', 'optimizer': 'adam', 'graph_mode': 'cutoff', 'cutoff': 0.782530413207654, 'grm_norm': 'gcn', 'self_loops': False, 'use_snp_selection': True, 'num_snps': 57227}. Best is trial 19 with value: 0.09185206122090518.
[I 2025-11-03 13:37:19,377] Trial 69 finished with value: -0.003492484774925139 and parameters: {'model_type': 'graphsage', 'hidden_dims': '[128, 64]', 'dropout': 0.35227433450424434, 'batch_norm': False, 'lr': 4.921382863896206e-06, 'weight_decay': 0.00016606378438722692, 'epochs': 331, 'loss': 'mse', 'optimizer': 'adam', 'graph_mode': 'knn', 'source': 'grm', 'knn_k': 1, 'weighted_edges': True, 'symmetrize_mode': 'mutual', 'use_snp_selection': True, 'num_snps': 10021}. Best is trial 19 with value: 0.09185206122090518.
[I 2025-11-03 13:37:22,394] Trial 70 finished with value: 0.029367299150668585 and parameters: {'model_type': 'graphsage', 'hidden_dims': '[256, 128, 64]', 'dropout': 0.5068113750700862, 'batch_norm': True, 'lr': 0.00045728030180272307, 'weight_decay': 0.0007091570677324154, 'epochs': 307, 'loss': 'mae', 'optimizer': 'adam', 'graph_mode': 'cutoff', 'cutoff': 0.696872628270542, 'grm_norm': 'none', 'self_loops': True, 'use_snp_selection': False}. Best is trial 19 with value: 0.09185206122090518.
[I 2025-11-03 13:37:25,252] Trial 71 finished with value: 0.03639185942105751 and parameters: {'model_type': 'graphsage', 'hidden_dims': '[256, 128]', 'dropout': 0.3239293650539875, 'batch_norm': True, 'lr': 0.00024416563028508467, 'weight_decay': 9.989546128595302e-05, 'epochs': 350, 'loss': 'mae', 'optimizer': 'adam', 'graph_mode': 'knn', 'source': 'grm', 'knn_k': 1, 'weighted_edges': True, 'symmetrize_mode': 'mutual', 'use_snp_selection': False}. Best is trial 19 with value: 0.09185206122090518.
[I 2025-11-03 13:37:28,407] Trial 72 finished with value: 0.011855948555713185 and parameters: {'model_type': 'graphsage', 'hidden_dims': '[256, 128, 64]', 'dropout': 0.344086406597033, 'batch_norm': True, 'lr': 1.039584970034208e-06, 'weight_decay': 0.0002911479891162138, 'epochs': 320, 'loss': 'mae', 'optimizer': 'adam', 'graph_mode': 'knn', 'source': 'grm', 'knn_k': 2, 'weighted_edges': True, 'symmetrize_mode': 'mutual', 'use_snp_selection': False}. Best is trial 19 with value: 0.09185206122090518.
[I 2025-11-03 13:37:32,679] Trial 73 finished with value: 0.02083178086312119 and parameters: {'model_type': 'graphsage', 'hidden_dims': '[512, 64]', 'dropout': 0.3956384147713124, 'batch_norm': True, 'lr': 0.0003196803720768107, 'weight_decay': 7.551333504720577e-05, 'epochs': 290, 'loss': 'mae', 'optimizer': 'adam', 'graph_mode': 'knn', 'source': 'grm', 'knn_k': 3, 'weighted_edges': True, 'symmetrize_mode': 'mutual', 'use_snp_selection': False}. Best is trial 19 with value: 0.09185206122090518.
[I 2025-11-03 13:37:35,854] Trial 74 finished with value: 0.022227924669200587 and parameters: {'model_type': 'graphsage', 'hidden_dims': '[256, 128, 64]', 'dropout': 0.36542458666943267, 'batch_norm': True, 'lr': 0.0006106387254495452, 'weight_decay': 0.00014480785366558936, 'epochs': 326, 'loss': 'mae', 'optimizer': 'adam', 'graph_mode': 'knn', 'source': 'grm', 'knn_k': 1, 'weighted_edges': True, 'symmetrize_mode': 'mutual', 'use_snp_selection': False}. Best is trial 19 with value: 0.09185206122090518.
[I 2025-11-03 13:37:38,024] Trial 75 finished with value: 0.006836720334058818 and parameters: {'model_type': 'graphsage', 'hidden_dims': '[128, 64]', 'dropout': 0.5539654871427189, 'batch_norm': False, 'lr': 0.00046014930266007666, 'weight_decay': 0.0002343331867143322, 'epochs': 157, 'loss': 'mse', 'optimizer': 'adam', 'graph_mode': 'knn', 'source': 'grm', 'knn_k': 10, 'weighted_edges': True, 'symmetrize_mode': 'mutual', 'use_snp_selection': True, 'num_snps': 19115}. Best is trial 19 with value: 0.09185206122090518.
[I 2025-11-03 13:37:39,977] Trial 76 finished with value: 0.027714093376512816 and parameters: {'model_type': 'graphsage', 'hidden_dims': '[256, 128]', 'dropout': 0.4148569470361114, 'batch_norm': False, 'lr': 2.7368855666733302e-05, 'weight_decay': 0.0004963742650941033, 'epochs': 278, 'loss': 'mse', 'optimizer': 'adam', 'graph_mode': 'knn', 'source': 'grm', 'knn_k': 2, 'weighted_edges': True, 'symmetrize_mode': 'mutual', 'use_snp_selection': True, 'num_snps': 2165}. Best is trial 19 with value: 0.09185206122090518.
[I 2025-11-03 13:37:42,724] Trial 77 finished with value: 0.03223372484990245 and parameters: {'model_type': 'graphsage', 'hidden_dims': '[512, 256]', 'dropout': 0.4831986851821697, 'batch_norm': True, 'lr': 0.00017290591751659414, 'weight_decay': 4.0575255482308435e-05, 'epochs': 186, 'loss': 'mse', 'optimizer': 'adam', 'graph_mode': 'cutoff', 'cutoff': 0.6137802638342184, 'grm_norm': 'gcn', 'self_loops': False, 'use_snp_selection': True, 'num_snps': 23757}. Best is trial 19 with value: 0.09185206122090518.
[I 2025-11-03 13:37:46,621] Trial 78 finished with value: 0.014178332402348202 and parameters: {'model_type': 'graphsage', 'hidden_dims': '[512, 128]', 'dropout': 0.27513872750353857, 'batch_norm': False, 'lr': 1.9245931043497063e-05, 'weight_decay': 1.0703989686028842e-07, 'epochs': 220, 'loss': 'mae', 'optimizer': 'adam', 'graph_mode': 'knn', 'source': 'grm', 'knn_k': 5, 'weighted_edges': False, 'symmetrize_mode': 'union', 'use_snp_selection': False}. Best is trial 19 with value: 0.09185206122090518.
[I 2025-11-03 13:37:48,607] Trial 79 finished with value: 0.04506268141510224 and parameters: {'model_type': 'graphsage', 'hidden_dims': '[256, 128, 64]', 'dropout': 0.3892851829376272, 'batch_norm': False, 'lr': 9.593447867976907e-05, 'weight_decay': 5.107928152804573e-06, 'epochs': 173, 'loss': 'mse', 'optimizer': 'adam', 'graph_mode': 'cutoff', 'cutoff': 0.40112776897469754, 'grm_norm': 'none', 'self_loops': False, 'use_snp_selection': True, 'num_snps': 8006}. Best is trial 19 with value: 0.09185206122090518.
[I 2025-11-03 13:37:50,567] Trial 80 finished with value: -0.008606002082687273 and parameters: {'model_type': 'graphsage', 'hidden_dims': '[256, 128, 64]', 'dropout': 0.5317790534026788, 'batch_norm': False, 'lr': 9.357527425701743e-05, 'weight_decay': 4.294440271401702e-06, 'epochs': 166, 'loss': 'mse', 'optimizer': 'adam', 'graph_mode': 'cutoff', 'cutoff': 0.4006895622642925, 'grm_norm': 'none', 'self_loops': False, 'use_snp_selection': True, 'num_snps': 8220}. Best is trial 19 with value: 0.09185206122090518.
[I 2025-11-03 13:37:52,776] Trial 81 finished with value: 0.015694256621435785 and parameters: {'model_type': 'graphsage', 'hidden_dims': '[256, 128, 64]', 'dropout': 0.38991605575760085, 'batch_norm': False, 'lr': 5.748070256673158e-05, 'weight_decay': 1.4038704698518246e-06, 'epochs': 174, 'loss': 'mse', 'optimizer': 'adam', 'graph_mode': 'cutoff', 'cutoff': 0.2879669744159842, 'grm_norm': 'none', 'self_loops': False, 'use_snp_selection': True, 'num_snps': 13948}. Best is trial 19 with value: 0.09185206122090518.
