[I 2025-11-03 14:26:21,481] Trial 118 finished with value: 0.12467618829349651 and parameters: {'model_type': 'graphsage', 'hidden_dims': '[512, 128]', 'dropout': 0.2001378962365075, 'batch_norm': True, 'lr': 0.00013313295274746488, 'weight_decay': 3.4282447053344708e-06, 'epochs': 249, 'loss': 'mse', 'optimizer': 'adam', 'graph_mode': 'knn', 'source': 'grm', 'knn_k': 9, 'weighted_edges': True, 'symmetrize_mode': 'mutual', 'use_snp_selection': False}. Best is trial 55 with value: 0.15949987873804383.
[I 2025-11-03 14:26:32,136] Trial 119 finished with value: 0.1246067336271795 and parameters: {'model_type': 'graphsage', 'hidden_dims': '[512, 256]', 'dropout': 0.4825818828318928, 'batch_norm': True, 'lr': 4.167975171933334e-05, 'weight_decay': 9.64964655331614e-07, 'epochs': 265, 'loss': 'mae', 'optimizer': 'adam', 'graph_mode': 'knn', 'source': 'grm', 'knn_k': 8, 'weighted_edges': False, 'symmetrize_mode': 'mutual', 'use_snp_selection': False}. Best is trial 55 with value: 0.15949987873804383.
[I 2025-11-03 14:26:41,242] Trial 120 finished with value: 0.14541528024773392 and parameters: {'model_type': 'graphsage', 'hidden_dims': '[512, 128]', 'dropout': 0.5557350530307268, 'batch_norm': True, 'lr': 0.0002178176171381364, 'weight_decay': 7.818234592565408e-05, 'epochs': 206, 'loss': 'mae', 'optimizer': 'adam', 'graph_mode': 'knn', 'source': 'grm', 'knn_k': 10, 'weighted_edges': True, 'symmetrize_mode': 'mutual', 'use_snp_selection': False}. Best is trial 55 with value: 0.15949987873804383.
[I 2025-11-03 14:26:52,260] Trial 121 finished with value: 0.15498646365765475 and parameters: {'model_type': 'graphsage', 'hidden_dims': '[512, 128]', 'dropout': 0.5275179259574977, 'batch_norm': True, 'lr': 0.0005002936311796217, 'weight_decay': 1.9507207137277596e-06, 'epochs': 262, 'loss': 'mae', 'optimizer': 'adam', 'graph_mode': 'knn', 'source': 'grm', 'knn_k': 10, 'weighted_edges': True, 'symmetrize_mode': 'mutual', 'use_snp_selection': False}. Best is trial 55 with value: 0.15949987873804383.
[I 2025-11-03 14:27:03,808] Trial 122 finished with value: 0.15749905774692896 and parameters: {'model_type': 'graphsage', 'hidden_dims': '[512, 128]', 'dropout': 0.502539107764136, 'batch_norm': True, 'lr': 0.0004977337633691474, 'weight_decay': 2.2388117468139835e-06, 'epochs': 279, 'loss': 'mae', 'optimizer': 'adam', 'graph_mode': 'knn', 'source': 'grm', 'knn_k': 10, 'weighted_edges': True, 'symmetrize_mode': 'mutual', 'use_snp_selection': False}. Best is trial 55 with value: 0.15949987873804383.
[I 2025-11-03 14:27:15,345] Trial 123 finished with value: 0.15296776916563531 and parameters: {'model_type': 'graphsage', 'hidden_dims': '[512, 128]', 'dropout': 0.5132353554311978, 'batch_norm': True, 'lr': 0.0005107467136647424, 'weight_decay': 1.8258222426072224e-06, 'epochs': 278, 'loss': 'mae', 'optimizer': 'adam', 'graph_mode': 'knn', 'source': 'grm', 'knn_k': 10, 'weighted_edges': True, 'symmetrize_mode': 'mutual', 'use_snp_selection': False}. Best is trial 55 with value: 0.15949987873804383.
[I 2025-11-03 14:27:27,316] Trial 124 finished with value: 0.14717876941664756 and parameters: {'model_type': 'graphsage', 'hidden_dims': '[512, 128]', 'dropout': 0.512784483963781, 'batch_norm': True, 'lr': 0.0004329443847991068, 'weight_decay': 2.261173009405154e-06, 'epochs': 290, 'loss': 'mae', 'optimizer': 'adam', 'graph_mode': 'knn', 'source': 'grm', 'knn_k': 10, 'weighted_edges': True, 'symmetrize_mode': 'mutual', 'use_snp_selection': False}. Best is trial 55 with value: 0.15949987873804383.
[I 2025-11-03 14:27:38,930] Trial 125 finished with value: 0.14046929082223747 and parameters: {'model_type': 'graphsage', 'hidden_dims': '[512, 128]', 'dropout': 0.5271870295702187, 'batch_norm': True, 'lr': 0.0005951906455488497, 'weight_decay': 1.8156204895531436e-06, 'epochs': 280, 'loss': 'mae', 'optimizer': 'adam', 'graph_mode': 'knn', 'source': 'grm', 'knn_k': 10, 'weighted_edges': True, 'symmetrize_mode': 'mutual', 'use_snp_selection': False}. Best is trial 55 with value: 0.15949987873804383.
[I 2025-11-03 14:27:51,422] Trial 126 finished with value: 0.13073894956267398 and parameters: {'model_type': 'graphsage', 'hidden_dims': '[512, 128]', 'dropout': 0.4989929479855593, 'batch_norm': True, 'lr': 0.0006607926593738006, 'weight_decay': 2.6969764179467546e-06, 'epochs': 241, 'loss': 'mae', 'optimizer': 'adam', 'graph_mode': 'knn', 'source': 'grm', 'knn_k': 10, 'weighted_edges': True, 'symmetrize_mode': 'union', 'use_snp_selection': False}. Best is trial 55 with value: 0.15949987873804383.
[I 2025-11-03 14:28:02,162] Trial 127 finished with value: 0.14095162606960876 and parameters: {'model_type': 'graphsage', 'hidden_dims': '[512, 128]', 'dropout': 0.5376082221141196, 'batch_norm': True, 'lr': 0.0003147037653971658, 'weight_decay': 1.5104876341198454e-06, 'epochs': 255, 'loss': 'mae', 'optimizer': 'adam', 'graph_mode': 'knn', 'source': 'grm', 'knn_k': 10, 'weighted_edges': True, 'symmetrize_mode': 'mutual', 'use_snp_selection': False}. Best is trial 55 with value: 0.15949987873804383.
[I 2025-11-03 14:28:08,779] Trial 128 finished with value: 0.11177684948761583 and parameters: {'model_type': 'graphsage', 'hidden_dims': '[512, 128]', 'dropout': 0.5107192330452719, 'batch_norm': False, 'lr': 0.000769101642287023, 'weight_decay': 3.14299834069741e-06, 'epochs': 268, 'loss': 'mae', 'optimizer': 'adam', 'graph_mode': 'knn', 'source': 'grm', 'knn_k': 10, 'weighted_edges': True, 'symmetrize_mode': 'mutual', 'use_snp_selection': True, 'num_snps': 23993}. Best is trial 55 with value: 0.15949987873804383.
[I 2025-11-03 14:28:20,481] Trial 129 finished with value: 0.15219758493170524 and parameters: {'model_type': 'graphsage', 'hidden_dims': '[512, 128]', 'dropout': 0.48823532364530436, 'batch_norm': True, 'lr': 0.0003960479526901257, 'weight_decay': 1.2746022393505747e-06, 'epochs': 284, 'loss': 'mse', 'optimizer': 'adam', 'graph_mode': 'knn', 'source': 'grm', 'knn_k': 10, 'weighted_edges': True, 'symmetrize_mode': 'mutual', 'use_snp_selection': False}. Best is trial 55 with value: 0.15949987873804383.
[I 2025-11-03 14:28:32,656] Trial 130 finished with value: 0.1435809054818623 and parameters: {'model_type': 'graphsage', 'hidden_dims': '[512, 128]', 'dropout': 0.468274237290922, 'batch_norm': True, 'lr': 0.00039356401425195433, 'weight_decay': 4.354732861639638e-06, 'epochs': 298, 'loss': 'mse', 'optimizer': 'adam', 'graph_mode': 'knn', 'source': 'grm', 'knn_k': 10, 'weighted_edges': False, 'symmetrize_mode': 'mutual', 'use_snp_selection': False}. Best is trial 55 with value: 0.15949987873804383.
[I 2025-11-03 14:28:43,583] Trial 131 finished with value: 0.1418709046009412 and parameters: {'model_type': 'graphsage', 'hidden_dims': '[512, 128]', 'dropout': 0.48847792022476066, 'batch_norm': True, 'lr': 0.0004976946934165283, 'weight_decay': 1.233883764967252e-06, 'epochs': 260, 'loss': 'mse', 'optimizer': 'adam', 'graph_mode': 'knn', 'source': 'grm', 'knn_k': 10, 'weighted_edges': True, 'symmetrize_mode': 'mutual', 'use_snp_selection': False}. Best is trial 55 with value: 0.15949987873804383.
[I 2025-11-03 14:28:55,171] Trial 132 finished with value: 0.15308244064477294 and parameters: {'model_type': 'graphsage', 'hidden_dims': '[512, 128]', 'dropout': 0.5062791506751253, 'batch_norm': True, 'lr': 0.0005605692261393176, 'weight_decay': 2.1636223004392267e-06, 'epochs': 282, 'loss': 'mse', 'optimizer': 'adam', 'graph_mode': 'knn', 'source': 'grm', 'knn_k': 10, 'weighted_edges': True, 'symmetrize_mode': 'mutual', 'use_snp_selection': False}. Best is trial 55 with value: 0.15949987873804383.
[I 2025-11-03 14:29:06,830] Trial 133 finished with value: 0.15032403120899723 and parameters: {'model_type': 'graphsage', 'hidden_dims': '[512, 128]', 'dropout': 0.4738598860520004, 'batch_norm': True, 'lr': 0.0005112370516004766, 'weight_decay': 2.334072323277947e-06, 'epochs': 284, 'loss': 'mse', 'optimizer': 'adam', 'graph_mode': 'knn', 'source': 'grm', 'knn_k': 10, 'weighted_edges': True, 'symmetrize_mode': 'mutual', 'use_snp_selection': False}. Best is trial 55 with value: 0.15949987873804383.
[I 2025-11-03 14:29:18,113] Trial 134 finished with value: 0.16040056814570394 and parameters: {'model_type': 'graphsage', 'hidden_dims': '[512, 128]', 'dropout': 0.5018363639022524, 'batch_norm': True, 'lr': 0.0004343256939651214, 'weight_decay': 1.6838869841451417e-06, 'epochs': 280, 'loss': 'mse', 'optimizer': 'adam', 'graph_mode': 'knn', 'source': 'grm', 'knn_k': 9, 'weighted_edges': True, 'symmetrize_mode': 'mutual', 'use_snp_selection': False}. Best is trial 134 with value: 0.16040056814570394.
[I 2025-11-03 14:29:31,265] Trial 135 finished with value: 0.14102982131911274 and parameters: {'model_type': 'graphsage', 'hidden_dims': '[512, 128]', 'dropout': 0.4995668786466874, 'batch_norm': True, 'lr': 0.0008879898709664495, 'weight_decay': 1.6451449964162774e-06, 'epochs': 269, 'loss': 'mse', 'optimizer': 'adam', 'graph_mode': 'knn', 'source': 'grm', 'knn_k': 9, 'weighted_edges': True, 'symmetrize_mode': 'union', 'use_snp_selection': False}. Best is trial 134 with value: 0.16040056814570394.
[I 2025-11-03 14:29:42,456] Trial 136 finished with value: 0.14186816825627407 and parameters: {'model_type': 'graphsage', 'hidden_dims': '[512, 128]', 'dropout': 0.5215974052857582, 'batch_norm': True, 'lr': 0.0002495254405931306, 'weight_decay': 6.319404941138106e-06, 'epochs': 277, 'loss': 'mse', 'optimizer': 'adam', 'graph_mode': 'knn', 'source': 'grm', 'knn_k': 9, 'weighted_edges': True, 'symmetrize_mode': 'mutual', 'use_snp_selection': False}. Best is trial 134 with value: 0.16040056814570394.
[I 2025-11-03 14:29:56,955] Trial 137 finished with value: 0.12494250050095618 and parameters: {'model_type': 'graphsage', 'hidden_dims': '[512, 128]', 'dropout': 0.5471647128142199, 'batch_norm': True, 'lr': 0.0004479616753609921, 'weight_decay': 3.678290893824121e-06, 'epochs': 291, 'loss': 'mse', 'optimizer': 'adam', 'graph_mode': 'cutoff', 'cutoff': 0.20317799620059307, 'grm_norm': 'gcn', 'self_loops': True, 'use_snp_selection': False}. Best is trial 134 with value: 0.16040056814570394.
[I 2025-11-03 14:30:08,242] Trial 138 finished with value: 0.13913311699989267 and parameters: {'model_type': 'graphsage', 'hidden_dims': '[512, 128]', 'dropout': 0.5069120045327793, 'batch_norm': True, 'lr': 0.00034105496674089895, 'weight_decay': 2.7999193832432143e-06, 'epochs': 280, 'loss': 'mse', 'optimizer': 'adam', 'graph_mode': 'knn', 'source': 'grm', 'knn_k': 9, 'weighted_edges': True, 'symmetrize_mode': 'mutual', 'use_snp_selection': False}. Best is trial 134 with value: 0.16040056814570394.
[I 2025-11-03 14:30:16,510] Trial 139 finished with value: 0.15192850843973807 and parameters: {'model_type': 'graphsage', 'hidden_dims': '[256, 128]', 'dropout': 0.4575943888318108, 'batch_norm': True, 'lr': 0.000684915901043401, 'weight_decay': 4.871861693955986e-06, 'epochs': 305, 'loss': 'mse', 'optimizer': 'adam', 'graph_mode': 'knn', 'source': 'grm', 'knn_k': 9, 'weighted_edges': True, 'symmetrize_mode': 'mutual', 'use_snp_selection': False}. Best is trial 134 with value: 0.16040056814570394.
[I 2025-11-03 14:30:22,106] Trial 140 finished with value: 0.13826700812857234 and parameters: {'model_type': 'graphsage', 'hidden_dims': '[256, 128, 64]', 'dropout': 0.43668009717446693, 'batch_norm': True, 'lr': 0.0005682422672224148, 'weight_decay': 5.062349361463487e-05, 'epochs': 271, 'loss': 'mse', 'optimizer': 'adam', 'graph_mode': 'knn', 'source': 'grm', 'knn_k': 1, 'weighted_edges': True, 'symmetrize_mode': 'mutual', 'use_snp_selection': False}. Best is trial 134 with value: 0.16040056814570394.
[I 2025-11-03 14:30:33,875] Trial 141 finished with value: 0.15733610921734165 and parameters: {'model_type': 'graphsage', 'hidden_dims': '[512, 128]', 'dropout': 0.48803872432314355, 'batch_norm': True, 'lr': 0.000397633926836893, 'weight_decay': 2.0185634086288744e-06, 'epochs': 285, 'loss': 'mse', 'optimizer': 'adam', 'graph_mode': 'knn', 'source': 'grm', 'knn_k': 10, 'weighted_edges': True, 'symmetrize_mode': 'mutual', 'use_snp_selection': False}. Best is trial 134 with value: 0.16040056814570394.
[I 2025-11-03 14:30:45,718] Trial 142 finished with value: 0.1573589329214421 and parameters: {'model_type': 'graphsage', 'hidden_dims': '[512, 128]', 'dropout': 0.5322533531896714, 'batch_norm': True, 'lr': 0.00029754404828307275, 'weight_decay': 1.9439418366819817e-06, 'epochs': 289, 'loss': 'mse', 'optimizer': 'adam', 'graph_mode': 'knn', 'source': 'grm', 'knn_k': 10, 'weighted_edges': True, 'symmetrize_mode': 'mutual', 'use_snp_selection': False}. Best is trial 134 with value: 0.16040056814570394.
[I 2025-11-03 14:30:57,715] Trial 143 finished with value: 0.16552025882163018 and parameters: {'model_type': 'graphsage', 'hidden_dims': '[512, 128]', 'dropout': 0.5328675976430702, 'batch_norm': True, 'lr': 0.0002981579317988494, 'weight_decay': 1.919761423125771e-06, 'epochs': 291, 'loss': 'mse', 'optimizer': 'adam', 'graph_mode': 'knn', 'source': 'grm', 'knn_k': 10, 'weighted_edges': True, 'symmetrize_mode': 'mutual', 'use_snp_selection': False}. Best is trial 143 with value: 0.16552025882163018.
[I 2025-11-03 14:31:09,820] Trial 144 finished with value: 0.14845669539293674 and parameters: {'model_type': 'graphsage', 'hidden_dims': '[512, 128]', 'dropout': 0.5039140275834644, 'batch_norm': True, 'lr': 0.00029602776469107053, 'weight_decay': 1.8656482035025055e-06, 'epochs': 297, 'loss': 'mse', 'optimizer': 'adam', 'graph_mode': 'knn', 'source': 'grm', 'knn_k': 10, 'weighted_edges': True, 'symmetrize_mode': 'mutual', 'use_snp_selection': False}. Best is trial 143 with value: 0.16552025882163018.
[I 2025-11-03 14:31:21,652] Trial 145 finished with value: 0.14545905417503383 and parameters: {'model_type': 'graphsage', 'hidden_dims': '[512, 128]', 'dropout': 0.5309749642270246, 'batch_norm': True, 'lr': 0.0003474794797793587, 'weight_decay': 2.1448160112483733e-06, 'epochs': 289, 'loss': 'mse', 'optimizer': 'adam', 'graph_mode': 'knn', 'source': 'grm', 'knn_k': 10, 'weighted_edges': True, 'symmetrize_mode': 'mutual', 'use_snp_selection': False}. Best is trial 143 with value: 0.16552025882163018.
[I 2025-11-03 14:31:30,968] Trial 146 finished with value: 0.13634124056511487 and parameters: {'model_type': 'graphsage', 'hidden_dims': '[128, 64]', 'dropout': 0.5785051306272293, 'batch_norm': True, 'lr': 0.00044821373401083913, 'weight_decay': 1.4687910867959663e-06, 'epochs': 310, 'loss': 'mse', 'optimizer': 'adam', 'graph_mode': 'knn', 'source': 'grm', 'knn_k': 10, 'weighted_edges': True, 'symmetrize_mode': 'union', 'use_snp_selection': False}. Best is trial 143 with value: 0.16552025882163018.
[I 2025-11-03 14:31:43,711] Trial 147 finished with value: 0.153706151293921 and parameters: {'model_type': 'graphsage', 'hidden_dims': '[512, 128]', 'dropout': 0.49085611066049906, 'batch_norm': True, 'lr': 0.0002777697394151691, 'weight_decay': 1.8592242749261283e-06, 'epochs': 316, 'loss': 'mse', 'optimizer': 'adam', 'graph_mode': 'knn', 'source': 'grm', 'knn_k': 10, 'weighted_edges': True, 'symmetrize_mode': 'mutual', 'use_snp_selection': False}. Best is trial 143 with value: 0.16552025882163018.
[I 2025-11-03 14:31:56,549] Trial 148 finished with value: 0.1563369528216273 and parameters: {'model_type': 'graphsage', 'hidden_dims': '[512, 128]', 'dropout': 0.49230333285720146, 'batch_norm': True, 'lr': 0.0002750235986669786, 'weight_decay': 8.874823985110647e-07, 'epochs': 319, 'loss': 'mse', 'optimizer': 'adam', 'graph_mode': 'knn', 'source': 'grm', 'knn_k': 10, 'weighted_edges': False, 'symmetrize_mode': 'mutual', 'use_snp_selection': False}. Best is trial 143 with value: 0.16552025882163018.
[I 2025-11-03 14:32:05,606] Trial 149 finished with value: 0.15816488607246637 and parameters: {'model_type': 'graphsage', 'hidden_dims': '[256, 128, 64]', 'dropout': 0.4762993693902204, 'batch_norm': True, 'lr': 0.0002821681204864611, 'weight_decay': 8.404574360066976e-07, 'epochs': 325, 'loss': 'mse', 'optimizer': 'adam', 'graph_mode': 'knn', 'source': 'grm', 'knn_k': 10, 'weighted_edges': False, 'symmetrize_mode': 'mutual', 'use_snp_selection': False}. Best is trial 143 with value: 0.16552025882163018.
[I 2025-11-03 14:32:08,794] Trial 0 finished with value: 0.045216205052999864 and parameters: {'model_type': 'graphsage', 'hidden_dims': '[128, 64]', 'dropout': 0.199031432379812, 'batch_norm': True, 'lr': 1.8408544111075837e-06, 'weight_decay': 5.5136510071208614e-05, 'epochs': 336, 'loss': 'mae', 'optimizer': 'adam', 'graph_mode': 'knn', 'source': 'grm', 'knn_k': 8, 'weighted_edges': True, 'symmetrize_mode': 'mutual', 'use_snp_selection': False}. Best is trial 0 with value: 0.045216205052999864.
[I 2025-11-03 14:32:10,581] Trial 1 finished with value: 0.11771904072601704 and parameters: {'model_type': 'graphsage', 'hidden_dims': '[128, 64]', 'dropout': 0.40051947670227217, 'batch_norm': True, 'lr': 0.0005320428882732732, 'weight_decay': 1.89210117736594e-06, 'epochs': 68, 'loss': 'mse', 'optimizer': 'adam', 'graph_mode': 'knn', 'source': 'grm', 'knn_k': 7, 'weighted_edges': True, 'symmetrize_mode': 'union', 'use_snp_selection': False}. Best is trial 1 with value: 0.11771904072601704.
[I 2025-11-03 14:32:13,340] Trial 2 finished with value: 0.03291122824703983 and parameters: {'model_type': 'graphsage', 'hidden_dims': '[256, 128]', 'dropout': 0.5105528289184642, 'batch_norm': False, 'lr': 0.0006804279372404962, 'weight_decay': 0.0008922815224257085, 'epochs': 181, 'loss': 'mse', 'optimizer': 'adam', 'graph_mode': 'cutoff', 'cutoff': 0.5741905641612706, 'grm_norm': 'gcn', 'self_loops': False, 'use_snp_selection': True, 'num_snps': 26910}. Best is trial 1 with value: 0.11771904072601704.
[I 2025-11-03 14:32:16,333] Trial 3 finished with value: 0.06109293821025706 and parameters: {'model_type': 'graphsage', 'hidden_dims': '[256, 128, 64]', 'dropout': 0.5390483213624292, 'batch_norm': False, 'lr': 3.4705625989073525e-05, 'weight_decay': 2.4623319020131338e-05, 'epochs': 121, 'loss': 'mse', 'optimizer': 'adam', 'graph_mode': 'knn', 'source': 'grm', 'knn_k': 6, 'weighted_edges': False, 'symmetrize_mode': 'mutual', 'use_snp_selection': True, 'num_snps': 30713}. Best is trial 1 with value: 0.11771904072601704.
[I 2025-11-03 14:32:19,241] Trial 4 finished with value: 0.06720459736169906 and parameters: {'model_type': 'graphsage', 'hidden_dims': '[128, 64]', 'dropout': 0.13404863676897502, 'batch_norm': False, 'lr': 0.0001431556295367288, 'weight_decay': 2.2084517750726675e-05, 'epochs': 51, 'loss': 'mae', 'optimizer': 'adam', 'graph_mode': 'cutoff', 'cutoff': 0.6714268476993044, 'grm_norm': 'none', 'self_loops': False, 'use_snp_selection': True, 'num_snps': 45645}. Best is trial 1 with value: 0.11771904072601704.
[I 2025-11-03 14:32:22,897] Trial 5 finished with value: 0.07253116955277986 and parameters: {'model_type': 'graphsage', 'hidden_dims': '[256, 128]', 'dropout': 0.42253606323412096, 'batch_norm': False, 'lr': 4.238630400638805e-05, 'weight_decay': 8.074086040046576e-07, 'epochs': 158, 'loss': 'mae', 'optimizer': 'adam', 'graph_mode': 'knn', 'source': 'grm', 'knn_k': 1, 'weighted_edges': False, 'symmetrize_mode': 'mutual', 'use_snp_selection': True, 'num_snps': 43113}. Best is trial 1 with value: 0.11771904072601704.
[I 2025-11-03 14:32:27,719] Trial 6 finished with value: 0.12632520976631367 and parameters: {'model_type': 'graphsage', 'hidden_dims': '[512, 256]', 'dropout': 0.3534893146320237, 'batch_norm': True, 'lr': 0.000251307964226932, 'weight_decay': 1.821819791794022e-05, 'epochs': 223, 'loss': 'mae', 'optimizer': 'adam', 'graph_mode': 'knn', 'source': 'grm', 'knn_k': 1, 'weighted_edges': True, 'symmetrize_mode': 'mutual', 'use_snp_selection': False}. Best is trial 6 with value: 0.12632520976631367.
[I 2025-11-03 14:32:32,064] Trial 7 finished with value: 0.09487980629143294 and parameters: {'model_type': 'graphsage', 'hidden_dims': '[512, 256]', 'dropout': 0.1105825955860775, 'batch_norm': True, 'lr': 2.374338412754043e-05, 'weight_decay': 1.1284721123340274e-05, 'epochs': 190, 'loss': 'mse', 'optimizer': 'adam', 'graph_mode': 'cutoff', 'cutoff': 0.719872204109604, 'grm_norm': 'gcn', 'self_loops': False, 'use_snp_selection': False}. Best is trial 6 with value: 0.12632520976631367.
[I 2025-11-03 14:32:35,817] Trial 8 finished with value: 0.09755585228839087 and parameters: {'model_type': 'graphsage', 'hidden_dims': '[512, 128]', 'dropout': 0.5066580418354021, 'batch_norm': True, 'lr': 0.00039213678276659976, 'weight_decay': 3.43655320802934e-06, 'epochs': 120, 'loss': 'mse', 'optimizer': 'adam', 'graph_mode': 'cutoff', 'cutoff': 0.34923059576505366, 'grm_norm': 'cosine', 'self_loops': True, 'use_snp_selection': False}. Best is trial 6 with value: 0.12632520976631367.
[I 2025-11-03 14:32:38,073] Trial 9 finished with value: 0.06308574344381729 and parameters: {'model_type': 'graphsage', 'hidden_dims': '[512, 256]', 'dropout': 0.301734920240333, 'batch_norm': False, 'lr': 6.650961854953448e-06, 'weight_decay': 6.861575656590315e-05, 'epochs': 150, 'loss': 'mae', 'optimizer': 'adam', 'graph_mode': 'cutoff', 'cutoff': 0.2857569870061939, 'grm_norm': 'cosine_then_gcn', 'self_loops': False, 'use_snp_selection': True, 'num_snps': 12722}. Best is trial 6 with value: 0.12632520976631367.
[I 2025-11-03 14:32:43,651] Trial 10 finished with value: 0.1085156501921619 and parameters: {'model_type': 'graphsage', 'hidden_dims': '[512, 64]', 'dropout': 0.2833599465317005, 'batch_norm': True, 'lr': 0.00016916760584270694, 'weight_decay': 1.7866650996308468e-07, 'epochs': 275, 'loss': 'mae', 'optimizer': 'adam', 'graph_mode': 'knn', 'source': 'grm', 'knn_k': 1, 'weighted_edges': True, 'symmetrize_mode': 'union', 'use_snp_selection': False}. Best is trial 6 with value: 0.12632520976631367.
