[I 2025-11-03 12:10:56,271] Trial 129 finished with value: 0.08866007761525246 and parameters: {'model_type': 'gcn', 'hidden_dims': '[512, 64]', 'dropout': 0.4014104518101452, 'batch_norm': True, 'lr': 3.681637315376395e-05, 'weight_decay': 1.591474046534309e-07, 'epochs': 223, 'loss': 'mse', 'optimizer': 'adam', 'graph_mode': 'off', 'use_snp_selection': False}. Best is trial 22 with value: 0.13056895679760083.
[I 2025-11-03 12:10:59,047] Trial 130 finished with value: 0.11479276133645167 and parameters: {'model_type': 'gcn', 'hidden_dims': '[512, 256]', 'dropout': 0.1758100294800713, 'batch_norm': True, 'lr': 0.0008170100003359944, 'weight_decay': 0.0007422781072116368, 'epochs': 296, 'loss': 'mse', 'optimizer': 'adam', 'graph_mode': 'off', 'use_snp_selection': False}. Best is trial 22 with value: 0.13056895679760083.
[I 2025-11-03 12:11:01,915] Trial 131 finished with value: 0.12288311639156618 and parameters: {'model_type': 'gcn', 'hidden_dims': '[512, 256]', 'dropout': 0.3482664771950188, 'batch_norm': True, 'lr': 0.0006061568729052713, 'weight_decay': 2.0140867887184503e-07, 'epochs': 302, 'loss': 'mse', 'optimizer': 'adam', 'graph_mode': 'off', 'use_snp_selection': True, 'num_snps': 42315}. Best is trial 22 with value: 0.13056895679760083.
[I 2025-11-03 12:11:04,360] Trial 132 finished with value: 0.11227674824114188 and parameters: {'model_type': 'gcn', 'hidden_dims': '[512, 256]', 'dropout': 0.37991729334311775, 'batch_norm': True, 'lr': 0.0003578177130217396, 'weight_decay': 2.329728281453181e-07, 'epochs': 253, 'loss': 'mse', 'optimizer': 'adam', 'graph_mode': 'off', 'use_snp_selection': True, 'num_snps': 37299}. Best is trial 22 with value: 0.13056895679760083.
[I 2025-11-03 12:11:06,576] Trial 133 finished with value: 0.10820447545106346 and parameters: {'model_type': 'gcn', 'hidden_dims': '[512, 256]', 'dropout': 0.3660256936203695, 'batch_norm': True, 'lr': 0.0007008072863643498, 'weight_decay': 1.1740815861672904e-07, 'epochs': 316, 'loss': 'mse', 'optimizer': 'adam', 'graph_mode': 'off', 'use_snp_selection': True, 'num_snps': 26522}. Best is trial 22 with value: 0.13056895679760083.
[I 2025-11-03 12:11:09,824] Trial 134 finished with value: 0.11709553174030692 and parameters: {'model_type': 'gcn', 'hidden_dims': '[512, 256]', 'dropout': 0.34732519463092487, 'batch_norm': True, 'lr': 0.000588773030005929, 'weight_decay': 1.8816964593384255e-07, 'epochs': 308, 'loss': 'mse', 'optimizer': 'adam', 'graph_mode': 'off', 'use_snp_selection': True, 'num_snps': 51195}. Best is trial 22 with value: 0.13056895679760083.
[I 2025-11-03 12:11:12,256] Trial 135 finished with value: 0.11022824207432198 and parameters: {'model_type': 'gcn', 'hidden_dims': '[512, 256]', 'dropout': 0.33185302304740855, 'batch_norm': True, 'lr': 0.00027090263397946913, 'weight_decay': 2.867831315205632e-07, 'epochs': 280, 'loss': 'mse', 'optimizer': 'adam', 'graph_mode': 'off', 'use_snp_selection': True, 'num_snps': 35635}. Best is trial 22 with value: 0.13056895679760083.
[I 2025-11-03 12:11:13,630] Trial 136 finished with value: 0.11790510379771398 and parameters: {'model_type': 'gcn', 'hidden_dims': '[128, 64]', 'dropout': 0.3188017433620005, 'batch_norm': True, 'lr': 0.0004683827645044044, 'weight_decay': 1.4307155440228577e-07, 'epochs': 297, 'loss': 'mse', 'optimizer': 'adam', 'graph_mode': 'off', 'use_snp_selection': False}. Best is trial 22 with value: 0.13056895679760083.
[I 2025-11-03 12:11:15,078] Trial 137 finished with value: 0.11307728853539382 and parameters: {'model_type': 'gcn', 'hidden_dims': '[512, 128]', 'dropout': 0.30544757996136546, 'batch_norm': True, 'lr': 0.0008877415940904649, 'weight_decay': 4.2554735620556726e-07, 'epochs': 92, 'loss': 'mse', 'optimizer': 'adam', 'graph_mode': 'off', 'use_snp_selection': True, 'num_snps': 28691}. Best is trial 22 with value: 0.13056895679760083.
[I 2025-11-03 12:11:18,018] Trial 138 finished with value: 0.11175763196562688 and parameters: {'model_type': 'gcn', 'hidden_dims': '[512, 256]', 'dropout': 0.2370487342666364, 'batch_norm': True, 'lr': 0.00011133556313481381, 'weight_decay': 1.0125603981355414e-07, 'epochs': 331, 'loss': 'mse', 'optimizer': 'adam', 'graph_mode': 'off', 'use_snp_selection': False}. Best is trial 22 with value: 0.13056895679760083.
[I 2025-11-03 12:11:19,486] Trial 139 finished with value: 0.08849887546510438 and parameters: {'model_type': 'gcn', 'hidden_dims': '[128, 64]', 'dropout': 0.34298928164865, 'batch_norm': False, 'lr': 0.0009984310413006748, 'weight_decay': 2.148395176344355e-07, 'epochs': 340, 'loss': 'mse', 'optimizer': 'adam', 'graph_mode': 'off', 'use_snp_selection': False}. Best is trial 22 with value: 0.13056895679760083.
[I 2025-11-03 12:11:20,636] Trial 140 finished with value: 0.10410124612114578 and parameters: {'model_type': 'gcn', 'hidden_dims': '[128, 64]', 'dropout': 0.3611831302745858, 'batch_norm': True, 'lr': 0.0005369481672810097, 'weight_decay': 5.073254539218478e-07, 'epochs': 203, 'loss': 'mae', 'optimizer': 'adam', 'graph_mode': 'off', 'use_snp_selection': False}. Best is trial 22 with value: 0.13056895679760083.
[I 2025-11-03 12:11:23,505] Trial 141 finished with value: 0.11544068635376134 and parameters: {'model_type': 'gcn', 'hidden_dims': '[512, 256]', 'dropout': 0.3562602412481722, 'batch_norm': True, 'lr': 0.0005929964619131803, 'weight_decay': 1.987777593269453e-07, 'epochs': 305, 'loss': 'mse', 'optimizer': 'adam', 'graph_mode': 'off', 'use_snp_selection': True, 'num_snps': 41814}. Best is trial 22 with value: 0.13056895679760083.
[I 2025-11-03 12:11:26,742] Trial 142 finished with value: 0.11975002863676577 and parameters: {'model_type': 'gcn', 'hidden_dims': '[512, 256]', 'dropout': 0.35063554699177646, 'batch_norm': True, 'lr': 0.0007463729710367465, 'weight_decay': 2.3352033223362042e-07, 'epochs': 301, 'loss': 'mse', 'optimizer': 'adam', 'graph_mode': 'off', 'use_snp_selection': True, 'num_snps': 49911}. Best is trial 22 with value: 0.13056895679760083.
[I 2025-11-03 12:11:29,517] Trial 143 finished with value: 0.11555742862265077 and parameters: {'model_type': 'gcn', 'hidden_dims': '[512, 256]', 'dropout': 0.3755539342994391, 'batch_norm': True, 'lr': 0.0006449910658541542, 'weight_decay': 1.7840658423169455e-07, 'epochs': 291, 'loss': 'mse', 'optimizer': 'adam', 'graph_mode': 'off', 'use_snp_selection': True, 'num_snps': 41705}. Best is trial 22 with value: 0.13056895679760083.
[I 2025-11-03 12:11:33,037] Trial 144 finished with value: 0.041363055748703456 and parameters: {'model_type': 'gcn', 'hidden_dims': '[512, 256]', 'dropout': 0.25812988627582384, 'batch_norm': True, 'lr': 1.417497398576138e-05, 'weight_decay': 1.421503697735593e-07, 'epochs': 325, 'loss': 'mse', 'optimizer': 'adam', 'graph_mode': 'off', 'use_snp_selection': True, 'num_snps': 54158}. Best is trial 22 with value: 0.13056895679760083.
[I 2025-11-03 12:11:35,661] Trial 145 finished with value: 0.13191993839921146 and parameters: {'model_type': 'gcn', 'hidden_dims': '[512, 256]', 'dropout': 0.326745501472614, 'batch_norm': True, 'lr': 0.0004045952050047934, 'weight_decay': 2.634097606161725e-07, 'epochs': 228, 'loss': 'mse', 'optimizer': 'adam', 'graph_mode': 'off', 'use_snp_selection': True, 'num_snps': 44512}. Best is trial 145 with value: 0.13191993839921146.
[I 2025-11-03 12:11:37,936] Trial 146 finished with value: 0.114849946695849 and parameters: {'model_type': 'gcn', 'hidden_dims': '[512, 64]', 'dropout': 0.32714304119754956, 'batch_norm': True, 'lr': 0.00040289947067417256, 'weight_decay': 3.2176690532710496e-07, 'epochs': 228, 'loss': 'mse', 'optimizer': 'adam', 'graph_mode': 'off', 'use_snp_selection': False}. Best is trial 145 with value: 0.13191993839921146.
[I 2025-11-03 12:11:40,299] Trial 147 finished with value: 0.12266995094178543 and parameters: {'model_type': 'gcn', 'hidden_dims': '[512, 256]', 'dropout': 0.31584966498557915, 'batch_norm': True, 'lr': 0.00023120565183763664, 'weight_decay': 2.662953706404152e-07, 'epochs': 247, 'loss': 'mse', 'optimizer': 'adam', 'graph_mode': 'off', 'use_snp_selection': False}. Best is trial 145 with value: 0.13191993839921146.
[I 2025-11-03 12:11:41,880] Trial 148 finished with value: 0.1028049307599948 and parameters: {'model_type': 'gcn', 'hidden_dims': '[128, 64]', 'dropout': 0.29194017844780096, 'batch_norm': True, 'lr': 0.0004713404824185998, 'weight_decay': 6.58360206005697e-07, 'epochs': 215, 'loss': 'mse', 'optimizer': 'adam', 'graph_mode': 'off', 'use_snp_selection': True, 'num_snps': 31704}. Best is trial 145 with value: 0.13191993839921146.
[I 2025-11-03 12:11:43,459] Trial 149 finished with value: 0.10198482545722433 and parameters: {'model_type': 'gcn', 'hidden_dims': '[256, 128]', 'dropout': 0.3410157713939681, 'batch_norm': True, 'lr': 0.0003175712793923498, 'weight_decay': 6.297307566386988e-06, 'epochs': 234, 'loss': 'mse', 'optimizer': 'adam', 'graph_mode': 'off', 'use_snp_selection': False}. Best is trial 145 with value: 0.13191993839921146.
[I 2025-11-03 12:11:45,574] Trial 0 finished with value: -0.008316948446001737 and parameters: {'model_type': 'gcn', 'hidden_dims': '[128, 64]', 'dropout': 0.199031432379812, 'batch_norm': True, 'lr': 1.8408544111075837e-06, 'weight_decay': 5.5136510071208614e-05, 'epochs': 336, 'loss': 'mae', 'optimizer': 'adam', 'graph_mode': 'off', 'use_snp_selection': True, 'num_snps': 43862}. Best is trial 0 with value: -0.008316948446001737.
[I 2025-11-03 12:11:47,090] Trial 1 finished with value: 0.025097546135999228 and parameters: {'model_type': 'gcn', 'hidden_dims': '[256, 128]', 'dropout': 0.4370668075331726, 'batch_norm': True, 'lr': 7.133471581159139e-05, 'weight_decay': 1.128633586803549e-05, 'epochs': 242, 'loss': 'mae', 'optimizer': 'adam', 'graph_mode': 'off', 'use_snp_selection': False}. Best is trial 1 with value: 0.025097546135999228.
[I 2025-11-03 12:11:48,209] Trial 2 finished with value: -0.008877281470380149 and parameters: {'model_type': 'gcn', 'hidden_dims': '[256, 128, 64]', 'dropout': 0.41314357415569625, 'batch_norm': False, 'lr': 3.952233718592101e-06, 'weight_decay': 0.00026754769258252603, 'epochs': 149, 'loss': 'mse', 'optimizer': 'adam', 'graph_mode': 'off', 'use_snp_selection': True, 'num_snps': 11571}. Best is trial 1 with value: 0.025097546135999228.
[I 2025-11-03 12:11:50,810] Trial 3 finished with value: 0.01976973714902284 and parameters: {'model_type': 'gcn', 'hidden_dims': '[512, 64]', 'dropout': 0.5938127374509361, 'batch_norm': False, 'lr': 5.67704586114731e-06, 'weight_decay': 2.4518087630137052e-05, 'epochs': 320, 'loss': 'mae', 'optimizer': 'adam', 'graph_mode': 'off', 'use_snp_selection': False}. Best is trial 1 with value: 0.025097546135999228.
[I 2025-11-03 12:11:53,201] Trial 4 finished with value: 0.0007048413419295542 and parameters: {'model_type': 'gcn', 'hidden_dims': '[512, 128]', 'dropout': 0.25746343592134413, 'batch_norm': True, 'lr': 1.3467657668402788e-06, 'weight_decay': 0.00033087251918647806, 'epochs': 277, 'loss': 'mse', 'optimizer': 'adam', 'graph_mode': 'off', 'use_snp_selection': True, 'num_snps': 36675}. Best is trial 1 with value: 0.025097546135999228.
[I 2025-11-03 12:11:54,884] Trial 5 finished with value: 0.006618377361117315 and parameters: {'model_type': 'gcn', 'hidden_dims': '[512, 64]', 'dropout': 0.38275350994408375, 'batch_norm': True, 'lr': 1.5586664309232824e-06, 'weight_decay': 0.0008227664668621182, 'epochs': 145, 'loss': 'mae', 'optimizer': 'adam', 'graph_mode': 'off', 'use_snp_selection': True, 'num_snps': 32148}. Best is trial 1 with value: 0.025097546135999228.
[I 2025-11-03 12:11:56,191] Trial 6 finished with value: 0.028771717720730634 and parameters: {'model_type': 'gcn', 'hidden_dims': '[256, 128]', 'dropout': 0.3930109900265879, 'batch_norm': False, 'lr': 4.892964372128395e-05, 'weight_decay': 1.5809549317992182e-06, 'epochs': 199, 'loss': 'mse', 'optimizer': 'adam', 'graph_mode': 'off', 'use_snp_selection': False}. Best is trial 6 with value: 0.028771717720730634.
[I 2025-11-03 12:11:57,639] Trial 7 finished with value: 0.02325317482111388 and parameters: {'model_type': 'gcn', 'hidden_dims': '[512, 256]', 'dropout': 0.15343979219678458, 'batch_norm': True, 'lr': 6.234003099047341e-05, 'weight_decay': 3.894760610535477e-07, 'epochs': 97, 'loss': 'mse', 'optimizer': 'adam', 'graph_mode': 'off', 'use_snp_selection': False}. Best is trial 6 with value: 0.028771717720730634.
[I 2025-11-03 12:12:00,238] Trial 8 finished with value: 0.01684263302171713 and parameters: {'model_type': 'gcn', 'hidden_dims': '[512, 128]', 'dropout': 0.10743001231661406, 'batch_norm': True, 'lr': 0.00023728538449271062, 'weight_decay': 1.7629071578048637e-05, 'epochs': 312, 'loss': 'mae', 'optimizer': 'adam', 'graph_mode': 'off', 'use_snp_selection': False}. Best is trial 6 with value: 0.028771717720730634.
[I 2025-11-03 12:12:02,035] Trial 9 finished with value: 0.0118801130913214 and parameters: {'model_type': 'gcn', 'hidden_dims': '[512, 64]', 'dropout': 0.14505336736221927, 'batch_norm': True, 'lr': 5.8619638388111826e-05, 'weight_decay': 6.200156172669308e-07, 'epochs': 175, 'loss': 'mse', 'optimizer': 'adam', 'graph_mode': 'off', 'use_snp_selection': False}. Best is trial 6 with value: 0.028771717720730634.
[I 2025-11-03 12:12:02,798] Trial 10 finished with value: -0.029214360905727647 and parameters: {'model_type': 'gcn', 'hidden_dims': '[256, 128]', 'dropout': 0.5267360651501256, 'batch_norm': False, 'lr': 0.00032393778075602147, 'weight_decay': 1.936962886850364e-06, 'epochs': 46, 'loss': 'mse', 'optimizer': 'adam', 'graph_mode': 'off', 'use_snp_selection': False}. Best is trial 6 with value: 0.028771717720730634.
[I 2025-11-03 12:12:04,233] Trial 11 finished with value: 0.014790307567321625 and parameters: {'model_type': 'gcn', 'hidden_dims': '[256, 128]', 'dropout': 0.4514665825009126, 'batch_norm': False, 'lr': 1.647410838612645e-05, 'weight_decay': 3.590337640024813e-06, 'epochs': 239, 'loss': 'mae', 'optimizer': 'adam', 'graph_mode': 'off', 'use_snp_selection': False}. Best is trial 6 with value: 0.028771717720730634.
[I 2025-11-03 12:12:05,637] Trial 12 finished with value: 0.039788226820136205 and parameters: {'model_type': 'gcn', 'hidden_dims': '[256, 128]', 'dropout': 0.30357877697773006, 'batch_norm': False, 'lr': 2.4079976228986342e-05, 'weight_decay': 1.3081036432574914e-07, 'epochs': 219, 'loss': 'mae', 'optimizer': 'adam', 'graph_mode': 'off', 'use_snp_selection': False}. Best is trial 12 with value: 0.039788226820136205.
[I 2025-11-03 12:12:06,999] Trial 13 finished with value: 0.012686299161934552 and parameters: {'model_type': 'gcn', 'hidden_dims': '[256, 128]', 'dropout': 0.3041365173646664, 'batch_norm': False, 'lr': 1.581618310073141e-05, 'weight_decay': 1.0540026232995748e-07, 'epochs': 212, 'loss': 'mse', 'optimizer': 'adam', 'graph_mode': 'off', 'use_snp_selection': False}. Best is trial 12 with value: 0.039788226820136205.
[I 2025-11-03 12:12:08,304] Trial 14 finished with value: 0.02878104443011921 and parameters: {'model_type': 'gcn', 'hidden_dims': '[256, 128]', 'dropout': 0.3012984444538551, 'batch_norm': False, 'lr': 0.0001457690241539883, 'weight_decay': 1.0511393530426642e-07, 'epochs': 198, 'loss': 'mae', 'optimizer': 'adam', 'graph_mode': 'off', 'use_snp_selection': False}. Best is trial 12 with value: 0.039788226820136205.
[I 2025-11-03 12:12:09,478] Trial 15 finished with value: 0.028059295786410865 and parameters: {'model_type': 'gcn', 'hidden_dims': '[128, 64]', 'dropout': 0.30748970331358694, 'batch_norm': False, 'lr': 0.0001572871022003765, 'weight_decay': 1.1179477109289942e-07, 'epochs': 260, 'loss': 'mae', 'optimizer': 'adam', 'graph_mode': 'off', 'use_snp_selection': False}. Best is trial 12 with value: 0.039788226820136205.
[I 2025-11-03 12:12:10,635] Trial 16 finished with value: -0.00286342780534103 and parameters: {'model_type': 'gcn', 'hidden_dims': '[256, 128, 64]', 'dropout': 0.24636696142691386, 'batch_norm': False, 'lr': 0.0006289346442834361, 'weight_decay': 3.315063111115081e-07, 'epochs': 129, 'loss': 'mae', 'optimizer': 'adam', 'graph_mode': 'off', 'use_snp_selection': False}. Best is trial 12 with value: 0.039788226820136205.
[I 2025-11-03 12:12:13,161] Trial 17 finished with value: -0.000128669364472629 and parameters: {'model_type': 'gcn', 'hidden_dims': '[512, 256]', 'dropout': 0.32888830259108426, 'batch_norm': False, 'lr': 2.2599008677310323e-05, 'weight_decay': 2.556635282881023e-07, 'epochs': 287, 'loss': 'mae', 'optimizer': 'adam', 'graph_mode': 'off', 'use_snp_selection': False}. Best is trial 12 with value: 0.039788226820136205.
[I 2025-11-03 12:12:15,531] Trial 18 finished with value: 0.005882764130935323 and parameters: {'model_type': 'gcn', 'hidden_dims': '[256, 128]', 'dropout': 0.2312628506238401, 'batch_norm': False, 'lr': 0.000919616353548597, 'weight_decay': 1.0815722596945956e-06, 'epochs': 217, 'loss': 'mae', 'optimizer': 'adam', 'graph_mode': 'off', 'use_snp_selection': True, 'num_snps': 58241}. Best is trial 12 with value: 0.039788226820136205.
[I 2025-11-03 12:12:16,761] Trial 19 finished with value: 0.018418612312622287 and parameters: {'model_type': 'gcn', 'hidden_dims': '[256, 128]', 'dropout': 0.49722996477773623, 'batch_norm': False, 'lr': 0.0001433479397973849, 'weight_decay': 4.045710233045699e-06, 'epochs': 177, 'loss': 'mae', 'optimizer': 'adam', 'graph_mode': 'off', 'use_snp_selection': False}. Best is trial 12 with value: 0.039788226820136205.
[I 2025-11-03 12:12:17,749] Trial 20 finished with value: -0.013614351604629794 and parameters: {'model_type': 'gcn', 'hidden_dims': '[256, 128]', 'dropout': 0.3445437979407208, 'batch_norm': False, 'lr': 7.951283186534729e-06, 'weight_decay': 1.6973989855159803e-07, 'epochs': 108, 'loss': 'mae', 'optimizer': 'adam', 'graph_mode': 'off', 'use_snp_selection': False}. Best is trial 12 with value: 0.039788226820136205.
[I 2025-11-03 12:12:19,063] Trial 21 finished with value: 0.022462783322708027 and parameters: {'model_type': 'gcn', 'hidden_dims': '[256, 128]', 'dropout': 0.37787843356888323, 'batch_norm': False, 'lr': 3.768882000800948e-05, 'weight_decay': 7.183848865111096e-07, 'epochs': 207, 'loss': 'mse', 'optimizer': 'adam', 'graph_mode': 'off', 'use_snp_selection': False}. Best is trial 12 with value: 0.039788226820136205.
[I 2025-11-03 12:12:20,299] Trial 22 finished with value: 0.027274505516346456 and parameters: {'model_type': 'gcn', 'hidden_dims': '[256, 128]', 'dropout': 0.28832353199192623, 'batch_norm': False, 'lr': 0.00010480393822217223, 'weight_decay': 1.52391770991326e-06, 'epochs': 179, 'loss': 'mse', 'optimizer': 'adam', 'graph_mode': 'off', 'use_snp_selection': False}. Best is trial 12 with value: 0.039788226820136205.
[I 2025-11-03 12:12:21,768] Trial 23 finished with value: 0.019727311696712498 and parameters: {'model_type': 'gcn', 'hidden_dims': '[256, 128]', 'dropout': 0.3691500912600813, 'batch_norm': False, 'lr': 3.3983901682717705e-05, 'weight_decay': 3.5098246680687934e-06, 'epochs': 247, 'loss': 'mse', 'optimizer': 'adam', 'graph_mode': 'off', 'use_snp_selection': False}. Best is trial 12 with value: 0.039788226820136205.
[I 2025-11-03 12:12:23,067] Trial 24 finished with value: 0.0396350403230975 and parameters: {'model_type': 'gcn', 'hidden_dims': '[256, 128]', 'dropout': 0.27141260238133813, 'batch_norm': False, 'lr': 1.0339930351440496e-05, 'weight_decay': 2.2878936900200534e-07, 'epochs': 199, 'loss': 'mae', 'optimizer': 'adam', 'graph_mode': 'off', 'use_snp_selection': False}. Best is trial 12 with value: 0.039788226820136205.
[I 2025-11-03 12:12:25,123] Trial 25 finished with value: 9.424375603287735e-05 and parameters: {'model_type': 'gcn', 'hidden_dims': '[512, 256]', 'dropout': 0.20659399060640365, 'batch_norm': False, 'lr': 6.957296081481843e-06, 'weight_decay': 2.053880334722089e-07, 'epochs': 225, 'loss': 'mae', 'optimizer': 'adam', 'graph_mode': 'off', 'use_snp_selection': False}. Best is trial 12 with value: 0.039788226820136205.
[I 2025-11-03 12:12:25,965] Trial 26 finished with value: 0.018189983184660825 and parameters: {'model_type': 'gcn', 'hidden_dims': '[512, 128]', 'dropout': 0.28413159071967836, 'batch_norm': False, 'lr': 1.2550693142833744e-05, 'weight_decay': 4.974890347938925e-07, 'epochs': 156, 'loss': 'mae', 'optimizer': 'adam', 'graph_mode': 'off', 'use_snp_selection': True, 'num_snps': 3842}. Best is trial 12 with value: 0.039788226820136205.
[I 2025-11-03 12:12:27,784] Trial 27 finished with value: -0.014220430672046579 and parameters: {'model_type': 'gcn', 'hidden_dims': '[256, 128, 64]', 'dropout': 0.2004127704964685, 'batch_norm': False, 'lr': 3.367686308473862e-06, 'weight_decay': 1.0308381661604383e-07, 'epochs': 273, 'loss': 'mae', 'optimizer': 'adam', 'graph_mode': 'off', 'use_snp_selection': False}. Best is trial 12 with value: 0.039788226820136205.
[I 2025-11-03 12:12:28,768] Trial 28 finished with value: 0.012221120913627117 and parameters: {'model_type': 'gcn', 'hidden_dims': '[128, 64]', 'dropout': 0.2667359562450607, 'batch_norm': False, 'lr': 2.2729297314213175e-05, 'weight_decay': 2.5950897773338703e-07, 'epochs': 187, 'loss': 'mae', 'optimizer': 'adam', 'graph_mode': 'off', 'use_snp_selection': False}. Best is trial 12 with value: 0.039788226820136205.
[I 2025-11-03 12:12:29,722] Trial 29 finished with value: 0.0010361199668899718 and parameters: {'model_type': 'gcn', 'hidden_dims': '[128, 64]', 'dropout': 0.32195194040372804, 'batch_norm': False, 'lr': 2.8966762461994946e-06, 'weight_decay': 5.522710335772491e-05, 'epochs': 78, 'loss': 'mae', 'optimizer': 'adam', 'graph_mode': 'off', 'use_snp_selection': True, 'num_snps': 19468}. Best is trial 12 with value: 0.039788226820136205.
