[I 2025-11-03 11:55:12,262] Trial 14 finished with value: 0.07501338870419991 and parameters: {'model_type': 'gcn', 'hidden_dims': '[512, 128]', 'dropout': 0.2896280300541336, 'batch_norm': True, 'lr': 0.000923030482500558, 'weight_decay': 3.4312897322914332e-06, 'epochs': 253, 'loss': 'mae', 'optimizer': 'adam', 'graph_mode': 'off', 'use_snp_selection': False}. Best is trial 12 with value: 0.0873186023536236.
[I 2025-11-03 11:55:15,202] Trial 15 finished with value: 0.07808392527484623 and parameters: {'model_type': 'gcn', 'hidden_dims': '[512, 128]', 'dropout': 0.2270774052443235, 'batch_norm': True, 'lr': 0.00022081075816005494, 'weight_decay': 4.647398975110258e-06, 'epochs': 268, 'loss': 'mae', 'optimizer': 'adam', 'graph_mode': 'off', 'use_snp_selection': False}. Best is trial 12 with value: 0.0873186023536236.
[I 2025-11-03 11:55:17,068] Trial 16 finished with value: -0.022384974738106515 and parameters: {'model_type': 'gcn', 'hidden_dims': '[256, 128, 64]', 'dropout': 0.3272438537349502, 'batch_norm': True, 'lr': 1.4186730202195519e-05, 'weight_decay': 4.319682528055659e-07, 'epochs': 220, 'loss': 'mae', 'optimizer': 'adam', 'graph_mode': 'off', 'use_snp_selection': False}. Best is trial 12 with value: 0.0873186023536236.
[I 2025-11-03 11:55:18,108] Trial 17 finished with value: 0.09135025300597223 and parameters: {'model_type': 'gcn', 'hidden_dims': '[128, 64]', 'dropout': 0.5023764840287924, 'batch_norm': True, 'lr': 0.0004316698161142987, 'weight_decay': 6.65496788673904e-05, 'epochs': 153, 'loss': 'mae', 'optimizer': 'adam', 'graph_mode': 'off', 'use_snp_selection': False}. Best is trial 17 with value: 0.09135025300597223.
[I 2025-11-03 11:55:20,204] Trial 18 finished with value: 0.012956331825463687 and parameters: {'model_type': 'gcn', 'hidden_dims': '[128, 64]', 'dropout': 0.496722732969213, 'batch_norm': False, 'lr': 0.00016733760154266994, 'weight_decay': 7.197637349971629e-05, 'epochs': 120, 'loss': 'mae', 'optimizer': 'adam', 'graph_mode': 'off', 'use_snp_selection': True, 'num_snps': 58241}. Best is trial 17 with value: 0.09135025300597223.
[I 2025-11-03 11:55:21,001] Trial 19 finished with value: -0.010253727077294104 and parameters: {'model_type': 'gcn', 'hidden_dims': '[128, 64]', 'dropout': 0.5463690211280188, 'batch_norm': True, 'lr': 1.725931429091624e-05, 'weight_decay': 6.781491313995479e-05, 'epochs': 77, 'loss': 'mae', 'optimizer': 'adam', 'graph_mode': 'off', 'use_snp_selection': False}. Best is trial 17 with value: 0.09135025300597223.
[I 2025-11-03 11:55:23,177] Trial 20 finished with value: 0.08085277506227782 and parameters: {'model_type': 'gcn', 'hidden_dims': '[512, 256]', 'dropout': 0.47146663126798083, 'batch_norm': True, 'lr': 0.00041341180889758995, 'weight_decay': 6.714783628966817e-06, 'epochs': 173, 'loss': 'mae', 'optimizer': 'adam', 'graph_mode': 'off', 'use_snp_selection': False}. Best is trial 17 with value: 0.09135025300597223.
[I 2025-11-03 11:55:24,261] Trial 21 finished with value: 0.06804746183282444 and parameters: {'model_type': 'gcn', 'hidden_dims': '[128, 64]', 'dropout': 0.3426036956588672, 'batch_norm': True, 'lr': 0.0004940655189215167, 'weight_decay': 1.0863796298982378e-06, 'epochs': 170, 'loss': 'mae', 'optimizer': 'adam', 'graph_mode': 'off', 'use_snp_selection': False}. Best is trial 17 with value: 0.09135025300597223.
[I 2025-11-03 11:55:26,848] Trial 22 finished with value: 0.06611765933867525 and parameters: {'model_type': 'gcn', 'hidden_dims': '[512, 128]', 'dropout': 0.2134670728629386, 'batch_norm': True, 'lr': 0.00013125309290784544, 'weight_decay': 1.5399046505057312e-07, 'epochs': 228, 'loss': 'mae', 'optimizer': 'adam', 'graph_mode': 'off', 'use_snp_selection': False}. Best is trial 17 with value: 0.09135025300597223.
[I 2025-11-03 11:55:29,938] Trial 23 finished with value: 0.07731036638946988 and parameters: {'model_type': 'gcn', 'hidden_dims': '[512, 128]', 'dropout': 0.18072397639648616, 'batch_norm': True, 'lr': 0.0009284471673756117, 'weight_decay': 3.1393293951100876e-05, 'epochs': 288, 'loss': 'mae', 'optimizer': 'adam', 'graph_mode': 'off', 'use_snp_selection': False}. Best is trial 17 with value: 0.09135025300597223.
[I 2025-11-03 11:55:31,151] Trial 24 finished with value: 0.0785549364775375 and parameters: {'model_type': 'gcn', 'hidden_dims': '[128, 64]', 'dropout': 0.3134906031308018, 'batch_norm': True, 'lr': 0.0005588826868706272, 'weight_decay': 2.8594700928272414e-06, 'epochs': 199, 'loss': 'mae', 'optimizer': 'adam', 'graph_mode': 'off', 'use_snp_selection': False}. Best is trial 17 with value: 0.09135025300597223.
[I 2025-11-03 11:55:33,027] Trial 25 finished with value: 0.07405916895670889 and parameters: {'model_type': 'gcn', 'hidden_dims': '[512, 128]', 'dropout': 0.5335323239954018, 'batch_norm': True, 'lr': 0.00011465898504849449, 'weight_decay': 8.66067573600079e-06, 'epochs': 132, 'loss': 'mae', 'optimizer': 'adam', 'graph_mode': 'off', 'use_snp_selection': False}. Best is trial 17 with value: 0.09135025300597223.
[I 2025-11-03 11:55:33,846] Trial 26 finished with value: 0.006474618299631275 and parameters: {'model_type': 'gcn', 'hidden_dims': '[256, 128]', 'dropout': 0.24309751696333332, 'batch_norm': False, 'lr': 0.00039531976600027427, 'weight_decay': 0.00015265805543382738, 'epochs': 107, 'loss': 'mae', 'optimizer': 'adam', 'graph_mode': 'off', 'use_snp_selection': True, 'num_snps': 3842}. Best is trial 17 with value: 0.09135025300597223.
[I 2025-11-03 11:55:35,470] Trial 27 finished with value: 0.0785007996097275 and parameters: {'model_type': 'gcn', 'hidden_dims': '[256, 128, 64]', 'dropout': 0.14201787846424646, 'batch_norm': True, 'lr': 0.0005849645073981007, 'weight_decay': 9.92007027578569e-07, 'epochs': 178, 'loss': 'mae', 'optimizer': 'adam', 'graph_mode': 'off', 'use_snp_selection': False}. Best is trial 17 with value: 0.09135025300597223.
[I 2025-11-03 11:55:38,317] Trial 28 finished with value: 0.07470268457180645 and parameters: {'model_type': 'gcn', 'hidden_dims': '[512, 256]', 'dropout': 0.597478967603532, 'batch_norm': True, 'lr': 0.0003011965874761071, 'weight_decay': 2.905899669856454e-07, 'epochs': 254, 'loss': 'mae', 'optimizer': 'adam', 'graph_mode': 'off', 'use_snp_selection': False}. Best is trial 17 with value: 0.09135025300597223.
[I 2025-11-03 11:55:39,933] Trial 29 finished with value: 0.08706563364907316 and parameters: {'model_type': 'gcn', 'hidden_dims': '[128, 64]', 'dropout': 0.18573528609734802, 'batch_norm': True, 'lr': 0.00013050159889111014, 'weight_decay': 3.580635249841934e-05, 'epochs': 294, 'loss': 'mae', 'optimizer': 'adam', 'graph_mode': 'off', 'use_snp_selection': True, 'num_snps': 19468}. Best is trial 17 with value: 0.09135025300597223.
[I 2025-11-03 11:55:41,569] Trial 30 finished with value: 0.0352864107815754 and parameters: {'model_type': 'gcn', 'hidden_dims': '[128, 64]', 'dropout': 0.18156925331196544, 'batch_norm': True, 'lr': 2.7034606056978673e-05, 'weight_decay': 0.00010803940086829997, 'epochs': 318, 'loss': 'mae', 'optimizer': 'adam', 'graph_mode': 'off', 'use_snp_selection': True, 'num_snps': 18365}. Best is trial 17 with value: 0.09135025300597223.
[I 2025-11-03 11:55:43,164] Trial 31 finished with value: 0.04000104968461356 and parameters: {'model_type': 'gcn', 'hidden_dims': '[128, 64]', 'dropout': 0.1916936283070984, 'batch_norm': True, 'lr': 0.0001097549664468848, 'weight_decay': 1.284180599392984e-05, 'epochs': 292, 'loss': 'mae', 'optimizer': 'adam', 'graph_mode': 'off', 'use_snp_selection': True, 'num_snps': 20689}. Best is trial 17 with value: 0.09135025300597223.
[I 2025-11-03 11:55:44,944] Trial 32 finished with value: 0.061788627275767914 and parameters: {'model_type': 'gcn', 'hidden_dims': '[128, 64]', 'dropout': 0.12379044303776257, 'batch_norm': True, 'lr': 0.0001805630612099221, 'weight_decay': 4.742745389825516e-05, 'epochs': 349, 'loss': 'mae', 'optimizer': 'adam', 'graph_mode': 'off', 'use_snp_selection': True, 'num_snps': 20754}. Best is trial 17 with value: 0.09135025300597223.
[I 2025-11-03 11:55:47,135] Trial 33 finished with value: 0.07015745576970911 and parameters: {'model_type': 'gcn', 'hidden_dims': '[128, 64]', 'dropout': 0.20596758508242427, 'batch_norm': True, 'lr': 0.0009828695506208756, 'weight_decay': 6.3898015117063334e-06, 'epochs': 237, 'loss': 'mae', 'optimizer': 'adam', 'graph_mode': 'off', 'use_snp_selection': True, 'num_snps': 50127}. Best is trial 17 with value: 0.09135025300597223.
[I 2025-11-03 11:55:48,268] Trial 34 finished with value: 0.03711498009780602 and parameters: {'model_type': 'gcn', 'hidden_dims': '[512, 128]', 'dropout': 0.17008564072168483, 'batch_norm': True, 'lr': 0.0002841861648364189, 'weight_decay': 3.586058448145699e-05, 'epochs': 209, 'loss': 'mae', 'optimizer': 'adam', 'graph_mode': 'off', 'use_snp_selection': True, 'num_snps': 4311}. Best is trial 17 with value: 0.09135025300597223.
[I 2025-11-03 11:55:50,044] Trial 35 finished with value: 0.04837893891597379 and parameters: {'model_type': 'gcn', 'hidden_dims': '[256, 128]', 'dropout': 0.4236235193465832, 'batch_norm': False, 'lr': 0.000495261422826274, 'weight_decay': 2.0964181892187084e-05, 'epochs': 250, 'loss': 'mae', 'optimizer': 'adam', 'graph_mode': 'off', 'use_snp_selection': True, 'num_snps': 26222}. Best is trial 17 with value: 0.09135025300597223.
[I 2025-11-03 11:55:51,112] Trial 36 finished with value: 0.0392835487902187 and parameters: {'model_type': 'gcn', 'hidden_dims': '[128, 64]', 'dropout': 0.3676088083762732, 'batch_norm': True, 'lr': 8.785002966978005e-05, 'weight_decay': 0.000247158577632545, 'epochs': 162, 'loss': 'mse', 'optimizer': 'adam', 'graph_mode': 'off', 'use_snp_selection': False}. Best is trial 17 with value: 0.09135025300597223.
[I 2025-11-03 11:55:53,758] Trial 37 finished with value: 0.008464340623129262 and parameters: {'model_type': 'gcn', 'hidden_dims': '[256, 128, 64]', 'dropout': 0.4666138740276324, 'batch_norm': True, 'lr': 2.6246285399617145e-06, 'weight_decay': 0.0006307513011214727, 'epochs': 298, 'loss': 'mae', 'optimizer': 'adam', 'graph_mode': 'off', 'use_snp_selection': True, 'num_snps': 38290}. Best is trial 17 with value: 0.09135025300597223.
[I 2025-11-03 11:55:56,694] Trial 38 finished with value: 0.035119444804481724 and parameters: {'model_type': 'gcn', 'hidden_dims': '[512, 128]', 'dropout': 0.27052750889094596, 'batch_norm': False, 'lr': 0.000618797775983709, 'weight_decay': 2.452907924208634e-06, 'epochs': 271, 'loss': 'mse', 'optimizer': 'adam', 'graph_mode': 'off', 'use_snp_selection': False}. Best is trial 17 with value: 0.09135025300597223.
[I 2025-11-03 11:55:57,959] Trial 39 finished with value: 0.041944431928385574 and parameters: {'model_type': 'gcn', 'hidden_dims': '[128, 64]', 'dropout': 0.23472685141223326, 'batch_norm': True, 'lr': 3.504543559074626e-05, 'weight_decay': 0.00013096738720050168, 'epochs': 187, 'loss': 'mae', 'optimizer': 'adam', 'graph_mode': 'off', 'use_snp_selection': True, 'num_snps': 13361}. Best is trial 17 with value: 0.09135025300597223.
[I 2025-11-03 11:55:59,991] Trial 40 finished with value: 0.0759564971463636 and parameters: {'model_type': 'gcn', 'hidden_dims': '[512, 256]', 'dropout': 0.2971250787869487, 'batch_norm': True, 'lr': 0.00017149505405968348, 'weight_decay': 1.4842441397475827e-05, 'epochs': 151, 'loss': 'mae', 'optimizer': 'adam', 'graph_mode': 'off', 'use_snp_selection': False}. Best is trial 17 with value: 0.09135025300597223.
[I 2025-11-03 11:56:02,329] Trial 41 finished with value: 0.07325175297374814 and parameters: {'model_type': 'gcn', 'hidden_dims': '[512, 256]', 'dropout': 0.45325704508100656, 'batch_norm': True, 'lr': 0.0003859131054010171, 'weight_decay': 1.228510429657548e-05, 'epochs': 193, 'loss': 'mae', 'optimizer': 'adam', 'graph_mode': 'off', 'use_snp_selection': False}. Best is trial 17 with value: 0.09135025300597223.
[I 2025-11-03 11:56:04,360] Trial 42 finished with value: 0.07858763708198224 and parameters: {'model_type': 'gcn', 'hidden_dims': '[512, 256]', 'dropout': 0.5618236931925369, 'batch_norm': True, 'lr': 0.0003684063648256817, 'weight_decay': 6.541748534974031e-06, 'epochs': 155, 'loss': 'mae', 'optimizer': 'adam', 'graph_mode': 'off', 'use_snp_selection': False}. Best is trial 17 with value: 0.09135025300597223.
[I 2025-11-03 11:56:07,106] Trial 43 finished with value: 0.06232835598535975 and parameters: {'model_type': 'gcn', 'hidden_dims': '[512, 256]', 'dropout': 0.4978313092304018, 'batch_norm': True, 'lr': 0.0006763514478016023, 'weight_decay': 1.4095365489700082e-06, 'epochs': 237, 'loss': 'mae', 'optimizer': 'adam', 'graph_mode': 'off', 'use_snp_selection': False}. Best is trial 17 with value: 0.09135025300597223.
[I 2025-11-03 11:56:08,967] Trial 44 finished with value: 0.08300404124925899 and parameters: {'model_type': 'gcn', 'hidden_dims': '[512, 64]', 'dropout': 0.49550298768536793, 'batch_norm': True, 'lr': 0.00043968713902615346, 'weight_decay': 4.348499128194821e-06, 'epochs': 134, 'loss': 'mse', 'optimizer': 'adam', 'graph_mode': 'off', 'use_snp_selection': False}. Best is trial 17 with value: 0.09135025300597223.
[I 2025-11-03 11:56:10,533] Trial 45 finished with value: 0.05522562724314492 and parameters: {'model_type': 'gcn', 'hidden_dims': '[512, 64]', 'dropout': 0.12539907759971758, 'batch_norm': True, 'lr': 0.00024310235557593743, 'weight_decay': 4.353271056139539e-06, 'epochs': 87, 'loss': 'mse', 'optimizer': 'adam', 'graph_mode': 'off', 'use_snp_selection': False}. Best is trial 17 with value: 0.09135025300597223.
[I 2025-11-03 11:56:12,420] Trial 46 finished with value: 0.0679878226708215 and parameters: {'model_type': 'gcn', 'hidden_dims': '[512, 64]', 'dropout': 0.4013595215573008, 'batch_norm': True, 'lr': 0.0007384858408556906, 'weight_decay': 6.644315806592597e-07, 'epochs': 140, 'loss': 'mse', 'optimizer': 'adam', 'graph_mode': 'off', 'use_snp_selection': False}. Best is trial 17 with value: 0.09135025300597223.
[I 2025-11-03 11:56:14,140] Trial 47 finished with value: 0.03373501475824864 and parameters: {'model_type': 'gcn', 'hidden_dims': '[512, 64]', 'dropout': 0.5144446727754544, 'batch_norm': False, 'lr': 8.240101671305681e-06, 'weight_decay': 2.257064704462645e-05, 'epochs': 114, 'loss': 'mse', 'optimizer': 'adam', 'graph_mode': 'off', 'use_snp_selection': False}. Best is trial 17 with value: 0.09135025300597223.
[I 2025-11-03 11:56:17,579] Trial 48 finished with value: 0.062427040333310334 and parameters: {'model_type': 'gcn', 'hidden_dims': '[512, 64]', 'dropout': 0.16024278264981046, 'batch_norm': True, 'lr': 0.00020521126051188727, 'weight_decay': 2.041306741036746e-06, 'epochs': 331, 'loss': 'mse', 'optimizer': 'adam', 'graph_mode': 'off', 'use_snp_selection': False}. Best is trial 17 with value: 0.09135025300597223.
[I 2025-11-03 11:56:18,909] Trial 49 finished with value: 0.06905447156554576 and parameters: {'model_type': 'gcn', 'hidden_dims': '[512, 128]', 'dropout': 0.37054126102967727, 'batch_norm': True, 'lr': 7.826312306521526e-05, 'weight_decay': 3.6245327250382073e-06, 'epochs': 68, 'loss': 'mse', 'optimizer': 'adam', 'graph_mode': 'off', 'use_snp_selection': False}. Best is trial 17 with value: 0.09135025300597223.
[I 2025-11-03 11:56:20,360] Trial 50 finished with value: 0.03343141842311372 and parameters: {'model_type': 'gcn', 'hidden_dims': '[256, 128]', 'dropout': 0.12483376479641736, 'batch_norm': True, 'lr': 4.6418808719227614e-05, 'weight_decay': 4.934103627459134e-05, 'epochs': 129, 'loss': 'mse', 'optimizer': 'adam', 'graph_mode': 'off', 'use_snp_selection': True, 'num_snps': 26890}. Best is trial 17 with value: 0.09135025300597223.
[I 2025-11-03 11:56:22,491] Trial 51 finished with value: 0.07657522571083436 and parameters: {'model_type': 'gcn', 'hidden_dims': '[512, 256]', 'dropout': 0.4730112015441157, 'batch_norm': True, 'lr': 0.00043689451419169287, 'weight_decay': 7.465807810659718e-06, 'epochs': 166, 'loss': 'mae', 'optimizer': 'adam', 'graph_mode': 'off', 'use_snp_selection': False}. Best is trial 17 with value: 0.09135025300597223.
[I 2025-11-03 11:56:24,737] Trial 52 finished with value: 0.07823775872271053 and parameters: {'model_type': 'gcn', 'hidden_dims': '[512, 128]', 'dropout': 0.5062324184670357, 'batch_norm': True, 'lr': 0.0007496035633985112, 'weight_decay': 1.0107533548340154e-05, 'epochs': 182, 'loss': 'mae', 'optimizer': 'adam', 'graph_mode': 'off', 'use_snp_selection': False}. Best is trial 17 with value: 0.09135025300597223.
[I 2025-11-03 11:56:27,312] Trial 53 finished with value: 0.07440741930574966 and parameters: {'model_type': 'gcn', 'hidden_dims': '[512, 64]', 'dropout': 0.42873002267892624, 'batch_norm': True, 'lr': 0.0002809139822672529, 'weight_decay': 5.584500019403867e-06, 'epochs': 212, 'loss': 'mae', 'optimizer': 'adam', 'graph_mode': 'off', 'use_snp_selection': False}. Best is trial 17 with value: 0.09135025300597223.
[I 2025-11-03 11:56:29,808] Trial 54 finished with value: -0.009457502619406026 and parameters: {'model_type': 'gcn', 'hidden_dims': '[512, 128]', 'dropout': 0.555142304598264, 'batch_norm': True, 'lr': 1.0572812887040672e-06, 'weight_decay': 3.002962043796576e-06, 'epochs': 202, 'loss': 'mae', 'optimizer': 'adam', 'graph_mode': 'off', 'use_snp_selection': False}. Best is trial 17 with value: 0.09135025300597223.
[I 2025-11-03 11:56:31,248] Trial 55 finished with value: 0.09107652608149112 and parameters: {'model_type': 'gcn', 'hidden_dims': '[256, 128, 64]', 'dropout': 0.5264045353556555, 'batch_norm': True, 'lr': 0.0004796670577853519, 'weight_decay': 1.5176635781479221e-06, 'epochs': 143, 'loss': 'mse', 'optimizer': 'adam', 'graph_mode': 'off', 'use_snp_selection': False}. Best is trial 17 with value: 0.09135025300597223.
[I 2025-11-03 11:56:32,449] Trial 56 finished with value: 0.06745164361041624 and parameters: {'model_type': 'gcn', 'hidden_dims': '[256, 128, 64]', 'dropout': 0.5710965853162965, 'batch_norm': True, 'lr': 0.0001376699656526253, 'weight_decay': 1.4674975990791823e-06, 'epochs': 100, 'loss': 'mse', 'optimizer': 'adam', 'graph_mode': 'off', 'use_snp_selection': False}. Best is trial 17 with value: 0.09135025300597223.
[I 2025-11-03 11:56:33,826] Trial 57 finished with value: 0.006687158448592856 and parameters: {'model_type': 'gcn', 'hidden_dims': '[256, 128, 64]', 'dropout': 0.5308434691527059, 'batch_norm': False, 'lr': 0.0008025137415379021, 'weight_decay': 9.719575588491208e-07, 'epochs': 138, 'loss': 'mse', 'optimizer': 'adam', 'graph_mode': 'off', 'use_snp_selection': False}. Best is trial 17 with value: 0.09135025300597223.
[I 2025-11-03 11:56:35,803] Trial 58 finished with value: 0.07571168930263572 and parameters: {'model_type': 'gcn', 'hidden_dims': '[256, 128, 64]', 'dropout': 0.5772778584126619, 'batch_norm': True, 'lr': 0.0004912318122603823, 'weight_decay': 6.63154181256572e-07, 'epochs': 222, 'loss': 'mse', 'optimizer': 'adam', 'graph_mode': 'off', 'use_snp_selection': False}. Best is trial 17 with value: 0.09135025300597223.
[I 2025-11-03 11:56:37,372] Trial 59 finished with value: 0.0731561666941189 and parameters: {'model_type': 'gcn', 'hidden_dims': '[256, 128, 64]', 'dropout': 0.25321761563178097, 'batch_norm': True, 'lr': 0.0009960457659854167, 'weight_decay': 8.37572075056304e-05, 'epochs': 152, 'loss': 'mse', 'optimizer': 'adam', 'graph_mode': 'off', 'use_snp_selection': False}. Best is trial 17 with value: 0.09135025300597223.
[I 2025-11-03 11:56:38,927] Trial 60 finished with value: 0.0785788257945628 and parameters: {'model_type': 'gcn', 'hidden_dims': '[128, 64]', 'dropout': 0.22046949201523452, 'batch_norm': True, 'lr': 0.0003525028438098249, 'weight_decay': 3.658201364601477e-07, 'epochs': 306, 'loss': 'mse', 'optimizer': 'adam', 'graph_mode': 'off', 'use_snp_selection': False}. Best is trial 17 with value: 0.09135025300597223.
[I 2025-11-03 11:56:40,688] Trial 61 finished with value: 0.0727161600072738 and parameters: {'model_type': 'gcn', 'hidden_dims': '[512, 128]', 'dropout': 0.48938297736152386, 'batch_norm': True, 'lr': 0.0005720631607478507, 'weight_decay': 2.069310100157163e-06, 'epochs': 121, 'loss': 'mae', 'optimizer': 'adam', 'graph_mode': 'off', 'use_snp_selection': False}. Best is trial 17 with value: 0.09135025300597223.
[I 2025-11-03 11:56:41,849] Trial 62 finished with value: 0.08866680620816442 and parameters: {'model_type': 'gcn', 'hidden_dims': '[128, 64]', 'dropout': 0.4456224856514664, 'batch_norm': True, 'lr': 0.00026298064745133306, 'weight_decay': 4.476563690724075e-06, 'epochs': 162, 'loss': 'mae', 'optimizer': 'adam', 'graph_mode': 'off', 'use_snp_selection': False}. Best is trial 17 with value: 0.09135025300597223.
[I 2025-11-03 11:56:42,952] Trial 63 finished with value: 0.09581533016551708 and parameters: {'model_type': 'gcn', 'hidden_dims': '[128, 64]', 'dropout': 0.5298618621204992, 'batch_norm': True, 'lr': 0.00023651147614200572, 'weight_decay': 4.240132896152767e-06, 'epochs': 160, 'loss': 'mae', 'optimizer': 'adam', 'graph_mode': 'off', 'use_snp_selection': False}. Best is trial 63 with value: 0.09581533016551708.
[I 2025-11-03 11:56:44,068] Trial 64 finished with value: 0.0839913329786254 and parameters: {'model_type': 'gcn', 'hidden_dims': '[128, 64]', 'dropout': 0.5201717377288513, 'batch_norm': True, 'lr': 0.0002449019265260987, 'weight_decay': 3.059303682265119e-05, 'epochs': 162, 'loss': 'mae', 'optimizer': 'adam', 'graph_mode': 'off', 'use_snp_selection': False}. Best is trial 63 with value: 0.09581533016551708.
[I 2025-11-03 11:56:45,167] Trial 65 finished with value: 0.08809216540624946 and parameters: {'model_type': 'gcn', 'hidden_dims': '[128, 64]', 'dropout': 0.5211287821159646, 'batch_norm': True, 'lr': 0.00023453889258744377, 'weight_decay': 2.814133376279807e-05, 'epochs': 165, 'loss': 'mae', 'optimizer': 'adam', 'graph_mode': 'off', 'use_snp_selection': False}. Best is trial 63 with value: 0.09581533016551708.
