[I 2025-11-03 11:42:30,433] Trial 43 finished with value: 0.10580226755120764 and parameters: {'model_type': 'gcn', 'hidden_dims': '[256, 128, 64]', 'dropout': 0.16799802480758413, 'batch_norm': True, 'lr': 0.00015058317838474475, 'weight_decay': 2.4136090727818505e-05, 'epochs': 16, 'loss': 'mse', 'optimizer': 'adam', 'graph_mode': 'cutoff', 'cutoff': 0.5101393836023969, 'grm_norm': 'cosine_then_gcn', 'self_loops': True, 'use_snp_selection': False}. Best is trial 34 with value: 0.12224647455287384.
[I 2025-11-03 11:42:31,823] Trial 44 finished with value: 0.12016066555398355 and parameters: {'model_type': 'gcn', 'hidden_dims': '[256, 128, 64]', 'dropout': 0.26277597884069837, 'batch_norm': True, 'lr': 0.0007023379668720016, 'weight_decay': 0.0001642481968040394, 'epochs': 69, 'loss': 'mse', 'optimizer': 'adam', 'graph_mode': 'cutoff', 'cutoff': 0.5239143101101711, 'grm_norm': 'cosine_then_gcn', 'self_loops': False, 'use_snp_selection': False}. Best is trial 34 with value: 0.12224647455287384.
[I 2025-11-03 11:42:33,144] Trial 45 finished with value: 0.11817338017305566 and parameters: {'model_type': 'gcn', 'hidden_dims': '[256, 128]', 'dropout': 0.23497229819860063, 'batch_norm': True, 'lr': 0.0007317612727564727, 'weight_decay': 0.00023328398252719682, 'epochs': 78, 'loss': 'mse', 'optimizer': 'adam', 'graph_mode': 'cutoff', 'cutoff': 0.6462618119806919, 'grm_norm': 'cosine_then_gcn', 'self_loops': False, 'use_snp_selection': False}. Best is trial 34 with value: 0.12224647455287384.
[I 2025-11-03 11:42:34,405] Trial 46 finished with value: 0.11062776444977586 and parameters: {'model_type': 'gcn', 'hidden_dims': '[256, 128]', 'dropout': 0.269745540749436, 'batch_norm': True, 'lr': 0.0008046206763939762, 'weight_decay': 0.0002495589555118232, 'epochs': 66, 'loss': 'mae', 'optimizer': 'adam', 'graph_mode': 'cutoff', 'cutoff': 0.7245119495890844, 'grm_norm': 'none', 'self_loops': False, 'use_snp_selection': False}. Best is trial 34 with value: 0.12224647455287384.
[I 2025-11-03 11:42:35,578] Trial 47 finished with value: 0.01937055673449073 and parameters: {'model_type': 'gcn', 'hidden_dims': '[256, 128]', 'dropout': 0.24065905165051235, 'batch_norm': True, 'lr': 0.0002945430518562226, 'weight_decay': 0.0004517248546034537, 'epochs': 21, 'loss': 'mse', 'optimizer': 'adam', 'graph_mode': 'knn', 'source': 'grm', 'knn_k': 10, 'weighted_edges': False, 'symmetrize_mode': 'union', 'use_snp_selection': False}. Best is trial 34 with value: 0.12224647455287384.
[I 2025-11-03 11:42:37,788] Trial 48 finished with value: 0.029721766522899436 and parameters: {'model_type': 'gcn', 'hidden_dims': '[256, 128]', 'dropout': 0.2852794708190802, 'batch_norm': False, 'lr': 0.00018989784287130326, 'weight_decay': 0.0009264117708575181, 'epochs': 39, 'loss': 'mse', 'optimizer': 'adam', 'graph_mode': 'cutoff', 'cutoff': 0.5939998237215246, 'grm_norm': 'gcn', 'self_loops': False, 'use_snp_selection': True, 'num_snps': 42595}. Best is trial 34 with value: 0.12224647455287384.
[I 2025-11-03 11:42:39,057] Trial 49 finished with value: 0.052261103514306025 and parameters: {'model_type': 'gcn', 'hidden_dims': '[512, 64]', 'dropout': 0.22077984632950023, 'batch_norm': True, 'lr': 0.0007470302482177494, 'weight_decay': 0.00016450902079681367, 'epochs': 2, 'loss': 'mae', 'optimizer': 'adam', 'graph_mode': 'cutoff', 'cutoff': 0.824295579064126, 'grm_norm': 'cosine_then_gcn', 'self_loops': False, 'use_snp_selection': False}. Best is trial 34 with value: 0.12224647455287384.
[I 2025-11-03 11:42:40,556] Trial 50 finished with value: 0.040757294138820045 and parameters: {'model_type': 'gcn', 'hidden_dims': '[256, 128, 64]', 'dropout': 0.21631726050547784, 'batch_norm': True, 'lr': 0.0003472850315287618, 'weight_decay': 7.335182811472044e-05, 'epochs': 80, 'loss': 'mse', 'optimizer': 'adam', 'graph_mode': 'knn', 'source': 'grm', 'knn_k': 8, 'weighted_edges': False, 'symmetrize_mode': 'union', 'use_snp_selection': False}. Best is trial 34 with value: 0.12224647455287384.
[I 2025-11-03 11:42:42,245] Trial 51 finished with value: 0.11336605169427887 and parameters: {'model_type': 'gcn', 'hidden_dims': '[256, 128, 64]', 'dropout': 0.12192779268071294, 'batch_norm': True, 'lr': 0.0005026585124442214, 'weight_decay': 0.00036448259859974937, 'epochs': 131, 'loss': 'mse', 'optimizer': 'adam', 'graph_mode': 'cutoff', 'cutoff': 0.6507057710002909, 'grm_norm': 'cosine_then_gcn', 'self_loops': False, 'use_snp_selection': False}. Best is trial 34 with value: 0.12224647455287384.
[I 2025-11-03 11:42:43,729] Trial 52 finished with value: 0.11427558909014196 and parameters: {'model_type': 'gcn', 'hidden_dims': '[256, 128]', 'dropout': 0.25860785665281777, 'batch_norm': True, 'lr': 0.0005838186567349058, 'weight_decay': 0.00011403560849171013, 'epochs': 116, 'loss': 'mse', 'optimizer': 'adam', 'graph_mode': 'cutoff', 'cutoff': 0.6271300027865806, 'grm_norm': 'cosine_then_gcn', 'self_loops': False, 'use_snp_selection': False}. Best is trial 34 with value: 0.12224647455287384.
[I 2025-11-03 11:42:45,592] Trial 53 finished with value: 0.11807295272879581 and parameters: {'model_type': 'gcn', 'hidden_dims': '[256, 128, 64]', 'dropout': 0.17232444478462788, 'batch_norm': True, 'lr': 0.0008177816534187003, 'weight_decay': 6.02250809857407e-05, 'epochs': 168, 'loss': 'mse', 'optimizer': 'adam', 'graph_mode': 'cutoff', 'cutoff': 0.6887840550618739, 'grm_norm': 'cosine_then_gcn', 'self_loops': False, 'use_snp_selection': False}. Best is trial 34 with value: 0.12224647455287384.
[I 2025-11-03 11:42:47,136] Trial 54 finished with value: 0.1257725893707902 and parameters: {'model_type': 'gcn', 'hidden_dims': '[256, 128, 64]', 'dropout': 0.23975011478740296, 'batch_norm': True, 'lr': 0.0007915710736840747, 'weight_decay': 0.00018516254877028667, 'epochs': 101, 'loss': 'mse', 'optimizer': 'adam', 'graph_mode': 'cutoff', 'cutoff': 0.6999405848953412, 'grm_norm': 'cosine_then_gcn', 'self_loops': False, 'use_snp_selection': False}. Best is trial 54 with value: 0.1257725893707902.
[I 2025-11-03 11:42:48,637] Trial 55 finished with value: 0.10919095032741799 and parameters: {'model_type': 'gcn', 'hidden_dims': '[256, 128, 64]', 'dropout': 0.2362239895462736, 'batch_norm': True, 'lr': 0.0009820852570414029, 'weight_decay': 0.00020614596091921873, 'epochs': 92, 'loss': 'mse', 'optimizer': 'adam', 'graph_mode': 'cutoff', 'cutoff': 0.7137800861628691, 'grm_norm': 'cosine_then_gcn', 'self_loops': False, 'use_snp_selection': False}. Best is trial 54 with value: 0.1257725893707902.
[I 2025-11-03 11:42:49,912] Trial 56 finished with value: 0.07736712388092012 and parameters: {'model_type': 'gcn', 'hidden_dims': '[256, 128, 64]', 'dropout': 0.3093396231106529, 'batch_norm': True, 'lr': 0.0008028313564466464, 'weight_decay': 0.00015368948331557705, 'epochs': 41, 'loss': 'mae', 'optimizer': 'adam', 'graph_mode': 'cutoff', 'cutoff': 0.7723431061307134, 'grm_norm': 'cosine_then_gcn', 'self_loops': False, 'use_snp_selection': False}. Best is trial 54 with value: 0.1257725893707902.
[I 2025-11-03 11:42:51,538] Trial 57 finished with value: 0.10263170021905535 and parameters: {'model_type': 'gcn', 'hidden_dims': '[512, 64]', 'dropout': 0.2711901791165436, 'batch_norm': True, 'lr': 0.0002287172586596685, 'weight_decay': 0.00010110424798589708, 'epochs': 75, 'loss': 'mse', 'optimizer': 'adam', 'graph_mode': 'cutoff', 'cutoff': 0.6737710162695177, 'grm_norm': 'none', 'self_loops': False, 'use_snp_selection': False}. Best is trial 54 with value: 0.1257725893707902.
[I 2025-11-03 11:42:53,088] Trial 58 finished with value: 0.003254215339819687 and parameters: {'model_type': 'gcn', 'hidden_dims': '[256, 128, 64]', 'dropout': 0.20761784615937606, 'batch_norm': True, 'lr': 1.9532467582638195e-05, 'weight_decay': 6.339732755188808e-05, 'epochs': 103, 'loss': 'mse', 'optimizer': 'adam', 'graph_mode': 'cutoff', 'cutoff': 0.7466094386471873, 'grm_norm': 'cosine_then_gcn', 'self_loops': False, 'use_snp_selection': False}. Best is trial 54 with value: 0.1257725893707902.
[I 2025-11-03 11:42:54,438] Trial 59 finished with value: 0.026872309325987127 and parameters: {'model_type': 'gcn', 'hidden_dims': '[256, 128, 64]', 'dropout': 0.3322033152782109, 'batch_norm': True, 'lr': 4.808053575771938e-06, 'weight_decay': 0.00039653782467627413, 'epochs': 54, 'loss': 'mse', 'optimizer': 'adam', 'graph_mode': 'knn', 'source': 'grm', 'knn_k': 3, 'weighted_edges': True, 'symmetrize_mode': 'mutual', 'use_snp_selection': False}. Best is trial 54 with value: 0.1257725893707902.
[I 2025-11-03 11:42:55,837] Trial 60 finished with value: 0.12613582447066837 and parameters: {'model_type': 'gcn', 'hidden_dims': '[128, 64]', 'dropout': 0.28828376071821904, 'batch_norm': True, 'lr': 0.00027705515289717274, 'weight_decay': 0.0006798076129925215, 'epochs': 142, 'loss': 'mse', 'optimizer': 'adam', 'graph_mode': 'cutoff', 'cutoff': 0.8046716091261708, 'grm_norm': 'cosine_then_gcn', 'self_loops': False, 'use_snp_selection': False}. Best is trial 60 with value: 0.12613582447066837.
[I 2025-11-03 11:42:57,235] Trial 61 finished with value: 0.1359435621151581 and parameters: {'model_type': 'gcn', 'hidden_dims': '[128, 64]', 'dropout': 0.249528240678768, 'batch_norm': True, 'lr': 0.0003966168461227538, 'weight_decay': 0.0005990659656996565, 'epochs': 142, 'loss': 'mse', 'optimizer': 'adam', 'graph_mode': 'cutoff', 'cutoff': 0.8114812432729832, 'grm_norm': 'cosine_then_gcn', 'self_loops': False, 'use_snp_selection': False}. Best is trial 61 with value: 0.1359435621151581.
[I 2025-11-03 11:42:58,710] Trial 62 finished with value: 0.11771288232030927 and parameters: {'model_type': 'gcn', 'hidden_dims': '[128, 64]', 'dropout': 0.28740342466312585, 'batch_norm': True, 'lr': 0.0004020587535233097, 'weight_decay': 0.0005673108134189419, 'epochs': 166, 'loss': 'mse', 'optimizer': 'adam', 'graph_mode': 'cutoff', 'cutoff': 0.8782400634659666, 'grm_norm': 'cosine_then_gcn', 'self_loops': False, 'use_snp_selection': False}. Best is trial 61 with value: 0.1359435621151581.
[I 2025-11-03 11:43:00,090] Trial 63 finished with value: 0.11533140974902133 and parameters: {'model_type': 'gcn', 'hidden_dims': '[128, 64]', 'dropout': 0.2533519726774349, 'batch_norm': True, 'lr': 0.0007431436381606095, 'weight_decay': 0.0006935845965150852, 'epochs': 139, 'loss': 'mse', 'optimizer': 'adam', 'graph_mode': 'cutoff', 'cutoff': 0.8126784180958213, 'grm_norm': 'cosine_then_gcn', 'self_loops': False, 'use_snp_selection': False}. Best is trial 61 with value: 0.1359435621151581.
[I 2025-11-03 11:43:01,401] Trial 64 finished with value: 0.11224360977716435 and parameters: {'model_type': 'gcn', 'hidden_dims': '[128, 64]', 'dropout': 0.2744947175615406, 'batch_norm': True, 'lr': 0.0003037244253034474, 'weight_decay': 0.00026721279003308183, 'epochs': 122, 'loss': 'mse', 'optimizer': 'adam', 'graph_mode': 'cutoff', 'cutoff': 0.8942136859519703, 'grm_norm': 'cosine_then_gcn', 'self_loops': False, 'use_snp_selection': False}. Best is trial 61 with value: 0.1359435621151581.
[I 2025-11-03 11:43:02,782] Trial 65 finished with value: 0.11649243191086667 and parameters: {'model_type': 'gcn', 'hidden_dims': '[128, 64]', 'dropout': 0.23005784016033612, 'batch_norm': True, 'lr': 0.000271247989544595, 'weight_decay': 0.0009232907694410043, 'epochs': 145, 'loss': 'mse', 'optimizer': 'adam', 'graph_mode': 'cutoff', 'cutoff': 0.8337935699048042, 'grm_norm': 'cosine_then_gcn', 'self_loops': False, 'use_snp_selection': False}. Best is trial 61 with value: 0.1359435621151581.
[I 2025-11-03 11:43:04,139] Trial 66 finished with value: 0.09777389311842162 and parameters: {'model_type': 'gcn', 'hidden_dims': '[128, 64]', 'dropout': 0.29920330508117987, 'batch_norm': True, 'lr': 0.0008146223483848471, 'weight_decay': 0.00019929704470055288, 'epochs': 135, 'loss': 'mae', 'optimizer': 'adam', 'graph_mode': 'cutoff', 'cutoff': 0.8056935455353821, 'grm_norm': 'cosine_then_gcn', 'self_loops': False, 'use_snp_selection': False}. Best is trial 61 with value: 0.1359435621151581.
[I 2025-11-03 11:43:05,890] Trial 67 finished with value: 0.059021509822842835 and parameters: {'model_type': 'gcn', 'hidden_dims': '[128, 64]', 'dropout': 0.25328629618348675, 'batch_norm': False, 'lr': 0.0003852502126374132, 'weight_decay': 0.00043930327675697356, 'epochs': 193, 'loss': 'mse', 'optimizer': 'adam', 'graph_mode': 'cutoff', 'cutoff': 0.8618595698396663, 'grm_norm': 'cosine', 'self_loops': False, 'use_snp_selection': True, 'num_snps': 17897}. Best is trial 61 with value: 0.1359435621151581.
[I 2025-11-03 11:43:08,182] Trial 68 finished with value: 0.08388804194200278 and parameters: {'model_type': 'gcn', 'hidden_dims': '[512, 128]', 'dropout': 0.3342537715387194, 'batch_norm': True, 'lr': 0.00018657413923885719, 'weight_decay': 0.0003185555871246048, 'epochs': 210, 'loss': 'mse', 'optimizer': 'adam', 'graph_mode': 'cutoff', 'cutoff': 0.48096116613015, 'grm_norm': 'cosine_then_gcn', 'self_loops': False, 'use_snp_selection': False}. Best is trial 61 with value: 0.1359435621151581.
[I 2025-11-03 11:43:09,835] Trial 69 finished with value: 0.11003026957919732 and parameters: {'model_type': 'gcn', 'hidden_dims': '[256, 128]', 'dropout': 0.23950982409895188, 'batch_norm': True, 'lr': 0.000871641605828018, 'weight_decay': 0.0007534107913294654, 'epochs': 175, 'loss': 'mse', 'optimizer': 'adam', 'graph_mode': 'cutoff', 'cutoff': 0.7035072264244805, 'grm_norm': 'gcn', 'self_loops': False, 'use_snp_selection': False}. Best is trial 61 with value: 0.1359435621151581.
[I 2025-11-03 11:43:10,986] Trial 70 finished with value: 0.09444725278901406 and parameters: {'model_type': 'gcn', 'hidden_dims': '[128, 64]', 'dropout': 0.20278676703652748, 'batch_norm': True, 'lr': 0.0006387129529149055, 'weight_decay': 0.00022852814340846618, 'epochs': 66, 'loss': 'mse', 'optimizer': 'adam', 'graph_mode': 'cutoff', 'cutoff': 0.542157623252977, 'grm_norm': 'cosine_then_gcn', 'self_loops': False, 'use_snp_selection': False}. Best is trial 61 with value: 0.1359435621151581.
[I 2025-11-03 11:43:12,483] Trial 71 finished with value: 0.12059814909264811 and parameters: {'model_type': 'gcn', 'hidden_dims': '[256, 128, 64]', 'dropout': 0.1608853704823645, 'batch_norm': True, 'lr': 0.0004314498586816687, 'weight_decay': 0.0001667437791186026, 'epochs': 95, 'loss': 'mse', 'optimizer': 'adam', 'graph_mode': 'cutoff', 'cutoff': 0.7437103186015875, 'grm_norm': 'cosine_then_gcn', 'self_loops': False, 'use_snp_selection': False}. Best is trial 61 with value: 0.1359435621151581.
[I 2025-11-03 11:43:13,924] Trial 72 finished with value: 0.09947320183926406 and parameters: {'model_type': 'gcn', 'hidden_dims': '[256, 128, 64]', 'dropout': 0.16699700200346382, 'batch_norm': True, 'lr': 0.000423358795123784, 'weight_decay': 0.00016681145941710034, 'epochs': 85, 'loss': 'mse', 'optimizer': 'adam', 'graph_mode': 'cutoff', 'cutoff': 0.737119592019807, 'grm_norm': 'cosine_then_gcn', 'self_loops': False, 'use_snp_selection': False}. Best is trial 61 with value: 0.1359435621151581.
[I 2025-11-03 11:43:16,561] Trial 73 finished with value: 0.10536491521244051 and parameters: {'model_type': 'gcn', 'hidden_dims': '[256, 128, 64]', 'dropout': 0.21908562761091094, 'batch_norm': True, 'lr': 0.0005901462881041787, 'weight_decay': 0.0005091570666175025, 'epochs': 350, 'loss': 'mse', 'optimizer': 'adam', 'graph_mode': 'cutoff', 'cutoff': 0.7845069961636211, 'grm_norm': 'cosine_then_gcn', 'self_loops': False, 'use_snp_selection': False}. Best is trial 61 with value: 0.1359435621151581.
[I 2025-11-03 11:43:18,279] Trial 74 finished with value: 0.11503186054764426 and parameters: {'model_type': 'gcn', 'hidden_dims': '[512, 64]', 'dropout': 0.14105029252944312, 'batch_norm': True, 'lr': 0.00031163497965138175, 'weight_decay': 0.000355605304781425, 'epochs': 99, 'loss': 'mse', 'optimizer': 'adam', 'graph_mode': 'cutoff', 'cutoff': 0.6891304253724768, 'grm_norm': 'cosine_then_gcn', 'self_loops': False, 'use_snp_selection': False}. Best is trial 61 with value: 0.1359435621151581.
[I 2025-11-03 11:43:19,914] Trial 75 finished with value: 0.060899355113376887 and parameters: {'model_type': 'gcn', 'hidden_dims': '[256, 128, 64]', 'dropout': 0.31889831806309077, 'batch_norm': True, 'lr': 0.00012039630124678864, 'weight_decay': 0.0001375911827440593, 'epochs': 127, 'loss': 'mse', 'optimizer': 'adam', 'graph_mode': 'cutoff', 'cutoff': 0.573743984091855, 'grm_norm': 'cosine_then_gcn', 'self_loops': False, 'use_snp_selection': False}. Best is trial 61 with value: 0.1359435621151581.
[I 2025-11-03 11:43:21,057] Trial 76 finished with value: 0.0997236549435642 and parameters: {'model_type': 'gcn', 'hidden_dims': '[128, 64]', 'dropout': 0.19664185296079137, 'batch_norm': True, 'lr': 0.00045969171256072204, 'weight_decay': 4.788127020604418e-05, 'epochs': 67, 'loss': 'mse', 'optimizer': 'adam', 'graph_mode': 'cutoff', 'cutoff': 0.7558714414273248, 'grm_norm': 'cosine', 'self_loops': False, 'use_snp_selection': False}. Best is trial 61 with value: 0.1359435621151581.
[I 2025-11-03 11:43:22,872] Trial 77 finished with value: 0.11095286315560142 and parameters: {'model_type': 'gcn', 'hidden_dims': '[256, 128, 64]', 'dropout': 0.1673620291863512, 'batch_norm': True, 'lr': 0.0009856594397815804, 'weight_decay': 0.00010345243213117934, 'epochs': 166, 'loss': 'mse', 'optimizer': 'adam', 'graph_mode': 'cutoff', 'cutoff': 0.7979021552758018, 'grm_norm': 'cosine_then_gcn', 'self_loops': False, 'use_snp_selection': False}. Best is trial 61 with value: 0.1359435621151581.
[I 2025-11-03 11:43:25,690] Trial 78 finished with value: 0.021066954190425598 and parameters: {'model_type': 'gcn', 'hidden_dims': '[256, 128]', 'dropout': 0.26455240550715, 'batch_norm': False, 'lr': 0.0007333309306671363, 'weight_decay': 0.0002968161749193255, 'epochs': 148, 'loss': 'mse', 'optimizer': 'adam', 'graph_mode': 'knn', 'source': 'grm', 'knn_k': 5, 'weighted_edges': False, 'symmetrize_mode': 'union', 'use_snp_selection': True, 'num_snps': 49628}. Best is trial 61 with value: 0.1359435621151581.
[I 2025-11-03 11:43:27,507] Trial 79 finished with value: 0.0845048004839934 and parameters: {'model_type': 'gcn', 'hidden_dims': '[512, 128]', 'dropout': 0.24640825061856567, 'batch_norm': True, 'lr': 0.0002435034318737858, 'weight_decay': 0.00018213073509870767, 'epochs': 113, 'loss': 'mse', 'optimizer': 'adam', 'graph_mode': 'cutoff', 'cutoff': 0.8516229170508725, 'grm_norm': 'cosine_then_gcn', 'self_loops': False, 'use_snp_selection': False}. Best is trial 61 with value: 0.1359435621151581.
[I 2025-11-03 11:43:29,396] Trial 80 finished with value: 0.09907232579548364 and parameters: {'model_type': 'gcn', 'hidden_dims': '[256, 128, 64]', 'dropout': 0.2869488913561448, 'batch_norm': True, 'lr': 0.0005880057858431016, 'weight_decay': 0.0007570730883372976, 'epochs': 187, 'loss': 'mae', 'optimizer': 'adam', 'graph_mode': 'cutoff', 'cutoff': 0.7183468003151813, 'grm_norm': 'none', 'self_loops': False, 'use_snp_selection': False}. Best is trial 61 with value: 0.1359435621151581.
[I 2025-11-03 11:43:30,903] Trial 81 finished with value: 0.10718815035252524 and parameters: {'model_type': 'gcn', 'hidden_dims': '[256, 128, 64]', 'dropout': 0.2254302118088916, 'batch_norm': True, 'lr': 0.0004973597087743647, 'weight_decay': 7.966277250564115e-05, 'epochs': 99, 'loss': 'mse', 'optimizer': 'adam', 'graph_mode': 'cutoff', 'cutoff': 0.655524633766334, 'grm_norm': 'cosine_then_gcn', 'self_loops': False, 'use_snp_selection': False}. Best is trial 61 with value: 0.1359435621151581.
[I 2025-11-03 11:43:32,332] Trial 82 finished with value: 0.10824721252814022 and parameters: {'model_type': 'gcn', 'hidden_dims': '[256, 128, 64]', 'dropout': 0.20896350727705232, 'batch_norm': True, 'lr': 0.0003806420870283641, 'weight_decay': 0.00011789557338269727, 'epochs': 82, 'loss': 'mse', 'optimizer': 'adam', 'graph_mode': 'cutoff', 'cutoff': 0.6901025586699694, 'grm_norm': 'cosine_then_gcn', 'self_loops': False, 'use_snp_selection': False}. Best is trial 61 with value: 0.1359435621151581.
[I 2025-11-03 11:43:34,386] Trial 83 finished with value: 0.11326371881753652 and parameters: {'model_type': 'gcn', 'hidden_dims': '[256, 128, 64]', 'dropout': 0.11589566177961214, 'batch_norm': True, 'lr': 0.0006580325449123865, 'weight_decay': 0.00024854491259464667, 'epochs': 219, 'loss': 'mse', 'optimizer': 'adam', 'graph_mode': 'cutoff', 'cutoff': 0.6048850651998618, 'grm_norm': 'cosine_then_gcn', 'self_loops': False, 'use_snp_selection': False}. Best is trial 61 with value: 0.1359435621151581.
[I 2025-11-03 11:43:35,858] Trial 84 finished with value: 0.11148870479828019 and parameters: {'model_type': 'gcn', 'hidden_dims': '[256, 128, 64]', 'dropout': 0.1629630813066034, 'batch_norm': True, 'lr': 0.0005301033117046273, 'weight_decay': 6.163556203565492e-05, 'epochs': 92, 'loss': 'mse', 'optimizer': 'adam', 'graph_mode': 'cutoff', 'cutoff': 0.7647212411796517, 'grm_norm': 'cosine_then_gcn', 'self_loops': False, 'use_snp_selection': False}. Best is trial 61 with value: 0.1359435621151581.
[I 2025-11-03 11:43:37,622] Trial 85 finished with value: 0.11211480181358925 and parameters: {'model_type': 'gcn', 'hidden_dims': '[256, 128, 64]', 'dropout': 0.14203006321279393, 'batch_norm': True, 'lr': 0.0008213709464096221, 'weight_decay': 2.0685452031201637e-05, 'epochs': 156, 'loss': 'mse', 'optimizer': 'adam', 'graph_mode': 'cutoff', 'cutoff': 0.665564573225481, 'grm_norm': 'cosine_then_gcn', 'self_loops': False, 'use_snp_selection': False}. Best is trial 61 with value: 0.1359435621151581.
