[I 2025-11-03 11:53:26,655] Trial 112 finished with value: -0.009847705591229404 and parameters: {'model_type': 'gcn', 'hidden_dims': '[512, 256]', 'dropout': 0.14883377065379425, 'batch_norm': True, 'lr': 9.208410704831335e-06, 'weight_decay': 8.007086246992664e-07, 'epochs': 286, 'loss': 'mse', 'optimizer': 'adam', 'graph_mode': 'off', 'use_snp_selection': False}. Best is trial 15 with value: 0.09769708887569035.
[I 2025-11-03 11:53:28,807] Trial 113 finished with value: 0.019100066177551334 and parameters: {'model_type': 'gcn', 'hidden_dims': '[512, 256]', 'dropout': 0.17470653546926002, 'batch_norm': True, 'lr': 4.379265787736898e-05, 'weight_decay': 8.221314994947098e-07, 'epochs': 261, 'loss': 'mse', 'optimizer': 'adam', 'graph_mode': 'off', 'use_snp_selection': False}. Best is trial 15 with value: 0.09769708887569035.
[I 2025-11-03 11:53:31,190] Trial 114 finished with value: 0.05769411078666072 and parameters: {'model_type': 'gcn', 'hidden_dims': '[512, 256]', 'dropout': 0.1371470698286883, 'batch_norm': True, 'lr': 0.00028945475828747136, 'weight_decay': 5.992732053870505e-07, 'epochs': 304, 'loss': 'mse', 'optimizer': 'adam', 'graph_mode': 'off', 'use_snp_selection': False}. Best is trial 15 with value: 0.09769708887569035.
[I 2025-11-03 11:53:33,445] Trial 115 finished with value: 0.05620291174608508 and parameters: {'model_type': 'gcn', 'hidden_dims': '[512, 128]', 'dropout': 0.38596983186383305, 'batch_norm': True, 'lr': 6.300490199007357e-05, 'weight_decay': 2.2679663310336718e-06, 'epochs': 274, 'loss': 'mse', 'optimizer': 'adam', 'graph_mode': 'off', 'use_snp_selection': False}. Best is trial 15 with value: 0.09769708887569035.
[I 2025-11-03 11:53:35,924] Trial 116 finished with value: 0.0379674823737831 and parameters: {'model_type': 'gcn', 'hidden_dims': '[512, 256]', 'dropout': 0.18468408021973665, 'batch_norm': True, 'lr': 3.0508865730235906e-05, 'weight_decay': 1.1696740205948594e-06, 'epochs': 321, 'loss': 'mse', 'optimizer': 'adam', 'graph_mode': 'off', 'use_snp_selection': False}. Best is trial 15 with value: 0.09769708887569035.
[I 2025-11-03 11:53:38,411] Trial 117 finished with value: 0.054768211122344736 and parameters: {'model_type': 'gcn', 'hidden_dims': '[512, 256]', 'dropout': 0.2093655068178465, 'batch_norm': True, 'lr': 3.722501848017461e-05, 'weight_decay': 4.2163021034269425e-07, 'epochs': 312, 'loss': 'mse', 'optimizer': 'adam', 'graph_mode': 'off', 'use_snp_selection': False}. Best is trial 15 with value: 0.09769708887569035.
[I 2025-11-03 11:53:40,622] Trial 118 finished with value: 0.06255564075681647 and parameters: {'model_type': 'gcn', 'hidden_dims': '[512, 256]', 'dropout': 0.11111876822340798, 'batch_norm': True, 'lr': 0.00018892417387799141, 'weight_decay': 1.8273106392805233e-06, 'epochs': 267, 'loss': 'mse', 'optimizer': 'adam', 'graph_mode': 'off', 'use_snp_selection': False}. Best is trial 15 with value: 0.09769708887569035.
[I 2025-11-03 11:53:42,182] Trial 119 finished with value: 0.04872064879157075 and parameters: {'model_type': 'gcn', 'hidden_dims': '[256, 128, 64]', 'dropout': 0.12259517093132295, 'batch_norm': False, 'lr': 0.00038436725182668064, 'weight_decay': 2.712238130157424e-06, 'epochs': 268, 'loss': 'mse', 'optimizer': 'adam', 'graph_mode': 'off', 'use_snp_selection': True, 'num_snps': 16095}. Best is trial 15 with value: 0.09769708887569035.
[I 2025-11-03 11:53:44,274] Trial 120 finished with value: 0.06977959082230174 and parameters: {'model_type': 'gcn', 'hidden_dims': '[512, 128]', 'dropout': 0.10609860685220665, 'batch_norm': True, 'lr': 0.00022406505727219235, 'weight_decay': 1.7000371458322058e-06, 'epochs': 241, 'loss': 'mse', 'optimizer': 'adam', 'graph_mode': 'off', 'use_snp_selection': False}. Best is trial 15 with value: 0.09769708887569035.
[I 2025-11-03 11:53:46,384] Trial 121 finished with value: 0.049575070431735646 and parameters: {'model_type': 'gcn', 'hidden_dims': '[512, 128]', 'dropout': 0.10890922560942431, 'batch_norm': True, 'lr': 0.00017908356284204865, 'weight_decay': 3.927511466552193e-06, 'epochs': 241, 'loss': 'mse', 'optimizer': 'adam', 'graph_mode': 'off', 'use_snp_selection': False}. Best is trial 15 with value: 0.09769708887569035.
[I 2025-11-03 11:53:48,288] Trial 122 finished with value: 0.06398661302133479 and parameters: {'model_type': 'gcn', 'hidden_dims': '[512, 128]', 'dropout': 0.10740136397551862, 'batch_norm': True, 'lr': 0.00020397960722917186, 'weight_decay': 1.8689111115044007e-06, 'epochs': 220, 'loss': 'mse', 'optimizer': 'adam', 'graph_mode': 'off', 'use_snp_selection': False}. Best is trial 15 with value: 0.09769708887569035.
[I 2025-11-03 11:53:50,212] Trial 123 finished with value: 0.06119415598034714 and parameters: {'model_type': 'gcn', 'hidden_dims': '[512, 128]', 'dropout': 0.10770218176449102, 'batch_norm': True, 'lr': 0.0001524778493785747, 'weight_decay': 2.086068574282951e-06, 'epochs': 217, 'loss': 'mse', 'optimizer': 'adam', 'graph_mode': 'off', 'use_snp_selection': False}. Best is trial 15 with value: 0.09769708887569035.
[I 2025-11-03 11:53:52,157] Trial 124 finished with value: 0.0448541417588338 and parameters: {'model_type': 'gcn', 'hidden_dims': '[512, 128]', 'dropout': 0.1011763349673969, 'batch_norm': True, 'lr': 0.00020796241897383947, 'weight_decay': 1.328647561030926e-06, 'epochs': 220, 'loss': 'mse', 'optimizer': 'adam', 'graph_mode': 'off', 'use_snp_selection': False}. Best is trial 15 with value: 0.09769708887569035.
[I 2025-11-03 11:53:54,158] Trial 125 finished with value: 0.0526339922229157 and parameters: {'model_type': 'gcn', 'hidden_dims': '[512, 128]', 'dropout': 0.11020705136497559, 'batch_norm': True, 'lr': 8.444192957883147e-05, 'weight_decay': 1.9749529598095054e-06, 'epochs': 227, 'loss': 'mse', 'optimizer': 'adam', 'graph_mode': 'off', 'use_snp_selection': False}. Best is trial 15 with value: 0.09769708887569035.
[I 2025-11-03 11:53:56,179] Trial 126 finished with value: 0.05239008484615126 and parameters: {'model_type': 'gcn', 'hidden_dims': '[512, 128]', 'dropout': 0.12444195472661121, 'batch_norm': True, 'lr': 0.00014981317542480941, 'weight_decay': 1.8268922728094763e-06, 'epochs': 234, 'loss': 'mse', 'optimizer': 'adam', 'graph_mode': 'off', 'use_snp_selection': False}. Best is trial 15 with value: 0.09769708887569035.
[I 2025-11-03 11:53:58,013] Trial 127 finished with value: 0.04630693961475888 and parameters: {'model_type': 'gcn', 'hidden_dims': '[512, 128]', 'dropout': 0.1132991019843711, 'batch_norm': True, 'lr': 0.00025442534010692604, 'weight_decay': 2.5433705874859384e-06, 'epochs': 201, 'loss': 'mae', 'optimizer': 'adam', 'graph_mode': 'off', 'use_snp_selection': False}. Best is trial 15 with value: 0.09769708887569035.
[I 2025-11-03 11:53:59,843] Trial 128 finished with value: 0.07022236974197121 and parameters: {'model_type': 'gcn', 'hidden_dims': '[512, 128]', 'dropout': 0.14692761411848518, 'batch_norm': True, 'lr': 0.00034479117884115684, 'weight_decay': 3.7174838279789243e-06, 'epochs': 188, 'loss': 'mse', 'optimizer': 'adam', 'graph_mode': 'off', 'use_snp_selection': False}. Best is trial 15 with value: 0.09769708887569035.
[I 2025-11-03 11:54:01,687] Trial 129 finished with value: 0.05220420982113177 and parameters: {'model_type': 'gcn', 'hidden_dims': '[512, 128]', 'dropout': 0.1512606098378334, 'batch_norm': True, 'lr': 0.00014461154423509344, 'weight_decay': 3.453996012851215e-06, 'epochs': 196, 'loss': 'mse', 'optimizer': 'adam', 'graph_mode': 'off', 'use_snp_selection': False}. Best is trial 15 with value: 0.09769708887569035.
[I 2025-11-03 11:54:03,272] Trial 130 finished with value: 0.04708282044100766 and parameters: {'model_type': 'gcn', 'hidden_dims': '[512, 128]', 'dropout': 0.13292098350216283, 'batch_norm': True, 'lr': 0.00020217351352632722, 'weight_decay': 2.897546547370983e-06, 'epochs': 168, 'loss': 'mse', 'optimizer': 'adam', 'graph_mode': 'off', 'use_snp_selection': True, 'num_snps': 26579}. Best is trial 15 with value: 0.09769708887569035.
[I 2025-11-03 11:54:05,069] Trial 131 finished with value: -0.010688925217216712 and parameters: {'model_type': 'gcn', 'hidden_dims': '[512, 128]', 'dropout': 0.12171152029859536, 'batch_norm': True, 'lr': 4.229010616265793e-06, 'weight_decay': 1.4772162123889725e-06, 'epochs': 188, 'loss': 'mse', 'optimizer': 'adam', 'graph_mode': 'off', 'use_snp_selection': False}. Best is trial 15 with value: 0.09769708887569035.
[I 2025-11-03 11:54:06,822] Trial 132 finished with value: 0.06165770317559586 and parameters: {'model_type': 'gcn', 'hidden_dims': '[512, 128]', 'dropout': 0.10197470797191197, 'batch_norm': True, 'lr': 0.00023860205125051387, 'weight_decay': 4.315418865639524e-06, 'epochs': 182, 'loss': 'mse', 'optimizer': 'adam', 'graph_mode': 'off', 'use_snp_selection': False}. Best is trial 15 with value: 0.09769708887569035.
[I 2025-11-03 11:54:08,737] Trial 133 finished with value: 0.05654735211127996 and parameters: {'model_type': 'gcn', 'hidden_dims': '[512, 128]', 'dropout': 0.10146507612082355, 'batch_norm': True, 'lr': 0.00031294317977921364, 'weight_decay': 4.332815031559061e-06, 'epochs': 208, 'loss': 'mse', 'optimizer': 'adam', 'graph_mode': 'off', 'use_snp_selection': False}. Best is trial 15 with value: 0.09769708887569035.
[I 2025-11-03 11:54:10,532] Trial 134 finished with value: 0.055693735136870974 and parameters: {'model_type': 'gcn', 'hidden_dims': '[512, 128]', 'dropout': 0.1161515616253821, 'batch_norm': True, 'lr': 0.0003523601369030495, 'weight_decay': 2.2918529918446895e-06, 'epochs': 183, 'loss': 'mse', 'optimizer': 'adam', 'graph_mode': 'off', 'use_snp_selection': False}. Best is trial 15 with value: 0.09769708887569035.
[I 2025-11-03 11:54:12,282] Trial 135 finished with value: 0.03256959968507786 and parameters: {'model_type': 'gcn', 'hidden_dims': '[512, 128]', 'dropout': 0.1487135451154433, 'batch_norm': True, 'lr': 0.0005145371526639408, 'weight_decay': 6.182897684618445e-06, 'epochs': 178, 'loss': 'mse', 'optimizer': 'adam', 'graph_mode': 'off', 'use_snp_selection': False}. Best is trial 15 with value: 0.09769708887569035.
[I 2025-11-03 11:54:14,291] Trial 136 finished with value: 0.05266993829491973 and parameters: {'model_type': 'gcn', 'hidden_dims': '[512, 128]', 'dropout': 0.11054711017834587, 'batch_norm': False, 'lr': 0.0003340041114443979, 'weight_decay': 4.005392171290219e-06, 'epochs': 244, 'loss': 'mse', 'optimizer': 'adam', 'graph_mode': 'off', 'use_snp_selection': False}. Best is trial 15 with value: 0.09769708887569035.
[I 2025-11-03 11:54:15,927] Trial 137 finished with value: 0.032497005381300244 and parameters: {'model_type': 'gcn', 'hidden_dims': '[512, 128]', 'dropout': 0.5282764304059637, 'batch_norm': True, 'lr': 0.00021737584357385501, 'weight_decay': 1.013517833389174e-06, 'epochs': 149, 'loss': 'mse', 'optimizer': 'adam', 'graph_mode': 'off', 'use_snp_selection': False}. Best is trial 15 with value: 0.09769708887569035.
[I 2025-11-03 11:54:17,896] Trial 138 finished with value: 0.053309791649758714 and parameters: {'model_type': 'gcn', 'hidden_dims': '[512, 128]', 'dropout': 0.1361526712876379, 'batch_norm': True, 'lr': 0.00017864858413914567, 'weight_decay': 1.99494278805546e-06, 'epochs': 216, 'loss': 'mse', 'optimizer': 'adam', 'graph_mode': 'off', 'use_snp_selection': False}. Best is trial 15 with value: 0.09769708887569035.
[I 2025-11-03 11:54:19,600] Trial 139 finished with value: 0.04207167693458281 and parameters: {'model_type': 'gcn', 'hidden_dims': '[512, 128]', 'dropout': 0.10043381721514112, 'batch_norm': True, 'lr': 0.00010322680055692664, 'weight_decay': 1.507432154189804e-06, 'epochs': 164, 'loss': 'mse', 'optimizer': 'adam', 'graph_mode': 'off', 'use_snp_selection': False}. Best is trial 15 with value: 0.09769708887569035.
[I 2025-11-03 11:54:20,698] Trial 140 finished with value: 0.05967919618753559 and parameters: {'model_type': 'gcn', 'hidden_dims': '[256, 128]', 'dropout': 0.12243045383184303, 'batch_norm': True, 'lr': 0.00024110301539265484, 'weight_decay': 2.870288046837569e-06, 'epochs': 134, 'loss': 'mse', 'optimizer': 'adam', 'graph_mode': 'off', 'use_snp_selection': False}. Best is trial 15 with value: 0.09769708887569035.
[I 2025-11-03 11:54:22,843] Trial 141 finished with value: 0.042413602668664514 and parameters: {'model_type': 'gcn', 'hidden_dims': '[512, 128]', 'dropout': 0.14460584744066438, 'batch_norm': True, 'lr': 2.5703489099549616e-05, 'weight_decay': 3.6541615058799754e-06, 'epochs': 253, 'loss': 'mse', 'optimizer': 'adam', 'graph_mode': 'off', 'use_snp_selection': False}. Best is trial 15 with value: 0.09769708887569035.
[I 2025-11-03 11:54:24,579] Trial 142 finished with value: 0.027280671530254715 and parameters: {'model_type': 'gcn', 'hidden_dims': '[512, 128]', 'dropout': 0.361312141920357, 'batch_norm': True, 'lr': 6.796336320633338e-06, 'weight_decay': 6.801551023214673e-07, 'epochs': 173, 'loss': 'mse', 'optimizer': 'adam', 'graph_mode': 'off', 'use_snp_selection': False}. Best is trial 15 with value: 0.09769708887569035.
[I 2025-11-03 11:54:26,382] Trial 143 finished with value: 0.03244613093373736 and parameters: {'model_type': 'gcn', 'hidden_dims': '[512, 128]', 'dropout': 0.4104412040706729, 'batch_norm': True, 'lr': 6.501236129064324e-05, 'weight_decay': 5.649606823977248e-06, 'epochs': 193, 'loss': 'mse', 'optimizer': 'adam', 'graph_mode': 'off', 'use_snp_selection': False}. Best is trial 15 with value: 0.09769708887569035.
[I 2025-11-03 11:54:28,368] Trial 144 finished with value: 0.04146600578697298 and parameters: {'model_type': 'gcn', 'hidden_dims': '[512, 64]', 'dropout': 0.3855888373475406, 'batch_norm': True, 'lr': 5.287960053605804e-06, 'weight_decay': 1.1711681472077597e-06, 'epochs': 227, 'loss': 'mse', 'optimizer': 'adam', 'graph_mode': 'off', 'use_snp_selection': False}. Best is trial 15 with value: 0.09769708887569035.
[I 2025-11-03 11:54:30,351] Trial 145 finished with value: 0.05747654849367764 and parameters: {'model_type': 'gcn', 'hidden_dims': '[512, 128]', 'dropout': 0.11038066900258851, 'batch_norm': True, 'lr': 0.00019075034089083328, 'weight_decay': 4.469462481943862e-05, 'epochs': 222, 'loss': 'mse', 'optimizer': 'adam', 'graph_mode': 'off', 'use_snp_selection': False}. Best is trial 15 with value: 0.09769708887569035.
[I 2025-11-03 11:54:31,934] Trial 146 finished with value: 0.035946920942927806 and parameters: {'model_type': 'gcn', 'hidden_dims': '[256, 128, 64]', 'dropout': 0.3458100721229829, 'batch_norm': True, 'lr': 3.3935934227176555e-05, 'weight_decay': 3.0394380332673607e-06, 'epochs': 210, 'loss': 'mse', 'optimizer': 'adam', 'graph_mode': 'off', 'use_snp_selection': False}. Best is trial 15 with value: 0.09769708887569035.
[I 2025-11-03 11:54:34,256] Trial 147 finished with value: 0.01342255868192947 and parameters: {'model_type': 'gcn', 'hidden_dims': '[512, 128]', 'dropout': 0.12943124399251676, 'batch_norm': False, 'lr': 4.5331313647083596e-05, 'weight_decay': 1.802067539411403e-06, 'epochs': 237, 'loss': 'mse', 'optimizer': 'adam', 'graph_mode': 'off', 'use_snp_selection': True, 'num_snps': 40591}. Best is trial 15 with value: 0.09769708887569035.
[I 2025-11-03 11:54:36,362] Trial 148 finished with value: 0.0424029932568757 and parameters: {'model_type': 'gcn', 'hidden_dims': '[512, 128]', 'dropout': 0.1375630657735019, 'batch_norm': True, 'lr': 0.0002454591299363234, 'weight_decay': 9.160811956137738e-07, 'epochs': 255, 'loss': 'mse', 'optimizer': 'adam', 'graph_mode': 'off', 'use_snp_selection': False}. Best is trial 15 with value: 0.09769708887569035.
[I 2025-11-03 11:54:38,571] Trial 149 finished with value: 0.06440583396241467 and parameters: {'model_type': 'gcn', 'hidden_dims': '[512, 128]', 'dropout': 0.2792749404938462, 'batch_norm': True, 'lr': 5.1644973290930275e-05, 'weight_decay': 2.234767352405685e-06, 'epochs': 263, 'loss': 'mse', 'optimizer': 'adam', 'graph_mode': 'off', 'use_snp_selection': False}. Best is trial 15 with value: 0.09769708887569035.
[I 2025-11-03 11:54:40,880] Trial 0 finished with value: -0.002351435213221593 and parameters: {'model_type': 'gcn', 'hidden_dims': '[128, 64]', 'dropout': 0.199031432379812, 'batch_norm': True, 'lr': 1.8408544111075837e-06, 'weight_decay': 5.5136510071208614e-05, 'epochs': 336, 'loss': 'mae', 'optimizer': 'adam', 'graph_mode': 'off', 'use_snp_selection': True, 'num_snps': 43862}. Best is trial 0 with value: -0.002351435213221593.
[I 2025-11-03 11:54:42,686] Trial 1 finished with value: 0.05200275727706432 and parameters: {'model_type': 'gcn', 'hidden_dims': '[256, 128]', 'dropout': 0.4370668075331726, 'batch_norm': True, 'lr': 7.133471581159139e-05, 'weight_decay': 1.128633586803549e-05, 'epochs': 242, 'loss': 'mae', 'optimizer': 'adam', 'graph_mode': 'off', 'use_snp_selection': False}. Best is trial 1 with value: 0.05200275727706432.
[I 2025-11-03 11:54:43,892] Trial 2 finished with value: 0.013002195726347459 and parameters: {'model_type': 'gcn', 'hidden_dims': '[256, 128, 64]', 'dropout': 0.41314357415569625, 'batch_norm': False, 'lr': 3.952233718592101e-06, 'weight_decay': 0.00026754769258252603, 'epochs': 149, 'loss': 'mse', 'optimizer': 'adam', 'graph_mode': 'off', 'use_snp_selection': True, 'num_snps': 11571}. Best is trial 1 with value: 0.05200275727706432.
[I 2025-11-03 11:54:47,203] Trial 3 finished with value: 0.03739520926935948 and parameters: {'model_type': 'gcn', 'hidden_dims': '[512, 64]', 'dropout': 0.5938127374509361, 'batch_norm': False, 'lr': 5.67704586114731e-06, 'weight_decay': 2.4518087630137052e-05, 'epochs': 320, 'loss': 'mae', 'optimizer': 'adam', 'graph_mode': 'off', 'use_snp_selection': False}. Best is trial 1 with value: 0.05200275727706432.
[I 2025-11-03 11:54:49,933] Trial 4 finished with value: -0.013818109656967352 and parameters: {'model_type': 'gcn', 'hidden_dims': '[512, 128]', 'dropout': 0.25746343592134413, 'batch_norm': True, 'lr': 1.3467657668402788e-06, 'weight_decay': 0.00033087251918647806, 'epochs': 277, 'loss': 'mse', 'optimizer': 'adam', 'graph_mode': 'off', 'use_snp_selection': True, 'num_snps': 36675}. Best is trial 1 with value: 0.05200275727706432.
[I 2025-11-03 11:54:51,827] Trial 5 finished with value: 0.008306394534486353 and parameters: {'model_type': 'gcn', 'hidden_dims': '[512, 64]', 'dropout': 0.38275350994408375, 'batch_norm': True, 'lr': 1.5586664309232824e-06, 'weight_decay': 0.0008227664668621182, 'epochs': 145, 'loss': 'mae', 'optimizer': 'adam', 'graph_mode': 'off', 'use_snp_selection': True, 'num_snps': 32148}. Best is trial 1 with value: 0.05200275727706432.
[I 2025-11-03 11:54:53,384] Trial 6 finished with value: 0.04806663299135088 and parameters: {'model_type': 'gcn', 'hidden_dims': '[256, 128]', 'dropout': 0.3930109900265879, 'batch_norm': False, 'lr': 4.892964372128395e-05, 'weight_decay': 1.5809549317992182e-06, 'epochs': 199, 'loss': 'mse', 'optimizer': 'adam', 'graph_mode': 'off', 'use_snp_selection': False}. Best is trial 1 with value: 0.05200275727706432.
[I 2025-11-03 11:54:54,945] Trial 7 finished with value: 0.05030196510317438 and parameters: {'model_type': 'gcn', 'hidden_dims': '[512, 256]', 'dropout': 0.15343979219678458, 'batch_norm': True, 'lr': 6.234003099047341e-05, 'weight_decay': 3.894760610535477e-07, 'epochs': 97, 'loss': 'mse', 'optimizer': 'adam', 'graph_mode': 'off', 'use_snp_selection': False}. Best is trial 1 with value: 0.05200275727706432.
[I 2025-11-03 11:54:58,271] Trial 8 finished with value: 0.06258780425594002 and parameters: {'model_type': 'gcn', 'hidden_dims': '[512, 128]', 'dropout': 0.10743001231661406, 'batch_norm': True, 'lr': 0.00023728538449271062, 'weight_decay': 1.7629071578048637e-05, 'epochs': 312, 'loss': 'mae', 'optimizer': 'adam', 'graph_mode': 'off', 'use_snp_selection': False}. Best is trial 8 with value: 0.06258780425594002.
[I 2025-11-03 11:55:00,526] Trial 9 finished with value: 0.06823721282339251 and parameters: {'model_type': 'gcn', 'hidden_dims': '[512, 64]', 'dropout': 0.14505336736221927, 'batch_norm': True, 'lr': 5.8619638388111826e-05, 'weight_decay': 6.200156172669308e-07, 'epochs': 175, 'loss': 'mse', 'optimizer': 'adam', 'graph_mode': 'off', 'use_snp_selection': False}. Best is trial 9 with value: 0.06823721282339251.
[I 2025-11-03 11:55:01,650] Trial 10 finished with value: -0.009856954304368988 and parameters: {'model_type': 'gcn', 'hidden_dims': '[512, 64]', 'dropout': 0.2753166624526289, 'batch_norm': False, 'lr': 0.00032393778075602147, 'weight_decay': 1.1714031539166645e-07, 'epochs': 44, 'loss': 'mse', 'optimizer': 'adam', 'graph_mode': 'off', 'use_snp_selection': False}. Best is trial 9 with value: 0.06823721282339251.
[I 2025-11-03 11:55:04,161] Trial 11 finished with value: 0.07128654272989755 and parameters: {'model_type': 'gcn', 'hidden_dims': '[512, 128]', 'dropout': 0.10095648685224448, 'batch_norm': True, 'lr': 0.0007381466848241794, 'weight_decay': 1.969664044175748e-06, 'epochs': 216, 'loss': 'mae', 'optimizer': 'adam', 'graph_mode': 'off', 'use_snp_selection': False}. Best is trial 11 with value: 0.07128654272989755.
[I 2025-11-03 11:55:06,701] Trial 12 finished with value: 0.0873186023536236 and parameters: {'model_type': 'gcn', 'hidden_dims': '[512, 128]', 'dropout': 0.10344600881777158, 'batch_norm': True, 'lr': 0.0006753264773209732, 'weight_decay': 2.0975627484345868e-06, 'epochs': 208, 'loss': 'mae', 'optimizer': 'adam', 'graph_mode': 'off', 'use_snp_selection': False}. Best is trial 12 with value: 0.0873186023536236.
[I 2025-11-03 11:55:09,447] Trial 13 finished with value: 0.08304991829359058 and parameters: {'model_type': 'gcn', 'hidden_dims': '[512, 128]', 'dropout': 0.24637176605202246, 'batch_norm': True, 'lr': 0.0006882846823941375, 'weight_decay': 2.6819409307287284e-06, 'epochs': 236, 'loss': 'mae', 'optimizer': 'adam', 'graph_mode': 'off', 'use_snp_selection': False}. Best is trial 12 with value: 0.0873186023536236.
