[I 2025-11-03 13:40:17,064] Trial 125 finished with value: 0.04497523544966417 and parameters: {'model_type': 'graphsage', 'hidden_dims': '[512, 128]', 'dropout': 0.38210438292630866, 'batch_norm': True, 'lr': 9.847084715239385e-05, 'weight_decay': 2.932460537304339e-06, 'epochs': 339, 'loss': 'mae', 'optimizer': 'adam', 'graph_mode': 'cutoff', 'cutoff': 0.5351719439054059, 'grm_norm': 'cosine_then_gcn', 'self_loops': False, 'use_snp_selection': False}. Best is trial 19 with value: 0.09185206122090518.
[I 2025-11-03 13:40:21,555] Trial 126 finished with value: 0.04382020027417356 and parameters: {'model_type': 'graphsage', 'hidden_dims': '[512, 128]', 'dropout': 0.42657106095031283, 'batch_norm': True, 'lr': 9.594846705413161e-05, 'weight_decay': 1.374825998706269e-06, 'epochs': 339, 'loss': 'mae', 'optimizer': 'adam', 'graph_mode': 'cutoff', 'cutoff': 0.5467328599555865, 'grm_norm': 'cosine_then_gcn', 'self_loops': False, 'use_snp_selection': False}. Best is trial 19 with value: 0.09185206122090518.
[I 2025-11-03 13:40:24,171] Trial 127 finished with value: 0.05684358136845458 and parameters: {'model_type': 'graphsage', 'hidden_dims': '[512, 128]', 'dropout': 0.3777374739523573, 'batch_norm': False, 'lr': 5.072975803858207e-05, 'weight_decay': 3.6194895835948986e-06, 'epochs': 329, 'loss': 'mse', 'optimizer': 'adam', 'graph_mode': 'cutoff', 'cutoff': 0.5925708224396254, 'grm_norm': 'cosine_then_gcn', 'self_loops': False, 'use_snp_selection': True, 'num_snps': 10820}. Best is trial 19 with value: 0.09185206122090518.
[I 2025-11-03 13:40:26,662] Trial 128 finished with value: 0.040358134129672055 and parameters: {'model_type': 'graphsage', 'hidden_dims': '[512, 128]', 'dropout': 0.3800766707663716, 'batch_norm': True, 'lr': 7.044875626975839e-05, 'weight_decay': 2.0403642216042357e-06, 'epochs': 350, 'loss': 'mse', 'optimizer': 'adam', 'graph_mode': 'cutoff', 'cutoff': 0.586380417216627, 'grm_norm': 'cosine_then_gcn', 'self_loops': False, 'use_snp_selection': True, 'num_snps': 2119}. Best is trial 19 with value: 0.09185206122090518.
[I 2025-11-03 13:40:31,086] Trial 129 finished with value: -0.0025098709695123367 and parameters: {'model_type': 'graphsage', 'hidden_dims': '[512, 128]', 'dropout': 0.4012800182596137, 'batch_norm': False, 'lr': 0.00010421422552710123, 'weight_decay': 4.8462205511992645e-06, 'epochs': 333, 'loss': 'mae', 'optimizer': 'adam', 'graph_mode': 'cutoff', 'cutoff': 0.6320188513260563, 'grm_norm': 'cosine_then_gcn', 'self_loops': False, 'use_snp_selection': False}. Best is trial 19 with value: 0.09185206122090518.
[I 2025-11-03 13:40:34,929] Trial 130 finished with value: 0.014873731156908173 and parameters: {'model_type': 'graphsage', 'hidden_dims': '[512, 128]', 'dropout': 0.4493064520710678, 'batch_norm': False, 'lr': 8.044338807499632e-05, 'weight_decay': 4.044255585486826e-06, 'epochs': 326, 'loss': 'mse', 'optimizer': 'adam', 'graph_mode': 'cutoff', 'cutoff': 0.47361017934814215, 'grm_norm': 'cosine_then_gcn', 'self_loops': False, 'use_snp_selection': True, 'num_snps': 34075}. Best is trial 19 with value: 0.09185206122090518.
[I 2025-11-03 13:40:37,578] Trial 131 finished with value: 0.021109378227627852 and parameters: {'model_type': 'graphsage', 'hidden_dims': '[512, 128]', 'dropout': 0.37161953006217835, 'batch_norm': False, 'lr': 4.3265879718231e-05, 'weight_decay': 2.5396503888061543e-06, 'epochs': 344, 'loss': 'mse', 'optimizer': 'adam', 'graph_mode': 'cutoff', 'cutoff': 0.5415721803445552, 'grm_norm': 'cosine_then_gcn', 'self_loops': False, 'use_snp_selection': True, 'num_snps': 10303}. Best is trial 19 with value: 0.09185206122090518.
[I 2025-11-03 13:40:40,301] Trial 132 finished with value: 0.020044489094752774 and parameters: {'model_type': 'graphsage', 'hidden_dims': '[512, 128]', 'dropout': 0.5008550216889771, 'batch_norm': False, 'lr': 5.778537438532011e-05, 'weight_decay': 3.7287988096379967e-06, 'epochs': 332, 'loss': 'mse', 'optimizer': 'adam', 'graph_mode': 'cutoff', 'cutoff': 0.5759532355018272, 'grm_norm': 'cosine_then_gcn', 'self_loops': False, 'use_snp_selection': True, 'num_snps': 12565}. Best is trial 19 with value: 0.09185206122090518.
[I 2025-11-03 13:40:42,715] Trial 133 finished with value: 0.029270930277617742 and parameters: {'model_type': 'graphsage', 'hidden_dims': '[512, 128]', 'dropout': 0.3441249321320358, 'batch_norm': False, 'lr': 6.21173195174974e-05, 'weight_decay': 3.0894562006933957e-06, 'epochs': 337, 'loss': 'mse', 'optimizer': 'adam', 'graph_mode': 'cutoff', 'cutoff': 0.6095612875881423, 'grm_norm': 'cosine_then_gcn', 'self_loops': False, 'use_snp_selection': True, 'num_snps': 5628}. Best is trial 19 with value: 0.09185206122090518.
[I 2025-11-03 13:40:45,355] Trial 134 finished with value: 0.03525334584346799 and parameters: {'model_type': 'graphsage', 'hidden_dims': '[256, 128, 64]', 'dropout': 0.39052193551013836, 'batch_norm': False, 'lr': 8.718399520612417e-05, 'weight_decay': 2.1179986770534017e-06, 'epochs': 320, 'loss': 'mse', 'optimizer': 'adam', 'graph_mode': 'cutoff', 'cutoff': 0.5105730838846602, 'grm_norm': 'cosine_then_gcn', 'self_loops': False, 'use_snp_selection': True, 'num_snps': 3877}. Best is trial 19 with value: 0.09185206122090518.
[I 2025-11-03 13:40:47,224] Trial 135 finished with value: 0.031128938347362665 and parameters: {'model_type': 'graphsage', 'hidden_dims': '[256, 128]', 'dropout': 0.36338609607376837, 'batch_norm': False, 'lr': 0.00015006675033585565, 'weight_decay': 1.6280573117211386e-06, 'epochs': 177, 'loss': 'mse', 'optimizer': 'adam', 'graph_mode': 'cutoff', 'cutoff': 0.4600875481958224, 'grm_norm': 'cosine', 'self_loops': False, 'use_snp_selection': True, 'num_snps': 7928}. Best is trial 19 with value: 0.09185206122090518.
[I 2025-11-03 13:40:51,484] Trial 136 finished with value: 0.056300930736793015 and parameters: {'model_type': 'graphsage', 'hidden_dims': '[512, 64]', 'dropout': 0.40859957637067784, 'batch_norm': True, 'lr': 4.809397150745157e-05, 'weight_decay': 9.447011629564249e-07, 'epochs': 308, 'loss': 'mae', 'optimizer': 'adam', 'graph_mode': 'cutoff', 'cutoff': 0.7169941135481114, 'grm_norm': 'cosine_then_gcn', 'self_loops': False, 'use_snp_selection': False}. Best is trial 19 with value: 0.09185206122090518.
[I 2025-11-03 13:40:55,804] Trial 137 finished with value: 0.01719249624621451 and parameters: {'model_type': 'graphsage', 'hidden_dims': '[512, 128]', 'dropout': 0.4072296879781705, 'batch_norm': True, 'lr': 5.2745066075530204e-05, 'weight_decay': 1.3755487632126379e-05, 'epochs': 313, 'loss': 'mae', 'optimizer': 'adam', 'graph_mode': 'cutoff', 'cutoff': 0.8983135362160947, 'grm_norm': 'cosine_then_gcn', 'self_loops': False, 'use_snp_selection': False}. Best is trial 19 with value: 0.09185206122090518.
[I 2025-11-03 13:41:00,194] Trial 138 finished with value: 0.02469778968619737 and parameters: {'model_type': 'graphsage', 'hidden_dims': '[512, 64]', 'dropout': 0.3818450439099306, 'batch_norm': True, 'lr': 4.6208581743145554e-05, 'weight_decay': 8.274708664788357e-07, 'epochs': 326, 'loss': 'mae', 'optimizer': 'adam', 'graph_mode': 'cutoff', 'cutoff': 0.7150347428997287, 'grm_norm': 'cosine_then_gcn', 'self_loops': False, 'use_snp_selection': False}. Best is trial 19 with value: 0.09185206122090518.
[I 2025-11-03 13:41:03,651] Trial 139 finished with value: 0.048447116629145054 and parameters: {'model_type': 'graphsage', 'hidden_dims': '[256, 128, 64]', 'dropout': 0.41278573228531734, 'batch_norm': True, 'lr': 0.00012328757043338605, 'weight_decay': 4.600556042896142e-07, 'epochs': 345, 'loss': 'mae', 'optimizer': 'adam', 'graph_mode': 'cutoff', 'cutoff': 0.7538252797504925, 'grm_norm': 'cosine_then_gcn', 'self_loops': False, 'use_snp_selection': False}. Best is trial 19 with value: 0.09185206122090518.
[I 2025-11-03 13:41:07,106] Trial 140 finished with value: 0.06351177775723209 and parameters: {'model_type': 'graphsage', 'hidden_dims': '[256, 128, 64]', 'dropout': 0.4122694650844015, 'batch_norm': True, 'lr': 3.463660897400819e-05, 'weight_decay': 3.691358018225207e-07, 'epochs': 345, 'loss': 'mae', 'optimizer': 'adam', 'graph_mode': 'cutoff', 'cutoff': 0.8036079641377448, 'grm_norm': 'cosine_then_gcn', 'self_loops': False, 'use_snp_selection': False}. Best is trial 19 with value: 0.09185206122090518.
[I 2025-11-03 13:41:10,557] Trial 141 finished with value: 0.059823087135014684 and parameters: {'model_type': 'graphsage', 'hidden_dims': '[256, 128, 64]', 'dropout': 0.394425295497268, 'batch_norm': True, 'lr': 3.9549543136987375e-05, 'weight_decay': 3.0926506611922943e-07, 'epochs': 345, 'loss': 'mae', 'optimizer': 'adam', 'graph_mode': 'cutoff', 'cutoff': 0.8326175347569307, 'grm_norm': 'cosine_then_gcn', 'self_loops': False, 'use_snp_selection': False}. Best is trial 19 with value: 0.09185206122090518.
[I 2025-11-03 13:41:14,006] Trial 142 finished with value: 0.012821482771616212 and parameters: {'model_type': 'graphsage', 'hidden_dims': '[256, 128, 64]', 'dropout': 0.39746972436365025, 'batch_norm': True, 'lr': 3.4276633342829416e-05, 'weight_decay': 2.9695135048943834e-07, 'epochs': 345, 'loss': 'mae', 'optimizer': 'adam', 'graph_mode': 'cutoff', 'cutoff': 0.8277000038871536, 'grm_norm': 'cosine_then_gcn', 'self_loops': False, 'use_snp_selection': False}. Best is trial 19 with value: 0.09185206122090518.
[I 2025-11-03 13:41:17,488] Trial 143 finished with value: 0.036230928296236024 and parameters: {'model_type': 'graphsage', 'hidden_dims': '[256, 128, 64]', 'dropout': 0.4113556971028826, 'batch_norm': True, 'lr': 2.5967410100482294e-05, 'weight_decay': 3.1693176705442126e-07, 'epochs': 350, 'loss': 'mae', 'optimizer': 'adam', 'graph_mode': 'cutoff', 'cutoff': 0.8238808366888332, 'grm_norm': 'cosine_then_gcn', 'self_loops': False, 'use_snp_selection': False}. Best is trial 19 with value: 0.09185206122090518.
[I 2025-11-03 13:41:20,931] Trial 144 finished with value: 0.04413071562132995 and parameters: {'model_type': 'graphsage', 'hidden_dims': '[256, 128, 64]', 'dropout': 0.4160421460514557, 'batch_norm': True, 'lr': 3.608935389770365e-05, 'weight_decay': 4.804700510210566e-07, 'epochs': 343, 'loss': 'mae', 'optimizer': 'adam', 'graph_mode': 'cutoff', 'cutoff': 0.7679456888526821, 'grm_norm': 'cosine_then_gcn', 'self_loops': False, 'use_snp_selection': False}. Best is trial 19 with value: 0.09185206122090518.
[I 2025-11-03 13:41:24,310] Trial 145 finished with value: 0.045272045065681686 and parameters: {'model_type': 'graphsage', 'hidden_dims': '[256, 128, 64]', 'dropout': 0.43184430948476626, 'batch_norm': True, 'lr': 3.892747567714113e-05, 'weight_decay': 1.1086478653234372e-07, 'epochs': 332, 'loss': 'mae', 'optimizer': 'adam', 'graph_mode': 'cutoff', 'cutoff': 0.8065273758163306, 'grm_norm': 'cosine_then_gcn', 'self_loops': False, 'use_snp_selection': False}. Best is trial 19 with value: 0.09185206122090518.
[I 2025-11-03 13:41:27,678] Trial 146 finished with value: 0.037356872845044346 and parameters: {'model_type': 'graphsage', 'hidden_dims': '[256, 128, 64]', 'dropout': 0.395109834297472, 'batch_norm': True, 'lr': 3.086828521870211e-05, 'weight_decay': 1.2940049928481244e-07, 'epochs': 330, 'loss': 'mae', 'optimizer': 'adam', 'graph_mode': 'cutoff', 'cutoff': 0.8090208648712145, 'grm_norm': 'cosine_then_gcn', 'self_loops': False, 'use_snp_selection': False}. Best is trial 19 with value: 0.09185206122090518.
[I 2025-11-03 13:41:31,001] Trial 147 finished with value: 0.038647051726757704 and parameters: {'model_type': 'graphsage', 'hidden_dims': '[256, 128, 64]', 'dropout': 0.41972012720994495, 'batch_norm': True, 'lr': 4.788462243502604e-05, 'weight_decay': 1.9506243852937458e-07, 'epochs': 322, 'loss': 'mae', 'optimizer': 'adam', 'graph_mode': 'cutoff', 'cutoff': 0.7414355990752042, 'grm_norm': 'cosine_then_gcn', 'self_loops': False, 'use_snp_selection': False}. Best is trial 19 with value: 0.09185206122090518.
[I 2025-11-03 13:41:34,244] Trial 148 finished with value: 0.030679725529514243 and parameters: {'model_type': 'graphsage', 'hidden_dims': '[256, 128, 64]', 'dropout': 0.5199476768727048, 'batch_norm': True, 'lr': 4.2354049833025566e-05, 'weight_decay': 5.848071738016892e-07, 'epochs': 308, 'loss': 'mae', 'optimizer': 'adam', 'graph_mode': 'cutoff', 'cutoff': 0.8693618864119085, 'grm_norm': 'cosine_then_gcn', 'self_loops': False, 'use_snp_selection': False}. Best is trial 19 with value: 0.09185206122090518.
[I 2025-11-03 13:41:37,664] Trial 149 finished with value: 0.0157900948688967 and parameters: {'model_type': 'graphsage', 'hidden_dims': '[256, 128, 64]', 'dropout': 0.43245040643346777, 'batch_norm': True, 'lr': 3.894637414591179e-05, 'weight_decay': 1.8727964061562432e-07, 'epochs': 339, 'loss': 'mae', 'optimizer': 'adam', 'graph_mode': 'cutoff', 'cutoff': 0.7970087158405231, 'grm_norm': 'cosine_then_gcn', 'self_loops': False, 'use_snp_selection': False}. Best is trial 19 with value: 0.09185206122090518.
[I 2025-11-03 13:41:40,608] Trial 0 finished with value: 0.013018603732549554 and parameters: {'model_type': 'graphsage', 'hidden_dims': '[128, 64]', 'dropout': 0.199031432379812, 'batch_norm': True, 'lr': 1.8408544111075837e-06, 'weight_decay': 5.5136510071208614e-05, 'epochs': 336, 'loss': 'mae', 'optimizer': 'adam', 'graph_mode': 'knn', 'source': 'grm', 'knn_k': 8, 'weighted_edges': True, 'symmetrize_mode': 'mutual', 'use_snp_selection': False}. Best is trial 0 with value: 0.013018603732549554.
[I 2025-11-03 13:41:42,303] Trial 1 finished with value: 0.02988547026529745 and parameters: {'model_type': 'graphsage', 'hidden_dims': '[128, 64]', 'dropout': 0.40051947670227217, 'batch_norm': True, 'lr': 0.0005320428882732732, 'weight_decay': 1.89210117736594e-06, 'epochs': 68, 'loss': 'mse', 'optimizer': 'adam', 'graph_mode': 'knn', 'source': 'grm', 'knn_k': 7, 'weighted_edges': True, 'symmetrize_mode': 'union', 'use_snp_selection': False}. Best is trial 1 with value: 0.02988547026529745.
[I 2025-11-03 13:41:45,048] Trial 2 finished with value: 0.01861882910576795 and parameters: {'model_type': 'graphsage', 'hidden_dims': '[256, 128]', 'dropout': 0.5105528289184642, 'batch_norm': False, 'lr': 0.0006804279372404962, 'weight_decay': 0.0008922815224257085, 'epochs': 181, 'loss': 'mse', 'optimizer': 'adam', 'graph_mode': 'cutoff', 'cutoff': 0.5741905641612706, 'grm_norm': 'gcn', 'self_loops': False, 'use_snp_selection': True, 'num_snps': 26910}. Best is trial 1 with value: 0.02988547026529745.
[I 2025-11-03 13:41:47,909] Trial 3 finished with value: 0.03981047441941555 and parameters: {'model_type': 'graphsage', 'hidden_dims': '[256, 128, 64]', 'dropout': 0.5390483213624292, 'batch_norm': False, 'lr': 3.4705625989073525e-05, 'weight_decay': 2.4623319020131338e-05, 'epochs': 121, 'loss': 'mse', 'optimizer': 'adam', 'graph_mode': 'knn', 'source': 'grm', 'knn_k': 6, 'weighted_edges': False, 'symmetrize_mode': 'mutual', 'use_snp_selection': True, 'num_snps': 30713}. Best is trial 3 with value: 0.03981047441941555.
[I 2025-11-03 13:41:50,701] Trial 4 finished with value: 0.048608489270874716 and parameters: {'model_type': 'graphsage', 'hidden_dims': '[128, 64]', 'dropout': 0.13404863676897502, 'batch_norm': False, 'lr': 0.0001431556295367288, 'weight_decay': 2.2084517750726675e-05, 'epochs': 51, 'loss': 'mae', 'optimizer': 'adam', 'graph_mode': 'cutoff', 'cutoff': 0.6714268476993044, 'grm_norm': 'none', 'self_loops': False, 'use_snp_selection': True, 'num_snps': 45645}. Best is trial 4 with value: 0.048608489270874716.
[I 2025-11-03 13:41:54,169] Trial 5 finished with value: 0.0019338706387451937 and parameters: {'model_type': 'graphsage', 'hidden_dims': '[256, 128]', 'dropout': 0.42253606323412096, 'batch_norm': False, 'lr': 4.238630400638805e-05, 'weight_decay': 8.074086040046576e-07, 'epochs': 158, 'loss': 'mae', 'optimizer': 'adam', 'graph_mode': 'knn', 'source': 'grm', 'knn_k': 1, 'weighted_edges': False, 'symmetrize_mode': 'mutual', 'use_snp_selection': True, 'num_snps': 43113}. Best is trial 4 with value: 0.048608489270874716.
[I 2025-11-03 13:41:58,812] Trial 6 finished with value: 0.03302391234163398 and parameters: {'model_type': 'graphsage', 'hidden_dims': '[512, 256]', 'dropout': 0.3534893146320237, 'batch_norm': True, 'lr': 0.000251307964226932, 'weight_decay': 1.821819791794022e-05, 'epochs': 223, 'loss': 'mae', 'optimizer': 'adam', 'graph_mode': 'knn', 'source': 'grm', 'knn_k': 1, 'weighted_edges': True, 'symmetrize_mode': 'mutual', 'use_snp_selection': False}. Best is trial 4 with value: 0.048608489270874716.
[I 2025-11-03 13:42:02,997] Trial 7 finished with value: 0.02436765113528793 and parameters: {'model_type': 'graphsage', 'hidden_dims': '[512, 256]', 'dropout': 0.1105825955860775, 'batch_norm': True, 'lr': 2.374338412754043e-05, 'weight_decay': 1.1284721123340274e-05, 'epochs': 190, 'loss': 'mse', 'optimizer': 'adam', 'graph_mode': 'cutoff', 'cutoff': 0.719872204109604, 'grm_norm': 'gcn', 'self_loops': False, 'use_snp_selection': False}. Best is trial 4 with value: 0.048608489270874716.
[I 2025-11-03 13:42:06,481] Trial 8 finished with value: 0.011273900142763308 and parameters: {'model_type': 'graphsage', 'hidden_dims': '[512, 128]', 'dropout': 0.5066580418354021, 'batch_norm': True, 'lr': 0.00039213678276659976, 'weight_decay': 3.43655320802934e-06, 'epochs': 120, 'loss': 'mse', 'optimizer': 'adam', 'graph_mode': 'cutoff', 'cutoff': 0.34923059576505366, 'grm_norm': 'cosine', 'self_loops': True, 'use_snp_selection': False}. Best is trial 4 with value: 0.048608489270874716.
[I 2025-11-03 13:42:08,753] Trial 9 finished with value: 0.020723017278742137 and parameters: {'model_type': 'graphsage', 'hidden_dims': '[512, 256]', 'dropout': 0.301734920240333, 'batch_norm': False, 'lr': 6.650961854953448e-06, 'weight_decay': 6.861575656590315e-05, 'epochs': 150, 'loss': 'mae', 'optimizer': 'adam', 'graph_mode': 'cutoff', 'cutoff': 0.2857569870061939, 'grm_norm': 'cosine_then_gcn', 'self_loops': False, 'use_snp_selection': True, 'num_snps': 12722}. Best is trial 4 with value: 0.048608489270874716.
[I 2025-11-03 13:42:13,020] Trial 10 finished with value: 0.022773066443478873 and parameters: {'model_type': 'graphsage', 'hidden_dims': '[512, 64]', 'dropout': 0.22492338276159776, 'batch_norm': False, 'lr': 0.00014233761188460356, 'weight_decay': 1.8772904431456567e-07, 'epochs': 41, 'loss': 'mae', 'optimizer': 'adam', 'graph_mode': 'cutoff', 'cutoff': 0.8740100033033124, 'grm_norm': 'none', 'self_loops': True, 'use_snp_selection': True, 'num_snps': 58960}. Best is trial 4 with value: 0.048608489270874716.
[I 2025-11-03 13:42:16,237] Trial 11 finished with value: -0.0007302128047217971 and parameters: {'model_type': 'graphsage', 'hidden_dims': '[256, 128, 64]', 'dropout': 0.5994089069221873, 'batch_norm': False, 'lr': 8.25287866247181e-05, 'weight_decay': 0.0002205522163250003, 'epochs': 94, 'loss': 'mse', 'optimizer': 'adam', 'graph_mode': 'knn', 'source': 'grm', 'knn_k': 5, 'weighted_edges': False, 'symmetrize_mode': 'union', 'use_snp_selection': True, 'num_snps': 38963}. Best is trial 4 with value: 0.048608489270874716.
[I 2025-11-03 13:42:19,764] Trial 12 finished with value: 0.009594853452416586 and parameters: {'model_type': 'graphsage', 'hidden_dims': '[256, 128, 64]', 'dropout': 0.10852296509461337, 'batch_norm': False, 'lr': 1.6075293249126023e-05, 'weight_decay': 4.159401756974887e-05, 'epochs': 259, 'loss': 'mae', 'optimizer': 'adam', 'graph_mode': 'cutoff', 'cutoff': 0.5157485749757096, 'grm_norm': 'none', 'self_loops': False, 'use_snp_selection': True, 'num_snps': 30790}. Best is trial 4 with value: 0.048608489270874716.
[I 2025-11-03 13:42:23,662] Trial 13 finished with value: -0.013705319895583117 and parameters: {'model_type': 'graphsage', 'hidden_dims': '[256, 128, 64]', 'dropout': 0.5843082786028272, 'batch_norm': False, 'lr': 6.992587711753582e-05, 'weight_decay': 4.973467440708404e-06, 'epochs': 106, 'loss': 'mse', 'optimizer': 'adam', 'graph_mode': 'knn', 'source': 'grm', 'knn_k': 10, 'weighted_edges': False, 'symmetrize_mode': 'mutual', 'use_snp_selection': True, 'num_snps': 51436}. Best is trial 4 with value: 0.048608489270874716.
[I 2025-11-03 13:42:25,670] Trial 14 finished with value: 0.07089940486947045 and parameters: {'model_type': 'graphsage', 'hidden_dims': '[128, 64]', 'dropout': 0.2431693408055321, 'batch_norm': False, 'lr': 6.728628530366481e-06, 'weight_decay': 0.00022828589047768893, 'epochs': 41, 'loss': 'mae', 'optimizer': 'adam', 'graph_mode': 'cutoff', 'cutoff': 0.7154802468613564, 'grm_norm': 'none', 'self_loops': False, 'use_snp_selection': True, 'num_snps': 22268}. Best is trial 14 with value: 0.07089940486947045.
[I 2025-11-03 13:42:27,411] Trial 15 finished with value: 0.062317914672472025 and parameters: {'model_type': 'graphsage', 'hidden_dims': '[128, 64]', 'dropout': 0.2090862207091141, 'batch_norm': False, 'lr': 6.9082542699866905e-06, 'weight_decay': 0.0002464064671216169, 'epochs': 53, 'loss': 'mae', 'optimizer': 'adam', 'graph_mode': 'cutoff', 'cutoff': 0.7064745714131908, 'grm_norm': 'none', 'self_loops': False, 'use_snp_selection': True, 'num_snps': 13255}. Best is trial 14 with value: 0.07089940486947045.
[I 2025-11-03 13:42:28,953] Trial 16 finished with value: 0.02343384495220588 and parameters: {'model_type': 'graphsage', 'hidden_dims': '[128, 64]', 'dropout': 0.2553691451635419, 'batch_norm': False, 'lr': 4.2417531234975676e-06, 'weight_decay': 0.0008299787910600814, 'epochs': 79, 'loss': 'mae', 'optimizer': 'adam', 'graph_mode': 'cutoff', 'cutoff': 0.8507604723648265, 'grm_norm': 'none', 'self_loops': False, 'use_snp_selection': True, 'num_snps': 4348}. Best is trial 14 with value: 0.07089940486947045.
