[I 2025-11-03 16:15:43,929] Trial 15 finished with value: 0.13088987744032093 and parameters: {'model_type': 'graphsage', 'hidden_dims': '[512, 64]', 'dropout': 0.32182199730807426, 'batch_norm': True, 'lr': 0.00016454300965981406, 'weight_decay': 4.3750989597912334e-07, 'epochs': 289, 'loss': 'mae', 'optimizer': 'adam', 'graph_mode': 'knn', 'source': 'grm', 'knn_k': 1, 'weighted_edges': True, 'symmetrize_mode': 'union', 'use_snp_selection': False}. Best is trial 10 with value: 0.14096262297620188.
[I 2025-11-03 16:15:50,115] Trial 16 finished with value: 0.12930630323169554 and parameters: {'model_type': 'graphsage', 'hidden_dims': '[512, 64]', 'dropout': 0.219085497447947, 'batch_norm': True, 'lr': 5.782974614565059e-05, 'weight_decay': 3.222651619217792e-06, 'epochs': 230, 'loss': 'mae', 'optimizer': 'adam', 'graph_mode': 'knn', 'source': 'grm', 'knn_k': 10, 'weighted_edges': False, 'symmetrize_mode': 'union', 'use_snp_selection': False}. Best is trial 10 with value: 0.14096262297620188.
[I 2025-11-03 16:15:56,283] Trial 17 finished with value: 0.11840217818023985 and parameters: {'model_type': 'graphsage', 'hidden_dims': '[512, 128]', 'dropout': 0.3979233558206208, 'batch_norm': True, 'lr': 0.0002681341972492662, 'weight_decay': 2.690272323435558e-07, 'epochs': 305, 'loss': 'mae', 'optimizer': 'adam', 'graph_mode': 'knn', 'source': 'grm', 'knn_k': 3, 'weighted_edges': True, 'symmetrize_mode': 'union', 'use_snp_selection': False}. Best is trial 10 with value: 0.14096262297620188.
[I 2025-11-03 16:16:00,054] Trial 18 finished with value: 0.14425130320136526 and parameters: {'model_type': 'graphsage', 'hidden_dims': '[256, 128, 64]', 'dropout': 0.45638033887282076, 'batch_norm': True, 'lr': 0.0009438285356975067, 'weight_decay': 9.668925928026224e-07, 'epochs': 243, 'loss': 'mae', 'optimizer': 'adam', 'graph_mode': 'knn', 'source': 'grm', 'knn_k': 5, 'weighted_edges': True, 'symmetrize_mode': 'union', 'use_snp_selection': False}. Best is trial 18 with value: 0.14425130320136526.
[I 2025-11-03 16:16:03,790] Trial 19 finished with value: 0.13175167188204276 and parameters: {'model_type': 'graphsage', 'hidden_dims': '[256, 128, 64]', 'dropout': 0.4527535758652603, 'batch_norm': True, 'lr': 0.0007948585399487627, 'weight_decay': 9.459696819638982e-07, 'epochs': 240, 'loss': 'mae', 'optimizer': 'adam', 'graph_mode': 'knn', 'source': 'grm', 'knn_k': 5, 'weighted_edges': False, 'symmetrize_mode': 'union', 'use_snp_selection': False}. Best is trial 18 with value: 0.14425130320136526.
[I 2025-11-03 16:16:09,060] Trial 20 finished with value: 0.12290308386244592 and parameters: {'model_type': 'graphsage', 'hidden_dims': '[256, 128, 64]', 'dropout': 0.5852217565214374, 'batch_norm': True, 'lr': 0.0009268141134215794, 'weight_decay': 1.328170963180864e-06, 'epochs': 320, 'loss': 'mae', 'optimizer': 'adam', 'graph_mode': 'knn', 'source': 'grm', 'knn_k': 9, 'weighted_edges': True, 'symmetrize_mode': 'union', 'use_snp_selection': False}. Best is trial 18 with value: 0.14425130320136526.
[I 2025-11-03 16:16:12,491] Trial 21 finished with value: 0.11269353657070012 and parameters: {'model_type': 'graphsage', 'hidden_dims': '[256, 128, 64]', 'dropout': 0.3548210850628242, 'batch_norm': True, 'lr': 0.0002885819095826248, 'weight_decay': 1.9946155730197828e-07, 'epochs': 254, 'loss': 'mae', 'optimizer': 'adam', 'graph_mode': 'knn', 'source': 'grm', 'knn_k': 2, 'weighted_edges': True, 'symmetrize_mode': 'union', 'use_snp_selection': False}. Best is trial 18 with value: 0.14425130320136526.
[I 2025-11-03 16:16:17,745] Trial 22 finished with value: 0.146581783007024 and parameters: {'model_type': 'graphsage', 'hidden_dims': '[512, 64]', 'dropout': 0.46471682451647334, 'batch_norm': True, 'lr': 0.00012168520033975463, 'weight_decay': 5.184174564458549e-07, 'epochs': 215, 'loss': 'mae', 'optimizer': 'adam', 'graph_mode': 'knn', 'source': 'grm', 'knn_k': 5, 'weighted_edges': True, 'symmetrize_mode': 'union', 'use_snp_selection': False}. Best is trial 22 with value: 0.146581783007024.
[I 2025-11-03 16:16:22,904] Trial 23 finished with value: 0.09887255731480568 and parameters: {'model_type': 'graphsage', 'hidden_dims': '[512, 64]', 'dropout': 0.4703840332369766, 'batch_norm': True, 'lr': 1.8073306834356e-05, 'weight_decay': 6.283375119118616e-07, 'epochs': 213, 'loss': 'mae', 'optimizer': 'adam', 'graph_mode': 'knn', 'source': 'grm', 'knn_k': 5, 'weighted_edges': True, 'symmetrize_mode': 'union', 'use_snp_selection': False}. Best is trial 22 with value: 0.146581783007024.
[I 2025-11-03 16:16:26,528] Trial 24 finished with value: 0.10927204233866919 and parameters: {'model_type': 'graphsage', 'hidden_dims': '[256, 128, 64]', 'dropout': 0.45860883425056187, 'batch_norm': True, 'lr': 7.248022899508092e-05, 'weight_decay': 3.2575789186583427e-06, 'epochs': 214, 'loss': 'mae', 'optimizer': 'adam', 'graph_mode': 'knn', 'source': 'grm', 'knn_k': 6, 'weighted_edges': True, 'symmetrize_mode': 'union', 'use_snp_selection': False}. Best is trial 22 with value: 0.146581783007024.
[I 2025-11-03 16:16:32,074] Trial 25 finished with value: 0.12506344624985136 and parameters: {'model_type': 'graphsage', 'hidden_dims': '[512, 64]', 'dropout': 0.5488815066269475, 'batch_norm': True, 'lr': 0.0004284231593976044, 'weight_decay': 6.3060277863543106e-06, 'epochs': 249, 'loss': 'mae', 'optimizer': 'adam', 'graph_mode': 'knn', 'source': 'grm', 'knn_k': 4, 'weighted_edges': True, 'symmetrize_mode': 'union', 'use_snp_selection': False}. Best is trial 22 with value: 0.146581783007024.
[I 2025-11-03 16:16:38,972] Trial 26 finished with value: 0.11272189724148794 and parameters: {'model_type': 'graphsage', 'hidden_dims': '[512, 128]', 'dropout': 0.38499891575823997, 'batch_norm': False, 'lr': 0.00022517411406682656, 'weight_decay': 3.6287981794017153e-07, 'epochs': 301, 'loss': 'mse', 'optimizer': 'adam', 'graph_mode': 'cutoff', 'cutoff': 0.8765009073803762, 'grm_norm': 'none', 'self_loops': True, 'use_snp_selection': True, 'num_snps': 59005}. Best is trial 22 with value: 0.146581783007024.
[I 2025-11-03 16:16:42,557] Trial 27 finished with value: 0.030613011939266174 and parameters: {'model_type': 'graphsage', 'hidden_dims': '[256, 128]', 'dropout': 0.4321939243438787, 'batch_norm': True, 'lr': 1.2930656788964772e-06, 'weight_decay': 1.7559377331183127e-06, 'epochs': 196, 'loss': 'mae', 'optimizer': 'adam', 'graph_mode': 'knn', 'source': 'grm', 'knn_k': 7, 'weighted_edges': True, 'symmetrize_mode': 'union', 'use_snp_selection': False}. Best is trial 22 with value: 0.146581783007024.
[I 2025-11-03 16:16:45,258] Trial 28 finished with value: 0.004898308428815563 and parameters: {'model_type': 'graphsage', 'hidden_dims': '[256, 128, 64]', 'dropout': 0.4883126803406223, 'batch_norm': True, 'lr': 6.734570542801553e-06, 'weight_decay': 5.705090567887533e-07, 'epochs': 163, 'loss': 'mae', 'optimizer': 'adam', 'graph_mode': 'knn', 'source': 'grm', 'knn_k': 4, 'weighted_edges': False, 'symmetrize_mode': 'mutual', 'use_snp_selection': False}. Best is trial 22 with value: 0.146581783007024.
[I 2025-11-03 16:16:48,499] Trial 29 finished with value: 0.12269481380592638 and parameters: {'model_type': 'graphsage', 'hidden_dims': '[128, 64]', 'dropout': 0.22487044772394038, 'batch_norm': True, 'lr': 5.00677025148739e-05, 'weight_decay': 8.368908757919724e-05, 'epochs': 267, 'loss': 'mae', 'optimizer': 'adam', 'graph_mode': 'knn', 'source': 'grm', 'knn_k': 7, 'weighted_edges': True, 'symmetrize_mode': 'union', 'use_snp_selection': False}. Best is trial 22 with value: 0.146581783007024.
[I 2025-11-03 16:16:55,386] Trial 30 finished with value: 0.042148761931234485 and parameters: {'model_type': 'graphsage', 'hidden_dims': '[512, 64]', 'dropout': 0.3251462680439098, 'batch_norm': True, 'lr': 3.1375870937498553e-06, 'weight_decay': 0.00020511462460338128, 'epochs': 332, 'loss': 'mae', 'optimizer': 'adam', 'graph_mode': 'knn', 'source': 'grm', 'knn_k': 5, 'weighted_edges': True, 'symmetrize_mode': 'union', 'use_snp_selection': False}. Best is trial 22 with value: 0.146581783007024.
[I 2025-11-03 16:17:01,047] Trial 31 finished with value: 0.11185338620217815 and parameters: {'model_type': 'graphsage', 'hidden_dims': '[512, 64]', 'dropout': 0.29614486166073284, 'batch_norm': True, 'lr': 0.00013073608087172406, 'weight_decay': 1.7510640731259243e-07, 'epochs': 282, 'loss': 'mae', 'optimizer': 'adam', 'graph_mode': 'knn', 'source': 'grm', 'knn_k': 2, 'weighted_edges': True, 'symmetrize_mode': 'union', 'use_snp_selection': False}. Best is trial 22 with value: 0.146581783007024.
[I 2025-11-03 16:17:06,209] Trial 32 finished with value: 0.10773820677909948 and parameters: {'model_type': 'graphsage', 'hidden_dims': '[512, 64]', 'dropout': 0.1630251098059575, 'batch_norm': True, 'lr': 0.00012893981822691513, 'weight_decay': 1.9564843369020434e-07, 'epochs': 238, 'loss': 'mae', 'optimizer': 'adam', 'graph_mode': 'knn', 'source': 'grm', 'knn_k': 2, 'weighted_edges': True, 'symmetrize_mode': 'union', 'use_snp_selection': False}. Best is trial 22 with value: 0.146581783007024.
[I 2025-11-03 16:17:12,364] Trial 33 finished with value: 0.11257730062531918 and parameters: {'model_type': 'graphsage', 'hidden_dims': '[512, 64]', 'dropout': 0.3747762117911848, 'batch_norm': True, 'lr': 0.00044580649498050367, 'weight_decay': 1.0089090694063114e-07, 'epochs': 316, 'loss': 'mae', 'optimizer': 'adam', 'graph_mode': 'knn', 'source': 'grm', 'knn_k': 2, 'weighted_edges': True, 'symmetrize_mode': 'union', 'use_snp_selection': False}. Best is trial 22 with value: 0.146581783007024.
[I 2025-11-03 16:17:16,939] Trial 34 finished with value: 0.14500177686216692 and parameters: {'model_type': 'graphsage', 'hidden_dims': '[512, 64]', 'dropout': 0.24957766105045603, 'batch_norm': True, 'lr': 0.00017908094912870342, 'weight_decay': 9.483276799664067e-07, 'epochs': 203, 'loss': 'mse', 'optimizer': 'adam', 'graph_mode': 'knn', 'source': 'grm', 'knn_k': 1, 'weighted_edges': True, 'symmetrize_mode': 'union', 'use_snp_selection': False}. Best is trial 22 with value: 0.146581783007024.
[I 2025-11-03 16:17:18,772] Trial 35 finished with value: 0.10591537355037664 and parameters: {'model_type': 'graphsage', 'hidden_dims': '[128, 64]', 'dropout': 0.2516826571136179, 'batch_norm': False, 'lr': 0.0006542813490499528, 'weight_decay': 1.2261411107648687e-06, 'epochs': 208, 'loss': 'mse', 'optimizer': 'adam', 'graph_mode': 'knn', 'source': 'grm', 'knn_k': 3, 'weighted_edges': True, 'symmetrize_mode': 'union', 'use_snp_selection': True, 'num_snps': 2074}. Best is trial 22 with value: 0.146581783007024.
[I 2025-11-03 16:17:21,549] Trial 36 finished with value: 0.1127236096778694 and parameters: {'model_type': 'graphsage', 'hidden_dims': '[256, 128]', 'dropout': 0.5460347742472199, 'batch_norm': True, 'lr': 0.00018235798905122296, 'weight_decay': 2.5544420261531497e-06, 'epochs': 170, 'loss': 'mse', 'optimizer': 'adam', 'graph_mode': 'cutoff', 'cutoff': 0.42596163795855535, 'grm_norm': 'cosine', 'self_loops': True, 'use_snp_selection': False}. Best is trial 22 with value: 0.146581783007024.
[I 2025-11-03 16:17:23,780] Trial 37 finished with value: 0.09395069305621456 and parameters: {'model_type': 'graphsage', 'hidden_dims': '[256, 128, 64]', 'dropout': 0.4199733448520681, 'batch_norm': False, 'lr': 0.00035278644163502446, 'weight_decay': 6.4533020787749045e-06, 'epochs': 132, 'loss': 'mse', 'optimizer': 'adam', 'graph_mode': 'knn', 'source': 'grm', 'knn_k': 8, 'weighted_edges': True, 'symmetrize_mode': 'mutual', 'use_snp_selection': True, 'num_snps': 15344}. Best is trial 22 with value: 0.146581783007024.
[I 2025-11-03 16:17:28,448] Trial 38 finished with value: 0.10534967564424912 and parameters: {'model_type': 'graphsage', 'hidden_dims': '[512, 64]', 'dropout': 0.18249662452096072, 'batch_norm': True, 'lr': 3.146311924207456e-05, 'weight_decay': 7.371973247303168e-07, 'epochs': 185, 'loss': 'mse', 'optimizer': 'adam', 'graph_mode': 'knn', 'source': 'grm', 'knn_k': 4, 'weighted_edges': True, 'symmetrize_mode': 'union', 'use_snp_selection': False}. Best is trial 22 with value: 0.146581783007024.
[I 2025-11-03 16:17:34,212] Trial 39 finished with value: 0.05937670859885675 and parameters: {'model_type': 'graphsage', 'hidden_dims': '[512, 256]', 'dropout': 0.33115286455795545, 'batch_norm': False, 'lr': 0.00048751734363825774, 'weight_decay': 0.0006513368993264923, 'epochs': 199, 'loss': 'mse', 'optimizer': 'adam', 'graph_mode': 'cutoff', 'cutoff': 0.8982975816958216, 'grm_norm': 'cosine_then_gcn', 'self_loops': True, 'use_snp_selection': True, 'num_snps': 58379}. Best is trial 22 with value: 0.146581783007024.
[I 2025-11-03 16:17:37,056] Trial 40 finished with value: 0.13755232960194663 and parameters: {'model_type': 'graphsage', 'hidden_dims': '[128, 64]', 'dropout': 0.2312632053277197, 'batch_norm': True, 'lr': 0.0006236933168192255, 'weight_decay': 2.8194205744277863e-07, 'epochs': 226, 'loss': 'mse', 'optimizer': 'adam', 'graph_mode': 'knn', 'source': 'grm', 'knn_k': 6, 'weighted_edges': True, 'symmetrize_mode': 'union', 'use_snp_selection': False}. Best is trial 22 with value: 0.146581783007024.
[I 2025-11-03 16:17:39,866] Trial 41 finished with value: 0.13199932716567805 and parameters: {'model_type': 'graphsage', 'hidden_dims': '[128, 64]', 'dropout': 0.2272946403130951, 'batch_norm': True, 'lr': 0.0009769843674245833, 'weight_decay': 2.9480471874703063e-07, 'epochs': 229, 'loss': 'mse', 'optimizer': 'adam', 'graph_mode': 'knn', 'source': 'grm', 'knn_k': 6, 'weighted_edges': True, 'symmetrize_mode': 'union', 'use_snp_selection': False}. Best is trial 22 with value: 0.146581783007024.
[I 2025-11-03 16:17:42,979] Trial 42 finished with value: 0.12862479068935023 and parameters: {'model_type': 'graphsage', 'hidden_dims': '[128, 64]', 'dropout': 0.2518162333395828, 'batch_norm': True, 'lr': 0.0007294162408687777, 'weight_decay': 4.831420423278639e-07, 'epochs': 251, 'loss': 'mse', 'optimizer': 'adam', 'graph_mode': 'knn', 'source': 'grm', 'knn_k': 7, 'weighted_edges': True, 'symmetrize_mode': 'union', 'use_snp_selection': False}. Best is trial 22 with value: 0.146581783007024.
[I 2025-11-03 16:17:44,765] Trial 43 finished with value: 0.12991183111046578 and parameters: {'model_type': 'graphsage', 'hidden_dims': '[128, 64]', 'dropout': 0.13222613629542834, 'batch_norm': True, 'lr': 0.0006077919286861829, 'weight_decay': 1.5972746875141747e-06, 'epochs': 85, 'loss': 'mse', 'optimizer': 'adam', 'graph_mode': 'knn', 'source': 'grm', 'knn_k': 6, 'weighted_edges': False, 'symmetrize_mode': 'union', 'use_snp_selection': False}. Best is trial 22 with value: 0.146581783007024.
[I 2025-11-03 16:17:47,220] Trial 44 finished with value: 0.1424163734228106 and parameters: {'model_type': 'graphsage', 'hidden_dims': '[128, 64]', 'dropout': 0.15567329443319297, 'batch_norm': True, 'lr': 0.0001984498338255318, 'weight_decay': 2.5326111254568757e-07, 'epochs': 222, 'loss': 'mse', 'optimizer': 'adam', 'graph_mode': 'knn', 'source': 'grm', 'knn_k': 8, 'weighted_edges': True, 'symmetrize_mode': 'mutual', 'use_snp_selection': False}. Best is trial 22 with value: 0.146581783007024.
[I 2025-11-03 16:17:49,948] Trial 45 finished with value: 0.11348676878452012 and parameters: {'model_type': 'graphsage', 'hidden_dims': '[256, 128]', 'dropout': 0.15760193683591672, 'batch_norm': True, 'lr': 9.002533873205588e-05, 'weight_decay': 9.327484842356429e-07, 'epochs': 176, 'loss': 'mse', 'optimizer': 'adam', 'graph_mode': 'cutoff', 'cutoff': 0.4585737354176531, 'grm_norm': 'cosine', 'self_loops': False, 'use_snp_selection': False}. Best is trial 22 with value: 0.146581783007024.
[I 2025-11-03 16:17:54,050] Trial 46 finished with value: 0.1406297119755108 and parameters: {'model_type': 'graphsage', 'hidden_dims': '[512, 256]', 'dropout': 0.10990473799286415, 'batch_norm': True, 'lr': 0.00020677312564352135, 'weight_decay': 1.5110018177527972e-07, 'epochs': 146, 'loss': 'mse', 'optimizer': 'adam', 'graph_mode': 'knn', 'source': 'grm', 'knn_k': 8, 'weighted_edges': True, 'symmetrize_mode': 'mutual', 'use_snp_selection': False}. Best is trial 22 with value: 0.146581783007024.
[I 2025-11-03 16:17:59,047] Trial 47 finished with value: 0.12535410173954842 and parameters: {'model_type': 'graphsage', 'hidden_dims': '[512, 128]', 'dropout': 0.2862210317116806, 'batch_norm': True, 'lr': 6.353094874548132e-05, 'weight_decay': 5.4871845428889854e-06, 'epochs': 207, 'loss': 'mse', 'optimizer': 'adam', 'graph_mode': 'knn', 'source': 'grm', 'knn_k': 10, 'weighted_edges': True, 'symmetrize_mode': 'mutual', 'use_snp_selection': False}. Best is trial 22 with value: 0.146581783007024.
[I 2025-11-03 16:18:04,541] Trial 48 finished with value: 0.11902885326992596 and parameters: {'model_type': 'graphsage', 'hidden_dims': '[512, 64]', 'dropout': 0.20144469801223852, 'batch_norm': False, 'lr': 0.00010756228510342955, 'weight_decay': 5.346475282238546e-07, 'epochs': 259, 'loss': 'mse', 'optimizer': 'adam', 'graph_mode': 'knn', 'source': 'grm', 'knn_k': 9, 'weighted_edges': False, 'symmetrize_mode': 'mutual', 'use_snp_selection': True, 'num_snps': 42595}. Best is trial 22 with value: 0.146581783007024.
[I 2025-11-03 16:18:08,870] Trial 49 finished with value: 0.13215116871919566 and parameters: {'model_type': 'graphsage', 'hidden_dims': '[512, 64]', 'dropout': 0.5148423798726172, 'batch_norm': True, 'lr': 3.300073793327205e-05, 'weight_decay': 2.652834706547781e-07, 'epochs': 189, 'loss': 'mae', 'optimizer': 'adam', 'graph_mode': 'knn', 'source': 'grm', 'knn_k': 1, 'weighted_edges': True, 'symmetrize_mode': 'mutual', 'use_snp_selection': False}. Best is trial 22 with value: 0.146581783007024.
[I 2025-11-03 16:18:13,935] Trial 50 finished with value: 0.14055531799554488 and parameters: {'model_type': 'graphsage', 'hidden_dims': '[256, 128, 64]', 'dropout': 0.36490140318172914, 'batch_norm': True, 'lr': 0.00031175376251940174, 'weight_decay': 3.192577224729498e-05, 'epochs': 295, 'loss': 'mse', 'optimizer': 'adam', 'graph_mode': 'cutoff', 'cutoff': 0.20628834676422192, 'grm_norm': 'none', 'self_loops': True, 'use_snp_selection': False}. Best is trial 22 with value: 0.146581783007024.
[I 2025-11-03 16:18:17,986] Trial 51 finished with value: 0.13860195517964813 and parameters: {'model_type': 'graphsage', 'hidden_dims': '[512, 256]', 'dropout': 0.10690395752988177, 'batch_norm': True, 'lr': 0.00021382617770321743, 'weight_decay': 1.5411557773993312e-07, 'epochs': 145, 'loss': 'mse', 'optimizer': 'adam', 'graph_mode': 'knn', 'source': 'grm', 'knn_k': 8, 'weighted_edges': True, 'symmetrize_mode': 'mutual', 'use_snp_selection': False}. Best is trial 22 with value: 0.146581783007024.
[I 2025-11-03 16:18:21,286] Trial 52 finished with value: 0.13817555109304777 and parameters: {'model_type': 'graphsage', 'hidden_dims': '[512, 256]', 'dropout': 0.12726298026511856, 'batch_norm': True, 'lr': 0.00022861247670729297, 'weight_decay': 1.3536409671735662e-07, 'epochs': 90, 'loss': 'mse', 'optimizer': 'adam', 'graph_mode': 'knn', 'source': 'grm', 'knn_k': 9, 'weighted_edges': True, 'symmetrize_mode': 'mutual', 'use_snp_selection': False}. Best is trial 22 with value: 0.146581783007024.
[I 2025-11-03 16:18:24,707] Trial 53 finished with value: 0.13417023529463845 and parameters: {'model_type': 'graphsage', 'hidden_dims': '[512, 256]', 'dropout': 0.1574393379431572, 'batch_norm': True, 'lr': 0.00018080004910539285, 'weight_decay': 3.7217393993709793e-07, 'epochs': 115, 'loss': 'mse', 'optimizer': 'adam', 'graph_mode': 'knn', 'source': 'grm', 'knn_k': 1, 'weighted_edges': True, 'symmetrize_mode': 'mutual', 'use_snp_selection': False}. Best is trial 22 with value: 0.146581783007024.
[I 2025-11-03 16:18:30,138] Trial 54 finished with value: 0.11620188202820285 and parameters: {'model_type': 'graphsage', 'hidden_dims': '[512, 256]', 'dropout': 0.17892679198028033, 'batch_norm': True, 'lr': 0.00014685397676652504, 'weight_decay': 1.1059537202315116e-06, 'epochs': 241, 'loss': 'mse', 'optimizer': 'adam', 'graph_mode': 'knn', 'source': 'grm', 'knn_k': 8, 'weighted_edges': True, 'symmetrize_mode': 'mutual', 'use_snp_selection': False}. Best is trial 22 with value: 0.146581783007024.
[I 2025-11-03 16:18:35,266] Trial 55 finished with value: 0.12891308074972335 and parameters: {'model_type': 'graphsage', 'hidden_dims': '[512, 64]', 'dropout': 0.10583263652059263, 'batch_norm': True, 'lr': 7.983369000711696e-05, 'weight_decay': 7.773973608886391e-07, 'epochs': 224, 'loss': 'mae', 'optimizer': 'adam', 'graph_mode': 'knn', 'source': 'grm', 'knn_k': 7, 'weighted_edges': True, 'symmetrize_mode': 'mutual', 'use_snp_selection': False}. Best is trial 22 with value: 0.146581783007024.
[I 2025-11-03 16:18:37,819] Trial 56 finished with value: 0.1382945174342233 and parameters: {'model_type': 'graphsage', 'hidden_dims': '[128, 64]', 'dropout': 0.1426247244728302, 'batch_norm': True, 'lr': 0.00010778760858835508, 'weight_decay': 2.431797349726588e-07, 'epochs': 271, 'loss': 'mae', 'optimizer': 'adam', 'graph_mode': 'knn', 'source': 'grm', 'knn_k': 5, 'weighted_edges': True, 'symmetrize_mode': 'mutual', 'use_snp_selection': False}. Best is trial 22 with value: 0.146581783007024.
[I 2025-11-03 16:18:42,001] Trial 57 finished with value: 0.1311004090787433 and parameters: {'model_type': 'graphsage', 'hidden_dims': '[512, 256]', 'dropout': 0.5846658247432986, 'batch_norm': True, 'lr': 0.00035603318666243823, 'weight_decay': 1.2854211599979484e-07, 'epochs': 148, 'loss': 'mse', 'optimizer': 'adam', 'graph_mode': 'knn', 'source': 'grm', 'knn_k': 9, 'weighted_edges': True, 'symmetrize_mode': 'mutual', 'use_snp_selection': False}. Best is trial 22 with value: 0.146581783007024.
