[I 2025-11-03 13:33:06,254] Trial 148 finished with value: 0.05952629857052803 and parameters: {'model_type': 'graphsage', 'hidden_dims': '[512, 256]', 'dropout': 0.3702894455871737, 'batch_norm': True, 'lr': 7.802104862186821e-05, 'weight_decay': 3.853979677792617e-07, 'epochs': 330, 'loss': 'mae', 'optimizer': 'adam', 'graph_mode': 'knn', 'source': 'grm', 'knn_k': 1, 'weighted_edges': True, 'symmetrize_mode': 'union', 'use_snp_selection': False}. Best is trial 122 with value: 0.08378642422721401.
[I 2025-11-03 13:33:11,183] Trial 149 finished with value: 0.05923626037803634 and parameters: {'model_type': 'graphsage', 'hidden_dims': '[512, 256]', 'dropout': 0.39260519779143627, 'batch_norm': True, 'lr': 0.00012430242108396264, 'weight_decay': 0.00018862503600042586, 'epochs': 338, 'loss': 'mae', 'optimizer': 'adam', 'graph_mode': 'knn', 'source': 'grm', 'knn_k': 1, 'weighted_edges': False, 'symmetrize_mode': 'union', 'use_snp_selection': False}. Best is trial 122 with value: 0.08378642422721401.
[I 2025-11-03 13:33:53,341] Trial 0 finished with value: 0.005963193775205816 and parameters: {'model_type': 'graphsage', 'hidden_dims': '[128, 64]', 'dropout': 0.199031432379812, 'batch_norm': True, 'lr': 1.8408544111075837e-06, 'weight_decay': 5.5136510071208614e-05, 'epochs': 336, 'loss': 'mae', 'optimizer': 'adam', 'graph_mode': 'knn', 'source': 'grm', 'knn_k': 8, 'weighted_edges': True, 'symmetrize_mode': 'mutual', 'use_snp_selection': False}. Best is trial 0 with value: 0.005963193775205816.
[I 2025-11-03 13:33:54,864] Trial 1 finished with value: 0.026700984069504097 and parameters: {'model_type': 'graphsage', 'hidden_dims': '[128, 64]', 'dropout': 0.40051947670227217, 'batch_norm': True, 'lr': 0.0005320428882732732, 'weight_decay': 1.89210117736594e-06, 'epochs': 68, 'loss': 'mse', 'optimizer': 'adam', 'graph_mode': 'knn', 'source': 'grm', 'knn_k': 7, 'weighted_edges': True, 'symmetrize_mode': 'union', 'use_snp_selection': False}. Best is trial 1 with value: 0.026700984069504097.
[I 2025-11-03 13:33:57,365] Trial 2 finished with value: 0.05248341322145509 and parameters: {'model_type': 'graphsage', 'hidden_dims': '[256, 128]', 'dropout': 0.5105528289184642, 'batch_norm': False, 'lr': 0.0006804279372404962, 'weight_decay': 0.0008922815224257085, 'epochs': 181, 'loss': 'mse', 'optimizer': 'adam', 'graph_mode': 'cutoff', 'cutoff': 0.5741905641612706, 'grm_norm': 'gcn', 'self_loops': False, 'use_snp_selection': True, 'num_snps': 26910}. Best is trial 2 with value: 0.05248341322145509.
[I 2025-11-03 13:34:00,044] Trial 3 finished with value: -0.022079088096885104 and parameters: {'model_type': 'graphsage', 'hidden_dims': '[256, 128, 64]', 'dropout': 0.5390483213624292, 'batch_norm': False, 'lr': 3.4705625989073525e-05, 'weight_decay': 2.4623319020131338e-05, 'epochs': 121, 'loss': 'mse', 'optimizer': 'adam', 'graph_mode': 'knn', 'source': 'grm', 'knn_k': 6, 'weighted_edges': False, 'symmetrize_mode': 'mutual', 'use_snp_selection': True, 'num_snps': 30713}. Best is trial 2 with value: 0.05248341322145509.
[I 2025-11-03 13:34:02,636] Trial 4 finished with value: 0.039350194684292794 and parameters: {'model_type': 'graphsage', 'hidden_dims': '[128, 64]', 'dropout': 0.13404863676897502, 'batch_norm': False, 'lr': 0.0001431556295367288, 'weight_decay': 2.2084517750726675e-05, 'epochs': 51, 'loss': 'mae', 'optimizer': 'adam', 'graph_mode': 'cutoff', 'cutoff': 0.6714268476993044, 'grm_norm': 'none', 'self_loops': False, 'use_snp_selection': True, 'num_snps': 45645}. Best is trial 2 with value: 0.05248341322145509.
[I 2025-11-03 13:34:05,738] Trial 5 finished with value: 0.032853512653617994 and parameters: {'model_type': 'graphsage', 'hidden_dims': '[256, 128]', 'dropout': 0.42253606323412096, 'batch_norm': False, 'lr': 4.238630400638805e-05, 'weight_decay': 8.074086040046576e-07, 'epochs': 158, 'loss': 'mae', 'optimizer': 'adam', 'graph_mode': 'knn', 'source': 'grm', 'knn_k': 1, 'weighted_edges': False, 'symmetrize_mode': 'mutual', 'use_snp_selection': True, 'num_snps': 43113}. Best is trial 2 with value: 0.05248341322145509.
[I 2025-11-03 13:34:09,426] Trial 6 finished with value: 0.04293965430150312 and parameters: {'model_type': 'graphsage', 'hidden_dims': '[512, 256]', 'dropout': 0.3534893146320237, 'batch_norm': True, 'lr': 0.000251307964226932, 'weight_decay': 1.821819791794022e-05, 'epochs': 223, 'loss': 'mae', 'optimizer': 'adam', 'graph_mode': 'knn', 'source': 'grm', 'knn_k': 1, 'weighted_edges': True, 'symmetrize_mode': 'mutual', 'use_snp_selection': False}. Best is trial 2 with value: 0.05248341322145509.
[I 2025-11-03 13:34:12,839] Trial 7 finished with value: 0.024212685765722178 and parameters: {'model_type': 'graphsage', 'hidden_dims': '[512, 256]', 'dropout': 0.1105825955860775, 'batch_norm': True, 'lr': 2.374338412754043e-05, 'weight_decay': 1.1284721123340274e-05, 'epochs': 190, 'loss': 'mse', 'optimizer': 'adam', 'graph_mode': 'cutoff', 'cutoff': 0.719872204109604, 'grm_norm': 'gcn', 'self_loops': False, 'use_snp_selection': False}. Best is trial 2 with value: 0.05248341322145509.
[I 2025-11-03 13:34:15,840] Trial 8 finished with value: 0.02828268240244093 and parameters: {'model_type': 'graphsage', 'hidden_dims': '[512, 128]', 'dropout': 0.5066580418354021, 'batch_norm': True, 'lr': 0.00039213678276659976, 'weight_decay': 3.43655320802934e-06, 'epochs': 120, 'loss': 'mse', 'optimizer': 'adam', 'graph_mode': 'cutoff', 'cutoff': 0.34923059576505366, 'grm_norm': 'cosine', 'self_loops': True, 'use_snp_selection': False}. Best is trial 2 with value: 0.05248341322145509.
[I 2025-11-03 13:34:17,864] Trial 9 finished with value: 0.029017777279614385 and parameters: {'model_type': 'graphsage', 'hidden_dims': '[512, 256]', 'dropout': 0.301734920240333, 'batch_norm': False, 'lr': 6.650961854953448e-06, 'weight_decay': 6.861575656590315e-05, 'epochs': 150, 'loss': 'mae', 'optimizer': 'adam', 'graph_mode': 'cutoff', 'cutoff': 0.2857569870061939, 'grm_norm': 'cosine_then_gcn', 'self_loops': False, 'use_snp_selection': True, 'num_snps': 12722}. Best is trial 2 with value: 0.05248341322145509.
[I 2025-11-03 13:34:20,280] Trial 10 finished with value: 0.029549734240227714 and parameters: {'model_type': 'graphsage', 'hidden_dims': '[256, 128]', 'dropout': 0.5885461262002587, 'batch_norm': False, 'lr': 9.558525641285997e-05, 'weight_decay': 0.0005507714381092994, 'epochs': 275, 'loss': 'mse', 'optimizer': 'adam', 'graph_mode': 'cutoff', 'cutoff': 0.8740100033033124, 'grm_norm': 'gcn', 'self_loops': True, 'use_snp_selection': True, 'num_snps': 16208}. Best is trial 2 with value: 0.05248341322145509.
[I 2025-11-03 13:34:24,129] Trial 11 finished with value: 0.03295993610366115 and parameters: {'model_type': 'graphsage', 'hidden_dims': '[512, 64]', 'dropout': 0.28662674491963874, 'batch_norm': True, 'lr': 0.000993464184224348, 'weight_decay': 1.0655358607693621e-07, 'epochs': 241, 'loss': 'mae', 'optimizer': 'adam', 'graph_mode': 'knn', 'source': 'grm', 'knn_k': 1, 'weighted_edges': True, 'symmetrize_mode': 'union', 'use_snp_selection': False}. Best is trial 2 with value: 0.05248341322145509.
[I 2025-11-03 13:34:29,521] Trial 12 finished with value: 0.021313885262411177 and parameters: {'model_type': 'graphsage', 'hidden_dims': '[512, 256]', 'dropout': 0.43189401499478725, 'batch_norm': True, 'lr': 0.00022827207082888324, 'weight_decay': 0.000735101428743778, 'epochs': 245, 'loss': 'mae', 'optimizer': 'adam', 'graph_mode': 'knn', 'source': 'grm', 'knn_k': 3, 'weighted_edges': True, 'symmetrize_mode': 'mutual', 'use_snp_selection': True, 'num_snps': 58791}. Best is trial 2 with value: 0.05248341322145509.
[I 2025-11-03 13:34:31,872] Trial 13 finished with value: 0.01815853204815595 and parameters: {'model_type': 'graphsage', 'hidden_dims': '[256, 128]', 'dropout': 0.33212846078805314, 'batch_norm': False, 'lr': 0.0009901577515335541, 'weight_decay': 0.00018004872141209711, 'epochs': 215, 'loss': 'mse', 'optimizer': 'adam', 'graph_mode': 'cutoff', 'cutoff': 0.4773775536648144, 'grm_norm': 'gcn', 'self_loops': False, 'use_snp_selection': False}. Best is trial 2 with value: 0.05248341322145509.
[I 2025-11-03 13:34:34,299] Trial 14 finished with value: 0.06484627310204948 and parameters: {'model_type': 'graphsage', 'hidden_dims': '[256, 128, 64]', 'dropout': 0.4873120737718566, 'batch_norm': False, 'lr': 8.589510603311415e-05, 'weight_decay': 0.0001891563515268861, 'epochs': 304, 'loss': 'mse', 'optimizer': 'adam', 'graph_mode': 'knn', 'source': 'grm', 'knn_k': 10, 'weighted_edges': True, 'symmetrize_mode': 'mutual', 'use_snp_selection': True, 'num_snps': 2338}. Best is trial 14 with value: 0.06484627310204948.
[I 2025-11-03 13:34:36,780] Trial 15 finished with value: 0.06239158777445459 and parameters: {'model_type': 'graphsage', 'hidden_dims': '[256, 128, 64]', 'dropout': 0.4795102175358149, 'batch_norm': False, 'lr': 7.97697121758268e-06, 'weight_decay': 0.0002657276224192271, 'epochs': 338, 'loss': 'mse', 'optimizer': 'adam', 'graph_mode': 'cutoff', 'cutoff': 0.5222336348323294, 'grm_norm': 'none', 'self_loops': False, 'use_snp_selection': True, 'num_snps': 3972}. Best is trial 14 with value: 0.06484627310204948.
[I 2025-11-03 13:34:39,301] Trial 16 finished with value: 0.014810528853128153 and parameters: {'model_type': 'graphsage', 'hidden_dims': '[256, 128, 64]', 'dropout': 0.4700076119887159, 'batch_norm': False, 'lr': 9.684731008190878e-06, 'weight_decay': 0.00015491183864732865, 'epochs': 328, 'loss': 'mse', 'optimizer': 'adam', 'graph_mode': 'knn', 'source': 'grm', 'knn_k': 10, 'weighted_edges': False, 'symmetrize_mode': 'union', 'use_snp_selection': True, 'num_snps': 3907}. Best is trial 14 with value: 0.06484627310204948.
[I 2025-11-03 13:34:41,545] Trial 17 finished with value: -0.011388518901759317 and parameters: {'model_type': 'graphsage', 'hidden_dims': '[256, 128, 64]', 'dropout': 0.5801943431504863, 'batch_norm': False, 'lr': 1.271834535798505e-06, 'weight_decay': 0.00025775573970236113, 'epochs': 295, 'loss': 'mse', 'optimizer': 'adam', 'graph_mode': 'cutoff', 'cutoff': 0.44409079094163684, 'grm_norm': 'none', 'self_loops': True, 'use_snp_selection': True, 'num_snps': 2562}. Best is trial 14 with value: 0.06484627310204948.
[I 2025-11-03 13:34:44,293] Trial 18 finished with value: 0.012101433039864145 and parameters: {'model_type': 'graphsage', 'hidden_dims': '[256, 128, 64]', 'dropout': 0.4617400517337028, 'batch_norm': False, 'lr': 4.993278422669561e-06, 'weight_decay': 7.178323930955432e-05, 'epochs': 299, 'loss': 'mse', 'optimizer': 'adam', 'graph_mode': 'cutoff', 'cutoff': 0.2013125402062066, 'grm_norm': 'none', 'self_loops': False, 'use_snp_selection': True, 'num_snps': 15059}. Best is trial 14 with value: 0.06484627310204948.
[I 2025-11-03 13:34:47,101] Trial 19 finished with value: 0.09185206122090518 and parameters: {'model_type': 'graphsage', 'hidden_dims': '[256, 128, 64]', 'dropout': 0.37675540526803925, 'batch_norm': False, 'lr': 1.435155367890197e-05, 'weight_decay': 0.00028100660266362694, 'epochs': 344, 'loss': 'mse', 'optimizer': 'adam', 'graph_mode': 'knn', 'source': 'grm', 'knn_k': 10, 'weighted_edges': True, 'symmetrize_mode': 'mutual', 'use_snp_selection': True, 'num_snps': 9675}. Best is trial 19 with value: 0.09185206122090518.
[I 2025-11-03 13:34:49,952] Trial 20 finished with value: 0.028689055371838603 and parameters: {'model_type': 'graphsage', 'hidden_dims': '[512, 128]', 'dropout': 0.23046734466326846, 'batch_norm': False, 'lr': 1.641798239114919e-05, 'weight_decay': 5.4797191649395136e-06, 'epochs': 274, 'loss': 'mse', 'optimizer': 'adam', 'graph_mode': 'knn', 'source': 'grm', 'knn_k': 10, 'weighted_edges': True, 'symmetrize_mode': 'mutual', 'use_snp_selection': True, 'num_snps': 20968}. Best is trial 19 with value: 0.09185206122090518.
[I 2025-11-03 13:34:52,695] Trial 21 finished with value: 0.014497247364662033 and parameters: {'model_type': 'graphsage', 'hidden_dims': '[256, 128, 64]', 'dropout': 0.3726723993601837, 'batch_norm': False, 'lr': 7.175338148861885e-05, 'weight_decay': 0.0003213009088317119, 'epochs': 343, 'loss': 'mse', 'optimizer': 'adam', 'graph_mode': 'knn', 'source': 'grm', 'knn_k': 9, 'weighted_edges': True, 'symmetrize_mode': 'mutual', 'use_snp_selection': True, 'num_snps': 8048}. Best is trial 19 with value: 0.09185206122090518.
[I 2025-11-03 13:34:55,153] Trial 22 finished with value: 0.04012930126034634 and parameters: {'model_type': 'graphsage', 'hidden_dims': '[256, 128, 64]', 'dropout': 0.4540184348968537, 'batch_norm': False, 'lr': 3.1868653642222323e-06, 'weight_decay': 0.00010903967648718545, 'epochs': 325, 'loss': 'mse', 'optimizer': 'adam', 'graph_mode': 'knn', 'source': 'grm', 'knn_k': 4, 'weighted_edges': True, 'symmetrize_mode': 'mutual', 'use_snp_selection': True, 'num_snps': 2764}. Best is trial 19 with value: 0.09185206122090518.
[I 2025-11-03 13:34:57,778] Trial 23 finished with value: 0.008680069113486849 and parameters: {'model_type': 'graphsage', 'hidden_dims': '[256, 128, 64]', 'dropout': 0.5290437649053235, 'batch_norm': False, 'lr': 1.2216838915906037e-05, 'weight_decay': 0.00034888345360405235, 'epochs': 309, 'loss': 'mse', 'optimizer': 'adam', 'graph_mode': 'knn', 'source': 'grm', 'knn_k': 8, 'weighted_edges': True, 'symmetrize_mode': 'mutual', 'use_snp_selection': True, 'num_snps': 8802}. Best is trial 19 with value: 0.09185206122090518.
[I 2025-11-03 13:35:00,801] Trial 24 finished with value: 0.016407742134493294 and parameters: {'model_type': 'graphsage', 'hidden_dims': '[512, 64]', 'dropout': 0.38721508434777135, 'batch_norm': False, 'lr': 3.5172805346094437e-06, 'weight_decay': 3.9911783289658075e-05, 'epochs': 347, 'loss': 'mse', 'optimizer': 'adam', 'graph_mode': 'knn', 'source': 'grm', 'knn_k': 10, 'weighted_edges': False, 'symmetrize_mode': 'union', 'use_snp_selection': True, 'num_snps': 19623}. Best is trial 19 with value: 0.09185206122090518.
[I 2025-11-03 13:35:03,301] Trial 25 finished with value: 0.017419345826577698 and parameters: {'model_type': 'graphsage', 'hidden_dims': '[256, 128, 64]', 'dropout': 0.488569772972971, 'batch_norm': False, 'lr': 5.7131874897536755e-05, 'weight_decay': 0.00044305005868005, 'epochs': 270, 'loss': 'mse', 'optimizer': 'adam', 'graph_mode': 'knn', 'source': 'grm', 'knn_k': 8, 'weighted_edges': True, 'symmetrize_mode': 'mutual', 'use_snp_selection': True, 'num_snps': 9786}. Best is trial 19 with value: 0.09185206122090518.
[I 2025-11-03 13:35:06,409] Trial 26 finished with value: 0.017853761257064157 and parameters: {'model_type': 'graphsage', 'hidden_dims': '[256, 128, 64]', 'dropout': 0.5460812638300147, 'batch_norm': False, 'lr': 1.704298868362144e-05, 'weight_decay': 0.0001526703433389577, 'epochs': 308, 'loss': 'mse', 'optimizer': 'adam', 'graph_mode': 'cutoff', 'cutoff': 0.8550725812234301, 'grm_norm': 'cosine_then_gcn', 'self_loops': True, 'use_snp_selection': True, 'num_snps': 22139}. Best is trial 19 with value: 0.09185206122090518.
[I 2025-11-03 13:35:09,194] Trial 27 finished with value: 0.001118098478272267 and parameters: {'model_type': 'graphsage', 'hidden_dims': '[256, 128, 64]', 'dropout': 0.4308001026645123, 'batch_norm': False, 'lr': 7.428138715459902e-06, 'weight_decay': 0.0008686769009076002, 'epochs': 349, 'loss': 'mse', 'optimizer': 'adam', 'graph_mode': 'knn', 'source': 'grm', 'knn_k': 5, 'weighted_edges': True, 'symmetrize_mode': 'mutual', 'use_snp_selection': True, 'num_snps': 7706}. Best is trial 19 with value: 0.09185206122090518.
[I 2025-11-03 13:35:11,307] Trial 28 finished with value: 0.03587306464640355 and parameters: {'model_type': 'graphsage', 'hidden_dims': '[256, 128, 64]', 'dropout': 0.29146818239536665, 'batch_norm': False, 'lr': 2.4774130572118354e-05, 'weight_decay': 3.958035130592323e-07, 'epochs': 254, 'loss': 'mse', 'optimizer': 'adam', 'graph_mode': 'cutoff', 'cutoff': 0.6435358249504257, 'grm_norm': 'cosine', 'self_loops': False, 'use_snp_selection': True, 'num_snps': 2153}. Best is trial 19 with value: 0.09185206122090518.
[I 2025-11-03 13:35:15,756] Trial 29 finished with value: 0.03266226268739626 and parameters: {'model_type': 'graphsage', 'hidden_dims': '[512, 128]', 'dropout': 0.25190852979446493, 'batch_norm': False, 'lr': 0.00010299837783030175, 'weight_decay': 6.0568683180794705e-05, 'epochs': 320, 'loss': 'mse', 'optimizer': 'adam', 'graph_mode': 'knn', 'source': 'grm', 'knn_k': 9, 'weighted_edges': True, 'symmetrize_mode': 'mutual', 'use_snp_selection': True, 'num_snps': 39586}. Best is trial 19 with value: 0.09185206122090518.
[I 2025-11-03 13:35:18,269] Trial 30 finished with value: 0.044117758905612287 and parameters: {'model_type': 'graphsage', 'hidden_dims': '[512, 64]', 'dropout': 0.3399053274377395, 'batch_norm': False, 'lr': 2.6438882509259694e-06, 'weight_decay': 9.388991241163642e-05, 'epochs': 289, 'loss': 'mse', 'optimizer': 'adam', 'graph_mode': 'knn', 'source': 'grm', 'knn_k': 6, 'weighted_edges': False, 'symmetrize_mode': 'union', 'use_snp_selection': True, 'num_snps': 12930}. Best is trial 19 with value: 0.09185206122090518.
[I 2025-11-03 13:35:20,965] Trial 31 finished with value: 0.02724456459517398 and parameters: {'model_type': 'graphsage', 'hidden_dims': '[256, 128]', 'dropout': 0.5161261667718051, 'batch_norm': False, 'lr': 1.3297346431240096e-05, 'weight_decay': 0.0009756769857570229, 'epochs': 182, 'loss': 'mse', 'optimizer': 'adam', 'graph_mode': 'cutoff', 'cutoff': 0.5540169847349887, 'grm_norm': 'none', 'self_loops': False, 'use_snp_selection': True, 'num_snps': 31252}. Best is trial 19 with value: 0.09185206122090518.
[I 2025-11-03 13:35:23,549] Trial 32 finished with value: 0.028613442274958472 and parameters: {'model_type': 'graphsage', 'hidden_dims': '[128, 64]', 'dropout': 0.5630170701500498, 'batch_norm': False, 'lr': 0.0005592695999291651, 'weight_decay': 0.00028051168842793174, 'epochs': 220, 'loss': 'mse', 'optimizer': 'adam', 'graph_mode': 'cutoff', 'cutoff': 0.5627446166693147, 'grm_norm': 'gcn', 'self_loops': False, 'use_snp_selection': True, 'num_snps': 28328}. Best is trial 19 with value: 0.09185206122090518.
[I 2025-11-03 13:35:25,893] Trial 33 finished with value: 0.002719695438552403 and parameters: {'model_type': 'graphsage', 'hidden_dims': '[256, 128]', 'dropout': 0.49623347877081597, 'batch_norm': False, 'lr': 4.4931679507982794e-05, 'weight_decay': 0.0005675266480797592, 'epochs': 138, 'loss': 'mse', 'optimizer': 'adam', 'graph_mode': 'cutoff', 'cutoff': 0.4438908807219881, 'grm_norm': 'none', 'self_loops': False, 'use_snp_selection': True, 'num_snps': 25620}. Best is trial 19 with value: 0.09185206122090518.
[I 2025-11-03 13:35:28,393] Trial 34 finished with value: 0.0005042617084340626 and parameters: {'model_type': 'graphsage', 'hidden_dims': '[128, 64]', 'dropout': 0.394193001175609, 'batch_norm': False, 'lr': 0.00015134827354355092, 'weight_decay': 3.5138932613924877e-05, 'epochs': 101, 'loss': 'mse', 'optimizer': 'adam', 'graph_mode': 'cutoff', 'cutoff': 0.7765209980434609, 'grm_norm': 'gcn', 'self_loops': False, 'use_snp_selection': True, 'num_snps': 36175}. Best is trial 19 with value: 0.09185206122090518.
[I 2025-11-03 13:35:30,206] Trial 35 finished with value: 0.03186062956170084 and parameters: {'model_type': 'graphsage', 'hidden_dims': '[256, 128]', 'dropout': 0.17109478935532324, 'batch_norm': False, 'lr': 2.9537622954642845e-05, 'weight_decay': 0.00015762154251899684, 'epochs': 181, 'loss': 'mse', 'optimizer': 'adam', 'graph_mode': 'cutoff', 'cutoff': 0.6094392969884643, 'grm_norm': 'cosine_then_gcn', 'self_loops': False, 'use_snp_selection': True, 'num_snps': 6586}. Best is trial 19 with value: 0.09185206122090518.
[I 2025-11-03 13:35:32,697] Trial 36 finished with value: 0.006668775471009262 and parameters: {'model_type': 'graphsage', 'hidden_dims': '[256, 128, 64]', 'dropout': 0.47137421911046606, 'batch_norm': True, 'lr': 5.344219101178794e-06, 'weight_decay': 0.0003724222200698687, 'epochs': 166, 'loss': 'mae', 'optimizer': 'adam', 'graph_mode': 'knn', 'source': 'grm', 'knn_k': 9, 'weighted_edges': True, 'symmetrize_mode': 'mutual', 'use_snp_selection': False}. Best is trial 19 with value: 0.09185206122090518.
[I 2025-11-03 13:35:36,483] Trial 37 finished with value: -0.03576439153443825 and parameters: {'model_type': 'graphsage', 'hidden_dims': '[256, 128, 64]', 'dropout': 0.5431678917342131, 'batch_norm': False, 'lr': 0.0005438828525511093, 'weight_decay': 0.0005527936388906696, 'epochs': 204, 'loss': 'mse', 'optimizer': 'adam', 'graph_mode': 'cutoff', 'cutoff': 0.4997510941553579, 'grm_norm': 'cosine', 'self_loops': False, 'use_snp_selection': True, 'num_snps': 50036}. Best is trial 19 with value: 0.09185206122090518.
[I 2025-11-03 13:35:39,423] Trial 38 finished with value: 0.03615831943482602 and parameters: {'model_type': 'graphsage', 'hidden_dims': '[256, 128]', 'dropout': 0.4145333227452426, 'batch_norm': True, 'lr': 0.0003012079080112919, 'weight_decay': 1.5958228341071856e-05, 'epochs': 315, 'loss': 'mse', 'optimizer': 'adam', 'graph_mode': 'knn', 'source': 'grm', 'knn_k': 7, 'weighted_edges': True, 'symmetrize_mode': 'mutual', 'use_snp_selection': False}. Best is trial 19 with value: 0.09185206122090518.
[I 2025-11-03 13:35:42,114] Trial 39 finished with value: 0.0019659323418531943 and parameters: {'model_type': 'graphsage', 'hidden_dims': '[128, 64]', 'dropout': 0.49316552141494296, 'batch_norm': False, 'lr': 2.0781727260228506e-05, 'weight_decay': 0.00025979673794076716, 'epochs': 332, 'loss': 'mae', 'optimizer': 'adam', 'graph_mode': 'cutoff', 'cutoff': 0.3371022609626222, 'grm_norm': 'gcn', 'self_loops': True, 'use_snp_selection': True, 'num_snps': 16745}. Best is trial 19 with value: 0.09185206122090518.
