[I 2025-11-03 14:25:55,373] Trial 115 finished with value: 0.1382255420633689 and parameters: {'model_type': 'gcn', 'hidden_dims': '[256, 128]', 'dropout': 0.4027995556647166, 'batch_norm': True, 'lr': 0.0008641856959524712, 'weight_decay': 9.155987651296965e-06, 'epochs': 185, 'loss': 'mse', 'optimizer': 'adam', 'graph_mode': 'knn', 'source': 'grm', 'knn_k': 1, 'weighted_edges': True, 'symmetrize_mode': 'mutual', 'use_snp_selection': False}. Best is trial 114 with value: 0.1463315428789703.
[I 2025-11-03 14:25:57,290] Trial 116 finished with value: 0.11009296687397652 and parameters: {'model_type': 'gcn', 'hidden_dims': '[256, 128]', 'dropout': 0.11553388088906338, 'batch_norm': True, 'lr': 0.0008440189582626951, 'weight_decay': 9.356071721601033e-06, 'epochs': 186, 'loss': 'mse', 'optimizer': 'adam', 'graph_mode': 'knn', 'source': 'grm', 'knn_k': 2, 'weighted_edges': True, 'symmetrize_mode': 'mutual', 'use_snp_selection': False}. Best is trial 114 with value: 0.1463315428789703.
[I 2025-11-03 14:25:59,267] Trial 117 finished with value: 0.12937835466645567 and parameters: {'model_type': 'gcn', 'hidden_dims': '[256, 128]', 'dropout': 0.4032570302127436, 'batch_norm': True, 'lr': 0.0007891625693440195, 'weight_decay': 7.789380934336871e-06, 'epochs': 199, 'loss': 'mse', 'optimizer': 'adam', 'graph_mode': 'knn', 'source': 'grm', 'knn_k': 1, 'weighted_edges': True, 'symmetrize_mode': 'mutual', 'use_snp_selection': False}. Best is trial 114 with value: 0.1463315428789703.
[I 2025-11-03 14:26:01,055] Trial 118 finished with value: 0.14635046646420216 and parameters: {'model_type': 'gcn', 'hidden_dims': '[256, 128]', 'dropout': 0.3954239791785793, 'batch_norm': True, 'lr': 0.0005943778362191103, 'weight_decay': 6.1849571869489916e-06, 'epochs': 168, 'loss': 'mse', 'optimizer': 'adam', 'graph_mode': 'cutoff', 'cutoff': 0.8049124137721202, 'grm_norm': 'gcn', 'self_loops': True, 'use_snp_selection': False}. Best is trial 118 with value: 0.14635046646420216.
[I 2025-11-03 14:26:03,021] Trial 119 finished with value: 0.1372961223205815 and parameters: {'model_type': 'gcn', 'hidden_dims': '[256, 128]', 'dropout': 0.37753369852397295, 'batch_norm': True, 'lr': 0.0005815327574956624, 'weight_decay': 0.0008223462334845251, 'epochs': 208, 'loss': 'mse', 'optimizer': 'adam', 'graph_mode': 'cutoff', 'cutoff': 0.8307318547303627, 'grm_norm': 'gcn', 'self_loops': True, 'use_snp_selection': False}. Best is trial 118 with value: 0.14635046646420216.
[I 2025-11-03 14:26:05,680] Trial 120 finished with value: 0.12048759109086252 and parameters: {'model_type': 'gcn', 'hidden_dims': '[512, 128]', 'dropout': 0.36863110472249544, 'batch_norm': True, 'lr': 0.0006115088151625935, 'weight_decay': 0.0001233273702879883, 'epochs': 206, 'loss': 'mse', 'optimizer': 'adam', 'graph_mode': 'cutoff', 'cutoff': 0.8060252381240158, 'grm_norm': 'gcn', 'self_loops': True, 'use_snp_selection': False}. Best is trial 118 with value: 0.14635046646420216.
[I 2025-11-03 14:26:07,567] Trial 121 finished with value: 0.14808200425066217 and parameters: {'model_type': 'gcn', 'hidden_dims': '[256, 128]', 'dropout': 0.3791786037197307, 'batch_norm': True, 'lr': 0.0007305205034499148, 'weight_decay': 0.0003027507669279721, 'epochs': 189, 'loss': 'mse', 'optimizer': 'adam', 'graph_mode': 'cutoff', 'cutoff': 0.6598699382010551, 'grm_norm': 'gcn', 'self_loops': True, 'use_snp_selection': False}. Best is trial 121 with value: 0.14808200425066217.
[I 2025-11-03 14:26:09,447] Trial 122 finished with value: 0.14293549853505746 and parameters: {'model_type': 'gcn', 'hidden_dims': '[256, 128]', 'dropout': 0.37973956732892516, 'batch_norm': True, 'lr': 0.0009994162921995798, 'weight_decay': 0.0005760299514635957, 'epochs': 187, 'loss': 'mse', 'optimizer': 'adam', 'graph_mode': 'cutoff', 'cutoff': 0.6499249196579728, 'grm_norm': 'gcn', 'self_loops': True, 'use_snp_selection': False}. Best is trial 121 with value: 0.14808200425066217.
[I 2025-11-03 14:26:11,345] Trial 123 finished with value: 0.13584633255761533 and parameters: {'model_type': 'gcn', 'hidden_dims': '[256, 128]', 'dropout': 0.3798557071326953, 'batch_norm': True, 'lr': 0.0007338122173389164, 'weight_decay': 0.00047426269847014965, 'epochs': 191, 'loss': 'mse', 'optimizer': 'adam', 'graph_mode': 'cutoff', 'cutoff': 0.6367317630363208, 'grm_norm': 'gcn', 'self_loops': True, 'use_snp_selection': False}. Best is trial 121 with value: 0.14808200425066217.
[I 2025-11-03 14:26:13,232] Trial 124 finished with value: 0.1322729423165231 and parameters: {'model_type': 'gcn', 'hidden_dims': '[256, 128]', 'dropout': 0.34151911089229564, 'batch_norm': True, 'lr': 0.000743692372392681, 'weight_decay': 0.0006066493409062374, 'epochs': 189, 'loss': 'mse', 'optimizer': 'adam', 'graph_mode': 'cutoff', 'cutoff': 0.6572852740472971, 'grm_norm': 'gcn', 'self_loops': True, 'use_snp_selection': False}. Best is trial 121 with value: 0.14808200425066217.
[I 2025-11-03 14:26:15,941] Trial 125 finished with value: 0.13445026611227393 and parameters: {'model_type': 'gcn', 'hidden_dims': '[512, 256]', 'dropout': 0.3751037454243537, 'batch_norm': True, 'lr': 0.0008528240235235535, 'weight_decay': 0.00043272591409823495, 'epochs': 212, 'loss': 'mse', 'optimizer': 'adam', 'graph_mode': 'cutoff', 'cutoff': 0.63070733874782, 'grm_norm': 'gcn', 'self_loops': True, 'use_snp_selection': False}. Best is trial 121 with value: 0.14808200425066217.
[I 2025-11-03 14:26:17,980] Trial 126 finished with value: 0.035512270928223184 and parameters: {'model_type': 'gcn', 'hidden_dims': '[256, 128]', 'dropout': 0.3896506706022931, 'batch_norm': True, 'lr': 1.0013725580650348e-06, 'weight_decay': 0.0009970259067006101, 'epochs': 223, 'loss': 'mse', 'optimizer': 'adam', 'graph_mode': 'cutoff', 'cutoff': 0.8038909706891619, 'grm_norm': 'gcn', 'self_loops': True, 'use_snp_selection': False}. Best is trial 121 with value: 0.14808200425066217.
[I 2025-11-03 14:26:20,059] Trial 127 finished with value: 0.13603494449816841 and parameters: {'model_type': 'gcn', 'hidden_dims': '[256, 128]', 'dropout': 0.35252828490819604, 'batch_norm': True, 'lr': 0.0005753592233049683, 'weight_decay': 0.00026229052048776604, 'epochs': 232, 'loss': 'mse', 'optimizer': 'adam', 'graph_mode': 'cutoff', 'cutoff': 0.7960771130878261, 'grm_norm': 'gcn', 'self_loops': True, 'use_snp_selection': False}. Best is trial 121 with value: 0.14808200425066217.
[I 2025-11-03 14:26:22,185] Trial 128 finished with value: 0.135655196339225 and parameters: {'model_type': 'gcn', 'hidden_dims': '[256, 128]', 'dropout': 0.33074889888754183, 'batch_norm': True, 'lr': 0.0005638436315507306, 'weight_decay': 0.0006997044861699225, 'epochs': 241, 'loss': 'mse', 'optimizer': 'adam', 'graph_mode': 'cutoff', 'cutoff': 0.8010933767328836, 'grm_norm': 'gcn', 'self_loops': True, 'use_snp_selection': False}. Best is trial 121 with value: 0.14808200425066217.
[I 2025-11-03 14:26:24,613] Trial 129 finished with value: 0.1430022646121824 and parameters: {'model_type': 'gcn', 'hidden_dims': '[512, 64]', 'dropout': 0.3526282192879756, 'batch_norm': True, 'lr': 0.0008653002426378657, 'weight_decay': 0.0002463571296597291, 'epochs': 173, 'loss': 'mse', 'optimizer': 'adam', 'graph_mode': 'cutoff', 'cutoff': 0.7417949606756558, 'grm_norm': 'gcn', 'self_loops': True, 'use_snp_selection': False}. Best is trial 121 with value: 0.14808200425066217.
[I 2025-11-03 14:26:27,050] Trial 130 finished with value: 0.13259293302467315 and parameters: {'model_type': 'gcn', 'hidden_dims': '[512, 64]', 'dropout': 0.40399288898222785, 'batch_norm': True, 'lr': 0.0008752176070019005, 'weight_decay': 0.0003316265256784005, 'epochs': 174, 'loss': 'mse', 'optimizer': 'adam', 'graph_mode': 'cutoff', 'cutoff': 0.7237643488430976, 'grm_norm': 'gcn', 'self_loops': True, 'use_snp_selection': False}. Best is trial 121 with value: 0.14808200425066217.
[I 2025-11-03 14:26:29,656] Trial 131 finished with value: 0.1289072189782342 and parameters: {'model_type': 'gcn', 'hidden_dims': '[512, 64]', 'dropout': 0.3467214549566219, 'batch_norm': True, 'lr': 0.0009927524038735836, 'weight_decay': 0.0002039703646152828, 'epochs': 199, 'loss': 'mse', 'optimizer': 'adam', 'graph_mode': 'cutoff', 'cutoff': 0.8404530541691452, 'grm_norm': 'gcn', 'self_loops': True, 'use_snp_selection': False}. Best is trial 121 with value: 0.14808200425066217.
[I 2025-11-03 14:26:32,634] Trial 132 finished with value: 0.13462357207715694 and parameters: {'model_type': 'gcn', 'hidden_dims': '[512, 64]', 'dropout': 0.3675410148683584, 'batch_norm': True, 'lr': 0.0007346361626863601, 'weight_decay': 0.0003081652469829315, 'epochs': 251, 'loss': 'mse', 'optimizer': 'adam', 'graph_mode': 'cutoff', 'cutoff': 0.7558478154671884, 'grm_norm': 'gcn', 'self_loops': True, 'use_snp_selection': False}. Best is trial 121 with value: 0.14808200425066217.
[I 2025-11-03 14:26:35,451] Trial 133 finished with value: 0.14419052314204212 and parameters: {'model_type': 'gcn', 'hidden_dims': '[512, 64]', 'dropout': 0.31421678874390446, 'batch_norm': True, 'lr': 0.00038870223741040855, 'weight_decay': 0.0007518764430067108, 'epochs': 228, 'loss': 'mse', 'optimizer': 'adam', 'graph_mode': 'cutoff', 'cutoff': 0.7051499740630393, 'grm_norm': 'gcn', 'self_loops': True, 'use_snp_selection': False}. Best is trial 121 with value: 0.14808200425066217.
[I 2025-11-03 14:26:37,845] Trial 134 finished with value: 0.1164811240274891 and parameters: {'model_type': 'gcn', 'hidden_dims': '[512, 64]', 'dropout': 0.392262514198796, 'batch_norm': True, 'lr': 0.0003820562332327529, 'weight_decay': 0.0005564889915774868, 'epochs': 168, 'loss': 'mse', 'optimizer': 'adam', 'graph_mode': 'cutoff', 'cutoff': 0.7126562910786072, 'grm_norm': 'gcn', 'self_loops': True, 'use_snp_selection': False}. Best is trial 121 with value: 0.14808200425066217.
[I 2025-11-03 14:26:40,512] Trial 135 finished with value: 0.1334759387098796 and parameters: {'model_type': 'gcn', 'hidden_dims': '[512, 64]', 'dropout': 0.35366728404453557, 'batch_norm': True, 'lr': 0.000878337147493829, 'weight_decay': 0.0008662981321386561, 'epochs': 207, 'loss': 'mse', 'optimizer': 'adam', 'graph_mode': 'cutoff', 'cutoff': 0.6840758663965943, 'grm_norm': 'gcn', 'self_loops': True, 'use_snp_selection': False}. Best is trial 121 with value: 0.14808200425066217.
[I 2025-11-03 14:26:42,356] Trial 136 finished with value: 0.13197195488094837 and parameters: {'model_type': 'gcn', 'hidden_dims': '[256, 128]', 'dropout': 0.28766038757501144, 'batch_norm': True, 'lr': 0.0006671381013847808, 'weight_decay': 0.0006819415236072302, 'epochs': 177, 'loss': 'mae', 'optimizer': 'adam', 'graph_mode': 'cutoff', 'cutoff': 0.6053757417923117, 'grm_norm': 'gcn', 'self_loops': True, 'use_snp_selection': False}. Best is trial 121 with value: 0.14808200425066217.
[I 2025-11-03 14:26:44,960] Trial 137 finished with value: 0.13761464491841757 and parameters: {'model_type': 'gcn', 'hidden_dims': '[512, 64]', 'dropout': 0.31377248849603573, 'batch_norm': False, 'lr': 0.0005213989206529435, 'weight_decay': 0.0008959826244617438, 'epochs': 258, 'loss': 'mse', 'optimizer': 'adam', 'graph_mode': 'cutoff', 'cutoff': 0.8451585395897984, 'grm_norm': 'gcn', 'self_loops': True, 'use_snp_selection': True, 'num_snps': 23071}. Best is trial 121 with value: 0.14808200425066217.
[I 2025-11-03 14:26:47,547] Trial 138 finished with value: 0.11175989397885348 and parameters: {'model_type': 'gcn', 'hidden_dims': '[512, 64]', 'dropout': 0.3029101823929261, 'batch_norm': False, 'lr': 0.0007759607471573478, 'weight_decay': 0.0007702990124085692, 'epochs': 260, 'loss': 'mse', 'optimizer': 'adam', 'graph_mode': 'cutoff', 'cutoff': 0.8600379352212709, 'grm_norm': 'gcn', 'self_loops': True, 'use_snp_selection': True, 'num_snps': 21647}. Best is trial 121 with value: 0.14808200425066217.
[I 2025-11-03 14:26:49,446] Trial 139 finished with value: 0.1075698590689152 and parameters: {'model_type': 'gcn', 'hidden_dims': '[512, 64]', 'dropout': 0.30820749375345746, 'batch_norm': False, 'lr': 0.0005738004469240793, 'weight_decay': 0.0005203212187021005, 'epochs': 256, 'loss': 'mse', 'optimizer': 'adam', 'graph_mode': 'cutoff', 'cutoff': 0.7701957056704417, 'grm_norm': 'gcn', 'self_loops': True, 'use_snp_selection': True, 'num_snps': 9163}. Best is trial 121 with value: 0.14808200425066217.
[I 2025-11-03 14:26:52,114] Trial 140 finished with value: 0.0505687810849332 and parameters: {'model_type': 'gcn', 'hidden_dims': '[512, 64]', 'dropout': 0.3351765967666283, 'batch_norm': False, 'lr': 0.0009979631887183874, 'weight_decay': 0.0009551462019194464, 'epochs': 280, 'loss': 'mse', 'optimizer': 'adam', 'graph_mode': 'cutoff', 'cutoff': 0.8420022342431801, 'grm_norm': 'gcn', 'self_loops': True, 'use_snp_selection': True, 'num_snps': 22479}. Best is trial 121 with value: 0.14808200425066217.
[I 2025-11-03 14:26:55,074] Trial 141 finished with value: 0.09526285047168666 and parameters: {'model_type': 'gcn', 'hidden_dims': '[512, 64]', 'dropout': 0.31079252800173174, 'batch_norm': False, 'lr': 0.0004349413108488389, 'weight_decay': 0.00016190579683376754, 'epochs': 186, 'loss': 'mse', 'optimizer': 'adam', 'graph_mode': 'cutoff', 'cutoff': 0.7034697103172712, 'grm_norm': 'gcn', 'self_loops': True, 'use_snp_selection': True, 'num_snps': 34997}. Best is trial 121 with value: 0.14808200425066217.
[I 2025-11-03 14:26:58,192] Trial 142 finished with value: 0.11277875387806617 and parameters: {'model_type': 'gcn', 'hidden_dims': '[512, 64]', 'dropout': 0.3840227996647157, 'batch_norm': False, 'lr': 0.000509950355421245, 'weight_decay': 0.0008246107085200305, 'epochs': 314, 'loss': 'mse', 'optimizer': 'adam', 'graph_mode': 'cutoff', 'cutoff': 0.6040748910710458, 'grm_norm': 'gcn', 'self_loops': True, 'use_snp_selection': True, 'num_snps': 27542}. Best is trial 121 with value: 0.14808200425066217.
[I 2025-11-03 14:27:00,957] Trial 143 finished with value: 0.1335127498940694 and parameters: {'model_type': 'gcn', 'hidden_dims': '[512, 64]', 'dropout': 0.3193222694998138, 'batch_norm': True, 'lr': 0.0006483513331255955, 'weight_decay': 0.0005841991342971371, 'epochs': 221, 'loss': 'mse', 'optimizer': 'adam', 'graph_mode': 'cutoff', 'cutoff': 0.7534959013959538, 'grm_norm': 'gcn', 'self_loops': True, 'use_snp_selection': False}. Best is trial 121 with value: 0.14808200425066217.
[I 2025-11-03 14:27:03,268] Trial 144 finished with value: 0.11904257476667876 and parameters: {'model_type': 'gcn', 'hidden_dims': '[512, 64]', 'dropout': 0.4006918762159658, 'batch_norm': True, 'lr': 0.00010650203643446451, 'weight_decay': 0.0003674015348011741, 'epochs': 154, 'loss': 'mse', 'optimizer': 'adam', 'graph_mode': 'cutoff', 'cutoff': 0.6729631072521872, 'grm_norm': 'none', 'self_loops': True, 'use_snp_selection': False}. Best is trial 121 with value: 0.14808200425066217.
[I 2025-11-03 14:27:05,214] Trial 145 finished with value: 0.1434888370896421 and parameters: {'model_type': 'gcn', 'hidden_dims': '[256, 128]', 'dropout': 0.369751605506812, 'batch_norm': True, 'lr': 0.0008488102426152542, 'weight_decay': 0.0006740500080844764, 'epochs': 195, 'loss': 'mse', 'optimizer': 'adam', 'graph_mode': 'cutoff', 'cutoff': 0.5264801037422805, 'grm_norm': 'gcn', 'self_loops': True, 'use_snp_selection': False}. Best is trial 121 with value: 0.14808200425066217.
[I 2025-11-03 14:27:07,506] Trial 146 finished with value: 0.1284832177523422 and parameters: {'model_type': 'gcn', 'hidden_dims': '[256, 128]', 'dropout': 0.3688881513810002, 'batch_norm': True, 'lr': 0.0008508898306082861, 'weight_decay': 0.0004447066060953825, 'epochs': 270, 'loss': 'mse', 'optimizer': 'adam', 'graph_mode': 'cutoff', 'cutoff': 0.5287635281422759, 'grm_norm': 'gcn', 'self_loops': True, 'use_snp_selection': False}. Best is trial 121 with value: 0.14808200425066217.
[I 2025-11-03 14:27:10,384] Trial 147 finished with value: 0.14440514918282651 and parameters: {'model_type': 'gcn', 'hidden_dims': '[512, 128]', 'dropout': 0.37776307703422796, 'batch_norm': True, 'lr': 0.0007113063404247924, 'weight_decay': 0.0007067927206333107, 'epochs': 232, 'loss': 'mse', 'optimizer': 'adam', 'graph_mode': 'cutoff', 'cutoff': 0.8436369724591384, 'grm_norm': 'gcn', 'self_loops': True, 'use_snp_selection': False}. Best is trial 121 with value: 0.14808200425066217.
[I 2025-11-03 14:27:12,242] Trial 148 finished with value: 0.07719243365977657 and parameters: {'model_type': 'gcn', 'hidden_dims': '[512, 128]', 'dropout': 0.3581869346868354, 'batch_norm': False, 'lr': 0.000713470399581664, 'weight_decay': 0.0007215961564800671, 'epochs': 234, 'loss': 'mse', 'optimizer': 'adam', 'graph_mode': 'cutoff', 'cutoff': 0.5175548348606681, 'grm_norm': 'gcn', 'self_loops': True, 'use_snp_selection': True, 'num_snps': 8601}. Best is trial 121 with value: 0.14808200425066217.
[I 2025-11-03 14:27:15,190] Trial 149 finished with value: 0.1375289797820304 and parameters: {'model_type': 'gcn', 'hidden_dims': '[512, 128]', 'dropout': 0.3762823506671436, 'batch_norm': True, 'lr': 0.0005266062854614276, 'weight_decay': 0.00061088845255402, 'epochs': 245, 'loss': 'mse', 'optimizer': 'adam', 'graph_mode': 'cutoff', 'cutoff': 0.8399970313414038, 'grm_norm': 'gcn', 'self_loops': True, 'use_snp_selection': False}. Best is trial 121 with value: 0.14808200425066217.
[I 2025-11-03 14:27:17,207] Trial 0 finished with value: 0.030534265503344798 and parameters: {'model_type': 'gcn', 'hidden_dims': '[128, 64]', 'dropout': 0.199031432379812, 'batch_norm': True, 'lr': 1.8408544111075837e-06, 'weight_decay': 5.5136510071208614e-05, 'epochs': 334, 'loss': 'mae', 'optimizer': 'adam', 'graph_mode': 'knn', 'source': 'grm', 'knn_k': 8, 'weighted_edges': True, 'symmetrize_mode': 'mutual', 'use_snp_selection': False}. Best is trial 0 with value: 0.030534265503344798.
[I 2025-11-03 14:27:18,318] Trial 1 finished with value: -0.0027783182685926044 and parameters: {'model_type': 'gcn', 'hidden_dims': '[128, 64]', 'dropout': 0.40051947670227217, 'batch_norm': True, 'lr': 0.0005320428882732732, 'weight_decay': 1.89210117736594e-06, 'epochs': 32, 'loss': 'mse', 'optimizer': 'adam', 'graph_mode': 'knn', 'source': 'grm', 'knn_k': 7, 'weighted_edges': True, 'symmetrize_mode': 'union', 'use_snp_selection': False}. Best is trial 0 with value: 0.030534265503344798.
[I 2025-11-03 14:27:20,518] Trial 2 finished with value: 0.023584299138779467 and parameters: {'model_type': 'gcn', 'hidden_dims': '[256, 128]', 'dropout': 0.5105528289184642, 'batch_norm': False, 'lr': 0.0006804279372404962, 'weight_decay': 0.0008922815224257085, 'epochs': 160, 'loss': 'mse', 'optimizer': 'adam', 'graph_mode': 'cutoff', 'cutoff': 0.5741905641612706, 'grm_norm': 'gcn', 'self_loops': False, 'use_snp_selection': True, 'num_snps': 26910}. Best is trial 0 with value: 0.030534265503344798.
[I 2025-11-03 14:27:22,827] Trial 3 finished with value: 0.017210021682469562 and parameters: {'model_type': 'gcn', 'hidden_dims': '[256, 128, 64]', 'dropout': 0.5390483213624292, 'batch_norm': False, 'lr': 3.4705625989073525e-05, 'weight_decay': 2.4623319020131338e-05, 'epochs': 92, 'loss': 'mse', 'optimizer': 'adam', 'graph_mode': 'knn', 'source': 'grm', 'knn_k': 6, 'weighted_edges': False, 'symmetrize_mode': 'mutual', 'use_snp_selection': True, 'num_snps': 30713}. Best is trial 0 with value: 0.030534265503344798.
[I 2025-11-03 14:27:25,146] Trial 4 finished with value: 0.017817040388577933 and parameters: {'model_type': 'gcn', 'hidden_dims': '[128, 64]', 'dropout': 0.13404863676897502, 'batch_norm': False, 'lr': 0.0001431556295367288, 'weight_decay': 2.2084517750726675e-05, 'epochs': 13, 'loss': 'mae', 'optimizer': 'adam', 'graph_mode': 'cutoff', 'cutoff': 0.6714268476993044, 'grm_norm': 'none', 'self_loops': False, 'use_snp_selection': True, 'num_snps': 45645}. Best is trial 0 with value: 0.030534265503344798.
[I 2025-11-03 14:27:27,930] Trial 5 finished with value: -0.01962746612686593 and parameters: {'model_type': 'gcn', 'hidden_dims': '[256, 128]', 'dropout': 0.42253606323412096, 'batch_norm': False, 'lr': 4.238630400638805e-05, 'weight_decay': 8.074086040046576e-07, 'epochs': 134, 'loss': 'mae', 'optimizer': 'adam', 'graph_mode': 'knn', 'source': 'grm', 'knn_k': 1, 'weighted_edges': False, 'symmetrize_mode': 'mutual', 'use_snp_selection': True, 'num_snps': 43113}. Best is trial 0 with value: 0.030534265503344798.
[I 2025-11-03 14:27:30,613] Trial 6 finished with value: -0.005918421768122229 and parameters: {'model_type': 'gcn', 'hidden_dims': '[512, 256]', 'dropout': 0.3534893146320237, 'batch_norm': True, 'lr': 0.000251307964226932, 'weight_decay': 1.821819791794022e-05, 'epochs': 207, 'loss': 'mae', 'optimizer': 'adam', 'graph_mode': 'knn', 'source': 'grm', 'knn_k': 1, 'weighted_edges': True, 'symmetrize_mode': 'mutual', 'use_snp_selection': False}. Best is trial 0 with value: 0.030534265503344798.
[I 2025-11-03 14:27:32,960] Trial 7 finished with value: 0.008271354778703523 and parameters: {'model_type': 'gcn', 'hidden_dims': '[512, 256]', 'dropout': 0.1105825955860775, 'batch_norm': True, 'lr': 2.374338412754043e-05, 'weight_decay': 1.1284721123340274e-05, 'epochs': 170, 'loss': 'mse', 'optimizer': 'adam', 'graph_mode': 'cutoff', 'cutoff': 0.719872204109604, 'grm_norm': 'gcn', 'self_loops': False, 'use_snp_selection': False}. Best is trial 0 with value: 0.030534265503344798.
[I 2025-11-03 14:27:34,791] Trial 8 finished with value: 0.0001401536108199788 and parameters: {'model_type': 'gcn', 'hidden_dims': '[512, 128]', 'dropout': 0.5066580418354021, 'batch_norm': True, 'lr': 0.00039213678276659976, 'weight_decay': 3.43655320802934e-06, 'epochs': 91, 'loss': 'mse', 'optimizer': 'adam', 'graph_mode': 'cutoff', 'cutoff': 0.34923059576505366, 'grm_norm': 'cosine', 'self_loops': True, 'use_snp_selection': False}. Best is trial 0 with value: 0.030534265503344798.
