[I 2025-11-03 12:21:50,367] Trial 9 finished with value: -0.03196538967172619 and parameters: {'model_type': 'gcn', 'hidden_dims': '[512, 256]', 'dropout': 0.301734920240333, 'batch_norm': False, 'lr': 6.650961854953448e-06, 'weight_decay': 6.861575656590315e-05, 'epochs': 125, 'loss': 'mae', 'optimizer': 'adam', 'graph_mode': 'cutoff', 'cutoff': 0.2857569870061939, 'grm_norm': 'cosine_then_gcn', 'self_loops': False, 'use_snp_selection': True, 'num_snps': 12722}. Best is trial 6 with value: 0.022837550690999395.
[I 2025-11-03 12:21:53,563] Trial 10 finished with value: 0.025461597478454792 and parameters: {'model_type': 'gcn', 'hidden_dims': '[512, 64]', 'dropout': 0.2833599465317005, 'batch_norm': True, 'lr': 0.00016916760584270694, 'weight_decay': 1.7866650996308468e-07, 'epochs': 266, 'loss': 'mae', 'optimizer': 'adam', 'graph_mode': 'knn', 'source': 'grm', 'knn_k': 1, 'weighted_edges': True, 'symmetrize_mode': 'union', 'use_snp_selection': False}. Best is trial 10 with value: 0.025461597478454792.
[I 2025-11-03 12:21:56,746] Trial 11 finished with value: 0.013660383846593746 and parameters: {'model_type': 'gcn', 'hidden_dims': '[512, 64]', 'dropout': 0.2859699507705008, 'batch_norm': True, 'lr': 0.00012623783700890367, 'weight_decay': 1.6805209943987688e-07, 'epochs': 265, 'loss': 'mae', 'optimizer': 'adam', 'graph_mode': 'knn', 'source': 'grm', 'knn_k': 1, 'weighted_edges': True, 'symmetrize_mode': 'union', 'use_snp_selection': False}. Best is trial 10 with value: 0.025461597478454792.
[I 2025-11-03 12:21:59,784] Trial 12 finished with value: 0.026335516476865575 and parameters: {'model_type': 'gcn', 'hidden_dims': '[512, 64]', 'dropout': 0.2516138819478735, 'batch_norm': True, 'lr': 0.00016473964335013254, 'weight_decay': 1.0888016761521717e-07, 'epochs': 241, 'loss': 'mae', 'optimizer': 'adam', 'graph_mode': 'knn', 'source': 'grm', 'knn_k': 3, 'weighted_edges': True, 'symmetrize_mode': 'union', 'use_snp_selection': False}. Best is trial 12 with value: 0.026335516476865575.
[I 2025-11-03 12:22:02,913] Trial 13 finished with value: 0.00576832489825294 and parameters: {'model_type': 'gcn', 'hidden_dims': '[512, 64]', 'dropout': 0.24309647664877107, 'batch_norm': True, 'lr': 8.49851536138356e-05, 'weight_decay': 1.1697174867672891e-07, 'epochs': 254, 'loss': 'mae', 'optimizer': 'adam', 'graph_mode': 'knn', 'source': 'grm', 'knn_k': 4, 'weighted_edges': True, 'symmetrize_mode': 'union', 'use_snp_selection': False}. Best is trial 12 with value: 0.026335516476865575.
[I 2025-11-03 12:22:06,597] Trial 14 finished with value: 0.0036344107673276288 and parameters: {'model_type': 'gcn', 'hidden_dims': '[512, 64]', 'dropout': 0.21126359993861654, 'batch_norm': True, 'lr': 1.2586985041154999e-05, 'weight_decay': 5.194076018798529e-07, 'epochs': 335, 'loss': 'mae', 'optimizer': 'adam', 'graph_mode': 'knn', 'source': 'grm', 'knn_k': 4, 'weighted_edges': True, 'symmetrize_mode': 'union', 'use_snp_selection': False}. Best is trial 12 with value: 0.026335516476865575.
[I 2025-11-03 12:22:09,802] Trial 15 finished with value: 0.031503960281094465 and parameters: {'model_type': 'gcn', 'hidden_dims': '[512, 64]', 'dropout': 0.342394432621743, 'batch_norm': True, 'lr': 0.00094645867610948, 'weight_decay': 3.982920789454622e-07, 'epochs': 266, 'loss': 'mae', 'optimizer': 'adam', 'graph_mode': 'knn', 'source': 'grm', 'knn_k': 3, 'weighted_edges': True, 'symmetrize_mode': 'union', 'use_snp_selection': False}. Best is trial 15 with value: 0.031503960281094465.
[I 2025-11-03 12:22:12,651] Trial 16 finished with value: 0.020399256793167498 and parameters: {'model_type': 'gcn', 'hidden_dims': '[512, 64]', 'dropout': 0.3912763499396328, 'batch_norm': True, 'lr': 0.0008000134635777176, 'weight_decay': 4.4574762736754364e-07, 'epochs': 215, 'loss': 'mae', 'optimizer': 'adam', 'graph_mode': 'knn', 'source': 'grm', 'knn_k': 4, 'weighted_edges': False, 'symmetrize_mode': 'union', 'use_snp_selection': False}. Best is trial 15 with value: 0.031503960281094465.
[I 2025-11-03 12:22:15,984] Trial 17 finished with value: 0.0025610563798639085 and parameters: {'model_type': 'gcn', 'hidden_dims': '[512, 128]', 'dropout': 0.4382039703467012, 'batch_norm': True, 'lr': 0.00028616129463827076, 'weight_decay': 3.107383290096833e-06, 'epochs': 286, 'loss': 'mae', 'optimizer': 'adam', 'graph_mode': 'knn', 'source': 'grm', 'knn_k': 3, 'weighted_edges': True, 'symmetrize_mode': 'union', 'use_snp_selection': False}. Best is trial 15 with value: 0.031503960281094465.
[I 2025-11-03 12:22:18,447] Trial 18 finished with value: -0.004537375383505727 and parameters: {'model_type': 'gcn', 'hidden_dims': '[256, 128, 64]', 'dropout': 0.33632587693836724, 'batch_norm': True, 'lr': 0.0009600579316870807, 'weight_decay': 1.2340011329591048e-06, 'epochs': 219, 'loss': 'mae', 'optimizer': 'adam', 'graph_mode': 'knn', 'source': 'grm', 'knn_k': 10, 'weighted_edges': True, 'symmetrize_mode': 'union', 'use_snp_selection': False}. Best is trial 15 with value: 0.031503960281094465.
[I 2025-11-03 12:22:21,927] Trial 19 finished with value: 0.031841961977542806 and parameters: {'model_type': 'gcn', 'hidden_dims': '[512, 64]', 'dropout': 0.17219191310081194, 'batch_norm': True, 'lr': 7.196733253377151e-05, 'weight_decay': 3.1362402420243644e-07, 'epochs': 305, 'loss': 'mae', 'optimizer': 'adam', 'graph_mode': 'knn', 'source': 'grm', 'knn_k': 3, 'weighted_edges': True, 'symmetrize_mode': 'union', 'use_snp_selection': False}. Best is trial 19 with value: 0.031841961977542806.
[I 2025-11-03 12:22:25,393] Trial 20 finished with value: 0.015955065201974216 and parameters: {'model_type': 'gcn', 'hidden_dims': '[512, 64]', 'dropout': 0.18614493348161285, 'batch_norm': True, 'lr': 3.6318419901982732e-06, 'weight_decay': 5.419868681338688e-06, 'epochs': 304, 'loss': 'mae', 'optimizer': 'adam', 'graph_mode': 'knn', 'source': 'grm', 'knn_k': 3, 'weighted_edges': False, 'symmetrize_mode': 'union', 'use_snp_selection': False}. Best is trial 19 with value: 0.031841961977542806.
[I 2025-11-03 12:22:28,873] Trial 21 finished with value: 0.024598662914768407 and parameters: {'model_type': 'gcn', 'hidden_dims': '[512, 64]', 'dropout': 0.16403709010075304, 'batch_norm': True, 'lr': 6.367962472189855e-05, 'weight_decay': 3.6402718708523155e-07, 'epochs': 306, 'loss': 'mae', 'optimizer': 'adam', 'graph_mode': 'knn', 'source': 'grm', 'knn_k': 3, 'weighted_edges': True, 'symmetrize_mode': 'union', 'use_snp_selection': False}. Best is trial 19 with value: 0.031841961977542806.
[I 2025-11-03 12:22:31,857] Trial 22 finished with value: -0.005262854289023719 and parameters: {'model_type': 'gcn', 'hidden_dims': '[512, 64]', 'dropout': 0.2545126810119694, 'batch_norm': True, 'lr': 1.9474624078489922e-05, 'weight_decay': 2.2939273263620846e-07, 'epochs': 232, 'loss': 'mae', 'optimizer': 'adam', 'graph_mode': 'knn', 'source': 'grm', 'knn_k': 5, 'weighted_edges': True, 'symmetrize_mode': 'union', 'use_snp_selection': False}. Best is trial 19 with value: 0.031841961977542806.
[I 2025-11-03 12:22:35,275] Trial 23 finished with value: 0.024566939886623847 and parameters: {'model_type': 'gcn', 'hidden_dims': '[512, 64]', 'dropout': 0.23010631926598793, 'batch_norm': True, 'lr': 0.00021943734221846543, 'weight_decay': 1.0409092798865743e-07, 'epochs': 298, 'loss': 'mae', 'optimizer': 'adam', 'graph_mode': 'knn', 'source': 'grm', 'knn_k': 2, 'weighted_edges': True, 'symmetrize_mode': 'union', 'use_snp_selection': False}. Best is trial 19 with value: 0.031841961977542806.
[I 2025-11-03 12:22:38,955] Trial 24 finished with value: 0.017685413297687635 and parameters: {'model_type': 'gcn', 'hidden_dims': '[512, 64]', 'dropout': 0.3367508196614764, 'batch_norm': True, 'lr': 6.947375375139144e-05, 'weight_decay': 6.423930386493262e-07, 'epochs': 350, 'loss': 'mae', 'optimizer': 'adam', 'graph_mode': 'knn', 'source': 'grm', 'knn_k': 5, 'weighted_edges': True, 'symmetrize_mode': 'union', 'use_snp_selection': False}. Best is trial 19 with value: 0.031841961977542806.
[I 2025-11-03 12:22:41,904] Trial 25 finished with value: 0.03354768491524633 and parameters: {'model_type': 'gcn', 'hidden_dims': '[512, 64]', 'dropout': 0.1531833423241359, 'batch_norm': True, 'lr': 0.00042276418533339393, 'weight_decay': 2.798943830061951e-07, 'epochs': 245, 'loss': 'mae', 'optimizer': 'adam', 'graph_mode': 'knn', 'source': 'grm', 'knn_k': 2, 'weighted_edges': True, 'symmetrize_mode': 'union', 'use_snp_selection': False}. Best is trial 25 with value: 0.03354768491524633.
[I 2025-11-03 12:22:46,119] Trial 26 finished with value: 0.05091100342443368 and parameters: {'model_type': 'gcn', 'hidden_dims': '[512, 128]', 'dropout': 0.5896027440730658, 'batch_norm': False, 'lr': 0.00045769216381683363, 'weight_decay': 1.2480426102799778e-06, 'epochs': 193, 'loss': 'mae', 'optimizer': 'adam', 'graph_mode': 'cutoff', 'cutoff': 0.8765009073803762, 'grm_norm': 'none', 'self_loops': True, 'use_snp_selection': True, 'num_snps': 59005}. Best is trial 26 with value: 0.05091100342443368.
[I 2025-11-03 12:22:50,342] Trial 27 finished with value: -0.013708487360802938 and parameters: {'model_type': 'gcn', 'hidden_dims': '[512, 128]', 'dropout': 0.14866111639492172, 'batch_norm': False, 'lr': 0.0005067031159964858, 'weight_decay': 1.338923769124515e-06, 'epochs': 191, 'loss': 'mse', 'optimizer': 'adam', 'graph_mode': 'cutoff', 'cutoff': 0.8907049599927799, 'grm_norm': 'none', 'self_loops': True, 'use_snp_selection': True, 'num_snps': 58472}. Best is trial 26 with value: 0.05091100342443368.
[I 2025-11-03 12:22:54,632] Trial 28 finished with value: 0.008880282993419681 and parameters: {'model_type': 'gcn', 'hidden_dims': '[512, 128]', 'dropout': 0.5890545370941862, 'batch_norm': False, 'lr': 0.0003470500505583357, 'weight_decay': 9.784848581917788e-07, 'epochs': 192, 'loss': 'mae', 'optimizer': 'adam', 'graph_mode': 'cutoff', 'cutoff': 0.8091444867553712, 'grm_norm': 'none', 'self_loops': True, 'use_snp_selection': True, 'num_snps': 59610}. Best is trial 26 with value: 0.05091100342443368.
[I 2025-11-03 12:22:56,909] Trial 29 finished with value: 0.03625048963953174 and parameters: {'model_type': 'gcn', 'hidden_dims': '[512, 128]', 'dropout': 0.10630293494305203, 'batch_norm': False, 'lr': 0.00010615536651403966, 'weight_decay': 0.00027117598063771114, 'epochs': 322, 'loss': 'mae', 'optimizer': 'adam', 'graph_mode': 'cutoff', 'cutoff': 0.49003689705315706, 'grm_norm': 'cosine_then_gcn', 'self_loops': True, 'use_snp_selection': True, 'num_snps': 12210}. Best is trial 26 with value: 0.05091100342443368.
[I 2025-11-03 12:22:58,417] Trial 30 finished with value: 0.028013220212395076 and parameters: {'model_type': 'gcn', 'hidden_dims': '[512, 128]', 'dropout': 0.10235063568413136, 'batch_norm': False, 'lr': 0.00042586119519382154, 'weight_decay': 0.000236975219492873, 'epochs': 151, 'loss': 'mae', 'optimizer': 'adam', 'graph_mode': 'cutoff', 'cutoff': 0.4759751103017282, 'grm_norm': 'cosine_then_gcn', 'self_loops': True, 'use_snp_selection': True, 'num_snps': 4531}. Best is trial 26 with value: 0.05091100342443368.
[I 2025-11-03 12:23:01,001] Trial 31 finished with value: -0.003759321580302215 and parameters: {'model_type': 'gcn', 'hidden_dims': '[512, 128]', 'dropout': 0.17196265447303277, 'batch_norm': False, 'lr': 1.050807680032028e-06, 'weight_decay': 8.80454785359613e-05, 'epochs': 323, 'loss': 'mae', 'optimizer': 'adam', 'graph_mode': 'cutoff', 'cutoff': 0.46470776274608416, 'grm_norm': 'cosine_then_gcn', 'self_loops': True, 'use_snp_selection': True, 'num_snps': 17301}. Best is trial 26 with value: 0.05091100342443368.
[I 2025-11-03 12:23:04,893] Trial 32 finished with value: 0.058217567068497234 and parameters: {'model_type': 'gcn', 'hidden_dims': '[512, 128]', 'dropout': 0.1260033149592038, 'batch_norm': False, 'lr': 8.216416099668181e-05, 'weight_decay': 0.0005371382210589339, 'epochs': 285, 'loss': 'mae', 'optimizer': 'adam', 'graph_mode': 'cutoff', 'cutoff': 0.5846866965076587, 'grm_norm': 'cosine', 'self_loops': True, 'use_snp_selection': True, 'num_snps': 41086}. Best is trial 32 with value: 0.058217567068497234.
[I 2025-11-03 12:23:09,367] Trial 33 finished with value: 0.013612963698076193 and parameters: {'model_type': 'gcn', 'hidden_dims': '[512, 128]', 'dropout': 0.13022473361558345, 'batch_norm': False, 'lr': 0.00011399758408187346, 'weight_decay': 0.0008885202455641017, 'epochs': 276, 'loss': 'mae', 'optimizer': 'adam', 'graph_mode': 'cutoff', 'cutoff': 0.5872636391675288, 'grm_norm': 'cosine', 'self_loops': True, 'use_snp_selection': True, 'num_snps': 45653}. Best is trial 32 with value: 0.058217567068497234.
[I 2025-11-03 12:23:13,214] Trial 34 finished with value: 0.024831520533603182 and parameters: {'model_type': 'gcn', 'hidden_dims': '[512, 128]', 'dropout': 0.10559043711000103, 'batch_norm': False, 'lr': 4.247779274405634e-05, 'weight_decay': 0.0004132614753237926, 'epochs': 326, 'loss': 'mse', 'optimizer': 'adam', 'graph_mode': 'cutoff', 'cutoff': 0.4531645718439566, 'grm_norm': 'cosine', 'self_loops': True, 'use_snp_selection': True, 'num_snps': 36739}. Best is trial 32 with value: 0.058217567068497234.
[I 2025-11-03 12:23:16,679] Trial 35 finished with value: 0.024088399247310502 and parameters: {'model_type': 'gcn', 'hidden_dims': '[128, 64]', 'dropout': 0.20268375425476753, 'batch_norm': False, 'lr': 0.0006002366125299454, 'weight_decay': 0.000146157555848467, 'epochs': 245, 'loss': 'mae', 'optimizer': 'adam', 'graph_mode': 'cutoff', 'cutoff': 0.6839947902042848, 'grm_norm': 'cosine', 'self_loops': True, 'use_snp_selection': True, 'num_snps': 52144}. Best is trial 32 with value: 0.058217567068497234.
[I 2025-11-03 12:23:19,414] Trial 36 finished with value: 0.033050726421295924 and parameters: {'model_type': 'gcn', 'hidden_dims': '[256, 128]', 'dropout': 0.4616648068429109, 'batch_norm': False, 'lr': 0.00022644228870125326, 'weight_decay': 0.0004918180547638995, 'epochs': 350, 'loss': 'mse', 'optimizer': 'adam', 'graph_mode': 'cutoff', 'cutoff': 0.41199686721809614, 'grm_norm': 'none', 'self_loops': True, 'use_snp_selection': True, 'num_snps': 23339}. Best is trial 32 with value: 0.058217567068497234.
[I 2025-11-03 12:23:22,910] Trial 37 finished with value: 0.04098401979198327 and parameters: {'model_type': 'gcn', 'hidden_dims': '[256, 128, 64]', 'dropout': 0.13503955543499976, 'batch_norm': False, 'lr': 9.107773103455205e-05, 'weight_decay': 4.096190501215263e-05, 'epochs': 282, 'loss': 'mae', 'optimizer': 'adam', 'graph_mode': 'cutoff', 'cutoff': 0.8855603104131528, 'grm_norm': 'cosine_then_gcn', 'self_loops': True, 'use_snp_selection': True, 'num_snps': 37592}. Best is trial 32 with value: 0.058217567068497234.
[I 2025-11-03 12:23:25,521] Trial 38 finished with value: -0.01580781918193753 and parameters: {'model_type': 'gcn', 'hidden_dims': '[256, 128, 64]', 'dropout': 0.568774011742048, 'batch_norm': False, 'lr': 9.956619164425137e-05, 'weight_decay': 4.296130513567669e-05, 'epochs': 65, 'loss': 'mae', 'optimizer': 'adam', 'graph_mode': 'cutoff', 'cutoff': 0.8863551959725584, 'grm_norm': 'cosine_then_gcn', 'self_loops': True, 'use_snp_selection': True, 'num_snps': 37116}. Best is trial 32 with value: 0.058217567068497234.
[I 2025-11-03 12:23:28,968] Trial 39 finished with value: 0.026226241102959083 and parameters: {'model_type': 'gcn', 'hidden_dims': '[256, 128, 64]', 'dropout': 0.13325480341248247, 'batch_norm': False, 'lr': 5.025679838672906e-05, 'weight_decay': 4.001969817772111e-05, 'epochs': 282, 'loss': 'mse', 'optimizer': 'adam', 'graph_mode': 'cutoff', 'cutoff': 0.7882871187073381, 'grm_norm': 'cosine_then_gcn', 'self_loops': True, 'use_snp_selection': True, 'num_snps': 37043}. Best is trial 32 with value: 0.058217567068497234.
[I 2025-11-03 12:23:33,337] Trial 40 finished with value: -0.02314290366298474 and parameters: {'model_type': 'gcn', 'hidden_dims': '[256, 128, 64]', 'dropout': 0.5019627917002776, 'batch_norm': False, 'lr': 2.5232396841974224e-05, 'weight_decay': 0.00014568247083552183, 'epochs': 318, 'loss': 'mae', 'optimizer': 'adam', 'graph_mode': 'cutoff', 'cutoff': 0.8020768688993041, 'grm_norm': 'cosine_then_gcn', 'self_loops': True, 'use_snp_selection': True, 'num_snps': 52799}. Best is trial 32 with value: 0.058217567068497234.
[I 2025-11-03 12:23:35,166] Trial 41 finished with value: 0.040296264523312315 and parameters: {'model_type': 'gcn', 'hidden_dims': '[512, 128]', 'dropout': 0.14557594648817396, 'batch_norm': False, 'lr': 0.00018593764693453375, 'weight_decay': 0.00038214726950488027, 'epochs': 233, 'loss': 'mae', 'optimizer': 'adam', 'graph_mode': 'cutoff', 'cutoff': 0.5331471795862062, 'grm_norm': 'cosine_then_gcn', 'self_loops': True, 'use_snp_selection': True, 'num_snps': 6183}. Best is trial 32 with value: 0.058217567068497234.
[I 2025-11-03 12:23:36,876] Trial 42 finished with value: 0.04241204595796962 and parameters: {'model_type': 'gcn', 'hidden_dims': '[512, 128]', 'dropout': 0.12780665001989983, 'batch_norm': False, 'lr': 0.00017939547565105945, 'weight_decay': 0.0005847166355766832, 'epochs': 196, 'loss': 'mae', 'optimizer': 'adam', 'graph_mode': 'cutoff', 'cutoff': 0.5339493217861543, 'grm_norm': 'cosine_then_gcn', 'self_loops': True, 'use_snp_selection': True, 'num_snps': 5565}. Best is trial 32 with value: 0.058217567068497234.
[I 2025-11-03 12:23:38,572] Trial 43 finished with value: 0.033003290411960595 and parameters: {'model_type': 'gcn', 'hidden_dims': '[512, 128]', 'dropout': 0.12973151664530883, 'batch_norm': False, 'lr': 0.00019102558053078896, 'weight_decay': 0.0008076915742574946, 'epochs': 192, 'loss': 'mae', 'optimizer': 'adam', 'graph_mode': 'cutoff', 'cutoff': 0.6071557525081674, 'grm_norm': 'cosine_then_gcn', 'self_loops': True, 'use_snp_selection': True, 'num_snps': 5485}. Best is trial 32 with value: 0.058217567068497234.
[I 2025-11-03 12:23:40,076] Trial 44 finished with value: 0.0554321403039758 and parameters: {'model_type': 'gcn', 'hidden_dims': '[512, 128]', 'dropout': 0.20980029407085743, 'batch_norm': False, 'lr': 0.0002653848982714406, 'weight_decay': 0.00047295973421458335, 'epochs': 154, 'loss': 'mae', 'optimizer': 'adam', 'graph_mode': 'cutoff', 'cutoff': 0.5386415590100523, 'grm_norm': 'cosine_then_gcn', 'self_loops': True, 'use_snp_selection': True, 'num_snps': 3010}. Best is trial 32 with value: 0.058217567068497234.
[I 2025-11-03 12:23:42,116] Trial 45 finished with value: 0.05332484942979429 and parameters: {'model_type': 'gcn', 'hidden_dims': '[128, 64]', 'dropout': 0.21796079706970453, 'batch_norm': False, 'lr': 0.0003109374592335076, 'weight_decay': 1.1811881533353852e-05, 'epochs': 121, 'loss': 'mae', 'optimizer': 'adam', 'graph_mode': 'cutoff', 'cutoff': 0.6317290589888624, 'grm_norm': 'cosine', 'self_loops': True, 'use_snp_selection': True, 'num_snps': 22055}. Best is trial 32 with value: 0.058217567068497234.
[I 2025-11-03 12:23:43,817] Trial 46 finished with value: 0.04225667378579189 and parameters: {'model_type': 'gcn', 'hidden_dims': '[128, 64]', 'dropout': 0.30969018964759143, 'batch_norm': False, 'lr': 0.0002920774149137175, 'weight_decay': 1.3975719353811687e-05, 'epochs': 129, 'loss': 'mae', 'optimizer': 'adam', 'graph_mode': 'cutoff', 'cutoff': 0.6329902940997478, 'grm_norm': 'cosine', 'self_loops': True, 'use_snp_selection': True, 'num_snps': 11411}. Best is trial 32 with value: 0.058217567068497234.
[I 2025-11-03 12:23:45,746] Trial 47 finished with value: -0.013091688842989474 and parameters: {'model_type': 'gcn', 'hidden_dims': '[128, 64]', 'dropout': 0.37048133192304783, 'batch_norm': False, 'lr': 0.0005915734413138838, 'weight_decay': 7.249823073150831e-06, 'epochs': 105, 'loss': 'mse', 'optimizer': 'adam', 'graph_mode': 'cutoff', 'cutoff': 0.5323636039788175, 'grm_norm': 'cosine', 'self_loops': True, 'use_snp_selection': True, 'num_snps': 20114}. Best is trial 32 with value: 0.058217567068497234.
[I 2025-11-03 12:23:47,241] Trial 48 finished with value: 0.009263133277354221 and parameters: {'model_type': 'gcn', 'hidden_dims': '[512, 256]', 'dropout': 0.22424153413001344, 'batch_norm': False, 'lr': 0.00014020400693492445, 'weight_decay': 0.0006114122185136234, 'epochs': 155, 'loss': 'mae', 'optimizer': 'adam', 'graph_mode': 'cutoff', 'cutoff': 0.5482820311270876, 'grm_norm': 'cosine', 'self_loops': True, 'use_snp_selection': True, 'num_snps': 2690}. Best is trial 32 with value: 0.058217567068497234.
[I 2025-11-03 12:23:48,671] Trial 49 finished with value: 0.035077952983925145 and parameters: {'model_type': 'gcn', 'hidden_dims': '[256, 128]', 'dropout': 0.27222466853450444, 'batch_norm': False, 'lr': 0.0003118016192504341, 'weight_decay': 0.00020695046264696608, 'epochs': 64, 'loss': 'mae', 'optimizer': 'adam', 'graph_mode': 'cutoff', 'cutoff': 0.4024563106317802, 'grm_norm': 'none', 'self_loops': True, 'use_snp_selection': True, 'num_snps': 8301}. Best is trial 32 with value: 0.058217567068497234.
[I 2025-11-03 12:23:50,657] Trial 50 finished with value: 0.011360271112679097 and parameters: {'model_type': 'gcn', 'hidden_dims': '[128, 64]', 'dropout': 0.19213926240484586, 'batch_norm': False, 'lr': 0.0007315957824798447, 'weight_decay': 2.7962795614871355e-06, 'epochs': 172, 'loss': 'mae', 'optimizer': 'adam', 'graph_mode': 'cutoff', 'cutoff': 0.6440548745881538, 'grm_norm': 'cosine', 'self_loops': True, 'use_snp_selection': True, 'num_snps': 16474}. Best is trial 32 with value: 0.058217567068497234.
[I 2025-11-03 12:23:52,338] Trial 51 finished with value: 0.014871413730932061 and parameters: {'model_type': 'gcn', 'hidden_dims': '[128, 64]', 'dropout': 0.30865215816108826, 'batch_norm': False, 'lr': 0.0002805885603922373, 'weight_decay': 1.666083423280749e-05, 'epochs': 132, 'loss': 'mae', 'optimizer': 'adam', 'graph_mode': 'cutoff', 'cutoff': 0.6178629709963555, 'grm_norm': 'cosine', 'self_loops': True, 'use_snp_selection': True, 'num_snps': 10509}. Best is trial 32 with value: 0.058217567068497234.
