[I 2025-11-03 16:27:49,141] Trial 37 finished with value: 0.006541402195667092 and parameters: {'model_type': 'graphsage', 'hidden_dims': '[256, 128]', 'dropout': 0.5983997675135191, 'batch_norm': False, 'lr': 5.932237204141354e-05, 'weight_decay': 1.7196890147128763e-05, 'epochs': 266, 'loss': 'mae', 'optimizer': 'adam', 'graph_mode': 'cutoff', 'cutoff': 0.4084494397804278, 'grm_norm': 'gcn', 'self_loops': False, 'use_snp_selection': True, 'num_snps': 2049}. Best is trial 29 with value: 0.04518093547498729.
[I 2025-11-03 16:27:51,363] Trial 38 finished with value: 0.017759615113215905 and parameters: {'model_type': 'graphsage', 'hidden_dims': '[256, 128]', 'dropout': 0.538237228379313, 'batch_norm': False, 'lr': 0.0004804610562040334, 'weight_decay': 6.9699875708891e-06, 'epochs': 308, 'loss': 'mae', 'optimizer': 'adam', 'graph_mode': 'cutoff', 'cutoff': 0.26083182229251395, 'grm_norm': 'gcn', 'self_loops': False, 'use_snp_selection': True, 'num_snps': 8759}. Best is trial 29 with value: 0.04518093547498729.
[I 2025-11-03 16:27:53,647] Trial 39 finished with value: -0.002380634516626623 and parameters: {'model_type': 'graphsage', 'hidden_dims': '[256, 128]', 'dropout': 0.5737050843903153, 'batch_norm': False, 'lr': 0.00013263144836089008, 'weight_decay': 3.0899205920725306e-05, 'epochs': 329, 'loss': 'mae', 'optimizer': 'adam', 'graph_mode': 'cutoff', 'cutoff': 0.3878513798525306, 'grm_norm': 'gcn', 'self_loops': False, 'use_snp_selection': True, 'num_snps': 8881}. Best is trial 29 with value: 0.04518093547498729.
