[I 2025-11-03 12:59:16,367] Trial 37 finished with value: 0.01631999150601389 and parameters: {'model_type': 'graphsage', 'hidden_dims': '[256, 128, 64]', 'dropout': 0.5288773816827776, 'batch_norm': False, 'lr': 0.0008344615466448202, 'weight_decay': 4.830936308591571e-07, 'epochs': 100, 'loss': 'mae', 'optimizer': 'adam', 'graph_mode': 'knn', 'source': 'grm', 'knn_k': 3, 'weighted_edges': True, 'symmetrize_mode': 'mutual', 'use_snp_selection': True, 'num_snps': 15344}. Best is trial 10 with value: 0.041181875302267676.
[I 2025-11-03 12:59:18,949] Trial 38 finished with value: 0.034042204245749136 and parameters: {'model_type': 'graphsage', 'hidden_dims': '[512, 128]', 'dropout': 0.45451599262483017, 'batch_norm': True, 'lr': 8.732644103841458e-05, 'weight_decay': 3.399959876742368e-05, 'epochs': 47, 'loss': 'mse', 'optimizer': 'adam', 'graph_mode': 'cutoff', 'cutoff': 0.423279865952097, 'grm_norm': 'cosine', 'self_loops': True, 'use_snp_selection': False}. Best is trial 10 with value: 0.041181875302267676.
[I 2025-11-03 12:59:24,934] Trial 39 finished with value: 0.029262123928629345 and parameters: {'model_type': 'graphsage', 'hidden_dims': '[512, 256]', 'dropout': 0.4951208780504633, 'batch_norm': False, 'lr': 4.537314332496085e-05, 'weight_decay': 2.1406449257700947e-07, 'epochs': 247, 'loss': 'mae', 'optimizer': 'adam', 'graph_mode': 'cutoff', 'cutoff': 0.579651590995302, 'grm_norm': 'gcn', 'self_loops': False, 'use_snp_selection': True, 'num_snps': 58379}. Best is trial 10 with value: 0.041181875302267676.
[I 2025-11-03 12:59:26,845] Trial 40 finished with value: 0.04299625948970329 and parameters: {'model_type': 'graphsage', 'hidden_dims': '[128, 64]', 'dropout': 0.37764418267144423, 'batch_norm': True, 'lr': 0.00025636002885543786, 'weight_decay': 1.0232148972981635e-05, 'epochs': 75, 'loss': 'mse', 'optimizer': 'adam', 'graph_mode': 'knn', 'source': 'grm', 'knn_k': 10, 'weighted_edges': False, 'symmetrize_mode': 'union', 'use_snp_selection': False}. Best is trial 40 with value: 0.04299625948970329.
[I 2025-11-03 12:59:28,821] Trial 41 finished with value: 0.033487721763481616 and parameters: {'model_type': 'graphsage', 'hidden_dims': '[128, 64]', 'dropout': 0.3329179314919489, 'batch_norm': True, 'lr': 0.00020287390459614968, 'weight_decay': 1.1977948228345433e-05, 'epochs': 89, 'loss': 'mse', 'optimizer': 'adam', 'graph_mode': 'knn', 'source': 'grm', 'knn_k': 10, 'weighted_edges': False, 'symmetrize_mode': 'union', 'use_snp_selection': False}. Best is trial 40 with value: 0.04299625948970329.
[I 2025-11-03 12:59:30,597] Trial 42 finished with value: 0.02292883117155729 and parameters: {'model_type': 'graphsage', 'hidden_dims': '[128, 64]', 'dropout': 0.37595679383253194, 'batch_norm': True, 'lr': 0.0005567437578965636, 'weight_decay': 7.836946092283073e-06, 'epochs': 73, 'loss': 'mse', 'optimizer': 'adam', 'graph_mode': 'knn', 'source': 'grm', 'knn_k': 8, 'weighted_edges': False, 'symmetrize_mode': 'union', 'use_snp_selection': False}. Best is trial 40 with value: 0.04299625948970329.
[I 2025-11-03 12:59:32,694] Trial 43 finished with value: 0.021481405872269186 and parameters: {'model_type': 'graphsage', 'hidden_dims': '[128, 64]', 'dropout': 0.41820187028593403, 'batch_norm': True, 'lr': 0.00025397245373507776, 'weight_decay': 1.1385789444226233e-06, 'epochs': 118, 'loss': 'mse', 'optimizer': 'adam', 'graph_mode': 'knn', 'source': 'grm', 'knn_k': 9, 'weighted_edges': False, 'symmetrize_mode': 'union', 'use_snp_selection': False}. Best is trial 40 with value: 0.04299625948970329.
[I 2025-11-03 12:59:34,216] Trial 44 finished with value: 0.0032417565067847445 and parameters: {'model_type': 'graphsage', 'hidden_dims': '[128, 64]', 'dropout': 0.5970167466866261, 'batch_norm': True, 'lr': 0.00014002144850399056, 'weight_decay': 2.8766591148662924e-05, 'epochs': 67, 'loss': 'mse', 'optimizer': 'adam', 'graph_mode': 'knn', 'source': 'grm', 'knn_k': 3, 'weighted_edges': False, 'symmetrize_mode': 'union', 'use_snp_selection': False}. Best is trial 40 with value: 0.04299625948970329.
[I 2025-11-03 12:59:36,781] Trial 45 finished with value: 0.012208130285214993 and parameters: {'model_type': 'graphsage', 'hidden_dims': '[256, 128]', 'dropout': 0.1780090758356534, 'batch_norm': True, 'lr': 0.00030488403270017254, 'weight_decay': 2.332617291214585e-06, 'epochs': 132, 'loss': 'mse', 'optimizer': 'adam', 'graph_mode': 'knn', 'source': 'grm', 'knn_k': 6, 'weighted_edges': False, 'symmetrize_mode': 'union', 'use_snp_selection': False}. Best is trial 40 with value: 0.04299625948970329.
[I 2025-11-03 12:59:40,417] Trial 46 finished with value: 0.03669211131239771 and parameters: {'model_type': 'graphsage', 'hidden_dims': '[512, 256]', 'dropout': 0.2823464802248515, 'batch_norm': True, 'lr': 0.00014252729420771978, 'weight_decay': 1.4335256780945635e-05, 'epochs': 160, 'loss': 'mse', 'optimizer': 'adam', 'graph_mode': 'cutoff', 'cutoff': 0.5978425752867659, 'grm_norm': 'cosine_then_gcn', 'self_loops': True, 'use_snp_selection': False}. Best is trial 40 with value: 0.04299625948970329.
[I 2025-11-03 12:59:44,230] Trial 47 finished with value: 0.01996202454998781 and parameters: {'model_type': 'graphsage', 'hidden_dims': '[512, 128]', 'dropout': 0.5511895269543704, 'batch_norm': False, 'lr': 2.4793769157820112e-05, 'weight_decay': 4.695137116175952e-05, 'epochs': 58, 'loss': 'mse', 'optimizer': 'adam', 'graph_mode': 'knn', 'source': 'grm', 'knn_k': 8, 'weighted_edges': False, 'symmetrize_mode': 'union', 'use_snp_selection': True, 'num_snps': 43485}. Best is trial 40 with value: 0.04299625948970329.
[I 2025-11-03 12:59:47,610] Trial 48 finished with value: 0.041010985662535394 and parameters: {'model_type': 'graphsage', 'hidden_dims': '[512, 64]', 'dropout': 0.31886290595471994, 'batch_norm': True, 'lr': 0.0007508572763079428, 'weight_decay': 5.811367460601409e-06, 'epochs': 111, 'loss': 'mae', 'optimizer': 'adam', 'graph_mode': 'cutoff', 'cutoff': 0.2629090305360259, 'grm_norm': 'none', 'self_loops': False, 'use_snp_selection': False}. Best is trial 40 with value: 0.04299625948970329.
[I 2025-11-03 12:59:51,009] Trial 49 finished with value: 0.016321582509004742 and parameters: {'model_type': 'graphsage', 'hidden_dims': '[512, 64]', 'dropout': 0.23291543607443743, 'batch_norm': True, 'lr': 0.0008173156529828816, 'weight_decay': 5.719085876007045e-06, 'epochs': 112, 'loss': 'mae', 'optimizer': 'adam', 'graph_mode': 'cutoff', 'cutoff': 0.25813338143143466, 'grm_norm': 'none', 'self_loops': False, 'use_snp_selection': False}. Best is trial 40 with value: 0.04299625948970329.
[I 2025-11-03 12:59:54,164] Trial 50 finished with value: 0.03442754076085541 and parameters: {'model_type': 'graphsage', 'hidden_dims': '[512, 64]', 'dropout': 0.33300770352706627, 'batch_norm': True, 'lr': 0.0004659333872932737, 'weight_decay': 3.3539313097130096e-06, 'epochs': 82, 'loss': 'mae', 'optimizer': 'adam', 'graph_mode': 'cutoff', 'cutoff': 0.2030727966649492, 'grm_norm': 'none', 'self_loops': False, 'use_snp_selection': False}. Best is trial 40 with value: 0.04299625948970329.
[I 2025-11-03 12:59:57,413] Trial 51 finished with value: 0.020781637865008997 and parameters: {'model_type': 'graphsage', 'hidden_dims': '[512, 64]', 'dropout': 0.307519550802894, 'batch_norm': True, 'lr': 0.0006521744647888301, 'weight_decay': 1.980867774338403e-05, 'epochs': 108, 'loss': 'mae', 'optimizer': 'adam', 'graph_mode': 'cutoff', 'cutoff': 0.3244054731393004, 'grm_norm': 'none', 'self_loops': False, 'use_snp_selection': False}. Best is trial 40 with value: 0.04299625948970329.
[I 2025-11-03 13:00:01,277] Trial 52 finished with value: 0.03275280961182146 and parameters: {'model_type': 'graphsage', 'hidden_dims': '[512, 64]', 'dropout': 0.5750593175375783, 'batch_norm': True, 'lr': 0.0003619998508217353, 'weight_decay': 1.395455219017081e-07, 'epochs': 152, 'loss': 'mae', 'optimizer': 'adam', 'graph_mode': 'cutoff', 'cutoff': 0.28035670177563193, 'grm_norm': 'none', 'self_loops': False, 'use_snp_selection': False}. Best is trial 40 with value: 0.04299625948970329.
[I 2025-11-03 13:00:07,247] Trial 53 finished with value: 0.03290761321682912 and parameters: {'model_type': 'graphsage', 'hidden_dims': '[512, 128]', 'dropout': 0.3742173000395903, 'batch_norm': True, 'lr': 0.000997279734514415, 'weight_decay': 7.924226752753226e-06, 'epochs': 313, 'loss': 'mae', 'optimizer': 'adam', 'graph_mode': 'cutoff', 'cutoff': 0.23954975402462367, 'grm_norm': 'gcn', 'self_loops': False, 'use_snp_selection': False}. Best is trial 40 with value: 0.04299625948970329.
[I 2025-11-03 13:00:11,165] Trial 54 finished with value: 0.035714952781863714 and parameters: {'model_type': 'graphsage', 'hidden_dims': '[512, 128]', 'dropout': 0.2574097396591849, 'batch_norm': True, 'lr': 0.0002183059810228888, 'weight_decay': 6.233851959156758e-07, 'epochs': 190, 'loss': 'mse', 'optimizer': 'adam', 'graph_mode': 'cutoff', 'cutoff': 0.6975893107251765, 'grm_norm': 'none', 'self_loops': False, 'use_snp_selection': False}. Best is trial 40 with value: 0.04299625948970329.
[I 2025-11-03 13:00:14,469] Trial 55 finished with value: 0.012790734159047234 and parameters: {'model_type': 'graphsage', 'hidden_dims': '[256, 128, 64]', 'dropout': 0.3182868166217915, 'batch_norm': True, 'lr': 6.0395051381598e-05, 'weight_decay': 1.5754935267158155e-05, 'epochs': 280, 'loss': 'mse', 'optimizer': 'adam', 'graph_mode': 'cutoff', 'cutoff': 0.37656829121278823, 'grm_norm': 'cosine', 'self_loops': True, 'use_snp_selection': False}. Best is trial 40 with value: 0.04299625948970329.
[I 2025-11-03 13:00:17,001] Trial 56 finished with value: 0.012464438124279211 and parameters: {'model_type': 'graphsage', 'hidden_dims': '[512, 64]', 'dropout': 0.42033115361367696, 'batch_norm': True, 'lr': 0.00011483777570360169, 'weight_decay': 3.901442866141004e-07, 'epochs': 41, 'loss': 'mse', 'optimizer': 'adam', 'graph_mode': 'cutoff', 'cutoff': 0.2823036188960471, 'grm_norm': 'cosine', 'self_loops': False, 'use_snp_selection': False}. Best is trial 40 with value: 0.04299625948970329.
[I 2025-11-03 13:00:21,924] Trial 57 finished with value: 0.02432349526198378 and parameters: {'model_type': 'graphsage', 'hidden_dims': '[512, 128]', 'dropout': 0.5409861040486879, 'batch_norm': True, 'lr': 0.00027947016646094033, 'weight_decay': 1.5381175777950229e-07, 'epochs': 232, 'loss': 'mae', 'optimizer': 'adam', 'graph_mode': 'cutoff', 'cutoff': 0.2432115402178316, 'grm_norm': 'cosine_then_gcn', 'self_loops': True, 'use_snp_selection': False}. Best is trial 40 with value: 0.04299625948970329.
[I 2025-11-03 13:00:25,329] Trial 58 finished with value: 0.03577760164253117 and parameters: {'model_type': 'graphsage', 'hidden_dims': '[512, 256]', 'dropout': 0.4563110741975493, 'batch_norm': True, 'lr': 0.00016961679361975141, 'weight_decay': 2.4400068903528467e-07, 'epochs': 126, 'loss': 'mse', 'optimizer': 'adam', 'graph_mode': 'cutoff', 'cutoff': 0.4331238141577887, 'grm_norm': 'cosine', 'self_loops': True, 'use_snp_selection': False}. Best is trial 40 with value: 0.04299625948970329.
[I 2025-11-03 13:00:27,659] Trial 59 finished with value: 0.03793701803990468 and parameters: {'model_type': 'graphsage', 'hidden_dims': '[512, 128]', 'dropout': 0.5803182610829143, 'batch_norm': False, 'lr': 4.808053575771938e-06, 'weight_decay': 5.145203575346009e-06, 'epochs': 139, 'loss': 'mse', 'optimizer': 'adam', 'graph_mode': 'cutoff', 'cutoff': 0.33900019071858156, 'grm_norm': 'gcn', 'self_loops': True, 'use_snp_selection': True, 'num_snps': 16802}. Best is trial 40 with value: 0.04299625948970329.
[I 2025-11-03 13:00:29,365] Trial 60 finished with value: 0.02510659775267858 and parameters: {'model_type': 'graphsage', 'hidden_dims': '[128, 64]', 'dropout': 0.4892062951997664, 'batch_norm': True, 'lr': 8.249017865830047e-05, 'weight_decay': 2.8943059048277987e-06, 'epochs': 86, 'loss': 'mse', 'optimizer': 'adam', 'graph_mode': 'knn', 'source': 'grm', 'knn_k': 10, 'weighted_edges': True, 'symmetrize_mode': 'mutual', 'use_snp_selection': False}. Best is trial 40 with value: 0.04299625948970329.
[I 2025-11-03 13:00:32,562] Trial 61 finished with value: 0.01983837397009828 and parameters: {'model_type': 'graphsage', 'hidden_dims': '[512, 64]', 'dropout': 0.5537135083779069, 'batch_norm': True, 'lr': 0.000760834415739952, 'weight_decay': 1.4078404530217365e-06, 'epochs': 105, 'loss': 'mse', 'optimizer': 'adam', 'graph_mode': 'cutoff', 'cutoff': 0.40671129430051195, 'grm_norm': 'cosine', 'self_loops': True, 'use_snp_selection': False}. Best is trial 40 with value: 0.04299625948970329.
[I 2025-11-03 13:00:37,843] Trial 62 finished with value: 0.03296959108654557 and parameters: {'model_type': 'graphsage', 'hidden_dims': '[512, 64]', 'dropout': 0.595131090179987, 'batch_norm': True, 'lr': 0.000456826426565459, 'weight_decay': 1.6342839099861225e-06, 'epochs': 327, 'loss': 'mse', 'optimizer': 'adam', 'graph_mode': 'cutoff', 'cutoff': 0.6263294284385593, 'grm_norm': 'cosine', 'self_loops': True, 'use_snp_selection': False}. Best is trial 40 with value: 0.04299625948970329.
[I 2025-11-03 13:00:43,302] Trial 63 finished with value: 0.03740386555796561 and parameters: {'model_type': 'graphsage', 'hidden_dims': '[512, 64]', 'dropout': 0.521809927482788, 'batch_norm': True, 'lr': 0.0009388467606650684, 'weight_decay': 1.0550915265473627e-06, 'epochs': 314, 'loss': 'mse', 'optimizer': 'adam', 'graph_mode': 'cutoff', 'cutoff': 0.38814319299156885, 'grm_norm': 'cosine', 'self_loops': True, 'use_snp_selection': False}. Best is trial 40 with value: 0.04299625948970329.
[I 2025-11-03 13:00:47,433] Trial 64 finished with value: 0.043560982615975505 and parameters: {'model_type': 'graphsage', 'hidden_dims': '[512, 128]', 'dropout': 0.5810953085406275, 'batch_norm': True, 'lr': 0.0006258063765382176, 'weight_decay': 9.642559004474536e-06, 'epochs': 212, 'loss': 'mse', 'optimizer': 'adam', 'graph_mode': 'cutoff', 'cutoff': 0.776238525997035, 'grm_norm': 'cosine', 'self_loops': True, 'use_snp_selection': False}. Best is trial 64 with value: 0.043560982615975505.
[I 2025-11-03 13:00:51,613] Trial 65 finished with value: 0.0022691612060662053 and parameters: {'model_type': 'graphsage', 'hidden_dims': '[512, 128]', 'dropout': 0.5631248452111762, 'batch_norm': True, 'lr': 0.0005339256074132212, 'weight_decay': 0.0009982574687840962, 'epochs': 210, 'loss': 'mse', 'optimizer': 'adam', 'graph_mode': 'cutoff', 'cutoff': 0.8305538203978813, 'grm_norm': 'cosine', 'self_loops': True, 'use_snp_selection': False}. Best is trial 64 with value: 0.043560982615975505.
[I 2025-11-03 13:00:56,212] Trial 66 finished with value: 0.02363260448953885 and parameters: {'model_type': 'graphsage', 'hidden_dims': '[512, 128]', 'dropout': 0.5324256061946064, 'batch_norm': True, 'lr': 0.00036112728611268605, 'weight_decay': 9.518244152592542e-06, 'epochs': 254, 'loss': 'mse', 'optimizer': 'adam', 'graph_mode': 'cutoff', 'cutoff': 0.7960520617574187, 'grm_norm': 'none', 'self_loops': True, 'use_snp_selection': False}. Best is trial 64 with value: 0.043560982615975505.
[I 2025-11-03 13:01:00,651] Trial 67 finished with value: 0.04213017241314078 and parameters: {'model_type': 'graphsage', 'hidden_dims': '[512, 128]', 'dropout': 0.5013474276339018, 'batch_norm': True, 'lr': 0.0006616349409094338, 'weight_decay': 0.0002146857180597703, 'epochs': 238, 'loss': 'mse', 'optimizer': 'adam', 'graph_mode': 'cutoff', 'cutoff': 0.7519504125741036, 'grm_norm': 'cosine', 'self_loops': True, 'use_snp_selection': False}. Best is trial 64 with value: 0.043560982615975505.
[I 2025-11-03 13:01:04,996] Trial 68 finished with value: 0.018282811934540164 and parameters: {'model_type': 'graphsage', 'hidden_dims': '[512, 128]', 'dropout': 0.5836106680438718, 'batch_norm': True, 'lr': 0.0006429382533846207, 'weight_decay': 0.00040613282775549524, 'epochs': 228, 'loss': 'mae', 'optimizer': 'adam', 'graph_mode': 'cutoff', 'cutoff': 0.7996293335662998, 'grm_norm': 'cosine', 'self_loops': True, 'use_snp_selection': False}. Best is trial 64 with value: 0.043560982615975505.
[I 2025-11-03 13:01:09,193] Trial 69 finished with value: 0.03864889848654502 and parameters: {'model_type': 'graphsage', 'hidden_dims': '[512, 128]', 'dropout': 0.5072783877653211, 'batch_norm': True, 'lr': 0.0004186050225833281, 'weight_decay': 0.00022322592184085419, 'epochs': 212, 'loss': 'mse', 'optimizer': 'adam', 'graph_mode': 'cutoff', 'cutoff': 0.7405188453570805, 'grm_norm': 'cosine', 'self_loops': False, 'use_snp_selection': False}. Best is trial 64 with value: 0.043560982615975505.
[I 2025-11-03 13:01:11,992] Trial 70 finished with value: 0.03379519244887011 and parameters: {'model_type': 'graphsage', 'hidden_dims': '[256, 128]', 'dropout': 0.2774222618371232, 'batch_norm': True, 'lr': 0.0007241775571097623, 'weight_decay': 0.0005060070727028583, 'epochs': 244, 'loss': 'mse', 'optimizer': 'adam', 'graph_mode': 'cutoff', 'cutoff': 0.8833720577829653, 'grm_norm': 'cosine_then_gcn', 'self_loops': True, 'use_snp_selection': False}. Best is trial 64 with value: 0.043560982615975505.
[I 2025-11-03 13:01:16,737] Trial 71 finished with value: 0.03121708070990729 and parameters: {'model_type': 'graphsage', 'hidden_dims': '[512, 128]', 'dropout': 0.4381065640032399, 'batch_norm': True, 'lr': 0.00023215163196748127, 'weight_decay': 9.130543940305487e-05, 'epochs': 266, 'loss': 'mse', 'optimizer': 'adam', 'graph_mode': 'cutoff', 'cutoff': 0.7622619025567413, 'grm_norm': 'cosine', 'self_loops': True, 'use_snp_selection': False}. Best is trial 64 with value: 0.043560982615975505.
[I 2025-11-03 13:01:21,180] Trial 72 finished with value: 0.03549726131032964 and parameters: {'model_type': 'graphsage', 'hidden_dims': '[512, 128]', 'dropout': 0.48153198173188244, 'batch_norm': True, 'lr': 0.0005362558673399856, 'weight_decay': 4.4567578653936096e-05, 'epochs': 239, 'loss': 'mse', 'optimizer': 'adam', 'graph_mode': 'cutoff', 'cutoff': 0.6580684515728706, 'grm_norm': 'cosine', 'self_loops': True, 'use_snp_selection': False}. Best is trial 64 with value: 0.043560982615975505.
[I 2025-11-03 13:01:26,072] Trial 73 finished with value: 0.030496830664721555 and parameters: {'model_type': 'graphsage', 'hidden_dims': '[512, 128]', 'dropout': 0.5094681108033973, 'batch_norm': True, 'lr': 0.00010767642143609909, 'weight_decay': 1.3339683820372374e-07, 'epochs': 284, 'loss': 'mse', 'optimizer': 'adam', 'graph_mode': 'cutoff', 'cutoff': 0.8445638726097204, 'grm_norm': 'cosine', 'self_loops': True, 'use_snp_selection': False}. Best is trial 64 with value: 0.043560982615975505.
[I 2025-11-03 13:01:30,768] Trial 74 finished with value: 0.01086792738070588 and parameters: {'model_type': 'graphsage', 'hidden_dims': '[512, 128]', 'dropout': 0.5502602625617362, 'batch_norm': True, 'lr': 4.225168400180402e-05, 'weight_decay': 1.9510855862828729e-07, 'epochs': 257, 'loss': 'mse', 'optimizer': 'adam', 'graph_mode': 'cutoff', 'cutoff': 0.5427708790211226, 'grm_norm': 'cosine', 'self_loops': True, 'use_snp_selection': False}. Best is trial 64 with value: 0.043560982615975505.
[I 2025-11-03 13:01:35,751] Trial 75 finished with value: 0.03827087256770461 and parameters: {'model_type': 'graphsage', 'hidden_dims': '[512, 128]', 'dropout': 0.4629743826936455, 'batch_norm': True, 'lr': 0.00029935113906364965, 'weight_decay': 0.00019930274885415268, 'epochs': 225, 'loss': 'mse', 'optimizer': 'adam', 'graph_mode': 'knn', 'source': 'grm', 'knn_k': 7, 'weighted_edges': False, 'symmetrize_mode': 'union', 'use_snp_selection': False}. Best is trial 64 with value: 0.043560982615975505.
[I 2025-11-03 13:01:37,885] Trial 76 finished with value: 0.037336666556462485 and parameters: {'model_type': 'graphsage', 'hidden_dims': '[256, 128, 64]', 'dropout': 0.5687336386921591, 'batch_norm': False, 'lr': 0.00017632488683937638, 'weight_decay': 2.177014491009433e-05, 'epochs': 201, 'loss': 'mse', 'optimizer': 'adam', 'graph_mode': 'cutoff', 'cutoff': 0.24034152460763875, 'grm_norm': 'cosine', 'self_loops': True, 'use_snp_selection': True, 'num_snps': 5307}. Best is trial 64 with value: 0.043560982615975505.
[I 2025-11-03 13:01:39,716] Trial 77 finished with value: -0.0075745583294483205 and parameters: {'model_type': 'graphsage', 'hidden_dims': '[128, 64]', 'dropout': 0.38274934564436663, 'batch_norm': True, 'lr': 5.956690278156339e-05, 'weight_decay': 2.8613130173277555e-07, 'epochs': 170, 'loss': 'mse', 'optimizer': 'adam', 'graph_mode': 'cutoff', 'cutoff': 0.5150299110466293, 'grm_norm': 'cosine', 'self_loops': True, 'use_snp_selection': False}. Best is trial 64 with value: 0.043560982615975505.
[I 2025-11-03 13:01:44,048] Trial 78 finished with value: 0.016230723089881646 and parameters: {'model_type': 'graphsage', 'hidden_dims': '[512, 128]', 'dropout': 0.5202386799737898, 'batch_norm': True, 'lr': 0.0004764702538830771, 'weight_decay': 5.526837847868968e-06, 'epochs': 182, 'loss': 'mae', 'optimizer': 'adam', 'graph_mode': 'knn', 'source': 'grm', 'knn_k': 5, 'weighted_edges': False, 'symmetrize_mode': 'union', 'use_snp_selection': False}. Best is trial 64 with value: 0.043560982615975505.
[I 2025-11-03 13:01:46,733] Trial 79 finished with value: 0.03898642217084861 and parameters: {'model_type': 'graphsage', 'hidden_dims': '[512, 128]', 'dropout': 0.3472993917579531, 'batch_norm': True, 'lr': 0.0003655208757816421, 'weight_decay': 1.2503842492974292e-05, 'epochs': 60, 'loss': 'mse', 'optimizer': 'adam', 'graph_mode': 'cutoff', 'cutoff': 0.3172098724974478, 'grm_norm': 'none', 'self_loops': True, 'use_snp_selection': False}. Best is trial 64 with value: 0.043560982615975505.
