[I 2025-11-03 13:54:16,515] Trial 17 finished with value: 0.039104718103235486 and parameters: {'model_type': 'gcn', 'hidden_dims': '[512, 64]', 'dropout': 0.42828138759436274, 'batch_norm': True, 'lr': 0.00024253454874406555, 'weight_decay': 5.170296782239038e-06, 'epochs': 271, 'loss': 'mse', 'optimizer': 'adam', 'graph_mode': 'knn', 'source': 'grm', 'knn_k': 4, 'weighted_edges': False, 'symmetrize_mode': 'union', 'use_snp_selection': False}. Best is trial 11 with value: 0.1282886373815262.
[I 2025-11-03 13:54:18,071] Trial 18 finished with value: 0.08457854653968296 and parameters: {'model_type': 'gcn', 'hidden_dims': '[256, 128, 64]', 'dropout': 0.30493799482917733, 'batch_norm': True, 'lr': 0.0009617768567260481, 'weight_decay': 3.293863322548928e-07, 'epochs': 104, 'loss': 'mse', 'optimizer': 'adam', 'graph_mode': 'cutoff', 'cutoff': 0.44520224814551607, 'grm_norm': 'cosine_then_gcn', 'self_loops': True, 'use_snp_selection': False}. Best is trial 11 with value: 0.1282886373815262.
[I 2025-11-03 13:54:19,571] Trial 19 finished with value: 0.06596322566799728 and parameters: {'model_type': 'gcn', 'hidden_dims': '[512, 64]', 'dropout': 0.17689013579720142, 'batch_norm': True, 'lr': 7.196733253377151e-05, 'weight_decay': 0.0004088863535682684, 'epochs': 41, 'loss': 'mse', 'optimizer': 'adam', 'graph_mode': 'knn', 'source': 'grm', 'knn_k': 4, 'weighted_edges': True, 'symmetrize_mode': 'union', 'use_snp_selection': False}. Best is trial 11 with value: 0.1282886373815262.
[I 2025-11-03 13:54:20,847] Trial 20 finished with value: 0.028896606204806417 and parameters: {'model_type': 'gcn', 'hidden_dims': '[512, 64]', 'dropout': 0.3837741009735829, 'batch_norm': True, 'lr': 0.0003051708980745447, 'weight_decay': 1.328170963180864e-06, 'epochs': 1, 'loss': 'mse', 'optimizer': 'adam', 'graph_mode': 'cutoff', 'cutoff': 0.21218709727906532, 'grm_norm': 'cosine', 'self_loops': True, 'use_snp_selection': False}. Best is trial 11 with value: 0.1282886373815262.
[I 2025-11-03 13:54:22,539] Trial 21 finished with value: 0.08134610328947861 and parameters: {'model_type': 'gcn', 'hidden_dims': '[512, 128]', 'dropout': 0.47231055671098787, 'batch_norm': True, 'lr': 0.0003744047308843959, 'weight_decay': 4.209936504470346e-06, 'epochs': 87, 'loss': 'mse', 'optimizer': 'adam', 'graph_mode': 'cutoff', 'cutoff': 0.39005611936980383, 'grm_norm': 'cosine', 'self_loops': True, 'use_snp_selection': False}. Best is trial 11 with value: 0.1282886373815262.
[I 2025-11-03 13:54:24,383] Trial 22 finished with value: 0.07199933273968187 and parameters: {'model_type': 'gcn', 'hidden_dims': '[512, 128]', 'dropout': 0.46875524779328526, 'batch_norm': True, 'lr': 0.0009992116768385408, 'weight_decay': 4.1320822207650115e-06, 'epochs': 122, 'loss': 'mse', 'optimizer': 'adam', 'graph_mode': 'cutoff', 'cutoff': 0.37856149726359034, 'grm_norm': 'cosine', 'self_loops': True, 'use_snp_selection': False}. Best is trial 11 with value: 0.1282886373815262.
[I 2025-11-03 13:54:26,016] Trial 23 finished with value: 0.08409525144995911 and parameters: {'model_type': 'gcn', 'hidden_dims': '[512, 128]', 'dropout': 0.5552454565256397, 'batch_norm': True, 'lr': 0.00019920231639522712, 'weight_decay': 2.635278066091677e-07, 'epochs': 77, 'loss': 'mse', 'optimizer': 'adam', 'graph_mode': 'cutoff', 'cutoff': 0.6011862334968195, 'grm_norm': 'cosine', 'self_loops': True, 'use_snp_selection': False}. Best is trial 11 with value: 0.1282886373815262.
[I 2025-11-03 13:54:27,472] Trial 24 finished with value: 0.09865693449973884 and parameters: {'model_type': 'gcn', 'hidden_dims': '[512, 128]', 'dropout': 0.29891273837308846, 'batch_norm': True, 'lr': 0.00042413447400156494, 'weight_decay': 2.6609289283452237e-06, 'epochs': 41, 'loss': 'mse', 'optimizer': 'adam', 'graph_mode': 'cutoff', 'cutoff': 0.35204806583462095, 'grm_norm': 'cosine', 'self_loops': True, 'use_snp_selection': False}. Best is trial 11 with value: 0.1282886373815262.
[I 2025-11-03 13:54:29,675] Trial 25 finished with value: 0.07969164851754268 and parameters: {'model_type': 'gcn', 'hidden_dims': '[512, 64]', 'dropout': 0.5065387056408392, 'batch_norm': True, 'lr': 0.0004799389008992802, 'weight_decay': 8.298107179935263e-07, 'epochs': 196, 'loss': 'mse', 'optimizer': 'adam', 'graph_mode': 'cutoff', 'cutoff': 0.47905350146507686, 'grm_norm': 'cosine', 'self_loops': True, 'use_snp_selection': False}. Best is trial 11 with value: 0.1282886373815262.
[I 2025-11-03 13:54:32,967] Trial 26 finished with value: -0.003761217963333981 and parameters: {'model_type': 'gcn', 'hidden_dims': '[256, 128, 64]', 'dropout': 0.4356457358662112, 'batch_norm': False, 'lr': 7.477727915711025e-05, 'weight_decay': 8.80554898246781e-06, 'epochs': 148, 'loss': 'mae', 'optimizer': 'adam', 'graph_mode': 'knn', 'source': 'grm', 'knn_k': 8, 'weighted_edges': False, 'symmetrize_mode': 'union', 'use_snp_selection': True, 'num_snps': 59005}. Best is trial 11 with value: 0.1282886373815262.
[I 2025-11-03 13:54:34,408] Trial 27 finished with value: -0.02312164195899021 and parameters: {'model_type': 'gcn', 'hidden_dims': '[256, 128]', 'dropout': 0.25372220510795257, 'batch_norm': True, 'lr': 1.293065678896477e-06, 'weight_decay': 2.3822503339540053e-07, 'epochs': 107, 'loss': 'mse', 'optimizer': 'adam', 'graph_mode': 'cutoff', 'cutoff': 0.30770385352552376, 'grm_norm': 'gcn', 'self_loops': True, 'use_snp_selection': False}. Best is trial 11 with value: 0.1282886373815262.
[I 2025-11-03 13:54:35,816] Trial 28 finished with value: -0.0033736388998180777 and parameters: {'model_type': 'gcn', 'hidden_dims': '[512, 128]', 'dropout': 0.5995293644199655, 'batch_norm': True, 'lr': 1.3447036526313609e-05, 'weight_decay': 6.687892027322362e-07, 'epochs': 28, 'loss': 'mse', 'optimizer': 'adam', 'graph_mode': 'knn', 'source': 'grm', 'knn_k': 4, 'weighted_edges': True, 'symmetrize_mode': 'union', 'use_snp_selection': False}. Best is trial 11 with value: 0.1282886373815262.
[I 2025-11-03 13:54:37,027] Trial 29 finished with value: 0.008771050580691747 and parameters: {'model_type': 'gcn', 'hidden_dims': '[128, 64]', 'dropout': 0.2072086303571316, 'batch_norm': True, 'lr': 3.1198349261687997e-06, 'weight_decay': 8.368908757919738e-05, 'epochs': 68, 'loss': 'mae', 'optimizer': 'adam', 'graph_mode': 'knn', 'source': 'grm', 'knn_k': 9, 'weighted_edges': True, 'symmetrize_mode': 'union', 'use_snp_selection': False}. Best is trial 11 with value: 0.1282886373815262.
[I 2025-11-03 13:54:39,870] Trial 30 finished with value: 0.08023280787317814 and parameters: {'model_type': 'gcn', 'hidden_dims': '[512, 64]', 'dropout': 0.38762635991827543, 'batch_norm': True, 'lr': 0.0003658233346713282, 'weight_decay': 8.005688685268766e-06, 'epochs': 330, 'loss': 'mse', 'optimizer': 'adam', 'graph_mode': 'cutoff', 'cutoff': 0.20867502491096857, 'grm_norm': 'cosine_then_gcn', 'self_loops': True, 'use_snp_selection': False}. Best is trial 11 with value: 0.1282886373815262.
[I 2025-11-03 13:54:41,163] Trial 31 finished with value: 0.01703226760286068 and parameters: {'model_type': 'gcn', 'hidden_dims': '[512, 64]', 'dropout': 0.27817887626216614, 'batch_norm': True, 'lr': 0.0008560337207438312, 'weight_decay': 1.0168244343753015e-07, 'epochs': 1, 'loss': 'mse', 'optimizer': 'adam', 'graph_mode': 'knn', 'source': 'grm', 'knn_k': 10, 'weighted_edges': True, 'symmetrize_mode': 'union', 'use_snp_selection': False}. Best is trial 11 with value: 0.1282886373815262.
[I 2025-11-03 13:54:42,558] Trial 32 finished with value: 0.07926032649952447 and parameters: {'model_type': 'gcn', 'hidden_dims': '[512, 64]', 'dropout': 0.3137239636673354, 'batch_norm': True, 'lr': 0.0005901224803799996, 'weight_decay': 1.7296329764939338e-07, 'epochs': 20, 'loss': 'mse', 'optimizer': 'adam', 'graph_mode': 'knn', 'source': 'grm', 'knn_k': 10, 'weighted_edges': True, 'symmetrize_mode': 'union', 'use_snp_selection': False}. Best is trial 11 with value: 0.1282886373815262.
[I 2025-11-03 13:54:44,056] Trial 33 finished with value: 0.09938871267966082 and parameters: {'model_type': 'gcn', 'hidden_dims': '[512, 64]', 'dropout': 0.3352105064562263, 'batch_norm': True, 'lr': 0.0006749359795437095, 'weight_decay': 2.3036741524326033e-06, 'epochs': 44, 'loss': 'mse', 'optimizer': 'adam', 'graph_mode': 'knn', 'source': 'grm', 'knn_k': 8, 'weighted_edges': True, 'symmetrize_mode': 'union', 'use_snp_selection': False}. Best is trial 11 with value: 0.1282886373815262.
[I 2025-11-03 13:54:45,573] Trial 34 finished with value: 0.08523648318441499 and parameters: {'model_type': 'gcn', 'hidden_dims': '[512, 64]', 'dropout': 0.3746419767226199, 'batch_norm': True, 'lr': 0.0005510760444484327, 'weight_decay': 2.3835253838103962e-06, 'epochs': 50, 'loss': 'mse', 'optimizer': 'adam', 'graph_mode': 'knn', 'source': 'grm', 'knn_k': 8, 'weighted_edges': True, 'symmetrize_mode': 'union', 'use_snp_selection': False}. Best is trial 11 with value: 0.1282886373815262.
[I 2025-11-03 13:54:46,651] Trial 35 finished with value: 0.025639456050701795 and parameters: {'model_type': 'gcn', 'hidden_dims': '[128, 64]', 'dropout': 0.33363493058752075, 'batch_norm': False, 'lr': 0.00020281201092815725, 'weight_decay': 1.2188409336495906e-06, 'epochs': 99, 'loss': 'mse', 'optimizer': 'adam', 'graph_mode': 'knn', 'source': 'grm', 'knn_k': 6, 'weighted_edges': True, 'symmetrize_mode': 'union', 'use_snp_selection': True, 'num_snps': 2074}. Best is trial 11 with value: 0.1282886373815262.
[I 2025-11-03 13:54:47,853] Trial 36 finished with value: 0.11501908535558433 and parameters: {'model_type': 'gcn', 'hidden_dims': '[256, 128]', 'dropout': 0.5091562242955712, 'batch_norm': True, 'lr': 0.0006249476631038796, 'weight_decay': 2.7739388257001514e-06, 'epochs': 28, 'loss': 'mse', 'optimizer': 'adam', 'graph_mode': 'knn', 'source': 'grm', 'knn_k': 9, 'weighted_edges': False, 'symmetrize_mode': 'mutual', 'use_snp_selection': False}. Best is trial 11 with value: 0.1282886373815262.
[I 2025-11-03 13:54:49,159] Trial 37 finished with value: -0.0006801594078892991 and parameters: {'model_type': 'gcn', 'hidden_dims': '[256, 128]', 'dropout': 0.5162011289338848, 'batch_norm': False, 'lr': 0.00035768992345433634, 'weight_decay': 4.830936308591571e-07, 'epochs': 26, 'loss': 'mae', 'optimizer': 'adam', 'graph_mode': 'knn', 'source': 'grm', 'knn_k': 9, 'weighted_edges': False, 'symmetrize_mode': 'mutual', 'use_snp_selection': True, 'num_snps': 15344}. Best is trial 11 with value: 0.1282886373815262.
[I 2025-11-03 13:54:50,496] Trial 38 finished with value: 0.07104176699667214 and parameters: {'model_type': 'gcn', 'hidden_dims': '[256, 128]', 'dropout': 0.5638534052435753, 'batch_norm': True, 'lr': 0.00015222919519554742, 'weight_decay': 1.001761495047643e-06, 'epochs': 83, 'loss': 'mse', 'optimizer': 'adam', 'graph_mode': 'cutoff', 'cutoff': 0.4284886412943941, 'grm_norm': 'none', 'self_loops': False, 'use_snp_selection': False}. Best is trial 11 with value: 0.1282886373815262.
[I 2025-11-03 13:54:53,603] Trial 39 finished with value: -0.0026233488097717715 and parameters: {'model_type': 'gcn', 'hidden_dims': '[256, 128]', 'dropout': 0.49775710178935595, 'batch_norm': False, 'lr': 4.84931223896522e-05, 'weight_decay': 1.3710982355445046e-05, 'epochs': 153, 'loss': 'mae', 'optimizer': 'adam', 'graph_mode': 'knn', 'source': 'grm', 'knn_k': 5, 'weighted_edges': False, 'symmetrize_mode': 'mutual', 'use_snp_selection': True, 'num_snps': 58379}. Best is trial 11 with value: 0.1282886373815262.
[I 2025-11-03 13:54:54,847] Trial 40 finished with value: 0.09576845334987298 and parameters: {'model_type': 'gcn', 'hidden_dims': '[256, 128]', 'dropout': 0.44902821094125134, 'batch_norm': True, 'lr': 0.0007022738017044938, 'weight_decay': 3.0815674600618424e-05, 'epochs': 58, 'loss': 'mse', 'optimizer': 'adam', 'graph_mode': 'cutoff', 'cutoff': 0.5258543395680432, 'grm_norm': 'cosine', 'self_loops': True, 'use_snp_selection': False}. Best is trial 11 with value: 0.1282886373815262.
[I 2025-11-03 13:54:56,290] Trial 41 finished with value: 0.11722323748825444 and parameters: {'model_type': 'gcn', 'hidden_dims': '[512, 256]', 'dropout': 0.5342669744125448, 'batch_norm': True, 'lr': 0.0006848381607356118, 'weight_decay': 2.547660637703324e-06, 'epochs': 34, 'loss': 'mse', 'optimizer': 'adam', 'graph_mode': 'knn', 'source': 'grm', 'knn_k': 9, 'weighted_edges': False, 'symmetrize_mode': 'mutual', 'use_snp_selection': False}. Best is trial 11 with value: 0.1282886373815262.
[I 2025-11-03 13:54:57,685] Trial 42 finished with value: 0.11005023536654572 and parameters: {'model_type': 'gcn', 'hidden_dims': '[512, 256]', 'dropout': 0.5329732466915499, 'batch_norm': True, 'lr': 0.0004672048333763795, 'weight_decay': 5.938818769864621e-06, 'epochs': 26, 'loss': 'mse', 'optimizer': 'adam', 'graph_mode': 'knn', 'source': 'grm', 'knn_k': 9, 'weighted_edges': False, 'symmetrize_mode': 'mutual', 'use_snp_selection': False}. Best is trial 11 with value: 0.1282886373815262.
[I 2025-11-03 13:54:59,078] Trial 43 finished with value: 0.10941677281875727 and parameters: {'model_type': 'gcn', 'hidden_dims': '[512, 256]', 'dropout': 0.5384835597803248, 'batch_norm': True, 'lr': 0.0005229274621817117, 'weight_decay': 1.931249546847252e-06, 'epochs': 25, 'loss': 'mse', 'optimizer': 'adam', 'graph_mode': 'knn', 'source': 'grm', 'knn_k': 9, 'weighted_edges': False, 'symmetrize_mode': 'mutual', 'use_snp_selection': False}. Best is trial 11 with value: 0.1282886373815262.
[I 2025-11-03 13:55:00,520] Trial 44 finished with value: 0.08529808663230444 and parameters: {'model_type': 'gcn', 'hidden_dims': '[512, 256]', 'dropout': 0.5336684719107634, 'batch_norm': True, 'lr': 0.0002915058831148941, 'weight_decay': 6.430990031745926e-06, 'epochs': 34, 'loss': 'mse', 'optimizer': 'adam', 'graph_mode': 'knn', 'source': 'grm', 'knn_k': 9, 'weighted_edges': False, 'symmetrize_mode': 'mutual', 'use_snp_selection': False}. Best is trial 11 with value: 0.1282886373815262.
[I 2025-11-03 13:55:01,868] Trial 45 finished with value: 0.10223627630301367 and parameters: {'model_type': 'gcn', 'hidden_dims': '[512, 256]', 'dropout': 0.5764173408971871, 'batch_norm': True, 'lr': 0.0007861714170126782, 'weight_decay': 3.127578189155378e-06, 'epochs': 16, 'loss': 'mse', 'optimizer': 'adam', 'graph_mode': 'knn', 'source': 'grm', 'knn_k': 7, 'weighted_edges': False, 'symmetrize_mode': 'mutual', 'use_snp_selection': False}. Best is trial 11 with value: 0.1282886373815262.
[I 2025-11-03 13:55:03,507] Trial 46 finished with value: 0.11509907271857354 and parameters: {'model_type': 'gcn', 'hidden_dims': '[512, 256]', 'dropout': 0.4090440283486133, 'batch_norm': True, 'lr': 0.0006732077921306888, 'weight_decay': 3.021508404966008e-05, 'epochs': 71, 'loss': 'mse', 'optimizer': 'adam', 'graph_mode': 'knn', 'source': 'grm', 'knn_k': 9, 'weighted_edges': False, 'symmetrize_mode': 'mutual', 'use_snp_selection': False}. Best is trial 11 with value: 0.1282886373815262.
[I 2025-11-03 13:55:05,092] Trial 47 finished with value: 0.11702546098162118 and parameters: {'model_type': 'gcn', 'hidden_dims': '[512, 256]', 'dropout': 0.41183820805987875, 'batch_norm': True, 'lr': 0.0006859703171837135, 'weight_decay': 4.695137116175952e-05, 'epochs': 64, 'loss': 'mse', 'optimizer': 'adam', 'graph_mode': 'knn', 'source': 'grm', 'knn_k': 7, 'weighted_edges': False, 'symmetrize_mode': 'mutual', 'use_snp_selection': False}. Best is trial 11 with value: 0.1282886373815262.
[I 2025-11-03 13:55:07,776] Trial 48 finished with value: 0.008976938341293143 and parameters: {'model_type': 'gcn', 'hidden_dims': '[512, 256]', 'dropout': 0.41288496541501973, 'batch_norm': False, 'lr': 0.0009814235609175966, 'weight_decay': 0.00017056957036349087, 'epochs': 114, 'loss': 'mae', 'optimizer': 'adam', 'graph_mode': 'knn', 'source': 'grm', 'knn_k': 7, 'weighted_edges': False, 'symmetrize_mode': 'mutual', 'use_snp_selection': True, 'num_snps': 42595}. Best is trial 11 with value: 0.1282886373815262.
[I 2025-11-03 13:55:09,475] Trial 49 finished with value: 0.07029859964882293 and parameters: {'model_type': 'gcn', 'hidden_dims': '[512, 256]', 'dropout': 0.4118520895003167, 'batch_norm': True, 'lr': 0.00024015064449304713, 'weight_decay': 4.0071852409595494e-05, 'epochs': 73, 'loss': 'mse', 'optimizer': 'adam', 'graph_mode': 'knn', 'source': 'grm', 'knn_k': 10, 'weighted_edges': False, 'symmetrize_mode': 'mutual', 'use_snp_selection': False}. Best is trial 11 with value: 0.1282886373815262.
[I 2025-11-03 13:55:11,419] Trial 50 finished with value: 0.11684975522306289 and parameters: {'model_type': 'gcn', 'hidden_dims': '[512, 256]', 'dropout': 0.3660555828283665, 'batch_norm': True, 'lr': 0.0007300325262438545, 'weight_decay': 1.6759310534203844e-05, 'epochs': 132, 'loss': 'mse', 'optimizer': 'adam', 'graph_mode': 'knn', 'source': 'grm', 'knn_k': 8, 'weighted_edges': False, 'symmetrize_mode': 'mutual', 'use_snp_selection': False}. Best is trial 11 with value: 0.1282886373815262.
[I 2025-11-03 13:55:13,381] Trial 51 finished with value: 0.11728462365403221 and parameters: {'model_type': 'gcn', 'hidden_dims': '[512, 256]', 'dropout': 0.368890500304173, 'batch_norm': True, 'lr': 0.0006459265077631639, 'weight_decay': 1.8150433255444732e-05, 'epochs': 137, 'loss': 'mse', 'optimizer': 'adam', 'graph_mode': 'knn', 'source': 'grm', 'knn_k': 8, 'weighted_edges': False, 'symmetrize_mode': 'mutual', 'use_snp_selection': False}. Best is trial 11 with value: 0.1282886373815262.
[I 2025-11-03 13:55:15,355] Trial 52 finished with value: 0.12701824922792804 and parameters: {'model_type': 'gcn', 'hidden_dims': '[512, 256]', 'dropout': 0.3596864455149301, 'batch_norm': True, 'lr': 0.0004676818830720172, 'weight_decay': 1.787239841133124e-05, 'epochs': 139, 'loss': 'mse', 'optimizer': 'adam', 'graph_mode': 'knn', 'source': 'grm', 'knn_k': 8, 'weighted_edges': False, 'symmetrize_mode': 'mutual', 'use_snp_selection': False}. Best is trial 11 with value: 0.1282886373815262.
[I 2025-11-03 13:55:17,545] Trial 53 finished with value: 0.08788289977498356 and parameters: {'model_type': 'gcn', 'hidden_dims': '[512, 256]', 'dropout': 0.36684455473299116, 'batch_norm': True, 'lr': 0.00028618379693535855, 'weight_decay': 1.9159806576390673e-05, 'epochs': 181, 'loss': 'mse', 'optimizer': 'adam', 'graph_mode': 'knn', 'source': 'grm', 'knn_k': 8, 'weighted_edges': False, 'symmetrize_mode': 'mutual', 'use_snp_selection': False}. Best is trial 11 with value: 0.1282886373815262.
[I 2025-11-03 13:55:19,544] Trial 54 finished with value: 0.10222695011679184 and parameters: {'model_type': 'gcn', 'hidden_dims': '[512, 256]', 'dropout': 0.34115031845306726, 'batch_norm': True, 'lr': 0.00042894213181596724, 'weight_decay': 1.3176204341506678e-05, 'epochs': 142, 'loss': 'mse', 'optimizer': 'adam', 'graph_mode': 'knn', 'source': 'grm', 'knn_k': 7, 'weighted_edges': False, 'symmetrize_mode': 'mutual', 'use_snp_selection': False}. Best is trial 11 with value: 0.1282886373815262.
[I 2025-11-03 13:55:21,643] Trial 55 finished with value: 0.046080313129222984 and parameters: {'model_type': 'gcn', 'hidden_dims': '[512, 256]', 'dropout': 0.3590889834756589, 'batch_norm': True, 'lr': 2.3831942087397076e-05, 'weight_decay': 5.092779543921178e-05, 'epochs': 166, 'loss': 'mse', 'optimizer': 'adam', 'graph_mode': 'knn', 'source': 'grm', 'knn_k': 8, 'weighted_edges': False, 'symmetrize_mode': 'mutual', 'use_snp_selection': False}. Best is trial 11 with value: 0.1282886373815262.
[I 2025-11-03 13:55:24,038] Trial 56 finished with value: 0.09425815684950667 and parameters: {'model_type': 'gcn', 'hidden_dims': '[512, 256]', 'dropout': 0.4461596917987675, 'batch_norm': True, 'lr': 0.0001671787921601542, 'weight_decay': 0.00011519738346002545, 'epochs': 225, 'loss': 'mse', 'optimizer': 'adam', 'graph_mode': 'knn', 'source': 'grm', 'knn_k': 6, 'weighted_edges': False, 'symmetrize_mode': 'mutual', 'use_snp_selection': False}. Best is trial 11 with value: 0.1282886373815262.
[I 2025-11-03 13:55:26,212] Trial 57 finished with value: 0.09338388048316729 and parameters: {'model_type': 'gcn', 'hidden_dims': '[512, 256]', 'dropout': 0.39042019325548744, 'batch_norm': True, 'lr': 0.00010484854348119596, 'weight_decay': 1.6889245031047366e-05, 'epochs': 180, 'loss': 'mse', 'optimizer': 'adam', 'graph_mode': 'knn', 'source': 'grm', 'knn_k': 8, 'weighted_edges': False, 'symmetrize_mode': 'mutual', 'use_snp_selection': False}. Best is trial 11 with value: 0.1282886373815262.
[I 2025-11-03 13:55:28,128] Trial 58 finished with value: 0.11573275390179519 and parameters: {'model_type': 'gcn', 'hidden_dims': '[512, 256]', 'dropout': 0.32344123346023607, 'batch_norm': True, 'lr': 0.0007719876891367181, 'weight_decay': 2.4142337636506898e-05, 'epochs': 130, 'loss': 'mse', 'optimizer': 'adam', 'graph_mode': 'knn', 'source': 'grm', 'knn_k': 7, 'weighted_edges': False, 'symmetrize_mode': 'mutual', 'use_snp_selection': False}. Best is trial 11 with value: 0.1282886373815262.
[I 2025-11-03 13:55:29,862] Trial 59 finished with value: 0.07235210055557964 and parameters: {'model_type': 'gcn', 'hidden_dims': '[256, 128, 64]', 'dropout': 0.48024507859058707, 'batch_norm': True, 'lr': 0.0003415713454930989, 'weight_decay': 0.00020753599176373124, 'epochs': 139, 'loss': 'mse', 'optimizer': 'adam', 'graph_mode': 'knn', 'source': 'grm', 'knn_k': 8, 'weighted_edges': False, 'symmetrize_mode': 'mutual', 'use_snp_selection': False}. Best is trial 11 with value: 0.1282886373815262.
[I 2025-11-03 13:55:31,651] Trial 60 finished with value: 0.09039800766242655 and parameters: {'model_type': 'gcn', 'hidden_dims': '[512, 256]', 'dropout': 0.3959554606309046, 'batch_norm': False, 'lr': 0.0005004548137135426, 'weight_decay': 9.800798282717684e-06, 'epochs': 123, 'loss': 'mse', 'optimizer': 'adam', 'graph_mode': 'knn', 'source': 'grm', 'knn_k': 7, 'weighted_edges': False, 'symmetrize_mode': 'mutual', 'use_snp_selection': True, 'num_snps': 19019}. Best is trial 11 with value: 0.1282886373815262.
