[I 2025-11-03 13:09:16,349] Trial 132 finished with value: 0.08031639849834053 and parameters: {'model_type': 'gcn', 'hidden_dims': '[512, 256]', 'dropout': 0.2951767563930034, 'batch_norm': True, 'lr': 0.00042834232807683026, 'weight_decay': 5.113571273382089e-07, 'epochs': 210, 'loss': 'mse', 'optimizer': 'adam', 'graph_mode': 'off', 'use_snp_selection': True, 'num_snps': 42268}. Best is trial 130 with value: 0.09791449546929949.
[I 2025-11-03 13:09:18,276] Trial 133 finished with value: 0.07709098515964187 and parameters: {'model_type': 'gcn', 'hidden_dims': '[512, 256]', 'dropout': 0.3242668930413997, 'batch_norm': True, 'lr': 0.0004864576536851022, 'weight_decay': 2.8406071748431753e-07, 'epochs': 197, 'loss': 'mse', 'optimizer': 'adam', 'graph_mode': 'off', 'use_snp_selection': True, 'num_snps': 38630}. Best is trial 130 with value: 0.09791449546929949.
[I 2025-11-03 13:09:20,387] Trial 134 finished with value: 0.07809033708934537 and parameters: {'model_type': 'gcn', 'hidden_dims': '[512, 256]', 'dropout': 0.28704532369752106, 'batch_norm': True, 'lr': 0.00035858004710678717, 'weight_decay': 3.3071443676413164e-07, 'epochs': 207, 'loss': 'mse', 'optimizer': 'adam', 'graph_mode': 'off', 'use_snp_selection': True, 'num_snps': 40346}. Best is trial 130 with value: 0.09791449546929949.
[I 2025-11-03 13:09:22,436] Trial 135 finished with value: 0.08562115731257723 and parameters: {'model_type': 'gcn', 'hidden_dims': '[512, 256]', 'dropout': 0.3002751465288357, 'batch_norm': True, 'lr': 0.0005521465590391897, 'weight_decay': 4.358727290374059e-07, 'epochs': 210, 'loss': 'mse', 'optimizer': 'adam', 'graph_mode': 'off', 'use_snp_selection': True, 'num_snps': 36908}. Best is trial 130 with value: 0.09791449546929949.
[I 2025-11-03 13:09:24,289] Trial 136 finished with value: 0.07736226969462184 and parameters: {'model_type': 'gcn', 'hidden_dims': '[512, 256]', 'dropout': 0.3049185662394561, 'batch_norm': True, 'lr': 0.0005649826326928402, 'weight_decay': 2.382379531076984e-07, 'epochs': 200, 'loss': 'mse', 'optimizer': 'adam', 'graph_mode': 'off', 'use_snp_selection': True, 'num_snps': 34475}. Best is trial 130 with value: 0.09791449546929949.
[I 2025-11-03 13:09:26,275] Trial 137 finished with value: 0.07101460158506269 and parameters: {'model_type': 'gcn', 'hidden_dims': '[512, 256]', 'dropout': 0.26695616059304395, 'batch_norm': True, 'lr': 0.0006802312042193878, 'weight_decay': 4.278483191180171e-07, 'epochs': 210, 'loss': 'mse', 'optimizer': 'adam', 'graph_mode': 'off', 'use_snp_selection': True, 'num_snps': 36069}. Best is trial 130 with value: 0.09791449546929949.
[I 2025-11-03 13:09:28,324] Trial 138 finished with value: 0.03428878125983328 and parameters: {'model_type': 'gcn', 'hidden_dims': '[512, 256]', 'dropout': 0.32409534668555967, 'batch_norm': False, 'lr': 1.205278612926743e-05, 'weight_decay': 2.890590273737119e-07, 'epochs': 190, 'loss': 'mse', 'optimizer': 'adam', 'graph_mode': 'off', 'use_snp_selection': True, 'num_snps': 40798}. Best is trial 130 with value: 0.09791449546929949.
[I 2025-11-03 13:09:30,351] Trial 139 finished with value: 0.06480267553441793 and parameters: {'model_type': 'gcn', 'hidden_dims': '[512, 256]', 'dropout': 0.2941590212381699, 'batch_norm': True, 'lr': 5.8256786729847466e-05, 'weight_decay': 3.3959537257787816e-07, 'epochs': 214, 'loss': 'mse', 'optimizer': 'adam', 'graph_mode': 'off', 'use_snp_selection': True, 'num_snps': 37078}. Best is trial 130 with value: 0.09791449546929949.
[I 2025-11-03 13:09:32,716] Trial 140 finished with value: 0.09314604004861221 and parameters: {'model_type': 'gcn', 'hidden_dims': '[512, 256]', 'dropout': 0.3557005646205037, 'batch_norm': True, 'lr': 0.0005134388982617902, 'weight_decay': 4.4411655631290444e-07, 'epochs': 224, 'loss': 'mse', 'optimizer': 'adam', 'graph_mode': 'off', 'use_snp_selection': True, 'num_snps': 45188}. Best is trial 130 with value: 0.09791449546929949.
[I 2025-11-03 13:09:35,132] Trial 141 finished with value: 0.08471499319847786 and parameters: {'model_type': 'gcn', 'hidden_dims': '[512, 256]', 'dropout': 0.3388667948627231, 'batch_norm': True, 'lr': 0.0004806002542607428, 'weight_decay': 4.532593278804759e-07, 'epochs': 221, 'loss': 'mse', 'optimizer': 'adam', 'graph_mode': 'off', 'use_snp_selection': True, 'num_snps': 47556}. Best is trial 130 with value: 0.09791449546929949.
[I 2025-11-03 13:09:37,527] Trial 142 finished with value: 0.07803466980459334 and parameters: {'model_type': 'gcn', 'hidden_dims': '[512, 256]', 'dropout': 0.3417095797238578, 'batch_norm': True, 'lr': 0.0004903325285905396, 'weight_decay': 4.5597726389300117e-07, 'epochs': 204, 'loss': 'mse', 'optimizer': 'adam', 'graph_mode': 'off', 'use_snp_selection': True, 'num_snps': 46849}. Best is trial 130 with value: 0.09791449546929949.
[I 2025-11-03 13:09:39,935] Trial 143 finished with value: 0.09445813765096939 and parameters: {'model_type': 'gcn', 'hidden_dims': '[512, 256]', 'dropout': 0.35696301533667113, 'batch_norm': True, 'lr': 0.00042972409963211867, 'weight_decay': 2.184346346721337e-07, 'epochs': 225, 'loss': 'mse', 'optimizer': 'adam', 'graph_mode': 'off', 'use_snp_selection': True, 'num_snps': 45113}. Best is trial 130 with value: 0.09791449546929949.
[I 2025-11-03 13:09:42,358] Trial 144 finished with value: 0.0800834832882103 and parameters: {'model_type': 'gcn', 'hidden_dims': '[512, 256]', 'dropout': 0.3507309852087821, 'batch_norm': True, 'lr': 0.0004045863279211598, 'weight_decay': 2.2633808230198522e-07, 'epochs': 225, 'loss': 'mse', 'optimizer': 'adam', 'graph_mode': 'off', 'use_snp_selection': True, 'num_snps': 45434}. Best is trial 130 with value: 0.09791449546929949.
[I 2025-11-03 13:09:44,755] Trial 145 finished with value: 0.0843598513080081 and parameters: {'model_type': 'gcn', 'hidden_dims': '[512, 256]', 'dropout': 0.31969255682986275, 'batch_norm': True, 'lr': 0.0005708529388905458, 'weight_decay': 1.363771566640662e-07, 'epochs': 195, 'loss': 'mse', 'optimizer': 'adam', 'graph_mode': 'off', 'use_snp_selection': True, 'num_snps': 49315}. Best is trial 130 with value: 0.09791449546929949.
[I 2025-11-03 13:09:47,030] Trial 146 finished with value: 0.0807807586121742 and parameters: {'model_type': 'gcn', 'hidden_dims': '[512, 256]', 'dropout': 0.35711745857644844, 'batch_norm': True, 'lr': 0.0003467099109487692, 'weight_decay': 1.6674291494104495e-07, 'epochs': 215, 'loss': 'mse', 'optimizer': 'adam', 'graph_mode': 'off', 'use_snp_selection': True, 'num_snps': 44306}. Best is trial 130 with value: 0.09791449546929949.
[I 2025-11-03 13:09:48,782] Trial 147 finished with value: 0.08303541499625025 and parameters: {'model_type': 'gcn', 'hidden_dims': '[512, 256]', 'dropout': 0.3739129224766886, 'batch_norm': True, 'lr': 0.000722148604122266, 'weight_decay': 2.822538211224023e-07, 'epochs': 206, 'loss': 'mse', 'optimizer': 'adam', 'graph_mode': 'off', 'use_snp_selection': True, 'num_snps': 31993}. Best is trial 130 with value: 0.09791449546929949.
[I 2025-11-03 13:09:51,246] Trial 148 finished with value: 0.08068767086224403 and parameters: {'model_type': 'gcn', 'hidden_dims': '[512, 256]', 'dropout': 0.3044782391085857, 'batch_norm': True, 'lr': 0.0004307806566278239, 'weight_decay': 2.2076630060310616e-07, 'epochs': 233, 'loss': 'mse', 'optimizer': 'adam', 'graph_mode': 'off', 'use_snp_selection': True, 'num_snps': 49597}. Best is trial 130 with value: 0.09791449546929949.
[I 2025-11-03 13:09:53,231] Trial 149 finished with value: 0.08500392606982753 and parameters: {'model_type': 'gcn', 'hidden_dims': '[512, 256]', 'dropout': 0.2783854050567603, 'batch_norm': True, 'lr': 0.0006501634193019946, 'weight_decay': 3.4787247380935547e-07, 'epochs': 220, 'loss': 'mse', 'optimizer': 'adam', 'graph_mode': 'off', 'use_snp_selection': True, 'num_snps': 34925}. Best is trial 130 with value: 0.09791449546929949.
[I 2025-11-03 13:09:55,242] Trial 0 finished with value: 0.0017460694738410433 and parameters: {'model_type': 'gcn', 'hidden_dims': '[128, 64]', 'dropout': 0.199031432379812, 'batch_norm': True, 'lr': 1.8408544111075837e-06, 'weight_decay': 5.5136510071208614e-05, 'epochs': 336, 'loss': 'mae', 'optimizer': 'adam', 'graph_mode': 'off', 'use_snp_selection': True, 'num_snps': 43862}. Best is trial 0 with value: 0.0017460694738410433.
[I 2025-11-03 13:09:56,667] Trial 1 finished with value: 0.036378658836684445 and parameters: {'model_type': 'gcn', 'hidden_dims': '[256, 128]', 'dropout': 0.4370668075331726, 'batch_norm': True, 'lr': 7.133471581159139e-05, 'weight_decay': 1.128633586803549e-05, 'epochs': 242, 'loss': 'mae', 'optimizer': 'adam', 'graph_mode': 'off', 'use_snp_selection': False}. Best is trial 1 with value: 0.036378658836684445.
[I 2025-11-03 13:09:57,732] Trial 2 finished with value: 0.014381126023629644 and parameters: {'model_type': 'gcn', 'hidden_dims': '[256, 128, 64]', 'dropout': 0.41314357415569625, 'batch_norm': False, 'lr': 3.952233718592101e-06, 'weight_decay': 0.00026754769258252603, 'epochs': 149, 'loss': 'mse', 'optimizer': 'adam', 'graph_mode': 'off', 'use_snp_selection': True, 'num_snps': 11571}. Best is trial 1 with value: 0.036378658836684445.
[I 2025-11-03 13:10:00,098] Trial 3 finished with value: 0.011594229328846366 and parameters: {'model_type': 'gcn', 'hidden_dims': '[512, 64]', 'dropout': 0.5938127374509361, 'batch_norm': False, 'lr': 5.67704586114731e-06, 'weight_decay': 2.4518087630137052e-05, 'epochs': 320, 'loss': 'mae', 'optimizer': 'adam', 'graph_mode': 'off', 'use_snp_selection': False}. Best is trial 1 with value: 0.036378658836684445.
[I 2025-11-03 13:10:02,346] Trial 4 finished with value: -0.002977132398989705 and parameters: {'model_type': 'gcn', 'hidden_dims': '[512, 128]', 'dropout': 0.25746343592134413, 'batch_norm': True, 'lr': 1.3467657668402788e-06, 'weight_decay': 0.00033087251918647806, 'epochs': 277, 'loss': 'mse', 'optimizer': 'adam', 'graph_mode': 'off', 'use_snp_selection': True, 'num_snps': 36675}. Best is trial 1 with value: 0.036378658836684445.
[I 2025-11-03 13:10:03,914] Trial 5 finished with value: 0.016208924323458464 and parameters: {'model_type': 'gcn', 'hidden_dims': '[512, 64]', 'dropout': 0.38275350994408375, 'batch_norm': True, 'lr': 1.5586664309232824e-06, 'weight_decay': 0.0008227664668621182, 'epochs': 145, 'loss': 'mae', 'optimizer': 'adam', 'graph_mode': 'off', 'use_snp_selection': True, 'num_snps': 32148}. Best is trial 1 with value: 0.036378658836684445.
[I 2025-11-03 13:10:05,221] Trial 6 finished with value: 0.04164036273154192 and parameters: {'model_type': 'gcn', 'hidden_dims': '[256, 128]', 'dropout': 0.3930109900265879, 'batch_norm': False, 'lr': 4.892964372128395e-05, 'weight_decay': 1.5809549317992182e-06, 'epochs': 199, 'loss': 'mse', 'optimizer': 'adam', 'graph_mode': 'off', 'use_snp_selection': False}. Best is trial 6 with value: 0.04164036273154192.
[I 2025-11-03 13:10:06,512] Trial 7 finished with value: 0.022464947205871222 and parameters: {'model_type': 'gcn', 'hidden_dims': '[512, 256]', 'dropout': 0.15343979219678458, 'batch_norm': True, 'lr': 6.234003099047341e-05, 'weight_decay': 3.894760610535477e-07, 'epochs': 97, 'loss': 'mse', 'optimizer': 'adam', 'graph_mode': 'off', 'use_snp_selection': False}. Best is trial 6 with value: 0.04164036273154192.
[I 2025-11-03 13:10:08,860] Trial 8 finished with value: 0.04442459143363002 and parameters: {'model_type': 'gcn', 'hidden_dims': '[512, 128]', 'dropout': 0.10743001231661406, 'batch_norm': True, 'lr': 0.00023728538449271062, 'weight_decay': 1.7629071578048637e-05, 'epochs': 312, 'loss': 'mae', 'optimizer': 'adam', 'graph_mode': 'off', 'use_snp_selection': False}. Best is trial 8 with value: 0.04442459143363002.
[I 2025-11-03 13:10:10,520] Trial 9 finished with value: 0.015013214962725304 and parameters: {'model_type': 'gcn', 'hidden_dims': '[512, 64]', 'dropout': 0.14505336736221927, 'batch_norm': True, 'lr': 5.8619638388111826e-05, 'weight_decay': 6.200156172669308e-07, 'epochs': 175, 'loss': 'mse', 'optimizer': 'adam', 'graph_mode': 'off', 'use_snp_selection': False}. Best is trial 8 with value: 0.04442459143363002.
[I 2025-11-03 13:10:11,582] Trial 10 finished with value: 0.03951482081416457 and parameters: {'model_type': 'gcn', 'hidden_dims': '[512, 128]', 'dropout': 0.2800030442581858, 'batch_norm': False, 'lr': 0.0004919806695968257, 'weight_decay': 2.9953888095455486e-06, 'epochs': 55, 'loss': 'mae', 'optimizer': 'adam', 'graph_mode': 'off', 'use_snp_selection': False}. Best is trial 8 with value: 0.04442459143363002.
[I 2025-11-03 13:10:12,978] Trial 11 finished with value: 0.006035154551630915 and parameters: {'model_type': 'gcn', 'hidden_dims': '[256, 128]', 'dropout': 0.5025533409127559, 'batch_norm': False, 'lr': 0.00034089430505247417, 'weight_decay': 2.512571353186099e-06, 'epochs': 239, 'loss': 'mse', 'optimizer': 'adam', 'graph_mode': 'off', 'use_snp_selection': False}. Best is trial 8 with value: 0.04442459143363002.
[I 2025-11-03 13:10:14,791] Trial 12 finished with value: 0.020275091735911868 and parameters: {'model_type': 'gcn', 'hidden_dims': '[512, 128]', 'dropout': 0.33506312640228997, 'batch_norm': False, 'lr': 1.764783267762576e-05, 'weight_decay': 1.3081036432574914e-07, 'epochs': 211, 'loss': 'mae', 'optimizer': 'adam', 'graph_mode': 'off', 'use_snp_selection': False}. Best is trial 8 with value: 0.04442459143363002.
[I 2025-11-03 13:10:16,292] Trial 13 finished with value: 0.013479452368675761 and parameters: {'model_type': 'gcn', 'hidden_dims': '[256, 128]', 'dropout': 0.5103047831198696, 'batch_norm': False, 'lr': 0.00020309888958837082, 'weight_decay': 2.875929917712265e-06, 'epochs': 285, 'loss': 'mse', 'optimizer': 'adam', 'graph_mode': 'off', 'use_snp_selection': False}. Best is trial 8 with value: 0.04442459143363002.
[I 2025-11-03 13:10:17,694] Trial 14 finished with value: 0.02163836704842672 and parameters: {'model_type': 'gcn', 'hidden_dims': '[128, 64]', 'dropout': 0.3012984444538551, 'batch_norm': True, 'lr': 0.0008639601853827713, 'weight_decay': 5.472340527804409e-05, 'epochs': 347, 'loss': 'mse', 'optimizer': 'adam', 'graph_mode': 'off', 'use_snp_selection': False}. Best is trial 8 with value: 0.04442459143363002.
[I 2025-11-03 13:10:19,406] Trial 15 finished with value: 0.019687722666209502 and parameters: {'model_type': 'gcn', 'hidden_dims': '[256, 128, 64]', 'dropout': 0.21295199995856007, 'batch_norm': False, 'lr': 0.0001572871022003765, 'weight_decay': 9.78235226321606e-07, 'epochs': 278, 'loss': 'mae', 'optimizer': 'adam', 'graph_mode': 'off', 'use_snp_selection': False}. Best is trial 8 with value: 0.04442459143363002.
[I 2025-11-03 13:10:20,697] Trial 16 finished with value: -0.006347016043728306 and parameters: {'model_type': 'gcn', 'hidden_dims': '[512, 256]', 'dropout': 0.12064802936228951, 'batch_norm': True, 'lr': 2.1517090787442848e-05, 'weight_decay': 8.67282206199243e-06, 'epochs': 111, 'loss': 'mae', 'optimizer': 'adam', 'graph_mode': 'off', 'use_snp_selection': False}. Best is trial 8 with value: 0.04442459143363002.
[I 2025-11-03 13:10:22,003] Trial 17 finished with value: 0.018099971636784815 and parameters: {'model_type': 'gcn', 'hidden_dims': '[256, 128]', 'dropout': 0.4599163501058063, 'batch_norm': False, 'lr': 1.165229826693097e-05, 'weight_decay': 7.4709635059708135e-06, 'epochs': 202, 'loss': 'mse', 'optimizer': 'adam', 'graph_mode': 'off', 'use_snp_selection': False}. Best is trial 8 with value: 0.04442459143363002.
[I 2025-11-03 13:10:24,831] Trial 18 finished with value: 0.01148753656570291 and parameters: {'model_type': 'gcn', 'hidden_dims': '[512, 128]', 'dropout': 0.36880629399866416, 'batch_norm': False, 'lr': 0.00019216972255480192, 'weight_decay': 5.1284909832915915e-05, 'epochs': 245, 'loss': 'mae', 'optimizer': 'adam', 'graph_mode': 'off', 'use_snp_selection': True, 'num_snps': 58241}. Best is trial 8 with value: 0.04442459143363002.
[I 2025-11-03 13:10:26,474] Trial 19 finished with value: 0.03288879106058197 and parameters: {'model_type': 'gcn', 'hidden_dims': '[256, 128]', 'dropout': 0.22426752700825467, 'batch_norm': True, 'lr': 4.155002256554203e-05, 'weight_decay': 1.1354159408743119e-07, 'epochs': 309, 'loss': 'mse', 'optimizer': 'adam', 'graph_mode': 'off', 'use_snp_selection': False}. Best is trial 8 with value: 0.04442459143363002.
[I 2025-11-03 13:10:27,454] Trial 20 finished with value: 0.01599777194942818 and parameters: {'model_type': 'gcn', 'hidden_dims': '[512, 128]', 'dropout': 0.33014052992884424, 'batch_norm': False, 'lr': 0.00010329651945882771, 'weight_decay': 1.378028402791799e-06, 'epochs': 43, 'loss': 'mse', 'optimizer': 'adam', 'graph_mode': 'off', 'use_snp_selection': False}. Best is trial 8 with value: 0.04442459143363002.
[I 2025-11-03 13:10:28,480] Trial 21 finished with value: -0.0048332312113206115 and parameters: {'model_type': 'gcn', 'hidden_dims': '[512, 128]', 'dropout': 0.26887747939301004, 'batch_norm': False, 'lr': 0.0005275084153127895, 'weight_decay': 3.8220841232005294e-06, 'epochs': 49, 'loss': 'mae', 'optimizer': 'adam', 'graph_mode': 'off', 'use_snp_selection': False}. Best is trial 8 with value: 0.04442459143363002.
[I 2025-11-03 13:10:29,785] Trial 22 finished with value: 0.018773910125620512 and parameters: {'model_type': 'gcn', 'hidden_dims': '[512, 128]', 'dropout': 0.28273364110226246, 'batch_norm': False, 'lr': 0.0004169593465846234, 'weight_decay': 1.8410498062633672e-05, 'epochs': 107, 'loss': 'mae', 'optimizer': 'adam', 'graph_mode': 'off', 'use_snp_selection': False}. Best is trial 8 with value: 0.04442459143363002.
[I 2025-11-03 13:10:31,395] Trial 23 finished with value: 0.04066328723003015 and parameters: {'model_type': 'gcn', 'hidden_dims': '[512, 128]', 'dropout': 0.1579268983344586, 'batch_norm': False, 'lr': 0.0009346028904306631, 'weight_decay': 3.2666120737763034e-07, 'epochs': 170, 'loss': 'mae', 'optimizer': 'adam', 'graph_mode': 'off', 'use_snp_selection': False}. Best is trial 8 with value: 0.04442459143363002.
[I 2025-11-03 13:10:33,021] Trial 24 finished with value: 0.022210752879530823 and parameters: {'model_type': 'gcn', 'hidden_dims': '[512, 128]', 'dropout': 0.10613706134571983, 'batch_norm': False, 'lr': 0.0008960044187609349, 'weight_decay': 2.5113031216947977e-07, 'epochs': 169, 'loss': 'mae', 'optimizer': 'adam', 'graph_mode': 'off', 'use_snp_selection': False}. Best is trial 8 with value: 0.04442459143363002.
[I 2025-11-03 13:10:34,439] Trial 25 finished with value: -0.004907534741653214 and parameters: {'model_type': 'gcn', 'hidden_dims': '[512, 256]', 'dropout': 0.18254027536308606, 'batch_norm': False, 'lr': 0.00011242067181353096, 'weight_decay': 3.379493849041015e-07, 'epochs': 135, 'loss': 'mae', 'optimizer': 'adam', 'graph_mode': 'off', 'use_snp_selection': False}. Best is trial 8 with value: 0.04442459143363002.
[I 2025-11-03 13:10:35,622] Trial 26 finished with value: 0.002926353271897993 and parameters: {'model_type': 'gcn', 'hidden_dims': '[256, 128, 64]', 'dropout': 0.15843304538649577, 'batch_norm': True, 'lr': 0.00027729636363962883, 'weight_decay': 7.830367085139929e-07, 'epochs': 210, 'loss': 'mae', 'optimizer': 'adam', 'graph_mode': 'off', 'use_snp_selection': True, 'num_snps': 3842}. Best is trial 8 with value: 0.04442459143363002.
[I 2025-11-03 13:10:36,579] Trial 27 finished with value: -0.023146235233789766 and parameters: {'model_type': 'gcn', 'hidden_dims': '[128, 64]', 'dropout': 0.23409257910988546, 'batch_norm': False, 'lr': 0.0006497604422780067, 'weight_decay': 2.0882575233058515e-07, 'epochs': 182, 'loss': 'mae', 'optimizer': 'adam', 'graph_mode': 'off', 'use_snp_selection': False}. Best is trial 8 with value: 0.04442459143363002.
[I 2025-11-03 13:10:37,958] Trial 28 finished with value: 0.02656322992348437 and parameters: {'model_type': 'gcn', 'hidden_dims': '[256, 128]', 'dropout': 0.10989447437287174, 'batch_norm': True, 'lr': 0.0002665742671543331, 'weight_decay': 0.00012563914046120265, 'epochs': 228, 'loss': 'mse', 'optimizer': 'adam', 'graph_mode': 'off', 'use_snp_selection': False}. Best is trial 8 with value: 0.04442459143363002.
[I 2025-11-03 13:10:38,918] Trial 29 finished with value: 0.01555568668831183 and parameters: {'model_type': 'gcn', 'hidden_dims': '[128, 64]', 'dropout': 0.1968735474682744, 'batch_norm': True, 'lr': 2.8764704098293485e-05, 'weight_decay': 1.2293086188165077e-06, 'epochs': 78, 'loss': 'mae', 'optimizer': 'adam', 'graph_mode': 'off', 'use_snp_selection': True, 'num_snps': 19468}. Best is trial 8 with value: 0.04442459143363002.
[I 2025-11-03 13:10:40,964] Trial 30 finished with value: -0.017329423914421563 and parameters: {'model_type': 'gcn', 'hidden_dims': '[512, 128]', 'dropout': 0.17356247072100922, 'batch_norm': False, 'lr': 0.0001230917067939689, 'weight_decay': 4.5972024736544615e-06, 'epochs': 262, 'loss': 'mae', 'optimizer': 'adam', 'graph_mode': 'off', 'use_snp_selection': False}. Best is trial 8 with value: 0.04442459143363002.
[I 2025-11-03 13:10:42,053] Trial 31 finished with value: -0.002702919697329973 and parameters: {'model_type': 'gcn', 'hidden_dims': '[512, 128]', 'dropout': 0.316756624457989, 'batch_norm': False, 'lr': 0.0005230532332671202, 'weight_decay': 1.836607764891191e-06, 'epochs': 73, 'loss': 'mae', 'optimizer': 'adam', 'graph_mode': 'off', 'use_snp_selection': False}. Best is trial 8 with value: 0.04442459143363002.
[I 2025-11-03 13:10:44,316] Trial 32 finished with value: -0.00043831204288688626 and parameters: {'model_type': 'gcn', 'hidden_dims': '[512, 128]', 'dropout': 0.37736067158473796, 'batch_norm': False, 'lr': 0.0007928331172161668, 'weight_decay': 5.517908851512397e-06, 'epochs': 305, 'loss': 'mae', 'optimizer': 'adam', 'graph_mode': 'off', 'use_snp_selection': False}. Best is trial 8 with value: 0.04442459143363002.
