[I 2025-11-03 13:50:03,998] Trial 30 finished with value: 0.06307190963612587 and parameters: {'model_type': 'gcn', 'hidden_dims': '[256, 128, 64]', 'dropout': 0.5206050943775002, 'batch_norm': True, 'lr': 0.0009119665199517469, 'weight_decay': 4.29049925000078e-07, 'epochs': 304, 'loss': 'mse', 'optimizer': 'adam', 'graph_mode': 'off', 'use_snp_selection': False}. Best is trial 22 with value: 0.11094395980680749.
[I 2025-11-03 13:50:06,514] Trial 31 finished with value: 0.10645500978263919 and parameters: {'model_type': 'gcn', 'hidden_dims': '[512, 64]', 'dropout': 0.3078453962049296, 'batch_norm': True, 'lr': 0.0005470399149476378, 'weight_decay': 2.8499089562087836e-07, 'epochs': 349, 'loss': 'mse', 'optimizer': 'adam', 'graph_mode': 'off', 'use_snp_selection': False}. Best is trial 22 with value: 0.11094395980680749.
[I 2025-11-03 13:50:08,992] Trial 32 finished with value: 0.10956432496305982 and parameters: {'model_type': 'gcn', 'hidden_dims': '[512, 64]', 'dropout': 0.42578926865934086, 'batch_norm': True, 'lr': 0.00040279046437521394, 'weight_decay': 9.511616959505522e-07, 'epochs': 344, 'loss': 'mse', 'optimizer': 'adam', 'graph_mode': 'off', 'use_snp_selection': False}. Best is trial 22 with value: 0.11094395980680749.
[I 2025-11-03 13:50:11,456] Trial 33 finished with value: 0.10935398590048982 and parameters: {'model_type': 'gcn', 'hidden_dims': '[512, 64]', 'dropout': 0.4174068941628874, 'batch_norm': True, 'lr': 0.0003300337132529434, 'weight_decay': 1.1200954978539692e-06, 'epochs': 333, 'loss': 'mse', 'optimizer': 'adam', 'graph_mode': 'off', 'use_snp_selection': False}. Best is trial 22 with value: 0.11094395980680749.
[I 2025-11-03 13:50:12,839] Trial 34 finished with value: 0.0992784401715475 and parameters: {'model_type': 'gcn', 'hidden_dims': '[128, 64]', 'dropout': 0.43148364902266434, 'batch_norm': True, 'lr': 0.0002300258417905426, 'weight_decay': 9.04936246058431e-07, 'epochs': 334, 'loss': 'mse', 'optimizer': 'adam', 'graph_mode': 'off', 'use_snp_selection': False}. Best is trial 22 with value: 0.11094395980680749.
[I 2025-11-03 13:50:15,238] Trial 35 finished with value: 0.08039497554379456 and parameters: {'model_type': 'gcn', 'hidden_dims': '[512, 64]', 'dropout': 0.40705945161370855, 'batch_norm': False, 'lr': 0.00010144060748686781, 'weight_decay': 1.2158435705049068e-06, 'epochs': 343, 'loss': 'mse', 'optimizer': 'adam', 'graph_mode': 'off', 'use_snp_selection': False}. Best is trial 22 with value: 0.11094395980680749.
[I 2025-11-03 13:50:18,052] Trial 36 finished with value: 0.03457735922337687 and parameters: {'model_type': 'gcn', 'hidden_dims': '[512, 64]', 'dropout': 0.43812732108345076, 'batch_norm': True, 'lr': 4.016392788956051e-06, 'weight_decay': 1.0687295154404784e-05, 'epochs': 262, 'loss': 'mse', 'optimizer': 'adam', 'graph_mode': 'off', 'use_snp_selection': True, 'num_snps': 58661}. Best is trial 22 with value: 0.11094395980680749.
[I 2025-11-03 13:50:19,729] Trial 37 finished with value: 0.05767350057627433 and parameters: {'model_type': 'gcn', 'hidden_dims': '[256, 128]', 'dropout': 0.37937640172432757, 'batch_norm': True, 'lr': 3.348416922614401e-05, 'weight_decay': 3.457500051210024e-06, 'epochs': 326, 'loss': 'mse', 'optimizer': 'adam', 'graph_mode': 'off', 'use_snp_selection': False}. Best is trial 22 with value: 0.11094395980680749.
[I 2025-11-03 13:50:21,217] Trial 38 finished with value: 0.0007449759639847095 and parameters: {'model_type': 'gcn', 'hidden_dims': '[256, 128, 64]', 'dropout': 0.5044515570124735, 'batch_norm': False, 'lr': 8.912722731890508e-05, 'weight_decay': 6.7084702228277706e-06, 'epochs': 234, 'loss': 'mse', 'optimizer': 'adam', 'graph_mode': 'off', 'use_snp_selection': True, 'num_snps': 19911}. Best is trial 22 with value: 0.11094395980680749.
[I 2025-11-03 13:50:23,412] Trial 39 finished with value: 0.08375985227438225 and parameters: {'model_type': 'gcn', 'hidden_dims': '[512, 64]', 'dropout': 0.4246116819735686, 'batch_norm': True, 'lr': 0.00036125177884362684, 'weight_decay': 3.845501833996926e-05, 'epochs': 298, 'loss': 'mse', 'optimizer': 'adam', 'graph_mode': 'off', 'use_snp_selection': False}. Best is trial 22 with value: 0.11094395980680749.
[I 2025-11-03 13:50:25,794] Trial 40 finished with value: 0.0934649887589841 and parameters: {'model_type': 'gcn', 'hidden_dims': '[512, 64]', 'dropout': 0.36758093819811444, 'batch_norm': True, 'lr': 0.00019848948604873532, 'weight_decay': 1.7653333928361732e-06, 'epochs': 320, 'loss': 'mae', 'optimizer': 'adam', 'graph_mode': 'off', 'use_snp_selection': False}. Best is trial 22 with value: 0.11094395980680749.
[I 2025-11-03 13:50:28,039] Trial 41 finished with value: 0.10799203417296357 and parameters: {'model_type': 'gcn', 'hidden_dims': '[512, 64]', 'dropout': 0.3944923007886479, 'batch_norm': True, 'lr': 0.0007281164945317063, 'weight_decay': 3.888657929231206e-07, 'epochs': 295, 'loss': 'mse', 'optimizer': 'adam', 'graph_mode': 'off', 'use_snp_selection': False}. Best is trial 22 with value: 0.11094395980680749.
[I 2025-11-03 13:50:30,523] Trial 42 finished with value: 0.08616930452931314 and parameters: {'model_type': 'gcn', 'hidden_dims': '[512, 64]', 'dropout': 0.3996414961699289, 'batch_norm': True, 'lr': 0.0003903733102844566, 'weight_decay': 1.4131247643263266e-07, 'epochs': 336, 'loss': 'mse', 'optimizer': 'adam', 'graph_mode': 'off', 'use_snp_selection': False}. Best is trial 22 with value: 0.11094395980680749.
[I 2025-11-03 13:50:32,913] Trial 43 finished with value: 0.10241992248194887 and parameters: {'model_type': 'gcn', 'hidden_dims': '[512, 64]', 'dropout': 0.44270897173801077, 'batch_norm': True, 'lr': 0.0006512089839587452, 'weight_decay': 7.430991181331712e-07, 'epochs': 311, 'loss': 'mse', 'optimizer': 'adam', 'graph_mode': 'off', 'use_snp_selection': False}. Best is trial 22 with value: 0.11094395980680749.
[I 2025-11-03 13:50:35,081] Trial 44 finished with value: 0.10538591392219315 and parameters: {'model_type': 'gcn', 'hidden_dims': '[512, 64]', 'dropout': 0.38802519183930245, 'batch_norm': True, 'lr': 0.00028474298148760814, 'weight_decay': 3.824857652831388e-07, 'epochs': 292, 'loss': 'mse', 'optimizer': 'adam', 'graph_mode': 'off', 'use_snp_selection': False}. Best is trial 22 with value: 0.11094395980680749.
[I 2025-11-03 13:50:37,158] Trial 45 finished with value: 0.10626954598642725 and parameters: {'model_type': 'gcn', 'hidden_dims': '[512, 256]', 'dropout': 0.3526138136642663, 'batch_norm': True, 'lr': 0.00040559413392303543, 'weight_decay': 1.3113776760335442e-06, 'epochs': 264, 'loss': 'mse', 'optimizer': 'adam', 'graph_mode': 'off', 'use_snp_selection': False}. Best is trial 22 with value: 0.11094395980680749.
[I 2025-11-03 13:50:38,930] Trial 46 finished with value: 0.09977653168125758 and parameters: {'model_type': 'gcn', 'hidden_dims': '[256, 128]', 'dropout': 0.40440927969212087, 'batch_norm': True, 'lr': 0.0006457904412428322, 'weight_decay': 1.6040169464680332e-07, 'epochs': 349, 'loss': 'mse', 'optimizer': 'adam', 'graph_mode': 'off', 'use_snp_selection': False}. Best is trial 22 with value: 0.11094395980680749.
[I 2025-11-03 13:50:40,557] Trial 47 finished with value: 0.07113428597778354 and parameters: {'model_type': 'gcn', 'hidden_dims': '[512, 64]', 'dropout': 0.45120577256233224, 'batch_norm': False, 'lr': 0.0002774833248594323, 'weight_decay': 3.0223297661240405e-07, 'epochs': 195, 'loss': 'mse', 'optimizer': 'adam', 'graph_mode': 'off', 'use_snp_selection': False}. Best is trial 22 with value: 0.11094395980680749.
[I 2025-11-03 13:50:42,034] Trial 48 finished with value: 0.001571176183710005 and parameters: {'model_type': 'gcn', 'hidden_dims': '[512, 64]', 'dropout': 0.3739725015513851, 'batch_norm': True, 'lr': 1.1170552432785515e-06, 'weight_decay': 2.9681446446269625e-06, 'epochs': 146, 'loss': 'mae', 'optimizer': 'adam', 'graph_mode': 'off', 'use_snp_selection': False}. Best is trial 22 with value: 0.11094395980680749.
[I 2025-11-03 13:50:43,401] Trial 49 finished with value: 0.07881579280046619 and parameters: {'model_type': 'gcn', 'hidden_dims': '[128, 64]', 'dropout': 0.2759120063354237, 'batch_norm': True, 'lr': 0.00015189051895404517, 'weight_decay': 0.000287191443674494, 'epochs': 50, 'loss': 'mse', 'optimizer': 'adam', 'graph_mode': 'off', 'use_snp_selection': True, 'num_snps': 46888}. Best is trial 22 with value: 0.11094395980680749.
[I 2025-11-03 13:50:45,595] Trial 50 finished with value: 0.10517736236093327 and parameters: {'model_type': 'gcn', 'hidden_dims': '[512, 128]', 'dropout': 0.5009802259069901, 'batch_norm': True, 'lr': 0.0007003279185642924, 'weight_decay': 1.975453923099614e-05, 'epochs': 276, 'loss': 'mse', 'optimizer': 'adam', 'graph_mode': 'off', 'use_snp_selection': False}. Best is trial 22 with value: 0.11094395980680749.
[I 2025-11-03 13:50:47,990] Trial 51 finished with value: 0.014602831075879 and parameters: {'model_type': 'gcn', 'hidden_dims': '[512, 64]', 'dropout': 0.33607518960653404, 'batch_norm': True, 'lr': 8.26991777858618e-06, 'weight_decay': 4.910200675251179e-07, 'epochs': 321, 'loss': 'mse', 'optimizer': 'adam', 'graph_mode': 'off', 'use_snp_selection': False}. Best is trial 22 with value: 0.11094395980680749.
[I 2025-11-03 13:50:50,408] Trial 52 finished with value: 0.09448426726783304 and parameters: {'model_type': 'gcn', 'hidden_dims': '[512, 64]', 'dropout': 0.31675683214056044, 'batch_norm': True, 'lr': 0.0008296727261100762, 'weight_decay': 6.906340733189669e-07, 'epochs': 331, 'loss': 'mse', 'optimizer': 'adam', 'graph_mode': 'off', 'use_snp_selection': False}. Best is trial 22 with value: 0.11094395980680749.
[I 2025-11-03 13:50:52,576] Trial 53 finished with value: 0.10539793992676146 and parameters: {'model_type': 'gcn', 'hidden_dims': '[512, 64]', 'dropout': 0.27866373488271245, 'batch_norm': True, 'lr': 0.000987450120179128, 'weight_decay': 4.210351419677317e-07, 'epochs': 277, 'loss': 'mse', 'optimizer': 'adam', 'graph_mode': 'off', 'use_snp_selection': False}. Best is trial 22 with value: 0.11094395980680749.
[I 2025-11-03 13:50:54,759] Trial 54 finished with value: 0.09785017761681804 and parameters: {'model_type': 'gcn', 'hidden_dims': '[512, 64]', 'dropout': 0.4134154532704682, 'batch_norm': True, 'lr': 0.0004745305383982477, 'weight_decay': 0.00010664591801811223, 'epochs': 289, 'loss': 'mse', 'optimizer': 'adam', 'graph_mode': 'off', 'use_snp_selection': False}. Best is trial 22 with value: 0.11094395980680749.
[I 2025-11-03 13:50:57,048] Trial 55 finished with value: 0.08611590560708317 and parameters: {'model_type': 'gcn', 'hidden_dims': '[512, 64]', 'dropout': 0.35325419707417033, 'batch_norm': True, 'lr': 0.0007236901278862909, 'weight_decay': 1.5422797935331313e-06, 'epochs': 308, 'loss': 'mae', 'optimizer': 'adam', 'graph_mode': 'off', 'use_snp_selection': False}. Best is trial 22 with value: 0.11094395980680749.
[I 2025-11-03 13:50:58,698] Trial 56 finished with value: 0.08210878808169063 and parameters: {'model_type': 'gcn', 'hidden_dims': '[256, 128, 64]', 'dropout': 0.382542637552375, 'batch_norm': True, 'lr': 0.00023817674993712823, 'weight_decay': 6.903811964554754e-07, 'epochs': 248, 'loss': 'mse', 'optimizer': 'adam', 'graph_mode': 'off', 'use_snp_selection': False}. Best is trial 22 with value: 0.11094395980680749.
[I 2025-11-03 13:50:59,822] Trial 57 finished with value: -0.03748108770600958 and parameters: {'model_type': 'gcn', 'hidden_dims': '[512, 64]', 'dropout': 0.293258542327336, 'batch_norm': False, 'lr': 0.0004554349362974926, 'weight_decay': 3.22392037848687e-07, 'epochs': 87, 'loss': 'mse', 'optimizer': 'adam', 'graph_mode': 'off', 'use_snp_selection': False}. Best is trial 22 with value: 0.11094395980680749.
[I 2025-11-03 13:51:02,164] Trial 58 finished with value: 0.03395765655945957 and parameters: {'model_type': 'gcn', 'hidden_dims': '[512, 256]', 'dropout': 0.4590031656936859, 'batch_norm': True, 'lr': 4.279864571246842e-05, 'weight_decay': 2.0547982835827612e-06, 'epochs': 315, 'loss': 'mse', 'optimizer': 'adam', 'graph_mode': 'off', 'use_snp_selection': False}. Best is trial 22 with value: 0.11094395980680749.
[I 2025-11-03 13:51:04,376] Trial 59 finished with value: 0.08967769105448907 and parameters: {'model_type': 'gcn', 'hidden_dims': '[512, 64]', 'dropout': 0.42260818125807925, 'batch_norm': True, 'lr': 0.0003364236801826901, 'weight_decay': 2.217217545648015e-07, 'epochs': 288, 'loss': 'mse', 'optimizer': 'adam', 'graph_mode': 'off', 'use_snp_selection': False}. Best is trial 22 with value: 0.11094395980680749.
[I 2025-11-03 13:51:05,785] Trial 60 finished with value: 0.0866843672130819 and parameters: {'model_type': 'gcn', 'hidden_dims': '[512, 128]', 'dropout': 0.33794664277484165, 'batch_norm': True, 'lr': 0.0005594302695957653, 'weight_decay': 9.871006421778924e-07, 'epochs': 130, 'loss': 'mae', 'optimizer': 'adam', 'graph_mode': 'off', 'use_snp_selection': False}. Best is trial 22 with value: 0.11094395980680749.
[I 2025-11-03 13:51:08,308] Trial 61 finished with value: 0.0993209267307314 and parameters: {'model_type': 'gcn', 'hidden_dims': '[512, 64]', 'dropout': 0.31236855676503555, 'batch_norm': True, 'lr': 0.0005642683360286478, 'weight_decay': 1.1017385240446085e-07, 'epochs': 342, 'loss': 'mse', 'optimizer': 'adam', 'graph_mode': 'off', 'use_snp_selection': False}. Best is trial 22 with value: 0.11094395980680749.
[I 2025-11-03 13:51:10,769] Trial 62 finished with value: 0.0032276725273019283 and parameters: {'model_type': 'gcn', 'hidden_dims': '[512, 64]', 'dropout': 0.36754371368504857, 'batch_norm': True, 'lr': 2.2162136274461878e-06, 'weight_decay': 2.693475982857191e-07, 'epochs': 344, 'loss': 'mse', 'optimizer': 'adam', 'graph_mode': 'off', 'use_snp_selection': False}. Best is trial 22 with value: 0.11094395980680749.
[I 2025-11-03 13:51:13,278] Trial 63 finished with value: 0.10946833572291237 and parameters: {'model_type': 'gcn', 'hidden_dims': '[512, 64]', 'dropout': 0.24522607857007878, 'batch_norm': True, 'lr': 0.0007380087594572499, 'weight_decay': 4.792005394546637e-07, 'epochs': 350, 'loss': 'mse', 'optimizer': 'adam', 'graph_mode': 'off', 'use_snp_selection': False}. Best is trial 22 with value: 0.11094395980680749.
[I 2025-11-03 13:51:15,672] Trial 64 finished with value: 0.0943733121551624 and parameters: {'model_type': 'gcn', 'hidden_dims': '[512, 64]', 'dropout': 0.17575092244205393, 'batch_norm': True, 'lr': 0.0008311069403916729, 'weight_decay': 5.358042492167328e-07, 'epochs': 327, 'loss': 'mse', 'optimizer': 'adam', 'graph_mode': 'off', 'use_snp_selection': False}. Best is trial 22 with value: 0.11094395980680749.
[I 2025-11-03 13:51:17,206] Trial 65 finished with value: 0.0995195472567692 and parameters: {'model_type': 'gcn', 'hidden_dims': '[512, 64]', 'dropout': 0.25781907111507896, 'batch_norm': True, 'lr': 0.0007375996395548275, 'weight_decay': 8.631844954321407e-07, 'epochs': 162, 'loss': 'mse', 'optimizer': 'adam', 'graph_mode': 'off', 'use_snp_selection': False}. Best is trial 22 with value: 0.11094395980680749.
[I 2025-11-03 13:51:18,944] Trial 66 finished with value: -8.298339995178255e-05 and parameters: {'model_type': 'gcn', 'hidden_dims': '[512, 64]', 'dropout': 0.24494033697301001, 'batch_norm': True, 'lr': 1.716932085752527e-05, 'weight_decay': 0.0008281283468112786, 'epochs': 300, 'loss': 'mse', 'optimizer': 'adam', 'graph_mode': 'off', 'use_snp_selection': True, 'num_snps': 22881}. Best is trial 22 with value: 0.11094395980680749.
[I 2025-11-03 13:51:20,215] Trial 67 finished with value: 0.08556857453832462 and parameters: {'model_type': 'gcn', 'hidden_dims': '[256, 128]', 'dropout': 0.22832200861068577, 'batch_norm': True, 'lr': 0.0004538236828736428, 'weight_decay': 1.3904885909225747e-06, 'epochs': 206, 'loss': 'mse', 'optimizer': 'adam', 'graph_mode': 'off', 'use_snp_selection': False}. Best is trial 22 with value: 0.11094395980680749.
[I 2025-11-03 13:51:20,877] Trial 68 finished with value: 0.06751949912198314 and parameters: {'model_type': 'gcn', 'hidden_dims': '[128, 64]', 'dropout': 0.18643223432297998, 'batch_norm': False, 'lr': 0.00032816206441613996, 'weight_decay': 3.518068749006427e-07, 'epochs': 74, 'loss': 'mse', 'optimizer': 'adam', 'graph_mode': 'off', 'use_snp_selection': False}. Best is trial 22 with value: 0.11094395980680749.
[I 2025-11-03 13:51:21,872] Trial 69 finished with value: 0.11018512484050667 and parameters: {'model_type': 'gcn', 'hidden_dims': '[512, 64]', 'dropout': 0.15263109196352656, 'batch_norm': True, 'lr': 0.00019039910168979908, 'weight_decay': 1.508492986052565e-07, 'epochs': 57, 'loss': 'mse', 'optimizer': 'adam', 'graph_mode': 'off', 'use_snp_selection': False}. Best is trial 22 with value: 0.11094395980680749.
[I 2025-11-03 13:51:22,888] Trial 70 finished with value: 0.07727601760214765 and parameters: {'model_type': 'gcn', 'hidden_dims': '[512, 64]', 'dropout': 0.13452214782112001, 'batch_norm': True, 'lr': 0.00017775444288507526, 'weight_decay': 1.4804693272702912e-07, 'epochs': 55, 'loss': 'mse', 'optimizer': 'adam', 'graph_mode': 'off', 'use_snp_selection': False}. Best is trial 22 with value: 0.11094395980680749.
[I 2025-11-03 13:51:23,864] Trial 71 finished with value: 0.08589104952752956 and parameters: {'model_type': 'gcn', 'hidden_dims': '[512, 64]', 'dropout': 0.13139005265185197, 'batch_norm': True, 'lr': 0.00024028401073179065, 'weight_decay': 2.1847829959701424e-07, 'epochs': 50, 'loss': 'mse', 'optimizer': 'adam', 'graph_mode': 'off', 'use_snp_selection': False}. Best is trial 22 with value: 0.11094395980680749.
[I 2025-11-03 13:51:24,973] Trial 72 finished with value: 0.07305227133250186 and parameters: {'model_type': 'gcn', 'hidden_dims': '[512, 64]', 'dropout': 0.2914233123571865, 'batch_norm': True, 'lr': 0.0005752626697699031, 'weight_decay': 5.528387614332506e-07, 'epochs': 64, 'loss': 'mse', 'optimizer': 'adam', 'graph_mode': 'off', 'use_snp_selection': False}. Best is trial 22 with value: 0.11094395980680749.
[I 2025-11-03 13:51:25,926] Trial 73 finished with value: 0.10579067077912044 and parameters: {'model_type': 'gcn', 'hidden_dims': '[512, 64]', 'dropout': 0.19987521439155914, 'batch_norm': True, 'lr': 0.0009672541177891329, 'weight_decay': 1.834537360744206e-07, 'epochs': 42, 'loss': 'mse', 'optimizer': 'adam', 'graph_mode': 'off', 'use_snp_selection': False}. Best is trial 22 with value: 0.11094395980680749.
[I 2025-11-03 13:51:26,835] Trial 74 finished with value: 0.08532926803563996 and parameters: {'model_type': 'gcn', 'hidden_dims': '[256, 128, 64]', 'dropout': 0.3992850101159, 'batch_norm': True, 'lr': 0.00036656208747653217, 'weight_decay': 4.932139096559987e-07, 'epochs': 79, 'loss': 'mse', 'optimizer': 'adam', 'graph_mode': 'off', 'use_snp_selection': False}. Best is trial 22 with value: 0.11094395980680749.
[I 2025-11-03 13:51:27,897] Trial 75 finished with value: 0.060663321429628075 and parameters: {'model_type': 'gcn', 'hidden_dims': '[512, 64]', 'dropout': 0.41568617701519683, 'batch_norm': True, 'lr': 0.0005045651881611249, 'weight_decay': 1.233960811367045e-07, 'epochs': 60, 'loss': 'mse', 'optimizer': 'adam', 'graph_mode': 'off', 'use_snp_selection': False}. Best is trial 22 with value: 0.11094395980680749.
[I 2025-11-03 13:51:29,177] Trial 76 finished with value: 0.07713490047866606 and parameters: {'model_type': 'gcn', 'hidden_dims': '[512, 64]', 'dropout': 0.34275434119276404, 'batch_norm': True, 'lr': 0.0007743975853215215, 'weight_decay': 3.9936489841377255e-07, 'epochs': 336, 'loss': 'mse', 'optimizer': 'adam', 'graph_mode': 'off', 'use_snp_selection': True, 'num_snps': 3325}. Best is trial 22 with value: 0.11094395980680749.
[I 2025-11-03 13:51:31,597] Trial 77 finished with value: 0.08876844929306943 and parameters: {'model_type': 'gcn', 'hidden_dims': '[512, 256]', 'dropout': 0.3209295886542271, 'batch_norm': True, 'lr': 0.00039411048230701803, 'weight_decay': 8.21690233081973e-07, 'epochs': 318, 'loss': 'mae', 'optimizer': 'adam', 'graph_mode': 'off', 'use_snp_selection': False}. Best is trial 22 with value: 0.11094395980680749.
[I 2025-11-03 13:51:33,451] Trial 78 finished with value: 0.09795235618068542 and parameters: {'model_type': 'gcn', 'hidden_dims': '[512, 64]', 'dropout': 0.1515782241281462, 'batch_norm': True, 'lr': 0.00029062777899709096, 'weight_decay': 2.55773326186741e-06, 'epochs': 225, 'loss': 'mse', 'optimizer': 'adam', 'graph_mode': 'off', 'use_snp_selection': False}. Best is trial 22 with value: 0.11094395980680749.
[I 2025-11-03 13:51:34,717] Trial 79 finished with value: 0.06413029379920625 and parameters: {'model_type': 'gcn', 'hidden_dims': '[512, 64]', 'dropout': 0.39151950413006614, 'batch_norm': True, 'lr': 2.3143489677545154e-05, 'weight_decay': 1.1697200114893969e-06, 'epochs': 105, 'loss': 'mse', 'optimizer': 'adam', 'graph_mode': 'off', 'use_snp_selection': False}. Best is trial 22 with value: 0.11094395980680749.
[I 2025-11-03 13:51:35,668] Trial 80 finished with value: 0.05614674559047686 and parameters: {'model_type': 'gcn', 'hidden_dims': '[512, 128]', 'dropout': 0.36142497415572644, 'batch_norm': False, 'lr': 7.018523511282291e-05, 'weight_decay': 2.7199131834564525e-07, 'epochs': 40, 'loss': 'mse', 'optimizer': 'adam', 'graph_mode': 'off', 'use_snp_selection': False}. Best is trial 22 with value: 0.11094395980680749.
[I 2025-11-03 13:51:38,110] Trial 81 finished with value: 0.0952097846650307 and parameters: {'model_type': 'gcn', 'hidden_dims': '[512, 64]', 'dropout': 0.3049771753254374, 'batch_norm': True, 'lr': 0.0005847531711076332, 'weight_decay': 1.9151245617579257e-07, 'epochs': 347, 'loss': 'mse', 'optimizer': 'adam', 'graph_mode': 'off', 'use_snp_selection': False}. Best is trial 22 with value: 0.11094395980680749.
