[I 2025-11-03 11:56:46,178] Trial 66 finished with value: 0.06709823127762024 and parameters: {'model_type': 'gcn', 'hidden_dims': '[128, 64]', 'dropout': 0.531070318869597, 'batch_norm': True, 'lr': 0.00015180265210022783, 'weight_decay': 6.428356653755714e-05, 'epochs': 148, 'loss': 'mae', 'optimizer': 'adam', 'graph_mode': 'off', 'use_snp_selection': False}. Best is trial 63 with value: 0.09581533016551708.
[I 2025-11-03 11:56:47,317] Trial 67 finished with value: 0.007076147013936058 and parameters: {'model_type': 'gcn', 'hidden_dims': '[128, 64]', 'dropout': 0.5768129215489957, 'batch_norm': True, 'lr': 0.00010819647407786113, 'weight_decay': 1.7945704112683596e-05, 'epochs': 173, 'loss': 'mae', 'optimizer': 'adam', 'graph_mode': 'off', 'use_snp_selection': True, 'num_snps': 10936}. Best is trial 63 with value: 0.09581533016551708.
[I 2025-11-03 11:56:48,481] Trial 68 finished with value: 0.06169404546507313 and parameters: {'model_type': 'gcn', 'hidden_dims': '[128, 64]', 'dropout': 0.5400101455848632, 'batch_norm': True, 'lr': 0.00020226460197200782, 'weight_decay': 0.0001710733964964617, 'epochs': 188, 'loss': 'mae', 'optimizer': 'adam', 'graph_mode': 'off', 'use_snp_selection': False}. Best is trial 63 with value: 0.09581533016551708.
[I 2025-11-03 11:56:49,545] Trial 69 finished with value: 0.03448033531570596 and parameters: {'model_type': 'gcn', 'hidden_dims': '[128, 64]', 'dropout': 0.44125069667839634, 'batch_norm': False, 'lr': 0.00030871281063188735, 'weight_decay': 4.3043395125304784e-05, 'epochs': 156, 'loss': 'mae', 'optimizer': 'adam', 'graph_mode': 'off', 'use_snp_selection': False}. Best is trial 63 with value: 0.09581533016551708.
[I 2025-11-03 11:56:51,389] Trial 70 finished with value: 0.08673525767366332 and parameters: {'model_type': 'gcn', 'hidden_dims': '[128, 64]', 'dropout': 0.4549900464186044, 'batch_norm': True, 'lr': 0.0002510964428540122, 'weight_decay': 1.3184203546603432e-06, 'epochs': 124, 'loss': 'mae', 'optimizer': 'adam', 'graph_mode': 'off', 'use_snp_selection': True, 'num_snps': 47497}. Best is trial 63 with value: 0.09581533016551708.
[I 2025-11-03 11:56:53,515] Trial 71 finished with value: 0.06920917398523938 and parameters: {'model_type': 'gcn', 'hidden_dims': '[128, 64]', 'dropout': 0.4710989078793756, 'batch_norm': True, 'lr': 0.0002446696465282344, 'weight_decay': 1.1986238660354284e-06, 'epochs': 123, 'loss': 'mae', 'optimizer': 'adam', 'graph_mode': 'off', 'use_snp_selection': True, 'num_snps': 59853}. Best is trial 63 with value: 0.09581533016551708.
[I 2025-11-03 11:56:55,511] Trial 72 finished with value: 0.07219616133253409 and parameters: {'model_type': 'gcn', 'hidden_dims': '[128, 64]', 'dropout': 0.4573606848347996, 'batch_norm': True, 'lr': 0.0003171483303902386, 'weight_decay': 7.52479433498079e-07, 'epochs': 143, 'loss': 'mae', 'optimizer': 'adam', 'graph_mode': 'off', 'use_snp_selection': True, 'num_snps': 50560}. Best is trial 63 with value: 0.09581533016551708.
[I 2025-11-03 11:56:57,308] Trial 73 finished with value: 0.0678254635200533 and parameters: {'model_type': 'gcn', 'hidden_dims': '[128, 64]', 'dropout': 0.4873763943808763, 'batch_norm': True, 'lr': 0.00017759819805455678, 'weight_decay': 1.5843592296516282e-06, 'epochs': 164, 'loss': 'mae', 'optimizer': 'adam', 'graph_mode': 'off', 'use_snp_selection': True, 'num_snps': 43698}. Best is trial 63 with value: 0.09581533016551708.
[I 2025-11-03 11:56:58,746] Trial 74 finished with value: 0.06016774273838696 and parameters: {'model_type': 'gcn', 'hidden_dims': '[128, 64]', 'dropout': 0.5174329305434107, 'batch_norm': True, 'lr': 9.859173066317872e-05, 'weight_decay': 2.4804126494884183e-06, 'epochs': 129, 'loss': 'mae', 'optimizer': 'adam', 'graph_mode': 'off', 'use_snp_selection': True, 'num_snps': 31439}. Best is trial 63 with value: 0.09581533016551708.
[I 2025-11-03 11:57:00,658] Trial 75 finished with value: 0.09631997594891462 and parameters: {'model_type': 'gcn', 'hidden_dims': '[128, 64]', 'dropout': 0.40627186193162496, 'batch_norm': True, 'lr': 0.0002674216880999792, 'weight_decay': 2.6330994693595412e-05, 'epochs': 110, 'loss': 'mae', 'optimizer': 'adam', 'graph_mode': 'off', 'use_snp_selection': True, 'num_snps': 53151}. Best is trial 75 with value: 0.09631997594891462.
[I 2025-11-03 11:57:02,584] Trial 76 finished with value: 0.05889459516022098 and parameters: {'model_type': 'gcn', 'hidden_dims': '[128, 64]', 'dropout': 0.3933021045124834, 'batch_norm': True, 'lr': 0.000495411569256803, 'weight_decay': 9.443991651846657e-05, 'epochs': 108, 'loss': 'mae', 'optimizer': 'adam', 'graph_mode': 'off', 'use_snp_selection': True, 'num_snps': 54985}. Best is trial 75 with value: 0.09631997594891462.
[I 2025-11-03 11:57:03,326] Trial 77 finished with value: 0.07042243934126052 and parameters: {'model_type': 'gcn', 'hidden_dims': '[128, 64]', 'dropout': 0.412142147715286, 'batch_norm': True, 'lr': 0.00012911209207487856, 'weight_decay': 3.505850224011816e-05, 'epochs': 51, 'loss': 'mae', 'optimizer': 'adam', 'graph_mode': 'off', 'use_snp_selection': False}. Best is trial 75 with value: 0.09631997594891462.
[I 2025-11-03 11:57:04,489] Trial 78 finished with value: 0.01542595122071836 and parameters: {'model_type': 'gcn', 'hidden_dims': '[128, 64]', 'dropout': 0.10028608149994843, 'batch_norm': True, 'lr': 5.654578058853651e-05, 'weight_decay': 2.5664118807812282e-05, 'epochs': 183, 'loss': 'mae', 'optimizer': 'adam', 'graph_mode': 'off', 'use_snp_selection': False}. Best is trial 75 with value: 0.09631997594891462.
[I 2025-11-03 11:57:06,304] Trial 79 finished with value: 0.039844931371624655 and parameters: {'model_type': 'gcn', 'hidden_dims': '[256, 128]', 'dropout': 0.5538143161183997, 'batch_norm': True, 'lr': 0.00020066646007231874, 'weight_decay': 1.5545555628304902e-05, 'epochs': 170, 'loss': 'mae', 'optimizer': 'adam', 'graph_mode': 'off', 'use_snp_selection': True, 'num_snps': 36296}. Best is trial 75 with value: 0.09631997594891462.
[I 2025-11-03 11:57:07,104] Trial 80 finished with value: 0.07317766829273557 and parameters: {'model_type': 'gcn', 'hidden_dims': '[128, 64]', 'dropout': 0.35725068709824115, 'batch_norm': True, 'lr': 0.0003451830883976841, 'weight_decay': 9.379238957185986e-06, 'epochs': 82, 'loss': 'mae', 'optimizer': 'adam', 'graph_mode': 'off', 'use_snp_selection': False}. Best is trial 75 with value: 0.09631997594891462.
[I 2025-11-03 11:57:08,889] Trial 81 finished with value: 0.05715052082534449 and parameters: {'model_type': 'gcn', 'hidden_dims': '[128, 64]', 'dropout': 0.4851865309110677, 'batch_norm': True, 'lr': 0.0002502675596963053, 'weight_decay': 5.8309699435989887e-05, 'epochs': 100, 'loss': 'mae', 'optimizer': 'adam', 'graph_mode': 'off', 'use_snp_selection': True, 'num_snps': 49080}. Best is trial 75 with value: 0.09631997594891462.
[I 2025-11-03 11:57:10,838] Trial 82 finished with value: 0.047944059527651406 and parameters: {'model_type': 'gcn', 'hidden_dims': '[128, 64]', 'dropout': 0.43893258532621793, 'batch_norm': True, 'lr': 0.00041536878248362086, 'weight_decay': 4.655512041567681e-06, 'epochs': 110, 'loss': 'mae', 'optimizer': 'adam', 'graph_mode': 'off', 'use_snp_selection': True, 'num_snps': 54266}. Best is trial 75 with value: 0.09631997594891462.
[I 2025-11-03 11:57:12,677] Trial 83 finished with value: 0.09235651653159706 and parameters: {'model_type': 'gcn', 'hidden_dims': '[128, 64]', 'dropout': 0.45303099661980517, 'batch_norm': True, 'lr': 0.0005620281008184991, 'weight_decay': 3.603389542707006e-06, 'epochs': 144, 'loss': 'mae', 'optimizer': 'adam', 'graph_mode': 'off', 'use_snp_selection': True, 'num_snps': 45388}. Best is trial 75 with value: 0.09631997594891462.
[I 2025-11-03 11:57:14,426] Trial 84 finished with value: 0.06499196505419697 and parameters: {'model_type': 'gcn', 'hidden_dims': '[128, 64]', 'dropout': 0.33342030689603136, 'batch_norm': True, 'lr': 0.0005888127227428582, 'weight_decay': 3.416065904658491e-06, 'epochs': 157, 'loss': 'mae', 'optimizer': 'adam', 'graph_mode': 'off', 'use_snp_selection': True, 'num_snps': 43353}. Best is trial 75 with value: 0.09631997594891462.
[I 2025-11-03 11:57:16,168] Trial 85 finished with value: 0.08065933080761194 and parameters: {'model_type': 'gcn', 'hidden_dims': '[128, 64]', 'dropout': 0.5066063272994203, 'batch_norm': True, 'lr': 0.0008491862826096991, 'weight_decay': 2.7494543901450305e-05, 'epochs': 144, 'loss': 'mae', 'optimizer': 'adam', 'graph_mode': 'off', 'use_snp_selection': True, 'num_snps': 40543}. Best is trial 75 with value: 0.09631997594891462.
[I 2025-11-03 11:57:17,834] Trial 86 finished with value: 0.062037117968972426 and parameters: {'model_type': 'gcn', 'hidden_dims': '[256, 128, 64]', 'dropout': 0.41255152203056333, 'batch_norm': False, 'lr': 0.0004961995817907597, 'weight_decay': 5.193948558810449e-06, 'epochs': 179, 'loss': 'mae', 'optimizer': 'adam', 'graph_mode': 'off', 'use_snp_selection': True, 'num_snps': 26146}. Best is trial 75 with value: 0.09631997594891462.
[I 2025-11-03 11:57:19,315] Trial 87 finished with value: 0.07770928633194897 and parameters: {'model_type': 'gcn', 'hidden_dims': '[128, 64]', 'dropout': 0.4281809270771979, 'batch_norm': True, 'lr': 0.000664539057323851, 'weight_decay': 1.8984858347668253e-06, 'epochs': 261, 'loss': 'mae', 'optimizer': 'adam', 'graph_mode': 'off', 'use_snp_selection': False}. Best is trial 75 with value: 0.09631997594891462.
[I 2025-11-03 11:57:20,484] Trial 88 finished with value: 0.07239485393283343 and parameters: {'model_type': 'gcn', 'hidden_dims': '[128, 64]', 'dropout': 0.3837449011878578, 'batch_norm': True, 'lr': 0.00030417441351023467, 'weight_decay': 8.154556213863003e-06, 'epochs': 193, 'loss': 'mae', 'optimizer': 'adam', 'graph_mode': 'off', 'use_snp_selection': False}. Best is trial 75 with value: 0.09631997594891462.
[I 2025-11-03 11:57:22,387] Trial 89 finished with value: 0.03312617316373015 and parameters: {'model_type': 'gcn', 'hidden_dims': '[128, 64]', 'dropout': 0.48319801164252013, 'batch_norm': True, 'lr': 0.00015775174316102382, 'weight_decay': 4.118217841581382e-05, 'epochs': 139, 'loss': 'mae', 'optimizer': 'adam', 'graph_mode': 'off', 'use_snp_selection': True, 'num_snps': 52930}. Best is trial 75 with value: 0.09631997594891462.
[I 2025-11-03 11:57:24,168] Trial 90 finished with value: 0.07105060577002495 and parameters: {'model_type': 'gcn', 'hidden_dims': '[256, 128, 64]', 'dropout': 0.44641533269678774, 'batch_norm': True, 'lr': 0.0004041365207906075, 'weight_decay': 1.9889268763912132e-05, 'epochs': 200, 'loss': 'mae', 'optimizer': 'adam', 'graph_mode': 'off', 'use_snp_selection': False}. Best is trial 75 with value: 0.09631997594891462.
[I 2025-11-03 11:57:25,919] Trial 91 finished with value: 0.03977348951959946 and parameters: {'model_type': 'gcn', 'hidden_dims': '[128, 64]', 'dropout': 0.45581226958475124, 'batch_norm': True, 'lr': 0.00028320053629478094, 'weight_decay': 3.1356519355454936e-06, 'epochs': 117, 'loss': 'mae', 'optimizer': 'adam', 'graph_mode': 'off', 'use_snp_selection': True, 'num_snps': 47003}. Best is trial 75 with value: 0.09631997594891462.
[I 2025-11-03 11:57:27,795] Trial 92 finished with value: 0.07566495027145183 and parameters: {'model_type': 'gcn', 'hidden_dims': '[128, 64]', 'dropout': 0.503582971749058, 'batch_norm': True, 'lr': 0.000353590848536473, 'weight_decay': 3.881578867759844e-06, 'epochs': 127, 'loss': 'mae', 'optimizer': 'adam', 'graph_mode': 'off', 'use_snp_selection': True, 'num_snps': 47185}. Best is trial 75 with value: 0.09631997594891462.
[I 2025-11-03 11:57:29,431] Trial 93 finished with value: 0.058875904323560664 and parameters: {'model_type': 'gcn', 'hidden_dims': '[128, 64]', 'dropout': 0.1420400024078613, 'batch_norm': True, 'lr': 0.00021924110516173583, 'weight_decay': 1.7325396697939923e-06, 'epochs': 135, 'loss': 'mae', 'optimizer': 'adam', 'graph_mode': 'off', 'use_snp_selection': True, 'num_snps': 40892}. Best is trial 75 with value: 0.09631997594891462.
[I 2025-11-03 11:57:31,382] Trial 94 finished with value: 0.08080624743702122 and parameters: {'model_type': 'gcn', 'hidden_dims': '[128, 64]', 'dropout': 0.4659899413324108, 'batch_norm': True, 'lr': 0.0002641270869495947, 'weight_decay': 2.426236341544152e-06, 'epochs': 94, 'loss': 'mae', 'optimizer': 'adam', 'graph_mode': 'off', 'use_snp_selection': True, 'num_snps': 56052}. Best is trial 75 with value: 0.09631997594891462.
[I 2025-11-03 11:57:33,096] Trial 95 finished with value: 0.090649972163863 and parameters: {'model_type': 'gcn', 'hidden_dims': '[256, 128]', 'dropout': 0.5271149076636329, 'batch_norm': True, 'lr': 0.0005373944313270444, 'weight_decay': 1.1922721291635036e-06, 'epochs': 147, 'loss': 'mae', 'optimizer': 'adam', 'graph_mode': 'off', 'use_snp_selection': True, 'num_snps': 34409}. Best is trial 75 with value: 0.09631997594891462.
[I 2025-11-03 11:57:34,457] Trial 96 finished with value: 0.06698916417309209 and parameters: {'model_type': 'gcn', 'hidden_dims': '[256, 128]', 'dropout': 0.5231039922581178, 'batch_norm': True, 'lr': 0.0005587968299638349, 'weight_decay': 8.005197027851283e-07, 'epochs': 147, 'loss': 'mae', 'optimizer': 'adam', 'graph_mode': 'off', 'use_snp_selection': False}. Best is trial 75 with value: 0.09631997594891462.
[I 2025-11-03 11:57:35,867] Trial 97 finished with value: 0.0826199433604208 and parameters: {'model_type': 'gcn', 'hidden_dims': '[256, 128]', 'dropout': 0.5461657540893232, 'batch_norm': True, 'lr': 0.0006992714865978117, 'weight_decay': 5.287620895878949e-07, 'epochs': 159, 'loss': 'mae', 'optimizer': 'adam', 'graph_mode': 'off', 'use_snp_selection': False}. Best is trial 75 with value: 0.09631997594891462.
[I 2025-11-03 11:57:37,629] Trial 98 finished with value: 0.057812439906777376 and parameters: {'model_type': 'gcn', 'hidden_dims': '[256, 128]', 'dropout': 0.589753683064772, 'batch_norm': True, 'lr': 0.0004561343912342463, 'weight_decay': 1.2971384926165945e-05, 'epochs': 169, 'loss': 'mae', 'optimizer': 'adam', 'graph_mode': 'off', 'use_snp_selection': True, 'num_snps': 34428}. Best is trial 75 with value: 0.09631997594891462.
[I 2025-11-03 11:57:39,682] Trial 99 finished with value: 0.08361322265193825 and parameters: {'model_type': 'gcn', 'hidden_dims': '[256, 128]', 'dropout': 0.11533488917523665, 'batch_norm': False, 'lr': 0.0008385560620364317, 'weight_decay': 9.624007561009088e-07, 'epochs': 286, 'loss': 'mae', 'optimizer': 'adam', 'graph_mode': 'off', 'use_snp_selection': False}. Best is trial 75 with value: 0.09631997594891462.
[I 2025-11-03 11:57:41,698] Trial 100 finished with value: 0.02487151083105266 and parameters: {'model_type': 'gcn', 'hidden_dims': '[512, 128]', 'dropout': 0.5316422796472764, 'batch_norm': True, 'lr': 1.6409857628086754e-05, 'weight_decay': 5.3907369221079025e-06, 'epochs': 151, 'loss': 'mae', 'optimizer': 'adam', 'graph_mode': 'off', 'use_snp_selection': False}. Best is trial 75 with value: 0.09631997594891462.
[I 2025-11-03 11:57:43,454] Trial 101 finished with value: 0.056644933727760326 and parameters: {'model_type': 'gcn', 'hidden_dims': '[128, 64]', 'dropout': 0.42088955120297133, 'batch_norm': True, 'lr': 0.00053581246254345, 'weight_decay': 1.252319511912633e-06, 'epochs': 124, 'loss': 'mae', 'optimizer': 'adam', 'graph_mode': 'off', 'use_snp_selection': True, 'num_snps': 45777}. Best is trial 75 with value: 0.09631997594891462.
[I 2025-11-03 11:57:45,446] Trial 102 finished with value: 0.06854786130930525 and parameters: {'model_type': 'gcn', 'hidden_dims': '[128, 64]', 'dropout': 0.5090720097250669, 'batch_norm': True, 'lr': 0.00034241179130056244, 'weight_decay': 2.260804163799851e-06, 'epochs': 135, 'loss': 'mae', 'optimizer': 'adam', 'graph_mode': 'off', 'use_snp_selection': True, 'num_snps': 52489}. Best is trial 75 with value: 0.09631997594891462.
[I 2025-11-03 11:57:47,014] Trial 103 finished with value: 0.08347897484924736 and parameters: {'model_type': 'gcn', 'hidden_dims': '[256, 128, 64]', 'dropout': 0.4005269683962271, 'batch_norm': True, 'lr': 0.00018942524037952586, 'weight_decay': 1.2788703085319301e-06, 'epochs': 115, 'loss': 'mae', 'optimizer': 'adam', 'graph_mode': 'off', 'use_snp_selection': True, 'num_snps': 27965}. Best is trial 75 with value: 0.09631997594891462.
[I 2025-11-03 11:57:48,695] Trial 104 finished with value: 0.05721493831213596 and parameters: {'model_type': 'gcn', 'hidden_dims': '[128, 64]', 'dropout': 0.47882874493010963, 'batch_norm': True, 'lr': 0.0006275899384116371, 'weight_decay': 7.67499347510279e-05, 'epochs': 143, 'loss': 'mae', 'optimizer': 'adam', 'graph_mode': 'off', 'use_snp_selection': True, 'num_snps': 40675}. Best is trial 75 with value: 0.09631997594891462.
[I 2025-11-03 11:57:50,136] Trial 105 finished with value: 0.06637640923954567 and parameters: {'model_type': 'gcn', 'hidden_dims': '[256, 128]', 'dropout': 0.49547519397908435, 'batch_norm': True, 'lr': 0.00042341580928891964, 'weight_decay': 1.976027531474539e-07, 'epochs': 163, 'loss': 'mae', 'optimizer': 'adam', 'graph_mode': 'off', 'use_snp_selection': True, 'num_snps': 21852}. Best is trial 75 with value: 0.09631997594891462.
[I 2025-11-03 11:57:51,329] Trial 106 finished with value: 0.025327699576431238 and parameters: {'model_type': 'gcn', 'hidden_dims': '[128, 64]', 'dropout': 0.19711925666924157, 'batch_norm': True, 'lr': 0.00022037282947487652, 'weight_decay': 2.6551830327475674e-06, 'epochs': 150, 'loss': 'mse', 'optimizer': 'adam', 'graph_mode': 'off', 'use_snp_selection': True, 'num_snps': 16213}. Best is trial 75 with value: 0.09631997594891462.
[I 2025-11-03 11:57:54,945] Trial 107 finished with value: 0.01508895285917934 and parameters: {'model_type': 'gcn', 'hidden_dims': '[512, 128]', 'dropout': 0.5409644664998124, 'batch_norm': True, 'lr': 2.7295610791314077e-05, 'weight_decay': 5.359641837927679e-05, 'epochs': 348, 'loss': 'mae', 'optimizer': 'adam', 'graph_mode': 'off', 'use_snp_selection': False}. Best is trial 75 with value: 0.09631997594891462.
[I 2025-11-03 11:57:57,078] Trial 108 finished with value: 0.060923872573290315 and parameters: {'model_type': 'gcn', 'hidden_dims': '[128, 64]', 'dropout': 0.5598232817841734, 'batch_norm': True, 'lr': 0.00013973534193071694, 'weight_decay': 1.633944731872572e-06, 'epochs': 172, 'loss': 'mae', 'optimizer': 'adam', 'graph_mode': 'off', 'use_snp_selection': True, 'num_snps': 57259}. Best is trial 75 with value: 0.09631997594891462.
[I 2025-11-03 11:57:58,073] Trial 109 finished with value: 0.0735005962777211 and parameters: {'model_type': 'gcn', 'hidden_dims': '[128, 64]', 'dropout': 0.5221461414331342, 'batch_norm': True, 'lr': 0.00029137893523379754, 'weight_decay': 5.34510618500096e-07, 'epochs': 130, 'loss': 'mae', 'optimizer': 'adam', 'graph_mode': 'off', 'use_snp_selection': False}. Best is trial 75 with value: 0.09631997594891462.
[I 2025-11-03 11:57:59,761] Trial 110 finished with value: 0.0823347251038456 and parameters: {'model_type': 'gcn', 'hidden_dims': '[256, 128, 64]', 'dropout': 0.44751605594481636, 'batch_norm': True, 'lr': 0.00035665437431362104, 'weight_decay': 0.00011693333807659756, 'epochs': 177, 'loss': 'mae', 'optimizer': 'adam', 'graph_mode': 'off', 'use_snp_selection': False}. Best is trial 75 with value: 0.09631997594891462.
[I 2025-11-03 11:58:00,852] Trial 111 finished with value: 0.08273291526356247 and parameters: {'model_type': 'gcn', 'hidden_dims': '[128, 64]', 'dropout': 0.5184454187132373, 'batch_norm': True, 'lr': 0.0002230003118695496, 'weight_decay': 3.815482593899768e-05, 'epochs': 159, 'loss': 'mae', 'optimizer': 'adam', 'graph_mode': 'off', 'use_snp_selection': False}. Best is trial 75 with value: 0.09631997594891462.
[I 2025-11-03 11:58:01,964] Trial 112 finished with value: 0.03968988522492569 and parameters: {'model_type': 'gcn', 'hidden_dims': '[128, 64]', 'dropout': 0.5674379654621616, 'batch_norm': True, 'lr': 0.0002488698508988607, 'weight_decay': 2.500422041622042e-05, 'epochs': 165, 'loss': 'mae', 'optimizer': 'adam', 'graph_mode': 'off', 'use_snp_selection': False}. Best is trial 75 with value: 0.09631997594891462.
[I 2025-11-03 11:58:02,999] Trial 113 finished with value: 0.05933856920666955 and parameters: {'model_type': 'gcn', 'hidden_dims': '[128, 64]', 'dropout': 0.4605226588836244, 'batch_norm': True, 'lr': 0.00017450385716997072, 'weight_decay': 3.473793337753269e-05, 'epochs': 156, 'loss': 'mae', 'optimizer': 'adam', 'graph_mode': 'off', 'use_snp_selection': False}. Best is trial 75 with value: 0.09631997594891462.
[I 2025-11-03 11:58:04,043] Trial 114 finished with value: 0.06328020562504497 and parameters: {'model_type': 'gcn', 'hidden_dims': '[128, 64]', 'dropout': 0.5500630375803661, 'batch_norm': True, 'lr': 0.00038491224090628353, 'weight_decay': 1.700767922940329e-05, 'epochs': 145, 'loss': 'mae', 'optimizer': 'adam', 'graph_mode': 'off', 'use_snp_selection': False}. Best is trial 75 with value: 0.09631997594891462.
[I 2025-11-03 11:58:05,200] Trial 115 finished with value: 0.021530122433592678 and parameters: {'model_type': 'gcn', 'hidden_dims': '[128, 64]', 'dropout': 0.3073444661944874, 'batch_norm': True, 'lr': 5.796826742934571e-06, 'weight_decay': 2.9952995252594518e-05, 'epochs': 188, 'loss': 'mae', 'optimizer': 'adam', 'graph_mode': 'off', 'use_snp_selection': False}. Best is trial 75 with value: 0.09631997594891462.
[I 2025-11-03 11:58:06,195] Trial 116 finished with value: 0.048968243581500676 and parameters: {'model_type': 'gcn', 'hidden_dims': '[512, 256]', 'dropout': 0.2690825773517406, 'batch_norm': True, 'lr': 0.00047997248531321323, 'weight_decay': 2.09774478175327e-05, 'epochs': 140, 'loss': 'mse', 'optimizer': 'adam', 'graph_mode': 'off', 'use_snp_selection': True, 'num_snps': 6297}. Best is trial 75 with value: 0.09631997594891462.
