[I 2025-11-03 14:09:07,601] Trial 107 finished with value: 0.09178550732749871 and parameters: {'model_type': 'gcn', 'hidden_dims': '[512, 128]', 'dropout': 0.14052077976604596, 'batch_norm': False, 'lr': 0.00013668148563518727, 'weight_decay': 8.042543517424967e-07, 'epochs': 323, 'loss': 'mae', 'optimizer': 'adam', 'graph_mode': 'cutoff', 'cutoff': 0.5578440887337935, 'grm_norm': 'gcn', 'self_loops': False, 'use_snp_selection': False}. Best is trial 104 with value: 0.1310460359363156.
[I 2025-11-03 14:09:11,337] Trial 108 finished with value: 0.084500733050137 and parameters: {'model_type': 'gcn', 'hidden_dims': '[512, 128]', 'dropout': 0.13059895267855517, 'batch_norm': True, 'lr': 4.538502268134625e-05, 'weight_decay': 2.2008158119954276e-07, 'epochs': 286, 'loss': 'mae', 'optimizer': 'adam', 'graph_mode': 'cutoff', 'cutoff': 0.5382659440658644, 'grm_norm': 'gcn', 'self_loops': False, 'use_snp_selection': False}. Best is trial 104 with value: 0.1310460359363156.
[I 2025-11-03 14:09:14,352] Trial 109 finished with value: 0.06413290236348994 and parameters: {'model_type': 'gcn', 'hidden_dims': '[512, 128]', 'dropout': 0.5777087506122047, 'batch_norm': False, 'lr': 0.0001604913461310645, 'weight_decay': 6.438046169883378e-07, 'epochs': 210, 'loss': 'mae', 'optimizer': 'adam', 'graph_mode': 'cutoff', 'cutoff': 0.6199037396949771, 'grm_norm': 'gcn', 'self_loops': False, 'use_snp_selection': False}. Best is trial 104 with value: 0.1310460359363156.
[I 2025-11-03 14:09:18,401] Trial 110 finished with value: 0.10159953678676636 and parameters: {'model_type': 'gcn', 'hidden_dims': '[512, 256]', 'dropout': 0.16451846540804657, 'batch_norm': False, 'lr': 0.00010746890443728419, 'weight_decay': 2.5797961182362377e-07, 'epochs': 329, 'loss': 'mae', 'optimizer': 'adam', 'graph_mode': 'cutoff', 'cutoff': 0.5803926137762297, 'grm_norm': 'gcn', 'self_loops': False, 'use_snp_selection': False}. Best is trial 104 with value: 0.1310460359363156.
[I 2025-11-03 14:09:22,428] Trial 111 finished with value: 0.10420356061333735 and parameters: {'model_type': 'gcn', 'hidden_dims': '[512, 256]', 'dropout': 0.1624047500230279, 'batch_norm': False, 'lr': 6.402431588820457e-05, 'weight_decay': 1.710731008415323e-07, 'epochs': 327, 'loss': 'mae', 'optimizer': 'adam', 'graph_mode': 'cutoff', 'cutoff': 0.5783794485844692, 'grm_norm': 'gcn', 'self_loops': False, 'use_snp_selection': False}. Best is trial 104 with value: 0.1310460359363156.
[I 2025-11-03 14:09:26,448] Trial 112 finished with value: 0.06833295209580671 and parameters: {'model_type': 'gcn', 'hidden_dims': '[512, 256]', 'dropout': 0.16630706413834873, 'batch_norm': False, 'lr': 6.379950424521578e-05, 'weight_decay': 1.2846152711155957e-07, 'epochs': 327, 'loss': 'mae', 'optimizer': 'adam', 'graph_mode': 'cutoff', 'cutoff': 0.5823655574983999, 'grm_norm': 'gcn', 'self_loops': False, 'use_snp_selection': False}. Best is trial 104 with value: 0.1310460359363156.
[I 2025-11-03 14:09:30,617] Trial 113 finished with value: 0.08542251788460851 and parameters: {'model_type': 'gcn', 'hidden_dims': '[512, 256]', 'dropout': 0.15986999579949196, 'batch_norm': False, 'lr': 0.00010853848418468275, 'weight_decay': 1.2095722888911587e-07, 'epochs': 344, 'loss': 'mae', 'optimizer': 'adam', 'graph_mode': 'cutoff', 'cutoff': 0.6484130811205893, 'grm_norm': 'gcn', 'self_loops': False, 'use_snp_selection': False}. Best is trial 104 with value: 0.1310460359363156.
[I 2025-11-03 14:09:34,776] Trial 114 finished with value: 0.09308909106714663 and parameters: {'model_type': 'gcn', 'hidden_dims': '[512, 256]', 'dropout': 0.11076726978962337, 'batch_norm': False, 'lr': 3.698060222657241e-05, 'weight_decay': 2.5933434098388076e-07, 'epochs': 334, 'loss': 'mae', 'optimizer': 'adam', 'graph_mode': 'cutoff', 'cutoff': 0.5153919961177784, 'grm_norm': 'cosine', 'self_loops': False, 'use_snp_selection': False}. Best is trial 104 with value: 0.1310460359363156.
[I 2025-11-03 14:09:38,871] Trial 115 finished with value: 0.08127469720703256 and parameters: {'model_type': 'gcn', 'hidden_dims': '[512, 256]', 'dropout': 0.17986928259434506, 'batch_norm': False, 'lr': 9.23980856555863e-05, 'weight_decay': 1.7904986143497387e-07, 'epochs': 318, 'loss': 'mae', 'optimizer': 'adam', 'graph_mode': 'cutoff', 'cutoff': 0.605522061005168, 'grm_norm': 'gcn', 'self_loops': False, 'use_snp_selection': False}. Best is trial 104 with value: 0.1310460359363156.
[I 2025-11-03 14:09:42,780] Trial 116 finished with value: 0.1024103509659838 and parameters: {'model_type': 'gcn', 'hidden_dims': '[512, 256]', 'dropout': 0.14360664696851652, 'batch_norm': False, 'lr': 7.029989828553807e-05, 'weight_decay': 3.758354778195292e-07, 'epochs': 298, 'loss': 'mae', 'optimizer': 'adam', 'graph_mode': 'cutoff', 'cutoff': 0.5710984124878057, 'grm_norm': 'gcn', 'self_loops': False, 'use_snp_selection': False}. Best is trial 104 with value: 0.1310460359363156.
[I 2025-11-03 14:09:46,676] Trial 117 finished with value: 0.08658773435119085 and parameters: {'model_type': 'gcn', 'hidden_dims': '[512, 256]', 'dropout': 0.1448670813227847, 'batch_norm': False, 'lr': 4.7273162908337264e-05, 'weight_decay': 1.5699318559591769e-07, 'epochs': 296, 'loss': 'mae', 'optimizer': 'adam', 'graph_mode': 'cutoff', 'cutoff': 0.5639820045413767, 'grm_norm': 'gcn', 'self_loops': False, 'use_snp_selection': False}. Best is trial 104 with value: 0.1310460359363156.
[I 2025-11-03 14:09:50,364] Trial 118 finished with value: 0.10728927397058229 and parameters: {'model_type': 'gcn', 'hidden_dims': '[512, 256]', 'dropout': 0.12518170599054163, 'batch_norm': False, 'lr': 7.390351569309333e-05, 'weight_decay': 4.155885795908376e-07, 'epochs': 272, 'loss': 'mae', 'optimizer': 'adam', 'graph_mode': 'cutoff', 'cutoff': 0.6756377055009555, 'grm_norm': 'gcn', 'self_loops': False, 'use_snp_selection': False}. Best is trial 104 with value: 0.1310460359363156.
[I 2025-11-03 14:09:54,044] Trial 119 finished with value: 0.08819933082658434 and parameters: {'model_type': 'gcn', 'hidden_dims': '[512, 256]', 'dropout': 0.12155437235795902, 'batch_norm': False, 'lr': 7.180681079354019e-05, 'weight_decay': 3.925609843461065e-07, 'epochs': 272, 'loss': 'mae', 'optimizer': 'adam', 'graph_mode': 'cutoff', 'cutoff': 0.6288669109807187, 'grm_norm': 'gcn', 'self_loops': False, 'use_snp_selection': False}. Best is trial 104 with value: 0.1310460359363156.
[I 2025-11-03 14:09:57,834] Trial 120 finished with value: 0.08565740282803244 and parameters: {'model_type': 'gcn', 'hidden_dims': '[512, 256]', 'dropout': 0.13305736607342766, 'batch_norm': False, 'lr': 5.690917367450693e-05, 'weight_decay': 4.924583970994362e-07, 'epochs': 283, 'loss': 'mae', 'optimizer': 'adam', 'graph_mode': 'cutoff', 'cutoff': 0.48597890022904955, 'grm_norm': 'gcn', 'self_loops': False, 'use_snp_selection': False}. Best is trial 104 with value: 0.1310460359363156.
[I 2025-11-03 14:10:01,784] Trial 121 finished with value: 0.08108349384759178 and parameters: {'model_type': 'gcn', 'hidden_dims': '[512, 256]', 'dropout': 0.1517188913181274, 'batch_norm': False, 'lr': 7.420633653030053e-05, 'weight_decay': 3.52546454206395e-07, 'epochs': 302, 'loss': 'mae', 'optimizer': 'adam', 'graph_mode': 'cutoff', 'cutoff': 0.6168271205865501, 'grm_norm': 'gcn', 'self_loops': False, 'use_snp_selection': False}. Best is trial 104 with value: 0.1310460359363156.
[I 2025-11-03 14:10:05,794] Trial 122 finished with value: 0.0889547712523622 and parameters: {'model_type': 'gcn', 'hidden_dims': '[512, 64]', 'dropout': 0.10034644397210932, 'batch_norm': False, 'lr': 8.528460113147083e-05, 'weight_decay': 1.1621798524068043e-06, 'epochs': 311, 'loss': 'mae', 'optimizer': 'adam', 'graph_mode': 'cutoff', 'cutoff': 0.6778784807079452, 'grm_norm': 'gcn', 'self_loops': False, 'use_snp_selection': False}. Best is trial 104 with value: 0.1310460359363156.
[I 2025-11-03 14:10:09,300] Trial 123 finished with value: 0.06086192129509652 and parameters: {'model_type': 'gcn', 'hidden_dims': '[512, 128]', 'dropout': 0.12435253813081334, 'batch_norm': False, 'lr': 3.8788902539456395e-05, 'weight_decay': 8.856564599733064e-07, 'epochs': 261, 'loss': 'mae', 'optimizer': 'adam', 'graph_mode': 'cutoff', 'cutoff': 0.6369550488869431, 'grm_norm': 'gcn', 'self_loops': False, 'use_snp_selection': False}. Best is trial 104 with value: 0.1310460359363156.
[I 2025-11-03 14:10:12,936] Trial 124 finished with value: 0.04811625264647839 and parameters: {'model_type': 'gcn', 'hidden_dims': '[512, 256]', 'dropout': 0.14325671196605888, 'batch_norm': False, 'lr': 1.6919487677005473e-06, 'weight_decay': 7.284810715621185e-07, 'epochs': 274, 'loss': 'mae', 'optimizer': 'adam', 'graph_mode': 'cutoff', 'cutoff': 0.6641775057118221, 'grm_norm': 'gcn', 'self_loops': False, 'use_snp_selection': False}. Best is trial 104 with value: 0.1310460359363156.
[I 2025-11-03 14:10:16,755] Trial 125 finished with value: 0.10487383575182596 and parameters: {'model_type': 'gcn', 'hidden_dims': '[512, 128]', 'dropout': 0.13203419211271508, 'batch_norm': False, 'lr': 0.00011848175487973552, 'weight_decay': 6.425325924841637e-07, 'epochs': 289, 'loss': 'mae', 'optimizer': 'adam', 'graph_mode': 'cutoff', 'cutoff': 0.59852587653513, 'grm_norm': 'gcn', 'self_loops': False, 'use_snp_selection': False}. Best is trial 104 with value: 0.1310460359363156.
[I 2025-11-03 14:10:19,482] Trial 126 finished with value: 0.054354900366021724 and parameters: {'model_type': 'gcn', 'hidden_dims': '[256, 128]', 'dropout': 0.11001449443887115, 'batch_norm': False, 'lr': 2.8148864467614658e-05, 'weight_decay': 5.738983447223808e-07, 'epochs': 292, 'loss': 'mae', 'optimizer': 'adam', 'graph_mode': 'knn', 'source': 'grm', 'knn_k': 5, 'weighted_edges': False, 'symmetrize_mode': 'union', 'use_snp_selection': False}. Best is trial 104 with value: 0.1310460359363156.
[I 2025-11-03 14:10:23,397] Trial 127 finished with value: 0.09831841718626554 and parameters: {'model_type': 'gcn', 'hidden_dims': '[512, 128]', 'dropout': 0.1338360166148614, 'batch_norm': False, 'lr': 6.45864898106949e-05, 'weight_decay': 1.5869583121522846e-06, 'epochs': 299, 'loss': 'mae', 'optimizer': 'adam', 'graph_mode': 'cutoff', 'cutoff': 0.5455788616695574, 'grm_norm': 'gcn', 'self_loops': False, 'use_snp_selection': False}. Best is trial 104 with value: 0.1310460359363156.
[I 2025-11-03 14:10:27,207] Trial 128 finished with value: 0.08974772407841651 and parameters: {'model_type': 'gcn', 'hidden_dims': '[512, 128]', 'dropout': 0.11813818260898278, 'batch_norm': True, 'lr': 0.00011861081712591243, 'weight_decay': 4.1059348591447277e-07, 'epochs': 282, 'loss': 'mae', 'optimizer': 'adam', 'graph_mode': 'cutoff', 'cutoff': 0.5961999372935938, 'grm_norm': 'cosine', 'self_loops': False, 'use_snp_selection': False}. Best is trial 104 with value: 0.1310460359363156.
[I 2025-11-03 14:10:30,697] Trial 129 finished with value: 0.08892940783791664 and parameters: {'model_type': 'gcn', 'hidden_dims': '[512, 256]', 'dropout': 0.15808997761224017, 'batch_norm': False, 'lr': 1.6496084772555562e-05, 'weight_decay': 3.269557460934508e-07, 'epochs': 255, 'loss': 'mae', 'optimizer': 'adam', 'graph_mode': 'cutoff', 'cutoff': 0.5832977724582327, 'grm_norm': 'gcn', 'self_loops': False, 'use_snp_selection': False}. Best is trial 104 with value: 0.1310460359363156.
[I 2025-11-03 14:10:34,694] Trial 130 finished with value: 0.09450821199106972 and parameters: {'model_type': 'gcn', 'hidden_dims': '[512, 128]', 'dropout': 0.14722500275549777, 'batch_norm': False, 'lr': 9.029455963904129e-05, 'weight_decay': 1.6620963508397845e-07, 'epochs': 312, 'loss': 'mae', 'optimizer': 'adam', 'graph_mode': 'cutoff', 'cutoff': 0.5251770564783786, 'grm_norm': 'gcn', 'self_loops': False, 'use_snp_selection': False}. Best is trial 104 with value: 0.1310460359363156.
[I 2025-11-03 14:10:38,075] Trial 131 finished with value: 0.09947565164426529 and parameters: {'model_type': 'gcn', 'hidden_dims': '[512, 128]', 'dropout': 0.17490515005758106, 'batch_norm': False, 'lr': 0.00016669611364831423, 'weight_decay': 6.640277628124591e-07, 'epochs': 242, 'loss': 'mae', 'optimizer': 'adam', 'graph_mode': 'cutoff', 'cutoff': 0.6084270806883386, 'grm_norm': 'gcn', 'self_loops': False, 'use_snp_selection': False}. Best is trial 104 with value: 0.1310460359363156.
[I 2025-11-03 14:10:41,674] Trial 132 finished with value: 0.10755894780423536 and parameters: {'model_type': 'gcn', 'hidden_dims': '[512, 128]', 'dropout': 0.13107620882854035, 'batch_norm': False, 'lr': 5.024618922338077e-05, 'weight_decay': 5.133703667415937e-07, 'epochs': 268, 'loss': 'mae', 'optimizer': 'adam', 'graph_mode': 'cutoff', 'cutoff': 0.6252125612654098, 'grm_norm': 'gcn', 'self_loops': False, 'use_snp_selection': False}. Best is trial 104 with value: 0.1310460359363156.
[I 2025-11-03 14:10:45,284] Trial 133 finished with value: 0.10151648959391518 and parameters: {'model_type': 'gcn', 'hidden_dims': '[512, 128]', 'dropout': 0.13077113469543863, 'batch_norm': False, 'lr': 4.875317560731848e-05, 'weight_decay': 4.6860261930728584e-07, 'epochs': 268, 'loss': 'mae', 'optimizer': 'adam', 'graph_mode': 'cutoff', 'cutoff': 0.6299928851896842, 'grm_norm': 'gcn', 'self_loops': False, 'use_snp_selection': False}. Best is trial 104 with value: 0.1310460359363156.
[I 2025-11-03 14:10:49,210] Trial 134 finished with value: 0.09308676858377536 and parameters: {'model_type': 'gcn', 'hidden_dims': '[512, 128]', 'dropout': 0.13939023886530522, 'batch_norm': False, 'lr': 5.4514938251458094e-05, 'weight_decay': 9.95123669391229e-07, 'epochs': 304, 'loss': 'mae', 'optimizer': 'adam', 'graph_mode': 'cutoff', 'cutoff': 0.5687116213652205, 'grm_norm': 'gcn', 'self_loops': False, 'use_snp_selection': False}. Best is trial 104 with value: 0.1310460359363156.
[I 2025-11-03 14:10:53,032] Trial 135 finished with value: 0.11620152682049739 and parameters: {'model_type': 'gcn', 'hidden_dims': '[512, 128]', 'dropout': 0.11698697139827807, 'batch_norm': False, 'lr': 7.933859034925454e-05, 'weight_decay': 5.617857714523474e-07, 'epochs': 293, 'loss': 'mae', 'optimizer': 'adam', 'graph_mode': 'cutoff', 'cutoff': 0.6531741963951994, 'grm_norm': 'gcn', 'self_loops': False, 'use_snp_selection': False}. Best is trial 104 with value: 0.1310460359363156.
[I 2025-11-03 14:10:56,717] Trial 136 finished with value: 0.09880084986269981 and parameters: {'model_type': 'gcn', 'hidden_dims': '[512, 128]', 'dropout': 0.10816786649301158, 'batch_norm': False, 'lr': 0.00010791598183449135, 'weight_decay': 5.152058302453969e-07, 'epochs': 276, 'loss': 'mae', 'optimizer': 'adam', 'graph_mode': 'cutoff', 'cutoff': 0.6545434431385151, 'grm_norm': 'gcn', 'self_loops': False, 'use_snp_selection': False}. Best is trial 104 with value: 0.1310460359363156.
[I 2025-11-03 14:11:00,294] Trial 137 finished with value: 0.10479756677929826 and parameters: {'model_type': 'gcn', 'hidden_dims': '[512, 128]', 'dropout': 0.11805807936350601, 'batch_norm': False, 'lr': 8.070228049829935e-05, 'weight_decay': 6.142720949085385e-07, 'epochs': 266, 'loss': 'mae', 'optimizer': 'adam', 'graph_mode': 'cutoff', 'cutoff': 0.6437115672693788, 'grm_norm': 'gcn', 'self_loops': False, 'use_snp_selection': False}. Best is trial 104 with value: 0.1310460359363156.
[I 2025-11-03 14:11:03,775] Trial 138 finished with value: 0.06425405788589804 and parameters: {'model_type': 'gcn', 'hidden_dims': '[512, 128]', 'dropout': 0.120318062689415, 'batch_norm': False, 'lr': 7.198443328402823e-06, 'weight_decay': 6.174652389509918e-07, 'epochs': 254, 'loss': 'mae', 'optimizer': 'adam', 'graph_mode': 'cutoff', 'cutoff': 0.6496132111368541, 'grm_norm': 'gcn', 'self_loops': False, 'use_snp_selection': False}. Best is trial 104 with value: 0.1310460359363156.
[I 2025-11-03 14:11:07,367] Trial 139 finished with value: 0.11495432641520693 and parameters: {'model_type': 'gcn', 'hidden_dims': '[512, 128]', 'dropout': 0.3127339534260529, 'batch_norm': False, 'lr': 0.00013219313764210175, 'weight_decay': 9.978468818305036e-07, 'epochs': 265, 'loss': 'mae', 'optimizer': 'adam', 'graph_mode': 'cutoff', 'cutoff': 0.6252115667071683, 'grm_norm': 'gcn', 'self_loops': False, 'use_snp_selection': False}. Best is trial 104 with value: 0.1310460359363156.
[I 2025-11-03 14:11:10,942] Trial 140 finished with value: 0.0813873721741405 and parameters: {'model_type': 'gcn', 'hidden_dims': '[512, 128]', 'dropout': 0.2718852448207526, 'batch_norm': False, 'lr': 0.00012720854475469298, 'weight_decay': 1.1498667436674232e-06, 'epochs': 264, 'loss': 'mae', 'optimizer': 'adam', 'graph_mode': 'cutoff', 'cutoff': 0.6844411623609703, 'grm_norm': 'gcn', 'self_loops': False, 'use_snp_selection': False}. Best is trial 104 with value: 0.1310460359363156.
[I 2025-11-03 14:11:14,228] Trial 141 finished with value: 0.09210932963455913 and parameters: {'model_type': 'gcn', 'hidden_dims': '[512, 128]', 'dropout': 0.12635128422441763, 'batch_norm': False, 'lr': 9.032213805744409e-05, 'weight_decay': 8.866630762936682e-07, 'epochs': 231, 'loss': 'mae', 'optimizer': 'adam', 'graph_mode': 'cutoff', 'cutoff': 0.6240672056261138, 'grm_norm': 'gcn', 'self_loops': False, 'use_snp_selection': False}. Best is trial 104 with value: 0.1310460359363156.
[I 2025-11-03 14:11:17,850] Trial 142 finished with value: 0.09835428693671923 and parameters: {'model_type': 'gcn', 'hidden_dims': '[512, 128]', 'dropout': 0.34441153717174805, 'batch_norm': False, 'lr': 0.0001479430774124991, 'weight_decay': 6.808821082970177e-07, 'epochs': 270, 'loss': 'mae', 'optimizer': 'adam', 'graph_mode': 'cutoff', 'cutoff': 0.5968873946553344, 'grm_norm': 'gcn', 'self_loops': False, 'use_snp_selection': False}. Best is trial 104 with value: 0.1310460359363156.
[I 2025-11-03 14:11:21,656] Trial 143 finished with value: 0.10128119464016451 and parameters: {'model_type': 'gcn', 'hidden_dims': '[512, 128]', 'dropout': 0.10003232393674708, 'batch_norm': False, 'lr': 0.00011552859889084995, 'weight_decay': 5.47077988551104e-07, 'epochs': 291, 'loss': 'mae', 'optimizer': 'adam', 'graph_mode': 'cutoff', 'cutoff': 0.6417829076153153, 'grm_norm': 'gcn', 'self_loops': False, 'use_snp_selection': False}. Best is trial 104 with value: 0.1310460359363156.
[I 2025-11-03 14:11:25,390] Trial 144 finished with value: 0.05738475011345493 and parameters: {'model_type': 'gcn', 'hidden_dims': '[512, 128]', 'dropout': 0.4861078712197643, 'batch_norm': False, 'lr': 8.222079689093544e-05, 'weight_decay': 2.2165592581215028e-07, 'epochs': 283, 'loss': 'mae', 'optimizer': 'adam', 'graph_mode': 'cutoff', 'cutoff': 0.6203993587186152, 'grm_norm': 'gcn', 'self_loops': False, 'use_snp_selection': False}. Best is trial 104 with value: 0.1310460359363156.
[I 2025-11-03 14:11:27,848] Trial 145 finished with value: 0.11094615748528314 and parameters: {'model_type': 'gcn', 'hidden_dims': '[512, 128]', 'dropout': 0.31191120316553855, 'batch_norm': False, 'lr': 0.00018153254111811693, 'weight_decay': 2.9738482687937485e-07, 'epochs': 139, 'loss': 'mae', 'optimizer': 'adam', 'graph_mode': 'cutoff', 'cutoff': 0.6634756434129584, 'grm_norm': 'gcn', 'self_loops': False, 'use_snp_selection': False}. Best is trial 104 with value: 0.1310460359363156.
[I 2025-11-03 14:11:31,177] Trial 146 finished with value: 0.07825357466894199 and parameters: {'model_type': 'gcn', 'hidden_dims': '[512, 128]', 'dropout': 0.3274542587436884, 'batch_norm': False, 'lr': 0.00013474024462039146, 'weight_decay': 3.77929462946054e-07, 'epochs': 238, 'loss': 'mae', 'optimizer': 'adam', 'graph_mode': 'cutoff', 'cutoff': 0.7079552736882024, 'grm_norm': 'gcn', 'self_loops': False, 'use_snp_selection': False}. Best is trial 104 with value: 0.1310460359363156.
[I 2025-11-03 14:11:33,725] Trial 147 finished with value: 0.06179601355139957 and parameters: {'model_type': 'gcn', 'hidden_dims': '[512, 128]', 'dropout': 0.30965082543769606, 'batch_norm': False, 'lr': 9.949681968576138e-05, 'weight_decay': 3.002665764076368e-07, 'epochs': 144, 'loss': 'mae', 'optimizer': 'adam', 'graph_mode': 'knn', 'source': 'grm', 'knn_k': 2, 'weighted_edges': True, 'symmetrize_mode': 'mutual', 'use_snp_selection': False}. Best is trial 104 with value: 0.1310460359363156.
[I 2025-11-03 14:11:35,991] Trial 148 finished with value: 0.06919432779485034 and parameters: {'model_type': 'gcn', 'hidden_dims': '[512, 128]', 'dropout': 0.1141047976014675, 'batch_norm': False, 'lr': 0.00018531509258585958, 'weight_decay': 5.701896122031606e-07, 'epochs': 117, 'loss': 'mae', 'optimizer': 'adam', 'graph_mode': 'cutoff', 'cutoff': 0.6644462975824562, 'grm_norm': 'gcn', 'self_loops': False, 'use_snp_selection': False}. Best is trial 104 with value: 0.1310460359363156.
[I 2025-11-03 14:11:38,555] Trial 149 finished with value: 0.11031540554123012 and parameters: {'model_type': 'gcn', 'hidden_dims': '[256, 128]', 'dropout': 0.3515276353681326, 'batch_norm': False, 'lr': 7.699953161938389e-05, 'weight_decay': 7.532787759964644e-07, 'epochs': 278, 'loss': 'mae', 'optimizer': 'adam', 'graph_mode': 'cutoff', 'cutoff': 0.6452517016953712, 'grm_norm': 'cosine', 'self_loops': False, 'use_snp_selection': False}. Best is trial 104 with value: 0.1310460359363156.
[I 2025-11-03 14:11:41,309] Trial 0 finished with value: 0.06497057022927327 and parameters: {'model_type': 'gcn', 'hidden_dims': '[128, 64]', 'dropout': 0.199031432379812, 'batch_norm': True, 'lr': 1.8408544111075837e-06, 'weight_decay': 5.5136510071208614e-05, 'epochs': 334, 'loss': 'mae', 'optimizer': 'adam', 'graph_mode': 'knn', 'source': 'grm', 'knn_k': 8, 'weighted_edges': True, 'symmetrize_mode': 'mutual', 'use_snp_selection': False}. Best is trial 0 with value: 0.06497057022927327.
