[I 2025-11-12 14:46:30,358] Trial 102 finished with value: 0.23158629676210934 and parameters: {'model_type': 'graphsage', 'hidden_dims': '[512, 64]', 'dropout': 0.5529742022881333, 'batch_norm': False, 'lr': 0.0001123969751906711, 'weight_decay': 7.0155312303931995e-06, 'epochs': 87, 'loss': 'mse', 'optimizer': 'adam', 'graph_mode': 'cutoff', 'cutoff': 0.4536509892519101, 'grm_norm': 'cosine', 'self_loops': True, 'use_snp_selection': True, 'num_snps': 29557}. Best is trial 52 with value: 0.2676437601376995.
[I 2025-11-12 14:48:50,395] Trial 103 finished with value: 0.20800504209721354 and parameters: {'model_type': 'graphsage', 'hidden_dims': '[512, 64]', 'dropout': 0.5741405501253773, 'batch_norm': False, 'lr': 8.492786096768053e-05, 'weight_decay': 1.8891992416912549e-06, 'epochs': 104, 'loss': 'mse', 'optimizer': 'adam', 'graph_mode': 'cutoff', 'cutoff': 0.27224198497585017, 'grm_norm': 'gcn', 'self_loops': False, 'use_snp_selection': True, 'num_snps': 35612}. Best is trial 52 with value: 0.2676437601376995.
[I 2025-11-12 14:50:40,357] Trial 104 finished with value: 0.2314136514866049 and parameters: {'model_type': 'graphsage', 'hidden_dims': '[512, 64]', 'dropout': 0.5441947437889509, 'batch_norm': False, 'lr': 4.828872165557916e-05, 'weight_decay': 1.3804717736518248e-05, 'epochs': 114, 'loss': 'mse', 'optimizer': 'adam', 'graph_mode': 'cutoff', 'cutoff': 0.4129530892376751, 'grm_norm': 'gcn', 'self_loops': True, 'use_snp_selection': True, 'num_snps': 31798}. Best is trial 52 with value: 0.2676437601376995.
[I 2025-11-12 14:53:15,671] Trial 105 finished with value: 0.22381213545310522 and parameters: {'model_type': 'graphsage', 'hidden_dims': '[512, 64]', 'dropout': 0.5348857267038866, 'batch_norm': False, 'lr': 6.822979417544184e-05, 'weight_decay': 2.7567265258037536e-06, 'epochs': 281, 'loss': 'mse', 'optimizer': 'adam', 'graph_mode': 'cutoff', 'cutoff': 0.3353418418460305, 'grm_norm': 'cosine_then_gcn', 'self_loops': False, 'use_snp_selection': True, 'num_snps': 25896}. Best is trial 52 with value: 0.2676437601376995.
[I 2025-11-12 14:54:38,843] Trial 106 finished with value: 0.2628374542394027 and parameters: {'model_type': 'graphsage', 'hidden_dims': '[512, 64]', 'dropout': 0.48589985143237385, 'batch_norm': False, 'lr': 5.4020213519392625e-05, 'weight_decay': 3.637612206914677e-05, 'epochs': 59, 'loss': 'mse', 'optimizer': 'adam', 'graph_mode': 'cutoff', 'cutoff': 0.21087038273498876, 'grm_norm': 'gcn', 'self_loops': False, 'use_snp_selection': True, 'num_snps': 21709}. Best is trial 52 with value: 0.2676437601376995.
[I 2025-11-12 14:56:56,823] Trial 107 finished with value: 0.23028471372986803 and parameters: {'model_type': 'graphsage', 'hidden_dims': '[512, 64]', 'dropout': 0.450898771137071, 'batch_norm': False, 'lr': 3.087949764504604e-05, 'weight_decay': 3.580626902660104e-05, 'epochs': 57, 'loss': 'mse', 'optimizer': 'adam', 'graph_mode': 'cutoff', 'cutoff': 0.22321236008093123, 'grm_norm': 'none', 'self_loops': False, 'use_snp_selection': True, 'num_snps': 40845}. Best is trial 52 with value: 0.2676437601376995.
[I 2025-11-12 14:58:00,651] Trial 108 finished with value: 0.20460151465111664 and parameters: {'model_type': 'graphsage', 'hidden_dims': '[256, 128, 64]', 'dropout': 0.4798837326477734, 'batch_norm': True, 'lr': 5.3020283638005346e-05, 'weight_decay': 2.759937009119258e-05, 'epochs': 78, 'loss': 'mse', 'optimizer': 'adam', 'graph_mode': 'cutoff', 'cutoff': 0.29109414033025394, 'grm_norm': 'gcn', 'self_loops': True, 'use_snp_selection': False}. Best is trial 52 with value: 0.2676437601376995.
[I 2025-11-12 14:59:23,204] Trial 109 finished with value: 0.23131958507847053 and parameters: {'model_type': 'graphsage', 'hidden_dims': '[512, 64]', 'dropout': 0.5243808461669373, 'batch_norm': False, 'lr': 4.073675329033513e-05, 'weight_decay': 2.1890629718169518e-05, 'epochs': 52, 'loss': 'mse', 'optimizer': 'adam', 'graph_mode': 'cutoff', 'cutoff': 0.20154797789117893, 'grm_norm': 'cosine_then_gcn', 'self_loops': False, 'use_snp_selection': True, 'num_snps': 21849}. Best is trial 52 with value: 0.2676437601376995.
[I 2025-11-12 15:00:55,556] Trial 110 finished with value: 0.24261482086402048 and parameters: {'model_type': 'graphsage', 'hidden_dims': '[512, 64]', 'dropout': 0.4826455124551865, 'batch_norm': False, 'lr': 2.3638160833125182e-05, 'weight_decay': 5.956827677551301e-07, 'epochs': 62, 'loss': 'mse', 'optimizer': 'adam', 'graph_mode': 'cutoff', 'cutoff': 0.24746433611369512, 'grm_norm': 'gcn', 'self_loops': False, 'use_snp_selection': True, 'num_snps': 27118}. Best is trial 52 with value: 0.2676437601376995.
[I 2025-11-12 15:02:09,122] Trial 111 finished with value: 0.2157093727418153 and parameters: {'model_type': 'graphsage', 'hidden_dims': '[512, 64]', 'dropout': 0.564865411034605, 'batch_norm': False, 'lr': 0.0001045136516942402, 'weight_decay': 5.0833140886725517e-05, 'epochs': 88, 'loss': 'mse', 'optimizer': 'adam', 'graph_mode': 'cutoff', 'cutoff': 0.3829410437359219, 'grm_norm': 'gcn', 'self_loops': False, 'use_snp_selection': True, 'num_snps': 20202}. Best is trial 52 with value: 0.2676437601376995.
[I 2025-11-12 15:03:15,294] Trial 112 finished with value: 0.22432272747610954 and parameters: {'model_type': 'graphsage', 'hidden_dims': '[512, 64]', 'dropout': 0.554208771156274, 'batch_norm': False, 'lr': 6.47245178605137e-05, 'weight_decay': 4.1689460007990094e-05, 'epochs': 67, 'loss': 'mae', 'optimizer': 'adam', 'graph_mode': 'cutoff', 'cutoff': 0.42973054947510253, 'grm_norm': 'gcn', 'self_loops': False, 'use_snp_selection': True, 'num_snps': 18701}. Best is trial 52 with value: 0.2676437601376995.
[I 2025-11-12 15:04:55,947] Trial 113 finished with value: 0.11036689151270487 and parameters: {'model_type': 'graphsage', 'hidden_dims': '[512, 64]', 'dropout': 0.578906855447049, 'batch_norm': False, 'lr': 0.0001625019586601971, 'weight_decay': 4.414722539451532e-06, 'epochs': 80, 'loss': 'mse', 'optimizer': 'adam', 'graph_mode': 'cutoff', 'cutoff': 0.22068258078147424, 'grm_norm': 'gcn', 'self_loops': False, 'use_snp_selection': True, 'num_snps': 23330}. Best is trial 52 with value: 0.2676437601376995.
[I 2025-11-12 15:06:20,679] Trial 114 finished with value: 0.25571941218212657 and parameters: {'model_type': 'graphsage', 'hidden_dims': '[512, 64]', 'dropout': 0.5108534607914909, 'batch_norm': False, 'lr': 3.410690560162394e-05, 'weight_decay': 2.3625108678840444e-06, 'epochs': 73, 'loss': 'mae', 'optimizer': 'adam', 'graph_mode': 'cutoff', 'cutoff': 0.49072766963366793, 'grm_norm': 'gcn', 'self_loops': False, 'use_snp_selection': True, 'num_snps': 31129}. Best is trial 52 with value: 0.2676437601376995.
[I 2025-11-12 15:07:50,010] Trial 115 finished with value: 0.2582161899149992 and parameters: {'model_type': 'graphsage', 'hidden_dims': '[512, 64]', 'dropout': 0.3976168636944225, 'batch_norm': False, 'lr': 3.4256663641200464e-05, 'weight_decay': 1.2325086993050434e-06, 'epochs': 76, 'loss': 'mae', 'optimizer': 'adam', 'graph_mode': 'cutoff', 'cutoff': 0.49417569252099436, 'grm_norm': 'gcn', 'self_loops': False, 'use_snp_selection': True, 'num_snps': 33300}. Best is trial 52 with value: 0.2676437601376995.
[I 2025-11-12 15:09:18,801] Trial 116 finished with value: 0.24227221671343385 and parameters: {'model_type': 'graphsage', 'hidden_dims': '[512, 128]', 'dropout': 0.38932700572908197, 'batch_norm': False, 'lr': 2.7574287045661746e-05, 'weight_decay': 3.187958431847773e-05, 'epochs': 74, 'loss': 'mae', 'optimizer': 'adam', 'graph_mode': 'cutoff', 'cutoff': 0.492857445060309, 'grm_norm': 'gcn', 'self_loops': False, 'use_snp_selection': True, 'num_snps': 33083}. Best is trial 52 with value: 0.2676437601376995.
[I 2025-11-12 15:10:29,578] Trial 117 finished with value: 0.24894652362204175 and parameters: {'model_type': 'graphsage', 'hidden_dims': '[512, 256]', 'dropout': 0.46660532693456835, 'batch_norm': False, 'lr': 3.424825621195063e-05, 'weight_decay': 1.0927613351397638e-06, 'epochs': 58, 'loss': 'mae', 'optimizer': 'adam', 'graph_mode': 'cutoff', 'cutoff': 0.5289107270216596, 'grm_norm': 'gcn', 'self_loops': False, 'use_snp_selection': True, 'num_snps': 25688}. Best is trial 52 with value: 0.2676437601376995.
[I 2025-11-12 15:11:45,125] Trial 118 finished with value: 0.21618755354760993 and parameters: {'model_type': 'graphsage', 'hidden_dims': '[512, 64]', 'dropout': 0.3242330593779567, 'batch_norm': False, 'lr': 4.2423073342183865e-05, 'weight_decay': 7.704223210224871e-05, 'epochs': 42, 'loss': 'mae', 'optimizer': 'adam', 'graph_mode': 'cutoff', 'cutoff': 0.4551871695673961, 'grm_norm': 'gcn', 'self_loops': False, 'use_snp_selection': True, 'num_snps': 31237}. Best is trial 52 with value: 0.2676437601376995.
[I 2025-11-12 15:12:50,698] Trial 119 finished with value: 0.21603796407230869 and parameters: {'model_type': 'graphsage', 'hidden_dims': '[128, 64]', 'dropout': 0.3467425390894372, 'batch_norm': False, 'lr': 1.968961018454463e-05, 'weight_decay': 1.7319201340852025e-06, 'epochs': 71, 'loss': 'mae', 'optimizer': 'adam', 'graph_mode': 'cutoff', 'cutoff': 0.4822062360001332, 'grm_norm': 'gcn', 'self_loops': False, 'use_snp_selection': True, 'num_snps': 28168}. Best is trial 52 with value: 0.2676437601376995.
[I 2025-11-12 15:13:56,596] Trial 120 finished with value: 0.21051818590638152 and parameters: {'model_type': 'graphsage', 'hidden_dims': '[512, 64]', 'dropout': 0.4340220282178689, 'batch_norm': False, 'lr': 1.0316843419708315e-05, 'weight_decay': 2.443168223781799e-05, 'epochs': 64, 'loss': 'mae', 'optimizer': 'adam', 'graph_mode': 'cutoff', 'cutoff': 0.5571786041210784, 'grm_norm': 'cosine', 'self_loops': False, 'use_snp_selection': True, 'num_snps': 19890}. Best is trial 52 with value: 0.2676437601376995.
[I 2025-11-12 15:15:42,644] Trial 121 finished with value: 0.24294312918690558 and parameters: {'model_type': 'graphsage', 'hidden_dims': '[512, 64]', 'dropout': 0.5104748972524662, 'batch_norm': False, 'lr': 2.9795629734122255e-05, 'weight_decay': 2.357901698367503e-06, 'epochs': 95, 'loss': 'mae', 'optimizer': 'adam', 'graph_mode': 'cutoff', 'cutoff': 0.4017475329563029, 'grm_norm': 'cosine_then_gcn', 'self_loops': False, 'use_snp_selection': True, 'num_snps': 34566}. Best is trial 52 with value: 0.2676437601376995.
[I 2025-11-12 15:17:19,804] Trial 122 finished with value: 0.22793232937180777 and parameters: {'model_type': 'graphsage', 'hidden_dims': '[512, 64]', 'dropout': 0.4143204156002349, 'batch_norm': False, 'lr': 5.1310243523140796e-05, 'weight_decay': 2.1497910657876003e-06, 'epochs': 81, 'loss': 'mae', 'optimizer': 'adam', 'graph_mode': 'cutoff', 'cutoff': 0.42361509328435765, 'grm_norm': 'gcn', 'self_loops': True, 'use_snp_selection': True, 'num_snps': 33483}. Best is trial 52 with value: 0.2676437601376995.
[I 2025-11-12 15:18:58,722] Trial 123 finished with value: 0.23394209328514742 and parameters: {'model_type': 'graphsage', 'hidden_dims': '[512, 64]', 'dropout': 0.4948324961544203, 'batch_norm': False, 'lr': 3.399702090881216e-05, 'weight_decay': 1.3039566480705746e-06, 'epochs': 101, 'loss': 'mse', 'optimizer': 'adam', 'graph_mode': 'cutoff', 'cutoff': 0.5111008477577964, 'grm_norm': 'cosine_then_gcn', 'self_loops': False, 'use_snp_selection': True, 'num_snps': 35525}. Best is trial 52 with value: 0.2676437601376995.
[I 2025-11-12 15:20:47,249] Trial 124 finished with value: 0.24420367650249938 and parameters: {'model_type': 'graphsage', 'hidden_dims': '[512, 64]', 'dropout': 0.3632841745768403, 'batch_norm': False, 'lr': 1.6806705506174844e-05, 'weight_decay': 3.0620216710858697e-06, 'epochs': 50, 'loss': 'mae', 'optimizer': 'adam', 'graph_mode': 'cutoff', 'cutoff': 0.2587151591208081, 'grm_norm': 'gcn', 'self_loops': False, 'use_snp_selection': True, 'num_snps': 38232}. Best is trial 52 with value: 0.2676437601376995.
[I 2025-11-12 15:22:52,131] Trial 125 finished with value: 0.2522119583483783 and parameters: {'model_type': 'graphsage', 'hidden_dims': '[512, 64]', 'dropout': 0.38464199420244083, 'batch_norm': False, 'lr': 3.94974972017618e-05, 'weight_decay': 1.5085734951728237e-06, 'epochs': 90, 'loss': 'mse', 'optimizer': 'adam', 'graph_mode': 'cutoff', 'cutoff': 0.2351731039578342, 'grm_norm': 'cosine_then_gcn', 'self_loops': True, 'use_snp_selection': True, 'num_snps': 31629}. Best is trial 52 with value: 0.2676437601376995.
[I 2025-11-12 15:24:24,051] Trial 126 finished with value: 0.253569289701598 and parameters: {'model_type': 'graphsage', 'hidden_dims': '[512, 64]', 'dropout': 0.4087188582625049, 'batch_norm': False, 'lr': 3.762640105568369e-05, 'weight_decay': 5.69727217624802e-07, 'epochs': 87, 'loss': 'mae', 'optimizer': 'adam', 'graph_mode': 'cutoff', 'cutoff': 0.5817620178606169, 'grm_norm': 'gcn', 'self_loops': False, 'use_snp_selection': True, 'num_snps': 36315}. Best is trial 52 with value: 0.2676437601376995.
[I 2025-11-12 15:25:55,849] Trial 127 finished with value: 0.23558038109985996 and parameters: {'model_type': 'graphsage', 'hidden_dims': '[512, 64]', 'dropout': 0.4116388502654206, 'batch_norm': False, 'lr': 3.948349318776178e-05, 'weight_decay': 1.3053804179266488e-06, 'epochs': 87, 'loss': 'mae', 'optimizer': 'adam', 'graph_mode': 'cutoff', 'cutoff': 0.6118452597096878, 'grm_norm': 'gcn', 'self_loops': False, 'use_snp_selection': True, 'num_snps': 36608}. Best is trial 52 with value: 0.2676437601376995.
[I 2025-11-12 15:27:24,016] Trial 128 finished with value: 0.24672290435237842 and parameters: {'model_type': 'graphsage', 'hidden_dims': '[512, 64]', 'dropout': 0.3881423639494416, 'batch_norm': False, 'lr': 4.540230321360377e-05, 'weight_decay': 5.536711251652802e-07, 'epochs': 109, 'loss': 'mae', 'optimizer': 'adam', 'graph_mode': 'cutoff', 'cutoff': 0.5339287652748691, 'grm_norm': 'gcn', 'self_loops': False, 'use_snp_selection': False}. Best is trial 52 with value: 0.2676437601376995.
[I 2025-11-12 15:28:38,689] Trial 129 finished with value: 0.18071682474460216 and parameters: {'model_type': 'graphsage', 'hidden_dims': '[512, 64]', 'dropout': 0.3734231542875654, 'batch_norm': True, 'lr': 2.3995773853958686e-05, 'weight_decay': 1.6343721768537413e-06, 'epochs': 69, 'loss': 'mae', 'optimizer': 'adam', 'graph_mode': 'cutoff', 'cutoff': 0.4636633419984081, 'grm_norm': 'gcn', 'self_loops': False, 'use_snp_selection': True, 'num_snps': 24276}. Best is trial 52 with value: 0.2676437601376995.
[I 2025-11-12 15:30:01,658] Trial 130 finished with value: 0.2469161560220614 and parameters: {'model_type': 'graphsage', 'hidden_dims': '[512, 64]', 'dropout': 0.40186464393469207, 'batch_norm': False, 'lr': 7.84392050532187e-05, 'weight_decay': 1.010586025568057e-06, 'epochs': 82, 'loss': 'mae', 'optimizer': 'adam', 'graph_mode': 'cutoff', 'cutoff': 0.573962212094496, 'grm_norm': 'gcn', 'self_loops': False, 'use_snp_selection': True, 'num_snps': 31199}. Best is trial 52 with value: 0.2676437601376995.
[I 2025-11-12 15:31:50,007] Trial 131 finished with value: 0.2370400153644458 and parameters: {'model_type': 'graphsage', 'hidden_dims': '[256, 128, 64]', 'dropout': 0.3613552666685063, 'batch_norm': False, 'lr': 2.784117559467534e-05, 'weight_decay': 7.566143790822298e-07, 'epochs': 73, 'loss': 'mae', 'optimizer': 'adam', 'graph_mode': 'cutoff', 'cutoff': 0.21288417447540828, 'grm_norm': 'cosine_then_gcn', 'self_loops': True, 'use_snp_selection': True, 'num_snps': 29315}. Best is trial 52 with value: 0.2676437601376995.
[I 2025-11-12 15:33:18,272] Trial 132 finished with value: 0.24301344647857775 and parameters: {'model_type': 'graphsage', 'hidden_dims': '[512, 64]', 'dropout': 0.38092615222950665, 'batch_norm': False, 'lr': 3.561281629361849e-05, 'weight_decay': 8.351522028854669e-07, 'epochs': 91, 'loss': 'mae', 'optimizer': 'adam', 'graph_mode': 'cutoff', 'cutoff': 0.5934215911747486, 'grm_norm': 'cosine_then_gcn', 'self_loops': False, 'use_snp_selection': True, 'num_snps': 32325}. Best is trial 52 with value: 0.2676437601376995.
[I 2025-11-12 15:34:44,936] Trial 133 finished with value: 0.23011454418942967 and parameters: {'model_type': 'graphsage', 'hidden_dims': '[512, 64]', 'dropout': 0.33976651522492185, 'batch_norm': False, 'lr': 2.4549645518445014e-05, 'weight_decay': 5.417384799842168e-05, 'epochs': 75, 'loss': 'mse', 'optimizer': 'adam', 'graph_mode': 'cutoff', 'cutoff': 0.23583841701062622, 'grm_norm': 'gcn', 'self_loops': True, 'use_snp_selection': True, 'num_snps': 21714}. Best is trial 52 with value: 0.2676437601376995.
[I 2025-11-12 15:36:26,877] Trial 134 finished with value: 0.23928374510810313 and parameters: {'model_type': 'graphsage', 'hidden_dims': '[512, 64]', 'dropout': 0.524081550435051, 'batch_norm': False, 'lr': 3.14812171164052e-05, 'weight_decay': 3.233607286137507e-07, 'epochs': 101, 'loss': 'mae', 'optimizer': 'adam', 'graph_mode': 'cutoff', 'cutoff': 0.4873780339299218, 'grm_norm': 'none', 'self_loops': False, 'use_snp_selection': True, 'num_snps': 34626}. Best is trial 52 with value: 0.2676437601376995.
[I 2025-11-12 15:37:51,095] Trial 135 finished with value: 0.24771252464049986 and parameters: {'model_type': 'graphsage', 'hidden_dims': '[256, 128, 64]', 'dropout': 0.41962295861309956, 'batch_norm': False, 'lr': 6.055948973016862e-05, 'weight_decay': 3.8109915816080446e-05, 'epochs': 62, 'loss': 'mse', 'optimizer': 'adam', 'graph_mode': 'cutoff', 'cutoff': 0.35039689531148954, 'grm_norm': 'cosine_then_gcn', 'self_loops': True, 'use_snp_selection': True, 'num_snps': 36249}. Best is trial 52 with value: 0.2676437601376995.
[I 2025-11-12 15:40:07,969] Trial 136 finished with value: 0.26673376966274515 and parameters: {'model_type': 'graphsage', 'hidden_dims': '[512, 64]', 'dropout': 0.4021782421787277, 'batch_norm': False, 'lr': 4.3771481263643166e-05, 'weight_decay': 4.808614595698768e-07, 'epochs': 83, 'loss': 'mae', 'optimizer': 'adam', 'graph_mode': 'cutoff', 'cutoff': 0.23200675520567696, 'grm_norm': 'gcn', 'self_loops': False, 'use_snp_selection': True, 'num_snps': 32918}. Best is trial 52 with value: 0.2676437601376995.
[I 2025-11-12 15:41:51,600] Trial 137 finished with value: 0.24359036406484652 and parameters: {'model_type': 'graphsage', 'hidden_dims': '[512, 64]', 'dropout': 0.4290734493821467, 'batch_norm': False, 'lr': 3.661540570558868e-05, 'weight_decay': 1.7659790418541874e-07, 'epochs': 90, 'loss': 'mae', 'optimizer': 'adam', 'graph_mode': 'cutoff', 'cutoff': 0.3181477224130086, 'grm_norm': 'gcn', 'self_loops': False, 'use_snp_selection': True, 'num_snps': 30276}. Best is trial 52 with value: 0.2676437601376995.
[I 2025-11-12 15:44:23,796] Trial 138 finished with value: 0.23925468149536808 and parameters: {'model_type': 'graphsage', 'hidden_dims': '[512, 64]', 'dropout': 0.40568544302080217, 'batch_norm': False, 'lr': 4.4796827815125316e-05, 'weight_decay': 4.4033130405042466e-07, 'epochs': 132, 'loss': 'mae', 'optimizer': 'adam', 'graph_mode': 'knn', 'source': 'grm', 'knn_k': 6, 'weighted_edges': True, 'symmetrize_mode': 'union', 'use_snp_selection': True, 'num_snps': 33485}. Best is trial 52 with value: 0.2676437601376995.
[I 2025-11-12 15:46:58,530] Trial 139 finished with value: 0.23185177785796313 and parameters: {'model_type': 'graphsage', 'hidden_dims': '[512, 64]', 'dropout': 0.3907259979985789, 'batch_norm': False, 'lr': 6.987969377344253e-05, 'weight_decay': 6.55807437131181e-07, 'epochs': 82, 'loss': 'mae', 'optimizer': 'adam', 'graph_mode': 'cutoff', 'cutoff': 0.23760130243284866, 'grm_norm': 'gcn', 'self_loops': False, 'use_snp_selection': True, 'num_snps': 38975}. Best is trial 52 with value: 0.2676437601376995.
[I 2025-11-12 15:48:24,974] Trial 140 finished with value: 0.23770484935248132 and parameters: {'model_type': 'graphsage', 'hidden_dims': '[256, 128]', 'dropout': 0.37648869311388533, 'batch_norm': False, 'lr': 5.3463414535076044e-05, 'weight_decay': 3.383688230917699e-07, 'epochs': 106, 'loss': 'mae', 'optimizer': 'adam', 'graph_mode': 'cutoff', 'cutoff': 0.6399569280466957, 'grm_norm': 'gcn', 'self_loops': False, 'use_snp_selection': True, 'num_snps': 42772}. Best is trial 52 with value: 0.2676437601376995.
[I 2025-11-12 15:49:59,588] Trial 141 finished with value: 0.23660454389969945 and parameters: {'model_type': 'graphsage', 'hidden_dims': '[512, 64]', 'dropout': 0.5458401590188491, 'batch_norm': False, 'lr': 2.07970370880029e-05, 'weight_decay': 5.153147418373512e-07, 'epochs': 67, 'loss': 'mae', 'optimizer': 'adam', 'graph_mode': 'cutoff', 'cutoff': 0.26834194147443075, 'grm_norm': 'gcn', 'self_loops': False, 'use_snp_selection': True, 'num_snps': 28326}. Best is trial 52 with value: 0.2676437601376995.
[I 2025-11-12 15:52:36,406] Trial 142 finished with value: 0.24939401765902808 and parameters: {'model_type': 'graphsage', 'hidden_dims': '[512, 64]', 'dropout': 0.3568988468483346, 'batch_norm': False, 'lr': 4.0689933364422165e-05, 'weight_decay': 2.8318367604025073e-05, 'epochs': 77, 'loss': 'mse', 'optimizer': 'adam', 'graph_mode': 'cutoff', 'cutoff': 0.22776853133975883, 'grm_norm': 'cosine_then_gcn', 'self_loops': True, 'use_snp_selection': True, 'num_snps': 40640}. Best is trial 52 with value: 0.2676437601376995.
[I 2025-11-12 15:54:09,403] Trial 143 finished with value: 0.2523205430896812 and parameters: {'model_type': 'graphsage', 'hidden_dims': '[512, 64]', 'dropout': 0.4413387550945366, 'batch_norm': False, 'lr': 3.0538834848605575e-05, 'weight_decay': 9.948891406878424e-05, 'epochs': 55, 'loss': 'mae', 'optimizer': 'adam', 'graph_mode': 'cutoff', 'cutoff': 0.2876702436544186, 'grm_norm': 'gcn', 'self_loops': False, 'use_snp_selection': True, 'num_snps': 31365}. Best is trial 52 with value: 0.2676437601376995.
