[I 2025-11-03 12:28:14,046] Trial 148 finished with value: 0.06061236270012847 and parameters: {'model_type': 'gcn', 'hidden_dims': '[512, 128]', 'dropout': 0.5068968515858003, 'batch_norm': True, 'lr': 0.0005479365742016504, 'weight_decay': 4.3166571855262e-06, 'epochs': 328, 'loss': 'mse', 'optimizer': 'adam', 'graph_mode': 'off', 'use_snp_selection': False}. Best is trial 16 with value: 0.08131540450815136.
[I 2025-11-03 12:28:16,602] Trial 149 finished with value: 0.047901781057195766 and parameters: {'model_type': 'gcn', 'hidden_dims': '[512, 128]', 'dropout': 0.4542397199051323, 'batch_norm': True, 'lr': 0.00047863444678371405, 'weight_decay': 3.018803616478392e-06, 'epochs': 343, 'loss': 'mse', 'optimizer': 'adam', 'graph_mode': 'off', 'use_snp_selection': False}. Best is trial 16 with value: 0.08131540450815136.
[I 2025-11-03 12:28:30,988] Trial 0 finished with value: -0.010495262956086196 and parameters: {'model_type': 'gcn', 'hidden_dims': '[128, 64]', 'dropout': 0.199031432379812, 'batch_norm': True, 'lr': 1.8408544111075837e-06, 'weight_decay': 5.5136510071208614e-05, 'epochs': 336, 'loss': 'mae', 'optimizer': 'adam', 'graph_mode': 'off', 'use_snp_selection': True, 'num_snps': 43862}. Best is trial 0 with value: -0.010495262956086196.
[I 2025-11-03 12:28:32,335] Trial 1 finished with value: 0.021774863607928855 and parameters: {'model_type': 'gcn', 'hidden_dims': '[256, 128]', 'dropout': 0.4370668075331726, 'batch_norm': True, 'lr': 7.133471581159139e-05, 'weight_decay': 1.128633586803549e-05, 'epochs': 242, 'loss': 'mae', 'optimizer': 'adam', 'graph_mode': 'off', 'use_snp_selection': False}. Best is trial 1 with value: 0.021774863607928855.
[I 2025-11-03 12:28:33,375] Trial 2 finished with value: -0.029081229698354322 and parameters: {'model_type': 'gcn', 'hidden_dims': '[256, 128, 64]', 'dropout': 0.41314357415569625, 'batch_norm': False, 'lr': 3.952233718592101e-06, 'weight_decay': 0.00026754769258252603, 'epochs': 149, 'loss': 'mse', 'optimizer': 'adam', 'graph_mode': 'off', 'use_snp_selection': True, 'num_snps': 11571}. Best is trial 1 with value: 0.021774863607928855.
[I 2025-11-03 12:28:35,532] Trial 3 finished with value: 0.04497924562169517 and parameters: {'model_type': 'gcn', 'hidden_dims': '[512, 64]', 'dropout': 0.5938127374509361, 'batch_norm': False, 'lr': 5.67704586114731e-06, 'weight_decay': 2.4518087630137052e-05, 'epochs': 320, 'loss': 'mae', 'optimizer': 'adam', 'graph_mode': 'off', 'use_snp_selection': False}. Best is trial 3 with value: 0.04497924562169517.
[I 2025-11-03 12:28:37,592] Trial 4 finished with value: 0.005377392845195981 and parameters: {'model_type': 'gcn', 'hidden_dims': '[512, 128]', 'dropout': 0.25746343592134413, 'batch_norm': True, 'lr': 1.3467657668402788e-06, 'weight_decay': 0.00033087251918647806, 'epochs': 277, 'loss': 'mse', 'optimizer': 'adam', 'graph_mode': 'off', 'use_snp_selection': True, 'num_snps': 36675}. Best is trial 3 with value: 0.04497924562169517.
[I 2025-11-03 12:28:39,128] Trial 5 finished with value: 0.01743414994204497 and parameters: {'model_type': 'gcn', 'hidden_dims': '[512, 64]', 'dropout': 0.38275350994408375, 'batch_norm': True, 'lr': 1.5586664309232824e-06, 'weight_decay': 0.0008227664668621182, 'epochs': 145, 'loss': 'mae', 'optimizer': 'adam', 'graph_mode': 'off', 'use_snp_selection': True, 'num_snps': 32148}. Best is trial 3 with value: 0.04497924562169517.
[I 2025-11-03 12:28:40,334] Trial 6 finished with value: 0.013550002699976681 and parameters: {'model_type': 'gcn', 'hidden_dims': '[256, 128]', 'dropout': 0.3930109900265879, 'batch_norm': False, 'lr': 4.892964372128395e-05, 'weight_decay': 1.5809549317992182e-06, 'epochs': 199, 'loss': 'mse', 'optimizer': 'adam', 'graph_mode': 'off', 'use_snp_selection': False}. Best is trial 3 with value: 0.04497924562169517.
[I 2025-11-03 12:28:41,504] Trial 7 finished with value: 0.018414531993672364 and parameters: {'model_type': 'gcn', 'hidden_dims': '[512, 256]', 'dropout': 0.15343979219678458, 'batch_norm': True, 'lr': 6.234003099047341e-05, 'weight_decay': 3.894760610535477e-07, 'epochs': 97, 'loss': 'mse', 'optimizer': 'adam', 'graph_mode': 'off', 'use_snp_selection': False}. Best is trial 3 with value: 0.04497924562169517.
[I 2025-11-03 12:28:43,680] Trial 8 finished with value: 0.03680707818781747 and parameters: {'model_type': 'gcn', 'hidden_dims': '[512, 128]', 'dropout': 0.10743001231661406, 'batch_norm': True, 'lr': 0.00023728538449271062, 'weight_decay': 1.7629071578048637e-05, 'epochs': 312, 'loss': 'mae', 'optimizer': 'adam', 'graph_mode': 'off', 'use_snp_selection': False}. Best is trial 3 with value: 0.04497924562169517.
[I 2025-11-03 12:28:45,258] Trial 9 finished with value: 0.030643598887754038 and parameters: {'model_type': 'gcn', 'hidden_dims': '[512, 64]', 'dropout': 0.14505336736221927, 'batch_norm': True, 'lr': 5.8619638388111826e-05, 'weight_decay': 6.200156172669308e-07, 'epochs': 175, 'loss': 'mse', 'optimizer': 'adam', 'graph_mode': 'off', 'use_snp_selection': False}. Best is trial 3 with value: 0.04497924562169517.
[I 2025-11-03 12:28:46,321] Trial 10 finished with value: 0.007372133370172183 and parameters: {'model_type': 'gcn', 'hidden_dims': '[512, 64]', 'dropout': 0.5885461262002587, 'batch_norm': False, 'lr': 8.769366258768696e-06, 'weight_decay': 2.78273193871783e-06, 'epochs': 55, 'loss': 'mae', 'optimizer': 'adam', 'graph_mode': 'off', 'use_snp_selection': False}. Best is trial 3 with value: 0.04497924562169517.
[I 2025-11-03 12:28:48,651] Trial 11 finished with value: 0.0053943370065466945 and parameters: {'model_type': 'gcn', 'hidden_dims': '[512, 128]', 'dropout': 0.583942291816117, 'batch_norm': False, 'lr': 0.0007607980626791682, 'weight_decay': 2.11387030344014e-05, 'epochs': 346, 'loss': 'mae', 'optimizer': 'adam', 'graph_mode': 'off', 'use_snp_selection': False}. Best is trial 3 with value: 0.04497924562169517.
[I 2025-11-03 12:28:50,683] Trial 12 finished with value: 0.008183640042948463 and parameters: {'model_type': 'gcn', 'hidden_dims': '[512, 128]', 'dropout': 0.2637316882220091, 'batch_norm': False, 'lr': 0.00038488688701881807, 'weight_decay': 6.235872918830569e-05, 'epochs': 294, 'loss': 'mae', 'optimizer': 'adam', 'graph_mode': 'off', 'use_snp_selection': False}. Best is trial 3 with value: 0.04497924562169517.
[I 2025-11-03 12:28:51,868] Trial 13 finished with value: -0.010917806246138936 and parameters: {'model_type': 'gcn', 'hidden_dims': '[128, 64]', 'dropout': 0.5255276925359323, 'batch_norm': False, 'lr': 1.3373175420781734e-05, 'weight_decay': 2.875929917712265e-06, 'epochs': 285, 'loss': 'mae', 'optimizer': 'adam', 'graph_mode': 'off', 'use_snp_selection': False}. Best is trial 3 with value: 0.04497924562169517.
[I 2025-11-03 12:28:53,415] Trial 14 finished with value: 0.05564324961726367 and parameters: {'model_type': 'gcn', 'hidden_dims': '[256, 128, 64]', 'dropout': 0.3012984444538551, 'batch_norm': True, 'lr': 0.0002108574938852793, 'weight_decay': 1.1414924884997386e-07, 'epochs': 237, 'loss': 'mae', 'optimizer': 'adam', 'graph_mode': 'off', 'use_snp_selection': False}. Best is trial 14 with value: 0.05564324961726367.
[I 2025-11-03 12:28:54,860] Trial 15 finished with value: 0.029369901254544157 and parameters: {'model_type': 'gcn', 'hidden_dims': '[256, 128, 64]', 'dropout': 0.30748970331358694, 'batch_norm': False, 'lr': 1.8411764708572348e-05, 'weight_decay': 1.2323424272263762e-07, 'epochs': 231, 'loss': 'mae', 'optimizer': 'adam', 'graph_mode': 'off', 'use_snp_selection': False}. Best is trial 14 with value: 0.05564324961726367.
[I 2025-11-03 12:28:56,452] Trial 16 finished with value: 0.07665877140891061 and parameters: {'model_type': 'gcn', 'hidden_dims': '[256, 128, 64]', 'dropout': 0.4889635464122647, 'batch_norm': True, 'lr': 0.00017549215405955411, 'weight_decay': 1.3072048124779758e-07, 'epochs': 240, 'loss': 'mae', 'optimizer': 'adam', 'graph_mode': 'off', 'use_snp_selection': False}. Best is trial 16 with value: 0.07665877140891061.
[I 2025-11-03 12:28:58,005] Trial 17 finished with value: 0.03275407955072459 and parameters: {'model_type': 'gcn', 'hidden_dims': '[256, 128, 64]', 'dropout': 0.4599163501058063, 'batch_norm': True, 'lr': 0.0001603276916402403, 'weight_decay': 1.4018844402885474e-07, 'epochs': 239, 'loss': 'mae', 'optimizer': 'adam', 'graph_mode': 'off', 'use_snp_selection': False}. Best is trial 16 with value: 0.07665877140891061.
[I 2025-11-03 12:29:00,355] Trial 18 finished with value: 0.03850996129736178 and parameters: {'model_type': 'gcn', 'hidden_dims': '[256, 128, 64]', 'dropout': 0.4947310636118752, 'batch_norm': True, 'lr': 0.0009890225422611427, 'weight_decay': 3.8864361433995704e-07, 'epochs': 209, 'loss': 'mae', 'optimizer': 'adam', 'graph_mode': 'off', 'use_snp_selection': True, 'num_snps': 58241}. Best is trial 16 with value: 0.07665877140891061.
[I 2025-11-03 12:29:01,979] Trial 19 finished with value: 0.03768453484845058 and parameters: {'model_type': 'gcn', 'hidden_dims': '[256, 128, 64]', 'dropout': 0.35684309903644984, 'batch_norm': True, 'lr': 0.0001433479397973849, 'weight_decay': 1.1354159408743119e-07, 'epochs': 253, 'loss': 'mae', 'optimizer': 'adam', 'graph_mode': 'off', 'use_snp_selection': False}. Best is trial 16 with value: 0.07665877140891061.
[I 2025-11-03 12:29:03,561] Trial 20 finished with value: 0.04205705432301824 and parameters: {'model_type': 'gcn', 'hidden_dims': '[512, 256]', 'dropout': 0.3194184669916603, 'batch_norm': True, 'lr': 0.0003535780328652228, 'weight_decay': 1.2423084674584588e-06, 'epochs': 166, 'loss': 'mae', 'optimizer': 'adam', 'graph_mode': 'off', 'use_snp_selection': False}. Best is trial 16 with value: 0.07665877140891061.
[I 2025-11-03 12:29:05,726] Trial 21 finished with value: 0.0031681857096477837 and parameters: {'model_type': 'gcn', 'hidden_dims': '[512, 64]', 'dropout': 0.534723437383262, 'batch_norm': False, 'lr': 5.006204505272851e-06, 'weight_decay': 4.933658186586706e-05, 'epochs': 314, 'loss': 'mae', 'optimizer': 'adam', 'graph_mode': 'off', 'use_snp_selection': False}. Best is trial 16 with value: 0.07665877140891061.
[I 2025-11-03 12:29:07,413] Trial 22 finished with value: -0.008360550608831487 and parameters: {'model_type': 'gcn', 'hidden_dims': '[256, 128, 64]', 'dropout': 0.544730880590581, 'batch_norm': True, 'lr': 2.3177299277638016e-05, 'weight_decay': 4.905653876075577e-06, 'epochs': 271, 'loss': 'mae', 'optimizer': 'adam', 'graph_mode': 'off', 'use_snp_selection': False}. Best is trial 16 with value: 0.07665877140891061.
[I 2025-11-03 12:29:08,898] Trial 23 finished with value: -0.0007320706560548415 and parameters: {'model_type': 'gcn', 'hidden_dims': '[256, 128, 64]', 'dropout': 0.4735334817927886, 'batch_norm': False, 'lr': 0.00010891833886571125, 'weight_decay': 3.2666120737763034e-07, 'epochs': 220, 'loss': 'mae', 'optimizer': 'adam', 'graph_mode': 'off', 'use_snp_selection': False}. Best is trial 16 with value: 0.07665877140891061.
[I 2025-11-03 12:29:10,867] Trial 24 finished with value: 0.007925871887007822 and parameters: {'model_type': 'gcn', 'hidden_dims': '[512, 64]', 'dropout': 0.5909549469724563, 'batch_norm': True, 'lr': 3.2280087332761746e-05, 'weight_decay': 8.845748547436762e-07, 'epochs': 259, 'loss': 'mae', 'optimizer': 'adam', 'graph_mode': 'off', 'use_snp_selection': False}. Best is trial 16 with value: 0.07665877140891061.
[I 2025-11-03 12:29:12,711] Trial 25 finished with value: 0.04190890951773275 and parameters: {'model_type': 'gcn', 'hidden_dims': '[256, 128, 64]', 'dropout': 0.2635964109256944, 'batch_norm': True, 'lr': 0.0004959165405064015, 'weight_decay': 1.9973176043702666e-07, 'epochs': 309, 'loss': 'mae', 'optimizer': 'adam', 'graph_mode': 'off', 'use_snp_selection': False}. Best is trial 16 with value: 0.07665877140891061.
[I 2025-11-03 12:29:13,543] Trial 26 finished with value: -0.00961683671106142 and parameters: {'model_type': 'gcn', 'hidden_dims': '[256, 128]', 'dropout': 0.49699549398759146, 'batch_norm': False, 'lr': 0.00023060574814974904, 'weight_decay': 7.229794675382694e-06, 'epochs': 181, 'loss': 'mse', 'optimizer': 'adam', 'graph_mode': 'off', 'use_snp_selection': True, 'num_snps': 3842}. Best is trial 16 with value: 0.07665877140891061.
[I 2025-11-03 12:29:14,329] Trial 27 finished with value: 0.002405505918663351 and parameters: {'model_type': 'gcn', 'hidden_dims': '[128, 64]', 'dropout': 0.5507301190542879, 'batch_norm': True, 'lr': 3.2105752529042985e-06, 'weight_decay': 2.6086871179536294e-05, 'epochs': 99, 'loss': 'mae', 'optimizer': 'adam', 'graph_mode': 'off', 'use_snp_selection': False}. Best is trial 16 with value: 0.07665877140891061.
[I 2025-11-03 12:29:16,562] Trial 28 finished with value: 0.018089259302869618 and parameters: {'model_type': 'gcn', 'hidden_dims': '[512, 256]', 'dropout': 0.3254314863734791, 'batch_norm': False, 'lr': 7.358926488596558e-06, 'weight_decay': 0.00011837572117061311, 'epochs': 329, 'loss': 'mae', 'optimizer': 'adam', 'graph_mode': 'off', 'use_snp_selection': False}. Best is trial 16 with value: 0.07665877140891061.
[I 2025-11-03 12:29:17,812] Trial 29 finished with value: 0.05069602648681003 and parameters: {'model_type': 'gcn', 'hidden_dims': '[128, 64]', 'dropout': 0.2162876159418507, 'batch_norm': True, 'lr': 2.5087654566083747e-06, 'weight_decay': 2.589070259401635e-06, 'epochs': 215, 'loss': 'mae', 'optimizer': 'adam', 'graph_mode': 'off', 'use_snp_selection': True, 'num_snps': 19468}. Best is trial 16 with value: 0.07665877140891061.
[I 2025-11-03 12:29:19,083] Trial 30 finished with value: 0.017903404720762794 and parameters: {'model_type': 'gcn', 'hidden_dims': '[128, 64]', 'dropout': 0.21211109649922116, 'batch_norm': True, 'lr': 2.1474983497741754e-06, 'weight_decay': 2.3579311042200846e-07, 'epochs': 216, 'loss': 'mae', 'optimizer': 'adam', 'graph_mode': 'off', 'use_snp_selection': True, 'num_snps': 18365}. Best is trial 16 with value: 0.07665877140891061.
[I 2025-11-03 12:29:20,318] Trial 31 finished with value: 0.02962487927571584 and parameters: {'model_type': 'gcn', 'hidden_dims': '[128, 64]', 'dropout': 0.23136926648654316, 'batch_norm': True, 'lr': 1.004839773374918e-06, 'weight_decay': 6.832757312982374e-07, 'epochs': 193, 'loss': 'mae', 'optimizer': 'adam', 'graph_mode': 'off', 'use_snp_selection': True, 'num_snps': 20689}. Best is trial 16 with value: 0.07665877140891061.
[I 2025-11-03 12:29:21,715] Trial 32 finished with value: -0.01291563830843635 and parameters: {'model_type': 'gcn', 'hidden_dims': '[128, 64]', 'dropout': 0.1853736889601128, 'batch_norm': True, 'lr': 0.00010358785501531816, 'weight_decay': 2.8554482564189327e-06, 'epochs': 261, 'loss': 'mae', 'optimizer': 'adam', 'graph_mode': 'off', 'use_snp_selection': True, 'num_snps': 20754}. Best is trial 16 with value: 0.07665877140891061.
[I 2025-11-03 12:29:23,984] Trial 33 finished with value: 0.010695563255437694 and parameters: {'model_type': 'gcn', 'hidden_dims': '[256, 128, 64]', 'dropout': 0.42853200988428675, 'batch_norm': True, 'lr': 2.5392756168590532e-06, 'weight_decay': 1.1078289620594578e-05, 'epochs': 234, 'loss': 'mae', 'optimizer': 'adam', 'graph_mode': 'off', 'use_snp_selection': True, 'num_snps': 50127}. Best is trial 16 with value: 0.07665877140891061.
[I 2025-11-03 12:29:24,805] Trial 34 finished with value: -0.018588434141044434 and parameters: {'model_type': 'gcn', 'hidden_dims': '[512, 64]', 'dropout': 0.3603644621111452, 'batch_norm': True, 'lr': 6.2736684263505185e-06, 'weight_decay': 5.846863806023918e-05, 'epochs': 144, 'loss': 'mae', 'optimizer': 'adam', 'graph_mode': 'off', 'use_snp_selection': True, 'num_snps': 4311}. Best is trial 16 with value: 0.07665877140891061.
[I 2025-11-03 12:29:26,377] Trial 35 finished with value: -0.010550092334673212 and parameters: {'model_type': 'gcn', 'hidden_dims': '[128, 64]', 'dropout': 0.3086124373447343, 'batch_norm': True, 'lr': 1.0215765969601517e-05, 'weight_decay': 6.088977177814725e-06, 'epochs': 285, 'loss': 'mse', 'optimizer': 'adam', 'graph_mode': 'off', 'use_snp_selection': True, 'num_snps': 26222}. Best is trial 16 with value: 0.07665877140891061.
[I 2025-11-03 12:29:27,834] Trial 36 finished with value: 0.03196954544275994 and parameters: {'model_type': 'gcn', 'hidden_dims': '[256, 128]', 'dropout': 0.23971416253199992, 'batch_norm': True, 'lr': 4.074713036444565e-06, 'weight_decay': 0.00016918453813253784, 'epochs': 117, 'loss': 'mae', 'optimizer': 'adam', 'graph_mode': 'off', 'use_snp_selection': True, 'num_snps': 38703}. Best is trial 16 with value: 0.07665877140891061.
[I 2025-11-03 12:29:29,279] Trial 37 finished with value: 0.04588182375597691 and parameters: {'model_type': 'gcn', 'hidden_dims': '[256, 128, 64]', 'dropout': 0.28772211852951846, 'batch_norm': True, 'lr': 3.293194410706246e-05, 'weight_decay': 0.0005919463730941769, 'epochs': 198, 'loss': 'mse', 'optimizer': 'adam', 'graph_mode': 'off', 'use_snp_selection': False}. Best is trial 16 with value: 0.07665877140891061.
[I 2025-11-03 12:29:30,726] Trial 38 finished with value: 0.012852613034098107 and parameters: {'model_type': 'gcn', 'hidden_dims': '[256, 128, 64]', 'dropout': 0.28138077205162415, 'batch_norm': True, 'lr': 3.304505933929922e-05, 'weight_decay': 0.0009491339080464578, 'epochs': 198, 'loss': 'mse', 'optimizer': 'adam', 'graph_mode': 'off', 'use_snp_selection': False}. Best is trial 16 with value: 0.07665877140891061.
[I 2025-11-03 12:29:31,909] Trial 39 finished with value: 0.048733456422740566 and parameters: {'model_type': 'gcn', 'hidden_dims': '[256, 128, 64]', 'dropout': 0.1912357612511437, 'batch_norm': True, 'lr': 8.478792835571348e-05, 'weight_decay': 0.0003589880414341307, 'epochs': 154, 'loss': 'mse', 'optimizer': 'adam', 'graph_mode': 'off', 'use_snp_selection': True, 'num_snps': 13361}. Best is trial 16 with value: 0.07665877140891061.
[I 2025-11-03 12:29:32,992] Trial 40 finished with value: -0.00799111836524197 and parameters: {'model_type': 'gcn', 'hidden_dims': '[256, 128, 64]', 'dropout': 0.20686671362405698, 'batch_norm': True, 'lr': 8.347205495688151e-05, 'weight_decay': 2.210265095476223e-07, 'epochs': 129, 'loss': 'mse', 'optimizer': 'adam', 'graph_mode': 'off', 'use_snp_selection': True, 'num_snps': 13453}. Best is trial 16 with value: 0.07665877140891061.
[I 2025-11-03 12:29:34,135] Trial 41 finished with value: 0.0027477017919954683 and parameters: {'model_type': 'gcn', 'hidden_dims': '[256, 128, 64]', 'dropout': 0.18193840269780512, 'batch_norm': True, 'lr': 4.529915798479108e-05, 'weight_decay': 0.0003534154876647566, 'epochs': 168, 'loss': 'mse', 'optimizer': 'adam', 'graph_mode': 'off', 'use_snp_selection': True, 'num_snps': 10568}. Best is trial 16 with value: 0.07665877140891061.
[I 2025-11-03 12:29:35,589] Trial 42 finished with value: 0.03518285036639909 and parameters: {'model_type': 'gcn', 'hidden_dims': '[256, 128, 64]', 'dropout': 0.2856366609088971, 'batch_norm': True, 'lr': 0.00020349023813531127, 'weight_decay': 0.0005108620921184824, 'epochs': 154, 'loss': 'mse', 'optimizer': 'adam', 'graph_mode': 'off', 'use_snp_selection': True, 'num_snps': 27001}. Best is trial 16 with value: 0.07665877140891061.
[I 2025-11-03 12:29:37,303] Trial 43 finished with value: 0.03189399286948134 and parameters: {'model_type': 'gcn', 'hidden_dims': '[256, 128, 64]', 'dropout': 0.14945814375582572, 'batch_norm': True, 'lr': 4.641709879095894e-05, 'weight_decay': 0.00017468137444774564, 'epochs': 219, 'loss': 'mse', 'optimizer': 'adam', 'graph_mode': 'off', 'use_snp_selection': True, 'num_snps': 26546}. Best is trial 16 with value: 0.07665877140891061.
[I 2025-11-03 12:29:38,719] Trial 44 finished with value: 0.04105414320552539 and parameters: {'model_type': 'gcn', 'hidden_dims': '[256, 128, 64]', 'dropout': 0.23297012110469711, 'batch_norm': True, 'lr': 9.064878530438037e-05, 'weight_decay': 0.0005561688539099809, 'epochs': 188, 'loss': 'mse', 'optimizer': 'adam', 'graph_mode': 'off', 'use_snp_selection': False}. Best is trial 16 with value: 0.07665877140891061.
[I 2025-11-03 12:29:40,232] Trial 45 finished with value: 0.021807191710813627 and parameters: {'model_type': 'gcn', 'hidden_dims': '[256, 128, 64]', 'dropout': 0.39724990237624325, 'batch_norm': True, 'lr': 0.00014103381320033724, 'weight_decay': 1.519016844542769e-06, 'epochs': 247, 'loss': 'mse', 'optimizer': 'adam', 'graph_mode': 'off', 'use_snp_selection': True, 'num_snps': 15928}. Best is trial 16 with value: 0.07665877140891061.
[I 2025-11-03 12:29:41,976] Trial 46 finished with value: 0.042677395133859035 and parameters: {'model_type': 'gcn', 'hidden_dims': '[512, 256]', 'dropout': 0.125070326563489, 'batch_norm': True, 'lr': 7.061652686853617e-05, 'weight_decay': 0.00026475846960692396, 'epochs': 212, 'loss': 'mse', 'optimizer': 'adam', 'graph_mode': 'off', 'use_snp_selection': False}. Best is trial 16 with value: 0.07665877140891061.
[I 2025-11-03 12:29:43,719] Trial 47 finished with value: 0.06026242922341375 and parameters: {'model_type': 'gcn', 'hidden_dims': '[512, 128]', 'dropout': 0.17368210241241383, 'batch_norm': True, 'lr': 0.0003143773233734278, 'weight_decay': 0.0006020185421402273, 'epochs': 203, 'loss': 'mse', 'optimizer': 'adam', 'graph_mode': 'off', 'use_snp_selection': False}. Best is trial 16 with value: 0.07665877140891061.
[I 2025-11-03 12:29:44,405] Trial 48 finished with value: 0.036001821488821084 and parameters: {'model_type': 'gcn', 'hidden_dims': '[512, 128]', 'dropout': 0.1686283940639409, 'batch_norm': True, 'lr': 0.00030907612141157066, 'weight_decay': 0.00010225643201138725, 'epochs': 41, 'loss': 'mse', 'optimizer': 'adam', 'graph_mode': 'off', 'use_snp_selection': True, 'num_snps': 8977}. Best is trial 16 with value: 0.07665877140891061.
