[I 2025-11-03 11:59:19,406] Trial 108 finished with value: 0.05955012251552473 and parameters: {'model_type': 'graphsage', 'hidden_dims': '[256, 128]', 'dropout': 0.3332091817853049, 'batch_norm': False, 'lr': 6.075560833392366e-06, 'weight_decay': 0.0006020040283664007, 'epochs': 208, 'loss': 'mae', 'optimizer': 'adam', 'graph_mode': 'cutoff', 'cutoff': 0.899034918746668, 'grm_norm': 'cosine_then_gcn', 'self_loops': False, 'use_snp_selection': True, 'num_snps': 48878}. Best is trial 95 with value: 0.08890736477236041.
[I 2025-11-03 11:59:23,263] Trial 109 finished with value: 0.008867951468469935 and parameters: {'model_type': 'graphsage', 'hidden_dims': '[256, 128]', 'dropout': 0.35120687745947327, 'batch_norm': False, 'lr': 4.012154835120219e-06, 'weight_decay': 0.0007435796094943054, 'epochs': 225, 'loss': 'mae', 'optimizer': 'adam', 'graph_mode': 'cutoff', 'cutoff': 0.8756454740235559, 'grm_norm': 'cosine_then_gcn', 'self_loops': False, 'use_snp_selection': True, 'num_snps': 46462}. Best is trial 95 with value: 0.08890736477236041.
[I 2025-11-03 11:59:26,907] Trial 110 finished with value: 0.059712787381145126 and parameters: {'model_type': 'graphsage', 'hidden_dims': '[256, 128]', 'dropout': 0.3646823907095527, 'batch_norm': False, 'lr': 9.731281527003745e-06, 'weight_decay': 0.00046315541472369677, 'epochs': 217, 'loss': 'mae', 'optimizer': 'adam', 'graph_mode': 'cutoff', 'cutoff': 0.8392092515874511, 'grm_norm': 'cosine_then_gcn', 'self_loops': True, 'use_snp_selection': True, 'num_snps': 42998}. Best is trial 95 with value: 0.08890736477236041.
[I 2025-11-03 11:59:31,485] Trial 111 finished with value: 0.04492269826179637 and parameters: {'model_type': 'graphsage', 'hidden_dims': '[256, 128]', 'dropout': 0.313565026247271, 'batch_norm': False, 'lr': 7.847669290922146e-06, 'weight_decay': 0.0005887155863770064, 'epochs': 229, 'loss': 'mae', 'optimizer': 'adam', 'graph_mode': 'cutoff', 'cutoff': 0.8623972173453686, 'grm_norm': 'cosine_then_gcn', 'self_loops': False, 'use_snp_selection': True, 'num_snps': 59422}. Best is trial 95 with value: 0.08890736477236041.
[I 2025-11-03 11:59:35,770] Trial 112 finished with value: 0.028231138175639832 and parameters: {'model_type': 'graphsage', 'hidden_dims': '[256, 128]', 'dropout': 0.3062042815816436, 'batch_norm': False, 'lr': 6.250694362702921e-06, 'weight_decay': 0.00047236866202090535, 'epochs': 235, 'loss': 'mae', 'optimizer': 'adam', 'graph_mode': 'cutoff', 'cutoff': 0.8884738053077232, 'grm_norm': 'cosine_then_gcn', 'self_loops': False, 'use_snp_selection': True, 'num_snps': 53556}. Best is trial 95 with value: 0.08890736477236041.
[I 2025-11-03 11:59:39,768] Trial 113 finished with value: 0.04934839162717393 and parameters: {'model_type': 'graphsage', 'hidden_dims': '[256, 128]', 'dropout': 0.29294152821895336, 'batch_norm': False, 'lr': 7.328558513875579e-06, 'weight_decay': 0.000707863809748655, 'epochs': 204, 'loss': 'mae', 'optimizer': 'adam', 'graph_mode': 'cutoff', 'cutoff': 0.8284455113835552, 'grm_norm': 'cosine_then_gcn', 'self_loops': False, 'use_snp_selection': True, 'num_snps': 50457}. Best is trial 95 with value: 0.08890736477236041.
[I 2025-11-03 11:59:44,274] Trial 114 finished with value: 0.051834549082046405 and parameters: {'model_type': 'graphsage', 'hidden_dims': '[256, 128]', 'dropout': 0.3174269157794923, 'batch_norm': False, 'lr': 1.5080167184669383e-05, 'weight_decay': 0.0003839534690037318, 'epochs': 246, 'loss': 'mae', 'optimizer': 'adam', 'graph_mode': 'cutoff', 'cutoff': 0.8096521773564788, 'grm_norm': 'cosine_then_gcn', 'self_loops': False, 'use_snp_selection': True, 'num_snps': 56114}. Best is trial 95 with value: 0.08890736477236041.
[I 2025-11-03 11:59:48,514] Trial 115 finished with value: 0.03136272073438911 and parameters: {'model_type': 'graphsage', 'hidden_dims': '[256, 128]', 'dropout': 0.33518518646673584, 'batch_norm': False, 'lr': 9.585548318562825e-06, 'weight_decay': 0.0009722661497132761, 'epochs': 212, 'loss': 'mae', 'optimizer': 'adam', 'graph_mode': 'cutoff', 'cutoff': 0.8512325564344073, 'grm_norm': 'cosine_then_gcn', 'self_loops': False, 'use_snp_selection': True, 'num_snps': 54493}. Best is trial 95 with value: 0.08890736477236041.
[I 2025-11-03 11:59:52,421] Trial 116 finished with value: 0.0664925568171846 and parameters: {'model_type': 'graphsage', 'hidden_dims': '[256, 128]', 'dropout': 0.307244150823937, 'batch_norm': False, 'lr': 5.6321875229119905e-06, 'weight_decay': 0.0005665699991195492, 'epochs': 228, 'loss': 'mae', 'optimizer': 'adam', 'graph_mode': 'cutoff', 'cutoff': 0.8835733669462963, 'grm_norm': 'gcn', 'self_loops': False, 'use_snp_selection': True, 'num_snps': 47565}. Best is trial 95 with value: 0.08890736477236041.
[I 2025-11-03 11:59:56,453] Trial 117 finished with value: 0.05574642223302782 and parameters: {'model_type': 'graphsage', 'hidden_dims': '[256, 128]', 'dropout': 0.34824099976230555, 'batch_norm': False, 'lr': 5.427278103710439e-06, 'weight_decay': 0.0005891366199494494, 'epochs': 259, 'loss': 'mae', 'optimizer': 'adam', 'graph_mode': 'cutoff', 'cutoff': 0.8834949767016721, 'grm_norm': 'gcn', 'self_loops': False, 'use_snp_selection': True, 'num_snps': 47265}. Best is trial 95 with value: 0.08890736477236041.
[I 2025-11-03 12:00:00,053] Trial 118 finished with value: 0.050294150768193914 and parameters: {'model_type': 'graphsage', 'hidden_dims': '[256, 128]', 'dropout': 0.2824392876808616, 'batch_norm': False, 'lr': 4.256865680970804e-06, 'weight_decay': 0.0008108870153588987, 'epochs': 194, 'loss': 'mae', 'optimizer': 'adam', 'graph_mode': 'cutoff', 'cutoff': 0.8347908296418451, 'grm_norm': 'gcn', 'self_loops': False, 'use_snp_selection': True, 'num_snps': 44483}. Best is trial 95 with value: 0.08890736477236041.
[I 2025-11-03 12:00:03,576] Trial 119 finished with value: 0.03308433123693101 and parameters: {'model_type': 'graphsage', 'hidden_dims': '[128, 64]', 'dropout': 0.2964031987124798, 'batch_norm': False, 'lr': 6.823252312042254e-06, 'weight_decay': 0.0003389788857502074, 'epochs': 253, 'loss': 'mae', 'optimizer': 'adam', 'graph_mode': 'cutoff', 'cutoff': 0.8623818754044452, 'grm_norm': 'gcn', 'self_loops': False, 'use_snp_selection': True, 'num_snps': 49336}. Best is trial 95 with value: 0.08890736477236041.
[I 2025-11-03 12:00:07,828] Trial 120 finished with value: 0.058187120161028436 and parameters: {'model_type': 'graphsage', 'hidden_dims': '[256, 128]', 'dropout': 0.3937202690472246, 'batch_norm': False, 'lr': 1.1273809656289262e-05, 'weight_decay': 0.0006658476608943857, 'epochs': 235, 'loss': 'mae', 'optimizer': 'adam', 'graph_mode': 'cutoff', 'cutoff': 0.8972137156246381, 'grm_norm': 'gcn', 'self_loops': False, 'use_snp_selection': True, 'num_snps': 53151}. Best is trial 95 with value: 0.08890736477236041.
[I 2025-11-03 12:00:11,905] Trial 121 finished with value: 0.06101695900096339 and parameters: {'model_type': 'graphsage', 'hidden_dims': '[256, 128]', 'dropout': 0.3057510063499036, 'batch_norm': False, 'lr': 2.6056678078975733e-05, 'weight_decay': 0.0004830304740153522, 'epochs': 218, 'loss': 'mae', 'optimizer': 'adam', 'graph_mode': 'cutoff', 'cutoff': 0.781490551056898, 'grm_norm': 'cosine_then_gcn', 'self_loops': False, 'use_snp_selection': True, 'num_snps': 51426}. Best is trial 95 with value: 0.08890736477236041.
[I 2025-11-03 12:00:15,973] Trial 122 finished with value: 0.05484831671783416 and parameters: {'model_type': 'graphsage', 'hidden_dims': '[256, 128]', 'dropout': 0.4392664593454266, 'batch_norm': False, 'lr': 8.00670016595043e-06, 'weight_decay': 0.00040206484691879436, 'epochs': 226, 'loss': 'mae', 'optimizer': 'adam', 'graph_mode': 'cutoff', 'cutoff': 0.8055191977104116, 'grm_norm': 'cosine_then_gcn', 'self_loops': False, 'use_snp_selection': True, 'num_snps': 49897}. Best is trial 95 with value: 0.08890736477236041.
[I 2025-11-03 12:00:20,445] Trial 123 finished with value: 0.03386085836562713 and parameters: {'model_type': 'graphsage', 'hidden_dims': '[256, 128]', 'dropout': 0.32713345373479025, 'batch_norm': False, 'lr': 6.535163515876407e-06, 'weight_decay': 0.0005623985559282249, 'epochs': 234, 'loss': 'mae', 'optimizer': 'adam', 'graph_mode': 'cutoff', 'cutoff': 0.8208420315102907, 'grm_norm': 'none', 'self_loops': False, 'use_snp_selection': True, 'num_snps': 57131}. Best is trial 95 with value: 0.08890736477236041.
[I 2025-11-03 12:00:24,882] Trial 124 finished with value: 0.026667747768550108 and parameters: {'model_type': 'graphsage', 'hidden_dims': '[256, 128]', 'dropout': 0.31276790085121237, 'batch_norm': False, 'lr': 2.2652595590947376e-05, 'weight_decay': 0.0004748887766834757, 'epochs': 248, 'loss': 'mae', 'optimizer': 'adam', 'graph_mode': 'cutoff', 'cutoff': 0.848975275319517, 'grm_norm': 'cosine_then_gcn', 'self_loops': False, 'use_snp_selection': True, 'num_snps': 55178}. Best is trial 95 with value: 0.08890736477236041.
[I 2025-11-03 12:00:28,825] Trial 125 finished with value: 0.04560918729923865 and parameters: {'model_type': 'graphsage', 'hidden_dims': '[256, 128]', 'dropout': 0.321388141356598, 'batch_norm': False, 'lr': 1.7081772247744946e-05, 'weight_decay': 0.000731636183590667, 'epochs': 228, 'loss': 'mae', 'optimizer': 'adam', 'graph_mode': 'cutoff', 'cutoff': 0.8757282386910424, 'grm_norm': 'cosine_then_gcn', 'self_loops': False, 'use_snp_selection': True, 'num_snps': 47532}. Best is trial 95 with value: 0.08890736477236041.
[I 2025-11-03 12:00:33,014] Trial 126 finished with value: 0.0337766006333508 and parameters: {'model_type': 'graphsage', 'hidden_dims': '[256, 128]', 'dropout': 0.3407479168667709, 'batch_norm': False, 'lr': 3.5233728326526916e-05, 'weight_decay': 0.00029843112962970686, 'epochs': 200, 'loss': 'mae', 'optimizer': 'adam', 'graph_mode': 'cutoff', 'cutoff': 0.44639523042381635, 'grm_norm': 'cosine_then_gcn', 'self_loops': False, 'use_snp_selection': True, 'num_snps': 52549}. Best is trial 95 with value: 0.08890736477236041.
[I 2025-11-03 12:00:38,833] Trial 127 finished with value: 0.06089087665055574 and parameters: {'model_type': 'graphsage', 'hidden_dims': '[512, 256]', 'dropout': 0.2897436778165541, 'batch_norm': False, 'lr': 3.6410154716312596e-06, 'weight_decay': 0.00035102334742281936, 'epochs': 241, 'loss': 'mae', 'optimizer': 'adam', 'graph_mode': 'cutoff', 'cutoff': 0.7937913736660787, 'grm_norm': 'cosine_then_gcn', 'self_loops': True, 'use_snp_selection': True, 'num_snps': 53924}. Best is trial 95 with value: 0.08890736477236041.
[I 2025-11-03 12:00:42,435] Trial 128 finished with value: 0.05758984033280116 and parameters: {'model_type': 'graphsage', 'hidden_dims': '[128, 64]', 'dropout': 0.36809294380488194, 'batch_norm': False, 'lr': 9.063984448433352e-06, 'weight_decay': 0.0008048071987634244, 'epochs': 264, 'loss': 'mae', 'optimizer': 'adam', 'graph_mode': 'cutoff', 'cutoff': 0.8607995273652082, 'grm_norm': 'none', 'self_loops': False, 'use_snp_selection': True, 'num_snps': 50952}. Best is trial 95 with value: 0.08890736477236041.
[I 2025-11-03 12:00:46,371] Trial 129 finished with value: 0.06484636176326602 and parameters: {'model_type': 'graphsage', 'hidden_dims': '[256, 128, 64]', 'dropout': 0.2645989658874685, 'batch_norm': False, 'lr': 4.261757705415932e-05, 'weight_decay': 0.0005994564014511088, 'epochs': 214, 'loss': 'mae', 'optimizer': 'adam', 'graph_mode': 'cutoff', 'cutoff': 0.8371907281697758, 'grm_norm': 'gcn', 'self_loops': False, 'use_snp_selection': True, 'num_snps': 48620}. Best is trial 95 with value: 0.08890736477236041.
[I 2025-11-03 12:00:50,370] Trial 130 finished with value: 0.04439709719903865 and parameters: {'model_type': 'graphsage', 'hidden_dims': '[256, 128, 64]', 'dropout': 0.5434983981572643, 'batch_norm': False, 'lr': 4.5153553943623386e-05, 'weight_decay': 0.0005990286007387063, 'epochs': 222, 'loss': 'mae', 'optimizer': 'adam', 'graph_mode': 'cutoff', 'cutoff': 0.836642679768132, 'grm_norm': 'gcn', 'self_loops': False, 'use_snp_selection': True, 'num_snps': 48509}. Best is trial 95 with value: 0.08890736477236041.
[I 2025-11-03 12:00:54,893] Trial 131 finished with value: 0.07574126382158916 and parameters: {'model_type': 'graphsage', 'hidden_dims': '[256, 128, 64]', 'dropout': 0.24994641094038517, 'batch_norm': False, 'lr': 1.1817342214110692e-05, 'weight_decay': 0.0009748095954548508, 'epochs': 214, 'loss': 'mae', 'optimizer': 'adam', 'graph_mode': 'cutoff', 'cutoff': 0.8151436271487842, 'grm_norm': 'gcn', 'self_loops': False, 'use_snp_selection': True, 'num_snps': 59753}. Best is trial 95 with value: 0.08890736477236041.
[I 2025-11-03 12:00:58,672] Trial 132 finished with value: 0.0786242957913121 and parameters: {'model_type': 'graphsage', 'hidden_dims': '[256, 128, 64]', 'dropout': 0.26230928835151124, 'batch_norm': False, 'lr': 1.0804477931087572e-05, 'weight_decay': 0.0009854093863750637, 'epochs': 206, 'loss': 'mae', 'optimizer': 'adam', 'graph_mode': 'cutoff', 'cutoff': 0.7812619267068648, 'grm_norm': 'gcn', 'self_loops': False, 'use_snp_selection': True, 'num_snps': 46635}. Best is trial 95 with value: 0.08890736477236041.
[I 2025-11-03 12:01:02,310] Trial 133 finished with value: 0.061532730296640685 and parameters: {'model_type': 'graphsage', 'hidden_dims': '[256, 128, 64]', 'dropout': 0.26685545539447936, 'batch_norm': False, 'lr': 1.1912622128430664e-05, 'weight_decay': 0.0008987961975981997, 'epochs': 207, 'loss': 'mae', 'optimizer': 'adam', 'graph_mode': 'cutoff', 'cutoff': 0.7824016915959187, 'grm_norm': 'gcn', 'self_loops': False, 'use_snp_selection': True, 'num_snps': 42882}. Best is trial 95 with value: 0.08890736477236041.
[I 2025-11-03 12:01:05,989] Trial 134 finished with value: 0.0346134483817654 and parameters: {'model_type': 'graphsage', 'hidden_dims': '[256, 128, 64]', 'dropout': 0.2537615471295844, 'batch_norm': False, 'lr': 1.4724040632117793e-05, 'weight_decay': 0.0008222869761346047, 'epochs': 189, 'loss': 'mae', 'optimizer': 'adam', 'graph_mode': 'cutoff', 'cutoff': 0.825624994278257, 'grm_norm': 'gcn', 'self_loops': False, 'use_snp_selection': True, 'num_snps': 45436}. Best is trial 95 with value: 0.08890736477236041.
[I 2025-11-03 12:01:08,537] Trial 135 finished with value: 0.03715827281342986 and parameters: {'model_type': 'graphsage', 'hidden_dims': '[256, 128, 64]', 'dropout': 0.2810171547955294, 'batch_norm': False, 'lr': 3.9361155027671084e-05, 'weight_decay': 0.0007175580564688957, 'epochs': 221, 'loss': 'mae', 'optimizer': 'adam', 'graph_mode': 'cutoff', 'cutoff': 0.7772022814522045, 'grm_norm': 'gcn', 'self_loops': False, 'use_snp_selection': True, 'num_snps': 13814}. Best is trial 95 with value: 0.08890736477236041.
[I 2025-11-03 12:01:12,825] Trial 136 finished with value: 0.05121878282539069 and parameters: {'model_type': 'graphsage', 'hidden_dims': '[256, 128, 64]', 'dropout': 0.2637208886568845, 'batch_norm': False, 'lr': 6.637124873902537e-05, 'weight_decay': 0.0009510404518294805, 'epochs': 209, 'loss': 'mae', 'optimizer': 'adam', 'graph_mode': 'cutoff', 'cutoff': 0.7963663242646686, 'grm_norm': 'gcn', 'self_loops': False, 'use_snp_selection': True, 'num_snps': 55769}. Best is trial 95 with value: 0.08890736477236041.
[I 2025-11-03 12:01:16,575] Trial 137 finished with value: 0.04453432414907158 and parameters: {'model_type': 'graphsage', 'hidden_dims': '[256, 128, 64]', 'dropout': 0.24919264356716006, 'batch_norm': False, 'lr': 1.0200133096640628e-05, 'weight_decay': 0.0009851341213864397, 'epochs': 197, 'loss': 'mae', 'optimizer': 'adam', 'graph_mode': 'cutoff', 'cutoff': 0.8447335787674384, 'grm_norm': 'gcn', 'self_loops': False, 'use_snp_selection': True, 'num_snps': 46665}. Best is trial 95 with value: 0.08890736477236041.
[I 2025-11-03 12:01:20,898] Trial 138 finished with value: 0.04405251071562356 and parameters: {'model_type': 'graphsage', 'hidden_dims': '[256, 128, 64]', 'dropout': 0.2968702645762622, 'batch_norm': False, 'lr': 0.0001835276975025178, 'weight_decay': 0.000409745745588508, 'epochs': 260, 'loss': 'mae', 'optimizer': 'adam', 'graph_mode': 'cutoff', 'cutoff': 0.8165935505642827, 'grm_norm': 'gcn', 'self_loops': False, 'use_snp_selection': True, 'num_snps': 51782}. Best is trial 95 with value: 0.08890736477236041.
[I 2025-11-03 12:01:25,157] Trial 139 finished with value: 0.04850853013116534 and parameters: {'model_type': 'graphsage', 'hidden_dims': '[256, 128, 64]', 'dropout': 0.28575456307360614, 'batch_norm': False, 'lr': 2.2861114484157408e-05, 'weight_decay': 0.0006740132903477338, 'epochs': 180, 'loss': 'mae', 'optimizer': 'adam', 'graph_mode': 'cutoff', 'cutoff': 0.7707918240184906, 'grm_norm': 'gcn', 'self_loops': False, 'use_snp_selection': True, 'num_snps': 57697}. Best is trial 95 with value: 0.08890736477236041.
[I 2025-11-03 12:01:29,545] Trial 140 finished with value: 0.05808814469899689 and parameters: {'model_type': 'graphsage', 'hidden_dims': '[256, 128, 64]', 'dropout': 0.2667280744205879, 'batch_norm': False, 'lr': 1.741047318240598e-05, 'weight_decay': 0.0005253885488640366, 'epochs': 242, 'loss': 'mae', 'optimizer': 'adam', 'graph_mode': 'cutoff', 'cutoff': 0.8901243853002762, 'grm_norm': 'gcn', 'self_loops': False, 'use_snp_selection': True, 'num_snps': 54558}. Best is trial 95 with value: 0.08890736477236041.
[I 2025-11-03 12:01:33,625] Trial 141 finished with value: 0.02918065044815822 and parameters: {'model_type': 'graphsage', 'hidden_dims': '[256, 128, 64]', 'dropout': 0.30091718348309715, 'batch_norm': False, 'lr': 5.085326030413294e-06, 'weight_decay': 0.0006064446327213205, 'epochs': 219, 'loss': 'mae', 'optimizer': 'adam', 'graph_mode': 'cutoff', 'cutoff': 0.677193219325061, 'grm_norm': 'gcn', 'self_loops': False, 'use_snp_selection': True, 'num_snps': 49924}. Best is trial 95 with value: 0.08890736477236041.
[I 2025-11-03 12:01:36,980] Trial 142 finished with value: 0.07099776567168822 and parameters: {'model_type': 'graphsage', 'hidden_dims': '[128, 64]', 'dropout': 0.3284164597550696, 'batch_norm': False, 'lr': 5.179666602962553e-05, 'weight_decay': 0.0004195961112561166, 'epochs': 215, 'loss': 'mae', 'optimizer': 'adam', 'graph_mode': 'cutoff', 'cutoff': 0.8597597933339131, 'grm_norm': 'none', 'self_loops': False, 'use_snp_selection': True, 'num_snps': 48268}. Best is trial 95 with value: 0.08890736477236041.
[I 2025-11-03 12:01:40,178] Trial 143 finished with value: 0.042952023530219936 and parameters: {'model_type': 'graphsage', 'hidden_dims': '[128, 64]', 'dropout': 0.3300137319362707, 'batch_norm': False, 'lr': 1.1627456326799975e-05, 'weight_decay': 0.00043534543734453327, 'epochs': 202, 'loss': 'mae', 'optimizer': 'adam', 'graph_mode': 'cutoff', 'cutoff': 0.8573878450179384, 'grm_norm': 'none', 'self_loops': False, 'use_snp_selection': True, 'num_snps': 44671}. Best is trial 95 with value: 0.08890736477236041.
[I 2025-11-03 12:01:43,707] Trial 144 finished with value: 0.026479517165868563 and parameters: {'model_type': 'graphsage', 'hidden_dims': '[128, 64]', 'dropout': 0.3542498144251481, 'batch_norm': False, 'lr': 9.91634516522942e-05, 'weight_decay': 0.000287336518970808, 'epochs': 275, 'loss': 'mae', 'optimizer': 'adam', 'graph_mode': 'cutoff', 'cutoff': 0.6483448763365364, 'grm_norm': 'none', 'self_loops': False, 'use_snp_selection': True, 'num_snps': 47813}. Best is trial 95 with value: 0.08890736477236041.
[I 2025-11-03 12:01:47,415] Trial 145 finished with value: 0.05925876130410642 and parameters: {'model_type': 'graphsage', 'hidden_dims': '[128, 64]', 'dropout': 0.3433352083738065, 'batch_norm': False, 'lr': 5.447593262602507e-05, 'weight_decay': 0.0003446782259722965, 'epochs': 289, 'loss': 'mae', 'optimizer': 'adam', 'graph_mode': 'cutoff', 'cutoff': 0.8328782217329715, 'grm_norm': 'none', 'self_loops': False, 'use_snp_selection': True, 'num_snps': 53099}. Best is trial 95 with value: 0.08890736477236041.
[I 2025-11-03 12:01:50,897] Trial 146 finished with value: 0.07831941610937493 and parameters: {'model_type': 'graphsage', 'hidden_dims': '[128, 64]', 'dropout': 0.25731115445285124, 'batch_norm': False, 'lr': 4.9783373704122166e-05, 'weight_decay': 0.0005243783046416562, 'epochs': 215, 'loss': 'mae', 'optimizer': 'adam', 'graph_mode': 'cutoff', 'cutoff': 0.7053269910317895, 'grm_norm': 'none', 'self_loops': False, 'use_snp_selection': True, 'num_snps': 51830}. Best is trial 95 with value: 0.08890736477236041.
[I 2025-11-03 12:01:54,394] Trial 147 finished with value: 0.05098928436544657 and parameters: {'model_type': 'graphsage', 'hidden_dims': '[128, 64]', 'dropout': 0.3749388619211201, 'batch_norm': False, 'lr': 7.350602230531493e-05, 'weight_decay': 0.0007856313024117124, 'epochs': 225, 'loss': 'mae', 'optimizer': 'adam', 'graph_mode': 'cutoff', 'cutoff': 0.7577478853387443, 'grm_norm': 'none', 'self_loops': True, 'use_snp_selection': True, 'num_snps': 51254}. Best is trial 95 with value: 0.08890736477236041.
[I 2025-11-03 12:01:58,079] Trial 148 finished with value: 0.05069481645595024 and parameters: {'model_type': 'graphsage', 'hidden_dims': '[128, 64]', 'dropout': 0.2770609891169186, 'batch_norm': False, 'lr': 8.411099093600973e-05, 'weight_decay': 0.0004850659882549469, 'epochs': 251, 'loss': 'mae', 'optimizer': 'adam', 'graph_mode': 'cutoff', 'cutoff': 0.6245005482804067, 'grm_norm': 'none', 'self_loops': False, 'use_snp_selection': True, 'num_snps': 53586}. Best is trial 95 with value: 0.08890736477236041.
[I 2025-11-03 12:02:01,667] Trial 149 finished with value: 0.05547078653128576 and parameters: {'model_type': 'graphsage', 'hidden_dims': '[128, 64]', 'dropout': 0.31932155223264885, 'batch_norm': False, 'lr': 0.00012034249231726342, 'weight_decay': 0.00038673003928510946, 'epochs': 238, 'loss': 'mae', 'optimizer': 'adam', 'graph_mode': 'cutoff', 'cutoff': 0.6996454619494613, 'grm_norm': 'none', 'self_loops': False, 'use_snp_selection': True, 'num_snps': 52389}. Best is trial 95 with value: 0.08890736477236041.
