[I 2025-11-03 15:44:17,868] Trial 57 finished with value: 0.09543654032631191 and parameters: {'model_type': 'graphsage', 'hidden_dims': '[512, 128]', 'dropout': 0.5806494797733197, 'batch_norm': True, 'lr': 0.000548824900516911, 'weight_decay': 3.885686894953916e-07, 'epochs': 267, 'loss': 'mae', 'optimizer': 'adam', 'graph_mode': 'knn', 'source': 'grm', 'knn_k': 1, 'weighted_edges': True, 'symmetrize_mode': 'union', 'use_snp_selection': False}. Best is trial 51 with value: 0.10350511250099614.
[I 2025-11-03 15:44:23,773] Trial 58 finished with value: 0.07879027819652522 and parameters: {'model_type': 'graphsage', 'hidden_dims': '[512, 128]', 'dropout': 0.5833517739448629, 'batch_norm': True, 'lr': 0.0008307752311419744, 'weight_decay': 4.2120190126100733e-07, 'epochs': 217, 'loss': 'mae', 'optimizer': 'adam', 'graph_mode': 'knn', 'source': 'grm', 'knn_k': 2, 'weighted_edges': True, 'symmetrize_mode': 'union', 'use_snp_selection': False}. Best is trial 51 with value: 0.10350511250099614.
[I 2025-11-03 15:44:30,392] Trial 59 finished with value: 0.09022630664444785 and parameters: {'model_type': 'graphsage', 'hidden_dims': '[512, 128]', 'dropout': 0.5466272670812494, 'batch_norm': True, 'lr': 0.00038453111752835, 'weight_decay': 1.1576951200063174e-06, 'epochs': 270, 'loss': 'mae', 'optimizer': 'adam', 'graph_mode': 'knn', 'source': 'grm', 'knn_k': 1, 'weighted_edges': True, 'symmetrize_mode': 'union', 'use_snp_selection': False}. Best is trial 51 with value: 0.10350511250099614.
[I 2025-11-03 15:44:36,807] Trial 60 finished with value: 0.06916728241183569 and parameters: {'model_type': 'graphsage', 'hidden_dims': '[512, 128]', 'dropout': 0.5888073589014546, 'batch_norm': True, 'lr': 0.000602106897779087, 'weight_decay': 7.611205103943427e-07, 'epochs': 246, 'loss': 'mae', 'optimizer': 'adam', 'graph_mode': 'knn', 'source': 'grm', 'knn_k': 2, 'weighted_edges': True, 'symmetrize_mode': 'union', 'use_snp_selection': False}. Best is trial 51 with value: 0.10350511250099614.
[I 2025-11-03 15:44:43,647] Trial 61 finished with value: 0.09485573136764446 and parameters: {'model_type': 'graphsage', 'hidden_dims': '[512, 128]', 'dropout': 0.5367121444259485, 'batch_norm': True, 'lr': 0.0004920935937886685, 'weight_decay': 3.150362143925117e-07, 'epochs': 283, 'loss': 'mae', 'optimizer': 'adam', 'graph_mode': 'knn', 'source': 'grm', 'knn_k': 1, 'weighted_edges': True, 'symmetrize_mode': 'union', 'use_snp_selection': False}. Best is trial 51 with value: 0.10350511250099614.
[I 2025-11-03 15:44:50,492] Trial 62 finished with value: 0.09273851504675044 and parameters: {'model_type': 'graphsage', 'hidden_dims': '[512, 128]', 'dropout': 0.5692839942077006, 'batch_norm': True, 'lr': 0.0009300231768118274, 'weight_decay': 3.368287194682182e-07, 'epochs': 283, 'loss': 'mae', 'optimizer': 'adam', 'graph_mode': 'knn', 'source': 'grm', 'knn_k': 1, 'weighted_edges': True, 'symmetrize_mode': 'union', 'use_snp_selection': False}. Best is trial 51 with value: 0.10350511250099614.
[I 2025-11-03 15:44:56,862] Trial 63 finished with value: 0.09872298543515484 and parameters: {'model_type': 'graphsage', 'hidden_dims': '[512, 128]', 'dropout': 0.5414746787294353, 'batch_norm': True, 'lr': 0.00044891694489369535, 'weight_decay': 2.051632922550073e-07, 'epochs': 255, 'loss': 'mae', 'optimizer': 'adam', 'graph_mode': 'knn', 'source': 'grm', 'knn_k': 1, 'weighted_edges': True, 'symmetrize_mode': 'union', 'use_snp_selection': False}. Best is trial 51 with value: 0.10350511250099614.
[I 2025-11-03 15:45:03,017] Trial 64 finished with value: 0.07366543742711366 and parameters: {'model_type': 'graphsage', 'hidden_dims': '[512, 128]', 'dropout': 0.5398524362517655, 'batch_norm': True, 'lr': 0.00033012734124922706, 'weight_decay': 4.930761313447516e-07, 'epochs': 229, 'loss': 'mae', 'optimizer': 'adam', 'graph_mode': 'knn', 'source': 'grm', 'knn_k': 2, 'weighted_edges': True, 'symmetrize_mode': 'union', 'use_snp_selection': False}. Best is trial 51 with value: 0.10350511250099614.
[I 2025-11-03 15:45:09,427] Trial 65 finished with value: 0.08094050080347825 and parameters: {'model_type': 'graphsage', 'hidden_dims': '[512, 128]', 'dropout': 0.266481025567905, 'batch_norm': True, 'lr': 0.00043557990801015606, 'weight_decay': 1.325000627692363e-07, 'epochs': 258, 'loss': 'mae', 'optimizer': 'adam', 'graph_mode': 'knn', 'source': 'grm', 'knn_k': 1, 'weighted_edges': True, 'symmetrize_mode': 'union', 'use_snp_selection': False}. Best is trial 51 with value: 0.10350511250099614.
[I 2025-11-03 15:45:16,566] Trial 66 finished with value: 0.03799399522773834 and parameters: {'model_type': 'graphsage', 'hidden_dims': '[512, 128]', 'dropout': 0.5982398357302265, 'batch_norm': True, 'lr': 1.4084803138868884e-05, 'weight_decay': 3.184387651839807e-07, 'epochs': 272, 'loss': 'mae', 'optimizer': 'adam', 'graph_mode': 'knn', 'source': 'grm', 'knn_k': 3, 'weighted_edges': True, 'symmetrize_mode': 'union', 'use_snp_selection': False}. Best is trial 51 with value: 0.10350511250099614.
[I 2025-11-03 15:45:23,152] Trial 67 finished with value: 0.07392696001447556 and parameters: {'model_type': 'graphsage', 'hidden_dims': '[512, 128]', 'dropout': 0.5515232161950946, 'batch_norm': True, 'lr': 0.0005570870696958727, 'weight_decay': 1.9789234315185743e-07, 'epochs': 258, 'loss': 'mae', 'optimizer': 'adam', 'graph_mode': 'knn', 'source': 'grm', 'knn_k': 2, 'weighted_edges': True, 'symmetrize_mode': 'union', 'use_snp_selection': False}. Best is trial 51 with value: 0.10350511250099614.
[I 2025-11-03 15:45:26,297] Trial 68 finished with value: 0.06580443901402509 and parameters: {'model_type': 'graphsage', 'hidden_dims': '[128, 64]', 'dropout': 0.17110562966797094, 'batch_norm': True, 'lr': 0.00026777160113264283, 'weight_decay': 2.683813377014021e-07, 'epochs': 191, 'loss': 'mae', 'optimizer': 'adam', 'graph_mode': 'knn', 'source': 'grm', 'knn_k': 6, 'weighted_edges': False, 'symmetrize_mode': 'union', 'use_snp_selection': False}. Best is trial 51 with value: 0.10350511250099614.
[I 2025-11-03 15:45:32,066] Trial 69 finished with value: 0.0775411550407405 and parameters: {'model_type': 'graphsage', 'hidden_dims': '[512, 128]', 'dropout': 0.4874178825935634, 'batch_norm': True, 'lr': 0.00038318208237173983, 'weight_decay': 5.415769280879106e-07, 'epochs': 233, 'loss': 'mae', 'optimizer': 'adam', 'graph_mode': 'knn', 'source': 'grm', 'knn_k': 1, 'weighted_edges': True, 'symmetrize_mode': 'mutual', 'use_snp_selection': False}. Best is trial 51 with value: 0.10350511250099614.
[I 2025-11-03 15:45:38,242] Trial 70 finished with value: 0.08232070889220634 and parameters: {'model_type': 'graphsage', 'hidden_dims': '[256, 128, 64]', 'dropout': 0.5103727985690819, 'batch_norm': True, 'lr': 0.00019234041913627288, 'weight_decay': 1.332528167667377e-07, 'epochs': 286, 'loss': 'mae', 'optimizer': 'adam', 'graph_mode': 'knn', 'source': 'grm', 'knn_k': 9, 'weighted_edges': True, 'symmetrize_mode': 'union', 'use_snp_selection': False}. Best is trial 51 with value: 0.10350511250099614.
[I 2025-11-03 15:45:45,399] Trial 71 finished with value: 0.10035783565736818 and parameters: {'model_type': 'graphsage', 'hidden_dims': '[512, 128]', 'dropout': 0.5630352611294235, 'batch_norm': True, 'lr': 0.0007945599164318415, 'weight_decay': 1.8973890777393944e-07, 'epochs': 305, 'loss': 'mae', 'optimizer': 'adam', 'graph_mode': 'knn', 'source': 'grm', 'knn_k': 1, 'weighted_edges': True, 'symmetrize_mode': 'union', 'use_snp_selection': False}. Best is trial 51 with value: 0.10350511250099614.
[I 2025-11-03 15:45:52,632] Trial 72 finished with value: 0.11572043655915205 and parameters: {'model_type': 'graphsage', 'hidden_dims': '[512, 128]', 'dropout': 0.5581521391727188, 'batch_norm': True, 'lr': 0.0006136730216863144, 'weight_decay': 2.1776637370888168e-07, 'epochs': 307, 'loss': 'mae', 'optimizer': 'adam', 'graph_mode': 'knn', 'source': 'grm', 'knn_k': 1, 'weighted_edges': True, 'symmetrize_mode': 'union', 'use_snp_selection': False}. Best is trial 72 with value: 0.11572043655915205.
[I 2025-11-03 15:45:59,889] Trial 73 finished with value: 0.09353608793295247 and parameters: {'model_type': 'graphsage', 'hidden_dims': '[512, 128]', 'dropout': 0.560590501794817, 'batch_norm': True, 'lr': 0.0006471350782113345, 'weight_decay': 1.9796321901689096e-07, 'epochs': 308, 'loss': 'mae', 'optimizer': 'adam', 'graph_mode': 'knn', 'source': 'grm', 'knn_k': 1, 'weighted_edges': True, 'symmetrize_mode': 'union', 'use_snp_selection': False}. Best is trial 72 with value: 0.11572043655915205.
[I 2025-11-03 15:46:06,348] Trial 74 finished with value: 0.0927563315438127 and parameters: {'model_type': 'graphsage', 'hidden_dims': '[512, 128]', 'dropout': 0.5897247741834658, 'batch_norm': True, 'lr': 0.0007669710038603073, 'weight_decay': 0.00019557609904327487, 'epochs': 248, 'loss': 'mae', 'optimizer': 'adam', 'graph_mode': 'knn', 'source': 'grm', 'knn_k': 2, 'weighted_edges': True, 'symmetrize_mode': 'union', 'use_snp_selection': False}. Best is trial 72 with value: 0.11572043655915205.
[I 2025-11-03 15:46:13,281] Trial 75 finished with value: 0.09213324304125273 and parameters: {'model_type': 'graphsage', 'hidden_dims': '[512, 128]', 'dropout': 0.5244778596349676, 'batch_norm': True, 'lr': 0.0005649494133392514, 'weight_decay': 1.4079856032745762e-07, 'epochs': 292, 'loss': 'mae', 'optimizer': 'adam', 'graph_mode': 'knn', 'source': 'grm', 'knn_k': 1, 'weighted_edges': True, 'symmetrize_mode': 'union', 'use_snp_selection': False}. Best is trial 72 with value: 0.11572043655915205.
[I 2025-11-03 15:46:19,819] Trial 76 finished with value: 0.0815824115172002 and parameters: {'model_type': 'graphsage', 'hidden_dims': '[512, 128]', 'dropout': 0.5631771559175285, 'batch_norm': True, 'lr': 3.867644675761705e-06, 'weight_decay': 0.0009635702106651014, 'epochs': 264, 'loss': 'mae', 'optimizer': 'adam', 'graph_mode': 'knn', 'source': 'grm', 'knn_k': 1, 'weighted_edges': True, 'symmetrize_mode': 'union', 'use_snp_selection': False}. Best is trial 72 with value: 0.11572043655915205.
[I 2025-11-03 15:46:27,463] Trial 77 finished with value: 0.09214256220291689 and parameters: {'model_type': 'graphsage', 'hidden_dims': '[512, 128]', 'dropout': 0.5444897471790555, 'batch_norm': True, 'lr': 0.0009708814905107322, 'weight_decay': 7.452555653566209e-07, 'epochs': 314, 'loss': 'mae', 'optimizer': 'adam', 'graph_mode': 'knn', 'source': 'grm', 'knn_k': 2, 'weighted_edges': True, 'symmetrize_mode': 'union', 'use_snp_selection': False}. Best is trial 72 with value: 0.11572043655915205.
[I 2025-11-03 15:46:34,091] Trial 78 finished with value: 0.10588583380267294 and parameters: {'model_type': 'graphsage', 'hidden_dims': '[512, 128]', 'dropout': 0.5884211336136428, 'batch_norm': True, 'lr': 0.0003412711238366371, 'weight_decay': 4.0795715200201933e-07, 'epochs': 274, 'loss': 'mae', 'optimizer': 'adam', 'graph_mode': 'knn', 'source': 'grm', 'knn_k': 1, 'weighted_edges': True, 'symmetrize_mode': 'union', 'use_snp_selection': False}. Best is trial 72 with value: 0.11572043655915205.
[I 2025-11-03 15:46:42,355] Trial 79 finished with value: 0.06595461126174032 and parameters: {'model_type': 'graphsage', 'hidden_dims': '[512, 128]', 'dropout': 0.5993890584917383, 'batch_norm': True, 'lr': 0.00033727829567412325, 'weight_decay': 2.1230014513686225e-07, 'epochs': 332, 'loss': 'mae', 'optimizer': 'adam', 'graph_mode': 'knn', 'source': 'grm', 'knn_k': 3, 'weighted_edges': True, 'symmetrize_mode': 'union', 'use_snp_selection': False}. Best is trial 72 with value: 0.11572043655915205.
[I 2025-11-03 15:46:49,850] Trial 80 finished with value: 0.08808857828096123 and parameters: {'model_type': 'graphsage', 'hidden_dims': '[512, 256]', 'dropout': 0.517281499108711, 'batch_norm': True, 'lr': 7.51817957996514e-05, 'weight_decay': 1.0111254617171987e-07, 'epochs': 308, 'loss': 'mae', 'optimizer': 'adam', 'graph_mode': 'knn', 'source': 'grm', 'knn_k': 2, 'weighted_edges': False, 'symmetrize_mode': 'union', 'use_snp_selection': False}. Best is trial 72 with value: 0.11572043655915205.
[I 2025-11-03 15:46:56,566] Trial 81 finished with value: 0.08444072552583731 and parameters: {'model_type': 'graphsage', 'hidden_dims': '[512, 128]', 'dropout': 0.5832502803151881, 'batch_norm': True, 'lr': 0.00039948821040222703, 'weight_decay': 3.843667753401311e-07, 'epochs': 279, 'loss': 'mae', 'optimizer': 'adam', 'graph_mode': 'knn', 'source': 'grm', 'knn_k': 1, 'weighted_edges': True, 'symmetrize_mode': 'union', 'use_snp_selection': False}. Best is trial 72 with value: 0.11572043655915205.
[I 2025-11-03 15:47:03,251] Trial 82 finished with value: 0.10637272597039125 and parameters: {'model_type': 'graphsage', 'hidden_dims': '[512, 128]', 'dropout': 0.5567403178288756, 'batch_norm': True, 'lr': 0.0004741384278354604, 'weight_decay': 2.542466780879218e-07, 'epochs': 274, 'loss': 'mae', 'optimizer': 'adam', 'graph_mode': 'knn', 'source': 'grm', 'knn_k': 1, 'weighted_edges': True, 'symmetrize_mode': 'union', 'use_snp_selection': False}. Best is trial 72 with value: 0.11572043655915205.
[I 2025-11-03 15:47:10,387] Trial 83 finished with value: 0.10105925359930341 and parameters: {'model_type': 'graphsage', 'hidden_dims': '[512, 128]', 'dropout': 0.5556168764169586, 'batch_norm': True, 'lr': 0.00028234427655227887, 'weight_decay': 2.5216029921222265e-07, 'epochs': 299, 'loss': 'mae', 'optimizer': 'adam', 'graph_mode': 'knn', 'source': 'grm', 'knn_k': 1, 'weighted_edges': True, 'symmetrize_mode': 'union', 'use_snp_selection': False}. Best is trial 72 with value: 0.11572043655915205.
[I 2025-11-03 15:47:17,471] Trial 84 finished with value: 0.1014740941512985 and parameters: {'model_type': 'graphsage', 'hidden_dims': '[512, 128]', 'dropout': 0.5518540459089355, 'batch_norm': True, 'lr': 0.0001716309105154711, 'weight_decay': 2.4726588229356696e-07, 'epochs': 297, 'loss': 'mae', 'optimizer': 'adam', 'graph_mode': 'knn', 'source': 'grm', 'knn_k': 1, 'weighted_edges': True, 'symmetrize_mode': 'union', 'use_snp_selection': False}. Best is trial 72 with value: 0.11572043655915205.
[I 2025-11-03 15:47:24,759] Trial 85 finished with value: 0.09371725065810387 and parameters: {'model_type': 'graphsage', 'hidden_dims': '[512, 128]', 'dropout': 0.5568687825860847, 'batch_norm': True, 'lr': 0.00014923545304225264, 'weight_decay': 2.458519598075468e-07, 'epochs': 294, 'loss': 'mae', 'optimizer': 'adam', 'graph_mode': 'knn', 'source': 'grm', 'knn_k': 2, 'weighted_edges': True, 'symmetrize_mode': 'union', 'use_snp_selection': False}. Best is trial 72 with value: 0.11572043655915205.
[I 2025-11-03 15:47:31,391] Trial 86 finished with value: 0.0894245018951723 and parameters: {'model_type': 'graphsage', 'hidden_dims': '[512, 128]', 'dropout': 0.5495215852274875, 'batch_norm': True, 'lr': 0.00024552004623943464, 'weight_decay': 1.6747110076487467e-07, 'epochs': 274, 'loss': 'mae', 'optimizer': 'adam', 'graph_mode': 'knn', 'source': 'grm', 'knn_k': 1, 'weighted_edges': True, 'symmetrize_mode': 'union', 'use_snp_selection': False}. Best is trial 72 with value: 0.11572043655915205.
[I 2025-11-03 15:47:38,256] Trial 87 finished with value: 0.07803048234137945 and parameters: {'model_type': 'graphsage', 'hidden_dims': '[512, 128]', 'dropout': 0.5670980087573334, 'batch_norm': True, 'lr': 0.00031151562280182503, 'weight_decay': 1.2402299184047479e-07, 'epochs': 297, 'loss': 'mae', 'optimizer': 'adam', 'graph_mode': 'knn', 'source': 'grm', 'knn_k': 1, 'weighted_edges': True, 'symmetrize_mode': 'mutual', 'use_snp_selection': False}. Best is trial 72 with value: 0.11572043655915205.
[I 2025-11-03 15:47:45,407] Trial 88 finished with value: 0.09531204277839112 and parameters: {'model_type': 'graphsage', 'hidden_dims': '[512, 128]', 'dropout': 0.5303531667160931, 'batch_norm': True, 'lr': 0.0001792057085517265, 'weight_decay': 2.8174643437580356e-07, 'epochs': 302, 'loss': 'mae', 'optimizer': 'adam', 'graph_mode': 'knn', 'source': 'grm', 'knn_k': 1, 'weighted_edges': True, 'symmetrize_mode': 'union', 'use_snp_selection': False}. Best is trial 72 with value: 0.11572043655915205.
[I 2025-11-03 15:47:47,503] Trial 89 finished with value: 0.07105135917630323 and parameters: {'model_type': 'graphsage', 'hidden_dims': '[128, 64]', 'dropout': 0.49586087445680554, 'batch_norm': True, 'lr': 0.00046055416268984565, 'weight_decay': 2.1215975203950934e-07, 'epochs': 136, 'loss': 'mae', 'optimizer': 'adam', 'graph_mode': 'knn', 'source': 'grm', 'knn_k': 2, 'weighted_edges': True, 'symmetrize_mode': 'union', 'use_snp_selection': False}. Best is trial 72 with value: 0.11572043655915205.
[I 2025-11-03 15:47:55,126] Trial 90 finished with value: 0.08642339988420795 and parameters: {'model_type': 'graphsage', 'hidden_dims': '[512, 64]', 'dropout': 0.5681864387463137, 'batch_norm': True, 'lr': 0.0002774246315978552, 'weight_decay': 1.540405844534055e-07, 'epochs': 316, 'loss': 'mae', 'optimizer': 'adam', 'graph_mode': 'knn', 'source': 'grm', 'knn_k': 2, 'weighted_edges': True, 'symmetrize_mode': 'union', 'use_snp_selection': False}. Best is trial 72 with value: 0.11572043655915205.
[I 2025-11-03 15:48:02,059] Trial 91 finished with value: 0.10620170865995363 and parameters: {'model_type': 'graphsage', 'hidden_dims': '[512, 128]', 'dropout': 0.5418739161101038, 'batch_norm': True, 'lr': 0.0002108433112885074, 'weight_decay': 4.269605404497585e-07, 'epochs': 288, 'loss': 'mae', 'optimizer': 'adam', 'graph_mode': 'knn', 'source': 'grm', 'knn_k': 1, 'weighted_edges': True, 'symmetrize_mode': 'union', 'use_snp_selection': False}. Best is trial 72 with value: 0.11572043655915205.
[I 2025-11-03 15:48:08,967] Trial 92 finished with value: 0.09616607129102467 and parameters: {'model_type': 'graphsage', 'hidden_dims': '[512, 128]', 'dropout': 0.5428019434978169, 'batch_norm': True, 'lr': 0.0002062203468101037, 'weight_decay': 4.465496328666713e-07, 'epochs': 286, 'loss': 'mae', 'optimizer': 'adam', 'graph_mode': 'knn', 'source': 'grm', 'knn_k': 1, 'weighted_edges': True, 'symmetrize_mode': 'union', 'use_snp_selection': False}. Best is trial 72 with value: 0.11572043655915205.
[I 2025-11-03 15:48:16,192] Trial 93 finished with value: 0.09837081057712047 and parameters: {'model_type': 'graphsage', 'hidden_dims': '[512, 128]', 'dropout': 0.5885414903969183, 'batch_norm': True, 'lr': 0.00037119106704640927, 'weight_decay': 6.127536676182136e-07, 'epochs': 304, 'loss': 'mae', 'optimizer': 'adam', 'graph_mode': 'knn', 'source': 'grm', 'knn_k': 1, 'weighted_edges': True, 'symmetrize_mode': 'union', 'use_snp_selection': False}. Best is trial 72 with value: 0.11572043655915205.
[I 2025-11-03 15:48:23,712] Trial 94 finished with value: 0.09708402889107975 and parameters: {'model_type': 'graphsage', 'hidden_dims': '[512, 128]', 'dropout': 0.5880382252358831, 'batch_norm': True, 'lr': 0.0003401092865201883, 'weight_decay': 6.614482695840092e-07, 'epochs': 322, 'loss': 'mae', 'optimizer': 'adam', 'graph_mode': 'knn', 'source': 'grm', 'knn_k': 1, 'weighted_edges': True, 'symmetrize_mode': 'union', 'use_snp_selection': False}. Best is trial 72 with value: 0.11572043655915205.
[I 2025-11-03 15:48:28,090] Trial 95 finished with value: 0.10782136316032835 and parameters: {'model_type': 'graphsage', 'hidden_dims': '[256, 128, 64]', 'dropout': 0.5596940822154509, 'batch_norm': True, 'lr': 0.0003792633362839488, 'weight_decay': 3.4517378882334614e-07, 'epochs': 307, 'loss': 'mae', 'optimizer': 'adam', 'graph_mode': 'knn', 'source': 'grm', 'knn_k': 1, 'weighted_edges': True, 'symmetrize_mode': 'union', 'use_snp_selection': False}. Best is trial 72 with value: 0.11572043655915205.
[I 2025-11-03 15:48:32,512] Trial 96 finished with value: 0.0949935444084525 and parameters: {'model_type': 'graphsage', 'hidden_dims': '[256, 128, 64]', 'dropout': 0.5566109044097434, 'batch_norm': True, 'lr': 0.0002381190944070252, 'weight_decay': 3.354741419947181e-07, 'epochs': 312, 'loss': 'mae', 'optimizer': 'adam', 'graph_mode': 'knn', 'source': 'grm', 'knn_k': 1, 'weighted_edges': True, 'symmetrize_mode': 'union', 'use_snp_selection': False}. Best is trial 72 with value: 0.11572043655915205.
[I 2025-11-03 15:48:34,530] Trial 97 finished with value: 0.06629814716764329 and parameters: {'model_type': 'graphsage', 'hidden_dims': '[256, 128, 64]', 'dropout': 0.528054648815761, 'batch_norm': True, 'lr': 0.00045808429066687494, 'weight_decay': 2.346448691307678e-07, 'epochs': 62, 'loss': 'mae', 'optimizer': 'adam', 'graph_mode': 'knn', 'source': 'grm', 'knn_k': 1, 'weighted_edges': False, 'symmetrize_mode': 'union', 'use_snp_selection': False}. Best is trial 72 with value: 0.11572043655915205.
[I 2025-11-03 15:48:39,788] Trial 98 finished with value: 0.06810921967697055 and parameters: {'model_type': 'graphsage', 'hidden_dims': '[256, 128, 64]', 'dropout': 0.5063248635812532, 'batch_norm': True, 'lr': 0.0001580970261683008, 'weight_decay': 5.23712422260801e-07, 'epochs': 293, 'loss': 'mae', 'optimizer': 'adam', 'graph_mode': 'knn', 'source': 'grm', 'knn_k': 5, 'weighted_edges': True, 'symmetrize_mode': 'union', 'use_snp_selection': False}. Best is trial 72 with value: 0.11572043655915205.
[I 2025-11-03 15:48:43,834] Trial 99 finished with value: 0.09565601635934347 and parameters: {'model_type': 'graphsage', 'hidden_dims': '[256, 128, 64]', 'dropout': 0.5398382925282612, 'batch_norm': True, 'lr': 4.855846035824942e-05, 'weight_decay': 2.7991694538384083e-07, 'epochs': 279, 'loss': 'mae', 'optimizer': 'adam', 'graph_mode': 'knn', 'source': 'grm', 'knn_k': 2, 'weighted_edges': True, 'symmetrize_mode': 'mutual', 'use_snp_selection': False}. Best is trial 72 with value: 0.11572043655915205.
