[I 2025-11-03 12:28:55,574] Trial 30 finished with value: 0.008893276042858174 and parameters: {'model_type': 'gcn', 'hidden_dims': '[512, 64]', 'dropout': 0.16709592327317618, 'batch_norm': True, 'lr': 5.734050401944039e-06, 'weight_decay': 9.124962857398843e-06, 'epochs': 334, 'loss': 'mae', 'optimizer': 'adam', 'graph_mode': 'cutoff', 'cutoff': 0.31260047371757677, 'grm_norm': 'cosine_then_gcn', 'self_loops': True, 'use_snp_selection': False}. Best is trial 15 with value: 0.12250249074614396.
[I 2025-11-03 12:28:56,982] Trial 31 finished with value: 0.10427874035648102 and parameters: {'model_type': 'gcn', 'hidden_dims': '[128, 64]', 'dropout': 0.5019099978844547, 'batch_norm': True, 'lr': 0.0006515786774793412, 'weight_decay': 0.0004199277227108792, 'epochs': 149, 'loss': 'mae', 'optimizer': 'adam', 'graph_mode': 'cutoff', 'cutoff': 0.5739789388159117, 'grm_norm': 'cosine_then_gcn', 'self_loops': False, 'use_snp_selection': False}. Best is trial 15 with value: 0.12250249074614396.
[I 2025-11-03 12:28:58,826] Trial 32 finished with value: 0.10576907107618089 and parameters: {'model_type': 'gcn', 'hidden_dims': '[512, 256]', 'dropout': 0.5609941066802874, 'batch_norm': True, 'lr': 0.0005600453845330197, 'weight_decay': 0.00010705803528647096, 'epochs': 111, 'loss': 'mae', 'optimizer': 'adam', 'graph_mode': 'cutoff', 'cutoff': 0.5220871940777514, 'grm_norm': 'gcn', 'self_loops': True, 'use_snp_selection': False}. Best is trial 15 with value: 0.12250249074614396.
[I 2025-11-03 12:29:00,501] Trial 33 finished with value: 0.08271289240567686 and parameters: {'model_type': 'gcn', 'hidden_dims': '[256, 128]', 'dropout': 0.5235228790532561, 'batch_norm': True, 'lr': 0.0003177407413669059, 'weight_decay': 3.89949043136795e-05, 'epochs': 179, 'loss': 'mse', 'optimizer': 'adam', 'graph_mode': 'cutoff', 'cutoff': 0.6193541592467676, 'grm_norm': 'none', 'self_loops': False, 'use_snp_selection': False}. Best is trial 15 with value: 0.12250249074614396.
[I 2025-11-03 12:29:01,830] Trial 34 finished with value: 0.09003721197502088 and parameters: {'model_type': 'gcn', 'hidden_dims': '[128, 64]', 'dropout': 0.3968765793000646, 'batch_norm': False, 'lr': 0.0007268332881564278, 'weight_decay': 0.00023776361848015475, 'epochs': 181, 'loss': 'mae', 'optimizer': 'adam', 'graph_mode': 'cutoff', 'cutoff': 0.7317450906565561, 'grm_norm': 'cosine', 'self_loops': True, 'use_snp_selection': True, 'num_snps': 2039}. Best is trial 15 with value: 0.12250249074614396.
[I 2025-11-03 12:29:04,294] Trial 35 finished with value: 0.11333793844052556 and parameters: {'model_type': 'gcn', 'hidden_dims': '[512, 64]', 'dropout': 0.46425081618191283, 'batch_norm': True, 'lr': 0.0009819119758167258, 'weight_decay': 0.000612354365776766, 'epochs': 216, 'loss': 'mae', 'optimizer': 'adam', 'graph_mode': 'cutoff', 'cutoff': 0.5197446211746501, 'grm_norm': 'cosine_then_gcn', 'self_loops': False, 'use_snp_selection': False}. Best is trial 15 with value: 0.12250249074614396.
[I 2025-11-03 12:29:06,851] Trial 36 finished with value: 0.11478811759224225 and parameters: {'model_type': 'gcn', 'hidden_dims': '[512, 64]', 'dropout': 0.4635495230757719, 'batch_norm': True, 'lr': 0.0009939344557206165, 'weight_decay': 0.00045406652162669115, 'epochs': 240, 'loss': 'mae', 'optimizer': 'adam', 'graph_mode': 'cutoff', 'cutoff': 0.4149959023101102, 'grm_norm': 'cosine_then_gcn', 'self_loops': False, 'use_snp_selection': False}. Best is trial 15 with value: 0.12250249074614396.
[I 2025-11-03 12:29:09,441] Trial 37 finished with value: 0.10620309195868222 and parameters: {'model_type': 'gcn', 'hidden_dims': '[512, 64]', 'dropout': 0.44049015644516337, 'batch_norm': True, 'lr': 0.0004786115228162533, 'weight_decay': 0.00010932867191419125, 'epochs': 246, 'loss': 'mae', 'optimizer': 'adam', 'graph_mode': 'cutoff', 'cutoff': 0.4114243943690896, 'grm_norm': 'cosine_then_gcn', 'self_loops': True, 'use_snp_selection': False}. Best is trial 15 with value: 0.12250249074614396.
[I 2025-11-03 12:29:12,145] Trial 38 finished with value: 0.0410070659951012 and parameters: {'model_type': 'gcn', 'hidden_dims': '[512, 64]', 'dropout': 0.41313570288734275, 'batch_norm': True, 'lr': 2.2513782253051322e-05, 'weight_decay': 1.887491255592637e-06, 'epochs': 267, 'loss': 'mae', 'optimizer': 'adam', 'graph_mode': 'cutoff', 'cutoff': 0.24693576905918457, 'grm_norm': 'cosine_then_gcn', 'self_loops': False, 'use_snp_selection': False}. Best is trial 15 with value: 0.12250249074614396.
[I 2025-11-03 12:29:14,963] Trial 39 finished with value: 0.12134106737982571 and parameters: {'model_type': 'gcn', 'hidden_dims': '[512, 64]', 'dropout': 0.4814755917694737, 'batch_norm': True, 'lr': 0.0002714483734100645, 'weight_decay': 4.328554861750444e-05, 'epochs': 288, 'loss': 'mae', 'optimizer': 'adam', 'graph_mode': 'cutoff', 'cutoff': 0.40246370467230264, 'grm_norm': 'cosine_then_gcn', 'self_loops': False, 'use_snp_selection': False}. Best is trial 15 with value: 0.12250249074614396.
[I 2025-11-03 12:29:17,599] Trial 40 finished with value: -0.0030484479404308236 and parameters: {'model_type': 'gcn', 'hidden_dims': '[256, 128, 64]', 'dropout': 0.38039828061038916, 'batch_norm': True, 'lr': 0.0001804733933733607, 'weight_decay': 2.9089611567271687e-05, 'epochs': 327, 'loss': 'mae', 'optimizer': 'adam', 'graph_mode': 'knn', 'source': 'grm', 'knn_k': 10, 'weighted_edges': False, 'symmetrize_mode': 'union', 'use_snp_selection': False}. Best is trial 15 with value: 0.12250249074614396.
[I 2025-11-03 12:29:20,378] Trial 41 finished with value: 0.12165934913647641 and parameters: {'model_type': 'gcn', 'hidden_dims': '[512, 64]', 'dropout': 0.49309200768581746, 'batch_norm': True, 'lr': 0.0002935297810028722, 'weight_decay': 1.2840464523887682e-05, 'epochs': 281, 'loss': 'mae', 'optimizer': 'adam', 'graph_mode': 'cutoff', 'cutoff': 0.3978009753684572, 'grm_norm': 'cosine_then_gcn', 'self_loops': False, 'use_snp_selection': False}. Best is trial 15 with value: 0.12250249074614396.
[I 2025-11-03 12:29:23,158] Trial 42 finished with value: 0.12057483191573787 and parameters: {'model_type': 'gcn', 'hidden_dims': '[512, 64]', 'dropout': 0.49838279561988175, 'batch_norm': True, 'lr': 0.0002810755461403844, 'weight_decay': 8.870402892160817e-06, 'epochs': 278, 'loss': 'mae', 'optimizer': 'adam', 'graph_mode': 'cutoff', 'cutoff': 0.33435059158976993, 'grm_norm': 'cosine_then_gcn', 'self_loops': False, 'use_snp_selection': False}. Best is trial 15 with value: 0.12250249074614396.
[I 2025-11-03 12:29:26,008] Trial 43 finished with value: 0.10115703129657086 and parameters: {'model_type': 'gcn', 'hidden_dims': '[512, 64]', 'dropout': 0.50140157903956, 'batch_norm': True, 'lr': 0.0002357765220753564, 'weight_decay': 1.3973941356446742e-05, 'epochs': 288, 'loss': 'mae', 'optimizer': 'adam', 'graph_mode': 'cutoff', 'cutoff': 0.3230387023450413, 'grm_norm': 'cosine_then_gcn', 'self_loops': False, 'use_snp_selection': False}. Best is trial 15 with value: 0.12250249074614396.
[I 2025-11-03 12:29:29,153] Trial 44 finished with value: 0.12085127152789438 and parameters: {'model_type': 'gcn', 'hidden_dims': '[512, 64]', 'dropout': 0.5625236072251456, 'batch_norm': True, 'lr': 0.00010955465744791064, 'weight_decay': 7.443238631879244e-06, 'epochs': 322, 'loss': 'mae', 'optimizer': 'adam', 'graph_mode': 'cutoff', 'cutoff': 0.4729723022811829, 'grm_norm': 'cosine_then_gcn', 'self_loops': False, 'use_snp_selection': False}. Best is trial 15 with value: 0.12250249074614396.
[I 2025-11-03 12:29:32,442] Trial 45 finished with value: 0.10457034606379574 and parameters: {'model_type': 'gcn', 'hidden_dims': '[512, 64]', 'dropout': 0.5944925196276692, 'batch_norm': True, 'lr': 0.00011599980039573962, 'weight_decay': 7.546299881573609e-06, 'epochs': 347, 'loss': 'mae', 'optimizer': 'adam', 'graph_mode': 'cutoff', 'cutoff': 0.4797706797141959, 'grm_norm': 'cosine_then_gcn', 'self_loops': False, 'use_snp_selection': False}. Best is trial 15 with value: 0.12250249074614396.
[I 2025-11-03 12:29:35,546] Trial 46 finished with value: 0.08076223788521408 and parameters: {'model_type': 'gcn', 'hidden_dims': '[512, 64]', 'dropout': 0.5633339393167084, 'batch_norm': True, 'lr': 5.199620360444745e-05, 'weight_decay': 2.601076474076145e-06, 'epochs': 315, 'loss': 'mae', 'optimizer': 'adam', 'graph_mode': 'cutoff', 'cutoff': 0.33326790168129344, 'grm_norm': 'cosine_then_gcn', 'self_loops': False, 'use_snp_selection': False}. Best is trial 15 with value: 0.12250249074614396.
[I 2025-11-03 12:29:38,490] Trial 47 finished with value: 0.06816828613204078 and parameters: {'model_type': 'gcn', 'hidden_dims': '[512, 64]', 'dropout': 0.5310270097117905, 'batch_norm': True, 'lr': 0.00027530455429513077, 'weight_decay': 6.744712671625567e-06, 'epochs': 281, 'loss': 'mae', 'optimizer': 'adam', 'graph_mode': 'knn', 'source': 'grm', 'knn_k': 4, 'weighted_edges': False, 'symmetrize_mode': 'union', 'use_snp_selection': False}. Best is trial 15 with value: 0.12250249074614396.
[I 2025-11-03 12:29:41,549] Trial 48 finished with value: 0.07663924399641746 and parameters: {'model_type': 'gcn', 'hidden_dims': '[512, 64]', 'dropout': 0.3198980588125308, 'batch_norm': True, 'lr': 6.270191208415454e-05, 'weight_decay': 1.3420591893994026e-05, 'epochs': 311, 'loss': 'mae', 'optimizer': 'adam', 'graph_mode': 'cutoff', 'cutoff': 0.26549016782444834, 'grm_norm': 'none', 'self_loops': False, 'use_snp_selection': False}. Best is trial 15 with value: 0.12250249074614396.
[I 2025-11-03 12:29:43,509] Trial 49 finished with value: 0.1038905546427258 and parameters: {'model_type': 'gcn', 'hidden_dims': '[128, 64]', 'dropout': 0.49004015758284825, 'batch_norm': True, 'lr': 0.00010960381473174331, 'weight_decay': 2.13951468976027e-05, 'epochs': 278, 'loss': 'mae', 'optimizer': 'adam', 'graph_mode': 'cutoff', 'cutoff': 0.44624743048013926, 'grm_norm': 'cosine_then_gcn', 'self_loops': False, 'use_snp_selection': False}. Best is trial 15 with value: 0.12250249074614396.
[I 2025-11-03 12:29:46,787] Trial 50 finished with value: 0.1161430071704394 and parameters: {'model_type': 'gcn', 'hidden_dims': '[512, 128]', 'dropout': 0.5649865353296192, 'batch_norm': True, 'lr': 0.00039335908969424435, 'weight_decay': 2.2604372243824175e-07, 'epochs': 345, 'loss': 'mae', 'optimizer': 'adam', 'graph_mode': 'cutoff', 'cutoff': 0.3627192525980009, 'grm_norm': 'cosine_then_gcn', 'self_loops': False, 'use_snp_selection': False}. Best is trial 15 with value: 0.12250249074614396.
[I 2025-11-03 12:29:50,097] Trial 51 finished with value: 0.1177151352335367 and parameters: {'model_type': 'gcn', 'hidden_dims': '[512, 128]', 'dropout': 0.5637430157550438, 'batch_norm': True, 'lr': 0.00038072430591387624, 'weight_decay': 1.4924970565084673e-07, 'epochs': 350, 'loss': 'mae', 'optimizer': 'adam', 'graph_mode': 'cutoff', 'cutoff': 0.35154013869423373, 'grm_norm': 'cosine_then_gcn', 'self_loops': False, 'use_snp_selection': False}. Best is trial 15 with value: 0.12250249074614396.
[I 2025-11-03 12:29:53,272] Trial 52 finished with value: 0.07296699911033691 and parameters: {'model_type': 'gcn', 'hidden_dims': '[512, 128]', 'dropout': 0.5523560491886238, 'batch_norm': True, 'lr': 0.00017570180177794742, 'weight_decay': 1.755206615259745e-07, 'epochs': 327, 'loss': 'mae', 'optimizer': 'adam', 'graph_mode': 'cutoff', 'cutoff': 0.2958840522338309, 'grm_norm': 'cosine_then_gcn', 'self_loops': False, 'use_snp_selection': False}. Best is trial 15 with value: 0.12250249074614396.
[I 2025-11-03 12:29:56,388] Trial 53 finished with value: 0.12455370264455201 and parameters: {'model_type': 'gcn', 'hidden_dims': '[512, 128]', 'dropout': 0.5997481406648817, 'batch_norm': True, 'lr': 0.00025299570264503883, 'weight_decay': 5.942379529414846e-07, 'epochs': 317, 'loss': 'mae', 'optimizer': 'adam', 'graph_mode': 'cutoff', 'cutoff': 0.47918154779950406, 'grm_norm': 'cosine_then_gcn', 'self_loops': False, 'use_snp_selection': False}. Best is trial 53 with value: 0.12455370264455201.
[I 2025-11-03 12:29:57,670] Trial 54 finished with value: 0.030610288781858088 and parameters: {'model_type': 'gcn', 'hidden_dims': '[512, 128]', 'dropout': 0.481327654883421, 'batch_norm': True, 'lr': 0.00025131743844467985, 'weight_decay': 1.129706881867076e-06, 'epochs': 1, 'loss': 'mae', 'optimizer': 'adam', 'graph_mode': 'cutoff', 'cutoff': 0.47934867251912044, 'grm_norm': 'cosine', 'self_loops': False, 'use_snp_selection': False}. Best is trial 53 with value: 0.12455370264455201.
[I 2025-11-03 12:30:00,878] Trial 55 finished with value: 0.020697345361581267 and parameters: {'model_type': 'gcn', 'hidden_dims': '[512, 64]', 'dropout': 0.5207577855191544, 'batch_norm': True, 'lr': 7.120837923983778e-05, 'weight_decay': 6.251315116630878e-07, 'epochs': 317, 'loss': 'mae', 'optimizer': 'adam', 'graph_mode': 'knn', 'source': 'grm', 'knn_k': 8, 'weighted_edges': False, 'symmetrize_mode': 'union', 'use_snp_selection': False}. Best is trial 53 with value: 0.12455370264455201.
[I 2025-11-03 12:30:03,731] Trial 56 finished with value: 0.07239246288633833 and parameters: {'model_type': 'gcn', 'hidden_dims': '[512, 64]', 'dropout': 0.5945696191431292, 'batch_norm': True, 'lr': 0.00013205936949813463, 'weight_decay': 1.8499712626854244e-06, 'epochs': 272, 'loss': 'mae', 'optimizer': 'adam', 'graph_mode': 'cutoff', 'cutoff': 0.5025795480008267, 'grm_norm': 'cosine_then_gcn', 'self_loops': False, 'use_snp_selection': False}. Best is trial 53 with value: 0.12455370264455201.
[I 2025-11-03 12:30:06,343] Trial 57 finished with value: 0.08783716698461023 and parameters: {'model_type': 'gcn', 'hidden_dims': '[256, 128, 64]', 'dropout': 0.5804494207469524, 'batch_norm': True, 'lr': 0.00019835631741502263, 'weight_decay': 2.8721291183812503e-07, 'epochs': 289, 'loss': 'mse', 'optimizer': 'adam', 'graph_mode': 'cutoff', 'cutoff': 0.42075617253923564, 'grm_norm': 'cosine_then_gcn', 'self_loops': False, 'use_snp_selection': False}. Best is trial 53 with value: 0.12455370264455201.
[I 2025-11-03 12:30:10,608] Trial 58 finished with value: 0.09851224550070678 and parameters: {'model_type': 'gcn', 'hidden_dims': '[512, 64]', 'dropout': 0.13060296371936103, 'batch_norm': False, 'lr': 0.0004182398720298574, 'weight_decay': 1.783802325471414e-05, 'epochs': 252, 'loss': 'mae', 'optimizer': 'adam', 'graph_mode': 'cutoff', 'cutoff': 0.40090401860508834, 'grm_norm': 'cosine_then_gcn', 'self_loops': False, 'use_snp_selection': True, 'num_snps': 58846}. Best is trial 53 with value: 0.12455370264455201.
[I 2025-11-03 12:30:13,688] Trial 59 finished with value: 0.1097379922777349 and parameters: {'model_type': 'gcn', 'hidden_dims': '[512, 128]', 'dropout': 0.44204284946926087, 'batch_norm': True, 'lr': 0.00027619145942953756, 'weight_decay': 4.609819158826186e-06, 'epochs': 304, 'loss': 'mae', 'optimizer': 'adam', 'graph_mode': 'cutoff', 'cutoff': 0.46325296009545774, 'grm_norm': 'cosine_then_gcn', 'self_loops': False, 'use_snp_selection': False}. Best is trial 53 with value: 0.12455370264455201.
[I 2025-11-03 12:30:16,875] Trial 60 finished with value: 0.08906494918072164 and parameters: {'model_type': 'gcn', 'hidden_dims': '[512, 64]', 'dropout': 0.4214633908769001, 'batch_norm': True, 'lr': 0.00010453234040436642, 'weight_decay': 2.974412308979242e-06, 'epochs': 324, 'loss': 'mae', 'optimizer': 'adam', 'graph_mode': 'knn', 'source': 'grm', 'knn_k': 3, 'weighted_edges': True, 'symmetrize_mode': 'mutual', 'use_snp_selection': False}. Best is trial 53 with value: 0.12455370264455201.
[I 2025-11-03 12:30:20,163] Trial 61 finished with value: 0.12352805063367571 and parameters: {'model_type': 'gcn', 'hidden_dims': '[512, 128]', 'dropout': 0.571762161821455, 'batch_norm': True, 'lr': 0.00033963142502320436, 'weight_decay': 4.904969717150724e-07, 'epochs': 344, 'loss': 'mae', 'optimizer': 'adam', 'graph_mode': 'cutoff', 'cutoff': 0.3485861751623063, 'grm_norm': 'cosine_then_gcn', 'self_loops': False, 'use_snp_selection': False}. Best is trial 53 with value: 0.12455370264455201.
[I 2025-11-03 12:30:21,629] Trial 62 finished with value: 0.08652100763967814 and parameters: {'model_type': 'gcn', 'hidden_dims': '[512, 128]', 'dropout': 0.5745544741032632, 'batch_norm': True, 'lr': 0.0003033908373165675, 'weight_decay': 7.082105640340299e-07, 'epochs': 32, 'loss': 'mae', 'optimizer': 'adam', 'graph_mode': 'cutoff', 'cutoff': 0.38507982491843434, 'grm_norm': 'cosine_then_gcn', 'self_loops': False, 'use_snp_selection': False}. Best is trial 53 with value: 0.12455370264455201.
[I 2025-11-03 12:30:24,870] Trial 63 finished with value: 0.1200851502568455 and parameters: {'model_type': 'gcn', 'hidden_dims': '[512, 128]', 'dropout': 0.5414725636188736, 'batch_norm': True, 'lr': 0.00016062770031921206, 'weight_decay': 3.744105851380644e-07, 'epochs': 338, 'loss': 'mae', 'optimizer': 'adam', 'graph_mode': 'cutoff', 'cutoff': 0.4350755022893278, 'grm_norm': 'cosine_then_gcn', 'self_loops': False, 'use_snp_selection': False}. Best is trial 53 with value: 0.12455370264455201.
[I 2025-11-03 12:30:27,815] Trial 64 finished with value: 0.106399930801466 and parameters: {'model_type': 'gcn', 'hidden_dims': '[512, 128]', 'dropout': 0.22203662172303446, 'batch_norm': True, 'lr': 0.00023112190469249275, 'weight_decay': 1.2550124167807378e-06, 'epochs': 292, 'loss': 'mae', 'optimizer': 'adam', 'graph_mode': 'cutoff', 'cutoff': 0.3459154465987086, 'grm_norm': 'none', 'self_loops': False, 'use_snp_selection': False}. Best is trial 53 with value: 0.12455370264455201.
[I 2025-11-03 12:30:30,872] Trial 65 finished with value: 0.1281613599694599 and parameters: {'model_type': 'gcn', 'hidden_dims': '[512, 64]', 'dropout': 0.5970871603546781, 'batch_norm': True, 'lr': 0.0004518621442041881, 'weight_decay': 5.772573423069628e-05, 'epochs': 309, 'loss': 'mae', 'optimizer': 'adam', 'graph_mode': 'cutoff', 'cutoff': 0.4979751509384416, 'grm_norm': 'cosine', 'self_loops': False, 'use_snp_selection': False}. Best is trial 65 with value: 0.1281613599694599.
[I 2025-11-03 12:30:33,909] Trial 66 finished with value: 0.11735828432417457 and parameters: {'model_type': 'gcn', 'hidden_dims': '[512, 128]', 'dropout': 0.5995033898972787, 'batch_norm': True, 'lr': 0.00048453289865898515, 'weight_decay': 5.433414323907623e-05, 'epochs': 308, 'loss': 'mse', 'optimizer': 'adam', 'graph_mode': 'cutoff', 'cutoff': 0.5046129443883022, 'grm_norm': 'cosine', 'self_loops': False, 'use_snp_selection': False}. Best is trial 65 with value: 0.1281613599694599.
[I 2025-11-03 12:30:38,086] Trial 67 finished with value: 0.06127180634861012 and parameters: {'model_type': 'gcn', 'hidden_dims': '[512, 64]', 'dropout': 0.5784941011598316, 'batch_norm': False, 'lr': 3.261968935403969e-05, 'weight_decay': 5.87927814775093e-07, 'epochs': 333, 'loss': 'mae', 'optimizer': 'adam', 'graph_mode': 'cutoff', 'cutoff': 0.5404465483729959, 'grm_norm': 'cosine', 'self_loops': False, 'use_snp_selection': True, 'num_snps': 49691}. Best is trial 65 with value: 0.1281613599694599.
[I 2025-11-03 12:30:40,186] Trial 68 finished with value: 0.11671696151628895 and parameters: {'model_type': 'gcn', 'hidden_dims': '[128, 64]', 'dropout': 0.5507759749340353, 'batch_norm': True, 'lr': 0.000429071155804639, 'weight_decay': 3.783632186888613e-05, 'epochs': 320, 'loss': 'mae', 'optimizer': 'adam', 'graph_mode': 'cutoff', 'cutoff': 0.5988212347570452, 'grm_norm': 'cosine', 'self_loops': False, 'use_snp_selection': False}. Best is trial 65 with value: 0.1281613599694599.
[I 2025-11-03 12:30:43,190] Trial 69 finished with value: 0.11403401158380458 and parameters: {'model_type': 'gcn', 'hidden_dims': '[512, 64]', 'dropout': 0.2554620990216959, 'batch_norm': True, 'lr': 0.00020914723262167357, 'weight_decay': 6.787246489232355e-05, 'epochs': 300, 'loss': 'mae', 'optimizer': 'adam', 'graph_mode': 'cutoff', 'cutoff': 0.49616624090374983, 'grm_norm': 'cosine', 'self_loops': False, 'use_snp_selection': False}. Best is trial 65 with value: 0.1281613599694599.
[I 2025-11-03 12:30:46,432] Trial 70 finished with value: 0.11015098554440245 and parameters: {'model_type': 'gcn', 'hidden_dims': '[512, 256]', 'dropout': 0.5341881290939375, 'batch_norm': True, 'lr': 0.00013575099845789334, 'weight_decay': 4.380241381754689e-07, 'epochs': 340, 'loss': 'mae', 'optimizer': 'adam', 'graph_mode': 'cutoff', 'cutoff': 0.8930230169165841, 'grm_norm': 'cosine_then_gcn', 'self_loops': False, 'use_snp_selection': False}. Best is trial 65 with value: 0.1281613599694599.
[I 2025-11-03 12:30:49,240] Trial 71 finished with value: 0.12877151477969082 and parameters: {'model_type': 'gcn', 'hidden_dims': '[512, 64]', 'dropout': 0.5124044229341091, 'batch_norm': True, 'lr': 0.0003151366770366602, 'weight_decay': 2.7900748205357666e-05, 'epochs': 264, 'loss': 'mae', 'optimizer': 'adam', 'graph_mode': 'cutoff', 'cutoff': 0.43714764072111606, 'grm_norm': 'cosine_then_gcn', 'self_loops': False, 'use_snp_selection': False}. Best is trial 71 with value: 0.12877151477969082.
[I 2025-11-03 12:30:52,174] Trial 72 finished with value: 0.12005323704224723 and parameters: {'model_type': 'gcn', 'hidden_dims': '[512, 64]', 'dropout': 0.5226202785570064, 'batch_norm': True, 'lr': 0.0003270656321334807, 'weight_decay': 2.6138587017420153e-05, 'epochs': 286, 'loss': 'mae', 'optimizer': 'adam', 'graph_mode': 'cutoff', 'cutoff': 0.44787764315362744, 'grm_norm': 'cosine_then_gcn', 'self_loops': False, 'use_snp_selection': False}. Best is trial 71 with value: 0.12877151477969082.
[I 2025-11-03 12:30:54,336] Trial 73 finished with value: 0.12747035310233182 and parameters: {'model_type': 'gcn', 'hidden_dims': '[256, 128]', 'dropout': 0.4786922611481398, 'batch_norm': True, 'lr': 0.0008333995176971323, 'weight_decay': 5.137181235163056e-05, 'epochs': 265, 'loss': 'mae', 'optimizer': 'adam', 'graph_mode': 'cutoff', 'cutoff': 0.545893202230529, 'grm_norm': 'cosine_then_gcn', 'self_loops': False, 'use_snp_selection': False}. Best is trial 71 with value: 0.12877151477969082.
