[I 2025-11-03 12:06:07,527] Trial 86 finished with value: 0.06403778827784831 and parameters: {'model_type': 'graphsage', 'hidden_dims': '[128, 64]', 'dropout': 0.2244895051510722, 'batch_norm': True, 'lr': 0.00021842064778847543, 'weight_decay': 3.0287006195778286e-05, 'epochs': 239, 'loss': 'mse', 'optimizer': 'adam', 'graph_mode': 'knn', 'source': 'grm', 'knn_k': 10, 'weighted_edges': False, 'symmetrize_mode': 'union', 'use_snp_selection': False}. Best is trial 77 with value: 0.08732210053952931.
[I 2025-11-03 12:06:10,119] Trial 87 finished with value: 0.04136426209126179 and parameters: {'model_type': 'graphsage', 'hidden_dims': '[128, 64]', 'dropout': 0.22285493683234958, 'batch_norm': True, 'lr': 0.00023604937133780995, 'weight_decay': 2.9748271428888324e-05, 'epochs': 239, 'loss': 'mae', 'optimizer': 'adam', 'graph_mode': 'knn', 'source': 'grm', 'knn_k': 9, 'weighted_edges': False, 'symmetrize_mode': 'union', 'use_snp_selection': False}. Best is trial 77 with value: 0.08732210053952931.
[I 2025-11-03 12:06:12,324] Trial 88 finished with value: 0.07644251615279556 and parameters: {'model_type': 'graphsage', 'hidden_dims': '[128, 64]', 'dropout': 0.2097042477459143, 'batch_norm': True, 'lr': 0.0006349420364217886, 'weight_decay': 1.9292464783298072e-05, 'epochs': 271, 'loss': 'mse', 'optimizer': 'adam', 'graph_mode': 'cutoff', 'cutoff': 0.33383194572866803, 'grm_norm': 'gcn', 'self_loops': False, 'use_snp_selection': False}. Best is trial 77 with value: 0.08732210053952931.
[I 2025-11-03 12:06:14,517] Trial 89 finished with value: 0.06927463812086056 and parameters: {'model_type': 'graphsage', 'hidden_dims': '[128, 64]', 'dropout': 0.2014125568621961, 'batch_norm': True, 'lr': 0.0006289319130205642, 'weight_decay': 2.0746206019212223e-05, 'epochs': 269, 'loss': 'mse', 'optimizer': 'adam', 'graph_mode': 'cutoff', 'cutoff': 0.3177211299545949, 'grm_norm': 'gcn', 'self_loops': False, 'use_snp_selection': False}. Best is trial 77 with value: 0.08732210053952931.
[I 2025-11-03 12:06:16,909] Trial 90 finished with value: 0.07740561688269969 and parameters: {'model_type': 'graphsage', 'hidden_dims': '[128, 64]', 'dropout': 0.1985969094332742, 'batch_norm': True, 'lr': 0.0009147241404453931, 'weight_decay': 1.9459691689621376e-05, 'epochs': 324, 'loss': 'mse', 'optimizer': 'adam', 'graph_mode': 'cutoff', 'cutoff': 0.31182363961292847, 'grm_norm': 'gcn', 'self_loops': False, 'use_snp_selection': False}. Best is trial 77 with value: 0.08732210053952931.
[I 2025-11-03 12:06:19,265] Trial 91 finished with value: 0.06631674231520096 and parameters: {'model_type': 'graphsage', 'hidden_dims': '[128, 64]', 'dropout': 0.20230915336975164, 'batch_norm': True, 'lr': 0.0009805554649988785, 'weight_decay': 1.9831135359001884e-05, 'epochs': 320, 'loss': 'mse', 'optimizer': 'adam', 'graph_mode': 'cutoff', 'cutoff': 0.3082535219211908, 'grm_norm': 'gcn', 'self_loops': False, 'use_snp_selection': False}. Best is trial 77 with value: 0.08732210053952931.
[I 2025-11-03 12:06:21,450] Trial 92 finished with value: 0.05730223025266042 and parameters: {'model_type': 'graphsage', 'hidden_dims': '[128, 64]', 'dropout': 0.18691252157117702, 'batch_norm': True, 'lr': 0.0007398071290829955, 'weight_decay': 1.5821568014200897e-05, 'epochs': 268, 'loss': 'mse', 'optimizer': 'adam', 'graph_mode': 'cutoff', 'cutoff': 0.3557568238411727, 'grm_norm': 'gcn', 'self_loops': False, 'use_snp_selection': False}. Best is trial 77 with value: 0.08732210053952931.
[I 2025-11-03 12:06:23,689] Trial 93 finished with value: 0.05840347809908163 and parameters: {'model_type': 'graphsage', 'hidden_dims': '[128, 64]', 'dropout': 0.16755912554562863, 'batch_norm': True, 'lr': 0.000646728793118892, 'weight_decay': 1.0968619043646772e-05, 'epochs': 280, 'loss': 'mse', 'optimizer': 'adam', 'graph_mode': 'cutoff', 'cutoff': 0.2895647743335864, 'grm_norm': 'gcn', 'self_loops': False, 'use_snp_selection': False}. Best is trial 77 with value: 0.08732210053952931.
[I 2025-11-03 12:06:25,951] Trial 94 finished with value: 0.08203040487367062 and parameters: {'model_type': 'graphsage', 'hidden_dims': '[128, 64]', 'dropout': 0.13880345994401122, 'batch_norm': True, 'lr': 0.0005618949518372787, 'weight_decay': 2.457651221651166e-05, 'epochs': 291, 'loss': 'mse', 'optimizer': 'adam', 'graph_mode': 'cutoff', 'cutoff': 0.4119109925927026, 'grm_norm': 'gcn', 'self_loops': False, 'use_snp_selection': False}. Best is trial 77 with value: 0.08732210053952931.
[I 2025-11-03 12:06:28,350] Trial 95 finished with value: 0.06964788198122504 and parameters: {'model_type': 'graphsage', 'hidden_dims': '[128, 64]', 'dropout': 0.12823542696270476, 'batch_norm': True, 'lr': 0.000562544214031984, 'weight_decay': 2.3162024013515446e-05, 'epochs': 326, 'loss': 'mse', 'optimizer': 'adam', 'graph_mode': 'cutoff', 'cutoff': 0.4037149048906434, 'grm_norm': 'gcn', 'self_loops': False, 'use_snp_selection': False}. Best is trial 77 with value: 0.08732210053952931.
[I 2025-11-03 12:06:30,726] Trial 96 finished with value: 0.0511308244845963 and parameters: {'model_type': 'graphsage', 'hidden_dims': '[128, 64]', 'dropout': 0.1286884697367483, 'batch_norm': True, 'lr': 0.0008012576432016211, 'weight_decay': 2.4514260798523957e-05, 'epochs': 327, 'loss': 'mse', 'optimizer': 'adam', 'graph_mode': 'cutoff', 'cutoff': 0.39726866783261106, 'grm_norm': 'gcn', 'self_loops': False, 'use_snp_selection': False}. Best is trial 77 with value: 0.08732210053952931.
[I 2025-11-03 12:06:33,011] Trial 97 finished with value: 0.05801858345841973 and parameters: {'model_type': 'graphsage', 'hidden_dims': '[128, 64]', 'dropout': 0.11678690680383655, 'batch_norm': True, 'lr': 0.0005727011403487465, 'weight_decay': 2.0149718627206966e-05, 'epochs': 295, 'loss': 'mse', 'optimizer': 'adam', 'graph_mode': 'cutoff', 'cutoff': 0.3291386333500564, 'grm_norm': 'gcn', 'self_loops': False, 'use_snp_selection': False}. Best is trial 77 with value: 0.08732210053952931.
[I 2025-11-03 12:06:35,347] Trial 98 finished with value: 0.0526655102878854 and parameters: {'model_type': 'graphsage', 'hidden_dims': '[128, 64]', 'dropout': 0.1566603926841245, 'batch_norm': True, 'lr': 0.000886285098882636, 'weight_decay': 3.590081841463982e-05, 'epochs': 310, 'loss': 'mse', 'optimizer': 'adam', 'graph_mode': 'cutoff', 'cutoff': 0.456421748816754, 'grm_norm': 'gcn', 'self_loops': False, 'use_snp_selection': False}. Best is trial 77 with value: 0.08732210053952931.
[I 2025-11-03 12:06:37,836] Trial 99 finished with value: 0.0496316513445634 and parameters: {'model_type': 'graphsage', 'hidden_dims': '[128, 64]', 'dropout': 0.1427147529670012, 'batch_norm': True, 'lr': 0.0005440006928504633, 'weight_decay': 1.4788022698986735e-05, 'epochs': 345, 'loss': 'mse', 'optimizer': 'adam', 'graph_mode': 'cutoff', 'cutoff': 0.24630304560710314, 'grm_norm': 'gcn', 'self_loops': False, 'use_snp_selection': False}. Best is trial 77 with value: 0.08732210053952931.
[I 2025-11-03 12:06:40,224] Trial 100 finished with value: 0.05521979657095475 and parameters: {'model_type': 'graphsage', 'hidden_dims': '[128, 64]', 'dropout': 0.2128064859330317, 'batch_norm': True, 'lr': 0.0007140795271989811, 'weight_decay': 2.6603378192397927e-05, 'epochs': 331, 'loss': 'mse', 'optimizer': 'adam', 'graph_mode': 'cutoff', 'cutoff': 0.3898926609328527, 'grm_norm': 'gcn', 'self_loops': False, 'use_snp_selection': False}. Best is trial 77 with value: 0.08732210053952931.
[I 2025-11-03 12:06:43,120] Trial 101 finished with value: 0.06458561028709169 and parameters: {'model_type': 'graphsage', 'hidden_dims': '[256, 128]', 'dropout': 0.10280727981726286, 'batch_norm': True, 'lr': 0.00047628992980922925, 'weight_decay': 8.774844751222809e-06, 'epochs': 263, 'loss': 'mse', 'optimizer': 'adam', 'graph_mode': 'cutoff', 'cutoff': 0.28133742899281505, 'grm_norm': 'gcn', 'self_loops': False, 'use_snp_selection': False}. Best is trial 77 with value: 0.08732210053952931.
[I 2025-11-03 12:06:45,345] Trial 102 finished with value: 0.060526337048845434 and parameters: {'model_type': 'graphsage', 'hidden_dims': '[128, 64]', 'dropout': 0.1792615311388947, 'batch_norm': True, 'lr': 0.000652361815505617, 'weight_decay': 1.176677963614678e-05, 'epochs': 278, 'loss': 'mse', 'optimizer': 'adam', 'graph_mode': 'cutoff', 'cutoff': 0.33668894373113695, 'grm_norm': 'gcn', 'self_loops': False, 'use_snp_selection': False}. Best is trial 77 with value: 0.08732210053952931.
[I 2025-11-03 12:06:47,577] Trial 103 finished with value: 0.056413903187944134 and parameters: {'model_type': 'graphsage', 'hidden_dims': '[128, 64]', 'dropout': 0.2481667746471473, 'batch_norm': True, 'lr': 0.00037264556261727623, 'weight_decay': 5.8632555226495824e-06, 'epochs': 288, 'loss': 'mse', 'optimizer': 'adam', 'graph_mode': 'cutoff', 'cutoff': 0.41108589885992286, 'grm_norm': 'gcn', 'self_loops': False, 'use_snp_selection': False}. Best is trial 77 with value: 0.08732210053952931.
[I 2025-11-03 12:06:50,634] Trial 104 finished with value: 0.0581008849183772 and parameters: {'model_type': 'graphsage', 'hidden_dims': '[256, 128]', 'dropout': 0.1515748134522469, 'batch_norm': True, 'lr': 0.0006003465844551793, 'weight_decay': 4.518995761009657e-06, 'epochs': 312, 'loss': 'mse', 'optimizer': 'adam', 'graph_mode': 'cutoff', 'cutoff': 0.48250741793706037, 'grm_norm': 'gcn', 'self_loops': False, 'use_snp_selection': False}. Best is trial 77 with value: 0.08732210053952931.
[I 2025-11-03 12:06:53,156] Trial 105 finished with value: 0.0567605607734086 and parameters: {'model_type': 'graphsage', 'hidden_dims': '[512, 256]', 'dropout': 0.18907523392967432, 'batch_norm': True, 'lr': 0.0002632514176328447, 'weight_decay': 4.243027769580955e-05, 'epochs': 46, 'loss': 'mse', 'optimizer': 'adam', 'graph_mode': 'cutoff', 'cutoff': 0.3746095550075402, 'grm_norm': 'gcn', 'self_loops': False, 'use_snp_selection': False}. Best is trial 77 with value: 0.08732210053952931.
[I 2025-11-03 12:06:55,629] Trial 106 finished with value: 0.06042803177998746 and parameters: {'model_type': 'graphsage', 'hidden_dims': '[128, 64]', 'dropout': 0.34143389476670016, 'batch_norm': True, 'lr': 0.0009191127849789596, 'weight_decay': 1.8719373417145673e-05, 'epochs': 339, 'loss': 'mae', 'optimizer': 'adam', 'graph_mode': 'cutoff', 'cutoff': 0.31229392325558625, 'grm_norm': 'gcn', 'self_loops': False, 'use_snp_selection': False}. Best is trial 77 with value: 0.08732210053952931.
[I 2025-11-03 12:06:57,747] Trial 107 finished with value: 0.06140415544912576 and parameters: {'model_type': 'graphsage', 'hidden_dims': '[128, 64]', 'dropout': 0.20898475173220757, 'batch_norm': True, 'lr': 0.0005054978764514649, 'weight_decay': 1.934412738155706e-06, 'epochs': 250, 'loss': 'mse', 'optimizer': 'adam', 'graph_mode': 'cutoff', 'cutoff': 0.2644723135686443, 'grm_norm': 'gcn', 'self_loops': False, 'use_snp_selection': False}. Best is trial 77 with value: 0.08732210053952931.
[I 2025-11-03 12:07:02,170] Trial 108 finished with value: 0.0706881693336817 and parameters: {'model_type': 'graphsage', 'hidden_dims': '[512, 64]', 'dropout': 0.3069990234194949, 'batch_norm': True, 'lr': 0.0001696018839802578, 'weight_decay': 1.0676179551448953e-06, 'epochs': 260, 'loss': 'mse', 'optimizer': 'adam', 'graph_mode': 'cutoff', 'cutoff': 0.34446427484839914, 'grm_norm': 'gcn', 'self_loops': False, 'use_snp_selection': False}. Best is trial 77 with value: 0.08732210053952931.
[I 2025-11-03 12:07:06,849] Trial 109 finished with value: 0.06549318170042469 and parameters: {'model_type': 'graphsage', 'hidden_dims': '[512, 64]', 'dropout': 0.12395150553985322, 'batch_norm': True, 'lr': 0.0007416935931608695, 'weight_decay': 1.0780546731826255e-06, 'epochs': 288, 'loss': 'mse', 'optimizer': 'adam', 'graph_mode': 'cutoff', 'cutoff': 0.3479852688548547, 'grm_norm': 'gcn', 'self_loops': False, 'use_snp_selection': False}. Best is trial 77 with value: 0.08732210053952931.
[I 2025-11-03 12:07:11,258] Trial 110 finished with value: 0.06587449553671831 and parameters: {'model_type': 'graphsage', 'hidden_dims': '[512, 64]', 'dropout': 0.3053959172706516, 'batch_norm': True, 'lr': 0.0005668770090722965, 'weight_decay': 2.666819731029208e-07, 'epochs': 261, 'loss': 'mse', 'optimizer': 'adam', 'graph_mode': 'cutoff', 'cutoff': 0.41811843927948716, 'grm_norm': 'gcn', 'self_loops': False, 'use_snp_selection': False}. Best is trial 77 with value: 0.08732210053952931.
[I 2025-11-03 12:07:15,791] Trial 111 finished with value: 0.06616849831096977 and parameters: {'model_type': 'graphsage', 'hidden_dims': '[512, 64]', 'dropout': 0.2426162082631607, 'batch_norm': True, 'lr': 0.0001876668465512182, 'weight_decay': 5.792176861837086e-07, 'epochs': 272, 'loss': 'mse', 'optimizer': 'adam', 'graph_mode': 'cutoff', 'cutoff': 0.32588858907978796, 'grm_norm': 'none', 'self_loops': False, 'use_snp_selection': False}. Best is trial 77 with value: 0.08732210053952931.
[I 2025-11-03 12:07:18,599] Trial 112 finished with value: 0.05157407209624326 and parameters: {'model_type': 'graphsage', 'hidden_dims': '[256, 128]', 'dropout': 0.31797839814043655, 'batch_norm': True, 'lr': 0.00047353383082576414, 'weight_decay': 3.001666616296149e-06, 'epochs': 257, 'loss': 'mse', 'optimizer': 'adam', 'graph_mode': 'cutoff', 'cutoff': 0.35333669704764575, 'grm_norm': 'gcn', 'self_loops': False, 'use_snp_selection': False}. Best is trial 77 with value: 0.08732210053952931.
[I 2025-11-03 12:07:23,398] Trial 113 finished with value: 0.07135158489699309 and parameters: {'model_type': 'graphsage', 'hidden_dims': '[512, 64]', 'dropout': 0.19348357346369516, 'batch_norm': True, 'lr': 0.00033750303258763226, 'weight_decay': 7.876134644797759e-07, 'epochs': 299, 'loss': 'mse', 'optimizer': 'adam', 'graph_mode': 'cutoff', 'cutoff': 0.43176772150264237, 'grm_norm': 'gcn', 'self_loops': False, 'use_snp_selection': False}. Best is trial 77 with value: 0.08732210053952931.
[I 2025-11-03 12:07:28,343] Trial 114 finished with value: 0.06262570773028461 and parameters: {'model_type': 'graphsage', 'hidden_dims': '[512, 64]', 'dropout': 0.1909789525348784, 'batch_norm': True, 'lr': 0.0003436635629738885, 'weight_decay': 6.877286031906865e-07, 'epochs': 320, 'loss': 'mse', 'optimizer': 'adam', 'graph_mode': 'cutoff', 'cutoff': 0.4354854452384142, 'grm_norm': 'gcn', 'self_loops': False, 'use_snp_selection': False}. Best is trial 77 with value: 0.08732210053952931.
[I 2025-11-03 12:07:33,162] Trial 115 finished with value: 0.06896344699122019 and parameters: {'model_type': 'graphsage', 'hidden_dims': '[512, 64]', 'dropout': 0.2336630652257852, 'batch_norm': True, 'lr': 0.00014776245420523127, 'weight_decay': 6.941792277257217e-05, 'epochs': 305, 'loss': 'mse', 'optimizer': 'adam', 'graph_mode': 'cutoff', 'cutoff': 0.37889486184127186, 'grm_norm': 'gcn', 'self_loops': False, 'use_snp_selection': False}. Best is trial 77 with value: 0.08732210053952931.
[I 2025-11-03 12:07:37,938] Trial 116 finished with value: 0.07097196516909099 and parameters: {'model_type': 'graphsage', 'hidden_dims': '[512, 64]', 'dropout': 0.17036423880223153, 'batch_norm': True, 'lr': 0.0008904180758903986, 'weight_decay': 9.120485536415253e-07, 'epochs': 300, 'loss': 'mse', 'optimizer': 'adam', 'graph_mode': 'cutoff', 'cutoff': 0.49417612051368326, 'grm_norm': 'gcn', 'self_loops': False, 'use_snp_selection': False}. Best is trial 77 with value: 0.08732210053952931.
[I 2025-11-03 12:07:42,746] Trial 117 finished with value: 0.060526929113660484 and parameters: {'model_type': 'graphsage', 'hidden_dims': '[512, 64]', 'dropout': 0.16785236793107344, 'batch_norm': True, 'lr': 0.000991331516706956, 'weight_decay': 8.637754778479634e-07, 'epochs': 302, 'loss': 'mse', 'optimizer': 'adam', 'graph_mode': 'cutoff', 'cutoff': 0.48528617541676455, 'grm_norm': 'none', 'self_loops': False, 'use_snp_selection': False}. Best is trial 77 with value: 0.08732210053952931.
[I 2025-11-03 12:07:47,386] Trial 118 finished with value: 0.04998567489091668 and parameters: {'model_type': 'graphsage', 'hidden_dims': '[512, 64]', 'dropout': 0.14076937596539704, 'batch_norm': True, 'lr': 0.0008765044630394188, 'weight_decay': 1.5834717041379796e-06, 'epochs': 282, 'loss': 'mse', 'optimizer': 'adam', 'graph_mode': 'cutoff', 'cutoff': 0.5393889882299494, 'grm_norm': 'cosine_then_gcn', 'self_loops': False, 'use_snp_selection': False}. Best is trial 77 with value: 0.08732210053952931.
[I 2025-11-03 12:07:52,292] Trial 119 finished with value: 0.03750791456863491 and parameters: {'model_type': 'graphsage', 'hidden_dims': '[512, 64]', 'dropout': 0.17873171524916126, 'batch_norm': True, 'lr': 0.0007284509930285968, 'weight_decay': 9.085876770189819e-07, 'epochs': 317, 'loss': 'mse', 'optimizer': 'adam', 'graph_mode': 'cutoff', 'cutoff': 0.5802064137365862, 'grm_norm': 'gcn', 'self_loops': False, 'use_snp_selection': False}. Best is trial 77 with value: 0.08732210053952931.
[I 2025-11-03 12:07:57,061] Trial 120 finished with value: 0.02930795306383132 and parameters: {'model_type': 'graphsage', 'hidden_dims': '[512, 64]', 'dropout': 0.14737541358958917, 'batch_norm': True, 'lr': 0.00028038469020226416, 'weight_decay': 1.1311256588259566e-06, 'epochs': 298, 'loss': 'mae', 'optimizer': 'adam', 'graph_mode': 'cutoff', 'cutoff': 0.500718588535872, 'grm_norm': 'cosine', 'self_loops': False, 'use_snp_selection': False}. Best is trial 77 with value: 0.08732210053952931.
[I 2025-11-03 12:08:01,736] Trial 121 finished with value: 0.0702100018439448 and parameters: {'model_type': 'graphsage', 'hidden_dims': '[512, 64]', 'dropout': 0.1960205541229595, 'batch_norm': True, 'lr': 0.0006273811642106685, 'weight_decay': 1.2912097849391712e-06, 'epochs': 285, 'loss': 'mse', 'optimizer': 'adam', 'graph_mode': 'cutoff', 'cutoff': 0.445530946583279, 'grm_norm': 'gcn', 'self_loops': False, 'use_snp_selection': False}. Best is trial 77 with value: 0.08732210053952931.
[I 2025-11-03 12:08:06,365] Trial 122 finished with value: 0.05988190089055297 and parameters: {'model_type': 'graphsage', 'hidden_dims': '[512, 64]', 'dropout': 0.1574427654815615, 'batch_norm': True, 'lr': 0.00040927254547873837, 'weight_decay': 7.073538225949863e-07, 'epochs': 285, 'loss': 'mse', 'optimizer': 'adam', 'graph_mode': 'cutoff', 'cutoff': 0.44272822213323876, 'grm_norm': 'gcn', 'self_loops': False, 'use_snp_selection': False}. Best is trial 77 with value: 0.08732210053952931.
[I 2025-11-03 12:08:11,067] Trial 123 finished with value: 0.06023033008695308 and parameters: {'model_type': 'graphsage', 'hidden_dims': '[512, 64]', 'dropout': 0.16779559220059853, 'batch_norm': True, 'lr': 0.0005330447520336447, 'weight_decay': 1.2908308257549142e-06, 'epochs': 293, 'loss': 'mse', 'optimizer': 'adam', 'graph_mode': 'cutoff', 'cutoff': 0.4281883692812132, 'grm_norm': 'gcn', 'self_loops': False, 'use_snp_selection': False}. Best is trial 77 with value: 0.08732210053952931.
[I 2025-11-03 12:08:16,100] Trial 124 finished with value: 0.047522609398891 and parameters: {'model_type': 'graphsage', 'hidden_dims': '[512, 64]', 'dropout': 0.21818120562294946, 'batch_norm': True, 'lr': 0.0006703291847933956, 'weight_decay': 2.327888982228793e-06, 'epochs': 328, 'loss': 'mse', 'optimizer': 'adam', 'graph_mode': 'cutoff', 'cutoff': 0.4568731306357469, 'grm_norm': 'cosine_then_gcn', 'self_loops': False, 'use_snp_selection': False}. Best is trial 77 with value: 0.08732210053952931.
[I 2025-11-03 12:08:20,901] Trial 125 finished with value: 0.06387830709017371 and parameters: {'model_type': 'graphsage', 'hidden_dims': '[512, 64]', 'dropout': 0.19529387316621916, 'batch_norm': True, 'lr': 0.0008355696926169033, 'weight_decay': 3.0947992850783336e-07, 'epochs': 303, 'loss': 'mse', 'optimizer': 'adam', 'graph_mode': 'cutoff', 'cutoff': 0.39629058697124847, 'grm_norm': 'gcn', 'self_loops': True, 'use_snp_selection': False}. Best is trial 77 with value: 0.08732210053952931.
[I 2025-11-03 12:08:23,939] Trial 126 finished with value: 0.04967953462507543 and parameters: {'model_type': 'graphsage', 'hidden_dims': '[256, 128]', 'dropout': 0.13234163839380564, 'batch_norm': True, 'lr': 3.639501701514669e-05, 'weight_decay': 4.944711082115322e-07, 'epochs': 314, 'loss': 'mse', 'optimizer': 'adam', 'graph_mode': 'cutoff', 'cutoff': 0.5092004249454937, 'grm_norm': 'gcn', 'self_loops': False, 'use_snp_selection': False}. Best is trial 77 with value: 0.08732210053952931.
[I 2025-11-03 12:08:26,536] Trial 127 finished with value: 0.06881203030769285 and parameters: {'model_type': 'graphsage', 'hidden_dims': '[512, 64]', 'dropout': 0.1775207759265085, 'batch_norm': True, 'lr': 0.0004506079782236918, 'weight_decay': 1.7028722366908779e-06, 'epochs': 58, 'loss': 'mse', 'optimizer': 'adam', 'graph_mode': 'cutoff', 'cutoff': 0.3670283116009904, 'grm_norm': 'cosine_then_gcn', 'self_loops': True, 'use_snp_selection': False}. Best is trial 77 with value: 0.08732210053952931.
[I 2025-11-03 12:08:31,537] Trial 128 finished with value: 0.059337664101797354 and parameters: {'model_type': 'graphsage', 'hidden_dims': '[512, 256]', 'dropout': 0.11649426879096689, 'batch_norm': True, 'lr': 0.0003624183752110181, 'weight_decay': 1.3746036967153799e-06, 'epochs': 324, 'loss': 'mse', 'optimizer': 'adam', 'graph_mode': 'cutoff', 'cutoff': 0.40391815385619406, 'grm_norm': 'gcn', 'self_loops': False, 'use_snp_selection': False}. Best is trial 77 with value: 0.08732210053952931.
[I 2025-11-03 12:08:34,717] Trial 129 finished with value: 0.07325896048716005 and parameters: {'model_type': 'graphsage', 'hidden_dims': '[256, 128]', 'dropout': 0.25406801990952443, 'batch_norm': True, 'lr': 0.0006074589302477587, 'weight_decay': 5.510777412045283e-07, 'epochs': 336, 'loss': 'mse', 'optimizer': 'adam', 'graph_mode': 'cutoff', 'cutoff': 0.4638028709145206, 'grm_norm': 'gcn', 'self_loops': False, 'use_snp_selection': False}. Best is trial 77 with value: 0.08732210053952931.
