[I 2025-11-03 12:22:59,306] Trial 144 finished with value: 0.040554515338083644 and parameters: {'model_type': 'gcn', 'hidden_dims': '[128, 64]', 'dropout': 0.4765960177604476, 'batch_norm': True, 'lr': 5.8685075403685335e-05, 'weight_decay': 8.863262214825247e-05, 'epochs': 249, 'loss': 'mse', 'optimizer': 'adam', 'graph_mode': 'off', 'use_snp_selection': True, 'num_snps': 18475}. Best is trial 140 with value: 0.09761039542478162.
[I 2025-11-03 12:23:00,564] Trial 145 finished with value: 0.07182306596301279 and parameters: {'model_type': 'gcn', 'hidden_dims': '[128, 64]', 'dropout': 0.599045265767069, 'batch_norm': True, 'lr': 0.0007695574584713471, 'weight_decay': 0.00015195793261641143, 'epochs': 285, 'loss': 'mse', 'optimizer': 'adam', 'graph_mode': 'off', 'use_snp_selection': True, 'num_snps': 11182}. Best is trial 140 with value: 0.09761039542478162.
[I 2025-11-03 12:23:01,933] Trial 146 finished with value: 0.08701553082840786 and parameters: {'model_type': 'gcn', 'hidden_dims': '[128, 64]', 'dropout': 0.4074010934428137, 'batch_norm': True, 'lr': 0.0005713667746717947, 'weight_decay': 2.932060141054375e-05, 'epochs': 297, 'loss': 'mse', 'optimizer': 'adam', 'graph_mode': 'off', 'use_snp_selection': True, 'num_snps': 14147}. Best is trial 140 with value: 0.09761039542478162.
[I 2025-11-03 12:23:03,266] Trial 147 finished with value: 0.0869804412150537 and parameters: {'model_type': 'gcn', 'hidden_dims': '[128, 64]', 'dropout': 0.4085432715348274, 'batch_norm': True, 'lr': 0.000508006834210448, 'weight_decay': 4.2666746085626766e-05, 'epochs': 295, 'loss': 'mse', 'optimizer': 'adam', 'graph_mode': 'off', 'use_snp_selection': True, 'num_snps': 13661}. Best is trial 140 with value: 0.09761039542478162.
[I 2025-11-03 12:23:04,462] Trial 148 finished with value: 0.07366742551312394 and parameters: {'model_type': 'gcn', 'hidden_dims': '[128, 64]', 'dropout': 0.4077760196457868, 'batch_norm': True, 'lr': 0.0004923351994067998, 'weight_decay': 4.2008697619404384e-05, 'epochs': 293, 'loss': 'mse', 'optimizer': 'adam', 'graph_mode': 'off', 'use_snp_selection': True, 'num_snps': 6191}. Best is trial 140 with value: 0.09761039542478162.
[I 2025-11-03 12:23:05,808] Trial 149 finished with value: 0.07296569442528698 and parameters: {'model_type': 'gcn', 'hidden_dims': '[128, 64]', 'dropout': 0.39070061586074645, 'batch_norm': True, 'lr': 0.0005427701307291906, 'weight_decay': 3.367037589483876e-05, 'epochs': 302, 'loss': 'mse', 'optimizer': 'adam', 'graph_mode': 'off', 'use_snp_selection': True, 'num_snps': 12707}. Best is trial 140 with value: 0.09761039542478162.
[I 2025-11-03 12:23:07,829] Trial 0 finished with value: -0.051240411189079765 and parameters: {'model_type': 'gcn', 'hidden_dims': '[128, 64]', 'dropout': 0.199031432379812, 'batch_norm': True, 'lr': 1.8408544111075837e-06, 'weight_decay': 5.5136510071208614e-05, 'epochs': 336, 'loss': 'mae', 'optimizer': 'adam', 'graph_mode': 'off', 'use_snp_selection': True, 'num_snps': 43862}. Best is trial 0 with value: -0.051240411189079765.
[I 2025-11-03 12:23:09,233] Trial 1 finished with value: 0.0256894718132218 and parameters: {'model_type': 'gcn', 'hidden_dims': '[256, 128]', 'dropout': 0.4370668075331726, 'batch_norm': True, 'lr': 7.133471581159139e-05, 'weight_decay': 1.128633586803549e-05, 'epochs': 242, 'loss': 'mae', 'optimizer': 'adam', 'graph_mode': 'off', 'use_snp_selection': False}. Best is trial 1 with value: 0.0256894718132218.
[I 2025-11-03 12:23:10,290] Trial 2 finished with value: -0.00838678769812017 and parameters: {'model_type': 'gcn', 'hidden_dims': '[256, 128, 64]', 'dropout': 0.41314357415569625, 'batch_norm': False, 'lr': 3.952233718592101e-06, 'weight_decay': 0.00026754769258252603, 'epochs': 149, 'loss': 'mse', 'optimizer': 'adam', 'graph_mode': 'off', 'use_snp_selection': True, 'num_snps': 11571}. Best is trial 1 with value: 0.0256894718132218.
[I 2025-11-03 12:23:12,576] Trial 3 finished with value: 0.020320343349689414 and parameters: {'model_type': 'gcn', 'hidden_dims': '[512, 64]', 'dropout': 0.5938127374509361, 'batch_norm': False, 'lr': 5.67704586114731e-06, 'weight_decay': 2.4518087630137052e-05, 'epochs': 320, 'loss': 'mae', 'optimizer': 'adam', 'graph_mode': 'off', 'use_snp_selection': False}. Best is trial 1 with value: 0.0256894718132218.
[I 2025-11-03 12:23:14,755] Trial 4 finished with value: 0.04612202631284733 and parameters: {'model_type': 'gcn', 'hidden_dims': '[512, 128]', 'dropout': 0.25746343592134413, 'batch_norm': True, 'lr': 1.3467657668402788e-06, 'weight_decay': 0.00033087251918647806, 'epochs': 277, 'loss': 'mse', 'optimizer': 'adam', 'graph_mode': 'off', 'use_snp_selection': True, 'num_snps': 36675}. Best is trial 4 with value: 0.04612202631284733.
[I 2025-11-03 12:23:16,335] Trial 5 finished with value: 0.02605205070706442 and parameters: {'model_type': 'gcn', 'hidden_dims': '[512, 64]', 'dropout': 0.38275350994408375, 'batch_norm': True, 'lr': 1.5586664309232824e-06, 'weight_decay': 0.0008227664668621182, 'epochs': 145, 'loss': 'mae', 'optimizer': 'adam', 'graph_mode': 'off', 'use_snp_selection': True, 'num_snps': 32148}. Best is trial 4 with value: 0.04612202631284733.
[I 2025-11-03 12:23:17,541] Trial 6 finished with value: -0.015350817011181453 and parameters: {'model_type': 'gcn', 'hidden_dims': '[256, 128]', 'dropout': 0.3930109900265879, 'batch_norm': False, 'lr': 4.892964372128395e-05, 'weight_decay': 1.5809549317992182e-06, 'epochs': 199, 'loss': 'mse', 'optimizer': 'adam', 'graph_mode': 'off', 'use_snp_selection': False}. Best is trial 4 with value: 0.04612202631284733.
[I 2025-11-03 12:23:18,808] Trial 7 finished with value: 0.04470100795317291 and parameters: {'model_type': 'gcn', 'hidden_dims': '[512, 256]', 'dropout': 0.15343979219678458, 'batch_norm': True, 'lr': 6.234003099047341e-05, 'weight_decay': 3.894760610535477e-07, 'epochs': 97, 'loss': 'mse', 'optimizer': 'adam', 'graph_mode': 'off', 'use_snp_selection': False}. Best is trial 4 with value: 0.04612202631284733.
[I 2025-11-03 12:23:21,226] Trial 8 finished with value: 0.042062863164087465 and parameters: {'model_type': 'gcn', 'hidden_dims': '[512, 128]', 'dropout': 0.10743001231661406, 'batch_norm': True, 'lr': 0.00023728538449271062, 'weight_decay': 1.7629071578048637e-05, 'epochs': 312, 'loss': 'mae', 'optimizer': 'adam', 'graph_mode': 'off', 'use_snp_selection': False}. Best is trial 4 with value: 0.04612202631284733.
[I 2025-11-03 12:23:22,855] Trial 9 finished with value: 0.0339243738453455 and parameters: {'model_type': 'gcn', 'hidden_dims': '[512, 64]', 'dropout': 0.14505336736221927, 'batch_norm': True, 'lr': 5.8619638388111826e-05, 'weight_decay': 6.200156172669308e-07, 'epochs': 175, 'loss': 'mse', 'optimizer': 'adam', 'graph_mode': 'off', 'use_snp_selection': False}. Best is trial 4 with value: 0.04612202631284733.
[I 2025-11-03 12:23:25,570] Trial 10 finished with value: 0.026279117327687465 and parameters: {'model_type': 'gcn', 'hidden_dims': '[512, 128]', 'dropout': 0.2549147281275221, 'batch_norm': False, 'lr': 1.080428984628536e-05, 'weight_decay': 0.00013977662613780072, 'epochs': 256, 'loss': 'mse', 'optimizer': 'adam', 'graph_mode': 'off', 'use_snp_selection': True, 'num_snps': 57847}. Best is trial 4 with value: 0.04612202631284733.
[I 2025-11-03 12:23:26,229] Trial 11 finished with value: 0.05075919987446284 and parameters: {'model_type': 'gcn', 'hidden_dims': '[512, 256]', 'dropout': 0.2800596885478351, 'batch_norm': True, 'lr': 0.0008017090021055314, 'weight_decay': 2.2708492465287616e-06, 'epochs': 46, 'loss': 'mse', 'optimizer': 'adam', 'graph_mode': 'off', 'use_snp_selection': True, 'num_snps': 7093}. Best is trial 11 with value: 0.05075919987446284.
[I 2025-11-03 12:23:26,930] Trial 12 finished with value: 0.042455354605329884 and parameters: {'model_type': 'gcn', 'hidden_dims': '[512, 256]', 'dropout': 0.28681524965375393, 'batch_norm': True, 'lr': 0.0007231873509640611, 'weight_decay': 2.6699378773244137e-06, 'epochs': 41, 'loss': 'mse', 'optimizer': 'adam', 'graph_mode': 'off', 'use_snp_selection': True, 'num_snps': 10357}. Best is trial 11 with value: 0.05075919987446284.
[I 2025-11-03 12:23:28,747] Trial 13 finished with value: 0.0666259936569183 and parameters: {'model_type': 'gcn', 'hidden_dims': '[512, 256]', 'dropout': 0.3112170219239623, 'batch_norm': True, 'lr': 1.5854582165352368e-05, 'weight_decay': 1.3917882897272238e-07, 'epochs': 262, 'loss': 'mse', 'optimizer': 'adam', 'graph_mode': 'off', 'use_snp_selection': True, 'num_snps': 28233}. Best is trial 13 with value: 0.0666259936569183.
[I 2025-11-03 12:23:29,329] Trial 14 finished with value: 0.015836760520953327 and parameters: {'model_type': 'gcn', 'hidden_dims': '[512, 256]', 'dropout': 0.32662394773489983, 'batch_norm': True, 'lr': 2.197688923999646e-05, 'weight_decay': 1.3497435491125087e-07, 'epochs': 43, 'loss': 'mse', 'optimizer': 'adam', 'graph_mode': 'off', 'use_snp_selection': True, 'num_snps': 3476}. Best is trial 13 with value: 0.0666259936569183.
[I 2025-11-03 12:23:30,702] Trial 15 finished with value: 0.0547770129415597 and parameters: {'model_type': 'gcn', 'hidden_dims': '[512, 256]', 'dropout': 0.4912941942099374, 'batch_norm': True, 'lr': 0.0009322090391033168, 'weight_decay': 1.303577291749503e-07, 'epochs': 216, 'loss': 'mse', 'optimizer': 'adam', 'graph_mode': 'off', 'use_snp_selection': True, 'num_snps': 18607}. Best is trial 13 with value: 0.0666259936569183.
[I 2025-11-03 12:23:32,076] Trial 16 finished with value: 0.08131540450815136 and parameters: {'model_type': 'gcn', 'hidden_dims': '[512, 256]', 'dropout': 0.5244873324993468, 'batch_norm': True, 'lr': 0.0001443770290019885, 'weight_decay': 1.0482369643047958e-07, 'epochs': 222, 'loss': 'mse', 'optimizer': 'adam', 'graph_mode': 'off', 'use_snp_selection': True, 'num_snps': 18139}. Best is trial 16 with value: 0.08131540450815136.
[I 2025-11-03 12:23:33,582] Trial 17 finished with value: 0.00937101127114333 and parameters: {'model_type': 'gcn', 'hidden_dims': '[128, 64]', 'dropout': 0.5563747502045611, 'batch_norm': True, 'lr': 0.0001182043577940801, 'weight_decay': 6.165876508510631e-07, 'epochs': 274, 'loss': 'mse', 'optimizer': 'adam', 'graph_mode': 'off', 'use_snp_selection': True, 'num_snps': 24613}. Best is trial 16 with value: 0.08131540450815136.
[I 2025-11-03 12:23:35,079] Trial 18 finished with value: 0.016620258995688832 and parameters: {'model_type': 'gcn', 'hidden_dims': '[256, 128, 64]', 'dropout': 0.47627753018274765, 'batch_norm': False, 'lr': 1.8677439282146575e-05, 'weight_decay': 1.1311390835460124e-07, 'epochs': 230, 'loss': 'mse', 'optimizer': 'adam', 'graph_mode': 'off', 'use_snp_selection': True, 'num_snps': 21632}. Best is trial 16 with value: 0.08131540450815136.
[I 2025-11-03 12:23:37,662] Trial 19 finished with value: 0.05997383927440833 and parameters: {'model_type': 'gcn', 'hidden_dims': '[512, 256]', 'dropout': 0.34056005706667425, 'batch_norm': True, 'lr': 0.0002491294915770103, 'weight_decay': 2.707738080163954e-07, 'epochs': 292, 'loss': 'mse', 'optimizer': 'adam', 'graph_mode': 'off', 'use_snp_selection': True, 'num_snps': 45180}. Best is trial 16 with value: 0.08131540450815136.
[I 2025-11-03 12:23:39,213] Trial 20 finished with value: 0.05607867425844485 and parameters: {'model_type': 'gcn', 'hidden_dims': '[512, 256]', 'dropout': 0.506064761551703, 'batch_norm': True, 'lr': 0.0001993385077355656, 'weight_decay': 4.940792000646761e-06, 'epochs': 176, 'loss': 'mse', 'optimizer': 'adam', 'graph_mode': 'off', 'use_snp_selection': True, 'num_snps': 27343}. Best is trial 16 with value: 0.08131540450815136.
[I 2025-11-03 12:23:41,811] Trial 21 finished with value: 0.054495774673764846 and parameters: {'model_type': 'gcn', 'hidden_dims': '[512, 256]', 'dropout': 0.33842624633505936, 'batch_norm': True, 'lr': 0.0003778643108943882, 'weight_decay': 2.635983566590209e-07, 'epochs': 294, 'loss': 'mse', 'optimizer': 'adam', 'graph_mode': 'off', 'use_snp_selection': True, 'num_snps': 44881}. Best is trial 16 with value: 0.08131540450815136.
[I 2025-11-03 12:23:44,127] Trial 22 finished with value: 0.05609055336593906 and parameters: {'model_type': 'gcn', 'hidden_dims': '[512, 256]', 'dropout': 0.35295930075372955, 'batch_norm': True, 'lr': 0.000140508036963022, 'weight_decay': 2.6005657655389394e-07, 'epochs': 273, 'loss': 'mse', 'optimizer': 'adam', 'graph_mode': 'off', 'use_snp_selection': True, 'num_snps': 40450}. Best is trial 16 with value: 0.08131540450815136.
[I 2025-11-03 12:23:47,295] Trial 23 finished with value: 0.04259032494921121 and parameters: {'model_type': 'gcn', 'hidden_dims': '[512, 256]', 'dropout': 0.30743469495371856, 'batch_norm': True, 'lr': 0.0003794364950317055, 'weight_decay': 1.0412355698193187e-06, 'epochs': 348, 'loss': 'mse', 'optimizer': 'adam', 'graph_mode': 'off', 'use_snp_selection': True, 'num_snps': 54605}. Best is trial 16 with value: 0.08131540450815136.
[I 2025-11-03 12:23:48,732] Trial 24 finished with value: 0.017628042638405245 and parameters: {'model_type': 'gcn', 'hidden_dims': '[512, 256]', 'dropout': 0.21422418006443147, 'batch_norm': True, 'lr': 3.2192676724011476e-05, 'weight_decay': 1.0290552703442587e-07, 'epochs': 251, 'loss': 'mse', 'optimizer': 'adam', 'graph_mode': 'off', 'use_snp_selection': True, 'num_snps': 17013}. Best is trial 16 with value: 0.08131540450815136.
[I 2025-11-03 12:23:50,863] Trial 25 finished with value: 0.02138278767548764 and parameters: {'model_type': 'gcn', 'hidden_dims': '[512, 256]', 'dropout': 0.42577498040171435, 'batch_norm': True, 'lr': 1.0861964952737303e-05, 'weight_decay': 2.671168248161866e-07, 'epochs': 300, 'loss': 'mse', 'optimizer': 'adam', 'graph_mode': 'off', 'use_snp_selection': True, 'num_snps': 31779}. Best is trial 16 with value: 0.08131540450815136.
[I 2025-11-03 12:23:52,591] Trial 26 finished with value: 0.008318412561943676 and parameters: {'model_type': 'gcn', 'hidden_dims': '[128, 64]', 'dropout': 0.361577188213021, 'batch_norm': False, 'lr': 0.00011300567171061009, 'weight_decay': 7.686680450993178e-07, 'epochs': 213, 'loss': 'mae', 'optimizer': 'adam', 'graph_mode': 'off', 'use_snp_selection': True, 'num_snps': 46950}. Best is trial 16 with value: 0.08131540450815136.
[I 2025-11-03 12:23:54,887] Trial 27 finished with value: 0.04245690583143922 and parameters: {'model_type': 'gcn', 'hidden_dims': '[256, 128, 64]', 'dropout': 0.4532750443271342, 'batch_norm': True, 'lr': 0.00030146826793033346, 'weight_decay': 3.523820686403327e-07, 'epochs': 230, 'loss': 'mse', 'optimizer': 'adam', 'graph_mode': 'off', 'use_snp_selection': True, 'num_snps': 51210}. Best is trial 16 with value: 0.08131540450815136.
[I 2025-11-03 12:23:56,743] Trial 28 finished with value: 0.006973332944074246 and parameters: {'model_type': 'gcn', 'hidden_dims': '[256, 128]', 'dropout': 0.5476699491509148, 'batch_norm': True, 'lr': 1.1851000852242448e-05, 'weight_decay': 4.60519947660896e-06, 'epochs': 285, 'loss': 'mse', 'optimizer': 'adam', 'graph_mode': 'off', 'use_snp_selection': True, 'num_snps': 36145}. Best is trial 16 with value: 0.08131540450815136.
[I 2025-11-03 12:23:58,228] Trial 29 finished with value: 0.05184348639829161 and parameters: {'model_type': 'gcn', 'hidden_dims': '[128, 64]', 'dropout': 0.22574715467172418, 'batch_norm': True, 'lr': 3.7408496867236307e-06, 'weight_decay': 5.454450348581608e-05, 'epochs': 327, 'loss': 'mae', 'optimizer': 'adam', 'graph_mode': 'off', 'use_snp_selection': True, 'num_snps': 15395}. Best is trial 16 with value: 0.08131540450815136.
[I 2025-11-03 12:24:00,052] Trial 30 finished with value: 0.018700502248720954 and parameters: {'model_type': 'gcn', 'hidden_dims': '[512, 256]', 'dropout': 0.3816913667977301, 'batch_norm': True, 'lr': 3.455480085967043e-05, 'weight_decay': 2.029085653048749e-07, 'epochs': 257, 'loss': 'mse', 'optimizer': 'adam', 'graph_mode': 'off', 'use_snp_selection': True, 'num_snps': 28748}. Best is trial 16 with value: 0.08131540450815136.
[I 2025-11-03 12:24:02,350] Trial 31 finished with value: 0.04077073031834341 and parameters: {'model_type': 'gcn', 'hidden_dims': '[512, 256]', 'dropout': 0.34838554109114533, 'batch_norm': True, 'lr': 0.0001017355587120885, 'weight_decay': 2.0450632216673578e-07, 'epochs': 271, 'loss': 'mse', 'optimizer': 'adam', 'graph_mode': 'off', 'use_snp_selection': True, 'num_snps': 39528}. Best is trial 16 with value: 0.08131540450815136.
[I 2025-11-03 12:24:04,590] Trial 32 finished with value: 0.060513493443778064 and parameters: {'model_type': 'gcn', 'hidden_dims': '[512, 256]', 'dropout': 0.3131379020917908, 'batch_norm': True, 'lr': 0.00017052551677095533, 'weight_decay': 4.3770157376787126e-07, 'epochs': 238, 'loss': 'mse', 'optimizer': 'adam', 'graph_mode': 'off', 'use_snp_selection': True, 'num_snps': 40751}. Best is trial 16 with value: 0.08131540450815136.
[I 2025-11-03 12:24:07,095] Trial 33 finished with value: 0.038076026203281904 and parameters: {'model_type': 'gcn', 'hidden_dims': '[512, 256]', 'dropout': 0.3080210677953946, 'batch_norm': True, 'lr': 0.0002062579972534823, 'weight_decay': 4.5212131751660276e-07, 'epochs': 238, 'loss': 'mse', 'optimizer': 'adam', 'graph_mode': 'off', 'use_snp_selection': True, 'num_snps': 49881}. Best is trial 16 with value: 0.08131540450815136.
[I 2025-11-03 12:24:08,324] Trial 34 finished with value: 0.050613762707511285 and parameters: {'model_type': 'gcn', 'hidden_dims': '[256, 128]', 'dropout': 0.2392921075543053, 'batch_norm': True, 'lr': 0.0005168439718817525, 'weight_decay': 9.912118638375685e-07, 'epochs': 188, 'loss': 'mae', 'optimizer': 'adam', 'graph_mode': 'off', 'use_snp_selection': False}. Best is trial 16 with value: 0.08131540450815136.
[I 2025-11-03 12:24:10,040] Trial 35 finished with value: 0.04452925822277117 and parameters: {'model_type': 'gcn', 'hidden_dims': '[512, 256]', 'dropout': 0.2801452461108629, 'batch_norm': False, 'lr': 0.00016571240901650522, 'weight_decay': 1.746162189132538e-07, 'epochs': 303, 'loss': 'mse', 'optimizer': 'adam', 'graph_mode': 'off', 'use_snp_selection': True, 'num_snps': 22463}. Best is trial 16 with value: 0.08131540450815136.
[I 2025-11-03 12:24:11,901] Trial 36 finished with value: 0.016199529981250856 and parameters: {'model_type': 'gcn', 'hidden_dims': '[512, 64]', 'dropout': 0.1909538705613129, 'batch_norm': True, 'lr': 9.737536013488874e-05, 'weight_decay': 1.4354606495204684e-06, 'epochs': 213, 'loss': 'mse', 'optimizer': 'adam', 'graph_mode': 'off', 'use_snp_selection': True, 'num_snps': 34014}. Best is trial 16 with value: 0.08131540450815136.
[I 2025-11-03 12:24:13,632] Trial 37 finished with value: 0.027675678551591844 and parameters: {'model_type': 'gcn', 'hidden_dims': '[256, 128, 64]', 'dropout': 0.4076512775220662, 'batch_norm': True, 'lr': 5.85782311056397e-06, 'weight_decay': 5.703340573940474e-07, 'epochs': 147, 'loss': 'mae', 'optimizer': 'adam', 'graph_mode': 'off', 'use_snp_selection': True, 'num_snps': 40954}. Best is trial 16 with value: 0.08131540450815136.
[I 2025-11-03 12:24:15,549] Trial 38 finished with value: 0.024674886938367377 and parameters: {'model_type': 'gcn', 'hidden_dims': '[512, 256]', 'dropout': 0.3151011931647523, 'batch_norm': False, 'lr': 4.262346833868764e-05, 'weight_decay': 1.0096836616722684e-07, 'epochs': 245, 'loss': 'mse', 'optimizer': 'adam', 'graph_mode': 'off', 'use_snp_selection': False}. Best is trial 16 with value: 0.08131540450815136.
[I 2025-11-03 12:24:18,402] Trial 39 finished with value: -0.01884216315234929 and parameters: {'model_type': 'gcn', 'hidden_dims': '[512, 128]', 'dropout': 0.4563721104309256, 'batch_norm': True, 'lr': 6.925369382437525e-05, 'weight_decay': 3.887252506204867e-07, 'epochs': 329, 'loss': 'mse', 'optimizer': 'adam', 'graph_mode': 'off', 'use_snp_selection': True, 'num_snps': 47500}. Best is trial 16 with value: 0.08131540450815136.
[I 2025-11-03 12:24:19,392] Trial 40 finished with value: -0.020340896105726307 and parameters: {'model_type': 'gcn', 'hidden_dims': '[256, 128]', 'dropout': 0.37608763812775486, 'batch_norm': True, 'lr': 2.1205216552894206e-05, 'weight_decay': 8.843324677443132e-06, 'epochs': 113, 'loss': 'mae', 'optimizer': 'adam', 'graph_mode': 'off', 'use_snp_selection': False}. Best is trial 16 with value: 0.08131540450815136.
[I 2025-11-03 12:24:21,830] Trial 41 finished with value: 0.000498166453835019 and parameters: {'model_type': 'gcn', 'hidden_dims': '[512, 256]', 'dropout': 0.3548092823514106, 'batch_norm': True, 'lr': 0.0001365093667751405, 'weight_decay': 2.5352375862943366e-07, 'epochs': 269, 'loss': 'mse', 'optimizer': 'adam', 'graph_mode': 'off', 'use_snp_selection': True, 'num_snps': 41563}. Best is trial 16 with value: 0.08131540450815136.
[I 2025-11-03 12:24:24,101] Trial 42 finished with value: 0.05765347686366071 and parameters: {'model_type': 'gcn', 'hidden_dims': '[512, 256]', 'dropout': 0.18666431653208768, 'batch_norm': True, 'lr': 0.0005391465740520679, 'weight_decay': 1.7502435175482674e-07, 'epochs': 284, 'loss': 'mse', 'optimizer': 'adam', 'graph_mode': 'off', 'use_snp_selection': True, 'num_snps': 38498}. Best is trial 16 with value: 0.08131540450815136.
[I 2025-11-03 12:24:26,439] Trial 43 finished with value: 0.04358506494284442 and parameters: {'model_type': 'gcn', 'hidden_dims': '[512, 256]', 'dropout': 0.1635815531712681, 'batch_norm': True, 'lr': 0.0006259027755940603, 'weight_decay': 1.5933583122628717e-07, 'epochs': 312, 'loss': 'mse', 'optimizer': 'adam', 'graph_mode': 'off', 'use_snp_selection': True, 'num_snps': 37439}. Best is trial 16 with value: 0.08131540450815136.
[I 2025-11-03 12:24:28,854] Trial 44 finished with value: 0.03785467990443466 and parameters: {'model_type': 'gcn', 'hidden_dims': '[512, 64]', 'dropout': 0.19458325777771437, 'batch_norm': True, 'lr': 0.0004784460042211745, 'weight_decay': 3.768796873619619e-07, 'epochs': 262, 'loss': 'mse', 'optimizer': 'adam', 'graph_mode': 'off', 'use_snp_selection': True, 'num_snps': 44181}. Best is trial 16 with value: 0.08131540450815136.
