[I 2025-11-03 13:01:50,920] Trial 80 finished with value: 0.017572008670277344 and parameters: {'model_type': 'graphsage', 'hidden_dims': '[512, 128]', 'dropout': 0.5399214938147396, 'batch_norm': True, 'lr': 0.0006137851681292946, 'weight_decay': 3.9454204113585104e-07, 'epochs': 197, 'loss': 'mse', 'optimizer': 'adam', 'graph_mode': 'cutoff', 'cutoff': 0.3435220695861523, 'grm_norm': 'cosine', 'self_loops': True, 'use_snp_selection': False}. Best is trial 64 with value: 0.043560982615975505.
[I 2025-11-03 13:01:55,710] Trial 81 finished with value: 0.03707258440555175 and parameters: {'model_type': 'graphsage', 'hidden_dims': '[512, 64]', 'dropout': 0.5834767222858169, 'batch_norm': True, 'lr': 0.0008834057029866942, 'weight_decay': 2.4809125279833558e-06, 'epochs': 218, 'loss': 'mse', 'optimizer': 'adam', 'graph_mode': 'cutoff', 'cutoff': 0.22801993097222836, 'grm_norm': 'cosine', 'self_loops': True, 'use_snp_selection': False}. Best is trial 64 with value: 0.043560982615975505.
[I 2025-11-03 13:02:00,815] Trial 82 finished with value: 0.03082543930315493 and parameters: {'model_type': 'graphsage', 'hidden_dims': '[512, 64]', 'dropout': 0.5707689599514447, 'batch_norm': True, 'lr': 0.0007199579808653801, 'weight_decay': 1.9342005775869065e-06, 'epochs': 289, 'loss': 'mse', 'optimizer': 'adam', 'graph_mode': 'cutoff', 'cutoff': 0.45537500112381835, 'grm_norm': 'cosine', 'self_loops': True, 'use_snp_selection': False}. Best is trial 64 with value: 0.043560982615975505.
[I 2025-11-03 13:02:02,570] Trial 83 finished with value: -0.001933583976896187 and parameters: {'model_type': 'graphsage', 'hidden_dims': '[128, 64]', 'dropout': 0.5956633684137571, 'batch_norm': True, 'lr': 2.7512482816747317e-05, 'weight_decay': 4.096392402384624e-06, 'epochs': 120, 'loss': 'mse', 'optimizer': 'adam', 'graph_mode': 'cutoff', 'cutoff': 0.3016238295105007, 'grm_norm': 'cosine', 'self_loops': True, 'use_snp_selection': False}. Best is trial 64 with value: 0.043560982615975505.
[I 2025-11-03 13:02:08,740] Trial 84 finished with value: 0.027932816927938302 and parameters: {'model_type': 'graphsage', 'hidden_dims': '[512, 256]', 'dropout': 0.5588206783554248, 'batch_norm': True, 'lr': 1.3151983900963192e-05, 'weight_decay': 7.967629648309359e-07, 'epochs': 349, 'loss': 'mse', 'optimizer': 'adam', 'graph_mode': 'cutoff', 'cutoff': 0.26876341183033403, 'grm_norm': 'cosine', 'self_loops': True, 'use_snp_selection': False}. Best is trial 64 with value: 0.043560982615975505.
[I 2025-11-03 13:02:11,684] Trial 85 finished with value: 0.03141444588337382 and parameters: {'model_type': 'graphsage', 'hidden_dims': '[256, 128]', 'dropout': 0.2907732310724432, 'batch_norm': True, 'lr': 7.591246098514445e-05, 'weight_decay': 6.957711707912599e-06, 'epochs': 237, 'loss': 'mse', 'optimizer': 'adam', 'graph_mode': 'cutoff', 'cutoff': 0.3976183300976373, 'grm_norm': 'cosine', 'self_loops': True, 'use_snp_selection': False}. Best is trial 64 with value: 0.043560982615975505.
[I 2025-11-03 13:02:14,936] Trial 86 finished with value: 0.01391536632979681 and parameters: {'model_type': 'graphsage', 'hidden_dims': '[512, 128]', 'dropout': 0.4986063118048035, 'batch_norm': True, 'lr': 0.00012765721319323616, 'weight_decay': 9.63427791864443e-06, 'epochs': 96, 'loss': 'mse', 'optimizer': 'adam', 'graph_mode': 'knn', 'source': 'grm', 'knn_k': 9, 'weighted_edges': True, 'symmetrize_mode': 'mutual', 'use_snp_selection': False}. Best is trial 64 with value: 0.043560982615975505.
[I 2025-11-03 13:02:20,455] Trial 87 finished with value: 0.027876752216034053 and parameters: {'model_type': 'graphsage', 'hidden_dims': '[512, 64]', 'dropout': 0.14026385052202797, 'batch_norm': False, 'lr': 0.0007734246997088691, 'weight_decay': 1.1783905130045533e-07, 'epochs': 270, 'loss': 'mae', 'optimizer': 'adam', 'graph_mode': 'cutoff', 'cutoff': 0.6990418283157128, 'grm_norm': 'gcn', 'self_loops': False, 'use_snp_selection': True, 'num_snps': 50914}. Best is trial 64 with value: 0.043560982615975505.
[I 2025-11-03 13:02:25,530] Trial 88 finished with value: 0.033439919051146245 and parameters: {'model_type': 'graphsage', 'hidden_dims': '[512, 128]', 'dropout': 0.5999886002412992, 'batch_norm': True, 'lr': 0.00026421236310372373, 'weight_decay': 1.7249552184542676e-07, 'epochs': 258, 'loss': 'mse', 'optimizer': 'adam', 'graph_mode': 'cutoff', 'cutoff': 0.2975067783415135, 'grm_norm': 'cosine', 'self_loops': True, 'use_snp_selection': False}. Best is trial 64 with value: 0.043560982615975505.
[I 2025-11-03 13:02:27,973] Trial 89 finished with value: 0.03250068126830829 and parameters: {'model_type': 'graphsage', 'hidden_dims': '[256, 128, 64]', 'dropout': 0.4728183159725006, 'batch_norm': True, 'lr': 0.0005093459839986908, 'weight_decay': 3.3574128947554066e-06, 'epochs': 145, 'loss': 'mse', 'optimizer': 'adam', 'graph_mode': 'cutoff', 'cutoff': 0.3503479222374868, 'grm_norm': 'none', 'self_loops': True, 'use_snp_selection': False}. Best is trial 64 with value: 0.043560982615975505.
[I 2025-11-03 13:02:31,023] Trial 90 finished with value: 0.01871648500733926 and parameters: {'model_type': 'graphsage', 'hidden_dims': '[512, 128]', 'dropout': 0.260671624917191, 'batch_norm': True, 'lr': 0.0009635646364321692, 'weight_decay': 2.2832333545540133e-07, 'epochs': 80, 'loss': 'mse', 'optimizer': 'adam', 'graph_mode': 'knn', 'source': 'grm', 'knn_k': 3, 'weighted_edges': False, 'symmetrize_mode': 'union', 'use_snp_selection': False}. Best is trial 64 with value: 0.043560982615975505.
[I 2025-11-03 13:02:33,738] Trial 91 finished with value: 0.02003297230551697 and parameters: {'model_type': 'graphsage', 'hidden_dims': '[512, 128]', 'dropout': 0.34424056561077254, 'batch_norm': True, 'lr': 0.00036975465561039537, 'weight_decay': 1.650315061115706e-05, 'epochs': 57, 'loss': 'mse', 'optimizer': 'adam', 'graph_mode': 'cutoff', 'cutoff': 0.33309350787128644, 'grm_norm': 'none', 'self_loops': True, 'use_snp_selection': False}. Best is trial 64 with value: 0.043560982615975505.
[I 2025-11-03 13:02:36,792] Trial 92 finished with value: 0.03675841970283557 and parameters: {'model_type': 'graphsage', 'hidden_dims': '[512, 128]', 'dropout': 0.3685838511350361, 'batch_norm': True, 'lr': 0.0003898953358502329, 'weight_decay': 1.0770836245399489e-05, 'epochs': 90, 'loss': 'mse', 'optimizer': 'adam', 'graph_mode': 'cutoff', 'cutoff': 0.31573154430534806, 'grm_norm': 'none', 'self_loops': True, 'use_snp_selection': False}. Best is trial 64 with value: 0.043560982615975505.
[I 2025-11-03 13:02:39,667] Trial 93 finished with value: 0.02806445262873999 and parameters: {'model_type': 'graphsage', 'hidden_dims': '[512, 128]', 'dropout': 0.3053378294540939, 'batch_norm': True, 'lr': 0.0005951315370933407, 'weight_decay': 1.3998580289441206e-05, 'epochs': 68, 'loss': 'mse', 'optimizer': 'adam', 'graph_mode': 'cutoff', 'cutoff': 0.2593295834374426, 'grm_norm': 'none', 'self_loops': True, 'use_snp_selection': False}. Best is trial 64 with value: 0.043560982615975505.
[I 2025-11-03 13:02:42,312] Trial 94 finished with value: 0.03744155154275127 and parameters: {'model_type': 'graphsage', 'hidden_dims': '[512, 128]', 'dropout': 0.32246971101844507, 'batch_norm': True, 'lr': 0.00019286238894804076, 'weight_decay': 2.5916285789056005e-05, 'epochs': 56, 'loss': 'mse', 'optimizer': 'adam', 'graph_mode': 'cutoff', 'cutoff': 0.36861482935432693, 'grm_norm': 'none', 'self_loops': True, 'use_snp_selection': False}. Best is trial 64 with value: 0.043560982615975505.
[I 2025-11-03 13:02:44,362] Trial 95 finished with value: 0.03536232508018886 and parameters: {'model_type': 'graphsage', 'hidden_dims': '[128, 64]', 'dropout': 0.4099014651252012, 'batch_norm': True, 'lr': 1.8382471767425782e-05, 'weight_decay': 0.0007037887604121043, 'epochs': 133, 'loss': 'mse', 'optimizer': 'adam', 'graph_mode': 'cutoff', 'cutoff': 0.2165238669763318, 'grm_norm': 'cosine_then_gcn', 'self_loops': True, 'use_snp_selection': False}. Best is trial 64 with value: 0.043560982615975505.
[I 2025-11-03 13:02:49,624] Trial 96 finished with value: 0.014387859832263351 and parameters: {'model_type': 'graphsage', 'hidden_dims': '[512, 128]', 'dropout': 0.35320919278304574, 'batch_norm': True, 'lr': 0.00015243506870066988, 'weight_decay': 4.596805055140585e-06, 'epochs': 305, 'loss': 'mae', 'optimizer': 'adam', 'graph_mode': 'cutoff', 'cutoff': 0.47451160644973933, 'grm_norm': 'none', 'self_loops': False, 'use_snp_selection': False}. Best is trial 64 with value: 0.043560982615975505.
[I 2025-11-03 13:02:53,572] Trial 97 finished with value: 0.025410196085264163 and parameters: {'model_type': 'graphsage', 'hidden_dims': '[512, 64]', 'dropout': 0.5282528431050448, 'batch_norm': True, 'lr': 0.0003327099395189331, 'weight_decay': 6.6249038740188195e-06, 'epochs': 180, 'loss': 'mse', 'optimizer': 'adam', 'graph_mode': 'cutoff', 'cutoff': 0.439433160092475, 'grm_norm': 'cosine', 'self_loops': True, 'use_snp_selection': False}. Best is trial 64 with value: 0.043560982615975505.
[I 2025-11-03 13:02:56,335] Trial 98 finished with value: 0.03697929891929898 and parameters: {'model_type': 'graphsage', 'hidden_dims': '[512, 128]', 'dropout': 0.33812130102481525, 'batch_norm': True, 'lr': 0.0004346214426562159, 'weight_decay': 3.161411442788907e-05, 'epochs': 75, 'loss': 'mse', 'optimizer': 'adam', 'graph_mode': 'cutoff', 'cutoff': 0.768233867905842, 'grm_norm': 'cosine', 'self_loops': True, 'use_snp_selection': False}. Best is trial 64 with value: 0.043560982615975505.
[I 2025-11-03 13:02:59,631] Trial 99 finished with value: 0.0358430604684765 and parameters: {'model_type': 'graphsage', 'hidden_dims': '[512, 256]', 'dropout': 0.546004931732975, 'batch_norm': True, 'lr': 0.00066712334990935, 'weight_decay': 8.471067014514776e-06, 'epochs': 102, 'loss': 'mse', 'optimizer': 'adam', 'graph_mode': 'cutoff', 'cutoff': 0.27173739131680297, 'grm_norm': 'cosine', 'self_loops': False, 'use_snp_selection': False}. Best is trial 64 with value: 0.043560982615975505.
[I 2025-11-03 13:03:02,639] Trial 100 finished with value: 0.00555241769895776 and parameters: {'model_type': 'graphsage', 'hidden_dims': '[512, 128]', 'dropout': 0.5797749506986727, 'batch_norm': False, 'lr': 0.0007916451935656574, 'weight_decay': 1.2703866326103506e-05, 'epochs': 160, 'loss': 'mae', 'optimizer': 'adam', 'graph_mode': 'knn', 'source': 'grm', 'knn_k': 9, 'weighted_edges': True, 'symmetrize_mode': 'mutual', 'use_snp_selection': True, 'num_snps': 24520}. Best is trial 64 with value: 0.043560982615975505.
[I 2025-11-03 13:03:06,882] Trial 101 finished with value: 0.02775542528613055 and parameters: {'model_type': 'graphsage', 'hidden_dims': '[512, 128]', 'dropout': 0.5065272327436502, 'batch_norm': True, 'lr': 0.00039528176185309785, 'weight_decay': 0.0001102299008736791, 'epochs': 218, 'loss': 'mse', 'optimizer': 'adam', 'graph_mode': 'cutoff', 'cutoff': 0.7623136164169088, 'grm_norm': 'cosine', 'self_loops': False, 'use_snp_selection': False}. Best is trial 64 with value: 0.043560982615975505.
[I 2025-11-03 13:03:11,070] Trial 102 finished with value: 0.029739161615820225 and parameters: {'model_type': 'graphsage', 'hidden_dims': '[512, 128]', 'dropout': 0.5636901207747457, 'batch_norm': True, 'lr': 9.390283954952404e-05, 'weight_decay': 0.0001874157253108523, 'epochs': 212, 'loss': 'mse', 'optimizer': 'adam', 'graph_mode': 'cutoff', 'cutoff': 0.7240511031079077, 'grm_norm': 'cosine', 'self_loops': False, 'use_snp_selection': False}. Best is trial 64 with value: 0.043560982615975505.
[I 2025-11-03 13:03:15,573] Trial 103 finished with value: 0.03456571204801727 and parameters: {'model_type': 'graphsage', 'hidden_dims': '[512, 128]', 'dropout': 0.446207467759117, 'batch_norm': True, 'lr': 0.00023215873683805292, 'weight_decay': 0.00025217965063742496, 'epochs': 245, 'loss': 'mse', 'optimizer': 'adam', 'graph_mode': 'cutoff', 'cutoff': 0.7324535610770174, 'grm_norm': 'cosine', 'self_loops': False, 'use_snp_selection': False}. Best is trial 64 with value: 0.043560982615975505.
[I 2025-11-03 13:03:19,683] Trial 104 finished with value: 0.015429881130744397 and parameters: {'model_type': 'graphsage', 'hidden_dims': '[512, 128]', 'dropout': 0.4871129244450273, 'batch_norm': True, 'lr': 9.184660060837543e-06, 'weight_decay': 0.0002469414225500502, 'epochs': 202, 'loss': 'mse', 'optimizer': 'adam', 'graph_mode': 'cutoff', 'cutoff': 0.8416204336652281, 'grm_norm': 'cosine', 'self_loops': False, 'use_snp_selection': False}. Best is trial 64 with value: 0.043560982615975505.
[I 2025-11-03 13:03:22,095] Trial 105 finished with value: 0.018756557650650083 and parameters: {'model_type': 'graphsage', 'hidden_dims': '[512, 64]', 'dropout': 0.3605874055316037, 'batch_norm': True, 'lr': 0.0005192867703231105, 'weight_decay': 1.296755125379489e-07, 'epochs': 40, 'loss': 'mse', 'optimizer': 'adam', 'graph_mode': 'cutoff', 'cutoff': 0.7885277981174212, 'grm_norm': 'cosine', 'self_loops': False, 'use_snp_selection': False}. Best is trial 64 with value: 0.043560982615975505.
[I 2025-11-03 13:03:24,110] Trial 106 finished with value: 0.026725139303856227 and parameters: {'model_type': 'graphsage', 'hidden_dims': '[128, 64]', 'dropout': 0.3949289845962944, 'batch_norm': True, 'lr': 0.00043585510890203715, 'weight_decay': 0.00015420667897614456, 'epochs': 230, 'loss': 'mse', 'optimizer': 'adam', 'graph_mode': 'cutoff', 'cutoff': 0.7458474043060581, 'grm_norm': 'gcn', 'self_loops': True, 'use_snp_selection': False}. Best is trial 64 with value: 0.043560982615975505.
[I 2025-11-03 13:03:26,629] Trial 107 finished with value: 0.026112229246918403 and parameters: {'model_type': 'graphsage', 'hidden_dims': '[512, 128]', 'dropout': 0.590092151585648, 'batch_norm': True, 'lr': 0.00030694336228555307, 'weight_decay': 6.46570094060295e-05, 'epochs': 47, 'loss': 'mse', 'optimizer': 'adam', 'graph_mode': 'cutoff', 'cutoff': 0.6919382755166341, 'grm_norm': 'none', 'self_loops': True, 'use_snp_selection': False}. Best is trial 64 with value: 0.043560982615975505.
[I 2025-11-03 13:03:31,699] Trial 108 finished with value: 0.05044592186643208 and parameters: {'model_type': 'graphsage', 'hidden_dims': '[512, 128]', 'dropout': 0.5273411105359136, 'batch_norm': True, 'lr': 0.0008623563843636993, 'weight_decay': 6.040188693479513e-07, 'epochs': 277, 'loss': 'mse', 'optimizer': 'adam', 'graph_mode': 'cutoff', 'cutoff': 0.4154211516788132, 'grm_norm': 'cosine', 'self_loops': True, 'use_snp_selection': False}. Best is trial 108 with value: 0.05044592186643208.
[I 2025-11-03 13:03:34,750] Trial 109 finished with value: 0.03145513543200075 and parameters: {'model_type': 'graphsage', 'hidden_dims': '[256, 128]', 'dropout': 0.5236563116161772, 'batch_norm': True, 'lr': 0.0008788169498467214, 'weight_decay': 6.34481549043998e-07, 'epochs': 252, 'loss': 'mse', 'optimizer': 'adam', 'graph_mode': 'cutoff', 'cutoff': 0.3793417875115329, 'grm_norm': 'cosine', 'self_loops': True, 'use_snp_selection': False}. Best is trial 108 with value: 0.05044592186643208.
[I 2025-11-03 13:03:39,646] Trial 110 finished with value: 0.020552859790720975 and parameters: {'model_type': 'graphsage', 'hidden_dims': '[512, 128]', 'dropout': 0.5342631465885079, 'batch_norm': True, 'lr': 0.0005825057150671295, 'weight_decay': 1.001792140601481e-07, 'epochs': 265, 'loss': 'mae', 'optimizer': 'adam', 'graph_mode': 'cutoff', 'cutoff': 0.4035597280146459, 'grm_norm': 'cosine_then_gcn', 'self_loops': True, 'use_snp_selection': False}. Best is trial 108 with value: 0.05044592186643208.
[I 2025-11-03 13:03:44,849] Trial 111 finished with value: 0.017047627100925222 and parameters: {'model_type': 'graphsage', 'hidden_dims': '[512, 128]', 'dropout': 0.5551526962766675, 'batch_norm': True, 'lr': 0.0006578721654322172, 'weight_decay': 2.9843861173283894e-07, 'epochs': 274, 'loss': 'mse', 'optimizer': 'adam', 'graph_mode': 'cutoff', 'cutoff': 0.2972767087692064, 'grm_norm': 'cosine', 'self_loops': True, 'use_snp_selection': False}. Best is trial 108 with value: 0.05044592186643208.
[I 2025-11-03 13:03:49,913] Trial 112 finished with value: 0.02613713540833253 and parameters: {'model_type': 'graphsage', 'hidden_dims': '[512, 128]', 'dropout': 0.49479271303319794, 'batch_norm': True, 'lr': 0.0007056649442820852, 'weight_decay': 1.279652199524841e-06, 'epochs': 278, 'loss': 'mse', 'optimizer': 'adam', 'graph_mode': 'cutoff', 'cutoff': 0.3546235965959338, 'grm_norm': 'cosine', 'self_loops': True, 'use_snp_selection': False}. Best is trial 108 with value: 0.05044592186643208.
[I 2025-11-03 13:03:55,451] Trial 113 finished with value: 0.020340193571108414 and parameters: {'model_type': 'graphsage', 'hidden_dims': '[512, 128]', 'dropout': 0.5041785727584781, 'batch_norm': True, 'lr': 0.000993524215233014, 'weight_decay': 2.1021626957384372e-06, 'epochs': 322, 'loss': 'mse', 'optimizer': 'adam', 'graph_mode': 'cutoff', 'cutoff': 0.41537121851358544, 'grm_norm': 'cosine', 'self_loops': True, 'use_snp_selection': False}. Best is trial 108 with value: 0.05044592186643208.
[I 2025-11-03 13:04:00,149] Trial 114 finished with value: 0.04183924063379726 and parameters: {'model_type': 'graphsage', 'hidden_dims': '[512, 128]', 'dropout': 0.5146529679778435, 'batch_norm': True, 'lr': 0.0008164983388513594, 'weight_decay': 4.1048582335412654e-07, 'epochs': 240, 'loss': 'mse', 'optimizer': 'adam', 'graph_mode': 'cutoff', 'cutoff': 0.32612188137138376, 'grm_norm': 'cosine', 'self_loops': True, 'use_snp_selection': False}. Best is trial 108 with value: 0.05044592186643208.
[I 2025-11-03 13:04:05,989] Trial 115 finished with value: 0.03276516671272208 and parameters: {'model_type': 'graphsage', 'hidden_dims': '[512, 64]', 'dropout': 0.31585230718994395, 'batch_norm': True, 'lr': 0.0008215779200895449, 'weight_decay': 4.5828334352268556e-07, 'epochs': 337, 'loss': 'mse', 'optimizer': 'adam', 'graph_mode': 'cutoff', 'cutoff': 0.31998266085927096, 'grm_norm': 'cosine', 'self_loops': True, 'use_snp_selection': False}. Best is trial 108 with value: 0.05044592186643208.
[I 2025-11-03 13:04:10,719] Trial 116 finished with value: 0.030480432565999256 and parameters: {'model_type': 'graphsage', 'hidden_dims': '[512, 128]', 'dropout': 0.5753915263046221, 'batch_norm': True, 'lr': 3.8568490768325244e-05, 'weight_decay': 6.412401385170808e-07, 'epochs': 240, 'loss': 'mse', 'optimizer': 'adam', 'graph_mode': 'knn', 'source': 'grm', 'knn_k': 2, 'weighted_edges': False, 'symmetrize_mode': 'union', 'use_snp_selection': False}. Best is trial 108 with value: 0.05044592186643208.
[I 2025-11-03 13:04:15,987] Trial 117 finished with value: 0.03451813678801344 and parameters: {'model_type': 'graphsage', 'hidden_dims': '[512, 128]', 'dropout': 0.5152903166844728, 'batch_norm': True, 'lr': 0.0005755845960251907, 'weight_decay': 1.677661946398339e-07, 'epochs': 260, 'loss': 'mse', 'optimizer': 'adam', 'graph_mode': 'cutoff', 'cutoff': 0.25223356412064596, 'grm_norm': 'cosine', 'self_loops': True, 'use_snp_selection': False}. Best is trial 108 with value: 0.05044592186643208.
[I 2025-11-03 13:04:18,397] Trial 118 finished with value: 0.03366736351791122 and parameters: {'model_type': 'graphsage', 'hidden_dims': '[256, 128, 64]', 'dropout': 0.5890985520312891, 'batch_norm': True, 'lr': 0.000833990207617474, 'weight_decay': 1.0371780394532986e-06, 'epochs': 111, 'loss': 'mse', 'optimizer': 'adam', 'graph_mode': 'cutoff', 'cutoff': 0.22430031635712355, 'grm_norm': 'none', 'self_loops': True, 'use_snp_selection': False}. Best is trial 108 with value: 0.05044592186643208.
[I 2025-11-03 13:04:21,628] Trial 119 finished with value: 0.027453047904838834 and parameters: {'model_type': 'graphsage', 'hidden_dims': '[128, 64]', 'dropout': 0.4766079715973759, 'batch_norm': False, 'lr': 5.392571294673931e-05, 'weight_decay': 3.660493383341256e-07, 'epochs': 298, 'loss': 'mse', 'optimizer': 'adam', 'graph_mode': 'cutoff', 'cutoff': 0.3245941545158345, 'grm_norm': 'cosine', 'self_loops': True, 'use_snp_selection': True, 'num_snps': 35685}. Best is trial 108 with value: 0.05044592186643208.
[I 2025-11-03 13:04:25,228] Trial 120 finished with value: 0.016196004815188805 and parameters: {'model_type': 'graphsage', 'hidden_dims': '[512, 128]', 'dropout': 0.5491087329228621, 'batch_norm': True, 'lr': 0.0006898150646672421, 'weight_decay': 3.3473789318687795e-06, 'epochs': 127, 'loss': 'mse', 'optimizer': 'adam', 'graph_mode': 'cutoff', 'cutoff': 0.2855050097949302, 'grm_norm': 'cosine', 'self_loops': True, 'use_snp_selection': False}. Best is trial 108 with value: 0.05044592186643208.
[I 2025-11-03 13:04:29,822] Trial 121 finished with value: 0.023574903869131764 and parameters: {'model_type': 'graphsage', 'hidden_dims': '[512, 128]', 'dropout': 0.5363017183663016, 'batch_norm': True, 'lr': 0.0004819534081823042, 'weight_decay': 2.784801297537901e-07, 'epochs': 234, 'loss': 'mse', 'optimizer': 'adam', 'graph_mode': 'cutoff', 'cutoff': 0.3705689961051664, 'grm_norm': 'cosine', 'self_loops': False, 'use_snp_selection': False}. Best is trial 108 with value: 0.05044592186643208.
[I 2025-11-03 13:04:34,160] Trial 122 finished with value: 0.03612196040101609 and parameters: {'model_type': 'graphsage', 'hidden_dims': '[512, 128]', 'dropout': 0.514475820980841, 'batch_norm': True, 'lr': 0.0004035485864272389, 'weight_decay': 5.644640429398214e-06, 'epochs': 224, 'loss': 'mse', 'optimizer': 'adam', 'graph_mode': 'cutoff', 'cutoff': 0.8135862354881435, 'grm_norm': 'cosine', 'self_loops': True, 'use_snp_selection': False}. Best is trial 108 with value: 0.05044592186643208.
