[I 2025-11-03 14:05:15,658] Trial 21 finished with value: 0.09088736337401622 and parameters: {'model_type': 'gcn', 'hidden_dims': '[256, 128, 64]', 'dropout': 0.17948649421882285, 'batch_norm': False, 'lr': 6.613969864436531e-05, 'weight_decay': 7.406201302930027e-07, 'epochs': 314, 'loss': 'mse', 'optimizer': 'adam', 'graph_mode': 'cutoff', 'cutoff': 0.7848317104319784, 'grm_norm': 'none', 'self_loops': True, 'use_snp_selection': False}. Best is trial 17 with value: 0.10050485197380808.
[I 2025-11-03 14:05:18,712] Trial 22 finished with value: 0.05866235654595801 and parameters: {'model_type': 'gcn', 'hidden_dims': '[256, 128, 64]', 'dropout': 0.3254314863734792, 'batch_norm': False, 'lr': 5.564773668904827e-05, 'weight_decay': 5.401723128900014e-07, 'epochs': 312, 'loss': 'mse', 'optimizer': 'adam', 'graph_mode': 'cutoff', 'cutoff': 0.7899388143041809, 'grm_norm': 'none', 'self_loops': True, 'use_snp_selection': False}. Best is trial 17 with value: 0.10050485197380808.
[I 2025-11-03 14:05:22,014] Trial 23 finished with value: 0.08186133933015066 and parameters: {'model_type': 'gcn', 'hidden_dims': '[256, 128, 64]', 'dropout': 0.16141453233369507, 'batch_norm': False, 'lr': 0.0001633608846472735, 'weight_decay': 1.030004398185905e-07, 'epochs': 350, 'loss': 'mse', 'optimizer': 'adam', 'graph_mode': 'cutoff', 'cutoff': 0.8109250275009312, 'grm_norm': 'none', 'self_loops': True, 'use_snp_selection': False}. Best is trial 17 with value: 0.10050485197380808.
[I 2025-11-03 14:05:24,927] Trial 24 finished with value: 0.08720890170301157 and parameters: {'model_type': 'gcn', 'hidden_dims': '[256, 128, 64]', 'dropout': 0.23426539394795426, 'batch_norm': False, 'lr': 0.000998891968303466, 'weight_decay': 1.9886479106870062e-06, 'epochs': 292, 'loss': 'mse', 'optimizer': 'adam', 'graph_mode': 'cutoff', 'cutoff': 0.8904660293257014, 'grm_norm': 'none', 'self_loops': True, 'use_snp_selection': False}. Best is trial 17 with value: 0.10050485197380808.
[I 2025-11-03 14:05:28,964] Trial 25 finished with value: 0.046962909168336356 and parameters: {'model_type': 'gcn', 'hidden_dims': '[512, 128]', 'dropout': 0.5984005703393165, 'batch_norm': False, 'lr': 0.0002816799579048647, 'weight_decay': 4.4232828391142824e-07, 'epochs': 321, 'loss': 'mse', 'optimizer': 'adam', 'graph_mode': 'cutoff', 'cutoff': 0.7986320886781364, 'grm_norm': 'none', 'self_loops': True, 'use_snp_selection': False}. Best is trial 17 with value: 0.10050485197380808.
[I 2025-11-03 14:05:31,635] Trial 26 finished with value: 0.03098086976740111 and parameters: {'model_type': 'gcn', 'hidden_dims': '[256, 128, 64]', 'dropout': 0.15907134583542804, 'batch_norm': False, 'lr': 1.5164111791436941e-05, 'weight_decay': 1.4999337090563447e-06, 'epochs': 238, 'loss': 'mse', 'optimizer': 'adam', 'graph_mode': 'knn', 'source': 'grm', 'knn_k': 10, 'weighted_edges': False, 'symmetrize_mode': 'union', 'use_snp_selection': False}. Best is trial 17 with value: 0.10050485197380808.
[I 2025-11-03 14:05:34,523] Trial 27 finished with value: 0.06475851482294244 and parameters: {'model_type': 'gcn', 'hidden_dims': '[256, 128, 64]', 'dropout': 0.21354746933787003, 'batch_norm': False, 'lr': 5.021238044188494e-05, 'weight_decay': 2.415773580785969e-07, 'epochs': 286, 'loss': 'mse', 'optimizer': 'adam', 'graph_mode': 'cutoff', 'cutoff': 0.7281093295853199, 'grm_norm': 'none', 'self_loops': True, 'use_snp_selection': False}. Best is trial 17 with value: 0.10050485197380808.
[I 2025-11-03 14:05:36,814] Trial 28 finished with value: 0.07023256767218346 and parameters: {'model_type': 'gcn', 'hidden_dims': '[256, 128, 64]', 'dropout': 0.3692664823121289, 'batch_norm': False, 'lr': 0.00011697053833371621, 'weight_decay': 3.6895922167458107e-06, 'epochs': 205, 'loss': 'mse', 'optimizer': 'adam', 'graph_mode': 'cutoff', 'cutoff': 0.6005363514800703, 'grm_norm': 'none', 'self_loops': True, 'use_snp_selection': False}. Best is trial 17 with value: 0.10050485197380808.
[I 2025-11-03 14:05:39,834] Trial 29 finished with value: 0.026662204689155252 and parameters: {'model_type': 'gcn', 'hidden_dims': '[256, 128, 64]', 'dropout': 0.2918366853656293, 'batch_norm': False, 'lr': 3.0035937518996183e-06, 'weight_decay': 7.938412265063517e-07, 'epochs': 329, 'loss': 'mse', 'optimizer': 'adam', 'graph_mode': 'knn', 'source': 'grm', 'knn_k': 3, 'weighted_edges': True, 'symmetrize_mode': 'union', 'use_snp_selection': False}. Best is trial 17 with value: 0.10050485197380808.
[I 2025-11-03 14:05:42,531] Trial 30 finished with value: 0.08208802825898757 and parameters: {'model_type': 'gcn', 'hidden_dims': '[256, 128]', 'dropout': 0.1988632706462291, 'batch_norm': False, 'lr': 3.0941789746380834e-05, 'weight_decay': 3.8722577708835435e-06, 'epochs': 332, 'loss': 'mse', 'optimizer': 'adam', 'graph_mode': 'cutoff', 'cutoff': 0.4138234498592763, 'grm_norm': 'cosine', 'self_loops': True, 'use_snp_selection': False}. Best is trial 17 with value: 0.10050485197380808.
[I 2025-11-03 14:05:45,241] Trial 31 finished with value: 0.09800128034840673 and parameters: {'model_type': 'gcn', 'hidden_dims': '[256, 128, 64]', 'dropout': 0.227578859086754, 'batch_norm': False, 'lr': 0.0002607831842661863, 'weight_decay': 2.0422727438666085e-06, 'epochs': 289, 'loss': 'mse', 'optimizer': 'adam', 'graph_mode': 'cutoff', 'cutoff': 0.8939600769316367, 'grm_norm': 'none', 'self_loops': True, 'use_snp_selection': False}. Best is trial 17 with value: 0.10050485197380808.
[I 2025-11-03 14:05:47,106] Trial 32 finished with value: 0.08952999974756752 and parameters: {'model_type': 'gcn', 'hidden_dims': '[128, 64]', 'dropout': 0.24324841304996586, 'batch_norm': False, 'lr': 0.00024441375144542, 'weight_decay': 1.4191236169304608e-06, 'epochs': 279, 'loss': 'mse', 'optimizer': 'adam', 'graph_mode': 'cutoff', 'cutoff': 0.8400929387004997, 'grm_norm': 'none', 'self_loops': True, 'use_snp_selection': False}. Best is trial 17 with value: 0.10050485197380808.
[I 2025-11-03 14:05:48,944] Trial 33 finished with value: 0.091780489990489 and parameters: {'model_type': 'gcn', 'hidden_dims': '[128, 64]', 'dropout': 0.2524071604695802, 'batch_norm': False, 'lr': 0.0002338795034457977, 'weight_decay': 1.6606126913539764e-06, 'epochs': 272, 'loss': 'mse', 'optimizer': 'adam', 'graph_mode': 'cutoff', 'cutoff': 0.8377417286797534, 'grm_norm': 'none', 'self_loops': True, 'use_snp_selection': False}. Best is trial 17 with value: 0.10050485197380808.
[I 2025-11-03 14:05:50,754] Trial 34 finished with value: 0.07662867826120384 and parameters: {'model_type': 'gcn', 'hidden_dims': '[128, 64]', 'dropout': 0.15402136810493952, 'batch_norm': False, 'lr': 0.0004364490495946384, 'weight_decay': 7.879275734365764e-06, 'epochs': 247, 'loss': 'mse', 'optimizer': 'adam', 'graph_mode': 'knn', 'source': 'grm', 'knn_k': 4, 'weighted_edges': False, 'symmetrize_mode': 'union', 'use_snp_selection': False}. Best is trial 17 with value: 0.10050485197380808.
[I 2025-11-03 14:05:52,399] Trial 35 finished with value: 0.06264199161409796 and parameters: {'model_type': 'gcn', 'hidden_dims': '[128, 64]', 'dropout': 0.2690177560963181, 'batch_norm': False, 'lr': 0.0005621197579481173, 'weight_decay': 2.3348064033294413e-06, 'epochs': 217, 'loss': 'mse', 'optimizer': 'adam', 'graph_mode': 'cutoff', 'cutoff': 0.8986054239874592, 'grm_norm': 'none', 'self_loops': True, 'use_snp_selection': False}. Best is trial 17 with value: 0.10050485197380808.
[I 2025-11-03 14:05:54,398] Trial 36 finished with value: 0.0923917698317755 and parameters: {'model_type': 'gcn', 'hidden_dims': '[128, 64]', 'dropout': 0.4150499595785224, 'batch_norm': False, 'lr': 0.00011737824491705207, 'weight_decay': 8.902193580602618e-07, 'epochs': 302, 'loss': 'mse', 'optimizer': 'adam', 'graph_mode': 'cutoff', 'cutoff': 0.7704044099034363, 'grm_norm': 'none', 'self_loops': True, 'use_snp_selection': False}. Best is trial 17 with value: 0.10050485197380808.
[I 2025-11-03 14:05:58,059] Trial 37 finished with value: 0.07853056297669508 and parameters: {'model_type': 'gcn', 'hidden_dims': '[128, 64]', 'dropout': 0.43850966084470516, 'batch_norm': False, 'lr': 0.00030316443530913924, 'weight_decay': 1.1136446814397746e-06, 'epochs': 260, 'loss': 'mae', 'optimizer': 'adam', 'graph_mode': 'knn', 'source': 'grm', 'knn_k': 10, 'weighted_edges': True, 'symmetrize_mode': 'mutual', 'use_snp_selection': True, 'num_snps': 54772}. Best is trial 17 with value: 0.10050485197380808.
[I 2025-11-03 14:06:00,059] Trial 38 finished with value: 0.03310443121627608 and parameters: {'model_type': 'gcn', 'hidden_dims': '[128, 64]', 'dropout': 0.4555446040277716, 'batch_norm': False, 'lr': 0.00011882101037570586, 'weight_decay': 2.757502548676875e-06, 'epochs': 297, 'loss': 'mse', 'optimizer': 'adam', 'graph_mode': 'cutoff', 'cutoff': 0.6816983014245916, 'grm_norm': 'none', 'self_loops': True, 'use_snp_selection': False}. Best is trial 17 with value: 0.10050485197380808.
[I 2025-11-03 14:06:03,948] Trial 39 finished with value: -0.03942944945998991 and parameters: {'model_type': 'gcn', 'hidden_dims': '[128, 64]', 'dropout': 0.36903151883443597, 'batch_norm': False, 'lr': 0.0008356645475209907, 'weight_decay': 2.4613307727345716e-07, 'epochs': 335, 'loss': 'mse', 'optimizer': 'adam', 'graph_mode': 'cutoff', 'cutoff': 0.545035796200693, 'grm_norm': 'gcn', 'self_loops': True, 'use_snp_selection': True, 'num_snps': 58379}. Best is trial 17 with value: 0.10050485197380808.
[I 2025-11-03 14:06:06,454] Trial 40 finished with value: 0.047866361676678154 and parameters: {'model_type': 'gcn', 'hidden_dims': '[256, 128]', 'dropout': 0.3302721052652053, 'batch_norm': False, 'lr': 0.00017278855109471806, 'weight_decay': 1.314549066077347e-05, 'epochs': 277, 'loss': 'mae', 'optimizer': 'adam', 'graph_mode': 'knn', 'source': 'grm', 'knn_k': 4, 'weighted_edges': False, 'symmetrize_mode': 'union', 'use_snp_selection': False}. Best is trial 17 with value: 0.10050485197380808.
[I 2025-11-03 14:06:08,450] Trial 41 finished with value: 0.05903982866574453 and parameters: {'model_type': 'gcn', 'hidden_dims': '[128, 64]', 'dropout': 0.4623472041183019, 'batch_norm': False, 'lr': 0.0002058344315820519, 'weight_decay': 6.596742914892469e-07, 'epochs': 316, 'loss': 'mse', 'optimizer': 'adam', 'graph_mode': 'cutoff', 'cutoff': 0.7730684628098066, 'grm_norm': 'none', 'self_loops': True, 'use_snp_selection': False}. Best is trial 17 with value: 0.10050485197380808.
[I 2025-11-03 14:06:12,463] Trial 42 finished with value: 0.07982960041255302 and parameters: {'model_type': 'gcn', 'hidden_dims': '[512, 128]', 'dropout': 0.41488074110568046, 'batch_norm': False, 'lr': 0.00010050039069271386, 'weight_decay': 5.938818769864621e-06, 'epochs': 337, 'loss': 'mse', 'optimizer': 'adam', 'graph_mode': 'cutoff', 'cutoff': 0.8396513901785428, 'grm_norm': 'none', 'self_loops': True, 'use_snp_selection': False}. Best is trial 17 with value: 0.10050485197380808.
[I 2025-11-03 14:06:16,184] Trial 43 finished with value: -0.007228335422382104 and parameters: {'model_type': 'gcn', 'hidden_dims': '[512, 64]', 'dropout': 0.39312387452001624, 'batch_norm': False, 'lr': 0.00042851353854269367, 'weight_decay': 9.188820279289901e-07, 'epochs': 302, 'loss': 'mse', 'optimizer': 'adam', 'graph_mode': 'cutoff', 'cutoff': 0.718205894622121, 'grm_norm': 'none', 'self_loops': True, 'use_snp_selection': False}. Best is trial 17 with value: 0.10050485197380808.
[I 2025-11-03 14:06:17,324] Trial 44 finished with value: -0.011574539082079198 and parameters: {'model_type': 'gcn', 'hidden_dims': '[128, 64]', 'dropout': 0.1313456836289729, 'batch_norm': False, 'lr': 0.0003306538438527731, 'weight_decay': 3.6582013646014773e-07, 'epochs': 69, 'loss': 'mse', 'optimizer': 'adam', 'graph_mode': 'cutoff', 'cutoff': 0.748990128892686, 'grm_norm': 'none', 'self_loops': True, 'use_snp_selection': False}. Best is trial 17 with value: 0.10050485197380808.
[I 2025-11-03 14:06:19,977] Trial 45 finished with value: 0.011139696795144989 and parameters: {'model_type': 'gcn', 'hidden_dims': '[256, 128, 64]', 'dropout': 0.494339489960013, 'batch_norm': False, 'lr': 4.257142299311332e-05, 'weight_decay': 1.876007422901798e-06, 'epochs': 279, 'loss': 'mse', 'optimizer': 'adam', 'graph_mode': 'cutoff', 'cutoff': 0.6988948914226729, 'grm_norm': 'gcn', 'self_loops': True, 'use_snp_selection': False}. Best is trial 17 with value: 0.10050485197380808.
[I 2025-11-03 14:06:21,989] Trial 46 finished with value: 0.06505043569325392 and parameters: {'model_type': 'gcn', 'hidden_dims': '[128, 64]', 'dropout': 0.29757592016625045, 'batch_norm': False, 'lr': 6.928586544113503e-05, 'weight_decay': 1.3327044087686035e-06, 'epochs': 147, 'loss': 'mae', 'optimizer': 'adam', 'graph_mode': 'cutoff', 'cutoff': 0.8610794345812797, 'grm_norm': 'cosine', 'self_loops': True, 'use_snp_selection': True, 'num_snps': 19621}. Best is trial 17 with value: 0.10050485197380808.
[I 2025-11-03 14:06:24,644] Trial 47 finished with value: 0.08627663764258187 and parameters: {'model_type': 'gcn', 'hidden_dims': '[256, 128]', 'dropout': 0.19199142050660514, 'batch_norm': False, 'lr': 0.00012618470239219537, 'weight_decay': 4.759063692522161e-06, 'epochs': 324, 'loss': 'mse', 'optimizer': 'adam', 'graph_mode': 'cutoff', 'cutoff': 0.7917893153976263, 'grm_norm': 'none', 'self_loops': True, 'use_snp_selection': False}. Best is trial 17 with value: 0.10050485197380808.
[I 2025-11-03 14:06:25,845] Trial 48 finished with value: 0.04427901396831971 and parameters: {'model_type': 'gcn', 'hidden_dims': '[512, 128]', 'dropout': 0.2537242546196372, 'batch_norm': True, 'lr': 0.0002095887346201243, 'weight_decay': 2.7543117328571543e-07, 'epochs': 2, 'loss': 'mse', 'optimizer': 'adam', 'graph_mode': 'cutoff', 'cutoff': 0.6603387694548579, 'grm_norm': 'gcn', 'self_loops': True, 'use_snp_selection': False}. Best is trial 17 with value: 0.10050485197380808.
[I 2025-11-03 14:06:29,751] Trial 49 finished with value: 0.0731834127374494 and parameters: {'model_type': 'gcn', 'hidden_dims': '[512, 64]', 'dropout': 0.17199829281003998, 'batch_norm': False, 'lr': 3.331299992928898e-05, 'weight_decay': 1.378133776846943e-07, 'epochs': 229, 'loss': 'mse', 'optimizer': 'adam', 'graph_mode': 'cutoff', 'cutoff': 0.7493712587733562, 'grm_norm': 'none', 'self_loops': True, 'use_snp_selection': True, 'num_snps': 41013}. Best is trial 17 with value: 0.10050485197380808.
[I 2025-11-03 14:06:32,455] Trial 50 finished with value: 0.11298321822955552 and parameters: {'model_type': 'gcn', 'hidden_dims': '[256, 128, 64]', 'dropout': 0.1370056293922661, 'batch_norm': False, 'lr': 9.449958250652012e-05, 'weight_decay': 6.689911139409384e-07, 'epochs': 268, 'loss': 'mae', 'optimizer': 'adam', 'graph_mode': 'cutoff', 'cutoff': 0.8420540653403609, 'grm_norm': 'cosine_then_gcn', 'self_loops': True, 'use_snp_selection': False}. Best is trial 50 with value: 0.11298321822955552.
[I 2025-11-03 14:06:35,113] Trial 51 finished with value: 0.0832348106388085 and parameters: {'model_type': 'gcn', 'hidden_dims': '[256, 128, 64]', 'dropout': 0.12983096649119194, 'batch_norm': False, 'lr': 8.680651533395947e-05, 'weight_decay': 7.284496648639903e-07, 'epochs': 266, 'loss': 'mae', 'optimizer': 'adam', 'graph_mode': 'cutoff', 'cutoff': 0.8440419640688919, 'grm_norm': 'cosine_then_gcn', 'self_loops': True, 'use_snp_selection': False}. Best is trial 50 with value: 0.11298321822955552.
[I 2025-11-03 14:06:37,346] Trial 52 finished with value: 0.09380134426490264 and parameters: {'model_type': 'gcn', 'hidden_dims': '[256, 128, 64]', 'dropout': 0.20262893955513983, 'batch_norm': False, 'lr': 0.00015337425676607716, 'weight_decay': 4.5878581681491707e-07, 'epochs': 197, 'loss': 'mae', 'optimizer': 'adam', 'graph_mode': 'cutoff', 'cutoff': 0.812621316364362, 'grm_norm': 'cosine_then_gcn', 'self_loops': True, 'use_snp_selection': False}. Best is trial 50 with value: 0.11298321822955552.
[I 2025-11-03 14:06:39,553] Trial 53 finished with value: 0.09548078713475704 and parameters: {'model_type': 'gcn', 'hidden_dims': '[256, 128, 64]', 'dropout': 0.20713056336868996, 'batch_norm': False, 'lr': 0.000590239289244014, 'weight_decay': 4.812577862894929e-07, 'epochs': 191, 'loss': 'mae', 'optimizer': 'adam', 'graph_mode': 'cutoff', 'cutoff': 0.8973222243381798, 'grm_norm': 'cosine_then_gcn', 'self_loops': True, 'use_snp_selection': False}. Best is trial 50 with value: 0.11298321822955552.
[I 2025-11-03 14:06:41,730] Trial 54 finished with value: 0.09631320751087638 and parameters: {'model_type': 'gcn', 'hidden_dims': '[256, 128, 64]', 'dropout': 0.14606556353770944, 'batch_norm': False, 'lr': 0.000600250957050712, 'weight_decay': 5.845739079887009e-07, 'epochs': 188, 'loss': 'mae', 'optimizer': 'adam', 'graph_mode': 'cutoff', 'cutoff': 0.8828653261300826, 'grm_norm': 'cosine_then_gcn', 'self_loops': False, 'use_snp_selection': False}. Best is trial 50 with value: 0.11298321822955552.
[I 2025-11-03 14:06:43,940] Trial 55 finished with value: 0.08563989734016339 and parameters: {'model_type': 'gcn', 'hidden_dims': '[256, 128, 64]', 'dropout': 0.15005665997169632, 'batch_norm': True, 'lr': 0.0006980080696657473, 'weight_decay': 4.7227684059775006e-07, 'epochs': 183, 'loss': 'mae', 'optimizer': 'adam', 'graph_mode': 'cutoff', 'cutoff': 0.8813976056696928, 'grm_norm': 'cosine_then_gcn', 'self_loops': False, 'use_snp_selection': False}. Best is trial 50 with value: 0.11298321822955552.
[I 2025-11-03 14:06:46,005] Trial 56 finished with value: 0.08558917536266669 and parameters: {'model_type': 'gcn', 'hidden_dims': '[256, 128, 64]', 'dropout': 0.12050871729810182, 'batch_norm': False, 'lr': 0.0005531548993613662, 'weight_decay': 1.9033657194065867e-07, 'epochs': 169, 'loss': 'mae', 'optimizer': 'adam', 'graph_mode': 'cutoff', 'cutoff': 0.8955823262510928, 'grm_norm': 'cosine_then_gcn', 'self_loops': False, 'use_snp_selection': False}. Best is trial 50 with value: 0.11298321822955552.
[I 2025-11-03 14:06:48,235] Trial 57 finished with value: 0.09585935119372829 and parameters: {'model_type': 'gcn', 'hidden_dims': '[256, 128, 64]', 'dropout': 0.21619363319976231, 'batch_norm': False, 'lr': 0.0003375019734981786, 'weight_decay': 3.7223542039125e-07, 'epochs': 195, 'loss': 'mae', 'optimizer': 'adam', 'graph_mode': 'cutoff', 'cutoff': 0.8656605234387083, 'grm_norm': 'cosine_then_gcn', 'self_loops': False, 'use_snp_selection': False}. Best is trial 50 with value: 0.11298321822955552.
[I 2025-11-03 14:06:50,288] Trial 58 finished with value: 0.025809310599872445 and parameters: {'model_type': 'gcn', 'hidden_dims': '[256, 128, 64]', 'dropout': 0.2328075280367783, 'batch_norm': False, 'lr': 0.00036832877757437806, 'weight_decay': 2.9543413162689115e-05, 'epochs': 156, 'loss': 'mae', 'optimizer': 'adam', 'graph_mode': 'knn', 'source': 'grm', 'knn_k': 8, 'weighted_edges': False, 'symmetrize_mode': 'union', 'use_snp_selection': False}. Best is trial 50 with value: 0.11298321822955552.
[I 2025-11-03 14:06:52,526] Trial 59 finished with value: 0.017118081518790396 and parameters: {'model_type': 'gcn', 'hidden_dims': '[256, 128, 64]', 'dropout': 0.14655008079427723, 'batch_norm': True, 'lr': 0.0006591499223410781, 'weight_decay': 1.0370274373152652e-07, 'epochs': 185, 'loss': 'mae', 'optimizer': 'adam', 'graph_mode': 'cutoff', 'cutoff': 0.37851482207795517, 'grm_norm': 'cosine_then_gcn', 'self_loops': False, 'use_snp_selection': False}. Best is trial 50 with value: 0.11298321822955552.
[I 2025-11-03 14:06:54,806] Trial 60 finished with value: 0.09764170919393317 and parameters: {'model_type': 'gcn', 'hidden_dims': '[256, 128, 64]', 'dropout': 0.17374415316892317, 'batch_norm': False, 'lr': 0.0004975276432013498, 'weight_decay': 0.00035087838750424635, 'epochs': 124, 'loss': 'mae', 'optimizer': 'adam', 'graph_mode': 'cutoff', 'cutoff': 0.861140036703606, 'grm_norm': 'cosine_then_gcn', 'self_loops': False, 'use_snp_selection': True, 'num_snps': 21166}. Best is trial 50 with value: 0.11298321822955552.
[I 2025-11-03 14:06:57,168] Trial 61 finished with value: 0.1116387600776369 and parameters: {'model_type': 'gcn', 'hidden_dims': '[256, 128, 64]', 'dropout': 0.16850214203227865, 'batch_norm': False, 'lr': 0.0009990872125319014, 'weight_decay': 3.9513649812101235e-07, 'epochs': 143, 'loss': 'mae', 'optimizer': 'adam', 'graph_mode': 'cutoff', 'cutoff': 0.8626231048493888, 'grm_norm': 'cosine_then_gcn', 'self_loops': False, 'use_snp_selection': True, 'num_snps': 20223}. Best is trial 50 with value: 0.11298321822955552.
[I 2025-11-03 14:06:59,422] Trial 62 finished with value: 0.09588844310110035 and parameters: {'model_type': 'gcn', 'hidden_dims': '[256, 128, 64]', 'dropout': 0.11197369631842306, 'batch_norm': False, 'lr': 0.0009068988515352301, 'weight_decay': 0.0003120405366669323, 'epochs': 113, 'loss': 'mae', 'optimizer': 'adam', 'graph_mode': 'cutoff', 'cutoff': 0.8623185886411628, 'grm_norm': 'cosine_then_gcn', 'self_loops': False, 'use_snp_selection': True, 'num_snps': 20234}. Best is trial 50 with value: 0.11298321822955552.
[I 2025-11-03 14:07:01,729] Trial 63 finished with value: 0.02561182187608848 and parameters: {'model_type': 'gcn', 'hidden_dims': '[256, 128, 64]', 'dropout': 0.11043538733517913, 'batch_norm': False, 'lr': 0.0009093767272082326, 'weight_decay': 0.0005031941740559709, 'epochs': 119, 'loss': 'mae', 'optimizer': 'adam', 'graph_mode': 'cutoff', 'cutoff': 0.2624910100165731, 'grm_norm': 'cosine_then_gcn', 'self_loops': False, 'use_snp_selection': True, 'num_snps': 20417}. Best is trial 50 with value: 0.11298321822955552.
