[I 2025-11-03 12:36:10,081] Trial 55 finished with value: 0.09212367301916334 and parameters: {'model_type': 'gcn', 'hidden_dims': '[512, 256]', 'dropout': 0.3423415405893156, 'batch_norm': True, 'lr': 0.0001077173072681008, 'weight_decay': 1.3221715534327087e-05, 'epochs': 228, 'loss': 'mae', 'optimizer': 'adam', 'graph_mode': 'knn', 'source': 'grm', 'knn_k': 6, 'weighted_edges': True, 'symmetrize_mode': 'mutual', 'use_snp_selection': False}. Best is trial 55 with value: 0.09212367301916334.
[I 2025-11-03 12:36:12,900] Trial 56 finished with value: 0.062253798260558275 and parameters: {'model_type': 'gcn', 'hidden_dims': '[512, 256]', 'dropout': 0.3366621066179641, 'batch_norm': True, 'lr': 0.00011543323832878043, 'weight_decay': 1.480658125517458e-05, 'epochs': 245, 'loss': 'mae', 'optimizer': 'adam', 'graph_mode': 'knn', 'source': 'grm', 'knn_k': 7, 'weighted_edges': True, 'symmetrize_mode': 'mutual', 'use_snp_selection': False}. Best is trial 55 with value: 0.09212367301916334.
[I 2025-11-03 12:36:15,630] Trial 57 finished with value: 0.06894227432976538 and parameters: {'model_type': 'gcn', 'hidden_dims': '[512, 256]', 'dropout': 0.29035046289160643, 'batch_norm': True, 'lr': 0.00024107257662068617, 'weight_decay': 5.775688303828123e-06, 'epochs': 230, 'loss': 'mae', 'optimizer': 'adam', 'graph_mode': 'knn', 'source': 'grm', 'knn_k': 5, 'weighted_edges': True, 'symmetrize_mode': 'mutual', 'use_snp_selection': False}. Best is trial 55 with value: 0.09212367301916334.
[I 2025-11-03 12:36:18,690] Trial 58 finished with value: 0.0816920796754643 and parameters: {'model_type': 'gcn', 'hidden_dims': '[512, 256]', 'dropout': 0.36088599720349407, 'batch_norm': True, 'lr': 0.0004339230474330068, 'weight_decay': 1.2282639908997637e-05, 'epochs': 284, 'loss': 'mae', 'optimizer': 'adam', 'graph_mode': 'knn', 'source': 'grm', 'knn_k': 6, 'weighted_edges': True, 'symmetrize_mode': 'mutual', 'use_snp_selection': False}. Best is trial 55 with value: 0.09212367301916334.
[I 2025-11-03 12:36:21,625] Trial 59 finished with value: 0.06315868644386247 and parameters: {'model_type': 'gcn', 'hidden_dims': '[512, 256]', 'dropout': 0.36921398857214455, 'batch_norm': True, 'lr': 0.00032718875366100796, 'weight_decay': 2.5764510937257782e-06, 'epochs': 263, 'loss': 'mae', 'optimizer': 'adam', 'graph_mode': 'knn', 'source': 'grm', 'knn_k': 6, 'weighted_edges': True, 'symmetrize_mode': 'mutual', 'use_snp_selection': False}. Best is trial 55 with value: 0.09212367301916334.
[I 2025-11-03 12:36:24,576] Trial 60 finished with value: 0.07423126183932122 and parameters: {'model_type': 'gcn', 'hidden_dims': '[512, 256]', 'dropout': 0.32481816860845925, 'batch_norm': True, 'lr': 0.0006899976390884626, 'weight_decay': 1.2094717121795143e-05, 'epochs': 266, 'loss': 'mae', 'optimizer': 'adam', 'graph_mode': 'knn', 'source': 'grm', 'knn_k': 6, 'weighted_edges': True, 'symmetrize_mode': 'mutual', 'use_snp_selection': False}. Best is trial 55 with value: 0.09212367301916334.
[I 2025-11-03 12:36:27,539] Trial 61 finished with value: 0.07519888690772637 and parameters: {'model_type': 'gcn', 'hidden_dims': '[512, 256]', 'dropout': 0.325458664709618, 'batch_norm': True, 'lr': 0.0007465520629185596, 'weight_decay': 1.0692287004301271e-05, 'epochs': 268, 'loss': 'mae', 'optimizer': 'adam', 'graph_mode': 'knn', 'source': 'grm', 'knn_k': 6, 'weighted_edges': True, 'symmetrize_mode': 'mutual', 'use_snp_selection': False}. Best is trial 55 with value: 0.09212367301916334.
[I 2025-11-03 12:36:30,644] Trial 62 finished with value: 0.08196220668725555 and parameters: {'model_type': 'gcn', 'hidden_dims': '[512, 256]', 'dropout': 0.3590608544735487, 'batch_norm': True, 'lr': 0.0008166963107741233, 'weight_decay': 8.084234826498725e-06, 'epochs': 292, 'loss': 'mae', 'optimizer': 'adam', 'graph_mode': 'knn', 'source': 'grm', 'knn_k': 7, 'weighted_edges': True, 'symmetrize_mode': 'mutual', 'use_snp_selection': False}. Best is trial 55 with value: 0.09212367301916334.
[I 2025-11-03 12:36:33,868] Trial 63 finished with value: 0.06888273303839801 and parameters: {'model_type': 'gcn', 'hidden_dims': '[512, 256]', 'dropout': 0.3477748455264612, 'batch_norm': True, 'lr': 0.000755088298703929, 'weight_decay': 7.424328993034724e-06, 'epochs': 312, 'loss': 'mae', 'optimizer': 'adam', 'graph_mode': 'knn', 'source': 'grm', 'knn_k': 7, 'weighted_edges': True, 'symmetrize_mode': 'mutual', 'use_snp_selection': False}. Best is trial 55 with value: 0.09212367301916334.
[I 2025-11-03 12:36:36,900] Trial 64 finished with value: 0.08548282801565354 and parameters: {'model_type': 'gcn', 'hidden_dims': '[512, 256]', 'dropout': 0.3547424347294248, 'batch_norm': True, 'lr': 0.000492380743428492, 'weight_decay': 1.7751250987072827e-05, 'epochs': 279, 'loss': 'mae', 'optimizer': 'adam', 'graph_mode': 'knn', 'source': 'grm', 'knn_k': 6, 'weighted_edges': True, 'symmetrize_mode': 'mutual', 'use_snp_selection': False}. Best is trial 55 with value: 0.09212367301916334.
[I 2025-11-03 12:36:39,625] Trial 65 finished with value: 0.06969269411518336 and parameters: {'model_type': 'gcn', 'hidden_dims': '[512, 256]', 'dropout': 0.3599588745242004, 'batch_norm': True, 'lr': 0.0005274916367018418, 'weight_decay': 1.9719612515512532e-05, 'epochs': 228, 'loss': 'mae', 'optimizer': 'adam', 'graph_mode': 'knn', 'source': 'grm', 'knn_k': 5, 'weighted_edges': True, 'symmetrize_mode': 'mutual', 'use_snp_selection': False}. Best is trial 55 with value: 0.09212367301916334.
[I 2025-11-03 12:36:42,702] Trial 66 finished with value: 0.07232831224266964 and parameters: {'model_type': 'gcn', 'hidden_dims': '[512, 256]', 'dropout': 0.3907009114900243, 'batch_norm': True, 'lr': 0.00030627351887859306, 'weight_decay': 4.380445436074755e-06, 'epochs': 282, 'loss': 'mae', 'optimizer': 'adam', 'graph_mode': 'knn', 'source': 'grm', 'knn_k': 7, 'weighted_edges': True, 'symmetrize_mode': 'mutual', 'use_snp_selection': False}. Best is trial 55 with value: 0.09212367301916334.
[I 2025-11-03 12:36:45,989] Trial 67 finished with value: 0.039869948419782364 and parameters: {'model_type': 'gcn', 'hidden_dims': '[512, 256]', 'dropout': 0.35962995254428654, 'batch_norm': True, 'lr': 0.00019467040029477305, 'weight_decay': 6.999239886347661e-06, 'epochs': 312, 'loss': 'mae', 'optimizer': 'adam', 'graph_mode': 'knn', 'source': 'grm', 'knn_k': 8, 'weighted_edges': True, 'symmetrize_mode': 'mutual', 'use_snp_selection': False}. Best is trial 55 with value: 0.09212367301916334.
[I 2025-11-03 12:36:48,532] Trial 68 finished with value: 0.0760213873902967 and parameters: {'model_type': 'gcn', 'hidden_dims': '[512, 256]', 'dropout': 0.281662426079327, 'batch_norm': True, 'lr': 0.0004307427898219711, 'weight_decay': 2.6857710358628088e-05, 'epochs': 195, 'loss': 'mae', 'optimizer': 'adam', 'graph_mode': 'knn', 'source': 'grm', 'knn_k': 6, 'weighted_edges': True, 'symmetrize_mode': 'mutual', 'use_snp_selection': False}. Best is trial 55 with value: 0.09212367301916334.
[I 2025-11-03 12:36:51,280] Trial 69 finished with value: 0.07177632159733516 and parameters: {'model_type': 'gcn', 'hidden_dims': '[512, 256]', 'dropout': 0.3370145475065076, 'batch_norm': True, 'lr': 0.0005781689550752689, 'weight_decay': 1.6433042098405152e-05, 'epochs': 229, 'loss': 'mae', 'optimizer': 'adam', 'graph_mode': 'knn', 'source': 'grm', 'knn_k': 7, 'weighted_edges': True, 'symmetrize_mode': 'mutual', 'use_snp_selection': False}. Best is trial 55 with value: 0.09212367301916334.
[I 2025-11-03 12:36:54,621] Trial 70 finished with value: 0.08412320740500606 and parameters: {'model_type': 'gcn', 'hidden_dims': '[512, 256]', 'dropout': 0.3152259939243495, 'batch_norm': True, 'lr': 0.0008308570758627166, 'weight_decay': 3.849029340928574e-05, 'epochs': 330, 'loss': 'mae', 'optimizer': 'adam', 'graph_mode': 'knn', 'source': 'grm', 'knn_k': 6, 'weighted_edges': True, 'symmetrize_mode': 'mutual', 'use_snp_selection': False}. Best is trial 55 with value: 0.09212367301916334.
[I 2025-11-03 12:36:57,994] Trial 71 finished with value: 0.08089697902258271 and parameters: {'model_type': 'gcn', 'hidden_dims': '[512, 256]', 'dropout': 0.25206215604671633, 'batch_norm': True, 'lr': 0.0008617692786978725, 'weight_decay': 3.9550269488559986e-05, 'epochs': 336, 'loss': 'mae', 'optimizer': 'adam', 'graph_mode': 'knn', 'source': 'grm', 'knn_k': 6, 'weighted_edges': True, 'symmetrize_mode': 'mutual', 'use_snp_selection': False}. Best is trial 55 with value: 0.09212367301916334.
[I 2025-11-03 12:37:01,337] Trial 72 finished with value: 0.07246828692507619 and parameters: {'model_type': 'gcn', 'hidden_dims': '[512, 256]', 'dropout': 0.24197816556722737, 'batch_norm': True, 'lr': 0.0009927010858801438, 'weight_decay': 3.2150538018313605e-05, 'epochs': 331, 'loss': 'mae', 'optimizer': 'adam', 'graph_mode': 'knn', 'source': 'grm', 'knn_k': 6, 'weighted_edges': True, 'symmetrize_mode': 'mutual', 'use_snp_selection': False}. Best is trial 55 with value: 0.09212367301916334.
[I 2025-11-03 12:37:04,684] Trial 73 finished with value: 0.08360167915759528 and parameters: {'model_type': 'gcn', 'hidden_dims': '[512, 256]', 'dropout': 0.31037542871645885, 'batch_norm': True, 'lr': 0.0006289690176222027, 'weight_decay': 4.2051798982823446e-05, 'epochs': 331, 'loss': 'mae', 'optimizer': 'adam', 'graph_mode': 'knn', 'source': 'grm', 'knn_k': 6, 'weighted_edges': True, 'symmetrize_mode': 'mutual', 'use_snp_selection': False}. Best is trial 55 with value: 0.09212367301916334.
[I 2025-11-03 12:37:08,026] Trial 74 finished with value: 0.08466078211903788 and parameters: {'model_type': 'gcn', 'hidden_dims': '[512, 256]', 'dropout': 0.2624975601753629, 'batch_norm': True, 'lr': 0.0008341811969490402, 'weight_decay': 3.8813371401856e-05, 'epochs': 331, 'loss': 'mae', 'optimizer': 'adam', 'graph_mode': 'knn', 'source': 'grm', 'knn_k': 5, 'weighted_edges': True, 'symmetrize_mode': 'mutual', 'use_snp_selection': False}. Best is trial 55 with value: 0.09212367301916334.
[I 2025-11-03 12:37:11,305] Trial 75 finished with value: 0.08310277917906292 and parameters: {'model_type': 'gcn', 'hidden_dims': '[512, 256]', 'dropout': 0.2576809918076106, 'batch_norm': True, 'lr': 0.0008955912018261486, 'weight_decay': 4.284118559892509e-05, 'epochs': 328, 'loss': 'mae', 'optimizer': 'adam', 'graph_mode': 'knn', 'source': 'grm', 'knn_k': 5, 'weighted_edges': True, 'symmetrize_mode': 'mutual', 'use_snp_selection': False}. Best is trial 55 with value: 0.09212367301916334.
[I 2025-11-03 12:37:14,691] Trial 76 finished with value: 0.06972406441233324 and parameters: {'model_type': 'gcn', 'hidden_dims': '[512, 256]', 'dropout': 0.21512975602154583, 'batch_norm': True, 'lr': 0.0006111135074809193, 'weight_decay': 3.5896965356788116e-05, 'epochs': 323, 'loss': 'mae', 'optimizer': 'adam', 'graph_mode': 'knn', 'source': 'grm', 'knn_k': 4, 'weighted_edges': True, 'symmetrize_mode': 'mutual', 'use_snp_selection': False}. Best is trial 55 with value: 0.09212367301916334.
[I 2025-11-03 12:37:17,832] Trial 77 finished with value: 0.0819250264960014 and parameters: {'model_type': 'gcn', 'hidden_dims': '[512, 256]', 'dropout': 0.2667090673180017, 'batch_norm': True, 'lr': 0.0008385625669860925, 'weight_decay': 2.399662861635396e-05, 'epochs': 293, 'loss': 'mae', 'optimizer': 'adam', 'graph_mode': 'knn', 'source': 'grm', 'knn_k': 5, 'weighted_edges': True, 'symmetrize_mode': 'mutual', 'use_snp_selection': False}. Best is trial 55 with value: 0.09212367301916334.
[I 2025-11-03 12:37:21,282] Trial 78 finished with value: 0.0840752220051752 and parameters: {'model_type': 'gcn', 'hidden_dims': '[512, 64]', 'dropout': 0.26990293812581745, 'batch_norm': True, 'lr': 0.0008005097509323058, 'weight_decay': 2.6838457762207815e-05, 'epochs': 349, 'loss': 'mae', 'optimizer': 'adam', 'graph_mode': 'knn', 'source': 'grm', 'knn_k': 4, 'weighted_edges': True, 'symmetrize_mode': 'mutual', 'use_snp_selection': False}. Best is trial 55 with value: 0.09212367301916334.
[I 2025-11-03 12:37:24,735] Trial 79 finished with value: 0.06663438647522661 and parameters: {'model_type': 'gcn', 'hidden_dims': '[512, 64]', 'dropout': 0.3077245079736992, 'batch_norm': True, 'lr': 0.0008410161208249211, 'weight_decay': 4.3024452132611204e-05, 'epochs': 350, 'loss': 'mae', 'optimizer': 'adam', 'graph_mode': 'knn', 'source': 'grm', 'knn_k': 4, 'weighted_edges': True, 'symmetrize_mode': 'mutual', 'use_snp_selection': False}. Best is trial 55 with value: 0.09212367301916334.
[I 2025-11-03 12:37:27,998] Trial 80 finished with value: 0.07817662582090443 and parameters: {'model_type': 'gcn', 'hidden_dims': '[512, 64]', 'dropout': 0.28201419361714547, 'batch_norm': True, 'lr': 0.0005960422030658644, 'weight_decay': 6.273956407156791e-05, 'epochs': 317, 'loss': 'mae', 'optimizer': 'adam', 'graph_mode': 'knn', 'source': 'grm', 'knn_k': 5, 'weighted_edges': True, 'symmetrize_mode': 'mutual', 'use_snp_selection': False}. Best is trial 55 with value: 0.09212367301916334.
[I 2025-11-03 12:37:31,166] Trial 81 finished with value: 0.0860889890186593 and parameters: {'model_type': 'gcn', 'hidden_dims': '[512, 64]', 'dropout': 0.26368386699854846, 'batch_norm': True, 'lr': 0.000823871310345056, 'weight_decay': 2.089902122289928e-05, 'epochs': 301, 'loss': 'mae', 'optimizer': 'adam', 'graph_mode': 'knn', 'source': 'grm', 'knn_k': 5, 'weighted_edges': True, 'symmetrize_mode': 'mutual', 'use_snp_selection': False}. Best is trial 55 with value: 0.09212367301916334.
[I 2025-11-03 12:37:34,332] Trial 82 finished with value: 0.07464988285967275 and parameters: {'model_type': 'gcn', 'hidden_dims': '[512, 64]', 'dropout': 0.21114058157104243, 'batch_norm': True, 'lr': 0.0008608765091442175, 'weight_decay': 8.645659013269919e-05, 'epochs': 301, 'loss': 'mae', 'optimizer': 'adam', 'graph_mode': 'knn', 'source': 'grm', 'knn_k': 4, 'weighted_edges': True, 'symmetrize_mode': 'mutual', 'use_snp_selection': False}. Best is trial 55 with value: 0.09212367301916334.
[I 2025-11-03 12:37:37,661] Trial 83 finished with value: 0.0730248450298183 and parameters: {'model_type': 'gcn', 'hidden_dims': '[512, 64]', 'dropout': 0.24603829001445554, 'batch_norm': True, 'lr': 0.0004941018519834739, 'weight_decay': 2.4465981382322196e-05, 'epochs': 328, 'loss': 'mae', 'optimizer': 'adam', 'graph_mode': 'knn', 'source': 'grm', 'knn_k': 5, 'weighted_edges': True, 'symmetrize_mode': 'mutual', 'use_snp_selection': False}. Best is trial 55 with value: 0.09212367301916334.
[I 2025-11-03 12:37:41,045] Trial 84 finished with value: 0.07552018832541889 and parameters: {'model_type': 'gcn', 'hidden_dims': '[512, 64]', 'dropout': 0.2597660076124602, 'batch_norm': True, 'lr': 0.0006441393035175833, 'weight_decay': 1.936551311639669e-05, 'epochs': 338, 'loss': 'mae', 'optimizer': 'adam', 'graph_mode': 'knn', 'source': 'grm', 'knn_k': 4, 'weighted_edges': True, 'symmetrize_mode': 'mutual', 'use_snp_selection': False}. Best is trial 55 with value: 0.09212367301916334.
[I 2025-11-03 12:37:44,227] Trial 85 finished with value: 0.06131521832478007 and parameters: {'model_type': 'gcn', 'hidden_dims': '[512, 64]', 'dropout': 0.29028594756943893, 'batch_norm': True, 'lr': 0.0003497039179052832, 'weight_decay': 4.1374022567266775e-05, 'epochs': 303, 'loss': 'mae', 'optimizer': 'adam', 'graph_mode': 'knn', 'source': 'grm', 'knn_k': 5, 'weighted_edges': True, 'symmetrize_mode': 'mutual', 'use_snp_selection': False}. Best is trial 55 with value: 0.09212367301916334.
[I 2025-11-03 12:37:47,654] Trial 86 finished with value: 0.06024816747769394 and parameters: {'model_type': 'gcn', 'hidden_dims': '[512, 64]', 'dropout': 0.1539055424658039, 'batch_norm': True, 'lr': 0.0009647855931188428, 'weight_decay': 2.8090896972690568e-05, 'epochs': 343, 'loss': 'mae', 'optimizer': 'adam', 'graph_mode': 'knn', 'source': 'grm', 'knn_k': 7, 'weighted_edges': True, 'symmetrize_mode': 'union', 'use_snp_selection': False}. Best is trial 55 with value: 0.09212367301916334.
[I 2025-11-03 12:37:49,815] Trial 87 finished with value: 0.07329646310707434 and parameters: {'model_type': 'gcn', 'hidden_dims': '[128, 64]', 'dropout': 0.27923774406807234, 'batch_norm': True, 'lr': 0.000761878429228601, 'weight_decay': 6.9681421310644e-05, 'epochs': 322, 'loss': 'mae', 'optimizer': 'adam', 'graph_mode': 'knn', 'source': 'grm', 'knn_k': 5, 'weighted_edges': True, 'symmetrize_mode': 'mutual', 'use_snp_selection': False}. Best is trial 55 with value: 0.09212367301916334.
[I 2025-11-03 12:37:52,828] Trial 88 finished with value: 0.06295725058321719 and parameters: {'model_type': 'gcn', 'hidden_dims': '[512, 64]', 'dropout': 0.22808596459391914, 'batch_norm': True, 'lr': 0.000280468855633933, 'weight_decay': 8.964590690709449e-06, 'epochs': 275, 'loss': 'mae', 'optimizer': 'adam', 'graph_mode': 'knn', 'source': 'grm', 'knn_k': 4, 'weighted_edges': True, 'symmetrize_mode': 'mutual', 'use_snp_selection': False}. Best is trial 55 with value: 0.09212367301916334.
[I 2025-11-03 12:37:55,735] Trial 89 finished with value: 0.07251547904883078 and parameters: {'model_type': 'gcn', 'hidden_dims': '[512, 256]', 'dropout': 0.3129780220505929, 'batch_norm': True, 'lr': 0.0005193757930993129, 'weight_decay': 2.00715815643213e-05, 'epochs': 255, 'loss': 'mae', 'optimizer': 'adam', 'graph_mode': 'knn', 'source': 'grm', 'knn_k': 5, 'weighted_edges': True, 'symmetrize_mode': 'mutual', 'use_snp_selection': False}. Best is trial 55 with value: 0.09212367301916334.
[I 2025-11-03 12:37:58,972] Trial 90 finished with value: 0.021486305992116313 and parameters: {'model_type': 'gcn', 'hidden_dims': '[512, 256]', 'dropout': 0.29743814035409527, 'batch_norm': True, 'lr': 5.189942938515329e-05, 'weight_decay': 5.400325702576701e-05, 'epochs': 310, 'loss': 'mae', 'optimizer': 'adam', 'graph_mode': 'knn', 'source': 'grm', 'knn_k': 8, 'weighted_edges': True, 'symmetrize_mode': 'mutual', 'use_snp_selection': False}. Best is trial 55 with value: 0.09212367301916334.
[I 2025-11-03 12:38:02,113] Trial 91 finished with value: 0.08071462584354434 and parameters: {'model_type': 'gcn', 'hidden_dims': '[512, 256]', 'dropout': 0.26831624925480374, 'batch_norm': True, 'lr': 0.0007705723847246497, 'weight_decay': 2.3886026273376142e-05, 'epochs': 295, 'loss': 'mae', 'optimizer': 'adam', 'graph_mode': 'knn', 'source': 'grm', 'knn_k': 5, 'weighted_edges': True, 'symmetrize_mode': 'mutual', 'use_snp_selection': False}. Best is trial 55 with value: 0.09212367301916334.
[I 2025-11-03 12:38:05,224] Trial 92 finished with value: 0.08127760404369563 and parameters: {'model_type': 'gcn', 'hidden_dims': '[512, 256]', 'dropout': 0.2614531128234326, 'batch_norm': True, 'lr': 0.0008832973941217948, 'weight_decay': 2.841882623186573e-05, 'epochs': 290, 'loss': 'mae', 'optimizer': 'adam', 'graph_mode': 'knn', 'source': 'grm', 'knn_k': 5, 'weighted_edges': True, 'symmetrize_mode': 'mutual', 'use_snp_selection': False}. Best is trial 55 with value: 0.09212367301916334.
[I 2025-11-03 12:38:08,541] Trial 93 finished with value: 0.049242334160730324 and parameters: {'model_type': 'gcn', 'hidden_dims': '[512, 256]', 'dropout': 0.23743162681364405, 'batch_norm': True, 'lr': 0.0009917949535200566, 'weight_decay': 4.159650226088138e-05, 'epochs': 326, 'loss': 'mae', 'optimizer': 'adam', 'graph_mode': 'knn', 'source': 'grm', 'knn_k': 3, 'weighted_edges': True, 'symmetrize_mode': 'mutual', 'use_snp_selection': False}. Best is trial 55 with value: 0.09212367301916334.
[I 2025-11-03 12:38:12,008] Trial 94 finished with value: 0.05856852393007698 and parameters: {'model_type': 'gcn', 'hidden_dims': '[512, 256]', 'dropout': 0.27658219639880116, 'batch_norm': True, 'lr': 0.0006350211407823951, 'weight_decay': 1.8309534020543284e-05, 'epochs': 350, 'loss': 'mae', 'optimizer': 'adam', 'graph_mode': 'knn', 'source': 'grm', 'knn_k': 5, 'weighted_edges': True, 'symmetrize_mode': 'union', 'use_snp_selection': False}. Best is trial 55 with value: 0.09212367301916334.
[I 2025-11-03 12:38:15,402] Trial 95 finished with value: 0.05995959287985992 and parameters: {'model_type': 'gcn', 'hidden_dims': '[512, 256]', 'dropout': 0.21580405007402667, 'batch_norm': True, 'lr': 0.0007992479282151, 'weight_decay': 1.12778121924476e-05, 'epochs': 337, 'loss': 'mae', 'optimizer': 'adam', 'graph_mode': 'knn', 'source': 'grm', 'knn_k': 6, 'weighted_edges': True, 'symmetrize_mode': 'mutual', 'use_snp_selection': False}. Best is trial 55 with value: 0.09212367301916334.
[I 2025-11-03 12:38:17,505] Trial 96 finished with value: 0.07223207618703137 and parameters: {'model_type': 'gcn', 'hidden_dims': '[128, 64]', 'dropout': 0.19610373491841737, 'batch_norm': True, 'lr': 0.0005881281766294906, 'weight_decay': 3.509777183538632e-05, 'epochs': 300, 'loss': 'mae', 'optimizer': 'adam', 'graph_mode': 'knn', 'source': 'grm', 'knn_k': 7, 'weighted_edges': True, 'symmetrize_mode': 'mutual', 'use_snp_selection': False}. Best is trial 55 with value: 0.09212367301916334.
[I 2025-11-03 12:38:20,721] Trial 97 finished with value: 0.043751867567449594 and parameters: {'model_type': 'gcn', 'hidden_dims': '[512, 256]', 'dropout': 0.3040124930325819, 'batch_norm': True, 'lr': 0.000682245474724086, 'weight_decay': 2.4425249467510317e-05, 'epochs': 308, 'loss': 'mae', 'optimizer': 'adam', 'graph_mode': 'knn', 'source': 'grm', 'knn_k': 6, 'weighted_edges': False, 'symmetrize_mode': 'mutual', 'use_snp_selection': False}. Best is trial 55 with value: 0.09212367301916334.
[I 2025-11-03 12:38:23,978] Trial 98 finished with value: 0.06130658284893405 and parameters: {'model_type': 'gcn', 'hidden_dims': '[512, 64]', 'dropout': 0.2540529676557644, 'batch_norm': True, 'lr': 0.0004725422282768934, 'weight_decay': 6.474134797718699e-05, 'epochs': 316, 'loss': 'mae', 'optimizer': 'adam', 'graph_mode': 'knn', 'source': 'grm', 'knn_k': 4, 'weighted_edges': True, 'symmetrize_mode': 'mutual', 'use_snp_selection': False}. Best is trial 55 with value: 0.09212367301916334.
