[I 2025-11-03 13:40:15,458] Trial 75 finished with value: 0.07207932541797782 and parameters: {'model_type': 'gcn', 'hidden_dims': '[512, 256]', 'dropout': 0.17443325802662618, 'batch_norm': True, 'lr': 0.0005830196136148683, 'weight_decay': 7.047417671702547e-05, 'epochs': 160, 'loss': 'mse', 'optimizer': 'adam', 'graph_mode': 'cutoff', 'cutoff': 0.44925606359109455, 'grm_norm': 'gcn', 'self_loops': True, 'use_snp_selection': False}. Best is trial 45 with value: 0.09999459353692468.
[I 2025-11-03 13:40:17,675] Trial 76 finished with value: 0.08098990380404165 and parameters: {'model_type': 'gcn', 'hidden_dims': '[512, 256]', 'dropout': 0.15735927212057033, 'batch_norm': True, 'lr': 0.0007742167277059713, 'weight_decay': 0.0004271302885315988, 'epochs': 164, 'loss': 'mse', 'optimizer': 'adam', 'graph_mode': 'cutoff', 'cutoff': 0.39613988855167936, 'grm_norm': 'cosine_then_gcn', 'self_loops': True, 'use_snp_selection': False}. Best is trial 45 with value: 0.09999459353692468.
[I 2025-11-03 13:40:19,451] Trial 77 finished with value: 0.06647535642418848 and parameters: {'model_type': 'gcn', 'hidden_dims': '[256, 128]', 'dropout': 0.14142537233009492, 'batch_norm': True, 'lr': 0.0002041499427008617, 'weight_decay': 0.00011166359911506117, 'epochs': 180, 'loss': 'mse', 'optimizer': 'adam', 'graph_mode': 'cutoff', 'cutoff': 0.30968287065965266, 'grm_norm': 'cosine_then_gcn', 'self_loops': False, 'use_snp_selection': False}. Best is trial 45 with value: 0.09999459353692468.
[I 2025-11-03 13:40:22,599] Trial 78 finished with value: 0.054218524679626436 and parameters: {'model_type': 'gcn', 'hidden_dims': '[512, 256]', 'dropout': 0.22188651200004808, 'batch_norm': False, 'lr': 1.2093666744722891e-05, 'weight_decay': 0.00017702226060804552, 'epochs': 267, 'loss': 'mse', 'optimizer': 'adam', 'graph_mode': 'cutoff', 'cutoff': 0.6516361359986821, 'grm_norm': 'none', 'self_loops': True, 'use_snp_selection': True, 'num_snps': 36102}. Best is trial 45 with value: 0.09999459353692468.
[I 2025-11-03 13:40:24,311] Trial 79 finished with value: 0.061596718041749786 and parameters: {'model_type': 'gcn', 'hidden_dims': '[256, 128, 64]', 'dropout': 0.11370083801270112, 'batch_norm': True, 'lr': 0.00027615785061322007, 'weight_decay': 0.00025549830793382443, 'epochs': 121, 'loss': 'mse', 'optimizer': 'adam', 'graph_mode': 'cutoff', 'cutoff': 0.5920911387559389, 'grm_norm': 'cosine_then_gcn', 'self_loops': True, 'use_snp_selection': False}. Best is trial 45 with value: 0.09999459353692468.
[I 2025-11-03 13:40:26,863] Trial 80 finished with value: 0.033601771638983105 and parameters: {'model_type': 'gcn', 'hidden_dims': '[512, 256]', 'dropout': 0.2869488913561448, 'batch_norm': True, 'lr': 0.0001154458599328398, 'weight_decay': 0.0005295093083467985, 'epochs': 223, 'loss': 'mae', 'optimizer': 'adam', 'graph_mode': 'cutoff', 'cutoff': 0.2183450666183953, 'grm_norm': 'gcn', 'self_loops': True, 'use_snp_selection': False}. Best is trial 45 with value: 0.09999459353692468.
[I 2025-11-03 13:40:28,927] Trial 81 finished with value: 0.09225624827819184 and parameters: {'model_type': 'gcn', 'hidden_dims': '[512, 256]', 'dropout': 0.1278745187276437, 'batch_norm': True, 'lr': 0.000374894039284279, 'weight_decay': 0.0003479537600945728, 'epochs': 136, 'loss': 'mse', 'optimizer': 'adam', 'graph_mode': 'cutoff', 'cutoff': 0.5406423999532887, 'grm_norm': 'cosine_then_gcn', 'self_loops': True, 'use_snp_selection': False}. Best is trial 45 with value: 0.09999459353692468.
[I 2025-11-03 13:40:31,167] Trial 82 finished with value: 0.06297908753460656 and parameters: {'model_type': 'gcn', 'hidden_dims': '[512, 256]', 'dropout': 0.120992490233395, 'batch_norm': True, 'lr': 0.000372589287858164, 'weight_decay': 7.397189990441001e-05, 'epochs': 166, 'loss': 'mse', 'optimizer': 'adam', 'graph_mode': 'cutoff', 'cutoff': 0.5173554256463571, 'grm_norm': 'cosine_then_gcn', 'self_loops': True, 'use_snp_selection': False}. Best is trial 45 with value: 0.09999459353692468.
[I 2025-11-03 13:40:33,650] Trial 83 finished with value: 0.07890275646959007 and parameters: {'model_type': 'gcn', 'hidden_dims': '[512, 256]', 'dropout': 0.1780588075335948, 'batch_norm': True, 'lr': 0.000451705122445582, 'weight_decay': 2.16377165927444e-05, 'epochs': 212, 'loss': 'mse', 'optimizer': 'adam', 'graph_mode': 'cutoff', 'cutoff': 0.5566138467517691, 'grm_norm': 'cosine_then_gcn', 'self_loops': True, 'use_snp_selection': False}. Best is trial 45 with value: 0.09999459353692468.
[I 2025-11-03 13:40:35,710] Trial 84 finished with value: 0.07122615292262142 and parameters: {'model_type': 'gcn', 'hidden_dims': '[512, 128]', 'dropout': 0.2005424093354725, 'batch_norm': True, 'lr': 0.0005496499335650089, 'weight_decay': 0.0003302919903063674, 'epochs': 133, 'loss': 'mse', 'optimizer': 'adam', 'graph_mode': 'cutoff', 'cutoff': 0.602760770403487, 'grm_norm': 'cosine_then_gcn', 'self_loops': True, 'use_snp_selection': False}. Best is trial 45 with value: 0.09999459353692468.
[I 2025-11-03 13:40:38,143] Trial 85 finished with value: 0.04076829927367754 and parameters: {'model_type': 'gcn', 'hidden_dims': '[512, 256]', 'dropout': 0.16403489847033698, 'batch_norm': True, 'lr': 0.0003036729804740858, 'weight_decay': 0.0001455398948588103, 'epochs': 195, 'loss': 'mse', 'optimizer': 'adam', 'graph_mode': 'knn', 'source': 'grm', 'knn_k': 10, 'weighted_edges': False, 'symmetrize_mode': 'mutual', 'use_snp_selection': False}. Best is trial 45 with value: 0.09999459353692468.
[I 2025-11-03 13:40:40,305] Trial 86 finished with value: 0.08614462028609424 and parameters: {'model_type': 'gcn', 'hidden_dims': '[512, 256]', 'dropout': 0.14207824829917073, 'batch_norm': True, 'lr': 0.0007919617951046504, 'weight_decay': 0.0007060198342868059, 'epochs': 154, 'loss': 'mse', 'optimizer': 'adam', 'graph_mode': 'cutoff', 'cutoff': 0.4014808865264842, 'grm_norm': 'cosine_then_gcn', 'self_loops': True, 'use_snp_selection': False}. Best is trial 45 with value: 0.09999459353692468.
[I 2025-11-03 13:40:43,350] Trial 87 finished with value: 0.08610319954557956 and parameters: {'model_type': 'gcn', 'hidden_dims': '[512, 256]', 'dropout': 0.14026385052202797, 'batch_norm': True, 'lr': 0.000844468111246329, 'weight_decay': 0.0007357730255604169, 'epochs': 311, 'loss': 'mse', 'optimizer': 'adam', 'graph_mode': 'cutoff', 'cutoff': 0.4041679738401217, 'grm_norm': 'cosine_then_gcn', 'self_loops': True, 'use_snp_selection': False}. Best is trial 45 with value: 0.09999459353692468.
[I 2025-11-03 13:40:45,323] Trial 88 finished with value: 0.08819391375410773 and parameters: {'model_type': 'gcn', 'hidden_dims': '[128, 64]', 'dropout': 0.13755276836946806, 'batch_norm': True, 'lr': 0.0007630071811651169, 'weight_decay': 0.0009490452777842303, 'epochs': 323, 'loss': 'mse', 'optimizer': 'adam', 'graph_mode': 'cutoff', 'cutoff': 0.4688100585286369, 'grm_norm': 'cosine_then_gcn', 'self_loops': True, 'use_snp_selection': False}. Best is trial 45 with value: 0.09999459353692468.
[I 2025-11-03 13:40:46,725] Trial 89 finished with value: 0.04455785904939444 and parameters: {'model_type': 'gcn', 'hidden_dims': '[128, 64]', 'dropout': 0.10142728291290723, 'batch_norm': False, 'lr': 0.0007170351242326166, 'weight_decay': 0.0007372849469459928, 'epochs': 153, 'loss': 'mae', 'optimizer': 'adam', 'graph_mode': 'knn', 'source': 'grm', 'knn_k': 2, 'weighted_edges': False, 'symmetrize_mode': 'mutual', 'use_snp_selection': True, 'num_snps': 3785}. Best is trial 45 with value: 0.09999459353692468.
[I 2025-11-03 13:40:48,760] Trial 90 finished with value: 0.07425487776611821 and parameters: {'model_type': 'gcn', 'hidden_dims': '[128, 64]', 'dropout': 0.12781618295192865, 'batch_norm': True, 'lr': 0.000813520323524248, 'weight_decay': 5.109016023519005e-05, 'epochs': 340, 'loss': 'mse', 'optimizer': 'adam', 'graph_mode': 'cutoff', 'cutoff': 0.4934272346931998, 'grm_norm': 'cosine_then_gcn', 'self_loops': True, 'use_snp_selection': False}. Best is trial 45 with value: 0.09999459353692468.
[I 2025-11-03 13:40:50,753] Trial 91 finished with value: 0.07822128175310114 and parameters: {'model_type': 'gcn', 'hidden_dims': '[128, 64]', 'dropout': 0.13950849688057843, 'batch_norm': True, 'lr': 0.0008061646510444041, 'weight_decay': 0.0009147815718179219, 'epochs': 326, 'loss': 'mse', 'optimizer': 'adam', 'graph_mode': 'cutoff', 'cutoff': 0.41636084309286164, 'grm_norm': 'cosine_then_gcn', 'self_loops': True, 'use_snp_selection': False}. Best is trial 45 with value: 0.09999459353692468.
[I 2025-11-03 13:40:52,747] Trial 92 finished with value: 0.06753624237011009 and parameters: {'model_type': 'gcn', 'hidden_dims': '[128, 64]', 'dropout': 0.14824492371344905, 'batch_norm': True, 'lr': 0.000658584715580791, 'weight_decay': 0.00042725344712134174, 'epochs': 329, 'loss': 'mse', 'optimizer': 'adam', 'graph_mode': 'cutoff', 'cutoff': 0.4640421509225255, 'grm_norm': 'cosine_then_gcn', 'self_loops': True, 'use_snp_selection': False}. Best is trial 45 with value: 0.09999459353692468.
[I 2025-11-03 13:40:55,847] Trial 93 finished with value: 0.07029285926976549 and parameters: {'model_type': 'gcn', 'hidden_dims': '[512, 128]', 'dropout': 0.1104923306953318, 'batch_norm': True, 'lr': 0.0005178392195189963, 'weight_decay': 0.0007104510399466548, 'epochs': 322, 'loss': 'mse', 'optimizer': 'adam', 'graph_mode': 'cutoff', 'cutoff': 0.3866430979516106, 'grm_norm': 'cosine_then_gcn', 'self_loops': True, 'use_snp_selection': False}. Best is trial 45 with value: 0.09999459353692468.
[I 2025-11-03 13:40:58,062] Trial 94 finished with value: 0.08048911565308298 and parameters: {'model_type': 'gcn', 'hidden_dims': '[256, 128]', 'dropout': 0.1579206269363412, 'batch_norm': True, 'lr': 0.00044058605084355563, 'weight_decay': 0.0005310817500955137, 'epochs': 301, 'loss': 'mse', 'optimizer': 'adam', 'graph_mode': 'cutoff', 'cutoff': 0.5250870460135493, 'grm_norm': 'cosine_then_gcn', 'self_loops': True, 'use_snp_selection': False}. Best is trial 45 with value: 0.09999459353692468.
[I 2025-11-03 13:41:00,877] Trial 95 finished with value: 0.06785935903051296 and parameters: {'model_type': 'gcn', 'hidden_dims': '[512, 256]', 'dropout': 0.13452702600792005, 'batch_norm': True, 'lr': 0.0008570857714678566, 'weight_decay': 0.0009936454997382341, 'epochs': 273, 'loss': 'mse', 'optimizer': 'adam', 'graph_mode': 'cutoff', 'cutoff': 0.4213217289288186, 'grm_norm': 'cosine_then_gcn', 'self_loops': False, 'use_snp_selection': False}. Best is trial 45 with value: 0.09999459353692468.
[I 2025-11-03 13:41:03,897] Trial 96 finished with value: 0.06852052911621397 and parameters: {'model_type': 'gcn', 'hidden_dims': '[512, 256]', 'dropout': 0.31417221930566397, 'batch_norm': True, 'lr': 0.0005617258586475222, 'weight_decay': 0.000720059202822405, 'epochs': 307, 'loss': 'mse', 'optimizer': 'adam', 'graph_mode': 'cutoff', 'cutoff': 0.47451160644973933, 'grm_norm': 'cosine_then_gcn', 'self_loops': True, 'use_snp_selection': False}. Best is trial 45 with value: 0.09999459353692468.
[I 2025-11-03 13:41:06,960] Trial 97 finished with value: 0.06909466055545652 and parameters: {'model_type': 'gcn', 'hidden_dims': '[512, 256]', 'dropout': 0.12231560286653606, 'batch_norm': True, 'lr': 0.0006442720492200268, 'weight_decay': 0.00010061578150255849, 'epochs': 317, 'loss': 'mse', 'optimizer': 'adam', 'graph_mode': 'cutoff', 'cutoff': 0.31304266849538437, 'grm_norm': 'cosine_then_gcn', 'self_loops': True, 'use_snp_selection': False}. Best is trial 45 with value: 0.09999459353692468.
[I 2025-11-03 13:41:09,068] Trial 98 finished with value: 0.03579882610767097 and parameters: {'model_type': 'gcn', 'hidden_dims': '[128, 64]', 'dropout': 0.38243741719348506, 'batch_norm': True, 'lr': 0.0003498292278748329, 'weight_decay': 0.0003588257231549684, 'epochs': 350, 'loss': 'mae', 'optimizer': 'adam', 'graph_mode': 'knn', 'source': 'grm', 'knn_k': 5, 'weighted_edges': False, 'symmetrize_mode': 'mutual', 'use_snp_selection': False}. Best is trial 45 with value: 0.09999459353692468.
[I 2025-11-03 13:41:11,993] Trial 99 finished with value: 0.07212443091940873 and parameters: {'model_type': 'gcn', 'hidden_dims': '[512, 128]', 'dropout': 0.11323037023506254, 'batch_norm': True, 'lr': 0.0007293063225930989, 'weight_decay': 3.7803424821638944e-05, 'epochs': 291, 'loss': 'mse', 'optimizer': 'adam', 'graph_mode': 'cutoff', 'cutoff': 0.42315625915029464, 'grm_norm': 'cosine_then_gcn', 'self_loops': True, 'use_snp_selection': False}. Best is trial 45 with value: 0.09999459353692468.
[I 2025-11-03 13:41:13,974] Trial 100 finished with value: 0.07545884955902599 and parameters: {'model_type': 'gcn', 'hidden_dims': '[512, 256]', 'dropout': 0.1646323896693912, 'batch_norm': True, 'lr': 0.000846565614697349, 'weight_decay': 6.133124363651562e-05, 'epochs': 121, 'loss': 'mse', 'optimizer': 'adam', 'graph_mode': 'cutoff', 'cutoff': 0.4538753531898555, 'grm_norm': 'cosine', 'self_loops': True, 'use_snp_selection': False}. Best is trial 45 with value: 0.09999459353692468.
[I 2025-11-03 13:41:15,848] Trial 101 finished with value: 0.08492783053234816 and parameters: {'model_type': 'gcn', 'hidden_dims': '[512, 256]', 'dropout': 0.1384803731938829, 'batch_norm': True, 'lr': 0.00045953991058623805, 'weight_decay': 0.00023583636199645062, 'epochs': 101, 'loss': 'mse', 'optimizer': 'adam', 'graph_mode': 'cutoff', 'cutoff': 0.5771091132632344, 'grm_norm': 'cosine_then_gcn', 'self_loops': True, 'use_snp_selection': False}. Best is trial 45 with value: 0.09999459353692468.
[I 2025-11-03 13:41:18,122] Trial 102 finished with value: 0.07843289517817778 and parameters: {'model_type': 'gcn', 'hidden_dims': '[512, 256]', 'dropout': 0.1486120763303625, 'batch_norm': True, 'lr': 0.0005157116419187323, 'weight_decay': 0.00016379812517410298, 'epochs': 173, 'loss': 'mse', 'optimizer': 'adam', 'graph_mode': 'cutoff', 'cutoff': 0.5440435265965924, 'grm_norm': 'cosine_then_gcn', 'self_loops': True, 'use_snp_selection': False}. Best is trial 45 with value: 0.09999459353692468.
[I 2025-11-03 13:41:19,635] Trial 103 finished with value: 0.08042956371827178 and parameters: {'model_type': 'gcn', 'hidden_dims': '[512, 256]', 'dropout': 0.1277335282305783, 'batch_norm': True, 'lr': 0.00038694428335839915, 'weight_decay': 0.00027070408191701985, 'epochs': 36, 'loss': 'mse', 'optimizer': 'adam', 'graph_mode': 'cutoff', 'cutoff': 0.6245735964021996, 'grm_norm': 'cosine_then_gcn', 'self_loops': True, 'use_snp_selection': False}. Best is trial 45 with value: 0.09999459353692468.
[I 2025-11-03 13:41:21,358] Trial 104 finished with value: 0.05371459446461788 and parameters: {'model_type': 'gcn', 'hidden_dims': '[512, 256]', 'dropout': 0.18566139641156354, 'batch_norm': True, 'lr': 4.430659365697773e-05, 'weight_decay': 0.00045599584355603004, 'epochs': 77, 'loss': 'mse', 'optimizer': 'adam', 'graph_mode': 'cutoff', 'cutoff': 0.6541093437311779, 'grm_norm': 'cosine_then_gcn', 'self_loops': True, 'use_snp_selection': False}. Best is trial 45 with value: 0.09999459353692468.
[I 2025-11-03 13:41:23,829] Trial 105 finished with value: 0.07229466632221467 and parameters: {'model_type': 'gcn', 'hidden_dims': '[256, 128, 64]', 'dropout': 0.10760793016904976, 'batch_norm': True, 'lr': 0.0006602021123948857, 'weight_decay': 0.00012952423453367788, 'epochs': 290, 'loss': 'mse', 'optimizer': 'adam', 'graph_mode': 'cutoff', 'cutoff': 0.7007491381480119, 'grm_norm': 'cosine_then_gcn', 'self_loops': True, 'use_snp_selection': False}. Best is trial 45 with value: 0.09999459353692468.
[I 2025-11-03 13:41:25,926] Trial 106 finished with value: 0.09328291225391834 and parameters: {'model_type': 'gcn', 'hidden_dims': '[512, 256]', 'dropout': 0.16550112641647718, 'batch_norm': True, 'lr': 0.0008663048920212866, 'weight_decay': 0.00020191544259433154, 'epochs': 142, 'loss': 'mse', 'optimizer': 'adam', 'graph_mode': 'cutoff', 'cutoff': 0.49547459829619045, 'grm_norm': 'cosine_then_gcn', 'self_loops': True, 'use_snp_selection': False}. Best is trial 45 with value: 0.09999459353692468.
[I 2025-11-03 13:41:27,996] Trial 107 finished with value: 0.06171013001277833 and parameters: {'model_type': 'gcn', 'hidden_dims': '[512, 256]', 'dropout': 0.34560716166876626, 'batch_norm': True, 'lr': 0.0008849670942154012, 'weight_decay': 0.00020705115690444618, 'epochs': 138, 'loss': 'mse', 'optimizer': 'adam', 'graph_mode': 'cutoff', 'cutoff': 0.48752512207562854, 'grm_norm': 'cosine', 'self_loops': True, 'use_snp_selection': False}. Best is trial 45 with value: 0.09999459353692468.
[I 2025-11-03 13:41:31,524] Trial 108 finished with value: 0.060691390838400645 and parameters: {'model_type': 'gcn', 'hidden_dims': '[512, 256]', 'dropout': 0.15128442659642075, 'batch_norm': False, 'lr': 0.0005722911122460802, 'weight_decay': 0.0006263061012640986, 'epochs': 147, 'loss': 'mae', 'optimizer': 'adam', 'graph_mode': 'cutoff', 'cutoff': 0.507321349637994, 'grm_norm': 'cosine_then_gcn', 'self_loops': False, 'use_snp_selection': True, 'num_snps': 53135}. Best is trial 45 with value: 0.09999459353692468.
[I 2025-11-03 13:41:33,513] Trial 109 finished with value: 0.05107942117749976 and parameters: {'model_type': 'gcn', 'hidden_dims': '[512, 256]', 'dropout': 0.1208177547030083, 'batch_norm': True, 'lr': 0.0009839013481907027, 'weight_decay': 8.567092010315362e-05, 'epochs': 112, 'loss': 'mse', 'optimizer': 'adam', 'graph_mode': 'knn', 'source': 'grm', 'knn_k': 2, 'weighted_edges': False, 'symmetrize_mode': 'mutual', 'use_snp_selection': False}. Best is trial 45 with value: 0.09999459353692468.
[I 2025-11-03 13:41:35,814] Trial 110 finished with value: 0.07982174852963121 and parameters: {'model_type': 'gcn', 'hidden_dims': '[512, 128]', 'dropout': 0.40654197507948503, 'batch_norm': True, 'lr': 0.0007567350623548226, 'weight_decay': 0.0003089526099104524, 'epochs': 180, 'loss': 'mse', 'optimizer': 'adam', 'graph_mode': 'cutoff', 'cutoff': 0.5306967652558394, 'grm_norm': 'gcn', 'self_loops': True, 'use_snp_selection': False}. Best is trial 45 with value: 0.09999459353692468.
[I 2025-11-03 13:41:37,670] Trial 111 finished with value: 0.07554747618029217 and parameters: {'model_type': 'gcn', 'hidden_dims': '[512, 256]', 'dropout': 0.16729673384896246, 'batch_norm': True, 'lr': 0.00040101461566096095, 'weight_decay': 0.00014251182437782098, 'epochs': 99, 'loss': 'mse', 'optimizer': 'adam', 'graph_mode': 'cutoff', 'cutoff': 0.5570379825857977, 'grm_norm': 'cosine_then_gcn', 'self_loops': True, 'use_snp_selection': False}. Best is trial 45 with value: 0.09999459353692468.
[I 2025-11-03 13:41:39,322] Trial 112 finished with value: 0.07954201110076038 and parameters: {'model_type': 'gcn', 'hidden_dims': '[512, 256]', 'dropout': 0.1896018885507859, 'batch_norm': True, 'lr': 0.0003325883111898731, 'weight_decay': 3.856207074479839e-06, 'epochs': 60, 'loss': 'mse', 'optimizer': 'adam', 'graph_mode': 'cutoff', 'cutoff': 0.5782130316612931, 'grm_norm': 'cosine_then_gcn', 'self_loops': True, 'use_snp_selection': False}. Best is trial 45 with value: 0.09999459353692468.
[I 2025-11-03 13:41:41,110] Trial 113 finished with value: 0.0810672759411569 and parameters: {'model_type': 'gcn', 'hidden_dims': '[512, 256]', 'dropout': 0.13904942112217744, 'batch_norm': True, 'lr': 0.00047989106323348825, 'weight_decay': 0.00020808474897284076, 'epochs': 85, 'loss': 'mse', 'optimizer': 'adam', 'graph_mode': 'cutoff', 'cutoff': 0.37497778289814193, 'grm_norm': 'cosine_then_gcn', 'self_loops': True, 'use_snp_selection': False}. Best is trial 45 with value: 0.09999459353692468.
[I 2025-11-03 13:41:43,122] Trial 114 finished with value: 0.07227698829680146 and parameters: {'model_type': 'gcn', 'hidden_dims': '[512, 256]', 'dropout': 0.1529201068969667, 'batch_norm': True, 'lr': 0.0006458306056051337, 'weight_decay': 0.0006000777964324237, 'epochs': 126, 'loss': 'mse', 'optimizer': 'adam', 'graph_mode': 'cutoff', 'cutoff': 0.5991850485053892, 'grm_norm': 'cosine_then_gcn', 'self_loops': True, 'use_snp_selection': False}. Best is trial 45 with value: 0.09999459353692468.
[I 2025-11-03 13:41:45,319] Trial 115 finished with value: 0.07833324399236966 and parameters: {'model_type': 'gcn', 'hidden_dims': '[512, 256]', 'dropout': 0.20365812430552435, 'batch_norm': True, 'lr': 0.00024906301421156606, 'weight_decay': 7.431876206488407e-05, 'epochs': 158, 'loss': 'mse', 'optimizer': 'adam', 'graph_mode': 'cutoff', 'cutoff': 0.4346721312782823, 'grm_norm': 'cosine_then_gcn', 'self_loops': True, 'use_snp_selection': False}. Best is trial 45 with value: 0.09999459353692468.
[I 2025-11-03 13:41:47,051] Trial 116 finished with value: 0.08338118204559819 and parameters: {'model_type': 'gcn', 'hidden_dims': '[256, 128]', 'dropout': 0.13163621696658784, 'batch_norm': True, 'lr': 0.0008425314638859116, 'weight_decay': 0.00010017851199253841, 'epochs': 167, 'loss': 'mse', 'optimizer': 'adam', 'graph_mode': 'cutoff', 'cutoff': 0.5056402427043339, 'grm_norm': 'cosine_then_gcn', 'self_loops': True, 'use_snp_selection': False}. Best is trial 45 with value: 0.09999459353692468.
[I 2025-11-03 13:41:49,146] Trial 117 finished with value: 0.08814497520716408 and parameters: {'model_type': 'gcn', 'hidden_dims': '[512, 256]', 'dropout': 0.1605988891643525, 'batch_norm': True, 'lr': 0.0005356982690007267, 'weight_decay': 0.0003557646754504863, 'epochs': 142, 'loss': 'mse', 'optimizer': 'adam', 'graph_mode': 'cutoff', 'cutoff': 0.4042735784249476, 'grm_norm': 'cosine', 'self_loops': True, 'use_snp_selection': False}. Best is trial 45 with value: 0.09999459353692468.
