[I 2025-11-03 12:48:27,012] Trial 67 finished with value: 0.13946216004483628 and parameters: {'model_type': 'gcn', 'hidden_dims': '[512, 128]', 'dropout': 0.18324565009140942, 'batch_norm': True, 'lr': 0.0002071516996954732, 'weight_decay': 4.771614850293978e-07, 'epochs': 230, 'loss': 'mae', 'optimizer': 'adam', 'graph_mode': 'off', 'use_snp_selection': False}. Best is trial 49 with value: 0.1453007329103937.
[I 2025-11-03 12:48:31,709] Trial 68 finished with value: 0.1369989973710921 and parameters: {'model_type': 'gcn', 'hidden_dims': '[512, 128]', 'dropout': 0.1535832471102685, 'batch_norm': True, 'lr': 0.0005893201537863193, 'weight_decay': 1.4159724449718124e-06, 'epochs': 280, 'loss': 'mae', 'optimizer': 'adam', 'graph_mode': 'off', 'use_snp_selection': True, 'num_snps': 55768}. Best is trial 49 with value: 0.1453007329103937.
[I 2025-11-03 12:48:33,519] Trial 69 finished with value: 0.09775383171572737 and parameters: {'model_type': 'gcn', 'hidden_dims': '[128, 64]', 'dropout': 0.12043798376725605, 'batch_norm': True, 'lr': 6.035406976277527e-05, 'weight_decay': 1.0169070498521046e-07, 'epochs': 292, 'loss': 'mae', 'optimizer': 'adam', 'graph_mode': 'off', 'use_snp_selection': False}. Best is trial 49 with value: 0.1453007329103937.
[I 2025-11-03 12:48:35,804] Trial 70 finished with value: 0.11709945767296388 and parameters: {'model_type': 'gcn', 'hidden_dims': '[256, 128]', 'dropout': 0.14042211865788007, 'batch_norm': False, 'lr': 0.00038450511102090725, 'weight_decay': 2.2879525371874726e-06, 'epochs': 252, 'loss': 'mae', 'optimizer': 'adam', 'graph_mode': 'off', 'use_snp_selection': False}. Best is trial 49 with value: 0.1453007329103937.
[I 2025-11-03 12:48:39,102] Trial 71 finished with value: 0.1167952590373363 and parameters: {'model_type': 'gcn', 'hidden_dims': '[512, 128]', 'dropout': 0.18693830309644383, 'batch_norm': True, 'lr': 0.0002354664336059568, 'weight_decay': 4.6662141827587433e-07, 'epochs': 222, 'loss': 'mae', 'optimizer': 'adam', 'graph_mode': 'off', 'use_snp_selection': False}. Best is trial 49 with value: 0.1453007329103937.
[I 2025-11-03 12:48:42,491] Trial 72 finished with value: 0.14265408728691079 and parameters: {'model_type': 'gcn', 'hidden_dims': '[512, 128]', 'dropout': 0.11741421731832277, 'batch_norm': True, 'lr': 0.00019919378001566, 'weight_decay': 3.3163002120541384e-07, 'epochs': 233, 'loss': 'mae', 'optimizer': 'adam', 'graph_mode': 'off', 'use_snp_selection': False}. Best is trial 49 with value: 0.1453007329103937.
[I 2025-11-03 12:48:46,267] Trial 73 finished with value: 0.12995484922266365 and parameters: {'model_type': 'gcn', 'hidden_dims': '[512, 128]', 'dropout': 0.11578588700877872, 'batch_norm': True, 'lr': 0.00014398490198032934, 'weight_decay': 3.517396427729239e-07, 'epochs': 264, 'loss': 'mae', 'optimizer': 'adam', 'graph_mode': 'off', 'use_snp_selection': False}. Best is trial 49 with value: 0.1453007329103937.
[I 2025-11-03 12:48:49,856] Trial 74 finished with value: 0.15112741373180422 and parameters: {'model_type': 'gcn', 'hidden_dims': '[512, 128]', 'dropout': 0.16525882722108398, 'batch_norm': True, 'lr': 9.733096345021165e-05, 'weight_decay': 2.0788086088830108e-07, 'epochs': 249, 'loss': 'mae', 'optimizer': 'adam', 'graph_mode': 'off', 'use_snp_selection': False}. Best is trial 74 with value: 0.15112741373180422.
[I 2025-11-03 12:48:53,481] Trial 75 finished with value: 0.07246925424733579 and parameters: {'model_type': 'gcn', 'hidden_dims': '[512, 128]', 'dropout': 0.1306028675223579, 'batch_norm': True, 'lr': 2.8469066648160577e-05, 'weight_decay': 2.2514269646429825e-07, 'epochs': 247, 'loss': 'mae', 'optimizer': 'adam', 'graph_mode': 'off', 'use_snp_selection': False}. Best is trial 74 with value: 0.15112741373180422.
[I 2025-11-03 12:48:57,284] Trial 76 finished with value: 0.13482758403789788 and parameters: {'model_type': 'gcn', 'hidden_dims': '[512, 128]', 'dropout': 0.16065204981262166, 'batch_norm': True, 'lr': 0.00010051260345448436, 'weight_decay': 2.7820035088180226e-07, 'epochs': 265, 'loss': 'mae', 'optimizer': 'adam', 'graph_mode': 'off', 'use_snp_selection': False}. Best is trial 74 with value: 0.15112741373180422.
[I 2025-11-03 12:49:00,382] Trial 77 finished with value: 0.12214324067040876 and parameters: {'model_type': 'gcn', 'hidden_dims': '[512, 128]', 'dropout': 0.14377285438852774, 'batch_norm': True, 'lr': 8.254538386154332e-05, 'weight_decay': 3.5440696586496004e-05, 'epochs': 210, 'loss': 'mse', 'optimizer': 'adam', 'graph_mode': 'off', 'use_snp_selection': False}. Best is trial 74 with value: 0.15112741373180422.
[I 2025-11-03 12:49:03,753] Trial 78 finished with value: 0.12716582722487185 and parameters: {'model_type': 'gcn', 'hidden_dims': '[512, 128]', 'dropout': 0.17230248881150906, 'batch_norm': True, 'lr': 0.00048827503106179136, 'weight_decay': 1.9730825333253788e-07, 'epochs': 231, 'loss': 'mae', 'optimizer': 'adam', 'graph_mode': 'off', 'use_snp_selection': False}. Best is trial 74 with value: 0.15112741373180422.
[I 2025-11-03 12:49:06,576] Trial 79 finished with value: 0.1438577859238734 and parameters: {'model_type': 'gcn', 'hidden_dims': '[512, 128]', 'dropout': 0.12760071688474414, 'batch_norm': True, 'lr': 0.0006463925954356968, 'weight_decay': 6.638845392204766e-07, 'epochs': 155, 'loss': 'mae', 'optimizer': 'adam', 'graph_mode': 'off', 'use_snp_selection': True, 'num_snps': 40492}. Best is trial 74 with value: 0.15112741373180422.
[I 2025-11-03 12:49:09,607] Trial 80 finished with value: 0.12490899436667714 and parameters: {'model_type': 'gcn', 'hidden_dims': '[512, 128]', 'dropout': 0.46455783528152406, 'batch_norm': True, 'lr': 0.000971982775548219, 'weight_decay': 6.661388451253355e-07, 'epochs': 156, 'loss': 'mae', 'optimizer': 'adam', 'graph_mode': 'off', 'use_snp_selection': True, 'num_snps': 44421}. Best is trial 74 with value: 0.15112741373180422.
[I 2025-11-03 12:49:12,478] Trial 81 finished with value: 0.14219108993834467 and parameters: {'model_type': 'gcn', 'hidden_dims': '[512, 128]', 'dropout': 0.1244234830818921, 'batch_norm': True, 'lr': 0.0007444549217446593, 'weight_decay': 3.379576447919583e-07, 'epochs': 179, 'loss': 'mae', 'optimizer': 'adam', 'graph_mode': 'off', 'use_snp_selection': True, 'num_snps': 38905}. Best is trial 74 with value: 0.15112741373180422.
[I 2025-11-03 12:49:15,494] Trial 82 finished with value: 0.14382848591335434 and parameters: {'model_type': 'gcn', 'hidden_dims': '[512, 128]', 'dropout': 0.12375534891461956, 'batch_norm': True, 'lr': 0.0006644876183688149, 'weight_decay': 3.01092098396097e-07, 'epochs': 178, 'loss': 'mae', 'optimizer': 'adam', 'graph_mode': 'off', 'use_snp_selection': True, 'num_snps': 40087}. Best is trial 74 with value: 0.15112741373180422.
[I 2025-11-03 12:49:18,483] Trial 83 finished with value: 0.14420647514093682 and parameters: {'model_type': 'gcn', 'hidden_dims': '[512, 128]', 'dropout': 0.164536385257192, 'batch_norm': True, 'lr': 0.0006729337013140094, 'weight_decay': 3.358085496516856e-07, 'epochs': 181, 'loss': 'mae', 'optimizer': 'adam', 'graph_mode': 'off', 'use_snp_selection': True, 'num_snps': 40042}. Best is trial 74 with value: 0.15112741373180422.
[I 2025-11-03 12:49:21,447] Trial 84 finished with value: 0.13852706002177745 and parameters: {'model_type': 'gcn', 'hidden_dims': '[512, 128]', 'dropout': 0.16243084031442953, 'batch_norm': True, 'lr': 0.0008031241363219599, 'weight_decay': 9.045155906529492e-07, 'epochs': 178, 'loss': 'mae', 'optimizer': 'adam', 'graph_mode': 'off', 'use_snp_selection': True, 'num_snps': 39073}. Best is trial 74 with value: 0.15112741373180422.
[I 2025-11-03 12:49:24,315] Trial 85 finished with value: 0.13525032087920313 and parameters: {'model_type': 'gcn', 'hidden_dims': '[512, 128]', 'dropout': 0.15266106062092716, 'batch_norm': True, 'lr': 0.0006536809012177765, 'weight_decay': 3.143529075363152e-07, 'epochs': 199, 'loss': 'mae', 'optimizer': 'adam', 'graph_mode': 'off', 'use_snp_selection': True, 'num_snps': 34053}. Best is trial 74 with value: 0.15112741373180422.
[I 2025-11-03 12:49:27,312] Trial 86 finished with value: 0.13055665652906243 and parameters: {'model_type': 'gcn', 'hidden_dims': '[512, 128]', 'dropout': 0.3479176216210276, 'batch_norm': True, 'lr': 0.00040500729514081476, 'weight_decay': 5.554258365184516e-07, 'epochs': 156, 'loss': 'mae', 'optimizer': 'adam', 'graph_mode': 'off', 'use_snp_selection': True, 'num_snps': 43165}. Best is trial 74 with value: 0.15112741373180422.
[I 2025-11-03 12:49:30,047] Trial 87 finished with value: 0.10653301539727772 and parameters: {'model_type': 'gcn', 'hidden_dims': '[512, 128]', 'dropout': 0.20346093025350948, 'batch_norm': False, 'lr': 0.0008078140341034221, 'weight_decay': 3.559893211105164e-07, 'epochs': 171, 'loss': 'mae', 'optimizer': 'adam', 'graph_mode': 'off', 'use_snp_selection': True, 'num_snps': 37346}. Best is trial 74 with value: 0.15112741373180422.
[I 2025-11-03 12:49:33,166] Trial 88 finished with value: 0.13294050130021617 and parameters: {'model_type': 'gcn', 'hidden_dims': '[512, 128]', 'dropout': 0.1358134061239434, 'batch_norm': True, 'lr': 0.0006746124982077845, 'weight_decay': 1.4820380653584983e-07, 'epochs': 189, 'loss': 'mae', 'optimizer': 'adam', 'graph_mode': 'off', 'use_snp_selection': True, 'num_snps': 41052}. Best is trial 74 with value: 0.15112741373180422.
[I 2025-11-03 12:49:35,581] Trial 89 finished with value: 0.13625203715731715 and parameters: {'model_type': 'gcn', 'hidden_dims': '[256, 128, 64]', 'dropout': 0.11092803852142266, 'batch_norm': True, 'lr': 0.00027485539697910823, 'weight_decay': 4.2080101534868904e-07, 'epochs': 208, 'loss': 'mae', 'optimizer': 'adam', 'graph_mode': 'off', 'use_snp_selection': True, 'num_snps': 33679}. Best is trial 74 with value: 0.15112741373180422.
[I 2025-11-03 12:49:38,083] Trial 90 finished with value: 0.11309996524017525 and parameters: {'model_type': 'gcn', 'hidden_dims': '[512, 256]', 'dropout': 0.1723491010243852, 'batch_norm': True, 'lr': 0.00047157295632267997, 'weight_decay': 5.846555937711794e-07, 'epochs': 178, 'loss': 'mse', 'optimizer': 'adam', 'graph_mode': 'off', 'use_snp_selection': True, 'num_snps': 30748}. Best is trial 74 with value: 0.15112741373180422.
[I 2025-11-03 12:49:41,321] Trial 91 finished with value: 0.14234536545891188 and parameters: {'model_type': 'gcn', 'hidden_dims': '[512, 64]', 'dropout': 0.12838161389994882, 'batch_norm': True, 'lr': 0.000989940544190683, 'weight_decay': 2.8445045835352625e-07, 'epochs': 184, 'loss': 'mae', 'optimizer': 'adam', 'graph_mode': 'off', 'use_snp_selection': True, 'num_snps': 44652}. Best is trial 74 with value: 0.15112741373180422.
[I 2025-11-03 12:49:44,375] Trial 92 finished with value: 0.1364819205659773 and parameters: {'model_type': 'gcn', 'hidden_dims': '[512, 64]', 'dropout': 0.12662201041433904, 'batch_norm': True, 'lr': 0.0009238177688973312, 'weight_decay': 2.759217655167223e-07, 'epochs': 157, 'loss': 'mae', 'optimizer': 'adam', 'graph_mode': 'off', 'use_snp_selection': True, 'num_snps': 44854}. Best is trial 74 with value: 0.15112741373180422.
[I 2025-11-03 12:49:47,408] Trial 93 finished with value: 0.146774528196345 and parameters: {'model_type': 'gcn', 'hidden_dims': '[512, 64]', 'dropout': 0.14375664765603097, 'batch_norm': True, 'lr': 0.0006440942028407161, 'weight_decay': 1.6261806208430135e-07, 'epochs': 193, 'loss': 'mae', 'optimizer': 'adam', 'graph_mode': 'off', 'use_snp_selection': True, 'num_snps': 39249}. Best is trial 74 with value: 0.15112741373180422.
[I 2025-11-03 12:49:50,737] Trial 94 finished with value: 0.13911269233029264 and parameters: {'model_type': 'gcn', 'hidden_dims': '[512, 64]', 'dropout': 0.14948738782978283, 'batch_norm': True, 'lr': 0.0003400421446532137, 'weight_decay': 1.5847175156523254e-07, 'epochs': 198, 'loss': 'mae', 'optimizer': 'adam', 'graph_mode': 'off', 'use_snp_selection': True, 'num_snps': 42578}. Best is trial 74 with value: 0.15112741373180422.
[I 2025-11-03 12:49:54,187] Trial 95 finished with value: 0.14568262741973093 and parameters: {'model_type': 'gcn', 'hidden_dims': '[512, 64]', 'dropout': 0.16414834765163244, 'batch_norm': True, 'lr': 0.0006508613769472283, 'weight_decay': 1.302922224884369e-07, 'epochs': 192, 'loss': 'mae', 'optimizer': 'adam', 'graph_mode': 'off', 'use_snp_selection': True, 'num_snps': 46631}. Best is trial 74 with value: 0.15112741373180422.
[I 2025-11-03 12:49:57,682] Trial 96 finished with value: 0.13533844356683467 and parameters: {'model_type': 'gcn', 'hidden_dims': '[512, 64]', 'dropout': 0.18350091391716364, 'batch_norm': True, 'lr': 0.0005402202738595252, 'weight_decay': 1.2184888418929429e-07, 'epochs': 193, 'loss': 'mae', 'optimizer': 'adam', 'graph_mode': 'off', 'use_snp_selection': True, 'num_snps': 47148}. Best is trial 74 with value: 0.15112741373180422.
[I 2025-11-03 12:50:00,184] Trial 97 finished with value: 0.13873894833362416 and parameters: {'model_type': 'gcn', 'hidden_dims': '[512, 64]', 'dropout': 0.2175353970438697, 'batch_norm': True, 'lr': 0.0006369661715979291, 'weight_decay': 2.2563741771651147e-07, 'epochs': 141, 'loss': 'mae', 'optimizer': 'adam', 'graph_mode': 'off', 'use_snp_selection': True, 'num_snps': 35975}. Best is trial 74 with value: 0.15112741373180422.
[I 2025-11-03 12:50:02,575] Trial 98 finished with value: 0.13151155569840392 and parameters: {'model_type': 'gcn', 'hidden_dims': '[512, 64]', 'dropout': 0.16332612623707862, 'batch_norm': True, 'lr': 0.00038920329526296693, 'weight_decay': 1.3465520907762972e-07, 'epochs': 111, 'loss': 'mae', 'optimizer': 'adam', 'graph_mode': 'off', 'use_snp_selection': True, 'num_snps': 37763}. Best is trial 74 with value: 0.15112741373180422.
[I 2025-11-03 12:50:06,302] Trial 99 finished with value: 0.07867060643294915 and parameters: {'model_type': 'gcn', 'hidden_dims': '[512, 64]', 'dropout': 0.19055602515429138, 'batch_norm': True, 'lr': 8.517983712852646e-06, 'weight_decay': 1.6819540732852549e-07, 'epochs': 211, 'loss': 'mae', 'optimizer': 'adam', 'graph_mode': 'off', 'use_snp_selection': True, 'num_snps': 49865}. Best is trial 74 with value: 0.15112741373180422.
[I 2025-11-03 12:50:07,643] Trial 100 finished with value: 0.012764152574237611 and parameters: {'model_type': 'gcn', 'hidden_dims': '[512, 64]', 'dropout': 0.14181059425388887, 'batch_norm': False, 'lr': 1.0523002178846108e-06, 'weight_decay': 1.1667988505394754e-07, 'epochs': 164, 'loss': 'mae', 'optimizer': 'adam', 'graph_mode': 'off', 'use_snp_selection': True, 'num_snps': 8301}. Best is trial 74 with value: 0.15112741373180422.
[I 2025-11-03 12:50:11,132] Trial 101 finished with value: 0.13873175083772915 and parameters: {'model_type': 'gcn', 'hidden_dims': '[512, 64]', 'dropout': 0.11115065544774487, 'batch_norm': True, 'lr': 0.0009011108779920515, 'weight_decay': 2.0364100475620616e-07, 'epochs': 203, 'loss': 'mae', 'optimizer': 'adam', 'graph_mode': 'off', 'use_snp_selection': True, 'num_snps': 45590}. Best is trial 74 with value: 0.15112741373180422.
[I 2025-11-03 12:50:14,222] Trial 102 finished with value: 0.13776023699399187 and parameters: {'model_type': 'gcn', 'hidden_dims': '[512, 64]', 'dropout': 0.1539496609081273, 'batch_norm': True, 'lr': 0.0006102422225831884, 'weight_decay': 2.6369124018302105e-07, 'epochs': 184, 'loss': 'mae', 'optimizer': 'adam', 'graph_mode': 'off', 'use_snp_selection': True, 'num_snps': 41847}. Best is trial 74 with value: 0.15112741373180422.
[I 2025-11-03 12:50:17,496] Trial 103 finished with value: 0.133372149202045 and parameters: {'model_type': 'gcn', 'hidden_dims': '[512, 64]', 'dropout': 0.13367015738985077, 'batch_norm': True, 'lr': 0.0009928919089525698, 'weight_decay': 2.9970836710534224e-07, 'epochs': 171, 'loss': 'mae', 'optimizer': 'adam', 'graph_mode': 'off', 'use_snp_selection': True, 'num_snps': 47110}. Best is trial 74 with value: 0.15112741373180422.
[I 2025-11-03 12:50:20,786] Trial 104 finished with value: 0.14063134460992266 and parameters: {'model_type': 'gcn', 'hidden_dims': '[512, 64]', 'dropout': 0.11230966085599195, 'batch_norm': True, 'lr': 0.0007432263572935155, 'weight_decay': 4.894219225060594e-07, 'epochs': 223, 'loss': 'mae', 'optimizer': 'adam', 'graph_mode': 'off', 'use_snp_selection': True, 'num_snps': 39785}. Best is trial 74 with value: 0.15112741373180422.
[I 2025-11-03 12:50:24,301] Trial 105 finished with value: 0.13990426439969378 and parameters: {'model_type': 'gcn', 'hidden_dims': '[512, 128]', 'dropout': 0.1655276074156021, 'batch_norm': True, 'lr': 0.00043669677785694306, 'weight_decay': 1.7313302831909763e-07, 'epochs': 217, 'loss': 'mae', 'optimizer': 'adam', 'graph_mode': 'off', 'use_snp_selection': True, 'num_snps': 44698}. Best is trial 74 with value: 0.15112741373180422.
[I 2025-11-03 12:50:27,914] Trial 106 finished with value: 0.1301892916055642 and parameters: {'model_type': 'gcn', 'hidden_dims': '[512, 128]', 'dropout': 0.1788656322703788, 'batch_norm': True, 'lr': 0.0005268917907346867, 'weight_decay': 4.0561689907376977e-07, 'epochs': 192, 'loss': 'mae', 'optimizer': 'adam', 'graph_mode': 'off', 'use_snp_selection': True, 'num_snps': 50374}. Best is trial 74 with value: 0.15112741373180422.
[I 2025-11-03 12:50:30,859] Trial 107 finished with value: 0.13855222607456347 and parameters: {'model_type': 'gcn', 'hidden_dims': '[512, 64]', 'dropout': 0.1417930710801671, 'batch_norm': True, 'lr': 0.0007720230770236514, 'weight_decay': 2.4874997128280477e-07, 'epochs': 240, 'loss': 'mae', 'optimizer': 'adam', 'graph_mode': 'off', 'use_snp_selection': True, 'num_snps': 31444}. Best is trial 74 with value: 0.15112741373180422.
[I 2025-11-03 12:50:32,512] Trial 108 finished with value: 0.13257418532631352 and parameters: {'model_type': 'gcn', 'hidden_dims': '[256, 128, 64]', 'dropout': 0.12391687813565508, 'batch_norm': True, 'lr': 0.0008566780525800159, 'weight_decay': 7.886039881887171e-07, 'epochs': 46, 'loss': 'mse', 'optimizer': 'adam', 'graph_mode': 'off', 'use_snp_selection': True, 'num_snps': 36028}. Best is trial 74 with value: 0.15112741373180422.
[I 2025-11-03 12:50:35,959] Trial 109 finished with value: 0.12896348160720988 and parameters: {'model_type': 'gcn', 'hidden_dims': '[512, 128]', 'dropout': 0.5645851649527572, 'batch_norm': True, 'lr': 0.0006454148894394374, 'weight_decay': 1.4149803641669115e-07, 'epochs': 184, 'loss': 'mae', 'optimizer': 'adam', 'graph_mode': 'off', 'use_snp_selection': True, 'num_snps': 48257}. Best is trial 74 with value: 0.15112741373180422.
[I 2025-11-03 12:50:38,133] Trial 110 finished with value: 0.13303384460012066 and parameters: {'model_type': 'gcn', 'hidden_dims': '[512, 128]', 'dropout': 0.15387749756252087, 'batch_norm': True, 'lr': 0.0003298364442121216, 'weight_decay': 2.0948841836346778e-07, 'epochs': 59, 'loss': 'mae', 'optimizer': 'adam', 'graph_mode': 'off', 'use_snp_selection': True, 'num_snps': 42565}. Best is trial 74 with value: 0.15112741373180422.
[I 2025-11-03 12:50:41,055] Trial 111 finished with value: 0.14358628042397995 and parameters: {'model_type': 'gcn', 'hidden_dims': '[512, 128]', 'dropout': 0.12569908964190993, 'batch_norm': True, 'lr': 0.0007495783213675345, 'weight_decay': 3.3643288865020737e-07, 'epochs': 177, 'loss': 'mae', 'optimizer': 'adam', 'graph_mode': 'off', 'use_snp_selection': True, 'num_snps': 39598}. Best is trial 74 with value: 0.15112741373180422.
[I 2025-11-03 12:50:43,818] Trial 112 finished with value: 0.14192128488275285 and parameters: {'model_type': 'gcn', 'hidden_dims': '[512, 128]', 'dropout': 0.13398841541293272, 'batch_norm': True, 'lr': 0.0005190173440706244, 'weight_decay': 3.601854174374193e-07, 'epochs': 160, 'loss': 'mae', 'optimizer': 'adam', 'graph_mode': 'off', 'use_snp_selection': True, 'num_snps': 39259}. Best is trial 74 with value: 0.15112741373180422.
[I 2025-11-03 12:50:46,581] Trial 113 finished with value: 0.14233711564035637 and parameters: {'model_type': 'gcn', 'hidden_dims': '[512, 128]', 'dropout': 0.1074941582682759, 'batch_norm': True, 'lr': 0.000593742639392827, 'weight_decay': 3.056373854188187e-07, 'epochs': 138, 'loss': 'mae', 'optimizer': 'adam', 'graph_mode': 'off', 'use_snp_selection': True, 'num_snps': 41467}. Best is trial 74 with value: 0.15112741373180422.
[I 2025-11-03 12:50:49,832] Trial 114 finished with value: 0.13929508615368807 and parameters: {'model_type': 'gcn', 'hidden_dims': '[512, 256]', 'dropout': 0.12384743575916907, 'batch_norm': True, 'lr': 0.0006905730576567855, 'weight_decay': 1.7642095022650581e-07, 'epochs': 174, 'loss': 'mae', 'optimizer': 'adam', 'graph_mode': 'off', 'use_snp_selection': True, 'num_snps': 46014}. Best is trial 74 with value: 0.15112741373180422.
[I 2025-11-03 12:50:53,644] Trial 115 finished with value: 0.14328626081009715 and parameters: {'model_type': 'gcn', 'hidden_dims': '[512, 128]', 'dropout': 0.1424150503565011, 'batch_norm': True, 'lr': 0.00043255958777731695, 'weight_decay': 5.136069031517518e-07, 'epochs': 251, 'loss': 'mae', 'optimizer': 'adam', 'graph_mode': 'off', 'use_snp_selection': True, 'num_snps': 43745}. Best is trial 74 with value: 0.15112741373180422.
[I 2025-11-03 12:50:57,075] Trial 116 finished with value: 0.1435468615452523 and parameters: {'model_type': 'gcn', 'hidden_dims': '[512, 128]', 'dropout': 0.10002174463315389, 'batch_norm': True, 'lr': 0.00042973896130728105, 'weight_decay': 4.893715913115033e-07, 'epochs': 254, 'loss': 'mae', 'optimizer': 'adam', 'graph_mode': 'off', 'use_snp_selection': True, 'num_snps': 37560}. Best is trial 74 with value: 0.15112741373180422.
[I 2025-11-03 12:51:00,472] Trial 117 finished with value: 0.1410538762619189 and parameters: {'model_type': 'gcn', 'hidden_dims': '[512, 128]', 'dropout': 0.2856566995770472, 'batch_norm': True, 'lr': 0.00040079879985553034, 'weight_decay': 5.379726302586994e-07, 'epochs': 256, 'loss': 'mae', 'optimizer': 'adam', 'graph_mode': 'off', 'use_snp_selection': True, 'num_snps': 37798}. Best is trial 74 with value: 0.15112741373180422.
