[I 2025-11-03 14:56:29,746] Trial 95 finished with value: 0.0903836366870631 and parameters: {'model_type': 'graphsage', 'hidden_dims': '[128, 64]', 'dropout': 0.19751411936433325, 'batch_norm': True, 'lr': 0.0003534536520352129, 'weight_decay': 1.053024017586192e-05, 'epochs': 213, 'loss': 'mae', 'optimizer': 'adam', 'graph_mode': 'cutoff', 'cutoff': 0.5046824704592207, 'grm_norm': 'none', 'self_loops': True, 'use_snp_selection': False}. Best is trial 63 with value: 0.12672616425155095.
[I 2025-11-03 14:56:33,063] Trial 96 finished with value: 0.101057910814941 and parameters: {'model_type': 'graphsage', 'hidden_dims': '[512, 256]', 'dropout': 0.3409511926206103, 'batch_norm': True, 'lr': 0.00012833037452790545, 'weight_decay': 7.781863901856914e-05, 'epochs': 162, 'loss': 'mse', 'optimizer': 'adam', 'graph_mode': 'cutoff', 'cutoff': 0.7963871196016075, 'grm_norm': 'gcn', 'self_loops': False, 'use_snp_selection': False}. Best is trial 63 with value: 0.12672616425155095.
[I 2025-11-03 14:56:35,598] Trial 97 finished with value: 0.09882138186481687 and parameters: {'model_type': 'graphsage', 'hidden_dims': '[256, 128, 64]', 'dropout': 0.2562184435784812, 'batch_norm': True, 'lr': 0.00021189914800894268, 'weight_decay': 0.0009043936909643864, 'epochs': 218, 'loss': 'mse', 'optimizer': 'adam', 'graph_mode': 'cutoff', 'cutoff': 0.5821037432173726, 'grm_norm': 'cosine_then_gcn', 'self_loops': True, 'use_snp_selection': False}. Best is trial 63 with value: 0.12672616425155095.
[I 2025-11-03 14:56:38,078] Trial 98 finished with value: 0.09882558408196049 and parameters: {'model_type': 'graphsage', 'hidden_dims': '[512, 256]', 'dropout': 0.14072855085655434, 'batch_norm': True, 'lr': 0.0005069547223471079, 'weight_decay': 1.3513772594035718e-05, 'epochs': 52, 'loss': 'mse', 'optimizer': 'adam', 'graph_mode': 'cutoff', 'cutoff': 0.3321398052510382, 'grm_norm': 'none', 'self_loops': True, 'use_snp_selection': False}. Best is trial 63 with value: 0.12672616425155095.
[I 2025-11-03 14:56:40,159] Trial 99 finished with value: 0.10154613321489965 and parameters: {'model_type': 'graphsage', 'hidden_dims': '[256, 128]', 'dropout': 0.11119778617444316, 'batch_norm': True, 'lr': 0.0004346369017724629, 'weight_decay': 9.391455626536802e-07, 'epochs': 141, 'loss': 'mse', 'optimizer': 'adam', 'graph_mode': 'cutoff', 'cutoff': 0.2901830901984904, 'grm_norm': 'gcn', 'self_loops': False, 'use_snp_selection': False}. Best is trial 63 with value: 0.12672616425155095.
[I 2025-11-03 14:56:43,694] Trial 100 finished with value: 0.1166867173002984 and parameters: {'model_type': 'graphsage', 'hidden_dims': '[512, 64]', 'dropout': 0.21996795662011392, 'batch_norm': True, 'lr': 0.0007382700821159184, 'weight_decay': 1.4192999991950471e-06, 'epochs': 193, 'loss': 'mse', 'optimizer': 'adam', 'graph_mode': 'cutoff', 'cutoff': 0.38075644505334044, 'grm_norm': 'none', 'self_loops': True, 'use_snp_selection': False}. Best is trial 63 with value: 0.12672616425155095.
[I 2025-11-03 14:56:48,498] Trial 101 finished with value: 0.09087149994319942 and parameters: {'model_type': 'graphsage', 'hidden_dims': '[512, 256]', 'dropout': 0.2243584811809606, 'batch_norm': True, 'lr': 0.0002530996834681869, 'weight_decay': 3.064888864845217e-06, 'epochs': 254, 'loss': 'mse', 'optimizer': 'adam', 'graph_mode': 'knn', 'source': 'grm', 'knn_k': 10, 'weighted_edges': False, 'symmetrize_mode': 'union', 'use_snp_selection': False}. Best is trial 63 with value: 0.12672616425155095.
[I 2025-11-03 14:56:52,897] Trial 102 finished with value: 0.07977025901364274 and parameters: {'model_type': 'graphsage', 'hidden_dims': '[512, 256]', 'dropout': 0.20948571447572303, 'batch_norm': True, 'lr': 0.00029299420485349797, 'weight_decay': 1.082853595230471e-06, 'epochs': 232, 'loss': 'mse', 'optimizer': 'adam', 'graph_mode': 'knn', 'source': 'grm', 'knn_k': 8, 'weighted_edges': False, 'symmetrize_mode': 'union', 'use_snp_selection': False}. Best is trial 63 with value: 0.12672616425155095.
[I 2025-11-03 14:56:57,301] Trial 103 finished with value: 0.0759784451162663 and parameters: {'model_type': 'graphsage', 'hidden_dims': '[512, 256]', 'dropout': 0.17833339047113475, 'batch_norm': True, 'lr': 0.00010358427383218913, 'weight_decay': 5.670254465265804e-07, 'epochs': 241, 'loss': 'mse', 'optimizer': 'adam', 'graph_mode': 'knn', 'source': 'grm', 'knn_k': 7, 'weighted_edges': False, 'symmetrize_mode': 'union', 'use_snp_selection': False}. Best is trial 63 with value: 0.12672616425155095.
[I 2025-11-03 14:57:01,407] Trial 104 finished with value: 0.10335105868788977 and parameters: {'model_type': 'graphsage', 'hidden_dims': '[512, 256]', 'dropout': 0.23814163297387986, 'batch_norm': True, 'lr': 0.00019279857356736994, 'weight_decay': 2.8414217777786425e-07, 'epochs': 263, 'loss': 'mse', 'optimizer': 'adam', 'graph_mode': 'cutoff', 'cutoff': 0.428765839772157, 'grm_norm': 'gcn', 'self_loops': True, 'use_snp_selection': False}. Best is trial 63 with value: 0.12672616425155095.
[I 2025-11-03 14:57:05,259] Trial 105 finished with value: 0.11178753347516558 and parameters: {'model_type': 'graphsage', 'hidden_dims': '[512, 128]', 'dropout': 0.19086292732186855, 'batch_norm': True, 'lr': 0.00037601365969628877, 'weight_decay': 6.766778088228005e-07, 'epochs': 184, 'loss': 'mse', 'optimizer': 'adam', 'graph_mode': 'knn', 'source': 'grm', 'knn_k': 7, 'weighted_edges': False, 'symmetrize_mode': 'union', 'use_snp_selection': False}. Best is trial 63 with value: 0.12672616425155095.
[I 2025-11-03 14:57:08,506] Trial 106 finished with value: 0.08825708596084897 and parameters: {'model_type': 'graphsage', 'hidden_dims': '[512, 256]', 'dropout': 0.5029240165111672, 'batch_norm': True, 'lr': 0.00014373409419672528, 'weight_decay': 4.251987153667705e-05, 'epochs': 158, 'loss': 'mse', 'optimizer': 'adam', 'graph_mode': 'cutoff', 'cutoff': 0.8960245315804856, 'grm_norm': 'gcn', 'self_loops': False, 'use_snp_selection': False}. Best is trial 63 with value: 0.12672616425155095.
[I 2025-11-03 14:57:11,551] Trial 107 finished with value: 0.08785974442617361 and parameters: {'model_type': 'graphsage', 'hidden_dims': '[128, 64]', 'dropout': 0.15938120431978092, 'batch_norm': False, 'lr': 3.8548496564862e-05, 'weight_decay': 7.105526527189469e-06, 'epochs': 273, 'loss': 'mse', 'optimizer': 'adam', 'graph_mode': 'cutoff', 'cutoff': 0.6168250145896365, 'grm_norm': 'none', 'self_loops': True, 'use_snp_selection': True, 'num_snps': 37397}. Best is trial 63 with value: 0.12672616425155095.
[I 2025-11-03 14:57:15,532] Trial 108 finished with value: 0.11310706360967623 and parameters: {'model_type': 'graphsage', 'hidden_dims': '[512, 256]', 'dropout': 0.12972798692703758, 'batch_norm': True, 'lr': 0.00033494462658901873, 'weight_decay': 1.1421002062195178e-06, 'epochs': 208, 'loss': 'mse', 'optimizer': 'adam', 'graph_mode': 'knn', 'source': 'grm', 'knn_k': 9, 'weighted_edges': False, 'symmetrize_mode': 'mutual', 'use_snp_selection': False}. Best is trial 63 with value: 0.12672616425155095.
[I 2025-11-03 14:57:17,844] Trial 109 finished with value: 0.09907264505963834 and parameters: {'model_type': 'graphsage', 'hidden_dims': '[256, 128, 64]', 'dropout': 0.20140014703904005, 'batch_norm': True, 'lr': 0.00024079490079014287, 'weight_decay': 1.6265326326388469e-06, 'epochs': 168, 'loss': 'mae', 'optimizer': 'adam', 'graph_mode': 'cutoff', 'cutoff': 0.5462591256929404, 'grm_norm': 'gcn', 'self_loops': False, 'use_snp_selection': False}. Best is trial 63 with value: 0.12672616425155095.
[I 2025-11-03 14:57:21,873] Trial 110 finished with value: 0.11282328458526283 and parameters: {'model_type': 'graphsage', 'hidden_dims': '[512, 256]', 'dropout': 0.17219572968059205, 'batch_norm': True, 'lr': 0.00047182981188617195, 'weight_decay': 3.210676674315843e-05, 'epochs': 246, 'loss': 'mse', 'optimizer': 'adam', 'graph_mode': 'cutoff', 'cutoff': 0.46230743214897563, 'grm_norm': 'none', 'self_loops': True, 'use_snp_selection': False}. Best is trial 63 with value: 0.12672616425155095.
[I 2025-11-03 14:57:25,348] Trial 111 finished with value: 0.10089176553919407 and parameters: {'model_type': 'graphsage', 'hidden_dims': '[512, 64]', 'dropout': 0.2239812491769731, 'batch_norm': True, 'lr': 0.0009701221113268365, 'weight_decay': 1.3869992035535714e-06, 'epochs': 176, 'loss': 'mse', 'optimizer': 'adam', 'graph_mode': 'cutoff', 'cutoff': 0.37231743289012365, 'grm_norm': 'none', 'self_loops': True, 'use_snp_selection': False}. Best is trial 63 with value: 0.12672616425155095.
[I 2025-11-03 14:57:28,935] Trial 112 finished with value: 0.10750870529362679 and parameters: {'model_type': 'graphsage', 'hidden_dims': '[512, 64]', 'dropout': 0.25675270920548454, 'batch_norm': True, 'lr': 0.0007244402357070569, 'weight_decay': 2.3443612250225194e-06, 'epochs': 198, 'loss': 'mse', 'optimizer': 'adam', 'graph_mode': 'cutoff', 'cutoff': 0.39210022402806916, 'grm_norm': 'none', 'self_loops': True, 'use_snp_selection': False}. Best is trial 63 with value: 0.12672616425155095.
[I 2025-11-03 14:57:32,518] Trial 113 finished with value: 0.10760928573501444 and parameters: {'model_type': 'graphsage', 'hidden_dims': '[512, 64]', 'dropout': 0.2217674822745327, 'batch_norm': True, 'lr': 0.0005835078814454975, 'weight_decay': 9.286089067838024e-07, 'epochs': 191, 'loss': 'mse', 'optimizer': 'adam', 'graph_mode': 'cutoff', 'cutoff': 0.49681846499863697, 'grm_norm': 'none', 'self_loops': True, 'use_snp_selection': False}. Best is trial 63 with value: 0.12672616425155095.
[I 2025-11-03 14:57:36,137] Trial 114 finished with value: 0.11656430093652324 and parameters: {'model_type': 'graphsage', 'hidden_dims': '[512, 64]', 'dropout': 0.23833663012710882, 'batch_norm': True, 'lr': 0.00081079738291122, 'weight_decay': 4.5028910181116964e-07, 'epochs': 196, 'loss': 'mse', 'optimizer': 'adam', 'graph_mode': 'cutoff', 'cutoff': 0.35685479808586207, 'grm_norm': 'none', 'self_loops': True, 'use_snp_selection': False}. Best is trial 63 with value: 0.12672616425155095.
[I 2025-11-03 14:57:38,374] Trial 115 finished with value: 0.11425612817736444 and parameters: {'model_type': 'graphsage', 'hidden_dims': '[256, 128]', 'dropout': 0.20746633183442476, 'batch_norm': True, 'lr': 0.0005421015194129737, 'weight_decay': 9.776482158242657e-06, 'epochs': 183, 'loss': 'mse', 'optimizer': 'adam', 'graph_mode': 'cutoff', 'cutoff': 0.5624204533103785, 'grm_norm': 'gcn', 'self_loops': True, 'use_snp_selection': False}. Best is trial 63 with value: 0.12672616425155095.
[I 2025-11-03 14:57:41,602] Trial 116 finished with value: 0.0908701191723805 and parameters: {'model_type': 'graphsage', 'hidden_dims': '[512, 64]', 'dropout': 0.2178643943134059, 'batch_norm': True, 'lr': 1.8315735200690824e-05, 'weight_decay': 1.9601562824919147e-06, 'epochs': 148, 'loss': 'mse', 'optimizer': 'adam', 'graph_mode': 'cutoff', 'cutoff': 0.859139782335003, 'grm_norm': 'gcn', 'self_loops': True, 'use_snp_selection': False}. Best is trial 63 with value: 0.12672616425155095.
[I 2025-11-03 14:57:45,420] Trial 117 finished with value: 0.10992702184692682 and parameters: {'model_type': 'graphsage', 'hidden_dims': '[512, 256]', 'dropout': 0.18922014187465594, 'batch_norm': True, 'lr': 0.0004022716480321436, 'weight_decay': 5.661242905302507e-06, 'epochs': 176, 'loss': 'mse', 'optimizer': 'adam', 'graph_mode': 'knn', 'source': 'grm', 'knn_k': 6, 'weighted_edges': True, 'symmetrize_mode': 'union', 'use_snp_selection': False}. Best is trial 63 with value: 0.12672616425155095.
[I 2025-11-03 14:57:48,774] Trial 118 finished with value: 0.010373456622775994 and parameters: {'model_type': 'graphsage', 'hidden_dims': '[512, 256]', 'dropout': 0.15446206794628897, 'batch_norm': True, 'lr': 1.0734192924881945e-06, 'weight_decay': 3.948490147739809e-06, 'epochs': 165, 'loss': 'mse', 'optimizer': 'adam', 'graph_mode': 'cutoff', 'cutoff': 0.4076796780397589, 'grm_norm': 'cosine', 'self_loops': True, 'use_snp_selection': False}. Best is trial 63 with value: 0.12672616425155095.
[I 2025-11-03 14:57:50,490] Trial 119 finished with value: 0.08076512662141916 and parameters: {'model_type': 'graphsage', 'hidden_dims': '[128, 64]', 'dropout': 0.2696123787182126, 'batch_norm': True, 'lr': 4.1902617274999766e-06, 'weight_decay': 1.2462941291251252e-06, 'epochs': 154, 'loss': 'mse', 'optimizer': 'adam', 'graph_mode': 'cutoff', 'cutoff': 0.6631529105106398, 'grm_norm': 'none', 'self_loops': False, 'use_snp_selection': False}. Best is trial 63 with value: 0.12672616425155095.
[I 2025-11-03 14:57:54,425] Trial 120 finished with value: 0.1155271512019223 and parameters: {'model_type': 'graphsage', 'hidden_dims': '[512, 256]', 'dropout': 0.18019039975915907, 'batch_norm': True, 'lr': 0.0006439648960065078, 'weight_decay': 1.5557423854051057e-06, 'epochs': 235, 'loss': 'mse', 'optimizer': 'adam', 'graph_mode': 'cutoff', 'cutoff': 0.518369063300046, 'grm_norm': 'cosine_then_gcn', 'self_loops': True, 'use_snp_selection': False}. Best is trial 63 with value: 0.12672616425155095.
[I 2025-11-03 14:57:58,035] Trial 121 finished with value: 0.10195579165407552 and parameters: {'model_type': 'graphsage', 'hidden_dims': '[512, 64]', 'dropout': 0.23816146592208218, 'batch_norm': True, 'lr': 0.0008593942510121116, 'weight_decay': 8.098146935534147e-07, 'epochs': 197, 'loss': 'mse', 'optimizer': 'adam', 'graph_mode': 'cutoff', 'cutoff': 0.31388242020382656, 'grm_norm': 'none', 'self_loops': True, 'use_snp_selection': False}. Best is trial 63 with value: 0.12672616425155095.
[I 2025-11-03 14:58:01,581] Trial 122 finished with value: 0.11555969917118203 and parameters: {'model_type': 'graphsage', 'hidden_dims': '[512, 64]', 'dropout': 0.24550293283372224, 'batch_norm': True, 'lr': 0.0008500986050832549, 'weight_decay': 4.865415292579437e-07, 'epochs': 190, 'loss': 'mse', 'optimizer': 'adam', 'graph_mode': 'cutoff', 'cutoff': 0.35541722270715154, 'grm_norm': 'none', 'self_loops': True, 'use_snp_selection': False}. Best is trial 63 with value: 0.12672616425155095.
[I 2025-11-03 14:58:05,320] Trial 123 finished with value: 0.11083905100655009 and parameters: {'model_type': 'graphsage', 'hidden_dims': '[512, 64]', 'dropout': 0.23120965279210082, 'batch_norm': True, 'lr': 0.0007888902000790871, 'weight_decay': 4.350813152903302e-07, 'epochs': 219, 'loss': 'mse', 'optimizer': 'adam', 'graph_mode': 'cutoff', 'cutoff': 0.38297568326316345, 'grm_norm': 'none', 'self_loops': True, 'use_snp_selection': False}. Best is trial 63 with value: 0.12672616425155095.
[I 2025-11-03 14:58:08,736] Trial 124 finished with value: 0.10057947146210032 and parameters: {'model_type': 'graphsage', 'hidden_dims': '[512, 64]', 'dropout': 0.20619686176484064, 'batch_norm': True, 'lr': 0.000634504475549618, 'weight_decay': 1.630256753518447e-05, 'epochs': 173, 'loss': 'mse', 'optimizer': 'adam', 'graph_mode': 'cutoff', 'cutoff': 0.4326880873909199, 'grm_norm': 'none', 'self_loops': True, 'use_snp_selection': False}. Best is trial 63 with value: 0.12672616425155095.
[I 2025-11-03 14:58:12,453] Trial 125 finished with value: 0.1181139656497344 and parameters: {'model_type': 'graphsage', 'hidden_dims': '[512, 64]', 'dropout': 0.196535087784298, 'batch_norm': True, 'lr': 0.0007544266440237225, 'weight_decay': 2.8995723559150324e-07, 'epochs': 202, 'loss': 'mse', 'optimizer': 'adam', 'graph_mode': 'cutoff', 'cutoff': 0.23807225562724466, 'grm_norm': 'gcn', 'self_loops': True, 'use_snp_selection': False}. Best is trial 63 with value: 0.12672616425155095.
[I 2025-11-03 14:58:15,253] Trial 126 finished with value: 0.06679325385588081 and parameters: {'model_type': 'graphsage', 'hidden_dims': '[256, 128, 64]', 'dropout': 0.19169967081394676, 'batch_norm': False, 'lr': 0.00029778011677411353, 'weight_decay': 1.138641105405039e-07, 'epochs': 206, 'loss': 'mse', 'optimizer': 'adam', 'graph_mode': 'cutoff', 'cutoff': 0.4641965815865539, 'grm_norm': 'gcn', 'self_loops': False, 'use_snp_selection': True, 'num_snps': 25419}. Best is trial 63 with value: 0.12672616425155095.
[I 2025-11-03 14:58:17,234] Trial 127 finished with value: 0.1200277322797184 and parameters: {'model_type': 'graphsage', 'hidden_dims': '[256, 128]', 'dropout': 0.1613896010096112, 'batch_norm': True, 'lr': 0.00052927781042488, 'weight_decay': 6.096481499925545e-07, 'epochs': 97, 'loss': 'mse', 'optimizer': 'adam', 'graph_mode': 'knn', 'source': 'grm', 'knn_k': 1, 'weighted_edges': True, 'symmetrize_mode': 'mutual', 'use_snp_selection': False}. Best is trial 63 with value: 0.12672616425155095.
[I 2025-11-03 14:58:19,231] Trial 128 finished with value: 0.10737689590399473 and parameters: {'model_type': 'graphsage', 'hidden_dims': '[256, 128]', 'dropout': 0.12313330056269942, 'batch_norm': True, 'lr': 0.0004808723592031427, 'weight_decay': 2.3741345177985286e-07, 'epochs': 107, 'loss': 'mae', 'optimizer': 'adam', 'graph_mode': 'knn', 'source': 'grm', 'knn_k': 2, 'weighted_edges': True, 'symmetrize_mode': 'mutual', 'use_snp_selection': False}. Best is trial 63 with value: 0.12672616425155095.
[I 2025-11-03 14:58:21,006] Trial 129 finished with value: 0.0883509635635919 and parameters: {'model_type': 'graphsage', 'hidden_dims': '[256, 128]', 'dropout': 0.1407835293307687, 'batch_norm': True, 'lr': 2.226199458152932e-05, 'weight_decay': 6.500823960095913e-07, 'epochs': 60, 'loss': 'mse', 'optimizer': 'adam', 'graph_mode': 'knn', 'source': 'grm', 'knn_k': 1, 'weighted_edges': True, 'symmetrize_mode': 'mutual', 'use_snp_selection': False}. Best is trial 63 with value: 0.12672616425155095.
[I 2025-11-03 14:58:22,956] Trial 130 finished with value: 0.11948712407702836 and parameters: {'model_type': 'graphsage', 'hidden_dims': '[256, 128]', 'dropout': 0.1675425187787859, 'batch_norm': True, 'lr': 0.00036208385635519603, 'weight_decay': 2.2756039764360733e-05, 'epochs': 101, 'loss': 'mse', 'optimizer': 'adam', 'graph_mode': 'knn', 'source': 'grm', 'knn_k': 1, 'weighted_edges': True, 'symmetrize_mode': 'mutual', 'use_snp_selection': False}. Best is trial 63 with value: 0.12672616425155095.
[I 2025-11-03 14:58:24,886] Trial 131 finished with value: 0.10645063291709927 and parameters: {'model_type': 'graphsage', 'hidden_dims': '[256, 128]', 'dropout': 0.1664771282147534, 'batch_norm': True, 'lr': 0.00039020462799831265, 'weight_decay': 1.735673861724147e-07, 'epochs': 96, 'loss': 'mse', 'optimizer': 'adam', 'graph_mode': 'knn', 'source': 'grm', 'knn_k': 1, 'weighted_edges': True, 'symmetrize_mode': 'mutual', 'use_snp_selection': False}. Best is trial 63 with value: 0.12672616425155095.
[I 2025-11-03 14:58:26,844] Trial 132 finished with value: 0.1359814845743888 and parameters: {'model_type': 'graphsage', 'hidden_dims': '[256, 128]', 'dropout': 0.14831003315473684, 'batch_norm': True, 'lr': 0.00033416682210509553, 'weight_decay': 2.4000748587341224e-05, 'epochs': 103, 'loss': 'mse', 'optimizer': 'adam', 'graph_mode': 'knn', 'source': 'grm', 'knn_k': 1, 'weighted_edges': True, 'symmetrize_mode': 'mutual', 'use_snp_selection': False}. Best is trial 132 with value: 0.1359814845743888.
[I 2025-11-03 14:58:28,719] Trial 133 finished with value: 0.11043291509440702 and parameters: {'model_type': 'graphsage', 'hidden_dims': '[256, 128]', 'dropout': 0.15047647288920712, 'batch_norm': True, 'lr': 0.0004530168804354182, 'weight_decay': 2.3669439462672077e-05, 'epochs': 83, 'loss': 'mse', 'optimizer': 'adam', 'graph_mode': 'knn', 'source': 'grm', 'knn_k': 1, 'weighted_edges': True, 'symmetrize_mode': 'mutual', 'use_snp_selection': False}. Best is trial 132 with value: 0.1359814845743888.
[I 2025-11-03 14:58:30,721] Trial 134 finished with value: 0.11889372883120419 and parameters: {'model_type': 'graphsage', 'hidden_dims': '[256, 128]', 'dropout': 0.168205235912747, 'batch_norm': True, 'lr': 0.0003476477817561981, 'weight_decay': 2.0746542336546912e-05, 'epochs': 113, 'loss': 'mse', 'optimizer': 'adam', 'graph_mode': 'knn', 'source': 'grm', 'knn_k': 1, 'weighted_edges': True, 'symmetrize_mode': 'mutual', 'use_snp_selection': False}. Best is trial 132 with value: 0.1359814845743888.
[I 2025-11-03 14:58:32,663] Trial 135 finished with value: 0.10625475274736992 and parameters: {'model_type': 'graphsage', 'hidden_dims': '[256, 128]', 'dropout': 0.16189630773823016, 'batch_norm': True, 'lr': 0.0003460597229797385, 'weight_decay': 3.3944337934775626e-07, 'epochs': 99, 'loss': 'mse', 'optimizer': 'adam', 'graph_mode': 'knn', 'source': 'grm', 'knn_k': 1, 'weighted_edges': True, 'symmetrize_mode': 'mutual', 'use_snp_selection': False}. Best is trial 132 with value: 0.1359814845743888.
[I 2025-11-03 14:58:34,677] Trial 136 finished with value: 0.11949742222890307 and parameters: {'model_type': 'graphsage', 'hidden_dims': '[256, 128]', 'dropout': 0.11129970729242533, 'batch_norm': True, 'lr': 0.0005315886197535162, 'weight_decay': 1.20815999631326e-05, 'epochs': 111, 'loss': 'mse', 'optimizer': 'adam', 'graph_mode': 'knn', 'source': 'grm', 'knn_k': 2, 'weighted_edges': True, 'symmetrize_mode': 'mutual', 'use_snp_selection': False}. Best is trial 132 with value: 0.1359814845743888.
[I 2025-11-03 14:58:36,749] Trial 137 finished with value: 0.11569320486252736 and parameters: {'model_type': 'graphsage', 'hidden_dims': '[256, 128]', 'dropout': 0.10419127672320942, 'batch_norm': True, 'lr': 0.0005325502454262292, 'weight_decay': 1.287358197182733e-05, 'epochs': 124, 'loss': 'mse', 'optimizer': 'adam', 'graph_mode': 'knn', 'source': 'grm', 'knn_k': 2, 'weighted_edges': True, 'symmetrize_mode': 'mutual', 'use_snp_selection': False}. Best is trial 132 with value: 0.1359814845743888.
