[I 2025-11-13 05:16:13,739] Trial 8 finished with value: 0.2963679822695746 and parameters: {'model_type': 'graphsage', 'hidden_dims': '[512, 128]', 'dropout': 0.5066580418354021, 'batch_norm': True, 'lr': 0.00039213678276659976, 'weight_decay': 3.43655320802934e-06, 'epochs': 120, 'loss': 'mse', 'optimizer': 'adam', 'graph_mode': 'cutoff', 'cutoff': 0.34923059576505366, 'grm_norm': 'cosine', 'self_loops': True, 'use_snp_selection': False}. Best is trial 8 with value: 0.2963679822695746.
[I 2025-11-13 05:17:29,967] Trial 9 finished with value: 0.26153618254141087 and parameters: {'model_type': 'graphsage', 'hidden_dims': '[512, 256]', 'dropout': 0.301734920240333, 'batch_norm': False, 'lr': 6.650961854953448e-06, 'weight_decay': 6.861575656590315e-05, 'epochs': 150, 'loss': 'mae', 'optimizer': 'adam', 'graph_mode': 'cutoff', 'cutoff': 0.2857569870061939, 'grm_norm': 'cosine_then_gcn', 'self_loops': False, 'use_snp_selection': True, 'num_snps': 12722}. Best is trial 8 with value: 0.2963679822695746.
[I 2025-11-13 05:21:41,498] Trial 10 finished with value: 0.27037961701956376 and parameters: {'model_type': 'graphsage', 'hidden_dims': '[512, 128]', 'dropout': 0.5885461262002587, 'batch_norm': True, 'lr': 0.0001051230339774825, 'weight_decay': 1.3387352389235743e-07, 'epochs': 258, 'loss': 'mse', 'optimizer': 'adam', 'graph_mode': 'cutoff', 'cutoff': 0.2684196492120865, 'grm_norm': 'cosine', 'self_loops': True, 'use_snp_selection': False}. Best is trial 8 with value: 0.2963679822695746.
[I 2025-11-13 05:23:42,563] Trial 11 finished with value: 0.2612293181308188 and parameters: {'model_type': 'graphsage', 'hidden_dims': '[256, 128]', 'dropout': 0.4214049075657615, 'batch_norm': False, 'lr': 3.7182875105328795e-05, 'weight_decay': 8.733527807051696e-07, 'epochs': 123, 'loss': 'mae', 'optimizer': 'adam', 'graph_mode': 'knn', 'source': 'grm', 'knn_k': 1, 'weighted_edges': False, 'symmetrize_mode': 'union', 'use_snp_selection': True, 'num_snps': 57977}. Best is trial 8 with value: 0.2963679822695746.
[I 2025-11-13 05:25:50,853] Trial 12 finished with value: 0.24764490990018664 and parameters: {'model_type': 'graphsage', 'hidden_dims': '[512, 128]', 'dropout': 0.4599947205431382, 'batch_norm': True, 'lr': 7.90274437063362e-06, 'weight_decay': 2.1215328315431727e-06, 'epochs': 98, 'loss': 'mse', 'optimizer': 'adam', 'graph_mode': 'cutoff', 'cutoff': 0.421678803879304, 'grm_norm': 'cosine', 'self_loops': True, 'use_snp_selection': True, 'num_snps': 46224}. Best is trial 8 with value: 0.2963679822695746.
[I 2025-11-13 05:29:02,885] Trial 13 finished with value: 0.041411680670509085 and parameters: {'model_type': 'graphsage', 'hidden_dims': '[512, 64]', 'dropout': 0.48431307369261917, 'batch_norm': False, 'lr': 0.0009511944508019283, 'weight_decay': 3.5747956999090315e-07, 'epochs': 267, 'loss': 'mae', 'optimizer': 'adam', 'graph_mode': 'knn', 'source': 'grm', 'knn_k': 3, 'weighted_edges': False, 'symmetrize_mode': 'mutual', 'use_snp_selection': False}. Best is trial 8 with value: 0.2963679822695746.
[I 2025-11-13 05:29:50,616] Trial 14 finished with value: 0.23852397627380678 and parameters: {'model_type': 'graphsage', 'hidden_dims': '[256, 128]', 'dropout': 0.2833202860108971, 'batch_norm': False, 'lr': 8.589510603311415e-05, 'weight_decay': 3.3027094595086673e-06, 'epochs': 152, 'loss': 'mse', 'optimizer': 'adam', 'graph_mode': 'cutoff', 'cutoff': 0.8580286026410489, 'grm_norm': 'cosine', 'self_loops': True, 'use_snp_selection': True, 'num_snps': 3235}. Best is trial 8 with value: 0.2963679822695746.
[I 2025-11-13 05:31:27,270] Trial 15 finished with value: 0.30394102232945264 and parameters: {'model_type': 'graphsage', 'hidden_dims': '[512, 128]', 'dropout': 0.5886626138803472, 'batch_norm': True, 'lr': 0.0002583299346305667, 'weight_decay': 3.1936579028355376e-07, 'epochs': 89, 'loss': 'mae', 'optimizer': 'adam', 'graph_mode': 'knn', 'source': 'grm', 'knn_k': 10, 'weighted_edges': False, 'symmetrize_mode': 'mutual', 'use_snp_selection': False}. Best is trial 15 with value: 0.30394102232945264.
[I 2025-11-13 05:32:53,957] Trial 16 finished with value: 0.2953784163637896 and parameters: {'model_type': 'graphsage', 'hidden_dims': '[512, 128]', 'dropout': 0.5900504616559741, 'batch_norm': True, 'lr': 0.000302223164161179, 'weight_decay': 1.2212744467170829e-07, 'epochs': 92, 'loss': 'mae', 'optimizer': 'adam', 'graph_mode': 'cutoff', 'cutoff': 0.42757419724647805, 'grm_norm': 'none', 'self_loops': True, 'use_snp_selection': False}. Best is trial 15 with value: 0.30394102232945264.
[I 2025-11-13 05:34:09,631] Trial 17 finished with value: 0.2795784117557455 and parameters: {'model_type': 'graphsage', 'hidden_dims': '[512, 128]', 'dropout': 0.5437108080324877, 'batch_norm': True, 'lr': 0.0002935696797293651, 'weight_decay': 4.793065973385483e-06, 'epochs': 43, 'loss': 'mse', 'optimizer': 'adam', 'graph_mode': 'knn', 'source': 'grm', 'knn_k': 10, 'weighted_edges': False, 'symmetrize_mode': 'union', 'use_snp_selection': False}. Best is trial 15 with value: 0.30394102232945264.
[I 2025-11-13 05:35:41,734] Trial 18 finished with value: 0.2884085803808806 and parameters: {'model_type': 'graphsage', 'hidden_dims': '[512, 128]', 'dropout': 0.5932145448255082, 'batch_norm': True, 'lr': 0.00019877754138515873, 'weight_decay': 4.3102153413331945e-07, 'epochs': 83, 'loss': 'mse', 'optimizer': 'adam', 'graph_mode': 'knn', 'source': 'grm', 'knn_k': 10, 'weighted_edges': False, 'symmetrize_mode': 'mutual', 'use_snp_selection': False}. Best is trial 15 with value: 0.30394102232945264.
[I 2025-11-13 05:36:50,298] Trial 19 finished with value: 0.28474951920956054 and parameters: {'model_type': 'graphsage', 'hidden_dims': '[256, 128, 64]', 'dropout': 0.5297881400657614, 'batch_norm': True, 'lr': 0.0004672447320331081, 'weight_decay': 0.0004972147708801724, 'epochs': 115, 'loss': 'mae', 'optimizer': 'adam', 'graph_mode': 'cutoff', 'cutoff': 0.4300418329316046, 'grm_norm': 'cosine_then_gcn', 'self_loops': True, 'use_snp_selection': False}. Best is trial 15 with value: 0.30394102232945264.
[I 2025-11-13 05:41:33,407] Trial 20 finished with value: 0.2595394774554488 and parameters: {'model_type': 'graphsage', 'hidden_dims': '[512, 64]', 'dropout': 0.46460394356309936, 'batch_norm': True, 'lr': 7.812961624746165e-05, 'weight_decay': 3.040483166640534e-07, 'epochs': 236, 'loss': 'mae', 'optimizer': 'adam', 'graph_mode': 'cutoff', 'cutoff': 0.2386548621641688, 'grm_norm': 'cosine', 'self_loops': True, 'use_snp_selection': False}. Best is trial 15 with value: 0.30394102232945264.
[I 2025-11-13 05:42:54,777] Trial 21 finished with value: 0.2958900827414012 and parameters: {'model_type': 'graphsage', 'hidden_dims': '[512, 128]', 'dropout': 0.5897201518750793, 'batch_norm': True, 'lr': 0.0003556819313725332, 'weight_decay': 1.361605791599345e-07, 'epochs': 84, 'loss': 'mae', 'optimizer': 'adam', 'graph_mode': 'cutoff', 'cutoff': 0.43074288368722646, 'grm_norm': 'none', 'self_loops': True, 'use_snp_selection': False}. Best is trial 15 with value: 0.30394102232945264.
[I 2025-11-13 05:44:04,648] Trial 22 finished with value: 0.30258213504698217 and parameters: {'model_type': 'graphsage', 'hidden_dims': '[512, 128]', 'dropout': 0.5568250813104589, 'batch_norm': True, 'lr': 0.0003736446535633141, 'weight_decay': 1.3016919820075293e-07, 'epochs': 65, 'loss': 'mae', 'optimizer': 'adam', 'graph_mode': 'cutoff', 'cutoff': 0.36089248496224424, 'grm_norm': 'none', 'self_loops': True, 'use_snp_selection': False}. Best is trial 15 with value: 0.30394102232945264.
[I 2025-11-13 05:45:06,833] Trial 23 finished with value: 0.3049833692233162 and parameters: {'model_type': 'graphsage', 'hidden_dims': '[512, 128]', 'dropout': 0.548930203501308, 'batch_norm': True, 'lr': 0.0009159002709045302, 'weight_decay': 8.043034722721515e-07, 'epochs': 53, 'loss': 'mae', 'optimizer': 'adam', 'graph_mode': 'cutoff', 'cutoff': 0.33727905809566394, 'grm_norm': 'none', 'self_loops': True, 'use_snp_selection': False}. Best is trial 23 with value: 0.3049833692233162.
[I 2025-11-13 05:46:04,659] Trial 24 finished with value: 0.2937051544794317 and parameters: {'model_type': 'graphsage', 'hidden_dims': '[512, 128]', 'dropout': 0.5383430673285498, 'batch_norm': True, 'lr': 0.0007654323206120642, 'weight_decay': 7.790311217087598e-07, 'epochs': 60, 'loss': 'mae', 'optimizer': 'adam', 'graph_mode': 'cutoff', 'cutoff': 0.5533704323866921, 'grm_norm': 'none', 'self_loops': True, 'use_snp_selection': False}. Best is trial 23 with value: 0.3049833692233162.
[I 2025-11-13 05:47:18,000] Trial 25 finished with value: 0.3006292799899356 and parameters: {'model_type': 'graphsage', 'hidden_dims': '[512, 128]', 'dropout': 0.5566117924387282, 'batch_norm': True, 'lr': 0.0009987738310473088, 'weight_decay': 2.3265306868512603e-07, 'epochs': 70, 'loss': 'mae', 'optimizer': 'adam', 'graph_mode': 'cutoff', 'cutoff': 0.36497793352538965, 'grm_norm': 'none', 'self_loops': True, 'use_snp_selection': False}. Best is trial 23 with value: 0.3049833692233162.
[I 2025-11-13 05:48:14,560] Trial 26 finished with value: 0.27058402548339194 and parameters: {'model_type': 'graphsage', 'hidden_dims': '[512, 128]', 'dropout': 0.3685687117236634, 'batch_norm': True, 'lr': 0.000144197748653508, 'weight_decay': 1.1248100969659096e-06, 'epochs': 42, 'loss': 'mae', 'optimizer': 'adam', 'graph_mode': 'knn', 'source': 'grm', 'knn_k': 4, 'weighted_edges': True, 'symmetrize_mode': 'union', 'use_snp_selection': False}. Best is trial 23 with value: 0.3049833692233162.
[I 2025-11-13 05:50:39,272] Trial 27 finished with value: 0.2574666576491487 and parameters: {'model_type': 'graphsage', 'hidden_dims': '[512, 128]', 'dropout': 0.48484999931421247, 'batch_norm': True, 'lr': 1.528248236441605e-05, 'weight_decay': 4.431137898796974e-07, 'epochs': 99, 'loss': 'mae', 'optimizer': 'adam', 'graph_mode': 'cutoff', 'cutoff': 0.21986543537427106, 'grm_norm': 'none', 'self_loops': True, 'use_snp_selection': False}. Best is trial 23 with value: 0.3049833692233162.
[I 2025-11-13 05:55:00,671] Trial 28 finished with value: 0.27662994513958744 and parameters: {'model_type': 'graphsage', 'hidden_dims': '[512, 64]', 'dropout': 0.2881044307592996, 'batch_norm': True, 'lr': 0.00018550460737063693, 'weight_decay': 1.0588141636543109e-07, 'epochs': 307, 'loss': 'mae', 'optimizer': 'adam', 'graph_mode': 'knn', 'source': 'grm', 'knn_k': 8, 'weighted_edges': False, 'symmetrize_mode': 'mutual', 'use_snp_selection': False}. Best is trial 23 with value: 0.3049833692233162.
[I 2025-11-13 05:57:37,815] Trial 29 finished with value: 0.2610562215160809 and parameters: {'model_type': 'graphsage', 'hidden_dims': '[256, 128, 64]', 'dropout': 0.23348041836414035, 'batch_norm': True, 'lr': 6.15913617791822e-05, 'weight_decay': 2.0364558572331235e-07, 'epochs': 325, 'loss': 'mae', 'optimizer': 'adam', 'graph_mode': 'knn', 'source': 'grm', 'knn_k': 4, 'weighted_edges': False, 'symmetrize_mode': 'mutual', 'use_snp_selection': False}. Best is trial 23 with value: 0.3049833692233162.
[I 2025-11-13 05:59:25,172] Trial 30 finished with value: 0.2952710872375906 and parameters: {'model_type': 'graphsage', 'hidden_dims': '[512, 128]', 'dropout': 0.5627603000527395, 'batch_norm': True, 'lr': 0.0005369991784601409, 'weight_decay': 0.0001548536373019613, 'epochs': 137, 'loss': 'mae', 'optimizer': 'adam', 'graph_mode': 'cutoff', 'cutoff': 0.5193826591248765, 'grm_norm': 'none', 'self_loops': True, 'use_snp_selection': False}. Best is trial 23 with value: 0.3049833692233162.
[I 2025-11-13 06:00:38,294] Trial 31 finished with value: 0.11128708778544191 and parameters: {'model_type': 'graphsage', 'hidden_dims': '[512, 128]', 'dropout': 0.5632062909667371, 'batch_norm': True, 'lr': 1.3213342044302092e-06, 'weight_decay': 2.540496451387733e-07, 'epochs': 67, 'loss': 'mae', 'optimizer': 'adam', 'graph_mode': 'cutoff', 'cutoff': 0.3433972007406928, 'grm_norm': 'none', 'self_loops': True, 'use_snp_selection': False}. Best is trial 23 with value: 0.3049833692233162.
[I 2025-11-13 06:01:18,869] Trial 32 finished with value: 0.30427183463328616 and parameters: {'model_type': 'graphsage', 'hidden_dims': '[128, 64]', 'dropout': 0.5618236931925369, 'batch_norm': True, 'lr': 0.000863368229844076, 'weight_decay': 5.262064984831562e-07, 'epochs': 74, 'loss': 'mae', 'optimizer': 'adam', 'graph_mode': 'cutoff', 'cutoff': 0.34213711815551673, 'grm_norm': 'none', 'self_loops': True, 'use_snp_selection': False}. Best is trial 23 with value: 0.3049833692233162.
[I 2025-11-13 06:01:49,550] Trial 33 finished with value: 0.28946853559779284 and parameters: {'model_type': 'graphsage', 'hidden_dims': '[128, 64]', 'dropout': 0.5134211441374226, 'batch_norm': True, 'lr': 0.0005976331676608277, 'weight_decay': 1.5082214896292575e-06, 'epochs': 66, 'loss': 'mae', 'optimizer': 'adam', 'graph_mode': 'cutoff', 'cutoff': 0.4965826799043388, 'grm_norm': 'none', 'self_loops': True, 'use_snp_selection': False}. Best is trial 23 with value: 0.3049833692233162.
[I 2025-11-13 06:02:36,658] Trial 34 finished with value: 0.28000220172598267 and parameters: {'model_type': 'graphsage', 'hidden_dims': '[128, 64]', 'dropout': 0.45921058186230124, 'batch_norm': True, 'lr': 0.0006613351341687938, 'weight_decay': 5.725933933371885e-07, 'epochs': 80, 'loss': 'mae', 'optimizer': 'adam', 'graph_mode': 'cutoff', 'cutoff': 0.30568898980019993, 'grm_norm': 'none', 'self_loops': True, 'use_snp_selection': False}. Best is trial 23 with value: 0.3049833692233162.
[I 2025-11-13 06:03:03,718] Trial 35 finished with value: 0.298887279018056 and parameters: {'model_type': 'graphsage', 'hidden_dims': '[128, 64]', 'dropout': 0.5661495697964196, 'batch_norm': True, 'lr': 0.0004739682138865588, 'weight_decay': 1.6900747213419072e-06, 'epochs': 40, 'loss': 'mae', 'optimizer': 'adam', 'graph_mode': 'cutoff', 'cutoff': 0.38599466946671057, 'grm_norm': 'cosine_then_gcn', 'self_loops': False, 'use_snp_selection': False}. Best is trial 23 with value: 0.3049833692233162.
[I 2025-11-13 06:05:24,166] Trial 36 finished with value: 0.26876335003487856 and parameters: {'model_type': 'graphsage', 'hidden_dims': '[128, 64]', 'dropout': 0.5013126070968787, 'batch_norm': True, 'lr': 0.00022689967834792777, 'weight_decay': 1.962312357867556e-07, 'epochs': 169, 'loss': 'mae', 'optimizer': 'adam', 'graph_mode': 'knn', 'source': 'grm', 'knn_k': 9, 'weighted_edges': True, 'symmetrize_mode': 'union', 'use_snp_selection': False}. Best is trial 23 with value: 0.3049833692233162.
[I 2025-11-13 06:06:07,635] Trial 37 finished with value: 0.17356465393547457 and parameters: {'model_type': 'graphsage', 'hidden_dims': '[128, 64]', 'dropout': 0.5214539580340701, 'batch_norm': True, 'lr': 3.2585432060434905e-06, 'weight_decay': 5.991948774976363e-06, 'epochs': 107, 'loss': 'mae', 'optimizer': 'adam', 'graph_mode': 'cutoff', 'cutoff': 0.48927852211639267, 'grm_norm': 'gcn', 'self_loops': True, 'use_snp_selection': False}. Best is trial 23 with value: 0.3049833692233162.
[I 2025-11-13 06:06:52,190] Trial 38 finished with value: 0.27041228337491086 and parameters: {'model_type': 'graphsage', 'hidden_dims': '[256, 128, 64]', 'dropout': 0.3982091112207618, 'batch_norm': True, 'lr': 0.0001282767123877773, 'weight_decay': 6.218481065562924e-07, 'epochs': 56, 'loss': 'mae', 'optimizer': 'adam', 'graph_mode': 'knn', 'source': 'grm', 'knn_k': 6, 'weighted_edges': False, 'symmetrize_mode': 'mutual', 'use_snp_selection': False}. Best is trial 23 with value: 0.3049833692233162.
[I 2025-11-13 06:08:08,298] Trial 39 finished with value: 0.27244284908394756 and parameters: {'model_type': 'graphsage', 'hidden_dims': '[512, 256]', 'dropout': 0.17708051972838446, 'batch_norm': False, 'lr': 0.0007674202897631579, 'weight_decay': 1.2417942704893547e-06, 'epochs': 133, 'loss': 'mae', 'optimizer': 'adam', 'graph_mode': 'cutoff', 'cutoff': 0.31001277585330245, 'grm_norm': 'none', 'self_loops': True, 'use_snp_selection': True, 'num_snps': 15281}. Best is trial 23 with value: 0.3049833692233162.
[I 2025-11-13 06:11:41,416] Trial 40 finished with value: 0.26493456519560904 and parameters: {'model_type': 'graphsage', 'hidden_dims': '[128, 64]', 'dropout': 0.43458864357867466, 'batch_norm': True, 'lr': 0.0003546090225438878, 'weight_decay': 4.602706079354282e-07, 'epochs': 212, 'loss': 'mae', 'optimizer': 'adam', 'graph_mode': 'cutoff', 'cutoff': 0.20314080776501525, 'grm_norm': 'none', 'self_loops': True, 'use_snp_selection': False}. Best is trial 23 with value: 0.3049833692233162.
[I 2025-11-13 06:12:58,423] Trial 41 finished with value: 0.3015735253610411 and parameters: {'model_type': 'graphsage', 'hidden_dims': '[512, 128]', 'dropout': 0.5540068822599042, 'batch_norm': True, 'lr': 0.000942086541381236, 'weight_decay': 2.0660399183242172e-07, 'epochs': 74, 'loss': 'mae', 'optimizer': 'adam', 'graph_mode': 'cutoff', 'cutoff': 0.35491087907794405, 'grm_norm': 'none', 'self_loops': True, 'use_snp_selection': False}. Best is trial 23 with value: 0.3049833692233162.
[I 2025-11-13 06:14:16,349] Trial 42 finished with value: 0.29756051527016814 and parameters: {'model_type': 'graphsage', 'hidden_dims': '[512, 128]', 'dropout': 0.5496222345503041, 'batch_norm': True, 'lr': 0.0008291972234844269, 'weight_decay': 1.7002530950114143e-07, 'epochs': 77, 'loss': 'mae', 'optimizer': 'adam', 'graph_mode': 'cutoff', 'cutoff': 0.37670420464143495, 'grm_norm': 'none', 'self_loops': True, 'use_snp_selection': False}. Best is trial 23 with value: 0.3049833692233162.
[I 2025-11-13 06:15:22,231] Trial 43 finished with value: 0.2841214165375769 and parameters: {'model_type': 'graphsage', 'hidden_dims': '[512, 128]', 'dropout': 0.5722187697084334, 'batch_norm': True, 'lr': 0.0004808612980021987, 'weight_decay': 3.034442796624894e-07, 'epochs': 55, 'loss': 'mae', 'optimizer': 'adam', 'graph_mode': 'cutoff', 'cutoff': 0.311112417198725, 'grm_norm': 'none', 'self_loops': True, 'use_snp_selection': False}. Best is trial 23 with value: 0.3049833692233162.
[I 2025-11-13 06:16:13,743] Trial 44 finished with value: 0.2871184285112427 and parameters: {'model_type': 'graphsage', 'hidden_dims': '[256, 128]', 'dropout': 0.5984404197815667, 'batch_norm': True, 'lr': 0.0006300286699713547, 'weight_decay': 7.904392298626702e-07, 'epochs': 105, 'loss': 'mae', 'optimizer': 'adam', 'graph_mode': 'cutoff', 'cutoff': 0.607410764319114, 'grm_norm': 'none', 'self_loops': True, 'use_snp_selection': False}. Best is trial 23 with value: 0.3049833692233162.
[I 2025-11-13 06:18:13,244] Trial 45 finished with value: 0.29705681718903343 and parameters: {'model_type': 'graphsage', 'hidden_dims': '[512, 128]', 'dropout': 0.49383849576308864, 'batch_norm': True, 'lr': 0.00024464932655273954, 'weight_decay': 1.0408763716423673e-07, 'epochs': 90, 'loss': 'mae', 'optimizer': 'adam', 'graph_mode': 'cutoff', 'cutoff': 0.24801515610231728, 'grm_norm': 'gcn', 'self_loops': False, 'use_snp_selection': False}. Best is trial 23 with value: 0.3049833692233162.
[I 2025-11-13 06:19:42,278] Trial 46 finished with value: 0.2602384855727581 and parameters: {'model_type': 'graphsage', 'hidden_dims': '[512, 256]', 'dropout': 0.5207650536307838, 'batch_norm': False, 'lr': 0.000940589178058829, 'weight_decay': 2.2774270943099842e-06, 'epochs': 136, 'loss': 'mae', 'optimizer': 'adam', 'graph_mode': 'knn', 'source': 'grm', 'knn_k': 8, 'weighted_edges': False, 'symmetrize_mode': 'mutual', 'use_snp_selection': True, 'num_snps': 20473}. Best is trial 23 with value: 0.3049833692233162.
[I 2025-11-13 06:20:41,426] Trial 47 finished with value: 0.3041260239496798 and parameters: {'model_type': 'graphsage', 'hidden_dims': '[512, 128]', 'dropout': 0.5323941805262343, 'batch_norm': True, 'lr': 0.0003666436337278741, 'weight_decay': 1.7197303312278972e-07, 'epochs': 52, 'loss': 'mae', 'optimizer': 'adam', 'graph_mode': 'cutoff', 'cutoff': 0.3873442701999902, 'grm_norm': 'none', 'self_loops': True, 'use_snp_selection': False}. Best is trial 23 with value: 0.3049833692233162.
[I 2025-11-13 06:21:41,836] Trial 48 finished with value: 0.2837438047405044 and parameters: {'model_type': 'graphsage', 'hidden_dims': '[512, 64]', 'dropout': 0.5752894747184082, 'batch_norm': True, 'lr': 0.0004326791996082172, 'weight_decay': 1.1168290016364909e-05, 'epochs': 56, 'loss': 'mse', 'optimizer': 'adam', 'graph_mode': 'cutoff', 'cutoff': 0.46447342693290733, 'grm_norm': 'none', 'self_loops': False, 'use_snp_selection': False}. Best is trial 23 with value: 0.3049833692233162.
[I 2025-11-13 06:23:58,274] Trial 49 finished with value: 0.1621581705543024 and parameters: {'model_type': 'graphsage', 'hidden_dims': '[512, 128]', 'dropout': 0.5266275782565123, 'batch_norm': False, 'lr': 0.00015449975796438508, 'weight_decay': 3.3873242756298016e-07, 'epochs': 49, 'loss': 'mae', 'optimizer': 'adam', 'graph_mode': 'knn', 'source': 'grm', 'knn_k': 5, 'weighted_edges': True, 'symmetrize_mode': 'union', 'use_snp_selection': True, 'num_snps': 59837}. Best is trial 23 with value: 0.3049833692233162.
[I 2025-11-13 06:25:26,255] Trial 50 finished with value: 0.28089917964750855 and parameters: {'model_type': 'graphsage', 'hidden_dims': '[512, 128]', 'dropout': 0.4645020406486335, 'batch_norm': True, 'lr': 0.00029525692978802596, 'weight_decay': 5.383074878798311e-07, 'epochs': 114, 'loss': 'mae', 'optimizer': 'adam', 'graph_mode': 'cutoff', 'cutoff': 0.6699687501994005, 'grm_norm': 'gcn', 'self_loops': True, 'use_snp_selection': False}. Best is trial 23 with value: 0.3049833692233162.
[I 2025-11-13 06:26:40,327] Trial 51 finished with value: 0.2985018734360294 and parameters: {'model_type': 'graphsage', 'hidden_dims': '[512, 128]', 'dropout': 0.5462258338024985, 'batch_norm': True, 'lr': 0.0006591751728926517, 'weight_decay': 1.667531965938744e-07, 'epochs': 73, 'loss': 'mae', 'optimizer': 'adam', 'graph_mode': 'cutoff', 'cutoff': 0.39476017129530266, 'grm_norm': 'none', 'self_loops': True, 'use_snp_selection': False}. Best is trial 23 with value: 0.3049833692233162.
