[I 2025-11-03 11:47:51,828] Trial 67 finished with value: 0.04975776684250069 and parameters: {'model_type': 'gcn', 'hidden_dims': '[256, 128]', 'dropout': 0.14399843619760097, 'batch_norm': False, 'lr': 3.39277050028901e-05, 'weight_decay': 0.000723294310836172, 'epochs': 247, 'loss': 'mse', 'optimizer': 'adam', 'graph_mode': 'knn', 'source': 'grm', 'knn_k': 2, 'weighted_edges': True, 'symmetrize_mode': 'union', 'use_snp_selection': True, 'num_snps': 10355}. Best is trial 51 with value: 0.07825951436508155.
[I 2025-11-03 11:47:54,170] Trial 68 finished with value: 0.03657597008153932 and parameters: {'model_type': 'gcn', 'hidden_dims': '[256, 128]', 'dropout': 0.10003977702947182, 'batch_norm': True, 'lr': 0.0006683716673338763, 'weight_decay': 0.00038951627766064173, 'epochs': 275, 'loss': 'mse', 'optimizer': 'adam', 'graph_mode': 'cutoff', 'cutoff': 0.5795019461460441, 'grm_norm': 'gcn', 'self_loops': False, 'use_snp_selection': False}. Best is trial 51 with value: 0.07825951436508155.
[I 2025-11-03 11:47:55,871] Trial 69 finished with value: 0.036206851280624626 and parameters: {'model_type': 'gcn', 'hidden_dims': '[256, 128]', 'dropout': 0.1802013788803433, 'batch_norm': False, 'lr': 4.872731666566955e-05, 'weight_decay': 3.630555493993185e-07, 'epochs': 217, 'loss': 'mse', 'optimizer': 'adam', 'graph_mode': 'cutoff', 'cutoff': 0.6462665143670985, 'grm_norm': 'cosine', 'self_loops': False, 'use_snp_selection': True, 'num_snps': 4325}. Best is trial 51 with value: 0.07825951436508155.
[I 2025-11-03 11:47:57,647] Trial 70 finished with value: -0.0062406733490749594 and parameters: {'model_type': 'gcn', 'hidden_dims': '[128, 64]', 'dropout': 0.1581473000275923, 'batch_norm': True, 'lr': 1.7002986900884078e-06, 'weight_decay': 0.00044148851692813867, 'epochs': 199, 'loss': 'mse', 'optimizer': 'adam', 'graph_mode': 'knn', 'source': 'grm', 'knn_k': 2, 'weighted_edges': True, 'symmetrize_mode': 'union', 'use_snp_selection': False}. Best is trial 51 with value: 0.07825951436508155.
[I 2025-11-03 11:48:00,011] Trial 71 finished with value: 0.07840078880323388 and parameters: {'model_type': 'gcn', 'hidden_dims': '[256, 128, 64]', 'dropout': 0.12748692643218082, 'batch_norm': False, 'lr': 6.370343819528465e-05, 'weight_decay': 0.0009934039055284917, 'epochs': 207, 'loss': 'mse', 'optimizer': 'adam', 'graph_mode': 'knn', 'source': 'grm', 'knn_k': 4, 'weighted_edges': True, 'symmetrize_mode': 'union', 'use_snp_selection': True, 'num_snps': 16583}. Best is trial 71 with value: 0.07840078880323388.
[I 2025-11-03 11:48:02,279] Trial 72 finished with value: 0.07482600854805369 and parameters: {'model_type': 'gcn', 'hidden_dims': '[256, 128, 64]', 'dropout': 0.12857771566568588, 'batch_norm': False, 'lr': 2.340765362445527e-05, 'weight_decay': 0.0004997875191926756, 'epochs': 177, 'loss': 'mse', 'optimizer': 'adam', 'graph_mode': 'knn', 'source': 'grm', 'knn_k': 4, 'weighted_edges': True, 'symmetrize_mode': 'union', 'use_snp_selection': True, 'num_snps': 16272}. Best is trial 71 with value: 0.07840078880323388.
[I 2025-11-03 11:48:04,750] Trial 73 finished with value: 0.04376084514005044 and parameters: {'model_type': 'gcn', 'hidden_dims': '[256, 128, 64]', 'dropout': 0.13278160394490995, 'batch_norm': False, 'lr': 2.4500502762005163e-05, 'weight_decay': 0.00028240306820590216, 'epochs': 238, 'loss': 'mse', 'optimizer': 'adam', 'graph_mode': 'knn', 'source': 'grm', 'knn_k': 4, 'weighted_edges': True, 'symmetrize_mode': 'union', 'use_snp_selection': True, 'num_snps': 16477}. Best is trial 71 with value: 0.07840078880323388.
[I 2025-11-03 11:48:07,013] Trial 74 finished with value: 0.09093433545142589 and parameters: {'model_type': 'gcn', 'hidden_dims': '[256, 128, 64]', 'dropout': 0.15407242340629468, 'batch_norm': False, 'lr': 1.759053149077304e-05, 'weight_decay': 0.000550784985032752, 'epochs': 205, 'loss': 'mse', 'optimizer': 'adam', 'graph_mode': 'knn', 'source': 'grm', 'knn_k': 4, 'weighted_edges': True, 'symmetrize_mode': 'union', 'use_snp_selection': True, 'num_snps': 13870}. Best is trial 74 with value: 0.09093433545142589.
[I 2025-11-03 11:48:09,262] Trial 75 finished with value: 0.0672343747385617 and parameters: {'model_type': 'gcn', 'hidden_dims': '[256, 128, 64]', 'dropout': 0.12218789579522277, 'batch_norm': False, 'lr': 1.369274955920365e-05, 'weight_decay': 0.000987134287111765, 'epochs': 207, 'loss': 'mse', 'optimizer': 'adam', 'graph_mode': 'knn', 'source': 'grm', 'knn_k': 4, 'weighted_edges': True, 'symmetrize_mode': 'union', 'use_snp_selection': True, 'num_snps': 13043}. Best is trial 74 with value: 0.09093433545142589.
[I 2025-11-03 11:48:11,498] Trial 76 finished with value: 0.05973663430596438 and parameters: {'model_type': 'gcn', 'hidden_dims': '[256, 128, 64]', 'dropout': 0.12257241947691326, 'batch_norm': False, 'lr': 1.704183160687311e-05, 'weight_decay': 0.0005617471961882912, 'epochs': 206, 'loss': 'mse', 'optimizer': 'adam', 'graph_mode': 'knn', 'source': 'grm', 'knn_k': 4, 'weighted_edges': True, 'symmetrize_mode': 'union', 'use_snp_selection': True, 'num_snps': 13014}. Best is trial 74 with value: 0.09093433545142589.
[I 2025-11-03 11:48:13,776] Trial 77 finished with value: 0.030725031836493222 and parameters: {'model_type': 'gcn', 'hidden_dims': '[256, 128, 64]', 'dropout': 0.15620587134444142, 'batch_norm': False, 'lr': 1.2743471620968168e-05, 'weight_decay': 0.0009817295429170485, 'epochs': 186, 'loss': 'mae', 'optimizer': 'adam', 'graph_mode': 'knn', 'source': 'grm', 'knn_k': 4, 'weighted_edges': True, 'symmetrize_mode': 'union', 'use_snp_selection': True, 'num_snps': 16057}. Best is trial 74 with value: 0.09093433545142589.
[I 2025-11-03 11:48:15,989] Trial 78 finished with value: 0.062283299355147176 and parameters: {'model_type': 'gcn', 'hidden_dims': '[256, 128, 64]', 'dropout': 0.11770192780225398, 'batch_norm': False, 'lr': 9.293270640932065e-06, 'weight_decay': 0.0006931062369531324, 'epochs': 222, 'loss': 'mse', 'optimizer': 'adam', 'graph_mode': 'knn', 'source': 'grm', 'knn_k': 5, 'weighted_edges': True, 'symmetrize_mode': 'union', 'use_snp_selection': True, 'num_snps': 10238}. Best is trial 74 with value: 0.09093433545142589.
[I 2025-11-03 11:48:18,484] Trial 79 finished with value: 0.04825124274598631 and parameters: {'model_type': 'gcn', 'hidden_dims': '[256, 128, 64]', 'dropout': 0.2071632893828448, 'batch_norm': False, 'lr': 5.627923142459473e-06, 'weight_decay': 0.00047944775006014933, 'epochs': 207, 'loss': 'mse', 'optimizer': 'adam', 'graph_mode': 'knn', 'source': 'grm', 'knn_k': 2, 'weighted_edges': True, 'symmetrize_mode': 'union', 'use_snp_selection': True, 'num_snps': 20058}. Best is trial 74 with value: 0.09093433545142589.
[I 2025-11-03 11:48:20,718] Trial 80 finished with value: 0.06694394959684637 and parameters: {'model_type': 'gcn', 'hidden_dims': '[256, 128, 64]', 'dropout': 0.17006068000575766, 'batch_norm': False, 'lr': 1.933721640997908e-05, 'weight_decay': 0.00023137195336055038, 'epochs': 175, 'loss': 'mse', 'optimizer': 'adam', 'graph_mode': 'knn', 'source': 'grm', 'knn_k': 3, 'weighted_edges': True, 'symmetrize_mode': 'union', 'use_snp_selection': True, 'num_snps': 15624}. Best is trial 74 with value: 0.09093433545142589.
[I 2025-11-03 11:48:22,892] Trial 81 finished with value: 0.07301099088050386 and parameters: {'model_type': 'gcn', 'hidden_dims': '[256, 128, 64]', 'dropout': 0.17445258222479054, 'batch_norm': False, 'lr': 1.8480693784609745e-05, 'weight_decay': 0.00013406928084308819, 'epochs': 173, 'loss': 'mse', 'optimizer': 'adam', 'graph_mode': 'knn', 'source': 'grm', 'knn_k': 3, 'weighted_edges': True, 'symmetrize_mode': 'union', 'use_snp_selection': True, 'num_snps': 14396}. Best is trial 74 with value: 0.09093433545142589.
[I 2025-11-03 11:48:25,073] Trial 82 finished with value: 0.056137721477236405 and parameters: {'model_type': 'gcn', 'hidden_dims': '[256, 128, 64]', 'dropout': 0.1393910351522766, 'batch_norm': False, 'lr': 3.860509156671904e-05, 'weight_decay': 0.0001257402410266059, 'epochs': 210, 'loss': 'mse', 'optimizer': 'adam', 'graph_mode': 'knn', 'source': 'grm', 'knn_k': 4, 'weighted_edges': True, 'symmetrize_mode': 'union', 'use_snp_selection': True, 'num_snps': 10834}. Best is trial 74 with value: 0.09093433545142589.
[I 2025-11-03 11:48:27,029] Trial 83 finished with value: 0.05489304230133778 and parameters: {'model_type': 'gcn', 'hidden_dims': '[256, 128, 64]', 'dropout': 0.18423172747096134, 'batch_norm': False, 'lr': 6.233406255369377e-05, 'weight_decay': 0.000770984637608917, 'epochs': 192, 'loss': 'mse', 'optimizer': 'adam', 'graph_mode': 'knn', 'source': 'grm', 'knn_k': 3, 'weighted_edges': True, 'symmetrize_mode': 'union', 'use_snp_selection': True, 'num_snps': 6485}. Best is trial 74 with value: 0.09093433545142589.
[I 2025-11-03 11:48:29,179] Trial 84 finished with value: 0.05791888650464575 and parameters: {'model_type': 'gcn', 'hidden_dims': '[256, 128, 64]', 'dropout': 0.15559635443012776, 'batch_norm': False, 'lr': 1.4949762944304539e-05, 'weight_decay': 0.0009760094958483593, 'epochs': 169, 'loss': 'mse', 'optimizer': 'adam', 'graph_mode': 'knn', 'source': 'grm', 'knn_k': 2, 'weighted_edges': True, 'symmetrize_mode': 'union', 'use_snp_selection': True, 'num_snps': 14181}. Best is trial 74 with value: 0.09093433545142589.
[I 2025-11-03 11:48:31,576] Trial 85 finished with value: 0.0658662490820841 and parameters: {'model_type': 'gcn', 'hidden_dims': '[256, 128, 64]', 'dropout': 0.12936545026106552, 'batch_norm': False, 'lr': 3.0826173648113615e-05, 'weight_decay': 0.0005000770047618696, 'epochs': 201, 'loss': 'mse', 'optimizer': 'adam', 'graph_mode': 'knn', 'source': 'grm', 'knn_k': 4, 'weighted_edges': True, 'symmetrize_mode': 'union', 'use_snp_selection': True, 'num_snps': 18032}. Best is trial 74 with value: 0.09093433545142589.
[I 2025-11-03 11:48:34,100] Trial 86 finished with value: 0.03979008482643011 and parameters: {'model_type': 'gcn', 'hidden_dims': '[256, 128, 64]', 'dropout': 0.2018059752572318, 'batch_norm': False, 'lr': 7.141510921940652e-06, 'weight_decay': 0.0007261258432115396, 'epochs': 180, 'loss': 'mse', 'optimizer': 'adam', 'graph_mode': 'knn', 'source': 'grm', 'knn_k': 5, 'weighted_edges': True, 'symmetrize_mode': 'union', 'use_snp_selection': True, 'num_snps': 22862}. Best is trial 74 with value: 0.09093433545142589.
[I 2025-11-03 11:48:36,490] Trial 87 finished with value: 0.047794326475578 and parameters: {'model_type': 'gcn', 'hidden_dims': '[256, 128, 64]', 'dropout': 0.17034210239417194, 'batch_norm': False, 'lr': 2.3355257892564386e-05, 'weight_decay': 0.00036284204971500164, 'epochs': 261, 'loss': 'mse', 'optimizer': 'adam', 'graph_mode': 'knn', 'source': 'grm', 'knn_k': 3, 'weighted_edges': True, 'symmetrize_mode': 'union', 'use_snp_selection': True, 'num_snps': 11638}. Best is trial 74 with value: 0.09093433545142589.
[I 2025-11-03 11:48:38,506] Trial 88 finished with value: 0.06184066316468609 and parameters: {'model_type': 'gcn', 'hidden_dims': '[256, 128, 64]', 'dropout': 0.11735947848146347, 'batch_norm': False, 'lr': 4.5340858835585605e-05, 'weight_decay': 0.00020981461236564607, 'epochs': 222, 'loss': 'mse', 'optimizer': 'adam', 'graph_mode': 'knn', 'source': 'grm', 'knn_k': 1, 'weighted_edges': True, 'symmetrize_mode': 'union', 'use_snp_selection': True, 'num_snps': 5345}. Best is trial 74 with value: 0.09093433545142589.
[I 2025-11-03 11:48:40,992] Trial 89 finished with value: 0.05071780813823714 and parameters: {'model_type': 'gcn', 'hidden_dims': '[256, 128, 64]', 'dropout': 0.13811969222639112, 'batch_norm': False, 'lr': 3.358414302857069e-05, 'weight_decay': 0.00029182515342344653, 'epochs': 190, 'loss': 'mae', 'optimizer': 'adam', 'graph_mode': 'knn', 'source': 'grm', 'knn_k': 5, 'weighted_edges': True, 'symmetrize_mode': 'union', 'use_snp_selection': True, 'num_snps': 20394}. Best is trial 74 with value: 0.09093433545142589.
[I 2025-11-03 11:48:42,807] Trial 90 finished with value: 0.017994898420527303 and parameters: {'model_type': 'gcn', 'hidden_dims': '[512, 256]', 'dropout': 0.21671974419509446, 'batch_norm': False, 'lr': 6.616207359922538e-05, 'weight_decay': 0.00013073661499613887, 'epochs': 154, 'loss': 'mse', 'optimizer': 'adam', 'graph_mode': 'knn', 'source': 'grm', 'knn_k': 4, 'weighted_edges': True, 'symmetrize_mode': 'union', 'use_snp_selection': True, 'num_snps': 8943}. Best is trial 74 with value: 0.09093433545142589.
[I 2025-11-03 11:48:45,032] Trial 91 finished with value: 0.07149665263240379 and parameters: {'model_type': 'gcn', 'hidden_dims': '[256, 128, 64]', 'dropout': 0.17609590010308893, 'batch_norm': False, 'lr': 1.9160655323295926e-05, 'weight_decay': 0.00021560808810613317, 'epochs': 174, 'loss': 'mse', 'optimizer': 'adam', 'graph_mode': 'knn', 'source': 'grm', 'knn_k': 3, 'weighted_edges': True, 'symmetrize_mode': 'union', 'use_snp_selection': True, 'num_snps': 15767}. Best is trial 74 with value: 0.09093433545142589.
[I 2025-11-03 11:48:47,197] Trial 92 finished with value: 0.03569606197974405 and parameters: {'model_type': 'gcn', 'hidden_dims': '[256, 128, 64]', 'dropout': 0.14837809788473358, 'batch_norm': False, 'lr': 1.816104754475831e-05, 'weight_decay': 0.0006048263073835834, 'epochs': 169, 'loss': 'mse', 'optimizer': 'adam', 'graph_mode': 'knn', 'source': 'grm', 'knn_k': 2, 'weighted_edges': True, 'symmetrize_mode': 'union', 'use_snp_selection': True, 'num_snps': 14577}. Best is trial 74 with value: 0.09093433545142589.
[I 2025-11-03 11:48:49,556] Trial 93 finished with value: 0.06481451043867786 and parameters: {'model_type': 'gcn', 'hidden_dims': '[256, 128, 64]', 'dropout': 0.19331001991654242, 'batch_norm': False, 'lr': 1.2873794032625751e-05, 'weight_decay': 0.0005293786467009777, 'epochs': 201, 'loss': 'mse', 'optimizer': 'adam', 'graph_mode': 'knn', 'source': 'grm', 'knn_k': 3, 'weighted_edges': True, 'symmetrize_mode': 'union', 'use_snp_selection': True, 'num_snps': 16569}. Best is trial 74 with value: 0.09093433545142589.
[I 2025-11-03 11:48:51,798] Trial 94 finished with value: 0.05195473846984738 and parameters: {'model_type': 'gcn', 'hidden_dims': '[256, 128, 64]', 'dropout': 0.17832426361134474, 'batch_norm': False, 'lr': 2.6925721651430054e-05, 'weight_decay': 0.00033321290814330995, 'epochs': 212, 'loss': 'mse', 'optimizer': 'adam', 'graph_mode': 'knn', 'source': 'grm', 'knn_k': 4, 'weighted_edges': True, 'symmetrize_mode': 'union', 'use_snp_selection': True, 'num_snps': 12510}. Best is trial 74 with value: 0.09093433545142589.
[I 2025-11-03 11:48:54,426] Trial 95 finished with value: 0.05226129002408422 and parameters: {'model_type': 'gcn', 'hidden_dims': '[512, 128]', 'dropout': 0.1642697148371272, 'batch_norm': False, 'lr': 2.082919456331223e-05, 'weight_decay': 7.810958956770425e-05, 'epochs': 177, 'loss': 'mse', 'optimizer': 'adam', 'graph_mode': 'knn', 'source': 'grm', 'knn_k': 3, 'weighted_edges': True, 'symmetrize_mode': 'union', 'use_snp_selection': True, 'num_snps': 24626}. Best is trial 74 with value: 0.09093433545142589.
[I 2025-11-03 11:48:57,113] Trial 96 finished with value: 0.056488901239337 and parameters: {'model_type': 'gcn', 'hidden_dims': '[256, 128, 64]', 'dropout': 0.11316359362896583, 'batch_norm': False, 'lr': 3.695099998281705e-05, 'weight_decay': 0.0008176665121159148, 'epochs': 164, 'loss': 'mse', 'optimizer': 'adam', 'graph_mode': 'knn', 'source': 'grm', 'knn_k': 2, 'weighted_edges': True, 'symmetrize_mode': 'union', 'use_snp_selection': True, 'num_snps': 28184}. Best is trial 74 with value: 0.09093433545142589.
[I 2025-11-03 11:48:59,441] Trial 97 finished with value: 0.06506113975194538 and parameters: {'model_type': 'gcn', 'hidden_dims': '[512, 64]', 'dropout': 0.12921475502539226, 'batch_norm': False, 'lr': 1.1114343581308248e-05, 'weight_decay': 0.0006289937763213923, 'epochs': 187, 'loss': 'mse', 'optimizer': 'adam', 'graph_mode': 'knn', 'source': 'grm', 'knn_k': 1, 'weighted_edges': True, 'symmetrize_mode': 'union', 'use_snp_selection': True, 'num_snps': 17881}. Best is trial 74 with value: 0.09093433545142589.
[I 2025-11-03 11:49:02,031] Trial 98 finished with value: 0.058114980648368 and parameters: {'model_type': 'gcn', 'hidden_dims': '[256, 128, 64]', 'dropout': 0.2429067925605516, 'batch_norm': False, 'lr': 1.5267115291061354e-05, 'weight_decay': 0.00019475118278231663, 'epochs': 231, 'loss': 'mse', 'optimizer': 'adam', 'graph_mode': 'knn', 'source': 'grm', 'knn_k': 3, 'weighted_edges': True, 'symmetrize_mode': 'union', 'use_snp_selection': True, 'num_snps': 20905}. Best is trial 74 with value: 0.09093433545142589.
[I 2025-11-03 11:49:03,917] Trial 99 finished with value: 0.06582968729398654 and parameters: {'model_type': 'gcn', 'hidden_dims': '[256, 128, 64]', 'dropout': 0.15685881431101317, 'batch_norm': False, 'lr': 9.573030171698239e-06, 'weight_decay': 9.837186215005747e-05, 'epochs': 217, 'loss': 'mse', 'optimizer': 'adam', 'graph_mode': 'knn', 'source': 'grm', 'knn_k': 5, 'weighted_edges': True, 'symmetrize_mode': 'union', 'use_snp_selection': True, 'num_snps': 2210}. Best is trial 74 with value: 0.09093433545142589.
[I 2025-11-03 11:49:05,908] Trial 100 finished with value: 0.05364747418499826 and parameters: {'model_type': 'gcn', 'hidden_dims': '[512, 256]', 'dropout': 0.19562439648116584, 'batch_norm': False, 'lr': 3.0373020885412813e-05, 'weight_decay': 0.0003968606889935938, 'epochs': 242, 'loss': 'mse', 'optimizer': 'adam', 'graph_mode': 'knn', 'source': 'grm', 'knn_k': 4, 'weighted_edges': True, 'symmetrize_mode': 'union', 'use_snp_selection': True, 'num_snps': 8808}. Best is trial 74 with value: 0.09093433545142589.
[I 2025-11-03 11:49:08,062] Trial 101 finished with value: 0.07484156845723827 and parameters: {'model_type': 'gcn', 'hidden_dims': '[256, 128, 64]', 'dropout': 0.17176436712285478, 'batch_norm': False, 'lr': 1.8817738501874643e-05, 'weight_decay': 0.00021032409972098544, 'epochs': 175, 'loss': 'mse', 'optimizer': 'adam', 'graph_mode': 'knn', 'source': 'grm', 'knn_k': 3, 'weighted_edges': True, 'symmetrize_mode': 'union', 'use_snp_selection': True, 'num_snps': 14653}. Best is trial 74 with value: 0.09093433545142589.
[I 2025-11-03 11:49:10,074] Trial 102 finished with value: 0.05926790832589351 and parameters: {'model_type': 'gcn', 'hidden_dims': '[256, 128, 64]', 'dropout': 0.14873600621236457, 'batch_norm': False, 'lr': 1.6718694771975437e-05, 'weight_decay': 0.0002650906043319983, 'epochs': 138, 'loss': 'mse', 'optimizer': 'adam', 'graph_mode': 'knn', 'source': 'grm', 'knn_k': 3, 'weighted_edges': True, 'symmetrize_mode': 'union', 'use_snp_selection': True, 'num_snps': 13968}. Best is trial 74 with value: 0.09093433545142589.
[I 2025-11-03 11:49:12,397] Trial 103 finished with value: 0.05718721430990835 and parameters: {'model_type': 'gcn', 'hidden_dims': '[256, 128, 64]', 'dropout': 0.10016202114963106, 'batch_norm': False, 'lr': 2.2103093731013265e-05, 'weight_decay': 0.0001646389467498004, 'epochs': 197, 'loss': 'mse', 'optimizer': 'adam', 'graph_mode': 'knn', 'source': 'grm', 'knn_k': 4, 'weighted_edges': True, 'symmetrize_mode': 'union', 'use_snp_selection': True, 'num_snps': 17270}. Best is trial 74 with value: 0.09093433545142589.
[I 2025-11-03 11:49:14,352] Trial 104 finished with value: 0.06389368425099419 and parameters: {'model_type': 'gcn', 'hidden_dims': '[256, 128, 64]', 'dropout': 0.17501124080896213, 'batch_norm': False, 'lr': 1.3504610869113182e-05, 'weight_decay': 0.00047128056550320186, 'epochs': 150, 'loss': 'mse', 'optimizer': 'adam', 'graph_mode': 'knn', 'source': 'grm', 'knn_k': 2, 'weighted_edges': True, 'symmetrize_mode': 'union', 'use_snp_selection': True, 'num_snps': 11869}. Best is trial 74 with value: 0.09093433545142589.
[I 2025-11-03 11:49:16,729] Trial 105 finished with value: 0.08288312923534785 and parameters: {'model_type': 'gcn', 'hidden_dims': '[256, 128, 64]', 'dropout': 0.22216420464928277, 'batch_norm': False, 'lr': 2.630530936249652e-05, 'weight_decay': 0.0008422792565976728, 'epochs': 159, 'loss': 'mse', 'optimizer': 'adam', 'graph_mode': 'knn', 'source': 'grm', 'knn_k': 3, 'weighted_edges': True, 'symmetrize_mode': 'union', 'use_snp_selection': True, 'num_snps': 22020}. Best is trial 74 with value: 0.09093433545142589.
[I 2025-11-03 11:49:19,014] Trial 106 finished with value: 0.06838475271279087 and parameters: {'model_type': 'gcn', 'hidden_dims': '[256, 128, 64]', 'dropout': 0.22027446868555428, 'batch_norm': False, 'lr': 2.6375788099564308e-05, 'weight_decay': 6.74293345356114e-07, 'epochs': 131, 'loss': 'mse', 'optimizer': 'adam', 'graph_mode': 'knn', 'source': 'grm', 'knn_k': 3, 'weighted_edges': True, 'symmetrize_mode': 'union', 'use_snp_selection': True, 'num_snps': 22169}. Best is trial 74 with value: 0.09093433545142589.
[I 2025-11-03 11:49:21,250] Trial 107 finished with value: 0.06345967294887711 and parameters: {'model_type': 'gcn', 'hidden_dims': '[256, 128, 64]', 'dropout': 0.2574615824739656, 'batch_norm': False, 'lr': 4.320128351232483e-05, 'weight_decay': 6.002185368690513e-05, 'epochs': 155, 'loss': 'mse', 'optimizer': 'adam', 'graph_mode': 'knn', 'source': 'grm', 'knn_k': 3, 'weighted_edges': True, 'symmetrize_mode': 'union', 'use_snp_selection': True, 'num_snps': 18621}. Best is trial 74 with value: 0.09093433545142589.
[I 2025-11-03 11:49:23,371] Trial 108 finished with value: 0.044128854613541685 and parameters: {'model_type': 'gcn', 'hidden_dims': '[512, 256]', 'dropout': 0.20701350569062354, 'batch_norm': False, 'lr': 5.510630296592452e-05, 'weight_decay': 0.0003145368948650092, 'epochs': 161, 'loss': 'mae', 'optimizer': 'adam', 'graph_mode': 'knn', 'source': 'grm', 'knn_k': 6, 'weighted_edges': True, 'symmetrize_mode': 'union', 'use_snp_selection': True, 'num_snps': 15261}. Best is trial 74 with value: 0.09093433545142589.
