[I 2025-11-03 14:49:59,872] Trial 116 finished with value: 0.0020472573092995164 and parameters: {'model_type': 'graphsage', 'hidden_dims': '[128, 64]', 'dropout': 0.4490765712758623, 'batch_norm': False, 'lr': 4.4088703739440845e-06, 'weight_decay': 9.41786810523247e-06, 'epochs': 103, 'loss': 'mse', 'optimizer': 'adam', 'graph_mode': 'knn', 'source': 'grm', 'knn_k': 5, 'weighted_edges': True, 'symmetrize_mode': 'union', 'use_snp_selection': True, 'num_snps': 26411}. Best is trial 32 with value: 0.05624840045269122.
[I 2025-11-03 14:50:01,600] Trial 117 finished with value: -0.01579166888163611 and parameters: {'model_type': 'graphsage', 'hidden_dims': '[128, 64]', 'dropout': 0.3858996386685042, 'batch_norm': True, 'lr': 1.2029345718796514e-06, 'weight_decay': 0.00012539786446484836, 'epochs': 120, 'loss': 'mse', 'optimizer': 'adam', 'graph_mode': 'cutoff', 'cutoff': 0.45529901353486374, 'grm_norm': 'cosine', 'self_loops': True, 'use_snp_selection': False}. Best is trial 32 with value: 0.05624840045269122.
[I 2025-11-03 14:50:04,299] Trial 118 finished with value: 0.003815230105507496 and parameters: {'model_type': 'graphsage', 'hidden_dims': '[256, 128, 64]', 'dropout': 0.42578411276976785, 'batch_norm': False, 'lr': 5.8624833965478035e-05, 'weight_decay': 9.751838159713174e-05, 'epochs': 135, 'loss': 'mae', 'optimizer': 'adam', 'graph_mode': 'knn', 'source': 'grm', 'knn_k': 6, 'weighted_edges': False, 'symmetrize_mode': 'union', 'use_snp_selection': True, 'num_snps': 23273}. Best is trial 32 with value: 0.05624840045269122.
[I 2025-11-03 14:50:06,170] Trial 119 finished with value: -0.029572753510528058 and parameters: {'model_type': 'graphsage', 'hidden_dims': '[128, 64]', 'dropout': 0.5941928746567099, 'batch_norm': True, 'lr': 1.4461824390850471e-06, 'weight_decay': 0.00029344586810489535, 'epochs': 87, 'loss': 'mse', 'optimizer': 'adam', 'graph_mode': 'knn', 'source': 'grm', 'knn_k': 7, 'weighted_edges': False, 'symmetrize_mode': 'union', 'use_snp_selection': False}. Best is trial 32 with value: 0.05624840045269122.
[I 2025-11-03 14:50:08,568] Trial 120 finished with value: 0.036436106083737214 and parameters: {'model_type': 'graphsage', 'hidden_dims': '[128, 64]', 'dropout': 0.5323246008253568, 'batch_norm': False, 'lr': 1.7033027292708302e-06, 'weight_decay': 0.0002345058383426483, 'epochs': 71, 'loss': 'mse', 'optimizer': 'adam', 'graph_mode': 'knn', 'source': 'grm', 'knn_k': 8, 'weighted_edges': False, 'symmetrize_mode': 'mutual', 'use_snp_selection': True, 'num_snps': 29546}. Best is trial 32 with value: 0.05624840045269122.
[I 2025-11-03 14:50:10,902] Trial 121 finished with value: -0.014831362542912983 and parameters: {'model_type': 'graphsage', 'hidden_dims': '[128, 64]', 'dropout': 0.5444232961036993, 'batch_norm': False, 'lr': 1.658830411870959e-06, 'weight_decay': 0.0002138401456215525, 'epochs': 60, 'loss': 'mse', 'optimizer': 'adam', 'graph_mode': 'knn', 'source': 'grm', 'knn_k': 8, 'weighted_edges': False, 'symmetrize_mode': 'mutual', 'use_snp_selection': True, 'num_snps': 29893}. Best is trial 32 with value: 0.05624840045269122.
[I 2025-11-03 14:50:13,192] Trial 122 finished with value: -0.023817150597268362 and parameters: {'model_type': 'graphsage', 'hidden_dims': '[128, 64]', 'dropout': 0.5023831175865539, 'batch_norm': False, 'lr': 9.850256297180458e-05, 'weight_decay': 0.0005754688871442092, 'epochs': 96, 'loss': 'mse', 'optimizer': 'adam', 'graph_mode': 'knn', 'source': 'grm', 'knn_k': 8, 'weighted_edges': False, 'symmetrize_mode': 'mutual', 'use_snp_selection': True, 'num_snps': 26291}. Best is trial 32 with value: 0.05624840045269122.
[I 2025-11-03 14:50:15,476] Trial 123 finished with value: 0.011929389403643537 and parameters: {'model_type': 'graphsage', 'hidden_dims': '[128, 64]', 'dropout': 0.4069679660904667, 'batch_norm': False, 'lr': 0.0005308519695196171, 'weight_decay': 2.6333009273490975e-07, 'epochs': 64, 'loss': 'mse', 'optimizer': 'adam', 'graph_mode': 'knn', 'source': 'grm', 'knn_k': 8, 'weighted_edges': False, 'symmetrize_mode': 'mutual', 'use_snp_selection': True, 'num_snps': 28404}. Best is trial 32 with value: 0.05624840045269122.
[I 2025-11-03 14:50:17,503] Trial 124 finished with value: 0.0010666352979086416 and parameters: {'model_type': 'graphsage', 'hidden_dims': '[128, 64]', 'dropout': 0.14964213247062869, 'batch_norm': False, 'lr': 2.049377566386887e-06, 'weight_decay': 0.0002465742823031831, 'epochs': 68, 'loss': 'mse', 'optimizer': 'adam', 'graph_mode': 'knn', 'source': 'grm', 'knn_k': 9, 'weighted_edges': False, 'symmetrize_mode': 'mutual', 'use_snp_selection': True, 'num_snps': 20748}. Best is trial 32 with value: 0.05624840045269122.
[I 2025-11-03 14:50:19,852] Trial 125 finished with value: 0.02341977635036762 and parameters: {'model_type': 'graphsage', 'hidden_dims': '[256, 128, 64]', 'dropout': 0.5738414206470771, 'batch_norm': False, 'lr': 0.00043884223395886275, 'weight_decay': 0.000393585852975939, 'epochs': 71, 'loss': 'mse', 'optimizer': 'adam', 'graph_mode': 'knn', 'source': 'grm', 'knn_k': 6, 'weighted_edges': False, 'symmetrize_mode': 'mutual', 'use_snp_selection': True, 'num_snps': 24670}. Best is trial 32 with value: 0.05624840045269122.
[I 2025-11-03 14:50:22,204] Trial 126 finished with value: 0.002670111186509752 and parameters: {'model_type': 'graphsage', 'hidden_dims': '[256, 128, 64]', 'dropout': 0.5125843896046021, 'batch_norm': False, 'lr': 0.00038912953686238, 'weight_decay': 0.00014566623747536562, 'epochs': 72, 'loss': 'mse', 'optimizer': 'adam', 'graph_mode': 'knn', 'source': 'grm', 'knn_k': 6, 'weighted_edges': True, 'symmetrize_mode': 'mutual', 'use_snp_selection': True, 'num_snps': 24411}. Best is trial 32 with value: 0.05624840045269122.
[I 2025-11-03 14:50:24,978] Trial 127 finished with value: 0.009532382467271843 and parameters: {'model_type': 'graphsage', 'hidden_dims': '[256, 128, 64]', 'dropout': 0.5328187785563719, 'batch_norm': False, 'lr': 0.00042379959510895163, 'weight_decay': 0.0003701897266430314, 'epochs': 193, 'loss': 'mse', 'optimizer': 'adam', 'graph_mode': 'knn', 'source': 'grm', 'knn_k': 6, 'weighted_edges': False, 'symmetrize_mode': 'mutual', 'use_snp_selection': True, 'num_snps': 22881}. Best is trial 32 with value: 0.05624840045269122.
[I 2025-11-03 14:50:27,603] Trial 128 finished with value: -0.00857921384809068 and parameters: {'model_type': 'graphsage', 'hidden_dims': '[256, 128, 64]', 'dropout': 0.5765848944360481, 'batch_norm': False, 'lr': 0.0003259893979135367, 'weight_decay': 0.00019062336900274647, 'epochs': 82, 'loss': 'mse', 'optimizer': 'adam', 'graph_mode': 'knn', 'source': 'grm', 'knn_k': 7, 'weighted_edges': False, 'symmetrize_mode': 'mutual', 'use_snp_selection': True, 'num_snps': 30620}. Best is trial 32 with value: 0.05624840045269122.
[I 2025-11-03 14:50:30,594] Trial 129 finished with value: 0.0060145584025494215 and parameters: {'model_type': 'graphsage', 'hidden_dims': '[256, 128, 64]', 'dropout': 0.5552724098730172, 'batch_norm': False, 'lr': 0.0009585497306858224, 'weight_decay': 0.00040578917564510636, 'epochs': 144, 'loss': 'mse', 'optimizer': 'adam', 'graph_mode': 'knn', 'source': 'grm', 'knn_k': 6, 'weighted_edges': False, 'symmetrize_mode': 'mutual', 'use_snp_selection': True, 'num_snps': 33562}. Best is trial 32 with value: 0.05624840045269122.
[I 2025-11-03 14:50:32,751] Trial 130 finished with value: 0.006647180777544986 and parameters: {'model_type': 'graphsage', 'hidden_dims': '[256, 128, 64]', 'dropout': 0.569292590616632, 'batch_norm': False, 'lr': 0.0007131319359307653, 'weight_decay': 0.00030217590742560505, 'epochs': 46, 'loss': 'mse', 'optimizer': 'adam', 'graph_mode': 'cutoff', 'cutoff': 0.5394107065314842, 'grm_norm': 'cosine', 'self_loops': True, 'use_snp_selection': True, 'num_snps': 25213}. Best is trial 32 with value: 0.05624840045269122.
[I 2025-11-03 14:50:34,200] Trial 131 finished with value: -0.00900802683741794 and parameters: {'model_type': 'graphsage', 'hidden_dims': '[128, 64]', 'dropout': 0.1933613201344286, 'batch_norm': True, 'lr': 0.000546627362738728, 'weight_decay': 0.0006350395509967699, 'epochs': 54, 'loss': 'mae', 'optimizer': 'adam', 'graph_mode': 'knn', 'source': 'grm', 'knn_k': 5, 'weighted_edges': False, 'symmetrize_mode': 'mutual', 'use_snp_selection': False}. Best is trial 32 with value: 0.05624840045269122.
[I 2025-11-03 14:50:36,507] Trial 132 finished with value: -0.018131872209564425 and parameters: {'model_type': 'graphsage', 'hidden_dims': '[512, 128]', 'dropout': 0.1787423217326093, 'batch_norm': False, 'lr': 1.2031114922912283e-06, 'weight_decay': 0.0004713639932099214, 'epochs': 86, 'loss': 'mse', 'optimizer': 'adam', 'graph_mode': 'knn', 'source': 'grm', 'knn_k': 7, 'weighted_edges': False, 'symmetrize_mode': 'union', 'use_snp_selection': True, 'num_snps': 18457}. Best is trial 32 with value: 0.05624840045269122.
[I 2025-11-03 14:50:39,620] Trial 133 finished with value: 0.021027476371141607 and parameters: {'model_type': 'graphsage', 'hidden_dims': '[512, 256]', 'dropout': 0.12371000350703576, 'batch_norm': True, 'lr': 2.5965757312377283e-06, 'weight_decay': 0.0002505460193737711, 'epochs': 74, 'loss': 'mse', 'optimizer': 'adam', 'graph_mode': 'knn', 'source': 'grm', 'knn_k': 8, 'weighted_edges': False, 'symmetrize_mode': 'union', 'use_snp_selection': False}. Best is trial 32 with value: 0.05624840045269122.
[I 2025-11-03 14:50:41,965] Trial 134 finished with value: -0.004615716782349521 and parameters: {'model_type': 'graphsage', 'hidden_dims': '[128, 64]', 'dropout': 0.5981036461362766, 'batch_norm': False, 'lr': 1.5140828093106206e-06, 'weight_decay': 0.0005185150405181681, 'epochs': 95, 'loss': 'mae', 'optimizer': 'adam', 'graph_mode': 'knn', 'source': 'grm', 'knn_k': 8, 'weighted_edges': False, 'symmetrize_mode': 'mutual', 'use_snp_selection': True, 'num_snps': 27764}. Best is trial 32 with value: 0.05624840045269122.
[I 2025-11-03 14:50:44,551] Trial 135 finished with value: 0.03179619383283243 and parameters: {'model_type': 'graphsage', 'hidden_dims': '[512, 64]', 'dropout': 0.41734586706778853, 'batch_norm': False, 'lr': 0.0008602842059156432, 'weight_decay': 0.0003520796756616726, 'epochs': 111, 'loss': 'mse', 'optimizer': 'adam', 'graph_mode': 'knn', 'source': 'grm', 'knn_k': 4, 'weighted_edges': False, 'symmetrize_mode': 'union', 'use_snp_selection': True, 'num_snps': 21180}. Best is trial 32 with value: 0.05624840045269122.
[I 2025-11-03 14:50:47,162] Trial 136 finished with value: 0.003206171392305509 and parameters: {'model_type': 'graphsage', 'hidden_dims': '[512, 64]', 'dropout': 0.42420851409292143, 'batch_norm': False, 'lr': 0.0009062415534220109, 'weight_decay': 0.00033292440661397373, 'epochs': 115, 'loss': 'mse', 'optimizer': 'adam', 'graph_mode': 'knn', 'source': 'grm', 'knn_k': 4, 'weighted_edges': True, 'symmetrize_mode': 'union', 'use_snp_selection': True, 'num_snps': 21326}. Best is trial 32 with value: 0.05624840045269122.
[I 2025-11-03 14:50:49,942] Trial 137 finished with value: -0.033870404426098094 and parameters: {'model_type': 'graphsage', 'hidden_dims': '[512, 64]', 'dropout': 0.463904238519335, 'batch_norm': False, 'lr': 0.0006450533840562028, 'weight_decay': 0.00020703763068007574, 'epochs': 125, 'loss': 'mse', 'optimizer': 'adam', 'graph_mode': 'knn', 'source': 'grm', 'knn_k': 4, 'weighted_edges': False, 'symmetrize_mode': 'union', 'use_snp_selection': True, 'num_snps': 23518}. Best is trial 32 with value: 0.05624840045269122.
[I 2025-11-03 14:50:52,216] Trial 138 finished with value: -0.01588153121596406 and parameters: {'model_type': 'graphsage', 'hidden_dims': '[512, 64]', 'dropout': 0.4123415198614248, 'batch_norm': False, 'lr': 0.00047647422394299637, 'weight_decay': 0.00011761673561400396, 'epochs': 111, 'loss': 'mse', 'optimizer': 'adam', 'graph_mode': 'knn', 'source': 'grm', 'knn_k': 2, 'weighted_edges': False, 'symmetrize_mode': 'mutual', 'use_snp_selection': True, 'num_snps': 16982}. Best is trial 32 with value: 0.05624840045269122.
[I 2025-11-03 14:50:55,696] Trial 139 finished with value: -0.01880324353613036 and parameters: {'model_type': 'graphsage', 'hidden_dims': '[512, 64]', 'dropout': 0.39546917329302134, 'batch_norm': False, 'lr': 0.0007849771682433411, 'weight_decay': 0.00027759585105882313, 'epochs': 199, 'loss': 'mse', 'optimizer': 'adam', 'graph_mode': 'knn', 'source': 'grm', 'knn_k': 5, 'weighted_edges': False, 'symmetrize_mode': 'union', 'use_snp_selection': True, 'num_snps': 27309}. Best is trial 32 with value: 0.05624840045269122.
[I 2025-11-03 14:50:58,417] Trial 140 finished with value: 0.0013429363717468476 and parameters: {'model_type': 'graphsage', 'hidden_dims': '[256, 128]', 'dropout': 0.37813608053716535, 'batch_norm': False, 'lr': 0.0005808779348638027, 'weight_decay': 2.2084990251402132e-05, 'epochs': 276, 'loss': 'mse', 'optimizer': 'adam', 'graph_mode': 'knn', 'source': 'grm', 'knn_k': 7, 'weighted_edges': True, 'symmetrize_mode': 'union', 'use_snp_selection': True, 'num_snps': 19681}. Best is trial 32 with value: 0.05624840045269122.
[I 2025-11-03 14:51:00,126] Trial 141 finished with value: 0.015143605497601135 and parameters: {'model_type': 'graphsage', 'hidden_dims': '[128, 64]', 'dropout': 0.44369946422395046, 'batch_norm': True, 'lr': 1.8888555189172738e-06, 'weight_decay': 0.000833118325194595, 'epochs': 82, 'loss': 'mse', 'optimizer': 'adam', 'graph_mode': 'knn', 'source': 'grm', 'knn_k': 6, 'weighted_edges': False, 'symmetrize_mode': 'union', 'use_snp_selection': False}. Best is trial 32 with value: 0.05624840045269122.
[I 2025-11-03 14:51:02,780] Trial 142 finished with value: 0.008841838249631036 and parameters: {'model_type': 'graphsage', 'hidden_dims': '[256, 128, 64]', 'dropout': 0.31565094505469643, 'batch_norm': False, 'lr': 1.0025175813644263e-06, 'weight_decay': 0.0004161416973827568, 'epochs': 101, 'loss': 'mse', 'optimizer': 'adam', 'graph_mode': 'knn', 'source': 'grm', 'knn_k': 9, 'weighted_edges': False, 'symmetrize_mode': 'union', 'use_snp_selection': True, 'num_snps': 29084}. Best is trial 32 with value: 0.05624840045269122.
[I 2025-11-03 14:51:04,709] Trial 143 finished with value: 0.02144790312387373 and parameters: {'model_type': 'graphsage', 'hidden_dims': '[128, 64]', 'dropout': 0.2140275475915482, 'batch_norm': True, 'lr': 1.4208339735820077e-06, 'weight_decay': 0.0005242686552261419, 'epochs': 93, 'loss': 'mae', 'optimizer': 'adam', 'graph_mode': 'knn', 'source': 'grm', 'knn_k': 8, 'weighted_edges': False, 'symmetrize_mode': 'union', 'use_snp_selection': False}. Best is trial 32 with value: 0.05624840045269122.
[I 2025-11-03 14:51:06,866] Trial 144 finished with value: -0.0033403283301557418 and parameters: {'model_type': 'graphsage', 'hidden_dims': '[128, 64]', 'dropout': 0.5187373370661815, 'batch_norm': False, 'lr': 1.2990891742965194e-06, 'weight_decay': 0.00016346169205894707, 'epochs': 77, 'loss': 'mse', 'optimizer': 'adam', 'graph_mode': 'knn', 'source': 'grm', 'knn_k': 4, 'weighted_edges': False, 'symmetrize_mode': 'union', 'use_snp_selection': True, 'num_snps': 25415}. Best is trial 32 with value: 0.05624840045269122.
[I 2025-11-03 14:51:12,887] Trial 145 finished with value: -0.024649708124986514 and parameters: {'model_type': 'graphsage', 'hidden_dims': '[512, 64]', 'dropout': 0.4860713106776172, 'batch_norm': False, 'lr': 0.0008391536434482242, 'weight_decay': 8.441997666832468e-05, 'epochs': 210, 'loss': 'mse', 'optimizer': 'adam', 'graph_mode': 'knn', 'source': 'grm', 'knn_k': 5, 'weighted_edges': False, 'symmetrize_mode': 'union', 'use_snp_selection': True, 'num_snps': 57099}. Best is trial 32 with value: 0.05624840045269122.
[I 2025-11-03 14:51:14,710] Trial 146 finished with value: 0.014925570281208729 and parameters: {'model_type': 'graphsage', 'hidden_dims': '[128, 64]', 'dropout': 0.33510273472915036, 'batch_norm': True, 'lr': 3.2276627446897207e-06, 'weight_decay': 0.00035729340280050504, 'epochs': 106, 'loss': 'mae', 'optimizer': 'adam', 'graph_mode': 'cutoff', 'cutoff': 0.25479418255714137, 'grm_norm': 'cosine_then_gcn', 'self_loops': True, 'use_snp_selection': False}. Best is trial 32 with value: 0.05624840045269122.
[I 2025-11-03 14:51:17,582] Trial 147 finished with value: 0.02890980109657619 and parameters: {'model_type': 'graphsage', 'hidden_dims': '[256, 128, 64]', 'dropout': 0.5338248804708396, 'batch_norm': False, 'lr': 2.2640794444796083e-06, 'weight_decay': 0.0006978365416719955, 'epochs': 221, 'loss': 'mse', 'optimizer': 'adam', 'graph_mode': 'knn', 'source': 'grm', 'knn_k': 10, 'weighted_edges': False, 'symmetrize_mode': 'union', 'use_snp_selection': True, 'num_snps': 22176}. Best is trial 32 with value: 0.05624840045269122.
[I 2025-11-03 14:51:22,375] Trial 148 finished with value: 0.015200737111132024 and parameters: {'model_type': 'graphsage', 'hidden_dims': '[256, 128, 64]', 'dropout': 0.5417733657056917, 'batch_norm': False, 'lr': 2.2222971996142e-06, 'weight_decay': 0.00024342207526486704, 'epochs': 223, 'loss': 'mse', 'optimizer': 'adam', 'graph_mode': 'knn', 'source': 'grm', 'knn_k': 7, 'weighted_edges': False, 'symmetrize_mode': 'union', 'use_snp_selection': True, 'num_snps': 52001}. Best is trial 32 with value: 0.05624840045269122.
[I 2025-11-03 14:51:24,908] Trial 149 finished with value: 0.01986432165497993 and parameters: {'model_type': 'graphsage', 'hidden_dims': '[256, 128, 64]', 'dropout': 0.5311442247680352, 'batch_norm': False, 'lr': 0.0007142697651666066, 'weight_decay': 5.199747496185827e-05, 'epochs': 132, 'loss': 'mse', 'optimizer': 'adam', 'graph_mode': 'knn', 'source': 'grm', 'knn_k': 8, 'weighted_edges': False, 'symmetrize_mode': 'union', 'use_snp_selection': True, 'num_snps': 22406}. Best is trial 32 with value: 0.05624840045269122.
[I 2025-11-03 14:51:27,301] Trial 0 finished with value: 0.010452508367810052 and parameters: {'model_type': 'graphsage', 'hidden_dims': '[128, 64]', 'dropout': 0.199031432379812, 'batch_norm': True, 'lr': 1.8408544111075837e-06, 'weight_decay': 5.5136510071208614e-05, 'epochs': 336, 'loss': 'mae', 'optimizer': 'adam', 'graph_mode': 'knn', 'source': 'grm', 'knn_k': 8, 'weighted_edges': True, 'symmetrize_mode': 'mutual', 'use_snp_selection': False}. Best is trial 0 with value: 0.010452508367810052.
[I 2025-11-03 14:51:28,804] Trial 1 finished with value: 0.08561723555113955 and parameters: {'model_type': 'graphsage', 'hidden_dims': '[128, 64]', 'dropout': 0.40051947670227217, 'batch_norm': True, 'lr': 0.0005320428882732732, 'weight_decay': 1.89210117736594e-06, 'epochs': 68, 'loss': 'mse', 'optimizer': 'adam', 'graph_mode': 'knn', 'source': 'grm', 'knn_k': 7, 'weighted_edges': True, 'symmetrize_mode': 'union', 'use_snp_selection': False}. Best is trial 1 with value: 0.08561723555113955.
[I 2025-11-03 14:51:31,249] Trial 2 finished with value: 0.05666339062358186 and parameters: {'model_type': 'graphsage', 'hidden_dims': '[256, 128]', 'dropout': 0.5105528289184642, 'batch_norm': False, 'lr': 0.0006804279372404962, 'weight_decay': 0.0008922815224257085, 'epochs': 181, 'loss': 'mse', 'optimizer': 'adam', 'graph_mode': 'cutoff', 'cutoff': 0.5741905641612706, 'grm_norm': 'gcn', 'self_loops': False, 'use_snp_selection': True, 'num_snps': 26910}. Best is trial 1 with value: 0.08561723555113955.
[I 2025-11-03 14:51:33,878] Trial 3 finished with value: 0.02517356722569919 and parameters: {'model_type': 'graphsage', 'hidden_dims': '[256, 128, 64]', 'dropout': 0.5390483213624292, 'batch_norm': False, 'lr': 3.4705625989073525e-05, 'weight_decay': 2.4623319020131338e-05, 'epochs': 121, 'loss': 'mse', 'optimizer': 'adam', 'graph_mode': 'knn', 'source': 'grm', 'knn_k': 6, 'weighted_edges': False, 'symmetrize_mode': 'mutual', 'use_snp_selection': True, 'num_snps': 30713}. Best is trial 1 with value: 0.08561723555113955.
[I 2025-11-03 14:51:36,461] Trial 4 finished with value: 0.08376082236667384 and parameters: {'model_type': 'graphsage', 'hidden_dims': '[128, 64]', 'dropout': 0.13404863676897502, 'batch_norm': False, 'lr': 0.0001431556295367288, 'weight_decay': 2.2084517750726675e-05, 'epochs': 51, 'loss': 'mae', 'optimizer': 'adam', 'graph_mode': 'cutoff', 'cutoff': 0.6714268476993044, 'grm_norm': 'none', 'self_loops': False, 'use_snp_selection': True, 'num_snps': 45645}. Best is trial 1 with value: 0.08561723555113955.
[I 2025-11-03 14:51:39,565] Trial 5 finished with value: 0.08915135437467508 and parameters: {'model_type': 'graphsage', 'hidden_dims': '[256, 128]', 'dropout': 0.42253606323412096, 'batch_norm': False, 'lr': 4.238630400638805e-05, 'weight_decay': 8.074086040046576e-07, 'epochs': 158, 'loss': 'mae', 'optimizer': 'adam', 'graph_mode': 'knn', 'source': 'grm', 'knn_k': 1, 'weighted_edges': False, 'symmetrize_mode': 'mutual', 'use_snp_selection': True, 'num_snps': 43113}. Best is trial 5 with value: 0.08915135437467508.
[I 2025-11-03 14:51:43,384] Trial 6 finished with value: 0.10694617036554292 and parameters: {'model_type': 'graphsage', 'hidden_dims': '[512, 256]', 'dropout': 0.3534893146320237, 'batch_norm': True, 'lr': 0.000251307964226932, 'weight_decay': 1.821819791794022e-05, 'epochs': 223, 'loss': 'mae', 'optimizer': 'adam', 'graph_mode': 'knn', 'source': 'grm', 'knn_k': 1, 'weighted_edges': True, 'symmetrize_mode': 'mutual', 'use_snp_selection': False}. Best is trial 6 with value: 0.10694617036554292.
[I 2025-11-03 14:51:46,882] Trial 7 finished with value: 0.12018701237006751 and parameters: {'model_type': 'graphsage', 'hidden_dims': '[512, 256]', 'dropout': 0.1105825955860775, 'batch_norm': True, 'lr': 2.374338412754043e-05, 'weight_decay': 1.1284721123340274e-05, 'epochs': 190, 'loss': 'mse', 'optimizer': 'adam', 'graph_mode': 'cutoff', 'cutoff': 0.719872204109604, 'grm_norm': 'gcn', 'self_loops': False, 'use_snp_selection': False}. Best is trial 7 with value: 0.12018701237006751.
