[I 2025-11-03 13:20:33,222] Trial 7 finished with value: 0.061300460922004224 and parameters: {'model_type': 'gcn', 'hidden_dims': '[512, 256]', 'dropout': 0.1105825955860775, 'batch_norm': True, 'lr': 2.374338412754043e-05, 'weight_decay': 1.1284721123340274e-05, 'epochs': 170, 'loss': 'mse', 'optimizer': 'adam', 'graph_mode': 'cutoff', 'cutoff': 0.719872204109604, 'grm_norm': 'gcn', 'self_loops': False, 'use_snp_selection': False}. Best is trial 5 with value: 0.10109969080807474.
[I 2025-11-03 13:20:35,129] Trial 8 finished with value: 0.084405929003536 and parameters: {'model_type': 'gcn', 'hidden_dims': '[512, 128]', 'dropout': 0.5066580418354021, 'batch_norm': True, 'lr': 0.00039213678276659976, 'weight_decay': 3.43655320802934e-06, 'epochs': 91, 'loss': 'mse', 'optimizer': 'adam', 'graph_mode': 'cutoff', 'cutoff': 0.34923059576505366, 'grm_norm': 'cosine', 'self_loops': True, 'use_snp_selection': False}. Best is trial 5 with value: 0.10109969080807474.
[I 2025-11-03 13:20:36,947] Trial 9 finished with value: 0.03721750596674242 and parameters: {'model_type': 'gcn', 'hidden_dims': '[512, 256]', 'dropout': 0.301734920240333, 'batch_norm': False, 'lr': 6.650961854953448e-06, 'weight_decay': 6.861575656590315e-05, 'epochs': 125, 'loss': 'mae', 'optimizer': 'adam', 'graph_mode': 'cutoff', 'cutoff': 0.2857569870061939, 'grm_norm': 'cosine_then_gcn', 'self_loops': False, 'use_snp_selection': True, 'num_snps': 12722}. Best is trial 5 with value: 0.10109969080807474.
[I 2025-11-03 13:20:41,047] Trial 10 finished with value: 0.02782846324360512 and parameters: {'model_type': 'gcn', 'hidden_dims': '[256, 128]', 'dropout': 0.42081077970837905, 'batch_norm': False, 'lr': 6.10458015764876e-05, 'weight_decay': 1.1882920363656207e-07, 'epochs': 255, 'loss': 'mae', 'optimizer': 'adam', 'graph_mode': 'knn', 'source': 'grm', 'knn_k': 1, 'weighted_edges': False, 'symmetrize_mode': 'union', 'use_snp_selection': True, 'num_snps': 58960}. Best is trial 5 with value: 0.10109969080807474.
[I 2025-11-03 13:20:43,694] Trial 11 finished with value: 0.05830579796560859 and parameters: {'model_type': 'gcn', 'hidden_dims': '[256, 128]', 'dropout': 0.5994078297443701, 'batch_norm': False, 'lr': 0.0009859431121976962, 'weight_decay': 0.0007920371300925926, 'epochs': 183, 'loss': 'mse', 'optimizer': 'adam', 'graph_mode': 'cutoff', 'cutoff': 0.5167801880344087, 'grm_norm': 'gcn', 'self_loops': True, 'use_snp_selection': True, 'num_snps': 31091}. Best is trial 5 with value: 0.10109969080807474.
[I 2025-11-03 13:20:46,522] Trial 12 finished with value: 0.0641771920147981 and parameters: {'model_type': 'gcn', 'hidden_dims': '[256, 128]', 'dropout': 0.4529380881868808, 'batch_norm': False, 'lr': 1.09190189634402e-05, 'weight_decay': 3.0402477924679005e-07, 'epochs': 249, 'loss': 'mae', 'optimizer': 'adam', 'graph_mode': 'cutoff', 'cutoff': 0.8997334580241522, 'grm_norm': 'gcn', 'self_loops': False, 'use_snp_selection': True, 'num_snps': 30900}. Best is trial 5 with value: 0.10109969080807474.
[I 2025-11-03 13:20:48,498] Trial 13 finished with value: 0.06182071159951113 and parameters: {'model_type': 'gcn', 'hidden_dims': '[512, 64]', 'dropout': 0.2961936625090291, 'batch_norm': False, 'lr': 0.00010211123063502776, 'weight_decay': 0.0007550753157330512, 'epochs': 118, 'loss': 'mse', 'optimizer': 'adam', 'graph_mode': 'knn', 'source': 'grm', 'knn_k': 3, 'weighted_edges': False, 'symmetrize_mode': 'mutual', 'use_snp_selection': True, 'num_snps': 14531}. Best is trial 5 with value: 0.10109969080807474.
[I 2025-11-03 13:20:51,543] Trial 14 finished with value: 0.01933071162310194 and parameters: {'model_type': 'gcn', 'hidden_dims': '[256, 128]', 'dropout': 0.5059024864033792, 'batch_norm': False, 'lr': 3.2965950432104435e-06, 'weight_decay': 6.519642271725165e-07, 'epochs': 149, 'loss': 'mae', 'optimizer': 'adam', 'graph_mode': 'cutoff', 'cutoff': 0.49348330859673306, 'grm_norm': 'cosine_then_gcn', 'self_loops': False, 'use_snp_selection': True, 'num_snps': 44100}. Best is trial 5 with value: 0.10109969080807474.
[I 2025-11-03 13:20:54,360] Trial 15 finished with value: 0.03576328632948791 and parameters: {'model_type': 'gcn', 'hidden_dims': '[256, 128]', 'dropout': 0.5945136394423849, 'batch_norm': False, 'lr': 1.6230608961668894e-05, 'weight_decay': 0.0001298039942625942, 'epochs': 63, 'loss': 'mse', 'optimizer': 'adam', 'graph_mode': 'knn', 'source': 'grm', 'knn_k': 10, 'weighted_edges': False, 'symmetrize_mode': 'mutual', 'use_snp_selection': True, 'num_snps': 43179}. Best is trial 5 with value: 0.10109969080807474.
[I 2025-11-03 13:20:56,909] Trial 16 finished with value: 0.002484290295714683 and parameters: {'model_type': 'gcn', 'hidden_dims': '[512, 64]', 'dropout': 0.45888706612159014, 'batch_norm': False, 'lr': 1.061436110430588e-06, 'weight_decay': 2.9340253560969567e-06, 'epochs': 227, 'loss': 'mse', 'optimizer': 'adam', 'graph_mode': 'cutoff', 'cutoff': 0.6810039649986108, 'grm_norm': 'none', 'self_loops': True, 'use_snp_selection': True, 'num_snps': 20467}. Best is trial 5 with value: 0.10109969080807474.
[I 2025-11-03 13:21:01,382] Trial 17 finished with value: 0.036671895096491075 and parameters: {'model_type': 'gcn', 'hidden_dims': '[256, 128, 64]', 'dropout': 0.3671723562964725, 'batch_norm': False, 'lr': 6.172675886859051e-05, 'weight_decay': 0.00026701931337812885, 'epochs': 295, 'loss': 'mae', 'optimizer': 'adam', 'graph_mode': 'knn', 'source': 'grm', 'knn_k': 4, 'weighted_edges': False, 'symmetrize_mode': 'union', 'use_snp_selection': True, 'num_snps': 55447}. Best is trial 5 with value: 0.10109969080807474.
[I 2025-11-03 13:21:03,000] Trial 18 finished with value: 0.06402975739280217 and parameters: {'model_type': 'gcn', 'hidden_dims': '[512, 128]', 'dropout': 0.28921915537894993, 'batch_norm': False, 'lr': 0.00019983103102726843, 'weight_decay': 7.677288933068033e-07, 'epochs': 152, 'loss': 'mse', 'optimizer': 'adam', 'graph_mode': 'cutoff', 'cutoff': 0.3943236797477178, 'grm_norm': 'cosine', 'self_loops': False, 'use_snp_selection': True, 'num_snps': 4694}. Best is trial 5 with value: 0.10109969080807474.
[I 2025-11-03 13:21:06,101] Trial 19 finished with value: 0.06518929326605748 and parameters: {'model_type': 'gcn', 'hidden_dims': '[256, 128]', 'dropout': 0.5359691945490758, 'batch_norm': False, 'lr': 0.0008461493904494044, 'weight_decay': 5.4980640990494805e-06, 'epochs': 196, 'loss': 'mae', 'optimizer': 'adam', 'graph_mode': 'knn', 'source': 'grm', 'knn_k': 4, 'weighted_edges': False, 'symmetrize_mode': 'mutual', 'use_snp_selection': True, 'num_snps': 38924}. Best is trial 5 with value: 0.10109969080807474.
[I 2025-11-03 13:21:08,215] Trial 20 finished with value: 0.026293543253166695 and parameters: {'model_type': 'gcn', 'hidden_dims': '[256, 128]', 'dropout': 0.46703743276292387, 'batch_norm': False, 'lr': 5.672751922305723e-06, 'weight_decay': 1.1598567670078824e-07, 'epochs': 56, 'loss': 'mse', 'optimizer': 'adam', 'graph_mode': 'cutoff', 'cutoff': 0.8781219337374944, 'grm_norm': 'gcn', 'self_loops': True, 'use_snp_selection': True, 'num_snps': 26484}. Best is trial 5 with value: 0.10109969080807474.
[I 2025-11-03 13:21:10,334] Trial 21 finished with value: 0.05467648261610377 and parameters: {'model_type': 'gcn', 'hidden_dims': '[512, 128]', 'dropout': 0.5132396075629235, 'batch_norm': True, 'lr': 0.0004190938305809523, 'weight_decay': 1.739238413151367e-06, 'epochs': 102, 'loss': 'mse', 'optimizer': 'adam', 'graph_mode': 'cutoff', 'cutoff': 0.2533425951931151, 'grm_norm': 'cosine', 'self_loops': True, 'use_snp_selection': False}. Best is trial 5 with value: 0.10109969080807474.
[I 2025-11-03 13:21:12,095] Trial 22 finished with value: 0.08442641016459784 and parameters: {'model_type': 'gcn', 'hidden_dims': '[512, 128]', 'dropout': 0.48515889198043377, 'batch_norm': True, 'lr': 0.00030110501549241093, 'weight_decay': 5.184621929143136e-06, 'epochs': 63, 'loss': 'mse', 'optimizer': 'adam', 'graph_mode': 'cutoff', 'cutoff': 0.3847142470580156, 'grm_norm': 'cosine', 'self_loops': True, 'use_snp_selection': False}. Best is trial 5 with value: 0.10109969080807474.
[I 2025-11-03 13:21:13,837] Trial 23 finished with value: 0.05071297692925852 and parameters: {'model_type': 'gcn', 'hidden_dims': '[512, 128]', 'dropout': 0.42902895290769916, 'batch_norm': True, 'lr': 6.845691662366435e-05, 'weight_decay': 9.19515993965656e-07, 'epochs': 61, 'loss': 'mse', 'optimizer': 'adam', 'graph_mode': 'cutoff', 'cutoff': 0.43203490108318676, 'grm_norm': 'cosine', 'self_loops': True, 'use_snp_selection': False}. Best is trial 5 with value: 0.10109969080807474.
[I 2025-11-03 13:21:16,157] Trial 24 finished with value: 0.09491066442246113 and parameters: {'model_type': 'gcn', 'hidden_dims': '[512, 128]', 'dropout': 0.3898812150906135, 'batch_norm': True, 'lr': 0.00027879015735104154, 'weight_decay': 3.220061498457948e-07, 'epochs': 142, 'loss': 'mse', 'optimizer': 'adam', 'graph_mode': 'cutoff', 'cutoff': 0.5879982174146365, 'grm_norm': 'gcn', 'self_loops': False, 'use_snp_selection': False}. Best is trial 5 with value: 0.10109969080807474.
[I 2025-11-03 13:21:17,947] Trial 25 finished with value: 0.10558084955617857 and parameters: {'model_type': 'gcn', 'hidden_dims': '[256, 128]', 'dropout': 0.3666581152854362, 'batch_norm': True, 'lr': 0.0005997612596780809, 'weight_decay': 2.6222459645633865e-07, 'epochs': 143, 'loss': 'mse', 'optimizer': 'adam', 'graph_mode': 'cutoff', 'cutoff': 0.6060034417535715, 'grm_norm': 'gcn', 'self_loops': False, 'use_snp_selection': False}. Best is trial 25 with value: 0.10558084955617857.
[I 2025-11-03 13:21:20,241] Trial 26 finished with value: 0.08055892947846251 and parameters: {'model_type': 'gcn', 'hidden_dims': '[512, 64]', 'dropout': 0.23175104234063434, 'batch_norm': True, 'lr': 0.00016099071826855218, 'weight_decay': 2.8465949647341257e-07, 'epochs': 130, 'loss': 'mae', 'optimizer': 'adam', 'graph_mode': 'knn', 'source': 'grm', 'knn_k': 3, 'weighted_edges': True, 'symmetrize_mode': 'union', 'use_snp_selection': False}. Best is trial 25 with value: 0.10558084955617857.
[I 2025-11-03 13:21:22,131] Trial 27 finished with value: 0.04014124446389474 and parameters: {'model_type': 'gcn', 'hidden_dims': '[256, 128, 64]', 'dropout': 0.3859043760325905, 'batch_norm': True, 'lr': 3.4502166121889956e-05, 'weight_decay': 4.7266750653816393e-07, 'epochs': 133, 'loss': 'mse', 'optimizer': 'adam', 'graph_mode': 'cutoff', 'cutoff': 0.6102485407292524, 'grm_norm': 'gcn', 'self_loops': False, 'use_snp_selection': False}. Best is trial 25 with value: 0.10558084955617857.
[I 2025-11-03 13:21:25,022] Trial 28 finished with value: 0.04408948579862189 and parameters: {'model_type': 'gcn', 'hidden_dims': '[512, 128]', 'dropout': 0.3404120344500443, 'batch_norm': True, 'lr': 0.00011721299724731431, 'weight_decay': 2.45142925693487e-07, 'epochs': 209, 'loss': 'mae', 'optimizer': 'adam', 'graph_mode': 'knn', 'source': 'grm', 'knn_k': 10, 'weighted_edges': False, 'symmetrize_mode': 'mutual', 'use_snp_selection': False}. Best is trial 25 with value: 0.10558084955617857.
[I 2025-11-03 13:21:27,135] Trial 29 finished with value: 0.12547224693859224 and parameters: {'model_type': 'gcn', 'hidden_dims': '[128, 64]', 'dropout': 0.24339830652907393, 'batch_norm': True, 'lr': 0.00031177206013968813, 'weight_decay': 1.1962303346772308e-06, 'epochs': 310, 'loss': 'mae', 'optimizer': 'adam', 'graph_mode': 'knn', 'source': 'grm', 'knn_k': 1, 'weighted_edges': False, 'symmetrize_mode': 'mutual', 'use_snp_selection': False}. Best is trial 29 with value: 0.12547224693859224.
[I 2025-11-03 13:21:29,338] Trial 30 finished with value: 0.0979517739343302 and parameters: {'model_type': 'gcn', 'hidden_dims': '[128, 64]', 'dropout': 0.23398007404110688, 'batch_norm': True, 'lr': 0.000589434659297193, 'weight_decay': 1.5971957674951146e-06, 'epochs': 338, 'loss': 'mae', 'optimizer': 'adam', 'graph_mode': 'knn', 'source': 'grm', 'knn_k': 1, 'weighted_edges': False, 'symmetrize_mode': 'mutual', 'use_snp_selection': False}. Best is trial 29 with value: 0.12547224693859224.
[I 2025-11-03 13:21:31,604] Trial 31 finished with value: 0.1120359056718047 and parameters: {'model_type': 'gcn', 'hidden_dims': '[128, 64]', 'dropout': 0.20977428837209416, 'batch_norm': True, 'lr': 0.0004993412704573348, 'weight_decay': 1.258547134043935e-06, 'epochs': 349, 'loss': 'mae', 'optimizer': 'adam', 'graph_mode': 'knn', 'source': 'grm', 'knn_k': 1, 'weighted_edges': False, 'symmetrize_mode': 'mutual', 'use_snp_selection': False}. Best is trial 29 with value: 0.12547224693859224.
[I 2025-11-03 13:21:33,758] Trial 32 finished with value: 0.0671989558275301 and parameters: {'model_type': 'gcn', 'hidden_dims': '[128, 64]', 'dropout': 0.16781522129828896, 'batch_norm': True, 'lr': 0.0005084008739387368, 'weight_decay': 1.1930316652899273e-06, 'epochs': 318, 'loss': 'mae', 'optimizer': 'adam', 'graph_mode': 'knn', 'source': 'grm', 'knn_k': 2, 'weighted_edges': False, 'symmetrize_mode': 'mutual', 'use_snp_selection': False}. Best is trial 29 with value: 0.12547224693859224.
[I 2025-11-03 13:21:35,878] Trial 33 finished with value: 0.08685948537385696 and parameters: {'model_type': 'gcn', 'hidden_dims': '[128, 64]', 'dropout': 0.20730931378481632, 'batch_norm': True, 'lr': 0.00042079324854985077, 'weight_decay': 2.783705737442668e-06, 'epochs': 308, 'loss': 'mae', 'optimizer': 'adam', 'graph_mode': 'knn', 'source': 'grm', 'knn_k': 2, 'weighted_edges': False, 'symmetrize_mode': 'mutual', 'use_snp_selection': False}. Best is trial 29 with value: 0.12547224693859224.
[I 2025-11-03 13:21:38,136] Trial 34 finished with value: 0.08331257982161094 and parameters: {'model_type': 'gcn', 'hidden_dims': '[128, 64]', 'dropout': 0.2710751361765956, 'batch_norm': True, 'lr': 0.0006690681064711895, 'weight_decay': 1.7154506663846357e-07, 'epochs': 347, 'loss': 'mae', 'optimizer': 'adam', 'graph_mode': 'knn', 'source': 'grm', 'knn_k': 2, 'weighted_edges': False, 'symmetrize_mode': 'mutual', 'use_snp_selection': False}. Best is trial 29 with value: 0.12547224693859224.
[I 2025-11-03 13:21:40,169] Trial 35 finished with value: 0.0886430878078801 and parameters: {'model_type': 'gcn', 'hidden_dims': '[128, 64]', 'dropout': 0.17424361221786203, 'batch_norm': True, 'lr': 8.115988516502068e-05, 'weight_decay': 5.099530569173448e-07, 'epochs': 282, 'loss': 'mae', 'optimizer': 'adam', 'graph_mode': 'knn', 'source': 'grm', 'knn_k': 4, 'weighted_edges': False, 'symmetrize_mode': 'mutual', 'use_snp_selection': False}. Best is trial 29 with value: 0.12547224693859224.
[I 2025-11-03 13:21:42,099] Trial 36 finished with value: 0.11478321695373175 and parameters: {'model_type': 'gcn', 'hidden_dims': '[128, 64]', 'dropout': 0.326512535290747, 'batch_norm': True, 'lr': 0.0002328826097694516, 'weight_decay': 1.2930111395935747e-06, 'epochs': 274, 'loss': 'mae', 'optimizer': 'adam', 'graph_mode': 'knn', 'source': 'grm', 'knn_k': 1, 'weighted_edges': False, 'symmetrize_mode': 'mutual', 'use_snp_selection': False}. Best is trial 29 with value: 0.12547224693859224.
[I 2025-11-03 13:21:44,063] Trial 37 finished with value: 0.06078969393560157 and parameters: {'model_type': 'gcn', 'hidden_dims': '[128, 64]', 'dropout': 0.3250840947738175, 'batch_norm': True, 'lr': 0.0002200839533245935, 'weight_decay': 6.533054183691685e-06, 'epochs': 275, 'loss': 'mae', 'optimizer': 'adam', 'graph_mode': 'knn', 'source': 'grm', 'knn_k': 3, 'weighted_edges': False, 'symmetrize_mode': 'mutual', 'use_snp_selection': False}. Best is trial 29 with value: 0.12547224693859224.
[I 2025-11-03 13:21:46,163] Trial 38 finished with value: 0.07008494937589108 and parameters: {'model_type': 'gcn', 'hidden_dims': '[128, 64]', 'dropout': 0.25073633636179676, 'batch_norm': True, 'lr': 0.00032208145726372444, 'weight_decay': 1.2856531764099047e-06, 'epochs': 322, 'loss': 'mae', 'optimizer': 'adam', 'graph_mode': 'knn', 'source': 'grm', 'knn_k': 2, 'weighted_edges': False, 'symmetrize_mode': 'mutual', 'use_snp_selection': False}. Best is trial 29 with value: 0.12547224693859224.
[I 2025-11-03 13:21:48,353] Trial 39 finished with value: 0.08289679379377311 and parameters: {'model_type': 'gcn', 'hidden_dims': '[128, 64]', 'dropout': 0.3258481436097807, 'batch_norm': True, 'lr': 0.0001767471204119222, 'weight_decay': 1.0530320541635966e-05, 'epochs': 350, 'loss': 'mae', 'optimizer': 'adam', 'graph_mode': 'knn', 'source': 'grm', 'knn_k': 5, 'weighted_edges': True, 'symmetrize_mode': 'union', 'use_snp_selection': False}. Best is trial 29 with value: 0.12547224693859224.
[I 2025-11-03 13:21:50,190] Trial 40 finished with value: 0.10500596413518237 and parameters: {'model_type': 'gcn', 'hidden_dims': '[128, 64]', 'dropout': 0.18406967583918152, 'batch_norm': True, 'lr': 0.0007593258333759862, 'weight_decay': 2.1870784155653483e-06, 'epochs': 251, 'loss': 'mae', 'optimizer': 'adam', 'graph_mode': 'knn', 'source': 'grm', 'knn_k': 1, 'weighted_edges': False, 'symmetrize_mode': 'mutual', 'use_snp_selection': False}. Best is trial 29 with value: 0.12547224693859224.
[I 2025-11-03 13:21:52,061] Trial 41 finished with value: 0.11702384252171526 and parameters: {'model_type': 'gcn', 'hidden_dims': '[128, 64]', 'dropout': 0.1532215933756817, 'batch_norm': True, 'lr': 0.0007494332382376815, 'weight_decay': 2.357186742056482e-06, 'epochs': 257, 'loss': 'mae', 'optimizer': 'adam', 'graph_mode': 'knn', 'source': 'grm', 'knn_k': 1, 'weighted_edges': False, 'symmetrize_mode': 'mutual', 'use_snp_selection': False}. Best is trial 29 with value: 0.12547224693859224.
[I 2025-11-03 13:21:54,066] Trial 42 finished with value: 0.06956082495617334 and parameters: {'model_type': 'gcn', 'hidden_dims': '[128, 64]', 'dropout': 0.14161382128578381, 'batch_norm': True, 'lr': 0.0005407417309416058, 'weight_decay': 5.065756611220133e-07, 'epochs': 297, 'loss': 'mae', 'optimizer': 'adam', 'graph_mode': 'knn', 'source': 'grm', 'knn_k': 2, 'weighted_edges': False, 'symmetrize_mode': 'mutual', 'use_snp_selection': False}. Best is trial 29 with value: 0.12547224693859224.
[I 2025-11-03 13:21:56,010] Trial 43 finished with value: 0.11480614286619556 and parameters: {'model_type': 'gcn', 'hidden_dims': '[128, 64]', 'dropout': 0.21005321403822447, 'batch_norm': True, 'lr': 0.0009353264605739883, 'weight_decay': 3.830192130907365e-06, 'epochs': 273, 'loss': 'mae', 'optimizer': 'adam', 'graph_mode': 'knn', 'source': 'grm', 'knn_k': 1, 'weighted_edges': False, 'symmetrize_mode': 'mutual', 'use_snp_selection': False}. Best is trial 29 with value: 0.12547224693859224.
[I 2025-11-03 13:21:57,910] Trial 44 finished with value: 0.11326616723168881 and parameters: {'model_type': 'gcn', 'hidden_dims': '[128, 64]', 'dropout': 0.10252829761221824, 'batch_norm': True, 'lr': 0.0008952138285772197, 'weight_decay': 4.075410984095116e-06, 'epochs': 265, 'loss': 'mae', 'optimizer': 'adam', 'graph_mode': 'knn', 'source': 'grm', 'knn_k': 1, 'weighted_edges': False, 'symmetrize_mode': 'mutual', 'use_snp_selection': False}. Best is trial 29 with value: 0.12547224693859224.
[I 2025-11-03 13:21:59,717] Trial 45 finished with value: 0.09745160676215378 and parameters: {'model_type': 'gcn', 'hidden_dims': '[128, 64]', 'dropout': 0.10889555691743215, 'batch_norm': True, 'lr': 0.0009296067487478707, 'weight_decay': 2.171070889525816e-05, 'epochs': 234, 'loss': 'mae', 'optimizer': 'adam', 'graph_mode': 'knn', 'source': 'grm', 'knn_k': 1, 'weighted_edges': False, 'symmetrize_mode': 'mutual', 'use_snp_selection': False}. Best is trial 29 with value: 0.12547224693859224.
[I 2025-11-03 13:22:02,952] Trial 46 finished with value: 0.09159882213042954 and parameters: {'model_type': 'gcn', 'hidden_dims': '[512, 256]', 'dropout': 0.14321587633293892, 'batch_norm': True, 'lr': 0.0009753072830249133, 'weight_decay': 3.7450977530792003e-06, 'epochs': 265, 'loss': 'mae', 'optimizer': 'adam', 'graph_mode': 'knn', 'source': 'grm', 'knn_k': 2, 'weighted_edges': False, 'symmetrize_mode': 'mutual', 'use_snp_selection': False}. Best is trial 29 with value: 0.12547224693859224.
[I 2025-11-03 13:22:04,724] Trial 47 finished with value: 0.10939709534261347 and parameters: {'model_type': 'gcn', 'hidden_dims': '[128, 64]', 'dropout': 0.12717104417976743, 'batch_norm': True, 'lr': 0.0003990683944641964, 'weight_decay': 4.970851293422743e-05, 'epochs': 232, 'loss': 'mae', 'optimizer': 'adam', 'graph_mode': 'knn', 'source': 'grm', 'knn_k': 1, 'weighted_edges': False, 'symmetrize_mode': 'mutual', 'use_snp_selection': False}. Best is trial 29 with value: 0.12547224693859224.
[I 2025-11-03 13:22:06,685] Trial 48 finished with value: 0.0849609882013142 and parameters: {'model_type': 'gcn', 'hidden_dims': '[128, 64]', 'dropout': 0.10013971062908925, 'batch_norm': True, 'lr': 0.0006980634757780166, 'weight_decay': 1.5158962472126018e-05, 'epochs': 288, 'loss': 'mae', 'optimizer': 'adam', 'graph_mode': 'knn', 'source': 'grm', 'knn_k': 3, 'weighted_edges': False, 'symmetrize_mode': 'mutual', 'use_snp_selection': False}. Best is trial 29 with value: 0.12547224693859224.
[I 2025-11-03 13:22:08,566] Trial 49 finished with value: 0.08363685845120467 and parameters: {'model_type': 'gcn', 'hidden_dims': '[128, 64]', 'dropout': 0.15550554877501896, 'batch_norm': True, 'lr': 0.000329600911632147, 'weight_decay': 4.37589404134529e-06, 'epochs': 265, 'loss': 'mae', 'optimizer': 'adam', 'graph_mode': 'knn', 'source': 'grm', 'knn_k': 2, 'weighted_edges': False, 'symmetrize_mode': 'mutual', 'use_snp_selection': False}. Best is trial 29 with value: 0.12547224693859224.
