[I 2025-11-03 11:44:32,784] Trial 104 finished with value: 0.10910682386836315 and parameters: {'model_type': 'gcn', 'hidden_dims': '[128, 64]', 'dropout': 0.14818828227413208, 'batch_norm': True, 'lr': 0.0006442364261405454, 'weight_decay': 4.883562730164706e-07, 'epochs': 92, 'loss': 'mae', 'optimizer': 'adam', 'graph_mode': 'off', 'use_snp_selection': False}. Best is trial 44 with value: 0.12588276278015856.
[I 2025-11-03 11:44:33,908] Trial 105 finished with value: 0.11213257515929695 and parameters: {'model_type': 'gcn', 'hidden_dims': '[512, 128]', 'dropout': 0.12848123115481905, 'batch_norm': True, 'lr': 0.0004847467058872859, 'weight_decay': 0.0005917482009125113, 'epochs': 86, 'loss': 'mae', 'optimizer': 'adam', 'graph_mode': 'off', 'use_snp_selection': False}. Best is trial 44 with value: 0.12588276278015856.
[I 2025-11-03 11:44:35,150] Trial 106 finished with value: 0.13225225587076325 and parameters: {'model_type': 'gcn', 'hidden_dims': '[512, 256]', 'dropout': 0.3440442956621754, 'batch_norm': True, 'lr': 0.0008463941680343275, 'weight_decay': 6.607263438817556e-06, 'epochs': 105, 'loss': 'mae', 'optimizer': 'adam', 'graph_mode': 'off', 'use_snp_selection': False}. Best is trial 106 with value: 0.13225225587076325.
[I 2025-11-03 11:44:36,402] Trial 107 finished with value: 0.10473544529837563 and parameters: {'model_type': 'gcn', 'hidden_dims': '[512, 256]', 'dropout': 0.3384141697551572, 'batch_norm': True, 'lr': 0.0008395884800900109, 'weight_decay': 6.791932119875216e-06, 'epochs': 107, 'loss': 'mae', 'optimizer': 'adam', 'graph_mode': 'off', 'use_snp_selection': False}. Best is trial 106 with value: 0.13225225587076325.
[I 2025-11-03 11:44:37,285] Trial 108 finished with value: 0.08968030359278867 and parameters: {'model_type': 'gcn', 'hidden_dims': '[512, 256]', 'dropout': 0.36857036082566774, 'batch_norm': True, 'lr': 0.0009899655736545709, 'weight_decay': 9.142891787532238e-06, 'epochs': 97, 'loss': 'mae', 'optimizer': 'adam', 'graph_mode': 'off', 'use_snp_selection': True, 'num_snps': 11322}. Best is trial 106 with value: 0.13225225587076325.
[I 2025-11-03 11:44:39,624] Trial 109 finished with value: 0.1115406277687514 and parameters: {'model_type': 'gcn', 'hidden_dims': '[512, 256]', 'dropout': 0.3199642896175072, 'batch_norm': True, 'lr': 0.0003980147754808178, 'weight_decay': 3.8070209288452485e-06, 'epochs': 349, 'loss': 'mae', 'optimizer': 'adam', 'graph_mode': 'off', 'use_snp_selection': False}. Best is trial 106 with value: 0.13225225587076325.
[I 2025-11-03 11:44:40,925] Trial 110 finished with value: 0.11361236437100936 and parameters: {'model_type': 'gcn', 'hidden_dims': '[512, 256]', 'dropout': 0.2941959773831642, 'batch_norm': True, 'lr': 0.00018913610007520622, 'weight_decay': 0.0007445532868508992, 'epochs': 122, 'loss': 'mae', 'optimizer': 'adam', 'graph_mode': 'off', 'use_snp_selection': False}. Best is trial 106 with value: 0.13225225587076325.
[I 2025-11-03 11:44:41,765] Trial 111 finished with value: 0.11895806888975533 and parameters: {'model_type': 'gcn', 'hidden_dims': '[128, 64]', 'dropout': 0.12143443584458052, 'batch_norm': True, 'lr': 0.0007265874390505277, 'weight_decay': 1.9843155095871686e-07, 'epochs': 114, 'loss': 'mae', 'optimizer': 'adam', 'graph_mode': 'off', 'use_snp_selection': False}. Best is trial 106 with value: 0.13225225587076325.
[I 2025-11-03 11:44:42,469] Trial 112 finished with value: 0.11844585939948524 and parameters: {'model_type': 'gcn', 'hidden_dims': '[128, 64]', 'dropout': 0.26354820661029893, 'batch_norm': True, 'lr': 0.0006632055705017317, 'weight_decay': 5.1710107969556835e-06, 'epochs': 66, 'loss': 'mae', 'optimizer': 'adam', 'graph_mode': 'off', 'use_snp_selection': False}. Best is trial 106 with value: 0.13225225587076325.
[I 2025-11-03 11:44:43,193] Trial 113 finished with value: 0.09829225825944433 and parameters: {'model_type': 'gcn', 'hidden_dims': '[128, 64]', 'dropout': 0.26406582738183904, 'batch_norm': True, 'lr': 0.0008614109692343047, 'weight_decay': 5.659159037200495e-06, 'epochs': 67, 'loss': 'mae', 'optimizer': 'adam', 'graph_mode': 'off', 'use_snp_selection': False}. Best is trial 106 with value: 0.13225225587076325.
[I 2025-11-03 11:44:43,860] Trial 114 finished with value: 0.11338263923450093 and parameters: {'model_type': 'gcn', 'hidden_dims': '[128, 64]', 'dropout': 0.30536033765923365, 'batch_norm': True, 'lr': 0.0005385000726284316, 'weight_decay': 4.845154861720022e-06, 'epochs': 49, 'loss': 'mae', 'optimizer': 'adam', 'graph_mode': 'off', 'use_snp_selection': False}. Best is trial 106 with value: 0.13225225587076325.
[I 2025-11-03 11:44:44,785] Trial 115 finished with value: 0.09106286190264096 and parameters: {'model_type': 'gcn', 'hidden_dims': '[128, 64]', 'dropout': 0.21724552559301855, 'batch_norm': True, 'lr': 0.000599772936872756, 'weight_decay': 9.786918723206844e-06, 'epochs': 140, 'loss': 'mae', 'optimizer': 'adam', 'graph_mode': 'off', 'use_snp_selection': False}. Best is trial 106 with value: 0.13225225587076325.
[I 2025-11-03 11:44:45,536] Trial 116 finished with value: 0.11710873284972186 and parameters: {'model_type': 'gcn', 'hidden_dims': '[128, 64]', 'dropout': 0.24434532557481448, 'batch_norm': True, 'lr': 0.0007527273586455362, 'weight_decay': 1.3545664818025269e-05, 'epochs': 76, 'loss': 'mae', 'optimizer': 'adam', 'graph_mode': 'off', 'use_snp_selection': False}. Best is trial 106 with value: 0.13225225587076325.
[I 2025-11-03 11:44:46,279] Trial 117 finished with value: 0.046162752108845455 and parameters: {'model_type': 'gcn', 'hidden_dims': '[128, 64]', 'dropout': 0.2478778700541887, 'batch_norm': True, 'lr': 2.4708101643798716e-05, 'weight_decay': 1.4085467097294898e-05, 'epochs': 79, 'loss': 'mse', 'optimizer': 'adam', 'graph_mode': 'off', 'use_snp_selection': False}. Best is trial 106 with value: 0.13225225587076325.
[I 2025-11-03 11:44:46,999] Trial 118 finished with value: 0.10861283962606214 and parameters: {'model_type': 'gcn', 'hidden_dims': '[128, 64]', 'dropout': 0.25594095854853793, 'batch_norm': True, 'lr': 0.0007434444267135515, 'weight_decay': 5.05345297970651e-05, 'epochs': 64, 'loss': 'mae', 'optimizer': 'adam', 'graph_mode': 'off', 'use_snp_selection': False}. Best is trial 106 with value: 0.13225225587076325.
[I 2025-11-03 11:44:47,678] Trial 119 finished with value: 0.05231515960185889 and parameters: {'model_type': 'gcn', 'hidden_dims': '[128, 64]', 'dropout': 0.2410798593416184, 'batch_norm': False, 'lr': 0.0008562918542460723, 'weight_decay': 2.0607639239242305e-07, 'epochs': 56, 'loss': 'mae', 'optimizer': 'adam', 'graph_mode': 'off', 'use_snp_selection': False}. Best is trial 106 with value: 0.13225225587076325.
[I 2025-11-03 11:44:49,614] Trial 120 finished with value: 0.07412171147068973 and parameters: {'model_type': 'gcn', 'hidden_dims': '[512, 64]', 'dropout': 0.23045223968153872, 'batch_norm': True, 'lr': 5.1638740084865e-05, 'weight_decay': 3.2991651927475224e-07, 'epochs': 270, 'loss': 'mae', 'optimizer': 'adam', 'graph_mode': 'off', 'use_snp_selection': False}. Best is trial 106 with value: 0.13225225587076325.
[I 2025-11-03 11:44:50,367] Trial 121 finished with value: 0.08458391257665024 and parameters: {'model_type': 'gcn', 'hidden_dims': '[128, 64]', 'dropout': 0.3452256155144252, 'batch_norm': True, 'lr': 0.00045381225952814024, 'weight_decay': 6.84785911721347e-06, 'epochs': 88, 'loss': 'mae', 'optimizer': 'adam', 'graph_mode': 'off', 'use_snp_selection': False}. Best is trial 106 with value: 0.13225225587076325.
[I 2025-11-03 11:44:51,109] Trial 122 finished with value: 0.09645490096934105 and parameters: {'model_type': 'gcn', 'hidden_dims': '[128, 64]', 'dropout': 0.2872195196282662, 'batch_norm': True, 'lr': 0.0007375584954001368, 'weight_decay': 3.6868812568583413e-06, 'epochs': 77, 'loss': 'mae', 'optimizer': 'adam', 'graph_mode': 'off', 'use_snp_selection': False}. Best is trial 106 with value: 0.13225225587076325.
[I 2025-11-03 11:44:51,969] Trial 123 finished with value: 0.12416806201775679 and parameters: {'model_type': 'gcn', 'hidden_dims': '[128, 64]', 'dropout': 0.274872866650399, 'batch_norm': True, 'lr': 0.0006181977278066571, 'weight_decay': 8.395889424009478e-06, 'epochs': 113, 'loss': 'mae', 'optimizer': 'adam', 'graph_mode': 'off', 'use_snp_selection': False}. Best is trial 106 with value: 0.13225225587076325.
[I 2025-11-03 11:44:52,801] Trial 124 finished with value: 0.10187293167007623 and parameters: {'model_type': 'gcn', 'hidden_dims': '[128, 64]', 'dropout': 0.27740858616763264, 'batch_norm': True, 'lr': 0.0006381086523283617, 'weight_decay': 1.2291192785681073e-05, 'epochs': 114, 'loss': 'mae', 'optimizer': 'adam', 'graph_mode': 'off', 'use_snp_selection': False}. Best is trial 106 with value: 0.13225225587076325.
[I 2025-11-03 11:44:53,661] Trial 125 finished with value: 0.126545839991802 and parameters: {'model_type': 'gcn', 'hidden_dims': '[128, 64]', 'dropout': 0.27093848044759816, 'batch_norm': True, 'lr': 0.0009881281566901298, 'weight_decay': 1.9845258752870422e-05, 'epochs': 128, 'loss': 'mae', 'optimizer': 'adam', 'graph_mode': 'off', 'use_snp_selection': False}. Best is trial 106 with value: 0.13225225587076325.
[I 2025-11-03 11:44:54,543] Trial 126 finished with value: 0.11185787428832025 and parameters: {'model_type': 'gcn', 'hidden_dims': '[128, 64]', 'dropout': 0.27089238355080725, 'batch_norm': True, 'lr': 0.0009522064688364114, 'weight_decay': 3.7004230325772174e-05, 'epochs': 131, 'loss': 'mae', 'optimizer': 'adam', 'graph_mode': 'off', 'use_snp_selection': False}. Best is trial 106 with value: 0.13225225587076325.
[I 2025-11-03 11:44:55,657] Trial 127 finished with value: 0.11594318469864404 and parameters: {'model_type': 'gcn', 'hidden_dims': '[256, 128]', 'dropout': 0.3306448791848789, 'batch_norm': True, 'lr': 0.0005573458214817225, 'weight_decay': 2.778421513269267e-05, 'epochs': 156, 'loss': 'mse', 'optimizer': 'adam', 'graph_mode': 'off', 'use_snp_selection': False}. Best is trial 106 with value: 0.13225225587076325.
[I 2025-11-03 11:44:57,603] Trial 128 finished with value: 0.10756692868506379 and parameters: {'model_type': 'gcn', 'hidden_dims': '[512, 256]', 'dropout': 0.572857249190661, 'batch_norm': True, 'lr': 0.0008323750125444864, 'weight_decay': 1.776691886246027e-05, 'epochs': 126, 'loss': 'mae', 'optimizer': 'adam', 'graph_mode': 'off', 'use_snp_selection': True, 'num_snps': 51726}. Best is trial 106 with value: 0.13225225587076325.
[I 2025-11-03 11:44:58,919] Trial 129 finished with value: 0.11119348151893813 and parameters: {'model_type': 'gcn', 'hidden_dims': '[512, 64]', 'dropout': 0.26053958896014834, 'batch_norm': True, 'lr': 0.0009956933336113228, 'weight_decay': 2.9124565912391193e-06, 'epochs': 121, 'loss': 'mae', 'optimizer': 'adam', 'graph_mode': 'off', 'use_snp_selection': False}. Best is trial 106 with value: 0.13225225587076325.
[I 2025-11-03 11:44:59,796] Trial 130 finished with value: 0.11761086338342995 and parameters: {'model_type': 'gcn', 'hidden_dims': '[128, 64]', 'dropout': 0.31303722666506617, 'batch_norm': True, 'lr': 0.0004979195122291762, 'weight_decay': 8.654071044595183e-07, 'epochs': 139, 'loss': 'mse', 'optimizer': 'adam', 'graph_mode': 'off', 'use_snp_selection': False}. Best is trial 106 with value: 0.13225225587076325.
[I 2025-11-03 11:45:00,731] Trial 131 finished with value: 0.09722669094886277 and parameters: {'model_type': 'gcn', 'hidden_dims': '[128, 64]', 'dropout': 0.358688733613807, 'batch_norm': True, 'lr': 0.0006285210874091733, 'weight_decay': 1.1443258782199478e-06, 'epochs': 144, 'loss': 'mse', 'optimizer': 'adam', 'graph_mode': 'off', 'use_snp_selection': False}. Best is trial 106 with value: 0.13225225587076325.
[I 2025-11-03 11:45:01,691] Trial 132 finished with value: 0.11038854748180643 and parameters: {'model_type': 'gcn', 'hidden_dims': '[128, 64]', 'dropout': 0.3121917675376392, 'batch_norm': True, 'lr': 0.0007000292733819844, 'weight_decay': 9.038016225538142e-07, 'epochs': 161, 'loss': 'mse', 'optimizer': 'adam', 'graph_mode': 'off', 'use_snp_selection': False}. Best is trial 106 with value: 0.13225225587076325.
[I 2025-11-03 11:45:02,538] Trial 133 finished with value: 0.13523747457617283 and parameters: {'model_type': 'gcn', 'hidden_dims': '[128, 64]', 'dropout': 0.2933371208207732, 'batch_norm': True, 'lr': 0.00048413508445654653, 'weight_decay': 6.963267414830271e-07, 'epochs': 113, 'loss': 'mse', 'optimizer': 'adam', 'graph_mode': 'off', 'use_snp_selection': False}. Best is trial 133 with value: 0.13523747457617283.
[I 2025-11-03 11:45:03,363] Trial 134 finished with value: 0.1067522448536639 and parameters: {'model_type': 'gcn', 'hidden_dims': '[128, 64]', 'dropout': 0.2928511203715243, 'batch_norm': True, 'lr': 0.00043755313928249686, 'weight_decay': 5.472876158291959e-07, 'epochs': 113, 'loss': 'mse', 'optimizer': 'adam', 'graph_mode': 'off', 'use_snp_selection': False}. Best is trial 133 with value: 0.13523747457617283.
[I 2025-11-03 11:45:04,216] Trial 135 finished with value: 0.09488508184324718 and parameters: {'model_type': 'gcn', 'hidden_dims': '[128, 64]', 'dropout': 0.31661418434547217, 'batch_norm': True, 'lr': 0.0004950823734519306, 'weight_decay': 8.575826914097026e-06, 'epochs': 128, 'loss': 'mse', 'optimizer': 'adam', 'graph_mode': 'off', 'use_snp_selection': False}. Best is trial 133 with value: 0.13523747457617283.
[I 2025-11-03 11:45:05,141] Trial 136 finished with value: 0.11015242740554193 and parameters: {'model_type': 'gcn', 'hidden_dims': '[128, 64]', 'dropout': 0.2830406676933905, 'batch_norm': True, 'lr': 0.0005227806479390756, 'weight_decay': 6.444636882864196e-07, 'epochs': 149, 'loss': 'mse', 'optimizer': 'adam', 'graph_mode': 'off', 'use_snp_selection': False}. Best is trial 133 with value: 0.13523747457617283.
[I 2025-11-03 11:45:06,032] Trial 137 finished with value: 0.10872630987271949 and parameters: {'model_type': 'gcn', 'hidden_dims': '[128, 64]', 'dropout': 0.29865624541627, 'batch_norm': True, 'lr': 0.00037109328136996993, 'weight_decay': 8.400927667829809e-07, 'epochs': 135, 'loss': 'mse', 'optimizer': 'adam', 'graph_mode': 'off', 'use_snp_selection': False}. Best is trial 133 with value: 0.13523747457617283.
[I 2025-11-03 11:45:06,863] Trial 138 finished with value: 0.10991496831576843 and parameters: {'model_type': 'gcn', 'hidden_dims': '[128, 64]', 'dropout': 0.15355527391199877, 'batch_norm': True, 'lr': 0.0006066760734255801, 'weight_decay': 4.028626054525435e-07, 'epochs': 103, 'loss': 'mse', 'optimizer': 'adam', 'graph_mode': 'off', 'use_snp_selection': False}. Best is trial 133 with value: 0.13523747457617283.
[I 2025-11-03 11:45:07,849] Trial 139 finished with value: 0.11783452975016538 and parameters: {'model_type': 'gcn', 'hidden_dims': '[256, 128]', 'dropout': 0.19937013046187704, 'batch_norm': True, 'lr': 0.0008153072634376937, 'weight_decay': 7.262743790596678e-07, 'epochs': 116, 'loss': 'mse', 'optimizer': 'adam', 'graph_mode': 'off', 'use_snp_selection': False}. Best is trial 133 with value: 0.13523747457617283.
[I 2025-11-03 11:45:08,880] Trial 140 finished with value: 0.017505903456433172 and parameters: {'model_type': 'gcn', 'hidden_dims': '[256, 128]', 'dropout': 0.1993120762657994, 'batch_norm': False, 'lr': 0.0008567284567734279, 'weight_decay': 2.769275510976944e-07, 'epochs': 119, 'loss': 'mse', 'optimizer': 'adam', 'graph_mode': 'off', 'use_snp_selection': False}. Best is trial 133 with value: 0.13523747457617283.
[I 2025-11-03 11:45:09,862] Trial 141 finished with value: 0.10709998121071324 and parameters: {'model_type': 'gcn', 'hidden_dims': '[256, 128]', 'dropout': 0.18112722099093545, 'batch_norm': True, 'lr': 0.0007063624160707322, 'weight_decay': 6.469874994020226e-07, 'epochs': 111, 'loss': 'mse', 'optimizer': 'adam', 'graph_mode': 'off', 'use_snp_selection': False}. Best is trial 133 with value: 0.13523747457617283.
[I 2025-11-03 11:45:10,805] Trial 142 finished with value: 0.1222560486940268 and parameters: {'model_type': 'gcn', 'hidden_dims': '[256, 128]', 'dropout': 0.27619565506423077, 'batch_norm': True, 'lr': 0.0007922298679799053, 'weight_decay': 1.0740147828369368e-06, 'epochs': 106, 'loss': 'mse', 'optimizer': 'adam', 'graph_mode': 'off', 'use_snp_selection': False}. Best is trial 133 with value: 0.13523747457617283.
[I 2025-11-03 11:45:11,787] Trial 143 finished with value: 0.11745148358671671 and parameters: {'model_type': 'gcn', 'hidden_dims': '[256, 128]', 'dropout': 0.2640521261824292, 'batch_norm': True, 'lr': 0.0008421077326591946, 'weight_decay': 1.457300417283933e-06, 'epochs': 99, 'loss': 'mse', 'optimizer': 'adam', 'graph_mode': 'off', 'use_snp_selection': False}. Best is trial 133 with value: 0.13523747457617283.
[I 2025-11-03 11:45:12,733] Trial 144 finished with value: 0.1044068405999409 and parameters: {'model_type': 'gcn', 'hidden_dims': '[256, 128]', 'dropout': 0.2735440931024798, 'batch_norm': True, 'lr': 0.0007615656600225715, 'weight_decay': 4.7640715061321056e-07, 'epochs': 106, 'loss': 'mse', 'optimizer': 'adam', 'graph_mode': 'off', 'use_snp_selection': False}. Best is trial 133 with value: 0.13523747457617283.
[I 2025-11-03 11:45:13,624] Trial 145 finished with value: 0.11498327898087342 and parameters: {'model_type': 'gcn', 'hidden_dims': '[256, 128]', 'dropout': 0.23100547746879863, 'batch_norm': True, 'lr': 0.0006043900224874572, 'weight_decay': 1.1801890350457926e-06, 'epochs': 92, 'loss': 'mse', 'optimizer': 'adam', 'graph_mode': 'off', 'use_snp_selection': False}. Best is trial 133 with value: 0.13523747457617283.
[I 2025-11-03 11:45:14,594] Trial 146 finished with value: 0.12087535013369817 and parameters: {'model_type': 'gcn', 'hidden_dims': '[256, 128]', 'dropout': 0.2171614098685043, 'batch_norm': True, 'lr': 0.0006814231824056583, 'weight_decay': 5.970174742814251e-06, 'epochs': 118, 'loss': 'mse', 'optimizer': 'adam', 'graph_mode': 'off', 'use_snp_selection': False}. Best is trial 133 with value: 0.13523747457617283.
[I 2025-11-03 11:45:15,534] Trial 147 finished with value: 0.1272884809433491 and parameters: {'model_type': 'gcn', 'hidden_dims': '[256, 128]', 'dropout': 0.2778135551262134, 'batch_norm': True, 'lr': 0.0006759310329746319, 'weight_decay': 4.417220626940854e-06, 'epochs': 106, 'loss': 'mse', 'optimizer': 'adam', 'graph_mode': 'off', 'use_snp_selection': False}. Best is trial 133 with value: 0.13523747457617283.
[I 2025-11-03 11:45:16,556] Trial 148 finished with value: 0.1072895489790675 and parameters: {'model_type': 'gcn', 'hidden_dims': '[256, 128]', 'dropout': 0.2158982712263397, 'batch_norm': True, 'lr': 0.0005607827706218441, 'weight_decay': 5.157881340607334e-06, 'epochs': 124, 'loss': 'mse', 'optimizer': 'adam', 'graph_mode': 'off', 'use_snp_selection': False}. Best is trial 133 with value: 0.13523747457617283.
[I 2025-11-03 11:45:17,451] Trial 149 finished with value: 0.11838306283844749 and parameters: {'model_type': 'gcn', 'hidden_dims': '[256, 128]', 'dropout': 0.23585294658101488, 'batch_norm': True, 'lr': 0.0006737871831647264, 'weight_decay': 4.326275781050684e-06, 'epochs': 84, 'loss': 'mse', 'optimizer': 'adam', 'graph_mode': 'off', 'use_snp_selection': False}. Best is trial 133 with value: 0.13523747457617283.
[I 2025-11-03 11:45:19,574] Trial 0 finished with value: 0.028832552375141023 and parameters: {'model_type': 'gcn', 'hidden_dims': '[128, 64]', 'dropout': 0.199031432379812, 'batch_norm': True, 'lr': 1.8408544111075837e-06, 'weight_decay': 5.5136510071208614e-05, 'epochs': 336, 'loss': 'mae', 'optimizer': 'adam', 'graph_mode': 'off', 'use_snp_selection': True, 'num_snps': 43862}. Best is trial 0 with value: 0.028832552375141023.
[I 2025-11-03 11:45:21,177] Trial 1 finished with value: 0.04482776810705045 and parameters: {'model_type': 'gcn', 'hidden_dims': '[256, 128]', 'dropout': 0.4370668075331726, 'batch_norm': True, 'lr': 7.133471581159139e-05, 'weight_decay': 1.128633586803549e-05, 'epochs': 242, 'loss': 'mae', 'optimizer': 'adam', 'graph_mode': 'off', 'use_snp_selection': False}. Best is trial 1 with value: 0.04482776810705045.
[I 2025-11-03 11:45:22,315] Trial 2 finished with value: 0.05181563861721407 and parameters: {'model_type': 'gcn', 'hidden_dims': '[256, 128, 64]', 'dropout': 0.41314357415569625, 'batch_norm': False, 'lr': 3.952233718592101e-06, 'weight_decay': 0.00026754769258252603, 'epochs': 149, 'loss': 'mse', 'optimizer': 'adam', 'graph_mode': 'off', 'use_snp_selection': True, 'num_snps': 11571}. Best is trial 2 with value: 0.05181563861721407.
[I 2025-11-03 11:45:24,981] Trial 3 finished with value: -0.0037281306002773054 and parameters: {'model_type': 'gcn', 'hidden_dims': '[512, 64]', 'dropout': 0.5938127374509361, 'batch_norm': False, 'lr': 5.67704586114731e-06, 'weight_decay': 2.4518087630137052e-05, 'epochs': 320, 'loss': 'mae', 'optimizer': 'adam', 'graph_mode': 'off', 'use_snp_selection': False}. Best is trial 2 with value: 0.05181563861721407.
[I 2025-11-03 11:45:27,433] Trial 4 finished with value: 0.009421919655311568 and parameters: {'model_type': 'gcn', 'hidden_dims': '[512, 128]', 'dropout': 0.25746343592134413, 'batch_norm': True, 'lr': 1.3467657668402788e-06, 'weight_decay': 0.00033087251918647806, 'epochs': 277, 'loss': 'mse', 'optimizer': 'adam', 'graph_mode': 'off', 'use_snp_selection': True, 'num_snps': 36675}. Best is trial 2 with value: 0.05181563861721407.
[I 2025-11-03 11:45:29,138] Trial 5 finished with value: 0.019531342584469376 and parameters: {'model_type': 'gcn', 'hidden_dims': '[512, 64]', 'dropout': 0.38275350994408375, 'batch_norm': True, 'lr': 1.5586664309232824e-06, 'weight_decay': 0.0008227664668621182, 'epochs': 145, 'loss': 'mae', 'optimizer': 'adam', 'graph_mode': 'off', 'use_snp_selection': True, 'num_snps': 32148}. Best is trial 2 with value: 0.05181563861721407.
