[I 2025-11-03 13:24:58,463] Trial 102 finished with value: 0.04513554619054467 and parameters: {'model_type': 'gcn', 'hidden_dims': '[512, 256]', 'dropout': 0.1944798047868981, 'batch_norm': True, 'lr': 0.0002235845849164469, 'weight_decay': 2.3454039862896931e-07, 'epochs': 308, 'loss': 'mse', 'optimizer': 'adam', 'graph_mode': 'off', 'use_snp_selection': False}. Best is trial 39 with value: 0.0977451340706182.
[I 2025-11-03 13:25:00,377] Trial 103 finished with value: 0.03385767737406363 and parameters: {'model_type': 'gcn', 'hidden_dims': '[512, 128]', 'dropout': 0.16625832820569555, 'batch_norm': True, 'lr': 0.000274998265394978, 'weight_decay': 1.3173072193216744e-05, 'epochs': 214, 'loss': 'mse', 'optimizer': 'adam', 'graph_mode': 'off', 'use_snp_selection': False}. Best is trial 39 with value: 0.0977451340706182.
[I 2025-11-03 13:25:01,127] Trial 104 finished with value: 0.06157314510885893 and parameters: {'model_type': 'gcn', 'hidden_dims': '[128, 64]', 'dropout': 0.2481256259107952, 'batch_norm': True, 'lr': 3.5841004117394235e-05, 'weight_decay': 0.00011371338902963011, 'epochs': 101, 'loss': 'mse', 'optimizer': 'adam', 'graph_mode': 'off', 'use_snp_selection': False}. Best is trial 39 with value: 0.0977451340706182.
[I 2025-11-03 13:25:01,931] Trial 105 finished with value: 0.04043624566295956 and parameters: {'model_type': 'gcn', 'hidden_dims': '[128, 64]', 'dropout': 0.23950977812948138, 'batch_norm': True, 'lr': 3.3946453118155786e-05, 'weight_decay': 0.0001322033865748319, 'epochs': 102, 'loss': 'mse', 'optimizer': 'adam', 'graph_mode': 'off', 'use_snp_selection': False}. Best is trial 39 with value: 0.0977451340706182.
[I 2025-11-03 13:25:02,656] Trial 106 finished with value: 0.03650005130918796 and parameters: {'model_type': 'gcn', 'hidden_dims': '[128, 64]', 'dropout': 0.17869315013836073, 'batch_norm': True, 'lr': 4.146001283618166e-05, 'weight_decay': 3.945913994719518e-05, 'epochs': 92, 'loss': 'mse', 'optimizer': 'adam', 'graph_mode': 'off', 'use_snp_selection': False}. Best is trial 39 with value: 0.0977451340706182.
[I 2025-11-03 13:25:03,933] Trial 107 finished with value: 0.022189615406082924 and parameters: {'model_type': 'gcn', 'hidden_dims': '[128, 64]', 'dropout': 0.12881115027088857, 'batch_norm': True, 'lr': 0.00019104343119318975, 'weight_decay': 9.883738869861248e-05, 'epochs': 108, 'loss': 'mse', 'optimizer': 'adam', 'graph_mode': 'off', 'use_snp_selection': True, 'num_snps': 37972}. Best is trial 39 with value: 0.0977451340706182.
[I 2025-11-03 13:25:04,943] Trial 108 finished with value: 0.01966242362590585 and parameters: {'model_type': 'gcn', 'hidden_dims': '[128, 64]', 'dropout': 0.5324523026078596, 'batch_norm': True, 'lr': 4.655260565219536e-05, 'weight_decay': 6.951354191781307e-05, 'epochs': 198, 'loss': 'mae', 'optimizer': 'adam', 'graph_mode': 'off', 'use_snp_selection': False}. Best is trial 39 with value: 0.0977451340706182.
[I 2025-11-03 13:25:06,209] Trial 109 finished with value: 0.0339155371730865 and parameters: {'model_type': 'gcn', 'hidden_dims': '[128, 64]', 'dropout': 0.25012148965305064, 'batch_norm': True, 'lr': 0.00042456403484601664, 'weight_decay': 4.66489084676236e-05, 'epochs': 285, 'loss': 'mse', 'optimizer': 'adam', 'graph_mode': 'off', 'use_snp_selection': False}. Best is trial 39 with value: 0.0977451340706182.
[I 2025-11-03 13:25:06,998] Trial 110 finished with value: 0.010222827542079073 and parameters: {'model_type': 'gcn', 'hidden_dims': '[256, 128]', 'dropout': 0.10024333851058427, 'batch_norm': True, 'lr': 0.00015143584558770048, 'weight_decay': 0.00018027165824684846, 'epochs': 64, 'loss': 'mae', 'optimizer': 'adam', 'graph_mode': 'off', 'use_snp_selection': False}. Best is trial 39 with value: 0.0977451340706182.
[I 2025-11-03 13:25:08,404] Trial 111 finished with value: 0.022327608707056096 and parameters: {'model_type': 'gcn', 'hidden_dims': '[512, 128]', 'dropout': 0.18627781912035948, 'batch_norm': True, 'lr': 5.9961039722129825e-05, 'weight_decay': 0.00011301784490181063, 'epochs': 124, 'loss': 'mse', 'optimizer': 'adam', 'graph_mode': 'off', 'use_snp_selection': False}. Best is trial 39 with value: 0.0977451340706182.
[I 2025-11-03 13:25:10,689] Trial 112 finished with value: 0.03157870817917188 and parameters: {'model_type': 'gcn', 'hidden_dims': '[512, 128]', 'dropout': 0.20572524032558492, 'batch_norm': True, 'lr': 0.00010278518622938372, 'weight_decay': 0.00035632226999612106, 'epochs': 292, 'loss': 'mse', 'optimizer': 'adam', 'graph_mode': 'off', 'use_snp_selection': False}. Best is trial 39 with value: 0.0977451340706182.
[I 2025-11-03 13:25:11,825] Trial 113 finished with value: 0.026802082392720212 and parameters: {'model_type': 'gcn', 'hidden_dims': '[512, 128]', 'dropout': 0.21807482147473323, 'batch_norm': True, 'lr': 3.1736938359154175e-05, 'weight_decay': 2.6587039285121388e-05, 'epochs': 80, 'loss': 'mse', 'optimizer': 'adam', 'graph_mode': 'off', 'use_snp_selection': False}. Best is trial 39 with value: 0.0977451340706182.
[I 2025-11-03 13:25:14,181] Trial 114 finished with value: 0.03294070597082325 and parameters: {'model_type': 'gcn', 'hidden_dims': '[512, 256]', 'dropout': 0.1589915894187433, 'batch_norm': True, 'lr': 7.600789306881948e-05, 'weight_decay': 1.316575884574822e-07, 'epochs': 304, 'loss': 'mse', 'optimizer': 'adam', 'graph_mode': 'off', 'use_snp_selection': False}. Best is trial 39 with value: 0.0977451340706182.
[I 2025-11-03 13:25:16,625] Trial 115 finished with value: 0.0439899255395487 and parameters: {'model_type': 'gcn', 'hidden_dims': '[512, 128]', 'dropout': 0.1973710190943839, 'batch_norm': True, 'lr': 5.217968806018576e-05, 'weight_decay': 0.00027682183025159226, 'epochs': 326, 'loss': 'mse', 'optimizer': 'adam', 'graph_mode': 'off', 'use_snp_selection': False}. Best is trial 39 with value: 0.0977451340706182.
[I 2025-11-03 13:25:18,061] Trial 116 finished with value: 0.005844339171234182 and parameters: {'model_type': 'gcn', 'hidden_dims': '[512, 128]', 'dropout': 0.12007988514725478, 'batch_norm': False, 'lr': 2.4943628384337086e-05, 'weight_decay': 1.8376042680620912e-07, 'epochs': 144, 'loss': 'mse', 'optimizer': 'adam', 'graph_mode': 'off', 'use_snp_selection': False}. Best is trial 39 with value: 0.0977451340706182.
[I 2025-11-03 13:25:20,088] Trial 117 finished with value: 0.04116549659681909 and parameters: {'model_type': 'gcn', 'hidden_dims': '[256, 128, 64]', 'dropout': 0.17212265975818178, 'batch_norm': True, 'lr': 1.4123865783020141e-05, 'weight_decay': 3.6213131819700074e-07, 'epochs': 313, 'loss': 'mae', 'optimizer': 'adam', 'graph_mode': 'off', 'use_snp_selection': False}. Best is trial 39 with value: 0.0977451340706182.
[I 2025-11-03 13:25:20,874] Trial 118 finished with value: 0.030813679827836536 and parameters: {'model_type': 'gcn', 'hidden_dims': '[128, 64]', 'dropout': 0.14296538850362883, 'batch_norm': True, 'lr': 3.7678278748544924e-05, 'weight_decay': 5.173196242980922e-06, 'epochs': 114, 'loss': 'mse', 'optimizer': 'adam', 'graph_mode': 'off', 'use_snp_selection': False}. Best is trial 39 with value: 0.0977451340706182.
[I 2025-11-03 13:25:23,206] Trial 119 finished with value: 0.03205212934699517 and parameters: {'model_type': 'gcn', 'hidden_dims': '[512, 128]', 'dropout': 0.22569096913868214, 'batch_norm': True, 'lr': 0.00031804877220636263, 'weight_decay': 6.308559808785826e-07, 'epochs': 298, 'loss': 'mse', 'optimizer': 'adam', 'graph_mode': 'off', 'use_snp_selection': False}. Best is trial 39 with value: 0.0977451340706182.
[I 2025-11-03 13:25:25,715] Trial 120 finished with value: 0.017750981022229936 and parameters: {'model_type': 'gcn', 'hidden_dims': '[512, 128]', 'dropout': 0.2087299199359873, 'batch_norm': True, 'lr': 1.3211652970170723e-06, 'weight_decay': 2.6571324301562185e-07, 'epochs': 335, 'loss': 'mae', 'optimizer': 'adam', 'graph_mode': 'off', 'use_snp_selection': False}. Best is trial 39 with value: 0.0977451340706182.
[I 2025-11-03 13:25:27,499] Trial 121 finished with value: 0.0389114631074359 and parameters: {'model_type': 'gcn', 'hidden_dims': '[512, 128]', 'dropout': 0.178481781120381, 'batch_norm': True, 'lr': 0.00012494820346777854, 'weight_decay': 1.56098667729874e-07, 'epochs': 201, 'loss': 'mse', 'optimizer': 'adam', 'graph_mode': 'off', 'use_snp_selection': False}. Best is trial 39 with value: 0.0977451340706182.
[I 2025-11-03 13:25:29,741] Trial 122 finished with value: 0.02786185815617643 and parameters: {'model_type': 'gcn', 'hidden_dims': '[512, 128]', 'dropout': 0.15343899077518097, 'batch_norm': True, 'lr': 0.00022812174625224473, 'weight_decay': 1.8864447440209057e-07, 'epochs': 274, 'loss': 'mse', 'optimizer': 'adam', 'graph_mode': 'off', 'use_snp_selection': False}. Best is trial 39 with value: 0.0977451340706182.
[I 2025-11-03 13:25:31,325] Trial 123 finished with value: 0.035678197248225775 and parameters: {'model_type': 'gcn', 'hidden_dims': '[512, 128]', 'dropout': 0.1876632046133321, 'batch_norm': True, 'lr': 0.00014861576228699267, 'weight_decay': 3.1770987263721994e-07, 'epochs': 158, 'loss': 'mse', 'optimizer': 'adam', 'graph_mode': 'off', 'use_snp_selection': False}. Best is trial 39 with value: 0.0977451340706182.
[I 2025-11-03 13:25:33,048] Trial 124 finished with value: 0.04178053104003991 and parameters: {'model_type': 'gcn', 'hidden_dims': '[512, 128]', 'dropout': 0.1678549338347316, 'batch_norm': True, 'lr': 0.00019919251661684365, 'weight_decay': 1.3582007721665514e-07, 'epochs': 186, 'loss': 'mse', 'optimizer': 'adam', 'graph_mode': 'off', 'use_snp_selection': False}. Best is trial 39 with value: 0.0977451340706182.
[I 2025-11-03 13:25:34,146] Trial 125 finished with value: 0.05050013157796297 and parameters: {'model_type': 'gcn', 'hidden_dims': '[512, 128]', 'dropout': 0.13843450724770615, 'batch_norm': True, 'lr': 0.0002612648038588993, 'weight_decay': 1.683472651434463e-07, 'epochs': 176, 'loss': 'mse', 'optimizer': 'adam', 'graph_mode': 'off', 'use_snp_selection': True, 'num_snps': 12134}. Best is trial 39 with value: 0.0977451340706182.
[I 2025-11-03 13:25:35,210] Trial 126 finished with value: 0.05594086281208577 and parameters: {'model_type': 'gcn', 'hidden_dims': '[512, 64]', 'dropout': 0.13004327334232121, 'batch_norm': True, 'lr': 0.00025583279545515503, 'weight_decay': 2.1458774552103976e-07, 'epochs': 176, 'loss': 'mse', 'optimizer': 'adam', 'graph_mode': 'off', 'use_snp_selection': True, 'num_snps': 12046}. Best is trial 39 with value: 0.0977451340706182.
[I 2025-11-03 13:25:36,290] Trial 127 finished with value: 0.06755930947719671 and parameters: {'model_type': 'gcn', 'hidden_dims': '[512, 64]', 'dropout': 0.13144692132795818, 'batch_norm': True, 'lr': 0.0002735600906143321, 'weight_decay': 4.5662237367640954e-07, 'epochs': 176, 'loss': 'mse', 'optimizer': 'adam', 'graph_mode': 'off', 'use_snp_selection': True, 'num_snps': 12255}. Best is trial 39 with value: 0.0977451340706182.
[I 2025-11-03 13:25:37,359] Trial 128 finished with value: 0.05416210982639185 and parameters: {'model_type': 'gcn', 'hidden_dims': '[512, 64]', 'dropout': 0.1274564586287295, 'batch_norm': True, 'lr': 0.0006060381147669476, 'weight_decay': 5.146446185554687e-07, 'epochs': 175, 'loss': 'mse', 'optimizer': 'adam', 'graph_mode': 'off', 'use_snp_selection': True, 'num_snps': 11875}. Best is trial 39 with value: 0.0977451340706182.
[I 2025-11-03 13:25:38,450] Trial 129 finished with value: 0.047885652534537984 and parameters: {'model_type': 'gcn', 'hidden_dims': '[512, 64]', 'dropout': 0.12637929250078622, 'batch_norm': True, 'lr': 0.000558577792095364, 'weight_decay': 4.719556243285969e-07, 'epochs': 192, 'loss': 'mse', 'optimizer': 'adam', 'graph_mode': 'off', 'use_snp_selection': True, 'num_snps': 11491}. Best is trial 39 with value: 0.0977451340706182.
[I 2025-11-03 13:25:39,640] Trial 130 finished with value: -0.01952873081756797 and parameters: {'model_type': 'gcn', 'hidden_dims': '[512, 64]', 'dropout': 0.11068705083566732, 'batch_norm': True, 'lr': 6.223501827703859e-06, 'weight_decay': 6.981352412797427e-07, 'epochs': 165, 'loss': 'mse', 'optimizer': 'adam', 'graph_mode': 'off', 'use_snp_selection': True, 'num_snps': 17501}. Best is trial 39 with value: 0.0977451340706182.
[I 2025-11-03 13:25:40,680] Trial 131 finished with value: 0.03797410099740515 and parameters: {'model_type': 'gcn', 'hidden_dims': '[512, 256]', 'dropout': 0.13338345853218933, 'batch_norm': True, 'lr': 0.0004498090894875331, 'weight_decay': 4.367344738348277e-07, 'epochs': 176, 'loss': 'mse', 'optimizer': 'adam', 'graph_mode': 'off', 'use_snp_selection': True, 'num_snps': 10707}. Best is trial 39 with value: 0.0977451340706182.
[I 2025-11-03 13:25:41,678] Trial 132 finished with value: 0.05308164803106279 and parameters: {'model_type': 'gcn', 'hidden_dims': '[512, 64]', 'dropout': 0.14221230160074488, 'batch_norm': True, 'lr': 0.0007728771430208628, 'weight_decay': 2.2387644821512675e-07, 'epochs': 168, 'loss': 'mse', 'optimizer': 'adam', 'graph_mode': 'off', 'use_snp_selection': True, 'num_snps': 9788}. Best is trial 39 with value: 0.0977451340706182.
[I 2025-11-03 13:25:42,700] Trial 133 finished with value: 0.03531856291675581 and parameters: {'model_type': 'gcn', 'hidden_dims': '[512, 64]', 'dropout': 0.11986006641028132, 'batch_norm': True, 'lr': 0.0006880271956436481, 'weight_decay': 2.3363696398588133e-07, 'epochs': 207, 'loss': 'mse', 'optimizer': 'adam', 'graph_mode': 'off', 'use_snp_selection': True, 'num_snps': 7113}. Best is trial 39 with value: 0.0977451340706182.
[I 2025-11-03 13:25:44,150] Trial 134 finished with value: 0.0497433993452482 and parameters: {'model_type': 'gcn', 'hidden_dims': '[512, 64]', 'dropout': 0.14998205866857328, 'batch_norm': True, 'lr': 0.0007179091050165358, 'weight_decay': 3.350669558543456e-07, 'epochs': 171, 'loss': 'mse', 'optimizer': 'adam', 'graph_mode': 'off', 'use_snp_selection': True, 'num_snps': 25066}. Best is trial 39 with value: 0.0977451340706182.
[I 2025-11-03 13:25:45,346] Trial 135 finished with value: 0.05957957998890075 and parameters: {'model_type': 'gcn', 'hidden_dims': '[512, 64]', 'dropout': 0.12640193407072162, 'batch_norm': True, 'lr': 0.0009337642039521453, 'weight_decay': 8.971666812674997e-07, 'epochs': 167, 'loss': 'mse', 'optimizer': 'adam', 'graph_mode': 'off', 'use_snp_selection': True, 'num_snps': 16138}. Best is trial 39 with value: 0.0977451340706182.
[I 2025-11-03 13:25:46,501] Trial 136 finished with value: 0.05307574214949875 and parameters: {'model_type': 'gcn', 'hidden_dims': '[512, 64]', 'dropout': 0.10704680658190156, 'batch_norm': True, 'lr': 0.0008946977740963248, 'weight_decay': 1.1477835737785311e-06, 'epochs': 157, 'loss': 'mse', 'optimizer': 'adam', 'graph_mode': 'off', 'use_snp_selection': True, 'num_snps': 16863}. Best is trial 39 with value: 0.0977451340706182.
[I 2025-11-03 13:25:47,667] Trial 137 finished with value: 0.05708995142918713 and parameters: {'model_type': 'gcn', 'hidden_dims': '[512, 64]', 'dropout': 0.10523099128084434, 'batch_norm': True, 'lr': 0.0008495911135491966, 'weight_decay': 9.8027560133148e-07, 'epochs': 165, 'loss': 'mse', 'optimizer': 'adam', 'graph_mode': 'off', 'use_snp_selection': True, 'num_snps': 16153}. Best is trial 39 with value: 0.0977451340706182.
[I 2025-11-03 13:25:48,765] Trial 138 finished with value: 0.013266316411734045 and parameters: {'model_type': 'gcn', 'hidden_dims': '[512, 64]', 'dropout': 0.11966505500109825, 'batch_norm': False, 'lr': 0.0008679796453024992, 'weight_decay': 8.890053693241738e-07, 'epochs': 166, 'loss': 'mse', 'optimizer': 'adam', 'graph_mode': 'off', 'use_snp_selection': True, 'num_snps': 14508}. Best is trial 39 with value: 0.0977451340706182.
[I 2025-11-03 13:25:49,639] Trial 139 finished with value: 0.04293847731582666 and parameters: {'model_type': 'gcn', 'hidden_dims': '[512, 64]', 'dropout': 0.13314214516130446, 'batch_norm': True, 'lr': 0.0005963177617835753, 'weight_decay': 5.815686475354854e-07, 'epochs': 146, 'loss': 'mse', 'optimizer': 'adam', 'graph_mode': 'off', 'use_snp_selection': True, 'num_snps': 7231}. Best is trial 39 with value: 0.0977451340706182.
[I 2025-11-03 13:25:50,573] Trial 140 finished with value: 0.044971280819032435 and parameters: {'model_type': 'gcn', 'hidden_dims': '[512, 64]', 'dropout': 0.10098696409195024, 'batch_norm': True, 'lr': 0.000798572252651365, 'weight_decay': 2.852664168442276e-06, 'epochs': 165, 'loss': 'mse', 'optimizer': 'adam', 'graph_mode': 'off', 'use_snp_selection': True, 'num_snps': 8052}. Best is trial 39 with value: 0.0977451340706182.
[I 2025-11-03 13:25:51,706] Trial 141 finished with value: 0.04699758881417784 and parameters: {'model_type': 'gcn', 'hidden_dims': '[512, 64]', 'dropout': 0.11138935664343977, 'batch_norm': True, 'lr': 0.0008093877672630196, 'weight_decay': 1.1400023888228007e-06, 'epochs': 153, 'loss': 'mse', 'optimizer': 'adam', 'graph_mode': 'off', 'use_snp_selection': True, 'num_snps': 15941}. Best is trial 39 with value: 0.0977451340706182.
[I 2025-11-03 13:25:53,025] Trial 142 finished with value: 0.043331199831433964 and parameters: {'model_type': 'gcn', 'hidden_dims': '[512, 64]', 'dropout': 0.1274504129516793, 'batch_norm': True, 'lr': 0.0009288402615342763, 'weight_decay': 7.318939435992118e-07, 'epochs': 159, 'loss': 'mse', 'optimizer': 'adam', 'graph_mode': 'off', 'use_snp_selection': True, 'num_snps': 21997}. Best is trial 39 with value: 0.0977451340706182.
[I 2025-11-03 13:25:54,210] Trial 143 finished with value: 0.049752431851708655 and parameters: {'model_type': 'gcn', 'hidden_dims': '[512, 64]', 'dropout': 0.11031180613033316, 'batch_norm': True, 'lr': 0.0009966576574295144, 'weight_decay': 9.859789838688217e-07, 'epochs': 177, 'loss': 'mse', 'optimizer': 'adam', 'graph_mode': 'off', 'use_snp_selection': True, 'num_snps': 15102}. Best is trial 39 with value: 0.0977451340706182.
[I 2025-11-03 13:25:55,392] Trial 144 finished with value: 0.044783013300917045 and parameters: {'model_type': 'gcn', 'hidden_dims': '[512, 64]', 'dropout': 0.1411563548276042, 'batch_norm': True, 'lr': 0.0006288724435217852, 'weight_decay': 1.8379038855803343e-06, 'epochs': 189, 'loss': 'mse', 'optimizer': 'adam', 'graph_mode': 'off', 'use_snp_selection': True, 'num_snps': 14268}. Best is trial 39 with value: 0.0977451340706182.
[I 2025-11-03 13:25:56,269] Trial 145 finished with value: 0.04525794906998589 and parameters: {'model_type': 'gcn', 'hidden_dims': '[512, 64]', 'dropout': 0.11696830146647255, 'batch_norm': True, 'lr': 0.0008032412974976894, 'weight_decay': 1.538743349780592e-06, 'epochs': 140, 'loss': 'mse', 'optimizer': 'adam', 'graph_mode': 'off', 'use_snp_selection': True, 'num_snps': 8056}. Best is trial 39 with value: 0.0977451340706182.
[I 2025-11-03 13:25:57,475] Trial 146 finished with value: 0.048166224861593304 and parameters: {'model_type': 'gcn', 'hidden_dims': '[512, 64]', 'dropout': 0.1033639579322589, 'batch_norm': True, 'lr': 0.0007208113340728485, 'weight_decay': 0.0006296799517770411, 'epochs': 168, 'loss': 'mse', 'optimizer': 'adam', 'graph_mode': 'off', 'use_snp_selection': True, 'num_snps': 17623}. Best is trial 39 with value: 0.0977451340706182.
[I 2025-11-03 13:25:58,425] Trial 147 finished with value: 0.06406880193688629 and parameters: {'model_type': 'gcn', 'hidden_dims': '[512, 64]', 'dropout': 0.1303047589293922, 'batch_norm': True, 'lr': 0.0005564531329689635, 'weight_decay': 4.843493214412489e-07, 'epochs': 132, 'loss': 'mse', 'optimizer': 'adam', 'graph_mode': 'off', 'use_snp_selection': True, 'num_snps': 10930}. Best is trial 39 with value: 0.0977451340706182.
[I 2025-11-03 13:25:59,281] Trial 148 finished with value: 0.045830868239582996 and parameters: {'model_type': 'gcn', 'hidden_dims': '[512, 64]', 'dropout': 0.12786175598253288, 'batch_norm': True, 'lr': 0.0005193437408731584, 'weight_decay': 5.050717769126808e-07, 'epochs': 100, 'loss': 'mse', 'optimizer': 'adam', 'graph_mode': 'off', 'use_snp_selection': True, 'num_snps': 10705}. Best is trial 39 with value: 0.0977451340706182.
[I 2025-11-03 13:26:00,251] Trial 149 finished with value: 0.0356437379952817 and parameters: {'model_type': 'gcn', 'hidden_dims': '[512, 64]', 'dropout': 0.15865514428368932, 'batch_norm': True, 'lr': 0.0005275013471995736, 'weight_decay': 3.7852663547794243e-07, 'epochs': 130, 'loss': 'mse', 'optimizer': 'adam', 'graph_mode': 'off', 'use_snp_selection': True, 'num_snps': 11803}. Best is trial 39 with value: 0.0977451340706182.
[I 2025-11-03 13:26:02,526] Trial 0 finished with value: 0.014403654766906079 and parameters: {'model_type': 'gcn', 'hidden_dims': '[128, 64]', 'dropout': 0.199031432379812, 'batch_norm': True, 'lr': 1.8408544111075837e-06, 'weight_decay': 5.5136510071208614e-05, 'epochs': 336, 'loss': 'mae', 'optimizer': 'adam', 'graph_mode': 'off', 'use_snp_selection': True, 'num_snps': 43862}. Best is trial 0 with value: 0.014403654766906079.
[I 2025-11-03 13:26:04,302] Trial 1 finished with value: 0.06604946229440718 and parameters: {'model_type': 'gcn', 'hidden_dims': '[256, 128]', 'dropout': 0.4370668075331726, 'batch_norm': True, 'lr': 7.133471581159139e-05, 'weight_decay': 1.128633586803549e-05, 'epochs': 242, 'loss': 'mae', 'optimizer': 'adam', 'graph_mode': 'off', 'use_snp_selection': False}. Best is trial 1 with value: 0.06604946229440718.
[I 2025-11-03 13:26:05,430] Trial 2 finished with value: 0.001691902066848429 and parameters: {'model_type': 'gcn', 'hidden_dims': '[256, 128, 64]', 'dropout': 0.41314357415569625, 'batch_norm': False, 'lr': 3.952233718592101e-06, 'weight_decay': 0.00026754769258252603, 'epochs': 149, 'loss': 'mse', 'optimizer': 'adam', 'graph_mode': 'off', 'use_snp_selection': True, 'num_snps': 11571}. Best is trial 1 with value: 0.06604946229440718.
