[I 2025-11-03 12:12:31,166] Trial 30 finished with value: 0.010915451735041052 and parameters: {'model_type': 'gcn', 'hidden_dims': '[256, 128]', 'dropout': 0.1643682238690179, 'batch_norm': False, 'lr': 1.0339225946830233e-05, 'weight_decay': 7.683914821415082e-07, 'epochs': 228, 'loss': 'mae', 'optimizer': 'adam', 'graph_mode': 'off', 'use_snp_selection': False}. Best is trial 12 with value: 0.039788226820136205.
[I 2025-11-03 12:12:32,491] Trial 31 finished with value: -0.02626007631104438 and parameters: {'model_type': 'gcn', 'hidden_dims': '[256, 128]', 'dropout': 0.41261245150718195, 'batch_norm': False, 'lr': 4.2522633584324475e-05, 'weight_decay': 1.7073604884911177e-07, 'epochs': 201, 'loss': 'mae', 'optimizer': 'adam', 'graph_mode': 'off', 'use_snp_selection': False}. Best is trial 12 with value: 0.039788226820136205.
[I 2025-11-03 12:12:33,824] Trial 32 finished with value: 0.014403000384990483 and parameters: {'model_type': 'gcn', 'hidden_dims': '[256, 128]', 'dropout': 0.3546024310455933, 'batch_norm': False, 'lr': 0.00010827073378247882, 'weight_decay': 3.936231786863736e-07, 'epochs': 195, 'loss': 'mse', 'optimizer': 'adam', 'graph_mode': 'off', 'use_snp_selection': False}. Best is trial 12 with value: 0.039788226820136205.
[I 2025-11-03 12:12:34,992] Trial 33 finished with value: 0.032666718144140454 and parameters: {'model_type': 'gcn', 'hidden_dims': '[256, 128]', 'dropout': 0.4100702675647726, 'batch_norm': False, 'lr': 2.4401191894516552e-05, 'weight_decay': 6.848748155858186e-06, 'epochs': 154, 'loss': 'mae', 'optimizer': 'adam', 'graph_mode': 'off', 'use_snp_selection': False}. Best is trial 12 with value: 0.039788226820136205.
[I 2025-11-03 12:12:36,174] Trial 34 finished with value: 0.005195493139338917 and parameters: {'model_type': 'gcn', 'hidden_dims': '[256, 128]', 'dropout': 0.4776495763450488, 'batch_norm': False, 'lr': 2.4279813457946536e-05, 'weight_decay': 7.385153269115355e-05, 'epochs': 158, 'loss': 'mae', 'optimizer': 'adam', 'graph_mode': 'off', 'use_snp_selection': False}. Best is trial 12 with value: 0.039788226820136205.
[I 2025-11-03 12:12:37,314] Trial 35 finished with value: 0.05154567449331511 and parameters: {'model_type': 'gcn', 'hidden_dims': '[256, 128]', 'dropout': 0.4331507458812598, 'batch_norm': True, 'lr': 5.29116271088938e-06, 'weight_decay': 5.5611408744304315e-06, 'epochs': 137, 'loss': 'mae', 'optimizer': 'adam', 'graph_mode': 'off', 'use_snp_selection': False}. Best is trial 35 with value: 0.05154567449331511.
[I 2025-11-03 12:12:39,856] Trial 36 finished with value: -0.011635610538031372 and parameters: {'model_type': 'gcn', 'hidden_dims': '[512, 64]', 'dropout': 0.4328210212931869, 'batch_norm': True, 'lr': 2.2595649246158207e-06, 'weight_decay': 7.443363712316607e-06, 'epochs': 136, 'loss': 'mae', 'optimizer': 'adam', 'graph_mode': 'off', 'use_snp_selection': True, 'num_snps': 58661}. Best is trial 35 with value: 0.05154567449331511.
[I 2025-11-03 12:12:40,976] Trial 37 finished with value: 0.034023150884598376 and parameters: {'model_type': 'gcn', 'hidden_dims': '[256, 128, 64]', 'dropout': 0.5277801701804928, 'batch_norm': True, 'lr': 4.446294938689988e-06, 'weight_decay': 0.00011714621414526843, 'epochs': 112, 'loss': 'mae', 'optimizer': 'adam', 'graph_mode': 'off', 'use_snp_selection': False}. Best is trial 35 with value: 0.05154567449331511.
[I 2025-11-03 12:12:42,216] Trial 38 finished with value: -0.009345720828979285 and parameters: {'model_type': 'gcn', 'hidden_dims': '[256, 128, 64]', 'dropout': 0.574982269382311, 'batch_norm': True, 'lr': 5.479727655195994e-06, 'weight_decay': 0.00015042032696389946, 'epochs': 118, 'loss': 'mae', 'optimizer': 'adam', 'graph_mode': 'off', 'use_snp_selection': True, 'num_snps': 19911}. Best is trial 35 with value: 0.05154567449331511.
[I 2025-11-03 12:12:43,258] Trial 39 finished with value: -0.008044686376767009 and parameters: {'model_type': 'gcn', 'hidden_dims': '[256, 128, 64]', 'dropout': 0.5415211974699046, 'batch_norm': True, 'lr': 1.044125195433188e-06, 'weight_decay': 0.000810873219345378, 'epochs': 84, 'loss': 'mae', 'optimizer': 'adam', 'graph_mode': 'off', 'use_snp_selection': False}. Best is trial 35 with value: 0.05154567449331511.
[I 2025-11-03 12:12:44,153] Trial 40 finished with value: 0.006747895871177957 and parameters: {'model_type': 'gcn', 'hidden_dims': '[256, 128, 64]', 'dropout': 0.4669664468229205, 'batch_norm': True, 'lr': 4.767147905519569e-06, 'weight_decay': 3.2088058286289845e-05, 'epochs': 56, 'loss': 'mae', 'optimizer': 'adam', 'graph_mode': 'off', 'use_snp_selection': False}. Best is trial 35 with value: 0.05154567449331511.
[I 2025-11-03 12:12:45,856] Trial 41 finished with value: -0.008380861016069033 and parameters: {'model_type': 'gcn', 'hidden_dims': '[512, 128]', 'dropout': 0.41093125020629806, 'batch_norm': True, 'lr': 9.412544721166806e-06, 'weight_decay': 9.244373617874809e-06, 'epochs': 148, 'loss': 'mae', 'optimizer': 'adam', 'graph_mode': 'off', 'use_snp_selection': False}. Best is trial 35 with value: 0.05154567449331511.
[I 2025-11-03 12:12:48,089] Trial 42 finished with value: 0.02939286456993879 and parameters: {'model_type': 'gcn', 'hidden_dims': '[256, 128, 64]', 'dropout': 0.5020101299787818, 'batch_norm': True, 'lr': 2.24362866767316e-06, 'weight_decay': 2.2798130658926892e-05, 'epochs': 348, 'loss': 'mae', 'optimizer': 'adam', 'graph_mode': 'off', 'use_snp_selection': False}. Best is trial 35 with value: 0.05154567449331511.
[I 2025-11-03 12:12:49,852] Trial 43 finished with value: 0.010158573576156594 and parameters: {'model_type': 'gcn', 'hidden_dims': '[512, 64]', 'dropout': 0.5893660105800396, 'batch_norm': True, 'lr': 1.6434517013363835e-05, 'weight_decay': 0.00021933857766843218, 'epochs': 163, 'loss': 'mae', 'optimizer': 'adam', 'graph_mode': 'off', 'use_snp_selection': False}. Best is trial 35 with value: 0.05154567449331511.
[I 2025-11-03 12:12:50,905] Trial 44 finished with value: 0.024325155928538622 and parameters: {'model_type': 'gcn', 'hidden_dims': '[256, 128]', 'dropout': 0.434667890072213, 'batch_norm': True, 'lr': 6.8673360998003395e-06, 'weight_decay': 1.484336804295631e-05, 'epochs': 120, 'loss': 'mae', 'optimizer': 'adam', 'graph_mode': 'off', 'use_snp_selection': False}. Best is trial 35 with value: 0.05154567449331511.
[I 2025-11-03 12:12:52,243] Trial 45 finished with value: -0.0018062974555021248 and parameters: {'model_type': 'gcn', 'hidden_dims': '[512, 256]', 'dropout': 0.5272767096738504, 'batch_norm': True, 'lr': 1.1648401653985481e-05, 'weight_decay': 6.460174595275075e-06, 'epochs': 92, 'loss': 'mae', 'optimizer': 'adam', 'graph_mode': 'off', 'use_snp_selection': False}. Best is trial 35 with value: 0.05154567449331511.
[I 2025-11-03 12:12:53,397] Trial 46 finished with value: 0.0366448062336736 and parameters: {'model_type': 'gcn', 'hidden_dims': '[256, 128]', 'dropout': 0.3927111930251725, 'batch_norm': True, 'lr': 3.540978949140874e-06, 'weight_decay': 0.0004407929220893423, 'epochs': 140, 'loss': 'mae', 'optimizer': 'adam', 'graph_mode': 'off', 'use_snp_selection': False}. Best is trial 35 with value: 0.05154567449331511.
[I 2025-11-03 12:12:54,284] Trial 47 finished with value: -0.017986350970106594 and parameters: {'model_type': 'gcn', 'hidden_dims': '[256, 128]', 'dropout': 0.3335874298125896, 'batch_norm': True, 'lr': 4.26039969493931e-06, 'weight_decay': 0.0003721290278501021, 'epochs': 69, 'loss': 'mae', 'optimizer': 'adam', 'graph_mode': 'off', 'use_snp_selection': False}. Best is trial 35 with value: 0.05154567449331511.
[I 2025-11-03 12:12:55,701] Trial 48 finished with value: -0.009625554613194141 and parameters: {'model_type': 'gcn', 'hidden_dims': '[512, 128]', 'dropout': 0.5521720591464829, 'batch_norm': True, 'lr': 1.662163733823808e-06, 'weight_decay': 0.0005854586903354729, 'epochs': 106, 'loss': 'mae', 'optimizer': 'adam', 'graph_mode': 'off', 'use_snp_selection': False}. Best is trial 35 with value: 0.05154567449331511.
[I 2025-11-03 12:12:57,700] Trial 49 finished with value: 0.006813987584830536 and parameters: {'model_type': 'gcn', 'hidden_dims': '[256, 128, 64]', 'dropout': 0.2288801684288535, 'batch_norm': True, 'lr': 3.2073294098486987e-06, 'weight_decay': 0.00048166741928025556, 'epochs': 141, 'loss': 'mae', 'optimizer': 'adam', 'graph_mode': 'off', 'use_snp_selection': True, 'num_snps': 46888}. Best is trial 35 with value: 0.05154567449331511.
[I 2025-11-03 12:12:58,705] Trial 50 finished with value: -0.0019926177792857266 and parameters: {'model_type': 'gcn', 'hidden_dims': '[128, 64]', 'dropout': 0.3955191611754464, 'batch_norm': True, 'lr': 2.3408129555602456e-06, 'weight_decay': 0.00013219735126318582, 'epochs': 171, 'loss': 'mae', 'optimizer': 'adam', 'graph_mode': 'off', 'use_snp_selection': False}. Best is trial 35 with value: 0.05154567449331511.
[I 2025-11-03 12:12:59,833] Trial 51 finished with value: 0.025135381458380665 and parameters: {'model_type': 'gcn', 'hidden_dims': '[256, 128]', 'dropout': 0.4527757619261326, 'batch_norm': True, 'lr': 2.568241533315043e-05, 'weight_decay': 3.374312344635363e-05, 'epochs': 132, 'loss': 'mae', 'optimizer': 'adam', 'graph_mode': 'off', 'use_snp_selection': False}. Best is trial 35 with value: 0.05154567449331511.
[I 2025-11-03 12:13:00,908] Trial 52 finished with value: -0.008986347585005126 and parameters: {'model_type': 'gcn', 'hidden_dims': '[256, 128]', 'dropout': 0.3567963336214473, 'batch_norm': True, 'lr': 1.4026794299711463e-05, 'weight_decay': 0.00010866770165163314, 'epochs': 122, 'loss': 'mae', 'optimizer': 'adam', 'graph_mode': 'off', 'use_snp_selection': False}. Best is trial 35 with value: 0.05154567449331511.
[I 2025-11-03 12:13:01,905] Trial 53 finished with value: 0.004175303524002797 and parameters: {'model_type': 'gcn', 'hidden_dims': '[256, 128]', 'dropout': 0.38645927025691257, 'batch_norm': True, 'lr': 5.856699489175072e-06, 'weight_decay': 0.00028163707134216514, 'epochs': 107, 'loss': 'mae', 'optimizer': 'adam', 'graph_mode': 'off', 'use_snp_selection': False}. Best is trial 35 with value: 0.05154567449331511.
[I 2025-11-03 12:13:03,062] Trial 54 finished with value: -0.025397609309466353 and parameters: {'model_type': 'gcn', 'hidden_dims': '[256, 128]', 'dropout': 0.42419642317017314, 'batch_norm': True, 'lr': 8.477320526993121e-06, 'weight_decay': 2.3527425390269557e-06, 'epochs': 147, 'loss': 'mae', 'optimizer': 'adam', 'graph_mode': 'off', 'use_snp_selection': False}. Best is trial 35 with value: 0.05154567449331511.
[I 2025-11-03 12:13:04,318] Trial 55 finished with value: -0.00606742002264946 and parameters: {'model_type': 'gcn', 'hidden_dims': '[256, 128]', 'dropout': 0.26456800408072, 'batch_norm': True, 'lr': 5.534669027468148e-05, 'weight_decay': 5.450137112881713e-06, 'epochs': 168, 'loss': 'mae', 'optimizer': 'adam', 'graph_mode': 'off', 'use_snp_selection': False}. Best is trial 35 with value: 0.05154567449331511.
[I 2025-11-03 12:13:05,627] Trial 56 finished with value: -0.016432553575983035 and parameters: {'model_type': 'gcn', 'hidden_dims': '[256, 128]', 'dropout': 0.44997963999738655, 'batch_norm': False, 'lr': 3.940368653872884e-06, 'weight_decay': 1.319177056645612e-05, 'epochs': 191, 'loss': 'mae', 'optimizer': 'adam', 'graph_mode': 'off', 'use_snp_selection': False}. Best is trial 35 with value: 0.05154567449331511.
[I 2025-11-03 12:13:07,770] Trial 57 finished with value: 0.02525967799396879 and parameters: {'model_type': 'gcn', 'hidden_dims': '[512, 64]', 'dropout': 0.4994936438428427, 'batch_norm': False, 'lr': 1.89259846085052e-05, 'weight_decay': 0.00020851633819199636, 'epochs': 237, 'loss': 'mae', 'optimizer': 'adam', 'graph_mode': 'off', 'use_snp_selection': False}. Best is trial 35 with value: 0.05154567449331511.
[I 2025-11-03 12:13:09,149] Trial 58 finished with value: 0.019296878924233526 and parameters: {'model_type': 'gcn', 'hidden_dims': '[256, 128]', 'dropout': 0.40228275019692983, 'batch_norm': False, 'lr': 6.851299718951671e-05, 'weight_decay': 2.709079247690117e-06, 'epochs': 216, 'loss': 'mse', 'optimizer': 'adam', 'graph_mode': 'off', 'use_snp_selection': False}. Best is trial 35 with value: 0.05154567449331511.
[I 2025-11-03 12:13:11,018] Trial 59 finished with value: -0.005745977315535655 and parameters: {'model_type': 'gcn', 'hidden_dims': '[512, 256]', 'dropout': 0.3139448673444339, 'batch_norm': True, 'lr': 1.2694031293441729e-06, 'weight_decay': 1.479816792513569e-07, 'epochs': 183, 'loss': 'mae', 'optimizer': 'adam', 'graph_mode': 'off', 'use_snp_selection': False}. Best is trial 35 with value: 0.05154567449331511.
[I 2025-11-03 12:13:12,558] Trial 60 finished with value: 0.023698177112700246 and parameters: {'model_type': 'gcn', 'hidden_dims': '[256, 128]', 'dropout': 0.4794512490811169, 'batch_norm': False, 'lr': 5.28412523342023e-06, 'weight_decay': 1.0307784875966531e-06, 'epochs': 257, 'loss': 'mae', 'optimizer': 'adam', 'graph_mode': 'off', 'use_snp_selection': False}. Best is trial 35 with value: 0.05154567449331511.
[I 2025-11-03 12:13:14,752] Trial 61 finished with value: -0.008543457226133956 and parameters: {'model_type': 'gcn', 'hidden_dims': '[256, 128, 64]', 'dropout': 0.50835026715394, 'batch_norm': True, 'lr': 2.4483786047741496e-06, 'weight_decay': 2.318646747574942e-05, 'epochs': 334, 'loss': 'mae', 'optimizer': 'adam', 'graph_mode': 'off', 'use_snp_selection': False}. Best is trial 35 with value: 0.05154567449331511.
[I 2025-11-03 12:13:16,817] Trial 62 finished with value: -0.0033120976829897225 and parameters: {'model_type': 'gcn', 'hidden_dims': '[256, 128, 64]', 'dropout': 0.3701918166434072, 'batch_norm': True, 'lr': 4.002046302949639e-06, 'weight_decay': 6.217742825409996e-05, 'epochs': 309, 'loss': 'mae', 'optimizer': 'adam', 'graph_mode': 'off', 'use_snp_selection': False}. Best is trial 35 with value: 0.05154567449331511.
[I 2025-11-03 12:13:18,044] Trial 63 finished with value: 0.03240903640738126 and parameters: {'model_type': 'gcn', 'hidden_dims': '[256, 128, 64]', 'dropout': 0.2869704093911296, 'batch_norm': True, 'lr': 2.951658311128236e-05, 'weight_decay': 9.29342675330194e-05, 'epochs': 129, 'loss': 'mae', 'optimizer': 'adam', 'graph_mode': 'off', 'use_snp_selection': False}. Best is trial 35 with value: 0.05154567449331511.
[I 2025-11-03 12:13:19,268] Trial 64 finished with value: -0.03518000317117488 and parameters: {'model_type': 'gcn', 'hidden_dims': '[256, 128, 64]', 'dropout': 0.28182280173133356, 'batch_norm': True, 'lr': 2.8689697924807268e-05, 'weight_decay': 0.0009279263215781444, 'epochs': 126, 'loss': 'mae', 'optimizer': 'adam', 'graph_mode': 'off', 'use_snp_selection': False}. Best is trial 35 with value: 0.05154567449331511.
[I 2025-11-03 12:13:20,334] Trial 65 finished with value: -0.018755195566838877 and parameters: {'model_type': 'gcn', 'hidden_dims': '[256, 128, 64]', 'dropout': 0.3397062636832867, 'batch_norm': False, 'lr': 3.053012747449804e-05, 'weight_decay': 8.318372806638381e-05, 'epochs': 97, 'loss': 'mae', 'optimizer': 'adam', 'graph_mode': 'off', 'use_snp_selection': False}. Best is trial 35 with value: 0.05154567449331511.
[I 2025-11-03 12:13:21,602] Trial 66 finished with value: -0.015454786652371587 and parameters: {'model_type': 'gcn', 'hidden_dims': '[256, 128]', 'dropout': 0.23774747881987926, 'batch_norm': True, 'lr': 1.8819658623296127e-05, 'weight_decay': 0.00018089845863383013, 'epochs': 156, 'loss': 'mse', 'optimizer': 'adam', 'graph_mode': 'off', 'use_snp_selection': True, 'num_snps': 22881}. Best is trial 35 with value: 0.05154567449331511.
[I 2025-11-03 12:13:22,702] Trial 67 finished with value: 0.026956376659368286 and parameters: {'model_type': 'gcn', 'hidden_dims': '[256, 128]', 'dropout': 0.30525252707998835, 'batch_norm': False, 'lr': 4.196507383245992e-05, 'weight_decay': 3.84735971191163e-05, 'epochs': 140, 'loss': 'mae', 'optimizer': 'adam', 'graph_mode': 'off', 'use_snp_selection': False}. Best is trial 35 with value: 0.05154567449331511.
[I 2025-11-03 12:13:23,567] Trial 68 finished with value: 0.00860313114599682 and parameters: {'model_type': 'gcn', 'hidden_dims': '[128, 64]', 'dropout': 0.2813565622970031, 'batch_norm': True, 'lr': 7.222385400266983e-06, 'weight_decay': 1.1089162387767241e-05, 'epochs': 131, 'loss': 'mae', 'optimizer': 'adam', 'graph_mode': 'off', 'use_snp_selection': False}. Best is trial 35 with value: 0.05154567449331511.
[I 2025-11-03 12:13:24,956] Trial 69 finished with value: 0.033686132464258806 and parameters: {'model_type': 'gcn', 'hidden_dims': '[512, 128]', 'dropout': 0.3556676590163346, 'batch_norm': False, 'lr': 1.19780989111993e-05, 'weight_decay': 2.5053332998073e-07, 'epochs': 111, 'loss': 'mae', 'optimizer': 'adam', 'graph_mode': 'off', 'use_snp_selection': False}. Best is trial 35 with value: 0.05154567449331511.
[I 2025-11-03 12:13:27,047] Trial 70 finished with value: -0.02790591055549007 and parameters: {'model_type': 'gcn', 'hidden_dims': '[512, 128]', 'dropout': 0.3573087368708956, 'batch_norm': False, 'lr': 1.1108130479313448e-05, 'weight_decay': 2.932058872613513e-07, 'epochs': 226, 'loss': 'mae', 'optimizer': 'adam', 'graph_mode': 'off', 'use_snp_selection': False}. Best is trial 35 with value: 0.05154567449331511.
[I 2025-11-03 12:13:28,437] Trial 71 finished with value: -0.02151229425222927 and parameters: {'model_type': 'gcn', 'hidden_dims': '[512, 128]', 'dropout': 0.2929540931792382, 'batch_norm': False, 'lr': 1.3390672705288986e-05, 'weight_decay': 3.886575341073641e-07, 'epochs': 110, 'loss': 'mae', 'optimizer': 'adam', 'graph_mode': 'off', 'use_snp_selection': False}. Best is trial 35 with value: 0.05154567449331511.
[I 2025-11-03 12:13:29,851] Trial 72 finished with value: -0.011901979014391925 and parameters: {'model_type': 'gcn', 'hidden_dims': '[512, 128]', 'dropout': 0.3280566686126266, 'batch_norm': False, 'lr': 1.9916969173352053e-05, 'weight_decay': 1.4971922231954117e-07, 'epochs': 115, 'loss': 'mae', 'optimizer': 'adam', 'graph_mode': 'off', 'use_snp_selection': False}. Best is trial 35 with value: 0.05154567449331511.
[I 2025-11-03 12:13:31,200] Trial 73 finished with value: 0.03099840389625668 and parameters: {'model_type': 'gcn', 'hidden_dims': '[512, 128]', 'dropout': 0.2562653535132806, 'batch_norm': False, 'lr': 6.168424843842908e-06, 'weight_decay': 9.542187101763734e-05, 'epochs': 99, 'loss': 'mae', 'optimizer': 'adam', 'graph_mode': 'off', 'use_snp_selection': False}. Best is trial 35 with value: 0.05154567449331511.
[I 2025-11-03 12:13:32,353] Trial 74 finished with value: 0.017341381220573018 and parameters: {'model_type': 'gcn', 'hidden_dims': '[256, 128]', 'dropout': 0.2159469229740715, 'batch_norm': False, 'lr': 3.4796154665606586e-05, 'weight_decay': 1.2106095699398525e-06, 'epochs': 152, 'loss': 'mae', 'optimizer': 'adam', 'graph_mode': 'off', 'use_snp_selection': False}. Best is trial 35 with value: 0.05154567449331511.
[I 2025-11-03 12:13:33,872] Trial 75 finished with value: 0.003836543736458272 and parameters: {'model_type': 'gcn', 'hidden_dims': '[256, 128, 64]', 'dropout': 0.37076538057082364, 'batch_norm': False, 'lr': 8.36634306355731e-06, 'weight_decay': 2.299965455249282e-07, 'epochs': 210, 'loss': 'mae', 'optimizer': 'adam', 'graph_mode': 'off', 'use_snp_selection': False}. Best is trial 35 with value: 0.05154567449331511.
[I 2025-11-03 12:13:34,525] Trial 76 finished with value: -0.0019491423270514092 and parameters: {'model_type': 'gcn', 'hidden_dims': '[256, 128]', 'dropout': 0.3431667895795463, 'batch_norm': False, 'lr': 5.027908489426199e-05, 'weight_decay': 4.1942943464973965e-05, 'epochs': 74, 'loss': 'mae', 'optimizer': 'adam', 'graph_mode': 'off', 'use_snp_selection': True, 'num_snps': 3325}. Best is trial 35 with value: 0.05154567449331511.
[I 2025-11-03 12:13:35,784] Trial 77 finished with value: -0.01169106635371401 and parameters: {'model_type': 'gcn', 'hidden_dims': '[512, 256]', 'dropout': 0.38407702458001064, 'batch_norm': True, 'lr': 9.860728460335299e-06, 'weight_decay': 4.996597279209572e-06, 'epochs': 89, 'loss': 'mae', 'optimizer': 'adam', 'graph_mode': 'off', 'use_snp_selection': False}. Best is trial 35 with value: 0.05154567449331511.
[I 2025-11-03 12:13:37,673] Trial 78 finished with value: 0.02617691402310074 and parameters: {'model_type': 'gcn', 'hidden_dims': '[512, 128]', 'dropout': 0.42044088770546434, 'batch_norm': False, 'lr': 1.4960712825904491e-05, 'weight_decay': 5.970423629800827e-07, 'epochs': 204, 'loss': 'mse', 'optimizer': 'adam', 'graph_mode': 'off', 'use_snp_selection': False}. Best is trial 35 with value: 0.05154567449331511.
[I 2025-11-03 12:13:39,254] Trial 79 finished with value: 0.029622998743965075 and parameters: {'model_type': 'gcn', 'hidden_dims': '[512, 64]', 'dropout': 0.2705220069130349, 'batch_norm': True, 'lr': 2.1477851705163733e-05, 'weight_decay': 1.218940335028613e-07, 'epochs': 138, 'loss': 'mae', 'optimizer': 'adam', 'graph_mode': 'off', 'use_snp_selection': False}. Best is trial 35 with value: 0.05154567449331511.
[I 2025-11-03 12:13:40,624] Trial 80 finished with value: -0.0016350900552525027 and parameters: {'model_type': 'gcn', 'hidden_dims': '[256, 128, 64]', 'dropout': 0.3151938014976709, 'batch_norm': False, 'lr': 8.482865730390097e-05, 'weight_decay': 2.013006143791106e-07, 'epochs': 178, 'loss': 'mae', 'optimizer': 'adam', 'graph_mode': 'off', 'use_snp_selection': False}. Best is trial 35 with value: 0.05154567449331511.
[I 2025-11-03 12:13:41,920] Trial 81 finished with value: 0.032302620195606396 and parameters: {'model_type': 'gcn', 'hidden_dims': '[512, 128]', 'dropout': 0.18477357392075755, 'batch_norm': False, 'lr': 6.112126678045659e-06, 'weight_decay': 8.816861195157166e-05, 'epochs': 102, 'loss': 'mae', 'optimizer': 'adam', 'graph_mode': 'off', 'use_snp_selection': False}. Best is trial 35 with value: 0.05154567449331511.
