[I 2025-11-03 12:53:26,211] Trial 102 finished with value: 0.10861749791087255 and parameters: {'model_type': 'graphsage', 'hidden_dims': '[128, 64]', 'dropout': 0.3825421250845427, 'batch_norm': False, 'lr': 0.00025745609679803707, 'weight_decay': 4.701206712840543e-06, 'epochs': 146, 'loss': 'mae', 'optimizer': 'adam', 'graph_mode': 'cutoff', 'cutoff': 0.8507378437167064, 'grm_norm': 'cosine', 'self_loops': True, 'use_snp_selection': True, 'num_snps': 57632}. Best is trial 83 with value: 0.130537436953886.
[I 2025-11-03 12:53:29,627] Trial 103 finished with value: 0.1189991374570593 and parameters: {'model_type': 'graphsage', 'hidden_dims': '[128, 64]', 'dropout': 0.36255286936687303, 'batch_norm': False, 'lr': 4.546661150450551e-05, 'weight_decay': 2.6996646583202047e-07, 'epochs': 209, 'loss': 'mae', 'optimizer': 'adam', 'graph_mode': 'cutoff', 'cutoff': 0.6594346109720568, 'grm_norm': 'cosine_then_gcn', 'self_loops': True, 'use_snp_selection': True, 'num_snps': 43121}. Best is trial 83 with value: 0.130537436953886.
[I 2025-11-03 12:53:32,864] Trial 104 finished with value: -0.009255199140357719 and parameters: {'model_type': 'graphsage', 'hidden_dims': '[128, 64]', 'dropout': 0.15166576405992427, 'batch_norm': False, 'lr': 0.00035352009451104435, 'weight_decay': 8.288306016771467e-06, 'epochs': 48, 'loss': 'mae', 'optimizer': 'adam', 'graph_mode': 'knn', 'source': 'grm', 'knn_k': 4, 'weighted_edges': True, 'symmetrize_mode': 'mutual', 'use_snp_selection': True, 'num_snps': 51343}. Best is trial 83 with value: 0.130537436953886.
[I 2025-11-03 12:53:36,196] Trial 105 finished with value: 0.10496360102612085 and parameters: {'model_type': 'graphsage', 'hidden_dims': '[128, 64]', 'dropout': 0.3524352976846913, 'batch_norm': True, 'lr': 0.0002839143711165056, 'weight_decay': 1.3015508147543468e-06, 'epochs': 77, 'loss': 'mae', 'optimizer': 'adam', 'graph_mode': 'cutoff', 'cutoff': 0.7158467317744496, 'grm_norm': 'cosine', 'self_loops': False, 'use_snp_selection': True, 'num_snps': 53570}. Best is trial 83 with value: 0.130537436953886.
[I 2025-11-03 12:53:39,611] Trial 106 finished with value: 0.08561167681103367 and parameters: {'model_type': 'graphsage', 'hidden_dims': '[128, 64]', 'dropout': 0.4738669983310503, 'batch_norm': False, 'lr': 0.00017087087942615272, 'weight_decay': 3.860232812466419e-06, 'epochs': 118, 'loss': 'mae', 'optimizer': 'adam', 'graph_mode': 'knn', 'source': 'grm', 'knn_k': 5, 'weighted_edges': True, 'symmetrize_mode': 'mutual', 'use_snp_selection': True, 'num_snps': 47656}. Best is trial 83 with value: 0.130537436953886.
[I 2025-11-03 12:53:43,652] Trial 107 finished with value: 0.10807663131654975 and parameters: {'model_type': 'graphsage', 'hidden_dims': '[256, 128]', 'dropout': 0.10010993828933565, 'batch_norm': True, 'lr': 6.811625719411455e-05, 'weight_decay': 5.861488884327184e-05, 'epochs': 127, 'loss': 'mae', 'optimizer': 'adam', 'graph_mode': 'cutoff', 'cutoff': 0.6207472727365555, 'grm_norm': 'none', 'self_loops': True, 'use_snp_selection': True, 'num_snps': 55309}. Best is trial 83 with value: 0.130537436953886.
[I 2025-11-03 12:53:49,309] Trial 108 finished with value: 0.0017307746556449687 and parameters: {'model_type': 'graphsage', 'hidden_dims': '[512, 128]', 'dropout': 0.3894137022380697, 'batch_norm': False, 'lr': 0.00047166951038273756, 'weight_decay': 1.9519864289577536e-05, 'epochs': 161, 'loss': 'mse', 'optimizer': 'adam', 'graph_mode': 'knn', 'source': 'grm', 'knn_k': 1, 'weighted_edges': False, 'symmetrize_mode': 'union', 'use_snp_selection': True, 'num_snps': 56929}. Best is trial 83 with value: 0.130537436953886.
[I 2025-11-03 12:53:51,244] Trial 109 finished with value: 0.09670072966032316 and parameters: {'model_type': 'graphsage', 'hidden_dims': '[128, 64]', 'dropout': 0.33909699414677785, 'batch_norm': True, 'lr': 9.84604844264522e-05, 'weight_decay': 3.820594887869576e-05, 'epochs': 183, 'loss': 'mae', 'optimizer': 'adam', 'graph_mode': 'cutoff', 'cutoff': 0.7828659734150877, 'grm_norm': 'cosine_then_gcn', 'self_loops': False, 'use_snp_selection': False}. Best is trial 83 with value: 0.130537436953886.
[I 2025-11-03 12:53:54,553] Trial 110 finished with value: 0.07979503727338035 and parameters: {'model_type': 'graphsage', 'hidden_dims': '[128, 64]', 'dropout': 0.11477417748814314, 'batch_norm': True, 'lr': 2.0336099639498227e-05, 'weight_decay': 3.9728434506529e-07, 'epochs': 169, 'loss': 'mae', 'optimizer': 'adam', 'graph_mode': 'knn', 'source': 'grm', 'knn_k': 6, 'weighted_edges': True, 'symmetrize_mode': 'mutual', 'use_snp_selection': True, 'num_snps': 40485}. Best is trial 83 with value: 0.130537436953886.
[I 2025-11-03 12:53:59,772] Trial 111 finished with value: 0.11357710054362798 and parameters: {'model_type': 'graphsage', 'hidden_dims': '[256, 128]', 'dropout': 0.27248248619395354, 'batch_norm': True, 'lr': 0.0006156704893721335, 'weight_decay': 3.4437714945487898e-06, 'epochs': 338, 'loss': 'mae', 'optimizer': 'adam', 'graph_mode': 'knn', 'source': 'grm', 'knn_k': 7, 'weighted_edges': True, 'symmetrize_mode': 'mutual', 'use_snp_selection': True, 'num_snps': 46225}. Best is trial 83 with value: 0.130537436953886.
[I 2025-11-03 12:54:04,513] Trial 112 finished with value: 0.11166947442560447 and parameters: {'model_type': 'graphsage', 'hidden_dims': '[512, 64]', 'dropout': 0.326379910446897, 'batch_norm': True, 'lr': 0.0005178964474381345, 'weight_decay': 5.39305550481956e-06, 'epochs': 139, 'loss': 'mae', 'optimizer': 'adam', 'graph_mode': 'knn', 'source': 'grm', 'knn_k': 7, 'weighted_edges': True, 'symmetrize_mode': 'mutual', 'use_snp_selection': True, 'num_snps': 44878}. Best is trial 83 with value: 0.130537436953886.
[I 2025-11-03 12:54:08,927] Trial 113 finished with value: 0.11391409841289331 and parameters: {'model_type': 'graphsage', 'hidden_dims': '[128, 64]', 'dropout': 0.347154298513375, 'batch_norm': True, 'lr': 0.00020976969312753505, 'weight_decay': 1.7714353511705544e-06, 'epochs': 312, 'loss': 'mae', 'optimizer': 'adam', 'graph_mode': 'knn', 'source': 'grm', 'knn_k': 7, 'weighted_edges': True, 'symmetrize_mode': 'mutual', 'use_snp_selection': True, 'num_snps': 48977}. Best is trial 83 with value: 0.130537436953886.
[I 2025-11-03 12:54:15,812] Trial 114 finished with value: 0.11104305516161475 and parameters: {'model_type': 'graphsage', 'hidden_dims': '[512, 64]', 'dropout': 0.2915589314142732, 'batch_norm': True, 'lr': 3.7536604814419685e-05, 'weight_decay': 2.4043996320015735e-06, 'epochs': 317, 'loss': 'mae', 'optimizer': 'adam', 'graph_mode': 'knn', 'source': 'grm', 'knn_k': 4, 'weighted_edges': True, 'symmetrize_mode': 'mutual', 'use_snp_selection': True, 'num_snps': 50543}. Best is trial 83 with value: 0.130537436953886.
[I 2025-11-03 12:54:24,205] Trial 115 finished with value: 0.12654462500774974 and parameters: {'model_type': 'graphsage', 'hidden_dims': '[512, 256]', 'dropout': 0.3091069198110975, 'batch_norm': True, 'lr': 0.00040143486453976133, 'weight_decay': 3.1765577908139307e-06, 'epochs': 330, 'loss': 'mae', 'optimizer': 'adam', 'graph_mode': 'knn', 'source': 'grm', 'knn_k': 8, 'weighted_edges': True, 'symmetrize_mode': 'mutual', 'use_snp_selection': True, 'num_snps': 59081}. Best is trial 83 with value: 0.130537436953886.
[I 2025-11-03 12:54:32,139] Trial 116 finished with value: 0.11016903713795902 and parameters: {'model_type': 'graphsage', 'hidden_dims': '[512, 256]', 'dropout': 0.25506903103405565, 'batch_norm': True, 'lr': 0.00038140520341977557, 'weight_decay': 6.994987708327208e-06, 'epochs': 301, 'loss': 'mae', 'optimizer': 'adam', 'graph_mode': 'knn', 'source': 'grm', 'knn_k': 8, 'weighted_edges': True, 'symmetrize_mode': 'mutual', 'use_snp_selection': True, 'num_snps': 59081}. Best is trial 83 with value: 0.130537436953886.
[I 2025-11-03 12:54:40,014] Trial 117 finished with value: 0.05471030861373332 and parameters: {'model_type': 'graphsage', 'hidden_dims': '[512, 256]', 'dropout': 0.3245820052343621, 'batch_norm': False, 'lr': 3.1002243789093586e-06, 'weight_decay': 3.086981185721851e-06, 'epochs': 330, 'loss': 'mae', 'optimizer': 'adam', 'graph_mode': 'cutoff', 'cutoff': 0.4631510457593229, 'grm_norm': 'gcn', 'self_loops': False, 'use_snp_selection': True, 'num_snps': 58565}. Best is trial 83 with value: 0.130537436953886.
[I 2025-11-03 12:54:42,417] Trial 118 finished with value: 0.09560681172028568 and parameters: {'model_type': 'graphsage', 'hidden_dims': '[512, 256]', 'dropout': 0.3086667338214623, 'batch_norm': True, 'lr': 0.00029536565180618413, 'weight_decay': 1.5574890793380312e-07, 'epochs': 259, 'loss': 'mse', 'optimizer': 'adam', 'graph_mode': 'knn', 'source': 'grm', 'knn_k': 9, 'weighted_edges': True, 'symmetrize_mode': 'mutual', 'use_snp_selection': True, 'num_snps': 2011}. Best is trial 83 with value: 0.130537436953886.
[I 2025-11-03 12:54:49,815] Trial 119 finished with value: 0.09228820840901691 and parameters: {'model_type': 'graphsage', 'hidden_dims': '[512, 256]', 'dropout': 0.3614427590789488, 'batch_norm': False, 'lr': 0.00012135405465533313, 'weight_decay': 1.0456336187918136e-06, 'epochs': 347, 'loss': 'mae', 'optimizer': 'adam', 'graph_mode': 'cutoff', 'cutoff': 0.8739092080978028, 'grm_norm': 'none', 'self_loops': False, 'use_snp_selection': True, 'num_snps': 56736}. Best is trial 83 with value: 0.130537436953886.
[I 2025-11-03 12:54:55,134] Trial 120 finished with value: 0.11643934051086241 and parameters: {'model_type': 'graphsage', 'hidden_dims': '[256, 128]', 'dropout': 0.37284078942924326, 'batch_norm': True, 'lr': 0.0008436695666814537, 'weight_decay': 1.4748235840476387e-05, 'epochs': 329, 'loss': 'mae', 'optimizer': 'adam', 'graph_mode': 'knn', 'source': 'grm', 'knn_k': 3, 'weighted_edges': True, 'symmetrize_mode': 'mutual', 'use_snp_selection': True, 'num_snps': 52595}. Best is trial 83 with value: 0.130537436953886.
[I 2025-11-03 12:55:00,051] Trial 121 finished with value: 0.11562055327168018 and parameters: {'model_type': 'graphsage', 'hidden_dims': '[128, 64]', 'dropout': 0.31314197370114333, 'batch_norm': True, 'lr': 0.0004648326585804757, 'weight_decay': 3.802128955149323e-06, 'epochs': 276, 'loss': 'mae', 'optimizer': 'adam', 'graph_mode': 'knn', 'source': 'grm', 'knn_k': 8, 'weighted_edges': True, 'symmetrize_mode': 'mutual', 'use_snp_selection': True, 'num_snps': 59846}. Best is trial 83 with value: 0.130537436953886.
[I 2025-11-03 12:55:05,499] Trial 122 finished with value: 0.11510096035384589 and parameters: {'model_type': 'graphsage', 'hidden_dims': '[256, 128, 64]', 'dropout': 0.29872493978805403, 'batch_norm': True, 'lr': 0.0005673706361731135, 'weight_decay': 4.518029383482503e-06, 'epochs': 290, 'loss': 'mae', 'optimizer': 'adam', 'graph_mode': 'knn', 'source': 'grm', 'knn_k': 6, 'weighted_edges': True, 'symmetrize_mode': 'mutual', 'use_snp_selection': True, 'num_snps': 54533}. Best is trial 83 with value: 0.130537436953886.
[I 2025-11-03 12:55:09,771] Trial 123 finished with value: 0.13247668684539143 and parameters: {'model_type': 'graphsage', 'hidden_dims': '[128, 64]', 'dropout': 0.403022078981577, 'batch_norm': True, 'lr': 0.0003376889556744994, 'weight_decay': 1.1313435482127828e-05, 'epochs': 341, 'loss': 'mae', 'optimizer': 'adam', 'graph_mode': 'knn', 'source': 'grm', 'knn_k': 7, 'weighted_edges': True, 'symmetrize_mode': 'mutual', 'use_snp_selection': True, 'num_snps': 45705}. Best is trial 123 with value: 0.13247668684539143.
[I 2025-11-03 12:55:13,742] Trial 124 finished with value: 0.11617916497627423 and parameters: {'model_type': 'graphsage', 'hidden_dims': '[128, 64]', 'dropout': 0.43745711504276885, 'batch_norm': True, 'lr': 0.0002343330558945045, 'weight_decay': 1.1710581179435376e-05, 'epochs': 341, 'loss': 'mae', 'optimizer': 'adam', 'graph_mode': 'knn', 'source': 'grm', 'knn_k': 7, 'weighted_edges': True, 'symmetrize_mode': 'mutual', 'use_snp_selection': True, 'num_snps': 38610}. Best is trial 123 with value: 0.13247668684539143.
[I 2025-11-03 12:55:18,800] Trial 125 finished with value: 0.11843264403389808 and parameters: {'model_type': 'graphsage', 'hidden_dims': '[128, 64]', 'dropout': 0.38283961687347984, 'batch_norm': True, 'lr': 0.0003136685398284792, 'weight_decay': 9.533758364922367e-06, 'epochs': 332, 'loss': 'mae', 'optimizer': 'adam', 'graph_mode': 'knn', 'source': 'grm', 'knn_k': 8, 'weighted_edges': True, 'symmetrize_mode': 'mutual', 'use_snp_selection': True, 'num_snps': 55773}. Best is trial 123 with value: 0.13247668684539143.
[I 2025-11-03 12:55:22,502] Trial 126 finished with value: 0.11288698688310347 and parameters: {'model_type': 'graphsage', 'hidden_dims': '[128, 64]', 'dropout': 0.4052625140493488, 'batch_norm': True, 'lr': 0.00035141331620052065, 'weight_decay': 2.816578903702792e-05, 'epochs': 153, 'loss': 'mae', 'optimizer': 'adam', 'graph_mode': 'knn', 'source': 'grm', 'knn_k': 9, 'weighted_edges': False, 'symmetrize_mode': 'union', 'use_snp_selection': True, 'num_snps': 40842}. Best is trial 123 with value: 0.13247668684539143.
[I 2025-11-03 12:55:25,132] Trial 127 finished with value: 0.09872968785715983 and parameters: {'model_type': 'graphsage', 'hidden_dims': '[128, 64]', 'dropout': 0.14324602622780516, 'batch_norm': False, 'lr': 0.000251457915007395, 'weight_decay': 1.8577281442458946e-06, 'epochs': 71, 'loss': 'mae', 'optimizer': 'adam', 'graph_mode': 'cutoff', 'cutoff': 0.6329851478025719, 'grm_norm': 'none', 'self_loops': True, 'use_snp_selection': True, 'num_snps': 35132}. Best is trial 123 with value: 0.13247668684539143.
[I 2025-11-03 12:55:29,282] Trial 128 finished with value: 0.11158912075430089 and parameters: {'model_type': 'graphsage', 'hidden_dims': '[128, 64]', 'dropout': 0.42576570468079933, 'batch_norm': True, 'lr': 0.00017431923521507865, 'weight_decay': 2.7712096512235957e-06, 'epochs': 350, 'loss': 'mae', 'optimizer': 'adam', 'graph_mode': 'knn', 'source': 'grm', 'knn_k': 5, 'weighted_edges': True, 'symmetrize_mode': 'mutual', 'use_snp_selection': True, 'num_snps': 42936}. Best is trial 123 with value: 0.13247668684539143.
[I 2025-11-03 12:55:32,927] Trial 129 finished with value: 0.0784203341246919 and parameters: {'model_type': 'graphsage', 'hidden_dims': '[256, 128]', 'dropout': 0.12571136025894586, 'batch_norm': False, 'lr': 0.00040691521991818733, 'weight_decay': 1.9965405488744002e-07, 'epochs': 322, 'loss': 'mse', 'optimizer': 'adam', 'graph_mode': 'cutoff', 'cutoff': 0.8957560772749867, 'grm_norm': 'cosine_then_gcn', 'self_loops': False, 'use_snp_selection': False}. Best is trial 123 with value: 0.13247668684539143.
[I 2025-11-03 12:55:36,650] Trial 130 finished with value: 0.1223403640987975 and parameters: {'model_type': 'graphsage', 'hidden_dims': '[128, 64]', 'dropout': 0.4150113015747934, 'batch_norm': True, 'lr': 0.00019348949154654967, 'weight_decay': 1.1846196720984091e-05, 'epochs': 88, 'loss': 'mae', 'optimizer': 'adam', 'graph_mode': 'knn', 'source': 'grm', 'knn_k': 8, 'weighted_edges': True, 'symmetrize_mode': 'mutual', 'use_snp_selection': True, 'num_snps': 57653}. Best is trial 123 with value: 0.13247668684539143.
[I 2025-11-03 12:55:40,247] Trial 131 finished with value: 0.08900138953244138 and parameters: {'model_type': 'graphsage', 'hidden_dims': '[128, 64]', 'dropout': 0.4477131239967115, 'batch_norm': True, 'lr': 0.000203122971343983, 'weight_decay': 1.2293323488425241e-05, 'epochs': 55, 'loss': 'mae', 'optimizer': 'adam', 'graph_mode': 'knn', 'source': 'grm', 'knn_k': 8, 'weighted_edges': True, 'symmetrize_mode': 'mutual', 'use_snp_selection': True, 'num_snps': 57563}. Best is trial 123 with value: 0.13247668684539143.
[I 2025-11-03 12:55:43,958] Trial 132 finished with value: 0.10582808894066173 and parameters: {'model_type': 'graphsage', 'hidden_dims': '[128, 64]', 'dropout': 0.4024922001764418, 'batch_norm': True, 'lr': 0.0001609423690707064, 'weight_decay': 1.7374946870197883e-05, 'epochs': 81, 'loss': 'mae', 'optimizer': 'adam', 'graph_mode': 'knn', 'source': 'grm', 'knn_k': 8, 'weighted_edges': True, 'symmetrize_mode': 'mutual', 'use_snp_selection': True, 'num_snps': 58161}. Best is trial 123 with value: 0.13247668684539143.
[I 2025-11-03 12:55:47,582] Trial 133 finished with value: 0.1140421963749503 and parameters: {'model_type': 'graphsage', 'hidden_dims': '[128, 64]', 'dropout': 0.4159191699882694, 'batch_norm': True, 'lr': 0.0002623806856983109, 'weight_decay': 2.2885302695686518e-05, 'epochs': 99, 'loss': 'mae', 'optimizer': 'adam', 'graph_mode': 'knn', 'source': 'grm', 'knn_k': 7, 'weighted_edges': True, 'symmetrize_mode': 'mutual', 'use_snp_selection': True, 'num_snps': 53415}. Best is trial 123 with value: 0.13247668684539143.
[I 2025-11-03 12:55:51,645] Trial 134 finished with value: 0.12816660374914024 and parameters: {'model_type': 'graphsage', 'hidden_dims': '[128, 64]', 'dropout': 0.4241591078412853, 'batch_norm': True, 'lr': 0.00013959429364672057, 'weight_decay': 6.184469443359055e-06, 'epochs': 135, 'loss': 'mae', 'optimizer': 'adam', 'graph_mode': 'knn', 'source': 'grm', 'knn_k': 10, 'weighted_edges': True, 'symmetrize_mode': 'mutual', 'use_snp_selection': True, 'num_snps': 56045}. Best is trial 123 with value: 0.13247668684539143.
[I 2025-11-03 12:55:55,608] Trial 135 finished with value: 0.10204173405549871 and parameters: {'model_type': 'graphsage', 'hidden_dims': '[128, 64]', 'dropout': 0.46384586784812915, 'batch_norm': True, 'lr': 0.0001369825436631893, 'weight_decay': 5.470322123135484e-06, 'epochs': 130, 'loss': 'mae', 'optimizer': 'adam', 'graph_mode': 'knn', 'source': 'grm', 'knn_k': 10, 'weighted_edges': True, 'symmetrize_mode': 'mutual', 'use_snp_selection': True, 'num_snps': 55965}. Best is trial 123 with value: 0.13247668684539143.
[I 2025-11-03 12:56:01,213] Trial 136 finished with value: 0.12002157375221136 and parameters: {'model_type': 'graphsage', 'hidden_dims': '[512, 256]', 'dropout': 0.42617967742295154, 'batch_norm': False, 'lr': 0.0003420431193801381, 'weight_decay': 2.437040563015711e-06, 'epochs': 144, 'loss': 'mae', 'optimizer': 'adam', 'graph_mode': 'knn', 'source': 'grm', 'knn_k': 9, 'weighted_edges': True, 'symmetrize_mode': 'mutual', 'use_snp_selection': True, 'num_snps': 54789}. Best is trial 123 with value: 0.13247668684539143.
[I 2025-11-03 12:56:04,560] Trial 137 finished with value: 0.10500752105017874 and parameters: {'model_type': 'graphsage', 'hidden_dims': '[128, 64]', 'dropout': 0.39088693626766413, 'batch_norm': True, 'lr': 0.0006687613635646402, 'weight_decay': 7.201258525450754e-06, 'epochs': 134, 'loss': 'mae', 'optimizer': 'adam', 'graph_mode': 'cutoff', 'cutoff': 0.681397622985416, 'grm_norm': 'cosine', 'self_loops': False, 'use_snp_selection': True, 'num_snps': 47136}. Best is trial 123 with value: 0.13247668684539143.
[I 2025-11-03 12:56:09,413] Trial 138 finished with value: 0.09253350016789497 and parameters: {'model_type': 'graphsage', 'hidden_dims': '[512, 128]', 'dropout': 0.3533043112881387, 'batch_norm': False, 'lr': 7.576278841844956e-05, 'weight_decay': 1.4567702675472606e-06, 'epochs': 149, 'loss': 'mae', 'optimizer': 'adam', 'graph_mode': 'knn', 'source': 'grm', 'knn_k': 6, 'weighted_edges': True, 'symmetrize_mode': 'mutual', 'use_snp_selection': True, 'num_snps': 44082}. Best is trial 123 with value: 0.13247668684539143.
[I 2025-11-03 12:56:13,234] Trial 139 finished with value: 0.11072244585103135 and parameters: {'model_type': 'graphsage', 'hidden_dims': '[256, 128]', 'dropout': 0.33724460849324145, 'batch_norm': True, 'lr': 0.00042291941593771814, 'weight_decay': 3.43685948196427e-06, 'epochs': 122, 'loss': 'mae', 'optimizer': 'adam', 'graph_mode': 'cutoff', 'cutoff': 0.5638708861867455, 'grm_norm': 'none', 'self_loops': False, 'use_snp_selection': True, 'num_snps': 51467}. Best is trial 123 with value: 0.13247668684539143.
[I 2025-11-03 12:56:16,973] Trial 140 finished with value: 0.10443772693683442 and parameters: {'model_type': 'graphsage', 'hidden_dims': '[128, 64]', 'dropout': 0.36896991207556856, 'batch_norm': False, 'lr': 8.727696240492983e-05, 'weight_decay': 2.6158949670616377e-07, 'epochs': 136, 'loss': 'mae', 'optimizer': 'adam', 'graph_mode': 'knn', 'source': 'grm', 'knn_k': 10, 'weighted_edges': True, 'symmetrize_mode': 'mutual', 'use_snp_selection': True, 'num_snps': 49750}. Best is trial 123 with value: 0.13247668684539143.
[I 2025-11-03 12:56:20,579] Trial 141 finished with value: 0.11940398965464451 and parameters: {'model_type': 'graphsage', 'hidden_dims': '[128, 64]', 'dropout': 0.4097762503249553, 'batch_norm': True, 'lr': 0.00023212862547374244, 'weight_decay': 8.993327368573539e-06, 'epochs': 89, 'loss': 'mae', 'optimizer': 'adam', 'graph_mode': 'knn', 'source': 'grm', 'knn_k': 5, 'weighted_edges': True, 'symmetrize_mode': 'mutual', 'use_snp_selection': True, 'num_snps': 57087}. Best is trial 123 with value: 0.13247668684539143.
[I 2025-11-03 12:56:24,723] Trial 142 finished with value: 0.12283127756959554 and parameters: {'model_type': 'graphsage', 'hidden_dims': '[128, 64]', 'dropout': 0.38148650455981803, 'batch_norm': True, 'lr': 0.00019827838525957676, 'weight_decay': 6.676264504338044e-06, 'epochs': 157, 'loss': 'mae', 'optimizer': 'adam', 'graph_mode': 'knn', 'source': 'grm', 'knn_k': 7, 'weighted_edges': True, 'symmetrize_mode': 'mutual', 'use_snp_selection': True, 'num_snps': 58990}. Best is trial 123 with value: 0.13247668684539143.
[I 2025-11-03 12:56:28,907] Trial 143 finished with value: 0.11399747291064156 and parameters: {'model_type': 'graphsage', 'hidden_dims': '[128, 64]', 'dropout': 0.37869989473242127, 'batch_norm': True, 'lr': 0.0001488148978625993, 'weight_decay': 5.056915916897791e-06, 'epochs': 158, 'loss': 'mae', 'optimizer': 'adam', 'graph_mode': 'knn', 'source': 'grm', 'knn_k': 7, 'weighted_edges': True, 'symmetrize_mode': 'mutual', 'use_snp_selection': True, 'num_snps': 59915}. Best is trial 123 with value: 0.13247668684539143.
