[I 2025-11-12 20:56:26,900] Trial 55 finished with value: 0.23194670443587723 and parameters: {'model_type': 'graphsage', 'hidden_dims': '[128, 64]', 'dropout': 0.5165128841135144, 'batch_norm': False, 'lr': 6.08030487014945e-05, 'weight_decay': 2.0239741034269044e-06, 'epochs': 123, 'loss': 'mae', 'optimizer': 'adam', 'graph_mode': 'cutoff', 'cutoff': 0.4318644731408746, 'grm_norm': 'gcn', 'self_loops': False, 'use_snp_selection': True, 'num_snps': 43570}. Best is trial 27 with value: 0.24569925586503844.
[I 2025-11-12 20:59:20,818] Trial 56 finished with value: 0.24129413233027278 and parameters: {'model_type': 'graphsage', 'hidden_dims': '[512, 256]', 'dropout': 0.30995006285887083, 'batch_norm': False, 'lr': 3.67549624350808e-05, 'weight_decay': 5.143841378971153e-07, 'epochs': 226, 'loss': 'mae', 'optimizer': 'adam', 'graph_mode': 'cutoff', 'cutoff': 0.36287088251366895, 'grm_norm': 'cosine', 'self_loops': True, 'use_snp_selection': True, 'num_snps': 51269}. Best is trial 27 with value: 0.24569925586503844.
[I 2025-11-12 21:02:30,346] Trial 57 finished with value: 0.23113218420316492 and parameters: {'model_type': 'graphsage', 'hidden_dims': '[512, 256]', 'dropout': 0.5589465624349357, 'batch_norm': False, 'lr': 1.6006219674688056e-05, 'weight_decay': 4.7263837662765005e-07, 'epochs': 229, 'loss': 'mae', 'optimizer': 'adam', 'graph_mode': 'cutoff', 'cutoff': 0.37065677750566517, 'grm_norm': 'cosine', 'self_loops': True, 'use_snp_selection': True, 'num_snps': 53575}. Best is trial 27 with value: 0.24569925586503844.
[I 2025-11-12 21:04:20,638] Trial 58 finished with value: 0.20967405061503594 and parameters: {'model_type': 'graphsage', 'hidden_dims': '[512, 256]', 'dropout': 0.19210986209284164, 'batch_norm': False, 'lr': 3.710818793398433e-05, 'weight_decay': 1.8856194446158375e-07, 'epochs': 251, 'loss': 'mae', 'optimizer': 'adam', 'graph_mode': 'knn', 'source': 'grm', 'knn_k': 8, 'weighted_edges': True, 'symmetrize_mode': 'union', 'use_snp_selection': True, 'num_snps': 21158}. Best is trial 27 with value: 0.24569925586503844.
[I 2025-11-12 21:07:13,365] Trial 59 finished with value: 0.21515232725043493 and parameters: {'model_type': 'graphsage', 'hidden_dims': '[512, 256]', 'dropout': 0.36484728191468735, 'batch_norm': False, 'lr': 7.713892775275903e-06, 'weight_decay': 2.7995170996653486e-07, 'epochs': 286, 'loss': 'mae', 'optimizer': 'adam', 'graph_mode': 'cutoff', 'cutoff': 0.6931264490522826, 'grm_norm': 'cosine', 'self_loops': True, 'use_snp_selection': True, 'num_snps': 56749}. Best is trial 27 with value: 0.24569925586503844.
[I 2025-11-12 21:09:49,755] Trial 60 finished with value: 0.18655803833045925 and parameters: {'model_type': 'graphsage', 'hidden_dims': '[512, 256]', 'dropout': 0.3024077645365014, 'batch_norm': True, 'lr': 4.833530611105366e-06, 'weight_decay': 9.594552709274122e-07, 'epochs': 307, 'loss': 'mse', 'optimizer': 'adam', 'graph_mode': 'cutoff', 'cutoff': 0.6142423061053861, 'grm_norm': 'cosine', 'self_loops': True, 'use_snp_selection': False}. Best is trial 27 with value: 0.24569925586503844.
[I 2025-11-12 21:11:28,236] Trial 61 finished with value: 0.2397504435548598 and parameters: {'model_type': 'graphsage', 'hidden_dims': '[128, 64]', 'dropout': 0.33438782957045154, 'batch_norm': False, 'lr': 2.3060347832093738e-05, 'weight_decay': 5.609027381442048e-07, 'epochs': 193, 'loss': 'mae', 'optimizer': 'adam', 'graph_mode': 'cutoff', 'cutoff': 0.39362477860749956, 'grm_norm': 'cosine', 'self_loops': True, 'use_snp_selection': True, 'num_snps': 51436}. Best is trial 27 with value: 0.24569925586503844.
[I 2025-11-12 21:14:02,136] Trial 62 finished with value: 0.2176867344743237 and parameters: {'model_type': 'graphsage', 'hidden_dims': '[512, 128]', 'dropout': 0.2355855206628304, 'batch_norm': False, 'lr': 2.5223534866303404e-05, 'weight_decay': 5.944017971524373e-07, 'epochs': 159, 'loss': 'mae', 'optimizer': 'adam', 'graph_mode': 'cutoff', 'cutoff': 0.3113079504030388, 'grm_norm': 'cosine', 'self_loops': True, 'use_snp_selection': True, 'num_snps': 51735}. Best is trial 27 with value: 0.24569925586503844.
[I 2025-11-12 21:16:41,332] Trial 63 finished with value: 0.2376228686642201 and parameters: {'model_type': 'graphsage', 'hidden_dims': '[512, 64]', 'dropout': 0.34121503194912467, 'batch_norm': False, 'lr': 2.0047897838493646e-05, 'weight_decay': 1.4683434451714557e-07, 'epochs': 190, 'loss': 'mae', 'optimizer': 'adam', 'graph_mode': 'cutoff', 'cutoff': 0.39864193941746134, 'grm_norm': 'cosine', 'self_loops': True, 'use_snp_selection': True, 'num_snps': 54423}. Best is trial 27 with value: 0.24569925586503844.
[I 2025-11-12 21:20:56,775] Trial 64 finished with value: 0.22678297937643274 and parameters: {'model_type': 'graphsage', 'hidden_dims': '[512, 64]', 'dropout': 0.33897587475823326, 'batch_norm': False, 'lr': 1.7415429061471694e-05, 'weight_decay': 1.7075128734889557e-07, 'epochs': 190, 'loss': 'mae', 'optimizer': 'adam', 'graph_mode': 'cutoff', 'cutoff': 0.25202617476159755, 'grm_norm': 'cosine', 'self_loops': True, 'use_snp_selection': True, 'num_snps': 57646}. Best is trial 27 with value: 0.24569925586503844.
[I 2025-11-12 21:23:59,871] Trial 65 finished with value: 0.24420069020758878 and parameters: {'model_type': 'graphsage', 'hidden_dims': '[512, 64]', 'dropout': 0.40219089880758047, 'batch_norm': False, 'lr': 2.286516827514723e-05, 'weight_decay': 2.3489531227187508e-07, 'epochs': 221, 'loss': 'mae', 'optimizer': 'adam', 'graph_mode': 'cutoff', 'cutoff': 0.35733963388193923, 'grm_norm': 'cosine', 'self_loops': True, 'use_snp_selection': True, 'num_snps': 54657}. Best is trial 27 with value: 0.24569925586503844.
[I 2025-11-12 21:26:37,662] Trial 66 finished with value: 0.23706569963991958 and parameters: {'model_type': 'graphsage', 'hidden_dims': '[512, 64]', 'dropout': 0.39613384333942336, 'batch_norm': False, 'lr': 1.1572284438203334e-05, 'weight_decay': 1.2020480132450915e-07, 'epochs': 218, 'loss': 'mae', 'optimizer': 'adam', 'graph_mode': 'cutoff', 'cutoff': 0.3570440204109445, 'grm_norm': 'cosine', 'self_loops': True, 'use_snp_selection': True, 'num_snps': 47275}. Best is trial 27 with value: 0.24569925586503844.
[I 2025-11-12 21:27:18,257] Trial 67 finished with value: 0.19701894301811032 and parameters: {'model_type': 'graphsage', 'hidden_dims': '[512, 64]', 'dropout': 0.473804795398933, 'batch_norm': False, 'lr': 1.973497765049013e-05, 'weight_decay': 1.0139255222759397e-07, 'epochs': 207, 'loss': 'mae', 'optimizer': 'adam', 'graph_mode': 'cutoff', 'cutoff': 0.39587740134657956, 'grm_norm': 'cosine', 'self_loops': True, 'use_snp_selection': True, 'num_snps': 3778}. Best is trial 27 with value: 0.24569925586503844.
[I 2025-11-12 21:30:07,520] Trial 68 finished with value: 0.2428371961530828 and parameters: {'model_type': 'graphsage', 'hidden_dims': '[512, 64]', 'dropout': 0.4482588425732461, 'batch_norm': False, 'lr': 2.2887423036048875e-05, 'weight_decay': 2.2595884740198772e-07, 'epochs': 225, 'loss': 'mae', 'optimizer': 'adam', 'graph_mode': 'cutoff', 'cutoff': 0.4042858814150667, 'grm_norm': 'cosine', 'self_loops': True, 'use_snp_selection': True, 'num_snps': 51006}. Best is trial 27 with value: 0.24569925586503844.
[I 2025-11-12 21:32:55,291] Trial 69 finished with value: 0.24234864146844642 and parameters: {'model_type': 'graphsage', 'hidden_dims': '[512, 64]', 'dropout': 0.4970425762713713, 'batch_norm': False, 'lr': 3.889164739312732e-05, 'weight_decay': 3.502530124924077e-07, 'epochs': 246, 'loss': 'mae', 'optimizer': 'adam', 'graph_mode': 'cutoff', 'cutoff': 0.3451170382254812, 'grm_norm': 'cosine', 'self_loops': True, 'use_snp_selection': True, 'num_snps': 44917}. Best is trial 27 with value: 0.24569925586503844.
[I 2025-11-12 21:36:42,659] Trial 70 finished with value: 0.2229599925204128 and parameters: {'model_type': 'graphsage', 'hidden_dims': '[512, 64]', 'dropout': 0.45178829179795943, 'batch_norm': False, 'lr': 3.5777502699024504e-05, 'weight_decay': 2.2898756789993675e-07, 'epochs': 244, 'loss': 'mae', 'optimizer': 'adam', 'graph_mode': 'cutoff', 'cutoff': 0.2564564557294374, 'grm_norm': 'none', 'self_loops': True, 'use_snp_selection': True, 'num_snps': 44412}. Best is trial 27 with value: 0.24569925586503844.
[I 2025-11-12 21:39:48,739] Trial 71 finished with value: 0.2310432698160901 and parameters: {'model_type': 'graphsage', 'hidden_dims': '[512, 64]', 'dropout': 0.4980224680241005, 'batch_norm': False, 'lr': 6.584300167242832e-05, 'weight_decay': 3.895876134243199e-07, 'epochs': 226, 'loss': 'mae', 'optimizer': 'adam', 'graph_mode': 'cutoff', 'cutoff': 0.3272034214985592, 'grm_norm': 'cosine', 'self_loops': True, 'use_snp_selection': True, 'num_snps': 51466}. Best is trial 27 with value: 0.24569925586503844.
[I 2025-11-12 21:43:05,154] Trial 72 finished with value: 0.23262178604447933 and parameters: {'model_type': 'graphsage', 'hidden_dims': '[512, 64]', 'dropout': 0.41324342865269925, 'batch_norm': False, 'lr': 1.272194631201493e-05, 'weight_decay': 3.330492888505757e-07, 'epochs': 258, 'loss': 'mae', 'optimizer': 'adam', 'graph_mode': 'cutoff', 'cutoff': 0.3518405775765036, 'grm_norm': 'cosine', 'self_loops': True, 'use_snp_selection': True, 'num_snps': 50148}. Best is trial 27 with value: 0.24569925586503844.
[I 2025-11-12 21:45:47,195] Trial 73 finished with value: 0.23217533224755696 and parameters: {'model_type': 'graphsage', 'hidden_dims': '[512, 64]', 'dropout': 0.4434646808438307, 'batch_norm': False, 'lr': 0.00010724782714559195, 'weight_decay': 5.137335306011427e-07, 'epochs': 239, 'loss': 'mae', 'optimizer': 'adam', 'graph_mode': 'cutoff', 'cutoff': 0.4029573102645041, 'grm_norm': 'cosine', 'self_loops': True, 'use_snp_selection': True, 'num_snps': 48241}. Best is trial 27 with value: 0.24569925586503844.
[I 2025-11-12 21:49:38,872] Trial 74 finished with value: 0.20936684237242842 and parameters: {'model_type': 'graphsage', 'hidden_dims': '[512, 64]', 'dropout': 0.4666661729130111, 'batch_norm': False, 'lr': 0.00017796032895062416, 'weight_decay': 2.53981295008704e-07, 'epochs': 247, 'loss': 'mae', 'optimizer': 'adam', 'graph_mode': 'cutoff', 'cutoff': 0.2958363960248677, 'grm_norm': 'cosine', 'self_loops': True, 'use_snp_selection': True, 'num_snps': 52563}. Best is trial 27 with value: 0.24569925586503844.
[I 2025-11-12 21:51:46,352] Trial 75 finished with value: 0.2293153458177361 and parameters: {'model_type': 'graphsage', 'hidden_dims': '[512, 64]', 'dropout': 0.5202252858507079, 'batch_norm': False, 'lr': 2.2365882992330766e-05, 'weight_decay': 2.1479549786791844e-07, 'epochs': 222, 'loss': 'mae', 'optimizer': 'adam', 'graph_mode': 'knn', 'source': 'grm', 'knn_k': 3, 'weighted_edges': False, 'symmetrize_mode': 'mutual', 'use_snp_selection': True, 'num_snps': 42339}. Best is trial 27 with value: 0.24569925586503844.
[I 2025-11-12 21:53:39,662] Trial 76 finished with value: 0.21928266236511687 and parameters: {'model_type': 'graphsage', 'hidden_dims': '[256, 128]', 'dropout': 0.48536990336007396, 'batch_norm': False, 'lr': 3.865483631712499e-05, 'weight_decay': 1.4140783069104644e-07, 'epochs': 230, 'loss': 'mae', 'optimizer': 'adam', 'graph_mode': 'cutoff', 'cutoff': 0.4235535163941884, 'grm_norm': 'cosine', 'self_loops': True, 'use_snp_selection': True, 'num_snps': 45747}. Best is trial 27 with value: 0.24569925586503844.
[I 2025-11-12 21:55:53,299] Trial 77 finished with value: 0.22808573647243652 and parameters: {'model_type': 'graphsage', 'hidden_dims': '[512, 256]', 'dropout': 0.5024923553619262, 'batch_norm': True, 'lr': 2.617300352708589e-05, 'weight_decay': 7.373757454150976e-07, 'epochs': 207, 'loss': 'mae', 'optimizer': 'adam', 'graph_mode': 'cutoff', 'cutoff': 0.3462975016411937, 'grm_norm': 'cosine', 'self_loops': True, 'use_snp_selection': False}. Best is trial 27 with value: 0.24569925586503844.
[I 2025-11-12 21:59:01,474] Trial 78 finished with value: 0.20238964935427783 and parameters: {'model_type': 'graphsage', 'hidden_dims': '[512, 64]', 'dropout': 0.4337723894297349, 'batch_norm': False, 'lr': 3.0421194980663033e-05, 'weight_decay': 3.745878608978866e-07, 'epochs': 264, 'loss': 'mse', 'optimizer': 'adam', 'graph_mode': 'cutoff', 'cutoff': 0.472844430981642, 'grm_norm': 'cosine', 'self_loops': True, 'use_snp_selection': True, 'num_snps': 54616}. Best is trial 27 with value: 0.24569925586503844.
[I 2025-11-12 22:02:07,248] Trial 79 finished with value: 0.2397402890217753 and parameters: {'model_type': 'graphsage', 'hidden_dims': '[256, 128, 64]', 'dropout': 0.3049548872161412, 'batch_norm': False, 'lr': 5.180369880228229e-05, 'weight_decay': 4.827431676434765e-07, 'epochs': 277, 'loss': 'mae', 'optimizer': 'adam', 'graph_mode': 'cutoff', 'cutoff': 0.3721713971868525, 'grm_norm': 'none', 'self_loops': True, 'use_snp_selection': True, 'num_snps': 58254}. Best is trial 27 with value: 0.24569925586503844.
[I 2025-11-12 22:05:16,025] Trial 80 finished with value: 0.2313170331766154 and parameters: {'model_type': 'graphsage', 'hidden_dims': '[256, 128, 64]', 'dropout': 0.26714073432445434, 'batch_norm': False, 'lr': 5.4848285777478275e-05, 'weight_decay': 4.4464507680269033e-07, 'epochs': 274, 'loss': 'mae', 'optimizer': 'adam', 'graph_mode': 'cutoff', 'cutoff': 0.38029355003951704, 'grm_norm': 'none', 'self_loops': True, 'use_snp_selection': True, 'num_snps': 58401}. Best is trial 27 with value: 0.24569925586503844.
[I 2025-11-12 22:07:35,447] Trial 81 finished with value: 0.22978033330638886 and parameters: {'model_type': 'graphsage', 'hidden_dims': '[256, 128, 64]', 'dropout': 0.3077178799631071, 'batch_norm': False, 'lr': 4.2907866611241306e-05, 'weight_decay': 3.501003584143772e-07, 'epochs': 235, 'loss': 'mae', 'optimizer': 'adam', 'graph_mode': 'cutoff', 'cutoff': 0.4157388636208519, 'grm_norm': 'none', 'self_loops': True, 'use_snp_selection': True, 'num_snps': 52282}. Best is trial 27 with value: 0.24569925586503844.
[I 2025-11-12 22:10:38,808] Trial 82 finished with value: 0.23900457740938946 and parameters: {'model_type': 'graphsage', 'hidden_dims': '[256, 128, 64]', 'dropout': 0.28444135955875066, 'batch_norm': False, 'lr': 8.662610557234349e-05, 'weight_decay': 5.246718199576574e-07, 'epochs': 249, 'loss': 'mae', 'optimizer': 'adam', 'graph_mode': 'cutoff', 'cutoff': 0.3347178463746305, 'grm_norm': 'none', 'self_loops': True, 'use_snp_selection': True, 'num_snps': 55631}. Best is trial 27 with value: 0.24569925586503844.
[I 2025-11-12 22:14:57,856] Trial 83 finished with value: 0.2236764820134114 and parameters: {'model_type': 'graphsage', 'hidden_dims': '[256, 128, 64]', 'dropout': 0.24685857560688773, 'batch_norm': False, 'lr': 9.56929219864516e-05, 'weight_decay': 8.671666501318366e-07, 'epochs': 251, 'loss': 'mae', 'optimizer': 'adam', 'graph_mode': 'cutoff', 'cutoff': 0.2695584907550829, 'grm_norm': 'none', 'self_loops': True, 'use_snp_selection': True, 'num_snps': 57250}. Best is trial 27 with value: 0.24569925586503844.
[I 2025-11-12 22:20:15,879] Trial 84 finished with value: 0.2217314777215124 and parameters: {'model_type': 'graphsage', 'hidden_dims': '[256, 128, 64]', 'dropout': 0.28260831460939867, 'batch_norm': False, 'lr': 9.040918648394769e-06, 'weight_decay': 5.013706963298304e-07, 'epochs': 278, 'loss': 'mae', 'optimizer': 'adam', 'graph_mode': 'cutoff', 'cutoff': 0.2152006448548551, 'grm_norm': 'none', 'self_loops': True, 'use_snp_selection': True, 'num_snps': 50205}. Best is trial 27 with value: 0.24569925586503844.
[I 2025-11-12 22:23:30,109] Trial 85 finished with value: 0.23506855871923066 and parameters: {'model_type': 'graphsage', 'hidden_dims': '[256, 128, 64]', 'dropout': 0.31238967173868637, 'batch_norm': False, 'lr': 6.460524419136158e-05, 'weight_decay': 2.96148399210949e-07, 'epochs': 257, 'loss': 'mae', 'optimizer': 'adam', 'graph_mode': 'cutoff', 'cutoff': 0.3376333600611502, 'grm_norm': 'none', 'self_loops': True, 'use_snp_selection': True, 'num_snps': 58839}. Best is trial 27 with value: 0.24569925586503844.
[I 2025-11-12 22:27:07,439] Trial 86 finished with value: 0.22048497176834117 and parameters: {'model_type': 'graphsage', 'hidden_dims': '[256, 128, 64]', 'dropout': 0.29646128915796727, 'batch_norm': False, 'lr': 1.426983613598501e-05, 'weight_decay': 1.1404396531363989e-06, 'epochs': 266, 'loss': 'mae', 'optimizer': 'adam', 'graph_mode': 'knn', 'source': 'grm', 'knn_k': 5, 'weighted_edges': False, 'symmetrize_mode': 'union', 'use_snp_selection': True, 'num_snps': 55708}. Best is trial 27 with value: 0.24569925586503844.
[I 2025-11-12 22:30:54,605] Trial 87 finished with value: 0.22444293212884542 and parameters: {'model_type': 'graphsage', 'hidden_dims': '[256, 128, 64]', 'dropout': 0.32973833167572386, 'batch_norm': False, 'lr': 4.801108170984184e-05, 'weight_decay': 0.0008532047640387765, 'epochs': 296, 'loss': 'mae', 'optimizer': 'adam', 'graph_mode': 'cutoff', 'cutoff': 0.307581256661107, 'grm_norm': 'none', 'self_loops': True, 'use_snp_selection': True, 'num_snps': 53565}. Best is trial 27 with value: 0.24569925586503844.
[I 2025-11-12 22:32:48,307] Trial 88 finished with value: 0.22996850757509274 and parameters: {'model_type': 'graphsage', 'hidden_dims': '[256, 128]', 'dropout': 0.27527452927637286, 'batch_norm': False, 'lr': 3.116733303487428e-05, 'weight_decay': 6.716588340714417e-07, 'epochs': 283, 'loss': 'mae', 'optimizer': 'adam', 'graph_mode': 'cutoff', 'cutoff': 0.4361593878020572, 'grm_norm': 'none', 'self_loops': True, 'use_snp_selection': True, 'num_snps': 39860}. Best is trial 27 with value: 0.24569925586503844.
[I 2025-11-12 22:34:19,780] Trial 89 finished with value: 0.20485037561335923 and parameters: {'model_type': 'graphsage', 'hidden_dims': '[256, 128, 64]', 'dropout': 0.41256393196084035, 'batch_norm': True, 'lr': 2.4677725480561115e-05, 'weight_decay': 2.0886365243650312e-07, 'epochs': 221, 'loss': 'mse', 'optimizer': 'adam', 'graph_mode': 'cutoff', 'cutoff': 0.37394354492206056, 'grm_norm': 'none', 'self_loops': True, 'use_snp_selection': False}. Best is trial 27 with value: 0.24569925586503844.
[I 2025-11-12 22:37:17,799] Trial 90 finished with value: 0.2307170741851939 and parameters: {'model_type': 'graphsage', 'hidden_dims': '[512, 64]', 'dropout': 0.38584762453570604, 'batch_norm': False, 'lr': 1.791175227036396e-05, 'weight_decay': 5.877796624900351e-07, 'epochs': 244, 'loss': 'mae', 'optimizer': 'adam', 'graph_mode': 'cutoff', 'cutoff': 0.3349724229929276, 'grm_norm': 'cosine_then_gcn', 'self_loops': True, 'use_snp_selection': True, 'num_snps': 48217}. Best is trial 27 with value: 0.24569925586503844.
[I 2025-11-12 22:39:36,195] Trial 91 finished with value: 0.24525542639174608 and parameters: {'model_type': 'graphsage', 'hidden_dims': '[256, 128]', 'dropout': 0.48338626970657517, 'batch_norm': False, 'lr': 7.715882149001265e-05, 'weight_decay': 1.3969837067145578e-07, 'epochs': 211, 'loss': 'mae', 'optimizer': 'adam', 'graph_mode': 'cutoff', 'cutoff': 0.3617589278052879, 'grm_norm': 'cosine', 'self_loops': True, 'use_snp_selection': True, 'num_snps': 55065}. Best is trial 27 with value: 0.24569925586503844.
[I 2025-11-12 22:42:01,390] Trial 92 finished with value: 0.23231035368836514 and parameters: {'model_type': 'graphsage', 'hidden_dims': '[256, 128]', 'dropout': 0.216583481045157, 'batch_norm': False, 'lr': 6.97889617584999e-05, 'weight_decay': 1.4546216126630428e-07, 'epochs': 233, 'loss': 'mae', 'optimizer': 'adam', 'graph_mode': 'cutoff', 'cutoff': 0.3898946178672267, 'grm_norm': 'cosine', 'self_loops': True, 'use_snp_selection': True, 'num_snps': 55529}. Best is trial 27 with value: 0.24569925586503844.
[I 2025-11-12 22:44:04,895] Trial 93 finished with value: 0.24013453967432027 and parameters: {'model_type': 'graphsage', 'hidden_dims': '[256, 128]', 'dropout': 0.3516571763430384, 'batch_norm': False, 'lr': 0.00015691326514218773, 'weight_decay': 1.2519833785874626e-07, 'epochs': 196, 'loss': 'mae', 'optimizer': 'adam', 'graph_mode': 'cutoff', 'cutoff': 0.36120463123526897, 'grm_norm': 'cosine', 'self_loops': True, 'use_snp_selection': True, 'num_snps': 51426}. Best is trial 27 with value: 0.24569925586503844.
[I 2025-11-12 22:46:06,991] Trial 94 finished with value: 0.2129030647765527 and parameters: {'model_type': 'graphsage', 'hidden_dims': '[256, 128]', 'dropout': 0.35022657316041894, 'batch_norm': False, 'lr': 1.317296335912091e-06, 'weight_decay': 1.2580592308806559e-07, 'epochs': 215, 'loss': 'mae', 'optimizer': 'adam', 'graph_mode': 'cutoff', 'cutoff': 0.41713556056224455, 'grm_norm': 'cosine', 'self_loops': True, 'use_snp_selection': True, 'num_snps': 50615}. Best is trial 27 with value: 0.24569925586503844.
[I 2025-11-12 22:47:57,994] Trial 95 finished with value: 0.14745399477774704 and parameters: {'model_type': 'graphsage', 'hidden_dims': '[256, 128]', 'dropout': 0.46347669032421573, 'batch_norm': False, 'lr': 0.0002743321012786312, 'weight_decay': 2.346120398736954e-07, 'epochs': 179, 'loss': 'mae', 'optimizer': 'adam', 'graph_mode': 'cutoff', 'cutoff': 0.45407420295470075, 'grm_norm': 'cosine', 'self_loops': True, 'use_snp_selection': True, 'num_snps': 53261}. Best is trial 27 with value: 0.24569925586503844.
[I 2025-11-12 22:50:01,340] Trial 96 finished with value: 0.19721659299238303 and parameters: {'model_type': 'graphsage', 'hidden_dims': '[256, 128]', 'dropout': 0.5276404235293131, 'batch_norm': False, 'lr': 0.00016016683160608548, 'weight_decay': 3.096341460686299e-07, 'epochs': 198, 'loss': 'mae', 'optimizer': 'adam', 'graph_mode': 'cutoff', 'cutoff': 0.3561092838845269, 'grm_norm': 'cosine', 'self_loops': True, 'use_snp_selection': True, 'num_snps': 49446}. Best is trial 27 with value: 0.24569925586503844.
