[I 2025-11-13 01:56:00,624] Trial 32 finished with value: 0.21497536794616048 and parameters: {'model_type': 'graphsage', 'hidden_dims': '[512, 64]', 'dropout': 0.17676276713730854, 'batch_norm': False, 'lr': 3.174959530411029e-06, 'weight_decay': 3.9847865591152486e-05, 'epochs': 65, 'loss': 'mae', 'optimizer': 'adam', 'graph_mode': 'cutoff', 'cutoff': 0.5035606631104883, 'grm_norm': 'none', 'self_loops': False, 'use_snp_selection': True, 'num_snps': 39027}. Best is trial 23 with value: 0.24588175498575632.
[I 2025-11-13 01:57:40,443] Trial 33 finished with value: 0.2179910808425825 and parameters: {'model_type': 'graphsage', 'hidden_dims': '[512, 128]', 'dropout': 0.22468423194051895, 'batch_norm': False, 'lr': 7.67892048784704e-06, 'weight_decay': 7.96109053787625e-05, 'epochs': 83, 'loss': 'mae', 'optimizer': 'adam', 'graph_mode': 'cutoff', 'cutoff': 0.8319340175510253, 'grm_norm': 'gcn', 'self_loops': False, 'use_snp_selection': True, 'num_snps': 47205}. Best is trial 23 with value: 0.24588175498575632.
[I 2025-11-13 01:59:11,183] Trial 34 finished with value: 0.2139048939868963 and parameters: {'model_type': 'graphsage', 'hidden_dims': '[256, 128, 64]', 'dropout': 0.1254549358084762, 'batch_norm': False, 'lr': 3.0363537184112738e-05, 'weight_decay': 3.5138932613924877e-05, 'epochs': 102, 'loss': 'mse', 'optimizer': 'adam', 'graph_mode': 'knn', 'source': 'grm', 'knn_k': 4, 'weighted_edges': False, 'symmetrize_mode': 'union', 'use_snp_selection': True, 'num_snps': 32734}. Best is trial 23 with value: 0.24588175498575632.
[I 2025-11-13 02:00:47,514] Trial 35 finished with value: 0.22121067198528635 and parameters: {'model_type': 'graphsage', 'hidden_dims': '[256, 128]', 'dropout': 0.35238792345332937, 'batch_norm': False, 'lr': 1.6730103902901983e-05, 'weight_decay': 0.0009587484369062665, 'epochs': 136, 'loss': 'mae', 'optimizer': 'adam', 'graph_mode': 'cutoff', 'cutoff': 0.7329529735803678, 'grm_norm': 'none', 'self_loops': False, 'use_snp_selection': True, 'num_snps': 49597}. Best is trial 23 with value: 0.24588175498575632.
[I 2025-11-13 02:01:31,759] Trial 36 finished with value: 0.12555294620425347 and parameters: {'model_type': 'graphsage', 'hidden_dims': '[256, 128]', 'dropout': 0.15549888515560972, 'batch_norm': True, 'lr': 4.6282856072618266e-06, 'weight_decay': 0.00016745443269979368, 'epochs': 63, 'loss': 'mse', 'optimizer': 'adam', 'graph_mode': 'cutoff', 'cutoff': 0.37455593014250543, 'grm_norm': 'none', 'self_loops': False, 'use_snp_selection': False}. Best is trial 23 with value: 0.24588175498575632.
[I 2025-11-13 02:03:17,956] Trial 37 finished with value: 0.22947579353415234 and parameters: {'model_type': 'graphsage', 'hidden_dims': '[512, 64]', 'dropout': 0.12302155546478077, 'batch_norm': False, 'lr': 3.66459110698647e-05, 'weight_decay': 0.00046688664257172143, 'epochs': 58, 'loss': 'mae', 'optimizer': 'adam', 'graph_mode': 'knn', 'source': 'grm', 'knn_k': 4, 'weighted_edges': True, 'symmetrize_mode': 'mutual', 'use_snp_selection': True, 'num_snps': 55262}. Best is trial 23 with value: 0.24588175498575632.
[I 2025-11-13 02:04:21,326] Trial 38 finished with value: 0.2251525313649268 and parameters: {'model_type': 'graphsage', 'hidden_dims': '[256, 128, 64]', 'dropout': 0.19635030154958635, 'batch_norm': False, 'lr': 9.436102099635672e-06, 'weight_decay': 2.4863264694273572e-05, 'epochs': 80, 'loss': 'mae', 'optimizer': 'adam', 'graph_mode': 'cutoff', 'cutoff': 0.5891727031835879, 'grm_norm': 'gcn', 'self_loops': False, 'use_snp_selection': True, 'num_snps': 27336}. Best is trial 23 with value: 0.24588175498575632.
[I 2025-11-13 02:06:21,552] Trial 39 finished with value: 0.21360749759477787 and parameters: {'model_type': 'graphsage', 'hidden_dims': '[512, 256]', 'dropout': 0.32809099024142446, 'batch_norm': True, 'lr': 8.442131120761198e-05, 'weight_decay': 4.90988538017239e-07, 'epochs': 172, 'loss': 'mse', 'optimizer': 'adam', 'graph_mode': 'cutoff', 'cutoff': 0.6669612274002212, 'grm_norm': 'gcn', 'self_loops': False, 'use_snp_selection': False}. Best is trial 23 with value: 0.24588175498575632.
[I 2025-11-13 02:10:42,056] Trial 40 finished with value: 0.22716109240346208 and parameters: {'model_type': 'graphsage', 'hidden_dims': '[256, 128]', 'dropout': 0.3887152081100193, 'batch_norm': False, 'lr': 2.1307694860700464e-05, 'weight_decay': 3.502731070115358e-06, 'epochs': 209, 'loss': 'mae', 'optimizer': 'adam', 'graph_mode': 'knn', 'source': 'grm', 'knn_k': 10, 'weighted_edges': False, 'symmetrize_mode': 'union', 'use_snp_selection': True, 'num_snps': 39831}. Best is trial 23 with value: 0.24588175498575632.
[I 2025-11-13 02:11:48,444] Trial 41 finished with value: 0.23677715647233538 and parameters: {'model_type': 'graphsage', 'hidden_dims': '[128, 64]', 'dropout': 0.10217109110817549, 'batch_norm': False, 'lr': 0.0004515924472563571, 'weight_decay': 1.568485578860074e-05, 'epochs': 52, 'loss': 'mae', 'optimizer': 'adam', 'graph_mode': 'cutoff', 'cutoff': 0.6541926373394887, 'grm_norm': 'none', 'self_loops': False, 'use_snp_selection': True, 'num_snps': 46102}. Best is trial 23 with value: 0.24588175498575632.
[I 2025-11-13 02:13:03,551] Trial 42 finished with value: 0.24103998358068215 and parameters: {'model_type': 'graphsage', 'hidden_dims': '[128, 64]', 'dropout': 0.13279120098323446, 'batch_norm': False, 'lr': 2.8226621966566036e-05, 'weight_decay': 2.5427564057318894e-05, 'epochs': 106, 'loss': 'mae', 'optimizer': 'adam', 'graph_mode': 'cutoff', 'cutoff': 0.5738230346329265, 'grm_norm': 'none', 'self_loops': False, 'use_snp_selection': True, 'num_snps': 45856}. Best is trial 23 with value: 0.24588175498575632.
[I 2025-11-13 02:14:20,168] Trial 43 finished with value: 0.23410120970856343 and parameters: {'model_type': 'graphsage', 'hidden_dims': '[128, 64]', 'dropout': 0.1358864024723931, 'batch_norm': False, 'lr': 4.7433393676162366e-05, 'weight_decay': 2.8232670241015595e-05, 'epochs': 113, 'loss': 'mae', 'optimizer': 'adam', 'graph_mode': 'cutoff', 'cutoff': 0.5634744126330467, 'grm_norm': 'none', 'self_loops': False, 'use_snp_selection': True, 'num_snps': 45479}. Best is trial 23 with value: 0.24588175498575632.
[I 2025-11-13 02:15:22,984] Trial 44 finished with value: 0.23235305808955023 and parameters: {'model_type': 'graphsage', 'hidden_dims': '[128, 64]', 'dropout': 0.1728725181818908, 'batch_norm': False, 'lr': 3.092433491451912e-05, 'weight_decay': 6.767744190270241e-05, 'epochs': 75, 'loss': 'mae', 'optimizer': 'adam', 'graph_mode': 'cutoff', 'cutoff': 0.4854200805139392, 'grm_norm': 'none', 'self_loops': False, 'use_snp_selection': True, 'num_snps': 29278}. Best is trial 23 with value: 0.24588175498575632.
[I 2025-11-13 02:17:18,948] Trial 45 finished with value: 0.23504621836628448 and parameters: {'model_type': 'graphsage', 'hidden_dims': '[512, 64]', 'dropout': 0.21667618670472472, 'batch_norm': False, 'lr': 1.4595724596804487e-05, 'weight_decay': 8.313669595509202e-06, 'epochs': 92, 'loss': 'mae', 'optimizer': 'adam', 'graph_mode': 'cutoff', 'cutoff': 0.5853183812570065, 'grm_norm': 'none', 'self_loops': False, 'use_snp_selection': True, 'num_snps': 54658}. Best is trial 23 with value: 0.24588175498575632.
[I 2025-11-13 02:19:18,051] Trial 46 finished with value: 0.16438579402649262 and parameters: {'model_type': 'graphsage', 'hidden_dims': '[512, 128]', 'dropout': 0.4749086643626909, 'batch_norm': False, 'lr': 0.000958203671719048, 'weight_decay': 2.3265465655652817e-06, 'epochs': 136, 'loss': 'mae', 'optimizer': 'adam', 'graph_mode': 'cutoff', 'cutoff': 0.7421541068166421, 'grm_norm': 'cosine_then_gcn', 'self_loops': False, 'use_snp_selection': True, 'num_snps': 45217}. Best is trial 23 with value: 0.24588175498575632.
[I 2025-11-13 02:20:28,861] Trial 47 finished with value: 0.17590786550365417 and parameters: {'model_type': 'graphsage', 'hidden_dims': '[512, 256]', 'dropout': 0.24630125508983708, 'batch_norm': True, 'lr': 5.916934948855318e-06, 'weight_decay': 1.5022961971132952e-06, 'epochs': 41, 'loss': 'mse', 'optimizer': 'adam', 'graph_mode': 'cutoff', 'cutoff': 0.21495020909037632, 'grm_norm': 'none', 'self_loops': True, 'use_snp_selection': False}. Best is trial 23 with value: 0.24588175498575632.
[I 2025-11-13 02:22:19,362] Trial 48 finished with value: 0.2408237676216462 and parameters: {'model_type': 'graphsage', 'hidden_dims': '[512, 64]', 'dropout': 0.12336627931576376, 'batch_norm': False, 'lr': 2.2421623813632018e-05, 'weight_decay': 4.644180273443265e-06, 'epochs': 137, 'loss': 'mae', 'optimizer': 'adam', 'graph_mode': 'cutoff', 'cutoff': 0.6949021549050383, 'grm_norm': 'cosine', 'self_loops': False, 'use_snp_selection': True, 'num_snps': 39907}. Best is trial 23 with value: 0.24588175498575632.
[I 2025-11-13 02:24:22,607] Trial 49 finished with value: 0.23229000538893896 and parameters: {'model_type': 'graphsage', 'hidden_dims': '[512, 64]', 'dropout': 0.12727623749085676, 'batch_norm': False, 'lr': 2.4410134961197933e-05, 'weight_decay': 1.8437808191734134e-05, 'epochs': 131, 'loss': 'mae', 'optimizer': 'adam', 'graph_mode': 'knn', 'source': 'grm', 'knn_k': 4, 'weighted_edges': True, 'symmetrize_mode': 'union', 'use_snp_selection': True, 'num_snps': 34680}. Best is trial 23 with value: 0.24588175498575632.
[I 2025-11-13 02:25:54,564] Trial 50 finished with value: 0.24908458620425428 and parameters: {'model_type': 'graphsage', 'hidden_dims': '[512, 64]', 'dropout': 0.18362058367003836, 'batch_norm': False, 'lr': 6.985698564886227e-05, 'weight_decay': 4.802565811863191e-06, 'epochs': 85, 'loss': 'mae', 'optimizer': 'adam', 'graph_mode': 'cutoff', 'cutoff': 0.6933000843445212, 'grm_norm': 'cosine', 'self_loops': False, 'use_snp_selection': True, 'num_snps': 40159}. Best is trial 50 with value: 0.24908458620425428.
[I 2025-11-13 02:27:31,011] Trial 51 finished with value: 0.24954735194865255 and parameters: {'model_type': 'graphsage', 'hidden_dims': '[512, 64]', 'dropout': 0.1536441138372351, 'batch_norm': False, 'lr': 6.66533159566324e-05, 'weight_decay': 5.644750337326252e-06, 'epochs': 102, 'loss': 'mae', 'optimizer': 'adam', 'graph_mode': 'cutoff', 'cutoff': 0.6705979402526754, 'grm_norm': 'cosine', 'self_loops': False, 'use_snp_selection': True, 'num_snps': 38843}. Best is trial 51 with value: 0.24954735194865255.
[I 2025-11-13 02:29:04,056] Trial 52 finished with value: 0.24066516373366728 and parameters: {'model_type': 'graphsage', 'hidden_dims': '[512, 64]', 'dropout': 0.18952427565648045, 'batch_norm': False, 'lr': 6.421099084828399e-05, 'weight_decay': 1.043350983167269e-05, 'epochs': 104, 'loss': 'mae', 'optimizer': 'adam', 'graph_mode': 'cutoff', 'cutoff': 0.7570548840966665, 'grm_norm': 'cosine', 'self_loops': False, 'use_snp_selection': True, 'num_snps': 36340}. Best is trial 51 with value: 0.24954735194865255.
[I 2025-11-13 02:30:36,281] Trial 53 finished with value: 0.23299304699668516 and parameters: {'model_type': 'graphsage', 'hidden_dims': '[512, 64]', 'dropout': 0.15122602779982552, 'batch_norm': False, 'lr': 0.0001907220992170718, 'weight_decay': 3.2833191883050095e-06, 'epochs': 85, 'loss': 'mae', 'optimizer': 'adam', 'graph_mode': 'cutoff', 'cutoff': 0.6585267716022977, 'grm_norm': 'cosine', 'self_loops': False, 'use_snp_selection': True, 'num_snps': 40462}. Best is trial 51 with value: 0.24954735194865255.
[I 2025-11-13 02:32:06,144] Trial 54 finished with value: 0.2134889145585499 and parameters: {'model_type': 'graphsage', 'hidden_dims': '[512, 64]', 'dropout': 0.1771648380866474, 'batch_norm': False, 'lr': 0.00010177446175911539, 'weight_decay': 6.38203212785269e-06, 'epochs': 52, 'loss': 'mae', 'optimizer': 'adam', 'graph_mode': 'cutoff', 'cutoff': 0.6062378029066022, 'grm_norm': 'cosine', 'self_loops': False, 'use_snp_selection': True, 'num_snps': 49115}. Best is trial 51 with value: 0.24954735194865255.
[I 2025-11-13 02:34:13,296] Trial 55 finished with value: 0.21706893485022224 and parameters: {'model_type': 'graphsage', 'hidden_dims': '[512, 64]', 'dropout': 0.24638187677647697, 'batch_norm': False, 'lr': 0.00030456515326372297, 'weight_decay': 1.3561622497634363e-05, 'epochs': 257, 'loss': 'mae', 'optimizer': 'adam', 'graph_mode': 'cutoff', 'cutoff': 0.8455369657501739, 'grm_norm': 'cosine', 'self_loops': False, 'use_snp_selection': True, 'num_snps': 31111}. Best is trial 51 with value: 0.24954735194865255.
[I 2025-11-13 02:35:27,480] Trial 56 finished with value: 0.22931103042047787 and parameters: {'model_type': 'graphsage', 'hidden_dims': '[128, 64]', 'dropout': 0.2106742967340996, 'batch_norm': False, 'lr': 4.1050075290279316e-05, 'weight_decay': 8.817381252812758e-05, 'epochs': 98, 'loss': 'mae', 'optimizer': 'adam', 'graph_mode': 'cutoff', 'cutoff': 0.5427335734922925, 'grm_norm': 'cosine', 'self_loops': False, 'use_snp_selection': True, 'num_snps': 43425}. Best is trial 51 with value: 0.24954735194865255.
[I 2025-11-13 02:37:10,858] Trial 57 finished with value: 0.2437762932477782 and parameters: {'model_type': 'graphsage', 'hidden_dims': '[512, 64]', 'dropout': 0.2719261945161957, 'batch_norm': False, 'lr': 5.3325956890586796e-05, 'weight_decay': 9.98435816125781e-06, 'epochs': 76, 'loss': 'mae', 'optimizer': 'adam', 'graph_mode': 'cutoff', 'cutoff': 0.70468484730517, 'grm_norm': 'cosine', 'self_loops': True, 'use_snp_selection': True, 'num_snps': 51719}. Best is trial 51 with value: 0.24954735194865255.
[I 2025-11-13 02:39:09,779] Trial 58 finished with value: 0.2435102090156649 and parameters: {'model_type': 'graphsage', 'hidden_dims': '[512, 64]', 'dropout': 0.15502679265428518, 'batch_norm': False, 'lr': 6.131389321013236e-05, 'weight_decay': 1.0331262747220131e-05, 'epochs': 110, 'loss': 'mae', 'optimizer': 'adam', 'graph_mode': 'cutoff', 'cutoff': 0.6917279151827338, 'grm_norm': 'cosine', 'self_loops': True, 'use_snp_selection': True, 'num_snps': 51708}. Best is trial 51 with value: 0.24954735194865255.
[I 2025-11-13 02:40:59,636] Trial 59 finished with value: 0.2357462609428409 and parameters: {'model_type': 'graphsage', 'hidden_dims': '[512, 64]', 'dropout': 0.28056865413759113, 'batch_norm': False, 'lr': 6.256924988177225e-05, 'weight_decay': 4.391448816095492e-06, 'epochs': 76, 'loss': 'mae', 'optimizer': 'adam', 'graph_mode': 'cutoff', 'cutoff': 0.6941392513907154, 'grm_norm': 'cosine', 'self_loops': True, 'use_snp_selection': True, 'num_snps': 56749}. Best is trial 51 with value: 0.24954735194865255.
[I 2025-11-13 02:41:50,598] Trial 60 finished with value: 0.22992501204505675 and parameters: {'model_type': 'graphsage', 'hidden_dims': '[512, 64]', 'dropout': 0.15537256672755995, 'batch_norm': True, 'lr': 0.00017655659769979265, 'weight_decay': 8.994739789483881e-06, 'epochs': 50, 'loss': 'mse', 'optimizer': 'adam', 'graph_mode': 'cutoff', 'cutoff': 0.6950555103328601, 'grm_norm': 'cosine', 'self_loops': True, 'use_snp_selection': False}. Best is trial 51 with value: 0.24954735194865255.
[I 2025-11-13 02:43:52,475] Trial 61 finished with value: 0.23707643831392017 and parameters: {'model_type': 'graphsage', 'hidden_dims': '[512, 64]', 'dropout': 0.11613693494197266, 'batch_norm': False, 'lr': 0.00011998101587136077, 'weight_decay': 1.914964150772853e-05, 'epochs': 112, 'loss': 'mae', 'optimizer': 'adam', 'graph_mode': 'cutoff', 'cutoff': 0.6380493836327663, 'grm_norm': 'cosine', 'self_loops': True, 'use_snp_selection': True, 'num_snps': 51782}. Best is trial 51 with value: 0.24954735194865255.
[I 2025-11-13 02:45:43,944] Trial 62 finished with value: 0.2428804172384233 and parameters: {'model_type': 'graphsage', 'hidden_dims': '[512, 64]', 'dropout': 0.14445787553919168, 'batch_norm': False, 'lr': 6.396238801926342e-05, 'weight_decay': 6.722828814422879e-06, 'epochs': 89, 'loss': 'mae', 'optimizer': 'adam', 'graph_mode': 'cutoff', 'cutoff': 0.708356195642079, 'grm_norm': 'cosine', 'self_loops': True, 'use_snp_selection': True, 'num_snps': 50576}. Best is trial 51 with value: 0.24954735194865255.
[I 2025-11-13 02:47:37,563] Trial 63 finished with value: 0.2446407987205251 and parameters: {'model_type': 'graphsage', 'hidden_dims': '[512, 64]', 'dropout': 0.1660003673526724, 'batch_norm': False, 'lr': 5.4685789423233714e-05, 'weight_decay': 7.011992373440553e-06, 'epochs': 86, 'loss': 'mae', 'optimizer': 'adam', 'graph_mode': 'cutoff', 'cutoff': 0.7098046782686297, 'grm_norm': 'cosine', 'self_loops': True, 'use_snp_selection': True, 'num_snps': 55959}. Best is trial 51 with value: 0.24954735194865255.
[I 2025-11-13 02:49:53,585] Trial 64 finished with value: 0.23898160569021595 and parameters: {'model_type': 'graphsage', 'hidden_dims': '[512, 64]', 'dropout': 0.186474854872763, 'batch_norm': False, 'lr': 8.276987507791492e-05, 'weight_decay': 2.588234407337082e-06, 'epochs': 122, 'loss': 'mae', 'optimizer': 'adam', 'graph_mode': 'cutoff', 'cutoff': 0.756506562197904, 'grm_norm': 'cosine', 'self_loops': True, 'use_snp_selection': True, 'num_snps': 57820}. Best is trial 51 with value: 0.24954735194865255.
[I 2025-11-13 02:51:38,667] Trial 65 finished with value: 0.23754701584388643 and parameters: {'model_type': 'graphsage', 'hidden_dims': '[512, 64]', 'dropout': 0.2679107987449041, 'batch_norm': False, 'lr': 5.332005571022969e-05, 'weight_decay': 1.1178316153105664e-05, 'epochs': 76, 'loss': 'mae', 'optimizer': 'adam', 'graph_mode': 'cutoff', 'cutoff': 0.673399081359781, 'grm_norm': 'cosine', 'self_loops': True, 'use_snp_selection': True, 'num_snps': 52749}. Best is trial 51 with value: 0.24954735194865255.
[I 2025-11-13 02:53:35,176] Trial 66 finished with value: 0.24950395979173576 and parameters: {'model_type': 'graphsage', 'hidden_dims': '[512, 64]', 'dropout': 0.2031711704707359, 'batch_norm': False, 'lr': 9.859523857818363e-05, 'weight_decay': 1.7003446598699953e-06, 'epochs': 92, 'loss': 'mae', 'optimizer': 'adam', 'graph_mode': 'cutoff', 'cutoff': 0.7109323985092523, 'grm_norm': 'cosine', 'self_loops': True, 'use_snp_selection': True, 'num_snps': 56161}. Best is trial 51 with value: 0.24954735194865255.
[I 2025-11-13 02:55:11,951] Trial 67 finished with value: 0.23113988204969957 and parameters: {'model_type': 'graphsage', 'hidden_dims': '[256, 128, 64]', 'dropout': 0.3171179506300638, 'batch_norm': False, 'lr': 0.00010352722757438875, 'weight_decay': 1.5015918284429626e-06, 'epochs': 91, 'loss': 'mae', 'optimizer': 'adam', 'graph_mode': 'cutoff', 'cutoff': 0.7206844562876648, 'grm_norm': 'cosine', 'self_loops': True, 'use_snp_selection': True, 'num_snps': 59747}. Best is trial 51 with value: 0.24954735194865255.
[I 2025-11-13 02:57:28,963] Trial 68 finished with value: 0.10715847253489601 and parameters: {'model_type': 'graphsage', 'hidden_dims': '[512, 64]', 'dropout': 0.20558356297188093, 'batch_norm': False, 'lr': 0.00016566657803528717, 'weight_decay': 5.790592256552574e-07, 'epochs': 69, 'loss': 'mae', 'optimizer': 'adam', 'graph_mode': 'knn', 'source': 'grm', 'knn_k': 8, 'weighted_edges': False, 'symmetrize_mode': 'mutual', 'use_snp_selection': True, 'num_snps': 56434}. Best is trial 51 with value: 0.24954735194865255.
[I 2025-11-13 02:58:59,434] Trial 69 finished with value: 0.23344564406531862 and parameters: {'model_type': 'graphsage', 'hidden_dims': '[512, 128]', 'dropout': 0.16550915764398952, 'batch_norm': False, 'lr': 3.8389308142931244e-05, 'weight_decay': 4.5820116732114014e-06, 'epochs': 57, 'loss': 'mae', 'optimizer': 'adam', 'graph_mode': 'cutoff', 'cutoff': 0.6421342789703072, 'grm_norm': 'cosine', 'self_loops': True, 'use_snp_selection': True, 'num_snps': 47774}. Best is trial 51 with value: 0.24954735194865255.
[I 2025-11-13 02:59:44,365] Trial 70 finished with value: 0.1701385883637459 and parameters: {'model_type': 'graphsage', 'hidden_dims': '[512, 64]', 'dropout': 0.23263285420266128, 'batch_norm': False, 'lr': 8.167812514476436e-05, 'weight_decay': 2.0040923678331276e-06, 'epochs': 83, 'loss': 'mae', 'optimizer': 'adam', 'graph_mode': 'cutoff', 'cutoff': 0.6105678935642928, 'grm_norm': 'cosine_then_gcn', 'self_loops': True, 'use_snp_selection': True, 'num_snps': 2737}. Best is trial 51 with value: 0.24954735194865255.
[I 2025-11-13 03:01:37,836] Trial 71 finished with value: 0.23866501027831344 and parameters: {'model_type': 'graphsage', 'hidden_dims': '[512, 64]', 'dropout': 0.16342585240443028, 'batch_norm': False, 'lr': 5.557083442833168e-05, 'weight_decay': 3.662229512549127e-06, 'epochs': 97, 'loss': 'mae', 'optimizer': 'adam', 'graph_mode': 'cutoff', 'cutoff': 0.7653685739326104, 'grm_norm': 'cosine', 'self_loops': True, 'use_snp_selection': True, 'num_snps': 51984}. Best is trial 51 with value: 0.24954735194865255.
[I 2025-11-13 03:04:01,251] Trial 72 finished with value: 0.23598995872826967 and parameters: {'model_type': 'graphsage', 'hidden_dims': '[512, 64]', 'dropout': 0.1812095191940366, 'batch_norm': False, 'lr': 7.257567461934345e-05, 'weight_decay': 6.306521932351057e-06, 'epochs': 148, 'loss': 'mae', 'optimizer': 'adam', 'graph_mode': 'cutoff', 'cutoff': 0.6833211727145507, 'grm_norm': 'cosine', 'self_loops': True, 'use_snp_selection': True, 'num_snps': 55334}. Best is trial 51 with value: 0.24954735194865255.
[I 2025-11-13 03:05:39,294] Trial 73 finished with value: 0.23059760353866343 and parameters: {'model_type': 'graphsage', 'hidden_dims': '[512, 64]', 'dropout': 0.19642059224737052, 'batch_norm': False, 'lr': 0.00011080884653155017, 'weight_decay': 2.766063261703621e-06, 'epochs': 70, 'loss': 'mae', 'optimizer': 'adam', 'graph_mode': 'cutoff', 'cutoff': 0.7229198499129508, 'grm_norm': 'cosine', 'self_loops': True, 'use_snp_selection': True, 'num_snps': 49553}. Best is trial 51 with value: 0.24954735194865255.
