[I 2025-11-03 13:25:31,837] Trial 137 finished with value: 0.04611266786152062 and parameters: {'model_type': 'gcn', 'hidden_dims': '[256, 128]', 'dropout': 0.3510289313673852, 'batch_norm': True, 'lr': 0.00039323753581725103, 'weight_decay': 1.5447603723519274e-06, 'epochs': 277, 'loss': 'mae', 'optimizer': 'adam', 'graph_mode': 'knn', 'source': 'grm', 'knn_k': 10, 'weighted_edges': False, 'symmetrize_mode': 'mutual', 'use_snp_selection': False}. Best is trial 53 with value: 0.12552284880403508.
[I 2025-11-03 13:25:34,604] Trial 138 finished with value: 0.08340382060166046 and parameters: {'model_type': 'gcn', 'hidden_dims': '[256, 128]', 'dropout': 0.36820248252066184, 'batch_norm': True, 'lr': 8.564853425769897e-05, 'weight_decay': 2.179235339788311e-06, 'epochs': 330, 'loss': 'mae', 'optimizer': 'adam', 'graph_mode': 'knn', 'source': 'grm', 'knn_k': 1, 'weighted_edges': False, 'symmetrize_mode': 'mutual', 'use_snp_selection': False}. Best is trial 53 with value: 0.12552284880403508.
[I 2025-11-03 13:25:37,241] Trial 139 finished with value: 0.06344367698898712 and parameters: {'model_type': 'gcn', 'hidden_dims': '[256, 128]', 'dropout': 0.24064313688523217, 'batch_norm': True, 'lr': 0.0003237929286997719, 'weight_decay': 3.445341288090918e-06, 'epochs': 303, 'loss': 'mae', 'optimizer': 'adam', 'graph_mode': 'knn', 'source': 'grm', 'knn_k': 1, 'weighted_edges': False, 'symmetrize_mode': 'union', 'use_snp_selection': False}. Best is trial 53 with value: 0.12552284880403508.
[I 2025-11-03 13:25:39,851] Trial 140 finished with value: 0.07082671206144907 and parameters: {'model_type': 'gcn', 'hidden_dims': '[256, 128]', 'dropout': 0.32659494946315115, 'batch_norm': True, 'lr': 0.00046019192977393074, 'weight_decay': 1.1009387819363135e-06, 'epochs': 294, 'loss': 'mae', 'optimizer': 'adam', 'graph_mode': 'knn', 'source': 'grm', 'knn_k': 2, 'weighted_edges': False, 'symmetrize_mode': 'mutual', 'use_snp_selection': False}. Best is trial 53 with value: 0.12552284880403508.
[I 2025-11-03 13:25:42,283] Trial 141 finished with value: 0.10835603358364433 and parameters: {'model_type': 'gcn', 'hidden_dims': '[256, 128]', 'dropout': 0.19871517675016326, 'batch_norm': True, 'lr': 0.000860257423609613, 'weight_decay': 2.4172201395820114e-06, 'epochs': 260, 'loss': 'mae', 'optimizer': 'adam', 'graph_mode': 'knn', 'source': 'grm', 'knn_k': 1, 'weighted_edges': False, 'symmetrize_mode': 'mutual', 'use_snp_selection': False}. Best is trial 53 with value: 0.12552284880403508.
[I 2025-11-03 13:25:45,635] Trial 142 finished with value: 0.10776570971161335 and parameters: {'model_type': 'gcn', 'hidden_dims': '[512, 128]', 'dropout': 0.36023903145520175, 'batch_norm': True, 'lr': 0.0005346982705231479, 'weight_decay': 3.990440327833729e-06, 'epochs': 272, 'loss': 'mae', 'optimizer': 'adam', 'graph_mode': 'knn', 'source': 'grm', 'knn_k': 1, 'weighted_edges': False, 'symmetrize_mode': 'mutual', 'use_snp_selection': False}. Best is trial 53 with value: 0.12552284880403508.
[I 2025-11-03 13:25:48,052] Trial 143 finished with value: 0.10859705598818377 and parameters: {'model_type': 'gcn', 'hidden_dims': '[256, 128]', 'dropout': 0.12681463550844607, 'batch_norm': True, 'lr': 0.0006684816117146308, 'weight_decay': 1.3749179254375784e-06, 'epochs': 255, 'loss': 'mae', 'optimizer': 'adam', 'graph_mode': 'knn', 'source': 'grm', 'knn_k': 1, 'weighted_edges': False, 'symmetrize_mode': 'mutual', 'use_snp_selection': False}. Best is trial 53 with value: 0.12552284880403508.
[I 2025-11-03 13:25:50,162] Trial 144 finished with value: 0.10260137776327806 and parameters: {'model_type': 'gcn', 'hidden_dims': '[512, 64]', 'dropout': 0.3438421844178577, 'batch_norm': True, 'lr': 0.0007908521773469285, 'weight_decay': 1.7329476341758578e-06, 'epochs': 102, 'loss': 'mae', 'optimizer': 'adam', 'graph_mode': 'knn', 'source': 'grm', 'knn_k': 1, 'weighted_edges': False, 'symmetrize_mode': 'mutual', 'use_snp_selection': False}. Best is trial 53 with value: 0.12552284880403508.
[I 2025-11-03 13:25:53,583] Trial 145 finished with value: 0.11575345223587558 and parameters: {'model_type': 'gcn', 'hidden_dims': '[512, 128]', 'dropout': 0.2521424512162881, 'batch_norm': True, 'lr': 0.0006056201821552863, 'weight_decay': 3.1299927441435874e-06, 'epochs': 282, 'loss': 'mae', 'optimizer': 'adam', 'graph_mode': 'knn', 'source': 'grm', 'knn_k': 1, 'weighted_edges': False, 'symmetrize_mode': 'mutual', 'use_snp_selection': False}. Best is trial 53 with value: 0.12552284880403508.
[I 2025-11-03 13:25:57,001] Trial 146 finished with value: 0.10447559103359194 and parameters: {'model_type': 'gcn', 'hidden_dims': '[512, 128]', 'dropout': 0.28036395935259967, 'batch_norm': True, 'lr': 0.0004244562717306314, 'weight_decay': 2.969597751934205e-06, 'epochs': 280, 'loss': 'mae', 'optimizer': 'adam', 'graph_mode': 'knn', 'source': 'grm', 'knn_k': 1, 'weighted_edges': False, 'symmetrize_mode': 'mutual', 'use_snp_selection': False}. Best is trial 53 with value: 0.12552284880403508.
[I 2025-11-03 13:26:00,474] Trial 147 finished with value: 0.08456533627338615 and parameters: {'model_type': 'gcn', 'hidden_dims': '[512, 128]', 'dropout': 0.2553114860975785, 'batch_norm': True, 'lr': 0.0006003776627690121, 'weight_decay': 2.154253602417575e-06, 'epochs': 288, 'loss': 'mae', 'optimizer': 'adam', 'graph_mode': 'knn', 'source': 'grm', 'knn_k': 2, 'weighted_edges': False, 'symmetrize_mode': 'mutual', 'use_snp_selection': False}. Best is trial 53 with value: 0.12552284880403508.
[I 2025-11-03 13:26:04,009] Trial 148 finished with value: 0.1134159389863892 and parameters: {'model_type': 'gcn', 'hidden_dims': '[512, 128]', 'dropout': 0.21938203519823835, 'batch_norm': True, 'lr': 0.0005051066447276463, 'weight_decay': 2.513331374431137e-06, 'epochs': 298, 'loss': 'mae', 'optimizer': 'adam', 'graph_mode': 'knn', 'source': 'grm', 'knn_k': 1, 'weighted_edges': False, 'symmetrize_mode': 'mutual', 'use_snp_selection': False}. Best is trial 53 with value: 0.12552284880403508.
[I 2025-11-03 13:26:08,852] Trial 149 finished with value: 0.08704353432358632 and parameters: {'model_type': 'gcn', 'hidden_dims': '[512, 128]', 'dropout': 0.21259824591293897, 'batch_norm': False, 'lr': 0.00025498818771274513, 'weight_decay': 1.7992144410192588e-06, 'epochs': 310, 'loss': 'mae', 'optimizer': 'adam', 'graph_mode': 'knn', 'source': 'grm', 'knn_k': 1, 'weighted_edges': False, 'symmetrize_mode': 'mutual', 'use_snp_selection': True, 'num_snps': 50330}. Best is trial 53 with value: 0.12552284880403508.
[I 2025-11-03 13:26:11,063] Trial 0 finished with value: -0.04826954302129407 and parameters: {'model_type': 'gcn', 'hidden_dims': '[128, 64]', 'dropout': 0.199031432379812, 'batch_norm': True, 'lr': 1.8408544111075837e-06, 'weight_decay': 5.5136510071208614e-05, 'epochs': 334, 'loss': 'mae', 'optimizer': 'adam', 'graph_mode': 'knn', 'source': 'grm', 'knn_k': 8, 'weighted_edges': True, 'symmetrize_mode': 'mutual', 'use_snp_selection': False}. Best is trial 0 with value: -0.04826954302129407.
[I 2025-11-03 13:26:12,218] Trial 1 finished with value: -0.029237797064871618 and parameters: {'model_type': 'gcn', 'hidden_dims': '[128, 64]', 'dropout': 0.40051947670227217, 'batch_norm': True, 'lr': 0.0005320428882732732, 'weight_decay': 1.89210117736594e-06, 'epochs': 32, 'loss': 'mse', 'optimizer': 'adam', 'graph_mode': 'knn', 'source': 'grm', 'knn_k': 7, 'weighted_edges': True, 'symmetrize_mode': 'union', 'use_snp_selection': False}. Best is trial 1 with value: -0.029237797064871618.
[I 2025-11-03 13:26:14,572] Trial 2 finished with value: 0.007441450461003887 and parameters: {'model_type': 'gcn', 'hidden_dims': '[256, 128]', 'dropout': 0.5105528289184642, 'batch_norm': False, 'lr': 0.0006804279372404962, 'weight_decay': 0.0008922815224257085, 'epochs': 160, 'loss': 'mse', 'optimizer': 'adam', 'graph_mode': 'cutoff', 'cutoff': 0.5741905641612706, 'grm_norm': 'gcn', 'self_loops': False, 'use_snp_selection': True, 'num_snps': 26910}. Best is trial 2 with value: 0.007441450461003887.
[I 2025-11-03 13:26:17,010] Trial 3 finished with value: 0.015528274951822019 and parameters: {'model_type': 'gcn', 'hidden_dims': '[256, 128, 64]', 'dropout': 0.5390483213624292, 'batch_norm': False, 'lr': 3.4705625989073525e-05, 'weight_decay': 2.4623319020131338e-05, 'epochs': 92, 'loss': 'mse', 'optimizer': 'adam', 'graph_mode': 'knn', 'source': 'grm', 'knn_k': 6, 'weighted_edges': False, 'symmetrize_mode': 'mutual', 'use_snp_selection': True, 'num_snps': 30713}. Best is trial 3 with value: 0.015528274951822019.
[I 2025-11-03 13:26:19,496] Trial 4 finished with value: 0.04052943972242491 and parameters: {'model_type': 'gcn', 'hidden_dims': '[128, 64]', 'dropout': 0.13404863676897502, 'batch_norm': False, 'lr': 0.0001431556295367288, 'weight_decay': 2.2084517750726675e-05, 'epochs': 13, 'loss': 'mae', 'optimizer': 'adam', 'graph_mode': 'cutoff', 'cutoff': 0.6714268476993044, 'grm_norm': 'none', 'self_loops': False, 'use_snp_selection': True, 'num_snps': 45645}. Best is trial 4 with value: 0.04052943972242491.
[I 2025-11-03 13:26:22,453] Trial 5 finished with value: -0.02350471123153081 and parameters: {'model_type': 'gcn', 'hidden_dims': '[256, 128]', 'dropout': 0.42253606323412096, 'batch_norm': False, 'lr': 4.238630400638805e-05, 'weight_decay': 8.074086040046576e-07, 'epochs': 134, 'loss': 'mae', 'optimizer': 'adam', 'graph_mode': 'knn', 'source': 'grm', 'knn_k': 1, 'weighted_edges': False, 'symmetrize_mode': 'mutual', 'use_snp_selection': True, 'num_snps': 43113}. Best is trial 4 with value: 0.04052943972242491.
[I 2025-11-03 13:26:25,252] Trial 6 finished with value: -0.007697189551657669 and parameters: {'model_type': 'gcn', 'hidden_dims': '[512, 256]', 'dropout': 0.3534893146320237, 'batch_norm': True, 'lr': 0.000251307964226932, 'weight_decay': 1.821819791794022e-05, 'epochs': 207, 'loss': 'mae', 'optimizer': 'adam', 'graph_mode': 'knn', 'source': 'grm', 'knn_k': 1, 'weighted_edges': True, 'symmetrize_mode': 'mutual', 'use_snp_selection': False}. Best is trial 4 with value: 0.04052943972242491.
[I 2025-11-03 13:26:27,679] Trial 7 finished with value: -0.033334586687265556 and parameters: {'model_type': 'gcn', 'hidden_dims': '[512, 256]', 'dropout': 0.1105825955860775, 'batch_norm': True, 'lr': 2.374338412754043e-05, 'weight_decay': 1.1284721123340274e-05, 'epochs': 170, 'loss': 'mse', 'optimizer': 'adam', 'graph_mode': 'cutoff', 'cutoff': 0.719872204109604, 'grm_norm': 'gcn', 'self_loops': False, 'use_snp_selection': False}. Best is trial 4 with value: 0.04052943972242491.
[I 2025-11-03 13:26:29,590] Trial 8 finished with value: -0.02872756578345041 and parameters: {'model_type': 'gcn', 'hidden_dims': '[512, 128]', 'dropout': 0.5066580418354021, 'batch_norm': True, 'lr': 0.00039213678276659976, 'weight_decay': 3.43655320802934e-06, 'epochs': 91, 'loss': 'mse', 'optimizer': 'adam', 'graph_mode': 'cutoff', 'cutoff': 0.34923059576505366, 'grm_norm': 'cosine', 'self_loops': True, 'use_snp_selection': False}. Best is trial 4 with value: 0.04052943972242491.
[I 2025-11-03 13:26:31,365] Trial 9 finished with value: -0.012306700477084043 and parameters: {'model_type': 'gcn', 'hidden_dims': '[512, 256]', 'dropout': 0.301734920240333, 'batch_norm': False, 'lr': 6.650961854953448e-06, 'weight_decay': 6.861575656590315e-05, 'epochs': 125, 'loss': 'mae', 'optimizer': 'adam', 'graph_mode': 'cutoff', 'cutoff': 0.2857569870061939, 'grm_norm': 'cosine_then_gcn', 'self_loops': False, 'use_snp_selection': True, 'num_snps': 12722}. Best is trial 4 with value: 0.04052943972242491.
[I 2025-11-03 13:26:34,542] Trial 10 finished with value: 0.0060740004646108025 and parameters: {'model_type': 'gcn', 'hidden_dims': '[512, 64]', 'dropout': 0.22492338276159776, 'batch_norm': False, 'lr': 0.0001423376118846038, 'weight_decay': 1.8772904431456567e-07, 'epochs': 2, 'loss': 'mae', 'optimizer': 'adam', 'graph_mode': 'cutoff', 'cutoff': 0.8740100033033126, 'grm_norm': 'none', 'self_loops': True, 'use_snp_selection': True, 'num_snps': 58960}. Best is trial 4 with value: 0.04052943972242491.
[I 2025-11-03 13:26:37,176] Trial 11 finished with value: 0.00223993450564331 and parameters: {'model_type': 'gcn', 'hidden_dims': '[256, 128, 64]', 'dropout': 0.5994089069221873, 'batch_norm': False, 'lr': 8.25287866247181e-05, 'weight_decay': 0.0002205522163250003, 'epochs': 62, 'loss': 'mse', 'optimizer': 'adam', 'graph_mode': 'knn', 'source': 'grm', 'knn_k': 5, 'weighted_edges': False, 'symmetrize_mode': 'union', 'use_snp_selection': True, 'num_snps': 38963}. Best is trial 4 with value: 0.04052943972242491.
[I 2025-11-03 13:26:40,209] Trial 12 finished with value: -0.027919242615902635 and parameters: {'model_type': 'gcn', 'hidden_dims': '[256, 128, 64]', 'dropout': 0.10852296509461337, 'batch_norm': False, 'lr': 1.6075293249126023e-05, 'weight_decay': 4.159401756974879e-05, 'epochs': 248, 'loss': 'mae', 'optimizer': 'adam', 'graph_mode': 'cutoff', 'cutoff': 0.5157485749757097, 'grm_norm': 'none', 'self_loops': False, 'use_snp_selection': True, 'num_snps': 30790}. Best is trial 4 with value: 0.04052943972242491.
[I 2025-11-03 13:26:43,385] Trial 13 finished with value: 0.025025824228632657 and parameters: {'model_type': 'gcn', 'hidden_dims': '[256, 128, 64]', 'dropout': 0.5843082786028272, 'batch_norm': False, 'lr': 6.992587711753594e-05, 'weight_decay': 4.973467440708404e-06, 'epochs': 75, 'loss': 'mse', 'optimizer': 'adam', 'graph_mode': 'knn', 'source': 'grm', 'knn_k': 10, 'weighted_edges': False, 'symmetrize_mode': 'mutual', 'use_snp_selection': True, 'num_snps': 51436}. Best is trial 4 with value: 0.04052943972242491.
[I 2025-11-03 13:26:46,335] Trial 14 finished with value: -0.01267500471660929 and parameters: {'model_type': 'gcn', 'hidden_dims': '[128, 64]', 'dropout': 0.24316934080553204, 'batch_norm': False, 'lr': 9.238743634692461e-05, 'weight_decay': 6.0945412729314386e-06, 'epochs': 2, 'loss': 'mse', 'optimizer': 'adam', 'graph_mode': 'knn', 'source': 'grm', 'knn_k': 10, 'weighted_edges': False, 'symmetrize_mode': 'mutual', 'use_snp_selection': True, 'num_snps': 56909}. Best is trial 4 with value: 0.04052943972242491.
[I 2025-11-03 13:26:49,417] Trial 15 finished with value: 0.013597958159802796 and parameters: {'model_type': 'gcn', 'hidden_dims': '[512, 128]', 'dropout': 0.4415894205552803, 'batch_norm': False, 'lr': 6.9082542699866905e-06, 'weight_decay': 6.59480505877962e-07, 'epochs': 54, 'loss': 'mae', 'optimizer': 'adam', 'graph_mode': 'cutoff', 'cutoff': 0.7131101985219542, 'grm_norm': 'none', 'self_loops': False, 'use_snp_selection': True, 'num_snps': 48225}. Best is trial 4 with value: 0.04052943972242491.
[I 2025-11-03 13:26:52,736] Trial 16 finished with value: 0.024797241843013053 and parameters: {'model_type': 'gcn', 'hidden_dims': '[512, 64]', 'dropout': 0.31536693753197936, 'batch_norm': False, 'lr': 0.0001825016137783301, 'weight_decay': 0.000271384229586158, 'epochs': 93, 'loss': 'mse', 'optimizer': 'adam', 'graph_mode': 'cutoff', 'cutoff': 0.4985514132192289, 'grm_norm': 'cosine_then_gcn', 'self_loops': True, 'use_snp_selection': True, 'num_snps': 48328}. Best is trial 4 with value: 0.04052943972242491.
[I 2025-11-03 13:26:56,664] Trial 17 finished with value: -0.005777453085306427 and parameters: {'model_type': 'gcn', 'hidden_dims': '[256, 128, 64]', 'dropout': 0.17496504050409165, 'batch_norm': False, 'lr': 6.668041820415202e-05, 'weight_decay': 1.1595986771254326e-07, 'epochs': 229, 'loss': 'mae', 'optimizer': 'adam', 'graph_mode': 'knn', 'source': 'grm', 'knn_k': 10, 'weighted_edges': False, 'symmetrize_mode': 'union', 'use_snp_selection': True, 'num_snps': 50952}. Best is trial 4 with value: 0.04052943972242491.
[I 2025-11-03 13:26:58,985] Trial 18 finished with value: 0.002931934077056946 and parameters: {'model_type': 'gcn', 'hidden_dims': '[128, 64]', 'dropout': 0.5776808677194396, 'batch_norm': False, 'lr': 8.344497563667692e-06, 'weight_decay': 1.7234010301021283e-06, 'epochs': 41, 'loss': 'mse', 'optimizer': 'adam', 'graph_mode': 'cutoff', 'cutoff': 0.8946538684684766, 'grm_norm': 'cosine', 'self_loops': False, 'use_snp_selection': True, 'num_snps': 37415}. Best is trial 4 with value: 0.04052943972242491.
[I 2025-11-03 13:27:01,763] Trial 19 finished with value: -0.03088447110320511 and parameters: {'model_type': 'gcn', 'hidden_dims': '[256, 128, 64]', 'dropout': 0.2723583572331376, 'batch_norm': False, 'lr': 0.00027984093723113185, 'weight_decay': 5.4980640990494805e-06, 'epochs': 304, 'loss': 'mae', 'optimizer': 'adam', 'graph_mode': 'knn', 'source': 'grm', 'knn_k': 4, 'weighted_edges': False, 'symmetrize_mode': 'mutual', 'use_snp_selection': True, 'num_snps': 18039}. Best is trial 4 with value: 0.04052943972242491.
[I 2025-11-03 13:27:03,226] Trial 20 finished with value: 0.009949396425761536 and parameters: {'model_type': 'gcn', 'hidden_dims': '[128, 64]', 'dropout': 0.15319904921905894, 'batch_norm': False, 'lr': 0.00099921837741721, 'weight_decay': 0.00016956498764914208, 'epochs': 128, 'loss': 'mse', 'optimizer': 'adam', 'graph_mode': 'cutoff', 'cutoff': 0.705916671355068, 'grm_norm': 'none', 'self_loops': True, 'use_snp_selection': True, 'num_snps': 5460}. Best is trial 4 with value: 0.04052943972242491.
[I 2025-11-03 13:27:06,611] Trial 21 finished with value: -0.012211233565825257 and parameters: {'model_type': 'gcn', 'hidden_dims': '[512, 64]', 'dropout': 0.34157914742154605, 'batch_norm': False, 'lr': 0.00016793003902660844, 'weight_decay': 0.000899893878939857, 'epochs': 87, 'loss': 'mse', 'optimizer': 'adam', 'graph_mode': 'cutoff', 'cutoff': 0.4569711462862066, 'grm_norm': 'cosine_then_gcn', 'self_loops': True, 'use_snp_selection': True, 'num_snps': 50195}. Best is trial 4 with value: 0.04052943972242491.
[I 2025-11-03 13:27:09,374] Trial 22 finished with value: 0.03485584211451616 and parameters: {'model_type': 'gcn', 'hidden_dims': '[512, 64]', 'dropout': 0.47038403323697653, 'batch_norm': False, 'lr': 0.00015451700730912838, 'weight_decay': 0.0002293917129409824, 'epochs': 27, 'loss': 'mse', 'optimizer': 'adam', 'graph_mode': 'cutoff', 'cutoff': 0.6301237851716812, 'grm_norm': 'cosine_then_gcn', 'self_loops': True, 'use_snp_selection': True, 'num_snps': 44431}. Best is trial 4 with value: 0.04052943972242491.
[I 2025-11-03 13:27:12,065] Trial 23 finished with value: 0.0418498383745456 and parameters: {'model_type': 'gcn', 'hidden_dims': '[512, 64]', 'dropout': 0.4840543081260859, 'batch_norm': False, 'lr': 5.725990409015195e-05, 'weight_decay': 9.861049482873797e-05, 'epochs': 32, 'loss': 'mse', 'optimizer': 'adam', 'graph_mode': 'cutoff', 'cutoff': 0.5971780681455857, 'grm_norm': 'cosine_then_gcn', 'self_loops': True, 'use_snp_selection': True, 'num_snps': 41604}. Best is trial 23 with value: 0.0418498383745456.
[I 2025-11-03 13:27:14,617] Trial 24 finished with value: 0.012837345117893244 and parameters: {'model_type': 'gcn', 'hidden_dims': '[512, 64]', 'dropout': 0.46605303092321404, 'batch_norm': False, 'lr': 0.00011376939163260775, 'weight_decay': 0.0001361834253790684, 'epochs': 19, 'loss': 'mse', 'optimizer': 'adam', 'graph_mode': 'cutoff', 'cutoff': 0.636557309435743, 'grm_norm': 'cosine_then_gcn', 'self_loops': True, 'use_snp_selection': True, 'num_snps': 40699}. Best is trial 23 with value: 0.0418498383745456.
[I 2025-11-03 13:27:17,421] Trial 25 finished with value: 0.007190371291396763 and parameters: {'model_type': 'gcn', 'hidden_dims': '[512, 64]', 'dropout': 0.3778242430194832, 'batch_norm': False, 'lr': 4.498476612731105e-05, 'weight_decay': 0.0003967830339480108, 'epochs': 33, 'loss': 'mse', 'optimizer': 'adam', 'graph_mode': 'cutoff', 'cutoff': 0.6095312679605129, 'grm_norm': 'cosine_then_gcn', 'self_loops': True, 'use_snp_selection': True, 'num_snps': 44178}. Best is trial 23 with value: 0.0418498383745456.
[I 2025-11-03 13:27:19,954] Trial 26 finished with value: 0.04467868221728036 and parameters: {'model_type': 'gcn', 'hidden_dims': '[512, 64]', 'dropout': 0.4768939118868961, 'batch_norm': True, 'lr': 1.554499671120712e-05, 'weight_decay': 0.00012062329224636864, 'epochs': 54, 'loss': 'mae', 'optimizer': 'adam', 'graph_mode': 'cutoff', 'cutoff': 0.7843210603519077, 'grm_norm': 'cosine_then_gcn', 'self_loops': True, 'use_snp_selection': True, 'num_snps': 35041}. Best is trial 26 with value: 0.04467868221728036.
[I 2025-11-03 13:27:21,703] Trial 27 finished with value: -0.00603675314293433 and parameters: {'model_type': 'gcn', 'hidden_dims': '[512, 64]', 'dropout': 0.5088322986075096, 'batch_norm': True, 'lr': 1.6442414268425353e-05, 'weight_decay': 0.00010642299352450115, 'epochs': 57, 'loss': 'mae', 'optimizer': 'adam', 'graph_mode': 'cutoff', 'cutoff': 0.7785932937281026, 'grm_norm': 'cosine_then_gcn', 'self_loops': True, 'use_snp_selection': False}. Best is trial 26 with value: 0.04467868221728036.
[I 2025-11-03 13:27:23,489] Trial 28 finished with value: 0.004610482124787348 and parameters: {'model_type': 'gcn', 'hidden_dims': '[512, 64]', 'dropout': 0.541274110769517, 'batch_norm': True, 'lr': 2.8061425780502136e-06, 'weight_decay': 2.8820909233325547e-05, 'epochs': 2, 'loss': 'mae', 'optimizer': 'adam', 'graph_mode': 'cutoff', 'cutoff': 0.7850109434921815, 'grm_norm': 'none', 'self_loops': True, 'use_snp_selection': True, 'num_snps': 23502}. Best is trial 26 with value: 0.04467868221728036.
[I 2025-11-03 13:27:25,575] Trial 29 finished with value: 0.0040579389805499915 and parameters: {'model_type': 'gcn', 'hidden_dims': '[128, 64]', 'dropout': 0.44567601619587033, 'batch_norm': True, 'lr': 1.0893781950163453e-06, 'weight_decay': 4.809968751888188e-05, 'epochs': 334, 'loss': 'mae', 'optimizer': 'adam', 'graph_mode': 'cutoff', 'cutoff': 0.7982226986875172, 'grm_norm': 'cosine_then_gcn', 'self_loops': False, 'use_snp_selection': False}. Best is trial 26 with value: 0.04467868221728036.
