Running from this directory: /cluster/work/simennes/Project_thesis/Project_thesis
Name of job: nograph_ens
ID of job: 23199300
The job was run on these nodes: idun-06-03
[I 2025-11-03 11:42:21,355] Trial 0 finished with value: 0.025341719354605042 and parameters: {'model_type': 'gcn', 'hidden_dims': '[128, 64]', 'dropout': 0.199031432379812, 'batch_norm': True, 'lr': 1.8408544111075837e-06, 'weight_decay': 5.5136510071208614e-05, 'epochs': 336, 'loss': 'mae', 'optimizer': 'adam', 'graph_mode': 'off', 'use_snp_selection': True, 'num_snps': 43862}. Best is trial 0 with value: 0.025341719354605042.
[I 2025-11-03 11:42:22,760] Trial 1 finished with value: 0.0846899554999732 and parameters: {'model_type': 'gcn', 'hidden_dims': '[256, 128]', 'dropout': 0.4370668075331726, 'batch_norm': True, 'lr': 7.133471581159139e-05, 'weight_decay': 1.128633586803549e-05, 'epochs': 242, 'loss': 'mae', 'optimizer': 'adam', 'graph_mode': 'off', 'use_snp_selection': False}. Best is trial 1 with value: 0.0846899554999732.
[I 2025-11-03 11:42:23,828] Trial 2 finished with value: 0.011587092197413978 and parameters: {'model_type': 'gcn', 'hidden_dims': '[256, 128, 64]', 'dropout': 0.41314357415569625, 'batch_norm': False, 'lr': 3.952233718592101e-06, 'weight_decay': 0.00026754769258252603, 'epochs': 149, 'loss': 'mse', 'optimizer': 'adam', 'graph_mode': 'off', 'use_snp_selection': True, 'num_snps': 11571}. Best is trial 1 with value: 0.0846899554999732.
[I 2025-11-03 11:42:26,048] Trial 3 finished with value: 0.022034706463912503 and parameters: {'model_type': 'gcn', 'hidden_dims': '[512, 64]', 'dropout': 0.5938127374509361, 'batch_norm': False, 'lr': 5.67704586114731e-06, 'weight_decay': 2.4518087630137052e-05, 'epochs': 320, 'loss': 'mae', 'optimizer': 'adam', 'graph_mode': 'off', 'use_snp_selection': False}. Best is trial 1 with value: 0.0846899554999732.
[I 2025-11-03 11:42:28,077] Trial 4 finished with value: 0.029767795533398946 and parameters: {'model_type': 'gcn', 'hidden_dims': '[512, 128]', 'dropout': 0.25746343592134413, 'batch_norm': True, 'lr': 1.3467657668402788e-06, 'weight_decay': 0.00033087251918647806, 'epochs': 277, 'loss': 'mse', 'optimizer': 'adam', 'graph_mode': 'off', 'use_snp_selection': True, 'num_snps': 36675}. Best is trial 1 with value: 0.0846899554999732.
[I 2025-11-03 11:42:29,616] Trial 5 finished with value: 0.04469387937330139 and parameters: {'model_type': 'gcn', 'hidden_dims': '[512, 64]', 'dropout': 0.38275350994408375, 'batch_norm': True, 'lr': 1.5586664309232824e-06, 'weight_decay': 0.0008227664668621182, 'epochs': 145, 'loss': 'mae', 'optimizer': 'adam', 'graph_mode': 'off', 'use_snp_selection': True, 'num_snps': 32148}. Best is trial 1 with value: 0.0846899554999732.
[I 2025-11-03 11:42:30,835] Trial 6 finished with value: 0.013133812712649134 and parameters: {'model_type': 'gcn', 'hidden_dims': '[256, 128]', 'dropout': 0.3930109900265879, 'batch_norm': False, 'lr': 4.892964372128395e-05, 'weight_decay': 1.5809549317992182e-06, 'epochs': 199, 'loss': 'mse', 'optimizer': 'adam', 'graph_mode': 'off', 'use_snp_selection': False}. Best is trial 1 with value: 0.0846899554999732.
[I 2025-11-03 11:42:32,011] Trial 7 finished with value: 0.09425387973819666 and parameters: {'model_type': 'gcn', 'hidden_dims': '[512, 256]', 'dropout': 0.15343979219678458, 'batch_norm': True, 'lr': 6.234003099047341e-05, 'weight_decay': 3.894760610535477e-07, 'epochs': 97, 'loss': 'mse', 'optimizer': 'adam', 'graph_mode': 'off', 'use_snp_selection': False}. Best is trial 7 with value: 0.09425387973819666.
[I 2025-11-03 11:42:34,163] Trial 8 finished with value: 0.10392036548655172 and parameters: {'model_type': 'gcn', 'hidden_dims': '[512, 128]', 'dropout': 0.10743001231661406, 'batch_norm': True, 'lr': 0.00023728538449271062, 'weight_decay': 1.7629071578048637e-05, 'epochs': 312, 'loss': 'mae', 'optimizer': 'adam', 'graph_mode': 'off', 'use_snp_selection': False}. Best is trial 8 with value: 0.10392036548655172.
[I 2025-11-03 11:42:35,681] Trial 9 finished with value: 0.10403919304720848 and parameters: {'model_type': 'gcn', 'hidden_dims': '[512, 64]', 'dropout': 0.14505336736221927, 'batch_norm': True, 'lr': 5.8619638388111826e-05, 'weight_decay': 6.200156172669308e-07, 'epochs': 175, 'loss': 'mse', 'optimizer': 'adam', 'graph_mode': 'off', 'use_snp_selection': False}. Best is trial 9 with value: 0.10403919304720848.
[I 2025-11-03 11:42:36,624] Trial 10 finished with value: 0.0288313457734601 and parameters: {'model_type': 'gcn', 'hidden_dims': '[512, 64]', 'dropout': 0.2753166624526289, 'batch_norm': False, 'lr': 0.00032393778075602147, 'weight_decay': 1.1714031539166645e-07, 'epochs': 44, 'loss': 'mse', 'optimizer': 'adam', 'graph_mode': 'off', 'use_snp_selection': False}. Best is trial 9 with value: 0.10403919304720848.
[I 2025-11-03 11:42:38,358] Trial 11 finished with value: 0.11540115724208953 and parameters: {'model_type': 'gcn', 'hidden_dims': '[512, 128]', 'dropout': 0.10095648685224448, 'batch_norm': True, 'lr': 0.0007381466848241794, 'weight_decay': 1.969664044175748e-06, 'epochs': 216, 'loss': 'mae', 'optimizer': 'adam', 'graph_mode': 'off', 'use_snp_selection': False}. Best is trial 11 with value: 0.11540115724208953.
[I 2025-11-03 11:42:40,044] Trial 12 finished with value: 0.10477241852062773 and parameters: {'model_type': 'gcn', 'hidden_dims': '[512, 128]', 'dropout': 0.10344600881777158, 'batch_norm': True, 'lr': 0.0006753264773209732, 'weight_decay': 2.0975627484345868e-06, 'epochs': 208, 'loss': 'mae', 'optimizer': 'adam', 'graph_mode': 'off', 'use_snp_selection': False}. Best is trial 11 with value: 0.11540115724208953.
[I 2025-11-03 11:42:41,833] Trial 13 finished with value: 0.10730986411147869 and parameters: {'model_type': 'gcn', 'hidden_dims': '[512, 128]', 'dropout': 0.24637176605202246, 'batch_norm': True, 'lr': 0.0006882846823941375, 'weight_decay': 2.6819409307287284e-06, 'epochs': 236, 'loss': 'mae', 'optimizer': 'adam', 'graph_mode': 'off', 'use_snp_selection': False}. Best is trial 11 with value: 0.11540115724208953.
[I 2025-11-03 11:42:43,670] Trial 14 finished with value: 0.11730606755211875 and parameters: {'model_type': 'gcn', 'hidden_dims': '[512, 128]', 'dropout': 0.2896280300541336, 'batch_norm': True, 'lr': 0.0008799624705032788, 'weight_decay': 3.4312897322914332e-06, 'epochs': 249, 'loss': 'mae', 'optimizer': 'adam', 'graph_mode': 'off', 'use_snp_selection': False}. Best is trial 14 with value: 0.11730606755211875.
[I 2025-11-03 11:42:45,663] Trial 15 finished with value: 0.08191131352480534 and parameters: {'model_type': 'gcn', 'hidden_dims': '[512, 128]', 'dropout': 0.5175762982265439, 'batch_norm': True, 'lr': 0.00018429018027102802, 'weight_decay': 4.647398975110258e-06, 'epochs': 277, 'loss': 'mae', 'optimizer': 'adam', 'graph_mode': 'off', 'use_snp_selection': False}. Best is trial 14 with value: 0.11730606755211875.
[I 2025-11-03 11:42:47,336] Trial 16 finished with value: 0.017358461883103762 and parameters: {'model_type': 'gcn', 'hidden_dims': '[256, 128, 64]', 'dropout': 0.32783593338997624, 'batch_norm': True, 'lr': 1.3640696125628314e-05, 'weight_decay': 4.1729159046848005e-07, 'epochs': 258, 'loss': 'mae', 'optimizer': 'adam', 'graph_mode': 'off', 'use_snp_selection': False}. Best is trial 14 with value: 0.11730606755211875.
[I 2025-11-03 11:42:48,139] Trial 17 finished with value: 0.11871105602980027 and parameters: {'model_type': 'gcn', 'hidden_dims': '[128, 64]', 'dropout': 0.31793710483525317, 'batch_norm': True, 'lr': 0.000906375209920231, 'weight_decay': 4.9180078058170564e-05, 'epochs': 105, 'loss': 'mae', 'optimizer': 'adam', 'graph_mode': 'off', 'use_snp_selection': False}. Best is trial 17 with value: 0.11871105602980027.
[I 2025-11-03 11:42:49,791] Trial 18 finished with value: 0.04208792875297954 and parameters: {'model_type': 'gcn', 'hidden_dims': '[128, 64]', 'dropout': 0.32572477451298637, 'batch_norm': False, 'lr': 0.00016233944806321035, 'weight_decay': 7.197637349971629e-05, 'epochs': 94, 'loss': 'mae', 'optimizer': 'adam', 'graph_mode': 'off', 'use_snp_selection': True, 'num_snps': 58241}. Best is trial 17 with value: 0.11871105602980027.
[I 2025-11-03 11:42:50,449] Trial 19 finished with value: 0.046688898702167185 and parameters: {'model_type': 'gcn', 'hidden_dims': '[128, 64]', 'dropout': 0.4740850786520089, 'batch_norm': True, 'lr': 2.030728669224816e-05, 'weight_decay': 5.443668103051355e-05, 'epochs': 49, 'loss': 'mae', 'optimizer': 'adam', 'graph_mode': 'off', 'use_snp_selection': False}. Best is trial 17 with value: 0.11871105602980027.
[I 2025-11-03 11:42:51,632] Trial 20 finished with value: 0.11429689760485341 and parameters: {'model_type': 'gcn', 'hidden_dims': '[512, 256]', 'dropout': 0.29174091611568514, 'batch_norm': True, 'lr': 0.0003623883357900497, 'weight_decay': 5.665085537838559e-06, 'epochs': 99, 'loss': 'mae', 'optimizer': 'adam', 'graph_mode': 'off', 'use_snp_selection': False}. Best is trial 17 with value: 0.11871105602980027.
[I 2025-11-03 11:42:52,777] Trial 21 finished with value: 0.10479755753902621 and parameters: {'model_type': 'gcn', 'hidden_dims': '[128, 64]', 'dropout': 0.21138197306008916, 'batch_norm': True, 'lr': 0.000751929608577395, 'weight_decay': 9.224975761223073e-07, 'epochs': 224, 'loss': 'mae', 'optimizer': 'adam', 'graph_mode': 'off', 'use_snp_selection': False}. Best is trial 17 with value: 0.11871105602980027.
[I 2025-11-03 11:42:54,315] Trial 22 finished with value: 0.1056604217062243 and parameters: {'model_type': 'gcn', 'hidden_dims': '[512, 128]', 'dropout': 0.3522855124766425, 'batch_norm': True, 'lr': 0.0009194691183176393, 'weight_decay': 7.525760709471989e-06, 'epochs': 170, 'loss': 'mae', 'optimizer': 'adam', 'graph_mode': 'off', 'use_snp_selection': False}. Best is trial 17 with value: 0.11871105602980027.
[I 2025-11-03 11:42:55,639] Trial 23 finished with value: 0.10891628733583168 and parameters: {'model_type': 'gcn', 'hidden_dims': '[512, 128]', 'dropout': 0.2002560746211867, 'batch_norm': True, 'lr': 0.0004613461882338974, 'weight_decay': 1.7551965441394896e-07, 'epochs': 126, 'loss': 'mae', 'optimizer': 'adam', 'graph_mode': 'off', 'use_snp_selection': False}. Best is trial 17 with value: 0.11871105602980027.
[I 2025-11-03 11:42:56,902] Trial 24 finished with value: 0.10357840051933591 and parameters: {'model_type': 'gcn', 'hidden_dims': '[128, 64]', 'dropout': 0.30063216383746794, 'batch_norm': True, 'lr': 0.00012933696064794652, 'weight_decay': 2.6247792873177965e-05, 'epochs': 282, 'loss': 'mae', 'optimizer': 'adam', 'graph_mode': 'off', 'use_snp_selection': False}. Best is trial 17 with value: 0.11871105602980027.
[I 2025-11-03 11:42:58,475] Trial 25 finished with value: 0.10807023046045262 and parameters: {'model_type': 'gcn', 'hidden_dims': '[512, 128]', 'dropout': 0.23494314089343774, 'batch_norm': True, 'lr': 0.0009909150791604293, 'weight_decay': 3.838927328095876e-06, 'epochs': 174, 'loss': 'mae', 'optimizer': 'adam', 'graph_mode': 'off', 'use_snp_selection': False}. Best is trial 17 with value: 0.11871105602980027.
[I 2025-11-03 11:42:59,386] Trial 26 finished with value: 0.019662635316774757 and parameters: {'model_type': 'gcn', 'hidden_dims': '[256, 128]', 'dropout': 0.1545122911757531, 'batch_norm': False, 'lr': 0.0004341430898104752, 'weight_decay': 0.00015175755923235848, 'epochs': 212, 'loss': 'mae', 'optimizer': 'adam', 'graph_mode': 'off', 'use_snp_selection': True, 'num_snps': 3842}. Best is trial 17 with value: 0.11871105602980027.
[I 2025-11-03 11:43:01,054] Trial 27 finished with value: 0.09943710797512283 and parameters: {'model_type': 'gcn', 'hidden_dims': '[256, 128, 64]', 'dropout': 0.3572791604535832, 'batch_norm': True, 'lr': 0.00025274579924056085, 'weight_decay': 1.2214044978181781e-06, 'epochs': 258, 'loss': 'mae', 'optimizer': 'adam', 'graph_mode': 'off', 'use_snp_selection': False}. Best is trial 17 with value: 0.11871105602980027.
[I 2025-11-03 11:43:02,664] Trial 28 finished with value: 0.09639162162868131 and parameters: {'model_type': 'gcn', 'hidden_dims': '[512, 256]', 'dropout': 0.5034329047645976, 'batch_norm': True, 'lr': 0.0001045821895542795, 'weight_decay': 0.00011837572117061311, 'epochs': 185, 'loss': 'mae', 'optimizer': 'adam', 'graph_mode': 'off', 'use_snp_selection': False}. Best is trial 17 with value: 0.11871105602980027.
[I 2025-11-03 11:43:03,576] Trial 29 finished with value: 0.1004053435049181 and parameters: {'model_type': 'gcn', 'hidden_dims': '[128, 64]', 'dropout': 0.17538296762229866, 'batch_norm': True, 'lr': 0.0005388560200940643, 'weight_decay': 1.3473776012983157e-05, 'epochs': 74, 'loss': 'mae', 'optimizer': 'adam', 'graph_mode': 'off', 'use_snp_selection': True, 'num_snps': 19468}. Best is trial 17 with value: 0.11871105602980027.
[I 2025-11-03 11:43:04,460] Trial 30 finished with value: 0.10100744420937272 and parameters: {'model_type': 'gcn', 'hidden_dims': '[128, 64]', 'dropout': 0.4485007649909121, 'batch_norm': True, 'lr': 0.0003399202273108247, 'weight_decay': 3.900269913140492e-05, 'epochs': 128, 'loss': 'mae', 'optimizer': 'adam', 'graph_mode': 'off', 'use_snp_selection': False}. Best is trial 17 with value: 0.11871105602980027.
[I 2025-11-03 11:43:05,603] Trial 31 finished with value: 0.10519507463016119 and parameters: {'model_type': 'gcn', 'hidden_dims': '[512, 256]', 'dropout': 0.285245900890249, 'batch_norm': True, 'lr': 0.0004855410251867172, 'weight_decay': 6.296591801073234e-06, 'epochs': 81, 'loss': 'mae', 'optimizer': 'adam', 'graph_mode': 'off', 'use_snp_selection': False}. Best is trial 17 with value: 0.11871105602980027.
[I 2025-11-03 11:43:06,844] Trial 32 finished with value: 0.08873315856559942 and parameters: {'model_type': 'gcn', 'hidden_dims': '[512, 256]', 'dropout': 0.31707098400518785, 'batch_norm': True, 'lr': 0.000923606601512542, 'weight_decay': 9.466172013724439e-06, 'epochs': 108, 'loss': 'mae', 'optimizer': 'adam', 'graph_mode': 'off', 'use_snp_selection': False}. Best is trial 17 with value: 0.11871105602980027.
[I 2025-11-03 11:43:08,251] Trial 33 finished with value: 0.0983101637335319 and parameters: {'model_type': 'gcn', 'hidden_dims': '[512, 256]', 'dropout': 0.21302742992307394, 'batch_norm': True, 'lr': 0.00029506190379240057, 'weight_decay': 4.135013656806007e-06, 'epochs': 154, 'loss': 'mae', 'optimizer': 'adam', 'graph_mode': 'off', 'use_snp_selection': False}. Best is trial 17 with value: 0.11871105602980027.
[I 2025-11-03 11:43:09,275] Trial 34 finished with value: 0.08732337735071502 and parameters: {'model_type': 'gcn', 'hidden_dims': '[512, 256]', 'dropout': 0.3685687117236634, 'batch_norm': True, 'lr': 0.0005190051811150815, 'weight_decay': 2.297018513632334e-06, 'epochs': 62, 'loss': 'mae', 'optimizer': 'adam', 'graph_mode': 'off', 'use_snp_selection': False}. Best is trial 17 with value: 0.11871105602980027.
[I 2025-11-03 11:43:10,589] Trial 35 finished with value: 0.040761130219837766 and parameters: {'model_type': 'gcn', 'hidden_dims': '[512, 128]', 'dropout': 0.43024169205778806, 'batch_norm': False, 'lr': 0.00010745225742336623, 'weight_decay': 1.747908128558782e-05, 'epochs': 126, 'loss': 'mae', 'optimizer': 'adam', 'graph_mode': 'off', 'use_snp_selection': False}. Best is trial 17 with value: 0.11871105602980027.
[I 2025-11-03 11:43:12,831] Trial 36 finished with value: 0.0025872221150563405 and parameters: {'model_type': 'gcn', 'hidden_dims': '[256, 128]', 'dropout': 0.2611180657203019, 'batch_norm': True, 'lr': 3.7509529090214574e-06, 'weight_decay': 9.904908356402637e-07, 'epochs': 244, 'loss': 'mse', 'optimizer': 'adam', 'graph_mode': 'off', 'use_snp_selection': True, 'num_snps': 58661}. Best is trial 17 with value: 0.11871105602980027.
[I 2025-11-03 11:43:14,828] Trial 37 finished with value: 0.10784721763782137 and parameters: {'model_type': 'gcn', 'hidden_dims': '[256, 128, 64]', 'dropout': 0.5874252152201455, 'batch_norm': True, 'lr': 0.0002121049600646172, 'weight_decay': 2.98709803303029e-05, 'epochs': 336, 'loss': 'mae', 'optimizer': 'adam', 'graph_mode': 'off', 'use_snp_selection': False}. Best is trial 17 with value: 0.11871105602980027.
[I 2025-11-03 11:43:16,409] Trial 38 finished with value: 0.08400025910536899 and parameters: {'model_type': 'gcn', 'hidden_dims': '[512, 128]', 'dropout': 0.40191389286689494, 'batch_norm': False, 'lr': 0.0006415511890881762, 'weight_decay': 1.1083908093011498e-05, 'epochs': 300, 'loss': 'mse', 'optimizer': 'adam', 'graph_mode': 'off', 'use_snp_selection': True, 'num_snps': 19911}. Best is trial 17 with value: 0.11871105602980027.
[I 2025-11-03 11:43:17,852] Trial 39 finished with value: 0.10086287456434026 and parameters: {'model_type': 'gcn', 'hidden_dims': '[512, 256]', 'dropout': 0.29520205789306087, 'batch_norm': True, 'lr': 0.00036125177884362684, 'weight_decay': 0.000494866061743946, 'epochs': 154, 'loss': 'mae', 'optimizer': 'adam', 'graph_mode': 'off', 'use_snp_selection': False}. Best is trial 17 with value: 0.11871105602980027.
[I 2025-11-03 11:43:19,086] Trial 40 finished with value: 0.07632272520161883 and parameters: {'model_type': 'gcn', 'hidden_dims': '[256, 128]', 'dropout': 0.2261156351504495, 'batch_norm': True, 'lr': 3.0128907997420447e-05, 'weight_decay': 6.10965162373896e-06, 'epochs': 193, 'loss': 'mae', 'optimizer': 'adam', 'graph_mode': 'off', 'use_snp_selection': False}. Best is trial 17 with value: 0.11871105602980027.
[I 2025-11-03 11:43:20,295] Trial 41 finished with value: 0.1039583621632359 and parameters: {'model_type': 'gcn', 'hidden_dims': '[512, 128]', 'dropout': 0.1846948490324129, 'batch_norm': True, 'lr': 0.00042886826628376663, 'weight_decay': 1.0276581311489736e-07, 'epochs': 103, 'loss': 'mae', 'optimizer': 'adam', 'graph_mode': 'off', 'use_snp_selection': False}. Best is trial 17 with value: 0.11871105602980027.
[I 2025-11-03 11:43:21,597] Trial 42 finished with value: 0.11132222518882834 and parameters: {'model_type': 'gcn', 'hidden_dims': '[512, 128]', 'dropout': 0.13193906967780664, 'batch_norm': True, 'lr': 0.0009544437929457422, 'weight_decay': 2.1623380375768881e-07, 'epochs': 123, 'loss': 'mae', 'optimizer': 'adam', 'graph_mode': 'off', 'use_snp_selection': False}. Best is trial 17 with value: 0.11871105602980027.
[I 2025-11-03 11:43:22,823] Trial 43 finished with value: 0.11574755988948827 and parameters: {'model_type': 'gcn', 'hidden_dims': '[512, 128]', 'dropout': 0.1265319028360078, 'batch_norm': True, 'lr': 0.000737302867549087, 'weight_decay': 2.484734872917861e-07, 'epochs': 115, 'loss': 'mae', 'optimizer': 'adam', 'graph_mode': 'off', 'use_snp_selection': False}. Best is trial 17 with value: 0.11871105602980027.
[I 2025-11-03 11:43:23,928] Trial 44 finished with value: 0.12588276278015856 and parameters: {'model_type': 'gcn', 'hidden_dims': '[512, 64]', 'dropout': 0.1241532920605709, 'batch_norm': True, 'lr': 0.000652408484890337, 'weight_decay': 4.318824027196364e-07, 'epochs': 83, 'loss': 'mse', 'optimizer': 'adam', 'graph_mode': 'off', 'use_snp_selection': False}. Best is trial 44 with value: 0.12588276278015856.
[I 2025-11-03 11:43:25,023] Trial 45 finished with value: 0.11126078157519899 and parameters: {'model_type': 'gcn', 'hidden_dims': '[512, 64]', 'dropout': 0.1209637568453093, 'batch_norm': True, 'lr': 0.000643677615249708, 'weight_decay': 4.807613474074579e-07, 'epochs': 80, 'loss': 'mse', 'optimizer': 'adam', 'graph_mode': 'off', 'use_snp_selection': False}. Best is trial 44 with value: 0.12588276278015856.
[I 2025-11-03 11:43:26,392] Trial 46 finished with value: 0.0447419492715875 and parameters: {'model_type': 'gcn', 'hidden_dims': '[512, 64]', 'dropout': 0.1737583570625939, 'batch_norm': True, 'lr': 1.078169330471549e-05, 'weight_decay': 2.382469198766367e-07, 'epochs': 141, 'loss': 'mse', 'optimizer': 'adam', 'graph_mode': 'off', 'use_snp_selection': False}. Best is trial 44 with value: 0.12588276278015856.
[I 2025-11-03 11:43:27,387] Trial 47 finished with value: 0.017145769499298233 and parameters: {'model_type': 'gcn', 'hidden_dims': '[512, 64]', 'dropout': 0.10266468826594508, 'batch_norm': False, 'lr': 0.0007639156785244277, 'weight_decay': 6.32187915758664e-07, 'epochs': 61, 'loss': 'mse', 'optimizer': 'adam', 'graph_mode': 'off', 'use_snp_selection': False}. Best is trial 44 with value: 0.12588276278015856.
[I 2025-11-03 11:43:29,121] Trial 48 finished with value: 0.014504798237112216 and parameters: {'model_type': 'gcn', 'hidden_dims': '[512, 64]', 'dropout': 0.13026642538080246, 'batch_norm': True, 'lr': 1.1170552432785515e-06, 'weight_decay': 2.850260421384047e-07, 'epochs': 227, 'loss': 'mse', 'optimizer': 'adam', 'graph_mode': 'off', 'use_snp_selection': False}. Best is trial 44 with value: 0.12588276278015856.
[I 2025-11-03 11:43:31,452] Trial 49 finished with value: 0.09904330975521297 and parameters: {'model_type': 'gcn', 'hidden_dims': '[512, 128]', 'dropout': 0.15826111525110104, 'batch_norm': True, 'lr': 0.0002603228025170039, 'weight_decay': 1.303455376086353e-06, 'epochs': 248, 'loss': 'mse', 'optimizer': 'adam', 'graph_mode': 'off', 'use_snp_selection': True, 'num_snps': 46888}. Best is trial 44 with value: 0.12588276278015856.
[I 2025-11-03 11:43:32,722] Trial 50 finished with value: 0.06337098774718158 and parameters: {'model_type': 'gcn', 'hidden_dims': '[512, 128]', 'dropout': 0.12203299364668453, 'batch_norm': True, 'lr': 2.6693831717472616e-06, 'weight_decay': 7.18127330747754e-07, 'epochs': 115, 'loss': 'mse', 'optimizer': 'adam', 'graph_mode': 'off', 'use_snp_selection': False}. Best is trial 44 with value: 0.12588276278015856.
[I 2025-11-03 11:43:33,886] Trial 51 finished with value: 0.1246099616685408 and parameters: {'model_type': 'gcn', 'hidden_dims': '[512, 64]', 'dropout': 0.2664474411673027, 'batch_norm': True, 'lr': 0.0006318268740561307, 'weight_decay': 2.986458140002089e-06, 'epochs': 88, 'loss': 'mae', 'optimizer': 'adam', 'graph_mode': 'off', 'use_snp_selection': False}. Best is trial 44 with value: 0.12588276278015856.
