[I 2025-11-12 17:53:36,155] Trial 78 finished with value: 0.21628573887720512 and parameters: {'model_type': 'graphsage', 'hidden_dims': '[512, 64]', 'dropout': 0.15867460758770038, 'batch_norm': False, 'lr': 8.769419446933955e-05, 'weight_decay': 3.6099657782675613e-07, 'epochs': 90, 'loss': 'mse', 'optimizer': 'adam', 'graph_mode': 'cutoff', 'cutoff': 0.5371791019993027, 'grm_norm': 'cosine_then_gcn', 'self_loops': True, 'use_snp_selection': True, 'num_snps': 49950}. Best is trial 51 with value: 0.27300220176239537.
[I 2025-11-12 17:54:48,519] Trial 79 finished with value: 0.25393980492490875 and parameters: {'model_type': 'graphsage', 'hidden_dims': '[512, 64]', 'dropout': 0.11273869833773113, 'batch_norm': False, 'lr': 0.00013509774521453525, 'weight_decay': 1.807552891436314e-07, 'epochs': 64, 'loss': 'mae', 'optimizer': 'adam', 'graph_mode': 'cutoff', 'cutoff': 0.44373660453034525, 'grm_norm': 'cosine', 'self_loops': True, 'use_snp_selection': True, 'num_snps': 29051}. Best is trial 51 with value: 0.27300220176239537.
[I 2025-11-12 17:56:15,270] Trial 80 finished with value: 0.25726310118303514 and parameters: {'model_type': 'graphsage', 'hidden_dims': '[512, 256]', 'dropout': 0.13472632804474263, 'batch_norm': False, 'lr': 0.00011738011711957953, 'weight_decay': 5.241863863762482e-05, 'epochs': 54, 'loss': 'mae', 'optimizer': 'adam', 'graph_mode': 'cutoff', 'cutoff': 0.3636305805992252, 'grm_norm': 'gcn', 'self_loops': True, 'use_snp_selection': True, 'num_snps': 41768}. Best is trial 51 with value: 0.27300220176239537.
[I 2025-11-12 17:57:29,673] Trial 81 finished with value: 0.25616622502340664 and parameters: {'model_type': 'graphsage', 'hidden_dims': '[512, 64]', 'dropout': 0.2574262652402819, 'batch_norm': False, 'lr': 2.4668457165825973e-05, 'weight_decay': 1.7330902745456574e-06, 'epochs': 79, 'loss': 'mae', 'optimizer': 'adam', 'graph_mode': 'cutoff', 'cutoff': 0.33020251369352993, 'grm_norm': 'cosine_then_gcn', 'self_loops': True, 'use_snp_selection': True, 'num_snps': 25816}. Best is trial 51 with value: 0.27300220176239537.
[I 2025-11-12 17:58:49,784] Trial 82 finished with value: 0.267592142920629 and parameters: {'model_type': 'graphsage', 'hidden_dims': '[512, 128]', 'dropout': 0.18574545132717965, 'batch_norm': False, 'lr': 0.00029871323872329556, 'weight_decay': 2.3332105916647045e-05, 'epochs': 93, 'loss': 'mae', 'optimizer': 'adam', 'graph_mode': 'cutoff', 'cutoff': 0.28138904688054894, 'grm_norm': 'cosine_then_gcn', 'self_loops': True, 'use_snp_selection': True, 'num_snps': 23861}. Best is trial 51 with value: 0.27300220176239537.
[I 2025-11-12 18:00:11,008] Trial 83 finished with value: 0.25472280580105533 and parameters: {'model_type': 'graphsage', 'hidden_dims': '[512, 128]', 'dropout': 0.1912842900803309, 'batch_norm': False, 'lr': 0.00017758337748944965, 'weight_decay': 2.221470967184951e-05, 'epochs': 95, 'loss': 'mae', 'optimizer': 'adam', 'graph_mode': 'cutoff', 'cutoff': 0.2776399013617665, 'grm_norm': 'cosine_then_gcn', 'self_loops': True, 'use_snp_selection': True, 'num_snps': 23866}. Best is trial 51 with value: 0.27300220176239537.
[I 2025-11-12 18:01:24,141] Trial 84 finished with value: 0.2664130956725726 and parameters: {'model_type': 'graphsage', 'hidden_dims': '[512, 128]', 'dropout': 0.17028423421526495, 'batch_norm': False, 'lr': 0.000300004900446946, 'weight_decay': 3.8662242487716074e-05, 'epochs': 107, 'loss': 'mae', 'optimizer': 'adam', 'graph_mode': 'cutoff', 'cutoff': 0.3796566664669845, 'grm_norm': 'cosine_then_gcn', 'self_loops': True, 'use_snp_selection': True, 'num_snps': 21898}. Best is trial 51 with value: 0.27300220176239537.
[I 2025-11-12 18:02:50,289] Trial 85 finished with value: 0.258192349659407 and parameters: {'model_type': 'graphsage', 'hidden_dims': '[512, 128]', 'dropout': 0.14660892215283616, 'batch_norm': False, 'lr': 0.000273584328988281, 'weight_decay': 0.00011305971722956918, 'epochs': 109, 'loss': 'mae', 'optimizer': 'adam', 'graph_mode': 'cutoff', 'cutoff': 0.23953040365720496, 'grm_norm': 'cosine_then_gcn', 'self_loops': True, 'use_snp_selection': True, 'num_snps': 21079}. Best is trial 51 with value: 0.27300220176239537.
[I 2025-11-12 18:04:17,792] Trial 86 finished with value: 0.259881304170926 and parameters: {'model_type': 'graphsage', 'hidden_dims': '[512, 128]', 'dropout': 0.5082326162981556, 'batch_norm': False, 'lr': 0.00033180371696101213, 'weight_decay': 3.494727718664582e-05, 'epochs': 126, 'loss': 'mae', 'optimizer': 'adam', 'graph_mode': 'cutoff', 'cutoff': 0.2867430280569809, 'grm_norm': 'cosine_then_gcn', 'self_loops': True, 'use_snp_selection': True, 'num_snps': 22271}. Best is trial 51 with value: 0.27300220176239537.
[I 2025-11-12 18:05:25,202] Trial 87 finished with value: 0.1557895296805372 and parameters: {'model_type': 'graphsage', 'hidden_dims': '[512, 128]', 'dropout': 0.2042830085448057, 'batch_norm': False, 'lr': 0.0004261722767991279, 'weight_decay': 1.4357471335077806e-05, 'epochs': 47, 'loss': 'mae', 'optimizer': 'adam', 'graph_mode': 'cutoff', 'cutoff': 0.3751651857017559, 'grm_norm': 'cosine_then_gcn', 'self_loops': False, 'use_snp_selection': True, 'num_snps': 28502}. Best is trial 51 with value: 0.27300220176239537.
[I 2025-11-12 18:06:29,577] Trial 88 finished with value: 0.2512949912259579 and parameters: {'model_type': 'graphsage', 'hidden_dims': '[512, 128]', 'dropout': 0.4407141417770686, 'batch_norm': True, 'lr': 0.000287478681683679, 'weight_decay': 5.99983739262578e-05, 'epochs': 63, 'loss': 'mse', 'optimizer': 'adam', 'graph_mode': 'cutoff', 'cutoff': 0.32744399873916674, 'grm_norm': 'gcn', 'self_loops': True, 'use_snp_selection': False}. Best is trial 51 with value: 0.27300220176239537.
[I 2025-11-12 18:08:03,599] Trial 89 finished with value: 0.2551984142695201 and parameters: {'model_type': 'graphsage', 'hidden_dims': '[128, 64]', 'dropout': 0.16506451592441806, 'batch_norm': False, 'lr': 6.798878085091015e-05, 'weight_decay': 3.1698347103512e-05, 'epochs': 247, 'loss': 'mae', 'optimizer': 'adam', 'graph_mode': 'cutoff', 'cutoff': 0.28906595905015087, 'grm_norm': 'cosine_then_gcn', 'self_loops': True, 'use_snp_selection': True, 'num_snps': 24423}. Best is trial 51 with value: 0.27300220176239537.
[I 2025-11-12 18:09:03,516] Trial 90 finished with value: 0.25593920962173855 and parameters: {'model_type': 'graphsage', 'hidden_dims': '[512, 128]', 'dropout': 0.18293119817862402, 'batch_norm': False, 'lr': 1.9858631590533144e-05, 'weight_decay': 2.0782470856464084e-05, 'epochs': 57, 'loss': 'mae', 'optimizer': 'adam', 'graph_mode': 'cutoff', 'cutoff': 0.3981120939851897, 'grm_norm': 'cosine', 'self_loops': True, 'use_snp_selection': True, 'num_snps': 19936}. Best is trial 51 with value: 0.27300220176239537.
[I 2025-11-12 18:10:09,615] Trial 91 finished with value: 0.2615018293504379 and parameters: {'model_type': 'graphsage', 'hidden_dims': '[512, 64]', 'dropout': 0.2221213655088448, 'batch_norm': False, 'lr': 3.977190286355758e-05, 'weight_decay': 1.4058274688773935e-07, 'epochs': 75, 'loss': 'mae', 'optimizer': 'adam', 'graph_mode': 'cutoff', 'cutoff': 0.37230564949949974, 'grm_norm': 'cosine_then_gcn', 'self_loops': True, 'use_snp_selection': True, 'num_snps': 21895}. Best is trial 51 with value: 0.27300220176239537.
[I 2025-11-12 18:11:23,147] Trial 92 finished with value: 0.2488897945309601 and parameters: {'model_type': 'graphsage', 'hidden_dims': '[512, 128]', 'dropout': 0.22009859897128742, 'batch_norm': False, 'lr': 4.0027563791244005e-05, 'weight_decay': 1.290935543897926e-05, 'epochs': 105, 'loss': 'mae', 'optimizer': 'adam', 'graph_mode': 'cutoff', 'cutoff': 0.3686715054219582, 'grm_norm': 'cosine_then_gcn', 'self_loops': True, 'use_snp_selection': True, 'num_snps': 22338}. Best is trial 51 with value: 0.27300220176239537.
[I 2025-11-12 18:12:22,426] Trial 93 finished with value: 0.2572506403267966 and parameters: {'model_type': 'graphsage', 'hidden_dims': '[512, 64]', 'dropout': 0.1952634826741885, 'batch_norm': False, 'lr': 3.0255967213500905e-05, 'weight_decay': 1.3706463755288106e-07, 'epochs': 72, 'loss': 'mae', 'optimizer': 'adam', 'graph_mode': 'cutoff', 'cutoff': 0.3269297676385736, 'grm_norm': 'cosine_then_gcn', 'self_loops': True, 'use_snp_selection': True, 'num_snps': 16297}. Best is trial 51 with value: 0.27300220176239537.
[I 2025-11-12 18:13:23,408] Trial 94 finished with value: 0.2525321629598164 and parameters: {'model_type': 'graphsage', 'hidden_dims': '[128, 64]', 'dropout': 0.23153795538774422, 'batch_norm': False, 'lr': 0.0002524300196301639, 'weight_decay': 4.528351417726903e-05, 'epochs': 91, 'loss': 'mae', 'optimizer': 'adam', 'graph_mode': 'cutoff', 'cutoff': 0.40790036395611107, 'grm_norm': 'cosine_then_gcn', 'self_loops': True, 'use_snp_selection': True, 'num_snps': 27214}. Best is trial 51 with value: 0.27300220176239537.
[I 2025-11-12 18:14:24,596] Trial 95 finished with value: 0.1424909965340689 and parameters: {'model_type': 'graphsage', 'hidden_dims': '[512, 128]', 'dropout': 0.3089776255083372, 'batch_norm': False, 'lr': 0.000580802318624208, 'weight_decay': 1.656336115563038e-05, 'epochs': 41, 'loss': 'mae', 'optimizer': 'adam', 'graph_mode': 'cutoff', 'cutoff': 0.3462842807701159, 'grm_norm': 'gcn', 'self_loops': True, 'use_snp_selection': True, 'num_snps': 24759}. Best is trial 51 with value: 0.27300220176239537.
[I 2025-11-12 18:15:29,311] Trial 96 finished with value: 0.2522027971930555 and parameters: {'model_type': 'graphsage', 'hidden_dims': '[512, 64]', 'dropout': 0.13650036527039744, 'batch_norm': False, 'lr': 0.00019252649095859563, 'weight_decay': 9.20983031273691e-07, 'epochs': 60, 'loss': 'mae', 'optimizer': 'adam', 'graph_mode': 'cutoff', 'cutoff': 0.8463258677308698, 'grm_norm': 'cosine_then_gcn', 'self_loops': False, 'use_snp_selection': True, 'num_snps': 26637}. Best is trial 51 with value: 0.27300220176239537.
[I 2025-11-12 18:16:46,305] Trial 97 finished with value: 0.1901879432630676 and parameters: {'model_type': 'graphsage', 'hidden_dims': '[512, 256]', 'dropout': 0.5524372570229519, 'batch_norm': False, 'lr': 0.0003525140915857981, 'weight_decay': 6.8251749081671665e-06, 'epochs': 84, 'loss': 'mae', 'optimizer': 'adam', 'graph_mode': 'cutoff', 'cutoff': 0.675310280363946, 'grm_norm': 'cosine_then_gcn', 'self_loops': True, 'use_snp_selection': True, 'num_snps': 32581}. Best is trial 51 with value: 0.27300220176239537.
[I 2025-11-12 18:17:53,409] Trial 98 finished with value: 0.034830835643867165 and parameters: {'model_type': 'graphsage', 'hidden_dims': '[512, 128]', 'dropout': 0.3866234447102248, 'batch_norm': False, 'lr': 0.0006181072132197836, 'weight_decay': 9.843442384701351e-06, 'epochs': 49, 'loss': 'mse', 'optimizer': 'adam', 'graph_mode': 'cutoff', 'cutoff': 0.23753132673128846, 'grm_norm': 'cosine_then_gcn', 'self_loops': True, 'use_snp_selection': True, 'num_snps': 22010}. Best is trial 51 with value: 0.27300220176239537.
[I 2025-11-12 18:18:53,976] Trial 99 finished with value: 0.25434100650540875 and parameters: {'model_type': 'graphsage', 'hidden_dims': '[512, 64]', 'dropout': 0.1145333836128608, 'batch_norm': False, 'lr': 0.00015788836583590865, 'weight_decay': 5.299622563133034e-07, 'epochs': 68, 'loss': 'mae', 'optimizer': 'adam', 'graph_mode': 'cutoff', 'cutoff': 0.38314032611005744, 'grm_norm': 'gcn', 'self_loops': True, 'use_snp_selection': True, 'num_snps': 19306}. Best is trial 51 with value: 0.27300220176239537.
[I 2025-11-12 18:19:50,191] Trial 100 finished with value: 0.2572738917925362 and parameters: {'model_type': 'graphsage', 'hidden_dims': '[128, 64]', 'dropout': 0.21149044879142095, 'batch_norm': False, 'lr': 0.00010739748986871478, 'weight_decay': 1.361753960571532e-06, 'epochs': 99, 'loss': 'mae', 'optimizer': 'adam', 'graph_mode': 'cutoff', 'cutoff': 0.3000376728925872, 'grm_norm': 'cosine_then_gcn', 'self_loops': True, 'use_snp_selection': True, 'num_snps': 17565}. Best is trial 51 with value: 0.27300220176239537.
[I 2025-11-12 18:21:40,620] Trial 101 finished with value: 0.25079933481097555 and parameters: {'model_type': 'graphsage', 'hidden_dims': '[512, 64]', 'dropout': 0.17129604802345463, 'batch_norm': False, 'lr': 5.347599156198192e-05, 'weight_decay': 2.2202658947720947e-07, 'epochs': 75, 'loss': 'mae', 'optimizer': 'adam', 'graph_mode': 'cutoff', 'cutoff': 0.48121128897874577, 'grm_norm': 'cosine_then_gcn', 'self_loops': True, 'use_snp_selection': True, 'num_snps': 52268}. Best is trial 51 with value: 0.27300220176239537.
[I 2025-11-12 18:22:48,186] Trial 102 finished with value: 0.2577369867149922 and parameters: {'model_type': 'graphsage', 'hidden_dims': '[512, 64]', 'dropout': 0.15715133668703596, 'batch_norm': False, 'lr': 4.627399162146584e-05, 'weight_decay': 1.2783333808755416e-07, 'epochs': 74, 'loss': 'mae', 'optimizer': 'adam', 'graph_mode': 'cutoff', 'cutoff': 0.44061598317743444, 'grm_norm': 'cosine_then_gcn', 'self_loops': True, 'use_snp_selection': True, 'num_snps': 23280}. Best is trial 51 with value: 0.27300220176239537.
[I 2025-11-12 18:24:35,810] Trial 103 finished with value: 0.26118467955610397 and parameters: {'model_type': 'graphsage', 'hidden_dims': '[512, 64]', 'dropout': 0.17778673290590447, 'batch_norm': False, 'lr': 3.712533143484216e-05, 'weight_decay': 2.7885504928580045e-05, 'epochs': 54, 'loss': 'mae', 'optimizer': 'adam', 'graph_mode': 'cutoff', 'cutoff': 0.35142830294843064, 'grm_norm': 'cosine_then_gcn', 'self_loops': True, 'use_snp_selection': True, 'num_snps': 55510}. Best is trial 51 with value: 0.27300220176239537.
[I 2025-11-12 18:26:31,049] Trial 104 finished with value: 0.24759431125659317 and parameters: {'model_type': 'graphsage', 'hidden_dims': '[512, 64]', 'dropout': 0.18017330670959888, 'batch_norm': False, 'lr': 2.721123268492387e-05, 'weight_decay': 0.0007153197148345743, 'epochs': 53, 'loss': 'mae', 'optimizer': 'adam', 'graph_mode': 'cutoff', 'cutoff': 0.33084105054007595, 'grm_norm': 'none', 'self_loops': True, 'use_snp_selection': True, 'num_snps': 58246}. Best is trial 51 with value: 0.27300220176239537.
[I 2025-11-12 18:27:39,437] Trial 105 finished with value: 0.24430883696139144 and parameters: {'model_type': 'graphsage', 'hidden_dims': '[512, 64]', 'dropout': 0.19835378630408979, 'batch_norm': False, 'lr': 2.0150741465198293e-05, 'weight_decay': 2.67942946641521e-05, 'epochs': 59, 'loss': 'mae', 'optimizer': 'adam', 'graph_mode': 'cutoff', 'cutoff': 0.3529444168606091, 'grm_norm': 'cosine_then_gcn', 'self_loops': False, 'use_snp_selection': True, 'num_snps': 26082}. Best is trial 51 with value: 0.27300220176239537.
[I 2025-11-12 18:28:35,225] Trial 106 finished with value: 0.23290714434846907 and parameters: {'model_type': 'graphsage', 'hidden_dims': '[512, 128]', 'dropout': 0.2237235425230955, 'batch_norm': True, 'lr': 6.936431887461574e-05, 'weight_decay': 1.941629230788451e-05, 'epochs': 43, 'loss': 'mae', 'optimizer': 'adam', 'graph_mode': 'cutoff', 'cutoff': 0.26592558656598164, 'grm_norm': 'cosine_then_gcn', 'self_loops': True, 'use_snp_selection': False}. Best is trial 51 with value: 0.27300220176239537.
[I 2025-11-12 18:29:41,979] Trial 107 finished with value: 0.263724497864265 and parameters: {'model_type': 'graphsage', 'hidden_dims': '[512, 64]', 'dropout': 0.15204852297453336, 'batch_norm': False, 'lr': 3.506068868625886e-05, 'weight_decay': 3.802919286737976e-05, 'epochs': 46, 'loss': 'mae', 'optimizer': 'adam', 'graph_mode': 'cutoff', 'cutoff': 0.36802397680475907, 'grm_norm': 'none', 'self_loops': True, 'use_snp_selection': True, 'num_snps': 28566}. Best is trial 51 with value: 0.27300220176239537.
[I 2025-11-12 18:30:50,668] Trial 108 finished with value: 0.07427851827862594 and parameters: {'model_type': 'graphsage', 'hidden_dims': '[512, 64]', 'dropout': 0.13488894264005644, 'batch_norm': False, 'lr': 0.0004504760614634406, 'weight_decay': 6.924929172787141e-05, 'epochs': 45, 'loss': 'mse', 'optimizer': 'adam', 'graph_mode': 'cutoff', 'cutoff': 0.31767693347045045, 'grm_norm': 'none', 'self_loops': True, 'use_snp_selection': True, 'num_snps': 28743}. Best is trial 51 with value: 0.27300220176239537.
[I 2025-11-12 18:32:11,594] Trial 109 finished with value: 0.2616483072684688 and parameters: {'model_type': 'graphsage', 'hidden_dims': '[512, 128]', 'dropout': 0.16696181575518979, 'batch_norm': False, 'lr': 4.37484461637883e-05, 'weight_decay': 3.5520900398790404e-05, 'epochs': 84, 'loss': 'mae', 'optimizer': 'adam', 'graph_mode': 'cutoff', 'cutoff': 0.3793223353034427, 'grm_norm': 'none', 'self_loops': True, 'use_snp_selection': True, 'num_snps': 29992}. Best is trial 51 with value: 0.27300220176239537.
[I 2025-11-12 18:33:43,808] Trial 110 finished with value: 0.2577394763654104 and parameters: {'model_type': 'graphsage', 'hidden_dims': '[512, 128]', 'dropout': 0.14765513531116642, 'batch_norm': False, 'lr': 1.67796176574262e-05, 'weight_decay': 0.0001066282319478835, 'epochs': 86, 'loss': 'mae', 'optimizer': 'adam', 'graph_mode': 'cutoff', 'cutoff': 0.4056081038024487, 'grm_norm': 'none', 'self_loops': False, 'use_snp_selection': True, 'num_snps': 36773}. Best is trial 51 with value: 0.27300220176239537.
[I 2025-11-12 18:34:59,820] Trial 111 finished with value: 0.27276060635158395 and parameters: {'model_type': 'graphsage', 'hidden_dims': '[512, 128]', 'dropout': 0.16833024257171095, 'batch_norm': False, 'lr': 4.085726070312523e-05, 'weight_decay': 4.628227784956938e-05, 'epochs': 66, 'loss': 'mae', 'optimizer': 'adam', 'graph_mode': 'cutoff', 'cutoff': 0.38207958613196835, 'grm_norm': 'none', 'self_loops': True, 'use_snp_selection': True, 'num_snps': 30915}. Best is trial 51 with value: 0.27300220176239537.
[I 2025-11-12 18:36:15,054] Trial 112 finished with value: 0.2786953703733425 and parameters: {'model_type': 'graphsage', 'hidden_dims': '[512, 128]', 'dropout': 0.16168508504991422, 'batch_norm': False, 'lr': 3.3711851247717934e-05, 'weight_decay': 3.7276331663248325e-05, 'epochs': 68, 'loss': 'mae', 'optimizer': 'adam', 'graph_mode': 'cutoff', 'cutoff': 0.3859708449701942, 'grm_norm': 'none', 'self_loops': True, 'use_snp_selection': True, 'num_snps': 30080}. Best is trial 112 with value: 0.2786953703733425.
[I 2025-11-12 18:37:23,947] Trial 113 finished with value: 0.26155971445324583 and parameters: {'model_type': 'graphsage', 'hidden_dims': '[512, 128]', 'dropout': 0.15498822790911285, 'batch_norm': False, 'lr': 3.49963330932171e-05, 'weight_decay': 4.575428255877621e-05, 'epochs': 63, 'loss': 'mae', 'optimizer': 'adam', 'graph_mode': 'cutoff', 'cutoff': 0.4362418037992495, 'grm_norm': 'none', 'self_loops': True, 'use_snp_selection': True, 'num_snps': 27219}. Best is trial 112 with value: 0.2786953703733425.
[I 2025-11-12 18:38:33,208] Trial 114 finished with value: 0.20080685580464572 and parameters: {'model_type': 'graphsage', 'hidden_dims': '[512, 128]', 'dropout': 0.12615299367522817, 'batch_norm': False, 'lr': 0.0003084202256520775, 'weight_decay': 8.007819698047586e-05, 'epochs': 40, 'loss': 'mae', 'optimizer': 'adam', 'graph_mode': 'cutoff', 'cutoff': 0.3878446078474506, 'grm_norm': 'none', 'self_loops': True, 'use_snp_selection': True, 'num_snps': 33198}. Best is trial 112 with value: 0.2786953703733425.
[I 2025-11-12 18:39:43,651] Trial 115 finished with value: 0.2624015494633105 and parameters: {'model_type': 'graphsage', 'hidden_dims': '[512, 128]', 'dropout': 0.18550377373704177, 'batch_norm': False, 'lr': 1.2590061325204348e-05, 'weight_decay': 3.3002883153369256e-05, 'epochs': 68, 'loss': 'mae', 'optimizer': 'adam', 'graph_mode': 'cutoff', 'cutoff': 0.7668247517241417, 'grm_norm': 'none', 'self_loops': True, 'use_snp_selection': True, 'num_snps': 31332}. Best is trial 112 with value: 0.2786953703733425.
[I 2025-11-12 18:41:02,109] Trial 116 finished with value: 0.21409522991734126 and parameters: {'model_type': 'graphsage', 'hidden_dims': '[512, 128]', 'dropout': 0.16177968929121098, 'batch_norm': False, 'lr': 1.2846705289396681e-05, 'weight_decay': 5.608933042722071e-05, 'epochs': 67, 'loss': 'mae', 'optimizer': 'adam', 'graph_mode': 'knn', 'source': 'grm', 'knn_k': 3, 'weighted_edges': True, 'symmetrize_mode': 'union', 'use_snp_selection': True, 'num_snps': 31076}. Best is trial 112 with value: 0.2786953703733425.
[I 2025-11-12 18:42:07,550] Trial 117 finished with value: 0.23184322011197617 and parameters: {'model_type': 'graphsage', 'hidden_dims': '[512, 128]', 'dropout': 0.1857057484456895, 'batch_norm': False, 'lr': 8.93953234663195e-06, 'weight_decay': 3.804765900547451e-05, 'epochs': 53, 'loss': 'mae', 'optimizer': 'adam', 'graph_mode': 'cutoff', 'cutoff': 0.8454584084576968, 'grm_norm': 'none', 'self_loops': True, 'use_snp_selection': True, 'num_snps': 30079}. Best is trial 112 with value: 0.2786953703733425.
[I 2025-11-12 18:43:00,151] Trial 118 finished with value: 0.23985515360092355 and parameters: {'model_type': 'graphsage', 'hidden_dims': '[128, 64]', 'dropout': 0.4878858323622184, 'batch_norm': False, 'lr': 2.6581064359758508e-05, 'weight_decay': 0.0001438491589095617, 'epochs': 60, 'loss': 'mae', 'optimizer': 'adam', 'graph_mode': 'cutoff', 'cutoff': 0.7956755879809457, 'grm_norm': 'none', 'self_loops': True, 'use_snp_selection': True, 'num_snps': 28709}. Best is trial 112 with value: 0.2786953703733425.
[I 2025-11-12 18:44:08,181] Trial 119 finished with value: 0.24524526226371002 and parameters: {'model_type': 'graphsage', 'hidden_dims': '[512, 128]', 'dropout': 0.14402278474581282, 'batch_norm': False, 'lr': 4.851900253602708e-06, 'weight_decay': 2.5749469746023533e-05, 'epochs': 46, 'loss': 'mse', 'optimizer': 'adam', 'graph_mode': 'cutoff', 'cutoff': 0.6531958072885046, 'grm_norm': 'none', 'self_loops': True, 'use_snp_selection': True, 'num_snps': 34684}. Best is trial 112 with value: 0.2786953703733425.
