[I 2025-11-03 12:17:51,263] Trial 71 finished with value: 0.11269528944993588 and parameters: {'model_type': 'gcn', 'hidden_dims': '[512, 256]', 'dropout': 0.5373383290503749, 'batch_norm': True, 'lr': 0.00037075418306721205, 'weight_decay': 3.037986071532148e-06, 'epochs': 306, 'loss': 'mse', 'optimizer': 'adam', 'graph_mode': 'cutoff', 'cutoff': 0.8300988750269629, 'grm_norm': 'gcn', 'self_loops': False, 'use_snp_selection': False}. Best is trial 32 with value: 0.1359998317137015.
[I 2025-11-03 12:17:54,901] Trial 72 finished with value: 0.1277611340052484 and parameters: {'model_type': 'gcn', 'hidden_dims': '[512, 256]', 'dropout': 0.5662341876237807, 'batch_norm': True, 'lr': 0.000512066277424071, 'weight_decay': 6.658566339945622e-06, 'epochs': 322, 'loss': 'mse', 'optimizer': 'adam', 'graph_mode': 'cutoff', 'cutoff': 0.7709176074502638, 'grm_norm': 'cosine_then_gcn', 'self_loops': False, 'use_snp_selection': False}. Best is trial 32 with value: 0.1359998317137015.
[I 2025-11-03 12:17:58,554] Trial 73 finished with value: 0.11698424326337148 and parameters: {'model_type': 'gcn', 'hidden_dims': '[512, 256]', 'dropout': 0.5700338319860726, 'batch_norm': True, 'lr': 0.0007222624942368908, 'weight_decay': 7.86597854196891e-06, 'epochs': 324, 'loss': 'mse', 'optimizer': 'adam', 'graph_mode': 'cutoff', 'cutoff': 0.7516096882559791, 'grm_norm': 'cosine_then_gcn', 'self_loops': False, 'use_snp_selection': False}. Best is trial 32 with value: 0.1359998317137015.
[I 2025-11-03 12:18:02,177] Trial 74 finished with value: 0.11535862234616795 and parameters: {'model_type': 'gcn', 'hidden_dims': '[512, 256]', 'dropout': 0.56640651675971, 'batch_norm': True, 'lr': 0.0006324156017192055, 'weight_decay': 1.123896991133509e-06, 'epochs': 320, 'loss': 'mse', 'optimizer': 'adam', 'graph_mode': 'cutoff', 'cutoff': 0.7826085040267912, 'grm_norm': 'cosine_then_gcn', 'self_loops': False, 'use_snp_selection': False}. Best is trial 32 with value: 0.1359998317137015.
[I 2025-11-03 12:18:05,575] Trial 75 finished with value: 0.11045795740266315 and parameters: {'model_type': 'gcn', 'hidden_dims': '[512, 256]', 'dropout': 0.5852725160908889, 'batch_norm': True, 'lr': 0.0008289247551748286, 'weight_decay': 8.025000255831459e-06, 'epochs': 288, 'loss': 'mse', 'optimizer': 'adam', 'graph_mode': 'cutoff', 'cutoff': 0.6518575028607396, 'grm_norm': 'cosine_then_gcn', 'self_loops': False, 'use_snp_selection': False}. Best is trial 32 with value: 0.1359998317137015.
[I 2025-11-03 12:18:07,723] Trial 76 finished with value: 0.10150390080076838 and parameters: {'model_type': 'gcn', 'hidden_dims': '[128, 64]', 'dropout': 0.5369182847580178, 'batch_norm': True, 'lr': 0.0006197019255939012, 'weight_decay': 2.171425430684486e-07, 'epochs': 327, 'loss': 'mse', 'optimizer': 'adam', 'graph_mode': 'cutoff', 'cutoff': 0.7889523026946118, 'grm_norm': 'cosine_then_gcn', 'self_loops': False, 'use_snp_selection': False}. Best is trial 32 with value: 0.1359998317137015.
[I 2025-11-03 12:18:10,119] Trial 77 finished with value: 0.11917503355366296 and parameters: {'model_type': 'gcn', 'hidden_dims': '[256, 128]', 'dropout': 0.5708044993323108, 'batch_norm': True, 'lr': 0.000965708641280405, 'weight_decay': 3.948889718869528e-06, 'epochs': 269, 'loss': 'mse', 'optimizer': 'adam', 'graph_mode': 'cutoff', 'cutoff': 0.7487489116497195, 'grm_norm': 'cosine_then_gcn', 'self_loops': False, 'use_snp_selection': False}. Best is trial 32 with value: 0.1359998317137015.
[I 2025-11-03 12:18:12,519] Trial 78 finished with value: 0.04678000476839296 and parameters: {'model_type': 'gcn', 'hidden_dims': '[256, 128]', 'dropout': 0.13025310932689, 'batch_norm': True, 'lr': 1.344577076412883e-05, 'weight_decay': 1.449272287781869e-07, 'epochs': 268, 'loss': 'mse', 'optimizer': 'adam', 'graph_mode': 'cutoff', 'cutoff': 0.6366502561741677, 'grm_norm': 'cosine_then_gcn', 'self_loops': False, 'use_snp_selection': False}. Best is trial 32 with value: 0.1359998317137015.
[I 2025-11-03 12:18:14,807] Trial 79 finished with value: 0.08107807618310181 and parameters: {'model_type': 'gcn', 'hidden_dims': '[256, 128]', 'dropout': 0.5753146054223948, 'batch_norm': True, 'lr': 9.83912566507346e-05, 'weight_decay': 4.50620081947153e-06, 'epochs': 245, 'loss': 'mse', 'optimizer': 'adam', 'graph_mode': 'cutoff', 'cutoff': 0.49418952783382264, 'grm_norm': 'cosine_then_gcn', 'self_loops': False, 'use_snp_selection': False}. Best is trial 32 with value: 0.1359998317137015.
[I 2025-11-03 12:18:16,983] Trial 80 finished with value: 0.12639369350247115 and parameters: {'model_type': 'gcn', 'hidden_dims': '[256, 128]', 'dropout': 0.5636618172459684, 'batch_norm': True, 'lr': 0.0009355053757166378, 'weight_decay': 3.6231937094183464e-07, 'epochs': 224, 'loss': 'mse', 'optimizer': 'adam', 'graph_mode': 'cutoff', 'cutoff': 0.8165076897453922, 'grm_norm': 'cosine_then_gcn', 'self_loops': False, 'use_snp_selection': False}. Best is trial 32 with value: 0.1359998317137015.
[I 2025-11-03 12:18:19,319] Trial 81 finished with value: 0.12328130307075755 and parameters: {'model_type': 'gcn', 'hidden_dims': '[256, 128]', 'dropout': 0.5609401412724391, 'batch_norm': True, 'lr': 0.0009220806919353101, 'weight_decay': 1.977806067212456e-07, 'epochs': 257, 'loss': 'mse', 'optimizer': 'adam', 'graph_mode': 'cutoff', 'cutoff': 0.8085842644937682, 'grm_norm': 'cosine_then_gcn', 'self_loops': False, 'use_snp_selection': False}. Best is trial 32 with value: 0.1359998317137015.
[I 2025-11-03 12:18:21,491] Trial 82 finished with value: 0.10919976559591824 and parameters: {'model_type': 'gcn', 'hidden_dims': '[256, 128]', 'dropout': 0.5840957910798644, 'batch_norm': True, 'lr': 0.0009819354259030615, 'weight_decay': 3.846339299208953e-07, 'epochs': 223, 'loss': 'mse', 'optimizer': 'adam', 'graph_mode': 'cutoff', 'cutoff': 0.8457182989367225, 'grm_norm': 'cosine_then_gcn', 'self_loops': False, 'use_snp_selection': False}. Best is trial 32 with value: 0.1359998317137015.
[I 2025-11-03 12:18:23,741] Trial 83 finished with value: 0.13264757094724156 and parameters: {'model_type': 'gcn', 'hidden_dims': '[256, 128]', 'dropout': 0.5987877700871992, 'batch_norm': True, 'lr': 0.0009825436837295682, 'weight_decay': 2.0023438224321844e-07, 'epochs': 239, 'loss': 'mse', 'optimizer': 'adam', 'graph_mode': 'cutoff', 'cutoff': 0.8130199121904294, 'grm_norm': 'cosine_then_gcn', 'self_loops': False, 'use_snp_selection': False}. Best is trial 32 with value: 0.1359998317137015.
[I 2025-11-03 12:18:25,858] Trial 84 finished with value: 0.10957249973787211 and parameters: {'model_type': 'gcn', 'hidden_dims': '[256, 128]', 'dropout': 0.5582913485610718, 'batch_norm': True, 'lr': 0.0005643967864228296, 'weight_decay': 2.0203541613684958e-07, 'epochs': 212, 'loss': 'mse', 'optimizer': 'adam', 'graph_mode': 'cutoff', 'cutoff': 0.8336080290539061, 'grm_norm': 'cosine_then_gcn', 'self_loops': False, 'use_snp_selection': False}. Best is trial 32 with value: 0.1359998317137015.
[I 2025-11-03 12:18:28,204] Trial 85 finished with value: 0.11596837810708505 and parameters: {'model_type': 'gcn', 'hidden_dims': '[256, 128]', 'dropout': 0.5933910106877724, 'batch_norm': True, 'lr': 0.0009662592197946246, 'weight_decay': 2.704826553272801e-07, 'epochs': 256, 'loss': 'mae', 'optimizer': 'adam', 'graph_mode': 'cutoff', 'cutoff': 0.7900042286956586, 'grm_norm': 'cosine_then_gcn', 'self_loops': False, 'use_snp_selection': False}. Best is trial 32 with value: 0.1359998317137015.
[I 2025-11-03 12:18:30,433] Trial 86 finished with value: 0.11428555065572635 and parameters: {'model_type': 'gcn', 'hidden_dims': '[256, 128]', 'dropout': 0.5311909349793058, 'batch_norm': True, 'lr': 0.0003873046191752323, 'weight_decay': 1.7533490290421605e-07, 'epochs': 235, 'loss': 'mse', 'optimizer': 'adam', 'graph_mode': 'cutoff', 'cutoff': 0.8129402378193304, 'grm_norm': 'cosine_then_gcn', 'self_loops': False, 'use_snp_selection': False}. Best is trial 32 with value: 0.1359998317137015.
[I 2025-11-03 12:18:32,852] Trial 87 finished with value: 0.09899599021129606 and parameters: {'model_type': 'gcn', 'hidden_dims': '[256, 128]', 'dropout': 0.5719726264586343, 'batch_norm': True, 'lr': 0.0006838235706248029, 'weight_decay': 3.0765023200129657e-07, 'epochs': 272, 'loss': 'mse', 'optimizer': 'adam', 'graph_mode': 'cutoff', 'cutoff': 0.6923243262617219, 'grm_norm': 'cosine_then_gcn', 'self_loops': False, 'use_snp_selection': False}. Best is trial 32 with value: 0.1359998317137015.
[I 2025-11-03 12:18:34,886] Trial 88 finished with value: 0.09698480586184104 and parameters: {'model_type': 'gcn', 'hidden_dims': '[256, 128]', 'dropout': 0.5093965220956245, 'batch_norm': True, 'lr': 5.583111695498009e-05, 'weight_decay': 1.0867061697956363e-07, 'epochs': 195, 'loss': 'mse', 'optimizer': 'adam', 'graph_mode': 'cutoff', 'cutoff': 0.7621310223654135, 'grm_norm': 'cosine_then_gcn', 'self_loops': False, 'use_snp_selection': False}. Best is trial 32 with value: 0.1359998317137015.
[I 2025-11-03 12:18:37,365] Trial 89 finished with value: 0.10516887093892904 and parameters: {'model_type': 'gcn', 'hidden_dims': '[256, 128]', 'dropout': 0.27705252069066416, 'batch_norm': True, 'lr': 0.0004501531227432393, 'weight_decay': 4.801131102114624e-07, 'epochs': 283, 'loss': 'mae', 'optimizer': 'adam', 'graph_mode': 'cutoff', 'cutoff': 0.8596217631023607, 'grm_norm': 'cosine_then_gcn', 'self_loops': False, 'use_snp_selection': False}. Best is trial 32 with value: 0.1359998317137015.
[I 2025-11-03 12:18:39,535] Trial 90 finished with value: 0.10704509844780834 and parameters: {'model_type': 'gcn', 'hidden_dims': '[256, 128]', 'dropout': 0.5615093478732237, 'batch_norm': True, 'lr': 0.0008506678248622331, 'weight_decay': 1.41017337721844e-07, 'epochs': 223, 'loss': 'mse', 'optimizer': 'adam', 'graph_mode': 'cutoff', 'cutoff': 0.8938344869027849, 'grm_norm': 'cosine_then_gcn', 'self_loops': False, 'use_snp_selection': False}. Best is trial 32 with value: 0.1359998317137015.
[I 2025-11-03 12:18:41,813] Trial 91 finished with value: 0.12054679661036038 and parameters: {'model_type': 'gcn', 'hidden_dims': '[256, 128]', 'dropout': 0.20722994790933222, 'batch_norm': True, 'lr': 0.0006018478399004876, 'weight_decay': 3.6311226651257197e-07, 'epochs': 243, 'loss': 'mse', 'optimizer': 'adam', 'graph_mode': 'cutoff', 'cutoff': 0.6049285896214608, 'grm_norm': 'cosine_then_gcn', 'self_loops': False, 'use_snp_selection': False}. Best is trial 32 with value: 0.1359998317137015.
[I 2025-11-03 12:18:44,087] Trial 92 finished with value: 0.10394380635660903 and parameters: {'model_type': 'gcn', 'hidden_dims': '[256, 128]', 'dropout': 0.21777430793883296, 'batch_norm': True, 'lr': 0.000623735823238406, 'weight_decay': 3.5484905789433677e-07, 'epochs': 242, 'loss': 'mse', 'optimizer': 'adam', 'graph_mode': 'cutoff', 'cutoff': 0.5465024886144618, 'grm_norm': 'cosine_then_gcn', 'self_loops': False, 'use_snp_selection': False}. Best is trial 32 with value: 0.1359998317137015.
[I 2025-11-03 12:18:46,457] Trial 93 finished with value: 0.11355085270435022 and parameters: {'model_type': 'gcn', 'hidden_dims': '[256, 128]', 'dropout': 0.34810873079189675, 'batch_norm': True, 'lr': 0.0008154339480604059, 'weight_decay': 2.1841732994853478e-07, 'epochs': 262, 'loss': 'mse', 'optimizer': 'adam', 'graph_mode': 'cutoff', 'cutoff': 0.6878454439812172, 'grm_norm': 'cosine_then_gcn', 'self_loops': False, 'use_snp_selection': False}. Best is trial 32 with value: 0.1359998317137015.
[I 2025-11-03 12:18:48,351] Trial 94 finished with value: 0.10674298980838608 and parameters: {'model_type': 'gcn', 'hidden_dims': '[256, 128]', 'dropout': 0.2528593018780136, 'batch_norm': True, 'lr': 0.0005366366244555868, 'weight_decay': 7.125617171876498e-07, 'epochs': 166, 'loss': 'mse', 'optimizer': 'adam', 'graph_mode': 'cutoff', 'cutoff': 0.8148574342018651, 'grm_norm': 'cosine_then_gcn', 'self_loops': False, 'use_snp_selection': False}. Best is trial 32 with value: 0.1359998317137015.
[I 2025-11-03 12:18:50,536] Trial 95 finished with value: 0.04345090675673374 and parameters: {'model_type': 'gcn', 'hidden_dims': '[256, 128]', 'dropout': 0.5802523377427256, 'batch_norm': True, 'lr': 2.139419443735137e-05, 'weight_decay': 2.3883956625953487e-07, 'epochs': 229, 'loss': 'mse', 'optimizer': 'adam', 'graph_mode': 'cutoff', 'cutoff': 0.6240556448061594, 'grm_norm': 'none', 'self_loops': False, 'use_snp_selection': False}. Best is trial 32 with value: 0.1359998317137015.
[I 2025-11-03 12:18:52,840] Trial 96 finished with value: 0.10918221719133867 and parameters: {'model_type': 'gcn', 'hidden_dims': '[256, 128]', 'dropout': 0.549139238677187, 'batch_norm': True, 'lr': 0.0009999093551433479, 'weight_decay': 1.5251350168232594e-07, 'epochs': 250, 'loss': 'mse', 'optimizer': 'adam', 'graph_mode': 'cutoff', 'cutoff': 0.7052736601023406, 'grm_norm': 'cosine_then_gcn', 'self_loops': False, 'use_snp_selection': False}. Best is trial 32 with value: 0.1359998317137015.
[I 2025-11-03 12:18:55,083] Trial 97 finished with value: 0.11001027001920935 and parameters: {'model_type': 'gcn', 'hidden_dims': '[256, 128]', 'dropout': 0.5968876736762736, 'batch_norm': True, 'lr': 0.0003022338442058662, 'weight_decay': 0.0005093018943090306, 'epochs': 237, 'loss': 'mae', 'optimizer': 'adam', 'graph_mode': 'cutoff', 'cutoff': 0.7608361461132196, 'grm_norm': 'cosine', 'self_loops': False, 'use_snp_selection': False}. Best is trial 32 with value: 0.1359998317137015.
[I 2025-11-03 12:18:57,883] Trial 98 finished with value: 0.12385010737055395 and parameters: {'model_type': 'gcn', 'hidden_dims': '[512, 64]', 'dropout': 0.5192380339138404, 'batch_norm': True, 'lr': 0.0007185427630099844, 'weight_decay': 4.048253163248992e-07, 'epochs': 208, 'loss': 'mse', 'optimizer': 'adam', 'graph_mode': 'cutoff', 'cutoff': 0.8012247424239634, 'grm_norm': 'cosine_then_gcn', 'self_loops': True, 'use_snp_selection': False}. Best is trial 32 with value: 0.1359998317137015.
[I 2025-11-03 12:19:00,553] Trial 99 finished with value: 0.12314559017169824 and parameters: {'model_type': 'gcn', 'hidden_dims': '[512, 64]', 'dropout': 0.5222662870560429, 'batch_norm': True, 'lr': 0.0004567371034105407, 'weight_decay': 4.0263630476544027e-07, 'epochs': 190, 'loss': 'mse', 'optimizer': 'adam', 'graph_mode': 'cutoff', 'cutoff': 0.8646507860941776, 'grm_norm': 'cosine_then_gcn', 'self_loops': True, 'use_snp_selection': False}. Best is trial 32 with value: 0.1359998317137015.
[I 2025-11-03 12:19:03,323] Trial 100 finished with value: 0.12760433948469607 and parameters: {'model_type': 'gcn', 'hidden_dims': '[512, 64]', 'dropout': 0.5123464783436895, 'batch_norm': True, 'lr': 0.00022847835555425987, 'weight_decay': 5.332277300643212e-07, 'epochs': 207, 'loss': 'mse', 'optimizer': 'adam', 'graph_mode': 'cutoff', 'cutoff': 0.8623128336905167, 'grm_norm': 'none', 'self_loops': True, 'use_snp_selection': False}. Best is trial 32 with value: 0.1359998317137015.
[I 2025-11-03 12:19:05,857] Trial 101 finished with value: 0.11368122879541362 and parameters: {'model_type': 'gcn', 'hidden_dims': '[512, 64]', 'dropout': 0.5019603647092826, 'batch_norm': True, 'lr': 0.0003530356520872173, 'weight_decay': 2.9440177806978634e-07, 'epochs': 175, 'loss': 'mse', 'optimizer': 'adam', 'graph_mode': 'cutoff', 'cutoff': 0.8611936301302883, 'grm_norm': 'none', 'self_loops': True, 'use_snp_selection': False}. Best is trial 32 with value: 0.1359998317137015.
[I 2025-11-03 12:19:08,590] Trial 102 finished with value: 0.11716143947866474 and parameters: {'model_type': 'gcn', 'hidden_dims': '[512, 64]', 'dropout': 0.5221639911785131, 'batch_norm': True, 'lr': 0.0004582406753541327, 'weight_decay': 1.908093849094163e-07, 'epochs': 202, 'loss': 'mse', 'optimizer': 'adam', 'graph_mode': 'cutoff', 'cutoff': 0.8648132700026008, 'grm_norm': 'none', 'self_loops': True, 'use_snp_selection': False}. Best is trial 32 with value: 0.1359998317137015.
[I 2025-11-03 12:19:11,249] Trial 103 finished with value: 0.09686501641677955 and parameters: {'model_type': 'gcn', 'hidden_dims': '[512, 64]', 'dropout': 0.5138561484646925, 'batch_norm': True, 'lr': 0.00024826539973665, 'weight_decay': 8.935317424649112e-07, 'epochs': 191, 'loss': 'mse', 'optimizer': 'adam', 'graph_mode': 'cutoff', 'cutoff': 0.7985254423002257, 'grm_norm': 'none', 'self_loops': True, 'use_snp_selection': False}. Best is trial 32 with value: 0.1359998317137015.
[I 2025-11-03 12:19:13,991] Trial 104 finished with value: 0.12045102289879966 and parameters: {'model_type': 'gcn', 'hidden_dims': '[512, 64]', 'dropout': 0.47591509260370785, 'batch_norm': True, 'lr': 0.00016062632628831698, 'weight_decay': 4.3218395070516857e-07, 'epochs': 203, 'loss': 'mse', 'optimizer': 'adam', 'graph_mode': 'cutoff', 'cutoff': 0.886715629415942, 'grm_norm': 'none', 'self_loops': True, 'use_snp_selection': False}. Best is trial 32 with value: 0.1359998317137015.
[I 2025-11-03 12:19:16,811] Trial 105 finished with value: 0.11967292894643913 and parameters: {'model_type': 'gcn', 'hidden_dims': '[512, 64]', 'dropout': 0.5378779769144985, 'batch_norm': True, 'lr': 0.0007175997641193973, 'weight_decay': 5.673814918617407e-07, 'epochs': 212, 'loss': 'mse', 'optimizer': 'adam', 'graph_mode': 'cutoff', 'cutoff': 0.8349911050115671, 'grm_norm': 'cosine', 'self_loops': True, 'use_snp_selection': False}. Best is trial 32 with value: 0.1359998317137015.
[I 2025-11-03 12:19:19,203] Trial 106 finished with value: 0.11944751630249043 and parameters: {'model_type': 'gcn', 'hidden_dims': '[512, 64]', 'dropout': 0.5314455698858334, 'batch_norm': True, 'lr': 0.00040963218186427196, 'weight_decay': 1.153959849182478e-07, 'epochs': 152, 'loss': 'mse', 'optimizer': 'adam', 'graph_mode': 'cutoff', 'cutoff': 0.8205666389038404, 'grm_norm': 'cosine_then_gcn', 'self_loops': True, 'use_snp_selection': False}. Best is trial 32 with value: 0.1359998317137015.
[I 2025-11-03 12:19:22,079] Trial 107 finished with value: 0.1196421884760212 and parameters: {'model_type': 'gcn', 'hidden_dims': '[512, 64]', 'dropout': 0.49925477301499915, 'batch_norm': True, 'lr': 0.000491024131324432, 'weight_decay': 2.537279292697935e-07, 'epochs': 217, 'loss': 'mae', 'optimizer': 'adam', 'graph_mode': 'cutoff', 'cutoff': 0.7798154592216496, 'grm_norm': 'cosine_then_gcn', 'self_loops': True, 'use_snp_selection': False}. Best is trial 32 with value: 0.1359998317137015.
[I 2025-11-03 12:19:24,700] Trial 108 finished with value: 0.015004545209205874 and parameters: {'model_type': 'gcn', 'hidden_dims': '[512, 64]', 'dropout': 0.5521411760268355, 'batch_norm': True, 'lr': 6.53276542306643e-06, 'weight_decay': 4.318170370823906e-07, 'epochs': 185, 'loss': 'mse', 'optimizer': 'adam', 'graph_mode': 'cutoff', 'cutoff': 0.3327060522544292, 'grm_norm': 'none', 'self_loops': True, 'use_snp_selection': False}. Best is trial 32 with value: 0.1359998317137015.
[I 2025-11-03 12:19:26,968] Trial 109 finished with value: 0.08143767631505122 and parameters: {'model_type': 'gcn', 'hidden_dims': '[512, 64]', 'dropout': 0.5437135431512223, 'batch_norm': True, 'lr': 0.0002446070455373038, 'weight_decay': 5.471372314147215e-07, 'epochs': 137, 'loss': 'mse', 'optimizer': 'adam', 'graph_mode': 'cutoff', 'cutoff': 0.8687922508570867, 'grm_norm': 'gcn', 'self_loops': True, 'use_snp_selection': False}. Best is trial 32 with value: 0.1359998317137015.
[I 2025-11-03 12:19:29,324] Trial 110 finished with value: 0.1036359008919712 and parameters: {'model_type': 'gcn', 'hidden_dims': '[256, 128, 64]', 'dropout': 0.5187252279038047, 'batch_norm': True, 'lr': 0.00031324677615256576, 'weight_decay': 7.262679233095183e-07, 'epochs': 207, 'loss': 'mse', 'optimizer': 'adam', 'graph_mode': 'cutoff', 'cutoff': 0.8048148124680629, 'grm_norm': 'cosine_then_gcn', 'self_loops': True, 'use_snp_selection': False}. Best is trial 32 with value: 0.1359998317137015.
[I 2025-11-03 12:19:32,255] Trial 111 finished with value: 0.11542071100056545 and parameters: {'model_type': 'gcn', 'hidden_dims': '[512, 64]', 'dropout': 0.33143937907239907, 'batch_norm': True, 'lr': 0.0005809259196561775, 'weight_decay': 3.606688639645519e-07, 'epochs': 226, 'loss': 'mse', 'optimizer': 'adam', 'graph_mode': 'cutoff', 'cutoff': 0.7385684682097703, 'grm_norm': 'cosine_then_gcn', 'self_loops': True, 'use_snp_selection': False}. Best is trial 32 with value: 0.1359998317137015.
[I 2025-11-03 12:19:35,223] Trial 112 finished with value: 0.11662369567679216 and parameters: {'model_type': 'gcn', 'hidden_dims': '[512, 128]', 'dropout': 0.36767081320780515, 'batch_norm': True, 'lr': 0.0006771651074307676, 'weight_decay': 3.1322064542888116e-07, 'epochs': 231, 'loss': 'mse', 'optimizer': 'adam', 'graph_mode': 'cutoff', 'cutoff': 0.8450560508816921, 'grm_norm': 'cosine_then_gcn', 'self_loops': True, 'use_snp_selection': False}. Best is trial 32 with value: 0.1359998317137015.
[I 2025-11-03 12:19:38,118] Trial 113 finished with value: 0.11880316691769693 and parameters: {'model_type': 'gcn', 'hidden_dims': '[512, 64]', 'dropout': 0.3064503102783119, 'batch_norm': True, 'lr': 0.000796598532432559, 'weight_decay': 1.6054731038971372e-07, 'epochs': 220, 'loss': 'mse', 'optimizer': 'adam', 'graph_mode': 'cutoff', 'cutoff': 0.530917152819873, 'grm_norm': 'cosine_then_gcn', 'self_loops': True, 'use_snp_selection': False}. Best is trial 32 with value: 0.1359998317137015.
[I 2025-11-03 12:19:40,708] Trial 114 finished with value: 0.10351331969821458 and parameters: {'model_type': 'gcn', 'hidden_dims': '[512, 64]', 'dropout': 0.5593549116755933, 'batch_norm': True, 'lr': 0.0005723241823284576, 'weight_decay': 3.613135462014331e-07, 'epochs': 178, 'loss': 'mse', 'optimizer': 'adam', 'graph_mode': 'cutoff', 'cutoff': 0.3963399287492393, 'grm_norm': 'cosine_then_gcn', 'self_loops': True, 'use_snp_selection': False}. Best is trial 32 with value: 0.1359998317137015.
