[I 2025-11-03 13:12:15,004] Trial 85 finished with value: 0.04055961491676654 and parameters: {'model_type': 'gcn', 'hidden_dims': '[512, 256]', 'dropout': 0.2644672804645846, 'batch_norm': True, 'lr': 0.0002563222954300976, 'weight_decay': 5.377436799208827e-06, 'epochs': 326, 'loss': 'mae', 'optimizer': 'adam', 'graph_mode': 'off', 'use_snp_selection': False}. Best is trial 68 with value: 0.05388305186522981.
[I 2025-11-03 13:12:17,473] Trial 86 finished with value: 0.03095821772804654 and parameters: {'model_type': 'gcn', 'hidden_dims': '[512, 256]', 'dropout': 0.304836874805223, 'batch_norm': True, 'lr': 0.00012602056465948366, 'weight_decay': 1.8859033516738418e-06, 'epochs': 332, 'loss': 'mae', 'optimizer': 'adam', 'graph_mode': 'off', 'use_snp_selection': False}. Best is trial 68 with value: 0.05388305186522981.
[I 2025-11-03 13:12:19,828] Trial 87 finished with value: 0.022244396849360693 and parameters: {'model_type': 'gcn', 'hidden_dims': '[512, 256]', 'dropout': 0.2746032913016021, 'batch_norm': True, 'lr': 9.812935958430723e-05, 'weight_decay': 3.3433257129483765e-06, 'epochs': 299, 'loss': 'mae', 'optimizer': 'adam', 'graph_mode': 'off', 'use_snp_selection': False}. Best is trial 68 with value: 0.05388305186522981.
[I 2025-11-03 13:12:22,344] Trial 88 finished with value: 0.04246785841827531 and parameters: {'model_type': 'gcn', 'hidden_dims': '[512, 256]', 'dropout': 0.25048618633511466, 'batch_norm': True, 'lr': 0.0001680315049875833, 'weight_decay': 2.464983173517035e-06, 'epochs': 343, 'loss': 'mae', 'optimizer': 'adam', 'graph_mode': 'off', 'use_snp_selection': False}. Best is trial 68 with value: 0.05388305186522981.
[I 2025-11-03 13:12:24,859] Trial 89 finished with value: 0.039108006085605745 and parameters: {'model_type': 'gcn', 'hidden_dims': '[512, 256]', 'dropout': 0.3155235171269204, 'batch_norm': True, 'lr': 0.00042539012123276806, 'weight_decay': 4.569037765148467e-06, 'epochs': 341, 'loss': 'mae', 'optimizer': 'adam', 'graph_mode': 'off', 'use_snp_selection': False}. Best is trial 68 with value: 0.05388305186522981.
[I 2025-11-03 13:12:27,704] Trial 90 finished with value: 0.022703761708941075 and parameters: {'model_type': 'gcn', 'hidden_dims': '[512, 256]', 'dropout': 0.22790622279934702, 'batch_norm': True, 'lr': 0.0003191365538692479, 'weight_decay': 1.2494014613459994e-06, 'epochs': 321, 'loss': 'mae', 'optimizer': 'adam', 'graph_mode': 'off', 'use_snp_selection': True, 'num_snps': 48165}. Best is trial 68 with value: 0.05388305186522981.
[I 2025-11-03 13:12:30,082] Trial 91 finished with value: 0.04011336929473828 and parameters: {'model_type': 'gcn', 'hidden_dims': '[512, 256]', 'dropout': 0.2058433129402618, 'batch_norm': True, 'lr': 0.00021681173994385686, 'weight_decay': 7.466890842819741e-06, 'epochs': 325, 'loss': 'mae', 'optimizer': 'adam', 'graph_mode': 'off', 'use_snp_selection': False}. Best is trial 68 with value: 0.05388305186522981.
[I 2025-11-03 13:12:31,870] Trial 92 finished with value: 0.019595154480723246 and parameters: {'model_type': 'gcn', 'hidden_dims': '[256, 128, 64]', 'dropout': 0.1922014190427145, 'batch_norm': True, 'lr': 0.00013239744332176103, 'weight_decay': 3.949170955090386e-06, 'epochs': 281, 'loss': 'mae', 'optimizer': 'adam', 'graph_mode': 'off', 'use_snp_selection': False}. Best is trial 68 with value: 0.05388305186522981.
[I 2025-11-03 13:12:34,214] Trial 93 finished with value: 0.048411282853477657 and parameters: {'model_type': 'gcn', 'hidden_dims': '[512, 256]', 'dropout': 0.2779636491617525, 'batch_norm': True, 'lr': 0.00027031594746777614, 'weight_decay': 9.868840346356823e-06, 'epochs': 312, 'loss': 'mae', 'optimizer': 'adam', 'graph_mode': 'off', 'use_snp_selection': False}. Best is trial 68 with value: 0.05388305186522981.
[I 2025-11-03 13:12:36,672] Trial 94 finished with value: 0.04776480427388723 and parameters: {'model_type': 'gcn', 'hidden_dims': '[512, 256]', 'dropout': 0.27099019269293834, 'batch_norm': True, 'lr': 0.0002825863515920216, 'weight_decay': 1.064108381507937e-05, 'epochs': 332, 'loss': 'mae', 'optimizer': 'adam', 'graph_mode': 'off', 'use_snp_selection': False}. Best is trial 68 with value: 0.05388305186522981.
[I 2025-11-03 13:12:39,024] Trial 95 finished with value: 0.050368960087730424 and parameters: {'model_type': 'gcn', 'hidden_dims': '[512, 256]', 'dropout': 0.2743664884538156, 'batch_norm': True, 'lr': 0.0002712208054851958, 'weight_decay': 9.656486393977074e-06, 'epochs': 313, 'loss': 'mae', 'optimizer': 'adam', 'graph_mode': 'off', 'use_snp_selection': False}. Best is trial 68 with value: 0.05388305186522981.
[I 2025-11-03 13:12:41,321] Trial 96 finished with value: 0.04874342498649543 and parameters: {'model_type': 'gcn', 'hidden_dims': '[512, 256]', 'dropout': 0.3217128554322817, 'batch_norm': True, 'lr': 0.00025907645131603837, 'weight_decay': 1.0958670239008673e-05, 'epochs': 309, 'loss': 'mae', 'optimizer': 'adam', 'graph_mode': 'off', 'use_snp_selection': False}. Best is trial 68 with value: 0.05388305186522981.
[I 2025-11-03 13:12:43,670] Trial 97 finished with value: 0.04614660961691138 and parameters: {'model_type': 'gcn', 'hidden_dims': '[512, 64]', 'dropout': 0.3241119418709633, 'batch_norm': True, 'lr': 0.0004730038216826583, 'weight_decay': 9.845958283722226e-06, 'epochs': 312, 'loss': 'mae', 'optimizer': 'adam', 'graph_mode': 'off', 'use_snp_selection': False}. Best is trial 68 with value: 0.05388305186522981.
[I 2025-11-03 13:12:45,981] Trial 98 finished with value: 0.027119811996666923 and parameters: {'model_type': 'gcn', 'hidden_dims': '[512, 256]', 'dropout': 0.3028949050403635, 'batch_norm': True, 'lr': 0.00025184641468117147, 'weight_decay': 1.3961921405335565e-05, 'epochs': 303, 'loss': 'mae', 'optimizer': 'adam', 'graph_mode': 'off', 'use_snp_selection': False}. Best is trial 68 with value: 0.05388305186522981.
[I 2025-11-03 13:12:48,322] Trial 99 finished with value: 0.047510721222527606 and parameters: {'model_type': 'gcn', 'hidden_dims': '[512, 256]', 'dropout': 0.2870842872808853, 'batch_norm': True, 'lr': 0.0003196611826917378, 'weight_decay': 2.396835225460611e-05, 'epochs': 311, 'loss': 'mae', 'optimizer': 'adam', 'graph_mode': 'off', 'use_snp_selection': False}. Best is trial 68 with value: 0.05388305186522981.
[I 2025-11-03 13:12:50,688] Trial 100 finished with value: 0.044339762786593906 and parameters: {'model_type': 'gcn', 'hidden_dims': '[512, 256]', 'dropout': 0.2868140811794231, 'batch_norm': True, 'lr': 0.00032292410195047447, 'weight_decay': 6.582017402154286e-06, 'epochs': 316, 'loss': 'mae', 'optimizer': 'adam', 'graph_mode': 'off', 'use_snp_selection': False}. Best is trial 68 with value: 0.05388305186522981.
[I 2025-11-03 13:12:52,946] Trial 101 finished with value: 0.033451721886112125 and parameters: {'model_type': 'gcn', 'hidden_dims': '[512, 256]', 'dropout': 0.3130663457139805, 'batch_norm': True, 'lr': 0.0002895027135362553, 'weight_decay': 2.291651528516414e-05, 'epochs': 292, 'loss': 'mae', 'optimizer': 'adam', 'graph_mode': 'off', 'use_snp_selection': False}. Best is trial 68 with value: 0.05388305186522981.
[I 2025-11-03 13:12:55,287] Trial 102 finished with value: 0.04134954045212728 and parameters: {'model_type': 'gcn', 'hidden_dims': '[512, 256]', 'dropout': 0.24404689871207302, 'batch_norm': True, 'lr': 0.00041564528327555245, 'weight_decay': 1.5214279328114687e-05, 'epochs': 313, 'loss': 'mae', 'optimizer': 'adam', 'graph_mode': 'off', 'use_snp_selection': False}. Best is trial 68 with value: 0.05388305186522981.
[I 2025-11-03 13:12:57,421] Trial 103 finished with value: 0.04497630311761171 and parameters: {'model_type': 'gcn', 'hidden_dims': '[512, 256]', 'dropout': 0.2670605762134677, 'batch_norm': True, 'lr': 0.0006127566720334932, 'weight_decay': 3.262140863797328e-05, 'epochs': 270, 'loss': 'mae', 'optimizer': 'adam', 'graph_mode': 'off', 'use_snp_selection': False}. Best is trial 68 with value: 0.05388305186522981.
[I 2025-11-03 13:12:59,912] Trial 104 finished with value: 0.04417273251302203 and parameters: {'model_type': 'gcn', 'hidden_dims': '[512, 256]', 'dropout': 0.33572910450322574, 'batch_norm': True, 'lr': 0.0001676173182713945, 'weight_decay': 1.1922456465598959e-05, 'epochs': 345, 'loss': 'mae', 'optimizer': 'adam', 'graph_mode': 'off', 'use_snp_selection': False}. Best is trial 68 with value: 0.05388305186522981.
[I 2025-11-03 13:13:01,193] Trial 105 finished with value: 0.0435187738883783 and parameters: {'model_type': 'gcn', 'hidden_dims': '[128, 64]', 'dropout': 0.29177786854452764, 'batch_norm': True, 'lr': 0.0002101631643170623, 'weight_decay': 8.887134045921618e-06, 'epochs': 297, 'loss': 'mae', 'optimizer': 'adam', 'graph_mode': 'off', 'use_snp_selection': False}. Best is trial 68 with value: 0.05388305186522981.
[I 2025-11-03 13:13:03,395] Trial 106 finished with value: 0.0386849522292911 and parameters: {'model_type': 'gcn', 'hidden_dims': '[512, 256]', 'dropout': 0.2808599563415084, 'batch_norm': True, 'lr': 0.000575080564070343, 'weight_decay': 5.07011951274744e-05, 'epochs': 286, 'loss': 'mae', 'optimizer': 'adam', 'graph_mode': 'off', 'use_snp_selection': False}. Best is trial 68 with value: 0.05388305186522981.
[I 2025-11-03 13:13:05,674] Trial 107 finished with value: 0.03918003679788539 and parameters: {'model_type': 'gcn', 'hidden_dims': '[512, 256]', 'dropout': 0.36191546078503756, 'batch_norm': True, 'lr': 0.00028049423388109695, 'weight_decay': 2.895136628936629e-05, 'epochs': 305, 'loss': 'mae', 'optimizer': 'adam', 'graph_mode': 'off', 'use_snp_selection': False}. Best is trial 68 with value: 0.05388305186522981.
[I 2025-11-03 13:13:07,710] Trial 108 finished with value: 0.04361641880724112 and parameters: {'model_type': 'gcn', 'hidden_dims': '[256, 128, 64]', 'dropout': 0.32564992477407717, 'batch_norm': True, 'lr': 0.0007395477473552789, 'weight_decay': 1.125905763030364e-05, 'epochs': 338, 'loss': 'mae', 'optimizer': 'adam', 'graph_mode': 'off', 'use_snp_selection': False}. Best is trial 68 with value: 0.05388305186522981.
[I 2025-11-03 13:13:10,085] Trial 109 finished with value: 0.026098307999676003 and parameters: {'model_type': 'gcn', 'hidden_dims': '[512, 256]', 'dropout': 0.25123256766888696, 'batch_norm': True, 'lr': 9.50008724971897e-05, 'weight_decay': 2.2516101526145146e-05, 'epochs': 334, 'loss': 'mae', 'optimizer': 'adam', 'graph_mode': 'off', 'use_snp_selection': True, 'num_snps': 37017}. Best is trial 68 with value: 0.05388305186522981.
[I 2025-11-03 13:13:11,738] Trial 110 finished with value: 0.03484716031975347 and parameters: {'model_type': 'gcn', 'hidden_dims': '[256, 128]', 'dropout': 0.21239310807293785, 'batch_norm': True, 'lr': 0.0003749327534534951, 'weight_decay': 4.235380844273212e-05, 'epochs': 309, 'loss': 'mae', 'optimizer': 'adam', 'graph_mode': 'off', 'use_snp_selection': False}. Best is trial 68 with value: 0.05388305186522981.
[I 2025-11-03 13:13:14,280] Trial 111 finished with value: 0.046738138471282484 and parameters: {'model_type': 'gcn', 'hidden_dims': '[512, 256]', 'dropout': 0.2259394789252654, 'batch_norm': True, 'lr': 0.00023528798742086378, 'weight_decay': 5.255259409720182e-06, 'epochs': 350, 'loss': 'mae', 'optimizer': 'adam', 'graph_mode': 'off', 'use_snp_selection': False}. Best is trial 68 with value: 0.05388305186522981.
[I 2025-11-03 13:13:16,676] Trial 112 finished with value: 0.03613166194161603 and parameters: {'model_type': 'gcn', 'hidden_dims': '[512, 256]', 'dropout': 0.27108340328899905, 'batch_norm': True, 'lr': 0.00048703289034243436, 'weight_decay': 1.6467827752921477e-05, 'epochs': 322, 'loss': 'mae', 'optimizer': 'adam', 'graph_mode': 'off', 'use_snp_selection': False}. Best is trial 68 with value: 0.05388305186522981.
[I 2025-11-03 13:13:19,142] Trial 113 finished with value: -0.005354502939345991 and parameters: {'model_type': 'gcn', 'hidden_dims': '[512, 256]', 'dropout': 0.3083098575835621, 'batch_norm': True, 'lr': 3.740404803351678e-05, 'weight_decay': 8.268037115222462e-06, 'epochs': 328, 'loss': 'mae', 'optimizer': 'adam', 'graph_mode': 'off', 'use_snp_selection': False}. Best is trial 68 with value: 0.05388305186522981.
[I 2025-11-03 13:13:21,520] Trial 114 finished with value: 0.03796559560096159 and parameters: {'model_type': 'gcn', 'hidden_dims': '[512, 256]', 'dropout': 0.2954462027395927, 'batch_norm': True, 'lr': 0.0002813413787317158, 'weight_decay': 6.142661430129854e-06, 'epochs': 317, 'loss': 'mae', 'optimizer': 'adam', 'graph_mode': 'off', 'use_snp_selection': False}. Best is trial 68 with value: 0.05388305186522981.
[I 2025-11-03 13:13:22,886] Trial 115 finished with value: 0.011244834353311604 and parameters: {'model_type': 'gcn', 'hidden_dims': '[512, 256]', 'dropout': 0.2586735644341768, 'batch_norm': True, 'lr': 2.4917136641556033e-05, 'weight_decay': 2.0527479301564887e-05, 'epochs': 119, 'loss': 'mae', 'optimizer': 'adam', 'graph_mode': 'off', 'use_snp_selection': False}. Best is trial 68 with value: 0.05388305186522981.
[I 2025-11-03 13:13:24,157] Trial 116 finished with value: 0.06356138915670498 and parameters: {'model_type': 'gcn', 'hidden_dims': '[512, 64]', 'dropout': 0.33979651984939635, 'batch_norm': True, 'lr': 0.0003340670527592623, 'weight_decay': 3.5509710532656354e-06, 'epochs': 89, 'loss': 'mae', 'optimizer': 'adam', 'graph_mode': 'off', 'use_snp_selection': False}. Best is trial 116 with value: 0.06356138915670498.
[I 2025-11-03 13:13:25,320] Trial 117 finished with value: 0.036615369339208836 and parameters: {'model_type': 'gcn', 'hidden_dims': '[512, 64]', 'dropout': 0.34002371353643734, 'batch_norm': True, 'lr': 0.0003295369241360678, 'weight_decay': 3.5864598405926625e-06, 'epochs': 85, 'loss': 'mae', 'optimizer': 'adam', 'graph_mode': 'off', 'use_snp_selection': False}. Best is trial 116 with value: 0.06356138915670498.
[I 2025-11-03 13:13:26,508] Trial 118 finished with value: 0.031146736463148347 and parameters: {'model_type': 'gcn', 'hidden_dims': '[512, 256]', 'dropout': 0.24240092856703607, 'batch_norm': True, 'lr': 0.00036659158231161927, 'weight_decay': 2.139280012999796e-06, 'epochs': 82, 'loss': 'mae', 'optimizer': 'adam', 'graph_mode': 'off', 'use_snp_selection': False}. Best is trial 116 with value: 0.06356138915670498.
[I 2025-11-03 13:13:27,306] Trial 119 finished with value: 0.03899839147776482 and parameters: {'model_type': 'gcn', 'hidden_dims': '[256, 128]', 'dropout': 0.37269661510895874, 'batch_norm': True, 'lr': 0.00014609130390391242, 'weight_decay': 2.70507627168136e-06, 'epochs': 52, 'loss': 'mae', 'optimizer': 'adam', 'graph_mode': 'off', 'use_snp_selection': False}. Best is trial 116 with value: 0.06356138915670498.
[I 2025-11-03 13:13:28,554] Trial 120 finished with value: 0.02721350393137871 and parameters: {'model_type': 'gcn', 'hidden_dims': '[512, 64]', 'dropout': 0.35413457152165995, 'batch_norm': True, 'lr': 0.00020335260089623122, 'weight_decay': 1.3584313904299729e-05, 'epochs': 94, 'loss': 'mae', 'optimizer': 'adam', 'graph_mode': 'off', 'use_snp_selection': False}. Best is trial 116 with value: 0.06356138915670498.
[I 2025-11-03 13:13:29,839] Trial 121 finished with value: 0.022403687960189083 and parameters: {'model_type': 'gcn', 'hidden_dims': '[512, 64]', 'dropout': 0.28241531098119815, 'batch_norm': True, 'lr': 0.00023845885921834652, 'weight_decay': 5.030445658046343e-06, 'epochs': 109, 'loss': 'mae', 'optimizer': 'adam', 'graph_mode': 'off', 'use_snp_selection': False}. Best is trial 116 with value: 0.06356138915670498.
[I 2025-11-03 13:13:31,317] Trial 122 finished with value: 0.029014662448718403 and parameters: {'model_type': 'gcn', 'hidden_dims': '[512, 64]', 'dropout': 0.39004745033212745, 'batch_norm': True, 'lr': 0.00026066134731322763, 'weight_decay': 8.096045907733137e-06, 'epochs': 140, 'loss': 'mae', 'optimizer': 'adam', 'graph_mode': 'off', 'use_snp_selection': False}. Best is trial 116 with value: 0.06356138915670498.
[I 2025-11-03 13:13:33,789] Trial 123 finished with value: 0.036568313020657855 and parameters: {'model_type': 'gcn', 'hidden_dims': '[512, 256]', 'dropout': 0.3193891494867661, 'batch_norm': True, 'lr': 0.0004165389214175758, 'weight_decay': 6.9342549345017536e-06, 'epochs': 331, 'loss': 'mae', 'optimizer': 'adam', 'graph_mode': 'off', 'use_snp_selection': False}. Best is trial 116 with value: 0.06356138915670498.
[I 2025-11-03 13:13:34,913] Trial 124 finished with value: 0.029091244270277886 and parameters: {'model_type': 'gcn', 'hidden_dims': '[512, 256]', 'dropout': 0.2723786153059523, 'batch_norm': True, 'lr': 6.161439024701245e-05, 'weight_decay': 3.7431102964415704e-06, 'epochs': 69, 'loss': 'mae', 'optimizer': 'adam', 'graph_mode': 'off', 'use_snp_selection': False}. Best is trial 116 with value: 0.06356138915670498.
[I 2025-11-03 13:13:36,229] Trial 125 finished with value: 0.03461284152102784 and parameters: {'model_type': 'gcn', 'hidden_dims': '[128, 64]', 'dropout': 0.2983684891731674, 'batch_norm': True, 'lr': 0.0001792671395335684, 'weight_decay': 1.5924538012752834e-06, 'epochs': 310, 'loss': 'mae', 'optimizer': 'adam', 'graph_mode': 'off', 'use_snp_selection': False}. Best is trial 116 with value: 0.06356138915670498.
[I 2025-11-03 13:13:38,058] Trial 126 finished with value: 0.024221954104986218 and parameters: {'model_type': 'gcn', 'hidden_dims': '[512, 256]', 'dropout': 0.17378115872885314, 'batch_norm': True, 'lr': 0.0003114888598994447, 'weight_decay': 9.913624901554058e-06, 'epochs': 207, 'loss': 'mae', 'optimizer': 'adam', 'graph_mode': 'off', 'use_snp_selection': False}. Best is trial 116 with value: 0.06356138915670498.
[I 2025-11-03 13:13:39,742] Trial 127 finished with value: 0.04800116872441304 and parameters: {'model_type': 'gcn', 'hidden_dims': '[512, 64]', 'dropout': 0.23430542066942153, 'batch_norm': True, 'lr': 0.0005374983707130626, 'weight_decay': 2.905543224160168e-06, 'epochs': 180, 'loss': 'mae', 'optimizer': 'adam', 'graph_mode': 'off', 'use_snp_selection': False}. Best is trial 116 with value: 0.06356138915670498.
[I 2025-11-03 13:13:41,257] Trial 128 finished with value: 0.028755972013358437 and parameters: {'model_type': 'gcn', 'hidden_dims': '[512, 64]', 'dropout': 0.2363052638445644, 'batch_norm': True, 'lr': 0.0005120005572299175, 'weight_decay': 3.120840847260069e-05, 'epochs': 152, 'loss': 'mae', 'optimizer': 'adam', 'graph_mode': 'off', 'use_snp_selection': False}. Best is trial 116 with value: 0.06356138915670498.
[I 2025-11-03 13:13:42,284] Trial 129 finished with value: 0.06569271683467445 and parameters: {'model_type': 'gcn', 'hidden_dims': '[512, 64]', 'dropout': 0.21659692413844647, 'batch_norm': True, 'lr': 0.0003902709815251317, 'weight_decay': 2.8973655096482992e-06, 'epochs': 172, 'loss': 'mae', 'optimizer': 'adam', 'graph_mode': 'off', 'use_snp_selection': True, 'num_snps': 9760}. Best is trial 129 with value: 0.06569271683467445.
[I 2025-11-03 13:13:43,337] Trial 130 finished with value: 0.048233718704134246 and parameters: {'model_type': 'gcn', 'hidden_dims': '[512, 64]', 'dropout': 0.2214768339434775, 'batch_norm': True, 'lr': 0.0009718631098446696, 'weight_decay': 2.0112044991460368e-06, 'epochs': 177, 'loss': 'mae', 'optimizer': 'adam', 'graph_mode': 'off', 'use_snp_selection': True, 'num_snps': 10565}. Best is trial 129 with value: 0.06569271683467445.
[I 2025-11-03 13:13:44,466] Trial 131 finished with value: 0.04502224795685889 and parameters: {'model_type': 'gcn', 'hidden_dims': '[512, 64]', 'dropout': 0.2173803395426243, 'batch_norm': True, 'lr': 0.0007833708939424655, 'weight_decay': 1.8984000974858394e-06, 'epochs': 185, 'loss': 'mae', 'optimizer': 'adam', 'graph_mode': 'off', 'use_snp_selection': True, 'num_snps': 12448}. Best is trial 129 with value: 0.06569271683467445.
[I 2025-11-03 13:13:45,526] Trial 132 finished with value: 0.06129743027789642 and parameters: {'model_type': 'gcn', 'hidden_dims': '[512, 64]', 'dropout': 0.197720600844054, 'batch_norm': True, 'lr': 0.0005566326875451054, 'weight_decay': 3.026098399904283e-06, 'epochs': 181, 'loss': 'mae', 'optimizer': 'adam', 'graph_mode': 'off', 'use_snp_selection': True, 'num_snps': 10570}. Best is trial 129 with value: 0.06569271683467445.
[I 2025-11-03 13:13:46,565] Trial 133 finished with value: 0.061255782722420986 and parameters: {'model_type': 'gcn', 'hidden_dims': '[512, 64]', 'dropout': 0.18794339299993568, 'batch_norm': True, 'lr': 0.0009915361746883223, 'weight_decay': 2.644010292470743e-06, 'epochs': 167, 'loss': 'mae', 'optimizer': 'adam', 'graph_mode': 'off', 'use_snp_selection': True, 'num_snps': 10248}. Best is trial 129 with value: 0.06569271683467445.
[I 2025-11-03 13:13:47,648] Trial 134 finished with value: 0.04991186144704882 and parameters: {'model_type': 'gcn', 'hidden_dims': '[512, 64]', 'dropout': 0.19619831009415897, 'batch_norm': True, 'lr': 0.0008279126622703261, 'weight_decay': 2.606694368776184e-06, 'epochs': 179, 'loss': 'mae', 'optimizer': 'adam', 'graph_mode': 'off', 'use_snp_selection': True, 'num_snps': 11558}. Best is trial 129 with value: 0.06569271683467445.
[I 2025-11-03 13:13:48,710] Trial 135 finished with value: 0.04409279728330652 and parameters: {'model_type': 'gcn', 'hidden_dims': '[512, 64]', 'dropout': 0.19380830194402426, 'batch_norm': True, 'lr': 0.0007652702417382312, 'weight_decay': 1.4323167676319573e-06, 'epochs': 178, 'loss': 'mae', 'optimizer': 'adam', 'graph_mode': 'off', 'use_snp_selection': True, 'num_snps': 9849}. Best is trial 129 with value: 0.06569271683467445.
[I 2025-11-03 13:13:49,712] Trial 136 finished with value: 0.05974634839052673 and parameters: {'model_type': 'gcn', 'hidden_dims': '[512, 64]', 'dropout': 0.21416768445189027, 'batch_norm': True, 'lr': 0.0009957637094065658, 'weight_decay': 2.6945252102350664e-06, 'epochs': 174, 'loss': 'mae', 'optimizer': 'adam', 'graph_mode': 'off', 'use_snp_selection': True, 'num_snps': 8873}. Best is trial 129 with value: 0.06569271683467445.
