[I 2025-11-03 13:43:30,135] Trial 12 finished with value: 0.014679502560190037 and parameters: {'model_type': 'gcn', 'hidden_dims': '[512, 64]', 'dropout': 0.2516138819478735, 'batch_norm': True, 'lr': 0.00016473964335013254, 'weight_decay': 1.0888016761521717e-07, 'epochs': 241, 'loss': 'mae', 'optimizer': 'adam', 'graph_mode': 'knn', 'source': 'grm', 'knn_k': 3, 'weighted_edges': True, 'symmetrize_mode': 'union', 'use_snp_selection': False}. Best is trial 10 with value: 0.05333011221906296.
[I 2025-11-03 13:43:32,813] Trial 13 finished with value: -0.009769597036072632 and parameters: {'model_type': 'gcn', 'hidden_dims': '[512, 64]', 'dropout': 0.3597295172492356, 'batch_norm': True, 'lr': 7.689848153447392e-05, 'weight_decay': 0.000399947667615736, 'epochs': 239, 'loss': 'mae', 'optimizer': 'adam', 'graph_mode': 'knn', 'source': 'grm', 'knn_k': 4, 'weighted_edges': True, 'symmetrize_mode': 'mutual', 'use_snp_selection': False}. Best is trial 10 with value: 0.05333011221906296.
[I 2025-11-03 13:43:35,826] Trial 14 finished with value: 0.027849000747593104 and parameters: {'model_type': 'gcn', 'hidden_dims': '[512, 256]', 'dropout': 0.4385756036094508, 'batch_norm': True, 'lr': 0.00024045260907397715, 'weight_decay': 8.616224859633281e-07, 'epochs': 297, 'loss': 'mae', 'optimizer': 'adam', 'graph_mode': 'knn', 'source': 'grm', 'knn_k': 3, 'weighted_edges': True, 'symmetrize_mode': 'union', 'use_snp_selection': False}. Best is trial 10 with value: 0.05333011221906296.
[I 2025-11-03 13:43:38,294] Trial 15 finished with value: 0.033378606484940516 and parameters: {'model_type': 'gcn', 'hidden_dims': '[512, 128]', 'dropout': 0.34064023609126615, 'batch_norm': True, 'lr': 0.00094645867610948, 'weight_decay': 0.00013722890470534003, 'epochs': 205, 'loss': 'mae', 'optimizer': 'adam', 'graph_mode': 'knn', 'source': 'grm', 'knn_k': 1, 'weighted_edges': True, 'symmetrize_mode': 'union', 'use_snp_selection': False}. Best is trial 10 with value: 0.05333011221906296.
[I 2025-11-03 13:43:41,001] Trial 16 finished with value: -0.009014845842860351 and parameters: {'model_type': 'gcn', 'hidden_dims': '[256, 128, 64]', 'dropout': 0.21340045660836113, 'batch_norm': True, 'lr': 1.089173461717849e-05, 'weight_decay': 5.000656300659671e-06, 'epochs': 329, 'loss': 'mae', 'optimizer': 'adam', 'graph_mode': 'knn', 'source': 'grm', 'knn_k': 10, 'weighted_edges': False, 'symmetrize_mode': 'mutual', 'use_snp_selection': False}. Best is trial 10 with value: 0.05333011221906296.
[I 2025-11-03 13:43:43,488] Trial 17 finished with value: 0.02365016612590622 and parameters: {'model_type': 'gcn', 'hidden_dims': '[512, 64]', 'dropout': 0.3506981040499272, 'batch_norm': True, 'lr': 6.670040555727496e-05, 'weight_decay': 4.902696780823698e-07, 'epochs': 206, 'loss': 'mae', 'optimizer': 'adam', 'graph_mode': 'knn', 'source': 'grm', 'knn_k': 3, 'weighted_edges': True, 'symmetrize_mode': 'mutual', 'use_snp_selection': False}. Best is trial 10 with value: 0.05333011221906296.
[I 2025-11-03 13:43:46,442] Trial 18 finished with value: 0.024392006557507628 and parameters: {'model_type': 'gcn', 'hidden_dims': '[512, 256]', 'dropout': 0.1913488279846849, 'batch_norm': True, 'lr': 0.0003020825844618164, 'weight_decay': 3.293863322548928e-07, 'epochs': 288, 'loss': 'mae', 'optimizer': 'adam', 'graph_mode': 'knn', 'source': 'grm', 'knn_k': 5, 'weighted_edges': True, 'symmetrize_mode': 'union', 'use_snp_selection': False}. Best is trial 10 with value: 0.05333011221906296.
[I 2025-11-03 13:43:48,937] Trial 19 finished with value: 0.031061906394526044 and parameters: {'model_type': 'gcn', 'hidden_dims': '[512, 64]', 'dropout': 0.257661882049502, 'batch_norm': True, 'lr': 1.4712248825400985e-05, 'weight_decay': 6.684257902688376e-06, 'epochs': 209, 'loss': 'mae', 'optimizer': 'adam', 'graph_mode': 'knn', 'source': 'grm', 'knn_k': 2, 'weighted_edges': True, 'symmetrize_mode': 'mutual', 'use_snp_selection': False}. Best is trial 10 with value: 0.05333011221906296.
[I 2025-11-03 13:43:51,689] Trial 20 finished with value: 0.03218932369719964 and parameters: {'model_type': 'gcn', 'hidden_dims': '[512, 256]', 'dropout': 0.46201114806835597, 'batch_norm': True, 'lr': 3.6318419901982732e-06, 'weight_decay': 1.9118285321422387e-06, 'epochs': 251, 'loss': 'mae', 'optimizer': 'adam', 'graph_mode': 'knn', 'source': 'grm', 'knn_k': 2, 'weighted_edges': False, 'symmetrize_mode': 'union', 'use_snp_selection': False}. Best is trial 10 with value: 0.05333011221906296.
[I 2025-11-03 13:43:54,604] Trial 21 finished with value: 0.007336226859654704 and parameters: {'model_type': 'gcn', 'hidden_dims': '[512, 64]', 'dropout': 0.5980780865101266, 'batch_norm': True, 'lr': 0.00010448754122265002, 'weight_decay': 1.016440735863689e-07, 'epochs': 282, 'loss': 'mae', 'optimizer': 'adam', 'graph_mode': 'knn', 'source': 'grm', 'knn_k': 1, 'weighted_edges': True, 'symmetrize_mode': 'union', 'use_snp_selection': False}. Best is trial 10 with value: 0.05333011221906296.
[I 2025-11-03 13:43:57,388] Trial 22 finished with value: 0.02676742205983682 and parameters: {'model_type': 'gcn', 'hidden_dims': '[512, 64]', 'dropout': 0.30088040227154417, 'batch_norm': True, 'lr': 0.0001301100337790242, 'weight_decay': 2.9020444420200044e-07, 'epochs': 257, 'loss': 'mae', 'optimizer': 'adam', 'graph_mode': 'knn', 'source': 'grm', 'knn_k': 1, 'weighted_edges': True, 'symmetrize_mode': 'union', 'use_snp_selection': False}. Best is trial 10 with value: 0.05333011221906296.
[I 2025-11-03 13:44:00,489] Trial 23 finished with value: 0.0350656041513019 and parameters: {'model_type': 'gcn', 'hidden_dims': '[512, 64]', 'dropout': 0.27530306466070964, 'batch_norm': True, 'lr': 0.00021611495151438258, 'weight_decay': 1.9924821280862547e-07, 'epochs': 314, 'loss': 'mae', 'optimizer': 'adam', 'graph_mode': 'knn', 'source': 'grm', 'knn_k': 2, 'weighted_edges': True, 'symmetrize_mode': 'union', 'use_snp_selection': False}. Best is trial 10 with value: 0.05333011221906296.
[I 2025-11-03 13:44:03,794] Trial 24 finished with value: 0.009850073163482582 and parameters: {'model_type': 'gcn', 'hidden_dims': '[512, 64]', 'dropout': 0.3840385302621344, 'batch_norm': True, 'lr': 0.00042413447400156494, 'weight_decay': 1.0893657632304206e-06, 'epochs': 350, 'loss': 'mae', 'optimizer': 'adam', 'graph_mode': 'knn', 'source': 'grm', 'knn_k': 4, 'weighted_edges': True, 'symmetrize_mode': 'union', 'use_snp_selection': False}. Best is trial 10 with value: 0.05333011221906296.
[I 2025-11-03 13:44:06,238] Trial 25 finished with value: 0.038972358470098833 and parameters: {'model_type': 'gcn', 'hidden_dims': '[256, 128, 64]', 'dropout': 0.316583463607237, 'batch_norm': True, 'lr': 5.3676731912961417e-05, 'weight_decay': 1.472369913993269e-05, 'epochs': 270, 'loss': 'mae', 'optimizer': 'adam', 'graph_mode': 'knn', 'source': 'grm', 'knn_k': 2, 'weighted_edges': True, 'symmetrize_mode': 'union', 'use_snp_selection': False}. Best is trial 10 with value: 0.05333011221906296.
[I 2025-11-03 13:44:10,411] Trial 26 finished with value: -0.05094349185538264 and parameters: {'model_type': 'gcn', 'hidden_dims': '[512, 128]', 'dropout': 0.2343042385908985, 'batch_norm': False, 'lr': 0.0001011555063101701, 'weight_decay': 2.5961438750364377e-06, 'epochs': 222, 'loss': 'mae', 'optimizer': 'adam', 'graph_mode': 'knn', 'source': 'grm', 'knn_k': 4, 'weighted_edges': True, 'symmetrize_mode': 'mutual', 'use_snp_selection': True, 'num_snps': 59005}. Best is trial 10 with value: 0.05333011221906296.
[I 2025-11-03 13:44:12,172] Trial 27 finished with value: 0.04417806211637635 and parameters: {'model_type': 'gcn', 'hidden_dims': '[256, 128]', 'dropout': 0.16989830283646706, 'batch_norm': True, 'lr': 0.0002445212409131831, 'weight_decay': 2.183684823257836e-07, 'epochs': 182, 'loss': 'mse', 'optimizer': 'adam', 'graph_mode': 'cutoff', 'cutoff': 0.8907049599927799, 'grm_norm': 'none', 'self_loops': True, 'use_snp_selection': False}. Best is trial 10 with value: 0.05333011221906296.
[I 2025-11-03 13:44:15,198] Trial 28 finished with value: 0.017631354995152164 and parameters: {'model_type': 'gcn', 'hidden_dims': '[512, 256]', 'dropout': 0.3280122274321417, 'batch_norm': True, 'lr': 0.0009669395796913093, 'weight_decay': 5.051659957834219e-07, 'epochs': 305, 'loss': 'mae', 'optimizer': 'adam', 'graph_mode': 'knn', 'source': 'grm', 'knn_k': 1, 'weighted_edges': False, 'symmetrize_mode': 'union', 'use_snp_selection': False}. Best is trial 10 with value: 0.05333011221906296.
[I 2025-11-03 13:44:16,913] Trial 29 finished with value: 0.014701060070721266 and parameters: {'model_type': 'gcn', 'hidden_dims': '[128, 64]', 'dropout': 0.37522064071976985, 'batch_norm': True, 'lr': 2.3383476614226923e-05, 'weight_decay': 5.891149253635699e-05, 'epochs': 229, 'loss': 'mae', 'optimizer': 'adam', 'graph_mode': 'knn', 'source': 'grm', 'knn_k': 3, 'weighted_edges': True, 'symmetrize_mode': 'mutual', 'use_snp_selection': False}. Best is trial 10 with value: 0.05333011221906296.
[I 2025-11-03 13:44:19,724] Trial 30 finished with value: -0.005332948585148838 and parameters: {'model_type': 'gcn', 'hidden_dims': '[512, 64]', 'dropout': 0.27217402307547917, 'batch_norm': True, 'lr': 1.2963802273643008e-06, 'weight_decay': 0.00020511462460338166, 'epochs': 266, 'loss': 'mae', 'optimizer': 'adam', 'graph_mode': 'knn', 'source': 'grm', 'knn_k': 2, 'weighted_edges': True, 'symmetrize_mode': 'union', 'use_snp_selection': False}. Best is trial 10 with value: 0.05333011221906296.
[I 2025-11-03 13:44:21,468] Trial 31 finished with value: 0.047030167115481754 and parameters: {'model_type': 'gcn', 'hidden_dims': '[256, 128]', 'dropout': 0.17405495313894456, 'batch_norm': True, 'lr': 0.000269872384802462, 'weight_decay': 1.5086165672280542e-07, 'epochs': 186, 'loss': 'mse', 'optimizer': 'adam', 'graph_mode': 'cutoff', 'cutoff': 0.8376721263693089, 'grm_norm': 'none', 'self_loops': True, 'use_snp_selection': False}. Best is trial 10 with value: 0.05333011221906296.
[I 2025-11-03 13:44:23,236] Trial 32 finished with value: 0.02748679331192812 and parameters: {'model_type': 'gcn', 'hidden_dims': '[256, 128]', 'dropout': 0.17761350986080182, 'batch_norm': True, 'lr': 0.0005677773819371054, 'weight_decay': 1.4066459386114854e-07, 'epochs': 184, 'loss': 'mse', 'optimizer': 'adam', 'graph_mode': 'cutoff', 'cutoff': 0.8837302360421116, 'grm_norm': 'none', 'self_loops': True, 'use_snp_selection': False}. Best is trial 10 with value: 0.05333011221906296.
[I 2025-11-03 13:44:24,884] Trial 33 finished with value: 0.04421773389220444 and parameters: {'model_type': 'gcn', 'hidden_dims': '[256, 128]', 'dropout': 0.14808000859932358, 'batch_norm': True, 'lr': 0.0001804462673224527, 'weight_decay': 3.766638827354521e-07, 'epochs': 150, 'loss': 'mse', 'optimizer': 'adam', 'graph_mode': 'cutoff', 'cutoff': 0.4645826081323344, 'grm_norm': 'cosine_then_gcn', 'self_loops': True, 'use_snp_selection': False}. Best is trial 10 with value: 0.05333011221906296.
[I 2025-11-03 13:44:26,687] Trial 34 finished with value: 0.04313217485384894 and parameters: {'model_type': 'gcn', 'hidden_dims': '[256, 128]', 'dropout': 0.22519806912995938, 'batch_norm': True, 'lr': 0.0003529571382281961, 'weight_decay': 1.210816785546342e-06, 'epochs': 199, 'loss': 'mse', 'optimizer': 'adam', 'graph_mode': 'cutoff', 'cutoff': 0.7564356847513154, 'grm_norm': 'cosine', 'self_loops': True, 'use_snp_selection': False}. Best is trial 10 with value: 0.05333011221906296.
[I 2025-11-03 13:44:27,799] Trial 35 finished with value: -0.003397861390328577 and parameters: {'model_type': 'gcn', 'hidden_dims': '[128, 64]', 'dropout': 0.28308740250577125, 'batch_norm': False, 'lr': 0.000538452439705902, 'weight_decay': 3.184998275725864e-05, 'epochs': 91, 'loss': 'mse', 'optimizer': 'adam', 'graph_mode': 'cutoff', 'cutoff': 0.5031226538615519, 'grm_norm': 'none', 'self_loops': True, 'use_snp_selection': True, 'num_snps': 2074}. Best is trial 10 with value: 0.05333011221906296.
[I 2025-11-03 13:44:29,133] Trial 36 finished with value: 0.012624660406573188 and parameters: {'model_type': 'gcn', 'hidden_dims': '[256, 128]', 'dropout': 0.41290163706814714, 'batch_norm': True, 'lr': 8.977220999732742e-05, 'weight_decay': 1.7363148388644174e-07, 'epochs': 60, 'loss': 'mse', 'optimizer': 'adam', 'graph_mode': 'cutoff', 'cutoff': 0.7999048978602779, 'grm_norm': 'none', 'self_loops': True, 'use_snp_selection': False}. Best is trial 10 with value: 0.05333011221906296.
[I 2025-11-03 13:44:30,957] Trial 37 finished with value: 0.05468068371672446 and parameters: {'model_type': 'gcn', 'hidden_dims': '[256, 128, 64]', 'dropout': 0.11019610454401223, 'batch_norm': False, 'lr': 0.00014090397297691331, 'weight_decay': 6.270290974793381e-07, 'epochs': 146, 'loss': 'mse', 'optimizer': 'adam', 'graph_mode': 'cutoff', 'cutoff': 0.6226670588453102, 'grm_norm': 'cosine', 'self_loops': True, 'use_snp_selection': True, 'num_snps': 15344}. Best is trial 37 with value: 0.05468068371672446.
[I 2025-11-03 13:44:32,626] Trial 38 finished with value: 0.033867727005405496 and parameters: {'model_type': 'gcn', 'hidden_dims': '[256, 128, 64]', 'dropout': 0.10436832089269099, 'batch_norm': False, 'lr': 4.383478429703083e-05, 'weight_decay': 5.442765068199992e-07, 'epochs': 119, 'loss': 'mse', 'optimizer': 'adam', 'graph_mode': 'cutoff', 'cutoff': 0.6164926930339812, 'grm_norm': 'cosine', 'self_loops': True, 'use_snp_selection': True, 'num_snps': 13533}. Best is trial 37 with value: 0.05468068371672446.
[I 2025-11-03 13:44:34,519] Trial 39 finished with value: -0.04735066362329992 and parameters: {'model_type': 'gcn', 'hidden_dims': '[256, 128, 64]', 'dropout': 0.15375981527995844, 'batch_norm': False, 'lr': 0.0007250271365438141, 'weight_decay': 6.049909268734511e-06, 'epochs': 152, 'loss': 'mse', 'optimizer': 'adam', 'graph_mode': 'cutoff', 'cutoff': 0.38886354184097466, 'grm_norm': 'cosine', 'self_loops': True, 'use_snp_selection': True, 'num_snps': 17106}. Best is trial 37 with value: 0.05468068371672446.
[I 2025-11-03 13:44:36,060] Trial 40 finished with value: 0.021037801862951164 and parameters: {'model_type': 'gcn', 'hidden_dims': '[256, 128, 64]', 'dropout': 0.1287552714121502, 'batch_norm': False, 'lr': 0.00028984784464219086, 'weight_decay': 3.445175059502541e-05, 'epochs': 164, 'loss': 'mse', 'optimizer': 'adam', 'graph_mode': 'cutoff', 'cutoff': 0.7969663494979176, 'grm_norm': 'cosine', 'self_loops': True, 'use_snp_selection': True, 'num_snps': 4693}. Best is trial 37 with value: 0.05468068371672446.
[I 2025-11-03 13:44:37,967] Trial 41 finished with value: 0.017262648283824147 and parameters: {'model_type': 'gcn', 'hidden_dims': '[256, 128, 64]', 'dropout': 0.20497308959139815, 'batch_norm': False, 'lr': 0.0001355807140670693, 'weight_decay': 2.6616314507946744e-07, 'epochs': 115, 'loss': 'mse', 'optimizer': 'adam', 'graph_mode': 'cutoff', 'cutoff': 0.6448350913056846, 'grm_norm': 'cosine_then_gcn', 'self_loops': True, 'use_snp_selection': True, 'num_snps': 20942}. Best is trial 37 with value: 0.05468068371672446.
[I 2025-11-03 13:44:40,839] Trial 42 finished with value: -0.028382585598637895 and parameters: {'model_type': 'gcn', 'hidden_dims': '[512, 256]', 'dropout': 0.1247400470787643, 'batch_norm': False, 'lr': 0.00018634849836375215, 'weight_decay': 1.3133893173986229e-07, 'epochs': 183, 'loss': 'mse', 'optimizer': 'adam', 'graph_mode': 'cutoff', 'cutoff': 0.22614870085919014, 'grm_norm': 'gcn', 'self_loops': True, 'use_snp_selection': True, 'num_snps': 36593}. Best is trial 37 with value: 0.05468068371672446.
[I 2025-11-03 13:44:42,787] Trial 43 finished with value: 0.012178913635992729 and parameters: {'model_type': 'gcn', 'hidden_dims': '[128, 64]', 'dropout': 0.24013703638130687, 'batch_norm': False, 'lr': 0.00038328108264602427, 'weight_decay': 5.731110373189188e-07, 'epochs': 142, 'loss': 'mse', 'optimizer': 'adam', 'graph_mode': 'cutoff', 'cutoff': 0.5289084740977872, 'grm_norm': 'cosine', 'self_loops': False, 'use_snp_selection': True, 'num_snps': 23592}. Best is trial 37 with value: 0.05468068371672446.
[I 2025-11-03 13:44:45,446] Trial 44 finished with value: 0.01347718870187702 and parameters: {'model_type': 'gcn', 'hidden_dims': '[512, 64]', 'dropout': 0.3130901861060775, 'batch_norm': True, 'lr': 6.463716276055224e-05, 'weight_decay': 1.5320904205913322e-05, 'epochs': 225, 'loss': 'mse', 'optimizer': 'adam', 'graph_mode': 'knn', 'source': 'grm', 'knn_k': 9, 'weighted_edges': True, 'symmetrize_mode': 'union', 'use_snp_selection': False}. Best is trial 37 with value: 0.05468068371672446.
[I 2025-11-03 13:44:49,596] Trial 45 finished with value: -0.009882350474999874 and parameters: {'model_type': 'gcn', 'hidden_dims': '[512, 128]', 'dropout': 0.1520483709419462, 'batch_norm': False, 'lr': 0.00013439817915172225, 'weight_decay': 1.8421496871167888e-07, 'epochs': 240, 'loss': 'mae', 'optimizer': 'adam', 'graph_mode': 'cutoff', 'cutoff': 0.440378331619806, 'grm_norm': 'none', 'self_loops': True, 'use_snp_selection': True, 'num_snps': 57670}. Best is trial 37 with value: 0.05468068371672446.
[I 2025-11-03 13:44:51,487] Trial 46 finished with value: 0.01955143667046743 and parameters: {'model_type': 'gcn', 'hidden_dims': '[256, 128]', 'dropout': 0.19014187184890752, 'batch_norm': True, 'lr': 3.160171357099517e-05, 'weight_decay': 1.4818454132135675e-06, 'epochs': 195, 'loss': 'mse', 'optimizer': 'adam', 'graph_mode': 'knn', 'source': 'grm', 'knn_k': 5, 'weighted_edges': True, 'symmetrize_mode': 'mutual', 'use_snp_selection': False}. Best is trial 37 with value: 0.05468068371672446.
[I 2025-11-03 13:44:53,411] Trial 47 finished with value: 0.027657758525275855 and parameters: {'model_type': 'gcn', 'hidden_dims': '[512, 256]', 'dropout': 0.10085076604939511, 'batch_norm': True, 'lr': 0.0002460066528302312, 'weight_decay': 7.174833363094993e-07, 'epochs': 106, 'loss': 'mae', 'optimizer': 'adam', 'graph_mode': 'knn', 'source': 'grm', 'knn_k': 1, 'weighted_edges': False, 'symmetrize_mode': 'union', 'use_snp_selection': False}. Best is trial 37 with value: 0.05468068371672446.
[I 2025-11-03 13:44:55,651] Trial 48 finished with value: 0.024115990144352662 and parameters: {'model_type': 'gcn', 'hidden_dims': '[512, 64]', 'dropout': 0.4603213465973797, 'batch_norm': True, 'lr': 0.00010435991888981605, 'weight_decay': 3.4561489492959166e-07, 'epochs': 170, 'loss': 'mae', 'optimizer': 'adam', 'graph_mode': 'cutoff', 'cutoff': 0.8256456529967966, 'grm_norm': 'none', 'self_loops': True, 'use_snp_selection': False}. Best is trial 37 with value: 0.05468068371672446.
[I 2025-11-03 13:44:57,082] Trial 49 finished with value: 0.025554359340952813 and parameters: {'model_type': 'gcn', 'hidden_dims': '[256, 128, 64]', 'dropout': 0.36840844943207046, 'batch_norm': False, 'lr': 0.00045063863461812764, 'weight_decay': 0.000859327516751154, 'epochs': 70, 'loss': 'mae', 'optimizer': 'adam', 'graph_mode': 'knn', 'source': 'grm', 'knn_k': 2, 'weighted_edges': True, 'symmetrize_mode': 'mutual', 'use_snp_selection': True, 'num_snps': 8721}. Best is trial 37 with value: 0.05468068371672446.
[I 2025-11-03 13:45:00,014] Trial 50 finished with value: 0.025483572936232195 and parameters: {'model_type': 'gcn', 'hidden_dims': '[512, 256]', 'dropout': 0.39961369266413116, 'batch_norm': True, 'lr': 0.00016820672156877807, 'weight_decay': 9.303383386756667e-05, 'epochs': 274, 'loss': 'mse', 'optimizer': 'adam', 'graph_mode': 'knn', 'source': 'grm', 'knn_k': 7, 'weighted_edges': True, 'symmetrize_mode': 'mutual', 'use_snp_selection': False}. Best is trial 37 with value: 0.05468068371672446.
[I 2025-11-03 13:45:01,669] Trial 51 finished with value: 0.03116046794719079 and parameters: {'model_type': 'gcn', 'hidden_dims': '[256, 128]', 'dropout': 0.12590428816111174, 'batch_norm': True, 'lr': 0.0001850273856876278, 'weight_decay': 3.4099344391008775e-07, 'epochs': 149, 'loss': 'mse', 'optimizer': 'adam', 'graph_mode': 'cutoff', 'cutoff': 0.468396334243826, 'grm_norm': 'cosine_then_gcn', 'self_loops': True, 'use_snp_selection': False}. Best is trial 37 with value: 0.05468068371672446.
[I 2025-11-03 13:45:03,264] Trial 52 finished with value: 0.03340021883589591 and parameters: {'model_type': 'gcn', 'hidden_dims': '[256, 128]', 'dropout': 0.1429295876682014, 'batch_norm': True, 'lr': 0.0002863818032071077, 'weight_decay': 1.0802639849397863e-07, 'epochs': 131, 'loss': 'mse', 'optimizer': 'adam', 'graph_mode': 'cutoff', 'cutoff': 0.584598682617943, 'grm_norm': 'cosine_then_gcn', 'self_loops': True, 'use_snp_selection': False}. Best is trial 37 with value: 0.05468068371672446.
[I 2025-11-03 13:45:04,959] Trial 53 finished with value: 0.03713954480830519 and parameters: {'model_type': 'gcn', 'hidden_dims': '[256, 128]', 'dropout': 0.17013873511149422, 'batch_norm': True, 'lr': 7.922635968275234e-05, 'weight_decay': 4.0867929939833924e-07, 'epochs': 158, 'loss': 'mse', 'optimizer': 'adam', 'graph_mode': 'cutoff', 'cutoff': 0.7118595434519372, 'grm_norm': 'cosine_then_gcn', 'self_loops': True, 'use_snp_selection': False}. Best is trial 37 with value: 0.05468068371672446.
[I 2025-11-03 13:45:06,871] Trial 54 finished with value: 0.029259910929695335 and parameters: {'model_type': 'gcn', 'hidden_dims': '[256, 128]', 'dropout': 0.33994362287487334, 'batch_norm': True, 'lr': 0.0006651608896579655, 'weight_decay': 2.2108439841000758e-07, 'epochs': 214, 'loss': 'mse', 'optimizer': 'adam', 'graph_mode': 'cutoff', 'cutoff': 0.4048406028711924, 'grm_norm': 'cosine_then_gcn', 'self_loops': True, 'use_snp_selection': False}. Best is trial 37 with value: 0.05468068371672446.
