[I 2025-11-03 14:07:22,593] Trial 139 finished with value: 0.09191877908750859 and parameters: {'model_type': 'graphsage', 'hidden_dims': '[256, 128]', 'dropout': 0.1005653676665306, 'batch_norm': False, 'lr': 0.0001492949256413066, 'weight_decay': 6.608822074905056e-05, 'epochs': 288, 'loss': 'mse', 'optimizer': 'adam', 'graph_mode': 'knn', 'source': 'grm', 'knn_k': 3, 'weighted_edges': False, 'symmetrize_mode': 'mutual', 'use_snp_selection': True, 'num_snps': 24017}. Best is trial 73 with value: 0.10606704674092371.
[I 2025-11-03 14:07:25,611] Trial 140 finished with value: 0.08835999575428946 and parameters: {'model_type': 'graphsage', 'hidden_dims': '[256, 128]', 'dropout': 0.12049505030694087, 'batch_norm': False, 'lr': 0.00021428388422572447, 'weight_decay': 0.00013087814894818323, 'epochs': 274, 'loss': 'mse', 'optimizer': 'adam', 'graph_mode': 'knn', 'source': 'grm', 'knn_k': 2, 'weighted_edges': True, 'symmetrize_mode': 'mutual', 'use_snp_selection': True, 'num_snps': 17290}. Best is trial 73 with value: 0.10606704674092371.
[I 2025-11-03 14:07:29,942] Trial 141 finished with value: 0.06432855316858038 and parameters: {'model_type': 'graphsage', 'hidden_dims': '[256, 128]', 'dropout': 0.16439708229181965, 'batch_norm': False, 'lr': 0.0007708392297276571, 'weight_decay': 0.0001565536500963508, 'epochs': 330, 'loss': 'mse', 'optimizer': 'adam', 'graph_mode': 'knn', 'source': 'grm', 'knn_k': 2, 'weighted_edges': True, 'symmetrize_mode': 'mutual', 'use_snp_selection': True, 'num_snps': 32439}. Best is trial 73 with value: 0.10606704674092371.
[I 2025-11-03 14:07:32,590] Trial 142 finished with value: 0.07059999127740162 and parameters: {'model_type': 'graphsage', 'hidden_dims': '[256, 128, 64]', 'dropout': 0.1771622397230761, 'batch_norm': False, 'lr': 0.00040333568448048987, 'weight_decay': 0.0001883103379233286, 'epochs': 114, 'loss': 'mse', 'optimizer': 'adam', 'graph_mode': 'knn', 'source': 'grm', 'knn_k': 2, 'weighted_edges': True, 'symmetrize_mode': 'mutual', 'use_snp_selection': True, 'num_snps': 18367}. Best is trial 73 with value: 0.10606704674092371.
[I 2025-11-03 14:07:37,096] Trial 143 finished with value: 0.08182018427792918 and parameters: {'model_type': 'graphsage', 'hidden_dims': '[512, 128]', 'dropout': 0.13692631046286927, 'batch_norm': False, 'lr': 0.00047111416820407205, 'weight_decay': 0.00024974168465079086, 'epochs': 338, 'loss': 'mse', 'optimizer': 'adam', 'graph_mode': 'knn', 'source': 'grm', 'knn_k': 2, 'weighted_edges': True, 'symmetrize_mode': 'mutual', 'use_snp_selection': True, 'num_snps': 21180}. Best is trial 73 with value: 0.10606704674092371.
[I 2025-11-03 14:07:42,571] Trial 144 finished with value: 0.08945174285752328 and parameters: {'model_type': 'graphsage', 'hidden_dims': '[256, 128]', 'dropout': 0.19897768219094777, 'batch_norm': False, 'lr': 0.00033208621696106277, 'weight_decay': 0.0006280511230782837, 'epochs': 311, 'loss': 'mse', 'optimizer': 'adam', 'graph_mode': 'knn', 'source': 'grm', 'knn_k': 2, 'weighted_edges': True, 'symmetrize_mode': 'mutual', 'use_snp_selection': True, 'num_snps': 47703}. Best is trial 73 with value: 0.10606704674092371.
[I 2025-11-03 14:07:45,841] Trial 145 finished with value: 0.06428859355463681 and parameters: {'model_type': 'graphsage', 'hidden_dims': '[256, 128, 64]', 'dropout': 0.13016705396533307, 'batch_norm': False, 'lr': 0.0002663787455027899, 'weight_decay': 0.00011734312610216052, 'epochs': 289, 'loss': 'mse', 'optimizer': 'adam', 'graph_mode': 'knn', 'source': 'grm', 'knn_k': 1, 'weighted_edges': True, 'symmetrize_mode': 'mutual', 'use_snp_selection': True, 'num_snps': 14550}. Best is trial 73 with value: 0.10606704674092371.
[I 2025-11-03 14:07:52,666] Trial 146 finished with value: 0.08560039286082557 and parameters: {'model_type': 'graphsage', 'hidden_dims': '[512, 256]', 'dropout': 0.111556285241282, 'batch_norm': False, 'lr': 0.0005503830370825215, 'weight_decay': 0.0001514436636736495, 'epochs': 301, 'loss': 'mse', 'optimizer': 'adam', 'graph_mode': 'knn', 'source': 'grm', 'knn_k': 4, 'weighted_edges': False, 'symmetrize_mode': 'mutual', 'use_snp_selection': True, 'num_snps': 41092}. Best is trial 73 with value: 0.10606704674092371.
[I 2025-11-03 14:07:56,678] Trial 147 finished with value: 0.08418331867132568 and parameters: {'model_type': 'graphsage', 'hidden_dims': '[512, 64]', 'dropout': 0.1567360415309495, 'batch_norm': False, 'lr': 0.0007043572132651269, 'weight_decay': 0.00021594833310416856, 'epochs': 282, 'loss': 'mse', 'optimizer': 'adam', 'graph_mode': 'knn', 'source': 'grm', 'knn_k': 2, 'weighted_edges': True, 'symmetrize_mode': 'mutual', 'use_snp_selection': True, 'num_snps': 19749}. Best is trial 73 with value: 0.10606704674092371.
[I 2025-11-03 14:08:01,477] Trial 148 finished with value: 0.07183837792655338 and parameters: {'model_type': 'graphsage', 'hidden_dims': '[256, 128, 64]', 'dropout': 0.18927236230342448, 'batch_norm': True, 'lr': 0.00018651707045183203, 'weight_decay': 0.0002844186050640332, 'epochs': 345, 'loss': 'mse', 'optimizer': 'adam', 'graph_mode': 'knn', 'source': 'grm', 'knn_k': 2, 'weighted_edges': False, 'symmetrize_mode': 'mutual', 'use_snp_selection': False}. Best is trial 73 with value: 0.10606704674092371.
[I 2025-11-03 14:08:05,477] Trial 149 finished with value: 0.07535132031756595 and parameters: {'model_type': 'graphsage', 'hidden_dims': '[256, 128]', 'dropout': 0.21446041632998003, 'batch_norm': False, 'lr': 2.8399358356652766e-05, 'weight_decay': 0.0003954018625078307, 'epochs': 325, 'loss': 'mae', 'optimizer': 'adam', 'graph_mode': 'knn', 'source': 'grm', 'knn_k': 1, 'weighted_edges': True, 'symmetrize_mode': 'union', 'use_snp_selection': True, 'num_snps': 28569}. Best is trial 73 with value: 0.10606704674092371.
[I 2025-11-03 14:08:11,814] Trial 0 finished with value: 0.0642899080586849 and parameters: {'model_type': 'graphsage', 'hidden_dims': '[128, 64]', 'dropout': 0.199031432379812, 'batch_norm': True, 'lr': 1.8408544111075837e-06, 'weight_decay': 5.5136510071208614e-05, 'epochs': 336, 'loss': 'mae', 'optimizer': 'adam', 'graph_mode': 'knn', 'source': 'grm', 'knn_k': 8, 'weighted_edges': True, 'symmetrize_mode': 'mutual', 'use_snp_selection': False}. Best is trial 0 with value: 0.0642899080586849.
[I 2025-11-03 14:08:14,441] Trial 1 finished with value: 0.13489210195935544 and parameters: {'model_type': 'graphsage', 'hidden_dims': '[128, 64]', 'dropout': 0.40051947670227217, 'batch_norm': True, 'lr': 0.0005320428882732732, 'weight_decay': 1.89210117736594e-06, 'epochs': 68, 'loss': 'mse', 'optimizer': 'adam', 'graph_mode': 'knn', 'source': 'grm', 'knn_k': 7, 'weighted_edges': True, 'symmetrize_mode': 'union', 'use_snp_selection': False}. Best is trial 1 with value: 0.13489210195935544.
[I 2025-11-03 14:08:18,537] Trial 2 finished with value: 0.1104442725749671 and parameters: {'model_type': 'graphsage', 'hidden_dims': '[256, 128]', 'dropout': 0.5105528289184642, 'batch_norm': False, 'lr': 0.0006804279372404962, 'weight_decay': 0.0008922815224257085, 'epochs': 181, 'loss': 'mse', 'optimizer': 'adam', 'graph_mode': 'cutoff', 'cutoff': 0.5741905641612706, 'grm_norm': 'gcn', 'self_loops': False, 'use_snp_selection': True, 'num_snps': 26910}. Best is trial 1 with value: 0.13489210195935544.
[I 2025-11-03 14:08:22,927] Trial 3 finished with value: 0.11105163163025683 and parameters: {'model_type': 'graphsage', 'hidden_dims': '[256, 128, 64]', 'dropout': 0.5390483213624292, 'batch_norm': False, 'lr': 3.4705625989073525e-05, 'weight_decay': 2.4623319020131338e-05, 'epochs': 121, 'loss': 'mse', 'optimizer': 'adam', 'graph_mode': 'knn', 'source': 'grm', 'knn_k': 6, 'weighted_edges': False, 'symmetrize_mode': 'mutual', 'use_snp_selection': True, 'num_snps': 30713}. Best is trial 1 with value: 0.13489210195935544.
[I 2025-11-03 14:08:26,831] Trial 4 finished with value: 0.11819593466967514 and parameters: {'model_type': 'graphsage', 'hidden_dims': '[128, 64]', 'dropout': 0.13404863676897502, 'batch_norm': False, 'lr': 0.0001431556295367288, 'weight_decay': 2.2084517750726675e-05, 'epochs': 51, 'loss': 'mae', 'optimizer': 'adam', 'graph_mode': 'cutoff', 'cutoff': 0.6714268476993044, 'grm_norm': 'none', 'self_loops': False, 'use_snp_selection': True, 'num_snps': 45645}. Best is trial 1 with value: 0.13489210195935544.
[I 2025-11-03 14:08:32,098] Trial 5 finished with value: 0.10952607842402579 and parameters: {'model_type': 'graphsage', 'hidden_dims': '[256, 128]', 'dropout': 0.42253606323412096, 'batch_norm': False, 'lr': 4.238630400638805e-05, 'weight_decay': 8.074086040046576e-07, 'epochs': 158, 'loss': 'mae', 'optimizer': 'adam', 'graph_mode': 'knn', 'source': 'grm', 'knn_k': 1, 'weighted_edges': False, 'symmetrize_mode': 'mutual', 'use_snp_selection': True, 'num_snps': 43113}. Best is trial 1 with value: 0.13489210195935544.
[I 2025-11-03 14:08:39,863] Trial 6 finished with value: 0.1332905373663209 and parameters: {'model_type': 'graphsage', 'hidden_dims': '[512, 256]', 'dropout': 0.3534893146320237, 'batch_norm': True, 'lr': 0.000251307964226932, 'weight_decay': 1.821819791794022e-05, 'epochs': 223, 'loss': 'mae', 'optimizer': 'adam', 'graph_mode': 'knn', 'source': 'grm', 'knn_k': 1, 'weighted_edges': True, 'symmetrize_mode': 'mutual', 'use_snp_selection': False}. Best is trial 1 with value: 0.13489210195935544.
[I 2025-11-03 14:08:46,687] Trial 7 finished with value: 0.12873932986853312 and parameters: {'model_type': 'graphsage', 'hidden_dims': '[512, 256]', 'dropout': 0.1105825955860775, 'batch_norm': True, 'lr': 2.374338412754043e-05, 'weight_decay': 1.1284721123340274e-05, 'epochs': 190, 'loss': 'mse', 'optimizer': 'adam', 'graph_mode': 'cutoff', 'cutoff': 0.719872204109604, 'grm_norm': 'gcn', 'self_loops': False, 'use_snp_selection': False}. Best is trial 1 with value: 0.13489210195935544.
[I 2025-11-03 14:08:52,361] Trial 8 finished with value: 0.13175745208088857 and parameters: {'model_type': 'graphsage', 'hidden_dims': '[512, 128]', 'dropout': 0.5066580418354021, 'batch_norm': True, 'lr': 0.00039213678276659976, 'weight_decay': 3.43655320802934e-06, 'epochs': 120, 'loss': 'mse', 'optimizer': 'adam', 'graph_mode': 'cutoff', 'cutoff': 0.34923059576505366, 'grm_norm': 'cosine', 'self_loops': True, 'use_snp_selection': False}. Best is trial 1 with value: 0.13489210195935544.
[I 2025-11-03 14:08:56,081] Trial 9 finished with value: 0.11091594302425377 and parameters: {'model_type': 'graphsage', 'hidden_dims': '[512, 256]', 'dropout': 0.301734920240333, 'batch_norm': False, 'lr': 6.650961854953448e-06, 'weight_decay': 6.861575656590315e-05, 'epochs': 150, 'loss': 'mae', 'optimizer': 'adam', 'graph_mode': 'cutoff', 'cutoff': 0.2857569870061939, 'grm_norm': 'cosine_then_gcn', 'self_loops': False, 'use_snp_selection': True, 'num_snps': 12722}. Best is trial 1 with value: 0.13489210195935544.
[I 2025-11-03 14:09:00,003] Trial 10 finished with value: 0.145215868389724 and parameters: {'model_type': 'graphsage', 'hidden_dims': '[512, 64]', 'dropout': 0.2923745636750988, 'batch_norm': True, 'lr': 0.00010001966977255833, 'weight_decay': 1.2618827301366646e-07, 'epochs': 41, 'loss': 'mse', 'optimizer': 'adam', 'graph_mode': 'knn', 'source': 'grm', 'knn_k': 10, 'weighted_edges': True, 'symmetrize_mode': 'union', 'use_snp_selection': False}. Best is trial 10 with value: 0.145215868389724.
[I 2025-11-03 14:09:03,911] Trial 11 finished with value: 0.14645901962065444 and parameters: {'model_type': 'graphsage', 'hidden_dims': '[512, 64]', 'dropout': 0.2859699507705008, 'batch_norm': True, 'lr': 0.00012623783700890367, 'weight_decay': 1.409653792249845e-07, 'epochs': 42, 'loss': 'mse', 'optimizer': 'adam', 'graph_mode': 'knn', 'source': 'grm', 'knn_k': 10, 'weighted_edges': True, 'symmetrize_mode': 'union', 'use_snp_selection': False}. Best is trial 11 with value: 0.14645901962065444.
[I 2025-11-03 14:09:08,041] Trial 12 finished with value: 0.14331631603839423 and parameters: {'model_type': 'graphsage', 'hidden_dims': '[512, 64]', 'dropout': 0.26266132038870743, 'batch_norm': True, 'lr': 9.336280153487897e-05, 'weight_decay': 1.088595198446312e-07, 'epochs': 46, 'loss': 'mse', 'optimizer': 'adam', 'graph_mode': 'knn', 'source': 'grm', 'knn_k': 10, 'weighted_edges': True, 'symmetrize_mode': 'union', 'use_snp_selection': False}. Best is trial 11 with value: 0.14645901962065444.
[I 2025-11-03 14:09:20,871] Trial 13 finished with value: 0.14327114035115437 and parameters: {'model_type': 'graphsage', 'hidden_dims': '[512, 64]', 'dropout': 0.2687736708759205, 'batch_norm': True, 'lr': 0.00011794251245836268, 'weight_decay': 1.0931885328628727e-07, 'epochs': 252, 'loss': 'mse', 'optimizer': 'adam', 'graph_mode': 'knn', 'source': 'grm', 'knn_k': 10, 'weighted_edges': True, 'symmetrize_mode': 'union', 'use_snp_selection': False}. Best is trial 11 with value: 0.14645901962065444.
[I 2025-11-03 14:09:26,136] Trial 14 finished with value: 0.11076206767088127 and parameters: {'model_type': 'graphsage', 'hidden_dims': '[512, 64]', 'dropout': 0.19696847261698813, 'batch_norm': True, 'lr': 1.2586985041154999e-05, 'weight_decay': 3.315063111115081e-07, 'epochs': 98, 'loss': 'mse', 'optimizer': 'adam', 'graph_mode': 'knn', 'source': 'grm', 'knn_k': 4, 'weighted_edges': True, 'symmetrize_mode': 'union', 'use_snp_selection': False}. Best is trial 11 with value: 0.14645901962065444.
[I 2025-11-03 14:09:31,918] Trial 15 finished with value: 0.13639179628401094 and parameters: {'model_type': 'graphsage', 'hidden_dims': '[512, 64]', 'dropout': 0.3616584899410866, 'batch_norm': True, 'lr': 7.092120321265845e-05, 'weight_decay': 4.371243826117737e-07, 'epochs': 89, 'loss': 'mse', 'optimizer': 'adam', 'graph_mode': 'knn', 'source': 'grm', 'knn_k': 9, 'weighted_edges': True, 'symmetrize_mode': 'union', 'use_snp_selection': False}. Best is trial 11 with value: 0.14645901962065444.
[I 2025-11-03 14:09:42,891] Trial 16 finished with value: 0.15497727454342672 and parameters: {'model_type': 'graphsage', 'hidden_dims': '[512, 64]', 'dropout': 0.21908549744794695, 'batch_norm': True, 'lr': 0.0001906926052093823, 'weight_decay': 2.431253659230589e-06, 'epochs': 276, 'loss': 'mse', 'optimizer': 'adam', 'graph_mode': 'knn', 'source': 'grm', 'knn_k': 4, 'weighted_edges': False, 'symmetrize_mode': 'union', 'use_snp_selection': False}. Best is trial 16 with value: 0.15497727454342672.
[I 2025-11-03 14:09:54,341] Trial 17 finished with value: 0.1433737600808121 and parameters: {'model_type': 'graphsage', 'hidden_dims': '[512, 128]', 'dropout': 0.19830057994339195, 'batch_norm': True, 'lr': 0.00025159935096634315, 'weight_decay': 3.107383290096833e-06, 'epochs': 292, 'loss': 'mse', 'optimizer': 'adam', 'graph_mode': 'knn', 'source': 'grm', 'knn_k': 4, 'weighted_edges': False, 'symmetrize_mode': 'union', 'use_snp_selection': False}. Best is trial 16 with value: 0.15497727454342672.
[I 2025-11-03 14:10:01,914] Trial 18 finished with value: 0.1295777763875279 and parameters: {'model_type': 'graphsage', 'hidden_dims': '[256, 128, 64]', 'dropout': 0.4521803767950373, 'batch_norm': True, 'lr': 0.0009303712567709796, 'weight_decay': 1.3650471794462724e-06, 'epochs': 280, 'loss': 'mse', 'optimizer': 'adam', 'graph_mode': 'knn', 'source': 'grm', 'knn_k': 4, 'weighted_edges': False, 'symmetrize_mode': 'union', 'use_snp_selection': False}. Best is trial 16 with value: 0.15497727454342672.
[I 2025-11-03 14:10:14,285] Trial 19 finished with value: 0.061304242857715394 and parameters: {'model_type': 'graphsage', 'hidden_dims': '[512, 64]', 'dropout': 0.1642621953669171, 'batch_norm': True, 'lr': 1.3261425572023469e-06, 'weight_decay': 0.0002265861216302961, 'epochs': 337, 'loss': 'mse', 'optimizer': 'adam', 'graph_mode': 'knn', 'source': 'grm', 'knn_k': 3, 'weighted_edges': False, 'symmetrize_mode': 'union', 'use_snp_selection': False}. Best is trial 16 with value: 0.15497727454342672.
[I 2025-11-03 14:10:24,550] Trial 20 finished with value: 0.1466571202162038 and parameters: {'model_type': 'graphsage', 'hidden_dims': '[512, 64]', 'dropout': 0.253769840387702, 'batch_norm': True, 'lr': 0.00022747877228544472, 'weight_decay': 4.303705038788151e-06, 'epochs': 228, 'loss': 'mse', 'optimizer': 'adam', 'graph_mode': 'knn', 'source': 'grm', 'knn_k': 6, 'weighted_edges': False, 'symmetrize_mode': 'union', 'use_snp_selection': False}. Best is trial 16 with value: 0.15497727454342672.
[I 2025-11-03 14:10:34,790] Trial 21 finished with value: 0.14251635907517382 and parameters: {'model_type': 'graphsage', 'hidden_dims': '[512, 64]', 'dropout': 0.23909478238781692, 'batch_norm': True, 'lr': 0.00025869753876340136, 'weight_decay': 4.4886105617217045e-06, 'epochs': 229, 'loss': 'mse', 'optimizer': 'adam', 'graph_mode': 'knn', 'source': 'grm', 'knn_k': 6, 'weighted_edges': False, 'symmetrize_mode': 'union', 'use_snp_selection': False}. Best is trial 16 with value: 0.15497727454342672.
[I 2025-11-03 14:10:45,565] Trial 22 finished with value: 0.11454950020023588 and parameters: {'model_type': 'graphsage', 'hidden_dims': '[512, 64]', 'dropout': 0.32064524211231005, 'batch_norm': True, 'lr': 5.474326381005595e-05, 'weight_decay': 3.830511889069863e-07, 'epochs': 287, 'loss': 'mse', 'optimizer': 'adam', 'graph_mode': 'knn', 'source': 'grm', 'knn_k': 3, 'weighted_edges': False, 'symmetrize_mode': 'union', 'use_snp_selection': False}. Best is trial 16 with value: 0.15497727454342672.
[I 2025-11-03 14:10:57,657] Trial 23 finished with value: 0.13620909947946375 and parameters: {'model_type': 'graphsage', 'hidden_dims': '[512, 64]', 'dropout': 0.2426308233921536, 'batch_norm': True, 'lr': 0.00014225168590649236, 'weight_decay': 6.42710958976235e-06, 'epochs': 253, 'loss': 'mse', 'optimizer': 'adam', 'graph_mode': 'knn', 'source': 'grm', 'knn_k': 8, 'weighted_edges': False, 'symmetrize_mode': 'union', 'use_snp_selection': False}. Best is trial 16 with value: 0.15497727454342672.
[I 2025-11-03 14:11:07,753] Trial 24 finished with value: 0.13181783233293454 and parameters: {'model_type': 'graphsage', 'hidden_dims': '[512, 64]', 'dropout': 0.22356700196855817, 'batch_norm': True, 'lr': 0.00034909882954801307, 'weight_decay': 1.3893829888364337e-06, 'epochs': 214, 'loss': 'mse', 'optimizer': 'adam', 'graph_mode': 'knn', 'source': 'grm', 'knn_k': 7, 'weighted_edges': False, 'symmetrize_mode': 'union', 'use_snp_selection': False}. Best is trial 16 with value: 0.15497727454342672.
[I 2025-11-03 14:11:18,549] Trial 25 finished with value: 0.1430659770615365 and parameters: {'model_type': 'graphsage', 'hidden_dims': '[512, 64]', 'dropout': 0.16404433747547698, 'batch_norm': True, 'lr': 0.00018397901629733663, 'weight_decay': 6.453334218571666e-07, 'epochs': 257, 'loss': 'mse', 'optimizer': 'adam', 'graph_mode': 'knn', 'source': 'grm', 'knn_k': 5, 'weighted_edges': False, 'symmetrize_mode': 'union', 'use_snp_selection': False}. Best is trial 16 with value: 0.15497727454342672.
[I 2025-11-03 14:11:30,433] Trial 26 finished with value: 0.0627120175829554 and parameters: {'model_type': 'graphsage', 'hidden_dims': '[512, 128]', 'dropout': 0.5896027440730659, 'batch_norm': False, 'lr': 0.00043849403613034686, 'weight_decay': 2.5705888765738787e-07, 'epochs': 312, 'loss': 'mae', 'optimizer': 'adam', 'graph_mode': 'cutoff', 'cutoff': 0.8765009073803762, 'grm_norm': 'none', 'self_loops': True, 'use_snp_selection': True, 'num_snps': 59005}. Best is trial 16 with value: 0.15497727454342672.
[I 2025-11-03 14:11:34,853] Trial 27 finished with value: 0.08500553319760384 and parameters: {'model_type': 'graphsage', 'hidden_dims': '[256, 128]', 'dropout': 0.3184969027292452, 'batch_norm': True, 'lr': 1.9937354098458108e-05, 'weight_decay': 9.567526656651373e-06, 'epochs': 158, 'loss': 'mse', 'optimizer': 'adam', 'graph_mode': 'knn', 'source': 'grm', 'knn_k': 2, 'weighted_edges': False, 'symmetrize_mode': 'union', 'use_snp_selection': False}. Best is trial 16 with value: 0.15497727454342672.
[I 2025-11-03 14:11:40,234] Trial 28 finished with value: 0.11885402367141065 and parameters: {'model_type': 'graphsage', 'hidden_dims': '[256, 128, 64]', 'dropout': 0.38442834777474716, 'batch_norm': True, 'lr': 7.341549191641728e-05, 'weight_decay': 2.1907504138835446e-06, 'epochs': 207, 'loss': 'mse', 'optimizer': 'adam', 'graph_mode': 'knn', 'source': 'grm', 'knn_k': 5, 'weighted_edges': False, 'symmetrize_mode': 'mutual', 'use_snp_selection': False}. Best is trial 16 with value: 0.15497727454342672.
[I 2025-11-03 14:11:47,565] Trial 29 finished with value: 0.06847598600001913 and parameters: {'model_type': 'graphsage', 'hidden_dims': '[128, 64]', 'dropout': 0.1814420899053908, 'batch_norm': True, 'lr': 6.322407879502286e-06, 'weight_decay': 5.5765653208115594e-05, 'epochs': 272, 'loss': 'mae', 'optimizer': 'adam', 'graph_mode': 'knn', 'source': 'grm', 'knn_k': 8, 'weighted_edges': True, 'symmetrize_mode': 'union', 'use_snp_selection': False}. Best is trial 16 with value: 0.15497727454342672.
[I 2025-11-03 14:11:56,855] Trial 30 finished with value: 0.14512396234027744 and parameters: {'model_type': 'graphsage', 'hidden_dims': '[512, 64]', 'dropout': 0.21870368123902434, 'batch_norm': True, 'lr': 0.00095854629729458, 'weight_decay': 7.839651128452137e-07, 'epochs': 237, 'loss': 'mse', 'optimizer': 'adam', 'graph_mode': 'knn', 'source': 'grm', 'knn_k': 3, 'weighted_edges': False, 'symmetrize_mode': 'union', 'use_snp_selection': False}. Best is trial 16 with value: 0.15497727454342672.
[I 2025-11-03 14:12:01,901] Trial 31 finished with value: 0.13913801569135512 and parameters: {'model_type': 'graphsage', 'hidden_dims': '[512, 64]', 'dropout': 0.28264954054080843, 'batch_norm': True, 'lr': 0.00010036952244555921, 'weight_decay': 1.86874978120833e-07, 'epochs': 71, 'loss': 'mse', 'optimizer': 'adam', 'graph_mode': 'knn', 'source': 'grm', 'knn_k': 9, 'weighted_edges': True, 'symmetrize_mode': 'union', 'use_snp_selection': False}. Best is trial 16 with value: 0.15497727454342672.
