[I 2025-11-03 13:56:17,589] Trial 122 finished with value: 0.05324589413244217 and parameters: {'model_type': 'graphsage', 'hidden_dims': '[128, 64]', 'dropout': 0.1430372638098542, 'batch_norm': True, 'lr': 0.0009605649702192775, 'weight_decay': 8.574719620014859e-07, 'epochs': 171, 'loss': 'mse', 'optimizer': 'adam', 'graph_mode': 'knn', 'source': 'grm', 'knn_k': 9, 'weighted_edges': False, 'symmetrize_mode': 'union', 'use_snp_selection': False}. Best is trial 105 with value: 0.09350861439504544.
[I 2025-11-03 13:56:19,760] Trial 123 finished with value: 0.08400382336384468 and parameters: {'model_type': 'graphsage', 'hidden_dims': '[128, 64]', 'dropout': 0.15780215881349624, 'batch_norm': True, 'lr': 0.00027741174766140846, 'weight_decay': 7.373406559191485e-07, 'epochs': 166, 'loss': 'mse', 'optimizer': 'adam', 'graph_mode': 'knn', 'source': 'grm', 'knn_k': 9, 'weighted_edges': False, 'symmetrize_mode': 'union', 'use_snp_selection': False}. Best is trial 105 with value: 0.09350861439504544.
[I 2025-11-03 13:56:21,914] Trial 124 finished with value: 0.07048909485741421 and parameters: {'model_type': 'graphsage', 'hidden_dims': '[128, 64]', 'dropout': 0.1271944683051748, 'batch_norm': True, 'lr': 0.00030168077468714025, 'weight_decay': 6.750676783179433e-07, 'epochs': 163, 'loss': 'mse', 'optimizer': 'adam', 'graph_mode': 'knn', 'source': 'grm', 'knn_k': 9, 'weighted_edges': False, 'symmetrize_mode': 'union', 'use_snp_selection': False}. Best is trial 105 with value: 0.09350861439504544.
[I 2025-11-03 13:56:24,058] Trial 125 finished with value: 0.05362591704238286 and parameters: {'model_type': 'graphsage', 'hidden_dims': '[128, 64]', 'dropout': 0.11871339730725713, 'batch_norm': True, 'lr': 0.0002765058705874282, 'weight_decay': 5.852407768865026e-07, 'epochs': 161, 'loss': 'mse', 'optimizer': 'adam', 'graph_mode': 'knn', 'source': 'grm', 'knn_k': 9, 'weighted_edges': False, 'symmetrize_mode': 'union', 'use_snp_selection': False}. Best is trial 105 with value: 0.09350861439504544.
[I 2025-11-03 13:56:26,277] Trial 126 finished with value: 0.049714765035112664 and parameters: {'model_type': 'graphsage', 'hidden_dims': '[128, 64]', 'dropout': 0.10036968999219836, 'batch_norm': True, 'lr': 0.00032264433233889, 'weight_decay': 1.1301098203354336e-06, 'epochs': 175, 'loss': 'mse', 'optimizer': 'adam', 'graph_mode': 'knn', 'source': 'grm', 'knn_k': 9, 'weighted_edges': False, 'symmetrize_mode': 'union', 'use_snp_selection': False}. Best is trial 105 with value: 0.09350861439504544.
[I 2025-11-03 13:56:28,352] Trial 127 finished with value: 0.05833425632069303 and parameters: {'model_type': 'graphsage', 'hidden_dims': '[128, 64]', 'dropout': 0.13466857114519865, 'batch_norm': True, 'lr': 0.00024317296501331865, 'weight_decay': 7.183845996582817e-07, 'epochs': 148, 'loss': 'mse', 'optimizer': 'adam', 'graph_mode': 'knn', 'source': 'grm', 'knn_k': 9, 'weighted_edges': False, 'symmetrize_mode': 'union', 'use_snp_selection': False}. Best is trial 105 with value: 0.09350861439504544.
[I 2025-11-03 13:56:30,533] Trial 128 finished with value: 0.0662927493926748 and parameters: {'model_type': 'graphsage', 'hidden_dims': '[128, 64]', 'dropout': 0.15693869350322756, 'batch_norm': True, 'lr': 0.00043658601383377374, 'weight_decay': 1.5476115131274098e-06, 'epochs': 168, 'loss': 'mse', 'optimizer': 'adam', 'graph_mode': 'knn', 'source': 'grm', 'knn_k': 9, 'weighted_edges': False, 'symmetrize_mode': 'union', 'use_snp_selection': False}. Best is trial 105 with value: 0.09350861439504544.
[I 2025-11-03 13:56:32,704] Trial 129 finished with value: 0.06415760128355796 and parameters: {'model_type': 'graphsage', 'hidden_dims': '[128, 64]', 'dropout': 0.15839774094828063, 'batch_norm': True, 'lr': 0.0004488677373305992, 'weight_decay': 1.018998267694181e-06, 'epochs': 166, 'loss': 'mse', 'optimizer': 'adam', 'graph_mode': 'knn', 'source': 'grm', 'knn_k': 9, 'weighted_edges': False, 'symmetrize_mode': 'union', 'use_snp_selection': False}. Best is trial 105 with value: 0.09350861439504544.
[I 2025-11-03 13:56:34,557] Trial 130 finished with value: 0.04746687498885008 and parameters: {'model_type': 'graphsage', 'hidden_dims': '[128, 64]', 'dropout': 0.1491914242658589, 'batch_norm': True, 'lr': 0.0005533630806680113, 'weight_decay': 1.5601599123357242e-06, 'epochs': 154, 'loss': 'mse', 'optimizer': 'adam', 'graph_mode': 'knn', 'source': 'grm', 'knn_k': 8, 'weighted_edges': False, 'symmetrize_mode': 'mutual', 'use_snp_selection': False}. Best is trial 105 with value: 0.09350861439504544.
[I 2025-11-03 13:56:36,582] Trial 131 finished with value: 0.0648354486775835 and parameters: {'model_type': 'graphsage', 'hidden_dims': '[128, 64]', 'dropout': 0.12489112753960728, 'batch_norm': True, 'lr': 0.00038099969829176645, 'weight_decay': 1.366850311441417e-06, 'epochs': 139, 'loss': 'mse', 'optimizer': 'adam', 'graph_mode': 'knn', 'source': 'grm', 'knn_k': 9, 'weighted_edges': False, 'symmetrize_mode': 'union', 'use_snp_selection': False}. Best is trial 105 with value: 0.09350861439504544.
[I 2025-11-03 13:56:38,825] Trial 132 finished with value: 0.060133922397920245 and parameters: {'model_type': 'graphsage', 'hidden_dims': '[128, 64]', 'dropout': 0.18470344686739457, 'batch_norm': True, 'lr': 0.0003040104056706555, 'weight_decay': 7.051118098544248e-07, 'epochs': 180, 'loss': 'mse', 'optimizer': 'adam', 'graph_mode': 'knn', 'source': 'grm', 'knn_k': 9, 'weighted_edges': False, 'symmetrize_mode': 'union', 'use_snp_selection': False}. Best is trial 105 with value: 0.09350861439504544.
[I 2025-11-03 13:56:41,148] Trial 133 finished with value: 0.04692347055736387 and parameters: {'model_type': 'graphsage', 'hidden_dims': '[128, 64]', 'dropout': 0.14100443575474406, 'batch_norm': True, 'lr': 0.0005040431352229635, 'weight_decay': 1.7045807031411571e-06, 'epochs': 195, 'loss': 'mse', 'optimizer': 'adam', 'graph_mode': 'knn', 'source': 'grm', 'knn_k': 9, 'weighted_edges': False, 'symmetrize_mode': 'union', 'use_snp_selection': False}. Best is trial 105 with value: 0.09350861439504544.
[I 2025-11-03 13:56:43,419] Trial 134 finished with value: 0.05241882228491069 and parameters: {'model_type': 'graphsage', 'hidden_dims': '[128, 64]', 'dropout': 0.1628583300353631, 'batch_norm': True, 'lr': 0.0002606955287662335, 'weight_decay': 1.8987492607223695e-05, 'epochs': 174, 'loss': 'mse', 'optimizer': 'adam', 'graph_mode': 'knn', 'source': 'grm', 'knn_k': 10, 'weighted_edges': False, 'symmetrize_mode': 'union', 'use_snp_selection': False}. Best is trial 105 with value: 0.09350861439504544.
[I 2025-11-03 13:56:45,544] Trial 135 finished with value: 0.028219505674261378 and parameters: {'model_type': 'graphsage', 'hidden_dims': '[128, 64]', 'dropout': 0.12892041591263706, 'batch_norm': True, 'lr': 1.3033166219863476e-06, 'weight_decay': 4.642767284925188e-07, 'epochs': 145, 'loss': 'mse', 'optimizer': 'adam', 'graph_mode': 'knn', 'source': 'grm', 'knn_k': 10, 'weighted_edges': False, 'symmetrize_mode': 'union', 'use_snp_selection': False}. Best is trial 105 with value: 0.09350861439504544.
[I 2025-11-03 13:56:47,694] Trial 136 finished with value: 0.059590543596606066 and parameters: {'model_type': 'graphsage', 'hidden_dims': '[128, 64]', 'dropout': 0.14933454164243334, 'batch_norm': True, 'lr': 0.0004248648836292244, 'weight_decay': 8.23046915833779e-07, 'epochs': 159, 'loss': 'mse', 'optimizer': 'adam', 'graph_mode': 'knn', 'source': 'grm', 'knn_k': 9, 'weighted_edges': False, 'symmetrize_mode': 'union', 'use_snp_selection': False}. Best is trial 105 with value: 0.09350861439504544.
[I 2025-11-03 13:56:50,029] Trial 137 finished with value: 0.05169586747952664 and parameters: {'model_type': 'graphsage', 'hidden_dims': '[128, 64]', 'dropout': 0.11348949787702406, 'batch_norm': True, 'lr': 0.000640635192006458, 'weight_decay': 1.2611502626243047e-06, 'epochs': 210, 'loss': 'mse', 'optimizer': 'adam', 'graph_mode': 'knn', 'source': 'grm', 'knn_k': 8, 'weighted_edges': False, 'symmetrize_mode': 'union', 'use_snp_selection': False}. Best is trial 105 with value: 0.09350861439504544.
[I 2025-11-03 13:56:52,361] Trial 138 finished with value: 0.07214052868152493 and parameters: {'model_type': 'graphsage', 'hidden_dims': '[128, 64]', 'dropout': 0.19864699147338286, 'batch_norm': True, 'lr': 0.00019636704884995872, 'weight_decay': 3.1936115445268504e-06, 'epochs': 185, 'loss': 'mse', 'optimizer': 'adam', 'graph_mode': 'knn', 'source': 'grm', 'knn_k': 10, 'weighted_edges': False, 'symmetrize_mode': 'union', 'use_snp_selection': False}. Best is trial 105 with value: 0.09350861439504544.
[I 2025-11-03 13:56:54,551] Trial 139 finished with value: 0.059882089970287815 and parameters: {'model_type': 'graphsage', 'hidden_dims': '[128, 64]', 'dropout': 0.18552669363615956, 'batch_norm': True, 'lr': 0.0003522193565402236, 'weight_decay': 3.1795616728044796e-06, 'epochs': 166, 'loss': 'mse', 'optimizer': 'adam', 'graph_mode': 'knn', 'source': 'grm', 'knn_k': 9, 'weighted_edges': False, 'symmetrize_mode': 'union', 'use_snp_selection': False}. Best is trial 105 with value: 0.09350861439504544.
[I 2025-11-03 13:56:56,512] Trial 140 finished with value: 0.02635349480001643 and parameters: {'model_type': 'graphsage', 'hidden_dims': '[128, 64]', 'dropout': 0.20039050669389752, 'batch_norm': True, 'lr': 0.00015980282497621957, 'weight_decay': 4.6977659757020676e-06, 'epochs': 183, 'loss': 'mse', 'optimizer': 'adam', 'graph_mode': 'knn', 'source': 'grm', 'knn_k': 4, 'weighted_edges': False, 'symmetrize_mode': 'union', 'use_snp_selection': False}. Best is trial 105 with value: 0.09350861439504544.
[I 2025-11-03 13:56:58,882] Trial 141 finished with value: 0.03502815528712014 and parameters: {'model_type': 'graphsage', 'hidden_dims': '[128, 64]', 'dropout': 0.15721729500560572, 'batch_norm': True, 'lr': 0.00019086695080381352, 'weight_decay': 1.0114603544990334e-06, 'epochs': 192, 'loss': 'mse', 'optimizer': 'adam', 'graph_mode': 'knn', 'source': 'grm', 'knn_k': 10, 'weighted_edges': False, 'symmetrize_mode': 'union', 'use_snp_selection': False}. Best is trial 105 with value: 0.09350861439504544.
[I 2025-11-03 13:57:00,890] Trial 142 finished with value: 0.04523891305430165 and parameters: {'model_type': 'graphsage', 'hidden_dims': '[128, 64]', 'dropout': 0.17292954898203453, 'batch_norm': True, 'lr': 0.0002734083055654132, 'weight_decay': 2.3026119571232525e-06, 'epochs': 124, 'loss': 'mse', 'optimizer': 'adam', 'graph_mode': 'knn', 'source': 'grm', 'knn_k': 10, 'weighted_edges': False, 'symmetrize_mode': 'union', 'use_snp_selection': False}. Best is trial 105 with value: 0.09350861439504544.
[I 2025-11-03 13:57:03,897] Trial 143 finished with value: 0.047093882248418165 and parameters: {'model_type': 'graphsage', 'hidden_dims': '[256, 128]', 'dropout': 0.20984738426086158, 'batch_norm': True, 'lr': 0.00022440787258118592, 'weight_decay': 3.7894234926100892e-06, 'epochs': 187, 'loss': 'mse', 'optimizer': 'adam', 'graph_mode': 'knn', 'source': 'grm', 'knn_k': 10, 'weighted_edges': False, 'symmetrize_mode': 'union', 'use_snp_selection': False}. Best is trial 105 with value: 0.09350861439504544.
[I 2025-11-03 13:57:06,161] Trial 144 finished with value: 0.054010880947166655 and parameters: {'model_type': 'graphsage', 'hidden_dims': '[128, 64]', 'dropout': 0.19700930533023084, 'batch_norm': True, 'lr': 0.00016687635385939198, 'weight_decay': 5.451252582393695e-07, 'epochs': 170, 'loss': 'mse', 'optimizer': 'adam', 'graph_mode': 'knn', 'source': 'grm', 'knn_k': 10, 'weighted_edges': False, 'symmetrize_mode': 'union', 'use_snp_selection': False}. Best is trial 105 with value: 0.09350861439504544.
[I 2025-11-03 13:57:09,079] Trial 145 finished with value: 0.05401089957816454 and parameters: {'model_type': 'graphsage', 'hidden_dims': '[256, 128, 64]', 'dropout': 0.16214600465571025, 'batch_norm': True, 'lr': 0.0003223891630708448, 'weight_decay': 2.969597751934205e-06, 'epochs': 178, 'loss': 'mse', 'optimizer': 'adam', 'graph_mode': 'knn', 'source': 'grm', 'knn_k': 9, 'weighted_edges': False, 'symmetrize_mode': 'union', 'use_snp_selection': False}. Best is trial 105 with value: 0.09350861439504544.
[I 2025-11-03 13:57:11,250] Trial 146 finished with value: 0.08362573035090125 and parameters: {'model_type': 'graphsage', 'hidden_dims': '[128, 64]', 'dropout': 0.18521001763695427, 'batch_norm': True, 'lr': 3.501171255950327e-05, 'weight_decay': 1.6405165368113816e-06, 'epochs': 156, 'loss': 'mse', 'optimizer': 'adam', 'graph_mode': 'knn', 'source': 'grm', 'knn_k': 10, 'weighted_edges': False, 'symmetrize_mode': 'union', 'use_snp_selection': False}. Best is trial 105 with value: 0.09350861439504544.
[I 2025-11-03 13:57:13,425] Trial 147 finished with value: 0.07499284242407184 and parameters: {'model_type': 'graphsage', 'hidden_dims': '[128, 64]', 'dropout': 0.1454778397651587, 'batch_norm': True, 'lr': 4.577861799571258e-05, 'weight_decay': 1.5253187424627528e-06, 'epochs': 154, 'loss': 'mse', 'optimizer': 'adam', 'graph_mode': 'knn', 'source': 'grm', 'knn_k': 10, 'weighted_edges': False, 'symmetrize_mode': 'union', 'use_snp_selection': False}. Best is trial 105 with value: 0.09350861439504544.
[I 2025-11-03 13:57:15,623] Trial 148 finished with value: 0.0393367522056922 and parameters: {'model_type': 'graphsage', 'hidden_dims': '[128, 64]', 'dropout': 0.14364795432334082, 'batch_norm': True, 'lr': 3.576179412724038e-05, 'weight_decay': 1.238505218430791e-06, 'epochs': 158, 'loss': 'mse', 'optimizer': 'adam', 'graph_mode': 'knn', 'source': 'grm', 'knn_k': 10, 'weighted_edges': False, 'symmetrize_mode': 'union', 'use_snp_selection': False}. Best is trial 105 with value: 0.09350861439504544.
[I 2025-11-03 13:57:17,737] Trial 149 finished with value: 0.03246897350618791 and parameters: {'model_type': 'graphsage', 'hidden_dims': '[128, 64]', 'dropout': 0.11035264332139169, 'batch_norm': True, 'lr': 4.1516114241248115e-05, 'weight_decay': 1.9278182422665624e-06, 'epochs': 143, 'loss': 'mse', 'optimizer': 'adam', 'graph_mode': 'knn', 'source': 'grm', 'knn_k': 10, 'weighted_edges': False, 'symmetrize_mode': 'union', 'use_snp_selection': False}. Best is trial 105 with value: 0.09350861439504544.
[I 2025-11-03 13:57:21,805] Trial 0 finished with value: 0.036648769931852315 and parameters: {'model_type': 'graphsage', 'hidden_dims': '[128, 64]', 'dropout': 0.199031432379812, 'batch_norm': True, 'lr': 1.8408544111075837e-06, 'weight_decay': 5.5136510071208614e-05, 'epochs': 336, 'loss': 'mae', 'optimizer': 'adam', 'graph_mode': 'knn', 'source': 'grm', 'knn_k': 8, 'weighted_edges': True, 'symmetrize_mode': 'mutual', 'use_snp_selection': False}. Best is trial 0 with value: 0.036648769931852315.
[I 2025-11-03 13:57:23,805] Trial 1 finished with value: 0.05797869973151318 and parameters: {'model_type': 'graphsage', 'hidden_dims': '[128, 64]', 'dropout': 0.40051947670227217, 'batch_norm': True, 'lr': 0.0005320428882732732, 'weight_decay': 1.89210117736594e-06, 'epochs': 68, 'loss': 'mse', 'optimizer': 'adam', 'graph_mode': 'knn', 'source': 'grm', 'knn_k': 7, 'weighted_edges': True, 'symmetrize_mode': 'union', 'use_snp_selection': False}. Best is trial 1 with value: 0.05797869973151318.
[I 2025-11-03 13:57:26,901] Trial 2 finished with value: 0.06307197649106522 and parameters: {'model_type': 'graphsage', 'hidden_dims': '[256, 128]', 'dropout': 0.5105528289184642, 'batch_norm': False, 'lr': 0.0006804279372404962, 'weight_decay': 0.0008922815224257085, 'epochs': 181, 'loss': 'mse', 'optimizer': 'adam', 'graph_mode': 'cutoff', 'cutoff': 0.5741905641612706, 'grm_norm': 'gcn', 'self_loops': False, 'use_snp_selection': True, 'num_snps': 26910}. Best is trial 2 with value: 0.06307197649106522.
[I 2025-11-03 13:57:30,313] Trial 3 finished with value: -0.005177444557745506 and parameters: {'model_type': 'graphsage', 'hidden_dims': '[256, 128, 64]', 'dropout': 0.5390483213624292, 'batch_norm': False, 'lr': 3.4705625989073525e-05, 'weight_decay': 2.4623319020131338e-05, 'epochs': 121, 'loss': 'mse', 'optimizer': 'adam', 'graph_mode': 'knn', 'source': 'grm', 'knn_k': 6, 'weighted_edges': False, 'symmetrize_mode': 'mutual', 'use_snp_selection': True, 'num_snps': 30713}. Best is trial 2 with value: 0.06307197649106522.
[I 2025-11-03 13:57:33,521] Trial 4 finished with value: 0.04836524759125707 and parameters: {'model_type': 'graphsage', 'hidden_dims': '[128, 64]', 'dropout': 0.13404863676897502, 'batch_norm': False, 'lr': 0.0001431556295367288, 'weight_decay': 2.2084517750726675e-05, 'epochs': 51, 'loss': 'mae', 'optimizer': 'adam', 'graph_mode': 'cutoff', 'cutoff': 0.6714268476993044, 'grm_norm': 'none', 'self_loops': False, 'use_snp_selection': True, 'num_snps': 45645}. Best is trial 2 with value: 0.06307197649106522.
[I 2025-11-03 13:57:37,624] Trial 5 finished with value: 0.06533075527355187 and parameters: {'model_type': 'graphsage', 'hidden_dims': '[256, 128]', 'dropout': 0.42253606323412096, 'batch_norm': False, 'lr': 4.238630400638805e-05, 'weight_decay': 8.074086040046576e-07, 'epochs': 158, 'loss': 'mae', 'optimizer': 'adam', 'graph_mode': 'knn', 'source': 'grm', 'knn_k': 1, 'weighted_edges': False, 'symmetrize_mode': 'mutual', 'use_snp_selection': True, 'num_snps': 43113}. Best is trial 5 with value: 0.06533075527355187.
[I 2025-11-03 13:57:43,330] Trial 6 finished with value: 0.07945395818759281 and parameters: {'model_type': 'graphsage', 'hidden_dims': '[512, 256]', 'dropout': 0.3534893146320237, 'batch_norm': True, 'lr': 0.000251307964226932, 'weight_decay': 1.821819791794022e-05, 'epochs': 223, 'loss': 'mae', 'optimizer': 'adam', 'graph_mode': 'knn', 'source': 'grm', 'knn_k': 1, 'weighted_edges': True, 'symmetrize_mode': 'mutual', 'use_snp_selection': False}. Best is trial 6 with value: 0.07945395818759281.
[I 2025-11-03 13:57:48,437] Trial 7 finished with value: 0.08057692687462499 and parameters: {'model_type': 'graphsage', 'hidden_dims': '[512, 256]', 'dropout': 0.1105825955860775, 'batch_norm': True, 'lr': 2.374338412754043e-05, 'weight_decay': 1.1284721123340274e-05, 'epochs': 190, 'loss': 'mse', 'optimizer': 'adam', 'graph_mode': 'cutoff', 'cutoff': 0.719872204109604, 'grm_norm': 'gcn', 'self_loops': False, 'use_snp_selection': False}. Best is trial 7 with value: 0.08057692687462499.
[I 2025-11-03 13:57:52,812] Trial 8 finished with value: 0.03384113756701081 and parameters: {'model_type': 'graphsage', 'hidden_dims': '[512, 128]', 'dropout': 0.5066580418354021, 'batch_norm': True, 'lr': 0.00039213678276659976, 'weight_decay': 3.43655320802934e-06, 'epochs': 120, 'loss': 'mse', 'optimizer': 'adam', 'graph_mode': 'cutoff', 'cutoff': 0.34923059576505366, 'grm_norm': 'cosine', 'self_loops': True, 'use_snp_selection': False}. Best is trial 7 with value: 0.08057692687462499.
[I 2025-11-03 13:57:55,525] Trial 9 finished with value: -0.00588994505060771 and parameters: {'model_type': 'graphsage', 'hidden_dims': '[512, 256]', 'dropout': 0.301734920240333, 'batch_norm': False, 'lr': 6.650961854953448e-06, 'weight_decay': 6.861575656590315e-05, 'epochs': 150, 'loss': 'mae', 'optimizer': 'adam', 'graph_mode': 'cutoff', 'cutoff': 0.2857569870061939, 'grm_norm': 'cosine_then_gcn', 'self_loops': False, 'use_snp_selection': True, 'num_snps': 12722}. Best is trial 7 with value: 0.08057692687462499.
[I 2025-11-03 13:58:01,965] Trial 10 finished with value: 0.04559130859822983 and parameters: {'model_type': 'graphsage', 'hidden_dims': '[512, 64]', 'dropout': 0.2491228540815774, 'batch_norm': True, 'lr': 1.080428984628536e-05, 'weight_decay': 1.6060239611529646e-07, 'epochs': 275, 'loss': 'mse', 'optimizer': 'adam', 'graph_mode': 'cutoff', 'cutoff': 0.8740100033033124, 'grm_norm': 'gcn', 'self_loops': True, 'use_snp_selection': False}. Best is trial 7 with value: 0.08057692687462499.
[I 2025-11-03 13:58:08,177] Trial 11 finished with value: 0.08290441338579799 and parameters: {'model_type': 'graphsage', 'hidden_dims': '[512, 256]', 'dropout': 0.33158647695857435, 'batch_norm': True, 'lr': 0.0001113083271410056, 'weight_decay': 0.00028491289627808323, 'epochs': 242, 'loss': 'mae', 'optimizer': 'adam', 'graph_mode': 'knn', 'source': 'grm', 'knn_k': 1, 'weighted_edges': True, 'symmetrize_mode': 'union', 'use_snp_selection': False}. Best is trial 11 with value: 0.08290441338579799.
[I 2025-11-03 13:58:14,738] Trial 12 finished with value: 0.04803105666242716 and parameters: {'model_type': 'graphsage', 'hidden_dims': '[512, 256]', 'dropout': 0.11246889769773032, 'batch_norm': True, 'lr': 8.485681919849544e-05, 'weight_decay': 0.0004866193703411808, 'epochs': 237, 'loss': 'mse', 'optimizer': 'adam', 'graph_mode': 'knn', 'source': 'grm', 'knn_k': 3, 'weighted_edges': True, 'symmetrize_mode': 'union', 'use_snp_selection': False}. Best is trial 11 with value: 0.08290441338579799.
[I 2025-11-03 13:58:21,441] Trial 13 finished with value: 0.04809196118948467 and parameters: {'model_type': 'graphsage', 'hidden_dims': '[512, 256]', 'dropout': 0.22695662818447931, 'batch_norm': True, 'lr': 1.1123920200408949e-05, 'weight_decay': 0.0001548242747764141, 'epochs': 290, 'loss': 'mae', 'optimizer': 'adam', 'graph_mode': 'cutoff', 'cutoff': 0.8274420001613257, 'grm_norm': 'gcn', 'self_loops': False, 'use_snp_selection': False}. Best is trial 11 with value: 0.08290441338579799.
[I 2025-11-03 13:58:27,968] Trial 14 finished with value: 0.05153687433337209 and parameters: {'model_type': 'graphsage', 'hidden_dims': '[512, 256]', 'dropout': 0.30235973072802214, 'batch_norm': True, 'lr': 8.773526967482465e-05, 'weight_decay': 0.00022640784955374533, 'epochs': 223, 'loss': 'mae', 'optimizer': 'adam', 'graph_mode': 'knn', 'source': 'grm', 'knn_k': 4, 'weighted_edges': True, 'symmetrize_mode': 'union', 'use_snp_selection': False}. Best is trial 11 with value: 0.08290441338579799.
