[I 2025-11-03 13:59:04,703] Trial 42 finished with value: 0.009202248940704804 and parameters: {'model_type': 'gcn', 'hidden_dims': '[512, 256]', 'dropout': 0.5956857692368832, 'batch_norm': True, 'lr': 7.394675590958532e-05, 'weight_decay': 1.7489992909411888e-06, 'epochs': 165, 'loss': 'mae', 'optimizer': 'adam', 'graph_mode': 'off', 'use_snp_selection': False}. Best is trial 39 with value: 0.06568810899207723.
[I 2025-11-03 13:59:06,723] Trial 43 finished with value: -0.05558730733911678 and parameters: {'model_type': 'gcn', 'hidden_dims': '[512, 64]', 'dropout': 0.2578803216287696, 'batch_norm': True, 'lr': 6.778198737117827e-06, 'weight_decay': 2.6902512937762788e-05, 'epochs': 271, 'loss': 'mae', 'optimizer': 'adam', 'graph_mode': 'off', 'use_snp_selection': False}. Best is trial 39 with value: 0.06568810899207723.
[I 2025-11-03 13:59:07,996] Trial 44 finished with value: 0.03634830396373868 and parameters: {'model_type': 'gcn', 'hidden_dims': '[512, 256]', 'dropout': 0.4639527955964155, 'batch_norm': True, 'lr': 0.0002695392904101886, 'weight_decay': 1.2917015982837048e-05, 'epochs': 108, 'loss': 'mse', 'optimizer': 'adam', 'graph_mode': 'off', 'use_snp_selection': False}. Best is trial 39 with value: 0.06568810899207723.
[I 2025-11-03 13:59:09,620] Trial 45 finished with value: -0.017739650578883763 and parameters: {'model_type': 'gcn', 'hidden_dims': '[256, 128]', 'dropout': 0.5341493215856581, 'batch_norm': False, 'lr': 4.814249088828045e-05, 'weight_decay': 4.2055532860552384e-05, 'epochs': 333, 'loss': 'mae', 'optimizer': 'adam', 'graph_mode': 'off', 'use_snp_selection': False}. Best is trial 39 with value: 0.06568810899207723.
[I 2025-11-03 13:59:11,359] Trial 46 finished with value: 0.04625668681985516 and parameters: {'model_type': 'gcn', 'hidden_dims': '[512, 128]', 'dropout': 0.37414165073014, 'batch_norm': True, 'lr': 0.0009475514894918395, 'weight_decay': 8.05582520293784e-05, 'epochs': 320, 'loss': 'mae', 'optimizer': 'adam', 'graph_mode': 'off', 'use_snp_selection': True, 'num_snps': 22173}. Best is trial 39 with value: 0.06568810899207723.
[I 2025-11-03 13:59:12,163] Trial 47 finished with value: 0.029546327283952963 and parameters: {'model_type': 'gcn', 'hidden_dims': '[256, 128, 64]', 'dropout': 0.1301301788218991, 'batch_norm': True, 'lr': 1.4317992020057837e-05, 'weight_decay': 8.016262380803146e-06, 'epochs': 43, 'loss': 'mse', 'optimizer': 'adam', 'graph_mode': 'off', 'use_snp_selection': False}. Best is trial 39 with value: 0.06568810899207723.
[I 2025-11-03 13:59:13,764] Trial 48 finished with value: 0.03022474176405757 and parameters: {'model_type': 'gcn', 'hidden_dims': '[512, 256]', 'dropout': 0.5678477953313731, 'batch_norm': False, 'lr': 0.0001410791654375527, 'weight_decay': 1.4531880622815262e-05, 'epochs': 182, 'loss': 'mae', 'optimizer': 'adam', 'graph_mode': 'off', 'use_snp_selection': False}. Best is trial 39 with value: 0.06568810899207723.
[I 2025-11-03 13:59:15,851] Trial 49 finished with value: 0.04823129394569894 and parameters: {'model_type': 'gcn', 'hidden_dims': '[512, 128]', 'dropout': 0.30468490469484427, 'batch_norm': True, 'lr': 6.940756044130459e-05, 'weight_decay': 0.000373540134682856, 'epochs': 290, 'loss': 'mae', 'optimizer': 'adam', 'graph_mode': 'off', 'use_snp_selection': False}. Best is trial 39 with value: 0.06568810899207723.
[I 2025-11-03 13:59:18,287] Trial 50 finished with value: 0.027042854527089353 and parameters: {'model_type': 'gcn', 'hidden_dims': '[512, 256]', 'dropout': 0.15982766084532057, 'batch_norm': True, 'lr': 2.6693831717472616e-06, 'weight_decay': 2.102312461321189e-06, 'epochs': 256, 'loss': 'mae', 'optimizer': 'adam', 'graph_mode': 'off', 'use_snp_selection': True, 'num_snps': 47590}. Best is trial 39 with value: 0.06568810899207723.
[I 2025-11-03 13:59:20,027] Trial 51 finished with value: 0.06302756598253417 and parameters: {'model_type': 'gcn', 'hidden_dims': '[512, 256]', 'dropout': 0.23681467987724808, 'batch_norm': True, 'lr': 0.00018428962951737518, 'weight_decay': 6.084860807598727e-05, 'epochs': 223, 'loss': 'mae', 'optimizer': 'adam', 'graph_mode': 'off', 'use_snp_selection': False}. Best is trial 39 with value: 0.06568810899207723.
[I 2025-11-03 13:59:21,834] Trial 52 finished with value: 0.047560744396494874 and parameters: {'model_type': 'gcn', 'hidden_dims': '[512, 256]', 'dropout': 0.19911103162645316, 'batch_norm': True, 'lr': 0.00022229517951219242, 'weight_decay': 0.00010700641320167406, 'epochs': 221, 'loss': 'mae', 'optimizer': 'adam', 'graph_mode': 'off', 'use_snp_selection': False}. Best is trial 39 with value: 0.06568810899207723.
[I 2025-11-03 13:59:23,267] Trial 53 finished with value: 0.07059634841970504 and parameters: {'model_type': 'gcn', 'hidden_dims': '[512, 256]', 'dropout': 0.22894242156347772, 'batch_norm': True, 'lr': 0.0004996079534597139, 'weight_decay': 2.3676467473988347e-05, 'epochs': 143, 'loss': 'mae', 'optimizer': 'adam', 'graph_mode': 'off', 'use_snp_selection': False}. Best is trial 53 with value: 0.07059634841970504.
[I 2025-11-03 13:59:24,705] Trial 54 finished with value: 0.03905013116865384 and parameters: {'model_type': 'gcn', 'hidden_dims': '[512, 256]', 'dropout': 0.27160615776170965, 'batch_norm': True, 'lr': 0.0005880639921619275, 'weight_decay': 0.0001774212484316071, 'epochs': 142, 'loss': 'mae', 'optimizer': 'adam', 'graph_mode': 'off', 'use_snp_selection': False}. Best is trial 53 with value: 0.07059634841970504.
[I 2025-11-03 13:59:25,900] Trial 55 finished with value: 0.05552963087746934 and parameters: {'model_type': 'gcn', 'hidden_dims': '[512, 256]', 'dropout': 0.23430023297249755, 'batch_norm': True, 'lr': 0.00038215896911672183, 'weight_decay': 6.015028626410487e-05, 'epochs': 92, 'loss': 'mse', 'optimizer': 'adam', 'graph_mode': 'off', 'use_snp_selection': False}. Best is trial 53 with value: 0.07059634841970504.
[I 2025-11-03 13:59:27,557] Trial 56 finished with value: 0.06264943482916609 and parameters: {'model_type': 'gcn', 'hidden_dims': '[512, 256]', 'dropout': 0.2613104700703, 'batch_norm': True, 'lr': 0.0003068350666907932, 'weight_decay': 5.892865573290939e-07, 'epochs': 185, 'loss': 'mae', 'optimizer': 'adam', 'graph_mode': 'off', 'use_snp_selection': False}. Best is trial 53 with value: 0.07059634841970504.
[I 2025-11-03 13:59:29,046] Trial 57 finished with value: 0.025719834237389185 and parameters: {'model_type': 'gcn', 'hidden_dims': '[512, 256]', 'dropout': 0.1290069242883959, 'batch_norm': False, 'lr': 0.0003038222342167, 'weight_decay': 1.017093162048728e-06, 'epochs': 160, 'loss': 'mae', 'optimizer': 'adam', 'graph_mode': 'off', 'use_snp_selection': False}. Best is trial 53 with value: 0.07059634841970504.
[I 2025-11-03 13:59:30,485] Trial 58 finished with value: 0.04729515692030941 and parameters: {'model_type': 'gcn', 'hidden_dims': '[256, 128, 64]', 'dropout': 0.22457305534510041, 'batch_norm': True, 'lr': 0.0004256850632618115, 'weight_decay': 3.6135392233969375e-07, 'epochs': 205, 'loss': 'mae', 'optimizer': 'adam', 'graph_mode': 'off', 'use_snp_selection': False}. Best is trial 53 with value: 0.07059634841970504.
[I 2025-11-03 13:59:32,147] Trial 59 finished with value: 0.04862046887274166 and parameters: {'model_type': 'gcn', 'hidden_dims': '[512, 256]', 'dropout': 0.31794097342702154, 'batch_norm': True, 'lr': 0.0005113391362593943, 'weight_decay': 4.2948819091761516e-07, 'epochs': 188, 'loss': 'mae', 'optimizer': 'adam', 'graph_mode': 'off', 'use_snp_selection': False}. Best is trial 53 with value: 0.07059634841970504.
[I 2025-11-03 13:59:33,219] Trial 60 finished with value: 0.040602177365044255 and parameters: {'model_type': 'gcn', 'hidden_dims': '[512, 64]', 'dropout': 0.2893945200924064, 'batch_norm': True, 'lr': 0.0008429513099327479, 'weight_decay': 1.9154924719438918e-07, 'epochs': 113, 'loss': 'mae', 'optimizer': 'adam', 'graph_mode': 'off', 'use_snp_selection': True, 'num_snps': 18727}. Best is trial 53 with value: 0.07059634841970504.
[I 2025-11-03 13:59:34,628] Trial 61 finished with value: 0.0508827500715689 and parameters: {'model_type': 'gcn', 'hidden_dims': '[512, 256]', 'dropout': 0.265217661932309, 'batch_norm': True, 'lr': 0.00021649914514583214, 'weight_decay': 4.1228522337372146e-05, 'epochs': 134, 'loss': 'mae', 'optimizer': 'adam', 'graph_mode': 'off', 'use_snp_selection': False}. Best is trial 53 with value: 0.07059634841970504.
[I 2025-11-03 13:59:36,126] Trial 62 finished with value: 0.019245294569293896 and parameters: {'model_type': 'gcn', 'hidden_dims': '[512, 256]', 'dropout': 0.19763882619712048, 'batch_norm': True, 'lr': 2.4498032309634126e-05, 'weight_decay': 1.1179729788880445e-06, 'epochs': 157, 'loss': 'mae', 'optimizer': 'adam', 'graph_mode': 'off', 'use_snp_selection': False}. Best is trial 53 with value: 0.07059634841970504.
[I 2025-11-03 13:59:37,222] Trial 63 finished with value: 0.05183822084874499 and parameters: {'model_type': 'gcn', 'hidden_dims': '[512, 256]', 'dropout': 0.1688607126659009, 'batch_norm': True, 'lr': 0.00013317011109614045, 'weight_decay': 0.0006696905165049866, 'epochs': 76, 'loss': 'mae', 'optimizer': 'adam', 'graph_mode': 'off', 'use_snp_selection': False}. Best is trial 53 with value: 0.07059634841970504.
[I 2025-11-03 13:59:39,052] Trial 64 finished with value: 0.02252014060540332 and parameters: {'model_type': 'gcn', 'hidden_dims': '[512, 256]', 'dropout': 0.23872943475568675, 'batch_norm': True, 'lr': 1.3998046613557685e-05, 'weight_decay': 2.9745216572778283e-05, 'epochs': 232, 'loss': 'mae', 'optimizer': 'adam', 'graph_mode': 'off', 'use_snp_selection': False}. Best is trial 53 with value: 0.07059634841970504.
[I 2025-11-03 13:59:40,041] Trial 65 finished with value: 0.026175847927628462 and parameters: {'model_type': 'gcn', 'hidden_dims': '[128, 64]', 'dropout': 0.2558290265821884, 'batch_norm': True, 'lr': 3.696132748081946e-05, 'weight_decay': 6.0995989666021234e-05, 'epochs': 170, 'loss': 'mae', 'optimizer': 'adam', 'graph_mode': 'off', 'use_snp_selection': False}. Best is trial 53 with value: 0.07059634841970504.
[I 2025-11-03 13:59:41,778] Trial 66 finished with value: 0.050710015181092666 and parameters: {'model_type': 'gcn', 'hidden_dims': '[512, 256]', 'dropout': 0.3555910815268638, 'batch_norm': True, 'lr': 0.0005435419073639191, 'weight_decay': 5.903262310722151e-06, 'epochs': 209, 'loss': 'mae', 'optimizer': 'adam', 'graph_mode': 'off', 'use_snp_selection': False}. Best is trial 53 with value: 0.07059634841970504.
[I 2025-11-03 13:59:43,346] Trial 67 finished with value: 0.05471027364028211 and parameters: {'model_type': 'gcn', 'hidden_dims': '[512, 256]', 'dropout': 0.21900934222538768, 'batch_norm': True, 'lr': 0.000299261285068244, 'weight_decay': 1.0184686741219039e-07, 'epochs': 183, 'loss': 'mae', 'optimizer': 'adam', 'graph_mode': 'off', 'use_snp_selection': False}. Best is trial 53 with value: 0.07059634841970504.
[I 2025-11-03 13:59:44,987] Trial 68 finished with value: 0.0418190127560123 and parameters: {'model_type': 'gcn', 'hidden_dims': '[512, 256]', 'dropout': 0.18448817323355649, 'batch_norm': True, 'lr': 5.945108703152038e-05, 'weight_decay': 1.9081282896256902e-05, 'epochs': 197, 'loss': 'mse', 'optimizer': 'adam', 'graph_mode': 'off', 'use_snp_selection': False}. Best is trial 53 with value: 0.07059634841970504.
[I 2025-11-03 13:59:47,346] Trial 69 finished with value: 0.033627174637881535 and parameters: {'model_type': 'gcn', 'hidden_dims': '[512, 256]', 'dropout': 0.28281280641235296, 'batch_norm': False, 'lr': 0.00020106961216614276, 'weight_decay': 0.00010039243610482328, 'epochs': 340, 'loss': 'mae', 'optimizer': 'adam', 'graph_mode': 'off', 'use_snp_selection': False}. Best is trial 53 with value: 0.07059634841970504.
[I 2025-11-03 13:59:48,718] Trial 70 finished with value: 0.05787905861070354 and parameters: {'model_type': 'gcn', 'hidden_dims': '[256, 128]', 'dropout': 0.48536877234823766, 'batch_norm': True, 'lr': 0.0007166778768779468, 'weight_decay': 3.344905779082529e-06, 'epochs': 248, 'loss': 'mae', 'optimizer': 'adam', 'graph_mode': 'off', 'use_snp_selection': False}. Best is trial 53 with value: 0.07059634841970504.
[I 2025-11-03 13:59:50,087] Trial 71 finished with value: 0.06362022067927689 and parameters: {'model_type': 'gcn', 'hidden_dims': '[256, 128]', 'dropout': 0.49633299445319956, 'batch_norm': True, 'lr': 0.0006984870409452299, 'weight_decay': 3.39968116757064e-06, 'epochs': 244, 'loss': 'mae', 'optimizer': 'adam', 'graph_mode': 'off', 'use_snp_selection': False}. Best is trial 53 with value: 0.07059634841970504.
[I 2025-11-03 13:59:51,356] Trial 72 finished with value: 0.057442311811770924 and parameters: {'model_type': 'gcn', 'hidden_dims': '[256, 128]', 'dropout': 0.524526625035869, 'batch_norm': True, 'lr': 0.0004565725663338184, 'weight_decay': 2.796279561487135e-06, 'epochs': 217, 'loss': 'mae', 'optimizer': 'adam', 'graph_mode': 'off', 'use_snp_selection': False}. Best is trial 53 with value: 0.07059634841970504.
[I 2025-11-03 13:59:52,750] Trial 73 finished with value: 0.06567803863932165 and parameters: {'model_type': 'gcn', 'hidden_dims': '[256, 128]', 'dropout': 0.4943301562430416, 'batch_norm': True, 'lr': 0.0003423239782406277, 'weight_decay': 9.718058641733741e-06, 'epochs': 229, 'loss': 'mae', 'optimizer': 'adam', 'graph_mode': 'off', 'use_snp_selection': False}. Best is trial 53 with value: 0.07059634841970504.
[I 2025-11-03 13:59:54,089] Trial 74 finished with value: 0.03500820448595403 and parameters: {'model_type': 'gcn', 'hidden_dims': '[256, 128]', 'dropout': 0.4928449660752769, 'batch_norm': True, 'lr': 0.0006305382562029851, 'weight_decay': 1.1648691592842168e-05, 'epochs': 235, 'loss': 'mae', 'optimizer': 'adam', 'graph_mode': 'off', 'use_snp_selection': False}. Best is trial 53 with value: 0.07059634841970504.
[I 2025-11-03 13:59:55,413] Trial 75 finished with value: 0.0628308785588059 and parameters: {'model_type': 'gcn', 'hidden_dims': '[256, 128]', 'dropout': 0.5520619143529093, 'batch_norm': True, 'lr': 0.0003405338201582009, 'weight_decay': 8.573787065920109e-06, 'epochs': 229, 'loss': 'mae', 'optimizer': 'adam', 'graph_mode': 'off', 'use_snp_selection': False}. Best is trial 53 with value: 0.07059634841970504.
[I 2025-11-03 13:59:56,673] Trial 76 finished with value: 0.047892775185884556 and parameters: {'model_type': 'gcn', 'hidden_dims': '[256, 128]', 'dropout': 0.5605622020378667, 'batch_norm': True, 'lr': 0.0003122858544552581, 'weight_decay': 7.271287339194997e-06, 'epochs': 204, 'loss': 'mae', 'optimizer': 'adam', 'graph_mode': 'off', 'use_snp_selection': False}. Best is trial 53 with value: 0.07059634841970504.
[I 2025-11-03 13:59:58,000] Trial 77 finished with value: 0.03998864907416597 and parameters: {'model_type': 'gcn', 'hidden_dims': '[256, 128]', 'dropout': 0.4713204647862824, 'batch_norm': True, 'lr': 0.0002511239444302668, 'weight_decay': 4.862963346486374e-06, 'epochs': 227, 'loss': 'mae', 'optimizer': 'adam', 'graph_mode': 'off', 'use_snp_selection': False}. Best is trial 53 with value: 0.07059634841970504.
[I 2025-11-03 13:59:59,374] Trial 78 finished with value: 0.038155201563438365 and parameters: {'model_type': 'gcn', 'hidden_dims': '[256, 128]', 'dropout': 0.546221659178987, 'batch_norm': True, 'lr': 0.0003543181438112679, 'weight_decay': 1.5952248044414614e-05, 'epochs': 248, 'loss': 'mae', 'optimizer': 'adam', 'graph_mode': 'off', 'use_snp_selection': False}. Best is trial 53 with value: 0.07059634841970504.
[I 2025-11-03 14:00:01,447] Trial 79 finished with value: 0.04530297050112294 and parameters: {'model_type': 'gcn', 'hidden_dims': '[256, 128]', 'dropout': 0.4348002807791907, 'batch_norm': True, 'lr': 0.0009637862717004238, 'weight_decay': 8.544857661292562e-06, 'epochs': 239, 'loss': 'mae', 'optimizer': 'adam', 'graph_mode': 'off', 'use_snp_selection': True, 'num_snps': 47721}. Best is trial 53 with value: 0.07059634841970504.
[I 2025-11-03 14:00:02,896] Trial 80 finished with value: 0.05700460264851987 and parameters: {'model_type': 'gcn', 'hidden_dims': '[256, 128]', 'dropout': 0.5107707109284275, 'batch_norm': True, 'lr': 0.0004590063176817974, 'weight_decay': 1.1027688666748242e-05, 'epochs': 264, 'loss': 'mae', 'optimizer': 'adam', 'graph_mode': 'off', 'use_snp_selection': False}. Best is trial 53 with value: 0.07059634841970504.
[I 2025-11-03 14:00:04,378] Trial 81 finished with value: 0.053356401595112485 and parameters: {'model_type': 'gcn', 'hidden_dims': '[256, 128]', 'dropout': 0.5789796545377052, 'batch_norm': True, 'lr': 0.0007637213363831629, 'weight_decay': 2.27826415809529e-05, 'epochs': 280, 'loss': 'mae', 'optimizer': 'adam', 'graph_mode': 'off', 'use_snp_selection': False}. Best is trial 53 with value: 0.07059634841970504.
[I 2025-11-03 14:00:05,655] Trial 82 finished with value: 0.03376109118888834 and parameters: {'model_type': 'gcn', 'hidden_dims': '[256, 128]', 'dropout': 0.4088075835118527, 'batch_norm': True, 'lr': 0.00018175848876035358, 'weight_decay': 5.9919372020029886e-06, 'epochs': 214, 'loss': 'mae', 'optimizer': 'adam', 'graph_mode': 'off', 'use_snp_selection': False}. Best is trial 53 with value: 0.07059634841970504.
[I 2025-11-03 14:00:06,686] Trial 83 finished with value: 0.056896351984175135 and parameters: {'model_type': 'gcn', 'hidden_dims': '[128, 64]', 'dropout': 0.44152540897949255, 'batch_norm': True, 'lr': 0.00012338193629853948, 'weight_decay': 3.8216702410604624e-05, 'epochs': 191, 'loss': 'mae', 'optimizer': 'adam', 'graph_mode': 'off', 'use_snp_selection': False}. Best is trial 53 with value: 0.07059634841970504.
[I 2025-11-03 14:00:08,319] Trial 84 finished with value: 0.009544905105343227 and parameters: {'model_type': 'gcn', 'hidden_dims': '[256, 128, 64]', 'dropout': 0.48662705797388806, 'batch_norm': True, 'lr': 0.00039292616179141993, 'weight_decay': 1.052066398484125e-05, 'epochs': 256, 'loss': 'mae', 'optimizer': 'adam', 'graph_mode': 'off', 'use_snp_selection': False}. Best is trial 53 with value: 0.07059634841970504.
[I 2025-11-03 14:00:09,680] Trial 85 finished with value: 0.032569479085181895 and parameters: {'model_type': 'gcn', 'hidden_dims': '[256, 128]', 'dropout': 0.5431445773119383, 'batch_norm': True, 'lr': 0.0002698275406280495, 'weight_decay': 4.8079651216016846e-05, 'epochs': 226, 'loss': 'mae', 'optimizer': 'adam', 'graph_mode': 'off', 'use_snp_selection': False}. Best is trial 53 with value: 0.07059634841970504.
[I 2025-11-03 14:00:10,872] Trial 86 finished with value: 0.053303044220877824 and parameters: {'model_type': 'gcn', 'hidden_dims': '[256, 128]', 'dropout': 0.5068346390008865, 'batch_norm': True, 'lr': 0.0001598358824842762, 'weight_decay': 0.00012917510155720805, 'epochs': 175, 'loss': 'mse', 'optimizer': 'adam', 'graph_mode': 'off', 'use_snp_selection': False}. Best is trial 53 with value: 0.07059634841970504.
[I 2025-11-03 14:00:12,674] Trial 87 finished with value: 0.03533324649772265 and parameters: {'model_type': 'gcn', 'hidden_dims': '[512, 64]', 'dropout': 0.5224005928667391, 'batch_norm': False, 'lr': 0.0005558815520159173, 'weight_decay': 2.319782999878054e-05, 'epochs': 218, 'loss': 'mae', 'optimizer': 'adam', 'graph_mode': 'off', 'use_snp_selection': False}. Best is trial 53 with value: 0.07059634841970504.
[I 2025-11-03 14:00:14,653] Trial 88 finished with value: 0.04849619424482278 and parameters: {'model_type': 'gcn', 'hidden_dims': '[512, 256]', 'dropout': 0.4737907337089015, 'batch_norm': True, 'lr': 0.00010699889384994039, 'weight_decay': 7.488012805685958e-05, 'epochs': 247, 'loss': 'mae', 'optimizer': 'adam', 'graph_mode': 'off', 'use_snp_selection': False}. Best is trial 53 with value: 0.07059634841970504.
[I 2025-11-03 14:00:16,344] Trial 89 finished with value: 0.019102202875647165 and parameters: {'model_type': 'gcn', 'hidden_dims': '[512, 256]', 'dropout': 0.23162023993043357, 'batch_norm': True, 'lr': 8.624297921647991e-05, 'weight_decay': 3.45935879337391e-06, 'epochs': 199, 'loss': 'mae', 'optimizer': 'adam', 'graph_mode': 'off', 'use_snp_selection': False}. Best is trial 53 with value: 0.07059634841970504.
[I 2025-11-03 14:00:17,819] Trial 90 finished with value: 0.06270570086585964 and parameters: {'model_type': 'gcn', 'hidden_dims': '[512, 256]', 'dropout': 0.2111501012116229, 'batch_norm': True, 'lr': 0.0003307728946908416, 'weight_decay': 2.2599167368358423e-06, 'epochs': 148, 'loss': 'mae', 'optimizer': 'adam', 'graph_mode': 'off', 'use_snp_selection': False}. Best is trial 53 with value: 0.07059634841970504.
[I 2025-11-03 14:00:19,271] Trial 91 finished with value: 0.05849137036414412 and parameters: {'model_type': 'gcn', 'hidden_dims': '[512, 256]', 'dropout': 0.18958371469463148, 'batch_norm': True, 'lr': 0.0003402212427914678, 'weight_decay': 9.335158359139399e-07, 'epochs': 146, 'loss': 'mae', 'optimizer': 'adam', 'graph_mode': 'off', 'use_snp_selection': False}. Best is trial 53 with value: 0.07059634841970504.
[I 2025-11-03 14:00:20,821] Trial 92 finished with value: 0.04948581392842542 and parameters: {'model_type': 'gcn', 'hidden_dims': '[512, 256]', 'dropout': 0.2066845578153321, 'batch_norm': True, 'lr': 0.00025745949282223634, 'weight_decay': 2.4013558242062134e-06, 'epochs': 178, 'loss': 'mae', 'optimizer': 'adam', 'graph_mode': 'off', 'use_snp_selection': False}. Best is trial 53 with value: 0.07059634841970504.
[I 2025-11-03 14:00:22,246] Trial 93 finished with value: 0.04206497292598042 and parameters: {'model_type': 'gcn', 'hidden_dims': '[512, 256]', 'dropout': 0.17391637177411295, 'batch_norm': True, 'lr': 0.00046933520712495833, 'weight_decay': 5.186054267337552e-06, 'epochs': 131, 'loss': 'mae', 'optimizer': 'adam', 'graph_mode': 'off', 'use_snp_selection': False}. Best is trial 53 with value: 0.07059634841970504.
