[I 2025-11-03 11:43:38,928] Trial 86 finished with value: 0.09786124449749835 and parameters: {'model_type': 'gcn', 'hidden_dims': '[128, 64]', 'dropout': 0.18542215272554613, 'batch_norm': True, 'lr': 0.00015213325631520467, 'weight_decay': 4.5492386144055225e-05, 'epochs': 118, 'loss': 'mse', 'optimizer': 'adam', 'graph_mode': 'cutoff', 'cutoff': 0.7288184469496917, 'grm_norm': 'cosine_then_gcn', 'self_loops': True, 'use_snp_selection': False}. Best is trial 61 with value: 0.1359435621151581.
[I 2025-11-03 11:43:40,145] Trial 87 finished with value: 0.11550324723208795 and parameters: {'model_type': 'gcn', 'hidden_dims': '[256, 128]', 'dropout': 0.19474012697039966, 'batch_norm': True, 'lr': 0.00033950630351572676, 'weight_decay': 6.65996619629389e-06, 'epochs': 43, 'loss': 'mse', 'optimizer': 'adam', 'graph_mode': 'cutoff', 'cutoff': 0.27833149744664215, 'grm_norm': 'cosine_then_gcn', 'self_loops': False, 'use_snp_selection': False}. Best is trial 61 with value: 0.1359435621151581.
[I 2025-11-03 11:43:41,799] Trial 88 finished with value: 0.0954496795698661 and parameters: {'model_type': 'gcn', 'hidden_dims': '[256, 128, 64]', 'dropout': 0.2313217852594147, 'batch_norm': True, 'lr': 0.000441976538572274, 'weight_decay': 0.0005305857209938624, 'epochs': 133, 'loss': 'mse', 'optimizer': 'adam', 'graph_mode': 'cutoff', 'cutoff': 0.7075454702570618, 'grm_norm': 'gcn', 'self_loops': True, 'use_snp_selection': False}. Best is trial 61 with value: 0.1359435621151581.
[I 2025-11-03 11:43:43,233] Trial 89 finished with value: 0.003849358451153103 and parameters: {'model_type': 'gcn', 'hidden_dims': '[256, 128, 64]', 'dropout': 0.3810004290839359, 'batch_norm': True, 'lr': 2.3732095640054574e-06, 'weight_decay': 3.6087979521660026e-06, 'epochs': 72, 'loss': 'mse', 'optimizer': 'adam', 'graph_mode': 'knn', 'source': 'grm', 'knn_k': 9, 'weighted_edges': True, 'symmetrize_mode': 'union', 'use_snp_selection': False}. Best is trial 61 with value: 0.1359435621151581.
[I 2025-11-03 11:43:44,267] Trial 90 finished with value: 0.06121110358951968 and parameters: {'model_type': 'gcn', 'hidden_dims': '[512, 64]', 'dropout': 0.2774622926678854, 'batch_norm': False, 'lr': 9.020245328201042e-06, 'weight_decay': 0.0001448883889461362, 'epochs': 60, 'loss': 'mse', 'optimizer': 'adam', 'graph_mode': 'cutoff', 'cutoff': 0.6315394174481553, 'grm_norm': 'cosine_then_gcn', 'self_loops': False, 'use_snp_selection': True, 'num_snps': 3647}. Best is trial 61 with value: 0.1359435621151581.
[I 2025-11-03 11:43:46,056] Trial 91 finished with value: 0.11287381698344331 and parameters: {'model_type': 'gcn', 'hidden_dims': '[256, 128, 64]', 'dropout': 0.18564185988400794, 'batch_norm': True, 'lr': 0.0005460315287746325, 'weight_decay': 8.620920806905119e-05, 'epochs': 155, 'loss': 'mse', 'optimizer': 'adam', 'graph_mode': 'cutoff', 'cutoff': 0.594320963766081, 'grm_norm': 'cosine_then_gcn', 'self_loops': True, 'use_snp_selection': False}. Best is trial 61 with value: 0.1359435621151581.
[I 2025-11-03 11:43:47,933] Trial 92 finished with value: 0.11114345878829554 and parameters: {'model_type': 'gcn', 'hidden_dims': '[256, 128, 64]', 'dropout': 0.176544477763076, 'batch_norm': True, 'lr': 0.000690390634717235, 'weight_decay': 3.5869178215491475e-05, 'epochs': 180, 'loss': 'mse', 'optimizer': 'adam', 'graph_mode': 'cutoff', 'cutoff': 0.6179588246437662, 'grm_norm': 'cosine_then_gcn', 'self_loops': True, 'use_snp_selection': False}. Best is trial 61 with value: 0.1359435621151581.
[I 2025-11-03 11:43:49,739] Trial 93 finished with value: 0.09092719237633277 and parameters: {'model_type': 'gcn', 'hidden_dims': '[256, 128, 64]', 'dropout': 0.24632905079973108, 'batch_norm': True, 'lr': 0.0004825973935372439, 'weight_decay': 5.86146897280212e-05, 'epochs': 165, 'loss': 'mse', 'optimizer': 'adam', 'graph_mode': 'cutoff', 'cutoff': 0.6428845980688234, 'grm_norm': 'cosine_then_gcn', 'self_loops': True, 'use_snp_selection': False}. Best is trial 61 with value: 0.1359435621151581.
[I 2025-11-03 11:43:51,440] Trial 94 finished with value: 0.09558808911155994 and parameters: {'model_type': 'gcn', 'hidden_dims': '[256, 128, 64]', 'dropout': 0.2153791410773151, 'batch_norm': True, 'lr': 0.0002706565387740112, 'weight_decay': 0.0002258096203322683, 'epochs': 141, 'loss': 'mse', 'optimizer': 'adam', 'graph_mode': 'cutoff', 'cutoff': 0.5602987549137867, 'grm_norm': 'cosine_then_gcn', 'self_loops': True, 'use_snp_selection': False}. Best is trial 61 with value: 0.1359435621151581.
[I 2025-11-03 11:43:52,990] Trial 95 finished with value: 0.08925752888182281 and parameters: {'model_type': 'gcn', 'hidden_dims': '[256, 128, 64]', 'dropout': 0.15756598009951822, 'batch_norm': True, 'lr': 0.00021628671402915356, 'weight_decay': 1.2870557085816647e-05, 'epochs': 107, 'loss': 'mse', 'optimizer': 'adam', 'graph_mode': 'cutoff', 'cutoff': 0.5098899020879286, 'grm_norm': 'cosine_then_gcn', 'self_loops': True, 'use_snp_selection': False}. Best is trial 61 with value: 0.1359435621151581.
[I 2025-11-03 11:43:54,202] Trial 96 finished with value: 0.11393038169360316 and parameters: {'model_type': 'gcn', 'hidden_dims': '[128, 64]', 'dropout': 0.19853490072962754, 'batch_norm': True, 'lr': 0.0008505318444132895, 'weight_decay': 2.949643971581159e-05, 'epochs': 86, 'loss': 'mse', 'optimizer': 'adam', 'graph_mode': 'cutoff', 'cutoff': 0.6770644118508324, 'grm_norm': 'cosine_then_gcn', 'self_loops': True, 'use_snp_selection': False}. Best is trial 61 with value: 0.1359435621151581.
[I 2025-11-03 11:43:55,593] Trial 97 finished with value: 0.07874671025504075 and parameters: {'model_type': 'gcn', 'hidden_dims': '[256, 128]', 'dropout': 0.13526452966794153, 'batch_norm': True, 'lr': 0.00036693088104236196, 'weight_decay': 0.00040069701519165294, 'epochs': 98, 'loss': 'mae', 'optimizer': 'adam', 'graph_mode': 'cutoff', 'cutoff': 0.25070468723353223, 'grm_norm': 'none', 'self_loops': False, 'use_snp_selection': False}. Best is trial 61 with value: 0.1359435621151581.
[I 2025-11-03 11:43:57,327] Trial 98 finished with value: 0.049802591153732784 and parameters: {'model_type': 'gcn', 'hidden_dims': '[256, 128, 64]', 'dropout': 0.17645444573419053, 'batch_norm': True, 'lr': 3.1831344849191446e-05, 'weight_decay': 1.970235260859453e-05, 'epochs': 151, 'loss': 'mse', 'optimizer': 'adam', 'graph_mode': 'cutoff', 'cutoff': 0.7925605802926414, 'grm_norm': 'cosine', 'self_loops': False, 'use_snp_selection': False}. Best is trial 61 with value: 0.1359435621151581.
[I 2025-11-03 11:43:59,177] Trial 99 finished with value: 0.07614281699276122 and parameters: {'model_type': 'gcn', 'hidden_dims': '[512, 128]', 'dropout': 0.26020624906903844, 'batch_norm': True, 'lr': 6.267149899580751e-05, 'weight_decay': 0.0006237393131948541, 'epochs': 124, 'loss': 'mse', 'optimizer': 'adam', 'graph_mode': 'cutoff', 'cutoff': 0.6605467068781187, 'grm_norm': 'cosine_then_gcn', 'self_loops': True, 'use_snp_selection': False}. Best is trial 61 with value: 0.1359435621151581.
[I 2025-11-03 11:44:01,027] Trial 100 finished with value: 0.09974247746358719 and parameters: {'model_type': 'gcn', 'hidden_dims': '[256, 128, 64]', 'dropout': 0.299076705150916, 'batch_norm': True, 'lr': 0.000608080816324881, 'weight_decay': 3.837497590125657e-05, 'epochs': 174, 'loss': 'mse', 'optimizer': 'adam', 'graph_mode': 'cutoff', 'cutoff': 0.8306139265571256, 'grm_norm': 'cosine_then_gcn', 'self_loops': False, 'use_snp_selection': False}. Best is trial 61 with value: 0.1359435621151581.
[I 2025-11-03 11:44:02,576] Trial 101 finished with value: 0.12343942078438763 and parameters: {'model_type': 'gcn', 'hidden_dims': '[128, 64]', 'dropout': 0.23846717067154122, 'batch_norm': True, 'lr': 0.00042128399856251, 'weight_decay': 0.0005065144623211952, 'epochs': 201, 'loss': 'mse', 'optimizer': 'adam', 'graph_mode': 'cutoff', 'cutoff': 0.883873409133856, 'grm_norm': 'cosine_then_gcn', 'self_loops': False, 'use_snp_selection': False}. Best is trial 61 with value: 0.1359435621151581.
[I 2025-11-03 11:44:04,090] Trial 102 finished with value: 0.11439810824800786 and parameters: {'model_type': 'gcn', 'hidden_dims': '[128, 64]', 'dropout': 0.23831230129886163, 'batch_norm': True, 'lr': 0.00042022369207048713, 'weight_decay': 0.000504389770351402, 'epochs': 189, 'loss': 'mse', 'optimizer': 'adam', 'graph_mode': 'cutoff', 'cutoff': 0.8704416900164818, 'grm_norm': 'cosine_then_gcn', 'self_loops': False, 'use_snp_selection': False}. Best is trial 61 with value: 0.1359435621151581.
[I 2025-11-03 11:44:05,633] Trial 103 finished with value: 0.12055563158951564 and parameters: {'model_type': 'gcn', 'hidden_dims': '[128, 64]', 'dropout': 0.20953596589272647, 'batch_norm': True, 'lr': 0.0007158546654664496, 'weight_decay': 0.00034214662867496114, 'epochs': 199, 'loss': 'mse', 'optimizer': 'adam', 'graph_mode': 'cutoff', 'cutoff': 0.7521856838816259, 'grm_norm': 'cosine_then_gcn', 'self_loops': False, 'use_snp_selection': False}. Best is trial 61 with value: 0.1359435621151581.
[I 2025-11-03 11:44:07,242] Trial 104 finished with value: 0.11979281191210894 and parameters: {'model_type': 'gcn', 'hidden_dims': '[128, 64]', 'dropout': 0.21116271203219222, 'batch_norm': True, 'lr': 0.0008861150659550916, 'weight_decay': 0.0003242620605299478, 'epochs': 221, 'loss': 'mse', 'optimizer': 'adam', 'graph_mode': 'cutoff', 'cutoff': 0.7511584951694578, 'grm_norm': 'cosine_then_gcn', 'self_loops': False, 'use_snp_selection': False}. Best is trial 61 with value: 0.1359435621151581.
[I 2025-11-03 11:44:08,891] Trial 105 finished with value: 0.1250829661548426 and parameters: {'model_type': 'gcn', 'hidden_dims': '[128, 64]', 'dropout': 0.20939959380912548, 'batch_norm': True, 'lr': 0.0008734261474202566, 'weight_decay': 0.0003310684677885715, 'epochs': 235, 'loss': 'mse', 'optimizer': 'adam', 'graph_mode': 'cutoff', 'cutoff': 0.7461948156968604, 'grm_norm': 'cosine_then_gcn', 'self_loops': False, 'use_snp_selection': False}. Best is trial 61 with value: 0.1359435621151581.
[I 2025-11-03 11:44:10,578] Trial 106 finished with value: 0.10175528180300386 and parameters: {'model_type': 'gcn', 'hidden_dims': '[128, 64]', 'dropout': 0.22709354454511324, 'batch_norm': True, 'lr': 0.0007153782889206848, 'weight_decay': 0.0003403867402734871, 'epochs': 247, 'loss': 'mse', 'optimizer': 'adam', 'graph_mode': 'cutoff', 'cutoff': 0.7543650903933455, 'grm_norm': 'cosine_then_gcn', 'self_loops': False, 'use_snp_selection': False}. Best is trial 61 with value: 0.1359435621151581.
[I 2025-11-03 11:44:12,181] Trial 107 finished with value: 0.11441788113117592 and parameters: {'model_type': 'gcn', 'hidden_dims': '[128, 64]', 'dropout': 0.21043215441296265, 'batch_norm': True, 'lr': 0.0009108000697471603, 'weight_decay': 0.0008031994028504149, 'epochs': 219, 'loss': 'mse', 'optimizer': 'adam', 'graph_mode': 'cutoff', 'cutoff': 0.7706385823203813, 'grm_norm': 'cosine_then_gcn', 'self_loops': False, 'use_snp_selection': False}. Best is trial 61 with value: 0.1359435621151581.
[I 2025-11-03 11:44:13,734] Trial 108 finished with value: 0.1215509252734993 and parameters: {'model_type': 'gcn', 'hidden_dims': '[128, 64]', 'dropout': 0.24939086308628278, 'batch_norm': True, 'lr': 0.0009788352814664365, 'weight_decay': 0.00045500949856568633, 'epochs': 202, 'loss': 'mse', 'optimizer': 'adam', 'graph_mode': 'cutoff', 'cutoff': 0.8198688981215577, 'grm_norm': 'cosine_then_gcn', 'self_loops': False, 'use_snp_selection': False}. Best is trial 61 with value: 0.1359435621151581.
[I 2025-11-03 11:44:15,333] Trial 109 finished with value: 0.10901648414684834 and parameters: {'model_type': 'gcn', 'hidden_dims': '[128, 64]', 'dropout': 0.2500036933684504, 'batch_norm': True, 'lr': 0.0009121407605727253, 'weight_decay': 0.0004444664863110042, 'epochs': 203, 'loss': 'mse', 'optimizer': 'adam', 'graph_mode': 'knn', 'source': 'grm', 'knn_k': 6, 'weighted_edges': False, 'symmetrize_mode': 'mutual', 'use_snp_selection': False}. Best is trial 61 with value: 0.1359435621151581.
[I 2025-11-03 11:44:17,711] Trial 110 finished with value: 0.07913674468458197 and parameters: {'model_type': 'gcn', 'hidden_dims': '[128, 64]', 'dropout': 0.27711248733476895, 'batch_norm': False, 'lr': 0.0006619111031394484, 'weight_decay': 0.000613403257631526, 'epochs': 221, 'loss': 'mse', 'optimizer': 'adam', 'graph_mode': 'cutoff', 'cutoff': 0.8533648156269215, 'grm_norm': 'cosine_then_gcn', 'self_loops': False, 'use_snp_selection': True, 'num_snps': 36174}. Best is trial 61 with value: 0.1359435621151581.
[I 2025-11-03 11:44:19,348] Trial 111 finished with value: 0.11146760066029571 and parameters: {'model_type': 'gcn', 'hidden_dims': '[128, 64]', 'dropout': 0.2654718595477086, 'batch_norm': True, 'lr': 0.0009822414857070625, 'weight_decay': 0.0002682266877026769, 'epochs': 227, 'loss': 'mse', 'optimizer': 'adam', 'graph_mode': 'cutoff', 'cutoff': 0.8215974398097566, 'grm_norm': 'cosine_then_gcn', 'self_loops': False, 'use_snp_selection': False}. Best is trial 61 with value: 0.1359435621151581.
[I 2025-11-03 11:44:21,001] Trial 112 finished with value: 0.10057010294711274 and parameters: {'model_type': 'gcn', 'hidden_dims': '[128, 64]', 'dropout': 0.24292316795611074, 'batch_norm': True, 'lr': 0.0005775956454365275, 'weight_decay': 0.00034466817288492633, 'epochs': 236, 'loss': 'mse', 'optimizer': 'adam', 'graph_mode': 'cutoff', 'cutoff': 0.7372691899756826, 'grm_norm': 'cosine_then_gcn', 'self_loops': False, 'use_snp_selection': False}. Best is trial 61 with value: 0.1359435621151581.
[I 2025-11-03 11:44:22,704] Trial 113 finished with value: 0.12073491217552149 and parameters: {'model_type': 'gcn', 'hidden_dims': '[128, 64]', 'dropout': 0.22175058691771984, 'batch_norm': True, 'lr': 0.000754368359108463, 'weight_decay': 0.00018321599129623867, 'epochs': 253, 'loss': 'mse', 'optimizer': 'adam', 'graph_mode': 'cutoff', 'cutoff': 0.8090667401132575, 'grm_norm': 'cosine_then_gcn', 'self_loops': False, 'use_snp_selection': False}. Best is trial 61 with value: 0.1359435621151581.
[I 2025-11-03 11:44:24,269] Trial 114 finished with value: 0.12094212029513879 and parameters: {'model_type': 'gcn', 'hidden_dims': '[128, 64]', 'dropout': 0.22306733906808035, 'batch_norm': True, 'lr': 0.0007739561658906743, 'weight_decay': 0.00018855754504133658, 'epochs': 206, 'loss': 'mse', 'optimizer': 'adam', 'graph_mode': 'cutoff', 'cutoff': 0.8950601510659904, 'grm_norm': 'cosine_then_gcn', 'self_loops': False, 'use_snp_selection': False}. Best is trial 61 with value: 0.1359435621151581.
[I 2025-11-03 11:44:25,994] Trial 115 finished with value: 0.10995138542262334 and parameters: {'model_type': 'gcn', 'hidden_dims': '[128, 64]', 'dropout': 0.2566646657955031, 'batch_norm': True, 'lr': 0.0007275554531286412, 'weight_decay': 0.0001853845250107766, 'epochs': 258, 'loss': 'mse', 'optimizer': 'adam', 'graph_mode': 'cutoff', 'cutoff': 0.8851532811731888, 'grm_norm': 'gcn', 'self_loops': False, 'use_snp_selection': False}. Best is trial 61 with value: 0.1359435621151581.
[I 2025-11-03 11:44:27,540] Trial 116 finished with value: 0.10110071961010009 and parameters: {'model_type': 'gcn', 'hidden_dims': '[128, 64]', 'dropout': 0.22884826603207925, 'batch_norm': True, 'lr': 0.00047898515095211487, 'weight_decay': 0.000399310234448713, 'epochs': 200, 'loss': 'mse', 'optimizer': 'adam', 'graph_mode': 'cutoff', 'cutoff': 0.8405973402937861, 'grm_norm': 'cosine_then_gcn', 'self_loops': False, 'use_snp_selection': False}. Best is trial 61 with value: 0.1359435621151581.
[I 2025-11-03 11:44:29,126] Trial 117 finished with value: 0.09953854261759021 and parameters: {'model_type': 'gcn', 'hidden_dims': '[128, 64]', 'dropout': 0.2234480792751776, 'batch_norm': True, 'lr': 0.0005532204649737432, 'weight_decay': 0.00020894358508959725, 'epochs': 210, 'loss': 'mae', 'optimizer': 'adam', 'graph_mode': 'cutoff', 'cutoff': 0.8035189106235483, 'grm_norm': 'cosine_then_gcn', 'self_loops': False, 'use_snp_selection': False}. Best is trial 61 with value: 0.1359435621151581.
[I 2025-11-03 11:44:30,760] Trial 118 finished with value: 0.11021098162446132 and parameters: {'model_type': 'gcn', 'hidden_dims': '[128, 64]', 'dropout': 0.2876092527868135, 'batch_norm': True, 'lr': 8.965183252170618e-05, 'weight_decay': 0.00016208538017304768, 'epochs': 230, 'loss': 'mse', 'optimizer': 'adam', 'graph_mode': 'cutoff', 'cutoff': 0.8959832425269669, 'grm_norm': 'cosine_then_gcn', 'self_loops': False, 'use_snp_selection': False}. Best is trial 61 with value: 0.1359435621151581.
[I 2025-11-03 11:44:32,484] Trial 119 finished with value: 0.12233977548341428 and parameters: {'model_type': 'gcn', 'hidden_dims': '[128, 64]', 'dropout': 0.1985321439455492, 'batch_norm': True, 'lr': 0.0007437783122378264, 'weight_decay': 0.0002879537499447627, 'epochs': 259, 'loss': 'mse', 'optimizer': 'adam', 'graph_mode': 'cutoff', 'cutoff': 0.8155399828126308, 'grm_norm': 'cosine_then_gcn', 'self_loops': False, 'use_snp_selection': False}. Best is trial 61 with value: 0.1359435621151581.
[I 2025-11-03 11:44:34,203] Trial 120 finished with value: 0.06394245964370998 and parameters: {'model_type': 'gcn', 'hidden_dims': '[128, 64]', 'dropout': 0.19630056679843358, 'batch_norm': True, 'lr': 4.2902406649008016e-05, 'weight_decay': 0.00028504052946305307, 'epochs': 261, 'loss': 'mse', 'optimizer': 'adam', 'graph_mode': 'cutoff', 'cutoff': 0.8123817314759789, 'grm_norm': 'cosine', 'self_loops': False, 'use_snp_selection': False}. Best is trial 61 with value: 0.1359435621151581.
[I 2025-11-03 11:44:35,973] Trial 121 finished with value: 0.115498096059634 and parameters: {'model_type': 'gcn', 'hidden_dims': '[128, 64]', 'dropout': 0.2191142705570083, 'batch_norm': True, 'lr': 0.000641935782202221, 'weight_decay': 0.00047458650616662347, 'epochs': 276, 'loss': 'mse', 'optimizer': 'adam', 'graph_mode': 'cutoff', 'cutoff': 0.7848836783805965, 'grm_norm': 'cosine_then_gcn', 'self_loops': False, 'use_snp_selection': False}. Best is trial 61 with value: 0.1359435621151581.
[I 2025-11-03 11:44:37,751] Trial 122 finished with value: 0.1150497350883531 and parameters: {'model_type': 'gcn', 'hidden_dims': '[128, 64]', 'dropout': 0.20530619561305008, 'batch_norm': True, 'lr': 0.0007753218974397773, 'weight_decay': 0.00013000773563783915, 'epochs': 278, 'loss': 'mse', 'optimizer': 'adam', 'graph_mode': 'cutoff', 'cutoff': 0.8750721602571252, 'grm_norm': 'cosine_then_gcn', 'self_loops': False, 'use_snp_selection': False}. Best is trial 61 with value: 0.1359435621151581.
[I 2025-11-03 11:44:39,410] Trial 123 finished with value: 0.11978859054199573 and parameters: {'model_type': 'gcn', 'hidden_dims': '[128, 64]', 'dropout': 0.2340421623083973, 'batch_norm': True, 'lr': 0.0009963937911284387, 'weight_decay': 2.510330296074805e-07, 'epochs': 238, 'loss': 'mse', 'optimizer': 'adam', 'graph_mode': 'cutoff', 'cutoff': 0.8488241420790441, 'grm_norm': 'cosine_then_gcn', 'self_loops': False, 'use_snp_selection': False}. Best is trial 61 with value: 0.1359435621151581.
[I 2025-11-03 11:44:41,097] Trial 124 finished with value: 0.1096781126751683 and parameters: {'model_type': 'gcn', 'hidden_dims': '[128, 64]', 'dropout': 0.24824904247345328, 'batch_norm': True, 'lr': 0.0004061330611857879, 'weight_decay': 0.0008966690735734827, 'epochs': 247, 'loss': 'mse', 'optimizer': 'adam', 'graph_mode': 'cutoff', 'cutoff': 0.8171672317018568, 'grm_norm': 'cosine_then_gcn', 'self_loops': False, 'use_snp_selection': False}. Best is trial 61 with value: 0.1359435621151581.
[I 2025-11-03 11:44:42,910] Trial 125 finished with value: 0.11010375419640407 and parameters: {'model_type': 'gcn', 'hidden_dims': '[128, 64]', 'dropout': 0.2402536294282065, 'batch_norm': True, 'lr': 0.00031191305434977233, 'weight_decay': 0.0006678478971705236, 'epochs': 290, 'loss': 'mse', 'optimizer': 'adam', 'graph_mode': 'cutoff', 'cutoff': 0.8651841209081427, 'grm_norm': 'cosine_then_gcn', 'self_loops': False, 'use_snp_selection': False}. Best is trial 61 with value: 0.1359435621151581.
[I 2025-11-03 11:44:44,434] Trial 126 finished with value: 0.11138215457420848 and parameters: {'model_type': 'gcn', 'hidden_dims': '[128, 64]', 'dropout': 0.2615079535045574, 'batch_norm': True, 'lr': 0.0008047834654281273, 'weight_decay': 8.122097941041058e-07, 'epochs': 199, 'loss': 'mse', 'optimizer': 'adam', 'graph_mode': 'cutoff', 'cutoff': 0.7754219248205911, 'grm_norm': 'none', 'self_loops': False, 'use_snp_selection': False}. Best is trial 61 with value: 0.1359435621151581.
[I 2025-11-03 11:44:45,967] Trial 127 finished with value: 0.10912889820261013 and parameters: {'model_type': 'gcn', 'hidden_dims': '[128, 64]', 'dropout': 0.22283824405219757, 'batch_norm': True, 'lr': 0.000596159343614971, 'weight_decay': 0.0002497465680491358, 'epochs': 191, 'loss': 'mse', 'optimizer': 'adam', 'graph_mode': 'cutoff', 'cutoff': 0.8009481483345569, 'grm_norm': 'cosine_then_gcn', 'self_loops': False, 'use_snp_selection': False}. Best is trial 61 with value: 0.1359435621151581.
[I 2025-11-03 11:44:47,459] Trial 128 finished with value: 0.127897307869551 and parameters: {'model_type': 'gcn', 'hidden_dims': '[128, 64]', 'dropout': 0.1985135554746375, 'batch_norm': True, 'lr': 0.0004993215393796457, 'weight_decay': 0.00010075814710675167, 'epochs': 181, 'loss': 'mse', 'optimizer': 'adam', 'graph_mode': 'cutoff', 'cutoff': 0.833546413058798, 'grm_norm': 'cosine_then_gcn', 'self_loops': False, 'use_snp_selection': False}. Best is trial 61 with value: 0.1359435621151581.
[I 2025-11-03 11:44:48,983] Trial 129 finished with value: 0.08335302537973804 and parameters: {'model_type': 'gcn', 'hidden_dims': '[128, 64]', 'dropout': 0.19111533856587826, 'batch_norm': True, 'lr': 0.0005124684774674677, 'weight_decay': 0.0001947230534317025, 'epochs': 181, 'loss': 'mse', 'optimizer': 'adam', 'graph_mode': 'knn', 'source': 'grm', 'knn_k': 2, 'weighted_edges': True, 'symmetrize_mode': 'union', 'use_snp_selection': False}. Best is trial 61 with value: 0.1359435621151581.
