[I 2025-10-21 18:09:37,584] Trial 59 finished with value: 0.03543393108536701 and parameters: {'model_type': 'gat', 'hidden_dims': '[256, 128, 64]', 'dropout': 0.1046322874194251, 'batch_norm': False, 'gat_heads': 6, 'gat_attn_dropout': 0.2406704673905982, 'gat_concat_hidden': True, 'lr': 0.0006863135338064586, 'weight_decay': 1.5420041947565734e-06, 'epochs': 271, 'loss': 'mse', 'optimizer': 'adam', 'graph_mode': 'cutoff', 'cutoff': 0.879179758553926, 'grm_norm': 'cosine_then_gcn', 'self_loops': False}. Best is trial 58 with value: 0.2528015272051901.
[I 2025-10-21 18:13:09,344] Trial 60 finished with value: 0.22484742726651938 and parameters: {'model_type': 'gat', 'hidden_dims': '[256, 128, 64]', 'dropout': 0.1625222522091379, 'batch_norm': False, 'gat_heads': 6, 'gat_attn_dropout': 0.17888038796496, 'gat_concat_hidden': False, 'lr': 0.0009920260017918176, 'weight_decay': 9.417870457629465e-07, 'epochs': 222, 'loss': 'mae', 'optimizer': 'adam', 'graph_mode': 'cutoff', 'cutoff': 0.3943230811387982, 'grm_norm': 'cosine_then_gcn', 'self_loops': False}. Best is trial 58 with value: 0.2528015272051901.
[I 2025-10-21 18:18:24,173] Trial 61 finished with value: 0.24050040222659072 and parameters: {'model_type': 'gat', 'hidden_dims': '[256, 128, 64]', 'dropout': 0.1234588441426204, 'batch_norm': False, 'gat_heads': 7, 'gat_attn_dropout': 0.2677892304908014, 'gat_concat_hidden': True, 'lr': 0.0005530057617834332, 'weight_decay': 6.43883669368223e-07, 'epochs': 295, 'loss': 'mae', 'optimizer': 'adam', 'graph_mode': 'cutoff', 'cutoff': 0.898226348144298, 'grm_norm': 'cosine_then_gcn', 'self_loops': False}. Best is trial 58 with value: 0.2528015272051901.
[I 2025-10-21 18:23:20,396] Trial 62 finished with value: 0.2398516243624374 and parameters: {'model_type': 'gat', 'hidden_dims': '[256, 128, 64]', 'dropout': 0.1018826336357386, 'batch_norm': False, 'gat_heads': 7, 'gat_attn_dropout': 0.26754122753168386, 'gat_concat_hidden': True, 'lr': 0.0005500866925982118, 'weight_decay': 4.24955884863295e-07, 'epochs': 277, 'loss': 'mae', 'optimizer': 'adam', 'graph_mode': 'cutoff', 'cutoff': 0.8976311298913763, 'grm_norm': 'cosine_then_gcn', 'self_loops': False}. Best is trial 58 with value: 0.2528015272051901.
[I 2025-10-21 18:27:15,038] Trial 63 finished with value: 0.24554192118560367 and parameters: {'model_type': 'gat', 'hidden_dims': '[256, 128, 64]', 'dropout': 0.10069420615303518, 'batch_norm': False, 'gat_heads': 5, 'gat_attn_dropout': 0.24656966637092884, 'gat_concat_hidden': True, 'lr': 0.0005344213204130403, 'weight_decay': 4.6898821653313557e-07, 'epochs': 278, 'loss': 'mae', 'optimizer': 'adam', 'graph_mode': 'cutoff', 'cutoff': 0.8956407619880459, 'grm_norm': 'cosine_then_gcn', 'self_loops': False}. Best is trial 58 with value: 0.2528015272051901.
[I 2025-10-21 18:31:25,966] Trial 64 finished with value: 0.24060208776602496 and parameters: {'model_type': 'gat', 'hidden_dims': '[256, 128, 64]', 'dropout': 0.10216006686001347, 'batch_norm': False, 'gat_heads': 5, 'gat_attn_dropout': 0.2534256313639047, 'gat_concat_hidden': True, 'lr': 0.0005782281872069062, 'weight_decay': 4.509878421056946e-07, 'epochs': 299, 'loss': 'mae', 'optimizer': 'adam', 'graph_mode': 'cutoff', 'cutoff': 0.8999232411826519, 'grm_norm': 'cosine_then_gcn', 'self_loops': False}. Best is trial 58 with value: 0.2528015272051901.
[I 2025-10-21 18:35:36,769] Trial 65 finished with value: 0.1555239507162154 and parameters: {'model_type': 'gat', 'hidden_dims': '[256, 128, 64]', 'dropout': 0.13229887621635722, 'batch_norm': False, 'gat_heads': 5, 'gat_attn_dropout': 0.2145506309916193, 'gat_concat_hidden': True, 'lr': 0.0006304677549048545, 'weight_decay': 1.6251649462911148e-07, 'epochs': 299, 'loss': 'mae', 'optimizer': 'adam', 'graph_mode': 'cutoff', 'cutoff': 0.883762139105118, 'grm_norm': 'cosine_then_gcn', 'self_loops': False}. Best is trial 58 with value: 0.2528015272051901.
[I 2025-10-21 18:40:12,402] Trial 66 finished with value: 0.2418378850601875 and parameters: {'model_type': 'gat', 'hidden_dims': '[256, 128, 64]', 'dropout': 0.1132596869308064, 'batch_norm': False, 'gat_heads': 5, 'gat_attn_dropout': 0.286319804451611, 'gat_concat_hidden': True, 'lr': 0.0008077213340814823, 'weight_decay': 2.7721534603187157e-07, 'epochs': 330, 'loss': 'mae', 'optimizer': 'adam', 'graph_mode': 'cutoff', 'cutoff': 0.8989242755191769, 'grm_norm': 'cosine_then_gcn', 'self_loops': False}. Best is trial 58 with value: 0.2528015272051901.
[I 2025-10-21 18:44:46,373] Trial 67 finished with value: 0.23878633519845707 and parameters: {'model_type': 'gat', 'hidden_dims': '[256, 128, 64]', 'dropout': 0.11381777000523272, 'batch_norm': False, 'gat_heads': 5, 'gat_attn_dropout': 0.2917491968858853, 'gat_concat_hidden': True, 'lr': 0.000890269754811462, 'weight_decay': 3.1699815848017216e-07, 'epochs': 328, 'loss': 'mae', 'optimizer': 'adam', 'graph_mode': 'cutoff', 'cutoff': 0.8726922003678838, 'grm_norm': 'cosine_then_gcn', 'self_loops': False}. Best is trial 58 with value: 0.2528015272051901.
[I 2025-10-21 18:48:16,725] Trial 68 finished with value: 0.17972735852806107 and parameters: {'model_type': 'gat', 'hidden_dims': '[256, 128, 64]', 'dropout': 0.10139253968244188, 'batch_norm': False, 'gat_heads': 4, 'gat_attn_dropout': 0.24500458913027964, 'gat_concat_hidden': True, 'lr': 0.0007784936590444476, 'weight_decay': 1.2801870926612934e-07, 'epochs': 335, 'loss': 'mae', 'optimizer': 'adam', 'graph_mode': 'knn', 'source': 'grm', 'knn_k': 3, 'weighted_edges': True, 'symmetrize_mode': 'mutual'}. Best is trial 58 with value: 0.2528015272051901.
[I 2025-10-21 18:52:37,359] Trial 69 finished with value: 0.21977941937605752 and parameters: {'model_type': 'gat', 'hidden_dims': '[256, 128, 64]', 'dropout': 0.14941823048708752, 'batch_norm': False, 'gat_heads': 5, 'gat_attn_dropout': 0.19124361428579112, 'gat_concat_hidden': True, 'lr': 0.00041328709858084566, 'weight_decay': 1.0642206180744123e-07, 'epochs': 311, 'loss': 'mae', 'optimizer': 'adam', 'graph_mode': 'cutoff', 'cutoff': 0.8268767088549296, 'grm_norm': 'cosine_then_gcn', 'self_loops': False}. Best is trial 58 with value: 0.2528015272051901.
[I 2025-10-21 18:55:43,023] Trial 70 finished with value: 0.20383428699789805 and parameters: {'model_type': 'gat', 'hidden_dims': '[256, 128, 64]', 'dropout': 0.16645254880268526, 'batch_norm': False, 'gat_heads': 4, 'gat_attn_dropout': 0.3196344298520182, 'gat_concat_hidden': True, 'lr': 0.0005357724086960968, 'weight_decay': 2.0047936230988377e-07, 'epochs': 304, 'loss': 'mae', 'optimizer': 'adam', 'graph_mode': 'cutoff', 'cutoff': 0.874301235054389, 'grm_norm': 'cosine_then_gcn', 'self_loops': False}. Best is trial 58 with value: 0.2528015272051901.
[I 2025-10-21 18:59:49,975] Trial 71 finished with value: 0.235398348056968 and parameters: {'model_type': 'gat', 'hidden_dims': '[256, 128, 64]', 'dropout': 0.11669480885911207, 'batch_norm': False, 'gat_heads': 5, 'gat_attn_dropout': 0.2583719573591977, 'gat_concat_hidden': True, 'lr': 0.0003502387024278997, 'weight_decay': 7.381033337571e-07, 'epochs': 293, 'loss': 'mae', 'optimizer': 'adam', 'graph_mode': 'cutoff', 'cutoff': 0.8983733215014299, 'grm_norm': 'cosine_then_gcn', 'self_loops': False}. Best is trial 58 with value: 0.2528015272051901.
[I 2025-10-21 19:04:37,664] Trial 72 finished with value: 0.2509596421996902 and parameters: {'model_type': 'gat', 'hidden_dims': '[256, 128, 64]', 'dropout': 0.12088465485247021, 'batch_norm': False, 'gat_heads': 5, 'gat_attn_dropout': 0.21184720435876292, 'gat_concat_hidden': True, 'lr': 0.0007767668107093831, 'weight_decay': 2.5533580503717706e-07, 'epochs': 344, 'loss': 'mae', 'optimizer': 'adam', 'graph_mode': 'cutoff', 'cutoff': 0.8409167856710371, 'grm_norm': 'cosine_then_gcn', 'self_loops': False}. Best is trial 58 with value: 0.2528015272051901.
[I 2025-10-21 19:09:26,165] Trial 73 finished with value: 0.21620160365372992 and parameters: {'model_type': 'gat', 'hidden_dims': '[256, 128, 64]', 'dropout': 0.1393400581407136, 'batch_norm': False, 'gat_heads': 5, 'gat_attn_dropout': 0.21404306542114032, 'gat_concat_hidden': True, 'lr': 0.0008104053838741705, 'weight_decay': 2.4738288443337283e-07, 'epochs': 343, 'loss': 'mae', 'optimizer': 'adam', 'graph_mode': 'cutoff', 'cutoff': 0.8383431271104224, 'grm_norm': 'cosine_then_gcn', 'self_loops': False}. Best is trial 58 with value: 0.2528015272051901.
[I 2025-10-21 19:13:58,700] Trial 74 finished with value: 0.2431334528737305 and parameters: {'model_type': 'gat', 'hidden_dims': '[256, 128, 64]', 'dropout': 0.11463327491969616, 'batch_norm': False, 'gat_heads': 5, 'gat_attn_dropout': 0.16515121118776688, 'gat_concat_hidden': True, 'lr': 0.000595746693372854, 'weight_decay': 4.825881189168566e-07, 'epochs': 325, 'loss': 'mae', 'optimizer': 'adam', 'graph_mode': 'cutoff', 'cutoff': 0.8135206263074778, 'grm_norm': 'cosine_then_gcn', 'self_loops': False}. Best is trial 58 with value: 0.2528015272051901.
[I 2025-10-21 19:17:17,647] Trial 75 finished with value: 0.22994928598032777 and parameters: {'model_type': 'gat', 'hidden_dims': '[256, 128, 64]', 'dropout': 0.15399942952081486, 'batch_norm': False, 'gat_heads': 4, 'gat_attn_dropout': 0.10706191814722121, 'gat_concat_hidden': True, 'lr': 0.000447905733005349, 'weight_decay': 3.075525646186918e-07, 'epochs': 325, 'loss': 'mae', 'optimizer': 'adam', 'graph_mode': 'cutoff', 'cutoff': 0.8085688030853917, 'grm_norm': 'cosine_then_gcn', 'self_loops': False}. Best is trial 58 with value: 0.2528015272051901.
[I 2025-10-21 19:22:27,824] Trial 76 finished with value: 0.07163467179899738 and parameters: {'model_type': 'gat', 'hidden_dims': '[256, 128, 64]', 'dropout': 0.11732175142440397, 'batch_norm': False, 'gat_heads': 6, 'gat_attn_dropout': 0.16653932630467566, 'gat_concat_hidden': True, 'lr': 0.0007682770608661092, 'weight_decay': 5.403523043117508e-07, 'epochs': 342, 'loss': 'mse', 'optimizer': 'adam', 'graph_mode': 'cutoff', 'cutoff': 0.7369207983459637, 'grm_norm': 'cosine_then_gcn', 'self_loops': False}. Best is trial 58 with value: 0.2528015272051901.
[I 2025-10-21 19:24:59,824] Trial 77 finished with value: 0.2131123235253282 and parameters: {'model_type': 'gat', 'hidden_dims': '[128, 64]', 'dropout': 0.1410353680317558, 'batch_norm': False, 'gat_heads': 5, 'gat_attn_dropout': 0.2127972673338177, 'gat_concat_hidden': True, 'lr': 0.00028051487297535974, 'weight_decay': 2.0067482531410977e-07, 'epochs': 349, 'loss': 'mae', 'optimizer': 'adam', 'graph_mode': 'cutoff', 'cutoff': 0.5715786683379724, 'grm_norm': 'cosine_then_gcn', 'self_loops': False}. Best is trial 58 with value: 0.2528015272051901.
[I 2025-10-21 19:34:18,214] Trial 78 finished with value: 0.2332600459335988 and parameters: {'model_type': 'gat', 'hidden_dims': '[512, 128]', 'dropout': 0.5219245190395486, 'batch_norm': False, 'gat_heads': 6, 'gat_attn_dropout': 0.2903893794601473, 'gat_concat_hidden': False, 'lr': 0.00038071840306563794, 'weight_decay': 3.3728334952052534e-07, 'epochs': 320, 'loss': 'mae', 'optimizer': 'adam', 'graph_mode': 'cutoff', 'cutoff': 0.8323785235756491, 'grm_norm': 'cosine_then_gcn', 'self_loops': False}. Best is trial 58 with value: 0.2528015272051901.
[I 2025-10-21 19:38:05,407] Trial 79 finished with value: 0.1299190888027007 and parameters: {'model_type': 'gat', 'hidden_dims': '[256, 128, 64]', 'dropout': 0.1779674329601802, 'batch_norm': False, 'gat_heads': 5, 'gat_attn_dropout': 0.15194125244067389, 'gat_concat_hidden': True, 'lr': 0.000890292299372163, 'weight_decay': 2.942355433184019e-06, 'epochs': 246, 'loss': 'mae', 'optimizer': 'adam', 'graph_mode': 'knn', 'source': 'grm', 'knn_k': 10, 'weighted_edges': False, 'symmetrize_mode': 'union'}. Best is trial 58 with value: 0.2528015272051901.
[I 2025-10-21 19:42:17,934] Trial 80 finished with value: 0.2580957196313811 and parameters: {'model_type': 'gat', 'hidden_dims': '[256, 128, 64]', 'dropout': 0.12965783455616706, 'batch_norm': False, 'gat_heads': 6, 'gat_attn_dropout': 0.11243169263904247, 'gat_concat_hidden': True, 'lr': 0.0006640874428111103, 'weight_decay': 8.759662391361056e-07, 'epochs': 276, 'loss': 'mae', 'optimizer': 'adam', 'graph_mode': 'cutoff', 'cutoff': 0.8668851608042409, 'grm_norm': 'none', 'self_loops': False}. Best is trial 80 with value: 0.2580957196313811.
[I 2025-10-21 19:46:30,174] Trial 81 finished with value: 0.23686074911296867 and parameters: {'model_type': 'gat', 'hidden_dims': '[256, 128, 64]', 'dropout': 0.12958524309942537, 'batch_norm': False, 'gat_heads': 6, 'gat_attn_dropout': 0.09806455836344222, 'gat_concat_hidden': True, 'lr': 0.0009938649790305666, 'weight_decay': 9.61887111142537e-07, 'epochs': 276, 'loss': 'mae', 'optimizer': 'adam', 'graph_mode': 'cutoff', 'cutoff': 0.8675990660920373, 'grm_norm': 'none', 'self_loops': False}. Best is trial 80 with value: 0.2580957196313811.
[I 2025-10-21 19:51:33,298] Trial 82 finished with value: 0.2431578720424849 and parameters: {'model_type': 'gat', 'hidden_dims': '[256, 128, 64]', 'dropout': 0.11614756066805802, 'batch_norm': False, 'gat_heads': 6, 'gat_attn_dropout': 0.19906905964329946, 'gat_concat_hidden': True, 'lr': 0.0006438311804040236, 'weight_decay': 5.242196540988547e-07, 'epochs': 333, 'loss': 'mae', 'optimizer': 'adam', 'graph_mode': 'cutoff', 'cutoff': 0.8149287255222042, 'grm_norm': 'none', 'self_loops': False}. Best is trial 80 with value: 0.2580957196313811.
[I 2025-10-21 19:56:34,650] Trial 83 finished with value: 0.269018692899834 and parameters: {'model_type': 'gat', 'hidden_dims': '[256, 128, 64]', 'dropout': 0.11234179807643892, 'batch_norm': False, 'gat_heads': 6, 'gat_attn_dropout': 0.12866785129724845, 'gat_concat_hidden': True, 'lr': 0.0006787457316685406, 'weight_decay': 2.587554317728519e-07, 'epochs': 330, 'loss': 'mae', 'optimizer': 'adam', 'graph_mode': 'cutoff', 'cutoff': 0.8003454579958532, 'grm_norm': 'none', 'self_loops': False}. Best is trial 83 with value: 0.269018692899834.
[I 2025-10-21 20:01:37,660] Trial 84 finished with value: 0.23149034358428272 and parameters: {'model_type': 'gat', 'hidden_dims': '[256, 128, 64]', 'dropout': 0.1119915441927525, 'batch_norm': False, 'gat_heads': 6, 'gat_attn_dropout': 0.15072188848063095, 'gat_concat_hidden': True, 'lr': 0.0006098337527302019, 'weight_decay': 1.2478390011653557e-06, 'epochs': 332, 'loss': 'mae', 'optimizer': 'adam', 'graph_mode': 'cutoff', 'cutoff': 0.8079389630456729, 'grm_norm': 'none', 'self_loops': False}. Best is trial 83 with value: 0.269018692899834.
[I 2025-10-21 20:06:21,266] Trial 85 finished with value: 0.2398925681879886 and parameters: {'model_type': 'gat', 'hidden_dims': '[256, 128, 64]', 'dropout': 0.15625364269597608, 'batch_norm': False, 'gat_heads': 6, 'gat_attn_dropout': 0.12979629907004891, 'gat_concat_hidden': True, 'lr': 0.0004885493504614675, 'weight_decay': 3.731602920777048e-07, 'epochs': 309, 'loss': 'mae', 'optimizer': 'adam', 'graph_mode': 'cutoff', 'cutoff': 0.7816173155529342, 'grm_norm': 'none', 'self_loops': False}. Best is trial 83 with value: 0.269018692899834.
[I 2025-10-21 20:11:27,840] Trial 86 finished with value: 0.2481501233368229 and parameters: {'model_type': 'gat', 'hidden_dims': '[256, 128, 64]', 'dropout': 0.1309833401294693, 'batch_norm': False, 'gat_heads': 6, 'gat_attn_dropout': 0.19787290356765375, 'gat_concat_hidden': True, 'lr': 0.0006671595795905331, 'weight_decay': 7.794088618624489e-07, 'epochs': 337, 'loss': 'mae', 'optimizer': 'adam', 'graph_mode': 'cutoff', 'cutoff': 0.816510907296709, 'grm_norm': 'none', 'self_loops': False}. Best is trial 83 with value: 0.269018692899834.
[I 2025-10-21 20:16:43,291] Trial 87 finished with value: 0.21230310095025368 and parameters: {'model_type': 'gat', 'hidden_dims': '[256, 128]', 'dropout': 0.13324906562472874, 'batch_norm': False, 'gat_heads': 6, 'gat_attn_dropout': 0.19853167313599496, 'gat_concat_hidden': True, 'lr': 0.0007155589075981622, 'weight_decay': 7.234357410338866e-07, 'epochs': 339, 'loss': 'mae', 'optimizer': 'adam', 'graph_mode': 'cutoff', 'cutoff': 0.35485897206921246, 'grm_norm': 'none', 'self_loops': False}. Best is trial 83 with value: 0.269018692899834.
[I 2025-10-21 20:26:04,270] Trial 88 finished with value: 0.2485986949201437 and parameters: {'model_type': 'gat', 'hidden_dims': '[512, 64]', 'dropout': 0.14951702676458656, 'batch_norm': False, 'gat_heads': 6, 'gat_attn_dropout': 0.08917052804576316, 'gat_concat_hidden': True, 'lr': 0.0004887845847780192, 'weight_decay': 0.00038904184663254485, 'epochs': 317, 'loss': 'mae', 'optimizer': 'adam', 'graph_mode': 'cutoff', 'cutoff': 0.8463832787297949, 'grm_norm': 'none', 'self_loops': False}. Best is trial 83 with value: 0.269018692899834.
[I 2025-10-21 20:35:20,991] Trial 89 finished with value: 0.2177297081330038 and parameters: {'model_type': 'gat', 'hidden_dims': '[512, 64]', 'dropout': 0.18793896806049942, 'batch_norm': False, 'gat_heads': 6, 'gat_attn_dropout': 0.08095435268830925, 'gat_concat_hidden': True, 'lr': 0.0004826103512092402, 'weight_decay': 0.00014751340274070447, 'epochs': 315, 'loss': 'mse', 'optimizer': 'adam', 'graph_mode': 'cutoff', 'cutoff': 0.8501389676270181, 'grm_norm': 'none', 'self_loops': False}. Best is trial 83 with value: 0.269018692899834.
[I 2025-10-21 20:43:52,692] Trial 90 finished with value: 0.24038293916889217 and parameters: {'model_type': 'gat', 'hidden_dims': '[512, 64]', 'dropout': 0.16813708517281734, 'batch_norm': False, 'gat_heads': 6, 'gat_attn_dropout': 0.045156483401690525, 'gat_concat_hidden': True, 'lr': 0.00034931518436837175, 'weight_decay': 0.0005365725379676357, 'epochs': 287, 'loss': 'mae', 'optimizer': 'adam', 'graph_mode': 'cutoff', 'cutoff': 0.7477303175602438, 'grm_norm': 'none', 'self_loops': False}. Best is trial 83 with value: 0.269018692899834.
[I 2025-10-21 20:54:08,520] Trial 91 finished with value: 0.24800813949019265 and parameters: {'model_type': 'gat', 'hidden_dims': '[512, 64]', 'dropout': 0.14638682272465553, 'batch_norm': False, 'gat_heads': 6, 'gat_attn_dropout': 0.22596660553450748, 'gat_concat_hidden': True, 'lr': 0.0006269176419947874, 'weight_decay': 0.000314548186787007, 'epochs': 349, 'loss': 'mae', 'optimizer': 'adam', 'graph_mode': 'cutoff', 'cutoff': 0.7926953237793243, 'grm_norm': 'none', 'self_loops': False}. Best is trial 83 with value: 0.269018692899834.
[I 2025-10-21 21:03:37,326] Trial 92 finished with value: 0.2366972042898122 and parameters: {'model_type': 'gat', 'hidden_dims': '[512, 64]', 'dropout': 0.14751155287896292, 'batch_norm': False, 'gat_heads': 6, 'gat_attn_dropout': 0.0033283496475035425, 'gat_concat_hidden': True, 'lr': 0.0005103570757350516, 'weight_decay': 0.0005708092010395737, 'epochs': 321, 'loss': 'mae', 'optimizer': 'adam', 'graph_mode': 'cutoff', 'cutoff': 0.7891388902932049, 'grm_norm': 'none', 'self_loops': False}. Best is trial 83 with value: 0.269018692899834.
[I 2025-10-21 21:13:40,059] Trial 93 finished with value: 0.2462554934795651 and parameters: {'model_type': 'gat', 'hidden_dims': '[512, 64]', 'dropout': 0.12625084853548796, 'batch_norm': False, 'gat_heads': 6, 'gat_attn_dropout': 0.22835144086493422, 'gat_concat_hidden': True, 'lr': 0.0004240406877520315, 'weight_decay': 0.00035597965008528517, 'epochs': 341, 'loss': 'mae', 'optimizer': 'adam', 'graph_mode': 'cutoff', 'cutoff': 0.8636270652197557, 'grm_norm': 'none', 'self_loops': False}. Best is trial 83 with value: 0.269018692899834.
[I 2025-10-21 21:23:44,638] Trial 94 finished with value: 0.24062765495507604 and parameters: {'model_type': 'gat', 'hidden_dims': '[512, 64]', 'dropout': 0.12774950470518212, 'batch_norm': False, 'gat_heads': 6, 'gat_attn_dropout': 0.23160122465732166, 'gat_concat_hidden': True, 'lr': 0.0003950035204357245, 'weight_decay': 0.0003899629474378004, 'epochs': 344, 'loss': 'mae', 'optimizer': 'adam', 'graph_mode': 'cutoff', 'cutoff': 0.8715412185113909, 'grm_norm': 'none', 'self_loops': False}. Best is trial 83 with value: 0.269018692899834.
[I 2025-10-21 21:33:45,706] Trial 95 finished with value: 0.22126668541507927 and parameters: {'model_type': 'gat', 'hidden_dims': '[512, 64]', 'dropout': 0.13495124943145734, 'batch_norm': False, 'gat_heads': 6, 'gat_attn_dropout': 0.17682128519995916, 'gat_concat_hidden': True, 'lr': 6.53276542306643e-06, 'weight_decay': 0.00022185697802526002, 'epochs': 337, 'loss': 'mae', 'optimizer': 'adam', 'graph_mode': 'cutoff', 'cutoff': 0.7136757565860374, 'grm_norm': 'none', 'self_loops': False}. Best is trial 83 with value: 0.269018692899834.
[I 2025-10-21 21:43:46,910] Trial 96 finished with value: 0.20462956501146595 and parameters: {'model_type': 'gat', 'hidden_dims': '[512, 64]', 'dropout': 0.14588708751798354, 'batch_norm': False, 'gat_heads': 6, 'gat_attn_dropout': 0.11793705653702438, 'gat_concat_hidden': False, 'lr': 0.0006969852691540406, 'weight_decay': 0.0008107908477405639, 'epochs': 344, 'loss': 'mae', 'optimizer': 'adam', 'graph_mode': 'cutoff', 'cutoff': 0.8596947031149973, 'grm_norm': 'none', 'self_loops': False}. Best is trial 83 with value: 0.269018692899834.
[I 2025-10-21 21:53:06,230] Trial 97 finished with value: 0.23959593762998024 and parameters: {'model_type': 'gat', 'hidden_dims': '[512, 64]', 'dropout': 0.10090762799379023, 'batch_norm': False, 'gat_heads': 6, 'gat_attn_dropout': 0.08891203949884285, 'gat_concat_hidden': True, 'lr': 0.00024338725242012326, 'weight_decay': 0.00024076589567729933, 'epochs': 315, 'loss': 'mae', 'optimizer': 'adam', 'graph_mode': 'cutoff', 'cutoff': 0.7707361610207625, 'grm_norm': 'none', 'self_loops': False}. Best is trial 83 with value: 0.269018692899834.
