[I 2025-11-03 14:20:44,940] Trial 133 finished with value: 0.16360231489321822 and parameters: {'model_type': 'gcn', 'hidden_dims': '[512, 256]', 'dropout': 0.1413362893117464, 'batch_norm': True, 'lr': 0.0003955084950288455, 'weight_decay': 0.0001710180372421828, 'epochs': 246, 'loss': 'mae', 'optimizer': 'adam', 'graph_mode': 'knn', 'source': 'grm', 'knn_k': 1, 'weighted_edges': True, 'symmetrize_mode': 'union', 'use_snp_selection': False}. Best is trial 93 with value: 0.18608032209567513.
[I 2025-11-03 14:20:47,186] Trial 134 finished with value: 0.1451202267105443 and parameters: {'model_type': 'gcn', 'hidden_dims': '[128, 64]', 'dropout': 0.17539551654215646, 'batch_norm': True, 'lr': 0.0005548269395556748, 'weight_decay': 0.000356177800033377, 'epochs': 258, 'loss': 'mae', 'optimizer': 'adam', 'graph_mode': 'knn', 'source': 'grm', 'knn_k': 1, 'weighted_edges': True, 'symmetrize_mode': 'union', 'use_snp_selection': False}. Best is trial 93 with value: 0.18608032209567513.
[I 2025-11-03 14:20:51,697] Trial 135 finished with value: 0.13581787086146407 and parameters: {'model_type': 'gcn', 'hidden_dims': '[512, 256]', 'dropout': 0.16189630773823013, 'batch_norm': True, 'lr': 0.0004989429028419243, 'weight_decay': 0.0004955082670750767, 'epochs': 262, 'loss': 'mae', 'optimizer': 'adam', 'graph_mode': 'knn', 'source': 'grm', 'knn_k': 2, 'weighted_edges': True, 'symmetrize_mode': 'union', 'use_snp_selection': False}. Best is trial 93 with value: 0.18608032209567513.
[I 2025-11-03 14:20:54,623] Trial 136 finished with value: 0.08975835954378915 and parameters: {'model_type': 'gcn', 'hidden_dims': '[256, 128]', 'dropout': 0.1836534514902149, 'batch_norm': True, 'lr': 0.0006126715500522305, 'weight_decay': 0.00021016817214886398, 'epochs': 251, 'loss': 'mae', 'optimizer': 'adam', 'graph_mode': 'knn', 'source': 'grm', 'knn_k': 1, 'weighted_edges': False, 'symmetrize_mode': 'union', 'use_snp_selection': False}. Best is trial 93 with value: 0.18608032209567513.
[I 2025-11-03 14:20:59,486] Trial 137 finished with value: 0.1529523032811148 and parameters: {'model_type': 'gcn', 'hidden_dims': '[512, 256]', 'dropout': 0.21488384400579413, 'batch_norm': True, 'lr': 0.0007117256017578566, 'weight_decay': 0.0002660847566886962, 'epochs': 292, 'loss': 'mae', 'optimizer': 'adam', 'graph_mode': 'knn', 'source': 'grm', 'knn_k': 1, 'weighted_edges': True, 'symmetrize_mode': 'union', 'use_snp_selection': False}. Best is trial 93 with value: 0.18608032209567513.
[I 2025-11-03 14:21:03,693] Trial 138 finished with value: 0.16647875476283705 and parameters: {'model_type': 'gcn', 'hidden_dims': '[512, 256]', 'dropout': 0.23406013218942653, 'batch_norm': True, 'lr': 0.00038537685014225254, 'weight_decay': 2.2296992616630239e-07, 'epochs': 239, 'loss': 'mae', 'optimizer': 'adam', 'graph_mode': 'knn', 'source': 'grm', 'knn_k': 1, 'weighted_edges': True, 'symmetrize_mode': 'union', 'use_snp_selection': False}. Best is trial 93 with value: 0.18608032209567513.
[I 2025-11-03 14:21:08,240] Trial 139 finished with value: 0.180583949992719 and parameters: {'model_type': 'gcn', 'hidden_dims': '[512, 256]', 'dropout': 0.34888153178122655, 'batch_norm': True, 'lr': 0.0008857404635633198, 'weight_decay': 6.234812268958796e-05, 'epochs': 267, 'loss': 'mae', 'optimizer': 'adam', 'graph_mode': 'knn', 'source': 'grm', 'knn_k': 1, 'weighted_edges': True, 'symmetrize_mode': 'union', 'use_snp_selection': False}. Best is trial 93 with value: 0.18608032209567513.
[I 2025-11-03 14:21:12,858] Trial 140 finished with value: 0.17012073156208085 and parameters: {'model_type': 'gcn', 'hidden_dims': '[512, 256]', 'dropout': 0.1974729463586646, 'batch_norm': True, 'lr': 0.0009168581160034903, 'weight_decay': 5.861365721123382e-05, 'epochs': 267, 'loss': 'mae', 'optimizer': 'adam', 'graph_mode': 'knn', 'source': 'grm', 'knn_k': 1, 'weighted_edges': True, 'symmetrize_mode': 'union', 'use_snp_selection': False}. Best is trial 93 with value: 0.18608032209567513.
[I 2025-11-03 14:21:17,342] Trial 141 finished with value: 0.15984453327258633 and parameters: {'model_type': 'gcn', 'hidden_dims': '[512, 256]', 'dropout': 0.37405087399038794, 'batch_norm': True, 'lr': 0.0006702778456206386, 'weight_decay': 4.091047378636437e-05, 'epochs': 254, 'loss': 'mae', 'optimizer': 'adam', 'graph_mode': 'knn', 'source': 'grm', 'knn_k': 1, 'weighted_edges': True, 'symmetrize_mode': 'union', 'use_snp_selection': False}. Best is trial 93 with value: 0.18608032209567513.
[I 2025-11-03 14:21:22,206] Trial 142 finished with value: 0.18053613447161157 and parameters: {'model_type': 'gcn', 'hidden_dims': '[512, 256]', 'dropout': 0.24639105700148203, 'batch_norm': True, 'lr': 0.0008108336163744885, 'weight_decay': 9.856530573767468e-05, 'epochs': 289, 'loss': 'mae', 'optimizer': 'adam', 'graph_mode': 'knn', 'source': 'grm', 'knn_k': 1, 'weighted_edges': True, 'symmetrize_mode': 'union', 'use_snp_selection': False}. Best is trial 93 with value: 0.18608032209567513.
[I 2025-11-03 14:21:27,035] Trial 143 finished with value: 0.17609839635918118 and parameters: {'model_type': 'gcn', 'hidden_dims': '[512, 256]', 'dropout': 0.25182441317536164, 'batch_norm': True, 'lr': 0.0008630823621007659, 'weight_decay': 0.00010554032413546265, 'epochs': 287, 'loss': 'mae', 'optimizer': 'adam', 'graph_mode': 'knn', 'source': 'grm', 'knn_k': 1, 'weighted_edges': True, 'symmetrize_mode': 'union', 'use_snp_selection': False}. Best is trial 93 with value: 0.18608032209567513.
[I 2025-11-03 14:21:32,018] Trial 144 finished with value: 0.17370659624818247 and parameters: {'model_type': 'gcn', 'hidden_dims': '[512, 256]', 'dropout': 0.24902980727685825, 'batch_norm': True, 'lr': 0.000869358905624456, 'weight_decay': 8.969367810167102e-05, 'epochs': 299, 'loss': 'mae', 'optimizer': 'adam', 'graph_mode': 'knn', 'source': 'grm', 'knn_k': 1, 'weighted_edges': True, 'symmetrize_mode': 'union', 'use_snp_selection': False}. Best is trial 93 with value: 0.18608032209567513.
[I 2025-11-03 14:21:37,026] Trial 145 finished with value: 0.17880278715293088 and parameters: {'model_type': 'gcn', 'hidden_dims': '[512, 256]', 'dropout': 0.2518352921238001, 'batch_norm': True, 'lr': 0.0008697729132700014, 'weight_decay': 6.528742042938945e-05, 'epochs': 302, 'loss': 'mae', 'optimizer': 'adam', 'graph_mode': 'knn', 'source': 'grm', 'knn_k': 1, 'weighted_edges': True, 'symmetrize_mode': 'union', 'use_snp_selection': False}. Best is trial 93 with value: 0.18608032209567513.
[I 2025-11-03 14:21:41,886] Trial 146 finished with value: 0.1570394814908832 and parameters: {'model_type': 'gcn', 'hidden_dims': '[512, 64]', 'dropout': 0.27050081994939557, 'batch_norm': True, 'lr': 0.0007842780165063085, 'weight_decay': 6.0459308372028194e-05, 'epochs': 289, 'loss': 'mae', 'optimizer': 'adam', 'graph_mode': 'knn', 'source': 'grm', 'knn_k': 2, 'weighted_edges': True, 'symmetrize_mode': 'union', 'use_snp_selection': False}. Best is trial 93 with value: 0.18608032209567513.
[I 2025-11-03 14:21:46,969] Trial 147 finished with value: 0.1737171011899237 and parameters: {'model_type': 'gcn', 'hidden_dims': '[512, 256]', 'dropout': 0.24177276168175582, 'batch_norm': True, 'lr': 0.0009763611724892863, 'weight_decay': 9.416213697528991e-05, 'epochs': 309, 'loss': 'mae', 'optimizer': 'adam', 'graph_mode': 'knn', 'source': 'grm', 'knn_k': 1, 'weighted_edges': True, 'symmetrize_mode': 'union', 'use_snp_selection': False}. Best is trial 93 with value: 0.18608032209567513.
[I 2025-11-03 14:21:52,243] Trial 148 finished with value: 0.17714677283944424 and parameters: {'model_type': 'gcn', 'hidden_dims': '[512, 256]', 'dropout': 0.25299494053304994, 'batch_norm': True, 'lr': 0.000871403629741505, 'weight_decay': 7.651768788591122e-05, 'epochs': 324, 'loss': 'mae', 'optimizer': 'adam', 'graph_mode': 'knn', 'source': 'grm', 'knn_k': 1, 'weighted_edges': True, 'symmetrize_mode': 'union', 'use_snp_selection': False}. Best is trial 93 with value: 0.18608032209567513.
[I 2025-11-03 14:21:57,603] Trial 149 finished with value: 0.14442150329536904 and parameters: {'model_type': 'gcn', 'hidden_dims': '[512, 256]', 'dropout': 0.25929331471324096, 'batch_norm': True, 'lr': 0.0009948755501579228, 'weight_decay': 6.772438857322983e-05, 'epochs': 329, 'loss': 'mae', 'optimizer': 'adam', 'graph_mode': 'knn', 'source': 'grm', 'knn_k': 2, 'weighted_edges': True, 'symmetrize_mode': 'union', 'use_snp_selection': False}. Best is trial 93 with value: 0.18608032209567513.
[I 2025-11-03 14:21:59,711] Trial 0 finished with value: 0.0770088445723717 and parameters: {'model_type': 'gcn', 'hidden_dims': '[128, 64]', 'dropout': 0.199031432379812, 'batch_norm': True, 'lr': 1.8408544111075837e-06, 'weight_decay': 5.5136510071208614e-05, 'epochs': 334, 'loss': 'mae', 'optimizer': 'adam', 'graph_mode': 'knn', 'source': 'grm', 'knn_k': 8, 'weighted_edges': True, 'symmetrize_mode': 'mutual', 'use_snp_selection': False}. Best is trial 0 with value: 0.0770088445723717.
[I 2025-11-03 14:22:00,823] Trial 1 finished with value: 0.10908532125451803 and parameters: {'model_type': 'gcn', 'hidden_dims': '[128, 64]', 'dropout': 0.40051947670227217, 'batch_norm': True, 'lr': 0.0005320428882732732, 'weight_decay': 1.89210117736594e-06, 'epochs': 32, 'loss': 'mse', 'optimizer': 'adam', 'graph_mode': 'knn', 'source': 'grm', 'knn_k': 7, 'weighted_edges': True, 'symmetrize_mode': 'union', 'use_snp_selection': False}. Best is trial 1 with value: 0.10908532125451803.
[I 2025-11-03 14:22:03,172] Trial 2 finished with value: 0.09641263239735104 and parameters: {'model_type': 'gcn', 'hidden_dims': '[256, 128]', 'dropout': 0.5105528289184642, 'batch_norm': False, 'lr': 0.0006804279372404962, 'weight_decay': 0.0008922815224257085, 'epochs': 160, 'loss': 'mse', 'optimizer': 'adam', 'graph_mode': 'cutoff', 'cutoff': 0.5741905641612706, 'grm_norm': 'gcn', 'self_loops': False, 'use_snp_selection': True, 'num_snps': 26910}. Best is trial 1 with value: 0.10908532125451803.
[I 2025-11-03 14:22:05,543] Trial 3 finished with value: 0.08579189788806374 and parameters: {'model_type': 'gcn', 'hidden_dims': '[256, 128, 64]', 'dropout': 0.5390483213624292, 'batch_norm': False, 'lr': 3.4705625989073525e-05, 'weight_decay': 2.4623319020131338e-05, 'epochs': 92, 'loss': 'mse', 'optimizer': 'adam', 'graph_mode': 'knn', 'source': 'grm', 'knn_k': 6, 'weighted_edges': False, 'symmetrize_mode': 'mutual', 'use_snp_selection': True, 'num_snps': 30713}. Best is trial 1 with value: 0.10908532125451803.
[I 2025-11-03 14:22:07,934] Trial 4 finished with value: -0.017855326491287113 and parameters: {'model_type': 'gcn', 'hidden_dims': '[128, 64]', 'dropout': 0.13404863676897502, 'batch_norm': False, 'lr': 0.0001431556295367288, 'weight_decay': 2.2084517750726675e-05, 'epochs': 13, 'loss': 'mae', 'optimizer': 'adam', 'graph_mode': 'cutoff', 'cutoff': 0.6714268476993044, 'grm_norm': 'none', 'self_loops': False, 'use_snp_selection': True, 'num_snps': 45645}. Best is trial 1 with value: 0.10908532125451803.
[I 2025-11-03 14:22:10,856] Trial 5 finished with value: 0.08830015500446461 and parameters: {'model_type': 'gcn', 'hidden_dims': '[256, 128]', 'dropout': 0.42253606323412096, 'batch_norm': False, 'lr': 4.238630400638805e-05, 'weight_decay': 8.074086040046576e-07, 'epochs': 134, 'loss': 'mae', 'optimizer': 'adam', 'graph_mode': 'knn', 'source': 'grm', 'knn_k': 1, 'weighted_edges': False, 'symmetrize_mode': 'mutual', 'use_snp_selection': True, 'num_snps': 43113}. Best is trial 1 with value: 0.10908532125451803.
[I 2025-11-03 14:22:13,667] Trial 6 finished with value: 0.12023551332092001 and parameters: {'model_type': 'gcn', 'hidden_dims': '[512, 256]', 'dropout': 0.3534893146320237, 'batch_norm': True, 'lr': 0.000251307964226932, 'weight_decay': 1.821819791794022e-05, 'epochs': 207, 'loss': 'mae', 'optimizer': 'adam', 'graph_mode': 'knn', 'source': 'grm', 'knn_k': 1, 'weighted_edges': True, 'symmetrize_mode': 'mutual', 'use_snp_selection': False}. Best is trial 6 with value: 0.12023551332092001.
[I 2025-11-03 14:22:16,111] Trial 7 finished with value: 0.02104838615898546 and parameters: {'model_type': 'gcn', 'hidden_dims': '[512, 256]', 'dropout': 0.1105825955860775, 'batch_norm': True, 'lr': 2.374338412754043e-05, 'weight_decay': 1.1284721123340274e-05, 'epochs': 170, 'loss': 'mse', 'optimizer': 'adam', 'graph_mode': 'cutoff', 'cutoff': 0.719872204109604, 'grm_norm': 'gcn', 'self_loops': False, 'use_snp_selection': False}. Best is trial 6 with value: 0.12023551332092001.
[I 2025-11-03 14:22:17,998] Trial 8 finished with value: 0.08075388942642556 and parameters: {'model_type': 'gcn', 'hidden_dims': '[512, 128]', 'dropout': 0.5066580418354021, 'batch_norm': True, 'lr': 0.00039213678276659976, 'weight_decay': 3.43655320802934e-06, 'epochs': 91, 'loss': 'mse', 'optimizer': 'adam', 'graph_mode': 'cutoff', 'cutoff': 0.34923059576505366, 'grm_norm': 'cosine', 'self_loops': True, 'use_snp_selection': False}. Best is trial 6 with value: 0.12023551332092001.
[I 2025-11-03 14:22:19,789] Trial 9 finished with value: 0.09945637517399865 and parameters: {'model_type': 'gcn', 'hidden_dims': '[512, 256]', 'dropout': 0.301734920240333, 'batch_norm': False, 'lr': 6.650961854953448e-06, 'weight_decay': 6.861575656590315e-05, 'epochs': 125, 'loss': 'mae', 'optimizer': 'adam', 'graph_mode': 'cutoff', 'cutoff': 0.2857569870061939, 'grm_norm': 'cosine_then_gcn', 'self_loops': False, 'use_snp_selection': True, 'num_snps': 12722}. Best is trial 6 with value: 0.12023551332092001.
[I 2025-11-03 14:22:22,963] Trial 10 finished with value: 0.10945877938760736 and parameters: {'model_type': 'gcn', 'hidden_dims': '[512, 64]', 'dropout': 0.2833599465317005, 'batch_norm': True, 'lr': 0.00016916760584270694, 'weight_decay': 1.7866650996308468e-07, 'epochs': 266, 'loss': 'mae', 'optimizer': 'adam', 'graph_mode': 'knn', 'source': 'grm', 'knn_k': 1, 'weighted_edges': True, 'symmetrize_mode': 'union', 'use_snp_selection': False}. Best is trial 6 with value: 0.12023551332092001.
[I 2025-11-03 14:22:26,142] Trial 11 finished with value: 0.08384376086102922 and parameters: {'model_type': 'gcn', 'hidden_dims': '[512, 64]', 'dropout': 0.2859699507705008, 'batch_norm': True, 'lr': 0.00012623783700890367, 'weight_decay': 1.6805209943987688e-07, 'epochs': 265, 'loss': 'mae', 'optimizer': 'adam', 'graph_mode': 'knn', 'source': 'grm', 'knn_k': 1, 'weighted_edges': True, 'symmetrize_mode': 'union', 'use_snp_selection': False}. Best is trial 6 with value: 0.12023551332092001.
[I 2025-11-03 14:22:29,140] Trial 12 finished with value: 0.0832481315786405 and parameters: {'model_type': 'gcn', 'hidden_dims': '[512, 64]', 'dropout': 0.2516138819478735, 'batch_norm': True, 'lr': 0.00016473964335013254, 'weight_decay': 1.0888016761521717e-07, 'epochs': 241, 'loss': 'mae', 'optimizer': 'adam', 'graph_mode': 'knn', 'source': 'grm', 'knn_k': 3, 'weighted_edges': True, 'symmetrize_mode': 'union', 'use_snp_selection': False}. Best is trial 6 with value: 0.12023551332092001.
[I 2025-11-03 14:22:32,132] Trial 13 finished with value: 0.10979486968187774 and parameters: {'model_type': 'gcn', 'hidden_dims': '[512, 64]', 'dropout': 0.3597295172492356, 'batch_norm': True, 'lr': 7.689848153447392e-05, 'weight_decay': 0.000399947667615736, 'epochs': 239, 'loss': 'mae', 'optimizer': 'adam', 'graph_mode': 'knn', 'source': 'grm', 'knn_k': 4, 'weighted_edges': True, 'symmetrize_mode': 'mutual', 'use_snp_selection': False}. Best is trial 6 with value: 0.12023551332092001.
[I 2025-11-03 14:22:34,968] Trial 14 finished with value: 0.04189927705577258 and parameters: {'model_type': 'gcn', 'hidden_dims': '[512, 256]', 'dropout': 0.37558143462152954, 'batch_norm': True, 'lr': 1.2586985041154999e-05, 'weight_decay': 0.0006547799849767012, 'epochs': 216, 'loss': 'mae', 'optimizer': 'adam', 'graph_mode': 'knn', 'source': 'grm', 'knn_k': 4, 'weighted_edges': True, 'symmetrize_mode': 'mutual', 'use_snp_selection': False}. Best is trial 6 with value: 0.12023551332092001.
[I 2025-11-03 14:22:38,543] Trial 15 finished with value: 0.08546767452117578 and parameters: {'model_type': 'gcn', 'hidden_dims': '[512, 128]', 'dropout': 0.44099154398585816, 'batch_norm': True, 'lr': 7.092120321265845e-05, 'weight_decay': 0.00024733141729453437, 'epochs': 323, 'loss': 'mae', 'optimizer': 'adam', 'graph_mode': 'knn', 'source': 'grm', 'knn_k': 4, 'weighted_edges': True, 'symmetrize_mode': 'mutual', 'use_snp_selection': False}. Best is trial 6 with value: 0.12023551332092001.
[I 2025-11-03 14:22:40,850] Trial 16 finished with value: 0.10039909855963078 and parameters: {'model_type': 'gcn', 'hidden_dims': '[256, 128, 64]', 'dropout': 0.34568139268371517, 'batch_norm': True, 'lr': 0.0003130829346467753, 'weight_decay': 0.00016987098542991405, 'epochs': 213, 'loss': 'mae', 'optimizer': 'adam', 'graph_mode': 'knn', 'source': 'grm', 'knn_k': 10, 'weighted_edges': False, 'symmetrize_mode': 'mutual', 'use_snp_selection': False}. Best is trial 6 with value: 0.12023551332092001.
[I 2025-11-03 14:22:44,249] Trial 17 finished with value: 0.09754180643859708 and parameters: {'model_type': 'gcn', 'hidden_dims': '[512, 64]', 'dropout': 0.4663395208485065, 'batch_norm': True, 'lr': 6.670040555727496e-05, 'weight_decay': 0.00021747865886226228, 'epochs': 299, 'loss': 'mae', 'optimizer': 'adam', 'graph_mode': 'knn', 'source': 'grm', 'knn_k': 3, 'weighted_edges': True, 'symmetrize_mode': 'mutual', 'use_snp_selection': False}. Best is trial 6 with value: 0.12023551332092001.
[I 2025-11-03 14:22:46,960] Trial 18 finished with value: 0.12318528766360964 and parameters: {'model_type': 'gcn', 'hidden_dims': '[512, 256]', 'dropout': 0.34704036013644246, 'batch_norm': True, 'lr': 0.0009570488793843138, 'weight_decay': 4.249658628948637e-06, 'epochs': 200, 'loss': 'mae', 'optimizer': 'adam', 'graph_mode': 'knn', 'source': 'grm', 'knn_k': 3, 'weighted_edges': True, 'symmetrize_mode': 'mutual', 'use_snp_selection': False}. Best is trial 18 with value: 0.12318528766360964.
[I 2025-11-03 14:22:49,682] Trial 19 finished with value: 0.10824880000075732 and parameters: {'model_type': 'gcn', 'hidden_dims': '[512, 256]', 'dropout': 0.2162622402420996, 'batch_norm': True, 'lr': 0.0008312902749637316, 'weight_decay': 4.960555517004475e-06, 'epochs': 203, 'loss': 'mae', 'optimizer': 'adam', 'graph_mode': 'knn', 'source': 'grm', 'knn_k': 2, 'weighted_edges': True, 'symmetrize_mode': 'mutual', 'use_snp_selection': False}. Best is trial 18 with value: 0.12318528766360964.
[I 2025-11-03 14:22:53,012] Trial 20 finished with value: 0.1135621820995969 and parameters: {'model_type': 'gcn', 'hidden_dims': '[512, 256]', 'dropout': 0.5741974551696398, 'batch_norm': True, 'lr': 0.0009272590485878264, 'weight_decay': 9.591203210451866e-07, 'epochs': 287, 'loss': 'mae', 'optimizer': 'adam', 'graph_mode': 'knn', 'source': 'grm', 'knn_k': 3, 'weighted_edges': False, 'symmetrize_mode': 'mutual', 'use_snp_selection': False}. Best is trial 18 with value: 0.12318528766360964.
[I 2025-11-03 14:22:56,356] Trial 21 finished with value: 0.10327208246636999 and parameters: {'model_type': 'gcn', 'hidden_dims': '[512, 256]', 'dropout': 0.5999824909219363, 'batch_norm': True, 'lr': 0.0008897109488975974, 'weight_decay': 9.022011407250623e-07, 'epochs': 288, 'loss': 'mae', 'optimizer': 'adam', 'graph_mode': 'knn', 'source': 'grm', 'knn_k': 3, 'weighted_edges': False, 'symmetrize_mode': 'mutual', 'use_snp_selection': False}. Best is trial 18 with value: 0.12318528766360964.
[I 2025-11-03 14:22:58,990] Trial 22 finished with value: 0.12182707819537374 and parameters: {'model_type': 'gcn', 'hidden_dims': '[512, 256]', 'dropout': 0.5914537026815008, 'batch_norm': True, 'lr': 0.0003056021994573531, 'weight_decay': 4.647067040652062e-07, 'epochs': 191, 'loss': 'mae', 'optimizer': 'adam', 'graph_mode': 'knn', 'source': 'grm', 'knn_k': 2, 'weighted_edges': False, 'symmetrize_mode': 'mutual', 'use_snp_selection': False}. Best is trial 18 with value: 0.12318528766360964.
[I 2025-11-03 14:23:01,567] Trial 23 finished with value: 0.10994338191546603 and parameters: {'model_type': 'gcn', 'hidden_dims': '[512, 256]', 'dropout': 0.32335726946578397, 'batch_norm': True, 'lr': 0.0003787556106111673, 'weight_decay': 3.9567444656231715e-07, 'epochs': 182, 'loss': 'mae', 'optimizer': 'adam', 'graph_mode': 'knn', 'source': 'grm', 'knn_k': 2, 'weighted_edges': False, 'symmetrize_mode': 'mutual', 'use_snp_selection': False}. Best is trial 18 with value: 0.12318528766360964.
[I 2025-11-03 14:23:03,882] Trial 24 finished with value: 0.11136599705439136 and parameters: {'model_type': 'gcn', 'hidden_dims': '[512, 256]', 'dropout': 0.47896221650306264, 'batch_norm': True, 'lr': 0.00026363876789443154, 'weight_decay': 7.735675293958579e-06, 'epochs': 144, 'loss': 'mae', 'optimizer': 'adam', 'graph_mode': 'knn', 'source': 'grm', 'knn_k': 2, 'weighted_edges': False, 'symmetrize_mode': 'mutual', 'use_snp_selection': False}. Best is trial 18 with value: 0.12318528766360964.
[I 2025-11-03 14:23:06,520] Trial 25 finished with value: 0.093184754359023 and parameters: {'model_type': 'gcn', 'hidden_dims': '[512, 256]', 'dropout': 0.16565624396296894, 'batch_norm': True, 'lr': 0.0002101805805633584, 'weight_decay': 2.460214850366808e-06, 'epochs': 188, 'loss': 'mae', 'optimizer': 'adam', 'graph_mode': 'knn', 'source': 'grm', 'knn_k': 5, 'weighted_edges': True, 'symmetrize_mode': 'mutual', 'use_snp_selection': False}. Best is trial 18 with value: 0.12318528766360964.
[I 2025-11-03 14:23:10,205] Trial 26 finished with value: 0.09678096490123138 and parameters: {'model_type': 'gcn', 'hidden_dims': '[512, 256]', 'dropout': 0.3936169437832813, 'batch_norm': False, 'lr': 0.00046808688432873995, 'weight_decay': 1.4078283087439993e-05, 'epochs': 99, 'loss': 'mae', 'optimizer': 'adam', 'graph_mode': 'knn', 'source': 'grm', 'knn_k': 1, 'weighted_edges': False, 'symmetrize_mode': 'mutual', 'use_snp_selection': True, 'num_snps': 59005}. Best is trial 18 with value: 0.12318528766360964.
