[I 2025-11-03 12:07:48,665] Trial 25 finished with value: 0.11144647946491101 and parameters: {'model_type': 'gcn', 'hidden_dims': '[256, 128, 64]', 'dropout': 0.46647548875795697, 'batch_norm': True, 'lr': 0.0009909648903260607, 'weight_decay': 4.362751111565519e-06, 'epochs': 173, 'loss': 'mse', 'optimizer': 'adam', 'graph_mode': 'off', 'use_snp_selection': False}. Best is trial 22 with value: 0.13056895679760083.
[I 2025-11-03 12:07:49,645] Trial 26 finished with value: 0.0684833819450837 and parameters: {'model_type': 'gcn', 'hidden_dims': '[256, 128]', 'dropout': 0.2251782947987844, 'batch_norm': False, 'lr': 0.0004114530898396363, 'weight_decay': 2.7268132558702736e-07, 'epochs': 212, 'loss': 'mse', 'optimizer': 'adam', 'graph_mode': 'off', 'use_snp_selection': True, 'num_snps': 3842}. Best is trial 22 with value: 0.13056895679760083.
[I 2025-11-03 12:07:50,969] Trial 27 finished with value: 0.12619084627173946 and parameters: {'model_type': 'gcn', 'hidden_dims': '[128, 64]', 'dropout': 0.36280497806298656, 'batch_norm': True, 'lr': 0.00014326178348741427, 'weight_decay': 1.4619698090126775e-06, 'epochs': 282, 'loss': 'mse', 'optimizer': 'adam', 'graph_mode': 'off', 'use_snp_selection': False}. Best is trial 22 with value: 0.13056895679760083.
[I 2025-11-03 12:07:52,310] Trial 28 finished with value: 0.08270933028178437 and parameters: {'model_type': 'gcn', 'hidden_dims': '[128, 64]', 'dropout': 0.5111885248982433, 'batch_norm': True, 'lr': 0.00015842248605227208, 'weight_decay': 1.1654277058217453e-06, 'epochs': 289, 'loss': 'mse', 'optimizer': 'adam', 'graph_mode': 'off', 'use_snp_selection': False}. Best is trial 22 with value: 0.13056895679760083.
[I 2025-11-03 12:07:53,960] Trial 29 finished with value: 0.10361341368506512 and parameters: {'model_type': 'gcn', 'hidden_dims': '[128, 64]', 'dropout': 0.366287259660544, 'batch_norm': True, 'lr': 0.0003095638794828344, 'weight_decay': 5.522710335772491e-05, 'epochs': 333, 'loss': 'mse', 'optimizer': 'adam', 'graph_mode': 'off', 'use_snp_selection': True, 'num_snps': 19468}. Best is trial 22 with value: 0.13056895679760083.
[I 2025-11-03 12:07:55,284] Trial 30 finished with value: 0.040693664967217734 and parameters: {'model_type': 'gcn', 'hidden_dims': '[128, 64]', 'dropout': 0.46851057567257853, 'batch_norm': True, 'lr': 3.335129492651277e-05, 'weight_decay': 1.9521309348584096e-06, 'epochs': 267, 'loss': 'mse', 'optimizer': 'adam', 'graph_mode': 'off', 'use_snp_selection': False}. Best is trial 22 with value: 0.13056895679760083.
[I 2025-11-03 12:07:56,838] Trial 31 finished with value: 0.12000295471621228 and parameters: {'model_type': 'gcn', 'hidden_dims': '[128, 64]', 'dropout': 0.285245900890249, 'batch_norm': True, 'lr': 0.000522781847773906, 'weight_decay': 1.6368032972523567e-07, 'epochs': 350, 'loss': 'mse', 'optimizer': 'adam', 'graph_mode': 'off', 'use_snp_selection': False}. Best is trial 22 with value: 0.13056895679760083.
[I 2025-11-03 12:07:59,191] Trial 32 finished with value: 0.12607798951026095 and parameters: {'model_type': 'gcn', 'hidden_dims': '[512, 256]', 'dropout': 0.3517498189316824, 'batch_norm': True, 'lr': 0.00011206239886549398, 'weight_decay': 4.939947386195719e-07, 'epochs': 244, 'loss': 'mse', 'optimizer': 'adam', 'graph_mode': 'off', 'use_snp_selection': False}. Best is trial 22 with value: 0.13056895679760083.
[I 2025-11-03 12:08:01,559] Trial 33 finished with value: 0.10301605730843391 and parameters: {'model_type': 'gcn', 'hidden_dims': '[512, 256]', 'dropout': 0.41895037109598326, 'batch_norm': True, 'lr': 9.959887326613564e-05, 'weight_decay': 5.40807309746305e-07, 'epochs': 244, 'loss': 'mse', 'optimizer': 'adam', 'graph_mode': 'off', 'use_snp_selection': False}. Best is trial 22 with value: 0.13056895679760083.
[I 2025-11-03 12:08:04,359] Trial 34 finished with value: 0.10707863906203857 and parameters: {'model_type': 'gcn', 'hidden_dims': '[512, 256]', 'dropout': 0.34512798379371434, 'batch_norm': True, 'lr': 0.00010399414159968489, 'weight_decay': 7.052442274042556e-06, 'epochs': 309, 'loss': 'mae', 'optimizer': 'adam', 'graph_mode': 'off', 'use_snp_selection': False}. Best is trial 22 with value: 0.13056895679760083.
[I 2025-11-03 12:08:06,927] Trial 35 finished with value: 0.09177560634806314 and parameters: {'model_type': 'gcn', 'hidden_dims': '[512, 256]', 'dropout': 0.4544759458916864, 'batch_norm': False, 'lr': 0.0002886937061596462, 'weight_decay': 1.8999339336583308e-07, 'epochs': 288, 'loss': 'mse', 'optimizer': 'adam', 'graph_mode': 'off', 'use_snp_selection': False}. Best is trial 22 with value: 0.13056895679760083.
[I 2025-11-03 12:08:09,242] Trial 36 finished with value: 0.04963607422709648 and parameters: {'model_type': 'gcn', 'hidden_dims': '[256, 128]', 'dropout': 0.37424602162998943, 'batch_norm': True, 'lr': 1.0293821538494041e-05, 'weight_decay': 3.6855106276401566e-07, 'epochs': 162, 'loss': 'mse', 'optimizer': 'adam', 'graph_mode': 'off', 'use_snp_selection': True, 'num_snps': 58661}. Best is trial 22 with value: 0.13056895679760083.
[I 2025-11-03 12:08:11,309] Trial 37 finished with value: 0.10954540222464973 and parameters: {'model_type': 'gcn', 'hidden_dims': '[512, 64]', 'dropout': 0.5891237523734363, 'batch_norm': True, 'lr': 0.0001638048113388752, 'weight_decay': 9.096918760018813e-05, 'epochs': 204, 'loss': 'mae', 'optimizer': 'adam', 'graph_mode': 'off', 'use_snp_selection': False}. Best is trial 22 with value: 0.13056895679760083.
[I 2025-11-03 12:08:12,631] Trial 38 finished with value: 0.07082443631038018 and parameters: {'model_type': 'gcn', 'hidden_dims': '[128, 64]', 'dropout': 0.40769753989865265, 'batch_norm': False, 'lr': 3.230624853870608e-05, 'weight_decay': 8.690010260050824e-07, 'epochs': 246, 'loss': 'mse', 'optimizer': 'adam', 'graph_mode': 'off', 'use_snp_selection': True, 'num_snps': 19911}. Best is trial 22 with value: 0.13056895679760083.
[I 2025-11-03 12:08:14,196] Trial 39 finished with value: 0.11798521171450364 and parameters: {'model_type': 'gcn', 'hidden_dims': '[512, 256]', 'dropout': 0.35410398335707416, 'batch_norm': True, 'lr': 7.626503591642207e-05, 'weight_decay': 9.893072593663585e-06, 'epochs': 121, 'loss': 'mse', 'optimizer': 'adam', 'graph_mode': 'off', 'use_snp_selection': False}. Best is trial 22 with value: 0.13056895679760083.
[I 2025-11-03 12:08:16,192] Trial 40 finished with value: 0.018454980558668004 and parameters: {'model_type': 'gcn', 'hidden_dims': '[512, 256]', 'dropout': 0.2992697619608661, 'batch_norm': True, 'lr': 4.767147905519569e-06, 'weight_decay': 4.716013477659408e-07, 'epochs': 188, 'loss': 'mae', 'optimizer': 'adam', 'graph_mode': 'off', 'use_snp_selection': False}. Best is trial 22 with value: 0.13056895679760083.
[I 2025-11-03 12:08:18,475] Trial 41 finished with value: 0.10948754870673963 and parameters: {'model_type': 'gcn', 'hidden_dims': '[512, 128]', 'dropout': 0.26142199679586786, 'batch_norm': True, 'lr': 0.0006453546905440179, 'weight_decay': 2.2276218625147583e-07, 'epochs': 235, 'loss': 'mse', 'optimizer': 'adam', 'graph_mode': 'off', 'use_snp_selection': False}. Best is trial 22 with value: 0.13056895679760083.
[I 2025-11-03 12:08:20,517] Trial 42 finished with value: 0.10163719045054101 and parameters: {'model_type': 'gcn', 'hidden_dims': '[256, 128, 64]', 'dropout': 0.2137922611245816, 'batch_norm': True, 'lr': 0.0003903733102844566, 'weight_decay': 1.0311664796229527e-07, 'epochs': 273, 'loss': 'mse', 'optimizer': 'adam', 'graph_mode': 'off', 'use_snp_selection': False}. Best is trial 22 with value: 0.13056895679760083.
[I 2025-11-03 12:08:22,897] Trial 43 finished with value: 0.04075005317350438 and parameters: {'model_type': 'gcn', 'hidden_dims': '[512, 128]', 'dropout': 0.2600837130968256, 'batch_norm': True, 'lr': 2.1409924724993155e-06, 'weight_decay': 1.561885788225231e-07, 'epochs': 251, 'loss': 'mse', 'optimizer': 'adam', 'graph_mode': 'off', 'use_snp_selection': False}. Best is trial 22 with value: 0.13056895679760083.
[I 2025-11-03 12:08:24,176] Trial 44 finished with value: 0.1174656080377263 and parameters: {'model_type': 'gcn', 'hidden_dims': '[512, 64]', 'dropout': 0.14346230354025352, 'batch_norm': True, 'lr': 0.0005660288415447848, 'weight_decay': 3.169426942527653e-07, 'epochs': 67, 'loss': 'mse', 'optimizer': 'adam', 'graph_mode': 'off', 'use_snp_selection': False}. Best is trial 22 with value: 0.13056895679760083.
[I 2025-11-03 12:08:26,440] Trial 45 finished with value: 0.11421115780487485 and parameters: {'model_type': 'gcn', 'hidden_dims': '[512, 128]', 'dropout': 0.12742662304268138, 'batch_norm': True, 'lr': 0.0008145010588157829, 'weight_decay': 8.082780141559134e-07, 'epochs': 233, 'loss': 'mse', 'optimizer': 'adam', 'graph_mode': 'off', 'use_snp_selection': False}. Best is trial 22 with value: 0.13056895679760083.
[I 2025-11-03 12:08:29,201] Trial 46 finished with value: 0.11341666798629352 and parameters: {'model_type': 'gcn', 'hidden_dims': '[512, 128]', 'dropout': 0.38698462438306275, 'batch_norm': True, 'lr': 0.00023443874063339728, 'weight_decay': 2.1406698023981813e-06, 'epochs': 300, 'loss': 'mse', 'optimizer': 'adam', 'graph_mode': 'off', 'use_snp_selection': False}. Best is trial 22 with value: 0.13056895679760083.
[I 2025-11-03 12:08:30,740] Trial 47 finished with value: 0.04370363420479679 and parameters: {'model_type': 'gcn', 'hidden_dims': '[256, 128]', 'dropout': 0.32500055653793797, 'batch_norm': False, 'lr': 0.0004403541177937646, 'weight_decay': 1.4405546196565163e-07, 'epochs': 212, 'loss': 'mae', 'optimizer': 'adam', 'graph_mode': 'off', 'use_snp_selection': False}. Best is trial 22 with value: 0.13056895679760083.
[I 2025-11-03 12:08:31,777] Trial 48 finished with value: 0.0496799639152348 and parameters: {'model_type': 'gcn', 'hidden_dims': '[128, 64]', 'dropout': 0.3014732152279527, 'batch_norm': True, 'lr': 4.5307650135580386e-05, 'weight_decay': 3.9258320842281966e-07, 'epochs': 173, 'loss': 'mse', 'optimizer': 'adam', 'graph_mode': 'off', 'use_snp_selection': False}. Best is trial 22 with value: 0.13056895679760083.
[I 2025-11-03 12:08:34,050] Trial 49 finished with value: 0.08530967396826553 and parameters: {'model_type': 'gcn', 'hidden_dims': '[512, 256]', 'dropout': 0.3477553599604105, 'batch_norm': True, 'lr': 0.0001620060260490656, 'weight_decay': 1.3136077178522424e-06, 'epochs': 139, 'loss': 'mse', 'optimizer': 'adam', 'graph_mode': 'off', 'use_snp_selection': True, 'num_snps': 46888}. Best is trial 22 with value: 0.13056895679760083.
[I 2025-11-03 12:08:36,624] Trial 50 finished with value: 0.10959897179319807 and parameters: {'model_type': 'gcn', 'hidden_dims': '[512, 128]', 'dropout': 0.4304502965775156, 'batch_norm': True, 'lr': 0.00031123867981522384, 'weight_decay': 1.975453923099614e-05, 'epochs': 278, 'loss': 'mse', 'optimizer': 'adam', 'graph_mode': 'off', 'use_snp_selection': False}. Best is trial 22 with value: 0.13056895679760083.
[I 2025-11-03 12:08:38,109] Trial 51 finished with value: 0.11167266030014039 and parameters: {'model_type': 'gcn', 'hidden_dims': '[128, 64]', 'dropout': 0.2818979448018076, 'batch_norm': True, 'lr': 0.0005289775351786129, 'weight_decay': 1.7024338667362743e-07, 'epochs': 329, 'loss': 'mse', 'optimizer': 'adam', 'graph_mode': 'off', 'use_snp_selection': False}. Best is trial 22 with value: 0.13056895679760083.
[I 2025-11-03 12:08:39,597] Trial 52 finished with value: 0.12316127995900818 and parameters: {'model_type': 'gcn', 'hidden_dims': '[128, 64]', 'dropout': 0.246212108025183, 'batch_norm': True, 'lr': 0.000652033979535534, 'weight_decay': 1.3269175095556876e-07, 'epochs': 316, 'loss': 'mse', 'optimizer': 'adam', 'graph_mode': 'off', 'use_snp_selection': False}. Best is trial 22 with value: 0.13056895679760083.
[I 2025-11-03 12:08:41,059] Trial 53 finished with value: 0.11612516572872043 and parameters: {'model_type': 'gcn', 'hidden_dims': '[128, 64]', 'dropout': 0.1835226464325398, 'batch_norm': True, 'lr': 0.0008351029630179641, 'weight_decay': 1.2087936119506604e-07, 'epochs': 317, 'loss': 'mse', 'optimizer': 'adam', 'graph_mode': 'off', 'use_snp_selection': False}. Best is trial 22 with value: 0.13056895679760083.
[I 2025-11-03 12:08:42,473] Trial 54 finished with value: 0.1251370193187323 and parameters: {'model_type': 'gcn', 'hidden_dims': '[128, 64]', 'dropout': 0.24582229633467748, 'batch_norm': True, 'lr': 0.0006791775789492402, 'weight_decay': 2.3538878442394674e-07, 'epochs': 301, 'loss': 'mse', 'optimizer': 'adam', 'graph_mode': 'off', 'use_snp_selection': False}. Best is trial 22 with value: 0.13056895679760083.
[I 2025-11-03 12:08:43,875] Trial 55 finished with value: 0.12394042595892267 and parameters: {'model_type': 'gcn', 'hidden_dims': '[128, 64]', 'dropout': 0.24239334322265732, 'batch_norm': True, 'lr': 0.000716100700171698, 'weight_decay': 2.389862141062493e-07, 'epochs': 297, 'loss': 'mse', 'optimizer': 'adam', 'graph_mode': 'off', 'use_snp_selection': False}. Best is trial 22 with value: 0.13056895679760083.
[I 2025-11-03 12:08:45,275] Trial 56 finished with value: 0.11516895015324094 and parameters: {'model_type': 'gcn', 'hidden_dims': '[128, 64]', 'dropout': 0.20781981687546042, 'batch_norm': True, 'lr': 0.0007171669415635541, 'weight_decay': 6.18255286711213e-07, 'epochs': 302, 'loss': 'mse', 'optimizer': 'adam', 'graph_mode': 'off', 'use_snp_selection': False}. Best is trial 22 with value: 0.13056895679760083.
[I 2025-11-03 12:08:46,940] Trial 57 finished with value: 0.11001474213898726 and parameters: {'model_type': 'gcn', 'hidden_dims': '[128, 64]', 'dropout': 0.24326311403694087, 'batch_norm': True, 'lr': 0.0009984789894061138, 'weight_decay': 2.2922244177520564e-07, 'epochs': 350, 'loss': 'mse', 'optimizer': 'adam', 'graph_mode': 'off', 'use_snp_selection': False}. Best is trial 22 with value: 0.13056895679760083.
[I 2025-11-03 12:08:48,296] Trial 58 finished with value: 0.046149893382067174 and parameters: {'model_type': 'gcn', 'hidden_dims': '[128, 64]', 'dropout': 0.25245631871236923, 'batch_norm': False, 'lr': 1.0795446007347502e-05, 'weight_decay': 4.5223084224682413e-07, 'epochs': 298, 'loss': 'mae', 'optimizer': 'adam', 'graph_mode': 'off', 'use_snp_selection': False}. Best is trial 22 with value: 0.13056895679760083.
[I 2025-11-03 12:08:49,821] Trial 59 finished with value: 0.11301089714061817 and parameters: {'model_type': 'gcn', 'hidden_dims': '[128, 64]', 'dropout': 0.30422929014089767, 'batch_norm': True, 'lr': 0.0006519660346374005, 'weight_decay': 0.00034646727993642364, 'epochs': 322, 'loss': 'mse', 'optimizer': 'adam', 'graph_mode': 'off', 'use_snp_selection': False}. Best is trial 22 with value: 0.13056895679760083.
[I 2025-11-03 12:08:51,233] Trial 60 finished with value: 0.12248406982298748 and parameters: {'model_type': 'gcn', 'hidden_dims': '[128, 64]', 'dropout': 0.2679326662384335, 'batch_norm': True, 'lr': 0.0002521577988518894, 'weight_decay': 2.7700247415710977e-07, 'epochs': 283, 'loss': 'mse', 'optimizer': 'adam', 'graph_mode': 'off', 'use_snp_selection': False}. Best is trial 22 with value: 0.13056895679760083.
[I 2025-11-03 12:08:52,563] Trial 61 finished with value: 0.12558371240830718 and parameters: {'model_type': 'gcn', 'hidden_dims': '[128, 64]', 'dropout': 0.33082913176886486, 'batch_norm': True, 'lr': 0.000374478100134994, 'weight_decay': 3.116695555789787e-07, 'epochs': 261, 'loss': 'mse', 'optimizer': 'adam', 'graph_mode': 'off', 'use_snp_selection': False}. Best is trial 22 with value: 0.13056895679760083.
[I 2025-11-03 12:08:53,872] Trial 62 finished with value: 0.1124312870405889 and parameters: {'model_type': 'gcn', 'hidden_dims': '[128, 64]', 'dropout': 0.33741224391596325, 'batch_norm': True, 'lr': 0.00046198268136502137, 'weight_decay': 3.220139102889585e-07, 'epochs': 264, 'loss': 'mse', 'optimizer': 'adam', 'graph_mode': 'off', 'use_snp_selection': False}. Best is trial 22 with value: 0.13056895679760083.
[I 2025-11-03 12:08:55,264] Trial 63 finished with value: 0.11483692277030928 and parameters: {'model_type': 'gcn', 'hidden_dims': '[128, 64]', 'dropout': 0.3677180976996465, 'batch_norm': True, 'lr': 0.00036489140441489843, 'weight_decay': 1.9656952514945157e-07, 'epochs': 295, 'loss': 'mse', 'optimizer': 'adam', 'graph_mode': 'off', 'use_snp_selection': False}. Best is trial 22 with value: 0.13056895679760083.
[I 2025-11-03 12:08:56,694] Trial 64 finished with value: 0.08261250591830958 and parameters: {'model_type': 'gcn', 'hidden_dims': '[128, 64]', 'dropout': 0.3093317215264837, 'batch_norm': True, 'lr': 0.00019370588804086948, 'weight_decay': 6.271480677238453e-07, 'epochs': 309, 'loss': 'mse', 'optimizer': 'adam', 'graph_mode': 'off', 'use_snp_selection': False}. Best is trial 22 with value: 0.13056895679760083.
[I 2025-11-03 12:08:57,988] Trial 65 finished with value: 0.10649695629766487 and parameters: {'model_type': 'gcn', 'hidden_dims': '[128, 64]', 'dropout': 0.23862710996194125, 'batch_norm': True, 'lr': 0.0007999825679896122, 'weight_decay': 1.085621478306611e-06, 'epochs': 257, 'loss': 'mse', 'optimizer': 'adam', 'graph_mode': 'off', 'use_snp_selection': False}. Best is trial 22 with value: 0.13056895679760083.
[I 2025-11-03 12:09:00,012] Trial 66 finished with value: 0.1060149095132868 and parameters: {'model_type': 'gcn', 'hidden_dims': '[256, 128, 64]', 'dropout': 0.3998437546299743, 'batch_norm': True, 'lr': 0.0005823151275110804, 'weight_decay': 1.3220925645980574e-07, 'epochs': 276, 'loss': 'mse', 'optimizer': 'adam', 'graph_mode': 'off', 'use_snp_selection': False}. Best is trial 22 with value: 0.13056895679760083.
[I 2025-11-03 12:09:01,706] Trial 67 finished with value: 0.10924131671889155 and parameters: {'model_type': 'gcn', 'hidden_dims': '[128, 64]', 'dropout': 0.2955445973833292, 'batch_norm': True, 'lr': 0.00047952641824321814, 'weight_decay': 2.2160478972639262e-07, 'epochs': 335, 'loss': 'mse', 'optimizer': 'adam', 'graph_mode': 'off', 'use_snp_selection': True, 'num_snps': 22951}. Best is trial 22 with value: 0.13056895679760083.
[I 2025-11-03 12:09:04,580] Trial 68 finished with value: 0.11316001930085703 and parameters: {'model_type': 'gcn', 'hidden_dims': '[512, 256]', 'dropout': 0.32086730703487387, 'batch_norm': True, 'lr': 7.432116984385524e-05, 'weight_decay': 4.5616743067161246e-07, 'epochs': 325, 'loss': 'mse', 'optimizer': 'adam', 'graph_mode': 'off', 'use_snp_selection': False}. Best is trial 22 with value: 0.13056895679760083.
[I 2025-11-03 12:09:05,946] Trial 69 finished with value: 0.10199001502772563 and parameters: {'model_type': 'gcn', 'hidden_dims': '[128, 64]', 'dropout': 0.28003897405938344, 'batch_norm': False, 'lr': 0.00012351945946080975, 'weight_decay': 3.03411708708235e-06, 'epochs': 310, 'loss': 'mse', 'optimizer': 'adam', 'graph_mode': 'off', 'use_snp_selection': False}. Best is trial 22 with value: 0.13056895679760083.
[I 2025-11-03 12:09:08,457] Trial 70 finished with value: 0.11515381727751738 and parameters: {'model_type': 'gcn', 'hidden_dims': '[512, 64]', 'dropout': 0.3590580398328204, 'batch_norm': True, 'lr': 0.0003618466391867671, 'weight_decay': 3.206207962609023e-07, 'epochs': 270, 'loss': 'mse', 'optimizer': 'adam', 'graph_mode': 'off', 'use_snp_selection': False}. Best is trial 22 with value: 0.13056895679760083.
[I 2025-11-03 12:09:10,644] Trial 71 finished with value: 0.11646810120174239 and parameters: {'model_type': 'gcn', 'hidden_dims': '[512, 256]', 'dropout': 0.1987111327449729, 'batch_norm': True, 'lr': 0.0007040814401493621, 'weight_decay': 1.34547915359735e-07, 'epochs': 220, 'loss': 'mse', 'optimizer': 'adam', 'graph_mode': 'off', 'use_snp_selection': False}. Best is trial 22 with value: 0.13056895679760083.
[I 2025-11-03 12:09:12,256] Trial 72 finished with value: 0.1117314233148562 and parameters: {'model_type': 'gcn', 'hidden_dims': '[256, 128]', 'dropout': 0.16494902151159502, 'batch_norm': True, 'lr': 0.0002795427240468206, 'weight_decay': 1.7650634174947545e-07, 'epochs': 241, 'loss': 'mse', 'optimizer': 'adam', 'graph_mode': 'off', 'use_snp_selection': False}. Best is trial 22 with value: 0.13056895679760083.
[I 2025-11-03 12:09:13,613] Trial 73 finished with value: 0.12761455417300435 and parameters: {'model_type': 'gcn', 'hidden_dims': '[128, 64]', 'dropout': 0.33362203924338624, 'batch_norm': True, 'lr': 0.0009873783739393436, 'weight_decay': 1.0417944406583593e-07, 'epochs': 257, 'loss': 'mse', 'optimizer': 'adam', 'graph_mode': 'off', 'use_snp_selection': False}. Best is trial 22 with value: 0.13056895679760083.
[I 2025-11-03 12:09:15,014] Trial 74 finished with value: 0.11306513407955533 and parameters: {'model_type': 'gcn', 'hidden_dims': '[128, 64]', 'dropout': 0.3363366750581238, 'batch_norm': True, 'lr': 0.000990668436673387, 'weight_decay': 1.0560875574174981e-07, 'epochs': 290, 'loss': 'mse', 'optimizer': 'adam', 'graph_mode': 'off', 'use_snp_selection': False}. Best is trial 22 with value: 0.13056895679760083.
[I 2025-11-03 12:09:16,361] Trial 75 finished with value: 0.12043562381643534 and parameters: {'model_type': 'gcn', 'hidden_dims': '[128, 64]', 'dropout': 0.3809592480260593, 'batch_norm': True, 'lr': 0.0007961356969720389, 'weight_decay': 2.5954754558412917e-07, 'epochs': 280, 'loss': 'mse', 'optimizer': 'adam', 'graph_mode': 'off', 'use_snp_selection': False}. Best is trial 22 with value: 0.13056895679760083.
[I 2025-11-03 12:09:17,652] Trial 76 finished with value: 0.09967495760226701 and parameters: {'model_type': 'gcn', 'hidden_dims': '[128, 64]', 'dropout': 0.22923994784102855, 'batch_norm': True, 'lr': 0.0005992502524434511, 'weight_decay': 7.904490900771699e-07, 'epochs': 261, 'loss': 'mae', 'optimizer': 'adam', 'graph_mode': 'off', 'use_snp_selection': False}. Best is trial 22 with value: 0.13056895679760083.
