[I 2025-10-23 01:19:17,502] Trial 86 finished with value: 0.2275976275033877 and parameters: {'model_type': 'gat', 'hidden_dims': '[512, 128]', 'dropout': 0.40355816185320625, 'batch_norm': True, 'gat_heads': 6, 'gat_attn_dropout': 0.03639162224068183, 'gat_concat_hidden': True, 'lr': 0.0001624866306997288, 'weight_decay': 1.773610222355974e-07, 'epochs': 243, 'loss': 'mae', 'optimizer': 'adam', 'graph_mode': 'cutoff', 'cutoff': 0.8008347771391987, 'grm_norm': 'gcn', 'self_loops': True}. Best is trial 74 with value: 0.2347528881993936.
[I 2025-10-23 01:26:38,297] Trial 87 finished with value: 0.17268930853283687 and parameters: {'model_type': 'gat', 'hidden_dims': '[512, 128]', 'dropout': 0.4068833720514875, 'batch_norm': True, 'gat_heads': 6, 'gat_attn_dropout': 0.11887783644041586, 'gat_concat_hidden': True, 'lr': 0.000706894948428576, 'weight_decay': 8.010913250994262e-05, 'epochs': 233, 'loss': 'mae', 'optimizer': 'adam', 'graph_mode': 'cutoff', 'cutoff': 0.35485897206921246, 'grm_norm': 'cosine', 'self_loops': True}. Best is trial 74 with value: 0.2347528881993936.
[I 2025-10-23 01:34:06,409] Trial 88 finished with value: 0.2265600223805337 and parameters: {'model_type': 'gat', 'hidden_dims': '[512, 256]', 'dropout': 0.42609705725812635, 'batch_norm': True, 'gat_heads': 5, 'gat_attn_dropout': 0.018456622281155508, 'gat_concat_hidden': True, 'lr': 2.0788194748045755e-05, 'weight_decay': 2.8192114868155427e-07, 'epochs': 278, 'loss': 'mae', 'optimizer': 'adam', 'graph_mode': 'cutoff', 'cutoff': 0.7959865484188101, 'grm_norm': 'gcn', 'self_loops': True}. Best is trial 74 with value: 0.2347528881993936.
[I 2025-10-23 01:44:35,876] Trial 89 finished with value: 0.21408652397984337 and parameters: {'model_type': 'gat', 'hidden_dims': '[512, 256]', 'dropout': 0.43449251398299804, 'batch_norm': True, 'gat_heads': 7, 'gat_attn_dropout': 0.07421423082428566, 'gat_concat_hidden': True, 'lr': 2.364154550399086e-05, 'weight_decay': 2.7687110948615336e-07, 'epochs': 285, 'loss': 'mae', 'optimizer': 'adam', 'graph_mode': 'cutoff', 'cutoff': 0.8046287836546858, 'grm_norm': 'gcn', 'self_loops': True}. Best is trial 74 with value: 0.2347528881993936.
[I 2025-10-23 01:49:49,630] Trial 90 finished with value: 0.1724486896327812 and parameters: {'model_type': 'gat', 'hidden_dims': '[512, 256]', 'dropout': 0.459165230046417, 'batch_norm': True, 'gat_heads': 4, 'gat_attn_dropout': 0.015957878764352153, 'gat_concat_hidden': True, 'lr': 9.072191136288746e-06, 'weight_decay': 4.2843278783601546e-07, 'epochs': 243, 'loss': 'mae', 'optimizer': 'adam', 'graph_mode': 'cutoff', 'cutoff': 0.7570971448478264, 'grm_norm': 'cosine', 'self_loops': True}. Best is trial 74 with value: 0.2347528881993936.
[I 2025-10-23 01:55:46,777] Trial 91 finished with value: 0.17864506556837337 and parameters: {'model_type': 'gat', 'hidden_dims': '[512, 256]', 'dropout': 0.39807197636923175, 'batch_norm': True, 'gat_heads': 5, 'gat_attn_dropout': 0.03562272026470896, 'gat_concat_hidden': True, 'lr': 2.0226267469681788e-05, 'weight_decay': 1.874091924917102e-07, 'epochs': 220, 'loss': 'mae', 'optimizer': 'adam', 'graph_mode': 'cutoff', 'cutoff': 0.7865645380322838, 'grm_norm': 'gcn', 'self_loops': True}. Best is trial 74 with value: 0.2347528881993936.
[I 2025-10-23 02:02:50,841] Trial 92 finished with value: 0.1916043550955206 and parameters: {'model_type': 'gat', 'hidden_dims': '[512, 256]', 'dropout': 0.41672179838710827, 'batch_norm': True, 'gat_heads': 5, 'gat_attn_dropout': 0.055474445316421823, 'gat_concat_hidden': True, 'lr': 3.930148773408205e-06, 'weight_decay': 3.133030143216705e-07, 'epochs': 264, 'loss': 'mae', 'optimizer': 'adam', 'graph_mode': 'cutoff', 'cutoff': 0.8211224744627832, 'grm_norm': 'gcn', 'self_loops': True}. Best is trial 74 with value: 0.2347528881993936.
[I 2025-10-23 02:10:09,013] Trial 93 finished with value: 0.22387370900752618 and parameters: {'model_type': 'gat', 'hidden_dims': '[512, 128]', 'dropout': 0.5748540100188907, 'batch_norm': True, 'gat_heads': 5, 'gat_attn_dropout': 0.03693289103662747, 'gat_concat_hidden': True, 'lr': 3.0922848000665835e-05, 'weight_decay': 1.7213816523690868e-07, 'epochs': 277, 'loss': 'mae', 'optimizer': 'adam', 'graph_mode': 'cutoff', 'cutoff': 0.8521688623835939, 'grm_norm': 'gcn', 'self_loops': True}. Best is trial 74 with value: 0.2347528881993936.
[I 2025-10-23 02:13:26,214] Trial 94 finished with value: 0.2169091326783339 and parameters: {'model_type': 'gat', 'hidden_dims': '[256, 128, 64]', 'dropout': 0.4976838064882558, 'batch_norm': True, 'gat_heads': 6, 'gat_attn_dropout': 0.01299178694154341, 'gat_concat_hidden': True, 'lr': 0.00021234308549615135, 'weight_decay': 0.00040332547300088825, 'epochs': 204, 'loss': 'mae', 'optimizer': 'adam', 'graph_mode': 'cutoff', 'cutoff': 0.8259769546056125, 'grm_norm': 'gcn', 'self_loops': True}. Best is trial 74 with value: 0.2347528881993936.
[I 2025-10-23 02:21:09,051] Trial 95 finished with value: 0.16111373491981765 and parameters: {'model_type': 'gat', 'hidden_dims': '[512, 128]', 'dropout': 0.3901893421200877, 'batch_norm': True, 'gat_heads': 5, 'gat_attn_dropout': 0.08890663525063458, 'gat_concat_hidden': True, 'lr': 1.208371757868853e-05, 'weight_decay': 2.1305778147661866e-07, 'epochs': 293, 'loss': 'mae', 'optimizer': 'adam', 'graph_mode': 'cutoff', 'cutoff': 0.5514075304219863, 'grm_norm': 'gcn', 'self_loops': True}. Best is trial 74 with value: 0.2347528881993936.
[I 2025-10-23 02:26:59,424] Trial 96 finished with value: 0.1878729880983998 and parameters: {'model_type': 'gat', 'hidden_dims': '[512, 128]', 'dropout': 0.3148868741348422, 'batch_norm': True, 'gat_heads': 6, 'gat_attn_dropout': 0.06430408054784927, 'gat_concat_hidden': False, 'lr': 0.0001308152921720721, 'weight_decay': 0.00017825523826945147, 'epochs': 189, 'loss': 'mae', 'optimizer': 'adam', 'graph_mode': 'cutoff', 'cutoff': 0.7748410622556776, 'grm_norm': 'gcn', 'self_loops': True}. Best is trial 74 with value: 0.2347528881993936.
[I 2025-10-23 02:33:38,851] Trial 97 finished with value: 0.22872657464368046 and parameters: {'model_type': 'gat', 'hidden_dims': '[512, 128]', 'dropout': 0.42253744379229136, 'batch_norm': True, 'gat_heads': 5, 'gat_attn_dropout': 0.0008075114845907325, 'gat_concat_hidden': True, 'lr': 9.300479181243592e-05, 'weight_decay': 6.375414017946125e-07, 'epochs': 251, 'loss': 'mae', 'optimizer': 'adam', 'graph_mode': 'cutoff', 'cutoff': 0.8772975758967928, 'grm_norm': 'cosine_then_gcn', 'self_loops': True}. Best is trial 74 with value: 0.2347528881993936.
[I 2025-10-23 02:37:48,649] Trial 98 finished with value: 0.12283220208486978 and parameters: {'model_type': 'gat', 'hidden_dims': '[256, 128]', 'dropout': 0.4204434228661212, 'batch_norm': True, 'gat_heads': 6, 'gat_attn_dropout': 0.03010072630807311, 'gat_concat_hidden': True, 'lr': 1.699837194236899e-05, 'weight_decay': 3.6634728466660295e-07, 'epochs': 255, 'loss': 'mae', 'optimizer': 'adam', 'graph_mode': 'knn', 'source': 'grm', 'knn_k': 7, 'weighted_edges': False, 'symmetrize_mode': 'union'}. Best is trial 74 with value: 0.2347528881993936.
[I 2025-10-23 02:43:15,712] Trial 99 finished with value: 0.22080496036786795 and parameters: {'model_type': 'gat', 'hidden_dims': '[512, 256]', 'dropout': 0.46982138064359635, 'batch_norm': True, 'gat_heads': 4, 'gat_attn_dropout': 0.1585097639068956, 'gat_concat_hidden': True, 'lr': 0.00031304397114826656, 'weight_decay': 6.061849929635369e-07, 'epochs': 255, 'loss': 'mae', 'optimizer': 'adam', 'graph_mode': 'cutoff', 'cutoff': 0.7191636125686175, 'grm_norm': 'cosine_then_gcn', 'self_loops': True}. Best is trial 74 with value: 0.2347528881993936.
[I 2025-10-23 02:49:37,466] Trial 100 finished with value: 0.22766889699364712 and parameters: {'model_type': 'gat', 'hidden_dims': '[512, 128]', 'dropout': 0.44850243840891246, 'batch_norm': True, 'gat_heads': 5, 'gat_attn_dropout': 0.1098426330719375, 'gat_concat_hidden': True, 'lr': 0.00015789196811648496, 'weight_decay': 2.5193734066853627e-07, 'epochs': 240, 'loss': 'mae', 'optimizer': 'adam', 'graph_mode': 'cutoff', 'cutoff': 0.8027651660589167, 'grm_norm': 'cosine_then_gcn', 'self_loops': True}. Best is trial 74 with value: 0.2347528881993936.
[I 2025-10-23 02:55:57,043] Trial 101 finished with value: 0.23938908029324887 and parameters: {'model_type': 'gat', 'hidden_dims': '[512, 128]', 'dropout': 0.44980580326971153, 'batch_norm': True, 'gat_heads': 5, 'gat_attn_dropout': 0.05224440288198497, 'gat_concat_hidden': True, 'lr': 0.00016586923061206432, 'weight_decay': 4.5229340807870356e-07, 'epochs': 238, 'loss': 'mae', 'optimizer': 'adam', 'graph_mode': 'cutoff', 'cutoff': 0.8376111036250539, 'grm_norm': 'cosine_then_gcn', 'self_loops': True}. Best is trial 101 with value: 0.23938908029324887.
[I 2025-10-23 03:02:18,039] Trial 102 finished with value: 0.2009692277261058 and parameters: {'model_type': 'gat', 'hidden_dims': '[512, 128]', 'dropout': 0.4511803727093252, 'batch_norm': True, 'gat_heads': 5, 'gat_attn_dropout': 0.04895028055372253, 'gat_concat_hidden': True, 'lr': 0.00015411812382306152, 'weight_decay': 6.942163370429015e-07, 'epochs': 239, 'loss': 'mae', 'optimizer': 'adam', 'graph_mode': 'cutoff', 'cutoff': 0.8014753183539746, 'grm_norm': 'cosine_then_gcn', 'self_loops': True}. Best is trial 101 with value: 0.23938908029324887.
[I 2025-10-23 03:09:32,102] Trial 103 finished with value: 0.21025219100778386 and parameters: {'model_type': 'gat', 'hidden_dims': '[512, 128]', 'dropout': 0.4381916972075668, 'batch_norm': True, 'gat_heads': 5, 'gat_attn_dropout': 0.014210436378557255, 'gat_concat_hidden': True, 'lr': 0.00018497652434633938, 'weight_decay': 9.556932005946401e-07, 'epochs': 274, 'loss': 'mae', 'optimizer': 'adam', 'graph_mode': 'cutoff', 'cutoff': 0.8344583014404698, 'grm_norm': 'cosine_then_gcn', 'self_loops': True}. Best is trial 101 with value: 0.23938908029324887.
[I 2025-10-23 03:15:16,305] Trial 104 finished with value: 0.23350473570614244 and parameters: {'model_type': 'gat', 'hidden_dims': '[512, 128]', 'dropout': 0.4722428665402768, 'batch_norm': True, 'gat_heads': 5, 'gat_attn_dropout': 0.10736416683485055, 'gat_concat_hidden': True, 'lr': 7.082076946661048e-05, 'weight_decay': 4.729052882674402e-07, 'epochs': 215, 'loss': 'mae', 'optimizer': 'adam', 'graph_mode': 'cutoff', 'cutoff': 0.8811938741817913, 'grm_norm': 'cosine_then_gcn', 'self_loops': True}. Best is trial 101 with value: 0.23938908029324887.
[I 2025-10-23 03:20:03,667] Trial 105 finished with value: 0.19862577316796579 and parameters: {'model_type': 'gat', 'hidden_dims': '[512, 128]', 'dropout': 0.49772912646099476, 'batch_norm': True, 'gat_heads': 4, 'gat_attn_dropout': 0.13381419953610824, 'gat_concat_hidden': True, 'lr': 9.198646861317589e-05, 'weight_decay': 2.3755775462275625e-07, 'epochs': 225, 'loss': 'mae', 'optimizer': 'adam', 'graph_mode': 'cutoff', 'cutoff': 0.8769086738207161, 'grm_norm': 'cosine_then_gcn', 'self_loops': True}. Best is trial 101 with value: 0.23938908029324887.
[I 2025-10-23 03:25:42,055] Trial 106 finished with value: 0.19266932808747525 and parameters: {'model_type': 'gat', 'hidden_dims': '[512, 128]', 'dropout': 0.47067473629892115, 'batch_norm': True, 'gat_heads': 5, 'gat_attn_dropout': 0.06948606321585152, 'gat_concat_hidden': True, 'lr': 7.315821831841591e-05, 'weight_decay': 4.667929321050408e-07, 'epochs': 211, 'loss': 'mae', 'optimizer': 'adam', 'graph_mode': 'cutoff', 'cutoff': 0.8794970585153827, 'grm_norm': 'cosine_then_gcn', 'self_loops': True}. Best is trial 101 with value: 0.23938908029324887.
[I 2025-10-23 03:31:58,506] Trial 107 finished with value: 0.1936609834780705 and parameters: {'model_type': 'gat', 'hidden_dims': '[512, 128]', 'dropout': 0.5239525203524531, 'batch_norm': True, 'gat_heads': 5, 'gat_attn_dropout': 0.11698038655763279, 'gat_concat_hidden': True, 'lr': 0.00016508606014744838, 'weight_decay': 3.5407792904270296e-07, 'epochs': 237, 'loss': 'mae', 'optimizer': 'adam', 'graph_mode': 'cutoff', 'cutoff': 0.8500390786910319, 'grm_norm': 'cosine_then_gcn', 'self_loops': True}. Best is trial 101 with value: 0.23938908029324887.
[I 2025-10-23 03:37:43,750] Trial 108 finished with value: 0.2260196134994324 and parameters: {'model_type': 'gat', 'hidden_dims': '[512, 128]', 'dropout': 0.48299885294837475, 'batch_norm': True, 'gat_heads': 5, 'gat_attn_dropout': 0.10317615770893498, 'gat_concat_hidden': True, 'lr': 0.00013446166287265377, 'weight_decay': 1.270138258275882e-07, 'epochs': 216, 'loss': 'mae', 'optimizer': 'adam', 'graph_mode': 'cutoff', 'cutoff': 0.8837755999526382, 'grm_norm': 'cosine_then_gcn', 'self_loops': True}. Best is trial 101 with value: 0.23938908029324887.
[I 2025-10-23 03:44:20,423] Trial 109 finished with value: 0.2107347749351009 and parameters: {'model_type': 'gat', 'hidden_dims': '[512, 128]', 'dropout': 0.5559914753443134, 'batch_norm': True, 'gat_heads': 5, 'gat_attn_dropout': 0.078389481419356, 'gat_concat_hidden': True, 'lr': 9.375007670317231e-05, 'weight_decay': 1.7653972481146802e-07, 'epochs': 249, 'loss': 'mae', 'optimizer': 'adam', 'graph_mode': 'cutoff', 'cutoff': 0.8166676984624415, 'grm_norm': 'cosine_then_gcn', 'self_loops': True}. Best is trial 101 with value: 0.23938908029324887.
[I 2025-10-23 03:48:08,396] Trial 110 finished with value: 0.19301224164156836 and parameters: {'model_type': 'gat', 'hidden_dims': '[512, 128]', 'dropout': 0.49803048547260154, 'batch_norm': True, 'gat_heads': 4, 'gat_attn_dropout': 0.033809116415563445, 'gat_concat_hidden': False, 'lr': 4.771374324824617e-05, 'weight_decay': 4.172549505615148e-07, 'epochs': 178, 'loss': 'mae', 'optimizer': 'adam', 'graph_mode': 'cutoff', 'cutoff': 0.8346211288717365, 'grm_norm': 'cosine_then_gcn', 'self_loops': True}. Best is trial 101 with value: 0.23938908029324887.
[I 2025-10-23 03:54:07,702] Trial 111 finished with value: 0.21476244872831218 and parameters: {'model_type': 'gat', 'hidden_dims': '[512, 128]', 'dropout': 0.4226850678200935, 'batch_norm': True, 'gat_heads': 5, 'gat_attn_dropout': 0.04912221793279682, 'gat_concat_hidden': True, 'lr': 6.479739453317108e-05, 'weight_decay': 2.3819668527409162e-07, 'epochs': 225, 'loss': 'mae', 'optimizer': 'adam', 'graph_mode': 'cutoff', 'cutoff': 0.7867709352410973, 'grm_norm': 'cosine_then_gcn', 'self_loops': True}. Best is trial 101 with value: 0.23938908029324887.
[I 2025-10-23 04:00:34,780] Trial 112 finished with value: 0.20078322548558844 and parameters: {'model_type': 'gat', 'hidden_dims': '[512, 128]', 'dropout': 0.4409018317169291, 'batch_norm': True, 'gat_heads': 5, 'gat_attn_dropout': 0.0006821090323967036, 'gat_concat_hidden': True, 'lr': 0.0002592553581101392, 'weight_decay': 0.0002443393046852895, 'epochs': 244, 'loss': 'mae', 'optimizer': 'adam', 'graph_mode': 'cutoff', 'cutoff': 0.8551917961693617, 'grm_norm': 'cosine_then_gcn', 'self_loops': True}. Best is trial 101 with value: 0.23938908029324887.
[I 2025-10-23 04:07:34,144] Trial 113 finished with value: 0.22153690543315235 and parameters: {'model_type': 'gat', 'hidden_dims': '[512, 128]', 'dropout': 0.46307737196308296, 'batch_norm': True, 'gat_heads': 5, 'gat_attn_dropout': 0.026216938625627455, 'gat_concat_hidden': True, 'lr': 0.000389336459502234, 'weight_decay': 2.8125556351785696e-07, 'epochs': 266, 'loss': 'mae', 'optimizer': 'adam', 'graph_mode': 'cutoff', 'cutoff': 0.7991068084694428, 'grm_norm': 'cosine_then_gcn', 'self_loops': True}. Best is trial 101 with value: 0.23938908029324887.
[I 2025-10-23 04:13:41,394] Trial 114 finished with value: 0.22717691724444813 and parameters: {'model_type': 'gat', 'hidden_dims': '[512, 128]', 'dropout': 0.40970461583205553, 'batch_norm': True, 'gat_heads': 5, 'gat_attn_dropout': 0.014926528481859005, 'gat_concat_hidden': True, 'lr': 0.00015926992798638389, 'weight_decay': 6.370402357248872e-07, 'epochs': 231, 'loss': 'mae', 'optimizer': 'adam', 'graph_mode': 'cutoff', 'cutoff': 0.7666087549829982, 'grm_norm': 'cosine_then_gcn', 'self_loops': True}. Best is trial 101 with value: 0.23938908029324887.
[I 2025-10-23 04:20:04,624] Trial 115 finished with value: 0.23112101467946505 and parameters: {'model_type': 'gat', 'hidden_dims': '[512, 128]', 'dropout': 0.35394789058670206, 'batch_norm': True, 'gat_heads': 6, 'gat_attn_dropout': 0.038560062349764314, 'gat_concat_hidden': True, 'lr': 0.00015967472330458905, 'weight_decay': 6.335049864645799e-07, 'epochs': 205, 'loss': 'mae', 'optimizer': 'adam', 'graph_mode': 'cutoff', 'cutoff': 0.7656448874420937, 'grm_norm': 'cosine_then_gcn', 'self_loops': True}. Best is trial 101 with value: 0.23938908029324887.
[I 2025-10-23 04:26:26,821] Trial 116 finished with value: 0.16714780895048525 and parameters: {'model_type': 'gat', 'hidden_dims': '[512, 128]', 'dropout': 0.35353534154295013, 'batch_norm': True, 'gat_heads': 6, 'gat_attn_dropout': 0.11035762031212008, 'gat_concat_hidden': True, 'lr': 0.00012561928057572874, 'weight_decay': 8.017396979411109e-07, 'epochs': 203, 'loss': 'mae', 'optimizer': 'adam', 'graph_mode': 'knn', 'source': 'grm', 'knn_k': 2, 'weighted_edges': True, 'symmetrize_mode': 'mutual'}. Best is trial 101 with value: 0.23938908029324887.
[I 2025-10-23 04:32:44,931] Trial 117 finished with value: 0.22295525609922667 and parameters: {'model_type': 'gat', 'hidden_dims': '[512, 128]', 'dropout': 0.33669602641749485, 'batch_norm': False, 'gat_heads': 6, 'gat_attn_dropout': 0.03759857134291879, 'gat_concat_hidden': True, 'lr': 8.412590666621293e-05, 'weight_decay': 1.0949552602153632e-06, 'epochs': 207, 'loss': 'mae', 'optimizer': 'adam', 'graph_mode': 'cutoff', 'cutoff': 0.7479890643423538, 'grm_norm': 'cosine_then_gcn', 'self_loops': True}. Best is trial 101 with value: 0.23938908029324887.
[I 2025-10-23 04:39:24,178] Trial 118 finished with value: 0.22159651674546108 and parameters: {'model_type': 'gat', 'hidden_dims': '[512, 128]', 'dropout': 0.37678109382918523, 'batch_norm': True, 'gat_heads': 6, 'gat_attn_dropout': 0.06151949415442787, 'gat_concat_hidden': True, 'lr': 0.00010392418188941064, 'weight_decay': 1.4054325934197039e-06, 'epochs': 214, 'loss': 'mse', 'optimizer': 'adam', 'graph_mode': 'cutoff', 'cutoff': 0.8428862232299518, 'grm_norm': 'cosine_then_gcn', 'self_loops': False}. Best is trial 101 with value: 0.23938908029324887.
[I 2025-10-23 04:41:05,726] Trial 119 finished with value: 0.20909242492826846 and parameters: {'model_type': 'gat', 'hidden_dims': '[128, 64]', 'dropout': 0.4481085171942289, 'batch_norm': True, 'gat_heads': 6, 'gat_attn_dropout': 0.1805022309523251, 'gat_concat_hidden': True, 'lr': 0.00020799564383446072, 'weight_decay': 5.221526985660623e-07, 'epochs': 186, 'loss': 'mae', 'optimizer': 'adam', 'graph_mode': 'cutoff', 'cutoff': 0.8618365909139514, 'grm_norm': 'cosine_then_gcn', 'self_loops': True}. Best is trial 101 with value: 0.23938908029324887.
[I 2025-10-23 04:49:03,319] Trial 120 finished with value: 0.23237377645248491 and parameters: {'model_type': 'gat', 'hidden_dims': '[512, 128]', 'dropout': 0.3676776393085657, 'batch_norm': True, 'gat_heads': 7, 'gat_attn_dropout': 0.049667620180200774, 'gat_concat_hidden': True, 'lr': 0.00017775113669937374, 'weight_decay': 1.99272330236358e-06, 'epochs': 219, 'loss': 'mae', 'optimizer': 'adam', 'graph_mode': 'cutoff', 'cutoff': 0.8295258114457325, 'grm_norm': 'cosine_then_gcn', 'self_loops': True}. Best is trial 101 with value: 0.23938908029324887.
[I 2025-10-23 04:56:03,630] Trial 121 finished with value: 0.222108102557325 and parameters: {'model_type': 'gat', 'hidden_dims': '[512, 128]', 'dropout': 0.3656941769680042, 'batch_norm': True, 'gat_heads': 7, 'gat_attn_dropout': 0.048249096744779965, 'gat_concat_hidden': True, 'lr': 0.00017538753046542578, 'weight_decay': 1.5932442080035327e-07, 'epochs': 191, 'loss': 'mae', 'optimizer': 'adam', 'graph_mode': 'cutoff', 'cutoff': 0.8229788443933835, 'grm_norm': 'cosine_then_gcn', 'self_loops': True}. Best is trial 101 with value: 0.23938908029324887.
[I 2025-10-23 05:01:54,310] Trial 122 finished with value: 0.2333997370620997 and parameters: {'model_type': 'gat', 'hidden_dims': '[512, 128]', 'dropout': 0.3407774963594364, 'batch_norm': True, 'gat_heads': 5, 'gat_attn_dropout': 0.08340823555257613, 'gat_concat_hidden': True, 'lr': 0.00026053407468973116, 'weight_decay': 1.7899036838346948e-06, 'epochs': 220, 'loss': 'mae', 'optimizer': 'adam', 'graph_mode': 'cutoff', 'cutoff': 0.8840289674624054, 'grm_norm': 'cosine_then_gcn', 'self_loops': True}. Best is trial 101 with value: 0.23938908029324887.
[I 2025-10-23 05:07:50,460] Trial 123 finished with value: 0.2255306810676505 and parameters: {'model_type': 'gat', 'hidden_dims': '[512, 128]', 'dropout': 0.34562817802422874, 'batch_norm': True, 'gat_heads': 5, 'gat_attn_dropout': 0.0851529102509021, 'gat_concat_hidden': True, 'lr': 0.0002769621183988698, 'weight_decay': 1.9130103697222404e-06, 'epochs': 224, 'loss': 'mae', 'optimizer': 'adam', 'graph_mode': 'cutoff', 'cutoff': 0.8860761951858974, 'grm_norm': 'cosine_then_gcn', 'self_loops': True}. Best is trial 101 with value: 0.23938908029324887.
[I 2025-10-23 05:15:47,199] Trial 124 finished with value: 0.22058405649479212 and parameters: {'model_type': 'gat', 'hidden_dims': '[512, 128]', 'dropout': 0.31383462437996307, 'batch_norm': True, 'gat_heads': 7, 'gat_attn_dropout': 0.07157061029465978, 'gat_concat_hidden': True, 'lr': 0.00021834422309603203, 'weight_decay': 3.4809124442530175e-06, 'epochs': 219, 'loss': 'mae', 'optimizer': 'adam', 'graph_mode': 'cutoff', 'cutoff': 0.8851636923581727, 'grm_norm': 'cosine_then_gcn', 'self_loops': True}. Best is trial 101 with value: 0.23938908029324887.
