[I 2025-11-13 10:59:34,184] Trial 75 finished with value: 0.22590151364245709 and parameters: {'model_type': 'graphsage', 'hidden_dims': '[512, 256]', 'dropout': 0.45971007046909396, 'batch_norm': True, 'lr': 0.00011438520894114041, 'weight_decay': 3.1177544222969434e-05, 'epochs': 143, 'loss': 'mae', 'optimizer': 'adam', 'graph_mode': 'cutoff', 'cutoff': 0.4548798832051997, 'grm_norm': 'cosine', 'self_loops': True, 'use_snp_selection': False}. Best is trial 52 with value: 0.2605289408605313.
[I 2025-11-13 11:01:32,012] Trial 76 finished with value: 0.23924372835545232 and parameters: {'model_type': 'graphsage', 'hidden_dims': '[512, 256]', 'dropout': 0.4909763791290737, 'batch_norm': False, 'lr': 6.676783907318133e-05, 'weight_decay': 4.795640432435016e-06, 'epochs': 89, 'loss': 'mae', 'optimizer': 'adam', 'graph_mode': 'cutoff', 'cutoff': 0.48865876409525627, 'grm_norm': 'cosine', 'self_loops': True, 'use_snp_selection': True, 'num_snps': 45839}. Best is trial 52 with value: 0.2605289408605313.
[I 2025-11-13 11:05:48,773] Trial 77 finished with value: 0.23833522932781298 and parameters: {'model_type': 'graphsage', 'hidden_dims': '[512, 256]', 'dropout': 0.22669655416301937, 'batch_norm': False, 'lr': 0.00015325690395142884, 'weight_decay': 1.6547380094638248e-06, 'epochs': 104, 'loss': 'mae', 'optimizer': 'adam', 'graph_mode': 'cutoff', 'cutoff': 0.20559922776671347, 'grm_norm': 'cosine_then_gcn', 'self_loops': True, 'use_snp_selection': True, 'num_snps': 49266}. Best is trial 52 with value: 0.2605289408605313.
[I 2025-11-13 11:07:57,922] Trial 78 finished with value: 0.24081209523226552 and parameters: {'model_type': 'graphsage', 'hidden_dims': '[256, 128, 64]', 'dropout': 0.3578102720190932, 'batch_norm': False, 'lr': 0.00020644320340650258, 'weight_decay': 8.820075881169e-06, 'epochs': 178, 'loss': 'mae', 'optimizer': 'adam', 'graph_mode': 'cutoff', 'cutoff': 0.5408611158873576, 'grm_norm': 'cosine', 'self_loops': True, 'use_snp_selection': True, 'num_snps': 56406}. Best is trial 52 with value: 0.2605289408605313.
[I 2025-11-13 11:09:43,714] Trial 79 finished with value: 0.21092627556629706 and parameters: {'model_type': 'graphsage', 'hidden_dims': '[128, 64]', 'dropout': 0.412714323987662, 'batch_norm': False, 'lr': 9.755727072903809e-05, 'weight_decay': 5.30924118637744e-07, 'epochs': 200, 'loss': 'mae', 'optimizer': 'adam', 'graph_mode': 'cutoff', 'cutoff': 0.5680641105463896, 'grm_norm': 'cosine_then_gcn', 'self_loops': True, 'use_snp_selection': True, 'num_snps': 53725}. Best is trial 52 with value: 0.2605289408605313.
[I 2025-11-13 11:11:29,492] Trial 80 finished with value: 0.21258087903865835 and parameters: {'model_type': 'graphsage', 'hidden_dims': '[512, 256]', 'dropout': 0.1157312949517791, 'batch_norm': False, 'lr': 3.917059820515504e-05, 'weight_decay': 2.483528600761341e-06, 'epochs': 218, 'loss': 'mae', 'optimizer': 'adam', 'graph_mode': 'cutoff', 'cutoff': 0.6369575684149222, 'grm_norm': 'cosine', 'self_loops': True, 'use_snp_selection': True, 'num_snps': 24470}. Best is trial 52 with value: 0.2605289408605313.
[I 2025-11-13 11:15:00,436] Trial 81 finished with value: 0.22306509884274045 and parameters: {'model_type': 'graphsage', 'hidden_dims': '[512, 256]', 'dropout': 0.4517150889906648, 'batch_norm': False, 'lr': 9.423078571510875e-05, 'weight_decay': 2.4101192949304334e-06, 'epochs': 119, 'loss': 'mae', 'optimizer': 'adam', 'graph_mode': 'cutoff', 'cutoff': 0.3096891161615561, 'grm_norm': 'cosine', 'self_loops': True, 'use_snp_selection': True, 'num_snps': 57896}. Best is trial 52 with value: 0.2605289408605313.
[I 2025-11-13 11:20:13,898] Trial 82 finished with value: 0.23107810742294183 and parameters: {'model_type': 'graphsage', 'hidden_dims': '[512, 256]', 'dropout': 0.4086151291472918, 'batch_norm': False, 'lr': 8.578733323411924e-05, 'weight_decay': 2.2948611215490727e-06, 'epochs': 152, 'loss': 'mae', 'optimizer': 'adam', 'graph_mode': 'cutoff', 'cutoff': 0.2571178235291287, 'grm_norm': 'cosine', 'self_loops': True, 'use_snp_selection': True, 'num_snps': 58130}. Best is trial 52 with value: 0.2605289408605313.
[I 2025-11-13 11:23:42,299] Trial 83 finished with value: 0.2353462788345062 and parameters: {'model_type': 'graphsage', 'hidden_dims': '[512, 256]', 'dropout': 0.4279157188249285, 'batch_norm': False, 'lr': 0.00026895697485659995, 'weight_decay': 4.001724361073708e-06, 'epochs': 139, 'loss': 'mae', 'optimizer': 'adam', 'graph_mode': 'cutoff', 'cutoff': 0.3630980567610165, 'grm_norm': 'cosine', 'self_loops': True, 'use_snp_selection': True, 'num_snps': 57450}. Best is trial 52 with value: 0.2605289408605313.
[I 2025-11-13 11:26:04,414] Trial 84 finished with value: 0.2512556150688695 and parameters: {'model_type': 'graphsage', 'hidden_dims': '[512, 128]', 'dropout': 0.3879808735580718, 'batch_norm': False, 'lr': 7.075325726059766e-05, 'weight_decay': 1.7455933609900235e-06, 'epochs': 128, 'loss': 'mae', 'optimizer': 'adam', 'graph_mode': 'cutoff', 'cutoff': 0.450148861340544, 'grm_norm': 'cosine', 'self_loops': True, 'use_snp_selection': True, 'num_snps': 42697}. Best is trial 52 with value: 0.2605289408605313.
[I 2025-11-13 11:28:18,599] Trial 85 finished with value: 0.25035269825382167 and parameters: {'model_type': 'graphsage', 'hidden_dims': '[512, 128]', 'dropout': 0.38618281071941646, 'batch_norm': False, 'lr': 0.00012863851144105724, 'weight_decay': 1.5563118976849558e-06, 'epochs': 130, 'loss': 'mae', 'optimizer': 'adam', 'graph_mode': 'cutoff', 'cutoff': 0.43878514096903215, 'grm_norm': 'cosine_then_gcn', 'self_loops': True, 'use_snp_selection': True, 'num_snps': 39944}. Best is trial 52 with value: 0.2605289408605313.
[I 2025-11-13 11:30:18,263] Trial 86 finished with value: 0.2300406396858629 and parameters: {'model_type': 'graphsage', 'hidden_dims': '[512, 128]', 'dropout': 0.39290934740605826, 'batch_norm': True, 'lr': 5.188239907216541e-05, 'weight_decay': 9.198856572073401e-07, 'epochs': 131, 'loss': 'mae', 'optimizer': 'adam', 'graph_mode': 'cutoff', 'cutoff': 0.40919719018740075, 'grm_norm': 'cosine_then_gcn', 'self_loops': True, 'use_snp_selection': False}. Best is trial 52 with value: 0.2605289408605313.
[I 2025-11-13 11:32:11,815] Trial 87 finished with value: 0.2561887813904046 and parameters: {'model_type': 'graphsage', 'hidden_dims': '[512, 128]', 'dropout': 0.3422750099947174, 'batch_norm': False, 'lr': 0.00012947971393525106, 'weight_decay': 1.5778953457830643e-06, 'epochs': 112, 'loss': 'mae', 'optimizer': 'adam', 'graph_mode': 'cutoff', 'cutoff': 0.4460402370688971, 'grm_norm': 'cosine_then_gcn', 'self_loops': True, 'use_snp_selection': True, 'num_snps': 35305}. Best is trial 52 with value: 0.2605289408605313.
[I 2025-11-13 11:35:43,823] Trial 88 finished with value: 0.23101345171260596 and parameters: {'model_type': 'graphsage', 'hidden_dims': '[512, 128]', 'dropout': 0.33047813786732777, 'batch_norm': False, 'lr': 7.035551592071747e-05, 'weight_decay': 1.4737145000946179e-06, 'epochs': 349, 'loss': 'mae', 'optimizer': 'adam', 'graph_mode': 'cutoff', 'cutoff': 0.44402871263470534, 'grm_norm': 'cosine_then_gcn', 'self_loops': True, 'use_snp_selection': True, 'num_snps': 33511}. Best is trial 52 with value: 0.2605289408605313.
[I 2025-11-13 11:37:38,980] Trial 89 finished with value: 0.25195749656750144 and parameters: {'model_type': 'graphsage', 'hidden_dims': '[512, 128]', 'dropout': 0.29597951205614226, 'batch_norm': False, 'lr': 0.00013036595720273883, 'weight_decay': 1.1415322198059862e-06, 'epochs': 111, 'loss': 'mae', 'optimizer': 'adam', 'graph_mode': 'cutoff', 'cutoff': 0.4050454331846568, 'grm_norm': 'cosine_then_gcn', 'self_loops': True, 'use_snp_selection': True, 'num_snps': 36837}. Best is trial 52 with value: 0.2605289408605313.
[I 2025-11-13 11:39:35,966] Trial 90 finished with value: 0.2582693847899066 and parameters: {'model_type': 'graphsage', 'hidden_dims': '[512, 128]', 'dropout': 0.2875181754087356, 'batch_norm': False, 'lr': 0.00012236542295367462, 'weight_decay': 2.2639233264938457e-05, 'epochs': 111, 'loss': 'mae', 'optimizer': 'adam', 'graph_mode': 'cutoff', 'cutoff': 0.4046761978906603, 'grm_norm': 'cosine_then_gcn', 'self_loops': True, 'use_snp_selection': True, 'num_snps': 37077}. Best is trial 52 with value: 0.2605289408605313.
[I 2025-11-13 11:41:28,377] Trial 91 finished with value: 0.25101253080684965 and parameters: {'model_type': 'graphsage', 'hidden_dims': '[512, 128]', 'dropout': 0.2927992197551708, 'batch_norm': False, 'lr': 0.0001257823833392883, 'weight_decay': 3.479046360821193e-05, 'epochs': 112, 'loss': 'mae', 'optimizer': 'adam', 'graph_mode': 'cutoff', 'cutoff': 0.4730203914489888, 'grm_norm': 'cosine_then_gcn', 'self_loops': True, 'use_snp_selection': True, 'num_snps': 36104}. Best is trial 52 with value: 0.2605289408605313.
[I 2025-11-13 11:43:22,403] Trial 92 finished with value: 0.25904882281526376 and parameters: {'model_type': 'graphsage', 'hidden_dims': '[512, 128]', 'dropout': 0.27314211962101614, 'batch_norm': False, 'lr': 0.00012657636089262944, 'weight_decay': 7.553325611319834e-05, 'epochs': 112, 'loss': 'mae', 'optimizer': 'adam', 'graph_mode': 'cutoff', 'cutoff': 0.3911257824813204, 'grm_norm': 'cosine_then_gcn', 'self_loops': True, 'use_snp_selection': True, 'num_snps': 35633}. Best is trial 52 with value: 0.2605289408605313.
[I 2025-11-13 11:45:04,197] Trial 93 finished with value: 0.23947094790671533 and parameters: {'model_type': 'graphsage', 'hidden_dims': '[512, 128]', 'dropout': 0.283534364076833, 'batch_norm': False, 'lr': 0.0001536477174741764, 'weight_decay': 0.00010467654671938492, 'epochs': 87, 'loss': 'mae', 'optimizer': 'adam', 'graph_mode': 'cutoff', 'cutoff': 0.4103618940740217, 'grm_norm': 'cosine_then_gcn', 'self_loops': True, 'use_snp_selection': True, 'num_snps': 34898}. Best is trial 52 with value: 0.2605289408605313.
[I 2025-11-13 11:46:43,383] Trial 94 finished with value: 0.25255848786268165 and parameters: {'model_type': 'graphsage', 'hidden_dims': '[512, 128]', 'dropout': 0.29749983932778445, 'batch_norm': False, 'lr': 0.00020087094543707037, 'weight_decay': 2.5211454919826872e-05, 'epochs': 98, 'loss': 'mae', 'optimizer': 'adam', 'graph_mode': 'cutoff', 'cutoff': 0.38793492355650716, 'grm_norm': 'cosine_then_gcn', 'self_loops': True, 'use_snp_selection': True, 'num_snps': 31154}. Best is trial 52 with value: 0.2605289408605313.
[I 2025-11-13 11:48:24,061] Trial 95 finished with value: 0.2647045825331954 and parameters: {'model_type': 'graphsage', 'hidden_dims': '[512, 128]', 'dropout': 0.288336380390069, 'batch_norm': False, 'lr': 0.00019728321900661813, 'weight_decay': 2.11446119853223e-05, 'epochs': 99, 'loss': 'mae', 'optimizer': 'adam', 'graph_mode': 'cutoff', 'cutoff': 0.38156091157491473, 'grm_norm': 'cosine_then_gcn', 'self_loops': True, 'use_snp_selection': True, 'num_snps': 30588}. Best is trial 95 with value: 0.2647045825331954.
[I 2025-11-13 11:50:03,603] Trial 96 finished with value: 0.2435752618689666 and parameters: {'model_type': 'graphsage', 'hidden_dims': '[512, 128]', 'dropout': 0.26067952489323604, 'batch_norm': False, 'lr': 0.00018736803319622524, 'weight_decay': 2.095040264427458e-05, 'epochs': 97, 'loss': 'mae', 'optimizer': 'adam', 'graph_mode': 'cutoff', 'cutoff': 0.400386556843775, 'grm_norm': 'cosine_then_gcn', 'self_loops': True, 'use_snp_selection': True, 'num_snps': 30865}. Best is trial 95 with value: 0.2647045825331954.
[I 2025-11-13 11:51:31,391] Trial 97 finished with value: 0.2208643393157109 and parameters: {'model_type': 'graphsage', 'hidden_dims': '[512, 128]', 'dropout': 0.2999529866798495, 'batch_norm': False, 'lr': 0.00023939328408447615, 'weight_decay': 0.0002918639147682043, 'epochs': 71, 'loss': 'mae', 'optimizer': 'adam', 'graph_mode': 'cutoff', 'cutoff': 0.35465014054687266, 'grm_norm': 'cosine_then_gcn', 'self_loops': False, 'use_snp_selection': True, 'num_snps': 28882}. Best is trial 95 with value: 0.2647045825331954.
[I 2025-11-13 11:53:20,060] Trial 98 finished with value: 0.256163242198587 and parameters: {'model_type': 'graphsage', 'hidden_dims': '[512, 128]', 'dropout': 0.3085533118377068, 'batch_norm': False, 'lr': 0.0003255946197225403, 'weight_decay': 2.354543346352893e-05, 'epochs': 107, 'loss': 'mae', 'optimizer': 'adam', 'graph_mode': 'cutoff', 'cutoff': 0.38489437400366777, 'grm_norm': 'cosine_then_gcn', 'self_loops': True, 'use_snp_selection': True, 'num_snps': 32474}. Best is trial 95 with value: 0.2647045825331954.
[I 2025-11-13 11:55:19,332] Trial 99 finished with value: 0.12309606541166133 and parameters: {'model_type': 'graphsage', 'hidden_dims': '[512, 128]', 'dropout': 0.317796957270946, 'batch_norm': False, 'lr': 0.0005334270116305795, 'weight_decay': 2.1408319453496857e-05, 'epochs': 106, 'loss': 'mae', 'optimizer': 'adam', 'graph_mode': 'cutoff', 'cutoff': 0.3780151883139541, 'grm_norm': 'cosine_then_gcn', 'self_loops': False, 'use_snp_selection': True, 'num_snps': 37173}. Best is trial 95 with value: 0.2647045825331954.
[I 2025-11-13 11:56:44,645] Trial 100 finished with value: 0.23215780626061724 and parameters: {'model_type': 'graphsage', 'hidden_dims': '[512, 128]', 'dropout': 0.27443089887292915, 'batch_norm': True, 'lr': 0.00040112600422946435, 'weight_decay': 3.91123703140838e-05, 'epochs': 83, 'loss': 'mae', 'optimizer': 'adam', 'graph_mode': 'cutoff', 'cutoff': 0.3806614819600801, 'grm_norm': 'cosine_then_gcn', 'self_loops': True, 'use_snp_selection': False}. Best is trial 95 with value: 0.2647045825331954.
[I 2025-11-13 11:58:27,189] Trial 101 finished with value: 0.21291270858817857 and parameters: {'model_type': 'graphsage', 'hidden_dims': '[512, 128]', 'dropout': 0.31181569612995313, 'batch_norm': False, 'lr': 0.0002991541659332799, 'weight_decay': 1.4589377967282974e-05, 'epochs': 99, 'loss': 'mae', 'optimizer': 'adam', 'graph_mode': 'cutoff', 'cutoff': 0.39384489630458935, 'grm_norm': 'cosine_then_gcn', 'self_loops': True, 'use_snp_selection': True, 'num_snps': 31850}. Best is trial 95 with value: 0.2647045825331954.
[I 2025-11-13 12:00:09,538] Trial 102 finished with value: 0.15132080114155824 and parameters: {'model_type': 'graphsage', 'hidden_dims': '[512, 128]', 'dropout': 0.33690325359868867, 'batch_norm': False, 'lr': 0.0007263121573794194, 'weight_decay': 1.9102750164319034e-05, 'epochs': 115, 'loss': 'mae', 'optimizer': 'adam', 'graph_mode': 'cutoff', 'cutoff': 0.41825091748838, 'grm_norm': 'cosine_then_gcn', 'self_loops': True, 'use_snp_selection': True, 'num_snps': 29368}. Best is trial 95 with value: 0.2647045825331954.
[I 2025-11-13 12:01:36,675] Trial 103 finished with value: 0.263641969914163 and parameters: {'model_type': 'graphsage', 'hidden_dims': '[512, 128]', 'dropout': 0.25140784760323426, 'batch_norm': False, 'lr': 0.00018962522101300902, 'weight_decay': 7.123563798381533e-05, 'epochs': 93, 'loss': 'mae', 'optimizer': 'adam', 'graph_mode': 'cutoff', 'cutoff': 0.4419321254237658, 'grm_norm': 'cosine_then_gcn', 'self_loops': True, 'use_snp_selection': True, 'num_snps': 26141}. Best is trial 95 with value: 0.2647045825331954.
[I 2025-11-13 12:02:56,828] Trial 104 finished with value: 0.24808963869996314 and parameters: {'model_type': 'graphsage', 'hidden_dims': '[512, 128]', 'dropout': 0.2648124118981315, 'batch_norm': False, 'lr': 0.00018827968861091077, 'weight_decay': 0.0001036411200905302, 'epochs': 63, 'loss': 'mae', 'optimizer': 'adam', 'graph_mode': 'cutoff', 'cutoff': 0.33968407582638555, 'grm_norm': 'cosine_then_gcn', 'self_loops': True, 'use_snp_selection': True, 'num_snps': 25895}. Best is trial 95 with value: 0.2647045825331954.
[I 2025-11-13 12:04:04,907] Trial 105 finished with value: 0.2205203282010299 and parameters: {'model_type': 'graphsage', 'hidden_dims': '[512, 128]', 'dropout': 0.25240788421849253, 'batch_norm': False, 'lr': 0.0003327479456485512, 'weight_decay': 6.924031338482369e-05, 'epochs': 51, 'loss': 'mae', 'optimizer': 'adam', 'graph_mode': 'cutoff', 'cutoff': 0.4203288743663447, 'grm_norm': 'cosine_then_gcn', 'self_loops': True, 'use_snp_selection': True, 'num_snps': 20891}. Best is trial 95 with value: 0.2647045825331954.
[I 2025-11-13 12:05:46,480] Trial 106 finished with value: 0.24395275329889446 and parameters: {'model_type': 'graphsage', 'hidden_dims': '[512, 128]', 'dropout': 0.2415400892490545, 'batch_norm': False, 'lr': 0.00021986598403058016, 'weight_decay': 2.408934883211846e-05, 'epochs': 92, 'loss': 'mae', 'optimizer': 'adam', 'graph_mode': 'cutoff', 'cutoff': 0.3958878657089361, 'grm_norm': 'cosine_then_gcn', 'self_loops': False, 'use_snp_selection': True, 'num_snps': 32749}. Best is trial 95 with value: 0.2647045825331954.
[I 2025-11-13 12:07:15,722] Trial 107 finished with value: 0.22831596383485633 and parameters: {'model_type': 'graphsage', 'hidden_dims': '[512, 128]', 'dropout': 0.27830656672399046, 'batch_norm': False, 'lr': 0.00041304590341851064, 'weight_decay': 5.080502225034184e-05, 'epochs': 106, 'loss': 'mae', 'optimizer': 'adam', 'graph_mode': 'cutoff', 'cutoff': 0.5026487606265927, 'grm_norm': 'cosine_then_gcn', 'self_loops': True, 'use_snp_selection': True, 'num_snps': 27331}. Best is trial 95 with value: 0.2647045825331954.
[I 2025-11-13 12:08:58,493] Trial 108 finished with value: 0.24692208110697042 and parameters: {'model_type': 'graphsage', 'hidden_dims': '[512, 128]', 'dropout': 0.2893332778861591, 'batch_norm': False, 'lr': 0.0001532648253736785, 'weight_decay': 5.827241444703536e-05, 'epochs': 73, 'loss': 'mae', 'optimizer': 'adam', 'graph_mode': 'cutoff', 'cutoff': 0.31956951101068065, 'grm_norm': 'cosine_then_gcn', 'self_loops': True, 'use_snp_selection': True, 'num_snps': 34529}. Best is trial 95 with value: 0.2647045825331954.
[I 2025-11-13 12:10:36,503] Trial 109 finished with value: 0.21855301439040442 and parameters: {'model_type': 'graphsage', 'hidden_dims': '[512, 128]', 'dropout': 0.3618045382139415, 'batch_norm': False, 'lr': 0.00027206165805004516, 'weight_decay': 0.00014625475209370845, 'epochs': 84, 'loss': 'mae', 'optimizer': 'adam', 'graph_mode': 'cutoff', 'cutoff': 0.352403931575587, 'grm_norm': 'none', 'self_loops': False, 'use_snp_selection': True, 'num_snps': 31563}. Best is trial 95 with value: 0.2647045825331954.
[I 2025-11-13 12:12:31,476] Trial 110 finished with value: 0.23552660377233692 and parameters: {'model_type': 'graphsage', 'hidden_dims': '[512, 128]', 'dropout': 0.30709821694375794, 'batch_norm': False, 'lr': 0.00016505792653347492, 'weight_decay': 2.7194941471841172e-05, 'epochs': 95, 'loss': 'mae', 'optimizer': 'adam', 'graph_mode': 'cutoff', 'cutoff': 0.43665433889513816, 'grm_norm': 'cosine_then_gcn', 'self_loops': True, 'use_snp_selection': True, 'num_snps': 39225}. Best is trial 95 with value: 0.2647045825331954.
[I 2025-11-13 12:14:26,969] Trial 111 finished with value: 0.25263328230144777 and parameters: {'model_type': 'graphsage', 'hidden_dims': '[512, 128]', 'dropout': 0.34649152146630813, 'batch_norm': False, 'lr': 0.00012363755258087698, 'weight_decay': 4.05601415566213e-05, 'epochs': 110, 'loss': 'mae', 'optimizer': 'adam', 'graph_mode': 'cutoff', 'cutoff': 0.441581072889094, 'grm_norm': 'cosine_then_gcn', 'self_loops': True, 'use_snp_selection': True, 'num_snps': 36688}. Best is trial 95 with value: 0.2647045825331954.
[I 2025-11-13 12:16:22,894] Trial 112 finished with value: 0.25267845775924 and parameters: {'model_type': 'graphsage', 'hidden_dims': '[512, 128]', 'dropout': 0.3470363198469854, 'batch_norm': False, 'lr': 0.00012336301365537935, 'weight_decay': 4.129766542716006e-05, 'epochs': 109, 'loss': 'mae', 'optimizer': 'adam', 'graph_mode': 'cutoff', 'cutoff': 0.4685131896508844, 'grm_norm': 'cosine_then_gcn', 'self_loops': True, 'use_snp_selection': True, 'num_snps': 36286}. Best is trial 95 with value: 0.2647045825331954.
[I 2025-11-13 12:18:11,534] Trial 113 finished with value: 0.23094467403716576 and parameters: {'model_type': 'graphsage', 'hidden_dims': '[512, 128]', 'dropout': 0.345276562481275, 'batch_norm': False, 'lr': 0.00019148706012210313, 'weight_decay': 6.0825250402221474e-05, 'epochs': 103, 'loss': 'mae', 'optimizer': 'adam', 'graph_mode': 'cutoff', 'cutoff': 0.46234499965762776, 'grm_norm': 'cosine_then_gcn', 'self_loops': True, 'use_snp_selection': True, 'num_snps': 34870}. Best is trial 95 with value: 0.2647045825331954.
[I 2025-11-13 12:19:41,256] Trial 114 finished with value: 0.25644852000027163 and parameters: {'model_type': 'graphsage', 'hidden_dims': '[512, 128]', 'dropout': 0.3233487364166458, 'batch_norm': False, 'lr': 0.00011478212034099101, 'weight_decay': 4.032123822388914e-05, 'epochs': 89, 'loss': 'mae', 'optimizer': 'adam', 'graph_mode': 'cutoff', 'cutoff': 0.4945587245543398, 'grm_norm': 'cosine_then_gcn', 'self_loops': True, 'use_snp_selection': True, 'num_snps': 29875}. Best is trial 95 with value: 0.2647045825331954.
[I 2025-11-13 12:20:53,903] Trial 115 finished with value: 0.2427470550843486 and parameters: {'model_type': 'graphsage', 'hidden_dims': '[512, 128]', 'dropout': 0.33269170246750657, 'batch_norm': False, 'lr': 0.00011499933755395006, 'weight_decay': 8.288697826220043e-05, 'epochs': 77, 'loss': 'mae', 'optimizer': 'adam', 'graph_mode': 'cutoff', 'cutoff': 0.48567136273769584, 'grm_norm': 'none', 'self_loops': True, 'use_snp_selection': True, 'num_snps': 21650}. Best is trial 95 with value: 0.2647045825331954.
[I 2025-11-13 12:23:29,779] Trial 116 finished with value: 0.21319157030120764 and parameters: {'model_type': 'graphsage', 'hidden_dims': '[512, 128]', 'dropout': 0.3262959968838653, 'batch_norm': False, 'lr': 0.0001416780003897217, 'weight_decay': 3.473803928751767e-05, 'epochs': 315, 'loss': 'mse', 'optimizer': 'adam', 'graph_mode': 'cutoff', 'cutoff': 0.5118567548134649, 'grm_norm': 'cosine_then_gcn', 'self_loops': False, 'use_snp_selection': True, 'num_snps': 30096}. Best is trial 95 with value: 0.2647045825331954.
