[I 2025-11-03 13:01:41,627] Trial 110 finished with value: 0.04633938800054038 and parameters: {'model_type': 'gcn', 'hidden_dims': '[512, 256]', 'dropout': 0.3982984259491279, 'batch_norm': True, 'lr': 0.0007765843926369988, 'weight_decay': 1.8097690925897743e-05, 'epochs': 314, 'loss': 'mse', 'optimizer': 'adam', 'graph_mode': 'cutoff', 'cutoff': 0.3690920126596622, 'grm_norm': 'cosine', 'self_loops': False, 'use_snp_selection': False}. Best is trial 29 with value: 0.0909837172005828.
[I 2025-11-03 13:01:44,519] Trial 111 finished with value: 0.05244660353926392 and parameters: {'model_type': 'gcn', 'hidden_dims': '[512, 256]', 'dropout': 0.3410524574581245, 'batch_norm': True, 'lr': 0.0004726304627383526, 'weight_decay': 4.0670790992970405e-05, 'epochs': 265, 'loss': 'mse', 'optimizer': 'adam', 'graph_mode': 'cutoff', 'cutoff': 0.3306750433787842, 'grm_norm': 'cosine', 'self_loops': False, 'use_snp_selection': False}. Best is trial 29 with value: 0.0909837172005828.
[I 2025-11-03 13:01:47,589] Trial 112 finished with value: 0.03570295170789426 and parameters: {'model_type': 'gcn', 'hidden_dims': '[512, 256]', 'dropout': 0.32066933935698533, 'batch_norm': True, 'lr': 0.00039729416562624565, 'weight_decay': 6.0025687205281945e-06, 'epochs': 295, 'loss': 'mse', 'optimizer': 'adam', 'graph_mode': 'cutoff', 'cutoff': 0.5097256018341905, 'grm_norm': 'cosine', 'self_loops': False, 'use_snp_selection': False}. Best is trial 29 with value: 0.0909837172005828.
[I 2025-11-03 13:01:50,523] Trial 113 finished with value: 0.05394284130278289 and parameters: {'model_type': 'gcn', 'hidden_dims': '[512, 256]', 'dropout': 0.3769199764606432, 'batch_norm': True, 'lr': 0.000640202634543815, 'weight_decay': 1.969542131322351e-05, 'epochs': 275, 'loss': 'mse', 'optimizer': 'adam', 'graph_mode': 'cutoff', 'cutoff': 0.38128326040823807, 'grm_norm': 'cosine', 'self_loops': False, 'use_snp_selection': False}. Best is trial 29 with value: 0.0909837172005828.
[I 2025-11-03 13:01:52,606] Trial 114 finished with value: 0.03747417209443326 and parameters: {'model_type': 'gcn', 'hidden_dims': '[256, 128]', 'dropout': 0.34811221238059376, 'batch_norm': True, 'lr': 0.00033149658487684506, 'weight_decay': 2.6742111355397995e-05, 'epochs': 255, 'loss': 'mse', 'optimizer': 'adam', 'graph_mode': 'cutoff', 'cutoff': 0.35685479808586196, 'grm_norm': 'cosine', 'self_loops': False, 'use_snp_selection': False}. Best is trial 29 with value: 0.0909837172005828.
[I 2025-11-03 13:01:55,479] Trial 115 finished with value: 0.04154121140056861 and parameters: {'model_type': 'gcn', 'hidden_dims': '[512, 256]', 'dropout': 0.24984577799408386, 'batch_norm': True, 'lr': 2.1099857452763695e-06, 'weight_decay': 7.911597335016437e-06, 'epochs': 265, 'loss': 'mse', 'optimizer': 'adam', 'graph_mode': 'knn', 'source': 'grm', 'knn_k': 2, 'weighted_edges': True, 'symmetrize_mode': 'mutual', 'use_snp_selection': False}. Best is trial 29 with value: 0.0909837172005828.
[I 2025-11-03 13:01:57,874] Trial 116 finished with value: 0.034882575939543484 and parameters: {'model_type': 'gcn', 'hidden_dims': '[256, 128]', 'dropout': 0.38734148797302587, 'batch_norm': True, 'lr': 0.0005118300829102418, 'weight_decay': 1.0320445153392586e-05, 'epochs': 333, 'loss': 'mae', 'optimizer': 'adam', 'graph_mode': 'cutoff', 'cutoff': 0.8341497155922593, 'grm_norm': 'gcn', 'self_loops': True, 'use_snp_selection': False}. Best is trial 29 with value: 0.0909837172005828.
[I 2025-11-03 13:01:59,498] Trial 117 finished with value: 0.04108474608258468 and parameters: {'model_type': 'gcn', 'hidden_dims': '[128, 64]', 'dropout': 0.4100256767732282, 'batch_norm': True, 'lr': 0.0008435367889558536, 'weight_decay': 3.2518679671736e-05, 'epochs': 222, 'loss': 'mse', 'optimizer': 'adam', 'graph_mode': 'cutoff', 'cutoff': 0.5430369694739683, 'grm_norm': 'cosine', 'self_loops': False, 'use_snp_selection': False}. Best is trial 29 with value: 0.0909837172005828.
[I 2025-11-03 13:02:00,907] Trial 118 finished with value: 0.04601859427967493 and parameters: {'model_type': 'gcn', 'hidden_dims': '[512, 128]', 'dropout': 0.5669191532392704, 'batch_norm': True, 'lr': 0.0005655415856870138, 'weight_decay': 1.9955984182916584e-06, 'epochs': 15, 'loss': 'mse', 'optimizer': 'adam', 'graph_mode': 'knn', 'source': 'grm', 'knn_k': 9, 'weighted_edges': False, 'symmetrize_mode': 'union', 'use_snp_selection': False}. Best is trial 29 with value: 0.0909837172005828.
[I 2025-11-03 13:02:03,874] Trial 119 finished with value: 0.04169414277389484 and parameters: {'model_type': 'gcn', 'hidden_dims': '[512, 256]', 'dropout': 0.5874990184140909, 'batch_norm': True, 'lr': 0.00040455241482481846, 'weight_decay': 5.743593166221398e-06, 'epochs': 280, 'loss': 'mse', 'optimizer': 'adam', 'graph_mode': 'cutoff', 'cutoff': 0.31282259286253883, 'grm_norm': 'cosine', 'self_loops': True, 'use_snp_selection': False}. Best is trial 29 with value: 0.0909837172005828.
[I 2025-11-03 13:02:05,334] Trial 120 finished with value: 0.017740086939428152 and parameters: {'model_type': 'gcn', 'hidden_dims': '[256, 128, 64]', 'dropout': 0.36936133135298654, 'batch_norm': True, 'lr': 0.0002315173653530078, 'weight_decay': 2.2509056818627678e-05, 'epochs': 76, 'loss': 'mse', 'optimizer': 'adam', 'graph_mode': 'cutoff', 'cutoff': 0.48472773215244735, 'grm_norm': 'cosine', 'self_loops': False, 'use_snp_selection': False}. Best is trial 29 with value: 0.0909837172005828.
[I 2025-11-03 13:02:08,219] Trial 121 finished with value: 0.052661116527095556 and parameters: {'model_type': 'gcn', 'hidden_dims': '[512, 256]', 'dropout': 0.35846194524694563, 'batch_norm': True, 'lr': 0.000618760482463463, 'weight_decay': 1.9722023717497647e-05, 'epochs': 273, 'loss': 'mse', 'optimizer': 'adam', 'graph_mode': 'cutoff', 'cutoff': 0.3852155637899327, 'grm_norm': 'cosine', 'self_loops': False, 'use_snp_selection': False}. Best is trial 29 with value: 0.0909837172005828.
[I 2025-11-03 13:02:11,231] Trial 122 finished with value: 0.05350974378866488 and parameters: {'model_type': 'gcn', 'hidden_dims': '[512, 256]', 'dropout': 0.38145512983646956, 'batch_norm': True, 'lr': 0.0006623300030270158, 'weight_decay': 1.6924026260557262e-05, 'epochs': 294, 'loss': 'mse', 'optimizer': 'adam', 'graph_mode': 'cutoff', 'cutoff': 0.4162103144511796, 'grm_norm': 'cosine', 'self_loops': False, 'use_snp_selection': False}. Best is trial 29 with value: 0.0909837172005828.
[I 2025-11-03 13:02:14,094] Trial 123 finished with value: 0.03911174696213566 and parameters: {'model_type': 'gcn', 'hidden_dims': '[512, 256]', 'dropout': 0.5525699370181801, 'batch_norm': True, 'lr': 0.0009831685952673577, 'weight_decay': 1.2545688637325414e-05, 'epochs': 263, 'loss': 'mse', 'optimizer': 'adam', 'graph_mode': 'cutoff', 'cutoff': 0.34521883218903543, 'grm_norm': 'cosine', 'self_loops': False, 'use_snp_selection': False}. Best is trial 29 with value: 0.0909837172005828.
[I 2025-11-03 13:02:16,312] Trial 124 finished with value: 0.06708362020501048 and parameters: {'model_type': 'gcn', 'hidden_dims': '[512, 256]', 'dropout': 0.44415438291995607, 'batch_norm': True, 'lr': 4.860886391827054e-05, 'weight_decay': 9.731150329543582e-06, 'epochs': 160, 'loss': 'mse', 'optimizer': 'adam', 'graph_mode': 'cutoff', 'cutoff': 0.26169619674017214, 'grm_norm': 'cosine', 'self_loops': False, 'use_snp_selection': False}. Best is trial 29 with value: 0.0909837172005828.
[I 2025-11-03 13:02:17,990] Trial 125 finished with value: 0.044492278203750645 and parameters: {'model_type': 'gcn', 'hidden_dims': '[256, 128]', 'dropout': 0.4476107444874702, 'batch_norm': True, 'lr': 0.0001404500403280712, 'weight_decay': 1.0034519540211571e-05, 'epochs': 155, 'loss': 'mse', 'optimizer': 'adam', 'graph_mode': 'cutoff', 'cutoff': 0.271244091938264, 'grm_norm': 'none', 'self_loops': False, 'use_snp_selection': False}. Best is trial 29 with value: 0.0909837172005828.
[I 2025-11-03 13:02:20,325] Trial 126 finished with value: 0.08205484864612725 and parameters: {'model_type': 'gcn', 'hidden_dims': '[512, 128]', 'dropout': 0.42217276398611736, 'batch_norm': True, 'lr': 6.099070977726136e-05, 'weight_decay': 0.0006095920408934416, 'epochs': 171, 'loss': 'mae', 'optimizer': 'adam', 'graph_mode': 'knn', 'source': 'grm', 'knn_k': 8, 'weighted_edges': False, 'symmetrize_mode': 'mutual', 'use_snp_selection': False}. Best is trial 29 with value: 0.0909837172005828.
[I 2025-11-03 13:02:22,620] Trial 127 finished with value: 0.04576806114285676 and parameters: {'model_type': 'gcn', 'hidden_dims': '[512, 128]', 'dropout': 0.3948453406093615, 'batch_norm': True, 'lr': 3.7249712255863266e-05, 'weight_decay': 1.432947734632487e-06, 'epochs': 165, 'loss': 'mae', 'optimizer': 'adam', 'graph_mode': 'knn', 'source': 'grm', 'knn_k': 8, 'weighted_edges': False, 'symmetrize_mode': 'mutual', 'use_snp_selection': False}. Best is trial 29 with value: 0.0909837172005828.
[I 2025-11-03 13:02:24,927] Trial 128 finished with value: 0.04240649068458588 and parameters: {'model_type': 'gcn', 'hidden_dims': '[512, 128]', 'dropout': 0.40876708767027553, 'batch_norm': False, 'lr': 3.317773791322597e-05, 'weight_decay': 0.000638883744620622, 'epochs': 179, 'loss': 'mae', 'optimizer': 'adam', 'graph_mode': 'knn', 'source': 'grm', 'knn_k': 7, 'weighted_edges': False, 'symmetrize_mode': 'mutual', 'use_snp_selection': True, 'num_snps': 23993}. Best is trial 29 with value: 0.0909837172005828.
[I 2025-11-03 13:02:26,536] Trial 129 finished with value: 0.052561923391437115 and parameters: {'model_type': 'gcn', 'hidden_dims': '[128, 64]', 'dropout': 0.4174036645041296, 'batch_norm': True, 'lr': 7.531953285381244e-05, 'weight_decay': 0.00026174075473570975, 'epochs': 197, 'loss': 'mae', 'optimizer': 'adam', 'graph_mode': 'knn', 'source': 'grm', 'knn_k': 8, 'weighted_edges': False, 'symmetrize_mode': 'mutual', 'use_snp_selection': False}. Best is trial 29 with value: 0.0909837172005828.
[I 2025-11-03 13:02:28,701] Trial 130 finished with value: 0.02268266182420403 and parameters: {'model_type': 'gcn', 'hidden_dims': '[512, 256]', 'dropout': 0.4250498991200765, 'batch_norm': True, 'lr': 0.00011295669474795422, 'weight_decay': 0.000726289450559809, 'epochs': 143, 'loss': 'mae', 'optimizer': 'adam', 'graph_mode': 'knn', 'source': 'grm', 'knn_k': 5, 'weighted_edges': False, 'symmetrize_mode': 'mutual', 'use_snp_selection': False}. Best is trial 29 with value: 0.0909837172005828.
[I 2025-11-03 13:02:31,057] Trial 131 finished with value: 0.03209667286422899 and parameters: {'model_type': 'gcn', 'hidden_dims': '[512, 128]', 'dropout': 0.4388429752205897, 'batch_norm': True, 'lr': 6.157612569331269e-05, 'weight_decay': 4.8499232497744e-06, 'epochs': 175, 'loss': 'mae', 'optimizer': 'adam', 'graph_mode': 'knn', 'source': 'grm', 'knn_k': 6, 'weighted_edges': False, 'symmetrize_mode': 'mutual', 'use_snp_selection': False}. Best is trial 29 with value: 0.0909837172005828.
[I 2025-11-03 13:02:33,108] Trial 132 finished with value: 0.015230159712166267 and parameters: {'model_type': 'gcn', 'hidden_dims': '[512, 128]', 'dropout': 0.46306535484576333, 'batch_norm': True, 'lr': 4.890742647144973e-05, 'weight_decay': 1.8685869043425262e-07, 'epochs': 132, 'loss': 'mse', 'optimizer': 'adam', 'graph_mode': 'cutoff', 'cutoff': 0.29000896927976955, 'grm_norm': 'cosine', 'self_loops': False, 'use_snp_selection': False}. Best is trial 29 with value: 0.0909837172005828.
[I 2025-11-03 13:02:35,490] Trial 133 finished with value: 0.014131122751116103 and parameters: {'model_type': 'gcn', 'hidden_dims': '[512, 128]', 'dropout': 0.4927020675329444, 'batch_norm': True, 'lr': 8.911784218435172e-05, 'weight_decay': 7.3898307499176785e-06, 'epochs': 182, 'loss': 'mse', 'optimizer': 'adam', 'graph_mode': 'knn', 'source': 'grm', 'knn_k': 4, 'weighted_edges': False, 'symmetrize_mode': 'mutual', 'use_snp_selection': False}. Best is trial 29 with value: 0.0909837172005828.
[I 2025-11-03 13:02:37,670] Trial 134 finished with value: 0.03966662764333425 and parameters: {'model_type': 'gcn', 'hidden_dims': '[512, 128]', 'dropout': 0.19167784526808568, 'batch_norm': True, 'lr': 4.313005852617851e-05, 'weight_decay': 3.910323397067099e-06, 'epochs': 152, 'loss': 'mse', 'optimizer': 'adam', 'graph_mode': 'cutoff', 'cutoff': 0.25522881309690326, 'grm_norm': 'cosine_then_gcn', 'self_loops': True, 'use_snp_selection': False}. Best is trial 29 with value: 0.0909837172005828.
[I 2025-11-03 13:02:39,965] Trial 135 finished with value: 0.06241549383720234 and parameters: {'model_type': 'gcn', 'hidden_dims': '[512, 128]', 'dropout': 0.21000823265622368, 'batch_norm': True, 'lr': 5.7083578653904485e-05, 'weight_decay': 0.00020093276466315278, 'epochs': 165, 'loss': 'mae', 'optimizer': 'adam', 'graph_mode': 'cutoff', 'cutoff': 0.31631291900002506, 'grm_norm': 'cosine', 'self_loops': False, 'use_snp_selection': False}. Best is trial 29 with value: 0.0909837172005828.
[I 2025-11-03 13:02:42,194] Trial 136 finished with value: 0.03249473744506031 and parameters: {'model_type': 'gcn', 'hidden_dims': '[512, 64]', 'dropout': 0.21110757703948338, 'batch_norm': True, 'lr': 2.341819759435165e-05, 'weight_decay': 0.0004400017518702484, 'epochs': 159, 'loss': 'mae', 'optimizer': 'adam', 'graph_mode': 'cutoff', 'cutoff': 0.328358455482653, 'grm_norm': 'cosine', 'self_loops': False, 'use_snp_selection': False}. Best is trial 29 with value: 0.0909837172005828.
[I 2025-11-03 13:02:44,532] Trial 137 finished with value: 0.025014370489388846 and parameters: {'model_type': 'gcn', 'hidden_dims': '[512, 128]', 'dropout': 0.16254465215460429, 'batch_norm': True, 'lr': 5.061386783036208e-05, 'weight_decay': 0.00028586974338916816, 'epochs': 167, 'loss': 'mae', 'optimizer': 'adam', 'graph_mode': 'knn', 'source': 'grm', 'knn_k': 9, 'weighted_edges': True, 'symmetrize_mode': 'union', 'use_snp_selection': False}. Best is trial 29 with value: 0.0909837172005828.
[I 2025-11-03 13:02:46,481] Trial 138 finished with value: 0.07387435755707036 and parameters: {'model_type': 'gcn', 'hidden_dims': '[256, 128]', 'dropout': 0.22476629313978203, 'batch_norm': True, 'lr': 7.627515575579964e-05, 'weight_decay': 0.00017395562125463405, 'epochs': 213, 'loss': 'mae', 'optimizer': 'adam', 'graph_mode': 'cutoff', 'cutoff': 0.2305298107977359, 'grm_norm': 'cosine', 'self_loops': False, 'use_snp_selection': False}. Best is trial 29 with value: 0.0909837172005828.
[I 2025-11-03 13:02:48,446] Trial 139 finished with value: 0.03286717665309724 and parameters: {'model_type': 'gcn', 'hidden_dims': '[256, 128]', 'dropout': 0.22785215513714918, 'batch_norm': True, 'lr': 5.459716656690339e-05, 'weight_decay': 8.911605342728902e-05, 'epochs': 217, 'loss': 'mae', 'optimizer': 'adam', 'graph_mode': 'cutoff', 'cutoff': 0.21766199957085525, 'grm_norm': 'cosine', 'self_loops': False, 'use_snp_selection': False}. Best is trial 29 with value: 0.0909837172005828.
[I 2025-11-03 13:02:50,502] Trial 140 finished with value: 0.03829934431672511 and parameters: {'model_type': 'gcn', 'hidden_dims': '[256, 128]', 'dropout': 0.21041684136204372, 'batch_norm': True, 'lr': 6.810143288464046e-05, 'weight_decay': 0.0004969701224841244, 'epochs': 230, 'loss': 'mae', 'optimizer': 'adam', 'graph_mode': 'knn', 'source': 'grm', 'knn_k': 4, 'weighted_edges': False, 'symmetrize_mode': 'union', 'use_snp_selection': False}. Best is trial 29 with value: 0.0909837172005828.
[I 2025-11-03 13:02:52,436] Trial 141 finished with value: 0.04369859881978936 and parameters: {'model_type': 'gcn', 'hidden_dims': '[256, 128]', 'dropout': 0.24145933761030322, 'batch_norm': True, 'lr': 6.418365857810217e-05, 'weight_decay': 0.00019266561587632302, 'epochs': 211, 'loss': 'mae', 'optimizer': 'adam', 'graph_mode': 'cutoff', 'cutoff': 0.22773895362505825, 'grm_norm': 'cosine', 'self_loops': False, 'use_snp_selection': False}. Best is trial 29 with value: 0.0909837172005828.
[I 2025-11-03 13:02:54,302] Trial 142 finished with value: 0.03128353153479255 and parameters: {'model_type': 'gcn', 'hidden_dims': '[256, 128]', 'dropout': 0.20305380652650767, 'batch_norm': True, 'lr': 4.330031397203034e-05, 'weight_decay': 0.00014736406243611122, 'epochs': 192, 'loss': 'mae', 'optimizer': 'adam', 'graph_mode': 'cutoff', 'cutoff': 0.26649457046215647, 'grm_norm': 'cosine', 'self_loops': False, 'use_snp_selection': False}. Best is trial 29 with value: 0.0909837172005828.
[I 2025-11-03 13:02:57,040] Trial 143 finished with value: 0.05797812295397711 and parameters: {'model_type': 'gcn', 'hidden_dims': '[512, 128]', 'dropout': 0.2570050778460992, 'batch_norm': True, 'lr': 8.19419406604804e-05, 'weight_decay': 0.0001302431793622745, 'epochs': 243, 'loss': 'mae', 'optimizer': 'adam', 'graph_mode': 'cutoff', 'cutoff': 0.23821013379744577, 'grm_norm': 'cosine', 'self_loops': False, 'use_snp_selection': False}. Best is trial 29 with value: 0.0909837172005828.
[I 2025-11-03 13:02:59,791] Trial 144 finished with value: 0.020616022703333275 and parameters: {'model_type': 'gcn', 'hidden_dims': '[512, 128]', 'dropout': 0.28152594515629636, 'batch_norm': True, 'lr': 7.355227716628422e-05, 'weight_decay': 0.00013795372698234378, 'epochs': 245, 'loss': 'mae', 'optimizer': 'adam', 'graph_mode': 'cutoff', 'cutoff': 0.24413949533935084, 'grm_norm': 'cosine', 'self_loops': False, 'use_snp_selection': False}. Best is trial 29 with value: 0.0909837172005828.
[I 2025-11-03 13:03:02,509] Trial 145 finished with value: 0.07376964552460914 and parameters: {'model_type': 'gcn', 'hidden_dims': '[512, 128]', 'dropout': 0.23239052201864624, 'batch_norm': True, 'lr': 8.981645283876243e-05, 'weight_decay': 0.00024317703181534755, 'epochs': 240, 'loss': 'mae', 'optimizer': 'adam', 'graph_mode': 'cutoff', 'cutoff': 0.20480921279506936, 'grm_norm': 'cosine', 'self_loops': False, 'use_snp_selection': False}. Best is trial 29 with value: 0.0909837172005828.
[I 2025-11-03 13:03:05,154] Trial 146 finished with value: 0.042299062789243856 and parameters: {'model_type': 'gcn', 'hidden_dims': '[512, 128]', 'dropout': 0.22815214241950643, 'batch_norm': True, 'lr': 9.687375645370202e-05, 'weight_decay': 0.00035900273878563686, 'epochs': 228, 'loss': 'mae', 'optimizer': 'adam', 'graph_mode': 'cutoff', 'cutoff': 0.22083150154323103, 'grm_norm': 'cosine', 'self_loops': False, 'use_snp_selection': False}. Best is trial 29 with value: 0.0909837172005828.
[I 2025-11-03 13:03:07,845] Trial 147 finished with value: 0.06126462271957441 and parameters: {'model_type': 'gcn', 'hidden_dims': '[512, 128]', 'dropout': 0.18693991971801088, 'batch_norm': True, 'lr': 0.00011200780759197195, 'weight_decay': 0.0001917713592363713, 'epochs': 237, 'loss': 'mae', 'optimizer': 'adam', 'graph_mode': 'cutoff', 'cutoff': 0.2603339927654186, 'grm_norm': 'gcn', 'self_loops': False, 'use_snp_selection': False}. Best is trial 29 with value: 0.0909837172005828.
[I 2025-11-03 13:03:10,623] Trial 148 finished with value: 0.07422992168162203 and parameters: {'model_type': 'gcn', 'hidden_dims': '[512, 128]', 'dropout': 0.21955658633662514, 'batch_norm': True, 'lr': 8.045783336862345e-05, 'weight_decay': 0.00022453303470279824, 'epochs': 251, 'loss': 'mae', 'optimizer': 'adam', 'graph_mode': 'cutoff', 'cutoff': 0.25834407721168606, 'grm_norm': 'gcn', 'self_loops': False, 'use_snp_selection': False}. Best is trial 29 with value: 0.0909837172005828.
[I 2025-11-03 13:03:13,749] Trial 149 finished with value: 0.026932609919749835 and parameters: {'model_type': 'gcn', 'hidden_dims': '[512, 128]', 'dropout': 0.18248012159819574, 'batch_norm': False, 'lr': 0.00012359250620951637, 'weight_decay': 0.0002155250687255802, 'epochs': 251, 'loss': 'mae', 'optimizer': 'adam', 'graph_mode': 'cutoff', 'cutoff': 0.2082514616232815, 'grm_norm': 'gcn', 'self_loops': False, 'use_snp_selection': True, 'num_snps': 36015}. Best is trial 29 with value: 0.0909837172005828.
[I 2025-11-03 13:03:16,054] Trial 0 finished with value: -0.01914000722773275 and parameters: {'model_type': 'gcn', 'hidden_dims': '[128, 64]', 'dropout': 0.199031432379812, 'batch_norm': True, 'lr': 1.8408544111075837e-06, 'weight_decay': 5.5136510071208614e-05, 'epochs': 334, 'loss': 'mae', 'optimizer': 'adam', 'graph_mode': 'knn', 'source': 'grm', 'knn_k': 8, 'weighted_edges': True, 'symmetrize_mode': 'mutual', 'use_snp_selection': False}. Best is trial 0 with value: -0.01914000722773275.
[I 2025-11-03 13:03:17,185] Trial 1 finished with value: 0.002873854580978096 and parameters: {'model_type': 'gcn', 'hidden_dims': '[128, 64]', 'dropout': 0.40051947670227217, 'batch_norm': True, 'lr': 0.0005320428882732732, 'weight_decay': 1.89210117736594e-06, 'epochs': 32, 'loss': 'mse', 'optimizer': 'adam', 'graph_mode': 'knn', 'source': 'grm', 'knn_k': 7, 'weighted_edges': True, 'symmetrize_mode': 'union', 'use_snp_selection': False}. Best is trial 1 with value: 0.002873854580978096.
[I 2025-11-03 13:03:19,739] Trial 2 finished with value: 0.05336149130664805 and parameters: {'model_type': 'gcn', 'hidden_dims': '[256, 128]', 'dropout': 0.5105528289184642, 'batch_norm': False, 'lr': 0.0006804279372404962, 'weight_decay': 0.0008922815224257085, 'epochs': 160, 'loss': 'mse', 'optimizer': 'adam', 'graph_mode': 'cutoff', 'cutoff': 0.5741905641612706, 'grm_norm': 'gcn', 'self_loops': False, 'use_snp_selection': True, 'num_snps': 26910}. Best is trial 2 with value: 0.05336149130664805.
[I 2025-11-03 13:03:22,376] Trial 3 finished with value: 0.02107042057677387 and parameters: {'model_type': 'gcn', 'hidden_dims': '[256, 128, 64]', 'dropout': 0.5390483213624292, 'batch_norm': False, 'lr': 3.4705625989073525e-05, 'weight_decay': 2.4623319020131338e-05, 'epochs': 92, 'loss': 'mse', 'optimizer': 'adam', 'graph_mode': 'knn', 'source': 'grm', 'knn_k': 6, 'weighted_edges': False, 'symmetrize_mode': 'mutual', 'use_snp_selection': True, 'num_snps': 30713}. Best is trial 2 with value: 0.05336149130664805.
