[I 2025-11-03 15:31:31,679] Trial 33 finished with value: -0.01436632569197045 and parameters: {'model_type': 'graphsage', 'hidden_dims': '[512, 256]', 'dropout': 0.5290836444068978, 'batch_norm': True, 'lr': 2.0753006434196728e-05, 'weight_decay': 6.51436800110959e-06, 'epochs': 117, 'loss': 'mse', 'optimizer': 'adam', 'graph_mode': 'cutoff', 'cutoff': 0.7907485672713648, 'grm_norm': 'gcn', 'self_loops': False, 'use_snp_selection': False}. Best is trial 16 with value: 0.052214761853149355.
[I 2025-11-03 15:31:33,213] Trial 34 finished with value: 0.01974406030409918 and parameters: {'model_type': 'graphsage', 'hidden_dims': '[128, 64]', 'dropout': 0.38955321767640383, 'batch_norm': True, 'lr': 5.845033843583004e-05, 'weight_decay': 1.4402757717500342e-05, 'epochs': 89, 'loss': 'mse', 'optimizer': 'adam', 'graph_mode': 'knn', 'source': 'grm', 'knn_k': 4, 'weighted_edges': False, 'symmetrize_mode': 'union', 'use_snp_selection': False}. Best is trial 16 with value: 0.052214761853149355.
[I 2025-11-03 15:31:36,953] Trial 35 finished with value: 0.046196431174889974 and parameters: {'model_type': 'graphsage', 'hidden_dims': '[512, 64]', 'dropout': 0.31786400447784807, 'batch_norm': True, 'lr': 2.7454369656071065e-05, 'weight_decay': 3.572952179221173e-05, 'epochs': 204, 'loss': 'mse', 'optimizer': 'adam', 'graph_mode': 'cutoff', 'cutoff': 0.6852076717553344, 'grm_norm': 'gcn', 'self_loops': False, 'use_snp_selection': False}. Best is trial 16 with value: 0.052214761853149355.
[I 2025-11-03 15:31:40,030] Trial 36 finished with value: 0.028776586309618116 and parameters: {'model_type': 'graphsage', 'hidden_dims': '[256, 128]', 'dropout': 0.19335268411629158, 'batch_norm': False, 'lr': 3.204275544106238e-05, 'weight_decay': 9.951114243941198e-06, 'epochs': 173, 'loss': 'mae', 'optimizer': 'adam', 'graph_mode': 'knn', 'source': 'grm', 'knn_k': 10, 'weighted_edges': False, 'symmetrize_mode': 'union', 'use_snp_selection': True, 'num_snps': 34711}. Best is trial 16 with value: 0.052214761853149355.
[I 2025-11-03 15:31:42,086] Trial 37 finished with value: 0.026418039187950746 and parameters: {'model_type': 'graphsage', 'hidden_dims': '[256, 128, 64]', 'dropout': 0.22968692551742942, 'batch_norm': True, 'lr': 1.2342060438705989e-05, 'weight_decay': 1.6767968943696883e-06, 'epochs': 135, 'loss': 'mse', 'optimizer': 'adam', 'graph_mode': 'cutoff', 'cutoff': 0.8977596745189265, 'grm_norm': 'gcn', 'self_loops': False, 'use_snp_selection': False}. Best is trial 16 with value: 0.052214761853149355.
[I 2025-11-03 15:31:47,367] Trial 38 finished with value: 0.001015857921614616 and parameters: {'model_type': 'graphsage', 'hidden_dims': '[512, 256]', 'dropout': 0.41196682585337824, 'batch_norm': False, 'lr': 4.477787471297209e-05, 'weight_decay': 0.000329572526513134, 'epochs': 209, 'loss': 'mae', 'optimizer': 'adam', 'graph_mode': 'cutoff', 'cutoff': 0.7154761675225948, 'grm_norm': 'cosine', 'self_loops': False, 'use_snp_selection': True, 'num_snps': 58870}. Best is trial 16 with value: 0.052214761853149355.
[I 2025-11-03 15:31:48,950] Trial 39 finished with value: 0.041261352990057745 and parameters: {'model_type': 'graphsage', 'hidden_dims': '[128, 64]', 'dropout': 0.5695802859399427, 'batch_norm': True, 'lr': 0.0005993475938253789, 'weight_decay': 3.2763706281141296e-07, 'epochs': 99, 'loss': 'mse', 'optimizer': 'adam', 'graph_mode': 'knn', 'source': 'grm', 'knn_k': 4, 'weighted_edges': True, 'symmetrize_mode': 'mutual', 'use_snp_selection': False}. Best is trial 16 with value: 0.052214761853149355.
[I 2025-11-03 15:31:51,766] Trial 40 finished with value: 0.04157614478756298 and parameters: {'model_type': 'graphsage', 'hidden_dims': '[512, 128]', 'dropout': 0.5262855554066117, 'batch_norm': False, 'lr': 0.0002989371415208808, 'weight_decay': 2.6436404955303003e-05, 'epochs': 283, 'loss': 'mse', 'optimizer': 'adam', 'graph_mode': 'cutoff', 'cutoff': 0.8134320793836525, 'grm_norm': 'none', 'self_loops': False, 'use_snp_selection': True, 'num_snps': 22189}. Best is trial 16 with value: 0.052214761853149355.
[I 2025-11-03 15:31:54,903] Trial 41 finished with value: 0.03243160038112511 and parameters: {'model_type': 'graphsage', 'hidden_dims': '[256, 128]', 'dropout': 0.5928888579651818, 'batch_norm': True, 'lr': 0.0001804611267348551, 'weight_decay': 7.051828908040393e-05, 'epochs': 349, 'loss': 'mse', 'optimizer': 'adam', 'graph_mode': 'cutoff', 'cutoff': 0.6142434271129994, 'grm_norm': 'cosine_then_gcn', 'self_loops': False, 'use_snp_selection': False}. Best is trial 16 with value: 0.052214761853149355.
[I 2025-11-03 15:31:57,836] Trial 42 finished with value: 0.008013043227921636 and parameters: {'model_type': 'graphsage', 'hidden_dims': '[256, 128]', 'dropout': 0.5966453012917825, 'batch_norm': True, 'lr': 0.00013136651637986053, 'weight_decay': 5.8345302172154416e-05, 'epochs': 318, 'loss': 'mse', 'optimizer': 'adam', 'graph_mode': 'cutoff', 'cutoff': 0.6065424484826023, 'grm_norm': 'cosine_then_gcn', 'self_loops': False, 'use_snp_selection': False}. Best is trial 16 with value: 0.052214761853149355.
[I 2025-11-03 15:32:00,094] Trial 43 finished with value: 0.02973045617610843 and parameters: {'model_type': 'graphsage', 'hidden_dims': '[256, 128]', 'dropout': 0.559166689516178, 'batch_norm': True, 'lr': 0.00010342230400352328, 'weight_decay': 0.00010324776336273931, 'epochs': 177, 'loss': 'mse', 'optimizer': 'adam', 'graph_mode': 'cutoff', 'cutoff': 0.5428238952401377, 'grm_norm': 'cosine_then_gcn', 'self_loops': False, 'use_snp_selection': False}. Best is trial 16 with value: 0.052214761853149355.
[I 2025-11-03 15:32:02,993] Trial 44 finished with value: 0.0504461541159397 and parameters: {'model_type': 'graphsage', 'hidden_dims': '[256, 128]', 'dropout': 0.4951766512642579, 'batch_norm': True, 'lr': 0.00020067355352835893, 'weight_decay': 0.00024407281134860448, 'epochs': 297, 'loss': 'mse', 'optimizer': 'adam', 'graph_mode': 'cutoff', 'cutoff': 0.46666767302787837, 'grm_norm': 'cosine_then_gcn', 'self_loops': False, 'use_snp_selection': False}. Best is trial 16 with value: 0.052214761853149355.
[I 2025-11-03 15:32:07,195] Trial 45 finished with value: 0.04975725106748818 and parameters: {'model_type': 'graphsage', 'hidden_dims': '[512, 64]', 'dropout': 0.44761265949188833, 'batch_norm': True, 'lr': 0.00040961031529320146, 'weight_decay': 0.00023424438466428644, 'epochs': 246, 'loss': 'mse', 'optimizer': 'adam', 'graph_mode': 'cutoff', 'cutoff': 0.39488629852267254, 'grm_norm': 'cosine_then_gcn', 'self_loops': True, 'use_snp_selection': False}. Best is trial 16 with value: 0.052214761853149355.
[I 2025-11-03 15:32:11,779] Trial 46 finished with value: 0.04206175087072976 and parameters: {'model_type': 'graphsage', 'hidden_dims': '[512, 256]', 'dropout': 0.32394331909393126, 'batch_norm': True, 'lr': 0.00021732860014379155, 'weight_decay': 0.0005963251425710354, 'epochs': 289, 'loss': 'mae', 'optimizer': 'adam', 'graph_mode': 'cutoff', 'cutoff': 0.4808289362460294, 'grm_norm': 'cosine', 'self_loops': False, 'use_snp_selection': False}. Best is trial 16 with value: 0.052214761853149355.
[I 2025-11-03 15:32:14,791] Trial 47 finished with value: 0.047692066448603326 and parameters: {'model_type': 'graphsage', 'hidden_dims': '[256, 128]', 'dropout': 0.495159420592172, 'batch_norm': False, 'lr': 7.057011244544935e-05, 'weight_decay': 0.0002544471485608588, 'epochs': 233, 'loss': 'mse', 'optimizer': 'adam', 'graph_mode': 'cutoff', 'cutoff': 0.3242067058821819, 'grm_norm': 'gcn', 'self_loops': False, 'use_snp_selection': True, 'num_snps': 36748}. Best is trial 16 with value: 0.052214761853149355.
[I 2025-11-03 15:32:18,087] Trial 48 finished with value: 0.06346059432764593 and parameters: {'model_type': 'graphsage', 'hidden_dims': '[512, 64]', 'dropout': 0.46906276204042435, 'batch_norm': True, 'lr': 0.00033884315503622444, 'weight_decay': 0.00044391784937906003, 'epochs': 145, 'loss': 'mse', 'optimizer': 'adam', 'graph_mode': 'cutoff', 'cutoff': 0.4734908047739901, 'grm_norm': 'gcn', 'self_loops': False, 'use_snp_selection': False}. Best is trial 48 with value: 0.06346059432764593.
[I 2025-11-03 15:32:21,302] Trial 49 finished with value: 0.031186281957647513 and parameters: {'model_type': 'graphsage', 'hidden_dims': '[512, 64]', 'dropout': 0.47375902155654537, 'batch_norm': True, 'lr': 0.00037527552801721876, 'weight_decay': 0.0004506681010006201, 'epochs': 142, 'loss': 'mse', 'optimizer': 'adam', 'graph_mode': 'cutoff', 'cutoff': 0.48146966785870837, 'grm_norm': 'none', 'self_loops': False, 'use_snp_selection': False}. Best is trial 48 with value: 0.06346059432764593.
[I 2025-11-03 15:32:27,012] Trial 50 finished with value: 0.04283250121684182 and parameters: {'model_type': 'graphsage', 'hidden_dims': '[512, 64]', 'dropout': 0.43668721820794476, 'batch_norm': True, 'lr': 0.0007049674213193544, 'weight_decay': 0.0006920847666514361, 'epochs': 331, 'loss': 'mse', 'optimizer': 'adam', 'graph_mode': 'knn', 'source': 'grm', 'knn_k': 8, 'weighted_edges': False, 'symmetrize_mode': 'union', 'use_snp_selection': False}. Best is trial 48 with value: 0.06346059432764593.
[I 2025-11-03 15:32:30,460] Trial 51 finished with value: 0.02435519448160472 and parameters: {'model_type': 'graphsage', 'hidden_dims': '[512, 64]', 'dropout': 0.3893814891659555, 'batch_norm': True, 'lr': 0.00048578826495512296, 'weight_decay': 0.00013293485453768822, 'epochs': 165, 'loss': 'mse', 'optimizer': 'adam', 'graph_mode': 'cutoff', 'cutoff': 0.391464846056135, 'grm_norm': 'gcn', 'self_loops': False, 'use_snp_selection': False}. Best is trial 48 with value: 0.06346059432764593.
[I 2025-11-03 15:32:34,117] Trial 52 finished with value: 0.05520773358275072 and parameters: {'model_type': 'graphsage', 'hidden_dims': '[512, 64]', 'dropout': 0.517587968790089, 'batch_norm': True, 'lr': 0.000990254852683051, 'weight_decay': 0.0009617887846051487, 'epochs': 183, 'loss': 'mse', 'optimizer': 'adam', 'graph_mode': 'cutoff', 'cutoff': 0.4537193210232283, 'grm_norm': 'gcn', 'self_loops': False, 'use_snp_selection': False}. Best is trial 48 with value: 0.06346059432764593.
[I 2025-11-03 15:32:37,385] Trial 53 finished with value: 0.0424408604437746 and parameters: {'model_type': 'graphsage', 'hidden_dims': '[512, 64]', 'dropout': 0.5247617395924952, 'batch_norm': True, 'lr': 0.0009975765084074073, 'weight_decay': 0.0008941545361991335, 'epochs': 141, 'loss': 'mse', 'optimizer': 'adam', 'graph_mode': 'cutoff', 'cutoff': 0.4415317701675246, 'grm_norm': 'gcn', 'self_loops': False, 'use_snp_selection': False}. Best is trial 48 with value: 0.06346059432764593.
[I 2025-11-03 15:32:40,497] Trial 54 finished with value: 0.051979804572335864 and parameters: {'model_type': 'graphsage', 'hidden_dims': '[512, 64]', 'dropout': 0.46735515780818176, 'batch_norm': True, 'lr': 0.0002927900852286229, 'weight_decay': 0.0002709658365833694, 'epochs': 127, 'loss': 'mse', 'optimizer': 'adam', 'graph_mode': 'cutoff', 'cutoff': 0.5304617898087346, 'grm_norm': 'gcn', 'self_loops': False, 'use_snp_selection': False}. Best is trial 48 with value: 0.06346059432764593.
[I 2025-11-03 15:32:43,370] Trial 55 finished with value: 0.04888740273202723 and parameters: {'model_type': 'graphsage', 'hidden_dims': '[512, 64]', 'dropout': 0.4612745723014544, 'batch_norm': True, 'lr': 0.0003313318252394777, 'weight_decay': 0.00027871121543080406, 'epochs': 105, 'loss': 'mse', 'optimizer': 'adam', 'graph_mode': 'cutoff', 'cutoff': 0.5391372676164307, 'grm_norm': 'gcn', 'self_loops': False, 'use_snp_selection': False}. Best is trial 48 with value: 0.06346059432764593.
[I 2025-11-03 15:32:46,150] Trial 56 finished with value: 0.024656584052611834 and parameters: {'model_type': 'graphsage', 'hidden_dims': '[512, 64]', 'dropout': 0.48929012177387643, 'batch_norm': True, 'lr': 0.00020695483568294998, 'weight_decay': 0.0004464213354648775, 'epochs': 87, 'loss': 'mse', 'optimizer': 'adam', 'graph_mode': 'cutoff', 'cutoff': 0.46360220059591756, 'grm_norm': 'gcn', 'self_loops': True, 'use_snp_selection': False}. Best is trial 48 with value: 0.06346059432764593.
[I 2025-11-03 15:32:49,228] Trial 57 finished with value: 0.031192486334740723 and parameters: {'model_type': 'graphsage', 'hidden_dims': '[512, 64]', 'dropout': 0.429722778451539, 'batch_norm': True, 'lr': 0.0005081963870242885, 'weight_decay': 0.00015195825402140512, 'epochs': 121, 'loss': 'mse', 'optimizer': 'adam', 'graph_mode': 'cutoff', 'cutoff': 0.5143729227563012, 'grm_norm': 'gcn', 'self_loops': False, 'use_snp_selection': False}. Best is trial 48 with value: 0.06346059432764593.
[I 2025-11-03 15:32:51,863] Trial 58 finished with value: 0.03995566115666479 and parameters: {'model_type': 'graphsage', 'hidden_dims': '[512, 64]', 'dropout': 0.5485831649246667, 'batch_norm': True, 'lr': 9.220922568486527e-05, 'weight_decay': 0.00019207251822692944, 'epochs': 70, 'loss': 'mse', 'optimizer': 'adam', 'graph_mode': 'cutoff', 'cutoff': 0.3635845941822142, 'grm_norm': 'cosine', 'self_loops': False, 'use_snp_selection': False}. Best is trial 48 with value: 0.06346059432764593.
[I 2025-11-03 15:32:55,028] Trial 59 finished with value: 0.041065092570942215 and parameters: {'model_type': 'graphsage', 'hidden_dims': '[512, 64]', 'dropout': 0.5090874406917073, 'batch_norm': True, 'lr': 0.0001526400157105905, 'weight_decay': 0.0006210801430498889, 'epochs': 132, 'loss': 'mse', 'optimizer': 'adam', 'graph_mode': 'cutoff', 'cutoff': 0.40850369712016, 'grm_norm': 'cosine_then_gcn', 'self_loops': True, 'use_snp_selection': False}. Best is trial 48 with value: 0.06346059432764593.
[I 2025-11-03 15:32:58,455] Trial 60 finished with value: 0.024173703208899597 and parameters: {'model_type': 'graphsage', 'hidden_dims': '[512, 64]', 'dropout': 0.5754212104430471, 'batch_norm': True, 'lr': 0.0002440288455952589, 'weight_decay': 0.000402596604306036, 'epochs': 160, 'loss': 'mae', 'optimizer': 'adam', 'graph_mode': 'cutoff', 'cutoff': 0.5102609315647844, 'grm_norm': 'cosine', 'self_loops': False, 'use_snp_selection': False}. Best is trial 48 with value: 0.06346059432764593.
[I 2025-11-03 15:33:01,890] Trial 61 finished with value: 0.007575473579869227 and parameters: {'model_type': 'graphsage', 'hidden_dims': '[256, 128, 64]', 'dropout': 0.538925268127637, 'batch_norm': False, 'lr': 0.0007122580434032623, 'weight_decay': 0.0006888737400202206, 'epochs': 151, 'loss': 'mse', 'optimizer': 'adam', 'graph_mode': 'cutoff', 'cutoff': 0.4591281338056525, 'grm_norm': 'gcn', 'self_loops': False, 'use_snp_selection': True, 'num_snps': 51113}. Best is trial 48 with value: 0.06346059432764593.
[I 2025-11-03 15:33:05,468] Trial 62 finished with value: 0.05506555695492499 and parameters: {'model_type': 'graphsage', 'hidden_dims': '[512, 64]', 'dropout': 0.5010109982606012, 'batch_norm': True, 'lr': 0.0004602210988220449, 'weight_decay': 0.00033556028348329255, 'epochs': 183, 'loss': 'mse', 'optimizer': 'adam', 'graph_mode': 'cutoff', 'cutoff': 0.5501170491085733, 'grm_norm': 'gcn', 'self_loops': False, 'use_snp_selection': False}. Best is trial 48 with value: 0.06346059432764593.
[I 2025-11-03 15:33:09,502] Trial 63 finished with value: 0.02158511696442899 and parameters: {'model_type': 'graphsage', 'hidden_dims': '[512, 64]', 'dropout': 0.4636655816942027, 'batch_norm': True, 'lr': 0.00029142904021424557, 'weight_decay': 0.0002380543750138801, 'epochs': 219, 'loss': 'mse', 'optimizer': 'adam', 'graph_mode': 'cutoff', 'cutoff': 0.3052446059800135, 'grm_norm': 'gcn', 'self_loops': False, 'use_snp_selection': False}. Best is trial 48 with value: 0.06346059432764593.
[I 2025-11-03 15:33:13,143] Trial 64 finished with value: 0.031460604529538395 and parameters: {'model_type': 'graphsage', 'hidden_dims': '[512, 64]', 'dropout': 0.4901706416072019, 'batch_norm': True, 'lr': 0.0004683514547117296, 'weight_decay': 9.384055233941407e-05, 'epochs': 186, 'loss': 'mse', 'optimizer': 'adam', 'graph_mode': 'cutoff', 'cutoff': 0.5608743135727772, 'grm_norm': 'gcn', 'self_loops': False, 'use_snp_selection': False}. Best is trial 48 with value: 0.06346059432764593.
[I 2025-11-03 15:33:17,038] Trial 65 finished with value: 0.05950229868939491 and parameters: {'model_type': 'graphsage', 'hidden_dims': '[512, 64]', 'dropout': 0.5800944312992213, 'batch_norm': True, 'lr': 0.0008696172795098528, 'weight_decay': 0.0003252444218169351, 'epochs': 209, 'loss': 'mse', 'optimizer': 'adam', 'graph_mode': 'cutoff', 'cutoff': 0.42344001298313977, 'grm_norm': 'gcn', 'self_loops': True, 'use_snp_selection': False}. Best is trial 48 with value: 0.06346059432764593.
[I 2025-11-03 15:33:20,911] Trial 66 finished with value: 0.03006574604318638 and parameters: {'model_type': 'graphsage', 'hidden_dims': '[512, 64]', 'dropout': 0.5695419479895244, 'batch_norm': True, 'lr': 0.0008114183165041124, 'weight_decay': 0.0003451813240985665, 'epochs': 200, 'loss': 'mse', 'optimizer': 'adam', 'graph_mode': 'cutoff', 'cutoff': 0.24411916742148926, 'grm_norm': 'gcn', 'self_loops': True, 'use_snp_selection': False}. Best is trial 48 with value: 0.06346059432764593.
[I 2025-11-03 15:33:25,216] Trial 67 finished with value: 0.04310012216249185 and parameters: {'model_type': 'graphsage', 'hidden_dims': '[512, 64]', 'dropout': 0.5822735551593959, 'batch_norm': True, 'lr': 0.0009643994137745116, 'weight_decay': 0.00044628400210196056, 'epochs': 260, 'loss': 'mse', 'optimizer': 'adam', 'graph_mode': 'cutoff', 'cutoff': 0.42213557029632903, 'grm_norm': 'gcn', 'self_loops': True, 'use_snp_selection': False}. Best is trial 48 with value: 0.06346059432764593.
[I 2025-11-03 15:33:29,150] Trial 68 finished with value: 0.059372687396207796 and parameters: {'model_type': 'graphsage', 'hidden_dims': '[512, 64]', 'dropout': 0.5549138305683698, 'batch_norm': True, 'lr': 0.0006314044877031958, 'weight_decay': 0.00014657034632262967, 'epochs': 213, 'loss': 'mse', 'optimizer': 'adam', 'graph_mode': 'cutoff', 'cutoff': 0.3803756005124425, 'grm_norm': 'gcn', 'self_loops': True, 'use_snp_selection': False}. Best is trial 48 with value: 0.06346059432764593.
[I 2025-11-03 15:33:31,465] Trial 69 finished with value: 0.009200579903482362 and parameters: {'model_type': 'graphsage', 'hidden_dims': '[512, 64]', 'dropout': 0.5200909311198206, 'batch_norm': True, 'lr': 0.0006394701153127841, 'weight_decay': 0.00014502955112374576, 'epochs': 40, 'loss': 'mse', 'optimizer': 'adam', 'graph_mode': 'cutoff', 'cutoff': 0.39022551783379433, 'grm_norm': 'gcn', 'self_loops': True, 'use_snp_selection': False}. Best is trial 48 with value: 0.06346059432764593.
[I 2025-11-03 15:33:35,488] Trial 70 finished with value: 0.025825464581587437 and parameters: {'model_type': 'graphsage', 'hidden_dims': '[512, 64]', 'dropout': 0.5387904685074753, 'batch_norm': True, 'lr': 0.0005445251195157298, 'weight_decay': 0.0009458516209135727, 'epochs': 212, 'loss': 'mse', 'optimizer': 'adam', 'graph_mode': 'knn', 'source': 'grm', 'knn_k': 5, 'weighted_edges': True, 'symmetrize_mode': 'mutual', 'use_snp_selection': False}. Best is trial 48 with value: 0.06346059432764593.
[I 2025-11-03 15:33:39,274] Trial 71 finished with value: 0.05308812915813114 and parameters: {'model_type': 'graphsage', 'hidden_dims': '[512, 64]', 'dropout': 0.5596007656478563, 'batch_norm': True, 'lr': 0.0003853747286270391, 'weight_decay': 0.0005360220233925596, 'epochs': 196, 'loss': 'mse', 'optimizer': 'adam', 'graph_mode': 'cutoff', 'cutoff': 0.36148700230166886, 'grm_norm': 'gcn', 'self_loops': True, 'use_snp_selection': False}. Best is trial 48 with value: 0.06346059432764593.
[I 2025-11-03 15:33:43,048] Trial 72 finished with value: 0.040230313081983916 and parameters: {'model_type': 'graphsage', 'hidden_dims': '[512, 64]', 'dropout': 0.5562384069082206, 'batch_norm': True, 'lr': 0.00035928111806790954, 'weight_decay': 0.0005191634455190407, 'epochs': 194, 'loss': 'mse', 'optimizer': 'adam', 'graph_mode': 'cutoff', 'cutoff': 0.37614971300178635, 'grm_norm': 'gcn', 'self_loops': True, 'use_snp_selection': False}. Best is trial 48 with value: 0.06346059432764593.
[I 2025-11-03 15:33:46,675] Trial 73 finished with value: 0.03496193836046079 and parameters: {'model_type': 'graphsage', 'hidden_dims': '[512, 64]', 'dropout': 0.580994660520321, 'batch_norm': True, 'lr': 0.0007103215972834942, 'weight_decay': 0.000736629084507368, 'epochs': 183, 'loss': 'mse', 'optimizer': 'adam', 'graph_mode': 'cutoff', 'cutoff': 0.3433980225152423, 'grm_norm': 'gcn', 'self_loops': True, 'use_snp_selection': False}. Best is trial 48 with value: 0.06346059432764593.
[I 2025-11-03 15:33:50,150] Trial 74 finished with value: 0.042618017175280604 and parameters: {'model_type': 'graphsage', 'hidden_dims': '[512, 64]', 'dropout': 0.5095957665643369, 'batch_norm': True, 'lr': 0.0004586420338346334, 'weight_decay': 0.0003221517752747639, 'epochs': 168, 'loss': 'mse', 'optimizer': 'adam', 'graph_mode': 'cutoff', 'cutoff': 0.42749658424550807, 'grm_norm': 'gcn', 'self_loops': True, 'use_snp_selection': False}. Best is trial 48 with value: 0.06346059432764593.
[I 2025-11-03 15:33:54,138] Trial 75 finished with value: 0.03633763072544321 and parameters: {'model_type': 'graphsage', 'hidden_dims': '[512, 128]', 'dropout': 0.5581956172797429, 'batch_norm': True, 'lr': 0.000822757789433318, 'weight_decay': 0.0005279278023440219, 'epochs': 211, 'loss': 'mse', 'optimizer': 'adam', 'graph_mode': 'cutoff', 'cutoff': 0.28349679940457373, 'grm_norm': 'gcn', 'self_loops': True, 'use_snp_selection': False}. Best is trial 48 with value: 0.06346059432764593.
[I 2025-11-03 15:33:58,211] Trial 76 finished with value: 0.031221305007436067 and parameters: {'model_type': 'graphsage', 'hidden_dims': '[512, 64]', 'dropout': 0.531536652767917, 'batch_norm': True, 'lr': 0.0005475608363417829, 'weight_decay': 0.00017276468664357073, 'epochs': 236, 'loss': 'mse', 'optimizer': 'adam', 'graph_mode': 'cutoff', 'cutoff': 0.4965123762631587, 'grm_norm': 'gcn', 'self_loops': True, 'use_snp_selection': False}. Best is trial 48 with value: 0.06346059432764593.
