[I 2025-10-21 12:37:42,119] Trial 19 finished with value: 0.21630719197341408 and parameters: {'model_type': 'gat', 'hidden_dims': '[512, 256]', 'dropout': 0.1112825947437199, 'batch_norm': True, 'gat_heads': 5, 'gat_attn_dropout': 0.5470837408749187, 'gat_concat_hidden': True, 'lr': 0.0003852334071810517, 'weight_decay': 0.0009652163992896154, 'epochs': 323, 'loss': 'mae', 'optimizer': 'adam', 'graph_mode': 'cutoff', 'cutoff': 0.6553366718332067, 'grm_norm': 'gcn', 'self_loops': True}. Best is trial 13 with value: 0.2313536021562515.
[I 2025-10-21 12:45:46,833] Trial 20 finished with value: 0.22830164920298168 and parameters: {'model_type': 'gat', 'hidden_dims': '[512, 256]', 'dropout': 0.2198181435697219, 'batch_norm': True, 'gat_heads': 8, 'gat_attn_dropout': 0.33467057262315686, 'gat_concat_hidden': True, 'lr': 0.00012391345814090213, 'weight_decay': 3.3732134956011094e-07, 'epochs': 182, 'loss': 'mae', 'optimizer': 'adam', 'graph_mode': 'cutoff', 'cutoff': 0.6248117900814779, 'grm_norm': 'gcn', 'self_loops': True}. Best is trial 13 with value: 0.2313536021562515.
[I 2025-10-21 13:00:36,873] Trial 21 finished with value: 0.22989290709558072 and parameters: {'model_type': 'gat', 'hidden_dims': '[512, 256]', 'dropout': 0.10385544585684935, 'batch_norm': True, 'gat_heads': 8, 'gat_attn_dropout': 0.5954859114204554, 'gat_concat_hidden': True, 'lr': 0.0003314616541169575, 'weight_decay': 2.1979886449419293e-07, 'epochs': 348, 'loss': 'mae', 'optimizer': 'adam', 'graph_mode': 'cutoff', 'cutoff': 0.8913265902991561, 'grm_norm': 'gcn', 'self_loops': True}. Best is trial 13 with value: 0.2313536021562515.
[I 2025-10-21 13:14:08,940] Trial 22 finished with value: 0.23196465525992854 and parameters: {'model_type': 'gat', 'hidden_dims': '[512, 256]', 'dropout': 0.14512796110952, 'batch_norm': True, 'gat_heads': 8, 'gat_attn_dropout': 0.534824787324684, 'gat_concat_hidden': True, 'lr': 0.00034998621031414885, 'weight_decay': 2.469209468581054e-06, 'epochs': 315, 'loss': 'mae', 'optimizer': 'adam', 'graph_mode': 'cutoff', 'cutoff': 0.8422598258400064, 'grm_norm': 'gcn', 'self_loops': True}. Best is trial 22 with value: 0.23196465525992854.
[I 2025-10-21 13:23:42,356] Trial 23 finished with value: 0.228169158304624 and parameters: {'model_type': 'gat', 'hidden_dims': '[512, 256]', 'dropout': 0.15251369492444883, 'batch_norm': True, 'gat_heads': 6, 'gat_attn_dropout': 0.5320764745540272, 'gat_concat_hidden': True, 'lr': 0.0002515831859015646, 'weight_decay': 2.8817960161042965e-06, 'epochs': 309, 'loss': 'mae', 'optimizer': 'adam', 'graph_mode': 'cutoff', 'cutoff': 0.8215340308415819, 'grm_norm': 'gcn', 'self_loops': True}. Best is trial 22 with value: 0.23196465525992854.
[I 2025-10-21 13:33:17,615] Trial 24 finished with value: 0.23227097064172542 and parameters: {'model_type': 'gat', 'hidden_dims': '[512, 256]', 'dropout': 0.14562060406223273, 'batch_norm': True, 'gat_heads': 7, 'gat_attn_dropout': 0.4467772275969616, 'gat_concat_hidden': True, 'lr': 8.08666410341474e-05, 'weight_decay': 1.6163399839845053e-06, 'epochs': 260, 'loss': 'mae', 'optimizer': 'adam', 'graph_mode': 'cutoff', 'cutoff': 0.8245137693620204, 'grm_norm': 'gcn', 'self_loops': True}. Best is trial 24 with value: 0.23227097064172542.
[I 2025-10-21 13:42:46,718] Trial 25 finished with value: 0.23716326217380962 and parameters: {'model_type': 'gat', 'hidden_dims': '[512, 256]', 'dropout': 0.19577295885718357, 'batch_norm': True, 'gat_heads': 7, 'gat_attn_dropout': 0.4320825050153245, 'gat_concat_hidden': True, 'lr': 0.00010619641818987933, 'weight_decay': 1.3837518871635573e-05, 'epochs': 257, 'loss': 'mae', 'optimizer': 'adam', 'graph_mode': 'cutoff', 'cutoff': 0.7980691985413806, 'grm_norm': 'cosine', 'self_loops': True}. Best is trial 25 with value: 0.23716326217380962.
[I 2025-10-21 13:45:23,670] Trial 26 finished with value: 0.15821125245802328 and parameters: {'model_type': 'gat', 'hidden_dims': '[128, 64]', 'dropout': 0.20127861790826562, 'batch_norm': True, 'gat_heads': 7, 'gat_attn_dropout': 0.42563660592672165, 'gat_concat_hidden': False, 'lr': 9.428165602935847e-05, 'weight_decay': 1.3346283213476497e-05, 'epochs': 251, 'loss': 'mae', 'optimizer': 'adam', 'graph_mode': 'cutoff', 'cutoff': 0.6556301052116182, 'grm_norm': 'cosine', 'self_loops': True}. Best is trial 25 with value: 0.23716326217380962.
[I 2025-10-21 13:53:42,151] Trial 27 finished with value: 0.20039475479853253 and parameters: {'model_type': 'gat', 'hidden_dims': '[512, 128]', 'dropout': 0.31096496667407447, 'batch_norm': False, 'gat_heads': 6, 'gat_attn_dropout': 0.3536045749945839, 'gat_concat_hidden': True, 'lr': 5.392242381614052e-05, 'weight_decay': 1.2711775489281778e-05, 'epochs': 268, 'loss': 'mse', 'optimizer': 'adam', 'graph_mode': 'knn', 'source': 'grm', 'knn_k': 1, 'weighted_edges': True, 'symmetrize_mode': 'union'}. Best is trial 25 with value: 0.23716326217380962.
[I 2025-10-21 13:56:12,716] Trial 28 finished with value: 0.17735291138410422 and parameters: {'model_type': 'gat', 'hidden_dims': '[256, 128]', 'dropout': 0.27600459974584185, 'batch_norm': True, 'gat_heads': 4, 'gat_attn_dropout': 0.2288485882742325, 'gat_concat_hidden': True, 'lr': 2.1730842139014028e-05, 'weight_decay': 2.375622961187718e-06, 'epochs': 236, 'loss': 'mae', 'optimizer': 'adam', 'graph_mode': 'cutoff', 'cutoff': 0.8079087358933269, 'grm_norm': 'cosine', 'self_loops': True}. Best is trial 25 with value: 0.23716326217380962.
[I 2025-10-21 13:58:23,916] Trial 29 finished with value: 0.09708906510292882 and parameters: {'model_type': 'gat', 'hidden_dims': '[128, 64]', 'dropout': 0.19733880195366063, 'batch_norm': True, 'gat_heads': 7, 'gat_attn_dropout': 0.3992819068923224, 'gat_concat_hidden': True, 'lr': 8.237460077253954e-06, 'weight_decay': 2.7656528729506413e-05, 'epochs': 202, 'loss': 'mse', 'optimizer': 'adam', 'graph_mode': 'knn', 'source': 'grm', 'knn_k': 4, 'weighted_edges': False, 'symmetrize_mode': 'union'}. Best is trial 25 with value: 0.23716326217380962.
[I 2025-10-21 14:05:59,559] Trial 30 finished with value: 0.21325403287416886 and parameters: {'model_type': 'gat', 'hidden_dims': '[512, 256]', 'dropout': 0.14847465449217112, 'batch_norm': True, 'gat_heads': 5, 'gat_attn_dropout': 0.45443663739487145, 'gat_concat_hidden': True, 'lr': 3.911153095955494e-05, 'weight_decay': 7.176886244468034e-06, 'epochs': 284, 'loss': 'mae', 'optimizer': 'adam', 'graph_mode': 'cutoff', 'cutoff': 0.5950952350142336, 'grm_norm': 'cosine', 'self_loops': True}. Best is trial 25 with value: 0.23716326217380962.
[I 2025-10-21 14:17:11,667] Trial 31 finished with value: 0.2298517190643714 and parameters: {'model_type': 'gat', 'hidden_dims': '[512, 256]', 'dropout': 0.18629746836878788, 'batch_norm': True, 'gat_heads': 7, 'gat_attn_dropout': 0.5025046185445727, 'gat_concat_hidden': True, 'lr': 8.604211753749226e-05, 'weight_decay': 1.9034149018384186e-06, 'epochs': 308, 'loss': 'mae', 'optimizer': 'adam', 'graph_mode': 'cutoff', 'cutoff': 0.8078470460597424, 'grm_norm': 'none', 'self_loops': True}. Best is trial 25 with value: 0.23716326217380962.
[I 2025-10-21 14:26:47,667] Trial 32 finished with value: 0.2406032747304335 and parameters: {'model_type': 'gat', 'hidden_dims': '[512, 256]', 'dropout': 0.14169024348748535, 'batch_norm': True, 'gat_heads': 8, 'gat_attn_dropout': 0.5365778817199739, 'gat_concat_hidden': True, 'lr': 0.0001264613511502479, 'weight_decay': 4.6744803132129937e-07, 'epochs': 219, 'loss': 'mae', 'optimizer': 'adam', 'graph_mode': 'cutoff', 'cutoff': 0.8415052802910874, 'grm_norm': 'gcn', 'self_loops': True}. Best is trial 32 with value: 0.2406032747304335.
[I 2025-10-21 14:35:56,059] Trial 33 finished with value: 0.22799914207440253 and parameters: {'model_type': 'gat', 'hidden_dims': '[512, 64]', 'dropout': 0.22455988921641645, 'batch_norm': True, 'gat_heads': 8, 'gat_attn_dropout': 0.43924815682469537, 'gat_concat_hidden': True, 'lr': 3.7198007574291304e-05, 'weight_decay': 4.396323118526336e-06, 'epochs': 216, 'loss': 'mae', 'optimizer': 'adam', 'graph_mode': 'cutoff', 'cutoff': 0.7183939360204749, 'grm_norm': 'cosine', 'self_loops': True}. Best is trial 32 with value: 0.2406032747304335.
[I 2025-10-21 14:42:34,334] Trial 34 finished with value: 0.21499529624474042 and parameters: {'model_type': 'gat', 'hidden_dims': '[512, 256]', 'dropout': 0.14284013248891395, 'batch_norm': True, 'gat_heads': 7, 'gat_attn_dropout': 0.390662864484744, 'gat_concat_hidden': False, 'lr': 0.0004861328419015721, 'weight_decay': 1.2294229563583221e-06, 'epochs': 183, 'loss': 'mse', 'optimizer': 'adam', 'graph_mode': 'cutoff', 'cutoff': 0.8355659581042023, 'grm_norm': 'gcn', 'self_loops': True}. Best is trial 32 with value: 0.2406032747304335.
[I 2025-10-21 14:50:23,458] Trial 35 finished with value: 0.2298394820990653 and parameters: {'model_type': 'gat', 'hidden_dims': '[512, 256]', 'dropout': 0.24156954691058732, 'batch_norm': True, 'gat_heads': 6, 'gat_attn_dropout': 0.48091520460419923, 'gat_concat_hidden': True, 'lr': 0.0001097831981921622, 'weight_decay': 3.8326364038734904e-07, 'epochs': 248, 'loss': 'mae', 'optimizer': 'adam', 'graph_mode': 'cutoff', 'cutoff': 0.7594099780757272, 'grm_norm': 'gcn', 'self_loops': True}. Best is trial 32 with value: 0.2406032747304335.
[I 2025-10-21 14:52:44,197] Trial 36 finished with value: 0.22894196823613858 and parameters: {'model_type': 'gat', 'hidden_dims': '[256, 128]', 'dropout': 0.37764418267144423, 'batch_norm': False, 'gat_heads': 4, 'gat_attn_dropout': 0.525053190990797, 'gat_concat_hidden': True, 'lr': 6.29905069493444e-05, 'weight_decay': 4.620376762960307e-05, 'epochs': 208, 'loss': 'mae', 'optimizer': 'adam', 'graph_mode': 'knn', 'source': 'grm', 'knn_k': 10, 'weighted_edges': True, 'symmetrize_mode': 'union'}. Best is trial 32 with value: 0.2406032747304335.
[I 2025-10-21 14:59:39,471] Trial 37 finished with value: 0.10448017006591896 and parameters: {'model_type': 'gat', 'hidden_dims': '[512, 64]', 'dropout': 0.13742385228588422, 'batch_norm': True, 'gat_heads': 8, 'gat_attn_dropout': 0.3358254696417573, 'gat_concat_hidden': False, 'lr': 1.4929372209735344e-06, 'weight_decay': 1.4949284043508685e-05, 'epochs': 162, 'loss': 'mae', 'optimizer': 'adam', 'graph_mode': 'cutoff', 'cutoff': 0.7609728858072393, 'grm_norm': 'cosine', 'self_loops': True}. Best is trial 32 with value: 0.2406032747304335.
[I 2025-10-21 15:02:01,275] Trial 38 finished with value: 0.21644703906296323 and parameters: {'model_type': 'gat', 'hidden_dims': '[128, 64]', 'dropout': 0.1740538009149659, 'batch_norm': False, 'gat_heads': 7, 'gat_attn_dropout': 0.5573364852913519, 'gat_concat_hidden': True, 'lr': 2.1212375285544383e-05, 'weight_decay': 2.05168856662145e-07, 'epochs': 227, 'loss': 'mse', 'optimizer': 'adam', 'graph_mode': 'cutoff', 'cutoff': 0.8498776755369336, 'grm_norm': 'none', 'self_loops': False}. Best is trial 32 with value: 0.2406032747304335.
[I 2025-10-21 15:04:08,795] Trial 39 finished with value: 0.0796305891671753 and parameters: {'model_type': 'gat', 'hidden_dims': '[256, 128, 64]', 'dropout': 0.2089655432824419, 'batch_norm': True, 'gat_heads': 6, 'gat_attn_dropout': 0.48282149780888717, 'gat_concat_hidden': False, 'lr': 6.622769472411915e-05, 'weight_decay': 8.885543935162591e-05, 'epochs': 127, 'loss': 'mae', 'optimizer': 'adam', 'graph_mode': 'knn', 'source': 'grm', 'knn_k': 3, 'weighted_edges': True, 'symmetrize_mode': 'mutual'}. Best is trial 32 with value: 0.2406032747304335.
[I 2025-10-21 15:15:47,605] Trial 40 finished with value: 0.21283352204295802 and parameters: {'model_type': 'gat', 'hidden_dims': '[512, 256]', 'dropout': 0.2686969819279151, 'batch_norm': True, 'gat_heads': 8, 'gat_attn_dropout': 0.37919607068560446, 'gat_concat_hidden': True, 'lr': 0.000645759879417961, 'weight_decay': 1.9323512766494525e-06, 'epochs': 268, 'loss': 'mae', 'optimizer': 'adam', 'graph_mode': 'cutoff', 'cutoff': 0.6885880563405871, 'grm_norm': 'gcn', 'self_loops': True}. Best is trial 32 with value: 0.2406032747304335.
[I 2025-10-21 15:28:13,209] Trial 41 finished with value: 0.2321505540588103 and parameters: {'model_type': 'gat', 'hidden_dims': '[512, 256]', 'dropout': 0.12621565730315334, 'batch_norm': True, 'gat_heads': 8, 'gat_attn_dropout': 0.5619249540691188, 'gat_concat_hidden': True, 'lr': 0.00015843095415349662, 'weight_decay': 6.750312031861231e-07, 'epochs': 288, 'loss': 'mae', 'optimizer': 'adam', 'graph_mode': 'cutoff', 'cutoff': 0.8576011675650747, 'grm_norm': 'gcn', 'self_loops': True}. Best is trial 32 with value: 0.2406032747304335.
[I 2025-10-21 15:38:31,496] Trial 42 finished with value: 0.22710556923105546 and parameters: {'model_type': 'gat', 'hidden_dims': '[512, 256]', 'dropout': 0.13252673919841734, 'batch_norm': True, 'gat_heads': 7, 'gat_attn_dropout': 0.5209346579703384, 'gat_concat_hidden': True, 'lr': 0.00013679463847899714, 'weight_decay': 1.0779850510812448e-06, 'epochs': 281, 'loss': 'mae', 'optimizer': 'adam', 'graph_mode': 'cutoff', 'cutoff': 0.781690888265327, 'grm_norm': 'gcn', 'self_loops': True}. Best is trial 32 with value: 0.2406032747304335.
[I 2025-10-21 15:49:19,960] Trial 43 finished with value: 0.24352204654300996 and parameters: {'model_type': 'gat', 'hidden_dims': '[512, 256]', 'dropout': 0.17528876398487794, 'batch_norm': True, 'gat_heads': 8, 'gat_attn_dropout': 0.0033053925142385032, 'gat_concat_hidden': True, 'lr': 0.00029764206736483, 'weight_decay': 5.431770373145433e-07, 'epochs': 246, 'loss': 'mae', 'optimizer': 'adam', 'graph_mode': 'cutoff', 'cutoff': 0.8357133636426785, 'grm_norm': 'cosine_then_gcn', 'self_loops': False}. Best is trial 43 with value: 0.24352204654300996.
[I 2025-10-21 15:59:59,761] Trial 44 finished with value: 0.2102904203214726 and parameters: {'model_type': 'gat', 'hidden_dims': '[512, 256]', 'dropout': 0.5877647535124694, 'batch_norm': True, 'gat_heads': 8, 'gat_attn_dropout': 0.006973995638204777, 'gat_concat_hidden': True, 'lr': 8.047823478923177e-05, 'weight_decay': 4.666925603381637e-07, 'epochs': 243, 'loss': 'mae', 'optimizer': 'adam', 'graph_mode': 'cutoff', 'cutoff': 0.8537076052720606, 'grm_norm': 'cosine_then_gcn', 'self_loops': False}. Best is trial 43 with value: 0.24352204654300996.
[I 2025-10-21 16:04:10,711] Trial 45 finished with value: 0.15717449025588542 and parameters: {'model_type': 'gat', 'hidden_dims': '[256, 128, 64]', 'dropout': 0.17950910593882535, 'batch_norm': True, 'gat_heads': 7, 'gat_attn_dropout': 0.18846562038421064, 'gat_concat_hidden': True, 'lr': 0.00028465804800717075, 'weight_decay': 2.3545360642568711e-07, 'epochs': 219, 'loss': 'mae', 'optimizer': 'adam', 'graph_mode': 'cutoff', 'cutoff': 0.47554852079745974, 'grm_norm': 'cosine_then_gcn', 'self_loops': False}. Best is trial 43 with value: 0.24352204654300996.
[I 2025-10-21 16:15:59,573] Trial 46 finished with value: 0.18835095065678817 and parameters: {'model_type': 'gat', 'hidden_dims': '[512, 256]', 'dropout': 0.34293062464020585, 'batch_norm': False, 'gat_heads': 8, 'gat_attn_dropout': 0.5690835906075722, 'gat_concat_hidden': True, 'lr': 4.834491731410548e-05, 'weight_decay': 6.326307563182442e-07, 'epochs': 259, 'loss': 'mse', 'optimizer': 'adam', 'graph_mode': 'cutoff', 'cutoff': 0.24486855632848914, 'grm_norm': 'cosine_then_gcn', 'self_loops': False}. Best is trial 43 with value: 0.24352204654300996.
[I 2025-10-21 16:19:00,395] Trial 47 finished with value: 0.1777999583516423 and parameters: {'model_type': 'gat', 'hidden_dims': '[512, 64]', 'dropout': 0.2548862052240619, 'batch_norm': True, 'gat_heads': 3, 'gat_attn_dropout': 0.14039475328935966, 'gat_concat_hidden': True, 'lr': 0.0001585914392557653, 'weight_decay': 1.9526935103105963e-05, 'epochs': 192, 'loss': 'mae', 'optimizer': 'adam', 'graph_mode': 'cutoff', 'cutoff': 0.8536514444793907, 'grm_norm': 'cosine_then_gcn', 'self_loops': False}. Best is trial 43 with value: 0.24352204654300996.
[I 2025-10-21 16:19:56,189] Trial 48 finished with value: 0.17161692696107597 and parameters: {'model_type': 'gat', 'hidden_dims': '[256, 128]', 'dropout': 0.1688452559256116, 'batch_norm': True, 'gat_heads': 7, 'gat_attn_dropout': 0.4730630214072028, 'gat_concat_hidden': False, 'lr': 2.8565481338685498e-05, 'weight_decay': 8.592567473585976e-07, 'epochs': 40, 'loss': 'mae', 'optimizer': 'adam', 'graph_mode': 'cutoff', 'cutoff': 0.7788585801809654, 'grm_norm': 'cosine_then_gcn', 'self_loops': False}. Best is trial 43 with value: 0.24352204654300996.
[I 2025-10-21 16:29:57,492] Trial 49 finished with value: 0.22562109858005294 and parameters: {'model_type': 'gat', 'hidden_dims': '[512, 256]', 'dropout': 0.1298711520402299, 'batch_norm': True, 'gat_heads': 8, 'gat_attn_dropout': 0.3107856520298136, 'gat_concat_hidden': True, 'lr': 0.00011513686694007827, 'weight_decay': 1.4945234199085427e-07, 'epochs': 229, 'loss': 'mae', 'optimizer': 'adam', 'graph_mode': 'cutoff', 'cutoff': 0.6876105043141307, 'grm_norm': 'none', 'self_loops': False}. Best is trial 43 with value: 0.24352204654300996.
[I 2025-10-21 16:40:30,651] Trial 50 finished with value: 0.1535298209746456 and parameters: {'model_type': 'gat', 'hidden_dims': '[512, 128]', 'dropout': 0.4209277613445106, 'batch_norm': True, 'gat_heads': 7, 'gat_attn_dropout': 0.07227690099159415, 'gat_concat_hidden': True, 'lr': 0.00021105780432309197, 'weight_decay': 8.732146197835336e-06, 'epochs': 282, 'loss': 'mae', 'optimizer': 'adam', 'graph_mode': 'knn', 'source': 'grm', 'knn_k': 7, 'weighted_edges': False, 'symmetrize_mode': 'union'}. Best is trial 43 with value: 0.24352204654300996.
[I 2025-10-21 16:53:28,813] Trial 51 finished with value: 0.22945606356056397 and parameters: {'model_type': 'gat', 'hidden_dims': '[512, 256]', 'dropout': 0.12366840419740986, 'batch_norm': True, 'gat_heads': 8, 'gat_attn_dropout': 0.5063290940909141, 'gat_concat_hidden': True, 'lr': 0.0004563958523559057, 'weight_decay': 1.7999230728837226e-06, 'epochs': 302, 'loss': 'mae', 'optimizer': 'adam', 'graph_mode': 'cutoff', 'cutoff': 0.8536796453371397, 'grm_norm': 'gcn', 'self_loops': True}. Best is trial 43 with value: 0.24352204654300996.
[I 2025-10-21 17:06:04,824] Trial 52 finished with value: 0.21416075270010576 and parameters: {'model_type': 'gat', 'hidden_dims': '[512, 256]', 'dropout': 0.15690692621092964, 'batch_norm': True, 'gat_heads': 8, 'gat_attn_dropout': 0.05958108576001467, 'gat_concat_hidden': True, 'lr': 0.000724628034988258, 'weight_decay': 5.220150033365486e-07, 'epochs': 290, 'loss': 'mae', 'optimizer': 'adam', 'graph_mode': 'cutoff', 'cutoff': 0.8239881545679415, 'grm_norm': 'cosine_then_gcn', 'self_loops': True}. Best is trial 43 with value: 0.24352204654300996.
[I 2025-10-21 17:17:31,886] Trial 53 finished with value: 0.231796653597451 and parameters: {'model_type': 'gat', 'hidden_dims': '[512, 256]', 'dropout': 0.18820498100641778, 'batch_norm': True, 'gat_heads': 8, 'gat_attn_dropout': 0.5680328890566004, 'gat_concat_hidden': True, 'lr': 0.00030072570051889637, 'weight_decay': 4.033837174788779e-06, 'epochs': 265, 'loss': 'mae', 'optimizer': 'adam', 'graph_mode': 'cutoff', 'cutoff': 0.868044414344506, 'grm_norm': 'gcn', 'self_loops': False}. Best is trial 43 with value: 0.24352204654300996.
[I 2025-10-21 17:31:08,663] Trial 54 finished with value: 0.22374006538435545 and parameters: {'model_type': 'gat', 'hidden_dims': '[512, 256]', 'dropout': 0.207244693732945, 'batch_norm': True, 'gat_heads': 8, 'gat_attn_dropout': 0.5421867121389257, 'gat_concat_hidden': True, 'lr': 0.00016514132381748725, 'weight_decay': 1.1318747164930834e-06, 'epochs': 317, 'loss': 'mae', 'optimizer': 'adam', 'graph_mode': 'cutoff', 'cutoff': 0.7919249698039561, 'grm_norm': 'gcn', 'self_loops': True}. Best is trial 43 with value: 0.24352204654300996.
[I 2025-10-21 17:39:57,513] Trial 55 finished with value: 0.22023845697219163 and parameters: {'model_type': 'gat', 'hidden_dims': '[512, 256]', 'dropout': 0.1187118748373597, 'batch_norm': True, 'gat_heads': 7, 'gat_attn_dropout': 0.4246299199199316, 'gat_concat_hidden': True, 'lr': 0.00041229500010174947, 'weight_decay': 6.390109207340413e-06, 'epochs': 239, 'loss': 'mae', 'optimizer': 'adam', 'graph_mode': 'cutoff', 'cutoff': 0.7595040166137661, 'grm_norm': 'gcn', 'self_loops': True}. Best is trial 43 with value: 0.24352204654300996.
[I 2025-10-21 17:51:13,465] Trial 56 finished with value: 0.21579128605511194 and parameters: {'model_type': 'gat', 'hidden_dims': '[512, 256]', 'dropout': 0.23626330845855997, 'batch_norm': True, 'gat_heads': 8, 'gat_attn_dropout': 0.495594094447301, 'gat_concat_hidden': True, 'lr': 0.0002524701531721388, 'weight_decay': 2.893216216448066e-07, 'epochs': 256, 'loss': 'mae', 'optimizer': 'adam', 'graph_mode': 'cutoff', 'cutoff': 0.4878413840632355, 'grm_norm': 'cosine', 'self_loops': True}. Best is trial 43 with value: 0.24352204654300996.
[I 2025-10-21 18:01:14,748] Trial 57 finished with value: 0.2525553836773523 and parameters: {'model_type': 'gat', 'hidden_dims': '[512, 256]', 'dropout': 0.10047345662178477, 'batch_norm': False, 'gat_heads': 7, 'gat_attn_dropout': 0.24296873522157278, 'gat_concat_hidden': True, 'lr': 0.0006097773797991754, 'weight_decay': 2.822455309990898e-06, 'epochs': 281, 'loss': 'mae', 'optimizer': 'adam', 'graph_mode': 'cutoff', 'cutoff': 0.8750607604277009, 'grm_norm': 'gcn', 'self_loops': True}. Best is trial 57 with value: 0.2525553836773523.
[I 2025-10-21 18:05:28,396] Trial 58 finished with value: 0.2528015272051901 and parameters: {'model_type': 'gat', 'hidden_dims': '[256, 128, 64]', 'dropout': 0.11404286889234558, 'batch_norm': False, 'gat_heads': 6, 'gat_attn_dropout': 0.1840968725317948, 'gat_concat_hidden': True, 'lr': 0.000753935895686172, 'weight_decay': 7.062452577712993e-07, 'epochs': 276, 'loss': 'mae', 'optimizer': 'adam', 'graph_mode': 'cutoff', 'cutoff': 0.8733241495684381, 'grm_norm': 'cosine_then_gcn', 'self_loops': False}. Best is trial 58 with value: 0.2528015272051901.
