[I 2025-11-03 12:13:43,264] Trial 82 finished with value: -0.02804885057065433 and parameters: {'model_type': 'gcn', 'hidden_dims': '[512, 128]', 'dropout': 0.16198690535713292, 'batch_norm': False, 'lr': 4.8044422385540724e-06, 'weight_decay': 0.00035478883610912316, 'epochs': 99, 'loss': 'mae', 'optimizer': 'adam', 'graph_mode': 'off', 'use_snp_selection': False}. Best is trial 35 with value: 0.05154567449331511.
[I 2025-11-03 12:13:44,672] Trial 83 finished with value: -0.02037778307812646 and parameters: {'model_type': 'gcn', 'hidden_dims': '[512, 128]', 'dropout': 0.17900178781480208, 'batch_norm': False, 'lr': 2.7801972331616225e-06, 'weight_decay': 1.72486566959913e-05, 'epochs': 115, 'loss': 'mae', 'optimizer': 'adam', 'graph_mode': 'off', 'use_snp_selection': False}. Best is trial 35 with value: 0.05154567449331511.
[I 2025-11-03 12:13:46,170] Trial 84 finished with value: -0.012887254837433417 and parameters: {'model_type': 'gcn', 'hidden_dims': '[512, 128]', 'dropout': 0.44504864279383444, 'batch_norm': False, 'lr': 1.8954130911024743e-06, 'weight_decay': 8.56202311522829e-06, 'epochs': 131, 'loss': 'mae', 'optimizer': 'adam', 'graph_mode': 'off', 'use_snp_selection': False}. Best is trial 35 with value: 0.05154567449331511.
[I 2025-11-03 12:13:47,229] Trial 85 finished with value: 0.03793511486976182 and parameters: {'model_type': 'gcn', 'hidden_dims': '[256, 128]', 'dropout': 0.18123890440404253, 'batch_norm': False, 'lr': 3.6428149893217532e-06, 'weight_decay': 0.00012346122894443492, 'epochs': 125, 'loss': 'mae', 'optimizer': 'adam', 'graph_mode': 'off', 'use_snp_selection': False}. Best is trial 35 with value: 0.05154567449331511.
[I 2025-11-03 12:13:48,409] Trial 86 finished with value: 0.010152590656638595 and parameters: {'model_type': 'gcn', 'hidden_dims': '[256, 128]', 'dropout': 0.2994951930625938, 'batch_norm': True, 'lr': 3.5847731884863084e-06, 'weight_decay': 0.00015408460642545114, 'epochs': 161, 'loss': 'mae', 'optimizer': 'adam', 'graph_mode': 'off', 'use_snp_selection': False}. Best is trial 35 with value: 0.05154567449331511.
[I 2025-11-03 12:13:49,463] Trial 87 finished with value: -0.0348128553794306 and parameters: {'model_type': 'gcn', 'hidden_dims': '[256, 128]', 'dropout': 0.40507451374069003, 'batch_norm': False, 'lr': 4.650988002565262e-06, 'weight_decay': 0.000471285372796426, 'epochs': 126, 'loss': 'mae', 'optimizer': 'adam', 'graph_mode': 'off', 'use_snp_selection': False}. Best is trial 35 with value: 0.05154567449331511.
[I 2025-11-03 12:13:51,487] Trial 88 finished with value: 0.02308251822609534 and parameters: {'model_type': 'gcn', 'hidden_dims': '[256, 128]', 'dropout': 0.13921263513941043, 'batch_norm': True, 'lr': 1.2300573508955274e-05, 'weight_decay': 0.00011793998160462939, 'epochs': 169, 'loss': 'mae', 'optimizer': 'adam', 'graph_mode': 'off', 'use_snp_selection': True, 'num_snps': 48766}. Best is trial 35 with value: 0.05154567449331511.
[I 2025-11-03 12:13:52,739] Trial 89 finished with value: 0.020849718396378298 and parameters: {'model_type': 'gcn', 'hidden_dims': '[256, 128]', 'dropout': 0.24754539882131343, 'batch_norm': False, 'lr': 3.107933420130318e-06, 'weight_decay': 0.00025657885610785115, 'epochs': 151, 'loss': 'mse', 'optimizer': 'adam', 'graph_mode': 'off', 'use_snp_selection': False}. Best is trial 35 with value: 0.05154567449331511.
[I 2025-11-03 12:13:53,568] Trial 90 finished with value: -0.014652158978038503 and parameters: {'model_type': 'gcn', 'hidden_dims': '[256, 128]', 'dropout': 0.46597379381059945, 'batch_norm': True, 'lr': 1.716583787350664e-05, 'weight_decay': 0.0007107378909176581, 'epochs': 60, 'loss': 'mae', 'optimizer': 'adam', 'graph_mode': 'off', 'use_snp_selection': False}. Best is trial 35 with value: 0.05154567449331511.
[I 2025-11-03 12:13:54,491] Trial 91 finished with value: 0.03248646967774721 and parameters: {'model_type': 'gcn', 'hidden_dims': '[256, 128]', 'dropout': 0.10137883002146965, 'batch_norm': False, 'lr': 7.687303169653776e-06, 'weight_decay': 4.480164672180931e-05, 'epochs': 81, 'loss': 'mae', 'optimizer': 'adam', 'graph_mode': 'off', 'use_snp_selection': False}. Best is trial 35 with value: 0.05154567449331511.
[I 2025-11-03 12:13:55,427] Trial 92 finished with value: -0.024172192597287825 and parameters: {'model_type': 'gcn', 'hidden_dims': '[256, 128]', 'dropout': 0.11414555348343887, 'batch_norm': False, 'lr': 9.291193088973218e-06, 'weight_decay': 5.0123012454391794e-05, 'epochs': 85, 'loss': 'mae', 'optimizer': 'adam', 'graph_mode': 'off', 'use_snp_selection': False}. Best is trial 35 with value: 0.05154567449331511.
[I 2025-11-03 12:13:56,207] Trial 93 finished with value: 0.030513690828219166 and parameters: {'model_type': 'gcn', 'hidden_dims': '[256, 128]', 'dropout': 0.12986435052752568, 'batch_norm': False, 'lr': 7.0746063162668895e-06, 'weight_decay': 6.31243768039353e-05, 'epochs': 40, 'loss': 'mae', 'optimizer': 'adam', 'graph_mode': 'off', 'use_snp_selection': False}. Best is trial 35 with value: 0.05154567449331511.
[I 2025-11-03 12:13:57,345] Trial 94 finished with value: 0.0109629815668582 and parameters: {'model_type': 'gcn', 'hidden_dims': '[256, 128]', 'dropout': 0.39236266120764335, 'batch_norm': False, 'lr': 3.6042521094477062e-06, 'weight_decay': 2.839453208267029e-05, 'epochs': 145, 'loss': 'mae', 'optimizer': 'adam', 'graph_mode': 'off', 'use_snp_selection': False}. Best is trial 35 with value: 0.05154567449331511.
[I 2025-11-03 12:13:58,358] Trial 95 finished with value: -0.021914470313753515 and parameters: {'model_type': 'gcn', 'hidden_dims': '[256, 128]', 'dropout': 0.10796406843787015, 'batch_norm': False, 'lr': 2.4066622650242448e-05, 'weight_decay': 3.2562355542328496e-06, 'epochs': 113, 'loss': 'mae', 'optimizer': 'adam', 'graph_mode': 'off', 'use_snp_selection': False}. Best is trial 35 with value: 0.05154567449331511.
[I 2025-11-03 12:13:59,101] Trial 96 finished with value: 0.01123889920232011 and parameters: {'model_type': 'gcn', 'hidden_dims': '[128, 64]', 'dropout': 0.21059792254157483, 'batch_norm': False, 'lr': 0.00028982626768828357, 'weight_decay': 0.00016858037303894467, 'epochs': 80, 'loss': 'mae', 'optimizer': 'adam', 'graph_mode': 'off', 'use_snp_selection': False}. Best is trial 35 with value: 0.05154567449331511.
[I 2025-11-03 12:14:00,154] Trial 97 finished with value: 0.0052159100648712315 and parameters: {'model_type': 'gcn', 'hidden_dims': '[256, 128]', 'dropout': 0.35709459352080297, 'batch_norm': True, 'lr': 4.1147142885903e-05, 'weight_decay': 0.00011740007247799495, 'epochs': 121, 'loss': 'mae', 'optimizer': 'adam', 'graph_mode': 'off', 'use_snp_selection': False}. Best is trial 35 with value: 0.05154567449331511.
[I 2025-11-03 12:14:01,760] Trial 98 finished with value: 0.03286230452494176 and parameters: {'model_type': 'gcn', 'hidden_dims': '[256, 128, 64]', 'dropout': 0.22025198822698944, 'batch_norm': False, 'lr': 2.771080457571868e-05, 'weight_decay': 5.04838842811035e-07, 'epochs': 220, 'loss': 'mae', 'optimizer': 'adam', 'graph_mode': 'off', 'use_snp_selection': False}. Best is trial 35 with value: 0.05154567449331511.
[I 2025-11-03 12:14:03,168] Trial 99 finished with value: 0.02022701197723266 and parameters: {'model_type': 'gcn', 'hidden_dims': '[256, 128]', 'dropout': 0.18503542358681732, 'batch_norm': False, 'lr': 5.13673352631109e-06, 'weight_decay': 4.955408840310032e-07, 'epochs': 190, 'loss': 'mae', 'optimizer': 'adam', 'graph_mode': 'off', 'use_snp_selection': False}. Best is trial 35 with value: 0.05154567449331511.
[I 2025-11-03 12:14:04,639] Trial 100 finished with value: 0.01765310193923565 and parameters: {'model_type': 'gcn', 'hidden_dims': '[256, 128]', 'dropout': 0.21925785530005318, 'batch_norm': False, 'lr': 7.900890569161206e-06, 'weight_decay': 3.1952399993503045e-07, 'epochs': 237, 'loss': 'mae', 'optimizer': 'adam', 'graph_mode': 'off', 'use_snp_selection': False}. Best is trial 35 with value: 0.05154567449331511.
[I 2025-11-03 12:14:06,268] Trial 101 finished with value: -0.009066069830101312 and parameters: {'model_type': 'gcn', 'hidden_dims': '[256, 128, 64]', 'dropout': 0.2723215829450434, 'batch_norm': False, 'lr': 3.352478442596045e-05, 'weight_decay': 1.7529914015958846e-07, 'epochs': 232, 'loss': 'mae', 'optimizer': 'adam', 'graph_mode': 'off', 'use_snp_selection': False}. Best is trial 35 with value: 0.05154567449331511.
[I 2025-11-03 12:14:07,819] Trial 102 finished with value: 0.006955638171643025 and parameters: {'model_type': 'gcn', 'hidden_dims': '[256, 128, 64]', 'dropout': 0.24472095206403777, 'batch_norm': False, 'lr': 2.663349049263645e-05, 'weight_decay': 1.3997355981671673e-07, 'epochs': 213, 'loss': 'mae', 'optimizer': 'adam', 'graph_mode': 'off', 'use_snp_selection': False}. Best is trial 35 with value: 0.05154567449331511.
[I 2025-11-03 12:14:09,387] Trial 103 finished with value: 0.0335765788763145 and parameters: {'model_type': 'gcn', 'hidden_dims': '[256, 128, 64]', 'dropout': 0.2300159297481847, 'batch_norm': False, 'lr': 1.5964260509408406e-05, 'weight_decay': 2.385634782193923e-07, 'epochs': 219, 'loss': 'mae', 'optimizer': 'adam', 'graph_mode': 'off', 'use_snp_selection': False}. Best is trial 35 with value: 0.05154567449331511.
[I 2025-11-03 12:14:10,976] Trial 104 finished with value: -0.038175731133398304 and parameters: {'model_type': 'gcn', 'hidden_dims': '[256, 128, 64]', 'dropout': 0.4255474654147705, 'batch_norm': False, 'lr': 1.5455012108650624e-05, 'weight_decay': 2.605161295465988e-07, 'epochs': 221, 'loss': 'mae', 'optimizer': 'adam', 'graph_mode': 'off', 'use_snp_selection': False}. Best is trial 35 with value: 0.05154567449331511.
[I 2025-11-03 12:14:12,465] Trial 105 finished with value: 0.010141412612415761 and parameters: {'model_type': 'gcn', 'hidden_dims': '[256, 128, 64]', 'dropout': 0.5594305116741527, 'batch_norm': False, 'lr': 2.7422467747098427e-06, 'weight_decay': 3.915986391006742e-07, 'epochs': 200, 'loss': 'mae', 'optimizer': 'adam', 'graph_mode': 'off', 'use_snp_selection': False}. Best is trial 35 with value: 0.05154567449331511.
[I 2025-11-03 12:14:14,666] Trial 106 finished with value: 0.045182797197430964 and parameters: {'model_type': 'gcn', 'hidden_dims': '[512, 256]', 'dropout': 0.20326930106021976, 'batch_norm': False, 'lr': 1.2820237568405455e-05, 'weight_decay': 2.2501002699850212e-07, 'epochs': 247, 'loss': 'mae', 'optimizer': 'adam', 'graph_mode': 'off', 'use_snp_selection': False}. Best is trial 35 with value: 0.05154567449331511.
[I 2025-11-03 12:14:16,509] Trial 107 finished with value: -0.008622668063806977 and parameters: {'model_type': 'gcn', 'hidden_dims': '[512, 256]', 'dropout': 0.22497809320067855, 'batch_norm': False, 'lr': 1.0790892932574225e-05, 'weight_decay': 2.1930495988438707e-07, 'epochs': 244, 'loss': 'mae', 'optimizer': 'adam', 'graph_mode': 'off', 'use_snp_selection': True, 'num_snps': 26771}. Best is trial 35 with value: 0.05154567449331511.
[I 2025-11-03 12:14:18,854] Trial 108 finished with value: -0.008216943732535925 and parameters: {'model_type': 'gcn', 'hidden_dims': '[512, 256]', 'dropout': 0.19085958678468518, 'batch_norm': False, 'lr': 1.8205870940603328e-05, 'weight_decay': 4.7470514444044073e-07, 'epochs': 278, 'loss': 'mae', 'optimizer': 'adam', 'graph_mode': 'off', 'use_snp_selection': False}. Best is trial 35 with value: 0.05154567449331511.
[I 2025-11-03 12:14:21,091] Trial 109 finished with value: 0.010133295085301605 and parameters: {'model_type': 'gcn', 'hidden_dims': '[512, 256]', 'dropout': 0.1740874820613426, 'batch_norm': False, 'lr': 1.306349382466241e-05, 'weight_decay': 7.908209965571215e-07, 'epochs': 255, 'loss': 'mse', 'optimizer': 'adam', 'graph_mode': 'off', 'use_snp_selection': False}. Best is trial 35 with value: 0.05154567449331511.
[I 2025-11-03 12:14:23,059] Trial 110 finished with value: 0.02806509794480462 and parameters: {'model_type': 'gcn', 'hidden_dims': '[512, 256]', 'dropout': 0.1981060649245548, 'batch_norm': False, 'lr': 2.118426974444369e-05, 'weight_decay': 1.7613950865458532e-07, 'epochs': 208, 'loss': 'mae', 'optimizer': 'adam', 'graph_mode': 'off', 'use_snp_selection': False}. Best is trial 35 with value: 0.05154567449331511.
[I 2025-11-03 12:14:25,238] Trial 111 finished with value: 0.026518358251899944 and parameters: {'model_type': 'gcn', 'hidden_dims': '[512, 64]', 'dropout': 0.19961970608565827, 'batch_norm': False, 'lr': 8.848585393546035e-06, 'weight_decay': 2.701462985944388e-07, 'epochs': 250, 'loss': 'mae', 'optimizer': 'adam', 'graph_mode': 'off', 'use_snp_selection': False}. Best is trial 35 with value: 0.05154567449331511.
[I 2025-11-03 12:14:26,650] Trial 112 finished with value: 0.002731809312253998 and parameters: {'model_type': 'gcn', 'hidden_dims': '[256, 128]', 'dropout': 0.23705313816675072, 'batch_norm': False, 'lr': 1.166381539585028e-05, 'weight_decay': 1.3274958534800708e-07, 'epochs': 219, 'loss': 'mae', 'optimizer': 'adam', 'graph_mode': 'off', 'use_snp_selection': False}. Best is trial 35 with value: 0.05154567449331511.
[I 2025-11-03 12:14:28,084] Trial 113 finished with value: -0.030583708333407882 and parameters: {'model_type': 'gcn', 'hidden_dims': '[256, 128, 64]', 'dropout': 0.25243338595496845, 'batch_norm': False, 'lr': 6.494253226112464e-06, 'weight_decay': 3.3616201307129694e-07, 'epochs': 186, 'loss': 'mae', 'optimizer': 'adam', 'graph_mode': 'off', 'use_snp_selection': False}. Best is trial 35 with value: 0.05154567449331511.
[I 2025-11-03 12:14:29,652] Trial 114 finished with value: 0.021155561935028905 and parameters: {'model_type': 'gcn', 'hidden_dims': '[256, 128]', 'dropout': 0.15063670731322648, 'batch_norm': False, 'lr': 1.5221282213303367e-05, 'weight_decay': 1.7692418916565814e-06, 'epochs': 267, 'loss': 'mae', 'optimizer': 'adam', 'graph_mode': 'off', 'use_snp_selection': False}. Best is trial 35 with value: 0.05154567449331511.
[I 2025-11-03 12:14:31,281] Trial 115 finished with value: -0.022285257758626845 and parameters: {'model_type': 'gcn', 'hidden_dims': '[256, 128, 64]', 'dropout': 0.16813415381377736, 'batch_norm': False, 'lr': 4.22109967744149e-06, 'weight_decay': 1.0293110462733473e-07, 'epochs': 231, 'loss': 'mae', 'optimizer': 'adam', 'graph_mode': 'off', 'use_snp_selection': False}. Best is trial 35 with value: 0.05154567449331511.
[I 2025-11-03 12:14:32,405] Trial 116 finished with value: 0.01925507680216689 and parameters: {'model_type': 'gcn', 'hidden_dims': '[256, 128]', 'dropout': 0.37399842960675667, 'batch_norm': False, 'lr': 5.390324162849537e-06, 'weight_decay': 1.9567757630447307e-07, 'epochs': 136, 'loss': 'mae', 'optimizer': 'adam', 'graph_mode': 'off', 'use_snp_selection': False}. Best is trial 35 with value: 0.05154567449331511.
[I 2025-11-03 12:14:33,174] Trial 117 finished with value: 0.021017030277173228 and parameters: {'model_type': 'gcn', 'hidden_dims': '[128, 64]', 'dropout': 0.2065177809173307, 'batch_norm': False, 'lr': 7.918221443762417e-06, 'weight_decay': 5.839367703729588e-06, 'epochs': 93, 'loss': 'mae', 'optimizer': 'adam', 'graph_mode': 'off', 'use_snp_selection': False}. Best is trial 35 with value: 0.05154567449331511.
[I 2025-11-03 12:14:35,259] Trial 118 finished with value: 0.009124118554131437 and parameters: {'model_type': 'gcn', 'hidden_dims': '[512, 256]', 'dropout': 0.22752853980304621, 'batch_norm': False, 'lr': 9.990328315778616e-06, 'weight_decay': 7.166671894676583e-06, 'epochs': 226, 'loss': 'mae', 'optimizer': 'adam', 'graph_mode': 'off', 'use_snp_selection': False}. Best is trial 35 with value: 0.05154567449331511.
[I 2025-11-03 12:14:36,592] Trial 119 finished with value: -0.014468544032207745 and parameters: {'model_type': 'gcn', 'hidden_dims': '[256, 128]', 'dropout': 0.5990127129355302, 'batch_norm': False, 'lr': 1.9349405010593264e-06, 'weight_decay': 1.9666794824898594e-05, 'epochs': 193, 'loss': 'mae', 'optimizer': 'adam', 'graph_mode': 'off', 'use_snp_selection': False}. Best is trial 35 with value: 0.05154567449331511.
[I 2025-11-03 12:14:37,667] Trial 120 finished with value: -0.026998584972826326 and parameters: {'model_type': 'gcn', 'hidden_dims': '[256, 128, 64]', 'dropout': 0.5182948054077225, 'batch_norm': False, 'lr': 1.3299584639069211e-05, 'weight_decay': 2.345629772417471e-07, 'epochs': 104, 'loss': 'mae', 'optimizer': 'adam', 'graph_mode': 'off', 'use_snp_selection': False}. Best is trial 35 with value: 0.05154567449331511.
[I 2025-11-03 12:14:38,917] Trial 121 finished with value: 0.06354767617060408 and parameters: {'model_type': 'gcn', 'hidden_dims': '[256, 128, 64]', 'dropout': 0.3195695773823478, 'batch_norm': True, 'lr': 2.4284076731599668e-05, 'weight_decay': 0.0002794656949026854, 'epochs': 130, 'loss': 'mae', 'optimizer': 'adam', 'graph_mode': 'off', 'use_snp_selection': False}. Best is trial 121 with value: 0.06354767617060408.
[I 2025-11-03 12:14:40,204] Trial 122 finished with value: -0.0319141210158488 and parameters: {'model_type': 'gcn', 'hidden_dims': '[256, 128, 64]', 'dropout': 0.3348637918790194, 'batch_norm': True, 'lr': 2.3414928614185306e-05, 'weight_decay': 0.0002912845285375441, 'epochs': 140, 'loss': 'mae', 'optimizer': 'adam', 'graph_mode': 'off', 'use_snp_selection': False}. Best is trial 121 with value: 0.06354767617060408.
[I 2025-11-03 12:14:41,360] Trial 123 finished with value: 0.02712691401288687 and parameters: {'model_type': 'gcn', 'hidden_dims': '[256, 128, 64]', 'dropout': 0.3096446457533336, 'batch_norm': True, 'lr': 2.9406397912733443e-05, 'weight_decay': 0.0004209261267420091, 'epochs': 117, 'loss': 'mae', 'optimizer': 'adam', 'graph_mode': 'off', 'use_snp_selection': False}. Best is trial 121 with value: 0.06354767617060408.
[I 2025-11-03 12:14:42,595] Trial 124 finished with value: 0.026240134743736085 and parameters: {'model_type': 'gcn', 'hidden_dims': '[256, 128, 64]', 'dropout': 0.3221052938447389, 'batch_norm': True, 'lr': 1.802198226163493e-05, 'weight_decay': 0.00021390038351720012, 'epochs': 124, 'loss': 'mae', 'optimizer': 'adam', 'graph_mode': 'off', 'use_snp_selection': False}. Best is trial 121 with value: 0.06354767617060408.
[I 2025-11-03 12:14:43,838] Trial 125 finished with value: 0.034092493562114606 and parameters: {'model_type': 'gcn', 'hidden_dims': '[256, 128]', 'dropout': 0.12617183251792755, 'batch_norm': True, 'lr': 3.6422971144522734e-05, 'weight_decay': 0.0006877807511675741, 'epochs': 146, 'loss': 'mae', 'optimizer': 'adam', 'graph_mode': 'off', 'use_snp_selection': False}. Best is trial 121 with value: 0.06354767617060408.
[I 2025-11-03 12:14:45,221] Trial 126 finished with value: 0.03814632743289727 and parameters: {'model_type': 'gcn', 'hidden_dims': '[256, 128, 64]', 'dropout': 0.350992960470753, 'batch_norm': True, 'lr': 4.7867700397070895e-05, 'weight_decay': 0.0005327704653118896, 'epochs': 152, 'loss': 'mae', 'optimizer': 'adam', 'graph_mode': 'off', 'use_snp_selection': False}. Best is trial 121 with value: 0.06354767617060408.
[I 2025-11-03 12:14:46,473] Trial 127 finished with value: -0.025841372804582492 and parameters: {'model_type': 'gcn', 'hidden_dims': '[256, 128, 64]', 'dropout': 0.29704747803867565, 'batch_norm': True, 'lr': 4.749924469702364e-05, 'weight_decay': 0.0005859376183700347, 'epochs': 132, 'loss': 'mae', 'optimizer': 'adam', 'graph_mode': 'off', 'use_snp_selection': False}. Best is trial 121 with value: 0.06354767617060408.
[I 2025-11-03 12:14:47,728] Trial 128 finished with value: -0.02015558628610252 and parameters: {'model_type': 'gcn', 'hidden_dims': '[256, 128, 64]', 'dropout': 0.3459199578592516, 'batch_norm': True, 'lr': 3.750411147885636e-05, 'weight_decay': 0.0005671154104283542, 'epochs': 164, 'loss': 'mae', 'optimizer': 'adam', 'graph_mode': 'off', 'use_snp_selection': True, 'num_snps': 12722}. Best is trial 121 with value: 0.06354767617060408.
[I 2025-11-03 12:14:48,844] Trial 129 finished with value: 0.028796998041220753 and parameters: {'model_type': 'gcn', 'hidden_dims': '[256, 128, 64]', 'dropout': 0.3607872621908562, 'batch_norm': True, 'lr': 7.676022419109856e-05, 'weight_decay': 0.0008129429324199004, 'epochs': 109, 'loss': 'mse', 'optimizer': 'adam', 'graph_mode': 'off', 'use_snp_selection': False}. Best is trial 121 with value: 0.06354767617060408.
[I 2025-11-03 12:14:50,133] Trial 130 finished with value: 0.03334359986844348 and parameters: {'model_type': 'gcn', 'hidden_dims': '[256, 128, 64]', 'dropout': 0.32942802169552177, 'batch_norm': True, 'lr': 5.9813684911904594e-05, 'weight_decay': 0.0003411678279883825, 'epochs': 148, 'loss': 'mae', 'optimizer': 'adam', 'graph_mode': 'off', 'use_snp_selection': False}. Best is trial 121 with value: 0.06354767617060408.
[I 2025-11-03 12:14:51,410] Trial 131 finished with value: 0.01467773294898109 and parameters: {'model_type': 'gcn', 'hidden_dims': '[256, 128, 64]', 'dropout': 0.3243454273298418, 'batch_norm': True, 'lr': 8.943629089527722e-05, 'weight_decay': 0.000344078899048686, 'epochs': 144, 'loss': 'mae', 'optimizer': 'adam', 'graph_mode': 'off', 'use_snp_selection': False}. Best is trial 121 with value: 0.06354767617060408.
[I 2025-11-03 12:14:52,701] Trial 132 finished with value: 0.04995804815352863 and parameters: {'model_type': 'gcn', 'hidden_dims': '[256, 128, 64]', 'dropout': 0.3160623797815093, 'batch_norm': True, 'lr': 5.023756447132764e-05, 'weight_decay': 0.0006854759991809163, 'epochs': 150, 'loss': 'mae', 'optimizer': 'adam', 'graph_mode': 'off', 'use_snp_selection': False}. Best is trial 121 with value: 0.06354767617060408.
[I 2025-11-03 12:14:54,018] Trial 133 finished with value: 0.04052015465839319 and parameters: {'model_type': 'gcn', 'hidden_dims': '[256, 128, 64]', 'dropout': 0.3383957150304132, 'batch_norm': True, 'lr': 6.145839765112016e-05, 'weight_decay': 0.0006618397808661302, 'epochs': 150, 'loss': 'mae', 'optimizer': 'adam', 'graph_mode': 'off', 'use_snp_selection': False}. Best is trial 121 with value: 0.06354767617060408.
