[I 2025-11-03 11:51:29,443] Trial 60 finished with value: 0.04949049807463526 and parameters: {'model_type': 'gcn', 'hidden_dims': '[512, 256]', 'dropout': 0.2492453439902822, 'batch_norm': True, 'lr': 1.7192061213714257e-05, 'weight_decay': 9.255315633616434e-06, 'epochs': 350, 'loss': 'mse', 'optimizer': 'adam', 'graph_mode': 'off', 'use_snp_selection': False}. Best is trial 15 with value: 0.09769708887569035.
[I 2025-11-03 11:51:31,914] Trial 61 finished with value: 0.05609453812678262 and parameters: {'model_type': 'gcn', 'hidden_dims': '[512, 256]', 'dropout': 0.2005754853240727, 'batch_norm': True, 'lr': 3.1446728931742654e-05, 'weight_decay': 1.8482371364172554e-05, 'epochs': 315, 'loss': 'mse', 'optimizer': 'adam', 'graph_mode': 'off', 'use_snp_selection': False}. Best is trial 15 with value: 0.09769708887569035.
[I 2025-11-03 11:51:34,377] Trial 62 finished with value: 0.01504525128631127 and parameters: {'model_type': 'gcn', 'hidden_dims': '[512, 256]', 'dropout': 0.16840107721214959, 'batch_norm': True, 'lr': 2.765959274505859e-05, 'weight_decay': 4.28299766009848e-06, 'epochs': 317, 'loss': 'mse', 'optimizer': 'adam', 'graph_mode': 'off', 'use_snp_selection': False}. Best is trial 15 with value: 0.09769708887569035.
[I 2025-11-03 11:51:36,813] Trial 63 finished with value: 0.057251152765091656 and parameters: {'model_type': 'gcn', 'hidden_dims': '[512, 256]', 'dropout': 0.2129257960841655, 'batch_norm': True, 'lr': 0.0007048450315433005, 'weight_decay': 1.994009502768506e-06, 'epochs': 304, 'loss': 'mse', 'optimizer': 'adam', 'graph_mode': 'off', 'use_snp_selection': False}. Best is trial 15 with value: 0.09769708887569035.
[I 2025-11-03 11:51:39,207] Trial 64 finished with value: 0.06329378151748326 and parameters: {'model_type': 'gcn', 'hidden_dims': '[512, 256]', 'dropout': 0.213804907976707, 'batch_norm': True, 'lr': 5.113961349783107e-05, 'weight_decay': 2.03475484992769e-06, 'epochs': 298, 'loss': 'mse', 'optimizer': 'adam', 'graph_mode': 'off', 'use_snp_selection': False}. Best is trial 15 with value: 0.09769708887569035.
[I 2025-11-03 11:51:41,481] Trial 65 finished with value: 0.03371015199800878 and parameters: {'model_type': 'gcn', 'hidden_dims': '[512, 256]', 'dropout': 0.21134923921513998, 'batch_norm': True, 'lr': 0.0004715552940468399, 'weight_decay': 9.199383303778291e-07, 'epochs': 279, 'loss': 'mse', 'optimizer': 'adam', 'graph_mode': 'off', 'use_snp_selection': False}. Best is trial 15 with value: 0.09769708887569035.
[I 2025-11-03 11:51:43,809] Trial 66 finished with value: 0.006962975950444378 and parameters: {'model_type': 'gcn', 'hidden_dims': '[512, 256]', 'dropout': 0.18520885962996148, 'batch_norm': False, 'lr': 0.0008046361439694407, 'weight_decay': 2.469457016218277e-06, 'epochs': 296, 'loss': 'mse', 'optimizer': 'adam', 'graph_mode': 'off', 'use_snp_selection': False}. Best is trial 15 with value: 0.09769708887569035.
[I 2025-11-03 11:51:45,134] Trial 67 finished with value: 0.05305315266031983 and parameters: {'model_type': 'gcn', 'hidden_dims': '[512, 256]', 'dropout': 0.19177083220422017, 'batch_norm': True, 'lr': 9.498139077011272e-05, 'weight_decay': 2.090109459633882e-06, 'epochs': 82, 'loss': 'mse', 'optimizer': 'adam', 'graph_mode': 'off', 'use_snp_selection': False}. Best is trial 15 with value: 0.09769708887569035.
[I 2025-11-03 11:51:47,567] Trial 68 finished with value: 0.06654578816679083 and parameters: {'model_type': 'gcn', 'hidden_dims': '[512, 256]', 'dropout': 0.22110531851331608, 'batch_norm': True, 'lr': 3.885827090300303e-05, 'weight_decay': 1.2198999750578388e-06, 'epochs': 306, 'loss': 'mse', 'optimizer': 'adam', 'graph_mode': 'off', 'use_snp_selection': False}. Best is trial 15 with value: 0.09769708887569035.
[I 2025-11-03 11:51:49,656] Trial 69 finished with value: -0.0075443658810327675 and parameters: {'model_type': 'gcn', 'hidden_dims': '[512, 256]', 'dropout': 0.21622543074997588, 'batch_norm': False, 'lr': 0.00040581643750297437, 'weight_decay': 1.348848474766319e-06, 'epochs': 250, 'loss': 'mse', 'optimizer': 'adam', 'graph_mode': 'off', 'use_snp_selection': False}. Best is trial 15 with value: 0.09769708887569035.
[I 2025-11-03 11:51:51,993] Trial 70 finished with value: 0.05435333565199912 and parameters: {'model_type': 'gcn', 'hidden_dims': '[512, 256]', 'dropout': 0.2823307652491601, 'batch_norm': True, 'lr': 4.7930434398667526e-05, 'weight_decay': 7.150283995398121e-07, 'epochs': 284, 'loss': 'mse', 'optimizer': 'adam', 'graph_mode': 'off', 'use_snp_selection': False}. Best is trial 15 with value: 0.09769708887569035.
[I 2025-11-03 11:51:54,411] Trial 71 finished with value: 0.019733913351489614 and parameters: {'model_type': 'gcn', 'hidden_dims': '[512, 256]', 'dropout': 0.22560818186585438, 'batch_norm': True, 'lr': 3.509460602384339e-05, 'weight_decay': 3.6324355325545443e-07, 'epochs': 305, 'loss': 'mse', 'optimizer': 'adam', 'graph_mode': 'off', 'use_snp_selection': False}. Best is trial 15 with value: 0.09769708887569035.
[I 2025-11-03 11:51:56,669] Trial 72 finished with value: 0.06077830778891059 and parameters: {'model_type': 'gcn', 'hidden_dims': '[512, 256]', 'dropout': 0.16261980920971827, 'batch_norm': True, 'lr': 0.0001649744086717546, 'weight_decay': 1.5095584008218643e-05, 'epochs': 271, 'loss': 'mse', 'optimizer': 'adam', 'graph_mode': 'off', 'use_snp_selection': False}. Best is trial 15 with value: 0.09769708887569035.
[I 2025-11-03 11:51:58,945] Trial 73 finished with value: 0.03756598104948858 and parameters: {'model_type': 'gcn', 'hidden_dims': '[512, 256]', 'dropout': 0.16981752811072218, 'batch_norm': True, 'lr': 0.00017106760828461932, 'weight_decay': 1.6376086144172244e-06, 'epochs': 269, 'loss': 'mse', 'optimizer': 'adam', 'graph_mode': 'off', 'use_snp_selection': False}. Best is trial 15 with value: 0.09769708887569035.
[I 2025-11-03 11:52:00,899] Trial 74 finished with value: 0.04030762898610843 and parameters: {'model_type': 'gcn', 'hidden_dims': '[512, 256]', 'dropout': 0.16651116809921637, 'batch_norm': True, 'lr': 0.0004392379260881523, 'weight_decay': 3.364044118100281e-06, 'epochs': 220, 'loss': 'mse', 'optimizer': 'adam', 'graph_mode': 'off', 'use_snp_selection': False}. Best is trial 15 with value: 0.09769708887569035.
[I 2025-11-03 11:52:03,206] Trial 75 finished with value: 0.05910476069171918 and parameters: {'model_type': 'gcn', 'hidden_dims': '[512, 256]', 'dropout': 0.1432620422845003, 'batch_norm': True, 'lr': 0.0001248561946685746, 'weight_decay': 1.0005406293906947e-06, 'epochs': 291, 'loss': 'mse', 'optimizer': 'adam', 'graph_mode': 'off', 'use_snp_selection': False}. Best is trial 15 with value: 0.09769708887569035.
[I 2025-11-03 11:52:04,996] Trial 76 finished with value: 0.05469737805017519 and parameters: {'model_type': 'gcn', 'hidden_dims': '[256, 128, 64]', 'dropout': 0.1289341987204249, 'batch_norm': True, 'lr': 0.00012443180066384747, 'weight_decay': 5.456165552078731e-07, 'epochs': 258, 'loss': 'mse', 'optimizer': 'adam', 'graph_mode': 'off', 'use_snp_selection': False}. Best is trial 15 with value: 0.09769708887569035.
[I 2025-11-03 11:52:07,355] Trial 77 finished with value: 0.0548085715855644 and parameters: {'model_type': 'gcn', 'hidden_dims': '[512, 128]', 'dropout': 0.1503889714642365, 'batch_norm': True, 'lr': 5.996272704479942e-05, 'weight_decay': 2.4751626234854027e-07, 'epochs': 289, 'loss': 'mse', 'optimizer': 'adam', 'graph_mode': 'off', 'use_snp_selection': False}. Best is trial 15 with value: 0.09769708887569035.
[I 2025-11-03 11:52:08,882] Trial 78 finished with value: 0.03283220382860421 and parameters: {'model_type': 'gcn', 'hidden_dims': '[256, 128]', 'dropout': 0.12905723353264845, 'batch_norm': False, 'lr': 0.00012997017896946512, 'weight_decay': 1.0116962000269902e-06, 'epochs': 273, 'loss': 'mse', 'optimizer': 'adam', 'graph_mode': 'off', 'use_snp_selection': False}. Best is trial 15 with value: 0.09769708887569035.
[I 2025-11-03 11:52:11,034] Trial 79 finished with value: -0.004594650069021506 and parameters: {'model_type': 'gcn', 'hidden_dims': '[512, 256]', 'dropout': 0.40670802707772474, 'batch_norm': True, 'lr': 7.183662883222156e-05, 'weight_decay': 5.008789277521369e-06, 'epochs': 241, 'loss': 'mse', 'optimizer': 'adam', 'graph_mode': 'off', 'use_snp_selection': False}. Best is trial 15 with value: 0.09769708887569035.
[I 2025-11-03 11:52:13,429] Trial 80 finished with value: 0.04934000660153984 and parameters: {'model_type': 'gcn', 'hidden_dims': '[512, 128]', 'dropout': 0.32453637257887213, 'batch_norm': True, 'lr': 0.00029387380750403244, 'weight_decay': 1.575851702348748e-05, 'epochs': 298, 'loss': 'mse', 'optimizer': 'adam', 'graph_mode': 'off', 'use_snp_selection': False}. Best is trial 15 with value: 0.09769708887569035.
[I 2025-11-03 11:52:15,726] Trial 81 finished with value: 0.0586910836834241 and parameters: {'model_type': 'gcn', 'hidden_dims': '[512, 256]', 'dropout': 0.15944451309567706, 'batch_norm': True, 'lr': 0.000586382572864775, 'weight_decay': 2.1183807501529256e-06, 'epochs': 279, 'loss': 'mse', 'optimizer': 'adam', 'graph_mode': 'off', 'use_snp_selection': False}. Best is trial 15 with value: 0.09769708887569035.
[I 2025-11-03 11:52:17,992] Trial 82 finished with value: 0.05430757864380373 and parameters: {'model_type': 'gcn', 'hidden_dims': '[512, 256]', 'dropout': 0.11668487735672872, 'batch_norm': True, 'lr': 4.801182900918514e-05, 'weight_decay': 1.4363759289313212e-06, 'epochs': 278, 'loss': 'mse', 'optimizer': 'adam', 'graph_mode': 'off', 'use_snp_selection': False}. Best is trial 15 with value: 0.09769708887569035.
[I 2025-11-03 11:52:20,209] Trial 83 finished with value: 0.054974697906803933 and parameters: {'model_type': 'gcn', 'hidden_dims': '[512, 256]', 'dropout': 0.14145470571560975, 'batch_norm': True, 'lr': 8.62028802030701e-05, 'weight_decay': 1.091082538974518e-06, 'epochs': 263, 'loss': 'mse', 'optimizer': 'adam', 'graph_mode': 'off', 'use_snp_selection': False}. Best is trial 15 with value: 0.09769708887569035.
[I 2025-11-03 11:52:22,297] Trial 84 finished with value: 0.06612740551088653 and parameters: {'model_type': 'gcn', 'hidden_dims': '[512, 256]', 'dropout': 0.18018358279558572, 'batch_norm': True, 'lr': 5.337018802055449e-05, 'weight_decay': 7.702946935908457e-07, 'epochs': 249, 'loss': 'mse', 'optimizer': 'adam', 'graph_mode': 'off', 'use_snp_selection': False}. Best is trial 15 with value: 0.09769708887569035.
[I 2025-11-03 11:52:24,616] Trial 85 finished with value: 0.05910647863393855 and parameters: {'model_type': 'gcn', 'hidden_dims': '[512, 256]', 'dropout': 0.1603026909169218, 'batch_norm': True, 'lr': 5.49986148489145e-05, 'weight_decay': 7.738065357366347e-07, 'epochs': 287, 'loss': 'mse', 'optimizer': 'adam', 'graph_mode': 'off', 'use_snp_selection': False}. Best is trial 15 with value: 0.09769708887569035.
[I 2025-11-03 11:52:26,988] Trial 86 finished with value: 0.04551540801007315 and parameters: {'model_type': 'gcn', 'hidden_dims': '[512, 256]', 'dropout': 0.18122668208277998, 'batch_norm': True, 'lr': 5.368890503493031e-05, 'weight_decay': 6.697589477483586e-07, 'epochs': 289, 'loss': 'mse', 'optimizer': 'adam', 'graph_mode': 'off', 'use_snp_selection': False}. Best is trial 15 with value: 0.09769708887569035.
[I 2025-11-03 11:52:29,529] Trial 87 finished with value: 0.05177975075354948 and parameters: {'model_type': 'gcn', 'hidden_dims': '[512, 256]', 'dropout': 0.19165059879810917, 'batch_norm': True, 'lr': 0.00015173263192679663, 'weight_decay': 4.787759595860658e-07, 'epochs': 323, 'loss': 'mse', 'optimizer': 'adam', 'graph_mode': 'off', 'use_snp_selection': False}. Best is trial 15 with value: 0.09769708887569035.
[I 2025-11-03 11:52:31,543] Trial 88 finished with value: 0.043651699102074976 and parameters: {'model_type': 'gcn', 'hidden_dims': '[256, 128, 64]', 'dropout': 0.13892364382431446, 'batch_norm': True, 'lr': 4.187259504119489e-05, 'weight_decay': 1.8584399630634034e-07, 'epochs': 311, 'loss': 'mse', 'optimizer': 'adam', 'graph_mode': 'off', 'use_snp_selection': False}. Best is trial 15 with value: 0.09769708887569035.
[I 2025-11-03 11:52:33,892] Trial 89 finished with value: 0.026764848252206097 and parameters: {'model_type': 'gcn', 'hidden_dims': '[512, 64]', 'dropout': 0.10084699963056756, 'batch_norm': False, 'lr': 0.00010133855696350248, 'weight_decay': 3.501232012009515e-07, 'epochs': 301, 'loss': 'mse', 'optimizer': 'adam', 'graph_mode': 'off', 'use_snp_selection': False}. Best is trial 15 with value: 0.09769708887569035.
[I 2025-11-03 11:52:36,060] Trial 90 finished with value: 0.03220117336833919 and parameters: {'model_type': 'gcn', 'hidden_dims': '[512, 256]', 'dropout': 0.15571059118729, 'batch_norm': True, 'lr': 2.4508215092691355e-05, 'weight_decay': 6.771904936576213e-06, 'epochs': 251, 'loss': 'mse', 'optimizer': 'adam', 'graph_mode': 'off', 'use_snp_selection': False}. Best is trial 15 with value: 0.09769708887569035.
[I 2025-11-03 11:52:38,366] Trial 91 finished with value: 0.05294282327794184 and parameters: {'model_type': 'gcn', 'hidden_dims': '[512, 256]', 'dropout': 0.17247007211934642, 'batch_norm': True, 'lr': 0.00023025978450267172, 'weight_decay': 9.201125983771362e-07, 'epochs': 279, 'loss': 'mse', 'optimizer': 'adam', 'graph_mode': 'off', 'use_snp_selection': False}. Best is trial 15 with value: 0.09769708887569035.
[I 2025-11-03 11:52:40,686] Trial 92 finished with value: 0.06691781732769575 and parameters: {'model_type': 'gcn', 'hidden_dims': '[512, 256]', 'dropout': 0.16120483834706612, 'batch_norm': True, 'lr': 5.959431386939646e-05, 'weight_decay': 7.716269705003287e-07, 'epochs': 285, 'loss': 'mse', 'optimizer': 'adam', 'graph_mode': 'off', 'use_snp_selection': False}. Best is trial 15 with value: 0.09769708887569035.
[I 2025-11-03 11:52:43,063] Trial 93 finished with value: 0.05425704415012274 and parameters: {'model_type': 'gcn', 'hidden_dims': '[512, 256]', 'dropout': 0.11473818492461717, 'batch_norm': True, 'lr': 6.909534173418335e-05, 'weight_decay': 7.788681057927687e-07, 'epochs': 294, 'loss': 'mse', 'optimizer': 'adam', 'graph_mode': 'off', 'use_snp_selection': False}. Best is trial 15 with value: 0.09769708887569035.
[I 2025-11-03 11:52:45,293] Trial 94 finished with value: 0.0584818784328062 and parameters: {'model_type': 'gcn', 'hidden_dims': '[512, 256]', 'dropout': 0.15784233118994978, 'batch_norm': True, 'lr': 7.863964152323737e-05, 'weight_decay': 1.2537456128541303e-05, 'epochs': 270, 'loss': 'mse', 'optimizer': 'adam', 'graph_mode': 'off', 'use_snp_selection': False}. Best is trial 15 with value: 0.09769708887569035.
[I 2025-11-03 11:52:47,382] Trial 95 finished with value: 0.05757850113122139 and parameters: {'model_type': 'gcn', 'hidden_dims': '[512, 256]', 'dropout': 0.19287566438649595, 'batch_norm': True, 'lr': 0.00011613801688666602, 'weight_decay': 5.595422361478616e-07, 'epochs': 233, 'loss': 'mse', 'optimizer': 'adam', 'graph_mode': 'off', 'use_snp_selection': False}. Best is trial 15 with value: 0.09769708887569035.
[I 2025-11-03 11:52:49,295] Trial 96 finished with value: -0.0005146426815939699 and parameters: {'model_type': 'gcn', 'hidden_dims': '[256, 128, 64]', 'dropout': 0.2647887829696034, 'batch_norm': True, 'lr': 3.491265945130872e-05, 'weight_decay': 1.1812344322696965e-06, 'epochs': 285, 'loss': 'mse', 'optimizer': 'adam', 'graph_mode': 'off', 'use_snp_selection': False}. Best is trial 15 with value: 0.09769708887569035.
[I 2025-11-03 11:52:51,833] Trial 97 finished with value: 0.046482433030567524 and parameters: {'model_type': 'gcn', 'hidden_dims': '[512, 256]', 'dropout': 0.36961968785444194, 'batch_norm': True, 'lr': 6.0685962511073176e-05, 'weight_decay': 2.7045418815063797e-07, 'epochs': 332, 'loss': 'mse', 'optimizer': 'adam', 'graph_mode': 'off', 'use_snp_selection': False}. Best is trial 15 with value: 0.09769708887569035.
[I 2025-11-03 11:52:54,217] Trial 98 finished with value: 0.06149905436154646 and parameters: {'model_type': 'gcn', 'hidden_dims': '[512, 256]', 'dropout': 0.17730572445875142, 'batch_norm': True, 'lr': 4.482212291130907e-05, 'weight_decay': 3.1512871141172927e-06, 'epochs': 307, 'loss': 'mse', 'optimizer': 'adam', 'graph_mode': 'off', 'use_snp_selection': False}. Best is trial 15 with value: 0.09769708887569035.
[I 2025-11-03 11:52:55,894] Trial 99 finished with value: 0.0326295743844765 and parameters: {'model_type': 'gcn', 'hidden_dims': '[256, 128]', 'dropout': 0.233430514818131, 'batch_norm': False, 'lr': 5.336611182903697e-05, 'weight_decay': 3.4420381790183776e-06, 'epochs': 309, 'loss': 'mse', 'optimizer': 'adam', 'graph_mode': 'off', 'use_snp_selection': False}. Best is trial 15 with value: 0.09769708887569035.
[I 2025-11-03 11:52:58,541] Trial 100 finished with value: 0.05361799436804017 and parameters: {'model_type': 'gcn', 'hidden_dims': '[512, 256]', 'dropout': 0.18145448669056075, 'batch_norm': True, 'lr': 4.0840364218499566e-05, 'weight_decay': 2.313179405343337e-05, 'epochs': 340, 'loss': 'mse', 'optimizer': 'adam', 'graph_mode': 'off', 'use_snp_selection': False}. Best is trial 15 with value: 0.09769708887569035.
[I 2025-11-03 11:53:01,030] Trial 101 finished with value: 0.05685457639727869 and parameters: {'model_type': 'gcn', 'hidden_dims': '[512, 256]', 'dropout': 0.1998720852018331, 'batch_norm': True, 'lr': 4.76487331855785e-05, 'weight_decay': 2.534700829282727e-06, 'epochs': 315, 'loss': 'mse', 'optimizer': 'adam', 'graph_mode': 'off', 'use_snp_selection': False}. Best is trial 15 with value: 0.09769708887569035.
[I 2025-11-03 11:53:03,391] Trial 102 finished with value: 0.06026858759665976 and parameters: {'model_type': 'gcn', 'hidden_dims': '[512, 256]', 'dropout': 0.13591592237401906, 'batch_norm': True, 'lr': 0.00027210333508461543, 'weight_decay': 1.6789077625491293e-06, 'epochs': 300, 'loss': 'mse', 'optimizer': 'adam', 'graph_mode': 'off', 'use_snp_selection': False}. Best is trial 15 with value: 0.09769708887569035.
[I 2025-11-03 11:53:05,794] Trial 103 finished with value: 0.04473948496251265 and parameters: {'model_type': 'gcn', 'hidden_dims': '[512, 256]', 'dropout': 0.3047133397332889, 'batch_norm': True, 'lr': 2.8615892888762425e-05, 'weight_decay': 1.752939685000851e-06, 'epochs': 301, 'loss': 'mse', 'optimizer': 'adam', 'graph_mode': 'off', 'use_snp_selection': False}. Best is trial 15 with value: 0.09769708887569035.
[I 2025-11-03 11:53:08,279] Trial 104 finished with value: 0.06139160020822189 and parameters: {'model_type': 'gcn', 'hidden_dims': '[512, 256]', 'dropout': 0.13389296111722712, 'batch_norm': True, 'lr': 3.3913478693968286e-05, 'weight_decay': 7.933055949819241e-07, 'epochs': 321, 'loss': 'mse', 'optimizer': 'adam', 'graph_mode': 'off', 'use_snp_selection': False}. Best is trial 15 with value: 0.09769708887569035.
[I 2025-11-03 11:53:10,790] Trial 105 finished with value: 0.019281403473949497 and parameters: {'model_type': 'gcn', 'hidden_dims': '[512, 256]', 'dropout': 0.11656261838251374, 'batch_norm': True, 'lr': 1.3571038000268989e-05, 'weight_decay': 1.2839611043231552e-06, 'epochs': 320, 'loss': 'mse', 'optimizer': 'adam', 'graph_mode': 'off', 'use_snp_selection': False}. Best is trial 15 with value: 0.09769708887569035.
[I 2025-11-03 11:53:13,238] Trial 106 finished with value: 0.049696785525695474 and parameters: {'model_type': 'gcn', 'hidden_dims': '[512, 64]', 'dropout': 0.12953076759152374, 'batch_norm': True, 'lr': 0.00028759331443794427, 'weight_decay': 4.660130587329763e-06, 'epochs': 310, 'loss': 'mse', 'optimizer': 'adam', 'graph_mode': 'off', 'use_snp_selection': False}. Best is trial 15 with value: 0.09769708887569035.
[I 2025-11-03 11:53:14,977] Trial 107 finished with value: 0.007358234041081161 and parameters: {'model_type': 'gcn', 'hidden_dims': '[256, 128, 64]', 'dropout': 0.21619099997042285, 'batch_norm': True, 'lr': 1.1694143969681325e-05, 'weight_decay': 3.2087184393085097e-06, 'epochs': 248, 'loss': 'mse', 'optimizer': 'adam', 'graph_mode': 'off', 'use_snp_selection': False}. Best is trial 15 with value: 0.09769708887569035.
[I 2025-11-03 11:53:17,512] Trial 108 finished with value: 0.021021725577335077 and parameters: {'model_type': 'gcn', 'hidden_dims': '[512, 128]', 'dropout': 0.2447252572748227, 'batch_norm': True, 'lr': 3.4265477148181004e-05, 'weight_decay': 7.591243687128172e-06, 'epochs': 326, 'loss': 'mse', 'optimizer': 'adam', 'graph_mode': 'off', 'use_snp_selection': False}. Best is trial 15 with value: 0.09769708887569035.
[I 2025-11-03 11:53:20,038] Trial 109 finished with value: -0.004515934276363146 and parameters: {'model_type': 'gcn', 'hidden_dims': '[512, 256]', 'dropout': 0.17062402970115087, 'batch_norm': False, 'lr': 2.322526261787422e-05, 'weight_decay': 1.5969910273671071e-06, 'epochs': 332, 'loss': 'mae', 'optimizer': 'adam', 'graph_mode': 'off', 'use_snp_selection': False}. Best is trial 15 with value: 0.09769708887569035.
[I 2025-11-03 11:53:22,014] Trial 110 finished with value: -0.013295750805125036 and parameters: {'model_type': 'gcn', 'hidden_dims': '[512, 256]', 'dropout': 0.42357355341394726, 'batch_norm': True, 'lr': 6.02392849571893e-06, 'weight_decay': 5.409038245862545e-06, 'epochs': 210, 'loss': 'mse', 'optimizer': 'adam', 'graph_mode': 'off', 'use_snp_selection': True, 'num_snps': 35453}. Best is trial 15 with value: 0.09769708887569035.
[I 2025-11-03 11:53:24,359] Trial 111 finished with value: 0.03167157068586808 and parameters: {'model_type': 'gcn', 'hidden_dims': '[512, 256]', 'dropout': 0.16124400427120678, 'batch_norm': True, 'lr': 2.0068300566322162e-05, 'weight_decay': 5.053434567394355e-07, 'epochs': 296, 'loss': 'mse', 'optimizer': 'adam', 'graph_mode': 'off', 'use_snp_selection': False}. Best is trial 15 with value: 0.09769708887569035.
