[I 2025-11-03 15:11:45,542] Trial 96 finished with value: 0.04333523258604301 and parameters: {'model_type': 'graphsage', 'hidden_dims': '[128, 64]', 'dropout': 0.21551415830986764, 'batch_norm': True, 'lr': 0.0008629741012540619, 'weight_decay': 4.5714867009694155e-06, 'epochs': 84, 'loss': 'mse', 'optimizer': 'adam', 'graph_mode': 'knn', 'source': 'grm', 'knn_k': 6, 'weighted_edges': False, 'symmetrize_mode': 'union', 'use_snp_selection': False}. Best is trial 91 with value: 0.06275248714198164.
[I 2025-11-03 15:11:47,052] Trial 97 finished with value: 0.03727363212051011 and parameters: {'model_type': 'graphsage', 'hidden_dims': '[128, 64]', 'dropout': 0.38442002774892253, 'batch_norm': True, 'lr': 0.0005051169161593911, 'weight_decay': 2.9021319499839582e-06, 'epochs': 72, 'loss': 'mse', 'optimizer': 'adam', 'graph_mode': 'knn', 'source': 'grm', 'knn_k': 1, 'weighted_edges': True, 'symmetrize_mode': 'union', 'use_snp_selection': False}. Best is trial 91 with value: 0.06275248714198164.
[I 2025-11-03 15:11:49,103] Trial 98 finished with value: 0.05202982095400598 and parameters: {'model_type': 'graphsage', 'hidden_dims': '[256, 128]', 'dropout': 0.4099049331615001, 'batch_norm': True, 'lr': 0.00032656937460430317, 'weight_decay': 6.273148971949259e-06, 'epochs': 97, 'loss': 'mse', 'optimizer': 'adam', 'graph_mode': 'knn', 'source': 'grm', 'knn_k': 5, 'weighted_edges': False, 'symmetrize_mode': 'union', 'use_snp_selection': False}. Best is trial 91 with value: 0.06275248714198164.
[I 2025-11-03 15:11:51,239] Trial 99 finished with value: 0.05899975652869695 and parameters: {'model_type': 'graphsage', 'hidden_dims': '[256, 128]', 'dropout': 0.4119046397343105, 'batch_norm': True, 'lr': 9.123214104420557e-05, 'weight_decay': 1.216798850382375e-05, 'epochs': 112, 'loss': 'mse', 'optimizer': 'adam', 'graph_mode': 'knn', 'source': 'grm', 'knn_k': 5, 'weighted_edges': False, 'symmetrize_mode': 'union', 'use_snp_selection': False}. Best is trial 91 with value: 0.06275248714198164.
[I 2025-11-03 15:11:53,476] Trial 100 finished with value: 0.03763258491898558 and parameters: {'model_type': 'graphsage', 'hidden_dims': '[256, 128]', 'dropout': 0.43709982535181513, 'batch_norm': True, 'lr': 9.299179910367783e-05, 'weight_decay': 1.8330027143517508e-05, 'epochs': 108, 'loss': 'mse', 'optimizer': 'adam', 'graph_mode': 'cutoff', 'cutoff': 0.3684529969048688, 'grm_norm': 'gcn', 'self_loops': False, 'use_snp_selection': False}. Best is trial 91 with value: 0.06275248714198164.
[I 2025-11-03 15:11:55,522] Trial 101 finished with value: 0.045888377209445656 and parameters: {'model_type': 'graphsage', 'hidden_dims': '[256, 128]', 'dropout': 0.40760483845381257, 'batch_norm': True, 'lr': 6.72059912414544e-05, 'weight_decay': 2.5970493404248482e-05, 'epochs': 96, 'loss': 'mse', 'optimizer': 'adam', 'graph_mode': 'knn', 'source': 'grm', 'knn_k': 5, 'weighted_edges': False, 'symmetrize_mode': 'union', 'use_snp_selection': False}. Best is trial 91 with value: 0.06275248714198164.
[I 2025-11-03 15:11:57,374] Trial 102 finished with value: 0.0278225582366955 and parameters: {'model_type': 'graphsage', 'hidden_dims': '[256, 128]', 'dropout': 0.4312819120032793, 'batch_norm': True, 'lr': 0.00028134756790681054, 'weight_decay': 6.7729763112319984e-06, 'epochs': 61, 'loss': 'mse', 'optimizer': 'adam', 'graph_mode': 'knn', 'source': 'grm', 'knn_k': 5, 'weighted_edges': False, 'symmetrize_mode': 'union', 'use_snp_selection': False}. Best is trial 91 with value: 0.06275248714198164.
[I 2025-11-03 15:11:59,622] Trial 103 finished with value: 0.03733514351950183 and parameters: {'model_type': 'graphsage', 'hidden_dims': '[256, 128]', 'dropout': 0.35497102042620077, 'batch_norm': True, 'lr': 5.704470323021708e-05, 'weight_decay': 1.0048300675110753e-05, 'epochs': 132, 'loss': 'mse', 'optimizer': 'adam', 'graph_mode': 'knn', 'source': 'grm', 'knn_k': 5, 'weighted_edges': False, 'symmetrize_mode': 'union', 'use_snp_selection': False}. Best is trial 91 with value: 0.06275248714198164.
[I 2025-11-03 15:12:01,630] Trial 104 finished with value: 0.035373794048883855 and parameters: {'model_type': 'graphsage', 'hidden_dims': '[256, 128]', 'dropout': 0.4097354109934168, 'batch_norm': True, 'lr': 0.00035775475898769583, 'weight_decay': 1.1963116062628584e-05, 'epochs': 89, 'loss': 'mse', 'optimizer': 'adam', 'graph_mode': 'knn', 'source': 'grm', 'knn_k': 5, 'weighted_edges': False, 'symmetrize_mode': 'union', 'use_snp_selection': False}. Best is trial 91 with value: 0.06275248714198164.
[I 2025-11-03 15:12:03,373] Trial 105 finished with value: 0.027386816929515872 and parameters: {'model_type': 'graphsage', 'hidden_dims': '[256, 128]', 'dropout': 0.4475163087257834, 'batch_norm': True, 'lr': 0.00011917612721312676, 'weight_decay': 1.3112791626202996e-05, 'epochs': 45, 'loss': 'mse', 'optimizer': 'adam', 'graph_mode': 'knn', 'source': 'grm', 'knn_k': 4, 'weighted_edges': False, 'symmetrize_mode': 'union', 'use_snp_selection': False}. Best is trial 91 with value: 0.06275248714198164.
[I 2025-11-03 15:12:05,626] Trial 106 finished with value: 0.0411205084604359 and parameters: {'model_type': 'graphsage', 'hidden_dims': '[256, 128]', 'dropout': 0.3810973137652162, 'batch_norm': True, 'lr': 0.0005342296629526563, 'weight_decay': 5.355110218909973e-06, 'epochs': 113, 'loss': 'mse', 'optimizer': 'adam', 'graph_mode': 'knn', 'source': 'grm', 'knn_k': 8, 'weighted_edges': False, 'symmetrize_mode': 'union', 'use_snp_selection': False}. Best is trial 91 with value: 0.06275248714198164.
[I 2025-11-03 15:12:07,168] Trial 107 finished with value: 0.04380436652906146 and parameters: {'model_type': 'graphsage', 'hidden_dims': '[128, 64]', 'dropout': 0.2947329977899478, 'batch_norm': True, 'lr': 0.00017248429191880967, 'weight_decay': 7.589950403816135e-06, 'epochs': 54, 'loss': 'mse', 'optimizer': 'adam', 'graph_mode': 'knn', 'source': 'grm', 'knn_k': 9, 'weighted_edges': False, 'symmetrize_mode': 'union', 'use_snp_selection': False}. Best is trial 91 with value: 0.06275248714198164.
[I 2025-11-03 15:12:10,117] Trial 108 finished with value: -0.002692963394987694 and parameters: {'model_type': 'graphsage', 'hidden_dims': '[256, 128]', 'dropout': 0.463708326976802, 'batch_norm': False, 'lr': 0.0004213468700369718, 'weight_decay': 1.529228990146164e-05, 'epochs': 144, 'loss': 'mae', 'optimizer': 'adam', 'graph_mode': 'knn', 'source': 'grm', 'knn_k': 4, 'weighted_edges': False, 'symmetrize_mode': 'union', 'use_snp_selection': True, 'num_snps': 36947}. Best is trial 91 with value: 0.06275248714198164.
[I 2025-11-03 15:12:11,796] Trial 109 finished with value: 0.03856556611870561 and parameters: {'model_type': 'graphsage', 'hidden_dims': '[128, 64]', 'dropout': 0.268893440976965, 'batch_norm': True, 'lr': 0.0003155180214634677, 'weight_decay': 1.9627894537269053e-06, 'epochs': 101, 'loss': 'mse', 'optimizer': 'adam', 'graph_mode': 'knn', 'source': 'grm', 'knn_k': 7, 'weighted_edges': False, 'symmetrize_mode': 'mutual', 'use_snp_selection': False}. Best is trial 91 with value: 0.06275248714198164.
[I 2025-11-03 15:12:14,321] Trial 110 finished with value: 0.05515560761146512 and parameters: {'model_type': 'graphsage', 'hidden_dims': '[128, 64]', 'dropout': 0.3901683212217848, 'batch_norm': True, 'lr': 3.946777912552912e-05, 'weight_decay': 9.11198695766204e-06, 'epochs': 318, 'loss': 'mse', 'optimizer': 'adam', 'graph_mode': 'knn', 'source': 'grm', 'knn_k': 5, 'weighted_edges': False, 'symmetrize_mode': 'union', 'use_snp_selection': False}. Best is trial 91 with value: 0.06275248714198164.
[I 2025-11-03 15:12:16,673] Trial 111 finished with value: 0.02834341644030332 and parameters: {'model_type': 'graphsage', 'hidden_dims': '[128, 64]', 'dropout': 0.36389694526054933, 'batch_norm': True, 'lr': 2.78241772182768e-05, 'weight_decay': 5.963650492385635e-06, 'epochs': 274, 'loss': 'mse', 'optimizer': 'adam', 'graph_mode': 'knn', 'source': 'grm', 'knn_k': 5, 'weighted_edges': False, 'symmetrize_mode': 'union', 'use_snp_selection': False}. Best is trial 91 with value: 0.06275248714198164.
[I 2025-11-03 15:12:18,201] Trial 112 finished with value: 0.013224660773967544 and parameters: {'model_type': 'graphsage', 'hidden_dims': '[128, 64]', 'dropout': 0.39261335298720423, 'batch_norm': True, 'lr': 5.052939539398918e-05, 'weight_decay': 8.9673631641675e-06, 'epochs': 66, 'loss': 'mse', 'optimizer': 'adam', 'graph_mode': 'knn', 'source': 'grm', 'knn_k': 5, 'weighted_edges': False, 'symmetrize_mode': 'union', 'use_snp_selection': False}. Best is trial 91 with value: 0.06275248714198164.
[I 2025-11-03 15:12:20,748] Trial 113 finished with value: 0.03486678280966647 and parameters: {'model_type': 'graphsage', 'hidden_dims': '[128, 64]', 'dropout': 0.4230288423019023, 'batch_norm': True, 'lr': 3.346848802407122e-05, 'weight_decay': 4.44951214926363e-06, 'epochs': 324, 'loss': 'mse', 'optimizer': 'adam', 'graph_mode': 'knn', 'source': 'grm', 'knn_k': 5, 'weighted_edges': False, 'symmetrize_mode': 'union', 'use_snp_selection': False}. Best is trial 91 with value: 0.06275248714198164.
[I 2025-11-03 15:12:22,809] Trial 114 finished with value: 0.03074395094478914 and parameters: {'model_type': 'graphsage', 'hidden_dims': '[128, 64]', 'dropout': 0.39587834578997927, 'batch_norm': True, 'lr': 2.1253185010460217e-05, 'weight_decay': 9.999345125222357e-06, 'epochs': 199, 'loss': 'mse', 'optimizer': 'adam', 'graph_mode': 'knn', 'source': 'grm', 'knn_k': 6, 'weighted_edges': False, 'symmetrize_mode': 'union', 'use_snp_selection': False}. Best is trial 91 with value: 0.06275248714198164.
[I 2025-11-03 15:12:24,794] Trial 115 finished with value: 0.04941785482049551 and parameters: {'model_type': 'graphsage', 'hidden_dims': '[256, 128, 64]', 'dropout': 0.3272895540492862, 'batch_norm': True, 'lr': 0.0002280214572956559, 'weight_decay': 1.226153615169923e-06, 'epochs': 81, 'loss': 'mse', 'optimizer': 'adam', 'graph_mode': 'knn', 'source': 'grm', 'knn_k': 5, 'weighted_edges': False, 'symmetrize_mode': 'union', 'use_snp_selection': False}. Best is trial 91 with value: 0.06275248714198164.
[I 2025-11-03 15:12:26,297] Trial 116 finished with value: 0.03561515939822397 and parameters: {'model_type': 'graphsage', 'hidden_dims': '[128, 64]', 'dropout': 0.4153181329259569, 'batch_norm': True, 'lr': 0.0007620096235117074, 'weight_decay': 1.7184433493786484e-05, 'epochs': 58, 'loss': 'mse', 'optimizer': 'adam', 'graph_mode': 'knn', 'source': 'grm', 'knn_k': 6, 'weighted_edges': False, 'symmetrize_mode': 'union', 'use_snp_selection': False}. Best is trial 91 with value: 0.06275248714198164.
[I 2025-11-03 15:12:31,219] Trial 117 finished with value: 0.025038898622420404 and parameters: {'model_type': 'graphsage', 'hidden_dims': '[512, 64]', 'dropout': 0.16354947132740388, 'batch_norm': True, 'lr': 9.63854578751878e-05, 'weight_decay': 3.5529087302786243e-06, 'epochs': 289, 'loss': 'mse', 'optimizer': 'adam', 'graph_mode': 'knn', 'source': 'grm', 'knn_k': 7, 'weighted_edges': False, 'symmetrize_mode': 'union', 'use_snp_selection': False}. Best is trial 91 with value: 0.06275248714198164.
[I 2025-11-03 15:12:33,714] Trial 118 finished with value: 0.04842269952821439 and parameters: {'model_type': 'graphsage', 'hidden_dims': '[128, 64]', 'dropout': 0.2470249450951431, 'batch_norm': True, 'lr': 0.0005883779046560839, 'weight_decay': 6.928230170327752e-06, 'epochs': 312, 'loss': 'mse', 'optimizer': 'adam', 'graph_mode': 'knn', 'source': 'grm', 'knn_k': 4, 'weighted_edges': False, 'symmetrize_mode': 'union', 'use_snp_selection': False}. Best is trial 91 with value: 0.06275248714198164.
[I 2025-11-03 15:12:35,841] Trial 119 finished with value: 0.043228350150125265 and parameters: {'model_type': 'graphsage', 'hidden_dims': '[128, 64]', 'dropout': 0.2325910298498543, 'batch_norm': True, 'lr': 3.729147918697618e-06, 'weight_decay': 8.887826495115689e-07, 'epochs': 217, 'loss': 'mse', 'optimizer': 'adam', 'graph_mode': 'knn', 'source': 'grm', 'knn_k': 5, 'weighted_edges': False, 'symmetrize_mode': 'union', 'use_snp_selection': False}. Best is trial 91 with value: 0.06275248714198164.
[I 2025-11-03 15:12:37,299] Trial 120 finished with value: 0.07448932720724062 and parameters: {'model_type': 'graphsage', 'hidden_dims': '[128, 64]', 'dropout': 0.375403988082081, 'batch_norm': True, 'lr': 4.2902406649008016e-05, 'weight_decay': 2.187124784000477e-05, 'epochs': 71, 'loss': 'mse', 'optimizer': 'adam', 'graph_mode': 'cutoff', 'cutoff': 0.5483194374143944, 'grm_norm': 'gcn', 'self_loops': False, 'use_snp_selection': False}. Best is trial 120 with value: 0.07448932720724062.
[I 2025-11-03 15:12:38,870] Trial 121 finished with value: 0.03399865490176884 and parameters: {'model_type': 'graphsage', 'hidden_dims': '[128, 64]', 'dropout': 0.37780953902461156, 'batch_norm': True, 'lr': 3.991107760410522e-05, 'weight_decay': 3.5378697033863766e-05, 'epochs': 75, 'loss': 'mse', 'optimizer': 'adam', 'graph_mode': 'knn', 'source': 'grm', 'knn_k': 6, 'weighted_edges': False, 'symmetrize_mode': 'union', 'use_snp_selection': False}. Best is trial 120 with value: 0.07448932720724062.
[I 2025-11-03 15:12:40,331] Trial 122 finished with value: 0.017639380799526247 and parameters: {'model_type': 'graphsage', 'hidden_dims': '[128, 64]', 'dropout': 0.4025692210730068, 'batch_norm': True, 'lr': 2.872145150623885e-05, 'weight_decay': 4.8128131872337964e-05, 'epochs': 71, 'loss': 'mse', 'optimizer': 'adam', 'graph_mode': 'cutoff', 'cutoff': 0.5637399137107637, 'grm_norm': 'gcn', 'self_loops': False, 'use_snp_selection': False}. Best is trial 120 with value: 0.07448932720724062.
[I 2025-11-03 15:12:41,762] Trial 123 finished with value: 0.03488898868962903 and parameters: {'model_type': 'graphsage', 'hidden_dims': '[128, 64]', 'dropout': 0.31685230235164774, 'batch_norm': True, 'lr': 4.447951460447004e-05, 'weight_decay': 2.101069318951534e-05, 'epochs': 64, 'loss': 'mse', 'optimizer': 'adam', 'graph_mode': 'cutoff', 'cutoff': 0.6899932087580183, 'grm_norm': 'gcn', 'self_loops': False, 'use_snp_selection': False}. Best is trial 120 with value: 0.07448932720724062.
[I 2025-11-03 15:12:43,110] Trial 124 finished with value: 0.04413252714967145 and parameters: {'model_type': 'graphsage', 'hidden_dims': '[128, 64]', 'dropout': 0.2833799303027431, 'batch_norm': True, 'lr': 7.928959808818375e-05, 'weight_decay': 1.4104487345452345e-05, 'epochs': 43, 'loss': 'mse', 'optimizer': 'adam', 'graph_mode': 'cutoff', 'cutoff': 0.7856419498450155, 'grm_norm': 'gcn', 'self_loops': False, 'use_snp_selection': False}. Best is trial 120 with value: 0.07448932720724062.
[I 2025-11-03 15:12:44,663] Trial 125 finished with value: 0.050593011607214994 and parameters: {'model_type': 'graphsage', 'hidden_dims': '[128, 64]', 'dropout': 0.36695850149756337, 'batch_norm': True, 'lr': 0.000878614301200772, 'weight_decay': 8.311496616683661e-06, 'epochs': 94, 'loss': 'mse', 'optimizer': 'adam', 'graph_mode': 'cutoff', 'cutoff': 0.5177021493482119, 'grm_norm': 'gcn', 'self_loops': False, 'use_snp_selection': False}. Best is trial 120 with value: 0.07448932720724062.
[I 2025-11-03 15:12:47,303] Trial 126 finished with value: -0.0035745637955726136 and parameters: {'model_type': 'graphsage', 'hidden_dims': '[512, 128]', 'dropout': 0.4326093684970855, 'batch_norm': True, 'lr': 1.0013725580650348e-06, 'weight_decay': 2.4346857656549987e-05, 'epochs': 51, 'loss': 'mse', 'optimizer': 'adam', 'graph_mode': 'cutoff', 'cutoff': 0.3681987328621568, 'grm_norm': 'gcn', 'self_loops': False, 'use_snp_selection': False}. Best is trial 120 with value: 0.07448932720724062.
[I 2025-11-03 15:12:48,871] Trial 127 finished with value: 0.04925393041859333 and parameters: {'model_type': 'graphsage', 'hidden_dims': '[128, 64]', 'dropout': 0.3885848249085155, 'batch_norm': True, 'lr': 1.6812189074879577e-05, 'weight_decay': 1.1715828347404255e-05, 'epochs': 83, 'loss': 'mse', 'optimizer': 'adam', 'graph_mode': 'knn', 'source': 'grm', 'knn_k': 2, 'weighted_edges': False, 'symmetrize_mode': 'union', 'use_snp_selection': False}. Best is trial 120 with value: 0.07448932720724062.
[I 2025-11-03 15:12:51,033] Trial 128 finished with value: -0.014931451708192687 and parameters: {'model_type': 'graphsage', 'hidden_dims': '[256, 128]', 'dropout': 0.3536246020612135, 'batch_norm': False, 'lr': 0.00046261006734239833, 'weight_decay': 1.5849777462434979e-06, 'epochs': 59, 'loss': 'mae', 'optimizer': 'adam', 'graph_mode': 'knn', 'source': 'grm', 'knn_k': 5, 'weighted_edges': True, 'symmetrize_mode': 'union', 'use_snp_selection': True, 'num_snps': 23993}. Best is trial 120 with value: 0.07448932720724062.
[I 2025-11-03 15:12:52,530] Trial 129 finished with value: 0.05147037895517462 and parameters: {'model_type': 'graphsage', 'hidden_dims': '[128, 64]', 'dropout': 0.1379385318728935, 'batch_norm': True, 'lr': 0.0007242411330552573, 'weight_decay': 5.132577382566619e-06, 'epochs': 70, 'loss': 'mse', 'optimizer': 'adam', 'graph_mode': 'cutoff', 'cutoff': 0.6079283514765219, 'grm_norm': 'cosine_then_gcn', 'self_loops': False, 'use_snp_selection': False}. Best is trial 120 with value: 0.07448932720724062.
[I 2025-11-03 15:12:54,136] Trial 130 finished with value: 0.02156509472028062 and parameters: {'model_type': 'graphsage', 'hidden_dims': '[128, 64]', 'dropout': 0.39992068621371873, 'batch_norm': True, 'lr': 1.1659584261613438e-05, 'weight_decay': 6.210844325816557e-06, 'epochs': 87, 'loss': 'mse', 'optimizer': 'adam', 'graph_mode': 'knn', 'source': 'grm', 'knn_k': 7, 'weighted_edges': False, 'symmetrize_mode': 'mutual', 'use_snp_selection': False}. Best is trial 120 with value: 0.07448932720724062.
[I 2025-11-03 15:12:57,023] Trial 131 finished with value: 0.05486463059912884 and parameters: {'model_type': 'graphsage', 'hidden_dims': '[512, 256]', 'dropout': 0.20218879481995145, 'batch_norm': True, 'lr': 0.000632437857546006, 'weight_decay': 3.811429934714202e-06, 'epochs': 77, 'loss': 'mse', 'optimizer': 'adam', 'graph_mode': 'knn', 'source': 'grm', 'knn_k': 6, 'weighted_edges': True, 'symmetrize_mode': 'union', 'use_snp_selection': False}. Best is trial 120 with value: 0.07448932720724062.
[I 2025-11-03 15:12:59,865] Trial 132 finished with value: 0.054027593263006594 and parameters: {'model_type': 'graphsage', 'hidden_dims': '[512, 256]', 'dropout': 0.21653213728893475, 'batch_norm': True, 'lr': 0.0005973566522412806, 'weight_decay': 2.5253225924993594e-06, 'epochs': 78, 'loss': 'mse', 'optimizer': 'adam', 'graph_mode': 'knn', 'source': 'grm', 'knn_k': 6, 'weighted_edges': True, 'symmetrize_mode': 'union', 'use_snp_selection': False}. Best is trial 120 with value: 0.07448932720724062.
[I 2025-11-03 15:13:02,717] Trial 133 finished with value: 0.059022198152377664 and parameters: {'model_type': 'graphsage', 'hidden_dims': '[512, 256]', 'dropout': 0.21720285470272307, 'batch_norm': True, 'lr': 0.0005360851739257029, 'weight_decay': 2.104866472623309e-06, 'epochs': 79, 'loss': 'mse', 'optimizer': 'adam', 'graph_mode': 'knn', 'source': 'grm', 'knn_k': 6, 'weighted_edges': True, 'symmetrize_mode': 'union', 'use_snp_selection': False}. Best is trial 120 with value: 0.07448932720724062.
[I 2025-11-03 15:13:05,551] Trial 134 finished with value: 0.04069196290664217 and parameters: {'model_type': 'graphsage', 'hidden_dims': '[512, 256]', 'dropout': 0.21848659447058927, 'batch_norm': True, 'lr': 0.0005210202804908808, 'weight_decay': 2.606752218507189e-06, 'epochs': 77, 'loss': 'mse', 'optimizer': 'adam', 'graph_mode': 'knn', 'source': 'grm', 'knn_k': 6, 'weighted_edges': True, 'symmetrize_mode': 'union', 'use_snp_selection': False}. Best is trial 120 with value: 0.07448932720724062.
[I 2025-11-03 15:13:08,632] Trial 135 finished with value: 0.04847536023654959 and parameters: {'model_type': 'graphsage', 'hidden_dims': '[512, 256]', 'dropout': 0.16037808510084692, 'batch_norm': True, 'lr': 0.00037671401298086725, 'weight_decay': 3.434262960136573e-06, 'epochs': 103, 'loss': 'mse', 'optimizer': 'adam', 'graph_mode': 'knn', 'source': 'grm', 'knn_k': 6, 'weighted_edges': True, 'symmetrize_mode': 'union', 'use_snp_selection': False}. Best is trial 120 with value: 0.07448932720724062.
[I 2025-11-03 15:13:11,575] Trial 136 finished with value: 0.01718381639912365 and parameters: {'model_type': 'graphsage', 'hidden_dims': '[512, 256]', 'dropout': 0.18861560966788618, 'batch_norm': True, 'lr': 3.8669860117078125e-05, 'weight_decay': 2.0859823531001174e-06, 'epochs': 92, 'loss': 'mse', 'optimizer': 'adam', 'graph_mode': 'knn', 'source': 'grm', 'knn_k': 5, 'weighted_edges': True, 'symmetrize_mode': 'union', 'use_snp_selection': False}. Best is trial 120 with value: 0.07448932720724062.
[I 2025-11-03 15:13:14,447] Trial 137 finished with value: 0.046368836768914776 and parameters: {'model_type': 'graphsage', 'hidden_dims': '[512, 256]', 'dropout': 0.20356478143140602, 'batch_norm': True, 'lr': 0.00045102765517245785, 'weight_decay': 4.597879938402927e-06, 'epochs': 81, 'loss': 'mse', 'optimizer': 'adam', 'graph_mode': 'knn', 'source': 'grm', 'knn_k': 6, 'weighted_edges': True, 'symmetrize_mode': 'union', 'use_snp_selection': False}. Best is trial 120 with value: 0.07448932720724062.
[I 2025-11-03 15:13:17,189] Trial 138 finished with value: 0.05155027399164111 and parameters: {'model_type': 'graphsage', 'hidden_dims': '[512, 256]', 'dropout': 0.17904918052442143, 'batch_norm': True, 'lr': 0.0005886095708174795, 'weight_decay': 2.7031969360620207e-06, 'epochs': 70, 'loss': 'mse', 'optimizer': 'adam', 'graph_mode': 'knn', 'source': 'grm', 'knn_k': 5, 'weighted_edges': True, 'symmetrize_mode': 'union', 'use_snp_selection': False}. Best is trial 120 with value: 0.07448932720724062.
