[I 2025-11-03 13:51:36,298] Trial 79 finished with value: 0.03421122294730475 and parameters: {'model_type': 'gcn', 'hidden_dims': '[512, 64]', 'dropout': 0.5608773515991833, 'batch_norm': True, 'lr': 0.0003647867253916487, 'weight_decay': 5.9288177154084986e-05, 'epochs': 287, 'loss': 'mse', 'optimizer': 'adam', 'graph_mode': 'cutoff', 'cutoff': 0.8437657545647252, 'grm_norm': 'cosine', 'self_loops': False, 'use_snp_selection': False}. Best is trial 45 with value: 0.08406083721143744.
[I 2025-11-03 13:51:37,495] Trial 80 finished with value: 0.06493537658386114 and parameters: {'model_type': 'gcn', 'hidden_dims': '[128, 64]', 'dropout': 0.48950540452006946, 'batch_norm': True, 'lr': 0.0008165935212016277, 'weight_decay': 2.542022236245713e-05, 'epochs': 85, 'loss': 'mse', 'optimizer': 'adam', 'graph_mode': 'cutoff', 'cutoff': 0.7060180761184386, 'grm_norm': 'gcn', 'self_loops': False, 'use_snp_selection': False}. Best is trial 45 with value: 0.08406083721143744.
[I 2025-11-03 13:51:38,725] Trial 81 finished with value: 0.05552328724916389 and parameters: {'model_type': 'gcn', 'hidden_dims': '[256, 128]', 'dropout': 0.5878001934295095, 'batch_norm': True, 'lr': 0.00029715662884531195, 'weight_decay': 9.212342441533516e-06, 'epochs': 54, 'loss': 'mse', 'optimizer': 'adam', 'graph_mode': 'cutoff', 'cutoff': 0.7596957014141793, 'grm_norm': 'cosine', 'self_loops': False, 'use_snp_selection': False}. Best is trial 45 with value: 0.08406083721143744.
[I 2025-11-03 13:51:40,953] Trial 82 finished with value: 0.07086430429137315 and parameters: {'model_type': 'gcn', 'hidden_dims': '[512, 128]', 'dropout': 0.5479601563923535, 'batch_norm': True, 'lr': 0.00019018433262146328, 'weight_decay': 4.530354050072246e-06, 'epochs': 193, 'loss': 'mse', 'optimizer': 'adam', 'graph_mode': 'cutoff', 'cutoff': 0.6444803802930539, 'grm_norm': 'cosine', 'self_loops': False, 'use_snp_selection': False}. Best is trial 45 with value: 0.08406083721143744.
[I 2025-11-03 13:51:43,245] Trial 83 finished with value: 0.04191804399109634 and parameters: {'model_type': 'gcn', 'hidden_dims': '[512, 64]', 'dropout': 0.5482892505896682, 'batch_norm': True, 'lr': 0.00019098280092525805, 'weight_decay': 4.8383595106533445e-06, 'epochs': 204, 'loss': 'mse', 'optimizer': 'adam', 'graph_mode': 'cutoff', 'cutoff': 0.6290669781715766, 'grm_norm': 'cosine', 'self_loops': False, 'use_snp_selection': False}. Best is trial 45 with value: 0.08406083721143744.
[I 2025-11-03 13:51:45,472] Trial 84 finished with value: 0.05231699587505648 and parameters: {'model_type': 'gcn', 'hidden_dims': '[512, 128]', 'dropout': 0.512471503308902, 'batch_norm': True, 'lr': 0.00047096645570695044, 'weight_decay': 6.479353797687827e-06, 'epochs': 193, 'loss': 'mse', 'optimizer': 'adam', 'graph_mode': 'cutoff', 'cutoff': 0.7408138407738831, 'grm_norm': 'cosine', 'self_loops': False, 'use_snp_selection': False}. Best is trial 45 with value: 0.08406083721143744.
[I 2025-11-03 13:51:47,651] Trial 85 finished with value: 0.015500437630837931 and parameters: {'model_type': 'gcn', 'hidden_dims': '[512, 128]', 'dropout': 0.534982526741654, 'batch_norm': True, 'lr': 6.184146441354422e-05, 'weight_decay': 2.5005403439108937e-06, 'epochs': 185, 'loss': 'mse', 'optimizer': 'adam', 'graph_mode': 'cutoff', 'cutoff': 0.683565800425389, 'grm_norm': 'cosine', 'self_loops': False, 'use_snp_selection': False}. Best is trial 45 with value: 0.08406083721143744.
[I 2025-11-03 13:51:50,129] Trial 86 finished with value: 0.05352973295617301 and parameters: {'model_type': 'gcn', 'hidden_dims': '[512, 64]', 'dropout': 0.528981552579396, 'batch_norm': True, 'lr': 0.0005884241498143925, 'weight_decay': 1.2597015611520555e-05, 'epochs': 244, 'loss': 'mse', 'optimizer': 'adam', 'graph_mode': 'cutoff', 'cutoff': 0.7194917077243066, 'grm_norm': 'none', 'self_loops': True, 'use_snp_selection': False}. Best is trial 45 with value: 0.08406083721143744.
[I 2025-11-03 13:51:52,953] Trial 87 finished with value: 0.04172485921850825 and parameters: {'model_type': 'gcn', 'hidden_dims': '[512, 128]', 'dropout': 0.5845659066834985, 'batch_norm': True, 'lr': 0.00014604757912515802, 'weight_decay': 3.5732808525346452e-06, 'epochs': 308, 'loss': 'mse', 'optimizer': 'adam', 'graph_mode': 'cutoff', 'cutoff': 0.6469851637839166, 'grm_norm': 'cosine', 'self_loops': False, 'use_snp_selection': False}. Best is trial 45 with value: 0.08406083721143744.
[I 2025-11-03 13:51:55,059] Trial 88 finished with value: 0.012210365013916103 and parameters: {'model_type': 'gcn', 'hidden_dims': '[512, 128]', 'dropout': 0.43762203000592004, 'batch_norm': True, 'lr': 0.00010985134153487508, 'weight_decay': 8.339277196087772e-06, 'epochs': 174, 'loss': 'mse', 'optimizer': 'adam', 'graph_mode': 'cutoff', 'cutoff': 0.775878533883689, 'grm_norm': 'none', 'self_loops': True, 'use_snp_selection': False}. Best is trial 45 with value: 0.08406083721143744.
[I 2025-11-03 13:51:56,359] Trial 89 finished with value: -0.006714662012689225 and parameters: {'model_type': 'gcn', 'hidden_dims': '[128, 64]', 'dropout': 0.5583891929665833, 'batch_norm': True, 'lr': 2.809309428241897e-05, 'weight_decay': 4.434658974081399e-06, 'epochs': 114, 'loss': 'mae', 'optimizer': 'adam', 'graph_mode': 'cutoff', 'cutoff': 0.37725535904276586, 'grm_norm': 'gcn', 'self_loops': False, 'use_snp_selection': False}. Best is trial 45 with value: 0.08406083721143744.
[I 2025-11-03 13:51:57,566] Trial 90 finished with value: 0.016497307442583226 and parameters: {'model_type': 'gcn', 'hidden_dims': '[512, 128]', 'dropout': 0.46378073019290667, 'batch_norm': False, 'lr': 0.0003721414011790716, 'weight_decay': 1.201735828899466e-07, 'epochs': 102, 'loss': 'mse', 'optimizer': 'adam', 'graph_mode': 'knn', 'source': 'grm', 'knn_k': 9, 'weighted_edges': True, 'symmetrize_mode': 'union', 'use_snp_selection': True, 'num_snps': 3647}. Best is trial 45 with value: 0.08406083721143744.
[I 2025-11-03 13:51:59,251] Trial 91 finished with value: 0.08414917255143471 and parameters: {'model_type': 'gcn', 'hidden_dims': '[512, 128]', 'dropout': 0.5678353607453104, 'batch_norm': True, 'lr': 0.00022975914815465787, 'weight_decay': 2.1916397496724026e-07, 'epochs': 80, 'loss': 'mse', 'optimizer': 'adam', 'graph_mode': 'cutoff', 'cutoff': 0.5971563134353456, 'grm_norm': 'cosine', 'self_loops': False, 'use_snp_selection': False}. Best is trial 91 with value: 0.08414917255143471.
[I 2025-11-03 13:52:00,909] Trial 92 finished with value: 0.07266628664505509 and parameters: {'model_type': 'gcn', 'hidden_dims': '[512, 128]', 'dropout': 0.5477699670422269, 'batch_norm': True, 'lr': 0.00017661808583554068, 'weight_decay': 2.980134396978064e-07, 'epochs': 81, 'loss': 'mse', 'optimizer': 'adam', 'graph_mode': 'cutoff', 'cutoff': 0.6049723827781138, 'grm_norm': 'cosine', 'self_loops': False, 'use_snp_selection': False}. Best is trial 91 with value: 0.08414917255143471.
[I 2025-11-03 13:52:02,481] Trial 93 finished with value: 0.04301429782585399 and parameters: {'model_type': 'gcn', 'hidden_dims': '[512, 128]', 'dropout': 0.5805581408178452, 'batch_norm': True, 'lr': 0.00019306257680758385, 'weight_decay': 2.63392871822023e-07, 'epochs': 65, 'loss': 'mse', 'optimizer': 'adam', 'graph_mode': 'cutoff', 'cutoff': 0.6002510592611361, 'grm_norm': 'cosine', 'self_loops': False, 'use_snp_selection': False}. Best is trial 91 with value: 0.08414917255143471.
[I 2025-11-03 13:52:03,906] Trial 94 finished with value: 0.03183230298581667 and parameters: {'model_type': 'gcn', 'hidden_dims': '[512, 128]', 'dropout': 0.5672740061309308, 'batch_norm': True, 'lr': 0.000167966912592302, 'weight_decay': 2.0836230828359148e-07, 'epochs': 34, 'loss': 'mse', 'optimizer': 'adam', 'graph_mode': 'cutoff', 'cutoff': 0.6414399237180923, 'grm_norm': 'cosine', 'self_loops': False, 'use_snp_selection': False}. Best is trial 91 with value: 0.08414917255143471.
[I 2025-11-03 13:52:05,603] Trial 95 finished with value: 0.030596482541906153 and parameters: {'model_type': 'gcn', 'hidden_dims': '[512, 128]', 'dropout': 0.5493246866228293, 'batch_norm': True, 'lr': 0.00012160855673030031, 'weight_decay': 3.193216611875943e-07, 'epochs': 82, 'loss': 'mse', 'optimizer': 'adam', 'graph_mode': 'cutoff', 'cutoff': 0.6100239196340894, 'grm_norm': 'cosine', 'self_loops': False, 'use_snp_selection': False}. Best is trial 91 with value: 0.08414917255143471.
[I 2025-11-03 13:52:07,315] Trial 96 finished with value: 0.06514840960248423 and parameters: {'model_type': 'gcn', 'hidden_dims': '[512, 128]', 'dropout': 0.5631717611738185, 'batch_norm': True, 'lr': 0.00028134388328335323, 'weight_decay': 1.7695697228380064e-06, 'epochs': 90, 'loss': 'mse', 'optimizer': 'adam', 'graph_mode': 'cutoff', 'cutoff': 0.5579675928146283, 'grm_norm': 'cosine', 'self_loops': False, 'use_snp_selection': False}. Best is trial 91 with value: 0.08414917255143471.
[I 2025-11-03 13:52:09,725] Trial 97 finished with value: 0.03584321908760809 and parameters: {'model_type': 'gcn', 'hidden_dims': '[512, 128]', 'dropout': 0.48017004605772323, 'batch_norm': True, 'lr': 0.0004460653170785362, 'weight_decay': 7.871736331015471e-07, 'epochs': 229, 'loss': 'mse', 'optimizer': 'adam', 'graph_mode': 'cutoff', 'cutoff': 0.5837311612333573, 'grm_norm': 'cosine', 'self_loops': False, 'use_snp_selection': False}. Best is trial 91 with value: 0.08414917255143471.
[I 2025-11-03 13:52:11,971] Trial 98 finished with value: 0.019302131026015523 and parameters: {'model_type': 'gcn', 'hidden_dims': '[512, 128]', 'dropout': 0.5928317541587046, 'batch_norm': True, 'lr': 7.619027426078041e-05, 'weight_decay': 1.0892239046757424e-05, 'epochs': 196, 'loss': 'mse', 'optimizer': 'adam', 'graph_mode': 'cutoff', 'cutoff': 0.5277081745606611, 'grm_norm': 'cosine', 'self_loops': False, 'use_snp_selection': False}. Best is trial 91 with value: 0.08414917255143471.
[I 2025-11-03 13:52:13,468] Trial 99 finished with value: 0.00761573030907194 and parameters: {'model_type': 'gcn', 'hidden_dims': '[512, 256]', 'dropout': 0.5434705225858172, 'batch_norm': True, 'lr': 1.0675169348687084e-05, 'weight_decay': 3.180604877227718e-06, 'epochs': 49, 'loss': 'mse', 'optimizer': 'adam', 'graph_mode': 'cutoff', 'cutoff': 0.6860158136572785, 'grm_norm': 'cosine', 'self_loops': True, 'use_snp_selection': False}. Best is trial 91 with value: 0.08414917255143471.
[I 2025-11-03 13:52:15,526] Trial 100 finished with value: 0.057480030072923446 and parameters: {'model_type': 'gcn', 'hidden_dims': '[512, 128]', 'dropout': 0.5793458266443008, 'batch_norm': True, 'lr': 0.0009799726865993381, 'weight_decay': 1.0042753256858343e-07, 'epochs': 160, 'loss': 'mse', 'optimizer': 'adam', 'graph_mode': 'cutoff', 'cutoff': 0.5040881998934393, 'grm_norm': 'none', 'self_loops': False, 'use_snp_selection': False}. Best is trial 91 with value: 0.08414917255143471.
[I 2025-11-03 13:52:17,856] Trial 101 finished with value: 0.05459231527945802 and parameters: {'model_type': 'gcn', 'hidden_dims': '[512, 64]', 'dropout': 0.5213182142242277, 'batch_norm': True, 'lr': 0.00021363795143046938, 'weight_decay': 1.489629995986279e-07, 'epochs': 212, 'loss': 'mse', 'optimizer': 'adam', 'graph_mode': 'cutoff', 'cutoff': 0.810518029188728, 'grm_norm': 'cosine', 'self_loops': False, 'use_snp_selection': False}. Best is trial 91 with value: 0.08414917255143471.
[I 2025-11-03 13:52:19,480] Trial 102 finished with value: 0.012444583472371594 and parameters: {'model_type': 'gcn', 'hidden_dims': '[512, 128]', 'dropout': 0.5024984126588721, 'batch_norm': True, 'lr': 0.0002407398228488039, 'weight_decay': 4.1134412518350356e-07, 'epochs': 72, 'loss': 'mse', 'optimizer': 'adam', 'graph_mode': 'cutoff', 'cutoff': 0.28739434591401114, 'grm_norm': 'cosine', 'self_loops': True, 'use_snp_selection': False}. Best is trial 91 with value: 0.08414917255143471.
[I 2025-11-03 13:52:20,798] Trial 103 finished with value: 0.06398743096816573 and parameters: {'model_type': 'gcn', 'hidden_dims': '[256, 128]', 'dropout': 0.5535470381496488, 'batch_norm': True, 'lr': 0.00030863361279720474, 'weight_decay': 1.3625023264709642e-07, 'epochs': 80, 'loss': 'mse', 'optimizer': 'adam', 'graph_mode': 'cutoff', 'cutoff': 0.6636018160296654, 'grm_norm': 'none', 'self_loops': False, 'use_snp_selection': False}. Best is trial 91 with value: 0.08414917255143471.
[I 2025-11-03 13:52:22,636] Trial 104 finished with value: 0.037502630137606234 and parameters: {'model_type': 'gcn', 'hidden_dims': '[512, 128]', 'dropout': 0.5152612898674629, 'batch_norm': True, 'lr': 0.00026479691548357694, 'weight_decay': 2.0083324610267445e-07, 'epochs': 107, 'loss': 'mse', 'optimizer': 'adam', 'graph_mode': 'knn', 'source': 'grm', 'knn_k': 3, 'weighted_edges': False, 'symmetrize_mode': 'mutual', 'use_snp_selection': False}. Best is trial 91 with value: 0.08414917255143471.
[I 2025-11-03 13:52:24,538] Trial 105 finished with value: 0.02915219546048435 and parameters: {'model_type': 'gcn', 'hidden_dims': '[512, 64]', 'dropout': 0.529989641573556, 'batch_norm': True, 'lr': 0.00016642121883266885, 'weight_decay': 5.710229877388732e-06, 'epochs': 130, 'loss': 'mse', 'optimizer': 'adam', 'graph_mode': 'cutoff', 'cutoff': 0.6117556205557468, 'grm_norm': 'cosine', 'self_loops': False, 'use_snp_selection': False}. Best is trial 91 with value: 0.08414917255143471.
[I 2025-11-03 13:52:26,263] Trial 106 finished with value: 0.02515129318122287 and parameters: {'model_type': 'gcn', 'hidden_dims': '[512, 128]', 'dropout': 0.5400453282638584, 'batch_norm': True, 'lr': 0.00035775755323376565, 'weight_decay': 2.3564796643817115e-07, 'epochs': 93, 'loss': 'mse', 'optimizer': 'adam', 'graph_mode': 'cutoff', 'cutoff': 0.23656191948227095, 'grm_norm': 'gcn', 'self_loops': True, 'use_snp_selection': False}. Best is trial 91 with value: 0.08414917255143471.
[I 2025-11-03 13:52:28,086] Trial 107 finished with value: -0.020897085558998763 and parameters: {'model_type': 'gcn', 'hidden_dims': '[512, 128]', 'dropout': 0.567420543212947, 'batch_norm': True, 'lr': 2.312992506453103e-06, 'weight_decay': 3.1449126535769157e-07, 'epochs': 116, 'loss': 'mse', 'optimizer': 'adam', 'graph_mode': 'cutoff', 'cutoff': 0.5556475425455104, 'grm_norm': 'none', 'self_loops': False, 'use_snp_selection': False}. Best is trial 91 with value: 0.08414917255143471.
[I 2025-11-03 13:52:30,349] Trial 108 finished with value: -0.03120565279884149 and parameters: {'model_type': 'gcn', 'hidden_dims': '[512, 64]', 'dropout': 0.5560815855142472, 'batch_norm': False, 'lr': 0.0007393724672309889, 'weight_decay': 1.294167134088487e-06, 'epochs': 65, 'loss': 'mae', 'optimizer': 'adam', 'graph_mode': 'cutoff', 'cutoff': 0.6961994923668134, 'grm_norm': 'cosine', 'self_loops': False, 'use_snp_selection': True, 'num_snps': 36947}. Best is trial 91 with value: 0.08414917255143471.
[I 2025-11-03 13:52:31,877] Trial 109 finished with value: 0.005962003909640652 and parameters: {'model_type': 'gcn', 'hidden_dims': '[512, 128]', 'dropout': 0.4481552147410043, 'batch_norm': True, 'lr': 8.655142338950812e-05, 'weight_decay': 7.046347978468197e-06, 'epochs': 39, 'loss': 'mse', 'optimizer': 'adam', 'graph_mode': 'knn', 'source': 'grm', 'knn_k': 7, 'weighted_edges': False, 'symmetrize_mode': 'mutual', 'use_snp_selection': False}. Best is trial 91 with value: 0.08414917255143471.
[I 2025-11-03 13:52:33,239] Trial 110 finished with value: 0.04701522066927436 and parameters: {'model_type': 'gcn', 'hidden_dims': '[512, 128]', 'dropout': 0.4941165630746646, 'batch_norm': True, 'lr': 0.000525909011088048, 'weight_decay': 1.4866967261960187e-05, 'epochs': 21, 'loss': 'mse', 'optimizer': 'adam', 'graph_mode': 'cutoff', 'cutoff': 0.6388991731755288, 'grm_norm': 'cosine', 'self_loops': True, 'use_snp_selection': False}. Best is trial 91 with value: 0.08414917255143471.
[I 2025-11-03 13:52:34,921] Trial 111 finished with value: 0.043984256928057276 and parameters: {'model_type': 'gcn', 'hidden_dims': '[512, 128]', 'dropout': 0.5755480218319106, 'batch_norm': True, 'lr': 0.00020747197609302035, 'weight_decay': 4.740019141097822e-07, 'epochs': 77, 'loss': 'mse', 'optimizer': 'adam', 'graph_mode': 'cutoff', 'cutoff': 0.5720140160244295, 'grm_norm': 'cosine', 'self_loops': False, 'use_snp_selection': False}. Best is trial 91 with value: 0.08414917255143471.
[I 2025-11-03 13:52:36,606] Trial 112 finished with value: 0.0409628387468067 and parameters: {'model_type': 'gcn', 'hidden_dims': '[512, 128]', 'dropout': 0.5242876203291622, 'batch_norm': True, 'lr': 0.00014085247176265928, 'weight_decay': 1.6838518833890755e-07, 'epochs': 87, 'loss': 'mse', 'optimizer': 'adam', 'graph_mode': 'cutoff', 'cutoff': 0.5670955139680947, 'grm_norm': 'cosine', 'self_loops': False, 'use_snp_selection': False}. Best is trial 91 with value: 0.08414917255143471.
[I 2025-11-03 13:52:38,379] Trial 113 finished with value: 0.03293149003303375 and parameters: {'model_type': 'gcn', 'hidden_dims': '[512, 128]', 'dropout': 0.5470971782391114, 'batch_norm': True, 'lr': 0.00024128801534183347, 'weight_decay': 2.7419724573232946e-07, 'epochs': 102, 'loss': 'mse', 'optimizer': 'adam', 'graph_mode': 'cutoff', 'cutoff': 0.5394934360709964, 'grm_norm': 'cosine', 'self_loops': False, 'use_snp_selection': False}. Best is trial 91 with value: 0.08414917255143471.
[I 2025-11-03 13:52:39,939] Trial 114 finished with value: 0.0698373752923637 and parameters: {'model_type': 'gcn', 'hidden_dims': '[512, 128]', 'dropout': 0.5102142266250314, 'batch_norm': True, 'lr': 0.0008485634294562584, 'weight_decay': 6.184435526346444e-07, 'epochs': 58, 'loss': 'mse', 'optimizer': 'adam', 'graph_mode': 'cutoff', 'cutoff': 0.4627868584288838, 'grm_norm': 'none', 'self_loops': False, 'use_snp_selection': False}. Best is trial 91 with value: 0.08414917255143471.
[I 2025-11-03 13:52:41,500] Trial 115 finished with value: 0.07078651120994874 and parameters: {'model_type': 'gcn', 'hidden_dims': '[512, 64]', 'dropout': 0.5114027105767057, 'batch_norm': True, 'lr': 0.0008306562537356591, 'weight_decay': 9.12751204986873e-06, 'epochs': 59, 'loss': 'mse', 'optimizer': 'adam', 'graph_mode': 'cutoff', 'cutoff': 0.4228149444388304, 'grm_norm': 'none', 'self_loops': False, 'use_snp_selection': False}. Best is trial 91 with value: 0.08414917255143471.
[I 2025-11-03 13:52:42,648] Trial 116 finished with value: 0.06198986862186519 and parameters: {'model_type': 'gcn', 'hidden_dims': '[128, 64]', 'dropout': 0.5071622733010942, 'batch_norm': True, 'lr': 0.0008519684395919061, 'weight_decay': 1.0320445153392586e-05, 'epochs': 62, 'loss': 'mse', 'optimizer': 'adam', 'graph_mode': 'cutoff', 'cutoff': 0.42561093272450573, 'grm_norm': 'none', 'self_loops': False, 'use_snp_selection': False}. Best is trial 91 with value: 0.08414917255143471.
[I 2025-11-03 13:52:44,220] Trial 117 finished with value: 0.06104001115845289 and parameters: {'model_type': 'gcn', 'hidden_dims': '[512, 128]', 'dropout': 0.48077205632277215, 'batch_norm': True, 'lr': 0.0006826993133603018, 'weight_decay': 5.27627373254634e-06, 'epochs': 54, 'loss': 'mse', 'optimizer': 'adam', 'graph_mode': 'cutoff', 'cutoff': 0.4574237474321067, 'grm_norm': 'none', 'self_loops': False, 'use_snp_selection': False}. Best is trial 91 with value: 0.08414917255143471.
[I 2025-11-03 13:52:45,626] Trial 118 finished with value: 0.024886934825326296 and parameters: {'model_type': 'gcn', 'hidden_dims': '[512, 256]', 'dropout': 0.5374635001627993, 'batch_norm': True, 'lr': 0.0008284745565144234, 'weight_decay': 2.281931341901175e-05, 'epochs': 27, 'loss': 'mse', 'optimizer': 'adam', 'graph_mode': 'cutoff', 'cutoff': 0.39147997761983855, 'grm_norm': 'none', 'self_loops': False, 'use_snp_selection': False}. Best is trial 91 with value: 0.08414917255143471.
[I 2025-11-03 13:52:47,175] Trial 119 finished with value: 0.04231386347971669 and parameters: {'model_type': 'gcn', 'hidden_dims': '[512, 64]', 'dropout': 0.10420268833378221, 'batch_norm': True, 'lr': 0.0005485334660304674, 'weight_decay': 9.234947686829707e-06, 'epochs': 57, 'loss': 'mse', 'optimizer': 'adam', 'graph_mode': 'cutoff', 'cutoff': 0.4126186326175002, 'grm_norm': 'none', 'self_loops': False, 'use_snp_selection': False}. Best is trial 91 with value: 0.08414917255143471.
[I 2025-11-03 13:52:48,795] Trial 120 finished with value: 0.0468482123042637 and parameters: {'model_type': 'gcn', 'hidden_dims': '[512, 128]', 'dropout': 0.4718576354090426, 'batch_norm': True, 'lr': 0.0006308493494127746, 'weight_decay': 5.965808331313765e-07, 'epochs': 69, 'loss': 'mse', 'optimizer': 'adam', 'graph_mode': 'cutoff', 'cutoff': 0.4906321605230727, 'grm_norm': 'none', 'self_loops': False, 'use_snp_selection': False}. Best is trial 91 with value: 0.08414917255143471.
[I 2025-11-03 13:52:50,514] Trial 121 finished with value: 0.062100541340656346 and parameters: {'model_type': 'gcn', 'hidden_dims': '[512, 64]', 'dropout': 0.4998849824985878, 'batch_norm': True, 'lr': 0.0009910256719896083, 'weight_decay': 4.269530573420942e-06, 'epochs': 91, 'loss': 'mse', 'optimizer': 'adam', 'graph_mode': 'cutoff', 'cutoff': 0.34421489148105877, 'grm_norm': 'none', 'self_loops': False, 'use_snp_selection': False}. Best is trial 91 with value: 0.08414917255143471.
[I 2025-11-03 13:52:52,024] Trial 122 finished with value: 0.05843450431438055 and parameters: {'model_type': 'gcn', 'hidden_dims': '[512, 64]', 'dropout': 0.5101552729288621, 'batch_norm': True, 'lr': 0.0004447239835905653, 'weight_decay': 2.0085278496658018e-05, 'epochs': 51, 'loss': 'mse', 'optimizer': 'adam', 'graph_mode': 'cutoff', 'cutoff': 0.46508609307454796, 'grm_norm': 'none', 'self_loops': False, 'use_snp_selection': False}. Best is trial 91 with value: 0.08414917255143471.
