[I 2025-11-03 14:43:33,613] Trial 140 finished with value: 0.12066845333034627 and parameters: {'model_type': 'graphsage', 'hidden_dims': '[512, 256]', 'dropout': 0.29389207855118643, 'batch_norm': True, 'lr': 0.000984618985107266, 'weight_decay': 1.5506449602838594e-07, 'epochs': 239, 'loss': 'mse', 'optimizer': 'adam', 'graph_mode': 'knn', 'source': 'grm', 'knn_k': 6, 'weighted_edges': False, 'symmetrize_mode': 'mutual', 'use_snp_selection': False}. Best is trial 24 with value: 0.1360864241733849.
[I 2025-11-03 14:43:39,512] Trial 141 finished with value: 0.11702169531902393 and parameters: {'model_type': 'graphsage', 'hidden_dims': '[512, 256]', 'dropout': 0.35568968088381236, 'batch_norm': True, 'lr': 0.0006157868034667561, 'weight_decay': 0.00048707258313465625, 'epochs': 281, 'loss': 'mse', 'optimizer': 'adam', 'graph_mode': 'knn', 'source': 'grm', 'knn_k': 5, 'weighted_edges': True, 'symmetrize_mode': 'mutual', 'use_snp_selection': False}. Best is trial 24 with value: 0.1360864241733849.
[I 2025-11-03 14:43:45,368] Trial 142 finished with value: 0.12348488744409664 and parameters: {'model_type': 'graphsage', 'hidden_dims': '[512, 256]', 'dropout': 0.42903789641609413, 'batch_norm': True, 'lr': 0.0004917308798168353, 'weight_decay': 0.00024640405476823783, 'epochs': 267, 'loss': 'mse', 'optimizer': 'adam', 'graph_mode': 'knn', 'source': 'grm', 'knn_k': 7, 'weighted_edges': True, 'symmetrize_mode': 'mutual', 'use_snp_selection': False}. Best is trial 24 with value: 0.1360864241733849.
[I 2025-11-03 14:43:51,245] Trial 143 finished with value: 0.12052944035833585 and parameters: {'model_type': 'graphsage', 'hidden_dims': '[512, 256]', 'dropout': 0.42742300108842457, 'batch_norm': True, 'lr': 0.0004710387596097214, 'weight_decay': 0.000153613281269745, 'epochs': 269, 'loss': 'mse', 'optimizer': 'adam', 'graph_mode': 'knn', 'source': 'grm', 'knn_k': 7, 'weighted_edges': True, 'symmetrize_mode': 'mutual', 'use_snp_selection': False}. Best is trial 24 with value: 0.1360864241733849.
[I 2025-11-03 14:43:56,849] Trial 144 finished with value: 0.12526250920616494 and parameters: {'model_type': 'graphsage', 'hidden_dims': '[512, 256]', 'dropout': 0.4543957352113752, 'batch_norm': True, 'lr': 0.0007646404268086667, 'weight_decay': 0.0002420121464291105, 'epochs': 254, 'loss': 'mse', 'optimizer': 'adam', 'graph_mode': 'knn', 'source': 'grm', 'knn_k': 7, 'weighted_edges': True, 'symmetrize_mode': 'mutual', 'use_snp_selection': False}. Best is trial 24 with value: 0.1360864241733849.
[I 2025-11-03 14:44:02,644] Trial 145 finished with value: 0.10290031129884383 and parameters: {'model_type': 'graphsage', 'hidden_dims': '[512, 256]', 'dropout': 0.4648110282486165, 'batch_norm': True, 'lr': 0.0008058411633791868, 'weight_decay': 0.000203480537693701, 'epochs': 263, 'loss': 'mse', 'optimizer': 'adam', 'graph_mode': 'knn', 'source': 'grm', 'knn_k': 7, 'weighted_edges': True, 'symmetrize_mode': 'mutual', 'use_snp_selection': False}. Best is trial 24 with value: 0.1360864241733849.
[I 2025-11-03 14:44:08,346] Trial 146 finished with value: 0.11403389192241205 and parameters: {'model_type': 'graphsage', 'hidden_dims': '[512, 256]', 'dropout': 0.44855842367303284, 'batch_norm': True, 'lr': 0.000657213255111109, 'weight_decay': 3.148849667571165e-05, 'epochs': 255, 'loss': 'mse', 'optimizer': 'adam', 'graph_mode': 'knn', 'source': 'grm', 'knn_k': 7, 'weighted_edges': True, 'symmetrize_mode': 'mutual', 'use_snp_selection': False}. Best is trial 24 with value: 0.1360864241733849.
[I 2025-11-03 14:44:14,716] Trial 147 finished with value: 0.11832506449368124 and parameters: {'model_type': 'graphsage', 'hidden_dims': '[512, 256]', 'dropout': 0.43794560479223116, 'batch_norm': True, 'lr': 0.0005545794021357647, 'weight_decay': 0.0002515854597857409, 'epochs': 266, 'loss': 'mse', 'optimizer': 'adam', 'graph_mode': 'knn', 'source': 'grm', 'knn_k': 7, 'weighted_edges': True, 'symmetrize_mode': 'union', 'use_snp_selection': False}. Best is trial 24 with value: 0.1360864241733849.
[I 2025-11-03 14:44:20,316] Trial 148 finished with value: 0.11912546855838643 and parameters: {'model_type': 'graphsage', 'hidden_dims': '[512, 256]', 'dropout': 0.4488407237560844, 'batch_norm': True, 'lr': 0.0007649188585507557, 'weight_decay': 0.0005752885311699507, 'epochs': 249, 'loss': 'mae', 'optimizer': 'adam', 'graph_mode': 'knn', 'source': 'grm', 'knn_k': 8, 'weighted_edges': True, 'symmetrize_mode': 'mutual', 'use_snp_selection': False}. Best is trial 24 with value: 0.1360864241733849.
[I 2025-11-03 14:44:25,419] Trial 149 finished with value: 0.026639619275120374 and parameters: {'model_type': 'graphsage', 'hidden_dims': '[512, 256]', 'dropout': 0.49386173104347725, 'batch_norm': False, 'lr': 0.0008928816702078675, 'weight_decay': 0.00025586545523754496, 'epochs': 277, 'loss': 'mse', 'optimizer': 'adam', 'graph_mode': 'knn', 'source': 'grm', 'knn_k': 6, 'weighted_edges': True, 'symmetrize_mode': 'mutual', 'use_snp_selection': True, 'num_snps': 36015}. Best is trial 24 with value: 0.1360864241733849.
[I 2025-11-03 14:44:28,250] Trial 0 finished with value: 0.027033369111860547 and parameters: {'model_type': 'graphsage', 'hidden_dims': '[128, 64]', 'dropout': 0.199031432379812, 'batch_norm': True, 'lr': 1.8408544111075837e-06, 'weight_decay': 5.5136510071208614e-05, 'epochs': 336, 'loss': 'mae', 'optimizer': 'adam', 'graph_mode': 'knn', 'source': 'grm', 'knn_k': 8, 'weighted_edges': True, 'symmetrize_mode': 'mutual', 'use_snp_selection': False}. Best is trial 0 with value: 0.027033369111860547.
[I 2025-11-03 14:44:29,905] Trial 1 finished with value: -0.014472567282353565 and parameters: {'model_type': 'graphsage', 'hidden_dims': '[128, 64]', 'dropout': 0.40051947670227217, 'batch_norm': True, 'lr': 0.0005320428882732732, 'weight_decay': 1.89210117736594e-06, 'epochs': 68, 'loss': 'mse', 'optimizer': 'adam', 'graph_mode': 'knn', 'source': 'grm', 'knn_k': 7, 'weighted_edges': True, 'symmetrize_mode': 'union', 'use_snp_selection': False}. Best is trial 0 with value: 0.027033369111860547.
[I 2025-11-03 14:44:32,595] Trial 2 finished with value: 0.0198016913722338 and parameters: {'model_type': 'graphsage', 'hidden_dims': '[256, 128]', 'dropout': 0.5105528289184642, 'batch_norm': False, 'lr': 0.0006804279372404962, 'weight_decay': 0.0008922815224257085, 'epochs': 181, 'loss': 'mse', 'optimizer': 'adam', 'graph_mode': 'cutoff', 'cutoff': 0.5741905641612706, 'grm_norm': 'gcn', 'self_loops': False, 'use_snp_selection': True, 'num_snps': 26910}. Best is trial 0 with value: 0.027033369111860547.
[I 2025-11-03 14:44:35,446] Trial 3 finished with value: 0.02156270792430889 and parameters: {'model_type': 'graphsage', 'hidden_dims': '[256, 128, 64]', 'dropout': 0.5390483213624292, 'batch_norm': False, 'lr': 3.4705625989073525e-05, 'weight_decay': 2.4623319020131338e-05, 'epochs': 121, 'loss': 'mse', 'optimizer': 'adam', 'graph_mode': 'knn', 'source': 'grm', 'knn_k': 6, 'weighted_edges': False, 'symmetrize_mode': 'mutual', 'use_snp_selection': True, 'num_snps': 30713}. Best is trial 0 with value: 0.027033369111860547.
[I 2025-11-03 14:44:38,188] Trial 4 finished with value: 0.015001582350502477 and parameters: {'model_type': 'graphsage', 'hidden_dims': '[128, 64]', 'dropout': 0.13404863676897502, 'batch_norm': False, 'lr': 0.0001431556295367288, 'weight_decay': 2.2084517750726675e-05, 'epochs': 51, 'loss': 'mae', 'optimizer': 'adam', 'graph_mode': 'cutoff', 'cutoff': 0.6714268476993044, 'grm_norm': 'none', 'self_loops': False, 'use_snp_selection': True, 'num_snps': 45645}. Best is trial 0 with value: 0.027033369111860547.
[I 2025-11-03 14:44:41,574] Trial 5 finished with value: -0.012924583290300435 and parameters: {'model_type': 'graphsage', 'hidden_dims': '[256, 128]', 'dropout': 0.42253606323412096, 'batch_norm': False, 'lr': 4.238630400638805e-05, 'weight_decay': 8.074086040046576e-07, 'epochs': 158, 'loss': 'mae', 'optimizer': 'adam', 'graph_mode': 'knn', 'source': 'grm', 'knn_k': 1, 'weighted_edges': False, 'symmetrize_mode': 'mutual', 'use_snp_selection': True, 'num_snps': 43113}. Best is trial 0 with value: 0.027033369111860547.
[I 2025-11-03 14:44:45,948] Trial 6 finished with value: -0.008256304906469492 and parameters: {'model_type': 'graphsage', 'hidden_dims': '[512, 256]', 'dropout': 0.3534893146320237, 'batch_norm': True, 'lr': 0.000251307964226932, 'weight_decay': 1.821819791794022e-05, 'epochs': 223, 'loss': 'mae', 'optimizer': 'adam', 'graph_mode': 'knn', 'source': 'grm', 'knn_k': 1, 'weighted_edges': True, 'symmetrize_mode': 'mutual', 'use_snp_selection': False}. Best is trial 0 with value: 0.027033369111860547.
[I 2025-11-03 14:44:49,901] Trial 7 finished with value: -0.005073669912479595 and parameters: {'model_type': 'graphsage', 'hidden_dims': '[512, 256]', 'dropout': 0.1105825955860775, 'batch_norm': True, 'lr': 2.374338412754043e-05, 'weight_decay': 1.1284721123340274e-05, 'epochs': 190, 'loss': 'mse', 'optimizer': 'adam', 'graph_mode': 'cutoff', 'cutoff': 0.719872204109604, 'grm_norm': 'gcn', 'self_loops': False, 'use_snp_selection': False}. Best is trial 0 with value: 0.027033369111860547.
[I 2025-11-03 14:44:53,280] Trial 8 finished with value: -0.0074973433731236145 and parameters: {'model_type': 'graphsage', 'hidden_dims': '[512, 128]', 'dropout': 0.5066580418354021, 'batch_norm': True, 'lr': 0.00039213678276659976, 'weight_decay': 3.43655320802934e-06, 'epochs': 120, 'loss': 'mse', 'optimizer': 'adam', 'graph_mode': 'cutoff', 'cutoff': 0.34923059576505366, 'grm_norm': 'cosine', 'self_loops': True, 'use_snp_selection': False}. Best is trial 0 with value: 0.027033369111860547.
[I 2025-11-03 14:44:55,489] Trial 9 finished with value: -0.011317712431372818 and parameters: {'model_type': 'graphsage', 'hidden_dims': '[512, 256]', 'dropout': 0.301734920240333, 'batch_norm': False, 'lr': 6.650961854953448e-06, 'weight_decay': 6.861575656590315e-05, 'epochs': 150, 'loss': 'mae', 'optimizer': 'adam', 'graph_mode': 'cutoff', 'cutoff': 0.2857569870061939, 'grm_norm': 'cosine_then_gcn', 'self_loops': False, 'use_snp_selection': True, 'num_snps': 12722}. Best is trial 0 with value: 0.027033369111860547.
[I 2025-11-03 14:45:02,483] Trial 10 finished with value: 0.01814267962187821 and parameters: {'model_type': 'graphsage', 'hidden_dims': '[512, 64]', 'dropout': 0.22492338276159776, 'batch_norm': True, 'lr': 1.0627684039560866e-06, 'weight_decay': 0.000250012967435051, 'epochs': 342, 'loss': 'mae', 'optimizer': 'adam', 'graph_mode': 'knn', 'source': 'grm', 'knn_k': 10, 'weighted_edges': True, 'symmetrize_mode': 'union', 'use_snp_selection': False}. Best is trial 0 with value: 0.027033369111860547.
[I 2025-11-03 14:45:06,165] Trial 11 finished with value: -0.0010464236159226771 and parameters: {'model_type': 'graphsage', 'hidden_dims': '[256, 128, 64]', 'dropout': 0.5699777252922706, 'batch_norm': False, 'lr': 2.709675858546572e-06, 'weight_decay': 0.00011975818945457808, 'epochs': 343, 'loss': 'mse', 'optimizer': 'adam', 'graph_mode': 'knn', 'source': 'grm', 'knn_k': 6, 'weighted_edges': False, 'symmetrize_mode': 'mutual', 'use_snp_selection': True, 'num_snps': 24257}. Best is trial 0 with value: 0.027033369111860547.
[I 2025-11-03 14:45:11,317] Trial 12 finished with value: -0.01234073402959991 and parameters: {'model_type': 'graphsage', 'hidden_dims': '[256, 128, 64]', 'dropout': 0.22647944320852692, 'batch_norm': True, 'lr': 1.5784243508694372e-05, 'weight_decay': 1.465684253631785e-07, 'epochs': 259, 'loss': 'mse', 'optimizer': 'adam', 'graph_mode': 'knn', 'source': 'grm', 'knn_k': 8, 'weighted_edges': False, 'symmetrize_mode': 'mutual', 'use_snp_selection': True, 'num_snps': 58791}. Best is trial 0 with value: 0.027033369111860547.
[I 2025-11-03 14:45:14,533] Trial 13 finished with value: -0.016084402939495562 and parameters: {'model_type': 'graphsage', 'hidden_dims': '[256, 128, 64]', 'dropout': 0.5994430534474139, 'batch_norm': False, 'lr': 6.867918780372061e-05, 'weight_decay': 4.7727059765877854e-05, 'epochs': 274, 'loss': 'mae', 'optimizer': 'adam', 'graph_mode': 'knn', 'source': 'grm', 'knn_k': 4, 'weighted_edges': False, 'symmetrize_mode': 'mutual', 'use_snp_selection': False}. Best is trial 0 with value: 0.027033369111860547.
[I 2025-11-03 14:45:16,172] Trial 14 finished with value: -0.03700666032195018 and parameters: {'model_type': 'graphsage', 'hidden_dims': '[128, 64]', 'dropout': 0.22530335948448305, 'batch_norm': False, 'lr': 7.227965065321845e-06, 'weight_decay': 0.0003966001023060176, 'epochs': 106, 'loss': 'mse', 'optimizer': 'adam', 'graph_mode': 'knn', 'source': 'grm', 'knn_k': 4, 'weighted_edges': True, 'symmetrize_mode': 'mutual', 'use_snp_selection': False}. Best is trial 0 with value: 0.027033369111860547.
[I 2025-11-03 14:45:18,663] Trial 15 finished with value: 0.0011949006988811956 and parameters: {'model_type': 'graphsage', 'hidden_dims': '[512, 128]', 'dropout': 0.30675483174282264, 'batch_norm': True, 'lr': 1.1300392938059547e-06, 'weight_decay': 5.205187683564767e-06, 'epochs': 283, 'loss': 'mae', 'optimizer': 'adam', 'graph_mode': 'knn', 'source': 'grm', 'knn_k': 9, 'weighted_edges': True, 'symmetrize_mode': 'mutual', 'use_snp_selection': True, 'num_snps': 4426}. Best is trial 0 with value: 0.027033369111860547.
[I 2025-11-03 14:45:23,596] Trial 16 finished with value: -0.02199257796033053 and parameters: {'model_type': 'graphsage', 'hidden_dims': '[512, 64]', 'dropout': 0.45939857593813493, 'batch_norm': True, 'lr': 1.1099505106527803e-05, 'weight_decay': 3.585246316428601e-05, 'epochs': 235, 'loss': 'mae', 'optimizer': 'adam', 'graph_mode': 'knn', 'source': 'grm', 'knn_k': 5, 'weighted_edges': False, 'symmetrize_mode': 'union', 'use_snp_selection': False}. Best is trial 0 with value: 0.027033369111860547.
[I 2025-11-03 14:45:26,653] Trial 17 finished with value: -0.007644028156568837 and parameters: {'model_type': 'graphsage', 'hidden_dims': '[256, 128, 64]', 'dropout': 0.1719117603604054, 'batch_norm': False, 'lr': 8.774110294512398e-05, 'weight_decay': 0.00017718199243863008, 'epochs': 97, 'loss': 'mse', 'optimizer': 'adam', 'graph_mode': 'knn', 'source': 'grm', 'knn_k': 7, 'weighted_edges': True, 'symmetrize_mode': 'mutual', 'use_snp_selection': True, 'num_snps': 38044}. Best is trial 0 with value: 0.027033369111860547.
[I 2025-11-03 14:45:29,432] Trial 18 finished with value: 0.012312979881970007 and parameters: {'model_type': 'graphsage', 'hidden_dims': '[128, 64]', 'dropout': 0.31133711285198556, 'batch_norm': True, 'lr': 3.1903410737796472e-06, 'weight_decay': 8.613192603696309e-07, 'epochs': 322, 'loss': 'mse', 'optimizer': 'adam', 'graph_mode': 'knn', 'source': 'grm', 'knn_k': 8, 'weighted_edges': False, 'symmetrize_mode': 'mutual', 'use_snp_selection': False}. Best is trial 0 with value: 0.027033369111860547.
[I 2025-11-03 14:45:32,701] Trial 19 finished with value: -0.01322658925681814 and parameters: {'model_type': 'graphsage', 'hidden_dims': '[256, 128, 64]', 'dropout': 0.5222557068879935, 'batch_norm': False, 'lr': 3.715883753989093e-05, 'weight_decay': 8.1052027345543e-06, 'epochs': 307, 'loss': 'mae', 'optimizer': 'adam', 'graph_mode': 'knn', 'source': 'grm', 'knn_k': 3, 'weighted_edges': False, 'symmetrize_mode': 'union', 'use_snp_selection': True, 'num_snps': 18287}. Best is trial 0 with value: 0.027033369111860547.
[I 2025-11-03 14:45:36,404] Trial 20 finished with value: -0.004003459009574804 and parameters: {'model_type': 'graphsage', 'hidden_dims': '[128, 64]', 'dropout': 0.3739068036201154, 'batch_norm': False, 'lr': 3.3578708944705104e-06, 'weight_decay': 8.871270883649895e-05, 'epochs': 145, 'loss': 'mae', 'optimizer': 'adam', 'graph_mode': 'knn', 'source': 'grm', 'knn_k': 10, 'weighted_edges': True, 'symmetrize_mode': 'mutual', 'use_snp_selection': True, 'num_snps': 54151}. Best is trial 0 with value: 0.027033369111860547.
[I 2025-11-03 14:45:39,351] Trial 21 finished with value: -0.018755705300575038 and parameters: {'model_type': 'graphsage', 'hidden_dims': '[256, 128]', 'dropout': 0.4903673310533412, 'batch_norm': False, 'lr': 0.0009090482879333808, 'weight_decay': 0.0005757121118240305, 'epochs': 187, 'loss': 'mse', 'optimizer': 'adam', 'graph_mode': 'cutoff', 'cutoff': 0.5092015154441335, 'grm_norm': 'gcn', 'self_loops': True, 'use_snp_selection': True, 'num_snps': 32084}. Best is trial 0 with value: 0.027033369111860547.
[I 2025-11-03 14:45:42,254] Trial 22 finished with value: 0.016414963229450144 and parameters: {'model_type': 'graphsage', 'hidden_dims': '[256, 128]', 'dropout': 0.5485153177150403, 'batch_norm': False, 'lr': 0.00016643959739136413, 'weight_decay': 0.000718588314357119, 'epochs': 226, 'loss': 'mse', 'optimizer': 'adam', 'graph_mode': 'cutoff', 'cutoff': 0.8400279585522109, 'grm_norm': 'gcn', 'self_loops': False, 'use_snp_selection': True, 'num_snps': 27892}. Best is trial 0 with value: 0.027033369111860547.
[I 2025-11-03 14:45:45,258] Trial 23 finished with value: 0.007526853339621404 and parameters: {'model_type': 'graphsage', 'hidden_dims': '[256, 128]', 'dropout': 0.4800109016810753, 'batch_norm': False, 'lr': 0.000800498268737658, 'weight_decay': 0.00023670684787885344, 'epochs': 176, 'loss': 'mse', 'optimizer': 'adam', 'graph_mode': 'cutoff', 'cutoff': 0.4840568892622303, 'grm_norm': 'cosine', 'self_loops': False, 'use_snp_selection': True, 'num_snps': 33939}. Best is trial 0 with value: 0.027033369111860547.
[I 2025-11-03 14:45:47,558] Trial 24 finished with value: -0.006290621557059881 and parameters: {'model_type': 'graphsage', 'hidden_dims': '[256, 128]', 'dropout': 0.4466554076988257, 'batch_norm': False, 'lr': 7.514224768239149e-05, 'weight_decay': 2.9028243207937812e-05, 'epochs': 136, 'loss': 'mse', 'optimizer': 'adam', 'graph_mode': 'cutoff', 'cutoff': 0.6511512717601672, 'grm_norm': 'none', 'self_loops': True, 'use_snp_selection': True, 'num_snps': 20309}. Best is trial 0 with value: 0.027033369111860547.
[I 2025-11-03 14:45:49,530] Trial 25 finished with value: -0.022027384213353943 and parameters: {'model_type': 'graphsage', 'hidden_dims': '[512, 64]', 'dropout': 0.5993280712886662, 'batch_norm': False, 'lr': 1.774185196174995e-06, 'weight_decay': 0.0009529531970898431, 'epochs': 94, 'loss': 'mse', 'optimizer': 'adam', 'graph_mode': 'cutoff', 'cutoff': 0.41169387651143086, 'grm_norm': 'cosine_then_gcn', 'self_loops': False, 'use_snp_selection': True, 'num_snps': 11718}. Best is trial 0 with value: 0.027033369111860547.
[I 2025-11-03 14:45:51,973] Trial 26 finished with value: 0.017537033134777058 and parameters: {'model_type': 'graphsage', 'hidden_dims': '[128, 64]', 'dropout': 0.5435990875561582, 'batch_norm': True, 'lr': 2.0463570704610496e-05, 'weight_decay': 1.2049344155388403e-05, 'epochs': 203, 'loss': 'mse', 'optimizer': 'adam', 'graph_mode': 'cutoff', 'cutoff': 0.21893296452969285, 'grm_norm': 'gcn', 'self_loops': True, 'use_snp_selection': False}. Best is trial 0 with value: 0.027033369111860547.
[I 2025-11-03 14:45:55,434] Trial 27 finished with value: 0.018792973503235517 and parameters: {'model_type': 'graphsage', 'hidden_dims': '[512, 128]', 'dropout': 0.2679692983012783, 'batch_norm': False, 'lr': 7.0300109110479725e-06, 'weight_decay': 0.0001268441504333848, 'epochs': 79, 'loss': 'mse', 'optimizer': 'adam', 'graph_mode': 'knn', 'source': 'grm', 'knn_k': 6, 'weighted_edges': True, 'symmetrize_mode': 'mutual', 'use_snp_selection': True, 'num_snps': 38624}. Best is trial 0 with value: 0.027033369111860547.
[I 2025-11-03 14:45:57,877] Trial 28 finished with value: -0.00624997857189693 and parameters: {'model_type': 'graphsage', 'hidden_dims': '[256, 128]', 'dropout': 0.45821283180620453, 'batch_norm': True, 'lr': 0.0003282409400351206, 'weight_decay': 5.095787072167195e-05, 'epochs': 171, 'loss': 'mae', 'optimizer': 'adam', 'graph_mode': 'cutoff', 'cutoff': 0.843321845085844, 'grm_norm': 'gcn', 'self_loops': False, 'use_snp_selection': False}. Best is trial 0 with value: 0.027033369111860547.
[I 2025-11-03 14:45:59,719] Trial 29 finished with value: -0.019876941877285174 and parameters: {'model_type': 'graphsage', 'hidden_dims': '[256, 128, 64]', 'dropout': 0.3987312019831077, 'batch_norm': True, 'lr': 0.00018586173656787614, 'weight_decay': 1.6351471200644548e-06, 'epochs': 42, 'loss': 'mse', 'optimizer': 'adam', 'graph_mode': 'knn', 'source': 'grm', 'knn_k': 8, 'weighted_edges': False, 'symmetrize_mode': 'mutual', 'use_snp_selection': False}. Best is trial 0 with value: 0.027033369111860547.
[I 2025-11-03 14:46:03,052] Trial 30 finished with value: 0.03587274014897062 and parameters: {'model_type': 'graphsage', 'hidden_dims': '[128, 64]', 'dropout': 0.17157142351322632, 'batch_norm': False, 'lr': 0.0005823429733967351, 'weight_decay': 0.00040630621194335316, 'epochs': 123, 'loss': 'mse', 'optimizer': 'adam', 'graph_mode': 'knn', 'source': 'grm', 'knn_k': 5, 'weighted_edges': False, 'symmetrize_mode': 'union', 'use_snp_selection': True, 'num_snps': 49333}. Best is trial 30 with value: 0.03587274014897062.
[I 2025-11-03 14:46:06,465] Trial 31 finished with value: -0.011686855418158427 and parameters: {'model_type': 'graphsage', 'hidden_dims': '[128, 64]', 'dropout': 0.18044313327464737, 'batch_norm': False, 'lr': 0.0005901224803799996, 'weight_decay': 0.00029631963630616885, 'epochs': 127, 'loss': 'mse', 'optimizer': 'adam', 'graph_mode': 'knn', 'source': 'grm', 'knn_k': 5, 'weighted_edges': False, 'symmetrize_mode': 'union', 'use_snp_selection': True, 'num_snps': 49585}. Best is trial 30 with value: 0.03587274014897062.
