[I 2025-11-03 13:02:18,999] Trial 26 finished with value: 0.06258875589373274 and parameters: {'model_type': 'gcn', 'hidden_dims': '[256, 128]', 'dropout': 0.3111367359836579, 'batch_norm': False, 'lr': 0.00043919251664185856, 'weight_decay': 0.00015265805543382738, 'epochs': 106, 'loss': 'mae', 'optimizer': 'adam', 'graph_mode': 'off', 'use_snp_selection': True, 'num_snps': 3842}. Best is trial 11 with value: 0.11167912209591514.
[I 2025-11-03 13:02:19,701] Trial 27 finished with value: 0.09151068135419542 and parameters: {'model_type': 'gcn', 'hidden_dims': '[128, 64]', 'dropout': 0.356646587404417, 'batch_norm': True, 'lr': 0.0009502214604786, 'weight_decay': 1.134424736065386e-05, 'epochs': 73, 'loss': 'mae', 'optimizer': 'adam', 'graph_mode': 'off', 'use_snp_selection': False}. Best is trial 11 with value: 0.11167912209591514.
[I 2025-11-03 13:02:21,189] Trial 28 finished with value: 0.08330030357618179 and parameters: {'model_type': 'gcn', 'hidden_dims': '[512, 128]', 'dropout': 0.5976960797610256, 'batch_norm': True, 'lr': 0.0003020763296033213, 'weight_decay': 0.00011837572117061311, 'epochs': 146, 'loss': 'mae', 'optimizer': 'adam', 'graph_mode': 'off', 'use_snp_selection': False}. Best is trial 11 with value: 0.11167912209591514.
[I 2025-11-03 13:02:22,066] Trial 29 finished with value: 0.10430117092641672 and parameters: {'model_type': 'gcn', 'hidden_dims': '[128, 64]', 'dropout': 0.2214394634349324, 'batch_norm': True, 'lr': 0.0005388560200940643, 'weight_decay': 3.3840296839123704e-05, 'epochs': 52, 'loss': 'mae', 'optimizer': 'adam', 'graph_mode': 'off', 'use_snp_selection': True, 'num_snps': 19468}. Best is trial 11 with value: 0.11167912209591514.
[I 2025-11-03 13:02:23,402] Trial 30 finished with value: 0.007957321306048969 and parameters: {'model_type': 'gcn', 'hidden_dims': '[512, 256]', 'dropout': 0.478134419315309, 'batch_norm': True, 'lr': 2.0819274400698715e-05, 'weight_decay': 7.76685178938795e-07, 'epochs': 111, 'loss': 'mae', 'optimizer': 'adam', 'graph_mode': 'off', 'use_snp_selection': False}. Best is trial 11 with value: 0.11167912209591514.
[I 2025-11-03 13:02:24,470] Trial 31 finished with value: 0.09258419983194902 and parameters: {'model_type': 'gcn', 'hidden_dims': '[512, 256]', 'dropout': 0.532567851638772, 'batch_norm': True, 'lr': 0.0003347978377832525, 'weight_decay': 2.3555313453544856e-06, 'epochs': 59, 'loss': 'mae', 'optimizer': 'adam', 'graph_mode': 'off', 'use_snp_selection': False}. Best is trial 11 with value: 0.11167912209591514.
[I 2025-11-03 13:02:25,639] Trial 32 finished with value: 0.08939870476744707 and parameters: {'model_type': 'gcn', 'hidden_dims': '[512, 256]', 'dropout': 0.5419824390652626, 'batch_norm': True, 'lr': 0.00010287123621183565, 'weight_decay': 2.0568842338604123e-06, 'epochs': 80, 'loss': 'mae', 'optimizer': 'adam', 'graph_mode': 'off', 'use_snp_selection': False}. Best is trial 11 with value: 0.11167912209591514.
[I 2025-11-03 13:02:26,699] Trial 33 finished with value: 0.07989550830718721 and parameters: {'model_type': 'gcn', 'hidden_dims': '[512, 256]', 'dropout': 0.43668963748284534, 'batch_norm': True, 'lr': 0.00021157414433512525, 'weight_decay': 7.5019077242724665e-06, 'epochs': 71, 'loss': 'mae', 'optimizer': 'adam', 'graph_mode': 'off', 'use_snp_selection': False}. Best is trial 11 with value: 0.11167912209591514.
[I 2025-11-03 13:02:27,444] Trial 34 finished with value: 0.1097767296101931 and parameters: {'model_type': 'gcn', 'hidden_dims': '[256, 128]', 'dropout': 0.507221769396822, 'batch_norm': True, 'lr': 0.0006637159238760618, 'weight_decay': 3.093218404212208e-06, 'epochs': 42, 'loss': 'mae', 'optimizer': 'adam', 'graph_mode': 'off', 'use_snp_selection': False}. Best is trial 11 with value: 0.11167912209591514.
[I 2025-11-03 13:02:28,325] Trial 35 finished with value: -0.015391695125221637 and parameters: {'model_type': 'gcn', 'hidden_dims': '[256, 128]', 'dropout': 0.49581020969257156, 'batch_norm': False, 'lr': 0.0007592110436898183, 'weight_decay': 8.300946326488112e-06, 'epochs': 86, 'loss': 'mae', 'optimizer': 'adam', 'graph_mode': 'off', 'use_snp_selection': False}. Best is trial 11 with value: 0.11167912209591514.
[I 2025-11-03 13:02:30,041] Trial 36 finished with value: 0.10762877842475023 and parameters: {'model_type': 'gcn', 'hidden_dims': '[256, 128]', 'dropout': 0.42590612286366447, 'batch_norm': True, 'lr': 0.000594238867456555, 'weight_decay': 3.3959572787796947e-06, 'epochs': 42, 'loss': 'mse', 'optimizer': 'adam', 'graph_mode': 'off', 'use_snp_selection': True, 'num_snps': 58661}. Best is trial 11 with value: 0.11167912209591514.
[I 2025-11-03 13:02:31,424] Trial 37 finished with value: 0.0378842385818667 and parameters: {'model_type': 'gcn', 'hidden_dims': '[256, 128]', 'dropout': 0.5698009961609276, 'batch_norm': True, 'lr': 4.446294938689988e-06, 'weight_decay': 1.3947254388437805e-05, 'epochs': 236, 'loss': 'mae', 'optimizer': 'adam', 'graph_mode': 'off', 'use_snp_selection': False}. Best is trial 11 with value: 0.11167912209591514.
[I 2025-11-03 13:02:32,674] Trial 38 finished with value: 0.06523143288719267 and parameters: {'model_type': 'gcn', 'hidden_dims': '[512, 64]', 'dropout': 0.391681442764899, 'batch_norm': False, 'lr': 3.6337952564547506e-05, 'weight_decay': 6.592673888828759e-07, 'epochs': 169, 'loss': 'mse', 'optimizer': 'adam', 'graph_mode': 'off', 'use_snp_selection': True, 'num_snps': 19911}. Best is trial 11 with value: 0.11167912209591514.
[I 2025-11-03 13:02:33,650] Trial 39 finished with value: 0.027967638920800546 and parameters: {'model_type': 'gcn', 'hidden_dims': '[256, 128]', 'dropout': 0.133429017688058, 'batch_norm': True, 'lr': 8.053988720528605e-06, 'weight_decay': 0.000494866061743946, 'epochs': 113, 'loss': 'mae', 'optimizer': 'adam', 'graph_mode': 'off', 'use_snp_selection': False}. Best is trial 11 with value: 0.11167912209591514.
[I 2025-11-03 13:02:35,757] Trial 40 finished with value: 0.0995094910450885 and parameters: {'model_type': 'gcn', 'hidden_dims': '[512, 128]', 'dropout': 0.5061425168885094, 'batch_norm': True, 'lr': 0.0004636031789681634, 'weight_decay': 5.433540199899746e-06, 'epochs': 284, 'loss': 'mae', 'optimizer': 'adam', 'graph_mode': 'off', 'use_snp_selection': False}. Best is trial 11 with value: 0.11167912209591514.
[I 2025-11-03 13:02:36,625] Trial 41 finished with value: -0.009688523038145836 and parameters: {'model_type': 'gcn', 'hidden_dims': '[256, 128, 64]', 'dropout': 0.5119868189346005, 'batch_norm': True, 'lr': 2.320370617557869e-06, 'weight_decay': 2.4265399819307504e-06, 'epochs': 58, 'loss': 'mae', 'optimizer': 'adam', 'graph_mode': 'off', 'use_snp_selection': False}. Best is trial 11 with value: 0.11167912209591514.
[I 2025-11-03 13:02:39,081] Trial 42 finished with value: 0.103179164135008 and parameters: {'model_type': 'gcn', 'hidden_dims': '[512, 256]', 'dropout': 0.4532251550958391, 'batch_norm': True, 'lr': 0.00028286250510217584, 'weight_decay': 1.3310812469493732e-06, 'epochs': 348, 'loss': 'mae', 'optimizer': 'adam', 'graph_mode': 'off', 'use_snp_selection': False}. Best is trial 11 with value: 0.11167912209591514.
[I 2025-11-03 13:02:40,130] Trial 43 finished with value: 0.09536721424331268 and parameters: {'model_type': 'gcn', 'hidden_dims': '[512, 256]', 'dropout': 0.568833704399039, 'batch_norm': True, 'lr': 0.000397815536321781, 'weight_decay': 8.921397694862142e-07, 'epochs': 56, 'loss': 'mae', 'optimizer': 'adam', 'graph_mode': 'off', 'use_snp_selection': False}. Best is trial 11 with value: 0.11167912209591514.
[I 2025-11-03 13:02:41,341] Trial 44 finished with value: 0.1139330594433981 and parameters: {'model_type': 'gcn', 'hidden_dims': '[512, 64]', 'dropout': 0.3678195161741449, 'batch_norm': True, 'lr': 0.0007128343188371493, 'weight_decay': 3.723668147230268e-07, 'epochs': 90, 'loss': 'mse', 'optimizer': 'adam', 'graph_mode': 'off', 'use_snp_selection': False}. Best is trial 44 with value: 0.1139330594433981.
[I 2025-11-03 13:02:42,550] Trial 45 finished with value: 0.10454312414486772 and parameters: {'model_type': 'gcn', 'hidden_dims': '[512, 64]', 'dropout': 0.2590572917173414, 'batch_norm': True, 'lr': 0.0006511648245818425, 'weight_decay': 3.96449927316991e-07, 'epochs': 90, 'loss': 'mse', 'optimizer': 'adam', 'graph_mode': 'off', 'use_snp_selection': False}. Best is trial 44 with value: 0.1139330594433981.
[I 2025-11-03 13:02:44,204] Trial 46 finished with value: 0.10585017834633502 and parameters: {'model_type': 'gcn', 'hidden_dims': '[512, 64]', 'dropout': 0.36003837994552235, 'batch_norm': True, 'lr': 0.0009890190248659982, 'weight_decay': 2.0474361029399575e-07, 'epochs': 194, 'loss': 'mse', 'optimizer': 'adam', 'graph_mode': 'off', 'use_snp_selection': False}. Best is trial 44 with value: 0.1139330594433981.
[I 2025-11-03 13:02:45,634] Trial 47 finished with value: 0.09089753433640806 and parameters: {'model_type': 'gcn', 'hidden_dims': '[512, 64]', 'dropout': 0.19469118382600895, 'batch_norm': False, 'lr': 8.176462540431838e-05, 'weight_decay': 3.7445560345271016e-05, 'epochs': 133, 'loss': 'mse', 'optimizer': 'adam', 'graph_mode': 'off', 'use_snp_selection': False}. Best is trial 44 with value: 0.1139330594433981.
[I 2025-11-03 13:02:46,809] Trial 48 finished with value: 0.09914645614080644 and parameters: {'model_type': 'gcn', 'hidden_dims': '[512, 64]', 'dropout': 0.4040564967568177, 'batch_norm': True, 'lr': 0.000248494100178456, 'weight_decay': 1.1098207028423404e-07, 'epochs': 93, 'loss': 'mse', 'optimizer': 'adam', 'graph_mode': 'off', 'use_snp_selection': False}. Best is trial 44 with value: 0.1139330594433981.
[I 2025-11-03 13:02:48,597] Trial 49 finished with value: 0.09746260992236894 and parameters: {'model_type': 'gcn', 'hidden_dims': '[512, 128]', 'dropout': 0.45466891198695736, 'batch_norm': True, 'lr': 0.0006919826519093528, 'weight_decay': 1.9005224936239118e-05, 'epochs': 70, 'loss': 'mse', 'optimizer': 'adam', 'graph_mode': 'off', 'use_snp_selection': True, 'num_snps': 46888}. Best is trial 44 with value: 0.1139330594433981.
[I 2025-11-03 13:02:49,329] Trial 50 finished with value: 0.10328083087949468 and parameters: {'model_type': 'gcn', 'hidden_dims': '[256, 128]', 'dropout': 0.29636255057695693, 'batch_norm': True, 'lr': 0.0007376758443753927, 'weight_decay': 4.830936308591571e-07, 'epochs': 43, 'loss': 'mse', 'optimizer': 'adam', 'graph_mode': 'off', 'use_snp_selection': False}. Best is trial 44 with value: 0.1139330594433981.
[I 2025-11-03 13:02:50,337] Trial 51 finished with value: 0.08950186591291683 and parameters: {'model_type': 'gcn', 'hidden_dims': '[512, 256]', 'dropout': 0.5650784816747613, 'batch_norm': True, 'lr': 0.0003429767480275104, 'weight_decay': 2.53363004598034e-06, 'epochs': 54, 'loss': 'mae', 'optimizer': 'adam', 'graph_mode': 'off', 'use_snp_selection': False}. Best is trial 44 with value: 0.1139330594433981.
[I 2025-11-03 13:02:51,070] Trial 52 finished with value: 0.09912568226704342 and parameters: {'model_type': 'gcn', 'hidden_dims': '[128, 64]', 'dropout': 0.5268390130274364, 'batch_norm': True, 'lr': 0.00017125102238653913, 'weight_decay': 2.783855157142064e-07, 'epochs': 82, 'loss': 'mae', 'optimizer': 'adam', 'graph_mode': 'off', 'use_snp_selection': False}. Best is trial 44 with value: 0.1139330594433981.
[I 2025-11-03 13:02:52,177] Trial 53 finished with value: 0.1081038654103814 and parameters: {'model_type': 'gcn', 'hidden_dims': '[512, 256]', 'dropout': 0.13352554932798905, 'batch_norm': True, 'lr': 0.0005581288442400465, 'weight_decay': 1.695247862391317e-06, 'epochs': 67, 'loss': 'mae', 'optimizer': 'adam', 'graph_mode': 'off', 'use_snp_selection': False}. Best is trial 44 with value: 0.1139330594433981.
[I 2025-11-03 13:02:53,439] Trial 54 finished with value: 0.10729832800701004 and parameters: {'model_type': 'gcn', 'hidden_dims': '[512, 128]', 'dropout': 0.12789907973197195, 'batch_norm': True, 'lr': 0.0005112277535534575, 'weight_decay': 1.154113692943547e-06, 'epochs': 101, 'loss': 'mae', 'optimizer': 'adam', 'graph_mode': 'off', 'use_snp_selection': False}. Best is trial 44 with value: 0.1139330594433981.
[I 2025-11-03 13:02:54,396] Trial 55 finished with value: 0.09890269297459985 and parameters: {'model_type': 'gcn', 'hidden_dims': '[256, 128, 64]', 'dropout': 0.17040134554303438, 'batch_norm': True, 'lr': 0.0007517730741377524, 'weight_decay': 5.596250783167027e-06, 'epochs': 69, 'loss': 'mse', 'optimizer': 'adam', 'graph_mode': 'off', 'use_snp_selection': False}. Best is trial 44 with value: 0.1139330594433981.
[I 2025-11-03 13:02:55,928] Trial 56 finished with value: 0.10994610836816282 and parameters: {'model_type': 'gcn', 'hidden_dims': '[512, 64]', 'dropout': 0.10473303358267605, 'batch_norm': True, 'lr': 0.0005652003842447559, 'weight_decay': 1.544818228800726e-06, 'epochs': 156, 'loss': 'mae', 'optimizer': 'adam', 'graph_mode': 'off', 'use_snp_selection': False}. Best is trial 44 with value: 0.1139330594433981.
[I 2025-11-03 13:02:57,547] Trial 57 finished with value: 0.08140053329107863 and parameters: {'model_type': 'gcn', 'hidden_dims': '[512, 64]', 'dropout': 0.10589097653077438, 'batch_norm': False, 'lr': 0.00023496093705161996, 'weight_decay': 3.4621071768532223e-06, 'epochs': 181, 'loss': 'mae', 'optimizer': 'adam', 'graph_mode': 'off', 'use_snp_selection': False}. Best is trial 44 with value: 0.1139330594433981.
[I 2025-11-03 13:02:58,950] Trial 58 finished with value: 0.10037970145621934 and parameters: {'model_type': 'gcn', 'hidden_dims': '[512, 64]', 'dropout': 0.12154782347716953, 'batch_norm': True, 'lr': 0.0005905284950143488, 'weight_decay': 8.680116183964219e-07, 'epochs': 138, 'loss': 'mae', 'optimizer': 'adam', 'graph_mode': 'off', 'use_snp_selection': False}. Best is trial 44 with value: 0.1139330594433981.
[I 2025-11-03 13:03:00,478] Trial 59 finished with value: 0.10195829410164814 and parameters: {'model_type': 'gcn', 'hidden_dims': '[512, 64]', 'dropout': 0.1518129081798339, 'batch_norm': True, 'lr': 0.0008124203504309938, 'weight_decay': 1.4482012944209123e-06, 'epochs': 161, 'loss': 'mae', 'optimizer': 'adam', 'graph_mode': 'off', 'use_snp_selection': False}. Best is trial 44 with value: 0.1139330594433981.
[I 2025-11-03 13:03:01,413] Trial 60 finished with value: 0.11273939787645393 and parameters: {'model_type': 'gcn', 'hidden_dims': '[512, 64]', 'dropout': 0.16823172581800788, 'batch_norm': True, 'lr': 0.00040397868926070834, 'weight_decay': 1.581431171109205e-06, 'epochs': 41, 'loss': 'mse', 'optimizer': 'adam', 'graph_mode': 'off', 'use_snp_selection': False}. Best is trial 44 with value: 0.1139330594433981.
[I 2025-11-03 13:03:02,364] Trial 61 finished with value: 0.09855301198155746 and parameters: {'model_type': 'gcn', 'hidden_dims': '[512, 64]', 'dropout': 0.1748226649256399, 'batch_norm': True, 'lr': 0.0004092578607170516, 'weight_decay': 1.674234763488239e-06, 'epochs': 47, 'loss': 'mse', 'optimizer': 'adam', 'graph_mode': 'off', 'use_snp_selection': False}. Best is trial 44 with value: 0.1139330594433981.
[I 2025-11-03 13:03:03,410] Trial 62 finished with value: 0.10718200417356105 and parameters: {'model_type': 'gcn', 'hidden_dims': '[512, 64]', 'dropout': 0.21754473089557924, 'batch_norm': True, 'lr': 0.0005559522399121396, 'weight_decay': 2.8387385491790107e-06, 'epochs': 40, 'loss': 'mse', 'optimizer': 'adam', 'graph_mode': 'off', 'use_snp_selection': False}. Best is trial 44 with value: 0.1139330594433981.
[I 2025-11-03 13:03:04,492] Trial 63 finished with value: 0.11232626570487102 and parameters: {'model_type': 'gcn', 'hidden_dims': '[512, 64]', 'dropout': 0.10007242276991135, 'batch_norm': True, 'lr': 0.000388605173554499, 'weight_decay': 5.440168829509422e-07, 'epochs': 62, 'loss': 'mse', 'optimizer': 'adam', 'graph_mode': 'off', 'use_snp_selection': False}. Best is trial 44 with value: 0.1139330594433981.
[I 2025-11-03 13:03:05,653] Trial 64 finished with value: 0.10555685457679559 and parameters: {'model_type': 'gcn', 'hidden_dims': '[512, 64]', 'dropout': 0.11062109611227558, 'batch_norm': True, 'lr': 0.0004116217171746586, 'weight_decay': 4.994817380784419e-07, 'epochs': 79, 'loss': 'mse', 'optimizer': 'adam', 'graph_mode': 'off', 'use_snp_selection': False}. Best is trial 44 with value: 0.1139330594433981.
[I 2025-11-03 13:03:06,673] Trial 65 finished with value: 0.10706237482123288 and parameters: {'model_type': 'gcn', 'hidden_dims': '[512, 64]', 'dropout': 0.1496419261677327, 'batch_norm': True, 'lr': 0.00013711039736974696, 'weight_decay': 1.0239521062947738e-06, 'epochs': 50, 'loss': 'mse', 'optimizer': 'adam', 'graph_mode': 'off', 'use_snp_selection': False}. Best is trial 44 with value: 0.1139330594433981.
[I 2025-11-03 13:03:07,757] Trial 66 finished with value: 0.10706236759737828 and parameters: {'model_type': 'gcn', 'hidden_dims': '[512, 64]', 'dropout': 0.10058933651967075, 'batch_norm': True, 'lr': 0.0009039277265407158, 'weight_decay': 6.33101841473789e-07, 'epochs': 66, 'loss': 'mse', 'optimizer': 'adam', 'graph_mode': 'off', 'use_snp_selection': True, 'num_snps': 22881}. Best is trial 44 with value: 0.1139330594433981.
[I 2025-11-03 13:03:09,127] Trial 67 finished with value: 0.05678660560866828 and parameters: {'model_type': 'gcn', 'hidden_dims': '[512, 64]', 'dropout': 0.1826775005686751, 'batch_norm': True, 'lr': 1.0387880921401811e-06, 'weight_decay': 2.798294987578915e-07, 'epochs': 114, 'loss': 'mse', 'optimizer': 'adam', 'graph_mode': 'off', 'use_snp_selection': False}. Best is trial 44 with value: 0.1139330594433981.
[I 2025-11-03 13:03:10,932] Trial 68 finished with value: 0.11594365287585753 and parameters: {'model_type': 'gcn', 'hidden_dims': '[512, 128]', 'dropout': 0.20452357524365566, 'batch_norm': True, 'lr': 0.00030604803050888373, 'weight_decay': 2.6923699653712996e-07, 'epochs': 218, 'loss': 'mse', 'optimizer': 'adam', 'graph_mode': 'off', 'use_snp_selection': False}. Best is trial 68 with value: 0.11594365287585753.
[I 2025-11-03 13:03:12,725] Trial 69 finished with value: 0.11567986630545501 and parameters: {'model_type': 'gcn', 'hidden_dims': '[512, 128]', 'dropout': 0.1418939169251825, 'batch_norm': True, 'lr': 0.00019044493982343425, 'weight_decay': 1.6555982513566054e-07, 'epochs': 221, 'loss': 'mse', 'optimizer': 'adam', 'graph_mode': 'off', 'use_snp_selection': False}. Best is trial 68 with value: 0.11594365287585753.
[I 2025-11-03 13:03:14,528] Trial 70 finished with value: 0.048351211708130705 and parameters: {'model_type': 'gcn', 'hidden_dims': '[512, 128]', 'dropout': 0.16079409853067786, 'batch_norm': False, 'lr': 0.000196043057064915, 'weight_decay': 1.6664038901420387e-07, 'epochs': 224, 'loss': 'mse', 'optimizer': 'adam', 'graph_mode': 'off', 'use_snp_selection': False}. Best is trial 68 with value: 0.11594365287585753.
[I 2025-11-03 13:03:16,523] Trial 71 finished with value: 0.12111210649889043 and parameters: {'model_type': 'gcn', 'hidden_dims': '[512, 128]', 'dropout': 0.20811763181023715, 'batch_norm': True, 'lr': 0.0002526869235892645, 'weight_decay': 2.772401862000652e-07, 'epochs': 255, 'loss': 'mse', 'optimizer': 'adam', 'graph_mode': 'off', 'use_snp_selection': False}. Best is trial 71 with value: 0.12111210649889043.
[I 2025-11-03 13:03:18,515] Trial 72 finished with value: 0.11052046922911078 and parameters: {'model_type': 'gcn', 'hidden_dims': '[512, 128]', 'dropout': 0.11987760632162817, 'batch_norm': True, 'lr': 0.00027028592496857135, 'weight_decay': 1.392572882436261e-07, 'epochs': 261, 'loss': 'mse', 'optimizer': 'adam', 'graph_mode': 'off', 'use_snp_selection': False}. Best is trial 71 with value: 0.12111210649889043.
[I 2025-11-03 13:03:20,651] Trial 73 finished with value: 0.10820740701824548 and parameters: {'model_type': 'gcn', 'hidden_dims': '[512, 128]', 'dropout': 0.14054857443194282, 'batch_norm': True, 'lr': 0.00026708570900124684, 'weight_decay': 1.4999491269076036e-07, 'epochs': 262, 'loss': 'mse', 'optimizer': 'adam', 'graph_mode': 'off', 'use_snp_selection': False}. Best is trial 71 with value: 0.12111210649889043.
[I 2025-11-03 13:03:22,610] Trial 74 finished with value: 0.1266375421692321 and parameters: {'model_type': 'gcn', 'hidden_dims': '[512, 128]', 'dropout': 0.20959047244175935, 'batch_norm': True, 'lr': 0.0003542821109054607, 'weight_decay': 2.8587267190904826e-07, 'epochs': 255, 'loss': 'mse', 'optimizer': 'adam', 'graph_mode': 'off', 'use_snp_selection': False}. Best is trial 74 with value: 0.1266375421692321.
[I 2025-11-03 13:03:24,362] Trial 75 finished with value: 0.1089532707281333 and parameters: {'model_type': 'gcn', 'hidden_dims': '[512, 128]', 'dropout': 0.20633336014289644, 'batch_norm': True, 'lr': 0.0001340058394396053, 'weight_decay': 2.4031771641873825e-07, 'epochs': 207, 'loss': 'mse', 'optimizer': 'adam', 'graph_mode': 'off', 'use_snp_selection': False}. Best is trial 74 with value: 0.1266375421692321.
[I 2025-11-03 13:03:26,303] Trial 76 finished with value: 0.11991057883674511 and parameters: {'model_type': 'gcn', 'hidden_dims': '[512, 128]', 'dropout': 0.20537150706846646, 'batch_norm': True, 'lr': 0.00034894918740383375, 'weight_decay': 3.1710495643583284e-07, 'epochs': 249, 'loss': 'mse', 'optimizer': 'adam', 'graph_mode': 'off', 'use_snp_selection': False}. Best is trial 74 with value: 0.1266375421692321.
[I 2025-11-03 13:03:28,246] Trial 77 finished with value: 0.11119752133436535 and parameters: {'model_type': 'gcn', 'hidden_dims': '[512, 128]', 'dropout': 0.2411485288099369, 'batch_norm': True, 'lr': 0.00034750099504787617, 'weight_decay': 3.246202531103184e-07, 'epochs': 249, 'loss': 'mse', 'optimizer': 'adam', 'graph_mode': 'off', 'use_snp_selection': False}. Best is trial 74 with value: 0.1266375421692321.
