[I 2025-11-03 13:29:14,982] Trial 72 finished with value: 0.008147171763620195 and parameters: {'model_type': 'gcn', 'hidden_dims': '[256, 128, 64]', 'dropout': 0.47623535819053425, 'batch_norm': False, 'lr': 7.054666962232066e-05, 'weight_decay': 8.654204668997122e-06, 'epochs': 33, 'loss': 'mse', 'optimizer': 'adam', 'graph_mode': 'knn', 'source': 'grm', 'knn_k': 9, 'weighted_edges': False, 'symmetrize_mode': 'mutual', 'use_snp_selection': True, 'num_snps': 56438}. Best is trial 44 with value: 0.06423072367905273.
[I 2025-11-03 13:29:17,791] Trial 73 finished with value: -0.004330845976589409 and parameters: {'model_type': 'gcn', 'hidden_dims': '[256, 128, 64]', 'dropout': 0.4109007059434395, 'batch_norm': False, 'lr': 4.175797559865131e-05, 'weight_decay': 1.1669840086475209e-05, 'epochs': 52, 'loss': 'mse', 'optimizer': 'adam', 'graph_mode': 'knn', 'source': 'grm', 'knn_k': 10, 'weighted_edges': False, 'symmetrize_mode': 'mutual', 'use_snp_selection': True, 'num_snps': 49810}. Best is trial 44 with value: 0.06423072367905273.
[I 2025-11-03 13:29:20,530] Trial 74 finished with value: -0.037510718816788795 and parameters: {'model_type': 'gcn', 'hidden_dims': '[512, 64]', 'dropout': 0.5528988077752175, 'batch_norm': False, 'lr': 0.00013662202618904066, 'weight_decay': 0.00022709546060686894, 'epochs': 12, 'loss': 'mse', 'optimizer': 'adam', 'graph_mode': 'knn', 'source': 'grm', 'knn_k': 7, 'weighted_edges': False, 'symmetrize_mode': 'mutual', 'use_snp_selection': True, 'num_snps': 48077}. Best is trial 44 with value: 0.06423072367905273.
[I 2025-11-03 13:29:23,434] Trial 75 finished with value: 0.00885131011536198 and parameters: {'model_type': 'gcn', 'hidden_dims': '[512, 64]', 'dropout': 0.5075928726760237, 'batch_norm': False, 'lr': 9.814731197947265e-05, 'weight_decay': 5.096621227506753e-05, 'epochs': 95, 'loss': 'mse', 'optimizer': 'adam', 'graph_mode': 'cutoff', 'cutoff': 0.47787555683690836, 'grm_norm': 'cosine', 'self_loops': False, 'use_snp_selection': True, 'num_snps': 42550}. Best is trial 44 with value: 0.06423072367905273.
[I 2025-11-03 13:29:26,617] Trial 76 finished with value: 0.0215839429620845 and parameters: {'model_type': 'gcn', 'hidden_dims': '[256, 128, 64]', 'dropout': 0.5754873696201732, 'batch_norm': False, 'lr': 1.3919038884126149e-05, 'weight_decay': 5.1479174212281245e-06, 'epochs': 173, 'loss': 'mae', 'optimizer': 'adam', 'graph_mode': 'cutoff', 'cutoff': 0.8123070383248295, 'grm_norm': 'cosine_then_gcn', 'self_loops': True, 'use_snp_selection': True, 'num_snps': 45911}. Best is trial 44 with value: 0.06423072367905273.
[I 2025-11-03 13:29:29,573] Trial 77 finished with value: 0.028863254021925435 and parameters: {'model_type': 'gcn', 'hidden_dims': '[512, 128]', 'dropout': 0.5333206251563058, 'batch_norm': True, 'lr': 5.5355689947498325e-05, 'weight_decay': 8.601987757079242e-05, 'epochs': 21, 'loss': 'mse', 'optimizer': 'adam', 'graph_mode': 'knn', 'source': 'grm', 'knn_k': 9, 'weighted_edges': False, 'symmetrize_mode': 'mutual', 'use_snp_selection': True, 'num_snps': 51820}. Best is trial 44 with value: 0.06423072367905273.
[I 2025-11-03 13:29:30,688] Trial 78 finished with value: -0.006503737971866045 and parameters: {'model_type': 'gcn', 'hidden_dims': '[512, 128]', 'dropout': 0.5303250318326007, 'batch_norm': True, 'lr': 5.940788640046362e-06, 'weight_decay': 8.82221233500173e-05, 'epochs': 23, 'loss': 'mse', 'optimizer': 'adam', 'graph_mode': 'cutoff', 'cutoff': 0.8925544648627879, 'grm_norm': 'none', 'self_loops': True, 'use_snp_selection': True, 'num_snps': 4265}. Best is trial 44 with value: 0.06423072367905273.
[I 2025-11-03 13:29:33,757] Trial 79 finished with value: 0.006797405971018203 and parameters: {'model_type': 'gcn', 'hidden_dims': '[512, 128]', 'dropout': 0.4879865203857077, 'batch_norm': True, 'lr': 5.672595546765704e-05, 'weight_decay': 0.00014098761769548574, 'epochs': 38, 'loss': 'mae', 'optimizer': 'adam', 'graph_mode': 'knn', 'source': 'grm', 'knn_k': 8, 'weighted_edges': False, 'symmetrize_mode': 'mutual', 'use_snp_selection': True, 'num_snps': 51972}. Best is trial 44 with value: 0.06423072367905273.
[I 2025-11-03 13:29:35,869] Trial 80 finished with value: -0.0077180270132244004 and parameters: {'model_type': 'gcn', 'hidden_dims': '[512, 128]', 'dropout': 0.43396979889346965, 'batch_norm': True, 'lr': 2.910879755687167e-05, 'weight_decay': 0.00028838861898642195, 'epochs': 9, 'loss': 'mse', 'optimizer': 'adam', 'graph_mode': 'cutoff', 'cutoff': 0.7294392059042315, 'grm_norm': 'gcn', 'self_loops': True, 'use_snp_selection': True, 'num_snps': 32649}. Best is trial 44 with value: 0.06423072367905273.
[I 2025-11-03 13:29:38,541] Trial 81 finished with value: 0.04624466304623952 and parameters: {'model_type': 'gcn', 'hidden_dims': '[512, 128]', 'dropout': 0.5711947160876663, 'batch_norm': True, 'lr': 0.00017336358103521658, 'weight_decay': 0.00017532684510744337, 'epochs': 2, 'loss': 'mse', 'optimizer': 'adam', 'graph_mode': 'knn', 'source': 'grm', 'knn_k': 9, 'weighted_edges': False, 'symmetrize_mode': 'mutual', 'use_snp_selection': True, 'num_snps': 47824}. Best is trial 44 with value: 0.06423072367905273.
[I 2025-11-03 13:29:41,240] Trial 82 finished with value: 0.016649821173126984 and parameters: {'model_type': 'gcn', 'hidden_dims': '[512, 128]', 'dropout': 0.5212071913263918, 'batch_norm': True, 'lr': 0.0003894747438555637, 'weight_decay': 0.00017342327086028824, 'epochs': 4, 'loss': 'mse', 'optimizer': 'adam', 'graph_mode': 'knn', 'source': 'grm', 'knn_k': 9, 'weighted_edges': False, 'symmetrize_mode': 'mutual', 'use_snp_selection': True, 'num_snps': 48370}. Best is trial 44 with value: 0.06423072367905273.
[I 2025-11-03 13:29:43,918] Trial 83 finished with value: 0.0039588166033688345 and parameters: {'model_type': 'gcn', 'hidden_dims': '[512, 128]', 'dropout': 0.5697286900455262, 'batch_norm': True, 'lr': 0.00016740674537749743, 'weight_decay': 8.881973858779922e-05, 'epochs': 23, 'loss': 'mse', 'optimizer': 'adam', 'graph_mode': 'knn', 'source': 'grm', 'knn_k': 7, 'weighted_edges': False, 'symmetrize_mode': 'mutual', 'use_snp_selection': True, 'num_snps': 44344}. Best is trial 44 with value: 0.06423072367905273.
[I 2025-11-03 13:29:46,573] Trial 84 finished with value: 0.04426471733049085 and parameters: {'model_type': 'gcn', 'hidden_dims': '[512, 128]', 'dropout': 0.5424003725288898, 'batch_norm': True, 'lr': 0.0002848035485565513, 'weight_decay': 0.00042746107635346263, 'epochs': 1, 'loss': 'mse', 'optimizer': 'adam', 'graph_mode': 'knn', 'source': 'grm', 'knn_k': 8, 'weighted_edges': False, 'symmetrize_mode': 'mutual', 'use_snp_selection': True, 'num_snps': 47635}. Best is trial 44 with value: 0.06423072367905273.
[I 2025-11-03 13:29:49,644] Trial 85 finished with value: 0.01096604679609866 and parameters: {'model_type': 'gcn', 'hidden_dims': '[512, 128]', 'dropout': 0.5953967514559703, 'batch_norm': True, 'lr': 0.0002609466514916847, 'weight_decay': 0.0003835266217311252, 'epochs': 17, 'loss': 'mse', 'optimizer': 'adam', 'graph_mode': 'knn', 'source': 'grm', 'knn_k': 9, 'weighted_edges': False, 'symmetrize_mode': 'mutual', 'use_snp_selection': True, 'num_snps': 55293}. Best is trial 44 with value: 0.06423072367905273.
[I 2025-11-03 13:29:51,123] Trial 86 finished with value: -0.044087670864440195 and parameters: {'model_type': 'gcn', 'hidden_dims': '[512, 128]', 'dropout': 0.549146882781524, 'batch_norm': True, 'lr': 0.000489945558818365, 'weight_decay': 0.0004801905262299187, 'epochs': 26, 'loss': 'mse', 'optimizer': 'adam', 'graph_mode': 'cutoff', 'cutoff': 0.6239140747050703, 'grm_norm': 'cosine_then_gcn', 'self_loops': False, 'use_snp_selection': False}. Best is trial 44 with value: 0.06423072367905273.
[I 2025-11-03 13:29:53,732] Trial 87 finished with value: 0.009632893362645905 and parameters: {'model_type': 'gcn', 'hidden_dims': '[512, 128]', 'dropout': 0.49699077083919185, 'batch_norm': True, 'lr': 0.0003155410095339882, 'weight_decay': 0.0006812662564904046, 'epochs': 2, 'loss': 'mse', 'optimizer': 'adam', 'graph_mode': 'cutoff', 'cutoff': 0.6595145168777838, 'grm_norm': 'cosine_then_gcn', 'self_loops': True, 'use_snp_selection': True, 'num_snps': 47533}. Best is trial 44 with value: 0.06423072367905273.
[I 2025-11-03 13:29:56,781] Trial 88 finished with value: 0.002988612412055463 and parameters: {'model_type': 'gcn', 'hidden_dims': '[512, 128]', 'dropout': 0.5385047806093183, 'batch_norm': True, 'lr': 0.00021972830235436107, 'weight_decay': 1.5425375372193604e-05, 'epochs': 39, 'loss': 'mse', 'optimizer': 'adam', 'graph_mode': 'knn', 'source': 'grm', 'knn_k': 8, 'weighted_edges': False, 'symmetrize_mode': 'mutual', 'use_snp_selection': True, 'num_snps': 51415}. Best is trial 44 with value: 0.06423072367905273.
[I 2025-11-03 13:29:59,207] Trial 89 finished with value: 0.008976472255102001 and parameters: {'model_type': 'gcn', 'hidden_dims': '[512, 256]', 'dropout': 0.4487410227047137, 'batch_norm': True, 'lr': 0.0001228532233387722, 'weight_decay': 0.00012475331231985142, 'epochs': 13, 'loss': 'mse', 'optimizer': 'adam', 'graph_mode': 'cutoff', 'cutoff': 0.7885227457631298, 'grm_norm': 'none', 'self_loops': True, 'use_snp_selection': True, 'num_snps': 41013}. Best is trial 44 with value: 0.06423072367905273.
[I 2025-11-03 13:30:03,094] Trial 90 finished with value: -0.0018711445504993656 and parameters: {'model_type': 'gcn', 'hidden_dims': '[512, 64]', 'dropout': 0.3650126779067143, 'batch_norm': True, 'lr': 0.0003903742026547046, 'weight_decay': 0.0002741055094881843, 'epochs': 280, 'loss': 'mse', 'optimizer': 'adam', 'graph_mode': 'cutoff', 'cutoff': 0.6923867811205942, 'grm_norm': 'cosine_then_gcn', 'self_loops': False, 'use_snp_selection': True, 'num_snps': 43358}. Best is trial 44 with value: 0.06423072367905273.
[I 2025-11-03 13:30:05,906] Trial 91 finished with value: 0.027329933403467985 and parameters: {'model_type': 'gcn', 'hidden_dims': '[512, 128]', 'dropout': 0.5117054273636412, 'batch_norm': True, 'lr': 0.00017800465215727306, 'weight_decay': 0.00019495270585455604, 'epochs': 39, 'loss': 'mse', 'optimizer': 'adam', 'graph_mode': 'knn', 'source': 'grm', 'knn_k': 7, 'weighted_edges': False, 'symmetrize_mode': 'mutual', 'use_snp_selection': True, 'num_snps': 45622}. Best is trial 44 with value: 0.06423072367905273.
[I 2025-11-03 13:30:07,307] Trial 92 finished with value: 0.003689002316320465 and parameters: {'model_type': 'gcn', 'hidden_dims': '[512, 128]', 'dropout': 0.5278242027542119, 'batch_norm': True, 'lr': 0.00017897195419904187, 'weight_decay': 0.00022219323853164426, 'epochs': 37, 'loss': 'mse', 'optimizer': 'adam', 'graph_mode': 'knn', 'source': 'grm', 'knn_k': 6, 'weighted_edges': False, 'symmetrize_mode': 'mutual', 'use_snp_selection': True, 'num_snps': 9238}. Best is trial 44 with value: 0.06423072367905273.
[I 2025-11-03 13:30:10,153] Trial 93 finished with value: 0.0196866611636955 and parameters: {'model_type': 'gcn', 'hidden_dims': '[512, 128]', 'dropout': 0.4620657658706443, 'batch_norm': True, 'lr': 0.0006109776599766298, 'weight_decay': 6.198809633950106e-05, 'epochs': 19, 'loss': 'mse', 'optimizer': 'adam', 'graph_mode': 'knn', 'source': 'grm', 'knn_k': 7, 'weighted_edges': False, 'symmetrize_mode': 'mutual', 'use_snp_selection': True, 'num_snps': 49417}. Best is trial 44 with value: 0.06423072367905273.
[I 2025-11-03 13:30:13,906] Trial 94 finished with value: -0.012890816286904519 and parameters: {'model_type': 'gcn', 'hidden_dims': '[512, 128]', 'dropout': 0.571617100062197, 'batch_norm': True, 'lr': 1.6350312011225341e-06, 'weight_decay': 0.00014451210513650718, 'epochs': 212, 'loss': 'mse', 'optimizer': 'adam', 'graph_mode': 'knn', 'source': 'grm', 'knn_k': 7, 'weighted_edges': False, 'symmetrize_mode': 'mutual', 'use_snp_selection': True, 'num_snps': 46595}. Best is trial 44 with value: 0.06423072367905273.
[I 2025-11-03 13:30:16,120] Trial 95 finished with value: -0.029520785072070923 and parameters: {'model_type': 'gcn', 'hidden_dims': '[512, 128]', 'dropout': 0.4818251821448827, 'batch_norm': True, 'lr': 1.1102206330775918e-06, 'weight_decay': 2.513632723848073e-05, 'epochs': 48, 'loss': 'mse', 'optimizer': 'adam', 'graph_mode': 'knn', 'source': 'grm', 'knn_k': 9, 'weighted_edges': False, 'symmetrize_mode': 'mutual', 'use_snp_selection': True, 'num_snps': 29364}. Best is trial 44 with value: 0.06423072367905273.
[I 2025-11-03 13:30:18,979] Trial 96 finished with value: -0.03132656667111817 and parameters: {'model_type': 'gcn', 'hidden_dims': '[512, 64]', 'dropout': 0.2563473683191816, 'batch_norm': True, 'lr': 0.00015048402073098254, 'weight_decay': 7.722408749257607e-05, 'epochs': 8, 'loss': 'mse', 'optimizer': 'adam', 'graph_mode': 'cutoff', 'cutoff': 0.5292080614047332, 'grm_norm': 'gcn', 'self_loops': True, 'use_snp_selection': True, 'num_snps': 52988}. Best is trial 44 with value: 0.06423072367905273.
[I 2025-11-03 13:30:21,202] Trial 97 finished with value: 0.008921715643482783 and parameters: {'model_type': 'gcn', 'hidden_dims': '[256, 128]', 'dropout': 0.5051995814487978, 'batch_norm': True, 'lr': 0.00029799669317039453, 'weight_decay': 0.00010659430442256114, 'epochs': 27, 'loss': 'mse', 'optimizer': 'adam', 'graph_mode': 'knn', 'source': 'grm', 'knn_k': 6, 'weighted_edges': False, 'symmetrize_mode': 'mutual', 'use_snp_selection': True, 'num_snps': 35973}. Best is trial 44 with value: 0.06423072367905273.
[I 2025-11-03 13:30:23,605] Trial 98 finished with value: -0.013420492879052937 and parameters: {'model_type': 'gcn', 'hidden_dims': '[512, 64]', 'dropout': 0.5629933919812489, 'batch_norm': True, 'lr': 0.00022356781632324916, 'weight_decay': 3.5346094013866594e-05, 'epochs': 59, 'loss': 'mse', 'optimizer': 'adam', 'graph_mode': 'cutoff', 'cutoff': 0.8573963016142427, 'grm_norm': 'cosine_then_gcn', 'self_loops': True, 'use_snp_selection': True, 'num_snps': 33694}. Best is trial 44 with value: 0.06423072367905273.
[I 2025-11-03 13:30:24,945] Trial 99 finished with value: -0.033160042511833826 and parameters: {'model_type': 'gcn', 'hidden_dims': '[512, 128]', 'dropout': 0.10189221842599269, 'batch_norm': True, 'lr': 1.984042155058039e-05, 'weight_decay': 0.0004407482763708227, 'epochs': 1, 'loss': 'mse', 'optimizer': 'adam', 'graph_mode': 'knn', 'source': 'grm', 'knn_k': 8, 'weighted_edges': False, 'symmetrize_mode': 'mutual', 'use_snp_selection': False}. Best is trial 44 with value: 0.06423072367905273.
[I 2025-11-03 13:30:27,337] Trial 100 finished with value: -0.0017346171881214175 and parameters: {'model_type': 'gcn', 'hidden_dims': '[512, 64]', 'dropout': 0.13861870726332678, 'batch_norm': True, 'lr': 8.44986674604053e-06, 'weight_decay': 4.600349431008857e-05, 'epochs': 17, 'loss': 'mse', 'optimizer': 'adam', 'graph_mode': 'cutoff', 'cutoff': 0.5685792008022279, 'grm_norm': 'cosine', 'self_loops': True, 'use_snp_selection': True, 'num_snps': 39293}. Best is trial 44 with value: 0.06423072367905273.
[I 2025-11-03 13:30:29,819] Trial 101 finished with value: 0.026572476660666793 and parameters: {'model_type': 'gcn', 'hidden_dims': '[128, 64]', 'dropout': 0.5140684380150237, 'batch_norm': False, 'lr': 3.9415709271920955e-05, 'weight_decay': 0.0002993369831822149, 'epochs': 42, 'loss': 'mae', 'optimizer': 'adam', 'graph_mode': 'knn', 'source': 'grm', 'knn_k': 8, 'weighted_edges': False, 'symmetrize_mode': 'mutual', 'use_snp_selection': True, 'num_snps': 45416}. Best is trial 44 with value: 0.06423072367905273.
[I 2025-11-03 13:30:32,175] Trial 102 finished with value: 0.001479032155484319 and parameters: {'model_type': 'gcn', 'hidden_dims': '[128, 64]', 'dropout': 0.49650025945102444, 'batch_norm': False, 'lr': 0.0001313555694775019, 'weight_decay': 0.0003279855089567452, 'epochs': 31, 'loss': 'mae', 'optimizer': 'adam', 'graph_mode': 'knn', 'source': 'grm', 'knn_k': 8, 'weighted_edges': False, 'symmetrize_mode': 'mutual', 'use_snp_selection': True, 'num_snps': 42308}. Best is trial 44 with value: 0.06423072367905273.
[I 2025-11-03 13:30:34,980] Trial 103 finished with value: 0.009124307508248455 and parameters: {'model_type': 'gcn', 'hidden_dims': '[512, 64]', 'dropout': 0.5390672276083828, 'batch_norm': False, 'lr': 3.790735044902045e-05, 'weight_decay': 0.0009753384091396868, 'epochs': 40, 'loss': 'mae', 'optimizer': 'adam', 'graph_mode': 'knn', 'source': 'grm', 'knn_k': 10, 'weighted_edges': False, 'symmetrize_mode': 'mutual', 'use_snp_selection': True, 'num_snps': 45348}. Best is trial 44 with value: 0.06423072367905273.
[I 2025-11-03 13:30:37,793] Trial 104 finished with value: 0.03316608528531763 and parameters: {'model_type': 'gcn', 'hidden_dims': '[512, 128]', 'dropout': 0.5139784750339695, 'batch_norm': True, 'lr': 0.00018669431662609567, 'weight_decay': 0.0001916272764793522, 'epochs': 50, 'loss': 'mse', 'optimizer': 'adam', 'graph_mode': 'knn', 'source': 'grm', 'knn_k': 9, 'weighted_edges': False, 'symmetrize_mode': 'mutual', 'use_snp_selection': True, 'num_snps': 43514}. Best is trial 44 with value: 0.06423072367905273.
[I 2025-11-03 13:30:40,513] Trial 105 finished with value: 0.023584947512203563 and parameters: {'model_type': 'gcn', 'hidden_dims': '[512, 128]', 'dropout': 0.4767259245679035, 'batch_norm': True, 'lr': 0.00019527802503735677, 'weight_decay': 0.0001965246145587412, 'epochs': 53, 'loss': 'mse', 'optimizer': 'adam', 'graph_mode': 'knn', 'source': 'grm', 'knn_k': 10, 'weighted_edges': False, 'symmetrize_mode': 'mutual', 'use_snp_selection': True, 'num_snps': 41171}. Best is trial 44 with value: 0.06423072367905273.
[I 2025-11-03 13:30:43,409] Trial 106 finished with value: -0.009303469343691318 and parameters: {'model_type': 'gcn', 'hidden_dims': '[512, 128]', 'dropout': 0.5523581327997866, 'batch_norm': True, 'lr': 0.0002491073716362146, 'weight_decay': 0.0007023578208309473, 'epochs': 80, 'loss': 'mse', 'optimizer': 'adam', 'graph_mode': 'cutoff', 'cutoff': 0.7281826382494339, 'grm_norm': 'cosine_then_gcn', 'self_loops': False, 'use_snp_selection': True, 'num_snps': 43482}. Best is trial 44 with value: 0.06423072367905273.
[I 2025-11-03 13:30:47,312] Trial 107 finished with value: 0.013096873086673677 and parameters: {'model_type': 'gcn', 'hidden_dims': '[512, 128]', 'dropout': 0.5229866873337778, 'batch_norm': True, 'lr': 0.0001636727413446855, 'weight_decay': 0.00015027116590964773, 'epochs': 347, 'loss': 'mse', 'optimizer': 'adam', 'graph_mode': 'knn', 'source': 'grm', 'knn_k': 9, 'weighted_edges': False, 'symmetrize_mode': 'mutual', 'use_snp_selection': True, 'num_snps': 38110}. Best is trial 44 with value: 0.06423072367905273.
[I 2025-11-03 13:30:50,034] Trial 108 finished with value: 0.038199414139613704 and parameters: {'model_type': 'gcn', 'hidden_dims': '[512, 128]', 'dropout': 0.4912891954182096, 'batch_norm': True, 'lr': 9.427094808175997e-05, 'weight_decay': 1.1307296784702142e-05, 'epochs': 9, 'loss': 'mse', 'optimizer': 'adam', 'graph_mode': 'cutoff', 'cutoff': 0.44599938022104335, 'grm_norm': 'none', 'self_loops': True, 'use_snp_selection': True, 'num_snps': 49413}. Best is trial 44 with value: 0.06423072367905273.
[I 2025-11-03 13:30:52,761] Trial 109 finished with value: -0.025443767390622582 and parameters: {'model_type': 'gcn', 'hidden_dims': '[512, 64]', 'dropout': 0.48836499798789845, 'batch_norm': True, 'lr': 9.210904959573398e-05, 'weight_decay': 1.0767841134989938e-05, 'epochs': 10, 'loss': 'mse', 'optimizer': 'adam', 'graph_mode': 'cutoff', 'cutoff': 0.3852145807702942, 'grm_norm': 'none', 'self_loops': True, 'use_snp_selection': True, 'num_snps': 49447}. Best is trial 44 with value: 0.06423072367905273.
[I 2025-11-03 13:30:55,655] Trial 110 finished with value: 0.010385975662630243 and parameters: {'model_type': 'gcn', 'hidden_dims': '[512, 256]', 'dropout': 0.4674107581223945, 'batch_norm': True, 'lr': 0.00010204124780773085, 'weight_decay': 1.9212975163312278e-05, 'epochs': 23, 'loss': 'mse', 'optimizer': 'adam', 'graph_mode': 'cutoff', 'cutoff': 0.29341023353713924, 'grm_norm': 'none', 'self_loops': True, 'use_snp_selection': True, 'num_snps': 51260}. Best is trial 44 with value: 0.06423072367905273.
[I 2025-11-03 13:30:58,442] Trial 111 finished with value: 0.00270523315550569 and parameters: {'model_type': 'gcn', 'hidden_dims': '[512, 128]', 'dropout': 0.5069468105164124, 'batch_norm': True, 'lr': 0.00011830392821365302, 'weight_decay': 8.187599514103237e-06, 'epochs': 32, 'loss': 'mse', 'optimizer': 'adam', 'graph_mode': 'cutoff', 'cutoff': 0.6210795338674446, 'grm_norm': 'none', 'self_loops': True, 'use_snp_selection': True, 'num_snps': 47577}. Best is trial 44 with value: 0.06423072367905273.
[I 2025-11-03 13:31:00,297] Trial 112 finished with value: 0.018597390620835413 and parameters: {'model_type': 'gcn', 'hidden_dims': '[512, 128]', 'dropout': 0.5368684339091951, 'batch_norm': True, 'lr': 0.00014384316488046754, 'weight_decay': 1.3607004980803568e-05, 'epochs': 19, 'loss': 'mse', 'optimizer': 'adam', 'graph_mode': 'cutoff', 'cutoff': 0.4429701218404473, 'grm_norm': 'none', 'self_loops': True, 'use_snp_selection': True, 'num_snps': 24940}. Best is trial 44 with value: 0.06423072367905273.
[I 2025-11-03 13:31:03,283] Trial 113 finished with value: 0.0029862209625535177 and parameters: {'model_type': 'gcn', 'hidden_dims': '[512, 128]', 'dropout': 0.2962690543108382, 'batch_norm': True, 'lr': 0.00018143166692241437, 'weight_decay': 7.199223080408632e-06, 'epochs': 50, 'loss': 'mse', 'optimizer': 'adam', 'graph_mode': 'cutoff', 'cutoff': 0.5855835255104506, 'grm_norm': 'none', 'self_loops': True, 'use_snp_selection': True, 'num_snps': 50344}. Best is trial 44 with value: 0.06423072367905273.
