[I 2025-11-12 08:42:14,675] Trial 84 finished with value: 0.2679873424044982 and parameters: {'model_type': 'graphsage', 'hidden_dims': '[256, 128]', 'dropout': 0.20417929425638, 'batch_norm': False, 'lr': 3.98934576499844e-05, 'weight_decay': 1.604131401411785e-05, 'epochs': 131, 'loss': 'mae', 'optimizer': 'adam', 'graph_mode': 'cutoff', 'cutoff': 0.42496604903960766, 'grm_norm': 'cosine_then_gcn', 'self_loops': True, 'use_snp_selection': True, 'num_snps': 57760}. Best is trial 71 with value: 0.27769131151746956.
[I 2025-11-12 08:44:15,036] Trial 85 finished with value: 0.26778041345474607 and parameters: {'model_type': 'graphsage', 'hidden_dims': '[256, 128]', 'dropout': 0.1650200142827311, 'batch_norm': False, 'lr': 0.00015627070695105867, 'weight_decay': 6.532470365809241e-06, 'epochs': 84, 'loss': 'mae', 'optimizer': 'adam', 'graph_mode': 'cutoff', 'cutoff': 0.45349476661033505, 'grm_norm': 'cosine_then_gcn', 'self_loops': True, 'use_snp_selection': True, 'num_snps': 59475}. Best is trial 71 with value: 0.27769131151746956.
[I 2025-11-12 08:46:24,019] Trial 86 finished with value: 0.2763065890727844 and parameters: {'model_type': 'graphsage', 'hidden_dims': '[256, 128]', 'dropout': 0.1513573004495069, 'batch_norm': False, 'lr': 6.38669419878541e-05, 'weight_decay': 1.1606184922657372e-05, 'epochs': 95, 'loss': 'mae', 'optimizer': 'adam', 'graph_mode': 'cutoff', 'cutoff': 0.32891051621953327, 'grm_norm': 'cosine_then_gcn', 'self_loops': True, 'use_snp_selection': True, 'num_snps': 54608}. Best is trial 71 with value: 0.27769131151746956.
[I 2025-11-12 08:48:19,450] Trial 87 finished with value: 0.262716510815205 and parameters: {'model_type': 'graphsage', 'hidden_dims': '[256, 128]', 'dropout': 0.14582245601429308, 'batch_norm': False, 'lr': 3.5309038603260776e-05, 'weight_decay': 1.0058739002648957e-05, 'epochs': 96, 'loss': 'mae', 'optimizer': 'adam', 'graph_mode': 'knn', 'source': 'grm', 'knn_k': 5, 'weighted_edges': True, 'symmetrize_mode': 'mutual', 'use_snp_selection': True, 'num_snps': 52718}. Best is trial 71 with value: 0.27769131151746956.
[I 2025-11-12 08:50:47,378] Trial 88 finished with value: 0.27063569415040584 and parameters: {'model_type': 'graphsage', 'hidden_dims': '[256, 128]', 'dropout': 0.1907371651770649, 'batch_norm': False, 'lr': 6.307172426600938e-05, 'weight_decay': 4.176056207330679e-05, 'epochs': 117, 'loss': 'mae', 'optimizer': 'adam', 'graph_mode': 'cutoff', 'cutoff': 0.3310491175882634, 'grm_norm': 'cosine_then_gcn', 'self_loops': True, 'use_snp_selection': True, 'num_snps': 55141}. Best is trial 71 with value: 0.27769131151746956.
[I 2025-11-12 08:51:44,123] Trial 89 finished with value: 0.27472794579130655 and parameters: {'model_type': 'graphsage', 'hidden_dims': '[256, 128]', 'dropout': 0.16995258017489914, 'batch_norm': True, 'lr': 5.38962479859751e-05, 'weight_decay': 3.0086407013063118e-05, 'epochs': 86, 'loss': 'mae', 'optimizer': 'adam', 'graph_mode': 'cutoff', 'cutoff': 0.36836149658116835, 'grm_norm': 'cosine_then_gcn', 'self_loops': True, 'use_snp_selection': False}. Best is trial 71 with value: 0.27769131151746956.
[I 2025-11-12 08:52:44,947] Trial 90 finished with value: 0.24879432010464825 and parameters: {'model_type': 'graphsage', 'hidden_dims': '[256, 128]', 'dropout': 0.21452923976622795, 'batch_norm': True, 'lr': 5.0409945274857905e-05, 'weight_decay': 5.426833249062826e-05, 'epochs': 79, 'loss': 'mse', 'optimizer': 'adam', 'graph_mode': 'cutoff', 'cutoff': 0.2969405993683055, 'grm_norm': 'cosine_then_gcn', 'self_loops': True, 'use_snp_selection': False}. Best is trial 71 with value: 0.27769131151746956.
[I 2025-11-12 08:53:47,265] Trial 91 finished with value: 0.23897906302558375 and parameters: {'model_type': 'graphsage', 'hidden_dims': '[256, 128]', 'dropout': 0.15216875945959546, 'batch_norm': True, 'lr': 8.432898750709664e-05, 'weight_decay': 2.9469858306139333e-05, 'epochs': 91, 'loss': 'mae', 'optimizer': 'adam', 'graph_mode': 'cutoff', 'cutoff': 0.3300919825144379, 'grm_norm': 'cosine_then_gcn', 'self_loops': True, 'use_snp_selection': False}. Best is trial 71 with value: 0.27769131151746956.
[I 2025-11-12 08:54:51,237] Trial 92 finished with value: 0.26279277378270266 and parameters: {'model_type': 'graphsage', 'hidden_dims': '[256, 128]', 'dropout': 0.16970454264448345, 'batch_norm': True, 'lr': 6.565651235177348e-05, 'weight_decay': 1.675632086276634e-05, 'epochs': 101, 'loss': 'mae', 'optimizer': 'adam', 'graph_mode': 'cutoff', 'cutoff': 0.3709894069449121, 'grm_norm': 'cosine_then_gcn', 'self_loops': True, 'use_snp_selection': False}. Best is trial 71 with value: 0.27769131151746956.
[I 2025-11-12 08:55:36,338] Trial 93 finished with value: 0.24712938168495863 and parameters: {'model_type': 'graphsage', 'hidden_dims': '[256, 128]', 'dropout': 0.11144486439961482, 'batch_norm': True, 'lr': 3.614204902509174e-05, 'weight_decay': 3.0986466309851604e-05, 'epochs': 82, 'loss': 'mae', 'optimizer': 'adam', 'graph_mode': 'cutoff', 'cutoff': 0.5519469601086731, 'grm_norm': 'cosine_then_gcn', 'self_loops': True, 'use_snp_selection': False}. Best is trial 71 with value: 0.27769131151746956.
[I 2025-11-12 08:56:53,885] Trial 94 finished with value: 0.25790957760335054 and parameters: {'model_type': 'graphsage', 'hidden_dims': '[256, 128]', 'dropout': 0.16805539367855518, 'batch_norm': True, 'lr': 0.00011539542669075361, 'weight_decay': 1.144372662347224e-05, 'epochs': 146, 'loss': 'mae', 'optimizer': 'adam', 'graph_mode': 'cutoff', 'cutoff': 0.4880150936552311, 'grm_norm': 'cosine_then_gcn', 'self_loops': True, 'use_snp_selection': False}. Best is trial 71 with value: 0.27769131151746956.
[I 2025-11-12 09:00:13,074] Trial 95 finished with value: 0.26953306225150914 and parameters: {'model_type': 'graphsage', 'hidden_dims': '[256, 128]', 'dropout': 0.13814687099054537, 'batch_norm': False, 'lr': 5.059386035023113e-05, 'weight_decay': 7.223517422933117e-05, 'epochs': 110, 'loss': 'mae', 'optimizer': 'adam', 'graph_mode': 'cutoff', 'cutoff': 0.26075455280289356, 'grm_norm': 'cosine_then_gcn', 'self_loops': True, 'use_snp_selection': True, 'num_snps': 56799}. Best is trial 71 with value: 0.27769131151746956.
[I 2025-11-12 09:02:21,459] Trial 96 finished with value: 0.2656343126955191 and parameters: {'model_type': 'graphsage', 'hidden_dims': '[256, 128]', 'dropout': 0.22854823427327145, 'batch_norm': False, 'lr': 0.0001258922803126553, 'weight_decay': 1.885182961449824e-05, 'epochs': 121, 'loss': 'mae', 'optimizer': 'adam', 'graph_mode': 'cutoff', 'cutoff': 0.39100567490630567, 'grm_norm': 'cosine_then_gcn', 'self_loops': True, 'use_snp_selection': True, 'num_snps': 50332}. Best is trial 71 with value: 0.27769131151746956.
[I 2025-11-12 09:06:06,413] Trial 97 finished with value: 0.2502488927421418 and parameters: {'model_type': 'graphsage', 'hidden_dims': '[256, 128]', 'dropout': 0.18885213585605284, 'batch_norm': False, 'lr': 8.375611326138446e-05, 'weight_decay': 1.4734470940294713e-05, 'epochs': 294, 'loss': 'mae', 'optimizer': 'adam', 'graph_mode': 'cutoff', 'cutoff': 0.4426799334485017, 'grm_norm': 'cosine_then_gcn', 'self_loops': True, 'use_snp_selection': True, 'num_snps': 52242}. Best is trial 71 with value: 0.27769131151746956.
[I 2025-11-12 09:07:22,474] Trial 98 finished with value: 0.24802799595540165 and parameters: {'model_type': 'graphsage', 'hidden_dims': '[512, 128]', 'dropout': 0.1571971086831413, 'batch_norm': True, 'lr': 5.831821385163649e-05, 'weight_decay': 8.294032231345435e-06, 'epochs': 89, 'loss': 'mae', 'optimizer': 'adam', 'graph_mode': 'cutoff', 'cutoff': 0.5353524922601346, 'grm_norm': 'cosine', 'self_loops': True, 'use_snp_selection': False}. Best is trial 71 with value: 0.27769131151746956.
[I 2025-11-12 09:10:03,990] Trial 99 finished with value: 0.2760716473727316 and parameters: {'model_type': 'graphsage', 'hidden_dims': '[512, 64]', 'dropout': 0.11096453261193084, 'batch_norm': False, 'lr': 0.00014327810550423175, 'weight_decay': 2.2062943524677242e-05, 'epochs': 101, 'loss': 'mae', 'optimizer': 'adam', 'graph_mode': 'cutoff', 'cutoff': 0.3274160019890851, 'grm_norm': 'cosine_then_gcn', 'self_loops': True, 'use_snp_selection': True, 'num_snps': 54393}. Best is trial 71 with value: 0.27769131151746956.
[I 2025-11-12 09:14:24,817] Trial 100 finished with value: 0.21049518944361853 and parameters: {'model_type': 'graphsage', 'hidden_dims': '[512, 64]', 'dropout': 0.13392975345579855, 'batch_norm': False, 'lr': 0.0002318338713707767, 'weight_decay': 3.66052588477128e-05, 'epochs': 133, 'loss': 'mae', 'optimizer': 'adam', 'graph_mode': 'knn', 'source': 'grm', 'knn_k': 8, 'weighted_edges': False, 'symmetrize_mode': 'union', 'use_snp_selection': True, 'num_snps': 53396}. Best is trial 71 with value: 0.27769131151746956.
[I 2025-11-12 09:17:14,366] Trial 101 finished with value: 0.25808062966964135 and parameters: {'model_type': 'graphsage', 'hidden_dims': '[512, 64]', 'dropout': 0.1115299836254201, 'batch_norm': False, 'lr': 0.00015984322478385758, 'weight_decay': 2.371220557694651e-05, 'epochs': 100, 'loss': 'mae', 'optimizer': 'adam', 'graph_mode': 'cutoff', 'cutoff': 0.33743410222049797, 'grm_norm': 'cosine_then_gcn', 'self_loops': True, 'use_snp_selection': True, 'num_snps': 57308}. Best is trial 71 with value: 0.27769131151746956.
[I 2025-11-12 09:19:18,705] Trial 102 finished with value: 0.1225739809404474 and parameters: {'model_type': 'graphsage', 'hidden_dims': '[512, 64]', 'dropout': 0.17372168727556955, 'batch_norm': False, 'lr': 0.00018723297773510874, 'weight_decay': 2.0302040436767988e-05, 'epochs': 66, 'loss': 'mae', 'optimizer': 'adam', 'graph_mode': 'cutoff', 'cutoff': 0.3726084886518821, 'grm_norm': 'cosine_then_gcn', 'self_loops': True, 'use_snp_selection': True, 'num_snps': 54429}. Best is trial 71 with value: 0.27769131151746956.
[I 2025-11-12 09:21:07,787] Trial 103 finished with value: 0.25329787659753544 and parameters: {'model_type': 'graphsage', 'hidden_dims': '[512, 64]', 'dropout': 0.15927549197935612, 'batch_norm': False, 'lr': 0.00013872786595753637, 'weight_decay': 4.534850107070102e-05, 'epochs': 75, 'loss': 'mae', 'optimizer': 'adam', 'graph_mode': 'cutoff', 'cutoff': 0.4263395384968704, 'grm_norm': 'cosine_then_gcn', 'self_loops': True, 'use_snp_selection': True, 'num_snps': 43209}. Best is trial 71 with value: 0.27769131151746956.
[I 2025-11-12 09:23:20,467] Trial 104 finished with value: 0.26992279112945716 and parameters: {'model_type': 'graphsage', 'hidden_dims': '[256, 128]', 'dropout': 0.1027284730550078, 'batch_norm': False, 'lr': 7.369526373939659e-05, 'weight_decay': 1.1053823792179406e-05, 'epochs': 104, 'loss': 'mae', 'optimizer': 'adam', 'graph_mode': 'cutoff', 'cutoff': 0.32012257564580504, 'grm_norm': 'cosine_then_gcn', 'self_loops': True, 'use_snp_selection': True, 'num_snps': 49944}. Best is trial 71 with value: 0.27769131151746956.
[I 2025-11-12 09:24:56,199] Trial 105 finished with value: 0.21425773569026885 and parameters: {'model_type': 'graphsage', 'hidden_dims': '[256, 128]', 'dropout': 0.134232309567012, 'batch_norm': False, 'lr': 1.4527242162558112e-06, 'weight_decay': 2.6050307370050493e-05, 'epochs': 93, 'loss': 'mae', 'optimizer': 'adam', 'graph_mode': 'cutoff', 'cutoff': 0.3535609304217054, 'grm_norm': 'cosine_then_gcn', 'self_loops': True, 'use_snp_selection': True, 'num_snps': 39217}. Best is trial 71 with value: 0.27769131151746956.
[I 2025-11-12 09:26:51,230] Trial 106 finished with value: 0.25414528209643233 and parameters: {'model_type': 'graphsage', 'hidden_dims': '[256, 128]', 'dropout': 0.14889688812244684, 'batch_norm': False, 'lr': 3.8269830229557705e-05, 'weight_decay': 7.863361905221722e-05, 'epochs': 85, 'loss': 'mae', 'optimizer': 'adam', 'graph_mode': 'cutoff', 'cutoff': 0.29775103458874586, 'grm_norm': 'cosine_then_gcn', 'self_loops': True, 'use_snp_selection': True, 'num_snps': 46304}. Best is trial 71 with value: 0.27769131151746956.
[I 2025-11-12 09:30:02,030] Trial 107 finished with value: 0.2553860842273346 and parameters: {'model_type': 'graphsage', 'hidden_dims': '[256, 128]', 'dropout': 0.19661411345512259, 'batch_norm': False, 'lr': 3.084472764050077e-05, 'weight_decay': 6.051746358405754e-05, 'epochs': 113, 'loss': 'mae', 'optimizer': 'adam', 'graph_mode': 'cutoff', 'cutoff': 0.2747030411904051, 'grm_norm': 'cosine_then_gcn', 'self_loops': True, 'use_snp_selection': True, 'num_snps': 57660}. Best is trial 71 with value: 0.27769131151746956.
[I 2025-11-12 09:32:19,368] Trial 108 finished with value: 0.27034331990919774 and parameters: {'model_type': 'graphsage', 'hidden_dims': '[512, 64]', 'dropout': 0.11773528498962849, 'batch_norm': False, 'lr': 4.647078895284981e-05, 'weight_decay': 0.0001309790147670072, 'epochs': 125, 'loss': 'mae', 'optimizer': 'adam', 'graph_mode': 'cutoff', 'cutoff': 0.5572876020571124, 'grm_norm': 'cosine_then_gcn', 'self_loops': True, 'use_snp_selection': True, 'num_snps': 56268}. Best is trial 71 with value: 0.27769131151746956.
[I 2025-11-12 09:34:04,832] Trial 109 finished with value: 0.2445869579401058 and parameters: {'model_type': 'graphsage', 'hidden_dims': '[256, 128]', 'dropout': 0.13920255453973876, 'batch_norm': False, 'lr': 0.0001175519669068995, 'weight_decay': 3.334354189625198e-05, 'epochs': 118, 'loss': 'mse', 'optimizer': 'adam', 'graph_mode': 'cutoff', 'cutoff': 0.5226094508083678, 'grm_norm': 'cosine_then_gcn', 'self_loops': True, 'use_snp_selection': True, 'num_snps': 53614}. Best is trial 71 with value: 0.27769131151746956.
[I 2025-11-12 09:35:59,927] Trial 110 finished with value: 0.2511382280003903 and parameters: {'model_type': 'graphsage', 'hidden_dims': '[256, 128]', 'dropout': 0.12919567692808043, 'batch_norm': False, 'lr': 8.777790751610875e-05, 'weight_decay': 7.448749082945635e-06, 'epochs': 97, 'loss': 'mae', 'optimizer': 'adam', 'graph_mode': 'cutoff', 'cutoff': 0.46015167534970997, 'grm_norm': 'cosine', 'self_loops': True, 'use_snp_selection': True, 'num_snps': 51856}. Best is trial 71 with value: 0.27769131151746956.
[I 2025-11-12 09:38:19,541] Trial 111 finished with value: 0.2781480019373056 and parameters: {'model_type': 'graphsage', 'hidden_dims': '[256, 128]', 'dropout': 0.19115217901395004, 'batch_norm': False, 'lr': 6.766299611144801e-05, 'weight_decay': 4.02443565754346e-05, 'epochs': 110, 'loss': 'mae', 'optimizer': 'adam', 'graph_mode': 'cutoff', 'cutoff': 0.34097467783365715, 'grm_norm': 'cosine_then_gcn', 'self_loops': True, 'use_snp_selection': True, 'num_snps': 54997}. Best is trial 111 with value: 0.2781480019373056.
[I 2025-11-12 09:40:19,019] Trial 112 finished with value: 0.26339804276082024 and parameters: {'model_type': 'graphsage', 'hidden_dims': '[256, 128]', 'dropout': 0.20723252103234913, 'batch_norm': False, 'lr': 6.163470168214091e-05, 'weight_decay': 1.4964263016087345e-05, 'epochs': 110, 'loss': 'mae', 'optimizer': 'adam', 'graph_mode': 'cutoff', 'cutoff': 0.4886218001400509, 'grm_norm': 'cosine_then_gcn', 'self_loops': True, 'use_snp_selection': True, 'num_snps': 54950}. Best is trial 111 with value: 0.2781480019373056.
[I 2025-11-12 09:42:22,809] Trial 113 finished with value: 0.2705989502781063 and parameters: {'model_type': 'graphsage', 'hidden_dims': '[256, 128]', 'dropout': 0.16212597447907134, 'batch_norm': False, 'lr': 7.060671272041518e-05, 'weight_decay': 2.107348888059729e-05, 'epochs': 89, 'loss': 'mae', 'optimizer': 'adam', 'graph_mode': 'cutoff', 'cutoff': 0.40081882141533187, 'grm_norm': 'cosine_then_gcn', 'self_loops': True, 'use_snp_selection': True, 'num_snps': 58847}. Best is trial 111 with value: 0.2781480019373056.
[I 2025-11-12 09:44:42,915] Trial 114 finished with value: 0.27434399357935335 and parameters: {'model_type': 'graphsage', 'hidden_dims': '[256, 128]', 'dropout': 0.18611549519389678, 'batch_norm': False, 'lr': 5.4776149117753775e-05, 'weight_decay': 4.078523663661873e-05, 'epochs': 102, 'loss': 'mae', 'optimizer': 'adam', 'graph_mode': 'cutoff', 'cutoff': 0.3403422295313495, 'grm_norm': 'cosine_then_gcn', 'self_loops': True, 'use_snp_selection': True, 'num_snps': 56873}. Best is trial 111 with value: 0.2781480019373056.
[I 2025-11-12 09:47:23,639] Trial 115 finished with value: 0.2828237894184916 and parameters: {'model_type': 'graphsage', 'hidden_dims': '[512, 128]', 'dropout': 0.18384477917797035, 'batch_norm': False, 'lr': 5.364421049683079e-05, 'weight_decay': 4.4755027227663105e-05, 'epochs': 78, 'loss': 'mae', 'optimizer': 'adam', 'graph_mode': 'cutoff', 'cutoff': 0.31153174887883, 'grm_norm': 'cosine_then_gcn', 'self_loops': True, 'use_snp_selection': True, 'num_snps': 59952}. Best is trial 115 with value: 0.2828237894184916.
[I 2025-11-12 09:49:42,885] Trial 116 finished with value: 0.263306048419969 and parameters: {'model_type': 'graphsage', 'hidden_dims': '[512, 128]', 'dropout': 0.18546684083424278, 'batch_norm': False, 'lr': 4.235584344971346e-05, 'weight_decay': 4.213598492537835e-05, 'epochs': 64, 'loss': 'mae', 'optimizer': 'adam', 'graph_mode': 'cutoff', 'cutoff': 0.3107017291648724, 'grm_norm': 'cosine_then_gcn', 'self_loops': True, 'use_snp_selection': True, 'num_snps': 56673}. Best is trial 115 with value: 0.2828237894184916.
[I 2025-11-12 09:52:07,676] Trial 117 finished with value: 0.25728077881771805 and parameters: {'model_type': 'graphsage', 'hidden_dims': '[512, 128]', 'dropout': 0.1750856277154753, 'batch_norm': False, 'lr': 4.9790070653701154e-05, 'weight_decay': 5.561978884028108e-05, 'epochs': 83, 'loss': 'mae', 'optimizer': 'adam', 'graph_mode': 'cutoff', 'cutoff': 0.3450268008462324, 'grm_norm': 'cosine_then_gcn', 'self_loops': True, 'use_snp_selection': True, 'num_snps': 55530}. Best is trial 115 with value: 0.2828237894184916.
[I 2025-11-12 09:53:05,597] Trial 118 finished with value: 0.24090955102432465 and parameters: {'model_type': 'graphsage', 'hidden_dims': '[512, 128]', 'dropout': 0.21863547760678675, 'batch_norm': True, 'lr': 5.458236215834245e-05, 'weight_decay': 5.087567450315331e-05, 'epochs': 49, 'loss': 'mae', 'optimizer': 'adam', 'graph_mode': 'cutoff', 'cutoff': 0.36738454479935034, 'grm_norm': 'cosine_then_gcn', 'self_loops': True, 'use_snp_selection': False}. Best is trial 115 with value: 0.2828237894184916.
[I 2025-11-12 09:56:16,910] Trial 119 finished with value: 0.2751560276227093 and parameters: {'model_type': 'graphsage', 'hidden_dims': '[512, 128]', 'dropout': 0.238076420099813, 'batch_norm': False, 'lr': 4.211897950591146e-05, 'weight_decay': 3.243552010928025e-05, 'epochs': 103, 'loss': 'mae', 'optimizer': 'adam', 'graph_mode': 'cutoff', 'cutoff': 0.3075190560130687, 'grm_norm': 'cosine_then_gcn', 'self_loops': True, 'use_snp_selection': True, 'num_snps': 59800}. Best is trial 115 with value: 0.2828237894184916.
[I 2025-11-12 09:58:23,132] Trial 120 finished with value: 0.2568748614522492 and parameters: {'model_type': 'graphsage', 'hidden_dims': '[512, 128]', 'dropout': 0.23369521588530195, 'batch_norm': False, 'lr': 3.236971098399491e-05, 'weight_decay': 0.00010009958908894407, 'epochs': 76, 'loss': 'mae', 'optimizer': 'adam', 'graph_mode': 'knn', 'source': 'grm', 'knn_k': 2, 'weighted_edges': False, 'symmetrize_mode': 'mutual', 'use_snp_selection': True, 'num_snps': 59906}. Best is trial 115 with value: 0.2828237894184916.
[I 2025-11-12 10:01:29,104] Trial 121 finished with value: 0.271656318084356 and parameters: {'model_type': 'graphsage', 'hidden_dims': '[512, 128]', 'dropout': 0.2000825089525753, 'batch_norm': False, 'lr': 4.26434832122983e-05, 'weight_decay': 2.8507167941245024e-05, 'epochs': 102, 'loss': 'mae', 'optimizer': 'adam', 'graph_mode': 'cutoff', 'cutoff': 0.3127695328805687, 'grm_norm': 'cosine_then_gcn', 'self_loops': True, 'use_snp_selection': True, 'num_snps': 58093}. Best is trial 115 with value: 0.2828237894184916.
[I 2025-11-12 10:04:35,760] Trial 122 finished with value: 0.25352032957077336 and parameters: {'model_type': 'graphsage', 'hidden_dims': '[512, 128]', 'dropout': 0.1765711834396376, 'batch_norm': False, 'lr': 7.761203861778807e-05, 'weight_decay': 3.777916325604126e-05, 'epochs': 92, 'loss': 'mae', 'optimizer': 'adam', 'graph_mode': 'cutoff', 'cutoff': 0.2712683708090004, 'grm_norm': 'cosine_then_gcn', 'self_loops': True, 'use_snp_selection': True, 'num_snps': 53987}. Best is trial 115 with value: 0.2828237894184916.
[I 2025-11-12 10:07:51,982] Trial 123 finished with value: 0.2769675051072438 and parameters: {'model_type': 'graphsage', 'hidden_dims': '[512, 128]', 'dropout': 0.15054212869424, 'batch_norm': False, 'lr': 2.7656501261661208e-05, 'weight_decay': 3.164113451408312e-05, 'epochs': 129, 'loss': 'mae', 'optimizer': 'adam', 'graph_mode': 'cutoff', 'cutoff': 0.34243793745105244, 'grm_norm': 'cosine_then_gcn', 'self_loops': True, 'use_snp_selection': True, 'num_snps': 57007}. Best is trial 115 with value: 0.2828237894184916.
[I 2025-11-12 10:12:38,155] Trial 124 finished with value: 0.2659080512073412 and parameters: {'model_type': 'graphsage', 'hidden_dims': '[512, 128]', 'dropout': 0.14948022123906982, 'batch_norm': False, 'lr': 2.8465201909583897e-05, 'weight_decay': 2.951738901704e-05, 'epochs': 127, 'loss': 'mae', 'optimizer': 'adam', 'graph_mode': 'cutoff', 'cutoff': 0.23963854412910257, 'grm_norm': 'cosine_then_gcn', 'self_loops': True, 'use_snp_selection': True, 'num_snps': 56839}. Best is trial 115 with value: 0.2828237894184916.
[I 2025-11-12 10:15:35,476] Trial 125 finished with value: 0.26076332405912017 and parameters: {'model_type': 'graphsage', 'hidden_dims': '[512, 128]', 'dropout': 0.18648611604775847, 'batch_norm': False, 'lr': 9.018229687026002e-05, 'weight_decay': 4.3174054367620374e-05, 'epochs': 117, 'loss': 'mae', 'optimizer': 'adam', 'graph_mode': 'cutoff', 'cutoff': 0.3453381950044319, 'grm_norm': 'cosine_then_gcn', 'self_loops': True, 'use_snp_selection': True, 'num_snps': 55531}. Best is trial 115 with value: 0.2828237894184916.
