[I 2025-10-23 05:21:07,522] Trial 125 finished with value: 0.23142260756038727 and parameters: {'model_type': 'gat', 'hidden_dims': '[512, 128]', 'dropout': 0.3837797556473084, 'batch_norm': True, 'gat_heads': 5, 'gat_attn_dropout': 0.12702759741665876, 'gat_concat_hidden': True, 'lr': 0.00042018909223663035, 'weight_decay': 8.745371480846396e-07, 'epochs': 200, 'loss': 'mae', 'optimizer': 'adam', 'graph_mode': 'cutoff', 'cutoff': 0.8642163022634691, 'grm_norm': 'cosine_then_gcn', 'self_loops': True}. Best is trial 101 with value: 0.23938908029324887.
[I 2025-10-23 05:25:20,522] Trial 126 finished with value: 0.22438554883558606 and parameters: {'model_type': 'gat', 'hidden_dims': '[512, 128]', 'dropout': 0.3224554675289256, 'batch_norm': True, 'gat_heads': 4, 'gat_attn_dropout': 0.05419355503938979, 'gat_concat_hidden': True, 'lr': 0.0004434647166769504, 'weight_decay': 2.6473030587966314e-06, 'epochs': 197, 'loss': 'mae', 'optimizer': 'adam', 'graph_mode': 'cutoff', 'cutoff': 0.8704136963519462, 'grm_norm': 'cosine_then_gcn', 'self_loops': True}. Best is trial 101 with value: 0.23938908029324887.
[I 2025-10-23 05:27:52,599] Trial 127 finished with value: 0.20159284062036925 and parameters: {'model_type': 'gat', 'hidden_dims': '[256, 128, 64]', 'dropout': 0.3409343997491044, 'batch_norm': True, 'gat_heads': 5, 'gat_attn_dropout': 0.09707674235232919, 'gat_concat_hidden': True, 'lr': 0.00035389287221280965, 'weight_decay': 8.467765100462129e-07, 'epochs': 170, 'loss': 'mae', 'optimizer': 'adam', 'graph_mode': 'cutoff', 'cutoff': 0.8998189841337173, 'grm_norm': 'cosine', 'self_loops': True}. Best is trial 101 with value: 0.23938908029324887.
[I 2025-10-23 05:30:42,002] Trial 128 finished with value: 0.23013705138576449 and parameters: {'model_type': 'gat', 'hidden_dims': '[512, 128]', 'dropout': 0.2915983863938665, 'batch_norm': True, 'gat_heads': 3, 'gat_attn_dropout': 0.07896657244184485, 'gat_concat_hidden': True, 'lr': 0.00031397368300630207, 'weight_decay': 9.528387261245095e-07, 'epochs': 179, 'loss': 'mae', 'optimizer': 'adam', 'graph_mode': 'cutoff', 'cutoff': 0.8538477941316338, 'grm_norm': 'cosine_then_gcn', 'self_loops': True}. Best is trial 101 with value: 0.23938908029324887.
[I 2025-10-23 05:33:21,092] Trial 129 finished with value: 0.21768075916620658 and parameters: {'model_type': 'gat', 'hidden_dims': '[512, 128]', 'dropout': 0.3852882477819187, 'batch_norm': True, 'gat_heads': 3, 'gat_attn_dropout': 0.06456928309273627, 'gat_concat_hidden': True, 'lr': 0.0005430251622005318, 'weight_decay': 1.5590843598035142e-06, 'epochs': 167, 'loss': 'mae', 'optimizer': 'adam', 'graph_mode': 'cutoff', 'cutoff': 0.6287311508683223, 'grm_norm': 'cosine_then_gcn', 'self_loops': True}. Best is trial 101 with value: 0.23938908029324887.
[I 2025-10-23 05:35:26,532] Trial 130 finished with value: 0.20567168841617786 and parameters: {'model_type': 'gat', 'hidden_dims': '[512, 128]', 'dropout': 0.35073892956022573, 'batch_norm': True, 'gat_heads': 2, 'gat_attn_dropout': 0.12998433973363044, 'gat_concat_hidden': True, 'lr': 0.00032549579261417647, 'weight_decay': 1.0850838822500689e-06, 'epochs': 198, 'loss': 'mae', 'optimizer': 'adam', 'graph_mode': 'cutoff', 'cutoff': 0.8363433523284806, 'grm_norm': 'cosine_then_gcn', 'self_loops': True}. Best is trial 101 with value: 0.23938908029324887.
[I 2025-10-23 05:37:22,590] Trial 131 finished with value: 0.19754374780944534 and parameters: {'model_type': 'gat', 'hidden_dims': '[512, 128]', 'dropout': 0.2967441686734535, 'batch_norm': True, 'gat_heads': 2, 'gat_attn_dropout': 0.07753362381816051, 'gat_concat_hidden': True, 'lr': 0.0002537820143520999, 'weight_decay': 8.981434842356366e-07, 'epochs': 180, 'loss': 'mae', 'optimizer': 'adam', 'graph_mode': 'cutoff', 'cutoff': 0.8556777569742634, 'grm_norm': 'cosine_then_gcn', 'self_loops': True}. Best is trial 101 with value: 0.23938908029324887.
[I 2025-10-23 05:39:53,784] Trial 132 finished with value: 0.2145466352168539 and parameters: {'model_type': 'gat', 'hidden_dims': '[512, 128]', 'dropout': 0.37241939012947317, 'batch_norm': True, 'gat_heads': 3, 'gat_attn_dropout': 0.02777822952505265, 'gat_concat_hidden': True, 'lr': 0.000299935011887493, 'weight_decay': 2.401845489767834e-06, 'epochs': 158, 'loss': 'mae', 'optimizer': 'adam', 'graph_mode': 'cutoff', 'cutoff': 0.8740782079938777, 'grm_norm': 'cosine_then_gcn', 'self_loops': True}. Best is trial 101 with value: 0.23938908029324887.
[I 2025-10-23 05:43:09,993] Trial 133 finished with value: 0.2190821016799481 and parameters: {'model_type': 'gat', 'hidden_dims': '[512, 128]', 'dropout': 0.39048959194649707, 'batch_norm': True, 'gat_heads': 3, 'gat_attn_dropout': 0.0929808898920575, 'gat_concat_hidden': True, 'lr': 0.0001935555857614512, 'weight_decay': 1.3389787173780784e-06, 'epochs': 210, 'loss': 'mae', 'optimizer': 'adam', 'graph_mode': 'cutoff', 'cutoff': 0.8458606340676568, 'grm_norm': 'cosine', 'self_loops': True}. Best is trial 101 with value: 0.23938908029324887.
[I 2025-10-23 05:48:17,679] Trial 134 finished with value: 0.23332709523653988 and parameters: {'model_type': 'gat', 'hidden_dims': '[512, 64]', 'dropout': 0.2908212110457123, 'batch_norm': True, 'gat_heads': 5, 'gat_attn_dropout': 0.046266286181551, 'gat_concat_hidden': True, 'lr': 0.0003963919524732815, 'weight_decay': 6.484425170077663e-07, 'epochs': 193, 'loss': 'mae', 'optimizer': 'adam', 'graph_mode': 'cutoff', 'cutoff': 0.88763249084016, 'grm_norm': 'cosine_then_gcn', 'self_loops': True}. Best is trial 101 with value: 0.23938908029324887.
[I 2025-10-23 05:49:26,870] Trial 135 finished with value: 0.2253483579486843 and parameters: {'model_type': 'gat', 'hidden_dims': '[512, 64]', 'dropout': 0.303967699410859, 'batch_norm': True, 'gat_heads': 1, 'gat_attn_dropout': 0.04351960633101765, 'gat_concat_hidden': True, 'lr': 0.00044484197218503215, 'weight_decay': 6.471087480969054e-07, 'epochs': 204, 'loss': 'mae', 'optimizer': 'adam', 'graph_mode': 'cutoff', 'cutoff': 0.8988798551612348, 'grm_norm': 'cosine_then_gcn', 'self_loops': True}. Best is trial 101 with value: 0.23938908029324887.
[I 2025-10-23 05:54:27,647] Trial 136 finished with value: 0.19695918438593193 and parameters: {'model_type': 'gat', 'hidden_dims': '[512, 64]', 'dropout': 0.28554747918225687, 'batch_norm': False, 'gat_heads': 5, 'gat_attn_dropout': 0.010293336573154212, 'gat_concat_hidden': False, 'lr': 0.0006380450035691723, 'weight_decay': 1.1646614364049458e-06, 'epochs': 197, 'loss': 'mae', 'optimizer': 'adam', 'graph_mode': 'cutoff', 'cutoff': 0.8852933258559755, 'grm_norm': 'cosine_then_gcn', 'self_loops': False}. Best is trial 101 with value: 0.23938908029324887.
[I 2025-10-23 06:00:54,506] Trial 137 finished with value: 0.22700936021442258 and parameters: {'model_type': 'gat', 'hidden_dims': '[512, 64]', 'dropout': 0.5152877646353492, 'batch_norm': True, 'gat_heads': 7, 'gat_attn_dropout': 0.0600088891896836, 'gat_concat_hidden': True, 'lr': 0.0005101628292018248, 'weight_decay': 7.206056630088732e-07, 'epochs': 177, 'loss': 'mae', 'optimizer': 'adam', 'graph_mode': 'cutoff', 'cutoff': 0.8663086092641157, 'grm_norm': 'cosine_then_gcn', 'self_loops': True}. Best is trial 101 with value: 0.23938908029324887.
[I 2025-10-23 06:06:02,940] Trial 138 finished with value: 0.1365411564860201 and parameters: {'model_type': 'gat', 'hidden_dims': '[512, 64]', 'dropout': 0.29132545457910397, 'batch_norm': True, 'gat_heads': 5, 'gat_attn_dropout': 0.0014081376176482904, 'gat_concat_hidden': True, 'lr': 0.000399648555010065, 'weight_decay': 1.7983334946896093e-06, 'epochs': 191, 'loss': 'mse', 'optimizer': 'adam', 'graph_mode': 'knn', 'source': 'grm', 'knn_k': 5, 'weighted_edges': False, 'symmetrize_mode': 'mutual'}. Best is trial 101 with value: 0.23938908029324887.
[I 2025-10-23 06:11:35,534] Trial 139 finished with value: 0.21688419961799527 and parameters: {'model_type': 'gat', 'hidden_dims': '[512, 64]', 'dropout': 0.36251324447231786, 'batch_norm': True, 'gat_heads': 5, 'gat_attn_dropout': 0.028480877206659663, 'gat_concat_hidden': True, 'lr': 0.0002331266356512835, 'weight_decay': 5.688306521716677e-06, 'epochs': 210, 'loss': 'mae', 'optimizer': 'adam', 'graph_mode': 'cutoff', 'cutoff': 0.8289890102562425, 'grm_norm': 'cosine_then_gcn', 'self_loops': True}. Best is trial 101 with value: 0.23938908029324887.
[I 2025-10-23 06:16:12,197] Trial 140 finished with value: 0.2188795350668625 and parameters: {'model_type': 'gat', 'hidden_dims': '[512, 128]', 'dropout': 0.25674140565967996, 'batch_norm': True, 'gat_heads': 4, 'gat_attn_dropout': 0.04381366772437544, 'gat_concat_hidden': True, 'lr': 0.0001269629273244399, 'weight_decay': 5.172717082754581e-07, 'epochs': 217, 'loss': 'mae', 'optimizer': 'adam', 'graph_mode': 'cutoff', 'cutoff': 0.8635177129996611, 'grm_norm': 'cosine', 'self_loops': True}. Best is trial 101 with value: 0.23938908029324887.
[I 2025-10-23 06:18:51,761] Trial 141 finished with value: 0.21448523773837605 and parameters: {'model_type': 'gat', 'hidden_dims': '[256, 128]', 'dropout': 0.37741638528852467, 'batch_norm': True, 'gat_heads': 5, 'gat_attn_dropout': 0.07657432574588591, 'gat_concat_hidden': True, 'lr': 0.00027031524565095046, 'weight_decay': 8.270535668471558e-07, 'epochs': 183, 'loss': 'mae', 'optimizer': 'adam', 'graph_mode': 'cutoff', 'cutoff': 0.8485745406094387, 'grm_norm': 'none', 'self_loops': True}. Best is trial 101 with value: 0.23938908029324887.
[I 2025-10-23 06:22:24,143] Trial 142 finished with value: 0.22121759724104093 and parameters: {'model_type': 'gat', 'hidden_dims': '[512, 128]', 'dropout': 0.35695336697159386, 'batch_norm': True, 'gat_heads': 2, 'gat_attn_dropout': 0.05347440595261115, 'gat_concat_hidden': True, 'lr': 0.0003494079527451072, 'weight_decay': 4.337358017407266e-07, 'epochs': 347, 'loss': 'mae', 'optimizer': 'adam', 'graph_mode': 'cutoff', 'cutoff': 0.8836716138113042, 'grm_norm': 'cosine_then_gcn', 'self_loops': True}. Best is trial 101 with value: 0.23938908029324887.
[I 2025-10-23 06:28:34,041] Trial 143 finished with value: 0.2327662236593803 and parameters: {'model_type': 'gat', 'hidden_dims': '[512, 128]', 'dropout': 0.54651223602687, 'batch_norm': True, 'gat_heads': 5, 'gat_attn_dropout': 0.020956533084985695, 'gat_concat_hidden': True, 'lr': 0.0003059842913717086, 'weight_decay': 5.622593051124171e-07, 'epochs': 233, 'loss': 'mae', 'optimizer': 'adam', 'graph_mode': 'cutoff', 'cutoff': 0.8150993363137976, 'grm_norm': 'cosine_then_gcn', 'self_loops': True}. Best is trial 101 with value: 0.23938908029324887.
[I 2025-10-23 06:34:43,724] Trial 144 finished with value: 0.15144835734541845 and parameters: {'model_type': 'gat', 'hidden_dims': '[512, 128]', 'dropout': 0.5449550436417387, 'batch_norm': True, 'gat_heads': 5, 'gat_attn_dropout': 0.0190891203260707, 'gat_concat_hidden': True, 'lr': 1.056979515736987e-06, 'weight_decay': 9.571456447009182e-07, 'epochs': 233, 'loss': 'mae', 'optimizer': 'adam', 'graph_mode': 'cutoff', 'cutoff': 0.8140943928205246, 'grm_norm': 'cosine_then_gcn', 'self_loops': True}. Best is trial 101 with value: 0.23938908029324887.
[I 2025-10-23 06:40:44,057] Trial 145 finished with value: 0.22522475366702865 and parameters: {'model_type': 'gat', 'hidden_dims': '[512, 128]', 'dropout': 0.5560456922603009, 'batch_norm': True, 'gat_heads': 5, 'gat_attn_dropout': 0.03671497755236955, 'gat_concat_hidden': True, 'lr': 0.0001899896085520578, 'weight_decay': 5.835188987275753e-07, 'epochs': 227, 'loss': 'mae', 'optimizer': 'adam', 'graph_mode': 'cutoff', 'cutoff': 0.867319415345765, 'grm_norm': 'cosine_then_gcn', 'self_loops': True}. Best is trial 101 with value: 0.23938908029324887.
[I 2025-10-23 06:46:08,906] Trial 146 finished with value: 0.20788979553077286 and parameters: {'model_type': 'gat', 'hidden_dims': '[512, 128]', 'dropout': 0.4338974613691044, 'batch_norm': True, 'gat_heads': 5, 'gat_attn_dropout': 0.009050829333822069, 'gat_concat_hidden': True, 'lr': 0.00031628140832728915, 'weight_decay': 7.200313359473584e-07, 'epochs': 203, 'loss': 'mae', 'optimizer': 'adam', 'graph_mode': 'cutoff', 'cutoff': 0.8279819521344902, 'grm_norm': 'cosine_then_gcn', 'self_loops': True}. Best is trial 101 with value: 0.23938908029324887.
[I 2025-10-23 06:55:25,080] Trial 147 finished with value: 0.2057609547041282 and parameters: {'model_type': 'gat', 'hidden_dims': '[512, 128]', 'dropout': 0.4913065710330363, 'batch_norm': True, 'gat_heads': 8, 'gat_attn_dropout': 0.024301397967041505, 'gat_concat_hidden': True, 'lr': 0.00022209765596849468, 'weight_decay': 2.867015666655209e-05, 'epochs': 218, 'loss': 'mae', 'optimizer': 'adam', 'graph_mode': 'cutoff', 'cutoff': 0.8400127975151267, 'grm_norm': 'cosine_then_gcn', 'self_loops': True}. Best is trial 101 with value: 0.23938908029324887.
[I 2025-10-23 06:58:14,420] Trial 148 finished with value: 0.22274574993893165 and parameters: {'model_type': 'gat', 'hidden_dims': '[512, 128]', 'dropout': 0.32462905503528616, 'batch_norm': True, 'gat_heads': 5, 'gat_attn_dropout': 0.06342931553547267, 'gat_concat_hidden': True, 'lr': 0.00013711062039005315, 'weight_decay': 3.1076387489012236e-06, 'epochs': 99, 'loss': 'mae', 'optimizer': 'adam', 'graph_mode': 'cutoff', 'cutoff': 0.876928416225868, 'grm_norm': 'cosine', 'self_loops': True}. Best is trial 101 with value: 0.23938908029324887.
[I 2025-10-23 06:59:42,783] Trial 149 finished with value: 0.19412480374391405 and parameters: {'model_type': 'gat', 'hidden_dims': '[128, 64]', 'dropout': 0.41206113906364916, 'batch_norm': True, 'gat_heads': 5, 'gat_attn_dropout': 0.04254781109540813, 'gat_concat_hidden': True, 'lr': 0.00041681703408615056, 'weight_decay': 1.8118886359893842e-05, 'epochs': 193, 'loss': 'mae', 'optimizer': 'adam', 'graph_mode': 'cutoff', 'cutoff': 0.8991271012462934, 'grm_norm': 'cosine_then_gcn', 'self_loops': True}. Best is trial 101 with value: 0.23938908029324887.
[I 2025-10-23 07:00:48,416] Trial 0 finished with value: 0.17535445583355774 and parameters: {'model_type': 'gat', 'hidden_dims': '[128, 64]', 'dropout': 0.199031432379812, 'batch_norm': True, 'gat_heads': 1, 'gat_attn_dropout': 0.41121589102067835, 'gat_concat_hidden': True, 'lr': 3.4401453323286906e-05, 'weight_decay': 0.00017802616915745114, 'epochs': 230, 'loss': 'mse', 'optimizer': 'adam', 'graph_mode': 'knn', 'source': 'grm', 'knn_k': 6, 'weighted_edges': True, 'symmetrize_mode': 'mutual'}. Best is trial 0 with value: 0.17535445583355774.
[I 2025-10-23 07:02:00,143] Trial 1 finished with value: 0.05083620666868812 and parameters: {'model_type': 'gat', 'hidden_dims': '[512, 64]', 'dropout': 0.36082357619681704, 'batch_norm': True, 'gat_heads': 1, 'gat_attn_dropout': 0.18042003398172202, 'gat_concat_hidden': False, 'lr': 1.3825758230956745e-06, 'weight_decay': 3.199989794411411e-05, 'epochs': 210, 'loss': 'mse', 'optimizer': 'adam', 'graph_mode': 'knn', 'source': 'grm', 'knn_k': 8, 'weighted_edges': True, 'symmetrize_mode': 'mutual'}. Best is trial 0 with value: 0.17535445583355774.
[I 2025-10-23 07:04:29,836] Trial 2 finished with value: 0.12958283525832906 and parameters: {'model_type': 'gat', 'hidden_dims': '[512, 64]', 'dropout': 0.5938127374509361, 'batch_norm': False, 'gat_heads': 3, 'gat_attn_dropout': 0.3584229889385306, 'gat_concat_hidden': True, 'lr': 5.8966328690006356e-05, 'weight_decay': 1.4359095002909625e-07, 'epochs': 151, 'loss': 'mae', 'optimizer': 'adam', 'graph_mode': 'cutoff', 'cutoff': 0.22797144608298409, 'grm_norm': 'none', 'self_loops': False}. Best is trial 0 with value: 0.17535445583355774.
[I 2025-10-23 07:05:07,000] Trial 3 finished with value: 0.13310152206653797 and parameters: {'model_type': 'gat', 'hidden_dims': '[256, 128]', 'dropout': 0.23110783056597514, 'batch_norm': True, 'gat_heads': 3, 'gat_attn_dropout': 0.14524552524211642, 'gat_concat_hidden': False, 'lr': 2.6631568299397822e-05, 'weight_decay': 1.4831733219640837e-06, 'epochs': 59, 'loss': 'mse', 'optimizer': 'adam', 'graph_mode': 'cutoff', 'cutoff': 0.5085416774304665, 'grm_norm': 'cosine_then_gcn', 'self_loops': False}. Best is trial 0 with value: 0.17535445583355774.
[I 2025-10-23 07:05:38,319] Trial 4 finished with value: 0.14907042961766576 and parameters: {'model_type': 'gat', 'hidden_dims': '[128, 64]', 'dropout': 0.24986493621228142, 'batch_norm': False, 'gat_heads': 2, 'gat_attn_dropout': 0.03028660209239857, 'gat_concat_hidden': True, 'lr': 3.4411882055364858e-06, 'weight_decay': 0.00034938832175517785, 'epochs': 153, 'loss': 'mae', 'optimizer': 'adam', 'graph_mode': 'cutoff', 'cutoff': 0.5288497054083461, 'grm_norm': 'cosine_then_gcn', 'self_loops': False}. Best is trial 0 with value: 0.17535445583355774.
[I 2025-10-23 07:07:00,998] Trial 5 finished with value: 0.15437186784393225 and parameters: {'model_type': 'gat', 'hidden_dims': '[256, 128, 64]', 'dropout': 0.3667354424945013, 'batch_norm': False, 'gat_heads': 5, 'gat_attn_dropout': 0.47505419776597435, 'gat_concat_hidden': False, 'lr': 5.6570170227139244e-05, 'weight_decay': 6.845407486393404e-05, 'epochs': 86, 'loss': 'mae', 'optimizer': 'adam', 'graph_mode': 'cutoff', 'cutoff': 0.3163415033931736, 'grm_norm': 'cosine', 'self_loops': False}. Best is trial 0 with value: 0.17535445583355774.
[I 2025-10-23 07:09:56,234] Trial 6 finished with value: 0.13172022266908973 and parameters: {'model_type': 'gat', 'hidden_dims': '[512, 64]', 'dropout': 0.4724320384750339, 'batch_norm': True, 'gat_heads': 2, 'gat_attn_dropout': 0.5029567924222157, 'gat_concat_hidden': False, 'lr': 0.00035117819773722113, 'weight_decay': 2.586139236899202e-05, 'epochs': 282, 'loss': 'mse', 'optimizer': 'adam', 'graph_mode': 'knn', 'source': 'grm', 'knn_k': 5, 'weighted_edges': False, 'symmetrize_mode': 'mutual'}. Best is trial 0 with value: 0.17535445583355774.
[I 2025-10-23 07:10:27,105] Trial 7 finished with value: 0.11851434412907866 and parameters: {'model_type': 'gat', 'hidden_dims': '[256, 128]', 'dropout': 0.26933956649466984, 'batch_norm': False, 'gat_heads': 1, 'gat_attn_dropout': 0.12357015502138351, 'gat_concat_hidden': True, 'lr': 9.272145288974393e-05, 'weight_decay': 0.0001637847231599168, 'epochs': 149, 'loss': 'mae', 'optimizer': 'adam', 'graph_mode': 'knn', 'source': 'grm', 'knn_k': 9, 'weighted_edges': False, 'symmetrize_mode': 'mutual'}. Best is trial 0 with value: 0.17535445583355774.
[I 2025-10-23 07:10:46,617] Trial 8 finished with value: 0.13876696061706853 and parameters: {'model_type': 'gat', 'hidden_dims': '[256, 128, 64]', 'dropout': 0.5327763091136416, 'batch_norm': True, 'gat_heads': 1, 'gat_attn_dropout': 0.11077610280855929, 'gat_concat_hidden': False, 'lr': 0.0005504846263330393, 'weight_decay': 6.7826287729705615e-06, 'epochs': 80, 'loss': 'mse', 'optimizer': 'adam', 'graph_mode': 'cutoff', 'cutoff': 0.39200637331077737, 'grm_norm': 'cosine_then_gcn', 'self_loops': False}. Best is trial 0 with value: 0.17535445583355774.
[I 2025-10-23 07:12:07,337] Trial 9 finished with value: 0.19495395791235592 and parameters: {'model_type': 'gat', 'hidden_dims': '[256, 128, 64]', 'dropout': 0.29822093943922523, 'batch_norm': True, 'gat_heads': 2, 'gat_attn_dropout': 0.5041483896530343, 'gat_concat_hidden': True, 'lr': 0.0009262984185468379, 'weight_decay': 8.224875501038066e-07, 'epochs': 231, 'loss': 'mae', 'optimizer': 'adam', 'graph_mode': 'cutoff', 'cutoff': 0.40177719715455146, 'grm_norm': 'none', 'self_loops': True}. Best is trial 9 with value: 0.19495395791235592.
[I 2025-10-23 07:24:19,557] Trial 10 finished with value: 0.21176002718428757 and parameters: {'model_type': 'gat', 'hidden_dims': '[512, 256]', 'dropout': 0.11372025982957354, 'batch_norm': True, 'gat_heads': 7, 'gat_attn_dropout': 0.5599540289166529, 'gat_concat_hidden': True, 'lr': 0.0009650491902216229, 'weight_decay': 1.3004302134392705e-07, 'epochs': 339, 'loss': 'mae', 'optimizer': 'adam', 'graph_mode': 'cutoff', 'cutoff': 0.7605475530345412, 'grm_norm': 'gcn', 'self_loops': True}. Best is trial 10 with value: 0.21176002718428757.
[I 2025-10-23 07:39:05,142] Trial 11 finished with value: 0.22279737900517124 and parameters: {'model_type': 'gat', 'hidden_dims': '[512, 256]', 'dropout': 0.10254502285057247, 'batch_norm': True, 'gat_heads': 8, 'gat_attn_dropout': 0.5935696129988, 'gat_concat_hidden': True, 'lr': 0.0009039246077153928, 'weight_decay': 1.014091185981818e-07, 'epochs': 348, 'loss': 'mae', 'optimizer': 'adam', 'graph_mode': 'cutoff', 'cutoff': 0.8795382731036935, 'grm_norm': 'gcn', 'self_loops': True}. Best is trial 11 with value: 0.22279737900517124.
[I 2025-10-23 07:53:26,483] Trial 12 finished with value: 0.2184558596017329 and parameters: {'model_type': 'gat', 'hidden_dims': '[512, 256]', 'dropout': 0.11851629240082012, 'batch_norm': True, 'gat_heads': 8, 'gat_attn_dropout': 0.5936622869810394, 'gat_concat_hidden': True, 'lr': 0.00021857214966676538, 'weight_decay': 1.1903116219202832e-07, 'epochs': 338, 'loss': 'mae', 'optimizer': 'adam', 'graph_mode': 'cutoff', 'cutoff': 0.8655944931386742, 'grm_norm': 'gcn', 'self_loops': True}. Best is trial 11 with value: 0.22279737900517124.
[I 2025-10-23 08:07:43,299] Trial 13 finished with value: 0.21598178326045336 and parameters: {'model_type': 'gat', 'hidden_dims': '[512, 256]', 'dropout': 0.10079190261590662, 'batch_norm': True, 'gat_heads': 8, 'gat_attn_dropout': 0.5971336107168009, 'gat_concat_hidden': True, 'lr': 0.00019793009590144092, 'weight_decay': 6.31493865874628e-07, 'epochs': 335, 'loss': 'mae', 'optimizer': 'adam', 'graph_mode': 'cutoff', 'cutoff': 0.8990602763517246, 'grm_norm': 'gcn', 'self_loops': True}. Best is trial 11 with value: 0.22279737900517124.
