[I 2025-11-03 15:18:00,794] Trial 75 finished with value: 0.04607744807783717 and parameters: {'model_type': 'graphsage', 'hidden_dims': '[512, 256]', 'dropout': 0.4904801118506207, 'batch_norm': True, 'lr': 0.00029194384485669835, 'weight_decay': 9.50830788922125e-07, 'epochs': 132, 'loss': 'mse', 'optimizer': 'adam', 'graph_mode': 'knn', 'source': 'grm', 'knn_k': 3, 'weighted_edges': False, 'symmetrize_mode': 'mutual', 'use_snp_selection': False}. Best is trial 58 with value: 0.08637900504762047.
[I 2025-11-03 15:18:03,983] Trial 76 finished with value: 0.04243524866267242 and parameters: {'model_type': 'graphsage', 'hidden_dims': '[512, 256]', 'dropout': 0.5173732200710853, 'batch_norm': True, 'lr': 0.0005784491564961857, 'weight_decay': 5.705238165178553e-07, 'epochs': 142, 'loss': 'mse', 'optimizer': 'adam', 'graph_mode': 'knn', 'source': 'grm', 'knn_k': 9, 'weighted_edges': False, 'symmetrize_mode': 'mutual', 'use_snp_selection': False}. Best is trial 58 with value: 0.08637900504762047.
[I 2025-11-03 15:18:06,786] Trial 77 finished with value: 0.05852648454848794 and parameters: {'model_type': 'graphsage', 'hidden_dims': '[512, 256]', 'dropout': 0.25989893293031274, 'batch_norm': True, 'lr': 0.000782838745604166, 'weight_decay': 2.3929190440055886e-07, 'epochs': 106, 'loss': 'mse', 'optimizer': 'adam', 'graph_mode': 'knn', 'source': 'grm', 'knn_k': 3, 'weighted_edges': False, 'symmetrize_mode': 'mutual', 'use_snp_selection': False}. Best is trial 58 with value: 0.08637900504762047.
[I 2025-11-03 15:18:11,931] Trial 78 finished with value: 0.027946078347928734 and parameters: {'model_type': 'graphsage', 'hidden_dims': '[512, 64]', 'dropout': 0.5844739352614736, 'batch_norm': False, 'lr': 0.0003890743048829075, 'weight_decay': 5.906418866753885e-07, 'epochs': 350, 'loss': 'mse', 'optimizer': 'adam', 'graph_mode': 'knn', 'source': 'grm', 'knn_k': 4, 'weighted_edges': False, 'symmetrize_mode': 'mutual', 'use_snp_selection': True, 'num_snps': 49628}. Best is trial 58 with value: 0.08637900504762047.
[I 2025-11-03 15:18:16,023] Trial 79 finished with value: 0.05624029141663987 and parameters: {'model_type': 'graphsage', 'hidden_dims': '[512, 256]', 'dropout': 0.5669552894272593, 'batch_norm': True, 'lr': 0.0004996414392582769, 'weight_decay': 1.627460462503796e-06, 'epochs': 281, 'loss': 'mse', 'optimizer': 'adam', 'graph_mode': 'knn', 'source': 'grm', 'knn_k': 2, 'weighted_edges': False, 'symmetrize_mode': 'mutual', 'use_snp_selection': False}. Best is trial 58 with value: 0.08637900504762047.
[I 2025-11-03 15:18:17,592] Trial 80 finished with value: 0.07388984477026378 and parameters: {'model_type': 'graphsage', 'hidden_dims': '[128, 64]', 'dropout': 0.5352086118709942, 'batch_norm': True, 'lr': 4.0670814168613816e-05, 'weight_decay': 4.6668807325444743e-07, 'epochs': 122, 'loss': 'mse', 'optimizer': 'adam', 'graph_mode': 'cutoff', 'cutoff': 0.4589709743721061, 'grm_norm': 'none', 'self_loops': False, 'use_snp_selection': False}. Best is trial 58 with value: 0.08637900504762047.
[I 2025-11-03 15:18:18,976] Trial 81 finished with value: 0.012012240571621908 and parameters: {'model_type': 'graphsage', 'hidden_dims': '[128, 64]', 'dropout': 0.5376248241763655, 'batch_norm': True, 'lr': 1.1241709671833051e-05, 'weight_decay': 4.276335379035185e-07, 'epochs': 69, 'loss': 'mse', 'optimizer': 'adam', 'graph_mode': 'cutoff', 'cutoff': 0.4568029015737253, 'grm_norm': 'none', 'self_loops': False, 'use_snp_selection': False}. Best is trial 58 with value: 0.08637900504762047.
[I 2025-11-03 15:18:20,533] Trial 82 finished with value: 0.020208465721978913 and parameters: {'model_type': 'graphsage', 'hidden_dims': '[128, 64]', 'dropout': 0.5555098926208066, 'batch_norm': True, 'lr': 2.8826378882695347e-05, 'weight_decay': 1.3692777876653216e-07, 'epochs': 121, 'loss': 'mse', 'optimizer': 'adam', 'graph_mode': 'cutoff', 'cutoff': 0.5653032034960996, 'grm_norm': 'none', 'self_loops': False, 'use_snp_selection': False}. Best is trial 58 with value: 0.08637900504762047.
[I 2025-11-03 15:18:22,154] Trial 83 finished with value: 0.029179216612190546 and parameters: {'model_type': 'graphsage', 'hidden_dims': '[128, 64]', 'dropout': 0.4687847462992663, 'batch_norm': True, 'lr': 4.2028566560005994e-05, 'weight_decay': 9.549876808947755e-07, 'epochs': 136, 'loss': 'mse', 'optimizer': 'adam', 'graph_mode': 'cutoff', 'cutoff': 0.3865416371955346, 'grm_norm': 'none', 'self_loops': False, 'use_snp_selection': False}. Best is trial 58 with value: 0.08637900504762047.
[I 2025-11-03 15:18:23,870] Trial 84 finished with value: 0.017548951909712597 and parameters: {'model_type': 'graphsage', 'hidden_dims': '[128, 64]', 'dropout': 0.5367818767991219, 'batch_norm': True, 'lr': 2.0319099335751572e-05, 'weight_decay': 3.954666385408545e-06, 'epochs': 167, 'loss': 'mse', 'optimizer': 'adam', 'graph_mode': 'cutoff', 'cutoff': 0.6420903885822022, 'grm_norm': 'none', 'self_loops': False, 'use_snp_selection': False}. Best is trial 58 with value: 0.08637900504762047.
[I 2025-11-03 15:18:27,015] Trial 85 finished with value: 0.06368647881425409 and parameters: {'model_type': 'graphsage', 'hidden_dims': '[512, 256]', 'dropout': 0.5095913331750315, 'batch_norm': True, 'lr': 0.00024812199313689875, 'weight_decay': 2.921348772607056e-07, 'epochs': 155, 'loss': 'mse', 'optimizer': 'adam', 'graph_mode': 'cutoff', 'cutoff': 0.49320352485228963, 'grm_norm': 'none', 'self_loops': False, 'use_snp_selection': False}. Best is trial 58 with value: 0.08637900504762047.
[I 2025-11-03 15:18:28,686] Trial 86 finished with value: 0.056621599226388236 and parameters: {'model_type': 'graphsage', 'hidden_dims': '[128, 64]', 'dropout': 0.4956336981621763, 'batch_norm': True, 'lr': 0.0002553000905352075, 'weight_decay': 2.848360453420029e-07, 'epochs': 151, 'loss': 'mse', 'optimizer': 'adam', 'graph_mode': 'cutoff', 'cutoff': 0.4831085406810098, 'grm_norm': 'none', 'self_loops': False, 'use_snp_selection': False}. Best is trial 58 with value: 0.08637900504762047.
[I 2025-11-03 15:18:30,588] Trial 87 finished with value: 0.05820472659550743 and parameters: {'model_type': 'graphsage', 'hidden_dims': '[256, 128, 64]', 'dropout': 0.510375672812715, 'batch_norm': True, 'lr': 0.00034293795749093195, 'weight_decay': 8.22313735308298e-07, 'epochs': 103, 'loss': 'mse', 'optimizer': 'adam', 'graph_mode': 'cutoff', 'cutoff': 0.34722856583642125, 'grm_norm': 'none', 'self_loops': False, 'use_snp_selection': False}. Best is trial 58 with value: 0.08637900504762047.
[I 2025-11-03 15:18:33,435] Trial 88 finished with value: 0.05671893520760704 and parameters: {'model_type': 'graphsage', 'hidden_dims': '[512, 256]', 'dropout': 0.4338697927750367, 'batch_norm': True, 'lr': 0.0004443193928479483, 'weight_decay': 2.4336362293853923e-06, 'epochs': 120, 'loss': 'mse', 'optimizer': 'adam', 'graph_mode': 'cutoff', 'cutoff': 0.4953334948006115, 'grm_norm': 'none', 'self_loops': False, 'use_snp_selection': False}. Best is trial 58 with value: 0.08637900504762047.
[I 2025-11-03 15:18:36,929] Trial 89 finished with value: 0.04550634221378739 and parameters: {'model_type': 'graphsage', 'hidden_dims': '[512, 64]', 'dropout': 0.5250414717004885, 'batch_norm': True, 'lr': 0.00018965539043709986, 'weight_decay': 5.928059690719751e-06, 'epochs': 178, 'loss': 'mse', 'optimizer': 'adam', 'graph_mode': 'cutoff', 'cutoff': 0.20260191965376306, 'grm_norm': 'none', 'self_loops': False, 'use_snp_selection': False}. Best is trial 58 with value: 0.08637900504762047.
[I 2025-11-03 15:18:38,388] Trial 90 finished with value: 0.019762074504483626 and parameters: {'model_type': 'graphsage', 'hidden_dims': '[128, 64]', 'dropout': 0.5628748340002461, 'batch_norm': False, 'lr': 9.020245328201044e-06, 'weight_decay': 8.160609970203783e-06, 'epochs': 157, 'loss': 'mse', 'optimizer': 'adam', 'graph_mode': 'cutoff', 'cutoff': 0.6180875936981903, 'grm_norm': 'cosine_then_gcn', 'self_loops': False, 'use_snp_selection': True, 'num_snps': 3647}. Best is trial 58 with value: 0.08637900504762047.
[I 2025-11-03 15:18:41,532] Trial 91 finished with value: 0.04929223291186114 and parameters: {'model_type': 'graphsage', 'hidden_dims': '[512, 256]', 'dropout': 0.5840634869980645, 'batch_norm': True, 'lr': 0.00016220478509313384, 'weight_decay': 4.785361824520883e-07, 'epochs': 141, 'loss': 'mse', 'optimizer': 'adam', 'graph_mode': 'knn', 'source': 'grm', 'knn_k': 6, 'weighted_edges': False, 'symmetrize_mode': 'mutual', 'use_snp_selection': False}. Best is trial 58 with value: 0.08637900504762047.
[I 2025-11-03 15:18:44,591] Trial 92 finished with value: 0.04791700778483065 and parameters: {'model_type': 'graphsage', 'hidden_dims': '[512, 256]', 'dropout': 0.5459105755030359, 'batch_norm': True, 'lr': 0.0002479233161419414, 'weight_decay': 3.4779325046627253e-07, 'epochs': 128, 'loss': 'mse', 'optimizer': 'adam', 'graph_mode': 'cutoff', 'cutoff': 0.28173444138952963, 'grm_norm': 'cosine', 'self_loops': False, 'use_snp_selection': False}. Best is trial 58 with value: 0.08637900504762047.
[I 2025-11-03 15:18:48,313] Trial 93 finished with value: 0.056905220687719735 and parameters: {'model_type': 'graphsage', 'hidden_dims': '[512, 256]', 'dropout': 0.4813091217789842, 'batch_norm': True, 'lr': 0.00019413767373752512, 'weight_decay': 2.5173327609712044e-07, 'epochs': 231, 'loss': 'mse', 'optimizer': 'adam', 'graph_mode': 'knn', 'source': 'grm', 'knn_k': 3, 'weighted_edges': False, 'symmetrize_mode': 'mutual', 'use_snp_selection': False}. Best is trial 58 with value: 0.08637900504762047.
[I 2025-11-03 15:18:51,045] Trial 94 finished with value: 0.030650959742007947 and parameters: {'model_type': 'graphsage', 'hidden_dims': '[512, 256]', 'dropout': 0.36516145178280496, 'batch_norm': True, 'lr': 0.00010770778069047898, 'weight_decay': 3.168347596989738e-06, 'epochs': 94, 'loss': 'mse', 'optimizer': 'adam', 'graph_mode': 'knn', 'source': 'grm', 'knn_k': 5, 'weighted_edges': False, 'symmetrize_mode': 'mutual', 'use_snp_selection': False}. Best is trial 58 with value: 0.08637900504762047.
[I 2025-11-03 15:18:54,372] Trial 95 finished with value: 0.046920260784589614 and parameters: {'model_type': 'graphsage', 'hidden_dims': '[512, 128]', 'dropout': 0.4130422730487494, 'batch_norm': True, 'lr': 0.0002911925036678637, 'weight_decay': 1.628416441215965e-07, 'epochs': 172, 'loss': 'mse', 'optimizer': 'adam', 'graph_mode': 'knn', 'source': 'grm', 'knn_k': 4, 'weighted_edges': False, 'symmetrize_mode': 'mutual', 'use_snp_selection': False}. Best is trial 58 with value: 0.08637900504762047.
[I 2025-11-03 15:18:56,581] Trial 96 finished with value: 0.049094748708614716 and parameters: {'model_type': 'graphsage', 'hidden_dims': '[256, 128, 64]', 'dropout': 0.5179105664508339, 'batch_norm': True, 'lr': 7.759203667858234e-05, 'weight_decay': 1.1483283358687962e-06, 'epochs': 156, 'loss': 'mse', 'optimizer': 'adam', 'graph_mode': 'knn', 'source': 'grm', 'knn_k': 2, 'weighted_edges': False, 'symmetrize_mode': 'mutual', 'use_snp_selection': False}. Best is trial 58 with value: 0.08637900504762047.
[I 2025-11-03 15:18:59,760] Trial 97 finished with value: 0.05002510300871954 and parameters: {'model_type': 'graphsage', 'hidden_dims': '[512, 256]', 'dropout': 0.5751817178258657, 'batch_norm': True, 'lr': 3.593104950733471e-05, 'weight_decay': 5.797085112342497e-07, 'epochs': 164, 'loss': 'mse', 'optimizer': 'adam', 'graph_mode': 'cutoff', 'cutoff': 0.7864264008407802, 'grm_norm': 'gcn', 'self_loops': False, 'use_snp_selection': False}. Best is trial 58 with value: 0.08637900504762047.
[I 2025-11-03 15:19:03,018] Trial 98 finished with value: 0.035373454457421065 and parameters: {'model_type': 'graphsage', 'hidden_dims': '[512, 256]', 'dropout': 0.5322790322175507, 'batch_norm': True, 'lr': 0.00015701415795553954, 'weight_decay': 7.294414958812046e-07, 'epochs': 151, 'loss': 'mse', 'optimizer': 'adam', 'graph_mode': 'knn', 'source': 'grm', 'knn_k': 7, 'weighted_edges': True, 'symmetrize_mode': 'mutual', 'use_snp_selection': False}. Best is trial 58 with value: 0.08637900504762047.
[I 2025-11-03 15:19:04,627] Trial 99 finished with value: 0.0501306002416564 and parameters: {'model_type': 'graphsage', 'hidden_dims': '[128, 64]', 'dropout': 0.5497988258204501, 'batch_norm': True, 'lr': 0.0008561489603801716, 'weight_decay': 1.496393599162041e-05, 'epochs': 113, 'loss': 'mse', 'optimizer': 'adam', 'graph_mode': 'knn', 'source': 'grm', 'knn_k': 4, 'weighted_edges': False, 'symmetrize_mode': 'mutual', 'use_snp_selection': False}. Best is trial 58 with value: 0.08637900504762047.
[I 2025-11-03 15:19:07,708] Trial 100 finished with value: 0.06097183381535108 and parameters: {'model_type': 'graphsage', 'hidden_dims': '[512, 128]', 'dropout': 0.10895244165949358, 'batch_norm': True, 'lr': 6.084921222221665e-05, 'weight_decay': 4.6166027294151386e-07, 'epochs': 138, 'loss': 'mse', 'optimizer': 'adam', 'graph_mode': 'knn', 'source': 'grm', 'knn_k': 3, 'weighted_edges': False, 'symmetrize_mode': 'mutual', 'use_snp_selection': False}. Best is trial 58 with value: 0.08637900504762047.
[I 2025-11-03 15:19:10,787] Trial 101 finished with value: 0.04267286019125052 and parameters: {'model_type': 'graphsage', 'hidden_dims': '[512, 128]', 'dropout': 0.14640912683910112, 'batch_norm': True, 'lr': 6.107607429278767e-05, 'weight_decay': 1.3772409159667962e-06, 'epochs': 140, 'loss': 'mse', 'optimizer': 'adam', 'graph_mode': 'knn', 'source': 'grm', 'knn_k': 3, 'weighted_edges': False, 'symmetrize_mode': 'mutual', 'use_snp_selection': False}. Best is trial 58 with value: 0.08637900504762047.
[I 2025-11-03 15:19:13,673] Trial 102 finished with value: 0.04287745201096914 and parameters: {'model_type': 'graphsage', 'hidden_dims': '[512, 128]', 'dropout': 0.20982264081951163, 'batch_norm': True, 'lr': 5.152753168533362e-05, 'weight_decay': 4.6842877292631694e-07, 'epochs': 121, 'loss': 'mse', 'optimizer': 'adam', 'graph_mode': 'knn', 'source': 'grm', 'knn_k': 2, 'weighted_edges': False, 'symmetrize_mode': 'mutual', 'use_snp_selection': False}. Best is trial 58 with value: 0.08637900504762047.
[I 2025-11-03 15:19:16,816] Trial 103 finished with value: 0.035415518899080484 and parameters: {'model_type': 'graphsage', 'hidden_dims': '[512, 128]', 'dropout': 0.10245990877440582, 'batch_norm': True, 'lr': 3.714897641889505e-05, 'weight_decay': 3.5902328465210933e-07, 'epochs': 147, 'loss': 'mse', 'optimizer': 'adam', 'graph_mode': 'knn', 'source': 'grm', 'knn_k': 3, 'weighted_edges': False, 'symmetrize_mode': 'mutual', 'use_snp_selection': False}. Best is trial 58 with value: 0.08637900504762047.
[I 2025-11-03 15:19:19,760] Trial 104 finished with value: 0.0733668117706761 and parameters: {'model_type': 'graphsage', 'hidden_dims': '[512, 128]', 'dropout': 0.5900182329713599, 'batch_norm': True, 'lr': 8.739559786122129e-05, 'weight_decay': 2.2769640584885483e-07, 'epochs': 126, 'loss': 'mse', 'optimizer': 'adam', 'graph_mode': 'knn', 'source': 'grm', 'knn_k': 3, 'weighted_edges': False, 'symmetrize_mode': 'mutual', 'use_snp_selection': False}. Best is trial 58 with value: 0.08637900504762047.
[I 2025-11-03 15:19:22,795] Trial 105 finished with value: 0.03241568753425317 and parameters: {'model_type': 'graphsage', 'hidden_dims': '[512, 128]', 'dropout': 0.5895953635057077, 'batch_norm': True, 'lr': 6.784614365555132e-05, 'weight_decay': 1.221823773456676e-07, 'epochs': 137, 'loss': 'mae', 'optimizer': 'adam', 'graph_mode': 'knn', 'source': 'grm', 'knn_k': 2, 'weighted_edges': False, 'symmetrize_mode': 'mutual', 'use_snp_selection': False}. Best is trial 58 with value: 0.08637900504762047.
[I 2025-11-03 15:19:25,776] Trial 106 finished with value: 0.013610172479448339 and parameters: {'model_type': 'graphsage', 'hidden_dims': '[512, 128]', 'dropout': 0.5754593210429801, 'batch_norm': True, 'lr': 4.479058171517513e-05, 'weight_decay': 2.7573507387468934e-07, 'epochs': 129, 'loss': 'mse', 'optimizer': 'adam', 'graph_mode': 'knn', 'source': 'grm', 'knn_k': 2, 'weighted_edges': False, 'symmetrize_mode': 'mutual', 'use_snp_selection': False}. Best is trial 58 with value: 0.08637900504762047.
[I 2025-11-03 15:19:28,400] Trial 107 finished with value: 0.031279598825944 and parameters: {'model_type': 'graphsage', 'hidden_dims': '[512, 128]', 'dropout': 0.5614078426978808, 'batch_norm': True, 'lr': 0.0003319017397584852, 'weight_decay': 2.212051581994414e-07, 'epochs': 78, 'loss': 'mse', 'optimizer': 'adam', 'graph_mode': 'knn', 'source': 'grm', 'knn_k': 3, 'weighted_edges': False, 'symmetrize_mode': 'mutual', 'use_snp_selection': False}. Best is trial 58 with value: 0.08637900504762047.
[I 2025-11-03 15:19:30,801] Trial 108 finished with value: 0.05385520661528385 and parameters: {'model_type': 'graphsage', 'hidden_dims': '[512, 128]', 'dropout': 0.5481029080510089, 'batch_norm': True, 'lr': 0.00012407834635875202, 'weight_decay': 8.2165938810377e-06, 'epochs': 45, 'loss': 'mse', 'optimizer': 'adam', 'graph_mode': 'knn', 'source': 'grm', 'knn_k': 3, 'weighted_edges': True, 'symmetrize_mode': 'union', 'use_snp_selection': False}. Best is trial 58 with value: 0.08637900504762047.
[I 2025-11-03 15:19:32,957] Trial 109 finished with value: -0.007755519441192359 and parameters: {'model_type': 'graphsage', 'hidden_dims': '[256, 128, 64]', 'dropout': 0.5329991332446087, 'batch_norm': False, 'lr': 8.28571875713722e-05, 'weight_decay': 4.878336639837956e-06, 'epochs': 98, 'loss': 'mse', 'optimizer': 'adam', 'graph_mode': 'knn', 'source': 'grm', 'knn_k': 8, 'weighted_edges': False, 'symmetrize_mode': 'mutual', 'use_snp_selection': True, 'num_snps': 23428}. Best is trial 58 with value: 0.08637900504762047.
[I 2025-11-03 15:19:37,380] Trial 110 finished with value: 0.03998653840181197 and parameters: {'model_type': 'graphsage', 'hidden_dims': '[512, 128]', 'dropout': 0.5900613618700106, 'batch_norm': True, 'lr': 0.0006566793818304016, 'weight_decay': 1.9608495048318682e-07, 'epochs': 318, 'loss': 'mse', 'optimizer': 'adam', 'graph_mode': 'cutoff', 'cutoff': 0.3972808971087333, 'grm_norm': 'none', 'self_loops': False, 'use_snp_selection': False}. Best is trial 58 with value: 0.08637900504762047.
[I 2025-11-03 15:19:40,641] Trial 111 finished with value: 0.033717847944006035 and parameters: {'model_type': 'graphsage', 'hidden_dims': '[512, 256]', 'dropout': 0.2778489767041388, 'batch_norm': True, 'lr': 0.00010352906110375837, 'weight_decay': 4.723244450088268e-07, 'epochs': 160, 'loss': 'mse', 'optimizer': 'adam', 'graph_mode': 'knn', 'source': 'grm', 'knn_k': 4, 'weighted_edges': False, 'symmetrize_mode': 'mutual', 'use_snp_selection': False}. Best is trial 58 with value: 0.08637900504762047.
[I 2025-11-03 15:19:44,262] Trial 112 finished with value: 0.07283531341022575 and parameters: {'model_type': 'graphsage', 'hidden_dims': '[512, 256]', 'dropout': 0.12372165355111903, 'batch_norm': True, 'lr': 5.190818019205874e-05, 'weight_decay': 8.306213619870592e-07, 'epochs': 217, 'loss': 'mse', 'optimizer': 'adam', 'graph_mode': 'knn', 'source': 'grm', 'knn_k': 3, 'weighted_edges': False, 'symmetrize_mode': 'mutual', 'use_snp_selection': False}. Best is trial 58 with value: 0.08637900504762047.
[I 2025-11-03 15:19:46,222] Trial 113 finished with value: 0.0600433263138859 and parameters: {'model_type': 'graphsage', 'hidden_dims': '[128, 64]', 'dropout': 0.5018806792375984, 'batch_norm': True, 'lr': 0.000407259020138641, 'weight_decay': 6.505676790544288e-07, 'epochs': 214, 'loss': 'mse', 'optimizer': 'adam', 'graph_mode': 'knn', 'source': 'grm', 'knn_k': 3, 'weighted_edges': False, 'symmetrize_mode': 'mutual', 'use_snp_selection': False}. Best is trial 58 with value: 0.08637900504762047.
[I 2025-11-03 15:19:49,128] Trial 114 finished with value: 0.04335733872975259 and parameters: {'model_type': 'graphsage', 'hidden_dims': '[512, 256]', 'dropout': 0.12364674106088641, 'batch_norm': True, 'lr': 2.282046183662452e-05, 'weight_decay': 8.589138075566708e-07, 'epochs': 117, 'loss': 'mse', 'optimizer': 'adam', 'graph_mode': 'knn', 'source': 'grm', 'knn_k': 2, 'weighted_edges': False, 'symmetrize_mode': 'mutual', 'use_snp_selection': False}. Best is trial 58 with value: 0.08637900504762047.
[I 2025-11-03 15:19:52,112] Trial 115 finished with value: 0.045579297664310695 and parameters: {'model_type': 'graphsage', 'hidden_dims': '[512, 128]', 'dropout': 0.11819079678974483, 'batch_norm': True, 'lr': 0.0002096025543091557, 'weight_decay': 2.1140447290383494e-06, 'epochs': 126, 'loss': 'mse', 'optimizer': 'adam', 'graph_mode': 'knn', 'source': 'grm', 'knn_k': 3, 'weighted_edges': False, 'symmetrize_mode': 'mutual', 'use_snp_selection': False}. Best is trial 58 with value: 0.08637900504762047.
[I 2025-11-03 15:19:55,438] Trial 116 finished with value: 0.061384789188597834 and parameters: {'model_type': 'graphsage', 'hidden_dims': '[512, 64]', 'dropout': 0.1449454221503525, 'batch_norm': True, 'lr': 6.654380984415184e-05, 'weight_decay': 1.566926072930895e-06, 'epochs': 181, 'loss': 'mse', 'optimizer': 'adam', 'graph_mode': 'knn', 'source': 'grm', 'knn_k': 1, 'weighted_edges': False, 'symmetrize_mode': 'mutual', 'use_snp_selection': False}. Best is trial 58 with value: 0.08637900504762047.
[I 2025-11-03 15:19:58,833] Trial 117 finished with value: 0.07133049766761064 and parameters: {'model_type': 'graphsage', 'hidden_dims': '[512, 64]', 'dropout': 0.1504720307867176, 'batch_norm': True, 'lr': 0.00026031058135117134, 'weight_decay': 1.6019465802551636e-06, 'epochs': 191, 'loss': 'mse', 'optimizer': 'adam', 'graph_mode': 'knn', 'source': 'grm', 'knn_k': 1, 'weighted_edges': False, 'symmetrize_mode': 'union', 'use_snp_selection': False}. Best is trial 58 with value: 0.08637900504762047.
