[I 2025-11-03 13:15:10,209] Trial 147 finished with value: 0.10585279143740473 and parameters: {'model_type': 'graphsage', 'hidden_dims': '[512, 128]', 'dropout': 0.18023610595344625, 'batch_norm': True, 'lr': 0.0004843808529330322, 'weight_decay': 1.433021117342274e-07, 'epochs': 181, 'loss': 'mse', 'optimizer': 'adam', 'graph_mode': 'cutoff', 'cutoff': 0.25879341093019614, 'grm_norm': 'cosine', 'self_loops': True, 'use_snp_selection': False}. Best is trial 72 with value: 0.1443334714521971.
[I 2025-11-03 13:15:14,811] Trial 148 finished with value: 0.11225673224121323 and parameters: {'model_type': 'graphsage', 'hidden_dims': '[512, 64]', 'dropout': 0.12337891765363443, 'batch_norm': True, 'lr': 3.454310493074656e-05, 'weight_decay': 6.012079476210511e-07, 'epochs': 331, 'loss': 'mse', 'optimizer': 'adam', 'graph_mode': 'cutoff', 'cutoff': 0.7468818124451472, 'grm_norm': 'cosine', 'self_loops': True, 'use_snp_selection': False}. Best is trial 72 with value: 0.1443334714521971.
[I 2025-11-03 13:15:19,058] Trial 149 finished with value: 0.1096214534362638 and parameters: {'model_type': 'graphsage', 'hidden_dims': '[512, 256]', 'dropout': 0.10086326459189962, 'batch_norm': False, 'lr': 8.089625427493961e-05, 'weight_decay': 1.8745371457510985e-07, 'epochs': 310, 'loss': 'mse', 'optimizer': 'adam', 'graph_mode': 'knn', 'source': 'grm', 'knn_k': 7, 'weighted_edges': True, 'symmetrize_mode': 'mutual', 'use_snp_selection': True, 'num_snps': 36015}. Best is trial 72 with value: 0.1443334714521971.
[I 2025-11-03 13:15:21,546] Trial 0 finished with value: -0.01915310536080877 and parameters: {'model_type': 'graphsage', 'hidden_dims': '[128, 64]', 'dropout': 0.199031432379812, 'batch_norm': True, 'lr': 1.8408544111075837e-06, 'weight_decay': 5.5136510071208614e-05, 'epochs': 336, 'loss': 'mae', 'optimizer': 'adam', 'graph_mode': 'knn', 'source': 'grm', 'knn_k': 8, 'weighted_edges': True, 'symmetrize_mode': 'mutual', 'use_snp_selection': False}. Best is trial 0 with value: -0.01915310536080877.
[I 2025-11-03 13:15:23,069] Trial 1 finished with value: 0.0757827112224283 and parameters: {'model_type': 'graphsage', 'hidden_dims': '[128, 64]', 'dropout': 0.40051947670227217, 'batch_norm': True, 'lr': 0.0005320428882732732, 'weight_decay': 1.89210117736594e-06, 'epochs': 68, 'loss': 'mse', 'optimizer': 'adam', 'graph_mode': 'knn', 'source': 'grm', 'knn_k': 7, 'weighted_edges': True, 'symmetrize_mode': 'union', 'use_snp_selection': False}. Best is trial 1 with value: 0.0757827112224283.
[I 2025-11-03 13:15:25,597] Trial 2 finished with value: 0.04712215037775297 and parameters: {'model_type': 'graphsage', 'hidden_dims': '[256, 128]', 'dropout': 0.5105528289184642, 'batch_norm': False, 'lr': 0.0006804279372404962, 'weight_decay': 0.0008922815224257085, 'epochs': 181, 'loss': 'mse', 'optimizer': 'adam', 'graph_mode': 'cutoff', 'cutoff': 0.5741905641612706, 'grm_norm': 'gcn', 'self_loops': False, 'use_snp_selection': True, 'num_snps': 26910}. Best is trial 1 with value: 0.0757827112224283.
[I 2025-11-03 13:15:28,315] Trial 3 finished with value: 0.04828236014040908 and parameters: {'model_type': 'graphsage', 'hidden_dims': '[256, 128, 64]', 'dropout': 0.5390483213624292, 'batch_norm': False, 'lr': 3.4705625989073525e-05, 'weight_decay': 2.4623319020131338e-05, 'epochs': 121, 'loss': 'mse', 'optimizer': 'adam', 'graph_mode': 'knn', 'source': 'grm', 'knn_k': 6, 'weighted_edges': False, 'symmetrize_mode': 'mutual', 'use_snp_selection': True, 'num_snps': 30713}. Best is trial 1 with value: 0.0757827112224283.
[I 2025-11-03 13:15:30,997] Trial 4 finished with value: 0.07834738256079439 and parameters: {'model_type': 'graphsage', 'hidden_dims': '[128, 64]', 'dropout': 0.13404863676897502, 'batch_norm': False, 'lr': 0.0001431556295367288, 'weight_decay': 2.2084517750726675e-05, 'epochs': 51, 'loss': 'mae', 'optimizer': 'adam', 'graph_mode': 'cutoff', 'cutoff': 0.6714268476993044, 'grm_norm': 'none', 'self_loops': False, 'use_snp_selection': True, 'num_snps': 45645}. Best is trial 4 with value: 0.07834738256079439.
[I 2025-11-03 13:15:34,214] Trial 5 finished with value: 0.06957053579575985 and parameters: {'model_type': 'graphsage', 'hidden_dims': '[256, 128]', 'dropout': 0.42253606323412096, 'batch_norm': False, 'lr': 4.238630400638805e-05, 'weight_decay': 8.074086040046576e-07, 'epochs': 158, 'loss': 'mae', 'optimizer': 'adam', 'graph_mode': 'knn', 'source': 'grm', 'knn_k': 1, 'weighted_edges': False, 'symmetrize_mode': 'mutual', 'use_snp_selection': True, 'num_snps': 43113}. Best is trial 4 with value: 0.07834738256079439.
[I 2025-11-03 13:15:38,122] Trial 6 finished with value: 0.0805103642203296 and parameters: {'model_type': 'graphsage', 'hidden_dims': '[512, 256]', 'dropout': 0.3534893146320237, 'batch_norm': True, 'lr': 0.000251307964226932, 'weight_decay': 1.821819791794022e-05, 'epochs': 223, 'loss': 'mae', 'optimizer': 'adam', 'graph_mode': 'knn', 'source': 'grm', 'knn_k': 1, 'weighted_edges': True, 'symmetrize_mode': 'mutual', 'use_snp_selection': False}. Best is trial 6 with value: 0.0805103642203296.
[I 2025-11-03 13:15:41,648] Trial 7 finished with value: 0.08103105115590939 and parameters: {'model_type': 'graphsage', 'hidden_dims': '[512, 256]', 'dropout': 0.1105825955860775, 'batch_norm': True, 'lr': 2.374338412754043e-05, 'weight_decay': 1.1284721123340274e-05, 'epochs': 190, 'loss': 'mse', 'optimizer': 'adam', 'graph_mode': 'cutoff', 'cutoff': 0.719872204109604, 'grm_norm': 'gcn', 'self_loops': False, 'use_snp_selection': False}. Best is trial 7 with value: 0.08103105115590939.
[I 2025-11-03 13:15:44,695] Trial 8 finished with value: 0.08022950419272144 and parameters: {'model_type': 'graphsage', 'hidden_dims': '[512, 128]', 'dropout': 0.5066580418354021, 'batch_norm': True, 'lr': 0.00039213678276659976, 'weight_decay': 3.43655320802934e-06, 'epochs': 120, 'loss': 'mse', 'optimizer': 'adam', 'graph_mode': 'cutoff', 'cutoff': 0.34923059576505366, 'grm_norm': 'cosine', 'self_loops': True, 'use_snp_selection': False}. Best is trial 7 with value: 0.08103105115590939.
[I 2025-11-03 13:15:46,764] Trial 9 finished with value: 0.03277568636913214 and parameters: {'model_type': 'graphsage', 'hidden_dims': '[512, 256]', 'dropout': 0.301734920240333, 'batch_norm': False, 'lr': 6.650961854953448e-06, 'weight_decay': 6.861575656590315e-05, 'epochs': 150, 'loss': 'mae', 'optimizer': 'adam', 'graph_mode': 'cutoff', 'cutoff': 0.2857569870061939, 'grm_norm': 'cosine_then_gcn', 'self_loops': False, 'use_snp_selection': True, 'num_snps': 12722}. Best is trial 7 with value: 0.08103105115590939.
[I 2025-11-03 13:15:51,035] Trial 10 finished with value: 0.05279541990406351 and parameters: {'model_type': 'graphsage', 'hidden_dims': '[512, 64]', 'dropout': 0.2491228540815774, 'batch_norm': True, 'lr': 1.080428984628536e-05, 'weight_decay': 1.6060239611529646e-07, 'epochs': 275, 'loss': 'mse', 'optimizer': 'adam', 'graph_mode': 'cutoff', 'cutoff': 0.8740100033033124, 'grm_norm': 'gcn', 'self_loops': True, 'use_snp_selection': False}. Best is trial 7 with value: 0.08103105115590939.
[I 2025-11-03 13:15:55,150] Trial 11 finished with value: 0.08753245117947733 and parameters: {'model_type': 'graphsage', 'hidden_dims': '[512, 256]', 'dropout': 0.33158647695857435, 'batch_norm': True, 'lr': 0.0001113083271410056, 'weight_decay': 0.00028491289627808323, 'epochs': 242, 'loss': 'mae', 'optimizer': 'adam', 'graph_mode': 'knn', 'source': 'grm', 'knn_k': 1, 'weighted_edges': True, 'symmetrize_mode': 'union', 'use_snp_selection': False}. Best is trial 11 with value: 0.08753245117947733.
[I 2025-11-03 13:15:59,374] Trial 12 finished with value: 0.07694606510181104 and parameters: {'model_type': 'graphsage', 'hidden_dims': '[512, 256]', 'dropout': 0.11246889769773032, 'batch_norm': True, 'lr': 8.485681919849544e-05, 'weight_decay': 0.0004866193703411808, 'epochs': 237, 'loss': 'mse', 'optimizer': 'adam', 'graph_mode': 'knn', 'source': 'grm', 'knn_k': 3, 'weighted_edges': True, 'symmetrize_mode': 'union', 'use_snp_selection': False}. Best is trial 11 with value: 0.08753245117947733.
[I 2025-11-03 13:16:03,718] Trial 13 finished with value: 0.043796571050568445 and parameters: {'model_type': 'graphsage', 'hidden_dims': '[512, 256]', 'dropout': 0.22695662818447931, 'batch_norm': True, 'lr': 1.1123920200408949e-05, 'weight_decay': 0.0001548242747764141, 'epochs': 290, 'loss': 'mae', 'optimizer': 'adam', 'graph_mode': 'cutoff', 'cutoff': 0.8274420001613257, 'grm_norm': 'gcn', 'self_loops': False, 'use_snp_selection': False}. Best is trial 11 with value: 0.08753245117947733.
[I 2025-11-03 13:16:07,868] Trial 14 finished with value: 0.09085981496376223 and parameters: {'model_type': 'graphsage', 'hidden_dims': '[512, 256]', 'dropout': 0.30235973072802214, 'batch_norm': True, 'lr': 8.773526967482465e-05, 'weight_decay': 0.00022640784955374533, 'epochs': 223, 'loss': 'mae', 'optimizer': 'adam', 'graph_mode': 'knn', 'source': 'grm', 'knn_k': 4, 'weighted_edges': True, 'symmetrize_mode': 'union', 'use_snp_selection': False}. Best is trial 14 with value: 0.09085981496376223.
[I 2025-11-03 13:16:12,244] Trial 15 finished with value: 0.09127804037417447 and parameters: {'model_type': 'graphsage', 'hidden_dims': '[512, 64]', 'dropout': 0.3167436256258755, 'batch_norm': True, 'lr': 8.616128066037782e-05, 'weight_decay': 0.0002367396080979669, 'epochs': 254, 'loss': 'mae', 'optimizer': 'adam', 'graph_mode': 'knn', 'source': 'grm', 'knn_k': 4, 'weighted_edges': True, 'symmetrize_mode': 'union', 'use_snp_selection': False}. Best is trial 15 with value: 0.09127804037417447.
[I 2025-11-03 13:16:17,245] Trial 16 finished with value: 0.07640083689540199 and parameters: {'model_type': 'graphsage', 'hidden_dims': '[512, 64]', 'dropout': 0.28687406115982694, 'batch_norm': True, 'lr': 6.792619621178361e-05, 'weight_decay': 0.00010830873407218846, 'epochs': 324, 'loss': 'mae', 'optimizer': 'adam', 'graph_mode': 'knn', 'source': 'grm', 'knn_k': 4, 'weighted_edges': True, 'symmetrize_mode': 'union', 'use_snp_selection': False}. Best is trial 15 with value: 0.09127804037417447.
[I 2025-11-03 13:16:21,847] Trial 17 finished with value: 0.06810347412345001 and parameters: {'model_type': 'graphsage', 'hidden_dims': '[512, 64]', 'dropout': 0.4337768631587977, 'batch_norm': True, 'lr': 0.0002028341596053361, 'weight_decay': 0.0008769949239154745, 'epochs': 279, 'loss': 'mae', 'optimizer': 'adam', 'graph_mode': 'knn', 'source': 'grm', 'knn_k': 4, 'weighted_edges': True, 'symmetrize_mode': 'union', 'use_snp_selection': False}. Best is trial 15 with value: 0.09127804037417447.
[I 2025-11-03 13:16:24,954] Trial 18 finished with value: 0.08369922535867397 and parameters: {'model_type': 'graphsage', 'hidden_dims': '[256, 128, 64]', 'dropout': 0.3657326846668192, 'batch_norm': True, 'lr': 3.2431520417433524e-06, 'weight_decay': 0.00025095611678079775, 'epochs': 217, 'loss': 'mae', 'optimizer': 'adam', 'graph_mode': 'knn', 'source': 'grm', 'knn_k': 10, 'weighted_edges': False, 'symmetrize_mode': 'union', 'use_snp_selection': False}. Best is trial 15 with value: 0.09127804037417447.
[I 2025-11-03 13:16:29,786] Trial 19 finished with value: 0.052217611288084526 and parameters: {'model_type': 'graphsage', 'hidden_dims': '[512, 128]', 'dropout': 0.17219191310081194, 'batch_norm': True, 'lr': 2.020131515063574e-05, 'weight_decay': 5.7348827039208624e-06, 'epochs': 302, 'loss': 'mae', 'optimizer': 'adam', 'graph_mode': 'knn', 'source': 'grm', 'knn_k': 4, 'weighted_edges': True, 'symmetrize_mode': 'union', 'use_snp_selection': False}. Best is trial 15 with value: 0.09127804037417447.
[I 2025-11-03 13:16:34,163] Trial 20 finished with value: 0.0837569600601973 and parameters: {'model_type': 'graphsage', 'hidden_dims': '[512, 64]', 'dropout': 0.27752151234994293, 'batch_norm': True, 'lr': 4.690554111276529e-05, 'weight_decay': 4.4497951616588926e-05, 'epochs': 262, 'loss': 'mae', 'optimizer': 'adam', 'graph_mode': 'knn', 'source': 'grm', 'knn_k': 3, 'weighted_edges': True, 'symmetrize_mode': 'union', 'use_snp_selection': False}. Best is trial 15 with value: 0.09127804037417447.
[I 2025-11-03 13:16:38,354] Trial 21 finished with value: 0.08846707971982301 and parameters: {'model_type': 'graphsage', 'hidden_dims': '[512, 256]', 'dropout': 0.2997694066028005, 'batch_norm': True, 'lr': 0.00010932856842099272, 'weight_decay': 0.00028063141993433523, 'epochs': 248, 'loss': 'mae', 'optimizer': 'adam', 'graph_mode': 'knn', 'source': 'grm', 'knn_k': 2, 'weighted_edges': True, 'symmetrize_mode': 'union', 'use_snp_selection': False}. Best is trial 15 with value: 0.09127804037417447.
[I 2025-11-03 13:16:42,691] Trial 22 finished with value: 0.09749254593739673 and parameters: {'model_type': 'graphsage', 'hidden_dims': '[512, 256]', 'dropout': 0.3228818201665849, 'batch_norm': True, 'lr': 0.0009936031077191177, 'weight_decay': 0.00030474466392182016, 'epochs': 252, 'loss': 'mae', 'optimizer': 'adam', 'graph_mode': 'knn', 'source': 'grm', 'knn_k': 3, 'weighted_edges': True, 'symmetrize_mode': 'union', 'use_snp_selection': False}. Best is trial 22 with value: 0.09749254593739673.
[I 2025-11-03 13:16:46,698] Trial 23 finished with value: 0.07784401177416347 and parameters: {'model_type': 'graphsage', 'hidden_dims': '[512, 64]', 'dropout': 0.46321857460185734, 'batch_norm': True, 'lr': 0.00030476934880739923, 'weight_decay': 0.0001366858951246908, 'epochs': 204, 'loss': 'mae', 'optimizer': 'adam', 'graph_mode': 'knn', 'source': 'grm', 'knn_k': 5, 'weighted_edges': True, 'symmetrize_mode': 'union', 'use_snp_selection': False}. Best is trial 22 with value: 0.09749254593739673.
[I 2025-11-03 13:16:51,733] Trial 24 finished with value: 0.08456596852391574 and parameters: {'model_type': 'graphsage', 'hidden_dims': '[512, 256]', 'dropout': 0.37567915018881964, 'batch_norm': True, 'lr': 0.0007772613114012631, 'weight_decay': 0.0005681646771189613, 'epochs': 316, 'loss': 'mae', 'optimizer': 'adam', 'graph_mode': 'knn', 'source': 'grm', 'knn_k': 5, 'weighted_edges': True, 'symmetrize_mode': 'union', 'use_snp_selection': False}. Best is trial 22 with value: 0.09749254593739673.
[I 2025-11-03 13:16:54,600] Trial 25 finished with value: 0.07771717475285324 and parameters: {'model_type': 'graphsage', 'hidden_dims': '[256, 128, 64]', 'dropout': 0.32423354321965975, 'batch_norm': True, 'lr': 0.0009781454116176084, 'weight_decay': 0.00037933972666993773, 'epochs': 254, 'loss': 'mae', 'optimizer': 'adam', 'graph_mode': 'knn', 'source': 'grm', 'knn_k': 3, 'weighted_edges': False, 'symmetrize_mode': 'union', 'use_snp_selection': False}. Best is trial 22 with value: 0.09749254593739673.
[I 2025-11-03 13:17:00,420] Trial 26 finished with value: 0.0712543658528353 and parameters: {'model_type': 'graphsage', 'hidden_dims': '[512, 128]', 'dropout': 0.5896027440730659, 'batch_norm': False, 'lr': 0.00017193619138183643, 'weight_decay': 0.00010318849333877265, 'epochs': 218, 'loss': 'mae', 'optimizer': 'adam', 'graph_mode': 'knn', 'source': 'grm', 'knn_k': 6, 'weighted_edges': True, 'symmetrize_mode': 'union', 'use_snp_selection': True, 'num_snps': 59005}. Best is trial 22 with value: 0.09749254593739673.
[I 2025-11-03 13:17:02,737] Trial 27 finished with value: 0.0734591964011295 and parameters: {'model_type': 'graphsage', 'hidden_dims': '[256, 128]', 'dropout': 0.2564261754514148, 'batch_norm': True, 'lr': 0.0004496253300724845, 'weight_decay': 0.00018942212895157963, 'epochs': 164, 'loss': 'mae', 'optimizer': 'adam', 'graph_mode': 'knn', 'source': 'grm', 'knn_k': 2, 'weighted_edges': True, 'symmetrize_mode': 'union', 'use_snp_selection': False}. Best is trial 22 with value: 0.09749254593739673.
[I 2025-11-03 13:17:07,212] Trial 28 finished with value: 0.029547805907514737 and parameters: {'model_type': 'graphsage', 'hidden_dims': '[512, 64]', 'dropout': 0.20765212958969498, 'batch_norm': True, 'lr': 1.019193755399962e-06, 'weight_decay': 5.101544375959396e-05, 'epochs': 263, 'loss': 'mae', 'optimizer': 'adam', 'graph_mode': 'knn', 'source': 'grm', 'knn_k': 4, 'weighted_edges': True, 'symmetrize_mode': 'union', 'use_snp_selection': False}. Best is trial 22 with value: 0.09749254593739673.
[I 2025-11-03 13:17:09,509] Trial 29 finished with value: 0.06685150609465673 and parameters: {'model_type': 'graphsage', 'hidden_dims': '[128, 64]', 'dropout': 0.1881763221627632, 'batch_norm': True, 'lr': 5.9214048211264956e-05, 'weight_decay': 3.822710200703061e-05, 'epochs': 301, 'loss': 'mae', 'optimizer': 'adam', 'graph_mode': 'knn', 'source': 'grm', 'knn_k': 2, 'weighted_edges': False, 'symmetrize_mode': 'mutual', 'use_snp_selection': False}. Best is trial 22 with value: 0.09749254593739673.
[I 2025-11-03 13:17:14,716] Trial 30 finished with value: 0.02202846457963846 and parameters: {'model_type': 'graphsage', 'hidden_dims': '[512, 256]', 'dropout': 0.39467047916215325, 'batch_norm': True, 'lr': 5.118179303912433e-06, 'weight_decay': 1.0892003120527411e-07, 'epochs': 332, 'loss': 'mae', 'optimizer': 'adam', 'graph_mode': 'knn', 'source': 'grm', 'knn_k': 5, 'weighted_edges': True, 'symmetrize_mode': 'union', 'use_snp_selection': False}. Best is trial 22 with value: 0.09749254593739673.
[I 2025-11-03 13:17:18,771] Trial 31 finished with value: 0.08698155258498394 and parameters: {'model_type': 'graphsage', 'hidden_dims': '[512, 256]', 'dropout': 0.3145391821846619, 'batch_norm': True, 'lr': 0.00010324943839731877, 'weight_decay': 0.0003169697859220385, 'epochs': 235, 'loss': 'mae', 'optimizer': 'adam', 'graph_mode': 'knn', 'source': 'grm', 'knn_k': 2, 'weighted_edges': True, 'symmetrize_mode': 'union', 'use_snp_selection': False}. Best is trial 22 with value: 0.09749254593739673.
[I 2025-11-03 13:17:23,902] Trial 32 finished with value: 0.057950260389642315 and parameters: {'model_type': 'graphsage', 'hidden_dims': '[512, 256]', 'dropout': 0.2623309993244854, 'batch_norm': True, 'lr': 2.354157591777926e-05, 'weight_decay': 7.921793195668723e-05, 'epochs': 344, 'loss': 'mae', 'optimizer': 'adam', 'graph_mode': 'knn', 'source': 'grm', 'knn_k': 3, 'weighted_edges': True, 'symmetrize_mode': 'union', 'use_snp_selection': False}. Best is trial 22 with value: 0.09749254593739673.
[I 2025-11-03 13:17:27,720] Trial 33 finished with value: 0.07659879250738212 and parameters: {'model_type': 'graphsage', 'hidden_dims': '[512, 256]', 'dropout': 0.33894993674938473, 'batch_norm': True, 'lr': 0.0001436876346356908, 'weight_decay': 0.0007370918921434276, 'epochs': 207, 'loss': 'mae', 'optimizer': 'adam', 'graph_mode': 'knn', 'source': 'grm', 'knn_k': 2, 'weighted_edges': True, 'symmetrize_mode': 'union', 'use_snp_selection': False}. Best is trial 22 with value: 0.09749254593739673.
[I 2025-11-03 13:17:32,014] Trial 34 finished with value: 0.08686084832543822 and parameters: {'model_type': 'graphsage', 'hidden_dims': '[512, 256]', 'dropout': 0.2362292878914034, 'batch_norm': True, 'lr': 0.00035052795864688627, 'weight_decay': 0.00019783828746694802, 'epochs': 248, 'loss': 'mae', 'optimizer': 'adam', 'graph_mode': 'knn', 'source': 'grm', 'knn_k': 3, 'weighted_edges': True, 'symmetrize_mode': 'union', 'use_snp_selection': False}. Best is trial 22 with value: 0.09749254593739673.
[I 2025-11-03 13:17:33,679] Trial 35 finished with value: 0.05498104068927791 and parameters: {'model_type': 'graphsage', 'hidden_dims': '[128, 64]', 'dropout': 0.38825772414050186, 'batch_norm': False, 'lr': 0.0005384524397059019, 'weight_decay': 0.0009587906154072417, 'epochs': 181, 'loss': 'mae', 'optimizer': 'adam', 'graph_mode': 'knn', 'source': 'grm', 'knn_k': 4, 'weighted_edges': True, 'symmetrize_mode': 'union', 'use_snp_selection': True, 'num_snps': 2074}. Best is trial 22 with value: 0.09749254593739673.
[I 2025-11-03 13:17:36,523] Trial 36 finished with value: 0.06262465305710062 and parameters: {'model_type': 'graphsage', 'hidden_dims': '[256, 128]', 'dropout': 0.29252122078494797, 'batch_norm': True, 'lr': 6.622990130494557e-05, 'weight_decay': 0.0004442141417619771, 'epochs': 272, 'loss': 'mse', 'optimizer': 'adam', 'graph_mode': 'knn', 'source': 'grm', 'knn_k': 2, 'weighted_edges': True, 'symmetrize_mode': 'union', 'use_snp_selection': False}. Best is trial 22 with value: 0.09749254593739673.
[I 2025-11-03 13:17:39,127] Trial 37 finished with value: 0.060214108952702565 and parameters: {'model_type': 'graphsage', 'hidden_dims': '[256, 128, 64]', 'dropout': 0.42425822667487145, 'batch_norm': False, 'lr': 3.222089830742118e-05, 'weight_decay': 4.830936308591571e-07, 'epochs': 234, 'loss': 'mae', 'optimizer': 'adam', 'graph_mode': 'knn', 'source': 'grm', 'knn_k': 9, 'weighted_edges': True, 'symmetrize_mode': 'mutual', 'use_snp_selection': True, 'num_snps': 15344}. Best is trial 22 with value: 0.09749254593739673.
[I 2025-11-03 13:17:42,430] Trial 38 finished with value: 0.07336437788874632 and parameters: {'model_type': 'graphsage', 'hidden_dims': '[512, 256]', 'dropout': 0.3539827288940406, 'batch_norm': True, 'lr': 0.00022886806006596364, 'weight_decay': 3.6494558168224016e-05, 'epochs': 118, 'loss': 'mae', 'optimizer': 'adam', 'graph_mode': 'knn', 'source': 'grm', 'knn_k': 7, 'weighted_edges': True, 'symmetrize_mode': 'union', 'use_snp_selection': False}. Best is trial 22 with value: 0.09749254593739673.
[I 2025-11-03 13:17:46,294] Trial 39 finished with value: 0.049887615300987925 and parameters: {'model_type': 'graphsage', 'hidden_dims': '[128, 64]', 'dropout': 0.3080671314273796, 'batch_norm': False, 'lr': 0.00012056549736818721, 'weight_decay': 2.1040578746711815e-05, 'epochs': 290, 'loss': 'mse', 'optimizer': 'adam', 'graph_mode': 'cutoff', 'cutoff': 0.44317858358026907, 'grm_norm': 'none', 'self_loops': True, 'use_snp_selection': True, 'num_snps': 58379}. Best is trial 22 with value: 0.09749254593739673.
