[I 2025-11-12 02:22:47,421] Trial 24 finished with value: 0.20429688904372387 and parameters: {'model_type': 'graphsage', 'hidden_dims': '[256, 128, 64]', 'dropout': 0.2462141908998971, 'batch_norm': False, 'lr': 1.4550394363367034e-06, 'weight_decay': 1.4049243795478953e-06, 'epochs': 120, 'loss': 'mae', 'optimizer': 'adam', 'graph_mode': 'cutoff', 'cutoff': 0.706800603218611, 'grm_norm': 'cosine_then_gcn', 'self_loops': False, 'use_snp_selection': True, 'num_snps': 29271}. Best is trial 21 with value: 0.2484728945141111.
[I 2025-11-12 02:24:04,134] Trial 25 finished with value: 0.1819005151660453 and parameters: {'model_type': 'graphsage', 'hidden_dims': '[256, 128, 64]', 'dropout': 0.38125704522669784, 'batch_norm': False, 'lr': 2.6291908442081575e-06, 'weight_decay': 3.2821639298466034e-07, 'epochs': 61, 'loss': 'mae', 'optimizer': 'adam', 'graph_mode': 'cutoff', 'cutoff': 0.5094993562057348, 'grm_norm': 'cosine_then_gcn', 'self_loops': False, 'use_snp_selection': True, 'num_snps': 36527}. Best is trial 21 with value: 0.2484728945141111.
[I 2025-11-12 02:28:18,873] Trial 26 finished with value: 0.23240642514254456 and parameters: {'model_type': 'graphsage', 'hidden_dims': '[256, 128, 64]', 'dropout': 0.1790597443347427, 'batch_norm': False, 'lr': 6.999497915757962e-06, 'weight_decay': 1.0558203834570194e-07, 'epochs': 219, 'loss': 'mae', 'optimizer': 'adam', 'graph_mode': 'knn', 'source': 'grm', 'knn_k': 10, 'weighted_edges': False, 'symmetrize_mode': 'union', 'use_snp_selection': True, 'num_snps': 34162}. Best is trial 21 with value: 0.2484728945141111.
[I 2025-11-12 02:29:28,627] Trial 27 finished with value: 0.21855955166638763 and parameters: {'model_type': 'graphsage', 'hidden_dims': '[256, 128, 64]', 'dropout': 0.25372983450723674, 'batch_norm': False, 'lr': 5.332605189477543e-05, 'weight_decay': 3.7287770250447553e-06, 'epochs': 110, 'loss': 'mae', 'optimizer': 'adam', 'graph_mode': 'cutoff', 'cutoff': 0.6146813386446508, 'grm_norm': 'cosine_then_gcn', 'self_loops': False, 'use_snp_selection': True, 'num_snps': 22627}. Best is trial 21 with value: 0.2484728945141111.
[I 2025-11-12 02:31:18,227] Trial 28 finished with value: 0.217359744668118 and parameters: {'model_type': 'graphsage', 'hidden_dims': '[256, 128, 64]', 'dropout': 0.43701734658308644, 'batch_norm': False, 'lr': 0.0001011648860400929, 'weight_decay': 1.1687726195866218e-06, 'epochs': 134, 'loss': 'mae', 'optimizer': 'adam', 'graph_mode': 'cutoff', 'cutoff': 0.7486744119809771, 'grm_norm': 'gcn', 'self_loops': False, 'use_snp_selection': True, 'num_snps': 53161}. Best is trial 21 with value: 0.2484728945141111.
[I 2025-11-12 02:33:27,278] Trial 29 finished with value: 0.22409952318600937 and parameters: {'model_type': 'graphsage', 'hidden_dims': '[256, 128, 64]', 'dropout': 0.20927599194134755, 'batch_norm': False, 'lr': 2.8490902852811707e-06, 'weight_decay': 2.629894624186835e-07, 'epochs': 167, 'loss': 'mae', 'optimizer': 'adam', 'graph_mode': 'knn', 'source': 'grm', 'knn_k': 3, 'weighted_edges': True, 'symmetrize_mode': 'union', 'use_snp_selection': True, 'num_snps': 37914}. Best is trial 21 with value: 0.2484728945141111.
[I 2025-11-12 02:36:05,501] Trial 30 finished with value: 0.22670386378743984 and parameters: {'model_type': 'graphsage', 'hidden_dims': '[256, 128]', 'dropout': 0.3670026239697269, 'batch_norm': False, 'lr': 1.2009547907518552e-06, 'weight_decay': 7.0340887288149515e-06, 'epochs': 326, 'loss': 'mae', 'optimizer': 'adam', 'graph_mode': 'cutoff', 'cutoff': 0.6662904968161537, 'grm_norm': 'cosine_then_gcn', 'self_loops': False, 'use_snp_selection': True, 'num_snps': 48718}. Best is trial 21 with value: 0.2484728945141111.
[I 2025-11-12 02:37:44,559] Trial 31 finished with value: 0.24152581328200062 and parameters: {'model_type': 'graphsage', 'hidden_dims': '[512, 64]', 'dropout': 0.3049116033353171, 'batch_norm': False, 'lr': 1.0643476345395585e-05, 'weight_decay': 5.951199074107571e-07, 'epochs': 82, 'loss': 'mae', 'optimizer': 'adam', 'graph_mode': 'cutoff', 'cutoff': 0.8330332042450638, 'grm_norm': 'cosine_then_gcn', 'self_loops': False, 'use_snp_selection': True, 'num_snps': 40445}. Best is trial 21 with value: 0.2484728945141111.
[I 2025-11-12 02:39:19,289] Trial 32 finished with value: 0.24629324133433972 and parameters: {'model_type': 'graphsage', 'hidden_dims': '[512, 64]', 'dropout': 0.2878234427657062, 'batch_norm': False, 'lr': 8.428636969987558e-06, 'weight_decay': 8.50954542329043e-07, 'epochs': 74, 'loss': 'mae', 'optimizer': 'adam', 'graph_mode': 'cutoff', 'cutoff': 0.8291464895234132, 'grm_norm': 'cosine_then_gcn', 'self_loops': False, 'use_snp_selection': True, 'num_snps': 39271}. Best is trial 21 with value: 0.2484728945141111.
[I 2025-11-12 02:40:25,794] Trial 33 finished with value: 0.19386234688934312 and parameters: {'model_type': 'graphsage', 'hidden_dims': '[128, 64]', 'dropout': 0.26963438440946946, 'batch_norm': False, 'lr': 4.3902524563381724e-06, 'weight_decay': 1.0264443603351364e-06, 'epochs': 63, 'loss': 'mae', 'optimizer': 'adam', 'graph_mode': 'cutoff', 'cutoff': 0.7455853946679664, 'grm_norm': 'cosine_then_gcn', 'self_loops': False, 'use_snp_selection': True, 'num_snps': 33415}. Best is trial 21 with value: 0.2484728945141111.
[I 2025-11-12 02:42:03,076] Trial 34 finished with value: 0.20129780372802145 and parameters: {'model_type': 'graphsage', 'hidden_dims': '[256, 128, 64]', 'dropout': 0.17894832968093155, 'batch_norm': False, 'lr': 2.3619189530627814e-05, 'weight_decay': 2.7041584978017784e-07, 'epochs': 41, 'loss': 'mae', 'optimizer': 'adam', 'graph_mode': 'knn', 'source': 'grm', 'knn_k': 4, 'weighted_edges': False, 'symmetrize_mode': 'union', 'use_snp_selection': True, 'num_snps': 48502}. Best is trial 21 with value: 0.2484728945141111.
[I 2025-11-12 02:43:19,113] Trial 35 finished with value: 0.2329327082239876 and parameters: {'model_type': 'graphsage', 'hidden_dims': '[512, 64]', 'dropout': 0.2375926026614126, 'batch_norm': False, 'lr': 3.808664281401979e-05, 'weight_decay': 2.3493237611846233e-06, 'epochs': 68, 'loss': 'mae', 'optimizer': 'adam', 'graph_mode': 'cutoff', 'cutoff': 0.6878935733349674, 'grm_norm': 'cosine_then_gcn', 'self_loops': False, 'use_snp_selection': True, 'num_snps': 25969}. Best is trial 21 with value: 0.2484728945141111.
[I 2025-11-12 02:43:54,975] Trial 36 finished with value: 0.17172846699468747 and parameters: {'model_type': 'graphsage', 'hidden_dims': '[128, 64]', 'dropout': 0.28382397657448244, 'batch_norm': True, 'lr': 7.065806654739089e-06, 'weight_decay': 1.8286339726864447e-07, 'epochs': 103, 'loss': 'mae', 'optimizer': 'adam', 'graph_mode': 'cutoff', 'cutoff': 0.6222120515215395, 'grm_norm': 'cosine_then_gcn', 'self_loops': False, 'use_snp_selection': False}. Best is trial 21 with value: 0.2484728945141111.
[I 2025-11-12 02:45:32,826] Trial 37 finished with value: 0.22838764853926424 and parameters: {'model_type': 'graphsage', 'hidden_dims': '[256, 128]', 'dropout': 0.39916676368735093, 'batch_norm': False, 'lr': 0.00022835055832018175, 'weight_decay': 4.59476319408232e-07, 'epochs': 57, 'loss': 'mae', 'optimizer': 'adam', 'graph_mode': 'knn', 'source': 'grm', 'knn_k': 10, 'weighted_edges': True, 'symmetrize_mode': 'mutual', 'use_snp_selection': True, 'num_snps': 38897}. Best is trial 21 with value: 0.2484728945141111.
[I 2025-11-12 02:46:45,107] Trial 38 finished with value: 0.24017744925600892 and parameters: {'model_type': 'graphsage', 'hidden_dims': '[256, 128, 64]', 'dropout': 0.33742926736537665, 'batch_norm': False, 'lr': 8.497019708889495e-05, 'weight_decay': 7.480098885779211e-07, 'epochs': 77, 'loss': 'mae', 'optimizer': 'adam', 'graph_mode': 'cutoff', 'cutoff': 0.7526921204649524, 'grm_norm': 'none', 'self_loops': False, 'use_snp_selection': True, 'num_snps': 32537}. Best is trial 21 with value: 0.2484728945141111.
[I 2025-11-12 02:48:33,811] Trial 39 finished with value: 0.13979390012784337 and parameters: {'model_type': 'graphsage', 'hidden_dims': '[512, 256]', 'dropout': 0.15770084351657992, 'batch_norm': True, 'lr': 2.991362208404975e-06, 'weight_decay': 4.747473762193258e-05, 'epochs': 136, 'loss': 'mae', 'optimizer': 'adam', 'graph_mode': 'cutoff', 'cutoff': 0.5565787466856831, 'grm_norm': 'gcn', 'self_loops': False, 'use_snp_selection': False}. Best is trial 21 with value: 0.2484728945141111.
[I 2025-11-12 02:49:41,283] Trial 40 finished with value: 0.227886153011636 and parameters: {'model_type': 'graphsage', 'hidden_dims': '[128, 64]', 'dropout': 0.20075203216394139, 'batch_norm': False, 'lr': 4.614477988993477e-05, 'weight_decay': 7.355254720333966e-06, 'epochs': 52, 'loss': 'mae', 'optimizer': 'adam', 'graph_mode': 'knn', 'source': 'grm', 'knn_k': 4, 'weighted_edges': False, 'symmetrize_mode': 'union', 'use_snp_selection': True, 'num_snps': 27647}. Best is trial 21 with value: 0.2484728945141111.
[I 2025-11-12 02:51:20,531] Trial 41 finished with value: 0.2474274396951975 and parameters: {'model_type': 'graphsage', 'hidden_dims': '[512, 64]', 'dropout': 0.30630522705778707, 'batch_norm': False, 'lr': 1.069916215896549e-05, 'weight_decay': 5.415143490488222e-07, 'epochs': 83, 'loss': 'mae', 'optimizer': 'adam', 'graph_mode': 'cutoff', 'cutoff': 0.850650109725027, 'grm_norm': 'cosine_then_gcn', 'self_loops': False, 'use_snp_selection': True, 'num_snps': 40036}. Best is trial 21 with value: 0.2484728945141111.
[I 2025-11-12 02:52:54,564] Trial 42 finished with value: 0.2456590985699286 and parameters: {'model_type': 'graphsage', 'hidden_dims': '[512, 64]', 'dropout': 0.25498854463453025, 'batch_norm': False, 'lr': 2.9100404194655247e-05, 'weight_decay': 2.0388060716561786e-06, 'epochs': 77, 'loss': 'mae', 'optimizer': 'adam', 'graph_mode': 'cutoff', 'cutoff': 0.8394203833233456, 'grm_norm': 'cosine_then_gcn', 'self_loops': False, 'use_snp_selection': True, 'num_snps': 38134}. Best is trial 21 with value: 0.2484728945141111.
[I 2025-11-12 02:54:41,658] Trial 43 finished with value: 0.24587198769041385 and parameters: {'model_type': 'graphsage', 'hidden_dims': '[512, 64]', 'dropout': 0.3098629974739038, 'batch_norm': False, 'lr': 9.459870422826003e-06, 'weight_decay': 2.317086860552265e-06, 'epochs': 114, 'loss': 'mae', 'optimizer': 'adam', 'graph_mode': 'cutoff', 'cutoff': 0.8490708735173962, 'grm_norm': 'cosine_then_gcn', 'self_loops': False, 'use_snp_selection': True, 'num_snps': 38008}. Best is trial 21 with value: 0.2484728945141111.
[I 2025-11-12 02:56:33,416] Trial 44 finished with value: 0.20945324931817005 and parameters: {'model_type': 'graphsage', 'hidden_dims': '[512, 64]', 'dropout': 0.32817842727020347, 'batch_norm': False, 'lr': 9.860693634191585e-06, 'weight_decay': 2.6334984025771524e-06, 'epochs': 171, 'loss': 'mae', 'optimizer': 'adam', 'graph_mode': 'cutoff', 'cutoff': 0.8511524713494525, 'grm_norm': 'cosine_then_gcn', 'self_loops': False, 'use_snp_selection': True, 'num_snps': 30991}. Best is trial 21 with value: 0.2484728945141111.
[I 2025-11-12 02:58:15,768] Trial 45 finished with value: 0.23519997469023393 and parameters: {'model_type': 'graphsage', 'hidden_dims': '[512, 64]', 'dropout': 0.30058094857124895, 'batch_norm': False, 'lr': 3.058496045058924e-05, 'weight_decay': 1.8609006726116238e-06, 'epochs': 78, 'loss': 'mse', 'optimizer': 'adam', 'graph_mode': 'cutoff', 'cutoff': 0.8964724347833712, 'grm_norm': 'cosine_then_gcn', 'self_loops': False, 'use_snp_selection': True, 'num_snps': 44571}. Best is trial 21 with value: 0.2484728945141111.
[I 2025-11-12 03:00:02,498] Trial 46 finished with value: 0.2322171039924324 and parameters: {'model_type': 'graphsage', 'hidden_dims': '[512, 64]', 'dropout': 0.3707283120437418, 'batch_norm': True, 'lr': 2.0594218345246543e-05, 'weight_decay': 1.1261926551391972e-06, 'epochs': 136, 'loss': 'mae', 'optimizer': 'adam', 'graph_mode': 'cutoff', 'cutoff': 0.8487439527874373, 'grm_norm': 'cosine_then_gcn', 'self_loops': False, 'use_snp_selection': False}. Best is trial 21 with value: 0.2484728945141111.
[I 2025-11-12 03:02:44,268] Trial 47 finished with value: 0.23080885039053073 and parameters: {'model_type': 'graphsage', 'hidden_dims': '[512, 64]', 'dropout': 0.22592825699672092, 'batch_norm': False, 'lr': 1.591991542464633e-05, 'weight_decay': 5.697543486386913e-06, 'epochs': 202, 'loss': 'mae', 'optimizer': 'adam', 'graph_mode': 'cutoff', 'cutoff': 0.7841468323404609, 'grm_norm': 'gcn', 'self_loops': False, 'use_snp_selection': True, 'num_snps': 46667}. Best is trial 21 with value: 0.2484728945141111.
[I 2025-11-12 03:04:26,808] Trial 48 finished with value: 0.22624190791518975 and parameters: {'model_type': 'graphsage', 'hidden_dims': '[512, 64]', 'dropout': 0.2894998043836119, 'batch_norm': False, 'lr': 2.761082875813947e-05, 'weight_decay': 1.5346241431995247e-06, 'epochs': 96, 'loss': 'mse', 'optimizer': 'adam', 'graph_mode': 'cutoff', 'cutoff': 0.854995293000303, 'grm_norm': 'cosine', 'self_loops': True, 'use_snp_selection': True, 'num_snps': 39220}. Best is trial 21 with value: 0.2484728945141111.
[I 2025-11-12 03:06:05,974] Trial 49 finished with value: 0.21926750096339415 and parameters: {'model_type': 'graphsage', 'hidden_dims': '[512, 64]', 'dropout': 0.42630002161813857, 'batch_norm': True, 'lr': 8.272622046726296e-06, 'weight_decay': 1.4564324555007318e-05, 'epochs': 124, 'loss': 'mae', 'optimizer': 'adam', 'graph_mode': 'cutoff', 'cutoff': 0.8992411419857, 'grm_norm': 'cosine_then_gcn', 'self_loops': True, 'use_snp_selection': False}. Best is trial 21 with value: 0.2484728945141111.
[I 2025-11-12 03:08:42,442] Trial 50 finished with value: 0.2535306602402755 and parameters: {'model_type': 'graphsage', 'hidden_dims': '[512, 64]', 'dropout': 0.3485763016437078, 'batch_norm': False, 'lr': 4.428691398606006e-06, 'weight_decay': 3.113227004350149e-06, 'epochs': 272, 'loss': 'mae', 'optimizer': 'adam', 'graph_mode': 'cutoff', 'cutoff': 0.8085057773036494, 'grm_norm': 'cosine_then_gcn', 'self_loops': False, 'use_snp_selection': True, 'num_snps': 35047}. Best is trial 50 with value: 0.2535306602402755.
[I 2025-11-12 03:11:15,354] Trial 51 finished with value: 0.22729398457121333 and parameters: {'model_type': 'graphsage', 'hidden_dims': '[512, 64]', 'dropout': 0.3431181094737222, 'batch_norm': False, 'lr': 4.401244995024213e-06, 'weight_decay': 4.9735954156782575e-06, 'epochs': 265, 'loss': 'mae', 'optimizer': 'adam', 'graph_mode': 'cutoff', 'cutoff': 0.8186252167242402, 'grm_norm': 'cosine_then_gcn', 'self_loops': False, 'use_snp_selection': True, 'num_snps': 34655}. Best is trial 50 with value: 0.2535306602402755.
[I 2025-11-12 03:15:00,788] Trial 52 finished with value: 0.23885292579653897 and parameters: {'model_type': 'graphsage', 'hidden_dims': '[512, 64]', 'dropout': 0.30883828530322915, 'batch_norm': False, 'lr': 5.454193550654902e-06, 'weight_decay': 2.4762054369725017e-06, 'epochs': 267, 'loss': 'mae', 'optimizer': 'adam', 'graph_mode': 'cutoff', 'cutoff': 0.41100787892309165, 'grm_norm': 'cosine_then_gcn', 'self_loops': False, 'use_snp_selection': True, 'num_snps': 40702}. Best is trial 50 with value: 0.2535306602402755.
[I 2025-11-12 03:20:58,639] Trial 53 finished with value: 0.2276365436348807 and parameters: {'model_type': 'graphsage', 'hidden_dims': '[512, 64]', 'dropout': 0.36278550848356617, 'batch_norm': False, 'lr': 0.00016743562240247994, 'weight_decay': 8.436575164183569e-07, 'epochs': 337, 'loss': 'mae', 'optimizer': 'adam', 'graph_mode': 'cutoff', 'cutoff': 0.2266986201553094, 'grm_norm': 'cosine_then_gcn', 'self_loops': False, 'use_snp_selection': True, 'num_snps': 31762}. Best is trial 50 with value: 0.2535306602402755.
[I 2025-11-12 03:24:13,875] Trial 54 finished with value: 0.249461318479452 and parameters: {'model_type': 'graphsage', 'hidden_dims': '[512, 64]', 'dropout': 0.3920667006137748, 'batch_norm': False, 'lr': 0.00036982716432691404, 'weight_decay': 0.00043892560379231265, 'epochs': 313, 'loss': 'mae', 'optimizer': 'adam', 'graph_mode': 'cutoff', 'cutoff': 0.8624454827345316, 'grm_norm': 'cosine', 'self_loops': False, 'use_snp_selection': True, 'num_snps': 42370}. Best is trial 50 with value: 0.2535306602402755.
[I 2025-11-12 03:27:26,505] Trial 55 finished with value: 0.1957567759130233 and parameters: {'model_type': 'graphsage', 'hidden_dims': '[512, 128]', 'dropout': 0.3971642425791624, 'batch_norm': False, 'lr': 0.0005195534693982962, 'weight_decay': 0.0006568742945860698, 'epochs': 307, 'loss': 'mae', 'optimizer': 'adam', 'graph_mode': 'cutoff', 'cutoff': 0.773031981856135, 'grm_norm': 'cosine', 'self_loops': True, 'use_snp_selection': True, 'num_snps': 42634}. Best is trial 50 with value: 0.2535306602402755.
[I 2025-11-12 03:31:13,652] Trial 56 finished with value: 0.2132242083062542 and parameters: {'model_type': 'graphsage', 'hidden_dims': '[512, 256]', 'dropout': 0.45464071594381694, 'batch_norm': False, 'lr': 0.00033401333716814803, 'weight_decay': 0.0001673335594548112, 'epochs': 348, 'loss': 'mse', 'optimizer': 'adam', 'graph_mode': 'cutoff', 'cutoff': 0.868801301162907, 'grm_norm': 'cosine', 'self_loops': False, 'use_snp_selection': True, 'num_snps': 46121}. Best is trial 50 with value: 0.2535306602402755.
[I 2025-11-12 03:35:03,588] Trial 57 finished with value: 0.2234442385243741 and parameters: {'model_type': 'graphsage', 'hidden_dims': '[512, 64]', 'dropout': 0.35237708148816194, 'batch_norm': False, 'lr': 1.711007240128535e-05, 'weight_decay': 3.729985358167112e-05, 'epochs': 299, 'loss': 'mae', 'optimizer': 'adam', 'graph_mode': 'cutoff', 'cutoff': 0.8067543636442639, 'grm_norm': 'cosine', 'self_loops': False, 'use_snp_selection': True, 'num_snps': 52874}. Best is trial 50 with value: 0.2535306602402755.
[I 2025-11-12 03:42:24,445] Trial 58 finished with value: 0.2074303340874694 and parameters: {'model_type': 'graphsage', 'hidden_dims': '[512, 64]', 'dropout': 0.31953432059475295, 'batch_norm': False, 'lr': 3.2319227854048363e-06, 'weight_decay': 0.00010136230764414373, 'epochs': 319, 'loss': 'mae', 'optimizer': 'adam', 'graph_mode': 'knn', 'source': 'grm', 'knn_k': 8, 'weighted_edges': False, 'symmetrize_mode': 'union', 'use_snp_selection': True, 'num_snps': 42426}. Best is trial 50 with value: 0.2535306602402755.
[I 2025-11-12 03:44:20,483] Trial 59 finished with value: 0.2223057675328754 and parameters: {'model_type': 'graphsage', 'hidden_dims': '[256, 128]', 'dropout': 0.28944912170076065, 'batch_norm': False, 'lr': 2.1152728285264594e-06, 'weight_decay': 9.680516776120696e-06, 'epochs': 283, 'loss': 'mae', 'optimizer': 'adam', 'graph_mode': 'cutoff', 'cutoff': 0.8611029473851775, 'grm_norm': 'cosine', 'self_loops': False, 'use_snp_selection': True, 'num_snps': 35071}. Best is trial 50 with value: 0.2535306602402755.
[I 2025-11-12 03:47:13,240] Trial 60 finished with value: 0.22339695198652004 and parameters: {'model_type': 'graphsage', 'hidden_dims': '[512, 64]', 'dropout': 0.3851939354273896, 'batch_norm': True, 'lr': 0.000947304452952278, 'weight_decay': 0.0005474661684439809, 'epochs': 243, 'loss': 'mse', 'optimizer': 'adam', 'graph_mode': 'cutoff', 'cutoff': 0.7702445088388324, 'grm_norm': 'cosine', 'self_loops': True, 'use_snp_selection': False}. Best is trial 50 with value: 0.2535306602402755.
[I 2025-11-12 03:48:45,406] Trial 61 finished with value: 0.25323599734930985 and parameters: {'model_type': 'graphsage', 'hidden_dims': '[512, 64]', 'dropout': 0.2393759442481218, 'batch_norm': False, 'lr': 1.2205362041934016e-05, 'weight_decay': 3.2691468066491766e-06, 'epochs': 71, 'loss': 'mae', 'optimizer': 'adam', 'graph_mode': 'cutoff', 'cutoff': 0.8246180005981021, 'grm_norm': 'cosine_then_gcn', 'self_loops': False, 'use_snp_selection': True, 'num_snps': 38084}. Best is trial 50 with value: 0.2535306602402755.
[I 2025-11-12 03:50:13,360] Trial 62 finished with value: 0.21698778031891974 and parameters: {'model_type': 'graphsage', 'hidden_dims': '[512, 64]', 'dropout': 0.3201862893639721, 'batch_norm': False, 'lr': 8.428084860469749e-06, 'weight_decay': 2.949079262059228e-06, 'epochs': 49, 'loss': 'mae', 'optimizer': 'adam', 'graph_mode': 'cutoff', 'cutoff': 0.8127116937634358, 'grm_norm': 'cosine_then_gcn', 'self_loops': False, 'use_snp_selection': True, 'num_snps': 41705}. Best is trial 50 with value: 0.2535306602402755.
[I 2025-11-12 03:52:41,918] Trial 63 finished with value: 0.23459191252773456 and parameters: {'model_type': 'graphsage', 'hidden_dims': '[512, 64]', 'dropout': 0.2833174686245574, 'batch_norm': False, 'lr': 1.3464651495220826e-05, 'weight_decay': 5.017231871604947e-06, 'epochs': 234, 'loss': 'mae', 'optimizer': 'adam', 'graph_mode': 'cutoff', 'cutoff': 0.7220724968784004, 'grm_norm': 'cosine_then_gcn', 'self_loops': False, 'use_snp_selection': True, 'num_snps': 36902}. Best is trial 50 with value: 0.2535306602402755.
[I 2025-11-12 03:54:27,900] Trial 64 finished with value: 0.23252541868317095 and parameters: {'model_type': 'graphsage', 'hidden_dims': '[512, 64]', 'dropout': 0.22837019902357025, 'batch_norm': False, 'lr': 9.33877699528692e-06, 'weight_decay': 2.573529759573642e-05, 'epochs': 84, 'loss': 'mae', 'optimizer': 'adam', 'graph_mode': 'cutoff', 'cutoff': 0.8743414281130301, 'grm_norm': 'cosine_then_gcn', 'self_loops': False, 'use_snp_selection': True, 'num_snps': 44613}. Best is trial 50 with value: 0.2535306602402755.
[I 2025-11-12 03:56:16,413] Trial 65 finished with value: 0.24794108669007012 and parameters: {'model_type': 'graphsage', 'hidden_dims': '[512, 128]', 'dropout': 0.26891626619500103, 'batch_norm': False, 'lr': 1.2077219239446528e-05, 'weight_decay': 3.34446221676938e-07, 'epochs': 107, 'loss': 'mae', 'optimizer': 'adam', 'graph_mode': 'cutoff', 'cutoff': 0.8167813564223967, 'grm_norm': 'cosine_then_gcn', 'self_loops': False, 'use_snp_selection': True, 'num_snps': 39370}. Best is trial 50 with value: 0.2535306602402755.
