Running from this directory: /cluster/work/simennes/Project_thesis/Project_thesis
Name of job: gcn_ens
ID of job: 23199284
The job was run on these nodes: idun-07-05
[I 2025-11-03 11:41:01,385] Trial 0 finished with value: 0.017383106417460086 and parameters: {'model_type': 'gcn', 'hidden_dims': '[128, 64]', 'dropout': 0.199031432379812, 'batch_norm': True, 'lr': 1.8408544111075837e-06, 'weight_decay': 5.5136510071208614e-05, 'epochs': 334, 'loss': 'mae', 'optimizer': 'adam', 'graph_mode': 'knn', 'source': 'grm', 'knn_k': 8, 'weighted_edges': True, 'symmetrize_mode': 'mutual', 'use_snp_selection': False}. Best is trial 0 with value: 0.017383106417460086.
[I 2025-11-03 11:41:02,668] Trial 1 finished with value: 0.062405319221480564 and parameters: {'model_type': 'gcn', 'hidden_dims': '[128, 64]', 'dropout': 0.40051947670227217, 'batch_norm': True, 'lr': 0.0005320428882732732, 'weight_decay': 1.89210117736594e-06, 'epochs': 32, 'loss': 'mse', 'optimizer': 'adam', 'graph_mode': 'knn', 'source': 'grm', 'knn_k': 7, 'weighted_edges': True, 'symmetrize_mode': 'union', 'use_snp_selection': False}. Best is trial 1 with value: 0.062405319221480564.
[I 2025-11-03 11:41:04,664] Trial 2 finished with value: 0.03783258663736309 and parameters: {'model_type': 'gcn', 'hidden_dims': '[256, 128]', 'dropout': 0.5105528289184642, 'batch_norm': False, 'lr': 0.0006804279372404962, 'weight_decay': 0.0008922815224257085, 'epochs': 160, 'loss': 'mse', 'optimizer': 'adam', 'graph_mode': 'cutoff', 'cutoff': 0.5741905641612706, 'grm_norm': 'gcn', 'self_loops': False, 'use_snp_selection': True, 'num_snps': 26910}. Best is trial 1 with value: 0.062405319221480564.
[I 2025-11-03 11:41:06,723] Trial 3 finished with value: 0.024182157689233916 and parameters: {'model_type': 'gcn', 'hidden_dims': '[256, 128, 64]', 'dropout': 0.5390483213624292, 'batch_norm': False, 'lr': 3.4705625989073525e-05, 'weight_decay': 2.4623319020131338e-05, 'epochs': 92, 'loss': 'mse', 'optimizer': 'adam', 'graph_mode': 'knn', 'source': 'grm', 'knn_k': 6, 'weighted_edges': False, 'symmetrize_mode': 'mutual', 'use_snp_selection': True, 'num_snps': 30713}. Best is trial 1 with value: 0.062405319221480564.
[I 2025-11-03 11:41:08,885] Trial 4 finished with value: 0.002034505748019891 and parameters: {'model_type': 'gcn', 'hidden_dims': '[128, 64]', 'dropout': 0.13404863676897502, 'batch_norm': False, 'lr': 0.0001431556295367288, 'weight_decay': 2.2084517750726675e-05, 'epochs': 13, 'loss': 'mae', 'optimizer': 'adam', 'graph_mode': 'cutoff', 'cutoff': 0.6714268476993044, 'grm_norm': 'none', 'self_loops': False, 'use_snp_selection': True, 'num_snps': 45645}. Best is trial 1 with value: 0.062405319221480564.
[I 2025-11-03 11:41:11,407] Trial 5 finished with value: 0.06486443284469967 and parameters: {'model_type': 'gcn', 'hidden_dims': '[256, 128]', 'dropout': 0.42253606323412096, 'batch_norm': False, 'lr': 4.238630400638805e-05, 'weight_decay': 8.074086040046576e-07, 'epochs': 134, 'loss': 'mae', 'optimizer': 'adam', 'graph_mode': 'knn', 'source': 'grm', 'knn_k': 1, 'weighted_edges': False, 'symmetrize_mode': 'mutual', 'use_snp_selection': True, 'num_snps': 43113}. Best is trial 5 with value: 0.06486443284469967.
[I 2025-11-03 11:41:13,804] Trial 6 finished with value: 0.08892630018215117 and parameters: {'model_type': 'gcn', 'hidden_dims': '[512, 256]', 'dropout': 0.3534893146320237, 'batch_norm': True, 'lr': 0.000251307964226932, 'weight_decay': 1.821819791794022e-05, 'epochs': 207, 'loss': 'mae', 'optimizer': 'adam', 'graph_mode': 'knn', 'source': 'grm', 'knn_k': 1, 'weighted_edges': True, 'symmetrize_mode': 'mutual', 'use_snp_selection': False}. Best is trial 6 with value: 0.08892630018215117.
[I 2025-11-03 11:41:15,843] Trial 7 finished with value: 0.049041699421254754 and parameters: {'model_type': 'gcn', 'hidden_dims': '[512, 256]', 'dropout': 0.1105825955860775, 'batch_norm': True, 'lr': 2.374338412754043e-05, 'weight_decay': 1.1284721123340274e-05, 'epochs': 170, 'loss': 'mse', 'optimizer': 'adam', 'graph_mode': 'cutoff', 'cutoff': 0.719872204109604, 'grm_norm': 'gcn', 'self_loops': False, 'use_snp_selection': False}. Best is trial 6 with value: 0.08892630018215117.
[I 2025-11-03 11:41:17,506] Trial 8 finished with value: 0.0762137642180855 and parameters: {'model_type': 'gcn', 'hidden_dims': '[512, 128]', 'dropout': 0.5066580418354021, 'batch_norm': True, 'lr': 0.00039213678276659976, 'weight_decay': 3.43655320802934e-06, 'epochs': 91, 'loss': 'mse', 'optimizer': 'adam', 'graph_mode': 'cutoff', 'cutoff': 0.34923059576505366, 'grm_norm': 'cosine', 'self_loops': True, 'use_snp_selection': False}. Best is trial 6 with value: 0.08892630018215117.
[I 2025-11-03 11:41:19,004] Trial 9 finished with value: 0.028217868540205377 and parameters: {'model_type': 'gcn', 'hidden_dims': '[512, 256]', 'dropout': 0.301734920240333, 'batch_norm': False, 'lr': 6.650961854953448e-06, 'weight_decay': 6.861575656590315e-05, 'epochs': 125, 'loss': 'mae', 'optimizer': 'adam', 'graph_mode': 'cutoff', 'cutoff': 0.2857569870061939, 'grm_norm': 'cosine_then_gcn', 'self_loops': False, 'use_snp_selection': True, 'num_snps': 12722}. Best is trial 6 with value: 0.08892630018215117.
[I 2025-11-03 11:41:21,657] Trial 10 finished with value: 0.056488490595035246 and parameters: {'model_type': 'gcn', 'hidden_dims': '[512, 64]', 'dropout': 0.2833599465317005, 'batch_norm': True, 'lr': 0.00016916760584270694, 'weight_decay': 1.7866650996308468e-07, 'epochs': 266, 'loss': 'mae', 'optimizer': 'adam', 'graph_mode': 'knn', 'source': 'grm', 'knn_k': 1, 'weighted_edges': True, 'symmetrize_mode': 'union', 'use_snp_selection': False}. Best is trial 6 with value: 0.08892630018215117.
[I 2025-11-03 11:41:24,078] Trial 11 finished with value: 0.09164985210562367 and parameters: {'model_type': 'gcn', 'hidden_dims': '[512, 128]', 'dropout': 0.4671952862265716, 'batch_norm': True, 'lr': 0.0001934749722839273, 'weight_decay': 1.818759407283773e-06, 'epochs': 232, 'loss': 'mse', 'optimizer': 'adam', 'graph_mode': 'cutoff', 'cutoff': 0.27687267525456005, 'grm_norm': 'cosine', 'self_loops': True, 'use_snp_selection': False}. Best is trial 11 with value: 0.09164985210562367.
[I 2025-11-03 11:41:26,529] Trial 12 finished with value: 0.06711703072701147 and parameters: {'model_type': 'gcn', 'hidden_dims': '[512, 128]', 'dropout': 0.5982500509908173, 'batch_norm': True, 'lr': 0.00012104397613097465, 'weight_decay': 0.00031248060348503496, 'epochs': 241, 'loss': 'mse', 'optimizer': 'adam', 'graph_mode': 'cutoff', 'cutoff': 0.2158009400902668, 'grm_norm': 'cosine', 'self_loops': True, 'use_snp_selection': False}. Best is trial 11 with value: 0.09164985210562367.
[I 2025-11-03 11:41:28,991] Trial 13 finished with value: 0.05624125817617154 and parameters: {'model_type': 'gcn', 'hidden_dims': '[512, 128]', 'dropout': 0.4046702815157425, 'batch_norm': True, 'lr': 0.000989953654901811, 'weight_decay': 3.87720151008303e-07, 'epochs': 234, 'loss': 'mae', 'optimizer': 'adam', 'graph_mode': 'knn', 'source': 'grm', 'knn_k': 3, 'weighted_edges': True, 'symmetrize_mode': 'mutual', 'use_snp_selection': False}. Best is trial 11 with value: 0.09164985210562367.
[I 2025-11-03 11:41:31,771] Trial 14 finished with value: 0.03670292689037703 and parameters: {'model_type': 'gcn', 'hidden_dims': '[512, 256]', 'dropout': 0.33640886564480155, 'batch_norm': True, 'lr': 0.00025424642392072233, 'weight_decay': 5.098763140321504e-06, 'epochs': 297, 'loss': 'mse', 'optimizer': 'adam', 'graph_mode': 'knn', 'source': 'grm', 'knn_k': 4, 'weighted_edges': True, 'symmetrize_mode': 'mutual', 'use_snp_selection': False}. Best is trial 11 with value: 0.09164985210562367.
[I 2025-11-03 11:41:34,044] Trial 15 finished with value: 0.06949963008345435 and parameters: {'model_type': 'gcn', 'hidden_dims': '[512, 64]', 'dropout': 0.44099154398585816, 'batch_norm': True, 'lr': 7.092120321265845e-05, 'weight_decay': 1.8152037606406333e-06, 'epochs': 205, 'loss': 'mae', 'optimizer': 'adam', 'graph_mode': 'cutoff', 'cutoff': 0.4744944562988358, 'grm_norm': 'cosine', 'self_loops': True, 'use_snp_selection': False}. Best is trial 11 with value: 0.09164985210562367.
[I 2025-11-03 11:41:36,105] Trial 16 finished with value: 0.025929268588219572 and parameters: {'model_type': 'gcn', 'hidden_dims': '[256, 128, 64]', 'dropout': 0.24813958618908383, 'batch_norm': True, 'lr': 1.060811633453103e-05, 'weight_decay': 6.858520331233435e-07, 'epochs': 213, 'loss': 'mae', 'optimizer': 'adam', 'graph_mode': 'cutoff', 'cutoff': 0.8477330301700139, 'grm_norm': 'none', 'self_loops': True, 'use_snp_selection': False}. Best is trial 11 with value: 0.09164985210562367.
[I 2025-11-03 11:41:38,866] Trial 17 finished with value: 0.0438710758184077 and parameters: {'model_type': 'gcn', 'hidden_dims': '[512, 128]', 'dropout': 0.4663395208485065, 'batch_norm': True, 'lr': 9.097696221775466e-05, 'weight_decay': 0.00012257140891037648, 'epochs': 295, 'loss': 'mse', 'optimizer': 'adam', 'graph_mode': 'knn', 'source': 'grm', 'knn_k': 4, 'weighted_edges': False, 'symmetrize_mode': 'union', 'use_snp_selection': False}. Best is trial 11 with value: 0.09164985210562367.
[I 2025-11-03 11:41:41,092] Trial 18 finished with value: 0.10419890205992771 and parameters: {'model_type': 'gcn', 'hidden_dims': '[512, 256]', 'dropout': 0.3669972743083066, 'batch_norm': True, 'lr': 0.0003191943859326232, 'weight_decay': 8.983275654365809e-06, 'epochs': 194, 'loss': 'mse', 'optimizer': 'adam', 'graph_mode': 'cutoff', 'cutoff': 0.39226103399990825, 'grm_norm': 'cosine_then_gcn', 'self_loops': True, 'use_snp_selection': False}. Best is trial 18 with value: 0.10419890205992771.
[I 2025-11-03 11:41:44,030] Trial 19 finished with value: 0.04094012997583547 and parameters: {'model_type': 'gcn', 'hidden_dims': '[512, 256]', 'dropout': 0.3629165708762046, 'batch_norm': True, 'lr': 1.4719777247731438e-05, 'weight_decay': 5.7348827039208624e-06, 'epochs': 335, 'loss': 'mse', 'optimizer': 'adam', 'graph_mode': 'cutoff', 'cutoff': 0.4042893999293471, 'grm_norm': 'cosine_then_gcn', 'self_loops': True, 'use_snp_selection': False}. Best is trial 18 with value: 0.10419890205992771.
[I 2025-11-03 11:41:46,630] Trial 20 finished with value: -0.012759931095768777 and parameters: {'model_type': 'gcn', 'hidden_dims': '[512, 128]', 'dropout': 0.5741974551696398, 'batch_norm': True, 'lr': 3.6318419901982732e-06, 'weight_decay': 1.2843402138972306e-07, 'epochs': 269, 'loss': 'mse', 'optimizer': 'adam', 'graph_mode': 'cutoff', 'cutoff': 0.21218709727906532, 'grm_norm': 'cosine_then_gcn', 'self_loops': True, 'use_snp_selection': False}. Best is trial 18 with value: 0.10419890205992771.
[I 2025-11-03 11:41:48,854] Trial 21 finished with value: 0.10506642380607313 and parameters: {'model_type': 'gcn', 'hidden_dims': '[512, 256]', 'dropout': 0.36114839332067583, 'batch_norm': True, 'lr': 0.0002586975387634013, 'weight_decay': 1.6240869857250493e-05, 'epochs': 196, 'loss': 'mse', 'optimizer': 'adam', 'graph_mode': 'cutoff', 'cutoff': 0.4505133321052572, 'grm_norm': 'cosine', 'self_loops': True, 'use_snp_selection': False}. Best is trial 21 with value: 0.10506642380607313.
[I 2025-11-03 11:41:51,023] Trial 22 finished with value: 0.0903919704165028 and parameters: {'model_type': 'gcn', 'hidden_dims': '[512, 256]', 'dropout': 0.4684975429676387, 'batch_norm': True, 'lr': 6.083651762682816e-05, 'weight_decay': 1.963570794127037e-06, 'epochs': 185, 'loss': 'mse', 'optimizer': 'adam', 'graph_mode': 'cutoff', 'cutoff': 0.4484793664345037, 'grm_norm': 'cosine', 'self_loops': True, 'use_snp_selection': False}. Best is trial 21 with value: 0.10506642380607313.
[I 2025-11-03 11:41:52,971] Trial 23 finished with value: 0.04907580905548335 and parameters: {'model_type': 'gcn', 'hidden_dims': '[512, 256]', 'dropout': 0.38087279199185187, 'batch_norm': True, 'lr': 0.0003464989216623325, 'weight_decay': 8.538191975409848e-06, 'epochs': 141, 'loss': 'mse', 'optimizer': 'adam', 'graph_mode': 'cutoff', 'cutoff': 0.3503952154780404, 'grm_norm': 'cosine', 'self_loops': True, 'use_snp_selection': False}. Best is trial 21 with value: 0.10506642380607313.
[I 2025-11-03 11:41:55,476] Trial 24 finished with value: 0.10078885039300187 and parameters: {'model_type': 'gcn', 'hidden_dims': '[512, 256]', 'dropout': 0.3200571822561322, 'batch_norm': True, 'lr': 0.00021656210946406642, 'weight_decay': 5.2337428744204274e-05, 'epochs': 250, 'loss': 'mse', 'optimizer': 'adam', 'graph_mode': 'cutoff', 'cutoff': 0.5150773152103163, 'grm_norm': 'cosine_then_gcn', 'self_loops': True, 'use_snp_selection': False}. Best is trial 21 with value: 0.10506642380607313.
[I 2025-11-03 11:41:58,071] Trial 25 finished with value: 0.10085163942514219 and parameters: {'model_type': 'gcn', 'hidden_dims': '[512, 256]', 'dropout': 0.29990184150430066, 'batch_norm': True, 'lr': 0.0009781454116176084, 'weight_decay': 4.850911440346988e-05, 'epochs': 268, 'loss': 'mse', 'optimizer': 'adam', 'graph_mode': 'cutoff', 'cutoff': 0.5659459708216266, 'grm_norm': 'cosine_then_gcn', 'self_loops': True, 'use_snp_selection': False}. Best is trial 21 with value: 0.10506642380607313.
[I 2025-11-03 11:42:02,215] Trial 26 finished with value: 0.041309878600309956 and parameters: {'model_type': 'gcn', 'hidden_dims': '[512, 256]', 'dropout': 0.25962272964212385, 'batch_norm': False, 'lr': 0.0009588184831282252, 'weight_decay': 0.00019601038086210917, 'epochs': 300, 'loss': 'mse', 'optimizer': 'adam', 'graph_mode': 'cutoff', 'cutoff': 0.5652058458110091, 'grm_norm': 'cosine_then_gcn', 'self_loops': True, 'use_snp_selection': True, 'num_snps': 59005}. Best is trial 21 with value: 0.10506642380607313.
[I 2025-11-03 11:42:04,370] Trial 27 finished with value: 0.11512156344110545 and parameters: {'model_type': 'gcn', 'hidden_dims': '[512, 256]', 'dropout': 0.1808236578643972, 'batch_norm': True, 'lr': 0.0005361758933400431, 'weight_decay': 3.1822580120674596e-05, 'epochs': 182, 'loss': 'mse', 'optimizer': 'adam', 'graph_mode': 'cutoff', 'cutoff': 0.6414993555552015, 'grm_norm': 'cosine_then_gcn', 'self_loops': True, 'use_snp_selection': False}. Best is trial 27 with value: 0.11512156344110545.
[I 2025-11-03 11:42:06,132] Trial 28 finished with value: 0.10930533903282699 and parameters: {'model_type': 'gcn', 'hidden_dims': '[512, 256]', 'dropout': 0.19175414096095536, 'batch_norm': True, 'lr': 0.0004350473687268672, 'weight_decay': 1.3086101204124558e-05, 'epochs': 107, 'loss': 'mse', 'optimizer': 'adam', 'graph_mode': 'cutoff', 'cutoff': 0.6800861626623039, 'grm_norm': 'cosine_then_gcn', 'self_loops': True, 'use_snp_selection': False}. Best is trial 27 with value: 0.11512156344110545.
[I 2025-11-03 11:42:07,625] Trial 29 finished with value: 0.11804039863104254 and parameters: {'model_type': 'gcn', 'hidden_dims': '[256, 128, 64]', 'dropout': 0.1838816710593807, 'batch_norm': True, 'lr': 0.0005239100541207442, 'weight_decay': 3.4171608735159145e-05, 'epochs': 97, 'loss': 'mse', 'optimizer': 'adam', 'graph_mode': 'cutoff', 'cutoff': 0.6659934890129844, 'grm_norm': 'cosine_then_gcn', 'self_loops': True, 'use_snp_selection': False}. Best is trial 29 with value: 0.11804039863104254.
[I 2025-11-03 11:42:09,030] Trial 30 finished with value: 0.005803487771245642 and parameters: {'model_type': 'gcn', 'hidden_dims': '[256, 128, 64]', 'dropout': 0.18940987612261403, 'batch_norm': True, 'lr': 1.2963802273643008e-06, 'weight_decay': 8.976280485158775e-05, 'epochs': 77, 'loss': 'mse', 'optimizer': 'adam', 'graph_mode': 'cutoff', 'cutoff': 0.6971485929035621, 'grm_norm': 'cosine_then_gcn', 'self_loops': True, 'use_snp_selection': False}. Best is trial 29 with value: 0.11804039863104254.
[I 2025-11-03 11:42:10,806] Trial 31 finished with value: 0.11785017872298398 and parameters: {'model_type': 'gcn', 'hidden_dims': '[256, 128, 64]', 'dropout': 0.17847834377192906, 'batch_norm': True, 'lr': 0.0005089089593143393, 'weight_decay': 3.432805569088227e-05, 'epochs': 156, 'loss': 'mse', 'optimizer': 'adam', 'graph_mode': 'cutoff', 'cutoff': 0.6352615809846962, 'grm_norm': 'cosine_then_gcn', 'self_loops': True, 'use_snp_selection': False}. Best is trial 29 with value: 0.11804039863104254.
[I 2025-11-03 11:42:12,119] Trial 32 finished with value: 0.09711360528014926 and parameters: {'model_type': 'gcn', 'hidden_dims': '[256, 128, 64]', 'dropout': 0.18472056756566296, 'batch_norm': True, 'lr': 0.0005901224803799996, 'weight_decay': 3.943759448900356e-05, 'epochs': 57, 'loss': 'mse', 'optimizer': 'adam', 'graph_mode': 'cutoff', 'cutoff': 0.6448045346297486, 'grm_norm': 'cosine_then_gcn', 'self_loops': True, 'use_snp_selection': False}. Best is trial 29 with value: 0.11804039863104254.
[I 2025-11-03 11:42:13,677] Trial 33 finished with value: 0.10814120429522894 and parameters: {'model_type': 'gcn', 'hidden_dims': '[256, 128, 64]', 'dropout': 0.15201538434962075, 'batch_norm': True, 'lr': 0.00046660279798881136, 'weight_decay': 3.355680493745139e-05, 'epochs': 111, 'loss': 'mse', 'optimizer': 'adam', 'graph_mode': 'cutoff', 'cutoff': 0.7818170017857102, 'grm_norm': 'cosine_then_gcn', 'self_loops': True, 'use_snp_selection': False}. Best is trial 29 with value: 0.11804039863104254.
[I 2025-11-03 11:42:15,435] Trial 34 finished with value: 0.12224647455287384 and parameters: {'model_type': 'gcn', 'hidden_dims': '[256, 128, 64]', 'dropout': 0.2239497811252725, 'batch_norm': True, 'lr': 0.0004938920351681875, 'weight_decay': 0.00020914128019733144, 'epochs': 154, 'loss': 'mse', 'optimizer': 'adam', 'graph_mode': 'cutoff', 'cutoff': 0.6326143235380888, 'grm_norm': 'cosine_then_gcn', 'self_loops': True, 'use_snp_selection': False}. Best is trial 34 with value: 0.12224647455287384.
[I 2025-11-03 11:42:16,777] Trial 35 finished with value: 0.03632337527526899 and parameters: {'model_type': 'gcn', 'hidden_dims': '[256, 128, 64]', 'dropout': 0.23222222155362654, 'batch_norm': False, 'lr': 0.0006466171327118888, 'weight_decay': 0.0005388923568685339, 'epochs': 149, 'loss': 'mse', 'optimizer': 'adam', 'graph_mode': 'cutoff', 'cutoff': 0.6261824533020955, 'grm_norm': 'cosine_then_gcn', 'self_loops': True, 'use_snp_selection': True, 'num_snps': 2074}. Best is trial 34 with value: 0.12224647455287384.
[I 2025-11-03 11:42:18,581] Trial 36 finished with value: 0.09833258049226314 and parameters: {'model_type': 'gcn', 'hidden_dims': '[256, 128, 64]', 'dropout': 0.2181460305682979, 'batch_norm': True, 'lr': 0.0006837111882689964, 'weight_decay': 0.00013314330357375965, 'epochs': 161, 'loss': 'mse', 'optimizer': 'adam', 'graph_mode': 'cutoff', 'cutoff': 0.7431789461330748, 'grm_norm': 'cosine_then_gcn', 'self_loops': False, 'use_snp_selection': False}. Best is trial 34 with value: 0.12224647455287384.
[I 2025-11-03 11:42:19,960] Trial 37 finished with value: 0.02455219372377692 and parameters: {'model_type': 'gcn', 'hidden_dims': '[128, 64]', 'dropout': 0.15560036928100313, 'batch_norm': False, 'lr': 0.00011051624611738225, 'weight_decay': 0.0002881683866706608, 'epochs': 52, 'loss': 'mse', 'optimizer': 'adam', 'graph_mode': 'cutoff', 'cutoff': 0.612560145056309, 'grm_norm': 'gcn', 'self_loops': True, 'use_snp_selection': True, 'num_snps': 15344}. Best is trial 34 with value: 0.12224647455287384.
[I 2025-11-03 11:42:21,621] Trial 38 finished with value: 0.10858585768115234 and parameters: {'model_type': 'gcn', 'hidden_dims': '[256, 128]', 'dropout': 0.10436832089269099, 'batch_norm': True, 'lr': 0.0006634216109788232, 'weight_decay': 2.678599604573063e-05, 'epochs': 174, 'loss': 'mse', 'optimizer': 'adam', 'graph_mode': 'cutoff', 'cutoff': 0.7714712639129773, 'grm_norm': 'none', 'self_loops': True, 'use_snp_selection': False}. Best is trial 34 with value: 0.12224647455287384.
[I 2025-11-03 11:42:24,723] Trial 39 finished with value: 0.05646244479295196 and parameters: {'model_type': 'gcn', 'hidden_dims': '[256, 128, 64]', 'dropout': 0.14975464668080601, 'batch_norm': False, 'lr': 0.000447557846534789, 'weight_decay': 0.0006513368993264923, 'epochs': 124, 'loss': 'mse', 'optimizer': 'adam', 'graph_mode': 'cutoff', 'cutoff': 0.595837303222438, 'grm_norm': 'gcn', 'self_loops': False, 'use_snp_selection': True, 'num_snps': 58379}. Best is trial 34 with value: 0.12224647455287384.
[I 2025-11-03 11:42:26,551] Trial 40 finished with value: -0.0011892088695568033 and parameters: {'model_type': 'gcn', 'hidden_dims': '[256, 128, 64]', 'dropout': 0.12962994428858823, 'batch_norm': True, 'lr': 4.353876838784098e-05, 'weight_decay': 8.485058412751707e-05, 'epochs': 154, 'loss': 'mse', 'optimizer': 'adam', 'graph_mode': 'knn', 'source': 'grm', 'knn_k': 10, 'weighted_edges': False, 'symmetrize_mode': 'union', 'use_snp_selection': False}. Best is trial 34 with value: 0.12224647455287384.
[I 2025-11-03 11:42:27,826] Trial 41 finished with value: 0.10477018338334115 and parameters: {'model_type': 'gcn', 'hidden_dims': '[128, 64]', 'dropout': 0.20615785853938987, 'batch_norm': True, 'lr': 0.000360506373285876, 'weight_decay': 1.5108332851370001e-05, 'epochs': 109, 'loss': 'mse', 'optimizer': 'adam', 'graph_mode': 'cutoff', 'cutoff': 0.6713413130122069, 'grm_norm': 'cosine_then_gcn', 'self_loops': True, 'use_snp_selection': False}. Best is trial 34 with value: 0.12224647455287384.
[I 2025-11-03 11:42:29,301] Trial 42 finished with value: 0.11082764359962233 and parameters: {'model_type': 'gcn', 'hidden_dims': '[256, 128, 64]', 'dropout': 0.18002136367414864, 'batch_norm': True, 'lr': 0.0005167717410472091, 'weight_decay': 2.5989491982913635e-05, 'epochs': 90, 'loss': 'mse', 'optimizer': 'adam', 'graph_mode': 'cutoff', 'cutoff': 0.531789184647631, 'grm_norm': 'cosine_then_gcn', 'self_loops': True, 'use_snp_selection': False}. Best is trial 34 with value: 0.12224647455287384.
