[I 2025-11-03 15:05:59,707] Trial 117 finished with value: 0.08954329690669194 and parameters: {'model_type': 'graphsage', 'hidden_dims': '[512, 64]', 'dropout': 0.10185470540721216, 'batch_norm': True, 'lr': 0.000872487081314104, 'weight_decay': 1.0780997271556667e-06, 'epochs': 243, 'loss': 'mse', 'optimizer': 'adam', 'graph_mode': 'cutoff', 'cutoff': 0.5859189435029561, 'grm_norm': 'none', 'self_loops': True, 'use_snp_selection': False}. Best is trial 115 with value: 0.10532585301183989.
[I 2025-11-03 15:06:03,829] Trial 118 finished with value: 0.08504215419803299 and parameters: {'model_type': 'graphsage', 'hidden_dims': '[512, 64]', 'dropout': 0.13318040201968762, 'batch_norm': True, 'lr': 0.0007128633705892053, 'weight_decay': 1.8660316745056913e-06, 'epochs': 257, 'loss': 'mse', 'optimizer': 'adam', 'graph_mode': 'cutoff', 'cutoff': 0.570279410693818, 'grm_norm': 'none', 'self_loops': True, 'use_snp_selection': False}. Best is trial 115 with value: 0.10532585301183989.
[I 2025-11-03 15:06:06,613] Trial 119 finished with value: 0.10237514758577976 and parameters: {'model_type': 'graphsage', 'hidden_dims': '[256, 128, 64]', 'dropout': 0.1259942274474563, 'batch_norm': True, 'lr': 0.0006427921658709079, 'weight_decay': 1.2318277957763632e-06, 'epochs': 269, 'loss': 'mse', 'optimizer': 'adam', 'graph_mode': 'cutoff', 'cutoff': 0.5710324961733145, 'grm_norm': 'none', 'self_loops': True, 'use_snp_selection': False}. Best is trial 115 with value: 0.10532585301183989.
[I 2025-11-03 15:06:09,401] Trial 120 finished with value: 0.048116824956679224 and parameters: {'model_type': 'graphsage', 'hidden_dims': '[256, 128, 64]', 'dropout': 0.11168871150553819, 'batch_norm': True, 'lr': 1.9887065049195527e-05, 'weight_decay': 1.3124334522087453e-06, 'epochs': 270, 'loss': 'mse', 'optimizer': 'adam', 'graph_mode': 'cutoff', 'cutoff': 0.6033629398177924, 'grm_norm': 'none', 'self_loops': False, 'use_snp_selection': False}. Best is trial 115 with value: 0.10532585301183989.
[I 2025-11-03 15:06:12,091] Trial 121 finished with value: 0.09107143607791991 and parameters: {'model_type': 'graphsage', 'hidden_dims': '[256, 128, 64]', 'dropout': 0.12453313816165629, 'batch_norm': True, 'lr': 0.000662053068906596, 'weight_decay': 1.6268898054492307e-06, 'epochs': 249, 'loss': 'mse', 'optimizer': 'adam', 'graph_mode': 'cutoff', 'cutoff': 0.5373454738103275, 'grm_norm': 'none', 'self_loops': True, 'use_snp_selection': False}. Best is trial 115 with value: 0.10532585301183989.
[I 2025-11-03 15:06:14,708] Trial 122 finished with value: 0.04177114020477585 and parameters: {'model_type': 'graphsage', 'hidden_dims': '[256, 128, 64]', 'dropout': 0.11557579308184049, 'batch_norm': True, 'lr': 2.148487452890839e-06, 'weight_decay': 2.863879966703869e-06, 'epochs': 235, 'loss': 'mse', 'optimizer': 'adam', 'graph_mode': 'cutoff', 'cutoff': 0.61257632221141, 'grm_norm': 'none', 'self_loops': True, 'use_snp_selection': False}. Best is trial 115 with value: 0.10532585301183989.
[I 2025-11-03 15:06:17,446] Trial 123 finished with value: 0.08474993794473991 and parameters: {'model_type': 'graphsage', 'hidden_dims': '[256, 128, 64]', 'dropout': 0.12454359660569854, 'batch_norm': True, 'lr': 0.0004831969041735897, 'weight_decay': 2.178246301149124e-06, 'epochs': 259, 'loss': 'mse', 'optimizer': 'adam', 'graph_mode': 'cutoff', 'cutoff': 0.57496578867386, 'grm_norm': 'none', 'self_loops': True, 'use_snp_selection': False}. Best is trial 115 with value: 0.10532585301183989.
[I 2025-11-03 15:06:20,013] Trial 124 finished with value: 0.0832493134284406 and parameters: {'model_type': 'graphsage', 'hidden_dims': '[256, 128, 64]', 'dropout': 0.10959721509571167, 'batch_norm': True, 'lr': 0.0008542233651834684, 'weight_decay': 1.1536373192501676e-06, 'epochs': 224, 'loss': 'mse', 'optimizer': 'adam', 'graph_mode': 'cutoff', 'cutoff': 0.5373222587762448, 'grm_norm': 'none', 'self_loops': True, 'use_snp_selection': False}. Best is trial 115 with value: 0.10532585301183989.
[I 2025-11-03 15:06:22,659] Trial 125 finished with value: 0.08703065412895256 and parameters: {'model_type': 'graphsage', 'hidden_dims': '[256, 128, 64]', 'dropout': 0.13211571084135756, 'batch_norm': True, 'lr': 0.0005901646590840452, 'weight_decay': 1.617801663982948e-06, 'epochs': 240, 'loss': 'mse', 'optimizer': 'adam', 'graph_mode': 'cutoff', 'cutoff': 0.5177021493482119, 'grm_norm': 'none', 'self_loops': True, 'use_snp_selection': False}. Best is trial 115 with value: 0.10532585301183989.
[I 2025-11-03 15:06:25,523] Trial 126 finished with value: 0.0747580444922052 and parameters: {'model_type': 'graphsage', 'hidden_dims': '[256, 128, 64]', 'dropout': 0.10018230709728189, 'batch_norm': True, 'lr': 0.000663321428523136, 'weight_decay': 9.85189419029483e-07, 'epochs': 280, 'loss': 'mae', 'optimizer': 'adam', 'graph_mode': 'cutoff', 'cutoff': 0.48929564010441384, 'grm_norm': 'none', 'self_loops': True, 'use_snp_selection': False}. Best is trial 115 with value: 0.10532585301183989.
[I 2025-11-03 15:06:28,359] Trial 127 finished with value: 0.09814759160144639 and parameters: {'model_type': 'graphsage', 'hidden_dims': '[256, 128, 64]', 'dropout': 0.14533215482384296, 'batch_norm': False, 'lr': 0.00043989847184701614, 'weight_decay': 1.3168383869693896e-06, 'epochs': 229, 'loss': 'mse', 'optimizer': 'adam', 'graph_mode': 'cutoff', 'cutoff': 0.5709392989427259, 'grm_norm': 'none', 'self_loops': True, 'use_snp_selection': True, 'num_snps': 23439}. Best is trial 115 with value: 0.10532585301183989.
[I 2025-11-03 15:06:30,970] Trial 128 finished with value: 0.06540812013058209 and parameters: {'model_type': 'graphsage', 'hidden_dims': '[128, 64]', 'dropout': 0.14245400058032479, 'batch_norm': False, 'lr': 0.00042684575182677263, 'weight_decay': 2.0667242515943825e-06, 'epochs': 271, 'loss': 'mse', 'optimizer': 'adam', 'graph_mode': 'cutoff', 'cutoff': 0.5751006093372926, 'grm_norm': 'none', 'self_loops': True, 'use_snp_selection': True, 'num_snps': 23483}. Best is trial 115 with value: 0.10532585301183989.
[I 2025-11-03 15:06:34,219] Trial 129 finished with value: 0.05595096314849525 and parameters: {'model_type': 'graphsage', 'hidden_dims': '[256, 128, 64]', 'dropout': 0.15218345912647102, 'batch_norm': False, 'lr': 0.0005179076268821436, 'weight_decay': 1.5584409713987506e-06, 'epochs': 230, 'loss': 'mse', 'optimizer': 'adam', 'graph_mode': 'cutoff', 'cutoff': 0.5577254366821426, 'grm_norm': 'none', 'self_loops': True, 'use_snp_selection': True, 'num_snps': 34542}. Best is trial 115 with value: 0.10532585301183989.
[I 2025-11-03 15:06:36,357] Trial 130 finished with value: 0.050656924112686394 and parameters: {'model_type': 'graphsage', 'hidden_dims': '[512, 128]', 'dropout': 0.12135683758606969, 'batch_norm': False, 'lr': 0.0006662224506148529, 'weight_decay': 1.2605489024235323e-06, 'epochs': 246, 'loss': 'mse', 'optimizer': 'adam', 'graph_mode': 'cutoff', 'cutoff': 0.6200615239797059, 'grm_norm': 'none', 'self_loops': True, 'use_snp_selection': True, 'num_snps': 9422}. Best is trial 115 with value: 0.10532585301183989.
[I 2025-11-03 15:06:38,988] Trial 131 finished with value: 0.0859504500595594 and parameters: {'model_type': 'graphsage', 'hidden_dims': '[256, 128, 64]', 'dropout': 0.12951571106964382, 'batch_norm': False, 'lr': 0.0003584934214000164, 'weight_decay': 4.596954184973422e-07, 'epochs': 209, 'loss': 'mse', 'optimizer': 'adam', 'graph_mode': 'cutoff', 'cutoff': 0.5880601038535813, 'grm_norm': 'none', 'self_loops': True, 'use_snp_selection': True, 'num_snps': 20999}. Best is trial 115 with value: 0.10532585301183989.
[I 2025-11-03 15:06:41,989] Trial 132 finished with value: 0.07324242838288085 and parameters: {'model_type': 'graphsage', 'hidden_dims': '[256, 128, 64]', 'dropout': 0.14076339484395695, 'batch_norm': False, 'lr': 0.0007688208655976811, 'weight_decay': 1.0382150234945307e-06, 'epochs': 225, 'loss': 'mse', 'optimizer': 'adam', 'graph_mode': 'cutoff', 'cutoff': 0.564350229953254, 'grm_norm': 'none', 'self_loops': True, 'use_snp_selection': True, 'num_snps': 29032}. Best is trial 115 with value: 0.10532585301183989.
[I 2025-11-03 15:06:44,641] Trial 133 finished with value: 0.0744383959290052 and parameters: {'model_type': 'graphsage', 'hidden_dims': '[256, 128, 64]', 'dropout': 0.11119107536239717, 'batch_norm': True, 'lr': 0.0009053674455658662, 'weight_decay': 0.00015362245917849467, 'epochs': 234, 'loss': 'mse', 'optimizer': 'adam', 'graph_mode': 'cutoff', 'cutoff': 0.4642610571222286, 'grm_norm': 'none', 'self_loops': True, 'use_snp_selection': False}. Best is trial 115 with value: 0.10532585301183989.
[I 2025-11-03 15:06:47,404] Trial 134 finished with value: 0.09047727361860337 and parameters: {'model_type': 'graphsage', 'hidden_dims': '[256, 128, 64]', 'dropout': 0.1584324573241007, 'batch_norm': True, 'lr': 0.0004496815397819474, 'weight_decay': 7.511566530386554e-07, 'epochs': 264, 'loss': 'mse', 'optimizer': 'adam', 'graph_mode': 'cutoff', 'cutoff': 0.6507157786903993, 'grm_norm': 'none', 'self_loops': True, 'use_snp_selection': False}. Best is trial 115 with value: 0.10532585301183989.
[I 2025-11-03 15:06:50,124] Trial 135 finished with value: 0.058830557423034856 and parameters: {'model_type': 'graphsage', 'hidden_dims': '[256, 128, 64]', 'dropout': 0.1183493138649428, 'batch_norm': True, 'lr': 0.0006003814484217592, 'weight_decay': 1.7167904633121052e-06, 'epochs': 254, 'loss': 'mse', 'optimizer': 'adam', 'graph_mode': 'cutoff', 'cutoff': 0.4920212026934391, 'grm_norm': 'none', 'self_loops': False, 'use_snp_selection': False}. Best is trial 115 with value: 0.10532585301183989.
[I 2025-11-03 15:06:53,982] Trial 136 finished with value: 0.10515704190204184 and parameters: {'model_type': 'graphsage', 'hidden_dims': '[512, 64]', 'dropout': 0.140589904844051, 'batch_norm': True, 'lr': 0.0009983439842275686, 'weight_decay': 5.487522805770241e-07, 'epochs': 220, 'loss': 'mse', 'optimizer': 'adam', 'graph_mode': 'cutoff', 'cutoff': 0.5447125459814219, 'grm_norm': 'cosine', 'self_loops': True, 'use_snp_selection': False}. Best is trial 115 with value: 0.10532585301183989.
[I 2025-11-03 15:06:58,008] Trial 137 finished with value: 0.0702675925200665 and parameters: {'model_type': 'graphsage', 'hidden_dims': '[512, 64]', 'dropout': 0.1475112549158604, 'batch_norm': True, 'lr': 0.0008530811719791094, 'weight_decay': 9.232904286907525e-07, 'epochs': 242, 'loss': 'mse', 'optimizer': 'adam', 'graph_mode': 'cutoff', 'cutoff': 0.5457713768934085, 'grm_norm': 'cosine', 'self_loops': True, 'use_snp_selection': False}. Best is trial 115 with value: 0.10532585301183989.
[I 2025-11-03 15:07:02,927] Trial 138 finished with value: 0.07225538651792913 and parameters: {'model_type': 'graphsage', 'hidden_dims': '[512, 64]', 'dropout': 0.13725360605913867, 'batch_norm': False, 'lr': 0.000999108512050872, 'weight_decay': 6.185068552498161e-07, 'epochs': 225, 'loss': 'mse', 'optimizer': 'adam', 'graph_mode': 'cutoff', 'cutoff': 0.5290839972297636, 'grm_norm': 'cosine', 'self_loops': True, 'use_snp_selection': True, 'num_snps': 52199}. Best is trial 115 with value: 0.10532585301183989.
[I 2025-11-03 15:07:07,307] Trial 139 finished with value: 0.09848769238510251 and parameters: {'model_type': 'graphsage', 'hidden_dims': '[512, 64]', 'dropout': 0.16415975660876758, 'batch_norm': True, 'lr': 0.0007654579719561634, 'weight_decay': 1.3770415121148275e-06, 'epochs': 285, 'loss': 'mse', 'optimizer': 'adam', 'graph_mode': 'cutoff', 'cutoff': 0.5927861361268548, 'grm_norm': 'cosine', 'self_loops': True, 'use_snp_selection': False}. Best is trial 115 with value: 0.10532585301183989.
[I 2025-11-03 15:07:11,071] Trial 140 finished with value: 0.089324529871342 and parameters: {'model_type': 'graphsage', 'hidden_dims': '[512, 64]', 'dropout': 0.16623530392093264, 'batch_norm': True, 'lr': 0.0007609042221300824, 'weight_decay': 1.380907779469302e-06, 'epochs': 211, 'loss': 'mse', 'optimizer': 'adam', 'graph_mode': 'cutoff', 'cutoff': 0.5995403599622432, 'grm_norm': 'cosine', 'self_loops': True, 'use_snp_selection': False}. Best is trial 115 with value: 0.10532585301183989.
[I 2025-11-03 15:07:15,504] Trial 141 finished with value: 0.08261868471880135 and parameters: {'model_type': 'graphsage', 'hidden_dims': '[512, 64]', 'dropout': 0.14958198432230024, 'batch_norm': True, 'lr': 0.0006560021039903643, 'weight_decay': 1.2093790557232306e-06, 'epochs': 293, 'loss': 'mse', 'optimizer': 'adam', 'graph_mode': 'cutoff', 'cutoff': 0.5815311802714613, 'grm_norm': 'cosine', 'self_loops': True, 'use_snp_selection': False}. Best is trial 115 with value: 0.10532585301183989.
[I 2025-11-03 15:07:19,857] Trial 142 finished with value: 0.09639558574915591 and parameters: {'model_type': 'graphsage', 'hidden_dims': '[512, 64]', 'dropout': 0.1278033143445775, 'batch_norm': True, 'lr': 0.0005322722063430644, 'weight_decay': 5.337877202629354e-07, 'epochs': 283, 'loss': 'mse', 'optimizer': 'adam', 'graph_mode': 'cutoff', 'cutoff': 0.5547401867046098, 'grm_norm': 'cosine', 'self_loops': True, 'use_snp_selection': False}. Best is trial 115 with value: 0.10532585301183989.
[I 2025-11-03 15:07:24,248] Trial 143 finished with value: 0.06129126179901215 and parameters: {'model_type': 'graphsage', 'hidden_dims': '[512, 64]', 'dropout': 0.5701210886368522, 'batch_norm': True, 'lr': 0.0009950717391178207, 'weight_decay': 5.795176940796152e-07, 'epochs': 285, 'loss': 'mse', 'optimizer': 'adam', 'graph_mode': 'cutoff', 'cutoff': 0.5560210686524317, 'grm_norm': 'cosine', 'self_loops': True, 'use_snp_selection': False}. Best is trial 115 with value: 0.10532585301183989.
[I 2025-11-03 15:07:28,181] Trial 144 finished with value: 0.08948088230674431 and parameters: {'model_type': 'graphsage', 'hidden_dims': '[512, 64]', 'dropout': 0.12489571087871607, 'batch_norm': True, 'lr': 0.000767935197281269, 'weight_decay': 4.872185366475685e-07, 'epochs': 230, 'loss': 'mse', 'optimizer': 'adam', 'graph_mode': 'cutoff', 'cutoff': 0.568468117503296, 'grm_norm': 'cosine', 'self_loops': True, 'use_snp_selection': False}. Best is trial 115 with value: 0.10532585301183989.
[I 2025-11-03 15:07:32,156] Trial 145 finished with value: 0.08980648524047834 and parameters: {'model_type': 'graphsage', 'hidden_dims': '[512, 64]', 'dropout': 0.4634199535582908, 'batch_norm': True, 'lr': 0.000540129448586386, 'weight_decay': 8.282916118218829e-07, 'epochs': 236, 'loss': 'mse', 'optimizer': 'adam', 'graph_mode': 'cutoff', 'cutoff': 0.6082911454164367, 'grm_norm': 'cosine', 'self_loops': True, 'use_snp_selection': False}. Best is trial 115 with value: 0.10532585301183989.
[I 2025-11-03 15:07:36,350] Trial 146 finished with value: 0.09314873205174026 and parameters: {'model_type': 'graphsage', 'hidden_dims': '[512, 64]', 'dropout': 0.1596657545073339, 'batch_norm': True, 'lr': 0.0006410803456248734, 'weight_decay': 0.0005651363887689222, 'epochs': 260, 'loss': 'mse', 'optimizer': 'adam', 'graph_mode': 'cutoff', 'cutoff': 0.5404971976952421, 'grm_norm': 'cosine', 'self_loops': True, 'use_snp_selection': False}. Best is trial 115 with value: 0.10532585301183989.
[I 2025-11-03 15:07:40,530] Trial 147 finished with value: 0.08209847857273916 and parameters: {'model_type': 'graphsage', 'hidden_dims': '[512, 64]', 'dropout': 0.1888574052344467, 'batch_norm': True, 'lr': 0.0008739690874170454, 'weight_decay': 7.46583880407651e-05, 'epochs': 261, 'loss': 'mse', 'optimizer': 'adam', 'graph_mode': 'cutoff', 'cutoff': 0.6342018645712414, 'grm_norm': 'cosine', 'self_loops': False, 'use_snp_selection': False}. Best is trial 115 with value: 0.10532585301183989.
[I 2025-11-03 15:07:44,902] Trial 148 finished with value: 0.09276688191294458 and parameters: {'model_type': 'graphsage', 'hidden_dims': '[512, 64]', 'dropout': 0.1604637341964943, 'batch_norm': True, 'lr': 0.000625441200906548, 'weight_decay': 6.755926975394123e-07, 'epochs': 287, 'loss': 'mse', 'optimizer': 'adam', 'graph_mode': 'cutoff', 'cutoff': 0.5815286544530782, 'grm_norm': 'cosine', 'self_loops': True, 'use_snp_selection': False}. Best is trial 115 with value: 0.10532585301183989.
[I 2025-11-03 15:07:49,394] Trial 149 finished with value: 0.07420562993531683 and parameters: {'model_type': 'graphsage', 'hidden_dims': '[512, 64]', 'dropout': 0.1561465372020093, 'batch_norm': True, 'lr': 0.00040567028022616585, 'weight_decay': 0.0009879777612734552, 'epochs': 300, 'loss': 'mae', 'optimizer': 'adam', 'graph_mode': 'cutoff', 'cutoff': 0.5950180134188069, 'grm_norm': 'cosine', 'self_loops': True, 'use_snp_selection': False}. Best is trial 115 with value: 0.10532585301183989.
[I 2025-11-03 15:07:51,955] Trial 0 finished with value: -0.0037082180809744534 and parameters: {'model_type': 'graphsage', 'hidden_dims': '[128, 64]', 'dropout': 0.199031432379812, 'batch_norm': True, 'lr': 1.8408544111075837e-06, 'weight_decay': 5.5136510071208614e-05, 'epochs': 336, 'loss': 'mae', 'optimizer': 'adam', 'graph_mode': 'knn', 'source': 'grm', 'knn_k': 8, 'weighted_edges': True, 'symmetrize_mode': 'mutual', 'use_snp_selection': False}. Best is trial 0 with value: -0.0037082180809744534.
[I 2025-11-03 15:07:53,503] Trial 1 finished with value: 0.04824765021144777 and parameters: {'model_type': 'graphsage', 'hidden_dims': '[128, 64]', 'dropout': 0.40051947670227217, 'batch_norm': True, 'lr': 0.0005320428882732732, 'weight_decay': 1.89210117736594e-06, 'epochs': 68, 'loss': 'mse', 'optimizer': 'adam', 'graph_mode': 'knn', 'source': 'grm', 'knn_k': 7, 'weighted_edges': True, 'symmetrize_mode': 'union', 'use_snp_selection': False}. Best is trial 1 with value: 0.04824765021144777.
[I 2025-11-03 15:07:55,987] Trial 2 finished with value: 0.02725649023710057 and parameters: {'model_type': 'graphsage', 'hidden_dims': '[256, 128]', 'dropout': 0.5105528289184642, 'batch_norm': False, 'lr': 0.0006804279372404962, 'weight_decay': 0.0008922815224257085, 'epochs': 181, 'loss': 'mse', 'optimizer': 'adam', 'graph_mode': 'cutoff', 'cutoff': 0.5741905641612706, 'grm_norm': 'gcn', 'self_loops': False, 'use_snp_selection': True, 'num_snps': 26910}. Best is trial 1 with value: 0.04824765021144777.
[I 2025-11-03 15:07:58,682] Trial 3 finished with value: 0.017199834302287675 and parameters: {'model_type': 'graphsage', 'hidden_dims': '[256, 128, 64]', 'dropout': 0.5390483213624292, 'batch_norm': False, 'lr': 3.4705625989073525e-05, 'weight_decay': 2.4623319020131338e-05, 'epochs': 121, 'loss': 'mse', 'optimizer': 'adam', 'graph_mode': 'knn', 'source': 'grm', 'knn_k': 6, 'weighted_edges': False, 'symmetrize_mode': 'mutual', 'use_snp_selection': True, 'num_snps': 30713}. Best is trial 1 with value: 0.04824765021144777.
[I 2025-11-03 15:08:01,342] Trial 4 finished with value: 0.017696376519152356 and parameters: {'model_type': 'graphsage', 'hidden_dims': '[128, 64]', 'dropout': 0.13404863676897502, 'batch_norm': False, 'lr': 0.0001431556295367288, 'weight_decay': 2.2084517750726675e-05, 'epochs': 51, 'loss': 'mae', 'optimizer': 'adam', 'graph_mode': 'cutoff', 'cutoff': 0.6714268476993044, 'grm_norm': 'none', 'self_loops': False, 'use_snp_selection': True, 'num_snps': 45645}. Best is trial 1 with value: 0.04824765021144777.
[I 2025-11-03 15:08:04,536] Trial 5 finished with value: 0.023358054861267047 and parameters: {'model_type': 'graphsage', 'hidden_dims': '[256, 128]', 'dropout': 0.42253606323412096, 'batch_norm': False, 'lr': 4.238630400638805e-05, 'weight_decay': 8.074086040046576e-07, 'epochs': 158, 'loss': 'mae', 'optimizer': 'adam', 'graph_mode': 'knn', 'source': 'grm', 'knn_k': 1, 'weighted_edges': False, 'symmetrize_mode': 'mutual', 'use_snp_selection': True, 'num_snps': 43113}. Best is trial 1 with value: 0.04824765021144777.
[I 2025-11-03 15:08:08,462] Trial 6 finished with value: 0.03942909151791347 and parameters: {'model_type': 'graphsage', 'hidden_dims': '[512, 256]', 'dropout': 0.3534893146320237, 'batch_norm': True, 'lr': 0.000251307964226932, 'weight_decay': 1.821819791794022e-05, 'epochs': 223, 'loss': 'mae', 'optimizer': 'adam', 'graph_mode': 'knn', 'source': 'grm', 'knn_k': 1, 'weighted_edges': True, 'symmetrize_mode': 'mutual', 'use_snp_selection': False}. Best is trial 1 with value: 0.04824765021144777.
[I 2025-11-03 15:08:12,070] Trial 7 finished with value: 0.02105379107319345 and parameters: {'model_type': 'graphsage', 'hidden_dims': '[512, 256]', 'dropout': 0.1105825955860775, 'batch_norm': True, 'lr': 2.374338412754043e-05, 'weight_decay': 1.1284721123340274e-05, 'epochs': 190, 'loss': 'mse', 'optimizer': 'adam', 'graph_mode': 'cutoff', 'cutoff': 0.719872204109604, 'grm_norm': 'gcn', 'self_loops': False, 'use_snp_selection': False}. Best is trial 1 with value: 0.04824765021144777.
[I 2025-11-03 15:08:15,388] Trial 8 finished with value: 0.045774346580698254 and parameters: {'model_type': 'graphsage', 'hidden_dims': '[512, 128]', 'dropout': 0.5066580418354021, 'batch_norm': True, 'lr': 0.00039213678276659976, 'weight_decay': 3.43655320802934e-06, 'epochs': 120, 'loss': 'mse', 'optimizer': 'adam', 'graph_mode': 'cutoff', 'cutoff': 0.34923059576505366, 'grm_norm': 'cosine', 'self_loops': True, 'use_snp_selection': False}. Best is trial 1 with value: 0.04824765021144777.
[I 2025-11-03 15:08:17,460] Trial 9 finished with value: 0.031464917365086754 and parameters: {'model_type': 'graphsage', 'hidden_dims': '[512, 256]', 'dropout': 0.301734920240333, 'batch_norm': False, 'lr': 6.650961854953448e-06, 'weight_decay': 6.861575656590315e-05, 'epochs': 150, 'loss': 'mae', 'optimizer': 'adam', 'graph_mode': 'cutoff', 'cutoff': 0.2857569870061939, 'grm_norm': 'cosine_then_gcn', 'self_loops': False, 'use_snp_selection': True, 'num_snps': 12722}. Best is trial 1 with value: 0.04824765021144777.
