[I 2025-11-03 12:00:29,192] Trial 67 finished with value: -0.047320131427172674 and parameters: {'model_type': 'gcn', 'hidden_dims': '[512, 128]', 'dropout': 0.3377884596780776, 'batch_norm': True, 'lr': 2.4840268297653594e-05, 'weight_decay': 8.040077314511901e-05, 'epochs': 84, 'loss': 'mse', 'optimizer': 'adam', 'graph_mode': 'knn', 'source': 'grm', 'knn_k': 6, 'weighted_edges': False, 'symmetrize_mode': 'mutual', 'use_snp_selection': False}. Best is trial 40 with value: 0.10707079639337991.
[I 2025-11-03 12:00:32,784] Trial 68 finished with value: 0.02809258716577259 and parameters: {'model_type': 'gcn', 'hidden_dims': '[128, 64]', 'dropout': 0.2690068770506004, 'batch_norm': False, 'lr': 3.482744806476268e-05, 'weight_decay': 0.00015562238399428852, 'epochs': 209, 'loss': 'mae', 'optimizer': 'adam', 'graph_mode': 'cutoff', 'cutoff': 0.7300258062230663, 'grm_norm': 'gcn', 'self_loops': False, 'use_snp_selection': True, 'num_snps': 57012}. Best is trial 40 with value: 0.10707079639337991.
[I 2025-11-03 12:00:35,190] Trial 69 finished with value: 0.011022910644531076 and parameters: {'model_type': 'gcn', 'hidden_dims': '[256, 128]', 'dropout': 0.2316355423871463, 'batch_norm': True, 'lr': 5.501792251160296e-05, 'weight_decay': 3.952756784220181e-06, 'epochs': 237, 'loss': 'mae', 'optimizer': 'adam', 'graph_mode': 'knn', 'source': 'grm', 'knn_k': 9, 'weighted_edges': False, 'symmetrize_mode': 'mutual', 'use_snp_selection': False}. Best is trial 40 with value: 0.10707079639337991.
[I 2025-11-03 12:00:39,647] Trial 70 finished with value: 0.004669722616211993 and parameters: {'model_type': 'gcn', 'hidden_dims': '[512, 64]', 'dropout': 0.5008958114613455, 'batch_norm': False, 'lr': 0.0003346981488401922, 'weight_decay': 5.388564568748451e-05, 'epochs': 156, 'loss': 'mse', 'optimizer': 'adam', 'graph_mode': 'cutoff', 'cutoff': 0.8428518847234868, 'grm_norm': 'none', 'self_loops': False, 'use_snp_selection': True, 'num_snps': 59994}. Best is trial 40 with value: 0.10707079639337991.
[I 2025-11-03 12:00:44,996] Trial 71 finished with value: 0.09463707989686933 and parameters: {'model_type': 'gcn', 'hidden_dims': '[512, 128]', 'dropout': 0.1749671754681665, 'batch_norm': False, 'lr': 4.766376022747302e-05, 'weight_decay': 1.9232602247067063e-06, 'epochs': 302, 'loss': 'mae', 'optimizer': 'adam', 'graph_mode': 'cutoff', 'cutoff': 0.8415100898846498, 'grm_norm': 'none', 'self_loops': True, 'use_snp_selection': True, 'num_snps': 56698}. Best is trial 40 with value: 0.10707079639337991.
[I 2025-11-03 12:00:50,149] Trial 72 finished with value: 0.1041078986578647 and parameters: {'model_type': 'gcn', 'hidden_dims': '[512, 128]', 'dropout': 0.12513303814145949, 'batch_norm': False, 'lr': 0.00014317328265758578, 'weight_decay': 1.6798897927377286e-05, 'epochs': 289, 'loss': 'mae', 'optimizer': 'adam', 'graph_mode': 'cutoff', 'cutoff': 0.7750460899119632, 'grm_norm': 'none', 'self_loops': True, 'use_snp_selection': True, 'num_snps': 55142}. Best is trial 40 with value: 0.10707079639337991.
[I 2025-11-03 12:00:54,497] Trial 73 finished with value: 0.08713689185637218 and parameters: {'model_type': 'gcn', 'hidden_dims': '[512, 128]', 'dropout': 0.12553630310778593, 'batch_norm': False, 'lr': 0.00013966675331061968, 'weight_decay': 8.451572700393095e-06, 'epochs': 295, 'loss': 'mae', 'optimizer': 'adam', 'graph_mode': 'cutoff', 'cutoff': 0.8339237030041163, 'grm_norm': 'none', 'self_loops': True, 'use_snp_selection': True, 'num_snps': 41466}. Best is trial 40 with value: 0.10707079639337991.
[I 2025-11-03 12:00:58,900] Trial 74 finished with value: 0.0788813220703022 and parameters: {'model_type': 'gcn', 'hidden_dims': '[512, 128]', 'dropout': 0.12384872017341901, 'batch_norm': False, 'lr': 0.00013637812872206118, 'weight_decay': 8.312631204439956e-06, 'epochs': 296, 'loss': 'mae', 'optimizer': 'adam', 'graph_mode': 'cutoff', 'cutoff': 0.8363138024790633, 'grm_norm': 'none', 'self_loops': True, 'use_snp_selection': True, 'num_snps': 41927}. Best is trial 40 with value: 0.10707079639337991.
[I 2025-11-03 12:01:02,777] Trial 75 finished with value: 0.07469569458051989 and parameters: {'model_type': 'gcn', 'hidden_dims': '[512, 128]', 'dropout': 0.10187319967301695, 'batch_norm': False, 'lr': 9.267496630391307e-05, 'weight_decay': 1.577553178176346e-05, 'epochs': 307, 'loss': 'mae', 'optimizer': 'adam', 'graph_mode': 'cutoff', 'cutoff': 0.7816527071581265, 'grm_norm': 'none', 'self_loops': True, 'use_snp_selection': True, 'num_snps': 33410}. Best is trial 40 with value: 0.10707079639337991.
[I 2025-11-03 12:01:06,808] Trial 76 finished with value: 0.0788248151284981 and parameters: {'model_type': 'gcn', 'hidden_dims': '[512, 128]', 'dropout': 0.14472512503953675, 'batch_norm': False, 'lr': 0.00011033554021902016, 'weight_decay': 2.2301330176539474e-06, 'epochs': 262, 'loss': 'mae', 'optimizer': 'adam', 'graph_mode': 'cutoff', 'cutoff': 0.8651881227756056, 'grm_norm': 'none', 'self_loops': True, 'use_snp_selection': True, 'num_snps': 40127}. Best is trial 40 with value: 0.10707079639337991.
[I 2025-11-03 12:01:11,600] Trial 77 finished with value: 0.07165671913389476 and parameters: {'model_type': 'gcn', 'hidden_dims': '[512, 128]', 'dropout': 0.12869629023084606, 'batch_norm': False, 'lr': 0.00017887958857939828, 'weight_decay': 4.614275492507987e-06, 'epochs': 315, 'loss': 'mae', 'optimizer': 'adam', 'graph_mode': 'cutoff', 'cutoff': 0.824975031240053, 'grm_norm': 'none', 'self_loops': True, 'use_snp_selection': True, 'num_snps': 46480}. Best is trial 40 with value: 0.10707079639337991.
[I 2025-11-03 12:01:16,762] Trial 78 finished with value: 0.09197693984085278 and parameters: {'model_type': 'gcn', 'hidden_dims': '[512, 128]', 'dropout': 0.16836099385979197, 'batch_norm': False, 'lr': 6.841949463251071e-05, 'weight_decay': 2.887296072719633e-06, 'epochs': 289, 'loss': 'mae', 'optimizer': 'adam', 'graph_mode': 'cutoff', 'cutoff': 0.7925505025503035, 'grm_norm': 'none', 'self_loops': True, 'use_snp_selection': True, 'num_snps': 54798}. Best is trial 40 with value: 0.10707079639337991.
[I 2025-11-03 12:01:21,805] Trial 79 finished with value: 0.07044969648467318 and parameters: {'model_type': 'gcn', 'hidden_dims': '[512, 128]', 'dropout': 0.16900764596660647, 'batch_norm': False, 'lr': 3.9855350501870987e-05, 'weight_decay': 2.553688931780261e-06, 'epochs': 279, 'loss': 'mae', 'optimizer': 'adam', 'graph_mode': 'cutoff', 'cutoff': 0.7930115288291699, 'grm_norm': 'none', 'self_loops': True, 'use_snp_selection': True, 'num_snps': 54013}. Best is trial 40 with value: 0.10707079639337991.
[I 2025-11-03 12:01:27,110] Trial 80 finished with value: 0.07469893646880357 and parameters: {'model_type': 'gcn', 'hidden_dims': '[512, 128]', 'dropout': 0.15346872675644624, 'batch_norm': False, 'lr': 5.855142509707895e-05, 'weight_decay': 6.8654111470504995e-06, 'epochs': 294, 'loss': 'mae', 'optimizer': 'adam', 'graph_mode': 'cutoff', 'cutoff': 0.7151167666955636, 'grm_norm': 'none', 'self_loops': True, 'use_snp_selection': True, 'num_snps': 56414}. Best is trial 40 with value: 0.10707079639337991.
[I 2025-11-03 12:01:32,806] Trial 81 finished with value: 0.1031173912705313 and parameters: {'model_type': 'gcn', 'hidden_dims': '[512, 128]', 'dropout': 0.13849273126990994, 'batch_norm': False, 'lr': 0.0002384293071573801, 'weight_decay': 2.899125790617347e-05, 'epochs': 343, 'loss': 'mae', 'optimizer': 'adam', 'graph_mode': 'cutoff', 'cutoff': 0.866265695240571, 'grm_norm': 'none', 'self_loops': True, 'use_snp_selection': True, 'num_snps': 57260}. Best is trial 40 with value: 0.10707079639337991.
[I 2025-11-03 12:01:38,113] Trial 82 finished with value: 0.0908813794731952 and parameters: {'model_type': 'gcn', 'hidden_dims': '[512, 128]', 'dropout': 0.13679109365240177, 'batch_norm': False, 'lr': 0.0002369229593639541, 'weight_decay': 1.1238461873291815e-05, 'epochs': 334, 'loss': 'mae', 'optimizer': 'adam', 'graph_mode': 'cutoff', 'cutoff': 0.8538865868649903, 'grm_norm': 'none', 'self_loops': True, 'use_snp_selection': True, 'num_snps': 52651}. Best is trial 40 with value: 0.10707079639337991.
[I 2025-11-03 12:01:43,420] Trial 83 finished with value: 0.08771800102530304 and parameters: {'model_type': 'gcn', 'hidden_dims': '[512, 128]', 'dropout': 0.11518807094326942, 'batch_norm': False, 'lr': 0.00024981247782770213, 'weight_decay': 1.783188888795717e-05, 'epochs': 335, 'loss': 'mae', 'optimizer': 'adam', 'graph_mode': 'cutoff', 'cutoff': 0.8694063165909994, 'grm_norm': 'none', 'self_loops': True, 'use_snp_selection': True, 'num_snps': 52259}. Best is trial 40 with value: 0.10707079639337991.
[I 2025-11-03 12:01:48,757] Trial 84 finished with value: 0.07056801234096019 and parameters: {'model_type': 'gcn', 'hidden_dims': '[512, 128]', 'dropout': 0.11162386964593245, 'batch_norm': False, 'lr': 0.0002540718127270482, 'weight_decay': 2.6534836041438245e-05, 'epochs': 346, 'loss': 'mae', 'optimizer': 'adam', 'graph_mode': 'cutoff', 'cutoff': 0.8614756878595458, 'grm_norm': 'none', 'self_loops': True, 'use_snp_selection': True, 'num_snps': 51706}. Best is trial 40 with value: 0.10707079639337991.
[I 2025-11-03 12:01:54,421] Trial 85 finished with value: 0.09495472512188573 and parameters: {'model_type': 'gcn', 'hidden_dims': '[512, 128]', 'dropout': 0.15623230357081883, 'batch_norm': False, 'lr': 0.0003574451614599608, 'weight_decay': 1.7845491524511657e-05, 'epochs': 334, 'loss': 'mae', 'optimizer': 'adam', 'graph_mode': 'cutoff', 'cutoff': 0.8939620269950103, 'grm_norm': 'none', 'self_loops': True, 'use_snp_selection': True, 'num_snps': 57559}. Best is trial 40 with value: 0.10707079639337991.
[I 2025-11-03 12:02:00,086] Trial 86 finished with value: 0.08934937149879678 and parameters: {'model_type': 'gcn', 'hidden_dims': '[512, 128]', 'dropout': 0.15679353132988727, 'batch_norm': False, 'lr': 0.0005078530345460691, 'weight_decay': 1.3065380279140135e-05, 'epochs': 333, 'loss': 'mae', 'optimizer': 'adam', 'graph_mode': 'cutoff', 'cutoff': 0.8974192605607377, 'grm_norm': 'none', 'self_loops': True, 'use_snp_selection': True, 'num_snps': 57942}. Best is trial 40 with value: 0.10707079639337991.
[I 2025-11-03 12:02:04,924] Trial 87 finished with value: 0.09112944440597472 and parameters: {'model_type': 'gcn', 'hidden_dims': '[256, 128, 64]', 'dropout': 0.20839313732772993, 'batch_norm': False, 'lr': 0.00034989479564387333, 'weight_decay': 1.7905787931839143e-06, 'epochs': 333, 'loss': 'mae', 'optimizer': 'adam', 'graph_mode': 'cutoff', 'cutoff': 0.8080519259268283, 'grm_norm': 'none', 'self_loops': True, 'use_snp_selection': True, 'num_snps': 56503}. Best is trial 40 with value: 0.10707079639337991.
[I 2025-11-03 12:02:09,859] Trial 88 finished with value: 0.06945699519284593 and parameters: {'model_type': 'gcn', 'hidden_dims': '[256, 128, 64]', 'dropout': 0.20187557855982607, 'batch_norm': False, 'lr': 0.0006883966975225051, 'weight_decay': 1.8254116908686467e-06, 'epochs': 340, 'loss': 'mae', 'optimizer': 'adam', 'graph_mode': 'cutoff', 'cutoff': 0.8025141519477909, 'grm_norm': 'none', 'self_loops': True, 'use_snp_selection': True, 'num_snps': 57490}. Best is trial 40 with value: 0.10707079639337991.
[I 2025-11-03 12:02:14,560] Trial 89 finished with value: 0.07527135855344397 and parameters: {'model_type': 'gcn', 'hidden_dims': '[256, 128, 64]', 'dropout': 0.18635852225257737, 'batch_norm': False, 'lr': 0.0003595285346111419, 'weight_decay': 1.6883412974610383e-06, 'epochs': 315, 'loss': 'mae', 'optimizer': 'adam', 'graph_mode': 'cutoff', 'cutoff': 0.7746888783168735, 'grm_norm': 'none', 'self_loops': True, 'use_snp_selection': True, 'num_snps': 55314}. Best is trial 40 with value: 0.10707079639337991.
[I 2025-11-03 12:02:18,582] Trial 90 finished with value: -0.027167206090166714 and parameters: {'model_type': 'gcn', 'hidden_dims': '[128, 64]', 'dropout': 0.5968721318561121, 'batch_norm': False, 'lr': 0.0009537552150665223, 'weight_decay': 3.0871963116120323e-06, 'epochs': 322, 'loss': 'mae', 'optimizer': 'adam', 'graph_mode': 'cutoff', 'cutoff': 0.817817458180966, 'grm_norm': 'cosine', 'self_loops': True, 'use_snp_selection': True, 'num_snps': 58383}. Best is trial 40 with value: 0.10707079639337991.
[I 2025-11-03 12:02:23,253] Trial 91 finished with value: 0.06543993024861054 and parameters: {'model_type': 'gcn', 'hidden_dims': '[256, 128, 64]', 'dropout': 0.17497954129909485, 'batch_norm': False, 'lr': 0.00041848516272691795, 'weight_decay': 1.1071487863512685e-06, 'epochs': 331, 'loss': 'mae', 'optimizer': 'adam', 'graph_mode': 'cutoff', 'cutoff': 0.8522185405886099, 'grm_norm': 'none', 'self_loops': True, 'use_snp_selection': True, 'num_snps': 53351}. Best is trial 40 with value: 0.10707079639337991.
[I 2025-11-03 12:02:28,188] Trial 92 finished with value: 0.08298327667880721 and parameters: {'model_type': 'gcn', 'hidden_dims': '[256, 128, 64]', 'dropout': 0.13898939703106766, 'batch_norm': False, 'lr': 0.00019192165729042883, 'weight_decay': 2.1290891978729015e-05, 'epochs': 342, 'loss': 'mae', 'optimizer': 'adam', 'graph_mode': 'cutoff', 'cutoff': 0.8848025923288302, 'grm_norm': 'none', 'self_loops': True, 'use_snp_selection': True, 'num_snps': 56420}. Best is trial 40 with value: 0.10707079639337991.
[I 2025-11-03 12:02:33,409] Trial 93 finished with value: 0.0767962125627675 and parameters: {'model_type': 'gcn', 'hidden_dims': '[512, 128]', 'dropout': 0.15816478964965872, 'batch_norm': False, 'lr': 0.0004734793338430519, 'weight_decay': 5.508536955893735e-06, 'epochs': 316, 'loss': 'mae', 'optimizer': 'adam', 'graph_mode': 'cutoff', 'cutoff': 0.8073263683095406, 'grm_norm': 'none', 'self_loops': True, 'use_snp_selection': True, 'num_snps': 51158}. Best is trial 40 with value: 0.10707079639337991.
[I 2025-11-03 12:02:36,115] Trial 94 finished with value: 0.09357374776371524 and parameters: {'model_type': 'gcn', 'hidden_dims': '[128, 64]', 'dropout': 0.14662195261507732, 'batch_norm': False, 'lr': 0.0005989771467929937, 'weight_decay': 3.0786388415560294e-05, 'epochs': 330, 'loss': 'mae', 'optimizer': 'adam', 'graph_mode': 'cutoff', 'cutoff': 0.8661430107808283, 'grm_norm': 'cosine_then_gcn', 'self_loops': True, 'use_snp_selection': True, 'num_snps': 21882}. Best is trial 40 with value: 0.10707079639337991.
[I 2025-11-03 12:02:38,829] Trial 95 finished with value: 0.07720061796958896 and parameters: {'model_type': 'gcn', 'hidden_dims': '[128, 64]', 'dropout': 0.16761192292752009, 'batch_norm': False, 'lr': 0.000608056375775338, 'weight_decay': 2.9756505707953718e-05, 'epochs': 350, 'loss': 'mae', 'optimizer': 'adam', 'graph_mode': 'cutoff', 'cutoff': 0.7385557223473554, 'grm_norm': 'cosine_then_gcn', 'self_loops': True, 'use_snp_selection': True, 'num_snps': 20453}. Best is trial 40 with value: 0.10707079639337991.
[I 2025-11-03 12:02:41,539] Trial 96 finished with value: 0.06496503202655463 and parameters: {'model_type': 'gcn', 'hidden_dims': '[128, 64]', 'dropout': 0.14888061582164602, 'batch_norm': False, 'lr': 0.00033345527925198566, 'weight_decay': 0.000242401094387265, 'epochs': 304, 'loss': 'mae', 'optimizer': 'adam', 'graph_mode': 'cutoff', 'cutoff': 0.7802081517859368, 'grm_norm': 'cosine_then_gcn', 'self_loops': True, 'use_snp_selection': True, 'num_snps': 24425}. Best is trial 40 with value: 0.10707079639337991.
[I 2025-11-03 12:02:43,736] Trial 97 finished with value: 0.03523306580086724 and parameters: {'model_type': 'gcn', 'hidden_dims': '[128, 64]', 'dropout': 0.19015428177064014, 'batch_norm': False, 'lr': 0.00015313877564479108, 'weight_decay': 4.8135188956824985e-05, 'epochs': 289, 'loss': 'mae', 'optimizer': 'adam', 'graph_mode': 'cutoff', 'cutoff': 0.8777503274476766, 'grm_norm': 'cosine_then_gcn', 'self_loops': True, 'use_snp_selection': True, 'num_snps': 10452}. Best is trial 40 with value: 0.10707079639337991.
[I 2025-11-03 12:02:46,227] Trial 98 finished with value: 0.08925149966613832 and parameters: {'model_type': 'gcn', 'hidden_dims': '[128, 64]', 'dropout': 0.12434396236192255, 'batch_norm': False, 'lr': 0.00028414586010825336, 'weight_decay': 8.816339632580215e-07, 'epochs': 324, 'loss': 'mae', 'optimizer': 'adam', 'graph_mode': 'cutoff', 'cutoff': 0.8222439601685935, 'grm_norm': 'cosine_then_gcn', 'self_loops': True, 'use_snp_selection': True, 'num_snps': 17644}. Best is trial 40 with value: 0.10707079639337991.
[I 2025-11-03 12:02:51,731] Trial 99 finished with value: 0.07936910448019689 and parameters: {'model_type': 'gcn', 'hidden_dims': '[512, 256]', 'dropout': 0.20429117315714848, 'batch_norm': False, 'lr': 0.0007749791806081673, 'weight_decay': 2.6768889653008566e-06, 'epochs': 306, 'loss': 'mae', 'optimizer': 'adam', 'graph_mode': 'cutoff', 'cutoff': 0.8983870689577079, 'grm_norm': 'none', 'self_loops': True, 'use_snp_selection': True, 'num_snps': 58232}. Best is trial 40 with value: 0.10707079639337991.
[I 2025-11-03 12:02:55,512] Trial 100 finished with value: 0.036630724157692 and parameters: {'model_type': 'gcn', 'hidden_dims': '[128, 64]', 'dropout': 0.1736298918175922, 'batch_norm': False, 'lr': 4.8129303131281435e-05, 'weight_decay': 3.61145012125799e-05, 'epochs': 272, 'loss': 'mae', 'optimizer': 'adam', 'graph_mode': 'cutoff', 'cutoff': 0.6927927074566143, 'grm_norm': 'cosine_then_gcn', 'self_loops': True, 'use_snp_selection': True, 'num_snps': 55508}. Best is trial 40 with value: 0.10707079639337991.
[I 2025-11-03 12:03:00,958] Trial 101 finished with value: 0.10202584112014411 and parameters: {'model_type': 'gcn', 'hidden_dims': '[512, 128]', 'dropout': 0.1394521367491452, 'batch_norm': False, 'lr': 0.00022580490164574954, 'weight_decay': 1.3949023627648078e-05, 'epochs': 341, 'loss': 'mae', 'optimizer': 'adam', 'graph_mode': 'cutoff', 'cutoff': 0.8561567754480848, 'grm_norm': 'none', 'self_loops': True, 'use_snp_selection': True, 'num_snps': 53854}. Best is trial 40 with value: 0.10707079639337991.
[I 2025-11-03 12:03:04,611] Trial 102 finished with value: 0.08226218516208601 and parameters: {'model_type': 'gcn', 'hidden_dims': '[512, 128]', 'dropout': 0.1453239758203986, 'batch_norm': False, 'lr': 0.0006006209535139182, 'weight_decay': 0.0004079368299895019, 'epochs': 328, 'loss': 'mae', 'optimizer': 'adam', 'graph_mode': 'cutoff', 'cutoff': 0.845129847108087, 'grm_norm': 'none', 'self_loops': True, 'use_snp_selection': True, 'num_snps': 29041}. Best is trial 40 with value: 0.10707079639337991.
[I 2025-11-03 12:03:08,900] Trial 103 finished with value: 0.085676491568282 and parameters: {'model_type': 'gcn', 'hidden_dims': '[256, 128]', 'dropout': 0.21263036395614035, 'batch_norm': False, 'lr': 0.0004536286807849932, 'weight_decay': 1.643971013783396e-05, 'epochs': 312, 'loss': 'mae', 'optimizer': 'adam', 'graph_mode': 'cutoff', 'cutoff': 0.7653855446630006, 'grm_norm': 'cosine', 'self_loops': True, 'use_snp_selection': True, 'num_snps': 53748}. Best is trial 40 with value: 0.10707079639337991.
[I 2025-11-03 12:03:12,531] Trial 104 finished with value: 0.049065503252284176 and parameters: {'model_type': 'gcn', 'hidden_dims': '[128, 64]', 'dropout': 0.10615561061362636, 'batch_norm': False, 'lr': 6.614072536421631e-05, 'weight_decay': 6.050941515036644e-07, 'epochs': 343, 'loss': 'mae', 'optimizer': 'adam', 'graph_mode': 'cutoff', 'cutoff': 0.8149617947541867, 'grm_norm': 'none', 'self_loops': True, 'use_snp_selection': True, 'num_snps': 47720}. Best is trial 40 with value: 0.10707079639337991.
[I 2025-11-03 12:03:17,099] Trial 105 finished with value: 0.08080603872314585 and parameters: {'model_type': 'gcn', 'hidden_dims': '[256, 128, 64]', 'dropout': 0.1589613559819706, 'batch_norm': False, 'lr': 0.00037150519316101854, 'weight_decay': 1.3799109682188324e-05, 'epochs': 340, 'loss': 'mae', 'optimizer': 'adam', 'graph_mode': 'cutoff', 'cutoff': 0.7945705695110238, 'grm_norm': 'gcn', 'self_loops': True, 'use_snp_selection': True, 'num_snps': 49873}. Best is trial 40 with value: 0.10707079639337991.
[I 2025-11-03 12:03:21,439] Trial 106 finished with value: 0.02149805630857317 and parameters: {'model_type': 'gcn', 'hidden_dims': '[512, 128]', 'dropout': 0.12146989232363223, 'batch_norm': False, 'lr': 0.00020710838750355234, 'weight_decay': 2.182091378198348e-05, 'epochs': 145, 'loss': 'mae', 'optimizer': 'adam', 'graph_mode': 'cutoff', 'cutoff': 0.21525466446070785, 'grm_norm': 'none', 'self_loops': True, 'use_snp_selection': True, 'num_snps': 58193}. Best is trial 40 with value: 0.10707079639337991.
[I 2025-11-03 12:03:24,912] Trial 107 finished with value: 0.09670448312249803 and parameters: {'model_type': 'gcn', 'hidden_dims': '[128, 64]', 'dropout': 0.13092033639362108, 'batch_norm': False, 'lr': 0.00027267654605560033, 'weight_decay': 1.5388549133889008e-06, 'epochs': 169, 'loss': 'mae', 'optimizer': 'adam', 'graph_mode': 'cutoff', 'cutoff': 0.8786561224156955, 'grm_norm': 'gcn', 'self_loops': True, 'use_snp_selection': True, 'num_snps': 56423}. Best is trial 40 with value: 0.10707079639337991.
[I 2025-11-03 12:03:28,503] Trial 108 finished with value: 0.07887303534903077 and parameters: {'model_type': 'gcn', 'hidden_dims': '[128, 64]', 'dropout': 0.1348253501089333, 'batch_norm': False, 'lr': 0.00016094811390889076, 'weight_decay': 1.4000251432574588e-06, 'epochs': 176, 'loss': 'mae', 'optimizer': 'adam', 'graph_mode': 'cutoff', 'cutoff': 0.8696137383165473, 'grm_norm': 'gcn', 'self_loops': True, 'use_snp_selection': True, 'num_snps': 59737}. Best is trial 40 with value: 0.10707079639337991.
[I 2025-11-03 12:03:31,908] Trial 109 finished with value: 0.057057487662004754 and parameters: {'model_type': 'gcn', 'hidden_dims': '[128, 64]', 'dropout': 0.11246297533603165, 'batch_norm': False, 'lr': 0.00012076274945122727, 'weight_decay': 0.0006226106348732443, 'epochs': 160, 'loss': 'mae', 'optimizer': 'adam', 'graph_mode': 'cutoff', 'cutoff': 0.8786847947371403, 'grm_norm': 'gcn', 'self_loops': True, 'use_snp_selection': True, 'num_snps': 55538}. Best is trial 40 with value: 0.10707079639337991.
