[I 2025-11-12 05:16:14,949] Trial 108 finished with value: 0.2174515818482162 and parameters: {'model_type': 'graphsage', 'hidden_dims': '[256, 128, 64]', 'dropout': 0.22952642709237386, 'batch_norm': False, 'lr': 5.175305468180251e-06, 'weight_decay': 0.0002815806341540688, 'epochs': 46, 'loss': 'mae', 'optimizer': 'adam', 'graph_mode': 'cutoff', 'cutoff': 0.8700677093296932, 'grm_norm': 'none', 'self_loops': False, 'use_snp_selection': True, 'num_snps': 41719}. Best is trial 50 with value: 0.2535306602402755.
[I 2025-11-12 05:17:17,514] Trial 109 finished with value: 0.2282348915596671 and parameters: {'model_type': 'graphsage', 'hidden_dims': '[512, 256]', 'dropout': 0.32696364845230674, 'batch_norm': False, 'lr': 2.564703302705694e-05, 'weight_decay': 4.403230989750401e-06, 'epochs': 65, 'loss': 'mse', 'optimizer': 'adam', 'graph_mode': 'cutoff', 'cutoff': 0.8439820885465782, 'grm_norm': 'cosine_then_gcn', 'self_loops': False, 'use_snp_selection': False}. Best is trial 50 with value: 0.2535306602402755.
[I 2025-11-12 05:18:52,520] Trial 110 finished with value: 0.2211481473272819 and parameters: {'model_type': 'graphsage', 'hidden_dims': '[512, 64]', 'dropout': 0.3008609315150223, 'batch_norm': True, 'lr': 2.1441079607006483e-05, 'weight_decay': 3.2030057277917723e-06, 'epochs': 83, 'loss': 'mae', 'optimizer': 'adam', 'graph_mode': 'cutoff', 'cutoff': 0.726727487708309, 'grm_norm': 'cosine_then_gcn', 'self_loops': False, 'use_snp_selection': True, 'num_snps': 36581}. Best is trial 50 with value: 0.2535306602402755.
[I 2025-11-12 05:20:25,675] Trial 111 finished with value: 0.2399391224349428 and parameters: {'model_type': 'graphsage', 'hidden_dims': '[512, 64]', 'dropout': 0.25973380870678453, 'batch_norm': False, 'lr': 2.879015362791635e-05, 'weight_decay': 2.0518029437173456e-06, 'epochs': 74, 'loss': 'mae', 'optimizer': 'adam', 'graph_mode': 'cutoff', 'cutoff': 0.8334202258101759, 'grm_norm': 'cosine_then_gcn', 'self_loops': False, 'use_snp_selection': True, 'num_snps': 38156}. Best is trial 50 with value: 0.2535306602402755.
[I 2025-11-12 05:22:01,185] Trial 112 finished with value: 0.24814629448880635 and parameters: {'model_type': 'graphsage', 'hidden_dims': '[512, 64]', 'dropout': 0.24118839445290033, 'batch_norm': False, 'lr': 9.077555295876096e-06, 'weight_decay': 1.5846576418753732e-06, 'epochs': 79, 'loss': 'mae', 'optimizer': 'adam', 'graph_mode': 'cutoff', 'cutoff': 0.8187149411563567, 'grm_norm': 'cosine_then_gcn', 'self_loops': False, 'use_snp_selection': True, 'num_snps': 38443}. Best is trial 50 with value: 0.2535306602402755.
[I 2025-11-12 05:23:55,014] Trial 113 finished with value: 0.23168213851637182 and parameters: {'model_type': 'graphsage', 'hidden_dims': '[512, 64]', 'dropout': 0.24432856729639305, 'batch_norm': False, 'lr': 9.072999218529621e-06, 'weight_decay': 1.53686693297163e-06, 'epochs': 106, 'loss': 'mae', 'optimizer': 'adam', 'graph_mode': 'cutoff', 'cutoff': 0.8151557271147772, 'grm_norm': 'cosine_then_gcn', 'self_loops': False, 'use_snp_selection': True, 'num_snps': 43641}. Best is trial 50 with value: 0.2535306602402755.
[I 2025-11-12 05:25:35,607] Trial 114 finished with value: 0.25059698799887004 and parameters: {'model_type': 'graphsage', 'hidden_dims': '[512, 64]', 'dropout': 0.2821028488073638, 'batch_norm': False, 'lr': 1.1515251571532851e-05, 'weight_decay': 1.1035328146498203e-06, 'epochs': 91, 'loss': 'mae', 'optimizer': 'adam', 'graph_mode': 'cutoff', 'cutoff': 0.7898593718947164, 'grm_norm': 'cosine_then_gcn', 'self_loops': False, 'use_snp_selection': True, 'num_snps': 38841}. Best is trial 50 with value: 0.2535306602402755.
[I 2025-11-12 05:26:48,463] Trial 115 finished with value: 0.22645271700771813 and parameters: {'model_type': 'graphsage', 'hidden_dims': '[128, 64]', 'dropout': 0.28709176267499253, 'batch_norm': False, 'lr': 1.0945455547783123e-05, 'weight_decay': 1.110117405271016e-06, 'epochs': 88, 'loss': 'mae', 'optimizer': 'adam', 'graph_mode': 'cutoff', 'cutoff': 0.7562487459735217, 'grm_norm': 'cosine_then_gcn', 'self_loops': False, 'use_snp_selection': True, 'num_snps': 39307}. Best is trial 50 with value: 0.2535306602402755.
[I 2025-11-12 05:30:12,538] Trial 116 finished with value: 0.2279168882948163 and parameters: {'model_type': 'graphsage', 'hidden_dims': '[512, 64]', 'dropout': 0.2543741947414236, 'batch_norm': False, 'lr': 1.2072462446849183e-05, 'weight_decay': 4.3786885774032085e-07, 'epochs': 350, 'loss': 'mae', 'optimizer': 'adam', 'graph_mode': 'cutoff', 'cutoff': 0.7872242049936168, 'grm_norm': 'cosine', 'self_loops': False, 'use_snp_selection': True, 'num_snps': 40836}. Best is trial 50 with value: 0.2535306602402755.
[I 2025-11-12 05:31:36,797] Trial 117 finished with value: 0.10586184728987154 and parameters: {'model_type': 'graphsage', 'hidden_dims': '[512, 64]', 'dropout': 0.2239753105211184, 'batch_norm': False, 'lr': 0.00024117807002008783, 'weight_decay': 5.737453081997683e-07, 'epochs': 58, 'loss': 'mae', 'optimizer': 'adam', 'graph_mode': 'cutoff', 'cutoff': 0.7731606655802892, 'grm_norm': 'cosine_then_gcn', 'self_loops': False, 'use_snp_selection': True, 'num_snps': 35785}. Best is trial 50 with value: 0.2535306602402755.
[I 2025-11-12 05:34:31,496] Trial 118 finished with value: 0.23272227726693373 and parameters: {'model_type': 'graphsage', 'hidden_dims': '[512, 64]', 'dropout': 0.20707366183637343, 'batch_norm': False, 'lr': 1.4560182208094073e-06, 'weight_decay': 9.038962511928786e-07, 'epochs': 306, 'loss': 'mae', 'optimizer': 'adam', 'graph_mode': 'knn', 'source': 'grm', 'knn_k': 2, 'weighted_edges': False, 'symmetrize_mode': 'mutual', 'use_snp_selection': True, 'num_snps': 33206}. Best is trial 50 with value: 0.2535306602402755.
[I 2025-11-12 05:36:18,431] Trial 119 finished with value: 0.22712172021977137 and parameters: {'model_type': 'graphsage', 'hidden_dims': '[512, 128]', 'dropout': 0.26682251716586025, 'batch_norm': False, 'lr': 5.89642893500857e-06, 'weight_decay': 7.813278640369976e-07, 'epochs': 81, 'loss': 'mae', 'optimizer': 'adam', 'graph_mode': 'cutoff', 'cutoff': 0.80073464551841, 'grm_norm': 'cosine_then_gcn', 'self_loops': True, 'use_snp_selection': True, 'num_snps': 45712}. Best is trial 50 with value: 0.2535306602402755.
[I 2025-11-12 05:37:34,631] Trial 120 finished with value: 0.23923011575389563 and parameters: {'model_type': 'graphsage', 'hidden_dims': '[256, 128]', 'dropout': 0.10036968999219836, 'batch_norm': False, 'lr': 1.6310417898706838e-05, 'weight_decay': 2.2368524945642316e-07, 'epochs': 67, 'loss': 'mae', 'optimizer': 'adam', 'graph_mode': 'cutoff', 'cutoff': 0.8875919291823204, 'grm_norm': 'cosine_then_gcn', 'self_loops': False, 'use_snp_selection': True, 'num_snps': 37181}. Best is trial 50 with value: 0.2535306602402755.
[I 2025-11-12 05:39:14,405] Trial 121 finished with value: 0.2542564255643375 and parameters: {'model_type': 'graphsage', 'hidden_dims': '[512, 64]', 'dropout': 0.27597417632895693, 'batch_norm': False, 'lr': 7.706221700121801e-06, 'weight_decay': 1.7868231207422526e-06, 'epochs': 93, 'loss': 'mae', 'optimizer': 'adam', 'graph_mode': 'cutoff', 'cutoff': 0.8657110886590728, 'grm_norm': 'cosine_then_gcn', 'self_loops': False, 'use_snp_selection': True, 'num_snps': 38154}. Best is trial 121 with value: 0.2542564255643375.
[I 2025-11-12 05:40:58,682] Trial 122 finished with value: 0.2484291221429645 and parameters: {'model_type': 'graphsage', 'hidden_dims': '[512, 64]', 'dropout': 0.23745276228109677, 'batch_norm': False, 'lr': 4.908044444243233e-06, 'weight_decay': 1.5962090620830043e-06, 'epochs': 100, 'loss': 'mae', 'optimizer': 'adam', 'graph_mode': 'cutoff', 'cutoff': 0.8614438407000378, 'grm_norm': 'cosine_then_gcn', 'self_loops': False, 'use_snp_selection': True, 'num_snps': 39166}. Best is trial 121 with value: 0.2542564255643375.
[I 2025-11-12 05:44:22,446] Trial 123 finished with value: 0.22857880870809422 and parameters: {'model_type': 'graphsage', 'hidden_dims': '[512, 64]', 'dropout': 0.23503447694046456, 'batch_norm': False, 'lr': 3.3547603115754316e-06, 'weight_decay': 3.58035359740719e-07, 'epochs': 331, 'loss': 'mae', 'optimizer': 'adam', 'graph_mode': 'cutoff', 'cutoff': 0.8624783133382345, 'grm_norm': 'cosine_then_gcn', 'self_loops': False, 'use_snp_selection': True, 'num_snps': 42236}. Best is trial 121 with value: 0.2542564255643375.
[I 2025-11-12 05:46:55,834] Trial 124 finished with value: 0.21198757259793824 and parameters: {'model_type': 'graphsage', 'hidden_dims': '[512, 64]', 'dropout': 0.251216033419489, 'batch_norm': False, 'lr': 5.002565961307163e-06, 'weight_decay': 1.8143302429653378e-06, 'epochs': 230, 'loss': 'mae', 'optimizer': 'adam', 'graph_mode': 'cutoff', 'cutoff': 0.8214147919281276, 'grm_norm': 'cosine_then_gcn', 'self_loops': False, 'use_snp_selection': True, 'num_snps': 38801}. Best is trial 121 with value: 0.2542564255643375.
[I 2025-11-12 05:48:33,261] Trial 125 finished with value: 0.22711861580784878 and parameters: {'model_type': 'graphsage', 'hidden_dims': '[512, 64]', 'dropout': 0.27477476178069987, 'batch_norm': False, 'lr': 7.476897990908755e-06, 'weight_decay': 2.703177651447656e-06, 'epochs': 76, 'loss': 'mae', 'optimizer': 'adam', 'graph_mode': 'cutoff', 'cutoff': 0.8784506475359248, 'grm_norm': 'cosine_then_gcn', 'self_loops': False, 'use_snp_selection': True, 'num_snps': 40062}. Best is trial 121 with value: 0.2542564255643375.
[I 2025-11-12 05:49:59,266] Trial 126 finished with value: 0.22696758288883592 and parameters: {'model_type': 'graphsage', 'hidden_dims': '[256, 128, 64]', 'dropout': 0.2447033205292602, 'batch_norm': False, 'lr': 4.657457257349735e-06, 'weight_decay': 1.1214281860044591e-06, 'epochs': 91, 'loss': 'mae', 'optimizer': 'adam', 'graph_mode': 'cutoff', 'cutoff': 0.8997219446859727, 'grm_norm': 'cosine_then_gcn', 'self_loops': False, 'use_snp_selection': True, 'num_snps': 40920}. Best is trial 121 with value: 0.2542564255643375.
[I 2025-11-12 05:52:31,697] Trial 127 finished with value: 0.2388879626128504 and parameters: {'model_type': 'graphsage', 'hidden_dims': '[512, 64]', 'dropout': 0.2801400362548129, 'batch_norm': False, 'lr': 6.067097495580758e-06, 'weight_decay': 7.126193236303523e-05, 'epochs': 196, 'loss': 'mae', 'optimizer': 'adam', 'graph_mode': 'cutoff', 'cutoff': 0.8526416182163273, 'grm_norm': 'cosine_then_gcn', 'self_loops': False, 'use_snp_selection': True, 'num_snps': 44024}. Best is trial 121 with value: 0.2542564255643375.
[I 2025-11-12 05:53:56,051] Trial 128 finished with value: 0.2521372425379438 and parameters: {'model_type': 'graphsage', 'hidden_dims': '[512, 64]', 'dropout': 0.26245420288610666, 'batch_norm': False, 'lr': 8.348042999084384e-06, 'weight_decay': 2.725810006174807e-07, 'epochs': 52, 'loss': 'mae', 'optimizer': 'adam', 'graph_mode': 'cutoff', 'cutoff': 0.8661801848755041, 'grm_norm': 'cosine', 'self_loops': False, 'use_snp_selection': True, 'num_snps': 37670}. Best is trial 121 with value: 0.2542564255643375.
[I 2025-11-12 05:55:15,908] Trial 129 finished with value: 0.19767083707786187 and parameters: {'model_type': 'graphsage', 'hidden_dims': '[512, 64]', 'dropout': 0.19082808959990402, 'batch_norm': False, 'lr': 3.6008065232123757e-06, 'weight_decay': 2.50682806884178e-07, 'epochs': 40, 'loss': 'mae', 'optimizer': 'adam', 'graph_mode': 'cutoff', 'cutoff': 0.864046781855679, 'grm_norm': 'cosine', 'self_loops': False, 'use_snp_selection': True, 'num_snps': 37442}. Best is trial 121 with value: 0.2542564255643375.
[I 2025-11-12 05:56:11,135] Trial 130 finished with value: 0.21190586332230796 and parameters: {'model_type': 'graphsage', 'hidden_dims': '[512, 64]', 'dropout': 0.21615539101020284, 'batch_norm': True, 'lr': 1.3207736443075587e-05, 'weight_decay': 2.4098700290184556e-06, 'epochs': 52, 'loss': 'mae', 'optimizer': 'adam', 'graph_mode': 'cutoff', 'cutoff': 0.7036326341609586, 'grm_norm': 'cosine', 'self_loops': False, 'use_snp_selection': False}. Best is trial 121 with value: 0.2542564255643375.
[I 2025-11-12 05:57:40,163] Trial 131 finished with value: 0.22353455777680473 and parameters: {'model_type': 'graphsage', 'hidden_dims': '[512, 64]', 'dropout': 0.2659742008881967, 'batch_norm': False, 'lr': 9.588051394730386e-06, 'weight_decay': 1.7806926724495602e-07, 'epochs': 61, 'loss': 'mae', 'optimizer': 'adam', 'graph_mode': 'cutoff', 'cutoff': 0.8394597814610213, 'grm_norm': 'cosine', 'self_loops': False, 'use_snp_selection': True, 'num_snps': 38932}. Best is trial 121 with value: 0.2542564255643375.
[I 2025-11-12 05:59:04,512] Trial 132 finished with value: 0.2170561286858063 and parameters: {'model_type': 'graphsage', 'hidden_dims': '[512, 64]', 'dropout': 0.2581798465262349, 'batch_norm': False, 'lr': 7.877271658820602e-06, 'weight_decay': 2.7920931730042896e-07, 'epochs': 53, 'loss': 'mae', 'optimizer': 'adam', 'graph_mode': 'cutoff', 'cutoff': 0.8838076352595744, 'grm_norm': 'cosine', 'self_loops': False, 'use_snp_selection': True, 'num_snps': 36523}. Best is trial 121 with value: 0.2542564255643375.
[I 2025-11-12 06:00:37,077] Trial 133 finished with value: 0.2186968616281189 and parameters: {'model_type': 'graphsage', 'hidden_dims': '[512, 64]', 'dropout': 0.23597523031606576, 'batch_norm': False, 'lr': 6.593192921724286e-06, 'weight_decay': 4.7001315465560797e-07, 'epochs': 70, 'loss': 'mae', 'optimizer': 'adam', 'graph_mode': 'cutoff', 'cutoff': 0.8142857054270893, 'grm_norm': 'gcn', 'self_loops': False, 'use_snp_selection': True, 'num_snps': 39863}. Best is trial 121 with value: 0.2542564255643375.
[I 2025-11-12 06:02:05,127] Trial 134 finished with value: 0.24216820683571635 and parameters: {'model_type': 'graphsage', 'hidden_dims': '[512, 64]', 'dropout': 0.28993700986849935, 'batch_norm': False, 'lr': 8.903131823450892e-06, 'weight_decay': 1.7086620733235179e-06, 'epochs': 48, 'loss': 'mae', 'optimizer': 'adam', 'graph_mode': 'cutoff', 'cutoff': 0.8288785654888213, 'grm_norm': 'cosine_then_gcn', 'self_loops': False, 'use_snp_selection': True, 'num_snps': 42274}. Best is trial 121 with value: 0.2542564255643375.
[I 2025-11-12 06:03:40,022] Trial 135 finished with value: 0.21995012713558829 and parameters: {'model_type': 'graphsage', 'hidden_dims': '[512, 128]', 'dropout': 0.24538547523529605, 'batch_norm': False, 'lr': 1.1910316628328224e-05, 'weight_decay': 6.921875988922764e-07, 'epochs': 83, 'loss': 'mse', 'optimizer': 'adam', 'graph_mode': 'cutoff', 'cutoff': 0.8676020512116299, 'grm_norm': 'none', 'self_loops': False, 'use_snp_selection': True, 'num_snps': 38190}. Best is trial 121 with value: 0.2542564255643375.
[I 2025-11-12 06:06:44,683] Trial 136 finished with value: 0.23395772948375182 and parameters: {'model_type': 'graphsage', 'hidden_dims': '[512, 64]', 'dropout': 0.2736369835794702, 'batch_norm': False, 'lr': 0.00029869927600869597, 'weight_decay': 3.242385499150141e-07, 'epochs': 293, 'loss': 'mae', 'optimizer': 'adam', 'graph_mode': 'cutoff', 'cutoff': 0.8492987202205297, 'grm_norm': 'cosine_then_gcn', 'self_loops': False, 'use_snp_selection': True, 'num_snps': 41795}. Best is trial 121 with value: 0.2542564255643375.
[I 2025-11-12 06:07:59,748] Trial 137 finished with value: 0.24150799354219768 and parameters: {'model_type': 'graphsage', 'hidden_dims': '[256, 128, 64]', 'dropout': 0.2958298395724501, 'batch_norm': False, 'lr': 0.0002021081043200187, 'weight_decay': 8.414894673651513e-06, 'epochs': 68, 'loss': 'mae', 'optimizer': 'adam', 'graph_mode': 'cutoff', 'cutoff': 0.8048434395789742, 'grm_norm': 'cosine', 'self_loops': True, 'use_snp_selection': True, 'num_snps': 34568}. Best is trial 121 with value: 0.2542564255643375.
[I 2025-11-12 06:09:38,165] Trial 138 finished with value: 0.23190371233552068 and parameters: {'model_type': 'graphsage', 'hidden_dims': '[512, 64]', 'dropout': 0.2592784465195981, 'batch_norm': False, 'lr': 4.195879596712106e-06, 'weight_decay': 9.580530220775476e-07, 'epochs': 91, 'loss': 'mae', 'optimizer': 'adam', 'graph_mode': 'cutoff', 'cutoff': 0.8585244683096759, 'grm_norm': 'cosine_then_gcn', 'self_loops': False, 'use_snp_selection': True, 'num_snps': 36767}. Best is trial 121 with value: 0.2542564255643375.
[I 2025-11-12 06:11:36,197] Trial 139 finished with value: 0.23620657681715523 and parameters: {'model_type': 'graphsage', 'hidden_dims': '[512, 64]', 'dropout': 0.23063208212709974, 'batch_norm': False, 'lr': 1.4286781696453449e-05, 'weight_decay': 5.14278591205576e-06, 'epochs': 101, 'loss': 'mae', 'optimizer': 'adam', 'graph_mode': 'cutoff', 'cutoff': 0.6535853883383057, 'grm_norm': 'cosine_then_gcn', 'self_loops': False, 'use_snp_selection': True, 'num_snps': 47152}. Best is trial 121 with value: 0.2542564255643375.
[I 2025-11-12 06:13:47,083] Trial 140 finished with value: 0.23407511929172772 and parameters: {'model_type': 'graphsage', 'hidden_dims': '[512, 256]', 'dropout': 0.277926870048317, 'batch_norm': False, 'lr': 8.594221943671921e-06, 'weight_decay': 5.948164632391955e-07, 'epochs': 60, 'loss': 'mae', 'optimizer': 'adam', 'graph_mode': 'knn', 'source': 'grm', 'knn_k': 7, 'weighted_edges': True, 'symmetrize_mode': 'union', 'use_snp_selection': True, 'num_snps': 40811}. Best is trial 121 with value: 0.2542564255643375.
[I 2025-11-12 06:15:25,319] Trial 141 finished with value: 0.2186712795619242 and parameters: {'model_type': 'graphsage', 'hidden_dims': '[512, 64]', 'dropout': 0.4979575010992366, 'batch_norm': False, 'lr': 2.5735214411481047e-06, 'weight_decay': 1.3584977587576662e-06, 'epochs': 98, 'loss': 'mae', 'optimizer': 'adam', 'graph_mode': 'cutoff', 'cutoff': 0.8370960407475474, 'grm_norm': 'cosine_then_gcn', 'self_loops': False, 'use_snp_selection': True, 'num_snps': 35175}. Best is trial 121 with value: 0.2542564255643375.
[I 2025-11-12 06:17:11,865] Trial 142 finished with value: 0.22975506186194933 and parameters: {'model_type': 'graphsage', 'hidden_dims': '[512, 64]', 'dropout': 0.2983667330445774, 'batch_norm': False, 'lr': 1.124503239413688e-05, 'weight_decay': 1.4060673626429342e-06, 'epochs': 110, 'loss': 'mae', 'optimizer': 'adam', 'graph_mode': 'cutoff', 'cutoff': 0.7914144937153941, 'grm_norm': 'cosine_then_gcn', 'self_loops': False, 'use_snp_selection': True, 'num_snps': 37932}. Best is trial 121 with value: 0.2542564255643375.
[I 2025-11-12 06:19:01,365] Trial 143 finished with value: 0.23898058643616324 and parameters: {'model_type': 'graphsage', 'hidden_dims': '[512, 64]', 'dropout': 0.3569373012725639, 'batch_norm': False, 'lr': 1.8472902442546877e-05, 'weight_decay': 1.2070815786571332e-06, 'epochs': 76, 'loss': 'mae', 'optimizer': 'adam', 'graph_mode': 'cutoff', 'cutoff': 0.7343325467589908, 'grm_norm': 'cosine_then_gcn', 'self_loops': False, 'use_snp_selection': True, 'num_snps': 49922}. Best is trial 121 with value: 0.2542564255643375.
[I 2025-11-12 06:20:38,375] Trial 144 finished with value: 0.23807332911036788 and parameters: {'model_type': 'graphsage', 'hidden_dims': '[512, 64]', 'dropout': 0.2879452879741073, 'batch_norm': False, 'lr': 7.161583519609638e-06, 'weight_decay': 2.0847831426473915e-06, 'epochs': 94, 'loss': 'mae', 'optimizer': 'adam', 'graph_mode': 'cutoff', 'cutoff': 0.826487770655068, 'grm_norm': 'cosine_then_gcn', 'self_loops': False, 'use_snp_selection': True, 'num_snps': 35720}. Best is trial 121 with value: 0.2542564255643375.
[I 2025-11-12 06:21:51,853] Trial 145 finished with value: 0.23522892849931862 and parameters: {'model_type': 'graphsage', 'hidden_dims': '[128, 64]', 'dropout': 0.2661811029912095, 'batch_norm': False, 'lr': 0.00015399171711252032, 'weight_decay': 3.1259959977586243e-06, 'epochs': 87, 'loss': 'mae', 'optimizer': 'adam', 'graph_mode': 'cutoff', 'cutoff': 0.8803752626397966, 'grm_norm': 'cosine_then_gcn', 'self_loops': False, 'use_snp_selection': True, 'num_snps': 39506}. Best is trial 121 with value: 0.2542564255643375.
[I 2025-11-12 06:24:01,921] Trial 146 finished with value: 0.23307628514528803 and parameters: {'model_type': 'graphsage', 'hidden_dims': '[512, 64]', 'dropout': 0.37399908251638425, 'batch_norm': False, 'lr': 9.458261725193226e-05, 'weight_decay': 1.9416677050640648e-05, 'epochs': 208, 'loss': 'mae', 'optimizer': 'adam', 'graph_mode': 'cutoff', 'cutoff': 0.7798804956878433, 'grm_norm': 'cosine_then_gcn', 'self_loops': False, 'use_snp_selection': True, 'num_snps': 34001}. Best is trial 121 with value: 0.2542564255643375.
[I 2025-11-12 06:25:56,785] Trial 147 finished with value: 0.24049164641745852 and parameters: {'model_type': 'graphsage', 'hidden_dims': '[512, 64]', 'dropout': 0.3163996901392381, 'batch_norm': False, 'lr': 5.770079962424103e-06, 'weight_decay': 1.6285960539081012e-06, 'epochs': 103, 'loss': 'mae', 'optimizer': 'adam', 'graph_mode': 'cutoff', 'cutoff': 0.30924008892917676, 'grm_norm': 'cosine_then_gcn', 'self_loops': False, 'use_snp_selection': True, 'num_snps': 30973}. Best is trial 121 with value: 0.2542564255643375.
[I 2025-11-12 06:27:32,022] Trial 148 finished with value: 0.24993339607752088 and parameters: {'model_type': 'graphsage', 'hidden_dims': '[512, 64]', 'dropout': 0.33334359898925003, 'batch_norm': False, 'lr': 6.342419528716037e-05, 'weight_decay': 3.9423632488815377e-07, 'epochs': 78, 'loss': 'mae', 'optimizer': 'adam', 'graph_mode': 'cutoff', 'cutoff': 0.8180482420233866, 'grm_norm': 'cosine', 'self_loops': False, 'use_snp_selection': True, 'num_snps': 38773}. Best is trial 121 with value: 0.2542564255643375.
[I 2025-11-12 06:28:56,480] Trial 149 finished with value: 0.21983085205900962 and parameters: {'model_type': 'graphsage', 'hidden_dims': '[256, 128]', 'dropout': 0.22229071521476906, 'batch_norm': False, 'lr': 1.0145904953941065e-05, 'weight_decay': 3.959023044497829e-07, 'epochs': 81, 'loss': 'mae', 'optimizer': 'adam', 'graph_mode': 'cutoff', 'cutoff': 0.8142651665382501, 'grm_norm': 'cosine', 'self_loops': False, 'use_snp_selection': True, 'num_snps': 42923}. Best is trial 121 with value: 0.2542564255643375.
