[I 2025-11-03 12:34:40,037] Trial 12 finished with value: 0.002122444270861602 and parameters: {'model_type': 'gcn', 'hidden_dims': '[256, 128, 64]', 'dropout': 0.27080247973361776, 'batch_norm': False, 'lr': 8.313753911922747e-06, 'weight_decay': 0.0001165188654618749, 'epochs': 83, 'loss': 'mae', 'optimizer': 'adam', 'graph_mode': 'cutoff', 'cutoff': 0.8997334580241522, 'grm_norm': 'cosine_then_gcn', 'self_loops': False, 'use_snp_selection': True, 'num_snps': 26931}. Best is trial 9 with value: 0.07466625725234172.
[I 2025-11-03 12:34:42,289] Trial 13 finished with value: 0.036021680709785626 and parameters: {'model_type': 'gcn', 'hidden_dims': '[256, 128, 64]', 'dropout': 0.3202139902363953, 'batch_norm': False, 'lr': 5.704245178114853e-05, 'weight_decay': 0.00038895083479650167, 'epochs': 242, 'loss': 'mse', 'optimizer': 'adam', 'graph_mode': 'knn', 'source': 'grm', 'knn_k': 10, 'weighted_edges': False, 'symmetrize_mode': 'mutual', 'use_snp_selection': True, 'num_snps': 10575}. Best is trial 9 with value: 0.07466625725234172.
[I 2025-11-03 12:34:46,191] Trial 14 finished with value: 0.017013342893873372 and parameters: {'model_type': 'gcn', 'hidden_dims': '[512, 256]', 'dropout': 0.5988030903941239, 'batch_norm': False, 'lr': 6.728628530366481e-06, 'weight_decay': 6.997426951559611e-05, 'epochs': 121, 'loss': 'mae', 'optimizer': 'adam', 'graph_mode': 'cutoff', 'cutoff': 0.3972322443508363, 'grm_norm': 'cosine_then_gcn', 'self_loops': False, 'use_snp_selection': True, 'num_snps': 57886}. Best is trial 9 with value: 0.07466625725234172.
[I 2025-11-03 12:34:48,066] Trial 15 finished with value: 0.04836458460537949 and parameters: {'model_type': 'gcn', 'hidden_dims': '[512, 128]', 'dropout': 0.47025822868335876, 'batch_norm': False, 'lr': 1.991799218455483e-05, 'weight_decay': 4.037985837518538e-06, 'epochs': 52, 'loss': 'mse', 'optimizer': 'adam', 'graph_mode': 'knn', 'source': 'grm', 'knn_k': 4, 'weighted_edges': False, 'symmetrize_mode': 'mutual', 'use_snp_selection': True, 'num_snps': 19106}. Best is trial 9 with value: 0.07466625725234172.
[I 2025-11-03 12:34:51,345] Trial 16 finished with value: -0.013318996698797067 and parameters: {'model_type': 'gcn', 'hidden_dims': '[512, 64]', 'dropout': 0.33498183625353145, 'batch_norm': False, 'lr': 1.061436110430588e-06, 'weight_decay': 3.95685948155076e-05, 'epochs': 216, 'loss': 'mse', 'optimizer': 'adam', 'graph_mode': 'cutoff', 'cutoff': 0.20792938025503943, 'grm_norm': 'none', 'self_loops': True, 'use_snp_selection': True, 'num_snps': 37654}. Best is trial 9 with value: 0.07466625725234172.
[I 2025-11-03 12:34:54,670] Trial 17 finished with value: 0.05221343662095995 and parameters: {'model_type': 'gcn', 'hidden_dims': '[256, 128, 64]', 'dropout': 0.22843065374783902, 'batch_norm': False, 'lr': 9.037722304685501e-05, 'weight_decay': 5.320616480613653e-07, 'epochs': 303, 'loss': 'mae', 'optimizer': 'adam', 'graph_mode': 'knn', 'source': 'grm', 'knn_k': 3, 'weighted_edges': False, 'symmetrize_mode': 'union', 'use_snp_selection': True, 'num_snps': 31951}. Best is trial 9 with value: 0.07466625725234172.
[I 2025-11-03 12:34:56,105] Trial 18 finished with value: -0.02790146987097098 and parameters: {'model_type': 'gcn', 'hidden_dims': '[512, 256]', 'dropout': 0.4267522048032639, 'batch_norm': False, 'lr': 3.37848638514423e-06, 'weight_decay': 0.00020227181773653023, 'epochs': 122, 'loss': 'mse', 'optimizer': 'adam', 'graph_mode': 'knn', 'source': 'grm', 'knn_k': 7, 'weighted_edges': False, 'symmetrize_mode': 'mutual', 'use_snp_selection': True, 'num_snps': 4684}. Best is trial 9 with value: 0.07466625725234172.
[I 2025-11-03 12:34:57,853] Trial 19 finished with value: 0.00046167592814390677 and parameters: {'model_type': 'gcn', 'hidden_dims': '[512, 256]', 'dropout': 0.5424414860459843, 'batch_norm': False, 'lr': 1.4460550539788873e-05, 'weight_decay': 5.4980640990494805e-06, 'epochs': 61, 'loss': 'mae', 'optimizer': 'adam', 'graph_mode': 'cutoff', 'cutoff': 0.43802876390440865, 'grm_norm': 'cosine', 'self_loops': False, 'use_snp_selection': True, 'num_snps': 16882}. Best is trial 9 with value: 0.07466625725234172.
[I 2025-11-03 12:35:01,266] Trial 20 finished with value: 0.01672108171210301 and parameters: {'model_type': 'gcn', 'hidden_dims': '[256, 128, 64]', 'dropout': 0.29560457734604595, 'batch_norm': False, 'lr': 3.93692482201822e-06, 'weight_decay': 0.0007683901165155506, 'epochs': 147, 'loss': 'mse', 'optimizer': 'adam', 'graph_mode': 'cutoff', 'cutoff': 0.34268123396087025, 'grm_norm': 'cosine_then_gcn', 'self_loops': True, 'use_snp_selection': True, 'num_snps': 51742}. Best is trial 9 with value: 0.07466625725234172.
[I 2025-11-03 12:35:03,225] Trial 21 finished with value: 0.057507233299873034 and parameters: {'model_type': 'gcn', 'hidden_dims': '[512, 128]', 'dropout': 0.5282650098432841, 'batch_norm': True, 'lr': 0.0003222311993982216, 'weight_decay': 5.431923858851941e-06, 'epochs': 98, 'loss': 'mse', 'optimizer': 'adam', 'graph_mode': 'cutoff', 'cutoff': 0.32410200352744967, 'grm_norm': 'cosine', 'self_loops': True, 'use_snp_selection': False}. Best is trial 9 with value: 0.07466625725234172.
[I 2025-11-03 12:35:05,115] Trial 22 finished with value: 0.059751352157479926 and parameters: {'model_type': 'gcn', 'hidden_dims': '[512, 128]', 'dropout': 0.4833801982322721, 'batch_norm': True, 'lr': 0.00011392373080556023, 'weight_decay': 2.1432083965797793e-06, 'epochs': 93, 'loss': 'mse', 'optimizer': 'adam', 'graph_mode': 'cutoff', 'cutoff': 0.4596792945644943, 'grm_norm': 'cosine', 'self_loops': True, 'use_snp_selection': False}. Best is trial 9 with value: 0.07466625725234172.
[I 2025-11-03 12:35:06,498] Trial 23 finished with value: 0.022993762357164646 and parameters: {'model_type': 'gcn', 'hidden_dims': '[512, 128]', 'dropout': 0.38088976861928947, 'batch_norm': True, 'lr': 4.825726400513903e-05, 'weight_decay': 3.0498802884047883e-05, 'epochs': 5, 'loss': 'mse', 'optimizer': 'adam', 'graph_mode': 'cutoff', 'cutoff': 0.2765892823397755, 'grm_norm': 'cosine', 'self_loops': True, 'use_snp_selection': False}. Best is trial 9 with value: 0.07466625725234172.
[I 2025-11-03 12:35:09,025] Trial 24 finished with value: 0.060115402900401786 and parameters: {'model_type': 'gcn', 'hidden_dims': '[512, 128]', 'dropout': 0.5602718384659869, 'batch_norm': True, 'lr': 0.0002176380108851352, 'weight_decay': 9.141008358487038e-06, 'epochs': 195, 'loss': 'mse', 'optimizer': 'adam', 'graph_mode': 'cutoff', 'cutoff': 0.5267376231234259, 'grm_norm': 'cosine_then_gcn', 'self_loops': False, 'use_snp_selection': False}. Best is trial 9 with value: 0.07466625725234172.
[I 2025-11-03 12:35:10,370] Trial 25 finished with value: 0.07207366767663104 and parameters: {'model_type': 'gcn', 'hidden_dims': '[256, 128]', 'dropout': 0.45866976015073635, 'batch_norm': True, 'lr': 0.0009454172397096995, 'weight_decay': 0.00011641758296374171, 'epochs': 49, 'loss': 'mse', 'optimizer': 'adam', 'graph_mode': 'cutoff', 'cutoff': 0.34832291567392554, 'grm_norm': 'cosine', 'self_loops': True, 'use_snp_selection': False}. Best is trial 9 with value: 0.07466625725234172.
[I 2025-11-03 12:35:11,786] Trial 26 finished with value: 0.004569046388352632 and parameters: {'model_type': 'gcn', 'hidden_dims': '[256, 128]', 'dropout': 0.4544759458916865, 'batch_norm': True, 'lr': 1.0563576041446031e-05, 'weight_decay': 8.787509306945443e-05, 'epochs': 51, 'loss': 'mae', 'optimizer': 'adam', 'graph_mode': 'knn', 'source': 'grm', 'knn_k': 10, 'weighted_edges': True, 'symmetrize_mode': 'union', 'use_snp_selection': False}. Best is trial 9 with value: 0.07466625725234172.
[I 2025-11-03 12:35:13,592] Trial 27 finished with value: -0.03208150666949219 and parameters: {'model_type': 'gcn', 'hidden_dims': '[256, 128]', 'dropout': 0.4403420345994987, 'batch_norm': False, 'lr': 0.0009857019883233275, 'weight_decay': 0.00014128861392578634, 'epochs': 34, 'loss': 'mse', 'optimizer': 'adam', 'graph_mode': 'cutoff', 'cutoff': 0.5222219212649202, 'grm_norm': 'gcn', 'self_loops': False, 'use_snp_selection': True, 'num_snps': 22669}. Best is trial 9 with value: 0.07466625725234172.
[I 2025-11-03 12:35:15,119] Trial 28 finished with value: 0.06487920503839094 and parameters: {'model_type': 'gcn', 'hidden_dims': '[256, 128]', 'dropout': 0.19161714901420318, 'batch_norm': True, 'lr': 4.75907025958407e-06, 'weight_decay': 0.00037624448440453767, 'epochs': 71, 'loss': 'mae', 'optimizer': 'adam', 'graph_mode': 'knn', 'source': 'grm', 'knn_k': 3, 'weighted_edges': False, 'symmetrize_mode': 'mutual', 'use_snp_selection': False}. Best is trial 9 with value: 0.07466625725234172.
[I 2025-11-03 12:35:17,191] Trial 29 finished with value: 0.03574279275649412 and parameters: {'model_type': 'gcn', 'hidden_dims': '[512, 64]', 'dropout': 0.3754995768737447, 'batch_norm': True, 'lr': 1.820013541468163e-06, 'weight_decay': 5.107951510578965e-05, 'epochs': 115, 'loss': 'mae', 'optimizer': 'adam', 'graph_mode': 'knn', 'source': 'grm', 'knn_k': 6, 'weighted_edges': False, 'symmetrize_mode': 'mutual', 'use_snp_selection': False}. Best is trial 9 with value: 0.07466625725234172.
[I 2025-11-03 12:35:19,663] Trial 30 finished with value: 0.027251718777828053 and parameters: {'model_type': 'gcn', 'hidden_dims': '[128, 64]', 'dropout': 0.1750518733498514, 'batch_norm': False, 'lr': 2.8462569457464503e-05, 'weight_decay': 1.4269701332962136e-05, 'epochs': 142, 'loss': 'mse', 'optimizer': 'adam', 'graph_mode': 'cutoff', 'cutoff': 0.24655915068391407, 'grm_norm': 'none', 'self_loops': True, 'use_snp_selection': True, 'num_snps': 34475}. Best is trial 9 with value: 0.07466625725234172.
[I 2025-11-03 12:35:21,258] Trial 31 finished with value: 0.07334223258985871 and parameters: {'model_type': 'gcn', 'hidden_dims': '[256, 128]', 'dropout': 0.5671386655844843, 'batch_norm': True, 'lr': 0.00041559543930223337, 'weight_decay': 5.038971242563276e-05, 'epochs': 101, 'loss': 'mse', 'optimizer': 'adam', 'graph_mode': 'cutoff', 'cutoff': 0.35582199966862305, 'grm_norm': 'cosine', 'self_loops': True, 'use_snp_selection': False}. Best is trial 9 with value: 0.07466625725234172.
[I 2025-11-03 12:35:22,540] Trial 32 finished with value: 0.049441371115757166 and parameters: {'model_type': 'gcn', 'hidden_dims': '[256, 128]', 'dropout': 0.5573950194352537, 'batch_norm': True, 'lr': 0.0009573710257097069, 'weight_decay': 4.868435837931998e-05, 'epochs': 32, 'loss': 'mse', 'optimizer': 'adam', 'graph_mode': 'cutoff', 'cutoff': 0.31672138512823206, 'grm_norm': 'cosine', 'self_loops': True, 'use_snp_selection': False}. Best is trial 9 with value: 0.07466625725234172.
[I 2025-11-03 12:35:24,149] Trial 33 finished with value: 0.05513162056529442 and parameters: {'model_type': 'gcn', 'hidden_dims': '[256, 128]', 'dropout': 0.5570827790472339, 'batch_norm': True, 'lr': 0.0004915844797113443, 'weight_decay': 3.206591427201393e-05, 'epochs': 108, 'loss': 'mse', 'optimizer': 'adam', 'graph_mode': 'cutoff', 'cutoff': 0.3981516432487829, 'grm_norm': 'cosine', 'self_loops': True, 'use_snp_selection': False}. Best is trial 9 with value: 0.07466625725234172.
[I 2025-11-03 12:35:25,909] Trial 34 finished with value: 0.06628884291855829 and parameters: {'model_type': 'gcn', 'hidden_dims': '[256, 128]', 'dropout': 0.511032845767093, 'batch_norm': True, 'lr': 0.000538452439705902, 'weight_decay': 8.650379052919138e-05, 'epochs': 154, 'loss': 'mse', 'optimizer': 'adam', 'graph_mode': 'cutoff', 'cutoff': 0.28233936109392577, 'grm_norm': 'cosine', 'self_loops': True, 'use_snp_selection': False}. Best is trial 9 with value: 0.07466625725234172.
[I 2025-11-03 12:35:27,564] Trial 35 finished with value: 0.057257591461676825 and parameters: {'model_type': 'gcn', 'hidden_dims': '[128, 64]', 'dropout': 0.4861851258817999, 'batch_norm': True, 'lr': 0.00016678949572530342, 'weight_decay': 0.00014619689138434247, 'epochs': 184, 'loss': 'mse', 'optimizer': 'adam', 'graph_mode': 'cutoff', 'cutoff': 0.457433700322602, 'grm_norm': 'cosine_then_gcn', 'self_loops': True, 'use_snp_selection': False}. Best is trial 9 with value: 0.07466625725234172.
[I 2025-11-03 12:35:28,919] Trial 36 finished with value: 0.036614245687889596 and parameters: {'model_type': 'gcn', 'hidden_dims': '[256, 128]', 'dropout': 0.5759666931185758, 'batch_norm': True, 'lr': 7.724084246002847e-05, 'weight_decay': 2.1641644367741035e-05, 'epochs': 37, 'loss': 'mse', 'optimizer': 'adam', 'graph_mode': 'knn', 'source': 'grm', 'knn_k': 8, 'weighted_edges': True, 'symmetrize_mode': 'union', 'use_snp_selection': False}. Best is trial 9 with value: 0.07466625725234172.
[I 2025-11-03 12:35:30,434] Trial 37 finished with value: 0.025024426770227964 and parameters: {'model_type': 'gcn', 'hidden_dims': '[512, 256]', 'dropout': 0.4034712480191416, 'batch_norm': False, 'lr': 0.0002890974677198486, 'weight_decay': 0.00040299969544866856, 'epochs': 73, 'loss': 'mae', 'optimizer': 'adam', 'graph_mode': 'cutoff', 'cutoff': 0.38135019898639516, 'grm_norm': 'cosine', 'self_loops': False, 'use_snp_selection': True, 'num_snps': 10478}. Best is trial 9 with value: 0.07466625725234172.
[I 2025-11-03 12:35:31,677] Trial 38 finished with value: 0.03249464746622791 and parameters: {'model_type': 'gcn', 'hidden_dims': '[256, 128]', 'dropout': 0.5236241304863076, 'batch_norm': True, 'lr': 0.000672136452170918, 'weight_decay': 2.2049227295735383e-05, 'epochs': 12, 'loss': 'mse', 'optimizer': 'adam', 'graph_mode': 'cutoff', 'cutoff': 0.6160650706784447, 'grm_norm': 'cosine', 'self_loops': True, 'use_snp_selection': False}. Best is trial 9 with value: 0.07466625725234172.
[I 2025-11-03 12:35:34,680] Trial 39 finished with value: 0.03271620021558021 and parameters: {'model_type': 'gcn', 'hidden_dims': '[256, 128, 64]', 'dropout': 0.49727812616038053, 'batch_norm': False, 'lr': 3.7734993926547526e-05, 'weight_decay': 9.367966044347155e-06, 'epochs': 165, 'loss': 'mae', 'optimizer': 'adam', 'graph_mode': 'knn', 'source': 'grm', 'knn_k': 5, 'weighted_edges': False, 'symmetrize_mode': 'mutual', 'use_snp_selection': True, 'num_snps': 40771}. Best is trial 9 with value: 0.07466625725234172.
[I 2025-11-03 12:35:37,960] Trial 40 finished with value: 0.01395813822810892 and parameters: {'model_type': 'gcn', 'hidden_dims': '[512, 256]', 'dropout': 0.4614722291632712, 'batch_norm': True, 'lr': 1.6311577384968684e-05, 'weight_decay': 7.128597037569946e-05, 'epochs': 345, 'loss': 'mse', 'optimizer': 'adam', 'graph_mode': 'cutoff', 'cutoff': 0.27998458379969327, 'grm_norm': 'cosine_then_gcn', 'self_loops': True, 'use_snp_selection': False}. Best is trial 9 with value: 0.07466625725234172.
[I 2025-11-03 12:35:39,704] Trial 41 finished with value: 0.05841578423020963 and parameters: {'model_type': 'gcn', 'hidden_dims': '[512, 128]', 'dropout': 0.5076445709740901, 'batch_norm': True, 'lr': 0.00037853776579834365, 'weight_decay': 7.125883019055021e-07, 'epochs': 82, 'loss': 'mse', 'optimizer': 'adam', 'graph_mode': 'cutoff', 'cutoff': 0.35539771884780164, 'grm_norm': 'cosine', 'self_loops': True, 'use_snp_selection': False}. Best is trial 9 with value: 0.07466625725234172.
[I 2025-11-03 12:35:41,018] Trial 42 finished with value: 0.04963914825149071 and parameters: {'model_type': 'gcn', 'hidden_dims': '[128, 64]', 'dropout': 0.5793446422515222, 'batch_norm': True, 'lr': 0.0004515924472563579, 'weight_decay': 1.8973679423961747e-06, 'epochs': 105, 'loss': 'mse', 'optimizer': 'adam', 'graph_mode': 'cutoff', 'cutoff': 0.42777608599444517, 'grm_norm': 'cosine', 'self_loops': True, 'use_snp_selection': False}. Best is trial 9 with value: 0.07466625725234172.
[I 2025-11-03 12:35:42,784] Trial 43 finished with value: 0.05278461897229588 and parameters: {'model_type': 'gcn', 'hidden_dims': '[256, 128, 64]', 'dropout': 0.3004740541351603, 'batch_norm': True, 'lr': 0.00019022037353215982, 'weight_decay': 3.577411898599547e-06, 'epochs': 134, 'loss': 'mse', 'optimizer': 'adam', 'graph_mode': 'cutoff', 'cutoff': 0.3151766007161866, 'grm_norm': 'cosine', 'self_loops': True, 'use_snp_selection': False}. Best is trial 9 with value: 0.07466625725234172.
[I 2025-11-03 12:35:44,124] Trial 44 finished with value: 0.05102391677291171 and parameters: {'model_type': 'gcn', 'hidden_dims': '[256, 128]', 'dropout': 0.5352737482075601, 'batch_norm': True, 'lr': 0.0006705066305361617, 'weight_decay': 0.00021642016094558072, 'epochs': 61, 'loss': 'mse', 'optimizer': 'adam', 'graph_mode': 'cutoff', 'cutoff': 0.20051200445090275, 'grm_norm': 'cosine', 'self_loops': True, 'use_snp_selection': False}. Best is trial 9 with value: 0.07466625725234172.
[I 2025-11-03 12:35:45,714] Trial 45 finished with value: 0.05821805373597552 and parameters: {'model_type': 'gcn', 'hidden_dims': '[512, 64]', 'dropout': 0.26787127604315863, 'batch_norm': False, 'lr': 0.00013908994971032192, 'weight_decay': 1.4660509767555291e-05, 'epochs': 127, 'loss': 'mse', 'optimizer': 'adam', 'graph_mode': 'cutoff', 'cutoff': 0.47315762259150734, 'grm_norm': 'gcn', 'self_loops': False, 'use_snp_selection': True, 'num_snps': 11597}. Best is trial 9 with value: 0.07466625725234172.
[I 2025-11-03 12:35:47,631] Trial 46 finished with value: -0.0035215977328416476 and parameters: {'model_type': 'gcn', 'hidden_dims': '[512, 256]', 'dropout': 0.34890555054155686, 'batch_norm': False, 'lr': 0.0007874798077161753, 'weight_decay': 1.1996653336237337e-06, 'epochs': 48, 'loss': 'mae', 'optimizer': 'adam', 'graph_mode': 'knn', 'source': 'grm', 'knn_k': 9, 'weighted_edges': False, 'symmetrize_mode': 'mutual', 'use_snp_selection': True, 'num_snps': 24282}. Best is trial 9 with value: 0.07466625725234172.
[I 2025-11-03 12:35:49,251] Trial 47 finished with value: 0.05917665825908369 and parameters: {'model_type': 'gcn', 'hidden_dims': '[256, 128, 64]', 'dropout': 0.5730716927578193, 'batch_norm': True, 'lr': 0.0002563321294752705, 'weight_decay': 3.169755825438264e-05, 'epochs': 98, 'loss': 'mse', 'optimizer': 'adam', 'graph_mode': 'cutoff', 'cutoff': 0.3588732077609198, 'grm_norm': 'cosine', 'self_loops': True, 'use_snp_selection': False}. Best is trial 9 with value: 0.07466625725234172.
[I 2025-11-03 12:35:52,275] Trial 48 finished with value: -0.005775988604812047 and parameters: {'model_type': 'gcn', 'hidden_dims': '[512, 128]', 'dropout': 0.4118520895003167, 'batch_norm': False, 'lr': 6.913595670347859e-05, 'weight_decay': 1.1395723818877471e-07, 'epochs': 73, 'loss': 'mae', 'optimizer': 'adam', 'graph_mode': 'knn', 'source': 'grm', 'knn_k': 3, 'weighted_edges': True, 'symmetrize_mode': 'union', 'use_snp_selection': True, 'num_snps': 49810}. Best is trial 9 with value: 0.07466625725234172.
[I 2025-11-03 12:35:54,360] Trial 49 finished with value: -0.013798864703040082 and parameters: {'model_type': 'gcn', 'hidden_dims': '[512, 256]', 'dropout': 0.3812169680290176, 'batch_norm': False, 'lr': 0.00037119955715428403, 'weight_decay': 7.224032089917049e-06, 'epochs': 25, 'loss': 'mse', 'optimizer': 'adam', 'graph_mode': 'cutoff', 'cutoff': 0.25894834038645337, 'grm_norm': 'none', 'self_loops': False, 'use_snp_selection': True, 'num_snps': 31843}. Best is trial 9 with value: 0.07466625725234172.
[I 2025-11-03 12:35:56,931] Trial 50 finished with value: -0.003326148277206285 and parameters: {'model_type': 'gcn', 'hidden_dims': '[256, 128, 64]', 'dropout': 0.23197663234569196, 'batch_norm': True, 'lr': 6.161359874552793e-06, 'weight_decay': 0.00011021471858002659, 'epochs': 291, 'loss': 'mse', 'optimizer': 'adam', 'graph_mode': 'cutoff', 'cutoff': 0.5828400067198384, 'grm_norm': 'gcn', 'self_loops': False, 'use_snp_selection': False}. Best is trial 9 with value: 0.07466625725234172.
[I 2025-11-03 12:35:59,402] Trial 51 finished with value: 0.07817024591461408 and parameters: {'model_type': 'gcn', 'hidden_dims': '[512, 256]', 'dropout': 0.32255318025742746, 'batch_norm': True, 'lr': 0.0005048653528326442, 'weight_decay': 1.5477849581679938e-05, 'epochs': 199, 'loss': 'mae', 'optimizer': 'adam', 'graph_mode': 'knn', 'source': 'grm', 'knn_k': 1, 'weighted_edges': True, 'symmetrize_mode': 'mutual', 'use_snp_selection': False}. Best is trial 51 with value: 0.07817024591461408.
[I 2025-11-03 12:36:01,964] Trial 52 finished with value: 0.046604409697974004 and parameters: {'model_type': 'gcn', 'hidden_dims': '[512, 256]', 'dropout': 0.3114531819030905, 'batch_norm': True, 'lr': 0.0005812706555807538, 'weight_decay': 5.4141464011074425e-05, 'epochs': 212, 'loss': 'mae', 'optimizer': 'adam', 'graph_mode': 'knn', 'source': 'grm', 'knn_k': 2, 'weighted_edges': True, 'symmetrize_mode': 'mutual', 'use_snp_selection': False}. Best is trial 51 with value: 0.07817024591461408.
[I 2025-11-03 12:36:04,673] Trial 53 finished with value: 0.07918279207336489 and parameters: {'model_type': 'gcn', 'hidden_dims': '[512, 256]', 'dropout': 0.3353769378401904, 'batch_norm': True, 'lr': 0.00041801010615832683, 'weight_decay': 1.4546242585927628e-05, 'epochs': 229, 'loss': 'mae', 'optimizer': 'adam', 'graph_mode': 'knn', 'source': 'grm', 'knn_k': 6, 'weighted_edges': True, 'symmetrize_mode': 'mutual', 'use_snp_selection': False}. Best is trial 53 with value: 0.07918279207336489.
[I 2025-11-03 12:36:07,381] Trial 54 finished with value: 0.07983895159921855 and parameters: {'model_type': 'gcn', 'hidden_dims': '[512, 256]', 'dropout': 0.33918786076020957, 'batch_norm': True, 'lr': 0.0006990887007425159, 'weight_decay': 1.5267425412595187e-05, 'epochs': 230, 'loss': 'mae', 'optimizer': 'adam', 'graph_mode': 'knn', 'source': 'grm', 'knn_k': 6, 'weighted_edges': True, 'symmetrize_mode': 'mutual', 'use_snp_selection': False}. Best is trial 54 with value: 0.07983895159921855.
