[I 2025-11-03 13:52:53,700] Trial 123 finished with value: 0.046341233713154746 and parameters: {'model_type': 'gcn', 'hidden_dims': '[512, 64]', 'dropout': 0.5233231273423496, 'batch_norm': True, 'lr': 0.000741772778590969, 'weight_decay': 7.560345177785625e-06, 'epochs': 81, 'loss': 'mse', 'optimizer': 'adam', 'graph_mode': 'cutoff', 'cutoff': 0.5931959336903913, 'grm_norm': 'none', 'self_loops': False, 'use_snp_selection': False}. Best is trial 91 with value: 0.08414917255143471.
[I 2025-11-03 13:52:55,483] Trial 124 finished with value: 0.08784821491270979 and parameters: {'model_type': 'gcn', 'hidden_dims': '[512, 64]', 'dropout': 0.5622162055518162, 'batch_norm': True, 'lr': 0.00034067590561578817, 'weight_decay': 3.741309779476963e-07, 'epochs': 99, 'loss': 'mse', 'optimizer': 'adam', 'graph_mode': 'cutoff', 'cutoff': 0.448499257350595, 'grm_norm': 'gcn', 'self_loops': True, 'use_snp_selection': False}. Best is trial 124 with value: 0.08784821491270979.
[I 2025-11-03 13:52:56,965] Trial 125 finished with value: 0.05525265217681936 and parameters: {'model_type': 'gcn', 'hidden_dims': '[512, 64]', 'dropout': 0.5672408403383823, 'batch_norm': True, 'lr': 0.0003943182110160145, 'weight_decay': 3.6070331503795364e-07, 'epochs': 41, 'loss': 'mse', 'optimizer': 'adam', 'graph_mode': 'cutoff', 'cutoff': 0.417964891782966, 'grm_norm': 'gcn', 'self_loops': True, 'use_snp_selection': False}. Best is trial 124 with value: 0.08784821491270979.
[I 2025-11-03 13:52:58,545] Trial 126 finished with value: 0.037254500148094394 and parameters: {'model_type': 'gcn', 'hidden_dims': '[512, 128]', 'dropout': 0.5856887301775671, 'batch_norm': True, 'lr': 0.00032447211935984717, 'weight_decay': 1.101846722249482e-06, 'epochs': 60, 'loss': 'mse', 'optimizer': 'adam', 'graph_mode': 'cutoff', 'cutoff': 0.4580808167371689, 'grm_norm': 'gcn', 'self_loops': True, 'use_snp_selection': False}. Best is trial 124 with value: 0.08784821491270979.
[I 2025-11-03 13:52:59,877] Trial 127 finished with value: 0.024591574434441408 and parameters: {'model_type': 'gcn', 'hidden_dims': '[256, 128]', 'dropout': 0.597458858505178, 'batch_norm': True, 'lr': 0.000867826025524846, 'weight_decay': 8.386539890412756e-07, 'epochs': 71, 'loss': 'mse', 'optimizer': 'adam', 'graph_mode': 'cutoff', 'cutoff': 0.37791104222359245, 'grm_norm': 'gcn', 'self_loops': True, 'use_snp_selection': False}. Best is trial 124 with value: 0.08784821491270979.
[I 2025-11-03 13:53:01,799] Trial 128 finished with value: 0.02100302176255408 and parameters: {'model_type': 'gcn', 'hidden_dims': '[512, 128]', 'dropout': 0.42275160781502036, 'batch_norm': False, 'lr': 0.0005233096962444667, 'weight_decay': 5.068017052811938e-07, 'epochs': 99, 'loss': 'mae', 'optimizer': 'adam', 'graph_mode': 'cutoff', 'cutoff': 0.7294710902276659, 'grm_norm': 'gcn', 'self_loops': True, 'use_snp_selection': True, 'num_snps': 23993}. Best is trial 124 with value: 0.08784821491270979.
[I 2025-11-03 13:53:03,725] Trial 129 finished with value: 0.040574514286782035 and parameters: {'model_type': 'gcn', 'hidden_dims': '[512, 64]', 'dropout': 0.5552511396552852, 'batch_norm': True, 'lr': 0.00028282852496261737, 'weight_decay': 6.905042626136251e-07, 'epochs': 125, 'loss': 'mse', 'optimizer': 'adam', 'graph_mode': 'cutoff', 'cutoff': 0.44300617873042747, 'grm_norm': 'none', 'self_loops': True, 'use_snp_selection': False}. Best is trial 124 with value: 0.08784821491270979.
[I 2025-11-03 13:53:05,926] Trial 130 finished with value: 0.06428992337462083 and parameters: {'model_type': 'gcn', 'hidden_dims': '[512, 128]', 'dropout': 0.5360024052336703, 'batch_norm': True, 'lr': 0.000627976842155528, 'weight_decay': 4.157204449016364e-07, 'epochs': 181, 'loss': 'mse', 'optimizer': 'adam', 'graph_mode': 'cutoff', 'cutoff': 0.47655874813650245, 'grm_norm': 'gcn', 'self_loops': False, 'use_snp_selection': False}. Best is trial 124 with value: 0.08784821491270979.
[I 2025-11-03 13:53:07,701] Trial 131 finished with value: 0.05351506405054743 and parameters: {'model_type': 'gcn', 'hidden_dims': '[512, 64]', 'dropout': 0.48860776562934305, 'batch_norm': True, 'lr': 0.00018461811374506466, 'weight_decay': 1.8140535343447106e-07, 'epochs': 87, 'loss': 'mse', 'optimizer': 'adam', 'graph_mode': 'knn', 'source': 'grm', 'knn_k': 9, 'weighted_edges': True, 'symmetrize_mode': 'union', 'use_snp_selection': False}. Best is trial 124 with value: 0.08784821491270979.
[I 2025-11-03 13:53:09,447] Trial 132 finished with value: 0.06067758817100393 and parameters: {'model_type': 'gcn', 'hidden_dims': '[512, 64]', 'dropout': 0.5148429769005602, 'batch_norm': True, 'lr': 0.0007747157519870226, 'weight_decay': 2.2476228757026548e-07, 'epochs': 95, 'loss': 'mse', 'optimizer': 'adam', 'graph_mode': 'cutoff', 'cutoff': 0.49411959035042785, 'grm_norm': 'none', 'self_loops': False, 'use_snp_selection': False}. Best is trial 124 with value: 0.08784821491270979.
[I 2025-11-03 13:53:11,267] Trial 133 finished with value: 0.07698051693223694 and parameters: {'model_type': 'gcn', 'hidden_dims': '[512, 64]', 'dropout': 0.5489449194510404, 'batch_norm': True, 'lr': 0.00035367765594893134, 'weight_decay': 1.2009159651837977e-05, 'epochs': 109, 'loss': 'mse', 'optimizer': 'adam', 'graph_mode': 'cutoff', 'cutoff': 0.6195250531469982, 'grm_norm': 'none', 'self_loops': False, 'use_snp_selection': False}. Best is trial 124 with value: 0.08784821491270979.
[I 2025-11-03 13:53:13,074] Trial 134 finished with value: 0.06222802606506855 and parameters: {'model_type': 'gcn', 'hidden_dims': '[512, 64]', 'dropout': 0.5749849912488956, 'batch_norm': True, 'lr': 0.00043394185832719564, 'weight_decay': 1.4463355877762365e-05, 'epochs': 108, 'loss': 'mse', 'optimizer': 'adam', 'graph_mode': 'cutoff', 'cutoff': 0.6203958035258346, 'grm_norm': 'none', 'self_loops': False, 'use_snp_selection': False}. Best is trial 124 with value: 0.08784821491270979.
[I 2025-11-03 13:53:15,686] Trial 135 finished with value: 0.04525665279596351 and parameters: {'model_type': 'gcn', 'hidden_dims': '[512, 64]', 'dropout': 0.5437792729919377, 'batch_norm': True, 'lr': 0.0003409430335557001, 'weight_decay': 1.1208836489165329e-05, 'epochs': 265, 'loss': 'mse', 'optimizer': 'adam', 'graph_mode': 'cutoff', 'cutoff': 0.7526727789046033, 'grm_norm': 'none', 'self_loops': False, 'use_snp_selection': False}. Best is trial 124 with value: 0.08784821491270979.
[I 2025-11-03 13:53:18,092] Trial 136 finished with value: 0.057870367265572153 and parameters: {'model_type': 'gcn', 'hidden_dims': '[512, 128]', 'dropout': 0.12967075310396972, 'batch_norm': True, 'lr': 0.0006670454579434337, 'weight_decay': 1.64045804491925e-05, 'epochs': 222, 'loss': 'mse', 'optimizer': 'adam', 'graph_mode': 'cutoff', 'cutoff': 0.6537359369290747, 'grm_norm': 'none', 'self_loops': False, 'use_snp_selection': False}. Best is trial 124 with value: 0.08784821491270979.
[I 2025-11-03 13:53:19,722] Trial 137 finished with value: 0.05849571627893603 and parameters: {'model_type': 'gcn', 'hidden_dims': '[512, 128]', 'dropout': 0.564271982425311, 'batch_norm': True, 'lr': 0.0004776354985661121, 'weight_decay': 6.344028619236514e-06, 'epochs': 74, 'loss': 'mse', 'optimizer': 'adam', 'graph_mode': 'cutoff', 'cutoff': 0.7682373780434445, 'grm_norm': 'none', 'self_loops': False, 'use_snp_selection': False}. Best is trial 124 with value: 0.08784821491270979.
[I 2025-11-03 13:53:21,421] Trial 138 finished with value: 0.05549985507934261 and parameters: {'model_type': 'gcn', 'hidden_dims': '[512, 64]', 'dropout': 0.5547979358977166, 'batch_norm': True, 'lr': 0.0008938894204418481, 'weight_decay': 8.418035806575647e-06, 'epochs': 83, 'loss': 'mse', 'optimizer': 'adam', 'graph_mode': 'cutoff', 'cutoff': 0.5990114704486154, 'grm_norm': 'cosine', 'self_loops': False, 'use_snp_selection': False}. Best is trial 124 with value: 0.08784821491270979.
[I 2025-11-03 13:53:23,709] Trial 139 finished with value: 0.04466679252091402 and parameters: {'model_type': 'gcn', 'hidden_dims': '[512, 128]', 'dropout': 0.45949321407287985, 'batch_norm': True, 'lr': 0.000274333230647887, 'weight_decay': 2.9853475476022592e-05, 'epochs': 198, 'loss': 'mse', 'optimizer': 'adam', 'graph_mode': 'cutoff', 'cutoff': 0.4037281517407951, 'grm_norm': 'gcn', 'self_loops': True, 'use_snp_selection': False}. Best is trial 124 with value: 0.08784821491270979.
[I 2025-11-03 13:53:25,731] Trial 140 finished with value: 0.05895547582710692 and parameters: {'model_type': 'gcn', 'hidden_dims': '[512, 128]', 'dropout': 0.530830457609783, 'batch_norm': True, 'lr': 0.00040597249610421884, 'weight_decay': 9.575537468024878e-07, 'epochs': 145, 'loss': 'mse', 'optimizer': 'adam', 'graph_mode': 'cutoff', 'cutoff': 0.4435902234018283, 'grm_norm': 'cosine', 'self_loops': False, 'use_snp_selection': False}. Best is trial 124 with value: 0.08784821491270979.
[I 2025-11-03 13:53:27,541] Trial 141 finished with value: 0.031026662117533275 and parameters: {'model_type': 'gcn', 'hidden_dims': '[512, 64]', 'dropout': 0.5393923565834498, 'batch_norm': True, 'lr': 0.00022468129769138019, 'weight_decay': 1.216009617146471e-07, 'epochs': 101, 'loss': 'mse', 'optimizer': 'adam', 'graph_mode': 'knn', 'source': 'grm', 'knn_k': 4, 'weighted_edges': False, 'symmetrize_mode': 'mutual', 'use_snp_selection': False}. Best is trial 124 with value: 0.08784821491270979.
[I 2025-11-03 13:53:29,369] Trial 142 finished with value: 0.07501163572894504 and parameters: {'model_type': 'gcn', 'hidden_dims': '[512, 64]', 'dropout': 0.5498436544177132, 'batch_norm': True, 'lr': 0.00031374032732640623, 'weight_decay': 4.113703706373525e-05, 'epochs': 112, 'loss': 'mse', 'optimizer': 'adam', 'graph_mode': 'cutoff', 'cutoff': 0.5144536201796434, 'grm_norm': 'none', 'self_loops': False, 'use_snp_selection': False}. Best is trial 124 with value: 0.08784821491270979.
[I 2025-11-03 13:53:31,200] Trial 143 finished with value: 0.08420974672089673 and parameters: {'model_type': 'gcn', 'hidden_dims': '[512, 64]', 'dropout': 0.5616452278965056, 'batch_norm': True, 'lr': 0.0003555819868006696, 'weight_decay': 2.9456283368670277e-06, 'epochs': 114, 'loss': 'mse', 'optimizer': 'adam', 'graph_mode': 'cutoff', 'cutoff': 0.5163040588103824, 'grm_norm': 'none', 'self_loops': False, 'use_snp_selection': False}. Best is trial 124 with value: 0.08784821491270979.
[I 2025-11-03 13:53:33,162] Trial 144 finished with value: 0.05781554724486387 and parameters: {'model_type': 'gcn', 'hidden_dims': '[512, 64]', 'dropout': 0.5808921434298465, 'batch_norm': True, 'lr': 0.0003772630770119467, 'weight_decay': 8.969367810167102e-05, 'epochs': 138, 'loss': 'mse', 'optimizer': 'adam', 'graph_mode': 'cutoff', 'cutoff': 0.5104298945949052, 'grm_norm': 'none', 'self_loops': False, 'use_snp_selection': False}. Best is trial 124 with value: 0.08784821491270979.
[I 2025-11-03 13:53:34,976] Trial 145 finished with value: 0.05250836530252842 and parameters: {'model_type': 'gcn', 'hidden_dims': '[512, 64]', 'dropout': 0.5611727776401162, 'batch_norm': True, 'lr': 0.00030985847627755894, 'weight_decay': 2.1968512590374537e-06, 'epochs': 109, 'loss': 'mse', 'optimizer': 'adam', 'graph_mode': 'cutoff', 'cutoff': 0.4751594870892866, 'grm_norm': 'none', 'self_loops': False, 'use_snp_selection': False}. Best is trial 124 with value: 0.08784821491270979.
[I 2025-11-03 13:53:36,859] Trial 146 finished with value: 0.05059815637165388 and parameters: {'model_type': 'gcn', 'hidden_dims': '[512, 64]', 'dropout': 0.5479346105610738, 'batch_norm': True, 'lr': 0.0005491013509164018, 'weight_decay': 2.9024955557661585e-06, 'epochs': 122, 'loss': 'mse', 'optimizer': 'adam', 'graph_mode': 'cutoff', 'cutoff': 0.5018199941203035, 'grm_norm': 'none', 'self_loops': False, 'use_snp_selection': False}. Best is trial 124 with value: 0.08784821491270979.
[I 2025-11-03 13:53:38,141] Trial 147 finished with value: 0.06426084598727566 and parameters: {'model_type': 'gcn', 'hidden_dims': '[512, 64]', 'dropout': 0.5736350319458814, 'batch_norm': True, 'lr': 0.00036236089918043496, 'weight_decay': 3.409984576094284e-07, 'epochs': 9, 'loss': 'mse', 'optimizer': 'adam', 'graph_mode': 'cutoff', 'cutoff': 0.5186385014295664, 'grm_norm': 'none', 'self_loops': False, 'use_snp_selection': False}. Best is trial 124 with value: 0.08784821491270979.
[I 2025-11-03 13:53:40,539] Trial 148 finished with value: 0.08046436084417932 and parameters: {'model_type': 'gcn', 'hidden_dims': '[512, 64]', 'dropout': 0.5898180845616539, 'batch_norm': True, 'lr': 0.0006835129784365211, 'weight_decay': 4.0608997203194505e-05, 'epochs': 211, 'loss': 'mse', 'optimizer': 'adam', 'graph_mode': 'cutoff', 'cutoff': 0.5408273915875751, 'grm_norm': 'cosine', 'self_loops': False, 'use_snp_selection': False}. Best is trial 124 with value: 0.08784821491270979.
[I 2025-11-03 13:53:43,061] Trial 149 finished with value: 0.049988851280221756 and parameters: {'model_type': 'gcn', 'hidden_dims': '[512, 64]', 'dropout': 0.5893188061208796, 'batch_norm': True, 'lr': 0.0007197059854786071, 'weight_decay': 4.366080455586902e-05, 'epochs': 244, 'loss': 'mse', 'optimizer': 'adam', 'graph_mode': 'cutoff', 'cutoff': 0.5442034664674117, 'grm_norm': 'cosine', 'self_loops': True, 'use_snp_selection': False}. Best is trial 124 with value: 0.08784821491270979.
[I 2025-11-03 13:53:45,077] Trial 0 finished with value: 0.05334916988822093 and parameters: {'model_type': 'gcn', 'hidden_dims': '[128, 64]', 'dropout': 0.199031432379812, 'batch_norm': True, 'lr': 1.8408544111075837e-06, 'weight_decay': 5.5136510071208614e-05, 'epochs': 334, 'loss': 'mae', 'optimizer': 'adam', 'graph_mode': 'knn', 'source': 'grm', 'knn_k': 8, 'weighted_edges': True, 'symmetrize_mode': 'mutual', 'use_snp_selection': False}. Best is trial 0 with value: 0.05334916988822093.
[I 2025-11-03 13:53:46,166] Trial 1 finished with value: 0.08796463610367669 and parameters: {'model_type': 'gcn', 'hidden_dims': '[128, 64]', 'dropout': 0.40051947670227217, 'batch_norm': True, 'lr': 0.0005320428882732732, 'weight_decay': 1.89210117736594e-06, 'epochs': 32, 'loss': 'mse', 'optimizer': 'adam', 'graph_mode': 'knn', 'source': 'grm', 'knn_k': 7, 'weighted_edges': True, 'symmetrize_mode': 'union', 'use_snp_selection': False}. Best is trial 1 with value: 0.08796463610367669.
[I 2025-11-03 13:53:48,175] Trial 2 finished with value: 0.05000841884023682 and parameters: {'model_type': 'gcn', 'hidden_dims': '[256, 128]', 'dropout': 0.5105528289184642, 'batch_norm': False, 'lr': 0.0006804279372404962, 'weight_decay': 0.0008922815224257085, 'epochs': 160, 'loss': 'mse', 'optimizer': 'adam', 'graph_mode': 'cutoff', 'cutoff': 0.5741905641612706, 'grm_norm': 'gcn', 'self_loops': False, 'use_snp_selection': True, 'num_snps': 26910}. Best is trial 1 with value: 0.08796463610367669.
[I 2025-11-03 13:53:50,187] Trial 3 finished with value: 0.04527282264730665 and parameters: {'model_type': 'gcn', 'hidden_dims': '[256, 128, 64]', 'dropout': 0.5390483213624292, 'batch_norm': False, 'lr': 3.4705625989073525e-05, 'weight_decay': 2.4623319020131338e-05, 'epochs': 92, 'loss': 'mse', 'optimizer': 'adam', 'graph_mode': 'knn', 'source': 'grm', 'knn_k': 6, 'weighted_edges': False, 'symmetrize_mode': 'mutual', 'use_snp_selection': True, 'num_snps': 30713}. Best is trial 1 with value: 0.08796463610367669.
[I 2025-11-03 13:53:52,281] Trial 4 finished with value: 0.0052773162319502635 and parameters: {'model_type': 'gcn', 'hidden_dims': '[128, 64]', 'dropout': 0.13404863676897502, 'batch_norm': False, 'lr': 0.0001431556295367288, 'weight_decay': 2.2084517750726675e-05, 'epochs': 13, 'loss': 'mae', 'optimizer': 'adam', 'graph_mode': 'cutoff', 'cutoff': 0.6714268476993044, 'grm_norm': 'none', 'self_loops': False, 'use_snp_selection': True, 'num_snps': 45645}. Best is trial 1 with value: 0.08796463610367669.
[I 2025-11-03 13:53:54,805] Trial 5 finished with value: 0.05762436710696268 and parameters: {'model_type': 'gcn', 'hidden_dims': '[256, 128]', 'dropout': 0.42253606323412096, 'batch_norm': False, 'lr': 4.238630400638805e-05, 'weight_decay': 8.074086040046576e-07, 'epochs': 134, 'loss': 'mae', 'optimizer': 'adam', 'graph_mode': 'knn', 'source': 'grm', 'knn_k': 1, 'weighted_edges': False, 'symmetrize_mode': 'mutual', 'use_snp_selection': True, 'num_snps': 43113}. Best is trial 1 with value: 0.08796463610367669.
[I 2025-11-03 13:53:57,122] Trial 6 finished with value: 0.06736929329567684 and parameters: {'model_type': 'gcn', 'hidden_dims': '[512, 256]', 'dropout': 0.3534893146320237, 'batch_norm': True, 'lr': 0.000251307964226932, 'weight_decay': 1.821819791794022e-05, 'epochs': 207, 'loss': 'mae', 'optimizer': 'adam', 'graph_mode': 'knn', 'source': 'grm', 'knn_k': 1, 'weighted_edges': True, 'symmetrize_mode': 'mutual', 'use_snp_selection': False}. Best is trial 1 with value: 0.08796463610367669.
[I 2025-11-03 13:53:59,179] Trial 7 finished with value: 0.04081480421146397 and parameters: {'model_type': 'gcn', 'hidden_dims': '[512, 256]', 'dropout': 0.1105825955860775, 'batch_norm': True, 'lr': 2.374338412754043e-05, 'weight_decay': 1.1284721123340274e-05, 'epochs': 170, 'loss': 'mse', 'optimizer': 'adam', 'graph_mode': 'cutoff', 'cutoff': 0.719872204109604, 'grm_norm': 'gcn', 'self_loops': False, 'use_snp_selection': False}. Best is trial 1 with value: 0.08796463610367669.
[I 2025-11-03 13:54:00,859] Trial 8 finished with value: 0.1026055756299967 and parameters: {'model_type': 'gcn', 'hidden_dims': '[512, 128]', 'dropout': 0.5066580418354021, 'batch_norm': True, 'lr': 0.00039213678276659976, 'weight_decay': 3.43655320802934e-06, 'epochs': 91, 'loss': 'mse', 'optimizer': 'adam', 'graph_mode': 'cutoff', 'cutoff': 0.34923059576505366, 'grm_norm': 'cosine', 'self_loops': True, 'use_snp_selection': False}. Best is trial 8 with value: 0.1026055756299967.
[I 2025-11-03 13:54:02,375] Trial 9 finished with value: 0.028163746941960263 and parameters: {'model_type': 'gcn', 'hidden_dims': '[512, 256]', 'dropout': 0.301734920240333, 'batch_norm': False, 'lr': 6.650961854953448e-06, 'weight_decay': 6.861575656590315e-05, 'epochs': 125, 'loss': 'mae', 'optimizer': 'adam', 'graph_mode': 'cutoff', 'cutoff': 0.2857569870061939, 'grm_norm': 'cosine_then_gcn', 'self_loops': False, 'use_snp_selection': True, 'num_snps': 12722}. Best is trial 8 with value: 0.1026055756299967.
[I 2025-11-03 13:54:04,820] Trial 10 finished with value: 0.07205068199412118 and parameters: {'model_type': 'gcn', 'hidden_dims': '[512, 128]', 'dropout': 0.5885461262002587, 'batch_norm': True, 'lr': 0.00010512303397748249, 'weight_decay': 1.3387352389235743e-07, 'epochs': 246, 'loss': 'mse', 'optimizer': 'adam', 'graph_mode': 'cutoff', 'cutoff': 0.26841964921208644, 'grm_norm': 'cosine', 'self_loops': True, 'use_snp_selection': False}. Best is trial 8 with value: 0.1026055756299967.
[I 2025-11-03 13:54:06,247] Trial 11 finished with value: 0.1282886373815262 and parameters: {'model_type': 'gcn', 'hidden_dims': '[512, 64]', 'dropout': 0.4214049075657615, 'batch_norm': True, 'lr': 0.0008079808143806397, 'weight_decay': 1.818759407283773e-06, 'epochs': 24, 'loss': 'mse', 'optimizer': 'adam', 'graph_mode': 'knn', 'source': 'grm', 'knn_k': 10, 'weighted_edges': True, 'symmetrize_mode': 'union', 'use_snp_selection': False}. Best is trial 11 with value: 0.1282886373815262.
[I 2025-11-03 13:54:07,878] Trial 12 finished with value: 0.07384831127266518 and parameters: {'model_type': 'gcn', 'hidden_dims': '[512, 64]', 'dropout': 0.47115135401653874, 'batch_norm': True, 'lr': 0.0005941284936785953, 'weight_decay': 1.574117856284058e-06, 'epochs': 66, 'loss': 'mse', 'optimizer': 'adam', 'graph_mode': 'knn', 'source': 'grm', 'knn_k': 10, 'weighted_edges': True, 'symmetrize_mode': 'union', 'use_snp_selection': False}. Best is trial 11 with value: 0.1282886373815262.
[I 2025-11-03 13:54:09,458] Trial 13 finished with value: 0.11643321302493875 and parameters: {'model_type': 'gcn', 'hidden_dims': '[512, 64]', 'dropout': 0.28845157379465514, 'batch_norm': True, 'lr': 0.0009956721055247276, 'weight_decay': 3.87720151008303e-07, 'epochs': 69, 'loss': 'mse', 'optimizer': 'adam', 'graph_mode': 'cutoff', 'cutoff': 0.42054604956300407, 'grm_norm': 'cosine', 'self_loops': True, 'use_snp_selection': False}. Best is trial 11 with value: 0.1282886373815262.
[I 2025-11-03 13:54:10,817] Trial 14 finished with value: 0.09882032285587278 and parameters: {'model_type': 'gcn', 'hidden_dims': '[512, 64]', 'dropout': 0.2701641409826525, 'batch_norm': True, 'lr': 0.0008771854001626236, 'weight_decay': 1.3375124728893317e-07, 'epochs': 8, 'loss': 'mse', 'optimizer': 'adam', 'graph_mode': 'knn', 'source': 'grm', 'knn_k': 10, 'weighted_edges': True, 'symmetrize_mode': 'union', 'use_snp_selection': False}. Best is trial 11 with value: 0.1282886373815262.
[I 2025-11-03 13:54:12,408] Trial 15 finished with value: 0.0656551906832821 and parameters: {'model_type': 'gcn', 'hidden_dims': '[512, 64]', 'dropout': 0.23505378091596188, 'batch_norm': True, 'lr': 0.00013271420569930736, 'weight_decay': 6.266150011769369e-07, 'epochs': 65, 'loss': 'mse', 'optimizer': 'adam', 'graph_mode': 'cutoff', 'cutoff': 0.4824114567335711, 'grm_norm': 'cosine', 'self_loops': True, 'use_snp_selection': False}. Best is trial 11 with value: 0.1282886373815262.
[I 2025-11-03 13:54:13,903] Trial 16 finished with value: 0.01799607730378637 and parameters: {'model_type': 'gcn', 'hidden_dims': '[512, 64]', 'dropout': 0.353937621100347, 'batch_norm': True, 'lr': 9.17962440186086e-06, 'weight_decay': 3.9391581443712917e-07, 'epochs': 52, 'loss': 'mse', 'optimizer': 'adam', 'graph_mode': 'cutoff', 'cutoff': 0.8613353724659321, 'grm_norm': 'none', 'self_loops': True, 'use_snp_selection': False}. Best is trial 11 with value: 0.1282886373815262.
