[I 2025-11-03 16:10:04,590] Trial 122 finished with value: 0.16749413215156478 and parameters: {'model_type': 'graphsage', 'hidden_dims': '[512, 64]', 'dropout': 0.37752764052603494, 'batch_norm': True, 'lr': 0.0005310161458498591, 'weight_decay': 3.403582433027696e-07, 'epochs': 287, 'loss': 'mse', 'optimizer': 'adam', 'graph_mode': 'knn', 'source': 'grm', 'knn_k': 6, 'weighted_edges': False, 'symmetrize_mode': 'union', 'use_snp_selection': False}. Best is trial 117 with value: 0.18305314054348443.
[I 2025-11-03 16:10:13,238] Trial 123 finished with value: 0.16653210685175532 and parameters: {'model_type': 'graphsage', 'hidden_dims': '[256, 128]', 'dropout': 0.4165360605556331, 'batch_norm': True, 'lr': 0.0006969793689702374, 'weight_decay': 4.2820098491265555e-06, 'epochs': 271, 'loss': 'mse', 'optimizer': 'adam', 'graph_mode': 'knn', 'source': 'grm', 'knn_k': 7, 'weighted_edges': False, 'symmetrize_mode': 'union', 'use_snp_selection': False}. Best is trial 117 with value: 0.18305314054348443.
[I 2025-11-03 16:10:26,311] Trial 124 finished with value: 0.18044872672654286 and parameters: {'model_type': 'graphsage', 'hidden_dims': '[512, 256]', 'dropout': 0.4981583414731276, 'batch_norm': True, 'lr': 0.0006262684312142873, 'weight_decay': 1.353099173675739e-07, 'epochs': 310, 'loss': 'mse', 'optimizer': 'adam', 'graph_mode': 'knn', 'source': 'grm', 'knn_k': 6, 'weighted_edges': False, 'symmetrize_mode': 'union', 'use_snp_selection': False}. Best is trial 117 with value: 0.18305314054348443.
[I 2025-11-03 16:10:40,244] Trial 125 finished with value: 0.17702709364240185 and parameters: {'model_type': 'graphsage', 'hidden_dims': '[512, 256]', 'dropout': 0.4956421022736684, 'batch_norm': True, 'lr': 0.0006086644953469058, 'weight_decay': 6.550671564844683e-07, 'epochs': 334, 'loss': 'mse', 'optimizer': 'adam', 'graph_mode': 'knn', 'source': 'grm', 'knn_k': 6, 'weighted_edges': False, 'symmetrize_mode': 'union', 'use_snp_selection': False}. Best is trial 117 with value: 0.18305314054348443.
[I 2025-11-03 16:10:54,438] Trial 126 finished with value: 0.16926579300440558 and parameters: {'model_type': 'graphsage', 'hidden_dims': '[512, 256]', 'dropout': 0.4937909334065593, 'batch_norm': True, 'lr': 0.00099741320917193, 'weight_decay': 1.9232770448087965e-07, 'epochs': 341, 'loss': 'mse', 'optimizer': 'adam', 'graph_mode': 'knn', 'source': 'grm', 'knn_k': 6, 'weighted_edges': True, 'symmetrize_mode': 'union', 'use_snp_selection': False}. Best is trial 117 with value: 0.18305314054348443.
[I 2025-11-03 16:11:08,331] Trial 127 finished with value: 0.17324519975962743 and parameters: {'model_type': 'graphsage', 'hidden_dims': '[512, 256]', 'dropout': 0.5231816759355815, 'batch_norm': True, 'lr': 0.00040264330102113207, 'weight_decay': 5.624300226066834e-07, 'epochs': 331, 'loss': 'mse', 'optimizer': 'adam', 'graph_mode': 'knn', 'source': 'grm', 'knn_k': 6, 'weighted_edges': False, 'symmetrize_mode': 'union', 'use_snp_selection': False}. Best is trial 117 with value: 0.18305314054348443.
[I 2025-11-03 16:11:18,172] Trial 128 finished with value: 0.16434613315797633 and parameters: {'model_type': 'graphsage', 'hidden_dims': '[512, 256]', 'dropout': 0.47756876136553394, 'batch_norm': True, 'lr': 0.000831063632047371, 'weight_decay': 4.4833665497379216e-07, 'epochs': 312, 'loss': 'mse', 'optimizer': 'adam', 'graph_mode': 'cutoff', 'cutoff': 0.7996872564916059, 'grm_norm': 'cosine', 'self_loops': False, 'use_snp_selection': False}. Best is trial 117 with value: 0.18305314054348443.
[I 2025-11-03 16:11:33,143] Trial 129 finished with value: 0.17404259784801002 and parameters: {'model_type': 'graphsage', 'hidden_dims': '[512, 256]', 'dropout': 0.5040841623888788, 'batch_norm': True, 'lr': 0.00047710931879471505, 'weight_decay': 1.0725059882105689e-07, 'epochs': 344, 'loss': 'mse', 'optimizer': 'adam', 'graph_mode': 'knn', 'source': 'grm', 'knn_k': 7, 'weighted_edges': True, 'symmetrize_mode': 'union', 'use_snp_selection': False}. Best is trial 117 with value: 0.18305314054348443.
[I 2025-11-03 16:11:46,465] Trial 130 finished with value: 0.16378464704615942 and parameters: {'model_type': 'graphsage', 'hidden_dims': '[512, 256]', 'dropout': 0.49538295984503355, 'batch_norm': True, 'lr': 0.0005840663802808707, 'weight_decay': 1.0329254766437344e-06, 'epochs': 331, 'loss': 'mse', 'optimizer': 'adam', 'graph_mode': 'knn', 'source': 'grm', 'knn_k': 5, 'weighted_edges': False, 'symmetrize_mode': 'union', 'use_snp_selection': False}. Best is trial 117 with value: 0.18305314054348443.
[I 2025-11-03 16:12:00,503] Trial 131 finished with value: 0.17129840744344355 and parameters: {'model_type': 'graphsage', 'hidden_dims': '[512, 256]', 'dropout': 0.4654458873656009, 'batch_norm': True, 'lr': 0.0006440203680735996, 'weight_decay': 1.4624362623702114e-07, 'epochs': 335, 'loss': 'mse', 'optimizer': 'adam', 'graph_mode': 'knn', 'source': 'grm', 'knn_k': 6, 'weighted_edges': False, 'symmetrize_mode': 'union', 'use_snp_selection': False}. Best is trial 117 with value: 0.18305314054348443.
[I 2025-11-03 16:12:14,177] Trial 132 finished with value: 0.158034891900443 and parameters: {'model_type': 'graphsage', 'hidden_dims': '[512, 256]', 'dropout': 0.4836123443066261, 'batch_norm': True, 'lr': 4.890742647144973e-05, 'weight_decay': 2.306146460391432e-07, 'epochs': 324, 'loss': 'mse', 'optimizer': 'adam', 'graph_mode': 'knn', 'source': 'grm', 'knn_k': 6, 'weighted_edges': False, 'symmetrize_mode': 'union', 'use_snp_selection': False}. Best is trial 117 with value: 0.18305314054348443.
[I 2025-11-03 16:12:22,210] Trial 133 finished with value: 0.17322100865591977 and parameters: {'model_type': 'graphsage', 'hidden_dims': '[256, 128, 64]', 'dropout': 0.4595949693159211, 'batch_norm': True, 'lr': 0.0005362314124566942, 'weight_decay': 6.462845396507924e-07, 'epochs': 262, 'loss': 'mse', 'optimizer': 'adam', 'graph_mode': 'knn', 'source': 'grm', 'knn_k': 6, 'weighted_edges': False, 'symmetrize_mode': 'union', 'use_snp_selection': False}. Best is trial 117 with value: 0.18305314054348443.
[I 2025-11-03 16:12:36,115] Trial 134 finished with value: 0.16978930623546085 and parameters: {'model_type': 'graphsage', 'hidden_dims': '[512, 256]', 'dropout': 0.4480471957228866, 'batch_norm': True, 'lr': 0.0007845268575020926, 'weight_decay': 8.315804435664331e-07, 'epochs': 301, 'loss': 'mse', 'optimizer': 'adam', 'graph_mode': 'knn', 'source': 'grm', 'knn_k': 8, 'weighted_edges': False, 'symmetrize_mode': 'union', 'use_snp_selection': False}. Best is trial 117 with value: 0.18305314054348443.
[I 2025-11-03 16:12:42,492] Trial 135 finished with value: 0.17114796513322078 and parameters: {'model_type': 'graphsage', 'hidden_dims': '[512, 128]', 'dropout': 0.5339355706697587, 'batch_norm': True, 'lr': 0.000665051999177633, 'weight_decay': 2.1070247543176383e-06, 'epochs': 123, 'loss': 'mse', 'optimizer': 'adam', 'graph_mode': 'knn', 'source': 'grm', 'knn_k': 6, 'weighted_edges': False, 'symmetrize_mode': 'union', 'use_snp_selection': False}. Best is trial 117 with value: 0.18305314054348443.
[I 2025-11-03 16:12:55,193] Trial 136 finished with value: 0.18705159302348676 and parameters: {'model_type': 'graphsage', 'hidden_dims': '[512, 64]', 'dropout': 0.39118033527692564, 'batch_norm': True, 'lr': 0.00043184441956628695, 'weight_decay': 5.5709396250706616e-06, 'epochs': 284, 'loss': 'mse', 'optimizer': 'adam', 'graph_mode': 'knn', 'source': 'grm', 'knn_k': 7, 'weighted_edges': True, 'symmetrize_mode': 'union', 'use_snp_selection': False}. Best is trial 136 with value: 0.18705159302348676.
[I 2025-11-03 16:13:01,087] Trial 137 finished with value: 0.16173112774969653 and parameters: {'model_type': 'graphsage', 'hidden_dims': '[128, 64]', 'dropout': 0.39356218335755694, 'batch_norm': True, 'lr': 0.00027484898906484506, 'weight_decay': 5.8490417781660235e-06, 'epochs': 230, 'loss': 'mse', 'optimizer': 'adam', 'graph_mode': 'knn', 'source': 'grm', 'knn_k': 7, 'weighted_edges': True, 'symmetrize_mode': 'union', 'use_snp_selection': False}. Best is trial 136 with value: 0.18705159302348676.
[I 2025-11-03 16:13:10,747] Trial 138 finished with value: 0.1903361387390679 and parameters: {'model_type': 'graphsage', 'hidden_dims': '[512, 256]', 'dropout': 0.516918182565664, 'batch_norm': True, 'lr': 0.00042006119441635205, 'weight_decay': 2.7861616005022682e-06, 'epochs': 246, 'loss': 'mse', 'optimizer': 'adam', 'graph_mode': 'knn', 'source': 'grm', 'knn_k': 7, 'weighted_edges': True, 'symmetrize_mode': 'mutual', 'use_snp_selection': False}. Best is trial 138 with value: 0.1903361387390679.
[I 2025-11-03 16:13:19,527] Trial 139 finished with value: 0.1701095017515356 and parameters: {'model_type': 'graphsage', 'hidden_dims': '[512, 256]', 'dropout': 0.5198363589329573, 'batch_norm': True, 'lr': 0.0004206036079498341, 'weight_decay': 5.06255902724542e-06, 'epochs': 209, 'loss': 'mse', 'optimizer': 'adam', 'graph_mode': 'knn', 'source': 'grm', 'knn_k': 8, 'weighted_edges': True, 'symmetrize_mode': 'mutual', 'use_snp_selection': False}. Best is trial 138 with value: 0.1903361387390679.
[I 2025-11-03 16:13:26,953] Trial 140 finished with value: 0.18518632690904566 and parameters: {'model_type': 'graphsage', 'hidden_dims': '[512, 256]', 'dropout': 0.5449107027253118, 'batch_norm': True, 'lr': 0.0003365457744515352, 'weight_decay': 2.8480106806869296e-06, 'epochs': 173, 'loss': 'mse', 'optimizer': 'adam', 'graph_mode': 'knn', 'source': 'grm', 'knn_k': 7, 'weighted_edges': True, 'symmetrize_mode': 'mutual', 'use_snp_selection': False}. Best is trial 138 with value: 0.1903361387390679.
[I 2025-11-03 16:13:34,144] Trial 141 finished with value: 0.1859218097494008 and parameters: {'model_type': 'graphsage', 'hidden_dims': '[512, 256]', 'dropout': 0.5481039394040783, 'batch_norm': True, 'lr': 0.0003204104406901937, 'weight_decay': 2.904039693618422e-06, 'epochs': 165, 'loss': 'mse', 'optimizer': 'adam', 'graph_mode': 'knn', 'source': 'grm', 'knn_k': 7, 'weighted_edges': True, 'symmetrize_mode': 'mutual', 'use_snp_selection': False}. Best is trial 138 with value: 0.1903361387390679.
[I 2025-11-03 16:13:43,106] Trial 142 finished with value: 0.17704583975803867 and parameters: {'model_type': 'graphsage', 'hidden_dims': '[512, 256]', 'dropout': 0.5726069952885378, 'batch_norm': True, 'lr': 0.00034711984916924594, 'weight_decay': 3.077180891174512e-06, 'epochs': 221, 'loss': 'mse', 'optimizer': 'adam', 'graph_mode': 'knn', 'source': 'grm', 'knn_k': 7, 'weighted_edges': True, 'symmetrize_mode': 'mutual', 'use_snp_selection': False}. Best is trial 138 with value: 0.1903361387390679.
[I 2025-11-03 16:13:52,728] Trial 143 finished with value: 0.18838693115342606 and parameters: {'model_type': 'graphsage', 'hidden_dims': '[512, 256]', 'dropout': 0.5849531646870378, 'batch_norm': True, 'lr': 0.00032123999161186843, 'weight_decay': 3.104494518451103e-06, 'epochs': 243, 'loss': 'mse', 'optimizer': 'adam', 'graph_mode': 'knn', 'source': 'grm', 'knn_k': 7, 'weighted_edges': True, 'symmetrize_mode': 'mutual', 'use_snp_selection': False}. Best is trial 138 with value: 0.1903361387390679.
[I 2025-11-03 16:13:59,980] Trial 144 finished with value: 0.1759240029055673 and parameters: {'model_type': 'graphsage', 'hidden_dims': '[512, 256]', 'dropout': 0.549538442281494, 'batch_norm': True, 'lr': 0.00032569642440332763, 'weight_decay': 3.4138535828851575e-06, 'epochs': 166, 'loss': 'mse', 'optimizer': 'adam', 'graph_mode': 'knn', 'source': 'grm', 'knn_k': 7, 'weighted_edges': True, 'symmetrize_mode': 'mutual', 'use_snp_selection': False}. Best is trial 138 with value: 0.1903361387390679.
[I 2025-11-03 16:14:08,040] Trial 145 finished with value: 0.18471723760268072 and parameters: {'model_type': 'graphsage', 'hidden_dims': '[512, 256]', 'dropout': 0.5865779917610306, 'batch_norm': True, 'lr': 0.00032963808285531093, 'weight_decay': 2.988264455383683e-06, 'epochs': 192, 'loss': 'mse', 'optimizer': 'adam', 'graph_mode': 'knn', 'source': 'grm', 'knn_k': 7, 'weighted_edges': True, 'symmetrize_mode': 'mutual', 'use_snp_selection': False}. Best is trial 138 with value: 0.1903361387390679.
[I 2025-11-03 16:14:15,761] Trial 146 finished with value: 0.17788002847562223 and parameters: {'model_type': 'graphsage', 'hidden_dims': '[512, 256]', 'dropout': 0.5890174698363903, 'batch_norm': True, 'lr': 0.00017370143574567043, 'weight_decay': 2.787657122299805e-06, 'epochs': 181, 'loss': 'mse', 'optimizer': 'adam', 'graph_mode': 'knn', 'source': 'grm', 'knn_k': 7, 'weighted_edges': True, 'symmetrize_mode': 'mutual', 'use_snp_selection': False}. Best is trial 138 with value: 0.1903361387390679.
[I 2025-11-03 16:14:23,519] Trial 147 finished with value: 0.1616992537320776 and parameters: {'model_type': 'graphsage', 'hidden_dims': '[512, 256]', 'dropout': 0.5865320519643934, 'batch_norm': True, 'lr': 0.00018484033465121275, 'weight_decay': 2.8245296336236196e-06, 'epochs': 183, 'loss': 'mse', 'optimizer': 'adam', 'graph_mode': 'knn', 'source': 'grm', 'knn_k': 7, 'weighted_edges': True, 'symmetrize_mode': 'mutual', 'use_snp_selection': False}. Best is trial 138 with value: 0.1903361387390679.
[I 2025-11-03 16:14:30,512] Trial 148 finished with value: 0.15450016943185169 and parameters: {'model_type': 'graphsage', 'hidden_dims': '[512, 256]', 'dropout': 0.5839914091851471, 'batch_norm': True, 'lr': 0.00024100912043201872, 'weight_decay': 4.284077934483782e-06, 'epochs': 193, 'loss': 'mse', 'optimizer': 'adam', 'graph_mode': 'knn', 'source': 'grm', 'knn_k': 7, 'weighted_edges': True, 'symmetrize_mode': 'mutual', 'use_snp_selection': True, 'num_snps': 35651}. Best is trial 138 with value: 0.1903361387390679.
[I 2025-11-03 16:14:37,747] Trial 149 finished with value: 0.11044831946310639 and parameters: {'model_type': 'graphsage', 'hidden_dims': '[512, 256]', 'dropout': 0.5721944704139391, 'batch_norm': False, 'lr': 0.0003123944796642275, 'weight_decay': 3.0266065272574083e-06, 'epochs': 170, 'loss': 'mse', 'optimizer': 'adam', 'graph_mode': 'knn', 'source': 'grm', 'knn_k': 7, 'weighted_edges': True, 'symmetrize_mode': 'mutual', 'use_snp_selection': False}. Best is trial 138 with value: 0.1903361387390679.
[I 2025-11-03 16:14:40,929] Trial 0 finished with value: 0.0698566496366054 and parameters: {'model_type': 'graphsage', 'hidden_dims': '[128, 64]', 'dropout': 0.199031432379812, 'batch_norm': True, 'lr': 1.8408544111075837e-06, 'weight_decay': 5.5136510071208614e-05, 'epochs': 336, 'loss': 'mae', 'optimizer': 'adam', 'graph_mode': 'knn', 'source': 'grm', 'knn_k': 8, 'weighted_edges': True, 'symmetrize_mode': 'mutual', 'use_snp_selection': False}. Best is trial 0 with value: 0.0698566496366054.
[I 2025-11-03 16:14:42,670] Trial 1 finished with value: 0.12287405245434159 and parameters: {'model_type': 'graphsage', 'hidden_dims': '[128, 64]', 'dropout': 0.40051947670227217, 'batch_norm': True, 'lr': 0.0005320428882732732, 'weight_decay': 1.89210117736594e-06, 'epochs': 68, 'loss': 'mse', 'optimizer': 'adam', 'graph_mode': 'knn', 'source': 'grm', 'knn_k': 7, 'weighted_edges': True, 'symmetrize_mode': 'union', 'use_snp_selection': False}. Best is trial 1 with value: 0.12287405245434159.
[I 2025-11-03 16:14:45,212] Trial 2 finished with value: 0.12967883101843503 and parameters: {'model_type': 'graphsage', 'hidden_dims': '[256, 128]', 'dropout': 0.5105528289184642, 'batch_norm': False, 'lr': 0.0006804279372404962, 'weight_decay': 0.0008922815224257085, 'epochs': 181, 'loss': 'mse', 'optimizer': 'adam', 'graph_mode': 'cutoff', 'cutoff': 0.5741905641612706, 'grm_norm': 'gcn', 'self_loops': False, 'use_snp_selection': True, 'num_snps': 26910}. Best is trial 2 with value: 0.12967883101843503.
[I 2025-11-03 16:14:47,965] Trial 3 finished with value: 0.04790051795251735 and parameters: {'model_type': 'graphsage', 'hidden_dims': '[256, 128, 64]', 'dropout': 0.5390483213624292, 'batch_norm': False, 'lr': 3.4705625989073525e-05, 'weight_decay': 2.4623319020131338e-05, 'epochs': 121, 'loss': 'mse', 'optimizer': 'adam', 'graph_mode': 'knn', 'source': 'grm', 'knn_k': 6, 'weighted_edges': False, 'symmetrize_mode': 'mutual', 'use_snp_selection': True, 'num_snps': 30713}. Best is trial 2 with value: 0.12967883101843503.
[I 2025-11-03 16:14:50,650] Trial 4 finished with value: 0.11114694530559142 and parameters: {'model_type': 'graphsage', 'hidden_dims': '[128, 64]', 'dropout': 0.13404863676897502, 'batch_norm': False, 'lr': 0.0001431556295367288, 'weight_decay': 2.2084517750726675e-05, 'epochs': 51, 'loss': 'mae', 'optimizer': 'adam', 'graph_mode': 'cutoff', 'cutoff': 0.6714268476993044, 'grm_norm': 'none', 'self_loops': False, 'use_snp_selection': True, 'num_snps': 45645}. Best is trial 2 with value: 0.12967883101843503.
[I 2025-11-03 16:14:54,106] Trial 5 finished with value: 0.12037744982965037 and parameters: {'model_type': 'graphsage', 'hidden_dims': '[256, 128]', 'dropout': 0.42253606323412096, 'batch_norm': False, 'lr': 4.238630400638805e-05, 'weight_decay': 8.074086040046576e-07, 'epochs': 158, 'loss': 'mae', 'optimizer': 'adam', 'graph_mode': 'knn', 'source': 'grm', 'knn_k': 1, 'weighted_edges': False, 'symmetrize_mode': 'mutual', 'use_snp_selection': True, 'num_snps': 43113}. Best is trial 2 with value: 0.12967883101843503.
[I 2025-11-03 16:14:58,830] Trial 6 finished with value: 0.1334662334609029 and parameters: {'model_type': 'graphsage', 'hidden_dims': '[512, 256]', 'dropout': 0.3534893146320237, 'batch_norm': True, 'lr': 0.000251307964226932, 'weight_decay': 1.821819791794022e-05, 'epochs': 223, 'loss': 'mae', 'optimizer': 'adam', 'graph_mode': 'knn', 'source': 'grm', 'knn_k': 1, 'weighted_edges': True, 'symmetrize_mode': 'mutual', 'use_snp_selection': False}. Best is trial 6 with value: 0.1334662334609029.
[I 2025-11-03 16:15:03,108] Trial 7 finished with value: 0.08848259081424668 and parameters: {'model_type': 'graphsage', 'hidden_dims': '[512, 256]', 'dropout': 0.1105825955860775, 'batch_norm': True, 'lr': 2.374338412754043e-05, 'weight_decay': 1.1284721123340274e-05, 'epochs': 190, 'loss': 'mse', 'optimizer': 'adam', 'graph_mode': 'cutoff', 'cutoff': 0.719872204109604, 'grm_norm': 'gcn', 'self_loops': False, 'use_snp_selection': False}. Best is trial 6 with value: 0.1334662334609029.
[I 2025-11-03 16:15:06,756] Trial 8 finished with value: 0.13090302850790264 and parameters: {'model_type': 'graphsage', 'hidden_dims': '[512, 128]', 'dropout': 0.5066580418354021, 'batch_norm': True, 'lr': 0.00039213678276659976, 'weight_decay': 3.43655320802934e-06, 'epochs': 120, 'loss': 'mse', 'optimizer': 'adam', 'graph_mode': 'cutoff', 'cutoff': 0.34923059576505366, 'grm_norm': 'cosine', 'self_loops': True, 'use_snp_selection': False}. Best is trial 6 with value: 0.1334662334609029.
[I 2025-11-03 16:15:08,924] Trial 9 finished with value: 0.11503152349693394 and parameters: {'model_type': 'graphsage', 'hidden_dims': '[512, 256]', 'dropout': 0.301734920240333, 'batch_norm': False, 'lr': 6.650961854953448e-06, 'weight_decay': 6.861575656590315e-05, 'epochs': 150, 'loss': 'mae', 'optimizer': 'adam', 'graph_mode': 'cutoff', 'cutoff': 0.2857569870061939, 'grm_norm': 'cosine_then_gcn', 'self_loops': False, 'use_snp_selection': True, 'num_snps': 12722}. Best is trial 6 with value: 0.1334662334609029.
[I 2025-11-03 16:15:14,420] Trial 10 finished with value: 0.14096262297620188 and parameters: {'model_type': 'graphsage', 'hidden_dims': '[512, 64]', 'dropout': 0.2833599465317005, 'batch_norm': True, 'lr': 0.00016916760584270694, 'weight_decay': 1.7866650996308468e-07, 'epochs': 275, 'loss': 'mae', 'optimizer': 'adam', 'graph_mode': 'knn', 'source': 'grm', 'knn_k': 1, 'weighted_edges': True, 'symmetrize_mode': 'union', 'use_snp_selection': False}. Best is trial 10 with value: 0.14096262297620188.
[I 2025-11-03 16:15:19,881] Trial 11 finished with value: 0.13485057738171538 and parameters: {'model_type': 'graphsage', 'hidden_dims': '[512, 64]', 'dropout': 0.2859699507705008, 'batch_norm': True, 'lr': 0.00012623783700890367, 'weight_decay': 1.680520994398766e-07, 'epochs': 274, 'loss': 'mae', 'optimizer': 'adam', 'graph_mode': 'knn', 'source': 'grm', 'knn_k': 1, 'weighted_edges': True, 'symmetrize_mode': 'union', 'use_snp_selection': False}. Best is trial 10 with value: 0.14096262297620188.
[I 2025-11-03 16:15:25,732] Trial 12 finished with value: 0.10901688082049837 and parameters: {'model_type': 'graphsage', 'hidden_dims': '[512, 64]', 'dropout': 0.26266132038870743, 'batch_norm': True, 'lr': 9.336280153487897e-05, 'weight_decay': 1.0551808429767219e-07, 'epochs': 279, 'loss': 'mae', 'optimizer': 'adam', 'graph_mode': 'knn', 'source': 'grm', 'knn_k': 3, 'weighted_edges': True, 'symmetrize_mode': 'union', 'use_snp_selection': False}. Best is trial 10 with value: 0.14096262297620188.
[I 2025-11-03 16:15:31,511] Trial 13 finished with value: 0.11348623733703674 and parameters: {'model_type': 'graphsage', 'hidden_dims': '[512, 64]', 'dropout': 0.2687736708759205, 'batch_norm': True, 'lr': 8.73294266324171e-05, 'weight_decay': 1.169717486767289e-07, 'epochs': 262, 'loss': 'mae', 'optimizer': 'adam', 'graph_mode': 'knn', 'source': 'grm', 'knn_k': 4, 'weighted_edges': True, 'symmetrize_mode': 'union', 'use_snp_selection': False}. Best is trial 10 with value: 0.14096262297620188.
[I 2025-11-03 16:15:38,325] Trial 14 finished with value: 0.06381433431622625 and parameters: {'model_type': 'graphsage', 'hidden_dims': '[512, 64]', 'dropout': 0.19696847261698813, 'batch_norm': True, 'lr': 1.2586985041154999e-05, 'weight_decay': 3.8054513427732407e-07, 'epochs': 349, 'loss': 'mae', 'optimizer': 'adam', 'graph_mode': 'knn', 'source': 'grm', 'knn_k': 3, 'weighted_edges': True, 'symmetrize_mode': 'union', 'use_snp_selection': False}. Best is trial 10 with value: 0.14096262297620188.
