[I 2025-11-03 11:49:54,873] Trial 9 finished with value: 0.051901523161338184 and parameters: {'model_type': 'gcn', 'hidden_dims': '[512, 64]', 'dropout': 0.14505336736221927, 'batch_norm': True, 'lr': 5.8619638388111826e-05, 'weight_decay': 6.200156172669308e-07, 'epochs': 175, 'loss': 'mse', 'optimizer': 'adam', 'graph_mode': 'off', 'use_snp_selection': False}. Best is trial 0 with value: 0.05227042117329645.
[I 2025-11-03 11:49:56,498] Trial 10 finished with value: 0.006694629809365053 and parameters: {'model_type': 'gcn', 'hidden_dims': '[128, 64]', 'dropout': 0.26042626041863687, 'batch_norm': False, 'lr': 1.080428984628536e-05, 'weight_decay': 0.00011308342650768637, 'epochs': 54, 'loss': 'mae', 'optimizer': 'adam', 'graph_mode': 'off', 'use_snp_selection': True, 'num_snps': 57847}. Best is trial 0 with value: 0.05227042117329645.
[I 2025-11-03 11:49:58,587] Trial 11 finished with value: 0.016180976212022122 and parameters: {'model_type': 'gcn', 'hidden_dims': '[128, 64]', 'dropout': 0.2837290841141706, 'batch_norm': False, 'lr': 0.0007612007694070342, 'weight_decay': 1.8709020886192727e-06, 'epochs': 226, 'loss': 'mse', 'optimizer': 'adam', 'graph_mode': 'off', 'use_snp_selection': True, 'num_snps': 55155}. Best is trial 0 with value: 0.05227042117329645.
[I 2025-11-03 11:50:00,798] Trial 12 finished with value: 0.032060561133758304 and parameters: {'model_type': 'gcn', 'hidden_dims': '[256, 128]', 'dropout': 0.5040822261097737, 'batch_norm': False, 'lr': 1.8174345617074418e-05, 'weight_decay': 2.540289733915756e-06, 'epochs': 340, 'loss': 'mse', 'optimizer': 'adam', 'graph_mode': 'off', 'use_snp_selection': True, 'num_snps': 42333}. Best is trial 0 with value: 0.05227042117329645.
[I 2025-11-03 11:50:02,313] Trial 13 finished with value: -0.01645438405238188 and parameters: {'model_type': 'gcn', 'hidden_dims': '[256, 128]', 'dropout': 0.2927906138791051, 'batch_norm': False, 'lr': 0.00022909673034024954, 'weight_decay': 1.3917882897272238e-07, 'epochs': 263, 'loss': 'mae', 'optimizer': 'adam', 'graph_mode': 'off', 'use_snp_selection': False}. Best is trial 0 with value: 0.05227042117329645.
[I 2025-11-03 11:50:03,336] Trial 14 finished with value: 0.05001942339404952 and parameters: {'model_type': 'gcn', 'hidden_dims': '[128, 64]', 'dropout': 0.20365033665203916, 'batch_norm': True, 'lr': 2.5920425278148312e-05, 'weight_decay': 5.7839851163528764e-05, 'epochs': 191, 'loss': 'mae', 'optimizer': 'adam', 'graph_mode': 'off', 'use_snp_selection': False}. Best is trial 0 with value: 0.05227042117329645.
[I 2025-11-03 11:50:04,811] Trial 15 finished with value: 0.09769708887569035 and parameters: {'model_type': 'gcn', 'hidden_dims': '[256, 128, 64]', 'dropout': 0.3324413415458966, 'batch_norm': False, 'lr': 3.937868498877952e-06, 'weight_decay': 3.7461634298156576e-06, 'epochs': 287, 'loss': 'mse', 'optimizer': 'adam', 'graph_mode': 'off', 'use_snp_selection': True, 'num_snps': 10575}. Best is trial 15 with value: 0.09769708887569035.
[I 2025-11-03 11:50:06,150] Trial 16 finished with value: 0.028310250602602078 and parameters: {'model_type': 'gcn', 'hidden_dims': '[256, 128, 64]', 'dropout': 0.3358182757281713, 'batch_norm': False, 'lr': 2.860791149413572e-06, 'weight_decay': 5.183566262465886e-06, 'epochs': 282, 'loss': 'mae', 'optimizer': 'adam', 'graph_mode': 'off', 'use_snp_selection': True, 'num_snps': 4205}. Best is trial 15 with value: 0.09769708887569035.
[I 2025-11-03 11:50:08,105] Trial 17 finished with value: 0.03159353379789006 and parameters: {'model_type': 'gcn', 'hidden_dims': '[256, 128, 64]', 'dropout': 0.22699731649361615, 'batch_norm': True, 'lr': 8.632827420584905e-06, 'weight_decay': 4.3372141540230576e-05, 'epochs': 347, 'loss': 'mse', 'optimizer': 'adam', 'graph_mode': 'off', 'use_snp_selection': True, 'num_snps': 19183}. Best is trial 15 with value: 0.09769708887569035.
[I 2025-11-03 11:50:09,827] Trial 18 finished with value: 0.025477349993272932 and parameters: {'model_type': 'gcn', 'hidden_dims': '[512, 256]', 'dropout': 0.3286398693380081, 'batch_norm': True, 'lr': 2.4217650322551518e-06, 'weight_decay': 6.1320424958075904e-06, 'epochs': 301, 'loss': 'mse', 'optimizer': 'adam', 'graph_mode': 'off', 'use_snp_selection': True, 'num_snps': 20634}. Best is trial 15 with value: 0.09769708887569035.
[I 2025-11-03 11:50:11,613] Trial 19 finished with value: -0.003225279960060592 and parameters: {'model_type': 'gcn', 'hidden_dims': '[128, 64]', 'dropout': 0.20243416567108147, 'batch_norm': False, 'lr': 1.146637260472667e-06, 'weight_decay': 0.00010229390206792138, 'epochs': 239, 'loss': 'mae', 'optimizer': 'adam', 'graph_mode': 'off', 'use_snp_selection': True, 'num_snps': 44200}. Best is trial 15 with value: 0.09769708887569035.
[I 2025-11-03 11:50:13,584] Trial 20 finished with value: 0.025583116289061472 and parameters: {'model_type': 'gcn', 'hidden_dims': '[256, 128, 64]', 'dropout': 0.4572056249189089, 'batch_norm': False, 'lr': 5.60578481520913e-06, 'weight_decay': 4.000923373028005e-06, 'epochs': 348, 'loss': 'mae', 'optimizer': 'adam', 'graph_mode': 'off', 'use_snp_selection': True, 'num_snps': 23282}. Best is trial 15 with value: 0.09769708887569035.
[I 2025-11-03 11:50:15,223] Trial 21 finished with value: 0.05056633716152354 and parameters: {'model_type': 'gcn', 'hidden_dims': '[256, 128]', 'dropout': 0.4919666994553856, 'batch_norm': False, 'lr': 1.3435149120927592e-05, 'weight_decay': 1.0100666180716286e-06, 'epochs': 301, 'loss': 'mse', 'optimizer': 'adam', 'graph_mode': 'off', 'use_snp_selection': False}. Best is trial 15 with value: 0.09769708887569035.
[I 2025-11-03 11:50:17,181] Trial 22 finished with value: 0.02580294880109141 and parameters: {'model_type': 'gcn', 'hidden_dims': '[256, 128]', 'dropout': 0.3827516323701891, 'batch_norm': False, 'lr': 2.979193800472261e-05, 'weight_decay': 1.3376610362022762e-06, 'epochs': 203, 'loss': 'mse', 'optimizer': 'adam', 'graph_mode': 'off', 'use_snp_selection': True, 'num_snps': 44322}. Best is trial 15 with value: 0.09769708887569035.
[I 2025-11-03 11:50:18,884] Trial 23 finished with value: 0.038979735168869295 and parameters: {'model_type': 'gcn', 'hidden_dims': '[256, 128, 64]', 'dropout': 0.35552910519676184, 'batch_norm': False, 'lr': 0.00018892821647058285, 'weight_decay': 1.4196472629770953e-07, 'epochs': 265, 'loss': 'mse', 'optimizer': 'adam', 'graph_mode': 'off', 'use_snp_selection': False}. Best is trial 15 with value: 0.09769708887569035.
[I 2025-11-03 11:50:19,790] Trial 24 finished with value: 0.026020800454201156 and parameters: {'model_type': 'gcn', 'hidden_dims': '[128, 64]', 'dropout': 0.5549194627320733, 'batch_norm': False, 'lr': 0.00010868173465116556, 'weight_decay': 1.1150332860649075e-05, 'epochs': 218, 'loss': 'mse', 'optimizer': 'adam', 'graph_mode': 'off', 'use_snp_selection': True, 'num_snps': 2321}. Best is trial 15 with value: 0.09769708887569035.
[I 2025-11-03 11:50:21,850] Trial 25 finished with value: 0.04173690052136156 and parameters: {'model_type': 'gcn', 'hidden_dims': '[512, 256]', 'dropout': 0.31098777314754816, 'batch_norm': False, 'lr': 2.3948152041977843e-06, 'weight_decay': 4.324062411699967e-07, 'epochs': 120, 'loss': 'mse', 'optimizer': 'adam', 'graph_mode': 'off', 'use_snp_selection': True, 'num_snps': 51423}. Best is trial 15 with value: 0.09769708887569035.
[I 2025-11-03 11:50:24,340] Trial 26 finished with value: 0.06113051361242752 and parameters: {'model_type': 'gcn', 'hidden_dims': '[512, 128]', 'dropout': 0.3696880542961992, 'batch_norm': True, 'lr': 7.63771118187312e-06, 'weight_decay': 2.824698610924098e-05, 'epochs': 319, 'loss': 'mse', 'optimizer': 'adam', 'graph_mode': 'off', 'use_snp_selection': False}. Best is trial 15 with value: 0.09769708887569035.
[I 2025-11-03 11:50:26,534] Trial 27 finished with value: 0.02397772523864701 and parameters: {'model_type': 'gcn', 'hidden_dims': '[512, 128]', 'dropout': 0.23214367654954848, 'batch_norm': True, 'lr': 5.5374322193055585e-06, 'weight_decay': 1.979998725876337e-05, 'epochs': 328, 'loss': 'mse', 'optimizer': 'adam', 'graph_mode': 'off', 'use_snp_selection': True, 'num_snps': 30652}. Best is trial 15 with value: 0.09769708887569035.
[I 2025-11-03 11:50:28,856] Trial 28 finished with value: 0.006905083450582893 and parameters: {'model_type': 'gcn', 'hidden_dims': '[512, 128]', 'dropout': 0.1790971160533859, 'batch_norm': True, 'lr': 7.896787451341216e-06, 'weight_decay': 5.4950616191976046e-05, 'epochs': 290, 'loss': 'mae', 'optimizer': 'adam', 'graph_mode': 'off', 'use_snp_selection': False}. Best is trial 15 with value: 0.09769708887569035.
[I 2025-11-03 11:50:31,021] Trial 29 finished with value: -0.015793477235223778 and parameters: {'model_type': 'gcn', 'hidden_dims': '[512, 128]', 'dropout': 0.4436343304218576, 'batch_norm': True, 'lr': 3.3764519224957032e-06, 'weight_decay': 9.56185232799211e-06, 'epochs': 251, 'loss': 'mae', 'optimizer': 'adam', 'graph_mode': 'off', 'use_snp_selection': False}. Best is trial 15 with value: 0.09769708887569035.
[I 2025-11-03 11:50:32,412] Trial 30 finished with value: 0.055228023259532494 and parameters: {'model_type': 'gcn', 'hidden_dims': '[128, 64]', 'dropout': 0.3551805139822847, 'batch_norm': True, 'lr': 1.7927611217285846e-06, 'weight_decay': 0.00014829081585708797, 'epochs': 326, 'loss': 'mse', 'optimizer': 'adam', 'graph_mode': 'off', 'use_snp_selection': True, 'num_snps': 10551}. Best is trial 15 with value: 0.09769708887569035.
[I 2025-11-03 11:50:33,819] Trial 31 finished with value: -0.023781509360039307 and parameters: {'model_type': 'gcn', 'hidden_dims': '[128, 64]', 'dropout': 0.35277220883738014, 'batch_norm': True, 'lr': 1.9571611186446563e-06, 'weight_decay': 0.00023748661747071323, 'epochs': 326, 'loss': 'mse', 'optimizer': 'adam', 'graph_mode': 'off', 'use_snp_selection': True, 'num_snps': 12743}. Best is trial 15 with value: 0.09769708887569035.
[I 2025-11-03 11:50:35,152] Trial 32 finished with value: -0.018872005862009957 and parameters: {'model_type': 'gcn', 'hidden_dims': '[128, 64]', 'dropout': 0.41799039364253787, 'batch_norm': True, 'lr': 1.0025533090925526e-06, 'weight_decay': 0.0001187290975623796, 'epochs': 307, 'loss': 'mse', 'optimizer': 'adam', 'graph_mode': 'off', 'use_snp_selection': True, 'num_snps': 10997}. Best is trial 15 with value: 0.09769708887569035.
[I 2025-11-03 11:50:37,261] Trial 33 finished with value: 0.029561168916319363 and parameters: {'model_type': 'gcn', 'hidden_dims': '[256, 128, 64]', 'dropout': 0.46918624105782736, 'batch_norm': True, 'lr': 4.849515508874862e-06, 'weight_decay': 3.735969809992686e-05, 'epochs': 328, 'loss': 'mse', 'optimizer': 'adam', 'graph_mode': 'off', 'use_snp_selection': True, 'num_snps': 26943}. Best is trial 15 with value: 0.09769708887569035.
[I 2025-11-03 11:50:38,487] Trial 34 finished with value: 0.03133873943693544 and parameters: {'model_type': 'gcn', 'hidden_dims': '[128, 64]', 'dropout': 0.41523776389123956, 'batch_norm': True, 'lr': 3.5942169201991995e-06, 'weight_decay': 0.0004099485273430833, 'epochs': 288, 'loss': 'mse', 'optimizer': 'adam', 'graph_mode': 'off', 'use_snp_selection': True, 'num_snps': 7227}. Best is trial 15 with value: 0.09769708887569035.
[I 2025-11-03 11:50:40,087] Trial 35 finished with value: -0.0009240277317871711 and parameters: {'model_type': 'gcn', 'hidden_dims': '[512, 128]', 'dropout': 0.36677512950671554, 'batch_norm': True, 'lr': 1.43105741082575e-06, 'weight_decay': 0.00019563114530441185, 'epochs': 319, 'loss': 'mse', 'optimizer': 'adam', 'graph_mode': 'off', 'use_snp_selection': True, 'num_snps': 15713}. Best is trial 15 with value: 0.09769708887569035.
[I 2025-11-03 11:50:42,419] Trial 36 finished with value: 0.03676094884000534 and parameters: {'model_type': 'gcn', 'hidden_dims': '[512, 64]', 'dropout': 0.30840348346871066, 'batch_norm': True, 'lr': 1.7906878778284296e-06, 'weight_decay': 0.0006342653850075011, 'epochs': 272, 'loss': 'mse', 'optimizer': 'adam', 'graph_mode': 'off', 'use_snp_selection': True, 'num_snps': 37712}. Best is trial 15 with value: 0.09769708887569035.
[I 2025-11-03 11:50:43,841] Trial 37 finished with value: 0.031552207021968814 and parameters: {'model_type': 'gcn', 'hidden_dims': '[128, 64]', 'dropout': 0.26999884998708434, 'batch_norm': True, 'lr': 7.543587875000652e-06, 'weight_decay': 2.4347292357415616e-05, 'epochs': 336, 'loss': 'mae', 'optimizer': 'adam', 'graph_mode': 'off', 'use_snp_selection': False}. Best is trial 15 with value: 0.09769708887569035.
[I 2025-11-03 11:50:46,562] Trial 38 finished with value: 0.01742813221045457 and parameters: {'model_type': 'gcn', 'hidden_dims': '[256, 128, 64]', 'dropout': 0.10463846963650741, 'batch_norm': True, 'lr': 4.101566277550505e-06, 'weight_decay': 8.071801973556562e-05, 'epochs': 296, 'loss': 'mse', 'optimizer': 'adam', 'graph_mode': 'off', 'use_snp_selection': True, 'num_snps': 50428}. Best is trial 15 with value: 0.09769708887569035.
[I 2025-11-03 11:50:48,792] Trial 39 finished with value: 0.06406981530751167 and parameters: {'model_type': 'gcn', 'hidden_dims': '[512, 128]', 'dropout': 0.3950043040316459, 'batch_norm': True, 'lr': 1.606764866101407e-05, 'weight_decay': 0.00016807320533150004, 'epochs': 248, 'loss': 'mse', 'optimizer': 'adam', 'graph_mode': 'off', 'use_snp_selection': False}. Best is trial 15 with value: 0.09769708887569035.
[I 2025-11-03 11:50:50,895] Trial 40 finished with value: -0.004387978468426618 and parameters: {'model_type': 'gcn', 'hidden_dims': '[512, 128]', 'dropout': 0.39441327773159335, 'batch_norm': True, 'lr': 1.7742768780897446e-05, 'weight_decay': 0.00018210314517327266, 'epochs': 245, 'loss': 'mse', 'optimizer': 'adam', 'graph_mode': 'off', 'use_snp_selection': False}. Best is trial 15 with value: 0.09769708887569035.
[I 2025-11-03 11:50:53,348] Trial 41 finished with value: 0.02872963436105052 and parameters: {'model_type': 'gcn', 'hidden_dims': '[512, 128]', 'dropout': 0.43432266615831955, 'batch_norm': True, 'lr': 1.2775075021326745e-05, 'weight_decay': 3.2239510594428724e-05, 'epochs': 311, 'loss': 'mse', 'optimizer': 'adam', 'graph_mode': 'off', 'use_snp_selection': False}. Best is trial 15 with value: 0.09769708887569035.
[I 2025-11-03 11:50:55,605] Trial 42 finished with value: 0.02508641472972907 and parameters: {'model_type': 'gcn', 'hidden_dims': '[512, 128]', 'dropout': 0.3747762117911848, 'batch_norm': True, 'lr': 1.8880959577531296e-06, 'weight_decay': 0.0003285518402387254, 'epochs': 276, 'loss': 'mse', 'optimizer': 'adam', 'graph_mode': 'off', 'use_snp_selection': False}. Best is trial 15 with value: 0.09769708887569035.
[I 2025-11-03 11:50:58,056] Trial 43 finished with value: 0.024831649811145093 and parameters: {'model_type': 'gcn', 'hidden_dims': '[512, 64]', 'dropout': 0.3204731665744443, 'batch_norm': True, 'lr': 4.0315634898298895e-05, 'weight_decay': 1.4102532776120747e-05, 'epochs': 318, 'loss': 'mse', 'optimizer': 'adam', 'graph_mode': 'off', 'use_snp_selection': False}. Best is trial 15 with value: 0.09769708887569035.
[I 2025-11-03 11:51:00,308] Trial 44 finished with value: 0.057628457586715386 and parameters: {'model_type': 'gcn', 'hidden_dims': '[512, 128]', 'dropout': 0.4014440013754874, 'batch_norm': True, 'lr': 2.001936735349831e-05, 'weight_decay': 0.0004978448000296173, 'epochs': 257, 'loss': 'mse', 'optimizer': 'adam', 'graph_mode': 'off', 'use_snp_selection': False}. Best is trial 15 with value: 0.09769708887569035.
[I 2025-11-03 11:51:02,313] Trial 45 finished with value: 0.040566487986219806 and parameters: {'model_type': 'gcn', 'hidden_dims': '[512, 128]', 'dropout': 0.4003883415931966, 'batch_norm': True, 'lr': 2.222612794747133e-05, 'weight_decay': 0.0009342892706546544, 'epochs': 230, 'loss': 'mse', 'optimizer': 'adam', 'graph_mode': 'off', 'use_snp_selection': False}. Best is trial 15 with value: 0.09769708887569035.
[I 2025-11-03 11:51:04,491] Trial 46 finished with value: -0.0050344266230077685 and parameters: {'model_type': 'gcn', 'hidden_dims': '[512, 128]', 'dropout': 0.34092182838834895, 'batch_norm': True, 'lr': 1.0232676473417662e-05, 'weight_decay': 0.0005272888338651652, 'epochs': 258, 'loss': 'mse', 'optimizer': 'adam', 'graph_mode': 'off', 'use_snp_selection': False}. Best is trial 15 with value: 0.09769708887569035.
[I 2025-11-03 11:51:06,360] Trial 47 finished with value: 0.03712642183923762 and parameters: {'model_type': 'gcn', 'hidden_dims': '[512, 128]', 'dropout': 0.36167318450128966, 'batch_norm': True, 'lr': 3.850659430921826e-05, 'weight_decay': 0.0005065088773709554, 'epochs': 208, 'loss': 'mse', 'optimizer': 'adam', 'graph_mode': 'off', 'use_snp_selection': False}. Best is trial 15 with value: 0.09769708887569035.
[I 2025-11-03 11:51:07,968] Trial 48 finished with value: 0.046683467274230096 and parameters: {'model_type': 'gcn', 'hidden_dims': '[512, 128]', 'dropout': 0.2893255160489768, 'batch_norm': True, 'lr': 7.247084119723927e-06, 'weight_decay': 7.332143988912684e-05, 'epochs': 161, 'loss': 'mse', 'optimizer': 'adam', 'graph_mode': 'off', 'use_snp_selection': False}. Best is trial 15 with value: 0.09769708887569035.
[I 2025-11-03 11:51:09,007] Trial 49 finished with value: 0.004532818457577092 and parameters: {'model_type': 'gcn', 'hidden_dims': '[512, 256]', 'dropout': 0.4269253432078789, 'batch_norm': True, 'lr': 1.4922396819546698e-05, 'weight_decay': 0.00015773583850426455, 'epochs': 47, 'loss': 'mse', 'optimizer': 'adam', 'graph_mode': 'off', 'use_snp_selection': False}. Best is trial 15 with value: 0.09769708887569035.
[I 2025-11-03 11:51:11,034] Trial 50 finished with value: 0.0030260435707428943 and parameters: {'model_type': 'gcn', 'hidden_dims': '[512, 128]', 'dropout': 0.48505854885074917, 'batch_norm': True, 'lr': 2.1520080085897993e-05, 'weight_decay': 2.902981783466885e-06, 'epochs': 236, 'loss': 'mse', 'optimizer': 'adam', 'graph_mode': 'off', 'use_snp_selection': False}. Best is trial 15 with value: 0.09769708887569035.
[I 2025-11-03 11:51:12,271] Trial 51 finished with value: -0.0010076171043179763 and parameters: {'model_type': 'gcn', 'hidden_dims': '[128, 64]', 'dropout': 0.5498336093206059, 'batch_norm': True, 'lr': 2.7489499451904196e-06, 'weight_decay': 0.000299117031963098, 'epochs': 283, 'loss': 'mae', 'optimizer': 'adam', 'graph_mode': 'off', 'use_snp_selection': True, 'num_snps': 7065}. Best is trial 15 with value: 0.09769708887569035.
[I 2025-11-03 11:51:14,443] Trial 52 finished with value: 0.016266987100577893 and parameters: {'model_type': 'gcn', 'hidden_dims': '[256, 128, 64]', 'dropout': 0.4002290576231054, 'batch_norm': True, 'lr': 4.5958745046237e-06, 'weight_decay': 0.00015113146033661782, 'epochs': 341, 'loss': 'mae', 'optimizer': 'adam', 'graph_mode': 'off', 'use_snp_selection': False}. Best is trial 15 with value: 0.09769708887569035.
[I 2025-11-03 11:51:15,910] Trial 53 finished with value: 0.04647773689819462 and parameters: {'model_type': 'gcn', 'hidden_dims': '[128, 64]', 'dropout': 0.14390353506955178, 'batch_norm': True, 'lr': 1.3157169622494858e-06, 'weight_decay': 6.480431215716626e-06, 'epochs': 306, 'loss': 'mse', 'optimizer': 'adam', 'graph_mode': 'off', 'use_snp_selection': True, 'num_snps': 16158}. Best is trial 15 with value: 0.09769708887569035.
[I 2025-11-03 11:51:17,677] Trial 54 finished with value: 0.03495149898607878 and parameters: {'model_type': 'gcn', 'hidden_dims': '[512, 64]', 'dropout': 0.23477681974313017, 'batch_norm': False, 'lr': 7.601670517366696e-05, 'weight_decay': 5.8692276283419665e-05, 'epochs': 185, 'loss': 'mae', 'optimizer': 'adam', 'graph_mode': 'off', 'use_snp_selection': False}. Best is trial 15 with value: 0.09769708887569035.
[I 2025-11-03 11:51:19,143] Trial 55 finished with value: -0.0002940224939284422 and parameters: {'model_type': 'gcn', 'hidden_dims': '[128, 64]', 'dropout': 0.44819770212130666, 'batch_norm': True, 'lr': 6.428795134560092e-06, 'weight_decay': 0.00011819117914812939, 'epochs': 257, 'loss': 'mse', 'optimizer': 'adam', 'graph_mode': 'off', 'use_snp_selection': True, 'num_snps': 23875}. Best is trial 15 with value: 0.09769708887569035.
[I 2025-11-03 11:51:21,000] Trial 56 finished with value: 0.04375851462341426 and parameters: {'model_type': 'gcn', 'hidden_dims': '[256, 128, 64]', 'dropout': 0.38105056676635274, 'batch_norm': False, 'lr': 1.0065175526178503e-05, 'weight_decay': 3.275083099933464e-05, 'epochs': 267, 'loss': 'mse', 'optimizer': 'adam', 'graph_mode': 'off', 'use_snp_selection': True, 'num_snps': 29679}. Best is trial 15 with value: 0.09769708887569035.
[I 2025-11-03 11:51:22,848] Trial 57 finished with value: -0.006785222152961339 and parameters: {'model_type': 'gcn', 'hidden_dims': '[256, 128]', 'dropout': 0.1259859459526025, 'batch_norm': True, 'lr': 3.1696348207332068e-06, 'weight_decay': 0.0002593410006730824, 'epochs': 334, 'loss': 'mae', 'optimizer': 'adam', 'graph_mode': 'off', 'use_snp_selection': False}. Best is trial 15 with value: 0.09769708887569035.
[I 2025-11-03 11:51:24,115] Trial 58 finished with value: 0.002545443414948752 and parameters: {'model_type': 'gcn', 'hidden_dims': '[512, 128]', 'dropout': 0.34211584869642414, 'batch_norm': False, 'lr': 2.319513713075221e-06, 'weight_decay': 8.885543935162559e-05, 'epochs': 293, 'loss': 'mse', 'optimizer': 'adam', 'graph_mode': 'off', 'use_snp_selection': True, 'num_snps': 10106}. Best is trial 15 with value: 0.09769708887569035.
[I 2025-11-03 11:51:26,782] Trial 59 finished with value: 0.054894554351493555 and parameters: {'model_type': 'gcn', 'hidden_dims': '[512, 256]', 'dropout': 0.2500688504291888, 'batch_norm': True, 'lr': 1.5991726328057798e-05, 'weight_decay': 8.269422849726826e-06, 'epochs': 349, 'loss': 'mse', 'optimizer': 'adam', 'graph_mode': 'off', 'use_snp_selection': False}. Best is trial 15 with value: 0.09769708887569035.
