[I 2025-11-03 13:20:36,731] Trial 96 finished with value: 0.08793314438438007 and parameters: {'model_type': 'gcn', 'hidden_dims': '[128, 64]', 'dropout': 0.3044174817062691, 'batch_norm': True, 'lr': 0.00033145105699973297, 'weight_decay': 7.464262677662911e-06, 'epochs': 312, 'loss': 'mse', 'optimizer': 'adam', 'graph_mode': 'off', 'use_snp_selection': False}. Best is trial 53 with value: 0.12218763160211579.
[I 2025-11-03 13:20:38,092] Trial 97 finished with value: 0.09126390069494074 and parameters: {'model_type': 'gcn', 'hidden_dims': '[128, 64]', 'dropout': 0.2941953029067348, 'batch_norm': True, 'lr': 0.0008106383710973551, 'weight_decay': 9.796219798330458e-06, 'epochs': 342, 'loss': 'mae', 'optimizer': 'adam', 'graph_mode': 'off', 'use_snp_selection': False}. Best is trial 53 with value: 0.12218763160211579.
[I 2025-11-03 13:20:39,304] Trial 98 finished with value: 0.10445587093678188 and parameters: {'model_type': 'gcn', 'hidden_dims': '[128, 64]', 'dropout': 0.27219277633307987, 'batch_norm': True, 'lr': 0.0006707142507370225, 'weight_decay': 1.1119318171196175e-05, 'epochs': 281, 'loss': 'mse', 'optimizer': 'adam', 'graph_mode': 'off', 'use_snp_selection': False}. Best is trial 53 with value: 0.12218763160211579.
[I 2025-11-03 13:20:40,535] Trial 99 finished with value: 0.03313223925622538 and parameters: {'model_type': 'gcn', 'hidden_dims': '[128, 64]', 'dropout': 0.21882293069522407, 'batch_norm': False, 'lr': 2.3294687156157485e-06, 'weight_decay': 4.826901894477643e-06, 'epochs': 302, 'loss': 'mae', 'optimizer': 'adam', 'graph_mode': 'off', 'use_snp_selection': False}. Best is trial 53 with value: 0.12218763160211579.
[I 2025-11-03 13:20:41,760] Trial 100 finished with value: 0.11168216936477988 and parameters: {'model_type': 'gcn', 'hidden_dims': '[128, 64]', 'dropout': 0.24535785050666842, 'batch_norm': True, 'lr': 0.0005550375819890565, 'weight_decay': 1.1211578190653812e-05, 'epochs': 287, 'loss': 'mse', 'optimizer': 'adam', 'graph_mode': 'off', 'use_snp_selection': False}. Best is trial 53 with value: 0.12218763160211579.
[I 2025-11-03 13:20:42,918] Trial 101 finished with value: 0.08765521213303815 and parameters: {'model_type': 'gcn', 'hidden_dims': '[128, 64]', 'dropout': 0.24696649745466445, 'batch_norm': True, 'lr': 0.0005600208896211092, 'weight_decay': 1.246741539333154e-05, 'epochs': 266, 'loss': 'mse', 'optimizer': 'adam', 'graph_mode': 'off', 'use_snp_selection': False}. Best is trial 53 with value: 0.12218763160211579.
[I 2025-11-03 13:20:44,148] Trial 102 finished with value: 0.08581783920967657 and parameters: {'model_type': 'gcn', 'hidden_dims': '[128, 64]', 'dropout': 0.2388639946679189, 'batch_norm': True, 'lr': 0.0004832766074332765, 'weight_decay': 1.0517417918966297e-05, 'epochs': 290, 'loss': 'mse', 'optimizer': 'adam', 'graph_mode': 'off', 'use_snp_selection': False}. Best is trial 53 with value: 0.12218763160211579.
[I 2025-11-03 13:20:45,382] Trial 103 finished with value: 0.09883924967225724 and parameters: {'model_type': 'gcn', 'hidden_dims': '[128, 64]', 'dropout': 0.1961606058518849, 'batch_norm': True, 'lr': 0.0009949458311552203, 'weight_decay': 2.070392720108488e-05, 'epochs': 297, 'loss': 'mse', 'optimizer': 'adam', 'graph_mode': 'off', 'use_snp_selection': False}. Best is trial 53 with value: 0.12218763160211579.
[I 2025-11-03 13:20:46,670] Trial 104 finished with value: 0.10744764336409818 and parameters: {'model_type': 'gcn', 'hidden_dims': '[128, 64]', 'dropout': 0.2625015724814263, 'batch_norm': True, 'lr': 0.0007058012521126933, 'weight_decay': 1.4982515300046131e-05, 'epochs': 316, 'loss': 'mse', 'optimizer': 'adam', 'graph_mode': 'off', 'use_snp_selection': False}. Best is trial 53 with value: 0.12218763160211579.
[I 2025-11-03 13:20:48,523] Trial 105 finished with value: 0.09573097599951219 and parameters: {'model_type': 'gcn', 'hidden_dims': '[256, 128, 64]', 'dropout': 0.2302763403254653, 'batch_norm': True, 'lr': 0.0008682093818172915, 'weight_decay': 1.4461279303395415e-05, 'epochs': 328, 'loss': 'mse', 'optimizer': 'adam', 'graph_mode': 'off', 'use_snp_selection': False}. Best is trial 53 with value: 0.12218763160211579.
[I 2025-11-03 13:20:50,605] Trial 106 finished with value: 0.096911657170672 and parameters: {'model_type': 'gcn', 'hidden_dims': '[512, 256]', 'dropout': 0.257810191397837, 'batch_norm': True, 'lr': 0.00041243061321333214, 'weight_decay': 2.608738585489766e-05, 'epochs': 316, 'loss': 'mse', 'optimizer': 'adam', 'graph_mode': 'off', 'use_snp_selection': False}. Best is trial 53 with value: 0.12218763160211579.
[I 2025-11-03 13:20:51,891] Trial 107 finished with value: 0.07645542044588204 and parameters: {'model_type': 'gcn', 'hidden_dims': '[128, 64]', 'dropout': 0.17537159420238657, 'batch_norm': True, 'lr': 0.0007270975050190714, 'weight_decay': 4.149292199230157e-05, 'epochs': 309, 'loss': 'mae', 'optimizer': 'adam', 'graph_mode': 'off', 'use_snp_selection': False}. Best is trial 53 with value: 0.12218763160211579.
[I 2025-11-03 13:20:53,117] Trial 108 finished with value: 0.07605803284857299 and parameters: {'model_type': 'gcn', 'hidden_dims': '[512, 64]', 'dropout': 0.21093892897310001, 'batch_norm': True, 'lr': 0.00028903213430269016, 'weight_decay': 7.626211169815292e-06, 'epochs': 253, 'loss': 'mae', 'optimizer': 'adam', 'graph_mode': 'off', 'use_snp_selection': True, 'num_snps': 11322}. Best is trial 53 with value: 0.12218763160211579.
[I 2025-11-03 13:20:54,505] Trial 109 finished with value: 0.11370992521872059 and parameters: {'model_type': 'gcn', 'hidden_dims': '[128, 64]', 'dropout': 0.4219760636243896, 'batch_norm': True, 'lr': 0.000592781053480467, 'weight_decay': 1.9121422748101938e-05, 'epochs': 349, 'loss': 'mse', 'optimizer': 'adam', 'graph_mode': 'off', 'use_snp_selection': False}. Best is trial 53 with value: 0.12218763160211579.
[I 2025-11-03 13:20:55,876] Trial 110 finished with value: 0.10268580291002544 and parameters: {'model_type': 'gcn', 'hidden_dims': '[128, 64]', 'dropout': 0.4277030202812725, 'batch_norm': True, 'lr': 0.00059741283203341, 'weight_decay': 1.6275118982936994e-05, 'epochs': 344, 'loss': 'mse', 'optimizer': 'adam', 'graph_mode': 'off', 'use_snp_selection': False}. Best is trial 53 with value: 0.12218763160211579.
[I 2025-11-03 13:20:57,226] Trial 111 finished with value: 0.08761597345411459 and parameters: {'model_type': 'gcn', 'hidden_dims': '[128, 64]', 'dropout': 0.4779377288287688, 'batch_norm': True, 'lr': 0.0004764837976241207, 'weight_decay': 2.0260862790492218e-05, 'epochs': 335, 'loss': 'mse', 'optimizer': 'adam', 'graph_mode': 'off', 'use_snp_selection': False}. Best is trial 53 with value: 0.12218763160211579.
[I 2025-11-03 13:20:58,607] Trial 112 finished with value: 0.08271922313401411 and parameters: {'model_type': 'gcn', 'hidden_dims': '[128, 64]', 'dropout': 0.33492504637719395, 'batch_norm': True, 'lr': 0.0003520367642617711, 'weight_decay': 5.915446707648828e-06, 'epochs': 349, 'loss': 'mse', 'optimizer': 'adam', 'graph_mode': 'off', 'use_snp_selection': False}. Best is trial 53 with value: 0.12218763160211579.
[I 2025-11-03 13:20:59,904] Trial 113 finished with value: 0.11113928869767646 and parameters: {'model_type': 'gcn', 'hidden_dims': '[128, 64]', 'dropout': 0.45859492276200275, 'batch_norm': True, 'lr': 0.0005650672296008424, 'weight_decay': 1.2394208685762139e-05, 'epochs': 320, 'loss': 'mse', 'optimizer': 'adam', 'graph_mode': 'off', 'use_snp_selection': False}. Best is trial 53 with value: 0.12218763160211579.
[I 2025-11-03 13:21:01,299] Trial 114 finished with value: 0.10610282116964946 and parameters: {'model_type': 'gcn', 'hidden_dims': '[128, 64]', 'dropout': 0.4607613797749791, 'batch_norm': True, 'lr': 0.0008366602037164383, 'weight_decay': 4.370652436335042e-06, 'epochs': 322, 'loss': 'mse', 'optimizer': 'adam', 'graph_mode': 'off', 'use_snp_selection': False}. Best is trial 53 with value: 0.12218763160211579.
[I 2025-11-03 13:21:02,610] Trial 115 finished with value: 0.07808643496229654 and parameters: {'model_type': 'gcn', 'hidden_dims': '[128, 64]', 'dropout': 0.4489620844184692, 'batch_norm': True, 'lr': 0.0005296255017543495, 'weight_decay': 5.25943941426941e-06, 'epochs': 319, 'loss': 'mse', 'optimizer': 'adam', 'graph_mode': 'off', 'use_snp_selection': False}. Best is trial 53 with value: 0.12218763160211579.
[I 2025-11-03 13:21:03,919] Trial 116 finished with value: 0.09080418508300575 and parameters: {'model_type': 'gcn', 'hidden_dims': '[128, 64]', 'dropout': 0.5022591569901325, 'batch_norm': True, 'lr': 0.0007391069776058268, 'weight_decay': 2.3692184367057107e-06, 'epochs': 324, 'loss': 'mse', 'optimizer': 'adam', 'graph_mode': 'off', 'use_snp_selection': False}. Best is trial 53 with value: 0.12218763160211579.
[I 2025-11-03 13:21:05,162] Trial 117 finished with value: 0.09413913202311285 and parameters: {'model_type': 'gcn', 'hidden_dims': '[128, 64]', 'dropout': 0.4579236875977333, 'batch_norm': True, 'lr': 0.0006092177187308969, 'weight_decay': 4.1279536370069384e-06, 'epochs': 299, 'loss': 'mse', 'optimizer': 'adam', 'graph_mode': 'off', 'use_snp_selection': False}. Best is trial 53 with value: 0.12218763160211579.
[I 2025-11-03 13:21:06,442] Trial 118 finished with value: 0.10382025952551367 and parameters: {'model_type': 'gcn', 'hidden_dims': '[128, 64]', 'dropout': 0.40956387286237267, 'batch_norm': True, 'lr': 0.0006702993706710432, 'weight_decay': 1.400115561479209e-06, 'epochs': 311, 'loss': 'mse', 'optimizer': 'adam', 'graph_mode': 'off', 'use_snp_selection': False}. Best is trial 53 with value: 0.12218763160211579.
[I 2025-11-03 13:21:07,824] Trial 119 finished with value: 0.0310295223780724 and parameters: {'model_type': 'gcn', 'hidden_dims': '[256, 128]', 'dropout': 0.4936560390901058, 'batch_norm': False, 'lr': 0.0008778395364198922, 'weight_decay': 8.32676387459776e-06, 'epochs': 289, 'loss': 'mse', 'optimizer': 'adam', 'graph_mode': 'off', 'use_snp_selection': False}. Best is trial 53 with value: 0.12218763160211579.
[I 2025-11-03 13:21:09,168] Trial 120 finished with value: 0.08724368534984445 and parameters: {'model_type': 'gcn', 'hidden_dims': '[128, 64]', 'dropout': 0.47240544946959917, 'batch_norm': True, 'lr': 0.00042922142133174155, 'weight_decay': 6.997124246205035e-06, 'epochs': 337, 'loss': 'mse', 'optimizer': 'adam', 'graph_mode': 'off', 'use_snp_selection': False}. Best is trial 53 with value: 0.12218763160211579.
[I 2025-11-03 13:21:10,476] Trial 121 finished with value: 0.09982580723047851 and parameters: {'model_type': 'gcn', 'hidden_dims': '[128, 64]', 'dropout': 0.43599586915752875, 'batch_norm': True, 'lr': 0.0008176489032535958, 'weight_decay': 1.1826028207928206e-05, 'epochs': 318, 'loss': 'mse', 'optimizer': 'adam', 'graph_mode': 'off', 'use_snp_selection': False}. Best is trial 53 with value: 0.12218763160211579.
[I 2025-11-03 13:21:11,638] Trial 122 finished with value: 0.10688638160610617 and parameters: {'model_type': 'gcn', 'hidden_dims': '[128, 64]', 'dropout': 0.5110087218621101, 'batch_norm': True, 'lr': 0.0005422083102491192, 'weight_decay': 2.9731334098283604e-06, 'epochs': 269, 'loss': 'mse', 'optimizer': 'adam', 'graph_mode': 'off', 'use_snp_selection': False}. Best is trial 53 with value: 0.12218763160211579.
[I 2025-11-03 13:21:12,867] Trial 123 finished with value: 0.09214537658647903 and parameters: {'model_type': 'gcn', 'hidden_dims': '[128, 64]', 'dropout': 0.5009567685916451, 'batch_norm': True, 'lr': 0.0005450755412049597, 'weight_decay': 3.2022278330605752e-06, 'epochs': 271, 'loss': 'mse', 'optimizer': 'adam', 'graph_mode': 'off', 'use_snp_selection': False}. Best is trial 53 with value: 0.12218763160211579.
[I 2025-11-03 13:21:14,132] Trial 124 finished with value: 0.105432909989795 and parameters: {'model_type': 'gcn', 'hidden_dims': '[128, 64]', 'dropout': 0.5133758017351906, 'batch_norm': True, 'lr': 0.0007246441060663611, 'weight_decay': 2.7021884298970286e-06, 'epochs': 301, 'loss': 'mse', 'optimizer': 'adam', 'graph_mode': 'off', 'use_snp_selection': False}. Best is trial 53 with value: 0.12218763160211579.
[I 2025-11-03 13:21:15,798] Trial 125 finished with value: 0.10084679180303142 and parameters: {'model_type': 'gcn', 'hidden_dims': '[256, 128, 64]', 'dropout': 0.5229629352214652, 'batch_norm': True, 'lr': 0.0005108069169004074, 'weight_decay': 4.147827338268091e-06, 'epochs': 284, 'loss': 'mse', 'optimizer': 'adam', 'graph_mode': 'off', 'use_snp_selection': False}. Best is trial 53 with value: 0.12218763160211579.
[I 2025-11-03 13:21:16,954] Trial 126 finished with value: 0.09028789007848294 and parameters: {'model_type': 'gcn', 'hidden_dims': '[128, 64]', 'dropout': 0.5437196642319235, 'batch_norm': True, 'lr': 0.00036707808159118114, 'weight_decay': 1.459420174627013e-05, 'epochs': 262, 'loss': 'mse', 'optimizer': 'adam', 'graph_mode': 'off', 'use_snp_selection': False}. Best is trial 53 with value: 0.12218763160211579.
[I 2025-11-03 13:21:18,282] Trial 127 finished with value: 0.08668360789663608 and parameters: {'model_type': 'gcn', 'hidden_dims': '[128, 64]', 'dropout': 0.450411668427734, 'batch_norm': True, 'lr': 0.0006152123441544785, 'weight_decay': 9.257201573003079e-06, 'epochs': 326, 'loss': 'mse', 'optimizer': 'adam', 'graph_mode': 'off', 'use_snp_selection': False}. Best is trial 53 with value: 0.12218763160211579.
[I 2025-11-03 13:21:19,498] Trial 128 finished with value: 0.0852680546171991 and parameters: {'model_type': 'gcn', 'hidden_dims': '[128, 64]', 'dropout': 0.46232356306456046, 'batch_norm': True, 'lr': 0.0004549034288803636, 'weight_decay': 9.159631459669702e-07, 'epochs': 276, 'loss': 'mse', 'optimizer': 'adam', 'graph_mode': 'off', 'use_snp_selection': False}. Best is trial 53 with value: 0.12218763160211579.
[I 2025-11-03 13:21:21,485] Trial 129 finished with value: 0.10015952572033004 and parameters: {'model_type': 'gcn', 'hidden_dims': '[128, 64]', 'dropout': 0.48412499941441534, 'batch_norm': True, 'lr': 0.0009749743481034168, 'weight_decay': 1.8051233468546949e-06, 'epochs': 295, 'loss': 'mse', 'optimizer': 'adam', 'graph_mode': 'off', 'use_snp_selection': True, 'num_snps': 51837}. Best is trial 53 with value: 0.12218763160211579.
[I 2025-11-03 13:21:22,752] Trial 130 finished with value: 0.09777234596424624 and parameters: {'model_type': 'gcn', 'hidden_dims': '[128, 64]', 'dropout': 0.47441505576348686, 'batch_norm': True, 'lr': 0.0007339862040578841, 'weight_decay': 2.0637987285740123e-06, 'epochs': 307, 'loss': 'mse', 'optimizer': 'adam', 'graph_mode': 'off', 'use_snp_selection': False}. Best is trial 53 with value: 0.12218763160211579.
[I 2025-11-03 13:21:24,007] Trial 131 finished with value: 0.09067300508169941 and parameters: {'model_type': 'gcn', 'hidden_dims': '[128, 64]', 'dropout': 0.5130175648012997, 'batch_norm': True, 'lr': 0.0007202582489342522, 'weight_decay': 2.5948533968717738e-06, 'epochs': 303, 'loss': 'mse', 'optimizer': 'adam', 'graph_mode': 'off', 'use_snp_selection': False}. Best is trial 53 with value: 0.12218763160211579.
[I 2025-11-03 13:21:25,294] Trial 132 finished with value: 0.08521937218324088 and parameters: {'model_type': 'gcn', 'hidden_dims': '[128, 64]', 'dropout': 0.5402641026763897, 'batch_norm': True, 'lr': 0.0005855793976880053, 'weight_decay': 2.8715881703440544e-06, 'epochs': 315, 'loss': 'mse', 'optimizer': 'adam', 'graph_mode': 'off', 'use_snp_selection': False}. Best is trial 53 with value: 0.12218763160211579.
[I 2025-11-03 13:21:26,523] Trial 133 finished with value: 0.10114947784684078 and parameters: {'model_type': 'gcn', 'hidden_dims': '[128, 64]', 'dropout': 0.4251088243052065, 'batch_norm': True, 'lr': 0.0006674969536749936, 'weight_decay': 1.8577021233136707e-05, 'epochs': 287, 'loss': 'mse', 'optimizer': 'adam', 'graph_mode': 'off', 'use_snp_selection': False}. Best is trial 53 with value: 0.12218763160211579.
[I 2025-11-03 13:21:27,717] Trial 134 finished with value: 0.10848928373513465 and parameters: {'model_type': 'gcn', 'hidden_dims': '[128, 64]', 'dropout': 0.5116436784536732, 'batch_norm': True, 'lr': 0.0008610217700450276, 'weight_decay': 2.520480792350511e-05, 'epochs': 280, 'loss': 'mse', 'optimizer': 'adam', 'graph_mode': 'off', 'use_snp_selection': False}. Best is trial 53 with value: 0.12218763160211579.
[I 2025-11-03 13:21:29,559] Trial 135 finished with value: 0.09593643584335144 and parameters: {'model_type': 'gcn', 'hidden_dims': '[512, 256]', 'dropout': 0.4934875820323986, 'batch_norm': True, 'lr': 0.0008596097189063454, 'weight_decay': 2.6689234603679895e-05, 'epochs': 269, 'loss': 'mse', 'optimizer': 'adam', 'graph_mode': 'off', 'use_snp_selection': False}. Best is trial 53 with value: 0.12218763160211579.
[I 2025-11-03 13:21:30,750] Trial 136 finished with value: 0.10303966837505663 and parameters: {'model_type': 'gcn', 'hidden_dims': '[128, 64]', 'dropout': 0.24763336568764757, 'batch_norm': True, 'lr': 0.0005142245504899938, 'weight_decay': 2.2058989531092067e-05, 'epochs': 279, 'loss': 'mse', 'optimizer': 'adam', 'graph_mode': 'off', 'use_snp_selection': False}. Best is trial 53 with value: 0.12218763160211579.
[I 2025-11-03 13:21:32,306] Trial 137 finished with value: 0.11694536941718724 and parameters: {'model_type': 'gcn', 'hidden_dims': '[256, 128, 64]', 'dropout': 0.5296794911976691, 'batch_norm': True, 'lr': 0.000798480096226136, 'weight_decay': 3.4192105751457186e-05, 'epochs': 257, 'loss': 'mse', 'optimizer': 'adam', 'graph_mode': 'off', 'use_snp_selection': False}. Best is trial 53 with value: 0.12218763160211579.
[I 2025-11-03 13:21:33,876] Trial 138 finished with value: 0.09858143977446857 and parameters: {'model_type': 'gcn', 'hidden_dims': '[256, 128, 64]', 'dropout': 0.5287705079322634, 'batch_norm': True, 'lr': 0.0006136414685463147, 'weight_decay': 4.427222875405359e-07, 'epochs': 257, 'loss': 'mse', 'optimizer': 'adam', 'graph_mode': 'off', 'use_snp_selection': False}. Best is trial 53 with value: 0.12218763160211579.
[I 2025-11-03 13:21:35,409] Trial 139 finished with value: 0.08765482479607262 and parameters: {'model_type': 'gcn', 'hidden_dims': '[256, 128, 64]', 'dropout': 0.5544953586645783, 'batch_norm': True, 'lr': 0.0009777691914177747, 'weight_decay': 3.277546724319721e-05, 'epochs': 251, 'loss': 'mse', 'optimizer': 'adam', 'graph_mode': 'off', 'use_snp_selection': False}. Best is trial 53 with value: 0.12218763160211579.
[I 2025-11-03 13:21:36,818] Trial 140 finished with value: -0.0034204917973365855 and parameters: {'model_type': 'gcn', 'hidden_dims': '[256, 128, 64]', 'dropout': 0.5099388718350525, 'batch_norm': False, 'lr': 0.00044752879609897666, 'weight_decay': 1.327806394523226e-05, 'epochs': 237, 'loss': 'mse', 'optimizer': 'adam', 'graph_mode': 'off', 'use_snp_selection': False}. Best is trial 53 with value: 0.12218763160211579.
[I 2025-11-03 13:21:38,394] Trial 141 finished with value: 0.09422189898905486 and parameters: {'model_type': 'gcn', 'hidden_dims': '[256, 128, 64]', 'dropout': 0.5226733807843247, 'batch_norm': True, 'lr': 0.0007400993551747176, 'weight_decay': 1.652277438679959e-05, 'epochs': 262, 'loss': 'mse', 'optimizer': 'adam', 'graph_mode': 'off', 'use_snp_selection': False}. Best is trial 53 with value: 0.12218763160211579.
[I 2025-11-03 13:21:39,635] Trial 142 finished with value: 0.09208035772437996 and parameters: {'model_type': 'gcn', 'hidden_dims': '[128, 64]', 'dropout': 0.37507014998170374, 'batch_norm': True, 'lr': 0.0008791562680731643, 'weight_decay': 2.4146419757738966e-05, 'epochs': 293, 'loss': 'mse', 'optimizer': 'adam', 'graph_mode': 'off', 'use_snp_selection': False}. Best is trial 53 with value: 0.12218763160211579.
[I 2025-11-03 13:21:41,485] Trial 143 finished with value: 0.11564990862835531 and parameters: {'model_type': 'gcn', 'hidden_dims': '[512, 64]', 'dropout': 0.48247671753809485, 'batch_norm': True, 'lr': 0.0005621111884463208, 'weight_decay': 5.5083075844679686e-05, 'epochs': 274, 'loss': 'mse', 'optimizer': 'adam', 'graph_mode': 'off', 'use_snp_selection': False}. Best is trial 53 with value: 0.12218763160211579.
[I 2025-11-03 13:21:43,382] Trial 144 finished with value: 0.09833979978300018 and parameters: {'model_type': 'gcn', 'hidden_dims': '[512, 64]', 'dropout': 0.48298413317138406, 'batch_norm': True, 'lr': 0.00038476295905077486, 'weight_decay': 5.579287288773703e-05, 'epochs': 272, 'loss': 'mse', 'optimizer': 'adam', 'graph_mode': 'off', 'use_snp_selection': False}. Best is trial 53 with value: 0.12218763160211579.
[I 2025-11-03 13:21:45,263] Trial 145 finished with value: 0.0899581325560194 and parameters: {'model_type': 'gcn', 'hidden_dims': '[512, 64]', 'dropout': 0.5041308372331966, 'batch_norm': True, 'lr': 0.000547655663834522, 'weight_decay': 4.308987515157542e-05, 'epochs': 279, 'loss': 'mse', 'optimizer': 'adam', 'graph_mode': 'off', 'use_snp_selection': False}. Best is trial 53 with value: 0.12218763160211579.
[I 2025-11-03 13:21:47,094] Trial 146 finished with value: 0.0995797051963783 and parameters: {'model_type': 'gcn', 'hidden_dims': '[512, 64]', 'dropout': 0.5525222274639261, 'batch_norm': True, 'lr': 0.000623274813562997, 'weight_decay': 3.574809382700932e-05, 'epochs': 268, 'loss': 'mse', 'optimizer': 'adam', 'graph_mode': 'off', 'use_snp_selection': False}. Best is trial 53 with value: 0.12218763160211579.
[I 2025-11-03 13:21:49,009] Trial 147 finished with value: 0.10062897103737692 and parameters: {'model_type': 'gcn', 'hidden_dims': '[512, 64]', 'dropout': 0.22361593481003467, 'batch_norm': True, 'lr': 0.0004974446131658405, 'weight_decay': 3.089842424565485e-05, 'epochs': 285, 'loss': 'mse', 'optimizer': 'adam', 'graph_mode': 'off', 'use_snp_selection': False}. Best is trial 53 with value: 0.12218763160211579.
