[I 2025-11-03 12:30:43,008] Trial 39 finished with value: 0.12219726589541408 and parameters: {'model_type': 'graphsage', 'hidden_dims': '[128, 64]', 'dropout': 0.305940331740131, 'batch_norm': True, 'lr': 5.951728809037167e-05, 'weight_decay': 2.925779008441517e-07, 'epochs': 266, 'loss': 'mae', 'optimizer': 'adam', 'graph_mode': 'knn', 'source': 'grm', 'knn_k': 2, 'weighted_edges': False, 'symmetrize_mode': 'mutual', 'use_snp_selection': True, 'num_snps': 40771}. Best is trial 6 with value: 0.17598734759364715.
[I 2025-11-03 12:30:48,966] Trial 40 finished with value: 0.15061966236895505 and parameters: {'model_type': 'graphsage', 'hidden_dims': '[512, 128]', 'dropout': 0.28479077009404963, 'batch_norm': True, 'lr': 0.00019710543504780143, 'weight_decay': 5.556657404526373e-07, 'epochs': 96, 'loss': 'mse', 'optimizer': 'adam', 'graph_mode': 'cutoff', 'cutoff': 0.22456674910531654, 'grm_norm': 'gcn', 'self_loops': True, 'use_snp_selection': False}. Best is trial 6 with value: 0.17598734759364715.
[I 2025-11-03 12:30:58,540] Trial 41 finished with value: 0.17058799772911368 and parameters: {'model_type': 'graphsage', 'hidden_dims': '[512, 64]', 'dropout': 0.34124170332836035, 'batch_norm': True, 'lr': 0.00016426165686754017, 'weight_decay': 1.583023985284612e-07, 'epochs': 280, 'loss': 'mae', 'optimizer': 'adam', 'graph_mode': 'knn', 'source': 'grm', 'knn_k': 1, 'weighted_edges': True, 'symmetrize_mode': 'union', 'use_snp_selection': False}. Best is trial 6 with value: 0.17598734759364715.
[I 2025-11-03 12:31:08,409] Trial 42 finished with value: 0.16278312581863677 and parameters: {'model_type': 'graphsage', 'hidden_dims': '[512, 64]', 'dropout': 0.43877068168157557, 'batch_norm': True, 'lr': 0.0003340535501563417, 'weight_decay': 1.5869231186710159e-07, 'epochs': 289, 'loss': 'mae', 'optimizer': 'adam', 'graph_mode': 'knn', 'source': 'grm', 'knn_k': 1, 'weighted_edges': True, 'symmetrize_mode': 'union', 'use_snp_selection': False}. Best is trial 6 with value: 0.17598734759364715.
[I 2025-11-03 12:31:22,647] Trial 43 finished with value: 0.14758316155710519 and parameters: {'model_type': 'graphsage', 'hidden_dims': '[512, 64]', 'dropout': 0.4056084474478063, 'batch_norm': True, 'lr': 0.00010561144153880914, 'weight_decay': 1.0340072831837575e-06, 'epochs': 309, 'loss': 'mae', 'optimizer': 'adam', 'graph_mode': 'knn', 'source': 'grm', 'knn_k': 8, 'weighted_edges': True, 'symmetrize_mode': 'union', 'use_snp_selection': False}. Best is trial 6 with value: 0.17598734759364715.
[I 2025-11-03 12:31:31,374] Trial 44 finished with value: 0.17292767759377878 and parameters: {'model_type': 'graphsage', 'hidden_dims': '[512, 64]', 'dropout': 0.34210114055870133, 'batch_norm': True, 'lr': 0.000165253894269489, 'weight_decay': 1.5675976568405415e-07, 'epochs': 248, 'loss': 'mae', 'optimizer': 'adam', 'graph_mode': 'knn', 'source': 'grm', 'knn_k': 1, 'weighted_edges': True, 'symmetrize_mode': 'union', 'use_snp_selection': False}. Best is trial 6 with value: 0.17598734759364715.
[I 2025-11-03 12:31:40,649] Trial 45 finished with value: 0.15526532240809443 and parameters: {'model_type': 'graphsage', 'hidden_dims': '[512, 256]', 'dropout': 0.376513370735671, 'batch_norm': True, 'lr': 3.7324285119708175e-05, 'weight_decay': 2.026355479181201e-07, 'epochs': 249, 'loss': 'mae', 'optimizer': 'adam', 'graph_mode': 'knn', 'source': 'grm', 'knn_k': 2, 'weighted_edges': True, 'symmetrize_mode': 'union', 'use_snp_selection': False}. Best is trial 6 with value: 0.17598734759364715.
[I 2025-11-03 12:31:47,683] Trial 46 finished with value: 0.004613880751734648 and parameters: {'model_type': 'graphsage', 'hidden_dims': '[512, 64]', 'dropout': 0.34135476956552524, 'batch_norm': False, 'lr': 0.000496708151046961, 'weight_decay': 2.4162195828989077e-06, 'epochs': 187, 'loss': 'mae', 'optimizer': 'adam', 'graph_mode': 'knn', 'source': 'grm', 'knn_k': 1, 'weighted_edges': True, 'symmetrize_mode': 'union', 'use_snp_selection': False}. Best is trial 6 with value: 0.17598734759364715.
[I 2025-11-03 12:31:53,468] Trial 47 finished with value: 0.16288189889064464 and parameters: {'model_type': 'graphsage', 'hidden_dims': '[256, 128]', 'dropout': 0.40408151414973875, 'batch_norm': True, 'lr': 0.0002515959665480147, 'weight_decay': 2.5824340719073344e-07, 'epochs': 235, 'loss': 'mae', 'optimizer': 'adam', 'graph_mode': 'knn', 'source': 'grm', 'knn_k': 6, 'weighted_edges': True, 'symmetrize_mode': 'mutual', 'use_snp_selection': True, 'num_snps': 32598}. Best is trial 6 with value: 0.17598734759364715.
[I 2025-11-03 12:31:59,394] Trial 48 finished with value: 0.17898196514799913 and parameters: {'model_type': 'graphsage', 'hidden_dims': '[512, 256]', 'dropout': 0.37104413481182497, 'batch_norm': True, 'lr': 0.00012326590812866608, 'weight_decay': 4.169438279371041e-06, 'epochs': 135, 'loss': 'mae', 'optimizer': 'adam', 'graph_mode': 'cutoff', 'cutoff': 0.462747854429083, 'grm_norm': 'cosine', 'self_loops': False, 'use_snp_selection': False}. Best is trial 48 with value: 0.17898196514799913.
[I 2025-11-03 12:32:03,218] Trial 49 finished with value: 0.1622206687435999 and parameters: {'model_type': 'graphsage', 'hidden_dims': '[512, 256]', 'dropout': 0.334370554755327, 'batch_norm': True, 'lr': 0.0007526271467441306, 'weight_decay': 4.659838281483669e-06, 'epochs': 60, 'loss': 'mae', 'optimizer': 'adam', 'graph_mode': 'cutoff', 'cutoff': 0.40950619883396616, 'grm_norm': 'cosine', 'self_loops': False, 'use_snp_selection': False}. Best is trial 48 with value: 0.17898196514799913.
[I 2025-11-03 12:32:10,943] Trial 50 finished with value: 0.15256044739983443 and parameters: {'model_type': 'graphsage', 'hidden_dims': '[512, 256]', 'dropout': 0.30602747471836067, 'batch_norm': True, 'lr': 0.0001476440418370726, 'weight_decay': 1.7297403847396368e-05, 'epochs': 220, 'loss': 'mae', 'optimizer': 'adam', 'graph_mode': 'cutoff', 'cutoff': 0.523082707414331, 'grm_norm': 'cosine', 'self_loops': False, 'use_snp_selection': False}. Best is trial 48 with value: 0.17898196514799913.
[I 2025-11-03 12:32:16,441] Trial 51 finished with value: 0.14046536105829105 and parameters: {'model_type': 'graphsage', 'hidden_dims': '[512, 256]', 'dropout': 0.37644005700334343, 'batch_norm': True, 'lr': 6.681907693567885e-05, 'weight_decay': 6.520799354140706e-06, 'epochs': 135, 'loss': 'mae', 'optimizer': 'adam', 'graph_mode': 'cutoff', 'cutoff': 0.5341787455614336, 'grm_norm': 'cosine', 'self_loops': False, 'use_snp_selection': False}. Best is trial 48 with value: 0.17898196514799913.
[I 2025-11-03 12:32:21,781] Trial 52 finished with value: 0.14554084007409326 and parameters: {'model_type': 'graphsage', 'hidden_dims': '[512, 256]', 'dropout': 0.36077962225187915, 'batch_norm': True, 'lr': 0.00010118749397937296, 'weight_decay': 1.0050077568978752e-05, 'epochs': 131, 'loss': 'mae', 'optimizer': 'adam', 'graph_mode': 'cutoff', 'cutoff': 0.7569716130981785, 'grm_norm': 'none', 'self_loops': False, 'use_snp_selection': False}. Best is trial 48 with value: 0.17898196514799913.
[I 2025-11-03 12:32:27,960] Trial 53 finished with value: 0.15385893925869587 and parameters: {'model_type': 'graphsage', 'hidden_dims': '[512, 256]', 'dropout': 0.39762035576110133, 'batch_norm': True, 'lr': 0.00017432433513206243, 'weight_decay': 4.930443145875838e-07, 'epochs': 164, 'loss': 'mae', 'optimizer': 'adam', 'graph_mode': 'cutoff', 'cutoff': 0.627810760232268, 'grm_norm': 'cosine_then_gcn', 'self_loops': False, 'use_snp_selection': False}. Best is trial 48 with value: 0.17898196514799913.
[I 2025-11-03 12:32:35,585] Trial 54 finished with value: 0.14935419732611932 and parameters: {'model_type': 'graphsage', 'hidden_dims': '[512, 64]', 'dropout': 0.44599716574057346, 'batch_norm': True, 'lr': 0.00031061188164208743, 'weight_decay': 1.1162042192691248e-06, 'epochs': 142, 'loss': 'mae', 'optimizer': 'adam', 'graph_mode': 'knn', 'source': 'grm', 'knn_k': 3, 'weighted_edges': False, 'symmetrize_mode': 'union', 'use_snp_selection': True, 'num_snps': 46831}. Best is trial 48 with value: 0.17898196514799913.
[I 2025-11-03 12:32:41,548] Trial 55 finished with value: 0.14597526194703242 and parameters: {'model_type': 'graphsage', 'hidden_dims': '[256, 128, 64]', 'dropout': 0.349554369985164, 'batch_norm': False, 'lr': 4.546719844915635e-05, 'weight_decay': 0.0005173432800330201, 'epochs': 114, 'loss': 'mae', 'optimizer': 'adam', 'graph_mode': 'knn', 'source': 'grm', 'knn_k': 4, 'weighted_edges': True, 'symmetrize_mode': 'mutual', 'use_snp_selection': True, 'num_snps': 53132}. Best is trial 48 with value: 0.17898196514799913.
[I 2025-11-03 12:32:47,325] Trial 56 finished with value: 0.17190849062212588 and parameters: {'model_type': 'graphsage', 'hidden_dims': '[256, 128]', 'dropout': 0.41793455274795993, 'batch_norm': True, 'lr': 0.00013396869687809154, 'weight_decay': 4.16340984198045e-06, 'epochs': 182, 'loss': 'mae', 'optimizer': 'adam', 'graph_mode': 'knn', 'source': 'grm', 'knn_k': 10, 'weighted_edges': False, 'symmetrize_mode': 'mutual', 'use_snp_selection': False}. Best is trial 48 with value: 0.17898196514799913.
[I 2025-11-03 12:32:58,128] Trial 57 finished with value: 0.15235665435397305 and parameters: {'model_type': 'graphsage', 'hidden_dims': '[512, 256]', 'dropout': 0.36818998677037074, 'batch_norm': True, 'lr': 0.00013305468025178263, 'weight_decay': 4.199763988128841e-06, 'epochs': 202, 'loss': 'mae', 'optimizer': 'adam', 'graph_mode': 'knn', 'source': 'grm', 'knn_k': 10, 'weighted_edges': False, 'symmetrize_mode': 'union', 'use_snp_selection': False}. Best is trial 48 with value: 0.17898196514799913.
[I 2025-11-03 12:33:04,358] Trial 58 finished with value: 0.13647443505851428 and parameters: {'model_type': 'graphsage', 'hidden_dims': '[256, 128]', 'dropout': 0.4725904577947131, 'batch_norm': True, 'lr': 0.0002420042522844029, 'weight_decay': 2.2166151844614394e-05, 'epochs': 256, 'loss': 'mae', 'optimizer': 'adam', 'graph_mode': 'cutoff', 'cutoff': 0.4367676407466746, 'grm_norm': 'cosine', 'self_loops': False, 'use_snp_selection': False}. Best is trial 48 with value: 0.17898196514799913.
[I 2025-11-03 12:33:12,104] Trial 59 finished with value: 0.1827482862178971 and parameters: {'model_type': 'graphsage', 'hidden_dims': '[512, 128]', 'dropout': 0.42078537391070814, 'batch_norm': True, 'lr': 6.68050951987149e-05, 'weight_decay': 7.879017365764781e-06, 'epochs': 180, 'loss': 'mse', 'optimizer': 'adam', 'graph_mode': 'knn', 'source': 'grm', 'knn_k': 7, 'weighted_edges': True, 'symmetrize_mode': 'mutual', 'use_snp_selection': False}. Best is trial 59 with value: 0.1827482862178971.
[I 2025-11-03 12:33:20,140] Trial 60 finished with value: 0.1607130905733182 and parameters: {'model_type': 'graphsage', 'hidden_dims': '[512, 128]', 'dropout': 0.4243292425518634, 'batch_norm': True, 'lr': 6.861970325260631e-05, 'weight_decay': 7.591778785068267e-06, 'epochs': 179, 'loss': 'mse', 'optimizer': 'adam', 'graph_mode': 'knn', 'source': 'grm', 'knn_k': 9, 'weighted_edges': False, 'symmetrize_mode': 'mutual', 'use_snp_selection': False}. Best is trial 59 with value: 0.1827482862178971.
[I 2025-11-03 12:33:29,425] Trial 61 finished with value: 0.17295220936604216 and parameters: {'model_type': 'graphsage', 'hidden_dims': '[512, 128]', 'dropout': 0.4005540402432363, 'batch_norm': True, 'lr': 9.224178176674326e-05, 'weight_decay': 1.0234240500300456e-05, 'epochs': 229, 'loss': 'mse', 'optimizer': 'adam', 'graph_mode': 'knn', 'source': 'grm', 'knn_k': 7, 'weighted_edges': True, 'symmetrize_mode': 'mutual', 'use_snp_selection': False}. Best is trial 59 with value: 0.1827482862178971.
[I 2025-11-03 12:33:38,679] Trial 62 finished with value: 0.1670543919517904 and parameters: {'model_type': 'graphsage', 'hidden_dims': '[512, 128]', 'dropout': 0.41093426436424585, 'batch_norm': True, 'lr': 9.213728467363605e-05, 'weight_decay': 1.0490979312965063e-05, 'epochs': 228, 'loss': 'mse', 'optimizer': 'adam', 'graph_mode': 'knn', 'source': 'grm', 'knn_k': 7, 'weighted_edges': True, 'symmetrize_mode': 'mutual', 'use_snp_selection': False}. Best is trial 59 with value: 0.1827482862178971.
[I 2025-11-03 12:33:47,438] Trial 63 finished with value: 0.18343954522912806 and parameters: {'model_type': 'graphsage', 'hidden_dims': '[512, 128]', 'dropout': 0.3937099943074592, 'batch_norm': True, 'lr': 0.00013714994337424391, 'weight_decay': 5.079374271237183e-05, 'epochs': 212, 'loss': 'mse', 'optimizer': 'adam', 'graph_mode': 'knn', 'source': 'grm', 'knn_k': 7, 'weighted_edges': True, 'symmetrize_mode': 'mutual', 'use_snp_selection': False}. Best is trial 63 with value: 0.18343954522912806.
[I 2025-11-03 12:33:55,366] Trial 64 finished with value: 0.15679494251050147 and parameters: {'model_type': 'graphsage', 'hidden_dims': '[512, 128]', 'dropout': 0.3885189261076871, 'batch_norm': True, 'lr': 5.4871072805412344e-05, 'weight_decay': 4.831051324033846e-05, 'epochs': 186, 'loss': 'mse', 'optimizer': 'adam', 'graph_mode': 'knn', 'source': 'grm', 'knn_k': 7, 'weighted_edges': True, 'symmetrize_mode': 'mutual', 'use_snp_selection': False}. Best is trial 63 with value: 0.18343954522912806.
[I 2025-11-03 12:34:04,307] Trial 65 finished with value: 0.16027639559555817 and parameters: {'model_type': 'graphsage', 'hidden_dims': '[512, 128]', 'dropout': 0.3931625188531556, 'batch_norm': True, 'lr': 0.0002023427899248599, 'weight_decay': 8.71195357481492e-05, 'epochs': 213, 'loss': 'mse', 'optimizer': 'adam', 'graph_mode': 'knn', 'source': 'grm', 'knn_k': 8, 'weighted_edges': True, 'symmetrize_mode': 'mutual', 'use_snp_selection': False}. Best is trial 63 with value: 0.18343954522912806.
[I 2025-11-03 12:34:13,073] Trial 66 finished with value: 0.16577454639924016 and parameters: {'model_type': 'graphsage', 'hidden_dims': '[512, 128]', 'dropout': 0.45450927833502136, 'batch_norm': True, 'lr': 0.00012997807500155075, 'weight_decay': 0.00020963989041070458, 'epochs': 201, 'loss': 'mse', 'optimizer': 'adam', 'graph_mode': 'knn', 'source': 'grm', 'knn_k': 9, 'weighted_edges': True, 'symmetrize_mode': 'mutual', 'use_snp_selection': False}. Best is trial 63 with value: 0.18343954522912806.
[I 2025-11-03 12:34:20,258] Trial 67 finished with value: 0.16971096841843514 and parameters: {'model_type': 'graphsage', 'hidden_dims': '[512, 128]', 'dropout': 0.31674978004619525, 'batch_norm': True, 'lr': 3.262476533537616e-05, 'weight_decay': 2.9330780261491697e-05, 'epochs': 167, 'loss': 'mse', 'optimizer': 'adam', 'graph_mode': 'knn', 'source': 'grm', 'knn_k': 6, 'weighted_edges': True, 'symmetrize_mode': 'mutual', 'use_snp_selection': False}. Best is trial 63 with value: 0.18343954522912806.
[I 2025-11-03 12:34:29,888] Trial 68 finished with value: 0.18440835395187777 and parameters: {'model_type': 'graphsage', 'hidden_dims': '[512, 128]', 'dropout': 0.43570548302709344, 'batch_norm': True, 'lr': 7.852225391864592e-05, 'weight_decay': 1.6456143201485642e-05, 'epochs': 240, 'loss': 'mse', 'optimizer': 'adam', 'graph_mode': 'knn', 'source': 'grm', 'knn_k': 7, 'weighted_edges': True, 'symmetrize_mode': 'mutual', 'use_snp_selection': False}. Best is trial 68 with value: 0.18440835395187777.
[I 2025-11-03 12:34:39,446] Trial 69 finished with value: 0.16681862803267958 and parameters: {'model_type': 'graphsage', 'hidden_dims': '[512, 128]', 'dropout': 0.3652146407831461, 'batch_norm': True, 'lr': 7.624604873362793e-05, 'weight_decay': 1.698498922579384e-05, 'epochs': 239, 'loss': 'mse', 'optimizer': 'adam', 'graph_mode': 'knn', 'source': 'grm', 'knn_k': 7, 'weighted_edges': True, 'symmetrize_mode': 'mutual', 'use_snp_selection': False}. Best is trial 68 with value: 0.18440835395187777.
[I 2025-11-03 12:34:47,691] Trial 70 finished with value: 0.1523102049424657 and parameters: {'model_type': 'graphsage', 'hidden_dims': '[512, 128]', 'dropout': 0.49719358360032706, 'batch_norm': True, 'lr': 0.00010083478667933931, 'weight_decay': 0.00011293419745388767, 'epochs': 245, 'loss': 'mse', 'optimizer': 'adam', 'graph_mode': 'cutoff', 'cutoff': 0.7900842157955594, 'grm_norm': 'cosine', 'self_loops': True, 'use_snp_selection': False}. Best is trial 68 with value: 0.18440835395187777.
[I 2025-11-03 12:34:56,982] Trial 71 finished with value: 0.16359225231893826 and parameters: {'model_type': 'graphsage', 'hidden_dims': '[512, 128]', 'dropout': 0.43578654885923324, 'batch_norm': True, 'lr': 0.00014872662667589923, 'weight_decay': 4.633403140117307e-05, 'epochs': 229, 'loss': 'mse', 'optimizer': 'adam', 'graph_mode': 'knn', 'source': 'grm', 'knn_k': 7, 'weighted_edges': True, 'symmetrize_mode': 'mutual', 'use_snp_selection': False}. Best is trial 68 with value: 0.18440835395187777.
[I 2025-11-03 12:35:05,894] Trial 72 finished with value: 0.16294231703074194 and parameters: {'model_type': 'graphsage', 'hidden_dims': '[512, 128]', 'dropout': 0.4170717936759302, 'batch_norm': True, 'lr': 7.671060636163121e-05, 'weight_decay': 1.3806575410317792e-05, 'epochs': 205, 'loss': 'mse', 'optimizer': 'adam', 'graph_mode': 'knn', 'source': 'grm', 'knn_k': 9, 'weighted_edges': True, 'symmetrize_mode': 'mutual', 'use_snp_selection': False}. Best is trial 68 with value: 0.18440835395187777.
[I 2025-11-03 12:35:13,847] Trial 73 finished with value: 0.15345697199465447 and parameters: {'model_type': 'graphsage', 'hidden_dims': '[512, 128]', 'dropout': 0.46728801447622437, 'batch_norm': True, 'lr': 0.00012038324131802843, 'weight_decay': 7.5645953133182335e-06, 'epochs': 192, 'loss': 'mse', 'optimizer': 'adam', 'graph_mode': 'knn', 'source': 'grm', 'knn_k': 6, 'weighted_edges': True, 'symmetrize_mode': 'mutual', 'use_snp_selection': False}. Best is trial 68 with value: 0.18440835395187777.
[I 2025-11-03 12:35:22,955] Trial 74 finished with value: 0.15550885436283393 and parameters: {'model_type': 'graphsage', 'hidden_dims': '[512, 128]', 'dropout': 0.4048660854821127, 'batch_norm': True, 'lr': 5.461058532521172e-05, 'weight_decay': 3.0735029223553156e-06, 'epochs': 218, 'loss': 'mse', 'optimizer': 'adam', 'graph_mode': 'knn', 'source': 'grm', 'knn_k': 8, 'weighted_edges': True, 'symmetrize_mode': 'mutual', 'use_snp_selection': False}. Best is trial 68 with value: 0.18440835395187777.
[I 2025-11-03 12:35:29,915] Trial 75 finished with value: 0.17406936731113368 and parameters: {'model_type': 'graphsage', 'hidden_dims': '[512, 128]', 'dropout': 0.42587021047946894, 'batch_norm': True, 'lr': 0.00021710808792830245, 'weight_decay': 3.5648631545560444e-05, 'epochs': 155, 'loss': 'mse', 'optimizer': 'adam', 'graph_mode': 'knn', 'source': 'grm', 'knn_k': 7, 'weighted_edges': True, 'symmetrize_mode': 'mutual', 'use_snp_selection': False}. Best is trial 68 with value: 0.18440835395187777.
[I 2025-11-03 12:35:36,743] Trial 76 finished with value: 0.15846402121680006 and parameters: {'model_type': 'graphsage', 'hidden_dims': '[512, 128]', 'dropout': 0.4358373443818847, 'batch_norm': True, 'lr': 0.00021004874272428863, 'weight_decay': 3.533385352659607e-05, 'epochs': 150, 'loss': 'mse', 'optimizer': 'adam', 'graph_mode': 'knn', 'source': 'grm', 'knn_k': 7, 'weighted_edges': True, 'symmetrize_mode': 'mutual', 'use_snp_selection': False}. Best is trial 68 with value: 0.18440835395187777.
[I 2025-11-03 12:35:43,772] Trial 77 finished with value: 0.1701725114312103 and parameters: {'model_type': 'graphsage', 'hidden_dims': '[512, 128]', 'dropout': 0.48752081732094865, 'batch_norm': True, 'lr': 0.00028739687380525275, 'weight_decay': 2.1988366424170374e-05, 'epochs': 161, 'loss': 'mse', 'optimizer': 'adam', 'graph_mode': 'knn', 'source': 'grm', 'knn_k': 6, 'weighted_edges': True, 'symmetrize_mode': 'mutual', 'use_snp_selection': False}. Best is trial 68 with value: 0.18440835395187777.
[I 2025-11-03 12:35:54,047] Trial 78 finished with value: 0.19144233510547573 and parameters: {'model_type': 'graphsage', 'hidden_dims': '[512, 128]', 'dropout': 0.374586248263688, 'batch_norm': True, 'lr': 0.00038857045693763045, 'weight_decay': 6.507495316743484e-05, 'epochs': 261, 'loss': 'mse', 'optimizer': 'adam', 'graph_mode': 'knn', 'source': 'grm', 'knn_k': 7, 'weighted_edges': True, 'symmetrize_mode': 'mutual', 'use_snp_selection': False}. Best is trial 78 with value: 0.19144233510547573.
[I 2025-11-03 12:36:04,320] Trial 79 finished with value: 0.16624754443931364 and parameters: {'model_type': 'graphsage', 'hidden_dims': '[512, 128]', 'dropout': 0.3737511544154591, 'batch_norm': True, 'lr': 0.0006745401209485865, 'weight_decay': 6.259573315044993e-05, 'epochs': 261, 'loss': 'mse', 'optimizer': 'adam', 'graph_mode': 'knn', 'source': 'grm', 'knn_k': 7, 'weighted_edges': True, 'symmetrize_mode': 'mutual', 'use_snp_selection': False}. Best is trial 78 with value: 0.19144233510547573.
[I 2025-11-03 12:36:09,538] Trial 80 finished with value: 0.16233511913542323 and parameters: {'model_type': 'graphsage', 'hidden_dims': '[512, 128]', 'dropout': 0.44838224028123214, 'batch_norm': True, 'lr': 0.00038610709378014593, 'weight_decay': 0.00015441050345454973, 'epochs': 105, 'loss': 'mse', 'optimizer': 'adam', 'graph_mode': 'knn', 'source': 'grm', 'knn_k': 5, 'weighted_edges': True, 'symmetrize_mode': 'mutual', 'use_snp_selection': False}. Best is trial 78 with value: 0.19144233510547573.
[I 2025-11-03 12:36:20,496] Trial 81 finished with value: 0.17336950689759348 and parameters: {'model_type': 'graphsage', 'hidden_dims': '[512, 128]', 'dropout': 0.3536835810650015, 'batch_norm': True, 'lr': 0.0005208373627630035, 'weight_decay': 9.1582453427069e-05, 'epochs': 276, 'loss': 'mse', 'optimizer': 'adam', 'graph_mode': 'knn', 'source': 'grm', 'knn_k': 8, 'weighted_edges': True, 'symmetrize_mode': 'mutual', 'use_snp_selection': False}. Best is trial 78 with value: 0.19144233510547573.
