[I 2025-11-13 04:14:24,580] Trial 116 finished with value: 0.2284366791444211 and parameters: {'model_type': 'graphsage', 'hidden_dims': '[256, 128, 64]', 'dropout': 0.29287295973986843, 'batch_norm': False, 'lr': 1.8064039130346433e-05, 'weight_decay': 8.953488246758835e-07, 'epochs': 70, 'loss': 'mae', 'optimizer': 'adam', 'graph_mode': 'knn', 'source': 'grm', 'knn_k': 9, 'weighted_edges': False, 'symmetrize_mode': 'mutual', 'use_snp_selection': True, 'num_snps': 57611}. Best is trial 80 with value: 0.25207288460346516.
[I 2025-11-13 04:15:48,817] Trial 117 finished with value: 0.24363561306270162 and parameters: {'model_type': 'graphsage', 'hidden_dims': '[256, 128, 64]', 'dropout': 0.24214943443626596, 'batch_norm': False, 'lr': 6.682451375821506e-05, 'weight_decay': 1.1263373649867605e-06, 'epochs': 74, 'loss': 'mae', 'optimizer': 'adam', 'graph_mode': 'cutoff', 'cutoff': 0.8165519005812593, 'grm_norm': 'gcn', 'self_loops': True, 'use_snp_selection': True, 'num_snps': 52934}. Best is trial 80 with value: 0.25207288460346516.
[I 2025-11-13 04:17:07,123] Trial 118 finished with value: 0.24082678007913785 and parameters: {'model_type': 'graphsage', 'hidden_dims': '[256, 128, 64]', 'dropout': 0.20664782808364343, 'batch_norm': False, 'lr': 2.8116741726446528e-05, 'weight_decay': 3.229030912516527e-06, 'epochs': 40, 'loss': 'mae', 'optimizer': 'adam', 'graph_mode': 'cutoff', 'cutoff': 0.8538107453176826, 'grm_norm': 'gcn', 'self_loops': True, 'use_snp_selection': True, 'num_snps': 58630}. Best is trial 80 with value: 0.25207288460346516.
[I 2025-11-13 04:18:28,381] Trial 119 finished with value: 0.2377936355783094 and parameters: {'model_type': 'graphsage', 'hidden_dims': '[256, 128, 64]', 'dropout': 0.27150938137823166, 'batch_norm': False, 'lr': 2.314011702334271e-05, 'weight_decay': 2.294827189738655e-06, 'epochs': 59, 'loss': 'mae', 'optimizer': 'adam', 'graph_mode': 'cutoff', 'cutoff': 0.8360096237565763, 'grm_norm': 'gcn', 'self_loops': True, 'use_snp_selection': True, 'num_snps': 56192}. Best is trial 80 with value: 0.25207288460346516.
[I 2025-11-13 04:19:55,685] Trial 120 finished with value: 0.25924851756661577 and parameters: {'model_type': 'graphsage', 'hidden_dims': '[256, 128, 64]', 'dropout': 0.30619348962719783, 'batch_norm': False, 'lr': 4.2791456483274355e-05, 'weight_decay': 5.333164641452995e-06, 'epochs': 86, 'loss': 'mae', 'optimizer': 'adam', 'graph_mode': 'cutoff', 'cutoff': 0.8174937007130542, 'grm_norm': 'gcn', 'self_loops': True, 'use_snp_selection': True, 'num_snps': 52513}. Best is trial 120 with value: 0.25924851756661577.
[I 2025-11-13 04:21:05,016] Trial 121 finished with value: 0.22287279502832674 and parameters: {'model_type': 'graphsage', 'hidden_dims': '[256, 128, 64]', 'dropout': 0.31828330654004877, 'batch_norm': False, 'lr': 4.355112015433253e-05, 'weight_decay': 4.7720243498831305e-06, 'epochs': 94, 'loss': 'mae', 'optimizer': 'adam', 'graph_mode': 'cutoff', 'cutoff': 0.8800704574731606, 'grm_norm': 'gcn', 'self_loops': True, 'use_snp_selection': True, 'num_snps': 32629}. Best is trial 120 with value: 0.25924851756661577.
[I 2025-11-13 04:22:32,074] Trial 122 finished with value: 0.24096360491705698 and parameters: {'model_type': 'graphsage', 'hidden_dims': '[256, 128, 64]', 'dropout': 0.30401017689869164, 'batch_norm': False, 'lr': 8.73034390450778e-05, 'weight_decay': 3.989559027347333e-06, 'epochs': 85, 'loss': 'mae', 'optimizer': 'adam', 'graph_mode': 'cutoff', 'cutoff': 0.8122969781957516, 'grm_norm': 'gcn', 'self_loops': True, 'use_snp_selection': True, 'num_snps': 52515}. Best is trial 120 with value: 0.25924851756661577.
[I 2025-11-13 04:23:51,693] Trial 123 finished with value: 0.23815576182710002 and parameters: {'model_type': 'graphsage', 'hidden_dims': '[256, 128, 64]', 'dropout': 0.227878076198888, 'batch_norm': False, 'lr': 3.4557452403411595e-05, 'weight_decay': 5.669300242549211e-06, 'epochs': 67, 'loss': 'mae', 'optimizer': 'adam', 'graph_mode': 'cutoff', 'cutoff': 0.7628874873270198, 'grm_norm': 'gcn', 'self_loops': True, 'use_snp_selection': True, 'num_snps': 50424}. Best is trial 120 with value: 0.25924851756661577.
[I 2025-11-13 04:25:16,612] Trial 124 finished with value: 0.23888769312005737 and parameters: {'model_type': 'graphsage', 'hidden_dims': '[256, 128, 64]', 'dropout': 0.28958445458679277, 'batch_norm': False, 'lr': 4.990374479388201e-05, 'weight_decay': 2.706490366233129e-06, 'epochs': 78, 'loss': 'mae', 'optimizer': 'adam', 'graph_mode': 'cutoff', 'cutoff': 0.7923943789830915, 'grm_norm': 'gcn', 'self_loops': True, 'use_snp_selection': True, 'num_snps': 54185}. Best is trial 120 with value: 0.25924851756661577.
[I 2025-11-13 04:26:49,068] Trial 125 finished with value: 0.24017436882564414 and parameters: {'model_type': 'graphsage', 'hidden_dims': '[256, 128, 64]', 'dropout': 0.25339142132090225, 'batch_norm': False, 'lr': 6.377958914774006e-05, 'weight_decay': 2.104866472623309e-06, 'epochs': 100, 'loss': 'mae', 'optimizer': 'adam', 'graph_mode': 'cutoff', 'cutoff': 0.8583759953838416, 'grm_norm': 'gcn', 'self_loops': True, 'use_snp_selection': True, 'num_snps': 55220}. Best is trial 120 with value: 0.25924851756661577.
[I 2025-11-13 04:28:55,301] Trial 126 finished with value: 0.2431229848515796 and parameters: {'model_type': 'graphsage', 'hidden_dims': '[256, 128, 64]', 'dropout': 0.5662804466006538, 'batch_norm': False, 'lr': 4.170631358034347e-05, 'weight_decay': 0.0001929140588997494, 'epochs': 239, 'loss': 'mae', 'optimizer': 'adam', 'graph_mode': 'cutoff', 'cutoff': 0.8212261100016325, 'grm_norm': 'gcn', 'self_loops': True, 'use_snp_selection': True, 'num_snps': 51154}. Best is trial 120 with value: 0.25924851756661577.
[I 2025-11-13 04:30:16,250] Trial 127 finished with value: 0.25307540204697343 and parameters: {'model_type': 'graphsage', 'hidden_dims': '[256, 128, 64]', 'dropout': 0.3160465263879545, 'batch_norm': False, 'lr': 2.1193780800998715e-05, 'weight_decay': 1.3428408080506611e-06, 'epochs': 52, 'loss': 'mae', 'optimizer': 'adam', 'graph_mode': 'cutoff', 'cutoff': 0.8341500980625209, 'grm_norm': 'gcn', 'self_loops': True, 'use_snp_selection': True, 'num_snps': 57256}. Best is trial 120 with value: 0.25924851756661577.
[I 2025-11-13 04:30:59,076] Trial 128 finished with value: 0.21657825118231272 and parameters: {'model_type': 'graphsage', 'hidden_dims': '[256, 128, 64]', 'dropout': 0.3127463809260656, 'batch_norm': False, 'lr': 0.00011305155655628764, 'weight_decay': 3.99004200800735e-07, 'epochs': 88, 'loss': 'mse', 'optimizer': 'adam', 'graph_mode': 'cutoff', 'cutoff': 0.878202856650763, 'grm_norm': 'gcn', 'self_loops': False, 'use_snp_selection': False}. Best is trial 120 with value: 0.25924851756661577.
[I 2025-11-13 04:32:19,495] Trial 129 finished with value: 0.2049258521874629 and parameters: {'model_type': 'graphsage', 'hidden_dims': '[256, 128, 64]', 'dropout': 0.3621326718472727, 'batch_norm': True, 'lr': 1.5785233099689828e-05, 'weight_decay': 1.351345125953543e-06, 'epochs': 51, 'loss': 'mae', 'optimizer': 'adam', 'graph_mode': 'cutoff', 'cutoff': 0.8302437913365667, 'grm_norm': 'gcn', 'self_loops': True, 'use_snp_selection': True, 'num_snps': 56880}. Best is trial 120 with value: 0.25924851756661577.
[I 2025-11-13 04:33:43,085] Trial 130 finished with value: 0.2462049236471119 and parameters: {'model_type': 'graphsage', 'hidden_dims': '[256, 128, 64]', 'dropout': 0.2398028390070046, 'batch_norm': False, 'lr': 7.80759292472543e-05, 'weight_decay': 1.0069207471171826e-06, 'epochs': 72, 'loss': 'mae', 'optimizer': 'adam', 'graph_mode': 'cutoff', 'cutoff': 0.779397462942699, 'grm_norm': 'gcn', 'self_loops': False, 'use_snp_selection': True, 'num_snps': 53625}. Best is trial 120 with value: 0.25924851756661577.
[I 2025-11-13 04:35:07,112] Trial 131 finished with value: 0.24660402733752926 and parameters: {'model_type': 'graphsage', 'hidden_dims': '[256, 128, 64]', 'dropout': 0.34718296879588206, 'batch_norm': False, 'lr': 7.919095226410635e-05, 'weight_decay': 6.166241184534109e-07, 'epochs': 74, 'loss': 'mae', 'optimizer': 'adam', 'graph_mode': 'cutoff', 'cutoff': 0.7802808967880256, 'grm_norm': 'gcn', 'self_loops': False, 'use_snp_selection': True, 'num_snps': 53611}. Best is trial 120 with value: 0.25924851756661577.
[I 2025-11-13 04:36:30,762] Trial 132 finished with value: 0.22538452914793128 and parameters: {'model_type': 'graphsage', 'hidden_dims': '[256, 128, 64]', 'dropout': 0.38080392010222286, 'batch_norm': False, 'lr': 7.473547500919392e-05, 'weight_decay': 5.578396707710353e-07, 'epochs': 73, 'loss': 'mae', 'optimizer': 'adam', 'graph_mode': 'cutoff', 'cutoff': 0.7781572776130932, 'grm_norm': 'gcn', 'self_loops': False, 'use_snp_selection': True, 'num_snps': 53869}. Best is trial 120 with value: 0.25924851756661577.
[I 2025-11-13 04:37:52,165] Trial 133 finished with value: 0.2508824065345789 and parameters: {'model_type': 'graphsage', 'hidden_dims': '[256, 128, 64]', 'dropout': 0.34266789198227743, 'batch_norm': False, 'lr': 0.00013853896029952543, 'weight_decay': 1.0364370802580964e-06, 'epochs': 67, 'loss': 'mae', 'optimizer': 'adam', 'graph_mode': 'cutoff', 'cutoff': 0.7552615629050246, 'grm_norm': 'gcn', 'self_loops': False, 'use_snp_selection': True, 'num_snps': 52764}. Best is trial 120 with value: 0.25924851756661577.
[I 2025-11-13 04:39:17,752] Trial 134 finished with value: 0.2425154810969455 and parameters: {'model_type': 'graphsage', 'hidden_dims': '[256, 128, 64]', 'dropout': 0.34304835910543174, 'batch_norm': False, 'lr': 0.00013933826906397843, 'weight_decay': 6.67216245630748e-07, 'epochs': 82, 'loss': 'mae', 'optimizer': 'adam', 'graph_mode': 'cutoff', 'cutoff': 0.7511850916720104, 'grm_norm': 'gcn', 'self_loops': False, 'use_snp_selection': True, 'num_snps': 52460}. Best is trial 120 with value: 0.25924851756661577.
[I 2025-11-13 04:40:35,059] Trial 135 finished with value: 0.23458668204605743 and parameters: {'model_type': 'graphsage', 'hidden_dims': '[256, 128, 64]', 'dropout': 0.3322341929211578, 'batch_norm': False, 'lr': 0.0001006209868864935, 'weight_decay': 0.0006816042579371499, 'epochs': 47, 'loss': 'mae', 'optimizer': 'adam', 'graph_mode': 'cutoff', 'cutoff': 0.769031229040975, 'grm_norm': 'gcn', 'self_loops': False, 'use_snp_selection': True, 'num_snps': 55253}. Best is trial 120 with value: 0.25924851756661577.
[I 2025-11-13 04:41:56,051] Trial 136 finished with value: 0.21586919080167388 and parameters: {'model_type': 'graphsage', 'hidden_dims': '[256, 128, 64]', 'dropout': 0.3441431086957248, 'batch_norm': False, 'lr': 0.000217631062705699, 'weight_decay': 4.2977822761516684e-07, 'epochs': 54, 'loss': 'mae', 'optimizer': 'adam', 'graph_mode': 'cutoff', 'cutoff': 0.7929530706989399, 'grm_norm': 'gcn', 'self_loops': False, 'use_snp_selection': True, 'num_snps': 56768}. Best is trial 120 with value: 0.25924851756661577.
[I 2025-11-13 04:43:39,055] Trial 137 finished with value: 0.1973757862535462 and parameters: {'model_type': 'graphsage', 'hidden_dims': '[512, 256]', 'dropout': 0.36047798156824806, 'batch_norm': False, 'lr': 0.0002967493440653008, 'weight_decay': 1.7659790418541874e-07, 'epochs': 79, 'loss': 'mae', 'optimizer': 'adam', 'graph_mode': 'cutoff', 'cutoff': 0.8460393768446375, 'grm_norm': 'cosine_then_gcn', 'self_loops': True, 'use_snp_selection': True, 'num_snps': 50236}. Best is trial 120 with value: 0.25924851756661577.
[I 2025-11-13 04:45:19,837] Trial 138 finished with value: 0.1989742440339916 and parameters: {'model_type': 'graphsage', 'hidden_dims': '[256, 128, 64]', 'dropout': 0.3370899752065774, 'batch_norm': False, 'lr': 0.00011911592623365127, 'weight_decay': 1.7043316364684115e-06, 'epochs': 66, 'loss': 'mae', 'optimizer': 'adam', 'graph_mode': 'knn', 'source': 'grm', 'knn_k': 3, 'weighted_edges': True, 'symmetrize_mode': 'union', 'use_snp_selection': True, 'num_snps': 51933}. Best is trial 120 with value: 0.25924851756661577.
[I 2025-11-13 04:46:50,615] Trial 139 finished with value: 0.2394410633668805 and parameters: {'model_type': 'graphsage', 'hidden_dims': '[256, 128]', 'dropout': 0.3221305301842996, 'batch_norm': False, 'lr': 5.880474377173387e-05, 'weight_decay': 8.30412051894737e-07, 'epochs': 92, 'loss': 'mae', 'optimizer': 'adam', 'graph_mode': 'cutoff', 'cutoff': 0.7437264544671244, 'grm_norm': 'gcn', 'self_loops': False, 'use_snp_selection': True, 'num_snps': 55805}. Best is trial 120 with value: 0.25924851756661577.
[I 2025-11-13 04:48:56,025] Trial 140 finished with value: 0.23319821300055277 and parameters: {'model_type': 'graphsage', 'hidden_dims': '[512, 128]', 'dropout': 0.30153444553503767, 'batch_norm': False, 'lr': 9.21676361029936e-05, 'weight_decay': 1.2218983189313294e-06, 'epochs': 172, 'loss': 'mae', 'optimizer': 'adam', 'graph_mode': 'cutoff', 'cutoff': 0.8256001276849925, 'grm_norm': 'gcn', 'self_loops': True, 'use_snp_selection': True, 'num_snps': 41761}. Best is trial 120 with value: 0.25924851756661577.
[I 2025-11-13 04:50:20,429] Trial 141 finished with value: 0.23160947564868978 and parameters: {'model_type': 'graphsage', 'hidden_dims': '[256, 128, 64]', 'dropout': 0.2388454131549818, 'batch_norm': False, 'lr': 8.655301636985688e-05, 'weight_decay': 9.497682522525505e-07, 'epochs': 73, 'loss': 'mae', 'optimizer': 'adam', 'graph_mode': 'cutoff', 'cutoff': 0.7817820447118647, 'grm_norm': 'gcn', 'self_loops': False, 'use_snp_selection': True, 'num_snps': 54801}. Best is trial 120 with value: 0.25924851756661577.
[I 2025-11-13 04:51:39,948] Trial 142 finished with value: 0.24176345691365242 and parameters: {'model_type': 'graphsage', 'hidden_dims': '[256, 128, 64]', 'dropout': 0.22006753142810542, 'batch_norm': False, 'lr': 7.526496714205007e-05, 'weight_decay': 3.196548498593109e-07, 'epochs': 57, 'loss': 'mae', 'optimizer': 'adam', 'graph_mode': 'cutoff', 'cutoff': 0.7594421167741633, 'grm_norm': 'gcn', 'self_loops': False, 'use_snp_selection': True, 'num_snps': 53776}. Best is trial 120 with value: 0.25924851756661577.
[I 2025-11-13 04:53:00,960] Trial 143 finished with value: 0.2522485010509037 and parameters: {'model_type': 'graphsage', 'hidden_dims': '[256, 128, 64]', 'dropout': 0.20210340233036195, 'batch_norm': False, 'lr': 6.531413948504074e-05, 'weight_decay': 1.493897787117485e-06, 'epochs': 65, 'loss': 'mae', 'optimizer': 'adam', 'graph_mode': 'cutoff', 'cutoff': 0.8063467789232021, 'grm_norm': 'gcn', 'self_loops': False, 'use_snp_selection': True, 'num_snps': 53114}. Best is trial 120 with value: 0.25924851756661577.
[I 2025-11-13 04:54:18,636] Trial 144 finished with value: 0.22760611602159148 and parameters: {'model_type': 'graphsage', 'hidden_dims': '[256, 128, 64]', 'dropout': 0.19601580381963812, 'batch_norm': False, 'lr': 5.12321873294646e-05, 'weight_decay': 1.4918827910930508e-06, 'epochs': 65, 'loss': 'mae', 'optimizer': 'adam', 'graph_mode': 'cutoff', 'cutoff': 0.841209424554485, 'grm_norm': 'gcn', 'self_loops': False, 'use_snp_selection': True, 'num_snps': 48531}. Best is trial 120 with value: 0.25924851756661577.
[I 2025-11-13 04:56:13,800] Trial 145 finished with value: 0.21976285636538412 and parameters: {'model_type': 'graphsage', 'hidden_dims': '[128, 64]', 'dropout': 0.21060507083795252, 'batch_norm': False, 'lr': 6.641731710515456e-05, 'weight_decay': 1.1973034805280665e-06, 'epochs': 326, 'loss': 'mae', 'optimizer': 'adam', 'graph_mode': 'cutoff', 'cutoff': 0.8106472164044654, 'grm_norm': 'gcn', 'self_loops': False, 'use_snp_selection': True, 'num_snps': 51263}. Best is trial 120 with value: 0.25924851756661577.
[I 2025-11-13 04:57:18,003] Trial 146 finished with value: 0.2467817509619604 and parameters: {'model_type': 'graphsage', 'hidden_dims': '[256, 128, 64]', 'dropout': 0.3536478605696952, 'batch_norm': False, 'lr': 2.0634501468576092e-05, 'weight_decay': 3.354249739678254e-06, 'epochs': 45, 'loss': 'mae', 'optimizer': 'adam', 'graph_mode': 'cutoff', 'cutoff': 0.7975329782559011, 'grm_norm': 'gcn', 'self_loops': True, 'use_snp_selection': True, 'num_snps': 36114}. Best is trial 120 with value: 0.25924851756661577.
[I 2025-11-13 04:58:21,322] Trial 147 finished with value: 0.24156367165620987 and parameters: {'model_type': 'graphsage', 'hidden_dims': '[256, 128, 64]', 'dropout': 0.18384587674298344, 'batch_norm': False, 'lr': 2.5996133305914582e-05, 'weight_decay': 3.3604184656373186e-06, 'epochs': 44, 'loss': 'mae', 'optimizer': 'adam', 'graph_mode': 'cutoff', 'cutoff': 0.728473417636748, 'grm_norm': 'cosine_then_gcn', 'self_loops': True, 'use_snp_selection': True, 'num_snps': 33307}. Best is trial 120 with value: 0.25924851756661577.
[I 2025-11-13 04:59:25,025] Trial 148 finished with value: 0.2320403919685065 and parameters: {'model_type': 'graphsage', 'hidden_dims': '[256, 128, 64]', 'dropout': 0.3702471318545455, 'batch_norm': False, 'lr': 2.051786929056223e-05, 'weight_decay': 6.834537465797077e-06, 'epochs': 40, 'loss': 'mae', 'optimizer': 'adam', 'graph_mode': 'cutoff', 'cutoff': 0.857946395069335, 'grm_norm': 'gcn', 'self_loops': True, 'use_snp_selection': True, 'num_snps': 36918}. Best is trial 120 with value: 0.25924851756661577.
[I 2025-11-13 05:00:32,031] Trial 149 finished with value: 0.25232382031607037 and parameters: {'model_type': 'graphsage', 'hidden_dims': '[256, 128, 64]', 'dropout': 0.3095871954078272, 'batch_norm': False, 'lr': 3.141096394953636e-05, 'weight_decay': 1.9465450075744783e-06, 'epochs': 53, 'loss': 'mae', 'optimizer': 'adam', 'graph_mode': 'cutoff', 'cutoff': 0.8264863819686137, 'grm_norm': 'gcn', 'self_loops': True, 'use_snp_selection': True, 'num_snps': 38409}. Best is trial 120 with value: 0.25924851756661577.
[I 2025-11-13 05:03:05,034] Trial 0 finished with value: 0.18117017850517197 and parameters: {'model_type': 'graphsage', 'hidden_dims': '[128, 64]', 'dropout': 0.199031432379812, 'batch_norm': True, 'lr': 1.8408544111075837e-06, 'weight_decay': 5.5136510071208614e-05, 'epochs': 336, 'loss': 'mae', 'optimizer': 'adam', 'graph_mode': 'knn', 'source': 'grm', 'knn_k': 8, 'weighted_edges': True, 'symmetrize_mode': 'mutual', 'use_snp_selection': False}. Best is trial 0 with value: 0.18117017850517197.
[I 2025-11-13 05:03:55,880] Trial 1 finished with value: 0.2776258222031216 and parameters: {'model_type': 'graphsage', 'hidden_dims': '[128, 64]', 'dropout': 0.40051947670227217, 'batch_norm': True, 'lr': 0.0005320428882732732, 'weight_decay': 1.89210117736594e-06, 'epochs': 68, 'loss': 'mse', 'optimizer': 'adam', 'graph_mode': 'knn', 'source': 'grm', 'knn_k': 7, 'weighted_edges': True, 'symmetrize_mode': 'union', 'use_snp_selection': False}. Best is trial 1 with value: 0.2776258222031216.
[I 2025-11-13 05:05:15,513] Trial 2 finished with value: 0.22157751902648015 and parameters: {'model_type': 'graphsage', 'hidden_dims': '[256, 128]', 'dropout': 0.5105528289184642, 'batch_norm': False, 'lr': 0.0006804279372404962, 'weight_decay': 0.0008922815224257085, 'epochs': 181, 'loss': 'mse', 'optimizer': 'adam', 'graph_mode': 'cutoff', 'cutoff': 0.5741905641612706, 'grm_norm': 'gcn', 'self_loops': False, 'use_snp_selection': True, 'num_snps': 26910}. Best is trial 1 with value: 0.2776258222031216.
[I 2025-11-13 05:06:45,699] Trial 3 finished with value: 0.26785222343042175 and parameters: {'model_type': 'graphsage', 'hidden_dims': '[256, 128, 64]', 'dropout': 0.5390483213624292, 'batch_norm': False, 'lr': 3.4705625989073525e-05, 'weight_decay': 2.4623319020131338e-05, 'epochs': 121, 'loss': 'mse', 'optimizer': 'adam', 'graph_mode': 'knn', 'source': 'grm', 'knn_k': 6, 'weighted_edges': False, 'symmetrize_mode': 'mutual', 'use_snp_selection': True, 'num_snps': 30713}. Best is trial 1 with value: 0.2776258222031216.
[I 2025-11-13 05:07:53,021] Trial 4 finished with value: 0.2636124120266869 and parameters: {'model_type': 'graphsage', 'hidden_dims': '[128, 64]', 'dropout': 0.13404863676897502, 'batch_norm': False, 'lr': 0.0001431556295367288, 'weight_decay': 2.2084517750726675e-05, 'epochs': 51, 'loss': 'mae', 'optimizer': 'adam', 'graph_mode': 'cutoff', 'cutoff': 0.6714268476993044, 'grm_norm': 'none', 'self_loops': False, 'use_snp_selection': True, 'num_snps': 45645}. Best is trial 1 with value: 0.2776258222031216.
[I 2025-11-13 05:09:33,710] Trial 5 finished with value: 0.2866463248052567 and parameters: {'model_type': 'graphsage', 'hidden_dims': '[256, 128]', 'dropout': 0.42253606323412096, 'batch_norm': False, 'lr': 4.238630400638805e-05, 'weight_decay': 8.074086040046576e-07, 'epochs': 158, 'loss': 'mae', 'optimizer': 'adam', 'graph_mode': 'knn', 'source': 'grm', 'knn_k': 1, 'weighted_edges': False, 'symmetrize_mode': 'mutual', 'use_snp_selection': True, 'num_snps': 43113}. Best is trial 5 with value: 0.2866463248052567.
[I 2025-11-13 05:12:10,021] Trial 6 finished with value: 0.27222169572167637 and parameters: {'model_type': 'graphsage', 'hidden_dims': '[512, 256]', 'dropout': 0.3534893146320237, 'batch_norm': True, 'lr': 0.000251307964226932, 'weight_decay': 1.821819791794022e-05, 'epochs': 223, 'loss': 'mae', 'optimizer': 'adam', 'graph_mode': 'knn', 'source': 'grm', 'knn_k': 1, 'weighted_edges': True, 'symmetrize_mode': 'mutual', 'use_snp_selection': False}. Best is trial 5 with value: 0.2866463248052567.
[I 2025-11-13 05:14:22,893] Trial 7 finished with value: 0.24822413350366293 and parameters: {'model_type': 'graphsage', 'hidden_dims': '[512, 256]', 'dropout': 0.1105825955860775, 'batch_norm': True, 'lr': 2.374338412754043e-05, 'weight_decay': 1.1284721123340274e-05, 'epochs': 190, 'loss': 'mse', 'optimizer': 'adam', 'graph_mode': 'cutoff', 'cutoff': 0.719872204109604, 'grm_norm': 'gcn', 'self_loops': False, 'use_snp_selection': False}. Best is trial 5 with value: 0.2866463248052567.
