[I 2025-11-03 11:58:07,096] Trial 117 finished with value: 0.04330192406321068 and parameters: {'model_type': 'gcn', 'hidden_dims': '[128, 64]', 'dropout': 0.5003713395998783, 'batch_norm': True, 'lr': 0.0003196757787333657, 'weight_decay': 7.137438406575744e-06, 'epochs': 102, 'loss': 'mae', 'optimizer': 'adam', 'graph_mode': 'off', 'use_snp_selection': False}. Best is trial 75 with value: 0.09631997594891462.
[I 2025-11-03 11:58:09,846] Trial 118 finished with value: 0.07871822653776656 and parameters: {'model_type': 'gcn', 'hidden_dims': '[512, 128]', 'dropout': 0.15943630198855283, 'batch_norm': True, 'lr': 0.000249298015460431, 'weight_decay': 8.383229993979843e-07, 'epochs': 246, 'loss': 'mae', 'optimizer': 'adam', 'graph_mode': 'off', 'use_snp_selection': False}. Best is trial 75 with value: 0.09631997594891462.
[I 2025-11-03 11:58:11,372] Trial 119 finished with value: 0.00867061521546497 and parameters: {'model_type': 'gcn', 'hidden_dims': '[128, 64]', 'dropout': 0.5223923771622068, 'batch_norm': False, 'lr': 0.00012521863669075686, 'weight_decay': 6.763665304558743e-05, 'epochs': 132, 'loss': 'mae', 'optimizer': 'adam', 'graph_mode': 'off', 'use_snp_selection': True, 'num_snps': 33989}. Best is trial 75 with value: 0.09631997594891462.
[I 2025-11-03 11:58:12,412] Trial 120 finished with value: 0.03877123746190367 and parameters: {'model_type': 'gcn', 'hidden_dims': '[128, 64]', 'dropout': 0.5363996504066861, 'batch_norm': True, 'lr': 0.00015394048790401304, 'weight_decay': 4.7834442904935387e-05, 'epochs': 121, 'loss': 'mae', 'optimizer': 'adam', 'graph_mode': 'off', 'use_snp_selection': False}. Best is trial 75 with value: 0.09631997594891462.
[I 2025-11-03 11:58:14,368] Trial 121 finished with value: 0.08147588808134493 and parameters: {'model_type': 'gcn', 'hidden_dims': '[256, 128]', 'dropout': 0.11575125019970639, 'batch_norm': False, 'lr': 0.0007990213447480904, 'weight_decay': 1.0420986843454434e-06, 'epochs': 278, 'loss': 'mae', 'optimizer': 'adam', 'graph_mode': 'off', 'use_snp_selection': False}. Best is trial 75 with value: 0.09631997594891462.
[I 2025-11-03 11:58:16,332] Trial 122 finished with value: 0.09285940057544861 and parameters: {'model_type': 'gcn', 'hidden_dims': '[256, 128]', 'dropout': 0.1325876296736562, 'batch_norm': False, 'lr': 0.0005150123990078479, 'weight_decay': 9.421003051844949e-07, 'epochs': 288, 'loss': 'mae', 'optimizer': 'adam', 'graph_mode': 'off', 'use_snp_selection': False}. Best is trial 75 with value: 0.09631997594891462.
[I 2025-11-03 11:58:18,289] Trial 123 finished with value: 0.09770514437492617 and parameters: {'model_type': 'gcn', 'hidden_dims': '[256, 128]', 'dropout': 0.12832569293798177, 'batch_norm': False, 'lr': 0.0006543934018011666, 'weight_decay': 1.4795303876895202e-06, 'epochs': 278, 'loss': 'mae', 'optimizer': 'adam', 'graph_mode': 'off', 'use_snp_selection': False}. Best is trial 123 with value: 0.09770514437492617.
[I 2025-11-03 11:58:20,395] Trial 124 finished with value: 0.08988519455114073 and parameters: {'model_type': 'gcn', 'hidden_dims': '[256, 128]', 'dropout': 0.1334890840812129, 'batch_norm': False, 'lr': 0.0006571637970739459, 'weight_decay': 1.4925119291446013e-06, 'epochs': 320, 'loss': 'mae', 'optimizer': 'adam', 'graph_mode': 'off', 'use_snp_selection': False}. Best is trial 123 with value: 0.09770514437492617.
[I 2025-11-03 11:58:22,531] Trial 125 finished with value: 0.08392349014673875 and parameters: {'model_type': 'gcn', 'hidden_dims': '[256, 128]', 'dropout': 0.13829729275015043, 'batch_norm': False, 'lr': 0.0006339081107314344, 'weight_decay': 1.9151599165581775e-06, 'epochs': 323, 'loss': 'mae', 'optimizer': 'adam', 'graph_mode': 'off', 'use_snp_selection': False}. Best is trial 123 with value: 0.09770514437492617.
[I 2025-11-03 11:58:24,636] Trial 126 finished with value: 0.09864573449936301 and parameters: {'model_type': 'gcn', 'hidden_dims': '[256, 128]', 'dropout': 0.13235308291314626, 'batch_norm': False, 'lr': 0.000929976390407442, 'weight_decay': 2.9812270319505622e-06, 'epochs': 311, 'loss': 'mse', 'optimizer': 'adam', 'graph_mode': 'off', 'use_snp_selection': False}. Best is trial 126 with value: 0.09864573449936301.
[I 2025-11-03 11:58:26,676] Trial 127 finished with value: 0.07617283968529462 and parameters: {'model_type': 'gcn', 'hidden_dims': '[256, 128]', 'dropout': 0.13220284741433622, 'batch_norm': False, 'lr': 0.000996337342446281, 'weight_decay': 3.863980123997056e-06, 'epochs': 304, 'loss': 'mse', 'optimizer': 'adam', 'graph_mode': 'off', 'use_snp_selection': False}. Best is trial 126 with value: 0.09864573449936301.
[I 2025-11-03 11:58:28,799] Trial 128 finished with value: 0.10170132976592543 and parameters: {'model_type': 'gcn', 'hidden_dims': '[256, 128]', 'dropout': 0.14951675535947867, 'batch_norm': False, 'lr': 0.0009061003828157263, 'weight_decay': 2.7542265851191627e-06, 'epochs': 312, 'loss': 'mse', 'optimizer': 'adam', 'graph_mode': 'off', 'use_snp_selection': False}. Best is trial 128 with value: 0.10170132976592543.
[I 2025-11-03 11:58:30,871] Trial 129 finished with value: 0.0906303439757875 and parameters: {'model_type': 'gcn', 'hidden_dims': '[256, 128]', 'dropout': 0.16878362452611834, 'batch_norm': False, 'lr': 0.0008900479359503892, 'weight_decay': 3.0530623654714736e-06, 'epochs': 315, 'loss': 'mse', 'optimizer': 'adam', 'graph_mode': 'off', 'use_snp_selection': False}. Best is trial 128 with value: 0.10170132976592543.
[I 2025-11-03 11:58:33,014] Trial 130 finished with value: 0.06577651288654034 and parameters: {'model_type': 'gcn', 'hidden_dims': '[256, 128]', 'dropout': 0.15094446311314572, 'batch_norm': False, 'lr': 0.0008839005167452843, 'weight_decay': 3.1004395692413937e-06, 'epochs': 323, 'loss': 'mse', 'optimizer': 'adam', 'graph_mode': 'off', 'use_snp_selection': False}. Best is trial 128 with value: 0.10170132976592543.
[I 2025-11-03 11:58:35,061] Trial 131 finished with value: 0.07535331115091279 and parameters: {'model_type': 'gcn', 'hidden_dims': '[256, 128]', 'dropout': 0.17069352959319062, 'batch_norm': False, 'lr': 0.0007433939392925534, 'weight_decay': 1.5267648616079685e-06, 'epochs': 309, 'loss': 'mse', 'optimizer': 'adam', 'graph_mode': 'off', 'use_snp_selection': False}. Best is trial 128 with value: 0.10170132976592543.
[I 2025-11-03 11:58:37,338] Trial 132 finished with value: 0.09011190593166753 and parameters: {'model_type': 'gcn', 'hidden_dims': '[256, 128]', 'dropout': 0.17191663934913304, 'batch_norm': False, 'lr': 0.0007450919476869264, 'weight_decay': 2.3458244324972864e-06, 'epochs': 332, 'loss': 'mse', 'optimizer': 'adam', 'graph_mode': 'off', 'use_snp_selection': False}. Best is trial 128 with value: 0.10170132976592543.
[I 2025-11-03 11:58:39,511] Trial 133 finished with value: 0.069307156931787 and parameters: {'model_type': 'gcn', 'hidden_dims': '[256, 128]', 'dropout': 0.17080230075369363, 'batch_norm': False, 'lr': 0.0006911648369357829, 'weight_decay': 2.9342149585647356e-06, 'epochs': 332, 'loss': 'mse', 'optimizer': 'adam', 'graph_mode': 'off', 'use_snp_selection': False}. Best is trial 128 with value: 0.10170132976592543.
[I 2025-11-03 11:58:41,514] Trial 134 finished with value: 0.0960345799648412 and parameters: {'model_type': 'gcn', 'hidden_dims': '[256, 128]', 'dropout': 0.15300661168598761, 'batch_norm': False, 'lr': 0.0008826910596486608, 'weight_decay': 2.3371554148671183e-06, 'epochs': 300, 'loss': 'mse', 'optimizer': 'adam', 'graph_mode': 'off', 'use_snp_selection': False}. Best is trial 128 with value: 0.10170132976592543.
[I 2025-11-03 11:58:43,629] Trial 135 finished with value: 0.03973712669434583 and parameters: {'model_type': 'gcn', 'hidden_dims': '[256, 128]', 'dropout': 0.11228265661693987, 'batch_norm': False, 'lr': 0.0008737743960437544, 'weight_decay': 2.0337626703579576e-06, 'epochs': 314, 'loss': 'mse', 'optimizer': 'adam', 'graph_mode': 'off', 'use_snp_selection': False}. Best is trial 128 with value: 0.10170132976592543.
[I 2025-11-03 11:58:45,624] Trial 136 finished with value: 0.06664937349734745 and parameters: {'model_type': 'gcn', 'hidden_dims': '[256, 128]', 'dropout': 0.15216349008222588, 'batch_norm': False, 'lr': 0.0005542530233228379, 'weight_decay': 2.355613542651086e-06, 'epochs': 296, 'loss': 'mse', 'optimizer': 'adam', 'graph_mode': 'off', 'use_snp_selection': False}. Best is trial 128 with value: 0.10170132976592543.
[I 2025-11-03 11:58:47,800] Trial 137 finished with value: 0.05165729573165326 and parameters: {'model_type': 'gcn', 'hidden_dims': '[256, 128]', 'dropout': 0.12876094208641242, 'batch_norm': False, 'lr': 0.0007350264014213875, 'weight_decay': 3.6207473154166772e-06, 'epochs': 339, 'loss': 'mse', 'optimizer': 'adam', 'graph_mode': 'off', 'use_snp_selection': False}. Best is trial 128 with value: 0.10170132976592543.
[I 2025-11-03 11:58:49,885] Trial 138 finished with value: 0.10213562004150117 and parameters: {'model_type': 'gcn', 'hidden_dims': '[256, 128]', 'dropout': 0.1824225334350932, 'batch_norm': False, 'lr': 0.0009604019526785137, 'weight_decay': 1.7931512222069466e-06, 'epochs': 317, 'loss': 'mse', 'optimizer': 'adam', 'graph_mode': 'off', 'use_snp_selection': False}. Best is trial 138 with value: 0.10213562004150117.
[I 2025-11-03 11:58:51,913] Trial 139 finished with value: 0.09853275349562435 and parameters: {'model_type': 'gcn', 'hidden_dims': '[256, 128]', 'dropout': 0.17876701571444456, 'batch_norm': False, 'lr': 0.0008889319468672006, 'weight_decay': 1.1431556043348427e-06, 'epochs': 299, 'loss': 'mse', 'optimizer': 'adam', 'graph_mode': 'off', 'use_snp_selection': False}. Best is trial 138 with value: 0.10213562004150117.
[I 2025-11-03 11:58:53,945] Trial 140 finished with value: 0.06585905524407087 and parameters: {'model_type': 'gcn', 'hidden_dims': '[256, 128]', 'dropout': 0.18439773785063102, 'batch_norm': False, 'lr': 0.0009174184584589854, 'weight_decay': 1.204011354817231e-06, 'epochs': 301, 'loss': 'mse', 'optimizer': 'adam', 'graph_mode': 'off', 'use_snp_selection': False}. Best is trial 138 with value: 0.10213562004150117.
[I 2025-11-03 11:58:55,987] Trial 141 finished with value: 0.08559382747639722 and parameters: {'model_type': 'gcn', 'hidden_dims': '[256, 128]', 'dropout': 0.16452758964071496, 'batch_norm': False, 'lr': 0.0008136006135035469, 'weight_decay': 9.059162987160929e-07, 'epochs': 289, 'loss': 'mse', 'optimizer': 'adam', 'graph_mode': 'off', 'use_snp_selection': False}. Best is trial 138 with value: 0.10213562004150117.
[I 2025-11-03 11:58:57,896] Trial 142 finished with value: 0.023310216959487498 and parameters: {'model_type': 'gcn', 'hidden_dims': '[256, 128]', 'dropout': 0.205330954347659, 'batch_norm': False, 'lr': 0.0005867732536975258, 'weight_decay': 2.7253283769731523e-06, 'epochs': 280, 'loss': 'mse', 'optimizer': 'adam', 'graph_mode': 'off', 'use_snp_selection': False}. Best is trial 138 with value: 0.10213562004150117.
[I 2025-11-03 11:59:00,014] Trial 143 finished with value: -0.01664599537465112 and parameters: {'model_type': 'gcn', 'hidden_dims': '[256, 128]', 'dropout': 0.14871207756837343, 'batch_norm': False, 'lr': 0.0009952927398622837, 'weight_decay': 1.7134843870315672e-06, 'epochs': 317, 'loss': 'mse', 'optimizer': 'adam', 'graph_mode': 'off', 'use_snp_selection': False}. Best is trial 138 with value: 0.10213562004150117.
[I 2025-11-03 11:59:02,092] Trial 144 finished with value: 0.06797223418836573 and parameters: {'model_type': 'gcn', 'hidden_dims': '[256, 128]', 'dropout': 0.17653210449273013, 'batch_norm': False, 'lr': 0.0007546102145330672, 'weight_decay': 2.164143494736668e-06, 'epochs': 310, 'loss': 'mse', 'optimizer': 'adam', 'graph_mode': 'off', 'use_snp_selection': False}. Best is trial 138 with value: 0.10213562004150117.
[I 2025-11-03 11:59:04,281] Trial 145 finished with value: 0.0742366914871426 and parameters: {'model_type': 'gcn', 'hidden_dims': '[256, 128]', 'dropout': 0.15588204085577204, 'batch_norm': False, 'lr': 0.0005206629517993232, 'weight_decay': 1.1324560657764742e-06, 'epochs': 331, 'loss': 'mse', 'optimizer': 'adam', 'graph_mode': 'off', 'use_snp_selection': False}. Best is trial 138 with value: 0.10213562004150117.
[I 2025-11-03 11:59:06,130] Trial 146 finished with value: 0.03407228439563593 and parameters: {'model_type': 'gcn', 'hidden_dims': '[256, 128]', 'dropout': 0.19576758414870626, 'batch_norm': False, 'lr': 0.0008250108636343176, 'weight_decay': 0.0004032890406402373, 'epochs': 268, 'loss': 'mse', 'optimizer': 'adam', 'graph_mode': 'off', 'use_snp_selection': False}. Best is trial 138 with value: 0.10213562004150117.
[I 2025-11-03 11:59:08,210] Trial 147 finished with value: 0.04423597279537185 and parameters: {'model_type': 'gcn', 'hidden_dims': '[256, 128]', 'dropout': 0.14107515226525846, 'batch_norm': False, 'lr': 0.0006253070268621947, 'weight_decay': 7.250689653832243e-07, 'epochs': 297, 'loss': 'mse', 'optimizer': 'adam', 'graph_mode': 'off', 'use_snp_selection': False}. Best is trial 138 with value: 0.10213562004150117.
[I 2025-11-03 11:59:10,275] Trial 148 finished with value: 0.06645914381228672 and parameters: {'model_type': 'gcn', 'hidden_dims': '[256, 128]', 'dropout': 0.12186762494947173, 'batch_norm': False, 'lr': 0.0009012328124277282, 'weight_decay': 1.8360396283245672e-06, 'epochs': 305, 'loss': 'mse', 'optimizer': 'adam', 'graph_mode': 'off', 'use_snp_selection': False}. Best is trial 138 with value: 0.10213562004150117.
[I 2025-11-03 11:59:12,272] Trial 149 finished with value: 0.07426613836924796 and parameters: {'model_type': 'gcn', 'hidden_dims': '[256, 128]', 'dropout': 0.16089307815601464, 'batch_norm': False, 'lr': 0.0007149302183988405, 'weight_decay': 5.964135519572159e-06, 'epochs': 284, 'loss': 'mse', 'optimizer': 'adam', 'graph_mode': 'off', 'use_snp_selection': False}. Best is trial 138 with value: 0.10213562004150117.
[I 2025-11-03 11:59:15,091] Trial 0 finished with value: 0.07757370939483364 and parameters: {'model_type': 'gcn', 'hidden_dims': '[128, 64]', 'dropout': 0.199031432379812, 'batch_norm': True, 'lr': 1.8408544111075837e-06, 'weight_decay': 5.5136510071208614e-05, 'epochs': 336, 'loss': 'mae', 'optimizer': 'adam', 'graph_mode': 'off', 'use_snp_selection': True, 'num_snps': 43862}. Best is trial 0 with value: 0.07757370939483364.
[I 2025-11-03 11:59:17,393] Trial 1 finished with value: 0.10176422804404048 and parameters: {'model_type': 'gcn', 'hidden_dims': '[256, 128]', 'dropout': 0.4370668075331726, 'batch_norm': True, 'lr': 7.133471581159139e-05, 'weight_decay': 1.128633586803549e-05, 'epochs': 242, 'loss': 'mae', 'optimizer': 'adam', 'graph_mode': 'off', 'use_snp_selection': False}. Best is trial 1 with value: 0.10176422804404048.
[I 2025-11-03 11:59:18,829] Trial 2 finished with value: 0.06642307202706162 and parameters: {'model_type': 'gcn', 'hidden_dims': '[256, 128, 64]', 'dropout': 0.41314357415569625, 'batch_norm': False, 'lr': 3.952233718592101e-06, 'weight_decay': 0.00026754769258252603, 'epochs': 149, 'loss': 'mse', 'optimizer': 'adam', 'graph_mode': 'off', 'use_snp_selection': True, 'num_snps': 11571}. Best is trial 1 with value: 0.10176422804404048.
[I 2025-11-03 11:59:23,211] Trial 3 finished with value: 0.013945863721778822 and parameters: {'model_type': 'gcn', 'hidden_dims': '[512, 64]', 'dropout': 0.5938127374509361, 'batch_norm': False, 'lr': 5.67704586114731e-06, 'weight_decay': 2.4518087630137052e-05, 'epochs': 320, 'loss': 'mae', 'optimizer': 'adam', 'graph_mode': 'off', 'use_snp_selection': False}. Best is trial 1 with value: 0.10176422804404048.
[I 2025-11-03 11:59:26,745] Trial 4 finished with value: 0.05940680985605751 and parameters: {'model_type': 'gcn', 'hidden_dims': '[512, 128]', 'dropout': 0.25746343592134413, 'batch_norm': True, 'lr': 1.3467657668402788e-06, 'weight_decay': 0.00033087251918647806, 'epochs': 277, 'loss': 'mse', 'optimizer': 'adam', 'graph_mode': 'off', 'use_snp_selection': True, 'num_snps': 36675}. Best is trial 1 with value: 0.10176422804404048.
[I 2025-11-03 11:59:29,125] Trial 5 finished with value: 0.024374977172883134 and parameters: {'model_type': 'gcn', 'hidden_dims': '[512, 64]', 'dropout': 0.38275350994408375, 'batch_norm': True, 'lr': 1.5586664309232824e-06, 'weight_decay': 0.0008227664668621182, 'epochs': 145, 'loss': 'mae', 'optimizer': 'adam', 'graph_mode': 'off', 'use_snp_selection': True, 'num_snps': 32148}. Best is trial 1 with value: 0.10176422804404048.
[I 2025-11-03 11:59:31,046] Trial 6 finished with value: 0.12204681859129028 and parameters: {'model_type': 'gcn', 'hidden_dims': '[256, 128]', 'dropout': 0.3930109900265879, 'batch_norm': False, 'lr': 4.892964372128395e-05, 'weight_decay': 1.5809549317992182e-06, 'epochs': 199, 'loss': 'mse', 'optimizer': 'adam', 'graph_mode': 'off', 'use_snp_selection': False}. Best is trial 6 with value: 0.12204681859129028.
[I 2025-11-03 11:59:32,862] Trial 7 finished with value: 0.0955730231641357 and parameters: {'model_type': 'gcn', 'hidden_dims': '[512, 256]', 'dropout': 0.15343979219678458, 'batch_norm': True, 'lr': 6.234003099047341e-05, 'weight_decay': 3.894760610535477e-07, 'epochs': 97, 'loss': 'mse', 'optimizer': 'adam', 'graph_mode': 'off', 'use_snp_selection': False}. Best is trial 6 with value: 0.12204681859129028.
[I 2025-11-03 11:59:37,216] Trial 8 finished with value: 0.15173458987761906 and parameters: {'model_type': 'gcn', 'hidden_dims': '[512, 128]', 'dropout': 0.10743001231661406, 'batch_norm': True, 'lr': 0.00023728538449271062, 'weight_decay': 1.7629071578048637e-05, 'epochs': 312, 'loss': 'mae', 'optimizer': 'adam', 'graph_mode': 'off', 'use_snp_selection': False}. Best is trial 8 with value: 0.15173458987761906.
[I 2025-11-03 11:59:39,947] Trial 9 finished with value: 0.12478714970971734 and parameters: {'model_type': 'gcn', 'hidden_dims': '[512, 64]', 'dropout': 0.14505336736221927, 'batch_norm': True, 'lr': 5.8619638388111826e-05, 'weight_decay': 6.200156172669308e-07, 'epochs': 175, 'loss': 'mse', 'optimizer': 'adam', 'graph_mode': 'off', 'use_snp_selection': False}. Best is trial 8 with value: 0.15173458987761906.
[I 2025-11-03 11:59:41,305] Trial 10 finished with value: 0.01962276783851674 and parameters: {'model_type': 'gcn', 'hidden_dims': '[512, 128]', 'dropout': 0.2800030442581858, 'batch_norm': False, 'lr': 0.0004919806695968257, 'weight_decay': 2.9953888095455486e-06, 'epochs': 55, 'loss': 'mae', 'optimizer': 'adam', 'graph_mode': 'off', 'use_snp_selection': False}. Best is trial 8 with value: 0.15173458987761906.
[I 2025-11-03 11:59:44,510] Trial 11 finished with value: 0.16785372169072177 and parameters: {'model_type': 'gcn', 'hidden_dims': '[512, 128]', 'dropout': 0.10095648685224448, 'batch_norm': True, 'lr': 0.0003411435764085616, 'weight_decay': 1.2045055692919657e-07, 'epochs': 216, 'loss': 'mse', 'optimizer': 'adam', 'graph_mode': 'off', 'use_snp_selection': False}. Best is trial 11 with value: 0.16785372169072177.
[I 2025-11-03 11:59:48,185] Trial 12 finished with value: 0.15878376972474212 and parameters: {'model_type': 'gcn', 'hidden_dims': '[512, 128]', 'dropout': 0.10344600881777158, 'batch_norm': True, 'lr': 0.0006674532614549997, 'weight_decay': 1.3081036432574914e-07, 'epochs': 255, 'loss': 'mae', 'optimizer': 'adam', 'graph_mode': 'off', 'use_snp_selection': False}. Best is trial 11 with value: 0.16785372169072177.
[I 2025-11-03 11:59:51,629] Trial 13 finished with value: 0.1544900761923332 and parameters: {'model_type': 'gcn', 'hidden_dims': '[512, 128]', 'dropout': 0.22096278001553593, 'batch_norm': True, 'lr': 0.0005692918571972218, 'weight_decay': 1.0885943577911259e-07, 'epochs': 236, 'loss': 'mse', 'optimizer': 'adam', 'graph_mode': 'off', 'use_snp_selection': False}. Best is trial 11 with value: 0.16785372169072177.
[I 2025-11-03 11:59:55,221] Trial 14 finished with value: 0.1489108898185959 and parameters: {'model_type': 'gcn', 'hidden_dims': '[512, 128]', 'dropout': 0.3012984444538551, 'batch_norm': True, 'lr': 0.0002108574938852793, 'weight_decay': 1.0838231003431842e-07, 'epochs': 243, 'loss': 'mse', 'optimizer': 'adam', 'graph_mode': 'off', 'use_snp_selection': False}. Best is trial 11 with value: 0.16785372169072177.
[I 2025-11-03 11:59:57,016] Trial 15 finished with value: 0.15274569782694977 and parameters: {'model_type': 'gcn', 'hidden_dims': '[128, 64]', 'dropout': 0.10272160099215884, 'batch_norm': True, 'lr': 0.0008020255002946244, 'weight_decay': 3.9745576709552696e-07, 'epochs': 281, 'loss': 'mae', 'optimizer': 'adam', 'graph_mode': 'off', 'use_snp_selection': False}. Best is trial 11 with value: 0.16785372169072177.
[I 2025-11-03 11:59:59,285] Trial 16 finished with value: 0.12211571037039207 and parameters: {'model_type': 'gcn', 'hidden_dims': '[256, 128, 64]', 'dropout': 0.558513902174278, 'batch_norm': True, 'lr': 0.00017549215405955411, 'weight_decay': 1.3863650262743942e-06, 'epochs': 206, 'loss': 'mae', 'optimizer': 'adam', 'graph_mode': 'off', 'use_snp_selection': False}. Best is trial 11 with value: 0.16785372169072177.
[I 2025-11-03 12:00:03,350] Trial 17 finished with value: 0.058721640734451665 and parameters: {'model_type': 'gcn', 'hidden_dims': '[512, 256]', 'dropout': 0.5026660877666042, 'batch_norm': True, 'lr': 1.7075459989479874e-05, 'weight_decay': 4.434758177648061e-06, 'epochs': 287, 'loss': 'mse', 'optimizer': 'adam', 'graph_mode': 'off', 'use_snp_selection': False}. Best is trial 11 with value: 0.16785372169072177.
[I 2025-11-03 12:00:07,597] Trial 18 finished with value: 0.09463266235186389 and parameters: {'model_type': 'gcn', 'hidden_dims': '[512, 128]', 'dropout': 0.18666334338261442, 'batch_norm': False, 'lr': 0.000990842629404931, 'weight_decay': 2.3295471516958728e-07, 'epochs': 217, 'loss': 'mae', 'optimizer': 'adam', 'graph_mode': 'off', 'use_snp_selection': True, 'num_snps': 58241}. Best is trial 11 with value: 0.16785372169072177.
