[I 2025-11-03 13:07:18,456] Trial 16 finished with value: 0.022169119652210363 and parameters: {'model_type': 'graphsage', 'hidden_dims': '[256, 128, 64]', 'dropout': 0.5886866495246753, 'batch_norm': True, 'lr': 1.6737040749638926e-05, 'weight_decay': 7.502199477378959e-05, 'epochs': 101, 'loss': 'mae', 'optimizer': 'adam', 'graph_mode': 'cutoff', 'cutoff': 0.4354075990476878, 'grm_norm': 'none', 'self_loops': True, 'use_snp_selection': False}. Best is trial 8 with value: 0.1320936249611708.
[I 2025-11-03 13:07:22,923] Trial 17 finished with value: 0.10684734835714263 and parameters: {'model_type': 'graphsage', 'hidden_dims': '[512, 128]', 'dropout': 0.33683457960985275, 'batch_norm': True, 'lr': 7.480074947107918e-05, 'weight_decay': 7.705235343877529e-06, 'epochs': 273, 'loss': 'mse', 'optimizer': 'adam', 'graph_mode': 'knn', 'source': 'grm', 'knn_k': 4, 'weighted_edges': False, 'symmetrize_mode': 'union', 'use_snp_selection': False}. Best is trial 8 with value: 0.1320936249611708.
[I 2025-11-03 13:07:26,675] Trial 18 finished with value: 0.1260037362633512 and parameters: {'model_type': 'graphsage', 'hidden_dims': '[512, 256]', 'dropout': 0.23298138871912893, 'batch_norm': True, 'lr': 0.00019118591650870096, 'weight_decay': 0.0002172697548343361, 'epochs': 217, 'loss': 'mse', 'optimizer': 'adam', 'graph_mode': 'cutoff', 'cutoff': 0.4054871531968594, 'grm_norm': 'cosine_then_gcn', 'self_loops': True, 'use_snp_selection': False}. Best is trial 8 with value: 0.1320936249611708.
[I 2025-11-03 13:07:29,930] Trial 19 finished with value: 0.07624784708772056 and parameters: {'model_type': 'graphsage', 'hidden_dims': '[512, 256]', 'dropout': 0.22581880165726664, 'batch_norm': True, 'lr': 8.605177672980498e-06, 'weight_decay': 0.00018147135541260847, 'epochs': 149, 'loss': 'mse', 'optimizer': 'adam', 'graph_mode': 'cutoff', 'cutoff': 0.4136230223593566, 'grm_norm': 'cosine_then_gcn', 'self_loops': True, 'use_snp_selection': False}. Best is trial 8 with value: 0.1320936249611708.
[I 2025-11-03 13:07:32,650] Trial 20 finished with value: 0.10381494048441019 and parameters: {'model_type': 'graphsage', 'hidden_dims': '[512, 128]', 'dropout': 0.18614493348161285, 'batch_norm': True, 'lr': 6.0201577908762764e-05, 'weight_decay': 0.0009708132297565954, 'epochs': 80, 'loss': 'mse', 'optimizer': 'adam', 'graph_mode': 'cutoff', 'cutoff': 0.21218709727906532, 'grm_norm': 'cosine_then_gcn', 'self_loops': True, 'use_snp_selection': False}. Best is trial 8 with value: 0.1320936249611708.
[I 2025-11-03 13:07:36,422] Trial 21 finished with value: 0.13698237293288607 and parameters: {'model_type': 'graphsage', 'hidden_dims': '[512, 256]', 'dropout': 0.26456145998509206, 'batch_norm': True, 'lr': 0.00022332371440770177, 'weight_decay': 1.8845315374213317e-05, 'epochs': 218, 'loss': 'mse', 'optimizer': 'adam', 'graph_mode': 'cutoff', 'cutoff': 0.35693982185645523, 'grm_norm': 'cosine', 'self_loops': True, 'use_snp_selection': False}. Best is trial 21 with value: 0.13698237293288607.
[I 2025-11-03 13:07:40,116] Trial 22 finished with value: 0.11507088390683468 and parameters: {'model_type': 'graphsage', 'hidden_dims': '[512, 256]', 'dropout': 0.25725544475213763, 'batch_norm': True, 'lr': 0.0001773355929056985, 'weight_decay': 0.00019085913555358226, 'epochs': 211, 'loss': 'mse', 'optimizer': 'adam', 'graph_mode': 'cutoff', 'cutoff': 0.38298233090983297, 'grm_norm': 'cosine', 'self_loops': True, 'use_snp_selection': False}. Best is trial 21 with value: 0.13698237293288607.
[I 2025-11-03 13:07:44,407] Trial 23 finished with value: 0.12889923565879302 and parameters: {'model_type': 'graphsage', 'hidden_dims': '[512, 256]', 'dropout': 0.16092840053275612, 'batch_norm': True, 'lr': 0.0004610672664041688, 'weight_decay': 8.770958923762084e-07, 'epochs': 285, 'loss': 'mse', 'optimizer': 'adam', 'graph_mode': 'cutoff', 'cutoff': 0.5213459624219295, 'grm_norm': 'cosine', 'self_loops': True, 'use_snp_selection': False}. Best is trial 21 with value: 0.13698237293288607.
[I 2025-11-03 13:07:48,767] Trial 24 finished with value: 0.12992365079136928 and parameters: {'model_type': 'graphsage', 'hidden_dims': '[512, 256]', 'dropout': 0.1671696889590893, 'batch_norm': True, 'lr': 0.0004876033893737243, 'weight_decay': 9.072307898188961e-07, 'epochs': 295, 'loss': 'mse', 'optimizer': 'adam', 'graph_mode': 'cutoff', 'cutoff': 0.5346016158053652, 'grm_norm': 'cosine', 'self_loops': True, 'use_snp_selection': False}. Best is trial 21 with value: 0.13698237293288607.
[I 2025-11-03 13:07:51,911] Trial 25 finished with value: 0.10043706688867074 and parameters: {'model_type': 'graphsage', 'hidden_dims': '[256, 128, 64]', 'dropout': 0.28429998777364146, 'batch_norm': True, 'lr': 0.0009781454116176084, 'weight_decay': 2.937376464526185e-07, 'epochs': 343, 'loss': 'mse', 'optimizer': 'adam', 'graph_mode': 'cutoff', 'cutoff': 0.5335383013319602, 'grm_norm': 'cosine', 'self_loops': True, 'use_snp_selection': False}. Best is trial 21 with value: 0.13698237293288607.
[I 2025-11-03 13:07:57,915] Trial 26 finished with value: 0.022346619125781772 and parameters: {'model_type': 'graphsage', 'hidden_dims': '[512, 64]', 'dropout': 0.17433318568244424, 'batch_norm': False, 'lr': 0.000342096395297247, 'weight_decay': 2.8052400503418905e-06, 'epochs': 317, 'loss': 'mse', 'optimizer': 'adam', 'graph_mode': 'cutoff', 'cutoff': 0.3282479347445893, 'grm_norm': 'cosine', 'self_loops': True, 'use_snp_selection': True, 'num_snps': 59005}. Best is trial 21 with value: 0.13698237293288607.
[I 2025-11-03 13:08:00,111] Trial 27 finished with value: 0.1275716116948703 and parameters: {'model_type': 'graphsage', 'hidden_dims': '[256, 128]', 'dropout': 0.2119409166083416, 'batch_norm': True, 'lr': 0.0005767223161414262, 'weight_decay': 8.728928780721501e-07, 'epochs': 173, 'loss': 'mse', 'optimizer': 'adam', 'graph_mode': 'cutoff', 'cutoff': 0.6301176721728495, 'grm_norm': 'cosine', 'self_loops': True, 'use_snp_selection': False}. Best is trial 21 with value: 0.13698237293288607.
[I 2025-11-03 13:08:03,155] Trial 28 finished with value: 0.049316701538306196 and parameters: {'model_type': 'graphsage', 'hidden_dims': '[512, 256]', 'dropout': 0.13856989171948841, 'batch_norm': True, 'lr': 1.172392540014445e-06, 'weight_decay': 4.977979952500835e-06, 'epochs': 123, 'loss': 'mse', 'optimizer': 'adam', 'graph_mode': 'cutoff', 'cutoff': 0.512625683875311, 'grm_norm': 'cosine', 'self_loops': True, 'use_snp_selection': False}. Best is trial 21 with value: 0.13698237293288607.
[I 2025-11-03 13:08:05,483] Trial 29 finished with value: 0.08948618609150472 and parameters: {'model_type': 'graphsage', 'hidden_dims': '[128, 64]', 'dropout': 0.3938846240374938, 'batch_norm': True, 'lr': 0.00012918117328049853, 'weight_decay': 3.18257793468402e-05, 'epochs': 318, 'loss': 'mse', 'optimizer': 'adam', 'graph_mode': 'cutoff', 'cutoff': 0.34240891536728496, 'grm_norm': 'cosine', 'self_loops': True, 'use_snp_selection': False}. Best is trial 21 with value: 0.13698237293288607.
[I 2025-11-03 13:08:09,828] Trial 30 finished with value: 0.09870682084320977 and parameters: {'model_type': 'graphsage', 'hidden_dims': '[512, 128]', 'dropout': 0.25171973071734066, 'batch_norm': True, 'lr': 5.7258987615196194e-05, 'weight_decay': 3.932248856189873e-07, 'epochs': 283, 'loss': 'mse', 'optimizer': 'adam', 'graph_mode': 'cutoff', 'cutoff': 0.20867502491096857, 'grm_norm': 'gcn', 'self_loops': True, 'use_snp_selection': False}. Best is trial 21 with value: 0.13698237293288607.
[I 2025-11-03 13:08:14,192] Trial 31 finished with value: 0.11919626282952261 and parameters: {'model_type': 'graphsage', 'hidden_dims': '[512, 256]', 'dropout': 0.17428644980204036, 'batch_norm': True, 'lr': 0.0004105234141767051, 'weight_decay': 8.047053462604121e-07, 'epochs': 295, 'loss': 'mse', 'optimizer': 'adam', 'graph_mode': 'cutoff', 'cutoff': 0.49380124351985205, 'grm_norm': 'cosine', 'self_loops': True, 'use_snp_selection': False}. Best is trial 21 with value: 0.13698237293288607.
[I 2025-11-03 13:08:18,293] Trial 32 finished with value: 0.1231950929107655 and parameters: {'model_type': 'graphsage', 'hidden_dims': '[512, 256]', 'dropout': 0.14023345387487907, 'batch_norm': True, 'lr': 0.0006215267541140211, 'weight_decay': 1.4756049022682919e-06, 'epochs': 267, 'loss': 'mse', 'optimizer': 'adam', 'graph_mode': 'cutoff', 'cutoff': 0.594266609571827, 'grm_norm': 'cosine', 'self_loops': True, 'use_snp_selection': False}. Best is trial 21 with value: 0.13698237293288607.
[I 2025-11-03 13:08:22,850] Trial 33 finished with value: 0.14186163578646635 and parameters: {'model_type': 'graphsage', 'hidden_dims': '[512, 256]', 'dropout': 0.10443749467365576, 'batch_norm': True, 'lr': 0.00043966912810316236, 'weight_decay': 1.015150806395313e-07, 'epochs': 316, 'loss': 'mse', 'optimizer': 'adam', 'graph_mode': 'cutoff', 'cutoff': 0.4724238647520091, 'grm_norm': 'cosine', 'self_loops': True, 'use_snp_selection': False}. Best is trial 33 with value: 0.14186163578646635.
[I 2025-11-03 13:08:27,447] Trial 34 finished with value: 0.128534299500849 and parameters: {'model_type': 'graphsage', 'hidden_dims': '[512, 256]', 'dropout': 0.10698450361182801, 'batch_norm': True, 'lr': 0.0006398662900589103, 'weight_decay': 1.8689391326352805e-07, 'epochs': 326, 'loss': 'mse', 'optimizer': 'adam', 'graph_mode': 'cutoff', 'cutoff': 0.456897106975287, 'grm_norm': 'cosine', 'self_loops': True, 'use_snp_selection': False}. Best is trial 33 with value: 0.14186163578646635.
[I 2025-11-03 13:08:29,406] Trial 35 finished with value: 0.05158021262880343 and parameters: {'model_type': 'graphsage', 'hidden_dims': '[128, 64]', 'dropout': 0.5439454600271401, 'batch_norm': False, 'lr': 0.0002977828922140673, 'weight_decay': 1.0323876001426363e-05, 'epochs': 309, 'loss': 'mse', 'optimizer': 'adam', 'graph_mode': 'cutoff', 'cutoff': 0.3372861026549592, 'grm_norm': 'none', 'self_loops': True, 'use_snp_selection': True, 'num_snps': 2074}. Best is trial 33 with value: 0.14186163578646635.
[I 2025-11-03 13:08:32,410] Trial 36 finished with value: 0.11340490520228028 and parameters: {'model_type': 'graphsage', 'hidden_dims': '[256, 128]', 'dropout': 0.10142127497235989, 'batch_norm': True, 'lr': 0.0007916994900817384, 'weight_decay': 1.001543157175293e-07, 'epochs': 347, 'loss': 'mse', 'optimizer': 'adam', 'graph_mode': 'cutoff', 'cutoff': 0.4729875923151739, 'grm_norm': 'cosine', 'self_loops': False, 'use_snp_selection': False}. Best is trial 33 with value: 0.14186163578646635.
[I 2025-11-03 13:08:34,150] Trial 37 finished with value: 0.04794328705640477 and parameters: {'model_type': 'graphsage', 'hidden_dims': '[256, 128, 64]', 'dropout': 0.15057691577639856, 'batch_norm': False, 'lr': 3.301374437709557e-06, 'weight_decay': 3.780136081990512e-05, 'epochs': 48, 'loss': 'mse', 'optimizer': 'adam', 'graph_mode': 'cutoff', 'cutoff': 0.37649472493277353, 'grm_norm': 'cosine', 'self_loops': True, 'use_snp_selection': True, 'num_snps': 15344}. Best is trial 33 with value: 0.14186163578646635.
[I 2025-11-03 13:08:38,157] Trial 38 finished with value: 0.12055693649529932 and parameters: {'model_type': 'graphsage', 'hidden_dims': '[512, 256]', 'dropout': 0.19594098467564108, 'batch_norm': True, 'lr': 0.00017835945679712156, 'weight_decay': 5.075024467781556e-07, 'epochs': 242, 'loss': 'mse', 'optimizer': 'adam', 'graph_mode': 'cutoff', 'cutoff': 0.29588417716821996, 'grm_norm': 'cosine', 'self_loops': True, 'use_snp_selection': False}. Best is trial 33 with value: 0.14186163578646635.
[I 2025-11-03 13:08:41,524] Trial 39 finished with value: -0.00928427149226861 and parameters: {'model_type': 'graphsage', 'hidden_dims': '[128, 64]', 'dropout': 0.4560493708759047, 'batch_norm': False, 'lr': 0.00046122180201158865, 'weight_decay': 1.5312001336847918e-05, 'epochs': 134, 'loss': 'mse', 'optimizer': 'adam', 'graph_mode': 'cutoff', 'cutoff': 0.579651590995302, 'grm_norm': 'gcn', 'self_loops': False, 'use_snp_selection': True, 'num_snps': 58379}. Best is trial 33 with value: 0.14186163578646635.
[I 2025-11-03 13:08:45,488] Trial 40 finished with value: 0.0746272561616602 and parameters: {'model_type': 'graphsage', 'hidden_dims': '[512, 256]', 'dropout': 0.5183920260779593, 'batch_norm': True, 'lr': 0.000129360516158575, 'weight_decay': 2.0255568689468215e-07, 'epochs': 174, 'loss': 'mse', 'optimizer': 'adam', 'graph_mode': 'knn', 'source': 'grm', 'knn_k': 10, 'weighted_edges': False, 'symmetrize_mode': 'union', 'use_snp_selection': False}. Best is trial 33 with value: 0.14186163578646635.
[I 2025-11-03 13:08:50,106] Trial 41 finished with value: 0.13771319757331205 and parameters: {'model_type': 'graphsage', 'hidden_dims': '[512, 256]', 'dropout': 0.16021081645836902, 'batch_norm': True, 'lr': 0.0004921225596582009, 'weight_decay': 1.071033547234606e-06, 'epochs': 330, 'loss': 'mse', 'optimizer': 'adam', 'graph_mode': 'cutoff', 'cutoff': 0.5508290721755319, 'grm_norm': 'cosine', 'self_loops': True, 'use_snp_selection': False}. Best is trial 33 with value: 0.14186163578646635.
[I 2025-11-03 13:08:54,885] Trial 42 finished with value: 0.13132422862815896 and parameters: {'model_type': 'graphsage', 'hidden_dims': '[512, 256]', 'dropout': 0.1274742391001147, 'batch_norm': True, 'lr': 0.00032416277423918634, 'weight_decay': 2.876589279108436e-06, 'epochs': 350, 'loss': 'mse', 'optimizer': 'adam', 'graph_mode': 'cutoff', 'cutoff': 0.566274904567844, 'grm_norm': 'cosine', 'self_loops': True, 'use_snp_selection': False}. Best is trial 33 with value: 0.14186163578646635.
[I 2025-11-03 13:08:59,537] Trial 43 finished with value: 0.12544260784670624 and parameters: {'model_type': 'graphsage', 'hidden_dims': '[512, 256]', 'dropout': 0.12653405943521726, 'batch_norm': True, 'lr': 0.00025397245373507776, 'weight_decay': 2.844906061727416e-06, 'epochs': 332, 'loss': 'mse', 'optimizer': 'adam', 'graph_mode': 'cutoff', 'cutoff': 0.6298975972193174, 'grm_norm': 'cosine', 'self_loops': True, 'use_snp_selection': False}. Best is trial 33 with value: 0.14186163578646635.
[I 2025-11-03 13:09:03,102] Trial 44 finished with value: 0.1158797099899574 and parameters: {'model_type': 'graphsage', 'hidden_dims': '[512, 128]', 'dropout': 0.12160756905112394, 'batch_norm': True, 'lr': 0.0003244342030697823, 'weight_decay': 5.252395476341667e-06, 'epochs': 197, 'loss': 'mse', 'optimizer': 'adam', 'graph_mode': 'cutoff', 'cutoff': 0.748990128892686, 'grm_norm': 'none', 'self_loops': False, 'use_snp_selection': False}. Best is trial 33 with value: 0.14186163578646635.
[I 2025-11-03 13:09:07,738] Trial 45 finished with value: 0.12687407350277569 and parameters: {'model_type': 'graphsage', 'hidden_dims': '[512, 256]', 'dropout': 0.32309128791428, 'batch_norm': True, 'lr': 0.0007613816743007174, 'weight_decay': 1.99628506286404e-06, 'epochs': 329, 'loss': 'mae', 'optimizer': 'adam', 'graph_mode': 'cutoff', 'cutoff': 0.70683544126303, 'grm_norm': 'gcn', 'self_loops': True, 'use_snp_selection': False}. Best is trial 33 with value: 0.14186163578646635.
[I 2025-11-03 13:09:10,645] Trial 46 finished with value: 0.13760818118282758 and parameters: {'model_type': 'graphsage', 'hidden_dims': '[256, 128]', 'dropout': 0.2823464802248515, 'batch_norm': True, 'lr': 0.0002156836977243485, 'weight_decay': 1.3417772679944942e-06, 'epochs': 348, 'loss': 'mse', 'optimizer': 'adam', 'graph_mode': 'cutoff', 'cutoff': 0.5878451923185012, 'grm_norm': 'cosine', 'self_loops': False, 'use_snp_selection': False}. Best is trial 33 with value: 0.14186163578646635.
[I 2025-11-03 13:09:13,802] Trial 47 finished with value: 0.05309724336671556 and parameters: {'model_type': 'graphsage', 'hidden_dims': '[256, 128]', 'dropout': 0.28594979733673187, 'batch_norm': False, 'lr': 0.00010232145277918053, 'weight_decay': 1.5405522239467132e-06, 'epochs': 84, 'loss': 'mse', 'optimizer': 'adam', 'graph_mode': 'knn', 'source': 'grm', 'knn_k': 10, 'weighted_edges': False, 'symmetrize_mode': 'union', 'use_snp_selection': True, 'num_snps': 43485}. Best is trial 33 with value: 0.14186163578646635.
[I 2025-11-03 13:09:16,416] Trial 48 finished with value: 0.08982791888086666 and parameters: {'model_type': 'graphsage', 'hidden_dims': '[256, 128]', 'dropout': 0.36711074580756503, 'batch_norm': True, 'lr': 2.9081478770172682e-05, 'weight_decay': 6.852508624168964e-06, 'epochs': 254, 'loss': 'mae', 'optimizer': 'adam', 'graph_mode': 'cutoff', 'cutoff': 0.4695482319981862, 'grm_norm': 'cosine', 'self_loops': False, 'use_snp_selection': False}. Best is trial 33 with value: 0.14186163578646635.
[I 2025-11-03 13:09:18,888] Trial 49 finished with value: 0.11249234461268312 and parameters: {'model_type': 'graphsage', 'hidden_dims': '[256, 128]', 'dropout': 0.4118520895003167, 'batch_norm': True, 'lr': 0.00022062773798228548, 'weight_decay': 1.5889680493028893e-05, 'epochs': 235, 'loss': 'mse', 'optimizer': 'adam', 'graph_mode': 'cutoff', 'cutoff': 0.6457765992853352, 'grm_norm': 'cosine', 'self_loops': False, 'use_snp_selection': False}. Best is trial 33 with value: 0.14186163578646635.
[I 2025-11-03 13:09:24,099] Trial 50 finished with value: 0.10802596466047498 and parameters: {'model_type': 'graphsage', 'hidden_dims': '[512, 64]', 'dropout': 0.2905624987598712, 'batch_norm': True, 'lr': 0.00014696359423234926, 'weight_decay': 5.251695175160003e-07, 'epochs': 311, 'loss': 'mse', 'optimizer': 'adam', 'graph_mode': 'knn', 'source': 'grm', 'knn_k': 8, 'weighted_edges': False, 'symmetrize_mode': 'union', 'use_snp_selection': False}. Best is trial 33 with value: 0.14186163578646635.
[I 2025-11-03 13:09:27,062] Trial 51 finished with value: 0.13212177664001243 and parameters: {'model_type': 'graphsage', 'hidden_dims': '[256, 128]', 'dropout': 0.2164869195070346, 'batch_norm': True, 'lr': 0.0003197799744999418, 'weight_decay': 3.7545939497761515e-06, 'epochs': 350, 'loss': 'mse', 'optimizer': 'adam', 'graph_mode': 'cutoff', 'cutoff': 0.5638594965240911, 'grm_norm': 'cosine', 'self_loops': False, 'use_snp_selection': False}. Best is trial 33 with value: 0.14186163578646635.
[I 2025-11-03 13:09:29,946] Trial 52 finished with value: 0.12318680791146946 and parameters: {'model_type': 'graphsage', 'hidden_dims': '[256, 128]', 'dropout': 0.21596079155649378, 'batch_norm': True, 'lr': 0.00023902730981787519, 'weight_decay': 3.7027906616535637e-06, 'epochs': 333, 'loss': 'mse', 'optimizer': 'adam', 'graph_mode': 'cutoff', 'cutoff': 0.590315872170186, 'grm_norm': 'cosine', 'self_loops': False, 'use_snp_selection': False}. Best is trial 33 with value: 0.14186163578646635.
[I 2025-11-03 13:09:32,855] Trial 53 finished with value: 0.12899296248560302 and parameters: {'model_type': 'graphsage', 'hidden_dims': '[256, 128]', 'dropout': 0.23483120411530356, 'batch_norm': True, 'lr': 0.00040445026734069764, 'weight_decay': 7.477021800395582e-06, 'epochs': 339, 'loss': 'mse', 'optimizer': 'adam', 'graph_mode': 'cutoff', 'cutoff': 0.668574703257691, 'grm_norm': 'cosine', 'self_loops': False, 'use_snp_selection': False}. Best is trial 33 with value: 0.14186163578646635.
[I 2025-11-03 13:09:35,785] Trial 54 finished with value: 0.12415235688423588 and parameters: {'model_type': 'graphsage', 'hidden_dims': '[256, 128]', 'dropout': 0.26670505264223254, 'batch_norm': True, 'lr': 0.0005498924184216471, 'weight_decay': 1.3137270271478976e-06, 'epochs': 322, 'loss': 'mse', 'optimizer': 'adam', 'graph_mode': 'cutoff', 'cutoff': 0.25057156192846836, 'grm_norm': 'cosine', 'self_loops': False, 'use_snp_selection': False}. Best is trial 33 with value: 0.14186163578646635.
[I 2025-11-03 13:09:40,182] Trial 55 finished with value: 0.13239554471322343 and parameters: {'model_type': 'graphsage', 'hidden_dims': '[512, 128]', 'dropout': 0.3199247974353625, 'batch_norm': True, 'lr': 7.771254482833374e-05, 'weight_decay': 2.1098350960909785e-06, 'epochs': 300, 'loss': 'mae', 'optimizer': 'adam', 'graph_mode': 'cutoff', 'cutoff': 0.6086585920821983, 'grm_norm': 'cosine_then_gcn', 'self_loops': False, 'use_snp_selection': False}. Best is trial 33 with value: 0.14186163578646635.
[I 2025-11-03 13:09:44,614] Trial 56 finished with value: 0.13139335956088594 and parameters: {'model_type': 'graphsage', 'hidden_dims': '[512, 128]', 'dropout': 0.3288402858993931, 'batch_norm': True, 'lr': 7.059117112625697e-05, 'weight_decay': 1.9426141048484934e-06, 'epochs': 300, 'loss': 'mae', 'optimizer': 'adam', 'graph_mode': 'cutoff', 'cutoff': 0.6156256294797396, 'grm_norm': 'cosine_then_gcn', 'self_loops': False, 'use_snp_selection': False}. Best is trial 33 with value: 0.14186163578646635.
[I 2025-11-03 13:09:47,297] Trial 57 finished with value: 0.10283479687062141 and parameters: {'model_type': 'graphsage', 'hidden_dims': '[256, 128]', 'dropout': 0.3047553516918462, 'batch_norm': True, 'lr': 8.758758874948975e-05, 'weight_decay': 5.405887692592312e-05, 'epochs': 282, 'loss': 'mae', 'optimizer': 'adam', 'graph_mode': 'cutoff', 'cutoff': 0.5622530013268449, 'grm_norm': 'cosine_then_gcn', 'self_loops': False, 'use_snp_selection': False}. Best is trial 33 with value: 0.14186163578646635.
[I 2025-11-03 13:09:50,532] Trial 58 finished with value: 0.09062768352187794 and parameters: {'model_type': 'graphsage', 'hidden_dims': '[256, 128, 64]', 'dropout': 0.19547791590005642, 'batch_norm': True, 'lr': 1.771102134611614e-05, 'weight_decay': 1.1818071101642333e-05, 'epochs': 349, 'loss': 'mae', 'optimizer': 'adam', 'graph_mode': 'cutoff', 'cutoff': 0.7109694571499742, 'grm_norm': 'cosine_then_gcn', 'self_loops': False, 'use_snp_selection': False}. Best is trial 33 with value: 0.14186163578646635.
