[I 2025-11-03 12:30:59,814] Trial 101 finished with value: 0.04636477668149156 and parameters: {'model_type': 'gcn', 'hidden_dims': '[256, 128]', 'dropout': 0.32456467846452125, 'batch_norm': False, 'lr': 0.00013958451610450798, 'weight_decay': 1.6489223743436395e-07, 'epochs': 208, 'loss': 'mse', 'optimizer': 'adam', 'graph_mode': 'off', 'use_snp_selection': False}. Best is trial 16 with value: 0.07665877140891061.
[I 2025-11-03 12:31:01,081] Trial 102 finished with value: 0.06311316903485058 and parameters: {'model_type': 'gcn', 'hidden_dims': '[256, 128]', 'dropout': 0.3472855450172806, 'batch_norm': False, 'lr': 9.236203545836633e-05, 'weight_decay': 1.0389463029035415e-07, 'epochs': 226, 'loss': 'mse', 'optimizer': 'adam', 'graph_mode': 'off', 'use_snp_selection': False}. Best is trial 16 with value: 0.07665877140891061.
[I 2025-11-03 12:31:02,400] Trial 103 finished with value: 0.01386063100715592 and parameters: {'model_type': 'gcn', 'hidden_dims': '[256, 128]', 'dropout': 0.3164797920573547, 'batch_norm': False, 'lr': 9.560984707124268e-05, 'weight_decay': 1.228053286092706e-07, 'epochs': 242, 'loss': 'mse', 'optimizer': 'adam', 'graph_mode': 'off', 'use_snp_selection': False}. Best is trial 16 with value: 0.07665877140891061.
[I 2025-11-03 12:31:03,651] Trial 104 finished with value: 0.04896529515010094 and parameters: {'model_type': 'gcn', 'hidden_dims': '[256, 128]', 'dropout': 0.3399463131989843, 'batch_norm': False, 'lr': 7.30172276335706e-05, 'weight_decay': 1.1127504967183553e-07, 'epochs': 230, 'loss': 'mse', 'optimizer': 'adam', 'graph_mode': 'off', 'use_snp_selection': False}. Best is trial 16 with value: 0.07665877140891061.
[I 2025-11-03 12:31:04,972] Trial 105 finished with value: 0.013062842449566132 and parameters: {'model_type': 'gcn', 'hidden_dims': '[256, 128]', 'dropout': 0.3425599797191262, 'batch_norm': False, 'lr': 7.47939435094864e-05, 'weight_decay': 1.0553549600164577e-07, 'epochs': 223, 'loss': 'mse', 'optimizer': 'adam', 'graph_mode': 'off', 'use_snp_selection': False}. Best is trial 16 with value: 0.07665877140891061.
[I 2025-11-03 12:31:06,326] Trial 106 finished with value: 0.021887322155999974 and parameters: {'model_type': 'gcn', 'hidden_dims': '[256, 128]', 'dropout': 0.3785119362261572, 'batch_norm': True, 'lr': 6.777825643453932e-05, 'weight_decay': 2.634579263287996e-07, 'epochs': 228, 'loss': 'mse', 'optimizer': 'adam', 'graph_mode': 'off', 'use_snp_selection': False}. Best is trial 16 with value: 0.07665877140891061.
[I 2025-11-03 12:31:07,518] Trial 107 finished with value: 0.06351505430216872 and parameters: {'model_type': 'gcn', 'hidden_dims': '[256, 128]', 'dropout': 0.35765823498341015, 'batch_norm': True, 'lr': 4.949781828062962e-05, 'weight_decay': 1.9313372907823645e-07, 'epochs': 177, 'loss': 'mse', 'optimizer': 'adam', 'graph_mode': 'off', 'use_snp_selection': False}. Best is trial 16 with value: 0.07665877140891061.
[I 2025-11-03 12:31:08,638] Trial 108 finished with value: 0.022706252243310878 and parameters: {'model_type': 'gcn', 'hidden_dims': '[256, 128]', 'dropout': 0.4022095161557745, 'batch_norm': False, 'lr': 0.00011056908084168906, 'weight_decay': 1.3352974836295824e-07, 'epochs': 176, 'loss': 'mse', 'optimizer': 'adam', 'graph_mode': 'off', 'use_snp_selection': True, 'num_snps': 17464}. Best is trial 16 with value: 0.07665877140891061.
[I 2025-11-03 12:31:09,856] Trial 109 finished with value: -0.03117261392116099 and parameters: {'model_type': 'gcn', 'hidden_dims': '[256, 128]', 'dropout': 0.36126704659549286, 'batch_norm': True, 'lr': 2.699819747598006e-05, 'weight_decay': 1.953775851386079e-07, 'epochs': 193, 'loss': 'mse', 'optimizer': 'adam', 'graph_mode': 'off', 'use_snp_selection': False}. Best is trial 16 with value: 0.07665877140891061.
[I 2025-11-03 12:31:11,165] Trial 110 finished with value: 0.04735685893308079 and parameters: {'model_type': 'gcn', 'hidden_dims': '[256, 128]', 'dropout': 0.3532154904868801, 'batch_norm': True, 'lr': 4.47066851143193e-05, 'weight_decay': 1.1771869354737158e-07, 'epochs': 215, 'loss': 'mse', 'optimizer': 'adam', 'graph_mode': 'off', 'use_snp_selection': False}. Best is trial 16 with value: 0.07665877140891061.
[I 2025-11-03 12:31:12,237] Trial 111 finished with value: 0.0480204325979808 and parameters: {'model_type': 'gcn', 'hidden_dims': '[256, 128]', 'dropout': 0.33232254487021456, 'batch_norm': True, 'lr': 5.155516282385764e-05, 'weight_decay': 2.2467634925725178e-07, 'epochs': 152, 'loss': 'mse', 'optimizer': 'adam', 'graph_mode': 'off', 'use_snp_selection': False}. Best is trial 16 with value: 0.07665877140891061.
[I 2025-11-03 12:31:13,471] Trial 112 finished with value: 0.013079947616815066 and parameters: {'model_type': 'gcn', 'hidden_dims': '[256, 128]', 'dropout': 0.2941407806694712, 'batch_norm': True, 'lr': 9.063475982107901e-05, 'weight_decay': 1.7615136457516745e-07, 'epochs': 182, 'loss': 'mse', 'optimizer': 'adam', 'graph_mode': 'off', 'use_snp_selection': False}. Best is trial 16 with value: 0.07665877140891061.
[I 2025-11-03 12:31:14,882] Trial 113 finished with value: 0.042535750913438836 and parameters: {'model_type': 'gcn', 'hidden_dims': '[256, 128]', 'dropout': 0.30547157026114874, 'batch_norm': True, 'lr': 6.17557385320063e-05, 'weight_decay': 1.0293110462733473e-07, 'epochs': 249, 'loss': 'mse', 'optimizer': 'adam', 'graph_mode': 'off', 'use_snp_selection': False}. Best is trial 16 with value: 0.07665877140891061.
[I 2025-11-03 12:31:16,219] Trial 114 finished with value: 0.05827284433016803 and parameters: {'model_type': 'gcn', 'hidden_dims': '[256, 128]', 'dropout': 0.4770252977568261, 'batch_norm': True, 'lr': 0.00017833288146080323, 'weight_decay': 3.1331832166704453e-07, 'epochs': 231, 'loss': 'mse', 'optimizer': 'adam', 'graph_mode': 'off', 'use_snp_selection': False}. Best is trial 16 with value: 0.07665877140891061.
[I 2025-11-03 12:31:17,486] Trial 115 finished with value: 0.03688257639709724 and parameters: {'model_type': 'gcn', 'hidden_dims': '[256, 128]', 'dropout': 0.48031524814511084, 'batch_norm': True, 'lr': 0.0001906184265249242, 'weight_decay': 3.219338471027601e-07, 'epochs': 202, 'loss': 'mse', 'optimizer': 'adam', 'graph_mode': 'off', 'use_snp_selection': False}. Best is trial 16 with value: 0.07665877140891061.
[I 2025-11-03 12:31:18,779] Trial 116 finished with value: 0.009203494034910897 and parameters: {'model_type': 'gcn', 'hidden_dims': '[256, 128]', 'dropout': 0.4630009753403221, 'batch_norm': True, 'lr': 0.00017352609831554276, 'weight_decay': 1.378460958133813e-07, 'epochs': 217, 'loss': 'mse', 'optimizer': 'adam', 'graph_mode': 'off', 'use_snp_selection': False}. Best is trial 16 with value: 0.07665877140891061.
[I 2025-11-03 12:31:19,947] Trial 117 finished with value: 0.026575462561131562 and parameters: {'model_type': 'gcn', 'hidden_dims': '[256, 128]', 'dropout': 0.4222468016738541, 'batch_norm': True, 'lr': 0.0002914051101277319, 'weight_decay': 4.539523876761403e-07, 'epochs': 231, 'loss': 'mse', 'optimizer': 'adam', 'graph_mode': 'off', 'use_snp_selection': True, 'num_snps': 12048}. Best is trial 16 with value: 0.07665877140891061.
[I 2025-11-03 12:31:21,562] Trial 118 finished with value: 0.0072474542057740276 and parameters: {'model_type': 'gcn', 'hidden_dims': '[256, 128]', 'dropout': 0.499529150412238, 'batch_norm': False, 'lr': 0.00015817798675678646, 'weight_decay': 1.6091614232694365e-07, 'epochs': 350, 'loss': 'mse', 'optimizer': 'adam', 'graph_mode': 'off', 'use_snp_selection': False}. Best is trial 16 with value: 0.07665877140891061.
[I 2025-11-03 12:31:22,799] Trial 119 finished with value: 0.016889470755386896 and parameters: {'model_type': 'gcn', 'hidden_dims': '[256, 128]', 'dropout': 0.5214987412021543, 'batch_norm': True, 'lr': 0.0001178359553736332, 'weight_decay': 2.82264624306824e-07, 'epochs': 196, 'loss': 'mse', 'optimizer': 'adam', 'graph_mode': 'off', 'use_snp_selection': False}. Best is trial 16 with value: 0.07665877140891061.
[I 2025-11-03 12:31:24,129] Trial 120 finished with value: 0.03945326047460816 and parameters: {'model_type': 'gcn', 'hidden_dims': '[256, 128]', 'dropout': 0.34686313715817185, 'batch_norm': True, 'lr': 0.00022058512470335856, 'weight_decay': 2.103163438970723e-07, 'epochs': 224, 'loss': 'mse', 'optimizer': 'adam', 'graph_mode': 'off', 'use_snp_selection': False}. Best is trial 16 with value: 0.07665877140891061.
[I 2025-11-03 12:31:26,082] Trial 121 finished with value: 0.02080530335695751 and parameters: {'model_type': 'gcn', 'hidden_dims': '[512, 128]', 'dropout': 0.28423307223377553, 'batch_norm': True, 'lr': 7.48857468070368e-05, 'weight_decay': 1.277440921572071e-07, 'epochs': 257, 'loss': 'mse', 'optimizer': 'adam', 'graph_mode': 'off', 'use_snp_selection': False}. Best is trial 16 with value: 0.07665877140891061.
[I 2025-11-03 12:31:27,543] Trial 122 finished with value: -0.007464874141093909 and parameters: {'model_type': 'gcn', 'hidden_dims': '[256, 128]', 'dropout': 0.38246952952165797, 'batch_norm': True, 'lr': 1.0671611653525488e-06, 'weight_decay': 1.0165697573633643e-07, 'epochs': 242, 'loss': 'mse', 'optimizer': 'adam', 'graph_mode': 'off', 'use_snp_selection': False}. Best is trial 16 with value: 0.07665877140891061.
[I 2025-11-03 12:31:28,896] Trial 123 finished with value: 0.018114650216277603 and parameters: {'model_type': 'gcn', 'hidden_dims': '[256, 128]', 'dropout': 0.3379151629463586, 'batch_norm': True, 'lr': 3.616838122886209e-05, 'weight_decay': 1.5405180629953136e-07, 'epochs': 236, 'loss': 'mse', 'optimizer': 'adam', 'graph_mode': 'off', 'use_snp_selection': False}. Best is trial 16 with value: 0.07665877140891061.
[I 2025-11-03 12:31:30,878] Trial 124 finished with value: 0.03431226349777026 and parameters: {'model_type': 'gcn', 'hidden_dims': '[512, 64]', 'dropout': 0.3642826585691376, 'batch_norm': True, 'lr': 6.399770609663205e-05, 'weight_decay': 6.736927370845816e-07, 'epochs': 266, 'loss': 'mse', 'optimizer': 'adam', 'graph_mode': 'off', 'use_snp_selection': False}. Best is trial 16 with value: 0.07665877140891061.
[I 2025-11-03 12:31:32,316] Trial 125 finished with value: 0.04937939510957597 and parameters: {'model_type': 'gcn', 'hidden_dims': '[256, 128]', 'dropout': 0.48245456409910514, 'batch_norm': True, 'lr': 9.826207678932844e-05, 'weight_decay': 0.0003209211406512088, 'epochs': 252, 'loss': 'mse', 'optimizer': 'adam', 'graph_mode': 'off', 'use_snp_selection': False}. Best is trial 16 with value: 0.07665877140891061.
[I 2025-11-03 12:31:34,162] Trial 126 finished with value: 0.018489124713561768 and parameters: {'model_type': 'gcn', 'hidden_dims': '[256, 128]', 'dropout': 0.4785517011921446, 'batch_norm': False, 'lr': 0.00010469444978357577, 'weight_decay': 0.00035374404409754123, 'epochs': 230, 'loss': 'mse', 'optimizer': 'adam', 'graph_mode': 'off', 'use_snp_selection': True, 'num_snps': 42231}. Best is trial 16 with value: 0.07665877140891061.
[I 2025-11-03 12:31:35,546] Trial 127 finished with value: 0.012683568161285626 and parameters: {'model_type': 'gcn', 'hidden_dims': '[256, 128]', 'dropout': 0.45216939249255655, 'batch_norm': True, 'lr': 0.00013145360498669398, 'weight_decay': 1.840009927864452e-07, 'epochs': 251, 'loss': 'mse', 'optimizer': 'adam', 'graph_mode': 'off', 'use_snp_selection': False}. Best is trial 16 with value: 0.07665877140891061.
[I 2025-11-03 12:31:36,434] Trial 128 finished with value: 0.04382946187268098 and parameters: {'model_type': 'gcn', 'hidden_dims': '[256, 128]', 'dropout': 0.48816561016608406, 'batch_norm': True, 'lr': 9.159505736953601e-05, 'weight_decay': 0.0006134601138274465, 'epochs': 80, 'loss': 'mse', 'optimizer': 'adam', 'graph_mode': 'off', 'use_snp_selection': False}. Best is trial 16 with value: 0.07665877140891061.
[I 2025-11-03 12:31:37,883] Trial 129 finished with value: -0.010255896196820423 and parameters: {'model_type': 'gcn', 'hidden_dims': '[256, 128]', 'dropout': 0.46400642306395373, 'batch_norm': False, 'lr': 0.00015465030095433864, 'weight_decay': 0.0002191444669249218, 'epochs': 286, 'loss': 'mse', 'optimizer': 'adam', 'graph_mode': 'off', 'use_snp_selection': False}. Best is trial 16 with value: 0.07665877140891061.
[I 2025-11-03 12:31:39,567] Trial 130 finished with value: 0.054604515941301744 and parameters: {'model_type': 'gcn', 'hidden_dims': '[512, 128]', 'dropout': 0.31505636277225174, 'batch_norm': True, 'lr': 0.00025826097028973296, 'weight_decay': 0.0003107089627422462, 'epochs': 167, 'loss': 'mse', 'optimizer': 'adam', 'graph_mode': 'off', 'use_snp_selection': True, 'num_snps': 33157}. Best is trial 16 with value: 0.07665877140891061.
[I 2025-11-03 12:31:41,117] Trial 131 finished with value: 0.02716187337996369 and parameters: {'model_type': 'gcn', 'hidden_dims': '[512, 128]', 'dropout': 0.3232672478308624, 'batch_norm': True, 'lr': 0.0002123577424494982, 'weight_decay': 0.00034148593762578175, 'epochs': 165, 'loss': 'mse', 'optimizer': 'adam', 'graph_mode': 'off', 'use_snp_selection': True, 'num_snps': 29998}. Best is trial 16 with value: 0.07665877140891061.
[I 2025-11-03 12:31:42,819] Trial 132 finished with value: 0.040514459012006176 and parameters: {'model_type': 'gcn', 'hidden_dims': '[512, 128]', 'dropout': 0.30196048900970096, 'batch_norm': True, 'lr': 0.00018560054510932488, 'weight_decay': 0.00014622868498506775, 'epochs': 177, 'loss': 'mse', 'optimizer': 'adam', 'graph_mode': 'off', 'use_snp_selection': True, 'num_snps': 33711}. Best is trial 16 with value: 0.07665877140891061.
[I 2025-11-03 12:31:45,013] Trial 133 finished with value: 0.06475098579453605 and parameters: {'model_type': 'gcn', 'hidden_dims': '[512, 128]', 'dropout': 0.31798583321657026, 'batch_norm': True, 'lr': 0.0002419132538635738, 'weight_decay': 0.00029546957000509247, 'epochs': 139, 'loss': 'mse', 'optimizer': 'adam', 'graph_mode': 'off', 'use_snp_selection': True, 'num_snps': 57461}. Best is trial 16 with value: 0.07665877140891061.
[I 2025-11-03 12:31:47,331] Trial 134 finished with value: 0.029692517041642528 and parameters: {'model_type': 'gcn', 'hidden_dims': '[512, 128]', 'dropout': 0.3130699394331078, 'batch_norm': True, 'lr': 0.00026497149023115837, 'weight_decay': 0.0009724422467399566, 'epochs': 106, 'loss': 'mse', 'optimizer': 'adam', 'graph_mode': 'off', 'use_snp_selection': True, 'num_snps': 59673}. Best is trial 16 with value: 0.07665877140891061.
[I 2025-11-03 12:31:49,438] Trial 135 finished with value: 0.03123934116504543 and parameters: {'model_type': 'gcn', 'hidden_dims': '[512, 128]', 'dropout': 0.3332441435410151, 'batch_norm': True, 'lr': 0.0002744812295327242, 'weight_decay': 0.00028349144736252796, 'epochs': 120, 'loss': 'mse', 'optimizer': 'adam', 'graph_mode': 'off', 'use_snp_selection': True, 'num_snps': 53357}. Best is trial 16 with value: 0.07665877140891061.
[I 2025-11-03 12:31:51,904] Trial 136 finished with value: -0.053028000781388945 and parameters: {'model_type': 'gcn', 'hidden_dims': '[512, 128]', 'dropout': 0.5195340658590051, 'batch_norm': True, 'lr': 2.9722327774924517e-06, 'weight_decay': 0.0005024757251339476, 'epochs': 205, 'loss': 'mse', 'optimizer': 'adam', 'graph_mode': 'off', 'use_snp_selection': True, 'num_snps': 56646}. Best is trial 16 with value: 0.07665877140891061.
[I 2025-11-03 12:31:53,274] Trial 137 finished with value: 0.050585252842253764 and parameters: {'model_type': 'gcn', 'hidden_dims': '[512, 128]', 'dropout': 0.538857963661964, 'batch_norm': False, 'lr': 1.973097290648521e-06, 'weight_decay': 8.449402916740158e-07, 'epochs': 139, 'loss': 'mse', 'optimizer': 'adam', 'graph_mode': 'off', 'use_snp_selection': False}. Best is trial 16 with value: 0.07665877140891061.
[I 2025-11-03 12:31:54,649] Trial 138 finished with value: 0.04355043858718383 and parameters: {'model_type': 'gcn', 'hidden_dims': '[512, 128]', 'dropout': 0.552005090442741, 'batch_norm': True, 'lr': 0.0003509629953593357, 'weight_decay': 5.121767177165202e-07, 'epochs': 130, 'loss': 'mse', 'optimizer': 'adam', 'graph_mode': 'off', 'use_snp_selection': False}. Best is trial 16 with value: 0.07665877140891061.
[I 2025-11-03 12:31:56,014] Trial 139 finished with value: 0.031033989356001306 and parameters: {'model_type': 'gcn', 'hidden_dims': '[512, 128]', 'dropout': 0.5837190360064908, 'batch_norm': True, 'lr': 2.368129573092656e-06, 'weight_decay': 8.448326876478168e-07, 'epochs': 134, 'loss': 'mae', 'optimizer': 'adam', 'graph_mode': 'off', 'use_snp_selection': False}. Best is trial 16 with value: 0.07665877140891061.
[I 2025-11-03 12:31:57,824] Trial 140 finished with value: 0.051483808588859085 and parameters: {'model_type': 'gcn', 'hidden_dims': '[512, 128]', 'dropout': 0.561624048592079, 'batch_norm': False, 'lr': 1.7670771932838144e-06, 'weight_decay': 3.8212925138261265e-07, 'epochs': 145, 'loss': 'mse', 'optimizer': 'adam', 'graph_mode': 'off', 'use_snp_selection': True, 'num_snps': 43225}. Best is trial 16 with value: 0.07665877140891061.
[I 2025-11-03 12:31:59,732] Trial 141 finished with value: 0.018684105017863176 and parameters: {'model_type': 'gcn', 'hidden_dims': '[512, 128]', 'dropout': 0.5527587039256396, 'batch_norm': False, 'lr': 1.6350312011225314e-06, 'weight_decay': 1.4544784035608382e-06, 'epochs': 140, 'loss': 'mse', 'optimizer': 'adam', 'graph_mode': 'off', 'use_snp_selection': True, 'num_snps': 43941}. Best is trial 16 with value: 0.07665877140891061.
[I 2025-11-03 12:32:01,582] Trial 142 finished with value: -0.025531919751879666 and parameters: {'model_type': 'gcn', 'hidden_dims': '[512, 128]', 'dropout': 0.5355209633421018, 'batch_norm': False, 'lr': 1.7989819536586887e-06, 'weight_decay': 3.7917259696203913e-07, 'epochs': 147, 'loss': 'mse', 'optimizer': 'adam', 'graph_mode': 'off', 'use_snp_selection': True, 'num_snps': 41135}. Best is trial 16 with value: 0.07665877140891061.
[I 2025-11-03 12:32:03,489] Trial 143 finished with value: -0.010534072243129845 and parameters: {'model_type': 'gcn', 'hidden_dims': '[512, 128]', 'dropout': 0.5360244145806119, 'batch_norm': False, 'lr': 1.405604952511038e-06, 'weight_decay': 3.302221012820132e-07, 'epochs': 126, 'loss': 'mse', 'optimizer': 'adam', 'graph_mode': 'off', 'use_snp_selection': True, 'num_snps': 46946}. Best is trial 16 with value: 0.07665877140891061.
[I 2025-11-03 12:32:05,777] Trial 144 finished with value: -0.003881486085131563 and parameters: {'model_type': 'gcn', 'hidden_dims': '[512, 128]', 'dropout': 0.5764388654228302, 'batch_norm': False, 'lr': 1.2313024540863052e-06, 'weight_decay': 1.9818746041200972e-06, 'epochs': 143, 'loss': 'mse', 'optimizer': 'adam', 'graph_mode': 'off', 'use_snp_selection': True, 'num_snps': 55060}. Best is trial 16 with value: 0.07665877140891061.
[I 2025-11-03 12:32:07,887] Trial 145 finished with value: -0.031524638956670556 and parameters: {'model_type': 'gcn', 'hidden_dims': '[512, 128]', 'dropout': 0.5969830720431859, 'batch_norm': False, 'lr': 1.8144541636803604e-06, 'weight_decay': 9.0091785668458e-07, 'epochs': 160, 'loss': 'mse', 'optimizer': 'adam', 'graph_mode': 'off', 'use_snp_selection': True, 'num_snps': 51772}. Best is trial 16 with value: 0.07665877140891061.
[I 2025-11-03 12:32:09,328] Trial 146 finished with value: 0.018675335616774008 and parameters: {'model_type': 'gcn', 'hidden_dims': '[512, 128]', 'dropout': 0.5094446906789456, 'batch_norm': True, 'lr': 3.7549616417484927e-06, 'weight_decay': 2.508204533510098e-07, 'epochs': 155, 'loss': 'mse', 'optimizer': 'adam', 'graph_mode': 'off', 'use_snp_selection': False}. Best is trial 16 with value: 0.07665877140891061.
[I 2025-11-03 12:32:11,000] Trial 147 finished with value: 0.039602626606289645 and parameters: {'model_type': 'gcn', 'hidden_dims': '[512, 128]', 'dropout': 0.29887799813935045, 'batch_norm': False, 'lr': 0.00023948522820709393, 'weight_decay': 5.56714279456658e-07, 'epochs': 213, 'loss': 'mae', 'optimizer': 'adam', 'graph_mode': 'off', 'use_snp_selection': False}. Best is trial 16 with value: 0.07665877140891061.
[I 2025-11-03 12:32:12,680] Trial 148 finished with value: 0.03146482028937137 and parameters: {'model_type': 'gcn', 'hidden_dims': '[512, 256]', 'dropout': 0.3147951168209175, 'batch_norm': True, 'lr': 2.3436509593385457e-06, 'weight_decay': 3.4363116247471566e-06, 'epochs': 167, 'loss': 'mse', 'optimizer': 'adam', 'graph_mode': 'off', 'use_snp_selection': True, 'num_snps': 35073}. Best is trial 16 with value: 0.07665877140891061.
[I 2025-11-03 12:32:14,195] Trial 149 finished with value: -0.0199092429543411 and parameters: {'model_type': 'gcn', 'hidden_dims': '[512, 128]', 'dropout': 0.5576417687317368, 'batch_norm': False, 'lr': 0.00020081780674006283, 'weight_decay': 1.382104891575419e-07, 'epochs': 173, 'loss': 'mse', 'optimizer': 'adam', 'graph_mode': 'off', 'use_snp_selection': False}. Best is trial 16 with value: 0.07665877140891061.
[I 2025-11-03 12:32:16,327] Trial 0 finished with value: 0.0209650431234701 and parameters: {'model_type': 'gcn', 'hidden_dims': '[128, 64]', 'dropout': 0.199031432379812, 'batch_norm': True, 'lr': 1.8408544111075837e-06, 'weight_decay': 5.5136510071208614e-05, 'epochs': 336, 'loss': 'mae', 'optimizer': 'adam', 'graph_mode': 'off', 'use_snp_selection': True, 'num_snps': 43862}. Best is trial 0 with value: 0.0209650431234701.
[I 2025-11-03 12:32:17,883] Trial 1 finished with value: 0.0014228121080146622 and parameters: {'model_type': 'gcn', 'hidden_dims': '[256, 128]', 'dropout': 0.4370668075331726, 'batch_norm': True, 'lr': 7.133471581159139e-05, 'weight_decay': 1.128633586803549e-05, 'epochs': 242, 'loss': 'mae', 'optimizer': 'adam', 'graph_mode': 'off', 'use_snp_selection': False}. Best is trial 0 with value: 0.0209650431234701.
