[I 2025-11-03 12:57:08,658] Trial 122 finished with value: 0.11161409364155074 and parameters: {'model_type': 'gcn', 'hidden_dims': '[512, 128]', 'dropout': 0.2965908614009017, 'batch_norm': True, 'lr': 0.0005678349061605043, 'weight_decay': 2.7477559961068628e-05, 'epochs': 346, 'loss': 'mse', 'optimizer': 'adam', 'graph_mode': 'off', 'use_snp_selection': True, 'num_snps': 44904}. Best is trial 107 with value: 0.12997095560349564.
[I 2025-11-03 12:57:11,325] Trial 123 finished with value: 0.11723147687543041 and parameters: {'model_type': 'gcn', 'hidden_dims': '[512, 128]', 'dropout': 0.24569911220724325, 'batch_norm': True, 'lr': 0.0004745696637185816, 'weight_decay': 1.9745210713012077e-05, 'epochs': 302, 'loss': 'mse', 'optimizer': 'adam', 'graph_mode': 'off', 'use_snp_selection': True, 'num_snps': 38900}. Best is trial 107 with value: 0.12997095560349564.
[I 2025-11-03 12:57:14,182] Trial 124 finished with value: 0.11271220434035878 and parameters: {'model_type': 'gcn', 'hidden_dims': '[512, 128]', 'dropout': 0.26549929159627433, 'batch_norm': True, 'lr': 0.0006104870470893284, 'weight_decay': 8.68903716533376e-06, 'epochs': 310, 'loss': 'mse', 'optimizer': 'adam', 'graph_mode': 'off', 'use_snp_selection': True, 'num_snps': 41719}. Best is trial 107 with value: 0.12997095560349564.
[I 2025-11-03 12:57:17,309] Trial 125 finished with value: 0.11142074898947316 and parameters: {'model_type': 'gcn', 'hidden_dims': '[512, 128]', 'dropout': 0.2542622857207597, 'batch_norm': True, 'lr': 0.0007291794862102805, 'weight_decay': 1.1315021634652915e-05, 'epochs': 325, 'loss': 'mse', 'optimizer': 'adam', 'graph_mode': 'off', 'use_snp_selection': True, 'num_snps': 46273}. Best is trial 107 with value: 0.12997095560349564.
[I 2025-11-03 12:57:20,109] Trial 126 finished with value: 0.11410724151498888 and parameters: {'model_type': 'gcn', 'hidden_dims': '[512, 128]', 'dropout': 0.27540821943224164, 'batch_norm': True, 'lr': 0.0009853800126378095, 'weight_decay': 5.456546648937951e-06, 'epochs': 339, 'loss': 'mse', 'optimizer': 'adam', 'graph_mode': 'off', 'use_snp_selection': True, 'num_snps': 38566}. Best is trial 107 with value: 0.12997095560349564.
[I 2025-11-03 12:57:22,388] Trial 127 finished with value: 0.12044161458694716 and parameters: {'model_type': 'gcn', 'hidden_dims': '[512, 128]', 'dropout': 0.2412517611696725, 'batch_norm': True, 'lr': 0.0005139789866965694, 'weight_decay': 1.650302175276506e-05, 'epochs': 316, 'loss': 'mse', 'optimizer': 'adam', 'graph_mode': 'off', 'use_snp_selection': True, 'num_snps': 27547}. Best is trial 107 with value: 0.12997095560349564.
[I 2025-11-03 12:57:24,636] Trial 128 finished with value: 0.11380357042685045 and parameters: {'model_type': 'gcn', 'hidden_dims': '[512, 128]', 'dropout': 0.233545889714691, 'batch_norm': True, 'lr': 0.0005182375243570504, 'weight_decay': 5.0778642511654836e-05, 'epochs': 317, 'loss': 'mse', 'optimizer': 'adam', 'graph_mode': 'off', 'use_snp_selection': True, 'num_snps': 27772}. Best is trial 107 with value: 0.12997095560349564.
[I 2025-11-03 12:57:26,901] Trial 129 finished with value: 0.11397346816028768 and parameters: {'model_type': 'gcn', 'hidden_dims': '[512, 128]', 'dropout': 0.24127112526974492, 'batch_norm': True, 'lr': 0.00043900645855172397, 'weight_decay': 2.2740408108526024e-05, 'epochs': 350, 'loss': 'mse', 'optimizer': 'adam', 'graph_mode': 'off', 'use_snp_selection': True, 'num_snps': 25655}. Best is trial 107 with value: 0.12997095560349564.
[I 2025-11-03 12:57:28,526] Trial 130 finished with value: 0.10941430494439447 and parameters: {'model_type': 'gcn', 'hidden_dims': '[512, 128]', 'dropout': 0.22641744878477038, 'batch_norm': True, 'lr': 0.000524611515592385, 'weight_decay': 1.0100910750105445e-05, 'epochs': 331, 'loss': 'mse', 'optimizer': 'adam', 'graph_mode': 'off', 'use_snp_selection': True, 'num_snps': 12881}. Best is trial 107 with value: 0.12997095560349564.
[I 2025-11-03 12:57:30,985] Trial 131 finished with value: 0.11305260330714506 and parameters: {'model_type': 'gcn', 'hidden_dims': '[512, 128]', 'dropout': 0.26242402231376916, 'batch_norm': True, 'lr': 0.0006420542669375663, 'weight_decay': 1.4744949605800379e-05, 'epochs': 322, 'loss': 'mse', 'optimizer': 'adam', 'graph_mode': 'off', 'use_snp_selection': True, 'num_snps': 32508}. Best is trial 107 with value: 0.12997095560349564.
[I 2025-11-03 12:57:34,162] Trial 132 finished with value: 0.11130253785117677 and parameters: {'model_type': 'gcn', 'hidden_dims': '[512, 128]', 'dropout': 0.25289908404376854, 'batch_norm': True, 'lr': 0.0007921267083259942, 'weight_decay': 1.6258918733787275e-05, 'epochs': 335, 'loss': 'mse', 'optimizer': 'adam', 'graph_mode': 'off', 'use_snp_selection': True, 'num_snps': 45653}. Best is trial 107 with value: 0.12997095560349564.
[I 2025-11-03 12:57:37,142] Trial 133 finished with value: 0.11673147876587671 and parameters: {'model_type': 'gcn', 'hidden_dims': '[512, 128]', 'dropout': 0.21941418233423338, 'batch_norm': True, 'lr': 0.000682489024138199, 'weight_decay': 1.1915145870450725e-05, 'epochs': 344, 'loss': 'mse', 'optimizer': 'adam', 'graph_mode': 'off', 'use_snp_selection': True, 'num_snps': 41533}. Best is trial 107 with value: 0.12997095560349564.
[I 2025-11-03 12:57:40,049] Trial 134 finished with value: 0.11570097262287828 and parameters: {'model_type': 'gcn', 'hidden_dims': '[512, 128]', 'dropout': 0.28539937133436405, 'batch_norm': True, 'lr': 0.00041236424479154025, 'weight_decay': 2.83288514158894e-05, 'epochs': 315, 'loss': 'mse', 'optimizer': 'adam', 'graph_mode': 'off', 'use_snp_selection': True, 'num_snps': 42697}. Best is trial 107 with value: 0.12997095560349564.
[I 2025-11-03 12:57:42,791] Trial 135 finished with value: 0.1108818490620978 and parameters: {'model_type': 'gcn', 'hidden_dims': '[512, 128]', 'dropout': 0.2702058672320066, 'batch_norm': True, 'lr': 0.0008550537789789922, 'weight_decay': 2.101893025706617e-05, 'epochs': 326, 'loss': 'mse', 'optimizer': 'adam', 'graph_mode': 'off', 'use_snp_selection': True, 'num_snps': 37466}. Best is trial 107 with value: 0.12997095560349564.
[I 2025-11-03 12:57:45,119] Trial 136 finished with value: 0.11052160870437287 and parameters: {'model_type': 'gcn', 'hidden_dims': '[512, 128]', 'dropout': 0.23503788223428138, 'batch_norm': True, 'lr': 0.0005026290108429194, 'weight_decay': 2.8054087279242466e-06, 'epochs': 305, 'loss': 'mse', 'optimizer': 'adam', 'graph_mode': 'off', 'use_snp_selection': True, 'num_snps': 30066}. Best is trial 107 with value: 0.12997095560349564.
[I 2025-11-03 12:57:47,313] Trial 137 finished with value: 0.09961399980555706 and parameters: {'model_type': 'gcn', 'hidden_dims': '[128, 64]', 'dropout': 0.31682095058656007, 'batch_norm': True, 'lr': 0.0005953865249163931, 'weight_decay': 3.801633809390082e-05, 'epochs': 340, 'loss': 'mse', 'optimizer': 'adam', 'graph_mode': 'off', 'use_snp_selection': True, 'num_snps': 46461}. Best is trial 107 with value: 0.12997095560349564.
[I 2025-11-03 12:57:49,872] Trial 138 finished with value: 0.11602003836751626 and parameters: {'model_type': 'gcn', 'hidden_dims': '[512, 128]', 'dropout': 0.24262717041937984, 'batch_norm': True, 'lr': 0.0007566284170889679, 'weight_decay': 8.179904711264283e-06, 'epochs': 330, 'loss': 'mse', 'optimizer': 'adam', 'graph_mode': 'off', 'use_snp_selection': True, 'num_snps': 34566}. Best is trial 107 with value: 0.12997095560349564.
[I 2025-11-03 12:57:52,421] Trial 139 finished with value: 0.10999037614590823 and parameters: {'model_type': 'gcn', 'hidden_dims': '[256, 128, 64]', 'dropout': 0.25703478122017315, 'batch_norm': True, 'lr': 0.00031637516417938377, 'weight_decay': 6.894114117398819e-06, 'epochs': 299, 'loss': 'mse', 'optimizer': 'adam', 'graph_mode': 'off', 'use_snp_selection': True, 'num_snps': 40876}. Best is trial 107 with value: 0.12997095560349564.
[I 2025-11-03 12:57:54,384] Trial 140 finished with value: 0.08115201386506829 and parameters: {'model_type': 'gcn', 'hidden_dims': '[512, 128]', 'dropout': 0.2956199049452079, 'batch_norm': False, 'lr': 0.0003862877730162955, 'weight_decay': 0.0005972847980881727, 'epochs': 308, 'loss': 'mse', 'optimizer': 'adam', 'graph_mode': 'off', 'use_snp_selection': True, 'num_snps': 23800}. Best is trial 107 with value: 0.12997095560349564.
[I 2025-11-03 12:57:57,674] Trial 141 finished with value: 0.11068281360637276 and parameters: {'model_type': 'gcn', 'hidden_dims': '[512, 128]', 'dropout': 0.22310840501549203, 'batch_norm': True, 'lr': 0.0008434740364046229, 'weight_decay': 1.4298181112232578e-05, 'epochs': 336, 'loss': 'mse', 'optimizer': 'adam', 'graph_mode': 'off', 'use_snp_selection': True, 'num_snps': 50513}. Best is trial 107 with value: 0.12997095560349564.
[I 2025-11-03 12:58:01,262] Trial 142 finished with value: 0.1217303777014621 and parameters: {'model_type': 'gcn', 'hidden_dims': '[512, 128]', 'dropout': 0.2079894846983925, 'batch_norm': True, 'lr': 0.0006449638381902472, 'weight_decay': 1.1906644246800536e-05, 'epochs': 345, 'loss': 'mse', 'optimizer': 'adam', 'graph_mode': 'off', 'use_snp_selection': True, 'num_snps': 55100}. Best is trial 107 with value: 0.12997095560349564.
[I 2025-11-03 12:58:04,356] Trial 143 finished with value: 0.11641691693102257 and parameters: {'model_type': 'gcn', 'hidden_dims': '[512, 128]', 'dropout': 0.1866324940210902, 'batch_norm': True, 'lr': 0.0006501387398739177, 'weight_decay': 1.6449095359990454e-05, 'epochs': 345, 'loss': 'mse', 'optimizer': 'adam', 'graph_mode': 'off', 'use_snp_selection': True, 'num_snps': 44465}. Best is trial 107 with value: 0.12997095560349564.
[I 2025-11-03 12:58:07,912] Trial 144 finished with value: 0.11356405648925892 and parameters: {'model_type': 'gcn', 'hidden_dims': '[512, 256]', 'dropout': 0.20692084553479256, 'batch_norm': True, 'lr': 0.0004878017253000778, 'weight_decay': 9.742669974010698e-06, 'epochs': 350, 'loss': 'mse', 'optimizer': 'adam', 'graph_mode': 'off', 'use_snp_selection': True, 'num_snps': 54465}. Best is trial 107 with value: 0.12997095560349564.
[I 2025-11-03 12:58:11,116] Trial 145 finished with value: 0.12076265434480356 and parameters: {'model_type': 'gcn', 'hidden_dims': '[512, 128]', 'dropout': 0.24790460478185006, 'batch_norm': True, 'lr': 0.0005778074883683206, 'weight_decay': 1.979834606042023e-05, 'epochs': 258, 'loss': 'mse', 'optimizer': 'adam', 'graph_mode': 'off', 'use_snp_selection': True, 'num_snps': 56804}. Best is trial 107 with value: 0.12997095560349564.
[I 2025-11-03 12:58:14,194] Trial 146 finished with value: 0.11010986747249168 and parameters: {'model_type': 'gcn', 'hidden_dims': '[512, 128]', 'dropout': 0.21595643283994892, 'batch_norm': True, 'lr': 0.0005422927224477601, 'weight_decay': 2.7131842148645102e-05, 'epochs': 249, 'loss': 'mse', 'optimizer': 'adam', 'graph_mode': 'off', 'use_snp_selection': True, 'num_snps': 57255}. Best is trial 107 with value: 0.12997095560349564.
[I 2025-11-03 12:58:17,356] Trial 147 finished with value: 0.11611688118069868 and parameters: {'model_type': 'gcn', 'hidden_dims': '[512, 128]', 'dropout': 0.24063437319135167, 'batch_norm': True, 'lr': 0.0009772390791862276, 'weight_decay': 5.995304783814109e-05, 'epochs': 259, 'loss': 'mse', 'optimizer': 'adam', 'graph_mode': 'off', 'use_snp_selection': True, 'num_snps': 57852}. Best is trial 107 with value: 0.12997095560349564.
[I 2025-11-03 12:58:20,556] Trial 148 finished with value: 0.11406373337216628 and parameters: {'model_type': 'gcn', 'hidden_dims': '[512, 256]', 'dropout': 0.20570288856048985, 'batch_norm': True, 'lr': 0.0004281802109622441, 'weight_decay': 6.118285426184844e-06, 'epochs': 272, 'loss': 'mse', 'optimizer': 'adam', 'graph_mode': 'off', 'use_snp_selection': True, 'num_snps': 56587}. Best is trial 107 with value: 0.12997095560349564.
[I 2025-11-03 12:58:23,461] Trial 149 finished with value: 0.10236569187238571 and parameters: {'model_type': 'gcn', 'hidden_dims': '[512, 128]', 'dropout': 0.27484683833859597, 'batch_norm': True, 'lr': 0.0003637394738429768, 'weight_decay': 1.95233032481995e-05, 'epochs': 255, 'loss': 'mse', 'optimizer': 'adam', 'graph_mode': 'off', 'use_snp_selection': True, 'num_snps': 47898}. Best is trial 107 with value: 0.12997095560349564.
[I 2025-11-03 12:58:25,498] Trial 0 finished with value: -0.0068550589828297055 and parameters: {'model_type': 'gcn', 'hidden_dims': '[128, 64]', 'dropout': 0.199031432379812, 'batch_norm': True, 'lr': 1.8408544111075837e-06, 'weight_decay': 5.5136510071208614e-05, 'epochs': 336, 'loss': 'mae', 'optimizer': 'adam', 'graph_mode': 'off', 'use_snp_selection': True, 'num_snps': 43862}. Best is trial 0 with value: -0.0068550589828297055.
[I 2025-11-03 12:58:26,999] Trial 1 finished with value: -0.022327356572814202 and parameters: {'model_type': 'gcn', 'hidden_dims': '[256, 128]', 'dropout': 0.4370668075331726, 'batch_norm': True, 'lr': 7.133471581159139e-05, 'weight_decay': 1.128633586803549e-05, 'epochs': 242, 'loss': 'mae', 'optimizer': 'adam', 'graph_mode': 'off', 'use_snp_selection': False}. Best is trial 0 with value: -0.0068550589828297055.
[I 2025-11-03 12:58:28,098] Trial 2 finished with value: -0.009155871303210019 and parameters: {'model_type': 'gcn', 'hidden_dims': '[256, 128, 64]', 'dropout': 0.41314357415569625, 'batch_norm': False, 'lr': 3.952233718592101e-06, 'weight_decay': 0.00026754769258252603, 'epochs': 149, 'loss': 'mse', 'optimizer': 'adam', 'graph_mode': 'off', 'use_snp_selection': True, 'num_snps': 11571}. Best is trial 0 with value: -0.0068550589828297055.
[I 2025-11-03 12:58:30,657] Trial 3 finished with value: 0.010151161228801588 and parameters: {'model_type': 'gcn', 'hidden_dims': '[512, 64]', 'dropout': 0.5938127374509361, 'batch_norm': False, 'lr': 5.67704586114731e-06, 'weight_decay': 2.4518087630137052e-05, 'epochs': 320, 'loss': 'mae', 'optimizer': 'adam', 'graph_mode': 'off', 'use_snp_selection': False}. Best is trial 3 with value: 0.010151161228801588.
[I 2025-11-03 12:58:32,966] Trial 4 finished with value: -0.04125540901081577 and parameters: {'model_type': 'gcn', 'hidden_dims': '[512, 128]', 'dropout': 0.25746343592134413, 'batch_norm': True, 'lr': 1.3467657668402788e-06, 'weight_decay': 0.00033087251918647806, 'epochs': 277, 'loss': 'mse', 'optimizer': 'adam', 'graph_mode': 'off', 'use_snp_selection': True, 'num_snps': 36675}. Best is trial 3 with value: 0.010151161228801588.
[I 2025-11-03 12:58:34,632] Trial 5 finished with value: -0.006882993947619532 and parameters: {'model_type': 'gcn', 'hidden_dims': '[512, 64]', 'dropout': 0.38275350994408375, 'batch_norm': True, 'lr': 1.5586664309232824e-06, 'weight_decay': 0.0008227664668621182, 'epochs': 145, 'loss': 'mae', 'optimizer': 'adam', 'graph_mode': 'off', 'use_snp_selection': True, 'num_snps': 32148}. Best is trial 3 with value: 0.010151161228801588.
[I 2025-11-03 12:58:35,913] Trial 6 finished with value: -0.01697986487817536 and parameters: {'model_type': 'gcn', 'hidden_dims': '[256, 128]', 'dropout': 0.3930109900265879, 'batch_norm': False, 'lr': 4.892964372128395e-05, 'weight_decay': 1.5809549317992182e-06, 'epochs': 199, 'loss': 'mse', 'optimizer': 'adam', 'graph_mode': 'off', 'use_snp_selection': False}. Best is trial 3 with value: 0.010151161228801588.
[I 2025-11-03 12:58:37,211] Trial 7 finished with value: -0.006874578715718671 and parameters: {'model_type': 'gcn', 'hidden_dims': '[512, 256]', 'dropout': 0.15343979219678458, 'batch_norm': True, 'lr': 6.234003099047341e-05, 'weight_decay': 3.894760610535477e-07, 'epochs': 97, 'loss': 'mse', 'optimizer': 'adam', 'graph_mode': 'off', 'use_snp_selection': False}. Best is trial 3 with value: 0.010151161228801588.
[I 2025-11-03 12:58:39,788] Trial 8 finished with value: -0.0053635634406593025 and parameters: {'model_type': 'gcn', 'hidden_dims': '[512, 128]', 'dropout': 0.10743001231661406, 'batch_norm': True, 'lr': 0.00023728538449271062, 'weight_decay': 1.7629071578048637e-05, 'epochs': 312, 'loss': 'mae', 'optimizer': 'adam', 'graph_mode': 'off', 'use_snp_selection': False}. Best is trial 3 with value: 0.010151161228801588.
[I 2025-11-03 12:58:41,561] Trial 9 finished with value: -0.020059625196452897 and parameters: {'model_type': 'gcn', 'hidden_dims': '[512, 64]', 'dropout': 0.14505336736221927, 'batch_norm': True, 'lr': 5.8619638388111826e-05, 'weight_decay': 6.200156172669308e-07, 'epochs': 175, 'loss': 'mse', 'optimizer': 'adam', 'graph_mode': 'off', 'use_snp_selection': False}. Best is trial 3 with value: 0.010151161228801588.
[I 2025-11-03 12:58:42,601] Trial 10 finished with value: 0.022230825310179184 and parameters: {'model_type': 'gcn', 'hidden_dims': '[512, 64]', 'dropout': 0.5885461262002587, 'batch_norm': False, 'lr': 8.769366258768696e-06, 'weight_decay': 2.78273193871783e-06, 'epochs': 55, 'loss': 'mae', 'optimizer': 'adam', 'graph_mode': 'off', 'use_snp_selection': False}. Best is trial 10 with value: 0.022230825310179184.
[I 2025-11-03 12:58:43,748] Trial 11 finished with value: 0.04191243511097222 and parameters: {'model_type': 'gcn', 'hidden_dims': '[512, 64]', 'dropout': 0.583942291816117, 'batch_norm': False, 'lr': 1.182133596898616e-05, 'weight_decay': 4.061640528568547e-06, 'epochs': 77, 'loss': 'mae', 'optimizer': 'adam', 'graph_mode': 'off', 'use_snp_selection': False}. Best is trial 11 with value: 0.04191243511097222.
[I 2025-11-03 12:58:44,756] Trial 12 finished with value: 0.004574739466071804 and parameters: {'model_type': 'gcn', 'hidden_dims': '[512, 64]', 'dropout': 0.5928626416900284, 'batch_norm': False, 'lr': 1.223742348275826e-05, 'weight_decay': 1.8994153527272502e-06, 'epochs': 40, 'loss': 'mae', 'optimizer': 'adam', 'graph_mode': 'off', 'use_snp_selection': False}. Best is trial 11 with value: 0.04191243511097222.
[I 2025-11-03 12:58:45,796] Trial 13 finished with value: -0.002483771059047355 and parameters: {'model_type': 'gcn', 'hidden_dims': '[512, 64]', 'dropout': 0.5021680908774464, 'batch_norm': False, 'lr': 1.5004807436150271e-05, 'weight_decay': 1.3191035460883088e-07, 'epochs': 47, 'loss': 'mae', 'optimizer': 'adam', 'graph_mode': 'off', 'use_snp_selection': False}. Best is trial 11 with value: 0.04191243511097222.
[I 2025-11-03 12:58:46,542] Trial 14 finished with value: -0.016949269358708968 and parameters: {'model_type': 'gcn', 'hidden_dims': '[128, 64]', 'dropout': 0.5300180653494536, 'batch_norm': False, 'lr': 1.835780703793688e-05, 'weight_decay': 4.57067734295802e-06, 'epochs': 93, 'loss': 'mae', 'optimizer': 'adam', 'graph_mode': 'off', 'use_snp_selection': False}. Best is trial 11 with value: 0.04191243511097222.
[I 2025-11-03 12:58:47,799] Trial 15 finished with value: 0.014369631527877399 and parameters: {'model_type': 'gcn', 'hidden_dims': '[512, 256]', 'dropout': 0.2944131867549115, 'batch_norm': False, 'lr': 5.886637310193521e-06, 'weight_decay': 3.2513109021255193e-06, 'epochs': 96, 'loss': 'mae', 'optimizer': 'adam', 'graph_mode': 'off', 'use_snp_selection': False}. Best is trial 11 with value: 0.04191243511097222.
[I 2025-11-03 12:58:48,654] Trial 16 finished with value: 0.050243356640524144 and parameters: {'model_type': 'gcn', 'hidden_dims': '[256, 128, 64]', 'dropout': 0.4992385332513618, 'batch_norm': False, 'lr': 0.00021783781789519438, 'weight_decay': 7.640682939794461e-05, 'epochs': 67, 'loss': 'mae', 'optimizer': 'adam', 'graph_mode': 'off', 'use_snp_selection': False}. Best is trial 16 with value: 0.050243356640524144.
[I 2025-11-03 12:58:49,799] Trial 17 finished with value: -0.043012030460588546 and parameters: {'model_type': 'gcn', 'hidden_dims': '[256, 128, 64]', 'dropout': 0.49329768653247374, 'batch_norm': False, 'lr': 0.000906375209920231, 'weight_decay': 8.964784953631543e-05, 'epochs': 125, 'loss': 'mae', 'optimizer': 'adam', 'graph_mode': 'off', 'use_snp_selection': False}. Best is trial 16 with value: 0.050243356640524144.
[I 2025-11-03 12:58:52,232] Trial 18 finished with value: 0.02714588549850421 and parameters: {'model_type': 'gcn', 'hidden_dims': '[256, 128, 64]', 'dropout': 0.536866299480327, 'batch_norm': False, 'lr': 0.00016696190593713548, 'weight_decay': 6.253754839593564e-05, 'epochs': 216, 'loss': 'mae', 'optimizer': 'adam', 'graph_mode': 'off', 'use_snp_selection': True, 'num_snps': 58241}. Best is trial 16 with value: 0.050243356640524144.
[I 2025-11-03 12:58:53,197] Trial 19 finished with value: 0.04004152209440652 and parameters: {'model_type': 'gcn', 'hidden_dims': '[256, 128, 64]', 'dropout': 0.4741569600825432, 'batch_norm': False, 'lr': 0.00032432556496156254, 'weight_decay': 7.564255826747432e-06, 'epochs': 89, 'loss': 'mae', 'optimizer': 'adam', 'graph_mode': 'off', 'use_snp_selection': False}. Best is trial 16 with value: 0.050243356640524144.
[I 2025-11-03 12:58:54,073] Trial 20 finished with value: -0.029760300948495133 and parameters: {'model_type': 'gcn', 'hidden_dims': '[256, 128, 64]', 'dropout': 0.34113489482322534, 'batch_norm': False, 'lr': 2.659875630023703e-05, 'weight_decay': 0.00014215759756795764, 'epochs': 68, 'loss': 'mae', 'optimizer': 'adam', 'graph_mode': 'off', 'use_snp_selection': False}. Best is trial 16 with value: 0.050243356640524144.
[I 2025-11-03 12:58:55,199] Trial 21 finished with value: -0.03890867718532162 and parameters: {'model_type': 'gcn', 'hidden_dims': '[256, 128, 64]', 'dropout': 0.47526599481487986, 'batch_norm': False, 'lr': 0.0004967588547375821, 'weight_decay': 7.425359478373045e-06, 'epochs': 119, 'loss': 'mae', 'optimizer': 'adam', 'graph_mode': 'off', 'use_snp_selection': False}. Best is trial 16 with value: 0.050243356640524144.
[I 2025-11-03 12:58:56,131] Trial 22 finished with value: -0.007432498385332121 and parameters: {'model_type': 'gcn', 'hidden_dims': '[256, 128, 64]', 'dropout': 0.4515142215298965, 'batch_norm': False, 'lr': 0.00020034107988939302, 'weight_decay': 2.912180955890318e-05, 'epochs': 79, 'loss': 'mae', 'optimizer': 'adam', 'graph_mode': 'off', 'use_snp_selection': False}. Best is trial 16 with value: 0.050243356640524144.
