[I 2025-11-03 11:46:43,733] Trial 43 finished with value: 0.10194393050060707 and parameters: {'model_type': 'graphsage', 'hidden_dims': '[512, 128]', 'dropout': 0.354756084411345, 'batch_norm': True, 'lr': 0.00019618541493993832, 'weight_decay': 0.0005715798222262011, 'epochs': 185, 'loss': 'mae', 'optimizer': 'adam', 'graph_mode': 'knn', 'source': 'grm', 'knn_k': 1, 'weighted_edges': True, 'symmetrize_mode': 'mutual', 'use_snp_selection': False}. Best is trial 6 with value: 0.1230570001346002.
[I 2025-11-03 11:46:45,488] Trial 44 finished with value: 0.10275508139038116 and parameters: {'model_type': 'graphsage', 'hidden_dims': '[128, 64]', 'dropout': 0.4563910330026355, 'batch_norm': True, 'lr': 0.0003731563621926559, 'weight_decay': 0.00010829856371653236, 'epochs': 150, 'loss': 'mae', 'optimizer': 'adam', 'graph_mode': 'knn', 'source': 'grm', 'knn_k': 2, 'weighted_edges': False, 'symmetrize_mode': 'mutual', 'use_snp_selection': False}. Best is trial 6 with value: 0.1230570001346002.
[I 2025-11-03 11:46:49,349] Trial 45 finished with value: 0.10379574793687844 and parameters: {'model_type': 'graphsage', 'hidden_dims': '[512, 128]', 'dropout': 0.494339489960013, 'batch_norm': True, 'lr': 0.0006278556628188445, 'weight_decay': 3.0124570808102592e-05, 'epochs': 259, 'loss': 'mae', 'optimizer': 'adam', 'graph_mode': 'knn', 'source': 'grm', 'knn_k': 7, 'weighted_edges': True, 'symmetrize_mode': 'mutual', 'use_snp_selection': False}. Best is trial 6 with value: 0.1230570001346002.
[I 2025-11-03 11:46:51,661] Trial 46 finished with value: 0.11762182952636284 and parameters: {'model_type': 'graphsage', 'hidden_dims': '[256, 128]', 'dropout': 0.3817380475943138, 'batch_norm': True, 'lr': 0.0003122109494826367, 'weight_decay': 0.00013672952338682784, 'epochs': 232, 'loss': 'mse', 'optimizer': 'adam', 'graph_mode': 'knn', 'source': 'grm', 'knn_k': 1, 'weighted_edges': True, 'symmetrize_mode': 'mutual', 'use_snp_selection': False}. Best is trial 6 with value: 0.1230570001346002.
[I 2025-11-03 11:46:55,018] Trial 47 finished with value: 0.05603464120323983 and parameters: {'model_type': 'graphsage', 'hidden_dims': '[256, 128]', 'dropout': 0.22240275062463363, 'batch_norm': False, 'lr': 0.00015093561477065283, 'weight_decay': 0.00016915571698008472, 'epochs': 265, 'loss': 'mse', 'optimizer': 'adam', 'graph_mode': 'knn', 'source': 'grm', 'knn_k': 1, 'weighted_edges': True, 'symmetrize_mode': 'mutual', 'use_snp_selection': True, 'num_snps': 43485}. Best is trial 6 with value: 0.1230570001346002.
[I 2025-11-03 11:46:56,695] Trial 48 finished with value: 0.0355569331463271 and parameters: {'model_type': 'graphsage', 'hidden_dims': '[256, 128]', 'dropout': 0.5477185780680484, 'batch_norm': True, 'lr': 2.9081478770172682e-05, 'weight_decay': 6.629007666426701e-05, 'epochs': 41, 'loss': 'mse', 'optimizer': 'adam', 'graph_mode': 'knn', 'source': 'grm', 'knn_k': 3, 'weighted_edges': False, 'symmetrize_mode': 'mutual', 'use_snp_selection': False}. Best is trial 6 with value: 0.1230570001346002.
[I 2025-11-03 11:46:58,955] Trial 49 finished with value: 0.11687852868157621 and parameters: {'model_type': 'graphsage', 'hidden_dims': '[256, 128]', 'dropout': 0.42518771539515715, 'batch_norm': True, 'lr': 0.00034713283498030224, 'weight_decay': 1.5915958563651707e-06, 'epochs': 229, 'loss': 'mse', 'optimizer': 'adam', 'graph_mode': 'cutoff', 'cutoff': 0.5358834616354312, 'grm_norm': 'gcn', 'self_loops': False, 'use_snp_selection': False}. Best is trial 6 with value: 0.1230570001346002.
[I 2025-11-03 11:47:01,229] Trial 50 finished with value: 0.1139084519399911 and parameters: {'model_type': 'graphsage', 'hidden_dims': '[256, 128]', 'dropout': 0.44125069667839634, 'batch_norm': True, 'lr': 0.0003121021928009719, 'weight_decay': 5.17725757058995e-07, 'epochs': 226, 'loss': 'mse', 'optimizer': 'adam', 'graph_mode': 'cutoff', 'cutoff': 0.48334356870601536, 'grm_norm': 'gcn', 'self_loops': False, 'use_snp_selection': False}. Best is trial 6 with value: 0.1230570001346002.
[I 2025-11-03 11:47:03,534] Trial 51 finished with value: 0.11589920959086533 and parameters: {'model_type': 'graphsage', 'hidden_dims': '[256, 128]', 'dropout': 0.3634929123417954, 'batch_norm': True, 'lr': 9.942385740740309e-05, 'weight_decay': 7.215175066957608e-07, 'epochs': 238, 'loss': 'mse', 'optimizer': 'adam', 'graph_mode': 'cutoff', 'cutoff': 0.6065596877241899, 'grm_norm': 'gcn', 'self_loops': False, 'use_snp_selection': False}. Best is trial 6 with value: 0.1230570001346002.
[I 2025-11-03 11:47:06,016] Trial 52 finished with value: 0.09918312235192828 and parameters: {'model_type': 'graphsage', 'hidden_dims': '[256, 128]', 'dropout': 0.32070222606169707, 'batch_norm': True, 'lr': 0.00010598496482144422, 'weight_decay': 1.2676673579834068e-06, 'epochs': 293, 'loss': 'mse', 'optimizer': 'adam', 'graph_mode': 'cutoff', 'cutoff': 0.6210041973992857, 'grm_norm': 'gcn', 'self_loops': False, 'use_snp_selection': False}. Best is trial 6 with value: 0.1230570001346002.
[I 2025-11-03 11:47:08,305] Trial 53 finished with value: 0.10672674662696524 and parameters: {'model_type': 'graphsage', 'hidden_dims': '[256, 128]', 'dropout': 0.35415243822920295, 'batch_norm': True, 'lr': 0.00029290235124232206, 'weight_decay': 4.35711437418108e-07, 'epochs': 238, 'loss': 'mse', 'optimizer': 'adam', 'graph_mode': 'cutoff', 'cutoff': 0.7433011839635606, 'grm_norm': 'gcn', 'self_loops': False, 'use_snp_selection': False}. Best is trial 6 with value: 0.1230570001346002.
[I 2025-11-03 11:47:10,728] Trial 54 finished with value: 0.1087550373461586 and parameters: {'model_type': 'graphsage', 'hidden_dims': '[256, 128]', 'dropout': 0.2881606882591095, 'batch_norm': True, 'lr': 8.560365523274926e-05, 'weight_decay': 2.7599269960394583e-06, 'epochs': 268, 'loss': 'mse', 'optimizer': 'adam', 'graph_mode': 'cutoff', 'cutoff': 0.49526035708231697, 'grm_norm': 'gcn', 'self_loops': False, 'use_snp_selection': False}. Best is trial 6 with value: 0.1230570001346002.
[I 2025-11-03 11:47:13,362] Trial 55 finished with value: 0.09740507792720934 and parameters: {'model_type': 'graphsage', 'hidden_dims': '[256, 128]', 'dropout': 0.3628938378805099, 'batch_norm': True, 'lr': 0.00014366812267899498, 'weight_decay': 3.5115807364992004e-07, 'epochs': 317, 'loss': 'mse', 'optimizer': 'adam', 'graph_mode': 'cutoff', 'cutoff': 0.4109988655949532, 'grm_norm': 'gcn', 'self_loops': False, 'use_snp_selection': False}. Best is trial 6 with value: 0.1230570001346002.
[I 2025-11-03 11:47:17,018] Trial 56 finished with value: 0.09575467482225512 and parameters: {'model_type': 'graphsage', 'hidden_dims': '[512, 64]', 'dropout': 0.42932507299084066, 'batch_norm': True, 'lr': 0.00020025311136304575, 'weight_decay': 1.6727534539553997e-06, 'epochs': 253, 'loss': 'mse', 'optimizer': 'adam', 'graph_mode': 'cutoff', 'cutoff': 0.5507551724556363, 'grm_norm': 'gcn', 'self_loops': False, 'use_snp_selection': False}. Best is trial 6 with value: 0.1230570001346002.
[I 2025-11-03 11:47:19,157] Trial 57 finished with value: 0.12060402632060324 and parameters: {'model_type': 'graphsage', 'hidden_dims': '[256, 128]', 'dropout': 0.3396750240239258, 'batch_norm': True, 'lr': 0.00038378310268360344, 'weight_decay': 8.185288802135918e-07, 'epochs': 199, 'loss': 'mse', 'optimizer': 'adam', 'graph_mode': 'cutoff', 'cutoff': 0.6423031739301004, 'grm_norm': 'none', 'self_loops': False, 'use_snp_selection': False}. Best is trial 6 with value: 0.1230570001346002.
[I 2025-11-03 11:47:22,453] Trial 58 finished with value: 0.12499328695603992 and parameters: {'model_type': 'graphsage', 'hidden_dims': '[512, 256]', 'dropout': 0.33696379457829084, 'batch_norm': True, 'lr': 0.0003584222180737511, 'weight_decay': 1.1517410397619716e-06, 'epochs': 197, 'loss': 'mse', 'optimizer': 'adam', 'graph_mode': 'cutoff', 'cutoff': 0.7823089834551059, 'grm_norm': 'none', 'self_loops': False, 'use_snp_selection': False}. Best is trial 58 with value: 0.12499328695603992.
[I 2025-11-03 11:47:25,926] Trial 59 finished with value: 0.10949316119590932 and parameters: {'model_type': 'graphsage', 'hidden_dims': '[512, 256]', 'dropout': 0.3374491773526427, 'batch_norm': True, 'lr': 0.00025934910413316186, 'weight_decay': 2.489070911384057e-07, 'epochs': 226, 'loss': 'mse', 'optimizer': 'adam', 'graph_mode': 'cutoff', 'cutoff': 0.7700552852001012, 'grm_norm': 'none', 'self_loops': False, 'use_snp_selection': False}. Best is trial 58 with value: 0.12499328695603992.
[I 2025-11-03 11:47:28,285] Trial 60 finished with value: 0.05927427519103934 and parameters: {'model_type': 'graphsage', 'hidden_dims': '[512, 256]', 'dropout': 0.410074611314147, 'batch_norm': False, 'lr': 0.00034681811397011924, 'weight_decay': 1.05497113803384e-06, 'epochs': 201, 'loss': 'mse', 'optimizer': 'adam', 'graph_mode': 'cutoff', 'cutoff': 0.8046716091261706, 'grm_norm': 'none', 'self_loops': False, 'use_snp_selection': True, 'num_snps': 19019}. Best is trial 58 with value: 0.12499328695603992.
[I 2025-11-03 11:47:31,475] Trial 61 finished with value: 0.12019950636442732 and parameters: {'model_type': 'graphsage', 'hidden_dims': '[512, 256]', 'dropout': 0.2976863649389099, 'batch_norm': True, 'lr': 0.00047454406850632353, 'weight_decay': 2.791960246224006e-06, 'epochs': 183, 'loss': 'mse', 'optimizer': 'adam', 'graph_mode': 'cutoff', 'cutoff': 0.6614802806438442, 'grm_norm': 'none', 'self_loops': False, 'use_snp_selection': False}. Best is trial 58 with value: 0.12499328695603992.
[I 2025-11-03 11:47:34,664] Trial 62 finished with value: 0.10744375973310484 and parameters: {'model_type': 'graphsage', 'hidden_dims': '[512, 256]', 'dropout': 0.2914951656450119, 'batch_norm': True, 'lr': 0.0004336300034685507, 'weight_decay': 2.48050732533822e-06, 'epochs': 182, 'loss': 'mse', 'optimizer': 'adam', 'graph_mode': 'cutoff', 'cutoff': 0.6675790344199788, 'grm_norm': 'none', 'self_loops': False, 'use_snp_selection': False}. Best is trial 58 with value: 0.12499328695603992.
[I 2025-11-03 11:47:38,064] Trial 63 finished with value: 0.1141806493227415 and parameters: {'model_type': 'graphsage', 'hidden_dims': '[512, 256]', 'dropout': 0.27141385487863023, 'batch_norm': True, 'lr': 0.000800787460974234, 'weight_decay': 1.6483149441774241e-06, 'epochs': 213, 'loss': 'mse', 'optimizer': 'adam', 'graph_mode': 'cutoff', 'cutoff': 0.6507496978310456, 'grm_norm': 'none', 'self_loops': False, 'use_snp_selection': False}. Best is trial 58 with value: 0.12499328695603992.
[I 2025-11-03 11:47:41,069] Trial 64 finished with value: 0.1237670648074376 and parameters: {'model_type': 'graphsage', 'hidden_dims': '[512, 256]', 'dropout': 0.3241088885755937, 'batch_norm': True, 'lr': 0.0002533013647628221, 'weight_decay': 6.60031449043166e-06, 'epochs': 152, 'loss': 'mse', 'optimizer': 'adam', 'graph_mode': 'cutoff', 'cutoff': 0.8209020042503864, 'grm_norm': 'none', 'self_loops': False, 'use_snp_selection': False}. Best is trial 58 with value: 0.12499328695603992.
[I 2025-11-03 11:47:44,083] Trial 65 finished with value: 0.10696190148847538 and parameters: {'model_type': 'graphsage', 'hidden_dims': '[512, 256]', 'dropout': 0.3326153619635428, 'batch_norm': True, 'lr': 0.0002510935865377437, 'weight_decay': 5.620059281149705e-06, 'epochs': 153, 'loss': 'mse', 'optimizer': 'adam', 'graph_mode': 'cutoff', 'cutoff': 0.8224097945183072, 'grm_norm': 'none', 'self_loops': False, 'use_snp_selection': False}. Best is trial 58 with value: 0.12499328695603992.
[I 2025-11-03 11:47:46,953] Trial 66 finished with value: 0.11034045386631092 and parameters: {'model_type': 'graphsage', 'hidden_dims': '[512, 256]', 'dropout': 0.34272096895426096, 'batch_norm': True, 'lr': 0.0004746429213214875, 'weight_decay': 9.838552888939246e-06, 'epochs': 131, 'loss': 'mse', 'optimizer': 'adam', 'graph_mode': 'cutoff', 'cutoff': 0.7234499998524031, 'grm_norm': 'none', 'self_loops': False, 'use_snp_selection': False}. Best is trial 58 with value: 0.12499328695603992.
[I 2025-11-03 11:47:50,242] Trial 67 finished with value: 0.022578245488989727 and parameters: {'model_type': 'graphsage', 'hidden_dims': '[512, 256]', 'dropout': 0.32086132692019637, 'batch_norm': True, 'lr': 2.865433062445272e-06, 'weight_decay': 3.946673873952073e-06, 'epochs': 197, 'loss': 'mse', 'optimizer': 'adam', 'graph_mode': 'cutoff', 'cutoff': 0.8150159614674167, 'grm_norm': 'none', 'self_loops': False, 'use_snp_selection': False}. Best is trial 58 with value: 0.12499328695603992.
[I 2025-11-03 11:47:53,277] Trial 68 finished with value: 0.12231500028596891 and parameters: {'model_type': 'graphsage', 'hidden_dims': '[512, 256]', 'dropout': 0.2354324697736535, 'batch_norm': True, 'lr': 0.00017429720334191114, 'weight_decay': 2.3040386583915437e-06, 'epochs': 159, 'loss': 'mse', 'optimizer': 'adam', 'graph_mode': 'cutoff', 'cutoff': 0.6979203131074104, 'grm_norm': 'none', 'self_loops': False, 'use_snp_selection': False}. Best is trial 58 with value: 0.12499328695603992.
[I 2025-11-03 11:47:56,328] Trial 69 finished with value: 0.10896479549460672 and parameters: {'model_type': 'graphsage', 'hidden_dims': '[512, 256]', 'dropout': 0.13423540607035336, 'batch_norm': True, 'lr': 0.00017786349480771653, 'weight_decay': 7.522566544524664e-07, 'epochs': 160, 'loss': 'mse', 'optimizer': 'adam', 'graph_mode': 'cutoff', 'cutoff': 0.707824554362341, 'grm_norm': 'none', 'self_loops': False, 'use_snp_selection': False}. Best is trial 58 with value: 0.12499328695603992.
[I 2025-11-03 11:47:59,067] Trial 70 finished with value: 0.11682830705226604 and parameters: {'model_type': 'graphsage', 'hidden_dims': '[512, 256]', 'dropout': 0.22180558502027234, 'batch_norm': True, 'lr': 6.278339678595298e-05, 'weight_decay': 2.4864203959931936e-06, 'epochs': 110, 'loss': 'mse', 'optimizer': 'adam', 'graph_mode': 'cutoff', 'cutoff': 0.7908258476867462, 'grm_norm': 'none', 'self_loops': False, 'use_snp_selection': False}. Best is trial 58 with value: 0.12499328695603992.
[I 2025-11-03 11:48:02,239] Trial 71 finished with value: 0.11052561780175427 and parameters: {'model_type': 'graphsage', 'hidden_dims': '[512, 256]', 'dropout': 0.15373067373754556, 'batch_norm': True, 'lr': 0.00022296674617018237, 'weight_decay': 5.635521900398348e-06, 'epochs': 180, 'loss': 'mse', 'optimizer': 'adam', 'graph_mode': 'cutoff', 'cutoff': 0.5896198624311754, 'grm_norm': 'none', 'self_loops': False, 'use_snp_selection': False}. Best is trial 58 with value: 0.12499328695603992.
[I 2025-11-03 11:48:05,183] Trial 72 finished with value: 0.10274329779337497 and parameters: {'model_type': 'graphsage', 'hidden_dims': '[512, 256]', 'dropout': 0.2978988658018309, 'batch_norm': True, 'lr': 0.00012780026919956692, 'weight_decay': 3.08830158154327e-06, 'epochs': 144, 'loss': 'mse', 'optimizer': 'adam', 'graph_mode': 'cutoff', 'cutoff': 0.6820225680817915, 'grm_norm': 'none', 'self_loops': False, 'use_snp_selection': False}. Best is trial 58 with value: 0.12499328695603992.
[I 2025-11-03 11:48:09,484] Trial 73 finished with value: 0.10479022119215926 and parameters: {'model_type': 'graphsage', 'hidden_dims': '[512, 256]', 'dropout': 0.2487622020886697, 'batch_norm': True, 'lr': 0.00028403393177036605, 'weight_decay': 8.553212290268493e-06, 'epochs': 350, 'loss': 'mse', 'optimizer': 'adam', 'graph_mode': 'cutoff', 'cutoff': 0.7497819887394248, 'grm_norm': 'none', 'self_loops': False, 'use_snp_selection': False}. Best is trial 58 with value: 0.12499328695603992.
[I 2025-11-03 11:48:11,926] Trial 74 finished with value: 0.10050081865142907 and parameters: {'model_type': 'graphsage', 'hidden_dims': '[512, 64]', 'dropout': 0.37611007678849223, 'batch_norm': True, 'lr': 0.0004796436493152625, 'weight_decay': 2.064140443198778e-06, 'epochs': 68, 'loss': 'mse', 'optimizer': 'adam', 'graph_mode': 'cutoff', 'cutoff': 0.8502513638411178, 'grm_norm': 'none', 'self_loops': False, 'use_snp_selection': False}. Best is trial 58 with value: 0.12499328695603992.
[I 2025-11-03 11:48:14,206] Trial 75 finished with value: 0.12125136472548342 and parameters: {'model_type': 'graphsage', 'hidden_dims': '[256, 128, 64]', 'dropout': 0.23448524431779125, 'batch_norm': True, 'lr': 0.0003996807290485097, 'weight_decay': 1.5036317350698395e-05, 'epochs': 168, 'loss': 'mse', 'optimizer': 'adam', 'graph_mode': 'cutoff', 'cutoff': 0.6403115589297845, 'grm_norm': 'none', 'self_loops': False, 'use_snp_selection': False}. Best is trial 58 with value: 0.12499328695603992.
[I 2025-11-03 11:48:16,459] Trial 76 finished with value: 0.12642692181639253 and parameters: {'model_type': 'graphsage', 'hidden_dims': '[256, 128, 64]', 'dropout': 0.2685971535728881, 'batch_norm': True, 'lr': 0.0008251792308022241, 'weight_decay': 1.54821009220768e-05, 'epochs': 166, 'loss': 'mse', 'optimizer': 'adam', 'graph_mode': 'cutoff', 'cutoff': 0.6283316777518255, 'grm_norm': 'none', 'self_loops': False, 'use_snp_selection': False}. Best is trial 76 with value: 0.12642692181639253.
[I 2025-11-03 11:48:18,691] Trial 77 finished with value: 0.10863380562684848 and parameters: {'model_type': 'graphsage', 'hidden_dims': '[256, 128, 64]', 'dropout': 0.2338949509854946, 'batch_norm': True, 'lr': 0.0007749623917748582, 'weight_decay': 1.7366870181246514e-05, 'epochs': 162, 'loss': 'mse', 'optimizer': 'adam', 'graph_mode': 'cutoff', 'cutoff': 0.6388362235380803, 'grm_norm': 'none', 'self_loops': False, 'use_snp_selection': False}. Best is trial 76 with value: 0.12642692181639253.
[I 2025-11-03 11:48:21,986] Trial 78 finished with value: 0.046284751096379674 and parameters: {'model_type': 'graphsage', 'hidden_dims': '[256, 128, 64]', 'dropout': 0.20247040420666385, 'batch_norm': False, 'lr': 0.0007359052382175412, 'weight_decay': 1.374800084784591e-05, 'epochs': 136, 'loss': 'mse', 'optimizer': 'adam', 'graph_mode': 'cutoff', 'cutoff': 0.6930311372938487, 'grm_norm': 'none', 'self_loops': False, 'use_snp_selection': True, 'num_snps': 49628}. Best is trial 76 with value: 0.12642692181639253.
[I 2025-11-03 11:48:24,278] Trial 79 finished with value: 0.03743887255403254 and parameters: {'model_type': 'graphsage', 'hidden_dims': '[256, 128, 64]', 'dropout': 0.2715806040915643, 'batch_norm': True, 'lr': 7.899140011217064e-06, 'weight_decay': 2.08232952969446e-05, 'epochs': 174, 'loss': 'mse', 'optimizer': 'adam', 'graph_mode': 'cutoff', 'cutoff': 0.5743833462496406, 'grm_norm': 'none', 'self_loops': False, 'use_snp_selection': False}. Best is trial 76 with value: 0.12642692181639253.
[I 2025-11-03 11:48:26,572] Trial 80 finished with value: 0.09735282805800673 and parameters: {'model_type': 'graphsage', 'hidden_dims': '[256, 128, 64]', 'dropout': 0.20383924894545705, 'batch_norm': True, 'lr': 0.0003932371965376574, 'weight_decay': 1.2151478919270592e-05, 'epochs': 168, 'loss': 'mse', 'optimizer': 'adam', 'graph_mode': 'cutoff', 'cutoff': 0.6499221497881885, 'grm_norm': 'cosine_then_gcn', 'self_loops': False, 'use_snp_selection': False}. Best is trial 76 with value: 0.12642692181639253.
[I 2025-11-03 11:48:28,952] Trial 81 finished with value: 0.12757915674933779 and parameters: {'model_type': 'graphsage', 'hidden_dims': '[256, 128, 64]', 'dropout': 0.26179252240557843, 'batch_norm': True, 'lr': 0.0004675750597232053, 'weight_decay': 4.686525347410095e-06, 'epochs': 189, 'loss': 'mse', 'optimizer': 'adam', 'graph_mode': 'cutoff', 'cutoff': 0.7008474906856882, 'grm_norm': 'none', 'self_loops': False, 'use_snp_selection': False}. Best is trial 81 with value: 0.12757915674933779.
[I 2025-11-03 11:48:31,340] Trial 82 finished with value: 0.10334869797662088 and parameters: {'model_type': 'graphsage', 'hidden_dims': '[256, 128, 64]', 'dropout': 0.26176285895751394, 'batch_norm': True, 'lr': 0.0005206795355518984, 'weight_decay': 8.10798338862108e-06, 'epochs': 194, 'loss': 'mse', 'optimizer': 'adam', 'graph_mode': 'cutoff', 'cutoff': 0.6940941015484206, 'grm_norm': 'none', 'self_loops': False, 'use_snp_selection': False}. Best is trial 81 with value: 0.12757915674933779.
[I 2025-11-03 11:48:33,520] Trial 83 finished with value: 0.11122702306663827 and parameters: {'model_type': 'graphsage', 'hidden_dims': '[256, 128, 64]', 'dropout': 0.23998595953465063, 'batch_norm': True, 'lr': 0.0004364602727621732, 'weight_decay': 5.133230281660535e-06, 'epochs': 151, 'loss': 'mse', 'optimizer': 'adam', 'graph_mode': 'cutoff', 'cutoff': 0.6165992368046653, 'grm_norm': 'none', 'self_loops': False, 'use_snp_selection': False}. Best is trial 81 with value: 0.12757915674933779.
[I 2025-11-03 11:48:35,578] Trial 84 finished with value: 0.11490718164159436 and parameters: {'model_type': 'graphsage', 'hidden_dims': '[256, 128, 64]', 'dropout': 0.2820554282670981, 'batch_norm': True, 'lr': 0.0008657282436020917, 'weight_decay': 3.6440979268269446e-06, 'epochs': 126, 'loss': 'mse', 'optimizer': 'adam', 'graph_mode': 'cutoff', 'cutoff': 0.7367543171373293, 'grm_norm': 'none', 'self_loops': True, 'use_snp_selection': False}. Best is trial 81 with value: 0.12757915674933779.
[I 2025-11-03 11:48:37,919] Trial 85 finished with value: 0.1127281125755531 and parameters: {'model_type': 'graphsage', 'hidden_dims': '[256, 128, 64]', 'dropout': 0.257876334969182, 'batch_norm': True, 'lr': 0.0006893953412871537, 'weight_decay': 1.077603925371219e-06, 'epochs': 180, 'loss': 'mse', 'optimizer': 'adam', 'graph_mode': 'cutoff', 'cutoff': 0.6636559961370696, 'grm_norm': 'cosine', 'self_loops': False, 'use_snp_selection': False}. Best is trial 81 with value: 0.12757915674933779.
[I 2025-11-03 11:48:40,117] Trial 86 finished with value: 0.1187751173907825 and parameters: {'model_type': 'graphsage', 'hidden_dims': '[256, 128, 64]', 'dropout': 0.2316372055753972, 'batch_norm': True, 'lr': 0.0005406811236814375, 'weight_decay': 6.494451470297649e-06, 'epochs': 155, 'loss': 'mse', 'optimizer': 'adam', 'graph_mode': 'cutoff', 'cutoff': 0.7774245982854927, 'grm_norm': 'none', 'self_loops': False, 'use_snp_selection': False}. Best is trial 81 with value: 0.12757915674933779.
