[I 2025-11-03 13:45:09,563] Trial 55 finished with value: 0.020752140038136226 and parameters: {'model_type': 'gcn', 'hidden_dims': '[512, 64]', 'dropout': 0.21059546087220415, 'batch_norm': True, 'lr': 0.00013375298074457605, 'weight_decay': 8.320762138123804e-07, 'epochs': 247, 'loss': 'mae', 'optimizer': 'adam', 'graph_mode': 'cutoff', 'cutoff': 0.5067948095610677, 'grm_norm': 'cosine_then_gcn', 'self_loops': True, 'use_snp_selection': False}. Best is trial 37 with value: 0.05468068371672446.
[I 2025-11-03 13:45:11,697] Trial 56 finished with value: 0.0386042300176561 and parameters: {'model_type': 'gcn', 'hidden_dims': '[512, 128]', 'dropout': 0.29197151464309057, 'batch_norm': True, 'lr': 0.0001999763501630361, 'weight_decay': 3.865140340714897e-06, 'epochs': 140, 'loss': 'mae', 'optimizer': 'adam', 'graph_mode': 'knn', 'source': 'grm', 'knn_k': 3, 'weighted_edges': True, 'symmetrize_mode': 'union', 'use_snp_selection': False}. Best is trial 37 with value: 0.05468068371672446.
[I 2025-11-03 13:45:14,796] Trial 57 finished with value: 0.02798058139895644 and parameters: {'model_type': 'gcn', 'hidden_dims': '[512, 64]', 'dropout': 0.25959519101288286, 'batch_norm': True, 'lr': 0.0003401304161634138, 'weight_decay': 9.585111398579701e-06, 'epochs': 321, 'loss': 'mse', 'optimizer': 'adam', 'graph_mode': 'cutoff', 'cutoff': 0.3277088831678602, 'grm_norm': 'cosine', 'self_loops': False, 'use_snp_selection': False}. Best is trial 37 with value: 0.05468068371672446.
[I 2025-11-03 13:45:16,922] Trial 58 finished with value: -0.01600415404388203 and parameters: {'model_type': 'gcn', 'hidden_dims': '[256, 128]', 'dropout': 0.15948070927505517, 'batch_norm': True, 'lr': 5.377523307335725e-05, 'weight_decay': 1.6299178457151004e-07, 'epochs': 260, 'loss': 'mae', 'optimizer': 'adam', 'graph_mode': 'knn', 'source': 'grm', 'knn_k': 6, 'weighted_edges': True, 'symmetrize_mode': 'union', 'use_snp_selection': False}. Best is trial 37 with value: 0.05468068371672446.
[I 2025-11-03 13:45:19,901] Trial 59 finished with value: -0.002603258056670772 and parameters: {'model_type': 'gcn', 'hidden_dims': '[512, 256]', 'dropout': 0.18324113795964272, 'batch_norm': True, 'lr': 0.00011423081673372627, 'weight_decay': 2.518538357237658e-07, 'epochs': 290, 'loss': 'mae', 'optimizer': 'adam', 'graph_mode': 'knn', 'source': 'grm', 'knn_k': 7, 'weighted_edges': False, 'symmetrize_mode': 'mutual', 'use_snp_selection': False}. Best is trial 37 with value: 0.05468068371672446.
[I 2025-11-03 13:45:22,331] Trial 60 finished with value: -0.0070629255140926455 and parameters: {'model_type': 'gcn', 'hidden_dims': '[512, 64]', 'dropout': 0.22582315157925054, 'batch_norm': True, 'lr': 0.00015989225561839545, 'weight_decay': 1.0048023139691492e-07, 'epochs': 193, 'loss': 'mse', 'optimizer': 'adam', 'graph_mode': 'knn', 'source': 'grm', 'knn_k': 8, 'weighted_edges': True, 'symmetrize_mode': 'union', 'use_snp_selection': False}. Best is trial 37 with value: 0.05468068371672446.
[I 2025-11-03 13:45:24,087] Trial 61 finished with value: 0.024118588784163716 and parameters: {'model_type': 'gcn', 'hidden_dims': '[256, 128]', 'dropout': 0.169112516462476, 'batch_norm': True, 'lr': 0.00024378749698990315, 'weight_decay': 2.2997121202957936e-07, 'epochs': 181, 'loss': 'mse', 'optimizer': 'adam', 'graph_mode': 'cutoff', 'cutoff': 0.8985003460441379, 'grm_norm': 'none', 'self_loops': True, 'use_snp_selection': False}. Best is trial 37 with value: 0.05468068371672446.
[I 2025-11-03 13:45:25,820] Trial 62 finished with value: 0.028657438727472524 and parameters: {'model_type': 'gcn', 'hidden_dims': '[256, 128]', 'dropout': 0.11762451692814534, 'batch_norm': True, 'lr': 0.00023248087044325127, 'weight_decay': 4.0883749323792336e-07, 'epochs': 174, 'loss': 'mse', 'optimizer': 'adam', 'graph_mode': 'cutoff', 'cutoff': 0.8431546296071086, 'grm_norm': 'none', 'self_loops': True, 'use_snp_selection': False}. Best is trial 37 with value: 0.05468068371672446.
[I 2025-11-03 13:45:26,922] Trial 63 finished with value: 0.04079323098030082 and parameters: {'model_type': 'gcn', 'hidden_dims': '[256, 128]', 'dropout': 0.1478207896434237, 'batch_norm': True, 'lr': 0.00046261832173119684, 'weight_decay': 1.447218130727667e-07, 'epochs': 1, 'loss': 'mse', 'optimizer': 'adam', 'graph_mode': 'cutoff', 'cutoff': 0.8572889948749726, 'grm_norm': 'none', 'self_loops': True, 'use_snp_selection': False}. Best is trial 37 with value: 0.05468068371672446.
[I 2025-11-03 13:45:28,854] Trial 64 finished with value: 0.005226533610960661 and parameters: {'model_type': 'gcn', 'hidden_dims': '[256, 128]', 'dropout': 0.13803950594156222, 'batch_norm': True, 'lr': 2.9283201594701905e-06, 'weight_decay': 6.62965661968313e-07, 'epochs': 218, 'loss': 'mse', 'optimizer': 'adam', 'graph_mode': 'cutoff', 'cutoff': 0.5570647038127339, 'grm_norm': 'gcn', 'self_loops': True, 'use_snp_selection': False}. Best is trial 37 with value: 0.05468068371672446.
[I 2025-11-03 13:45:30,729] Trial 65 finished with value: 0.025138244788632455 and parameters: {'model_type': 'gcn', 'hidden_dims': '[256, 128, 64]', 'dropout': 0.2011958397274407, 'batch_norm': True, 'lr': 0.0002917569290828384, 'weight_decay': 3.121116874443159e-07, 'epochs': 166, 'loss': 'mae', 'optimizer': 'adam', 'graph_mode': 'cutoff', 'cutoff': 0.7567770972709172, 'grm_norm': 'none', 'self_loops': True, 'use_snp_selection': False}. Best is trial 37 with value: 0.05468068371672446.
[I 2025-11-03 13:45:32,339] Trial 66 finished with value: 0.04647713583475565 and parameters: {'model_type': 'gcn', 'hidden_dims': '[128, 64]', 'dropout': 0.2558696927696016, 'batch_norm': True, 'lr': 7.871334876838825e-05, 'weight_decay': 2.1128665059590125e-06, 'epochs': 206, 'loss': 'mse', 'optimizer': 'adam', 'graph_mode': 'cutoff', 'cutoff': 0.6910098355282686, 'grm_norm': 'none', 'self_loops': False, 'use_snp_selection': False}. Best is trial 37 with value: 0.05468068371672446.
[I 2025-11-03 13:45:34,057] Trial 67 finished with value: 0.005462530581912419 and parameters: {'model_type': 'gcn', 'hidden_dims': '[128, 64]', 'dropout': 0.3190484211559808, 'batch_norm': True, 'lr': 8.072546085650596e-05, 'weight_decay': 2.736636747546031e-06, 'epochs': 227, 'loss': 'mae', 'optimizer': 'adam', 'graph_mode': 'knn', 'source': 'grm', 'knn_k': 1, 'weighted_edges': False, 'symmetrize_mode': 'mutual', 'use_snp_selection': False}. Best is trial 37 with value: 0.05468068371672446.
[I 2025-11-03 13:45:36,846] Trial 68 finished with value: -0.006951510906193226 and parameters: {'model_type': 'gcn', 'hidden_dims': '[128, 64]', 'dropout': 0.24875626382000965, 'batch_norm': False, 'lr': 6.358555863828431e-05, 'weight_decay': 1.4986509052092254e-06, 'epochs': 304, 'loss': 'mse', 'optimizer': 'adam', 'graph_mode': 'cutoff', 'cutoff': 0.6812383627626564, 'grm_norm': 'gcn', 'self_loops': False, 'use_snp_selection': True, 'num_snps': 37707}. Best is trial 37 with value: 0.05468068371672446.
[I 2025-11-03 13:45:39,382] Trial 69 finished with value: 0.005293179766474873 and parameters: {'model_type': 'gcn', 'hidden_dims': '[512, 64]', 'dropout': 0.26675238638119847, 'batch_norm': True, 'lr': 0.00010882153731594996, 'weight_decay': 9.764382232359319e-07, 'epochs': 205, 'loss': 'mae', 'optimizer': 'adam', 'graph_mode': 'knn', 'source': 'grm', 'knn_k': 4, 'weighted_edges': True, 'symmetrize_mode': 'union', 'use_snp_selection': False}. Best is trial 37 with value: 0.05468068371672446.
[I 2025-11-03 13:45:40,935] Trial 70 finished with value: 0.01791115543332216 and parameters: {'model_type': 'gcn', 'hidden_dims': '[128, 64]', 'dropout': 0.35247793112755005, 'batch_norm': True, 'lr': 4.2021402877389676e-05, 'weight_decay': 4.1653646342608847e-07, 'epochs': 190, 'loss': 'mse', 'optimizer': 'adam', 'graph_mode': 'cutoff', 'cutoff': 0.6080897160046227, 'grm_norm': 'none', 'self_loops': False, 'use_snp_selection': False}. Best is trial 37 with value: 0.05468068371672446.
[I 2025-11-03 13:45:42,526] Trial 71 finished with value: 0.04209579174463198 and parameters: {'model_type': 'gcn', 'hidden_dims': '[128, 64]', 'dropout': 0.2920364503370383, 'batch_norm': True, 'lr': 0.00016806372610661232, 'weight_decay': 2.006650587822318e-07, 'epochs': 209, 'loss': 'mse', 'optimizer': 'adam', 'graph_mode': 'cutoff', 'cutoff': 0.7479964513605495, 'grm_norm': 'none', 'self_loops': False, 'use_snp_selection': False}. Best is trial 37 with value: 0.05468068371672446.
[I 2025-11-03 13:45:44,482] Trial 72 finished with value: 0.05467843882301521 and parameters: {'model_type': 'gcn', 'hidden_dims': '[256, 128]', 'dropout': 0.3386171124332972, 'batch_norm': True, 'lr': 0.00023060433208757473, 'weight_decay': 2.4888572480895455e-05, 'epochs': 237, 'loss': 'mse', 'optimizer': 'adam', 'graph_mode': 'cutoff', 'cutoff': 0.6677653951199543, 'grm_norm': 'none', 'self_loops': False, 'use_snp_selection': False}. Best is trial 37 with value: 0.05468068371672446.
[I 2025-11-03 13:45:47,339] Trial 73 finished with value: 0.018902819225977363 and parameters: {'model_type': 'gcn', 'hidden_dims': '[512, 256]', 'dropout': 0.3387399131487636, 'batch_norm': True, 'lr': 0.0002052485987342684, 'weight_decay': 2.2636029168044504e-05, 'epochs': 278, 'loss': 'mse', 'optimizer': 'adam', 'graph_mode': 'cutoff', 'cutoff': 0.6686228837359938, 'grm_norm': 'none', 'self_loops': False, 'use_snp_selection': False}. Best is trial 37 with value: 0.05468068371672446.
[I 2025-11-03 13:45:49,576] Trial 74 finished with value: 0.011356598301443348 and parameters: {'model_type': 'gcn', 'hidden_dims': '[256, 128, 64]', 'dropout': 0.32340778906869205, 'batch_norm': True, 'lr': 0.00012014919980833965, 'weight_decay': 1.669230785277026e-05, 'epochs': 236, 'loss': 'mse', 'optimizer': 'adam', 'graph_mode': 'cutoff', 'cutoff': 0.6417873769437487, 'grm_norm': 'none', 'self_loops': False, 'use_snp_selection': False}. Best is trial 37 with value: 0.05468068371672446.
[I 2025-11-03 13:45:51,668] Trial 75 finished with value: 0.02736687544330678 and parameters: {'model_type': 'gcn', 'hidden_dims': '[256, 128]', 'dropout': 0.3052045576188781, 'batch_norm': True, 'lr': 8.964828975276327e-05, 'weight_decay': 3.6130837114464086e-05, 'epochs': 260, 'loss': 'mse', 'optimizer': 'adam', 'graph_mode': 'cutoff', 'cutoff': 0.6978126703158631, 'grm_norm': 'cosine', 'self_loops': False, 'use_snp_selection': False}. Best is trial 37 with value: 0.05468068371672446.
[I 2025-11-03 13:45:55,598] Trial 76 finished with value: -0.005816014556485996 and parameters: {'model_type': 'gcn', 'hidden_dims': '[512, 128]', 'dropout': 0.38508027287963725, 'batch_norm': False, 'lr': 0.0003122912654414597, 'weight_decay': 1.348727915706865e-07, 'epochs': 248, 'loss': 'mse', 'optimizer': 'adam', 'graph_mode': 'knn', 'source': 'grm', 'knn_k': 3, 'weighted_edges': True, 'symmetrize_mode': 'mutual', 'use_snp_selection': True, 'num_snps': 49616}. Best is trial 37 with value: 0.05468068371672446.
[I 2025-11-03 13:45:58,308] Trial 77 finished with value: 0.0328761956299241 and parameters: {'model_type': 'gcn', 'hidden_dims': '[512, 64]', 'dropout': 0.27936399199216966, 'batch_norm': True, 'lr': 0.00014729305744344508, 'weight_decay': 2.651074464375174e-05, 'epochs': 234, 'loss': 'mae', 'optimizer': 'adam', 'graph_mode': 'cutoff', 'cutoff': 0.5804861638333481, 'grm_norm': 'cosine_then_gcn', 'self_loops': False, 'use_snp_selection': False}. Best is trial 37 with value: 0.05468068371672446.
[I 2025-11-03 13:45:59,987] Trial 78 finished with value: 0.014733909905567423 and parameters: {'model_type': 'gcn', 'hidden_dims': '[128, 64]', 'dropout': 0.3645066878780468, 'batch_norm': True, 'lr': 1.7440703279968518e-05, 'weight_decay': 1.035946231059993e-05, 'epochs': 200, 'loss': 'mse', 'optimizer': 'adam', 'graph_mode': 'knn', 'source': 'grm', 'knn_k': 5, 'weighted_edges': False, 'symmetrize_mode': 'union', 'use_snp_selection': False}. Best is trial 37 with value: 0.05468068371672446.
[I 2025-11-03 13:46:02,013] Trial 79 finished with value: 0.009566713933071302 and parameters: {'model_type': 'gcn', 'hidden_dims': '[512, 256]', 'dropout': 0.33240339551804005, 'batch_norm': False, 'lr': 0.0002580106535862293, 'weight_decay': 8.574123913576753e-06, 'epochs': 151, 'loss': 'mae', 'optimizer': 'adam', 'graph_mode': 'cutoff', 'cutoff': 0.7425550617174426, 'grm_norm': 'none', 'self_loops': False, 'use_snp_selection': True, 'num_snps': 19364}. Best is trial 37 with value: 0.05468068371672446.
[I 2025-11-03 13:46:03,946] Trial 80 finished with value: 0.020059166248546798 and parameters: {'model_type': 'gcn', 'hidden_dims': '[256, 128]', 'dropout': 0.22314573653501887, 'batch_norm': True, 'lr': 0.00039205677908464077, 'weight_decay': 4.561434196203742e-06, 'epochs': 217, 'loss': 'mse', 'optimizer': 'adam', 'graph_mode': 'cutoff', 'cutoff': 0.47291460877091973, 'grm_norm': 'gcn', 'self_loops': False, 'use_snp_selection': False}. Best is trial 37 with value: 0.05468068371672446.
[I 2025-11-03 13:46:05,736] Trial 81 finished with value: 0.03995099988499878 and parameters: {'model_type': 'gcn', 'hidden_dims': '[256, 128]', 'dropout': 0.11479439533361026, 'batch_norm': True, 'lr': 0.00021065432043724727, 'weight_decay': 2.575702497737499e-07, 'epochs': 179, 'loss': 'mse', 'optimizer': 'adam', 'graph_mode': 'cutoff', 'cutoff': 0.8873949004841338, 'grm_norm': 'none', 'self_loops': False, 'use_snp_selection': False}. Best is trial 37 with value: 0.05468068371672446.
[I 2025-11-03 13:46:07,543] Trial 82 finished with value: 0.04142574422891236 and parameters: {'model_type': 'gcn', 'hidden_dims': '[256, 128]', 'dropout': 0.5803441491716996, 'batch_norm': True, 'lr': 0.0001534440886393571, 'weight_decay': 4.0697270374221235e-05, 'epochs': 186, 'loss': 'mse', 'optimizer': 'adam', 'graph_mode': 'cutoff', 'cutoff': 0.7990904708122714, 'grm_norm': 'none', 'self_loops': True, 'use_snp_selection': False}. Best is trial 37 with value: 0.05468068371672446.
[I 2025-11-03 13:46:09,251] Trial 83 finished with value: 0.03065434919660352 and parameters: {'model_type': 'gcn', 'hidden_dims': '[256, 128]', 'dropout': 0.15900319228201237, 'batch_norm': True, 'lr': 0.00018642191798957382, 'weight_decay': 1.687949170343342e-05, 'epochs': 158, 'loss': 'mse', 'optimizer': 'adam', 'graph_mode': 'cutoff', 'cutoff': 0.6422551550114214, 'grm_norm': 'none', 'self_loops': True, 'use_snp_selection': False}. Best is trial 37 with value: 0.05468068371672446.
[I 2025-11-03 13:46:10,978] Trial 84 finished with value: 0.0360337295901172 and parameters: {'model_type': 'gcn', 'hidden_dims': '[256, 128, 64]', 'dropout': 0.1947393852038397, 'batch_norm': True, 'lr': 9.069817170843904e-05, 'weight_decay': 5.257133671625763e-05, 'epochs': 127, 'loss': 'mse', 'optimizer': 'adam', 'graph_mode': 'cutoff', 'cutoff': 0.8548739384301964, 'grm_norm': 'cosine', 'self_loops': True, 'use_snp_selection': False}. Best is trial 37 with value: 0.05468068371672446.
[I 2025-11-03 13:46:12,928] Trial 85 finished with value: 0.03265573611018062 and parameters: {'model_type': 'gcn', 'hidden_dims': '[512, 64]', 'dropout': 0.2413840567750663, 'batch_norm': True, 'lr': 0.0002496248005389634, 'weight_decay': 1.8935478347897797e-07, 'epochs': 106, 'loss': 'mse', 'optimizer': 'adam', 'graph_mode': 'knn', 'source': 'grm', 'knn_k': 1, 'weighted_edges': True, 'symmetrize_mode': 'mutual', 'use_snp_selection': False}. Best is trial 37 with value: 0.05468068371672446.
[I 2025-11-03 13:46:14,574] Trial 86 finished with value: 0.029260719194872904 and parameters: {'model_type': 'gcn', 'hidden_dims': '[256, 128]', 'dropout': 0.3040112617144323, 'batch_norm': True, 'lr': 0.0003600175382525426, 'weight_decay': 5.10037380887064e-07, 'epochs': 142, 'loss': 'mae', 'optimizer': 'adam', 'graph_mode': 'cutoff', 'cutoff': 0.7829794922029525, 'grm_norm': 'none', 'self_loops': False, 'use_snp_selection': False}. Best is trial 37 with value: 0.05468068371672446.
[I 2025-11-03 13:46:17,230] Trial 87 finished with value: -0.031881248989346536 and parameters: {'model_type': 'gcn', 'hidden_dims': '[256, 128]', 'dropout': 0.289337424729098, 'batch_norm': False, 'lr': 0.0006051547643373406, 'weight_decay': 1.327970763908456e-07, 'epochs': 254, 'loss': 'mse', 'optimizer': 'adam', 'graph_mode': 'cutoff', 'cutoff': 0.7264396850831245, 'grm_norm': 'cosine', 'self_loops': True, 'use_snp_selection': True, 'num_snps': 31673}. Best is trial 37 with value: 0.05468068371672446.
[I 2025-11-03 13:46:19,972] Trial 88 finished with value: 0.028626217590601095 and parameters: {'model_type': 'gcn', 'hidden_dims': '[512, 64]', 'dropout': 0.4267521821435618, 'batch_norm': True, 'lr': 0.00044381857496666945, 'weight_decay': 2.1907884622376725e-06, 'epochs': 243, 'loss': 'mae', 'optimizer': 'adam', 'graph_mode': 'knn', 'source': 'grm', 'knn_k': 2, 'weighted_edges': True, 'symmetrize_mode': 'union', 'use_snp_selection': False}. Best is trial 37 with value: 0.05468068371672446.
[I 2025-11-03 13:46:22,749] Trial 89 finished with value: 0.021541714021745546 and parameters: {'model_type': 'gcn', 'hidden_dims': '[512, 256]', 'dropout': 0.13822433883684984, 'batch_norm': True, 'lr': 0.0001271355559378798, 'weight_decay': 6.456870541768108e-07, 'epochs': 268, 'loss': 'mse', 'optimizer': 'adam', 'graph_mode': 'cutoff', 'cutoff': 0.5467276562992552, 'grm_norm': 'none', 'self_loops': True, 'use_snp_selection': False}. Best is trial 37 with value: 0.05468068371672446.
[I 2025-11-03 13:46:24,709] Trial 90 finished with value: 0.004728136977738012 and parameters: {'model_type': 'gcn', 'hidden_dims': '[256, 128, 64]', 'dropout': 0.1754769150991423, 'batch_norm': True, 'lr': 0.00016979500551785054, 'weight_decay': 2.9347185631351495e-07, 'epochs': 171, 'loss': 'mse', 'optimizer': 'adam', 'graph_mode': 'knn', 'source': 'grm', 'knn_k': 3, 'weighted_edges': True, 'symmetrize_mode': 'mutual', 'use_snp_selection': False}. Best is trial 37 with value: 0.05468068371672446.
[I 2025-11-03 13:46:26,838] Trial 91 finished with value: -0.030510727684236252 and parameters: {'model_type': 'gcn', 'hidden_dims': '[256, 128, 64]', 'dropout': 0.5453548905937469, 'batch_norm': False, 'lr': 1.0737845006663585e-05, 'weight_decay': 1.3132921281859498e-05, 'epochs': 49, 'loss': 'mse', 'optimizer': 'adam', 'graph_mode': 'knn', 'source': 'grm', 'knn_k': 6, 'weighted_edges': False, 'symmetrize_mode': 'mutual', 'use_snp_selection': True, 'num_snps': 31111}. Best is trial 37 with value: 0.05468068371672446.
[I 2025-11-03 13:46:28,855] Trial 92 finished with value: -0.0015619026559108473 and parameters: {'model_type': 'gcn', 'hidden_dims': '[256, 128, 64]', 'dropout': 0.5002468274825983, 'batch_norm': False, 'lr': 2.8430147924688283e-05, 'weight_decay': 2.5334336333217318e-05, 'epochs': 71, 'loss': 'mse', 'optimizer': 'adam', 'graph_mode': 'knn', 'source': 'grm', 'knn_k': 8, 'weighted_edges': False, 'symmetrize_mode': 'mutual', 'use_snp_selection': True, 'num_snps': 26380}. Best is trial 37 with value: 0.05468068371672446.
[I 2025-11-03 13:46:31,774] Trial 93 finished with value: 0.028208792126739452 and parameters: {'model_type': 'gcn', 'hidden_dims': '[256, 128, 64]', 'dropout': 0.10921726206719995, 'batch_norm': False, 'lr': 3.9566102100413566e-05, 'weight_decay': 7.835956084800614e-06, 'epochs': 204, 'loss': 'mse', 'optimizer': 'adam', 'graph_mode': 'knn', 'source': 'grm', 'knn_k': 6, 'weighted_edges': False, 'symmetrize_mode': 'mutual', 'use_snp_selection': True, 'num_snps': 36473}. Best is trial 37 with value: 0.05468068371672446.
[I 2025-11-03 13:46:33,840] Trial 94 finished with value: 0.007144638656602929 and parameters: {'model_type': 'gcn', 'hidden_dims': '[512, 128]', 'dropout': 0.4913281922656463, 'batch_norm': False, 'lr': 5.7159622337204624e-05, 'weight_decay': 8.798124324931508e-05, 'epochs': 286, 'loss': 'mse', 'optimizer': 'adam', 'graph_mode': 'knn', 'source': 'grm', 'knn_k': 9, 'weighted_edges': False, 'symmetrize_mode': 'mutual', 'use_snp_selection': True, 'num_snps': 11787}. Best is trial 37 with value: 0.05468068371672446.
[I 2025-11-03 13:46:35,201] Trial 95 finished with value: 0.01910051079605348 and parameters: {'model_type': 'gcn', 'hidden_dims': '[256, 128]', 'dropout': 0.269956187440751, 'batch_norm': False, 'lr': 0.00022199282352381748, 'weight_decay': 1.8747212162877817e-05, 'epochs': 89, 'loss': 'mae', 'optimizer': 'adam', 'graph_mode': 'knn', 'source': 'grm', 'knn_k': 5, 'weighted_edges': False, 'symmetrize_mode': 'mutual', 'use_snp_selection': True, 'num_snps': 7454}. Best is trial 37 with value: 0.05468068371672446.
[I 2025-11-03 13:46:36,907] Trial 96 finished with value: 0.02156978571725548 and parameters: {'model_type': 'gcn', 'hidden_dims': '[128, 64]', 'dropout': 0.4734255929521804, 'batch_norm': True, 'lr': 7.250884737727237e-05, 'weight_decay': 4.5072307435475716e-05, 'epochs': 228, 'loss': 'mse', 'optimizer': 'adam', 'graph_mode': 'cutoff', 'cutoff': 0.6111301679311828, 'grm_norm': 'none', 'self_loops': True, 'use_snp_selection': False}. Best is trial 37 with value: 0.05468068371672446.
[I 2025-11-03 13:46:38,415] Trial 97 finished with value: 0.0006211172802688418 and parameters: {'model_type': 'gcn', 'hidden_dims': '[256, 128, 64]', 'dropout': 0.21448950521788285, 'batch_norm': False, 'lr': 9.56975338713006e-05, 'weight_decay': 3.721419942769536e-07, 'epochs': 22, 'loss': 'mae', 'optimizer': 'adam', 'graph_mode': 'knn', 'source': 'grm', 'knn_k': 2, 'weighted_edges': False, 'symmetrize_mode': 'union', 'use_snp_selection': True, 'num_snps': 16527}. Best is trial 37 with value: 0.05468068371672446.
[I 2025-11-03 13:46:40,845] Trial 98 finished with value: 0.0635875299136068 and parameters: {'model_type': 'gcn', 'hidden_dims': '[512, 64]', 'dropout': 0.39870137329939104, 'batch_norm': True, 'lr': 0.0002771282185689, 'weight_decay': 1.6106995262969153e-07, 'epochs': 197, 'loss': 'mse', 'optimizer': 'adam', 'graph_mode': 'cutoff', 'cutoff': 0.670137358452737, 'grm_norm': 'cosine_then_gcn', 'self_loops': False, 'use_snp_selection': False}. Best is trial 98 with value: 0.0635875299136068.
