[I 2025-10-23 08:16:34,241] Trial 14 finished with value: 0.20898317564610885 and parameters: {'model_type': 'gat', 'hidden_dims': '[512, 128]', 'dropout': 0.16027227485298295, 'batch_norm': True, 'gat_heads': 6, 'gat_attn_dropout': 0.2810064922470583, 'gat_concat_hidden': True, 'lr': 0.0002680437229711166, 'weight_decay': 3.1094689509552523e-06, 'epochs': 291, 'loss': 'mae', 'optimizer': 'adam', 'graph_mode': 'cutoff', 'cutoff': 0.7540030982961998, 'grm_norm': 'gcn', 'self_loops': True}. Best is trial 11 with value: 0.22279737900517124.
[I 2025-10-23 08:29:01,749] Trial 15 finished with value: 0.17127798198717617 and parameters: {'model_type': 'gat', 'hidden_dims': '[512, 256]', 'dropout': 0.16427843933140435, 'batch_norm': True, 'gat_heads': 8, 'gat_attn_dropout': 0.2703365356641967, 'gat_concat_hidden': True, 'lr': 1.0948955842261321e-05, 'weight_decay': 3.0828332471720444e-07, 'epochs': 290, 'loss': 'mae', 'optimizer': 'adam', 'graph_mode': 'cutoff', 'cutoff': 0.8699328342264332, 'grm_norm': 'gcn', 'self_loops': True}. Best is trial 11 with value: 0.22279737900517124.
[I 2025-10-23 08:40:30,466] Trial 16 finished with value: 0.2080987884204693 and parameters: {'model_type': 'gat', 'hidden_dims': '[512, 256]', 'dropout': 0.4337768631587977, 'batch_norm': True, 'gat_heads': 7, 'gat_attn_dropout': 0.39990105865681413, 'gat_concat_hidden': True, 'lr': 0.00017271463727598583, 'weight_decay': 1.1251019146219692e-07, 'epochs': 317, 'loss': 'mae', 'optimizer': 'adam', 'graph_mode': 'cutoff', 'cutoff': 0.7025160829867918, 'grm_norm': 'gcn', 'self_loops': True}. Best is trial 11 with value: 0.22279737900517124.
[I 2025-10-23 08:48:30,358] Trial 17 finished with value: 0.2136979839945418 and parameters: {'model_type': 'gat', 'hidden_dims': '[512, 256]', 'dropout': 0.14682562041724406, 'batch_norm': True, 'gat_heads': 6, 'gat_attn_dropout': 0.5920583257501999, 'gat_concat_hidden': True, 'lr': 0.0004949423158135823, 'weight_decay': 3.859740273010918e-07, 'epochs': 258, 'loss': 'mae', 'optimizer': 'adam', 'graph_mode': 'cutoff', 'cutoff': 0.6791532686923003, 'grm_norm': 'cosine', 'self_loops': True}. Best is trial 11 with value: 0.22279737900517124.
[I 2025-10-23 09:00:44,740] Trial 18 finished with value: 0.1353803747782411 and parameters: {'model_type': 'gat', 'hidden_dims': '[512, 128]', 'dropout': 0.30817865657449356, 'batch_norm': False, 'gat_heads': 7, 'gat_attn_dropout': 0.45100373618933676, 'gat_concat_hidden': True, 'lr': 0.00016491682390326086, 'weight_decay': 0.0009391490866364236, 'epochs': 346, 'loss': 'mae', 'optimizer': 'adam', 'graph_mode': 'knn', 'source': 'grm', 'knn_k': 1, 'weighted_edges': False, 'symmetrize_mode': 'union'}. Best is trial 11 with value: 0.22279737900517124.
[I 2025-10-23 09:08:44,529] Trial 19 finished with value: 0.2096925536749715 and parameters: {'model_type': 'gat', 'hidden_dims': '[512, 256]', 'dropout': 0.21744683325985598, 'batch_norm': True, 'gat_heads': 5, 'gat_attn_dropout': 0.547085691211063, 'gat_concat_hidden': True, 'lr': 1.2550693142833744e-05, 'weight_decay': 2.443643243280606e-06, 'epochs': 304, 'loss': 'mae', 'optimizer': 'adam', 'graph_mode': 'cutoff', 'cutoff': 0.8375249382694765, 'grm_norm': 'gcn', 'self_loops': True}. Best is trial 11 with value: 0.22279737900517124.
[I 2025-10-23 09:20:02,935] Trial 20 finished with value: 0.20305804892366405 and parameters: {'model_type': 'gat', 'hidden_dims': '[512, 256]', 'dropout': 0.19610743902002528, 'batch_norm': True, 'gat_heads': 8, 'gat_attn_dropout': 0.3346957221214422, 'gat_concat_hidden': True, 'lr': 0.00010552294758659164, 'weight_decay': 6.359923488225596e-06, 'epochs': 261, 'loss': 'mae', 'optimizer': 'adam', 'graph_mode': 'cutoff', 'cutoff': 0.6248117900814779, 'grm_norm': 'gcn', 'self_loops': True}. Best is trial 11 with value: 0.22279737900517124.
[I 2025-10-23 09:34:49,117] Trial 21 finished with value: 0.22136520422308253 and parameters: {'model_type': 'gat', 'hidden_dims': '[512, 256]', 'dropout': 0.10385544585684935, 'batch_norm': True, 'gat_heads': 8, 'gat_attn_dropout': 0.5954859114204554, 'gat_concat_hidden': True, 'lr': 0.0002742284908609042, 'weight_decay': 5.109899989263935e-07, 'epochs': 348, 'loss': 'mae', 'optimizer': 'adam', 'graph_mode': 'cutoff', 'cutoff': 0.8958985548976812, 'grm_norm': 'gcn', 'self_loops': True}. Best is trial 11 with value: 0.22279737900517124.
[I 2025-10-23 09:49:40,988] Trial 22 finished with value: 0.21082399686116032 and parameters: {'model_type': 'gat', 'hidden_dims': '[512, 256]', 'dropout': 0.11140610203379375, 'batch_norm': True, 'gat_heads': 8, 'gat_attn_dropout': 0.5336927350470125, 'gat_concat_hidden': True, 'lr': 0.000576058717986372, 'weight_decay': 2.7481470538941676e-07, 'epochs': 350, 'loss': 'mae', 'optimizer': 'adam', 'graph_mode': 'cutoff', 'cutoff': 0.8198257293625725, 'grm_norm': 'gcn', 'self_loops': True}. Best is trial 11 with value: 0.22279737900517124.
[I 2025-10-23 09:59:29,353] Trial 23 finished with value: 0.21748852046386125 and parameters: {'model_type': 'gat', 'hidden_dims': '[512, 256]', 'dropout': 0.15586306394542412, 'batch_norm': True, 'gat_heads': 6, 'gat_attn_dropout': 0.599907770482127, 'gat_concat_hidden': True, 'lr': 0.0004026359428519834, 'weight_decay': 6.951444449336456e-07, 'epochs': 319, 'loss': 'mae', 'optimizer': 'adam', 'graph_mode': 'cutoff', 'cutoff': 0.8996602655489105, 'grm_norm': 'gcn', 'self_loops': True}. Best is trial 11 with value: 0.22279737900517124.
[I 2025-10-23 10:08:58,621] Trial 24 finished with value: 0.21850212759044912 and parameters: {'model_type': 'gat', 'hidden_dims': '[512, 256]', 'dropout': 0.1336279854534336, 'batch_norm': True, 'gat_heads': 7, 'gat_attn_dropout': 0.4499943323201273, 'gat_concat_hidden': True, 'lr': 0.0009697639157028259, 'weight_decay': 1.0151842129325907e-07, 'epochs': 260, 'loss': 'mae', 'optimizer': 'adam', 'graph_mode': 'cutoff', 'cutoff': 0.7853418903963469, 'grm_norm': 'gcn', 'self_loops': True}. Best is trial 11 with value: 0.22279737900517124.
[I 2025-10-23 10:18:23,197] Trial 25 finished with value: 0.2169666722326852 and parameters: {'model_type': 'gat', 'hidden_dims': '[512, 256]', 'dropout': 0.17947148287455889, 'batch_norm': True, 'gat_heads': 7, 'gat_attn_dropout': 0.4526651396445599, 'gat_concat_hidden': True, 'lr': 0.0008574271599502102, 'weight_decay': 2.579275132139982e-07, 'epochs': 257, 'loss': 'mae', 'optimizer': 'adam', 'graph_mode': 'cutoff', 'cutoff': 0.7733173673664706, 'grm_norm': 'cosine', 'self_loops': True}. Best is trial 11 with value: 0.22279737900517124.
[I 2025-10-23 10:20:19,576] Trial 26 finished with value: 0.19586684779734873 and parameters: {'model_type': 'gat', 'hidden_dims': '[128, 64]', 'dropout': 0.140574275586577, 'batch_norm': True, 'gat_heads': 7, 'gat_attn_dropout': 0.4173118227862795, 'gat_concat_hidden': False, 'lr': 0.0005474240472327417, 'weight_decay': 1.1453023620934408e-06, 'epochs': 186, 'loss': 'mae', 'optimizer': 'adam', 'graph_mode': 'cutoff', 'cutoff': 0.628446946184516, 'grm_norm': 'none', 'self_loops': True}. Best is trial 11 with value: 0.22279737900517124.
[I 2025-10-23 10:29:53,869] Trial 27 finished with value: 0.04709084255380958 and parameters: {'model_type': 'gat', 'hidden_dims': '[512, 128]', 'dropout': 0.29715306372114036, 'batch_norm': False, 'gat_heads': 6, 'gat_attn_dropout': 0.5283016762727794, 'gat_concat_hidden': True, 'lr': 0.00031005684333336664, 'weight_decay': 4.554052659841864e-07, 'epochs': 315, 'loss': 'mse', 'optimizer': 'adam', 'graph_mode': 'knn', 'source': 'grm', 'knn_k': 1, 'weighted_edges': True, 'symmetrize_mode': 'union'}. Best is trial 11 with value: 0.22279737900517124.
[I 2025-10-23 10:32:43,655] Trial 28 finished with value: 0.2022579659150448 and parameters: {'model_type': 'gat', 'hidden_dims': '[256, 128]', 'dropout': 0.3954087632526264, 'batch_norm': True, 'gat_heads': 4, 'gat_attn_dropout': 0.482829497293067, 'gat_concat_hidden': True, 'lr': 0.00012061549666904469, 'weight_decay': 2.1995778934419813e-07, 'epochs': 275, 'loss': 'mae', 'optimizer': 'adam', 'graph_mode': 'cutoff', 'cutoff': 0.7967191867030256, 'grm_norm': 'gcn', 'self_loops': True}. Best is trial 11 with value: 0.22279737900517124.
[I 2025-10-23 10:35:16,550] Trial 29 finished with value: 0.12752355209125885 and parameters: {'model_type': 'gat', 'hidden_dims': '[128, 64]', 'dropout': 0.19733772504875322, 'batch_norm': True, 'gat_heads': 8, 'gat_attn_dropout': 0.4106504866736904, 'gat_concat_hidden': True, 'lr': 0.0006979536706677178, 'weight_decay': 2.1009735433049286e-06, 'epochs': 238, 'loss': 'mse', 'optimizer': 'adam', 'graph_mode': 'knn', 'source': 'grm', 'knn_k': 4, 'weighted_edges': False, 'symmetrize_mode': 'union'}. Best is trial 11 with value: 0.22279737900517124.
[I 2025-10-23 10:42:54,759] Trial 30 finished with value: 0.20562777206097343 and parameters: {'model_type': 'gat', 'hidden_dims': '[512, 256]', 'dropout': 0.10045470659095267, 'batch_norm': True, 'gat_heads': 7, 'gat_attn_dropout': 0.346051328938881, 'gat_concat_hidden': True, 'lr': 2.174401262896829e-05, 'weight_decay': 1.8012259865689446e-07, 'epochs': 206, 'loss': 'mae', 'optimizer': 'adam', 'graph_mode': 'cutoff', 'cutoff': 0.71327368091722, 'grm_norm': 'gcn', 'self_loops': True}. Best is trial 11 with value: 0.22279737900517124.
[I 2025-10-23 10:56:52,508] Trial 31 finished with value: 0.21360213904995748 and parameters: {'model_type': 'gat', 'hidden_dims': '[512, 256]', 'dropout': 0.13470448809479382, 'batch_norm': True, 'gat_heads': 8, 'gat_attn_dropout': 0.5581837009366427, 'gat_concat_hidden': True, 'lr': 0.0002357064764205623, 'weight_decay': 1.1693313340317123e-07, 'epochs': 328, 'loss': 'mae', 'optimizer': 'adam', 'graph_mode': 'cutoff', 'cutoff': 0.8233348286604072, 'grm_norm': 'gcn', 'self_loops': True}. Best is trial 11 with value: 0.22279737900517124.
[I 2025-10-23 11:09:51,581] Trial 32 finished with value: 0.21519246751895352 and parameters: {'model_type': 'gat', 'hidden_dims': '[512, 256]', 'dropout': 0.1293275233773668, 'batch_norm': True, 'gat_heads': 8, 'gat_attn_dropout': 0.5539911341769007, 'gat_concat_hidden': True, 'lr': 0.00033928178406129607, 'weight_decay': 1.0256081441044243e-07, 'epochs': 304, 'loss': 'mae', 'optimizer': 'adam', 'graph_mode': 'cutoff', 'cutoff': 0.8668952108809747, 'grm_norm': 'gcn', 'self_loops': True}. Best is trial 11 with value: 0.22279737900517124.
[I 2025-10-23 11:21:18,758] Trial 33 finished with value: 0.20686731699728442 and parameters: {'model_type': 'gat', 'hidden_dims': '[512, 64]', 'dropout': 0.17859796051826557, 'batch_norm': True, 'gat_heads': 7, 'gat_attn_dropout': 0.5163941057991878, 'gat_concat_hidden': True, 'lr': 6.108946233113338e-05, 'weight_decay': 4.856866254669226e-07, 'epochs': 328, 'loss': 'mae', 'optimizer': 'adam', 'graph_mode': 'cutoff', 'cutoff': 0.8407931374190984, 'grm_norm': 'gcn', 'self_loops': True}. Best is trial 11 with value: 0.22279737900517124.
[I 2025-10-23 11:35:32,850] Trial 34 finished with value: 0.18862387583220427 and parameters: {'model_type': 'gat', 'hidden_dims': '[512, 256]', 'dropout': 0.2224790493273589, 'batch_norm': True, 'gat_heads': 8, 'gat_attn_dropout': 0.4498687659804328, 'gat_concat_hidden': False, 'lr': 0.0009455909107139812, 'weight_decay': 2.2048594572790072e-07, 'epochs': 350, 'loss': 'mse', 'optimizer': 'adam', 'graph_mode': 'cutoff', 'cutoff': 0.7892338436080316, 'grm_norm': 'gcn', 'self_loops': True}. Best is trial 11 with value: 0.22279737900517124.
[I 2025-10-23 11:43:19,984] Trial 35 finished with value: 0.2173101026534471 and parameters: {'model_type': 'gat', 'hidden_dims': '[512, 256]', 'dropout': 0.2592095938972214, 'batch_norm': True, 'gat_heads': 8, 'gat_attn_dropout': 0.5707361096801102, 'gat_concat_hidden': True, 'lr': 0.0004351887749850936, 'weight_decay': 1.0143409623606156e-07, 'epochs': 177, 'loss': 'mae', 'optimizer': 'adam', 'graph_mode': 'cutoff', 'cutoff': 0.8939012101441502, 'grm_norm': 'gcn', 'self_loops': True}. Best is trial 11 with value: 0.22279737900517124.
[I 2025-10-23 11:49:09,998] Trial 36 finished with value: 0.15767794051601353 and parameters: {'model_type': 'gat', 'hidden_dims': '[256, 128]', 'dropout': 0.1314987580789147, 'batch_norm': False, 'gat_heads': 7, 'gat_attn_dropout': 0.22203501175780513, 'gat_concat_hidden': True, 'lr': 3.919578527411749e-06, 'weight_decay': 2.158696041611755e-07, 'epochs': 304, 'loss': 'mae', 'optimizer': 'adam', 'graph_mode': 'knn', 'source': 'grm', 'knn_k': 10, 'weighted_edges': True, 'symmetrize_mode': 'union'}. Best is trial 11 with value: 0.22279737900517124.
[I 2025-10-23 11:58:04,158] Trial 37 finished with value: 0.19372478740039895 and parameters: {'model_type': 'gat', 'hidden_dims': '[512, 64]', 'dropout': 0.1867834935650701, 'batch_norm': True, 'gat_heads': 6, 'gat_attn_dropout': 0.48675437698954466, 'gat_concat_hidden': False, 'lr': 0.00014497307551898086, 'weight_decay': 1.6189410576819586e-05, 'epochs': 298, 'loss': 'mae', 'optimizer': 'adam', 'graph_mode': 'cutoff', 'cutoff': 0.7405327654133004, 'grm_norm': 'gcn', 'self_loops': True}. Best is trial 11 with value: 0.22279737900517124.
[I 2025-10-23 11:59:34,369] Trial 38 finished with value: 0.22437209937629396 and parameters: {'model_type': 'gat', 'hidden_dims': '[128, 64]', 'dropout': 0.5990729612712297, 'batch_norm': False, 'gat_heads': 4, 'gat_attn_dropout': 0.018574713627651784, 'gat_concat_hidden': True, 'lr': 6.644213669058895e-05, 'weight_decay': 1.1570889088669637e-06, 'epochs': 275, 'loss': 'mse', 'optimizer': 'adam', 'graph_mode': 'cutoff', 'cutoff': 0.6281254750385125, 'grm_norm': 'none', 'self_loops': False}. Best is trial 38 with value: 0.22437209937629396.
[I 2025-10-23 12:00:18,408] Trial 39 finished with value: 0.18671432994983211 and parameters: {'model_type': 'gat', 'hidden_dims': '[128, 64]', 'dropout': 0.5779117875046005, 'batch_norm': False, 'gat_heads': 4, 'gat_attn_dropout': 0.0663725472231953, 'gat_concat_hidden': False, 'lr': 6.710874319987582e-05, 'weight_decay': 1.2176609684774952e-06, 'epochs': 124, 'loss': 'mse', 'optimizer': 'adam', 'graph_mode': 'knn', 'source': 'grm', 'knn_k': 3, 'weighted_edges': True, 'symmetrize_mode': 'mutual'}. Best is trial 38 with value: 0.22437209937629396.
[I 2025-10-23 12:01:46,340] Trial 40 finished with value: 0.21933635519694367 and parameters: {'model_type': 'gat', 'hidden_dims': '[128, 64]', 'dropout': 0.4954265617282415, 'batch_norm': False, 'gat_heads': 4, 'gat_attn_dropout': 0.20198076070319418, 'gat_concat_hidden': True, 'lr': 3.192039494873291e-05, 'weight_decay': 5.226016137238107e-06, 'epochs': 269, 'loss': 'mse', 'optimizer': 'adam', 'graph_mode': 'cutoff', 'cutoff': 0.6539435525980286, 'grm_norm': 'none', 'self_loops': False}. Best is trial 38 with value: 0.22437209937629396.
[I 2025-10-23 12:02:53,657] Trial 41 finished with value: 0.19502073991926427 and parameters: {'model_type': 'gat', 'hidden_dims': '[128, 64]', 'dropout': 0.5301420734890371, 'batch_norm': False, 'gat_heads': 3, 'gat_attn_dropout': 0.022485559184581665, 'gat_concat_hidden': True, 'lr': 4.005674893087388e-05, 'weight_decay': 4.6726937795737434e-06, 'epochs': 243, 'loss': 'mse', 'optimizer': 'adam', 'graph_mode': 'cutoff', 'cutoff': 0.586309124061003, 'grm_norm': 'none', 'self_loops': False}. Best is trial 38 with value: 0.22437209937629396.
[I 2025-10-23 12:04:05,761] Trial 42 finished with value: 0.20120145401114414 and parameters: {'model_type': 'gat', 'hidden_dims': '[128, 64]', 'dropout': 0.48534326099449554, 'batch_norm': False, 'gat_heads': 4, 'gat_attn_dropout': 0.1602917947464571, 'gat_concat_hidden': True, 'lr': 2.1488447486203784e-05, 'weight_decay': 1.5908606110808042e-06, 'epochs': 217, 'loss': 'mse', 'optimizer': 'adam', 'graph_mode': 'cutoff', 'cutoff': 0.6636545050321064, 'grm_norm': 'none', 'self_loops': False}. Best is trial 38 with value: 0.22437209937629396.
[I 2025-10-23 12:05:20,051] Trial 43 finished with value: 0.1691288632040637 and parameters: {'model_type': 'gat', 'hidden_dims': '[128, 64]', 'dropout': 0.5994064248530949, 'batch_norm': False, 'gat_heads': 3, 'gat_attn_dropout': 0.06840436498633264, 'gat_concat_hidden': True, 'lr': 3.7325280491556935e-05, 'weight_decay': 3.4595027545773174e-06, 'epochs': 269, 'loss': 'mse', 'optimizer': 'adam', 'graph_mode': 'cutoff', 'cutoff': 0.5576391228450966, 'grm_norm': 'none', 'self_loops': False}. Best is trial 38 with value: 0.22437209937629396.
[I 2025-10-23 12:06:58,693] Trial 44 finished with value: 0.18669073302033962 and parameters: {'model_type': 'gat', 'hidden_dims': '[128, 64]', 'dropout': 0.4735026011006576, 'batch_norm': False, 'gat_heads': 5, 'gat_attn_dropout': 0.20320891830566418, 'gat_concat_hidden': True, 'lr': 1.5006379676206781e-05, 'weight_decay': 1.1898110300230983e-05, 'epochs': 221, 'loss': 'mse', 'optimizer': 'adam', 'graph_mode': 'cutoff', 'cutoff': 0.6420376309937802, 'grm_norm': 'none', 'self_loops': False}. Best is trial 38 with value: 0.22437209937629396.
[I 2025-10-23 12:09:39,363] Trial 45 finished with value: 0.1956064172806596 and parameters: {'model_type': 'gat', 'hidden_dims': '[256, 128, 64]', 'dropout': 0.5561242055995537, 'batch_norm': False, 'gat_heads': 4, 'gat_attn_dropout': 0.24831189923593078, 'gat_concat_hidden': True, 'lr': 6.676659758960979e-06, 'weight_decay': 9.129821017008894e-07, 'epochs': 250, 'loss': 'mse', 'optimizer': 'adam', 'graph_mode': 'cutoff', 'cutoff': 0.47554852079745974, 'grm_norm': 'cosine_then_gcn', 'self_loops': False}. Best is trial 38 with value: 0.22437209937629396.
[I 2025-10-23 12:10:59,154] Trial 46 finished with value: 0.14792262252150595 and parameters: {'model_type': 'gat', 'hidden_dims': '[128, 64]', 'dropout': 0.5154593474920365, 'batch_norm': False, 'gat_heads': 3, 'gat_attn_dropout': 0.3143578014413122, 'gat_concat_hidden': True, 'lr': 7.339530530213362e-05, 'weight_decay': 5.251082342903119e-07, 'epochs': 281, 'loss': 'mse', 'optimizer': 'adam', 'graph_mode': 'cutoff', 'cutoff': 0.24486855632848914, 'grm_norm': 'none', 'self_loops': False}. Best is trial 38 with value: 0.22437209937629396.
[I 2025-10-23 12:14:54,992] Trial 47 finished with value: -0.0177500747076178 and parameters: {'model_type': 'gat', 'hidden_dims': '[256, 128, 64]', 'dropout': 0.4202550625866859, 'batch_norm': False, 'gat_heads': 5, 'gat_attn_dropout': 0.39004000845883685, 'gat_concat_hidden': True, 'lr': 1.4620837494547313e-06, 'weight_decay': 7.889902519211753e-06, 'epochs': 275, 'loss': 'mse', 'optimizer': 'adam', 'graph_mode': 'cutoff', 'cutoff': 0.6001544273622138, 'grm_norm': 'none', 'self_loops': False}. Best is trial 38 with value: 0.22437209937629396.
[I 2025-10-23 12:15:05,715] Trial 48 finished with value: 0.026804045913406627 and parameters: {'model_type': 'gat', 'hidden_dims': '[128, 64]', 'dropout': 0.4380962663217993, 'batch_norm': False, 'gat_heads': 2, 'gat_attn_dropout': 0.003477731083912885, 'gat_concat_hidden': False, 'lr': 0.0007001827663592097, 'weight_decay': 0.0001402511285089815, 'epochs': 40, 'loss': 'mse', 'optimizer': 'adam', 'graph_mode': 'cutoff', 'cutoff': 0.728632867866762, 'grm_norm': 'cosine_then_gcn', 'self_loops': False}. Best is trial 38 with value: 0.22437209937629396.
[I 2025-10-23 12:21:06,218] Trial 49 finished with value: 0.20906795411932574 and parameters: {'model_type': 'gat', 'hidden_dims': '[512, 64]', 'dropout': 0.36067134657864786, 'batch_norm': False, 'gat_heads': 4, 'gat_attn_dropout': 0.09619627036717812, 'gat_concat_hidden': True, 'lr': 4.614271729770007e-05, 'weight_decay': 5.0616507219699575e-05, 'epochs': 291, 'loss': 'mse', 'optimizer': 'adam', 'graph_mode': 'cutoff', 'cutoff': 0.5329580884583218, 'grm_norm': 'none', 'self_loops': False}. Best is trial 38 with value: 0.22437209937629396.
[I 2025-10-23 12:24:06,599] Trial 50 finished with value: 0.15251012053417387 and parameters: {'model_type': 'gat', 'hidden_dims': '[256, 128]', 'dropout': 0.33524750644973367, 'batch_norm': False, 'gat_heads': 5, 'gat_attn_dropout': 0.1675711166644341, 'gat_concat_hidden': True, 'lr': 2.8484304627253243e-05, 'weight_decay': 2.1703691362528342e-05, 'epochs': 200, 'loss': 'mse', 'optimizer': 'adam', 'graph_mode': 'knn', 'source': 'grm', 'knn_k': 7, 'weighted_edges': False, 'symmetrize_mode': 'union'}. Best is trial 38 with value: 0.22437209937629396.
[I 2025-10-23 12:38:21,230] Trial 51 finished with value: 0.22287312886768446 and parameters: {'model_type': 'gat', 'hidden_dims': '[512, 256]', 'dropout': 0.1180047197217765, 'batch_norm': True, 'gat_heads': 8, 'gat_attn_dropout': 0.5744391158018898, 'gat_concat_hidden': True, 'lr': 0.0002085138519722067, 'weight_decay': 1.5693275455687424e-07, 'epochs': 335, 'loss': 'mae', 'optimizer': 'adam', 'graph_mode': 'cutoff', 'cutoff': 0.862969083631521, 'grm_norm': 'cosine', 'self_loops': False}. Best is trial 38 with value: 0.22437209937629396.
[I 2025-10-23 12:52:10,644] Trial 52 finished with value: 0.22126105548185748 and parameters: {'model_type': 'gat', 'hidden_dims': '[512, 256]', 'dropout': 0.571140018298968, 'batch_norm': True, 'gat_heads': 8, 'gat_attn_dropout': 0.5824456789476038, 'gat_concat_hidden': True, 'lr': 0.00027879814105362903, 'weight_decay': 1.8271465524523475e-07, 'epochs': 325, 'loss': 'mae', 'optimizer': 'adam', 'graph_mode': 'cutoff', 'cutoff': 0.7966508902125358, 'grm_norm': 'cosine', 'self_loops': False}. Best is trial 38 with value: 0.22437209937629396.
[I 2025-10-23 13:05:55,469] Trial 53 finished with value: 0.22621709057512146 and parameters: {'model_type': 'gat', 'hidden_dims': '[512, 128]', 'dropout': 0.5548172651194964, 'batch_norm': True, 'gat_heads': 8, 'gat_attn_dropout': 0.5780787040060499, 'gat_concat_hidden': True, 'lr': 8.788676420005438e-05, 'weight_decay': 3.872121032878392e-07, 'epochs': 331, 'loss': 'mae', 'optimizer': 'adam', 'graph_mode': 'cutoff', 'cutoff': 0.8543530506087786, 'grm_norm': 'cosine', 'self_loops': False}. Best is trial 53 with value: 0.22621709057512146.
