[I 2025-11-03 15:13:20,384] Trial 139 finished with value: 0.024689163700665612 and parameters: {'model_type': 'graphsage', 'hidden_dims': '[512, 256]', 'dropout': 0.24176531859514447, 'batch_norm': True, 'lr': 5.7711600389985324e-05, 'weight_decay': 4.029166792482805e-06, 'epochs': 115, 'loss': 'mse', 'optimizer': 'adam', 'graph_mode': 'knn', 'source': 'grm', 'knn_k': 6, 'weighted_edges': True, 'symmetrize_mode': 'union', 'use_snp_selection': False}. Best is trial 120 with value: 0.07448932720724062.
[I 2025-11-03 15:13:23,282] Trial 140 finished with value: 0.038647904980343234 and parameters: {'model_type': 'graphsage', 'hidden_dims': '[512, 256]', 'dropout': 0.19970140259798597, 'batch_norm': True, 'lr': 0.00033906842428021777, 'weight_decay': 2.9900962215261457e-06, 'epochs': 87, 'loss': 'mse', 'optimizer': 'adam', 'graph_mode': 'knn', 'source': 'grm', 'knn_k': 5, 'weighted_edges': True, 'symmetrize_mode': 'union', 'use_snp_selection': False}. Best is trial 120 with value: 0.07448932720724062.
[I 2025-11-03 15:13:25,972] Trial 141 finished with value: 0.04461846954610196 and parameters: {'model_type': 'graphsage', 'hidden_dims': '[512, 256]', 'dropout': 0.22849205467646647, 'batch_norm': True, 'lr': 0.0007374476359254027, 'weight_decay': 1.4889599528943523e-06, 'epochs': 62, 'loss': 'mse', 'optimizer': 'adam', 'graph_mode': 'knn', 'source': 'grm', 'knn_k': 6, 'weighted_edges': True, 'symmetrize_mode': 'union', 'use_snp_selection': False}. Best is trial 120 with value: 0.07448932720724062.
[I 2025-11-03 15:13:28,558] Trial 142 finished with value: 0.05417717857021512 and parameters: {'model_type': 'graphsage', 'hidden_dims': '[512, 256]', 'dropout': 0.20826172766423504, 'batch_norm': True, 'lr': 0.0006792924919676308, 'weight_decay': 2.2673745044854997e-06, 'epochs': 51, 'loss': 'mse', 'optimizer': 'adam', 'graph_mode': 'knn', 'source': 'grm', 'knn_k': 6, 'weighted_edges': True, 'symmetrize_mode': 'union', 'use_snp_selection': False}. Best is trial 120 with value: 0.07448932720724062.
[I 2025-11-03 15:13:31,382] Trial 143 finished with value: 0.05568363990637101 and parameters: {'model_type': 'graphsage', 'hidden_dims': '[512, 256]', 'dropout': 0.2129937770678653, 'batch_norm': True, 'lr': 0.0006380284349742487, 'weight_decay': 1.1096634555500654e-06, 'epochs': 76, 'loss': 'mse', 'optimizer': 'adam', 'graph_mode': 'knn', 'source': 'grm', 'knn_k': 6, 'weighted_edges': True, 'symmetrize_mode': 'union', 'use_snp_selection': False}. Best is trial 120 with value: 0.07448932720724062.
[I 2025-11-03 15:13:34,187] Trial 144 finished with value: 0.046951789885005285 and parameters: {'model_type': 'graphsage', 'hidden_dims': '[512, 256]', 'dropout': 0.21496409143558493, 'batch_norm': True, 'lr': 0.0006401480841900885, 'weight_decay': 1.1086296495552552e-06, 'epochs': 74, 'loss': 'mse', 'optimizer': 'adam', 'graph_mode': 'knn', 'source': 'grm', 'knn_k': 6, 'weighted_edges': True, 'symmetrize_mode': 'union', 'use_snp_selection': False}. Best is trial 120 with value: 0.07448932720724062.
[I 2025-11-03 15:13:38,754] Trial 145 finished with value: 0.04232950247388465 and parameters: {'model_type': 'graphsage', 'hidden_dims': '[512, 256]', 'dropout': 0.21003619742053653, 'batch_norm': True, 'lr': 0.0005612238738362388, 'weight_decay': 6.418842121148909e-07, 'epochs': 259, 'loss': 'mse', 'optimizer': 'adam', 'graph_mode': 'knn', 'source': 'grm', 'knn_k': 6, 'weighted_edges': True, 'symmetrize_mode': 'union', 'use_snp_selection': False}. Best is trial 120 with value: 0.07448932720724062.
[I 2025-11-03 15:13:42,463] Trial 146 finished with value: 0.04136622558575768 and parameters: {'model_type': 'graphsage', 'hidden_dims': '[512, 256]', 'dropout': 0.1887739308882988, 'batch_norm': True, 'lr': 0.0008854135325700876, 'weight_decay': 1.699092945841498e-06, 'epochs': 169, 'loss': 'mse', 'optimizer': 'adam', 'graph_mode': 'knn', 'source': 'grm', 'knn_k': 6, 'weighted_edges': True, 'symmetrize_mode': 'union', 'use_snp_selection': False}. Best is trial 120 with value: 0.07448932720724062.
[I 2025-11-03 15:13:45,200] Trial 147 finished with value: 0.03680300975969664 and parameters: {'model_type': 'graphsage', 'hidden_dims': '[512, 256]', 'dropout': 0.24986266153693582, 'batch_norm': True, 'lr': 0.0005068506812023031, 'weight_decay': 2.1973348065410067e-06, 'epochs': 64, 'loss': 'mse', 'optimizer': 'adam', 'graph_mode': 'knn', 'source': 'grm', 'knn_k': 7, 'weighted_edges': True, 'symmetrize_mode': 'union', 'use_snp_selection': False}. Best is trial 120 with value: 0.07448932720724062.
[I 2025-11-03 15:13:47,785] Trial 148 finished with value: 0.04674178684148286 and parameters: {'model_type': 'graphsage', 'hidden_dims': '[512, 256]', 'dropout': 0.22080089600109862, 'batch_norm': True, 'lr': 0.0006952010811355725, 'weight_decay': 1.300543125069827e-06, 'epochs': 51, 'loss': 'mse', 'optimizer': 'adam', 'graph_mode': 'knn', 'source': 'grm', 'knn_k': 6, 'weighted_edges': True, 'symmetrize_mode': 'union', 'use_snp_selection': False}. Best is trial 120 with value: 0.07448932720724062.
[I 2025-11-03 15:13:50,667] Trial 149 finished with value: 0.043816861554896065 and parameters: {'model_type': 'graphsage', 'hidden_dims': '[512, 256]', 'dropout': 0.17098907790363027, 'batch_norm': True, 'lr': 0.00043883506785551114, 'weight_decay': 9.821467550606592e-07, 'epochs': 79, 'loss': 'mse', 'optimizer': 'adam', 'graph_mode': 'knn', 'source': 'grm', 'knn_k': 7, 'weighted_edges': True, 'symmetrize_mode': 'union', 'use_snp_selection': False}. Best is trial 120 with value: 0.07448932720724062.
[I 2025-11-03 15:14:23,339] Trial 0 finished with value: -0.0013094673888665895 and parameters: {'model_type': 'graphsage', 'hidden_dims': '[128, 64]', 'dropout': 0.199031432379812, 'batch_norm': True, 'lr': 1.8408544111075837e-06, 'weight_decay': 5.5136510071208614e-05, 'epochs': 336, 'loss': 'mae', 'optimizer': 'adam', 'graph_mode': 'knn', 'source': 'grm', 'knn_k': 8, 'weighted_edges': True, 'symmetrize_mode': 'mutual', 'use_snp_selection': False}. Best is trial 0 with value: -0.0013094673888665895.
[I 2025-11-03 15:14:24,819] Trial 1 finished with value: 0.0548512848496416 and parameters: {'model_type': 'graphsage', 'hidden_dims': '[128, 64]', 'dropout': 0.40051947670227217, 'batch_norm': True, 'lr': 0.0005320428882732732, 'weight_decay': 1.89210117736594e-06, 'epochs': 68, 'loss': 'mse', 'optimizer': 'adam', 'graph_mode': 'knn', 'source': 'grm', 'knn_k': 7, 'weighted_edges': True, 'symmetrize_mode': 'union', 'use_snp_selection': False}. Best is trial 1 with value: 0.0548512848496416.
[I 2025-11-03 15:14:27,179] Trial 2 finished with value: 0.02593704126982689 and parameters: {'model_type': 'graphsage', 'hidden_dims': '[256, 128]', 'dropout': 0.5105528289184642, 'batch_norm': False, 'lr': 0.0006804279372404962, 'weight_decay': 0.0008922815224257085, 'epochs': 181, 'loss': 'mse', 'optimizer': 'adam', 'graph_mode': 'cutoff', 'cutoff': 0.5741905641612706, 'grm_norm': 'gcn', 'self_loops': False, 'use_snp_selection': True, 'num_snps': 26910}. Best is trial 1 with value: 0.0548512848496416.
[I 2025-11-03 15:14:29,694] Trial 3 finished with value: -0.0027253452638903858 and parameters: {'model_type': 'graphsage', 'hidden_dims': '[256, 128, 64]', 'dropout': 0.5390483213624292, 'batch_norm': False, 'lr': 3.4705625989073525e-05, 'weight_decay': 2.4623319020131338e-05, 'epochs': 121, 'loss': 'mse', 'optimizer': 'adam', 'graph_mode': 'knn', 'source': 'grm', 'knn_k': 6, 'weighted_edges': False, 'symmetrize_mode': 'mutual', 'use_snp_selection': True, 'num_snps': 30713}. Best is trial 1 with value: 0.0548512848496416.
[I 2025-11-03 15:14:32,097] Trial 4 finished with value: 0.01552273550949751 and parameters: {'model_type': 'graphsage', 'hidden_dims': '[128, 64]', 'dropout': 0.13404863676897502, 'batch_norm': False, 'lr': 0.0001431556295367288, 'weight_decay': 2.2084517750726675e-05, 'epochs': 51, 'loss': 'mae', 'optimizer': 'adam', 'graph_mode': 'cutoff', 'cutoff': 0.6714268476993044, 'grm_norm': 'none', 'self_loops': False, 'use_snp_selection': True, 'num_snps': 45645}. Best is trial 1 with value: 0.0548512848496416.
[I 2025-11-03 15:14:35,106] Trial 5 finished with value: 0.0070446771495598325 and parameters: {'model_type': 'graphsage', 'hidden_dims': '[256, 128]', 'dropout': 0.42253606323412096, 'batch_norm': False, 'lr': 4.238630400638805e-05, 'weight_decay': 8.074086040046576e-07, 'epochs': 158, 'loss': 'mae', 'optimizer': 'adam', 'graph_mode': 'knn', 'source': 'grm', 'knn_k': 1, 'weighted_edges': False, 'symmetrize_mode': 'mutual', 'use_snp_selection': True, 'num_snps': 43113}. Best is trial 1 with value: 0.0548512848496416.
[I 2025-11-03 15:14:38,769] Trial 6 finished with value: 0.05945137142719693 and parameters: {'model_type': 'graphsage', 'hidden_dims': '[512, 256]', 'dropout': 0.3534893146320237, 'batch_norm': True, 'lr': 0.000251307964226932, 'weight_decay': 1.821819791794022e-05, 'epochs': 223, 'loss': 'mae', 'optimizer': 'adam', 'graph_mode': 'knn', 'source': 'grm', 'knn_k': 1, 'weighted_edges': True, 'symmetrize_mode': 'mutual', 'use_snp_selection': False}. Best is trial 6 with value: 0.05945137142719693.
[I 2025-11-03 15:14:42,127] Trial 7 finished with value: 0.028970496483945656 and parameters: {'model_type': 'graphsage', 'hidden_dims': '[512, 256]', 'dropout': 0.1105825955860775, 'batch_norm': True, 'lr': 2.374338412754043e-05, 'weight_decay': 1.1284721123340274e-05, 'epochs': 190, 'loss': 'mse', 'optimizer': 'adam', 'graph_mode': 'cutoff', 'cutoff': 0.719872204109604, 'grm_norm': 'gcn', 'self_loops': False, 'use_snp_selection': False}. Best is trial 6 with value: 0.05945137142719693.
[I 2025-11-03 15:14:45,078] Trial 8 finished with value: 0.039679544368147385 and parameters: {'model_type': 'graphsage', 'hidden_dims': '[512, 128]', 'dropout': 0.5066580418354021, 'batch_norm': True, 'lr': 0.00039213678276659976, 'weight_decay': 3.43655320802934e-06, 'epochs': 120, 'loss': 'mse', 'optimizer': 'adam', 'graph_mode': 'cutoff', 'cutoff': 0.34923059576505366, 'grm_norm': 'cosine', 'self_loops': True, 'use_snp_selection': False}. Best is trial 6 with value: 0.05945137142719693.
[I 2025-11-03 15:14:47,055] Trial 9 finished with value: -0.008729424457857309 and parameters: {'model_type': 'graphsage', 'hidden_dims': '[512, 256]', 'dropout': 0.301734920240333, 'batch_norm': False, 'lr': 6.650961854953448e-06, 'weight_decay': 6.861575656590315e-05, 'epochs': 150, 'loss': 'mae', 'optimizer': 'adam', 'graph_mode': 'cutoff', 'cutoff': 0.2857569870061939, 'grm_norm': 'cosine_then_gcn', 'self_loops': False, 'use_snp_selection': True, 'num_snps': 12722}. Best is trial 6 with value: 0.05945137142719693.
[I 2025-11-03 15:14:51,113] Trial 10 finished with value: 0.050479296632304535 and parameters: {'model_type': 'graphsage', 'hidden_dims': '[512, 64]', 'dropout': 0.2833599465317005, 'batch_norm': True, 'lr': 0.00016916760584270694, 'weight_decay': 1.7866650996308468e-07, 'epochs': 275, 'loss': 'mae', 'optimizer': 'adam', 'graph_mode': 'knn', 'source': 'grm', 'knn_k': 1, 'weighted_edges': True, 'symmetrize_mode': 'union', 'use_snp_selection': False}. Best is trial 6 with value: 0.05945137142719693.
[I 2025-11-03 15:14:55,492] Trial 11 finished with value: 0.0319190267669132 and parameters: {'model_type': 'graphsage', 'hidden_dims': '[512, 256]', 'dropout': 0.3719635790172371, 'batch_norm': True, 'lr': 0.000791308626346835, 'weight_decay': 1.8187594072837697e-06, 'epochs': 255, 'loss': 'mse', 'optimizer': 'adam', 'graph_mode': 'knn', 'source': 'grm', 'knn_k': 10, 'weighted_edges': True, 'symmetrize_mode': 'union', 'use_snp_selection': False}. Best is trial 6 with value: 0.05945137142719693.
[I 2025-11-03 15:14:56,926] Trial 12 finished with value: 0.03345617397062048 and parameters: {'model_type': 'graphsage', 'hidden_dims': '[128, 64]', 'dropout': 0.41773763149008103, 'batch_norm': True, 'lr': 0.0001801553390925429, 'weight_decay': 0.00031248060348503496, 'epochs': 51, 'loss': 'mse', 'optimizer': 'adam', 'graph_mode': 'knn', 'source': 'grm', 'knn_k': 4, 'weighted_edges': True, 'symmetrize_mode': 'union', 'use_snp_selection': False}. Best is trial 6 with value: 0.05945137142719693.
[I 2025-11-03 15:15:00,762] Trial 13 finished with value: 0.023057377163698198 and parameters: {'model_type': 'graphsage', 'hidden_dims': '[512, 64]', 'dropout': 0.3250149154293312, 'batch_norm': True, 'lr': 7.355407310724191e-05, 'weight_decay': 2.988812407507651e-07, 'epochs': 242, 'loss': 'mae', 'optimizer': 'adam', 'graph_mode': 'knn', 'source': 'grm', 'knn_k': 5, 'weighted_edges': True, 'symmetrize_mode': 'mutual', 'use_snp_selection': False}. Best is trial 6 with value: 0.05945137142719693.
[I 2025-11-03 15:15:03,486] Trial 14 finished with value: 0.03283506616540825 and parameters: {'model_type': 'graphsage', 'hidden_dims': '[256, 128, 64]', 'dropout': 0.23252090215536952, 'batch_norm': True, 'lr': 0.0003914135064248066, 'weight_decay': 5.098763140321504e-06, 'epochs': 223, 'loss': 'mae', 'optimizer': 'adam', 'graph_mode': 'knn', 'source': 'grm', 'knn_k': 7, 'weighted_edges': True, 'symmetrize_mode': 'union', 'use_snp_selection': False}. Best is trial 6 with value: 0.05945137142719693.
[I 2025-11-03 15:15:07,674] Trial 15 finished with value: 0.01557060408467037 and parameters: {'model_type': 'graphsage', 'hidden_dims': '[512, 128]', 'dropout': 0.5933810085595006, 'batch_norm': True, 'lr': 1.2566698097454751e-05, 'weight_decay': 7.384906228399337e-07, 'epochs': 297, 'loss': 'mse', 'optimizer': 'adam', 'graph_mode': 'knn', 'source': 'grm', 'knn_k': 3, 'weighted_edges': True, 'symmetrize_mode': 'mutual', 'use_snp_selection': False}. Best is trial 6 with value: 0.05945137142719693.
[I 2025-11-03 15:15:09,279] Trial 16 finished with value: 0.03506655974048584 and parameters: {'model_type': 'graphsage', 'hidden_dims': '[128, 64]', 'dropout': 0.41856126883788003, 'batch_norm': True, 'lr': 0.00029530871976386335, 'weight_decay': 0.00014313216436470687, 'epochs': 92, 'loss': 'mae', 'optimizer': 'adam', 'graph_mode': 'knn', 'source': 'grm', 'knn_k': 8, 'weighted_edges': False, 'symmetrize_mode': 'union', 'use_snp_selection': False}. Best is trial 6 with value: 0.05945137142719693.
[I 2025-11-03 15:15:12,861] Trial 17 finished with value: 0.037693518858869166 and parameters: {'model_type': 'graphsage', 'hidden_dims': '[512, 256]', 'dropout': 0.365087750354523, 'batch_norm': True, 'lr': 9.025126066984405e-05, 'weight_decay': 8.09037698834493e-06, 'epochs': 204, 'loss': 'mse', 'optimizer': 'adam', 'graph_mode': 'knn', 'source': 'grm', 'knn_k': 3, 'weighted_edges': True, 'symmetrize_mode': 'union', 'use_snp_selection': False}. Best is trial 6 with value: 0.05945137142719693.
[I 2025-11-03 15:15:14,425] Trial 18 finished with value: 0.03947720906955488 and parameters: {'model_type': 'graphsage', 'hidden_dims': '[128, 64]', 'dropout': 0.4603741939916354, 'batch_norm': True, 'lr': 0.0009723760929408968, 'weight_decay': 1.642642555272364e-06, 'epochs': 85, 'loss': 'mse', 'optimizer': 'adam', 'graph_mode': 'knn', 'source': 'grm', 'knn_k': 10, 'weighted_edges': True, 'symmetrize_mode': 'mutual', 'use_snp_selection': False}. Best is trial 6 with value: 0.05945137142719693.
[I 2025-11-03 15:15:18,807] Trial 19 finished with value: -0.01786705135190663 and parameters: {'model_type': 'graphsage', 'hidden_dims': '[512, 256]', 'dropout': 0.25655087695138074, 'batch_norm': True, 'lr': 1.3261425572023469e-06, 'weight_decay': 1.5710250499225587e-05, 'epochs': 311, 'loss': 'mae', 'optimizer': 'adam', 'graph_mode': 'knn', 'source': 'grm', 'knn_k': 6, 'weighted_edges': False, 'symmetrize_mode': 'mutual', 'use_snp_selection': False}. Best is trial 6 with value: 0.05945137142719693.
[I 2025-11-03 15:15:22,177] Trial 20 finished with value: 0.04255928148535022 and parameters: {'model_type': 'graphsage', 'hidden_dims': '[512, 64]', 'dropout': 0.18614493348161285, 'batch_norm': True, 'lr': 0.0003568910054131416, 'weight_decay': 3.8458990800388366e-07, 'epochs': 157, 'loss': 'mse', 'optimizer': 'adam', 'graph_mode': 'knn', 'source': 'grm', 'knn_k': 8, 'weighted_edges': True, 'symmetrize_mode': 'union', 'use_snp_selection': False}. Best is trial 6 with value: 0.05945137142719693.
[I 2025-11-03 15:15:26,163] Trial 21 finished with value: 0.04500620202352811 and parameters: {'model_type': 'graphsage', 'hidden_dims': '[512, 64]', 'dropout': 0.2735047252380486, 'batch_norm': True, 'lr': 0.00016653801754484853, 'weight_decay': 1.016440735863689e-07, 'epochs': 273, 'loss': 'mae', 'optimizer': 'adam', 'graph_mode': 'knn', 'source': 'grm', 'knn_k': 1, 'weighted_edges': True, 'symmetrize_mode': 'union', 'use_snp_selection': False}. Best is trial 6 with value: 0.05945137142719693.
[I 2025-11-03 15:15:30,233] Trial 22 finished with value: 0.031456083177048205 and parameters: {'model_type': 'graphsage', 'hidden_dims': '[512, 64]', 'dropout': 0.34501607639261406, 'batch_norm': True, 'lr': 7.406607547401696e-05, 'weight_decay': 1.4378989688794407e-07, 'epochs': 271, 'loss': 'mae', 'optimizer': 'adam', 'graph_mode': 'knn', 'source': 'grm', 'knn_k': 2, 'weighted_edges': True, 'symmetrize_mode': 'union', 'use_snp_selection': False}. Best is trial 6 with value: 0.05945137142719693.
[I 2025-11-03 15:15:33,961] Trial 23 finished with value: 0.05135941928328084 and parameters: {'model_type': 'graphsage', 'hidden_dims': '[512, 64]', 'dropout': 0.29142266911196424, 'batch_norm': True, 'lr': 0.0002559134783736526, 'weight_decay': 2.284044251672264e-06, 'epochs': 226, 'loss': 'mae', 'optimizer': 'adam', 'graph_mode': 'knn', 'source': 'grm', 'knn_k': 2, 'weighted_edges': True, 'symmetrize_mode': 'union', 'use_snp_selection': False}. Best is trial 6 with value: 0.05945137142719693.
[I 2025-11-03 15:15:36,357] Trial 24 finished with value: 0.05152149729389282 and parameters: {'model_type': 'graphsage', 'hidden_dims': '[256, 128]', 'dropout': 0.38625662577509645, 'batch_norm': True, 'lr': 0.0005753958749385666, 'weight_decay': 2.876569632887394e-06, 'epochs': 222, 'loss': 'mae', 'optimizer': 'adam', 'graph_mode': 'knn', 'source': 'grm', 'knn_k': 3, 'weighted_edges': True, 'symmetrize_mode': 'union', 'use_snp_selection': False}. Best is trial 6 with value: 0.05945137142719693.
[I 2025-11-03 15:15:38,748] Trial 25 finished with value: 0.05662574994866411 and parameters: {'model_type': 'graphsage', 'hidden_dims': '[256, 128]', 'dropout': 0.39608243783582714, 'batch_norm': True, 'lr': 0.0005364291970788471, 'weight_decay': 4.9159849533440326e-06, 'epochs': 211, 'loss': 'mae', 'optimizer': 'adam', 'graph_mode': 'knn', 'source': 'grm', 'knn_k': 4, 'weighted_edges': True, 'symmetrize_mode': 'union', 'use_snp_selection': False}. Best is trial 6 with value: 0.05945137142719693.
[I 2025-11-03 15:15:42,373] Trial 26 finished with value: 0.03237512926530815 and parameters: {'model_type': 'graphsage', 'hidden_dims': '[256, 128]', 'dropout': 0.4285201389089175, 'batch_norm': False, 'lr': 0.0005505085941941476, 'weight_decay': 7.096046467843618e-06, 'epochs': 196, 'loss': 'mae', 'optimizer': 'adam', 'graph_mode': 'cutoff', 'cutoff': 0.8765009073803762, 'grm_norm': 'none', 'self_loops': True, 'use_snp_selection': True, 'num_snps': 59005}. Best is trial 6 with value: 0.05945137142719693.
[I 2025-11-03 15:15:44,445] Trial 27 finished with value: 0.036268090947013706 and parameters: {'model_type': 'graphsage', 'hidden_dims': '[256, 128]', 'dropout': 0.448394334445984, 'batch_norm': True, 'lr': 0.00011131344169640285, 'weight_decay': 4.1463474450828464e-05, 'epochs': 134, 'loss': 'mae', 'optimizer': 'adam', 'graph_mode': 'knn', 'source': 'grm', 'knn_k': 5, 'weighted_edges': True, 'symmetrize_mode': 'mutual', 'use_snp_selection': False}. Best is trial 6 with value: 0.05945137142719693.
[I 2025-11-03 15:15:46,859] Trial 28 finished with value: 0.056040885565186875 and parameters: {'model_type': 'graphsage', 'hidden_dims': '[256, 128, 64]', 'dropout': 0.47665069595857895, 'batch_norm': True, 'lr': 0.0009772542494824238, 'weight_decay': 7.253535165997649e-07, 'epochs': 174, 'loss': 'mse', 'optimizer': 'adam', 'graph_mode': 'knn', 'source': 'grm', 'knn_k': 4, 'weighted_edges': False, 'symmetrize_mode': 'union', 'use_snp_selection': False}. Best is trial 6 with value: 0.05945137142719693.
[I 2025-11-03 15:15:49,276] Trial 29 finished with value: 0.001995739319479234 and parameters: {'model_type': 'graphsage', 'hidden_dims': '[256, 128, 64]', 'dropout': 0.47983528578406365, 'batch_norm': True, 'lr': 4.408910157194893e-06, 'weight_decay': 7.199210790463793e-07, 'epochs': 174, 'loss': 'mae', 'optimizer': 'adam', 'graph_mode': 'knn', 'source': 'grm', 'knn_k': 4, 'weighted_edges': False, 'symmetrize_mode': 'mutual', 'use_snp_selection': False}. Best is trial 6 with value: 0.05945137142719693.
[I 2025-11-03 15:15:52,573] Trial 30 finished with value: 0.05054110842105056 and parameters: {'model_type': 'graphsage', 'hidden_dims': '[256, 128, 64]', 'dropout': 0.5565400449177457, 'batch_norm': True, 'lr': 0.000982496712117261, 'weight_decay': 7.110176650541126e-05, 'epochs': 332, 'loss': 'mae', 'optimizer': 'adam', 'graph_mode': 'knn', 'source': 'grm', 'knn_k': 4, 'weighted_edges': False, 'symmetrize_mode': 'union', 'use_snp_selection': False}. Best is trial 6 with value: 0.05945137142719693.
[I 2025-11-03 15:15:54,560] Trial 31 finished with value: 0.03873158991846562 and parameters: {'model_type': 'graphsage', 'hidden_dims': '[256, 128, 64]', 'dropout': 0.3945019351941881, 'batch_norm': True, 'lr': 0.0005089089593143393, 'weight_decay': 1.185366943468555e-06, 'epochs': 92, 'loss': 'mse', 'optimizer': 'adam', 'graph_mode': 'knn', 'source': 'grm', 'knn_k': 7, 'weighted_edges': False, 'symmetrize_mode': 'union', 'use_snp_selection': False}. Best is trial 6 with value: 0.05945137142719693.
