[I 2025-11-03 13:27:28,081] Trial 30 finished with value: -0.012754787765825875 and parameters: {'model_type': 'gcn', 'hidden_dims': '[256, 128]', 'dropout': 0.39386773039874357, 'batch_norm': True, 'lr': 1.2459964962807524e-05, 'weight_decay': 9.040000191972779e-05, 'epochs': 112, 'loss': 'mae', 'optimizer': 'adam', 'graph_mode': 'cutoff', 'cutoff': 0.4276395415621912, 'grm_norm': 'cosine', 'self_loops': True, 'use_snp_selection': True, 'num_snps': 34441}. Best is trial 26 with value: 0.04467868221728036.
[I 2025-11-03 13:27:30,485] Trial 31 finished with value: -0.012524606044909355 and parameters: {'model_type': 'gcn', 'hidden_dims': '[512, 64]', 'dropout': 0.47244463628932176, 'batch_norm': True, 'lr': 2.7218475086812724e-05, 'weight_decay': 0.0003269125262399644, 'epochs': 23, 'loss': 'mae', 'optimizer': 'adam', 'graph_mode': 'cutoff', 'cutoff': 0.6485067353797193, 'grm_norm': 'cosine_then_gcn', 'self_loops': True, 'use_snp_selection': True, 'num_snps': 35101}. Best is trial 26 with value: 0.04467868221728036.
[I 2025-11-03 13:27:33,349] Trial 32 finished with value: 0.007263421694389461 and parameters: {'model_type': 'gcn', 'hidden_dims': '[512, 64]', 'dropout': 0.4828493625487268, 'batch_norm': True, 'lr': 5.308487381049451e-05, 'weight_decay': 0.0005377389213973658, 'epochs': 45, 'loss': 'mae', 'optimizer': 'adam', 'graph_mode': 'cutoff', 'cutoff': 0.6687397324347251, 'grm_norm': 'cosine_then_gcn', 'self_loops': True, 'use_snp_selection': True, 'num_snps': 43591}. Best is trial 26 with value: 0.04467868221728036.
[I 2025-11-03 13:27:36,193] Trial 33 finished with value: 0.03646996897504643 and parameters: {'model_type': 'gcn', 'hidden_dims': '[512, 64]', 'dropout': 0.42024623881068984, 'batch_norm': False, 'lr': 4.255451013372984e-06, 'weight_decay': 1.1724200599705556e-05, 'epochs': 25, 'loss': 'mse', 'optimizer': 'adam', 'graph_mode': 'cutoff', 'cutoff': 0.5731283427292101, 'grm_norm': 'cosine_then_gcn', 'self_loops': True, 'use_snp_selection': True, 'num_snps': 45758}. Best is trial 26 with value: 0.04467868221728036.
[I 2025-11-03 13:27:39,185] Trial 34 finished with value: 0.01443055048176212 and parameters: {'model_type': 'gcn', 'hidden_dims': '[128, 64]', 'dropout': 0.4191284004496212, 'batch_norm': True, 'lr': 3.2287941492649936e-06, 'weight_decay': 1.3124384008980425e-05, 'epochs': 67, 'loss': 'mse', 'optimizer': 'adam', 'graph_mode': 'cutoff', 'cutoff': 0.5663424583018055, 'grm_norm': 'gcn', 'self_loops': True, 'use_snp_selection': True, 'num_snps': 54353}. Best is trial 26 with value: 0.04467868221728036.
[I 2025-11-03 13:27:41,575] Trial 35 finished with value: 0.02317714741624749 and parameters: {'model_type': 'gcn', 'hidden_dims': '[512, 128]', 'dropout': 0.3705412610296772, 'batch_norm': False, 'lr': 3.442434980299229e-06, 'weight_decay': 2.230324962925434e-05, 'epochs': 20, 'loss': 'mae', 'optimizer': 'adam', 'graph_mode': 'cutoff', 'cutoff': 0.8371851934253796, 'grm_norm': 'cosine_then_gcn', 'self_loops': False, 'use_snp_selection': True, 'num_snps': 35104}. Best is trial 26 with value: 0.04467868221728036.
[I 2025-11-03 13:27:43,331] Trial 36 finished with value: 0.024849519151499536 and parameters: {'model_type': 'gcn', 'hidden_dims': '[256, 128]', 'dropout': 0.5411734934979169, 'batch_norm': False, 'lr': 4.6282856072618266e-06, 'weight_decay': 6.139337514693365e-05, 'epochs': 149, 'loss': 'mse', 'optimizer': 'adam', 'graph_mode': 'cutoff', 'cutoff': 0.5462405461951714, 'grm_norm': 'none', 'self_loops': True, 'use_snp_selection': False}. Best is trial 26 with value: 0.04467868221728036.
[I 2025-11-03 13:27:46,608] Trial 37 finished with value: -0.0087427363494797 and parameters: {'model_type': 'gcn', 'hidden_dims': '[512, 64]', 'dropout': 0.4220403264062777, 'batch_norm': True, 'lr': 1.5891075680526322e-06, 'weight_decay': 2.938531790807698e-05, 'epochs': 104, 'loss': 'mae', 'optimizer': 'adam', 'graph_mode': 'cutoff', 'cutoff': 0.7446529742934229, 'grm_norm': 'cosine_then_gcn', 'self_loops': True, 'use_snp_selection': True, 'num_snps': 46588}. Best is trial 26 with value: 0.04467868221728036.
[I 2025-11-03 13:27:47,890] Trial 38 finished with value: 0.02422503271984395 and parameters: {'model_type': 'gcn', 'hidden_dims': '[128, 64]', 'dropout': 0.401898192907743, 'batch_norm': False, 'lr': 1.0818348230288684e-05, 'weight_decay': 9.33201336449536e-06, 'epochs': 74, 'loss': 'mse', 'optimizer': 'adam', 'graph_mode': 'cutoff', 'cutoff': 0.6787029958176757, 'grm_norm': 'cosine_then_gcn', 'self_loops': False, 'use_snp_selection': False}. Best is trial 26 with value: 0.04467868221728036.
[I 2025-11-03 13:27:50,552] Trial 39 finished with value: 0.016787672081333097 and parameters: {'model_type': 'gcn', 'hidden_dims': '[512, 256]', 'dropout': 0.4963707475661782, 'batch_norm': True, 'lr': 2.200565908017083e-05, 'weight_decay': 1.6382415595128136e-05, 'epochs': 192, 'loss': 'mae', 'optimizer': 'adam', 'graph_mode': 'cutoff', 'cutoff': 0.5949700144347296, 'grm_norm': 'none', 'self_loops': True, 'use_snp_selection': True, 'num_snps': 26322}. Best is trial 26 with value: 0.04467868221728036.
[I 2025-11-03 13:27:53,245] Trial 40 finished with value: 0.015189442685449658 and parameters: {'model_type': 'gcn', 'hidden_dims': '[512, 64]', 'dropout': 0.5308910803644924, 'batch_norm': False, 'lr': 3.500634565445487e-05, 'weight_decay': 4.1773236062085435e-05, 'epochs': 44, 'loss': 'mse', 'optimizer': 'adam', 'graph_mode': 'cutoff', 'cutoff': 0.5607828580077036, 'grm_norm': 'gcn', 'self_loops': False, 'use_snp_selection': True, 'num_snps': 40014}. Best is trial 26 with value: 0.04467868221728036.
[I 2025-11-03 13:27:56,035] Trial 41 finished with value: 0.0015914409268829326 and parameters: {'model_type': 'gcn', 'hidden_dims': '[512, 64]', 'dropout': 0.45453627954659015, 'batch_norm': False, 'lr': 0.0004515924472563579, 'weight_decay': 9.049786391635214e-05, 'epochs': 22, 'loss': 'mse', 'optimizer': 'adam', 'graph_mode': 'cutoff', 'cutoff': 0.6406952467901129, 'grm_norm': 'cosine_then_gcn', 'self_loops': True, 'use_snp_selection': True, 'num_snps': 44664}. Best is trial 26 with value: 0.04467868221728036.
[I 2025-11-03 13:27:58,727] Trial 42 finished with value: 0.021866524308786873 and parameters: {'model_type': 'gcn', 'hidden_dims': '[512, 64]', 'dropout': 0.4842728479801579, 'batch_norm': False, 'lr': 0.00011615833807173706, 'weight_decay': 0.0005606533019932245, 'epochs': 38, 'loss': 'mse', 'optimizer': 'adam', 'graph_mode': 'cutoff', 'cutoff': 0.607410764319114, 'grm_norm': 'cosine_then_gcn', 'self_loops': True, 'use_snp_selection': True, 'num_snps': 40525}. Best is trial 26 with value: 0.04467868221728036.
[I 2025-11-03 13:28:01,830] Trial 43 finished with value: -0.01658071622169356 and parameters: {'model_type': 'gcn', 'hidden_dims': '[512, 64]', 'dropout': 0.4368835953167544, 'batch_norm': False, 'lr': 0.0002761576979743553, 'weight_decay': 0.00017341424500418894, 'epochs': 13, 'loss': 'mse', 'optimizer': 'adam', 'graph_mode': 'cutoff', 'cutoff': 0.48941095003675616, 'grm_norm': 'cosine_then_gcn', 'self_loops': True, 'use_snp_selection': True, 'num_snps': 53579}. Best is trial 26 with value: 0.04467868221728036.
[I 2025-11-03 13:28:04,265] Trial 44 finished with value: 0.06423072367905273 and parameters: {'model_type': 'gcn', 'hidden_dims': '[512, 64]', 'dropout': 0.5200448112860957, 'batch_norm': False, 'lr': 0.00020799131349920216, 'weight_decay': 9.460295805890542e-06, 'epochs': 53, 'loss': 'mse', 'optimizer': 'adam', 'graph_mode': 'cutoff', 'cutoff': 0.7471251074030212, 'grm_norm': 'gcn', 'self_loops': True, 'use_snp_selection': True, 'num_snps': 32531}. Best is trial 44 with value: 0.06423072367905273.
[I 2025-11-03 13:28:06,551] Trial 45 finished with value: 0.006808606084942397 and parameters: {'model_type': 'gcn', 'hidden_dims': '[512, 256]', 'dropout': 0.5604916925360256, 'batch_norm': False, 'lr': 0.00021951824510365288, 'weight_decay': 2.387670920892398e-06, 'epochs': 73, 'loss': 'mse', 'optimizer': 'adam', 'graph_mode': 'cutoff', 'cutoff': 0.7500158562208453, 'grm_norm': 'gcn', 'self_loops': False, 'use_snp_selection': True, 'num_snps': 27385}. Best is trial 44 with value: 0.06423072367905273.
[I 2025-11-03 13:28:08,342] Trial 46 finished with value: 0.00033314662731895084 and parameters: {'model_type': 'gcn', 'hidden_dims': '[512, 128]', 'dropout': 0.5324149771418321, 'batch_norm': False, 'lr': 0.0003475355165759162, 'weight_decay': 9.84252101303311e-06, 'epochs': 57, 'loss': 'mse', 'optimizer': 'adam', 'graph_mode': 'knn', 'source': 'grm', 'knn_k': 3, 'weighted_edges': True, 'symmetrize_mode': 'union', 'use_snp_selection': False}. Best is trial 44 with value: 0.06423072367905273.
[I 2025-11-03 13:28:10,726] Trial 47 finished with value: -0.026354260146883496 and parameters: {'model_type': 'gcn', 'hidden_dims': '[256, 128]', 'dropout': 0.5176937142516824, 'batch_norm': False, 'lr': 0.0005828540332304167, 'weight_decay': 7.560584109986956e-06, 'epochs': 106, 'loss': 'mae', 'optimizer': 'adam', 'graph_mode': 'cutoff', 'cutoff': 0.8450226094989242, 'grm_norm': 'gcn', 'self_loops': True, 'use_snp_selection': True, 'num_snps': 32772}. Best is trial 44 with value: 0.06423072367905273.
[I 2025-11-03 13:28:12,799] Trial 48 finished with value: -0.01920207964890564 and parameters: {'model_type': 'gcn', 'hidden_dims': '[512, 64]', 'dropout': 0.3483016342176909, 'batch_norm': False, 'lr': 5.328809231409696e-05, 'weight_decay': 3.2064209831911477e-06, 'epochs': 9, 'loss': 'mse', 'optimizer': 'adam', 'graph_mode': 'cutoff', 'cutoff': 0.7117195213399392, 'grm_norm': 'gcn', 'self_loops': True, 'use_snp_selection': True, 'num_snps': 28685}. Best is trial 44 with value: 0.06423072367905273.
[I 2025-11-03 13:28:15,271] Trial 49 finished with value: -0.002973310456630091 and parameters: {'model_type': 'gcn', 'hidden_dims': '[128, 64]', 'dropout': 0.5599505482650129, 'batch_norm': True, 'lr': 4.904304843635217e-06, 'weight_decay': 1.3913175324496472e-06, 'epochs': 84, 'loss': 'mae', 'optimizer': 'adam', 'graph_mode': 'knn', 'source': 'grm', 'knn_k': 3, 'weighted_edges': True, 'symmetrize_mode': 'union', 'use_snp_selection': True, 'num_snps': 37242}. Best is trial 44 with value: 0.06423072367905273.
[I 2025-11-03 13:28:17,932] Trial 50 finished with value: -0.00208187659435059 and parameters: {'model_type': 'gcn', 'hidden_dims': '[512, 64]', 'dropout': 0.13332678957229122, 'batch_norm': False, 'lr': 8.217954710646179e-05, 'weight_decay': 3.2557642137624e-05, 'epochs': 260, 'loss': 'mse', 'optimizer': 'adam', 'graph_mode': 'cutoff', 'cutoff': 0.8261079338222572, 'grm_norm': 'cosine', 'self_loops': False, 'use_snp_selection': True, 'num_snps': 22342}. Best is trial 44 with value: 0.06423072367905273.
[I 2025-11-03 13:28:20,580] Trial 51 finished with value: 0.007923552991866766 and parameters: {'model_type': 'gcn', 'hidden_dims': '[512, 64]', 'dropout': 0.47076132614867783, 'batch_norm': False, 'lr': 0.00012864330285837603, 'weight_decay': 1.395076231727591e-05, 'epochs': 33, 'loss': 'mse', 'optimizer': 'adam', 'graph_mode': 'cutoff', 'cutoff': 0.680782211766796, 'grm_norm': 'gcn', 'self_loops': True, 'use_snp_selection': True, 'num_snps': 41404}. Best is trial 44 with value: 0.06423072367905273.
[I 2025-11-03 13:28:23,582] Trial 52 finished with value: -0.03028302973761685 and parameters: {'model_type': 'gcn', 'hidden_dims': '[512, 64]', 'dropout': 0.4888760412889151, 'batch_norm': False, 'lr': 0.0001586634438892382, 'weight_decay': 6.437870277900105e-05, 'epochs': 54, 'loss': 'mse', 'optimizer': 'adam', 'graph_mode': 'cutoff', 'cutoff': 0.7474673908644416, 'grm_norm': 'cosine_then_gcn', 'self_loops': True, 'use_snp_selection': True, 'num_snps': 46838}. Best is trial 44 with value: 0.06423072367905273.
[I 2025-11-03 13:28:26,019] Trial 53 finished with value: -0.022469624091149176 and parameters: {'model_type': 'gcn', 'hidden_dims': '[512, 64]', 'dropout': 0.2157103582713026, 'batch_norm': False, 'lr': 0.00010705678268209337, 'weight_decay': 0.00012054702394696656, 'epochs': 29, 'loss': 'mse', 'optimizer': 'adam', 'graph_mode': 'cutoff', 'cutoff': 0.5351301854346784, 'grm_norm': 'none', 'self_loops': True, 'use_snp_selection': True, 'num_snps': 37630}. Best is trial 44 with value: 0.06423072367905273.
[I 2025-11-03 13:28:28,765] Trial 54 finished with value: 0.010802557104039967 and parameters: {'model_type': 'gcn', 'hidden_dims': '[512, 64]', 'dropout': 0.40298021603490175, 'batch_norm': False, 'lr': 3.600396297538744e-05, 'weight_decay': 0.00024318336862669043, 'epochs': 43, 'loss': 'mse', 'optimizer': 'adam', 'graph_mode': 'cutoff', 'cutoff': 0.5987416544615916, 'grm_norm': 'cosine_then_gcn', 'self_loops': True, 'use_snp_selection': True, 'num_snps': 42647}. Best is trial 44 with value: 0.06423072367905273.
[I 2025-11-03 13:28:30,882] Trial 55 finished with value: -0.023836058496621244 and parameters: {'model_type': 'gcn', 'hidden_dims': '[512, 64]', 'dropout': 0.4558867841065539, 'batch_norm': False, 'lr': 0.00020450880490252197, 'weight_decay': 1.8769304931651e-05, 'epochs': 17, 'loss': 'mse', 'optimizer': 'adam', 'graph_mode': 'cutoff', 'cutoff': 0.3930185938421627, 'grm_norm': 'gcn', 'self_loops': True, 'use_snp_selection': True, 'num_snps': 30549}. Best is trial 44 with value: 0.06423072367905273.
[I 2025-11-03 13:28:33,607] Trial 56 finished with value: -0.045332198507722375 and parameters: {'model_type': 'gcn', 'hidden_dims': '[512, 256]', 'dropout': 0.27627524090920386, 'batch_norm': False, 'lr': 0.0003210548681531294, 'weight_decay': 3.441595304956031e-06, 'epochs': 2, 'loss': 'mse', 'optimizer': 'adam', 'graph_mode': 'cutoff', 'cutoff': 0.7059183324829514, 'grm_norm': 'cosine', 'self_loops': False, 'use_snp_selection': True, 'num_snps': 48877}. Best is trial 44 with value: 0.06423072367905273.
[I 2025-11-03 13:28:36,245] Trial 57 finished with value: 0.025387044213479853 and parameters: {'model_type': 'gcn', 'hidden_dims': '[128, 64]', 'dropout': 0.5148054366234798, 'batch_norm': False, 'lr': 6.902083372769918e-05, 'weight_decay': 0.00017702222280186996, 'epochs': 65, 'loss': 'mae', 'optimizer': 'adam', 'graph_mode': 'knn', 'source': 'grm', 'knn_k': 8, 'weighted_edges': True, 'symmetrize_mode': 'union', 'use_snp_selection': True, 'num_snps': 45140}. Best is trial 44 with value: 0.06423072367905273.
[I 2025-11-03 13:28:40,196] Trial 58 finished with value: -0.006738573251292781 and parameters: {'model_type': 'gcn', 'hidden_dims': '[512, 64]', 'dropout': 0.32306177018560195, 'batch_norm': False, 'lr': 1.9755885910162198e-05, 'weight_decay': 4.6495634477221186e-07, 'epochs': 143, 'loss': 'mse', 'optimizer': 'adam', 'graph_mode': 'cutoff', 'cutoff': 0.2336987704935214, 'grm_norm': 'none', 'self_loops': True, 'use_snp_selection': True, 'num_snps': 58950}. Best is trial 44 with value: 0.06423072367905273.
[I 2025-11-03 13:28:41,766] Trial 59 finished with value: -0.020452871773376388 and parameters: {'model_type': 'gcn', 'hidden_dims': '[256, 128, 64]', 'dropout': 0.43226480118447397, 'batch_norm': False, 'lr': 8.442388225235958e-05, 'weight_decay': 0.0005376701389174238, 'epochs': 87, 'loss': 'mae', 'optimizer': 'adam', 'graph_mode': 'cutoff', 'cutoff': 0.6297647646790128, 'grm_norm': 'cosine_then_gcn', 'self_loops': True, 'use_snp_selection': False}. Best is trial 44 with value: 0.06423072367905273.
[I 2025-11-03 13:28:44,896] Trial 60 finished with value: -0.0072254461244484446 and parameters: {'model_type': 'gcn', 'hidden_dims': '[512, 128]', 'dropout': 0.18207692554283159, 'batch_norm': True, 'lr': 0.0009258494241211485, 'weight_decay': 7.551512483673399e-05, 'epochs': 47, 'loss': 'mse', 'optimizer': 'adam', 'graph_mode': 'cutoff', 'cutoff': 0.6698159952600378, 'grm_norm': 'cosine_then_gcn', 'self_loops': True, 'use_snp_selection': True, 'num_snps': 53550}. Best is trial 44 with value: 0.06423072367905273.
[I 2025-11-03 13:28:47,521] Trial 61 finished with value: -0.008607688572436163 and parameters: {'model_type': 'gcn', 'hidden_dims': '[128, 64]', 'dropout': 0.5141598425925806, 'batch_norm': False, 'lr': 6.598741570891273e-05, 'weight_decay': 0.00015011149322590895, 'epochs': 65, 'loss': 'mae', 'optimizer': 'adam', 'graph_mode': 'knn', 'source': 'grm', 'knn_k': 8, 'weighted_edges': True, 'symmetrize_mode': 'union', 'use_snp_selection': True, 'num_snps': 45372}. Best is trial 44 with value: 0.06423072367905273.
[I 2025-11-03 13:28:49,809] Trial 62 finished with value: -0.06416749073756542 and parameters: {'model_type': 'gcn', 'hidden_dims': '[128, 64]', 'dropout': 0.4957453765031119, 'batch_norm': False, 'lr': 0.00014607790796962865, 'weight_decay': 0.00019766784168043263, 'epochs': 28, 'loss': 'mae', 'optimizer': 'adam', 'graph_mode': 'knn', 'source': 'grm', 'knn_k': 8, 'weighted_edges': True, 'symmetrize_mode': 'union', 'use_snp_selection': True, 'num_snps': 38608}. Best is trial 44 with value: 0.06423072367905273.
[I 2025-11-03 13:28:52,295] Trial 63 finished with value: -0.00019015901059263936 and parameters: {'model_type': 'gcn', 'hidden_dims': '[128, 64]', 'dropout': 0.5614005146536358, 'batch_norm': False, 'lr': 4.48301205186773e-05, 'weight_decay': 0.0003254827797395272, 'epochs': 55, 'loss': 'mae', 'optimizer': 'adam', 'graph_mode': 'knn', 'source': 'grm', 'knn_k': 6, 'weighted_edges': True, 'symmetrize_mode': 'union', 'use_snp_selection': True, 'num_snps': 42357}. Best is trial 44 with value: 0.06423072367905273.
[I 2025-11-03 13:28:54,807] Trial 64 finished with value: -0.031375985576267564 and parameters: {'model_type': 'gcn', 'hidden_dims': '[128, 64]', 'dropout': 0.5230594282723708, 'batch_norm': False, 'lr': 5.9942219066224e-05, 'weight_decay': 6.818579089693504e-06, 'epochs': 12, 'loss': 'mae', 'optimizer': 'adam', 'graph_mode': 'knn', 'source': 'grm', 'knn_k': 9, 'weighted_edges': True, 'symmetrize_mode': 'union', 'use_snp_selection': True, 'num_snps': 46863}. Best is trial 44 with value: 0.06423072367905273.
[I 2025-11-03 13:28:57,792] Trial 65 finished with value: 0.0014792853649885332 and parameters: {'model_type': 'gcn', 'hidden_dims': '[512, 64]', 'dropout': 0.502438886598636, 'batch_norm': False, 'lr': 0.0002413681410906672, 'weight_decay': 3.876763324669731e-05, 'epochs': 32, 'loss': 'mae', 'optimizer': 'adam', 'graph_mode': 'knn', 'source': 'grm', 'knn_k': 7, 'weighted_edges': True, 'symmetrize_mode': 'union', 'use_snp_selection': True, 'num_snps': 50257}. Best is trial 44 with value: 0.06423072367905273.
[I 2025-11-03 13:29:00,215] Trial 66 finished with value: 0.0021478497730205623 and parameters: {'model_type': 'gcn', 'hidden_dims': '[128, 64]', 'dropout': 0.4665155547597505, 'batch_norm': False, 'lr': 0.00010000194260615609, 'weight_decay': 2.187158530218141e-05, 'epochs': 120, 'loss': 'mae', 'optimizer': 'adam', 'graph_mode': 'knn', 'source': 'grm', 'knn_k': 5, 'weighted_edges': True, 'symmetrize_mode': 'union', 'use_snp_selection': True, 'num_snps': 36415}. Best is trial 44 with value: 0.06423072367905273.
[I 2025-11-03 13:29:02,462] Trial 67 finished with value: 0.014233558541756687 and parameters: {'model_type': 'gcn', 'hidden_dims': '[256, 128]', 'dropout': 0.4539535770411626, 'batch_norm': True, 'lr': 2.6314224359812147e-05, 'weight_decay': 0.0007061626440944424, 'epochs': 79, 'loss': 'mae', 'optimizer': 'adam', 'graph_mode': 'cutoff', 'cutoff': 0.5130476209140036, 'grm_norm': 'none', 'self_loops': False, 'use_snp_selection': True, 'num_snps': 32866}. Best is trial 44 with value: 0.06423072367905273.
[I 2025-11-03 13:29:05,007] Trial 68 finished with value: 0.008429228506024344 and parameters: {'model_type': 'gcn', 'hidden_dims': '[512, 64]', 'dropout': 0.5911158400558721, 'batch_norm': False, 'lr': 2.3257118438659835e-06, 'weight_decay': 0.0003843645317672757, 'epochs': 47, 'loss': 'mse', 'optimizer': 'adam', 'graph_mode': 'cutoff', 'cutoff': 0.5789135090607735, 'grm_norm': 'cosine_then_gcn', 'self_loops': True, 'use_snp_selection': True, 'num_snps': 39329}. Best is trial 44 with value: 0.06423072367905273.
[I 2025-11-03 13:29:07,810] Trial 69 finished with value: -0.004789613781453406 and parameters: {'model_type': 'gcn', 'hidden_dims': '[256, 128, 64]', 'dropout': 0.5458607428028747, 'batch_norm': False, 'lr': 0.0001939260914365061, 'weight_decay': 0.0001087571975053866, 'epochs': 94, 'loss': 'mae', 'optimizer': 'adam', 'graph_mode': 'cutoff', 'cutoff': 0.7667733473832566, 'grm_norm': 'cosine_then_gcn', 'self_loops': True, 'use_snp_selection': True, 'num_snps': 44846}. Best is trial 44 with value: 0.06423072367905273.
[I 2025-11-03 13:29:09,071] Trial 70 finished with value: -0.01653341842335153 and parameters: {'model_type': 'gcn', 'hidden_dims': '[128, 64]', 'dropout': 0.3842327724977515, 'batch_norm': True, 'lr': 1.0150277064019435e-05, 'weight_decay': 4.242447314924945e-06, 'epochs': 70, 'loss': 'mse', 'optimizer': 'adam', 'graph_mode': 'knn', 'source': 'grm', 'knn_k': 3, 'weighted_edges': True, 'symmetrize_mode': 'union', 'use_snp_selection': False}. Best is trial 44 with value: 0.06423072367905273.
[I 2025-11-03 13:29:12,004] Trial 71 finished with value: -0.013136162939725181 and parameters: {'model_type': 'gcn', 'hidden_dims': '[256, 128, 64]', 'dropout': 0.5821168290196056, 'batch_norm': False, 'lr': 7.843202648296775e-05, 'weight_decay': 4.662531219039029e-06, 'epochs': 64, 'loss': 'mse', 'optimizer': 'adam', 'graph_mode': 'knn', 'source': 'grm', 'knn_k': 9, 'weighted_edges': False, 'symmetrize_mode': 'mutual', 'use_snp_selection': True, 'num_snps': 52094}. Best is trial 44 with value: 0.06423072367905273.
