[I 2025-11-03 13:07:52,069] Trial 82 finished with value: 0.06962524592444315 and parameters: {'model_type': 'gcn', 'hidden_dims': '[512, 64]', 'dropout': 0.49943256844508854, 'batch_norm': True, 'lr': 0.0006198719398397555, 'weight_decay': 6.51386789004073e-07, 'epochs': 258, 'loss': 'mae', 'optimizer': 'adam', 'graph_mode': 'off', 'use_snp_selection': True, 'num_snps': 17854}. Best is trial 26 with value: 0.08910794720524956.
[I 2025-11-03 13:07:53,214] Trial 83 finished with value: 0.07463471916169354 and parameters: {'model_type': 'gcn', 'hidden_dims': '[512, 256]', 'dropout': 0.5157092211425952, 'batch_norm': True, 'lr': 0.0004902225260656698, 'weight_decay': 2.4787583893115556e-07, 'epochs': 231, 'loss': 'mae', 'optimizer': 'adam', 'graph_mode': 'off', 'use_snp_selection': True, 'num_snps': 8743}. Best is trial 26 with value: 0.08910794720524956.
[I 2025-11-03 13:07:54,869] Trial 84 finished with value: -5.880601364889141e-05 and parameters: {'model_type': 'gcn', 'hidden_dims': '[256, 128]', 'dropout': 0.5676716211123258, 'batch_norm': True, 'lr': 2.0272454617341682e-06, 'weight_decay': 1.741725140573555e-07, 'epochs': 244, 'loss': 'mae', 'optimizer': 'adam', 'graph_mode': 'off', 'use_snp_selection': True, 'num_snps': 29837}. Best is trial 26 with value: 0.08910794720524956.
[I 2025-11-03 13:07:57,843] Trial 85 finished with value: 0.07722570243707763 and parameters: {'model_type': 'gcn', 'hidden_dims': '[512, 128]', 'dropout': 0.41054431975404765, 'batch_norm': True, 'lr': 0.00028499624984996773, 'weight_decay': 1.8231231338882616e-07, 'epochs': 284, 'loss': 'mae', 'optimizer': 'adam', 'graph_mode': 'off', 'use_snp_selection': True, 'num_snps': 59136}. Best is trial 26 with value: 0.08910794720524956.
[I 2025-11-03 13:08:00,218] Trial 86 finished with value: 0.07198332937965522 and parameters: {'model_type': 'gcn', 'hidden_dims': '[256, 128, 64]', 'dropout': 0.3890130855427516, 'batch_norm': True, 'lr': 0.00036329765308047935, 'weight_decay': 1.283254029963299e-07, 'epochs': 214, 'loss': 'mae', 'optimizer': 'adam', 'graph_mode': 'off', 'use_snp_selection': True, 'num_snps': 54323}. Best is trial 26 with value: 0.08910794720524956.
[I 2025-11-03 13:08:02,000] Trial 87 finished with value: 0.0836148865607636 and parameters: {'model_type': 'gcn', 'hidden_dims': '[512, 64]', 'dropout': 0.5294812161190642, 'batch_norm': True, 'lr': 0.0009973456961630768, 'weight_decay': 2.952735934224118e-06, 'epochs': 263, 'loss': 'mse', 'optimizer': 'adam', 'graph_mode': 'off', 'use_snp_selection': True, 'num_snps': 25857}. Best is trial 26 with value: 0.08910794720524956.
[I 2025-11-03 13:08:03,698] Trial 88 finished with value: 0.03976026108699038 and parameters: {'model_type': 'gcn', 'hidden_dims': '[512, 256]', 'dropout': 0.11717972019884554, 'batch_norm': False, 'lr': 0.0008693307166914523, 'weight_decay': 3.004364716776981e-06, 'epochs': 263, 'loss': 'mse', 'optimizer': 'adam', 'graph_mode': 'off', 'use_snp_selection': True, 'num_snps': 25088}. Best is trial 26 with value: 0.08910794720524956.
[I 2025-11-03 13:08:05,279] Trial 89 finished with value: 0.07729331508886174 and parameters: {'model_type': 'gcn', 'hidden_dims': '[512, 64]', 'dropout': 0.531587194404057, 'batch_norm': True, 'lr': 0.0009546282769578054, 'weight_decay': 4.769819065077397e-06, 'epochs': 162, 'loss': 'mse', 'optimizer': 'adam', 'graph_mode': 'off', 'use_snp_selection': False}. Best is trial 26 with value: 0.08910794720524956.
[I 2025-11-03 13:08:07,484] Trial 90 finished with value: 0.08577097794699894 and parameters: {'model_type': 'gcn', 'hidden_dims': '[512, 256]', 'dropout': 0.5148949153389416, 'batch_norm': True, 'lr': 0.0006836228151397698, 'weight_decay': 1.3093196396204293e-06, 'epochs': 289, 'loss': 'mse', 'optimizer': 'adam', 'graph_mode': 'off', 'use_snp_selection': True, 'num_snps': 36164}. Best is trial 26 with value: 0.08910794720524956.
[I 2025-11-03 13:08:09,960] Trial 91 finished with value: 0.07404434068440799 and parameters: {'model_type': 'gcn', 'hidden_dims': '[512, 256]', 'dropout': 0.49212020425651615, 'batch_norm': True, 'lr': 0.0006895997807759729, 'weight_decay': 2.110195954323546e-06, 'epochs': 333, 'loss': 'mse', 'optimizer': 'adam', 'graph_mode': 'off', 'use_snp_selection': True, 'num_snps': 38947}. Best is trial 26 with value: 0.08910794720524956.
[I 2025-11-03 13:08:12,190] Trial 92 finished with value: 0.07458170040877471 and parameters: {'model_type': 'gcn', 'hidden_dims': '[512, 256]', 'dropout': 0.5151927091273193, 'batch_norm': True, 'lr': 0.0006118337024684743, 'weight_decay': 1.6783828327984978e-06, 'epochs': 290, 'loss': 'mse', 'optimizer': 'adam', 'graph_mode': 'off', 'use_snp_selection': True, 'num_snps': 36041}. Best is trial 26 with value: 0.08910794720524956.
[I 2025-11-03 13:08:14,273] Trial 93 finished with value: 0.08027850264603456 and parameters: {'model_type': 'gcn', 'hidden_dims': '[512, 256]', 'dropout': 0.5373891740873303, 'batch_norm': True, 'lr': 0.0009778336216858155, 'weight_decay': 1.2785707739629855e-06, 'epochs': 275, 'loss': 'mse', 'optimizer': 'adam', 'graph_mode': 'off', 'use_snp_selection': True, 'num_snps': 33579}. Best is trial 26 with value: 0.08910794720524956.
[I 2025-11-03 13:08:16,690] Trial 94 finished with value: 0.023454230116441495 and parameters: {'model_type': 'gcn', 'hidden_dims': '[512, 256]', 'dropout': 0.40579073615620787, 'batch_norm': True, 'lr': 7.617263597406471e-06, 'weight_decay': 9.800173885603863e-07, 'epochs': 312, 'loss': 'mse', 'optimizer': 'adam', 'graph_mode': 'off', 'use_snp_selection': True, 'num_snps': 38609}. Best is trial 26 with value: 0.08910794720524956.
[I 2025-11-03 13:08:18,534] Trial 95 finished with value: 0.07123169287746314 and parameters: {'model_type': 'gcn', 'hidden_dims': '[512, 128]', 'dropout': 0.4805527103393237, 'batch_norm': True, 'lr': 0.0007479151122339736, 'weight_decay': 1.992014587698077e-06, 'epochs': 253, 'loss': 'mse', 'optimizer': 'adam', 'graph_mode': 'off', 'use_snp_selection': True, 'num_snps': 28762}. Best is trial 26 with value: 0.08910794720524956.
[I 2025-11-03 13:08:20,273] Trial 96 finished with value: 0.054591501993557744 and parameters: {'model_type': 'gcn', 'hidden_dims': '[512, 64]', 'dropout': 0.37537084305803936, 'batch_norm': False, 'lr': 0.0005260473050364858, 'weight_decay': 3.7738312956794224e-06, 'epochs': 265, 'loss': 'mse', 'optimizer': 'adam', 'graph_mode': 'off', 'use_snp_selection': True, 'num_snps': 26261}. Best is trial 26 with value: 0.08910794720524956.
[I 2025-11-03 13:08:21,905] Trial 97 finished with value: 0.08386418236833446 and parameters: {'model_type': 'gcn', 'hidden_dims': '[256, 128, 64]', 'dropout': 0.23168268929671568, 'batch_norm': True, 'lr': 0.00040316405688502904, 'weight_decay': 3.239132626825319e-06, 'epochs': 279, 'loss': 'mse', 'optimizer': 'adam', 'graph_mode': 'off', 'use_snp_selection': True, 'num_snps': 15102}. Best is trial 26 with value: 0.08910794720524956.
[I 2025-11-03 13:08:23,480] Trial 98 finished with value: 0.037350854531114384 and parameters: {'model_type': 'gcn', 'hidden_dims': '[256, 128, 64]', 'dropout': 0.21556797508253026, 'batch_norm': True, 'lr': 4.300508049232335e-05, 'weight_decay': 7.496422795546352e-06, 'epochs': 280, 'loss': 'mse', 'optimizer': 'adam', 'graph_mode': 'off', 'use_snp_selection': True, 'num_snps': 12133}. Best is trial 26 with value: 0.08910794720524956.
[I 2025-11-03 13:08:25,503] Trial 99 finished with value: 0.08045895487043782 and parameters: {'model_type': 'gcn', 'hidden_dims': '[256, 128, 64]', 'dropout': 0.1870810568271065, 'batch_norm': True, 'lr': 0.00040146577863934066, 'weight_decay': 2.078157902550042e-07, 'epochs': 305, 'loss': 'mse', 'optimizer': 'adam', 'graph_mode': 'off', 'use_snp_selection': False}. Best is trial 26 with value: 0.08910794720524956.
[I 2025-11-03 13:08:26,634] Trial 100 finished with value: 0.04332754485830561 and parameters: {'model_type': 'gcn', 'hidden_dims': '[256, 128, 64]', 'dropout': 0.23893316421573566, 'batch_norm': False, 'lr': 0.0005657087887359217, 'weight_decay': 1.2471063486805907e-05, 'epochs': 232, 'loss': 'mse', 'optimizer': 'adam', 'graph_mode': 'off', 'use_snp_selection': True, 'num_snps': 2111}. Best is trial 26 with value: 0.08910794720524956.
[I 2025-11-03 13:08:28,248] Trial 101 finished with value: 0.0698973826297134 and parameters: {'model_type': 'gcn', 'hidden_dims': '[256, 128, 64]', 'dropout': 0.2808244958238527, 'batch_norm': True, 'lr': 0.0007019211869755403, 'weight_decay': 3.124960997768081e-06, 'epochs': 270, 'loss': 'mse', 'optimizer': 'adam', 'graph_mode': 'off', 'use_snp_selection': True, 'num_snps': 15293}. Best is trial 26 with value: 0.08910794720524956.
[I 2025-11-03 13:08:29,954] Trial 102 finished with value: 0.07682597887410231 and parameters: {'model_type': 'gcn', 'hidden_dims': '[512, 256]', 'dropout': 0.5224822442592975, 'batch_norm': True, 'lr': 0.0008073157264203825, 'weight_decay': 2.478276152119729e-06, 'epochs': 285, 'loss': 'mse', 'optimizer': 'adam', 'graph_mode': 'off', 'use_snp_selection': True, 'num_snps': 21917}. Best is trial 26 with value: 0.08910794720524956.
[I 2025-11-03 13:08:31,251] Trial 103 finished with value: 0.05586818577769806 and parameters: {'model_type': 'gcn', 'hidden_dims': '[128, 64]', 'dropout': 0.26836886646234065, 'batch_norm': True, 'lr': 0.0003224117515589722, 'weight_decay': 1.13009418448897e-06, 'epochs': 296, 'loss': 'mse', 'optimizer': 'adam', 'graph_mode': 'off', 'use_snp_selection': True, 'num_snps': 10485}. Best is trial 26 with value: 0.08910794720524956.
[I 2025-11-03 13:08:32,347] Trial 104 finished with value: 0.05696534752115131 and parameters: {'model_type': 'gcn', 'hidden_dims': '[512, 64]', 'dropout': 0.3495169306961703, 'batch_norm': True, 'lr': 0.00046856615704168403, 'weight_decay': 1.8406784883549387e-06, 'epochs': 249, 'loss': 'mse', 'optimizer': 'adam', 'graph_mode': 'off', 'use_snp_selection': True, 'num_snps': 4646}. Best is trial 26 with value: 0.08910794720524956.
[I 2025-11-03 13:08:33,302] Trial 105 finished with value: 0.09336341919701305 and parameters: {'model_type': 'gcn', 'hidden_dims': '[256, 128]', 'dropout': 0.5763149270310304, 'batch_norm': True, 'lr': 0.0006706906618659499, 'weight_decay': 2.548703455933548e-06, 'epochs': 172, 'loss': 'mse', 'optimizer': 'adam', 'graph_mode': 'off', 'use_snp_selection': True, 'num_snps': 7427}. Best is trial 105 with value: 0.09336341919701305.
[I 2025-11-03 13:08:34,177] Trial 106 finished with value: 0.0755360056058998 and parameters: {'model_type': 'gcn', 'hidden_dims': '[256, 128]', 'dropout': 0.5843527477783054, 'batch_norm': True, 'lr': 0.0006851249348123792, 'weight_decay': 2.9189768220037662e-06, 'epochs': 139, 'loss': 'mse', 'optimizer': 'adam', 'graph_mode': 'off', 'use_snp_selection': True, 'num_snps': 7523}. Best is trial 105 with value: 0.09336341919701305.
[I 2025-11-03 13:08:35,227] Trial 107 finished with value: 0.06714611584480187 and parameters: {'model_type': 'gcn', 'hidden_dims': '[256, 128]', 'dropout': 0.5943578660470807, 'batch_norm': True, 'lr': 0.0005810999996184291, 'weight_decay': 5.60033862261119e-06, 'epochs': 221, 'loss': 'mse', 'optimizer': 'adam', 'graph_mode': 'off', 'use_snp_selection': True, 'num_snps': 6046}. Best is trial 105 with value: 0.09336341919701305.
[I 2025-11-03 13:08:36,796] Trial 108 finished with value: 0.07643519768575929 and parameters: {'model_type': 'gcn', 'hidden_dims': '[256, 128]', 'dropout': 0.575205628492336, 'batch_norm': True, 'lr': 0.000391296302122705, 'weight_decay': 9.820713773364689e-06, 'epochs': 161, 'loss': 'mse', 'optimizer': 'adam', 'graph_mode': 'off', 'use_snp_selection': True, 'num_snps': 33450}. Best is trial 105 with value: 0.09336341919701305.
[I 2025-11-03 13:08:37,919] Trial 109 finished with value: 0.03434564713359895 and parameters: {'model_type': 'gcn', 'hidden_dims': '[256, 128]', 'dropout': 0.22641703487639456, 'batch_norm': False, 'lr': 0.0008040673533797865, 'weight_decay': 5.706899662178648e-07, 'epochs': 194, 'loss': 'mse', 'optimizer': 'adam', 'graph_mode': 'off', 'use_snp_selection': True, 'num_snps': 14984}. Best is trial 105 with value: 0.09336341919701305.
[I 2025-11-03 13:08:39,335] Trial 110 finished with value: 0.06414581590993146 and parameters: {'model_type': 'gcn', 'hidden_dims': '[256, 128, 64]', 'dropout': 0.16629525849248117, 'batch_norm': True, 'lr': 0.000501159711518804, 'weight_decay': 3.863958248747436e-06, 'epochs': 172, 'loss': 'mse', 'optimizer': 'adam', 'graph_mode': 'off', 'use_snp_selection': False}. Best is trial 105 with value: 0.09336341919701305.
[I 2025-11-03 13:08:40,413] Trial 111 finished with value: 0.07295468654728404 and parameters: {'model_type': 'gcn', 'hidden_dims': '[512, 256]', 'dropout': 0.5536156260721276, 'batch_norm': True, 'lr': 0.0006648427123542366, 'weight_decay': 1.4080399720969254e-06, 'epochs': 183, 'loss': 'mae', 'optimizer': 'adam', 'graph_mode': 'off', 'use_snp_selection': True, 'num_snps': 10075}. Best is trial 105 with value: 0.09336341919701305.
[I 2025-11-03 13:08:41,639] Trial 112 finished with value: 0.06729573841353059 and parameters: {'model_type': 'gcn', 'hidden_dims': '[512, 64]', 'dropout': 0.5409040188958041, 'batch_norm': True, 'lr': 0.00022927386644097794, 'weight_decay': 2.60529490207701e-06, 'epochs': 263, 'loss': 'mae', 'optimizer': 'adam', 'graph_mode': 'off', 'use_snp_selection': True, 'num_snps': 8516}. Best is trial 105 with value: 0.09336341919701305.
[I 2025-11-03 13:08:43,077] Trial 113 finished with value: 0.07486656432601994 and parameters: {'model_type': 'gcn', 'hidden_dims': '[512, 128]', 'dropout': 0.5056942596832915, 'batch_norm': True, 'lr': 0.0004430215100875452, 'weight_decay': 1.8164750517363612e-06, 'epochs': 240, 'loss': 'mae', 'optimizer': 'adam', 'graph_mode': 'off', 'use_snp_selection': True, 'num_snps': 18291}. Best is trial 105 with value: 0.09336341919701305.
[I 2025-11-03 13:08:44,309] Trial 114 finished with value: 0.0796773609391757 and parameters: {'model_type': 'gcn', 'hidden_dims': '[512, 256]', 'dropout': 0.4665376919169413, 'batch_norm': True, 'lr': 0.0003190515048297598, 'weight_decay': 7.582284068885024e-07, 'epochs': 176, 'loss': 'mse', 'optimizer': 'adam', 'graph_mode': 'off', 'use_snp_selection': True, 'num_snps': 16790}. Best is trial 105 with value: 0.09336341919701305.
[I 2025-11-03 13:08:45,561] Trial 115 finished with value: 0.0801919615782084 and parameters: {'model_type': 'gcn', 'hidden_dims': '[256, 128]', 'dropout': 0.5589471063600406, 'batch_norm': True, 'lr': 0.0005559847292634585, 'weight_decay': 1.471285259624513e-06, 'epochs': 251, 'loss': 'mae', 'optimizer': 'adam', 'graph_mode': 'off', 'use_snp_selection': True, 'num_snps': 12145}. Best is trial 105 with value: 0.09336341919701305.
[I 2025-11-03 13:08:46,979] Trial 116 finished with value: 0.08082607170148497 and parameters: {'model_type': 'gcn', 'hidden_dims': '[512, 64]', 'dropout': 0.2553393466010458, 'batch_norm': True, 'lr': 0.0008507086868508359, 'weight_decay': 4.292512356291295e-06, 'epochs': 202, 'loss': 'mae', 'optimizer': 'adam', 'graph_mode': 'off', 'use_snp_selection': True, 'num_snps': 20613}. Best is trial 105 with value: 0.09336341919701305.
[I 2025-11-03 13:08:48,755] Trial 117 finished with value: 0.08427741253034435 and parameters: {'model_type': 'gcn', 'hidden_dims': '[512, 256]', 'dropout': 0.5723497247784669, 'batch_norm': True, 'lr': 0.0002759465355807541, 'weight_decay': 8.899306770367974e-07, 'epochs': 276, 'loss': 'mse', 'optimizer': 'adam', 'graph_mode': 'off', 'use_snp_selection': True, 'num_snps': 25166}. Best is trial 105 with value: 0.09336341919701305.
[I 2025-11-03 13:08:50,791] Trial 118 finished with value: 0.053958643800975974 and parameters: {'model_type': 'gcn', 'hidden_dims': '[512, 256]', 'dropout': 0.5726343398514817, 'batch_norm': False, 'lr': 0.00018085503061603518, 'weight_decay': 8.480398485781493e-07, 'epochs': 320, 'loss': 'mse', 'optimizer': 'adam', 'graph_mode': 'off', 'use_snp_selection': True, 'num_snps': 30739}. Best is trial 105 with value: 0.09336341919701305.
[I 2025-11-03 13:08:52,572] Trial 119 finished with value: 0.07368978713173718 and parameters: {'model_type': 'gcn', 'hidden_dims': '[512, 256]', 'dropout': 0.5907720863213984, 'batch_norm': True, 'lr': 0.00026317119780750484, 'weight_decay': 3.770370332499627e-07, 'epochs': 278, 'loss': 'mse', 'optimizer': 'adam', 'graph_mode': 'off', 'use_snp_selection': True, 'num_snps': 23427}. Best is trial 105 with value: 0.09336341919701305.
[I 2025-11-03 13:08:54,264] Trial 120 finished with value: 0.06252800705377827 and parameters: {'model_type': 'gcn', 'hidden_dims': '[512, 256]', 'dropout': 0.30919041334146447, 'batch_norm': True, 'lr': 7.434954528552663e-05, 'weight_decay': 1.1501896771225751e-06, 'epochs': 188, 'loss': 'mse', 'optimizer': 'adam', 'graph_mode': 'off', 'use_snp_selection': False}. Best is trial 105 with value: 0.09336341919701305.
[I 2025-11-03 13:08:56,105] Trial 121 finished with value: 0.07163122372666496 and parameters: {'model_type': 'gcn', 'hidden_dims': '[512, 256]', 'dropout': 0.3354357824246481, 'batch_norm': True, 'lr': 0.0003815550050435467, 'weight_decay': 3.333658464849524e-06, 'epochs': 271, 'loss': 'mse', 'optimizer': 'adam', 'graph_mode': 'off', 'use_snp_selection': True, 'num_snps': 26442}. Best is trial 105 with value: 0.09336341919701305.
[I 2025-11-03 13:08:58,021] Trial 122 finished with value: 0.0645080398908364 and parameters: {'model_type': 'gcn', 'hidden_dims': '[256, 128, 64]', 'dropout': 0.5252259536285985, 'batch_norm': True, 'lr': 0.0004871825713066611, 'weight_decay': 0.00010048929086526432, 'epochs': 288, 'loss': 'mae', 'optimizer': 'adam', 'graph_mode': 'off', 'use_snp_selection': True, 'num_snps': 25311}. Best is trial 105 with value: 0.09336341919701305.
[I 2025-11-03 13:08:59,879] Trial 123 finished with value: 0.08280028191560533 and parameters: {'model_type': 'gcn', 'hidden_dims': '[512, 256]', 'dropout': 0.5426244065464936, 'batch_norm': True, 'lr': 0.0005754406095820435, 'weight_decay': 1.151199740706392e-07, 'epochs': 261, 'loss': 'mse', 'optimizer': 'adam', 'graph_mode': 'off', 'use_snp_selection': True, 'num_snps': 28159}. Best is trial 105 with value: 0.09336341919701305.
[I 2025-11-03 13:09:01,628] Trial 124 finished with value: 0.07567771590669155 and parameters: {'model_type': 'gcn', 'hidden_dims': '[512, 256]', 'dropout': 0.3655004235511818, 'batch_norm': True, 'lr': 0.0009901591652848307, 'weight_decay': 1.6586891314753127e-07, 'epochs': 227, 'loss': 'mse', 'optimizer': 'adam', 'graph_mode': 'off', 'use_snp_selection': True, 'num_snps': 28169}. Best is trial 105 with value: 0.09336341919701305.
[I 2025-11-03 13:09:02,727] Trial 125 finished with value: 0.050749165562757034 and parameters: {'model_type': 'gcn', 'hidden_dims': '[512, 256]', 'dropout': 0.5600853289523651, 'batch_norm': True, 'lr': 0.0006438311804040236, 'weight_decay': 1.004014916291146e-07, 'epochs': 257, 'loss': 'mse', 'optimizer': 'adam', 'graph_mode': 'off', 'use_snp_selection': True, 'num_snps': 3786}. Best is trial 105 with value: 0.09336341919701305.
[I 2025-11-03 13:09:04,533] Trial 126 finished with value: 0.09636405058073463 and parameters: {'model_type': 'gcn', 'hidden_dims': '[512, 256]', 'dropout': 0.3226993911823372, 'batch_norm': True, 'lr': 0.0007326598281929799, 'weight_decay': 1.228836515669741e-07, 'epochs': 210, 'loss': 'mse', 'optimizer': 'adam', 'graph_mode': 'off', 'use_snp_selection': True, 'num_snps': 30112}. Best is trial 126 with value: 0.09636405058073463.
[I 2025-11-03 13:09:06,261] Trial 127 finished with value: 0.07649999233980335 and parameters: {'model_type': 'gcn', 'hidden_dims': '[512, 256]', 'dropout': 0.31620943798023166, 'batch_norm': False, 'lr': 0.000768390072355842, 'weight_decay': 2.0114103339750584e-07, 'epochs': 216, 'loss': 'mse', 'optimizer': 'adam', 'graph_mode': 'off', 'use_snp_selection': True, 'num_snps': 30467}. Best is trial 126 with value: 0.09636405058073463.
[I 2025-11-03 13:09:08,236] Trial 128 finished with value: 0.0894174910758578 and parameters: {'model_type': 'gcn', 'hidden_dims': '[512, 256]', 'dropout': 0.29137619264701237, 'batch_norm': True, 'lr': 0.0004435539095401857, 'weight_decay': 3.071554510572027e-07, 'epochs': 206, 'loss': 'mse', 'optimizer': 'adam', 'graph_mode': 'off', 'use_snp_selection': True, 'num_snps': 37738}. Best is trial 126 with value: 0.09636405058073463.
[I 2025-11-03 13:09:10,032] Trial 129 finished with value: 0.09584533804823578 and parameters: {'model_type': 'gcn', 'hidden_dims': '[512, 256]', 'dropout': 0.2958395163615446, 'batch_norm': True, 'lr': 0.0004180871760299677, 'weight_decay': 2.9417595772699033e-07, 'epochs': 209, 'loss': 'mse', 'optimizer': 'adam', 'graph_mode': 'off', 'use_snp_selection': True, 'num_snps': 32195}. Best is trial 126 with value: 0.09636405058073463.
[I 2025-11-03 13:09:12,009] Trial 130 finished with value: 0.09791449546929949 and parameters: {'model_type': 'gcn', 'hidden_dims': '[512, 256]', 'dropout': 0.2913550000229659, 'batch_norm': True, 'lr': 0.00046487292778886566, 'weight_decay': 3.000376632462883e-07, 'epochs': 206, 'loss': 'mse', 'optimizer': 'adam', 'graph_mode': 'off', 'use_snp_selection': True, 'num_snps': 37449}. Best is trial 130 with value: 0.09791449546929949.
[I 2025-11-03 13:09:14,094] Trial 131 finished with value: 0.08668576292069971 and parameters: {'model_type': 'gcn', 'hidden_dims': '[512, 256]', 'dropout': 0.32509501301731103, 'batch_norm': True, 'lr': 0.0004771481806818385, 'weight_decay': 2.95337309838604e-07, 'epochs': 210, 'loss': 'mse', 'optimizer': 'adam', 'graph_mode': 'off', 'use_snp_selection': True, 'num_snps': 39144}. Best is trial 130 with value: 0.09791449546929949.
