[I 2025-11-03 12:54:53,554] Trial 71 finished with value: 0.10793169902835432 and parameters: {'model_type': 'gcn', 'hidden_dims': '[256, 128]', 'dropout': 0.2374265408751493, 'batch_norm': True, 'lr': 0.0006469048092172855, 'weight_decay': 3.169175481598784e-05, 'epochs': 233, 'loss': 'mse', 'optimizer': 'adam', 'graph_mode': 'off', 'use_snp_selection': False}. Best is trial 58 with value: 0.12489917561762844.
[I 2025-11-03 12:54:55,158] Trial 72 finished with value: 0.11136788408264074 and parameters: {'model_type': 'gcn', 'hidden_dims': '[256, 128]', 'dropout': 0.28108432578364395, 'batch_norm': True, 'lr': 0.0004620222258220014, 'weight_decay': 1.7329181155199304e-05, 'epochs': 245, 'loss': 'mse', 'optimizer': 'adam', 'graph_mode': 'off', 'use_snp_selection': False}. Best is trial 58 with value: 0.12489917561762844.
[I 2025-11-03 12:54:56,904] Trial 73 finished with value: 0.11851330830606997 and parameters: {'model_type': 'gcn', 'hidden_dims': '[256, 128]', 'dropout': 0.14054857443194282, 'batch_norm': True, 'lr': 0.00023403783677370323, 'weight_decay': 1.706897128370843e-07, 'epochs': 275, 'loss': 'mse', 'optimizer': 'adam', 'graph_mode': 'off', 'use_snp_selection': False}. Best is trial 58 with value: 0.12489917561762844.
[I 2025-11-03 12:54:58,674] Trial 74 finished with value: 0.09767289206230023 and parameters: {'model_type': 'gcn', 'hidden_dims': '[256, 128]', 'dropout': 0.14182781359541421, 'batch_norm': True, 'lr': 0.00020428718391841296, 'weight_decay': 1.6648518594135648e-07, 'epochs': 278, 'loss': 'mse', 'optimizer': 'adam', 'graph_mode': 'off', 'use_snp_selection': False}. Best is trial 58 with value: 0.12489917561762844.
[I 2025-11-03 12:55:00,427] Trial 75 finished with value: 0.11453002967955585 and parameters: {'model_type': 'gcn', 'hidden_dims': '[256, 128]', 'dropout': 0.12693541184924062, 'batch_norm': True, 'lr': 0.0002799308939036768, 'weight_decay': 2.830701348203208e-07, 'epochs': 268, 'loss': 'mse', 'optimizer': 'adam', 'graph_mode': 'off', 'use_snp_selection': False}. Best is trial 58 with value: 0.12489917561762844.
[I 2025-11-03 12:55:03,156] Trial 76 finished with value: 0.11059867480267752 and parameters: {'model_type': 'gcn', 'hidden_dims': '[512, 256]', 'dropout': 0.10126923031457055, 'batch_norm': True, 'lr': 0.0002843610400380369, 'weight_decay': 2.715516957685978e-07, 'epochs': 302, 'loss': 'mse', 'optimizer': 'adam', 'graph_mode': 'off', 'use_snp_selection': False}. Best is trial 58 with value: 0.12489917561762844.
[I 2025-11-03 12:55:05,398] Trial 77 finished with value: 0.02914864159401452 and parameters: {'model_type': 'gcn', 'hidden_dims': '[256, 128, 64]', 'dropout': 0.12297492007717176, 'batch_norm': True, 'lr': 7.20148866779143e-06, 'weight_decay': 1.5030903060348813e-07, 'epochs': 319, 'loss': 'mse', 'optimizer': 'adam', 'graph_mode': 'off', 'use_snp_selection': False}. Best is trial 58 with value: 0.12489917561762844.
[I 2025-11-03 12:55:06,541] Trial 78 finished with value: 0.07084813168912149 and parameters: {'model_type': 'gcn', 'hidden_dims': '[256, 128]', 'dropout': 0.4598268852244887, 'batch_norm': True, 'lr': 0.00017503790432306173, 'weight_decay': 4.857239295263125e-07, 'epochs': 270, 'loss': 'mse', 'optimizer': 'adam', 'graph_mode': 'off', 'use_snp_selection': True, 'num_snps': 2246}. Best is trial 58 with value: 0.12489917561762844.
[I 2025-11-03 12:55:09,195] Trial 79 finished with value: 0.11394469818149694 and parameters: {'model_type': 'gcn', 'hidden_dims': '[512, 64]', 'dropout': 0.1484201223719105, 'batch_norm': True, 'lr': 0.00024084377587925827, 'weight_decay': 2.6136592904682157e-07, 'epochs': 294, 'loss': 'mse', 'optimizer': 'adam', 'graph_mode': 'off', 'use_snp_selection': False}. Best is trial 58 with value: 0.12489917561762844.
[I 2025-11-03 12:55:12,189] Trial 80 finished with value: 0.10319621648750084 and parameters: {'model_type': 'gcn', 'hidden_dims': '[512, 64]', 'dropout': 0.14597661551328223, 'batch_norm': True, 'lr': 0.00025140334879786963, 'weight_decay': 2.2919146247040998e-07, 'epochs': 342, 'loss': 'mse', 'optimizer': 'adam', 'graph_mode': 'off', 'use_snp_selection': False}. Best is trial 58 with value: 0.12489917561762844.
[I 2025-11-03 12:55:15,091] Trial 81 finished with value: 0.109455712796858 and parameters: {'model_type': 'gcn', 'hidden_dims': '[512, 64]', 'dropout': 0.18317773343669597, 'batch_norm': True, 'lr': 0.0004531213658661816, 'weight_decay': 5.007838852751865e-07, 'epochs': 330, 'loss': 'mse', 'optimizer': 'adam', 'graph_mode': 'off', 'use_snp_selection': False}. Best is trial 58 with value: 0.12489917561762844.
[I 2025-11-03 12:55:17,864] Trial 82 finished with value: 0.10222694454312414 and parameters: {'model_type': 'gcn', 'hidden_dims': '[512, 64]', 'dropout': 0.163780484205529, 'batch_norm': True, 'lr': 0.000223869723347819, 'weight_decay': 2.607717005363847e-07, 'epochs': 309, 'loss': 'mse', 'optimizer': 'adam', 'graph_mode': 'off', 'use_snp_selection': False}. Best is trial 58 with value: 0.12489917561762844.
[I 2025-11-03 12:55:20,507] Trial 83 finished with value: 0.10096951556329238 and parameters: {'model_type': 'gcn', 'hidden_dims': '[512, 64]', 'dropout': 0.12060647122135498, 'batch_norm': True, 'lr': 0.00031370602365421956, 'weight_decay': 1.3515295518254112e-07, 'epochs': 290, 'loss': 'mse', 'optimizer': 'adam', 'graph_mode': 'off', 'use_snp_selection': False}. Best is trial 58 with value: 0.12489917561762844.
[I 2025-11-03 12:55:23,059] Trial 84 finished with value: 0.0981084660007252 and parameters: {'model_type': 'gcn', 'hidden_dims': '[512, 256]', 'dropout': 0.14732951965122276, 'batch_norm': True, 'lr': 0.00017756557610138011, 'weight_decay': 3.4460470045680657e-07, 'epochs': 276, 'loss': 'mse', 'optimizer': 'adam', 'graph_mode': 'off', 'use_snp_selection': False}. Best is trial 58 with value: 0.12489917561762844.
[I 2025-11-03 12:55:25,711] Trial 85 finished with value: 0.07178036134146594 and parameters: {'model_type': 'gcn', 'hidden_dims': '[512, 128]', 'dropout': 0.13441073178939625, 'batch_norm': False, 'lr': 0.00036169794203012217, 'weight_decay': 7.717840982621627e-07, 'epochs': 297, 'loss': 'mse', 'optimizer': 'adam', 'graph_mode': 'off', 'use_snp_selection': False}. Best is trial 58 with value: 0.12489917561762844.
[I 2025-11-03 12:55:27,541] Trial 86 finished with value: 0.11353249376984269 and parameters: {'model_type': 'gcn', 'hidden_dims': '[256, 128]', 'dropout': 0.11258095958918965, 'batch_norm': True, 'lr': 0.00044019549372212297, 'weight_decay': 6.321207836121507e-07, 'epochs': 265, 'loss': 'mae', 'optimizer': 'adam', 'graph_mode': 'off', 'use_snp_selection': False}. Best is trial 58 with value: 0.12489917561762844.
[I 2025-11-03 12:55:29,274] Trial 87 finished with value: 0.1008342681113007 and parameters: {'model_type': 'gcn', 'hidden_dims': '[256, 128]', 'dropout': 0.11371919226764113, 'batch_norm': True, 'lr': 0.000419245621916937, 'weight_decay': 5.987265141472873e-07, 'epochs': 266, 'loss': 'mae', 'optimizer': 'adam', 'graph_mode': 'off', 'use_snp_selection': False}. Best is trial 58 with value: 0.12489917561762844.
[I 2025-11-03 12:55:30,958] Trial 88 finished with value: 0.10800182114503769 and parameters: {'model_type': 'gcn', 'hidden_dims': '[256, 128]', 'dropout': 0.12743789087584367, 'batch_norm': True, 'lr': 0.0002593913801738795, 'weight_decay': 3.0502241847492624e-07, 'epochs': 255, 'loss': 'mae', 'optimizer': 'adam', 'graph_mode': 'off', 'use_snp_selection': False}. Best is trial 58 with value: 0.12489917561762844.
[I 2025-11-03 12:55:33,299] Trial 89 finished with value: 0.11896589272593751 and parameters: {'model_type': 'gcn', 'hidden_dims': '[256, 128]', 'dropout': 0.1931313689155858, 'batch_norm': True, 'lr': 0.0005279197623358804, 'weight_decay': 1.7950573984817054e-07, 'epochs': 280, 'loss': 'mae', 'optimizer': 'adam', 'graph_mode': 'off', 'use_snp_selection': True, 'num_snps': 45058}. Best is trial 58 with value: 0.12489917561762844.
[I 2025-11-03 12:55:35,710] Trial 90 finished with value: 0.105174905899721 and parameters: {'model_type': 'gcn', 'hidden_dims': '[256, 128]', 'dropout': 0.19362253113622654, 'batch_norm': True, 'lr': 0.0005174540604905663, 'weight_decay': 1.853125178347344e-07, 'epochs': 278, 'loss': 'mae', 'optimizer': 'adam', 'graph_mode': 'off', 'use_snp_selection': True, 'num_snps': 46815}. Best is trial 58 with value: 0.12489917561762844.
[I 2025-11-03 12:55:37,941] Trial 91 finished with value: 0.11073842853714247 and parameters: {'model_type': 'gcn', 'hidden_dims': '[256, 128]', 'dropout': 0.17146932075306784, 'batch_norm': True, 'lr': 0.0007208926481575348, 'weight_decay': 1.2140827519980442e-07, 'epochs': 286, 'loss': 'mae', 'optimizer': 'adam', 'graph_mode': 'off', 'use_snp_selection': True, 'num_snps': 39150}. Best is trial 58 with value: 0.12489917561762844.
[I 2025-11-03 12:55:40,674] Trial 92 finished with value: 0.11530413340171658 and parameters: {'model_type': 'gcn', 'hidden_dims': '[256, 128]', 'dropout': 0.15531233027486596, 'batch_norm': True, 'lr': 0.0003479997653703628, 'weight_decay': 2.248174776695157e-07, 'epochs': 320, 'loss': 'mae', 'optimizer': 'adam', 'graph_mode': 'off', 'use_snp_selection': True, 'num_snps': 51273}. Best is trial 58 with value: 0.12489917561762844.
[I 2025-11-03 12:55:43,477] Trial 93 finished with value: 0.10680223383997024 and parameters: {'model_type': 'gcn', 'hidden_dims': '[256, 128]', 'dropout': 0.20963398963743182, 'batch_norm': True, 'lr': 0.00034100137788772145, 'weight_decay': 2.1576668130079427e-07, 'epochs': 350, 'loss': 'mae', 'optimizer': 'adam', 'graph_mode': 'off', 'use_snp_selection': True, 'num_snps': 53387}. Best is trial 58 with value: 0.12489917561762844.
[I 2025-11-03 12:55:46,199] Trial 94 finished with value: 0.09343119903255012 and parameters: {'model_type': 'gcn', 'hidden_dims': '[256, 128]', 'dropout': 0.18115823330047887, 'batch_norm': True, 'lr': 0.00028862118799728595, 'weight_decay': 3.853530843789478e-07, 'epochs': 323, 'loss': 'mae', 'optimizer': 'adam', 'graph_mode': 'off', 'use_snp_selection': True, 'num_snps': 50875}. Best is trial 58 with value: 0.12489917561762844.
[I 2025-11-03 12:55:48,486] Trial 95 finished with value: 0.10998141797366588 and parameters: {'model_type': 'gcn', 'hidden_dims': '[256, 128]', 'dropout': 0.16058358212870805, 'batch_norm': True, 'lr': 0.0005408169355696754, 'weight_decay': 7.743602819202349e-06, 'epochs': 312, 'loss': 'mae', 'optimizer': 'adam', 'graph_mode': 'off', 'use_snp_selection': True, 'num_snps': 39809}. Best is trial 58 with value: 0.12489917561762844.
[I 2025-11-03 12:55:50,048] Trial 96 finished with value: 0.010079097243801759 and parameters: {'model_type': 'gcn', 'hidden_dims': '[128, 64]', 'dropout': 0.14662948799531234, 'batch_norm': True, 'lr': 2.290642450232906e-06, 'weight_decay': 1.1213937606760912e-07, 'epochs': 241, 'loss': 'mae', 'optimizer': 'adam', 'graph_mode': 'off', 'use_snp_selection': True, 'num_snps': 28302}. Best is trial 58 with value: 0.12489917561762844.
[I 2025-11-03 12:55:53,295] Trial 97 finished with value: 0.10307171301766539 and parameters: {'model_type': 'gcn', 'hidden_dims': '[512, 64]', 'dropout': 0.17365522957898633, 'batch_norm': True, 'lr': 0.00022019946953907163, 'weight_decay': 1.8636226360674623e-07, 'epochs': 306, 'loss': 'mae', 'optimizer': 'adam', 'graph_mode': 'off', 'use_snp_selection': True, 'num_snps': 52639}. Best is trial 58 with value: 0.12489917561762844.
[I 2025-11-03 12:55:55,251] Trial 98 finished with value: 0.09362765321149429 and parameters: {'model_type': 'gcn', 'hidden_dims': '[256, 128]', 'dropout': 0.1299666950328221, 'batch_norm': True, 'lr': 0.00012914584965126555, 'weight_decay': 1.0015498038738977e-07, 'epochs': 293, 'loss': 'mse', 'optimizer': 'adam', 'graph_mode': 'off', 'use_snp_selection': True, 'num_snps': 32534}. Best is trial 58 with value: 0.12489917561762844.
[I 2025-11-03 12:55:57,583] Trial 99 finished with value: 0.09639662574650587 and parameters: {'model_type': 'gcn', 'hidden_dims': '[256, 128, 64]', 'dropout': 0.1566979539324078, 'batch_norm': False, 'lr': 0.00035985121671697505, 'weight_decay': 2.5507954633757823e-07, 'epochs': 248, 'loss': 'mae', 'optimizer': 'adam', 'graph_mode': 'off', 'use_snp_selection': True, 'num_snps': 43876}. Best is trial 58 with value: 0.12489917561762844.
[I 2025-11-03 12:56:01,227] Trial 100 finished with value: 0.11518663439805543 and parameters: {'model_type': 'gcn', 'hidden_dims': '[512, 128]', 'dropout': 0.1954348127138979, 'batch_norm': True, 'lr': 0.0006522384744699605, 'weight_decay': 4.337294689657206e-06, 'epochs': 315, 'loss': 'mse', 'optimizer': 'adam', 'graph_mode': 'off', 'use_snp_selection': True, 'num_snps': 59747}. Best is trial 58 with value: 0.12489917561762844.
[I 2025-11-03 12:56:04,849] Trial 101 finished with value: 0.11185382701113704 and parameters: {'model_type': 'gcn', 'hidden_dims': '[512, 128]', 'dropout': 0.19415962367113648, 'batch_norm': True, 'lr': 0.0005845014441093543, 'weight_decay': 1.5052712531422078e-07, 'epochs': 318, 'loss': 'mse', 'optimizer': 'adam', 'graph_mode': 'off', 'use_snp_selection': True, 'num_snps': 59766}. Best is trial 58 with value: 0.12489917561762844.
[I 2025-11-03 12:56:08,353] Trial 102 finished with value: 0.10483573038233371 and parameters: {'model_type': 'gcn', 'hidden_dims': '[512, 128]', 'dropout': 0.22730000600554406, 'batch_norm': True, 'lr': 0.0004017638094109257, 'weight_decay': 4.570511532166692e-06, 'epochs': 331, 'loss': 'mse', 'optimizer': 'adam', 'graph_mode': 'off', 'use_snp_selection': True, 'num_snps': 53219}. Best is trial 58 with value: 0.12489917561762844.
[I 2025-11-03 12:56:11,302] Trial 103 finished with value: 0.11733825631063947 and parameters: {'model_type': 'gcn', 'hidden_dims': '[512, 128]', 'dropout': 0.21120788695213824, 'batch_norm': True, 'lr': 0.0006606556628422522, 'weight_decay': 9.486407001701402e-06, 'epochs': 280, 'loss': 'mse', 'optimizer': 'adam', 'graph_mode': 'off', 'use_snp_selection': True, 'num_snps': 48024}. Best is trial 58 with value: 0.12489917561762844.
[I 2025-11-03 12:56:14,665] Trial 104 finished with value: 0.11805010358397067 and parameters: {'model_type': 'gcn', 'hidden_dims': '[512, 128]', 'dropout': 0.21201723584715954, 'batch_norm': True, 'lr': 0.0008181382794754594, 'weight_decay': 1.2729537578727675e-05, 'epochs': 338, 'loss': 'mse', 'optimizer': 'adam', 'graph_mode': 'off', 'use_snp_selection': True, 'num_snps': 49102}. Best is trial 58 with value: 0.12489917561762844.
[I 2025-11-03 12:56:17,927] Trial 105 finished with value: 0.1161096729713105 and parameters: {'model_type': 'gcn', 'hidden_dims': '[512, 128]', 'dropout': 0.20401152568810088, 'batch_norm': True, 'lr': 0.0008401075593493784, 'weight_decay': 1.3144202849307616e-05, 'epochs': 333, 'loss': 'mse', 'optimizer': 'adam', 'graph_mode': 'off', 'use_snp_selection': True, 'num_snps': 49390}. Best is trial 58 with value: 0.12489917561762844.
[I 2025-11-03 12:56:21,184] Trial 106 finished with value: 0.11066727411719565 and parameters: {'model_type': 'gcn', 'hidden_dims': '[512, 128]', 'dropout': 0.2426634315187474, 'batch_norm': True, 'lr': 0.0009946302340966037, 'weight_decay': 1.348440429315996e-05, 'epochs': 342, 'loss': 'mse', 'optimizer': 'adam', 'graph_mode': 'off', 'use_snp_selection': True, 'num_snps': 48286}. Best is trial 58 with value: 0.12489917561762844.
[I 2025-11-03 12:56:24,230] Trial 107 finished with value: 0.12997095560349564 and parameters: {'model_type': 'gcn', 'hidden_dims': '[512, 128]', 'dropout': 0.23128799623007942, 'batch_norm': True, 'lr': 0.0007514078498653582, 'weight_decay': 1.0182002273059003e-05, 'epochs': 328, 'loss': 'mse', 'optimizer': 'adam', 'graph_mode': 'off', 'use_snp_selection': True, 'num_snps': 42779}. Best is trial 107 with value: 0.12997095560349564.
[I 2025-11-03 12:56:27,298] Trial 108 finished with value: 0.11819410786982372 and parameters: {'model_type': 'gcn', 'hidden_dims': '[512, 128]', 'dropout': 0.21184645744824443, 'batch_norm': True, 'lr': 0.0008088821097659951, 'weight_decay': 9.664978726329187e-06, 'epochs': 339, 'loss': 'mse', 'optimizer': 'adam', 'graph_mode': 'off', 'use_snp_selection': True, 'num_snps': 42576}. Best is trial 107 with value: 0.12997095560349564.
[I 2025-11-03 12:56:30,461] Trial 109 finished with value: 0.12067076467912814 and parameters: {'model_type': 'gcn', 'hidden_dims': '[512, 128]', 'dropout': 0.21746136935224059, 'batch_norm': True, 'lr': 0.0008229436732329374, 'weight_decay': 8.0267890950287e-06, 'epochs': 343, 'loss': 'mse', 'optimizer': 'adam', 'graph_mode': 'off', 'use_snp_selection': True, 'num_snps': 42819}. Best is trial 107 with value: 0.12997095560349564.
[I 2025-11-03 12:56:33,461] Trial 110 finished with value: 0.1114468572662983 and parameters: {'model_type': 'gcn', 'hidden_dims': '[512, 128]', 'dropout': 0.2675562415658198, 'batch_norm': True, 'lr': 0.0007810929038303114, 'weight_decay': 6.158053880436924e-06, 'epochs': 327, 'loss': 'mse', 'optimizer': 'adam', 'graph_mode': 'off', 'use_snp_selection': True, 'num_snps': 42823}. Best is trial 107 with value: 0.12997095560349564.
[I 2025-11-03 12:56:36,596] Trial 111 finished with value: 0.11190403423599506 and parameters: {'model_type': 'gcn', 'hidden_dims': '[512, 128]', 'dropout': 0.22894067854114783, 'batch_norm': True, 'lr': 0.0008810992667886362, 'weight_decay': 1.0300198931249321e-05, 'epochs': 343, 'loss': 'mse', 'optimizer': 'adam', 'graph_mode': 'off', 'use_snp_selection': True, 'num_snps': 43341}. Best is trial 107 with value: 0.12997095560349564.
[I 2025-11-03 12:56:39,415] Trial 112 finished with value: 0.11946597216820777 and parameters: {'model_type': 'gcn', 'hidden_dims': '[512, 128]', 'dropout': 0.2569649978916811, 'batch_norm': True, 'lr': 0.000697859182657499, 'weight_decay': 8.129397893883496e-06, 'epochs': 347, 'loss': 'mse', 'optimizer': 'adam', 'graph_mode': 'off', 'use_snp_selection': True, 'num_snps': 37852}. Best is trial 107 with value: 0.12997095560349564.
[I 2025-11-03 12:56:42,150] Trial 113 finished with value: 0.11445992907118131 and parameters: {'model_type': 'gcn', 'hidden_dims': '[512, 128]', 'dropout': 0.23376268343859277, 'batch_norm': True, 'lr': 0.00048196733802947646, 'weight_decay': 7.3662129985406304e-06, 'epochs': 340, 'loss': 'mse', 'optimizer': 'adam', 'graph_mode': 'off', 'use_snp_selection': True, 'num_snps': 35971}. Best is trial 107 with value: 0.12997095560349564.
[I 2025-11-03 12:56:45,068] Trial 114 finished with value: 0.11809795710506338 and parameters: {'model_type': 'gcn', 'hidden_dims': '[512, 128]', 'dropout': 0.25605297507090957, 'batch_norm': True, 'lr': 0.0006997451371959872, 'weight_decay': 1.5713464251259577e-05, 'epochs': 337, 'loss': 'mse', 'optimizer': 'adam', 'graph_mode': 'off', 'use_snp_selection': True, 'num_snps': 40442}. Best is trial 107 with value: 0.12997095560349564.
[I 2025-11-03 12:56:47,946] Trial 115 finished with value: 0.11497218413234604 and parameters: {'model_type': 'gcn', 'hidden_dims': '[512, 128]', 'dropout': 0.2186392158070176, 'batch_norm': True, 'lr': 0.0007062895044184676, 'weight_decay': 1.597656325866391e-05, 'epochs': 336, 'loss': 'mse', 'optimizer': 'adam', 'graph_mode': 'off', 'use_snp_selection': True, 'num_snps': 39975}. Best is trial 107 with value: 0.12997095560349564.
[I 2025-11-03 12:56:50,664] Trial 116 finished with value: 0.11160428991630789 and parameters: {'model_type': 'gcn', 'hidden_dims': '[512, 128]', 'dropout': 0.25197489307726406, 'batch_norm': True, 'lr': 0.0008665252532203961, 'weight_decay': 1.9105869242574618e-05, 'epochs': 349, 'loss': 'mse', 'optimizer': 'adam', 'graph_mode': 'off', 'use_snp_selection': True, 'num_snps': 36268}. Best is trial 107 with value: 0.12997095560349564.
[I 2025-11-03 12:56:53,813] Trial 117 finished with value: 0.12056388513597839 and parameters: {'model_type': 'gcn', 'hidden_dims': '[512, 128]', 'dropout': 0.2587102338308267, 'batch_norm': True, 'lr': 0.0009796928966275113, 'weight_decay': 2.3085695718871856e-05, 'epochs': 326, 'loss': 'mse', 'optimizer': 'adam', 'graph_mode': 'off', 'use_snp_selection': True, 'num_snps': 44407}. Best is trial 107 with value: 0.12997095560349564.
[I 2025-11-03 12:56:56,875] Trial 118 finished with value: 0.12071237525899299 and parameters: {'model_type': 'gcn', 'hidden_dims': '[512, 128]', 'dropout': 0.25928186094696526, 'batch_norm': True, 'lr': 0.000608282429799043, 'weight_decay': 2.2419729318149018e-05, 'epochs': 324, 'loss': 'mse', 'optimizer': 'adam', 'graph_mode': 'off', 'use_snp_selection': True, 'num_snps': 44008}. Best is trial 107 with value: 0.12997095560349564.
[I 2025-11-03 12:56:59,993] Trial 119 finished with value: 0.11614553394539641 and parameters: {'model_type': 'gcn', 'hidden_dims': '[512, 128]', 'dropout': 0.2758727891755275, 'batch_norm': True, 'lr': 0.000582365170208764, 'weight_decay': 3.078755261290469e-05, 'epochs': 329, 'loss': 'mse', 'optimizer': 'adam', 'graph_mode': 'off', 'use_snp_selection': True, 'num_snps': 44382}. Best is trial 107 with value: 0.12997095560349564.
[I 2025-11-03 12:57:02,483] Trial 120 finished with value: 0.02347889715074506 and parameters: {'model_type': 'gcn', 'hidden_dims': '[512, 128]', 'dropout': 0.3062468162456913, 'batch_norm': False, 'lr': 0.0009446583893147579, 'weight_decay': 2.3570298139713458e-05, 'epochs': 324, 'loss': 'mse', 'optimizer': 'adam', 'graph_mode': 'off', 'use_snp_selection': True, 'num_snps': 34579}. Best is trial 107 with value: 0.12997095560349564.
[I 2025-11-03 12:57:05,489] Trial 121 finished with value: 0.11117469834708915 and parameters: {'model_type': 'gcn', 'hidden_dims': '[512, 128]', 'dropout': 0.2601797701985413, 'batch_norm': True, 'lr': 0.0007136630974393117, 'weight_decay': 3.706443037044009e-05, 'epochs': 335, 'loss': 'mse', 'optimizer': 'adam', 'graph_mode': 'off', 'use_snp_selection': True, 'num_snps': 41020}. Best is trial 107 with value: 0.12997095560349564.
