[I 2025-11-03 12:51:04,057] Trial 118 finished with value: 0.14059933028265184 and parameters: {'model_type': 'gcn', 'hidden_dims': '[512, 128]', 'dropout': 0.142897678679203, 'batch_norm': True, 'lr': 0.0004596357711787527, 'weight_decay': 6.440762162925065e-06, 'epochs': 250, 'loss': 'mae', 'optimizer': 'adam', 'graph_mode': 'off', 'use_snp_selection': True, 'num_snps': 40266}. Best is trial 74 with value: 0.15112741373180422.
[I 2025-11-03 12:51:07,506] Trial 119 finished with value: 0.1326602748954838 and parameters: {'model_type': 'gcn', 'hidden_dims': '[512, 128]', 'dropout': 0.100442315645491, 'batch_norm': True, 'lr': 0.0005266667461947673, 'weight_decay': 1.015599105515301e-06, 'epochs': 271, 'loss': 'mae', 'optimizer': 'adam', 'graph_mode': 'off', 'use_snp_selection': True, 'num_snps': 35084}. Best is trial 74 with value: 0.15112741373180422.
[I 2025-11-03 12:51:11,313] Trial 120 finished with value: 0.11960846586463651 and parameters: {'model_type': 'gcn', 'hidden_dims': '[512, 128]', 'dropout': 0.19651505760708396, 'batch_norm': False, 'lr': 0.0003547138534155095, 'weight_decay': 6.701877647278008e-07, 'epochs': 262, 'loss': 'mae', 'optimizer': 'adam', 'graph_mode': 'off', 'use_snp_selection': True, 'num_snps': 43605}. Best is trial 74 with value: 0.15112741373180422.
[I 2025-11-03 12:51:14,614] Trial 121 finished with value: 0.13626407071343374 and parameters: {'model_type': 'gcn', 'hidden_dims': '[512, 128]', 'dropout': 0.11248267935612552, 'batch_norm': True, 'lr': 0.0004337488168651494, 'weight_decay': 4.1877136050810187e-07, 'epochs': 237, 'loss': 'mae', 'optimizer': 'adam', 'graph_mode': 'off', 'use_snp_selection': True, 'num_snps': 37890}. Best is trial 74 with value: 0.15112741373180422.
[I 2025-11-03 12:51:17,695] Trial 122 finished with value: 0.14090288782912952 and parameters: {'model_type': 'gcn', 'hidden_dims': '[512, 128]', 'dropout': 0.12006148800967495, 'batch_norm': True, 'lr': 0.00029703046923083696, 'weight_decay': 2.3808036869335318e-07, 'epochs': 245, 'loss': 'mae', 'optimizer': 'adam', 'graph_mode': 'off', 'use_snp_selection': True, 'num_snps': 33340}. Best is trial 74 with value: 0.15112741373180422.
[I 2025-11-03 12:51:20,225] Trial 123 finished with value: 0.1326448811944311 and parameters: {'model_type': 'gcn', 'hidden_dims': '[512, 128]', 'dropout': 0.14819177835980826, 'batch_norm': True, 'lr': 0.0006027648466763685, 'weight_decay': 4.830649109726979e-07, 'epochs': 230, 'loss': 'mae', 'optimizer': 'adam', 'graph_mode': 'off', 'use_snp_selection': True, 'num_snps': 24990}. Best is trial 74 with value: 0.15112741373180422.
[I 2025-11-03 12:51:23,932] Trial 124 finished with value: 0.13631051832251176 and parameters: {'model_type': 'gcn', 'hidden_dims': '[512, 128]', 'dropout': 0.13449757246844316, 'batch_norm': True, 'lr': 0.00021444730367571951, 'weight_decay': 3.796410469277432e-07, 'epochs': 272, 'loss': 'mae', 'optimizer': 'adam', 'graph_mode': 'off', 'use_snp_selection': True, 'num_snps': 40365}. Best is trial 74 with value: 0.15112741373180422.
[I 2025-11-03 12:51:26,952] Trial 125 finished with value: 0.12896666310354002 and parameters: {'model_type': 'gcn', 'hidden_dims': '[512, 128]', 'dropout': 0.16989885588600423, 'batch_norm': True, 'lr': 0.000836517224607851, 'weight_decay': 1.0263070246675445e-07, 'epochs': 201, 'loss': 'mae', 'optimizer': 'adam', 'graph_mode': 'off', 'use_snp_selection': False}. Best is trial 74 with value: 0.15112741373180422.
[I 2025-11-03 12:51:29,134] Trial 126 finished with value: 0.11840838180922159 and parameters: {'model_type': 'gcn', 'hidden_dims': '[512, 128]', 'dropout': 0.15813043638925792, 'batch_norm': True, 'lr': 0.00017586206407935618, 'weight_decay': 6.728987937209797e-07, 'epochs': 93, 'loss': 'mae', 'optimizer': 'adam', 'graph_mode': 'off', 'use_snp_selection': True, 'num_snps': 36385}. Best is trial 74 with value: 0.15112741373180422.
[I 2025-11-03 12:51:32,578] Trial 127 finished with value: 0.13959715547765275 and parameters: {'model_type': 'gcn', 'hidden_dims': '[512, 128]', 'dropout': 0.10837382488985192, 'batch_norm': True, 'lr': 0.00024926279357776057, 'weight_decay': 1.9952505796401236e-07, 'epochs': 215, 'loss': 'mae', 'optimizer': 'adam', 'graph_mode': 'off', 'use_snp_selection': True, 'num_snps': 43078}. Best is trial 74 with value: 0.15112741373180422.
[I 2025-11-03 12:51:36,242] Trial 128 finished with value: 0.1375187939028143 and parameters: {'model_type': 'gcn', 'hidden_dims': '[512, 128]', 'dropout': 0.11762213499382079, 'batch_norm': True, 'lr': 0.00071898752648016, 'weight_decay': 3.081992070681755e-07, 'epochs': 255, 'loss': 'mse', 'optimizer': 'adam', 'graph_mode': 'off', 'use_snp_selection': False}. Best is trial 74 with value: 0.15112741373180422.
[I 2025-11-03 12:51:39,340] Trial 129 finished with value: 0.08134191726777341 and parameters: {'model_type': 'gcn', 'hidden_dims': '[512, 128]', 'dropout': 0.13933625132870903, 'batch_norm': True, 'lr': 2.735629121605038e-06, 'weight_decay': 1.9014500173016547e-06, 'epochs': 151, 'loss': 'mae', 'optimizer': 'adam', 'graph_mode': 'off', 'use_snp_selection': True, 'num_snps': 48328}. Best is trial 74 with value: 0.15112741373180422.
[I 2025-11-03 12:51:42,652] Trial 130 finished with value: 0.12335022312887484 and parameters: {'model_type': 'gcn', 'hidden_dims': '[512, 128]', 'dropout': 0.10023304402017541, 'batch_norm': True, 'lr': 4.399424237257905e-05, 'weight_decay': 1.2858349042911432e-06, 'epochs': 224, 'loss': 'mae', 'optimizer': 'adam', 'graph_mode': 'off', 'use_snp_selection': True, 'num_snps': 38698}. Best is trial 74 with value: 0.15112741373180422.
[I 2025-11-03 12:51:46,015] Trial 131 finished with value: 0.13498774592962143 and parameters: {'model_type': 'gcn', 'hidden_dims': '[512, 64]', 'dropout': 0.1268338997203674, 'batch_norm': True, 'lr': 0.000988259861725663, 'weight_decay': 2.599178590260389e-07, 'epochs': 187, 'loss': 'mae', 'optimizer': 'adam', 'graph_mode': 'off', 'use_snp_selection': True, 'num_snps': 44897}. Best is trial 74 with value: 0.15112741373180422.
[I 2025-11-03 12:51:48,963] Trial 132 finished with value: 0.14153444933083492 and parameters: {'model_type': 'gcn', 'hidden_dims': '[512, 128]', 'dropout': 0.1314723901299781, 'batch_norm': True, 'lr': 0.0008258327079452829, 'weight_decay': 1.5626527702735776e-07, 'epochs': 167, 'loss': 'mae', 'optimizer': 'adam', 'graph_mode': 'off', 'use_snp_selection': True, 'num_snps': 41477}. Best is trial 74 with value: 0.15112741373180422.
[I 2025-11-03 12:51:52,653] Trial 133 finished with value: 0.1353125733260705 and parameters: {'model_type': 'gcn', 'hidden_dims': '[512, 64]', 'dropout': 0.1461624659785026, 'batch_norm': True, 'lr': 0.0004988704351996389, 'weight_decay': 3.131759053066269e-07, 'epochs': 195, 'loss': 'mae', 'optimizer': 'adam', 'graph_mode': 'off', 'use_snp_selection': True, 'num_snps': 51392}. Best is trial 74 with value: 0.15112741373180422.
[I 2025-11-03 12:51:55,954] Trial 134 finished with value: 0.14123437037129655 and parameters: {'model_type': 'gcn', 'hidden_dims': '[512, 128]', 'dropout': 0.11534528583425968, 'batch_norm': True, 'lr': 0.0006827782632854135, 'weight_decay': 4.188367732938999e-07, 'epochs': 179, 'loss': 'mae', 'optimizer': 'adam', 'graph_mode': 'off', 'use_snp_selection': True, 'num_snps': 46399}. Best is trial 74 with value: 0.15112741373180422.
[I 2025-11-03 12:51:59,091] Trial 135 finished with value: 0.13487199666707828 and parameters: {'model_type': 'gcn', 'hidden_dims': '[256, 128, 64]', 'dropout': 0.161339339869236, 'batch_norm': True, 'lr': 0.0005849006500611409, 'weight_decay': 2.2215313550765623e-07, 'epochs': 242, 'loss': 'mae', 'optimizer': 'adam', 'graph_mode': 'off', 'use_snp_selection': True, 'num_snps': 44074}. Best is trial 74 with value: 0.15112741373180422.
[I 2025-11-03 12:52:02,168] Trial 136 finished with value: 0.14126442522493687 and parameters: {'model_type': 'gcn', 'hidden_dims': '[512, 256]', 'dropout': 0.12791512229163007, 'batch_norm': True, 'lr': 0.000777295412952755, 'weight_decay': 5.678193505449078e-07, 'epochs': 205, 'loss': 'mae', 'optimizer': 'adam', 'graph_mode': 'off', 'use_snp_selection': False}. Best is trial 74 with value: 0.15112741373180422.
[I 2025-11-03 12:52:03,968] Trial 137 finished with value: 0.11861363159028986 and parameters: {'model_type': 'gcn', 'hidden_dims': '[512, 128]', 'dropout': 0.17712780752294346, 'batch_norm': True, 'lr': 0.0004300949834757733, 'weight_decay': 1.3315516144508228e-07, 'epochs': 190, 'loss': 'mae', 'optimizer': 'adam', 'graph_mode': 'off', 'use_snp_selection': True, 'num_snps': 14782}. Best is trial 74 with value: 0.15112741373180422.
[I 2025-11-03 12:52:07,894] Trial 138 finished with value: 0.13617167335928101 and parameters: {'model_type': 'gcn', 'hidden_dims': '[512, 64]', 'dropout': 0.15170347532997522, 'batch_norm': True, 'lr': 0.0008973747602795803, 'weight_decay': 0.0008088128680830106, 'epochs': 281, 'loss': 'mae', 'optimizer': 'adam', 'graph_mode': 'off', 'use_snp_selection': True, 'num_snps': 41965}. Best is trial 74 with value: 0.15112741373180422.
[I 2025-11-03 12:52:10,667] Trial 139 finished with value: 0.14494279432068113 and parameters: {'model_type': 'gcn', 'hidden_dims': '[512, 128]', 'dropout': 0.13815435831159126, 'batch_norm': True, 'lr': 0.0003717789644495463, 'weight_decay': 3.4967952898789746e-07, 'epochs': 175, 'loss': 'mae', 'optimizer': 'adam', 'graph_mode': 'off', 'use_snp_selection': False}. Best is trial 74 with value: 0.15112741373180422.
[I 2025-11-03 12:52:13,407] Trial 140 finished with value: 0.1332341397687927 and parameters: {'model_type': 'gcn', 'hidden_dims': '[512, 128]', 'dropout': 0.1396818999525701, 'batch_norm': True, 'lr': 0.0002609509809376816, 'weight_decay': 8.484743394132272e-07, 'epochs': 172, 'loss': 'mae', 'optimizer': 'adam', 'graph_mode': 'off', 'use_snp_selection': False}. Best is trial 74 with value: 0.15112741373180422.
[I 2025-11-03 12:52:16,170] Trial 141 finished with value: 0.13577766836255276 and parameters: {'model_type': 'gcn', 'hidden_dims': '[512, 128]', 'dropout': 0.11926831925376154, 'batch_norm': True, 'lr': 0.00034917582242799866, 'weight_decay': 2.6392672064441035e-07, 'epochs': 177, 'loss': 'mae', 'optimizer': 'adam', 'graph_mode': 'off', 'use_snp_selection': False}. Best is trial 74 with value: 0.15112741373180422.
[I 2025-11-03 12:52:18,887] Trial 142 finished with value: 0.14186358287921175 and parameters: {'model_type': 'gcn', 'hidden_dims': '[512, 128]', 'dropout': 0.130064981686969, 'batch_norm': True, 'lr': 0.000304699997829034, 'weight_decay': 3.318277520916653e-07, 'epochs': 163, 'loss': 'mae', 'optimizer': 'adam', 'graph_mode': 'off', 'use_snp_selection': False}. Best is trial 74 with value: 0.15112741373180422.
[I 2025-11-03 12:52:21,699] Trial 143 finished with value: 0.1481441210093924 and parameters: {'model_type': 'gcn', 'hidden_dims': '[512, 128]', 'dropout': 0.10940044677262016, 'batch_norm': True, 'lr': 0.0005402184776084265, 'weight_decay': 3.6152974207354776e-07, 'epochs': 182, 'loss': 'mae', 'optimizer': 'adam', 'graph_mode': 'off', 'use_snp_selection': False}. Best is trial 74 with value: 0.15112741373180422.
[I 2025-11-03 12:52:24,201] Trial 144 finished with value: 0.15486107650605474 and parameters: {'model_type': 'gcn', 'hidden_dims': '[512, 128]', 'dropout': 0.10726045251159055, 'batch_norm': True, 'lr': 0.0005037915223495533, 'weight_decay': 4.602609347062833e-07, 'epochs': 150, 'loss': 'mae', 'optimizer': 'adam', 'graph_mode': 'off', 'use_snp_selection': False}. Best is trial 144 with value: 0.15486107650605474.
[I 2025-11-03 12:52:26,726] Trial 145 finished with value: 0.13395068890434628 and parameters: {'model_type': 'gcn', 'hidden_dims': '[512, 128]', 'dropout': 0.10839959609734325, 'batch_norm': True, 'lr': 0.0005001103008935698, 'weight_decay': 4.865098313340909e-07, 'epochs': 153, 'loss': 'mae', 'optimizer': 'adam', 'graph_mode': 'off', 'use_snp_selection': False}. Best is trial 144 with value: 0.15486107650605474.
[I 2025-11-03 12:52:29,100] Trial 146 finished with value: 0.11505606746661032 and parameters: {'model_type': 'gcn', 'hidden_dims': '[512, 128]', 'dropout': 0.10071883227458808, 'batch_norm': False, 'lr': 0.0005760662110747015, 'weight_decay': 3.932173427708887e-07, 'epochs': 144, 'loss': 'mae', 'optimizer': 'adam', 'graph_mode': 'off', 'use_snp_selection': False}. Best is trial 144 with value: 0.15486107650605474.
[I 2025-11-03 12:52:31,818] Trial 147 finished with value: 0.12615728310873328 and parameters: {'model_type': 'gcn', 'hidden_dims': '[512, 128]', 'dropout': 0.1472137618055655, 'batch_norm': True, 'lr': 0.00037881066923438464, 'weight_decay': 1.8697347983285095e-07, 'epochs': 169, 'loss': 'mae', 'optimizer': 'adam', 'graph_mode': 'off', 'use_snp_selection': False}. Best is trial 144 with value: 0.15486107650605474.
[I 2025-11-03 12:52:34,799] Trial 148 finished with value: 0.12926469707975252 and parameters: {'model_type': 'gcn', 'hidden_dims': '[512, 128]', 'dropout': 0.11116364033945735, 'batch_norm': True, 'lr': 0.0004593920167617713, 'weight_decay': 5.418978866233006e-07, 'epochs': 196, 'loss': 'mae', 'optimizer': 'adam', 'graph_mode': 'off', 'use_snp_selection': False}. Best is trial 144 with value: 0.15486107650605474.
[I 2025-11-03 12:52:36,853] Trial 149 finished with value: 0.14261499478650583 and parameters: {'model_type': 'gcn', 'hidden_dims': '[512, 128]', 'dropout': 0.16309488422563082, 'batch_norm': True, 'lr': 0.0006092823678975812, 'weight_decay': 2.2244218673139192e-07, 'epochs': 112, 'loss': 'mae', 'optimizer': 'adam', 'graph_mode': 'off', 'use_snp_selection': False}. Best is trial 144 with value: 0.15486107650605474.
[I 2025-11-03 12:52:39,014] Trial 0 finished with value: 0.06416197895050613 and parameters: {'model_type': 'gcn', 'hidden_dims': '[128, 64]', 'dropout': 0.199031432379812, 'batch_norm': True, 'lr': 1.8408544111075837e-06, 'weight_decay': 5.5136510071208614e-05, 'epochs': 336, 'loss': 'mae', 'optimizer': 'adam', 'graph_mode': 'off', 'use_snp_selection': True, 'num_snps': 43862}. Best is trial 0 with value: 0.06416197895050613.
[I 2025-11-03 12:52:40,773] Trial 1 finished with value: 0.09016589246923382 and parameters: {'model_type': 'gcn', 'hidden_dims': '[256, 128]', 'dropout': 0.4370668075331726, 'batch_norm': True, 'lr': 7.133471581159139e-05, 'weight_decay': 1.128633586803549e-05, 'epochs': 242, 'loss': 'mae', 'optimizer': 'adam', 'graph_mode': 'off', 'use_snp_selection': False}. Best is trial 1 with value: 0.09016589246923382.
[I 2025-11-03 12:52:41,919] Trial 2 finished with value: -0.0037842989175768376 and parameters: {'model_type': 'gcn', 'hidden_dims': '[256, 128, 64]', 'dropout': 0.41314357415569625, 'batch_norm': False, 'lr': 3.952233718592101e-06, 'weight_decay': 0.00026754769258252603, 'epochs': 149, 'loss': 'mse', 'optimizer': 'adam', 'graph_mode': 'off', 'use_snp_selection': True, 'num_snps': 11571}. Best is trial 1 with value: 0.09016589246923382.
[I 2025-11-03 12:52:44,693] Trial 3 finished with value: 0.0515341665006265 and parameters: {'model_type': 'gcn', 'hidden_dims': '[512, 64]', 'dropout': 0.5938127374509361, 'batch_norm': False, 'lr': 5.67704586114731e-06, 'weight_decay': 2.4518087630137052e-05, 'epochs': 320, 'loss': 'mae', 'optimizer': 'adam', 'graph_mode': 'off', 'use_snp_selection': False}. Best is trial 1 with value: 0.09016589246923382.
[I 2025-11-03 12:52:47,138] Trial 4 finished with value: 0.048961295727390226 and parameters: {'model_type': 'gcn', 'hidden_dims': '[512, 128]', 'dropout': 0.25746343592134413, 'batch_norm': True, 'lr': 1.3467657668402788e-06, 'weight_decay': 0.00033087251918647806, 'epochs': 277, 'loss': 'mse', 'optimizer': 'adam', 'graph_mode': 'off', 'use_snp_selection': True, 'num_snps': 36675}. Best is trial 1 with value: 0.09016589246923382.
[I 2025-11-03 12:52:48,876] Trial 5 finished with value: 0.015098449279415206 and parameters: {'model_type': 'gcn', 'hidden_dims': '[512, 64]', 'dropout': 0.38275350994408375, 'batch_norm': True, 'lr': 1.5586664309232824e-06, 'weight_decay': 0.0008227664668621182, 'epochs': 145, 'loss': 'mae', 'optimizer': 'adam', 'graph_mode': 'off', 'use_snp_selection': True, 'num_snps': 32148}. Best is trial 1 with value: 0.09016589246923382.
[I 2025-11-03 12:52:50,396] Trial 6 finished with value: 0.06744380881906681 and parameters: {'model_type': 'gcn', 'hidden_dims': '[256, 128]', 'dropout': 0.3930109900265879, 'batch_norm': False, 'lr': 4.892964372128395e-05, 'weight_decay': 1.5809549317992182e-06, 'epochs': 199, 'loss': 'mse', 'optimizer': 'adam', 'graph_mode': 'off', 'use_snp_selection': False}. Best is trial 1 with value: 0.09016589246923382.
[I 2025-11-03 12:52:51,774] Trial 7 finished with value: 0.1134701291649533 and parameters: {'model_type': 'gcn', 'hidden_dims': '[512, 256]', 'dropout': 0.15343979219678458, 'batch_norm': True, 'lr': 6.234003099047341e-05, 'weight_decay': 3.894760610535477e-07, 'epochs': 97, 'loss': 'mse', 'optimizer': 'adam', 'graph_mode': 'off', 'use_snp_selection': False}. Best is trial 7 with value: 0.1134701291649533.
[I 2025-11-03 12:52:54,576] Trial 8 finished with value: 0.10277813283557025 and parameters: {'model_type': 'gcn', 'hidden_dims': '[512, 128]', 'dropout': 0.10743001231661406, 'batch_norm': True, 'lr': 0.00023728538449271062, 'weight_decay': 1.7629071578048637e-05, 'epochs': 312, 'loss': 'mae', 'optimizer': 'adam', 'graph_mode': 'off', 'use_snp_selection': False}. Best is trial 7 with value: 0.1134701291649533.
[I 2025-11-03 12:52:56,415] Trial 9 finished with value: 0.07545995960579903 and parameters: {'model_type': 'gcn', 'hidden_dims': '[512, 64]', 'dropout': 0.14505336736221927, 'batch_norm': True, 'lr': 5.8619638388111826e-05, 'weight_decay': 6.200156172669308e-07, 'epochs': 175, 'loss': 'mse', 'optimizer': 'adam', 'graph_mode': 'off', 'use_snp_selection': False}. Best is trial 7 with value: 0.1134701291649533.
[I 2025-11-03 12:52:57,457] Trial 10 finished with value: 0.023209043277014767 and parameters: {'model_type': 'gcn', 'hidden_dims': '[512, 256]', 'dropout': 0.2736992815328032, 'batch_norm': False, 'lr': 0.00032393778075602147, 'weight_decay': 1.1511946696017091e-07, 'epochs': 41, 'loss': 'mse', 'optimizer': 'adam', 'graph_mode': 'off', 'use_snp_selection': False}. Best is trial 7 with value: 0.1134701291649533.
[I 2025-11-03 12:52:58,678] Trial 11 finished with value: 0.10778233227254569 and parameters: {'model_type': 'gcn', 'hidden_dims': '[512, 128]', 'dropout': 0.10095648685224448, 'batch_norm': True, 'lr': 0.0007666984023899754, 'weight_decay': 2.512571353186099e-06, 'epochs': 70, 'loss': 'mae', 'optimizer': 'adam', 'graph_mode': 'off', 'use_snp_selection': False}. Best is trial 7 with value: 0.1134701291649533.
[I 2025-11-03 12:52:59,850] Trial 12 finished with value: 0.10055039636735513 and parameters: {'model_type': 'gcn', 'hidden_dims': '[512, 256]', 'dropout': 0.10344600881777158, 'batch_norm': True, 'lr': 0.0006753264773209732, 'weight_decay': 1.2006458821839938e-06, 'epochs': 63, 'loss': 'mae', 'optimizer': 'adam', 'graph_mode': 'off', 'use_snp_selection': False}. Best is trial 7 with value: 0.1134701291649533.
[I 2025-11-03 12:53:01,213] Trial 13 finished with value: 0.0398857058964707 and parameters: {'model_type': 'gcn', 'hidden_dims': '[512, 256]', 'dropout': 0.20673363050739701, 'batch_norm': True, 'lr': 1.3373175420781734e-05, 'weight_decay': 1.8965593394883618e-07, 'epochs': 92, 'loss': 'mse', 'optimizer': 'adam', 'graph_mode': 'off', 'use_snp_selection': False}. Best is trial 7 with value: 0.1134701291649533.
[I 2025-11-03 12:53:02,692] Trial 14 finished with value: 0.10905014914593664 and parameters: {'model_type': 'gcn', 'hidden_dims': '[512, 128]', 'dropout': 0.3012984444538551, 'batch_norm': True, 'lr': 0.0009000048932733864, 'weight_decay': 3.2568808920327207e-06, 'epochs': 110, 'loss': 'mae', 'optimizer': 'adam', 'graph_mode': 'off', 'use_snp_selection': False}. Best is trial 7 with value: 0.1134701291649533.
[I 2025-11-03 12:53:03,560] Trial 15 finished with value: 0.08322436783331195 and parameters: {'model_type': 'gcn', 'hidden_dims': '[128, 64]', 'dropout': 0.31234772133630384, 'batch_norm': True, 'lr': 0.0001572871022003765, 'weight_decay': 4.647398975110258e-06, 'epochs': 117, 'loss': 'mse', 'optimizer': 'adam', 'graph_mode': 'off', 'use_snp_selection': False}. Best is trial 7 with value: 0.1134701291649533.
[I 2025-11-03 12:53:04,706] Trial 16 finished with value: 0.05311806308958178 and parameters: {'model_type': 'gcn', 'hidden_dims': '[256, 128, 64]', 'dropout': 0.47522796769107767, 'batch_norm': True, 'lr': 2.1517090787442848e-05, 'weight_decay': 3.749525779502734e-07, 'epochs': 104, 'loss': 'mae', 'optimizer': 'adam', 'graph_mode': 'off', 'use_snp_selection': False}. Best is trial 7 with value: 0.1134701291649533.
[I 2025-11-03 12:53:06,778] Trial 17 finished with value: 0.08263669727658188 and parameters: {'model_type': 'gcn', 'hidden_dims': '[512, 128]', 'dropout': 0.2027968106615825, 'batch_norm': True, 'lr': 0.00011570589018203528, 'weight_decay': 3.7840409231649135e-06, 'epochs': 202, 'loss': 'mse', 'optimizer': 'adam', 'graph_mode': 'off', 'use_snp_selection': False}. Best is trial 7 with value: 0.1134701291649533.
[I 2025-11-03 12:53:09,281] Trial 18 finished with value: 0.05022980628325879 and parameters: {'model_type': 'gcn', 'hidden_dims': '[512, 256]', 'dropout': 0.32223702172256136, 'batch_norm': False, 'lr': 0.0009812890749830259, 'weight_decay': 4.999091826142784e-07, 'epochs': 143, 'loss': 'mae', 'optimizer': 'adam', 'graph_mode': 'off', 'use_snp_selection': True, 'num_snps': 58241}. Best is trial 7 with value: 0.1134701291649533.
