[I 2025-11-03 13:12:09,498] Trial 26 finished with value: 0.09680793514234376 and parameters: {'model_type': 'gcn', 'hidden_dims': '[512, 128]', 'dropout': 0.38745679041920295, 'batch_norm': False, 'lr': 0.00040471030482819043, 'weight_decay': 1.7723406665945992e-07, 'epochs': 254, 'loss': 'mae', 'optimizer': 'adam', 'graph_mode': 'cutoff', 'cutoff': 0.8765009073803762, 'grm_norm': 'none', 'self_loops': True, 'use_snp_selection': True, 'num_snps': 59005}. Best is trial 11 with value: 0.14984901617707141.
[I 2025-11-03 13:12:12,063] Trial 27 finished with value: 0.06937726385232194 and parameters: {'model_type': 'gcn', 'hidden_dims': '[256, 128]', 'dropout': 0.4440172934506005, 'batch_norm': True, 'lr': 1.9937354098458108e-05, 'weight_decay': 5.80944391997584e-06, 'epochs': 187, 'loss': 'mse', 'optimizer': 'adam', 'graph_mode': 'knn', 'source': 'grm', 'knn_k': 4, 'weighted_edges': True, 'symmetrize_mode': 'union', 'use_snp_selection': False}. Best is trial 11 with value: 0.14984901617707141.
[I 2025-11-03 13:12:15,955] Trial 28 finished with value: 0.13580889801384333 and parameters: {'model_type': 'gcn', 'hidden_dims': '[256, 128, 64]', 'dropout': 0.1574132891495136, 'batch_norm': True, 'lr': 7.341549191641728e-05, 'weight_decay': 5.000512563478479e-07, 'epochs': 334, 'loss': 'mae', 'optimizer': 'adam', 'graph_mode': 'knn', 'source': 'grm', 'knn_k': 1, 'weighted_edges': False, 'symmetrize_mode': 'mutual', 'use_snp_selection': False}. Best is trial 11 with value: 0.14984901617707141.
[I 2025-11-03 13:12:18,568] Trial 29 finished with value: 0.12441804388140573 and parameters: {'model_type': 'gcn', 'hidden_dims': '[128, 64]', 'dropout': 0.352906862512499, 'batch_norm': True, 'lr': 0.00013142057674351358, 'weight_decay': 9.759564253024096e-05, 'epochs': 321, 'loss': 'mae', 'optimizer': 'adam', 'graph_mode': 'knn', 'source': 'grm', 'knn_k': 3, 'weighted_edges': True, 'symmetrize_mode': 'union', 'use_snp_selection': False}. Best is trial 11 with value: 0.14984901617707141.
[I 2025-11-03 13:12:23,336] Trial 30 finished with value: 0.03990723483039914 and parameters: {'model_type': 'gcn', 'hidden_dims': '[512, 64]', 'dropout': 0.21870368123902434, 'batch_norm': True, 'lr': 1.2963802273643008e-06, 'weight_decay': 2.1844641516220384e-07, 'epochs': 285, 'loss': 'mae', 'optimizer': 'adam', 'graph_mode': 'knn', 'source': 'grm', 'knn_k': 2, 'weighted_edges': True, 'symmetrize_mode': 'union', 'use_snp_selection': False}. Best is trial 11 with value: 0.14984901617707141.
[I 2025-11-03 13:12:27,792] Trial 31 finished with value: 0.13331068320250244 and parameters: {'model_type': 'gcn', 'hidden_dims': '[512, 64]', 'dropout': 0.2961448616607328, 'batch_norm': True, 'lr': 0.00018954534322919024, 'weight_decay': 1.7510640731259243e-07, 'epochs': 261, 'loss': 'mae', 'optimizer': 'adam', 'graph_mode': 'knn', 'source': 'grm', 'knn_k': 1, 'weighted_edges': True, 'symmetrize_mode': 'union', 'use_snp_selection': False}. Best is trial 11 with value: 0.14984901617707141.
[I 2025-11-03 13:12:32,086] Trial 32 finished with value: 0.15312810173820499 and parameters: {'model_type': 'gcn', 'hidden_dims': '[512, 64]', 'dropout': 0.28690703455225874, 'batch_norm': True, 'lr': 0.00040656286582336614, 'weight_decay': 1.5259008266736005e-07, 'epochs': 248, 'loss': 'mae', 'optimizer': 'adam', 'graph_mode': 'knn', 'source': 'grm', 'knn_k': 1, 'weighted_edges': True, 'symmetrize_mode': 'union', 'use_snp_selection': False}. Best is trial 32 with value: 0.15312810173820499.
[I 2025-11-03 13:12:36,116] Trial 33 finished with value: 0.13085546194161385 and parameters: {'model_type': 'gcn', 'hidden_dims': '[512, 64]', 'dropout': 0.17609430276159038, 'batch_norm': True, 'lr': 0.000526002548241815, 'weight_decay': 1.0036938397365785e-07, 'epochs': 225, 'loss': 'mae', 'optimizer': 'adam', 'graph_mode': 'knn', 'source': 'grm', 'knn_k': 2, 'weighted_edges': True, 'symmetrize_mode': 'union', 'use_snp_selection': False}. Best is trial 32 with value: 0.15312810173820499.
[I 2025-11-03 13:12:38,336] Trial 34 finished with value: 0.13518443561796734 and parameters: {'model_type': 'gcn', 'hidden_dims': '[128, 64]', 'dropout': 0.2412019004825905, 'batch_norm': True, 'lr': 0.0008891170348467675, 'weight_decay': 1.4094445187370041e-06, 'epochs': 247, 'loss': 'mse', 'optimizer': 'adam', 'graph_mode': 'knn', 'source': 'grm', 'knn_k': 1, 'weighted_edges': True, 'symmetrize_mode': 'union', 'use_snp_selection': False}. Best is trial 32 with value: 0.15312810173820499.
[I 2025-11-03 13:12:40,817] Trial 35 finished with value: 0.07019798078041423 and parameters: {'model_type': 'gcn', 'hidden_dims': '[512, 64]', 'dropout': 0.32500055653793797, 'batch_norm': False, 'lr': 0.000365933961528693, 'weight_decay': 5.758593268780853e-07, 'epochs': 288, 'loss': 'mae', 'optimizer': 'adam', 'graph_mode': 'knn', 'source': 'grm', 'knn_k': 2, 'weighted_edges': True, 'symmetrize_mode': 'union', 'use_snp_selection': True, 'num_snps': 2074}. Best is trial 32 with value: 0.15312810173820499.
[I 2025-11-03 13:12:44,422] Trial 36 finished with value: 0.10681229711424428 and parameters: {'model_type': 'gcn', 'hidden_dims': '[256, 128]', 'dropout': 0.38878113617804216, 'batch_norm': True, 'lr': 0.0005278709722778441, 'weight_decay': 2.886603410532352e-07, 'epochs': 345, 'loss': 'mse', 'optimizer': 'adam', 'graph_mode': 'cutoff', 'cutoff': 0.42596163795855535, 'grm_norm': 'cosine', 'self_loops': True, 'use_snp_selection': False}. Best is trial 32 with value: 0.15312810173820499.
[I 2025-11-03 13:12:47,377] Trial 37 finished with value: 0.13501997477195 and parameters: {'model_type': 'gcn', 'hidden_dims': '[512, 64]', 'dropout': 0.3558755154292707, 'batch_norm': False, 'lr': 0.00024180689268018371, 'weight_decay': 9.388611644414266e-07, 'epochs': 154, 'loss': 'mae', 'optimizer': 'adam', 'graph_mode': 'knn', 'source': 'grm', 'knn_k': 9, 'weighted_edges': True, 'symmetrize_mode': 'mutual', 'use_snp_selection': True, 'num_snps': 15344}. Best is trial 32 with value: 0.15312810173820499.
[I 2025-11-03 13:12:50,306] Trial 38 finished with value: 0.10485958487743893 and parameters: {'model_type': 'gcn', 'hidden_dims': '[256, 128, 64]', 'dropout': 0.27938326582537293, 'batch_norm': True, 'lr': 3.374256329080851e-05, 'weight_decay': 0.00029814492190853386, 'epochs': 212, 'loss': 'mae', 'optimizer': 'adam', 'graph_mode': 'knn', 'source': 'grm', 'knn_k': 7, 'weighted_edges': True, 'symmetrize_mode': 'union', 'use_snp_selection': False}. Best is trial 32 with value: 0.15312810173820499.
[I 2025-11-03 13:12:57,671] Trial 39 finished with value: 0.10841567275327053 and parameters: {'model_type': 'gcn', 'hidden_dims': '[512, 256]', 'dropout': 0.3102630669462672, 'batch_norm': False, 'lr': 0.00011395064426187863, 'weight_decay': 5.664206644214619e-06, 'epochs': 323, 'loss': 'mse', 'optimizer': 'adam', 'graph_mode': 'cutoff', 'cutoff': 0.8982975816958216, 'grm_norm': 'cosine_then_gcn', 'self_loops': True, 'use_snp_selection': True, 'num_snps': 58379}. Best is trial 32 with value: 0.15312810173820499.
[I 2025-11-03 13:13:00,105] Trial 40 finished with value: 0.12122359231914845 and parameters: {'model_type': 'gcn', 'hidden_dims': '[128, 64]', 'dropout': 0.4281828256439241, 'batch_norm': True, 'lr': 0.0006499659968608972, 'weight_decay': 1.779792400287485e-07, 'epochs': 268, 'loss': 'mae', 'optimizer': 'adam', 'graph_mode': 'knn', 'source': 'grm', 'knn_k': 3, 'weighted_edges': True, 'symmetrize_mode': 'union', 'use_snp_selection': False}. Best is trial 32 with value: 0.15312810173820499.
[I 2025-11-03 13:13:04,694] Trial 41 finished with value: 0.14142431621002627 and parameters: {'model_type': 'gcn', 'hidden_dims': '[512, 64]', 'dropout': 0.28408356888086106, 'batch_norm': True, 'lr': 0.00017166309555883798, 'weight_decay': 1.4856713883661111e-07, 'epochs': 270, 'loss': 'mae', 'optimizer': 'adam', 'graph_mode': 'knn', 'source': 'grm', 'knn_k': 1, 'weighted_edges': True, 'symmetrize_mode': 'union', 'use_snp_selection': False}. Best is trial 32 with value: 0.15312810173820499.
[I 2025-11-03 13:13:08,889] Trial 42 finished with value: 0.11635126511617548 and parameters: {'model_type': 'gcn', 'hidden_dims': '[512, 64]', 'dropout': 0.36805478571812233, 'batch_norm': True, 'lr': 0.00021013697330487735, 'weight_decay': 2.8075697149176526e-07, 'epochs': 238, 'loss': 'mae', 'optimizer': 'adam', 'graph_mode': 'knn', 'source': 'grm', 'knn_k': 1, 'weighted_edges': True, 'symmetrize_mode': 'union', 'use_snp_selection': False}. Best is trial 32 with value: 0.15312810173820499.
[I 2025-11-03 13:13:13,576] Trial 43 finished with value: 0.07334335777813034 and parameters: {'model_type': 'gcn', 'hidden_dims': '[512, 64]', 'dropout': 0.24816525357768357, 'batch_norm': True, 'lr': 0.0003346231321616848, 'weight_decay': 3.9091987840491435e-07, 'epochs': 280, 'loss': 'mae', 'optimizer': 'adam', 'graph_mode': 'knn', 'source': 'grm', 'knn_k': 1, 'weighted_edges': False, 'symmetrize_mode': 'union', 'use_snp_selection': False}. Best is trial 32 with value: 0.15312810173820499.
[I 2025-11-03 13:13:15,733] Trial 44 finished with value: 0.12059766823790577 and parameters: {'model_type': 'gcn', 'hidden_dims': '[512, 64]', 'dropout': 0.32017128229195246, 'batch_norm': True, 'lr': 6.664667766087995e-05, 'weight_decay': 1.5231118775533134e-07, 'epochs': 69, 'loss': 'mae', 'optimizer': 'adam', 'graph_mode': 'knn', 'source': 'grm', 'knn_k': 2, 'weighted_edges': True, 'symmetrize_mode': 'mutual', 'use_snp_selection': False}. Best is trial 32 with value: 0.15312810173820499.
[I 2025-11-03 13:13:18,649] Trial 45 finished with value: 0.10909007446627479 and parameters: {'model_type': 'gcn', 'hidden_dims': '[256, 128]', 'dropout': 0.2917399210418099, 'batch_norm': True, 'lr': 0.00013540147001837703, 'weight_decay': 1.0326361803321625e-07, 'epochs': 247, 'loss': 'mae', 'optimizer': 'adam', 'graph_mode': 'cutoff', 'cutoff': 0.4585737354176531, 'grm_norm': 'cosine', 'self_loops': False, 'use_snp_selection': False}. Best is trial 32 with value: 0.15312810173820499.
[I 2025-11-03 13:13:22,395] Trial 46 finished with value: 0.12750681757094823 and parameters: {'model_type': 'gcn', 'hidden_dims': '[512, 128]', 'dropout': 0.2669003464351565, 'batch_norm': True, 'lr': 0.00043676959967365296, 'weight_decay': 5.34287830312411e-07, 'epochs': 201, 'loss': 'mae', 'optimizer': 'adam', 'graph_mode': 'knn', 'source': 'grm', 'knn_k': 1, 'weighted_edges': True, 'symmetrize_mode': 'union', 'use_snp_selection': False}. Best is trial 32 with value: 0.15312810173820499.
[I 2025-11-03 13:13:26,974] Trial 47 finished with value: 0.08037875794042322 and parameters: {'model_type': 'gcn', 'hidden_dims': '[512, 256]', 'dropout': 0.19191174878270298, 'batch_norm': True, 'lr': 0.00018629312132152338, 'weight_decay': 1.386156997685156e-06, 'epochs': 268, 'loss': 'mse', 'optimizer': 'adam', 'graph_mode': 'knn', 'source': 'grm', 'knn_k': 6, 'weighted_edges': True, 'symmetrize_mode': 'mutual', 'use_snp_selection': False}. Best is trial 32 with value: 0.15312810173820499.
[I 2025-11-03 13:13:32,864] Trial 48 finished with value: 0.13396896534748856 and parameters: {'model_type': 'gcn', 'hidden_dims': '[512, 64]', 'dropout': 0.3699930375884735, 'batch_norm': False, 'lr': 4.11182417722962e-05, 'weight_decay': 8.428606768523137e-07, 'epochs': 304, 'loss': 'mae', 'optimizer': 'adam', 'graph_mode': 'knn', 'source': 'grm', 'knn_k': 1, 'weighted_edges': False, 'symmetrize_mode': 'union', 'use_snp_selection': True, 'num_snps': 42595}. Best is trial 32 with value: 0.15312810173820499.
[I 2025-11-03 13:13:36,332] Trial 49 finished with value: 0.12157842558757073 and parameters: {'model_type': 'gcn', 'hidden_dims': '[512, 64]', 'dropout': 0.22677810727944345, 'batch_norm': True, 'lr': 9.630844257605831e-05, 'weight_decay': 2.2748746605958297e-07, 'epochs': 170, 'loss': 'mae', 'optimizer': 'adam', 'graph_mode': 'knn', 'source': 'grm', 'knn_k': 3, 'weighted_edges': True, 'symmetrize_mode': 'union', 'use_snp_selection': False}. Best is trial 32 with value: 0.15312810173820499.
[I 2025-11-03 13:13:37,709] Trial 50 finished with value: 0.06840144621706809 and parameters: {'model_type': 'gcn', 'hidden_dims': '[512, 64]', 'dropout': 0.332109864281148, 'batch_norm': True, 'lr': 0.0007162821017970064, 'weight_decay': 3.192577224729498e-05, 'epochs': 8, 'loss': 'mae', 'optimizer': 'adam', 'graph_mode': 'cutoff', 'cutoff': 0.20628834676422192, 'grm_norm': 'none', 'self_loops': True, 'use_snp_selection': False}. Best is trial 32 with value: 0.15312810173820499.
[I 2025-11-03 13:13:42,329] Trial 51 finished with value: 0.13502674077489307 and parameters: {'model_type': 'gcn', 'hidden_dims': '[512, 64]', 'dropout': 0.282017944600088, 'batch_norm': True, 'lr': 0.00015612997477276229, 'weight_decay': 1.702872000162506e-07, 'epochs': 272, 'loss': 'mae', 'optimizer': 'adam', 'graph_mode': 'knn', 'source': 'grm', 'knn_k': 1, 'weighted_edges': True, 'symmetrize_mode': 'union', 'use_snp_selection': False}. Best is trial 32 with value: 0.15312810173820499.
[I 2025-11-03 13:13:46,815] Trial 52 finished with value: 0.13561173201831087 and parameters: {'model_type': 'gcn', 'hidden_dims': '[512, 64]', 'dropout': 0.28999363804906914, 'batch_norm': True, 'lr': 0.00029123610955273635, 'weight_decay': 1.3536409671735662e-07, 'epochs': 258, 'loss': 'mae', 'optimizer': 'adam', 'graph_mode': 'knn', 'source': 'grm', 'knn_k': 2, 'weighted_edges': True, 'symmetrize_mode': 'union', 'use_snp_selection': False}. Best is trial 32 with value: 0.15312810173820499.
[I 2025-11-03 13:13:51,740] Trial 53 finished with value: 0.12304495244648685 and parameters: {'model_type': 'gcn', 'hidden_dims': '[512, 64]', 'dropout': 0.2648675779489145, 'batch_norm': True, 'lr': 7.735329499301922e-05, 'weight_decay': 3.2304236994025456e-07, 'epochs': 297, 'loss': 'mae', 'optimizer': 'adam', 'graph_mode': 'knn', 'source': 'grm', 'knn_k': 1, 'weighted_edges': True, 'symmetrize_mode': 'union', 'use_snp_selection': False}. Best is trial 32 with value: 0.15312810173820499.
[I 2025-11-03 13:13:55,916] Trial 54 finished with value: 0.12966585230358169 and parameters: {'model_type': 'gcn', 'hidden_dims': '[512, 64]', 'dropout': 0.3088100217464573, 'batch_norm': True, 'lr': 0.0001896155725862842, 'weight_decay': 1.401548904287608e-07, 'epochs': 235, 'loss': 'mae', 'optimizer': 'adam', 'graph_mode': 'knn', 'source': 'grm', 'knn_k': 1, 'weighted_edges': True, 'symmetrize_mode': 'union', 'use_snp_selection': False}. Best is trial 32 with value: 0.15312810173820499.
[I 2025-11-03 13:14:00,798] Trial 55 finished with value: 0.12529600385966386 and parameters: {'model_type': 'gcn', 'hidden_dims': '[512, 64]', 'dropout': 0.3374834162639471, 'batch_norm': True, 'lr': 0.00011178907201079389, 'weight_decay': 2.297138540662741e-07, 'epochs': 291, 'loss': 'mae', 'optimizer': 'adam', 'graph_mode': 'knn', 'source': 'grm', 'knn_k': 2, 'weighted_edges': True, 'symmetrize_mode': 'union', 'use_snp_selection': False}. Best is trial 32 with value: 0.15312810173820499.
[I 2025-11-03 13:14:04,589] Trial 56 finished with value: 0.09385107799877433 and parameters: {'model_type': 'gcn', 'hidden_dims': '[256, 128, 64]', 'dropout': 0.25424827780333215, 'batch_norm': True, 'lr': 4.744474761712487e-05, 'weight_decay': 3.823578383093085e-07, 'epochs': 317, 'loss': 'mae', 'optimizer': 'adam', 'graph_mode': 'knn', 'source': 'grm', 'knn_k': 1, 'weighted_edges': True, 'symmetrize_mode': 'union', 'use_snp_selection': False}. Best is trial 32 with value: 0.15312810173820499.
[I 2025-11-03 13:14:09,288] Trial 57 finished with value: 0.1450276870883818 and parameters: {'model_type': 'gcn', 'hidden_dims': '[512, 128]', 'dropout': 0.2739713714896115, 'batch_norm': True, 'lr': 0.0003180514761853837, 'weight_decay': 6.73386605525474e-07, 'epochs': 275, 'loss': 'mae', 'optimizer': 'adam', 'graph_mode': 'knn', 'source': 'grm', 'knn_k': 2, 'weighted_edges': True, 'symmetrize_mode': 'union', 'use_snp_selection': False}. Best is trial 32 with value: 0.15312810173820499.
[I 2025-11-03 13:14:13,256] Trial 58 finished with value: 0.12617365478386486 and parameters: {'model_type': 'gcn', 'hidden_dims': '[512, 128]', 'dropout': 0.22003283621247516, 'batch_norm': True, 'lr': 0.0002869658917184232, 'weight_decay': 6.797940317094836e-07, 'epochs': 217, 'loss': 'mae', 'optimizer': 'adam', 'graph_mode': 'knn', 'source': 'grm', 'knn_k': 2, 'weighted_edges': False, 'symmetrize_mode': 'mutual', 'use_snp_selection': False}. Best is trial 32 with value: 0.15312810173820499.
[I 2025-11-03 13:14:17,592] Trial 59 finished with value: 0.11400513960968059 and parameters: {'model_type': 'gcn', 'hidden_dims': '[512, 128]', 'dropout': 0.4131077862487917, 'batch_norm': True, 'lr': 0.0004446031108551653, 'weight_decay': 2.1568675396583806e-06, 'epochs': 245, 'loss': 'mse', 'optimizer': 'adam', 'graph_mode': 'knn', 'source': 'grm', 'knn_k': 3, 'weighted_edges': True, 'symmetrize_mode': 'union', 'use_snp_selection': False}. Best is trial 32 with value: 0.15312810173820499.
[I 2025-11-03 13:14:21,706] Trial 60 finished with value: 0.11931438615764756 and parameters: {'model_type': 'gcn', 'hidden_dims': '[512, 128]', 'dropout': 0.36787969733182163, 'batch_norm': False, 'lr': 0.00022911259050998955, 'weight_decay': 9.709235685024687e-07, 'epochs': 332, 'loss': 'mae', 'optimizer': 'adam', 'graph_mode': 'knn', 'source': 'grm', 'knn_k': 2, 'weighted_edges': True, 'symmetrize_mode': 'union', 'use_snp_selection': True, 'num_snps': 19019}. Best is trial 32 with value: 0.15312810173820499.
[I 2025-11-03 13:14:26,403] Trial 61 finished with value: 0.13366172540814703 and parameters: {'model_type': 'gcn', 'hidden_dims': '[512, 128]', 'dropout': 0.2698777305645333, 'batch_norm': True, 'lr': 0.00017114480770192078, 'weight_decay': 2.194914870504265e-07, 'epochs': 276, 'loss': 'mae', 'optimizer': 'adam', 'graph_mode': 'knn', 'source': 'grm', 'knn_k': 1, 'weighted_edges': True, 'symmetrize_mode': 'union', 'use_snp_selection': False}. Best is trial 32 with value: 0.15312810173820499.
[I 2025-11-03 13:14:30,941] Trial 62 finished with value: 0.12746433672157545 and parameters: {'model_type': 'gcn', 'hidden_dims': '[512, 64]', 'dropout': 0.3021635168914622, 'batch_norm': True, 'lr': 0.00012510751398119819, 'weight_decay': 4.314513194886297e-07, 'epochs': 264, 'loss': 'mae', 'optimizer': 'adam', 'graph_mode': 'knn', 'source': 'grm', 'knn_k': 1, 'weighted_edges': True, 'symmetrize_mode': 'union', 'use_snp_selection': False}. Best is trial 32 with value: 0.15312810173820499.
[I 2025-11-03 13:14:35,981] Trial 63 finished with value: 0.1468107715173019 and parameters: {'model_type': 'gcn', 'hidden_dims': '[512, 256]', 'dropout': 0.2387623794318009, 'batch_norm': True, 'lr': 0.0003166401856306992, 'weight_decay': 1.4354086418678584e-07, 'epochs': 304, 'loss': 'mae', 'optimizer': 'adam', 'graph_mode': 'knn', 'source': 'grm', 'knn_k': 1, 'weighted_edges': True, 'symmetrize_mode': 'union', 'use_snp_selection': False}. Best is trial 32 with value: 0.15312810173820499.
[I 2025-11-03 13:14:40,935] Trial 64 finished with value: 0.13473746350405405 and parameters: {'model_type': 'gcn', 'hidden_dims': '[512, 256]', 'dropout': 0.2367332710239649, 'batch_norm': True, 'lr': 0.0003238167418087227, 'weight_decay': 1.0115377035037264e-07, 'epochs': 295, 'loss': 'mae', 'optimizer': 'adam', 'graph_mode': 'knn', 'source': 'grm', 'knn_k': 2, 'weighted_edges': True, 'symmetrize_mode': 'union', 'use_snp_selection': False}. Best is trial 32 with value: 0.15312810173820499.
[I 2025-11-03 13:14:46,073] Trial 65 finished with value: 0.14013256167660967 and parameters: {'model_type': 'gcn', 'hidden_dims': '[512, 256]', 'dropout': 0.20628561868303574, 'batch_norm': True, 'lr': 0.0002421323259492769, 'weight_decay': 2.906158941779866e-07, 'epochs': 312, 'loss': 'mae', 'optimizer': 'adam', 'graph_mode': 'knn', 'source': 'grm', 'knn_k': 1, 'weighted_edges': True, 'symmetrize_mode': 'union', 'use_snp_selection': False}. Best is trial 32 with value: 0.15312810173820499.
[I 2025-11-03 13:14:51,155] Trial 66 finished with value: 0.12046863372388998 and parameters: {'model_type': 'gcn', 'hidden_dims': '[512, 256]', 'dropout': 0.160730379831038, 'batch_norm': True, 'lr': 0.0006647051323365863, 'weight_decay': 6.20358167319669e-07, 'epochs': 302, 'loss': 'mae', 'optimizer': 'adam', 'graph_mode': 'knn', 'source': 'grm', 'knn_k': 5, 'weighted_edges': True, 'symmetrize_mode': 'union', 'use_snp_selection': False}. Best is trial 32 with value: 0.15312810173820499.
[I 2025-11-03 13:14:55,205] Trial 67 finished with value: 0.05651764288238881 and parameters: {'model_type': 'gcn', 'hidden_dims': '[512, 256]', 'dropout': 0.31834376660013347, 'batch_norm': True, 'lr': 2.865433062445272e-06, 'weight_decay': 2.0684065395343869e-07, 'epochs': 224, 'loss': 'mae', 'optimizer': 'adam', 'graph_mode': 'cutoff', 'cutoff': 0.7519504125741036, 'grm_norm': 'gcn', 'self_loops': True, 'use_snp_selection': False}. Best is trial 32 with value: 0.15312810173820499.
[I 2025-11-03 13:14:57,680] Trial 68 finished with value: 0.12589830245863246 and parameters: {'model_type': 'gcn', 'hidden_dims': '[128, 64]', 'dropout': 0.2503849309277535, 'batch_norm': True, 'lr': 0.00043382789610634377, 'weight_decay': 1.305247711754089e-07, 'epochs': 285, 'loss': 'mae', 'optimizer': 'adam', 'graph_mode': 'knn', 'source': 'grm', 'knn_k': 2, 'weighted_edges': True, 'symmetrize_mode': 'union', 'use_snp_selection': False}. Best is trial 32 with value: 0.15312810173820499.
[I 2025-11-03 13:15:01,280] Trial 69 finished with value: 0.07857298377643464 and parameters: {'model_type': 'gcn', 'hidden_dims': '[256, 128]', 'dropout': 0.34325905909755416, 'batch_norm': True, 'lr': 0.0005212578620462971, 'weight_decay': 3.6718788582866006e-07, 'epochs': 332, 'loss': 'mae', 'optimizer': 'adam', 'graph_mode': 'knn', 'source': 'grm', 'knn_k': 1, 'weighted_edges': False, 'symmetrize_mode': 'union', 'use_snp_selection': False}. Best is trial 32 with value: 0.15312810173820499.
