[I 2025-11-03 13:48:46,506] Trial 128 finished with value: 0.11519416006726896 and parameters: {'model_type': 'gcn', 'hidden_dims': '[512, 256]', 'dropout': 0.14454303666860804, 'batch_norm': True, 'lr': 0.0006688543646100787, 'weight_decay': 6.5021323957485e-07, 'epochs': 246, 'loss': 'mse', 'optimizer': 'adam', 'graph_mode': 'off', 'use_snp_selection': False}. Best is trial 62 with value: 0.13653384210920258.
[I 2025-11-03 13:48:48,488] Trial 129 finished with value: 0.11830244644882135 and parameters: {'model_type': 'gcn', 'hidden_dims': '[512, 128]', 'dropout': 0.10595843867353286, 'batch_norm': True, 'lr': 0.0003378379908791072, 'weight_decay': 4.772504271286858e-07, 'epochs': 217, 'loss': 'mse', 'optimizer': 'adam', 'graph_mode': 'off', 'use_snp_selection': True, 'num_snps': 38804}. Best is trial 62 with value: 0.13653384210920258.
[I 2025-11-03 13:48:50,125] Trial 130 finished with value: 0.1182708299304282 and parameters: {'model_type': 'gcn', 'hidden_dims': '[512, 128]', 'dropout': 0.18459564341630538, 'batch_norm': True, 'lr': 0.0009921570549478182, 'weight_decay': 2.9237452434334607e-05, 'epochs': 191, 'loss': 'mse', 'optimizer': 'adam', 'graph_mode': 'off', 'use_snp_selection': False}. Best is trial 62 with value: 0.13653384210920258.
[I 2025-11-03 13:48:51,791] Trial 131 finished with value: 0.12312665908137638 and parameters: {'model_type': 'gcn', 'hidden_dims': '[512, 128]', 'dropout': 0.14759094713266396, 'batch_norm': True, 'lr': 0.0009968398192419664, 'weight_decay': 3.915771603178138e-07, 'epochs': 196, 'loss': 'mse', 'optimizer': 'adam', 'graph_mode': 'off', 'use_snp_selection': False}. Best is trial 62 with value: 0.13653384210920258.
[I 2025-11-03 13:48:53,508] Trial 132 finished with value: 0.11798107991747916 and parameters: {'model_type': 'gcn', 'hidden_dims': '[512, 128]', 'dropout': 0.1630815004196688, 'batch_norm': True, 'lr': 0.0008430610977269283, 'weight_decay': 2.914743091228531e-07, 'epochs': 202, 'loss': 'mse', 'optimizer': 'adam', 'graph_mode': 'off', 'use_snp_selection': False}. Best is trial 62 with value: 0.13653384210920258.
[I 2025-11-03 13:48:55,089] Trial 133 finished with value: 0.11774542653787777 and parameters: {'model_type': 'gcn', 'hidden_dims': '[512, 128]', 'dropout': 0.13277322801391175, 'batch_norm': True, 'lr': 0.0007272259997473358, 'weight_decay': 1.0895443768421754e-06, 'epochs': 177, 'loss': 'mse', 'optimizer': 'adam', 'graph_mode': 'off', 'use_snp_selection': False}. Best is trial 62 with value: 0.13653384210920258.
[I 2025-11-03 13:48:56,752] Trial 134 finished with value: 0.11791113287683591 and parameters: {'model_type': 'gcn', 'hidden_dims': '[512, 128]', 'dropout': 0.1570034419743342, 'batch_norm': True, 'lr': 0.0005955772562984886, 'weight_decay': 1.865315460027558e-07, 'epochs': 181, 'loss': 'mse', 'optimizer': 'adam', 'graph_mode': 'off', 'use_snp_selection': False}. Best is trial 62 with value: 0.13653384210920258.
[I 2025-11-03 13:48:58,402] Trial 135 finished with value: 0.14044301516376848 and parameters: {'model_type': 'gcn', 'hidden_dims': '[512, 64]', 'dropout': 0.12477070011846218, 'batch_norm': True, 'lr': 0.0008473792772185054, 'weight_decay': 4.5616855661820815e-07, 'epochs': 190, 'loss': 'mse', 'optimizer': 'adam', 'graph_mode': 'off', 'use_snp_selection': False}. Best is trial 135 with value: 0.14044301516376848.
[I 2025-11-03 13:48:59,935] Trial 136 finished with value: 0.011641641460456417 and parameters: {'model_type': 'gcn', 'hidden_dims': '[512, 64]', 'dropout': 0.12455840790085604, 'batch_norm': True, 'lr': 3.946903840951823e-06, 'weight_decay': 7.969261246681317e-07, 'epochs': 170, 'loss': 'mse', 'optimizer': 'adam', 'graph_mode': 'off', 'use_snp_selection': False}. Best is trial 135 with value: 0.14044301516376848.
[I 2025-11-03 13:49:01,925] Trial 137 finished with value: 0.12220543496893119 and parameters: {'model_type': 'gcn', 'hidden_dims': '[512, 64]', 'dropout': 0.13751319765309897, 'batch_norm': True, 'lr': 0.0004164551074414757, 'weight_decay': 2.1948043545943125e-07, 'epochs': 251, 'loss': 'mse', 'optimizer': 'adam', 'graph_mode': 'off', 'use_snp_selection': False}. Best is trial 135 with value: 0.14044301516376848.
[I 2025-11-03 13:49:03,559] Trial 138 finished with value: 0.12330052584269395 and parameters: {'model_type': 'gcn', 'hidden_dims': '[512, 64]', 'dropout': 0.11803770610294984, 'batch_norm': True, 'lr': 0.0004898757527362503, 'weight_decay': 5.752624897299383e-07, 'epochs': 187, 'loss': 'mse', 'optimizer': 'adam', 'graph_mode': 'off', 'use_snp_selection': False}. Best is trial 135 with value: 0.14044301516376848.
[I 2025-11-03 13:49:05,001] Trial 139 finished with value: 0.12330409895811315 and parameters: {'model_type': 'gcn', 'hidden_dims': '[512, 256]', 'dropout': 0.1024217893317017, 'batch_norm': True, 'lr': 0.0007248668260921775, 'weight_decay': 4.576125012551698e-07, 'epochs': 150, 'loss': 'mse', 'optimizer': 'adam', 'graph_mode': 'off', 'use_snp_selection': False}. Best is trial 135 with value: 0.14044301516376848.
[I 2025-11-03 13:49:06,713] Trial 140 finished with value: 0.0197575033942903 and parameters: {'model_type': 'gcn', 'hidden_dims': '[512, 64]', 'dropout': 0.21248664017243243, 'batch_norm': False, 'lr': 0.0008550610160508742, 'weight_decay': 3.3105593819205957e-07, 'epochs': 211, 'loss': 'mse', 'optimizer': 'adam', 'graph_mode': 'off', 'use_snp_selection': False}. Best is trial 135 with value: 0.14044301516376848.
[I 2025-11-03 13:49:08,382] Trial 141 finished with value: 0.12106879895186551 and parameters: {'model_type': 'gcn', 'hidden_dims': '[512, 128]', 'dropout': 0.15299464374175717, 'batch_norm': True, 'lr': 0.0009814914599064375, 'weight_decay': 1.5200710147984865e-07, 'epochs': 195, 'loss': 'mse', 'optimizer': 'adam', 'graph_mode': 'off', 'use_snp_selection': False}. Best is trial 135 with value: 0.14044301516376848.
[I 2025-11-03 13:49:10,090] Trial 142 finished with value: 0.11459757439147637 and parameters: {'model_type': 'gcn', 'hidden_dims': '[512, 128]', 'dropout': 0.1911162359523251, 'batch_norm': True, 'lr': 0.0006237573461902025, 'weight_decay': 4.6104938349880426e-07, 'epochs': 201, 'loss': 'mse', 'optimizer': 'adam', 'graph_mode': 'off', 'use_snp_selection': False}. Best is trial 135 with value: 0.14044301516376848.
[I 2025-11-03 13:49:11,128] Trial 143 finished with value: 0.11914416906997924 and parameters: {'model_type': 'gcn', 'hidden_dims': '[128, 64]', 'dropout': 0.1707786639913353, 'batch_norm': True, 'lr': 0.0008791950150999481, 'weight_decay': 2.7866015457852156e-07, 'epochs': 186, 'loss': 'mse', 'optimizer': 'adam', 'graph_mode': 'off', 'use_snp_selection': False}. Best is trial 135 with value: 0.14044301516376848.
[I 2025-11-03 13:49:12,809] Trial 144 finished with value: 0.12121177597187525 and parameters: {'model_type': 'gcn', 'hidden_dims': '[512, 128]', 'dropout': 0.13912687862449813, 'batch_norm': True, 'lr': 0.0007720496159236311, 'weight_decay': 6.368526021703239e-07, 'epochs': 193, 'loss': 'mse', 'optimizer': 'adam', 'graph_mode': 'off', 'use_snp_selection': False}. Best is trial 135 with value: 0.14044301516376848.
[I 2025-11-03 13:49:14,862] Trial 145 finished with value: 0.11628846848130052 and parameters: {'model_type': 'gcn', 'hidden_dims': '[512, 64]', 'dropout': 0.12514904780014866, 'batch_norm': True, 'lr': 0.0009914017293709645, 'weight_decay': 3.862057436219281e-07, 'epochs': 262, 'loss': 'mse', 'optimizer': 'adam', 'graph_mode': 'off', 'use_snp_selection': False}. Best is trial 135 with value: 0.14044301516376848.
[I 2025-11-03 13:49:15,996] Trial 146 finished with value: 0.12790098398482208 and parameters: {'model_type': 'gcn', 'hidden_dims': '[256, 128]', 'dropout': 0.14611236529904842, 'batch_norm': True, 'lr': 0.0005516033148694972, 'weight_decay': 7.232534879445108e-07, 'epochs': 161, 'loss': 'mse', 'optimizer': 'adam', 'graph_mode': 'off', 'use_snp_selection': False}. Best is trial 135 with value: 0.14044301516376848.
[I 2025-11-03 13:49:17,044] Trial 147 finished with value: 0.11404420286238917 and parameters: {'model_type': 'gcn', 'hidden_dims': '[256, 128]', 'dropout': 0.18246134220268148, 'batch_norm': True, 'lr': 0.0005466985780811335, 'weight_decay': 1.4113909990279714e-06, 'epochs': 144, 'loss': 'mse', 'optimizer': 'adam', 'graph_mode': 'off', 'use_snp_selection': False}. Best is trial 135 with value: 0.14044301516376848.
[I 2025-11-03 13:49:18,174] Trial 148 finished with value: 0.11078495641688942 and parameters: {'model_type': 'gcn', 'hidden_dims': '[256, 128]', 'dropout': 0.11643796415105903, 'batch_norm': True, 'lr': 0.0006206358689944128, 'weight_decay': 9.55072147444893e-07, 'epochs': 165, 'loss': 'mae', 'optimizer': 'adam', 'graph_mode': 'off', 'use_snp_selection': False}. Best is trial 135 with value: 0.14044301516376848.
[I 2025-11-03 13:49:19,317] Trial 149 finished with value: 0.11251972240705271 and parameters: {'model_type': 'gcn', 'hidden_dims': '[256, 128]', 'dropout': 0.14993005373674204, 'batch_norm': True, 'lr': 0.0004597434200100243, 'weight_decay': 7.191375462253088e-07, 'epochs': 172, 'loss': 'mse', 'optimizer': 'adam', 'graph_mode': 'off', 'use_snp_selection': False}. Best is trial 135 with value: 0.14044301516376848.
[I 2025-11-03 13:49:21,361] Trial 0 finished with value: 0.07036281755683908 and parameters: {'model_type': 'gcn', 'hidden_dims': '[128, 64]', 'dropout': 0.199031432379812, 'batch_norm': True, 'lr': 1.8408544111075837e-06, 'weight_decay': 5.5136510071208614e-05, 'epochs': 336, 'loss': 'mae', 'optimizer': 'adam', 'graph_mode': 'off', 'use_snp_selection': True, 'num_snps': 43862}. Best is trial 0 with value: 0.07036281755683908.
[I 2025-11-03 13:49:22,765] Trial 1 finished with value: 0.0595596535043523 and parameters: {'model_type': 'gcn', 'hidden_dims': '[256, 128]', 'dropout': 0.4370668075331726, 'batch_norm': True, 'lr': 7.133471581159139e-05, 'weight_decay': 1.128633586803549e-05, 'epochs': 242, 'loss': 'mae', 'optimizer': 'adam', 'graph_mode': 'off', 'use_snp_selection': False}. Best is trial 0 with value: 0.07036281755683908.
[I 2025-11-03 13:49:23,814] Trial 2 finished with value: 0.02336719653176339 and parameters: {'model_type': 'gcn', 'hidden_dims': '[256, 128, 64]', 'dropout': 0.41314357415569625, 'batch_norm': False, 'lr': 3.952233718592101e-06, 'weight_decay': 0.00026754769258252603, 'epochs': 149, 'loss': 'mse', 'optimizer': 'adam', 'graph_mode': 'off', 'use_snp_selection': True, 'num_snps': 11571}. Best is trial 0 with value: 0.07036281755683908.
[I 2025-11-03 13:49:26,095] Trial 3 finished with value: 0.043525454017479086 and parameters: {'model_type': 'gcn', 'hidden_dims': '[512, 64]', 'dropout': 0.5938127374509361, 'batch_norm': False, 'lr': 5.67704586114731e-06, 'weight_decay': 2.4518087630137052e-05, 'epochs': 320, 'loss': 'mae', 'optimizer': 'adam', 'graph_mode': 'off', 'use_snp_selection': False}. Best is trial 0 with value: 0.07036281755683908.
[I 2025-11-03 13:49:28,227] Trial 4 finished with value: 0.02369615347430652 and parameters: {'model_type': 'gcn', 'hidden_dims': '[512, 128]', 'dropout': 0.25746343592134413, 'batch_norm': True, 'lr': 1.3467657668402788e-06, 'weight_decay': 0.00033087251918647806, 'epochs': 277, 'loss': 'mse', 'optimizer': 'adam', 'graph_mode': 'off', 'use_snp_selection': True, 'num_snps': 36675}. Best is trial 0 with value: 0.07036281755683908.
[I 2025-11-03 13:49:29,816] Trial 5 finished with value: -0.034760102309229435 and parameters: {'model_type': 'gcn', 'hidden_dims': '[512, 64]', 'dropout': 0.38275350994408375, 'batch_norm': True, 'lr': 1.5586664309232824e-06, 'weight_decay': 0.0008227664668621182, 'epochs': 145, 'loss': 'mae', 'optimizer': 'adam', 'graph_mode': 'off', 'use_snp_selection': True, 'num_snps': 32148}. Best is trial 0 with value: 0.07036281755683908.
[I 2025-11-03 13:49:31,053] Trial 6 finished with value: 0.05179462040129848 and parameters: {'model_type': 'gcn', 'hidden_dims': '[256, 128]', 'dropout': 0.3930109900265879, 'batch_norm': False, 'lr': 4.892964372128395e-05, 'weight_decay': 1.5809549317992182e-06, 'epochs': 199, 'loss': 'mse', 'optimizer': 'adam', 'graph_mode': 'off', 'use_snp_selection': False}. Best is trial 0 with value: 0.07036281755683908.
[I 2025-11-03 13:49:32,233] Trial 7 finished with value: 0.08382353721333385 and parameters: {'model_type': 'gcn', 'hidden_dims': '[512, 256]', 'dropout': 0.15343979219678458, 'batch_norm': True, 'lr': 6.234003099047341e-05, 'weight_decay': 3.894760610535477e-07, 'epochs': 97, 'loss': 'mse', 'optimizer': 'adam', 'graph_mode': 'off', 'use_snp_selection': False}. Best is trial 7 with value: 0.08382353721333385.
[I 2025-11-03 13:49:34,565] Trial 8 finished with value: 0.08729062087532045 and parameters: {'model_type': 'gcn', 'hidden_dims': '[512, 128]', 'dropout': 0.10743001231661406, 'batch_norm': True, 'lr': 0.00023728538449271062, 'weight_decay': 1.7629071578048637e-05, 'epochs': 312, 'loss': 'mae', 'optimizer': 'adam', 'graph_mode': 'off', 'use_snp_selection': False}. Best is trial 8 with value: 0.08729062087532045.
[I 2025-11-03 13:49:36,142] Trial 9 finished with value: 0.09359914991616469 and parameters: {'model_type': 'gcn', 'hidden_dims': '[512, 64]', 'dropout': 0.14505336736221927, 'batch_norm': True, 'lr': 5.8619638388111826e-05, 'weight_decay': 6.200156172669308e-07, 'epochs': 175, 'loss': 'mse', 'optimizer': 'adam', 'graph_mode': 'off', 'use_snp_selection': False}. Best is trial 9 with value: 0.09359914991616469.
[I 2025-11-03 13:49:37,053] Trial 10 finished with value: -0.010842299074997268 and parameters: {'model_type': 'gcn', 'hidden_dims': '[512, 64]', 'dropout': 0.2753166624526289, 'batch_norm': False, 'lr': 0.00032393778075602147, 'weight_decay': 1.1714031539166645e-07, 'epochs': 44, 'loss': 'mse', 'optimizer': 'adam', 'graph_mode': 'off', 'use_snp_selection': False}. Best is trial 9 with value: 0.09359914991616469.
[I 2025-11-03 13:49:38,870] Trial 11 finished with value: 0.08283387268493463 and parameters: {'model_type': 'gcn', 'hidden_dims': '[512, 128]', 'dropout': 0.10095648685224448, 'batch_norm': True, 'lr': 0.0007381466848241794, 'weight_decay': 1.969664044175748e-06, 'epochs': 216, 'loss': 'mae', 'optimizer': 'adam', 'graph_mode': 'off', 'use_snp_selection': False}. Best is trial 9 with value: 0.09359914991616469.
[I 2025-11-03 13:49:41,058] Trial 12 finished with value: 0.09021237522369703 and parameters: {'model_type': 'gcn', 'hidden_dims': '[512, 128]', 'dropout': 0.10344600881777158, 'batch_norm': True, 'lr': 0.00018400807026440393, 'weight_decay': 2.652725854953085e-06, 'epochs': 281, 'loss': 'mae', 'optimizer': 'adam', 'graph_mode': 'off', 'use_snp_selection': False}. Best is trial 9 with value: 0.09359914991616469.
[I 2025-11-03 13:49:42,224] Trial 13 finished with value: 0.061108924680467025 and parameters: {'model_type': 'gcn', 'hidden_dims': '[128, 64]', 'dropout': 0.21612815944527586, 'batch_norm': True, 'lr': 1.537109700844877e-05, 'weight_decay': 2.1978369390547452e-06, 'epochs': 258, 'loss': 'mse', 'optimizer': 'adam', 'graph_mode': 'off', 'use_snp_selection': False}. Best is trial 9 with value: 0.09359914991616469.
[I 2025-11-03 13:49:43,520] Trial 14 finished with value: 0.08448738926866195 and parameters: {'model_type': 'gcn', 'hidden_dims': '[256, 128, 64]', 'dropout': 0.3012984444538551, 'batch_norm': True, 'lr': 0.00017558188744418174, 'weight_decay': 6.0566029709182e-07, 'epochs': 166, 'loss': 'mse', 'optimizer': 'adam', 'graph_mode': 'off', 'use_snp_selection': False}. Best is trial 9 with value: 0.09359914991616469.
[I 2025-11-03 13:49:44,758] Trial 15 finished with value: -0.010082779591597445 and parameters: {'model_type': 'gcn', 'hidden_dims': '[512, 256]', 'dropout': 0.1723492905468449, 'batch_norm': True, 'lr': 1.89989485263331e-05, 'weight_decay': 4.647398975110258e-06, 'epochs': 106, 'loss': 'mae', 'optimizer': 'adam', 'graph_mode': 'off', 'use_snp_selection': False}. Best is trial 9 with value: 0.09359914991616469.
[I 2025-11-03 13:49:46,586] Trial 16 finished with value: 0.05572899858874371 and parameters: {'model_type': 'gcn', 'hidden_dims': '[512, 128]', 'dropout': 0.558513902174278, 'batch_norm': True, 'lr': 0.00012800471281669893, 'weight_decay': 1.0661008213867922e-07, 'epochs': 223, 'loss': 'mae', 'optimizer': 'adam', 'graph_mode': 'off', 'use_snp_selection': False}. Best is trial 9 with value: 0.09359914991616469.
[I 2025-11-03 13:49:48,770] Trial 17 finished with value: 0.10674504638365208 and parameters: {'model_type': 'gcn', 'hidden_dims': '[512, 64]', 'dropout': 0.32888830259108426, 'batch_norm': True, 'lr': 0.000906375209920231, 'weight_decay': 4.90065802659754e-07, 'epochs': 287, 'loss': 'mse', 'optimizer': 'adam', 'graph_mode': 'off', 'use_snp_selection': False}. Best is trial 17 with value: 0.10674504638365208.
[I 2025-11-03 13:49:51,127] Trial 18 finished with value: 0.02221500316223951 and parameters: {'model_type': 'gcn', 'hidden_dims': '[512, 64]', 'dropout': 0.48158678503683405, 'batch_norm': False, 'lr': 0.0009810871311178397, 'weight_decay': 5.366019376428184e-07, 'epochs': 178, 'loss': 'mse', 'optimizer': 'adam', 'graph_mode': 'off', 'use_snp_selection': True, 'num_snps': 58241}. Best is trial 17 with value: 0.10674504638365208.
[I 2025-11-03 13:49:52,481] Trial 19 finished with value: 0.10572960586012947 and parameters: {'model_type': 'gcn', 'hidden_dims': '[512, 64]', 'dropout': 0.2998114171472142, 'batch_norm': True, 'lr': 0.0005888123109616593, 'weight_decay': 2.7108558617331295e-07, 'epochs': 119, 'loss': 'mse', 'optimizer': 'adam', 'graph_mode': 'off', 'use_snp_selection': False}. Best is trial 17 with value: 0.10674504638365208.
[I 2025-11-03 13:49:53,746] Trial 20 finished with value: 0.09608631056811037 and parameters: {'model_type': 'gcn', 'hidden_dims': '[512, 64]', 'dropout': 0.3251964441884422, 'batch_norm': True, 'lr': 0.00045282784582176917, 'weight_decay': 2.0531376692029492e-07, 'epochs': 103, 'loss': 'mse', 'optimizer': 'adam', 'graph_mode': 'off', 'use_snp_selection': False}. Best is trial 17 with value: 0.10674504638365208.
[I 2025-11-03 13:49:54,964] Trial 21 finished with value: 0.08307434802398153 and parameters: {'model_type': 'gcn', 'hidden_dims': '[512, 64]', 'dropout': 0.3308018286407156, 'batch_norm': True, 'lr': 0.00046752778494089687, 'weight_decay': 2.3733165632709834e-07, 'epochs': 91, 'loss': 'mse', 'optimizer': 'adam', 'graph_mode': 'off', 'use_snp_selection': False}. Best is trial 17 with value: 0.10674504638365208.
[I 2025-11-03 13:49:55,944] Trial 22 finished with value: 0.11094395980680749 and parameters: {'model_type': 'gcn', 'hidden_dims': '[512, 64]', 'dropout': 0.34164857932577514, 'batch_norm': True, 'lr': 0.00048215748786363354, 'weight_decay': 2.3590043475444153e-07, 'epochs': 46, 'loss': 'mse', 'optimizer': 'adam', 'graph_mode': 'off', 'use_snp_selection': False}. Best is trial 22 with value: 0.11094395980680749.
[I 2025-11-03 13:49:56,846] Trial 23 finished with value: 0.10771648040247352 and parameters: {'model_type': 'gcn', 'hidden_dims': '[512, 64]', 'dropout': 0.36123288203976534, 'batch_norm': True, 'lr': 0.0005445005497085993, 'weight_decay': 9.751950491737594e-07, 'epochs': 40, 'loss': 'mse', 'optimizer': 'adam', 'graph_mode': 'off', 'use_snp_selection': False}. Best is trial 22 with value: 0.11094395980680749.
[I 2025-11-03 13:49:57,735] Trial 24 finished with value: 0.0814831952795812 and parameters: {'model_type': 'gcn', 'hidden_dims': '[512, 64]', 'dropout': 0.46987033741278, 'batch_norm': True, 'lr': 0.0008840306460816461, 'weight_decay': 8.994231835963912e-07, 'epochs': 41, 'loss': 'mse', 'optimizer': 'adam', 'graph_mode': 'off', 'use_snp_selection': False}. Best is trial 22 with value: 0.11094395980680749.
[I 2025-11-03 13:49:58,752] Trial 25 finished with value: 0.07925065285705095 and parameters: {'model_type': 'gcn', 'hidden_dims': '[512, 64]', 'dropout': 0.3601176874658648, 'batch_norm': True, 'lr': 0.00035130548935125217, 'weight_decay': 4.519110036698679e-06, 'epochs': 57, 'loss': 'mse', 'optimizer': 'adam', 'graph_mode': 'off', 'use_snp_selection': False}. Best is trial 22 with value: 0.11094395980680749.
[I 2025-11-03 13:49:59,376] Trial 26 finished with value: 0.07524226166565617 and parameters: {'model_type': 'gcn', 'hidden_dims': '[512, 64]', 'dropout': 0.24964420270642748, 'batch_norm': False, 'lr': 0.00014463335658576693, 'weight_decay': 1.0782363577378036e-06, 'epochs': 79, 'loss': 'mse', 'optimizer': 'adam', 'graph_mode': 'off', 'use_snp_selection': True, 'num_snps': 3842}. Best is trial 22 with value: 0.11094395980680749.
[I 2025-11-03 13:50:00,186] Trial 27 finished with value: 0.03516219486572043 and parameters: {'model_type': 'gcn', 'hidden_dims': '[128, 64]', 'dropout': 0.34797394991675523, 'batch_norm': True, 'lr': 0.00010329599231635965, 'weight_decay': 4.881339110858778e-06, 'epochs': 127, 'loss': 'mse', 'optimizer': 'adam', 'graph_mode': 'off', 'use_snp_selection': False}. Best is trial 22 with value: 0.11094395980680749.
[I 2025-11-03 13:50:01,262] Trial 28 finished with value: 0.090007487035842 and parameters: {'model_type': 'gcn', 'hidden_dims': '[512, 256]', 'dropout': 0.46823880572043075, 'batch_norm': True, 'lr': 0.0002732468180257973, 'weight_decay': 1.8219834248060385e-07, 'epochs': 69, 'loss': 'mse', 'optimizer': 'adam', 'graph_mode': 'off', 'use_snp_selection': False}. Best is trial 22 with value: 0.11094395980680749.
[I 2025-11-03 13:50:02,155] Trial 29 finished with value: 0.08380733377715795 and parameters: {'model_type': 'gcn', 'hidden_dims': '[256, 128]', 'dropout': 0.22184718606302184, 'batch_norm': True, 'lr': 0.0005388560200940643, 'weight_decay': 5.522710335772481e-05, 'epochs': 65, 'loss': 'mse', 'optimizer': 'adam', 'graph_mode': 'off', 'use_snp_selection': True, 'num_snps': 19468}. Best is trial 22 with value: 0.11094395980680749.
