[I 2025-11-03 13:53:56,913] Trial 79 finished with value: -0.004201712453154334 and parameters: {'model_type': 'graphsage', 'hidden_dims': '[512, 128]', 'dropout': 0.3607956270492879, 'batch_norm': False, 'lr': 4.741469734419237e-05, 'weight_decay': 9.305545420767707e-07, 'epochs': 126, 'loss': 'mae', 'optimizer': 'adam', 'graph_mode': 'knn', 'source': 'grm', 'knn_k': 10, 'weighted_edges': False, 'symmetrize_mode': 'union', 'use_snp_selection': True, 'num_snps': 38848}. Best is trial 27 with value: 0.08246652821033469.
[I 2025-11-03 13:53:59,805] Trial 80 finished with value: 0.033894268217769315 and parameters: {'model_type': 'graphsage', 'hidden_dims': '[512, 128]', 'dropout': 0.298096823837365, 'batch_norm': True, 'lr': 9.164969183816563e-06, 'weight_decay': 3.5961835108115305e-06, 'epochs': 66, 'loss': 'mse', 'optimizer': 'adam', 'graph_mode': 'knn', 'source': 'grm', 'knn_k': 8, 'weighted_edges': True, 'symmetrize_mode': 'union', 'use_snp_selection': False}. Best is trial 27 with value: 0.08246652821033469.
[I 2025-11-03 13:54:02,870] Trial 81 finished with value: 0.05923602836262273 and parameters: {'model_type': 'graphsage', 'hidden_dims': '[512, 128]', 'dropout': 0.21391018187482247, 'batch_norm': True, 'lr': 0.0003672515862681629, 'weight_decay': 0.0001327402609488499, 'epochs': 77, 'loss': 'mse', 'optimizer': 'adam', 'graph_mode': 'knn', 'source': 'grm', 'knn_k': 10, 'weighted_edges': True, 'symmetrize_mode': 'union', 'use_snp_selection': False}. Best is trial 27 with value: 0.08246652821033469.
[I 2025-11-03 13:54:06,195] Trial 82 finished with value: 0.0472823239966735 and parameters: {'model_type': 'graphsage', 'hidden_dims': '[512, 128]', 'dropout': 0.19792017690686037, 'batch_norm': True, 'lr': 0.0002854793976143625, 'weight_decay': 0.0002152153593333396, 'epochs': 101, 'loss': 'mse', 'optimizer': 'adam', 'graph_mode': 'knn', 'source': 'grm', 'knn_k': 9, 'weighted_edges': True, 'symmetrize_mode': 'union', 'use_snp_selection': False}. Best is trial 27 with value: 0.08246652821033469.
[I 2025-11-03 13:54:08,971] Trial 83 finished with value: 0.03637951250932051 and parameters: {'model_type': 'graphsage', 'hidden_dims': '[512, 128]', 'dropout': 0.17562240180801358, 'batch_norm': True, 'lr': 0.00033565018526027397, 'weight_decay': 1.4973005602703473e-06, 'epochs': 52, 'loss': 'mse', 'optimizer': 'adam', 'graph_mode': 'knn', 'source': 'grm', 'knn_k': 10, 'weighted_edges': True, 'symmetrize_mode': 'union', 'use_snp_selection': False}. Best is trial 27 with value: 0.08246652821033469.
[I 2025-11-03 13:54:13,358] Trial 84 finished with value: 0.06564160690246097 and parameters: {'model_type': 'graphsage', 'hidden_dims': '[512, 128]', 'dropout': 0.23108800905275534, 'batch_norm': True, 'lr': 0.00019742506369311942, 'weight_decay': 0.00013389378448592173, 'epochs': 189, 'loss': 'mse', 'optimizer': 'adam', 'graph_mode': 'knn', 'source': 'grm', 'knn_k': 10, 'weighted_edges': False, 'symmetrize_mode': 'union', 'use_snp_selection': False}. Best is trial 27 with value: 0.08246652821033469.
[I 2025-11-03 13:54:17,024] Trial 85 finished with value: 0.027931514605808814 and parameters: {'model_type': 'graphsage', 'hidden_dims': '[512, 256]', 'dropout': 0.2368413410998132, 'batch_norm': False, 'lr': 1.4504751778719508e-05, 'weight_decay': 0.00011664540714453242, 'epochs': 184, 'loss': 'mae', 'optimizer': 'adam', 'graph_mode': 'knn', 'source': 'grm', 'knn_k': 9, 'weighted_edges': False, 'symmetrize_mode': 'union', 'use_snp_selection': True, 'num_snps': 31547}. Best is trial 27 with value: 0.08246652821033469.
[I 2025-11-03 13:54:21,287] Trial 86 finished with value: 0.043757935963835815 and parameters: {'model_type': 'graphsage', 'hidden_dims': '[512, 128]', 'dropout': 0.11438452762776855, 'batch_norm': True, 'lr': 8.812740333039737e-05, 'weight_decay': 2.211448365940286e-05, 'epochs': 175, 'loss': 'mse', 'optimizer': 'adam', 'graph_mode': 'knn', 'source': 'grm', 'knn_k': 10, 'weighted_edges': False, 'symmetrize_mode': 'union', 'use_snp_selection': False}. Best is trial 27 with value: 0.08246652821033469.
[I 2025-11-03 13:54:23,200] Trial 87 finished with value: 0.05139763780365663 and parameters: {'model_type': 'graphsage', 'hidden_dims': '[128, 64]', 'dropout': 0.1557276231294941, 'batch_norm': True, 'lr': 0.00013547147749430727, 'weight_decay': 0.0004602717227388153, 'epochs': 194, 'loss': 'mse', 'optimizer': 'adam', 'graph_mode': 'cutoff', 'cutoff': 0.6090833761024688, 'grm_norm': 'none', 'self_loops': True, 'use_snp_selection': False}. Best is trial 27 with value: 0.08246652821033469.
[I 2025-11-03 13:54:26,330] Trial 88 finished with value: 0.033324922343054376 and parameters: {'model_type': 'graphsage', 'hidden_dims': '[512, 64]', 'dropout': 0.39861623544547053, 'batch_norm': False, 'lr': 0.00021022255103929601, 'weight_decay': 1.197166752564174e-05, 'epochs': 202, 'loss': 'mae', 'optimizer': 'adam', 'graph_mode': 'knn', 'source': 'grm', 'knn_k': 9, 'weighted_edges': False, 'symmetrize_mode': 'union', 'use_snp_selection': True, 'num_snps': 24673}. Best is trial 27 with value: 0.08246652821033469.
[I 2025-11-03 13:54:28,618] Trial 89 finished with value: 0.05902883848994352 and parameters: {'model_type': 'graphsage', 'hidden_dims': '[256, 128]', 'dropout': 0.32776899557336436, 'batch_norm': True, 'lr': 0.0005561117614195828, 'weight_decay': 3.232909269995429e-06, 'epochs': 114, 'loss': 'mse', 'optimizer': 'adam', 'graph_mode': 'knn', 'source': 'grm', 'knn_k': 10, 'weighted_edges': False, 'symmetrize_mode': 'mutual', 'use_snp_selection': False}. Best is trial 27 with value: 0.08246652821033469.
[I 2025-11-03 13:54:31,420] Trial 90 finished with value: 0.0590332511240035 and parameters: {'model_type': 'graphsage', 'hidden_dims': '[512, 128]', 'dropout': 0.1359859564596797, 'batch_norm': False, 'lr': 0.0001816407600388427, 'weight_decay': 7.22600587051151e-05, 'epochs': 191, 'loss': 'mae', 'optimizer': 'adam', 'graph_mode': 'knn', 'source': 'grm', 'knn_k': 7, 'weighted_edges': False, 'symmetrize_mode': 'union', 'use_snp_selection': True, 'num_snps': 21357}. Best is trial 27 with value: 0.08246652821033469.
[I 2025-11-03 13:54:35,638] Trial 91 finished with value: 0.05867293871935967 and parameters: {'model_type': 'graphsage', 'hidden_dims': '[512, 128]', 'dropout': 0.23046358809323184, 'batch_norm': True, 'lr': 0.0004074686922207297, 'weight_decay': 0.00015301322206711954, 'epochs': 164, 'loss': 'mse', 'optimizer': 'adam', 'graph_mode': 'knn', 'source': 'grm', 'knn_k': 10, 'weighted_edges': False, 'symmetrize_mode': 'union', 'use_snp_selection': False}. Best is trial 27 with value: 0.08246652821033469.
[I 2025-11-03 13:54:39,538] Trial 92 finished with value: 0.052706274919531976 and parameters: {'model_type': 'graphsage', 'hidden_dims': '[512, 128]', 'dropout': 0.20198284952254633, 'batch_norm': True, 'lr': 0.0006369438218732635, 'weight_decay': 0.0007286284200374825, 'epochs': 149, 'loss': 'mse', 'optimizer': 'adam', 'graph_mode': 'knn', 'source': 'grm', 'knn_k': 10, 'weighted_edges': True, 'symmetrize_mode': 'union', 'use_snp_selection': False}. Best is trial 27 with value: 0.08246652821033469.
[I 2025-11-03 13:54:43,276] Trial 93 finished with value: 0.053651513039574196 and parameters: {'model_type': 'graphsage', 'hidden_dims': '[512, 128]', 'dropout': 0.17497329061680128, 'batch_norm': True, 'lr': 0.00024036826819164012, 'weight_decay': 0.0002769028898851011, 'epochs': 140, 'loss': 'mse', 'optimizer': 'adam', 'graph_mode': 'knn', 'source': 'grm', 'knn_k': 9, 'weighted_edges': False, 'symmetrize_mode': 'union', 'use_snp_selection': False}. Best is trial 27 with value: 0.08246652821033469.
[I 2025-11-03 13:54:47,513] Trial 94 finished with value: 0.0631269731197851 and parameters: {'model_type': 'graphsage', 'hidden_dims': '[512, 128]', 'dropout': 0.26665760195997595, 'batch_norm': True, 'lr': 0.00032157731164434995, 'weight_decay': 0.0001703270116491287, 'epochs': 157, 'loss': 'mse', 'optimizer': 'adam', 'graph_mode': 'knn', 'source': 'grm', 'knn_k': 10, 'weighted_edges': True, 'symmetrize_mode': 'union', 'use_snp_selection': False}. Best is trial 27 with value: 0.08246652821033469.
[I 2025-11-03 13:54:50,331] Trial 95 finished with value: 0.041059791735638757 and parameters: {'model_type': 'graphsage', 'hidden_dims': '[512, 128]', 'dropout': 0.25213472396259273, 'batch_norm': True, 'lr': 3.808129772841976e-05, 'weight_decay': 6.744054859176712e-05, 'epochs': 59, 'loss': 'mse', 'optimizer': 'adam', 'graph_mode': 'knn', 'source': 'grm', 'knn_k': 9, 'weighted_edges': True, 'symmetrize_mode': 'union', 'use_snp_selection': False}. Best is trial 27 with value: 0.08246652821033469.
[I 2025-11-03 13:54:53,835] Trial 96 finished with value: 0.04001612854851274 and parameters: {'model_type': 'graphsage', 'hidden_dims': '[512, 64]', 'dropout': 0.18943859278587283, 'batch_norm': True, 'lr': 0.0008191125520349165, 'weight_decay': 0.00021192690374533985, 'epochs': 169, 'loss': 'mse', 'optimizer': 'adam', 'graph_mode': 'cutoff', 'cutoff': 0.8487206760131896, 'grm_norm': 'none', 'self_loops': True, 'use_snp_selection': False}. Best is trial 27 with value: 0.08246652821033469.
[I 2025-11-03 13:54:58,085] Trial 97 finished with value: 0.07092551528808747 and parameters: {'model_type': 'graphsage', 'hidden_dims': '[512, 128]', 'dropout': 0.3726935873507348, 'batch_norm': True, 'lr': 2.768007237648546e-05, 'weight_decay': 3.67468015513945e-05, 'epochs': 188, 'loss': 'mse', 'optimizer': 'adam', 'graph_mode': 'knn', 'source': 'grm', 'knn_k': 8, 'weighted_edges': False, 'symmetrize_mode': 'union', 'use_snp_selection': False}. Best is trial 27 with value: 0.08246652821033469.
[I 2025-11-03 13:55:02,307] Trial 98 finished with value: 0.049501197347893405 and parameters: {'model_type': 'graphsage', 'hidden_dims': '[256, 128, 64]', 'dropout': 0.3469194368765468, 'batch_norm': False, 'lr': 2.4660492191028224e-05, 'weight_decay': 7.152489315564433e-06, 'epochs': 216, 'loss': 'mae', 'optimizer': 'adam', 'graph_mode': 'knn', 'source': 'grm', 'knn_k': 8, 'weighted_edges': False, 'symmetrize_mode': 'union', 'use_snp_selection': True, 'num_snps': 47685}. Best is trial 27 with value: 0.08246652821033469.
[I 2025-11-03 13:55:04,875] Trial 99 finished with value: 0.043866458150564856 and parameters: {'model_type': 'graphsage', 'hidden_dims': '[512, 128]', 'dropout': 0.3715103746538453, 'batch_norm': True, 'lr': 2.0496113564314255e-05, 'weight_decay': 2.373512364777727e-07, 'epochs': 40, 'loss': 'mse', 'optimizer': 'adam', 'graph_mode': 'knn', 'source': 'grm', 'knn_k': 7, 'weighted_edges': False, 'symmetrize_mode': 'union', 'use_snp_selection': False}. Best is trial 27 with value: 0.08246652821033469.
[I 2025-11-03 13:55:09,280] Trial 100 finished with value: 0.04076543288544755 and parameters: {'model_type': 'graphsage', 'hidden_dims': '[512, 128]', 'dropout': 0.4294202694944567, 'batch_norm': True, 'lr': 1.1498264507109711e-05, 'weight_decay': 3.456096881524081e-05, 'epochs': 204, 'loss': 'mse', 'optimizer': 'adam', 'graph_mode': 'knn', 'source': 'grm', 'knn_k': 8, 'weighted_edges': False, 'symmetrize_mode': 'union', 'use_snp_selection': False}. Best is trial 27 with value: 0.08246652821033469.
[I 2025-11-03 13:55:13,643] Trial 101 finished with value: 0.02787346908470583 and parameters: {'model_type': 'graphsage', 'hidden_dims': '[512, 128]', 'dropout': 0.3899885157458053, 'batch_norm': True, 'lr': 1.5670888992179415e-05, 'weight_decay': 2.0256974049196616e-06, 'epochs': 189, 'loss': 'mse', 'optimizer': 'adam', 'graph_mode': 'knn', 'source': 'grm', 'knn_k': 10, 'weighted_edges': False, 'symmetrize_mode': 'union', 'use_snp_selection': False}. Best is trial 27 with value: 0.08246652821033469.
[I 2025-11-03 13:55:18,415] Trial 102 finished with value: 0.05757086224798705 and parameters: {'model_type': 'graphsage', 'hidden_dims': '[512, 128]', 'dropout': 0.4491952353027189, 'batch_norm': True, 'lr': 6.40714866693227e-05, 'weight_decay': 7.246225319679822e-05, 'epochs': 228, 'loss': 'mse', 'optimizer': 'adam', 'graph_mode': 'knn', 'source': 'grm', 'knn_k': 9, 'weighted_edges': False, 'symmetrize_mode': 'union', 'use_snp_selection': False}. Best is trial 27 with value: 0.08246652821033469.
[I 2025-11-03 13:55:22,350] Trial 103 finished with value: 0.03585334921998472 and parameters: {'model_type': 'graphsage', 'hidden_dims': '[512, 128]', 'dropout': 0.35766344423138663, 'batch_norm': True, 'lr': 2.773211918753551e-05, 'weight_decay': 4.1545547994295927e-07, 'epochs': 176, 'loss': 'mse', 'optimizer': 'adam', 'graph_mode': 'knn', 'source': 'grm', 'knn_k': 5, 'weighted_edges': True, 'symmetrize_mode': 'union', 'use_snp_selection': False}. Best is trial 27 with value: 0.08246652821033469.
[I 2025-11-03 13:55:25,555] Trial 104 finished with value: 0.061571313042753525 and parameters: {'model_type': 'graphsage', 'hidden_dims': '[512, 128]', 'dropout': 0.37993300601129587, 'batch_norm': True, 'lr': 0.00018129537744993106, 'weight_decay': 5.8006780261886806e-05, 'epochs': 89, 'loss': 'mse', 'optimizer': 'adam', 'graph_mode': 'knn', 'source': 'grm', 'knn_k': 10, 'weighted_edges': True, 'symmetrize_mode': 'union', 'use_snp_selection': False}. Best is trial 27 with value: 0.08246652821033469.
[I 2025-11-03 13:55:28,884] Trial 105 finished with value: 0.09350861439504544 and parameters: {'model_type': 'graphsage', 'hidden_dims': '[512, 64]', 'dropout': 0.3132503851233205, 'batch_norm': True, 'lr': 7.0745935280800965e-06, 'weight_decay': 0.0001289041783770983, 'epochs': 130, 'loss': 'mse', 'optimizer': 'adam', 'graph_mode': 'knn', 'source': 'grm', 'knn_k': 2, 'weighted_edges': False, 'symmetrize_mode': 'union', 'use_snp_selection': False}. Best is trial 105 with value: 0.09350861439504544.
[I 2025-11-03 13:55:34,066] Trial 106 finished with value: 0.019305668746072296 and parameters: {'model_type': 'graphsage', 'hidden_dims': '[512, 64]', 'dropout': 0.30549254426369904, 'batch_norm': True, 'lr': 5.929912652028068e-06, 'weight_decay': 9.356430273833391e-05, 'epochs': 349, 'loss': 'mse', 'optimizer': 'adam', 'graph_mode': 'cutoff', 'cutoff': 0.7096481691344498, 'grm_norm': 'gcn', 'self_loops': False, 'use_snp_selection': False}. Best is trial 105 with value: 0.09350861439504544.
[I 2025-11-03 13:55:36,967] Trial 107 finished with value: 0.04680291467090047 and parameters: {'model_type': 'graphsage', 'hidden_dims': '[512, 64]', 'dropout': 0.3192306503190054, 'batch_norm': False, 'lr': 4.815686653910115e-06, 'weight_decay': 0.000128093342305852, 'epochs': 99, 'loss': 'mae', 'optimizer': 'adam', 'graph_mode': 'knn', 'source': 'grm', 'knn_k': 3, 'weighted_edges': False, 'symmetrize_mode': 'mutual', 'use_snp_selection': True, 'num_snps': 29589}. Best is trial 105 with value: 0.09350861439504544.
[I 2025-11-03 13:55:39,883] Trial 108 finished with value: 0.01624572929951598 and parameters: {'model_type': 'graphsage', 'hidden_dims': '[512, 64]', 'dropout': 0.4078670883561663, 'batch_norm': True, 'lr': 6.883934827950367e-06, 'weight_decay': 1.16738490766025e-06, 'epochs': 81, 'loss': 'mse', 'optimizer': 'adam', 'graph_mode': 'knn', 'source': 'grm', 'knn_k': 2, 'weighted_edges': False, 'symmetrize_mode': 'union', 'use_snp_selection': False}. Best is trial 105 with value: 0.09350861439504544.
[I 2025-11-03 13:55:43,931] Trial 109 finished with value: 0.05412524152716 and parameters: {'model_type': 'graphsage', 'hidden_dims': '[512, 64]', 'dropout': 0.3289231054335719, 'batch_norm': True, 'lr': 1.0234082666540031e-05, 'weight_decay': 5.159572709604749e-06, 'epochs': 197, 'loss': 'mse', 'optimizer': 'adam', 'graph_mode': 'knn', 'source': 'grm', 'knn_k': 3, 'weighted_edges': False, 'symmetrize_mode': 'union', 'use_snp_selection': False}. Best is trial 105 with value: 0.09350861439504544.
[I 2025-11-03 13:55:47,564] Trial 110 finished with value: 0.043157992280720626 and parameters: {'model_type': 'graphsage', 'hidden_dims': '[512, 256]', 'dropout': 0.35090288099304107, 'batch_norm': True, 'lr': 8.805813735778402e-06, 'weight_decay': 4.3907307620383124e-05, 'epochs': 130, 'loss': 'mse', 'optimizer': 'adam', 'graph_mode': 'knn', 'source': 'grm', 'knn_k': 8, 'weighted_edges': False, 'symmetrize_mode': 'union', 'use_snp_selection': False}. Best is trial 105 with value: 0.09350861439504544.
[I 2025-11-03 13:55:51,364] Trial 111 finished with value: 0.056948801394716614 and parameters: {'model_type': 'graphsage', 'hidden_dims': '[512, 128]', 'dropout': 0.2940273437630865, 'batch_norm': True, 'lr': 1.2143747674688313e-05, 'weight_decay': 0.0002693948799605396, 'epochs': 187, 'loss': 'mse', 'optimizer': 'adam', 'graph_mode': 'knn', 'source': 'grm', 'knn_k': 1, 'weighted_edges': True, 'symmetrize_mode': 'union', 'use_snp_selection': False}. Best is trial 105 with value: 0.09350861439504544.
[I 2025-11-03 13:55:54,215] Trial 112 finished with value: 0.04997881900533886 and parameters: {'model_type': 'graphsage', 'hidden_dims': '[512, 64]', 'dropout': 0.2212679276523104, 'batch_norm': True, 'lr': 0.00012761023104804174, 'weight_decay': 0.000345228647677676, 'epochs': 65, 'loss': 'mse', 'optimizer': 'adam', 'graph_mode': 'knn', 'source': 'grm', 'knn_k': 6, 'weighted_edges': False, 'symmetrize_mode': 'union', 'use_snp_selection': False}. Best is trial 105 with value: 0.09350861439504544.
[I 2025-11-03 13:55:57,231] Trial 113 finished with value: -0.0025589172102305708 and parameters: {'model_type': 'graphsage', 'hidden_dims': '[512, 128]', 'dropout': 0.30737243090814925, 'batch_norm': True, 'lr': 1.9552546479349774e-05, 'weight_decay': 0.00018717096147480473, 'epochs': 73, 'loss': 'mse', 'optimizer': 'adam', 'graph_mode': 'knn', 'source': 'grm', 'knn_k': 10, 'weighted_edges': True, 'symmetrize_mode': 'union', 'use_snp_selection': False}. Best is trial 105 with value: 0.09350861439504544.
[I 2025-11-03 13:55:59,381] Trial 114 finished with value: 0.06832313272848778 and parameters: {'model_type': 'graphsage', 'hidden_dims': '[128, 64]', 'dropout': 0.1646995133477048, 'batch_norm': True, 'lr': 0.0004891366970307016, 'weight_decay': 0.0001052371894368563, 'epochs': 145, 'loss': 'mse', 'optimizer': 'adam', 'graph_mode': 'knn', 'source': 'grm', 'knn_k': 10, 'weighted_edges': False, 'symmetrize_mode': 'union', 'use_snp_selection': False}. Best is trial 105 with value: 0.09350861439504544.
[I 2025-11-03 13:56:01,468] Trial 115 finished with value: 0.08130816303097696 and parameters: {'model_type': 'graphsage', 'hidden_dims': '[128, 64]', 'dropout': 0.15538261476886459, 'batch_norm': True, 'lr': 0.000497216459866953, 'weight_decay': 1.702492470605601e-06, 'epochs': 147, 'loss': 'mse', 'optimizer': 'adam', 'graph_mode': 'knn', 'source': 'grm', 'knn_k': 9, 'weighted_edges': False, 'symmetrize_mode': 'union', 'use_snp_selection': False}. Best is trial 105 with value: 0.09350861439504544.
[I 2025-11-03 13:56:03,582] Trial 116 finished with value: 0.018315591969926902 and parameters: {'model_type': 'graphsage', 'hidden_dims': '[128, 64]', 'dropout': 0.1534936579318401, 'batch_norm': True, 'lr': 2.864185252705153e-06, 'weight_decay': 2.176718453209745e-06, 'epochs': 153, 'loss': 'mse', 'optimizer': 'adam', 'graph_mode': 'knn', 'source': 'grm', 'knn_k': 9, 'weighted_edges': False, 'symmetrize_mode': 'union', 'use_snp_selection': False}. Best is trial 105 with value: 0.09350861439504544.
[I 2025-11-03 13:56:06,706] Trial 117 finished with value: 0.019632843518511387 and parameters: {'model_type': 'graphsage', 'hidden_dims': '[128, 64]', 'dropout': 0.1717762752529956, 'batch_norm': False, 'lr': 0.0005008190196071536, 'weight_decay': 1.7988911426337372e-06, 'epochs': 147, 'loss': 'mae', 'optimizer': 'adam', 'graph_mode': 'knn', 'source': 'grm', 'knn_k': 9, 'weighted_edges': False, 'symmetrize_mode': 'union', 'use_snp_selection': True, 'num_snps': 42779}. Best is trial 105 with value: 0.09350861439504544.
[I 2025-11-03 13:56:08,909] Trial 118 finished with value: 0.03181970779930696 and parameters: {'model_type': 'graphsage', 'hidden_dims': '[128, 64]', 'dropout': 0.1329943485622445, 'batch_norm': True, 'lr': 0.0006135009368633688, 'weight_decay': 0.00010591766421502979, 'epochs': 159, 'loss': 'mse', 'optimizer': 'adam', 'graph_mode': 'knn', 'source': 'grm', 'knn_k': 10, 'weighted_edges': False, 'symmetrize_mode': 'union', 'use_snp_selection': False}. Best is trial 105 with value: 0.09350861439504544.
[I 2025-11-03 13:56:10,876] Trial 119 finished with value: 0.05138816694575725 and parameters: {'model_type': 'graphsage', 'hidden_dims': '[128, 64]', 'dropout': 0.1802322365448285, 'batch_norm': True, 'lr': 0.0003961932180794293, 'weight_decay': 2.6054501716763436e-06, 'epochs': 133, 'loss': 'mse', 'optimizer': 'adam', 'graph_mode': 'knn', 'source': 'grm', 'knn_k': 8, 'weighted_edges': False, 'symmetrize_mode': 'union', 'use_snp_selection': False}. Best is trial 105 with value: 0.09350861439504544.
[I 2025-11-03 13:56:13,190] Trial 120 finished with value: 0.052309471224416176 and parameters: {'model_type': 'graphsage', 'hidden_dims': '[128, 64]', 'dropout': 0.16724914914826114, 'batch_norm': True, 'lr': 0.0007573460922773003, 'weight_decay': 0.00012974036514654518, 'epochs': 182, 'loss': 'mse', 'optimizer': 'adam', 'graph_mode': 'knn', 'source': 'grm', 'knn_k': 10, 'weighted_edges': False, 'symmetrize_mode': 'union', 'use_snp_selection': False}. Best is trial 105 with value: 0.09350861439504544.
[I 2025-11-03 13:56:15,391] Trial 121 finished with value: 0.07068312746054616 and parameters: {'model_type': 'graphsage', 'hidden_dims': '[128, 64]', 'dropout': 0.14287176441549793, 'batch_norm': True, 'lr': 0.0002500529691513822, 'weight_decay': 9.76244756439117e-07, 'epochs': 169, 'loss': 'mse', 'optimizer': 'adam', 'graph_mode': 'knn', 'source': 'grm', 'knn_k': 9, 'weighted_edges': False, 'symmetrize_mode': 'union', 'use_snp_selection': False}. Best is trial 105 with value: 0.09350861439504544.
