[I 2025-11-03 15:33:59,989] Trial 77 finished with value: 0.04190895393575258 and parameters: {'model_type': 'graphsage', 'hidden_dims': '[128, 64]', 'dropout': 0.5496308440373361, 'batch_norm': True, 'lr': 0.0003608938128440931, 'weight_decay': 0.0003720129248482224, 'epochs': 179, 'loss': 'mae', 'optimizer': 'adam', 'graph_mode': 'cutoff', 'cutoff': 0.44133663932238687, 'grm_norm': 'gcn', 'self_loops': True, 'use_snp_selection': False}. Best is trial 48 with value: 0.06346059432764593.
[I 2025-11-03 15:34:03,159] Trial 78 finished with value: 0.01997180909906217 and parameters: {'model_type': 'graphsage', 'hidden_dims': '[512, 64]', 'dropout': 0.4758995469708287, 'batch_norm': True, 'lr': 0.0002560158333058875, 'weight_decay': 0.00011792507357378527, 'epochs': 131, 'loss': 'mse', 'optimizer': 'adam', 'graph_mode': 'cutoff', 'cutoff': 0.5283131570577712, 'grm_norm': 'gcn', 'self_loops': True, 'use_snp_selection': False}. Best is trial 48 with value: 0.06346059432764593.
[I 2025-11-03 15:34:06,190] Trial 79 finished with value: 0.04332474617157546 and parameters: {'model_type': 'graphsage', 'hidden_dims': '[512, 64]', 'dropout': 0.5841394145321445, 'batch_norm': True, 'lr': 0.0008198373638923766, 'weight_decay': 0.0002921708695043029, 'epochs': 109, 'loss': 'mse', 'optimizer': 'adam', 'graph_mode': 'cutoff', 'cutoff': 0.33768976199497475, 'grm_norm': 'gcn', 'self_loops': True, 'use_snp_selection': False}. Best is trial 48 with value: 0.06346059432764593.
[I 2025-11-03 15:34:10,078] Trial 80 finished with value: 0.06056614488802755 and parameters: {'model_type': 'graphsage', 'hidden_dims': '[512, 64]', 'dropout': 0.41441569514483, 'batch_norm': True, 'lr': 0.0003056637166372841, 'weight_decay': 0.0008038606513198394, 'epochs': 221, 'loss': 'mse', 'optimizer': 'adam', 'graph_mode': 'cutoff', 'cutoff': 0.5841664545809389, 'grm_norm': 'none', 'self_loops': True, 'use_snp_selection': False}. Best is trial 48 with value: 0.06346059432764593.
[I 2025-11-03 15:34:14,050] Trial 81 finished with value: 0.060753213905471615 and parameters: {'model_type': 'graphsage', 'hidden_dims': '[512, 64]', 'dropout': 0.42277738835947337, 'batch_norm': True, 'lr': 0.0003027877664348024, 'weight_decay': 0.0007649760400070593, 'epochs': 225, 'loss': 'mse', 'optimizer': 'adam', 'graph_mode': 'cutoff', 'cutoff': 0.5843343031217995, 'grm_norm': 'none', 'self_loops': True, 'use_snp_selection': False}. Best is trial 48 with value: 0.06346059432764593.
[I 2025-11-03 15:34:18,033] Trial 82 finished with value: 0.0423601270554833 and parameters: {'model_type': 'graphsage', 'hidden_dims': '[512, 64]', 'dropout': 0.4214488876106999, 'batch_norm': True, 'lr': 0.000408482042969251, 'weight_decay': 0.0007637147406750328, 'epochs': 225, 'loss': 'mse', 'optimizer': 'adam', 'graph_mode': 'cutoff', 'cutoff': 0.6208951021759782, 'grm_norm': 'none', 'self_loops': True, 'use_snp_selection': False}. Best is trial 48 with value: 0.06346059432764593.
[I 2025-11-03 15:34:21,814] Trial 83 finished with value: 0.040944354351701295 and parameters: {'model_type': 'graphsage', 'hidden_dims': '[512, 64]', 'dropout': 0.3611388392465483, 'batch_norm': True, 'lr': 0.0005755722442584111, 'weight_decay': 0.0005089226675946426, 'epochs': 201, 'loss': 'mse', 'optimizer': 'adam', 'graph_mode': 'cutoff', 'cutoff': 0.5718917003499765, 'grm_norm': 'none', 'self_loops': True, 'use_snp_selection': False}. Best is trial 48 with value: 0.06346059432764593.
[I 2025-11-03 15:34:24,278] Trial 84 finished with value: 0.02686734692397272 and parameters: {'model_type': 'graphsage', 'hidden_dims': '[256, 128, 64]', 'dropout': 0.38919544932345057, 'batch_norm': True, 'lr': 0.0003182089609625517, 'weight_decay': 0.0009181417490863753, 'epochs': 219, 'loss': 'mse', 'optimizer': 'adam', 'graph_mode': 'cutoff', 'cutoff': 0.6338210726289162, 'grm_norm': 'none', 'self_loops': True, 'use_snp_selection': False}. Best is trial 48 with value: 0.06346059432764593.
[I 2025-11-03 15:34:28,402] Trial 85 finished with value: 0.02441706711850278 and parameters: {'model_type': 'graphsage', 'hidden_dims': '[512, 64]', 'dropout': 0.4493217730332804, 'batch_norm': True, 'lr': 0.0004300930151841585, 'weight_decay': 0.0006122777092883589, 'epochs': 240, 'loss': 'mse', 'optimizer': 'adam', 'graph_mode': 'cutoff', 'cutoff': 0.5849922129180996, 'grm_norm': 'none', 'self_loops': True, 'use_snp_selection': False}. Best is trial 48 with value: 0.06346059432764593.
[I 2025-11-03 15:34:32,184] Trial 86 finished with value: 0.03473383821753032 and parameters: {'model_type': 'graphsage', 'hidden_dims': '[512, 64]', 'dropout': 0.37460391000528603, 'batch_norm': True, 'lr': 0.0007007918316934453, 'weight_decay': 0.00020983731025342187, 'epochs': 192, 'loss': 'mse', 'optimizer': 'adam', 'graph_mode': 'knn', 'source': 'grm', 'knn_k': 2, 'weighted_edges': True, 'symmetrize_mode': 'mutual', 'use_snp_selection': False}. Best is trial 48 with value: 0.06346059432764593.
[I 2025-11-03 15:34:36,405] Trial 87 finished with value: 0.021419501530126252 and parameters: {'model_type': 'graphsage', 'hidden_dims': '[512, 128]', 'dropout': 0.41958775322415626, 'batch_norm': True, 'lr': 0.00024327213911483773, 'weight_decay': 0.0009864544258812774, 'epochs': 250, 'loss': 'mse', 'optimizer': 'adam', 'graph_mode': 'cutoff', 'cutoff': 0.5499465679050866, 'grm_norm': 'none', 'self_loops': True, 'use_snp_selection': False}. Best is trial 48 with value: 0.06346059432764593.
[I 2025-11-03 15:34:40,235] Trial 88 finished with value: 0.050371684648230136 and parameters: {'model_type': 'graphsage', 'hidden_dims': '[512, 64]', 'dropout': 0.5021302982948572, 'batch_norm': True, 'lr': 0.00017117383107318038, 'weight_decay': 0.0007414830430542081, 'epochs': 208, 'loss': 'mse', 'optimizer': 'adam', 'graph_mode': 'cutoff', 'cutoff': 0.6552721780363898, 'grm_norm': 'none', 'self_loops': True, 'use_snp_selection': False}. Best is trial 48 with value: 0.06346059432764593.
[I 2025-11-03 15:34:44,288] Trial 89 finished with value: 0.04167526382062334 and parameters: {'model_type': 'graphsage', 'hidden_dims': '[512, 64]', 'dropout': 0.4026882426274172, 'batch_norm': True, 'lr': 0.0006028034065128384, 'weight_decay': 0.0003894741991208546, 'epochs': 226, 'loss': 'mae', 'optimizer': 'adam', 'graph_mode': 'cutoff', 'cutoff': 0.41458543243243967, 'grm_norm': 'none', 'self_loops': True, 'use_snp_selection': False}. Best is trial 48 with value: 0.06346059432764593.
[I 2025-11-03 15:34:46,313] Trial 90 finished with value: 0.020662480366773334 and parameters: {'model_type': 'graphsage', 'hidden_dims': '[128, 64]', 'dropout': 0.5630344736692752, 'batch_norm': True, 'lr': 0.00011670852782659026, 'weight_decay': 0.0005616651575028191, 'epochs': 257, 'loss': 'mse', 'optimizer': 'adam', 'graph_mode': 'cutoff', 'cutoff': 0.3692100830916879, 'grm_norm': 'none', 'self_loops': True, 'use_snp_selection': False}. Best is trial 48 with value: 0.06346059432764593.
[I 2025-11-03 15:34:49,726] Trial 91 finished with value: 0.035861485358268386 and parameters: {'model_type': 'graphsage', 'hidden_dims': '[512, 64]', 'dropout': 0.47813795035547024, 'batch_norm': True, 'lr': 0.0002837726763316674, 'weight_decay': 0.00028778964915829785, 'epochs': 160, 'loss': 'mse', 'optimizer': 'adam', 'graph_mode': 'cutoff', 'cutoff': 0.5944323894224756, 'grm_norm': 'gcn', 'self_loops': True, 'use_snp_selection': False}. Best is trial 48 with value: 0.06346059432764593.
[I 2025-11-03 15:34:53,070] Trial 92 finished with value: 0.02994383196021145 and parameters: {'model_type': 'graphsage', 'hidden_dims': '[512, 64]', 'dropout': 0.4673977043088427, 'batch_norm': True, 'lr': 0.0003292599262380594, 'weight_decay': 0.0004259724880656445, 'epochs': 148, 'loss': 'mse', 'optimizer': 'adam', 'graph_mode': 'cutoff', 'cutoff': 0.4529521379118787, 'grm_norm': 'gcn', 'self_loops': True, 'use_snp_selection': False}. Best is trial 48 with value: 0.06346059432764593.
[I 2025-11-03 15:34:56,794] Trial 93 finished with value: 0.02044250524972311 and parameters: {'model_type': 'graphsage', 'hidden_dims': '[512, 64]', 'dropout': 0.43362837841751983, 'batch_norm': True, 'lr': 0.0001916409318525854, 'weight_decay': 0.000773899362331021, 'epochs': 197, 'loss': 'mse', 'optimizer': 'adam', 'graph_mode': 'cutoff', 'cutoff': 0.49356008125593515, 'grm_norm': 'gcn', 'self_loops': True, 'use_snp_selection': False}. Best is trial 48 with value: 0.06346059432764593.
[I 2025-11-03 15:35:00,428] Trial 94 finished with value: 0.05783049235961927 and parameters: {'model_type': 'graphsage', 'hidden_dims': '[512, 64]', 'dropout': 0.5360721971166226, 'batch_norm': True, 'lr': 0.00045675378029934576, 'weight_decay': 0.00022408864399941296, 'epochs': 177, 'loss': 'mse', 'optimizer': 'adam', 'graph_mode': 'cutoff', 'cutoff': 0.48535762982040553, 'grm_norm': 'gcn', 'self_loops': True, 'use_snp_selection': False}. Best is trial 48 with value: 0.06346059432764593.
[I 2025-11-03 15:35:04,120] Trial 95 finished with value: 0.029315501497683274 and parameters: {'model_type': 'graphsage', 'hidden_dims': '[512, 64]', 'dropout': 0.5178243904528878, 'batch_norm': True, 'lr': 0.0004915658893610961, 'weight_decay': 2.613361414242288e-06, 'epochs': 187, 'loss': 'mse', 'optimizer': 'adam', 'graph_mode': 'cutoff', 'cutoff': 0.4744729591862526, 'grm_norm': 'cosine', 'self_loops': True, 'use_snp_selection': False}. Best is trial 48 with value: 0.06346059432764593.
[I 2025-11-03 15:35:07,658] Trial 96 finished with value: 0.06258245111089283 and parameters: {'model_type': 'graphsage', 'hidden_dims': '[512, 64]', 'dropout': 0.5993202620943154, 'batch_norm': True, 'lr': 0.0008512534304956831, 'weight_decay': 0.00016495613471432974, 'epochs': 175, 'loss': 'mse', 'optimizer': 'adam', 'graph_mode': 'cutoff', 'cutoff': 0.4076187230763613, 'grm_norm': 'gcn', 'self_loops': True, 'use_snp_selection': False}. Best is trial 48 with value: 0.06346059432764593.
[I 2025-11-03 15:35:11,247] Trial 97 finished with value: 0.027626708603151282 and parameters: {'model_type': 'graphsage', 'hidden_dims': '[512, 64]', 'dropout': 0.540483040732338, 'batch_norm': True, 'lr': 0.0008585203581835455, 'weight_decay': 5.288480433747001e-05, 'epochs': 175, 'loss': 'mse', 'optimizer': 'adam', 'graph_mode': 'cutoff', 'cutoff': 0.4005033356594794, 'grm_norm': 'gcn', 'self_loops': True, 'use_snp_selection': False}. Best is trial 48 with value: 0.06346059432764593.
[I 2025-11-03 15:35:15,121] Trial 98 finished with value: 0.046473662877202865 and parameters: {'model_type': 'graphsage', 'hidden_dims': '[512, 64]', 'dropout': 0.5994508742302738, 'batch_norm': True, 'lr': 0.0007650689618058247, 'weight_decay': 0.00016670115216573843, 'epochs': 205, 'loss': 'mse', 'optimizer': 'adam', 'graph_mode': 'cutoff', 'cutoff': 0.3816538550546764, 'grm_norm': 'gcn', 'self_loops': True, 'use_snp_selection': False}. Best is trial 48 with value: 0.06346059432764593.
[I 2025-11-03 15:35:19,686] Trial 99 finished with value: 0.01813860413431005 and parameters: {'model_type': 'graphsage', 'hidden_dims': '[512, 64]', 'dropout': 0.3448971610809119, 'batch_norm': True, 'lr': 0.0006165204546519131, 'weight_decay': 0.00035099716085621336, 'epochs': 217, 'loss': 'mse', 'optimizer': 'adam', 'graph_mode': 'knn', 'source': 'grm', 'knn_k': 9, 'weighted_edges': False, 'symmetrize_mode': 'union', 'use_snp_selection': False}. Best is trial 48 with value: 0.06346059432764593.
[I 2025-11-03 15:35:23,702] Trial 100 finished with value: 0.03125015436805309 and parameters: {'model_type': 'graphsage', 'hidden_dims': '[512, 64]', 'dropout': 0.5314492238124483, 'batch_norm': True, 'lr': 0.0009862957805442023, 'weight_decay': 0.00021181285450217754, 'epochs': 230, 'loss': 'mse', 'optimizer': 'adam', 'graph_mode': 'cutoff', 'cutoff': 0.4979077390190446, 'grm_norm': 'gcn', 'self_loops': True, 'use_snp_selection': False}. Best is trial 48 with value: 0.06346059432764593.
[I 2025-11-03 15:35:27,192] Trial 101 finished with value: 0.043965768705820245 and parameters: {'model_type': 'graphsage', 'hidden_dims': '[512, 64]', 'dropout': 0.5772859036282685, 'batch_norm': True, 'lr': 0.0004413387682174177, 'weight_decay': 0.0004903354513384606, 'epochs': 170, 'loss': 'mse', 'optimizer': 'adam', 'graph_mode': 'cutoff', 'cutoff': 0.43270837042674476, 'grm_norm': 'gcn', 'self_loops': True, 'use_snp_selection': False}. Best is trial 48 with value: 0.06346059432764593.
[I 2025-11-03 15:35:30,849] Trial 102 finished with value: 0.05853590378001794 and parameters: {'model_type': 'graphsage', 'hidden_dims': '[512, 64]', 'dropout': 0.5701795898678196, 'batch_norm': True, 'lr': 0.0003782156958607379, 'weight_decay': 8.552583271653404e-05, 'epochs': 183, 'loss': 'mse', 'optimizer': 'adam', 'graph_mode': 'cutoff', 'cutoff': 0.4107216082501678, 'grm_norm': 'gcn', 'self_loops': True, 'use_snp_selection': False}. Best is trial 48 with value: 0.06346059432764593.
[I 2025-11-03 15:35:34,501] Trial 103 finished with value: 0.05073150330003244 and parameters: {'model_type': 'graphsage', 'hidden_dims': '[512, 64]', 'dropout': 0.5467877616800544, 'batch_norm': True, 'lr': 0.0005434013541689288, 'weight_decay': 8.956470351996471e-05, 'epochs': 180, 'loss': 'mse', 'optimizer': 'adam', 'graph_mode': 'cutoff', 'cutoff': 0.3202915556109029, 'grm_norm': 'gcn', 'self_loops': True, 'use_snp_selection': False}. Best is trial 48 with value: 0.06346059432764593.
[I 2025-11-03 15:35:36,886] Trial 104 finished with value: 0.03794709335999623 and parameters: {'model_type': 'graphsage', 'hidden_dims': '[256, 128, 64]', 'dropout': 0.5866303739573598, 'batch_norm': True, 'lr': 0.0006652336298924841, 'weight_decay': 0.00013156038211385731, 'epochs': 190, 'loss': 'mse', 'optimizer': 'adam', 'graph_mode': 'cutoff', 'cutoff': 0.41239622091034306, 'grm_norm': 'gcn', 'self_loops': True, 'use_snp_selection': False}. Best is trial 48 with value: 0.06346059432764593.
[I 2025-11-03 15:35:40,781] Trial 105 finished with value: -0.019128936762302644 and parameters: {'model_type': 'graphsage', 'hidden_dims': '[512, 64]', 'dropout': 0.5610522781610133, 'batch_norm': True, 'lr': 2.354905206973045e-06, 'weight_decay': 0.0006689599702153733, 'epochs': 213, 'loss': 'mse', 'optimizer': 'adam', 'graph_mode': 'cutoff', 'cutoff': 0.3568592119037956, 'grm_norm': 'gcn', 'self_loops': True, 'use_snp_selection': False}. Best is trial 48 with value: 0.06346059432764593.
[I 2025-11-03 15:35:44,192] Trial 106 finished with value: 0.037995527018825484 and parameters: {'model_type': 'graphsage', 'hidden_dims': '[512, 256]', 'dropout': 0.5684796208567937, 'batch_norm': True, 'lr': 0.00037226444797536034, 'weight_decay': 7.492643122464683e-05, 'epochs': 164, 'loss': 'mse', 'optimizer': 'adam', 'graph_mode': 'cutoff', 'cutoff': 0.5612334356317403, 'grm_norm': 'gcn', 'self_loops': True, 'use_snp_selection': False}. Best is trial 48 with value: 0.06346059432764593.
[I 2025-11-03 15:35:46,132] Trial 107 finished with value: 0.021066630170918952 and parameters: {'model_type': 'graphsage', 'hidden_dims': '[512, 64]', 'dropout': 0.5025728737293143, 'batch_norm': False, 'lr': 0.0004781852575179912, 'weight_decay': 0.00010553044007595142, 'epochs': 200, 'loss': 'mse', 'optimizer': 'adam', 'graph_mode': 'cutoff', 'cutoff': 0.45237145301481846, 'grm_norm': 'gcn', 'self_loops': True, 'use_snp_selection': True, 'num_snps': 8867}. Best is trial 48 with value: 0.06346059432764593.
[I 2025-11-03 15:35:49,748] Trial 108 finished with value: 0.04054017283308696 and parameters: {'model_type': 'graphsage', 'hidden_dims': '[512, 64]', 'dropout': 0.5168895954426431, 'batch_norm': True, 'lr': 0.0003930642794787022, 'weight_decay': 0.00023789046046984743, 'epochs': 183, 'loss': 'mse', 'optimizer': 'adam', 'graph_mode': 'cutoff', 'cutoff': 0.5105396766151742, 'grm_norm': 'none', 'self_loops': True, 'use_snp_selection': False}. Best is trial 48 with value: 0.06346059432764593.
[I 2025-11-03 15:35:53,106] Trial 109 finished with value: 0.026943783520826096 and parameters: {'model_type': 'graphsage', 'hidden_dims': '[512, 64]', 'dropout': 0.531134103127259, 'batch_norm': True, 'lr': 0.000754061068905979, 'weight_decay': 0.0002959227385725499, 'epochs': 150, 'loss': 'mae', 'optimizer': 'adam', 'graph_mode': 'cutoff', 'cutoff': 0.4759611320741183, 'grm_norm': 'gcn', 'self_loops': True, 'use_snp_selection': False}. Best is trial 48 with value: 0.06346059432764593.
[I 2025-11-03 15:35:56,475] Trial 110 finished with value: 0.04411112712966192 and parameters: {'model_type': 'graphsage', 'hidden_dims': '[512, 64]', 'dropout': 0.5537139483582775, 'batch_norm': True, 'lr': 0.00022400044132520267, 'weight_decay': 0.0005808261193180944, 'epochs': 156, 'loss': 'mse', 'optimizer': 'adam', 'graph_mode': 'cutoff', 'cutoff': 0.3984794655667198, 'grm_norm': 'gcn', 'self_loops': True, 'use_snp_selection': False}. Best is trial 48 with value: 0.06346059432764593.
[I 2025-11-03 15:36:00,179] Trial 111 finished with value: 0.060956945948113704 and parameters: {'model_type': 'graphsage', 'hidden_dims': '[512, 64]', 'dropout': 0.5955337425653463, 'batch_norm': True, 'lr': 0.0002689757031482741, 'weight_decay': 0.00019220616596733796, 'epochs': 193, 'loss': 'mse', 'optimizer': 'adam', 'graph_mode': 'cutoff', 'cutoff': 0.42749961123100483, 'grm_norm': 'cosine', 'self_loops': True, 'use_snp_selection': False}. Best is trial 48 with value: 0.06346059432764593.
[I 2025-11-03 15:36:03,894] Trial 112 finished with value: 0.05102397201716881 and parameters: {'model_type': 'graphsage', 'hidden_dims': '[512, 64]', 'dropout': 0.5709412738371908, 'batch_norm': True, 'lr': 0.0002674379858044358, 'weight_decay': 0.0001616608345536745, 'epochs': 194, 'loss': 'mse', 'optimizer': 'adam', 'graph_mode': 'cutoff', 'cutoff': 0.42167011393551734, 'grm_norm': 'cosine', 'self_loops': True, 'use_snp_selection': False}. Best is trial 48 with value: 0.06346059432764593.
[I 2025-11-03 15:36:07,699] Trial 113 finished with value: 0.04121256722149154 and parameters: {'model_type': 'graphsage', 'hidden_dims': '[512, 64]', 'dropout': 0.592995751706474, 'batch_norm': True, 'lr': 0.0009039276088376456, 'weight_decay': 0.0003955568201705598, 'epochs': 205, 'loss': 'mse', 'optimizer': 'adam', 'graph_mode': 'cutoff', 'cutoff': 0.4423431139302205, 'grm_norm': 'gcn', 'self_loops': True, 'use_snp_selection': False}. Best is trial 48 with value: 0.06346059432764593.
[I 2025-11-03 15:36:11,236] Trial 114 finished with value: 0.04065531386851076 and parameters: {'model_type': 'graphsage', 'hidden_dims': '[512, 128]', 'dropout': 0.5998404294356025, 'batch_norm': True, 'lr': 0.00034107552678503333, 'weight_decay': 0.000219963634629221, 'epochs': 174, 'loss': 'mse', 'optimizer': 'adam', 'graph_mode': 'cutoff', 'cutoff': 0.38443956270073265, 'grm_norm': 'gcn', 'self_loops': True, 'use_snp_selection': False}. Best is trial 48 with value: 0.06346059432764593.
[I 2025-11-03 15:36:15,129] Trial 115 finished with value: 0.030195042860098602 and parameters: {'model_type': 'graphsage', 'hidden_dims': '[512, 64]', 'dropout': 0.5839742153406267, 'batch_norm': True, 'lr': 5.587453723150804e-06, 'weight_decay': 0.00082254867421467, 'epochs': 215, 'loss': 'mse', 'optimizer': 'adam', 'graph_mode': 'cutoff', 'cutoff': 0.4663772194686484, 'grm_norm': 'gcn', 'self_loops': False, 'use_snp_selection': False}. Best is trial 48 with value: 0.06346059432764593.
[I 2025-11-03 15:36:18,867] Trial 116 finished with value: 0.03845640365521147 and parameters: {'model_type': 'graphsage', 'hidden_dims': '[512, 64]', 'dropout': 0.5423370807512634, 'batch_norm': True, 'lr': 0.0005457651428323665, 'weight_decay': 0.00011402857531314256, 'epochs': 197, 'loss': 'mse', 'optimizer': 'adam', 'graph_mode': 'cutoff', 'cutoff': 0.5994809191696194, 'grm_norm': 'cosine', 'self_loops': True, 'use_snp_selection': False}. Best is trial 48 with value: 0.06346059432764593.
[I 2025-11-03 15:36:20,623] Trial 117 finished with value: 0.02355009069004043 and parameters: {'model_type': 'graphsage', 'hidden_dims': '[128, 64]', 'dropout': 0.4835993938957341, 'batch_norm': True, 'lr': 0.0004205340545681878, 'weight_decay': 0.0001926082311622155, 'epochs': 182, 'loss': 'mse', 'optimizer': 'adam', 'graph_mode': 'cutoff', 'cutoff': 0.5244831206954869, 'grm_norm': 'none', 'self_loops': False, 'use_snp_selection': False}. Best is trial 48 with value: 0.06346059432764593.
[I 2025-11-03 15:36:24,644] Trial 118 finished with value: 0.039902497098207805 and parameters: {'model_type': 'graphsage', 'hidden_dims': '[512, 64]', 'dropout': 0.4547707740809787, 'batch_norm': True, 'lr': 0.0006226370171638604, 'weight_decay': 0.0003334452187234271, 'epochs': 223, 'loss': 'mse', 'optimizer': 'adam', 'graph_mode': 'cutoff', 'cutoff': 0.4041195215199382, 'grm_norm': 'gcn', 'self_loops': True, 'use_snp_selection': False}. Best is trial 48 with value: 0.06346059432764593.
[I 2025-11-03 15:36:28,933] Trial 119 finished with value: 0.03251748636725644 and parameters: {'model_type': 'graphsage', 'hidden_dims': '[512, 64]', 'dropout': 0.576950751622664, 'batch_norm': True, 'lr': 0.0003118383260754099, 'weight_decay': 0.00026441647763748925, 'epochs': 236, 'loss': 'mse', 'optimizer': 'adam', 'graph_mode': 'knn', 'source': 'grm', 'knn_k': 6, 'weighted_edges': False, 'symmetrize_mode': 'mutual', 'use_snp_selection': False}. Best is trial 48 with value: 0.06346059432764593.
[I 2025-11-03 15:36:32,551] Trial 120 finished with value: 0.01085362182670078 and parameters: {'model_type': 'graphsage', 'hidden_dims': '[512, 64]', 'dropout': 0.5633918715159869, 'batch_norm': False, 'lr': 0.0005064201504710834, 'weight_decay': 0.00046393735984671345, 'epochs': 187, 'loss': 'mse', 'optimizer': 'adam', 'graph_mode': 'cutoff', 'cutoff': 0.48627646162420907, 'grm_norm': 'gcn', 'self_loops': True, 'use_snp_selection': False}. Best is trial 48 with value: 0.06346059432764593.
