[I 2025-11-03 13:10:45,681] Trial 33 finished with value: 0.004326485725858133 and parameters: {'model_type': 'gcn', 'hidden_dims': '[512, 128]', 'dropout': 0.4100702675647726, 'batch_norm': False, 'lr': 0.00038511916447338116, 'weight_decay': 1.4077314756412716e-05, 'epochs': 126, 'loss': 'mae', 'optimizer': 'adam', 'graph_mode': 'off', 'use_snp_selection': False}. Best is trial 8 with value: 0.04442459143363002.
[I 2025-11-03 13:10:47,241] Trial 34 finished with value: 0.043236643623196215 and parameters: {'model_type': 'gcn', 'hidden_dims': '[512, 128]', 'dropout': 0.1362750129817241, 'batch_norm': False, 'lr': 3.8190281669228594e-06, 'weight_decay': 2.6213764752666e-05, 'epochs': 161, 'loss': 'mae', 'optimizer': 'adam', 'graph_mode': 'off', 'use_snp_selection': False}. Best is trial 8 with value: 0.04442459143363002.
[I 2025-11-03 13:10:48,348] Trial 35 finished with value: 0.04723760665017515 and parameters: {'model_type': 'gcn', 'hidden_dims': '[256, 128]', 'dropout': 0.12995841985677783, 'batch_norm': False, 'lr': 4.884446733782777e-06, 'weight_decay': 2.5444312588199597e-05, 'epochs': 156, 'loss': 'mae', 'optimizer': 'adam', 'graph_mode': 'off', 'use_snp_selection': False}. Best is trial 35 with value: 0.04723760665017515.
[I 2025-11-03 13:10:50,479] Trial 36 finished with value: 0.0193805511944737 and parameters: {'model_type': 'gcn', 'hidden_dims': '[256, 128]', 'dropout': 0.1323613255344529, 'batch_norm': True, 'lr': 3.0113736235749323e-06, 'weight_decay': 2.7877019472310856e-05, 'epochs': 190, 'loss': 'mae', 'optimizer': 'adam', 'graph_mode': 'off', 'use_snp_selection': True, 'num_snps': 58661}. Best is trial 35 with value: 0.04723760665017515.
[I 2025-11-03 13:10:51,609] Trial 37 finished with value: -0.03764274039953545 and parameters: {'model_type': 'gcn', 'hidden_dims': '[256, 128]', 'dropout': 0.23944939685409633, 'batch_norm': False, 'lr': 5.861292602707898e-06, 'weight_decay': 0.0001275248070655871, 'epochs': 162, 'loss': 'mse', 'optimizer': 'adam', 'graph_mode': 'off', 'use_snp_selection': False}. Best is trial 35 with value: 0.04723760665017515.
[I 2025-11-03 13:10:52,872] Trial 38 finished with value: -0.02343712196363661 and parameters: {'model_type': 'gcn', 'hidden_dims': '[512, 64]', 'dropout': 0.10013148574376848, 'batch_norm': True, 'lr': 2.484342920209047e-06, 'weight_decay': 2.5386350669673248e-05, 'epochs': 155, 'loss': 'mae', 'optimizer': 'adam', 'graph_mode': 'off', 'use_snp_selection': True, 'num_snps': 19911}. Best is trial 35 with value: 0.04723760665017515.
[I 2025-11-03 13:10:54,003] Trial 39 finished with value: -0.005226457642408359 and parameters: {'model_type': 'gcn', 'hidden_dims': '[256, 128]', 'dropout': 0.5964609540902079, 'batch_norm': False, 'lr': 1.0398142519901857e-06, 'weight_decay': 0.00010059642429239423, 'epochs': 126, 'loss': 'mse', 'optimizer': 'adam', 'graph_mode': 'off', 'use_snp_selection': False}. Best is trial 35 with value: 0.04723760665017515.
[I 2025-11-03 13:10:55,109] Trial 40 finished with value: -0.027644561439934698 and parameters: {'model_type': 'gcn', 'hidden_dims': '[256, 128]', 'dropout': 0.4512028437076095, 'batch_norm': True, 'lr': 6.336389683389498e-06, 'weight_decay': 3.844010479214129e-05, 'epochs': 145, 'loss': 'mae', 'optimizer': 'adam', 'graph_mode': 'off', 'use_snp_selection': False}. Best is trial 35 with value: 0.04723760665017515.
[I 2025-11-03 13:10:56,445] Trial 41 finished with value: 0.03334419946104496 and parameters: {'model_type': 'gcn', 'hidden_dims': '[256, 128, 64]', 'dropout': 0.14560263160793163, 'batch_norm': False, 'lr': 1.1596769374041707e-05, 'weight_decay': 1.2766297950250505e-05, 'epochs': 187, 'loss': 'mae', 'optimizer': 'adam', 'graph_mode': 'off', 'use_snp_selection': False}. Best is trial 35 with value: 0.04723760665017515.
[I 2025-11-03 13:10:58,344] Trial 42 finished with value: 0.03861008858671703 and parameters: {'model_type': 'gcn', 'hidden_dims': '[512, 128]', 'dropout': 0.1703721775789098, 'batch_norm': False, 'lr': 9.918816454168329e-06, 'weight_decay': 8.404514750157084e-05, 'epochs': 219, 'loss': 'mae', 'optimizer': 'adam', 'graph_mode': 'off', 'use_snp_selection': False}. Best is trial 35 with value: 0.04723760665017515.
[I 2025-11-03 13:10:59,972] Trial 43 finished with value: 0.03789980114410422 and parameters: {'model_type': 'gcn', 'hidden_dims': '[512, 64]', 'dropout': 0.19352959407094214, 'batch_norm': False, 'lr': 3.6251697191735935e-06, 'weight_decay': 5.885709014970283e-07, 'epochs': 173, 'loss': 'mae', 'optimizer': 'adam', 'graph_mode': 'off', 'use_snp_selection': False}. Best is trial 35 with value: 0.04723760665017515.
[I 2025-11-03 13:11:02,370] Trial 44 finished with value: 0.04483449220375424 and parameters: {'model_type': 'gcn', 'hidden_dims': '[512, 256]', 'dropout': 0.12566138418424397, 'batch_norm': False, 'lr': 1.8907190248641842e-06, 'weight_decay': 0.00020153984507322866, 'epochs': 330, 'loss': 'mae', 'optimizer': 'adam', 'graph_mode': 'off', 'use_snp_selection': False}. Best is trial 35 with value: 0.04723760665017515.
[I 2025-11-03 13:11:04,726] Trial 45 finished with value: -0.0004949221118347077 and parameters: {'model_type': 'gcn', 'hidden_dims': '[512, 256]', 'dropout': 0.132479903587658, 'batch_norm': False, 'lr': 1.8530206264059252e-06, 'weight_decay': 0.0003752917222306887, 'epochs': 327, 'loss': 'mae', 'optimizer': 'adam', 'graph_mode': 'off', 'use_snp_selection': False}. Best is trial 35 with value: 0.04723760665017515.
[I 2025-11-03 13:11:07,209] Trial 46 finished with value: -0.006233432352367796 and parameters: {'model_type': 'gcn', 'hidden_dims': '[512, 256]', 'dropout': 0.42083985501632126, 'batch_norm': False, 'lr': 1.6229517553954623e-06, 'weight_decay': 0.0005334294265338819, 'epochs': 350, 'loss': 'mse', 'optimizer': 'adam', 'graph_mode': 'off', 'use_snp_selection': False}. Best is trial 35 with value: 0.04723760665017515.
[I 2025-11-03 13:11:09,497] Trial 47 finished with value: -0.02154911155240279 and parameters: {'model_type': 'gcn', 'hidden_dims': '[512, 256]', 'dropout': 0.5110328457670931, 'batch_norm': False, 'lr': 2.3403602741354573e-06, 'weight_decay': 0.00018303360721511386, 'epochs': 307, 'loss': 'mae', 'optimizer': 'adam', 'graph_mode': 'off', 'use_snp_selection': False}. Best is trial 35 with value: 0.04723760665017515.
[I 2025-11-03 13:11:11,718] Trial 48 finished with value: 0.004893801425034468 and parameters: {'model_type': 'gcn', 'hidden_dims': '[512, 256]', 'dropout': 0.13026642538080258, 'batch_norm': True, 'lr': 4.585428300861862e-06, 'weight_decay': 3.800549952389685e-05, 'epochs': 290, 'loss': 'mse', 'optimizer': 'adam', 'graph_mode': 'off', 'use_snp_selection': False}. Best is trial 35 with value: 0.04723760665017515.
[I 2025-11-03 13:11:13,788] Trial 49 finished with value: 0.02412061297172079 and parameters: {'model_type': 'gcn', 'hidden_dims': '[256, 128]', 'dropout': 0.2055401151697273, 'batch_norm': False, 'lr': 7.274635422555988e-06, 'weight_decay': 1.821549379779197e-05, 'epochs': 261, 'loss': 'mae', 'optimizer': 'adam', 'graph_mode': 'off', 'use_snp_selection': True, 'num_snps': 46888}. Best is trial 35 with value: 0.04723760665017515.
[I 2025-11-03 13:11:15,465] Trial 50 finished with value: 0.009161423925588674 and parameters: {'model_type': 'gcn', 'hidden_dims': '[256, 128]', 'dropout': 0.12239163089505692, 'batch_norm': False, 'lr': 8.07337146583183e-05, 'weight_decay': 8.027050416768385e-06, 'epochs': 334, 'loss': 'mse', 'optimizer': 'adam', 'graph_mode': 'off', 'use_snp_selection': False}. Best is trial 35 with value: 0.04723760665017515.
[I 2025-11-03 13:11:16,953] Trial 51 finished with value: -0.016696175866165244 and parameters: {'model_type': 'gcn', 'hidden_dims': '[512, 128]', 'dropout': 0.15061779780814896, 'batch_norm': False, 'lr': 1.95048333411166e-05, 'weight_decay': 4.155724900597448e-05, 'epochs': 148, 'loss': 'mae', 'optimizer': 'adam', 'graph_mode': 'off', 'use_snp_selection': False}. Best is trial 35 with value: 0.04723760665017515.
[I 2025-11-03 13:11:18,657] Trial 52 finished with value: 0.02211836688287907 and parameters: {'model_type': 'gcn', 'hidden_dims': '[512, 128]', 'dropout': 0.16026165440549847, 'batch_norm': False, 'lr': 1.0921708743861942e-06, 'weight_decay': 7.516849716819107e-05, 'epochs': 200, 'loss': 'mae', 'optimizer': 'adam', 'graph_mode': 'off', 'use_snp_selection': False}. Best is trial 35 with value: 0.04723760665017515.
[I 2025-11-03 13:11:19,971] Trial 53 finished with value: -0.009424834667247691 and parameters: {'model_type': 'gcn', 'hidden_dims': '[128, 64]', 'dropout': 0.35151822179317804, 'batch_norm': False, 'lr': 4.555945659926799e-05, 'weight_decay': 0.0007871230623739149, 'epochs': 317, 'loss': 'mae', 'optimizer': 'adam', 'graph_mode': 'off', 'use_snp_selection': False}. Best is trial 35 with value: 0.04723760665017515.
[I 2025-11-03 13:11:21,222] Trial 54 finished with value: -0.019174906478564145 and parameters: {'model_type': 'gcn', 'hidden_dims': '[256, 128, 64]', 'dropout': 0.5554305273428004, 'batch_norm': False, 'lr': 4.673374462478176e-06, 'weight_decay': 0.00020006136757684827, 'epochs': 158, 'loss': 'mae', 'optimizer': 'adam', 'graph_mode': 'off', 'use_snp_selection': False}. Best is trial 35 with value: 0.04723760665017515.
[I 2025-11-03 13:11:23,418] Trial 55 finished with value: 0.018072691347309964 and parameters: {'model_type': 'gcn', 'hidden_dims': '[512, 64]', 'dropout': 0.14211060926439972, 'batch_norm': False, 'lr': 9.204497899464029e-06, 'weight_decay': 6.262582405718721e-06, 'epochs': 291, 'loss': 'mae', 'optimizer': 'adam', 'graph_mode': 'off', 'use_snp_selection': False}. Best is trial 35 with value: 0.04723760665017515.
[I 2025-11-03 13:11:24,964] Trial 56 finished with value: 0.03635131725089911 and parameters: {'model_type': 'gcn', 'hidden_dims': '[512, 128]', 'dropout': 0.18379063462133846, 'batch_norm': True, 'lr': 1.4259993294943133e-05, 'weight_decay': 1.18023432173334e-05, 'epochs': 136, 'loss': 'mae', 'optimizer': 'adam', 'graph_mode': 'off', 'use_snp_selection': False}. Best is trial 35 with value: 0.04723760665017515.
[I 2025-11-03 13:11:26,167] Trial 57 finished with value: 0.03425517619183532 and parameters: {'model_type': 'gcn', 'hidden_dims': '[512, 256]', 'dropout': 0.11444604300348966, 'batch_norm': False, 'lr': 3.062904341376607e-05, 'weight_decay': 2.332451968469514e-06, 'epochs': 96, 'loss': 'mae', 'optimizer': 'adam', 'graph_mode': 'off', 'use_snp_selection': False}. Best is trial 35 with value: 0.04723760665017515.
[I 2025-11-03 13:11:27,532] Trial 58 finished with value: 0.00648585346273176 and parameters: {'model_type': 'gcn', 'hidden_dims': '[256, 128]', 'dropout': 0.40228275019692983, 'batch_norm': False, 'lr': 2.1445727519670445e-06, 'weight_decay': 1.5744747309119066e-07, 'epochs': 234, 'loss': 'mse', 'optimizer': 'adam', 'graph_mode': 'off', 'use_snp_selection': False}. Best is trial 35 with value: 0.04723760665017515.
[I 2025-11-03 13:11:29,160] Trial 59 finished with value: 0.010594175986763647 and parameters: {'model_type': 'gcn', 'hidden_dims': '[512, 128]', 'dropout': 0.21870918239546466, 'batch_norm': True, 'lr': 3.167243414779486e-06, 'weight_decay': 4.0915694846166015e-07, 'epochs': 174, 'loss': 'mae', 'optimizer': 'adam', 'graph_mode': 'off', 'use_snp_selection': False}. Best is trial 35 with value: 0.04723760665017515.
[I 2025-11-03 13:11:30,784] Trial 60 finished with value: 0.020641991777131784 and parameters: {'model_type': 'gcn', 'hidden_dims': '[512, 128]', 'dropout': 0.10204469743863419, 'batch_norm': False, 'lr': 0.00016034282556307266, 'weight_decay': 6.158015537889844e-05, 'epochs': 252, 'loss': 'mae', 'optimizer': 'adam', 'graph_mode': 'off', 'use_snp_selection': True, 'num_snps': 24139}. Best is trial 35 with value: 0.04723760665017515.
[I 2025-11-03 13:11:31,992] Trial 61 finished with value: -0.0026277358529797467 and parameters: {'model_type': 'gcn', 'hidden_dims': '[512, 128]', 'dropout': 0.29501120047178986, 'batch_norm': False, 'lr': 0.0005266339607834309, 'weight_decay': 1.6954115942270032e-06, 'epochs': 67, 'loss': 'mae', 'optimizer': 'adam', 'graph_mode': 'off', 'use_snp_selection': False}. Best is trial 35 with value: 0.04723760665017515.
[I 2025-11-03 13:11:33,321] Trial 62 finished with value: 0.047941076769969754 and parameters: {'model_type': 'gcn', 'hidden_dims': '[512, 128]', 'dropout': 0.16834787864384157, 'batch_norm': False, 'lr': 0.0002661413420329955, 'weight_decay': 3.236805805881326e-06, 'epochs': 113, 'loss': 'mae', 'optimizer': 'adam', 'graph_mode': 'off', 'use_snp_selection': False}. Best is trial 62 with value: 0.047941076769969754.
[I 2025-11-03 13:11:34,524] Trial 63 finished with value: -0.015577675276247479 and parameters: {'model_type': 'gcn', 'hidden_dims': '[512, 128]', 'dropout': 0.16811644437217668, 'batch_norm': False, 'lr': 0.0002343766903766455, 'weight_decay': 3.544491068097959e-06, 'epochs': 97, 'loss': 'mae', 'optimizer': 'adam', 'graph_mode': 'off', 'use_snp_selection': False}. Best is trial 62 with value: 0.047941076769969754.
[I 2025-11-03 13:11:35,870] Trial 64 finished with value: 0.03536669241355036 and parameters: {'model_type': 'gcn', 'hidden_dims': '[512, 128]', 'dropout': 0.141459820159426, 'batch_norm': False, 'lr': 7.384516794630859e-05, 'weight_decay': 1.7964867734582196e-05, 'epochs': 111, 'loss': 'mae', 'optimizer': 'adam', 'graph_mode': 'off', 'use_snp_selection': False}. Best is trial 62 with value: 0.047941076769969754.
[I 2025-11-03 13:11:37,559] Trial 65 finished with value: -0.0212206866389838 and parameters: {'model_type': 'gcn', 'hidden_dims': '[256, 128]', 'dropout': 0.12021059940817944, 'batch_norm': False, 'lr': 4.859311152657627e-05, 'weight_decay': 9.310561521909568e-06, 'epochs': 338, 'loss': 'mae', 'optimizer': 'adam', 'graph_mode': 'off', 'use_snp_selection': False}. Best is trial 62 with value: 0.047941076769969754.
[I 2025-11-03 13:11:38,401] Trial 66 finished with value: 0.019400738819337026 and parameters: {'model_type': 'gcn', 'hidden_dims': '[128, 64]', 'dropout': 0.15978799580691472, 'batch_norm': False, 'lr': 0.0007107963300923623, 'weight_decay': 1.0008234985684687e-06, 'epochs': 136, 'loss': 'mse', 'optimizer': 'adam', 'graph_mode': 'off', 'use_snp_selection': False}. Best is trial 62 with value: 0.047941076769969754.
[I 2025-11-03 13:11:39,824] Trial 67 finished with value: -0.023025248584050143 and parameters: {'model_type': 'gcn', 'hidden_dims': '[512, 128]', 'dropout': 0.18388656844277562, 'batch_norm': False, 'lr': 1.3585684350838713e-06, 'weight_decay': 5.089837274897635e-07, 'epochs': 122, 'loss': 'mae', 'optimizer': 'adam', 'graph_mode': 'off', 'use_snp_selection': False}. Best is trial 62 with value: 0.047941076769969754.
[I 2025-11-03 13:11:41,421] Trial 68 finished with value: 0.05388305186522981 and parameters: {'model_type': 'gcn', 'hidden_dims': '[512, 256]', 'dropout': 0.24246688151140577, 'batch_norm': True, 'lr': 0.0003184299102233617, 'weight_decay': 2.8326516611084762e-05, 'epochs': 164, 'loss': 'mae', 'optimizer': 'adam', 'graph_mode': 'off', 'use_snp_selection': False}. Best is trial 68 with value: 0.05388305186522981.
[I 2025-11-03 13:11:43,167] Trial 69 finished with value: 0.03593035291572904 and parameters: {'model_type': 'gcn', 'hidden_dims': '[512, 256]', 'dropout': 0.2580860095425955, 'batch_norm': True, 'lr': 0.0002959910622261523, 'weight_decay': 3.311222268575992e-05, 'epochs': 197, 'loss': 'mae', 'optimizer': 'adam', 'graph_mode': 'off', 'use_snp_selection': False}. Best is trial 68 with value: 0.05388305186522981.
[I 2025-11-03 13:11:44,870] Trial 70 finished with value: 0.010534279304424925 and parameters: {'model_type': 'gcn', 'hidden_dims': '[512, 256]', 'dropout': 0.3465678519706761, 'batch_norm': True, 'lr': 0.00014467565875231667, 'weight_decay': 2.0076212437784763e-05, 'epochs': 180, 'loss': 'mse', 'optimizer': 'adam', 'graph_mode': 'off', 'use_snp_selection': False}. Best is trial 68 with value: 0.05388305186522981.
[I 2025-11-03 13:11:46,714] Trial 71 finished with value: 0.04378414909178042 and parameters: {'model_type': 'gcn', 'hidden_dims': '[512, 256]', 'dropout': 0.2374265408751493, 'batch_norm': True, 'lr': 0.000354775504821771, 'weight_decay': 4.500386213577349e-06, 'epochs': 212, 'loss': 'mae', 'optimizer': 'adam', 'graph_mode': 'off', 'use_snp_selection': False}. Best is trial 68 with value: 0.05388305186522981.
[I 2025-11-03 13:11:48,589] Trial 72 finished with value: 0.052849294258557 and parameters: {'model_type': 'gcn', 'hidden_dims': '[512, 256]', 'dropout': 0.20257576537419927, 'batch_norm': True, 'lr': 0.0003795635699491916, 'weight_decay': 4.44152743149844e-06, 'epochs': 212, 'loss': 'mae', 'optimizer': 'adam', 'graph_mode': 'off', 'use_snp_selection': False}. Best is trial 68 with value: 0.05388305186522981.
[I 2025-11-03 13:11:50,122] Trial 73 finished with value: 0.04051025409888537 and parameters: {'model_type': 'gcn', 'hidden_dims': '[512, 256]', 'dropout': 0.25350146032996956, 'batch_norm': True, 'lr': 0.00035289098282969953, 'weight_decay': 4.321408462184917e-06, 'epochs': 157, 'loss': 'mae', 'optimizer': 'adam', 'graph_mode': 'off', 'use_snp_selection': False}. Best is trial 68 with value: 0.05388305186522981.
[I 2025-11-03 13:11:52,024] Trial 74 finished with value: 0.034763708710915185 and parameters: {'model_type': 'gcn', 'hidden_dims': '[512, 256]', 'dropout': 0.2322792565261202, 'batch_norm': True, 'lr': 0.0004430053733301848, 'weight_decay': 5.897889639163566e-06, 'epochs': 222, 'loss': 'mae', 'optimizer': 'adam', 'graph_mode': 'off', 'use_snp_selection': False}. Best is trial 68 with value: 0.05388305186522981.
[I 2025-11-03 13:11:53,643] Trial 75 finished with value: 0.038740605478598 and parameters: {'model_type': 'gcn', 'hidden_dims': '[512, 256]', 'dropout': 0.2031104645486823, 'batch_norm': True, 'lr': 0.0002246236232736329, 'weight_decay': 2.234257230485398e-06, 'epochs': 166, 'loss': 'mae', 'optimizer': 'adam', 'graph_mode': 'off', 'use_snp_selection': False}. Best is trial 68 with value: 0.05388305186522981.
[I 2025-11-03 13:11:55,379] Trial 76 finished with value: 0.03203751009582997 and parameters: {'model_type': 'gcn', 'hidden_dims': '[512, 256]', 'dropout': 0.21803844358690805, 'batch_norm': True, 'lr': 0.0003083522670585408, 'weight_decay': 1.5134608100471847e-05, 'epochs': 191, 'loss': 'mae', 'optimizer': 'adam', 'graph_mode': 'off', 'use_snp_selection': False}. Best is trial 68 with value: 0.05388305186522981.
[I 2025-11-03 13:11:57,631] Trial 77 finished with value: 0.050360325169414126 and parameters: {'model_type': 'gcn', 'hidden_dims': '[512, 256]', 'dropout': 0.24550093596089997, 'batch_norm': True, 'lr': 0.00018924231434671665, 'weight_decay': 3.263977880076233e-06, 'epochs': 298, 'loss': 'mae', 'optimizer': 'adam', 'graph_mode': 'off', 'use_snp_selection': False}. Best is trial 68 with value: 0.05388305186522981.
[I 2025-11-03 13:11:58,799] Trial 78 finished with value: 0.006297324214899029 and parameters: {'model_type': 'gcn', 'hidden_dims': '[512, 256]', 'dropout': 0.24367449940482339, 'batch_norm': True, 'lr': 0.0001886417006511059, 'weight_decay': 3.0913571681015192e-06, 'epochs': 298, 'loss': 'mae', 'optimizer': 'adam', 'graph_mode': 'off', 'use_snp_selection': True, 'num_snps': 2246}. Best is trial 68 with value: 0.05388305186522981.
[I 2025-11-03 13:12:00,919] Trial 79 finished with value: 0.041180038777118726 and parameters: {'model_type': 'gcn', 'hidden_dims': '[512, 256]', 'dropout': 0.2931973710461555, 'batch_norm': True, 'lr': 0.0003811186806160097, 'weight_decay': 1.0434870849600186e-05, 'epochs': 274, 'loss': 'mae', 'optimizer': 'adam', 'graph_mode': 'off', 'use_snp_selection': False}. Best is trial 68 with value: 0.05388305186522981.
[I 2025-11-03 13:12:02,780] Trial 80 finished with value: 0.03966401368996361 and parameters: {'model_type': 'gcn', 'hidden_dims': '[512, 256]', 'dropout': 0.2599863606201008, 'batch_norm': True, 'lr': 0.0006225993207065787, 'weight_decay': 7.159341038407198e-06, 'epochs': 215, 'loss': 'mae', 'optimizer': 'adam', 'graph_mode': 'off', 'use_snp_selection': False}. Best is trial 68 with value: 0.05388305186522981.
[I 2025-11-03 13:12:05,235] Trial 81 finished with value: 0.05079253555281454 and parameters: {'model_type': 'gcn', 'hidden_dims': '[512, 256]', 'dropout': 0.2734954341961414, 'batch_norm': True, 'lr': 0.0002670307020189327, 'weight_decay': 4.609842604604605e-06, 'epochs': 331, 'loss': 'mae', 'optimizer': 'adam', 'graph_mode': 'off', 'use_snp_selection': False}. Best is trial 68 with value: 0.05388305186522981.
[I 2025-11-03 13:12:07,633] Trial 82 finished with value: 0.046388957434566225 and parameters: {'model_type': 'gcn', 'hidden_dims': '[512, 256]', 'dropout': 0.2745836781027622, 'batch_norm': True, 'lr': 0.0001893828868801819, 'weight_decay': 4.464509347018756e-06, 'epochs': 323, 'loss': 'mae', 'optimizer': 'adam', 'graph_mode': 'off', 'use_snp_selection': False}. Best is trial 68 with value: 0.05388305186522981.
[I 2025-11-03 13:12:10,109] Trial 83 finished with value: 0.03321477908202908 and parameters: {'model_type': 'gcn', 'hidden_dims': '[512, 256]', 'dropout': 0.2824316710976595, 'batch_norm': True, 'lr': 0.00019026338290852493, 'weight_decay': 2.946979939261606e-06, 'epochs': 317, 'loss': 'mae', 'optimizer': 'adam', 'graph_mode': 'off', 'use_snp_selection': False}. Best is trial 68 with value: 0.05388305186522981.
[I 2025-11-03 13:12:12,565] Trial 84 finished with value: 0.047204738898006686 and parameters: {'model_type': 'gcn', 'hidden_dims': '[512, 256]', 'dropout': 0.27302232013151173, 'batch_norm': True, 'lr': 0.00024744762253209107, 'weight_decay': 5.057745855533525e-06, 'epochs': 328, 'loss': 'mae', 'optimizer': 'adam', 'graph_mode': 'off', 'use_snp_selection': False}. Best is trial 68 with value: 0.05388305186522981.
