[I 2025-11-03 13:43:25,412] Trial 72 finished with value: -0.021237581643788323 and parameters: {'model_type': 'gcn', 'hidden_dims': '[256, 128, 64]', 'dropout': 0.3657429057052628, 'batch_norm': False, 'lr': 2.956685076937015e-06, 'weight_decay': 0.0003156144128456091, 'epochs': 102, 'loss': 'mse', 'optimizer': 'adam', 'graph_mode': 'off', 'use_snp_selection': True, 'num_snps': 12614}. Best is trial 30 with value: 0.07188646269394335.
[I 2025-11-03 13:43:26,581] Trial 73 finished with value: 0.004291550226701272 and parameters: {'model_type': 'gcn', 'hidden_dims': '[256, 128, 64]', 'dropout': 0.41310464283650417, 'batch_norm': False, 'lr': 9.531281567935025e-06, 'weight_decay': 0.00013480159667710777, 'epochs': 151, 'loss': 'mse', 'optimizer': 'adam', 'graph_mode': 'off', 'use_snp_selection': True, 'num_snps': 15609}. Best is trial 30 with value: 0.07188646269394335.
[I 2025-11-03 13:43:27,934] Trial 74 finished with value: -0.021987389613103904 and parameters: {'model_type': 'gcn', 'hidden_dims': '[256, 128, 64]', 'dropout': 0.44492326035950763, 'batch_norm': False, 'lr': 3.798014436392847e-05, 'weight_decay': 0.00020300937356732866, 'epochs': 178, 'loss': 'mse', 'optimizer': 'adam', 'graph_mode': 'off', 'use_snp_selection': True, 'num_snps': 20009}. Best is trial 30 with value: 0.07188646269394335.
[I 2025-11-03 13:43:29,043] Trial 75 finished with value: -0.001242610614945054 and parameters: {'model_type': 'gcn', 'hidden_dims': '[256, 128, 64]', 'dropout': 0.5239097585748693, 'batch_norm': False, 'lr': 2.8175451618338433e-05, 'weight_decay': 8.969937877716778e-05, 'epochs': 120, 'loss': 'mse', 'optimizer': 'adam', 'graph_mode': 'off', 'use_snp_selection': True, 'num_snps': 17453}. Best is trial 30 with value: 0.07188646269394335.
[I 2025-11-03 13:43:30,529] Trial 76 finished with value: 0.02547660399538866 and parameters: {'model_type': 'gcn', 'hidden_dims': '[512, 256]', 'dropout': 0.3349045890996415, 'batch_norm': True, 'lr': 5.223393593198314e-06, 'weight_decay': 2.8463836194166e-05, 'epochs': 334, 'loss': 'mae', 'optimizer': 'adam', 'graph_mode': 'off', 'use_snp_selection': True, 'num_snps': 12002}. Best is trial 30 with value: 0.07188646269394335.
[I 2025-11-03 13:43:31,470] Trial 77 finished with value: -0.01916639514857819 and parameters: {'model_type': 'gcn', 'hidden_dims': '[256, 128]', 'dropout': 0.5739678289659438, 'batch_norm': False, 'lr': 2.5893418349221244e-06, 'weight_decay': 0.0005185130912248243, 'epochs': 170, 'loss': 'mse', 'optimizer': 'adam', 'graph_mode': 'off', 'use_snp_selection': True, 'num_snps': 9298}. Best is trial 30 with value: 0.07188646269394335.
[I 2025-11-03 13:43:32,856] Trial 78 finished with value: -0.003992158228912925 and parameters: {'model_type': 'gcn', 'hidden_dims': '[512, 64]', 'dropout': 0.4973591437462022, 'batch_norm': True, 'lr': 3.473082756827574e-06, 'weight_decay': 0.0002553145770033164, 'epochs': 130, 'loss': 'mse', 'optimizer': 'adam', 'graph_mode': 'off', 'use_snp_selection': True, 'num_snps': 26123}. Best is trial 30 with value: 0.07188646269394335.
[I 2025-11-03 13:43:34,323] Trial 79 finished with value: 0.0043619066350234475 and parameters: {'model_type': 'gcn', 'hidden_dims': '[256, 128, 64]', 'dropout': 0.4029191681636764, 'batch_norm': False, 'lr': 1.3985908483613083e-05, 'weight_decay': 1.7889962023866145e-05, 'epochs': 204, 'loss': 'mse', 'optimizer': 'adam', 'graph_mode': 'off', 'use_snp_selection': False}. Best is trial 30 with value: 0.07188646269394335.
[I 2025-11-03 13:43:35,770] Trial 80 finished with value: -0.04659733843147112 and parameters: {'model_type': 'gcn', 'hidden_dims': '[256, 128]', 'dropout': 0.4796283924896107, 'batch_norm': True, 'lr': 1.6563745877082493e-06, 'weight_decay': 0.00038785966819032214, 'epochs': 189, 'loss': 'mae', 'optimizer': 'adam', 'graph_mode': 'off', 'use_snp_selection': True, 'num_snps': 29077}. Best is trial 30 with value: 0.07188646269394335.
[I 2025-11-03 13:43:36,968] Trial 81 finished with value: -0.018127321364619104 and parameters: {'model_type': 'gcn', 'hidden_dims': '[512, 64]', 'dropout': 0.3167716061205105, 'batch_norm': False, 'lr': 5.070287916939917e-05, 'weight_decay': 9.085248847123882e-06, 'epochs': 91, 'loss': 'mae', 'optimizer': 'adam', 'graph_mode': 'off', 'use_snp_selection': False}. Best is trial 30 with value: 0.07188646269394335.
[I 2025-11-03 13:43:38,330] Trial 82 finished with value: 0.013931737766635104 and parameters: {'model_type': 'gcn', 'hidden_dims': '[512, 64]', 'dropout': 0.2873807632143813, 'batch_norm': False, 'lr': 2.0512186540959714e-05, 'weight_decay': 3.289753045651771e-05, 'epochs': 112, 'loss': 'mae', 'optimizer': 'adam', 'graph_mode': 'off', 'use_snp_selection': False}. Best is trial 30 with value: 0.07188646269394335.
[I 2025-11-03 13:43:39,444] Trial 83 finished with value: 0.021962028945024376 and parameters: {'model_type': 'gcn', 'hidden_dims': '[512, 64]', 'dropout': 0.33358914865825273, 'batch_norm': False, 'lr': 3.6290439540593375e-05, 'weight_decay': 5.875469212088515e-05, 'epochs': 70, 'loss': 'mae', 'optimizer': 'adam', 'graph_mode': 'off', 'use_snp_selection': False}. Best is trial 30 with value: 0.07188646269394335.
[I 2025-11-03 13:43:40,956] Trial 84 finished with value: -0.01147870247605273 and parameters: {'model_type': 'gcn', 'hidden_dims': '[512, 64]', 'dropout': 0.589777685332555, 'batch_norm': False, 'lr': 9.394431182296706e-05, 'weight_decay': 4.476550968246155e-05, 'epochs': 141, 'loss': 'mae', 'optimizer': 'adam', 'graph_mode': 'off', 'use_snp_selection': False}. Best is trial 30 with value: 0.07188646269394335.
[I 2025-11-03 13:43:42,878] Trial 85 finished with value: 0.022134138411451107 and parameters: {'model_type': 'gcn', 'hidden_dims': '[512, 128]', 'dropout': 0.5367786692842712, 'batch_norm': False, 'lr': 4.413252666430829e-06, 'weight_decay': 0.00011434214171963217, 'epochs': 211, 'loss': 'mae', 'optimizer': 'adam', 'graph_mode': 'off', 'use_snp_selection': False}. Best is trial 30 with value: 0.07188646269394335.
[I 2025-11-03 13:43:44,076] Trial 86 finished with value: -0.0014274541083537805 and parameters: {'model_type': 'gcn', 'hidden_dims': '[128, 64]', 'dropout': 0.3845668432854201, 'batch_norm': True, 'lr': 4.4770193163117906e-05, 'weight_decay': 1.456773133179331e-05, 'epochs': 258, 'loss': 'mse', 'optimizer': 'adam', 'graph_mode': 'off', 'use_snp_selection': False}. Best is trial 30 with value: 0.07188646269394335.
[I 2025-11-03 13:43:45,032] Trial 87 finished with value: 0.015650830272613343 and parameters: {'model_type': 'gcn', 'hidden_dims': '[256, 128]', 'dropout': 0.2704288862379826, 'batch_norm': False, 'lr': 6.330956199678499e-06, 'weight_decay': 2.409420091379183e-05, 'epochs': 113, 'loss': 'mse', 'optimizer': 'adam', 'graph_mode': 'off', 'use_snp_selection': True, 'num_snps': 16764}. Best is trial 30 with value: 0.07188646269394335.
[I 2025-11-03 13:43:46,309] Trial 88 finished with value: -0.032089047347995656 and parameters: {'model_type': 'gcn', 'hidden_dims': '[256, 128, 64]', 'dropout': 0.43929273498450366, 'batch_norm': True, 'lr': 2.8256551879378743e-06, 'weight_decay': 7.639546232635468e-05, 'epochs': 227, 'loss': 'mse', 'optimizer': 'adam', 'graph_mode': 'off', 'use_snp_selection': True, 'num_snps': 6385}. Best is trial 30 with value: 0.07188646269394335.
[I 2025-11-03 13:43:48,260] Trial 89 finished with value: -0.003210942996945229 and parameters: {'model_type': 'gcn', 'hidden_dims': '[512, 64]', 'dropout': 0.5051587799705329, 'batch_norm': False, 'lr': 0.00011209225515695799, 'weight_decay': 0.0009357198239402813, 'epochs': 218, 'loss': 'mae', 'optimizer': 'adam', 'graph_mode': 'off', 'use_snp_selection': False}. Best is trial 30 with value: 0.07188646269394335.
[I 2025-11-03 13:43:49,256] Trial 90 finished with value: 0.021945475214422003 and parameters: {'model_type': 'gcn', 'hidden_dims': '[256, 128]', 'dropout': 0.11653064741449523, 'batch_norm': True, 'lr': 2.2623285762447983e-05, 'weight_decay': 0.0002907993515099565, 'epochs': 148, 'loss': 'mse', 'optimizer': 'adam', 'graph_mode': 'off', 'use_snp_selection': True, 'num_snps': 12308}. Best is trial 30 with value: 0.07188646269394335.
[I 2025-11-03 13:43:50,266] Trial 91 finished with value: 0.05613663463395702 and parameters: {'model_type': 'gcn', 'hidden_dims': '[256, 128]', 'dropout': 0.462517293368622, 'batch_norm': False, 'lr': 6.296293020496291e-05, 'weight_decay': 1.0354644479732775e-07, 'epochs': 126, 'loss': 'mse', 'optimizer': 'adam', 'graph_mode': 'off', 'use_snp_selection': False}. Best is trial 30 with value: 0.07188646269394335.
[I 2025-11-03 13:43:51,286] Trial 92 finished with value: 0.05627298689509159 and parameters: {'model_type': 'gcn', 'hidden_dims': '[256, 128]', 'dropout': 0.46214840651626776, 'batch_norm': False, 'lr': 7.438775055818975e-05, 'weight_decay': 9.042866432544884e-07, 'epochs': 130, 'loss': 'mse', 'optimizer': 'adam', 'graph_mode': 'off', 'use_snp_selection': False}. Best is trial 30 with value: 0.07188646269394335.
[I 2025-11-03 13:43:52,278] Trial 93 finished with value: 0.03250318721964804 and parameters: {'model_type': 'gcn', 'hidden_dims': '[256, 128]', 'dropout': 0.4668787818036925, 'batch_norm': False, 'lr': 5.9347604817390126e-05, 'weight_decay': 8.991418663810052e-07, 'epochs': 123, 'loss': 'mse', 'optimizer': 'adam', 'graph_mode': 'off', 'use_snp_selection': False}. Best is trial 30 with value: 0.07188646269394335.
[I 2025-11-03 13:43:53,254] Trial 94 finished with value: 0.025342582237367146 and parameters: {'model_type': 'gcn', 'hidden_dims': '[256, 128]', 'dropout': 0.4635245834793511, 'batch_norm': False, 'lr': 6.340745726267606e-05, 'weight_decay': 9.078679423939545e-07, 'epochs': 122, 'loss': 'mse', 'optimizer': 'adam', 'graph_mode': 'off', 'use_snp_selection': False}. Best is trial 30 with value: 0.07188646269394335.
[I 2025-11-03 13:43:54,277] Trial 95 finished with value: 0.01903950821747346 and parameters: {'model_type': 'gcn', 'hidden_dims': '[256, 128]', 'dropout': 0.47525301913317514, 'batch_norm': False, 'lr': 7.25885523101308e-05, 'weight_decay': 6.586754871490901e-07, 'epochs': 130, 'loss': 'mse', 'optimizer': 'adam', 'graph_mode': 'off', 'use_snp_selection': False}. Best is trial 30 with value: 0.07188646269394335.
[I 2025-11-03 13:43:55,461] Trial 96 finished with value: 0.004978647770172843 and parameters: {'model_type': 'gcn', 'hidden_dims': '[256, 128]', 'dropout': 0.42602329591464877, 'batch_norm': False, 'lr': 0.00016547753630218718, 'weight_decay': 1.0646423734234129e-07, 'epochs': 163, 'loss': 'mse', 'optimizer': 'adam', 'graph_mode': 'off', 'use_snp_selection': False}. Best is trial 30 with value: 0.07188646269394335.
[I 2025-11-03 13:43:56,391] Trial 97 finished with value: 0.009948957332418117 and parameters: {'model_type': 'gcn', 'hidden_dims': '[256, 128]', 'dropout': 0.48917158533776434, 'batch_norm': False, 'lr': 5.193863091254184e-05, 'weight_decay': 2.963756334631203e-07, 'epochs': 104, 'loss': 'mse', 'optimizer': 'adam', 'graph_mode': 'off', 'use_snp_selection': False}. Best is trial 30 with value: 0.07188646269394335.
[I 2025-11-03 13:43:58,076] Trial 98 finished with value: -0.005090772095159794 and parameters: {'model_type': 'gcn', 'hidden_dims': '[256, 128]', 'dropout': 0.5251669691994859, 'batch_norm': False, 'lr': 0.00011011705259957634, 'weight_decay': 9.814234705783785e-07, 'epochs': 321, 'loss': 'mse', 'optimizer': 'adam', 'graph_mode': 'off', 'use_snp_selection': False}. Best is trial 30 with value: 0.07188646269394335.
[I 2025-11-03 13:43:59,182] Trial 99 finished with value: 0.012000313281252652 and parameters: {'model_type': 'gcn', 'hidden_dims': '[256, 128]', 'dropout': 0.4549132361496583, 'batch_norm': False, 'lr': 8.292785870317482e-05, 'weight_decay': 2.1414842797143346e-06, 'epochs': 157, 'loss': 'mse', 'optimizer': 'adam', 'graph_mode': 'off', 'use_snp_selection': False}. Best is trial 30 with value: 0.07188646269394335.
[I 2025-11-03 13:44:00,205] Trial 100 finished with value: 0.03270913266320406 and parameters: {'model_type': 'gcn', 'hidden_dims': '[256, 128]', 'dropout': 0.5520949253310552, 'batch_norm': True, 'lr': 2.916673342120112e-05, 'weight_decay': 5.246566606824559e-06, 'epochs': 126, 'loss': 'mse', 'optimizer': 'adam', 'graph_mode': 'off', 'use_snp_selection': False}. Best is trial 30 with value: 0.07188646269394335.
[I 2025-11-03 13:44:01,226] Trial 101 finished with value: 0.019566086275402392 and parameters: {'model_type': 'gcn', 'hidden_dims': '[256, 128]', 'dropout': 0.5534294474165614, 'batch_norm': True, 'lr': 3.425857626243262e-05, 'weight_decay': 4.95954017137731e-06, 'epochs': 125, 'loss': 'mse', 'optimizer': 'adam', 'graph_mode': 'off', 'use_snp_selection': False}. Best is trial 30 with value: 0.07188646269394335.
[I 2025-11-03 13:44:02,313] Trial 102 finished with value: -0.023374073274610278 and parameters: {'model_type': 'gcn', 'hidden_dims': '[256, 128]', 'dropout': 0.5644963466714508, 'batch_norm': True, 'lr': 4.066673314820845e-05, 'weight_decay': 2.525588203286394e-07, 'epochs': 141, 'loss': 'mse', 'optimizer': 'adam', 'graph_mode': 'off', 'use_snp_selection': False}. Best is trial 30 with value: 0.07188646269394335.
[I 2025-11-03 13:44:03,779] Trial 103 finished with value: 0.01855728441346473 and parameters: {'model_type': 'gcn', 'hidden_dims': '[256, 128]', 'dropout': 0.5187832394761689, 'batch_norm': True, 'lr': 5.954410027552051e-05, 'weight_decay': 1.2961399536109587e-06, 'epochs': 239, 'loss': 'mse', 'optimizer': 'adam', 'graph_mode': 'off', 'use_snp_selection': False}. Best is trial 30 with value: 0.07188646269394335.
[I 2025-11-03 13:44:04,787] Trial 104 finished with value: 0.01238784030480703 and parameters: {'model_type': 'gcn', 'hidden_dims': '[256, 128]', 'dropout': 0.5051649718979005, 'batch_norm': True, 'lr': 2.9673198602372573e-05, 'weight_decay': 5.58848012844108e-06, 'epochs': 117, 'loss': 'mse', 'optimizer': 'adam', 'graph_mode': 'off', 'use_snp_selection': False}. Best is trial 30 with value: 0.07188646269394335.
[I 2025-11-03 13:44:05,845] Trial 105 finished with value: 0.00954348317063738 and parameters: {'model_type': 'gcn', 'hidden_dims': '[256, 128]', 'dropout': 0.586849964975944, 'batch_norm': True, 'lr': 6.583987568169545e-05, 'weight_decay': 2.6067506386415614e-06, 'epochs': 132, 'loss': 'mse', 'optimizer': 'adam', 'graph_mode': 'off', 'use_snp_selection': False}. Best is trial 30 with value: 0.07188646269394335.
[I 2025-11-03 13:44:06,806] Trial 106 finished with value: -0.01785876118820308 and parameters: {'model_type': 'gcn', 'hidden_dims': '[256, 128]', 'dropout': 0.5321756224425012, 'batch_norm': True, 'lr': 4.7021349619309126e-05, 'weight_decay': 4.119237573778337e-06, 'epochs': 107, 'loss': 'mse', 'optimizer': 'adam', 'graph_mode': 'off', 'use_snp_selection': False}. Best is trial 30 with value: 0.07188646269394335.
[I 2025-11-03 13:44:07,705] Trial 107 finished with value: 0.013396542998379607 and parameters: {'model_type': 'gcn', 'hidden_dims': '[256, 128]', 'dropout': 0.43659171136030633, 'batch_norm': False, 'lr': 1.7059243222976797e-05, 'weight_decay': 4.550479683687586e-07, 'epochs': 97, 'loss': 'mse', 'optimizer': 'adam', 'graph_mode': 'off', 'use_snp_selection': False}. Best is trial 30 with value: 0.07188646269394335.
[I 2025-11-03 13:44:09,239] Trial 108 finished with value: 0.028303787943571246 and parameters: {'model_type': 'gcn', 'hidden_dims': '[512, 256]', 'dropout': 0.4801155153760615, 'batch_norm': False, 'lr': 5.278679167830245e-05, 'weight_decay': 8.114721284573771e-06, 'epochs': 147, 'loss': 'mse', 'optimizer': 'adam', 'graph_mode': 'off', 'use_snp_selection': False}. Best is trial 30 with value: 0.07188646269394335.
[I 2025-11-03 13:44:10,310] Trial 109 finished with value: 0.011521381289332321 and parameters: {'model_type': 'gcn', 'hidden_dims': '[256, 128]', 'dropout': 0.5449483101407845, 'batch_norm': True, 'lr': 0.000436042642503192, 'weight_decay': 1.1694397104490751e-05, 'epochs': 137, 'loss': 'mse', 'optimizer': 'adam', 'graph_mode': 'off', 'use_snp_selection': False}. Best is trial 30 with value: 0.07188646269394335.
[I 2025-11-03 13:44:11,447] Trial 110 finished with value: -0.0014118367574276942 and parameters: {'model_type': 'gcn', 'hidden_dims': '[256, 128]', 'dropout': 0.46675163295376554, 'batch_norm': False, 'lr': 8.450102093006204e-05, 'weight_decay': 0.00020445332220669384, 'epochs': 166, 'loss': 'mse', 'optimizer': 'adam', 'graph_mode': 'off', 'use_snp_selection': False}. Best is trial 30 with value: 0.07188646269394335.
[I 2025-11-03 13:44:12,968] Trial 111 finished with value: -0.01670702429845981 and parameters: {'model_type': 'gcn', 'hidden_dims': '[512, 256]', 'dropout': 0.49283395862200535, 'batch_norm': False, 'lr': 5.269957501491176e-05, 'weight_decay': 8.117757182139666e-06, 'epochs': 144, 'loss': 'mse', 'optimizer': 'adam', 'graph_mode': 'off', 'use_snp_selection': False}. Best is trial 30 with value: 0.07188646269394335.
[I 2025-11-03 13:44:14,410] Trial 112 finished with value: 0.018661659417555727 and parameters: {'model_type': 'gcn', 'hidden_dims': '[512, 256]', 'dropout': 0.477262908366338, 'batch_norm': False, 'lr': 4.2434435088345744e-05, 'weight_decay': 3.5229139669323315e-06, 'epochs': 124, 'loss': 'mse', 'optimizer': 'adam', 'graph_mode': 'off', 'use_snp_selection': False}. Best is trial 30 with value: 0.07188646269394335.
[I 2025-11-03 13:44:15,984] Trial 113 finished with value: -0.000724551103014768 and parameters: {'model_type': 'gcn', 'hidden_dims': '[512, 256]', 'dropout': 0.48643474603721193, 'batch_norm': False, 'lr': 2.7336290175959925e-05, 'weight_decay': 6.083536810056471e-06, 'epochs': 149, 'loss': 'mse', 'optimizer': 'adam', 'graph_mode': 'off', 'use_snp_selection': False}. Best is trial 30 with value: 0.07188646269394335.
[I 2025-11-03 13:44:18,417] Trial 114 finished with value: -0.02335588296597787 and parameters: {'model_type': 'gcn', 'hidden_dims': '[512, 256]', 'dropout': 0.5087773455068657, 'batch_norm': False, 'lr': 0.0001352663443024185, 'weight_decay': 3.4231616615391486e-07, 'epochs': 299, 'loss': 'mse', 'optimizer': 'adam', 'graph_mode': 'off', 'use_snp_selection': False}. Best is trial 30 with value: 0.07188646269394335.
[I 2025-11-03 13:44:20,042] Trial 115 finished with value: 0.007759963601900279 and parameters: {'model_type': 'gcn', 'hidden_dims': '[512, 128]', 'dropout': 0.45728981257947293, 'batch_norm': False, 'lr': 3.342569315202559e-05, 'weight_decay': 1.8596370706166647e-05, 'epochs': 158, 'loss': 'mse', 'optimizer': 'adam', 'graph_mode': 'off', 'use_snp_selection': False}. Best is trial 30 with value: 0.07188646269394335.
[I 2025-11-03 13:44:20,774] Trial 116 finished with value: 0.01260287163886861 and parameters: {'model_type': 'gcn', 'hidden_dims': '[256, 128]', 'dropout': 0.41917396513389826, 'batch_norm': False, 'lr': 6.883581686933384e-05, 'weight_decay': 1.5935588659466978e-07, 'epochs': 128, 'loss': 'mse', 'optimizer': 'adam', 'graph_mode': 'off', 'use_snp_selection': True, 'num_snps': 2946}. Best is trial 30 with value: 0.07188646269394335.
[I 2025-11-03 13:44:22,864] Trial 117 finished with value: 0.038209492353719884 and parameters: {'model_type': 'gcn', 'hidden_dims': '[512, 256]', 'dropout': 0.5680031741412995, 'batch_norm': True, 'lr': 5.615473859397418e-05, 'weight_decay': 1.0655389464993093e-05, 'epochs': 232, 'loss': 'mse', 'optimizer': 'adam', 'graph_mode': 'off', 'use_snp_selection': False}. Best is trial 30 with value: 0.07188646269394335.
[I 2025-11-03 13:44:23,875] Trial 118 finished with value: 0.014145164628534086 and parameters: {'model_type': 'gcn', 'hidden_dims': '[256, 128]', 'dropout': 0.5728178164842748, 'batch_norm': True, 'lr': 0.00010121463716511808, 'weight_decay': 1.4431124536540437e-05, 'epochs': 233, 'loss': 'mse', 'optimizer': 'adam', 'graph_mode': 'off', 'use_snp_selection': True, 'num_snps': 2997}. Best is trial 30 with value: 0.07188646269394335.
[I 2025-11-03 13:44:25,030] Trial 119 finished with value: 0.0005382366766504542 and parameters: {'model_type': 'gcn', 'hidden_dims': '[128, 64]', 'dropout': 0.5932006421967287, 'batch_norm': True, 'lr': 1.2877070812874454e-06, 'weight_decay': 1.051169779206721e-05, 'epochs': 246, 'loss': 'mse', 'optimizer': 'adam', 'graph_mode': 'off', 'use_snp_selection': False}. Best is trial 30 with value: 0.07188646269394335.
[I 2025-11-03 13:44:26,918] Trial 120 finished with value: -0.011990558565966977 and parameters: {'model_type': 'gcn', 'hidden_dims': '[256, 128, 64]', 'dropout': 0.5809204642064396, 'batch_norm': True, 'lr': 3.909106717528076e-05, 'weight_decay': 1.5364484646423824e-06, 'epochs': 218, 'loss': 'mse', 'optimizer': 'adam', 'graph_mode': 'off', 'use_snp_selection': True, 'num_snps': 35925}. Best is trial 30 with value: 0.07188646269394335.
[I 2025-11-03 13:44:28,894] Trial 121 finished with value: -0.013778613476483029 and parameters: {'model_type': 'gcn', 'hidden_dims': '[512, 256]', 'dropout': 0.5645275088660213, 'batch_norm': True, 'lr': 5.0435038322893674e-05, 'weight_decay': 7.333024919404334e-06, 'epochs': 208, 'loss': 'mse', 'optimizer': 'adam', 'graph_mode': 'off', 'use_snp_selection': False}. Best is trial 30 with value: 0.07188646269394335.
[I 2025-11-03 13:44:30,418] Trial 122 finished with value: 0.011324165222742452 and parameters: {'model_type': 'gcn', 'hidden_dims': '[512, 256]', 'dropout': 0.5505203373399202, 'batch_norm': True, 'lr': 8.332211031702595e-05, 'weight_decay': 8.789275725189296e-06, 'epochs': 137, 'loss': 'mse', 'optimizer': 'adam', 'graph_mode': 'off', 'use_snp_selection': False}. Best is trial 30 with value: 0.07188646269394335.
