[I 2025-10-21 08:41:01,423] Trial 89 finished with value: 0.0734875101720562 and parameters: {'model_type': 'gat', 'hidden_dims': '[512, 64]', 'dropout': 0.4647789128129251, 'batch_norm': True, 'gat_heads': 5, 'gat_attn_dropout': 0.23187570094320317, 'gat_concat_hidden': False, 'lr': 4.8286192822301364e-05, 'weight_decay': 7.755645862685043e-05, 'epochs': 45, 'loss': 'mae', 'optimizer': 'adam', 'graph_mode': 'knn', 'source': 'grm', 'knn_k': 7, 'weighted_edges': False, 'symmetrize_mode': 'union'}. Best is trial 52 with value: 0.2589532475445489.
[I 2025-10-21 08:41:47,128] Trial 90 finished with value: 0.22354125292520216 and parameters: {'model_type': 'gat', 'hidden_dims': '[128, 64]', 'dropout': 0.5478056806698021, 'batch_norm': False, 'gat_heads': 3, 'gat_attn_dropout': 0.3403337372607096, 'gat_concat_hidden': False, 'lr': 3.3862463623444325e-05, 'weight_decay': 0.0003205634266050708, 'epochs': 159, 'loss': 'mae', 'optimizer': 'adam', 'graph_mode': 'cutoff', 'cutoff': 0.6016009354248518, 'grm_norm': 'cosine', 'self_loops': False}. Best is trial 52 with value: 0.2589532475445489.
[I 2025-10-21 08:44:19,425] Trial 91 finished with value: 0.24819866222083067 and parameters: {'model_type': 'gat', 'hidden_dims': '[128, 64]', 'dropout': 0.4377344136796065, 'batch_norm': False, 'gat_heads': 5, 'gat_attn_dropout': 0.18537926430882096, 'gat_concat_hidden': False, 'lr': 1.6383082190307232e-05, 'weight_decay': 0.00015856035741241534, 'epochs': 348, 'loss': 'mae', 'optimizer': 'adam', 'graph_mode': 'cutoff', 'cutoff': 0.5233009849032155, 'grm_norm': 'gcn', 'self_loops': True}. Best is trial 52 with value: 0.2589532475445489.
[I 2025-10-21 08:45:30,602] Trial 92 finished with value: 0.25069111309784164 and parameters: {'model_type': 'gat', 'hidden_dims': '[128, 64]', 'dropout': 0.4811710346832209, 'batch_norm': False, 'gat_heads': 5, 'gat_attn_dropout': 0.17118890438690507, 'gat_concat_hidden': False, 'lr': 1.8855855838340648e-05, 'weight_decay': 0.00010426497469692214, 'epochs': 155, 'loss': 'mae', 'optimizer': 'adam', 'graph_mode': 'cutoff', 'cutoff': 0.567653507946034, 'grm_norm': 'gcn', 'self_loops': True}. Best is trial 52 with value: 0.2589532475445489.
[I 2025-10-21 08:46:37,141] Trial 93 finished with value: 0.24151089487379424 and parameters: {'model_type': 'gat', 'hidden_dims': '[128, 64]', 'dropout': 0.48151411404638694, 'batch_norm': False, 'gat_heads': 5, 'gat_attn_dropout': 0.13720193133642355, 'gat_concat_hidden': False, 'lr': 2.2967971123870988e-05, 'weight_decay': 5.6337483878290666e-05, 'epochs': 144, 'loss': 'mae', 'optimizer': 'adam', 'graph_mode': 'cutoff', 'cutoff': 0.5699347569362496, 'grm_norm': 'gcn', 'self_loops': True}. Best is trial 52 with value: 0.2589532475445489.
[I 2025-10-21 08:47:56,069] Trial 94 finished with value: 0.23931508433601753 and parameters: {'model_type': 'gat', 'hidden_dims': '[128, 64]', 'dropout': 0.42166204111980854, 'batch_norm': False, 'gat_heads': 5, 'gat_attn_dropout': 0.16768028413425193, 'gat_concat_hidden': False, 'lr': 1.2639774875958544e-05, 'weight_decay': 0.00010200814664922681, 'epochs': 174, 'loss': 'mae', 'optimizer': 'adam', 'graph_mode': 'cutoff', 'cutoff': 0.8958430820886536, 'grm_norm': 'gcn', 'self_loops': True}. Best is trial 52 with value: 0.2589532475445489.
[I 2025-10-21 08:52:40,046] Trial 95 finished with value: 0.2317732449594306 and parameters: {'model_type': 'gat', 'hidden_dims': '[512, 128]', 'dropout': 0.47209693186666746, 'batch_norm': False, 'gat_heads': 6, 'gat_attn_dropout': 0.25779629843040547, 'gat_concat_hidden': False, 'lr': 1.984985826880658e-05, 'weight_decay': 0.00043392382081297137, 'epochs': 153, 'loss': 'mae', 'optimizer': 'adam', 'graph_mode': 'cutoff', 'cutoff': 0.6293340133224639, 'grm_norm': 'none', 'self_loops': True}. Best is trial 52 with value: 0.2589532475445489.
[I 2025-10-21 08:54:49,829] Trial 96 finished with value: 0.2054696348735061 and parameters: {'model_type': 'gat', 'hidden_dims': '[128, 64]', 'dropout': 0.496728937476263, 'batch_norm': False, 'gat_heads': 5, 'gat_attn_dropout': 0.11191226635712173, 'gat_concat_hidden': False, 'lr': 0.00014081044238454623, 'weight_decay': 0.00013550761797271154, 'epochs': 296, 'loss': 'mae', 'optimizer': 'adam', 'graph_mode': 'cutoff', 'cutoff': 0.5879382115675487, 'grm_norm': 'gcn', 'self_loops': True}. Best is trial 52 with value: 0.2589532475445489.
[I 2025-10-21 08:56:30,472] Trial 97 finished with value: 0.24810036230415528 and parameters: {'model_type': 'gat', 'hidden_dims': '[128, 64]', 'dropout': 0.5610885853967065, 'batch_norm': False, 'gat_heads': 6, 'gat_attn_dropout': 0.05426140583224737, 'gat_concat_hidden': False, 'lr': 0.00010104089681256754, 'weight_decay': 0.0002225499636205065, 'epochs': 188, 'loss': 'mae', 'optimizer': 'adam', 'graph_mode': 'cutoff', 'cutoff': 0.5529842007732707, 'grm_norm': 'none', 'self_loops': True}. Best is trial 52 with value: 0.2589532475445489.
[I 2025-10-21 08:58:15,698] Trial 98 finished with value: 0.21864816258856234 and parameters: {'model_type': 'gat', 'hidden_dims': '[256, 128]', 'dropout': 0.5094335780206574, 'batch_norm': False, 'gat_heads': 4, 'gat_attn_dropout': 0.20780494914420103, 'gat_concat_hidden': False, 'lr': 0.000188839539005018, 'weight_decay': 0.0003897032031721224, 'epochs': 165, 'loss': 'mae', 'optimizer': 'adam', 'graph_mode': 'cutoff', 'cutoff': 0.49043132658469346, 'grm_norm': 'cosine_then_gcn', 'self_loops': False}. Best is trial 52 with value: 0.2589532475445489.
[I 2025-10-21 08:59:48,745] Trial 99 finished with value: 0.2086235022325869 and parameters: {'model_type': 'gat', 'hidden_dims': '[128, 64]', 'dropout': 0.30945286631444413, 'batch_norm': False, 'gat_heads': 5, 'gat_attn_dropout': 0.09310692136766152, 'gat_concat_hidden': False, 'lr': 1.0751967369221793e-05, 'weight_decay': 8.083034697100241e-05, 'epochs': 205, 'loss': 'mse', 'optimizer': 'adam', 'graph_mode': 'cutoff', 'cutoff': 0.46367414142550606, 'grm_norm': 'none', 'self_loops': True}. Best is trial 52 with value: 0.2589532475445489.
[I 2025-10-21 09:05:33,324] Trial 100 finished with value: 0.21485444856895897 and parameters: {'model_type': 'gat', 'hidden_dims': '[512, 256]', 'dropout': 0.5249990239363913, 'batch_norm': False, 'gat_heads': 6, 'gat_attn_dropout': 0.07669789895583692, 'gat_concat_hidden': True, 'lr': 2.9846579024864858e-05, 'weight_decay': 0.0005420596637375796, 'epochs': 181, 'loss': 'mae', 'optimizer': 'adam', 'graph_mode': 'cutoff', 'cutoff': 0.5377977663963112, 'grm_norm': 'gcn', 'self_loops': True}. Best is trial 52 with value: 0.2589532475445489.
[I 2025-10-21 09:06:44,663] Trial 101 finished with value: 0.24658221207000824 and parameters: {'model_type': 'gat', 'hidden_dims': '[128, 64]', 'dropout': 0.44644013356107104, 'batch_norm': False, 'gat_heads': 5, 'gat_attn_dropout': 0.23841141799797452, 'gat_concat_hidden': False, 'lr': 1.870176954318656e-05, 'weight_decay': 0.00018004342087956274, 'epochs': 155, 'loss': 'mae', 'optimizer': 'adam', 'graph_mode': 'cutoff', 'cutoff': 0.5199525247370339, 'grm_norm': 'gcn', 'self_loops': True}. Best is trial 52 with value: 0.2589532475445489.
[I 2025-10-21 09:07:47,808] Trial 102 finished with value: 0.25827133852013007 and parameters: {'model_type': 'gat', 'hidden_dims': '[128, 64]', 'dropout': 0.4365512245016535, 'batch_norm': False, 'gat_heads': 5, 'gat_attn_dropout': 0.18137425979995836, 'gat_concat_hidden': False, 'lr': 1.6076974893678358e-05, 'weight_decay': 0.00015830804825814123, 'epochs': 136, 'loss': 'mae', 'optimizer': 'adam', 'graph_mode': 'cutoff', 'cutoff': 0.5768075432620825, 'grm_norm': 'gcn', 'self_loops': True}. Best is trial 52 with value: 0.2589532475445489.
[I 2025-10-21 09:08:49,616] Trial 103 finished with value: 0.23679573021796307 and parameters: {'model_type': 'gat', 'hidden_dims': '[128, 64]', 'dropout': 0.4622838412483187, 'batch_norm': False, 'gat_heads': 5, 'gat_attn_dropout': 0.1964745065292603, 'gat_concat_hidden': False, 'lr': 1.4335126640424126e-05, 'weight_decay': 0.0002480360519689076, 'epochs': 133, 'loss': 'mae', 'optimizer': 'adam', 'graph_mode': 'cutoff', 'cutoff': 0.6137176439074505, 'grm_norm': 'gcn', 'self_loops': True}. Best is trial 52 with value: 0.2589532475445489.
[I 2025-10-21 09:10:07,947] Trial 104 finished with value: 0.2557028269428828 and parameters: {'model_type': 'gat', 'hidden_dims': '[128, 64]', 'dropout': 0.4246134978690556, 'batch_norm': False, 'gat_heads': 5, 'gat_attn_dropout': 0.1468213676789935, 'gat_concat_hidden': False, 'lr': 6.209914855278558e-06, 'weight_decay': 0.0003357725378848044, 'epochs': 172, 'loss': 'mae', 'optimizer': 'adam', 'graph_mode': 'cutoff', 'cutoff': 0.5696080390231801, 'grm_norm': 'gcn', 'self_loops': True}. Best is trial 52 with value: 0.2589532475445489.
[I 2025-10-21 09:11:12,707] Trial 105 finished with value: 0.24947096041730052 and parameters: {'model_type': 'gat', 'hidden_dims': '[128, 64]', 'dropout': 0.38237988126851796, 'batch_norm': False, 'gat_heads': 5, 'gat_attn_dropout': 0.4283640734106689, 'gat_concat_hidden': False, 'lr': 6.21094538181378e-06, 'weight_decay': 0.00010718855580186512, 'epochs': 140, 'loss': 'mae', 'optimizer': 'adam', 'graph_mode': 'cutoff', 'cutoff': 0.5723435793361649, 'grm_norm': 'gcn', 'self_loops': True}. Best is trial 52 with value: 0.2589532475445489.
[I 2025-10-21 09:12:31,397] Trial 106 finished with value: 0.2576186982995274 and parameters: {'model_type': 'gat', 'hidden_dims': '[128, 64]', 'dropout': 0.42821901213487035, 'batch_norm': False, 'gat_heads': 5, 'gat_attn_dropout': 0.15136309122272448, 'gat_concat_hidden': False, 'lr': 7.920794979975308e-06, 'weight_decay': 0.0001379153734287389, 'epochs': 172, 'loss': 'mae', 'optimizer': 'adam', 'graph_mode': 'cutoff', 'cutoff': 0.5558090103629835, 'grm_norm': 'gcn', 'self_loops': True}. Best is trial 52 with value: 0.2589532475445489.
[I 2025-10-21 09:13:59,446] Trial 107 finished with value: 0.24328344141462616 and parameters: {'model_type': 'gat', 'hidden_dims': '[128, 64]', 'dropout': 0.4036771246347526, 'batch_norm': False, 'gat_heads': 5, 'gat_attn_dropout': 0.14873523746060086, 'gat_concat_hidden': False, 'lr': 7.790304033982589e-06, 'weight_decay': 5.481890032320793e-05, 'epochs': 195, 'loss': 'mae', 'optimizer': 'adam', 'graph_mode': 'cutoff', 'cutoff': 0.5522888488354732, 'grm_norm': 'gcn', 'self_loops': True}. Best is trial 52 with value: 0.2589532475445489.
[I 2025-10-21 09:15:14,497] Trial 108 finished with value: 0.22049304360976607 and parameters: {'model_type': 'gat', 'hidden_dims': '[128, 64]', 'dropout': 0.4162439306068609, 'batch_norm': False, 'gat_heads': 5, 'gat_attn_dropout': 0.12645725654332257, 'gat_concat_hidden': False, 'lr': 4.020044562641124e-06, 'weight_decay': 0.00013378110254726237, 'epochs': 163, 'loss': 'mae', 'optimizer': 'adam', 'graph_mode': 'knn', 'source': 'grm', 'knn_k': 2, 'weighted_edges': True, 'symmetrize_mode': 'mutual'}. Best is trial 52 with value: 0.2589532475445489.
[I 2025-10-21 09:16:48,399] Trial 109 finished with value: 0.16068986747187688 and parameters: {'model_type': 'gat', 'hidden_dims': '[128, 64]', 'dropout': 0.4289586617559218, 'batch_norm': True, 'gat_heads': 6, 'gat_attn_dropout': 0.16215661559031552, 'gat_concat_hidden': False, 'lr': 1.017623098231056e-05, 'weight_decay': 0.0007696268207660887, 'epochs': 172, 'loss': 'mae', 'optimizer': 'adam', 'graph_mode': 'cutoff', 'cutoff': 0.5338702870011541, 'grm_norm': 'gcn', 'self_loops': True}. Best is trial 52 with value: 0.2589532475445489.
[I 2025-10-21 09:18:07,461] Trial 110 finished with value: 0.219597588023437 and parameters: {'model_type': 'gat', 'hidden_dims': '[128, 64]', 'dropout': 0.3570065433311936, 'batch_norm': False, 'gat_heads': 7, 'gat_attn_dropout': 0.033809116415563445, 'gat_concat_hidden': False, 'lr': 2.411488203339566e-06, 'weight_decay': 4.531489312360594e-05, 'epochs': 120, 'loss': 'mae', 'optimizer': 'adam', 'graph_mode': 'cutoff', 'cutoff': 0.5854599300384218, 'grm_norm': 'gcn', 'self_loops': False}. Best is trial 52 with value: 0.2589532475445489.
[I 2025-10-21 09:19:29,868] Trial 111 finished with value: 0.2683083377048384 and parameters: {'model_type': 'gat', 'hidden_dims': '[128, 64]', 'dropout': 0.45152760990035806, 'batch_norm': False, 'gat_heads': 5, 'gat_attn_dropout': 0.13945561225613945, 'gat_concat_hidden': False, 'lr': 1.6297077376547545e-05, 'weight_decay': 0.00021395605063731567, 'epochs': 182, 'loss': 'mae', 'optimizer': 'adam', 'graph_mode': 'cutoff', 'cutoff': 0.5626416233694842, 'grm_norm': 'gcn', 'self_loops': True}. Best is trial 111 with value: 0.2683083377048384.
[I 2025-10-21 09:20:53,191] Trial 112 finished with value: 0.2537847731447364 and parameters: {'model_type': 'gat', 'hidden_dims': '[128, 64]', 'dropout': 0.45551218912125185, 'batch_norm': False, 'gat_heads': 5, 'gat_attn_dropout': 0.14048447543008757, 'gat_concat_hidden': False, 'lr': 1.5200667680174382e-05, 'weight_decay': 8.823307035934265e-05, 'epochs': 184, 'loss': 'mae', 'optimizer': 'adam', 'graph_mode': 'cutoff', 'cutoff': 0.5629903527313798, 'grm_norm': 'gcn', 'self_loops': True}. Best is trial 111 with value: 0.2683083377048384.
[I 2025-10-21 09:22:15,375] Trial 113 finished with value: 0.23381791280654926 and parameters: {'model_type': 'gat', 'hidden_dims': '[128, 64]', 'dropout': 0.3354897094716531, 'batch_norm': False, 'gat_heads': 5, 'gat_attn_dropout': 0.11426341560357817, 'gat_concat_hidden': False, 'lr': 1.5859626222943792e-05, 'weight_decay': 0.00020157877080296803, 'epochs': 181, 'loss': 'mae', 'optimizer': 'adam', 'graph_mode': 'cutoff', 'cutoff': 0.5488834235612825, 'grm_norm': 'gcn', 'self_loops': True}. Best is trial 111 with value: 0.2683083377048384.
[I 2025-10-21 09:23:43,133] Trial 114 finished with value: 0.2598600949787905 and parameters: {'model_type': 'gat', 'hidden_dims': '[128, 64]', 'dropout': 0.4541823688492058, 'batch_norm': False, 'gat_heads': 5, 'gat_attn_dropout': 0.13993874909924042, 'gat_concat_hidden': False, 'lr': 1.3555570720694187e-05, 'weight_decay': 0.00014841150014019967, 'epochs': 194, 'loss': 'mae', 'optimizer': 'adam', 'graph_mode': 'cutoff', 'cutoff': 0.5147220477841535, 'grm_norm': 'gcn', 'self_loops': True}. Best is trial 111 with value: 0.2683083377048384.
[I 2025-10-21 09:25:12,017] Trial 115 finished with value: 0.2448704185105842 and parameters: {'model_type': 'gat', 'hidden_dims': '[128, 64]', 'dropout': 0.44154397837232245, 'batch_norm': False, 'gat_heads': 5, 'gat_attn_dropout': 0.13329007406679727, 'gat_concat_hidden': False, 'lr': 1.3146405790544088e-05, 'weight_decay': 8.595984368288081e-05, 'epochs': 196, 'loss': 'mae', 'optimizer': 'adam', 'graph_mode': 'cutoff', 'cutoff': 0.5005958026077784, 'grm_norm': 'gcn', 'self_loops': True}. Best is trial 111 with value: 0.2683083377048384.
[I 2025-10-21 09:26:50,353] Trial 116 finished with value: 0.2470965309014102 and parameters: {'model_type': 'gat', 'hidden_dims': '[128, 64]', 'dropout': 0.4564018933552983, 'batch_norm': False, 'gat_heads': 5, 'gat_attn_dropout': 0.05824751903279106, 'gat_concat_hidden': False, 'lr': 1.0743764384204936e-05, 'weight_decay': 0.00015878702323678508, 'epochs': 219, 'loss': 'mae', 'optimizer': 'adam', 'graph_mode': 'cutoff', 'cutoff': 0.5114925238571733, 'grm_norm': 'gcn', 'self_loops': True}. Best is trial 111 with value: 0.2683083377048384.
[I 2025-10-21 09:28:16,086] Trial 117 finished with value: 0.22339121513050517 and parameters: {'model_type': 'gat', 'hidden_dims': '[128, 64]', 'dropout': 0.4319307029332732, 'batch_norm': False, 'gat_heads': 5, 'gat_attn_dropout': 0.14160052558393038, 'gat_concat_hidden': False, 'lr': 7.586610271462889e-06, 'weight_decay': 0.00027059349099879253, 'epochs': 188, 'loss': 'mae', 'optimizer': 'adam', 'graph_mode': 'cutoff', 'cutoff': 0.4813565024041042, 'grm_norm': 'gcn', 'self_loops': True}. Best is trial 111 with value: 0.2683083377048384.
[I 2025-10-21 09:29:48,155] Trial 118 finished with value: 0.2439641301183107 and parameters: {'model_type': 'gat', 'hidden_dims': '[128, 64]', 'dropout': 0.453455689015629, 'batch_norm': False, 'gat_heads': 5, 'gat_attn_dropout': 0.09446400149957641, 'gat_concat_hidden': False, 'lr': 8.636693072161628e-06, 'weight_decay': 3.5029602410771133e-06, 'epochs': 205, 'loss': 'mae', 'optimizer': 'adam', 'graph_mode': 'cutoff', 'cutoff': 0.59323666135324, 'grm_norm': 'gcn', 'self_loops': True}. Best is trial 111 with value: 0.2683083377048384.
[I 2025-10-21 09:31:06,119] Trial 119 finished with value: 0.23211545024571353 and parameters: {'model_type': 'gat', 'hidden_dims': '[128, 64]', 'dropout': 0.4170223748799296, 'batch_norm': False, 'gat_heads': 5, 'gat_attn_dropout': 0.1449203922177264, 'gat_concat_hidden': False, 'lr': 1.2092020986377999e-05, 'weight_decay': 2.0557097307797457e-05, 'epochs': 171, 'loss': 'mae', 'optimizer': 'adam', 'graph_mode': 'cutoff', 'cutoff': 0.5337821924776691, 'grm_norm': 'gcn', 'self_loops': True}. Best is trial 111 with value: 0.2683083377048384.
[I 2025-10-21 09:33:54,496] Trial 120 finished with value: 0.24614164376821562 and parameters: {'model_type': 'gat', 'hidden_dims': '[256, 128, 64]', 'dropout': 0.4006706471916082, 'batch_norm': False, 'gat_heads': 5, 'gat_attn_dropout': 0.11677642476683381, 'gat_concat_hidden': False, 'lr': 5.156433024985409e-06, 'weight_decay': 0.0001213097453775947, 'epochs': 194, 'loss': 'mse', 'optimizer': 'adam', 'graph_mode': 'cutoff', 'cutoff': 0.5596868164631054, 'grm_norm': 'cosine_then_gcn', 'self_loops': True}. Best is trial 111 with value: 0.2683083377048384.
[I 2025-10-21 09:39:20,199] Trial 121 finished with value: 0.24360515451417833 and parameters: {'model_type': 'gat', 'hidden_dims': '[512, 128]', 'dropout': 0.4264103530377026, 'batch_norm': False, 'gat_heads': 6, 'gat_attn_dropout': 0.10156569657978146, 'gat_concat_hidden': False, 'lr': 1.5254438572234163e-05, 'weight_decay': 0.000179330313090469, 'epochs': 177, 'loss': 'mae', 'optimizer': 'adam', 'graph_mode': 'cutoff', 'cutoff': 0.5756727436516499, 'grm_norm': 'gcn', 'self_loops': True}. Best is trial 111 with value: 0.2683083377048384.
[I 2025-10-21 09:40:55,449] Trial 122 finished with value: 0.23100453716370298 and parameters: {'model_type': 'gat', 'hidden_dims': '[128, 64]', 'dropout': 0.3741464291435391, 'batch_norm': False, 'gat_heads': 5, 'gat_attn_dropout': 0.15302025034376496, 'gat_concat_hidden': False, 'lr': 2.989349493521882e-06, 'weight_decay': 0.0001369396557971286, 'epochs': 210, 'loss': 'mae', 'optimizer': 'adam', 'graph_mode': 'cutoff', 'cutoff': 0.4443656067334576, 'grm_norm': 'gcn', 'self_loops': True}. Best is trial 111 with value: 0.2683083377048384.
[I 2025-10-21 09:43:34,253] Trial 123 finished with value: 0.214892857431983 and parameters: {'model_type': 'gat', 'hidden_dims': '[256, 128]', 'dropout': 0.44320775162335196, 'batch_norm': False, 'gat_heads': 5, 'gat_attn_dropout': 0.17969915743265405, 'gat_concat_hidden': False, 'lr': 1.623128730379951e-06, 'weight_decay': 0.0003131574165449206, 'epochs': 185, 'loss': 'mae', 'optimizer': 'adam', 'graph_mode': 'cutoff', 'cutoff': 0.6405411037133196, 'grm_norm': 'gcn', 'self_loops': True}. Best is trial 111 with value: 0.2683083377048384.
[I 2025-10-21 09:44:40,999] Trial 124 finished with value: 0.24766127277121802 and parameters: {'model_type': 'gat', 'hidden_dims': '[128, 64]', 'dropout': 0.41322100739377865, 'batch_norm': False, 'gat_heads': 4, 'gat_attn_dropout': 0.5559034417454832, 'gat_concat_hidden': False, 'lr': 2.562427822131924e-05, 'weight_decay': 0.00021986532657290915, 'epochs': 199, 'loss': 'mae', 'optimizer': 'adam', 'graph_mode': 'cutoff', 'cutoff': 0.5310064708066934, 'grm_norm': 'gcn', 'self_loops': True}. Best is trial 111 with value: 0.2683083377048384.
[I 2025-10-21 09:45:08,637] Trial 125 finished with value: 0.09000495155526131 and parameters: {'model_type': 'gat', 'hidden_dims': '[128, 64]', 'dropout': 0.38581032481794864, 'batch_norm': False, 'gat_heads': 1, 'gat_attn_dropout': 0.08183204031701947, 'gat_concat_hidden': False, 'lr': 1.1899265808361108e-06, 'weight_decay': 6.682952716132344e-05, 'epochs': 243, 'loss': 'mae', 'optimizer': 'adam', 'graph_mode': 'cutoff', 'cutoff': 0.6186026650331281, 'grm_norm': 'gcn', 'self_loops': False}. Best is trial 111 with value: 0.2683083377048384.
[I 2025-10-21 09:46:36,317] Trial 126 finished with value: 0.2290551568113317 and parameters: {'model_type': 'gat', 'hidden_dims': '[128, 64]', 'dropout': 0.4668632064341997, 'batch_norm': False, 'gat_heads': 6, 'gat_attn_dropout': 0.13280630817154862, 'gat_concat_hidden': True, 'lr': 2.22619206464517e-05, 'weight_decay': 0.00043260573541893205, 'epochs': 161, 'loss': 'mae', 'optimizer': 'adam', 'graph_mode': 'cutoff', 'cutoff': 0.5963841397254991, 'grm_norm': 'none', 'self_loops': True}. Best is trial 111 with value: 0.2683083377048384.
[I 2025-10-21 09:54:57,562] Trial 127 finished with value: 0.2242286570032473 and parameters: {'model_type': 'gat', 'hidden_dims': '[512, 128]', 'dropout': 0.4538324441974834, 'batch_norm': False, 'gat_heads': 5, 'gat_attn_dropout': 0.16451105350252002, 'gat_concat_hidden': False, 'lr': 3.829634362033709e-06, 'weight_decay': 0.00037110620213956323, 'epochs': 329, 'loss': 'mae', 'optimizer': 'adam', 'graph_mode': 'cutoff', 'cutoff': 0.798633644665016, 'grm_norm': 'cosine_then_gcn', 'self_loops': True}. Best is trial 111 with value: 0.2683083377048384.
[I 2025-10-21 09:55:57,352] Trial 128 finished with value: 0.09274808059537519 and parameters: {'model_type': 'gat', 'hidden_dims': '[128, 64]', 'dropout': 0.4066056412518542, 'batch_norm': True, 'gat_heads': 4, 'gat_attn_dropout': 0.12531553373043408, 'gat_concat_hidden': False, 'lr': 1.3944348598105354e-05, 'weight_decay': 9.454849231180886e-05, 'epochs': 170, 'loss': 'mae', 'optimizer': 'adam', 'graph_mode': 'knn', 'source': 'grm', 'knn_k': 5, 'weighted_edges': False, 'symmetrize_mode': 'union'}. Best is trial 111 with value: 0.2683083377048384.
