[I 2025-11-03 13:42:31,601] Trial 17 finished with value: 0.01865606064037847 and parameters: {'model_type': 'graphsage', 'hidden_dims': '[128, 64]', 'dropout': 0.17940020468099552, 'batch_norm': False, 'lr': 1.2443923937739731e-06, 'weight_decay': 0.00026701931337812885, 'epochs': 281, 'loss': 'mae', 'optimizer': 'adam', 'graph_mode': 'cutoff', 'cutoff': 0.7200154991134339, 'grm_norm': 'none', 'self_loops': False, 'use_snp_selection': True, 'num_snps': 16272}. Best is trial 14 with value: 0.07089940486947045.
[I 2025-11-03 13:42:33,735] Trial 18 finished with value: 0.02602411531883618 and parameters: {'model_type': 'graphsage', 'hidden_dims': '[512, 64]', 'dropout': 0.27319870484252096, 'batch_norm': False, 'lr': 9.05388032692559e-06, 'weight_decay': 0.00016886344981010098, 'epochs': 40, 'loss': 'mae', 'optimizer': 'adam', 'graph_mode': 'cutoff', 'cutoff': 0.5468473330096002, 'grm_norm': 'cosine_then_gcn', 'self_loops': True, 'use_snp_selection': True, 'num_snps': 17509}. Best is trial 14 with value: 0.07089940486947045.
[I 2025-11-03 13:42:35,555] Trial 19 finished with value: 0.03416049903170018 and parameters: {'model_type': 'graphsage', 'hidden_dims': '[512, 128]', 'dropout': 0.33769288232027106, 'batch_norm': False, 'lr': 3.0338527836754865e-06, 'weight_decay': 0.00040113218880853316, 'epochs': 153, 'loss': 'mae', 'optimizer': 'adam', 'graph_mode': 'cutoff', 'cutoff': 0.7734596561888458, 'grm_norm': 'cosine', 'self_loops': False, 'use_snp_selection': True, 'num_snps': 3041}. Best is trial 14 with value: 0.07089940486947045.
[I 2025-11-03 13:42:38,283] Trial 20 finished with value: 0.043173625569188995 and parameters: {'model_type': 'graphsage', 'hidden_dims': '[128, 64]', 'dropout': 0.17101721118546248, 'batch_norm': False, 'lr': 1.2256214881714375e-05, 'weight_decay': 0.00010409976028296733, 'epochs': 224, 'loss': 'mae', 'optimizer': 'adam', 'graph_mode': 'cutoff', 'cutoff': 0.6212685280785321, 'grm_norm': 'none', 'self_loops': False, 'use_snp_selection': True, 'num_snps': 24482}. Best is trial 14 with value: 0.07089940486947045.
[I 2025-11-03 13:42:40,930] Trial 21 finished with value: -0.01680257716601556 and parameters: {'model_type': 'graphsage', 'hidden_dims': '[128, 64]', 'dropout': 0.14744975504420058, 'batch_norm': False, 'lr': 5.437372756199108e-06, 'weight_decay': 0.00036075611445864504, 'epochs': 58, 'loss': 'mae', 'optimizer': 'adam', 'graph_mode': 'cutoff', 'cutoff': 0.678563812006594, 'grm_norm': 'none', 'self_loops': False, 'use_snp_selection': True, 'num_snps': 39787}. Best is trial 14 with value: 0.07089940486947045.
[I 2025-11-03 13:42:43,128] Trial 22 finished with value: 0.02152804195537111 and parameters: {'model_type': 'graphsage', 'hidden_dims': '[128, 64]', 'dropout': 0.23194311170277684, 'batch_norm': False, 'lr': 2.5578891508615925e-06, 'weight_decay': 0.00011984075245683017, 'epochs': 81, 'loss': 'mae', 'optimizer': 'adam', 'graph_mode': 'cutoff', 'cutoff': 0.7708713260930921, 'grm_norm': 'none', 'self_loops': False, 'use_snp_selection': True, 'num_snps': 23653}. Best is trial 14 with value: 0.07089940486947045.
[I 2025-11-03 13:42:44,782] Trial 23 finished with value: 0.007098843816480821 and parameters: {'model_type': 'graphsage', 'hidden_dims': '[128, 64]', 'dropout': 0.1418650932983266, 'batch_norm': False, 'lr': 2.142338301780383e-05, 'weight_decay': 2.744423818834789e-05, 'epochs': 63, 'loss': 'mae', 'optimizer': 'adam', 'graph_mode': 'cutoff', 'cutoff': 0.46308927051551385, 'grm_norm': 'none', 'self_loops': False, 'use_snp_selection': True, 'num_snps': 9616}. Best is trial 14 with value: 0.07089940486947045.
[I 2025-11-03 13:42:46,991] Trial 24 finished with value: 0.024918227663815525 and parameters: {'model_type': 'graphsage', 'hidden_dims': '[128, 64]', 'dropout': 0.20795822582595522, 'batch_norm': False, 'lr': 0.00020262796419164825, 'weight_decay': 1.016313591852439e-05, 'epochs': 123, 'loss': 'mae', 'optimizer': 'adam', 'graph_mode': 'cutoff', 'cutoff': 0.6360791423079271, 'grm_norm': 'none', 'self_loops': False, 'use_snp_selection': True, 'num_snps': 19952}. Best is trial 14 with value: 0.07089940486947045.
[I 2025-11-03 13:42:49,814] Trial 25 finished with value: 0.041300435359739415 and parameters: {'model_type': 'graphsage', 'hidden_dims': '[128, 64]', 'dropout': 0.2809962538353051, 'batch_norm': False, 'lr': 8.030084542038685e-05, 'weight_decay': 0.000523339875991667, 'epochs': 42, 'loss': 'mae', 'optimizer': 'adam', 'graph_mode': 'cutoff', 'cutoff': 0.7950305769513614, 'grm_norm': 'none', 'self_loops': True, 'use_snp_selection': True, 'num_snps': 46216}. Best is trial 14 with value: 0.07089940486947045.
[I 2025-11-03 13:42:51,397] Trial 26 finished with value: 0.045260316505870146 and parameters: {'model_type': 'graphsage', 'hidden_dims': '[128, 64]', 'dropout': 0.3224829757218532, 'batch_norm': True, 'lr': 9.009348306372393e-06, 'weight_decay': 9.66453938178575e-05, 'epochs': 88, 'loss': 'mae', 'optimizer': 'adam', 'graph_mode': 'cutoff', 'cutoff': 0.6676879095262992, 'grm_norm': 'cosine_then_gcn', 'self_loops': False, 'use_snp_selection': False}. Best is trial 14 with value: 0.07089940486947045.
[I 2025-11-03 13:42:54,583] Trial 27 finished with value: 0.03501459833887883 and parameters: {'model_type': 'graphsage', 'hidden_dims': '[512, 128]', 'dropout': 0.14100779561733862, 'batch_norm': False, 'lr': 4.350549331735279e-05, 'weight_decay': 9.449584480943546e-07, 'epochs': 62, 'loss': 'mae', 'optimizer': 'adam', 'graph_mode': 'cutoff', 'cutoff': 0.6085267473276296, 'grm_norm': 'cosine', 'self_loops': False, 'use_snp_selection': True, 'num_snps': 35103}. Best is trial 14 with value: 0.07089940486947045.
[I 2025-11-03 13:42:56,564] Trial 28 finished with value: 0.0334257852277994 and parameters: {'model_type': 'graphsage', 'hidden_dims': '[512, 64]', 'dropout': 0.18517648381051155, 'batch_norm': False, 'lr': 3.77935763191039e-06, 'weight_decay': 4.183749241805922e-05, 'epochs': 105, 'loss': 'mae', 'optimizer': 'adam', 'graph_mode': 'cutoff', 'cutoff': 0.4651111472052886, 'grm_norm': 'gcn', 'self_loops': False, 'use_snp_selection': True, 'num_snps': 10298}. Best is trial 14 with value: 0.07089940486947045.
[I 2025-11-03 13:42:59,118] Trial 29 finished with value: 0.04269943463275291 and parameters: {'model_type': 'graphsage', 'hidden_dims': '[128, 64]', 'dropout': 0.24202780056848847, 'batch_norm': True, 'lr': 1.0893781950163453e-06, 'weight_decay': 5.2782826987114196e-05, 'epochs': 336, 'loss': 'mae', 'optimizer': 'adam', 'graph_mode': 'cutoff', 'cutoff': 0.7126867733557718, 'grm_norm': 'none', 'self_loops': False, 'use_snp_selection': False}. Best is trial 14 with value: 0.07089940486947045.
[I 2025-11-03 13:43:03,867] Trial 30 finished with value: 0.010352869860808205 and parameters: {'model_type': 'graphsage', 'hidden_dims': '[256, 128]', 'dropout': 0.38354529031461626, 'batch_norm': False, 'lr': 2.3887551816277957e-06, 'weight_decay': 6.273926086745405e-06, 'epochs': 345, 'loss': 'mae', 'optimizer': 'adam', 'graph_mode': 'cutoff', 'cutoff': 0.7946672107631275, 'grm_norm': 'none', 'self_loops': True, 'use_snp_selection': True, 'num_snps': 52624}. Best is trial 14 with value: 0.07089940486947045.
[I 2025-11-03 13:43:05,453] Trial 31 finished with value: 0.02071523227186124 and parameters: {'model_type': 'graphsage', 'hidden_dims': '[128, 64]', 'dropout': 0.30913254753901553, 'batch_norm': True, 'lr': 8.484021734515716e-06, 'weight_decay': 9.499164570975769e-05, 'epochs': 89, 'loss': 'mae', 'optimizer': 'adam', 'graph_mode': 'cutoff', 'cutoff': 0.6721410664040323, 'grm_norm': 'cosine_then_gcn', 'self_loops': False, 'use_snp_selection': False}. Best is trial 14 with value: 0.07089940486947045.
[I 2025-11-03 13:43:06,914] Trial 32 finished with value: 0.018911406588507935 and parameters: {'model_type': 'graphsage', 'hidden_dims': '[128, 64]', 'dropout': 0.44528989180556333, 'batch_norm': True, 'lr': 1.319291160513579e-05, 'weight_decay': 0.00016768541547259046, 'epochs': 62, 'loss': 'mae', 'optimizer': 'adam', 'graph_mode': 'cutoff', 'cutoff': 0.6674698075188026, 'grm_norm': 'cosine_then_gcn', 'self_loops': False, 'use_snp_selection': False}. Best is trial 14 with value: 0.07089940486947045.
[I 2025-11-03 13:43:08,446] Trial 33 finished with value: 0.0012661454880732279 and parameters: {'model_type': 'graphsage', 'hidden_dims': '[128, 64]', 'dropout': 0.3269694682581728, 'batch_norm': True, 'lr': 5.79954709939947e-06, 'weight_decay': 0.0005271461420406648, 'epochs': 79, 'loss': 'mae', 'optimizer': 'adam', 'graph_mode': 'cutoff', 'cutoff': 0.7461914878281384, 'grm_norm': 'cosine_then_gcn', 'self_loops': False, 'use_snp_selection': False}. Best is trial 14 with value: 0.07089940486947045.
[I 2025-11-03 13:43:10,321] Trial 34 finished with value: 0.03580702483148689 and parameters: {'model_type': 'graphsage', 'hidden_dims': '[128, 64]', 'dropout': 0.21067307110033384, 'batch_norm': True, 'lr': 1.6535172143781508e-06, 'weight_decay': 1.580715775830551e-05, 'epochs': 133, 'loss': 'mae', 'optimizer': 'adam', 'graph_mode': 'knn', 'source': 'grm', 'knn_k': 3, 'weighted_edges': True, 'symmetrize_mode': 'union', 'use_snp_selection': False}. Best is trial 14 with value: 0.07089940486947045.
[I 2025-11-03 13:43:11,929] Trial 35 finished with value: 0.025400105498260894 and parameters: {'model_type': 'graphsage', 'hidden_dims': '[128, 64]', 'dropout': 0.2679179501225201, 'batch_norm': True, 'lr': 9.587928219142e-06, 'weight_decay': 8.778481491082083e-05, 'epochs': 98, 'loss': 'mae', 'optimizer': 'adam', 'graph_mode': 'cutoff', 'cutoff': 0.8325664169889894, 'grm_norm': 'cosine_then_gcn', 'self_loops': False, 'use_snp_selection': False}. Best is trial 14 with value: 0.07089940486947045.
[I 2025-11-03 13:43:13,998] Trial 36 finished with value: 0.03919045465739504 and parameters: {'model_type': 'graphsage', 'hidden_dims': '[256, 128]', 'dropout': 0.18771864747859512, 'batch_norm': True, 'lr': 0.0006955120862824045, 'weight_decay': 2.554242766395729e-05, 'epochs': 51, 'loss': 'mse', 'optimizer': 'adam', 'graph_mode': 'knn', 'source': 'grm', 'knn_k': 10, 'weighted_edges': True, 'symmetrize_mode': 'union', 'use_snp_selection': False}. Best is trial 14 with value: 0.07089940486947045.
[I 2025-11-03 13:43:15,464] Trial 37 finished with value: 0.013269958497271108 and parameters: {'model_type': 'graphsage', 'hidden_dims': '[128, 64]', 'dropout': 0.35863871105524436, 'batch_norm': True, 'lr': 2.494135473872728e-05, 'weight_decay': 0.0007497502651700348, 'epochs': 71, 'loss': 'mae', 'optimizer': 'adam', 'graph_mode': 'cutoff', 'cutoff': 0.5754956921505838, 'grm_norm': 'none', 'self_loops': False, 'use_snp_selection': False}. Best is trial 14 with value: 0.07089940486947045.
[I 2025-11-03 13:43:17,913] Trial 38 finished with value: 0.0030730559923019957 and parameters: {'model_type': 'graphsage', 'hidden_dims': '[128, 64]', 'dropout': 0.2953631346188236, 'batch_norm': False, 'lr': 0.0009557972538396107, 'weight_decay': 0.00016230174632609224, 'epochs': 168, 'loss': 'mse', 'optimizer': 'adam', 'graph_mode': 'cutoff', 'cutoff': 0.6448858737210911, 'grm_norm': 'cosine_then_gcn', 'self_loops': False, 'use_snp_selection': True, 'num_snps': 22729}. Best is trial 14 with value: 0.07089940486947045.
[I 2025-11-03 13:43:21,806] Trial 39 finished with value: 0.018814850142225333 and parameters: {'model_type': 'graphsage', 'hidden_dims': '[512, 256]', 'dropout': 0.16255110258016786, 'batch_norm': True, 'lr': 5.191114133081786e-05, 'weight_decay': 0.0002982911150490542, 'epochs': 137, 'loss': 'mae', 'optimizer': 'adam', 'graph_mode': 'knn', 'source': 'grm', 'knn_k': 4, 'weighted_edges': False, 'symmetrize_mode': 'union', 'use_snp_selection': False}. Best is trial 14 with value: 0.07089940486947045.
[I 2025-11-03 13:43:24,141] Trial 40 finished with value: 0.039349804862243744 and parameters: {'model_type': 'graphsage', 'hidden_dims': '[256, 128]', 'dropout': 0.4635248199475439, 'batch_norm': False, 'lr': 1.5997856867451254e-05, 'weight_decay': 5.6453585797855065e-05, 'epochs': 211, 'loss': 'mae', 'optimizer': 'adam', 'graph_mode': 'cutoff', 'cutoff': 0.564872493049734, 'grm_norm': 'gcn', 'self_loops': False, 'use_snp_selection': True, 'num_snps': 12610}. Best is trial 14 with value: 0.07089940486947045.
[I 2025-11-03 13:43:26,962] Trial 41 finished with value: 0.007739095353951505 and parameters: {'model_type': 'graphsage', 'hidden_dims': '[128, 64]', 'dropout': 0.12271008926420512, 'batch_norm': False, 'lr': 1.1580900410889782e-05, 'weight_decay': 8.494648166309685e-05, 'epochs': 233, 'loss': 'mae', 'optimizer': 'adam', 'graph_mode': 'cutoff', 'cutoff': 0.6181508020013317, 'grm_norm': 'none', 'self_loops': False, 'use_snp_selection': True, 'num_snps': 26429}. Best is trial 14 with value: 0.07089940486947045.
[I 2025-11-03 13:43:29,696] Trial 42 finished with value: 0.061364882764038585 and parameters: {'model_type': 'graphsage', 'hidden_dims': '[128, 64]', 'dropout': 0.2116330431060989, 'batch_norm': False, 'lr': 6.882390763422775e-06, 'weight_decay': 0.00011297442298125368, 'epochs': 245, 'loss': 'mae', 'optimizer': 'adam', 'graph_mode': 'cutoff', 'cutoff': 0.700743295966166, 'grm_norm': 'none', 'self_loops': False, 'use_snp_selection': True, 'num_snps': 22310}. Best is trial 14 with value: 0.07089940486947045.
[I 2025-11-03 13:43:32,440] Trial 43 finished with value: 0.04170127711472973 and parameters: {'model_type': 'graphsage', 'hidden_dims': '[128, 64]', 'dropout': 0.21527268913768022, 'batch_norm': False, 'lr': 4.48472046469214e-06, 'weight_decay': 3.5492683782369395e-05, 'epochs': 291, 'loss': 'mae', 'optimizer': 'adam', 'graph_mode': 'cutoff', 'cutoff': 0.7082143672083357, 'grm_norm': 'none', 'self_loops': False, 'use_snp_selection': True, 'num_snps': 17906}. Best is trial 14 with value: 0.07089940486947045.
[I 2025-11-03 13:43:36,754] Trial 44 finished with value: 0.012005173129304061 and parameters: {'model_type': 'graphsage', 'hidden_dims': '[512, 256]', 'dropout': 0.2421425397408381, 'batch_norm': False, 'lr': 6.362535592101236e-06, 'weight_decay': 1.7876831408163452e-05, 'epochs': 254, 'loss': 'mae', 'optimizer': 'adam', 'graph_mode': 'cutoff', 'cutoff': 0.6931497170054972, 'grm_norm': 'gcn', 'self_loops': False, 'use_snp_selection': True, 'num_snps': 34964}. Best is trial 14 with value: 0.07089940486947045.
[I 2025-11-03 13:43:39,507] Trial 45 finished with value: 0.010571772761641089 and parameters: {'model_type': 'graphsage', 'hidden_dims': '[512, 128]', 'dropout': 0.3778413458082576, 'batch_norm': False, 'lr': 3.2607335679880574e-05, 'weight_decay': 0.00023237351250979905, 'epochs': 49, 'loss': 'mse', 'optimizer': 'adam', 'graph_mode': 'cutoff', 'cutoff': 0.7342208375557691, 'grm_norm': 'cosine', 'self_loops': False, 'use_snp_selection': True, 'num_snps': 28405}. Best is trial 14 with value: 0.07089940486947045.
[I 2025-11-03 13:43:41,514] Trial 46 finished with value: 0.032617628683955485 and parameters: {'model_type': 'graphsage', 'hidden_dims': '[128, 64]', 'dropout': 0.1999699648533736, 'batch_norm': False, 'lr': 0.0003515228392466483, 'weight_decay': 1.2665384510201782e-07, 'epochs': 181, 'loss': 'mae', 'optimizer': 'adam', 'graph_mode': 'cutoff', 'cutoff': 0.20385629126661164, 'grm_norm': 'none', 'self_loops': True, 'use_snp_selection': True, 'num_snps': 7053}. Best is trial 14 with value: 0.07089940486947045.
[I 2025-11-03 13:43:45,022] Trial 47 finished with value: 0.01434714837014095 and parameters: {'model_type': 'graphsage', 'hidden_dims': '[256, 128, 64]', 'dropout': 0.25415731742687003, 'batch_norm': False, 'lr': 1.9415078964825763e-05, 'weight_decay': 2.12231600419346e-06, 'epochs': 207, 'loss': 'mae', 'optimizer': 'adam', 'graph_mode': 'knn', 'source': 'grm', 'knn_k': 3, 'weighted_edges': True, 'symmetrize_mode': 'mutual', 'use_snp_selection': True, 'num_snps': 34478}. Best is trial 14 with value: 0.07089940486947045.
[I 2025-11-03 13:43:48,341] Trial 48 finished with value: 0.018425451859677897 and parameters: {'model_type': 'graphsage', 'hidden_dims': '[512, 64]', 'dropout': 0.15812584846216132, 'batch_norm': False, 'lr': 3.508131009095554e-06, 'weight_decay': 0.0009994440984278776, 'epochs': 309, 'loss': 'mse', 'optimizer': 'adam', 'graph_mode': 'cutoff', 'cutoff': 0.8186347051099744, 'grm_norm': 'none', 'self_loops': False, 'use_snp_selection': True, 'num_snps': 20645}. Best is trial 14 with value: 0.07089940486947045.
[I 2025-11-03 13:43:49,806] Trial 49 finished with value: 0.02352832089019378 and parameters: {'model_type': 'graphsage', 'hidden_dims': '[128, 64]', 'dropout': 0.12074107151051686, 'batch_norm': True, 'lr': 0.0001079478878250379, 'weight_decay': 0.000149121724390769, 'epochs': 70, 'loss': 'mae', 'optimizer': 'adam', 'graph_mode': 'cutoff', 'cutoff': 0.75250864407102, 'grm_norm': 'none', 'self_loops': False, 'use_snp_selection': False}. Best is trial 14 with value: 0.07089940486947045.
[I 2025-11-03 13:43:52,290] Trial 50 finished with value: 0.04078892383260277 and parameters: {'model_type': 'graphsage', 'hidden_dims': '[128, 64]', 'dropout': 0.10269559200669803, 'batch_norm': False, 'lr': 1.751021370859871e-06, 'weight_decay': 0.0005516337103587299, 'epochs': 244, 'loss': 'mae', 'optimizer': 'adam', 'graph_mode': 'cutoff', 'cutoff': 0.5943817566289586, 'grm_norm': 'cosine_then_gcn', 'self_loops': False, 'use_snp_selection': True, 'num_snps': 15147}. Best is trial 14 with value: 0.07089940486947045.
[I 2025-11-03 13:43:55,177] Trial 51 finished with value: 0.03530147947125185 and parameters: {'model_type': 'graphsage', 'hidden_dims': '[128, 64]', 'dropout': 0.1625777849206774, 'batch_norm': False, 'lr': 8.763884096825062e-06, 'weight_decay': 0.00011402042653828147, 'epochs': 270, 'loss': 'mae', 'optimizer': 'adam', 'graph_mode': 'cutoff', 'cutoff': 0.6521722975324753, 'grm_norm': 'none', 'self_loops': False, 'use_snp_selection': True, 'num_snps': 25541}. Best is trial 14 with value: 0.07089940486947045.
[I 2025-11-03 13:43:57,776] Trial 52 finished with value: 0.041265559983065386 and parameters: {'model_type': 'graphsage', 'hidden_dims': '[128, 64]', 'dropout': 0.17674319421430587, 'batch_norm': False, 'lr': 1.3503823511962518e-05, 'weight_decay': 6.649689292371077e-05, 'epochs': 222, 'loss': 'mae', 'optimizer': 'adam', 'graph_mode': 'cutoff', 'cutoff': 0.5371385604800258, 'grm_norm': 'none', 'self_loops': False, 'use_snp_selection': True, 'num_snps': 22013}. Best is trial 14 with value: 0.07089940486947045.
[I 2025-11-03 13:44:00,526] Trial 53 finished with value: 0.03250863963367249 and parameters: {'model_type': 'graphsage', 'hidden_dims': '[128, 64]', 'dropout': 0.22635442830287633, 'batch_norm': False, 'lr': 7.769836690519246e-06, 'weight_decay': 0.00022517758368302787, 'epochs': 195, 'loss': 'mae', 'optimizer': 'adam', 'graph_mode': 'cutoff', 'cutoff': 0.693348725051909, 'grm_norm': 'none', 'self_loops': False, 'use_snp_selection': True, 'num_snps': 28357}. Best is trial 14 with value: 0.07089940486947045.
[I 2025-11-03 13:44:03,294] Trial 54 finished with value: 0.028345652653009874 and parameters: {'model_type': 'graphsage', 'hidden_dims': '[256, 128, 64]', 'dropout': 0.13101681097951623, 'batch_norm': False, 'lr': 1.140400743650448e-05, 'weight_decay': 0.0003191412212424744, 'epochs': 237, 'loss': 'mae', 'optimizer': 'adam', 'graph_mode': 'cutoff', 'cutoff': 0.8997996915384772, 'grm_norm': 'none', 'self_loops': False, 'use_snp_selection': True, 'num_snps': 13334}. Best is trial 14 with value: 0.07089940486947045.
[I 2025-11-03 13:44:05,423] Trial 55 finished with value: 0.012529098481338348 and parameters: {'model_type': 'graphsage', 'hidden_dims': '[128, 64]', 'dropout': 0.1891381010491022, 'batch_norm': False, 'lr': 4.9920854873603875e-06, 'weight_decay': 0.00012420294632426948, 'epochs': 53, 'loss': 'mae', 'optimizer': 'adam', 'graph_mode': 'cutoff', 'cutoff': 0.5064716731290627, 'grm_norm': 'none', 'self_loops': True, 'use_snp_selection': True, 'num_snps': 24562}. Best is trial 14 with value: 0.07089940486947045.
[I 2025-11-03 13:44:08,527] Trial 56 finished with value: 0.04223353357903611 and parameters: {'model_type': 'graphsage', 'hidden_dims': '[512, 256]', 'dropout': 0.28241257312435997, 'batch_norm': False, 'lr': 2.807084217096795e-05, 'weight_decay': 7.428026201412589e-05, 'epochs': 83, 'loss': 'mae', 'optimizer': 'adam', 'graph_mode': 'cutoff', 'cutoff': 0.6207778033951896, 'grm_norm': 'cosine', 'self_loops': False, 'use_snp_selection': True, 'num_snps': 31773}. Best is trial 14 with value: 0.07089940486947045.
[I 2025-11-03 13:44:12,588] Trial 57 finished with value: 0.01404830263692823 and parameters: {'model_type': 'graphsage', 'hidden_dims': '[128, 64]', 'dropout': 0.16933617597288492, 'batch_norm': False, 'lr': 6.642464605670747e-06, 'weight_decay': 0.0004203889613409986, 'epochs': 105, 'loss': 'mae', 'optimizer': 'adam', 'graph_mode': 'knn', 'source': 'grm', 'knn_k': 8, 'weighted_edges': False, 'symmetrize_mode': 'union', 'use_snp_selection': True, 'num_snps': 59613}. Best is trial 14 with value: 0.07089940486947045.
[I 2025-11-03 13:44:14,752] Trial 58 finished with value: -0.006832182335566993 and parameters: {'model_type': 'graphsage', 'hidden_dims': '[512, 128]', 'dropout': 0.2538376377384455, 'batch_norm': False, 'lr': 1.7302102017584455e-05, 'weight_decay': 7.35751982983441e-06, 'epochs': 43, 'loss': 'mae', 'optimizer': 'adam', 'graph_mode': 'cutoff', 'cutoff': 0.7256506391329194, 'grm_norm': 'none', 'self_loops': False, 'use_snp_selection': True, 'num_snps': 19030}. Best is trial 14 with value: 0.07089940486947045.
