[I 2025-11-13 08:17:32,181] Trial 140 finished with value: 0.28636090839654527 and parameters: {'model_type': 'graphsage', 'hidden_dims': '[512, 256]', 'dropout': 0.5632955066927477, 'batch_norm': True, 'lr': 0.0005308126372003515, 'weight_decay': 2.0790372339515454e-05, 'epochs': 44, 'loss': 'mae', 'optimizer': 'adam', 'graph_mode': 'cutoff', 'cutoff': 0.3654301631688397, 'grm_norm': 'gcn', 'self_loops': True, 'use_snp_selection': False}. Best is trial 119 with value: 0.3186191315699354.
[I 2025-11-13 08:18:40,520] Trial 141 finished with value: 0.3037072764581193 and parameters: {'model_type': 'graphsage', 'hidden_dims': '[512, 256]', 'dropout': 0.5302516775257516, 'batch_norm': True, 'lr': 0.0007567832833242414, 'weight_decay': 1.3328886633477717e-05, 'epochs': 64, 'loss': 'mae', 'optimizer': 'adam', 'graph_mode': 'cutoff', 'cutoff': 0.3739479378165079, 'grm_norm': 'gcn', 'self_loops': True, 'use_snp_selection': False}. Best is trial 119 with value: 0.3186191315699354.
[I 2025-11-13 08:19:35,386] Trial 142 finished with value: 0.3030479584212049 and parameters: {'model_type': 'graphsage', 'hidden_dims': '[512, 256]', 'dropout': 0.5088206281586792, 'batch_norm': True, 'lr': 0.0009904000315429718, 'weight_decay': 4.461289066181954e-05, 'epochs': 46, 'loss': 'mae', 'optimizer': 'adam', 'graph_mode': 'cutoff', 'cutoff': 0.38618413501413185, 'grm_norm': 'gcn', 'self_loops': True, 'use_snp_selection': False}. Best is trial 119 with value: 0.3186191315699354.
[I 2025-11-13 08:20:39,354] Trial 143 finished with value: 0.31084253460071853 and parameters: {'model_type': 'graphsage', 'hidden_dims': '[512, 256]', 'dropout': 0.5785622251405289, 'batch_norm': True, 'lr': 0.0006406166103367045, 'weight_decay': 3.0221033837909604e-05, 'epochs': 57, 'loss': 'mae', 'optimizer': 'adam', 'graph_mode': 'cutoff', 'cutoff': 0.35703637346838574, 'grm_norm': 'gcn', 'self_loops': True, 'use_snp_selection': False}. Best is trial 119 with value: 0.3186191315699354.
[I 2025-11-13 08:21:44,901] Trial 144 finished with value: 0.2946055757789203 and parameters: {'model_type': 'graphsage', 'hidden_dims': '[512, 256]', 'dropout': 0.5777493817176059, 'batch_norm': True, 'lr': 0.0006352953011048544, 'weight_decay': 2.9040541875619238e-05, 'epochs': 59, 'loss': 'mae', 'optimizer': 'adam', 'graph_mode': 'cutoff', 'cutoff': 0.3571572172121276, 'grm_norm': 'gcn', 'self_loops': True, 'use_snp_selection': False}. Best is trial 119 with value: 0.3186191315699354.
[I 2025-11-13 08:23:02,417] Trial 145 finished with value: 0.29830113524303903 and parameters: {'model_type': 'graphsage', 'hidden_dims': '[512, 256]', 'dropout': 0.5868697491608423, 'batch_norm': True, 'lr': 0.0007298927611560712, 'weight_decay': 1.938894045817043e-05, 'epochs': 73, 'loss': 'mae', 'optimizer': 'adam', 'graph_mode': 'cutoff', 'cutoff': 0.33682276075472145, 'grm_norm': 'gcn', 'self_loops': True, 'use_snp_selection': False}. Best is trial 119 with value: 0.3186191315699354.
[I 2025-11-13 08:24:15,765] Trial 146 finished with value: 0.3001172958093249 and parameters: {'model_type': 'graphsage', 'hidden_dims': '[512, 256]', 'dropout': 0.569777190454024, 'batch_norm': True, 'lr': 0.0008688686707384398, 'weight_decay': 1.061173306382868e-05, 'epochs': 66, 'loss': 'mae', 'optimizer': 'adam', 'graph_mode': 'cutoff', 'cutoff': 0.32329901805179395, 'grm_norm': 'gcn', 'self_loops': True, 'use_snp_selection': False}. Best is trial 119 with value: 0.3186191315699354.
[I 2025-11-13 08:25:21,385] Trial 147 finished with value: 0.30538603521656293 and parameters: {'model_type': 'graphsage', 'hidden_dims': '[512, 256]', 'dropout': 0.5492535551710052, 'batch_norm': True, 'lr': 0.0005839914320389572, 'weight_decay': 5.566260857817075e-05, 'epochs': 54, 'loss': 'mae', 'optimizer': 'adam', 'graph_mode': 'cutoff', 'cutoff': 0.3052446072754582, 'grm_norm': 'gcn', 'self_loops': True, 'use_snp_selection': False}. Best is trial 119 with value: 0.3186191315699354.
[I 2025-11-13 08:26:26,683] Trial 148 finished with value: 0.30139915528146005 and parameters: {'model_type': 'graphsage', 'hidden_dims': '[512, 256]', 'dropout': 0.5476457849058224, 'batch_norm': True, 'lr': 0.0005248511300750496, 'weight_decay': 7.355195060176843e-05, 'epochs': 53, 'loss': 'mae', 'optimizer': 'adam', 'graph_mode': 'cutoff', 'cutoff': 0.3016958406863931, 'grm_norm': 'gcn', 'self_loops': True, 'use_snp_selection': False}. Best is trial 119 with value: 0.3186191315699354.
[I 2025-11-13 08:27:18,075] Trial 149 finished with value: 0.1140450011803074 and parameters: {'model_type': 'graphsage', 'hidden_dims': '[512, 256]', 'dropout': 0.5932684366980304, 'batch_norm': False, 'lr': 0.0006197881291743673, 'weight_decay': 5.068929556795705e-05, 'epochs': 40, 'loss': 'mse', 'optimizer': 'adam', 'graph_mode': 'cutoff', 'cutoff': 0.26613593233093286, 'grm_norm': 'gcn', 'self_loops': True, 'use_snp_selection': True, 'num_snps': 9999}. Best is trial 119 with value: 0.3186191315699354.
[I 2025-11-13 08:29:49,709] Trial 0 finished with value: 0.12857904441096843 and parameters: {'model_type': 'graphsage', 'hidden_dims': '[128, 64]', 'dropout': 0.199031432379812, 'batch_norm': True, 'lr': 1.8408544111075837e-06, 'weight_decay': 5.5136510071208614e-05, 'epochs': 336, 'loss': 'mae', 'optimizer': 'adam', 'graph_mode': 'knn', 'source': 'grm', 'knn_k': 8, 'weighted_edges': True, 'symmetrize_mode': 'mutual', 'use_snp_selection': False}. Best is trial 0 with value: 0.12857904441096843.
[I 2025-11-13 08:30:42,059] Trial 1 finished with value: 0.20991685304623053 and parameters: {'model_type': 'graphsage', 'hidden_dims': '[128, 64]', 'dropout': 0.40051947670227217, 'batch_norm': True, 'lr': 0.0005320428882732732, 'weight_decay': 1.89210117736594e-06, 'epochs': 68, 'loss': 'mse', 'optimizer': 'adam', 'graph_mode': 'knn', 'source': 'grm', 'knn_k': 7, 'weighted_edges': True, 'symmetrize_mode': 'union', 'use_snp_selection': False}. Best is trial 1 with value: 0.20991685304623053.
[I 2025-11-13 08:32:04,382] Trial 2 finished with value: 0.21665015237619673 and parameters: {'model_type': 'graphsage', 'hidden_dims': '[256, 128]', 'dropout': 0.5105528289184642, 'batch_norm': False, 'lr': 0.0006804279372404962, 'weight_decay': 0.0008922815224257085, 'epochs': 181, 'loss': 'mse', 'optimizer': 'adam', 'graph_mode': 'cutoff', 'cutoff': 0.5741905641612706, 'grm_norm': 'gcn', 'self_loops': False, 'use_snp_selection': True, 'num_snps': 26910}. Best is trial 2 with value: 0.21665015237619673.
[I 2025-11-13 08:33:37,689] Trial 3 finished with value: 0.22959360114565192 and parameters: {'model_type': 'graphsage', 'hidden_dims': '[256, 128, 64]', 'dropout': 0.5390483213624292, 'batch_norm': False, 'lr': 3.4705625989073525e-05, 'weight_decay': 2.4623319020131338e-05, 'epochs': 121, 'loss': 'mse', 'optimizer': 'adam', 'graph_mode': 'knn', 'source': 'grm', 'knn_k': 6, 'weighted_edges': False, 'symmetrize_mode': 'mutual', 'use_snp_selection': True, 'num_snps': 30713}. Best is trial 3 with value: 0.22959360114565192.
[I 2025-11-13 08:34:47,394] Trial 4 finished with value: 0.2568370581276163 and parameters: {'model_type': 'graphsage', 'hidden_dims': '[128, 64]', 'dropout': 0.13404863676897502, 'batch_norm': False, 'lr': 0.0001431556295367288, 'weight_decay': 2.2084517750726675e-05, 'epochs': 51, 'loss': 'mae', 'optimizer': 'adam', 'graph_mode': 'cutoff', 'cutoff': 0.6714268476993044, 'grm_norm': 'none', 'self_loops': False, 'use_snp_selection': True, 'num_snps': 45645}. Best is trial 4 with value: 0.2568370581276163.
[I 2025-11-13 08:36:31,034] Trial 5 finished with value: 0.2416636118583116 and parameters: {'model_type': 'graphsage', 'hidden_dims': '[256, 128]', 'dropout': 0.42253606323412096, 'batch_norm': False, 'lr': 4.238630400638805e-05, 'weight_decay': 8.074086040046576e-07, 'epochs': 158, 'loss': 'mae', 'optimizer': 'adam', 'graph_mode': 'knn', 'source': 'grm', 'knn_k': 1, 'weighted_edges': False, 'symmetrize_mode': 'mutual', 'use_snp_selection': True, 'num_snps': 43113}. Best is trial 4 with value: 0.2568370581276163.
[I 2025-11-13 08:39:13,386] Trial 6 finished with value: 0.21306323911651875 and parameters: {'model_type': 'graphsage', 'hidden_dims': '[512, 256]', 'dropout': 0.3534893146320237, 'batch_norm': True, 'lr': 0.000251307964226932, 'weight_decay': 1.821819791794022e-05, 'epochs': 223, 'loss': 'mae', 'optimizer': 'adam', 'graph_mode': 'knn', 'source': 'grm', 'knn_k': 1, 'weighted_edges': True, 'symmetrize_mode': 'mutual', 'use_snp_selection': False}. Best is trial 4 with value: 0.2568370581276163.
[I 2025-11-13 08:41:31,566] Trial 7 finished with value: 0.22118915260317426 and parameters: {'model_type': 'graphsage', 'hidden_dims': '[512, 256]', 'dropout': 0.1105825955860775, 'batch_norm': True, 'lr': 2.374338412754043e-05, 'weight_decay': 1.1284721123340274e-05, 'epochs': 190, 'loss': 'mse', 'optimizer': 'adam', 'graph_mode': 'cutoff', 'cutoff': 0.719872204109604, 'grm_norm': 'gcn', 'self_loops': False, 'use_snp_selection': False}. Best is trial 4 with value: 0.2568370581276163.
[I 2025-11-13 08:43:26,666] Trial 8 finished with value: 0.2284608113018741 and parameters: {'model_type': 'graphsage', 'hidden_dims': '[512, 128]', 'dropout': 0.5066580418354021, 'batch_norm': True, 'lr': 0.00039213678276659976, 'weight_decay': 3.43655320802934e-06, 'epochs': 120, 'loss': 'mse', 'optimizer': 'adam', 'graph_mode': 'cutoff', 'cutoff': 0.34923059576505366, 'grm_norm': 'cosine', 'self_loops': True, 'use_snp_selection': False}. Best is trial 4 with value: 0.2568370581276163.
[I 2025-11-13 08:44:44,291] Trial 9 finished with value: 0.21591269885173392 and parameters: {'model_type': 'graphsage', 'hidden_dims': '[512, 256]', 'dropout': 0.301734920240333, 'batch_norm': False, 'lr': 6.650961854953448e-06, 'weight_decay': 6.861575656590315e-05, 'epochs': 150, 'loss': 'mae', 'optimizer': 'adam', 'graph_mode': 'cutoff', 'cutoff': 0.2857569870061939, 'grm_norm': 'cosine_then_gcn', 'self_loops': False, 'use_snp_selection': True, 'num_snps': 12722}. Best is trial 4 with value: 0.2568370581276163.
[I 2025-11-13 08:46:21,203] Trial 10 finished with value: 0.15805369212047765 and parameters: {'model_type': 'graphsage', 'hidden_dims': '[512, 64]', 'dropout': 0.22492338276159776, 'batch_norm': False, 'lr': 0.00014233761188460356, 'weight_decay': 1.8772904431456567e-07, 'epochs': 41, 'loss': 'mae', 'optimizer': 'adam', 'graph_mode': 'cutoff', 'cutoff': 0.8740100033033124, 'grm_norm': 'none', 'self_loops': True, 'use_snp_selection': True, 'num_snps': 58960}. Best is trial 4 with value: 0.2568370581276163.
[I 2025-11-13 08:49:16,055] Trial 11 finished with value: 0.21873762175531103 and parameters: {'model_type': 'graphsage', 'hidden_dims': '[256, 128]', 'dropout': 0.42220860806405436, 'batch_norm': False, 'lr': 6.262647579580582e-05, 'weight_decay': 4.139423376842716e-07, 'epochs': 265, 'loss': 'mae', 'optimizer': 'adam', 'graph_mode': 'knn', 'source': 'grm', 'knn_k': 1, 'weighted_edges': False, 'symmetrize_mode': 'union', 'use_snp_selection': True, 'num_snps': 51345}. Best is trial 4 with value: 0.2568370581276163.
[I 2025-11-13 08:50:37,869] Trial 12 finished with value: 0.2274158129928237 and parameters: {'model_type': 'graphsage', 'hidden_dims': '[256, 128]', 'dropout': 0.10085733521439913, 'batch_norm': False, 'lr': 1.09190189634402e-05, 'weight_decay': 1.082336638541815e-06, 'epochs': 65, 'loss': 'mae', 'optimizer': 'adam', 'graph_mode': 'cutoff', 'cutoff': 0.5157485749757096, 'grm_norm': 'none', 'self_loops': False, 'use_snp_selection': True, 'num_snps': 44729}. Best is trial 4 with value: 0.2568370581276163.
[I 2025-11-13 08:52:32,142] Trial 13 finished with value: 0.23326144973469365 and parameters: {'model_type': 'graphsage', 'hidden_dims': '[128, 64]', 'dropout': 0.27211071589228386, 'batch_norm': False, 'lr': 9.659725406393982e-05, 'weight_decay': 0.00036922279098827336, 'epochs': 259, 'loss': 'mae', 'optimizer': 'adam', 'graph_mode': 'knn', 'source': 'grm', 'knn_k': 3, 'weighted_edges': False, 'symmetrize_mode': 'mutual', 'use_snp_selection': True, 'num_snps': 41129}. Best is trial 4 with value: 0.2568370581276163.
[I 2025-11-13 08:54:12,201] Trial 14 finished with value: 0.23695844494440704 and parameters: {'model_type': 'graphsage', 'hidden_dims': '[512, 64]', 'dropout': 0.44502369125667784, 'batch_norm': False, 'lr': 1.1823202310856283e-05, 'weight_decay': 1.2718352739810505e-07, 'epochs': 103, 'loss': 'mae', 'optimizer': 'adam', 'graph_mode': 'cutoff', 'cutoff': 0.7154802468613564, 'grm_norm': 'none', 'self_loops': False, 'use_snp_selection': True, 'num_snps': 39076}. Best is trial 4 with value: 0.2568370581276163.
[I 2025-11-13 08:57:10,409] Trial 15 finished with value: 0.2086692342107114 and parameters: {'model_type': 'graphsage', 'hidden_dims': '[512, 128]', 'dropout': 0.5945136394423849, 'batch_norm': False, 'lr': 4.813260077217442e-05, 'weight_decay': 4.644082258867106e-06, 'epochs': 340, 'loss': 'mae', 'optimizer': 'adam', 'graph_mode': 'knn', 'source': 'grm', 'knn_k': 10, 'weighted_edges': False, 'symmetrize_mode': 'mutual', 'use_snp_selection': True, 'num_snps': 23302}. Best is trial 4 with value: 0.2568370581276163.
[I 2025-11-13 08:59:15,193] Trial 16 finished with value: 0.2426911915075185 and parameters: {'model_type': 'graphsage', 'hidden_dims': '[256, 128, 64]', 'dropout': 0.1777078481377637, 'batch_norm': False, 'lr': 0.00018193160805651356, 'weight_decay': 7.124903286527256e-07, 'epochs': 150, 'loss': 'mae', 'optimizer': 'adam', 'graph_mode': 'cutoff', 'cutoff': 0.4985514132192289, 'grm_norm': 'cosine_then_gcn', 'self_loops': True, 'use_snp_selection': True, 'num_snps': 51740}. Best is trial 4 with value: 0.2568370581276163.
[I 2025-11-13 09:01:15,216] Trial 17 finished with value: 0.2365565390559873 and parameters: {'model_type': 'graphsage', 'hidden_dims': '[256, 128, 64]', 'dropout': 0.17178364292614912, 'batch_norm': False, 'lr': 0.00018554485993892115, 'weight_decay': 0.0001172775091180384, 'epochs': 89, 'loss': 'mae', 'optimizer': 'adam', 'graph_mode': 'cutoff', 'cutoff': 0.49115498917855616, 'grm_norm': 'cosine_then_gcn', 'self_loops': True, 'use_snp_selection': True, 'num_snps': 59686}. Best is trial 4 with value: 0.2568370581276163.
[I 2025-11-13 09:03:16,637] Trial 18 finished with value: 0.22535933626249333 and parameters: {'model_type': 'graphsage', 'hidden_dims': '[256, 128, 64]', 'dropout': 0.15989116251508353, 'batch_norm': False, 'lr': 0.00025899904970025145, 'weight_decay': 4.514011028030521e-06, 'epochs': 227, 'loss': 'mae', 'optimizer': 'adam', 'graph_mode': 'cutoff', 'cutoff': 0.6375822648344665, 'grm_norm': 'cosine_then_gcn', 'self_loops': True, 'use_snp_selection': True, 'num_snps': 46428}. Best is trial 4 with value: 0.2568370581276163.
[I 2025-11-13 09:05:42,745] Trial 19 finished with value: 0.23606296545635086 and parameters: {'model_type': 'graphsage', 'hidden_dims': '[256, 128, 64]', 'dropout': 0.26413956406639927, 'batch_norm': False, 'lr': 9.059205797726917e-05, 'weight_decay': 4.888318197182529e-07, 'epochs': 135, 'loss': 'mae', 'optimizer': 'adam', 'graph_mode': 'cutoff', 'cutoff': 0.4110505882016593, 'grm_norm': 'cosine', 'self_loops': True, 'use_snp_selection': True, 'num_snps': 52248}. Best is trial 4 with value: 0.2568370581276163.
[I 2025-11-13 09:06:44,063] Trial 20 finished with value: 0.11388249290135781 and parameters: {'model_type': 'graphsage', 'hidden_dims': '[128, 64]', 'dropout': 0.14121394501982423, 'batch_norm': False, 'lr': 0.0009996509584575786, 'weight_decay': 0.00016956498764914208, 'epochs': 43, 'loss': 'mae', 'optimizer': 'adam', 'graph_mode': 'cutoff', 'cutoff': 0.8472101977815059, 'grm_norm': 'none', 'self_loops': False, 'use_snp_selection': True, 'num_snps': 36032}. Best is trial 4 with value: 0.2568370581276163.
[I 2025-11-13 09:09:39,946] Trial 21 finished with value: 0.22936163075624028 and parameters: {'model_type': 'graphsage', 'hidden_dims': '[256, 128]', 'dropout': 0.34157914742154605, 'batch_norm': False, 'lr': 2.3374052438063555e-05, 'weight_decay': 8.986187725856181e-07, 'epochs': 158, 'loss': 'mae', 'optimizer': 'adam', 'graph_mode': 'knn', 'source': 'grm', 'knn_k': 4, 'weighted_edges': False, 'symmetrize_mode': 'union', 'use_snp_selection': True, 'num_snps': 50195}. Best is trial 4 with value: 0.2568370581276163.
[I 2025-11-13 09:11:19,422] Trial 22 finished with value: 0.22624524100084362 and parameters: {'model_type': 'graphsage', 'hidden_dims': '[256, 128]', 'dropout': 0.22400166168268915, 'batch_norm': False, 'lr': 0.00011644846410558237, 'weight_decay': 3.51147872160865e-07, 'epochs': 214, 'loss': 'mae', 'optimizer': 'adam', 'graph_mode': 'cutoff', 'cutoff': 0.68161442474657, 'grm_norm': 'cosine_then_gcn', 'self_loops': True, 'use_snp_selection': True, 'num_snps': 35705}. Best is trial 4 with value: 0.2568370581276163.
[I 2025-11-13 09:13:31,698] Trial 23 finished with value: 0.23117773016477142 and parameters: {'model_type': 'graphsage', 'hidden_dims': '[128, 64]', 'dropout': 0.3508099300247047, 'batch_norm': False, 'lr': 6.091886369673007e-05, 'weight_decay': 1.985983602858351e-06, 'epochs': 167, 'loss': 'mae', 'optimizer': 'adam', 'graph_mode': 'knn', 'source': 'grm', 'knn_k': 4, 'weighted_edges': False, 'symmetrize_mode': 'mutual', 'use_snp_selection': True, 'num_snps': 53424}. Best is trial 4 with value: 0.2568370581276163.
[I 2025-11-13 09:16:26,876] Trial 24 finished with value: 0.21171092883480663 and parameters: {'model_type': 'graphsage', 'hidden_dims': '[256, 128, 64]', 'dropout': 0.45908333246280353, 'batch_norm': False, 'lr': 0.0002994020345184878, 'weight_decay': 7.5861473775496205e-06, 'epochs': 93, 'loss': 'mae', 'optimizer': 'adam', 'graph_mode': 'cutoff', 'cutoff': 0.21723894968142166, 'grm_norm': 'none', 'self_loops': False, 'use_snp_selection': True, 'num_snps': 41984}. Best is trial 4 with value: 0.2568370581276163.
[I 2025-11-13 09:19:40,254] Trial 25 finished with value: 0.230418242896605 and parameters: {'model_type': 'graphsage', 'hidden_dims': '[512, 64]', 'dropout': 0.3974617234169426, 'batch_norm': False, 'lr': 3.8190281669228594e-06, 'weight_decay': 2.6213764752666e-05, 'epochs': 274, 'loss': 'mae', 'optimizer': 'adam', 'graph_mode': 'cutoff', 'cutoff': 0.792936859968657, 'grm_norm': 'cosine_then_gcn', 'self_loops': True, 'use_snp_selection': True, 'num_snps': 47080}. Best is trial 4 with value: 0.2568370581276163.
[I 2025-11-13 09:21:46,294] Trial 26 finished with value: 0.18118278188072579 and parameters: {'model_type': 'graphsage', 'hidden_dims': '[512, 128]', 'dropout': 0.13687560628461465, 'batch_norm': True, 'lr': 3.6581441156292196e-05, 'weight_decay': 1.1835233004621412e-06, 'epochs': 134, 'loss': 'mse', 'optimizer': 'adam', 'graph_mode': 'knn', 'source': 'grm', 'knn_k': 3, 'weighted_edges': True, 'symmetrize_mode': 'union', 'use_snp_selection': False}. Best is trial 4 with value: 0.2568370581276163.
[I 2025-11-13 09:22:49,190] Trial 27 finished with value: 0.20020221035018554 and parameters: {'model_type': 'graphsage', 'hidden_dims': '[128, 64]', 'dropout': 0.20756871511263536, 'batch_norm': False, 'lr': 1.5089498649010225e-05, 'weight_decay': 2.0387851189575205e-07, 'epochs': 204, 'loss': 'mae', 'optimizer': 'adam', 'graph_mode': 'cutoff', 'cutoff': 0.586324543313734, 'grm_norm': 'gcn', 'self_loops': True, 'use_snp_selection': True, 'num_snps': 17483}. Best is trial 4 with value: 0.2568370581276163.
[I 2025-11-13 09:23:44,533] Trial 28 finished with value: 0.15174880208767139 and parameters: {'model_type': 'graphsage', 'hidden_dims': '[256, 128]', 'dropout': 0.3017616374792606, 'batch_norm': False, 'lr': 0.00015569123252135055, 'weight_decay': 7.758214765502741e-06, 'epochs': 306, 'loss': 'mae', 'optimizer': 'adam', 'graph_mode': 'knn', 'source': 'grm', 'knn_k': 10, 'weighted_edges': False, 'symmetrize_mode': 'mutual', 'use_snp_selection': True, 'num_snps': 2538}. Best is trial 4 with value: 0.2568370581276163.
[I 2025-11-13 09:25:27,968] Trial 29 finished with value: 0.12535787549743824 and parameters: {'model_type': 'graphsage', 'hidden_dims': '[256, 128, 64]', 'dropout': 0.18466841871700673, 'batch_norm': True, 'lr': 1.0893781950163453e-06, 'weight_decay': 4.6278096066208265e-05, 'epochs': 240, 'loss': 'mae', 'optimizer': 'adam', 'graph_mode': 'knn', 'source': 'grm', 'knn_k': 1, 'weighted_edges': False, 'symmetrize_mode': 'mutual', 'use_snp_selection': False}. Best is trial 4 with value: 0.2568370581276163.
[I 2025-11-13 09:27:03,215] Trial 30 finished with value: 0.22203022473479866 and parameters: {'model_type': 'graphsage', 'hidden_dims': '[128, 64]', 'dropout': 0.2453081171503465, 'batch_norm': False, 'lr': 6.687048217402231e-05, 'weight_decay': 6.770233322844006e-07, 'epochs': 67, 'loss': 'mae', 'optimizer': 'adam', 'graph_mode': 'cutoff', 'cutoff': 0.4566277914753454, 'grm_norm': 'cosine', 'self_loops': False, 'use_snp_selection': True, 'num_snps': 54636}. Best is trial 4 with value: 0.2568370581276163.
[I 2025-11-13 09:28:42,802] Trial 31 finished with value: 0.209379653914264 and parameters: {'model_type': 'graphsage', 'hidden_dims': '[512, 64]', 'dropout': 0.4562995732517906, 'batch_norm': False, 'lr': 5.888995630256687e-06, 'weight_decay': 1.042794738129197e-07, 'epochs': 100, 'loss': 'mae', 'optimizer': 'adam', 'graph_mode': 'cutoff', 'cutoff': 0.7583988350370092, 'grm_norm': 'none', 'self_loops': False, 'use_snp_selection': True, 'num_snps': 38273}. Best is trial 4 with value: 0.2568370581276163.
[I 2025-11-13 09:30:34,208] Trial 32 finished with value: 0.2325344119786859 and parameters: {'model_type': 'graphsage', 'hidden_dims': '[512, 64]', 'dropout': 0.39932811975696514, 'batch_norm': False, 'lr': 1.302476294678437e-05, 'weight_decay': 1.5687866676035923e-07, 'epochs': 116, 'loss': 'mae', 'optimizer': 'adam', 'graph_mode': 'cutoff', 'cutoff': 0.6352255869555821, 'grm_norm': 'none', 'self_loops': False, 'use_snp_selection': True, 'num_snps': 41261}. Best is trial 4 with value: 0.2568370581276163.
