[I 2025-11-03 13:44:31,851] Trial 123 finished with value: 0.01117019889759274 and parameters: {'model_type': 'gcn', 'hidden_dims': '[512, 256]', 'dropout': 0.5391079871384944, 'batch_norm': False, 'lr': 5.616398118036716e-05, 'weight_decay': 0.0003554750133123993, 'epochs': 118, 'loss': 'mse', 'optimizer': 'adam', 'graph_mode': 'off', 'use_snp_selection': False}. Best is trial 30 with value: 0.07188646269394335.
[I 2025-11-03 13:44:34,057] Trial 124 finished with value: 0.025705098431056766 and parameters: {'model_type': 'gcn', 'hidden_dims': '[512, 256]', 'dropout': 0.49715045973178257, 'batch_norm': True, 'lr': 7.184079531899612e-05, 'weight_decay': 2.1860748253856683e-05, 'epochs': 253, 'loss': 'mse', 'optimizer': 'adam', 'graph_mode': 'off', 'use_snp_selection': False}. Best is trial 30 with value: 0.07188646269394335.
[I 2025-11-03 13:44:35,422] Trial 125 finished with value: -0.019783238629635654 and parameters: {'model_type': 'gcn', 'hidden_dims': '[256, 128]', 'dropout': 0.474006339890507, 'batch_norm': False, 'lr': 3.11759943852397e-05, 'weight_decay': 0.0004787913213613858, 'epochs': 227, 'loss': 'mse', 'optimizer': 'adam', 'graph_mode': 'off', 'use_snp_selection': False}. Best is trial 30 with value: 0.07188646269394335.
[I 2025-11-03 13:44:36,647] Trial 126 finished with value: 0.011390013121494116 and parameters: {'model_type': 'gcn', 'hidden_dims': '[256, 128, 64]', 'dropout': 0.5187990564412532, 'batch_norm': False, 'lr': 4.4217068941764814e-05, 'weight_decay': 6.830724804675804e-07, 'epochs': 151, 'loss': 'mse', 'optimizer': 'adam', 'graph_mode': 'off', 'use_snp_selection': False}. Best is trial 30 with value: 0.07188646269394335.
[I 2025-11-03 13:44:39,253] Trial 127 finished with value: 0.018083276119184637 and parameters: {'model_type': 'gcn', 'hidden_dims': '[512, 256]', 'dropout': 0.40643902906365753, 'batch_norm': True, 'lr': 0.00017661808583554068, 'weight_decay': 1.1527661670975882e-05, 'epochs': 274, 'loss': 'mse', 'optimizer': 'adam', 'graph_mode': 'off', 'use_snp_selection': True, 'num_snps': 42863}. Best is trial 30 with value: 0.07188646269394335.
[I 2025-11-03 13:44:40,491] Trial 128 finished with value: 0.05152557942568102 and parameters: {'model_type': 'gcn', 'hidden_dims': '[256, 128]', 'dropout': 0.44367113812419234, 'batch_norm': False, 'lr': 6.220118214193265e-05, 'weight_decay': 4.3924076133295094e-06, 'epochs': 186, 'loss': 'mse', 'optimizer': 'adam', 'graph_mode': 'off', 'use_snp_selection': False}. Best is trial 30 with value: 0.07188646269394335.
[I 2025-11-03 13:44:42,466] Trial 129 finished with value: -0.010295823826519057 and parameters: {'model_type': 'gcn', 'hidden_dims': '[256, 128]', 'dropout': 0.43077957340828144, 'batch_norm': True, 'lr': 6.09604581855459e-05, 'weight_decay': 2.3376082661399197e-06, 'epochs': 194, 'loss': 'mse', 'optimizer': 'adam', 'graph_mode': 'off', 'use_snp_selection': True, 'num_snps': 46669}. Best is trial 30 with value: 0.07188646269394335.
[I 2025-11-03 13:44:44,002] Trial 130 finished with value: -0.02894910587818296 and parameters: {'model_type': 'gcn', 'hidden_dims': '[256, 128]', 'dropout': 0.44081480080415925, 'batch_norm': False, 'lr': 2.4801863002709932e-05, 'weight_decay': 4.885593289727683e-06, 'epochs': 268, 'loss': 'mse', 'optimizer': 'adam', 'graph_mode': 'off', 'use_snp_selection': False}. Best is trial 30 with value: 0.07188646269394335.
[I 2025-11-03 13:44:45,203] Trial 131 finished with value: -0.0005586253633769744 and parameters: {'model_type': 'gcn', 'hidden_dims': '[256, 128]', 'dropout': 0.45258179143301763, 'batch_norm': False, 'lr': 3.752039525096902e-05, 'weight_decay': 4.229529533259902e-06, 'epochs': 177, 'loss': 'mse', 'optimizer': 'adam', 'graph_mode': 'off', 'use_snp_selection': False}. Best is trial 30 with value: 0.07188646269394335.
[I 2025-11-03 13:44:46,402] Trial 132 finished with value: 0.01196355962432726 and parameters: {'model_type': 'gcn', 'hidden_dims': '[256, 128]', 'dropout': 0.4674666333854768, 'batch_norm': False, 'lr': 4.8814226600158875e-05, 'weight_decay': 7.046013928103835e-06, 'epochs': 182, 'loss': 'mse', 'optimizer': 'adam', 'graph_mode': 'off', 'use_snp_selection': False}. Best is trial 30 with value: 0.07188646269394335.
[I 2025-11-03 13:44:47,728] Trial 133 finished with value: -0.04167501905271512 and parameters: {'model_type': 'gcn', 'hidden_dims': '[256, 128]', 'dropout': 0.4864841075511316, 'batch_norm': False, 'lr': 7.016928026364153e-05, 'weight_decay': 2.8301193225009956e-05, 'epochs': 214, 'loss': 'mse', 'optimizer': 'adam', 'graph_mode': 'off', 'use_snp_selection': False}. Best is trial 30 with value: 0.07188646269394335.
[I 2025-11-03 13:44:49,129] Trial 134 finished with value: -0.013154611213457708 and parameters: {'model_type': 'gcn', 'hidden_dims': '[256, 128, 64]', 'dropout': 0.5569112275800842, 'batch_norm': False, 'lr': 5.80331139033292e-05, 'weight_decay': 1.3046209626072111e-05, 'epochs': 188, 'loss': 'mse', 'optimizer': 'adam', 'graph_mode': 'off', 'use_snp_selection': False}. Best is trial 30 with value: 0.07188646269394335.
[I 2025-11-03 13:44:50,334] Trial 135 finished with value: 0.0209643366742376 and parameters: {'model_type': 'gcn', 'hidden_dims': '[256, 128]', 'dropout': 0.3919329331059797, 'batch_norm': False, 'lr': 8.946107789829994e-05, 'weight_decay': 3.0515352633807934e-06, 'epochs': 171, 'loss': 'mse', 'optimizer': 'adam', 'graph_mode': 'off', 'use_snp_selection': False}. Best is trial 30 with value: 0.07188646269394335.
[I 2025-11-03 13:44:51,540] Trial 136 finished with value: 0.025950913873076405 and parameters: {'model_type': 'gcn', 'hidden_dims': '[256, 128]', 'dropout': 0.4455940634075618, 'batch_norm': False, 'lr': 4.3065725806587665e-05, 'weight_decay': 0.00017602146163805423, 'epochs': 144, 'loss': 'mse', 'optimizer': 'adam', 'graph_mode': 'off', 'use_snp_selection': True, 'num_snps': 24550}. Best is trial 30 with value: 0.07188646269394335.
[I 2025-11-03 13:44:52,680] Trial 137 finished with value: -0.01834829828296736 and parameters: {'model_type': 'gcn', 'hidden_dims': '[256, 128, 64]', 'dropout': 0.5972288896983091, 'batch_norm': False, 'lr': 2.091642441057741e-06, 'weight_decay': 0.0002999350477628024, 'epochs': 133, 'loss': 'mse', 'optimizer': 'adam', 'graph_mode': 'off', 'use_snp_selection': False}. Best is trial 30 with value: 0.07188646269394335.
[I 2025-11-03 13:44:53,691] Trial 138 finished with value: -0.044415159128338065 and parameters: {'model_type': 'gcn', 'hidden_dims': '[128, 64]', 'dropout': 0.4584455935876152, 'batch_norm': True, 'lr': 7.31324758382247e-05, 'weight_decay': 2.2494986389368158e-07, 'epochs': 203, 'loss': 'mse', 'optimizer': 'adam', 'graph_mode': 'off', 'use_snp_selection': True, 'num_snps': 6738}. Best is trial 30 with value: 0.07188646269394335.
[I 2025-11-03 13:44:55,763] Trial 139 finished with value: 0.0010398681208430354 and parameters: {'model_type': 'gcn', 'hidden_dims': '[512, 128]', 'dropout': 0.505090005474218, 'batch_norm': False, 'lr': 3.259041882006061e-05, 'weight_decay': 5.906743197799924e-06, 'epochs': 240, 'loss': 'mse', 'optimizer': 'adam', 'graph_mode': 'off', 'use_snp_selection': False}. Best is trial 30 with value: 0.07188646269394335.
[I 2025-11-03 13:44:56,900] Trial 140 finished with value: -0.04339460605159334 and parameters: {'model_type': 'gcn', 'hidden_dims': '[256, 128]', 'dropout': 0.5286092492096958, 'batch_norm': True, 'lr': 7.629139996356251e-06, 'weight_decay': 1.00223803119148e-05, 'epochs': 160, 'loss': 'mse', 'optimizer': 'adam', 'graph_mode': 'off', 'use_snp_selection': False}. Best is trial 30 with value: 0.07188646269394335.
[I 2025-11-03 13:44:57,988] Trial 141 finished with value: -0.02005760926530476 and parameters: {'model_type': 'gcn', 'hidden_dims': '[256, 128, 64]', 'dropout': 0.4255277296121504, 'batch_norm': False, 'lr': 3.978584439402468e-06, 'weight_decay': 0.0001529477292526039, 'epochs': 144, 'loss': 'mse', 'optimizer': 'adam', 'graph_mode': 'off', 'use_snp_selection': True, 'num_snps': 13635}. Best is trial 30 with value: 0.07188646269394335.
[I 2025-11-03 13:44:59,043] Trial 142 finished with value: -0.0054644818526953885 and parameters: {'model_type': 'gcn', 'hidden_dims': '[256, 128, 64]', 'dropout': 0.4684130241604717, 'batch_norm': False, 'lr': 2.5028692177342757e-06, 'weight_decay': 1.7489938507143e-05, 'epochs': 154, 'loss': 'mse', 'optimizer': 'adam', 'graph_mode': 'off', 'use_snp_selection': True, 'num_snps': 10648}. Best is trial 30 with value: 0.07188646269394335.
[I 2025-11-03 13:45:00,188] Trial 143 finished with value: 0.039899700727773775 and parameters: {'model_type': 'gcn', 'hidden_dims': '[256, 128, 64]', 'dropout': 0.48035084050713384, 'batch_norm': False, 'lr': 1.8336278404002778e-06, 'weight_decay': 0.00022857597610079257, 'epochs': 129, 'loss': 'mse', 'optimizer': 'adam', 'graph_mode': 'off', 'use_snp_selection': True, 'num_snps': 18464}. Best is trial 30 with value: 0.07188646269394335.
[I 2025-11-03 13:45:01,316] Trial 144 finished with value: -0.02331455142546842 and parameters: {'model_type': 'gcn', 'hidden_dims': '[256, 128, 64]', 'dropout': 0.4824207957843828, 'batch_norm': False, 'lr': 1.5255662519646004e-06, 'weight_decay': 4.0498784746605864e-05, 'epochs': 124, 'loss': 'mse', 'optimizer': 'adam', 'graph_mode': 'off', 'use_snp_selection': True, 'num_snps': 18169}. Best is trial 30 with value: 0.07188646269394335.
[I 2025-11-03 13:45:02,216] Trial 145 finished with value: -0.045040349146732564 and parameters: {'model_type': 'gcn', 'hidden_dims': '[256, 128, 64]', 'dropout': 0.4997829011105864, 'batch_norm': False, 'lr': 5.121260511826755e-05, 'weight_decay': 0.0002477873227127343, 'epochs': 112, 'loss': 'mse', 'optimizer': 'adam', 'graph_mode': 'off', 'use_snp_selection': True, 'num_snps': 8130}. Best is trial 30 with value: 0.07188646269394335.
[I 2025-11-03 13:45:03,358] Trial 146 finished with value: 0.007868627404048456 and parameters: {'model_type': 'gcn', 'hidden_dims': '[512, 256]', 'dropout': 0.47788896085310417, 'batch_norm': False, 'lr': 1.0701313055163501e-05, 'weight_decay': 8.342636484909132e-07, 'epochs': 138, 'loss': 'mse', 'optimizer': 'adam', 'graph_mode': 'off', 'use_snp_selection': True, 'num_snps': 15912}. Best is trial 30 with value: 0.07188646269394335.
[I 2025-11-03 13:45:04,282] Trial 147 finished with value: -0.009972900592468917 and parameters: {'model_type': 'gcn', 'hidden_dims': '[256, 128]', 'dropout': 0.4624946709597064, 'batch_norm': False, 'lr': 1.8784177380653647e-06, 'weight_decay': 0.00041119972082069567, 'epochs': 120, 'loss': 'mse', 'optimizer': 'adam', 'graph_mode': 'off', 'use_snp_selection': True, 'num_snps': 13632}. Best is trial 30 with value: 0.07188646269394335.
[I 2025-11-03 13:45:05,736] Trial 148 finished with value: -0.007246627366527909 and parameters: {'model_type': 'gcn', 'hidden_dims': '[512, 64]', 'dropout': 0.5149628686003603, 'batch_norm': True, 'lr': 6.243971284771711e-05, 'weight_decay': 1.7684993667953986e-06, 'epochs': 128, 'loss': 'mae', 'optimizer': 'adam', 'graph_mode': 'off', 'use_snp_selection': False}. Best is trial 30 with value: 0.07188646269394335.
[I 2025-11-03 13:45:06,863] Trial 149 finished with value: -0.029695644552938254 and parameters: {'model_type': 'gcn', 'hidden_dims': '[256, 128, 64]', 'dropout': 0.5737971297017225, 'batch_norm': False, 'lr': 3.9174874689797387e-05, 'weight_decay': 1.1523346436370674e-06, 'epochs': 133, 'loss': 'mse', 'optimizer': 'adam', 'graph_mode': 'off', 'use_snp_selection': False}. Best is trial 30 with value: 0.07188646269394335.
[I 2025-11-03 13:45:08,852] Trial 0 finished with value: 0.029483807927794172 and parameters: {'model_type': 'gcn', 'hidden_dims': '[128, 64]', 'dropout': 0.199031432379812, 'batch_norm': True, 'lr': 1.8408544111075837e-06, 'weight_decay': 5.5136510071208614e-05, 'epochs': 336, 'loss': 'mae', 'optimizer': 'adam', 'graph_mode': 'off', 'use_snp_selection': True, 'num_snps': 43862}. Best is trial 0 with value: 0.029483807927794172.
[I 2025-11-03 13:45:10,198] Trial 1 finished with value: 0.05370528265140279 and parameters: {'model_type': 'gcn', 'hidden_dims': '[256, 128]', 'dropout': 0.4370668075331726, 'batch_norm': True, 'lr': 7.133471581159139e-05, 'weight_decay': 1.128633586803549e-05, 'epochs': 242, 'loss': 'mae', 'optimizer': 'adam', 'graph_mode': 'off', 'use_snp_selection': False}. Best is trial 1 with value: 0.05370528265140279.
[I 2025-11-03 13:45:11,229] Trial 2 finished with value: -0.011020536159768314 and parameters: {'model_type': 'gcn', 'hidden_dims': '[256, 128, 64]', 'dropout': 0.41314357415569625, 'batch_norm': False, 'lr': 3.952233718592101e-06, 'weight_decay': 0.00026754769258252603, 'epochs': 149, 'loss': 'mse', 'optimizer': 'adam', 'graph_mode': 'off', 'use_snp_selection': True, 'num_snps': 11571}. Best is trial 1 with value: 0.05370528265140279.
[I 2025-11-03 13:45:13,469] Trial 3 finished with value: 0.02116748523649926 and parameters: {'model_type': 'gcn', 'hidden_dims': '[512, 64]', 'dropout': 0.5938127374509361, 'batch_norm': False, 'lr': 5.67704586114731e-06, 'weight_decay': 2.4518087630137052e-05, 'epochs': 320, 'loss': 'mae', 'optimizer': 'adam', 'graph_mode': 'off', 'use_snp_selection': False}. Best is trial 1 with value: 0.05370528265140279.
[I 2025-11-03 13:45:15,565] Trial 4 finished with value: 0.0432352334100736 and parameters: {'model_type': 'gcn', 'hidden_dims': '[512, 128]', 'dropout': 0.25746343592134413, 'batch_norm': True, 'lr': 1.3467657668402788e-06, 'weight_decay': 0.00033087251918647806, 'epochs': 277, 'loss': 'mse', 'optimizer': 'adam', 'graph_mode': 'off', 'use_snp_selection': True, 'num_snps': 36675}. Best is trial 1 with value: 0.05370528265140279.
[I 2025-11-03 13:45:17,139] Trial 5 finished with value: 0.009123984976316935 and parameters: {'model_type': 'gcn', 'hidden_dims': '[512, 64]', 'dropout': 0.38275350994408375, 'batch_norm': True, 'lr': 1.5586664309232824e-06, 'weight_decay': 0.0008227664668621182, 'epochs': 145, 'loss': 'mae', 'optimizer': 'adam', 'graph_mode': 'off', 'use_snp_selection': True, 'num_snps': 32148}. Best is trial 1 with value: 0.05370528265140279.
[I 2025-11-03 13:45:18,301] Trial 6 finished with value: 0.07366458681252444 and parameters: {'model_type': 'gcn', 'hidden_dims': '[256, 128]', 'dropout': 0.3930109900265879, 'batch_norm': False, 'lr': 4.892964372128395e-05, 'weight_decay': 1.5809549317992182e-06, 'epochs': 199, 'loss': 'mse', 'optimizer': 'adam', 'graph_mode': 'off', 'use_snp_selection': False}. Best is trial 6 with value: 0.07366458681252444.
[I 2025-11-03 13:45:19,459] Trial 7 finished with value: 0.07269052107430601 and parameters: {'model_type': 'gcn', 'hidden_dims': '[512, 256]', 'dropout': 0.15343979219678458, 'batch_norm': True, 'lr': 6.234003099047341e-05, 'weight_decay': 3.894760610535477e-07, 'epochs': 97, 'loss': 'mse', 'optimizer': 'adam', 'graph_mode': 'off', 'use_snp_selection': False}. Best is trial 6 with value: 0.07366458681252444.
[I 2025-11-03 13:45:21,665] Trial 8 finished with value: 0.11031182953158142 and parameters: {'model_type': 'gcn', 'hidden_dims': '[512, 128]', 'dropout': 0.10743001231661406, 'batch_norm': True, 'lr': 0.00023728538449271062, 'weight_decay': 1.7629071578048637e-05, 'epochs': 312, 'loss': 'mae', 'optimizer': 'adam', 'graph_mode': 'off', 'use_snp_selection': False}. Best is trial 8 with value: 0.11031182953158142.
[I 2025-11-03 13:45:23,204] Trial 9 finished with value: 0.10788242965321464 and parameters: {'model_type': 'gcn', 'hidden_dims': '[512, 64]', 'dropout': 0.14505336736221927, 'batch_norm': True, 'lr': 5.8619638388111826e-05, 'weight_decay': 6.200156172669308e-07, 'epochs': 175, 'loss': 'mse', 'optimizer': 'adam', 'graph_mode': 'off', 'use_snp_selection': False}. Best is trial 8 with value: 0.11031182953158142.
[I 2025-11-03 13:45:24,224] Trial 10 finished with value: 0.004941818233961084 and parameters: {'model_type': 'gcn', 'hidden_dims': '[512, 128]', 'dropout': 0.2800030442581858, 'batch_norm': False, 'lr': 0.0004919806695968257, 'weight_decay': 2.9953888095455486e-06, 'epochs': 55, 'loss': 'mae', 'optimizer': 'adam', 'graph_mode': 'off', 'use_snp_selection': False}. Best is trial 8 with value: 0.11031182953158142.
[I 2025-11-03 13:45:25,999] Trial 11 finished with value: 0.11149408466299254 and parameters: {'model_type': 'gcn', 'hidden_dims': '[512, 128]', 'dropout': 0.10095648685224448, 'batch_norm': True, 'lr': 0.0003411435764085616, 'weight_decay': 1.2045055692919657e-07, 'epochs': 216, 'loss': 'mse', 'optimizer': 'adam', 'graph_mode': 'off', 'use_snp_selection': False}. Best is trial 11 with value: 0.11149408466299254.
[I 2025-11-03 13:45:27,930] Trial 12 finished with value: 0.11778099585309726 and parameters: {'model_type': 'gcn', 'hidden_dims': '[512, 128]', 'dropout': 0.10344600881777158, 'batch_norm': True, 'lr': 0.0006674532614549997, 'weight_decay': 1.3081036432574914e-07, 'epochs': 255, 'loss': 'mae', 'optimizer': 'adam', 'graph_mode': 'off', 'use_snp_selection': False}. Best is trial 12 with value: 0.11778099585309726.
[I 2025-11-03 13:45:29,774] Trial 13 finished with value: 0.11823333910063544 and parameters: {'model_type': 'gcn', 'hidden_dims': '[512, 128]', 'dropout': 0.22096278001553593, 'batch_norm': True, 'lr': 0.0005692918571972218, 'weight_decay': 1.0885943577911259e-07, 'epochs': 236, 'loss': 'mse', 'optimizer': 'adam', 'graph_mode': 'off', 'use_snp_selection': False}. Best is trial 13 with value: 0.11823333910063544.
[I 2025-11-03 13:45:31,839] Trial 14 finished with value: 0.12641061034865247 and parameters: {'model_type': 'gcn', 'hidden_dims': '[512, 128]', 'dropout': 0.23392465516112823, 'batch_norm': True, 'lr': 0.0008794534911796285, 'weight_decay': 1.0444671845585217e-07, 'epochs': 272, 'loss': 'mse', 'optimizer': 'adam', 'graph_mode': 'off', 'use_snp_selection': False}. Best is trial 14 with value: 0.12641061034865247.
[I 2025-11-03 13:45:33,092] Trial 15 finished with value: 0.10526893239176255 and parameters: {'model_type': 'gcn', 'hidden_dims': '[128, 64]', 'dropout': 0.2916837780303359, 'batch_norm': True, 'lr': 0.000157625962509664, 'weight_decay': 4.644448443591828e-07, 'epochs': 291, 'loss': 'mse', 'optimizer': 'adam', 'graph_mode': 'off', 'use_snp_selection': False}. Best is trial 14 with value: 0.12641061034865247.
[I 2025-11-03 13:45:34,640] Trial 16 finished with value: 0.10039984961087134 and parameters: {'model_type': 'gcn', 'hidden_dims': '[256, 128, 64]', 'dropout': 0.21743834760566724, 'batch_norm': True, 'lr': 0.0008766188067383982, 'weight_decay': 1.4951197996686294e-06, 'epochs': 240, 'loss': 'mse', 'optimizer': 'adam', 'graph_mode': 'off', 'use_snp_selection': False}. Best is trial 14 with value: 0.12641061034865247.
[I 2025-11-03 13:45:37,104] Trial 17 finished with value: 0.041389405607913474 and parameters: {'model_type': 'gcn', 'hidden_dims': '[512, 256]', 'dropout': 0.32888830259108426, 'batch_norm': True, 'lr': 1.3781379594767287e-05, 'weight_decay': 1.197477380119548e-07, 'epochs': 349, 'loss': 'mse', 'optimizer': 'adam', 'graph_mode': 'off', 'use_snp_selection': False}. Best is trial 14 with value: 0.12641061034865247.
[I 2025-11-03 13:45:39,867] Trial 18 finished with value: 0.09893225503870608 and parameters: {'model_type': 'gcn', 'hidden_dims': '[512, 128]', 'dropout': 0.5098431992326697, 'batch_norm': False, 'lr': 0.00017079026537562808, 'weight_decay': 4.109412643182285e-06, 'epochs': 282, 'loss': 'mse', 'optimizer': 'adam', 'graph_mode': 'off', 'use_snp_selection': True, 'num_snps': 58241}. Best is trial 14 with value: 0.12641061034865247.
[I 2025-11-03 13:45:41,639] Trial 19 finished with value: 0.10235796092598307 and parameters: {'model_type': 'gcn', 'hidden_dims': '[512, 128]', 'dropout': 0.2294914574481478, 'batch_norm': True, 'lr': 2.4061745589344274e-05, 'weight_decay': 2.7141958802400986e-07, 'epochs': 217, 'loss': 'mse', 'optimizer': 'adam', 'graph_mode': 'off', 'use_snp_selection': False}. Best is trial 14 with value: 0.12641061034865247.
[I 2025-11-03 13:45:43,178] Trial 20 finished with value: 0.08861270502585653 and parameters: {'model_type': 'gcn', 'hidden_dims': '[512, 128]', 'dropout': 0.33178778871423825, 'batch_norm': True, 'lr': 0.00012813071333233692, 'weight_decay': 1.039768756569982e-06, 'epochs': 179, 'loss': 'mse', 'optimizer': 'adam', 'graph_mode': 'off', 'use_snp_selection': False}. Best is trial 14 with value: 0.12641061034865247.
[I 2025-11-03 13:45:45,132] Trial 21 finished with value: 0.11334611108734283 and parameters: {'model_type': 'gcn', 'hidden_dims': '[512, 128]', 'dropout': 0.1709984287528028, 'batch_norm': True, 'lr': 0.0005335745327152824, 'weight_decay': 1.0380534727677032e-07, 'epochs': 255, 'loss': 'mae', 'optimizer': 'adam', 'graph_mode': 'off', 'use_snp_selection': False}. Best is trial 14 with value: 0.12641061034865247.
[I 2025-11-03 13:45:47,214] Trial 22 finished with value: 0.11071509896015787 and parameters: {'model_type': 'gcn', 'hidden_dims': '[512, 128]', 'dropout': 0.194573629418887, 'batch_norm': True, 'lr': 0.0009559383405685856, 'weight_decay': 2.3175554059542297e-07, 'epochs': 262, 'loss': 'mae', 'optimizer': 'adam', 'graph_mode': 'off', 'use_snp_selection': False}. Best is trial 14 with value: 0.12641061034865247.
[I 2025-11-03 13:45:49,389] Trial 23 finished with value: 0.11695266729231271 and parameters: {'model_type': 'gcn', 'hidden_dims': '[512, 128]', 'dropout': 0.23922899848993967, 'batch_norm': True, 'lr': 0.0004953988093227476, 'weight_decay': 2.1141119102433459e-07, 'epochs': 294, 'loss': 'mae', 'optimizer': 'adam', 'graph_mode': 'off', 'use_snp_selection': False}. Best is trial 14 with value: 0.12641061034865247.
