[I 2025-11-03 12:42:33,979] Trial 37 finished with value: 0.02747893987800723 and parameters: {'model_type': 'gcn', 'hidden_dims': '[512, 64]', 'dropout': 0.27658355713991206, 'batch_norm': False, 'lr': 0.0006533571082865512, 'weight_decay': 1.9266169821228256e-06, 'epochs': 148, 'loss': 'mae', 'optimizer': 'adam', 'graph_mode': 'knn', 'source': 'grm', 'knn_k': 9, 'weighted_edges': True, 'symmetrize_mode': 'mutual', 'use_snp_selection': True, 'num_snps': 15344}. Best is trial 10 with value: 0.08432973395887666.
[I 2025-11-03 12:42:36,709] Trial 38 finished with value: 0.0414356451099456 and parameters: {'model_type': 'gcn', 'hidden_dims': '[256, 128, 64]', 'dropout': 0.1494035386019554, 'batch_norm': True, 'lr': 0.00019549481995276277, 'weight_decay': 2.927852242994435e-07, 'epochs': 321, 'loss': 'mae', 'optimizer': 'adam', 'graph_mode': 'knn', 'source': 'grm', 'knn_k': 7, 'weighted_edges': True, 'symmetrize_mode': 'union', 'use_snp_selection': False}. Best is trial 10 with value: 0.08432973395887666.
[I 2025-11-03 12:42:40,939] Trial 39 finished with value: -0.0020879699559979725 and parameters: {'model_type': 'gcn', 'hidden_dims': '[512, 256]', 'dropout': 0.34060336085056736, 'batch_norm': False, 'lr': 0.00031739480112366207, 'weight_decay': 7.462713279495199e-07, 'epochs': 259, 'loss': 'mse', 'optimizer': 'adam', 'graph_mode': 'cutoff', 'cutoff': 0.8982975816958216, 'grm_norm': 'cosine_then_gcn', 'self_loops': True, 'use_snp_selection': True, 'num_snps': 58379}. Best is trial 10 with value: 0.08432973395887666.
[I 2025-11-03 12:42:43,082] Trial 40 finished with value: 0.0024686909799273137 and parameters: {'model_type': 'gcn', 'hidden_dims': '[128, 64]', 'dropout': 0.37764418267144423, 'batch_norm': True, 'lr': 3.2752227994139336e-05, 'weight_decay': 1.5092761311008303e-07, 'epochs': 348, 'loss': 'mae', 'optimizer': 'adam', 'graph_mode': 'knn', 'source': 'grm', 'knn_k': 3, 'weighted_edges': True, 'symmetrize_mode': 'union', 'use_snp_selection': False}. Best is trial 10 with value: 0.08432973395887666.
[I 2025-11-03 12:42:45,001] Trial 41 finished with value: 0.056508076095449576 and parameters: {'model_type': 'gcn', 'hidden_dims': '[128, 64]', 'dropout': 0.2304753105688288, 'batch_norm': True, 'lr': 0.0008496584546842231, 'weight_decay': 3.555732006584107e-07, 'epochs': 293, 'loss': 'mse', 'optimizer': 'adam', 'graph_mode': 'knn', 'source': 'grm', 'knn_k': 1, 'weighted_edges': True, 'symmetrize_mode': 'union', 'use_snp_selection': False}. Best is trial 10 with value: 0.08432973395887666.
[I 2025-11-03 12:42:46,863] Trial 42 finished with value: 0.08246176814992262 and parameters: {'model_type': 'gcn', 'hidden_dims': '[128, 64]', 'dropout': 0.2558514407154441, 'batch_norm': True, 'lr': 0.0005124368736238332, 'weight_decay': 1.9481388684019355e-07, 'epochs': 275, 'loss': 'mse', 'optimizer': 'adam', 'graph_mode': 'knn', 'source': 'grm', 'knn_k': 1, 'weighted_edges': True, 'symmetrize_mode': 'union', 'use_snp_selection': False}. Best is trial 10 with value: 0.08432973395887666.
[I 2025-11-03 12:42:48,715] Trial 43 finished with value: 0.04368343519109398 and parameters: {'model_type': 'gcn', 'hidden_dims': '[128, 64]', 'dropout': 0.3033137560619694, 'batch_norm': True, 'lr': 0.0003945801369884492, 'weight_decay': 1.8825300952454804e-07, 'epochs': 272, 'loss': 'mse', 'optimizer': 'adam', 'graph_mode': 'knn', 'source': 'grm', 'knn_k': 1, 'weighted_edges': False, 'symmetrize_mode': 'union', 'use_snp_selection': False}. Best is trial 10 with value: 0.08432973395887666.
[I 2025-11-03 12:42:49,934] Trial 44 finished with value: 0.05041281501953869 and parameters: {'model_type': 'gcn', 'hidden_dims': '[128, 64]', 'dropout': 0.25848766503625226, 'batch_norm': True, 'lr': 0.000514821310702586, 'weight_decay': 1.1173850396736139e-07, 'epochs': 69, 'loss': 'mse', 'optimizer': 'adam', 'graph_mode': 'knn', 'source': 'grm', 'knn_k': 2, 'weighted_edges': True, 'symmetrize_mode': 'mutual', 'use_snp_selection': False}. Best is trial 10 with value: 0.08432973395887666.
[I 2025-11-03 12:42:51,954] Trial 45 finished with value: 0.032732882644125966 and parameters: {'model_type': 'gcn', 'hidden_dims': '[256, 128]', 'dropout': 0.17800907583565342, 'batch_norm': True, 'lr': 0.00012160602215355933, 'weight_decay': 5.351110388180581e-07, 'epochs': 242, 'loss': 'mse', 'optimizer': 'adam', 'graph_mode': 'cutoff', 'cutoff': 0.4585737354176531, 'grm_norm': 'cosine', 'self_loops': False, 'use_snp_selection': False}. Best is trial 10 with value: 0.08432973395887666.
[I 2025-11-03 12:42:54,393] Trial 46 finished with value: 0.09113089337527672 and parameters: {'model_type': 'gcn', 'hidden_dims': '[512, 256]', 'dropout': 0.2795241077637787, 'batch_norm': True, 'lr': 0.00024112163128644758, 'weight_decay': 0.00010362277217763107, 'epochs': 200, 'loss': 'mse', 'optimizer': 'adam', 'graph_mode': 'knn', 'source': 'grm', 'knn_k': 1, 'weighted_edges': True, 'symmetrize_mode': 'union', 'use_snp_selection': False}. Best is trial 46 with value: 0.09113089337527672.
[I 2025-11-03 12:42:56,835] Trial 47 finished with value: 0.017428510741178998 and parameters: {'model_type': 'gcn', 'hidden_dims': '[512, 256]', 'dropout': 0.2160238468275615, 'batch_norm': True, 'lr': 0.00019702174424528017, 'weight_decay': 4.695137116175952e-05, 'epochs': 197, 'loss': 'mse', 'optimizer': 'adam', 'graph_mode': 'knn', 'source': 'grm', 'knn_k': 6, 'weighted_edges': True, 'symmetrize_mode': 'mutual', 'use_snp_selection': False}. Best is trial 46 with value: 0.09113089337527672.
[I 2025-11-03 12:42:59,910] Trial 48 finished with value: 0.0006034214148345423 and parameters: {'model_type': 'gcn', 'hidden_dims': '[512, 256]', 'dropout': 0.31056704639396077, 'batch_norm': False, 'lr': 0.0005292695974962006, 'weight_decay': 7.3210151418956895e-06, 'epochs': 169, 'loss': 'mse', 'optimizer': 'adam', 'graph_mode': 'knn', 'source': 'grm', 'knn_k': 1, 'weighted_edges': False, 'symmetrize_mode': 'union', 'use_snp_selection': True, 'num_snps': 42595}. Best is trial 46 with value: 0.09113089337527672.
[I 2025-11-03 12:43:01,989] Trial 49 finished with value: 0.052819932164454325 and parameters: {'model_type': 'gcn', 'hidden_dims': '[512, 256]', 'dropout': 0.28011641150014954, 'batch_norm': True, 'lr': 0.0006857228510113446, 'weight_decay': 9.187132155288084e-05, 'epochs': 128, 'loss': 'mse', 'optimizer': 'adam', 'graph_mode': 'knn', 'source': 'grm', 'knn_k': 2, 'weighted_edges': True, 'symmetrize_mode': 'union', 'use_snp_selection': False}. Best is trial 46 with value: 0.09113089337527672.
[I 2025-11-03 12:43:03,857] Trial 50 finished with value: -0.01361269462916578 and parameters: {'model_type': 'gcn', 'hidden_dims': '[512, 128]', 'dropout': 0.2541508322661316, 'batch_norm': True, 'lr': 0.0003522693890176647, 'weight_decay': 0.00028915306274007095, 'epochs': 105, 'loss': 'mse', 'optimizer': 'adam', 'graph_mode': 'cutoff', 'cutoff': 0.20628834676422192, 'grm_norm': 'none', 'self_loops': True, 'use_snp_selection': False}. Best is trial 46 with value: 0.09113089337527672.
[I 2025-11-03 12:43:06,628] Trial 51 finished with value: 0.08293429521647482 and parameters: {'model_type': 'gcn', 'hidden_dims': '[512, 256]', 'dropout': 0.27601839760866836, 'batch_norm': True, 'lr': 0.0002597789278527508, 'weight_decay': 1.9847360404599852e-05, 'epochs': 257, 'loss': 'mse', 'optimizer': 'adam', 'graph_mode': 'knn', 'source': 'grm', 'knn_k': 1, 'weighted_edges': True, 'symmetrize_mode': 'union', 'use_snp_selection': False}. Best is trial 46 with value: 0.09113089337527672.
[I 2025-11-03 12:43:09,250] Trial 52 finished with value: 0.05617401775815943 and parameters: {'model_type': 'gcn', 'hidden_dims': '[512, 256]', 'dropout': 0.20355927669048113, 'batch_norm': True, 'lr': 0.0002558825245102271, 'weight_decay': 1.9100175328337393e-05, 'epochs': 231, 'loss': 'mse', 'optimizer': 'adam', 'graph_mode': 'knn', 'source': 'grm', 'knn_k': 1, 'weighted_edges': True, 'symmetrize_mode': 'union', 'use_snp_selection': False}. Best is trial 46 with value: 0.09113089337527672.
[I 2025-11-03 12:43:11,764] Trial 53 finished with value: 0.07915285908152055 and parameters: {'model_type': 'gcn', 'hidden_dims': '[512, 256]', 'dropout': 0.27008986300367244, 'batch_norm': True, 'lr': 0.0001971419126854773, 'weight_decay': 3.698321725654287e-05, 'epochs': 212, 'loss': 'mse', 'optimizer': 'adam', 'graph_mode': 'knn', 'source': 'grm', 'knn_k': 1, 'weighted_edges': True, 'symmetrize_mode': 'union', 'use_snp_selection': False}. Best is trial 46 with value: 0.09113089337527672.
[I 2025-11-03 12:43:14,269] Trial 54 finished with value: 0.06949380854210721 and parameters: {'model_type': 'gcn', 'hidden_dims': '[512, 256]', 'dropout': 0.26505271686449605, 'batch_norm': True, 'lr': 0.0007119752061547387, 'weight_decay': 3.0665282779136416e-05, 'epochs': 211, 'loss': 'mse', 'optimizer': 'adam', 'graph_mode': 'knn', 'source': 'grm', 'knn_k': 1, 'weighted_edges': True, 'symmetrize_mode': 'union', 'use_snp_selection': False}. Best is trial 46 with value: 0.09113089337527672.
[I 2025-11-03 12:43:16,580] Trial 55 finished with value: 0.04436984509066414 and parameters: {'model_type': 'gcn', 'hidden_dims': '[512, 256]', 'dropout': 0.24290371360380733, 'batch_norm': True, 'lr': 0.0004569346728449494, 'weight_decay': 1.2769982484529133e-05, 'epochs': 176, 'loss': 'mse', 'optimizer': 'adam', 'graph_mode': 'knn', 'source': 'grm', 'knn_k': 2, 'weighted_edges': True, 'symmetrize_mode': 'union', 'use_snp_selection': False}. Best is trial 46 with value: 0.09113089337527672.
[I 2025-11-03 12:43:19,345] Trial 56 finished with value: 0.03404537217383468 and parameters: {'model_type': 'gcn', 'hidden_dims': '[512, 256]', 'dropout': 0.28953913809707954, 'batch_norm': True, 'lr': 0.00028641688501830235, 'weight_decay': 0.00011519738346002545, 'epochs': 253, 'loss': 'mse', 'optimizer': 'adam', 'graph_mode': 'knn', 'source': 'grm', 'knn_k': 3, 'weighted_edges': True, 'symmetrize_mode': 'union', 'use_snp_selection': False}. Best is trial 46 with value: 0.09113089337527672.
[I 2025-11-03 12:43:21,701] Trial 57 finished with value: 0.056366359405053475 and parameters: {'model_type': 'gcn', 'hidden_dims': '[512, 256]', 'dropout': 0.35261705861592707, 'batch_norm': True, 'lr': 7.156665588231997e-05, 'weight_decay': 3.3970236753693915e-05, 'epochs': 185, 'loss': 'mse', 'optimizer': 'adam', 'graph_mode': 'knn', 'source': 'grm', 'knn_k': 1, 'weighted_edges': True, 'symmetrize_mode': 'union', 'use_snp_selection': False}. Best is trial 46 with value: 0.09113089337527672.
[I 2025-11-03 12:43:24,273] Trial 58 finished with value: 0.020363229078303468 and parameters: {'model_type': 'gcn', 'hidden_dims': '[512, 256]', 'dropout': 0.3251444842790845, 'batch_norm': True, 'lr': 4.582401794323047e-05, 'weight_decay': 4.979078000869688e-05, 'epochs': 221, 'loss': 'mse', 'optimizer': 'adam', 'graph_mode': 'knn', 'source': 'grm', 'knn_k': 2, 'weighted_edges': True, 'symmetrize_mode': 'mutual', 'use_snp_selection': False}. Best is trial 46 with value: 0.09113089337527672.
[I 2025-11-03 12:43:26,431] Trial 59 finished with value: 0.022921138243938946 and parameters: {'model_type': 'gcn', 'hidden_dims': '[512, 256]', 'dropout': 0.2711359992266854, 'batch_norm': True, 'lr': 0.00017027223858888675, 'weight_decay': 0.00018540602706285038, 'epochs': 151, 'loss': 'mse', 'optimizer': 'adam', 'graph_mode': 'knn', 'source': 'grm', 'knn_k': 1, 'weighted_edges': False, 'symmetrize_mode': 'union', 'use_snp_selection': False}. Best is trial 46 with value: 0.09113089337527672.
[I 2025-11-03 12:43:28,573] Trial 60 finished with value: -0.009116753547338263 and parameters: {'model_type': 'gcn', 'hidden_dims': '[512, 256]', 'dropout': 0.2120899125851953, 'batch_norm': False, 'lr': 0.00011802715946054272, 'weight_decay': 9.025106159296379e-05, 'epochs': 206, 'loss': 'mse', 'optimizer': 'adam', 'graph_mode': 'knn', 'source': 'grm', 'knn_k': 3, 'weighted_edges': True, 'symmetrize_mode': 'union', 'use_snp_selection': True, 'num_snps': 19019}. Best is trial 46 with value: 0.09113089337527672.
[I 2025-11-03 12:43:31,103] Trial 61 finished with value: 0.06430176079395136 and parameters: {'model_type': 'gcn', 'hidden_dims': '[256, 128, 64]', 'dropout': 0.30891549737961854, 'batch_norm': True, 'lr': 0.000222445039780089, 'weight_decay': 8.279352770125945e-06, 'epochs': 287, 'loss': 'mse', 'optimizer': 'adam', 'graph_mode': 'knn', 'source': 'grm', 'knn_k': 1, 'weighted_edges': True, 'symmetrize_mode': 'union', 'use_snp_selection': False}. Best is trial 46 with value: 0.09113089337527672.
[I 2025-11-03 12:43:33,965] Trial 62 finished with value: 0.06435487820008716 and parameters: {'model_type': 'gcn', 'hidden_dims': '[512, 64]', 'dropout': 0.294793752093867, 'batch_norm': True, 'lr': 0.00016241311753915926, 'weight_decay': 1.3119087691008242e-05, 'epochs': 274, 'loss': 'mse', 'optimizer': 'adam', 'graph_mode': 'knn', 'source': 'grm', 'knn_k': 1, 'weighted_edges': True, 'symmetrize_mode': 'union', 'use_snp_selection': False}. Best is trial 46 with value: 0.09113089337527672.
[I 2025-11-03 12:43:37,049] Trial 63 finished with value: 0.04680685865401637 and parameters: {'model_type': 'gcn', 'hidden_dims': '[512, 128]', 'dropout': 0.25151289237798574, 'batch_norm': True, 'lr': 0.00033946853825188127, 'weight_decay': 2.629704824229948e-05, 'epochs': 308, 'loss': 'mae', 'optimizer': 'adam', 'graph_mode': 'knn', 'source': 'grm', 'knn_k': 2, 'weighted_edges': True, 'symmetrize_mode': 'union', 'use_snp_selection': False}. Best is trial 46 with value: 0.09113089337527672.
[I 2025-11-03 12:43:39,757] Trial 64 finished with value: 0.08133921436992385 and parameters: {'model_type': 'gcn', 'hidden_dims': '[512, 64]', 'dropout': 0.31734187192919905, 'batch_norm': True, 'lr': 0.00021963812075163008, 'weight_decay': 3.976603044170743e-05, 'epochs': 247, 'loss': 'mse', 'optimizer': 'adam', 'graph_mode': 'knn', 'source': 'grm', 'knn_k': 1, 'weighted_edges': True, 'symmetrize_mode': 'union', 'use_snp_selection': False}. Best is trial 46 with value: 0.09113089337527672.
[I 2025-11-03 12:43:41,532] Trial 65 finished with value: 0.0732560315501505 and parameters: {'model_type': 'gcn', 'hidden_dims': '[128, 64]', 'dropout': 0.33898223058559385, 'batch_norm': True, 'lr': 0.0002726864325010003, 'weight_decay': 6.501042201627033e-05, 'epochs': 246, 'loss': 'mse', 'optimizer': 'adam', 'graph_mode': 'knn', 'source': 'grm', 'knn_k': 1, 'weighted_edges': True, 'symmetrize_mode': 'union', 'use_snp_selection': False}. Best is trial 46 with value: 0.09113089337527672.
[I 2025-11-03 12:43:44,311] Trial 66 finished with value: 0.030561869566163007 and parameters: {'model_type': 'gcn', 'hidden_dims': '[512, 64]', 'dropout': 0.2743453466624456, 'batch_norm': True, 'lr': 0.0004238110011955579, 'weight_decay': 3.7506009122367985e-05, 'epochs': 258, 'loss': 'mse', 'optimizer': 'adam', 'graph_mode': 'knn', 'source': 'grm', 'knn_k': 2, 'weighted_edges': True, 'symmetrize_mode': 'union', 'use_snp_selection': False}. Best is trial 46 with value: 0.09113089337527672.
[I 2025-11-03 12:43:46,942] Trial 67 finished with value: -0.00762674249796806 and parameters: {'model_type': 'gcn', 'hidden_dims': '[512, 256]', 'dropout': 0.3213906681719107, 'batch_norm': True, 'lr': 2.865433062445272e-06, 'weight_decay': 1.6588051561175093e-05, 'epochs': 233, 'loss': 'mse', 'optimizer': 'adam', 'graph_mode': 'knn', 'source': 'grm', 'knn_k': 1, 'weighted_edges': True, 'symmetrize_mode': 'union', 'use_snp_selection': False}. Best is trial 46 with value: 0.09113089337527672.
[I 2025-11-03 12:43:48,803] Trial 68 finished with value: 0.02353437481097356 and parameters: {'model_type': 'gcn', 'hidden_dims': '[256, 128]', 'dropout': 0.23118762424946948, 'batch_norm': True, 'lr': 8.413330711421579e-05, 'weight_decay': 0.0005080411820775811, 'epochs': 204, 'loss': 'mse', 'optimizer': 'adam', 'graph_mode': 'cutoff', 'cutoff': 0.7364324640933693, 'grm_norm': 'cosine_then_gcn', 'self_loops': True, 'use_snp_selection': False}. Best is trial 46 with value: 0.09113089337527672.
[I 2025-11-03 12:43:51,621] Trial 69 finished with value: 0.04994325932320369 and parameters: {'model_type': 'gcn', 'hidden_dims': '[512, 64]', 'dropout': 0.359353937976583, 'batch_norm': True, 'lr': 0.00014366981778914562, 'weight_decay': 0.0001351387955821194, 'epochs': 263, 'loss': 'mse', 'optimizer': 'adam', 'graph_mode': 'knn', 'source': 'grm', 'knn_k': 5, 'weighted_edges': True, 'symmetrize_mode': 'union', 'use_snp_selection': False}. Best is trial 46 with value: 0.09113089337527672.
[I 2025-11-03 12:43:54,185] Trial 70 finished with value: 0.031206093327809006 and parameters: {'model_type': 'gcn', 'hidden_dims': '[512, 64]', 'dropout': 0.10807424517359379, 'batch_norm': True, 'lr': 0.0005969694809583231, 'weight_decay': 6.289400201740062e-06, 'epochs': 221, 'loss': 'mse', 'optimizer': 'adam', 'graph_mode': 'knn', 'source': 'grm', 'knn_k': 2, 'weighted_edges': True, 'symmetrize_mode': 'union', 'use_snp_selection': False}. Best is trial 46 with value: 0.09113089337527672.
[I 2025-11-03 12:43:55,957] Trial 71 finished with value: 0.05286692293521358 and parameters: {'model_type': 'gcn', 'hidden_dims': '[128, 64]', 'dropout': 0.3997156594972144, 'batch_norm': True, 'lr': 0.00027588430687699187, 'weight_decay': 6.387283156804587e-05, 'epochs': 245, 'loss': 'mse', 'optimizer': 'adam', 'graph_mode': 'knn', 'source': 'grm', 'knn_k': 1, 'weighted_edges': True, 'symmetrize_mode': 'union', 'use_snp_selection': False}. Best is trial 46 with value: 0.09113089337527672.
[I 2025-11-03 12:43:57,744] Trial 72 finished with value: 0.06112543610330401 and parameters: {'model_type': 'gcn', 'hidden_dims': '[128, 64]', 'dropout': 0.33888772374397297, 'batch_norm': True, 'lr': 0.00023544504484148302, 'weight_decay': 8.666855010579641e-05, 'epochs': 250, 'loss': 'mse', 'optimizer': 'adam', 'graph_mode': 'knn', 'source': 'grm', 'knn_k': 1, 'weighted_edges': True, 'symmetrize_mode': 'union', 'use_snp_selection': False}. Best is trial 46 with value: 0.09113089337527672.
[I 2025-11-03 12:43:59,482] Trial 73 finished with value: 0.06866426223525787 and parameters: {'model_type': 'gcn', 'hidden_dims': '[128, 64]', 'dropout': 0.37425913911159403, 'batch_norm': True, 'lr': 0.00048381715020839097, 'weight_decay': 4.204080546561102e-05, 'epochs': 235, 'loss': 'mse', 'optimizer': 'adam', 'graph_mode': 'knn', 'source': 'grm', 'knn_k': 1, 'weighted_edges': True, 'symmetrize_mode': 'union', 'use_snp_selection': False}. Best is trial 46 with value: 0.09113089337527672.
[I 2025-11-03 12:44:01,353] Trial 74 finished with value: 0.061797480081720715 and parameters: {'model_type': 'gcn', 'hidden_dims': '[128, 64]', 'dropout': 0.2980669201160609, 'batch_norm': True, 'lr': 0.0003188846960411912, 'weight_decay': 2.394841386413355e-05, 'epochs': 277, 'loss': 'mse', 'optimizer': 'adam', 'graph_mode': 'knn', 'source': 'grm', 'knn_k': 1, 'weighted_edges': True, 'symmetrize_mode': 'union', 'use_snp_selection': False}. Best is trial 46 with value: 0.09113089337527672.
[I 2025-11-03 12:44:03,260] Trial 75 finished with value: -0.06879293211334897 and parameters: {'model_type': 'gcn', 'hidden_dims': '[128, 64]', 'dropout': 0.337268591561586, 'batch_norm': True, 'lr': 9.981496178984296e-06, 'weight_decay': 7.047417671702547e-05, 'epochs': 286, 'loss': 'mse', 'optimizer': 'adam', 'graph_mode': 'knn', 'source': 'grm', 'knn_k': 2, 'weighted_edges': True, 'symmetrize_mode': 'union', 'use_snp_selection': False}. Best is trial 46 with value: 0.09113089337527672.
[I 2025-11-03 12:44:05,877] Trial 76 finished with value: 0.05365228474939218 and parameters: {'model_type': 'gcn', 'hidden_dims': '[256, 128, 64]', 'dropout': 0.31906554742340937, 'batch_norm': True, 'lr': 0.00017538755604485352, 'weight_decay': 0.0001695756303507101, 'epochs': 305, 'loss': 'mse', 'optimizer': 'adam', 'graph_mode': 'knn', 'source': 'grm', 'knn_k': 1, 'weighted_edges': False, 'symmetrize_mode': 'union', 'use_snp_selection': False}. Best is trial 46 with value: 0.09113089337527672.
[I 2025-11-03 12:44:07,317] Trial 77 finished with value: 0.00469307975485545 and parameters: {'model_type': 'gcn', 'hidden_dims': '[512, 64]', 'dropout': 0.2683561968163748, 'batch_norm': True, 'lr': 0.0008208485845953391, 'weight_decay': 6.452679839853512e-05, 'epochs': 25, 'loss': 'mse', 'optimizer': 'adam', 'graph_mode': 'knn', 'source': 'grm', 'knn_k': 2, 'weighted_edges': True, 'symmetrize_mode': 'union', 'use_snp_selection': False}. Best is trial 46 with value: 0.09113089337527672.
[I 2025-11-03 12:44:11,191] Trial 78 finished with value: 0.025533457096517435 and parameters: {'model_type': 'gcn', 'hidden_dims': '[512, 256]', 'dropout': 0.4202040250290876, 'batch_norm': False, 'lr': 0.00011316611133506876, 'weight_decay': 1.7448548977861335e-05, 'epochs': 263, 'loss': 'mae', 'optimizer': 'adam', 'graph_mode': 'knn', 'source': 'grm', 'knn_k': 8, 'weighted_edges': True, 'symmetrize_mode': 'mutual', 'use_snp_selection': True, 'num_snps': 49628}. Best is trial 46 with value: 0.09113089337527672.
[I 2025-11-03 12:44:13,960] Trial 79 finished with value: 0.030721220243132175 and parameters: {'model_type': 'gcn', 'hidden_dims': '[512, 128]', 'dropout': 0.2846332633339291, 'batch_norm': True, 'lr': 0.00041646970774649166, 'weight_decay': 2.6857427274077258e-05, 'epochs': 247, 'loss': 'mse', 'optimizer': 'adam', 'graph_mode': 'knn', 'source': 'grm', 'knn_k': 4, 'weighted_edges': True, 'symmetrize_mode': 'union', 'use_snp_selection': False}. Best is trial 46 with value: 0.09113089337527672.
[I 2025-11-03 12:44:15,635] Trial 80 finished with value: 0.016758111650130154 and parameters: {'model_type': 'gcn', 'hidden_dims': '[128, 64]', 'dropout': 0.5399214938147396, 'batch_norm': True, 'lr': 0.0002951759635613246, 'weight_decay': 1.034467264846459e-05, 'epochs': 222, 'loss': 'mae', 'optimizer': 'adam', 'graph_mode': 'cutoff', 'cutoff': 0.5743609294765462, 'grm_norm': 'gcn', 'self_loops': False, 'use_snp_selection': False}. Best is trial 46 with value: 0.09113089337527672.
