[I 2025-11-12 17:02:13,388] Trial 36 finished with value: 0.2178636277969659 and parameters: {'model_type': 'graphsage', 'hidden_dims': '[128, 64]', 'dropout': 0.2529168652864921, 'batch_norm': True, 'lr': 4.0053718543401826e-05, 'weight_decay': 8.315289885460202e-05, 'epochs': 184, 'loss': 'mae', 'optimizer': 'adam', 'graph_mode': 'knn', 'source': 'grm', 'knn_k': 7, 'weighted_edges': True, 'symmetrize_mode': 'union', 'use_snp_selection': False}. Best is trial 23 with value: 0.2683766351477281.
[I 2025-11-12 17:03:42,674] Trial 37 finished with value: 0.2495485325963597 and parameters: {'model_type': 'graphsage', 'hidden_dims': '[256, 128, 64]', 'dropout': 0.20062571515544705, 'batch_norm': False, 'lr': 0.0003410116430015138, 'weight_decay': 1.703121145769462e-05, 'epochs': 203, 'loss': 'mae', 'optimizer': 'adam', 'graph_mode': 'knn', 'source': 'grm', 'knn_k': 4, 'weighted_edges': False, 'symmetrize_mode': 'mutual', 'use_snp_selection': True, 'num_snps': 27947}. Best is trial 23 with value: 0.2683766351477281.
[I 2025-11-12 17:05:11,271] Trial 38 finished with value: 0.22094851178878022 and parameters: {'model_type': 'graphsage', 'hidden_dims': '[512, 256]', 'dropout': 0.3248830258410096, 'batch_norm': True, 'lr': 1.920266207977738e-05, 'weight_decay': 3.8310002249503905e-07, 'epochs': 89, 'loss': 'mae', 'optimizer': 'adam', 'graph_mode': 'knn', 'source': 'grm', 'knn_k': 10, 'weighted_edges': False, 'symmetrize_mode': 'mutual', 'use_snp_selection': False}. Best is trial 23 with value: 0.2683766351477281.
[I 2025-11-12 17:06:14,889] Trial 39 finished with value: 0.25362804669202976 and parameters: {'model_type': 'graphsage', 'hidden_dims': '[256, 128]', 'dropout': 0.13872909445948275, 'batch_norm': False, 'lr': 0.00017810968918454916, 'weight_decay': 2.950215980737791e-06, 'epochs': 147, 'loss': 'mae', 'optimizer': 'adam', 'graph_mode': 'cutoff', 'cutoff': 0.44366554894928123, 'grm_norm': 'none', 'self_loops': True, 'use_snp_selection': True, 'num_snps': 18787}. Best is trial 23 with value: 0.2683766351477281.
[I 2025-11-12 17:07:16,294] Trial 40 finished with value: 0.246453668509512 and parameters: {'model_type': 'graphsage', 'hidden_dims': '[256, 128]', 'dropout': 0.10354389912427983, 'batch_norm': False, 'lr': 0.0004958695627781877, 'weight_decay': 2.2915786160882178e-06, 'epochs': 147, 'loss': 'mae', 'optimizer': 'adam', 'graph_mode': 'cutoff', 'cutoff': 0.4252443922897383, 'grm_norm': 'none', 'self_loops': True, 'use_snp_selection': True, 'num_snps': 17237}. Best is trial 23 with value: 0.2683766351477281.
[I 2025-11-12 17:08:38,821] Trial 41 finished with value: 0.23424621628408282 and parameters: {'model_type': 'graphsage', 'hidden_dims': '[256, 128]', 'dropout': 0.142785614062595, 'batch_norm': False, 'lr': 0.00015212080750827563, 'weight_decay': 7.107725503763326e-06, 'epochs': 184, 'loss': 'mae', 'optimizer': 'adam', 'graph_mode': 'cutoff', 'cutoff': 0.5609096529027232, 'grm_norm': 'none', 'self_loops': True, 'use_snp_selection': True, 'num_snps': 34032}. Best is trial 23 with value: 0.2683766351477281.
[I 2025-11-12 17:10:08,357] Trial 42 finished with value: 0.2604184425285215 and parameters: {'model_type': 'graphsage', 'hidden_dims': '[256, 128]', 'dropout': 0.20296339999372273, 'batch_norm': False, 'lr': 0.0002213631431617088, 'weight_decay': 3.3864176203436077e-06, 'epochs': 164, 'loss': 'mae', 'optimizer': 'adam', 'graph_mode': 'cutoff', 'cutoff': 0.3123656530360204, 'grm_norm': 'none', 'self_loops': True, 'use_snp_selection': True, 'num_snps': 27072}. Best is trial 23 with value: 0.2683766351477281.
[I 2025-11-12 17:11:02,439] Trial 43 finished with value: 0.25848622841305746 and parameters: {'model_type': 'graphsage', 'hidden_dims': '[256, 128]', 'dropout': 0.12461894349149527, 'batch_norm': False, 'lr': 0.0002171396612746456, 'weight_decay': 2.783916036998392e-06, 'epochs': 56, 'loss': 'mae', 'optimizer': 'adam', 'graph_mode': 'cutoff', 'cutoff': 0.3110332901094398, 'grm_norm': 'none', 'self_loops': True, 'use_snp_selection': True, 'num_snps': 19020}. Best is trial 23 with value: 0.2683766351477281.
[I 2025-11-12 17:12:04,746] Trial 44 finished with value: 0.2583525442405783 and parameters: {'model_type': 'graphsage', 'hidden_dims': '[256, 128]', 'dropout': 0.19114270831579125, 'batch_norm': False, 'lr': 0.0007443393105887943, 'weight_decay': 1.1172202643457014e-06, 'epochs': 59, 'loss': 'mae', 'optimizer': 'adam', 'graph_mode': 'cutoff', 'cutoff': 0.31234157497767534, 'grm_norm': 'none', 'self_loops': True, 'use_snp_selection': True, 'num_snps': 26695}. Best is trial 23 with value: 0.2683766351477281.
[I 2025-11-12 17:13:10,416] Trial 45 finished with value: 0.2576957975041329 and parameters: {'model_type': 'graphsage', 'hidden_dims': '[256, 128]', 'dropout': 0.18651527483366648, 'batch_norm': False, 'lr': 0.0006950676255012106, 'weight_decay': 1.097016372252933e-06, 'epochs': 58, 'loss': 'mae', 'optimizer': 'adam', 'graph_mode': 'cutoff', 'cutoff': 0.29711436289743, 'grm_norm': 'none', 'self_loops': True, 'use_snp_selection': True, 'num_snps': 27690}. Best is trial 23 with value: 0.2683766351477281.
[I 2025-11-12 17:13:58,647] Trial 46 finished with value: 0.2545308518207712 and parameters: {'model_type': 'graphsage', 'hidden_dims': '[256, 128]', 'dropout': 0.2782907853840854, 'batch_norm': True, 'lr': 0.0006760240112400142, 'weight_decay': 3.0313907539094544e-07, 'epochs': 56, 'loss': 'mae', 'optimizer': 'adam', 'graph_mode': 'cutoff', 'cutoff': 0.2622737528303874, 'grm_norm': 'none', 'self_loops': True, 'use_snp_selection': False}. Best is trial 23 with value: 0.2683766351477281.
[I 2025-11-12 17:14:41,860] Trial 47 finished with value: 0.25612905795734103 and parameters: {'model_type': 'graphsage', 'hidden_dims': '[256, 128]', 'dropout': 0.12038144931637725, 'batch_norm': False, 'lr': 0.0002842544436503878, 'weight_decay': 1.4050367851577345e-06, 'epochs': 73, 'loss': 'mae', 'optimizer': 'adam', 'graph_mode': 'cutoff', 'cutoff': 0.3425078543773742, 'grm_norm': 'none', 'self_loops': True, 'use_snp_selection': True, 'num_snps': 6004}. Best is trial 23 with value: 0.2683766351477281.
[I 2025-11-12 17:15:43,680] Trial 48 finished with value: 0.23918699938537752 and parameters: {'model_type': 'graphsage', 'hidden_dims': '[256, 128]', 'dropout': 0.20673475869659277, 'batch_norm': False, 'lr': 0.000889302526938055, 'weight_decay': 7.900528026655586e-07, 'epochs': 102, 'loss': 'mae', 'optimizer': 'adam', 'graph_mode': 'cutoff', 'cutoff': 0.22225105984670146, 'grm_norm': 'none', 'self_loops': True, 'use_snp_selection': True, 'num_snps': 13930}. Best is trial 23 with value: 0.2683766351477281.
[I 2025-11-12 17:16:47,938] Trial 49 finished with value: 0.2611427023690708 and parameters: {'model_type': 'graphsage', 'hidden_dims': '[256, 128]', 'dropout': 0.24148030612571633, 'batch_norm': False, 'lr': 0.0005104095081321276, 'weight_decay': 4.08393204999558e-06, 'epochs': 81, 'loss': 'mae', 'optimizer': 'adam', 'graph_mode': 'cutoff', 'cutoff': 0.34606720367923516, 'grm_norm': 'none', 'self_loops': True, 'use_snp_selection': True, 'num_snps': 25555}. Best is trial 23 with value: 0.2683766351477281.
[I 2025-11-12 17:17:56,384] Trial 50 finished with value: 0.25647898197509994 and parameters: {'model_type': 'graphsage', 'hidden_dims': '[512, 256]', 'dropout': 0.2433396512425068, 'batch_norm': False, 'lr': 0.0004987969311398159, 'weight_decay': 3.7869578302707905e-06, 'epochs': 117, 'loss': 'mae', 'optimizer': 'adam', 'graph_mode': 'cutoff', 'cutoff': 0.3957345207639029, 'grm_norm': 'none', 'self_loops': True, 'use_snp_selection': True, 'num_snps': 18208}. Best is trial 23 with value: 0.2683766351477281.
[I 2025-11-12 17:19:00,155] Trial 51 finished with value: 0.27300220176239537 and parameters: {'model_type': 'graphsage', 'hidden_dims': '[256, 128]', 'dropout': 0.16465587554982167, 'batch_norm': False, 'lr': 0.000385111427305446, 'weight_decay': 2.848811615604602e-06, 'epochs': 80, 'loss': 'mae', 'optimizer': 'adam', 'graph_mode': 'cutoff', 'cutoff': 0.33057674850508495, 'grm_norm': 'none', 'self_loops': True, 'use_snp_selection': True, 'num_snps': 24882}. Best is trial 51 with value: 0.27300220176239537.
[I 2025-11-12 17:19:59,575] Trial 52 finished with value: 0.25706766486292437 and parameters: {'model_type': 'graphsage', 'hidden_dims': '[256, 128]', 'dropout': 0.1633914561623515, 'batch_norm': False, 'lr': 0.0003753681887621122, 'weight_decay': 8.494826204313258e-06, 'epochs': 87, 'loss': 'mae', 'optimizer': 'adam', 'graph_mode': 'cutoff', 'cutoff': 0.3525626073179042, 'grm_norm': 'none', 'self_loops': True, 'use_snp_selection': True, 'num_snps': 20976}. Best is trial 51 with value: 0.27300220176239537.
[I 2025-11-12 17:21:04,320] Trial 53 finished with value: 0.24203678656309427 and parameters: {'model_type': 'graphsage', 'hidden_dims': '[256, 128]', 'dropout': 0.10105272174311469, 'batch_norm': False, 'lr': 0.00020965096900634982, 'weight_decay': 2.930874105461241e-06, 'epochs': 50, 'loss': 'mae', 'optimizer': 'adam', 'graph_mode': 'cutoff', 'cutoff': 0.252127957071758, 'grm_norm': 'none', 'self_loops': True, 'use_snp_selection': True, 'num_snps': 25397}. Best is trial 51 with value: 0.27300220176239537.
[I 2025-11-12 17:22:16,473] Trial 54 finished with value: 0.2617189073832928 and parameters: {'model_type': 'graphsage', 'hidden_dims': '[512, 128]', 'dropout': 0.23119974790873893, 'batch_norm': False, 'lr': 0.00029468579913847755, 'weight_decay': 1.584868330168881e-05, 'epochs': 80, 'loss': 'mae', 'optimizer': 'adam', 'graph_mode': 'cutoff', 'cutoff': 0.3209069981234697, 'grm_norm': 'gcn', 'self_loops': True, 'use_snp_selection': True, 'num_snps': 23810}. Best is trial 51 with value: 0.27300220176239537.
[I 2025-11-12 17:23:34,058] Trial 55 finished with value: 0.10329382721053344 and parameters: {'model_type': 'graphsage', 'hidden_dims': '[512, 128]', 'dropout': 0.2672328944092812, 'batch_norm': False, 'lr': 0.0003181401481168821, 'weight_decay': 1.782526628847433e-05, 'epochs': 78, 'loss': 'mse', 'optimizer': 'adam', 'graph_mode': 'cutoff', 'cutoff': 0.3930185938421627, 'grm_norm': 'gcn', 'self_loops': False, 'use_snp_selection': True, 'num_snps': 29480}. Best is trial 51 with value: 0.27300220176239537.
[I 2025-11-12 17:24:50,574] Trial 56 finished with value: 0.2501284469428305 and parameters: {'model_type': 'graphsage', 'hidden_dims': '[512, 128]', 'dropout': 0.32520998867937856, 'batch_norm': False, 'lr': 0.00042160271003189654, 'weight_decay': 1.4024545094122036e-05, 'epochs': 100, 'loss': 'mae', 'optimizer': 'adam', 'graph_mode': 'cutoff', 'cutoff': 0.3401060166989982, 'grm_norm': 'gcn', 'self_loops': True, 'use_snp_selection': True, 'num_snps': 23645}. Best is trial 51 with value: 0.27300220176239537.
[I 2025-11-12 17:26:25,836] Trial 57 finished with value: 0.05652437422837322 and parameters: {'model_type': 'graphsage', 'hidden_dims': '[512, 128]', 'dropout': 0.23104427655699786, 'batch_norm': False, 'lr': 0.0005298849400426777, 'weight_decay': 2.801675841700031e-05, 'epochs': 82, 'loss': 'mse', 'optimizer': 'adam', 'graph_mode': 'cutoff', 'cutoff': 0.26555768829035076, 'grm_norm': 'gcn', 'self_loops': True, 'use_snp_selection': True, 'num_snps': 31172}. Best is trial 51 with value: 0.27300220176239537.
[I 2025-11-12 17:27:33,420] Trial 58 finished with value: 0.24177775929656162 and parameters: {'model_type': 'graphsage', 'hidden_dims': '[512, 64]', 'dropout': 0.37216474126581917, 'batch_norm': False, 'lr': 8.326289032300458e-06, 'weight_decay': 6.011403105137127e-06, 'epochs': 132, 'loss': 'mae', 'optimizer': 'adam', 'graph_mode': 'cutoff', 'cutoff': 0.3747805152345662, 'grm_norm': 'gcn', 'self_loops': False, 'use_snp_selection': True, 'num_snps': 15984}. Best is trial 51 with value: 0.27300220176239537.
[I 2025-11-12 17:29:02,042] Trial 59 finished with value: 0.15563412818127065 and parameters: {'model_type': 'graphsage', 'hidden_dims': '[512, 128]', 'dropout': 0.2863200141123503, 'batch_norm': True, 'lr': 3.071873673981334e-06, 'weight_decay': 1.7008410747939594e-06, 'epochs': 113, 'loss': 'mse', 'optimizer': 'adam', 'graph_mode': 'cutoff', 'cutoff': 0.4912376497056583, 'grm_norm': 'cosine_then_gcn', 'self_loops': True, 'use_snp_selection': False}. Best is trial 51 with value: 0.27300220176239537.
[I 2025-11-12 17:29:47,824] Trial 60 finished with value: 0.2492092365167023 and parameters: {'model_type': 'graphsage', 'hidden_dims': '[128, 64]', 'dropout': 0.33573394779302024, 'batch_norm': False, 'lr': 2.9016840591946454e-05, 'weight_decay': 4.144304525368628e-06, 'epochs': 68, 'loss': 'mae', 'optimizer': 'adam', 'graph_mode': 'cutoff', 'cutoff': 0.4201019699059135, 'grm_norm': 'cosine', 'self_loops': False, 'use_snp_selection': True, 'num_snps': 10720}. Best is trial 51 with value: 0.27300220176239537.
[I 2025-11-12 17:30:41,725] Trial 61 finished with value: 0.2510239301593733 and parameters: {'model_type': 'graphsage', 'hidden_dims': '[256, 128]', 'dropout': 0.17035168735517764, 'batch_norm': False, 'lr': 0.00022089537149076174, 'weight_decay': 9.072815114804147e-06, 'epochs': 48, 'loss': 'mae', 'optimizer': 'adam', 'graph_mode': 'cutoff', 'cutoff': 0.3135925042401684, 'grm_norm': 'none', 'self_loops': True, 'use_snp_selection': True, 'num_snps': 20378}. Best is trial 51 with value: 0.27300220176239537.
[I 2025-11-12 17:31:42,897] Trial 62 finished with value: 0.2546716857890373 and parameters: {'model_type': 'graphsage', 'hidden_dims': '[256, 128]', 'dropout': 0.15574405965579194, 'batch_norm': False, 'lr': 0.00016633121883231385, 'weight_decay': 2.7023419503711015e-06, 'epochs': 67, 'loss': 'mae', 'optimizer': 'adam', 'graph_mode': 'cutoff', 'cutoff': 0.3072578618301292, 'grm_norm': 'none', 'self_loops': True, 'use_snp_selection': True, 'num_snps': 23451}. Best is trial 51 with value: 0.27300220176239537.
[I 2025-11-12 17:32:47,081] Trial 63 finished with value: 0.2691996528082732 and parameters: {'model_type': 'graphsage', 'hidden_dims': '[512, 64]', 'dropout': 0.20772079461581647, 'batch_norm': False, 'lr': 5.9688498852530446e-05, 'weight_decay': 6.877738599409225e-07, 'epochs': 47, 'loss': 'mae', 'optimizer': 'adam', 'graph_mode': 'cutoff', 'cutoff': 0.3421691184288367, 'grm_norm': 'cosine_then_gcn', 'self_loops': True, 'use_snp_selection': True, 'num_snps': 25433}. Best is trial 51 with value: 0.27300220176239537.
[I 2025-11-12 17:33:54,470] Trial 64 finished with value: 0.2702678014618644 and parameters: {'model_type': 'graphsage', 'hidden_dims': '[512, 64]', 'dropout': 0.20923968183888264, 'batch_norm': False, 'lr': 5.080702647273468e-05, 'weight_decay': 7.000952437772142e-07, 'epochs': 43, 'loss': 'mae', 'optimizer': 'adam', 'graph_mode': 'cutoff', 'cutoff': 0.3592528277854773, 'grm_norm': 'cosine_then_gcn', 'self_loops': True, 'use_snp_selection': True, 'num_snps': 29394}. Best is trial 51 with value: 0.27300220176239537.
[I 2025-11-12 17:35:03,429] Trial 65 finished with value: 0.22504928145791897 and parameters: {'model_type': 'graphsage', 'hidden_dims': '[512, 64]', 'dropout': 0.2543504665070782, 'batch_norm': False, 'lr': 5.90708801308504e-05, 'weight_decay': 6.140130411715802e-07, 'epochs': 40, 'loss': 'mae', 'optimizer': 'adam', 'graph_mode': 'cutoff', 'cutoff': 0.3564477468947027, 'grm_norm': 'cosine_then_gcn', 'self_loops': True, 'use_snp_selection': True, 'num_snps': 31723}. Best is trial 51 with value: 0.27300220176239537.
[I 2025-11-12 17:36:35,348] Trial 66 finished with value: 0.23561751437635756 and parameters: {'model_type': 'graphsage', 'hidden_dims': '[512, 64]', 'dropout': 0.22882963289875152, 'batch_norm': False, 'lr': 3.676025086073718e-05, 'weight_decay': 3.82080461951989e-07, 'epochs': 97, 'loss': 'mse', 'optimizer': 'adam', 'graph_mode': 'cutoff', 'cutoff': 0.7703690132683512, 'grm_norm': 'cosine_then_gcn', 'self_loops': False, 'use_snp_selection': True, 'num_snps': 41174}. Best is trial 51 with value: 0.27300220176239537.
[I 2025-11-12 17:38:23,135] Trial 67 finished with value: 0.26116762144674777 and parameters: {'model_type': 'graphsage', 'hidden_dims': '[512, 64]', 'dropout': 0.17505018556521076, 'batch_norm': False, 'lr': 5.488853542207181e-05, 'weight_decay': 1.9441661078098664e-07, 'epochs': 76, 'loss': 'mae', 'optimizer': 'adam', 'graph_mode': 'cutoff', 'cutoff': 0.46803757819077546, 'grm_norm': 'cosine_then_gcn', 'self_loops': True, 'use_snp_selection': True, 'num_snps': 50188}. Best is trial 51 with value: 0.27300220176239537.
[I 2025-11-12 17:39:58,813] Trial 68 finished with value: 0.23350806985507222 and parameters: {'model_type': 'graphsage', 'hidden_dims': '[512, 64]', 'dropout': 0.1871880932319403, 'batch_norm': False, 'lr': 5.1031474156565925e-05, 'weight_decay': 2.0293967489947037e-07, 'epochs': 47, 'loss': 'mae', 'optimizer': 'adam', 'graph_mode': 'cutoff', 'cutoff': 0.46839423528322893, 'grm_norm': 'cosine_then_gcn', 'self_loops': True, 'use_snp_selection': True, 'num_snps': 52987}. Best is trial 51 with value: 0.27300220176239537.
[I 2025-11-12 17:41:28,063] Trial 69 finished with value: 0.2358857662916066 and parameters: {'model_type': 'graphsage', 'hidden_dims': '[512, 64]', 'dropout': 0.21543934897204325, 'batch_norm': False, 'lr': 1.5201675601510668e-05, 'weight_decay': 1.6410619820125654e-07, 'epochs': 64, 'loss': 'mse', 'optimizer': 'adam', 'graph_mode': 'cutoff', 'cutoff': 0.5213714840205499, 'grm_norm': 'cosine_then_gcn', 'self_loops': False, 'use_snp_selection': True, 'num_snps': 47024}. Best is trial 51 with value: 0.27300220176239537.
[I 2025-11-12 17:43:01,859] Trial 70 finished with value: 0.2437214705259895 and parameters: {'model_type': 'graphsage', 'hidden_dims': '[512, 64]', 'dropout': 0.17432074309887066, 'batch_norm': False, 'lr': 2.440243162650857e-05, 'weight_decay': 2.61971723368273e-07, 'epochs': 75, 'loss': 'mae', 'optimizer': 'adam', 'graph_mode': 'cutoff', 'cutoff': 0.6295768527665287, 'grm_norm': 'cosine_then_gcn', 'self_loops': True, 'use_snp_selection': True, 'num_snps': 48924}. Best is trial 51 with value: 0.27300220176239537.
[I 2025-11-12 17:45:06,651] Trial 71 finished with value: 0.215108739146212 and parameters: {'model_type': 'graphsage', 'hidden_dims': '[512, 64]', 'dropout': 0.238973836751541, 'batch_norm': False, 'lr': 9.421033494949819e-05, 'weight_decay': 7.52821365307556e-07, 'epochs': 84, 'loss': 'mae', 'optimizer': 'adam', 'graph_mode': 'cutoff', 'cutoff': 0.41714061287982085, 'grm_norm': 'cosine_then_gcn', 'self_loops': True, 'use_snp_selection': True, 'num_snps': 55751}. Best is trial 51 with value: 0.27300220176239537.
[I 2025-11-12 17:46:09,844] Trial 72 finished with value: 0.26849969783446614 and parameters: {'model_type': 'graphsage', 'hidden_dims': '[512, 64]', 'dropout': 0.15130375780871458, 'batch_norm': False, 'lr': 0.00013364860148728364, 'weight_decay': 1.0497919538886991e-07, 'epochs': 46, 'loss': 'mae', 'optimizer': 'adam', 'graph_mode': 'cutoff', 'cutoff': 0.3692305774536815, 'grm_norm': 'cosine_then_gcn', 'self_loops': True, 'use_snp_selection': True, 'num_snps': 25114}. Best is trial 51 with value: 0.27300220176239537.
[I 2025-11-12 17:47:15,573] Trial 73 finished with value: 0.2555416764553114 and parameters: {'model_type': 'graphsage', 'hidden_dims': '[512, 64]', 'dropout': 0.14942582872204946, 'batch_norm': False, 'lr': 0.00012750416782112559, 'weight_decay': 1.0404710418724386e-07, 'epochs': 50, 'loss': 'mae', 'optimizer': 'adam', 'graph_mode': 'cutoff', 'cutoff': 0.5930676972433766, 'grm_norm': 'cosine_then_gcn', 'self_loops': True, 'use_snp_selection': True, 'num_snps': 30070}. Best is trial 51 with value: 0.27300220176239537.
[I 2025-11-12 17:48:38,558] Trial 74 finished with value: 0.25429070966364914 and parameters: {'model_type': 'graphsage', 'hidden_dims': '[512, 64]', 'dropout': 0.17710112697439673, 'batch_norm': False, 'lr': 5.976437779870505e-05, 'weight_decay': 1.5175669641053366e-07, 'epochs': 64, 'loss': 'mae', 'optimizer': 'adam', 'graph_mode': 'cutoff', 'cutoff': 0.467681050403915, 'grm_norm': 'cosine_then_gcn', 'self_loops': True, 'use_snp_selection': True, 'num_snps': 37565}. Best is trial 51 with value: 0.27300220176239537.
[I 2025-11-12 17:50:02,941] Trial 75 finished with value: 0.2383014851930037 and parameters: {'model_type': 'graphsage', 'hidden_dims': '[512, 64]', 'dropout': 0.20943668467069862, 'batch_norm': False, 'lr': 3.330657880013389e-05, 'weight_decay': 5.023515565483031e-07, 'epochs': 41, 'loss': 'mae', 'optimizer': 'adam', 'graph_mode': 'cutoff', 'cutoff': 0.39332419376133343, 'grm_norm': 'cosine_then_gcn', 'self_loops': True, 'use_snp_selection': True, 'num_snps': 45526}. Best is trial 51 with value: 0.27300220176239537.
[I 2025-11-12 17:50:56,442] Trial 76 finished with value: 0.24230473644821515 and parameters: {'model_type': 'graphsage', 'hidden_dims': '[512, 64]', 'dropout': 0.41561471588992127, 'batch_norm': True, 'lr': 7.746718124100953e-05, 'weight_decay': 2.6720935464187967e-07, 'epochs': 51, 'loss': 'mae', 'optimizer': 'adam', 'graph_mode': 'cutoff', 'cutoff': 0.4245905721896469, 'grm_norm': 'cosine_then_gcn', 'self_loops': False, 'use_snp_selection': False}. Best is trial 51 with value: 0.27300220176239537.
[I 2025-11-12 17:51:53,315] Trial 77 finished with value: 0.25306017249365703 and parameters: {'model_type': 'graphsage', 'hidden_dims': '[128, 64]', 'dropout': 0.12569908964190993, 'batch_norm': False, 'lr': 4.608353834789679e-05, 'weight_decay': 1.1265104419901103e-07, 'epochs': 71, 'loss': 'mae', 'optimizer': 'adam', 'graph_mode': 'cutoff', 'cutoff': 0.6727608477288274, 'grm_norm': 'cosine_then_gcn', 'self_loops': True, 'use_snp_selection': True, 'num_snps': 32478}. Best is trial 51 with value: 0.27300220176239537.
