[I 2025-10-22 05:55:39,841] Trial 67 finished with value: 0.24813436787854637 and parameters: {'model_type': 'gat', 'hidden_dims': '[512, 128]', 'dropout': 0.41168852726006544, 'batch_norm': False, 'gat_heads': 3, 'gat_attn_dropout': 0.2084507190913181, 'gat_concat_hidden': False, 'lr': 0.0004099250662667102, 'weight_decay': 1.1328476237575182e-05, 'epochs': 70, 'loss': 'mae', 'optimizer': 'adam', 'graph_mode': 'cutoff', 'cutoff': 0.8656103627979582, 'grm_norm': 'cosine_then_gcn', 'self_loops': False}. Best is trial 64 with value: 0.25109730294929067.
[I 2025-10-22 05:56:54,261] Trial 68 finished with value: 0.21268079963264913 and parameters: {'model_type': 'gat', 'hidden_dims': '[512, 128]', 'dropout': 0.27192153611718495, 'batch_norm': False, 'gat_heads': 3, 'gat_attn_dropout': 0.25892719060167435, 'gat_concat_hidden': False, 'lr': 0.00033785662071215077, 'weight_decay': 1.2306551480378466e-05, 'epochs': 70, 'loss': 'mae', 'optimizer': 'adam', 'graph_mode': 'knn', 'source': 'grm', 'knn_k': 3, 'weighted_edges': True, 'symmetrize_mode': 'mutual'}. Best is trial 64 with value: 0.25109730294929067.
[I 2025-10-22 05:58:29,841] Trial 69 finished with value: 0.24698256330599286 and parameters: {'model_type': 'gat', 'hidden_dims': '[512, 128]', 'dropout': 0.3466140197853692, 'batch_norm': False, 'gat_heads': 3, 'gat_attn_dropout': 0.16819767488576962, 'gat_concat_hidden': False, 'lr': 0.0002426893838636519, 'weight_decay': 1.1113303330184072e-06, 'epochs': 97, 'loss': 'mae', 'optimizer': 'adam', 'graph_mode': 'cutoff', 'cutoff': 0.8717808342687255, 'grm_norm': 'none', 'self_loops': False}. Best is trial 64 with value: 0.25109730294929067.
[I 2025-10-22 05:59:21,198] Trial 70 finished with value: 0.16508727452074617 and parameters: {'model_type': 'gat', 'hidden_dims': '[512, 128]', 'dropout': 0.3400424416816139, 'batch_norm': False, 'gat_heads': 3, 'gat_attn_dropout': 0.20453035829812874, 'gat_concat_hidden': False, 'lr': 0.0002526917552341156, 'weight_decay': 1.754075845900265e-07, 'epochs': 45, 'loss': 'mae', 'optimizer': 'adam', 'graph_mode': 'cutoff', 'cutoff': 0.8699059960795946, 'grm_norm': 'none', 'self_loops': False}. Best is trial 64 with value: 0.25109730294929067.
[I 2025-10-22 06:00:55,762] Trial 71 finished with value: 0.23913382069091318 and parameters: {'model_type': 'gat', 'hidden_dims': '[512, 128]', 'dropout': 0.40666866938057145, 'batch_norm': False, 'gat_heads': 3, 'gat_attn_dropout': 0.14352549253106772, 'gat_concat_hidden': False, 'lr': 0.00040433039561449765, 'weight_decay': 1.073459110429071e-06, 'epochs': 96, 'loss': 'mae', 'optimizer': 'adam', 'graph_mode': 'cutoff', 'cutoff': 0.8763454965737475, 'grm_norm': 'none', 'self_loops': False}. Best is trial 64 with value: 0.25109730294929067.
[I 2025-10-22 06:02:26,969] Trial 72 finished with value: 0.23933484133439792 and parameters: {'model_type': 'gat', 'hidden_dims': '[512, 128]', 'dropout': 0.3055423225506835, 'batch_norm': False, 'gat_heads': 3, 'gat_attn_dropout': 0.1833393338293041, 'gat_concat_hidden': False, 'lr': 0.00039664019736546384, 'weight_decay': 1.1209208463077493e-06, 'epochs': 92, 'loss': 'mae', 'optimizer': 'adam', 'graph_mode': 'cutoff', 'cutoff': 0.8724818088403796, 'grm_norm': 'none', 'self_loops': False}. Best is trial 64 with value: 0.25109730294929067.
[I 2025-10-22 06:03:31,639] Trial 73 finished with value: 0.23006824655235786 and parameters: {'model_type': 'gat', 'hidden_dims': '[512, 128]', 'dropout': 0.3039708115627697, 'batch_norm': False, 'gat_heads': 2, 'gat_attn_dropout': 0.19381728693604408, 'gat_concat_hidden': False, 'lr': 0.00041166767496104317, 'weight_decay': 1.0962021705231466e-06, 'epochs': 97, 'loss': 'mae', 'optimizer': 'adam', 'graph_mode': 'cutoff', 'cutoff': 0.8852862739721876, 'grm_norm': 'none', 'self_loops': False}. Best is trial 64 with value: 0.25109730294929067.
[I 2025-10-22 06:04:44,888] Trial 74 finished with value: 0.1425028600875583 and parameters: {'model_type': 'gat', 'hidden_dims': '[512, 128]', 'dropout': 0.27903794765258627, 'batch_norm': False, 'gat_heads': 3, 'gat_attn_dropout': 0.2452003909866719, 'gat_concat_hidden': False, 'lr': 0.0008716811261037235, 'weight_decay': 5.862084326414742e-07, 'epochs': 71, 'loss': 'mae', 'optimizer': 'adam', 'graph_mode': 'cutoff', 'cutoff': 0.8711514654487298, 'grm_norm': 'none', 'self_loops': False}. Best is trial 64 with value: 0.25109730294929067.
[I 2025-10-22 06:06:00,514] Trial 75 finished with value: 0.24396894787029427 and parameters: {'model_type': 'gat', 'hidden_dims': '[512, 128]', 'dropout': 0.3165625754486179, 'batch_norm': False, 'gat_heads': 2, 'gat_attn_dropout': 0.15384270399229036, 'gat_concat_hidden': False, 'lr': 0.0005089553112100198, 'weight_decay': 2.124932667588311e-06, 'epochs': 115, 'loss': 'mae', 'optimizer': 'adam', 'graph_mode': 'cutoff', 'cutoff': 0.7647468737031364, 'grm_norm': 'none', 'self_loops': False}. Best is trial 64 with value: 0.25109730294929067.
[I 2025-10-22 06:06:41,388] Trial 76 finished with value: 0.17786930495610564 and parameters: {'model_type': 'gat', 'hidden_dims': '[512, 128]', 'dropout': 0.32479154523821696, 'batch_norm': False, 'gat_heads': 2, 'gat_attn_dropout': 0.14520711188704222, 'gat_concat_hidden': False, 'lr': 0.0005017649150743776, 'weight_decay': 2.086031579541465e-06, 'epochs': 55, 'loss': 'mae', 'optimizer': 'adam', 'graph_mode': 'cutoff', 'cutoff': 0.7555867054209938, 'grm_norm': 'none', 'self_loops': False}. Best is trial 64 with value: 0.25109730294929067.
[I 2025-10-22 06:07:40,650] Trial 77 finished with value: 0.20315211121803006 and parameters: {'model_type': 'gat', 'hidden_dims': '[512, 128]', 'dropout': 0.3664078157029317, 'batch_norm': False, 'gat_heads': 2, 'gat_attn_dropout': 0.17218380583412124, 'gat_concat_hidden': False, 'lr': 0.000228416906309716, 'weight_decay': 1.2439227236733529e-06, 'epochs': 87, 'loss': 'mse', 'optimizer': 'adam', 'graph_mode': 'cutoff', 'cutoff': 0.7780619767352571, 'grm_norm': 'none', 'self_loops': False}. Best is trial 64 with value: 0.25109730294929067.
[I 2025-10-22 06:08:58,302] Trial 78 finished with value: 0.2541509702392434 and parameters: {'model_type': 'gat', 'hidden_dims': '[512, 128]', 'dropout': 0.4395277635111414, 'batch_norm': False, 'gat_heads': 3, 'gat_attn_dropout': 0.2698795704706948, 'gat_concat_hidden': False, 'lr': 0.0003424315992902487, 'weight_decay': 2.2492527569479425e-06, 'epochs': 76, 'loss': 'mae', 'optimizer': 'adam', 'graph_mode': 'cutoff', 'cutoff': 0.8533885376160153, 'grm_norm': 'none', 'self_loops': False}. Best is trial 78 with value: 0.2541509702392434.
[I 2025-10-22 06:09:41,160] Trial 79 finished with value: -0.005986013312296637 and parameters: {'model_type': 'gat', 'hidden_dims': '[512, 128]', 'dropout': 0.4355453923395942, 'batch_norm': False, 'gat_heads': 1, 'gat_attn_dropout': 0.273142965717392, 'gat_concat_hidden': False, 'lr': 0.00031301655186249526, 'weight_decay': 1.9229308929487113e-06, 'epochs': 114, 'loss': 'mae', 'optimizer': 'adam', 'graph_mode': 'knn', 'source': 'grm', 'knn_k': 10, 'weighted_edges': False, 'symmetrize_mode': 'union'}. Best is trial 78 with value: 0.2541509702392434.
[I 2025-10-22 06:10:57,259] Trial 80 finished with value: 0.2507249551070467 and parameters: {'model_type': 'gat', 'hidden_dims': '[512, 128]', 'dropout': 0.2965670785451745, 'batch_norm': False, 'gat_heads': 3, 'gat_attn_dropout': 0.22959611282829984, 'gat_concat_hidden': False, 'lr': 0.0002938540459293166, 'weight_decay': 7.206326868353423e-07, 'epochs': 74, 'loss': 'mae', 'optimizer': 'adam', 'graph_mode': 'cutoff', 'cutoff': 0.8587415631565398, 'grm_norm': 'none', 'self_loops': False}. Best is trial 78 with value: 0.2541509702392434.
[I 2025-10-22 06:11:58,993] Trial 81 finished with value: 0.23458395476788052 and parameters: {'model_type': 'gat', 'hidden_dims': '[512, 128]', 'dropout': 0.2910963974111055, 'batch_norm': False, 'gat_heads': 3, 'gat_attn_dropout': 0.22813043619643314, 'gat_concat_hidden': False, 'lr': 0.00020964139089982306, 'weight_decay': 5.919963952857949e-07, 'epochs': 57, 'loss': 'mae', 'optimizer': 'adam', 'graph_mode': 'cutoff', 'cutoff': 0.8513763442656402, 'grm_norm': 'none', 'self_loops': False}. Best is trial 78 with value: 0.2541509702392434.
[I 2025-10-22 06:13:19,622] Trial 82 finished with value: 0.2538108250016883 and parameters: {'model_type': 'gat', 'hidden_dims': '[512, 128]', 'dropout': 0.3147868914412328, 'batch_norm': False, 'gat_heads': 3, 'gat_attn_dropout': 0.19268645213714447, 'gat_concat_hidden': False, 'lr': 0.00029972656742990086, 'weight_decay': 2.371156864522439e-06, 'epochs': 79, 'loss': 'mae', 'optimizer': 'adam', 'graph_mode': 'cutoff', 'cutoff': 0.8157129273298104, 'grm_norm': 'none', 'self_loops': False}. Best is trial 78 with value: 0.2541509702392434.
[I 2025-10-22 06:14:38,627] Trial 83 finished with value: 0.24325376514210842 and parameters: {'model_type': 'gat', 'hidden_dims': '[512, 128]', 'dropout': 0.35594769066407306, 'batch_norm': False, 'gat_heads': 3, 'gat_attn_dropout': 0.24754046478058564, 'gat_concat_hidden': False, 'lr': 0.000302001416476924, 'weight_decay': 1.0028076678577892e-05, 'epochs': 77, 'loss': 'mae', 'optimizer': 'adam', 'graph_mode': 'cutoff', 'cutoff': 0.7222662622187521, 'grm_norm': 'none', 'self_loops': False}. Best is trial 78 with value: 0.2541509702392434.
[I 2025-10-22 06:16:43,515] Trial 84 finished with value: 0.2272635746036892 and parameters: {'model_type': 'gat', 'hidden_dims': '[512, 128]', 'dropout': 0.24880640934760634, 'batch_norm': False, 'gat_heads': 3, 'gat_attn_dropout': 0.19731206099856452, 'gat_concat_hidden': False, 'lr': 0.0004900653707913742, 'weight_decay': 1.5352042612264894e-06, 'epochs': 131, 'loss': 'mae', 'optimizer': 'adam', 'graph_mode': 'cutoff', 'cutoff': 0.8108294539627947, 'grm_norm': 'none', 'self_loops': False}. Best is trial 78 with value: 0.2541509702392434.
[I 2025-10-22 06:17:35,923] Trial 85 finished with value: 0.2402111247661209 and parameters: {'model_type': 'gat', 'hidden_dims': '[512, 128]', 'dropout': 0.3200493344863604, 'batch_norm': False, 'gat_heads': 2, 'gat_attn_dropout': 0.29988306373273194, 'gat_concat_hidden': False, 'lr': 0.00025533194096751894, 'weight_decay': 5.885585018453555e-06, 'epochs': 75, 'loss': 'mae', 'optimizer': 'adam', 'graph_mode': 'cutoff', 'cutoff': 0.7972370297031274, 'grm_norm': 'none', 'self_loops': False}. Best is trial 78 with value: 0.2541509702392434.
[I 2025-10-22 06:17:56,827] Trial 86 finished with value: 0.10106694487821437 and parameters: {'model_type': 'gat', 'hidden_dims': '[128, 64]', 'dropout': 0.33212292721384484, 'batch_norm': False, 'gat_heads': 4, 'gat_attn_dropout': 0.21992472539606703, 'gat_concat_hidden': False, 'lr': 0.0008004992381788016, 'weight_decay': 2.218083982095985e-06, 'epochs': 51, 'loss': 'mae', 'optimizer': 'adam', 'graph_mode': 'cutoff', 'cutoff': 0.8247470351201311, 'grm_norm': 'gcn', 'self_loops': False}. Best is trial 78 with value: 0.2541509702392434.
[I 2025-10-22 06:19:52,673] Trial 87 finished with value: 0.24427101412523963 and parameters: {'model_type': 'gat', 'hidden_dims': '[512, 128]', 'dropout': 0.3848343521013558, 'batch_norm': False, 'gat_heads': 4, 'gat_attn_dropout': 0.2643693625884491, 'gat_concat_hidden': False, 'lr': 0.00034639740844597997, 'weight_decay': 5.426083649500532e-06, 'epochs': 85, 'loss': 'mae', 'optimizer': 'adam', 'graph_mode': 'cutoff', 'cutoff': 0.8511999548119396, 'grm_norm': 'none', 'self_loops': False}. Best is trial 78 with value: 0.2541509702392434.
[I 2025-10-22 06:21:24,776] Trial 88 finished with value: 0.24028229144273855 and parameters: {'model_type': 'gat', 'hidden_dims': '[512, 128]', 'dropout': 0.38464282178206155, 'batch_norm': False, 'gat_heads': 4, 'gat_attn_dropout': 0.26083376529380753, 'gat_concat_hidden': False, 'lr': 0.00036675035670962776, 'weight_decay': 2.732800547810276e-07, 'epochs': 65, 'loss': 'mae', 'optimizer': 'adam', 'graph_mode': 'cutoff', 'cutoff': 0.8992444042498388, 'grm_norm': 'none', 'self_loops': False}. Best is trial 78 with value: 0.2541509702392434.
[I 2025-10-22 06:23:04,684] Trial 89 finished with value: 0.2227584311396961 and parameters: {'model_type': 'gat', 'hidden_dims': '[512, 128]', 'dropout': 0.37199045428699784, 'batch_norm': False, 'gat_heads': 3, 'gat_attn_dropout': 0.2961100999534715, 'gat_concat_hidden': False, 'lr': 0.00028893513413174747, 'weight_decay': 9.990640730655696e-06, 'epochs': 102, 'loss': 'mse', 'optimizer': 'adam', 'graph_mode': 'cutoff', 'cutoff': 0.8551380724971511, 'grm_norm': 'none', 'self_loops': False}. Best is trial 78 with value: 0.2541509702392434.
[I 2025-10-22 06:24:02,794] Trial 90 finished with value: 0.23267733685082076 and parameters: {'model_type': 'gat', 'hidden_dims': '[256, 128]', 'dropout': 0.44469098651166733, 'batch_norm': False, 'gat_heads': 4, 'gat_attn_dropout': 0.18681781548969142, 'gat_concat_hidden': False, 'lr': 0.00017811204401193794, 'weight_decay': 3.991594121017036e-06, 'epochs': 85, 'loss': 'mae', 'optimizer': 'adam', 'graph_mode': 'cutoff', 'cutoff': 0.8183195235243595, 'grm_norm': 'none', 'self_loops': False}. Best is trial 78 with value: 0.2541509702392434.
[I 2025-10-22 06:25:52,855] Trial 91 finished with value: 0.20701357206558998 and parameters: {'model_type': 'gat', 'hidden_dims': '[512, 128]', 'dropout': 0.4020746961082966, 'batch_norm': False, 'gat_heads': 3, 'gat_attn_dropout': 0.23195573277022347, 'gat_concat_hidden': False, 'lr': 0.0009816391152710124, 'weight_decay': 2.447373931571111e-06, 'epochs': 114, 'loss': 'mae', 'optimizer': 'adam', 'graph_mode': 'cutoff', 'cutoff': 0.7827514622069488, 'grm_norm': 'none', 'self_loops': False}. Best is trial 78 with value: 0.2541509702392434.
[I 2025-10-22 06:27:52,182] Trial 92 finished with value: 0.2382119749721471 and parameters: {'model_type': 'gat', 'hidden_dims': '[512, 128]', 'dropout': 0.4210358225503845, 'batch_norm': False, 'gat_heads': 4, 'gat_attn_dropout': 0.16268842301549688, 'gat_concat_hidden': False, 'lr': 0.0005234408854950715, 'weight_decay': 5.35883818878886e-06, 'epochs': 88, 'loss': 'mae', 'optimizer': 'adam', 'graph_mode': 'cutoff', 'cutoff': 0.8461325784039322, 'grm_norm': 'none', 'self_loops': False}. Best is trial 78 with value: 0.2541509702392434.
[I 2025-10-22 06:29:12,842] Trial 93 finished with value: 0.2408258613743887 and parameters: {'model_type': 'gat', 'hidden_dims': '[512, 128]', 'dropout': 0.29076069196724613, 'batch_norm': False, 'gat_heads': 3, 'gat_attn_dropout': 0.2697152077382985, 'gat_concat_hidden': False, 'lr': 0.00035548294389806746, 'weight_decay': 1.6543688499142488e-06, 'epochs': 79, 'loss': 'mae', 'optimizer': 'adam', 'graph_mode': 'cutoff', 'cutoff': 0.7511291831901656, 'grm_norm': 'none', 'self_loops': False}. Best is trial 78 with value: 0.2541509702392434.
[I 2025-10-22 06:29:37,571] Trial 94 finished with value: 0.036515449464993834 and parameters: {'model_type': 'gat', 'hidden_dims': '[512, 64]', 'dropout': 0.25476856943452775, 'batch_norm': False, 'gat_heads': 1, 'gat_attn_dropout': 0.2138200381385617, 'gat_concat_hidden': False, 'lr': 0.00021802228586297856, 'weight_decay': 3.541164638213887e-06, 'epochs': 63, 'loss': 'mae', 'optimizer': 'adam', 'graph_mode': 'cutoff', 'cutoff': 0.8326451506209736, 'grm_norm': 'none', 'self_loops': False}. Best is trial 78 with value: 0.2541509702392434.
[I 2025-10-22 06:31:00,477] Trial 95 finished with value: 0.23281261374888582 and parameters: {'model_type': 'gat', 'hidden_dims': '[512, 128]', 'dropout': 0.4604617094342974, 'batch_norm': False, 'gat_heads': 2, 'gat_attn_dropout': 0.12179811499162345, 'gat_concat_hidden': False, 'lr': 0.0004465174840062404, 'weight_decay': 7.695678469238513e-07, 'epochs': 128, 'loss': 'mae', 'optimizer': 'adam', 'graph_mode': 'cutoff', 'cutoff': 0.7997341250296559, 'grm_norm': 'gcn', 'self_loops': False}. Best is trial 78 with value: 0.2541509702392434.
[I 2025-10-22 06:33:32,038] Trial 96 finished with value: 0.2431086951903977 and parameters: {'model_type': 'gat', 'hidden_dims': '[512, 128]', 'dropout': 0.3129186774079605, 'batch_norm': False, 'gat_heads': 4, 'gat_attn_dropout': 0.1580910209689209, 'gat_concat_hidden': False, 'lr': 0.0006045846442506897, 'weight_decay': 2.549499363172331e-06, 'epochs': 116, 'loss': 'mae', 'optimizer': 'adam', 'graph_mode': 'cutoff', 'cutoff': 0.8595951631387415, 'grm_norm': 'none', 'self_loops': False}. Best is trial 78 with value: 0.2541509702392434.
[I 2025-10-22 06:34:40,022] Trial 97 finished with value: 0.25527624717567665 and parameters: {'model_type': 'gat', 'hidden_dims': '[512, 128]', 'dropout': 0.344388198034387, 'batch_norm': False, 'gat_heads': 2, 'gat_attn_dropout': 0.23803672548906596, 'gat_concat_hidden': False, 'lr': 0.00028347122735258433, 'weight_decay': 7.397204960427388e-06, 'epochs': 103, 'loss': 'mae', 'optimizer': 'adam', 'graph_mode': 'cutoff', 'cutoff': 0.8820889418552493, 'grm_norm': 'none', 'self_loops': False}. Best is trial 97 with value: 0.25527624717567665.
[I 2025-10-22 06:36:58,878] Trial 98 finished with value: 0.1976723534960711 and parameters: {'model_type': 'gat', 'hidden_dims': '[512, 128]', 'dropout': 0.3454447747646081, 'batch_norm': False, 'gat_heads': 4, 'gat_attn_dropout': 0.24245707080892243, 'gat_concat_hidden': False, 'lr': 0.000188839539005018, 'weight_decay': 8.976850662197656e-06, 'epochs': 99, 'loss': 'mae', 'optimizer': 'adam', 'graph_mode': 'knn', 'source': 'grm', 'knn_k': 7, 'weighted_edges': False, 'symmetrize_mode': 'union'}. Best is trial 97 with value: 0.25527624717567665.
[I 2025-10-22 06:37:30,227] Trial 99 finished with value: 0.17701144715075556 and parameters: {'model_type': 'gat', 'hidden_dims': '[128, 64]', 'dropout': 0.3609372339381978, 'batch_norm': False, 'gat_heads': 3, 'gat_attn_dropout': 0.25449848083432797, 'gat_concat_hidden': False, 'lr': 0.00029476205077804215, 'weight_decay': 2.4280302561934607e-05, 'epochs': 105, 'loss': 'mae', 'optimizer': 'adam', 'graph_mode': 'cutoff', 'cutoff': 0.8929122985731264, 'grm_norm': 'none', 'self_loops': False}. Best is trial 97 with value: 0.25527624717567665.
[I 2025-10-22 06:38:43,835] Trial 100 finished with value: 0.22806614360785363 and parameters: {'model_type': 'gat', 'hidden_dims': '[512, 128]', 'dropout': 0.3907810797495077, 'batch_norm': False, 'gat_heads': 4, 'gat_attn_dropout': 0.20332583934239115, 'gat_concat_hidden': False, 'lr': 0.0002446186778912292, 'weight_decay': 7.089623322707453e-06, 'epochs': 49, 'loss': 'mae', 'optimizer': 'adam', 'graph_mode': 'cutoff', 'cutoff': 0.8815181393760559, 'grm_norm': 'none', 'self_loops': False}. Best is trial 97 with value: 0.25527624717567665.
[I 2025-10-22 06:39:35,508] Trial 101 finished with value: 0.2065950329061567 and parameters: {'model_type': 'gat', 'hidden_dims': '[512, 128]', 'dropout': 0.4330759136537032, 'batch_norm': False, 'gat_heads': 2, 'gat_attn_dropout': 0.2825605646481303, 'gat_concat_hidden': False, 'lr': 0.0003509935359439604, 'weight_decay': 5.25142573186902e-06, 'epochs': 74, 'loss': 'mae', 'optimizer': 'adam', 'graph_mode': 'cutoff', 'cutoff': 0.8559010381705285, 'grm_norm': 'none', 'self_loops': False}. Best is trial 97 with value: 0.25527624717567665.
[I 2025-10-22 06:40:08,886] Trial 102 finished with value: 0.1773438942917652 and parameters: {'model_type': 'gat', 'hidden_dims': '[512, 128]', 'dropout': 0.34865594126968585, 'batch_norm': False, 'gat_heads': 1, 'gat_attn_dropout': 0.22998037943195584, 'gat_concat_hidden': False, 'lr': 0.000499210289257882, 'weight_decay': 3.953356594772332e-06, 'epochs': 91, 'loss': 'mae', 'optimizer': 'adam', 'graph_mode': 'cutoff', 'cutoff': 0.8205438336912159, 'grm_norm': 'none', 'self_loops': False}. Best is trial 97 with value: 0.25527624717567665.
[I 2025-10-22 06:42:06,796] Trial 103 finished with value: 0.24068092529838095 and parameters: {'model_type': 'gat', 'hidden_dims': '[512, 128]', 'dropout': 0.37831204360432685, 'batch_norm': False, 'gat_heads': 3, 'gat_attn_dropout': 0.1892363489248348, 'gat_concat_hidden': False, 'lr': 0.00026883063693591727, 'weight_decay': 1.767493293208805e-05, 'epochs': 123, 'loss': 'mae', 'optimizer': 'adam', 'graph_mode': 'cutoff', 'cutoff': 0.8378696988658165, 'grm_norm': 'none', 'self_loops': False}. Best is trial 97 with value: 0.25527624717567665.
[I 2025-10-22 06:43:03,182] Trial 104 finished with value: 0.23491607654821006 and parameters: {'model_type': 'gat', 'hidden_dims': '[512, 128]', 'dropout': 0.3280168220796325, 'batch_norm': False, 'gat_heads': 2, 'gat_attn_dropout': 0.21435255909243253, 'gat_concat_hidden': False, 'lr': 0.000457734646215473, 'weight_decay': 4.729052882674402e-07, 'epochs': 82, 'loss': 'mae', 'optimizer': 'adam', 'graph_mode': 'cutoff', 'cutoff': 0.8120907179499282, 'grm_norm': 'none', 'self_loops': False}. Best is trial 97 with value: 0.25527624717567665.
[I 2025-10-22 06:44:34,695] Trial 105 finished with value: 0.22660024560501948 and parameters: {'model_type': 'gat', 'hidden_dims': '[512, 128]', 'dropout': 0.3973511337538721, 'batch_norm': False, 'gat_heads': 2, 'gat_attn_dropout': 0.31712598702933686, 'gat_concat_hidden': False, 'lr': 0.0005649882716866735, 'weight_decay': 1.301750907317366e-06, 'epochs': 144, 'loss': 'mae', 'optimizer': 'adam', 'graph_mode': 'cutoff', 'cutoff': 0.7705144791780423, 'grm_norm': 'cosine_then_gcn', 'self_loops': False}. Best is trial 97 with value: 0.25527624717567665.
[I 2025-10-22 06:46:29,394] Trial 106 finished with value: 0.15429053926767983 and parameters: {'model_type': 'gat', 'hidden_dims': '[512, 128]', 'dropout': 0.4161511864413328, 'batch_norm': False, 'gat_heads': 3, 'gat_attn_dropout': 0.1262130521178907, 'gat_concat_hidden': False, 'lr': 0.0006674371948829652, 'weight_decay': 6.5816370976291015e-06, 'epochs': 112, 'loss': 'mae', 'optimizer': 'adam', 'graph_mode': 'cutoff', 'cutoff': 0.24442895435545403, 'grm_norm': 'none', 'self_loops': False}. Best is trial 97 with value: 0.25527624717567665.
