[I 2025-11-03 14:00:23,773] Trial 94 finished with value: 0.04939395160667692 and parameters: {'model_type': 'gcn', 'hidden_dims': '[512, 256]', 'dropout': 0.20808165880316407, 'batch_norm': True, 'lr': 0.00020452658496390605, 'weight_decay': 6.818961873398679e-07, 'epochs': 159, 'loss': 'mae', 'optimizer': 'adam', 'graph_mode': 'off', 'use_snp_selection': False}. Best is trial 53 with value: 0.07059634841970504.
[I 2025-11-03 14:00:25,683] Trial 95 finished with value: 0.05624176430096664 and parameters: {'model_type': 'gcn', 'hidden_dims': '[512, 256]', 'dropout': 0.22091612404758162, 'batch_norm': True, 'lr': 0.000613779839719493, 'weight_decay': 1.3712385302162585e-05, 'epochs': 230, 'loss': 'mae', 'optimizer': 'adam', 'graph_mode': 'off', 'use_snp_selection': False}. Best is trial 53 with value: 0.07059634841970504.
[I 2025-11-03 14:00:26,993] Trial 96 finished with value: 0.0340315791259403 and parameters: {'model_type': 'gcn', 'hidden_dims': '[256, 128, 64]', 'dropout': 0.2458067713377821, 'batch_norm': True, 'lr': 0.00032220330793675706, 'weight_decay': 1.3979963415929518e-06, 'epochs': 118, 'loss': 'mae', 'optimizer': 'adam', 'graph_mode': 'off', 'use_snp_selection': True, 'num_snps': 27656}. Best is trial 53 with value: 0.07059634841970504.
[I 2025-11-03 14:00:28,484] Trial 97 finished with value: 0.046552124348478816 and parameters: {'model_type': 'gcn', 'hidden_dims': '[512, 256]', 'dropout': 0.444219701841803, 'batch_norm': True, 'lr': 0.00040877852942014774, 'weight_decay': 3.970760993099048e-06, 'epochs': 153, 'loss': 'mae', 'optimizer': 'adam', 'graph_mode': 'off', 'use_snp_selection': False}. Best is trial 53 with value: 0.07059634841970504.
[I 2025-11-03 14:00:29,893] Trial 98 finished with value: 0.04245916070717759 and parameters: {'model_type': 'gcn', 'hidden_dims': '[256, 128]', 'dropout': 0.27025463390951515, 'batch_norm': True, 'lr': 0.0001488360394420446, 'weight_decay': 3.5030941788830755e-05, 'epochs': 240, 'loss': 'mae', 'optimizer': 'adam', 'graph_mode': 'off', 'use_snp_selection': False}. Best is trial 53 with value: 0.07059634841970504.
[I 2025-11-03 14:00:30,948] Trial 99 finished with value: 0.05337435554366873 and parameters: {'model_type': 'gcn', 'hidden_dims': '[128, 64]', 'dropout': 0.3729124715949265, 'batch_norm': True, 'lr': 0.0007825922307418139, 'weight_decay': 9.904764608605582e-06, 'epochs': 209, 'loss': 'mse', 'optimizer': 'adam', 'graph_mode': 'off', 'use_snp_selection': False}. Best is trial 53 with value: 0.07059634841970504.
[I 2025-11-03 14:00:32,383] Trial 100 finished with value: 0.028944121847332766 and parameters: {'model_type': 'gcn', 'hidden_dims': '[512, 256]', 'dropout': 0.5789412781652895, 'batch_norm': False, 'lr': 3.5730428001863624e-05, 'weight_decay': 1.5343129825554663e-07, 'epochs': 140, 'loss': 'mae', 'optimizer': 'adam', 'graph_mode': 'off', 'use_snp_selection': False}. Best is trial 53 with value: 0.07059634841970504.
[I 2025-11-03 14:00:34,730] Trial 101 finished with value: 0.03284258142558879 and parameters: {'model_type': 'gcn', 'hidden_dims': '[512, 256]', 'dropout': 0.25801231288769555, 'batch_norm': True, 'lr': 2.3340640392092748e-05, 'weight_decay': 0.00030918663901849657, 'epochs': 338, 'loss': 'mae', 'optimizer': 'adam', 'graph_mode': 'off', 'use_snp_selection': False}. Best is trial 53 with value: 0.07059634841970504.
[I 2025-11-03 14:00:37,102] Trial 102 finished with value: 0.04984145719456778 and parameters: {'model_type': 'gcn', 'hidden_dims': '[512, 256]', 'dropout': 0.249405070324527, 'batch_norm': True, 'lr': 2.745352810561941e-05, 'weight_decay': 3.0279909781892135e-05, 'epochs': 350, 'loss': 'mae', 'optimizer': 'adam', 'graph_mode': 'off', 'use_snp_selection': False}. Best is trial 53 with value: 0.07059634841970504.
[I 2025-11-03 14:00:39,301] Trial 103 finished with value: 0.036469410074569907 and parameters: {'model_type': 'gcn', 'hidden_dims': '[512, 256]', 'dropout': 0.2157555641824708, 'batch_norm': True, 'lr': 1.693660940825447e-05, 'weight_decay': 1.957932750584589e-06, 'epochs': 309, 'loss': 'mae', 'optimizer': 'adam', 'graph_mode': 'off', 'use_snp_selection': False}. Best is trial 53 with value: 0.07059634841970504.
[I 2025-11-03 14:00:41,551] Trial 104 finished with value: 0.035508109635663816 and parameters: {'model_type': 'gcn', 'hidden_dims': '[512, 128]', 'dropout': 0.23293001008989103, 'batch_norm': True, 'lr': 5.2627394773939e-05, 'weight_decay': 0.0009548435888266148, 'epochs': 323, 'loss': 'mae', 'optimizer': 'adam', 'graph_mode': 'off', 'use_snp_selection': False}. Best is trial 53 with value: 0.07059634841970504.
[I 2025-11-03 14:00:43,052] Trial 105 finished with value: -0.018873526522145467 and parameters: {'model_type': 'gcn', 'hidden_dims': '[512, 256]', 'dropout': 0.29911170102345513, 'batch_norm': True, 'lr': 1.2235681882980268e-05, 'weight_decay': 1.7836419702965544e-05, 'epochs': 166, 'loss': 'mae', 'optimizer': 'adam', 'graph_mode': 'off', 'use_snp_selection': False}. Best is trial 53 with value: 0.07059634841970504.
[I 2025-11-03 14:00:45,154] Trial 106 finished with value: 0.05091484631609806 and parameters: {'model_type': 'gcn', 'hidden_dims': '[512, 64]', 'dropout': 0.20303682227344944, 'batch_norm': True, 'lr': 0.00028874176029792436, 'weight_decay': 3.3534893192427603e-07, 'epochs': 295, 'loss': 'mae', 'optimizer': 'adam', 'graph_mode': 'off', 'use_snp_selection': False}. Best is trial 53 with value: 0.07059634841970504.
[I 2025-11-03 14:00:47,454] Trial 107 finished with value: -0.023591834644118546 and parameters: {'model_type': 'gcn', 'hidden_dims': '[512, 256]', 'dropout': 0.14160525365252846, 'batch_norm': True, 'lr': 1.0749491698496562e-06, 'weight_decay': 0.00021501821543738715, 'epochs': 327, 'loss': 'mae', 'optimizer': 'adam', 'graph_mode': 'off', 'use_snp_selection': False}. Best is trial 53 with value: 0.07059634841970504.
[I 2025-11-03 14:00:48,968] Trial 108 finished with value: -0.035766221768185516 and parameters: {'model_type': 'gcn', 'hidden_dims': '[512, 256]', 'dropout': 0.42702359974886733, 'batch_norm': True, 'lr': 3.396041406145142e-05, 'weight_decay': 6.857021153879311e-06, 'epochs': 342, 'loss': 'mae', 'optimizer': 'adam', 'graph_mode': 'off', 'use_snp_selection': True, 'num_snps': 13399}. Best is trial 53 with value: 0.07059634841970504.
[I 2025-11-03 14:00:49,984] Trial 109 finished with value: 0.04725595568634155 and parameters: {'model_type': 'gcn', 'hidden_dims': '[256, 128]', 'dropout': 0.1919465462026619, 'batch_norm': True, 'lr': 0.00023737861051785803, 'weight_decay': 0.000477898226637022, 'epochs': 125, 'loss': 'mae', 'optimizer': 'adam', 'graph_mode': 'off', 'use_snp_selection': False}. Best is trial 53 with value: 0.07059634841970504.
[I 2025-11-03 14:00:51,882] Trial 110 finished with value: 0.051149458170676995 and parameters: {'model_type': 'gcn', 'hidden_dims': '[512, 256]', 'dropout': 0.2393705474719158, 'batch_norm': True, 'lr': 0.0006745598650568775, 'weight_decay': 2.786422957895909e-07, 'epochs': 255, 'loss': 'mae', 'optimizer': 'adam', 'graph_mode': 'off', 'use_snp_selection': False}. Best is trial 53 with value: 0.07059634841970504.
[I 2025-11-03 14:00:53,369] Trial 111 finished with value: 0.04486598258251977 and parameters: {'model_type': 'gcn', 'hidden_dims': '[512, 256]', 'dropout': 0.18795726555608377, 'batch_norm': True, 'lr': 0.00037725125284037206, 'weight_decay': 9.469572915925204e-07, 'epochs': 149, 'loss': 'mae', 'optimizer': 'adam', 'graph_mode': 'off', 'use_snp_selection': False}. Best is trial 53 with value: 0.07059634841970504.
[I 2025-11-03 14:00:54,818] Trial 112 finished with value: 0.05071823205488999 and parameters: {'model_type': 'gcn', 'hidden_dims': '[512, 256]', 'dropout': 0.1607292239622946, 'batch_norm': True, 'lr': 0.00048081494809188824, 'weight_decay': 6.223037977485078e-07, 'epochs': 147, 'loss': 'mae', 'optimizer': 'adam', 'graph_mode': 'off', 'use_snp_selection': False}. Best is trial 53 with value: 0.07059634841970504.
[I 2025-11-03 14:00:56,240] Trial 113 finished with value: 0.06140683257654262 and parameters: {'model_type': 'gcn', 'hidden_dims': '[512, 256]', 'dropout': 0.17486920099955322, 'batch_norm': True, 'lr': 0.0003604190355639113, 'weight_decay': 1.3267717283721764e-06, 'epochs': 137, 'loss': 'mae', 'optimizer': 'adam', 'graph_mode': 'off', 'use_snp_selection': False}. Best is trial 53 with value: 0.07059634841970504.
[I 2025-11-03 14:00:57,506] Trial 114 finished with value: 0.005762064557435854 and parameters: {'model_type': 'gcn', 'hidden_dims': '[512, 256]', 'dropout': 0.40649579802241576, 'batch_norm': True, 'lr': 2.0640775824043144e-05, 'weight_decay': 1.4549105982273825e-06, 'epochs': 102, 'loss': 'mae', 'optimizer': 'adam', 'graph_mode': 'off', 'use_snp_selection': False}. Best is trial 53 with value: 0.07059634841970504.
[I 2025-11-03 14:00:59,314] Trial 115 finished with value: 0.05159435470836807 and parameters: {'model_type': 'gcn', 'hidden_dims': '[512, 256]', 'dropout': 0.177518444548736, 'batch_norm': True, 'lr': 0.0005117629828703765, 'weight_decay': 7.493281897079891e-07, 'epochs': 221, 'loss': 'mae', 'optimizer': 'adam', 'graph_mode': 'off', 'use_snp_selection': False}. Best is trial 53 with value: 0.07059634841970504.
[I 2025-11-03 14:01:00,356] Trial 116 finished with value: 0.055496540161886446 and parameters: {'model_type': 'gcn', 'hidden_dims': '[256, 128]', 'dropout': 0.11989621309671919, 'batch_norm': True, 'lr': 0.0003496762030514528, 'weight_decay': 1.1562199162184412e-06, 'epochs': 137, 'loss': 'mae', 'optimizer': 'adam', 'graph_mode': 'off', 'use_snp_selection': False}. Best is trial 53 with value: 0.07059634841970504.
[I 2025-11-03 14:01:01,759] Trial 117 finished with value: 0.027391619665914323 and parameters: {'model_type': 'gcn', 'hidden_dims': '[512, 256]', 'dropout': 0.22468516489622634, 'batch_norm': True, 'lr': 4.05921640760115e-05, 'weight_decay': 4.609613087301828e-07, 'epochs': 128, 'loss': 'mse', 'optimizer': 'adam', 'graph_mode': 'off', 'use_snp_selection': False}. Best is trial 53 with value: 0.07059634841970504.
[I 2025-11-03 14:01:03,088] Trial 118 finished with value: 0.03293781332727355 and parameters: {'model_type': 'gcn', 'hidden_dims': '[512, 256]', 'dropout': 0.5008703111059821, 'batch_norm': False, 'lr': 7.238072217145277e-06, 'weight_decay': 0.0006962307384278715, 'epochs': 120, 'loss': 'mae', 'optimizer': 'adam', 'graph_mode': 'off', 'use_snp_selection': False}. Best is trial 53 with value: 0.07059634841970504.
[I 2025-11-03 14:01:04,434] Trial 119 finished with value: 0.033291565398941465 and parameters: {'model_type': 'gcn', 'hidden_dims': '[256, 128]', 'dropout': 0.26407599965619527, 'batch_norm': True, 'lr': 0.00019456663745857363, 'weight_decay': 6.97228616491739e-05, 'epochs': 234, 'loss': 'mae', 'optimizer': 'adam', 'graph_mode': 'off', 'use_snp_selection': False}. Best is trial 53 with value: 0.07059634841970504.
[I 2025-11-03 14:01:06,085] Trial 120 finished with value: 0.03693047779557249 and parameters: {'model_type': 'gcn', 'hidden_dims': '[512, 256]', 'dropout': 0.16606719140173987, 'batch_norm': True, 'lr': 0.0002301480286305063, 'weight_decay': 9.116204914905031e-05, 'epochs': 190, 'loss': 'mae', 'optimizer': 'adam', 'graph_mode': 'off', 'use_snp_selection': False}. Best is trial 53 with value: 0.07059634841970504.
[I 2025-11-03 14:01:07,533] Trial 121 finished with value: 0.05843675187567335 and parameters: {'model_type': 'gcn', 'hidden_dims': '[512, 256]', 'dropout': 0.1522547422213754, 'batch_norm': True, 'lr': 0.00030167661463390835, 'weight_decay': 2.506664605457447e-06, 'epochs': 152, 'loss': 'mae', 'optimizer': 'adam', 'graph_mode': 'off', 'use_snp_selection': False}. Best is trial 53 with value: 0.07059634841970504.
[I 2025-11-03 14:01:08,981] Trial 122 finished with value: 0.05237972864516536 and parameters: {'model_type': 'gcn', 'hidden_dims': '[512, 256]', 'dropout': 0.45470275734724674, 'batch_norm': True, 'lr': 0.000343690536482309, 'weight_decay': 8.623533669139979e-07, 'epochs': 141, 'loss': 'mae', 'optimizer': 'adam', 'graph_mode': 'off', 'use_snp_selection': False}. Best is trial 53 with value: 0.07059634841970504.
[I 2025-11-03 14:01:10,719] Trial 123 finished with value: 0.058637415215776895 and parameters: {'model_type': 'gcn', 'hidden_dims': '[512, 256]', 'dropout': 0.19442576394341876, 'batch_norm': True, 'lr': 0.00041350373806804815, 'weight_decay': 1.6404797393291385e-06, 'epochs': 209, 'loss': 'mae', 'optimizer': 'adam', 'graph_mode': 'off', 'use_snp_selection': False}. Best is trial 53 with value: 0.07059634841970504.
[I 2025-11-03 14:01:12,421] Trial 124 finished with value: 0.05720994322022156 and parameters: {'model_type': 'gcn', 'hidden_dims': '[512, 256]', 'dropout': 0.2114003458503661, 'batch_norm': True, 'lr': 0.00042951417290614316, 'weight_decay': 2.0420640987527403e-06, 'epochs': 204, 'loss': 'mae', 'optimizer': 'adam', 'graph_mode': 'off', 'use_snp_selection': False}. Best is trial 53 with value: 0.07059634841970504.
[I 2025-11-03 14:01:13,890] Trial 125 finished with value: 0.06518946557057063 and parameters: {'model_type': 'gcn', 'hidden_dims': '[256, 128, 64]', 'dropout': 0.19812418458598205, 'batch_norm': True, 'lr': 0.0005630204209306885, 'weight_decay': 0.00016683501353005611, 'epochs': 210, 'loss': 'mae', 'optimizer': 'adam', 'graph_mode': 'off', 'use_snp_selection': False}. Best is trial 53 with value: 0.07059634841970504.
[I 2025-11-03 14:01:15,440] Trial 126 finished with value: 0.05461975792358868 and parameters: {'model_type': 'gcn', 'hidden_dims': '[256, 128, 64]', 'dropout': 0.5604105183972723, 'batch_norm': True, 'lr': 0.0008759143836994209, 'weight_decay': 0.00015365782328849952, 'epochs': 226, 'loss': 'mae', 'optimizer': 'adam', 'graph_mode': 'off', 'use_snp_selection': False}. Best is trial 53 with value: 0.07059634841970504.
[I 2025-11-03 14:01:17,212] Trial 127 finished with value: 0.047639016429499685 and parameters: {'model_type': 'gcn', 'hidden_dims': '[512, 128]', 'dropout': 0.5349281631877137, 'batch_norm': True, 'lr': 0.0006133463000497496, 'weight_decay': 5.152528299489318e-05, 'epochs': 215, 'loss': 'mae', 'optimizer': 'adam', 'graph_mode': 'off', 'use_snp_selection': False}. Best is trial 53 with value: 0.07059634841970504.
[I 2025-11-03 14:01:18,858] Trial 128 finished with value: 0.05309926854622485 and parameters: {'model_type': 'gcn', 'hidden_dims': '[128, 64]', 'dropout': 0.17926895075068894, 'batch_norm': True, 'lr': 0.0005247603783433797, 'weight_decay': 0.0002548616258938596, 'epochs': 242, 'loss': 'mae', 'optimizer': 'adam', 'graph_mode': 'off', 'use_snp_selection': True, 'num_snps': 38401}. Best is trial 53 with value: 0.07059634841970504.
[I 2025-11-03 14:01:20,349] Trial 129 finished with value: 0.05664007820375269 and parameters: {'model_type': 'gcn', 'hidden_dims': '[256, 128, 64]', 'dropout': 0.22890108941686307, 'batch_norm': True, 'lr': 0.00026341104011058045, 'weight_decay': 1.4109199133760833e-05, 'epochs': 221, 'loss': 'mae', 'optimizer': 'adam', 'graph_mode': 'off', 'use_snp_selection': False}. Best is trial 53 with value: 0.07059634841970504.
[I 2025-11-03 14:01:22,057] Trial 130 finished with value: 0.04818150740468588 and parameters: {'model_type': 'gcn', 'hidden_dims': '[256, 128, 64]', 'dropout': 0.27796749591906417, 'batch_norm': True, 'lr': 0.0006874977259290017, 'weight_decay': 0.000362411145649122, 'epochs': 274, 'loss': 'mae', 'optimizer': 'adam', 'graph_mode': 'off', 'use_snp_selection': False}. Best is trial 53 with value: 0.07059634841970504.
[I 2025-11-03 14:01:23,515] Trial 131 finished with value: 0.04927255415137598 and parameters: {'model_type': 'gcn', 'hidden_dims': '[256, 128, 64]', 'dropout': 0.19742389767179266, 'batch_norm': True, 'lr': 0.0004413256320380487, 'weight_decay': 1.208184009274399e-06, 'epochs': 209, 'loss': 'mae', 'optimizer': 'adam', 'graph_mode': 'off', 'use_snp_selection': False}. Best is trial 53 with value: 0.07059634841970504.
[I 2025-11-03 14:01:25,345] Trial 132 finished with value: 0.05083900179086889 and parameters: {'model_type': 'gcn', 'hidden_dims': '[512, 256]', 'dropout': 0.21801151098404187, 'batch_norm': True, 'lr': 2.6351735149198758e-05, 'weight_decay': 1.8153815049535484e-06, 'epochs': 232, 'loss': 'mae', 'optimizer': 'adam', 'graph_mode': 'off', 'use_snp_selection': False}. Best is trial 53 with value: 0.07059634841970504.
[I 2025-11-03 14:01:26,322] Trial 133 finished with value: 0.04315364535276403 and parameters: {'model_type': 'gcn', 'hidden_dims': '[256, 128]', 'dropout': 0.20615474758588118, 'batch_norm': True, 'lr': 0.000556620931086477, 'weight_decay': 0.0001287778534472969, 'epochs': 84, 'loss': 'mae', 'optimizer': 'adam', 'graph_mode': 'off', 'use_snp_selection': False}. Best is trial 53 with value: 0.07059634841970504.
[I 2025-11-03 14:01:28,021] Trial 134 finished with value: 0.053204020316643744 and parameters: {'model_type': 'gcn', 'hidden_dims': '[512, 256]', 'dropout': 0.23796935502456093, 'batch_norm': True, 'lr': 0.0001720442769403669, 'weight_decay': 2.90224438418934e-06, 'epochs': 201, 'loss': 'mae', 'optimizer': 'adam', 'graph_mode': 'off', 'use_snp_selection': False}. Best is trial 53 with value: 0.07059634841970504.
[I 2025-11-03 14:01:29,668] Trial 135 finished with value: 0.039897188160488616 and parameters: {'model_type': 'gcn', 'hidden_dims': '[512, 256]', 'dropout': 0.25599173243086454, 'batch_norm': True, 'lr': 0.00038392607739866396, 'weight_decay': 4.475693535645399e-06, 'epochs': 196, 'loss': 'mae', 'optimizer': 'adam', 'graph_mode': 'off', 'use_snp_selection': False}. Best is trial 53 with value: 0.07059634841970504.
[I 2025-11-03 14:01:31,371] Trial 136 finished with value: 0.04989742974491898 and parameters: {'model_type': 'gcn', 'hidden_dims': '[512, 64]', 'dropout': 0.19853933505605617, 'batch_norm': True, 'lr': 0.0002884495668825727, 'weight_decay': 1.5809409711984732e-06, 'epochs': 210, 'loss': 'mae', 'optimizer': 'adam', 'graph_mode': 'off', 'use_snp_selection': False}. Best is trial 53 with value: 0.07059634841970504.
[I 2025-11-03 14:01:33,700] Trial 137 finished with value: 0.059152829209475226 and parameters: {'model_type': 'gcn', 'hidden_dims': '[512, 256]', 'dropout': 0.18096654895019107, 'batch_norm': True, 'lr': 3.164069816797211e-05, 'weight_decay': 9.096165616724782e-06, 'epochs': 336, 'loss': 'mae', 'optimizer': 'adam', 'graph_mode': 'off', 'use_snp_selection': False}. Best is trial 53 with value: 0.07059634841970504.
[I 2025-11-03 14:01:35,375] Trial 138 finished with value: -0.00957218696970251 and parameters: {'model_type': 'gcn', 'hidden_dims': '[256, 128]', 'dropout': 0.17425473382421267, 'batch_norm': True, 'lr': 1.9249047549242526e-05, 'weight_decay': 3.6306677937099366e-06, 'epochs': 342, 'loss': 'mse', 'optimizer': 'adam', 'graph_mode': 'off', 'use_snp_selection': False}. Best is trial 53 with value: 0.07059634841970504.
[I 2025-11-03 14:01:37,223] Trial 139 finished with value: 0.07264745599929207 and parameters: {'model_type': 'gcn', 'hidden_dims': '[256, 128, 64]', 'dropout': 0.14876143224528396, 'batch_norm': False, 'lr': 5.1011319255504815e-05, 'weight_decay': 7.528216910620805e-06, 'epochs': 336, 'loss': 'mae', 'optimizer': 'adam', 'graph_mode': 'off', 'use_snp_selection': False}. Best is trial 139 with value: 0.07264745599929207.
[I 2025-11-03 14:01:39,020] Trial 140 finished with value: 0.008079873277958819 and parameters: {'model_type': 'gcn', 'hidden_dims': '[256, 128, 64]', 'dropout': 0.13898881678068542, 'batch_norm': False, 'lr': 4.66512233470495e-05, 'weight_decay': 9.91139173467858e-06, 'epochs': 315, 'loss': 'mae', 'optimizer': 'adam', 'graph_mode': 'off', 'use_snp_selection': False}. Best is trial 139 with value: 0.07264745599929207.
[I 2025-11-03 14:01:40,886] Trial 141 finished with value: 0.013033617578067334 and parameters: {'model_type': 'gcn', 'hidden_dims': '[256, 128, 64]', 'dropout': 0.15502295808985922, 'batch_norm': False, 'lr': 3.928565647226323e-05, 'weight_decay': 8.513281545230753e-06, 'epochs': 333, 'loss': 'mae', 'optimizer': 'adam', 'graph_mode': 'off', 'use_snp_selection': False}. Best is trial 139 with value: 0.07264745599929207.
[I 2025-11-03 14:01:42,746] Trial 142 finished with value: 0.0221102054228952 and parameters: {'model_type': 'gcn', 'hidden_dims': '[256, 128, 64]', 'dropout': 0.12074392066055989, 'batch_norm': False, 'lr': 2.9218328887235934e-05, 'weight_decay': 0.00018378556777249425, 'epochs': 335, 'loss': 'mae', 'optimizer': 'adam', 'graph_mode': 'off', 'use_snp_selection': False}. Best is trial 139 with value: 0.07264745599929207.
[I 2025-11-03 14:01:44,646] Trial 143 finished with value: 0.022320221561369456 and parameters: {'model_type': 'gcn', 'hidden_dims': '[256, 128, 64]', 'dropout': 0.1840166955495226, 'batch_norm': False, 'lr': 5.334204452334989e-05, 'weight_decay': 5.562373280998747e-06, 'epochs': 347, 'loss': 'mae', 'optimizer': 'adam', 'graph_mode': 'off', 'use_snp_selection': False}. Best is trial 139 with value: 0.07264745599929207.
[I 2025-11-03 14:01:46,886] Trial 144 finished with value: -0.010758987802210095 and parameters: {'model_type': 'gcn', 'hidden_dims': '[512, 256]', 'dropout': 0.5197827411292242, 'batch_norm': False, 'lr': 8.359605695114662e-05, 'weight_decay': 6.853579084527849e-06, 'epochs': 339, 'loss': 'mae', 'optimizer': 'adam', 'graph_mode': 'off', 'use_snp_selection': False}. Best is trial 139 with value: 0.07264745599929207.
[I 2025-11-03 14:01:48,781] Trial 145 finished with value: 0.057935856585963647 and parameters: {'model_type': 'gcn', 'hidden_dims': '[256, 128, 64]', 'dropout': 0.14754873573130217, 'batch_norm': True, 'lr': 6.815364807689193e-05, 'weight_decay': 8.112297897843073e-06, 'epochs': 320, 'loss': 'mae', 'optimizer': 'adam', 'graph_mode': 'off', 'use_snp_selection': False}. Best is trial 139 with value: 0.07264745599929207.
