[I 2025-10-22 15:49:52,577] Trial 6 finished with value: 0.15211046515823895 and parameters: {'model_type': 'gat', 'hidden_dims': '[512, 64]', 'dropout': 0.4724320384750339, 'batch_norm': True, 'gat_heads': 2, 'gat_attn_dropout': 0.5029567924222157, 'gat_concat_hidden': False, 'lr': 0.00035117819773722113, 'weight_decay': 2.586139236899202e-05, 'epochs': 282, 'loss': 'mse', 'optimizer': 'adam', 'graph_mode': 'knn', 'source': 'grm', 'knn_k': 5, 'weighted_edges': False, 'symmetrize_mode': 'mutual'}. Best is trial 2 with value: 0.17308616320526288.
[I 2025-10-22 15:50:24,344] Trial 7 finished with value: 0.15404831119070136 and parameters: {'model_type': 'gat', 'hidden_dims': '[256, 128]', 'dropout': 0.26933956649466984, 'batch_norm': False, 'gat_heads': 1, 'gat_attn_dropout': 0.12357015502138351, 'gat_concat_hidden': True, 'lr': 9.272145288974393e-05, 'weight_decay': 0.0001637847231599168, 'epochs': 149, 'loss': 'mae', 'optimizer': 'adam', 'graph_mode': 'knn', 'source': 'grm', 'knn_k': 9, 'weighted_edges': False, 'symmetrize_mode': 'mutual'}. Best is trial 2 with value: 0.17308616320526288.
[I 2025-10-22 15:50:44,057] Trial 8 finished with value: 0.1844179263745158 and parameters: {'model_type': 'gat', 'hidden_dims': '[256, 128, 64]', 'dropout': 0.5327763091136416, 'batch_norm': True, 'gat_heads': 1, 'gat_attn_dropout': 0.11077610280855929, 'gat_concat_hidden': False, 'lr': 0.0005504846263330393, 'weight_decay': 6.7826287729705615e-06, 'epochs': 80, 'loss': 'mse', 'optimizer': 'adam', 'graph_mode': 'cutoff', 'cutoff': 0.39200637331077737, 'grm_norm': 'cosine_then_gcn', 'self_loops': False}. Best is trial 8 with value: 0.1844179263745158.
[I 2025-10-22 15:52:05,465] Trial 9 finished with value: 0.20861182316246155 and parameters: {'model_type': 'gat', 'hidden_dims': '[256, 128, 64]', 'dropout': 0.29822093943922523, 'batch_norm': True, 'gat_heads': 2, 'gat_attn_dropout': 0.5041483896530343, 'gat_concat_hidden': True, 'lr': 0.0009262984185468379, 'weight_decay': 8.224875501038066e-07, 'epochs': 231, 'loss': 'mae', 'optimizer': 'adam', 'graph_mode': 'cutoff', 'cutoff': 0.40177719715455146, 'grm_norm': 'none', 'self_loops': True}. Best is trial 9 with value: 0.20861182316246155.
[I 2025-10-22 16:04:25,344] Trial 10 finished with value: 0.2131477723899425 and parameters: {'model_type': 'gat', 'hidden_dims': '[512, 256]', 'dropout': 0.11372025982957354, 'batch_norm': True, 'gat_heads': 7, 'gat_attn_dropout': 0.5599540289166529, 'gat_concat_hidden': True, 'lr': 0.0009650491902216229, 'weight_decay': 1.3004302134392705e-07, 'epochs': 339, 'loss': 'mae', 'optimizer': 'adam', 'graph_mode': 'cutoff', 'cutoff': 0.7605475530345412, 'grm_norm': 'gcn', 'self_loops': True}. Best is trial 10 with value: 0.2131477723899425.
[I 2025-10-22 16:19:19,143] Trial 11 finished with value: 0.21028908293475373 and parameters: {'model_type': 'gat', 'hidden_dims': '[512, 256]', 'dropout': 0.10254502285057247, 'batch_norm': True, 'gat_heads': 8, 'gat_attn_dropout': 0.5935696129988, 'gat_concat_hidden': True, 'lr': 0.0009039246077153928, 'weight_decay': 1.014091185981818e-07, 'epochs': 348, 'loss': 'mae', 'optimizer': 'adam', 'graph_mode': 'cutoff', 'cutoff': 0.8795382731036935, 'grm_norm': 'gcn', 'self_loops': True}. Best is trial 10 with value: 0.2131477723899425.
[I 2025-10-22 16:33:48,817] Trial 12 finished with value: 0.21597648862284577 and parameters: {'model_type': 'gat', 'hidden_dims': '[512, 256]', 'dropout': 0.11851629240082012, 'batch_norm': True, 'gat_heads': 8, 'gat_attn_dropout': 0.5936622869810394, 'gat_concat_hidden': True, 'lr': 0.00021857214966676538, 'weight_decay': 1.1903116219202832e-07, 'epochs': 338, 'loss': 'mae', 'optimizer': 'adam', 'graph_mode': 'cutoff', 'cutoff': 0.8655944931386742, 'grm_norm': 'gcn', 'self_loops': True}. Best is trial 12 with value: 0.21597648862284577.
[I 2025-10-22 16:48:08,184] Trial 13 finished with value: 0.21531389011745478 and parameters: {'model_type': 'gat', 'hidden_dims': '[512, 256]', 'dropout': 0.10085201161116182, 'batch_norm': True, 'gat_heads': 8, 'gat_attn_dropout': 0.5971261634521214, 'gat_concat_hidden': True, 'lr': 0.00020400539388946485, 'weight_decay': 5.734114824541148e-07, 'epochs': 335, 'loss': 'mae', 'optimizer': 'adam', 'graph_mode': 'cutoff', 'cutoff': 0.8505441025011694, 'grm_norm': 'gcn', 'self_loops': True}. Best is trial 12 with value: 0.21597648862284577.
[I 2025-10-22 16:57:04,809] Trial 14 finished with value: 0.2204784609712346 and parameters: {'model_type': 'gat', 'hidden_dims': '[512, 128]', 'dropout': 0.15888831956654023, 'batch_norm': True, 'gat_heads': 6, 'gat_attn_dropout': 0.2810064922470583, 'gat_concat_hidden': True, 'lr': 0.0001779075227074746, 'weight_decay': 7.56312608130222e-07, 'epochs': 292, 'loss': 'mae', 'optimizer': 'adam', 'graph_mode': 'cutoff', 'cutoff': 0.7362863533137929, 'grm_norm': 'gcn', 'self_loops': True}. Best is trial 14 with value: 0.2204784609712346.
[I 2025-10-22 17:05:52,907] Trial 15 finished with value: 0.2019692780253967 and parameters: {'model_type': 'gat', 'hidden_dims': '[512, 128]', 'dropout': 0.17428890987072215, 'batch_norm': True, 'gat_heads': 6, 'gat_attn_dropout': 0.2703038396936633, 'gat_concat_hidden': True, 'lr': 1.0948955842261321e-05, 'weight_decay': 2.59931839909819e-06, 'epochs': 286, 'loss': 'mae', 'optimizer': 'adam', 'graph_mode': 'cutoff', 'cutoff': 0.6996556771115825, 'grm_norm': 'gcn', 'self_loops': True}. Best is trial 14 with value: 0.2204784609712346.
[I 2025-10-22 17:14:32,304] Trial 16 finished with value: 0.21810919004502666 and parameters: {'model_type': 'gat', 'hidden_dims': '[512, 128]', 'dropout': 0.1605647972769279, 'batch_norm': True, 'gat_heads': 6, 'gat_attn_dropout': 0.27015350409494526, 'gat_concat_hidden': True, 'lr': 0.00016577780425965693, 'weight_decay': 3.7127005900639406e-07, 'epochs': 281, 'loss': 'mae', 'optimizer': 'adam', 'graph_mode': 'cutoff', 'cutoff': 0.6891673938283641, 'grm_norm': 'gcn', 'self_loops': True}. Best is trial 14 with value: 0.2204784609712346.
[I 2025-10-22 17:21:45,226] Trial 17 finished with value: 0.21426357836465337 and parameters: {'model_type': 'gat', 'hidden_dims': '[512, 128]', 'dropout': 0.4084851794382792, 'batch_norm': True, 'gat_heads': 5, 'gat_attn_dropout': 0.2622499188713548, 'gat_concat_hidden': True, 'lr': 0.00013938524162135474, 'weight_decay': 4.1083967388498073e-07, 'epochs': 272, 'loss': 'mae', 'optimizer': 'adam', 'graph_mode': 'cutoff', 'cutoff': 0.6623121005931064, 'grm_norm': 'cosine', 'self_loops': True}. Best is trial 14 with value: 0.2204784609712346.
[I 2025-10-22 17:30:59,004] Trial 18 finished with value: 0.1550776794366281 and parameters: {'model_type': 'gat', 'hidden_dims': '[512, 128]', 'dropout': 0.1931941746236644, 'batch_norm': False, 'gat_heads': 6, 'gat_attn_dropout': 0.33210648632164685, 'gat_concat_hidden': True, 'lr': 1.4229742500153306e-05, 'weight_decay': 4.501553599901053e-06, 'epochs': 300, 'loss': 'mae', 'optimizer': 'adam', 'graph_mode': 'knn', 'source': 'grm', 'knn_k': 1, 'weighted_edges': False, 'symmetrize_mode': 'union'}. Best is trial 14 with value: 0.2204784609712346.
[I 2025-10-22 17:38:44,918] Trial 19 finished with value: 0.20416033496772154 and parameters: {'model_type': 'gat', 'hidden_dims': '[512, 128]', 'dropout': 0.29690025160740663, 'batch_norm': True, 'gat_heads': 6, 'gat_attn_dropout': 0.2073696340549781, 'gat_concat_hidden': True, 'lr': 0.0003499870864850594, 'weight_decay': 0.0009652163992896154, 'epochs': 250, 'loss': 'mae', 'optimizer': 'adam', 'graph_mode': 'cutoff', 'cutoff': 0.6162754822765526, 'grm_norm': 'gcn', 'self_loops': True}. Best is trial 14 with value: 0.2204784609712346.
[I 2025-10-22 17:42:44,415] Trial 20 finished with value: 0.17678853101282796 and parameters: {'model_type': 'gat', 'hidden_dims': '[512, 128]', 'dropout': 0.15629301446227395, 'batch_norm': True, 'gat_heads': 4, 'gat_attn_dropout': 0.402006710502103, 'gat_concat_hidden': True, 'lr': 0.0001161597094522936, 'weight_decay': 3.2455104912107645e-07, 'epochs': 185, 'loss': 'mae', 'optimizer': 'adam', 'graph_mode': 'cutoff', 'cutoff': 0.7351863181263883, 'grm_norm': 'gcn', 'self_loops': True}. Best is trial 14 with value: 0.2204784609712346.
[I 2025-10-22 17:54:35,360] Trial 21 finished with value: 0.20041737342483512 and parameters: {'model_type': 'gat', 'hidden_dims': '[512, 256]', 'dropout': 0.14528382340563503, 'batch_norm': True, 'gat_heads': 7, 'gat_attn_dropout': 0.24237437447515892, 'gat_concat_hidden': True, 'lr': 0.00023552107068168336, 'weight_decay': 2.984869501515628e-07, 'epochs': 324, 'loss': 'mae', 'optimizer': 'adam', 'graph_mode': 'cutoff', 'cutoff': 0.8031072454519743, 'grm_norm': 'gcn', 'self_loops': True}. Best is trial 14 with value: 0.2204784609712346.
[I 2025-10-22 18:05:40,239] Trial 22 finished with value: 0.22255691246714887 and parameters: {'model_type': 'gat', 'hidden_dims': '[512, 128]', 'dropout': 0.21643386654893554, 'batch_norm': True, 'gat_heads': 7, 'gat_attn_dropout': 0.3156514974361204, 'gat_concat_hidden': True, 'lr': 0.00022762877869569965, 'weight_decay': 1.1995387457752896e-06, 'epochs': 310, 'loss': 'mae', 'optimizer': 'adam', 'graph_mode': 'cutoff', 'cutoff': 0.8097183659198013, 'grm_norm': 'gcn', 'self_loops': True}. Best is trial 22 with value: 0.22255691246714887.
[I 2025-10-22 18:16:35,945] Trial 23 finished with value: 0.21002887838095785 and parameters: {'model_type': 'gat', 'hidden_dims': '[512, 128]', 'dropout': 0.22186169783114063, 'batch_norm': True, 'gat_heads': 7, 'gat_attn_dropout': 0.3183890337186741, 'gat_concat_hidden': True, 'lr': 0.00044952699805854293, 'weight_decay': 2.1109512035570236e-06, 'epochs': 304, 'loss': 'mae', 'optimizer': 'adam', 'graph_mode': 'cutoff', 'cutoff': 0.6031534961722004, 'grm_norm': 'gcn', 'self_loops': True}. Best is trial 22 with value: 0.22255691246714887.
[I 2025-10-22 18:24:36,625] Trial 24 finished with value: 0.2129386213750944 and parameters: {'model_type': 'gat', 'hidden_dims': '[512, 128]', 'dropout': 0.30889133191793466, 'batch_norm': True, 'gat_heads': 6, 'gat_attn_dropout': 0.37986073566783785, 'gat_concat_hidden': True, 'lr': 5.751284158339709e-05, 'weight_decay': 1.0266203668714972e-06, 'epochs': 260, 'loss': 'mae', 'optimizer': 'adam', 'graph_mode': 'cutoff', 'cutoff': 0.7507312957446513, 'grm_norm': 'gcn', 'self_loops': True}. Best is trial 22 with value: 0.22255691246714887.
[I 2025-10-22 18:32:48,483] Trial 25 finished with value: 0.21235367239442987 and parameters: {'model_type': 'gat', 'hidden_dims': '[512, 128]', 'dropout': 0.1578983605315714, 'batch_norm': True, 'gat_heads': 5, 'gat_attn_dropout': 0.30039923586064593, 'gat_concat_hidden': True, 'lr': 0.00014074164619608834, 'weight_decay': 1.1984282569582984e-05, 'epochs': 313, 'loss': 'mae', 'optimizer': 'adam', 'graph_mode': 'cutoff', 'cutoff': 0.7976917104961747, 'grm_norm': 'cosine', 'self_loops': True}. Best is trial 22 with value: 0.22255691246714887.
[I 2025-10-22 18:41:33,177] Trial 26 finished with value: 0.20691194749969596 and parameters: {'model_type': 'gat', 'hidden_dims': '[512, 128]', 'dropout': 0.20914137557078785, 'batch_norm': True, 'gat_heads': 7, 'gat_attn_dropout': 0.23442619930719852, 'gat_concat_hidden': False, 'lr': 8.553228646459503e-05, 'weight_decay': 2.6457713286178854e-06, 'epochs': 246, 'loss': 'mae', 'optimizer': 'adam', 'graph_mode': 'cutoff', 'cutoff': 0.661082219617858, 'grm_norm': 'none', 'self_loops': True}. Best is trial 22 with value: 0.22255691246714887.
[I 2025-10-22 18:47:50,507] Trial 27 finished with value: 0.1529902641703515 and parameters: {'model_type': 'gat', 'hidden_dims': '[512, 128]', 'dropout': 0.14573950419380974, 'batch_norm': False, 'gat_heads': 4, 'gat_attn_dropout': 0.429427891590775, 'gat_concat_hidden': True, 'lr': 2.9704471124439393e-05, 'weight_decay': 2.5264626740180875e-07, 'epochs': 298, 'loss': 'mse', 'optimizer': 'adam', 'graph_mode': 'knn', 'source': 'grm', 'knn_k': 1, 'weighted_edges': True, 'symmetrize_mode': 'union'}. Best is trial 22 with value: 0.22255691246714887.
[I 2025-10-22 18:56:11,982] Trial 28 finished with value: 0.2131994718047619 and parameters: {'model_type': 'gat', 'hidden_dims': '[512, 128]', 'dropout': 0.2500372189285662, 'batch_norm': True, 'gat_heads': 6, 'gat_attn_dropout': 0.07311147148725566, 'gat_concat_hidden': True, 'lr': 0.00020043471892269203, 'weight_decay': 7.854761770262412e-07, 'epochs': 270, 'loss': 'mae', 'optimizer': 'adam', 'graph_mode': 'cutoff', 'cutoff': 0.5823735774547633, 'grm_norm': 'gcn', 'self_loops': True}. Best is trial 22 with value: 0.22255691246714887.
[I 2025-10-22 18:58:21,064] Trial 29 finished with value: 0.1353348424587381 and parameters: {'model_type': 'gat', 'hidden_dims': '[128, 64]', 'dropout': 0.19059370972137957, 'batch_norm': True, 'gat_heads': 7, 'gat_attn_dropout': 0.1733151881655796, 'gat_concat_hidden': True, 'lr': 1.696170946698764e-05, 'weight_decay': 4.44701800719328e-06, 'epochs': 199, 'loss': 'mse', 'optimizer': 'adam', 'graph_mode': 'knn', 'source': 'grm', 'knn_k': 4, 'weighted_edges': False, 'symmetrize_mode': 'union'}. Best is trial 22 with value: 0.22255691246714887.
[I 2025-10-22 19:01:37,257] Trial 30 finished with value: 0.19015802607200633 and parameters: {'model_type': 'gat', 'hidden_dims': '[256, 128]', 'dropout': 0.4163786329800766, 'batch_norm': True, 'gat_heads': 5, 'gat_attn_dropout': 0.35459161675671375, 'gat_concat_hidden': True, 'lr': 7.098923883911376e-06, 'weight_decay': 1.06457092076239e-05, 'epochs': 226, 'loss': 'mae', 'optimizer': 'adam', 'graph_mode': 'cutoff', 'cutoff': 0.7043391711093258, 'grm_norm': 'gcn', 'self_loops': True}. Best is trial 22 with value: 0.22255691246714887.
[I 2025-10-22 19:15:22,276] Trial 31 finished with value: 0.21619146979449244 and parameters: {'model_type': 'gat', 'hidden_dims': '[512, 256]', 'dropout': 0.11899147532699214, 'batch_norm': True, 'gat_heads': 8, 'gat_attn_dropout': 0.42986464965988835, 'gat_concat_hidden': True, 'lr': 0.0002357064764205623, 'weight_decay': 2.0057028796371656e-07, 'epochs': 320, 'loss': 'mae', 'optimizer': 'adam', 'graph_mode': 'cutoff', 'cutoff': 0.8903799643132071, 'grm_norm': 'gcn', 'self_loops': True}. Best is trial 22 with value: 0.22255691246714887.
[I 2025-10-22 19:18:41,560] Trial 32 finished with value: 0.21673956566198654 and parameters: {'model_type': 'gat', 'hidden_dims': '[128, 64]', 'dropout': 0.1406771633900388, 'batch_norm': True, 'gat_heads': 8, 'gat_attn_dropout': 0.4376742137210255, 'gat_concat_hidden': True, 'lr': 0.00030027409444260294, 'weight_decay': 2.1667953267556947e-07, 'epochs': 321, 'loss': 'mae', 'optimizer': 'adam', 'graph_mode': 'cutoff', 'cutoff': 0.8196426314505763, 'grm_norm': 'gcn', 'self_loops': True}. Best is trial 22 with value: 0.22255691246714887.
[I 2025-10-22 19:21:40,767] Trial 33 finished with value: 0.2159885035801806 and parameters: {'model_type': 'gat', 'hidden_dims': '[128, 64]', 'dropout': 0.18511869217858873, 'batch_norm': True, 'gat_heads': 7, 'gat_attn_dropout': 0.2940751084916011, 'gat_concat_hidden': True, 'lr': 0.0005021384881791884, 'weight_decay': 4.915786874781014e-07, 'epochs': 289, 'loss': 'mae', 'optimizer': 'adam', 'graph_mode': 'cutoff', 'cutoff': 0.7992683763113282, 'grm_norm': 'gcn', 'self_loops': True}. Best is trial 22 with value: 0.22255691246714887.
[I 2025-10-22 19:24:57,187] Trial 34 finished with value: 0.201072645490951 and parameters: {'model_type': 'gat', 'hidden_dims': '[128, 64]', 'dropout': 0.21325798298872464, 'batch_norm': True, 'gat_heads': 8, 'gat_attn_dropout': 0.20077757408078362, 'gat_concat_hidden': False, 'lr': 3.869106631041527e-05, 'weight_decay': 1.2895940760048804e-06, 'epochs': 318, 'loss': 'mse', 'optimizer': 'adam', 'graph_mode': 'cutoff', 'cutoff': 0.8263946552012655, 'grm_norm': 'gcn', 'self_loops': True}. Best is trial 22 with value: 0.22255691246714887.
[I 2025-10-22 19:27:02,185] Trial 35 finished with value: 0.21183345980997953 and parameters: {'model_type': 'gat', 'hidden_dims': '[128, 64]', 'dropout': 0.1377887135883331, 'batch_norm': True, 'gat_heads': 6, 'gat_attn_dropout': 0.3648340697416143, 'gat_concat_hidden': True, 'lr': 0.0006298149286549751, 'weight_decay': 2.090627163555021e-07, 'epochs': 232, 'loss': 'mae', 'optimizer': 'adam', 'graph_mode': 'cutoff', 'cutoff': 0.7530519938971745, 'grm_norm': 'gcn', 'self_loops': True}. Best is trial 22 with value: 0.22255691246714887.
[I 2025-10-22 19:33:33,341] Trial 36 finished with value: 0.05807617009699573 and parameters: {'model_type': 'gat', 'hidden_dims': '[512, 64]', 'dropout': 0.2426429348104784, 'batch_norm': False, 'gat_heads': 7, 'gat_attn_dropout': 0.45573541307516274, 'gat_concat_hidden': True, 'lr': 0.00033136513362319267, 'weight_decay': 5.725893224350386e-07, 'epochs': 170, 'loss': 'mae', 'optimizer': 'adam', 'graph_mode': 'knn', 'source': 'grm', 'knn_k': 10, 'weighted_edges': True, 'symmetrize_mode': 'union'}. Best is trial 22 with value: 0.22255691246714887.
[I 2025-10-22 19:36:20,369] Trial 37 finished with value: 0.18617137860666988 and parameters: {'model_type': 'gat', 'hidden_dims': '[128, 64]', 'dropout': 0.3442178671936387, 'batch_norm': True, 'gat_heads': 8, 'gat_attn_dropout': 0.3331273284952717, 'gat_concat_hidden': False, 'lr': 1.4929372209735344e-06, 'weight_decay': 1.5100892544693915e-06, 'epochs': 268, 'loss': 'mae', 'optimizer': 'adam', 'graph_mode': 'cutoff', 'cutoff': 0.6662426018280238, 'grm_norm': 'gcn', 'self_loops': True}. Best is trial 22 with value: 0.22255691246714887.
[I 2025-10-22 19:43:28,115] Trial 38 finished with value: 0.22157627916521325 and parameters: {'model_type': 'gat', 'hidden_dims': '[512, 64]', 'dropout': 0.2722067649426267, 'batch_norm': False, 'gat_heads': 4, 'gat_attn_dropout': 0.28346270203555796, 'gat_concat_hidden': True, 'lr': 7.509013443057496e-05, 'weight_decay': 1.9848173225774492e-07, 'epochs': 349, 'loss': 'mse', 'optimizer': 'adam', 'graph_mode': 'cutoff', 'cutoff': 0.7845813638167085, 'grm_norm': 'none', 'self_loops': False}. Best is trial 22 with value: 0.22255691246714887.
[I 2025-10-22 19:46:01,874] Trial 39 finished with value: 0.1752958141992052 and parameters: {'model_type': 'gat', 'hidden_dims': '[512, 64]', 'dropout': 0.25916677374489006, 'batch_norm': False, 'gat_heads': 4, 'gat_attn_dropout': 0.22618896338483085, 'gat_concat_hidden': False, 'lr': 8.230721540159661e-05, 'weight_decay': 1.737434164299794e-06, 'epochs': 115, 'loss': 'mse', 'optimizer': 'adam', 'graph_mode': 'knn', 'source': 'grm', 'knn_k': 3, 'weighted_edges': True, 'symmetrize_mode': 'mutual'}. Best is trial 22 with value: 0.22255691246714887.
[I 2025-10-22 19:53:50,395] Trial 40 finished with value: 0.1613756033168447 and parameters: {'model_type': 'gat', 'hidden_dims': '[512, 64]', 'dropout': 0.329638917831869, 'batch_norm': False, 'gat_heads': 5, 'gat_attn_dropout': 0.15803155032391675, 'gat_concat_hidden': True, 'lr': 4.1929597037410787e-05, 'weight_decay': 6.998414800033718e-07, 'epochs': 284, 'loss': 'mse', 'optimizer': 'adam', 'graph_mode': 'cutoff', 'cutoff': 0.2172105245914876, 'grm_norm': 'none', 'self_loops': False}. Best is trial 22 with value: 0.22255691246714887.
[I 2025-10-22 19:59:01,298] Trial 41 finished with value: 0.21124084159324305 and parameters: {'model_type': 'gat', 'hidden_dims': '[512, 64]', 'dropout': 0.27645583704699056, 'batch_norm': False, 'gat_heads': 3, 'gat_attn_dropout': 0.28097906294575986, 'gat_concat_hidden': True, 'lr': 0.0001452321623256529, 'weight_decay': 1.6684776726538978e-07, 'epochs': 348, 'loss': 'mse', 'optimizer': 'adam', 'graph_mode': 'cutoff', 'cutoff': 0.791012053900081, 'grm_norm': 'none', 'self_loops': False}. Best is trial 22 with value: 0.22255691246714887.
[I 2025-10-22 20:01:52,263] Trial 42 finished with value: 0.20575781853482358 and parameters: {'model_type': 'gat', 'hidden_dims': '[256, 128]', 'dropout': 0.17324822090339978, 'batch_norm': False, 'gat_heads': 3, 'gat_attn_dropout': 0.3966884771410104, 'gat_concat_hidden': True, 'lr': 7.905849786155671e-05, 'weight_decay': 3.6379243229864723e-07, 'epochs': 327, 'loss': 'mse', 'optimizer': 'adam', 'graph_mode': 'cutoff', 'cutoff': 0.6944064410755496, 'grm_norm': 'none', 'self_loops': False}. Best is trial 22 with value: 0.22255691246714887.
[I 2025-10-22 20:05:02,927] Trial 43 finished with value: 0.20902120759099513 and parameters: {'model_type': 'gat', 'hidden_dims': '[256, 128, 64]', 'dropout': 0.20077427321089725, 'batch_norm': False, 'gat_heads': 4, 'gat_attn_dropout': 0.25968270878841854, 'gat_concat_hidden': True, 'lr': 0.0003126474412626683, 'weight_decay': 1.7249454944118295e-07, 'epochs': 310, 'loss': 'mse', 'optimizer': 'adam', 'graph_mode': 'cutoff', 'cutoff': 0.8252138399154422, 'grm_norm': 'cosine_then_gcn', 'self_loops': False}. Best is trial 22 with value: 0.22255691246714887.
[I 2025-10-22 20:15:25,442] Trial 44 finished with value: 0.208109150576473 and parameters: {'model_type': 'gat', 'hidden_dims': '[512, 64]', 'dropout': 0.5877647535124694, 'batch_norm': False, 'gat_heads': 6, 'gat_attn_dropout': 0.4967763016773159, 'gat_concat_hidden': True, 'lr': 0.00011481592381352742, 'weight_decay': 3.972007159417449e-05, 'epochs': 350, 'loss': 'mse', 'optimizer': 'adam', 'graph_mode': 'cutoff', 'cutoff': 0.7381741778264506, 'grm_norm': 'none', 'self_loops': False}. Best is trial 22 with value: 0.22255691246714887.
[I 2025-10-22 20:26:18,308] Trial 45 finished with value: 0.1663505608795572 and parameters: {'model_type': 'gat', 'hidden_dims': '[512, 128]', 'dropout': 0.13349103533060747, 'batch_norm': True, 'gat_heads': 7, 'gat_attn_dropout': 0.3051093291124368, 'gat_concat_hidden': True, 'lr': 5.865639426540594e-05, 'weight_decay': 3.9046064744721284e-07, 'epochs': 298, 'loss': 'mae', 'optimizer': 'adam', 'graph_mode': 'cutoff', 'cutoff': 0.47554852079745974, 'grm_norm': 'cosine_then_gcn', 'self_loops': False}. Best is trial 22 with value: 0.22255691246714887.
