[I 2025-11-03 14:23:13,184] Trial 27 finished with value: 0.042948099775744576 and parameters: {'model_type': 'gcn', 'hidden_dims': '[512, 256]', 'dropout': 0.22354797310019775, 'batch_norm': True, 'lr': 1.293065678896477e-06, 'weight_decay': 3.5391778131295446e-07, 'epochs': 245, 'loss': 'mse', 'optimizer': 'adam', 'graph_mode': 'cutoff', 'cutoff': 0.8907049599927799, 'grm_norm': 'none', 'self_loops': True, 'use_snp_selection': False}. Best is trial 18 with value: 0.12318528766360964.
[I 2025-11-03 14:23:15,328] Trial 28 finished with value: 0.06669066665216367 and parameters: {'model_type': 'gcn', 'hidden_dims': '[256, 128]', 'dropout': 0.337038516452845, 'batch_norm': True, 'lr': 9.656074681221489e-05, 'weight_decay': 3.761935758140749e-05, 'epochs': 231, 'loss': 'mae', 'optimizer': 'adam', 'graph_mode': 'knn', 'source': 'grm', 'knn_k': 2, 'weighted_edges': True, 'symmetrize_mode': 'union', 'use_snp_selection': False}. Best is trial 18 with value: 0.12318528766360964.
[I 2025-11-03 14:23:17,470] Trial 29 finished with value: -0.005183513624511497 and parameters: {'model_type': 'gcn', 'hidden_dims': '[256, 128, 64]', 'dropout': 0.1881763221627633, 'batch_norm': True, 'lr': 4.408910157194893e-06, 'weight_decay': 8.368908757919738e-05, 'epochs': 190, 'loss': 'mae', 'optimizer': 'adam', 'graph_mode': 'knn', 'source': 'grm', 'knn_k': 5, 'weighted_edges': False, 'symmetrize_mode': 'mutual', 'use_snp_selection': False}. Best is trial 18 with value: 0.12318528766360964.
[I 2025-11-03 14:23:21,065] Trial 30 finished with value: 0.1180086964138068 and parameters: {'model_type': 'gcn', 'hidden_dims': '[512, 128]', 'dropout': 0.5511609509336903, 'batch_norm': True, 'lr': 0.0002620559569998059, 'weight_decay': 6.560859181474708e-06, 'epochs': 330, 'loss': 'mae', 'optimizer': 'adam', 'graph_mode': 'knn', 'source': 'grm', 'knn_k': 2, 'weighted_edges': True, 'symmetrize_mode': 'mutual', 'use_snp_selection': False}. Best is trial 18 with value: 0.12318528766360964.
[I 2025-11-03 14:23:24,644] Trial 31 finished with value: 0.11512200150978444 and parameters: {'model_type': 'gcn', 'hidden_dims': '[512, 128]', 'dropout': 0.55612660315133, 'batch_norm': True, 'lr': 0.0002833646511186016, 'weight_decay': 5.8242693910840315e-06, 'epochs': 328, 'loss': 'mae', 'optimizer': 'adam', 'graph_mode': 'knn', 'source': 'grm', 'knn_k': 2, 'weighted_edges': True, 'symmetrize_mode': 'mutual', 'use_snp_selection': False}. Best is trial 18 with value: 0.12318528766360964.
[I 2025-11-03 14:23:28,333] Trial 32 finished with value: 0.1258622504967447 and parameters: {'model_type': 'gcn', 'hidden_dims': '[512, 128]', 'dropout': 0.596179741450005, 'batch_norm': True, 'lr': 0.0005901224803799996, 'weight_decay': 1.492091602181763e-06, 'epochs': 343, 'loss': 'mae', 'optimizer': 'adam', 'graph_mode': 'knn', 'source': 'grm', 'knn_k': 1, 'weighted_edges': True, 'symmetrize_mode': 'mutual', 'use_snp_selection': False}. Best is trial 32 with value: 0.1258622504967447.
[I 2025-11-03 14:23:29,818] Trial 33 finished with value: 0.11294083270316443 and parameters: {'model_type': 'gcn', 'hidden_dims': '[128, 64]', 'dropout': 0.5205758274127019, 'batch_norm': True, 'lr': 0.0005845579460772564, 'weight_decay': 1.7540612871821285e-06, 'epochs': 151, 'loss': 'mae', 'optimizer': 'adam', 'graph_mode': 'knn', 'source': 'grm', 'knn_k': 1, 'weighted_edges': True, 'symmetrize_mode': 'mutual', 'use_snp_selection': False}. Best is trial 32 with value: 0.1258622504967447.
[I 2025-11-03 14:23:31,857] Trial 34 finished with value: 0.12276979957974025 and parameters: {'model_type': 'gcn', 'hidden_dims': '[512, 128]', 'dropout': 0.5973777271739984, 'batch_norm': True, 'lr': 0.0005726883878258849, 'weight_decay': 1.600488985978731e-06, 'epochs': 113, 'loss': 'mse', 'optimizer': 'adam', 'graph_mode': 'knn', 'source': 'grm', 'knn_k': 1, 'weighted_edges': True, 'symmetrize_mode': 'mutual', 'use_snp_selection': False}. Best is trial 32 with value: 0.1258622504967447.
[I 2025-11-03 14:23:33,061] Trial 35 finished with value: 0.08761363670130885 and parameters: {'model_type': 'gcn', 'hidden_dims': '[512, 128]', 'dropout': 0.5920297257159557, 'batch_norm': False, 'lr': 0.0005781128500934429, 'weight_decay': 1.7287379259270379e-06, 'epochs': 55, 'loss': 'mse', 'optimizer': 'adam', 'graph_mode': 'knn', 'source': 'grm', 'knn_k': 3, 'weighted_edges': True, 'symmetrize_mode': 'mutual', 'use_snp_selection': True, 'num_snps': 2074}. Best is trial 32 with value: 0.1258622504967447.
[I 2025-11-03 14:23:34,748] Trial 36 finished with value: 0.08214455911341287 and parameters: {'model_type': 'gcn', 'hidden_dims': '[512, 128]', 'dropout': 0.5667295498170544, 'batch_norm': True, 'lr': 0.0005449952264823289, 'weight_decay': 4.76499271742898e-07, 'epochs': 59, 'loss': 'mse', 'optimizer': 'adam', 'graph_mode': 'cutoff', 'cutoff': 0.42596163795855535, 'grm_norm': 'cosine', 'self_loops': True, 'use_snp_selection': False}. Best is trial 32 with value: 0.1258622504967447.
[I 2025-11-03 14:23:36,670] Trial 37 finished with value: 0.013701283655047554 and parameters: {'model_type': 'gcn', 'hidden_dims': '[512, 128]', 'dropout': 0.5288773816827776, 'batch_norm': False, 'lr': 0.0006873689925773292, 'weight_decay': 1.1854246559102761e-06, 'epochs': 121, 'loss': 'mse', 'optimizer': 'adam', 'graph_mode': 'knn', 'source': 'grm', 'knn_k': 9, 'weighted_edges': True, 'symmetrize_mode': 'mutual', 'use_snp_selection': True, 'num_snps': 15344}. Best is trial 32 with value: 0.1258622504967447.
[I 2025-11-03 14:23:38,195] Trial 38 finished with value: 0.13874813886098575 and parameters: {'model_type': 'gcn', 'hidden_dims': '[128, 64]', 'dropout': 0.4852541607606197, 'batch_norm': True, 'lr': 0.0009492982034907802, 'weight_decay': 3.2681199044375936e-06, 'epochs': 164, 'loss': 'mse', 'optimizer': 'adam', 'graph_mode': 'knn', 'source': 'grm', 'knn_k': 2, 'weighted_edges': True, 'symmetrize_mode': 'mutual', 'use_snp_selection': False}. Best is trial 38 with value: 0.13874813886098575.
[I 2025-11-03 14:23:41,949] Trial 39 finished with value: -0.01367196868165741 and parameters: {'model_type': 'gcn', 'hidden_dims': '[128, 64]', 'dropout': 0.46138597813591675, 'batch_norm': False, 'lr': 0.0009557168800156974, 'weight_decay': 3.85453334206501e-06, 'epochs': 347, 'loss': 'mse', 'optimizer': 'adam', 'graph_mode': 'cutoff', 'cutoff': 0.8982975816958216, 'grm_norm': 'cosine_then_gcn', 'self_loops': True, 'use_snp_selection': True, 'num_snps': 58379}. Best is trial 38 with value: 0.13874813886098575.
[I 2025-11-03 14:23:43,338] Trial 40 finished with value: 0.12640933533657908 and parameters: {'model_type': 'gcn', 'hidden_dims': '[128, 64]', 'dropout': 0.5013167760955579, 'batch_norm': True, 'lr': 0.0004254159209778193, 'weight_decay': 3.937554072638294e-06, 'epochs': 111, 'loss': 'mse', 'optimizer': 'adam', 'graph_mode': 'knn', 'source': 'grm', 'knn_k': 1, 'weighted_edges': True, 'symmetrize_mode': 'union', 'use_snp_selection': False}. Best is trial 38 with value: 0.13874813886098575.
[I 2025-11-03 14:23:44,661] Trial 41 finished with value: 0.12073267073631969 and parameters: {'model_type': 'gcn', 'hidden_dims': '[128, 64]', 'dropout': 0.4901868922510784, 'batch_norm': True, 'lr': 0.0004156552901558141, 'weight_decay': 2.788048163994496e-06, 'epochs': 104, 'loss': 'mse', 'optimizer': 'adam', 'graph_mode': 'knn', 'source': 'grm', 'knn_k': 1, 'weighted_edges': True, 'symmetrize_mode': 'union', 'use_snp_selection': False}. Best is trial 38 with value: 0.13874813886098575.
[I 2025-11-03 14:23:45,864] Trial 42 finished with value: 0.13101666500479514 and parameters: {'model_type': 'gcn', 'hidden_dims': '[128, 64]', 'dropout': 0.4276728406162846, 'batch_norm': True, 'lr': 0.0006735262574176528, 'weight_decay': 1.4901072813859586e-06, 'epochs': 68, 'loss': 'mse', 'optimizer': 'adam', 'graph_mode': 'knn', 'source': 'grm', 'knn_k': 1, 'weighted_edges': True, 'symmetrize_mode': 'union', 'use_snp_selection': False}. Best is trial 38 with value: 0.13874813886098575.
[I 2025-11-03 14:23:47,150] Trial 43 finished with value: 0.09762092901939141 and parameters: {'model_type': 'gcn', 'hidden_dims': '[128, 64]', 'dropout': 0.4103643027334274, 'batch_norm': True, 'lr': 0.000740588966232343, 'weight_decay': 9.874505142553118e-06, 'epochs': 79, 'loss': 'mse', 'optimizer': 'adam', 'graph_mode': 'knn', 'source': 'grm', 'knn_k': 7, 'weighted_edges': True, 'symmetrize_mode': 'union', 'use_snp_selection': False}. Best is trial 38 with value: 0.13874813886098575.
[I 2025-11-03 14:23:48,160] Trial 44 finished with value: 0.07907100880945182 and parameters: {'model_type': 'gcn', 'hidden_dims': '[128, 64]', 'dropout': 0.44437340695476646, 'batch_norm': True, 'lr': 0.00041329571814370655, 'weight_decay': 4.067723656201271e-06, 'epochs': 8, 'loss': 'mse', 'optimizer': 'adam', 'graph_mode': 'knn', 'source': 'grm', 'knn_k': 2, 'weighted_edges': True, 'symmetrize_mode': 'union', 'use_snp_selection': False}. Best is trial 38 with value: 0.13874813886098575.
[I 2025-11-03 14:23:49,410] Trial 45 finished with value: 0.06176210796507654 and parameters: {'model_type': 'gcn', 'hidden_dims': '[128, 64]', 'dropout': 0.5048705454822823, 'batch_norm': True, 'lr': 0.00019454613905708998, 'weight_decay': 6.669102549509717e-07, 'epochs': 77, 'loss': 'mse', 'optimizer': 'adam', 'graph_mode': 'cutoff', 'cutoff': 0.4585737354176531, 'grm_norm': 'cosine', 'self_loops': False, 'use_snp_selection': False}. Best is trial 38 with value: 0.13874813886098575.
[I 2025-11-03 14:23:50,525] Trial 46 finished with value: 0.12149600119468013 and parameters: {'model_type': 'gcn', 'hidden_dims': '[128, 64]', 'dropout': 0.42723850850772505, 'batch_norm': True, 'lr': 0.000690159166706438, 'weight_decay': 2.6944937719599034e-05, 'epochs': 39, 'loss': 'mse', 'optimizer': 'adam', 'graph_mode': 'knn', 'source': 'grm', 'knn_k': 1, 'weighted_edges': True, 'symmetrize_mode': 'union', 'use_snp_selection': False}. Best is trial 38 with value: 0.13874813886098575.
[I 2025-11-03 14:23:51,958] Trial 47 finished with value: 0.10273369650636327 and parameters: {'model_type': 'gcn', 'hidden_dims': '[128, 64]', 'dropout': 0.3835107338444291, 'batch_norm': True, 'lr': 0.00012414277801751783, 'weight_decay': 2.6646865499789976e-06, 'epochs': 135, 'loss': 'mse', 'optimizer': 'adam', 'graph_mode': 'knn', 'source': 'grm', 'knn_k': 1, 'weighted_edges': True, 'symmetrize_mode': 'union', 'use_snp_selection': False}. Best is trial 38 with value: 0.13874813886098575.
[I 2025-11-03 14:23:54,641] Trial 48 finished with value: 0.09908231932532495 and parameters: {'model_type': 'gcn', 'hidden_dims': '[128, 64]', 'dropout': 0.49480899137929124, 'batch_norm': False, 'lr': 4.576459262255606e-05, 'weight_decay': 1.1811044150340357e-06, 'epochs': 156, 'loss': 'mse', 'optimizer': 'adam', 'graph_mode': 'knn', 'source': 'grm', 'knn_k': 3, 'weighted_edges': True, 'symmetrize_mode': 'union', 'use_snp_selection': True, 'num_snps': 42595}. Best is trial 38 with value: 0.13874813886098575.
[I 2025-11-03 14:23:56,580] Trial 49 finished with value: 0.14342353120882104 and parameters: {'model_type': 'gcn', 'hidden_dims': '[256, 128]', 'dropout': 0.5393740782048595, 'batch_norm': True, 'lr': 0.0009537414120652792, 'weight_decay': 2.4574198906405045e-07, 'epochs': 170, 'loss': 'mse', 'optimizer': 'adam', 'graph_mode': 'knn', 'source': 'grm', 'knn_k': 1, 'weighted_edges': True, 'symmetrize_mode': 'union', 'use_snp_selection': False}. Best is trial 49 with value: 0.14342353120882104.
[I 2025-11-03 14:23:58,396] Trial 50 finished with value: 0.028301981677880186 and parameters: {'model_type': 'gcn', 'hidden_dims': '[256, 128]', 'dropout': 0.5389794646699511, 'batch_norm': True, 'lr': 1.258489841580828e-05, 'weight_decay': 2.0533418020086737e-07, 'epochs': 169, 'loss': 'mse', 'optimizer': 'adam', 'graph_mode': 'cutoff', 'cutoff': 0.20628834676422192, 'grm_norm': 'none', 'self_loops': True, 'use_snp_selection': False}. Best is trial 49 with value: 0.14342353120882104.
[I 2025-11-03 14:23:59,617] Trial 51 finished with value: 0.11148166252313457 and parameters: {'model_type': 'gcn', 'hidden_dims': '[256, 128]', 'dropout': 0.517456625813514, 'batch_norm': True, 'lr': 0.0009120570404645047, 'weight_decay': 2.7084176812584603e-07, 'epochs': 32, 'loss': 'mse', 'optimizer': 'adam', 'graph_mode': 'knn', 'source': 'grm', 'knn_k': 1, 'weighted_edges': True, 'symmetrize_mode': 'union', 'use_snp_selection': False}. Best is trial 49 with value: 0.14342353120882104.
[I 2025-11-03 14:24:01,328] Trial 52 finished with value: 0.13055098723822625 and parameters: {'model_type': 'gcn', 'hidden_dims': '[256, 128]', 'dropout': 0.45107278617348767, 'batch_norm': True, 'lr': 0.000998339548612778, 'weight_decay': 8.922254633824263e-06, 'epochs': 136, 'loss': 'mse', 'optimizer': 'adam', 'graph_mode': 'knn', 'source': 'grm', 'knn_k': 1, 'weighted_edges': True, 'symmetrize_mode': 'union', 'use_snp_selection': False}. Best is trial 49 with value: 0.14342353120882104.
[I 2025-11-03 14:24:03,174] Trial 53 finished with value: 0.13454804502336526 and parameters: {'model_type': 'gcn', 'hidden_dims': '[256, 128]', 'dropout': 0.4600909435286782, 'batch_norm': True, 'lr': 0.0004821133107932891, 'weight_decay': 1.3905671986055664e-05, 'epochs': 168, 'loss': 'mse', 'optimizer': 'adam', 'graph_mode': 'knn', 'source': 'grm', 'knn_k': 1, 'weighted_edges': True, 'symmetrize_mode': 'union', 'use_snp_selection': False}. Best is trial 49 with value: 0.14342353120882104.
[I 2025-11-03 14:24:05,027] Trial 54 finished with value: 0.1167754222688639 and parameters: {'model_type': 'gcn', 'hidden_dims': '[256, 128]', 'dropout': 0.4538574886498396, 'batch_norm': True, 'lr': 0.0003770985498824244, 'weight_decay': 1.6263813758361182e-05, 'epochs': 168, 'loss': 'mse', 'optimizer': 'adam', 'graph_mode': 'knn', 'source': 'grm', 'knn_k': 2, 'weighted_edges': True, 'symmetrize_mode': 'union', 'use_snp_selection': False}. Best is trial 49 with value: 0.14342353120882104.
[I 2025-11-03 14:24:06,729] Trial 55 finished with value: 0.13100862840554958 and parameters: {'model_type': 'gcn', 'hidden_dims': '[256, 128]', 'dropout': 0.4159706791525509, 'batch_norm': True, 'lr': 0.00047188429153412475, 'weight_decay': 1.0494805609992171e-07, 'epochs': 133, 'loss': 'mse', 'optimizer': 'adam', 'graph_mode': 'knn', 'source': 'grm', 'knn_k': 1, 'weighted_edges': True, 'symmetrize_mode': 'union', 'use_snp_selection': False}. Best is trial 49 with value: 0.14342353120882104.
[I 2025-11-03 14:24:08,433] Trial 56 finished with value: 0.10945383869556526 and parameters: {'model_type': 'gcn', 'hidden_dims': '[256, 128]', 'dropout': 0.4309603961734363, 'batch_norm': True, 'lr': 0.0007036497566855919, 'weight_decay': 1.219656897388857e-07, 'epochs': 138, 'loss': 'mse', 'optimizer': 'adam', 'graph_mode': 'knn', 'source': 'grm', 'knn_k': 1, 'weighted_edges': True, 'symmetrize_mode': 'union', 'use_snp_selection': False}. Best is trial 49 with value: 0.14342353120882104.
[I 2025-11-03 14:24:10,260] Trial 57 finished with value: 0.05425420276712115 and parameters: {'model_type': 'gcn', 'hidden_dims': '[256, 128]', 'dropout': 0.4117196942453956, 'batch_norm': True, 'lr': 2.2806895089210215e-05, 'weight_decay': 1.3689025910872652e-07, 'epochs': 156, 'loss': 'mse', 'optimizer': 'adam', 'graph_mode': 'knn', 'source': 'grm', 'knn_k': 7, 'weighted_edges': True, 'symmetrize_mode': 'union', 'use_snp_selection': False}. Best is trial 49 with value: 0.14342353120882104.
[I 2025-11-03 14:24:11,912] Trial 58 finished with value: 0.1348314295905041 and parameters: {'model_type': 'gcn', 'hidden_dims': '[256, 128]', 'dropout': 0.4689579650971932, 'batch_norm': True, 'lr': 0.0005117489541824156, 'weight_decay': 9.913145351443953e-06, 'epochs': 124, 'loss': 'mse', 'optimizer': 'adam', 'graph_mode': 'knn', 'source': 'grm', 'knn_k': 2, 'weighted_edges': True, 'symmetrize_mode': 'union', 'use_snp_selection': False}. Best is trial 49 with value: 0.14342353120882104.
[I 2025-11-03 14:24:13,590] Trial 59 finished with value: 0.09361030400001742 and parameters: {'model_type': 'gcn', 'hidden_dims': '[256, 128]', 'dropout': 0.47361212397154345, 'batch_norm': True, 'lr': 0.0003459180993109852, 'weight_decay': 2.222685027929252e-07, 'epochs': 125, 'loss': 'mse', 'optimizer': 'adam', 'graph_mode': 'knn', 'source': 'grm', 'knn_k': 4, 'weighted_edges': True, 'symmetrize_mode': 'union', 'use_snp_selection': False}. Best is trial 49 with value: 0.14342353120882104.
[I 2025-11-03 14:24:15,485] Trial 60 finished with value: 0.11847752378042774 and parameters: {'model_type': 'gcn', 'hidden_dims': '[256, 128]', 'dropout': 0.3992896452350811, 'batch_norm': True, 'lr': 0.00020630989521530505, 'weight_decay': 6.685149563366167e-07, 'epochs': 178, 'loss': 'mse', 'optimizer': 'adam', 'graph_mode': 'knn', 'source': 'grm', 'knn_k': 2, 'weighted_edges': True, 'symmetrize_mode': 'union', 'use_snp_selection': False}. Best is trial 49 with value: 0.14342353120882104.
[I 2025-11-03 14:24:17,226] Trial 61 finished with value: 0.13841156563721338 and parameters: {'model_type': 'gcn', 'hidden_dims': '[256, 128]', 'dropout': 0.4816844342271207, 'batch_norm': True, 'lr': 0.0005024854955566522, 'weight_decay': 1.024469389288506e-05, 'epochs': 145, 'loss': 'mse', 'optimizer': 'adam', 'graph_mode': 'knn', 'source': 'grm', 'knn_k': 1, 'weighted_edges': True, 'symmetrize_mode': 'union', 'use_snp_selection': False}. Best is trial 49 with value: 0.14342353120882104.
[I 2025-11-03 14:24:19,053] Trial 62 finished with value: 0.12371319553434584 and parameters: {'model_type': 'gcn', 'hidden_dims': '[256, 128]', 'dropout': 0.48147191755189883, 'batch_norm': True, 'lr': 0.0005064253672450472, 'weight_decay': 4.056895701355035e-05, 'epochs': 166, 'loss': 'mse', 'optimizer': 'adam', 'graph_mode': 'knn', 'source': 'grm', 'knn_k': 2, 'weighted_edges': True, 'symmetrize_mode': 'union', 'use_snp_selection': False}. Best is trial 49 with value: 0.14342353120882104.
[I 2025-11-03 14:24:20,790] Trial 63 finished with value: 0.11726395088102641 and parameters: {'model_type': 'gcn', 'hidden_dims': '[256, 128]', 'dropout': 0.43298141589100886, 'batch_norm': True, 'lr': 0.0004917928285847121, 'weight_decay': 2.1843684080437496e-05, 'epochs': 149, 'loss': 'mse', 'optimizer': 'adam', 'graph_mode': 'knn', 'source': 'grm', 'knn_k': 1, 'weighted_edges': True, 'symmetrize_mode': 'union', 'use_snp_selection': False}. Best is trial 49 with value: 0.14342353120882104.
[I 2025-11-03 14:24:22,257] Trial 64 finished with value: 0.12775018821189793 and parameters: {'model_type': 'gcn', 'hidden_dims': '[256, 128]', 'dropout': 0.46768493196448824, 'batch_norm': True, 'lr': 0.000786125036647521, 'weight_decay': 1.2134705240217778e-05, 'epochs': 88, 'loss': 'mse', 'optimizer': 'adam', 'graph_mode': 'knn', 'source': 'grm', 'knn_k': 2, 'weighted_edges': True, 'symmetrize_mode': 'union', 'use_snp_selection': False}. Best is trial 49 with value: 0.14342353120882104.
[I 2025-11-03 14:24:24,426] Trial 65 finished with value: 0.052443990368543844 and parameters: {'model_type': 'gcn', 'hidden_dims': '[256, 128, 64]', 'dropout': 0.38229217134417415, 'batch_norm': True, 'lr': 3.190307709117047e-06, 'weight_decay': 1.0482086867503245e-07, 'epochs': 201, 'loss': 'mse', 'optimizer': 'adam', 'graph_mode': 'knn', 'source': 'grm', 'knn_k': 1, 'weighted_edges': True, 'symmetrize_mode': 'union', 'use_snp_selection': False}. Best is trial 49 with value: 0.14342353120882104.
[I 2025-11-03 14:24:26,042] Trial 66 finished with value: 0.11485855337194792 and parameters: {'model_type': 'gcn', 'hidden_dims': '[256, 128]', 'dropout': 0.5362000918827988, 'batch_norm': True, 'lr': 0.00024042161359344983, 'weight_decay': 6.435886752396761e-06, 'epochs': 122, 'loss': 'mse', 'optimizer': 'adam', 'graph_mode': 'knn', 'source': 'grm', 'knn_k': 2, 'weighted_edges': True, 'symmetrize_mode': 'union', 'use_snp_selection': False}. Best is trial 49 with value: 0.14342353120882104.
[I 2025-11-03 14:24:28,131] Trial 67 finished with value: 0.12645346227930862 and parameters: {'model_type': 'gcn', 'hidden_dims': '[256, 128]', 'dropout': 0.4111640415997591, 'batch_norm': False, 'lr': 0.0003045745880598283, 'weight_decay': 7.986571874150172e-05, 'epochs': 228, 'loss': 'mse', 'optimizer': 'adam', 'graph_mode': 'knn', 'source': 'grm', 'knn_k': 1, 'weighted_edges': True, 'symmetrize_mode': 'union', 'use_snp_selection': True, 'num_snps': 17897}. Best is trial 49 with value: 0.14342353120882104.
[I 2025-11-03 14:24:30,639] Trial 68 finished with value: 0.10371196053226515 and parameters: {'model_type': 'gcn', 'hidden_dims': '[512, 64]', 'dropout': 0.4837170257925843, 'batch_norm': True, 'lr': 0.0006742810748164906, 'weight_decay': 3.1046501078625906e-05, 'epochs': 177, 'loss': 'mse', 'optimizer': 'adam', 'graph_mode': 'knn', 'source': 'grm', 'knn_k': 3, 'weighted_edges': True, 'symmetrize_mode': 'union', 'use_snp_selection': False}. Best is trial 49 with value: 0.14342353120882104.
[I 2025-11-03 14:24:32,387] Trial 69 finished with value: 0.11746269777691579 and parameters: {'model_type': 'gcn', 'hidden_dims': '[256, 128]', 'dropout': 0.5124462321685157, 'batch_norm': True, 'lr': 0.00016742437941278662, 'weight_decay': 1.8532762811973182e-05, 'epochs': 160, 'loss': 'mse', 'optimizer': 'adam', 'graph_mode': 'cutoff', 'cutoff': 0.7491524523886718, 'grm_norm': 'gcn', 'self_loops': False, 'use_snp_selection': False}. Best is trial 49 with value: 0.14342353120882104.
[I 2025-11-03 14:24:34,109] Trial 70 finished with value: 0.09237628048029935 and parameters: {'model_type': 'gcn', 'hidden_dims': '[256, 128]', 'dropout': 0.4463186069423778, 'batch_norm': True, 'lr': 0.00013393775862908277, 'weight_decay': 2.891744643540245e-07, 'epochs': 144, 'loss': 'mse', 'optimizer': 'adam', 'graph_mode': 'knn', 'source': 'grm', 'knn_k': 2, 'weighted_edges': True, 'symmetrize_mode': 'union', 'use_snp_selection': False}. Best is trial 49 with value: 0.14342353120882104.
