[I 2025-11-03 13:09:43,683] Trial 133 finished with value: 0.05466312755204209 and parameters: {'model_type': 'gcn', 'hidden_dims': '[256, 128, 64]', 'dropout': 0.16842994075100368, 'batch_norm': True, 'lr': 0.00012336879329554774, 'weight_decay': 2.9169578888312943e-07, 'epochs': 127, 'loss': 'mae', 'optimizer': 'adam', 'graph_mode': 'cutoff', 'cutoff': 0.7873398059213115, 'grm_norm': 'cosine_then_gcn', 'self_loops': True, 'use_snp_selection': False}. Best is trial 86 with value: 0.09740689525741682.
[I 2025-11-03 13:09:45,459] Trial 134 finished with value: 0.050976685207014365 and parameters: {'model_type': 'gcn', 'hidden_dims': '[256, 128, 64]', 'dropout': 0.1378150896836043, 'batch_norm': True, 'lr': 0.00015612634788305564, 'weight_decay': 1.3385145688698562e-07, 'epochs': 106, 'loss': 'mae', 'optimizer': 'adam', 'graph_mode': 'cutoff', 'cutoff': 0.5876188973450085, 'grm_norm': 'cosine_then_gcn', 'self_loops': True, 'use_snp_selection': False}. Best is trial 86 with value: 0.09740689525741682.
[I 2025-11-03 13:09:47,602] Trial 135 finished with value: 0.054161563971581145 and parameters: {'model_type': 'gcn', 'hidden_dims': '[256, 128, 64]', 'dropout': 0.15997848028880007, 'batch_norm': True, 'lr': 8.490283525040337e-05, 'weight_decay': 1.8812283099255028e-07, 'epochs': 165, 'loss': 'mae', 'optimizer': 'adam', 'graph_mode': 'cutoff', 'cutoff': 0.8265576885143944, 'grm_norm': 'cosine_then_gcn', 'self_loops': True, 'use_snp_selection': False}. Best is trial 86 with value: 0.09740689525741682.
[I 2025-11-03 13:09:51,499] Trial 136 finished with value: 0.058447356958103706 and parameters: {'model_type': 'gcn', 'hidden_dims': '[512, 64]', 'dropout': 0.10989731020396042, 'batch_norm': False, 'lr': 0.0001812237347867634, 'weight_decay': 0.000542451223101037, 'epochs': 143, 'loss': 'mse', 'optimizer': 'adam', 'graph_mode': 'cutoff', 'cutoff': 0.8716024982884404, 'grm_norm': 'cosine', 'self_loops': True, 'use_snp_selection': True, 'num_snps': 48406}. Best is trial 86 with value: 0.09740689525741682.
[I 2025-11-03 13:09:53,668] Trial 137 finished with value: 0.07621895045827683 and parameters: {'model_type': 'gcn', 'hidden_dims': '[256, 128, 64]', 'dropout': 0.15145598072344557, 'batch_norm': True, 'lr': 0.00010020142015812248, 'weight_decay': 2.2651563210054226e-07, 'epochs': 159, 'loss': 'mae', 'optimizer': 'adam', 'graph_mode': 'cutoff', 'cutoff': 0.8473052710487471, 'grm_norm': 'cosine_then_gcn', 'self_loops': True, 'use_snp_selection': False}. Best is trial 86 with value: 0.09740689525741682.
[I 2025-11-03 13:09:56,626] Trial 138 finished with value: 0.03321304984066706 and parameters: {'model_type': 'gcn', 'hidden_dims': '[256, 128]', 'dropout': 0.35004443317838435, 'batch_norm': True, 'lr': 6.75781961500389e-05, 'weight_decay': 1.6960899874253406e-07, 'epochs': 337, 'loss': 'mse', 'optimizer': 'adam', 'graph_mode': 'knn', 'source': 'grm', 'knn_k': 10, 'weighted_edges': True, 'symmetrize_mode': 'union', 'use_snp_selection': False}. Best is trial 86 with value: 0.09740689525741682.
[I 2025-11-03 13:09:59,043] Trial 139 finished with value: 0.06311080935734105 and parameters: {'model_type': 'gcn', 'hidden_dims': '[512, 64]', 'dropout': 0.18185027873394083, 'batch_norm': True, 'lr': 0.0001379576151436318, 'weight_decay': 3.3859616926193875e-07, 'epochs': 128, 'loss': 'mae', 'optimizer': 'adam', 'graph_mode': 'cutoff', 'cutoff': 0.5109403853135401, 'grm_norm': 'cosine_then_gcn', 'self_loops': True, 'use_snp_selection': False}. Best is trial 86 with value: 0.09740689525741682.
[I 2025-11-03 13:10:01,178] Trial 140 finished with value: 0.04099611679892164 and parameters: {'model_type': 'gcn', 'hidden_dims': '[512, 256]', 'dropout': 0.1244346277762994, 'batch_norm': False, 'lr': 0.00022545325264035812, 'weight_decay': 4.870832803562014e-06, 'epochs': 275, 'loss': 'mse', 'optimizer': 'adam', 'graph_mode': 'cutoff', 'cutoff': 0.5551494568172384, 'grm_norm': 'gcn', 'self_loops': False, 'use_snp_selection': True, 'num_snps': 7472}. Best is trial 86 with value: 0.09740689525741682.
[I 2025-11-03 13:10:03,136] Trial 141 finished with value: 0.029478574761990277 and parameters: {'model_type': 'gcn', 'hidden_dims': '[256, 128, 64]', 'dropout': 0.13611945666407493, 'batch_norm': True, 'lr': 1.978244777315802e-05, 'weight_decay': 1.6960981446513588e-05, 'epochs': 135, 'loss': 'mae', 'optimizer': 'adam', 'graph_mode': 'cutoff', 'cutoff': 0.8849920669222825, 'grm_norm': 'cosine_then_gcn', 'self_loops': True, 'use_snp_selection': False}. Best is trial 86 with value: 0.09740689525741682.
[I 2025-11-03 13:10:05,082] Trial 142 finished with value: 0.06840512841170662 and parameters: {'model_type': 'gcn', 'hidden_dims': '[256, 128, 64]', 'dropout': 0.16951971182497186, 'batch_norm': True, 'lr': 0.00011158722075612101, 'weight_decay': 3.1271046554669976e-05, 'epochs': 134, 'loss': 'mae', 'optimizer': 'adam', 'graph_mode': 'cutoff', 'cutoff': 0.8978135977427552, 'grm_norm': 'cosine_then_gcn', 'self_loops': True, 'use_snp_selection': False}. Best is trial 86 with value: 0.09740689525741682.
[I 2025-11-03 13:10:06,940] Trial 143 finished with value: 0.07418087481931723 and parameters: {'model_type': 'gcn', 'hidden_dims': '[256, 128, 64]', 'dropout': 0.1472770819320403, 'batch_norm': True, 'lr': 0.00011597430233805315, 'weight_decay': 8.974545127840282e-06, 'epochs': 119, 'loss': 'mae', 'optimizer': 'adam', 'graph_mode': 'cutoff', 'cutoff': 0.8117642424248188, 'grm_norm': 'cosine_then_gcn', 'self_loops': True, 'use_snp_selection': False}. Best is trial 86 with value: 0.09740689525741682.
[I 2025-11-03 13:10:09,646] Trial 144 finished with value: 0.06949159945506114 and parameters: {'model_type': 'gcn', 'hidden_dims': '[256, 128, 64]', 'dropout': 0.1929181738679993, 'batch_norm': True, 'lr': 9.279593946968254e-05, 'weight_decay': 5.143210141111767e-05, 'epochs': 255, 'loss': 'mae', 'optimizer': 'adam', 'graph_mode': 'cutoff', 'cutoff': 0.8617194597223052, 'grm_norm': 'cosine_then_gcn', 'self_loops': True, 'use_snp_selection': False}. Best is trial 86 with value: 0.09740689525741682.
[I 2025-11-03 13:10:12,824] Trial 145 finished with value: 0.05230861896812659 and parameters: {'model_type': 'gcn', 'hidden_dims': '[256, 128, 64]', 'dropout': 0.14417697602520513, 'batch_norm': True, 'lr': 0.00015211450100705161, 'weight_decay': 1.4808436544321616e-05, 'epochs': 327, 'loss': 'mae', 'optimizer': 'adam', 'graph_mode': 'cutoff', 'cutoff': 0.7678380053116245, 'grm_norm': 'cosine_then_gcn', 'self_loops': True, 'use_snp_selection': False}. Best is trial 86 with value: 0.09740689525741682.
[I 2025-11-03 13:10:15,465] Trial 146 finished with value: 0.06257675288871105 and parameters: {'model_type': 'gcn', 'hidden_dims': '[256, 128]', 'dropout': 0.11671296880281372, 'batch_norm': True, 'lr': 0.00017610568172340285, 'weight_decay': 2.381470581295032e-07, 'epochs': 292, 'loss': 'mae', 'optimizer': 'adam', 'graph_mode': 'cutoff', 'cutoff': 0.8357223658697326, 'grm_norm': 'cosine_then_gcn', 'self_loops': True, 'use_snp_selection': False}. Best is trial 86 with value: 0.09740689525741682.
[I 2025-11-03 13:10:16,977] Trial 147 finished with value: 0.05503538635369089 and parameters: {'model_type': 'gcn', 'hidden_dims': '[128, 64]', 'dropout': 0.15735846410697385, 'batch_norm': True, 'lr': 8.217537027759436e-05, 'weight_decay': 1.156863480734981e-05, 'epochs': 145, 'loss': 'mse', 'optimizer': 'adam', 'graph_mode': 'cutoff', 'cutoff': 0.8807984277446428, 'grm_norm': 'cosine', 'self_loops': True, 'use_snp_selection': False}. Best is trial 86 with value: 0.09740689525741682.
[I 2025-11-03 13:10:19,074] Trial 148 finished with value: 0.025260080120271367 and parameters: {'model_type': 'gcn', 'hidden_dims': '[256, 128, 64]', 'dropout': 0.12910621055817456, 'batch_norm': False, 'lr': 0.00012870373876586232, 'weight_decay': 5.954169686508381e-07, 'epochs': 104, 'loss': 'mae', 'optimizer': 'adam', 'graph_mode': 'knn', 'source': 'grm', 'knn_k': 4, 'weighted_edges': True, 'symmetrize_mode': 'union', 'use_snp_selection': True, 'num_snps': 15342}. Best is trial 86 with value: 0.09740689525741682.
[I 2025-11-03 13:10:21,404] Trial 149 finished with value: 0.07285572353487758 and parameters: {'model_type': 'gcn', 'hidden_dims': '[512, 64]', 'dropout': 0.1752097511113876, 'batch_norm': True, 'lr': 4.3328559873512923e-05, 'weight_decay': 4.111887656854953e-07, 'epochs': 125, 'loss': 'mse', 'optimizer': 'adam', 'graph_mode': 'cutoff', 'cutoff': 0.7934937052950628, 'grm_norm': 'none', 'self_loops': True, 'use_snp_selection': False}. Best is trial 86 with value: 0.09740689525741682.
[I 2025-11-03 13:10:24,035] Trial 0 finished with value: 0.0218786271695009 and parameters: {'model_type': 'gcn', 'hidden_dims': '[128, 64]', 'dropout': 0.199031432379812, 'batch_norm': True, 'lr': 1.8408544111075837e-06, 'weight_decay': 5.5136510071208614e-05, 'epochs': 334, 'loss': 'mae', 'optimizer': 'adam', 'graph_mode': 'knn', 'source': 'grm', 'knn_k': 8, 'weighted_edges': True, 'symmetrize_mode': 'mutual', 'use_snp_selection': False}. Best is trial 0 with value: 0.0218786271695009.
[I 2025-11-03 13:10:25,191] Trial 1 finished with value: 0.11479674643317377 and parameters: {'model_type': 'gcn', 'hidden_dims': '[128, 64]', 'dropout': 0.40051947670227217, 'batch_norm': True, 'lr': 0.0005320428882732732, 'weight_decay': 1.89210117736594e-06, 'epochs': 32, 'loss': 'mse', 'optimizer': 'adam', 'graph_mode': 'knn', 'source': 'grm', 'knn_k': 7, 'weighted_edges': True, 'symmetrize_mode': 'union', 'use_snp_selection': False}. Best is trial 1 with value: 0.11479674643317377.
[I 2025-11-03 13:10:28,294] Trial 2 finished with value: 0.011712838469140119 and parameters: {'model_type': 'gcn', 'hidden_dims': '[256, 128]', 'dropout': 0.5105528289184642, 'batch_norm': False, 'lr': 0.0006804279372404962, 'weight_decay': 0.0008922815224257085, 'epochs': 160, 'loss': 'mse', 'optimizer': 'adam', 'graph_mode': 'cutoff', 'cutoff': 0.5741905641612706, 'grm_norm': 'gcn', 'self_loops': False, 'use_snp_selection': True, 'num_snps': 26910}. Best is trial 1 with value: 0.11479674643317377.
[I 2025-11-03 13:10:31,425] Trial 3 finished with value: 0.06658290920061359 and parameters: {'model_type': 'gcn', 'hidden_dims': '[256, 128, 64]', 'dropout': 0.5390483213624292, 'batch_norm': False, 'lr': 3.4705625989073525e-05, 'weight_decay': 2.4623319020131338e-05, 'epochs': 92, 'loss': 'mse', 'optimizer': 'adam', 'graph_mode': 'knn', 'source': 'grm', 'knn_k': 6, 'weighted_edges': False, 'symmetrize_mode': 'mutual', 'use_snp_selection': True, 'num_snps': 30713}. Best is trial 1 with value: 0.11479674643317377.
[I 2025-11-03 13:10:34,424] Trial 4 finished with value: 0.025793241770458546 and parameters: {'model_type': 'gcn', 'hidden_dims': '[128, 64]', 'dropout': 0.13404863676897502, 'batch_norm': False, 'lr': 0.0001431556295367288, 'weight_decay': 2.2084517750726675e-05, 'epochs': 13, 'loss': 'mae', 'optimizer': 'adam', 'graph_mode': 'cutoff', 'cutoff': 0.6714268476993044, 'grm_norm': 'none', 'self_loops': False, 'use_snp_selection': True, 'num_snps': 45645}. Best is trial 1 with value: 0.11479674643317377.
[I 2025-11-03 13:10:38,172] Trial 5 finished with value: 0.12444788962405376 and parameters: {'model_type': 'gcn', 'hidden_dims': '[256, 128]', 'dropout': 0.42253606323412096, 'batch_norm': False, 'lr': 4.238630400638805e-05, 'weight_decay': 8.074086040046576e-07, 'epochs': 134, 'loss': 'mae', 'optimizer': 'adam', 'graph_mode': 'knn', 'source': 'grm', 'knn_k': 1, 'weighted_edges': False, 'symmetrize_mode': 'mutual', 'use_snp_selection': True, 'num_snps': 43113}. Best is trial 5 with value: 0.12444788962405376.
[I 2025-11-03 13:10:42,008] Trial 6 finished with value: 0.14088675511234214 and parameters: {'model_type': 'gcn', 'hidden_dims': '[512, 256]', 'dropout': 0.3534893146320237, 'batch_norm': True, 'lr': 0.000251307964226932, 'weight_decay': 1.821819791794022e-05, 'epochs': 207, 'loss': 'mae', 'optimizer': 'adam', 'graph_mode': 'knn', 'source': 'grm', 'knn_k': 1, 'weighted_edges': True, 'symmetrize_mode': 'mutual', 'use_snp_selection': False}. Best is trial 6 with value: 0.14088675511234214.
[I 2025-11-03 13:10:45,279] Trial 7 finished with value: 0.0354953904749434 and parameters: {'model_type': 'gcn', 'hidden_dims': '[512, 256]', 'dropout': 0.1105825955860775, 'batch_norm': True, 'lr': 2.374338412754043e-05, 'weight_decay': 1.1284721123340274e-05, 'epochs': 170, 'loss': 'mse', 'optimizer': 'adam', 'graph_mode': 'cutoff', 'cutoff': 0.719872204109604, 'grm_norm': 'gcn', 'self_loops': False, 'use_snp_selection': False}. Best is trial 6 with value: 0.14088675511234214.
[I 2025-11-03 13:10:47,626] Trial 8 finished with value: 0.11328777233978757 and parameters: {'model_type': 'gcn', 'hidden_dims': '[512, 128]', 'dropout': 0.5066580418354021, 'batch_norm': True, 'lr': 0.00039213678276659976, 'weight_decay': 3.43655320802934e-06, 'epochs': 91, 'loss': 'mse', 'optimizer': 'adam', 'graph_mode': 'cutoff', 'cutoff': 0.34923059576505366, 'grm_norm': 'cosine', 'self_loops': True, 'use_snp_selection': False}. Best is trial 6 with value: 0.14088675511234214.
[I 2025-11-03 13:10:50,207] Trial 9 finished with value: 0.07234090147841432 and parameters: {'model_type': 'gcn', 'hidden_dims': '[512, 256]', 'dropout': 0.301734920240333, 'batch_norm': False, 'lr': 6.650961854953448e-06, 'weight_decay': 6.861575656590315e-05, 'epochs': 125, 'loss': 'mae', 'optimizer': 'adam', 'graph_mode': 'cutoff', 'cutoff': 0.2857569870061939, 'grm_norm': 'cosine_then_gcn', 'self_loops': False, 'use_snp_selection': True, 'num_snps': 12722}. Best is trial 6 with value: 0.14088675511234214.
[I 2025-11-03 13:10:54,730] Trial 10 finished with value: 0.1432667172693075 and parameters: {'model_type': 'gcn', 'hidden_dims': '[512, 64]', 'dropout': 0.2833599465317005, 'batch_norm': True, 'lr': 0.00016916760584270694, 'weight_decay': 1.7866650996308468e-07, 'epochs': 266, 'loss': 'mae', 'optimizer': 'adam', 'graph_mode': 'knn', 'source': 'grm', 'knn_k': 1, 'weighted_edges': True, 'symmetrize_mode': 'union', 'use_snp_selection': False}. Best is trial 10 with value: 0.1432667172693075.
[I 2025-11-03 13:10:59,266] Trial 11 finished with value: 0.14984901617707141 and parameters: {'model_type': 'gcn', 'hidden_dims': '[512, 64]', 'dropout': 0.2859699507705008, 'batch_norm': True, 'lr': 0.00012623783700890367, 'weight_decay': 1.6805209943987688e-07, 'epochs': 265, 'loss': 'mae', 'optimizer': 'adam', 'graph_mode': 'knn', 'source': 'grm', 'knn_k': 1, 'weighted_edges': True, 'symmetrize_mode': 'union', 'use_snp_selection': False}. Best is trial 11 with value: 0.14984901617707141.
[I 2025-11-03 13:11:03,891] Trial 12 finished with value: 0.10572342158590423 and parameters: {'model_type': 'gcn', 'hidden_dims': '[512, 64]', 'dropout': 0.26266132038870743, 'batch_norm': True, 'lr': 9.336280153487897e-05, 'weight_decay': 1.0551808429767219e-07, 'epochs': 270, 'loss': 'mae', 'optimizer': 'adam', 'graph_mode': 'knn', 'source': 'grm', 'knn_k': 3, 'weighted_edges': True, 'symmetrize_mode': 'union', 'use_snp_selection': False}. Best is trial 11 with value: 0.14984901617707141.
[I 2025-11-03 13:11:08,286] Trial 13 finished with value: 0.10472852375206934 and parameters: {'model_type': 'gcn', 'hidden_dims': '[512, 64]', 'dropout': 0.2687736708759205, 'batch_norm': True, 'lr': 8.732942663241711e-05, 'weight_decay': 1.1697174867672891e-07, 'epochs': 251, 'loss': 'mae', 'optimizer': 'adam', 'graph_mode': 'knn', 'source': 'grm', 'knn_k': 4, 'weighted_edges': True, 'symmetrize_mode': 'union', 'use_snp_selection': False}. Best is trial 11 with value: 0.14984901617707141.
[I 2025-11-03 13:11:13,873] Trial 14 finished with value: 0.07611677905266596 and parameters: {'model_type': 'gcn', 'hidden_dims': '[512, 64]', 'dropout': 0.19696847261698813, 'batch_norm': True, 'lr': 1.2586985041154999e-05, 'weight_decay': 3.8054513427732407e-07, 'epochs': 349, 'loss': 'mae', 'optimizer': 'adam', 'graph_mode': 'knn', 'source': 'grm', 'knn_k': 3, 'weighted_edges': True, 'symmetrize_mode': 'union', 'use_snp_selection': False}. Best is trial 11 with value: 0.14984901617707141.
[I 2025-11-03 13:11:18,610] Trial 15 finished with value: 0.14628576655473374 and parameters: {'model_type': 'gcn', 'hidden_dims': '[512, 64]', 'dropout': 0.32182199730807426, 'batch_norm': True, 'lr': 0.00016454300965981406, 'weight_decay': 4.3750989597912334e-07, 'epochs': 282, 'loss': 'mae', 'optimizer': 'adam', 'graph_mode': 'knn', 'source': 'grm', 'knn_k': 1, 'weighted_edges': True, 'symmetrize_mode': 'union', 'use_snp_selection': False}. Best is trial 11 with value: 0.14984901617707141.
[I 2025-11-03 13:11:23,794] Trial 16 finished with value: 0.08901630005802216 and parameters: {'model_type': 'gcn', 'hidden_dims': '[512, 64]', 'dropout': 0.3912763499396328, 'batch_norm': True, 'lr': 5.8155244500770475e-05, 'weight_decay': 6.966019491522892e-07, 'epochs': 309, 'loss': 'mae', 'optimizer': 'adam', 'graph_mode': 'knn', 'source': 'grm', 'knn_k': 10, 'weighted_edges': False, 'symmetrize_mode': 'union', 'use_snp_selection': False}. Best is trial 11 with value: 0.14984901617707141.
[I 2025-11-03 13:11:27,792] Trial 17 finished with value: 0.11375949495614969 and parameters: {'model_type': 'gcn', 'hidden_dims': '[512, 128]', 'dropout': 0.46671086169925924, 'batch_norm': True, 'lr': 0.00028616129463827076, 'weight_decay': 3.107383290096833e-06, 'epochs': 218, 'loss': 'mae', 'optimizer': 'adam', 'graph_mode': 'knn', 'source': 'grm', 'knn_k': 3, 'weighted_edges': True, 'symmetrize_mode': 'union', 'use_snp_selection': False}. Best is trial 11 with value: 0.14984901617707141.
[I 2025-11-03 13:11:31,423] Trial 18 finished with value: 0.11764455161565585 and parameters: {'model_type': 'gcn', 'hidden_dims': '[256, 128, 64]', 'dropout': 0.20588978637538785, 'batch_norm': True, 'lr': 0.0009303712567709796, 'weight_decay': 3.293863322548928e-07, 'epochs': 296, 'loss': 'mae', 'optimizer': 'adam', 'graph_mode': 'knn', 'source': 'grm', 'knn_k': 5, 'weighted_edges': True, 'symmetrize_mode': 'union', 'use_snp_selection': False}. Best is trial 11 with value: 0.14984901617707141.
[I 2025-11-03 13:11:35,550] Trial 19 finished with value: 0.05119887543732285 and parameters: {'model_type': 'gcn', 'hidden_dims': '[512, 64]', 'dropout': 0.3428635050089619, 'batch_norm': True, 'lr': 1.4712248825400985e-05, 'weight_decay': 9.172787270771911e-07, 'epochs': 231, 'loss': 'mae', 'optimizer': 'adam', 'graph_mode': 'knn', 'source': 'grm', 'knn_k': 2, 'weighted_edges': True, 'symmetrize_mode': 'union', 'use_snp_selection': False}. Best is trial 11 with value: 0.14984901617707141.
[I 2025-11-03 13:11:40,553] Trial 20 finished with value: 0.010760733539214893 and parameters: {'model_type': 'gcn', 'hidden_dims': '[512, 64]', 'dropout': 0.5741974551696398, 'batch_norm': True, 'lr': 3.6318419901982732e-06, 'weight_decay': 0.0006285794524056533, 'epochs': 304, 'loss': 'mae', 'optimizer': 'adam', 'graph_mode': 'knn', 'source': 'grm', 'knn_k': 2, 'weighted_edges': False, 'symmetrize_mode': 'union', 'use_snp_selection': False}. Best is trial 11 with value: 0.14984901617707141.
[I 2025-11-03 13:11:45,141] Trial 21 finished with value: 0.14387181628292445 and parameters: {'model_type': 'gcn', 'hidden_dims': '[512, 64]', 'dropout': 0.3083258386798514, 'batch_norm': True, 'lr': 0.0001552429523774223, 'weight_decay': 2.648419205762322e-07, 'epochs': 270, 'loss': 'mae', 'optimizer': 'adam', 'graph_mode': 'knn', 'source': 'grm', 'knn_k': 1, 'weighted_edges': True, 'symmetrize_mode': 'union', 'use_snp_selection': False}. Best is trial 11 with value: 0.14984901617707141.
[I 2025-11-03 13:11:49,878] Trial 22 finished with value: 0.10639769505861224 and parameters: {'model_type': 'gcn', 'hidden_dims': '[512, 64]', 'dropout': 0.33091637792526796, 'batch_norm': True, 'lr': 0.00010044183852457175, 'weight_decay': 2.6279122945689714e-07, 'epochs': 282, 'loss': 'mae', 'optimizer': 'adam', 'graph_mode': 'knn', 'source': 'grm', 'knn_k': 1, 'weighted_edges': True, 'symmetrize_mode': 'union', 'use_snp_selection': False}. Best is trial 11 with value: 0.14984901617707141.
[I 2025-11-03 13:11:53,600] Trial 23 finished with value: 0.11817416340361622 and parameters: {'model_type': 'gcn', 'hidden_dims': '[512, 64]', 'dropout': 0.2543032819439872, 'batch_norm': True, 'lr': 0.0002512028463208897, 'weight_decay': 1.3047437585940313e-06, 'epochs': 197, 'loss': 'mae', 'optimizer': 'adam', 'graph_mode': 'knn', 'source': 'grm', 'knn_k': 2, 'weighted_edges': True, 'symmetrize_mode': 'union', 'use_snp_selection': False}. Best is trial 11 with value: 0.14984901617707141.
[I 2025-11-03 13:11:57,792] Trial 24 finished with value: 0.125949863079949 and parameters: {'model_type': 'gcn', 'hidden_dims': '[512, 64]', 'dropout': 0.23144947041613645, 'batch_norm': True, 'lr': 0.0001551309792567471, 'weight_decay': 4.3799120296010357e-07, 'epochs': 234, 'loss': 'mae', 'optimizer': 'adam', 'graph_mode': 'knn', 'source': 'grm', 'knn_k': 4, 'weighted_edges': True, 'symmetrize_mode': 'union', 'use_snp_selection': False}. Best is trial 11 with value: 0.14984901617707141.
[I 2025-11-03 13:12:02,898] Trial 25 finished with value: 0.14137175236102856 and parameters: {'model_type': 'gcn', 'hidden_dims': '[512, 64]', 'dropout': 0.30901450330789504, 'batch_norm': True, 'lr': 5.240993538198321e-05, 'weight_decay': 2.6343170314188544e-06, 'epochs': 311, 'loss': 'mae', 'optimizer': 'adam', 'graph_mode': 'knn', 'source': 'grm', 'knn_k': 2, 'weighted_edges': True, 'symmetrize_mode': 'union', 'use_snp_selection': False}. Best is trial 11 with value: 0.14984901617707141.
