[I 2025-10-21 21:57:37,415] Trial 98 finished with value: 0.04190000936919426 and parameters: {'model_type': 'gat', 'hidden_dims': '[512, 64]', 'dropout': 0.162387824723005, 'batch_norm': False, 'gat_heads': 6, 'gat_attn_dropout': 0.22702909376815178, 'gat_concat_hidden': True, 'lr': 0.000852603807951789, 'weight_decay': 0.0004021868627269089, 'epochs': 138, 'loss': 'mae', 'optimizer': 'adam', 'graph_mode': 'knn', 'source': 'grm', 'knn_k': 7, 'weighted_edges': False, 'symmetrize_mode': 'union'}. Best is trial 83 with value: 0.269018692899834.
[I 2025-10-21 21:58:15,100] Trial 99 finished with value: 0.12632084187752265 and parameters: {'model_type': 'gat', 'hidden_dims': '[512, 64]', 'dropout': 0.12450681023490945, 'batch_norm': False, 'gat_heads': 1, 'gat_attn_dropout': 0.12495165629550377, 'gat_concat_hidden': True, 'lr': 0.0004739464992245824, 'weight_decay': 3.8837918683679274e-05, 'epochs': 106, 'loss': 'mae', 'optimizer': 'adam', 'graph_mode': 'cutoff', 'cutoff': 0.8390732313937479, 'grm_norm': 'none', 'self_loops': False}. Best is trial 83 with value: 0.269018692899834.
[I 2025-10-21 22:06:29,798] Trial 100 finished with value: 0.23862236218424582 and parameters: {'model_type': 'gat', 'hidden_dims': '[512, 64]', 'dropout': 0.13678358874358568, 'batch_norm': False, 'gat_heads': 5, 'gat_attn_dropout': 0.14044172693818305, 'gat_concat_hidden': True, 'lr': 0.00033291573810534635, 'weight_decay': 0.0001094132355688131, 'epochs': 328, 'loss': 'mae', 'optimizer': 'adam', 'graph_mode': 'cutoff', 'cutoff': 0.8766500170476726, 'grm_norm': 'none', 'self_loops': False}. Best is trial 83 with value: 0.269018692899834.
[I 2025-10-21 22:18:33,381] Trial 101 finished with value: 0.242580252733081 and parameters: {'model_type': 'gat', 'hidden_dims': '[512, 128]', 'dropout': 0.15489408464156315, 'batch_norm': False, 'gat_heads': 7, 'gat_attn_dropout': 0.03076676649067636, 'gat_concat_hidden': True, 'lr': 0.0006675941869276261, 'weight_decay': 0.0005227612299434026, 'epochs': 348, 'loss': 'mae', 'optimizer': 'adam', 'graph_mode': 'cutoff', 'cutoff': 0.8353047702786881, 'grm_norm': 'none', 'self_loops': False}. Best is trial 83 with value: 0.269018692899834.
[I 2025-10-21 22:20:51,552] Trial 102 finished with value: 0.25235332103537106 and parameters: {'model_type': 'gat', 'hidden_dims': '[128, 64]', 'dropout': 0.12303359044291942, 'batch_norm': False, 'gat_heads': 6, 'gat_attn_dropout': 0.16365328537571694, 'gat_concat_hidden': True, 'lr': 0.0003008471491610411, 'weight_decay': 0.0002799284892972039, 'epochs': 265, 'loss': 'mae', 'optimizer': 'adam', 'graph_mode': 'cutoff', 'cutoff': 0.8583066726778715, 'grm_norm': 'none', 'self_loops': False}. Best is trial 83 with value: 0.269018692899834.
[I 2025-10-21 22:23:11,020] Trial 103 finished with value: 0.1662322934211033 and parameters: {'model_type': 'gat', 'hidden_dims': '[128, 64]', 'dropout': 0.1081314015707679, 'batch_norm': False, 'gat_heads': 6, 'gat_attn_dropout': 0.20564871561431722, 'gat_concat_hidden': True, 'lr': 1.0734192924881945e-06, 'weight_decay': 0.00029597261872790564, 'epochs': 264, 'loss': 'mae', 'optimizer': 'adam', 'graph_mode': 'cutoff', 'cutoff': 0.8568130699373835, 'grm_norm': 'none', 'self_loops': False}. Best is trial 83 with value: 0.269018692899834.
[I 2025-10-21 22:25:48,927] Trial 104 finished with value: 0.21519780083859721 and parameters: {'model_type': 'gat', 'hidden_dims': '[128, 64]', 'dropout': 0.12479886452202968, 'batch_norm': False, 'gat_heads': 6, 'gat_attn_dropout': 0.15880777092080933, 'gat_concat_hidden': True, 'lr': 0.000555297412438279, 'weight_decay': 0.00017361101565803197, 'epochs': 305, 'loss': 'mae', 'optimizer': 'adam', 'graph_mode': 'cutoff', 'cutoff': 0.795271620730402, 'grm_norm': 'none', 'self_loops': False}. Best is trial 83 with value: 0.269018692899834.
[I 2025-10-21 22:27:48,058] Trial 105 finished with value: 0.24920113159084512 and parameters: {'model_type': 'gat', 'hidden_dims': '[128, 64]', 'dropout': 0.10955834412983002, 'batch_norm': False, 'gat_heads': 5, 'gat_attn_dropout': 0.22592795551870024, 'gat_concat_hidden': True, 'lr': 0.00042695883729567687, 'weight_decay': 0.00029040317532099677, 'epochs': 275, 'loss': 'mae', 'optimizer': 'adam', 'graph_mode': 'cutoff', 'cutoff': 0.8845598995725784, 'grm_norm': 'none', 'self_loops': False}. Best is trial 83 with value: 0.269018692899834.
[I 2025-10-21 22:30:48,031] Trial 106 finished with value: 0.23502942139770325 and parameters: {'model_type': 'gat', 'hidden_dims': '[128, 64]', 'dropout': 0.13905938421461733, 'batch_norm': False, 'gat_heads': 6, 'gat_attn_dropout': 0.22645714736716532, 'gat_concat_hidden': True, 'lr': 0.00018479129143122636, 'weight_decay': 0.00027611111680978266, 'epochs': 349, 'loss': 'mae', 'optimizer': 'adam', 'graph_mode': 'cutoff', 'cutoff': 0.8209874248897597, 'grm_norm': 'none', 'self_loops': False}. Best is trial 83 with value: 0.269018692899834.
[I 2025-10-21 22:33:40,078] Trial 107 finished with value: 0.25052967139087273 and parameters: {'model_type': 'gat', 'hidden_dims': '[128, 64]', 'dropout': 0.335463413542073, 'batch_norm': False, 'gat_heads': 6, 'gat_attn_dropout': 0.1821757744848998, 'gat_concat_hidden': True, 'lr': 0.00038098287835334566, 'weight_decay': 0.0008566712205598363, 'epochs': 338, 'loss': 'mae', 'optimizer': 'adam', 'graph_mode': 'cutoff', 'cutoff': 0.8818366851601971, 'grm_norm': 'none', 'self_loops': False}. Best is trial 83 with value: 0.269018692899834.
[I 2025-10-21 22:36:27,842] Trial 108 finished with value: -0.011386886351392365 and parameters: {'model_type': 'gat', 'hidden_dims': '[128, 64]', 'dropout': 0.4083725450695207, 'batch_norm': False, 'gat_heads': 7, 'gat_attn_dropout': 0.17585505613583585, 'gat_concat_hidden': True, 'lr': 0.0007605759695608822, 'weight_decay': 0.0007895258931039435, 'epochs': 270, 'loss': 'mse', 'optimizer': 'adam', 'graph_mode': 'cutoff', 'cutoff': 0.4294910237618683, 'grm_norm': 'none', 'self_loops': False}. Best is trial 83 with value: 0.269018692899834.
[I 2025-10-21 22:38:31,313] Trial 109 finished with value: 0.2779994139152295 and parameters: {'model_type': 'gat', 'hidden_dims': '[128, 64]', 'dropout': 0.2916855169745588, 'batch_norm': False, 'gat_heads': 5, 'gat_attn_dropout': 0.18763772932891543, 'gat_concat_hidden': True, 'lr': 0.00031191305434977233, 'weight_decay': 0.0009094686954383431, 'epochs': 287, 'loss': 'mae', 'optimizer': 'adam', 'graph_mode': 'cutoff', 'cutoff': 0.8825006440831885, 'grm_norm': 'none', 'self_loops': False}. Best is trial 109 with value: 0.2779994139152295.
[I 2025-10-21 22:40:35,542] Trial 110 finished with value: 0.24744719030372128 and parameters: {'model_type': 'gat', 'hidden_dims': '[128, 64]', 'dropout': 0.3500238642038797, 'batch_norm': False, 'gat_heads': 5, 'gat_attn_dropout': 0.18702741232839643, 'gat_concat_hidden': False, 'lr': 0.00023889496472169247, 'weight_decay': 0.0007616014886639848, 'epochs': 287, 'loss': 'mae', 'optimizer': 'adam', 'graph_mode': 'cutoff', 'cutoff': 0.8805593626655609, 'grm_norm': 'none', 'self_loops': False}. Best is trial 109 with value: 0.2779994139152295.
[I 2025-10-21 22:42:42,796] Trial 111 finished with value: 0.23315121646053738 and parameters: {'model_type': 'gat', 'hidden_dims': '[128, 64]', 'dropout': 0.2862668951933237, 'batch_norm': False, 'gat_heads': 5, 'gat_attn_dropout': 0.13220901554192913, 'gat_concat_hidden': True, 'lr': 0.0002939603003769911, 'weight_decay': 0.000968040771394089, 'epochs': 294, 'loss': 'mae', 'optimizer': 'adam', 'graph_mode': 'cutoff', 'cutoff': 0.8487166185033901, 'grm_norm': 'none', 'self_loops': False}. Best is trial 109 with value: 0.2779994139152295.
[I 2025-10-21 22:44:42,992] Trial 112 finished with value: 0.2476087456537961 and parameters: {'model_type': 'gat', 'hidden_dims': '[128, 64]', 'dropout': 0.10977284554676751, 'batch_norm': False, 'gat_heads': 5, 'gat_attn_dropout': 0.1691171543580616, 'gat_concat_hidden': True, 'lr': 0.0004033501715781299, 'weight_decay': 0.0006435585603700141, 'epochs': 277, 'loss': 'mae', 'optimizer': 'adam', 'graph_mode': 'cutoff', 'cutoff': 0.8848486723117873, 'grm_norm': 'none', 'self_loops': False}. Best is trial 109 with value: 0.2779994139152295.
[I 2025-10-21 22:47:24,029] Trial 113 finished with value: 0.18084522082375237 and parameters: {'model_type': 'gat', 'hidden_dims': '[128, 64]', 'dropout': 0.3222906337739132, 'batch_norm': False, 'gat_heads': 6, 'gat_attn_dropout': 0.11143375170921398, 'gat_concat_hidden': True, 'lr': 0.0006248641171198389, 'weight_decay': 0.0004508291502258393, 'epochs': 314, 'loss': 'mae', 'optimizer': 'adam', 'graph_mode': 'cutoff', 'cutoff': 0.8249733773007568, 'grm_norm': 'none', 'self_loops': False}. Best is trial 109 with value: 0.2779994139152295.
[I 2025-10-21 22:50:14,445] Trial 114 finished with value: 0.05939222421274963 and parameters: {'model_type': 'gat', 'hidden_dims': '[128, 64]', 'dropout': 0.3232134461436211, 'batch_norm': False, 'gat_heads': 6, 'gat_attn_dropout': 0.20758067038054004, 'gat_concat_hidden': True, 'lr': 0.0009339358475292854, 'weight_decay': 0.00020954009716173623, 'epochs': 334, 'loss': 'mae', 'optimizer': 'adam', 'graph_mode': 'cutoff', 'cutoff': 0.8468319865663244, 'grm_norm': 'none', 'self_loops': False}. Best is trial 109 with value: 0.2779994139152295.
[I 2025-10-21 22:51:35,781] Trial 115 finished with value: 0.16967609201072326 and parameters: {'model_type': 'gat', 'hidden_dims': '[128, 64]', 'dropout': 0.38155572538633414, 'batch_norm': False, 'gat_heads': 4, 'gat_attn_dropout': 0.15824741759658925, 'gat_concat_hidden': True, 'lr': 0.00045452223589610854, 'weight_decay': 0.0002932824299982061, 'epochs': 252, 'loss': 'mae', 'optimizer': 'adam', 'graph_mode': 'cutoff', 'cutoff': 0.8663825956220449, 'grm_norm': 'none', 'self_loops': False}. Best is trial 109 with value: 0.2779994139152295.
[I 2025-10-21 22:52:26,070] Trial 116 finished with value: 0.09813522905172052 and parameters: {'model_type': 'gat', 'hidden_dims': '[128, 64]', 'dropout': 0.3365554584847454, 'batch_norm': False, 'gat_heads': 2, 'gat_attn_dropout': 0.184135384773372, 'gat_concat_hidden': True, 'lr': 0.0003266175178178616, 'weight_decay': 0.00014202504767268483, 'epochs': 263, 'loss': 'mae', 'optimizer': 'adam', 'graph_mode': 'cutoff', 'cutoff': 0.8816512108360227, 'grm_norm': 'none', 'self_loops': False}. Best is trial 109 with value: 0.2779994139152295.
[I 2025-10-21 22:55:38,563] Trial 117 finished with value: 0.231673086002463 and parameters: {'model_type': 'gat', 'hidden_dims': '[128, 64]', 'dropout': 0.12021791506866623, 'batch_norm': False, 'gat_heads': 7, 'gat_attn_dropout': 0.14058032284384459, 'gat_concat_hidden': True, 'lr': 0.0007203122147503987, 'weight_decay': 5.702228156098508e-05, 'epochs': 321, 'loss': 'mae', 'optimizer': 'adam', 'graph_mode': 'cutoff', 'cutoff': 0.8040404053105343, 'grm_norm': 'none', 'self_loops': False}. Best is trial 109 with value: 0.2779994139152295.
[I 2025-10-21 22:59:39,239] Trial 118 finished with value: 0.18946598262835307 and parameters: {'model_type': 'gat', 'hidden_dims': '[256, 128]', 'dropout': 0.2962131095961679, 'batch_norm': False, 'gat_heads': 5, 'gat_attn_dropout': 0.19540076721163313, 'gat_concat_hidden': True, 'lr': 0.00037251491162325443, 'weight_decay': 0.0004569289995633467, 'epochs': 283, 'loss': 'mae', 'optimizer': 'adam', 'graph_mode': 'knn', 'source': 'grm', 'knn_k': 2, 'weighted_edges': True, 'symmetrize_mode': 'mutual'}. Best is trial 109 with value: 0.2779994139152295.
[I 2025-10-21 23:02:15,509] Trial 119 finished with value: 0.021242445826526946 and parameters: {'model_type': 'gat', 'hidden_dims': '[128, 64]', 'dropout': 0.49316107177631235, 'batch_norm': False, 'gat_heads': 6, 'gat_attn_dropout': 0.22085219906887943, 'gat_concat_hidden': True, 'lr': 0.0008615038456903319, 'weight_decay': 0.0006599743689920967, 'epochs': 306, 'loss': 'mae', 'optimizer': 'adam', 'graph_mode': 'cutoff', 'cutoff': 0.8445451097824587, 'grm_norm': 'none', 'self_loops': False}. Best is trial 109 with value: 0.2779994139152295.
[I 2025-10-21 23:04:33,662] Trial 120 finished with value: 0.18516751016284846 and parameters: {'model_type': 'gat', 'hidden_dims': '[128, 64]', 'dropout': 0.25684415730095433, 'batch_norm': False, 'gat_heads': 5, 'gat_attn_dropout': 0.06492340165579134, 'gat_concat_hidden': True, 'lr': 2.9679085889869283e-06, 'weight_decay': 2.0797865299211506e-06, 'epochs': 299, 'loss': 'mae', 'optimizer': 'adam', 'graph_mode': 'cutoff', 'cutoff': 0.2515471452247914, 'grm_norm': 'none', 'self_loops': False}. Best is trial 109 with value: 0.2779994139152295.
[I 2025-10-21 23:06:32,621] Trial 121 finished with value: 0.2587139997812077 and parameters: {'model_type': 'gat', 'hidden_dims': '[128, 64]', 'dropout': 0.10863783347400477, 'batch_norm': False, 'gat_heads': 5, 'gat_attn_dropout': 0.17193476400952148, 'gat_concat_hidden': True, 'lr': 0.0004326327280739548, 'weight_decay': 0.0006911683111391892, 'epochs': 275, 'loss': 'mae', 'optimizer': 'adam', 'graph_mode': 'cutoff', 'cutoff': 0.8807073480968604, 'grm_norm': 'none', 'self_loops': False}. Best is trial 109 with value: 0.2779994139152295.
[I 2025-10-21 23:08:30,851] Trial 122 finished with value: 0.23483089900545218 and parameters: {'model_type': 'gat', 'hidden_dims': '[128, 64]', 'dropout': 0.11020232228235369, 'batch_norm': False, 'gat_heads': 5, 'gat_attn_dropout': 0.2026444823341566, 'gat_concat_hidden': True, 'lr': 0.0005440841673550424, 'weight_decay': 0.0009612186403930516, 'epochs': 274, 'loss': 'mae', 'optimizer': 'adam', 'graph_mode': 'cutoff', 'cutoff': 0.8864238302711231, 'grm_norm': 'none', 'self_loops': False}. Best is trial 109 with value: 0.2779994139152295.
[I 2025-10-21 23:09:53,391] Trial 123 finished with value: 0.06231443657992828 and parameters: {'model_type': 'gat', 'hidden_dims': '[128, 64]', 'dropout': 0.36639381967931794, 'batch_norm': False, 'gat_heads': 4, 'gat_attn_dropout': 0.23810889706135022, 'gat_concat_hidden': True, 'lr': 0.0006146663613368274, 'weight_decay': 0.0006496829216022628, 'epochs': 256, 'loss': 'mae', 'optimizer': 'adam', 'graph_mode': 'cutoff', 'cutoff': 0.8285631910525029, 'grm_norm': 'none', 'self_loops': False}. Best is trial 109 with value: 0.2779994139152295.
[I 2025-10-21 23:12:24,469] Trial 124 finished with value: 0.21689663800493494 and parameters: {'model_type': 'gat', 'hidden_dims': '[128, 64]', 'dropout': 0.14457232600671413, 'batch_norm': False, 'gat_heads': 6, 'gat_attn_dropout': 0.1712339567969306, 'gat_concat_hidden': True, 'lr': 0.0004622184553412694, 'weight_decay': 0.00044526093366725083, 'epochs': 292, 'loss': 'mae', 'optimizer': 'adam', 'graph_mode': 'cutoff', 'cutoff': 0.8626283626224, 'grm_norm': 'none', 'self_loops': False}. Best is trial 109 with value: 0.2779994139152295.
[I 2025-10-21 23:16:11,323] Trial 125 finished with value: 0.21523969322470618 and parameters: {'model_type': 'gat', 'hidden_dims': '[256, 128, 64]', 'dropout': 0.3922939907827888, 'batch_norm': False, 'gat_heads': 5, 'gat_attn_dropout': 0.10556180252173344, 'gat_concat_hidden': True, 'lr': 0.0003171223940594904, 'weight_decay': 0.00029922892498652944, 'epochs': 269, 'loss': 'mae', 'optimizer': 'adam', 'graph_mode': 'cutoff', 'cutoff': 0.8860795626881361, 'grm_norm': 'cosine', 'self_loops': False}. Best is trial 109 with value: 0.2779994139152295.
[I 2025-10-21 23:18:14,576] Trial 126 finished with value: 0.24898716731844264 and parameters: {'model_type': 'gat', 'hidden_dims': '[128, 64]', 'dropout': 0.22213585843857964, 'batch_norm': False, 'gat_heads': 6, 'gat_attn_dropout': 0.1462989437328475, 'gat_concat_hidden': True, 'lr': 0.00020668685575919295, 'weight_decay': 0.0008312375941706511, 'epochs': 236, 'loss': 'mae', 'optimizer': 'adam', 'graph_mode': 'cutoff', 'cutoff': 0.8591015804646395, 'grm_norm': 'none', 'self_loops': False}. Best is trial 109 with value: 0.2779994139152295.
[I 2025-10-21 23:20:08,258] Trial 127 finished with value: 0.24696647830569846 and parameters: {'model_type': 'gat', 'hidden_dims': '[128, 64]', 'dropout': 0.12016972686935289, 'batch_norm': False, 'gat_heads': 5, 'gat_attn_dropout': 0.15334809670902294, 'gat_concat_hidden': True, 'lr': 0.0003810414464710947, 'weight_decay': 0.0007651287766678262, 'epochs': 261, 'loss': 'mae', 'optimizer': 'adam', 'graph_mode': 'cutoff', 'cutoff': 0.8623257731424586, 'grm_norm': 'none', 'self_loops': False}. Best is trial 109 with value: 0.2779994139152295.
[I 2025-10-21 23:22:35,067] Trial 128 finished with value: 0.22489874766900075 and parameters: {'model_type': 'gat', 'hidden_dims': '[128, 64]', 'dropout': 0.26608148176471513, 'batch_norm': False, 'gat_heads': 6, 'gat_attn_dropout': 0.13373761308746973, 'gat_concat_hidden': True, 'lr': 0.00026584023744539266, 'weight_decay': 0.0005577792891789593, 'epochs': 283, 'loss': 'mse', 'optimizer': 'adam', 'graph_mode': 'cutoff', 'cutoff': 0.8443841622489788, 'grm_norm': 'none', 'self_loops': False}. Best is trial 109 with value: 0.2779994139152295.
[I 2025-10-21 23:24:32,132] Trial 129 finished with value: 0.21883748118288565 and parameters: {'model_type': 'gat', 'hidden_dims': '[128, 64]', 'dropout': 0.3020044259695216, 'batch_norm': False, 'gat_heads': 5, 'gat_attn_dropout': 0.08759131016118249, 'gat_concat_hidden': True, 'lr': 0.0002302941316774104, 'weight_decay': 0.0009511425279123474, 'epochs': 272, 'loss': 'mae', 'optimizer': 'adam', 'graph_mode': 'cutoff', 'cutoff': 0.8730210328592779, 'grm_norm': 'none', 'self_loops': False}. Best is trial 109 with value: 0.2779994139152295.
[I 2025-10-21 23:28:41,878] Trial 130 finished with value: 0.2420993546677328 and parameters: {'model_type': 'gat', 'hidden_dims': '[256, 128, 64]', 'dropout': 0.24514247012432133, 'batch_norm': False, 'gat_heads': 7, 'gat_attn_dropout': 0.11774092757147744, 'gat_concat_hidden': False, 'lr': 0.000188993500369069, 'weight_decay': 4.777455981984968e-06, 'epochs': 234, 'loss': 'mae', 'optimizer': 'adam', 'graph_mode': 'cutoff', 'cutoff': 0.890072028010781, 'grm_norm': 'none', 'self_loops': False}. Best is trial 109 with value: 0.2779994139152295.
[I 2025-10-21 23:31:28,710] Trial 131 finished with value: 0.1747171087596459 and parameters: {'model_type': 'gat', 'hidden_dims': '[128, 64]', 'dropout': 0.2184792418741463, 'batch_norm': False, 'gat_heads': 6, 'gat_attn_dropout': 0.17760887953611104, 'gat_concat_hidden': True, 'lr': 0.0005599110398230788, 'weight_decay': 1.3736591763247452e-06, 'epochs': 327, 'loss': 'mae', 'optimizer': 'adam', 'graph_mode': 'cutoff', 'cutoff': 0.8552058110362359, 'grm_norm': 'none', 'self_loops': False}. Best is trial 109 with value: 0.2779994139152295.
[I 2025-10-21 23:41:27,294] Trial 132 finished with value: 0.2393337137709421 and parameters: {'model_type': 'gat', 'hidden_dims': '[512, 128]', 'dropout': 0.1329862947163596, 'batch_norm': False, 'gat_heads': 6, 'gat_attn_dropout': 0.1941463520535456, 'gat_concat_hidden': True, 'lr': 0.0005003222284802898, 'weight_decay': 1.695336208549902e-07, 'epochs': 337, 'loss': 'mae', 'optimizer': 'adam', 'graph_mode': 'cutoff', 'cutoff': 0.8191209723082264, 'grm_norm': 'none', 'self_loops': False}. Best is trial 109 with value: 0.2779994139152295.
[I 2025-10-21 23:46:44,253] Trial 133 finished with value: 0.25740161491662517 and parameters: {'model_type': 'gat', 'hidden_dims': '[256, 128, 64]', 'dropout': 0.15284023419784137, 'batch_norm': False, 'gat_heads': 6, 'gat_attn_dropout': 0.25493854102922175, 'gat_concat_hidden': True, 'lr': 0.0007698864143351676, 'weight_decay': 0.00033647846362960105, 'epochs': 350, 'loss': 'mae', 'optimizer': 'adam', 'graph_mode': 'cutoff', 'cutoff': 0.8307452408141374, 'grm_norm': 'none', 'self_loops': False}. Best is trial 109 with value: 0.2779994139152295.
[I 2025-10-21 23:50:58,937] Trial 134 finished with value: 0.23334363291568802 and parameters: {'model_type': 'gat', 'hidden_dims': '[256, 128, 64]', 'dropout': 0.10103838890425479, 'batch_norm': False, 'gat_heads': 6, 'gat_attn_dropout': 0.2776406876743531, 'gat_concat_hidden': True, 'lr': 0.0007884786542885337, 'weight_decay': 0.00035995250326098147, 'epochs': 278, 'loss': 'mae', 'optimizer': 'adam', 'graph_mode': 'cutoff', 'cutoff': 0.8358659586491899, 'grm_norm': 'gcn', 'self_loops': False}. Best is trial 109 with value: 0.2779994139152295.
[I 2025-10-21 23:55:01,318] Trial 135 finished with value: 0.26385834996105134 and parameters: {'model_type': 'gat', 'hidden_dims': '[256, 128, 64]', 'dropout': 0.19736771544980913, 'batch_norm': False, 'gat_heads': 6, 'gat_attn_dropout': 0.25229592759037744, 'gat_concat_hidden': True, 'lr': 0.000980081266457025, 'weight_decay': 0.0006736067799688681, 'epochs': 265, 'loss': 'mae', 'optimizer': 'adam', 'graph_mode': 'cutoff', 'cutoff': 0.8718169075693917, 'grm_norm': 'none', 'self_loops': False}. Best is trial 109 with value: 0.2779994139152295.
[I 2025-10-21 23:59:24,271] Trial 136 finished with value: 0.2448954540685052 and parameters: {'model_type': 'gat', 'hidden_dims': '[256, 128, 64]', 'dropout': 0.20682556399921484, 'batch_norm': False, 'gat_heads': 6, 'gat_attn_dropout': 0.24409009355530364, 'gat_concat_hidden': True, 'lr': 0.0009703745164058811, 'weight_decay': 0.0006501892559561481, 'epochs': 289, 'loss': 'mae', 'optimizer': 'adam', 'graph_mode': 'cutoff', 'cutoff': 0.8731593517086966, 'grm_norm': 'none', 'self_loops': False}. Best is trial 109 with value: 0.2779994139152295.
[I 2025-10-22 00:02:51,357] Trial 137 finished with value: 0.2552950007896734 and parameters: {'model_type': 'gat', 'hidden_dims': '[256, 128, 64]', 'dropout': 0.19352934114226925, 'batch_norm': False, 'gat_heads': 5, 'gat_attn_dropout': 0.14623860815722636, 'gat_concat_hidden': True, 'lr': 0.0008126237670485977, 'weight_decay': 0.0005019880990464611, 'epochs': 242, 'loss': 'mae', 'optimizer': 'adam', 'graph_mode': 'cutoff', 'cutoff': 0.8590391427855603, 'grm_norm': 'none', 'self_loops': False}. Best is trial 109 with value: 0.2779994139152295.
