[I 2025-11-03 11:49:25,977] Trial 109 finished with value: 0.07586623275430339 and parameters: {'model_type': 'gcn', 'hidden_dims': '[512, 128]', 'dropout': 0.18550819911232402, 'batch_norm': False, 'lr': 1.9916962613096754e-05, 'weight_decay': 0.00010318060301773119, 'epochs': 181, 'loss': 'mse', 'optimizer': 'adam', 'graph_mode': 'knn', 'source': 'grm', 'knn_k': 2, 'weighted_edges': True, 'symmetrize_mode': 'mutual', 'use_snp_selection': True, 'num_snps': 25113}. Best is trial 74 with value: 0.09093433545142589.
[I 2025-11-03 11:49:28,723] Trial 110 finished with value: 0.03529728785840674 and parameters: {'model_type': 'gcn', 'hidden_dims': '[512, 128]', 'dropout': 0.2796479270343054, 'batch_norm': False, 'lr': 2.1423060357323656e-05, 'weight_decay': 0.00010551345502048233, 'epochs': 175, 'loss': 'mse', 'optimizer': 'adam', 'graph_mode': 'knn', 'source': 'grm', 'knn_k': 1, 'weighted_edges': False, 'symmetrize_mode': 'mutual', 'use_snp_selection': True, 'num_snps': 27538}. Best is trial 74 with value: 0.09093433545142589.
[I 2025-11-03 11:49:31,365] Trial 111 finished with value: 0.05294305218386644 and parameters: {'model_type': 'gcn', 'hidden_dims': '[512, 128]', 'dropout': 0.17974359210304577, 'batch_norm': False, 'lr': 1.8055754218842697e-05, 'weight_decay': 0.00014945231535244295, 'epochs': 181, 'loss': 'mse', 'optimizer': 'adam', 'graph_mode': 'knn', 'source': 'grm', 'knn_k': 2, 'weighted_edges': True, 'symmetrize_mode': 'mutual', 'use_snp_selection': True, 'num_snps': 24900}. Best is trial 74 with value: 0.09093433545142589.
[I 2025-11-03 11:49:33,863] Trial 112 finished with value: 0.059456541897749626 and parameters: {'model_type': 'gcn', 'hidden_dims': '[512, 128]', 'dropout': 0.2243513249699251, 'batch_norm': False, 'lr': 3.0747411734336575e-05, 'weight_decay': 0.000839681840729879, 'epochs': 188, 'loss': 'mse', 'optimizer': 'adam', 'graph_mode': 'knn', 'source': 'grm', 'knn_k': 2, 'weighted_edges': True, 'symmetrize_mode': 'mutual', 'use_snp_selection': True, 'num_snps': 21307}. Best is trial 74 with value: 0.09093433545142589.
[I 2025-11-03 11:49:36,222] Trial 113 finished with value: 0.017409763977641803 and parameters: {'model_type': 'gcn', 'hidden_dims': '[512, 128]', 'dropout': 0.18737921952130107, 'batch_norm': False, 'lr': 2.559552348527907e-05, 'weight_decay': 4.547405206225198e-07, 'epochs': 169, 'loss': 'mse', 'optimizer': 'adam', 'graph_mode': 'knn', 'source': 'grm', 'knn_k': 3, 'weighted_edges': True, 'symmetrize_mode': 'mutual', 'use_snp_selection': True, 'num_snps': 19322}. Best is trial 74 with value: 0.09093433545142589.
[I 2025-11-03 11:49:39,057] Trial 114 finished with value: 0.03926264140827894 and parameters: {'model_type': 'gcn', 'hidden_dims': '[256, 128, 64]', 'dropout': 0.20084141433714234, 'batch_norm': False, 'lr': 3.9116967158940327e-05, 'weight_decay': 0.0006298611009124833, 'epochs': 194, 'loss': 'mse', 'optimizer': 'adam', 'graph_mode': 'knn', 'source': 'grm', 'knn_k': 3, 'weighted_edges': True, 'symmetrize_mode': 'mutual', 'use_snp_selection': True, 'num_snps': 29088}. Best is trial 74 with value: 0.09093433545142589.
[I 2025-11-03 11:49:41,495] Trial 115 finished with value: 0.03298156675274079 and parameters: {'model_type': 'gcn', 'hidden_dims': '[256, 128]', 'dropout': 0.16030364011685683, 'batch_norm': False, 'lr': 4.812013198937761e-05, 'weight_decay': 0.00020919286068964735, 'epochs': 224, 'loss': 'mse', 'optimizer': 'adam', 'graph_mode': 'knn', 'source': 'grm', 'knn_k': 2, 'weighted_edges': True, 'symmetrize_mode': 'union', 'use_snp_selection': True, 'num_snps': 23267}. Best is trial 74 with value: 0.09093433545142589.
[I 2025-11-03 11:49:43,947] Trial 116 finished with value: 0.0465293775181006 and parameters: {'model_type': 'gcn', 'hidden_dims': '[512, 64]', 'dropout': 0.24169271471808704, 'batch_norm': False, 'lr': 1.8719169536864353e-05, 'weight_decay': 0.0004261219528522776, 'epochs': 126, 'loss': 'mse', 'optimizer': 'adam', 'graph_mode': 'knn', 'source': 'grm', 'knn_k': 1, 'weighted_edges': True, 'symmetrize_mode': 'union', 'use_snp_selection': True, 'num_snps': 24970}. Best is trial 74 with value: 0.09093433545142589.
[I 2025-11-03 11:49:46,091] Trial 117 finished with value: 0.061206428350679784 and parameters: {'model_type': 'gcn', 'hidden_dims': '[256, 128, 64]', 'dropout': 0.14015575536646063, 'batch_norm': False, 'lr': 3.4077548944987095e-05, 'weight_decay': 4.358153433868588e-05, 'epochs': 143, 'loss': 'mse', 'optimizer': 'adam', 'graph_mode': 'knn', 'source': 'grm', 'knn_k': 4, 'weighted_edges': True, 'symmetrize_mode': 'union', 'use_snp_selection': True, 'num_snps': 17183}. Best is trial 74 with value: 0.09093433545142589.
[I 2025-11-03 11:49:48,094] Trial 118 finished with value: 0.050276290082576676 and parameters: {'model_type': 'gcn', 'hidden_dims': '[256, 128, 64]', 'dropout': 0.16757156722411753, 'batch_norm': False, 'lr': 2.2983761957144925e-05, 'weight_decay': 0.00011804463839530276, 'epochs': 182, 'loss': 'mse', 'optimizer': 'adam', 'graph_mode': 'knn', 'source': 'grm', 'knn_k': 3, 'weighted_edges': True, 'symmetrize_mode': 'union', 'use_snp_selection': True, 'num_snps': 9579}. Best is trial 74 with value: 0.09093433545142589.
[I 2025-11-03 11:49:50,714] Trial 119 finished with value: 0.04846034227198012 and parameters: {'model_type': 'gcn', 'hidden_dims': '[512, 128]', 'dropout': 0.20949133194102415, 'batch_norm': False, 'lr': 1.5894018262026654e-05, 'weight_decay': 1.4712612360628338e-07, 'epochs': 165, 'loss': 'mse', 'optimizer': 'adam', 'graph_mode': 'knn', 'source': 'grm', 'knn_k': 2, 'weighted_edges': False, 'symmetrize_mode': 'mutual', 'use_snp_selection': True, 'num_snps': 26423}. Best is trial 74 with value: 0.09093433545142589.
[I 2025-11-03 11:49:53,469] Trial 120 finished with value: 0.03065990809665426 and parameters: {'model_type': 'gcn', 'hidden_dims': '[512, 256]', 'dropout': 0.19045660469943024, 'batch_norm': True, 'lr': 2.0223424997203387e-05, 'weight_decay': 0.0007649178768471081, 'epochs': 202, 'loss': 'mse', 'optimizer': 'adam', 'graph_mode': 'knn', 'source': 'grm', 'knn_k': 4, 'weighted_edges': True, 'symmetrize_mode': 'union', 'use_snp_selection': False}. Best is trial 74 with value: 0.09093433545142589.
[I 2025-11-03 11:49:55,667] Trial 121 finished with value: 0.07796321845510201 and parameters: {'model_type': 'gcn', 'hidden_dims': '[256, 128, 64]', 'dropout': 0.21725883611933045, 'batch_norm': False, 'lr': 2.6209147185081488e-05, 'weight_decay': 4.3058303551484175e-07, 'epochs': 131, 'loss': 'mse', 'optimizer': 'adam', 'graph_mode': 'knn', 'source': 'grm', 'knn_k': 3, 'weighted_edges': True, 'symmetrize_mode': 'union', 'use_snp_selection': True, 'num_snps': 22697}. Best is trial 74 with value: 0.09093433545142589.
[I 2025-11-03 11:49:57,553] Trial 122 finished with value: 0.059340240383494974 and parameters: {'model_type': 'gcn', 'hidden_dims': '[256, 128, 64]', 'dropout': 0.23571317948014592, 'batch_norm': False, 'lr': 2.8521054759179494e-05, 'weight_decay': 3.3674873302230884e-07, 'epochs': 113, 'loss': 'mse', 'optimizer': 'adam', 'graph_mode': 'knn', 'source': 'grm', 'knn_k': 3, 'weighted_edges': True, 'symmetrize_mode': 'union', 'use_snp_selection': True, 'num_snps': 15048}. Best is trial 74 with value: 0.09093433545142589.
[I 2025-11-03 11:49:59,663] Trial 123 finished with value: 0.03766151782975467 and parameters: {'model_type': 'gcn', 'hidden_dims': '[256, 128, 64]', 'dropout': 0.14969105420086476, 'batch_norm': False, 'lr': 2.314178660943025e-05, 'weight_decay': 2.8284955960178764e-07, 'epochs': 149, 'loss': 'mse', 'optimizer': 'adam', 'graph_mode': 'knn', 'source': 'grm', 'knn_k': 3, 'weighted_edges': True, 'symmetrize_mode': 'union', 'use_snp_selection': True, 'num_snps': 19042}. Best is trial 74 with value: 0.09093433545142589.
[I 2025-11-03 11:50:01,931] Trial 124 finished with value: 0.021320275769031276 and parameters: {'model_type': 'gcn', 'hidden_dims': '[256, 128, 64]', 'dropout': 0.18086053355573856, 'batch_norm': False, 'lr': 0.0001051770578241358, 'weight_decay': 4.2335168272278216e-07, 'epochs': 173, 'loss': 'mse', 'optimizer': 'adam', 'graph_mode': 'knn', 'source': 'grm', 'knn_k': 4, 'weighted_edges': True, 'symmetrize_mode': 'union', 'use_snp_selection': True, 'num_snps': 22036}. Best is trial 74 with value: 0.09093433545142589.
[I 2025-11-03 11:50:04,514] Trial 125 finished with value: 0.07359353468260074 and parameters: {'model_type': 'gcn', 'hidden_dims': '[256, 128, 64]', 'dropout': 0.37418178961397036, 'batch_norm': False, 'lr': 1.2184330307370027e-05, 'weight_decay': 5.640786914050571e-07, 'epochs': 137, 'loss': 'mse', 'optimizer': 'adam', 'graph_mode': 'knn', 'source': 'grm', 'knn_k': 2, 'weighted_edges': True, 'symmetrize_mode': 'union', 'use_snp_selection': True, 'num_snps': 32972}. Best is trial 74 with value: 0.09093433545142589.
[I 2025-11-03 11:50:07,161] Trial 126 finished with value: 0.028011914449095565 and parameters: {'model_type': 'gcn', 'hidden_dims': '[256, 128, 64]', 'dropout': 0.3667062499730216, 'batch_norm': False, 'lr': 1.2703062184982636e-05, 'weight_decay': 5.740318315006605e-07, 'epochs': 136, 'loss': 'mse', 'optimizer': 'adam', 'graph_mode': 'knn', 'source': 'grm', 'knn_k': 5, 'weighted_edges': True, 'symmetrize_mode': 'union', 'use_snp_selection': True, 'num_snps': 34438}. Best is trial 74 with value: 0.09093433545142589.
[I 2025-11-03 11:50:09,789] Trial 127 finished with value: -0.007611683036834329 and parameters: {'model_type': 'gcn', 'hidden_dims': '[256, 128, 64]', 'dropout': 0.39740192936119684, 'batch_norm': False, 'lr': 1.094078135308853e-05, 'weight_decay': 2.3135073838934472e-07, 'epochs': 160, 'loss': 'mae', 'optimizer': 'adam', 'graph_mode': 'knn', 'source': 'grm', 'knn_k': 2, 'weighted_edges': True, 'symmetrize_mode': 'union', 'use_snp_selection': True, 'num_snps': 31611}. Best is trial 74 with value: 0.09093433545142589.
[I 2025-11-03 11:50:12,151] Trial 128 finished with value: 0.035740936249995275 and parameters: {'model_type': 'gcn', 'hidden_dims': '[256, 128, 64]', 'dropout': 0.3208965923157072, 'batch_norm': False, 'lr': 1.7196669759487558e-05, 'weight_decay': 7.4258427029982e-07, 'epochs': 123, 'loss': 'mse', 'optimizer': 'adam', 'graph_mode': 'cutoff', 'cutoff': 0.34447969846474835, 'grm_norm': 'cosine_then_gcn', 'self_loops': True, 'use_snp_selection': True, 'num_snps': 29228}. Best is trial 74 with value: 0.09093433545142589.
[I 2025-11-03 11:50:14,093] Trial 129 finished with value: 0.025390592584734265 and parameters: {'model_type': 'gcn', 'hidden_dims': '[256, 128, 64]', 'dropout': 0.2649573339801854, 'batch_norm': True, 'lr': 7.685526975130903e-06, 'weight_decay': 9.479976880521507e-07, 'epochs': 147, 'loss': 'mse', 'optimizer': 'adam', 'graph_mode': 'knn', 'source': 'grm', 'knn_k': 3, 'weighted_edges': True, 'symmetrize_mode': 'union', 'use_snp_selection': False}. Best is trial 74 with value: 0.09093433545142589.
[I 2025-11-03 11:50:16,782] Trial 130 finished with value: 0.04746168296069989 and parameters: {'model_type': 'gcn', 'hidden_dims': '[256, 128, 64]', 'dropout': 0.2141439990368176, 'batch_norm': False, 'lr': 9.784072607472687e-06, 'weight_decay': 4.6151417697927196e-07, 'epochs': 118, 'loss': 'mse', 'optimizer': 'adam', 'graph_mode': 'knn', 'source': 'grm', 'knn_k': 4, 'weighted_edges': True, 'symmetrize_mode': 'union', 'use_snp_selection': True, 'num_snps': 39028}. Best is trial 74 with value: 0.09093433545142589.
[I 2025-11-03 11:50:19,270] Trial 131 finished with value: 0.019327924112063157 and parameters: {'model_type': 'gcn', 'hidden_dims': '[256, 128]', 'dropout': 0.3871775377513895, 'batch_norm': False, 'lr': 2.6554415657447094e-05, 'weight_decay': 0.0005039391045449616, 'epochs': 158, 'loss': 'mse', 'optimizer': 'adam', 'graph_mode': 'knn', 'source': 'grm', 'knn_k': 2, 'weighted_edges': True, 'symmetrize_mode': 'union', 'use_snp_selection': True, 'num_snps': 33282}. Best is trial 74 with value: 0.09093433545142589.
[I 2025-11-03 11:50:21,250] Trial 132 finished with value: 0.08650420110727204 and parameters: {'model_type': 'gcn', 'hidden_dims': '[256, 128, 64]', 'dropout': 0.42738658850937533, 'batch_norm': False, 'lr': 3.378292691199971e-05, 'weight_decay': 0.0006894964326347468, 'epochs': 185, 'loss': 'mse', 'optimizer': 'adam', 'graph_mode': 'knn', 'source': 'grm', 'knn_k': 2, 'weighted_edges': True, 'symmetrize_mode': 'union', 'use_snp_selection': True, 'num_snps': 11355}. Best is trial 74 with value: 0.09093433545142589.
[I 2025-11-03 11:50:23,218] Trial 133 finished with value: 0.05174792107804507 and parameters: {'model_type': 'gcn', 'hidden_dims': '[256, 128, 64]', 'dropout': 0.43727479975384526, 'batch_norm': False, 'lr': 2.0030387473211336e-05, 'weight_decay': 0.0007408508833423724, 'epochs': 188, 'loss': 'mse', 'optimizer': 'adam', 'graph_mode': 'knn', 'source': 'grm', 'knn_k': 1, 'weighted_edges': True, 'symmetrize_mode': 'union', 'use_snp_selection': True, 'num_snps': 10931}. Best is trial 74 with value: 0.09093433545142589.
[I 2025-11-03 11:50:25,574] Trial 134 finished with value: 0.043644051145102405 and parameters: {'model_type': 'gcn', 'hidden_dims': '[256, 128, 64]', 'dropout': 0.3490293398555891, 'batch_norm': False, 'lr': 7.00654123595323e-05, 'weight_decay': 1.4474224016316383e-06, 'epochs': 174, 'loss': 'mse', 'optimizer': 'adam', 'graph_mode': 'knn', 'source': 'grm', 'knn_k': 3, 'weighted_edges': True, 'symmetrize_mode': 'union', 'use_snp_selection': True, 'num_snps': 23727}. Best is trial 74 with value: 0.09093433545142589.
[I 2025-11-03 11:50:27,291] Trial 135 finished with value: 0.04065921163278874 and parameters: {'model_type': 'gcn', 'hidden_dims': '[256, 128, 64]', 'dropout': 0.45175580986293384, 'batch_norm': False, 'lr': 1.4763357066382142e-05, 'weight_decay': 0.0009888639787754834, 'epochs': 102, 'loss': 'mse', 'optimizer': 'adam', 'graph_mode': 'knn', 'source': 'grm', 'knn_k': 2, 'weighted_edges': True, 'symmetrize_mode': 'union', 'use_snp_selection': True, 'num_snps': 13105}. Best is trial 74 with value: 0.09093433545142589.
[I 2025-11-03 11:50:29,349] Trial 136 finished with value: 0.07097609927200216 and parameters: {'model_type': 'gcn', 'hidden_dims': '[256, 128, 64]', 'dropout': 0.4199337695008992, 'batch_norm': False, 'lr': 3.875885812689601e-05, 'weight_decay': 7.477748680308319e-05, 'epochs': 179, 'loss': 'mse', 'optimizer': 'adam', 'graph_mode': 'cutoff', 'cutoff': 0.25719105648524715, 'grm_norm': 'cosine', 'self_loops': True, 'use_snp_selection': True, 'num_snps': 15786}. Best is trial 74 with value: 0.09093433545142589.
[I 2025-11-03 11:50:31,434] Trial 137 finished with value: 0.0608541904842284 and parameters: {'model_type': 'gcn', 'hidden_dims': '[256, 128, 64]', 'dropout': 0.4340772878500283, 'batch_norm': False, 'lr': 4.0887358276267584e-05, 'weight_decay': 7.874060315660625e-05, 'epochs': 179, 'loss': 'mse', 'optimizer': 'adam', 'graph_mode': 'knn', 'source': 'grm', 'knn_k': 4, 'weighted_edges': False, 'symmetrize_mode': 'union', 'use_snp_selection': True, 'num_snps': 15473}. Best is trial 74 with value: 0.09093433545142589.
[I 2025-11-03 11:50:33,412] Trial 138 finished with value: 0.04901986282392469 and parameters: {'model_type': 'gcn', 'hidden_dims': '[256, 128, 64]', 'dropout': 0.4677895764232382, 'batch_norm': True, 'lr': 4.86512725051153e-05, 'weight_decay': 6.320971774623026e-05, 'epochs': 165, 'loss': 'mse', 'optimizer': 'adam', 'graph_mode': 'cutoff', 'cutoff': 0.22939553585065045, 'grm_norm': 'cosine', 'self_loops': True, 'use_snp_selection': False}. Best is trial 74 with value: 0.09093433545142589.
[I 2025-11-03 11:50:35,494] Trial 139 finished with value: 0.0253715602322388 and parameters: {'model_type': 'gcn', 'hidden_dims': '[256, 128, 64]', 'dropout': 0.4159126219040676, 'batch_norm': False, 'lr': 5.779536729088648e-05, 'weight_decay': 3.399119832610006e-05, 'epochs': 193, 'loss': 'mse', 'optimizer': 'adam', 'graph_mode': 'knn', 'source': 'grm', 'knn_k': 8, 'weighted_edges': True, 'symmetrize_mode': 'mutual', 'use_snp_selection': True, 'num_snps': 13532}. Best is trial 74 with value: 0.09093433545142589.
[I 2025-11-03 11:50:37,503] Trial 140 finished with value: 0.0745588792896768 and parameters: {'model_type': 'gcn', 'hidden_dims': '[256, 128, 64]', 'dropout': 0.3827137231146958, 'batch_norm': False, 'lr': 3.100017480994379e-05, 'weight_decay': 0.00023967846105222583, 'epochs': 142, 'loss': 'mse', 'optimizer': 'adam', 'graph_mode': 'knn', 'source': 'grm', 'knn_k': 3, 'weighted_edges': True, 'symmetrize_mode': 'union', 'use_snp_selection': True, 'num_snps': 16802}. Best is trial 74 with value: 0.09093433545142589.
[I 2025-11-03 11:50:39,434] Trial 141 finished with value: 0.07321471075988534 and parameters: {'model_type': 'gcn', 'hidden_dims': '[256, 128, 64]', 'dropout': 0.40985469720555623, 'batch_norm': False, 'lr': 3.473125368594947e-05, 'weight_decay': 0.00014847817716424463, 'epochs': 126, 'loss': 'mse', 'optimizer': 'adam', 'graph_mode': 'knn', 'source': 'grm', 'knn_k': 3, 'weighted_edges': True, 'symmetrize_mode': 'union', 'use_snp_selection': True, 'num_snps': 16811}. Best is trial 74 with value: 0.09093433545142589.
[I 2025-11-03 11:50:41,427] Trial 142 finished with value: 0.03954239818660748 and parameters: {'model_type': 'gcn', 'hidden_dims': '[256, 128, 64]', 'dropout': 0.3825451409793808, 'batch_norm': False, 'lr': 3.06544779508846e-05, 'weight_decay': 0.00015359079384059566, 'epochs': 133, 'loss': 'mse', 'optimizer': 'adam', 'graph_mode': 'knn', 'source': 'grm', 'knn_k': 3, 'weighted_edges': True, 'symmetrize_mode': 'union', 'use_snp_selection': True, 'num_snps': 18054}. Best is trial 74 with value: 0.09093433545142589.
[I 2025-11-03 11:50:43,456] Trial 143 finished with value: 0.08525517536794164 and parameters: {'model_type': 'gcn', 'hidden_dims': '[256, 128, 64]', 'dropout': 0.3700697937334718, 'batch_norm': False, 'lr': 3.329599495404034e-05, 'weight_decay': 0.0002417669782273651, 'epochs': 127, 'loss': 'mse', 'optimizer': 'adam', 'graph_mode': 'knn', 'source': 'grm', 'knn_k': 3, 'weighted_edges': True, 'symmetrize_mode': 'union', 'use_snp_selection': True, 'num_snps': 19904}. Best is trial 74 with value: 0.09093433545142589.
[I 2025-11-03 11:50:45,538] Trial 144 finished with value: 0.061064920380759884 and parameters: {'model_type': 'gcn', 'hidden_dims': '[256, 128, 64]', 'dropout': 0.3725441267388504, 'batch_norm': False, 'lr': 3.5020218031584595e-05, 'weight_decay': 0.000248141654593264, 'epochs': 139, 'loss': 'mse', 'optimizer': 'adam', 'graph_mode': 'knn', 'source': 'grm', 'knn_k': 3, 'weighted_edges': True, 'symmetrize_mode': 'union', 'use_snp_selection': True, 'num_snps': 20198}. Best is trial 74 with value: 0.09093433545142589.
[I 2025-11-03 11:50:47,484] Trial 145 finished with value: 0.06704208268850725 and parameters: {'model_type': 'gcn', 'hidden_dims': '[256, 128, 64]', 'dropout': 0.4026235142306227, 'batch_norm': False, 'lr': 4.422408301174389e-05, 'weight_decay': 0.00013835465566826654, 'epochs': 125, 'loss': 'mse', 'optimizer': 'adam', 'graph_mode': 'knn', 'source': 'grm', 'knn_k': 3, 'weighted_edges': True, 'symmetrize_mode': 'union', 'use_snp_selection': True, 'num_snps': 16950}. Best is trial 74 with value: 0.09093433545142589.
[I 2025-11-03 11:50:49,056] Trial 146 finished with value: 0.03439845228961888 and parameters: {'model_type': 'gcn', 'hidden_dims': '[128, 64]', 'dropout': 0.3661570999613506, 'batch_norm': False, 'lr': 2.8021013134091083e-05, 'weight_decay': 0.00018060574244056006, 'epochs': 107, 'loss': 'mse', 'optimizer': 'adam', 'graph_mode': 'knn', 'source': 'grm', 'knn_k': 2, 'weighted_edges': True, 'symmetrize_mode': 'union', 'use_snp_selection': True, 'num_snps': 11915}. Best is trial 74 with value: 0.09093433545142589.
[I 2025-11-03 11:50:50,826] Trial 147 finished with value: 0.019797453552661073 and parameters: {'model_type': 'gcn', 'hidden_dims': '[256, 128, 64]', 'dropout': 0.404505345160299, 'batch_norm': True, 'lr': 3.251315905136263e-05, 'weight_decay': 0.00036135494152557775, 'epochs': 114, 'loss': 'mse', 'optimizer': 'adam', 'graph_mode': 'knn', 'source': 'grm', 'knn_k': 3, 'weighted_edges': True, 'symmetrize_mode': 'union', 'use_snp_selection': False}. Best is trial 74 with value: 0.09093433545142589.
[I 2025-11-03 11:50:52,531] Trial 148 finished with value: 0.0738410193505641 and parameters: {'model_type': 'gcn', 'hidden_dims': '[256, 128, 64]', 'dropout': 0.3442452767325769, 'batch_norm': False, 'lr': 2.544478082180158e-05, 'weight_decay': 0.0002896260214288423, 'epochs': 144, 'loss': 'mse', 'optimizer': 'adam', 'graph_mode': 'knn', 'source': 'grm', 'knn_k': 2, 'weighted_edges': True, 'symmetrize_mode': 'union', 'use_snp_selection': True, 'num_snps': 7308}. Best is trial 74 with value: 0.09093433545142589.
[I 2025-11-03 11:50:54,139] Trial 149 finished with value: 0.05991185737271146 and parameters: {'model_type': 'gcn', 'hidden_dims': '[256, 128, 64]', 'dropout': 0.3400408754853875, 'batch_norm': False, 'lr': 2.3059309463775478e-05, 'weight_decay': 0.00029142194557876426, 'epochs': 127, 'loss': 'mse', 'optimizer': 'adam', 'graph_mode': 'knn', 'source': 'grm', 'knn_k': 2, 'weighted_edges': True, 'symmetrize_mode': 'union', 'use_snp_selection': True, 'num_snps': 5843}. Best is trial 74 with value: 0.09093433545142589.
[I 2025-11-03 11:50:56,216] Trial 0 finished with value: 0.024018557851023664 and parameters: {'model_type': 'gcn', 'hidden_dims': '[128, 64]', 'dropout': 0.199031432379812, 'batch_norm': True, 'lr': 1.8408544111075837e-06, 'weight_decay': 5.5136510071208614e-05, 'epochs': 334, 'loss': 'mae', 'optimizer': 'adam', 'graph_mode': 'knn', 'source': 'grm', 'knn_k': 8, 'weighted_edges': True, 'symmetrize_mode': 'mutual', 'use_snp_selection': False}. Best is trial 0 with value: 0.024018557851023664.
