[I 2025-11-03 14:01:41,258] Trial 57 finished with value: 0.09553170827423658 and parameters: {'model_type': 'graphsage', 'hidden_dims': '[256, 128, 64]', 'dropout': 0.15502560088864936, 'batch_norm': False, 'lr': 0.00048259808154276613, 'weight_decay': 0.00021902405626042246, 'epochs': 347, 'loss': 'mse', 'optimizer': 'adam', 'graph_mode': 'knn', 'source': 'grm', 'knn_k': 2, 'weighted_edges': True, 'symmetrize_mode': 'mutual', 'use_snp_selection': True, 'num_snps': 26378}. Best is trial 45 with value: 0.10287748043634418.
[I 2025-11-03 14:01:44,762] Trial 58 finished with value: 0.055437922909414655 and parameters: {'model_type': 'graphsage', 'hidden_dims': '[128, 64]', 'dropout': 0.15359511314759935, 'batch_norm': False, 'lr': 0.0003510250414666707, 'weight_decay': 0.0006173964974085286, 'epochs': 342, 'loss': 'mse', 'optimizer': 'adam', 'graph_mode': 'knn', 'source': 'grm', 'knn_k': 4, 'weighted_edges': True, 'symmetrize_mode': 'mutual', 'use_snp_selection': True, 'num_snps': 27471}. Best is trial 45 with value: 0.10287748043634418.
[I 2025-11-03 14:01:49,293] Trial 59 finished with value: 0.09720669005552135 and parameters: {'model_type': 'graphsage', 'hidden_dims': '[256, 128, 64]', 'dropout': 0.24164079480675077, 'batch_norm': False, 'lr': 0.00021724981228587773, 'weight_decay': 0.00021776187632748526, 'epochs': 307, 'loss': 'mse', 'optimizer': 'adam', 'graph_mode': 'knn', 'source': 'grm', 'knn_k': 2, 'weighted_edges': False, 'symmetrize_mode': 'mutual', 'use_snp_selection': True, 'num_snps': 35434}. Best is trial 45 with value: 0.10287748043634418.
[I 2025-11-03 14:01:53,741] Trial 60 finished with value: 0.1057032632255119 and parameters: {'model_type': 'graphsage', 'hidden_dims': '[256, 128]', 'dropout': 0.24575609357123276, 'batch_norm': False, 'lr': 0.00011467052708291467, 'weight_decay': 0.00022491863243003448, 'epochs': 307, 'loss': 'mse', 'optimizer': 'adam', 'graph_mode': 'knn', 'source': 'grm', 'knn_k': 2, 'weighted_edges': False, 'symmetrize_mode': 'mutual', 'use_snp_selection': True, 'num_snps': 35388}. Best is trial 60 with value: 0.1057032632255119.
[I 2025-11-03 14:01:58,326] Trial 61 finished with value: 0.08207697867737658 and parameters: {'model_type': 'graphsage', 'hidden_dims': '[256, 128]', 'dropout': 0.2433314563173012, 'batch_norm': False, 'lr': 0.00015872984798206725, 'weight_decay': 0.00022019162887232063, 'epochs': 308, 'loss': 'mse', 'optimizer': 'adam', 'graph_mode': 'knn', 'source': 'grm', 'knn_k': 2, 'weighted_edges': False, 'symmetrize_mode': 'mutual', 'use_snp_selection': True, 'num_snps': 36892}. Best is trial 60 with value: 0.1057032632255119.
[I 2025-11-03 14:02:03,118] Trial 62 finished with value: 0.05865207269636276 and parameters: {'model_type': 'graphsage', 'hidden_dims': '[256, 128]', 'dropout': 0.27106521255404514, 'batch_norm': False, 'lr': 0.0002450032849776588, 'weight_decay': 0.00010220943936694609, 'epochs': 349, 'loss': 'mse', 'optimizer': 'adam', 'graph_mode': 'knn', 'source': 'grm', 'knn_k': 1, 'weighted_edges': False, 'symmetrize_mode': 'mutual', 'use_snp_selection': True, 'num_snps': 38120}. Best is trial 60 with value: 0.1057032632255119.
[I 2025-11-03 14:02:07,003] Trial 63 finished with value: 0.08663115929920776 and parameters: {'model_type': 'graphsage', 'hidden_dims': '[256, 128]', 'dropout': 0.2248434761867834, 'batch_norm': False, 'lr': 0.00012836122049337235, 'weight_decay': 0.00039203068184687494, 'epochs': 324, 'loss': 'mse', 'optimizer': 'adam', 'graph_mode': 'knn', 'source': 'grm', 'knn_k': 2, 'weighted_edges': False, 'symmetrize_mode': 'mutual', 'use_snp_selection': True, 'num_snps': 27788}. Best is trial 60 with value: 0.1057032632255119.
[I 2025-11-03 14:02:11,274] Trial 64 finished with value: 0.08200179954298277 and parameters: {'model_type': 'graphsage', 'hidden_dims': '[256, 128]', 'dropout': 0.120356455571469, 'batch_norm': False, 'lr': 9.441293606324706e-05, 'weight_decay': 0.0006855287257492965, 'epochs': 268, 'loss': 'mse', 'optimizer': 'adam', 'graph_mode': 'knn', 'source': 'grm', 'knn_k': 1, 'weighted_edges': False, 'symmetrize_mode': 'mutual', 'use_snp_selection': True, 'num_snps': 36730}. Best is trial 60 with value: 0.1057032632255119.
[I 2025-11-03 14:02:15,468] Trial 65 finished with value: 0.09612997996706582 and parameters: {'model_type': 'graphsage', 'hidden_dims': '[256, 128, 64]', 'dropout': 0.1907645128380251, 'batch_norm': False, 'lr': 0.00027399141413267614, 'weight_decay': 0.00020273615546409574, 'epochs': 336, 'loss': 'mse', 'optimizer': 'adam', 'graph_mode': 'knn', 'source': 'grm', 'knn_k': 2, 'weighted_edges': False, 'symmetrize_mode': 'mutual', 'use_snp_selection': True, 'num_snps': 29815}. Best is trial 60 with value: 0.1057032632255119.
[I 2025-11-03 14:02:19,665] Trial 66 finished with value: 0.07437245577433578 and parameters: {'model_type': 'graphsage', 'hidden_dims': '[256, 128, 64]', 'dropout': 0.25984633276123476, 'batch_norm': False, 'lr': 0.00028121737050700187, 'weight_decay': 0.0002155575004433015, 'epochs': 337, 'loss': 'mse', 'optimizer': 'adam', 'graph_mode': 'knn', 'source': 'grm', 'knn_k': 2, 'weighted_edges': False, 'symmetrize_mode': 'mutual', 'use_snp_selection': True, 'num_snps': 30203}. Best is trial 60 with value: 0.1057032632255119.
[I 2025-11-03 14:02:26,345] Trial 67 finished with value: 0.07404682915592915 and parameters: {'model_type': 'graphsage', 'hidden_dims': '[512, 128]', 'dropout': 0.2908601584634237, 'batch_norm': False, 'lr': 0.00021906093689007892, 'weight_decay': 0.0003531930468216658, 'epochs': 312, 'loss': 'mse', 'optimizer': 'adam', 'graph_mode': 'knn', 'source': 'grm', 'knn_k': 1, 'weighted_edges': False, 'symmetrize_mode': 'mutual', 'use_snp_selection': True, 'num_snps': 41765}. Best is trial 60 with value: 0.1057032632255119.
[I 2025-11-03 14:02:32,188] Trial 68 finished with value: 0.07044848631264451 and parameters: {'model_type': 'graphsage', 'hidden_dims': '[512, 64]', 'dropout': 0.2357174883128426, 'batch_norm': False, 'lr': 0.00018025940760279407, 'weight_decay': 0.00017237944786189312, 'epochs': 330, 'loss': 'mse', 'optimizer': 'adam', 'graph_mode': 'knn', 'source': 'grm', 'knn_k': 2, 'weighted_edges': False, 'symmetrize_mode': 'mutual', 'use_snp_selection': True, 'num_snps': 32834}. Best is trial 60 with value: 0.1057032632255119.
[I 2025-11-03 14:02:36,118] Trial 69 finished with value: 0.06908160390384073 and parameters: {'model_type': 'graphsage', 'hidden_dims': '[256, 128, 64]', 'dropout': 0.19149272914077553, 'batch_norm': False, 'lr': 0.00015821586227180584, 'weight_decay': 0.0002667219899237287, 'epochs': 288, 'loss': 'mse', 'optimizer': 'adam', 'graph_mode': 'knn', 'source': 'grm', 'knn_k': 1, 'weighted_edges': False, 'symmetrize_mode': 'mutual', 'use_snp_selection': True, 'num_snps': 29990}. Best is trial 60 with value: 0.1057032632255119.
[I 2025-11-03 14:02:41,016] Trial 70 finished with value: 0.03165913716964082 and parameters: {'model_type': 'graphsage', 'hidden_dims': '[256, 128]', 'dropout': 0.15974235831726716, 'batch_norm': False, 'lr': 1.1464401340513372e-06, 'weight_decay': 7.294049409004353e-05, 'epochs': 321, 'loss': 'mse', 'optimizer': 'adam', 'graph_mode': 'knn', 'source': 'grm', 'knn_k': 2, 'weighted_edges': False, 'symmetrize_mode': 'mutual', 'use_snp_selection': True, 'num_snps': 39646}. Best is trial 60 with value: 0.1057032632255119.
[I 2025-11-03 14:02:44,783] Trial 71 finished with value: 0.09266511249208942 and parameters: {'model_type': 'graphsage', 'hidden_dims': '[256, 128, 64]', 'dropout': 0.22240925883937973, 'batch_norm': False, 'lr': 0.00046432682705860404, 'weight_decay': 0.00012753127155829761, 'epochs': 302, 'loss': 'mse', 'optimizer': 'adam', 'graph_mode': 'knn', 'source': 'grm', 'knn_k': 3, 'weighted_edges': False, 'symmetrize_mode': 'mutual', 'use_snp_selection': True, 'num_snps': 25119}. Best is trial 60 with value: 0.1057032632255119.
[I 2025-11-03 14:02:47,895] Trial 72 finished with value: 0.04144803406612038 and parameters: {'model_type': 'graphsage', 'hidden_dims': '[256, 128, 64]', 'dropout': 0.1805208553049198, 'batch_norm': False, 'lr': 0.00011099570910641896, 'weight_decay': 8.6040907886167e-05, 'epochs': 43, 'loss': 'mse', 'optimizer': 'adam', 'graph_mode': 'knn', 'source': 'grm', 'knn_k': 3, 'weighted_edges': False, 'symmetrize_mode': 'mutual', 'use_snp_selection': True, 'num_snps': 34239}. Best is trial 60 with value: 0.1057032632255119.
[I 2025-11-03 14:02:53,418] Trial 73 finished with value: 0.10606704674092371 and parameters: {'model_type': 'graphsage', 'hidden_dims': '[256, 128, 64]', 'dropout': 0.11753190335607162, 'batch_norm': False, 'lr': 0.00030015349183134, 'weight_decay': 0.00024737890883180287, 'epochs': 297, 'loss': 'mse', 'optimizer': 'adam', 'graph_mode': 'knn', 'source': 'grm', 'knn_k': 2, 'weighted_edges': False, 'symmetrize_mode': 'mutual', 'use_snp_selection': True, 'num_snps': 48788}. Best is trial 73 with value: 0.10606704674092371.
[I 2025-11-03 14:02:59,625] Trial 74 finished with value: 0.07123894051245067 and parameters: {'model_type': 'graphsage', 'hidden_dims': '[256, 128, 64]', 'dropout': 0.19635159005370795, 'batch_norm': False, 'lr': 0.00030947946137188203, 'weight_decay': 0.0004287313422606212, 'epochs': 340, 'loss': 'mse', 'optimizer': 'adam', 'graph_mode': 'knn', 'source': 'grm', 'knn_k': 2, 'weighted_edges': False, 'symmetrize_mode': 'mutual', 'use_snp_selection': True, 'num_snps': 53294}. Best is trial 73 with value: 0.10606704674092371.
[I 2025-11-03 14:03:04,721] Trial 75 finished with value: 0.07343938149747534 and parameters: {'model_type': 'graphsage', 'hidden_dims': '[256, 128, 64]', 'dropout': 0.11388246454494172, 'batch_norm': False, 'lr': 0.00021140969707536666, 'weight_decay': 0.0008320564190791081, 'epochs': 291, 'loss': 'mse', 'optimizer': 'adam', 'graph_mode': 'knn', 'source': 'grm', 'knn_k': 1, 'weighted_edges': False, 'symmetrize_mode': 'mutual', 'use_snp_selection': True, 'num_snps': 45148}. Best is trial 73 with value: 0.10606704674092371.
[I 2025-11-03 14:03:09,189] Trial 76 finished with value: 0.07703915730126903 and parameters: {'model_type': 'graphsage', 'hidden_dims': '[128, 64]', 'dropout': 0.1507143221861447, 'batch_norm': False, 'lr': 0.0003685572632984158, 'weight_decay': 0.00025114397983516906, 'epochs': 310, 'loss': 'mse', 'optimizer': 'adam', 'graph_mode': 'knn', 'source': 'grm', 'knn_k': 1, 'weighted_edges': False, 'symmetrize_mode': 'mutual', 'use_snp_selection': True, 'num_snps': 49102}. Best is trial 73 with value: 0.10606704674092371.
[I 2025-11-03 14:03:12,435] Trial 77 finished with value: 0.0512260999346158 and parameters: {'model_type': 'graphsage', 'hidden_dims': '[256, 128, 64]', 'dropout': 0.5645851649527572, 'batch_norm': False, 'lr': 0.00011625764086237578, 'weight_decay': 0.00015744368403792039, 'epochs': 329, 'loss': 'mse', 'optimizer': 'adam', 'graph_mode': 'knn', 'source': 'grm', 'knn_k': 2, 'weighted_edges': False, 'symmetrize_mode': 'mutual', 'use_snp_selection': True, 'num_snps': 9431}. Best is trial 73 with value: 0.10606704674092371.
[I 2025-11-03 14:03:14,907] Trial 78 finished with value: 0.07668219691391609 and parameters: {'model_type': 'graphsage', 'hidden_dims': '[256, 128, 64]', 'dropout': 0.2944108326165559, 'batch_norm': False, 'lr': 0.00024150955247823102, 'weight_decay': 0.00021831263915768478, 'epochs': 71, 'loss': 'mse', 'optimizer': 'adam', 'graph_mode': 'knn', 'source': 'grm', 'knn_k': 2, 'weighted_edges': False, 'symmetrize_mode': 'mutual', 'use_snp_selection': True, 'num_snps': 17802}. Best is trial 73 with value: 0.10606704674092371.
[I 2025-11-03 14:03:21,523] Trial 79 finished with value: 0.06952973719977698 and parameters: {'model_type': 'graphsage', 'hidden_dims': '[256, 128, 64]', 'dropout': 0.16455788616192746, 'batch_norm': False, 'lr': 0.00016522271212279348, 'weight_decay': 0.00018534955895576402, 'epochs': 269, 'loss': 'mse', 'optimizer': 'adam', 'graph_mode': 'knn', 'source': 'grm', 'knn_k': 6, 'weighted_edges': False, 'symmetrize_mode': 'mutual', 'use_snp_selection': True, 'num_snps': 58692}. Best is trial 73 with value: 0.10606704674092371.
[I 2025-11-03 14:03:25,301] Trial 80 finished with value: 0.08488848295554068 and parameters: {'model_type': 'graphsage', 'hidden_dims': '[256, 128, 64]', 'dropout': 0.13137551230140698, 'batch_norm': False, 'lr': 7.526875911160945e-05, 'weight_decay': 0.00033539091445751516, 'epochs': 318, 'loss': 'mse', 'optimizer': 'adam', 'graph_mode': 'knn', 'source': 'grm', 'knn_k': 1, 'weighted_edges': False, 'symmetrize_mode': 'mutual', 'use_snp_selection': True, 'num_snps': 25847}. Best is trial 73 with value: 0.10606704674092371.
[I 2025-11-03 14:03:29,408] Trial 81 finished with value: 0.08630445548102637 and parameters: {'model_type': 'graphsage', 'hidden_dims': '[256, 128, 64]', 'dropout': 0.10775895486092882, 'batch_norm': False, 'lr': 0.0005048558372561432, 'weight_decay': 0.0004822970645571631, 'epochs': 293, 'loss': 'mse', 'optimizer': 'adam', 'graph_mode': 'knn', 'source': 'grm', 'knn_k': 3, 'weighted_edges': True, 'symmetrize_mode': 'mutual', 'use_snp_selection': True, 'num_snps': 29848}. Best is trial 73 with value: 0.10606704674092371.
[I 2025-11-03 14:03:32,796] Trial 82 finished with value: 0.07229458173557843 and parameters: {'model_type': 'graphsage', 'hidden_dims': '[256, 128, 64]', 'dropout': 0.1302307654099367, 'batch_norm': False, 'lr': 0.0002913697590494453, 'weight_decay': 0.0001227622709081445, 'epochs': 303, 'loss': 'mse', 'optimizer': 'adam', 'graph_mode': 'knn', 'source': 'grm', 'knn_k': 3, 'weighted_edges': True, 'symmetrize_mode': 'mutual', 'use_snp_selection': True, 'num_snps': 15565}. Best is trial 73 with value: 0.10606704674092371.
[I 2025-11-03 14:03:36,530] Trial 83 finished with value: 0.08118742752911318 and parameters: {'model_type': 'graphsage', 'hidden_dims': '[256, 128, 64]', 'dropout': 0.15050922498887212, 'batch_norm': False, 'lr': 0.0005137715883042538, 'weight_decay': 9.652673665195085e-05, 'epochs': 298, 'loss': 'mse', 'optimizer': 'adam', 'graph_mode': 'knn', 'source': 'grm', 'knn_k': 2, 'weighted_edges': True, 'symmetrize_mode': 'mutual', 'use_snp_selection': True, 'num_snps': 24842}. Best is trial 73 with value: 0.10606704674092371.
[I 2025-11-03 14:03:40,188] Trial 84 finished with value: 0.10355862831654777 and parameters: {'model_type': 'graphsage', 'hidden_dims': '[256, 128, 64]', 'dropout': 0.11419864169220945, 'batch_norm': False, 'lr': 0.0004229113023422172, 'weight_decay': 0.00018042589356435373, 'epochs': 336, 'loss': 'mse', 'optimizer': 'adam', 'graph_mode': 'knn', 'source': 'grm', 'knn_k': 2, 'weighted_edges': True, 'symmetrize_mode': 'mutual', 'use_snp_selection': True, 'num_snps': 19421}. Best is trial 73 with value: 0.10606704674092371.
[I 2025-11-03 14:03:44,516] Trial 85 finished with value: 0.08964316565576023 and parameters: {'model_type': 'graphsage', 'hidden_dims': '[512, 128]', 'dropout': 0.1142428630707917, 'batch_norm': False, 'lr': 0.0004083098530819368, 'weight_decay': 0.00026671170802197627, 'epochs': 335, 'loss': 'mse', 'optimizer': 'adam', 'graph_mode': 'knn', 'source': 'grm', 'knn_k': 2, 'weighted_edges': True, 'symmetrize_mode': 'union', 'use_snp_selection': True, 'num_snps': 19292}. Best is trial 73 with value: 0.10606704674092371.
[I 2025-11-03 14:03:48,009] Trial 86 finished with value: 0.08725289428411416 and parameters: {'model_type': 'graphsage', 'hidden_dims': '[256, 128, 64]', 'dropout': 0.17702209893573645, 'batch_norm': False, 'lr': 0.0003435196782776014, 'weight_decay': 0.00018823395941886925, 'epochs': 347, 'loss': 'mse', 'optimizer': 'adam', 'graph_mode': 'knn', 'source': 'grm', 'knn_k': 2, 'weighted_edges': True, 'symmetrize_mode': 'mutual', 'use_snp_selection': True, 'num_snps': 13935}. Best is trial 73 with value: 0.10606704674092371.
[I 2025-11-03 14:03:52,614] Trial 87 finished with value: 0.09710347981223261 and parameters: {'model_type': 'graphsage', 'hidden_dims': '[512, 64]', 'dropout': 0.14213410097632642, 'batch_norm': False, 'lr': 0.00027415212772247555, 'weight_decay': 0.0005730296733733871, 'epochs': 350, 'loss': 'mse', 'optimizer': 'adam', 'graph_mode': 'knn', 'source': 'grm', 'knn_k': 1, 'weighted_edges': True, 'symmetrize_mode': 'mutual', 'use_snp_selection': True, 'num_snps': 22226}. Best is trial 73 with value: 0.10606704674092371.
[I 2025-11-03 14:03:56,212] Trial 88 finished with value: 0.08602607670865338 and parameters: {'model_type': 'graphsage', 'hidden_dims': '[256, 128]', 'dropout': 0.14321592816634385, 'batch_norm': False, 'lr': 0.00022644785078736835, 'weight_decay': 0.0007440856065341836, 'epochs': 349, 'loss': 'mse', 'optimizer': 'adam', 'graph_mode': 'knn', 'source': 'grm', 'knn_k': 1, 'weighted_edges': True, 'symmetrize_mode': 'mutual', 'use_snp_selection': True, 'num_snps': 22317}. Best is trial 73 with value: 0.10606704674092371.
[I 2025-11-03 14:03:59,905] Trial 89 finished with value: 0.057592159405023255 and parameters: {'model_type': 'graphsage', 'hidden_dims': '[512, 64]', 'dropout': 0.20201879046566518, 'batch_norm': False, 'lr': 0.0008770231878633422, 'weight_decay': 0.0005377026860547748, 'epochs': 325, 'loss': 'mse', 'optimizer': 'adam', 'graph_mode': 'knn', 'source': 'grm', 'knn_k': 1, 'weighted_edges': False, 'symmetrize_mode': 'mutual', 'use_snp_selection': True, 'num_snps': 16183}. Best is trial 73 with value: 0.10606704674092371.
[I 2025-11-03 14:04:03,044] Trial 90 finished with value: 0.06501223079115154 and parameters: {'model_type': 'graphsage', 'hidden_dims': '[512, 64]', 'dropout': 0.16518139434219214, 'batch_norm': False, 'lr': 0.0005828015214547668, 'weight_decay': 0.0004669282488234072, 'epochs': 339, 'loss': 'mse', 'optimizer': 'adam', 'graph_mode': 'knn', 'source': 'grm', 'knn_k': 2, 'weighted_edges': True, 'symmetrize_mode': 'union', 'use_snp_selection': True, 'num_snps': 10449}. Best is trial 73 with value: 0.10606704674092371.
[I 2025-11-03 14:04:06,997] Trial 91 finished with value: 0.10052553460726894 and parameters: {'model_type': 'graphsage', 'hidden_dims': '[512, 64]', 'dropout': 0.10150180472876111, 'batch_norm': False, 'lr': 0.00027757333615033265, 'weight_decay': 0.0009881132072553764, 'epochs': 286, 'loss': 'mse', 'optimizer': 'adam', 'graph_mode': 'knn', 'source': 'grm', 'knn_k': 2, 'weighted_edges': True, 'symmetrize_mode': 'mutual', 'use_snp_selection': True, 'num_snps': 19173}. Best is trial 73 with value: 0.10606704674092371.
[I 2025-11-03 14:04:10,920] Trial 92 finished with value: 0.07723498057153677 and parameters: {'model_type': 'graphsage', 'hidden_dims': '[512, 64]', 'dropout': 0.10103424172515915, 'batch_norm': False, 'lr': 0.00041929347657336286, 'weight_decay': 0.0009103854804791648, 'epochs': 286, 'loss': 'mse', 'optimizer': 'adam', 'graph_mode': 'knn', 'source': 'grm', 'knn_k': 2, 'weighted_edges': True, 'symmetrize_mode': 'mutual', 'use_snp_selection': True, 'num_snps': 19101}. Best is trial 73 with value: 0.10606704674092371.
[I 2025-11-03 14:04:15,878] Trial 93 finished with value: 0.09217164622665913 and parameters: {'model_type': 'graphsage', 'hidden_dims': '[512, 64]', 'dropout': 0.11313298820192784, 'batch_norm': False, 'lr': 0.00027255185894084976, 'weight_decay': 0.00038034510662646697, 'epochs': 314, 'loss': 'mse', 'optimizer': 'adam', 'graph_mode': 'knn', 'source': 'grm', 'knn_k': 10, 'weighted_edges': True, 'symmetrize_mode': 'mutual', 'use_snp_selection': True, 'num_snps': 22682}. Best is trial 73 with value: 0.10606704674092371.
[I 2025-11-03 14:04:20,189] Trial 94 finished with value: 0.082192522661757 and parameters: {'model_type': 'graphsage', 'hidden_dims': '[512, 64]', 'dropout': 0.13716135959374998, 'batch_norm': False, 'lr': 0.00019954966363383225, 'weight_decay': 0.0006731546124657289, 'epochs': 331, 'loss': 'mse', 'optimizer': 'adam', 'graph_mode': 'knn', 'source': 'grm', 'knn_k': 1, 'weighted_edges': True, 'symmetrize_mode': 'mutual', 'use_snp_selection': True, 'num_snps': 20462}. Best is trial 73 with value: 0.10606704674092371.
[I 2025-11-03 14:04:23,930] Trial 95 finished with value: 0.09508022429970854 and parameters: {'model_type': 'graphsage', 'hidden_dims': '[512, 64]', 'dropout': 0.15160169251910405, 'batch_norm': False, 'lr': 0.00014008287660228098, 'weight_decay': 0.00030729619163978296, 'epochs': 275, 'loss': 'mse', 'optimizer': 'adam', 'graph_mode': 'knn', 'source': 'grm', 'knn_k': 2, 'weighted_edges': True, 'symmetrize_mode': 'mutual', 'use_snp_selection': True, 'num_snps': 17855}. Best is trial 73 with value: 0.10606704674092371.
[I 2025-11-03 14:04:29,130] Trial 96 finished with value: 0.09350981392159778 and parameters: {'model_type': 'graphsage', 'hidden_dims': '[512, 64]', 'dropout': 0.11250797969331464, 'batch_norm': False, 'lr': 0.0003663926708568967, 'weight_decay': 0.0005882161671677899, 'epochs': 322, 'loss': 'mse', 'optimizer': 'adam', 'graph_mode': 'knn', 'source': 'grm', 'knn_k': 2, 'weighted_edges': True, 'symmetrize_mode': 'mutual', 'use_snp_selection': True, 'num_snps': 28463}. Best is trial 73 with value: 0.10606704674092371.
[I 2025-11-03 14:04:32,168] Trial 97 finished with value: 0.05927352779161293 and parameters: {'model_type': 'graphsage', 'hidden_dims': '[128, 64]', 'dropout': 0.21676483929681117, 'batch_norm': False, 'lr': 0.0001779904489793212, 'weight_decay': 0.000986503574680436, 'epochs': 338, 'loss': 'mse', 'optimizer': 'adam', 'graph_mode': 'knn', 'source': 'grm', 'knn_k': 9, 'weighted_edges': True, 'symmetrize_mode': 'mutual', 'use_snp_selection': True, 'num_snps': 14073}. Best is trial 73 with value: 0.10606704674092371.
