[I 2025-11-03 13:23:22,842] Trial 50 finished with value: 0.02136895282621822 and parameters: {'model_type': 'gcn', 'hidden_dims': '[512, 64]', 'dropout': 0.12124288224632827, 'batch_norm': True, 'lr': 0.0002376226985711601, 'weight_decay': 5.5228834189057105e-05, 'epochs': 225, 'loss': 'mae', 'optimizer': 'adam', 'graph_mode': 'off', 'use_snp_selection': False}. Best is trial 39 with value: 0.0977451340706182.
[I 2025-11-03 13:23:25,248] Trial 51 finished with value: 0.03714034893664076 and parameters: {'model_type': 'gcn', 'hidden_dims': '[512, 128]', 'dropout': 0.11642629919609454, 'batch_norm': True, 'lr': 0.0005106585127967907, 'weight_decay': 1.7621204174118896e-05, 'epochs': 309, 'loss': 'mae', 'optimizer': 'adam', 'graph_mode': 'off', 'use_snp_selection': False}. Best is trial 39 with value: 0.0977451340706182.
[I 2025-11-03 13:23:27,555] Trial 52 finished with value: 0.052386204088450926 and parameters: {'model_type': 'gcn', 'hidden_dims': '[512, 128]', 'dropout': 0.1491552731348633, 'batch_norm': True, 'lr': 0.0002146525435779339, 'weight_decay': 3.450395380145017e-05, 'epochs': 288, 'loss': 'mae', 'optimizer': 'adam', 'graph_mode': 'off', 'use_snp_selection': False}. Best is trial 39 with value: 0.0977451340706182.
[I 2025-11-03 13:23:29,845] Trial 53 finished with value: 0.041579860967522086 and parameters: {'model_type': 'gcn', 'hidden_dims': '[512, 128]', 'dropout': 0.17534095686846482, 'batch_norm': True, 'lr': 0.00017822579996316237, 'weight_decay': 3.08664312649554e-05, 'epochs': 288, 'loss': 'mae', 'optimizer': 'adam', 'graph_mode': 'off', 'use_snp_selection': False}. Best is trial 39 with value: 0.0977451340706182.
[I 2025-11-03 13:23:31,933] Trial 54 finished with value: 0.0026922724021190957 and parameters: {'model_type': 'gcn', 'hidden_dims': '[512, 128]', 'dropout': 0.14886817588747778, 'batch_norm': True, 'lr': 5.449925226127178e-05, 'weight_decay': 5.96887613257079e-06, 'epochs': 251, 'loss': 'mae', 'optimizer': 'adam', 'graph_mode': 'off', 'use_snp_selection': False}. Best is trial 39 with value: 0.0977451340706182.
[I 2025-11-03 13:23:33,137] Trial 55 finished with value: 0.041103060654313704 and parameters: {'model_type': 'gcn', 'hidden_dims': '[128, 64]', 'dropout': 0.210908755950278, 'batch_norm': True, 'lr': 0.0009608301057267565, 'weight_decay': 9.507395367383911e-05, 'epochs': 277, 'loss': 'mae', 'optimizer': 'adam', 'graph_mode': 'off', 'use_snp_selection': False}. Best is trial 39 with value: 0.0977451340706182.
[I 2025-11-03 13:23:35,247] Trial 56 finished with value: 0.03692150960743907 and parameters: {'model_type': 'gcn', 'hidden_dims': '[256, 128, 64]', 'dropout': 0.1938582967187676, 'batch_norm': True, 'lr': 0.000327720816515068, 'weight_decay': 0.00020858076980139758, 'epochs': 321, 'loss': 'mae', 'optimizer': 'adam', 'graph_mode': 'off', 'use_snp_selection': False}. Best is trial 39 with value: 0.0977451340706182.
[I 2025-11-03 13:23:37,763] Trial 57 finished with value: 0.021002810583206515 and parameters: {'model_type': 'gcn', 'hidden_dims': '[512, 256]', 'dropout': 0.13713248811041207, 'batch_norm': False, 'lr': 3.092533939888729e-05, 'weight_decay': 1.5973525838484664e-05, 'epochs': 350, 'loss': 'mse', 'optimizer': 'adam', 'graph_mode': 'off', 'use_snp_selection': False}. Best is trial 39 with value: 0.0977451340706182.
[I 2025-11-03 13:23:39,927] Trial 58 finished with value: 0.03249326407256782 and parameters: {'model_type': 'gcn', 'hidden_dims': '[512, 128]', 'dropout': 0.15873530216362552, 'batch_norm': True, 'lr': 9.286483324773182e-05, 'weight_decay': 4.5284415449950045e-05, 'epochs': 268, 'loss': 'mae', 'optimizer': 'adam', 'graph_mode': 'off', 'use_snp_selection': False}. Best is trial 39 with value: 0.0977451340706182.
[I 2025-11-03 13:23:41,780] Trial 59 finished with value: 0.04886313960397923 and parameters: {'model_type': 'gcn', 'hidden_dims': '[512, 128]', 'dropout': 0.1771825505223273, 'batch_norm': True, 'lr': 0.00021114017557014904, 'weight_decay': 1.6139406775110432e-07, 'epochs': 206, 'loss': 'mse', 'optimizer': 'adam', 'graph_mode': 'off', 'use_snp_selection': False}. Best is trial 39 with value: 0.0977451340706182.
[I 2025-11-03 13:23:43,391] Trial 60 finished with value: 0.040177468195494254 and parameters: {'model_type': 'gcn', 'hidden_dims': '[128, 64]', 'dropout': 0.13210133349172537, 'batch_norm': True, 'lr': 0.00013482216850348793, 'weight_decay': 2.9337199812300775e-07, 'epochs': 336, 'loss': 'mae', 'optimizer': 'adam', 'graph_mode': 'off', 'use_snp_selection': True, 'num_snps': 24139}. Best is trial 39 with value: 0.0977451340706182.
[I 2025-11-03 13:23:45,284] Trial 61 finished with value: 0.024862430349532314 and parameters: {'model_type': 'gcn', 'hidden_dims': '[512, 128]', 'dropout': 0.17459390753951637, 'batch_norm': True, 'lr': 0.00019614377617862704, 'weight_decay': 4.425249203812806e-07, 'epochs': 211, 'loss': 'mse', 'optimizer': 'adam', 'graph_mode': 'off', 'use_snp_selection': False}. Best is trial 39 with value: 0.0977451340706182.
[I 2025-11-03 13:23:46,669] Trial 62 finished with value: 0.027573816745568455 and parameters: {'model_type': 'gcn', 'hidden_dims': '[512, 128]', 'dropout': 0.19361731622454895, 'batch_norm': True, 'lr': 0.0002844495128189939, 'weight_decay': 2.1486423466450504e-07, 'epochs': 121, 'loss': 'mse', 'optimizer': 'adam', 'graph_mode': 'off', 'use_snp_selection': False}. Best is trial 39 with value: 0.0977451340706182.
[I 2025-11-03 13:23:49,007] Trial 63 finished with value: 0.049228027345022025 and parameters: {'model_type': 'gcn', 'hidden_dims': '[512, 128]', 'dropout': 0.21528646030733728, 'batch_norm': True, 'lr': 6.670868147966137e-05, 'weight_decay': 1.5681656612793631e-07, 'epochs': 305, 'loss': 'mse', 'optimizer': 'adam', 'graph_mode': 'off', 'use_snp_selection': False}. Best is trial 39 with value: 0.0977451340706182.
[I 2025-11-03 13:23:51,341] Trial 64 finished with value: 0.040574452456179536 and parameters: {'model_type': 'gcn', 'hidden_dims': '[512, 128]', 'dropout': 0.21894895381011156, 'batch_norm': True, 'lr': 6.821632289577426e-05, 'weight_decay': 8.671482896323576e-07, 'epochs': 298, 'loss': 'mse', 'optimizer': 'adam', 'graph_mode': 'off', 'use_snp_selection': False}. Best is trial 39 with value: 0.0977451340706182.
[I 2025-11-03 13:23:53,737] Trial 65 finished with value: 0.022848868165017633 and parameters: {'model_type': 'gcn', 'hidden_dims': '[512, 256]', 'dropout': 0.2828236285193927, 'batch_norm': True, 'lr': 4.859311152657627e-05, 'weight_decay': 1.4898472667880103e-07, 'epochs': 316, 'loss': 'mse', 'optimizer': 'adam', 'graph_mode': 'off', 'use_snp_selection': False}. Best is trial 39 with value: 0.0977451340706182.
[I 2025-11-03 13:23:56,052] Trial 66 finished with value: 0.025630230234165743 and parameters: {'model_type': 'gcn', 'hidden_dims': '[512, 128]', 'dropout': 0.151652145436776, 'batch_norm': True, 'lr': 2.0158926272700854e-05, 'weight_decay': 6.880180263924932e-06, 'epochs': 302, 'loss': 'mae', 'optimizer': 'adam', 'graph_mode': 'off', 'use_snp_selection': False}. Best is trial 39 with value: 0.0977451340706182.
[I 2025-11-03 13:23:57,641] Trial 67 finished with value: 0.027397887092809468 and parameters: {'model_type': 'gcn', 'hidden_dims': '[256, 128]', 'dropout': 0.11197791268731816, 'batch_norm': True, 'lr': 3.5144914755127936e-05, 'weight_decay': 3.8424131623945445e-06, 'epochs': 285, 'loss': 'mse', 'optimizer': 'adam', 'graph_mode': 'off', 'use_snp_selection': False}. Best is trial 39 with value: 0.0977451340706182.
[I 2025-11-03 13:23:58,895] Trial 68 finished with value: -0.004755358664886088 and parameters: {'model_type': 'gcn', 'hidden_dims': '[512, 128]', 'dropout': 0.3326798987697642, 'batch_norm': False, 'lr': 1.3865713633103501e-05, 'weight_decay': 2.2820796946835254e-05, 'epochs': 100, 'loss': 'mae', 'optimizer': 'adam', 'graph_mode': 'off', 'use_snp_selection': False}. Best is trial 39 with value: 0.0977451340706182.
[I 2025-11-03 13:24:00,302] Trial 69 finished with value: 0.01816256468576724 and parameters: {'model_type': 'gcn', 'hidden_dims': '[128, 64]', 'dropout': 0.20584285350412881, 'batch_norm': True, 'lr': 2.706367931333718e-05, 'weight_decay': 2.737106268157862e-07, 'epochs': 339, 'loss': 'mae', 'optimizer': 'adam', 'graph_mode': 'off', 'use_snp_selection': False}. Best is trial 39 with value: 0.0977451340706182.
[I 2025-11-03 13:24:02,046] Trial 70 finished with value: 0.019722799483050044 and parameters: {'model_type': 'gcn', 'hidden_dims': '[256, 128, 64]', 'dropout': 0.26136004743784536, 'batch_norm': True, 'lr': 0.00013604971295081664, 'weight_decay': 6.185590884848318e-07, 'epochs': 260, 'loss': 'mse', 'optimizer': 'adam', 'graph_mode': 'off', 'use_snp_selection': False}. Best is trial 39 with value: 0.0977451340706182.
[I 2025-11-03 13:24:03,572] Trial 71 finished with value: 0.03227086433055134 and parameters: {'model_type': 'gcn', 'hidden_dims': '[512, 128]', 'dropout': 0.1866814522201191, 'batch_norm': True, 'lr': 9.337754188733302e-05, 'weight_decay': 1.5630680761829423e-07, 'epochs': 153, 'loss': 'mse', 'optimizer': 'adam', 'graph_mode': 'off', 'use_snp_selection': False}. Best is trial 39 with value: 0.0977451340706182.
[I 2025-11-03 13:24:05,334] Trial 72 finished with value: 0.06187794980572295 and parameters: {'model_type': 'gcn', 'hidden_dims': '[512, 128]', 'dropout': 0.16937209237516848, 'batch_norm': True, 'lr': 6.747059280760711e-05, 'weight_decay': 1.700129567386661e-07, 'epochs': 195, 'loss': 'mse', 'optimizer': 'adam', 'graph_mode': 'off', 'use_snp_selection': False}. Best is trial 39 with value: 0.0977451340706182.
[I 2025-11-03 13:24:06,414] Trial 73 finished with value: 0.012044139381990702 and parameters: {'model_type': 'gcn', 'hidden_dims': '[512, 128]', 'dropout': 0.16717152798358775, 'batch_norm': True, 'lr': 6.0573127032805246e-05, 'weight_decay': 1.0628799047107808e-05, 'epochs': 57, 'loss': 'mse', 'optimizer': 'adam', 'graph_mode': 'off', 'use_snp_selection': False}. Best is trial 39 with value: 0.0977451340706182.
[I 2025-11-03 13:24:08,036] Trial 74 finished with value: 0.032622211984119166 and parameters: {'model_type': 'gcn', 'hidden_dims': '[512, 128]', 'dropout': 0.23294965309649568, 'batch_norm': True, 'lr': 4.4187944538058135e-05, 'weight_decay': 3.1023486101401575e-07, 'epochs': 172, 'loss': 'mse', 'optimizer': 'adam', 'graph_mode': 'off', 'use_snp_selection': False}. Best is trial 39 with value: 0.0977451340706182.
[I 2025-11-03 13:24:10,340] Trial 75 finished with value: 0.06078431647414839 and parameters: {'model_type': 'gcn', 'hidden_dims': '[512, 128]', 'dropout': 0.44894199585487804, 'batch_norm': True, 'lr': 0.00011138542705201992, 'weight_decay': 1.1882455793034792e-06, 'epochs': 291, 'loss': 'mse', 'optimizer': 'adam', 'graph_mode': 'off', 'use_snp_selection': False}. Best is trial 39 with value: 0.0977451340706182.
[I 2025-11-03 13:24:11,498] Trial 76 finished with value: 0.048013698019399045 and parameters: {'model_type': 'gcn', 'hidden_dims': '[512, 256]', 'dropout': 0.4176671087946074, 'batch_norm': True, 'lr': 0.00014982453984534302, 'weight_decay': 1.4628056862882524e-06, 'epochs': 294, 'loss': 'mse', 'optimizer': 'adam', 'graph_mode': 'off', 'use_snp_selection': True, 'num_snps': 3325}. Best is trial 39 with value: 0.0977451340706182.
[I 2025-11-03 13:24:13,745] Trial 77 finished with value: 0.043099185419892154 and parameters: {'model_type': 'gcn', 'hidden_dims': '[512, 128]', 'dropout': 0.4653612327954705, 'batch_norm': True, 'lr': 9.324033544524963e-05, 'weight_decay': 9.777445866004086e-07, 'epochs': 277, 'loss': 'mae', 'optimizer': 'adam', 'graph_mode': 'off', 'use_snp_selection': False}. Best is trial 39 with value: 0.0977451340706182.
[I 2025-11-03 13:24:16,194] Trial 78 finished with value: 0.022152536803863185 and parameters: {'model_type': 'gcn', 'hidden_dims': '[512, 128]', 'dropout': 0.5356701739994623, 'batch_norm': True, 'lr': 0.00011132439790824714, 'weight_decay': 4.1058240436666315e-07, 'epochs': 322, 'loss': 'mse', 'optimizer': 'adam', 'graph_mode': 'off', 'use_snp_selection': False}. Best is trial 39 with value: 0.0977451340706182.
[I 2025-11-03 13:24:18,166] Trial 79 finished with value: 0.026081570963557336 and parameters: {'model_type': 'gcn', 'hidden_dims': '[512, 64]', 'dropout': 0.1353605991788656, 'batch_norm': True, 'lr': 7.79663614538667e-05, 'weight_decay': 5.56823599061877e-07, 'epochs': 236, 'loss': 'mae', 'optimizer': 'adam', 'graph_mode': 'off', 'use_snp_selection': False}. Best is trial 39 with value: 0.0977451340706182.
[I 2025-11-03 13:24:18,839] Trial 80 finished with value: 0.015365288084298878 and parameters: {'model_type': 'gcn', 'hidden_dims': '[128, 64]', 'dropout': 0.4447328989843287, 'batch_norm': False, 'lr': 0.0003775021682009566, 'weight_decay': 0.0004391148556334814, 'epochs': 74, 'loss': 'mae', 'optimizer': 'adam', 'graph_mode': 'off', 'use_snp_selection': False}. Best is trial 39 with value: 0.0977451340706182.
[I 2025-11-03 13:24:21,220] Trial 81 finished with value: 0.03983496184127745 and parameters: {'model_type': 'gcn', 'hidden_dims': '[512, 128]', 'dropout': 0.1507778111635046, 'batch_norm': True, 'lr': 6.908107282359115e-05, 'weight_decay': 2.423085535441173e-07, 'epochs': 312, 'loss': 'mse', 'optimizer': 'adam', 'graph_mode': 'off', 'use_snp_selection': False}. Best is trial 39 with value: 0.0977451340706182.
[I 2025-11-03 13:24:23,597] Trial 82 finished with value: 0.04226606547911668 and parameters: {'model_type': 'gcn', 'hidden_dims': '[512, 128]', 'dropout': 0.37596475829146714, 'batch_norm': True, 'lr': 3.9882953041115795e-05, 'weight_decay': 1.1035611423865559e-07, 'epochs': 305, 'loss': 'mse', 'optimizer': 'adam', 'graph_mode': 'off', 'use_snp_selection': False}. Best is trial 39 with value: 0.0977451340706182.
[I 2025-11-03 13:24:25,862] Trial 83 finished with value: 0.040204097836874945 and parameters: {'model_type': 'gcn', 'hidden_dims': '[512, 128]', 'dropout': 0.11228441029661303, 'batch_norm': True, 'lr': 5.2726773669563245e-05, 'weight_decay': 3.3902452367136273e-07, 'epochs': 291, 'loss': 'mse', 'optimizer': 'adam', 'graph_mode': 'off', 'use_snp_selection': False}. Best is trial 39 with value: 0.0977451340706182.
[I 2025-11-03 13:24:28,348] Trial 84 finished with value: 0.040687904998541025 and parameters: {'model_type': 'gcn', 'hidden_dims': '[512, 128]', 'dropout': 0.16018181490910863, 'batch_norm': True, 'lr': 0.00011796095642710536, 'weight_decay': 1.5117804035458727e-05, 'epochs': 329, 'loss': 'mse', 'optimizer': 'adam', 'graph_mode': 'off', 'use_snp_selection': False}. Best is trial 39 with value: 0.0977451340706182.
[I 2025-11-03 13:24:29,915] Trial 85 finished with value: 0.010107921121667383 and parameters: {'model_type': 'gcn', 'hidden_dims': '[256, 128]', 'dropout': 0.30071479550015157, 'batch_norm': True, 'lr': 9.184078303168681e-06, 'weight_decay': 2.033825942466176e-06, 'epochs': 280, 'loss': 'mse', 'optimizer': 'adam', 'graph_mode': 'off', 'use_snp_selection': False}. Best is trial 39 with value: 0.0977451340706182.
[I 2025-11-03 13:24:32,247] Trial 86 finished with value: 0.03042097438932713 and parameters: {'model_type': 'gcn', 'hidden_dims': '[512, 128]', 'dropout': 0.12689727833792797, 'batch_norm': True, 'lr': 2.703705228963324e-05, 'weight_decay': 8.847671552684225e-06, 'epochs': 300, 'loss': 'mse', 'optimizer': 'adam', 'graph_mode': 'off', 'use_snp_selection': False}. Best is trial 39 with value: 0.0977451340706182.
[I 2025-11-03 13:24:34,307] Trial 87 finished with value: -0.01660267918502464 and parameters: {'model_type': 'gcn', 'hidden_dims': '[512, 256]', 'dropout': 0.49366927730510624, 'batch_norm': True, 'lr': 4.0870333532373795e-06, 'weight_decay': 7.576701519120639e-07, 'epochs': 247, 'loss': 'mae', 'optimizer': 'adam', 'graph_mode': 'off', 'use_snp_selection': False}. Best is trial 39 with value: 0.0977451340706182.
[I 2025-11-03 13:24:36,935] Trial 88 finished with value: 0.043474458797424176 and parameters: {'model_type': 'gcn', 'hidden_dims': '[512, 128]', 'dropout': 0.21357357036243563, 'batch_norm': True, 'lr': 0.0002506039832935035, 'weight_decay': 1.9270460816703713e-07, 'epochs': 267, 'loss': 'mse', 'optimizer': 'adam', 'graph_mode': 'off', 'use_snp_selection': True, 'num_snps': 48766}. Best is trial 39 with value: 0.0977451340706182.
[I 2025-11-03 13:24:38,148] Trial 89 finished with value: -0.006436460718559644 and parameters: {'model_type': 'gcn', 'hidden_dims': '[256, 128, 64]', 'dropout': 0.3589177678779721, 'batch_norm': True, 'lr': 6.626478209918728e-05, 'weight_decay': 1.2165828370933613e-07, 'epochs': 134, 'loss': 'mae', 'optimizer': 'adam', 'graph_mode': 'off', 'use_snp_selection': False}. Best is trial 39 with value: 0.0977451340706182.
[I 2025-11-03 13:24:40,550] Trial 90 finished with value: 0.03509473608979338 and parameters: {'model_type': 'gcn', 'hidden_dims': '[512, 128]', 'dropout': 0.40078839317742515, 'batch_norm': True, 'lr': 0.00016801080283928367, 'weight_decay': 1.1667995772308153e-06, 'epochs': 317, 'loss': 'mse', 'optimizer': 'adam', 'graph_mode': 'off', 'use_snp_selection': False}. Best is trial 39 with value: 0.0977451340706182.
[I 2025-11-03 13:24:42,315] Trial 91 finished with value: 0.05620764632472407 and parameters: {'model_type': 'gcn', 'hidden_dims': '[512, 128]', 'dropout': 0.17471846015201406, 'batch_norm': True, 'lr': 0.0002950911371656843, 'weight_decay': 3.753816236722021e-07, 'epochs': 189, 'loss': 'mse', 'optimizer': 'adam', 'graph_mode': 'off', 'use_snp_selection': False}. Best is trial 39 with value: 0.0977451340706182.
[I 2025-11-03 13:24:43,979] Trial 92 finished with value: 0.04242075757099407 and parameters: {'model_type': 'gcn', 'hidden_dims': '[512, 128]', 'dropout': 0.20054961106360228, 'batch_norm': True, 'lr': 0.0004880959768393383, 'weight_decay': 3.929477673070141e-07, 'epochs': 172, 'loss': 'mse', 'optimizer': 'adam', 'graph_mode': 'off', 'use_snp_selection': False}. Best is trial 39 with value: 0.0977451340706182.
[I 2025-11-03 13:24:45,748] Trial 93 finished with value: 0.04110643066266767 and parameters: {'model_type': 'gcn', 'hidden_dims': '[512, 128]', 'dropout': 0.14089086982341642, 'batch_norm': True, 'lr': 0.0002075099602359378, 'weight_decay': 0.0009818924169438454, 'epochs': 193, 'loss': 'mse', 'optimizer': 'adam', 'graph_mode': 'off', 'use_snp_selection': False}. Best is trial 39 with value: 0.0977451340706182.
[I 2025-11-03 13:24:47,675] Trial 94 finished with value: 0.044501452347756515 and parameters: {'model_type': 'gcn', 'hidden_dims': '[512, 128]', 'dropout': 0.1701183138333269, 'batch_norm': True, 'lr': 0.0003417076169521004, 'weight_decay': 5.376718579524548e-07, 'epochs': 222, 'loss': 'mse', 'optimizer': 'adam', 'graph_mode': 'off', 'use_snp_selection': False}. Best is trial 39 with value: 0.0977451340706182.
[I 2025-11-03 13:24:48,634] Trial 95 finished with value: 0.052662817506693965 and parameters: {'model_type': 'gcn', 'hidden_dims': '[128, 64]', 'dropout': 0.18973505545909203, 'batch_norm': True, 'lr': 0.0002793057616189438, 'weight_decay': 7.9865718741502e-05, 'epochs': 184, 'loss': 'mse', 'optimizer': 'adam', 'graph_mode': 'off', 'use_snp_selection': False}. Best is trial 39 with value: 0.0977451340706182.
[I 2025-11-03 13:24:49,550] Trial 96 finished with value: 0.02932207802791129 and parameters: {'model_type': 'gcn', 'hidden_dims': '[128, 64]', 'dropout': 0.18546279463319518, 'batch_norm': True, 'lr': 0.0002898262676882831, 'weight_decay': 7.699154219360345e-05, 'epochs': 165, 'loss': 'mae', 'optimizer': 'adam', 'graph_mode': 'off', 'use_snp_selection': False}. Best is trial 39 with value: 0.0977451340706182.
[I 2025-11-03 13:24:50,542] Trial 97 finished with value: 0.017442250482121596 and parameters: {'model_type': 'gcn', 'hidden_dims': '[128, 64]', 'dropout': 0.15358189915590958, 'batch_norm': False, 'lr': 0.0006144294513255598, 'weight_decay': 3.091082911204979e-05, 'epochs': 203, 'loss': 'mse', 'optimizer': 'adam', 'graph_mode': 'off', 'use_snp_selection': False}. Best is trial 39 with value: 0.0977451340706182.
[I 2025-11-03 13:24:51,521] Trial 98 finished with value: 0.022344734682928143 and parameters: {'model_type': 'gcn', 'hidden_dims': '[128, 64]', 'dropout': 0.11002187074548256, 'batch_norm': True, 'lr': 0.0003921070247699431, 'weight_decay': 0.00014430688561721495, 'epochs': 181, 'loss': 'mae', 'optimizer': 'adam', 'graph_mode': 'off', 'use_snp_selection': False}. Best is trial 39 with value: 0.0977451340706182.
[I 2025-11-03 13:24:52,614] Trial 99 finished with value: 0.024242506013655508 and parameters: {'model_type': 'gcn', 'hidden_dims': '[128, 64]', 'dropout': 0.14435224522447987, 'batch_norm': True, 'lr': 2.3294687156157485e-06, 'weight_decay': 2.0855496333357856e-05, 'epochs': 226, 'loss': 'mse', 'optimizer': 'adam', 'graph_mode': 'off', 'use_snp_selection': False}. Best is trial 39 with value: 0.0977451340706182.
[I 2025-11-03 13:24:54,383] Trial 100 finished with value: 0.03418886722459743 and parameters: {'model_type': 'gcn', 'hidden_dims': '[512, 64]', 'dropout': 0.5955566245756247, 'batch_norm': True, 'lr': 1.8564541947362387e-05, 'weight_decay': 0.00022266571292662042, 'epochs': 192, 'loss': 'mae', 'optimizer': 'adam', 'graph_mode': 'off', 'use_snp_selection': False}. Best is trial 39 with value: 0.0977451340706182.
[I 2025-11-03 13:24:56,075] Trial 101 finished with value: 0.029093744305125385 and parameters: {'model_type': 'gcn', 'hidden_dims': '[512, 128]', 'dropout': 0.22626975481306838, 'batch_norm': True, 'lr': 8.321850659698818e-05, 'weight_decay': 6.0486121834665705e-05, 'epochs': 183, 'loss': 'mse', 'optimizer': 'adam', 'graph_mode': 'off', 'use_snp_selection': False}. Best is trial 39 with value: 0.0977451340706182.
