Running from this directory: /cluster/work/simennes/Project_thesis/Project_thesis
Name of job: tune_params
ID of job: 23139602
The job was run on these nodes: idun-07-07
[I 2025-10-20 16:48:50,146] Trial 0 finished with value: 0.14523111555981838 and parameters: {'model_type': 'gat', 'hidden_dims': '[128, 64]', 'dropout': 0.199031432379812, 'batch_norm': True, 'gat_heads': 1, 'gat_attn_dropout': 0.41121589102067835, 'gat_concat_hidden': True, 'lr': 3.4401453323286906e-05, 'weight_decay': 0.00017802616915745114, 'epochs': 230, 'loss': 'mse', 'optimizer': 'adam', 'graph_mode': 'knn', 'source': 'grm', 'knn_k': 6, 'weighted_edges': True, 'symmetrize_mode': 'mutual'}. Best is trial 0 with value: 0.14523111555981838.
[I 2025-10-20 16:50:01,698] Trial 1 finished with value: 0.12088676688898688 and parameters: {'model_type': 'gat', 'hidden_dims': '[512, 64]', 'dropout': 0.36082357619681704, 'batch_norm': True, 'gat_heads': 1, 'gat_attn_dropout': 0.18042003398172202, 'gat_concat_hidden': False, 'lr': 1.3825758230956745e-06, 'weight_decay': 3.199989794411411e-05, 'epochs': 210, 'loss': 'mse', 'optimizer': 'adam', 'graph_mode': 'knn', 'source': 'grm', 'knn_k': 8, 'weighted_edges': True, 'symmetrize_mode': 'mutual'}. Best is trial 0 with value: 0.14523111555981838.
[I 2025-10-20 16:52:31,209] Trial 2 finished with value: 0.18245778331910206 and parameters: {'model_type': 'gat', 'hidden_dims': '[512, 64]', 'dropout': 0.5938127374509361, 'batch_norm': False, 'gat_heads': 3, 'gat_attn_dropout': 0.3584229889385306, 'gat_concat_hidden': True, 'lr': 5.8966328690006356e-05, 'weight_decay': 1.4359095002909625e-07, 'epochs': 151, 'loss': 'mae', 'optimizer': 'adam', 'graph_mode': 'cutoff', 'cutoff': 0.22797144608298409, 'grm_norm': 'none', 'self_loops': False}. Best is trial 2 with value: 0.18245778331910206.
[I 2025-10-20 16:53:08,458] Trial 3 finished with value: 0.15350507863414398 and parameters: {'model_type': 'gat', 'hidden_dims': '[256, 128]', 'dropout': 0.23110783056597514, 'batch_norm': True, 'gat_heads': 3, 'gat_attn_dropout': 0.14524552524211642, 'gat_concat_hidden': False, 'lr': 2.6631568299397822e-05, 'weight_decay': 1.4831733219640837e-06, 'epochs': 59, 'loss': 'mse', 'optimizer': 'adam', 'graph_mode': 'cutoff', 'cutoff': 0.5085416774304665, 'grm_norm': 'cosine_then_gcn', 'self_loops': False}. Best is trial 2 with value: 0.18245778331910206.
[I 2025-10-20 16:53:39,935] Trial 4 finished with value: 0.15150605135460776 and parameters: {'model_type': 'gat', 'hidden_dims': '[128, 64]', 'dropout': 0.24986493621228142, 'batch_norm': False, 'gat_heads': 2, 'gat_attn_dropout': 0.03028660209239857, 'gat_concat_hidden': True, 'lr': 3.4411882055364858e-06, 'weight_decay': 0.00034938832175517785, 'epochs': 153, 'loss': 'mae', 'optimizer': 'adam', 'graph_mode': 'cutoff', 'cutoff': 0.5288497054083461, 'grm_norm': 'cosine_then_gcn', 'self_loops': False}. Best is trial 2 with value: 0.18245778331910206.
[I 2025-10-20 16:55:02,674] Trial 5 finished with value: 0.18863979405294198 and parameters: {'model_type': 'gat', 'hidden_dims': '[256, 128, 64]', 'dropout': 0.3667354424945013, 'batch_norm': False, 'gat_heads': 5, 'gat_attn_dropout': 0.47505419776597435, 'gat_concat_hidden': False, 'lr': 5.6570170227139244e-05, 'weight_decay': 6.845407486393404e-05, 'epochs': 86, 'loss': 'mae', 'optimizer': 'adam', 'graph_mode': 'cutoff', 'cutoff': 0.3163415033931736, 'grm_norm': 'cosine', 'self_loops': False}. Best is trial 5 with value: 0.18863979405294198.
[I 2025-10-20 16:57:57,970] Trial 6 finished with value: 0.13790787364123197 and parameters: {'model_type': 'gat', 'hidden_dims': '[512, 64]', 'dropout': 0.4724320384750339, 'batch_norm': True, 'gat_heads': 2, 'gat_attn_dropout': 0.5029567924222157, 'gat_concat_hidden': False, 'lr': 0.00035117819773722113, 'weight_decay': 2.586139236899202e-05, 'epochs': 282, 'loss': 'mse', 'optimizer': 'adam', 'graph_mode': 'knn', 'source': 'grm', 'knn_k': 5, 'weighted_edges': False, 'symmetrize_mode': 'mutual'}. Best is trial 5 with value: 0.18863979405294198.
[I 2025-10-20 16:58:28,982] Trial 7 finished with value: 0.20983968618908183 and parameters: {'model_type': 'gat', 'hidden_dims': '[256, 128]', 'dropout': 0.26933956649466984, 'batch_norm': False, 'gat_heads': 1, 'gat_attn_dropout': 0.12357015502138351, 'gat_concat_hidden': True, 'lr': 9.272145288974393e-05, 'weight_decay': 0.0001637847231599168, 'epochs': 149, 'loss': 'mae', 'optimizer': 'adam', 'graph_mode': 'knn', 'source': 'grm', 'knn_k': 9, 'weighted_edges': False, 'symmetrize_mode': 'mutual'}. Best is trial 7 with value: 0.20983968618908183.
[I 2025-10-20 16:58:48,649] Trial 8 finished with value: 0.11284441825572364 and parameters: {'model_type': 'gat', 'hidden_dims': '[256, 128, 64]', 'dropout': 0.5327763091136416, 'batch_norm': True, 'gat_heads': 1, 'gat_attn_dropout': 0.11077610280855929, 'gat_concat_hidden': False, 'lr': 0.0005504846263330393, 'weight_decay': 6.7826287729705615e-06, 'epochs': 80, 'loss': 'mse', 'optimizer': 'adam', 'graph_mode': 'cutoff', 'cutoff': 0.39200637331077737, 'grm_norm': 'cosine_then_gcn', 'self_loops': False}. Best is trial 7 with value: 0.20983968618908183.
[I 2025-10-20 17:00:09,689] Trial 9 finished with value: 0.189485032793198 and parameters: {'model_type': 'gat', 'hidden_dims': '[256, 128, 64]', 'dropout': 0.29822093943922523, 'batch_norm': True, 'gat_heads': 2, 'gat_attn_dropout': 0.5041483896530343, 'gat_concat_hidden': True, 'lr': 0.0009262984185468379, 'weight_decay': 8.224875501038066e-07, 'epochs': 231, 'loss': 'mae', 'optimizer': 'adam', 'graph_mode': 'cutoff', 'cutoff': 0.40177719715455146, 'grm_norm': 'none', 'self_loops': True}. Best is trial 7 with value: 0.20983968618908183.
[I 2025-10-20 17:06:36,490] Trial 10 finished with value: 0.1922909855313432 and parameters: {'model_type': 'gat', 'hidden_dims': '[256, 128]', 'dropout': 0.11372025982957354, 'batch_norm': False, 'gat_heads': 7, 'gat_attn_dropout': 0.2443275079776917, 'gat_concat_hidden': True, 'lr': 0.00016784941511771467, 'weight_decay': 5.9202890126985e-06, 'epochs': 339, 'loss': 'mae', 'optimizer': 'adam', 'graph_mode': 'knn', 'source': 'grm', 'knn_k': 10, 'weighted_edges': False, 'symmetrize_mode': 'union'}. Best is trial 7 with value: 0.20983968618908183.
[I 2025-10-20 17:14:19,085] Trial 11 finished with value: 0.18227036755662446 and parameters: {'model_type': 'gat', 'hidden_dims': '[256, 128]', 'dropout': 0.10218478872377368, 'batch_norm': False, 'gat_heads': 8, 'gat_attn_dropout': 0.2558365959913355, 'gat_concat_hidden': True, 'lr': 0.00016826444685824328, 'weight_decay': 5.432915736313813e-06, 'epochs': 348, 'loss': 'mae', 'optimizer': 'adam', 'graph_mode': 'knn', 'source': 'grm', 'knn_k': 10, 'weighted_edges': False, 'symmetrize_mode': 'union'}. Best is trial 7 with value: 0.20983968618908183.
[I 2025-10-20 17:20:10,767] Trial 12 finished with value: 0.17212360444087957 and parameters: {'model_type': 'gat', 'hidden_dims': '[256, 128]', 'dropout': 0.12075505276198942, 'batch_norm': False, 'gat_heads': 7, 'gat_attn_dropout': 0.2591153897776135, 'gat_concat_hidden': True, 'lr': 0.0001911940988809333, 'weight_decay': 0.0006210153429155936, 'epochs': 326, 'loss': 'mae', 'optimizer': 'adam', 'graph_mode': 'knn', 'source': 'grm', 'knn_k': 1, 'weighted_edges': False, 'symmetrize_mode': 'union'}. Best is trial 7 with value: 0.20983968618908183.
[I 2025-10-20 17:24:39,416] Trial 13 finished with value: 0.1786494873855818 and parameters: {'model_type': 'gat', 'hidden_dims': '[512, 256]', 'dropout': 0.1619360596158616, 'batch_norm': False, 'gat_heads': 5, 'gat_attn_dropout': 0.032332040148660285, 'gat_concat_hidden': True, 'lr': 9.933777278644612e-06, 'weight_decay': 1.989759453864908e-06, 'epochs': 153, 'loss': 'mae', 'optimizer': 'adam', 'graph_mode': 'knn', 'source': 'grm', 'knn_k': 10, 'weighted_edges': False, 'symmetrize_mode': 'union'}. Best is trial 7 with value: 0.20983968618908183.
[I 2025-10-20 17:33:29,172] Trial 14 finished with value: 0.2233340907230464 and parameters: {'model_type': 'gat', 'hidden_dims': '[512, 128]', 'dropout': 0.43354241554115447, 'batch_norm': False, 'gat_heads': 6, 'gat_attn_dropout': 0.20203044299413284, 'gat_concat_hidden': True, 'lr': 0.0001313527986269499, 'weight_decay': 0.00012725108328059322, 'epochs': 285, 'loss': 'mae', 'optimizer': 'adam', 'graph_mode': 'knn', 'source': 'grm', 'knn_k': 8, 'weighted_edges': False, 'symmetrize_mode': 'mutual'}. Best is trial 14 with value: 0.2233340907230464.
[I 2025-10-20 17:42:01,919] Trial 15 finished with value: 0.21007812490370345 and parameters: {'model_type': 'gat', 'hidden_dims': '[512, 128]', 'dropout': 0.41351758245914916, 'batch_norm': False, 'gat_heads': 6, 'gat_attn_dropout': 0.10350434663127081, 'gat_concat_hidden': True, 'lr': 1.352570837276448e-05, 'weight_decay': 0.00013167918530753255, 'epochs': 275, 'loss': 'mae', 'optimizer': 'adam', 'graph_mode': 'knn', 'source': 'grm', 'knn_k': 7, 'weighted_edges': False, 'symmetrize_mode': 'mutual'}. Best is trial 14 with value: 0.2233340907230464.
[I 2025-10-20 17:50:40,261] Trial 16 finished with value: 0.20548459550519294 and parameters: {'model_type': 'gat', 'hidden_dims': '[512, 128]', 'dropout': 0.4337768631587977, 'batch_norm': False, 'gat_heads': 6, 'gat_attn_dropout': 0.5914495619487123, 'gat_concat_hidden': True, 'lr': 1.017782472097058e-05, 'weight_decay': 0.0008442835511459924, 'epochs': 279, 'loss': 'mae', 'optimizer': 'adam', 'graph_mode': 'knn', 'source': 'grm', 'knn_k': 6, 'weighted_edges': False, 'symmetrize_mode': 'mutual'}. Best is trial 14 with value: 0.2233340907230464.
[I 2025-10-20 17:59:39,151] Trial 17 finished with value: 0.20084891069373506 and parameters: {'model_type': 'gat', 'hidden_dims': '[512, 128]', 'dropout': 0.4472513720308577, 'batch_norm': False, 'gat_heads': 6, 'gat_attn_dropout': 0.0008874212360814593, 'gat_concat_hidden': True, 'lr': 1.2937943558941825e-05, 'weight_decay': 6.406227221132982e-05, 'epochs': 289, 'loss': 'mae', 'optimizer': 'adam', 'graph_mode': 'knn', 'source': 'grm', 'knn_k': 7, 'weighted_edges': True, 'symmetrize_mode': 'mutual'}. Best is trial 14 with value: 0.2233340907230464.
[I 2025-10-20 18:05:07,934] Trial 18 finished with value: 0.16095633249741276 and parameters: {'model_type': 'gat', 'hidden_dims': '[512, 128]', 'dropout': 0.39804117750610357, 'batch_norm': False, 'gat_heads': 4, 'gat_attn_dropout': 0.2029035226822049, 'gat_concat_hidden': True, 'lr': 4.3848208686942805e-06, 'weight_decay': 1.7468916696041842e-05, 'epochs': 258, 'loss': 'mae', 'optimizer': 'adam', 'graph_mode': 'knn', 'source': 'grm', 'knn_k': 4, 'weighted_edges': False, 'symmetrize_mode': 'mutual'}. Best is trial 14 with value: 0.2233340907230464.
[I 2025-10-20 18:13:11,564] Trial 19 finished with value: 0.20741421603120083 and parameters: {'model_type': 'gat', 'hidden_dims': '[512, 128]', 'dropout': 0.5030116912710171, 'batch_norm': False, 'gat_heads': 8, 'gat_attn_dropout': 0.33686234580987906, 'gat_concat_hidden': True, 'lr': 2.0223960972023577e-05, 'weight_decay': 0.0001011302242612643, 'epochs': 187, 'loss': 'mae', 'optimizer': 'adam', 'graph_mode': 'knn', 'source': 'grm', 'knn_k': 3, 'weighted_edges': False, 'symmetrize_mode': 'mutual'}. Best is trial 14 with value: 0.2233340907230464.
[I 2025-10-20 18:22:37,740] Trial 20 finished with value: 0.20981919563440274 and parameters: {'model_type': 'gat', 'hidden_dims': '[512, 128]', 'dropout': 0.33156848208096434, 'batch_norm': False, 'gat_heads': 6, 'gat_attn_dropout': 0.06920440148127271, 'gat_concat_hidden': True, 'lr': 4.638780386230511e-06, 'weight_decay': 0.00036075611445864504, 'epochs': 304, 'loss': 'mae', 'optimizer': 'adam', 'graph_mode': 'knn', 'source': 'grm', 'knn_k': 8, 'weighted_edges': False, 'symmetrize_mode': 'mutual'}. Best is trial 14 with value: 0.2233340907230464.
[I 2025-10-20 18:25:25,321] Trial 21 finished with value: 0.21598043391284288 and parameters: {'model_type': 'gat', 'hidden_dims': '[512, 256]', 'dropout': 0.3098974207435964, 'batch_norm': False, 'gat_heads': 4, 'gat_attn_dropout': 0.10905158131453699, 'gat_concat_hidden': True, 'lr': 9.579677664585605e-05, 'weight_decay': 0.0001803621045839619, 'epochs': 122, 'loss': 'mae', 'optimizer': 'adam', 'graph_mode': 'knn', 'source': 'grm', 'knn_k': 8, 'weighted_edges': False, 'symmetrize_mode': 'mutual'}. Best is trial 14 with value: 0.2233340907230464.
[I 2025-10-20 18:31:00,009] Trial 22 finished with value: 0.20770887385382827 and parameters: {'model_type': 'gat', 'hidden_dims': '[512, 256]', 'dropout': 0.4008450399760575, 'batch_norm': False, 'gat_heads': 4, 'gat_attn_dropout': 0.0943081693561979, 'gat_concat_hidden': True, 'lr': 8.328162191616955e-05, 'weight_decay': 0.00021730043330577852, 'epochs': 258, 'loss': 'mae', 'optimizer': 'adam', 'graph_mode': 'knn', 'source': 'grm', 'knn_k': 8, 'weighted_edges': False, 'symmetrize_mode': 'mutual'}. Best is trial 14 with value: 0.2233340907230464.
[I 2025-10-20 18:33:51,001] Trial 23 finished with value: 0.2158972453937711 and parameters: {'model_type': 'gat', 'hidden_dims': '[512, 256]', 'dropout': 0.3091369447194629, 'batch_norm': False, 'gat_heads': 5, 'gat_attn_dropout': 0.17979261787550246, 'gat_concat_hidden': True, 'lr': 0.0002923705786737544, 'weight_decay': 4.7837151955481594e-05, 'epochs': 97, 'loss': 'mae', 'optimizer': 'adam', 'graph_mode': 'knn', 'source': 'grm', 'knn_k': 7, 'weighted_edges': False, 'symmetrize_mode': 'mutual'}. Best is trial 14 with value: 0.2233340907230464.
[I 2025-10-20 18:37:06,750] Trial 24 finished with value: 0.1961262187631647 and parameters: {'model_type': 'gat', 'hidden_dims': '[512, 256]', 'dropout': 0.3097842417811177, 'batch_norm': False, 'gat_heads': 5, 'gat_attn_dropout': 0.1898253359303497, 'gat_concat_hidden': True, 'lr': 0.0002841861648364189, 'weight_decay': 4.456449506976319e-05, 'epochs': 113, 'loss': 'mae', 'optimizer': 'adam', 'graph_mode': 'knn', 'source': 'grm', 'knn_k': 7, 'weighted_edges': True, 'symmetrize_mode': 'mutual'}. Best is trial 14 with value: 0.2233340907230464.
[I 2025-10-20 18:39:48,431] Trial 25 finished with value: 0.18273135858282435 and parameters: {'model_type': 'gat', 'hidden_dims': '[512, 256]', 'dropout': 0.29859843908287853, 'batch_norm': False, 'gat_heads': 4, 'gat_attn_dropout': 0.16687128606619506, 'gat_concat_hidden': True, 'lr': 0.0005538440532672187, 'weight_decay': 1.5907908647468945e-05, 'epochs': 117, 'loss': 'mae', 'optimizer': 'adam', 'graph_mode': 'knn', 'source': 'grm', 'knn_k': 9, 'weighted_edges': False, 'symmetrize_mode': 'mutual'}. Best is trial 14 with value: 0.2233340907230464.
[I 2025-10-20 18:41:55,350] Trial 26 finished with value: 0.20902805736585198 and parameters: {'model_type': 'gat', 'hidden_dims': '[512, 256]', 'dropout': 0.35556928558536305, 'batch_norm': False, 'gat_heads': 7, 'gat_attn_dropout': 0.27156019873475645, 'gat_concat_hidden': False, 'lr': 0.00010938495768048699, 'weight_decay': 0.0003579461677921104, 'epochs': 48, 'loss': 'mae', 'optimizer': 'adam', 'graph_mode': 'knn', 'source': 'grm', 'knn_k': 5, 'weighted_edges': False, 'symmetrize_mode': 'mutual'}. Best is trial 14 with value: 0.2233340907230464.
[I 2025-10-20 18:43:52,897] Trial 27 finished with value: 0.015513669007826265 and parameters: {'model_type': 'gat', 'hidden_dims': '[512, 256]', 'dropout': 0.2011994455620954, 'batch_norm': False, 'gat_heads': 3, 'gat_attn_dropout': 0.3145523703064721, 'gat_concat_hidden': True, 'lr': 0.0002948349797464521, 'weight_decay': 6.277289535351427e-05, 'epochs': 116, 'loss': 'mse', 'optimizer': 'adam', 'graph_mode': 'knn', 'source': 'grm', 'knn_k': 9, 'weighted_edges': False, 'symmetrize_mode': 'mutual'}. Best is trial 14 with value: 0.2233340907230464.
[I 2025-10-20 18:48:53,527] Trial 28 finished with value: 0.1810371859932919 and parameters: {'model_type': 'gat', 'hidden_dims': '[512, 256]', 'dropout': 0.4907687769594799, 'batch_norm': False, 'gat_heads': 5, 'gat_attn_dropout': 0.2187249940413829, 'gat_concat_hidden': True, 'lr': 5.2840437376888846e-05, 'weight_decay': 1.4027013764509016e-05, 'epochs': 177, 'loss': 'mae', 'optimizer': 'adam', 'graph_mode': 'knn', 'source': 'grm', 'knn_k': 7, 'weighted_edges': True, 'symmetrize_mode': 'union'}. Best is trial 14 with value: 0.2233340907230464.
[I 2025-10-20 18:49:28,154] Trial 29 finished with value: 0.1950571293933295 and parameters: {'model_type': 'gat', 'hidden_dims': '[128, 64]', 'dropout': 0.5429583310256896, 'batch_norm': True, 'gat_heads': 4, 'gat_attn_dropout': 0.06531079246902594, 'gat_concat_hidden': True, 'lr': 0.0009046646360870221, 'weight_decay': 0.00010389675718199341, 'epochs': 91, 'loss': 'mse', 'optimizer': 'adam', 'graph_mode': 'knn', 'source': 'grm', 'knn_k': 8, 'weighted_edges': False, 'symmetrize_mode': 'mutual'}. Best is trial 14 with value: 0.2233340907230464.
[I 2025-10-20 18:55:25,978] Trial 30 finished with value: 0.1879492513786413 and parameters: {'model_type': 'gat', 'hidden_dims': '[512, 256]', 'dropout': 0.38121962028177764, 'batch_norm': False, 'gat_heads': 5, 'gat_attn_dropout': 0.3992963993623377, 'gat_concat_hidden': True, 'lr': 0.00011429098236936566, 'weight_decay': 0.00021721740408475778, 'epochs': 219, 'loss': 'mae', 'optimizer': 'adam', 'graph_mode': 'knn', 'source': 'grm', 'knn_k': 6, 'weighted_edges': False, 'symmetrize_mode': 'mutual'}. Best is trial 14 with value: 0.2233340907230464.
[I 2025-10-20 19:03:05,814] Trial 31 finished with value: 0.20371559828107802 and parameters: {'model_type': 'gat', 'hidden_dims': '[512, 128]', 'dropout': 0.42460595689583636, 'batch_norm': False, 'gat_heads': 6, 'gat_attn_dropout': 0.13978774740652408, 'gat_concat_hidden': True, 'lr': 3.4078975940477346e-05, 'weight_decay': 0.00013593850553167335, 'epochs': 245, 'loss': 'mae', 'optimizer': 'adam', 'graph_mode': 'knn', 'source': 'grm', 'knn_k': 7, 'weighted_edges': False, 'symmetrize_mode': 'mutual'}. Best is trial 14 with value: 0.2233340907230464.
[I 2025-10-20 19:12:44,043] Trial 32 finished with value: 0.20986484495464305 and parameters: {'model_type': 'gat', 'hidden_dims': '[512, 128]', 'dropout': 0.272634404287049, 'batch_norm': False, 'gat_heads': 6, 'gat_attn_dropout': 0.15303243398116376, 'gat_concat_hidden': True, 'lr': 1.8912625442360976e-05, 'weight_decay': 3.3797274331938386e-05, 'epochs': 312, 'loss': 'mae', 'optimizer': 'adam', 'graph_mode': 'knn', 'source': 'grm', 'knn_k': 7, 'weighted_edges': False, 'symmetrize_mode': 'mutual'}. Best is trial 14 with value: 0.2233340907230464.
[I 2025-10-20 19:19:57,905] Trial 33 finished with value: 0.21030599314366452 and parameters: {'model_type': 'gat', 'hidden_dims': '[512, 128]', 'dropout': 0.331238881055794, 'batch_norm': False, 'gat_heads': 7, 'gat_attn_dropout': 0.21307869303175964, 'gat_concat_hidden': True, 'lr': 4.0620514445371747e-05, 'weight_decay': 0.0005139900344655687, 'epochs': 195, 'loss': 'mae', 'optimizer': 'adam', 'graph_mode': 'knn', 'source': 'grm', 'knn_k': 8, 'weighted_edges': False, 'symmetrize_mode': 'mutual'}. Best is trial 14 with value: 0.2233340907230464.
[I 2025-10-20 19:21:48,999] Trial 34 finished with value: 0.19194684172625218 and parameters: {'model_type': 'gat', 'hidden_dims': '[128, 64]', 'dropout': 0.3194493080804421, 'batch_norm': True, 'gat_heads': 7, 'gat_attn_dropout': 0.21472026168440014, 'gat_concat_hidden': False, 'lr': 4.296899475087803e-05, 'weight_decay': 0.0005971976288252504, 'epochs': 172, 'loss': 'mse', 'optimizer': 'adam', 'graph_mode': 'knn', 'source': 'grm', 'knn_k': 9, 'weighted_edges': False, 'symmetrize_mode': 'mutual'}. Best is trial 14 with value: 0.2233340907230464.
[I 2025-10-20 19:30:22,624] Trial 35 finished with value: 0.2606798803794081 and parameters: {'model_type': 'gat', 'hidden_dims': '[512, 64]', 'dropout': 0.3342196201750227, 'batch_norm': False, 'gat_heads': 8, 'gat_attn_dropout': 0.2950563870467431, 'gat_concat_hidden': True, 'lr': 7.830146612570934e-05, 'weight_decay': 0.000294038869487581, 'epochs': 208, 'loss': 'mae', 'optimizer': 'adam', 'graph_mode': 'cutoff', 'cutoff': 0.8726976526690509, 'grm_norm': 'gcn', 'self_loops': True}. Best is trial 35 with value: 0.2606798803794081.
[I 2025-10-20 19:33:28,871] Trial 36 finished with value: 0.18140770822079566 and parameters: {'model_type': 'gat', 'hidden_dims': '[512, 64]', 'dropout': 0.22544026199664197, 'batch_norm': False, 'gat_heads': 8, 'gat_attn_dropout': 0.2821256665361141, 'gat_concat_hidden': True, 'lr': 7.458731355294553e-05, 'weight_decay': 1.0780314763292428e-07, 'epochs': 66, 'loss': 'mae', 'optimizer': 'adam', 'graph_mode': 'cutoff', 'cutoff': 0.846228498862172, 'grm_norm': 'gcn', 'self_loops': True}. Best is trial 35 with value: 0.2606798803794081.
[I 2025-10-20 19:35:31,670] Trial 37 finished with value: 0.25697583283820824 and parameters: {'model_type': 'gat', 'hidden_dims': '[512, 64]', 'dropout': 0.3729183416656281, 'batch_norm': False, 'gat_heads': 3, 'gat_attn_dropout': 0.4005439313141335, 'gat_concat_hidden': False, 'lr': 0.0001999449749978367, 'weight_decay': 0.0009960743967456728, 'epochs': 130, 'loss': 'mae', 'optimizer': 'adam', 'graph_mode': 'cutoff', 'cutoff': 0.8051268951636038, 'grm_norm': 'gcn', 'self_loops': True}. Best is trial 35 with value: 0.2606798803794081.
[I 2025-10-20 19:37:42,102] Trial 38 finished with value: 0.19329418326541628 and parameters: {'model_type': 'gat', 'hidden_dims': '[512, 64]', 'dropout': 0.3788869471296572, 'batch_norm': True, 'gat_heads': 3, 'gat_attn_dropout': 0.39120336795479066, 'gat_concat_hidden': False, 'lr': 0.00013499085955857762, 'weight_decay': 0.00026242461591537055, 'epochs': 137, 'loss': 'mse', 'optimizer': 'adam', 'graph_mode': 'cutoff', 'cutoff': 0.88414841262485, 'grm_norm': 'gcn', 'self_loops': True}. Best is trial 35 with value: 0.2606798803794081.
