[I 2025-11-03 13:04:36,893] Trial 123 finished with value: 0.01319703300973438 and parameters: {'model_type': 'graphsage', 'hidden_dims': '[512, 128]', 'dropout': 0.48422502867257233, 'batch_norm': True, 'lr': 1.994335181425323e-06, 'weight_decay': 4.812755705023488e-07, 'epochs': 64, 'loss': 'mse', 'optimizer': 'adam', 'graph_mode': 'cutoff', 'cutoff': 0.8662549896419551, 'grm_norm': 'cosine', 'self_loops': True, 'use_snp_selection': False}. Best is trial 108 with value: 0.05044592186643208.
[I 2025-11-03 13:04:41,500] Trial 124 finished with value: 0.037359028105477345 and parameters: {'model_type': 'graphsage', 'hidden_dims': '[512, 128]', 'dropout': 0.5693177795611524, 'batch_norm': True, 'lr': 0.0005012292481574113, 'weight_decay': 2.0340212155990913e-07, 'epochs': 249, 'loss': 'mse', 'optimizer': 'adam', 'graph_mode': 'cutoff', 'cutoff': 0.7812217457435394, 'grm_norm': 'cosine', 'self_loops': True, 'use_snp_selection': False}. Best is trial 108 with value: 0.05044592186643208.
[I 2025-11-03 13:04:46,157] Trial 125 finished with value: 0.047463192202230546 and parameters: {'model_type': 'graphsage', 'hidden_dims': '[512, 64]', 'dropout': 0.4967192877665486, 'batch_norm': True, 'lr': 6.74959896393059e-05, 'weight_decay': 1.51359471756742e-07, 'epochs': 191, 'loss': 'mse', 'optimizer': 'adam', 'graph_mode': 'cutoff', 'cutoff': 0.20162020219418716, 'grm_norm': 'cosine', 'self_loops': True, 'use_snp_selection': False}. Best is trial 108 with value: 0.05044592186643208.
[I 2025-11-03 13:04:50,692] Trial 126 finished with value: 0.013336497383324587 and parameters: {'model_type': 'graphsage', 'hidden_dims': '[512, 64]', 'dropout': 0.46944118143695773, 'batch_norm': True, 'lr': 7.703559385353389e-05, 'weight_decay': 1.4769880141214752e-07, 'epochs': 188, 'loss': 'mse', 'optimizer': 'adam', 'graph_mode': 'knn', 'source': 'grm', 'knn_k': 7, 'weighted_edges': False, 'symmetrize_mode': 'union', 'use_snp_selection': False}. Best is trial 108 with value: 0.05044592186643208.
[I 2025-11-03 13:04:54,514] Trial 127 finished with value: 0.01580812840038813 and parameters: {'model_type': 'graphsage', 'hidden_dims': '[512, 64]', 'dropout': 0.4941358979982891, 'batch_norm': True, 'lr': 6.788630995948098e-05, 'weight_decay': 2.1018188714292343e-07, 'epochs': 144, 'loss': 'mae', 'optimizer': 'adam', 'graph_mode': 'cutoff', 'cutoff': 0.2481465460039624, 'grm_norm': 'cosine', 'self_loops': True, 'use_snp_selection': False}. Best is trial 108 with value: 0.05044592186643208.
[I 2025-11-03 13:04:58,524] Trial 128 finished with value: 0.04672237877034883 and parameters: {'model_type': 'graphsage', 'hidden_dims': '[512, 64]', 'dropout': 0.296810543105122, 'batch_norm': True, 'lr': 0.00014092482294465682, 'weight_decay': 1.2603179813879607e-07, 'epochs': 154, 'loss': 'mse', 'optimizer': 'adam', 'graph_mode': 'cutoff', 'cutoff': 0.22918990588648055, 'grm_norm': 'none', 'self_loops': True, 'use_snp_selection': False}. Best is trial 108 with value: 0.05044592186643208.
[I 2025-11-03 13:05:02,919] Trial 129 finished with value: 0.044034875978777435 and parameters: {'model_type': 'graphsage', 'hidden_dims': '[512, 64]', 'dropout': 0.28826765473851856, 'batch_norm': True, 'lr': 0.00011366904560742924, 'weight_decay': 1.221975008158703e-07, 'epochs': 174, 'loss': 'mse', 'optimizer': 'adam', 'graph_mode': 'cutoff', 'cutoff': 0.20261366095615918, 'grm_norm': 'gcn', 'self_loops': True, 'use_snp_selection': False}. Best is trial 108 with value: 0.05044592186643208.
[I 2025-11-03 13:05:07,028] Trial 130 finished with value: 0.027516253934357627 and parameters: {'model_type': 'graphsage', 'hidden_dims': '[512, 64]', 'dropout': 0.2519347301133693, 'batch_norm': True, 'lr': 0.00011173731780298856, 'weight_decay': 1.2638066307451735e-07, 'epochs': 152, 'loss': 'mse', 'optimizer': 'adam', 'graph_mode': 'cutoff', 'cutoff': 0.20200138058741993, 'grm_norm': 'gcn', 'self_loops': True, 'use_snp_selection': False}. Best is trial 108 with value: 0.05044592186643208.
[I 2025-11-03 13:05:11,226] Trial 131 finished with value: 0.0410877915797716 and parameters: {'model_type': 'graphsage', 'hidden_dims': '[512, 64]', 'dropout': 0.28420111240427454, 'batch_norm': True, 'lr': 8.702098990228019e-05, 'weight_decay': 1.1348522893999171e-07, 'epochs': 165, 'loss': 'mse', 'optimizer': 'adam', 'graph_mode': 'cutoff', 'cutoff': 0.220156918501065, 'grm_norm': 'gcn', 'self_loops': True, 'use_snp_selection': False}. Best is trial 108 with value: 0.05044592186643208.
[I 2025-11-03 13:05:15,358] Trial 132 finished with value: 0.03126310989182492 and parameters: {'model_type': 'graphsage', 'hidden_dims': '[512, 64]', 'dropout': 0.28893948537094843, 'batch_norm': True, 'lr': 9.15223126710319e-05, 'weight_decay': 1.7064526462147764e-07, 'epochs': 163, 'loss': 'mse', 'optimizer': 'adam', 'graph_mode': 'cutoff', 'cutoff': 0.23067123863686564, 'grm_norm': 'gcn', 'self_loops': True, 'use_snp_selection': False}. Best is trial 108 with value: 0.05044592186643208.
[I 2025-11-03 13:05:19,832] Trial 133 finished with value: 0.03226585901261171 and parameters: {'model_type': 'graphsage', 'hidden_dims': '[512, 64]', 'dropout': 0.29446618298583516, 'batch_norm': True, 'lr': 0.00014752926915487873, 'weight_decay': 1.145383262221112e-07, 'epochs': 178, 'loss': 'mse', 'optimizer': 'adam', 'graph_mode': 'cutoff', 'cutoff': 0.2017170326505221, 'grm_norm': 'gcn', 'self_loops': True, 'use_snp_selection': False}. Best is trial 108 with value: 0.05044592186643208.
[I 2025-11-03 13:05:24,164] Trial 134 finished with value: 0.03808769470085231 and parameters: {'model_type': 'graphsage', 'hidden_dims': '[512, 64]', 'dropout': 0.26910573136968735, 'batch_norm': True, 'lr': 0.00012648260456539398, 'weight_decay': 2.430328745317658e-07, 'epochs': 174, 'loss': 'mse', 'optimizer': 'adam', 'graph_mode': 'cutoff', 'cutoff': 0.21587519862243182, 'grm_norm': 'gcn', 'self_loops': True, 'use_snp_selection': False}. Best is trial 108 with value: 0.05044592186643208.
[I 2025-11-03 13:05:28,307] Trial 135 finished with value: 0.05386629749244956 and parameters: {'model_type': 'graphsage', 'hidden_dims': '[512, 64]', 'dropout': 0.24540592118351073, 'batch_norm': True, 'lr': 0.00010086998154828171, 'weight_decay': 1.4819554862152095e-07, 'epochs': 164, 'loss': 'mse', 'optimizer': 'adam', 'graph_mode': 'cutoff', 'cutoff': 0.2359619731292844, 'grm_norm': 'gcn', 'self_loops': True, 'use_snp_selection': False}. Best is trial 135 with value: 0.05386629749244956.
[I 2025-11-03 13:05:32,419] Trial 136 finished with value: 0.03244777982866396 and parameters: {'model_type': 'graphsage', 'hidden_dims': '[512, 64]', 'dropout': 0.23647250170343462, 'batch_norm': True, 'lr': 8.702076842887376e-05, 'weight_decay': 1.50590450961081e-07, 'epochs': 170, 'loss': 'mse', 'optimizer': 'adam', 'graph_mode': 'cutoff', 'cutoff': 0.2614793747374028, 'grm_norm': 'gcn', 'self_loops': True, 'use_snp_selection': False}. Best is trial 135 with value: 0.05386629749244956.
[I 2025-11-03 13:05:36,833] Trial 137 finished with value: 0.02832033438424704 and parameters: {'model_type': 'graphsage', 'hidden_dims': '[512, 64]', 'dropout': 0.2694676903735405, 'batch_norm': True, 'lr': 0.00010154584008198953, 'weight_decay': 1.8076727022253233e-07, 'epochs': 186, 'loss': 'mse', 'optimizer': 'adam', 'graph_mode': 'cutoff', 'cutoff': 0.23370113388435426, 'grm_norm': 'gcn', 'self_loops': True, 'use_snp_selection': False}. Best is trial 135 with value: 0.05386629749244956.
[I 2025-11-03 13:05:41,048] Trial 138 finished with value: 0.054727051803681766 and parameters: {'model_type': 'graphsage', 'hidden_dims': '[512, 64]', 'dropout': 0.20744099944592612, 'batch_norm': True, 'lr': 0.00011827911516788931, 'weight_decay': 1.2186364728716675e-07, 'epochs': 164, 'loss': 'mse', 'optimizer': 'adam', 'graph_mode': 'cutoff', 'cutoff': 0.21284100649642382, 'grm_norm': 'gcn', 'self_loops': True, 'use_snp_selection': False}. Best is trial 138 with value: 0.054727051803681766.
[I 2025-11-03 13:05:45,264] Trial 139 finished with value: 0.03457638673890172 and parameters: {'model_type': 'graphsage', 'hidden_dims': '[512, 64]', 'dropout': 0.211291048020316, 'batch_norm': True, 'lr': 0.00012861225674526625, 'weight_decay': 1.0546511682093074e-07, 'epochs': 166, 'loss': 'mse', 'optimizer': 'adam', 'graph_mode': 'cutoff', 'cutoff': 0.2191383566137628, 'grm_norm': 'gcn', 'self_loops': True, 'use_snp_selection': False}. Best is trial 138 with value: 0.054727051803681766.
[I 2025-11-03 13:05:49,267] Trial 140 finished with value: 0.03871008556114126 and parameters: {'model_type': 'graphsage', 'hidden_dims': '[512, 64]', 'dropout': 0.190172276298301, 'batch_norm': True, 'lr': 0.00015897635881617517, 'weight_decay': 1.3261234229245146e-07, 'epochs': 156, 'loss': 'mse', 'optimizer': 'adam', 'graph_mode': 'cutoff', 'cutoff': 0.24362248010174775, 'grm_norm': 'gcn', 'self_loops': True, 'use_snp_selection': False}. Best is trial 138 with value: 0.054727051803681766.
[I 2025-11-03 13:05:53,022] Trial 141 finished with value: 0.04552934597521652 and parameters: {'model_type': 'graphsage', 'hidden_dims': '[512, 64]', 'dropout': 0.24085018853565454, 'batch_norm': True, 'lr': 7.088941415979941e-05, 'weight_decay': 2.3725250993848107e-07, 'epochs': 144, 'loss': 'mse', 'optimizer': 'adam', 'graph_mode': 'cutoff', 'cutoff': 0.2757714864311468, 'grm_norm': 'gcn', 'self_loops': True, 'use_snp_selection': False}. Best is trial 138 with value: 0.054727051803681766.
[I 2025-11-03 13:05:56,738] Trial 142 finished with value: 0.04069019408955999 and parameters: {'model_type': 'graphsage', 'hidden_dims': '[512, 64]', 'dropout': 0.20688186712416004, 'batch_norm': True, 'lr': 4.982920341789253e-05, 'weight_decay': 1.529391716075457e-07, 'epochs': 138, 'loss': 'mse', 'optimizer': 'adam', 'graph_mode': 'cutoff', 'cutoff': 0.2649452135784556, 'grm_norm': 'gcn', 'self_loops': True, 'use_snp_selection': False}. Best is trial 138 with value: 0.054727051803681766.
[I 2025-11-03 13:06:00,474] Trial 143 finished with value: 0.029567124935627187 and parameters: {'model_type': 'graphsage', 'hidden_dims': '[512, 64]', 'dropout': 0.22600803455722868, 'batch_norm': True, 'lr': 6.860042803373594e-05, 'weight_decay': 2.0275879001996896e-07, 'epochs': 140, 'loss': 'mse', 'optimizer': 'adam', 'graph_mode': 'cutoff', 'cutoff': 0.26642263445819236, 'grm_norm': 'gcn', 'self_loops': True, 'use_snp_selection': False}. Best is trial 138 with value: 0.054727051803681766.
[I 2025-11-03 13:06:04,367] Trial 144 finished with value: 0.020287241340500917 and parameters: {'model_type': 'graphsage', 'hidden_dims': '[512, 64]', 'dropout': 0.17388465783682763, 'batch_norm': True, 'lr': 4.964478063021477e-05, 'weight_decay': 1.5219643741510726e-07, 'epochs': 156, 'loss': 'mse', 'optimizer': 'adam', 'graph_mode': 'cutoff', 'cutoff': 0.27704423026933866, 'grm_norm': 'gcn', 'self_loops': True, 'use_snp_selection': False}. Best is trial 138 with value: 0.054727051803681766.
[I 2025-11-03 13:06:08,797] Trial 145 finished with value: 0.03737907247473591 and parameters: {'model_type': 'graphsage', 'hidden_dims': '[512, 64]', 'dropout': 0.24591874933989233, 'batch_norm': True, 'lr': 6.0118878307744726e-05, 'weight_decay': 2.432112280437031e-07, 'epochs': 193, 'loss': 'mse', 'optimizer': 'adam', 'graph_mode': 'cutoff', 'cutoff': 0.25153536390694553, 'grm_norm': 'gcn', 'self_loops': True, 'use_snp_selection': False}. Best is trial 138 with value: 0.054727051803681766.
[I 2025-11-03 13:06:13,063] Trial 146 finished with value: 0.05684680526683192 and parameters: {'model_type': 'graphsage', 'hidden_dims': '[512, 64]', 'dropout': 0.21072325688656587, 'batch_norm': True, 'lr': 0.00010256149515142252, 'weight_decay': 1.245748815515224e-07, 'epochs': 173, 'loss': 'mse', 'optimizer': 'adam', 'graph_mode': 'cutoff', 'cutoff': 0.22984201934838613, 'grm_norm': 'gcn', 'self_loops': True, 'use_snp_selection': False}. Best is trial 146 with value: 0.05684680526683192.
[I 2025-11-03 13:06:17,061] Trial 147 finished with value: 0.027835402590309404 and parameters: {'model_type': 'graphsage', 'hidden_dims': '[512, 64]', 'dropout': 0.1864444226131838, 'batch_norm': True, 'lr': 0.00010820790977779177, 'weight_decay': 1.0003972060814312e-07, 'epochs': 178, 'loss': 'mae', 'optimizer': 'adam', 'graph_mode': 'knn', 'source': 'grm', 'knn_k': 4, 'weighted_edges': True, 'symmetrize_mode': 'mutual', 'use_snp_selection': False}. Best is trial 146 with value: 0.05684680526683192.
[I 2025-11-03 13:06:21,395] Trial 148 finished with value: 0.034907128802187 and parameters: {'model_type': 'graphsage', 'hidden_dims': '[512, 64]', 'dropout': 0.239120310144953, 'batch_norm': True, 'lr': 8.1145342520019e-05, 'weight_decay': 1.2863315353727176e-07, 'epochs': 173, 'loss': 'mse', 'optimizer': 'adam', 'graph_mode': 'cutoff', 'cutoff': 0.21238972274095516, 'grm_norm': 'gcn', 'self_loops': True, 'use_snp_selection': False}. Best is trial 146 with value: 0.05684680526683192.
[I 2025-11-03 13:06:25,535] Trial 149 finished with value: 0.02754739960292597 and parameters: {'model_type': 'graphsage', 'hidden_dims': '[512, 64]', 'dropout': 0.21543188817183917, 'batch_norm': True, 'lr': 0.0001329279541390747, 'weight_decay': 3.080357302116733e-07, 'epochs': 163, 'loss': 'mse', 'optimizer': 'adam', 'graph_mode': 'cutoff', 'cutoff': 0.22900633249621308, 'grm_norm': 'gcn', 'self_loops': True, 'use_snp_selection': False}. Best is trial 146 with value: 0.05684680526683192.
[I 2025-11-03 13:06:28,024] Trial 0 finished with value: 0.012222568681827709 and parameters: {'model_type': 'graphsage', 'hidden_dims': '[128, 64]', 'dropout': 0.199031432379812, 'batch_norm': True, 'lr': 1.8408544111075837e-06, 'weight_decay': 5.5136510071208614e-05, 'epochs': 336, 'loss': 'mae', 'optimizer': 'adam', 'graph_mode': 'knn', 'source': 'grm', 'knn_k': 8, 'weighted_edges': True, 'symmetrize_mode': 'mutual', 'use_snp_selection': False}. Best is trial 0 with value: 0.012222568681827709.
[I 2025-11-03 13:06:29,544] Trial 1 finished with value: 0.09817210808446103 and parameters: {'model_type': 'graphsage', 'hidden_dims': '[128, 64]', 'dropout': 0.40051947670227217, 'batch_norm': True, 'lr': 0.0005320428882732732, 'weight_decay': 1.89210117736594e-06, 'epochs': 68, 'loss': 'mse', 'optimizer': 'adam', 'graph_mode': 'knn', 'source': 'grm', 'knn_k': 7, 'weighted_edges': True, 'symmetrize_mode': 'union', 'use_snp_selection': False}. Best is trial 1 with value: 0.09817210808446103.
[I 2025-11-03 13:06:32,068] Trial 2 finished with value: 0.11829066763861945 and parameters: {'model_type': 'graphsage', 'hidden_dims': '[256, 128]', 'dropout': 0.5105528289184642, 'batch_norm': False, 'lr': 0.0006804279372404962, 'weight_decay': 0.0008922815224257085, 'epochs': 181, 'loss': 'mse', 'optimizer': 'adam', 'graph_mode': 'cutoff', 'cutoff': 0.5741905641612706, 'grm_norm': 'gcn', 'self_loops': False, 'use_snp_selection': True, 'num_snps': 26910}. Best is trial 2 with value: 0.11829066763861945.
[I 2025-11-03 13:06:34,781] Trial 3 finished with value: 0.07660857540556622 and parameters: {'model_type': 'graphsage', 'hidden_dims': '[256, 128, 64]', 'dropout': 0.5390483213624292, 'batch_norm': False, 'lr': 3.4705625989073525e-05, 'weight_decay': 2.4623319020131338e-05, 'epochs': 121, 'loss': 'mse', 'optimizer': 'adam', 'graph_mode': 'knn', 'source': 'grm', 'knn_k': 6, 'weighted_edges': False, 'symmetrize_mode': 'mutual', 'use_snp_selection': True, 'num_snps': 30713}. Best is trial 2 with value: 0.11829066763861945.
[I 2025-11-03 13:06:37,442] Trial 4 finished with value: 0.11919440116876125 and parameters: {'model_type': 'graphsage', 'hidden_dims': '[128, 64]', 'dropout': 0.13404863676897502, 'batch_norm': False, 'lr': 0.0001431556295367288, 'weight_decay': 2.2084517750726675e-05, 'epochs': 51, 'loss': 'mae', 'optimizer': 'adam', 'graph_mode': 'cutoff', 'cutoff': 0.6714268476993044, 'grm_norm': 'none', 'self_loops': False, 'use_snp_selection': True, 'num_snps': 45645}. Best is trial 4 with value: 0.11919440116876125.
[I 2025-11-03 13:06:40,653] Trial 5 finished with value: 0.10165066273388508 and parameters: {'model_type': 'graphsage', 'hidden_dims': '[256, 128]', 'dropout': 0.42253606323412096, 'batch_norm': False, 'lr': 4.238630400638805e-05, 'weight_decay': 8.074086040046576e-07, 'epochs': 158, 'loss': 'mae', 'optimizer': 'adam', 'graph_mode': 'knn', 'source': 'grm', 'knn_k': 1, 'weighted_edges': False, 'symmetrize_mode': 'mutual', 'use_snp_selection': True, 'num_snps': 43113}. Best is trial 4 with value: 0.11919440116876125.
[I 2025-11-03 13:06:44,517] Trial 6 finished with value: 0.12446684607769448 and parameters: {'model_type': 'graphsage', 'hidden_dims': '[512, 256]', 'dropout': 0.3534893146320237, 'batch_norm': True, 'lr': 0.000251307964226932, 'weight_decay': 1.821819791794022e-05, 'epochs': 223, 'loss': 'mae', 'optimizer': 'adam', 'graph_mode': 'knn', 'source': 'grm', 'knn_k': 1, 'weighted_edges': True, 'symmetrize_mode': 'mutual', 'use_snp_selection': False}. Best is trial 6 with value: 0.12446684607769448.
[I 2025-11-03 13:06:48,046] Trial 7 finished with value: 0.09129950396964198 and parameters: {'model_type': 'graphsage', 'hidden_dims': '[512, 256]', 'dropout': 0.1105825955860775, 'batch_norm': True, 'lr': 2.374338412754043e-05, 'weight_decay': 1.1284721123340274e-05, 'epochs': 190, 'loss': 'mse', 'optimizer': 'adam', 'graph_mode': 'cutoff', 'cutoff': 0.719872204109604, 'grm_norm': 'gcn', 'self_loops': False, 'use_snp_selection': False}. Best is trial 6 with value: 0.12446684607769448.
[I 2025-11-03 13:06:51,085] Trial 8 finished with value: 0.1320936249611708 and parameters: {'model_type': 'graphsage', 'hidden_dims': '[512, 128]', 'dropout': 0.5066580418354021, 'batch_norm': True, 'lr': 0.00039213678276659976, 'weight_decay': 3.43655320802934e-06, 'epochs': 120, 'loss': 'mse', 'optimizer': 'adam', 'graph_mode': 'cutoff', 'cutoff': 0.34923059576505366, 'grm_norm': 'cosine', 'self_loops': True, 'use_snp_selection': False}. Best is trial 8 with value: 0.1320936249611708.
[I 2025-11-03 13:06:53,114] Trial 9 finished with value: 0.08543377608262691 and parameters: {'model_type': 'graphsage', 'hidden_dims': '[512, 256]', 'dropout': 0.301734920240333, 'batch_norm': False, 'lr': 6.650961854953448e-06, 'weight_decay': 6.861575656590315e-05, 'epochs': 150, 'loss': 'mae', 'optimizer': 'adam', 'graph_mode': 'cutoff', 'cutoff': 0.2857569870061939, 'grm_norm': 'cosine_then_gcn', 'self_loops': False, 'use_snp_selection': True, 'num_snps': 12722}. Best is trial 8 with value: 0.1320936249611708.
[I 2025-11-03 13:06:57,260] Trial 10 finished with value: 0.07502886478279927 and parameters: {'model_type': 'graphsage', 'hidden_dims': '[512, 128]', 'dropout': 0.5885461262002587, 'batch_norm': True, 'lr': 0.0001051230339774825, 'weight_decay': 1.3387352389235743e-07, 'epochs': 258, 'loss': 'mse', 'optimizer': 'adam', 'graph_mode': 'cutoff', 'cutoff': 0.2684196492120865, 'grm_norm': 'cosine', 'self_loops': True, 'use_snp_selection': False}. Best is trial 8 with value: 0.1320936249611708.
[I 2025-11-03 13:07:01,276] Trial 11 finished with value: 0.12000640582517424 and parameters: {'model_type': 'graphsage', 'hidden_dims': '[512, 64]', 'dropout': 0.308263488917678, 'batch_norm': True, 'lr': 0.00022560183586670565, 'weight_decay': 1.8187594072837697e-06, 'epochs': 245, 'loss': 'mae', 'optimizer': 'adam', 'graph_mode': 'knn', 'source': 'grm', 'knn_k': 1, 'weighted_edges': True, 'symmetrize_mode': 'union', 'use_snp_selection': False}. Best is trial 8 with value: 0.1320936249611708.
[I 2025-11-03 13:07:05,223] Trial 12 finished with value: 0.11167154481748895 and parameters: {'model_type': 'graphsage', 'hidden_dims': '[512, 128]', 'dropout': 0.4553257072886185, 'batch_norm': True, 'lr': 0.00026556678939619073, 'weight_decay': 0.00031248060348503496, 'epochs': 244, 'loss': 'mae', 'optimizer': 'adam', 'graph_mode': 'cutoff', 'cutoff': 0.4198107830115015, 'grm_norm': 'cosine', 'self_loops': True, 'use_snp_selection': False}. Best is trial 8 with value: 0.1320936249611708.
[I 2025-11-03 13:07:08,175] Trial 13 finished with value: 0.09316804521679932 and parameters: {'model_type': 'graphsage', 'hidden_dims': '[512, 128]', 'dropout': 0.2587783692407996, 'batch_norm': True, 'lr': 0.0009936168343551261, 'weight_decay': 3.25577732770118e-06, 'epochs': 110, 'loss': 'mse', 'optimizer': 'adam', 'graph_mode': 'knn', 'source': 'grm', 'knn_k': 3, 'weighted_edges': True, 'symmetrize_mode': 'mutual', 'use_snp_selection': False}. Best is trial 8 with value: 0.1320936249611708.
[I 2025-11-03 13:07:12,770] Trial 14 finished with value: 0.11788529337067577 and parameters: {'model_type': 'graphsage', 'hidden_dims': '[512, 256]', 'dropout': 0.37024128557448766, 'batch_norm': True, 'lr': 9.446020779397886e-05, 'weight_decay': 3.315063111115081e-07, 'epochs': 303, 'loss': 'mse', 'optimizer': 'adam', 'graph_mode': 'knn', 'source': 'grm', 'knn_k': 4, 'weighted_edges': True, 'symmetrize_mode': 'mutual', 'use_snp_selection': False}. Best is trial 8 with value: 0.1320936249611708.
[I 2025-11-03 13:07:16,501] Trial 15 finished with value: 0.10282455906575279 and parameters: {'model_type': 'graphsage', 'hidden_dims': '[512, 64]', 'dropout': 0.4797914676505614, 'batch_norm': True, 'lr': 0.00037657921180127074, 'weight_decay': 5.261089059975707e-06, 'epochs': 221, 'loss': 'mae', 'optimizer': 'adam', 'graph_mode': 'cutoff', 'cutoff': 0.8369455107922676, 'grm_norm': 'cosine', 'self_loops': True, 'use_snp_selection': False}. Best is trial 8 with value: 0.1320936249611708.
