[I 2025-11-03 11:48:43,082] Trial 87 finished with value: 0.08995897145832181 and parameters: {'model_type': 'graphsage', 'hidden_dims': '[512, 256]', 'dropout': 0.29901345848638083, 'batch_norm': True, 'lr': 0.00022033612841563944, 'weight_decay': 1.0910488459027404e-05, 'epochs': 142, 'loss': 'mse', 'optimizer': 'adam', 'graph_mode': 'cutoff', 'cutoff': 0.711489947414657, 'grm_norm': 'none', 'self_loops': True, 'use_snp_selection': False}. Best is trial 81 with value: 0.12757915674933779.
[I 2025-11-03 11:48:44,947] Trial 88 finished with value: 0.11833109505101391 and parameters: {'model_type': 'graphsage', 'hidden_dims': '[128, 64]', 'dropout': 0.16880967539257663, 'batch_norm': True, 'lr': 0.0009689992950762899, 'weight_decay': 4.763693920365044e-06, 'epochs': 192, 'loss': 'mse', 'optimizer': 'adam', 'graph_mode': 'cutoff', 'cutoff': 0.8484169065606962, 'grm_norm': 'cosine_then_gcn', 'self_loops': False, 'use_snp_selection': False}. Best is trial 81 with value: 0.12757915674933779.
[I 2025-11-03 11:48:48,057] Trial 89 finished with value: 0.12641105389831145 and parameters: {'model_type': 'graphsage', 'hidden_dims': '[512, 256]', 'dropout': 0.32208319942411834, 'batch_norm': True, 'lr': 0.0003417884709293, 'weight_decay': 3.636050854822695e-05, 'epochs': 166, 'loss': 'mse', 'optimizer': 'adam', 'graph_mode': 'cutoff', 'cutoff': 0.6258666616653529, 'grm_norm': 'none', 'self_loops': False, 'use_snp_selection': False}. Best is trial 81 with value: 0.12757915674933779.
[I 2025-11-03 11:48:49,794] Trial 90 finished with value: 0.05296328388353832 and parameters: {'model_type': 'graphsage', 'hidden_dims': '[256, 128, 64]', 'dropout': 0.31263086580241806, 'batch_norm': False, 'lr': 0.00016408845940161886, 'weight_decay': 1.9111644391932006e-05, 'epochs': 168, 'loss': 'mse', 'optimizer': 'adam', 'graph_mode': 'cutoff', 'cutoff': 0.6142789685402296, 'grm_norm': 'cosine', 'self_loops': False, 'use_snp_selection': True, 'num_snps': 3647}. Best is trial 81 with value: 0.12757915674933779.
[I 2025-11-03 11:48:53,027] Trial 91 finished with value: 0.11088482796256871 and parameters: {'model_type': 'graphsage', 'hidden_dims': '[512, 256]', 'dropout': 0.3260197308310143, 'batch_norm': True, 'lr': 0.0003638878110074061, 'weight_decay': 2.6497471257520427e-05, 'epochs': 186, 'loss': 'mse', 'optimizer': 'adam', 'graph_mode': 'cutoff', 'cutoff': 0.6376206915111738, 'grm_norm': 'none', 'self_loops': False, 'use_snp_selection': False}. Best is trial 81 with value: 0.12757915674933779.
[I 2025-11-03 11:48:56,387] Trial 92 finished with value: 0.12041799907789927 and parameters: {'model_type': 'graphsage', 'hidden_dims': '[512, 256]', 'dropout': 0.2766989652464271, 'batch_norm': True, 'lr': 0.000340458843568621, 'weight_decay': 3.546004461775429e-05, 'epochs': 205, 'loss': 'mse', 'optimizer': 'adam', 'graph_mode': 'cutoff', 'cutoff': 0.5590359855225394, 'grm_norm': 'none', 'self_loops': False, 'use_snp_selection': False}. Best is trial 81 with value: 0.12757915674933779.
[I 2025-11-03 11:48:59,815] Trial 93 finished with value: 0.11156744922100478 and parameters: {'model_type': 'graphsage', 'hidden_dims': '[512, 256]', 'dropout': 0.27515164777934076, 'batch_norm': True, 'lr': 0.0002622628298000024, 'weight_decay': 2.760413214545492e-05, 'epochs': 217, 'loss': 'mse', 'optimizer': 'adam', 'graph_mode': 'cutoff', 'cutoff': 0.5715346389677435, 'grm_norm': 'none', 'self_loops': False, 'use_snp_selection': False}. Best is trial 81 with value: 0.12757915674933779.
[I 2025-11-03 11:49:03,176] Trial 94 finished with value: 0.10857401548240128 and parameters: {'model_type': 'graphsage', 'hidden_dims': '[512, 256]', 'dropout': 0.3458780694481969, 'batch_norm': True, 'lr': 0.0003341645975240975, 'weight_decay': 3.720717621718888e-05, 'epochs': 205, 'loss': 'mse', 'optimizer': 'adam', 'graph_mode': 'cutoff', 'cutoff': 0.551691583856909, 'grm_norm': 'none', 'self_loops': False, 'use_snp_selection': False}. Best is trial 81 with value: 0.12757915674933779.
[I 2025-11-03 11:49:06,334] Trial 95 finished with value: 0.12915900749773812 and parameters: {'model_type': 'graphsage', 'hidden_dims': '[512, 256]', 'dropout': 0.216145887336251, 'batch_norm': True, 'lr': 0.00018570937396744275, 'weight_decay': 3.345412161610561e-05, 'epochs': 175, 'loss': 'mse', 'optimizer': 'adam', 'graph_mode': 'cutoff', 'cutoff': 0.5046824704592207, 'grm_norm': 'none', 'self_loops': False, 'use_snp_selection': False}. Best is trial 95 with value: 0.12915900749773812.
[I 2025-11-03 11:49:09,327] Trial 96 finished with value: 0.11029785425812995 and parameters: {'model_type': 'graphsage', 'hidden_dims': '[512, 256]', 'dropout': 0.2125983935443874, 'batch_norm': True, 'lr': 0.00019774818382224156, 'weight_decay': 1.6160603040101566e-05, 'epochs': 146, 'loss': 'mse', 'optimizer': 'adam', 'graph_mode': 'cutoff', 'cutoff': 0.5173573659555769, 'grm_norm': 'none', 'self_loops': True, 'use_snp_selection': False}. Best is trial 95 with value: 0.12915900749773812.
[I 2025-11-03 11:49:11,573] Trial 97 finished with value: 0.11091287899644763 and parameters: {'model_type': 'graphsage', 'hidden_dims': '[256, 128, 64]', 'dropout': 0.1832247248712655, 'batch_norm': True, 'lr': 0.00013529049384560237, 'weight_decay': 2.0279327716389094e-06, 'epochs': 162, 'loss': 'mse', 'optimizer': 'adam', 'graph_mode': 'cutoff', 'cutoff': 0.4469579536184992, 'grm_norm': 'none', 'self_loops': False, 'use_snp_selection': False}. Best is trial 95 with value: 0.12915900749773812.
[I 2025-11-03 11:49:14,707] Trial 98 finished with value: 0.11087139333008254 and parameters: {'model_type': 'graphsage', 'hidden_dims': '[512, 256]', 'dropout': 0.23483362436804917, 'batch_norm': True, 'lr': 0.0004108630677972023, 'weight_decay': 2.3810531461045495e-05, 'epochs': 174, 'loss': 'mse', 'optimizer': 'adam', 'graph_mode': 'cutoff', 'cutoff': 0.7582626371264658, 'grm_norm': 'none', 'self_loops': False, 'use_snp_selection': False}. Best is trial 95 with value: 0.12915900749773812.
[I 2025-11-03 11:49:17,777] Trial 99 finished with value: 0.10954281154029626 and parameters: {'model_type': 'graphsage', 'hidden_dims': '[512, 64]', 'dropout': 0.26296532818543, 'batch_norm': True, 'lr': 0.00023149835396099957, 'weight_decay': 7.970485714426664e-05, 'epochs': 157, 'loss': 'mse', 'optimizer': 'adam', 'graph_mode': 'cutoff', 'cutoff': 0.6096133253752286, 'grm_norm': 'cosine_then_gcn', 'self_loops': False, 'use_snp_selection': False}. Best is trial 95 with value: 0.12915900749773812.
[I 2025-11-03 11:49:21,073] Trial 100 finished with value: 0.11267519313036417 and parameters: {'model_type': 'graphsage', 'hidden_dims': '[512, 256]', 'dropout': 0.21061355147800906, 'batch_norm': True, 'lr': 0.00028606659812298687, 'weight_decay': 1.2940631045485511e-05, 'epochs': 197, 'loss': 'mse', 'optimizer': 'adam', 'graph_mode': 'cutoff', 'cutoff': 0.8914433209776609, 'grm_norm': 'none', 'self_loops': False, 'use_snp_selection': False}. Best is trial 95 with value: 0.12915900749773812.
[I 2025-11-03 11:49:24,497] Trial 101 finished with value: 0.11851602771743767 and parameters: {'model_type': 'graphsage', 'hidden_dims': '[512, 256]', 'dropout': 0.19260207951266337, 'batch_norm': True, 'lr': 0.00033481882437276034, 'weight_decay': 4.4115784535876565e-05, 'epochs': 211, 'loss': 'mse', 'optimizer': 'adam', 'graph_mode': 'cutoff', 'cutoff': 0.4668492105868332, 'grm_norm': 'none', 'self_loops': False, 'use_snp_selection': False}. Best is trial 95 with value: 0.12915900749773812.
[I 2025-11-03 11:49:27,636] Trial 102 finished with value: 0.10715970343445057 and parameters: {'model_type': 'graphsage', 'hidden_dims': '[512, 256]', 'dropout': 0.24712072433193719, 'batch_norm': True, 'lr': 0.00018675327218798703, 'weight_decay': 3.4404379498684625e-05, 'epochs': 177, 'loss': 'mse', 'optimizer': 'adam', 'graph_mode': 'cutoff', 'cutoff': 0.5235135855036663, 'grm_norm': 'none', 'self_loops': False, 'use_snp_selection': False}. Best is trial 95 with value: 0.12915900749773812.
[I 2025-11-03 11:49:30,870] Trial 103 finished with value: 0.11557772027069636 and parameters: {'model_type': 'graphsage', 'hidden_dims': '[512, 256]', 'dropout': 0.2792616254441038, 'batch_norm': True, 'lr': 0.000552416028352532, 'weight_decay': 5.167131026383933e-05, 'epochs': 187, 'loss': 'mse', 'optimizer': 'adam', 'graph_mode': 'cutoff', 'cutoff': 0.5830199751534585, 'grm_norm': 'none', 'self_loops': False, 'use_snp_selection': False}. Best is trial 95 with value: 0.12915900749773812.
[I 2025-11-03 11:49:32,818] Trial 104 finished with value: 0.11774820411306797 and parameters: {'model_type': 'graphsage', 'hidden_dims': '[128, 64]', 'dropout': 0.3077902737441305, 'batch_norm': True, 'lr': 0.00016026627763899082, 'weight_decay': 9.188450128723924e-06, 'epochs': 223, 'loss': 'mse', 'optimizer': 'adam', 'graph_mode': 'cutoff', 'cutoff': 0.4983177779860092, 'grm_norm': 'none', 'self_loops': False, 'use_snp_selection': False}. Best is trial 95 with value: 0.12915900749773812.
[I 2025-11-03 11:49:35,891] Trial 105 finished with value: 0.11020726277845802 and parameters: {'model_type': 'graphsage', 'hidden_dims': '[512, 256]', 'dropout': 0.28989561794316976, 'batch_norm': True, 'lr': 0.00025258157885222287, 'weight_decay': 5.530426105453996e-07, 'epochs': 168, 'loss': 'mse', 'optimizer': 'adam', 'graph_mode': 'cutoff', 'cutoff': 0.635326653733041, 'grm_norm': 'none', 'self_loops': False, 'use_snp_selection': False}. Best is trial 95 with value: 0.12915900749773812.
[I 2025-11-03 11:49:39,198] Trial 106 finished with value: 0.115704841943957 and parameters: {'model_type': 'graphsage', 'hidden_dims': '[512, 256]', 'dropout': 0.324980383380362, 'batch_norm': True, 'lr': 0.0003947729420166557, 'weight_decay': 1.315644958009531e-06, 'epochs': 199, 'loss': 'mse', 'optimizer': 'adam', 'graph_mode': 'cutoff', 'cutoff': 0.6813938543085337, 'grm_norm': 'none', 'self_loops': False, 'use_snp_selection': False}. Best is trial 95 with value: 0.12915900749773812.
[I 2025-11-03 11:49:41,678] Trial 107 finished with value: 0.10898812211562159 and parameters: {'model_type': 'graphsage', 'hidden_dims': '[256, 128, 64]', 'dropout': 0.22178351900843343, 'batch_norm': True, 'lr': 0.000624047005961547, 'weight_decay': 7.193608591119348e-06, 'epochs': 208, 'loss': 'mse', 'optimizer': 'adam', 'graph_mode': 'cutoff', 'cutoff': 0.5468737789914198, 'grm_norm': 'cosine', 'self_loops': False, 'use_snp_selection': False}. Best is trial 95 with value: 0.12915900749773812.
[I 2025-11-03 11:49:44,537] Trial 108 finished with value: 0.1090795629820498 and parameters: {'model_type': 'graphsage', 'hidden_dims': '[512, 256]', 'dropout': 0.36904725622363255, 'batch_norm': True, 'lr': 0.00031399020825556096, 'weight_decay': 3.274833607100269e-05, 'epochs': 136, 'loss': 'mse', 'optimizer': 'adam', 'graph_mode': 'cutoff', 'cutoff': 0.603157035895143, 'grm_norm': 'none', 'self_loops': False, 'use_snp_selection': False}. Best is trial 95 with value: 0.12915900749773812.
[I 2025-11-03 11:49:47,572] Trial 109 finished with value: 0.05697710282582903 and parameters: {'model_type': 'graphsage', 'hidden_dims': '[512, 256]', 'dropout': 0.26497915123896326, 'batch_norm': False, 'lr': 0.0004904359631187216, 'weight_decay': 4.194071741872277e-05, 'epochs': 113, 'loss': 'mse', 'optimizer': 'adam', 'graph_mode': 'cutoff', 'cutoff': 0.4079436171763794, 'grm_norm': 'none', 'self_loops': False, 'use_snp_selection': True, 'num_snps': 37760}. Best is trial 95 with value: 0.12915900749773812.
[I 2025-11-03 11:49:49,826] Trial 110 finished with value: 0.07600722739080669 and parameters: {'model_type': 'graphsage', 'hidden_dims': '[256, 128, 64]', 'dropout': 0.3540777308657367, 'batch_norm': True, 'lr': 3.946777912552912e-05, 'weight_decay': 6.227571163012181e-05, 'epochs': 165, 'loss': 'mse', 'optimizer': 'adam', 'graph_mode': 'cutoff', 'cutoff': 0.8408814651630735, 'grm_norm': 'none', 'self_loops': True, 'use_snp_selection': False}. Best is trial 95 with value: 0.12915900749773812.
[I 2025-11-03 11:49:53,008] Trial 111 finished with value: 0.10522452951621943 and parameters: {'model_type': 'graphsage', 'hidden_dims': '[512, 256]', 'dropout': 0.3389442201678355, 'batch_norm': True, 'lr': 0.00046469254906107303, 'weight_decay': 2.0953195204005393e-05, 'epochs': 182, 'loss': 'mse', 'optimizer': 'adam', 'graph_mode': 'cutoff', 'cutoff': 0.6687709073348714, 'grm_norm': 'none', 'self_loops': False, 'use_snp_selection': False}. Best is trial 95 with value: 0.12915900749773812.
[I 2025-11-03 11:49:56,235] Trial 112 finished with value: 0.11745905951469841 and parameters: {'model_type': 'graphsage', 'hidden_dims': '[512, 256]', 'dropout': 0.298824767281496, 'batch_norm': True, 'lr': 1.9068612972509337e-05, 'weight_decay': 3.130985581099715e-06, 'epochs': 188, 'loss': 'mse', 'optimizer': 'adam', 'graph_mode': 'cutoff', 'cutoff': 0.7174377171507592, 'grm_norm': 'none', 'self_loops': False, 'use_snp_selection': False}. Best is trial 95 with value: 0.12915900749773812.
[I 2025-11-03 11:49:59,370] Trial 113 finished with value: 0.11817269365055573 and parameters: {'model_type': 'graphsage', 'hidden_dims': '[512, 256]', 'dropout': 0.31550004648909075, 'batch_norm': True, 'lr': 0.0003810731949766045, 'weight_decay': 2.4578287619993536e-06, 'epochs': 174, 'loss': 'mse', 'optimizer': 'adam', 'graph_mode': 'cutoff', 'cutoff': 0.653119790918348, 'grm_norm': 'none', 'self_loops': False, 'use_snp_selection': False}. Best is trial 95 with value: 0.12915900749773812.
[I 2025-11-03 11:50:02,782] Trial 114 finished with value: 0.12283608079223478 and parameters: {'model_type': 'graphsage', 'hidden_dims': '[512, 256]', 'dropout': 0.24381657947949317, 'batch_norm': True, 'lr': 0.0002834854991655957, 'weight_decay': 1.049931639317984e-06, 'epochs': 214, 'loss': 'mse', 'optimizer': 'adam', 'graph_mode': 'cutoff', 'cutoff': 0.6989760528041777, 'grm_norm': 'none', 'self_loops': False, 'use_snp_selection': False}. Best is trial 95 with value: 0.12915900749773812.
[I 2025-11-03 11:50:06,120] Trial 115 finished with value: 0.11507026927733145 and parameters: {'model_type': 'graphsage', 'hidden_dims': '[512, 256]', 'dropout': 0.25106581713742493, 'batch_norm': True, 'lr': 0.00021701031420572677, 'weight_decay': 1.3241660533161686e-06, 'epochs': 203, 'loss': 'mse', 'optimizer': 'adam', 'graph_mode': 'cutoff', 'cutoff': 0.791098488866476, 'grm_norm': 'none', 'self_loops': False, 'use_snp_selection': False}. Best is trial 95 with value: 0.12915900749773812.
[I 2025-11-03 11:50:09,534] Trial 116 finished with value: 0.11312925303729782 and parameters: {'model_type': 'graphsage', 'hidden_dims': '[512, 256]', 'dropout': 0.24101446852123568, 'batch_norm': True, 'lr': 0.0002948315277171121, 'weight_decay': 9.296523606174027e-07, 'epochs': 213, 'loss': 'mse', 'optimizer': 'adam', 'graph_mode': 'cutoff', 'cutoff': 0.7365116067634575, 'grm_norm': 'gcn', 'self_loops': False, 'use_snp_selection': False}. Best is trial 95 with value: 0.12915900749773812.
[I 2025-11-03 11:50:12,781] Trial 117 finished with value: 0.1186703261835729 and parameters: {'model_type': 'graphsage', 'hidden_dims': '[512, 64]', 'dropout': 0.17820132979940326, 'batch_norm': True, 'lr': 0.0002522748002912898, 'weight_decay': 7.073311635297055e-07, 'epochs': 193, 'loss': 'mse', 'optimizer': 'adam', 'graph_mode': 'cutoff', 'cutoff': 0.6941582330169737, 'grm_norm': 'none', 'self_loops': False, 'use_snp_selection': False}. Best is trial 95 with value: 0.12915900749773812.
[I 2025-11-03 11:50:14,994] Trial 118 finished with value: 0.09993905481970025 and parameters: {'model_type': 'graphsage', 'hidden_dims': '[256, 128, 64]', 'dropout': 0.2840016959175267, 'batch_norm': True, 'lr': 0.00011740973641147115, 'weight_decay': 5.87821680346487e-07, 'epochs': 157, 'loss': 'mse', 'optimizer': 'adam', 'graph_mode': 'cutoff', 'cutoff': 0.6310452097677987, 'grm_norm': 'none', 'self_loops': False, 'use_snp_selection': False}. Best is trial 95 with value: 0.12915900749773812.
[I 2025-11-03 11:50:18,778] Trial 119 finished with value: 0.11546261201755999 and parameters: {'model_type': 'graphsage', 'hidden_dims': '[512, 256]', 'dropout': 0.2286546190737626, 'batch_norm': True, 'lr': 0.0006911710472405184, 'weight_decay': 3.981679859104849e-07, 'epochs': 241, 'loss': 'mse', 'optimizer': 'adam', 'graph_mode': 'cutoff', 'cutoff': 0.21699635037389503, 'grm_norm': 'none', 'self_loops': False, 'use_snp_selection': False}. Best is trial 95 with value: 0.12915900749773812.
[I 2025-11-03 11:50:22,192] Trial 120 finished with value: 0.11478882683280811 and parameters: {'model_type': 'graphsage', 'hidden_dims': '[512, 256]', 'dropout': 0.2541104776242423, 'batch_norm': True, 'lr': 0.00019312509583429503, 'weight_decay': 1.791798006761358e-05, 'epochs': 219, 'loss': 'mse', 'optimizer': 'adam', 'graph_mode': 'cutoff', 'cutoff': 0.5906663760366007, 'grm_norm': 'none', 'self_loops': False, 'use_snp_selection': False}. Best is trial 95 with value: 0.12915900749773812.
[I 2025-11-03 11:50:25,358] Trial 121 finished with value: 0.125805545830389 and parameters: {'model_type': 'graphsage', 'hidden_dims': '[512, 256]', 'dropout': 0.3033935580119903, 'batch_norm': True, 'lr': 0.00034424565994845555, 'weight_decay': 4.23524079891652e-06, 'epochs': 179, 'loss': 'mse', 'optimizer': 'adam', 'graph_mode': 'cutoff', 'cutoff': 0.658828245399522, 'grm_norm': 'none', 'self_loops': False, 'use_snp_selection': False}. Best is trial 95 with value: 0.12915900749773812.
[I 2025-11-03 11:50:28,528] Trial 122 finished with value: 0.114119265135644 and parameters: {'model_type': 'graphsage', 'hidden_dims': '[512, 256]', 'dropout': 0.26822730001654554, 'batch_norm': True, 'lr': 0.0003475989287580078, 'weight_decay': 1.1386277728666829e-05, 'epochs': 178, 'loss': 'mse', 'optimizer': 'adam', 'graph_mode': 'cutoff', 'cutoff': 0.6783597796351764, 'grm_norm': 'none', 'self_loops': False, 'use_snp_selection': False}. Best is trial 95 with value: 0.12915900749773812.
[I 2025-11-03 11:50:31,472] Trial 123 finished with value: 0.11908617343326393 and parameters: {'model_type': 'graphsage', 'hidden_dims': '[512, 256]', 'dropout': 0.33473483439852847, 'batch_norm': True, 'lr': 0.0002744035026205528, 'weight_decay': 4.068599364536839e-06, 'epochs': 149, 'loss': 'mse', 'optimizer': 'adam', 'graph_mode': 'cutoff', 'cutoff': 0.6991356289429774, 'grm_norm': 'none', 'self_loops': False, 'use_snp_selection': False}. Best is trial 95 with value: 0.12915900749773812.
[I 2025-11-03 11:50:34,588] Trial 124 finished with value: 0.11739690313758001 and parameters: {'model_type': 'graphsage', 'hidden_dims': '[512, 256]', 'dropout': 0.3101274778848196, 'batch_norm': True, 'lr': 0.00031941091124624573, 'weight_decay': 2.4532821329084952e-05, 'epochs': 170, 'loss': 'mse', 'optimizer': 'adam', 'graph_mode': 'cutoff', 'cutoff': 0.5622536654786223, 'grm_norm': 'none', 'self_loops': False, 'use_snp_selection': False}. Best is trial 95 with value: 0.12915900749773812.
[I 2025-11-03 11:50:36,731] Trial 125 finished with value: 0.10451931701710952 and parameters: {'model_type': 'graphsage', 'hidden_dims': '[256, 128]', 'dropout': 0.21418218546411344, 'batch_norm': True, 'lr': 0.0004152806412519707, 'weight_decay': 1.5085434813250008e-05, 'epochs': 199, 'loss': 'mse', 'optimizer': 'adam', 'graph_mode': 'cutoff', 'cutoff': 0.6480668285096817, 'grm_norm': 'none', 'self_loops': False, 'use_snp_selection': False}. Best is trial 95 with value: 0.12915900749773812.
[I 2025-11-03 11:50:39,150] Trial 126 finished with value: -0.009561003860280524 and parameters: {'model_type': 'graphsage', 'hidden_dims': '[256, 128, 64]', 'dropout': 0.2890838215476703, 'batch_norm': True, 'lr': 1.0013725580650348e-06, 'weight_decay': 6.424618164839019e-06, 'epochs': 190, 'loss': 'mae', 'optimizer': 'adam', 'graph_mode': 'cutoff', 'cutoff': 0.6202437632427321, 'grm_norm': 'cosine_then_gcn', 'self_loops': False, 'use_snp_selection': False}. Best is trial 95 with value: 0.12915900749773812.
[I 2025-11-03 11:50:40,846] Trial 127 finished with value: 0.11219918315520541 and parameters: {'model_type': 'graphsage', 'hidden_dims': '[128, 64]', 'dropout': 0.32650978002244657, 'batch_norm': True, 'lr': 0.0002372114985907863, 'weight_decay': 1.0950675755343492e-06, 'epochs': 161, 'loss': 'mse', 'optimizer': 'adam', 'graph_mode': 'cutoff', 'cutoff': 0.7346431564786564, 'grm_norm': 'none', 'self_loops': False, 'use_snp_selection': False}. Best is trial 95 with value: 0.12915900749773812.
[I 2025-11-03 11:50:43,488] Trial 128 finished with value: 0.05063938282968491 and parameters: {'model_type': 'graphsage', 'hidden_dims': '[512, 256]', 'dropout': 0.34986716341839946, 'batch_norm': False, 'lr': 0.0005749247905174277, 'weight_decay': 1.8210717419942287e-06, 'epochs': 206, 'loss': 'mse', 'optimizer': 'adam', 'graph_mode': 'cutoff', 'cutoff': 0.7754771537277352, 'grm_norm': 'cosine', 'self_loops': False, 'use_snp_selection': True, 'num_snps': 23993}. Best is trial 95 with value: 0.12915900749773812.
[I 2025-11-03 11:50:46,885] Trial 129 finished with value: 0.12046221816260716 and parameters: {'model_type': 'graphsage', 'hidden_dims': '[512, 256]', 'dropout': 0.23800192449845947, 'batch_norm': True, 'lr': 0.00037325044086007424, 'weight_decay': 1.4218148487045901e-06, 'epochs': 214, 'loss': 'mse', 'optimizer': 'adam', 'graph_mode': 'cutoff', 'cutoff': 0.6695227224584462, 'grm_norm': 'none', 'self_loops': True, 'use_snp_selection': False}. Best is trial 95 with value: 0.12915900749773812.
[I 2025-11-03 11:50:49,445] Trial 130 finished with value: 0.10476047040643792 and parameters: {'model_type': 'graphsage', 'hidden_dims': '[256, 128, 64]', 'dropout': 0.3944077677941693, 'batch_norm': True, 'lr': 0.0001714313517055302, 'weight_decay': 1.4698477881493374e-06, 'epochs': 229, 'loss': 'mse', 'optimizer': 'adam', 'graph_mode': 'cutoff', 'cutoff': 0.8288360840787112, 'grm_norm': 'none', 'self_loops': True, 'use_snp_selection': False}. Best is trial 95 with value: 0.12915900749773812.
