[I 2025-11-03 12:32:43,472] Trial 118 finished with value: 0.12269805942428239 and parameters: {'model_type': 'gcn', 'hidden_dims': '[512, 256]', 'dropout': 0.3898570884540619, 'batch_norm': True, 'lr': 0.0003900351769120184, 'weight_decay': 1.2343329272807084e-07, 'epochs': 302, 'loss': 'mse', 'optimizer': 'adam', 'graph_mode': 'cutoff', 'cutoff': 0.8817787450795256, 'grm_norm': 'none', 'self_loops': True, 'use_snp_selection': False}. Best is trial 109 with value: 0.13600402080253834.
[I 2025-11-03 12:32:46,228] Trial 119 finished with value: 0.12425409396861757 and parameters: {'model_type': 'gcn', 'hidden_dims': '[512, 256]', 'dropout': 0.42948568595806, 'batch_norm': True, 'lr': 0.0005143175148993607, 'weight_decay': 2.475485172135409e-07, 'epochs': 255, 'loss': 'mse', 'optimizer': 'adam', 'graph_mode': 'cutoff', 'cutoff': 0.817088856657154, 'grm_norm': 'none', 'self_loops': False, 'use_snp_selection': False}. Best is trial 109 with value: 0.13600402080253834.
[I 2025-11-03 12:32:49,030] Trial 120 finished with value: 0.12474932152013093 and parameters: {'model_type': 'gcn', 'hidden_dims': '[512, 256]', 'dropout': 0.3593133158201053, 'batch_norm': True, 'lr': 0.0005798763342889958, 'weight_decay': 3.4626357094786196e-07, 'epochs': 265, 'loss': 'mse', 'optimizer': 'adam', 'graph_mode': 'cutoff', 'cutoff': 0.8431562523393537, 'grm_norm': 'none', 'self_loops': False, 'use_snp_selection': False}. Best is trial 109 with value: 0.13600402080253834.
[I 2025-11-03 12:32:51,977] Trial 121 finished with value: 0.11904602398588267 and parameters: {'model_type': 'gcn', 'hidden_dims': '[512, 256]', 'dropout': 0.45060800179625293, 'batch_norm': True, 'lr': 0.0006321444770401083, 'weight_decay': 1.8980991214720215e-07, 'epochs': 287, 'loss': 'mse', 'optimizer': 'adam', 'graph_mode': 'cutoff', 'cutoff': 0.8618757017841406, 'grm_norm': 'none', 'self_loops': False, 'use_snp_selection': False}. Best is trial 109 with value: 0.13600402080253834.
[I 2025-11-03 12:32:55,116] Trial 122 finished with value: 0.12044676374720148 and parameters: {'model_type': 'gcn', 'hidden_dims': '[512, 256]', 'dropout': 0.4035619246321025, 'batch_norm': True, 'lr': 0.0009118786465602658, 'weight_decay': 1.9054790935127346e-07, 'epochs': 278, 'loss': 'mse', 'optimizer': 'adam', 'graph_mode': 'cutoff', 'cutoff': 0.8764825842459676, 'grm_norm': 'none', 'self_loops': False, 'use_snp_selection': False}. Best is trial 109 with value: 0.13600402080253834.
[I 2025-11-03 12:32:58,119] Trial 123 finished with value: 0.12292369751190119 and parameters: {'model_type': 'gcn', 'hidden_dims': '[512, 256]', 'dropout': 0.4403064268686636, 'batch_norm': True, 'lr': 0.0007555773556287183, 'weight_decay': 1.5346094230003572e-07, 'epochs': 284, 'loss': 'mse', 'optimizer': 'adam', 'graph_mode': 'cutoff', 'cutoff': 0.8456437642725488, 'grm_norm': 'none', 'self_loops': False, 'use_snp_selection': False}. Best is trial 109 with value: 0.13600402080253834.
[I 2025-11-03 12:33:01,198] Trial 124 finished with value: 0.12327726462967431 and parameters: {'model_type': 'gcn', 'hidden_dims': '[512, 256]', 'dropout': 0.4544181671226671, 'batch_norm': True, 'lr': 0.00044605137408304713, 'weight_decay': 1.276033876271608e-07, 'epochs': 306, 'loss': 'mse', 'optimizer': 'adam', 'graph_mode': 'cutoff', 'cutoff': 0.8713707437096994, 'grm_norm': 'none', 'self_loops': False, 'use_snp_selection': False}. Best is trial 109 with value: 0.13600402080253834.
[I 2025-11-03 12:33:03,933] Trial 125 finished with value: 0.10832999900777267 and parameters: {'model_type': 'gcn', 'hidden_dims': '[512, 256]', 'dropout': 0.48866510949547726, 'batch_norm': True, 'lr': 0.0006110835472300498, 'weight_decay': 1.673146400292201e-07, 'epochs': 245, 'loss': 'mse', 'optimizer': 'adam', 'graph_mode': 'cutoff', 'cutoff': 0.8873596706597794, 'grm_norm': 'none', 'self_loops': False, 'use_snp_selection': False}. Best is trial 109 with value: 0.13600402080253834.
[I 2025-11-03 12:33:06,829] Trial 126 finished with value: 0.04580307620760526 and parameters: {'model_type': 'gcn', 'hidden_dims': '[512, 256]', 'dropout': 0.3436176300785778, 'batch_norm': True, 'lr': 5.8415134093054025e-06, 'weight_decay': 2.182127793547034e-07, 'epochs': 274, 'loss': 'mse', 'optimizer': 'adam', 'graph_mode': 'cutoff', 'cutoff': 0.8996150415237436, 'grm_norm': 'none', 'self_loops': False, 'use_snp_selection': False}. Best is trial 109 with value: 0.13600402080253834.
[I 2025-11-03 12:33:09,832] Trial 127 finished with value: 0.118366072650753 and parameters: {'model_type': 'gcn', 'hidden_dims': '[512, 256]', 'dropout': 0.47056590888662153, 'batch_norm': True, 'lr': 0.0009745454066977548, 'weight_decay': 2.6967722842282473e-07, 'epochs': 293, 'loss': 'mse', 'optimizer': 'adam', 'graph_mode': 'cutoff', 'cutoff': 0.821134364512027, 'grm_norm': 'none', 'self_loops': False, 'use_snp_selection': False}. Best is trial 109 with value: 0.13600402080253834.
[I 2025-11-03 12:33:12,678] Trial 128 finished with value: 0.12485684613924791 and parameters: {'model_type': 'gcn', 'hidden_dims': '[512, 256]', 'dropout': 0.4207777753585956, 'batch_norm': True, 'lr': 0.0006882744073504525, 'weight_decay': 3.7976248862637613e-07, 'epochs': 265, 'loss': 'mse', 'optimizer': 'adam', 'graph_mode': 'cutoff', 'cutoff': 0.8670144053102177, 'grm_norm': 'none', 'self_loops': False, 'use_snp_selection': False}. Best is trial 109 with value: 0.13600402080253834.
[I 2025-11-03 12:33:15,717] Trial 129 finished with value: 0.12626965448493854 and parameters: {'model_type': 'gcn', 'hidden_dims': '[512, 256]', 'dropout': 0.3743124577950897, 'batch_norm': True, 'lr': 0.0005026786006583151, 'weight_decay': 1.2070937855037829e-07, 'epochs': 299, 'loss': 'mse', 'optimizer': 'adam', 'graph_mode': 'cutoff', 'cutoff': 0.8441733864938873, 'grm_norm': 'none', 'self_loops': False, 'use_snp_selection': False}. Best is trial 109 with value: 0.13600402080253834.
[I 2025-11-03 12:33:18,669] Trial 130 finished with value: 0.11224668319227082 and parameters: {'model_type': 'gcn', 'hidden_dims': '[512, 256]', 'dropout': 0.44277947575056004, 'batch_norm': True, 'lr': 0.0007913028070392197, 'weight_decay': 1.003687685753435e-07, 'epochs': 284, 'loss': 'mse', 'optimizer': 'adam', 'graph_mode': 'cutoff', 'cutoff': 0.8845066866959914, 'grm_norm': 'none', 'self_loops': False, 'use_snp_selection': False}. Best is trial 109 with value: 0.13600402080253834.
[I 2025-11-03 12:33:21,609] Trial 131 finished with value: 0.12615542960436202 and parameters: {'model_type': 'gcn', 'hidden_dims': '[512, 256]', 'dropout': 0.4313346839046682, 'batch_norm': True, 'lr': 0.0005550471819035717, 'weight_decay': 3.020068863094851e-07, 'epochs': 282, 'loss': 'mse', 'optimizer': 'adam', 'graph_mode': 'cutoff', 'cutoff': 0.8754190152811269, 'grm_norm': 'none', 'self_loops': False, 'use_snp_selection': False}. Best is trial 109 with value: 0.13600402080253834.
[I 2025-11-03 12:33:24,722] Trial 132 finished with value: 0.12622561838037047 and parameters: {'model_type': 'gcn', 'hidden_dims': '[512, 256]', 'dropout': 0.31886749683087334, 'batch_norm': True, 'lr': 0.00040759899171897567, 'weight_decay': 2.578771216693104e-07, 'epochs': 312, 'loss': 'mse', 'optimizer': 'adam', 'graph_mode': 'cutoff', 'cutoff': 0.8580164660706594, 'grm_norm': 'none', 'self_loops': False, 'use_snp_selection': False}. Best is trial 109 with value: 0.13600402080253834.
[I 2025-11-03 12:33:27,525] Trial 133 finished with value: 0.12805601927458074 and parameters: {'model_type': 'gcn', 'hidden_dims': '[512, 256]', 'dropout': 0.49946736893528676, 'batch_norm': True, 'lr': 0.0004955876919243319, 'weight_decay': 1.9932372999018063e-07, 'epochs': 257, 'loss': 'mse', 'optimizer': 'adam', 'graph_mode': 'cutoff', 'cutoff': 0.8314432177675566, 'grm_norm': 'none', 'self_loops': False, 'use_snp_selection': False}. Best is trial 109 with value: 0.13600402080253834.
[I 2025-11-03 12:33:30,403] Trial 134 finished with value: 0.12162265972808053 and parameters: {'model_type': 'gcn', 'hidden_dims': '[512, 256]', 'dropout': 0.47233000208946885, 'batch_norm': True, 'lr': 0.0006584327748416307, 'weight_decay': 1.4778006617569673e-07, 'epochs': 271, 'loss': 'mse', 'optimizer': 'adam', 'graph_mode': 'cutoff', 'cutoff': 0.8986149550755473, 'grm_norm': 'none', 'self_loops': False, 'use_snp_selection': False}. Best is trial 109 with value: 0.13600402080253834.
[I 2025-11-03 12:33:32,376] Trial 135 finished with value: 0.08244249203842732 and parameters: {'model_type': 'gcn', 'hidden_dims': '[128, 64]', 'dropout': 0.13211098147292252, 'batch_norm': True, 'lr': 9.408991368728043e-06, 'weight_decay': 2.607581633148959e-07, 'epochs': 290, 'loss': 'mse', 'optimizer': 'adam', 'graph_mode': 'cutoff', 'cutoff': 0.880949775714619, 'grm_norm': 'none', 'self_loops': False, 'use_snp_selection': False}. Best is trial 109 with value: 0.13600402080253834.
[I 2025-11-03 12:33:35,120] Trial 136 finished with value: 0.1166786880066204 and parameters: {'model_type': 'gcn', 'hidden_dims': '[512, 256]', 'dropout': 0.3159959823352367, 'batch_norm': True, 'lr': 0.0003545931778632098, 'weight_decay': 1.747287817613639e-07, 'epochs': 247, 'loss': 'mse', 'optimizer': 'adam', 'graph_mode': 'cutoff', 'cutoff': 0.8145926944584975, 'grm_norm': 'none', 'self_loops': False, 'use_snp_selection': False}. Best is trial 109 with value: 0.13600402080253834.
[I 2025-11-03 12:33:37,783] Trial 137 finished with value: 0.08557399883103887 and parameters: {'model_type': 'gcn', 'hidden_dims': '[512, 256]', 'dropout': 0.45903613546501887, 'batch_norm': False, 'lr': 0.0008006538235318112, 'weight_decay': 1.4069952164155701e-07, 'epochs': 281, 'loss': 'mse', 'optimizer': 'adam', 'graph_mode': 'cutoff', 'cutoff': 0.7879428615446725, 'grm_norm': 'none', 'self_loops': False, 'use_snp_selection': True, 'num_snps': 22884}. Best is trial 109 with value: 0.13600402080253834.
[I 2025-11-03 12:33:40,726] Trial 138 finished with value: 0.08461990831559654 and parameters: {'model_type': 'gcn', 'hidden_dims': '[512, 256]', 'dropout': 0.39558516557038015, 'batch_norm': True, 'lr': 0.0005721652519140785, 'weight_decay': 3.5071057684189757e-07, 'epochs': 263, 'loss': 'mse', 'optimizer': 'adam', 'graph_mode': 'knn', 'source': 'grm', 'knn_k': 2, 'weighted_edges': False, 'symmetrize_mode': 'mutual', 'use_snp_selection': False}. Best is trial 109 with value: 0.13600402080253834.
[I 2025-11-03 12:33:43,769] Trial 139 finished with value: 0.10713188509135664 and parameters: {'model_type': 'gcn', 'hidden_dims': '[512, 256]', 'dropout': 0.24788879671815842, 'batch_norm': True, 'lr': 0.00047391042296782404, 'weight_decay': 2.2641315680035663e-07, 'epochs': 300, 'loss': 'mse', 'optimizer': 'adam', 'graph_mode': 'cutoff', 'cutoff': 0.8641206652715279, 'grm_norm': 'none', 'self_loops': False, 'use_snp_selection': False}. Best is trial 109 with value: 0.13600402080253834.
[I 2025-11-03 12:33:46,281] Trial 140 finished with value: 0.10074706134234719 and parameters: {'model_type': 'gcn', 'hidden_dims': '[256, 128, 64]', 'dropout': 0.4063789161047361, 'batch_norm': True, 'lr': 0.000884293396632363, 'weight_decay': 4.392321521997672e-07, 'epochs': 276, 'loss': 'mse', 'optimizer': 'adam', 'graph_mode': 'cutoff', 'cutoff': 0.8404400368040823, 'grm_norm': 'none', 'self_loops': True, 'use_snp_selection': False}. Best is trial 109 with value: 0.13600402080253834.
[I 2025-11-03 12:33:49,380] Trial 141 finished with value: 0.12235802413249032 and parameters: {'model_type': 'gcn', 'hidden_dims': '[512, 256]', 'dropout': 0.492885252329521, 'batch_norm': True, 'lr': 0.00042726778593624306, 'weight_decay': 1.1974947734632642e-07, 'epochs': 307, 'loss': 'mse', 'optimizer': 'adam', 'graph_mode': 'cutoff', 'cutoff': 0.8804190354985078, 'grm_norm': 'cosine', 'self_loops': False, 'use_snp_selection': False}. Best is trial 109 with value: 0.13600402080253834.
[I 2025-11-03 12:33:52,361] Trial 142 finished with value: 0.1174932433153592 and parameters: {'model_type': 'gcn', 'hidden_dims': '[512, 256]', 'dropout': 0.32941154835220243, 'batch_norm': True, 'lr': 0.0007488651029113042, 'weight_decay': 1.5943701990483282e-07, 'epochs': 289, 'loss': 'mse', 'optimizer': 'adam', 'graph_mode': 'cutoff', 'cutoff': 0.8505909232907527, 'grm_norm': 'none', 'self_loops': False, 'use_snp_selection': False}. Best is trial 109 with value: 0.13600402080253834.
[I 2025-11-03 12:33:55,248] Trial 143 finished with value: 0.12134563649688183 and parameters: {'model_type': 'gcn', 'hidden_dims': '[512, 256]', 'dropout': 0.15533752276114685, 'batch_norm': True, 'lr': 0.000989380811785834, 'weight_decay': 2.836084167677266e-07, 'epochs': 270, 'loss': 'mse', 'optimizer': 'adam', 'graph_mode': 'cutoff', 'cutoff': 0.8281129042426246, 'grm_norm': 'cosine', 'self_loops': False, 'use_snp_selection': False}. Best is trial 109 with value: 0.13600402080253834.
[I 2025-11-03 12:33:58,390] Trial 144 finished with value: 0.08635596763675897 and parameters: {'model_type': 'gcn', 'hidden_dims': '[512, 256]', 'dropout': 0.4690952292067166, 'batch_norm': True, 'lr': 0.0005634805491564006, 'weight_decay': 1.8716017900190358e-07, 'epochs': 314, 'loss': 'mse', 'optimizer': 'adam', 'graph_mode': 'cutoff', 'cutoff': 0.20698980114094018, 'grm_norm': 'none', 'self_loops': False, 'use_snp_selection': False}. Best is trial 109 with value: 0.13600402080253834.
[I 2025-11-03 12:34:01,177] Trial 145 finished with value: 0.13782589639862222 and parameters: {'model_type': 'gcn', 'hidden_dims': '[512, 256]', 'dropout': 0.28167154328726696, 'batch_norm': True, 'lr': 0.0006789074294985274, 'weight_decay': 6.213008644800672e-05, 'epochs': 253, 'loss': 'mse', 'optimizer': 'adam', 'graph_mode': 'cutoff', 'cutoff': 0.8901980300873162, 'grm_norm': 'gcn', 'self_loops': False, 'use_snp_selection': False}. Best is trial 145 with value: 0.13782589639862222.
[I 2025-11-03 12:34:03,948] Trial 146 finished with value: 0.12660692382101948 and parameters: {'model_type': 'gcn', 'hidden_dims': '[512, 256]', 'dropout': 0.3034173174429369, 'batch_norm': True, 'lr': 0.0006492019657559501, 'weight_decay': 1.354960861444829e-07, 'epochs': 250, 'loss': 'mse', 'optimizer': 'adam', 'graph_mode': 'cutoff', 'cutoff': 0.8855965343505602, 'grm_norm': 'gcn', 'self_loops': False, 'use_snp_selection': False}. Best is trial 145 with value: 0.13782589639862222.
[I 2025-11-03 12:34:06,622] Trial 147 finished with value: 0.13290625697495595 and parameters: {'model_type': 'gcn', 'hidden_dims': '[512, 256]', 'dropout': 0.35583302647712767, 'batch_norm': True, 'lr': 0.0007211948762987687, 'weight_decay': 2.1151195186455626e-07, 'epochs': 234, 'loss': 'mse', 'optimizer': 'adam', 'graph_mode': 'cutoff', 'cutoff': 0.8999897339279086, 'grm_norm': 'gcn', 'self_loops': False, 'use_snp_selection': False}. Best is trial 145 with value: 0.13782589639862222.
[I 2025-11-03 12:34:09,423] Trial 148 finished with value: 0.1235843268083543 and parameters: {'model_type': 'gcn', 'hidden_dims': '[512, 256]', 'dropout': 0.3672483236632234, 'batch_norm': True, 'lr': 0.0007460592532915988, 'weight_decay': 2.219260769203068e-07, 'epochs': 256, 'loss': 'mse', 'optimizer': 'adam', 'graph_mode': 'cutoff', 'cutoff': 0.8631474326967847, 'grm_norm': 'gcn', 'self_loops': False, 'use_snp_selection': False}. Best is trial 145 with value: 0.13782589639862222.
[I 2025-11-03 12:34:12,111] Trial 149 finished with value: 0.11359597426402845 and parameters: {'model_type': 'gcn', 'hidden_dims': '[512, 256]', 'dropout': 0.35093034957655606, 'batch_norm': True, 'lr': 0.0008282401690702333, 'weight_decay': 1.0909936363684135e-07, 'epochs': 236, 'loss': 'mse', 'optimizer': 'adam', 'graph_mode': 'cutoff', 'cutoff': 0.8954404884357128, 'grm_norm': 'gcn', 'self_loops': False, 'use_snp_selection': False}. Best is trial 145 with value: 0.13782589639862222.
[I 2025-11-03 12:34:14,301] Trial 0 finished with value: -0.019727395780536346 and parameters: {'model_type': 'gcn', 'hidden_dims': '[128, 64]', 'dropout': 0.199031432379812, 'batch_norm': True, 'lr': 1.8408544111075837e-06, 'weight_decay': 5.5136510071208614e-05, 'epochs': 334, 'loss': 'mae', 'optimizer': 'adam', 'graph_mode': 'knn', 'source': 'grm', 'knn_k': 8, 'weighted_edges': True, 'symmetrize_mode': 'mutual', 'use_snp_selection': False}. Best is trial 0 with value: -0.019727395780536346.
[I 2025-11-03 12:34:15,493] Trial 1 finished with value: 0.0533057012638691 and parameters: {'model_type': 'gcn', 'hidden_dims': '[128, 64]', 'dropout': 0.40051947670227217, 'batch_norm': True, 'lr': 0.0005320428882732732, 'weight_decay': 1.89210117736594e-06, 'epochs': 32, 'loss': 'mse', 'optimizer': 'adam', 'graph_mode': 'knn', 'source': 'grm', 'knn_k': 7, 'weighted_edges': True, 'symmetrize_mode': 'union', 'use_snp_selection': False}. Best is trial 1 with value: 0.0533057012638691.
[I 2025-11-03 12:34:17,807] Trial 2 finished with value: 0.03206061320229792 and parameters: {'model_type': 'gcn', 'hidden_dims': '[256, 128]', 'dropout': 0.5105528289184642, 'batch_norm': False, 'lr': 0.0006804279372404962, 'weight_decay': 0.0008922815224257085, 'epochs': 160, 'loss': 'mse', 'optimizer': 'adam', 'graph_mode': 'cutoff', 'cutoff': 0.5741905641612706, 'grm_norm': 'gcn', 'self_loops': False, 'use_snp_selection': True, 'num_snps': 26910}. Best is trial 1 with value: 0.0533057012638691.
[I 2025-11-03 12:34:20,235] Trial 3 finished with value: 0.07323430628787997 and parameters: {'model_type': 'gcn', 'hidden_dims': '[256, 128, 64]', 'dropout': 0.5390483213624292, 'batch_norm': False, 'lr': 3.4705625989073525e-05, 'weight_decay': 2.4623319020131338e-05, 'epochs': 92, 'loss': 'mse', 'optimizer': 'adam', 'graph_mode': 'knn', 'source': 'grm', 'knn_k': 6, 'weighted_edges': False, 'symmetrize_mode': 'mutual', 'use_snp_selection': True, 'num_snps': 30713}. Best is trial 3 with value: 0.07323430628787997.
[I 2025-11-03 12:34:22,733] Trial 4 finished with value: -0.03732695027246149 and parameters: {'model_type': 'gcn', 'hidden_dims': '[128, 64]', 'dropout': 0.13404863676897502, 'batch_norm': False, 'lr': 0.0001431556295367288, 'weight_decay': 2.2084517750726675e-05, 'epochs': 13, 'loss': 'mae', 'optimizer': 'adam', 'graph_mode': 'cutoff', 'cutoff': 0.6714268476993044, 'grm_norm': 'none', 'self_loops': False, 'use_snp_selection': True, 'num_snps': 45645}. Best is trial 3 with value: 0.07323430628787997.
[I 2025-11-03 12:34:25,667] Trial 5 finished with value: 0.026574809397422752 and parameters: {'model_type': 'gcn', 'hidden_dims': '[256, 128]', 'dropout': 0.42253606323412096, 'batch_norm': False, 'lr': 4.238630400638805e-05, 'weight_decay': 8.074086040046576e-07, 'epochs': 134, 'loss': 'mae', 'optimizer': 'adam', 'graph_mode': 'knn', 'source': 'grm', 'knn_k': 1, 'weighted_edges': False, 'symmetrize_mode': 'mutual', 'use_snp_selection': True, 'num_snps': 43113}. Best is trial 3 with value: 0.07323430628787997.
[I 2025-11-03 12:34:28,296] Trial 6 finished with value: 0.06728740318475473 and parameters: {'model_type': 'gcn', 'hidden_dims': '[512, 256]', 'dropout': 0.3534893146320237, 'batch_norm': True, 'lr': 0.000251307964226932, 'weight_decay': 1.821819791794022e-05, 'epochs': 207, 'loss': 'mae', 'optimizer': 'adam', 'graph_mode': 'knn', 'source': 'grm', 'knn_k': 1, 'weighted_edges': True, 'symmetrize_mode': 'mutual', 'use_snp_selection': False}. Best is trial 3 with value: 0.07323430628787997.
[I 2025-11-03 12:34:30,611] Trial 7 finished with value: 0.018175647244512642 and parameters: {'model_type': 'gcn', 'hidden_dims': '[512, 256]', 'dropout': 0.1105825955860775, 'batch_norm': True, 'lr': 2.374338412754043e-05, 'weight_decay': 1.1284721123340274e-05, 'epochs': 170, 'loss': 'mse', 'optimizer': 'adam', 'graph_mode': 'cutoff', 'cutoff': 0.719872204109604, 'grm_norm': 'gcn', 'self_loops': False, 'use_snp_selection': False}. Best is trial 3 with value: 0.07323430628787997.
[I 2025-11-03 12:34:32,476] Trial 8 finished with value: 0.07029849365593929 and parameters: {'model_type': 'gcn', 'hidden_dims': '[512, 128]', 'dropout': 0.5066580418354021, 'batch_norm': True, 'lr': 0.00039213678276659976, 'weight_decay': 3.43655320802934e-06, 'epochs': 91, 'loss': 'mse', 'optimizer': 'adam', 'graph_mode': 'cutoff', 'cutoff': 0.34923059576505366, 'grm_norm': 'cosine', 'self_loops': True, 'use_snp_selection': False}. Best is trial 3 with value: 0.07323430628787997.
[I 2025-11-03 12:34:34,220] Trial 9 finished with value: 0.07466625725234172 and parameters: {'model_type': 'gcn', 'hidden_dims': '[512, 256]', 'dropout': 0.301734920240333, 'batch_norm': False, 'lr': 6.650961854953448e-06, 'weight_decay': 6.861575656590315e-05, 'epochs': 125, 'loss': 'mae', 'optimizer': 'adam', 'graph_mode': 'cutoff', 'cutoff': 0.2857569870061939, 'grm_norm': 'cosine_then_gcn', 'self_loops': False, 'use_snp_selection': True, 'num_snps': 12722}. Best is trial 9 with value: 0.07466625725234172.
[I 2025-11-03 12:34:35,972] Trial 10 finished with value: -0.0015000845583085778 and parameters: {'model_type': 'gcn', 'hidden_dims': '[512, 64]', 'dropout': 0.2549147281275221, 'batch_norm': False, 'lr': 2.3453406095863302e-06, 'weight_decay': 0.000250012967435051, 'epochs': 249, 'loss': 'mae', 'optimizer': 'adam', 'graph_mode': 'cutoff', 'cutoff': 0.22502730798645276, 'grm_norm': 'cosine_then_gcn', 'self_loops': True, 'use_snp_selection': True, 'num_snps': 3859}. Best is trial 9 with value: 0.07466625725234172.
[I 2025-11-03 12:34:37,830] Trial 11 finished with value: 0.02468840154061248 and parameters: {'model_type': 'gcn', 'hidden_dims': '[256, 128, 64]', 'dropout': 0.5994089069221873, 'batch_norm': False, 'lr': 8.807069823561703e-06, 'weight_decay': 1.0655358607693621e-07, 'epochs': 86, 'loss': 'mse', 'optimizer': 'adam', 'graph_mode': 'knn', 'source': 'grm', 'knn_k': 5, 'weighted_edges': False, 'symmetrize_mode': 'union', 'use_snp_selection': True, 'num_snps': 16031}. Best is trial 9 with value: 0.07466625725234172.
