[I 2025-11-03 15:10:21,478] Trial 53 finished with value: 0.021929944194586604 and parameters: {'model_type': 'graphsage', 'hidden_dims': '[128, 64]', 'dropout': 0.28784466634070693, 'batch_norm': True, 'lr': 0.0007064280550738095, 'weight_decay': 1.2708944330383663e-05, 'epochs': 123, 'loss': 'mse', 'optimizer': 'adam', 'graph_mode': 'knn', 'source': 'grm', 'knn_k': 7, 'weighted_edges': False, 'symmetrize_mode': 'union', 'use_snp_selection': False}. Best is trial 31 with value: 0.058828505495271376.
[I 2025-11-03 15:10:22,952] Trial 54 finished with value: 0.04132548721355534 and parameters: {'model_type': 'graphsage', 'hidden_dims': '[128, 64]', 'dropout': 0.3218545861418396, 'batch_norm': True, 'lr': 0.000372167451462981, 'weight_decay': 2.0109120406368805e-05, 'epochs': 60, 'loss': 'mse', 'optimizer': 'adam', 'graph_mode': 'knn', 'source': 'grm', 'knn_k': 6, 'weighted_edges': False, 'symmetrize_mode': 'mutual', 'use_snp_selection': False}. Best is trial 31 with value: 0.058828505495271376.
[I 2025-11-03 15:10:25,018] Trial 55 finished with value: 0.03390154969450829 and parameters: {'model_type': 'graphsage', 'hidden_dims': '[256, 128, 64]', 'dropout': 0.27697421628415997, 'batch_norm': True, 'lr': 0.0009848222046389844, 'weight_decay': 4.447734288109235e-06, 'epochs': 89, 'loss': 'mse', 'optimizer': 'adam', 'graph_mode': 'knn', 'source': 'grm', 'knn_k': 6, 'weighted_edges': False, 'symmetrize_mode': 'union', 'use_snp_selection': False}. Best is trial 31 with value: 0.058828505495271376.
[I 2025-11-03 15:10:26,550] Trial 56 finished with value: 0.04910774494324576 and parameters: {'model_type': 'graphsage', 'hidden_dims': '[128, 64]', 'dropout': 0.3460233223948549, 'batch_norm': True, 'lr': 0.00023231654339041246, 'weight_decay': 6.847304817339493e-06, 'epochs': 75, 'loss': 'mse', 'optimizer': 'adam', 'graph_mode': 'knn', 'source': 'grm', 'knn_k': 7, 'weighted_edges': False, 'symmetrize_mode': 'mutual', 'use_snp_selection': False}. Best is trial 31 with value: 0.058828505495271376.
[I 2025-11-03 15:10:29,758] Trial 57 finished with value: 0.044947160267388965 and parameters: {'model_type': 'graphsage', 'hidden_dims': '[512, 256]', 'dropout': 0.238971422536298, 'batch_norm': True, 'lr': 0.0005645457261451342, 'weight_decay': 4.145382439760973e-06, 'epochs': 98, 'loss': 'mse', 'optimizer': 'adam', 'graph_mode': 'knn', 'source': 'grm', 'knn_k': 9, 'weighted_edges': False, 'symmetrize_mode': 'union', 'use_snp_selection': False}. Best is trial 31 with value: 0.058828505495271376.
[I 2025-11-03 15:10:32,352] Trial 58 finished with value: 0.011754973406347758 and parameters: {'model_type': 'graphsage', 'hidden_dims': '[512, 64]', 'dropout': 0.20393313224296322, 'batch_norm': True, 'lr': 1.9532467582638195e-05, 'weight_decay': 2.4585993870316583e-06, 'epochs': 51, 'loss': 'mse', 'optimizer': 'adam', 'graph_mode': 'knn', 'source': 'grm', 'knn_k': 6, 'weighted_edges': False, 'symmetrize_mode': 'union', 'use_snp_selection': False}. Best is trial 31 with value: 0.058828505495271376.
[I 2025-11-03 15:10:34,830] Trial 59 finished with value: 0.02630629858365245 and parameters: {'model_type': 'graphsage', 'hidden_dims': '[128, 64]', 'dropout': 0.3055318285152639, 'batch_norm': True, 'lr': 0.0007918583042694982, 'weight_decay': 1.381424019038056e-06, 'epochs': 349, 'loss': 'mse', 'optimizer': 'adam', 'graph_mode': 'knn', 'source': 'grm', 'knn_k': 4, 'weighted_edges': False, 'symmetrize_mode': 'mutual', 'use_snp_selection': False}. Best is trial 31 with value: 0.058828505495271376.
[I 2025-11-03 15:10:36,818] Trial 60 finished with value: 0.04101782856207147 and parameters: {'model_type': 'graphsage', 'hidden_dims': '[256, 128]', 'dropout': 0.25975325576972813, 'batch_norm': True, 'lr': 0.00015148900756800643, 'weight_decay': 1.0081267676296493e-05, 'epochs': 70, 'loss': 'mse', 'optimizer': 'adam', 'graph_mode': 'knn', 'source': 'grm', 'knn_k': 8, 'weighted_edges': False, 'symmetrize_mode': 'union', 'use_snp_selection': False}. Best is trial 31 with value: 0.058828505495271376.
[I 2025-11-03 15:10:38,384] Trial 61 finished with value: 0.05242592642445368 and parameters: {'model_type': 'graphsage', 'hidden_dims': '[128, 64]', 'dropout': 0.1647464533268429, 'batch_norm': True, 'lr': 0.00030487493421931845, 'weight_decay': 1.6082079296456271e-06, 'epochs': 81, 'loss': 'mse', 'optimizer': 'adam', 'graph_mode': 'knn', 'source': 'grm', 'knn_k': 5, 'weighted_edges': False, 'symmetrize_mode': 'union', 'use_snp_selection': False}. Best is trial 31 with value: 0.058828505495271376.
[I 2025-11-03 15:10:39,961] Trial 62 finished with value: 0.04714040961356854 and parameters: {'model_type': 'graphsage', 'hidden_dims': '[128, 64]', 'dropout': 0.1741221973733719, 'batch_norm': True, 'lr': 0.00039138119916864403, 'weight_decay': 5.967010184515202e-06, 'epochs': 84, 'loss': 'mse', 'optimizer': 'adam', 'graph_mode': 'knn', 'source': 'grm', 'knn_k': 5, 'weighted_edges': False, 'symmetrize_mode': 'union', 'use_snp_selection': False}. Best is trial 31 with value: 0.058828505495271376.
[I 2025-11-03 15:10:41,501] Trial 63 finished with value: 0.030287346498302607 and parameters: {'model_type': 'graphsage', 'hidden_dims': '[128, 64]', 'dropout': 0.13283279631207973, 'batch_norm': True, 'lr': 0.00029463671703706316, 'weight_decay': 7.897587504336335e-07, 'epochs': 62, 'loss': 'mse', 'optimizer': 'adam', 'graph_mode': 'knn', 'source': 'grm', 'knn_k': 7, 'weighted_edges': False, 'symmetrize_mode': 'union', 'use_snp_selection': False}. Best is trial 31 with value: 0.058828505495271376.
[I 2025-11-03 15:10:42,943] Trial 64 finished with value: 0.050552164797987756 and parameters: {'model_type': 'graphsage', 'hidden_dims': '[128, 64]', 'dropout': 0.23785080767402608, 'batch_norm': True, 'lr': 0.0004898803897928387, 'weight_decay': 1.9120659686120364e-06, 'epochs': 50, 'loss': 'mse', 'optimizer': 'adam', 'graph_mode': 'knn', 'source': 'grm', 'knn_k': 4, 'weighted_edges': False, 'symmetrize_mode': 'union', 'use_snp_selection': False}. Best is trial 31 with value: 0.058828505495271376.
[I 2025-11-03 15:10:44,621] Trial 65 finished with value: 0.04848551118992153 and parameters: {'model_type': 'graphsage', 'hidden_dims': '[128, 64]', 'dropout': 0.20328997593963213, 'batch_norm': True, 'lr': 0.0008006998979594055, 'weight_decay': 3.4299394670928506e-06, 'epochs': 102, 'loss': 'mse', 'optimizer': 'adam', 'graph_mode': 'knn', 'source': 'grm', 'knn_k': 6, 'weighted_edges': False, 'symmetrize_mode': 'union', 'use_snp_selection': False}. Best is trial 31 with value: 0.058828505495271376.
[I 2025-11-03 15:10:46,822] Trial 66 finished with value: 0.04524119090104938 and parameters: {'model_type': 'graphsage', 'hidden_dims': '[256, 128, 64]', 'dropout': 0.1602652655762184, 'batch_norm': True, 'lr': 0.0005807869530714338, 'weight_decay': 7.869579749480042e-07, 'epochs': 117, 'loss': 'mae', 'optimizer': 'adam', 'graph_mode': 'knn', 'source': 'grm', 'knn_k': 5, 'weighted_edges': True, 'symmetrize_mode': 'union', 'use_snp_selection': False}. Best is trial 31 with value: 0.058828505495271376.
[I 2025-11-03 15:10:48,692] Trial 67 finished with value: 0.007999755681606846 and parameters: {'model_type': 'graphsage', 'hidden_dims': '[128, 64]', 'dropout': 0.11871908711554907, 'batch_norm': False, 'lr': 0.00024127929057787822, 'weight_decay': 7.854949935948078e-06, 'epochs': 80, 'loss': 'mse', 'optimizer': 'adam', 'graph_mode': 'knn', 'source': 'grm', 'knn_k': 6, 'weighted_edges': False, 'symmetrize_mode': 'union', 'use_snp_selection': True, 'num_snps': 17897}. Best is trial 31 with value: 0.058828505495271376.
[I 2025-11-03 15:10:52,306] Trial 68 finished with value: 0.04712659953953794 and parameters: {'model_type': 'graphsage', 'hidden_dims': '[512, 64]', 'dropout': 0.18728058133943848, 'batch_norm': True, 'lr': 0.0003425496188066224, 'weight_decay': 2.159892589475478e-05, 'epochs': 162, 'loss': 'mse', 'optimizer': 'adam', 'graph_mode': 'knn', 'source': 'grm', 'knn_k': 4, 'weighted_edges': True, 'symmetrize_mode': 'union', 'use_snp_selection': False}. Best is trial 31 with value: 0.058828505495271376.
[I 2025-11-03 15:10:54,168] Trial 69 finished with value: 0.021024155273978308 and parameters: {'model_type': 'graphsage', 'hidden_dims': '[128, 64]', 'dropout': 0.391242374816293, 'batch_norm': True, 'lr': 3.4716014868663515e-05, 'weight_decay': 2.877972333322362e-06, 'epochs': 126, 'loss': 'mse', 'optimizer': 'adam', 'graph_mode': 'knn', 'source': 'grm', 'knn_k': 8, 'weighted_edges': True, 'symmetrize_mode': 'union', 'use_snp_selection': False}. Best is trial 31 with value: 0.058828505495271376.
[I 2025-11-03 15:10:55,627] Trial 70 finished with value: 0.0516338424421856 and parameters: {'model_type': 'graphsage', 'hidden_dims': '[128, 64]', 'dropout': 0.22782582006164395, 'batch_norm': True, 'lr': 0.0008323471318352301, 'weight_decay': 2.0023216027189926e-06, 'epochs': 47, 'loss': 'mse', 'optimizer': 'adam', 'graph_mode': 'knn', 'source': 'grm', 'knn_k': 6, 'weighted_edges': False, 'symmetrize_mode': 'union', 'use_snp_selection': False}. Best is trial 31 with value: 0.058828505495271376.
[I 2025-11-03 15:10:57,090] Trial 71 finished with value: 0.03966502201796101 and parameters: {'model_type': 'graphsage', 'hidden_dims': '[128, 64]', 'dropout': 0.28871505189954483, 'batch_norm': True, 'lr': 0.0008253506532595219, 'weight_decay': 5.189553319387336e-06, 'epochs': 48, 'loss': 'mse', 'optimizer': 'adam', 'graph_mode': 'knn', 'source': 'grm', 'knn_k': 6, 'weighted_edges': False, 'symmetrize_mode': 'union', 'use_snp_selection': False}. Best is trial 31 with value: 0.058828505495271376.
[I 2025-11-03 15:10:58,605] Trial 72 finished with value: 0.045831395962499896 and parameters: {'model_type': 'graphsage', 'hidden_dims': '[128, 64]', 'dropout': 0.23192415456402635, 'batch_norm': True, 'lr': 0.0005416135975855453, 'weight_decay': 1.9363860480744305e-06, 'epochs': 67, 'loss': 'mse', 'optimizer': 'adam', 'graph_mode': 'knn', 'source': 'grm', 'knn_k': 5, 'weighted_edges': False, 'symmetrize_mode': 'union', 'use_snp_selection': False}. Best is trial 31 with value: 0.058828505495271376.
[I 2025-11-03 15:11:00,253] Trial 73 finished with value: 0.04377036917815375 and parameters: {'model_type': 'graphsage', 'hidden_dims': '[128, 64]', 'dropout': 0.250436706739557, 'batch_norm': True, 'lr': 0.0004394114088210229, 'weight_decay': 1.4530115995990913e-06, 'epochs': 87, 'loss': 'mse', 'optimizer': 'adam', 'graph_mode': 'knn', 'source': 'grm', 'knn_k': 7, 'weighted_edges': False, 'symmetrize_mode': 'union', 'use_snp_selection': False}. Best is trial 31 with value: 0.058828505495271376.
[I 2025-11-03 15:11:03,078] Trial 74 finished with value: 0.05152751264589343 and parameters: {'model_type': 'graphsage', 'hidden_dims': '[512, 256]', 'dropout': 0.19548679892422477, 'batch_norm': True, 'lr': 0.000654248853754455, 'weight_decay': 3.7830178013900995e-06, 'epochs': 75, 'loss': 'mse', 'optimizer': 'adam', 'graph_mode': 'knn', 'source': 'grm', 'knn_k': 6, 'weighted_edges': True, 'symmetrize_mode': 'union', 'use_snp_selection': False}. Best is trial 31 with value: 0.058828505495271376.
[I 2025-11-03 15:11:05,882] Trial 75 finished with value: 0.04505630374387231 and parameters: {'model_type': 'graphsage', 'hidden_dims': '[512, 256]', 'dropout': 0.2092370971098132, 'batch_norm': True, 'lr': 0.0008491883115494489, 'weight_decay': 1.064573611304e-06, 'epochs': 73, 'loss': 'mse', 'optimizer': 'adam', 'graph_mode': 'knn', 'source': 'grm', 'knn_k': 6, 'weighted_edges': True, 'symmetrize_mode': 'union', 'use_snp_selection': False}. Best is trial 31 with value: 0.058828505495271376.
[I 2025-11-03 15:11:08,353] Trial 76 finished with value: 0.04891078397702647 and parameters: {'model_type': 'graphsage', 'hidden_dims': '[512, 256]', 'dropout': 0.13192165626654276, 'batch_norm': True, 'lr': 0.0006044816121005321, 'weight_decay': 3.8953604940378845e-06, 'epochs': 40, 'loss': 'mse', 'optimizer': 'adam', 'graph_mode': 'knn', 'source': 'grm', 'knn_k': 5, 'weighted_edges': True, 'symmetrize_mode': 'union', 'use_snp_selection': False}. Best is trial 31 with value: 0.058828505495271376.
[I 2025-11-03 15:11:11,236] Trial 77 finished with value: 0.03355421790792006 and parameters: {'model_type': 'graphsage', 'hidden_dims': '[512, 256]', 'dropout': 0.19369217957566268, 'batch_norm': True, 'lr': 0.0009829737534063911, 'weight_decay': 5.904530199039016e-07, 'epochs': 92, 'loss': 'mae', 'optimizer': 'adam', 'graph_mode': 'knn', 'source': 'grm', 'knn_k': 5, 'weighted_edges': True, 'symmetrize_mode': 'mutual', 'use_snp_selection': False}. Best is trial 31 with value: 0.058828505495271376.
[I 2025-11-03 15:11:15,023] Trial 78 finished with value: 0.020671902415894877 and parameters: {'model_type': 'graphsage', 'hidden_dims': '[512, 256]', 'dropout': 0.16886983892152357, 'batch_norm': False, 'lr': 0.00032245681601773477, 'weight_decay': 2.28337660488708e-06, 'epochs': 63, 'loss': 'mse', 'optimizer': 'adam', 'graph_mode': 'knn', 'source': 'grm', 'knn_k': 4, 'weighted_edges': True, 'symmetrize_mode': 'union', 'use_snp_selection': True, 'num_snps': 49628}. Best is trial 31 with value: 0.058828505495271376.
[I 2025-11-03 15:11:17,696] Trial 79 finished with value: 0.04281046236250937 and parameters: {'model_type': 'graphsage', 'hidden_dims': '[256, 128]', 'dropout': 0.2249628082108773, 'batch_norm': True, 'lr': 0.0004371532401329172, 'weight_decay': 1.3353391584001192e-06, 'epochs': 183, 'loss': 'mse', 'optimizer': 'adam', 'graph_mode': 'knn', 'source': 'grm', 'knn_k': 6, 'weighted_edges': True, 'symmetrize_mode': 'union', 'use_snp_selection': False}. Best is trial 31 with value: 0.058828505495271376.
[I 2025-11-03 15:11:20,568] Trial 80 finished with value: 0.0493700202752854 and parameters: {'model_type': 'graphsage', 'hidden_dims': '[512, 256]', 'dropout': 0.18305986478630107, 'batch_norm': True, 'lr': 0.0005192185363844857, 'weight_decay': 1.6247248694557083e-05, 'epochs': 75, 'loss': 'mse', 'optimizer': 'adam', 'graph_mode': 'knn', 'source': 'grm', 'knn_k': 5, 'weighted_edges': True, 'symmetrize_mode': 'union', 'use_snp_selection': False}. Best is trial 31 with value: 0.058828505495271376.
[I 2025-11-03 15:11:22,079] Trial 81 finished with value: 0.013643597768946532 and parameters: {'model_type': 'graphsage', 'hidden_dims': '[128, 64]', 'dropout': 0.4209953175655326, 'batch_norm': True, 'lr': 0.0006956962865023467, 'weight_decay': 1.1416936315146247e-05, 'epochs': 51, 'loss': 'mse', 'optimizer': 'adam', 'graph_mode': 'knn', 'source': 'grm', 'knn_k': 7, 'weighted_edges': False, 'symmetrize_mode': 'union', 'use_snp_selection': False}. Best is trial 31 with value: 0.058828505495271376.
[I 2025-11-03 15:11:23,602] Trial 82 finished with value: 0.05161417071044885 and parameters: {'model_type': 'graphsage', 'hidden_dims': '[128, 64]', 'dropout': 0.26392742447088724, 'batch_norm': True, 'lr': 0.0006452654993529945, 'weight_decay': 6.923902305116838e-06, 'epochs': 57, 'loss': 'mse', 'optimizer': 'adam', 'graph_mode': 'knn', 'source': 'grm', 'knn_k': 7, 'weighted_edges': True, 'symmetrize_mode': 'union', 'use_snp_selection': False}. Best is trial 31 with value: 0.058828505495271376.
[I 2025-11-03 15:11:25,186] Trial 83 finished with value: 0.017461562183158138 and parameters: {'model_type': 'graphsage', 'hidden_dims': '[128, 64]', 'dropout': 0.14939606690498766, 'batch_norm': True, 'lr': 0.0005965937458871499, 'weight_decay': 6.600785647045563e-06, 'epochs': 80, 'loss': 'mse', 'optimizer': 'adam', 'graph_mode': 'knn', 'source': 'grm', 'knn_k': 6, 'weighted_edges': True, 'symmetrize_mode': 'union', 'use_snp_selection': False}. Best is trial 31 with value: 0.058828505495271376.
[I 2025-11-03 15:11:26,697] Trial 84 finished with value: 0.02336926670212641 and parameters: {'model_type': 'graphsage', 'hidden_dims': '[128, 64]', 'dropout': 0.20977304934386243, 'batch_norm': True, 'lr': 1.3151983900963192e-05, 'weight_decay': 8.733157194994325e-06, 'epochs': 57, 'loss': 'mse', 'optimizer': 'adam', 'graph_mode': 'knn', 'source': 'grm', 'knn_k': 7, 'weighted_edges': True, 'symmetrize_mode': 'union', 'use_snp_selection': False}. Best is trial 31 with value: 0.058828505495271376.
[I 2025-11-03 15:11:28,229] Trial 85 finished with value: 0.04711271731565399 and parameters: {'model_type': 'graphsage', 'hidden_dims': '[128, 64]', 'dropout': 0.2600093673621456, 'batch_norm': True, 'lr': 0.0003856462766720244, 'weight_decay': 3.0022756010652338e-06, 'epochs': 67, 'loss': 'mse', 'optimizer': 'adam', 'graph_mode': 'knn', 'source': 'grm', 'knn_k': 5, 'weighted_edges': True, 'symmetrize_mode': 'union', 'use_snp_selection': False}. Best is trial 31 with value: 0.058828505495271376.
[I 2025-11-03 15:11:30,031] Trial 86 finished with value: 0.02712981882252353 and parameters: {'model_type': 'graphsage', 'hidden_dims': '[256, 128, 64]', 'dropout': 0.2456479384161037, 'batch_norm': True, 'lr': 0.0008080351551748882, 'weight_decay': 3.706871348803516e-06, 'epochs': 46, 'loss': 'mse', 'optimizer': 'adam', 'graph_mode': 'knn', 'source': 'grm', 'knn_k': 6, 'weighted_edges': True, 'symmetrize_mode': 'union', 'use_snp_selection': False}. Best is trial 31 with value: 0.058828505495271376.
[I 2025-11-03 15:11:31,733] Trial 87 finished with value: 0.0374389486823973 and parameters: {'model_type': 'graphsage', 'hidden_dims': '[128, 64]', 'dropout': 0.22542490084224273, 'batch_norm': True, 'lr': 0.00025840906177906496, 'weight_decay': 3.6685011005122864e-05, 'epochs': 101, 'loss': 'mse', 'optimizer': 'adam', 'graph_mode': 'knn', 'source': 'grm', 'knn_k': 7, 'weighted_edges': True, 'symmetrize_mode': 'union', 'use_snp_selection': False}. Best is trial 31 with value: 0.058828505495271376.
[I 2025-11-03 15:11:33,210] Trial 88 finished with value: 0.04223043045584171 and parameters: {'model_type': 'graphsage', 'hidden_dims': '[128, 64]', 'dropout': 0.19860393788351663, 'batch_norm': True, 'lr': 0.0004874041471902628, 'weight_decay': 1.7808261941453014e-06, 'epochs': 55, 'loss': 'mse', 'optimizer': 'adam', 'graph_mode': 'knn', 'source': 'grm', 'knn_k': 4, 'weighted_edges': True, 'symmetrize_mode': 'union', 'use_snp_selection': False}. Best is trial 31 with value: 0.058828505495271376.
[I 2025-11-03 15:11:34,679] Trial 89 finished with value: -0.016596409258199683 and parameters: {'model_type': 'graphsage', 'hidden_dims': '[512, 64]', 'dropout': 0.3630256908116341, 'batch_norm': False, 'lr': 0.00020062821901475002, 'weight_decay': 1.2523221046079454e-05, 'epochs': 89, 'loss': 'mae', 'optimizer': 'adam', 'graph_mode': 'cutoff', 'cutoff': 0.6393211049271805, 'grm_norm': 'cosine_then_gcn', 'self_loops': False, 'use_snp_selection': True, 'num_snps': 3785}. Best is trial 31 with value: 0.058828505495271376.
[I 2025-11-03 15:11:36,385] Trial 90 finished with value: 0.042723909213552194 and parameters: {'model_type': 'graphsage', 'hidden_dims': '[128, 64]', 'dropout': 0.17707385275099136, 'batch_norm': True, 'lr': 0.0006246271200308357, 'weight_decay': 7.386152294719729e-06, 'epochs': 78, 'loss': 'mse', 'optimizer': 'adam', 'graph_mode': 'knn', 'source': 'grm', 'knn_k': 8, 'weighted_edges': True, 'symmetrize_mode': 'union', 'use_snp_selection': False}. Best is trial 31 with value: 0.058828505495271376.
[I 2025-11-03 15:11:37,903] Trial 91 finished with value: 0.06275248714198164 and parameters: {'model_type': 'graphsage', 'hidden_dims': '[128, 64]', 'dropout': 0.267865977542844, 'batch_norm': True, 'lr': 0.0007046467595754945, 'weight_decay': 4.857046296392901e-06, 'epochs': 59, 'loss': 'mse', 'optimizer': 'adam', 'graph_mode': 'knn', 'source': 'grm', 'knn_k': 7, 'weighted_edges': False, 'symmetrize_mode': 'union', 'use_snp_selection': False}. Best is trial 91 with value: 0.06275248714198164.
[I 2025-11-03 15:11:39,426] Trial 92 finished with value: 0.0352521305310287 and parameters: {'model_type': 'graphsage', 'hidden_dims': '[128, 64]', 'dropout': 0.27883347191644353, 'batch_norm': True, 'lr': 0.0009995313754125343, 'weight_decay': 5.371837514265074e-06, 'epochs': 63, 'loss': 'mse', 'optimizer': 'adam', 'graph_mode': 'knn', 'source': 'grm', 'knn_k': 6, 'weighted_edges': False, 'symmetrize_mode': 'union', 'use_snp_selection': False}. Best is trial 91 with value: 0.06275248714198164.
[I 2025-11-03 15:11:40,883] Trial 93 finished with value: 0.03920778992489793 and parameters: {'model_type': 'graphsage', 'hidden_dims': '[128, 64]', 'dropout': 0.3053378294540939, 'batch_norm': True, 'lr': 0.0007660894371707593, 'weight_decay': 2.5337319885911536e-06, 'epochs': 45, 'loss': 'mse', 'optimizer': 'adam', 'graph_mode': 'knn', 'source': 'grm', 'knn_k': 7, 'weighted_edges': False, 'symmetrize_mode': 'union', 'use_snp_selection': False}. Best is trial 91 with value: 0.06275248714198164.
[I 2025-11-03 15:11:42,464] Trial 94 finished with value: 0.0334227818012039 and parameters: {'model_type': 'graphsage', 'hidden_dims': '[128, 64]', 'dropout': 0.26255726183918615, 'batch_norm': True, 'lr': 0.0006660122613181689, 'weight_decay': 9.062713787858752e-06, 'epochs': 68, 'loss': 'mse', 'optimizer': 'adam', 'graph_mode': 'knn', 'source': 'grm', 'knn_k': 8, 'weighted_edges': False, 'symmetrize_mode': 'union', 'use_snp_selection': False}. Best is trial 91 with value: 0.06275248714198164.
[I 2025-11-03 15:11:43,941] Trial 95 finished with value: 0.04526194363306017 and parameters: {'model_type': 'graphsage', 'hidden_dims': '[128, 64]', 'dropout': 0.33962365464009897, 'batch_norm': True, 'lr': 0.00040576209664432416, 'weight_decay': 0.0007037887604121043, 'epochs': 54, 'loss': 'mse', 'optimizer': 'adam', 'graph_mode': 'knn', 'source': 'grm', 'knn_k': 7, 'weighted_edges': True, 'symmetrize_mode': 'mutual', 'use_snp_selection': False}. Best is trial 91 with value: 0.06275248714198164.
