[I 2025-11-03 13:09:55,402] Trial 59 finished with value: 0.08457918041993515 and parameters: {'model_type': 'graphsage', 'hidden_dims': '[512, 128]', 'dropout': 0.3472328772440856, 'batch_norm': True, 'lr': 3.67549624350808e-05, 'weight_decay': 1.107044820872029e-06, 'epochs': 336, 'loss': 'mae', 'optimizer': 'adam', 'graph_mode': 'knn', 'source': 'grm', 'knn_k': 3, 'weighted_edges': True, 'symmetrize_mode': 'mutual', 'use_snp_selection': False}. Best is trial 33 with value: 0.14186163578646635.
[I 2025-11-03 13:09:58,105] Trial 60 finished with value: 0.10714741529306346 and parameters: {'model_type': 'graphsage', 'hidden_dims': '[256, 128]', 'dropout': 0.26964686756057793, 'batch_norm': False, 'lr': 0.00014302367447051567, 'weight_decay': 4.033837174788779e-06, 'epochs': 310, 'loss': 'mae', 'optimizer': 'adam', 'graph_mode': 'cutoff', 'cutoff': 0.6748540645527081, 'grm_norm': 'cosine_then_gcn', 'self_loops': False, 'use_snp_selection': True, 'num_snps': 19019}. Best is trial 33 with value: 0.14186163578646635.
[I 2025-11-03 13:10:01,695] Trial 61 finished with value: 0.11823778941962643 and parameters: {'model_type': 'graphsage', 'hidden_dims': '[512, 128]', 'dropout': 0.24856910988572872, 'batch_norm': True, 'lr': 0.00018842690384044457, 'weight_decay': 2.298037511991786e-06, 'epochs': 196, 'loss': 'mse', 'optimizer': 'adam', 'graph_mode': 'cutoff', 'cutoff': 0.5025863112681132, 'grm_norm': 'none', 'self_loops': False, 'use_snp_selection': False}. Best is trial 33 with value: 0.14186163578646635.
[I 2025-11-03 13:10:06,300] Trial 62 finished with value: 0.11999645673883805 and parameters: {'model_type': 'graphsage', 'hidden_dims': '[512, 128]', 'dropout': 0.31750209129068335, 'batch_norm': True, 'lr': 5.073689360507242e-05, 'weight_decay': 2.362079925631157e-05, 'epochs': 322, 'loss': 'mse', 'optimizer': 'adam', 'graph_mode': 'cutoff', 'cutoff': 0.43753297470101454, 'grm_norm': 'cosine', 'self_loops': False, 'use_snp_selection': False}. Best is trial 33 with value: 0.14186163578646635.
[I 2025-11-03 13:10:10,610] Trial 63 finished with value: 0.11739181228858325 and parameters: {'model_type': 'graphsage', 'hidden_dims': '[512, 128]', 'dropout': 0.21117209266091905, 'batch_norm': True, 'lr': 0.0008246642778610856, 'weight_decay': 5.025403542156523e-07, 'epochs': 291, 'loss': 'mae', 'optimizer': 'adam', 'graph_mode': 'cutoff', 'cutoff': 0.5459349858192931, 'grm_norm': 'cosine_then_gcn', 'self_loops': False, 'use_snp_selection': False}. Best is trial 33 with value: 0.14186163578646635.
[I 2025-11-03 13:10:13,214] Trial 64 finished with value: 0.12696287593442104 and parameters: {'model_type': 'graphsage', 'hidden_dims': '[512, 64]', 'dropout': 0.3741144167137636, 'batch_norm': True, 'lr': 0.0002848084139849629, 'weight_decay': 4.19643570900404e-06, 'epochs': 65, 'loss': 'mse', 'optimizer': 'adam', 'graph_mode': 'cutoff', 'cutoff': 0.38945782458758693, 'grm_norm': 'cosine', 'self_loops': False, 'use_snp_selection': False}. Best is trial 33 with value: 0.14186163578646635.
[I 2025-11-03 13:10:17,375] Trial 65 finished with value: 0.1317759678701264 and parameters: {'model_type': 'graphsage', 'hidden_dims': '[512, 128]', 'dropout': 0.18348033955142778, 'batch_norm': True, 'lr': 0.000511373689487494, 'weight_decay': 6.37057980803075e-06, 'epochs': 274, 'loss': 'mse', 'optimizer': 'adam', 'graph_mode': 'cutoff', 'cutoff': 0.6006314128047445, 'grm_norm': 'cosine', 'self_loops': True, 'use_snp_selection': False}. Best is trial 33 with value: 0.14186163578646635.
[I 2025-11-03 13:10:20,641] Trial 66 finished with value: 0.12489174369504887 and parameters: {'model_type': 'graphsage', 'hidden_dims': '[512, 256]', 'dropout': 0.15390150718429724, 'batch_norm': True, 'lr': 0.00035785755302024234, 'weight_decay': 6.309633775201042e-07, 'epochs': 156, 'loss': 'mse', 'optimizer': 'adam', 'graph_mode': 'cutoff', 'cutoff': 0.7646904729056074, 'grm_norm': 'cosine', 'self_loops': True, 'use_snp_selection': False}. Best is trial 33 with value: 0.14186163578646635.
[I 2025-11-03 13:10:23,035] Trial 67 finished with value: 0.11106319666316332 and parameters: {'model_type': 'graphsage', 'hidden_dims': '[128, 64]', 'dropout': 0.5661905884141796, 'batch_norm': True, 'lr': 0.00011392601770024846, 'weight_decay': 1.2651993447330165e-06, 'epochs': 305, 'loss': 'mse', 'optimizer': 'adam', 'graph_mode': 'cutoff', 'cutoff': 0.5418925989459719, 'grm_norm': 'gcn', 'self_loops': True, 'use_snp_selection': False}. Best is trial 33 with value: 0.14186163578646635.
[I 2025-11-03 13:10:27,772] Trial 68 finished with value: 0.11220388645746003 and parameters: {'model_type': 'graphsage', 'hidden_dims': '[512, 128]', 'dropout': 0.23963071028574945, 'batch_norm': True, 'lr': 0.0002319416222738223, 'weight_decay': 2.553424863870754e-07, 'epochs': 341, 'loss': 'mae', 'optimizer': 'adam', 'graph_mode': 'cutoff', 'cutoff': 0.29463119351343675, 'grm_norm': 'cosine', 'self_loops': False, 'use_snp_selection': False}. Best is trial 33 with value: 0.14186163578646635.
[I 2025-11-03 13:10:32,368] Trial 69 finished with value: 0.11863831061783794 and parameters: {'model_type': 'graphsage', 'hidden_dims': '[512, 256]', 'dropout': 0.27662127716440693, 'batch_norm': True, 'lr': 0.00041221044141274, 'weight_decay': 0.00011646387775473364, 'epochs': 318, 'loss': 'mse', 'optimizer': 'adam', 'graph_mode': 'cutoff', 'cutoff': 0.3596870877317204, 'grm_norm': 'cosine_then_gcn', 'self_loops': True, 'use_snp_selection': False}. Best is trial 33 with value: 0.14186163578646635.
[I 2025-11-03 13:10:34,911] Trial 70 finished with value: 0.10483075297529645 and parameters: {'model_type': 'graphsage', 'hidden_dims': '[256, 128]', 'dropout': 0.4769049758136098, 'batch_norm': True, 'lr': 0.0001658481259786349, 'weight_decay': 0.0005060070727028583, 'epochs': 256, 'loss': 'mse', 'optimizer': 'adam', 'graph_mode': 'cutoff', 'cutoff': 0.4346532599868617, 'grm_norm': 'cosine', 'self_loops': True, 'use_snp_selection': False}. Best is trial 33 with value: 0.14186163578646635.
[I 2025-11-03 13:10:39,024] Trial 71 finished with value: 0.12584597827390473 and parameters: {'model_type': 'graphsage', 'hidden_dims': '[512, 128]', 'dropout': 0.17374958869280224, 'batch_norm': True, 'lr': 0.0004856200807536458, 'weight_decay': 6.486893667530227e-06, 'epochs': 270, 'loss': 'mse', 'optimizer': 'adam', 'graph_mode': 'cutoff', 'cutoff': 0.5854033624603038, 'grm_norm': 'cosine', 'self_loops': True, 'use_snp_selection': False}. Best is trial 33 with value: 0.14186163578646635.
[I 2025-11-03 13:10:43,340] Trial 72 finished with value: 0.1443334714521971 and parameters: {'model_type': 'graphsage', 'hidden_dims': '[512, 128]', 'dropout': 0.19151131669449956, 'batch_norm': True, 'lr': 0.0005416135975855453, 'weight_decay': 8.803359431840375e-06, 'epochs': 290, 'loss': 'mse', 'optimizer': 'adam', 'graph_mode': 'cutoff', 'cutoff': 0.6049151305778286, 'grm_norm': 'cosine', 'self_loops': True, 'use_snp_selection': False}. Best is trial 72 with value: 0.1443334714521971.
[I 2025-11-03 13:10:47,645] Trial 73 finished with value: 0.13187796579275501 and parameters: {'model_type': 'graphsage', 'hidden_dims': '[512, 128]', 'dropout': 0.21920366679721895, 'batch_norm': True, 'lr': 0.0006651598846857794, 'weight_decay': 1.3806575410317792e-05, 'epochs': 290, 'loss': 'mse', 'optimizer': 'adam', 'graph_mode': 'cutoff', 'cutoff': 0.887505322162276, 'grm_norm': 'cosine', 'self_loops': True, 'use_snp_selection': False}. Best is trial 72 with value: 0.1443334714521971.
[I 2025-11-03 13:10:51,512] Trial 74 finished with value: 0.12228163690977895 and parameters: {'model_type': 'graphsage', 'hidden_dims': '[512, 128]', 'dropout': 0.3043912331183173, 'batch_norm': True, 'lr': 0.0008950538905758817, 'weight_decay': 8.671155182510063e-06, 'epochs': 229, 'loss': 'mse', 'optimizer': 'adam', 'graph_mode': 'cutoff', 'cutoff': 0.5164538469847412, 'grm_norm': 'cosine', 'self_loops': True, 'use_snp_selection': False}. Best is trial 72 with value: 0.1443334714521971.
[I 2025-11-03 13:10:54,576] Trial 75 finished with value: 0.1132002727069889 and parameters: {'model_type': 'graphsage', 'hidden_dims': '[256, 128, 64]', 'dropout': 0.20320040136286507, 'batch_norm': True, 'lr': 0.0002971184311824361, 'weight_decay': 2.4801045408451506e-06, 'epochs': 328, 'loss': 'mse', 'optimizer': 'adam', 'graph_mode': 'cutoff', 'cutoff': 0.6495505915021231, 'grm_norm': 'cosine', 'self_loops': True, 'use_snp_selection': False}. Best is trial 72 with value: 0.1443334714521971.
[I 2025-11-03 13:10:58,957] Trial 76 finished with value: 0.12636550843944683 and parameters: {'model_type': 'graphsage', 'hidden_dims': '[512, 256]', 'dropout': 0.24749977604069345, 'batch_norm': True, 'lr': 0.0006995944138761951, 'weight_decay': 2.128013878908446e-05, 'epochs': 300, 'loss': 'mse', 'optimizer': 'adam', 'graph_mode': 'cutoff', 'cutoff': 0.611332484083573, 'grm_norm': 'none', 'self_loops': True, 'use_snp_selection': False}. Best is trial 72 with value: 0.1443334714521971.
[I 2025-11-03 13:11:00,884] Trial 77 finished with value: 0.09198524350451093 and parameters: {'model_type': 'graphsage', 'hidden_dims': '[512, 128]', 'dropout': 0.11411112302127051, 'batch_norm': False, 'lr': 0.00037850577246463643, 'weight_decay': 3.220606735389744e-05, 'epochs': 208, 'loss': 'mse', 'optimizer': 'adam', 'graph_mode': 'knn', 'source': 'grm', 'knn_k': 5, 'weighted_edges': False, 'symmetrize_mode': 'union', 'use_snp_selection': True, 'num_snps': 5844}. Best is trial 72 with value: 0.1443334714521971.
[I 2025-11-03 13:11:04,060] Trial 78 finished with value: 0.12741538664535987 and parameters: {'model_type': 'graphsage', 'hidden_dims': '[512, 256]', 'dropout': 0.14866513224932681, 'batch_norm': True, 'lr': 0.00022066703623343554, 'weight_decay': 9.4371692187387e-06, 'epochs': 139, 'loss': 'mse', 'optimizer': 'adam', 'graph_mode': 'cutoff', 'cutoff': 0.49301135384882927, 'grm_norm': 'cosine', 'self_loops': True, 'use_snp_selection': False}. Best is trial 72 with value: 0.1443334714521971.
[I 2025-11-03 13:11:07,538] Trial 79 finished with value: 0.13247446997979362 and parameters: {'model_type': 'graphsage', 'hidden_dims': '[512, 64]', 'dropout': 0.34429916680666994, 'batch_norm': True, 'lr': 0.0005693227690569079, 'weight_decay': 1.6936154396895777e-06, 'epochs': 183, 'loss': 'mse', 'optimizer': 'adam', 'graph_mode': 'cutoff', 'cutoff': 0.3226763566471563, 'grm_norm': 'cosine', 'self_loops': True, 'use_snp_selection': False}. Best is trial 72 with value: 0.1443334714521971.
[I 2025-11-03 13:11:11,033] Trial 80 finished with value: 0.10015519648295963 and parameters: {'model_type': 'graphsage', 'hidden_dims': '[512, 64]', 'dropout': 0.3344046962375109, 'batch_norm': True, 'lr': 0.0005546401962445738, 'weight_decay': 1.751656670057326e-06, 'epochs': 185, 'loss': 'mse', 'optimizer': 'adam', 'graph_mode': 'cutoff', 'cutoff': 0.31959417464857653, 'grm_norm': 'cosine', 'self_loops': True, 'use_snp_selection': False}. Best is trial 72 with value: 0.1443334714521971.
[I 2025-11-03 13:11:13,980] Trial 81 finished with value: 0.09369617030250064 and parameters: {'model_type': 'graphsage', 'hidden_dims': '[512, 64]', 'dropout': 0.3611518040269358, 'batch_norm': True, 'lr': 0.00046080929673049983, 'weight_decay': 4.119552870773171e-06, 'epochs': 104, 'loss': 'mse', 'optimizer': 'adam', 'graph_mode': 'cutoff', 'cutoff': 0.2324150544029661, 'grm_norm': 'cosine', 'self_loops': True, 'use_snp_selection': False}. Best is trial 72 with value: 0.1443334714521971.
[I 2025-11-03 13:11:18,738] Trial 82 finished with value: 0.1096769734260849 and parameters: {'model_type': 'graphsage', 'hidden_dims': '[512, 64]', 'dropout': 0.38817995558259005, 'batch_norm': True, 'lr': 0.0006005340778879774, 'weight_decay': 3.045243888153738e-06, 'epochs': 341, 'loss': 'mse', 'optimizer': 'adam', 'graph_mode': 'cutoff', 'cutoff': 0.2738004860940397, 'grm_norm': 'cosine', 'self_loops': True, 'use_snp_selection': False}. Best is trial 72 with value: 0.1443334714521971.
[I 2025-11-03 13:11:22,051] Trial 83 finished with value: 0.12304896852738266 and parameters: {'model_type': 'graphsage', 'hidden_dims': '[512, 64]', 'dropout': 0.34624911190180735, 'batch_norm': True, 'lr': 0.0002693867189702776, 'weight_decay': 1.0680721001063852e-06, 'epochs': 164, 'loss': 'mse', 'optimizer': 'adam', 'graph_mode': 'cutoff', 'cutoff': 0.5656159663264262, 'grm_norm': 'cosine', 'self_loops': True, 'use_snp_selection': False}. Best is trial 72 with value: 0.1443334714521971.
[I 2025-11-03 13:11:26,612] Trial 84 finished with value: 0.10053498210236136 and parameters: {'model_type': 'graphsage', 'hidden_dims': '[512, 256]', 'dropout': 0.5987253113562495, 'batch_norm': True, 'lr': 0.0003216734436597711, 'weight_decay': 5.179615130074363e-06, 'epochs': 311, 'loss': 'mse', 'optimizer': 'adam', 'graph_mode': 'cutoff', 'cutoff': 0.31569162508808923, 'grm_norm': 'cosine', 'self_loops': True, 'use_snp_selection': False}. Best is trial 72 with value: 0.1443334714521971.
[I 2025-11-03 13:11:29,504] Trial 85 finished with value: 0.03964017784416715 and parameters: {'model_type': 'graphsage', 'hidden_dims': '[256, 128]', 'dropout': 0.2892477129076125, 'batch_norm': True, 'lr': 8.112791978560557e-06, 'weight_decay': 2.249775111316617e-06, 'epochs': 334, 'loss': 'mse', 'optimizer': 'adam', 'graph_mode': 'cutoff', 'cutoff': 0.39238004886037264, 'grm_norm': 'cosine', 'self_loops': True, 'use_snp_selection': False}. Best is trial 72 with value: 0.1443334714521971.
[I 2025-11-03 13:11:31,116] Trial 86 finished with value: 0.11138605039096235 and parameters: {'model_type': 'graphsage', 'hidden_dims': '[128, 64]', 'dropout': 0.3120271872126647, 'batch_norm': True, 'lr': 0.00020085695121688192, 'weight_decay': 7.686926900629151e-07, 'epochs': 122, 'loss': 'mse', 'optimizer': 'adam', 'graph_mode': 'cutoff', 'cutoff': 0.35167891951386915, 'grm_norm': 'gcn', 'self_loops': False, 'use_snp_selection': False}. Best is trial 72 with value: 0.1443334714521971.
[I 2025-11-03 13:11:35,608] Trial 87 finished with value: 0.1262147588668573 and parameters: {'model_type': 'graphsage', 'hidden_dims': '[512, 256]', 'dropout': 0.2323997097944176, 'batch_norm': True, 'lr': 0.00042060377148594275, 'weight_decay': 1.6226934547892716e-06, 'epochs': 316, 'loss': 'mae', 'optimizer': 'adam', 'graph_mode': 'cutoff', 'cutoff': 0.626561189651377, 'grm_norm': 'cosine', 'self_loops': True, 'use_snp_selection': False}. Best is trial 72 with value: 0.1443334714521971.
[I 2025-11-03 13:11:38,805] Trial 88 finished with value: -0.016626147673103782 and parameters: {'model_type': 'graphsage', 'hidden_dims': '[512, 128]', 'dropout': 0.26300383755661455, 'batch_norm': False, 'lr': 0.00095959802990309, 'weight_decay': 1.4065022641831416e-07, 'epochs': 92, 'loss': 'mse', 'optimizer': 'adam', 'graph_mode': 'cutoff', 'cutoff': 0.36295198987016314, 'grm_norm': 'cosine_then_gcn', 'self_loops': False, 'use_snp_selection': True, 'num_snps': 37039}. Best is trial 72 with value: 0.1443334714521971.
[I 2025-11-03 13:11:41,470] Trial 89 finished with value: 0.103519240892183 and parameters: {'model_type': 'graphsage', 'hidden_dims': '[256, 128]', 'dropout': 0.4246774199486767, 'batch_norm': True, 'lr': 0.00034872453787343125, 'weight_decay': 1.1631970517245027e-05, 'epochs': 204, 'loss': 'mse', 'optimizer': 'adam', 'graph_mode': 'knn', 'source': 'grm', 'knn_k': 9, 'weighted_edges': True, 'symmetrize_mode': 'mutual', 'use_snp_selection': False}. Best is trial 72 with value: 0.1443334714521971.
[I 2025-11-03 13:11:44,003] Trial 90 finished with value: 0.13596196090131174 and parameters: {'model_type': 'graphsage', 'hidden_dims': '[512, 64]', 'dropout': 0.16216400336246134, 'batch_norm': True, 'lr': 0.0007512058062521818, 'weight_decay': 3.756696539326492e-07, 'epochs': 61, 'loss': 'mse', 'optimizer': 'adam', 'graph_mode': 'cutoff', 'cutoff': 0.526632780493165, 'grm_norm': 'cosine', 'self_loops': True, 'use_snp_selection': False}. Best is trial 72 with value: 0.1443334714521971.
[I 2025-11-03 13:11:46,636] Trial 91 finished with value: 0.13592282997304073 and parameters: {'model_type': 'graphsage', 'hidden_dims': '[512, 64]', 'dropout': 0.18676802773135787, 'batch_norm': True, 'lr': 0.0007255366072050646, 'weight_decay': 3.6880512742891227e-07, 'epochs': 69, 'loss': 'mse', 'optimizer': 'adam', 'graph_mode': 'cutoff', 'cutoff': 0.5599544228427944, 'grm_norm': 'cosine', 'self_loops': True, 'use_snp_selection': False}. Best is trial 72 with value: 0.1443334714521971.
[I 2025-11-03 13:11:51,451] Trial 92 finished with value: 0.1297149592208429 and parameters: {'model_type': 'graphsage', 'hidden_dims': '[512, 64]', 'dropout': 0.17982482557742413, 'batch_norm': True, 'lr': 0.0007053014594118311, 'weight_decay': 4.022489973855964e-07, 'epochs': 350, 'loss': 'mse', 'optimizer': 'adam', 'graph_mode': 'cutoff', 'cutoff': 0.5355568606297924, 'grm_norm': 'cosine', 'self_loops': True, 'use_snp_selection': False}. Best is trial 72 with value: 0.1443334714521971.
[I 2025-11-03 13:11:54,011] Trial 93 finished with value: 0.1169009947178907 and parameters: {'model_type': 'graphsage', 'hidden_dims': '[512, 64]', 'dropout': 0.16400502938090702, 'batch_norm': True, 'lr': 0.0005619490636632668, 'weight_decay': 2.0407482311831163e-07, 'epochs': 60, 'loss': 'mse', 'optimizer': 'adam', 'graph_mode': 'cutoff', 'cutoff': 0.5723019052926941, 'grm_norm': 'cosine', 'self_loops': True, 'use_snp_selection': False}. Best is trial 72 with value: 0.1443334714521971.
[I 2025-11-03 13:11:56,704] Trial 94 finished with value: 0.12484950853728471 and parameters: {'model_type': 'graphsage', 'hidden_dims': '[512, 64]', 'dropout': 0.19380830194402426, 'batch_norm': True, 'lr': 0.0007375989619963329, 'weight_decay': 2.922660414314116e-07, 'epochs': 75, 'loss': 'mse', 'optimizer': 'adam', 'graph_mode': 'cutoff', 'cutoff': 0.5257032649566644, 'grm_norm': 'cosine', 'self_loops': True, 'use_snp_selection': False}. Best is trial 72 with value: 0.1443334714521971.
[I 2025-11-03 13:11:59,156] Trial 95 finished with value: 0.13198530571719014 and parameters: {'model_type': 'graphsage', 'hidden_dims': '[512, 64]', 'dropout': 0.1415424468825217, 'batch_norm': True, 'lr': 0.0008196036502659647, 'weight_decay': 6.487476300226667e-07, 'epochs': 47, 'loss': 'mse', 'optimizer': 'adam', 'graph_mode': 'cutoff', 'cutoff': 0.5600596441809568, 'grm_norm': 'cosine', 'self_loops': True, 'use_snp_selection': False}. Best is trial 72 with value: 0.1443334714521971.
[I 2025-11-03 13:12:01,664] Trial 96 finished with value: 0.12536473065678594 and parameters: {'model_type': 'graphsage', 'hidden_dims': '[512, 64]', 'dropout': 0.20710545910820302, 'batch_norm': True, 'lr': 0.00047022833036428784, 'weight_decay': 1.233016036589192e-07, 'epochs': 53, 'loss': 'mse', 'optimizer': 'adam', 'graph_mode': 'cutoff', 'cutoff': 0.47451160644973933, 'grm_norm': 'cosine', 'self_loops': True, 'use_snp_selection': False}. Best is trial 72 with value: 0.1443334714521971.
[I 2025-11-03 13:12:04,381] Trial 97 finished with value: 0.10962378545461574 and parameters: {'model_type': 'graphsage', 'hidden_dims': '[512, 64]', 'dropout': 0.15987784938370428, 'batch_norm': True, 'lr': 0.0008515813080162295, 'weight_decay': 3.8376821181515266e-07, 'epochs': 89, 'loss': 'mae', 'optimizer': 'adam', 'graph_mode': 'cutoff', 'cutoff': 0.6460744770310675, 'grm_norm': 'none', 'self_loops': False, 'use_snp_selection': False}. Best is trial 72 with value: 0.1443334714521971.
[I 2025-11-03 13:12:07,037] Trial 98 finished with value: 0.11536248429634664 and parameters: {'model_type': 'graphsage', 'hidden_dims': '[512, 64]', 'dropout': 0.1926193165577377, 'batch_norm': True, 'lr': 0.000588302494400746, 'weight_decay': 1.0345860097977873e-06, 'epochs': 74, 'loss': 'mse', 'optimizer': 'adam', 'graph_mode': 'cutoff', 'cutoff': 0.5983983292776095, 'grm_norm': 'cosine', 'self_loops': True, 'use_snp_selection': False}. Best is trial 72 with value: 0.1443334714521971.
[I 2025-11-03 13:12:09,109] Trial 99 finished with value: 0.021697785958897833 and parameters: {'model_type': 'graphsage', 'hidden_dims': '[256, 128, 64]', 'dropout': 0.22333153454537863, 'batch_norm': True, 'lr': 3.7930482233104258e-06, 'weight_decay': 6.90363425553608e-07, 'epochs': 113, 'loss': 'mse', 'optimizer': 'adam', 'graph_mode': 'cutoff', 'cutoff': 0.489801896121375, 'grm_norm': 'cosine', 'self_loops': False, 'use_snp_selection': False}. Best is trial 72 with value: 0.1443334714521971.
[I 2025-11-03 13:12:13,400] Trial 100 finished with value: 0.1278885559760135 and parameters: {'model_type': 'graphsage', 'hidden_dims': '[512, 256]', 'dropout': 0.13429866763956497, 'batch_norm': True, 'lr': 0.00027407002603966794, 'weight_decay': 5.349914967649728e-07, 'epochs': 279, 'loss': 'mse', 'optimizer': 'adam', 'graph_mode': 'cutoff', 'cutoff': 0.5526055659797853, 'grm_norm': 'cosine_then_gcn', 'self_loops': True, 'use_snp_selection': False}. Best is trial 72 with value: 0.1443334714521971.
[I 2025-11-03 13:12:16,514] Trial 101 finished with value: 0.10638934514436446 and parameters: {'model_type': 'graphsage', 'hidden_dims': '[512, 128]', 'dropout': 0.16787734129582205, 'batch_norm': True, 'lr': 0.0004020671299830135, 'weight_decay': 1.3560024069016207e-06, 'epochs': 131, 'loss': 'mse', 'optimizer': 'adam', 'graph_mode': 'cutoff', 'cutoff': 0.5831833216587188, 'grm_norm': 'cosine', 'self_loops': True, 'use_snp_selection': False}. Best is trial 72 with value: 0.1443334714521971.
[I 2025-11-03 13:12:19,143] Trial 102 finished with value: 0.12533358225192892 and parameters: {'model_type': 'graphsage', 'hidden_dims': '[256, 128]', 'dropout': 0.2940265212882882, 'batch_norm': True, 'lr': 0.0005091236729503043, 'weight_decay': 1.69707755947827e-07, 'epochs': 263, 'loss': 'mse', 'optimizer': 'adam', 'graph_mode': 'cutoff', 'cutoff': 0.408714698345574, 'grm_norm': 'cosine', 'self_loops': True, 'use_snp_selection': False}. Best is trial 72 with value: 0.1443334714521971.
