[I 2025-11-03 11:54:00,159] Trial 88 finished with value: 0.02474789052934741 and parameters: {'model_type': 'gcn', 'hidden_dims': '[512, 128]', 'dropout': 0.5372309044544579, 'batch_norm': True, 'lr': 0.0006556640389888072, 'weight_decay': 1.3008080769659345e-06, 'epochs': 7, 'loss': 'mae', 'optimizer': 'adam', 'graph_mode': 'cutoff', 'cutoff': 0.8030031664383689, 'grm_norm': 'cosine', 'self_loops': True, 'use_snp_selection': True, 'num_snps': 31410}. Best is trial 51 with value: 0.08379407168685457.
[I 2025-11-03 11:54:02,449] Trial 89 finished with value: 0.05176415902994677 and parameters: {'model_type': 'gcn', 'hidden_dims': '[512, 128]', 'dropout': 0.518099328368455, 'batch_norm': True, 'lr': 0.0004451060605668524, 'weight_decay': 4.2781927881132077e-07, 'epochs': 38, 'loss': 'mae', 'optimizer': 'adam', 'graph_mode': 'knn', 'source': 'grm', 'knn_k': 6, 'weighted_edges': True, 'symmetrize_mode': 'mutual', 'use_snp_selection': True, 'num_snps': 34905}. Best is trial 51 with value: 0.08379407168685457.
[I 2025-11-03 11:54:05,295] Trial 90 finished with value: 0.06676239109626686 and parameters: {'model_type': 'gcn', 'hidden_dims': '[512, 128]', 'dropout': 0.5727958022715792, 'batch_norm': True, 'lr': 0.00033188296624012256, 'weight_decay': 2.1843310772238998e-05, 'epochs': 49, 'loss': 'mae', 'optimizer': 'adam', 'graph_mode': 'knn', 'source': 'grm', 'knn_k': 8, 'weighted_edges': True, 'symmetrize_mode': 'mutual', 'use_snp_selection': True, 'num_snps': 48290}. Best is trial 51 with value: 0.08379407168685457.
[I 2025-11-03 11:54:08,568] Trial 91 finished with value: 0.07797679433157688 and parameters: {'model_type': 'gcn', 'hidden_dims': '[512, 128]', 'dropout': 0.4776107423333762, 'batch_norm': True, 'lr': 0.0008288485483976773, 'weight_decay': 1.6656530858874633e-06, 'epochs': 74, 'loss': 'mae', 'optimizer': 'adam', 'graph_mode': 'knn', 'source': 'grm', 'knn_k': 7, 'weighted_edges': True, 'symmetrize_mode': 'union', 'use_snp_selection': True, 'num_snps': 54984}. Best is trial 51 with value: 0.08379407168685457.
[I 2025-11-03 11:54:11,830] Trial 92 finished with value: 0.07053056467441222 and parameters: {'model_type': 'gcn', 'hidden_dims': '[512, 128]', 'dropout': 0.4888271601465909, 'batch_norm': True, 'lr': 0.0008473528632261493, 'weight_decay': 2.2282175399014043e-06, 'epochs': 76, 'loss': 'mae', 'optimizer': 'adam', 'graph_mode': 'knn', 'source': 'grm', 'knn_k': 7, 'weighted_edges': True, 'symmetrize_mode': 'mutual', 'use_snp_selection': True, 'num_snps': 54720}. Best is trial 51 with value: 0.08379407168685457.
[I 2025-11-03 11:54:14,498] Trial 93 finished with value: 0.06147263539353769 and parameters: {'model_type': 'gcn', 'hidden_dims': '[512, 128]', 'dropout': 0.4820939910920744, 'batch_norm': True, 'lr': 0.0006740697931375627, 'weight_decay': 3.7179493543520376e-06, 'epochs': 63, 'loss': 'mae', 'optimizer': 'adam', 'graph_mode': 'knn', 'source': 'grm', 'knn_k': 7, 'weighted_edges': True, 'symmetrize_mode': 'union', 'use_snp_selection': True, 'num_snps': 41598}. Best is trial 51 with value: 0.08379407168685457.
[I 2025-11-03 11:54:18,212] Trial 94 finished with value: 0.05255302122897772 and parameters: {'model_type': 'gcn', 'hidden_dims': '[512, 128]', 'dropout': 0.27714993431758145, 'batch_norm': True, 'lr': 0.0005536529193117233, 'weight_decay': 1.0289696893601358e-06, 'epochs': 143, 'loss': 'mae', 'optimizer': 'adam', 'graph_mode': 'knn', 'source': 'grm', 'knn_k': 7, 'weighted_edges': True, 'symmetrize_mode': 'union', 'use_snp_selection': True, 'num_snps': 56253}. Best is trial 51 with value: 0.08379407168685457.
[I 2025-11-03 11:54:20,468] Trial 95 finished with value: 0.09464136209494968 and parameters: {'model_type': 'gcn', 'hidden_dims': '[512, 128]', 'dropout': 0.5044886270354281, 'batch_norm': True, 'lr': 0.0008432707446621671, 'weight_decay': 3.103311628260526e-06, 'epochs': 100, 'loss': 'mae', 'optimizer': 'adam', 'graph_mode': 'knn', 'source': 'grm', 'knn_k': 8, 'weighted_edges': True, 'symmetrize_mode': 'union', 'use_snp_selection': True, 'num_snps': 27820}. Best is trial 95 with value: 0.09464136209494968.
[I 2025-11-03 11:54:22,709] Trial 96 finished with value: 0.05096404723789333 and parameters: {'model_type': 'gcn', 'hidden_dims': '[128, 64]', 'dropout': 0.5061506932997102, 'batch_norm': True, 'lr': 0.00047047082574973217, 'weight_decay': 3.1967411755836173e-06, 'epochs': 181, 'loss': 'mae', 'optimizer': 'adam', 'graph_mode': 'knn', 'source': 'grm', 'knn_k': 8, 'weighted_edges': False, 'symmetrize_mode': 'union', 'use_snp_selection': True, 'num_snps': 26505}. Best is trial 95 with value: 0.09464136209494968.
[I 2025-11-03 11:54:25,095] Trial 97 finished with value: 0.05565335525455176 and parameters: {'model_type': 'gcn', 'hidden_dims': '[512, 128]', 'dropout': 0.535377056458211, 'batch_norm': True, 'lr': 0.00029491755415215776, 'weight_decay': 5.436362101191808e-06, 'epochs': 104, 'loss': 'mae', 'optimizer': 'adam', 'graph_mode': 'knn', 'source': 'grm', 'knn_k': 8, 'weighted_edges': True, 'symmetrize_mode': 'mutual', 'use_snp_selection': True, 'num_snps': 30149}. Best is trial 95 with value: 0.09464136209494968.
[I 2025-11-03 11:54:27,569] Trial 98 finished with value: 0.016456544422483406 and parameters: {'model_type': 'gcn', 'hidden_dims': '[256, 128, 64]', 'dropout': 0.5511928982137964, 'batch_norm': True, 'lr': 8.788097233821814e-05, 'weight_decay': 1.44633552887964e-06, 'epochs': 117, 'loss': 'mae', 'optimizer': 'adam', 'graph_mode': 'knn', 'source': 'grm', 'knn_k': 8, 'weighted_edges': True, 'symmetrize_mode': 'union', 'use_snp_selection': True, 'num_snps': 32812}. Best is trial 95 with value: 0.09464136209494968.
[I 2025-11-03 11:54:30,704] Trial 99 finished with value: 0.07600925470642846 and parameters: {'model_type': 'gcn', 'hidden_dims': '[512, 128]', 'dropout': 0.5175513120941506, 'batch_norm': True, 'lr': 0.0008346208168895416, 'weight_decay': 1.745314157998742e-06, 'epochs': 96, 'loss': 'mae', 'optimizer': 'adam', 'graph_mode': 'knn', 'source': 'grm', 'knn_k': 6, 'weighted_edges': True, 'symmetrize_mode': 'union', 'use_snp_selection': True, 'num_snps': 48999}. Best is trial 95 with value: 0.09464136209494968.
[I 2025-11-03 11:54:32,513] Trial 100 finished with value: 0.06940626447755682 and parameters: {'model_type': 'gcn', 'hidden_dims': '[128, 64]', 'dropout': 0.502881087401233, 'batch_norm': True, 'lr': 0.0006825348030620573, 'weight_decay': 2.384355280097411e-06, 'epochs': 83, 'loss': 'mae', 'optimizer': 'adam', 'graph_mode': 'knn', 'source': 'grm', 'knn_k': 8, 'weighted_edges': True, 'symmetrize_mode': 'union', 'use_snp_selection': True, 'num_snps': 22768}. Best is trial 95 with value: 0.09464136209494968.
[I 2025-11-03 11:54:35,341] Trial 101 finished with value: 0.04313958769542171 and parameters: {'model_type': 'gcn', 'hidden_dims': '[512, 128]', 'dropout': 0.46859976781418233, 'batch_norm': True, 'lr': 0.0008630039195096109, 'weight_decay': 1.0904551538547205e-05, 'epochs': 74, 'loss': 'mae', 'optimizer': 'adam', 'graph_mode': 'knn', 'source': 'grm', 'knn_k': 7, 'weighted_edges': True, 'symmetrize_mode': 'union', 'use_snp_selection': True, 'num_snps': 44775}. Best is trial 95 with value: 0.09464136209494968.
[I 2025-11-03 11:54:37,462] Trial 102 finished with value: 0.06065262411902921 and parameters: {'model_type': 'gcn', 'hidden_dims': '[512, 128]', 'dropout': 0.45363789442010055, 'batch_norm': True, 'lr': 0.0005947851257872738, 'weight_decay': 6.638365649065134e-07, 'epochs': 52, 'loss': 'mae', 'optimizer': 'adam', 'graph_mode': 'knn', 'source': 'grm', 'knn_k': 7, 'weighted_edges': True, 'symmetrize_mode': 'union', 'use_snp_selection': True, 'num_snps': 29174}. Best is trial 95 with value: 0.09464136209494968.
[I 2025-11-03 11:54:40,851] Trial 103 finished with value: 0.0671670290167773 and parameters: {'model_type': 'gcn', 'hidden_dims': '[512, 128]', 'dropout': 0.4838271879641973, 'batch_norm': True, 'lr': 0.0004097054757146841, 'weight_decay': 3.249809000564671e-05, 'epochs': 66, 'loss': 'mae', 'optimizer': 'adam', 'graph_mode': 'knn', 'source': 'grm', 'knn_k': 6, 'weighted_edges': True, 'symmetrize_mode': 'union', 'use_snp_selection': True, 'num_snps': 59836}. Best is trial 95 with value: 0.09464136209494968.
[I 2025-11-03 11:54:43,737] Trial 104 finished with value: 0.06277720622361703 and parameters: {'model_type': 'gcn', 'hidden_dims': '[512, 128]', 'dropout': 0.5262910663901339, 'batch_norm': True, 'lr': 0.000759809768997228, 'weight_decay': 4.53819041994542e-07, 'epochs': 139, 'loss': 'mae', 'optimizer': 'adam', 'graph_mode': 'knn', 'source': 'grm', 'knn_k': 8, 'weighted_edges': True, 'symmetrize_mode': 'union', 'use_snp_selection': True, 'num_snps': 39530}. Best is trial 95 with value: 0.09464136209494968.
[I 2025-11-03 11:54:47,324] Trial 105 finished with value: 0.017788401236438642 and parameters: {'model_type': 'gcn', 'hidden_dims': '[512, 128]', 'dropout': 0.49514045057908396, 'batch_norm': False, 'lr': 0.000922262673698737, 'weight_decay': 1.0510519917753068e-06, 'epochs': 126, 'loss': 'mae', 'optimizer': 'adam', 'graph_mode': 'knn', 'source': 'grm', 'knn_k': 9, 'weighted_edges': True, 'symmetrize_mode': 'union', 'use_snp_selection': True, 'num_snps': 56913}. Best is trial 95 with value: 0.09464136209494968.
[I 2025-11-03 11:54:49,040] Trial 106 finished with value: 0.06293894817634597 and parameters: {'model_type': 'gcn', 'hidden_dims': '[512, 128]', 'dropout': 0.5412627796299109, 'batch_norm': True, 'lr': 0.0002253048613248297, 'weight_decay': 7.726592488887945e-06, 'epochs': 36, 'loss': 'mae', 'optimizer': 'adam', 'graph_mode': 'cutoff', 'cutoff': 0.4171192520169613, 'grm_norm': 'cosine_then_gcn', 'self_loops': True, 'use_snp_selection': True, 'num_snps': 21354}. Best is trial 95 with value: 0.09464136209494968.
[I 2025-11-03 11:54:50,412] Trial 107 finished with value: 0.031808120044527696 and parameters: {'model_type': 'gcn', 'hidden_dims': '[512, 128]', 'dropout': 0.47585221846350567, 'batch_norm': True, 'lr': 0.0005394997840478021, 'weight_decay': 1.0463827880867279e-07, 'epochs': 22, 'loss': 'mae', 'optimizer': 'adam', 'graph_mode': 'knn', 'source': 'grm', 'knn_k': 5, 'weighted_edges': True, 'symmetrize_mode': 'union', 'use_snp_selection': True, 'num_snps': 12261}. Best is trial 95 with value: 0.09464136209494968.
[I 2025-11-03 11:54:53,330] Trial 108 finished with value: 0.0487451176258246 and parameters: {'model_type': 'gcn', 'hidden_dims': '[256, 128]', 'dropout': 0.5564264436324907, 'batch_norm': True, 'lr': 0.0006532990626500057, 'weight_decay': 1.5618152695264268e-05, 'epochs': 92, 'loss': 'mae', 'optimizer': 'adam', 'graph_mode': 'knn', 'source': 'grm', 'knn_k': 7, 'weighted_edges': True, 'symmetrize_mode': 'union', 'use_snp_selection': True, 'num_snps': 51252}. Best is trial 95 with value: 0.09464136209494968.
[I 2025-11-03 11:54:56,067] Trial 109 finished with value: 0.04917676930571868 and parameters: {'model_type': 'gcn', 'hidden_dims': '[128, 64]', 'dropout': 0.43031710089328606, 'batch_norm': True, 'lr': 0.0007840008973552659, 'weight_decay': 4.273787079281612e-06, 'epochs': 159, 'loss': 'mse', 'optimizer': 'adam', 'graph_mode': 'knn', 'source': 'grm', 'knn_k': 8, 'weighted_edges': True, 'symmetrize_mode': 'mutual', 'use_snp_selection': True, 'num_snps': 45704}. Best is trial 95 with value: 0.09464136209494968.
[I 2025-11-03 11:54:58,772] Trial 110 finished with value: 0.04105381556384916 and parameters: {'model_type': 'gcn', 'hidden_dims': '[512, 64]', 'dropout': 0.4577840447373793, 'batch_norm': True, 'lr': 0.00047707786654596537, 'weight_decay': 1.5360911071139452e-06, 'epochs': 152, 'loss': 'mae', 'optimizer': 'adam', 'graph_mode': 'knn', 'source': 'grm', 'knn_k': 9, 'weighted_edges': False, 'symmetrize_mode': 'union', 'use_snp_selection': True, 'num_snps': 33654}. Best is trial 95 with value: 0.09464136209494968.
[I 2025-11-03 11:55:00,216] Trial 111 finished with value: 0.02521296645007138 and parameters: {'model_type': 'gcn', 'hidden_dims': '[256, 128, 64]', 'dropout': 0.45091054523669916, 'batch_norm': True, 'lr': 0.0009390516154128556, 'weight_decay': 2.1646940874848354e-06, 'epochs': 59, 'loss': 'mae', 'optimizer': 'adam', 'graph_mode': 'knn', 'source': 'grm', 'knn_k': 9, 'weighted_edges': True, 'symmetrize_mode': 'union', 'use_snp_selection': False}. Best is trial 95 with value: 0.09464136209494968.
[I 2025-11-03 11:55:02,007] Trial 112 finished with value: 0.05921327775380044 and parameters: {'model_type': 'gcn', 'hidden_dims': '[512, 128]', 'dropout': 0.5034354167479081, 'batch_norm': True, 'lr': 0.0009952189768818046, 'weight_decay': 0.000802424545037736, 'epochs': 83, 'loss': 'mae', 'optimizer': 'adam', 'graph_mode': 'knn', 'source': 'grm', 'knn_k': 8, 'weighted_edges': True, 'symmetrize_mode': 'union', 'use_snp_selection': False}. Best is trial 95 with value: 0.09464136209494968.
[I 2025-11-03 11:55:03,926] Trial 113 finished with value: 0.06677762227013076 and parameters: {'model_type': 'gcn', 'hidden_dims': '[512, 128]', 'dropout': 0.4659698471519583, 'batch_norm': True, 'lr': 0.0007370124463456285, 'weight_decay': 2.9780752172319e-06, 'epochs': 105, 'loss': 'mae', 'optimizer': 'adam', 'graph_mode': 'knn', 'source': 'grm', 'knn_k': 7, 'weighted_edges': True, 'symmetrize_mode': 'union', 'use_snp_selection': False}. Best is trial 95 with value: 0.09464136209494968.
[I 2025-11-03 11:55:05,649] Trial 114 finished with value: 0.06997354142284412 and parameters: {'model_type': 'gcn', 'hidden_dims': '[512, 256]', 'dropout': 0.4409146260680175, 'batch_norm': True, 'lr': 0.000639020684976222, 'weight_decay': 2.2676066850147743e-05, 'epochs': 72, 'loss': 'mae', 'optimizer': 'adam', 'graph_mode': 'knn', 'source': 'grm', 'knn_k': 7, 'weighted_edges': True, 'symmetrize_mode': 'union', 'use_snp_selection': False}. Best is trial 95 with value: 0.09464136209494968.
[I 2025-11-03 11:55:08,570] Trial 115 finished with value: 0.053228528865354514 and parameters: {'model_type': 'gcn', 'hidden_dims': '[512, 128]', 'dropout': 0.3668845346464176, 'batch_norm': True, 'lr': 0.0009905932448486681, 'weight_decay': 8.442876421923419e-07, 'epochs': 113, 'loss': 'mae', 'optimizer': 'adam', 'graph_mode': 'knn', 'source': 'grm', 'knn_k': 8, 'weighted_edges': True, 'symmetrize_mode': 'union', 'use_snp_selection': True, 'num_snps': 43349}. Best is trial 95 with value: 0.09464136209494968.
[I 2025-11-03 11:55:10,441] Trial 116 finished with value: 0.018825786779602387 and parameters: {'model_type': 'gcn', 'hidden_dims': '[512, 128]', 'dropout': 0.5179143823266705, 'batch_norm': True, 'lr': 1.0388831387250544e-06, 'weight_decay': 1.2533699129762112e-06, 'epochs': 87, 'loss': 'mae', 'optimizer': 'adam', 'graph_mode': 'knn', 'source': 'grm', 'knn_k': 9, 'weighted_edges': True, 'symmetrize_mode': 'union', 'use_snp_selection': False}. Best is trial 95 with value: 0.09464136209494968.
[I 2025-11-03 11:55:11,581] Trial 117 finished with value: 0.051383823694002684 and parameters: {'model_type': 'gcn', 'hidden_dims': '[128, 64]', 'dropout': 0.4852688098244462, 'batch_norm': True, 'lr': 0.000855813609434037, 'weight_decay': 9.043419516588904e-06, 'epochs': 46, 'loss': 'mae', 'optimizer': 'adam', 'graph_mode': 'knn', 'source': 'grm', 'knn_k': 6, 'weighted_edges': True, 'symmetrize_mode': 'union', 'use_snp_selection': False}. Best is trial 95 with value: 0.09464136209494968.
[I 2025-11-03 11:55:13,324] Trial 118 finished with value: 0.05979884395544953 and parameters: {'model_type': 'gcn', 'hidden_dims': '[512, 256]', 'dropout': 0.3862852420556168, 'batch_norm': True, 'lr': 0.0005805558507409726, 'weight_decay': 2.6508737235595673e-06, 'epochs': 96, 'loss': 'mse', 'optimizer': 'adam', 'graph_mode': 'knn', 'source': 'grm', 'knn_k': 8, 'weighted_edges': True, 'symmetrize_mode': 'union', 'use_snp_selection': True, 'num_snps': 15809}. Best is trial 95 with value: 0.09464136209494968.
[I 2025-11-03 11:55:15,066] Trial 119 finished with value: -0.06264587038191417 and parameters: {'model_type': 'gcn', 'hidden_dims': '[512, 128]', 'dropout': 0.49755734268841834, 'batch_norm': False, 'lr': 0.0007344002608149276, 'weight_decay': 1.2348505459162584e-05, 'epochs': 78, 'loss': 'mae', 'optimizer': 'adam', 'graph_mode': 'knn', 'source': 'grm', 'knn_k': 7, 'weighted_edges': True, 'symmetrize_mode': 'union', 'use_snp_selection': False}. Best is trial 95 with value: 0.09464136209494968.
[I 2025-11-03 11:55:17,626] Trial 120 finished with value: 0.07754961968913872 and parameters: {'model_type': 'gcn', 'hidden_dims': '[256, 128]', 'dropout': 0.5107402948144286, 'batch_norm': True, 'lr': 0.0003735909566635369, 'weight_decay': 3.805078204247294e-06, 'epochs': 67, 'loss': 'mae', 'optimizer': 'adam', 'graph_mode': 'cutoff', 'cutoff': 0.21219363038692124, 'grm_norm': 'none', 'self_loops': False, 'use_snp_selection': True, 'num_snps': 47499}. Best is trial 95 with value: 0.09464136209494968.
[I 2025-11-03 11:55:20,193] Trial 121 finished with value: 0.031487687457803115 and parameters: {'model_type': 'gcn', 'hidden_dims': '[256, 128]', 'dropout': 0.505572616085505, 'batch_norm': True, 'lr': 0.00037849254823665754, 'weight_decay': 6.365336177649461e-06, 'epochs': 54, 'loss': 'mae', 'optimizer': 'adam', 'graph_mode': 'cutoff', 'cutoff': 0.20918213723478044, 'grm_norm': 'none', 'self_loops': False, 'use_snp_selection': True, 'num_snps': 47623}. Best is trial 95 with value: 0.09464136209494968.
[I 2025-11-03 11:55:22,987] Trial 122 finished with value: 0.034989538758359855 and parameters: {'model_type': 'gcn', 'hidden_dims': '[256, 128]', 'dropout': 0.5289155756641186, 'batch_norm': True, 'lr': 0.0005014330047323065, 'weight_decay': 3.904637977829935e-06, 'epochs': 69, 'loss': 'mae', 'optimizer': 'adam', 'graph_mode': 'cutoff', 'cutoff': 0.33868353565759973, 'grm_norm': 'none', 'self_loops': False, 'use_snp_selection': True, 'num_snps': 52180}. Best is trial 95 with value: 0.09464136209494968.
[I 2025-11-03 11:55:24,899] Trial 123 finished with value: 0.06122948078939202 and parameters: {'model_type': 'gcn', 'hidden_dims': '[256, 128]', 'dropout': 0.4773126819055466, 'batch_norm': True, 'lr': 0.0008533447400948078, 'weight_decay': 1.717558145179491e-06, 'epochs': 60, 'loss': 'mae', 'optimizer': 'adam', 'graph_mode': 'cutoff', 'cutoff': 0.4483729224963398, 'grm_norm': 'none', 'self_loops': False, 'use_snp_selection': True, 'num_snps': 28029}. Best is trial 95 with value: 0.09464136209494968.
[I 2025-11-03 11:55:28,158] Trial 124 finished with value: 0.04872188496791771 and parameters: {'model_type': 'gcn', 'hidden_dims': '[512, 256]', 'dropout': 0.5132906917350528, 'batch_norm': True, 'lr': 0.00042642031344712253, 'weight_decay': 2.795556883075059e-06, 'epochs': 80, 'loss': 'mae', 'optimizer': 'adam', 'graph_mode': 'cutoff', 'cutoff': 0.3155512553171437, 'grm_norm': 'none', 'self_loops': False, 'use_snp_selection': True, 'num_snps': 56736}. Best is trial 95 with value: 0.09464136209494968.
[I 2025-11-03 11:55:30,467] Trial 125 finished with value: 0.07239488444997819 and parameters: {'model_type': 'gcn', 'hidden_dims': '[512, 128]', 'dropout': 0.40641806198871794, 'batch_norm': True, 'lr': 0.0006649090511446376, 'weight_decay': 4.968332851875141e-06, 'epochs': 172, 'loss': 'mae', 'optimizer': 'adam', 'graph_mode': 'cutoff', 'cutoff': 0.4998176577534795, 'grm_norm': 'none', 'self_loops': False, 'use_snp_selection': True, 'num_snps': 25379}. Best is trial 95 with value: 0.09464136209494968.
[I 2025-11-03 11:55:31,957] Trial 126 finished with value: 0.06574205903773876 and parameters: {'model_type': 'gcn', 'hidden_dims': '[256, 128]', 'dropout': 0.4856104826454844, 'batch_norm': True, 'lr': 0.0009988792809700383, 'weight_decay': 1.84592118520397e-05, 'epochs': 100, 'loss': 'mae', 'optimizer': 'adam', 'graph_mode': 'knn', 'source': 'grm', 'knn_k': 9, 'weighted_edges': True, 'symmetrize_mode': 'mutual', 'use_snp_selection': False}. Best is trial 95 with value: 0.09464136209494968.
[I 2025-11-03 11:55:35,027] Trial 127 finished with value: 0.08321834507014701 and parameters: {'model_type': 'gcn', 'hidden_dims': '[512, 128]', 'dropout': 0.46827929849080335, 'batch_norm': True, 'lr': 0.0005522072684337853, 'weight_decay': 0.00024794480210224806, 'epochs': 89, 'loss': 'mae', 'optimizer': 'adam', 'graph_mode': 'knn', 'source': 'grm', 'knn_k': 10, 'weighted_edges': True, 'symmetrize_mode': 'union', 'use_snp_selection': True, 'num_snps': 50407}. Best is trial 95 with value: 0.09464136209494968.
[I 2025-11-03 11:55:38,050] Trial 128 finished with value: 0.04286164029291086 and parameters: {'model_type': 'gcn', 'hidden_dims': '[512, 128]', 'dropout': 0.31581767385023535, 'batch_norm': True, 'lr': 1.2744715697976041e-05, 'weight_decay': 0.00018056201696591706, 'epochs': 67, 'loss': 'mae', 'optimizer': 'adam', 'graph_mode': 'knn', 'source': 'grm', 'knn_k': 9, 'weighted_edges': True, 'symmetrize_mode': 'union', 'use_snp_selection': True, 'num_snps': 50342}. Best is trial 95 with value: 0.09464136209494968.
[I 2025-11-03 11:55:41,930] Trial 129 finished with value: 0.04736728991888296 and parameters: {'model_type': 'gcn', 'hidden_dims': '[512, 128]', 'dropout': 0.5203012421038425, 'batch_norm': True, 'lr': 0.00034866504335066037, 'weight_decay': 3.2746787123288156e-07, 'epochs': 200, 'loss': 'mse', 'optimizer': 'adam', 'graph_mode': 'knn', 'source': 'grm', 'knn_k': 8, 'weighted_edges': True, 'symmetrize_mode': 'union', 'use_snp_selection': True, 'num_snps': 53979}. Best is trial 95 with value: 0.09464136209494968.
[I 2025-11-03 11:55:44,182] Trial 130 finished with value: 0.04109793032342696 and parameters: {'model_type': 'gcn', 'hidden_dims': '[512, 128]', 'dropout': 0.5351512452621807, 'batch_norm': True, 'lr': 0.0005387309621620925, 'weight_decay': 2.003427205834842e-06, 'epochs': 26, 'loss': 'mae', 'optimizer': 'adam', 'graph_mode': 'cutoff', 'cutoff': 0.27703312080464515, 'grm_norm': 'none', 'self_loops': False, 'use_snp_selection': True, 'num_snps': 37494}. Best is trial 95 with value: 0.09464136209494968.
