[I 2025-10-22 00:06:29,389] Trial 138 finished with value: 0.18679814001140987 and parameters: {'model_type': 'gat', 'hidden_dims': '[256, 128, 64]', 'dropout': 0.19472783728041324, 'batch_norm': False, 'gat_heads': 5, 'gat_attn_dropout': 0.25349840293031417, 'gat_concat_hidden': True, 'lr': 0.0007440778860687439, 'weight_decay': 0.000508652154557502, 'epochs': 244, 'loss': 'mae', 'optimizer': 'adam', 'graph_mode': 'knn', 'source': 'grm', 'knn_k': 5, 'weighted_edges': False, 'symmetrize_mode': 'mutual'}. Best is trial 109 with value: 0.2779994139152295.
[I 2025-10-22 00:08:53,509] Trial 139 finished with value: 0.2275769968188182 and parameters: {'model_type': 'gat', 'hidden_dims': '[256, 128, 64]', 'dropout': 0.2201274229841589, 'batch_norm': False, 'gat_heads': 4, 'gat_attn_dropout': 0.26287884907176, 'gat_concat_hidden': True, 'lr': 0.0008627501688556875, 'weight_decay': 0.0007664565282541959, 'epochs': 227, 'loss': 'mae', 'optimizer': 'adam', 'graph_mode': 'cutoff', 'cutoff': 0.635765400933091, 'grm_norm': 'cosine', 'self_loops': True}. Best is trial 109 with value: 0.2779994139152295.
[I 2025-10-22 00:12:31,549] Trial 140 finished with value: 0.257971406606342 and parameters: {'model_type': 'gat', 'hidden_dims': '[256, 128, 64]', 'dropout': 0.18311327475885042, 'batch_norm': False, 'gat_heads': 5, 'gat_attn_dropout': 0.14821952375535088, 'gat_concat_hidden': True, 'lr': 0.0009875589402677648, 'weight_decay': 0.000851359778437396, 'epochs': 254, 'loss': 'mae', 'optimizer': 'adam', 'graph_mode': 'cutoff', 'cutoff': 0.899969718967296, 'grm_norm': 'none', 'self_loops': False}. Best is trial 109 with value: 0.2779994139152295.
[I 2025-10-22 00:15:57,589] Trial 141 finished with value: 0.26151119354523056 and parameters: {'model_type': 'gat', 'hidden_dims': '[256, 128, 64]', 'dropout': 0.22936347715591826, 'batch_norm': False, 'gat_heads': 5, 'gat_attn_dropout': 0.15141608276841048, 'gat_concat_hidden': True, 'lr': 0.0008514525008054076, 'weight_decay': 0.0009905194031766716, 'epochs': 240, 'loss': 'mae', 'optimizer': 'adam', 'graph_mode': 'cutoff', 'cutoff': 0.8875122562634371, 'grm_norm': 'none', 'self_loops': False}. Best is trial 109 with value: 0.2779994139152295.
[I 2025-10-22 00:19:31,978] Trial 142 finished with value: 0.24597719792274617 and parameters: {'model_type': 'gat', 'hidden_dims': '[256, 128, 64]', 'dropout': 0.18291111518448902, 'batch_norm': False, 'gat_heads': 5, 'gat_attn_dropout': 0.1599935918685921, 'gat_concat_hidden': True, 'lr': 0.0009557288125544929, 'weight_decay': 0.0006587653600038626, 'epochs': 250, 'loss': 'mae', 'optimizer': 'adam', 'graph_mode': 'cutoff', 'cutoff': 0.8984669652853764, 'grm_norm': 'none', 'self_loops': False}. Best is trial 109 with value: 0.2779994139152295.
[I 2025-10-22 00:23:12,013] Trial 143 finished with value: 0.25333865385620696 and parameters: {'model_type': 'gat', 'hidden_dims': '[256, 128, 64]', 'dropout': 0.19698707659402354, 'batch_norm': False, 'gat_heads': 5, 'gat_attn_dropout': 0.1853739710645046, 'gat_concat_hidden': True, 'lr': 0.000833763327215154, 'weight_decay': 0.0009006933228461637, 'epochs': 257, 'loss': 'mae', 'optimizer': 'adam', 'graph_mode': 'cutoff', 'cutoff': 0.876859832294496, 'grm_norm': 'none', 'self_loops': False}. Best is trial 109 with value: 0.2779994139152295.
[I 2025-10-22 00:26:51,570] Trial 144 finished with value: 0.2602473128883042 and parameters: {'model_type': 'gat', 'hidden_dims': '[256, 128, 64]', 'dropout': 0.23451099130812275, 'batch_norm': False, 'gat_heads': 5, 'gat_attn_dropout': 0.18202353137503616, 'gat_concat_hidden': True, 'lr': 0.0008274003007287537, 'weight_decay': 0.0009463286311090862, 'epochs': 257, 'loss': 'mae', 'optimizer': 'adam', 'graph_mode': 'cutoff', 'cutoff': 0.8728829746708052, 'grm_norm': 'none', 'self_loops': False}. Best is trial 109 with value: 0.2779994139152295.
[I 2025-10-22 00:30:18,102] Trial 145 finished with value: 0.2503906398675987 and parameters: {'model_type': 'gat', 'hidden_dims': '[256, 128, 64]', 'dropout': 0.1945720696660439, 'batch_norm': False, 'gat_heads': 5, 'gat_attn_dropout': 0.16666866765367824, 'gat_concat_hidden': True, 'lr': 0.0008015306808707178, 'weight_decay': 0.0009531491142304641, 'epochs': 241, 'loss': 'mae', 'optimizer': 'adam', 'graph_mode': 'cutoff', 'cutoff': 0.869247719114085, 'grm_norm': 'none', 'self_loops': False}. Best is trial 109 with value: 0.2779994139152295.
[I 2025-10-22 00:33:57,140] Trial 146 finished with value: 0.24549861711771964 and parameters: {'model_type': 'gat', 'hidden_dims': '[256, 128, 64]', 'dropout': 0.23734373875091636, 'batch_norm': False, 'gat_heads': 5, 'gat_attn_dropout': 0.14095463816126613, 'gat_concat_hidden': True, 'lr': 0.000991588216426239, 'weight_decay': 0.000567183951687605, 'epochs': 256, 'loss': 'mae', 'optimizer': 'adam', 'graph_mode': 'cutoff', 'cutoff': 0.8997391958738471, 'grm_norm': 'gcn', 'self_loops': False}. Best is trial 109 with value: 0.2779994139152295.
[I 2025-10-22 00:37:41,663] Trial 147 finished with value: 0.22712664903823807 and parameters: {'model_type': 'gat', 'hidden_dims': '[256, 128, 64]', 'dropout': 0.211448223531952, 'batch_norm': False, 'gat_heads': 5, 'gat_attn_dropout': 0.13094306829466054, 'gat_concat_hidden': True, 'lr': 0.0007112653069252223, 'weight_decay': 0.0006877818912599296, 'epochs': 263, 'loss': 'mae', 'optimizer': 'adam', 'graph_mode': 'cutoff', 'cutoff': 0.8618478140131225, 'grm_norm': 'none', 'self_loops': False}. Best is trial 109 with value: 0.2779994139152295.
[I 2025-10-22 00:40:18,767] Trial 148 finished with value: 0.22821226553874427 and parameters: {'model_type': 'gat', 'hidden_dims': '[256, 128, 64]', 'dropout': 0.17212606897575136, 'batch_norm': False, 'gat_heads': 4, 'gat_attn_dropout': 0.15204308210937617, 'gat_concat_hidden': True, 'lr': 0.0008368043153331636, 'weight_decay': 0.0009959064610282045, 'epochs': 252, 'loss': 'mae', 'optimizer': 'adam', 'graph_mode': 'cutoff', 'cutoff': 0.8749601929586727, 'grm_norm': 'none', 'self_loops': False}. Best is trial 109 with value: 0.2779994139152295.
[I 2025-10-22 00:43:59,852] Trial 149 finished with value: 0.18825961343643108 and parameters: {'model_type': 'gat', 'hidden_dims': '[256, 128, 64]', 'dropout': 0.2342372163338873, 'batch_norm': False, 'gat_heads': 5, 'gat_attn_dropout': 0.121522842360298, 'gat_concat_hidden': True, 'lr': 0.0009940941519100274, 'weight_decay': 0.0004905011906456685, 'epochs': 258, 'loss': 'mae', 'optimizer': 'adam', 'graph_mode': 'cutoff', 'cutoff': 0.8324708586890959, 'grm_norm': 'none', 'self_loops': True}. Best is trial 109 with value: 0.2779994139152295.
[I 2025-10-22 00:44:40,626] Trial 0 finished with value: 0.1192384103132715 and parameters: {'model_type': 'gat', 'hidden_dims': '[128, 64]', 'dropout': 0.199031432379812, 'batch_norm': True, 'gat_heads': 1, 'gat_attn_dropout': 0.41121589102067835, 'gat_concat_hidden': True, 'lr': 3.4401453323286906e-05, 'weight_decay': 0.00017802616915745114, 'epochs': 230, 'loss': 'mse', 'optimizer': 'adam', 'graph_mode': 'knn', 'source': 'grm', 'knn_k': 6, 'weighted_edges': True, 'symmetrize_mode': 'mutual'}. Best is trial 0 with value: 0.1192384103132715.
[I 2025-10-22 00:45:53,138] Trial 1 finished with value: 0.09779192443156504 and parameters: {'model_type': 'gat', 'hidden_dims': '[512, 64]', 'dropout': 0.36082357619681704, 'batch_norm': True, 'gat_heads': 1, 'gat_attn_dropout': 0.18042003398172202, 'gat_concat_hidden': False, 'lr': 1.3825758230956745e-06, 'weight_decay': 3.199989794411411e-05, 'epochs': 210, 'loss': 'mse', 'optimizer': 'adam', 'graph_mode': 'knn', 'source': 'grm', 'knn_k': 8, 'weighted_edges': True, 'symmetrize_mode': 'mutual'}. Best is trial 0 with value: 0.1192384103132715.
[I 2025-10-22 00:48:24,073] Trial 2 finished with value: 0.16921943768026057 and parameters: {'model_type': 'gat', 'hidden_dims': '[512, 64]', 'dropout': 0.5938127374509361, 'batch_norm': False, 'gat_heads': 3, 'gat_attn_dropout': 0.3584229889385306, 'gat_concat_hidden': True, 'lr': 5.8966328690006356e-05, 'weight_decay': 1.4359095002909625e-07, 'epochs': 151, 'loss': 'mae', 'optimizer': 'adam', 'graph_mode': 'cutoff', 'cutoff': 0.22797144608298409, 'grm_norm': 'none', 'self_loops': False}. Best is trial 2 with value: 0.16921943768026057.
[I 2025-10-22 00:49:01,461] Trial 3 finished with value: 0.1116046947011066 and parameters: {'model_type': 'gat', 'hidden_dims': '[256, 128]', 'dropout': 0.23110783056597514, 'batch_norm': True, 'gat_heads': 3, 'gat_attn_dropout': 0.14524552524211642, 'gat_concat_hidden': False, 'lr': 2.6631568299397822e-05, 'weight_decay': 1.4831733219640837e-06, 'epochs': 59, 'loss': 'mse', 'optimizer': 'adam', 'graph_mode': 'cutoff', 'cutoff': 0.5085416774304665, 'grm_norm': 'cosine_then_gcn', 'self_loops': False}. Best is trial 2 with value: 0.16921943768026057.
[I 2025-10-22 00:49:33,055] Trial 4 finished with value: 0.1625886234298232 and parameters: {'model_type': 'gat', 'hidden_dims': '[128, 64]', 'dropout': 0.24986493621228142, 'batch_norm': False, 'gat_heads': 2, 'gat_attn_dropout': 0.03028660209239857, 'gat_concat_hidden': True, 'lr': 3.4411882055364858e-06, 'weight_decay': 0.00034938832175517785, 'epochs': 153, 'loss': 'mae', 'optimizer': 'adam', 'graph_mode': 'cutoff', 'cutoff': 0.5288497054083461, 'grm_norm': 'cosine_then_gcn', 'self_loops': False}. Best is trial 2 with value: 0.16921943768026057.
[I 2025-10-22 00:50:56,523] Trial 5 finished with value: 0.17026623188354745 and parameters: {'model_type': 'gat', 'hidden_dims': '[256, 128, 64]', 'dropout': 0.3667354424945013, 'batch_norm': False, 'gat_heads': 5, 'gat_attn_dropout': 0.47505419776597435, 'gat_concat_hidden': False, 'lr': 5.6570170227139244e-05, 'weight_decay': 6.845407486393404e-05, 'epochs': 86, 'loss': 'mae', 'optimizer': 'adam', 'graph_mode': 'cutoff', 'cutoff': 0.3163415033931736, 'grm_norm': 'cosine', 'self_loops': False}. Best is trial 5 with value: 0.17026623188354745.
[I 2025-10-22 00:53:53,353] Trial 6 finished with value: 0.1222885789755569 and parameters: {'model_type': 'gat', 'hidden_dims': '[512, 64]', 'dropout': 0.4724320384750339, 'batch_norm': True, 'gat_heads': 2, 'gat_attn_dropout': 0.5029567924222157, 'gat_concat_hidden': False, 'lr': 0.00035117819773722113, 'weight_decay': 2.586139236899202e-05, 'epochs': 282, 'loss': 'mse', 'optimizer': 'adam', 'graph_mode': 'knn', 'source': 'grm', 'knn_k': 5, 'weighted_edges': False, 'symmetrize_mode': 'mutual'}. Best is trial 5 with value: 0.17026623188354745.
[I 2025-10-22 00:54:24,443] Trial 7 finished with value: 0.15160838674952284 and parameters: {'model_type': 'gat', 'hidden_dims': '[256, 128]', 'dropout': 0.26933956649466984, 'batch_norm': False, 'gat_heads': 1, 'gat_attn_dropout': 0.12357015502138351, 'gat_concat_hidden': True, 'lr': 9.272145288974393e-05, 'weight_decay': 0.0001637847231599168, 'epochs': 149, 'loss': 'mae', 'optimizer': 'adam', 'graph_mode': 'knn', 'source': 'grm', 'knn_k': 9, 'weighted_edges': False, 'symmetrize_mode': 'mutual'}. Best is trial 5 with value: 0.17026623188354745.
[I 2025-10-22 00:54:44,086] Trial 8 finished with value: 0.08147338406560312 and parameters: {'model_type': 'gat', 'hidden_dims': '[256, 128, 64]', 'dropout': 0.5327763091136416, 'batch_norm': True, 'gat_heads': 1, 'gat_attn_dropout': 0.11077610280855929, 'gat_concat_hidden': False, 'lr': 0.0005504846263330393, 'weight_decay': 6.7826287729705615e-06, 'epochs': 80, 'loss': 'mse', 'optimizer': 'adam', 'graph_mode': 'cutoff', 'cutoff': 0.39200637331077737, 'grm_norm': 'cosine_then_gcn', 'self_loops': False}. Best is trial 5 with value: 0.17026623188354745.
[I 2025-10-22 00:56:05,433] Trial 9 finished with value: 0.18869604700317355 and parameters: {'model_type': 'gat', 'hidden_dims': '[256, 128, 64]', 'dropout': 0.29822093943922523, 'batch_norm': True, 'gat_heads': 2, 'gat_attn_dropout': 0.5041483896530343, 'gat_concat_hidden': True, 'lr': 0.0009262984185468379, 'weight_decay': 8.224875501038066e-07, 'epochs': 231, 'loss': 'mae', 'optimizer': 'adam', 'graph_mode': 'cutoff', 'cutoff': 0.40177719715455146, 'grm_norm': 'none', 'self_loops': True}. Best is trial 9 with value: 0.18869604700317355.
[I 2025-10-22 01:08:23,770] Trial 10 finished with value: 0.2140463358618469 and parameters: {'model_type': 'gat', 'hidden_dims': '[512, 256]', 'dropout': 0.11372025982957354, 'batch_norm': True, 'gat_heads': 7, 'gat_attn_dropout': 0.5599540289166529, 'gat_concat_hidden': True, 'lr': 0.0009650491902216229, 'weight_decay': 1.3004302134392705e-07, 'epochs': 339, 'loss': 'mae', 'optimizer': 'adam', 'graph_mode': 'cutoff', 'cutoff': 0.7605475530345412, 'grm_norm': 'gcn', 'self_loops': True}. Best is trial 10 with value: 0.2140463358618469.
[I 2025-10-22 01:23:15,579] Trial 11 finished with value: 0.2113615112999228 and parameters: {'model_type': 'gat', 'hidden_dims': '[512, 256]', 'dropout': 0.10254502285057247, 'batch_norm': True, 'gat_heads': 8, 'gat_attn_dropout': 0.5935696129988, 'gat_concat_hidden': True, 'lr': 0.0009039246077153928, 'weight_decay': 1.014091185981818e-07, 'epochs': 348, 'loss': 'mae', 'optimizer': 'adam', 'graph_mode': 'cutoff', 'cutoff': 0.8795382731036935, 'grm_norm': 'gcn', 'self_loops': True}. Best is trial 10 with value: 0.2140463358618469.
[I 2025-10-22 01:37:43,342] Trial 12 finished with value: 0.21331026082088306 and parameters: {'model_type': 'gat', 'hidden_dims': '[512, 256]', 'dropout': 0.11851629240082012, 'batch_norm': True, 'gat_heads': 8, 'gat_attn_dropout': 0.5936622869810394, 'gat_concat_hidden': True, 'lr': 0.00021857214966676538, 'weight_decay': 1.1903116219202832e-07, 'epochs': 338, 'loss': 'mae', 'optimizer': 'adam', 'graph_mode': 'cutoff', 'cutoff': 0.8655944931386742, 'grm_norm': 'gcn', 'self_loops': True}. Best is trial 10 with value: 0.2140463358618469.
[I 2025-10-22 01:52:03,327] Trial 13 finished with value: 0.2140974292420108 and parameters: {'model_type': 'gat', 'hidden_dims': '[512, 256]', 'dropout': 0.10085201161116182, 'batch_norm': True, 'gat_heads': 8, 'gat_attn_dropout': 0.5971261634521214, 'gat_concat_hidden': True, 'lr': 0.00020400539388946485, 'weight_decay': 5.734114824541148e-07, 'epochs': 335, 'loss': 'mae', 'optimizer': 'adam', 'graph_mode': 'cutoff', 'cutoff': 0.8505441025011694, 'grm_norm': 'gcn', 'self_loops': True}. Best is trial 13 with value: 0.2140974292420108.
[I 2025-10-22 02:00:59,451] Trial 14 finished with value: 0.20430760449715538 and parameters: {'model_type': 'gat', 'hidden_dims': '[512, 128]', 'dropout': 0.15902593238344254, 'batch_norm': True, 'gat_heads': 6, 'gat_attn_dropout': 0.2810064922470583, 'gat_concat_hidden': True, 'lr': 0.00027526330183044647, 'weight_decay': 7.56312608130222e-07, 'epochs': 292, 'loss': 'mae', 'optimizer': 'adam', 'graph_mode': 'cutoff', 'cutoff': 0.7241954398615861, 'grm_norm': 'gcn', 'self_loops': True}. Best is trial 13 with value: 0.2140974292420108.
[I 2025-10-22 02:11:30,483] Trial 15 finished with value: 0.16378288709904448 and parameters: {'model_type': 'gat', 'hidden_dims': '[512, 256]', 'dropout': 0.16104587108836052, 'batch_norm': True, 'gat_heads': 7, 'gat_attn_dropout': 0.2827419937814156, 'gat_concat_hidden': True, 'lr': 1.0948955842261321e-05, 'weight_decay': 2.7381548737456626e-06, 'epochs': 286, 'loss': 'mae', 'optimizer': 'adam', 'graph_mode': 'cutoff', 'cutoff': 0.7084722945089641, 'grm_norm': 'gcn', 'self_loops': True}. Best is trial 13 with value: 0.2140974292420108.
[I 2025-10-22 02:21:13,599] Trial 16 finished with value: 0.21881042181207816 and parameters: {'model_type': 'gat', 'hidden_dims': '[512, 256]', 'dropout': 0.4337768631587977, 'batch_norm': True, 'gat_heads': 6, 'gat_attn_dropout': 0.5378353656633225, 'gat_concat_hidden': True, 'lr': 0.0001708785478390336, 'weight_decay': 3.8277286072118204e-07, 'epochs': 314, 'loss': 'mae', 'optimizer': 'adam', 'graph_mode': 'cutoff', 'cutoff': 0.7306141926613994, 'grm_norm': 'gcn', 'self_loops': True}. Best is trial 16 with value: 0.21881042181207816.
[I 2025-10-22 02:28:13,679] Trial 17 finished with value: 0.21629764782129057 and parameters: {'model_type': 'gat', 'hidden_dims': '[512, 256]', 'dropout': 0.40982623159711423, 'batch_norm': True, 'gat_heads': 5, 'gat_attn_dropout': 0.41259294888575837, 'gat_concat_hidden': True, 'lr': 0.0001422688967454226, 'weight_decay': 3.9857354002613476e-07, 'epochs': 262, 'loss': 'mae', 'optimizer': 'adam', 'graph_mode': 'cutoff', 'cutoff': 0.6113783326509719, 'grm_norm': 'cosine', 'self_loops': True}. Best is trial 16 with value: 0.21881042181207816.
[I 2025-10-22 02:35:00,266] Trial 18 finished with value: 0.14392395356201443 and parameters: {'model_type': 'gat', 'hidden_dims': '[512, 128]', 'dropout': 0.42846145787849366, 'batch_norm': False, 'gat_heads': 5, 'gat_attn_dropout': 0.41681675021825426, 'gat_concat_hidden': True, 'lr': 1.4229742500153306e-05, 'weight_decay': 4.757861214174276e-06, 'epochs': 255, 'loss': 'mae', 'optimizer': 'adam', 'graph_mode': 'knn', 'source': 'grm', 'knn_k': 1, 'weighted_edges': False, 'symmetrize_mode': 'union'}. Best is trial 16 with value: 0.21881042181207816.
[I 2025-10-22 02:41:28,891] Trial 19 finished with value: 0.19983608103090622 and parameters: {'model_type': 'gat', 'hidden_dims': '[512, 256]', 'dropout': 0.42991327319282074, 'batch_norm': True, 'gat_heads': 4, 'gat_attn_dropout': 0.3467196701644216, 'gat_concat_hidden': True, 'lr': 0.00013905800967391774, 'weight_decay': 3.815795148502405e-07, 'epochs': 306, 'loss': 'mae', 'optimizer': 'adam', 'graph_mode': 'cutoff', 'cutoff': 0.6240829973278275, 'grm_norm': 'cosine', 'self_loops': True}. Best is trial 16 with value: 0.21881042181207816.
[I 2025-10-22 02:47:23,824] Trial 20 finished with value: 0.22031834497359043 and parameters: {'model_type': 'gat', 'hidden_dims': '[512, 256]', 'dropout': 0.4928232664084796, 'batch_norm': True, 'gat_heads': 6, 'gat_attn_dropout': 0.44573496902950505, 'gat_concat_hidden': True, 'lr': 0.00010412865265554662, 'weight_decay': 0.000960654517203466, 'epochs': 185, 'loss': 'mae', 'optimizer': 'adam', 'graph_mode': 'cutoff', 'cutoff': 0.617570121064403, 'grm_norm': 'cosine', 'self_loops': True}. Best is trial 20 with value: 0.22031834497359043.
[I 2025-10-22 02:53:09,765] Trial 21 finished with value: 0.2183011328397339 and parameters: {'model_type': 'gat', 'hidden_dims': '[512, 256]', 'dropout': 0.5148351256167332, 'batch_norm': True, 'gat_heads': 6, 'gat_attn_dropout': 0.44504923661471185, 'gat_concat_hidden': True, 'lr': 0.00010010756918908551, 'weight_decay': 0.0006118045565727987, 'epochs': 180, 'loss': 'mae', 'optimizer': 'adam', 'graph_mode': 'cutoff', 'cutoff': 0.6182586156686071, 'grm_norm': 'cosine', 'self_loops': True}. Best is trial 20 with value: 0.22031834497359043.
[I 2025-10-22 02:59:04,773] Trial 22 finished with value: 0.22300617294808017 and parameters: {'model_type': 'gat', 'hidden_dims': '[512, 256]', 'dropout': 0.5031638626938344, 'batch_norm': True, 'gat_heads': 6, 'gat_attn_dropout': 0.46127530331234606, 'gat_concat_hidden': True, 'lr': 8.595857244132166e-05, 'weight_decay': 0.0008768298132785547, 'epochs': 185, 'loss': 'mae', 'optimizer': 'adam', 'graph_mode': 'cutoff', 'cutoff': 0.6398915840946489, 'grm_norm': 'cosine', 'self_loops': True}. Best is trial 22 with value: 0.22300617294808017.
[I 2025-10-22 03:04:57,433] Trial 23 finished with value: 0.2225625127395956 and parameters: {'model_type': 'gat', 'hidden_dims': '[512, 256]', 'dropout': 0.5028056816809845, 'batch_norm': True, 'gat_heads': 6, 'gat_attn_dropout': 0.5291520466204459, 'gat_concat_hidden': True, 'lr': 5.7093051242801476e-05, 'weight_decay': 0.000850629831717751, 'epochs': 184, 'loss': 'mae', 'optimizer': 'adam', 'graph_mode': 'cutoff', 'cutoff': 0.679126144755284, 'grm_norm': 'cosine', 'self_loops': True}. Best is trial 22 with value: 0.22300617294808017.
[I 2025-10-22 03:11:49,534] Trial 24 finished with value: 0.185797499596049 and parameters: {'model_type': 'gat', 'hidden_dims': '[512, 256]', 'dropout': 0.58146838385698, 'batch_norm': True, 'gat_heads': 7, 'gat_attn_dropout': 0.34640020477122413, 'gat_concat_hidden': True, 'lr': 1.9824471519201646e-05, 'weight_decay': 0.0009376265693948165, 'epochs': 182, 'loss': 'mae', 'optimizer': 'adam', 'graph_mode': 'cutoff', 'cutoff': 0.6540337578584394, 'grm_norm': 'cosine', 'self_loops': True}. Best is trial 22 with value: 0.22300617294808017.
[I 2025-10-22 03:15:58,828] Trial 25 finished with value: 0.20211630705931735 and parameters: {'model_type': 'gat', 'hidden_dims': '[512, 256]', 'dropout': 0.5011931743918955, 'batch_norm': True, 'gat_heads': 6, 'gat_attn_dropout': 0.47229059073421964, 'gat_concat_hidden': True, 'lr': 4.9678856474133946e-05, 'weight_decay': 0.00038939323308526564, 'epochs': 123, 'loss': 'mae', 'optimizer': 'adam', 'graph_mode': 'cutoff', 'cutoff': 0.4794855391398005, 'grm_norm': 'cosine', 'self_loops': True}. Best is trial 22 with value: 0.22300617294808017.
[I 2025-10-22 03:17:09,598] Trial 26 finished with value: 0.1359404979765928 and parameters: {'model_type': 'gat', 'hidden_dims': '[128, 64]', 'dropout': 0.5483982046722385, 'batch_norm': True, 'gat_heads': 4, 'gat_attn_dropout': 0.5436445153612854, 'gat_concat_hidden': False, 'lr': 5.613357295367121e-06, 'weight_decay': 0.0001508769953751862, 'epochs': 208, 'loss': 'mae', 'optimizer': 'adam', 'graph_mode': 'cutoff', 'cutoff': 0.7873943244498538, 'grm_norm': 'cosine', 'self_loops': True}. Best is trial 22 with value: 0.22300617294808017.
[I 2025-10-22 03:21:19,493] Trial 27 finished with value: 0.16251089428676885 and parameters: {'model_type': 'gat', 'hidden_dims': '[512, 128]', 'dropout': 0.48825629729858677, 'batch_norm': False, 'gat_heads': 7, 'gat_attn_dropout': 0.5148859766765286, 'gat_concat_hidden': True, 'lr': 8.295810960221928e-05, 'weight_decay': 0.0009349848172659363, 'epochs': 107, 'loss': 'mse', 'optimizer': 'adam', 'graph_mode': 'knn', 'source': 'grm', 'knn_k': 1, 'weighted_edges': True, 'symmetrize_mode': 'union'}. Best is trial 22 with value: 0.22300617294808017.
