[I 2025-11-03 14:17:17,535] Trial 89 finished with value: 0.11809338108979094 and parameters: {'model_type': 'gcn', 'hidden_dims': '[256, 128, 64]', 'dropout': 0.30780740864575284, 'batch_norm': False, 'lr': 0.00033128334243374686, 'weight_decay': 1.0185082382149123e-05, 'epochs': 252, 'loss': 'mae', 'optimizer': 'adam', 'graph_mode': 'knn', 'source': 'grm', 'knn_k': 2, 'weighted_edges': True, 'symmetrize_mode': 'union', 'use_snp_selection': True, 'num_snps': 49875}. Best is trial 31 with value: 0.17643153876650486.
[I 2025-11-03 14:17:20,376] Trial 90 finished with value: 0.15388626602231487 and parameters: {'model_type': 'gcn', 'hidden_dims': '[256, 128]', 'dropout': 0.3269362123530457, 'batch_norm': True, 'lr': 0.00022879201343343057, 'weight_decay': 1.7835086106268717e-07, 'epochs': 234, 'loss': 'mae', 'optimizer': 'adam', 'graph_mode': 'knn', 'source': 'grm', 'knn_k': 1, 'weighted_edges': False, 'symmetrize_mode': 'mutual', 'use_snp_selection': False}. Best is trial 31 with value: 0.17643153876650486.
[I 2025-11-03 14:17:23,776] Trial 91 finished with value: 0.16336004843999802 and parameters: {'model_type': 'gcn', 'hidden_dims': '[512, 256]', 'dropout': 0.2896720568839764, 'batch_norm': True, 'lr': 0.0006541982648990343, 'weight_decay': 2.673140446244471e-07, 'epochs': 172, 'loss': 'mae', 'optimizer': 'adam', 'graph_mode': 'knn', 'source': 'grm', 'knn_k': 1, 'weighted_edges': True, 'symmetrize_mode': 'union', 'use_snp_selection': False}. Best is trial 31 with value: 0.17643153876650486.
[I 2025-11-03 14:17:28,399] Trial 92 finished with value: 0.176973192671009 and parameters: {'model_type': 'gcn', 'hidden_dims': '[512, 256]', 'dropout': 0.2639479053969813, 'batch_norm': True, 'lr': 0.000712317622077465, 'weight_decay': 2.3102301996811298e-07, 'epochs': 270, 'loss': 'mae', 'optimizer': 'adam', 'graph_mode': 'knn', 'source': 'grm', 'knn_k': 1, 'weighted_edges': True, 'symmetrize_mode': 'union', 'use_snp_selection': False}. Best is trial 92 with value: 0.176973192671009.
[I 2025-11-03 14:17:33,027] Trial 93 finished with value: 0.18608032209567513 and parameters: {'model_type': 'gcn', 'hidden_dims': '[512, 256]', 'dropout': 0.25954158445381775, 'batch_norm': True, 'lr': 0.0009211782428067766, 'weight_decay': 3.302878125818048e-07, 'epochs': 271, 'loss': 'mae', 'optimizer': 'adam', 'graph_mode': 'knn', 'source': 'grm', 'knn_k': 1, 'weighted_edges': True, 'symmetrize_mode': 'union', 'use_snp_selection': False}. Best is trial 93 with value: 0.18608032209567513.
[I 2025-11-03 14:17:37,700] Trial 94 finished with value: 0.16612779439775197 and parameters: {'model_type': 'gcn', 'hidden_dims': '[512, 256]', 'dropout': 0.2672404302694327, 'batch_norm': True, 'lr': 0.0006818811471647746, 'weight_decay': 3.1841718378677715e-07, 'epochs': 269, 'loss': 'mae', 'optimizer': 'adam', 'graph_mode': 'knn', 'source': 'grm', 'knn_k': 6, 'weighted_edges': True, 'symmetrize_mode': 'union', 'use_snp_selection': False}. Best is trial 93 with value: 0.18608032209567513.
[I 2025-11-03 14:17:42,463] Trial 95 finished with value: 0.17098063796821236 and parameters: {'model_type': 'gcn', 'hidden_dims': '[512, 256]', 'dropout': 0.2606958573930747, 'batch_norm': True, 'lr': 0.0007860534911022167, 'weight_decay': 0.0005840983989585929, 'epochs': 281, 'loss': 'mae', 'optimizer': 'adam', 'graph_mode': 'knn', 'source': 'grm', 'knn_k': 1, 'weighted_edges': True, 'symmetrize_mode': 'union', 'use_snp_selection': False}. Best is trial 93 with value: 0.18608032209567513.
[I 2025-11-03 14:17:47,683] Trial 96 finished with value: 0.1690831036024752 and parameters: {'model_type': 'gcn', 'hidden_dims': '[512, 256]', 'dropout': 0.26016835533508664, 'batch_norm': True, 'lr': 0.0005234813985325584, 'weight_decay': 0.00023388940533185883, 'epochs': 318, 'loss': 'mae', 'optimizer': 'adam', 'graph_mode': 'knn', 'source': 'grm', 'knn_k': 1, 'weighted_edges': True, 'symmetrize_mode': 'union', 'use_snp_selection': False}. Best is trial 93 with value: 0.18608032209567513.
[I 2025-11-03 14:17:52,840] Trial 97 finished with value: 0.16871530968051168 and parameters: {'model_type': 'gcn', 'hidden_dims': '[512, 256]', 'dropout': 0.2632221821727339, 'batch_norm': True, 'lr': 0.000860188942189084, 'weight_decay': 0.00036276888037735323, 'epochs': 312, 'loss': 'mae', 'optimizer': 'adam', 'graph_mode': 'knn', 'source': 'grm', 'knn_k': 1, 'weighted_edges': True, 'symmetrize_mode': 'union', 'use_snp_selection': False}. Best is trial 93 with value: 0.18608032209567513.
[I 2025-11-03 14:17:58,463] Trial 98 finished with value: 0.1556413398638444 and parameters: {'model_type': 'gcn', 'hidden_dims': '[512, 256]', 'dropout': 0.23145449895694387, 'batch_norm': True, 'lr': 0.0008879006121839599, 'weight_decay': 0.0007408875349300954, 'epochs': 349, 'loss': 'mae', 'optimizer': 'adam', 'graph_mode': 'knn', 'source': 'grm', 'knn_k': 1, 'weighted_edges': True, 'symmetrize_mode': 'union', 'use_snp_selection': False}. Best is trial 93 with value: 0.18608032209567513.
[I 2025-11-03 14:18:03,758] Trial 99 finished with value: 0.16801415214811896 and parameters: {'model_type': 'gcn', 'hidden_dims': '[512, 256]', 'dropout': 0.27713309708363365, 'batch_norm': True, 'lr': 0.0005403150241665587, 'weight_decay': 0.0003499603497689995, 'epochs': 320, 'loss': 'mae', 'optimizer': 'adam', 'graph_mode': 'knn', 'source': 'grm', 'knn_k': 1, 'weighted_edges': True, 'symmetrize_mode': 'union', 'use_snp_selection': False}. Best is trial 93 with value: 0.18608032209567513.
[I 2025-11-03 14:18:08,736] Trial 100 finished with value: 0.17805679981873312 and parameters: {'model_type': 'gcn', 'hidden_dims': '[512, 256]', 'dropout': 0.2508276696675549, 'batch_norm': True, 'lr': 0.000980598302712314, 'weight_decay': 0.0002435252946659825, 'epochs': 294, 'loss': 'mae', 'optimizer': 'adam', 'graph_mode': 'knn', 'source': 'grm', 'knn_k': 1, 'weighted_edges': True, 'symmetrize_mode': 'union', 'use_snp_selection': False}. Best is trial 93 with value: 0.18608032209567513.
[I 2025-11-03 14:18:13,722] Trial 101 finished with value: 0.15948436413561184 and parameters: {'model_type': 'gcn', 'hidden_dims': '[512, 256]', 'dropout': 0.30130594850311454, 'batch_norm': True, 'lr': 0.0009921208733423574, 'weight_decay': 0.0005873081014937101, 'epochs': 294, 'loss': 'mae', 'optimizer': 'adam', 'graph_mode': 'knn', 'source': 'grm', 'knn_k': 1, 'weighted_edges': True, 'symmetrize_mode': 'union', 'use_snp_selection': False}. Best is trial 93 with value: 0.18608032209567513.
[I 2025-11-03 14:18:18,534] Trial 102 finished with value: 0.17701477690616282 and parameters: {'model_type': 'gcn', 'hidden_dims': '[512, 256]', 'dropout': 0.2513297429290952, 'batch_norm': True, 'lr': 0.000738628609616296, 'weight_decay': 0.00021475290127012152, 'epochs': 281, 'loss': 'mae', 'optimizer': 'adam', 'graph_mode': 'knn', 'source': 'grm', 'knn_k': 1, 'weighted_edges': True, 'symmetrize_mode': 'union', 'use_snp_selection': False}. Best is trial 93 with value: 0.18608032209567513.
[I 2025-11-03 14:18:23,439] Trial 103 finished with value: 0.1593233706211693 and parameters: {'model_type': 'gcn', 'hidden_dims': '[512, 256]', 'dropout': 0.2114200378425506, 'batch_norm': True, 'lr': 0.0007429980775583251, 'weight_decay': 0.00027070408191701985, 'epochs': 286, 'loss': 'mae', 'optimizer': 'adam', 'graph_mode': 'knn', 'source': 'grm', 'knn_k': 2, 'weighted_edges': True, 'symmetrize_mode': 'union', 'use_snp_selection': False}. Best is trial 93 with value: 0.18608032209567513.
[I 2025-11-03 14:18:28,221] Trial 104 finished with value: 0.17560248439391002 and parameters: {'model_type': 'gcn', 'hidden_dims': '[512, 256]', 'dropout': 0.2480976131013106, 'batch_norm': True, 'lr': 0.0008268318354330128, 'weight_decay': 8.323839839898922e-05, 'epochs': 278, 'loss': 'mae', 'optimizer': 'adam', 'graph_mode': 'knn', 'source': 'grm', 'knn_k': 1, 'weighted_edges': True, 'symmetrize_mode': 'union', 'use_snp_selection': False}. Best is trial 93 with value: 0.18608032209567513.
[I 2025-11-03 14:18:32,974] Trial 105 finished with value: 0.16963062144011298 and parameters: {'model_type': 'gcn', 'hidden_dims': '[512, 256]', 'dropout': 0.25326826308406203, 'batch_norm': True, 'lr': 0.0009988167411988053, 'weight_decay': 0.00010631784543422778, 'epochs': 276, 'loss': 'mae', 'optimizer': 'adam', 'graph_mode': 'knn', 'source': 'grm', 'knn_k': 1, 'weighted_edges': True, 'symmetrize_mode': 'union', 'use_snp_selection': False}. Best is trial 93 with value: 0.18608032209567513.
[I 2025-11-03 14:18:38,219] Trial 106 finished with value: 0.153778222210917 and parameters: {'model_type': 'gcn', 'hidden_dims': '[512, 256]', 'dropout': 0.2861157352776728, 'batch_norm': True, 'lr': 0.0008389300484644537, 'weight_decay': 8.51594992393153e-05, 'epochs': 305, 'loss': 'mae', 'optimizer': 'adam', 'graph_mode': 'knn', 'source': 'grm', 'knn_k': 10, 'weighted_edges': True, 'symmetrize_mode': 'union', 'use_snp_selection': False}. Best is trial 93 with value: 0.18608032209567513.
[I 2025-11-03 14:18:43,069] Trial 107 finished with value: 0.15514264811485215 and parameters: {'model_type': 'gcn', 'hidden_dims': '[512, 256]', 'dropout': 0.23634417060853144, 'batch_norm': True, 'lr': 0.0007696050824932167, 'weight_decay': 0.00020705115690444618, 'epochs': 285, 'loss': 'mse', 'optimizer': 'adam', 'graph_mode': 'knn', 'source': 'grm', 'knn_k': 1, 'weighted_edges': True, 'symmetrize_mode': 'union', 'use_snp_selection': False}. Best is trial 93 with value: 0.18608032209567513.
[I 2025-11-03 14:18:48,424] Trial 108 finished with value: 0.12181694377212413 and parameters: {'model_type': 'gcn', 'hidden_dims': '[512, 256]', 'dropout': 0.2483403439948128, 'batch_norm': False, 'lr': 0.000639275673624225, 'weight_decay': 0.0005654769711266536, 'epochs': 292, 'loss': 'mae', 'optimizer': 'adam', 'graph_mode': 'knn', 'source': 'grm', 'knn_k': 1, 'weighted_edges': True, 'symmetrize_mode': 'union', 'use_snp_selection': True, 'num_snps': 36947}. Best is trial 93 with value: 0.18608032209567513.
[I 2025-11-03 14:18:53,181] Trial 109 finished with value: 0.1486551751148821 and parameters: {'model_type': 'gcn', 'hidden_dims': '[512, 256]', 'dropout': 0.27096194884869146, 'batch_norm': True, 'lr': 0.0007306967793628141, 'weight_decay': 0.000299025796806931, 'epochs': 275, 'loss': 'mae', 'optimizer': 'adam', 'graph_mode': 'knn', 'source': 'grm', 'knn_k': 2, 'weighted_edges': True, 'symmetrize_mode': 'union', 'use_snp_selection': False}. Best is trial 93 with value: 0.18608032209567513.
[I 2025-11-03 14:18:58,008] Trial 110 finished with value: 0.17895041317160218 and parameters: {'model_type': 'gcn', 'hidden_dims': '[512, 256]', 'dropout': 0.2205979639961583, 'batch_norm': True, 'lr': 0.00048319455532813785, 'weight_decay': 0.00016607862078337333, 'epochs': 282, 'loss': 'mae', 'optimizer': 'adam', 'graph_mode': 'knn', 'source': 'grm', 'knn_k': 1, 'weighted_edges': True, 'symmetrize_mode': 'union', 'use_snp_selection': False}. Best is trial 93 with value: 0.18608032209567513.
[I 2025-11-03 14:19:02,613] Trial 111 finished with value: 0.1700871910751668 and parameters: {'model_type': 'gcn', 'hidden_dims': '[512, 256]', 'dropout': 0.22507287208182006, 'batch_norm': True, 'lr': 0.0004621075872146037, 'weight_decay': 0.0001431185705720753, 'epochs': 265, 'loss': 'mae', 'optimizer': 'adam', 'graph_mode': 'knn', 'source': 'grm', 'knn_k': 1, 'weighted_edges': True, 'symmetrize_mode': 'union', 'use_snp_selection': False}. Best is trial 93 with value: 0.18608032209567513.
[I 2025-11-03 14:19:08,145] Trial 112 finished with value: 0.16980790672954224 and parameters: {'model_type': 'gcn', 'hidden_dims': '[512, 256]', 'dropout': 0.24314940559603465, 'batch_norm': True, 'lr': 0.0009028483680616184, 'weight_decay': 0.0005059254816648195, 'epochs': 339, 'loss': 'mae', 'optimizer': 'adam', 'graph_mode': 'knn', 'source': 'grm', 'knn_k': 1, 'weighted_edges': True, 'symmetrize_mode': 'union', 'use_snp_selection': False}. Best is trial 93 with value: 0.18608032209567513.
[I 2025-11-03 14:19:12,814] Trial 113 finished with value: 0.16887595421636759 and parameters: {'model_type': 'gcn', 'hidden_dims': '[512, 256]', 'dropout': 0.21992900172499658, 'batch_norm': True, 'lr': 0.00040352241379781797, 'weight_decay': 0.00012293976371184, 'epochs': 279, 'loss': 'mae', 'optimizer': 'adam', 'graph_mode': 'knn', 'source': 'grm', 'knn_k': 1, 'weighted_edges': True, 'symmetrize_mode': 'union', 'use_snp_selection': False}. Best is trial 93 with value: 0.18608032209567513.
[I 2025-11-03 14:19:17,585] Trial 114 finished with value: 0.1652567534981418 and parameters: {'model_type': 'gcn', 'hidden_dims': '[512, 256]', 'dropout': 0.2746846075336109, 'batch_norm': True, 'lr': 0.0005658618488443227, 'weight_decay': 0.0001712079654524415, 'epochs': 282, 'loss': 'mae', 'optimizer': 'adam', 'graph_mode': 'knn', 'source': 'grm', 'knn_k': 1, 'weighted_edges': True, 'symmetrize_mode': 'union', 'use_snp_selection': False}. Best is trial 93 with value: 0.18608032209567513.
[I 2025-11-03 14:19:22,680] Trial 115 finished with value: 0.07823857312021902 and parameters: {'model_type': 'gcn', 'hidden_dims': '[512, 256]', 'dropout': 0.2610542025421207, 'batch_norm': True, 'lr': 7.805265379231227e-06, 'weight_decay': 0.0004509811853016308, 'epochs': 304, 'loss': 'mae', 'optimizer': 'adam', 'graph_mode': 'knn', 'source': 'grm', 'knn_k': 1, 'weighted_edges': True, 'symmetrize_mode': 'union', 'use_snp_selection': False}. Best is trial 93 with value: 0.18608032209567513.
[I 2025-11-03 14:19:27,690] Trial 116 finished with value: 0.14175057046381406 and parameters: {'model_type': 'gcn', 'hidden_dims': '[512, 256]', 'dropout': 0.2866511052731785, 'batch_norm': True, 'lr': 0.0007050966801058097, 'weight_decay': 0.00022070856188235934, 'epochs': 295, 'loss': 'mae', 'optimizer': 'adam', 'graph_mode': 'knn', 'source': 'grm', 'knn_k': 2, 'weighted_edges': True, 'symmetrize_mode': 'union', 'use_snp_selection': False}. Best is trial 93 with value: 0.18608032209567513.
[I 2025-11-03 14:19:32,355] Trial 117 finished with value: 0.12489633986389036 and parameters: {'model_type': 'gcn', 'hidden_dims': '[512, 256]', 'dropout': 0.3062174565424698, 'batch_norm': True, 'lr': 0.0004979973779814392, 'weight_decay': 7.653593833784934e-05, 'epochs': 269, 'loss': 'mae', 'optimizer': 'adam', 'graph_mode': 'knn', 'source': 'grm', 'knn_k': 1, 'weighted_edges': False, 'symmetrize_mode': 'union', 'use_snp_selection': False}. Best is trial 93 with value: 0.18608032209567513.
[I 2025-11-03 14:19:36,852] Trial 118 finished with value: 0.1675749383881292 and parameters: {'model_type': 'gcn', 'hidden_dims': '[512, 256]', 'dropout': 0.19179282488053734, 'batch_norm': True, 'lr': 0.0006077760490982658, 'weight_decay': 0.0001505219941088371, 'epochs': 249, 'loss': 'mae', 'optimizer': 'adam', 'graph_mode': 'knn', 'source': 'grm', 'knn_k': 8, 'weighted_edges': True, 'symmetrize_mode': 'union', 'use_snp_selection': False}. Best is trial 93 with value: 0.18608032209567513.
[I 2025-11-03 14:19:40,195] Trial 119 finished with value: 0.13667682488700597 and parameters: {'model_type': 'gcn', 'hidden_dims': '[256, 128, 64]', 'dropout': 0.23192345826315428, 'batch_norm': True, 'lr': 0.0008439654469765225, 'weight_decay': 0.0008223462334845251, 'epochs': 261, 'loss': 'mae', 'optimizer': 'adam', 'graph_mode': 'knn', 'source': 'grm', 'knn_k': 1, 'weighted_edges': True, 'symmetrize_mode': 'union', 'use_snp_selection': False}. Best is trial 93 with value: 0.18608032209567513.
[I 2025-11-03 14:19:45,250] Trial 120 finished with value: 0.15348519301464175 and parameters: {'model_type': 'gcn', 'hidden_dims': '[512, 256]', 'dropout': 0.24846275972168502, 'batch_norm': True, 'lr': 0.000752187553787483, 'weight_decay': 0.00018204932725959114, 'epochs': 310, 'loss': 'mae', 'optimizer': 'adam', 'graph_mode': 'knn', 'source': 'grm', 'knn_k': 2, 'weighted_edges': True, 'symmetrize_mode': 'union', 'use_snp_selection': False}. Best is trial 93 with value: 0.18608032209567513.
[I 2025-11-03 14:19:49,733] Trial 121 finished with value: 0.1556360688961359 and parameters: {'model_type': 'gcn', 'hidden_dims': '[512, 256]', 'dropout': 0.22053301319131263, 'batch_norm': True, 'lr': 0.0004478274528840019, 'weight_decay': 0.00013985570190398324, 'epochs': 265, 'loss': 'mae', 'optimizer': 'adam', 'graph_mode': 'knn', 'source': 'grm', 'knn_k': 1, 'weighted_edges': True, 'symmetrize_mode': 'union', 'use_snp_selection': False}. Best is trial 93 with value: 0.18608032209567513.
[I 2025-11-03 14:19:54,315] Trial 122 finished with value: 0.17073588632263978 and parameters: {'model_type': 'gcn', 'hidden_dims': '[512, 256]', 'dropout': 0.22864599995372953, 'batch_norm': True, 'lr': 0.00049409155225358, 'weight_decay': 0.0003141689835353639, 'epochs': 272, 'loss': 'mae', 'optimizer': 'adam', 'graph_mode': 'knn', 'source': 'grm', 'knn_k': 1, 'weighted_edges': True, 'symmetrize_mode': 'union', 'use_snp_selection': False}. Best is trial 93 with value: 0.18608032209567513.
[I 2025-11-03 14:19:58,927] Trial 123 finished with value: 0.16697066974137786 and parameters: {'model_type': 'gcn', 'hidden_dims': '[512, 256]', 'dropout': 0.25299104909610015, 'batch_norm': True, 'lr': 0.00040903442689370806, 'weight_decay': 0.0002948623019128939, 'epochs': 275, 'loss': 'mae', 'optimizer': 'adam', 'graph_mode': 'knn', 'source': 'grm', 'knn_k': 1, 'weighted_edges': True, 'symmetrize_mode': 'union', 'use_snp_selection': False}. Best is trial 93 with value: 0.18608032209567513.
[I 2025-11-03 14:20:03,498] Trial 124 finished with value: 0.16872661131451563 and parameters: {'model_type': 'gcn', 'hidden_dims': '[512, 256]', 'dropout': 0.29399682101121066, 'batch_norm': True, 'lr': 0.000646502371568294, 'weight_decay': 9.317938322158796e-05, 'epochs': 272, 'loss': 'mae', 'optimizer': 'adam', 'graph_mode': 'knn', 'source': 'grm', 'knn_k': 1, 'weighted_edges': True, 'symmetrize_mode': 'union', 'use_snp_selection': False}. Best is trial 93 with value: 0.18608032209567513.
[I 2025-11-03 14:20:08,310] Trial 125 finished with value: 0.1563035635397826 and parameters: {'model_type': 'gcn', 'hidden_dims': '[512, 256]', 'dropout': 0.2654964761590911, 'batch_norm': True, 'lr': 0.0009864315815045748, 'weight_decay': 0.00024672846305674495, 'epochs': 290, 'loss': 'mae', 'optimizer': 'adam', 'graph_mode': 'knn', 'source': 'grm', 'knn_k': 2, 'weighted_edges': True, 'symmetrize_mode': 'union', 'use_snp_selection': False}. Best is trial 93 with value: 0.18608032209567513.
[I 2025-11-03 14:20:12,994] Trial 126 finished with value: 0.1752479680496407 and parameters: {'model_type': 'gcn', 'hidden_dims': '[512, 256]', 'dropout': 0.23973948527166308, 'batch_norm': True, 'lr': 0.0005403205117243107, 'weight_decay': 0.0004068469872043573, 'epochs': 281, 'loss': 'mae', 'optimizer': 'adam', 'graph_mode': 'knn', 'source': 'grm', 'knn_k': 1, 'weighted_edges': True, 'symmetrize_mode': 'union', 'use_snp_selection': False}. Best is trial 93 with value: 0.18608032209567513.
[I 2025-11-03 14:20:17,673] Trial 127 finished with value: 0.1735152023260383 and parameters: {'model_type': 'gcn', 'hidden_dims': '[512, 256]', 'dropout': 0.21241334527014913, 'batch_norm': True, 'lr': 0.000592689210022984, 'weight_decay': 0.0003235832976281612, 'epochs': 281, 'loss': 'mae', 'optimizer': 'adam', 'graph_mode': 'knn', 'source': 'grm', 'knn_k': 1, 'weighted_edges': True, 'symmetrize_mode': 'union', 'use_snp_selection': False}. Best is trial 93 with value: 0.18608032209567513.
[I 2025-11-03 14:20:22,610] Trial 128 finished with value: 0.15448895981337257 and parameters: {'model_type': 'gcn', 'hidden_dims': '[512, 256]', 'dropout': 0.23977718767626277, 'batch_norm': True, 'lr': 0.0005729088078673347, 'weight_decay': 0.00043854058150898106, 'epochs': 299, 'loss': 'mse', 'optimizer': 'adam', 'graph_mode': 'knn', 'source': 'grm', 'knn_k': 2, 'weighted_edges': True, 'symmetrize_mode': 'union', 'use_snp_selection': False}. Best is trial 93 with value: 0.18608032209567513.
[I 2025-11-03 14:20:26,975] Trial 129 finished with value: 0.12757221893058684 and parameters: {'model_type': 'gcn', 'hidden_dims': '[512, 256]', 'dropout': 0.20867897470155547, 'batch_norm': False, 'lr': 0.0008288122145299417, 'weight_decay': 0.0003980972373685567, 'epochs': 282, 'loss': 'mae', 'optimizer': 'adam', 'graph_mode': 'knn', 'source': 'grm', 'knn_k': 1, 'weighted_edges': True, 'symmetrize_mode': 'union', 'use_snp_selection': True, 'num_snps': 27400}. Best is trial 93 with value: 0.18608032209567513.
[I 2025-11-03 14:20:31,710] Trial 130 finished with value: 0.16049522135293048 and parameters: {'model_type': 'gcn', 'hidden_dims': '[512, 256]', 'dropout': 0.19483300393474967, 'batch_norm': True, 'lr': 0.0006927366251091255, 'weight_decay': 0.0007024899663835605, 'epochs': 282, 'loss': 'mae', 'optimizer': 'adam', 'graph_mode': 'knn', 'source': 'grm', 'knn_k': 1, 'weighted_edges': True, 'symmetrize_mode': 'union', 'use_snp_selection': False}. Best is trial 93 with value: 0.18608032209567513.
[I 2025-11-03 14:20:36,181] Trial 131 finished with value: 0.17333603552351373 and parameters: {'model_type': 'gcn', 'hidden_dims': '[512, 256]', 'dropout': 0.22823816783801232, 'batch_norm': True, 'lr': 0.000507310059389826, 'weight_decay': 0.00036240856211664825, 'epochs': 261, 'loss': 'mae', 'optimizer': 'adam', 'graph_mode': 'knn', 'source': 'grm', 'knn_k': 1, 'weighted_edges': True, 'symmetrize_mode': 'union', 'use_snp_selection': False}. Best is trial 93 with value: 0.18608032209567513.
[I 2025-11-03 14:20:40,646] Trial 132 finished with value: 0.18069785813386774 and parameters: {'model_type': 'gcn', 'hidden_dims': '[512, 256]', 'dropout': 0.17647069472103055, 'batch_norm': True, 'lr': 0.0005695180678837784, 'weight_decay': 0.0004951655697240315, 'epochs': 260, 'loss': 'mae', 'optimizer': 'adam', 'graph_mode': 'knn', 'source': 'grm', 'knn_k': 1, 'weighted_edges': True, 'symmetrize_mode': 'union', 'use_snp_selection': False}. Best is trial 93 with value: 0.18608032209567513.
