[I 2025-11-12 00:25:16,285] Trial 87 finished with value: 0.2612819378512223 and parameters: {'model_type': 'graphsage', 'hidden_dims': '[512, 64]', 'dropout': 0.5999847065258775, 'batch_norm': True, 'lr': 0.0008585446275165314, 'weight_decay': 4.1395252298251466e-07, 'epochs': 49, 'loss': 'mse', 'optimizer': 'adam', 'graph_mode': 'cutoff', 'cutoff': 0.492418484540977, 'grm_norm': 'cosine_then_gcn', 'self_loops': True, 'use_snp_selection': False}. Best is trial 72 with value: 0.279860945049314.
[I 2025-11-12 00:26:46,698] Trial 88 finished with value: 0.2546122664029754 and parameters: {'model_type': 'graphsage', 'hidden_dims': '[512, 64]', 'dropout': 0.5860780332962551, 'batch_norm': True, 'lr': 0.00017121695629249508, 'weight_decay': 4.32771036620949e-07, 'epochs': 48, 'loss': 'mse', 'optimizer': 'adam', 'graph_mode': 'cutoff', 'cutoff': 0.20011010776491017, 'grm_norm': 'cosine_then_gcn', 'self_loops': True, 'use_snp_selection': False}. Best is trial 72 with value: 0.279860945049314.
[I 2025-11-12 00:27:51,225] Trial 89 finished with value: 0.2441309096421859 and parameters: {'model_type': 'graphsage', 'hidden_dims': '[512, 256]', 'dropout': 0.5686150711830625, 'batch_norm': True, 'lr': 1.9970452379795323e-05, 'weight_decay': 6.851346990482774e-07, 'epochs': 57, 'loss': 'mse', 'optimizer': 'adam', 'graph_mode': 'cutoff', 'cutoff': 0.4848289182634455, 'grm_norm': 'cosine_then_gcn', 'self_loops': True, 'use_snp_selection': False}. Best is trial 72 with value: 0.279860945049314.
[I 2025-11-12 00:29:09,019] Trial 90 finished with value: 0.26583408382402296 and parameters: {'model_type': 'graphsage', 'hidden_dims': '[512, 64]', 'dropout': 0.5994706420795598, 'batch_norm': True, 'lr': 0.0006487959238141966, 'weight_decay': 8.395481429254277e-07, 'epochs': 69, 'loss': 'mse', 'optimizer': 'adam', 'graph_mode': 'cutoff', 'cutoff': 0.3332395841471326, 'grm_norm': 'cosine_then_gcn', 'self_loops': True, 'use_snp_selection': False}. Best is trial 72 with value: 0.279860945049314.
[I 2025-11-12 00:30:22,503] Trial 91 finished with value: 0.2657087608256793 and parameters: {'model_type': 'graphsage', 'hidden_dims': '[512, 64]', 'dropout': 0.5920662288844069, 'batch_norm': True, 'lr': 0.0005593034174438682, 'weight_decay': 8.343079705317434e-07, 'epochs': 64, 'loss': 'mse', 'optimizer': 'adam', 'graph_mode': 'cutoff', 'cutoff': 0.336756303733809, 'grm_norm': 'cosine_then_gcn', 'self_loops': True, 'use_snp_selection': False}. Best is trial 72 with value: 0.279860945049314.
[I 2025-11-12 00:31:39,762] Trial 92 finished with value: 0.266159140874441 and parameters: {'model_type': 'graphsage', 'hidden_dims': '[512, 64]', 'dropout': 0.5990279453303157, 'batch_norm': True, 'lr': 0.00061299117255042, 'weight_decay': 1.0190669866987524e-06, 'epochs': 69, 'loss': 'mse', 'optimizer': 'adam', 'graph_mode': 'cutoff', 'cutoff': 0.33859267332285603, 'grm_norm': 'cosine_then_gcn', 'self_loops': True, 'use_snp_selection': False}. Best is trial 72 with value: 0.279860945049314.
[I 2025-11-12 00:33:08,922] Trial 93 finished with value: 0.26593607938307995 and parameters: {'model_type': 'graphsage', 'hidden_dims': '[512, 64]', 'dropout': 0.5782738384318942, 'batch_norm': True, 'lr': 0.0006209699710801793, 'weight_decay': 1.4541805537561652e-06, 'epochs': 84, 'loss': 'mse', 'optimizer': 'adam', 'graph_mode': 'cutoff', 'cutoff': 0.3361279662891633, 'grm_norm': 'cosine_then_gcn', 'self_loops': True, 'use_snp_selection': False}. Best is trial 72 with value: 0.279860945049314.
[I 2025-11-12 00:34:33,500] Trial 94 finished with value: 0.25978979927884865 and parameters: {'model_type': 'graphsage', 'hidden_dims': '[512, 64]', 'dropout': 0.5738751470033314, 'batch_norm': True, 'lr': 0.0003736213954161908, 'weight_decay': 1.5336864660681451e-06, 'epochs': 81, 'loss': 'mse', 'optimizer': 'adam', 'graph_mode': 'cutoff', 'cutoff': 0.3714762568756305, 'grm_norm': 'cosine_then_gcn', 'self_loops': True, 'use_snp_selection': False}. Best is trial 72 with value: 0.279860945049314.
[I 2025-11-12 00:35:52,256] Trial 95 finished with value: 0.26530836044222356 and parameters: {'model_type': 'graphsage', 'hidden_dims': '[512, 64]', 'dropout': 0.5598672487025107, 'batch_norm': True, 'lr': 0.0005797066916788241, 'weight_decay': 1.2858349042911432e-06, 'epochs': 71, 'loss': 'mse', 'optimizer': 'adam', 'graph_mode': 'cutoff', 'cutoff': 0.3380780656572936, 'grm_norm': 'cosine_then_gcn', 'self_loops': True, 'use_snp_selection': False}. Best is trial 72 with value: 0.279860945049314.
[I 2025-11-12 00:37:24,178] Trial 96 finished with value: 0.24772531384457216 and parameters: {'model_type': 'graphsage', 'hidden_dims': '[512, 64]', 'dropout': 0.5886651286620896, 'batch_norm': True, 'lr': 0.0006141008629651759, 'weight_decay': 1.2635593065762901e-06, 'epochs': 88, 'loss': 'mse', 'optimizer': 'adam', 'graph_mode': 'cutoff', 'cutoff': 0.24267261105630555, 'grm_norm': 'cosine_then_gcn', 'self_loops': True, 'use_snp_selection': True, 'num_snps': 21283}. Best is trial 72 with value: 0.279860945049314.
[I 2025-11-12 00:39:42,444] Trial 97 finished with value: 0.24901354511640617 and parameters: {'model_type': 'graphsage', 'hidden_dims': '[512, 64]', 'dropout': 0.5558124813433817, 'batch_norm': True, 'lr': 0.00044515292922102433, 'weight_decay': 4.601585965883057e-06, 'epochs': 95, 'loss': 'mse', 'optimizer': 'adam', 'graph_mode': 'knn', 'source': 'grm', 'knn_k': 9, 'weighted_edges': True, 'symmetrize_mode': 'union', 'use_snp_selection': False}. Best is trial 72 with value: 0.279860945049314.
[I 2025-11-12 00:41:06,151] Trial 98 finished with value: 0.2574742533027311 and parameters: {'model_type': 'graphsage', 'hidden_dims': '[512, 64]', 'dropout': 0.5423116049332642, 'batch_norm': True, 'lr': 0.000528166926996644, 'weight_decay': 2.1989390276828005e-06, 'epochs': 70, 'loss': 'mse', 'optimizer': 'adam', 'graph_mode': 'cutoff', 'cutoff': 0.29449531154875275, 'grm_norm': 'cosine_then_gcn', 'self_loops': True, 'use_snp_selection': False}. Best is trial 72 with value: 0.279860945049314.
[I 2025-11-12 00:42:17,207] Trial 99 finished with value: 0.014013000134830972 and parameters: {'model_type': 'graphsage', 'hidden_dims': '[512, 64]', 'dropout': 0.5780903442016935, 'batch_norm': False, 'lr': 0.0006663016333151218, 'weight_decay': 3.231356965155327e-06, 'epochs': 65, 'loss': 'mae', 'optimizer': 'adam', 'graph_mode': 'cutoff', 'cutoff': 0.39481698250389485, 'grm_norm': 'cosine_then_gcn', 'self_loops': True, 'use_snp_selection': False}. Best is trial 72 with value: 0.279860945049314.
[I 2025-11-12 00:43:40,018] Trial 100 finished with value: 0.2529271740354839 and parameters: {'model_type': 'graphsage', 'hidden_dims': '[512, 64]', 'dropout': 0.5998054025367133, 'batch_norm': True, 'lr': 0.00046932434716275354, 'weight_decay': 1.0994652934094663e-06, 'epochs': 76, 'loss': 'mse', 'optimizer': 'adam', 'graph_mode': 'cutoff', 'cutoff': 0.3382069714632545, 'grm_norm': 'cosine_then_gcn', 'self_loops': False, 'use_snp_selection': False}. Best is trial 72 with value: 0.279860945049314.
[I 2025-11-12 00:44:51,618] Trial 101 finished with value: 0.26667675849154854 and parameters: {'model_type': 'graphsage', 'hidden_dims': '[512, 64]', 'dropout': 0.5630014006222781, 'batch_norm': True, 'lr': 0.000569189739333551, 'weight_decay': 1.5893411874418668e-06, 'epochs': 58, 'loss': 'mse', 'optimizer': 'adam', 'graph_mode': 'cutoff', 'cutoff': 0.3062646704864554, 'grm_norm': 'cosine_then_gcn', 'self_loops': True, 'use_snp_selection': False}. Best is trial 72 with value: 0.279860945049314.
[I 2025-11-12 00:46:08,031] Trial 102 finished with value: 0.2613553253708815 and parameters: {'model_type': 'graphsage', 'hidden_dims': '[512, 64]', 'dropout': 0.561538494035118, 'batch_norm': True, 'lr': 0.0005831145031510466, 'weight_decay': 1.7636993986419814e-06, 'epochs': 58, 'loss': 'mse', 'optimizer': 'adam', 'graph_mode': 'cutoff', 'cutoff': 0.2751714294677857, 'grm_norm': 'cosine_then_gcn', 'self_loops': True, 'use_snp_selection': False}. Best is trial 72 with value: 0.279860945049314.
[I 2025-11-12 00:47:08,936] Trial 103 finished with value: 0.2493682592147201 and parameters: {'model_type': 'graphsage', 'hidden_dims': '[512, 64]', 'dropout': 0.5312422366034389, 'batch_norm': True, 'lr': 0.0008489382529316193, 'weight_decay': 8.589689067548028e-07, 'epochs': 45, 'loss': 'mse', 'optimizer': 'adam', 'graph_mode': 'cutoff', 'cutoff': 0.3069972356753655, 'grm_norm': 'cosine_then_gcn', 'self_loops': True, 'use_snp_selection': False}. Best is trial 72 with value: 0.279860945049314.
[I 2025-11-12 00:48:25,664] Trial 104 finished with value: 0.2620862082121407 and parameters: {'model_type': 'graphsage', 'hidden_dims': '[512, 64]', 'dropout': 0.574051984710605, 'batch_norm': True, 'lr': 0.00036925599339291223, 'weight_decay': 1.0242857450407147e-06, 'epochs': 69, 'loss': 'mse', 'optimizer': 'adam', 'graph_mode': 'cutoff', 'cutoff': 0.3455782729669246, 'grm_norm': 'cosine_then_gcn', 'self_loops': True, 'use_snp_selection': False}. Best is trial 72 with value: 0.279860945049314.
[I 2025-11-12 00:49:47,916] Trial 105 finished with value: 0.2562996445630481 and parameters: {'model_type': 'graphsage', 'hidden_dims': '[512, 64]', 'dropout': 0.5835067008265108, 'batch_norm': True, 'lr': 0.0004892892829083186, 'weight_decay': 1.5812723712562711e-06, 'epochs': 52, 'loss': 'mse', 'optimizer': 'adam', 'graph_mode': 'cutoff', 'cutoff': 0.24471482130460387, 'grm_norm': 'cosine_then_gcn', 'self_loops': True, 'use_snp_selection': False}. Best is trial 72 with value: 0.279860945049314.
[I 2025-11-12 00:51:55,543] Trial 106 finished with value: 0.2666098639562867 and parameters: {'model_type': 'graphsage', 'hidden_dims': '[512, 64]', 'dropout': 0.5547497942017585, 'batch_norm': True, 'lr': 0.0006465814818489345, 'weight_decay': 6.229910338679353e-06, 'epochs': 82, 'loss': 'mse', 'optimizer': 'adam', 'graph_mode': 'cutoff', 'cutoff': 0.21834347974887366, 'grm_norm': 'cosine_then_gcn', 'self_loops': True, 'use_snp_selection': False}. Best is trial 72 with value: 0.279860945049314.
[I 2025-11-12 00:53:40,409] Trial 107 finished with value: 0.2561364070611211 and parameters: {'model_type': 'graphsage', 'hidden_dims': '[512, 128]', 'dropout': 0.5443316104824062, 'batch_norm': True, 'lr': 0.0006850209426423086, 'weight_decay': 5.520802364859711e-06, 'epochs': 84, 'loss': 'mse', 'optimizer': 'adam', 'graph_mode': 'cutoff', 'cutoff': 0.2611641378851576, 'grm_norm': 'cosine_then_gcn', 'self_loops': True, 'use_snp_selection': False}. Best is trial 72 with value: 0.279860945049314.
[I 2025-11-12 00:55:15,184] Trial 108 finished with value: 0.2678560196308818 and parameters: {'model_type': 'graphsage', 'hidden_dims': '[512, 64]', 'dropout': 0.5918833231361664, 'batch_norm': True, 'lr': 0.00042337902794922474, 'weight_decay': 2.040757983586029e-06, 'epochs': 60, 'loss': 'mse', 'optimizer': 'adam', 'graph_mode': 'cutoff', 'cutoff': 0.23527347276950364, 'grm_norm': 'cosine_then_gcn', 'self_loops': True, 'use_snp_selection': False}. Best is trial 72 with value: 0.279860945049314.
[I 2025-11-12 00:56:47,128] Trial 109 finished with value: 0.2677041537660866 and parameters: {'model_type': 'graphsage', 'hidden_dims': '[256, 128]', 'dropout': 0.5688584525424872, 'batch_norm': True, 'lr': 0.0003266714350832286, 'weight_decay': 2.4318440954713964e-06, 'epochs': 77, 'loss': 'mse', 'optimizer': 'adam', 'graph_mode': 'cutoff', 'cutoff': 0.2232770316724616, 'grm_norm': 'cosine_then_gcn', 'self_loops': True, 'use_snp_selection': False}. Best is trial 72 with value: 0.279860945049314.
[I 2025-11-12 00:58:48,172] Trial 110 finished with value: 0.2510639854897446 and parameters: {'model_type': 'graphsage', 'hidden_dims': '[256, 128]', 'dropout': 0.5129459556871111, 'batch_norm': True, 'lr': 0.0004064073501664492, 'weight_decay': 3.3408046254981083e-06, 'epochs': 110, 'loss': 'mse', 'optimizer': 'adam', 'graph_mode': 'cutoff', 'cutoff': 0.2284940966390186, 'grm_norm': 'cosine_then_gcn', 'self_loops': True, 'use_snp_selection': False}. Best is trial 72 with value: 0.279860945049314.
[I 2025-11-12 01:00:40,522] Trial 111 finished with value: 0.25730701828490954 and parameters: {'model_type': 'graphsage', 'hidden_dims': '[256, 128]', 'dropout': 0.5668736385299941, 'batch_norm': True, 'lr': 0.0002669253011614409, 'weight_decay': 2.189845626404017e-06, 'epochs': 95, 'loss': 'mse', 'optimizer': 'adam', 'graph_mode': 'cutoff', 'cutoff': 0.21732009542362293, 'grm_norm': 'cosine_then_gcn', 'self_loops': True, 'use_snp_selection': False}. Best is trial 72 with value: 0.279860945049314.
[I 2025-11-12 01:01:48,098] Trial 112 finished with value: 0.2610367144225435 and parameters: {'model_type': 'graphsage', 'hidden_dims': '[256, 128]', 'dropout': 0.5923791752773645, 'batch_norm': True, 'lr': 0.000794217104788861, 'weight_decay': 2.59529644244192e-06, 'epochs': 55, 'loss': 'mse', 'optimizer': 'adam', 'graph_mode': 'cutoff', 'cutoff': 0.23511632395310508, 'grm_norm': 'cosine_then_gcn', 'self_loops': True, 'use_snp_selection': False}. Best is trial 72 with value: 0.279860945049314.
[I 2025-11-12 01:02:37,114] Trial 113 finished with value: 0.27330240454370613 and parameters: {'model_type': 'graphsage', 'hidden_dims': '[256, 128]', 'dropout': 0.5502239322457255, 'batch_norm': True, 'lr': 0.00033941265095897865, 'weight_decay': 3.971037750679963e-06, 'epochs': 40, 'loss': 'mse', 'optimizer': 'adam', 'graph_mode': 'cutoff', 'cutoff': 0.2541878845596147, 'grm_norm': 'cosine_then_gcn', 'self_loops': True, 'use_snp_selection': False}. Best is trial 72 with value: 0.279860945049314.
[I 2025-11-12 01:03:34,977] Trial 114 finished with value: 0.2574099298791429 and parameters: {'model_type': 'graphsage', 'hidden_dims': '[256, 128]', 'dropout': 0.5511220326049086, 'batch_norm': True, 'lr': 0.0003263758893179405, 'weight_decay': 7.673871661037826e-06, 'epochs': 40, 'loss': 'mse', 'optimizer': 'adam', 'graph_mode': 'cutoff', 'cutoff': 0.21639461790556877, 'grm_norm': 'cosine_then_gcn', 'self_loops': True, 'use_snp_selection': False}. Best is trial 72 with value: 0.279860945049314.
[I 2025-11-12 01:04:55,153] Trial 115 finished with value: 0.26878969184033674 and parameters: {'model_type': 'graphsage', 'hidden_dims': '[256, 128]', 'dropout': 0.5341348738765452, 'batch_norm': True, 'lr': 0.00020796761555059634, 'weight_decay': 1.0994596704736109e-05, 'epochs': 77, 'loss': 'mse', 'optimizer': 'adam', 'graph_mode': 'cutoff', 'cutoff': 0.25466811123871314, 'grm_norm': 'gcn', 'self_loops': True, 'use_snp_selection': False}. Best is trial 72 with value: 0.279860945049314.
[I 2025-11-12 01:05:51,858] Trial 116 finished with value: 0.2384503623015913 and parameters: {'model_type': 'graphsage', 'hidden_dims': '[256, 128]', 'dropout': 0.5295567207217261, 'batch_norm': True, 'lr': 0.0002297287160637812, 'weight_decay': 6.076469151697398e-06, 'epochs': 46, 'loss': 'mse', 'optimizer': 'adam', 'graph_mode': 'knn', 'source': 'grm', 'knn_k': 6, 'weighted_edges': False, 'symmetrize_mode': 'union', 'use_snp_selection': True, 'num_snps': 11286}. Best is trial 72 with value: 0.279860945049314.
[I 2025-11-12 01:07:11,344] Trial 117 finished with value: 0.2369785948927726 and parameters: {'model_type': 'graphsage', 'hidden_dims': '[256, 128]', 'dropout': 0.4775269536723184, 'batch_norm': True, 'lr': 0.00019197966966665942, 'weight_decay': 9.614549313430442e-06, 'epochs': 76, 'loss': 'mse', 'optimizer': 'adam', 'graph_mode': 'cutoff', 'cutoff': 0.2531204859807221, 'grm_norm': 'gcn', 'self_loops': True, 'use_snp_selection': False}. Best is trial 72 with value: 0.279860945049314.
[I 2025-11-12 01:08:06,418] Trial 118 finished with value: 0.09967670214144082 and parameters: {'model_type': 'graphsage', 'hidden_dims': '[256, 128]', 'dropout': 0.5038081053779837, 'batch_norm': False, 'lr': 0.00027610461289984557, 'weight_decay': 1.3245626316878243e-05, 'epochs': 60, 'loss': 'mse', 'optimizer': 'adam', 'graph_mode': 'cutoff', 'cutoff': 0.28032869164152435, 'grm_norm': 'gcn', 'self_loops': True, 'use_snp_selection': False}. Best is trial 72 with value: 0.279860945049314.
[I 2025-11-12 01:09:22,351] Trial 119 finished with value: 0.26945453495344185 and parameters: {'model_type': 'graphsage', 'hidden_dims': '[256, 128]', 'dropout': 0.5184975145858897, 'batch_norm': True, 'lr': 0.00035918452083671617, 'weight_decay': 4.088561003170203e-06, 'epochs': 54, 'loss': 'mae', 'optimizer': 'adam', 'graph_mode': 'cutoff', 'cutoff': 0.20834925939574916, 'grm_norm': 'gcn', 'self_loops': False, 'use_snp_selection': False}. Best is trial 72 with value: 0.279860945049314.
[I 2025-11-12 01:10:39,650] Trial 120 finished with value: 0.26712101366150465 and parameters: {'model_type': 'graphsage', 'hidden_dims': '[256, 128]', 'dropout': 0.48808547950697145, 'batch_norm': True, 'lr': 0.00022006750491853803, 'weight_decay': 4.10722721775502e-06, 'epochs': 53, 'loss': 'mae', 'optimizer': 'adam', 'graph_mode': 'cutoff', 'cutoff': 0.2000940617456805, 'grm_norm': 'gcn', 'self_loops': False, 'use_snp_selection': False}. Best is trial 72 with value: 0.279860945049314.
[I 2025-11-12 01:11:53,919] Trial 121 finished with value: 0.27034125799848563 and parameters: {'model_type': 'graphsage', 'hidden_dims': '[256, 128]', 'dropout': 0.48446597088971066, 'batch_norm': True, 'lr': 0.00022034870296699975, 'weight_decay': 4.310113279885445e-06, 'epochs': 53, 'loss': 'mae', 'optimizer': 'adam', 'graph_mode': 'cutoff', 'cutoff': 0.21046009341740157, 'grm_norm': 'gcn', 'self_loops': False, 'use_snp_selection': False}. Best is trial 72 with value: 0.279860945049314.
[I 2025-11-12 01:13:11,045] Trial 122 finished with value: 0.2737402096987501 and parameters: {'model_type': 'graphsage', 'hidden_dims': '[256, 128]', 'dropout': 0.46757844330508375, 'batch_norm': True, 'lr': 0.00021030198488827104, 'weight_decay': 3.6791317493122904e-06, 'epochs': 53, 'loss': 'mae', 'optimizer': 'adam', 'graph_mode': 'cutoff', 'cutoff': 0.2008770022533047, 'grm_norm': 'gcn', 'self_loops': False, 'use_snp_selection': False}. Best is trial 72 with value: 0.279860945049314.
[I 2025-11-12 01:14:11,803] Trial 123 finished with value: 0.25177051467416217 and parameters: {'model_type': 'graphsage', 'hidden_dims': '[256, 128]', 'dropout': 0.4893943492150704, 'batch_norm': True, 'lr': 0.0002259891997901603, 'weight_decay': 4.246061864371917e-06, 'epochs': 40, 'loss': 'mae', 'optimizer': 'adam', 'graph_mode': 'cutoff', 'cutoff': 0.20810514699335877, 'grm_norm': 'gcn', 'self_loops': False, 'use_snp_selection': False}. Best is trial 72 with value: 0.279860945049314.
[I 2025-11-12 01:15:19,028] Trial 124 finished with value: 0.2587222120115701 and parameters: {'model_type': 'graphsage', 'hidden_dims': '[256, 128]', 'dropout': 0.4547954957313377, 'batch_norm': True, 'lr': 0.00020072655651058244, 'weight_decay': 4.230560315971077e-06, 'epochs': 53, 'loss': 'mae', 'optimizer': 'adam', 'graph_mode': 'cutoff', 'cutoff': 0.23406369435290428, 'grm_norm': 'gcn', 'self_loops': False, 'use_snp_selection': False}. Best is trial 72 with value: 0.279860945049314.
[I 2025-11-12 01:16:26,545] Trial 125 finished with value: 0.2654202321922435 and parameters: {'model_type': 'graphsage', 'hidden_dims': '[256, 128]', 'dropout': 0.468464558699734, 'batch_norm': True, 'lr': 0.00016485941092897038, 'weight_decay': 1.2769569510295581e-05, 'epochs': 45, 'loss': 'mae', 'optimizer': 'adam', 'graph_mode': 'cutoff', 'cutoff': 0.2024485531920466, 'grm_norm': 'gcn', 'self_loops': False, 'use_snp_selection': False}. Best is trial 72 with value: 0.279860945049314.
[I 2025-11-12 01:17:25,226] Trial 126 finished with value: 0.27956827096520553 and parameters: {'model_type': 'graphsage', 'hidden_dims': '[256, 128]', 'dropout': 0.48531464210882574, 'batch_norm': True, 'lr': 0.0003263570866823941, 'weight_decay': 3.7088838642750956e-06, 'epochs': 50, 'loss': 'mae', 'optimizer': 'adam', 'graph_mode': 'cutoff', 'cutoff': 0.25141402731164725, 'grm_norm': 'gcn', 'self_loops': False, 'use_snp_selection': False}. Best is trial 72 with value: 0.279860945049314.
[I 2025-11-12 01:18:32,162] Trial 127 finished with value: 0.28085608979509497 and parameters: {'model_type': 'graphsage', 'hidden_dims': '[256, 128]', 'dropout': 0.4816483537525867, 'batch_norm': True, 'lr': 0.0003233357947795288, 'weight_decay': 3.7354527185578032e-06, 'epochs': 52, 'loss': 'mae', 'optimizer': 'adam', 'graph_mode': 'cutoff', 'cutoff': 0.23075074958074893, 'grm_norm': 'gcn', 'self_loops': False, 'use_snp_selection': False}. Best is trial 127 with value: 0.28085608979509497.
[I 2025-11-12 01:19:48,316] Trial 128 finished with value: 0.269426367637562 and parameters: {'model_type': 'graphsage', 'hidden_dims': '[256, 128]', 'dropout': 0.5207996271737827, 'batch_norm': True, 'lr': 0.00033528629344325344, 'weight_decay': 3.208152413793525e-05, 'epochs': 61, 'loss': 'mae', 'optimizer': 'adam', 'graph_mode': 'cutoff', 'cutoff': 0.2299291502117768, 'grm_norm': 'gcn', 'self_loops': False, 'use_snp_selection': False}. Best is trial 127 with value: 0.28085608979509497.
[I 2025-11-12 01:20:56,156] Trial 129 finished with value: 0.27282016836577966 and parameters: {'model_type': 'graphsage', 'hidden_dims': '[256, 128]', 'dropout': 0.5219239772925783, 'batch_norm': True, 'lr': 0.00031612165823957346, 'weight_decay': 4.13614071472692e-05, 'epochs': 62, 'loss': 'mae', 'optimizer': 'adam', 'graph_mode': 'cutoff', 'cutoff': 0.2553174338779841, 'grm_norm': 'gcn', 'self_loops': False, 'use_snp_selection': False}. Best is trial 127 with value: 0.28085608979509497.
[I 2025-11-12 01:22:04,243] Trial 130 finished with value: 0.2764119934354031 and parameters: {'model_type': 'graphsage', 'hidden_dims': '[256, 128]', 'dropout': 0.5157801984672737, 'batch_norm': True, 'lr': 0.00028650207958790913, 'weight_decay': 4.250732211703661e-05, 'epochs': 63, 'loss': 'mae', 'optimizer': 'adam', 'graph_mode': 'cutoff', 'cutoff': 0.2568740568182967, 'grm_norm': 'gcn', 'self_loops': False, 'use_snp_selection': False}. Best is trial 127 with value: 0.28085608979509497.
