[I 2025-11-03 14:32:50,336] Trial 11 finished with value: 0.1181601065588752 and parameters: {'model_type': 'graphsage', 'hidden_dims': '[512, 256]', 'dropout': 0.3719635790172371, 'batch_norm': True, 'lr': 0.000791308626346835, 'weight_decay': 1.8187594072837697e-06, 'epochs': 255, 'loss': 'mse', 'optimizer': 'adam', 'graph_mode': 'knn', 'source': 'grm', 'knn_k': 10, 'weighted_edges': True, 'symmetrize_mode': 'union', 'use_snp_selection': False}. Best is trial 6 with value: 0.12632520976631367.
[I 2025-11-03 14:32:56,936] Trial 12 finished with value: 0.11213946814876828 and parameters: {'model_type': 'graphsage', 'hidden_dims': '[512, 256]', 'dropout': 0.3507813621480734, 'batch_norm': True, 'lr': 0.0001520253709731507, 'weight_decay': 0.00031248060348503496, 'epochs': 253, 'loss': 'mae', 'optimizer': 'adam', 'graph_mode': 'knn', 'source': 'grm', 'knn_k': 10, 'weighted_edges': True, 'symmetrize_mode': 'union', 'use_snp_selection': False}. Best is trial 6 with value: 0.12632520976631367.
[I 2025-11-03 14:33:02,175] Trial 13 finished with value: 0.12222588702949125 and parameters: {'model_type': 'graphsage', 'hidden_dims': '[512, 256]', 'dropout': 0.42908399240511785, 'batch_norm': True, 'lr': 0.0009956278186051537, 'weight_decay': 3.87720151008303e-07, 'epochs': 244, 'loss': 'mse', 'optimizer': 'adam', 'graph_mode': 'knn', 'source': 'grm', 'knn_k': 4, 'weighted_edges': True, 'symmetrize_mode': 'mutual', 'use_snp_selection': False}. Best is trial 6 with value: 0.12632520976631367.
[I 2025-11-03 14:33:07,150] Trial 14 finished with value: 0.11360698876614478 and parameters: {'model_type': 'graphsage', 'hidden_dims': '[512, 256]', 'dropout': 0.46467037219538687, 'batch_norm': True, 'lr': 0.0003093651826494884, 'weight_decay': 1.3208198619177989e-07, 'epochs': 225, 'loss': 'mse', 'optimizer': 'adam', 'graph_mode': 'knn', 'source': 'grm', 'knn_k': 3, 'weighted_edges': True, 'symmetrize_mode': 'mutual', 'use_snp_selection': False}. Best is trial 6 with value: 0.12632520976631367.
[I 2025-11-03 14:33:13,233] Trial 15 finished with value: 0.11154420933729053 and parameters: {'model_type': 'graphsage', 'hidden_dims': '[512, 64]', 'dropout': 0.5971506176290345, 'batch_norm': True, 'lr': 7.092120321265845e-05, 'weight_decay': 4.857490268368051e-07, 'epochs': 305, 'loss': 'mae', 'optimizer': 'adam', 'graph_mode': 'knn', 'source': 'grm', 'knn_k': 4, 'weighted_edges': True, 'symmetrize_mode': 'mutual', 'use_snp_selection': False}. Best is trial 6 with value: 0.12632520976631367.
[I 2025-11-03 14:33:16,419] Trial 16 finished with value: 0.0520730308607633 and parameters: {'model_type': 'graphsage', 'hidden_dims': '[256, 128, 64]', 'dropout': 0.29581760028888954, 'batch_norm': True, 'lr': 1.6737040749638926e-05, 'weight_decay': 4.068448697583434e-06, 'epochs': 228, 'loss': 'mae', 'optimizer': 'adam', 'graph_mode': 'knn', 'source': 'grm', 'knn_k': 3, 'weighted_edges': False, 'symmetrize_mode': 'mutual', 'use_snp_selection': False}. Best is trial 6 with value: 0.12632520976631367.
[I 2025-11-03 14:33:22,454] Trial 17 finished with value: 0.11225375293396815 and parameters: {'model_type': 'graphsage', 'hidden_dims': '[512, 128]', 'dropout': 0.2374945222606738, 'batch_norm': True, 'lr': 0.00024252998252347708, 'weight_decay': 0.0001728289255135471, 'epochs': 301, 'loss': 'mse', 'optimizer': 'adam', 'graph_mode': 'knn', 'source': 'grm', 'knn_k': 4, 'weighted_edges': True, 'symmetrize_mode': 'mutual', 'use_snp_selection': False}. Best is trial 6 with value: 0.12632520976631367.
[I 2025-11-03 14:33:27,270] Trial 18 finished with value: 0.11572964496787981 and parameters: {'model_type': 'graphsage', 'hidden_dims': '[512, 256]', 'dropout': 0.45799607615690646, 'batch_norm': True, 'lr': 0.0009614139356617602, 'weight_decay': 7.215056472974216e-06, 'epochs': 217, 'loss': 'mse', 'optimizer': 'adam', 'graph_mode': 'knn', 'source': 'grm', 'knn_k': 2, 'weighted_edges': True, 'symmetrize_mode': 'mutual', 'use_snp_selection': False}. Best is trial 6 with value: 0.12632520976631367.
[I 2025-11-03 14:33:33,884] Trial 19 finished with value: 0.12467521805763984 and parameters: {'model_type': 'graphsage', 'hidden_dims': '[512, 256]', 'dropout': 0.4326452098279709, 'batch_norm': True, 'lr': 7.732140669604487e-05, 'weight_decay': 4.315495574710184e-07, 'epochs': 337, 'loss': 'mae', 'optimizer': 'adam', 'graph_mode': 'knn', 'source': 'grm', 'knn_k': 5, 'weighted_edges': False, 'symmetrize_mode': 'mutual', 'use_snp_selection': False}. Best is trial 6 with value: 0.12632520976631367.
[I 2025-11-03 14:33:40,721] Trial 20 finished with value: 0.10630097745148134 and parameters: {'model_type': 'graphsage', 'hidden_dims': '[512, 256]', 'dropout': 0.32590666803578755, 'batch_norm': True, 'lr': 7.008531997990307e-05, 'weight_decay': 9.591203210451866e-07, 'epochs': 346, 'loss': 'mae', 'optimizer': 'adam', 'graph_mode': 'knn', 'source': 'grm', 'knn_k': 6, 'weighted_edges': False, 'symmetrize_mode': 'mutual', 'use_snp_selection': False}. Best is trial 6 with value: 0.12632520976631367.
[I 2025-11-03 14:33:46,914] Trial 21 finished with value: 0.11209809124068659 and parameters: {'model_type': 'graphsage', 'hidden_dims': '[512, 256]', 'dropout': 0.4186577485916534, 'batch_norm': True, 'lr': 8.931394279267106e-05, 'weight_decay': 1.7735235745867076e-07, 'epochs': 305, 'loss': 'mae', 'optimizer': 'adam', 'graph_mode': 'knn', 'source': 'grm', 'knn_k': 5, 'weighted_edges': False, 'symmetrize_mode': 'mutual', 'use_snp_selection': False}. Best is trial 6 with value: 0.12632520976631367.
[I 2025-11-03 14:33:52,619] Trial 22 finished with value: 0.11125510488682809 and parameters: {'model_type': 'graphsage', 'hidden_dims': '[512, 256]', 'dropout': 0.371324184320069, 'batch_norm': True, 'lr': 0.000310908981545934, 'weight_decay': 5.284822059399674e-07, 'epochs': 276, 'loss': 'mae', 'optimizer': 'adam', 'graph_mode': 'knn', 'source': 'grm', 'knn_k': 4, 'weighted_edges': False, 'symmetrize_mode': 'mutual', 'use_snp_selection': False}. Best is trial 6 with value: 0.12632520976631367.
[I 2025-11-03 14:33:57,903] Trial 23 finished with value: 0.05418776592769265 and parameters: {'model_type': 'graphsage', 'hidden_dims': '[512, 256]', 'dropout': 0.4703840332369766, 'batch_norm': True, 'lr': 9.960893610571038e-06, 'weight_decay': 3.7890854779681826e-07, 'epochs': 253, 'loss': 'mae', 'optimizer': 'adam', 'graph_mode': 'knn', 'source': 'grm', 'knn_k': 2, 'weighted_edges': True, 'symmetrize_mode': 'mutual', 'use_snp_selection': False}. Best is trial 6 with value: 0.12632520976631367.
[I 2025-11-03 14:34:02,789] Trial 24 finished with value: 0.1360864241733849 and parameters: {'model_type': 'graphsage', 'hidden_dims': '[512, 256]', 'dropout': 0.414884503437908, 'batch_norm': True, 'lr': 0.0005061954643846609, 'weight_decay': 1.0553963070318878e-07, 'epochs': 207, 'loss': 'mae', 'optimizer': 'adam', 'graph_mode': 'knn', 'source': 'grm', 'knn_k': 5, 'weighted_edges': False, 'symmetrize_mode': 'mutual', 'use_snp_selection': False}. Best is trial 24 with value: 0.1360864241733849.
[I 2025-11-03 14:34:06,097] Trial 25 finished with value: 0.09147032627817145 and parameters: {'model_type': 'graphsage', 'hidden_dims': '[256, 128, 64]', 'dropout': 0.38653482579632636, 'batch_norm': True, 'lr': 0.00011341244187998615, 'weight_decay': 1.0777080547661811e-07, 'epochs': 206, 'loss': 'mae', 'optimizer': 'adam', 'graph_mode': 'knn', 'source': 'grm', 'knn_k': 8, 'weighted_edges': False, 'symmetrize_mode': 'mutual', 'use_snp_selection': False}. Best is trial 24 with value: 0.1360864241733849.
[I 2025-11-03 14:34:11,871] Trial 26 finished with value: 0.09603301063073161 and parameters: {'model_type': 'graphsage', 'hidden_dims': '[512, 128]', 'dropout': 0.2470035837292539, 'batch_norm': False, 'lr': 0.00021269402938293495, 'weight_decay': 1.4078283087439993e-05, 'epochs': 166, 'loss': 'mae', 'optimizer': 'adam', 'graph_mode': 'cutoff', 'cutoff': 0.8765009073803762, 'grm_norm': 'none', 'self_loops': True, 'use_snp_selection': True, 'num_snps': 59005}. Best is trial 24 with value: 0.1360864241733849.
[I 2025-11-03 14:34:14,374] Trial 27 finished with value: 0.09838569323250611 and parameters: {'model_type': 'graphsage', 'hidden_dims': '[256, 128]', 'dropout': 0.5564797190138333, 'batch_norm': True, 'lr': 0.0004481065655238418, 'weight_decay': 2.382250333954005e-07, 'epochs': 118, 'loss': 'mae', 'optimizer': 'adam', 'graph_mode': 'knn', 'source': 'grm', 'knn_k': 5, 'weighted_edges': False, 'symmetrize_mode': 'mutual', 'use_snp_selection': False}. Best is trial 24 with value: 0.1360864241733849.
[I 2025-11-03 14:34:21,731] Trial 28 finished with value: 0.1027303051237726 and parameters: {'model_type': 'graphsage', 'hidden_dims': '[512, 64]', 'dropout': 0.3448500597862041, 'batch_norm': True, 'lr': 5.1169544187166864e-05, 'weight_decay': 1.2093531062198734e-06, 'epochs': 326, 'loss': 'mae', 'optimizer': 'adam', 'graph_mode': 'knn', 'source': 'grm', 'knn_k': 7, 'weighted_edges': False, 'symmetrize_mode': 'union', 'use_snp_selection': False}. Best is trial 24 with value: 0.1360864241733849.
[I 2025-11-03 14:34:23,403] Trial 29 finished with value: 0.04254593144904828 and parameters: {'model_type': 'graphsage', 'hidden_dims': '[128, 64]', 'dropout': 0.1881763221627632, 'batch_norm': True, 'lr': 5.910688223700587e-06, 'weight_decay': 5.891149253635698e-05, 'epochs': 96, 'loss': 'mae', 'optimizer': 'adam', 'graph_mode': 'knn', 'source': 'grm', 'knn_k': 3, 'weighted_edges': False, 'symmetrize_mode': 'mutual', 'use_snp_selection': False}. Best is trial 24 with value: 0.1360864241733849.
[I 2025-11-03 14:34:29,390] Trial 30 finished with value: 0.049864351621772794 and parameters: {'model_type': 'graphsage', 'hidden_dims': '[512, 256]', 'dropout': 0.44580372810578295, 'batch_norm': True, 'lr': 1.296380227364303e-06, 'weight_decay': 3.039882986675041e-05, 'epochs': 279, 'loss': 'mae', 'optimizer': 'adam', 'graph_mode': 'knn', 'source': 'grm', 'knn_k': 7, 'weighted_edges': False, 'symmetrize_mode': 'mutual', 'use_snp_selection': False}. Best is trial 24 with value: 0.1360864241733849.
[I 2025-11-03 14:34:34,625] Trial 31 finished with value: 0.10986680670759791 and parameters: {'model_type': 'graphsage', 'hidden_dims': '[512, 256]', 'dropout': 0.4189007884504888, 'batch_norm': True, 'lr': 0.0005848541277690266, 'weight_decay': 3.2099879127891454e-07, 'epochs': 235, 'loss': 'mae', 'optimizer': 'adam', 'graph_mode': 'knn', 'source': 'grm', 'knn_k': 5, 'weighted_edges': True, 'symmetrize_mode': 'mutual', 'use_snp_selection': False}. Best is trial 24 with value: 0.1360864241733849.
[I 2025-11-03 14:34:39,405] Trial 32 finished with value: 0.11728249994535732 and parameters: {'model_type': 'graphsage', 'hidden_dims': '[512, 256]', 'dropout': 0.49831772172293953, 'batch_norm': True, 'lr': 0.0009175106971098907, 'weight_decay': 4.588651012742765e-06, 'epochs': 205, 'loss': 'mse', 'optimizer': 'adam', 'graph_mode': 'knn', 'source': 'grm', 'knn_k': 4, 'weighted_edges': True, 'symmetrize_mode': 'mutual', 'use_snp_selection': False}. Best is trial 24 with value: 0.1360864241733849.
[I 2025-11-03 14:34:43,908] Trial 33 finished with value: 0.09981420828996715 and parameters: {'model_type': 'graphsage', 'hidden_dims': '[512, 256]', 'dropout': 0.4025679949440325, 'batch_norm': True, 'lr': 0.0005034124842044904, 'weight_decay': 1.00300616704021e-07, 'epochs': 175, 'loss': 'mse', 'optimizer': 'adam', 'graph_mode': 'knn', 'source': 'grm', 'knn_k': 6, 'weighted_edges': False, 'symmetrize_mode': 'mutual', 'use_snp_selection': False}. Best is trial 24 with value: 0.1360864241733849.
[I 2025-11-03 14:34:46,507] Trial 34 finished with value: 0.09919092255268627 and parameters: {'model_type': 'graphsage', 'hidden_dims': '[128, 64]', 'dropout': 0.44023543590423275, 'batch_norm': True, 'lr': 0.0002455618768937532, 'weight_decay': 6.694583066604005e-07, 'epochs': 325, 'loss': 'mae', 'optimizer': 'adam', 'graph_mode': 'knn', 'source': 'grm', 'knn_k': 2, 'weighted_edges': False, 'symmetrize_mode': 'mutual', 'use_snp_selection': False}. Best is trial 24 with value: 0.1360864241733849.
[I 2025-11-03 14:34:48,439] Trial 35 finished with value: 0.07526476125895645 and parameters: {'model_type': 'graphsage', 'hidden_dims': '[512, 256]', 'dropout': 0.47981792189754, 'batch_norm': False, 'lr': 0.0005859301954719803, 'weight_decay': 1.7207015694317405e-06, 'epochs': 191, 'loss': 'mse', 'optimizer': 'adam', 'graph_mode': 'knn', 'source': 'grm', 'knn_k': 5, 'weighted_edges': True, 'symmetrize_mode': 'mutual', 'use_snp_selection': True, 'num_snps': 2074}. Best is trial 24 with value: 0.1360864241733849.
[I 2025-11-03 14:34:51,074] Trial 36 finished with value: 0.08513105576886361 and parameters: {'model_type': 'graphsage', 'hidden_dims': '[256, 128]', 'dropout': 0.5423122269106598, 'batch_norm': True, 'lr': 0.00032900132157717194, 'weight_decay': 2.8562994305683507e-07, 'epochs': 144, 'loss': 'mae', 'optimizer': 'adam', 'graph_mode': 'cutoff', 'cutoff': 0.42596163795855535, 'grm_norm': 'cosine', 'self_loops': True, 'use_snp_selection': False}. Best is trial 24 with value: 0.1360864241733849.
[I 2025-11-03 14:34:53,885] Trial 37 finished with value: 0.09124123277475717 and parameters: {'model_type': 'graphsage', 'hidden_dims': '[256, 128, 64]', 'dropout': 0.3268097916720437, 'batch_norm': False, 'lr': 0.00011211683221179414, 'weight_decay': 9.885860618834471e-05, 'epochs': 239, 'loss': 'mse', 'optimizer': 'adam', 'graph_mode': 'knn', 'source': 'grm', 'knn_k': 3, 'weighted_edges': True, 'symmetrize_mode': 'mutual', 'use_snp_selection': True, 'num_snps': 15344}. Best is trial 24 with value: 0.1360864241733849.
[I 2025-11-03 14:35:00,851] Trial 38 finished with value: 0.04484253765801787 and parameters: {'model_type': 'graphsage', 'hidden_dims': '[512, 256]', 'dropout': 0.40104594154599055, 'batch_norm': True, 'lr': 2.8602254084458333e-06, 'weight_decay': 2.6424560986800456e-05, 'epochs': 288, 'loss': 'mae', 'optimizer': 'adam', 'graph_mode': 'cutoff', 'cutoff': 0.2236606579884875, 'grm_norm': 'cosine_then_gcn', 'self_loops': True, 'use_snp_selection': False}. Best is trial 24 with value: 0.1360864241733849.
[I 2025-11-03 14:35:05,593] Trial 39 finished with value: 0.07457155781663352 and parameters: {'model_type': 'graphsage', 'hidden_dims': '[128, 64]', 'dropout': 0.3630130527403892, 'batch_norm': False, 'lr': 0.0006992738555267136, 'weight_decay': 7.026677380686762e-06, 'epochs': 263, 'loss': 'mse', 'optimizer': 'adam', 'graph_mode': 'knn', 'source': 'grm', 'knn_k': 8, 'weighted_edges': False, 'symmetrize_mode': 'mutual', 'use_snp_selection': True, 'num_snps': 58379}. Best is trial 24 with value: 0.1360864241733849.
[I 2025-11-03 14:35:10,140] Trial 40 finished with value: 0.10482246591482301 and parameters: {'model_type': 'graphsage', 'hidden_dims': '[512, 256]', 'dropout': 0.4370950170914252, 'batch_norm': True, 'lr': 0.00020519041857375956, 'weight_decay': 0.0007532046363087115, 'epochs': 206, 'loss': 'mae', 'optimizer': 'adam', 'graph_mode': 'cutoff', 'cutoff': 0.8775832147217085, 'grm_norm': 'cosine', 'self_loops': True, 'use_snp_selection': False}. Best is trial 24 with value: 0.1360864241733849.
[I 2025-11-03 14:35:16,684] Trial 41 finished with value: 0.1212494198743162 and parameters: {'model_type': 'graphsage', 'hidden_dims': '[512, 256]', 'dropout': 0.3780951996587904, 'batch_norm': True, 'lr': 0.0009733078792005678, 'weight_decay': 2.392469683192459e-06, 'epochs': 244, 'loss': 'mse', 'optimizer': 'adam', 'graph_mode': 'knn', 'source': 'grm', 'knn_k': 10, 'weighted_edges': True, 'symmetrize_mode': 'union', 'use_snp_selection': False}. Best is trial 24 with value: 0.1360864241733849.
[I 2025-11-03 14:35:22,977] Trial 42 finished with value: 0.11924813350020085 and parameters: {'model_type': 'graphsage', 'hidden_dims': '[512, 256]', 'dropout': 0.39609135966057324, 'batch_norm': True, 'lr': 0.00046163143554978195, 'weight_decay': 2.416499372963074e-06, 'epochs': 242, 'loss': 'mse', 'optimizer': 'adam', 'graph_mode': 'knn', 'source': 'grm', 'knn_k': 9, 'weighted_edges': True, 'symmetrize_mode': 'union', 'use_snp_selection': False}. Best is trial 24 with value: 0.1360864241733849.
[I 2025-11-03 14:35:27,976] Trial 43 finished with value: 0.11720584384698128 and parameters: {'model_type': 'graphsage', 'hidden_dims': '[512, 256]', 'dropout': 0.3234718446833213, 'batch_norm': True, 'lr': 0.0007498532937780232, 'weight_decay': 2.1006157663145093e-07, 'epochs': 187, 'loss': 'mse', 'optimizer': 'adam', 'graph_mode': 'knn', 'source': 'grm', 'knn_k': 6, 'weighted_edges': True, 'symmetrize_mode': 'union', 'use_snp_selection': False}. Best is trial 24 with value: 0.1360864241733849.
[I 2025-11-03 14:35:33,630] Trial 44 finished with value: 0.11044749839563626 and parameters: {'model_type': 'graphsage', 'hidden_dims': '[512, 256]', 'dropout': 0.3855813320570118, 'batch_norm': True, 'lr': 0.0009717431311938301, 'weight_decay': 1.1964472067450347e-06, 'epochs': 221, 'loss': 'mse', 'optimizer': 'adam', 'graph_mode': 'knn', 'source': 'grm', 'knn_k': 7, 'weighted_edges': True, 'symmetrize_mode': 'union', 'use_snp_selection': False}. Best is trial 24 with value: 0.1360864241733849.
[I 2025-11-03 14:35:36,984] Trial 45 finished with value: 0.05685996474149824 and parameters: {'model_type': 'graphsage', 'hidden_dims': '[256, 128]', 'dropout': 0.494339489960013, 'batch_norm': True, 'lr': 2.471017039225558e-05, 'weight_decay': 1.6187911622885368e-05, 'epochs': 259, 'loss': 'mse', 'optimizer': 'adam', 'graph_mode': 'knn', 'source': 'grm', 'knn_k': 1, 'weighted_edges': True, 'symmetrize_mode': 'union', 'use_snp_selection': False}. Best is trial 24 with value: 0.1360864241733849.
[I 2025-11-03 14:35:42,068] Trial 46 finished with value: 0.11123276424085 and parameters: {'model_type': 'graphsage', 'hidden_dims': '[512, 64]', 'dropout': 0.26078437082790235, 'batch_norm': True, 'lr': 0.0003757232780043204, 'weight_decay': 5.342878303124109e-07, 'epochs': 169, 'loss': 'mse', 'optimizer': 'adam', 'graph_mode': 'knn', 'source': 'grm', 'knn_k': 9, 'weighted_edges': True, 'symmetrize_mode': 'union', 'use_snp_selection': False}. Best is trial 24 with value: 0.1360864241733849.
[I 2025-11-03 14:35:46,019] Trial 47 finished with value: -0.007177856737175174 and parameters: {'model_type': 'graphsage', 'hidden_dims': '[512, 128]', 'dropout': 0.347206749112411, 'batch_norm': False, 'lr': 0.0006376199749788896, 'weight_decay': 9.085915343549831e-06, 'epochs': 58, 'loss': 'mae', 'optimizer': 'adam', 'graph_mode': 'knn', 'source': 'grm', 'knn_k': 6, 'weighted_edges': True, 'symmetrize_mode': 'union', 'use_snp_selection': True, 'num_snps': 43485}. Best is trial 24 with value: 0.1360864241733849.
[I 2025-11-03 14:35:50,974] Trial 48 finished with value: 0.1186906208127663 and parameters: {'model_type': 'graphsage', 'hidden_dims': '[512, 256]', 'dropout': 0.41923474139023664, 'batch_norm': True, 'lr': 0.0001567778793800581, 'weight_decay': 2.589461733049632e-06, 'epochs': 212, 'loss': 'mse', 'optimizer': 'adam', 'graph_mode': 'knn', 'source': 'grm', 'knn_k': 5, 'weighted_edges': False, 'symmetrize_mode': 'mutual', 'use_snp_selection': False}. Best is trial 24 with value: 0.1360864241733849.
[I 2025-11-03 14:35:54,807] Trial 49 finished with value: 0.10356644029788181 and parameters: {'model_type': 'graphsage', 'hidden_dims': '[512, 256]', 'dropout': 0.29984674482858886, 'batch_norm': True, 'lr': 4.159278729816073e-05, 'weight_decay': 1.7569206280535474e-07, 'epochs': 139, 'loss': 'mae', 'optimizer': 'adam', 'graph_mode': 'cutoff', 'cutoff': 0.5358834616354312, 'grm_norm': 'gcn', 'self_loops': False, 'use_snp_selection': False}. Best is trial 24 with value: 0.1360864241733849.
[I 2025-11-03 14:36:01,165] Trial 50 finished with value: 0.11526991497776823 and parameters: {'model_type': 'graphsage', 'hidden_dims': '[512, 256]', 'dropout': 0.5260502616305407, 'batch_norm': True, 'lr': 0.00027581633694096516, 'weight_decay': 4.3043395125304784e-05, 'epochs': 293, 'loss': 'mse', 'optimizer': 'adam', 'graph_mode': 'knn', 'source': 'grm', 'knn_k': 4, 'weighted_edges': True, 'symmetrize_mode': 'union', 'use_snp_selection': False}. Best is trial 24 with value: 0.1360864241733849.
[I 2025-11-03 14:36:07,521] Trial 51 finished with value: 0.1064362194755728 and parameters: {'model_type': 'graphsage', 'hidden_dims': '[512, 256]', 'dropout': 0.39262745194692295, 'batch_norm': True, 'lr': 0.00041785415566752407, 'weight_decay': 2.7869356023092493e-06, 'epochs': 243, 'loss': 'mse', 'optimizer': 'adam', 'graph_mode': 'knn', 'source': 'grm', 'knn_k': 9, 'weighted_edges': True, 'symmetrize_mode': 'union', 'use_snp_selection': False}. Best is trial 24 with value: 0.1360864241733849.
[I 2025-11-03 14:36:13,998] Trial 52 finished with value: 0.11650046693112309 and parameters: {'model_type': 'graphsage', 'hidden_dims': '[512, 256]', 'dropout': 0.36438682785613463, 'batch_norm': True, 'lr': 0.00048673375741522135, 'weight_decay': 5.276479400262126e-06, 'epochs': 244, 'loss': 'mse', 'optimizer': 'adam', 'graph_mode': 'knn', 'source': 'grm', 'knn_k': 10, 'weighted_edges': True, 'symmetrize_mode': 'union', 'use_snp_selection': False}. Best is trial 24 with value: 0.1360864241733849.
[I 2025-11-03 14:36:20,762] Trial 53 finished with value: 0.10803302538392588 and parameters: {'model_type': 'graphsage', 'hidden_dims': '[512, 256]', 'dropout': 0.4305722394765119, 'batch_norm': True, 'lr': 0.0007516165373574502, 'weight_decay': 8.073457321780635e-07, 'epochs': 269, 'loss': 'mse', 'optimizer': 'adam', 'graph_mode': 'knn', 'source': 'grm', 'knn_k': 9, 'weighted_edges': True, 'symmetrize_mode': 'union', 'use_snp_selection': False}. Best is trial 24 with value: 0.1360864241733849.
