[I 2025-11-13 18:25:32,132] Trial 135 finished with value: 0.26403581694630784 and parameters: {'model_type': 'graphsage', 'hidden_dims': '[256, 128]', 'dropout': 0.1846706552779315, 'batch_norm': False, 'lr': 7.701084065880461e-05, 'weight_decay': 2.666853691163281e-07, 'epochs': 227, 'loss': 'mae', 'optimizer': 'adam', 'graph_mode': 'cutoff', 'cutoff': 0.4714902984932393, 'grm_norm': 'cosine_then_gcn', 'self_loops': False, 'use_snp_selection': True, 'num_snps': 53129}. Best is trial 19 with value: 0.30021150341023195.
[I 2025-11-13 18:28:22,427] Trial 136 finished with value: 0.270985567536738 and parameters: {'model_type': 'graphsage', 'hidden_dims': '[256, 128]', 'dropout': 0.14929914838432642, 'batch_norm': False, 'lr': 3.251233462641978e-05, 'weight_decay': 2.5849630518418353e-06, 'epochs': 236, 'loss': 'mae', 'optimizer': 'adam', 'graph_mode': 'cutoff', 'cutoff': 0.5122499371497573, 'grm_norm': 'cosine_then_gcn', 'self_loops': False, 'use_snp_selection': True, 'num_snps': 58565}. Best is trial 19 with value: 0.30021150341023195.
[I 2025-11-13 18:29:57,849] Trial 137 finished with value: 0.24406257297288367 and parameters: {'model_type': 'graphsage', 'hidden_dims': '[256, 128]', 'dropout': 0.3626258570610711, 'batch_norm': True, 'lr': 4.0744790346300384e-05, 'weight_decay': 1.5133172403208508e-07, 'epochs': 216, 'loss': 'mae', 'optimizer': 'adam', 'graph_mode': 'cutoff', 'cutoff': 0.5377774160790033, 'grm_norm': 'cosine_then_gcn', 'self_loops': False, 'use_snp_selection': False}. Best is trial 19 with value: 0.30021150341023195.
[I 2025-11-13 18:33:26,655] Trial 138 finished with value: 0.2561305673781288 and parameters: {'model_type': 'graphsage', 'hidden_dims': '[256, 128]', 'dropout': 0.40953949412301066, 'batch_norm': False, 'lr': 6.319679480995084e-05, 'weight_decay': 3.4734989500788655e-07, 'epochs': 196, 'loss': 'mae', 'optimizer': 'adam', 'graph_mode': 'knn', 'source': 'grm', 'knn_k': 6, 'weighted_edges': False, 'symmetrize_mode': 'mutual', 'use_snp_selection': True, 'num_snps': 57172}. Best is trial 19 with value: 0.30021150341023195.
[I 2025-11-13 18:37:27,361] Trial 139 finished with value: 0.2754785313658258 and parameters: {'model_type': 'graphsage', 'hidden_dims': '[512, 256]', 'dropout': 0.22631267268574592, 'batch_norm': False, 'lr': 4.6726590744496634e-05, 'weight_decay': 1.0294050481813397e-07, 'epochs': 230, 'loss': 'mae', 'optimizer': 'adam', 'graph_mode': 'cutoff', 'cutoff': 0.46279209723484305, 'grm_norm': 'cosine_then_gcn', 'self_loops': True, 'use_snp_selection': True, 'num_snps': 51091}. Best is trial 19 with value: 0.30021150341023195.
[I 2025-11-13 18:39:21,902] Trial 140 finished with value: 0.22737875134041258 and parameters: {'model_type': 'graphsage', 'hidden_dims': '[256, 128]', 'dropout': 0.5152388707115703, 'batch_norm': False, 'lr': 0.00017947479533295439, 'weight_decay': 1.8185165468239539e-07, 'epochs': 248, 'loss': 'mae', 'optimizer': 'adam', 'graph_mode': 'cutoff', 'cutoff': 0.5811813980957905, 'grm_norm': 'cosine_then_gcn', 'self_loops': False, 'use_snp_selection': True, 'num_snps': 39881}. Best is trial 19 with value: 0.30021150341023195.
[I 2025-11-13 18:41:25,508] Trial 141 finished with value: 0.2835067999750599 and parameters: {'model_type': 'graphsage', 'hidden_dims': '[256, 128, 64]', 'dropout': 0.15764425949186178, 'batch_norm': False, 'lr': 2.2542471282354385e-05, 'weight_decay': 1.6234733394867972e-06, 'epochs': 214, 'loss': 'mae', 'optimizer': 'adam', 'graph_mode': 'cutoff', 'cutoff': 0.4913981267864411, 'grm_norm': 'cosine_then_gcn', 'self_loops': False, 'use_snp_selection': True, 'num_snps': 37857}. Best is trial 19 with value: 0.30021150341023195.
[I 2025-11-13 18:43:29,418] Trial 142 finished with value: 0.2821836662724171 and parameters: {'model_type': 'graphsage', 'hidden_dims': '[256, 128, 64]', 'dropout': 0.1540949935565623, 'batch_norm': False, 'lr': 1.5661526766994385e-05, 'weight_decay': 1.1852372566572757e-06, 'epochs': 222, 'loss': 'mae', 'optimizer': 'adam', 'graph_mode': 'cutoff', 'cutoff': 0.49359924598295857, 'grm_norm': 'cosine_then_gcn', 'self_loops': False, 'use_snp_selection': True, 'num_snps': 37539}. Best is trial 19 with value: 0.30021150341023195.
[I 2025-11-13 18:46:10,664] Trial 143 finished with value: 0.2759644878776101 and parameters: {'model_type': 'graphsage', 'hidden_dims': '[256, 128, 64]', 'dropout': 0.17505408680084145, 'batch_norm': False, 'lr': 1.3832447780337893e-05, 'weight_decay': 1.0258623416677164e-06, 'epochs': 211, 'loss': 'mae', 'optimizer': 'adam', 'graph_mode': 'cutoff', 'cutoff': 0.48860500683776364, 'grm_norm': 'cosine_then_gcn', 'self_loops': False, 'use_snp_selection': True, 'num_snps': 50039}. Best is trial 19 with value: 0.30021150341023195.
[I 2025-11-13 18:48:41,020] Trial 144 finished with value: 0.26369167425282736 and parameters: {'model_type': 'graphsage', 'hidden_dims': '[512, 64]', 'dropout': 0.16157617255786935, 'batch_norm': False, 'lr': 2.254877071651305e-05, 'weight_decay': 1.8399903048589432e-06, 'epochs': 221, 'loss': 'mae', 'optimizer': 'adam', 'graph_mode': 'cutoff', 'cutoff': 0.505332617339049, 'grm_norm': 'cosine_then_gcn', 'self_loops': False, 'use_snp_selection': True, 'num_snps': 37697}. Best is trial 19 with value: 0.30021150341023195.
[I 2025-11-13 18:51:26,048] Trial 145 finished with value: 0.2826330989607376 and parameters: {'model_type': 'graphsage', 'hidden_dims': '[256, 128, 64]', 'dropout': 0.19330024500171378, 'batch_norm': False, 'lr': 1.6265150793575595e-05, 'weight_decay': 1.076342020304386e-06, 'epochs': 234, 'loss': 'mae', 'optimizer': 'adam', 'graph_mode': 'cutoff', 'cutoff': 0.44577867024066686, 'grm_norm': 'cosine_then_gcn', 'self_loops': False, 'use_snp_selection': True, 'num_snps': 46332}. Best is trial 19 with value: 0.30021150341023195.
[I 2025-11-13 18:54:24,119] Trial 146 finished with value: 0.2740415049462418 and parameters: {'model_type': 'graphsage', 'hidden_dims': '[256, 128, 64]', 'dropout': 0.1981068418287425, 'batch_norm': False, 'lr': 1.6227610630072252e-05, 'weight_decay': 1.1820753828772948e-06, 'epochs': 236, 'loss': 'mae', 'optimizer': 'adam', 'graph_mode': 'cutoff', 'cutoff': 0.44776773844414486, 'grm_norm': 'cosine_then_gcn', 'self_loops': False, 'use_snp_selection': True, 'num_snps': 46044}. Best is trial 19 with value: 0.30021150341023195.
[I 2025-11-13 18:57:36,412] Trial 147 finished with value: 0.26648598620574454 and parameters: {'model_type': 'graphsage', 'hidden_dims': '[256, 128, 64]', 'dropout': 0.2406984643015888, 'batch_norm': False, 'lr': 2.0143108516710303e-05, 'weight_decay': 1.4890558861740027e-06, 'epochs': 244, 'loss': 'mae', 'optimizer': 'adam', 'graph_mode': 'cutoff', 'cutoff': 0.4684443514727966, 'grm_norm': 'cosine_then_gcn', 'self_loops': False, 'use_snp_selection': True, 'num_snps': 50484}. Best is trial 19 with value: 0.30021150341023195.
[I 2025-11-13 19:00:43,308] Trial 148 finished with value: 0.27233253053526923 and parameters: {'model_type': 'graphsage', 'hidden_dims': '[256, 128, 64]', 'dropout': 0.2586699166082226, 'batch_norm': False, 'lr': 1.751838390963172e-05, 'weight_decay': 7.517263127444516e-07, 'epochs': 259, 'loss': 'mae', 'optimizer': 'adam', 'graph_mode': 'cutoff', 'cutoff': 0.4887367267188691, 'grm_norm': 'cosine_then_gcn', 'self_loops': False, 'use_snp_selection': True, 'num_snps': 49370}. Best is trial 19 with value: 0.30021150341023195.
[I 2025-11-13 19:03:25,855] Trial 149 finished with value: 0.2571120554668486 and parameters: {'model_type': 'graphsage', 'hidden_dims': '[256, 128, 64]', 'dropout': 0.20714992515684433, 'batch_norm': False, 'lr': 1.0592363925089836e-05, 'weight_decay': 1.3052912148490621e-06, 'epochs': 233, 'loss': 'mse', 'optimizer': 'adam', 'graph_mode': 'cutoff', 'cutoff': 0.5093928257406631, 'grm_norm': 'cosine_then_gcn', 'self_loops': False, 'use_snp_selection': True, 'num_snps': 55829}. Best is trial 19 with value: 0.30021150341023195.
[I 2025-11-13 19:06:19,764] Trial 0 finished with value: 0.15466916363824817 and parameters: {'model_type': 'graphsage', 'hidden_dims': '[128, 64]', 'dropout': 0.199031432379812, 'batch_norm': True, 'lr': 1.8408544111075837e-06, 'weight_decay': 5.5136510071208614e-05, 'epochs': 336, 'loss': 'mae', 'optimizer': 'adam', 'graph_mode': 'knn', 'source': 'grm', 'knn_k': 8, 'weighted_edges': True, 'symmetrize_mode': 'mutual', 'use_snp_selection': False}. Best is trial 0 with value: 0.15466916363824817.
[I 2025-11-13 19:07:12,095] Trial 1 finished with value: 0.23083359165782577 and parameters: {'model_type': 'graphsage', 'hidden_dims': '[128, 64]', 'dropout': 0.40051947670227217, 'batch_norm': True, 'lr': 0.0005320428882732732, 'weight_decay': 1.89210117736594e-06, 'epochs': 68, 'loss': 'mse', 'optimizer': 'adam', 'graph_mode': 'knn', 'source': 'grm', 'knn_k': 7, 'weighted_edges': True, 'symmetrize_mode': 'union', 'use_snp_selection': False}. Best is trial 1 with value: 0.23083359165782577.
[I 2025-11-13 19:08:32,817] Trial 2 finished with value: 0.15377218761779382 and parameters: {'model_type': 'graphsage', 'hidden_dims': '[256, 128]', 'dropout': 0.5105528289184642, 'batch_norm': False, 'lr': 0.0006804279372404962, 'weight_decay': 0.0008922815224257085, 'epochs': 181, 'loss': 'mse', 'optimizer': 'adam', 'graph_mode': 'cutoff', 'cutoff': 0.5741905641612706, 'grm_norm': 'gcn', 'self_loops': False, 'use_snp_selection': True, 'num_snps': 26910}. Best is trial 1 with value: 0.23083359165782577.
[I 2025-11-13 19:10:05,490] Trial 3 finished with value: 0.22976857899887837 and parameters: {'model_type': 'graphsage', 'hidden_dims': '[256, 128, 64]', 'dropout': 0.5390483213624292, 'batch_norm': False, 'lr': 3.4705625989073525e-05, 'weight_decay': 2.4623319020131338e-05, 'epochs': 121, 'loss': 'mse', 'optimizer': 'adam', 'graph_mode': 'knn', 'source': 'grm', 'knn_k': 6, 'weighted_edges': False, 'symmetrize_mode': 'mutual', 'use_snp_selection': True, 'num_snps': 30713}. Best is trial 1 with value: 0.23083359165782577.
[I 2025-11-13 19:11:14,109] Trial 4 finished with value: 0.26593128568374164 and parameters: {'model_type': 'graphsage', 'hidden_dims': '[128, 64]', 'dropout': 0.13404863676897502, 'batch_norm': False, 'lr': 0.0001431556295367288, 'weight_decay': 2.2084517750726675e-05, 'epochs': 51, 'loss': 'mae', 'optimizer': 'adam', 'graph_mode': 'cutoff', 'cutoff': 0.6714268476993044, 'grm_norm': 'none', 'self_loops': False, 'use_snp_selection': True, 'num_snps': 45645}. Best is trial 4 with value: 0.26593128568374164.
[I 2025-11-13 19:12:56,801] Trial 5 finished with value: 0.2600909013294149 and parameters: {'model_type': 'graphsage', 'hidden_dims': '[256, 128]', 'dropout': 0.42253606323412096, 'batch_norm': False, 'lr': 4.238630400638805e-05, 'weight_decay': 8.074086040046576e-07, 'epochs': 158, 'loss': 'mae', 'optimizer': 'adam', 'graph_mode': 'knn', 'source': 'grm', 'knn_k': 1, 'weighted_edges': False, 'symmetrize_mode': 'mutual', 'use_snp_selection': True, 'num_snps': 43113}. Best is trial 4 with value: 0.26593128568374164.
[I 2025-11-13 19:15:38,096] Trial 6 finished with value: 0.2539993198360363 and parameters: {'model_type': 'graphsage', 'hidden_dims': '[512, 256]', 'dropout': 0.3534893146320237, 'batch_norm': True, 'lr': 0.000251307964226932, 'weight_decay': 1.821819791794022e-05, 'epochs': 223, 'loss': 'mae', 'optimizer': 'adam', 'graph_mode': 'knn', 'source': 'grm', 'knn_k': 1, 'weighted_edges': True, 'symmetrize_mode': 'mutual', 'use_snp_selection': False}. Best is trial 4 with value: 0.26593128568374164.
[I 2025-11-13 19:17:55,531] Trial 7 finished with value: 0.24594420634692513 and parameters: {'model_type': 'graphsage', 'hidden_dims': '[512, 256]', 'dropout': 0.1105825955860775, 'batch_norm': True, 'lr': 2.374338412754043e-05, 'weight_decay': 1.1284721123340274e-05, 'epochs': 190, 'loss': 'mse', 'optimizer': 'adam', 'graph_mode': 'cutoff', 'cutoff': 0.719872204109604, 'grm_norm': 'gcn', 'self_loops': False, 'use_snp_selection': False}. Best is trial 4 with value: 0.26593128568374164.
[I 2025-11-13 19:19:48,077] Trial 8 finished with value: 0.266471348049475 and parameters: {'model_type': 'graphsage', 'hidden_dims': '[512, 128]', 'dropout': 0.5066580418354021, 'batch_norm': True, 'lr': 0.00039213678276659976, 'weight_decay': 3.43655320802934e-06, 'epochs': 120, 'loss': 'mse', 'optimizer': 'adam', 'graph_mode': 'cutoff', 'cutoff': 0.34923059576505366, 'grm_norm': 'cosine', 'self_loops': True, 'use_snp_selection': False}. Best is trial 8 with value: 0.266471348049475.
[I 2025-11-13 19:21:05,534] Trial 9 finished with value: 0.21956611829177275 and parameters: {'model_type': 'graphsage', 'hidden_dims': '[512, 256]', 'dropout': 0.301734920240333, 'batch_norm': False, 'lr': 6.650961854953448e-06, 'weight_decay': 6.861575656590315e-05, 'epochs': 150, 'loss': 'mae', 'optimizer': 'adam', 'graph_mode': 'cutoff', 'cutoff': 0.2857569870061939, 'grm_norm': 'cosine_then_gcn', 'self_loops': False, 'use_snp_selection': True, 'num_snps': 12722}. Best is trial 8 with value: 0.266471348049475.
[I 2025-11-13 19:25:15,241] Trial 10 finished with value: 0.2586384380387439 and parameters: {'model_type': 'graphsage', 'hidden_dims': '[512, 128]', 'dropout': 0.5885461262002587, 'batch_norm': True, 'lr': 0.0001051230339774825, 'weight_decay': 1.3387352389235743e-07, 'epochs': 258, 'loss': 'mse', 'optimizer': 'adam', 'graph_mode': 'cutoff', 'cutoff': 0.2684196492120865, 'grm_norm': 'cosine', 'self_loops': True, 'use_snp_selection': False}. Best is trial 8 with value: 0.266471348049475.
[I 2025-11-13 19:26:53,052] Trial 11 finished with value: 0.11796732129789445 and parameters: {'model_type': 'graphsage', 'hidden_dims': '[512, 64]', 'dropout': 0.2550635947051742, 'batch_norm': False, 'lr': 0.00018327279415154775, 'weight_decay': 1.8187594072837697e-06, 'epochs': 42, 'loss': 'mae', 'optimizer': 'adam', 'graph_mode': 'cutoff', 'cutoff': 0.8789885830334562, 'grm_norm': 'none', 'self_loops': True, 'use_snp_selection': True, 'num_snps': 58236}. Best is trial 8 with value: 0.266471348049475.
[I 2025-11-13 19:29:19,668] Trial 12 finished with value: 0.2582451563786188 and parameters: {'model_type': 'graphsage', 'hidden_dims': '[512, 128]', 'dropout': 0.13991498236489835, 'batch_norm': True, 'lr': 0.00011120232078697283, 'weight_decay': 0.00028303623505598777, 'epochs': 96, 'loss': 'mse', 'optimizer': 'adam', 'graph_mode': 'cutoff', 'cutoff': 0.46547924207578695, 'grm_norm': 'cosine', 'self_loops': True, 'use_snp_selection': True, 'num_snps': 53389}. Best is trial 8 with value: 0.266471348049475.
[I 2025-11-13 19:30:46,409] Trial 13 finished with value: 0.05477952940840399 and parameters: {'model_type': 'graphsage', 'hidden_dims': '[512, 128]', 'dropout': 0.463149119497691, 'batch_norm': False, 'lr': 0.0009737420347470426, 'weight_decay': 3.9084467537793925e-06, 'epochs': 95, 'loss': 'mae', 'optimizer': 'adam', 'graph_mode': 'cutoff', 'cutoff': 0.4773775536648144, 'grm_norm': 'none', 'self_loops': True, 'use_snp_selection': False}. Best is trial 8 with value: 0.266471348049475.
[I 2025-11-13 19:31:51,943] Trial 14 finished with value: 0.15357705768892485 and parameters: {'model_type': 'graphsage', 'hidden_dims': '[128, 64]', 'dropout': 0.22837545539909274, 'batch_norm': False, 'lr': 0.0003528065889335271, 'weight_decay': 3.826299217360769e-07, 'epochs': 43, 'loss': 'mse', 'optimizer': 'adam', 'graph_mode': 'cutoff', 'cutoff': 0.6586941310443425, 'grm_norm': 'none', 'self_loops': False, 'use_snp_selection': True, 'num_snps': 42397}. Best is trial 8 with value: 0.266471348049475.
[I 2025-11-13 19:33:02,955] Trial 15 finished with value: 0.2543498768405284 and parameters: {'model_type': 'graphsage', 'hidden_dims': '[256, 128, 64]', 'dropout': 0.3152781583098168, 'batch_norm': True, 'lr': 7.22632211160111e-05, 'weight_decay': 5.75920096700474e-06, 'epochs': 117, 'loss': 'mae', 'optimizer': 'adam', 'graph_mode': 'cutoff', 'cutoff': 0.38977294615010133, 'grm_norm': 'cosine', 'self_loops': False, 'use_snp_selection': False}. Best is trial 8 with value: 0.266471348049475.
[I 2025-11-13 19:34:14,209] Trial 16 finished with value: 0.22719062929094194 and parameters: {'model_type': 'graphsage', 'hidden_dims': '[512, 64]', 'dropout': 0.17442542708353412, 'batch_norm': True, 'lr': 1.271161794036865e-05, 'weight_decay': 0.00012090388667123787, 'epochs': 80, 'loss': 'mae', 'optimizer': 'adam', 'graph_mode': 'cutoff', 'cutoff': 0.757108779180882, 'grm_norm': 'cosine_then_gcn', 'self_loops': True, 'use_snp_selection': False}. Best is trial 8 with value: 0.266471348049475.
[I 2025-11-13 19:35:20,546] Trial 17 finished with value: 0.21894996006322795 and parameters: {'model_type': 'graphsage', 'hidden_dims': '[128, 64]', 'dropout': 0.5928746349572604, 'batch_norm': False, 'lr': 0.00020304094647201465, 'weight_decay': 3.328526930416055e-06, 'epochs': 132, 'loss': 'mse', 'optimizer': 'adam', 'graph_mode': 'cutoff', 'cutoff': 0.20344371814847323, 'grm_norm': 'none', 'self_loops': True, 'use_snp_selection': True, 'num_snps': 11519}. Best is trial 8 with value: 0.266471348049475.
[I 2025-11-13 19:38:07,941] Trial 18 finished with value: 0.24535853797454216 and parameters: {'model_type': 'graphsage', 'hidden_dims': '[512, 128]', 'dropout': 0.48713984374727903, 'batch_norm': True, 'lr': 0.00041664902635833837, 'weight_decay': 5.429441087775478e-07, 'epochs': 238, 'loss': 'mse', 'optimizer': 'adam', 'graph_mode': 'cutoff', 'cutoff': 0.5920313189691022, 'grm_norm': 'cosine', 'self_loops': False, 'use_snp_selection': True, 'num_snps': 43118}. Best is trial 8 with value: 0.266471348049475.
[I 2025-11-13 19:39:57,196] Trial 19 finished with value: 0.2564549694022124 and parameters: {'model_type': 'graphsage', 'hidden_dims': '[128, 64]', 'dropout': 0.39771197426492766, 'batch_norm': False, 'lr': 6.788802345057869e-05, 'weight_decay': 3.792655758076827e-05, 'epochs': 306, 'loss': 'mae', 'optimizer': 'adam', 'graph_mode': 'cutoff', 'cutoff': 0.41527777654278275, 'grm_norm': 'none', 'self_loops': False, 'use_snp_selection': False}. Best is trial 8 with value: 0.266471348049475.
[I 2025-11-13 19:41:05,839] Trial 20 finished with value: 0.17354265708707017 and parameters: {'model_type': 'graphsage', 'hidden_dims': '[512, 128]', 'dropout': 0.27020199247046595, 'batch_norm': False, 'lr': 1.1277956545809076e-06, 'weight_decay': 9.149377694187576e-06, 'epochs': 64, 'loss': 'mae', 'optimizer': 'adam', 'graph_mode': 'cutoff', 'cutoff': 0.812648622291956, 'grm_norm': 'cosine', 'self_loops': True, 'use_snp_selection': True, 'num_snps': 22145}. Best is trial 8 with value: 0.266471348049475.
[I 2025-11-13 19:42:54,464] Trial 21 finished with value: 0.24579413453294352 and parameters: {'model_type': 'graphsage', 'hidden_dims': '[256, 128]', 'dropout': 0.4283383834663608, 'batch_norm': False, 'lr': 3.708794373669967e-05, 'weight_decay': 8.096397912053882e-07, 'epochs': 151, 'loss': 'mae', 'optimizer': 'adam', 'graph_mode': 'knn', 'source': 'grm', 'knn_k': 1, 'weighted_edges': False, 'symmetrize_mode': 'union', 'use_snp_selection': True, 'num_snps': 42804}. Best is trial 8 with value: 0.266471348049475.
[I 2025-11-13 19:45:03,319] Trial 22 finished with value: 0.2480196495290729 and parameters: {'model_type': 'graphsage', 'hidden_dims': '[256, 128]', 'dropout': 0.44641079082703494, 'batch_norm': False, 'lr': 1.70967242072898e-05, 'weight_decay': 1.8730516123789005e-07, 'epochs': 167, 'loss': 'mae', 'optimizer': 'adam', 'graph_mode': 'knn', 'source': 'grm', 'knn_k': 3, 'weighted_edges': False, 'symmetrize_mode': 'mutual', 'use_snp_selection': True, 'num_snps': 47700}. Best is trial 8 with value: 0.266471348049475.
[I 2025-11-13 19:48:01,918] Trial 23 finished with value: 0.2498663837792075 and parameters: {'model_type': 'graphsage', 'hidden_dims': '[256, 128]', 'dropout': 0.5307908896085531, 'batch_norm': False, 'lr': 8.032435869272236e-06, 'weight_decay': 1.6202922351246024e-06, 'epochs': 211, 'loss': 'mae', 'optimizer': 'adam', 'graph_mode': 'knn', 'source': 'grm', 'knn_k': 10, 'weighted_edges': False, 'symmetrize_mode': 'mutual', 'use_snp_selection': True, 'num_snps': 36378}. Best is trial 8 with value: 0.266471348049475.
[I 2025-11-13 19:50:26,443] Trial 24 finished with value: 0.23228167889500012 and parameters: {'model_type': 'graphsage', 'hidden_dims': '[256, 128]', 'dropout': 0.3579290780588409, 'batch_norm': False, 'lr': 0.00010452819077484147, 'weight_decay': 1.0995306937261176e-06, 'epochs': 101, 'loss': 'mae', 'optimizer': 'adam', 'graph_mode': 'knn', 'source': 'grm', 'knn_k': 4, 'weighted_edges': False, 'symmetrize_mode': 'union', 'use_snp_selection': True, 'num_snps': 52075}. Best is trial 8 with value: 0.266471348049475.
[I 2025-11-13 19:51:18,013] Trial 25 finished with value: 0.2157189472231486 and parameters: {'model_type': 'graphsage', 'hidden_dims': '[512, 64]', 'dropout': 0.39051557789284, 'batch_norm': False, 'lr': 5.461126216412523e-05, 'weight_decay': 7.753456525186142e-06, 'epochs': 142, 'loss': 'mae', 'optimizer': 'adam', 'graph_mode': 'knn', 'source': 'grm', 'knn_k': 4, 'weighted_edges': False, 'symmetrize_mode': 'mutual', 'use_snp_selection': True, 'num_snps': 3545}. Best is trial 8 with value: 0.266471348049475.
[I 2025-11-13 19:52:59,647] Trial 26 finished with value: 0.23143618864830665 and parameters: {'model_type': 'graphsage', 'hidden_dims': '[256, 128, 64]', 'dropout': 0.4849147545829836, 'batch_norm': True, 'lr': 0.0001606134491589333, 'weight_decay': 4.540430114533198e-07, 'epochs': 172, 'loss': 'mse', 'optimizer': 'adam', 'graph_mode': 'knn', 'source': 'grm', 'knn_k': 3, 'weighted_edges': True, 'symmetrize_mode': 'union', 'use_snp_selection': False}. Best is trial 8 with value: 0.266471348049475.
