[I 2025-11-03 13:50:14,296] Trial 35 finished with value: 0.011565466397553506 and parameters: {'model_type': 'gcn', 'hidden_dims': '[128, 64]', 'dropout': 0.2782636019271973, 'batch_norm': False, 'lr': 0.0006736603315379999, 'weight_decay': 2.8345627110703646e-06, 'epochs': 181, 'loss': 'mse', 'optimizer': 'adam', 'graph_mode': 'cutoff', 'cutoff': 0.6653874872176198, 'grm_norm': 'cosine_then_gcn', 'self_loops': True, 'use_snp_selection': True, 'num_snps': 2074}. Best is trial 12 with value: 0.07544054689754426.
[I 2025-11-03 13:50:15,528] Trial 36 finished with value: 0.04224284066275405 and parameters: {'model_type': 'gcn', 'hidden_dims': '[256, 128]', 'dropout': 0.35660439142251815, 'batch_norm': True, 'lr': 5.154116425908342e-05, 'weight_decay': 1.0038908743761101e-07, 'epochs': 59, 'loss': 'mse', 'optimizer': 'adam', 'graph_mode': 'cutoff', 'cutoff': 0.48309728655455775, 'grm_norm': 'cosine_then_gcn', 'self_loops': True, 'use_snp_selection': False}. Best is trial 12 with value: 0.07544054689754426.
[I 2025-11-03 13:50:17,104] Trial 37 finished with value: 0.05064641288435225 and parameters: {'model_type': 'gcn', 'hidden_dims': '[256, 128, 64]', 'dropout': 0.16267225786674155, 'batch_norm': False, 'lr': 0.00015407651418306527, 'weight_decay': 1.0547124606146725e-06, 'epochs': 105, 'loss': 'mae', 'optimizer': 'adam', 'graph_mode': 'knn', 'source': 'grm', 'knn_k': 3, 'weighted_edges': True, 'symmetrize_mode': 'mutual', 'use_snp_selection': True, 'num_snps': 15344}. Best is trial 12 with value: 0.07544054689754426.
[I 2025-11-03 13:50:19,105] Trial 38 finished with value: 0.032015993814474536 and parameters: {'model_type': 'gcn', 'hidden_dims': '[512, 256]', 'dropout': 0.41183934832763724, 'batch_norm': True, 'lr': 3.363306939312868e-05, 'weight_decay': 7.894230140127344e-06, 'epochs': 153, 'loss': 'mse', 'optimizer': 'adam', 'graph_mode': 'cutoff', 'cutoff': 0.6061573576056429, 'grm_norm': 'cosine', 'self_loops': True, 'use_snp_selection': False}. Best is trial 12 with value: 0.07544054689754426.
[I 2025-11-03 13:50:21,977] Trial 39 finished with value: 0.005999353083414919 and parameters: {'model_type': 'gcn', 'hidden_dims': '[128, 64]', 'dropout': 0.21223582819279213, 'batch_norm': False, 'lr': 0.0005071542504186217, 'weight_decay': 4.5571769002532765e-07, 'epochs': 168, 'loss': 'mse', 'optimizer': 'adam', 'graph_mode': 'cutoff', 'cutoff': 0.8155129565774478, 'grm_norm': 'gcn', 'self_loops': False, 'use_snp_selection': True, 'num_snps': 58379}. Best is trial 12 with value: 0.07544054689754426.
[I 2025-11-03 13:50:24,348] Trial 40 finished with value: -0.05392502936136783 and parameters: {'model_type': 'gcn', 'hidden_dims': '[512, 128]', 'dropout': 0.3244839252913771, 'batch_norm': True, 'lr': 0.0001726579332207782, 'weight_decay': 0.0001092033816492151, 'epochs': 213, 'loss': 'mae', 'optimizer': 'adam', 'graph_mode': 'knn', 'source': 'grm', 'knn_k': 10, 'weighted_edges': False, 'symmetrize_mode': 'union', 'use_snp_selection': False}. Best is trial 12 with value: 0.07544054689754426.
[I 2025-11-03 13:50:25,718] Trial 41 finished with value: 0.07844071552903915 and parameters: {'model_type': 'gcn', 'hidden_dims': '[512, 128]', 'dropout': 0.5545053660308253, 'batch_norm': True, 'lr': 0.00033349433263788744, 'weight_decay': 2.5134796054119237e-06, 'epochs': 35, 'loss': 'mse', 'optimizer': 'adam', 'graph_mode': 'cutoff', 'cutoff': 0.32851729663572105, 'grm_norm': 'cosine', 'self_loops': True, 'use_snp_selection': False}. Best is trial 41 with value: 0.07844071552903915.
[I 2025-11-03 13:50:26,965] Trial 42 finished with value: 0.03608733481537276 and parameters: {'model_type': 'gcn', 'hidden_dims': '[512, 128]', 'dropout': 0.5442200977077271, 'batch_norm': True, 'lr': 0.0003067630726465362, 'weight_decay': 2.286476554186018e-06, 'epochs': 11, 'loss': 'mse', 'optimizer': 'adam', 'graph_mode': 'cutoff', 'cutoff': 0.3297386506572696, 'grm_norm': 'cosine', 'self_loops': True, 'use_snp_selection': False}. Best is trial 41 with value: 0.07844071552903915.
[I 2025-11-03 13:50:28,400] Trial 43 finished with value: 0.030013094251009422 and parameters: {'model_type': 'gcn', 'hidden_dims': '[512, 128]', 'dropout': 0.5000811083486127, 'batch_norm': True, 'lr': 0.00012852208219821194, 'weight_decay': 1.3384226050012353e-06, 'epochs': 42, 'loss': 'mse', 'optimizer': 'adam', 'graph_mode': 'cutoff', 'cutoff': 0.4004410035877275, 'grm_norm': 'cosine', 'self_loops': True, 'use_snp_selection': False}. Best is trial 41 with value: 0.07844071552903915.
[I 2025-11-03 13:50:30,012] Trial 44 finished with value: 0.0773353153346266 and parameters: {'model_type': 'gcn', 'hidden_dims': '[512, 128]', 'dropout': 0.557237313827837, 'batch_norm': True, 'lr': 0.0009174697447001902, 'weight_decay': 7.525631605781557e-07, 'epochs': 85, 'loss': 'mse', 'optimizer': 'adam', 'graph_mode': 'cutoff', 'cutoff': 0.7341297000024443, 'grm_norm': 'none', 'self_loops': False, 'use_snp_selection': False}. Best is trial 41 with value: 0.07844071552903915.
[I 2025-11-03 13:50:31,648] Trial 45 finished with value: 0.08406083721143744 and parameters: {'model_type': 'gcn', 'hidden_dims': '[512, 128]', 'dropout': 0.5632970864233715, 'batch_norm': True, 'lr': 0.0007695895476257229, 'weight_decay': 7.949727528501356e-06, 'epochs': 90, 'loss': 'mse', 'optimizer': 'adam', 'graph_mode': 'cutoff', 'cutoff': 0.70683544126303, 'grm_norm': 'none', 'self_loops': False, 'use_snp_selection': False}. Best is trial 45 with value: 0.08406083721143744.
[I 2025-11-03 13:50:33,067] Trial 46 finished with value: 0.04647547827061394 and parameters: {'model_type': 'gcn', 'hidden_dims': '[512, 128]', 'dropout': 0.5749127898348642, 'batch_norm': True, 'lr': 0.000943397455821976, 'weight_decay': 1.3406621638899865e-05, 'epochs': 47, 'loss': 'mse', 'optimizer': 'adam', 'graph_mode': 'cutoff', 'cutoff': 0.7154838581535554, 'grm_norm': 'none', 'self_loops': False, 'use_snp_selection': False}. Best is trial 45 with value: 0.08406083721143744.
[I 2025-11-03 13:50:34,356] Trial 47 finished with value: 0.03967288791441917 and parameters: {'model_type': 'gcn', 'hidden_dims': '[512, 128]', 'dropout': 0.5674012946134351, 'batch_norm': True, 'lr': 0.0006376199749788896, 'weight_decay': 6.225909001701006e-06, 'epochs': 21, 'loss': 'mse', 'optimizer': 'adam', 'graph_mode': 'cutoff', 'cutoff': 0.6750340470189958, 'grm_norm': 'none', 'self_loops': False, 'use_snp_selection': False}. Best is trial 45 with value: 0.08406083721143744.
[I 2025-11-03 13:50:36,840] Trial 48 finished with value: 0.02231879958798555 and parameters: {'model_type': 'gcn', 'hidden_dims': '[512, 128]', 'dropout': 0.5198172452066973, 'batch_norm': False, 'lr': 0.0004997208583316485, 'weight_decay': 3.354157157332088e-05, 'epochs': 81, 'loss': 'mae', 'optimizer': 'adam', 'graph_mode': 'cutoff', 'cutoff': 0.30717374296250527, 'grm_norm': 'none', 'self_loops': False, 'use_snp_selection': True, 'num_snps': 42595}. Best is trial 45 with value: 0.08406083721143744.
[I 2025-11-03 13:50:38,067] Trial 49 finished with value: 0.03058464151859012 and parameters: {'model_type': 'gcn', 'hidden_dims': '[512, 128]', 'dropout': 0.529885804802934, 'batch_norm': True, 'lr': 0.0008232864179538084, 'weight_decay': 2.0828813581699313e-06, 'epochs': 2, 'loss': 'mse', 'optimizer': 'adam', 'graph_mode': 'cutoff', 'cutoff': 0.7378428609922959, 'grm_norm': 'none', 'self_loops': False, 'use_snp_selection': False}. Best is trial 45 with value: 0.08406083721143744.
[I 2025-11-03 13:50:39,907] Trial 50 finished with value: 0.041430550082864316 and parameters: {'model_type': 'gcn', 'hidden_dims': '[512, 128]', 'dropout': 0.599897127224906, 'batch_norm': True, 'lr': 0.0004077438736382424, 'weight_decay': 4.709474778407571e-06, 'epochs': 119, 'loss': 'mse', 'optimizer': 'adam', 'graph_mode': 'cutoff', 'cutoff': 0.6268679371659646, 'grm_norm': 'none', 'self_loops': False, 'use_snp_selection': False}. Best is trial 45 with value: 0.08406083721143744.
[I 2025-11-03 13:50:41,549] Trial 51 finished with value: 0.04656001228170034 and parameters: {'model_type': 'gcn', 'hidden_dims': '[512, 128]', 'dropout': 0.4889249193920603, 'batch_norm': True, 'lr': 0.0005855352276405497, 'weight_decay': 1.690103029625515e-07, 'epochs': 87, 'loss': 'mse', 'optimizer': 'adam', 'graph_mode': 'cutoff', 'cutoff': 0.3700159573412002, 'grm_norm': 'none', 'self_loops': False, 'use_snp_selection': False}. Best is trial 45 with value: 0.08406083721143744.
[I 2025-11-03 13:50:43,146] Trial 52 finished with value: 0.0654426212399269 and parameters: {'model_type': 'gcn', 'hidden_dims': '[512, 128]', 'dropout': 0.5735487922567917, 'batch_norm': True, 'lr': 0.00022841541634561124, 'weight_decay': 5.220694622012614e-07, 'epochs': 76, 'loss': 'mse', 'optimizer': 'adam', 'graph_mode': 'cutoff', 'cutoff': 0.5705349458006874, 'grm_norm': 'cosine', 'self_loops': False, 'use_snp_selection': False}. Best is trial 45 with value: 0.08406083721143744.
[I 2025-11-03 13:50:44,667] Trial 53 finished with value: 0.05124587267688756 and parameters: {'model_type': 'gcn', 'hidden_dims': '[512, 128]', 'dropout': 0.557777680875601, 'batch_norm': True, 'lr': 0.0003223338619064351, 'weight_decay': 6.038798800562963e-07, 'epochs': 61, 'loss': 'mse', 'optimizer': 'adam', 'graph_mode': 'cutoff', 'cutoff': 0.694596817577887, 'grm_norm': 'cosine', 'self_loops': False, 'use_snp_selection': False}. Best is trial 45 with value: 0.08406083721143744.
[I 2025-11-03 13:50:46,447] Trial 54 finished with value: 0.04628880323469955 and parameters: {'model_type': 'gcn', 'hidden_dims': '[512, 128]', 'dropout': 0.5743397647383683, 'batch_norm': True, 'lr': 0.0004781801537499238, 'weight_decay': 1.0357070879599064e-05, 'epochs': 111, 'loss': 'mse', 'optimizer': 'adam', 'graph_mode': 'cutoff', 'cutoff': 0.5884298683469416, 'grm_norm': 'cosine', 'self_loops': False, 'use_snp_selection': False}. Best is trial 45 with value: 0.08406083721143744.
[I 2025-11-03 13:50:47,805] Trial 55 finished with value: 0.04732007924595827 and parameters: {'model_type': 'gcn', 'hidden_dims': '[512, 128]', 'dropout': 0.5376119055564423, 'batch_norm': True, 'lr': 0.0006928002907241687, 'weight_decay': 2.769057580524736e-06, 'epochs': 28, 'loss': 'mse', 'optimizer': 'adam', 'graph_mode': 'cutoff', 'cutoff': 0.44569759557559213, 'grm_norm': 'cosine', 'self_loops': False, 'use_snp_selection': False}. Best is trial 45 with value: 0.08406083721143744.
[I 2025-11-03 13:50:49,400] Trial 56 finished with value: 0.06109710003988016 and parameters: {'model_type': 'gcn', 'hidden_dims': '[512, 256]', 'dropout': 0.45858510305647476, 'batch_norm': True, 'lr': 0.0009872833255549379, 'weight_decay': 2.8846684953851935e-07, 'epochs': 75, 'loss': 'mse', 'optimizer': 'adam', 'graph_mode': 'cutoff', 'cutoff': 0.6567478497121402, 'grm_norm': 'cosine', 'self_loops': False, 'use_snp_selection': False}. Best is trial 45 with value: 0.08406083721143744.
[I 2025-11-03 13:50:50,889] Trial 57 finished with value: 0.03405853608644 and parameters: {'model_type': 'gcn', 'hidden_dims': '[512, 128]', 'dropout': 0.5860010041025501, 'batch_norm': True, 'lr': 0.00012676541983267466, 'weight_decay': 1.6903699803488968e-05, 'epochs': 55, 'loss': 'mse', 'optimizer': 'adam', 'graph_mode': 'cutoff', 'cutoff': 0.268080792190901, 'grm_norm': 'cosine', 'self_loops': False, 'use_snp_selection': False}. Best is trial 45 with value: 0.08406083721143744.
[I 2025-11-03 13:50:52,652] Trial 58 finished with value: 0.06827281449140993 and parameters: {'model_type': 'gcn', 'hidden_dims': '[512, 64]', 'dropout': 0.522653384270157, 'batch_norm': True, 'lr': 0.00023705530316271177, 'weight_decay': 1.6001847698986457e-07, 'epochs': 98, 'loss': 'mse', 'optimizer': 'adam', 'graph_mode': 'knn', 'source': 'grm', 'knn_k': 8, 'weighted_edges': False, 'symmetrize_mode': 'mutual', 'use_snp_selection': False}. Best is trial 45 with value: 0.08406083721143744.
[I 2025-11-03 13:50:54,401] Trial 59 finished with value: 0.015465501702228521 and parameters: {'model_type': 'gcn', 'hidden_dims': '[512, 64]', 'dropout': 0.520367717326075, 'batch_norm': True, 'lr': 0.0002564828928815251, 'weight_decay': 1.4628208221379614e-07, 'epochs': 95, 'loss': 'mse', 'optimizer': 'adam', 'graph_mode': 'knn', 'source': 'grm', 'knn_k': 8, 'weighted_edges': False, 'symmetrize_mode': 'mutual', 'use_snp_selection': False}. Best is trial 45 with value: 0.08406083721143744.
[I 2025-11-03 13:50:56,219] Trial 60 finished with value: -0.010982510420124122 and parameters: {'model_type': 'gcn', 'hidden_dims': '[512, 64]', 'dropout': 0.5033934464273203, 'batch_norm': False, 'lr': 0.000714415674941392, 'weight_decay': 9.548369190621342e-07, 'epochs': 131, 'loss': 'mse', 'optimizer': 'adam', 'graph_mode': 'knn', 'source': 'grm', 'knn_k': 9, 'weighted_edges': False, 'symmetrize_mode': 'mutual', 'use_snp_selection': True, 'num_snps': 19019}. Best is trial 45 with value: 0.08406083721143744.
[I 2025-11-03 13:50:57,880] Trial 61 finished with value: 0.013845866488056349 and parameters: {'model_type': 'gcn', 'hidden_dims': '[512, 64]', 'dropout': 0.5563020000537519, 'batch_norm': True, 'lr': 8.915592304399289e-05, 'weight_decay': 4.703361819304996e-07, 'epochs': 75, 'loss': 'mse', 'optimizer': 'adam', 'graph_mode': 'knn', 'source': 'grm', 'knn_k': 6, 'weighted_edges': False, 'symmetrize_mode': 'mutual', 'use_snp_selection': False}. Best is trial 45 with value: 0.08406083721143744.
[I 2025-11-03 13:50:59,386] Trial 62 finished with value: 0.003122252430458275 and parameters: {'model_type': 'gcn', 'hidden_dims': '[512, 128]', 'dropout': 0.4860740016243582, 'batch_norm': True, 'lr': 4.3432615857695075e-05, 'weight_decay': 1.6808520379277187e-07, 'epochs': 44, 'loss': 'mse', 'optimizer': 'adam', 'graph_mode': 'knn', 'source': 'grm', 'knn_k': 3, 'weighted_edges': False, 'symmetrize_mode': 'mutual', 'use_snp_selection': False}. Best is trial 45 with value: 0.08406083721143744.
[I 2025-11-03 13:51:01,297] Trial 63 finished with value: 0.020648237041564863 and parameters: {'model_type': 'gcn', 'hidden_dims': '[256, 128]', 'dropout': 0.5383566742411766, 'batch_norm': True, 'lr': 0.00021217212956910623, 'weight_decay': 0.0005799101116341424, 'epochs': 233, 'loss': 'mse', 'optimizer': 'adam', 'graph_mode': 'knn', 'source': 'grm', 'knn_k': 8, 'weighted_edges': False, 'symmetrize_mode': 'mutual', 'use_snp_selection': False}. Best is trial 45 with value: 0.08406083721143744.
[I 2025-11-03 13:51:03,564] Trial 64 finished with value: 0.06929146603489013 and parameters: {'model_type': 'gcn', 'hidden_dims': '[512, 64]', 'dropout': 0.4448732655708415, 'batch_norm': True, 'lr': 0.0003728629574845479, 'weight_decay': 2.968750751084377e-07, 'epochs': 203, 'loss': 'mse', 'optimizer': 'adam', 'graph_mode': 'cutoff', 'cutoff': 0.47554601145325426, 'grm_norm': 'gcn', 'self_loops': False, 'use_snp_selection': False}. Best is trial 45 with value: 0.08406083721143744.
[I 2025-11-03 13:51:06,188] Trial 65 finished with value: 0.03977633945074715 and parameters: {'model_type': 'gcn', 'hidden_dims': '[512, 64]', 'dropout': 0.45255946841009864, 'batch_norm': True, 'lr': 0.0005025850870747394, 'weight_decay': 2.5941086831753353e-07, 'epochs': 272, 'loss': 'mse', 'optimizer': 'adam', 'graph_mode': 'cutoff', 'cutoff': 0.4860029882813994, 'grm_norm': 'gcn', 'self_loops': False, 'use_snp_selection': False}. Best is trial 45 with value: 0.08406083721143744.
[I 2025-11-03 13:51:08,741] Trial 66 finished with value: 0.022339885889410178 and parameters: {'model_type': 'gcn', 'hidden_dims': '[512, 64]', 'dropout': 0.5970957003833528, 'batch_norm': True, 'lr': 0.0004044222573413588, 'weight_decay': 1.553651719534493e-06, 'epochs': 256, 'loss': 'mae', 'optimizer': 'adam', 'graph_mode': 'cutoff', 'cutoff': 0.39805124320526664, 'grm_norm': 'gcn', 'self_loops': False, 'use_snp_selection': False}. Best is trial 45 with value: 0.08406083721143744.
[I 2025-11-03 13:51:10,508] Trial 67 finished with value: 0.003809808647140916 and parameters: {'model_type': 'gcn', 'hidden_dims': '[512, 64]', 'dropout': 0.5217691442333746, 'batch_norm': True, 'lr': 0.00034513628937716195, 'weight_decay': 1.2249446556473744e-07, 'epochs': 95, 'loss': 'mse', 'optimizer': 'adam', 'graph_mode': 'knn', 'source': 'grm', 'knn_k': 7, 'weighted_edges': True, 'symmetrize_mode': 'union', 'use_snp_selection': False}. Best is trial 45 with value: 0.08406083721143744.
[I 2025-11-03 13:51:12,864] Trial 68 finished with value: 0.0422831183025604 and parameters: {'model_type': 'gcn', 'hidden_dims': '[512, 64]', 'dropout': 0.5698820279243003, 'batch_norm': True, 'lr': 0.00023245534726995954, 'weight_decay': 4.0202657570938154e-07, 'epochs': 218, 'loss': 'mse', 'optimizer': 'adam', 'graph_mode': 'cutoff', 'cutoff': 0.4672150892042999, 'grm_norm': 'gcn', 'self_loops': False, 'use_snp_selection': False}. Best is trial 45 with value: 0.08406083721143744.
[I 2025-11-03 13:51:14,477] Trial 69 finished with value: 0.02768744841152733 and parameters: {'model_type': 'gcn', 'hidden_dims': '[512, 128]', 'dropout': 0.4438321292510615, 'batch_norm': True, 'lr': 0.0008542823693343182, 'weight_decay': 1.855178068079265e-07, 'epochs': 70, 'loss': 'mse', 'optimizer': 'adam', 'graph_mode': 'cutoff', 'cutoff': 0.3557291172324811, 'grm_norm': 'cosine', 'self_loops': False, 'use_snp_selection': False}. Best is trial 45 with value: 0.08406083721143744.
[I 2025-11-03 13:51:16,302] Trial 70 finished with value: 0.0690433769850065 and parameters: {'model_type': 'gcn', 'hidden_dims': '[512, 128]', 'dropout': 0.4719466437053596, 'batch_norm': True, 'lr': 0.00027893818928418387, 'weight_decay': 7.5984845500242635e-06, 'epochs': 115, 'loss': 'mse', 'optimizer': 'adam', 'graph_mode': 'cutoff', 'cutoff': 0.5796902723294074, 'grm_norm': 'none', 'self_loops': False, 'use_snp_selection': False}. Best is trial 45 with value: 0.08406083721143744.
[I 2025-11-03 13:51:18,240] Trial 71 finished with value: 0.052822282928837824 and parameters: {'model_type': 'gcn', 'hidden_dims': '[512, 128]', 'dropout': 0.47574601751720075, 'batch_norm': True, 'lr': 0.0003172329513342915, 'weight_decay': 3.0508327957832915e-05, 'epochs': 137, 'loss': 'mse', 'optimizer': 'adam', 'graph_mode': 'cutoff', 'cutoff': 0.5497567907297126, 'grm_norm': 'none', 'self_loops': False, 'use_snp_selection': False}. Best is trial 45 with value: 0.08406083721143744.
[I 2025-11-03 13:51:20,037] Trial 72 finished with value: 0.030480990020944423 and parameters: {'model_type': 'gcn', 'hidden_dims': '[512, 128]', 'dropout': 0.49621488032036504, 'batch_norm': True, 'lr': 0.00015279221378075293, 'weight_decay': 6.2591798075460985e-06, 'epochs': 110, 'loss': 'mse', 'optimizer': 'adam', 'graph_mode': 'cutoff', 'cutoff': 0.5754771412601614, 'grm_norm': 'none', 'self_loops': False, 'use_snp_selection': False}. Best is trial 45 with value: 0.08406083721143744.
[I 2025-11-03 13:51:23,061] Trial 73 finished with value: 0.0504234947882545 and parameters: {'model_type': 'gcn', 'hidden_dims': '[512, 128]', 'dropout': 0.46772856342217844, 'batch_norm': True, 'lr': 0.0002600333608361427, 'weight_decay': 3.683836933990141e-06, 'epochs': 350, 'loss': 'mse', 'optimizer': 'adam', 'graph_mode': 'cutoff', 'cutoff': 0.5187980311112751, 'grm_norm': 'none', 'self_loops': False, 'use_snp_selection': False}. Best is trial 45 with value: 0.08406083721143744.
[I 2025-11-03 13:51:24,796] Trial 74 finished with value: 0.01741461094261264 and parameters: {'model_type': 'gcn', 'hidden_dims': '[512, 128]', 'dropout': 0.5091640286872646, 'batch_norm': True, 'lr': 0.00042726885498138535, 'weight_decay': 6.531118118300453e-07, 'epochs': 98, 'loss': 'mse', 'optimizer': 'adam', 'graph_mode': 'cutoff', 'cutoff': 0.4307943921375531, 'grm_norm': 'none', 'self_loops': False, 'use_snp_selection': False}. Best is trial 45 with value: 0.08406083721143744.
[I 2025-11-03 13:51:26,666] Trial 75 finished with value: 0.024487047265492376 and parameters: {'model_type': 'gcn', 'hidden_dims': '[512, 256]', 'dropout': 0.5452821646455377, 'batch_norm': True, 'lr': 0.0005834421363030387, 'weight_decay': 7.5884430342942085e-06, 'epochs': 121, 'loss': 'mse', 'optimizer': 'adam', 'graph_mode': 'cutoff', 'cutoff': 0.32808889969920074, 'grm_norm': 'gcn', 'self_loops': False, 'use_snp_selection': False}. Best is trial 45 with value: 0.08406083721143744.
[I 2025-11-03 13:51:28,336] Trial 76 finished with value: 0.07075388944379513 and parameters: {'model_type': 'gcn', 'hidden_dims': '[512, 64]', 'dropout': 0.5581055270231897, 'batch_norm': True, 'lr': 0.0007319615152949448, 'weight_decay': 1.3181185177078434e-05, 'epochs': 84, 'loss': 'mse', 'optimizer': 'adam', 'graph_mode': 'cutoff', 'cutoff': 0.7646806896139008, 'grm_norm': 'cosine', 'self_loops': False, 'use_snp_selection': False}. Best is trial 45 with value: 0.08406083721143744.
[I 2025-11-03 13:51:30,425] Trial 77 finished with value: 0.043310243180814584 and parameters: {'model_type': 'gcn', 'hidden_dims': '[512, 64]', 'dropout': 0.4133111808969287, 'batch_norm': True, 'lr': 0.0007486488106323154, 'weight_decay': 1.3598027185099884e-05, 'epochs': 169, 'loss': 'mse', 'optimizer': 'adam', 'graph_mode': 'cutoff', 'cutoff': 0.7603879296135304, 'grm_norm': 'none', 'self_loops': False, 'use_snp_selection': False}. Best is trial 45 with value: 0.08406083721143744.
[I 2025-11-03 13:51:33,548] Trial 78 finished with value: -0.010966885694254708 and parameters: {'model_type': 'gcn', 'hidden_dims': '[512, 64]', 'dropout': 0.5308738561193378, 'batch_norm': False, 'lr': 0.0005977983032630868, 'weight_decay': 1.7753589697543743e-05, 'epochs': 145, 'loss': 'mae', 'optimizer': 'adam', 'graph_mode': 'knn', 'source': 'grm', 'knn_k': 5, 'weighted_edges': False, 'symmetrize_mode': 'mutual', 'use_snp_selection': True, 'num_snps': 49628}. Best is trial 45 with value: 0.08406083721143744.
