[I 2025-11-03 12:54:32,734] Trial 40 finished with value: 0.06703058362419242 and parameters: {'model_type': 'gcn', 'hidden_dims': '[512, 64]', 'dropout': 0.5066770207858933, 'batch_norm': False, 'lr': 0.00012319520227543402, 'weight_decay': 2.565763634069135e-07, 'epochs': 141, 'loss': 'mse', 'optimizer': 'adam', 'graph_mode': 'cutoff', 'cutoff': 0.20338742962864564, 'grm_norm': 'gcn', 'self_loops': False, 'use_snp_selection': True, 'num_snps': 42724}. Best is trial 40 with value: 0.06703058362419242.
[I 2025-11-03 12:54:35,871] Trial 41 finished with value: 0.012265395940673017 and parameters: {'model_type': 'gcn', 'hidden_dims': '[512, 64]', 'dropout': 0.5060003414165003, 'batch_norm': False, 'lr': 0.00011702666635574731, 'weight_decay': 1.0521232422255395e-07, 'epochs': 142, 'loss': 'mse', 'optimizer': 'adam', 'graph_mode': 'cutoff', 'cutoff': 0.21045854340962922, 'grm_norm': 'gcn', 'self_loops': False, 'use_snp_selection': True, 'num_snps': 41706}. Best is trial 40 with value: 0.06703058362419242.
[I 2025-11-03 12:54:38,964] Trial 42 finished with value: 0.03870349378254654 and parameters: {'model_type': 'gcn', 'hidden_dims': '[512, 64]', 'dropout': 0.5603823935838929, 'batch_norm': False, 'lr': 4.713263094603128e-05, 'weight_decay': 6.785621107870456e-07, 'epochs': 193, 'loss': 'mse', 'optimizer': 'adam', 'graph_mode': 'cutoff', 'cutoff': 0.28602272312316307, 'grm_norm': 'gcn', 'self_loops': False, 'use_snp_selection': True, 'num_snps': 35971}. Best is trial 40 with value: 0.06703058362419242.
[I 2025-11-03 12:54:42,641] Trial 43 finished with value: 0.03194352353217636 and parameters: {'model_type': 'gcn', 'hidden_dims': '[512, 64]', 'dropout': 0.46289320779611204, 'batch_norm': False, 'lr': 0.00048041516010660195, 'weight_decay': 1.839157703131827e-07, 'epochs': 159, 'loss': 'mse', 'optimizer': 'adam', 'graph_mode': 'cutoff', 'cutoff': 0.3193215700240592, 'grm_norm': 'gcn', 'self_loops': False, 'use_snp_selection': True, 'num_snps': 51668}. Best is trial 40 with value: 0.06703058362419242.
[I 2025-11-03 12:54:45,118] Trial 44 finished with value: 0.038384968856538006 and parameters: {'model_type': 'gcn', 'hidden_dims': '[512, 64]', 'dropout': 0.521258888788625, 'batch_norm': False, 'lr': 0.00023499569569908764, 'weight_decay': 2.5063971273290594e-07, 'epochs': 212, 'loss': 'mse', 'optimizer': 'adam', 'graph_mode': 'cutoff', 'cutoff': 0.7490709307414434, 'grm_norm': 'gcn', 'self_loops': False, 'use_snp_selection': True, 'num_snps': 22374}. Best is trial 40 with value: 0.06703058362419242.
[I 2025-11-03 12:54:47,322] Trial 45 finished with value: -0.005062411664840221 and parameters: {'model_type': 'gcn', 'hidden_dims': '[512, 256]', 'dropout': 0.4902095074533205, 'batch_norm': False, 'lr': 0.0006776070013811914, 'weight_decay': 1.5199436885070443e-05, 'epochs': 7, 'loss': 'mse', 'optimizer': 'adam', 'graph_mode': 'cutoff', 'cutoff': 0.41959229862575925, 'grm_norm': 'gcn', 'self_loops': False, 'use_snp_selection': True, 'num_snps': 35373}. Best is trial 40 with value: 0.06703058362419242.
[I 2025-11-03 12:54:48,767] Trial 46 finished with value: -0.010204762973245721 and parameters: {'model_type': 'gcn', 'hidden_dims': '[128, 64]', 'dropout': 0.4415447503112762, 'batch_norm': True, 'lr': 7.655114784754614e-05, 'weight_decay': 2.064194657759368e-06, 'epochs': 115, 'loss': 'mae', 'optimizer': 'adam', 'graph_mode': 'knn', 'source': 'grm', 'knn_k': 9, 'weighted_edges': True, 'symmetrize_mode': 'union', 'use_snp_selection': False}. Best is trial 40 with value: 0.06703058362419242.
[I 2025-11-03 12:54:50,418] Trial 47 finished with value: -0.009838863437996982 and parameters: {'model_type': 'gcn', 'hidden_dims': '[512, 128]', 'dropout': 0.3423603533286313, 'batch_norm': True, 'lr': 3.086369534248164e-05, 'weight_decay': 9.29103620128354e-07, 'epochs': 61, 'loss': 'mse', 'optimizer': 'adam', 'graph_mode': 'cutoff', 'cutoff': 0.21742514779650296, 'grm_norm': 'none', 'self_loops': False, 'use_snp_selection': False}. Best is trial 40 with value: 0.06703058362419242.
[I 2025-11-03 12:54:54,333] Trial 48 finished with value: 0.025689676977664708 and parameters: {'model_type': 'gcn', 'hidden_dims': '[512, 256]', 'dropout': 0.27779186148721274, 'batch_norm': False, 'lr': 1.340007854760972e-05, 'weight_decay': 3.026492034818506e-07, 'epochs': 238, 'loss': 'mse', 'optimizer': 'adam', 'graph_mode': 'cutoff', 'cutoff': 0.602315291249768, 'grm_norm': 'cosine_then_gcn', 'self_loops': True, 'use_snp_selection': True, 'num_snps': 48896}. Best is trial 40 with value: 0.06703058362419242.
[I 2025-11-03 12:54:56,575] Trial 49 finished with value: 0.04194279452613744 and parameters: {'model_type': 'gcn', 'hidden_dims': '[512, 64]', 'dropout': 0.4108286757306875, 'batch_norm': True, 'lr': 0.0001467243723379176, 'weight_decay': 5.09947488522519e-06, 'epochs': 129, 'loss': 'mse', 'optimizer': 'adam', 'graph_mode': 'knn', 'source': 'grm', 'knn_k': 6, 'weighted_edges': False, 'symmetrize_mode': 'mutual', 'use_snp_selection': False}. Best is trial 40 with value: 0.06703058362419242.
[I 2025-11-03 12:54:58,570] Trial 50 finished with value: 0.03529104363824149 and parameters: {'model_type': 'gcn', 'hidden_dims': '[256, 128, 64]', 'dropout': 0.3669810632492393, 'batch_norm': True, 'lr': 2.4733014343178072e-05, 'weight_decay': 2.1038336026861556e-05, 'epochs': 167, 'loss': 'mse', 'optimizer': 'adam', 'graph_mode': 'cutoff', 'cutoff': 0.5405686206258976, 'grm_norm': 'cosine', 'self_loops': False, 'use_snp_selection': False}. Best is trial 40 with value: 0.06703058362419242.
[I 2025-11-03 12:55:00,784] Trial 51 finished with value: 0.007758450530490035 and parameters: {'model_type': 'gcn', 'hidden_dims': '[512, 64]', 'dropout': 0.41035751795505515, 'batch_norm': True, 'lr': 0.00012081468833162501, 'weight_decay': 5.876175867225253e-06, 'epochs': 136, 'loss': 'mse', 'optimizer': 'adam', 'graph_mode': 'knn', 'source': 'grm', 'knn_k': 6, 'weighted_edges': False, 'symmetrize_mode': 'mutual', 'use_snp_selection': False}. Best is trial 40 with value: 0.06703058362419242.
[I 2025-11-03 12:55:02,632] Trial 52 finished with value: 0.020657877780436967 and parameters: {'model_type': 'gcn', 'hidden_dims': '[512, 64]', 'dropout': 0.4430146019852351, 'batch_norm': True, 'lr': 0.0001696514851813625, 'weight_decay': 2.7966343034914257e-06, 'epochs': 82, 'loss': 'mse', 'optimizer': 'adam', 'graph_mode': 'knn', 'source': 'grm', 'knn_k': 7, 'weighted_edges': False, 'symmetrize_mode': 'mutual', 'use_snp_selection': False}. Best is trial 40 with value: 0.06703058362419242.
[I 2025-11-03 12:55:04,610] Trial 53 finished with value: -0.01598069893741962 and parameters: {'model_type': 'gcn', 'hidden_dims': '[512, 64]', 'dropout': 0.39880694558443786, 'batch_norm': True, 'lr': 0.0002729578146445149, 'weight_decay': 9.592566971231902e-06, 'epochs': 102, 'loss': 'mse', 'optimizer': 'adam', 'graph_mode': 'knn', 'source': 'grm', 'knn_k': 4, 'weighted_edges': False, 'symmetrize_mode': 'mutual', 'use_snp_selection': False}. Best is trial 40 with value: 0.06703058362419242.
[I 2025-11-03 12:55:06,926] Trial 54 finished with value: 0.03900958679182102 and parameters: {'model_type': 'gcn', 'hidden_dims': '[512, 64]', 'dropout': 0.4216609937192735, 'batch_norm': True, 'lr': 6.823739242053818e-05, 'weight_decay': 1.5962483260241348e-06, 'epochs': 152, 'loss': 'mse', 'optimizer': 'adam', 'graph_mode': 'knn', 'source': 'grm', 'knn_k': 7, 'weighted_edges': False, 'symmetrize_mode': 'mutual', 'use_snp_selection': False}. Best is trial 40 with value: 0.06703058362419242.
[I 2025-11-03 12:55:08,378] Trial 55 finished with value: 0.03488000984636442 and parameters: {'model_type': 'gcn', 'hidden_dims': '[128, 64]', 'dropout': 0.5266480496579908, 'batch_norm': True, 'lr': 9.871514509143146e-05, 'weight_decay': 4.415940122836532e-06, 'epochs': 126, 'loss': 'mse', 'optimizer': 'adam', 'graph_mode': 'knn', 'source': 'grm', 'knn_k': 9, 'weighted_edges': False, 'symmetrize_mode': 'mutual', 'use_snp_selection': False}. Best is trial 40 with value: 0.06703058362419242.
[I 2025-11-03 12:55:10,031] Trial 56 finished with value: 0.004316060552550177 and parameters: {'model_type': 'gcn', 'hidden_dims': '[128, 64]', 'dropout': 0.4863570625041458, 'batch_norm': True, 'lr': 0.0008021181589132118, 'weight_decay': 1.4375735368546596e-05, 'epochs': 199, 'loss': 'mse', 'optimizer': 'adam', 'graph_mode': 'knn', 'source': 'grm', 'knn_k': 6, 'weighted_edges': True, 'symmetrize_mode': 'union', 'use_snp_selection': False}. Best is trial 40 with value: 0.06703058362419242.
[I 2025-11-03 12:55:12,458] Trial 57 finished with value: 0.03420687935294916 and parameters: {'model_type': 'gcn', 'hidden_dims': '[512, 256]', 'dropout': 0.3773644605743697, 'batch_norm': True, 'lr': 0.0004600904989478107, 'weight_decay': 3.142513280937001e-06, 'epochs': 179, 'loss': 'mse', 'optimizer': 'adam', 'graph_mode': 'cutoff', 'cutoff': 0.8365897150283178, 'grm_norm': 'gcn', 'self_loops': False, 'use_snp_selection': False}. Best is trial 40 with value: 0.06703058362419242.
[I 2025-11-03 12:55:14,505] Trial 58 finished with value: 0.019964449127029 and parameters: {'model_type': 'gcn', 'hidden_dims': '[512, 64]', 'dropout': 0.2378704241729735, 'batch_norm': True, 'lr': 1.9800216949037047e-05, 'weight_decay': 7.688000497945359e-06, 'epochs': 114, 'loss': 'mae', 'optimizer': 'adam', 'graph_mode': 'knn', 'source': 'grm', 'knn_k': 4, 'weighted_edges': False, 'symmetrize_mode': 'mutual', 'use_snp_selection': False}. Best is trial 40 with value: 0.06703058362419242.
[I 2025-11-03 12:55:16,041] Trial 59 finished with value: 0.050659804970518425 and parameters: {'model_type': 'gcn', 'hidden_dims': '[512, 128]', 'dropout': 0.28345459938667705, 'batch_norm': True, 'lr': 4.319054703196159e-05, 'weight_decay': 3.116526009830651e-05, 'epochs': 45, 'loss': 'mse', 'optimizer': 'adam', 'graph_mode': 'cutoff', 'cutoff': 0.6765815413958889, 'grm_norm': 'none', 'self_loops': True, 'use_snp_selection': False}. Best is trial 40 with value: 0.06703058362419242.
[I 2025-11-03 12:55:17,521] Trial 60 finished with value: 0.01805048335042155 and parameters: {'model_type': 'gcn', 'hidden_dims': '[512, 128]', 'dropout': 0.2939438181188993, 'batch_norm': False, 'lr': 4.2941306249722706e-05, 'weight_decay': 9.430350060993931e-05, 'epochs': 47, 'loss': 'mse', 'optimizer': 'adam', 'graph_mode': 'cutoff', 'cutoff': 0.6686896628449192, 'grm_norm': 'none', 'self_loops': True, 'use_snp_selection': True, 'num_snps': 11677}. Best is trial 40 with value: 0.06703058362419242.
[I 2025-11-03 12:55:19,181] Trial 61 finished with value: 0.016617489594586952 and parameters: {'model_type': 'gcn', 'hidden_dims': '[512, 128]', 'dropout': 0.33164171557807004, 'batch_norm': True, 'lr': 5.8279028432152034e-05, 'weight_decay': 2.7338450388109157e-05, 'epochs': 56, 'loss': 'mse', 'optimizer': 'adam', 'graph_mode': 'cutoff', 'cutoff': 0.7177318767794294, 'grm_norm': 'none', 'self_loops': True, 'use_snp_selection': False}. Best is trial 40 with value: 0.06703058362419242.
[I 2025-11-03 12:55:20,889] Trial 62 finished with value: 0.05200247107550596 and parameters: {'model_type': 'gcn', 'hidden_dims': '[512, 128]', 'dropout': 0.20665717872658826, 'batch_norm': True, 'lr': 0.00013595521431943264, 'weight_decay': 4.427198061453093e-05, 'epochs': 72, 'loss': 'mse', 'optimizer': 'adam', 'graph_mode': 'cutoff', 'cutoff': 0.8164200872653515, 'grm_norm': 'none', 'self_loops': True, 'use_snp_selection': False}. Best is trial 40 with value: 0.06703058362419242.
[I 2025-11-03 12:55:22,406] Trial 63 finished with value: 0.006302296855648056 and parameters: {'model_type': 'gcn', 'hidden_dims': '[512, 128]', 'dropout': 0.15543997007794066, 'batch_norm': True, 'lr': 2.9729289923351968e-05, 'weight_decay': 7.077334459481522e-05, 'epochs': 42, 'loss': 'mse', 'optimizer': 'adam', 'graph_mode': 'cutoff', 'cutoff': 0.8058363172439614, 'grm_norm': 'none', 'self_loops': True, 'use_snp_selection': False}. Best is trial 40 with value: 0.06703058362419242.
[I 2025-11-03 12:55:23,803] Trial 64 finished with value: 0.0303553211777596 and parameters: {'model_type': 'gcn', 'hidden_dims': '[512, 128]', 'dropout': 0.20187061487617527, 'batch_norm': True, 'lr': 8.649821924748231e-06, 'weight_decay': 3.386206198701255e-05, 'epochs': 24, 'loss': 'mse', 'optimizer': 'adam', 'graph_mode': 'cutoff', 'cutoff': 0.8612196064840165, 'grm_norm': 'none', 'self_loops': True, 'use_snp_selection': False}. Best is trial 40 with value: 0.06703058362419242.
[I 2025-11-03 12:55:25,151] Trial 65 finished with value: 0.0195186790604479 and parameters: {'model_type': 'gcn', 'hidden_dims': '[512, 128]', 'dropout': 0.26179678522498073, 'batch_norm': True, 'lr': 1.4730012256067383e-05, 'weight_decay': 4.212859496569271e-05, 'epochs': 16, 'loss': 'mse', 'optimizer': 'adam', 'graph_mode': 'cutoff', 'cutoff': 0.7085446223976558, 'grm_norm': 'none', 'self_loops': True, 'use_snp_selection': False}. Best is trial 40 with value: 0.06703058362419242.
[I 2025-11-03 12:55:26,909] Trial 66 finished with value: 0.027210208001792843 and parameters: {'model_type': 'gcn', 'hidden_dims': '[512, 128]', 'dropout': 0.22163963129602543, 'batch_norm': True, 'lr': 0.000203538192226295, 'weight_decay': 1.7914697994505173e-05, 'epochs': 79, 'loss': 'mse', 'optimizer': 'adam', 'graph_mode': 'cutoff', 'cutoff': 0.755754339517347, 'grm_norm': 'none', 'self_loops': True, 'use_snp_selection': False}. Best is trial 40 with value: 0.06703058362419242.
[I 2025-11-03 12:55:28,526] Trial 67 finished with value: 0.009832925531632517 and parameters: {'model_type': 'gcn', 'hidden_dims': '[512, 128]', 'dropout': 0.123573532963032, 'batch_norm': True, 'lr': 9.383367470700466e-05, 'weight_decay': 0.00023258676096478845, 'epochs': 57, 'loss': 'mse', 'optimizer': 'adam', 'graph_mode': 'cutoff', 'cutoff': 0.6812813653709433, 'grm_norm': 'none', 'self_loops': True, 'use_snp_selection': False}. Best is trial 40 with value: 0.06703058362419242.
[I 2025-11-03 12:55:29,789] Trial 68 finished with value: 0.042468439701369556 and parameters: {'model_type': 'gcn', 'hidden_dims': '[128, 64]', 'dropout': 0.16857182536306928, 'batch_norm': True, 'lr': 2.1597041193471685e-05, 'weight_decay': 1.1061058952753708e-05, 'epochs': 94, 'loss': 'mse', 'optimizer': 'adam', 'graph_mode': 'cutoff', 'cutoff': 0.7999248573804538, 'grm_norm': 'cosine_then_gcn', 'self_loops': True, 'use_snp_selection': False}. Best is trial 40 with value: 0.06703058362419242.
[I 2025-11-03 12:55:31,132] Trial 69 finished with value: 0.011247362340483989 and parameters: {'model_type': 'gcn', 'hidden_dims': '[256, 128]', 'dropout': 0.2892936388513445, 'batch_norm': True, 'lr': 3.8245955314031126e-05, 'weight_decay': 5.303250673606458e-07, 'epochs': 66, 'loss': 'mse', 'optimizer': 'adam', 'graph_mode': 'cutoff', 'cutoff': 0.6444314312987764, 'grm_norm': 'gcn', 'self_loops': False, 'use_snp_selection': False}. Best is trial 40 with value: 0.06703058362419242.
[I 2025-11-03 12:55:32,586] Trial 70 finished with value: 0.027871830572908398 and parameters: {'model_type': 'gcn', 'hidden_dims': '[512, 128]', 'dropout': 0.2564678586374824, 'batch_norm': True, 'lr': 0.0003263115470581496, 'weight_decay': 1.1564985618707724e-05, 'epochs': 32, 'loss': 'mae', 'optimizer': 'adam', 'graph_mode': 'cutoff', 'cutoff': 0.5877876290034214, 'grm_norm': 'none', 'self_loops': False, 'use_snp_selection': False}. Best is trial 40 with value: 0.06703058362419242.
[I 2025-11-03 12:55:33,845] Trial 71 finished with value: 0.06901665353648391 and parameters: {'model_type': 'gcn', 'hidden_dims': '[128, 64]', 'dropout': 0.1033233559205798, 'batch_norm': True, 'lr': 1.9642798733242486e-05, 'weight_decay': 2.0181247539543393e-05, 'epochs': 92, 'loss': 'mse', 'optimizer': 'adam', 'graph_mode': 'cutoff', 'cutoff': 0.817362914190608, 'grm_norm': 'cosine_then_gcn', 'self_loops': True, 'use_snp_selection': False}. Best is trial 71 with value: 0.06901665353648391.
[I 2025-11-03 12:55:35,027] Trial 72 finished with value: 0.05466330103902375 and parameters: {'model_type': 'gcn', 'hidden_dims': '[128, 64]', 'dropout': 0.11713067080627529, 'batch_norm': True, 'lr': 1.2044981498959512e-05, 'weight_decay': 2.028281515131832e-05, 'epochs': 68, 'loss': 'mse', 'optimizer': 'adam', 'graph_mode': 'cutoff', 'cutoff': 0.8432545147799855, 'grm_norm': 'cosine_then_gcn', 'self_loops': True, 'use_snp_selection': False}. Best is trial 71 with value: 0.06901665353648391.
[I 2025-11-03 12:55:36,132] Trial 73 finished with value: 0.04200294390661871 and parameters: {'model_type': 'gcn', 'hidden_dims': '[128, 64]', 'dropout': 0.10554815712345444, 'batch_norm': True, 'lr': 1.2676821983685973e-05, 'weight_decay': 7.575497320033719e-05, 'epochs': 41, 'loss': 'mse', 'optimizer': 'adam', 'graph_mode': 'cutoff', 'cutoff': 0.850160467850476, 'grm_norm': 'cosine_then_gcn', 'self_loops': True, 'use_snp_selection': False}. Best is trial 71 with value: 0.06901665353648391.
[I 2025-11-03 12:55:37,355] Trial 74 finished with value: 0.03313076600835444 and parameters: {'model_type': 'gcn', 'hidden_dims': '[128, 64]', 'dropout': 0.10198561942033837, 'batch_norm': True, 'lr': 5.371075813301901e-06, 'weight_decay': 4.467940502058299e-05, 'epochs': 69, 'loss': 'mse', 'optimizer': 'adam', 'graph_mode': 'cutoff', 'cutoff': 0.8230323221718119, 'grm_norm': 'cosine_then_gcn', 'self_loops': True, 'use_snp_selection': False}. Best is trial 71 with value: 0.06901665353648391.
[I 2025-11-03 12:55:38,335] Trial 75 finished with value: 0.01886711543390969 and parameters: {'model_type': 'gcn', 'hidden_dims': '[128, 64]', 'dropout': 0.15474810470631167, 'batch_norm': True, 'lr': 8.244398617390633e-06, 'weight_decay': 2.2326944809277167e-05, 'epochs': 2, 'loss': 'mse', 'optimizer': 'adam', 'graph_mode': 'cutoff', 'cutoff': 0.8939183730685475, 'grm_norm': 'cosine_then_gcn', 'self_loops': True, 'use_snp_selection': False}. Best is trial 71 with value: 0.06901665353648391.
[I 2025-11-03 12:55:39,504] Trial 76 finished with value: 0.05398506963071113 and parameters: {'model_type': 'gcn', 'hidden_dims': '[128, 64]', 'dropout': 0.13717503091757124, 'batch_norm': True, 'lr': 1.7496679573366794e-05, 'weight_decay': 5.8687861377561945e-05, 'epochs': 50, 'loss': 'mse', 'optimizer': 'adam', 'graph_mode': 'cutoff', 'cutoff': 0.7736671319816294, 'grm_norm': 'cosine_then_gcn', 'self_loops': True, 'use_snp_selection': False}. Best is trial 71 with value: 0.06901665353648391.
[I 2025-11-03 12:55:41,523] Trial 77 finished with value: 0.015118629718905215 and parameters: {'model_type': 'gcn', 'hidden_dims': '[128, 64]', 'dropout': 0.1414502963382972, 'batch_norm': True, 'lr': 1.1513351458417714e-05, 'weight_decay': 3.218121582483538e-05, 'epochs': 334, 'loss': 'mse', 'optimizer': 'adam', 'graph_mode': 'cutoff', 'cutoff': 0.7751151228342563, 'grm_norm': 'cosine_then_gcn', 'self_loops': True, 'use_snp_selection': False}. Best is trial 71 with value: 0.06901665353648391.
[I 2025-11-03 12:55:43,741] Trial 78 finished with value: 0.004686377103983937 and parameters: {'model_type': 'gcn', 'hidden_dims': '[128, 64]', 'dropout': 0.11871576765718934, 'batch_norm': False, 'lr': 1.6542491282413167e-05, 'weight_decay': 5.740217769752621e-05, 'epochs': 86, 'loss': 'mse', 'optimizer': 'adam', 'graph_mode': 'cutoff', 'cutoff': 0.7425953071506173, 'grm_norm': 'cosine_then_gcn', 'self_loops': True, 'use_snp_selection': True, 'num_snps': 34076}. Best is trial 71 with value: 0.06901665353648391.
[I 2025-11-03 12:55:44,914] Trial 79 finished with value: 0.047009991027102266 and parameters: {'model_type': 'gcn', 'hidden_dims': '[128, 64]', 'dropout': 0.18258219135537673, 'batch_norm': True, 'lr': 2.2583282732707496e-05, 'weight_decay': 0.00017187263928372906, 'epochs': 53, 'loss': 'mse', 'optimizer': 'adam', 'graph_mode': 'cutoff', 'cutoff': 0.788182156667365, 'grm_norm': 'cosine_then_gcn', 'self_loops': True, 'use_snp_selection': False}. Best is trial 71 with value: 0.06901665353648391.
[I 2025-11-03 12:55:47,273] Trial 80 finished with value: 0.03755194154335628 and parameters: {'model_type': 'gcn', 'hidden_dims': '[512, 256]', 'dropout': 0.11145796071786027, 'batch_norm': True, 'lr': 3.1339191616158866e-05, 'weight_decay': 1.7413592312158408e-05, 'epochs': 166, 'loss': 'mse', 'optimizer': 'adam', 'graph_mode': 'cutoff', 'cutoff': 0.7292021071066755, 'grm_norm': 'cosine_then_gcn', 'self_loops': True, 'use_snp_selection': False}. Best is trial 71 with value: 0.06901665353648391.
[I 2025-11-03 12:55:48,401] Trial 81 finished with value: 0.030017513875130172 and parameters: {'model_type': 'gcn', 'hidden_dims': '[128, 64]', 'dropout': 0.13748453300593902, 'batch_norm': True, 'lr': 2.2185769274108592e-05, 'weight_decay': 0.00015240661708256826, 'epochs': 49, 'loss': 'mse', 'optimizer': 'adam', 'graph_mode': 'cutoff', 'cutoff': 0.790310556317218, 'grm_norm': 'cosine_then_gcn', 'self_loops': True, 'use_snp_selection': False}. Best is trial 71 with value: 0.06901665353648391.
[I 2025-11-03 12:55:49,631] Trial 82 finished with value: 0.05133594925494154 and parameters: {'model_type': 'gcn', 'hidden_dims': '[128, 64]', 'dropout': 0.1904140426974275, 'batch_norm': True, 'lr': 1.900990392409699e-05, 'weight_decay': 0.00032707922372974814, 'epochs': 73, 'loss': 'mse', 'optimizer': 'adam', 'graph_mode': 'cutoff', 'cutoff': 0.8169418810366802, 'grm_norm': 'cosine_then_gcn', 'self_loops': True, 'use_snp_selection': False}. Best is trial 71 with value: 0.06901665353648391.
[I 2025-11-03 12:55:50,956] Trial 83 finished with value: 0.026856560475697774 and parameters: {'model_type': 'gcn', 'hidden_dims': '[128, 64]', 'dropout': 0.1701683771296681, 'batch_norm': True, 'lr': 9.547648107608637e-06, 'weight_decay': 0.00031394083871486743, 'epochs': 106, 'loss': 'mse', 'optimizer': 'adam', 'graph_mode': 'cutoff', 'cutoff': 0.828126515931367, 'grm_norm': 'cosine_then_gcn', 'self_loops': True, 'use_snp_selection': False}. Best is trial 71 with value: 0.06901665353648391.
