[I 2025-11-03 13:15:05,763] Trial 70 finished with value: 0.038254991957548744 and parameters: {'model_type': 'gcn', 'hidden_dims': '[512, 128]', 'dropout': 0.10807424517359379, 'batch_norm': True, 'lr': 8.15114176343114e-06, 'weight_decay': 1.4523769131792575e-05, 'epochs': 257, 'loss': 'mae', 'optimizer': 'adam', 'graph_mode': 'knn', 'source': 'grm', 'knn_k': 2, 'weighted_edges': True, 'symmetrize_mode': 'union', 'use_snp_selection': False}. Best is trial 32 with value: 0.15312810173820499.
[I 2025-11-03 13:15:10,364] Trial 71 finished with value: 0.12009649912034437 and parameters: {'model_type': 'gcn', 'hidden_dims': '[512, 64]', 'dropout': 0.2790525840732358, 'batch_norm': True, 'lr': 0.0001521653184779657, 'weight_decay': 1.4930623006397493e-07, 'epochs': 269, 'loss': 'mae', 'optimizer': 'adam', 'graph_mode': 'knn', 'source': 'grm', 'knn_k': 1, 'weighted_edges': True, 'symmetrize_mode': 'union', 'use_snp_selection': False}. Best is trial 32 with value: 0.15312810173820499.
[I 2025-11-03 13:15:15,121] Trial 72 finished with value: 0.13829584861391667 and parameters: {'model_type': 'gcn', 'hidden_dims': '[512, 64]', 'dropout': 0.2929188620181737, 'batch_norm': True, 'lr': 8.571030050463713e-05, 'weight_decay': 2.7111454611135585e-07, 'epochs': 282, 'loss': 'mae', 'optimizer': 'adam', 'graph_mode': 'knn', 'source': 'grm', 'knn_k': 1, 'weighted_edges': True, 'symmetrize_mode': 'union', 'use_snp_selection': False}. Best is trial 32 with value: 0.15312810173820499.
[I 2025-11-03 13:15:19,410] Trial 73 finished with value: 0.15100767517448174 and parameters: {'model_type': 'gcn', 'hidden_dims': '[512, 64]', 'dropout': 0.27648837362201795, 'batch_norm': True, 'lr': 6.158791892857526e-05, 'weight_decay': 1.2872205373953122e-07, 'epochs': 243, 'loss': 'mae', 'optimizer': 'adam', 'graph_mode': 'knn', 'source': 'grm', 'knn_k': 1, 'weighted_edges': True, 'symmetrize_mode': 'union', 'use_snp_selection': False}. Best is trial 32 with value: 0.15312810173820499.
[I 2025-11-03 13:15:22,082] Trial 74 finished with value: 0.03039816547129606 and parameters: {'model_type': 'gcn', 'hidden_dims': '[256, 128, 64]', 'dropout': 0.2615113499058195, 'batch_norm': True, 'lr': 2.205561371757452e-05, 'weight_decay': 1.8924297388419628e-07, 'epochs': 184, 'loss': 'mae', 'optimizer': 'adam', 'graph_mode': 'knn', 'source': 'grm', 'knn_k': 1, 'weighted_edges': True, 'symmetrize_mode': 'union', 'use_snp_selection': False}. Best is trial 32 with value: 0.15312810173820499.
[I 2025-11-03 13:15:26,358] Trial 75 finished with value: 0.11980470790918542 and parameters: {'model_type': 'gcn', 'hidden_dims': '[512, 64]', 'dropout': 0.3065284210179138, 'batch_norm': True, 'lr': 5.956307727885499e-05, 'weight_decay': 5.079863135191731e-07, 'epochs': 241, 'loss': 'mae', 'optimizer': 'adam', 'graph_mode': 'knn', 'source': 'grm', 'knn_k': 2, 'weighted_edges': True, 'symmetrize_mode': 'union', 'use_snp_selection': False}. Best is trial 32 with value: 0.15312810173820499.
[I 2025-11-03 13:15:28,888] Trial 76 finished with value: 0.10639669401872999 and parameters: {'model_type': 'gcn', 'hidden_dims': '[512, 64]', 'dropout': 0.23761606844759486, 'batch_norm': False, 'lr': 0.0003468386736320792, 'weight_decay': 1.2766006430629917e-07, 'epochs': 229, 'loss': 'mse', 'optimizer': 'adam', 'graph_mode': 'knn', 'source': 'grm', 'knn_k': 1, 'weighted_edges': True, 'symmetrize_mode': 'union', 'use_snp_selection': True, 'num_snps': 5307}. Best is trial 32 with value: 0.15312810173820499.
[I 2025-11-03 13:15:33,325] Trial 77 finished with value: 0.0942578206840064 and parameters: {'model_type': 'gcn', 'hidden_dims': '[512, 256]', 'dropout': 0.5219858392707696, 'batch_norm': True, 'lr': 2.9084371778781187e-05, 'weight_decay': 2.4356451512391585e-07, 'epochs': 255, 'loss': 'mae', 'optimizer': 'adam', 'graph_mode': 'knn', 'source': 'grm', 'knn_k': 2, 'weighted_edges': True, 'symmetrize_mode': 'mutual', 'use_snp_selection': False}. Best is trial 32 with value: 0.15312810173820499.
[I 2025-11-03 13:15:37,686] Trial 78 finished with value: 0.13699877472007518 and parameters: {'model_type': 'gcn', 'hidden_dims': '[512, 64]', 'dropout': 0.3212462150137887, 'batch_norm': True, 'lr': 0.00020381131085481347, 'weight_decay': 1.1099321444341237e-06, 'epochs': 252, 'loss': 'mae', 'optimizer': 'adam', 'graph_mode': 'cutoff', 'cutoff': 0.5717997799720426, 'grm_norm': 'cosine_then_gcn', 'self_loops': False, 'use_snp_selection': False}. Best is trial 32 with value: 0.15312810173820499.
[I 2025-11-03 13:15:40,471] Trial 79 finished with value: 0.11072176327567708 and parameters: {'model_type': 'gcn', 'hidden_dims': '[512, 64]', 'dropout': 0.2127129703436737, 'batch_norm': True, 'lr': 0.00010927744894044739, 'weight_decay': 1.1943149682553962e-07, 'epochs': 118, 'loss': 'mae', 'optimizer': 'adam', 'graph_mode': 'knn', 'source': 'grm', 'knn_k': 4, 'weighted_edges': True, 'symmetrize_mode': 'union', 'use_snp_selection': False}. Best is trial 32 with value: 0.15312810173820499.
[I 2025-11-03 13:15:42,939] Trial 80 finished with value: 0.13423231735480545 and parameters: {'model_type': 'gcn', 'hidden_dims': '[128, 64]', 'dropout': 0.2748114021114354, 'batch_norm': True, 'lr': 0.00026071498733075795, 'weight_decay': 4.269137253808517e-06, 'epochs': 291, 'loss': 'mae', 'optimizer': 'adam', 'graph_mode': 'knn', 'source': 'grm', 'knn_k': 3, 'weighted_edges': True, 'symmetrize_mode': 'union', 'use_snp_selection': False}. Best is trial 32 with value: 0.15312810173820499.
[I 2025-11-03 13:15:47,636] Trial 81 finished with value: 0.1264791265164653 and parameters: {'model_type': 'gcn', 'hidden_dims': '[512, 64]', 'dropout': 0.28640418320383626, 'batch_norm': True, 'lr': 0.0001420934432522812, 'weight_decay': 1.761058989862825e-07, 'epochs': 277, 'loss': 'mae', 'optimizer': 'adam', 'graph_mode': 'knn', 'source': 'grm', 'knn_k': 1, 'weighted_edges': True, 'symmetrize_mode': 'union', 'use_snp_selection': False}. Best is trial 32 with value: 0.15312810173820499.
[I 2025-11-03 13:15:52,184] Trial 82 finished with value: 0.1338312589829149 and parameters: {'model_type': 'gcn', 'hidden_dims': '[512, 64]', 'dropout': 0.1914357726925432, 'batch_norm': True, 'lr': 9.557361738787054e-05, 'weight_decay': 3.29304081756898e-07, 'epochs': 264, 'loss': 'mae', 'optimizer': 'adam', 'graph_mode': 'knn', 'source': 'grm', 'knn_k': 1, 'weighted_edges': True, 'symmetrize_mode': 'union', 'use_snp_selection': False}. Best is trial 32 with value: 0.15312810173820499.
[I 2025-11-03 13:15:56,839] Trial 83 finished with value: 0.11288388186291727 and parameters: {'model_type': 'gcn', 'hidden_dims': '[512, 64]', 'dropout': 0.3002981153362031, 'batch_norm': True, 'lr': 0.00016089363425380465, 'weight_decay': 1.444153174723221e-07, 'epochs': 274, 'loss': 'mae', 'optimizer': 'adam', 'graph_mode': 'knn', 'source': 'grm', 'knn_k': 1, 'weighted_edges': True, 'symmetrize_mode': 'union', 'use_snp_selection': False}. Best is trial 32 with value: 0.15312810173820499.
[I 2025-11-03 13:16:01,833] Trial 84 finished with value: 0.13299208768741855 and parameters: {'model_type': 'gcn', 'hidden_dims': '[512, 64]', 'dropout': 0.5987253113562495, 'batch_norm': True, 'lr': 0.00021334267976359022, 'weight_decay': 4.529388172603305e-07, 'epochs': 301, 'loss': 'mae', 'optimizer': 'adam', 'graph_mode': 'knn', 'source': 'grm', 'knn_k': 1, 'weighted_edges': True, 'symmetrize_mode': 'union', 'use_snp_selection': False}. Best is trial 32 with value: 0.15312810173820499.
[I 2025-11-03 13:16:04,840] Trial 85 finished with value: 0.1267239716075742 and parameters: {'model_type': 'gcn', 'hidden_dims': '[256, 128]', 'dropout': 0.24785860838893692, 'batch_norm': True, 'lr': 0.0003052275441976951, 'weight_decay': 2.517492434149767e-07, 'epochs': 247, 'loss': 'mae', 'optimizer': 'adam', 'graph_mode': 'knn', 'source': 'grm', 'knn_k': 10, 'weighted_edges': True, 'symmetrize_mode': 'union', 'use_snp_selection': False}. Best is trial 32 with value: 0.15312810173820499.
[I 2025-11-03 13:16:06,590] Trial 86 finished with value: 0.0531601389747754 and parameters: {'model_type': 'gcn', 'hidden_dims': '[512, 64]', 'dropout': 0.35350705792386117, 'batch_norm': True, 'lr': 6.823985626443476e-05, 'weight_decay': 1.798483252316403e-07, 'epochs': 34, 'loss': 'mae', 'optimizer': 'adam', 'graph_mode': 'knn', 'source': 'grm', 'knn_k': 2, 'weighted_edges': False, 'symmetrize_mode': 'union', 'use_snp_selection': False}. Best is trial 32 with value: 0.15312810173820499.
[I 2025-11-03 13:16:12,287] Trial 87 finished with value: -0.02340673669221407 and parameters: {'model_type': 'gcn', 'hidden_dims': '[512, 64]', 'dropout': 0.31370489587062433, 'batch_norm': False, 'lr': 0.0004032099469339377, 'weight_decay': 1.0234525692441745e-07, 'epochs': 205, 'loss': 'mse', 'optimizer': 'adam', 'graph_mode': 'knn', 'source': 'grm', 'knn_k': 9, 'weighted_edges': True, 'symmetrize_mode': 'union', 'use_snp_selection': True, 'num_snps': 50914}. Best is trial 32 with value: 0.15312810173820499.
[I 2025-11-03 13:16:17,589] Trial 88 finished with value: 0.11190867729576122 and parameters: {'model_type': 'gcn', 'hidden_dims': '[512, 128]', 'dropout': 0.32756711095885327, 'batch_norm': True, 'lr': 0.0001261722769230499, 'weight_decay': 7.150307598373282e-07, 'epochs': 323, 'loss': 'mae', 'optimizer': 'adam', 'graph_mode': 'knn', 'source': 'grm', 'knn_k': 1, 'weighted_edges': True, 'symmetrize_mode': 'mutual', 'use_snp_selection': False}. Best is trial 32 with value: 0.15312810173820499.
[I 2025-11-03 13:16:22,679] Trial 89 finished with value: 0.13852993744314113 and parameters: {'model_type': 'gcn', 'hidden_dims': '[512, 64]', 'dropout': 0.27678910667723794, 'batch_norm': True, 'lr': 0.00017943874564578342, 'weight_decay': 3.383190113380371e-07, 'epochs': 311, 'loss': 'mae', 'optimizer': 'adam', 'graph_mode': 'knn', 'source': 'grm', 'knn_k': 1, 'weighted_edges': True, 'symmetrize_mode': 'union', 'use_snp_selection': False}. Best is trial 32 with value: 0.15312810173820499.
[I 2025-11-03 13:16:27,474] Trial 90 finished with value: 0.10659570413986735 and parameters: {'model_type': 'gcn', 'hidden_dims': '[512, 256]', 'dropout': 0.2598941767857669, 'batch_norm': True, 'lr': 0.0007748542665369433, 'weight_decay': 0.00011305971722956918, 'epochs': 287, 'loss': 'mae', 'optimizer': 'adam', 'graph_mode': 'cutoff', 'cutoff': 0.45967598828727374, 'grm_norm': 'gcn', 'self_loops': False, 'use_snp_selection': False}. Best is trial 32 with value: 0.15312810173820499.
[I 2025-11-03 13:16:33,037] Trial 91 finished with value: 0.13340546327820485 and parameters: {'model_type': 'gcn', 'hidden_dims': '[512, 64]', 'dropout': 0.29405053812723186, 'batch_norm': True, 'lr': 8.087496271824583e-05, 'weight_decay': 1.910229179091069e-06, 'epochs': 347, 'loss': 'mae', 'optimizer': 'adam', 'graph_mode': 'knn', 'source': 'grm', 'knn_k': 2, 'weighted_edges': True, 'symmetrize_mode': 'union', 'use_snp_selection': False}. Best is trial 32 with value: 0.15312810173820499.
[I 2025-11-03 13:16:37,580] Trial 92 finished with value: 0.10603996113897717 and parameters: {'model_type': 'gcn', 'hidden_dims': '[512, 64]', 'dropout': 0.28416674056959945, 'batch_norm': True, 'lr': 5.55739565145349e-05, 'weight_decay': 6.6600326429564885e-06, 'epochs': 264, 'loss': 'mae', 'optimizer': 'adam', 'graph_mode': 'knn', 'source': 'grm', 'knn_k': 2, 'weighted_edges': True, 'symmetrize_mode': 'union', 'use_snp_selection': False}. Best is trial 32 with value: 0.15312810173820499.
[I 2025-11-03 13:16:42,316] Trial 93 finished with value: 0.1314059862232554 and parameters: {'model_type': 'gcn', 'hidden_dims': '[512, 64]', 'dropout': 0.3053378294540939, 'batch_norm': True, 'lr': 4.558896576993881e-05, 'weight_decay': 1.5794998012360944e-07, 'epochs': 279, 'loss': 'mae', 'optimizer': 'adam', 'graph_mode': 'knn', 'source': 'grm', 'knn_k': 1, 'weighted_edges': True, 'symmetrize_mode': 'union', 'use_snp_selection': False}. Best is trial 32 with value: 0.15312810173820499.
[I 2025-11-03 13:16:47,452] Trial 94 finished with value: 0.10135863641839818 and parameters: {'model_type': 'gcn', 'hidden_dims': '[512, 64]', 'dropout': 0.33206154185925935, 'batch_norm': True, 'lr': 2.6544696217639796e-05, 'weight_decay': 2.0836230828359148e-07, 'epochs': 310, 'loss': 'mae', 'optimizer': 'adam', 'graph_mode': 'knn', 'source': 'grm', 'knn_k': 1, 'weighted_edges': True, 'symmetrize_mode': 'union', 'use_snp_selection': False}. Best is trial 32 with value: 0.15312810173820499.
[I 2025-11-03 13:16:52,447] Trial 95 finished with value: 0.11602606728233972 and parameters: {'model_type': 'gcn', 'hidden_dims': '[512, 64]', 'dropout': 0.2280501211473556, 'batch_norm': True, 'lr': 0.00026735188945654535, 'weight_decay': 1.2108905103164997e-07, 'epochs': 296, 'loss': 'mae', 'optimizer': 'adam', 'graph_mode': 'knn', 'source': 'grm', 'knn_k': 2, 'weighted_edges': True, 'symmetrize_mode': 'union', 'use_snp_selection': False}. Best is trial 32 with value: 0.15312810173820499.
[I 2025-11-03 13:16:55,641] Trial 96 finished with value: 0.10792276080292384 and parameters: {'model_type': 'gcn', 'hidden_dims': '[256, 128, 64]', 'dropout': 0.2672889949665178, 'batch_norm': True, 'lr': 0.000581107956677584, 'weight_decay': 2.4737853060406967e-06, 'epochs': 239, 'loss': 'mae', 'optimizer': 'adam', 'graph_mode': 'knn', 'source': 'grm', 'knn_k': 1, 'weighted_edges': True, 'symmetrize_mode': 'union', 'use_snp_selection': False}. Best is trial 32 with value: 0.15312810173820499.
[I 2025-11-03 13:17:01,054] Trial 97 finished with value: 0.11268820228216625 and parameters: {'model_type': 'gcn', 'hidden_dims': '[512, 64]', 'dropout': 0.3453908156938353, 'batch_norm': True, 'lr': 5.859373448149256e-05, 'weight_decay': 2.6922010171515534e-07, 'epochs': 325, 'loss': 'mae', 'optimizer': 'adam', 'graph_mode': 'knn', 'source': 'grm', 'knn_k': 7, 'weighted_edges': True, 'symmetrize_mode': 'union', 'use_snp_selection': False}. Best is trial 32 with value: 0.15312810173820499.
[I 2025-11-03 13:17:05,640] Trial 98 finished with value: 0.14457305225015465 and parameters: {'model_type': 'gcn', 'hidden_dims': '[512, 128]', 'dropout': 0.24587942432154214, 'batch_norm': True, 'lr': 3.720922558336843e-05, 'weight_decay': 5.34408069147434e-07, 'epochs': 260, 'loss': 'mae', 'optimizer': 'adam', 'graph_mode': 'knn', 'source': 'grm', 'knn_k': 5, 'weighted_edges': True, 'symmetrize_mode': 'union', 'use_snp_selection': False}. Best is trial 32 with value: 0.15312810173820499.
[I 2025-11-03 13:17:10,154] Trial 99 finished with value: 0.1500778022562339 and parameters: {'model_type': 'gcn', 'hidden_dims': '[512, 128]', 'dropout': 0.24471265726716335, 'batch_norm': True, 'lr': 0.0003636353275292652, 'weight_decay': 4.3060353952108035e-07, 'epochs': 258, 'loss': 'mae', 'optimizer': 'adam', 'graph_mode': 'knn', 'source': 'grm', 'knn_k': 1, 'weighted_edges': True, 'symmetrize_mode': 'union', 'use_snp_selection': False}. Best is trial 32 with value: 0.15312810173820499.
[I 2025-11-03 13:17:14,678] Trial 100 finished with value: 0.11969783881199286 and parameters: {'model_type': 'gcn', 'hidden_dims': '[512, 128]', 'dropout': 0.17960667632226296, 'batch_norm': True, 'lr': 0.0003626204227651084, 'weight_decay': 4.6166027294151386e-07, 'epochs': 257, 'loss': 'mse', 'optimizer': 'adam', 'graph_mode': 'knn', 'source': 'grm', 'knn_k': 5, 'weighted_edges': True, 'symmetrize_mode': 'union', 'use_snp_selection': False}. Best is trial 32 with value: 0.15312810173820499.
[I 2025-11-03 13:17:19,148] Trial 101 finished with value: 0.14822334614871446 and parameters: {'model_type': 'gcn', 'hidden_dims': '[512, 128]', 'dropout': 0.24066960898420084, 'batch_norm': True, 'lr': 3.8469543211414625e-05, 'weight_decay': 2.982032120333945e-07, 'epochs': 249, 'loss': 'mae', 'optimizer': 'adam', 'graph_mode': 'knn', 'source': 'grm', 'knn_k': 7, 'weighted_edges': True, 'symmetrize_mode': 'union', 'use_snp_selection': False}. Best is trial 32 with value: 0.15312810173820499.
[I 2025-11-03 13:17:23,350] Trial 102 finished with value: 0.13303457785152856 and parameters: {'model_type': 'gcn', 'hidden_dims': '[512, 128]', 'dropout': 0.2429067925605516, 'batch_norm': True, 'lr': 3.657626460113188e-05, 'weight_decay': 6.065597938878915e-07, 'epochs': 228, 'loss': 'mae', 'optimizer': 'adam', 'graph_mode': 'knn', 'source': 'grm', 'knn_k': 8, 'weighted_edges': True, 'symmetrize_mode': 'union', 'use_snp_selection': False}. Best is trial 32 with value: 0.15312810173820499.
[I 2025-11-03 13:17:27,820] Trial 103 finished with value: 0.1377462937569042 and parameters: {'model_type': 'gcn', 'hidden_dims': '[512, 128]', 'dropout': 0.22040302550770857, 'batch_norm': True, 'lr': 3.1658984285655674e-05, 'weight_decay': 7.637152876459371e-07, 'epochs': 251, 'loss': 'mae', 'optimizer': 'adam', 'graph_mode': 'knn', 'source': 'grm', 'knn_k': 6, 'weighted_edges': True, 'symmetrize_mode': 'union', 'use_snp_selection': False}. Best is trial 32 with value: 0.15312810173820499.
[I 2025-11-03 13:17:32,200] Trial 104 finished with value: 0.13226842026347962 and parameters: {'model_type': 'gcn', 'hidden_dims': '[512, 128]', 'dropout': 0.23037054610894656, 'batch_norm': True, 'lr': 3.8771924163199626e-05, 'weight_decay': 4.017124955193329e-07, 'epochs': 243, 'loss': 'mae', 'optimizer': 'adam', 'graph_mode': 'knn', 'source': 'grm', 'knn_k': 8, 'weighted_edges': True, 'symmetrize_mode': 'union', 'use_snp_selection': False}. Best is trial 32 with value: 0.15312810173820499.
[I 2025-11-03 13:17:36,232] Trial 105 finished with value: 0.1565977305588232 and parameters: {'model_type': 'gcn', 'hidden_dims': '[512, 128]', 'dropout': 0.25589770010215124, 'batch_norm': True, 'lr': 0.00047333307966624625, 'weight_decay': 2.9429154963924807e-07, 'epochs': 216, 'loss': 'mae', 'optimizer': 'adam', 'graph_mode': 'knn', 'source': 'grm', 'knn_k': 6, 'weighted_edges': False, 'symmetrize_mode': 'union', 'use_snp_selection': False}. Best is trial 105 with value: 0.1565977305588232.
[I 2025-11-03 13:17:40,493] Trial 106 finished with value: 0.06588189731848496 and parameters: {'model_type': 'gcn', 'hidden_dims': '[512, 128]', 'dropout': 0.2527663356318523, 'batch_norm': True, 'lr': 1.4501111425437144e-05, 'weight_decay': 3.177220209019444e-07, 'epochs': 234, 'loss': 'mae', 'optimizer': 'adam', 'graph_mode': 'knn', 'source': 'grm', 'knn_k': 6, 'weighted_edges': False, 'symmetrize_mode': 'union', 'use_snp_selection': False}. Best is trial 105 with value: 0.1565977305588232.
[I 2025-11-03 13:17:45,357] Trial 107 finished with value: 0.06396148505574559 and parameters: {'model_type': 'gcn', 'hidden_dims': '[512, 128]', 'dropout': 0.25720108504127265, 'batch_norm': False, 'lr': 0.0009715003927008788, 'weight_decay': 5.511179231867225e-07, 'epochs': 222, 'loss': 'mae', 'optimizer': 'adam', 'graph_mode': 'knn', 'source': 'grm', 'knn_k': 7, 'weighted_edges': False, 'symmetrize_mode': 'union', 'use_snp_selection': True, 'num_snps': 37397}. Best is trial 105 with value: 0.1565977305588232.
[I 2025-11-03 13:17:50,000] Trial 108 finished with value: 0.12612781857026312 and parameters: {'model_type': 'gcn', 'hidden_dims': '[512, 128]', 'dropout': 0.20566918761771183, 'batch_norm': True, 'lr': 0.000450615034164367, 'weight_decay': 2.2328758387002434e-07, 'epochs': 261, 'loss': 'mae', 'optimizer': 'adam', 'graph_mode': 'knn', 'source': 'grm', 'knn_k': 7, 'weighted_edges': False, 'symmetrize_mode': 'mutual', 'use_snp_selection': False}. Best is trial 105 with value: 0.1565977305588232.
[I 2025-11-03 13:17:54,034] Trial 109 finished with value: 0.14488960695511954 and parameters: {'model_type': 'gcn', 'hidden_dims': '[512, 128]', 'dropout': 0.24048303100756477, 'batch_norm': True, 'lr': 0.0005006198183377151, 'weight_decay': 1.626532632638844e-06, 'epochs': 217, 'loss': 'mae', 'optimizer': 'adam', 'graph_mode': 'knn', 'source': 'grm', 'knn_k': 6, 'weighted_edges': False, 'symmetrize_mode': 'union', 'use_snp_selection': False}. Best is trial 105 with value: 0.1565977305588232.
[I 2025-11-03 13:17:57,844] Trial 110 finished with value: 0.13161141785152197 and parameters: {'model_type': 'gcn', 'hidden_dims': '[512, 128]', 'dropout': 0.23954711753040892, 'batch_norm': True, 'lr': 0.0005849648314764053, 'weight_decay': 1.2500174028765702e-06, 'epochs': 198, 'loss': 'mae', 'optimizer': 'adam', 'graph_mode': 'knn', 'source': 'grm', 'knn_k': 6, 'weighted_edges': False, 'symmetrize_mode': 'union', 'use_snp_selection': False}. Best is trial 105 with value: 0.1565977305588232.
[I 2025-11-03 13:18:01,857] Trial 111 finished with value: 0.15667204282550012 and parameters: {'model_type': 'gcn', 'hidden_dims': '[512, 128]', 'dropout': 0.2730622377478768, 'batch_norm': True, 'lr': 0.00045445324884874213, 'weight_decay': 9.182477190140485e-07, 'epochs': 213, 'loss': 'mae', 'optimizer': 'adam', 'graph_mode': 'knn', 'source': 'grm', 'knn_k': 6, 'weighted_edges': False, 'symmetrize_mode': 'union', 'use_snp_selection': False}. Best is trial 111 with value: 0.15667204282550012.
[I 2025-11-03 13:18:05,557] Trial 112 finished with value: 0.143213391235662 and parameters: {'model_type': 'gcn', 'hidden_dims': '[512, 128]', 'dropout': 0.2742619711328432, 'batch_norm': True, 'lr': 0.0008076169282153865, 'weight_decay': 1.516995917615851e-06, 'epochs': 186, 'loss': 'mae', 'optimizer': 'adam', 'graph_mode': 'knn', 'source': 'grm', 'knn_k': 6, 'weighted_edges': False, 'symmetrize_mode': 'union', 'use_snp_selection': False}. Best is trial 111 with value: 0.15667204282550012.
[I 2025-11-03 13:18:09,607] Trial 113 finished with value: 0.14168974004502635 and parameters: {'model_type': 'gcn', 'hidden_dims': '[512, 128]', 'dropout': 0.22322032486219745, 'batch_norm': True, 'lr': 0.000498673610561306, 'weight_decay': 9.102917462898029e-07, 'epochs': 214, 'loss': 'mae', 'optimizer': 'adam', 'graph_mode': 'knn', 'source': 'grm', 'knn_k': 6, 'weighted_edges': False, 'symmetrize_mode': 'union', 'use_snp_selection': False}. Best is trial 111 with value: 0.15667204282550012.
