[I 2025-11-03 12:24:30,764] Trial 45 finished with value: 0.04775739711817492 and parameters: {'model_type': 'gcn', 'hidden_dims': '[512, 256]', 'dropout': 0.11349280334990786, 'batch_norm': True, 'lr': 0.00029467068392429184, 'weight_decay': 1.6973579850755465e-07, 'epochs': 225, 'loss': 'mse', 'optimizer': 'adam', 'graph_mode': 'off', 'use_snp_selection': True, 'num_snps': 34598}. Best is trial 16 with value: 0.08131540450815136.
[I 2025-11-03 12:24:32,931] Trial 46 finished with value: 0.060026710504583955 and parameters: {'model_type': 'gcn', 'hidden_dims': '[512, 128]', 'dropout': 0.5990363980517559, 'batch_norm': True, 'lr': 0.00026062823741086565, 'weight_decay': 9.92606364629176e-07, 'epochs': 289, 'loss': 'mse', 'optimizer': 'adam', 'graph_mode': 'off', 'use_snp_selection': False}. Best is trial 16 with value: 0.08131540450815136.
[I 2025-11-03 12:24:34,638] Trial 47 finished with value: 0.0009784567213330152 and parameters: {'model_type': 'gcn', 'hidden_dims': '[512, 128]', 'dropout': 0.5925128511872557, 'batch_norm': False, 'lr': 7.15063517293116e-05, 'weight_decay': 1.7650223847556747e-06, 'epochs': 196, 'loss': 'mse', 'optimizer': 'adam', 'graph_mode': 'off', 'use_snp_selection': False}. Best is trial 16 with value: 0.08131540450815136.
[I 2025-11-03 12:24:36,849] Trial 48 finished with value: 0.03539982575871214 and parameters: {'model_type': 'gcn', 'hidden_dims': '[512, 128]', 'dropout': 0.533803027673607, 'batch_norm': True, 'lr': 1.0622088740885973e-06, 'weight_decay': 3.3716105050234615e-06, 'epochs': 290, 'loss': 'mse', 'optimizer': 'adam', 'graph_mode': 'off', 'use_snp_selection': False}. Best is trial 16 with value: 0.08131540450815136.
[I 2025-11-03 12:24:39,269] Trial 49 finished with value: 0.07365407531013513 and parameters: {'model_type': 'gcn', 'hidden_dims': '[512, 128]', 'dropout': 0.594055459019239, 'batch_norm': True, 'lr': 0.00028523469421395855, 'weight_decay': 1.045985347262668e-06, 'epochs': 311, 'loss': 'mse', 'optimizer': 'adam', 'graph_mode': 'off', 'use_snp_selection': False}. Best is trial 16 with value: 0.08131540450815136.
[I 2025-11-03 12:24:41,783] Trial 50 finished with value: 0.003815328154325585 and parameters: {'model_type': 'gcn', 'hidden_dims': '[512, 128]', 'dropout': 0.5971029663830134, 'batch_norm': True, 'lr': 1.5216473350950011e-05, 'weight_decay': 1.0384537340980044e-06, 'epochs': 348, 'loss': 'mse', 'optimizer': 'adam', 'graph_mode': 'off', 'use_snp_selection': False}. Best is trial 16 with value: 0.08131540450815136.
[I 2025-11-03 12:24:44,143] Trial 51 finished with value: 0.04889310451152481 and parameters: {'model_type': 'gcn', 'hidden_dims': '[512, 128]', 'dropout': 0.561570764643825, 'batch_norm': True, 'lr': 0.0002528819615963246, 'weight_decay': 5.518916893738275e-07, 'epochs': 316, 'loss': 'mse', 'optimizer': 'adam', 'graph_mode': 'off', 'use_snp_selection': False}. Best is trial 16 with value: 0.08131540450815136.
[I 2025-11-03 12:24:46,439] Trial 52 finished with value: 0.047416147817973875 and parameters: {'model_type': 'gcn', 'hidden_dims': '[512, 128]', 'dropout': 0.578993344363732, 'batch_norm': True, 'lr': 0.00018198975267999865, 'weight_decay': 8.791611862696525e-07, 'epochs': 305, 'loss': 'mse', 'optimizer': 'adam', 'graph_mode': 'off', 'use_snp_selection': False}. Best is trial 16 with value: 0.08131540450815136.
[I 2025-11-03 12:24:48,387] Trial 53 finished with value: 0.04191001522086862 and parameters: {'model_type': 'gcn', 'hidden_dims': '[512, 128]', 'dropout': 0.5258281104706074, 'batch_norm': True, 'lr': 0.000409968751717051, 'weight_decay': 0.0007942516007097191, 'epochs': 241, 'loss': 'mse', 'optimizer': 'adam', 'graph_mode': 'off', 'use_snp_selection': False}. Best is trial 16 with value: 0.08131540450815136.
[I 2025-11-03 12:24:50,837] Trial 54 finished with value: 0.04249428276635573 and parameters: {'model_type': 'gcn', 'hidden_dims': '[512, 128]', 'dropout': 0.2638834557398995, 'batch_norm': True, 'lr': 0.0002652402929513148, 'weight_decay': 1.424914813878057e-06, 'epochs': 335, 'loss': 'mse', 'optimizer': 'adam', 'graph_mode': 'off', 'use_snp_selection': False}. Best is trial 16 with value: 0.08131540450815136.
[I 2025-11-03 12:24:52,850] Trial 55 finished with value: 0.03989556712680752 and parameters: {'model_type': 'gcn', 'hidden_dims': '[512, 128]', 'dropout': 0.5629017415147773, 'batch_norm': True, 'lr': 0.00015887557641386518, 'weight_decay': 3.341463967394428e-07, 'epochs': 259, 'loss': 'mse', 'optimizer': 'adam', 'graph_mode': 'off', 'use_snp_selection': False}. Best is trial 16 with value: 0.08131540450815136.
[I 2025-11-03 12:24:54,064] Trial 56 finished with value: 0.02759005954778571 and parameters: {'model_type': 'gcn', 'hidden_dims': '[128, 64]', 'dropout': 0.5804034262864257, 'batch_norm': True, 'lr': 0.0003842435260616957, 'weight_decay': 2.310676152847103e-06, 'epochs': 279, 'loss': 'mse', 'optimizer': 'adam', 'graph_mode': 'off', 'use_snp_selection': False}. Best is trial 16 with value: 0.08131540450815136.
[I 2025-11-03 12:24:55,488] Trial 57 finished with value: 0.010062659745996861 and parameters: {'model_type': 'gcn', 'hidden_dims': '[256, 128, 64]', 'dropout': 0.5139546486721797, 'batch_norm': False, 'lr': 8.722188061061909e-05, 'weight_decay': 6.69944260857596e-07, 'epochs': 207, 'loss': 'mse', 'optimizer': 'adam', 'graph_mode': 'off', 'use_snp_selection': False}. Best is trial 16 with value: 0.08131540450815136.
[I 2025-11-03 12:24:57,100] Trial 58 finished with value: 0.0469272508017302 and parameters: {'model_type': 'gcn', 'hidden_dims': '[512, 64]', 'dropout': 0.29240055709366825, 'batch_norm': True, 'lr': 0.00021341576575347715, 'weight_decay': 1.311574832589001e-07, 'epochs': 165, 'loss': 'mae', 'optimizer': 'adam', 'graph_mode': 'off', 'use_snp_selection': False}. Best is trial 16 with value: 0.08131540450815136.
[I 2025-11-03 12:24:58,331] Trial 59 finished with value: 0.023404075173972774 and parameters: {'model_type': 'gcn', 'hidden_dims': '[512, 256]', 'dropout': 0.5417742879461657, 'batch_norm': True, 'lr': 6.113972488550665e-06, 'weight_decay': 2.4487149914721128e-05, 'epochs': 228, 'loss': 'mse', 'optimizer': 'adam', 'graph_mode': 'off', 'use_snp_selection': True, 'num_snps': 13083}. Best is trial 16 with value: 0.08131540450815136.
[I 2025-11-03 12:25:01,401] Trial 60 finished with value: 0.05501759040835877 and parameters: {'model_type': 'gcn', 'hidden_dims': '[512, 256]', 'dropout': 0.3267059802383128, 'batch_norm': True, 'lr': 0.0006934018223170605, 'weight_decay': 8.6770030027293e-06, 'epochs': 298, 'loss': 'mse', 'optimizer': 'adam', 'graph_mode': 'off', 'use_snp_selection': True, 'num_snps': 59433}. Best is trial 16 with value: 0.08131540450815136.
[I 2025-11-03 12:25:03,311] Trial 61 finished with value: 0.0549699410641039 and parameters: {'model_type': 'gcn', 'hidden_dims': '[512, 256]', 'dropout': 0.40917714191741517, 'batch_norm': True, 'lr': 0.0009613571016018937, 'weight_decay': 2.478312051195417e-07, 'epochs': 284, 'loss': 'mse', 'optimizer': 'adam', 'graph_mode': 'off', 'use_snp_selection': True, 'num_snps': 28660}. Best is trial 16 with value: 0.08131540450815136.
[I 2025-11-03 12:25:06,281] Trial 62 finished with value: 0.06286438725931585 and parameters: {'model_type': 'gcn', 'hidden_dims': '[512, 256]', 'dropout': 0.49876935151829344, 'batch_norm': True, 'lr': 0.00029126978838800053, 'weight_decay': 1.4267617611182315e-07, 'epochs': 320, 'loss': 'mse', 'optimizer': 'adam', 'graph_mode': 'off', 'use_snp_selection': True, 'num_snps': 53149}. Best is trial 16 with value: 0.08131540450815136.
[I 2025-11-03 12:25:09,274] Trial 63 finished with value: 0.06079718891073257 and parameters: {'model_type': 'gcn', 'hidden_dims': '[512, 256]', 'dropout': 0.4895531092806802, 'batch_norm': True, 'lr': 0.00013269931142007577, 'weight_decay': 4.496787107268267e-07, 'epochs': 320, 'loss': 'mse', 'optimizer': 'adam', 'graph_mode': 'off', 'use_snp_selection': True, 'num_snps': 54629}. Best is trial 16 with value: 0.08131540450815136.
[I 2025-11-03 12:25:12,248] Trial 64 finished with value: 0.021296950021122665 and parameters: {'model_type': 'gcn', 'hidden_dims': '[512, 256]', 'dropout': 0.4848153272024346, 'batch_norm': True, 'lr': 4.785515601696674e-05, 'weight_decay': 1.3249843652490922e-07, 'epochs': 317, 'loss': 'mse', 'optimizer': 'adam', 'graph_mode': 'off', 'use_snp_selection': True, 'num_snps': 53916}. Best is trial 16 with value: 0.08131540450815136.
[I 2025-11-03 12:25:15,407] Trial 65 finished with value: 0.005876809346381692 and parameters: {'model_type': 'gcn', 'hidden_dims': '[512, 256]', 'dropout': 0.5020507666837054, 'batch_norm': True, 'lr': 0.00013969753174387526, 'weight_decay': 5.727877730430348e-07, 'epochs': 341, 'loss': 'mse', 'optimizer': 'adam', 'graph_mode': 'off', 'use_snp_selection': True, 'num_snps': 55968}. Best is trial 16 with value: 0.08131540450815136.
[I 2025-11-03 12:25:17,704] Trial 66 finished with value: 0.04804374503290067 and parameters: {'model_type': 'gcn', 'hidden_dims': '[256, 128]', 'dropout': 0.46177399037731304, 'batch_norm': True, 'lr': 8.233120116702787e-06, 'weight_decay': 4.604380532790516e-07, 'epochs': 306, 'loss': 'mse', 'optimizer': 'adam', 'graph_mode': 'off', 'use_snp_selection': True, 'num_snps': 51312}. Best is trial 16 with value: 0.08131540450815136.
[I 2025-11-03 12:25:19,072] Trial 67 finished with value: 0.04331774042440756 and parameters: {'model_type': 'gcn', 'hidden_dims': '[512, 256]', 'dropout': 0.5185228113199766, 'batch_norm': True, 'lr': 8.730680698318371e-05, 'weight_decay': 2.923345081777072e-07, 'epochs': 326, 'loss': 'mse', 'optimizer': 'adam', 'graph_mode': 'off', 'use_snp_selection': True, 'num_snps': 9151}. Best is trial 16 with value: 0.08131540450815136.
[I 2025-11-03 12:25:20,548] Trial 68 finished with value: 0.030359578084654067 and parameters: {'model_type': 'gcn', 'hidden_dims': '[128, 64]', 'dropout': 0.5807407420895997, 'batch_norm': True, 'lr': 2.6814277070615383e-06, 'weight_decay': 1.0260209397914067e-07, 'epochs': 266, 'loss': 'mse', 'optimizer': 'adam', 'graph_mode': 'off', 'use_snp_selection': True, 'num_snps': 24973}. Best is trial 16 with value: 0.08131540450815136.
[I 2025-11-03 12:25:22,547] Trial 69 finished with value: 0.016173634624584543 and parameters: {'model_type': 'gcn', 'hidden_dims': '[512, 128]', 'dropout': 0.5009794891433229, 'batch_norm': False, 'lr': 2.5412980330310863e-05, 'weight_decay': 1.332695555343455e-06, 'epochs': 248, 'loss': 'mse', 'optimizer': 'adam', 'graph_mode': 'off', 'use_snp_selection': False}. Best is trial 16 with value: 0.08131540450815136.
[I 2025-11-03 12:25:24,340] Trial 70 finished with value: 0.04318933021709304 and parameters: {'model_type': 'gcn', 'hidden_dims': '[512, 256]', 'dropout': 0.43156149819234185, 'batch_norm': True, 'lr': 0.0003253404331875815, 'weight_decay': 9.327759214507221e-05, 'epochs': 323, 'loss': 'mae', 'optimizer': 'adam', 'graph_mode': 'off', 'use_snp_selection': True, 'num_snps': 20914}. Best is trial 16 with value: 0.08131540450815136.
[I 2025-11-03 12:25:27,008] Trial 71 finished with value: 0.04740586375219824 and parameters: {'model_type': 'gcn', 'hidden_dims': '[512, 256]', 'dropout': 0.47578452537169413, 'batch_norm': True, 'lr': 0.00022185644494475008, 'weight_decay': 2.0170120836430482e-07, 'epochs': 289, 'loss': 'mse', 'optimizer': 'adam', 'graph_mode': 'off', 'use_snp_selection': True, 'num_snps': 47398}. Best is trial 16 with value: 0.08131540450815136.
[I 2025-11-03 12:25:30,246] Trial 72 finished with value: 0.04097961141823249 and parameters: {'model_type': 'gcn', 'hidden_dims': '[512, 256]', 'dropout': 0.5542294453695615, 'batch_norm': True, 'lr': 0.0003265684339099513, 'weight_decay': 8.120403300913972e-07, 'epochs': 335, 'loss': 'mse', 'optimizer': 'adam', 'graph_mode': 'off', 'use_snp_selection': True, 'num_snps': 56777}. Best is trial 16 with value: 0.08131540450815136.
[I 2025-11-03 12:25:33,024] Trial 73 finished with value: 0.016057811410568223 and parameters: {'model_type': 'gcn', 'hidden_dims': '[512, 256]', 'dropout': 0.29888769495751305, 'batch_norm': True, 'lr': 0.00012357360533918677, 'weight_decay': 2.3919592388199487e-07, 'epochs': 295, 'loss': 'mse', 'optimizer': 'adam', 'graph_mode': 'off', 'use_snp_selection': True, 'num_snps': 51960}. Best is trial 16 with value: 0.08131540450815136.
[I 2025-11-03 12:25:34,173] Trial 74 finished with value: 0.03926874955329471 and parameters: {'model_type': 'gcn', 'hidden_dims': '[512, 256]', 'dropout': 0.3385447525996504, 'batch_norm': True, 'lr': 0.00019536381104710534, 'weight_decay': 4.279358366486176e-07, 'epochs': 279, 'loss': 'mse', 'optimizer': 'adam', 'graph_mode': 'off', 'use_snp_selection': True, 'num_snps': 3769}. Best is trial 16 with value: 0.08131540450815136.
[I 2025-11-03 12:25:37,363] Trial 75 finished with value: 0.052747440069655656 and parameters: {'model_type': 'gcn', 'hidden_dims': '[512, 256]', 'dropout': 0.5740590947332926, 'batch_norm': True, 'lr': 0.00025316625448300605, 'weight_decay': 1.4789351108394847e-07, 'epochs': 310, 'loss': 'mse', 'optimizer': 'adam', 'graph_mode': 'off', 'use_snp_selection': True, 'num_snps': 59412}. Best is trial 16 with value: 0.08131540450815136.
[I 2025-11-03 12:25:39,597] Trial 76 finished with value: 0.05964650846218617 and parameters: {'model_type': 'gcn', 'hidden_dims': '[256, 128, 64]', 'dropout': 0.3677123160424628, 'batch_norm': True, 'lr': 0.00045459425601462097, 'weight_decay': 3.386941970550682e-07, 'epochs': 235, 'loss': 'mse', 'optimizer': 'adam', 'graph_mode': 'off', 'use_snp_selection': True, 'num_snps': 48886}. Best is trial 16 with value: 0.08131540450815136.
[I 2025-11-03 12:25:42,126] Trial 77 finished with value: 0.03064590775676559 and parameters: {'model_type': 'gcn', 'hidden_dims': '[512, 256]', 'dropout': 0.26672252472443037, 'batch_norm': True, 'lr': 0.0001780409098716683, 'weight_decay': 1.967829556434551e-07, 'epochs': 220, 'loss': 'mse', 'optimizer': 'adam', 'graph_mode': 'off', 'use_snp_selection': True, 'num_snps': 54734}. Best is trial 16 with value: 0.08131540450815136.
[I 2025-11-03 12:25:44,435] Trial 78 finished with value: 0.04251018399418705 and parameters: {'model_type': 'gcn', 'hidden_dims': '[512, 64]', 'dropout': 0.39571736388723877, 'batch_norm': True, 'lr': 0.0005649135794703321, 'weight_decay': 4.78272001822658e-07, 'epochs': 254, 'loss': 'mse', 'optimizer': 'adam', 'graph_mode': 'off', 'use_snp_selection': True, 'num_snps': 42279}. Best is trial 16 with value: 0.08131540450815136.
[I 2025-11-03 12:25:46,530] Trial 79 finished with value: 0.02322765520062996 and parameters: {'model_type': 'gcn', 'hidden_dims': '[512, 256]', 'dropout': 0.3254805856005844, 'batch_norm': True, 'lr': 1.5435929406221672e-05, 'weight_decay': 7.127017483081997e-07, 'epochs': 272, 'loss': 'mse', 'optimizer': 'adam', 'graph_mode': 'off', 'use_snp_selection': False}. Best is trial 16 with value: 0.08131540450815136.
[I 2025-11-03 12:25:48,379] Trial 80 finished with value: -0.031169886802287234 and parameters: {'model_type': 'gcn', 'hidden_dims': '[256, 128]', 'dropout': 0.5333650174753872, 'batch_norm': False, 'lr': 0.00015042894096230658, 'weight_decay': 3.0110473794035305e-07, 'epochs': 185, 'loss': 'mae', 'optimizer': 'adam', 'graph_mode': 'off', 'use_snp_selection': True, 'num_snps': 44386}. Best is trial 16 with value: 0.08131540450815136.
[I 2025-11-03 12:25:50,626] Trial 81 finished with value: 0.051432035327691195 and parameters: {'model_type': 'gcn', 'hidden_dims': '[256, 128, 64]', 'dropout': 0.36335522796404046, 'batch_norm': True, 'lr': 0.00044369554489613204, 'weight_decay': 3.459032619819673e-07, 'epochs': 235, 'loss': 'mse', 'optimizer': 'adam', 'graph_mode': 'off', 'use_snp_selection': True, 'num_snps': 48821}. Best is trial 16 with value: 0.08131540450815136.
[I 2025-11-03 12:25:52,712] Trial 82 finished with value: 0.023773106091622406 and parameters: {'model_type': 'gcn', 'hidden_dims': '[256, 128, 64]', 'dropout': 0.44057422579233124, 'batch_norm': True, 'lr': 0.0003430661382041062, 'weight_decay': 1.2948681036978224e-07, 'epochs': 206, 'loss': 'mse', 'optimizer': 'adam', 'graph_mode': 'off', 'use_snp_selection': True, 'num_snps': 46626}. Best is trial 16 with value: 0.08131540450815136.
[I 2025-11-03 12:25:55,131] Trial 83 finished with value: 0.0379950914391981 and parameters: {'model_type': 'gcn', 'hidden_dims': '[256, 128, 64]', 'dropout': 0.34043151731977617, 'batch_norm': True, 'lr': 0.00028692629910788224, 'weight_decay': 2.2092049072695684e-07, 'epochs': 240, 'loss': 'mse', 'optimizer': 'adam', 'graph_mode': 'off', 'use_snp_selection': True, 'num_snps': 52343}. Best is trial 16 with value: 0.08131540450815136.
[I 2025-11-03 12:25:56,764] Trial 84 finished with value: 0.003755169900104466 and parameters: {'model_type': 'gcn', 'hidden_dims': '[256, 128, 64]', 'dropout': 0.5951457990351586, 'batch_norm': True, 'lr': 0.00022596915427608612, 'weight_decay': 1.6160929405315985e-07, 'epochs': 67, 'loss': 'mse', 'optimizer': 'adam', 'graph_mode': 'off', 'use_snp_selection': True, 'num_snps': 49900}. Best is trial 16 with value: 0.08131540450815136.
[I 2025-11-03 12:25:59,387] Trial 85 finished with value: 0.05232541220020305 and parameters: {'model_type': 'gcn', 'hidden_dims': '[512, 128]', 'dropout': 0.37316419744600743, 'batch_norm': True, 'lr': 0.0004649376003116161, 'weight_decay': 1.183133324644416e-06, 'epochs': 300, 'loss': 'mse', 'optimizer': 'adam', 'graph_mode': 'off', 'use_snp_selection': True, 'num_snps': 45660}. Best is trial 16 with value: 0.08131540450815136.
[I 2025-11-03 12:26:01,213] Trial 86 finished with value: 0.03313767057837133 and parameters: {'model_type': 'gcn', 'hidden_dims': '[256, 128, 64]', 'dropout': 0.392409169054686, 'batch_norm': True, 'lr': 0.0001032625630113335, 'weight_decay': 3.011776713635728e-07, 'epochs': 319, 'loss': 'mse', 'optimizer': 'adam', 'graph_mode': 'off', 'use_snp_selection': True, 'num_snps': 19142}. Best is trial 16 with value: 0.08131540450815136.
[I 2025-11-03 12:26:03,296] Trial 87 finished with value: 0.05862165866339671 and parameters: {'model_type': 'gcn', 'hidden_dims': '[512, 256]', 'dropout': 0.3160530102726691, 'batch_norm': True, 'lr': 0.0008458065979503531, 'weight_decay': 2.0309194298078098e-06, 'epochs': 263, 'loss': 'mse', 'optimizer': 'adam', 'graph_mode': 'off', 'use_snp_selection': False}. Best is trial 16 with value: 0.08131540450815136.
[I 2025-11-03 12:26:05,932] Trial 88 finished with value: 0.04324452609954699 and parameters: {'model_type': 'gcn', 'hidden_dims': '[512, 128]', 'dropout': 0.2752807937694661, 'batch_norm': True, 'lr': 0.0006713490438338417, 'weight_decay': 3.3118161512232195e-06, 'epochs': 252, 'loss': 'mse', 'optimizer': 'adam', 'graph_mode': 'off', 'use_snp_selection': True, 'num_snps': 53475}. Best is trial 16 with value: 0.08131540450815136.
[I 2025-11-03 12:26:07,773] Trial 89 finished with value: 0.03847900673226977 and parameters: {'model_type': 'gcn', 'hidden_dims': '[128, 64]', 'dropout': 0.5665853273023884, 'batch_norm': True, 'lr': 0.00012437216629391522, 'weight_decay': 5.036136114904409e-07, 'epochs': 220, 'loss': 'mse', 'optimizer': 'adam', 'graph_mode': 'off', 'use_snp_selection': True, 'num_snps': 49602}. Best is trial 16 with value: 0.08131540450815136.
[I 2025-11-03 12:26:10,048] Trial 90 finished with value: 0.04816943527829417 and parameters: {'model_type': 'gcn', 'hidden_dims': '[512, 256]', 'dropout': 0.24371217429623385, 'batch_norm': True, 'lr': 0.00036862547872090827, 'weight_decay': 1.1857891779134538e-07, 'epochs': 310, 'loss': 'mse', 'optimizer': 'adam', 'graph_mode': 'off', 'use_snp_selection': False}. Best is trial 16 with value: 0.08131540450815136.
[I 2025-11-03 12:26:12,110] Trial 91 finished with value: 0.04868530464093825 and parameters: {'model_type': 'gcn', 'hidden_dims': '[512, 256]', 'dropout': 0.3175481218552161, 'batch_norm': True, 'lr': 0.0002704119825683513, 'weight_decay': 9.042866432544884e-07, 'epochs': 263, 'loss': 'mse', 'optimizer': 'adam', 'graph_mode': 'off', 'use_snp_selection': False}. Best is trial 16 with value: 0.08131540450815136.
[I 2025-11-03 12:26:14,045] Trial 92 finished with value: 0.06754006695180298 and parameters: {'model_type': 'gcn', 'hidden_dims': '[512, 256]', 'dropout': 0.3026668054537532, 'batch_norm': True, 'lr': 0.0006017220128476541, 'weight_decay': 2.202586563876957e-06, 'epochs': 232, 'loss': 'mse', 'optimizer': 'adam', 'graph_mode': 'off', 'use_snp_selection': False}. Best is trial 16 with value: 0.08131540450815136.
[I 2025-11-03 12:26:15,940] Trial 93 finished with value: 0.05059609263460579 and parameters: {'model_type': 'gcn', 'hidden_dims': '[512, 256]', 'dropout': 0.30005631963752305, 'batch_norm': True, 'lr': 0.0005538396542747076, 'weight_decay': 5.755055123855351e-06, 'epochs': 231, 'loss': 'mse', 'optimizer': 'adam', 'graph_mode': 'off', 'use_snp_selection': False}. Best is trial 16 with value: 0.08131540450815136.
[I 2025-11-03 12:26:17,684] Trial 94 finished with value: 0.07224852542760728 and parameters: {'model_type': 'gcn', 'hidden_dims': '[512, 256]', 'dropout': 0.47305276141291774, 'batch_norm': True, 'lr': 0.000777605406506103, 'weight_decay': 3.407166390315772e-07, 'epochs': 202, 'loss': 'mse', 'optimizer': 'adam', 'graph_mode': 'off', 'use_snp_selection': False}. Best is trial 16 with value: 0.08131540450815136.
[I 2025-11-03 12:26:19,384] Trial 95 finished with value: 0.04849859740624834 and parameters: {'model_type': 'gcn', 'hidden_dims': '[512, 256]', 'dropout': 0.476733245494347, 'batch_norm': True, 'lr': 0.0008722687577602906, 'weight_decay': 7.138995518545502e-07, 'epochs': 189, 'loss': 'mse', 'optimizer': 'adam', 'graph_mode': 'off', 'use_snp_selection': False}. Best is trial 16 with value: 0.08131540450815136.
