[I 2025-11-03 11:44:50,951] Trial 130 finished with value: 0.06633959149544638 and parameters: {'model_type': 'gcn', 'hidden_dims': '[128, 64]', 'dropout': 0.20419958384333015, 'batch_norm': False, 'lr': 0.0004510118258615125, 'weight_decay': 0.00038651314637401155, 'epochs': 212, 'loss': 'mse', 'optimizer': 'adam', 'graph_mode': 'cutoff', 'cutoff': 0.8292186976560171, 'grm_norm': 'cosine_then_gcn', 'self_loops': False, 'use_snp_selection': True, 'num_snps': 23556}. Best is trial 61 with value: 0.1359435621151581.
[I 2025-11-03 11:44:52,668] Trial 131 finished with value: 0.11284029738086193 and parameters: {'model_type': 'gcn', 'hidden_dims': '[128, 64]', 'dropout': 0.5330487791729364, 'batch_norm': True, 'lr': 0.0007031391895884923, 'weight_decay': 0.00011193270143189993, 'epochs': 254, 'loss': 'mse', 'optimizer': 'adam', 'graph_mode': 'cutoff', 'cutoff': 0.7888329057686383, 'grm_norm': 'cosine_then_gcn', 'self_loops': False, 'use_snp_selection': False}. Best is trial 61 with value: 0.1359435621151581.
[I 2025-11-03 11:44:54,231] Trial 132 finished with value: 0.121771509915663 and parameters: {'model_type': 'gcn', 'hidden_dims': '[128, 64]', 'dropout': 0.21653213728893475, 'batch_norm': True, 'lr': 0.0003638676417875729, 'weight_decay': 0.00014319034224128053, 'epochs': 205, 'loss': 'mse', 'optimizer': 'adam', 'graph_mode': 'cutoff', 'cutoff': 0.8438894999618638, 'grm_norm': 'cosine_then_gcn', 'self_loops': False, 'use_snp_selection': False}. Best is trial 61 with value: 0.1359435621151581.
[I 2025-11-03 11:44:55,800] Trial 133 finished with value: 0.10339356762940391 and parameters: {'model_type': 'gcn', 'hidden_dims': '[128, 64]', 'dropout': 0.21392665962175228, 'batch_norm': True, 'lr': 0.00035650074657547315, 'weight_decay': 0.00029322997297103284, 'epochs': 207, 'loss': 'mse', 'optimizer': 'adam', 'graph_mode': 'cutoff', 'cutoff': 0.837296719007986, 'grm_norm': 'cosine_then_gcn', 'self_loops': False, 'use_snp_selection': False}. Best is trial 61 with value: 0.1359435621151581.
[I 2025-11-03 11:44:57,339] Trial 134 finished with value: 0.09837566061005858 and parameters: {'model_type': 'gcn', 'hidden_dims': '[128, 64]', 'dropout': 0.20144255504351652, 'batch_norm': True, 'lr': 0.00028063250981482675, 'weight_decay': 0.00013416928459381334, 'epochs': 197, 'loss': 'mse', 'optimizer': 'adam', 'graph_mode': 'cutoff', 'cutoff': 0.8995249902167354, 'grm_norm': 'cosine_then_gcn', 'self_loops': False, 'use_snp_selection': False}. Best is trial 61 with value: 0.1359435621151581.
[I 2025-11-03 11:44:59,018] Trial 135 finished with value: 0.11156111275506479 and parameters: {'model_type': 'gcn', 'hidden_dims': '[128, 64]', 'dropout': 0.2329890553174355, 'batch_norm': True, 'lr': 0.0005542324876525037, 'weight_decay': 0.000532869525227494, 'epochs': 244, 'loss': 'mse', 'optimizer': 'adam', 'graph_mode': 'cutoff', 'cutoff': 0.854138296085296, 'grm_norm': 'cosine_then_gcn', 'self_loops': False, 'use_snp_selection': False}. Best is trial 61 with value: 0.1359435621151581.
[I 2025-11-03 11:45:00,519] Trial 136 finished with value: 0.11232501539955783 and parameters: {'model_type': 'gcn', 'hidden_dims': '[128, 64]', 'dropout': 0.42928866876463406, 'batch_norm': True, 'lr': 0.00041111925237677144, 'weight_decay': 0.0009872966909101188, 'epochs': 184, 'loss': 'mse', 'optimizer': 'adam', 'graph_mode': 'cutoff', 'cutoff': 0.8852750005302351, 'grm_norm': 'cosine_then_gcn', 'self_loops': False, 'use_snp_selection': False}. Best is trial 61 with value: 0.1359435621151581.
[I 2025-11-03 11:45:02,147] Trial 137 finished with value: 0.11492023581330625 and parameters: {'model_type': 'gcn', 'hidden_dims': '[128, 64]', 'dropout': 0.18319295612989028, 'batch_norm': True, 'lr': 0.00033213297656880587, 'weight_decay': 0.000226265731674239, 'epochs': 227, 'loss': 'mse', 'optimizer': 'adam', 'graph_mode': 'cutoff', 'cutoff': 0.8158112194609091, 'grm_norm': 'cosine_then_gcn', 'self_loops': False, 'use_snp_selection': False}. Best is trial 61 with value: 0.1359435621151581.
[I 2025-11-03 11:45:03,621] Trial 138 finished with value: 0.11609253637386457 and parameters: {'model_type': 'gcn', 'hidden_dims': '[128, 64]', 'dropout': 0.19233862218649203, 'batch_norm': True, 'lr': 0.0006400816330603867, 'weight_decay': 0.0001649504176896766, 'epochs': 175, 'loss': 'mse', 'optimizer': 'adam', 'graph_mode': 'cutoff', 'cutoff': 0.7600693250947879, 'grm_norm': 'cosine_then_gcn', 'self_loops': False, 'use_snp_selection': False}. Best is trial 61 with value: 0.1359435621151581.
[I 2025-11-03 11:45:05,643] Trial 139 finished with value: 0.10900452264082822 and parameters: {'model_type': 'gcn', 'hidden_dims': '[512, 256]', 'dropout': 0.2196202991707719, 'batch_norm': True, 'lr': 0.0008437720414458174, 'weight_decay': 0.0004246267608742633, 'epochs': 161, 'loss': 'mae', 'optimizer': 'adam', 'graph_mode': 'cutoff', 'cutoff': 0.728107913159724, 'grm_norm': 'gcn', 'self_loops': False, 'use_snp_selection': False}. Best is trial 61 with value: 0.1359435621151581.
[I 2025-11-03 11:45:07,240] Trial 140 finished with value: 0.11244052226935669 and parameters: {'model_type': 'gcn', 'hidden_dims': '[128, 64]', 'dropout': 0.15065870034975065, 'batch_norm': True, 'lr': 0.0004842881329733862, 'weight_decay': 0.000313348736551202, 'epochs': 215, 'loss': 'mse', 'optimizer': 'adam', 'graph_mode': 'cutoff', 'cutoff': 0.8452472225122409, 'grm_norm': 'cosine_then_gcn', 'self_loops': False, 'use_snp_selection': False}. Best is trial 61 with value: 0.1359435621151581.
[I 2025-11-03 11:45:08,803] Trial 141 finished with value: 0.11904838672996533 and parameters: {'model_type': 'gcn', 'hidden_dims': '[128, 64]', 'dropout': 0.24667380230187466, 'batch_norm': True, 'lr': 0.0007143054332323498, 'weight_decay': 0.00010029432984683226, 'epochs': 205, 'loss': 'mse', 'optimizer': 'adam', 'graph_mode': 'cutoff', 'cutoff': 0.8695882886723023, 'grm_norm': 'cosine_then_gcn', 'self_loops': False, 'use_snp_selection': False}. Best is trial 61 with value: 0.1359435621151581.
[I 2025-11-03 11:45:10,559] Trial 142 finished with value: 0.07594205674738407 and parameters: {'model_type': 'gcn', 'hidden_dims': '[128, 64]', 'dropout': 0.2657980087904777, 'batch_norm': True, 'lr': 0.0006180306880612073, 'weight_decay': 0.00015102646391564232, 'epochs': 267, 'loss': 'mse', 'optimizer': 'adam', 'graph_mode': 'cutoff', 'cutoff': 0.4928054435700637, 'grm_norm': 'cosine_then_gcn', 'self_loops': False, 'use_snp_selection': False}. Best is trial 61 with value: 0.1359435621151581.
[I 2025-11-03 11:45:12,719] Trial 143 finished with value: 0.10515477756367542 and parameters: {'model_type': 'gcn', 'hidden_dims': '[512, 64]', 'dropout': 0.2522886397467133, 'batch_norm': True, 'lr': 0.0007765389803305178, 'weight_decay': 0.00018240794205617075, 'epochs': 190, 'loss': 'mse', 'optimizer': 'adam', 'graph_mode': 'cutoff', 'cutoff': 0.7970400147209085, 'grm_norm': 'cosine_then_gcn', 'self_loops': False, 'use_snp_selection': False}. Best is trial 61 with value: 0.1359435621151581.
[I 2025-11-03 11:45:14,265] Trial 144 finished with value: 0.07082554195798091 and parameters: {'model_type': 'gcn', 'hidden_dims': '[128, 64]', 'dropout': 0.22791757390177347, 'batch_norm': True, 'lr': 0.0005390992019174697, 'weight_decay': 0.00022457402593250225, 'epochs': 197, 'loss': 'mse', 'optimizer': 'adam', 'graph_mode': 'cutoff', 'cutoff': 0.5339543185545438, 'grm_norm': 'cosine_then_gcn', 'self_loops': False, 'use_snp_selection': False}. Best is trial 61 with value: 0.1359435621151581.
[I 2025-11-03 11:45:16,208] Trial 145 finished with value: 0.10241046036085506 and parameters: {'model_type': 'gcn', 'hidden_dims': '[512, 128]', 'dropout': 0.21327690911006209, 'batch_norm': True, 'lr': 0.0008673915439308465, 'weight_decay': 0.0002631917649261404, 'epochs': 143, 'loss': 'mse', 'optimizer': 'adam', 'graph_mode': 'cutoff', 'cutoff': 0.43822489066143816, 'grm_norm': 'cosine_then_gcn', 'self_loops': False, 'use_snp_selection': False}. Best is trial 61 with value: 0.1359435621151581.
[I 2025-11-03 11:45:17,704] Trial 146 finished with value: 0.09876846418561772 and parameters: {'model_type': 'gcn', 'hidden_dims': '[128, 64]', 'dropout': 0.2381747338127086, 'batch_norm': True, 'lr': 0.00043411839179881604, 'weight_decay': 0.00011989288594340804, 'epochs': 182, 'loss': 'mse', 'optimizer': 'adam', 'graph_mode': 'cutoff', 'cutoff': 0.8256833640493145, 'grm_norm': 'cosine_then_gcn', 'self_loops': False, 'use_snp_selection': False}. Best is trial 61 with value: 0.1359435621151581.
[I 2025-11-03 11:45:18,750] Trial 147 finished with value: 0.10377453242410734 and parameters: {'model_type': 'gcn', 'hidden_dims': '[128, 64]', 'dropout': 0.20327382216230025, 'batch_norm': True, 'lr': 0.00037746955492145814, 'weight_decay': 0.0005909451981434792, 'epochs': 30, 'loss': 'mse', 'optimizer': 'adam', 'graph_mode': 'cutoff', 'cutoff': 0.776477399468774, 'grm_norm': 'cosine_then_gcn', 'self_loops': False, 'use_snp_selection': False}. Best is trial 61 with value: 0.1359435621151581.
[I 2025-11-03 11:45:20,405] Trial 148 finished with value: 0.11218394704719953 and parameters: {'model_type': 'gcn', 'hidden_dims': '[128, 64]', 'dropout': 0.2250064671708463, 'batch_norm': True, 'lr': 0.0007052354109839388, 'weight_decay': 0.000797494676254031, 'epochs': 233, 'loss': 'mse', 'optimizer': 'adam', 'graph_mode': 'cutoff', 'cutoff': 0.8574479687848756, 'grm_norm': 'cosine_then_gcn', 'self_loops': False, 'use_snp_selection': False}. Best is trial 61 with value: 0.1359435621151581.
[I 2025-11-03 11:45:22,165] Trial 149 finished with value: 0.008143229121130309 and parameters: {'model_type': 'gcn', 'hidden_dims': '[128, 64]', 'dropout': 0.2733713132550259, 'batch_norm': True, 'lr': 2.5104064763244103e-05, 'weight_decay': 0.00036799457449768875, 'epochs': 274, 'loss': 'mse', 'optimizer': 'adam', 'graph_mode': 'cutoff', 'cutoff': 0.8348540339081897, 'grm_norm': 'cosine', 'self_loops': False, 'use_snp_selection': False}. Best is trial 61 with value: 0.1359435621151581.
[I 2025-11-03 11:45:24,236] Trial 0 finished with value: -0.02826062614565285 and parameters: {'model_type': 'gcn', 'hidden_dims': '[128, 64]', 'dropout': 0.199031432379812, 'batch_norm': True, 'lr': 1.8408544111075837e-06, 'weight_decay': 5.5136510071208614e-05, 'epochs': 334, 'loss': 'mae', 'optimizer': 'adam', 'graph_mode': 'knn', 'source': 'grm', 'knn_k': 8, 'weighted_edges': True, 'symmetrize_mode': 'mutual', 'use_snp_selection': False}. Best is trial 0 with value: -0.02826062614565285.
[I 2025-11-03 11:45:25,314] Trial 1 finished with value: 0.05004695669868638 and parameters: {'model_type': 'gcn', 'hidden_dims': '[128, 64]', 'dropout': 0.40051947670227217, 'batch_norm': True, 'lr': 0.0005320428882732732, 'weight_decay': 1.89210117736594e-06, 'epochs': 32, 'loss': 'mse', 'optimizer': 'adam', 'graph_mode': 'knn', 'source': 'grm', 'knn_k': 7, 'weighted_edges': True, 'symmetrize_mode': 'union', 'use_snp_selection': False}. Best is trial 1 with value: 0.05004695669868638.
[I 2025-11-03 11:45:27,498] Trial 2 finished with value: 0.06660239705815157 and parameters: {'model_type': 'gcn', 'hidden_dims': '[256, 128]', 'dropout': 0.5105528289184642, 'batch_norm': False, 'lr': 0.0006804279372404962, 'weight_decay': 0.0008922815224257085, 'epochs': 160, 'loss': 'mse', 'optimizer': 'adam', 'graph_mode': 'cutoff', 'cutoff': 0.5741905641612706, 'grm_norm': 'gcn', 'self_loops': False, 'use_snp_selection': True, 'num_snps': 26910}. Best is trial 2 with value: 0.06660239705815157.
[I 2025-11-03 11:45:29,781] Trial 3 finished with value: 0.06044749302988628 and parameters: {'model_type': 'gcn', 'hidden_dims': '[256, 128, 64]', 'dropout': 0.5390483213624292, 'batch_norm': False, 'lr': 3.4705625989073525e-05, 'weight_decay': 2.4623319020131338e-05, 'epochs': 92, 'loss': 'mse', 'optimizer': 'adam', 'graph_mode': 'knn', 'source': 'grm', 'knn_k': 6, 'weighted_edges': False, 'symmetrize_mode': 'mutual', 'use_snp_selection': True, 'num_snps': 30713}. Best is trial 2 with value: 0.06660239705815157.
[I 2025-11-03 11:45:32,075] Trial 4 finished with value: 0.030845066615447354 and parameters: {'model_type': 'gcn', 'hidden_dims': '[128, 64]', 'dropout': 0.13404863676897502, 'batch_norm': False, 'lr': 0.0001431556295367288, 'weight_decay': 2.2084517750726675e-05, 'epochs': 13, 'loss': 'mae', 'optimizer': 'adam', 'graph_mode': 'cutoff', 'cutoff': 0.6714268476993044, 'grm_norm': 'none', 'self_loops': False, 'use_snp_selection': True, 'num_snps': 45645}. Best is trial 2 with value: 0.06660239705815157.
[I 2025-11-03 11:45:34,857] Trial 5 finished with value: 0.027968483418493655 and parameters: {'model_type': 'gcn', 'hidden_dims': '[256, 128]', 'dropout': 0.42253606323412096, 'batch_norm': False, 'lr': 4.238630400638805e-05, 'weight_decay': 8.074086040046576e-07, 'epochs': 134, 'loss': 'mae', 'optimizer': 'adam', 'graph_mode': 'knn', 'source': 'grm', 'knn_k': 1, 'weighted_edges': False, 'symmetrize_mode': 'mutual', 'use_snp_selection': True, 'num_snps': 43113}. Best is trial 2 with value: 0.06660239705815157.
[I 2025-11-03 11:45:37,527] Trial 6 finished with value: 0.04494049647991003 and parameters: {'model_type': 'gcn', 'hidden_dims': '[512, 256]', 'dropout': 0.3534893146320237, 'batch_norm': True, 'lr': 0.000251307964226932, 'weight_decay': 1.821819791794022e-05, 'epochs': 207, 'loss': 'mae', 'optimizer': 'adam', 'graph_mode': 'knn', 'source': 'grm', 'knn_k': 1, 'weighted_edges': True, 'symmetrize_mode': 'mutual', 'use_snp_selection': False}. Best is trial 2 with value: 0.06660239705815157.
[I 2025-11-03 11:45:39,857] Trial 7 finished with value: 0.053713299634499646 and parameters: {'model_type': 'gcn', 'hidden_dims': '[512, 256]', 'dropout': 0.1105825955860775, 'batch_norm': True, 'lr': 2.374338412754043e-05, 'weight_decay': 1.1284721123340274e-05, 'epochs': 170, 'loss': 'mse', 'optimizer': 'adam', 'graph_mode': 'cutoff', 'cutoff': 0.719872204109604, 'grm_norm': 'gcn', 'self_loops': False, 'use_snp_selection': False}. Best is trial 2 with value: 0.06660239705815157.
[I 2025-11-03 11:45:41,674] Trial 8 finished with value: 0.02632897227169585 and parameters: {'model_type': 'gcn', 'hidden_dims': '[512, 128]', 'dropout': 0.5066580418354021, 'batch_norm': True, 'lr': 0.00039213678276659976, 'weight_decay': 3.43655320802934e-06, 'epochs': 91, 'loss': 'mse', 'optimizer': 'adam', 'graph_mode': 'cutoff', 'cutoff': 0.34923059576505366, 'grm_norm': 'cosine', 'self_loops': True, 'use_snp_selection': False}. Best is trial 2 with value: 0.06660239705815157.
[I 2025-11-03 11:45:43,346] Trial 9 finished with value: 0.015264963185839111 and parameters: {'model_type': 'gcn', 'hidden_dims': '[512, 256]', 'dropout': 0.301734920240333, 'batch_norm': False, 'lr': 6.650961854953448e-06, 'weight_decay': 6.861575656590315e-05, 'epochs': 125, 'loss': 'mae', 'optimizer': 'adam', 'graph_mode': 'cutoff', 'cutoff': 0.2857569870061939, 'grm_norm': 'cosine_then_gcn', 'self_loops': False, 'use_snp_selection': True, 'num_snps': 12722}. Best is trial 2 with value: 0.06660239705815157.
[I 2025-11-03 11:45:45,413] Trial 10 finished with value: 0.047528180211077756 and parameters: {'model_type': 'gcn', 'hidden_dims': '[256, 128]', 'dropout': 0.5885461262002587, 'batch_norm': False, 'lr': 9.558525641285997e-05, 'weight_decay': 0.0005507714381092994, 'epochs': 266, 'loss': 'mse', 'optimizer': 'adam', 'graph_mode': 'cutoff', 'cutoff': 0.8740100033033126, 'grm_norm': 'gcn', 'self_loops': True, 'use_snp_selection': True, 'num_snps': 16208}. Best is trial 2 with value: 0.06660239705815157.
[I 2025-11-03 11:45:47,453] Trial 11 finished with value: 0.0016669311636204837 and parameters: {'model_type': 'gcn', 'hidden_dims': '[256, 128, 64]', 'dropout': 0.5993628209965833, 'batch_norm': False, 'lr': 0.0009856604966616241, 'weight_decay': 1.0655358607693621e-07, 'epochs': 70, 'loss': 'mse', 'optimizer': 'adam', 'graph_mode': 'knn', 'source': 'grm', 'knn_k': 5, 'weighted_edges': False, 'symmetrize_mode': 'union', 'use_snp_selection': True, 'num_snps': 26762}. Best is trial 2 with value: 0.06660239705815157.
[I 2025-11-03 11:45:50,210] Trial 12 finished with value: 0.029349231734124293 and parameters: {'model_type': 'gcn', 'hidden_dims': '[256, 128, 64]', 'dropout': 0.4959639391019912, 'batch_norm': False, 'lr': 1.09190189634402e-05, 'weight_decay': 0.000884287926706653, 'epochs': 224, 'loss': 'mse', 'optimizer': 'adam', 'graph_mode': 'cutoff', 'cutoff': 0.5157485749757097, 'grm_norm': 'gcn', 'self_loops': False, 'use_snp_selection': True, 'num_snps': 30900}. Best is trial 2 with value: 0.06660239705815157.
[I 2025-11-03 11:45:52,728] Trial 13 finished with value: 0.009242844855944461 and parameters: {'model_type': 'gcn', 'hidden_dims': '[512, 64]', 'dropout': 0.5080947972831079, 'batch_norm': False, 'lr': 2.599790905224076e-06, 'weight_decay': 0.0002563123329143171, 'epochs': 153, 'loss': 'mse', 'optimizer': 'adam', 'graph_mode': 'knn', 'source': 'grm', 'knn_k': 10, 'weighted_edges': False, 'symmetrize_mode': 'mutual', 'use_snp_selection': True, 'num_snps': 27767}. Best is trial 2 with value: 0.06660239705815157.
[I 2025-11-03 11:45:55,769] Trial 14 finished with value: 0.04387652402096049 and parameters: {'model_type': 'gcn', 'hidden_dims': '[256, 128]', 'dropout': 0.4506894495718366, 'batch_norm': False, 'lr': 5.7638783139697534e-05, 'weight_decay': 0.000164606269109534, 'epochs': 82, 'loss': 'mse', 'optimizer': 'adam', 'graph_mode': 'cutoff', 'cutoff': 0.49348330859673306, 'grm_norm': 'cosine_then_gcn', 'self_loops': False, 'use_snp_selection': True, 'num_snps': 55144}. Best is trial 2 with value: 0.06660239705815157.
[I 2025-11-03 11:45:57,578] Trial 15 finished with value: 0.03924733111281048 and parameters: {'model_type': 'gcn', 'hidden_dims': '[256, 128, 64]', 'dropout': 0.5537506162027, 'batch_norm': False, 'lr': 1.6230608961668894e-05, 'weight_decay': 9.277929454080319e-05, 'epochs': 215, 'loss': 'mse', 'optimizer': 'adam', 'graph_mode': 'knn', 'source': 'grm', 'knn_k': 4, 'weighted_edges': False, 'symmetrize_mode': 'mutual', 'use_snp_selection': True, 'num_snps': 2799}. Best is trial 2 with value: 0.06660239705815157.
[I 2025-11-03 11:46:01,117] Trial 16 finished with value: 0.0251512371920892 and parameters: {'model_type': 'gcn', 'hidden_dims': '[512, 64]', 'dropout': 0.2858607843085205, 'batch_norm': False, 'lr': 1.061436110430588e-06, 'weight_decay': 3.6052943896407367e-07, 'epochs': 272, 'loss': 'mse', 'optimizer': 'adam', 'graph_mode': 'cutoff', 'cutoff': 0.6585249553774893, 'grm_norm': 'none', 'self_loops': True, 'use_snp_selection': True, 'num_snps': 39820}. Best is trial 2 with value: 0.06660239705815157.
[I 2025-11-03 11:46:03,117] Trial 17 finished with value: 0.007350230946085453 and parameters: {'model_type': 'gcn', 'hidden_dims': '[512, 128]', 'dropout': 0.4625135641172987, 'batch_norm': False, 'lr': 0.00015931464773479776, 'weight_decay': 4.37696300840197e-06, 'epochs': 107, 'loss': 'mse', 'optimizer': 'adam', 'graph_mode': 'knn', 'source': 'grm', 'knn_k': 3, 'weighted_edges': False, 'symmetrize_mode': 'union', 'use_snp_selection': True, 'num_snps': 19735}. Best is trial 2 with value: 0.06660239705815157.
[I 2025-11-03 11:46:05,430] Trial 18 finished with value: -0.006084429117027238 and parameters: {'model_type': 'gcn', 'hidden_dims': '[256, 128, 64]', 'dropout': 0.38144141121557545, 'batch_norm': False, 'lr': 8.344497563667692e-06, 'weight_decay': 3.0587023786541466e-05, 'epochs': 51, 'loss': 'mse', 'optimizer': 'adam', 'graph_mode': 'cutoff', 'cutoff': 0.3943236797477178, 'grm_norm': 'cosine', 'self_loops': False, 'use_snp_selection': True, 'num_snps': 37415}. Best is trial 2 with value: 0.06660239705815157.
[I 2025-11-03 11:46:07,586] Trial 19 finished with value: 0.05098981549821154 and parameters: {'model_type': 'gcn', 'hidden_dims': '[256, 128]', 'dropout': 0.5418703732296725, 'batch_norm': False, 'lr': 0.0008384972093008827, 'weight_decay': 0.0003297428665621773, 'epochs': 180, 'loss': 'mse', 'optimizer': 'adam', 'graph_mode': 'knn', 'source': 'grm', 'knn_k': 7, 'weighted_edges': False, 'symmetrize_mode': 'mutual', 'use_snp_selection': True, 'num_snps': 22343}. Best is trial 2 with value: 0.06660239705815157.
[I 2025-11-03 11:46:09,377] Trial 20 finished with value: 0.02839321486328703 and parameters: {'model_type': 'gcn', 'hidden_dims': '[256, 128]', 'dropout': 0.31766750875585814, 'batch_norm': False, 'lr': 4.253612284864056e-06, 'weight_decay': 6.522902987872315e-06, 'epochs': 263, 'loss': 'mse', 'optimizer': 'adam', 'graph_mode': 'cutoff', 'cutoff': 0.8781219337374944, 'grm_norm': 'gcn', 'self_loops': True, 'use_snp_selection': True, 'num_snps': 7309}. Best is trial 2 with value: 0.06660239705815157.
[I 2025-11-03 11:46:11,759] Trial 21 finished with value: 0.02741934569455193 and parameters: {'model_type': 'gcn', 'hidden_dims': '[512, 256]', 'dropout': 0.2151078111721278, 'batch_norm': True, 'lr': 2.180745833610832e-05, 'weight_decay': 1.0160577540700859e-05, 'epochs': 169, 'loss': 'mse', 'optimizer': 'adam', 'graph_mode': 'cutoff', 'cutoff': 0.7055187270936302, 'grm_norm': 'gcn', 'self_loops': False, 'use_snp_selection': False}. Best is trial 2 with value: 0.06660239705815157.
[I 2025-11-03 11:46:13,847] Trial 22 finished with value: 0.053811346917470665 and parameters: {'model_type': 'gcn', 'hidden_dims': '[512, 256]', 'dropout': 0.24531456231605808, 'batch_norm': True, 'lr': 2.9216410032929847e-05, 'weight_decay': 1.5895882312564007e-06, 'epochs': 131, 'loss': 'mse', 'optimizer': 'adam', 'graph_mode': 'cutoff', 'cutoff': 0.7514810688918189, 'grm_norm': 'gcn', 'self_loops': False, 'use_snp_selection': False}. Best is trial 2 with value: 0.06660239705815157.
