[I 2025-11-03 13:45:51,215] Trial 24 finished with value: 0.1355348650810286 and parameters: {'model_type': 'gcn', 'hidden_dims': '[512, 128]', 'dropout': 0.13159710832903634, 'batch_norm': True, 'lr': 0.0008925592490142438, 'weight_decay': 8.700345281130742e-07, 'epochs': 229, 'loss': 'mse', 'optimizer': 'adam', 'graph_mode': 'off', 'use_snp_selection': False}. Best is trial 24 with value: 0.1355348650810286.
[I 2025-11-03 13:45:53,049] Trial 25 finished with value: 0.11606484262219781 and parameters: {'model_type': 'gcn', 'hidden_dims': '[512, 256]', 'dropout': 0.30713701630751117, 'batch_norm': True, 'lr': 0.0002840951067012187, 'weight_decay': 7.736965589170095e-07, 'epochs': 233, 'loss': 'mse', 'optimizer': 'adam', 'graph_mode': 'off', 'use_snp_selection': False}. Best is trial 24 with value: 0.1355348650810286.
[I 2025-11-03 13:45:53,905] Trial 26 finished with value: 0.09099495015694059 and parameters: {'model_type': 'gcn', 'hidden_dims': '[256, 128]', 'dropout': 0.15319440164832154, 'batch_norm': False, 'lr': 0.00039769492564779526, 'weight_decay': 2.443643243280606e-06, 'epochs': 198, 'loss': 'mse', 'optimizer': 'adam', 'graph_mode': 'off', 'use_snp_selection': True, 'num_snps': 3842}. Best is trial 24 with value: 0.1355348650810286.
[I 2025-11-03 13:45:55,116] Trial 27 finished with value: 0.10414361506002988 and parameters: {'model_type': 'gcn', 'hidden_dims': '[256, 128, 64]', 'dropout': 0.25635770022960913, 'batch_norm': True, 'lr': 0.000956860578570543, 'weight_decay': 4.881339110858778e-06, 'epochs': 146, 'loss': 'mse', 'optimizer': 'adam', 'graph_mode': 'off', 'use_snp_selection': False}. Best is trial 24 with value: 0.1355348650810286.
[I 2025-11-03 13:45:56,153] Trial 28 finished with value: 0.09776376139602949 and parameters: {'model_type': 'gcn', 'hidden_dims': '[128, 64]', 'dropout': 0.19619381716213838, 'batch_norm': True, 'lr': 0.00010913538877504255, 'weight_decay': 2.905899669856454e-07, 'epochs': 221, 'loss': 'mse', 'optimizer': 'adam', 'graph_mode': 'off', 'use_snp_selection': False}. Best is trial 24 with value: 0.1355348650810286.
[I 2025-11-03 13:45:57,616] Trial 29 finished with value: 0.09629586266963515 and parameters: {'model_type': 'gcn', 'hidden_dims': '[128, 64]', 'dropout': 0.1930195370240523, 'batch_norm': True, 'lr': 0.00024131284079230954, 'weight_decay': 5.522710335772491e-05, 'epochs': 317, 'loss': 'mse', 'optimizer': 'adam', 'graph_mode': 'off', 'use_snp_selection': True, 'num_snps': 19468}. Best is trial 24 with value: 0.1355348650810286.
[I 2025-11-03 13:45:59,188] Trial 30 finished with value: 0.0741529902210334 and parameters: {'model_type': 'gcn', 'hidden_dims': '[512, 128]', 'dropout': 0.14862402119463497, 'batch_norm': True, 'lr': 1.950261248481532e-05, 'weight_decay': 5.291056172412096e-07, 'epochs': 174, 'loss': 'mse', 'optimizer': 'adam', 'graph_mode': 'off', 'use_snp_selection': False}. Best is trial 24 with value: 0.1355348650810286.
[I 2025-11-03 13:46:01,159] Trial 31 finished with value: 0.12139147780341299 and parameters: {'model_type': 'gcn', 'hidden_dims': '[512, 128]', 'dropout': 0.10572733898383622, 'batch_norm': True, 'lr': 0.0006635818750912337, 'weight_decay': 1.6368032972523567e-07, 'epochs': 265, 'loss': 'mae', 'optimizer': 'adam', 'graph_mode': 'off', 'use_snp_selection': False}. Best is trial 24 with value: 0.1355348650810286.
[I 2025-11-03 13:46:03,167] Trial 32 finished with value: 0.12043897936208259 and parameters: {'model_type': 'gcn', 'hidden_dims': '[512, 128]', 'dropout': 0.1261627026260336, 'batch_norm': True, 'lr': 0.0006265639208339607, 'weight_decay': 1.8250210841660225e-07, 'epochs': 263, 'loss': 'mae', 'optimizer': 'adam', 'graph_mode': 'off', 'use_snp_selection': False}. Best is trial 24 with value: 0.1355348650810286.
[I 2025-11-03 13:46:05,203] Trial 33 finished with value: 0.11405470779314585 and parameters: {'model_type': 'gcn', 'hidden_dims': '[512, 128]', 'dropout': 0.1326473308259002, 'batch_norm': True, 'lr': 0.0006225073824009951, 'weight_decay': 1.6959173705221977e-07, 'epochs': 270, 'loss': 'mae', 'optimizer': 'adam', 'graph_mode': 'off', 'use_snp_selection': False}. Best is trial 24 with value: 0.1355348650810286.
[I 2025-11-03 13:46:06,756] Trial 34 finished with value: 0.1056207264903976 and parameters: {'model_type': 'gcn', 'hidden_dims': '[256, 128]', 'dropout': 0.17856499138646023, 'batch_norm': True, 'lr': 0.00030855435593775936, 'weight_decay': 3.7620590353463075e-07, 'epochs': 306, 'loss': 'mae', 'optimizer': 'adam', 'graph_mode': 'off', 'use_snp_selection': False}. Best is trial 24 with value: 0.1355348650810286.
[I 2025-11-03 13:46:08,682] Trial 35 finished with value: 0.09581501373314677 and parameters: {'model_type': 'gcn', 'hidden_dims': '[512, 128]', 'dropout': 0.12732708027204923, 'batch_norm': False, 'lr': 9.825799111517023e-05, 'weight_decay': 8.04081414493425e-07, 'epochs': 258, 'loss': 'mae', 'optimizer': 'adam', 'graph_mode': 'off', 'use_snp_selection': False}. Best is trial 24 with value: 0.1355348650810286.
[I 2025-11-03 13:46:11,684] Trial 36 finished with value: -0.003724393295414221 and parameters: {'model_type': 'gcn', 'hidden_dims': '[512, 64]', 'dropout': 0.12448691694090477, 'batch_norm': True, 'lr': 2.738271186962594e-06, 'weight_decay': 6.886876803351276e-05, 'epochs': 327, 'loss': 'mae', 'optimizer': 'adam', 'graph_mode': 'off', 'use_snp_selection': True, 'num_snps': 58661}. Best is trial 24 with value: 0.1355348650810286.
[I 2025-11-03 13:46:13,501] Trial 37 finished with value: 0.10941502093675881 and parameters: {'model_type': 'gcn', 'hidden_dims': '[256, 128, 64]', 'dropout': 0.16212914656845528, 'batch_norm': True, 'lr': 0.0007501313186879458, 'weight_decay': 8.118126164253094e-06, 'epochs': 297, 'loss': 'mae', 'optimizer': 'adam', 'graph_mode': 'off', 'use_snp_selection': False}. Best is trial 24 with value: 0.1355348650810286.
[I 2025-11-03 13:46:14,981] Trial 38 finished with value: 0.07527748729728378 and parameters: {'model_type': 'gcn', 'hidden_dims': '[512, 128]', 'dropout': 0.46348439059080443, 'batch_norm': False, 'lr': 0.000193084995995082, 'weight_decay': 1.1690776204021995e-06, 'epochs': 274, 'loss': 'mae', 'optimizer': 'adam', 'graph_mode': 'off', 'use_snp_selection': True, 'num_snps': 19911}. Best is trial 24 with value: 0.1355348650810286.
[I 2025-11-03 13:46:17,390] Trial 39 finished with value: 0.0912218840249292 and parameters: {'model_type': 'gcn', 'hidden_dims': '[512, 128]', 'dropout': 0.593444752072398, 'batch_norm': True, 'lr': 8.284398853496303e-06, 'weight_decay': 1.8945059089393733e-07, 'epochs': 337, 'loss': 'mae', 'optimizer': 'adam', 'graph_mode': 'off', 'use_snp_selection': False}. Best is trial 24 with value: 0.1355348650810286.
[I 2025-11-03 13:46:19,300] Trial 40 finished with value: 0.107466903936453 and parameters: {'model_type': 'gcn', 'hidden_dims': '[512, 256]', 'dropout': 0.2652621446744998, 'batch_norm': True, 'lr': 0.0004086744525950706, 'weight_decay': 3.899434190926646e-07, 'epochs': 246, 'loss': 'mae', 'optimizer': 'adam', 'graph_mode': 'off', 'use_snp_selection': False}. Best is trial 24 with value: 0.1355348650810286.
[I 2025-11-03 13:46:21,152] Trial 41 finished with value: 0.1161509320008196 and parameters: {'model_type': 'gcn', 'hidden_dims': '[512, 128]', 'dropout': 0.21087551668170118, 'batch_norm': True, 'lr': 0.0006566542621982009, 'weight_decay': 1.020470225065408e-07, 'epochs': 231, 'loss': 'mse', 'optimizer': 'adam', 'graph_mode': 'off', 'use_snp_selection': False}. Best is trial 24 with value: 0.1355348650810286.
[I 2025-11-03 13:46:22,897] Trial 42 finished with value: 0.11008665508333826 and parameters: {'model_type': 'gcn', 'hidden_dims': '[512, 128]', 'dropout': 0.3668203050891774, 'batch_norm': True, 'lr': 0.0009538772554454188, 'weight_decay': 2.1513081788751897e-07, 'epochs': 214, 'loss': 'mse', 'optimizer': 'adam', 'graph_mode': 'off', 'use_snp_selection': False}. Best is trial 24 with value: 0.1355348650810286.
[I 2025-11-03 13:46:24,988] Trial 43 finished with value: 0.11808728591567938 and parameters: {'model_type': 'gcn', 'hidden_dims': '[512, 128]', 'dropout': 0.12899083315274976, 'batch_norm': True, 'lr': 0.00044886399206836987, 'weight_decay': 1.6502656116907305e-07, 'epochs': 281, 'loss': 'mse', 'optimizer': 'adam', 'graph_mode': 'off', 'use_snp_selection': False}. Best is trial 24 with value: 0.1355348650810286.
[I 2025-11-03 13:46:26,924] Trial 44 finished with value: 0.11352157445479023 and parameters: {'model_type': 'gcn', 'hidden_dims': '[512, 64]', 'dropout': 0.1740782074671001, 'batch_norm': True, 'lr': 0.0006467860714929533, 'weight_decay': 3.339311701422514e-07, 'epochs': 244, 'loss': 'mse', 'optimizer': 'adam', 'graph_mode': 'off', 'use_snp_selection': False}. Best is trial 24 with value: 0.1355348650810286.
[I 2025-11-03 13:46:28,257] Trial 45 finished with value: 0.11158435701299702 and parameters: {'model_type': 'gcn', 'hidden_dims': '[512, 128]', 'dropout': 0.10070547089380454, 'batch_norm': True, 'lr': 0.00031200039751588246, 'weight_decay': 9.971306686848864e-05, 'epochs': 127, 'loss': 'mae', 'optimizer': 'adam', 'graph_mode': 'off', 'use_snp_selection': False}. Best is trial 24 with value: 0.1355348650810286.
[I 2025-11-03 13:46:29,441] Trial 46 finished with value: 0.05463446556549659 and parameters: {'model_type': 'gcn', 'hidden_dims': '[256, 128]', 'dropout': 0.23506167183090093, 'batch_norm': True, 'lr': 4.49032791409583e-05, 'weight_decay': 5.233430038625761e-07, 'epochs': 196, 'loss': 'mse', 'optimizer': 'adam', 'graph_mode': 'off', 'use_snp_selection': False}. Best is trial 24 with value: 0.1355348650810286.
[I 2025-11-03 13:46:31,215] Trial 47 finished with value: 0.08945442329416814 and parameters: {'model_type': 'gcn', 'hidden_dims': '[512, 128]', 'dropout': 0.11890296030138976, 'batch_norm': False, 'lr': 0.0005370984360176643, 'weight_decay': 1.42756783469395e-07, 'epochs': 225, 'loss': 'mae', 'optimizer': 'adam', 'graph_mode': 'off', 'use_snp_selection': False}. Best is trial 24 with value: 0.1355348650810286.
[I 2025-11-03 13:46:33,201] Trial 48 finished with value: 0.013296182563419372 and parameters: {'model_type': 'gcn', 'hidden_dims': '[512, 128]', 'dropout': 0.14422962918836274, 'batch_norm': True, 'lr': 1.1170552432785515e-06, 'weight_decay': 0.0006963874766430633, 'epochs': 264, 'loss': 'mse', 'optimizer': 'adam', 'graph_mode': 'off', 'use_snp_selection': False}. Best is trial 24 with value: 0.1355348650810286.
[I 2025-11-03 13:46:34,536] Trial 49 finished with value: 0.0838752682842328 and parameters: {'model_type': 'gcn', 'hidden_dims': '[128, 64]', 'dropout': 0.21437050855221615, 'batch_norm': True, 'lr': 0.0002136191268548856, 'weight_decay': 1.0049959916223116e-07, 'epochs': 48, 'loss': 'mse', 'optimizer': 'adam', 'graph_mode': 'off', 'use_snp_selection': True, 'num_snps': 46888}. Best is trial 24 with value: 0.1355348650810286.
[I 2025-11-03 13:46:36,652] Trial 50 finished with value: 0.11687040703002521 and parameters: {'model_type': 'gcn', 'hidden_dims': '[512, 128]', 'dropout': 0.2955376794258305, 'batch_norm': True, 'lr': 0.0007376396823888429, 'weight_decay': 1.995727690712104e-06, 'epochs': 285, 'loss': 'mae', 'optimizer': 'adam', 'graph_mode': 'off', 'use_snp_selection': False}. Best is trial 24 with value: 0.1355348650810286.
[I 2025-11-03 13:46:38,545] Trial 51 finished with value: 0.13117361458360072 and parameters: {'model_type': 'gcn', 'hidden_dims': '[512, 128]', 'dropout': 0.1293085650694964, 'batch_norm': True, 'lr': 0.0004180785326119163, 'weight_decay': 1.6532225253834208e-07, 'epochs': 249, 'loss': 'mse', 'optimizer': 'adam', 'graph_mode': 'off', 'use_snp_selection': False}. Best is trial 24 with value: 0.1355348650810286.
[I 2025-11-03 13:46:40,475] Trial 52 finished with value: 0.11318379383078842 and parameters: {'model_type': 'gcn', 'hidden_dims': '[512, 128]', 'dropout': 0.16326854933724694, 'batch_norm': True, 'lr': 0.00037385727991094334, 'weight_decay': 2.7061510734263553e-07, 'epochs': 249, 'loss': 'mse', 'optimizer': 'adam', 'graph_mode': 'off', 'use_snp_selection': False}. Best is trial 24 with value: 0.1355348650810286.
[I 2025-11-03 13:46:42,195] Trial 53 finished with value: 0.12531179082970811 and parameters: {'model_type': 'gcn', 'hidden_dims': '[512, 128]', 'dropout': 0.1004333910141529, 'batch_norm': True, 'lr': 0.000716206229397503, 'weight_decay': 1.665321730676758e-07, 'epochs': 208, 'loss': 'mse', 'optimizer': 'adam', 'graph_mode': 'off', 'use_snp_selection': False}. Best is trial 24 with value: 0.1355348650810286.
[I 2025-11-03 13:46:43,994] Trial 54 finished with value: 0.12612752170522673 and parameters: {'model_type': 'gcn', 'hidden_dims': '[512, 128]', 'dropout': 0.11437620240428975, 'batch_norm': True, 'lr': 0.0007697579982993534, 'weight_decay': 1.6481582095743124e-07, 'epochs': 208, 'loss': 'mse', 'optimizer': 'adam', 'graph_mode': 'off', 'use_snp_selection': False}. Best is trial 24 with value: 0.1355348650810286.
[I 2025-11-03 13:46:45,575] Trial 55 finished with value: 0.12461345523158004 and parameters: {'model_type': 'gcn', 'hidden_dims': '[512, 128]', 'dropout': 0.10084073706252145, 'batch_norm': True, 'lr': 0.0009905388749640415, 'weight_decay': 6.153261774324535e-07, 'epochs': 184, 'loss': 'mse', 'optimizer': 'adam', 'graph_mode': 'off', 'use_snp_selection': False}. Best is trial 24 with value: 0.1355348650810286.
[I 2025-11-03 13:46:46,907] Trial 56 finished with value: 0.10589333364966487 and parameters: {'model_type': 'gcn', 'hidden_dims': '[256, 128, 64]', 'dropout': 0.13910438266177755, 'batch_norm': True, 'lr': 0.0009591190819803308, 'weight_decay': 7.820307138788906e-07, 'epochs': 184, 'loss': 'mse', 'optimizer': 'adam', 'graph_mode': 'off', 'use_snp_selection': False}. Best is trial 24 with value: 0.1355348650810286.
[I 2025-11-03 13:46:48,654] Trial 57 finished with value: 0.1113816198030437 and parameters: {'model_type': 'gcn', 'hidden_dims': '[512, 64]', 'dropout': 0.11408270331618833, 'batch_norm': True, 'lr': 0.0008088816319967448, 'weight_decay': 1.4197933475314815e-06, 'epochs': 213, 'loss': 'mse', 'optimizer': 'adam', 'graph_mode': 'off', 'use_snp_selection': False}. Best is trial 24 with value: 0.1355348650810286.
[I 2025-11-03 13:46:50,159] Trial 58 finished with value: 0.011197520459341064 and parameters: {'model_type': 'gcn', 'hidden_dims': '[512, 128]', 'dropout': 0.17889154052234219, 'batch_norm': False, 'lr': 0.000424323351411512, 'weight_decay': 1.958497757374072e-05, 'epochs': 163, 'loss': 'mse', 'optimizer': 'adam', 'graph_mode': 'off', 'use_snp_selection': False}. Best is trial 24 with value: 0.1355348650810286.
[I 2025-11-03 13:46:51,851] Trial 59 finished with value: 0.12138685454059733 and parameters: {'model_type': 'gcn', 'hidden_dims': '[512, 256]', 'dropout': 0.15233578914468354, 'batch_norm': True, 'lr': 0.00026975393848955464, 'weight_decay': 5.816110286256505e-07, 'epochs': 208, 'loss': 'mse', 'optimizer': 'adam', 'graph_mode': 'off', 'use_snp_selection': False}. Best is trial 24 with value: 0.1355348650810286.
[I 2025-11-03 13:46:53,317] Trial 60 finished with value: 0.11281668730585949 and parameters: {'model_type': 'gcn', 'hidden_dims': '[512, 128]', 'dropout': 0.10266764194638886, 'batch_norm': True, 'lr': 0.0005132353977761005, 'weight_decay': 3.0620023130257454e-07, 'epochs': 161, 'loss': 'mse', 'optimizer': 'adam', 'graph_mode': 'off', 'use_snp_selection': False}. Best is trial 24 with value: 0.1355348650810286.
[I 2025-11-03 13:46:54,950] Trial 61 finished with value: 0.12238581457907823 and parameters: {'model_type': 'gcn', 'hidden_dims': '[512, 128]', 'dropout': 0.11343567123256794, 'batch_norm': True, 'lr': 0.0007597620126679826, 'weight_decay': 1.607449432435884e-07, 'epochs': 188, 'loss': 'mse', 'optimizer': 'adam', 'graph_mode': 'off', 'use_snp_selection': False}. Best is trial 24 with value: 0.1355348650810286.
[I 2025-11-03 13:46:56,651] Trial 62 finished with value: 0.13653384210920258 and parameters: {'model_type': 'gcn', 'hidden_dims': '[512, 128]', 'dropout': 0.13860923209895706, 'batch_norm': True, 'lr': 0.0007703440491387182, 'weight_decay': 1.3957947150438136e-07, 'epochs': 190, 'loss': 'mse', 'optimizer': 'adam', 'graph_mode': 'off', 'use_snp_selection': False}. Best is trial 62 with value: 0.13653384210920258.
[I 2025-11-03 13:46:58,326] Trial 63 finished with value: 0.1257652087291448 and parameters: {'model_type': 'gcn', 'hidden_dims': '[512, 128]', 'dropout': 0.13706945067952434, 'batch_norm': True, 'lr': 0.0009621241550359752, 'weight_decay': 4.2205662580477844e-07, 'epochs': 202, 'loss': 'mse', 'optimizer': 'adam', 'graph_mode': 'off', 'use_snp_selection': False}. Best is trial 62 with value: 0.13653384210920258.
[I 2025-11-03 13:47:00,032] Trial 64 finished with value: 0.12690759870634996 and parameters: {'model_type': 'gcn', 'hidden_dims': '[512, 128]', 'dropout': 0.18393864604539772, 'batch_norm': True, 'lr': 0.0004886172302055684, 'weight_decay': 2.4920071748955655e-07, 'epochs': 206, 'loss': 'mse', 'optimizer': 'adam', 'graph_mode': 'off', 'use_snp_selection': False}. Best is trial 62 with value: 0.13653384210920258.
[I 2025-11-03 13:47:01,728] Trial 65 finished with value: 0.12410133894082298 and parameters: {'model_type': 'gcn', 'hidden_dims': '[512, 128]', 'dropout': 0.1938646395527052, 'batch_norm': True, 'lr': 0.00037175010083588165, 'weight_decay': 4.3314771912484955e-07, 'epochs': 202, 'loss': 'mse', 'optimizer': 'adam', 'graph_mode': 'off', 'use_snp_selection': False}. Best is trial 62 with value: 0.13653384210920258.
[I 2025-11-03 13:47:02,857] Trial 66 finished with value: 0.11825813118480198 and parameters: {'model_type': 'gcn', 'hidden_dims': '[256, 128]', 'dropout': 0.1818123147059601, 'batch_norm': True, 'lr': 0.0005105360249261037, 'weight_decay': 2.396462251028015e-07, 'epochs': 134, 'loss': 'mse', 'optimizer': 'adam', 'graph_mode': 'off', 'use_snp_selection': True, 'num_snps': 22881}. Best is trial 62 with value: 0.13653384210920258.
[I 2025-11-03 13:47:04,629] Trial 67 finished with value: 0.1177008771736307 and parameters: {'model_type': 'gcn', 'hidden_dims': '[512, 128]', 'dropout': 0.16168726810606915, 'batch_norm': True, 'lr': 0.0008262786316016365, 'weight_decay': 2.4770470162374694e-07, 'epochs': 224, 'loss': 'mse', 'optimizer': 'adam', 'graph_mode': 'off', 'use_snp_selection': False}. Best is trial 62 with value: 0.13653384210920258.
[I 2025-11-03 13:47:05,531] Trial 68 finished with value: 0.10201326145146211 and parameters: {'model_type': 'gcn', 'hidden_dims': '[128, 64]', 'dropout': 0.20798644929670645, 'batch_norm': True, 'lr': 0.00014127290779846085, 'weight_decay': 1.3230354694295145e-07, 'epochs': 169, 'loss': 'mse', 'optimizer': 'adam', 'graph_mode': 'off', 'use_snp_selection': False}. Best is trial 62 with value: 0.13653384210920258.
[I 2025-11-03 13:47:07,342] Trial 69 finished with value: 0.06174333112860556 and parameters: {'model_type': 'gcn', 'hidden_dims': '[512, 128]', 'dropout': 0.14496421691841482, 'batch_norm': False, 'lr': 0.0005652488148557607, 'weight_decay': 1.0120405139161427e-06, 'epochs': 231, 'loss': 'mse', 'optimizer': 'adam', 'graph_mode': 'off', 'use_snp_selection': False}. Best is trial 62 with value: 0.13653384210920258.
[I 2025-11-03 13:47:08,426] Trial 70 finished with value: 0.07377848727250813 and parameters: {'model_type': 'gcn', 'hidden_dims': '[512, 128]', 'dropout': 0.13452214782112001, 'batch_norm': True, 'lr': 7.6067899107489e-05, 'weight_decay': 3.7497831569912253e-07, 'epochs': 73, 'loss': 'mse', 'optimizer': 'adam', 'graph_mode': 'off', 'use_snp_selection': False}. Best is trial 62 with value: 0.13653384210920258.
[I 2025-11-03 13:47:10,113] Trial 71 finished with value: 0.12561579132478054 and parameters: {'model_type': 'gcn', 'hidden_dims': '[512, 128]', 'dropout': 0.15651019223104898, 'batch_norm': True, 'lr': 0.0007689368506095186, 'weight_decay': 1.3306946217886098e-07, 'epochs': 206, 'loss': 'mse', 'optimizer': 'adam', 'graph_mode': 'off', 'use_snp_selection': False}. Best is trial 62 with value: 0.13653384210920258.
[I 2025-11-03 13:47:11,860] Trial 72 finished with value: 0.11056430446889075 and parameters: {'model_type': 'gcn', 'hidden_dims': '[512, 128]', 'dropout': 0.16495857553785576, 'batch_norm': True, 'lr': 0.00044347335759336844, 'weight_decay': 1.270166273990121e-07, 'epochs': 202, 'loss': 'mse', 'optimizer': 'adam', 'graph_mode': 'off', 'use_snp_selection': False}. Best is trial 62 with value: 0.13653384210920258.
[I 2025-11-03 13:47:13,569] Trial 73 finished with value: 0.1139428233591126 and parameters: {'model_type': 'gcn', 'hidden_dims': '[512, 128]', 'dropout': 0.1817657196034955, 'batch_norm': True, 'lr': 0.0003321374998993211, 'weight_decay': 3.010062337507875e-07, 'epochs': 188, 'loss': 'mse', 'optimizer': 'adam', 'graph_mode': 'off', 'use_snp_selection': False}. Best is trial 62 with value: 0.13653384210920258.
[I 2025-11-03 13:47:15,481] Trial 74 finished with value: 0.12501906618500086 and parameters: {'model_type': 'gcn', 'hidden_dims': '[512, 128]', 'dropout': 0.2517740701724227, 'batch_norm': True, 'lr': 0.0008287697878504344, 'weight_decay': 2.120918928140431e-07, 'epochs': 237, 'loss': 'mse', 'optimizer': 'adam', 'graph_mode': 'off', 'use_snp_selection': False}. Best is trial 62 with value: 0.13653384210920258.
[I 2025-11-03 13:47:16,744] Trial 75 finished with value: 0.08722964726525231 and parameters: {'model_type': 'gcn', 'hidden_dims': '[256, 128, 64]', 'dropout': 0.4243202473811953, 'batch_norm': True, 'lr': 0.0006062986836683436, 'weight_decay': 1.3218412384942448e-07, 'epochs': 153, 'loss': 'mse', 'optimizer': 'adam', 'graph_mode': 'off', 'use_snp_selection': False}. Best is trial 62 with value: 0.13653384210920258.
