[I 2025-11-03 12:05:29,702] Trial 123 finished with value: 0.15938269760240473 and parameters: {'model_type': 'gcn', 'hidden_dims': '[512, 256]', 'dropout': 0.1312923688426689, 'batch_norm': True, 'lr': 0.0006591581107876976, 'weight_decay': 1.9917004660041942e-07, 'epochs': 331, 'loss': 'mae', 'optimizer': 'adam', 'graph_mode': 'off', 'use_snp_selection': False}. Best is trial 105 with value: 0.1693502671945205.
[I 2025-11-03 12:05:31,909] Trial 124 finished with value: 0.13164292450471468 and parameters: {'model_type': 'gcn', 'hidden_dims': '[512, 256]', 'dropout': 0.496596992662782, 'batch_norm': True, 'lr': 0.0004482523286253412, 'weight_decay': 1.4197461341684786e-07, 'epochs': 129, 'loss': 'mae', 'optimizer': 'adam', 'graph_mode': 'off', 'use_snp_selection': False}. Best is trial 105 with value: 0.1693502671945205.
[I 2025-11-03 12:05:36,689] Trial 125 finished with value: 0.15914184265230275 and parameters: {'model_type': 'gcn', 'hidden_dims': '[512, 256]', 'dropout': 0.11552128000373962, 'batch_norm': True, 'lr': 0.00026902002887827653, 'weight_decay': 2.388993749068669e-07, 'epochs': 348, 'loss': 'mae', 'optimizer': 'adam', 'graph_mode': 'off', 'use_snp_selection': False}. Best is trial 105 with value: 0.1693502671945205.
[I 2025-11-03 12:05:39,723] Trial 126 finished with value: 0.16851770768866 and parameters: {'model_type': 'gcn', 'hidden_dims': '[512, 128]', 'dropout': 0.10340509079456438, 'batch_norm': True, 'lr': 0.0005339778995168766, 'weight_decay': 1.0755204003137982e-05, 'epochs': 201, 'loss': 'mae', 'optimizer': 'adam', 'graph_mode': 'off', 'use_snp_selection': False}. Best is trial 105 with value: 0.1693502671945205.
[I 2025-11-03 12:05:44,335] Trial 127 finished with value: 0.16134018529122363 and parameters: {'model_type': 'gcn', 'hidden_dims': '[512, 128]', 'dropout': 0.10233261496323819, 'batch_norm': True, 'lr': 0.0005305441373728534, 'weight_decay': 7.212062301744039e-06, 'epochs': 335, 'loss': 'mae', 'optimizer': 'adam', 'graph_mode': 'off', 'use_snp_selection': False}. Best is trial 105 with value: 0.1693502671945205.
[I 2025-11-03 12:05:46,488] Trial 128 finished with value: 0.11040106445842575 and parameters: {'model_type': 'gcn', 'hidden_dims': '[512, 128]', 'dropout': 0.10070847142832842, 'batch_norm': True, 'lr': 0.0005613767369335575, 'weight_decay': 3.66683361833587e-06, 'epochs': 311, 'loss': 'mae', 'optimizer': 'adam', 'graph_mode': 'off', 'use_snp_selection': True, 'num_snps': 12722}. Best is trial 105 with value: 0.1693502671945205.
[I 2025-11-03 12:05:51,044] Trial 129 finished with value: 0.11436518454607669 and parameters: {'model_type': 'gcn', 'hidden_dims': '[512, 128]', 'dropout': 0.144192119975064, 'batch_norm': True, 'lr': 1.1542905074028255e-05, 'weight_decay': 1.0149694860245075e-05, 'epochs': 334, 'loss': 'mae', 'optimizer': 'adam', 'graph_mode': 'off', 'use_snp_selection': False}. Best is trial 105 with value: 0.1693502671945205.
[I 2025-11-03 12:05:55,477] Trial 130 finished with value: 0.1528384525123989 and parameters: {'model_type': 'gcn', 'hidden_dims': '[512, 128]', 'dropout': 0.1199382199996452, 'batch_norm': True, 'lr': 0.0004098603535594571, 'weight_decay': 5.473205997285878e-06, 'epochs': 323, 'loss': 'mae', 'optimizer': 'adam', 'graph_mode': 'off', 'use_snp_selection': False}. Best is trial 105 with value: 0.1693502671945205.
[I 2025-11-03 12:05:58,054] Trial 131 finished with value: 0.15410583613504478 and parameters: {'model_type': 'gcn', 'hidden_dims': '[512, 128]', 'dropout': 0.11022183863731168, 'batch_norm': True, 'lr': 0.0007254923413733348, 'weight_decay': 1.7085285677058919e-07, 'epochs': 159, 'loss': 'mae', 'optimizer': 'adam', 'graph_mode': 'off', 'use_snp_selection': False}. Best is trial 105 with value: 0.1693502671945205.
[I 2025-11-03 12:06:02,677] Trial 132 finished with value: 0.1489405693210157 and parameters: {'model_type': 'gcn', 'hidden_dims': '[512, 128]', 'dropout': 0.10032082943159942, 'batch_norm': True, 'lr': 0.0005204909842907419, 'weight_decay': 6.658705410071861e-06, 'epochs': 340, 'loss': 'mae', 'optimizer': 'adam', 'graph_mode': 'off', 'use_snp_selection': False}. Best is trial 105 with value: 0.1693502671945205.
[I 2025-11-03 12:06:07,443] Trial 133 finished with value: 0.15495513471414787 and parameters: {'model_type': 'gcn', 'hidden_dims': '[512, 128]', 'dropout': 0.12384957292726989, 'batch_norm': True, 'lr': 0.000873221958814848, 'weight_decay': 4.144144690059146e-07, 'epochs': 347, 'loss': 'mae', 'optimizer': 'adam', 'graph_mode': 'off', 'use_snp_selection': False}. Best is trial 105 with value: 0.1693502671945205.
[I 2025-11-03 12:06:11,870] Trial 134 finished with value: 0.15412587863664673 and parameters: {'model_type': 'gcn', 'hidden_dims': '[512, 128]', 'dropout': 0.13423871714418092, 'batch_norm': True, 'lr': 0.000630746177406679, 'weight_decay': 1.129811113425533e-06, 'epochs': 315, 'loss': 'mae', 'optimizer': 'adam', 'graph_mode': 'off', 'use_snp_selection': False}. Best is trial 105 with value: 0.1693502671945205.
[I 2025-11-03 12:06:16,529] Trial 135 finished with value: 0.1588931718089205 and parameters: {'model_type': 'gcn', 'hidden_dims': '[512, 128]', 'dropout': 0.11421793740974931, 'batch_norm': True, 'lr': 0.0003286056385074274, 'weight_decay': 1.4592857876320608e-06, 'epochs': 329, 'loss': 'mae', 'optimizer': 'adam', 'graph_mode': 'off', 'use_snp_selection': False}. Best is trial 105 with value: 0.1693502671945205.
[I 2025-11-03 12:06:20,784] Trial 136 finished with value: 0.15342680182832788 and parameters: {'model_type': 'gcn', 'hidden_dims': '[512, 128]', 'dropout': 0.13927964800619697, 'batch_norm': True, 'lr': 0.00045805781356461406, 'weight_decay': 1.921027363912274e-07, 'epochs': 303, 'loss': 'mae', 'optimizer': 'adam', 'graph_mode': 'off', 'use_snp_selection': False}. Best is trial 105 with value: 0.1693502671945205.
[I 2025-11-03 12:06:23,066] Trial 137 finished with value: -0.0009774086926989983 and parameters: {'model_type': 'gcn', 'hidden_dims': '[256, 128, 64]', 'dropout': 0.148483940387553, 'batch_norm': True, 'lr': 2.2975734365990353e-06, 'weight_decay': 1.2712545188194641e-05, 'epochs': 219, 'loss': 'mse', 'optimizer': 'adam', 'graph_mode': 'off', 'use_snp_selection': False}. Best is trial 105 with value: 0.1693502671945205.
[I 2025-11-03 12:06:26,116] Trial 138 finished with value: 0.14898166539611515 and parameters: {'model_type': 'gcn', 'hidden_dims': '[512, 128]', 'dropout': 0.10036487320557362, 'batch_norm': True, 'lr': 0.0005559619373039421, 'weight_decay': 1.2762412449550539e-07, 'epochs': 194, 'loss': 'mae', 'optimizer': 'adam', 'graph_mode': 'off', 'use_snp_selection': False}. Best is trial 105 with value: 0.1693502671945205.
[I 2025-11-03 12:06:29,113] Trial 139 finished with value: 0.12532866366774345 and parameters: {'model_type': 'gcn', 'hidden_dims': '[512, 128]', 'dropout': 0.1264310107376734, 'batch_norm': False, 'lr': 0.00037706778646191184, 'weight_decay': 2.6970476562207446e-07, 'epochs': 201, 'loss': 'mae', 'optimizer': 'adam', 'graph_mode': 'off', 'use_snp_selection': False}. Best is trial 105 with value: 0.1693502671945205.
[I 2025-11-03 12:06:32,685] Trial 140 finished with value: 0.12908754353719143 and parameters: {'model_type': 'gcn', 'hidden_dims': '[512, 128]', 'dropout': 0.5998869202215542, 'batch_norm': True, 'lr': 0.0007074328251462456, 'weight_decay': 2.007644194841438e-05, 'epochs': 238, 'loss': 'mae', 'optimizer': 'adam', 'graph_mode': 'off', 'use_snp_selection': False}. Best is trial 105 with value: 0.1693502671945205.
[I 2025-11-03 12:06:35,807] Trial 141 finished with value: 0.1583385969344506 and parameters: {'model_type': 'gcn', 'hidden_dims': '[512, 256]', 'dropout': 0.5715109252517765, 'batch_norm': True, 'lr': 0.0003040071321051731, 'weight_decay': 4.8975360278458045e-05, 'epochs': 205, 'loss': 'mae', 'optimizer': 'adam', 'graph_mode': 'off', 'use_snp_selection': False}. Best is trial 105 with value: 0.1693502671945205.
[I 2025-11-03 12:06:39,193] Trial 142 finished with value: 0.14751470159794342 and parameters: {'model_type': 'gcn', 'hidden_dims': '[512, 256]', 'dropout': 0.5267130803486363, 'batch_norm': True, 'lr': 0.0004973098309933706, 'weight_decay': 8.553162953619996e-06, 'epochs': 228, 'loss': 'mae', 'optimizer': 'adam', 'graph_mode': 'off', 'use_snp_selection': False}. Best is trial 105 with value: 0.1693502671945205.
[I 2025-11-03 12:06:42,016] Trial 143 finished with value: 0.15181456087066036 and parameters: {'model_type': 'gcn', 'hidden_dims': '[512, 64]', 'dropout': 0.11249497442573148, 'batch_norm': True, 'lr': 0.00023182153752610948, 'weight_decay': 3.5437222904035514e-05, 'epochs': 184, 'loss': 'mae', 'optimizer': 'adam', 'graph_mode': 'off', 'use_snp_selection': False}. Best is trial 105 with value: 0.1693502671945205.
[I 2025-11-03 12:06:45,331] Trial 144 finished with value: 0.15247860772503832 and parameters: {'model_type': 'gcn', 'hidden_dims': '[512, 128]', 'dropout': 0.1198469480523941, 'batch_norm': True, 'lr': 0.00040436185732936207, 'weight_decay': 2.440357036121526e-05, 'epochs': 222, 'loss': 'mae', 'optimizer': 'adam', 'graph_mode': 'off', 'use_snp_selection': False}. Best is trial 105 with value: 0.1693502671945205.
[I 2025-11-03 12:06:48,076] Trial 145 finished with value: 0.14623256588578604 and parameters: {'model_type': 'gcn', 'hidden_dims': '[512, 128]', 'dropout': 0.5101412764550953, 'batch_norm': True, 'lr': 0.0005824161663430754, 'weight_decay': 1.707892693844678e-05, 'epochs': 175, 'loss': 'mae', 'optimizer': 'adam', 'graph_mode': 'off', 'use_snp_selection': False}. Best is trial 105 with value: 0.1693502671945205.
[I 2025-11-03 12:06:49,331] Trial 146 finished with value: 0.15619745332846902 and parameters: {'model_type': 'gcn', 'hidden_dims': '[256, 128]', 'dropout': 0.4796321393083475, 'batch_norm': True, 'lr': 0.000353708595493064, 'weight_decay': 1.4192205110683282e-05, 'epochs': 93, 'loss': 'mae', 'optimizer': 'adam', 'graph_mode': 'off', 'use_snp_selection': False}. Best is trial 105 with value: 0.1693502671945205.
[I 2025-11-03 12:06:52,600] Trial 147 finished with value: 0.15228385346581447 and parameters: {'model_type': 'gcn', 'hidden_dims': '[512, 256]', 'dropout': 0.4464080019014659, 'batch_norm': True, 'lr': 0.000450065661929696, 'weight_decay': 1.5681180072496457e-07, 'epochs': 210, 'loss': 'mae', 'optimizer': 'adam', 'graph_mode': 'off', 'use_snp_selection': False}. Best is trial 105 with value: 0.1693502671945205.
[I 2025-11-03 12:06:55,625] Trial 148 finished with value: 0.15285949250553868 and parameters: {'model_type': 'gcn', 'hidden_dims': '[512, 128]', 'dropout': 0.10954271842282612, 'batch_norm': True, 'lr': 0.00030663470044004496, 'weight_decay': 5.71314004549688e-07, 'epochs': 195, 'loss': 'mse', 'optimizer': 'adam', 'graph_mode': 'off', 'use_snp_selection': False}. Best is trial 105 with value: 0.1693502671945205.
[I 2025-11-03 12:06:58,097] Trial 149 finished with value: 0.15472077988615573 and parameters: {'model_type': 'gcn', 'hidden_dims': '[128, 64]', 'dropout': 0.13437979978323408, 'batch_norm': True, 'lr': 0.0007865593596357181, 'weight_decay': 1.0556617517475095e-05, 'epochs': 202, 'loss': 'mae', 'optimizer': 'adam', 'graph_mode': 'off', 'use_snp_selection': True, 'num_snps': 51826}. Best is trial 105 with value: 0.1693502671945205.
[I 2025-11-03 12:07:00,271] Trial 0 finished with value: 0.07483888667768665 and parameters: {'model_type': 'gcn', 'hidden_dims': '[128, 64]', 'dropout': 0.199031432379812, 'batch_norm': True, 'lr': 1.8408544111075837e-06, 'weight_decay': 5.5136510071208614e-05, 'epochs': 336, 'loss': 'mae', 'optimizer': 'adam', 'graph_mode': 'off', 'use_snp_selection': True, 'num_snps': 43862}. Best is trial 0 with value: 0.07483888667768665.
[I 2025-11-03 12:07:01,923] Trial 1 finished with value: 0.09886675633717101 and parameters: {'model_type': 'gcn', 'hidden_dims': '[256, 128]', 'dropout': 0.4370668075331726, 'batch_norm': True, 'lr': 7.133471581159139e-05, 'weight_decay': 1.128633586803549e-05, 'epochs': 242, 'loss': 'mae', 'optimizer': 'adam', 'graph_mode': 'off', 'use_snp_selection': False}. Best is trial 1 with value: 0.09886675633717101.
[I 2025-11-03 12:07:03,061] Trial 2 finished with value: 0.020325107826830648 and parameters: {'model_type': 'gcn', 'hidden_dims': '[256, 128, 64]', 'dropout': 0.41314357415569625, 'batch_norm': False, 'lr': 3.952233718592101e-06, 'weight_decay': 0.00026754769258252603, 'epochs': 149, 'loss': 'mse', 'optimizer': 'adam', 'graph_mode': 'off', 'use_snp_selection': True, 'num_snps': 11571}. Best is trial 1 with value: 0.09886675633717101.
[I 2025-11-03 12:07:05,967] Trial 3 finished with value: -0.0015994711774638642 and parameters: {'model_type': 'gcn', 'hidden_dims': '[512, 64]', 'dropout': 0.5938127374509361, 'batch_norm': False, 'lr': 5.67704586114731e-06, 'weight_decay': 2.4518087630137052e-05, 'epochs': 320, 'loss': 'mae', 'optimizer': 'adam', 'graph_mode': 'off', 'use_snp_selection': False}. Best is trial 1 with value: 0.09886675633717101.
[I 2025-11-03 12:07:08,442] Trial 4 finished with value: -0.03441061342840325 and parameters: {'model_type': 'gcn', 'hidden_dims': '[512, 128]', 'dropout': 0.25746343592134413, 'batch_norm': True, 'lr': 1.3467657668402788e-06, 'weight_decay': 0.00033087251918647806, 'epochs': 277, 'loss': 'mse', 'optimizer': 'adam', 'graph_mode': 'off', 'use_snp_selection': True, 'num_snps': 36675}. Best is trial 1 with value: 0.09886675633717101.
[I 2025-11-03 12:07:10,234] Trial 5 finished with value: 0.014892988505090058 and parameters: {'model_type': 'gcn', 'hidden_dims': '[512, 64]', 'dropout': 0.38275350994408375, 'batch_norm': True, 'lr': 1.5586664309232824e-06, 'weight_decay': 0.0008227664668621182, 'epochs': 145, 'loss': 'mae', 'optimizer': 'adam', 'graph_mode': 'off', 'use_snp_selection': True, 'num_snps': 32148}. Best is trial 1 with value: 0.09886675633717101.
[I 2025-11-03 12:07:11,679] Trial 6 finished with value: 0.035031019533002805 and parameters: {'model_type': 'gcn', 'hidden_dims': '[256, 128]', 'dropout': 0.3930109900265879, 'batch_norm': False, 'lr': 4.892964372128395e-05, 'weight_decay': 1.5809549317992182e-06, 'epochs': 199, 'loss': 'mse', 'optimizer': 'adam', 'graph_mode': 'off', 'use_snp_selection': False}. Best is trial 1 with value: 0.09886675633717101.
[I 2025-11-03 12:07:13,065] Trial 7 finished with value: 0.07008240161100142 and parameters: {'model_type': 'gcn', 'hidden_dims': '[512, 256]', 'dropout': 0.15343979219678458, 'batch_norm': True, 'lr': 6.234003099047341e-05, 'weight_decay': 3.894760610535477e-07, 'epochs': 97, 'loss': 'mse', 'optimizer': 'adam', 'graph_mode': 'off', 'use_snp_selection': False}. Best is trial 1 with value: 0.09886675633717101.
[I 2025-11-03 12:07:15,837] Trial 8 finished with value: 0.11314899756620739 and parameters: {'model_type': 'gcn', 'hidden_dims': '[512, 128]', 'dropout': 0.10743001231661406, 'batch_norm': True, 'lr': 0.00023728538449271062, 'weight_decay': 1.7629071578048637e-05, 'epochs': 312, 'loss': 'mae', 'optimizer': 'adam', 'graph_mode': 'off', 'use_snp_selection': False}. Best is trial 8 with value: 0.11314899756620739.
[I 2025-11-03 12:07:17,708] Trial 9 finished with value: 0.09945892325581829 and parameters: {'model_type': 'gcn', 'hidden_dims': '[512, 64]', 'dropout': 0.14505336736221927, 'batch_norm': True, 'lr': 5.8619638388111826e-05, 'weight_decay': 6.200156172669308e-07, 'epochs': 175, 'loss': 'mse', 'optimizer': 'adam', 'graph_mode': 'off', 'use_snp_selection': False}. Best is trial 8 with value: 0.11314899756620739.
[I 2025-11-03 12:07:18,817] Trial 10 finished with value: 0.012283180050654242 and parameters: {'model_type': 'gcn', 'hidden_dims': '[512, 128]', 'dropout': 0.2800030442581858, 'batch_norm': False, 'lr': 0.0004919806695968257, 'weight_decay': 2.9953888095455486e-06, 'epochs': 55, 'loss': 'mae', 'optimizer': 'adam', 'graph_mode': 'off', 'use_snp_selection': False}. Best is trial 8 with value: 0.11314899756620739.
[I 2025-11-03 12:07:20,999] Trial 11 finished with value: 0.12300276199152466 and parameters: {'model_type': 'gcn', 'hidden_dims': '[512, 128]', 'dropout': 0.10095648685224448, 'batch_norm': True, 'lr': 0.0003411435764085616, 'weight_decay': 1.2045055692919657e-07, 'epochs': 216, 'loss': 'mse', 'optimizer': 'adam', 'graph_mode': 'off', 'use_snp_selection': False}. Best is trial 11 with value: 0.12300276199152466.
[I 2025-11-03 12:07:23,414] Trial 12 finished with value: 0.11423109232783209 and parameters: {'model_type': 'gcn', 'hidden_dims': '[512, 128]', 'dropout': 0.10344600881777158, 'batch_norm': True, 'lr': 0.0006674532614549997, 'weight_decay': 1.3081036432574914e-07, 'epochs': 255, 'loss': 'mae', 'optimizer': 'adam', 'graph_mode': 'off', 'use_snp_selection': False}. Best is trial 11 with value: 0.12300276199152466.
[I 2025-11-03 12:07:25,720] Trial 13 finished with value: 0.12186369231259203 and parameters: {'model_type': 'gcn', 'hidden_dims': '[512, 128]', 'dropout': 0.22096278001553593, 'batch_norm': True, 'lr': 0.0005692918571972218, 'weight_decay': 1.0885943577911259e-07, 'epochs': 236, 'loss': 'mse', 'optimizer': 'adam', 'graph_mode': 'off', 'use_snp_selection': False}. Best is trial 11 with value: 0.12300276199152466.
[I 2025-11-03 12:07:27,908] Trial 14 finished with value: 0.11009519843595121 and parameters: {'model_type': 'gcn', 'hidden_dims': '[512, 128]', 'dropout': 0.23392465516112823, 'batch_norm': True, 'lr': 0.0002108574938852793, 'weight_decay': 1.0444671845585217e-07, 'epochs': 217, 'loss': 'mse', 'optimizer': 'adam', 'graph_mode': 'off', 'use_snp_selection': False}. Best is trial 11 with value: 0.12300276199152466.
[I 2025-11-03 12:07:29,280] Trial 15 finished with value: 0.10922816471128545 and parameters: {'model_type': 'gcn', 'hidden_dims': '[128, 64]', 'dropout': 0.316654910482128, 'batch_norm': True, 'lr': 0.00020129884303790978, 'weight_decay': 3.799898316093095e-07, 'epochs': 288, 'loss': 'mse', 'optimizer': 'adam', 'graph_mode': 'off', 'use_snp_selection': False}. Best is trial 11 with value: 0.12300276199152466.
[I 2025-11-03 12:07:31,023] Trial 16 finished with value: 0.08913599428426539 and parameters: {'model_type': 'gcn', 'hidden_dims': '[256, 128, 64]', 'dropout': 0.1939926453793234, 'batch_norm': True, 'lr': 1.9769161257438765e-05, 'weight_decay': 1.528022915982662e-06, 'epochs': 223, 'loss': 'mse', 'optimizer': 'adam', 'graph_mode': 'off', 'use_snp_selection': False}. Best is trial 11 with value: 0.12300276199152466.
[I 2025-11-03 12:07:32,768] Trial 17 finished with value: 0.11816551290613082 and parameters: {'model_type': 'gcn', 'hidden_dims': '[512, 256]', 'dropout': 0.31793710483525317, 'batch_norm': True, 'lr': 0.000906375209920231, 'weight_decay': 2.5801072347044834e-07, 'epochs': 153, 'loss': 'mse', 'optimizer': 'adam', 'graph_mode': 'off', 'use_snp_selection': False}. Best is trial 11 with value: 0.12300276199152466.
[I 2025-11-03 12:07:35,541] Trial 18 finished with value: 0.07722172578273773 and parameters: {'model_type': 'gcn', 'hidden_dims': '[512, 128]', 'dropout': 0.5098431992326697, 'batch_norm': False, 'lr': 0.00039523703751571243, 'weight_decay': 4.109412643182285e-06, 'epochs': 184, 'loss': 'mse', 'optimizer': 'adam', 'graph_mode': 'off', 'use_snp_selection': True, 'num_snps': 58241}. Best is trial 11 with value: 0.12300276199152466.
[I 2025-11-03 12:07:37,032] Trial 19 finished with value: 0.06842082622082829 and parameters: {'model_type': 'gcn', 'hidden_dims': '[512, 128]', 'dropout': 0.18625362219272576, 'batch_norm': True, 'lr': 2.013931005240395e-05, 'weight_decay': 6.388120178893008e-07, 'epochs': 108, 'loss': 'mse', 'optimizer': 'adam', 'graph_mode': 'off', 'use_snp_selection': False}. Best is trial 11 with value: 0.12300276199152466.
[I 2025-11-03 12:07:39,474] Trial 20 finished with value: 0.11775596107031842 and parameters: {'model_type': 'gcn', 'hidden_dims': '[512, 128]', 'dropout': 0.2333704671534715, 'batch_norm': True, 'lr': 0.00010275910876071159, 'weight_decay': 1.7070827228113143e-07, 'epochs': 260, 'loss': 'mse', 'optimizer': 'adam', 'graph_mode': 'off', 'use_snp_selection': False}. Best is trial 11 with value: 0.12300276199152466.
[I 2025-11-03 12:07:41,101] Trial 21 finished with value: 0.10651276301439923 and parameters: {'model_type': 'gcn', 'hidden_dims': '[512, 256]', 'dropout': 0.3308112928187943, 'batch_norm': True, 'lr': 0.0006952504632145539, 'weight_decay': 2.5680187306128563e-07, 'epochs': 129, 'loss': 'mse', 'optimizer': 'adam', 'graph_mode': 'off', 'use_snp_selection': False}. Best is trial 11 with value: 0.12300276199152466.
[I 2025-11-03 12:07:42,917] Trial 22 finished with value: 0.13056895679760083 and parameters: {'model_type': 'gcn', 'hidden_dims': '[512, 256]', 'dropout': 0.298388823040876, 'batch_norm': True, 'lr': 0.0009148532821511736, 'weight_decay': 1.0790082404688784e-07, 'epochs': 162, 'loss': 'mse', 'optimizer': 'adam', 'graph_mode': 'off', 'use_snp_selection': False}. Best is trial 22 with value: 0.13056895679760083.
[I 2025-11-03 12:07:45,142] Trial 23 finished with value: 0.11425010905843395 and parameters: {'model_type': 'gcn', 'hidden_dims': '[512, 256]', 'dropout': 0.16726103521983995, 'batch_norm': True, 'lr': 0.0003016140254855497, 'weight_decay': 1.0046078905342336e-07, 'epochs': 229, 'loss': 'mse', 'optimizer': 'adam', 'graph_mode': 'off', 'use_snp_selection': False}. Best is trial 22 with value: 0.13056895679760083.
[I 2025-11-03 12:07:47,183] Trial 24 finished with value: 0.10455110339997226 and parameters: {'model_type': 'gcn', 'hidden_dims': '[512, 256]', 'dropout': 0.2782976747272272, 'batch_norm': True, 'lr': 0.00012933696064794652, 'weight_decay': 8.77509410131123e-07, 'epochs': 199, 'loss': 'mse', 'optimizer': 'adam', 'graph_mode': 'off', 'use_snp_selection': False}. Best is trial 22 with value: 0.13056895679760083.
