[I 2025-11-03 12:55:52,164] Trial 84 finished with value: 0.06794739725702444 and parameters: {'model_type': 'gcn', 'hidden_dims': '[128, 64]', 'dropout': 0.1442845615603599, 'batch_norm': True, 'lr': 4.936393654937418e-05, 'weight_decay': 0.00010010132026445245, 'epochs': 76, 'loss': 'mse', 'optimizer': 'adam', 'graph_mode': 'cutoff', 'cutoff': 0.6943729057219448, 'grm_norm': 'cosine_then_gcn', 'self_loops': True, 'use_snp_selection': False}. Best is trial 71 with value: 0.06901665353648391.
[I 2025-11-03 12:55:53,370] Trial 85 finished with value: 0.02063372904212689 and parameters: {'model_type': 'gcn', 'hidden_dims': '[128, 64]', 'dropout': 0.1437351790927493, 'batch_norm': True, 'lr': 1.7275428464933007e-05, 'weight_decay': 0.00031108145208622815, 'epochs': 75, 'loss': 'mse', 'optimizer': 'adam', 'graph_mode': 'cutoff', 'cutoff': 0.8659341304460472, 'grm_norm': 'cosine_then_gcn', 'self_loops': True, 'use_snp_selection': False}. Best is trial 71 with value: 0.06901665353648391.
[I 2025-11-03 12:55:55,684] Trial 86 finished with value: 0.01898872479095865 and parameters: {'model_type': 'gcn', 'hidden_dims': '[128, 64]', 'dropout': 0.16938675564398398, 'batch_norm': False, 'lr': 2.7992859750541023e-05, 'weight_decay': 9.317816351026899e-05, 'epochs': 66, 'loss': 'mse', 'optimizer': 'adam', 'graph_mode': 'cutoff', 'cutoff': 0.8130462629313653, 'grm_norm': 'cosine_then_gcn', 'self_loops': False, 'use_snp_selection': True, 'num_snps': 39451}. Best is trial 71 with value: 0.06901665353648391.
[I 2025-11-03 12:55:57,003] Trial 87 finished with value: 0.04441754328944537 and parameters: {'model_type': 'gcn', 'hidden_dims': '[128, 64]', 'dropout': 0.19798088081721496, 'batch_norm': True, 'lr': 3.5777246786973005e-05, 'weight_decay': 9.866029946904665e-05, 'epochs': 93, 'loss': 'mse', 'optimizer': 'adam', 'graph_mode': 'cutoff', 'cutoff': 0.7634067158298243, 'grm_norm': 'cosine_then_gcn', 'self_loops': True, 'use_snp_selection': False}. Best is trial 71 with value: 0.06901665353648391.
[I 2025-11-03 12:55:58,841] Trial 88 finished with value: -0.01290970632612387 and parameters: {'model_type': 'gcn', 'hidden_dims': '[256, 128, 64]', 'dropout': 0.12760848559135085, 'batch_norm': True, 'lr': 1.4617323170918307e-05, 'weight_decay': 0.0008855716950362942, 'epochs': 142, 'loss': 'mae', 'optimizer': 'adam', 'graph_mode': 'cutoff', 'cutoff': 0.7024719488754492, 'grm_norm': 'cosine_then_gcn', 'self_loops': False, 'use_snp_selection': False}. Best is trial 71 with value: 0.06901665353648391.
[I 2025-11-03 12:56:00,088] Trial 89 finished with value: 0.044180202445825344 and parameters: {'model_type': 'gcn', 'hidden_dims': '[128, 64]', 'dropout': 0.11654166096459512, 'batch_norm': True, 'lr': 5.202294535902763e-05, 'weight_decay': 0.00040518255225914735, 'epochs': 87, 'loss': 'mse', 'optimizer': 'adam', 'graph_mode': 'cutoff', 'cutoff': 0.846538884506147, 'grm_norm': 'cosine_then_gcn', 'self_loops': True, 'use_snp_selection': False}. Best is trial 71 with value: 0.06901665353648391.
[I 2025-11-03 12:56:02,073] Trial 90 finished with value: 0.025659411061138167 and parameters: {'model_type': 'gcn', 'hidden_dims': '[128, 64]', 'dropout': 0.1485564583184636, 'batch_norm': False, 'lr': 6.714316075416945e-05, 'weight_decay': 4.019983636325471e-05, 'epochs': 102, 'loss': 'mse', 'optimizer': 'adam', 'graph_mode': 'cutoff', 'cutoff': 0.7715256628174177, 'grm_norm': 'gcn', 'self_loops': False, 'use_snp_selection': True, 'num_snps': 26270}. Best is trial 71 with value: 0.06901665353648391.
[I 2025-11-03 12:56:03,283] Trial 91 finished with value: 0.04548976911608568 and parameters: {'model_type': 'gcn', 'hidden_dims': '[128, 64]', 'dropout': 0.13404215388272317, 'batch_norm': True, 'lr': 1.8696692555113574e-05, 'weight_decay': 2.706984010135994e-05, 'epochs': 63, 'loss': 'mse', 'optimizer': 'adam', 'graph_mode': 'cutoff', 'cutoff': 0.7350042435255673, 'grm_norm': 'cosine_then_gcn', 'self_loops': True, 'use_snp_selection': False}. Best is trial 71 with value: 0.06901665353648391.
[I 2025-11-03 12:56:04,817] Trial 92 finished with value: 0.034519374569497774 and parameters: {'model_type': 'gcn', 'hidden_dims': '[512, 256]', 'dropout': 0.2027565978055243, 'batch_norm': True, 'lr': 2.5122220060357243e-05, 'weight_decay': 0.0006838897356296717, 'epochs': 35, 'loss': 'mse', 'optimizer': 'adam', 'graph_mode': 'cutoff', 'cutoff': 0.6850449939005145, 'grm_norm': 'gcn', 'self_loops': True, 'use_snp_selection': False}. Best is trial 71 with value: 0.06901665353648391.
[I 2025-11-03 12:56:06,031] Trial 93 finished with value: 0.05393081349273507 and parameters: {'model_type': 'gcn', 'hidden_dims': '[128, 64]', 'dropout': 0.2382908782191876, 'batch_norm': True, 'lr': 4.46965842826932e-05, 'weight_decay': 6.674401868387591e-05, 'epochs': 79, 'loss': 'mse', 'optimizer': 'adam', 'graph_mode': 'cutoff', 'cutoff': 0.6381522854306322, 'grm_norm': 'cosine', 'self_loops': True, 'use_snp_selection': False}. Best is trial 71 with value: 0.06901665353648391.
[I 2025-11-03 12:56:07,255] Trial 94 finished with value: 0.02521564810231104 and parameters: {'model_type': 'gcn', 'hidden_dims': '[128, 64]', 'dropout': 0.2395739483430728, 'batch_norm': True, 'lr': 1.2013483957027758e-05, 'weight_decay': 4.9459768448746044e-05, 'epochs': 78, 'loss': 'mse', 'optimizer': 'adam', 'graph_mode': 'cutoff', 'cutoff': 0.8756054902039581, 'grm_norm': 'cosine', 'self_loops': True, 'use_snp_selection': False}. Best is trial 71 with value: 0.06901665353648391.
[I 2025-11-03 12:56:08,597] Trial 95 finished with value: 0.01758999091102496 and parameters: {'model_type': 'gcn', 'hidden_dims': '[128, 64]', 'dropout': 0.21980530740992474, 'batch_norm': True, 'lr': 2.0048961245014394e-05, 'weight_decay': 6.9214746781382e-05, 'epochs': 110, 'loss': 'mse', 'optimizer': 'adam', 'graph_mode': 'cutoff', 'cutoff': 0.625613441448327, 'grm_norm': 'cosine', 'self_loops': True, 'use_snp_selection': False}. Best is trial 71 with value: 0.06901665353648391.
[I 2025-11-03 12:56:10,560] Trial 96 finished with value: 0.04810822891202455 and parameters: {'model_type': 'gcn', 'hidden_dims': '[128, 64]', 'dropout': 0.1635030256622225, 'batch_norm': True, 'lr': 0.00014497502077058993, 'weight_decay': 0.00012055866741199859, 'epochs': 313, 'loss': 'mse', 'optimizer': 'adam', 'graph_mode': 'cutoff', 'cutoff': 0.8177204163236628, 'grm_norm': 'cosine', 'self_loops': False, 'use_snp_selection': False}. Best is trial 71 with value: 0.06901665353648391.
[I 2025-11-03 12:56:12,406] Trial 97 finished with value: 0.04283342311898516 and parameters: {'model_type': 'gcn', 'hidden_dims': '[128, 64]', 'dropout': 0.19503263496328196, 'batch_norm': True, 'lr': 6.832563754493079e-06, 'weight_decay': 6.167021954850829e-05, 'epochs': 283, 'loss': 'mse', 'optimizer': 'adam', 'graph_mode': 'cutoff', 'cutoff': 0.6532389395283722, 'grm_norm': 'cosine', 'self_loops': True, 'use_snp_selection': False}. Best is trial 71 with value: 0.06901665353648391.
[I 2025-11-03 12:56:14,425] Trial 98 finished with value: 0.056561632530638235 and parameters: {'model_type': 'gcn', 'hidden_dims': '[256, 128]', 'dropout': 0.18756353874903678, 'batch_norm': True, 'lr': 3.3828581843180104e-05, 'weight_decay': 0.0004791536659281502, 'epochs': 215, 'loss': 'mse', 'optimizer': 'adam', 'graph_mode': 'cutoff', 'cutoff': 0.6990739203004388, 'grm_norm': 'gcn', 'self_loops': False, 'use_snp_selection': False}. Best is trial 71 with value: 0.06901665353648391.
[I 2025-11-03 12:56:17,992] Trial 99 finished with value: -0.00448336329577388 and parameters: {'model_type': 'gcn', 'hidden_dims': '[256, 128]', 'dropout': 0.1785922520523429, 'batch_norm': False, 'lr': 4.784165113798612e-05, 'weight_decay': 0.0005354778517900093, 'epochs': 253, 'loss': 'mse', 'optimizer': 'adam', 'graph_mode': 'cutoff', 'cutoff': 0.7017594121967657, 'grm_norm': 'gcn', 'self_loops': False, 'use_snp_selection': True, 'num_snps': 50053}. Best is trial 71 with value: 0.06901665353648391.
[I 2025-11-03 12:56:20,342] Trial 100 finished with value: 0.010018149458930538 and parameters: {'model_type': 'gcn', 'hidden_dims': '[256, 128, 64]', 'dropout': 0.21252723370745502, 'batch_norm': True, 'lr': 6.587409549284199e-05, 'weight_decay': 1.4237601359976768e-05, 'epochs': 233, 'loss': 'mse', 'optimizer': 'adam', 'graph_mode': 'cutoff', 'cutoff': 0.7229098089875278, 'grm_norm': 'gcn', 'self_loops': False, 'use_snp_selection': False}. Best is trial 71 with value: 0.06901665353648391.
[I 2025-11-03 12:56:21,944] Trial 101 finished with value: 0.020188565380215493 and parameters: {'model_type': 'gcn', 'hidden_dims': '[128, 64]', 'dropout': 0.1864866764800739, 'batch_norm': True, 'lr': 3.2232017410456444e-05, 'weight_decay': 0.0004742809735576669, 'epochs': 208, 'loss': 'mse', 'optimizer': 'adam', 'graph_mode': 'cutoff', 'cutoff': 0.7851615600787365, 'grm_norm': 'gcn', 'self_loops': False, 'use_snp_selection': False}. Best is trial 71 with value: 0.06901665353648391.
[I 2025-11-03 12:56:23,791] Trial 102 finished with value: 0.02574865883879933 and parameters: {'model_type': 'gcn', 'hidden_dims': '[256, 128]', 'dropout': 0.10061145302450228, 'batch_norm': True, 'lr': 1.3914959515538659e-05, 'weight_decay': 0.0002726505768604731, 'epochs': 183, 'loss': 'mse', 'optimizer': 'adam', 'graph_mode': 'cutoff', 'cutoff': 0.752664391324813, 'grm_norm': 'gcn', 'self_loops': False, 'use_snp_selection': False}. Best is trial 71 with value: 0.06901665353648391.
[I 2025-11-03 12:56:25,158] Trial 103 finished with value: 0.03193911255920986 and parameters: {'model_type': 'gcn', 'hidden_dims': '[256, 128]', 'dropout': 0.13104023735074788, 'batch_norm': True, 'lr': 2.4933128990369872e-05, 'weight_decay': 0.00020023465750165442, 'epochs': 71, 'loss': 'mse', 'optimizer': 'adam', 'graph_mode': 'cutoff', 'cutoff': 0.6908881844558078, 'grm_norm': 'cosine', 'self_loops': False, 'use_snp_selection': False}. Best is trial 71 with value: 0.06901665353648391.
[I 2025-11-03 12:56:27,424] Trial 104 finished with value: 0.01958158812005686 and parameters: {'model_type': 'gcn', 'hidden_dims': '[256, 128]', 'dropout': 0.11169870512414978, 'batch_norm': True, 'lr': 1.6386501375187314e-05, 'weight_decay': 2.055526614722837e-05, 'epochs': 276, 'loss': 'mse', 'optimizer': 'adam', 'graph_mode': 'cutoff', 'cutoff': 0.5484576192494843, 'grm_norm': 'cosine_then_gcn', 'self_loops': True, 'use_snp_selection': False}. Best is trial 71 with value: 0.06901665353648391.
[I 2025-11-03 12:56:29,319] Trial 105 finished with value: 0.005407091705549772 and parameters: {'model_type': 'gcn', 'hidden_dims': '[512, 256]', 'dropout': 0.16022583200014257, 'batch_norm': True, 'lr': 3.52222450582673e-05, 'weight_decay': 0.0001201531093099947, 'epochs': 97, 'loss': 'mse', 'optimizer': 'adam', 'graph_mode': 'cutoff', 'cutoff': 0.4129032524023858, 'grm_norm': 'gcn', 'self_loops': True, 'use_snp_selection': False}. Best is trial 71 with value: 0.06901665353648391.
[I 2025-11-03 12:56:30,977] Trial 106 finished with value: 0.018679824262061964 and parameters: {'model_type': 'gcn', 'hidden_dims': '[128, 64]', 'dropout': 0.23182881465075422, 'batch_norm': True, 'lr': 2.703699133309856e-05, 'weight_decay': 0.0003684900511117449, 'epochs': 217, 'loss': 'mae', 'optimizer': 'adam', 'graph_mode': 'cutoff', 'cutoff': 0.6616543293922218, 'grm_norm': 'cosine_then_gcn', 'self_loops': False, 'use_snp_selection': False}. Best is trial 71 with value: 0.06901665353648391.
[I 2025-11-03 12:56:32,785] Trial 107 finished with value: 0.0026939046198214043 and parameters: {'model_type': 'gcn', 'hidden_dims': '[128, 64]', 'dropout': 0.14389010677803282, 'batch_norm': True, 'lr': 3.922827270703437e-05, 'weight_decay': 0.0006654294228437716, 'epochs': 259, 'loss': 'mse', 'optimizer': 'adam', 'graph_mode': 'cutoff', 'cutoff': 0.8356069360651521, 'grm_norm': 'cosine', 'self_loops': True, 'use_snp_selection': False}. Best is trial 71 with value: 0.06901665353648391.
[I 2025-11-03 12:56:34,615] Trial 108 finished with value: 0.019854748656926206 and parameters: {'model_type': 'gcn', 'hidden_dims': '[256, 128]', 'dropout': 0.18987361669169672, 'batch_norm': True, 'lr': 9.970944991193125e-06, 'weight_decay': 3.6921997792238964e-05, 'epochs': 168, 'loss': 'mse', 'optimizer': 'adam', 'graph_mode': 'cutoff', 'cutoff': 0.8079502386471658, 'grm_norm': 'gcn', 'self_loops': False, 'use_snp_selection': False}. Best is trial 71 with value: 0.06901665353648391.
[I 2025-11-03 12:56:37,558] Trial 109 finished with value: 0.026726810553781594 and parameters: {'model_type': 'gcn', 'hidden_dims': '[128, 64]', 'dropout': 0.24548682664898358, 'batch_norm': False, 'lr': 1.9839412542520057e-05, 'weight_decay': 8.214408693174136e-05, 'epochs': 83, 'loss': 'mse', 'optimizer': 'adam', 'graph_mode': 'cutoff', 'cutoff': 0.7152373385956527, 'grm_norm': 'cosine_then_gcn', 'self_loops': True, 'use_snp_selection': True, 'num_snps': 55830}. Best is trial 71 with value: 0.06901665353648391.
[I 2025-11-03 12:56:40,127] Trial 110 finished with value: 0.014034136031377403 and parameters: {'model_type': 'gcn', 'hidden_dims': '[512, 256]', 'dropout': 0.17744245485887766, 'batch_norm': True, 'lr': 0.00012111369438300862, 'weight_decay': 5.095970564103359e-05, 'epochs': 195, 'loss': 'mse', 'optimizer': 'adam', 'graph_mode': 'cutoff', 'cutoff': 0.8770242506069096, 'grm_norm': 'cosine_then_gcn', 'self_loops': True, 'use_snp_selection': False}. Best is trial 71 with value: 0.06901665353648391.
[I 2025-11-03 12:56:41,740] Trial 111 finished with value: 0.011660826723643594 and parameters: {'model_type': 'gcn', 'hidden_dims': '[512, 128]', 'dropout': 0.3213125383425727, 'batch_norm': True, 'lr': 4.061119493780469e-05, 'weight_decay': 1.22688874231456e-05, 'epochs': 57, 'loss': 'mse', 'optimizer': 'adam', 'graph_mode': 'cutoff', 'cutoff': 0.676840974992204, 'grm_norm': 'none', 'self_loops': True, 'use_snp_selection': False}. Best is trial 71 with value: 0.06901665353648391.
[I 2025-11-03 12:56:42,753] Trial 112 finished with value: 0.04758256244952338 and parameters: {'model_type': 'gcn', 'hidden_dims': '[128, 64]', 'dropout': 0.303224962050364, 'batch_norm': True, 'lr': 8.199947771027985e-05, 'weight_decay': 3.0447775894709256e-05, 'epochs': 18, 'loss': 'mse', 'optimizer': 'adam', 'graph_mode': 'cutoff', 'cutoff': 0.7414493918045459, 'grm_norm': 'none', 'self_loops': True, 'use_snp_selection': False}. Best is trial 71 with value: 0.06901665353648391.
[I 2025-11-03 12:56:44,304] Trial 113 finished with value: 0.007969994112854366 and parameters: {'model_type': 'gcn', 'hidden_dims': '[512, 64]', 'dropout': 0.2109206848193579, 'batch_norm': True, 'lr': 4.639542242646194e-05, 'weight_decay': 2.3002999414219403e-05, 'epochs': 42, 'loss': 'mse', 'optimizer': 'adam', 'graph_mode': 'cutoff', 'cutoff': 0.6376393414864001, 'grm_norm': 'none', 'self_loops': True, 'use_snp_selection': False}. Best is trial 71 with value: 0.06901665353648391.
[I 2025-11-03 12:56:45,954] Trial 114 finished with value: 0.0007994616748489836 and parameters: {'model_type': 'gcn', 'hidden_dims': '[512, 128]', 'dropout': 0.279464165963577, 'batch_norm': True, 'lr': 0.00010214039440864247, 'weight_decay': 1.771442972090816e-05, 'epochs': 63, 'loss': 'mse', 'optimizer': 'adam', 'graph_mode': 'cutoff', 'cutoff': 0.6081615764575424, 'grm_norm': 'none', 'self_loops': True, 'use_snp_selection': False}. Best is trial 71 with value: 0.06901665353648391.
[I 2025-11-03 12:56:47,098] Trial 115 finished with value: -0.0038208311226580935 and parameters: {'model_type': 'gcn', 'hidden_dims': '[128, 64]', 'dropout': 0.3551474129419786, 'batch_norm': True, 'lr': 5.6072239846227576e-05, 'weight_decay': 8.170862463442298e-06, 'epochs': 51, 'loss': 'mse', 'optimizer': 'adam', 'graph_mode': 'cutoff', 'cutoff': 0.6728613304680182, 'grm_norm': 'gcn', 'self_loops': True, 'use_snp_selection': False}. Best is trial 71 with value: 0.06901665353648391.
[I 2025-11-03 12:56:48,504] Trial 116 finished with value: 0.01779947989038754 and parameters: {'model_type': 'gcn', 'hidden_dims': '[128, 64]', 'dropout': 0.2600434253139033, 'batch_norm': True, 'lr': 1.4661233123132674e-05, 'weight_decay': 2.875514377622769e-05, 'epochs': 119, 'loss': 'mse', 'optimizer': 'adam', 'graph_mode': 'cutoff', 'cutoff': 0.6950830276215768, 'grm_norm': 'cosine', 'self_loops': False, 'use_snp_selection': False}. Best is trial 71 with value: 0.06901665353648391.
[I 2025-11-03 12:56:50,251] Trial 117 finished with value: 0.03367735773570721 and parameters: {'model_type': 'gcn', 'hidden_dims': '[512, 128]', 'dropout': 0.12063075308816164, 'batch_norm': True, 'lr': 2.7279331872829962e-05, 'weight_decay': 6.270837481168704e-05, 'epochs': 74, 'loss': 'mse', 'optimizer': 'adam', 'graph_mode': 'cutoff', 'cutoff': 0.7759761623708974, 'grm_norm': 'cosine_then_gcn', 'self_loops': True, 'use_snp_selection': False}. Best is trial 71 with value: 0.06901665353648391.
[I 2025-11-03 12:56:51,725] Trial 118 finished with value: 0.03740131174687729 and parameters: {'model_type': 'gcn', 'hidden_dims': '[256, 128]', 'dropout': 0.12744173667721892, 'batch_norm': True, 'lr': 3.346112433417001e-05, 'weight_decay': 3.748004753808579e-05, 'epochs': 91, 'loss': 'mse', 'optimizer': 'adam', 'graph_mode': 'cutoff', 'cutoff': 0.5652840308979596, 'grm_norm': 'cosine_then_gcn', 'self_loops': False, 'use_snp_selection': False}. Best is trial 71 with value: 0.06901665353648391.
[I 2025-11-03 12:56:53,175] Trial 119 finished with value: -0.021368742602190644 and parameters: {'model_type': 'gcn', 'hidden_dims': '[128, 64]', 'dropout': 0.15126042219272498, 'batch_norm': True, 'lr': 1.2481337415658805e-06, 'weight_decay': 4.463112980896849e-05, 'epochs': 149, 'loss': 'mse', 'optimizer': 'adam', 'graph_mode': 'cutoff', 'cutoff': 0.8475581886036777, 'grm_norm': 'none', 'self_loops': True, 'use_snp_selection': False}. Best is trial 71 with value: 0.06901665353648391.
[I 2025-11-03 12:56:55,468] Trial 120 finished with value: 0.06178137762778865 and parameters: {'model_type': 'gcn', 'hidden_dims': '[256, 128, 64]', 'dropout': 0.223803434068997, 'batch_norm': False, 'lr': 6.232263105456077e-05, 'weight_decay': 0.00010883430359721163, 'epochs': 187, 'loss': 'mae', 'optimizer': 'adam', 'graph_mode': 'cutoff', 'cutoff': 0.8001405565397045, 'grm_norm': 'gcn', 'self_loops': True, 'use_snp_selection': True, 'num_snps': 21889}. Best is trial 71 with value: 0.06901665353648391.
[I 2025-11-03 12:56:57,861] Trial 121 finished with value: 0.019099693201912436 and parameters: {'model_type': 'gcn', 'hidden_dims': '[256, 128, 64]', 'dropout': 0.22642493390156992, 'batch_norm': False, 'lr': 7.034210318479061e-05, 'weight_decay': 0.00010194717085503466, 'epochs': 228, 'loss': 'mae', 'optimizer': 'adam', 'graph_mode': 'cutoff', 'cutoff': 0.794466290888643, 'grm_norm': 'gcn', 'self_loops': True, 'use_snp_selection': True, 'num_snps': 20262}. Best is trial 71 with value: 0.06901665353648391.
[I 2025-11-03 12:56:59,687] Trial 122 finished with value: 0.035734224936270195 and parameters: {'model_type': 'gcn', 'hidden_dims': '[256, 128, 64]', 'dropout': 0.27388002338249934, 'batch_norm': False, 'lr': 2.2771000136607664e-05, 'weight_decay': 0.0001945214235426001, 'epochs': 184, 'loss': 'mae', 'optimizer': 'adam', 'graph_mode': 'cutoff', 'cutoff': 0.7593809190566236, 'grm_norm': 'gcn', 'self_loops': True, 'use_snp_selection': True, 'num_snps': 6638}. Best is trial 71 with value: 0.06901665353648391.
[I 2025-11-03 12:57:01,776] Trial 123 finished with value: 0.025144098316193114 and parameters: {'model_type': 'gcn', 'hidden_dims': '[256, 128, 64]', 'dropout': 0.2107589269217821, 'batch_norm': False, 'lr': 6.06531222100138e-05, 'weight_decay': 0.0001492414158679054, 'epochs': 82, 'loss': 'mae', 'optimizer': 'adam', 'graph_mode': 'cutoff', 'cutoff': 0.8142829127571914, 'grm_norm': 'gcn', 'self_loops': True, 'use_snp_selection': True, 'num_snps': 26304}. Best is trial 71 with value: 0.06901665353648391.
[I 2025-11-03 12:57:04,013] Trial 124 finished with value: 0.04342662355487473 and parameters: {'model_type': 'gcn', 'hidden_dims': '[256, 128, 64]', 'dropout': 0.11234472732832042, 'batch_norm': False, 'lr': 4.285774189936377e-05, 'weight_decay': 8.511378988576595e-05, 'epochs': 201, 'loss': 'mae', 'optimizer': 'adam', 'graph_mode': 'cutoff', 'cutoff': 0.7313922247942186, 'grm_norm': 'gcn', 'self_loops': True, 'use_snp_selection': True, 'num_snps': 16121}. Best is trial 71 with value: 0.06901665353648391.
[I 2025-11-03 12:57:06,194] Trial 125 finished with value: 0.02229586099130575 and parameters: {'model_type': 'gcn', 'hidden_dims': '[512, 64]', 'dropout': 0.24447908112819022, 'batch_norm': False, 'lr': 4.762151548808425e-05, 'weight_decay': 2.318226041475623e-05, 'epochs': 49, 'loss': 'mae', 'optimizer': 'adam', 'graph_mode': 'cutoff', 'cutoff': 0.8371903778824605, 'grm_norm': 'cosine_then_gcn', 'self_loops': True, 'use_snp_selection': True, 'num_snps': 29341}. Best is trial 71 with value: 0.06901665353648391.
[I 2025-11-03 12:57:08,474] Trial 126 finished with value: 0.014706909453277498 and parameters: {'model_type': 'gcn', 'hidden_dims': '[512, 256]', 'dropout': 0.13825400868231585, 'batch_norm': True, 'lr': 0.00012921995714381432, 'weight_decay': 5.296890865955745e-05, 'epochs': 133, 'loss': 'mse', 'optimizer': 'adam', 'graph_mode': 'cutoff', 'cutoff': 0.2950255031902218, 'grm_norm': 'cosine', 'self_loops': False, 'use_snp_selection': False}. Best is trial 71 with value: 0.06901665353648391.
[I 2025-11-03 12:57:10,067] Trial 127 finished with value: 0.036506059952340436 and parameters: {'model_type': 'gcn', 'hidden_dims': '[128, 64]', 'dropout': 0.28992851495429367, 'batch_norm': True, 'lr': 9.140057438176707e-05, 'weight_decay': 6.638013748220657e-06, 'epochs': 174, 'loss': 'mse', 'optimizer': 'adam', 'graph_mode': 'cutoff', 'cutoff': 0.7134080835208199, 'grm_norm': 'cosine_then_gcn', 'self_loops': True, 'use_snp_selection': False}. Best is trial 71 with value: 0.06901665353648391.
