[I 2025-11-03 11:45:30,535] Trial 6 finished with value: 0.032549220929141615 and parameters: {'model_type': 'gcn', 'hidden_dims': '[256, 128]', 'dropout': 0.3930109900265879, 'batch_norm': False, 'lr': 4.892964372128395e-05, 'weight_decay': 1.5809549317992182e-06, 'epochs': 199, 'loss': 'mse', 'optimizer': 'adam', 'graph_mode': 'off', 'use_snp_selection': False}. Best is trial 2 with value: 0.05181563861721407.
[I 2025-11-03 11:45:31,883] Trial 7 finished with value: 0.026656490705794136 and parameters: {'model_type': 'gcn', 'hidden_dims': '[512, 256]', 'dropout': 0.15343979219678458, 'batch_norm': True, 'lr': 6.234003099047341e-05, 'weight_decay': 3.894760610535477e-07, 'epochs': 97, 'loss': 'mse', 'optimizer': 'adam', 'graph_mode': 'off', 'use_snp_selection': False}. Best is trial 2 with value: 0.05181563861721407.
[I 2025-11-03 11:45:34,575] Trial 8 finished with value: 0.03093858243406477 and parameters: {'model_type': 'gcn', 'hidden_dims': '[512, 128]', 'dropout': 0.10743001231661406, 'batch_norm': True, 'lr': 0.00023728538449271062, 'weight_decay': 1.7629071578048637e-05, 'epochs': 312, 'loss': 'mae', 'optimizer': 'adam', 'graph_mode': 'off', 'use_snp_selection': False}. Best is trial 2 with value: 0.05181563861721407.
[I 2025-11-03 11:45:36,391] Trial 9 finished with value: -0.0006994700102760592 and parameters: {'model_type': 'gcn', 'hidden_dims': '[512, 64]', 'dropout': 0.14505336736221927, 'batch_norm': True, 'lr': 5.8619638388111826e-05, 'weight_decay': 6.200156172669308e-07, 'epochs': 175, 'loss': 'mse', 'optimizer': 'adam', 'graph_mode': 'off', 'use_snp_selection': False}. Best is trial 2 with value: 0.05181563861721407.
[I 2025-11-03 11:45:37,037] Trial 10 finished with value: -0.03417389907805797 and parameters: {'model_type': 'gcn', 'hidden_dims': '[256, 128, 64]', 'dropout': 0.5344471988899759, 'batch_norm': False, 'lr': 1.080428984628536e-05, 'weight_decay': 0.00013977662613780072, 'epochs': 43, 'loss': 'mse', 'optimizer': 'adam', 'graph_mode': 'off', 'use_snp_selection': True, 'num_snps': 4154}. Best is trial 2 with value: 0.05181563861721407.
[I 2025-11-03 11:45:38,141] Trial 11 finished with value: 0.019144983217398746 and parameters: {'model_type': 'gcn', 'hidden_dims': '[256, 128]', 'dropout': 0.4556279307248699, 'batch_norm': False, 'lr': 0.0006579145291493049, 'weight_decay': 4.528256227746403e-06, 'epochs': 240, 'loss': 'mae', 'optimizer': 'adam', 'graph_mode': 'off', 'use_snp_selection': True, 'num_snps': 6849}. Best is trial 2 with value: 0.05181563861721407.
[I 2025-11-03 11:45:39,656] Trial 12 finished with value: 0.029672888628654484 and parameters: {'model_type': 'gcn', 'hidden_dims': '[256, 128, 64]', 'dropout': 0.30778189624818614, 'batch_norm': False, 'lr': 1.5635974602051994e-05, 'weight_decay': 4.702096964630499e-06, 'epochs': 219, 'loss': 'mse', 'optimizer': 'adam', 'graph_mode': 'off', 'use_snp_selection': True, 'num_snps': 17715}. Best is trial 2 with value: 0.05181563861721407.
[I 2025-11-03 11:45:40,744] Trial 13 finished with value: 0.04910023211411953 and parameters: {'model_type': 'gcn', 'hidden_dims': '[256, 128]', 'dropout': 0.4642522719331128, 'batch_norm': False, 'lr': 0.00025601792781129566, 'weight_decay': 1.3917882897272238e-07, 'epochs': 132, 'loss': 'mae', 'optimizer': 'adam', 'graph_mode': 'off', 'use_snp_selection': False}. Best is trial 2 with value: 0.05181563861721407.
[I 2025-11-03 11:45:41,933] Trial 14 finished with value: -0.0014247007361436871 and parameters: {'model_type': 'gcn', 'hidden_dims': '[256, 128, 64]', 'dropout': 0.4694336147469494, 'batch_norm': False, 'lr': 0.000999951197374498, 'weight_decay': 1.9066300525955814e-07, 'epochs': 130, 'loss': 'mae', 'optimizer': 'adam', 'graph_mode': 'off', 'use_snp_selection': False}. Best is trial 2 with value: 0.05181563861721407.
[I 2025-11-03 11:45:42,900] Trial 15 finished with value: 0.03603316192334221 and parameters: {'model_type': 'gcn', 'hidden_dims': '[128, 64]', 'dropout': 0.3203534049388236, 'batch_norm': False, 'lr': 0.0001649682079330494, 'weight_decay': 7.706714155290695e-05, 'epochs': 73, 'loss': 'mse', 'optimizer': 'adam', 'graph_mode': 'off', 'use_snp_selection': True, 'num_snps': 19637}. Best is trial 2 with value: 0.05181563861721407.
[I 2025-11-03 11:45:44,557] Trial 16 finished with value: 0.014932584214085644 and parameters: {'model_type': 'gcn', 'hidden_dims': '[512, 256]', 'dropout': 0.5333375447695154, 'batch_norm': False, 'lr': 4.4104393187832995e-06, 'weight_decay': 1.2142465685620477e-07, 'epochs': 143, 'loss': 'mae', 'optimizer': 'adam', 'graph_mode': 'off', 'use_snp_selection': False}. Best is trial 2 with value: 0.05181563861721407.
[I 2025-11-03 11:45:46,779] Trial 17 finished with value: 0.05965903896429322 and parameters: {'model_type': 'gcn', 'hidden_dims': '[256, 128, 64]', 'dropout': 0.5079515867190039, 'batch_norm': False, 'lr': 0.0002206058349202303, 'weight_decay': 0.0009155030134839949, 'epochs': 173, 'loss': 'mse', 'optimizer': 'adam', 'graph_mode': 'off', 'use_snp_selection': True, 'num_snps': 54776}. Best is trial 17 with value: 0.05965903896429322.
[I 2025-11-03 11:45:49,213] Trial 18 finished with value: 0.037210962857615555 and parameters: {'model_type': 'gcn', 'hidden_dims': '[256, 128, 64]', 'dropout': 0.5265735226191754, 'batch_norm': False, 'lr': 3.83550102460855e-06, 'weight_decay': 0.000922433099068622, 'epochs': 187, 'loss': 'mse', 'optimizer': 'adam', 'graph_mode': 'off', 'use_snp_selection': True, 'num_snps': 57068}. Best is trial 17 with value: 0.05965903896429322.
[I 2025-11-03 11:45:51,237] Trial 19 finished with value: -0.010751949161657367 and parameters: {'model_type': 'gcn', 'hidden_dims': '[256, 128, 64]', 'dropout': 0.5781787809354858, 'batch_norm': False, 'lr': 2.189531033008616e-05, 'weight_decay': 0.00029405442291425144, 'epochs': 110, 'loss': 'mse', 'optimizer': 'adam', 'graph_mode': 'off', 'use_snp_selection': True, 'num_snps': 57174}. Best is trial 17 with value: 0.05965903896429322.
[I 2025-11-03 11:45:52,573] Trial 20 finished with value: 0.01739165983056173 and parameters: {'model_type': 'gcn', 'hidden_dims': '[256, 128, 64]', 'dropout': 0.3765552697318014, 'batch_norm': False, 'lr': 0.00043980856967993417, 'weight_decay': 0.000295719193404006, 'epochs': 173, 'loss': 'mse', 'optimizer': 'adam', 'graph_mode': 'off', 'use_snp_selection': True, 'num_snps': 19782}. Best is trial 17 with value: 0.05965903896429322.
[I 2025-11-03 11:45:54,289] Trial 21 finished with value: 0.04748043527885087 and parameters: {'model_type': 'gcn', 'hidden_dims': '[256, 128]', 'dropout': 0.4867498024251802, 'batch_norm': False, 'lr': 0.0002060176939726985, 'weight_decay': 1.390411109640045e-06, 'epochs': 151, 'loss': 'mse', 'optimizer': 'adam', 'graph_mode': 'off', 'use_snp_selection': True, 'num_snps': 43848}. Best is trial 17 with value: 0.05965903896429322.
[I 2025-11-03 11:45:56,070] Trial 22 finished with value: 0.04518320277403872 and parameters: {'model_type': 'gcn', 'hidden_dims': '[256, 128, 64]', 'dropout': 0.4244400238757159, 'batch_norm': False, 'lr': 0.000126339662219507, 'weight_decay': 0.00014061128063276327, 'epochs': 104, 'loss': 'mse', 'optimizer': 'adam', 'graph_mode': 'off', 'use_snp_selection': True, 'num_snps': 46764}. Best is trial 17 with value: 0.05965903896429322.
[I 2025-11-03 11:45:56,954] Trial 23 finished with value: 0.01627403453144073 and parameters: {'model_type': 'gcn', 'hidden_dims': '[256, 128]', 'dropout': 0.4986381076139037, 'batch_norm': False, 'lr': 0.0003795300583821111, 'weight_decay': 0.0004833952993224468, 'epochs': 74, 'loss': 'mae', 'optimizer': 'adam', 'graph_mode': 'off', 'use_snp_selection': False}. Best is trial 17 with value: 0.05965903896429322.
[I 2025-11-03 11:45:58,296] Trial 24 finished with value: 0.07345968974271269 and parameters: {'model_type': 'gcn', 'hidden_dims': '[256, 128, 64]', 'dropout': 0.41987830677746607, 'batch_norm': False, 'lr': 0.00010652089149918203, 'weight_decay': 3.4954349256866535e-05, 'epochs': 212, 'loss': 'mse', 'optimizer': 'adam', 'graph_mode': 'off', 'use_snp_selection': True, 'num_snps': 12499}. Best is trial 24 with value: 0.07345968974271269.
[I 2025-11-03 11:45:59,655] Trial 25 finished with value: 0.04045926712194134 and parameters: {'model_type': 'gcn', 'hidden_dims': '[256, 128, 64]', 'dropout': 0.41310413630452975, 'batch_norm': False, 'lr': 0.0001058398212793939, 'weight_decay': 3.78866244274582e-05, 'epochs': 219, 'loss': 'mse', 'optimizer': 'adam', 'graph_mode': 'off', 'use_snp_selection': True, 'num_snps': 11465}. Best is trial 24 with value: 0.07345968974271269.
[I 2025-11-03 11:46:01,467] Trial 26 finished with value: 0.04727854330168592 and parameters: {'model_type': 'gcn', 'hidden_dims': '[256, 128, 64]', 'dropout': 0.343387539862669, 'batch_norm': False, 'lr': 3.469739458119623e-05, 'weight_decay': 0.00011890259563860705, 'epochs': 257, 'loss': 'mse', 'optimizer': 'adam', 'graph_mode': 'off', 'use_snp_selection': True, 'num_snps': 26294}. Best is trial 24 with value: 0.07345968974271269.
[I 2025-11-03 11:46:02,827] Trial 27 finished with value: 0.04726942026687002 and parameters: {'model_type': 'gcn', 'hidden_dims': '[256, 128, 64]', 'dropout': 0.2604926700359038, 'batch_norm': False, 'lr': 9.134160698816422e-06, 'weight_decay': 0.00045724040218413076, 'epochs': 213, 'loss': 'mse', 'optimizer': 'adam', 'graph_mode': 'off', 'use_snp_selection': True, 'num_snps': 11806}. Best is trial 24 with value: 0.07345968974271269.
[I 2025-11-03 11:46:04,057] Trial 28 finished with value: 0.04819969887030987 and parameters: {'model_type': 'gcn', 'hidden_dims': '[256, 128, 64]', 'dropout': 0.5603374755151075, 'batch_norm': False, 'lr': 2.5295518283642865e-06, 'weight_decay': 0.00013861768888348704, 'epochs': 164, 'loss': 'mse', 'optimizer': 'adam', 'graph_mode': 'off', 'use_snp_selection': True, 'num_snps': 13029}. Best is trial 24 with value: 0.07345968974271269.
[I 2025-11-03 11:46:05,449] Trial 29 finished with value: 0.05957826551480908 and parameters: {'model_type': 'gcn', 'hidden_dims': '[128, 64]', 'dropout': 0.27018097991931944, 'batch_norm': False, 'lr': 2.8787052884985332e-05, 'weight_decay': 5.910418098398091e-05, 'epochs': 196, 'loss': 'mse', 'optimizer': 'adam', 'graph_mode': 'off', 'use_snp_selection': True, 'num_snps': 25015}. Best is trial 24 with value: 0.07345968974271269.
[I 2025-11-03 11:46:07,010] Trial 30 finished with value: 0.048404536050483254 and parameters: {'model_type': 'gcn', 'hidden_dims': '[128, 64]', 'dropout': 0.2334639687565177, 'batch_norm': False, 'lr': 2.6298525006374347e-05, 'weight_decay': 3.5016431186186025e-05, 'epochs': 280, 'loss': 'mse', 'optimizer': 'adam', 'graph_mode': 'off', 'use_snp_selection': True, 'num_snps': 25835}. Best is trial 24 with value: 0.07345968974271269.
[I 2025-11-03 11:46:08,363] Trial 31 finished with value: 0.04778652199005536 and parameters: {'model_type': 'gcn', 'hidden_dims': '[128, 64]', 'dropout': 0.2873583036877654, 'batch_norm': False, 'lr': 3.7011771726263895e-05, 'weight_decay': 6.720353946788368e-05, 'epochs': 195, 'loss': 'mse', 'optimizer': 'adam', 'graph_mode': 'off', 'use_snp_selection': True, 'num_snps': 24484}. Best is trial 24 with value: 0.07345968974271269.
[I 2025-11-03 11:46:09,934] Trial 32 finished with value: 0.05167845122941495 and parameters: {'model_type': 'gcn', 'hidden_dims': '[128, 64]', 'dropout': 0.3508038684497954, 'batch_norm': False, 'lr': 9.383474701283447e-05, 'weight_decay': 9.24323679077966e-06, 'epochs': 238, 'loss': 'mse', 'optimizer': 'adam', 'graph_mode': 'off', 'use_snp_selection': True, 'num_snps': 33412}. Best is trial 24 with value: 0.07345968974271269.
[I 2025-11-03 11:46:10,870] Trial 33 finished with value: 0.0229028420862887 and parameters: {'model_type': 'gcn', 'hidden_dims': '[128, 64]', 'dropout': 0.2066641787886491, 'batch_norm': False, 'lr': 7.145833781159131e-06, 'weight_decay': 5.1463172564607445e-05, 'epochs': 208, 'loss': 'mse', 'optimizer': 'adam', 'graph_mode': 'off', 'use_snp_selection': True, 'num_snps': 2359}. Best is trial 24 with value: 0.07345968974271269.
[I 2025-11-03 11:46:12,131] Trial 34 finished with value: 0.03756334434975112 and parameters: {'model_type': 'gcn', 'hidden_dims': '[512, 128]', 'dropout': 0.4303589335839369, 'batch_norm': True, 'lr': 1.6130879579664806e-05, 'weight_decay': 0.00022652253326743826, 'epochs': 167, 'loss': 'mse', 'optimizer': 'adam', 'graph_mode': 'off', 'use_snp_selection': True, 'num_snps': 16124}. Best is trial 24 with value: 0.07345968974271269.
[I 2025-11-03 11:46:13,702] Trial 35 finished with value: 0.0711251412340792 and parameters: {'model_type': 'gcn', 'hidden_dims': '[512, 256]', 'dropout': 0.3602512238867116, 'batch_norm': False, 'lr': 0.0003763978851637584, 'weight_decay': 1.7233861086003786e-05, 'epochs': 188, 'loss': 'mse', 'optimizer': 'adam', 'graph_mode': 'off', 'use_snp_selection': True, 'num_snps': 23387}. Best is trial 24 with value: 0.07345968974271269.
[I 2025-11-03 11:46:15,886] Trial 36 finished with value: 0.03496587919288732 and parameters: {'model_type': 'gcn', 'hidden_dims': '[512, 256]', 'dropout': 0.28080429558676534, 'batch_norm': False, 'lr': 0.00036654037329562894, 'weight_decay': 1.1866465170223773e-05, 'epochs': 230, 'loss': 'mse', 'optimizer': 'adam', 'graph_mode': 'off', 'use_snp_selection': True, 'num_snps': 37370}. Best is trial 24 with value: 0.07345968974271269.
[I 2025-11-03 11:46:17,683] Trial 37 finished with value: 0.03893448025745264 and parameters: {'model_type': 'gcn', 'hidden_dims': '[512, 256]', 'dropout': 0.34654654705755217, 'batch_norm': False, 'lr': 0.000152666973831106, 'weight_decay': 2.1892720262046044e-05, 'epochs': 269, 'loss': 'mse', 'optimizer': 'adam', 'graph_mode': 'off', 'use_snp_selection': True, 'num_snps': 22840}. Best is trial 24 with value: 0.07345968974271269.
[I 2025-11-03 11:46:19,442] Trial 38 finished with value: 0.051033673230766574 and parameters: {'model_type': 'gcn', 'hidden_dims': '[512, 256]', 'dropout': 0.3896118006213078, 'batch_norm': True, 'lr': 0.0006155743993020561, 'weight_decay': 4.397992998535539e-06, 'epochs': 185, 'loss': 'mse', 'optimizer': 'adam', 'graph_mode': 'off', 'use_snp_selection': True, 'num_snps': 29477}. Best is trial 24 with value: 0.07345968974271269.
[I 2025-11-03 11:46:21,851] Trial 39 finished with value: 0.04690757078073634 and parameters: {'model_type': 'gcn', 'hidden_dims': '[512, 64]', 'dropout': 0.36550910742102216, 'batch_norm': False, 'lr': 0.0002814619601028867, 'weight_decay': 8.770898148656184e-06, 'epochs': 348, 'loss': 'mse', 'optimizer': 'adam', 'graph_mode': 'off', 'use_snp_selection': True, 'num_snps': 30027}. Best is trial 24 with value: 0.07345968974271269.
[I 2025-11-03 11:46:24,984] Trial 40 finished with value: 0.06280573340670076 and parameters: {'model_type': 'gcn', 'hidden_dims': '[512, 256]', 'dropout': 0.3224407184375737, 'batch_norm': True, 'lr': 8.64517897953589e-05, 'weight_decay': 1.6210451928048887e-05, 'epochs': 302, 'loss': 'mse', 'optimizer': 'adam', 'graph_mode': 'off', 'use_snp_selection': True, 'num_snps': 51824}. Best is trial 24 with value: 0.07345968974271269.
[I 2025-11-03 11:46:28,158] Trial 41 finished with value: 0.04140822547273431 and parameters: {'model_type': 'gcn', 'hidden_dims': '[512, 256]', 'dropout': 0.3101543097428786, 'batch_norm': True, 'lr': 9.018394115156642e-05, 'weight_decay': 1.4168847723253823e-05, 'epochs': 309, 'loss': 'mse', 'optimizer': 'adam', 'graph_mode': 'off', 'use_snp_selection': True, 'num_snps': 51129}. Best is trial 24 with value: 0.07345968974271269.
[I 2025-11-03 11:46:30,980] Trial 42 finished with value: 0.04669420825286525 and parameters: {'model_type': 'gcn', 'hidden_dims': '[512, 256]', 'dropout': 0.23616350495039942, 'batch_norm': True, 'lr': 7.571187742278948e-05, 'weight_decay': 2.7344575700653844e-05, 'epochs': 286, 'loss': 'mse', 'optimizer': 'adam', 'graph_mode': 'off', 'use_snp_selection': True, 'num_snps': 47733}. Best is trial 24 with value: 0.07345968974271269.
[I 2025-11-03 11:46:34,117] Trial 43 finished with value: 0.047985856715611924 and parameters: {'model_type': 'gcn', 'hidden_dims': '[512, 256]', 'dropout': 0.40649754497076357, 'batch_norm': True, 'lr': 5.0561095344863046e-05, 'weight_decay': 6.230356920227046e-06, 'epochs': 298, 'loss': 'mse', 'optimizer': 'adam', 'graph_mode': 'off', 'use_snp_selection': True, 'num_snps': 53061}. Best is trial 24 with value: 0.07345968974271269.
[I 2025-11-03 11:46:36,899] Trial 44 finished with value: 0.03897868371388188 and parameters: {'model_type': 'gcn', 'hidden_dims': '[512, 128]', 'dropout': 0.32329014296322356, 'batch_norm': True, 'lr': 0.00019919506451227502, 'weight_decay': 1.584433858786754e-06, 'epochs': 329, 'loss': 'mse', 'optimizer': 'adam', 'graph_mode': 'off', 'use_snp_selection': True, 'num_snps': 39212}. Best is trial 24 with value: 0.07345968974271269.
[I 2025-11-03 11:46:39,861] Trial 45 finished with value: 0.028200265438386114 and parameters: {'model_type': 'gcn', 'hidden_dims': '[512, 256]', 'dropout': 0.2767725995189841, 'batch_norm': True, 'lr': 0.00013941697628471427, 'weight_decay': 2.6493309766261694e-06, 'epochs': 255, 'loss': 'mse', 'optimizer': 'adam', 'graph_mode': 'off', 'use_snp_selection': True, 'num_snps': 53342}. Best is trial 24 with value: 0.07345968974271269.
[I 2025-11-03 11:46:42,252] Trial 46 finished with value: 0.04434342056997028 and parameters: {'model_type': 'gcn', 'hidden_dims': '[512, 64]', 'dropout': 0.4494889220307928, 'batch_norm': True, 'lr': 6.656890051898153e-05, 'weight_decay': 1.7993008620029697e-05, 'epochs': 198, 'loss': 'mse', 'optimizer': 'adam', 'graph_mode': 'off', 'use_snp_selection': True, 'num_snps': 44176}. Best is trial 24 with value: 0.07345968974271269.
[I 2025-11-03 11:46:44,273] Trial 47 finished with value: 0.030962320903472333 and parameters: {'model_type': 'gcn', 'hidden_dims': '[128, 64]', 'dropout': 0.18550391396935975, 'batch_norm': False, 'lr': 0.0006119640668500845, 'weight_decay': 9.167503046897876e-05, 'epochs': 153, 'loss': 'mse', 'optimizer': 'adam', 'graph_mode': 'off', 'use_snp_selection': True, 'num_snps': 58762}. Best is trial 24 with value: 0.07345968974271269.
[I 2025-11-03 11:46:45,602] Trial 48 finished with value: 0.04518155893030074 and parameters: {'model_type': 'gcn', 'hidden_dims': '[512, 256]', 'dropout': 0.37117122581920425, 'batch_norm': True, 'lr': 4.161853907616455e-05, 'weight_decay': 4.3210709055813976e-05, 'epochs': 124, 'loss': 'mae', 'optimizer': 'adam', 'graph_mode': 'off', 'use_snp_selection': True, 'num_snps': 21659}. Best is trial 24 with value: 0.07345968974271269.
[I 2025-11-03 11:46:47,425] Trial 49 finished with value: 0.05639572659741505 and parameters: {'model_type': 'gcn', 'hidden_dims': '[512, 128]', 'dropout': 0.49932675798759507, 'batch_norm': False, 'lr': 0.0002952307911723746, 'weight_decay': 3.1040801267175014e-05, 'epochs': 182, 'loss': 'mse', 'optimizer': 'adam', 'graph_mode': 'off', 'use_snp_selection': False}. Best is trial 24 with value: 0.07345968974271269.
[I 2025-11-03 11:46:48,651] Trial 50 finished with value: 0.030504193651293705 and parameters: {'model_type': 'gcn', 'hidden_dims': '[128, 64]', 'dropout': 0.2953631346188236, 'batch_norm': False, 'lr': 0.0009557972538396107, 'weight_decay': 0.0006188541641014018, 'epochs': 230, 'loss': 'mse', 'optimizer': 'adam', 'graph_mode': 'off', 'use_snp_selection': True, 'num_snps': 15249}. Best is trial 24 with value: 0.07345968974271269.
[I 2025-11-03 11:46:50,513] Trial 51 finished with value: 0.0626515520885082 and parameters: {'model_type': 'gcn', 'hidden_dims': '[512, 128]', 'dropout': 0.49940492982420287, 'batch_norm': False, 'lr': 0.0002987458224852328, 'weight_decay': 2.8812919814829102e-05, 'epochs': 183, 'loss': 'mse', 'optimizer': 'adam', 'graph_mode': 'off', 'use_snp_selection': False}. Best is trial 24 with value: 0.07345968974271269.
[I 2025-11-03 11:46:52,496] Trial 52 finished with value: 0.04107545049560432 and parameters: {'model_type': 'gcn', 'hidden_dims': '[512, 128]', 'dropout': 0.5264045353556555, 'batch_norm': False, 'lr': 0.0004796670577853519, 'weight_decay': 1.9649289453189205e-05, 'epochs': 204, 'loss': 'mse', 'optimizer': 'adam', 'graph_mode': 'off', 'use_snp_selection': False}. Best is trial 24 with value: 0.07345968974271269.
[I 2025-11-03 11:46:54,215] Trial 53 finished with value: 0.042831546785372085 and parameters: {'model_type': 'gcn', 'hidden_dims': '[512, 128]', 'dropout': 0.5513244624724339, 'batch_norm': False, 'lr': 0.0002077086276722459, 'weight_decay': 7.248728994282522e-06, 'epochs': 160, 'loss': 'mse', 'optimizer': 'adam', 'graph_mode': 'off', 'use_snp_selection': False}. Best is trial 24 with value: 0.07345968974271269.
[I 2025-11-03 11:46:56,058] Trial 54 finished with value: 0.06429754517683532 and parameters: {'model_type': 'gcn', 'hidden_dims': '[512, 128]', 'dropout': 0.4800266130229114, 'batch_norm': False, 'lr': 0.00012538380847619863, 'weight_decay': 6.351721951396218e-05, 'epochs': 178, 'loss': 'mse', 'optimizer': 'adam', 'graph_mode': 'off', 'use_snp_selection': False}. Best is trial 24 with value: 0.07345968974271269.
[I 2025-11-03 11:46:57,630] Trial 55 finished with value: 0.03496833793347016 and parameters: {'model_type': 'gcn', 'hidden_dims': '[512, 128]', 'dropout': 0.4469316130784169, 'batch_norm': False, 'lr': 0.000111005263566273, 'weight_decay': 1.3922649334994834e-05, 'epochs': 138, 'loss': 'mae', 'optimizer': 'adam', 'graph_mode': 'off', 'use_snp_selection': False}. Best is trial 24 with value: 0.07345968974271269.
[I 2025-11-03 11:46:59,417] Trial 56 finished with value: 0.04744479543035323 and parameters: {'model_type': 'gcn', 'hidden_dims': '[512, 128]', 'dropout': 0.48718134584216616, 'batch_norm': False, 'lr': 0.00031374354466465665, 'weight_decay': 8.767063585313725e-05, 'epochs': 175, 'loss': 'mse', 'optimizer': 'adam', 'graph_mode': 'off', 'use_snp_selection': False}. Best is trial 24 with value: 0.07345968974271269.
