[I 2025-11-03 13:59:44,732] Trial 42 finished with value: 0.036894278803971545 and parameters: {'model_type': 'gcn', 'hidden_dims': '[128, 64]', 'dropout': 0.22440118767619952, 'batch_norm': True, 'lr': 0.0003058340374814663, 'weight_decay': 3.915875335465606e-06, 'epochs': 105, 'loss': 'mae', 'optimizer': 'adam', 'graph_mode': 'knn', 'source': 'grm', 'knn_k': 8, 'weighted_edges': True, 'symmetrize_mode': 'union', 'use_snp_selection': False}. Best is trial 17 with value: 0.06511496650400468.
[I 2025-11-03 13:59:46,127] Trial 43 finished with value: 0.046979434311401135 and parameters: {'model_type': 'gcn', 'hidden_dims': '[128, 64]', 'dropout': 0.12648994938805838, 'batch_norm': True, 'lr': 8.909957023029146e-05, 'weight_decay': 0.00013711546815433755, 'epochs': 129, 'loss': 'mae', 'optimizer': 'adam', 'graph_mode': 'knn', 'source': 'grm', 'knn_k': 9, 'weighted_edges': True, 'symmetrize_mode': 'union', 'use_snp_selection': False}. Best is trial 17 with value: 0.06511496650400468.
[I 2025-11-03 13:59:47,315] Trial 44 finished with value: -0.03949815148971597 and parameters: {'model_type': 'gcn', 'hidden_dims': '[128, 64]', 'dropout': 0.45270639471731566, 'batch_norm': True, 'lr': 1.1329795720799229e-06, 'weight_decay': 2.60575916028387e-05, 'epochs': 60, 'loss': 'mae', 'optimizer': 'adam', 'graph_mode': 'knn', 'source': 'grm', 'knn_k': 6, 'weighted_edges': True, 'symmetrize_mode': 'union', 'use_snp_selection': False}. Best is trial 17 with value: 0.06511496650400468.
[I 2025-11-03 13:59:50,380] Trial 45 finished with value: 0.013001019717625831 and parameters: {'model_type': 'gcn', 'hidden_dims': '[256, 128]', 'dropout': 0.1940156424930437, 'batch_norm': False, 'lr': 0.0001363331826362476, 'weight_decay': 1.2253929650137204e-05, 'epochs': 190, 'loss': 'mae', 'optimizer': 'adam', 'graph_mode': 'knn', 'source': 'grm', 'knn_k': 9, 'weighted_edges': False, 'symmetrize_mode': 'mutual', 'use_snp_selection': True, 'num_snps': 47606}. Best is trial 17 with value: 0.06511496650400468.
[I 2025-11-03 13:59:52,258] Trial 46 finished with value: 0.02382862354244074 and parameters: {'model_type': 'gcn', 'hidden_dims': '[512, 64]', 'dropout': 0.4356271723867399, 'batch_norm': True, 'lr': 0.0006329736953541586, 'weight_decay': 6.480853447439616e-05, 'epochs': 94, 'loss': 'mae', 'optimizer': 'adam', 'graph_mode': 'knn', 'source': 'grm', 'knn_k': 1, 'weighted_edges': True, 'symmetrize_mode': 'mutual', 'use_snp_selection': False}. Best is trial 17 with value: 0.06511496650400468.
[I 2025-11-03 13:59:54,950] Trial 47 finished with value: 0.08946651587739919 and parameters: {'model_type': 'gcn', 'hidden_dims': '[128, 64]', 'dropout': 0.4894020975732013, 'batch_norm': False, 'lr': 4.0000795747215506e-05, 'weight_decay': 1.4988754455227182e-07, 'epochs': 324, 'loss': 'mae', 'optimizer': 'adam', 'graph_mode': 'cutoff', 'cutoff': 0.48770454853654105, 'grm_norm': 'cosine_then_gcn', 'self_loops': False, 'use_snp_selection': True, 'num_snps': 34357}. Best is trial 47 with value: 0.08946651587739919.
[I 2025-11-03 13:59:56,888] Trial 48 finished with value: 0.06014955356362549 and parameters: {'model_type': 'gcn', 'hidden_dims': '[128, 64]', 'dropout': 0.5166355231788505, 'batch_norm': True, 'lr': 0.0002049206391140031, 'weight_decay': 4.816194448822918e-05, 'epochs': 315, 'loss': 'mae', 'optimizer': 'adam', 'graph_mode': 'cutoff', 'cutoff': 0.462768411917176, 'grm_norm': 'cosine_then_gcn', 'self_loops': False, 'use_snp_selection': False}. Best is trial 47 with value: 0.08946651587739919.
[I 2025-11-03 13:59:58,805] Trial 49 finished with value: 0.0374058669649901 and parameters: {'model_type': 'gcn', 'hidden_dims': '[128, 64]', 'dropout': 0.5671888072170336, 'batch_norm': True, 'lr': 0.00038335736632363773, 'weight_decay': 0.00015107308895946913, 'epochs': 312, 'loss': 'mae', 'optimizer': 'adam', 'graph_mode': 'cutoff', 'cutoff': 0.4823674965549449, 'grm_norm': 'cosine_then_gcn', 'self_loops': False, 'use_snp_selection': False}. Best is trial 47 with value: 0.08946651587739919.
[I 2025-11-03 14:00:00,762] Trial 50 finished with value: 0.016020071889189535 and parameters: {'model_type': 'gcn', 'hidden_dims': '[128, 64]', 'dropout': 0.4905663577158146, 'batch_norm': True, 'lr': 0.00019489265584697311, 'weight_decay': 4.7080400910127616e-05, 'epochs': 328, 'loss': 'mae', 'optimizer': 'adam', 'graph_mode': 'cutoff', 'cutoff': 0.5407682983968047, 'grm_norm': 'cosine_then_gcn', 'self_loops': False, 'use_snp_selection': False}. Best is trial 47 with value: 0.08946651587739919.
[I 2025-11-03 14:00:02,589] Trial 51 finished with value: 0.013806074125699017 and parameters: {'model_type': 'gcn', 'hidden_dims': '[128, 64]', 'dropout': 0.522121287065099, 'batch_norm': True, 'lr': 3.5724206925847475e-05, 'weight_decay': 1.5906378826026216e-05, 'epochs': 281, 'loss': 'mae', 'optimizer': 'adam', 'graph_mode': 'cutoff', 'cutoff': 0.43812580820514146, 'grm_norm': 'cosine_then_gcn', 'self_loops': False, 'use_snp_selection': False}. Best is trial 47 with value: 0.08946651587739919.
[I 2025-11-03 14:00:04,553] Trial 52 finished with value: 0.030339452391449542 and parameters: {'model_type': 'gcn', 'hidden_dims': '[128, 64]', 'dropout': 0.3548648028877851, 'batch_norm': True, 'lr': 0.0008868495774981543, 'weight_decay': 1.8034105555698354e-07, 'epochs': 327, 'loss': 'mae', 'optimizer': 'adam', 'graph_mode': 'cutoff', 'cutoff': 0.6342770549341362, 'grm_norm': 'cosine_then_gcn', 'self_loops': False, 'use_snp_selection': False}. Best is trial 47 with value: 0.08946651587739919.
[I 2025-11-03 14:00:06,978] Trial 53 finished with value: 0.06990972109949238 and parameters: {'model_type': 'gcn', 'hidden_dims': '[256, 128]', 'dropout': 0.4969449131958748, 'batch_norm': True, 'lr': 0.00018056067399854414, 'weight_decay': 2.4732659932429676e-05, 'epochs': 337, 'loss': 'mae', 'optimizer': 'adam', 'graph_mode': 'cutoff', 'cutoff': 0.5170745573241748, 'grm_norm': 'cosine_then_gcn', 'self_loops': False, 'use_snp_selection': False}. Best is trial 47 with value: 0.08946651587739919.
[I 2025-11-03 14:00:09,753] Trial 54 finished with value: 0.028471272215225978 and parameters: {'model_type': 'gcn', 'hidden_dims': '[256, 128, 64]', 'dropout': 0.4991381930649192, 'batch_norm': True, 'lr': 0.00017812755387792775, 'weight_decay': 2.512347614846681e-05, 'epochs': 336, 'loss': 'mae', 'optimizer': 'adam', 'graph_mode': 'cutoff', 'cutoff': 0.5281967025948048, 'grm_norm': 'cosine_then_gcn', 'self_loops': False, 'use_snp_selection': False}. Best is trial 47 with value: 0.08946651587739919.
[I 2025-11-03 14:00:12,239] Trial 55 finished with value: 0.05435144580019501 and parameters: {'model_type': 'gcn', 'hidden_dims': '[256, 128]', 'dropout': 0.5637614690870418, 'batch_norm': True, 'lr': 8.586626179698758e-05, 'weight_decay': 5.0455596504912634e-05, 'epochs': 349, 'loss': 'mae', 'optimizer': 'adam', 'graph_mode': 'cutoff', 'cutoff': 0.3866898738104979, 'grm_norm': 'cosine_then_gcn', 'self_loops': False, 'use_snp_selection': False}. Best is trial 47 with value: 0.08946651587739919.
[I 2025-11-03 14:00:14,171] Trial 56 finished with value: 0.022124864936109618 and parameters: {'model_type': 'gcn', 'hidden_dims': '[128, 64]', 'dropout': 0.5511159719091949, 'batch_norm': True, 'lr': 0.0003891728647418889, 'weight_decay': 9.280160063916688e-06, 'epochs': 315, 'loss': 'mae', 'optimizer': 'adam', 'graph_mode': 'cutoff', 'cutoff': 0.4660422143900673, 'grm_norm': 'cosine_then_gcn', 'self_loops': False, 'use_snp_selection': False}. Best is trial 47 with value: 0.08946651587739919.
[I 2025-11-03 14:00:17,199] Trial 57 finished with value: 0.02135961950630996 and parameters: {'model_type': 'gcn', 'hidden_dims': '[512, 256]', 'dropout': 0.5867668273988418, 'batch_norm': True, 'lr': 0.0005409186445443921, 'weight_decay': 2.0681538028106307e-05, 'epochs': 292, 'loss': 'mae', 'optimizer': 'adam', 'graph_mode': 'cutoff', 'cutoff': 0.6000714005591812, 'grm_norm': 'cosine_then_gcn', 'self_loops': False, 'use_snp_selection': False}. Best is trial 47 with value: 0.08946651587739919.
[I 2025-11-03 14:00:20,129] Trial 58 finished with value: -0.03237204814334519 and parameters: {'model_type': 'gcn', 'hidden_dims': '[512, 128]', 'dropout': 0.5146235390502711, 'batch_norm': True, 'lr': 2.020422419393483e-06, 'weight_decay': 0.00011768611806363498, 'epochs': 281, 'loss': 'mse', 'optimizer': 'adam', 'graph_mode': 'cutoff', 'cutoff': 0.7577066740156381, 'grm_norm': 'cosine', 'self_loops': False, 'use_snp_selection': False}. Best is trial 47 with value: 0.08946651587739919.
[I 2025-11-03 14:00:23,255] Trial 59 finished with value: 0.009034971596113987 and parameters: {'model_type': 'gcn', 'hidden_dims': '[512, 64]', 'dropout': 0.20288396904702766, 'batch_norm': True, 'lr': 6.311754669768696e-05, 'weight_decay': 8.184842979687758e-05, 'epochs': 313, 'loss': 'mae', 'optimizer': 'adam', 'graph_mode': 'cutoff', 'cutoff': 0.345637390323173, 'grm_norm': 'gcn', 'self_loops': False, 'use_snp_selection': False}. Best is trial 47 with value: 0.08946651587739919.
[I 2025-11-03 14:00:24,954] Trial 60 finished with value: 0.0070213951560005195 and parameters: {'model_type': 'gcn', 'hidden_dims': '[128, 64]', 'dropout': 0.29660984030164544, 'batch_norm': True, 'lr': 0.00010535717811729663, 'weight_decay': 0.0002556487150418182, 'epochs': 239, 'loss': 'mae', 'optimizer': 'adam', 'graph_mode': 'cutoff', 'cutoff': 0.4996875314257343, 'grm_norm': 'cosine_then_gcn', 'self_loops': False, 'use_snp_selection': False}. Best is trial 47 with value: 0.08946651587739919.
[I 2025-11-03 14:00:27,428] Trial 61 finished with value: 0.057792636353594856 and parameters: {'model_type': 'gcn', 'hidden_dims': '[256, 128]', 'dropout': 0.5573703645392631, 'batch_norm': True, 'lr': 7.957612414214007e-05, 'weight_decay': 4.9773642837570406e-05, 'epochs': 346, 'loss': 'mae', 'optimizer': 'adam', 'graph_mode': 'cutoff', 'cutoff': 0.3885563891392817, 'grm_norm': 'cosine_then_gcn', 'self_loops': False, 'use_snp_selection': False}. Best is trial 47 with value: 0.08946651587739919.
[I 2025-11-03 14:00:29,860] Trial 62 finished with value: 0.02707686262920262 and parameters: {'model_type': 'gcn', 'hidden_dims': '[256, 128]', 'dropout': 0.48115891093080887, 'batch_norm': True, 'lr': 7.203731674022395e-05, 'weight_decay': 3.764545573216342e-05, 'epochs': 334, 'loss': 'mae', 'optimizer': 'adam', 'graph_mode': 'cutoff', 'cutoff': 0.4411696966443769, 'grm_norm': 'cosine_then_gcn', 'self_loops': False, 'use_snp_selection': False}. Best is trial 47 with value: 0.08946651587739919.
[I 2025-11-03 14:00:32,339] Trial 63 finished with value: 0.012863409074984108 and parameters: {'model_type': 'gcn', 'hidden_dims': '[256, 128]', 'dropout': 0.5378341970833244, 'batch_norm': True, 'lr': 0.0002549347173453574, 'weight_decay': 0.00019624182639106308, 'epochs': 348, 'loss': 'mae', 'optimizer': 'adam', 'graph_mode': 'cutoff', 'cutoff': 0.30228652393983046, 'grm_norm': 'cosine_then_gcn', 'self_loops': False, 'use_snp_selection': False}. Best is trial 47 with value: 0.08946651587739919.
[I 2025-11-03 14:00:34,699] Trial 64 finished with value: 0.05024496286722525 and parameters: {'model_type': 'gcn', 'hidden_dims': '[256, 128]', 'dropout': 0.24528957142502583, 'batch_norm': True, 'lr': 0.00017207672773124358, 'weight_decay': 5.6061423810927844e-05, 'epochs': 321, 'loss': 'mae', 'optimizer': 'adam', 'graph_mode': 'cutoff', 'cutoff': 0.38601720293903186, 'grm_norm': 'cosine_then_gcn', 'self_loops': False, 'use_snp_selection': False}. Best is trial 47 with value: 0.08946651587739919.
[I 2025-11-03 14:00:36,997] Trial 65 finished with value: 0.046297277924069166 and parameters: {'model_type': 'gcn', 'hidden_dims': '[256, 128]', 'dropout': 0.508909330547891, 'batch_norm': True, 'lr': 0.0001189146705145137, 'weight_decay': 8.886098917025913e-05, 'epochs': 306, 'loss': 'mae', 'optimizer': 'adam', 'graph_mode': 'cutoff', 'cutoff': 0.5052220796492485, 'grm_norm': 'cosine_then_gcn', 'self_loops': False, 'use_snp_selection': False}. Best is trial 47 with value: 0.08946651587739919.
[I 2025-11-03 14:00:38,817] Trial 66 finished with value: 0.02744600128841215 and parameters: {'model_type': 'gcn', 'hidden_dims': '[128, 64]', 'dropout': 0.5579944403256026, 'batch_norm': True, 'lr': 5.101811948150562e-05, 'weight_decay': 5.409663075589903e-06, 'epochs': 285, 'loss': 'mae', 'optimizer': 'adam', 'graph_mode': 'cutoff', 'cutoff': 0.5726472281316872, 'grm_norm': 'cosine_then_gcn', 'self_loops': False, 'use_snp_selection': False}. Best is trial 47 with value: 0.08946651587739919.
[I 2025-11-03 14:00:40,605] Trial 67 finished with value: 0.0013198449884647783 and parameters: {'model_type': 'gcn', 'hidden_dims': '[128, 64]', 'dropout': 0.12771726025109897, 'batch_norm': True, 'lr': 4.018802812907962e-05, 'weight_decay': 2.1213912857010795e-05, 'epochs': 269, 'loss': 'mae', 'optimizer': 'adam', 'graph_mode': 'cutoff', 'cutoff': 0.43840229047967455, 'grm_norm': 'cosine_then_gcn', 'self_loops': False, 'use_snp_selection': False}. Best is trial 47 with value: 0.08946651587739919.
[I 2025-11-03 14:00:42,851] Trial 68 finished with value: 0.06878796379490919 and parameters: {'model_type': 'gcn', 'hidden_dims': '[256, 128]', 'dropout': 0.595302324756317, 'batch_norm': False, 'lr': 2.859515247392548e-05, 'weight_decay': 3.2658945556949136e-05, 'epochs': 340, 'loss': 'mae', 'optimizer': 'adam', 'graph_mode': 'cutoff', 'cutoff': 0.2931857974749945, 'grm_norm': 'gcn', 'self_loops': False, 'use_snp_selection': True, 'num_snps': 17156}. Best is trial 47 with value: 0.08946651587739919.
[I 2025-11-03 14:00:45,017] Trial 69 finished with value: 0.015689805338931787 and parameters: {'model_type': 'gcn', 'hidden_dims': '[256, 128]', 'dropout': 0.5925112163154567, 'batch_norm': False, 'lr': 2.9267782161364793e-05, 'weight_decay': 3.269338856401442e-05, 'epochs': 340, 'loss': 'mae', 'optimizer': 'adam', 'graph_mode': 'cutoff', 'cutoff': 0.22337416956163852, 'grm_norm': 'gcn', 'self_loops': False, 'use_snp_selection': True, 'num_snps': 14475}. Best is trial 47 with value: 0.08946651587739919.
[I 2025-11-03 14:00:47,520] Trial 70 finished with value: -0.019179920844052442 and parameters: {'model_type': 'gcn', 'hidden_dims': '[256, 128]', 'dropout': 0.578485120049947, 'batch_norm': False, 'lr': 1.9872538536640804e-05, 'weight_decay': 1.1862940419564046e-05, 'epochs': 326, 'loss': 'mae', 'optimizer': 'adam', 'graph_mode': 'cutoff', 'cutoff': 0.29663325063323015, 'grm_norm': 'gcn', 'self_loops': False, 'use_snp_selection': True, 'num_snps': 23966}. Best is trial 47 with value: 0.08946651587739919.
[I 2025-11-03 14:00:49,234] Trial 71 finished with value: 0.027760298611019148 and parameters: {'model_type': 'gcn', 'hidden_dims': '[256, 128]', 'dropout': 0.5518527212748622, 'batch_norm': False, 'lr': 2.8703312785398564e-05, 'weight_decay': 4.15688210273904e-05, 'epochs': 302, 'loss': 'mae', 'optimizer': 'adam', 'graph_mode': 'cutoff', 'cutoff': 0.25861759607873525, 'grm_norm': 'gcn', 'self_loops': False, 'use_snp_selection': True, 'num_snps': 2755}. Best is trial 47 with value: 0.08946651587739919.
[I 2025-11-03 14:00:51,495] Trial 72 finished with value: 0.016321825914776614 and parameters: {'model_type': 'gcn', 'hidden_dims': '[256, 128]', 'dropout': 0.5312056100588873, 'batch_norm': False, 'lr': 5.074975554916272e-06, 'weight_decay': 2.815034037431213e-05, 'epochs': 336, 'loss': 'mae', 'optimizer': 'adam', 'graph_mode': 'cutoff', 'cutoff': 0.34868960933494064, 'grm_norm': 'gcn', 'self_loops': False, 'use_snp_selection': True, 'num_snps': 17453}. Best is trial 47 with value: 0.08946651587739919.
[I 2025-11-03 14:00:53,712] Trial 73 finished with value: 0.03648048041221584 and parameters: {'model_type': 'gcn', 'hidden_dims': '[256, 128, 64]', 'dropout': 0.27774376712283055, 'batch_norm': False, 'lr': 0.00015666230752737112, 'weight_decay': 1.9007827120459847e-05, 'epochs': 319, 'loss': 'mae', 'optimizer': 'adam', 'graph_mode': 'cutoff', 'cutoff': 0.3897843298049734, 'grm_norm': 'none', 'self_loops': False, 'use_snp_selection': True, 'num_snps': 8418}. Best is trial 47 with value: 0.08946651587739919.
[I 2025-11-03 14:00:56,400] Trial 74 finished with value: 0.005128897547860201 and parameters: {'model_type': 'gcn', 'hidden_dims': '[128, 64]', 'dropout': 0.10036960100952085, 'batch_norm': False, 'lr': 8.083939931796185e-05, 'weight_decay': 6.853982363937054e-05, 'epochs': 347, 'loss': 'mse', 'optimizer': 'adam', 'graph_mode': 'cutoff', 'cutoff': 0.5607438015818018, 'grm_norm': 'gcn', 'self_loops': False, 'use_snp_selection': True, 'num_snps': 30740}. Best is trial 47 with value: 0.08946651587739919.
[I 2025-11-03 14:00:59,358] Trial 75 finished with value: 0.08880584631349876 and parameters: {'model_type': 'gcn', 'hidden_dims': '[512, 128]', 'dropout': 0.4794659094897001, 'batch_norm': False, 'lr': 0.00034034159953826574, 'weight_decay': 1.2071382102896754e-07, 'epochs': 307, 'loss': 'mae', 'optimizer': 'adam', 'graph_mode': 'cutoff', 'cutoff': 0.3448780195524024, 'grm_norm': 'cosine', 'self_loops': True, 'use_snp_selection': True, 'num_snps': 27469}. Best is trial 47 with value: 0.08946651587739919.
[I 2025-11-03 14:01:01,739] Trial 76 finished with value: 0.04155415239425153 and parameters: {'model_type': 'gcn', 'hidden_dims': '[512, 128]', 'dropout': 0.48752081732094865, 'batch_norm': False, 'lr': 0.0006977786867375399, 'weight_decay': 1.500273733280133e-07, 'epochs': 143, 'loss': 'mae', 'optimizer': 'adam', 'graph_mode': 'cutoff', 'cutoff': 0.3497847956680309, 'grm_norm': 'cosine', 'self_loops': True, 'use_snp_selection': True, 'num_snps': 27495}. Best is trial 47 with value: 0.08946651587739919.
[I 2025-11-03 14:01:05,025] Trial 77 finished with value: -3.871292407298457e-05 and parameters: {'model_type': 'gcn', 'hidden_dims': '[512, 128]', 'dropout': 0.45286791753986577, 'batch_norm': False, 'lr': 0.0003206445967621671, 'weight_decay': 1.190564403420184e-07, 'epochs': 305, 'loss': 'mae', 'optimizer': 'adam', 'graph_mode': 'cutoff', 'cutoff': 0.32267635664715644, 'grm_norm': 'cosine', 'self_loops': True, 'use_snp_selection': True, 'num_snps': 33574}. Best is trial 47 with value: 0.08946651587739919.
[I 2025-11-03 14:01:07,743] Trial 78 finished with value: -0.009421342008917076 and parameters: {'model_type': 'gcn', 'hidden_dims': '[512, 128]', 'dropout': 0.5202713234415665, 'batch_norm': False, 'lr': 1.2736667081882222e-05, 'weight_decay': 2.014366109800328e-07, 'epochs': 269, 'loss': 'mae', 'optimizer': 'adam', 'graph_mode': 'cutoff', 'cutoff': 0.24849684537169325, 'grm_norm': 'cosine', 'self_loops': True, 'use_snp_selection': True, 'num_snps': 24686}. Best is trial 47 with value: 0.08946651587739919.
[I 2025-11-03 14:01:10,253] Trial 79 finished with value: 0.057977023755750284 and parameters: {'model_type': 'gcn', 'hidden_dims': '[512, 128]', 'dropout': 0.477119195514342, 'batch_norm': False, 'lr': 0.00023846674342390317, 'weight_decay': 1.6198406351437673e-05, 'epochs': 289, 'loss': 'mae', 'optimizer': 'adam', 'graph_mode': 'cutoff', 'cutoff': 0.41553431426978893, 'grm_norm': 'cosine', 'self_loops': True, 'use_snp_selection': True, 'num_snps': 19693}. Best is trial 47 with value: 0.08946651587739919.
[I 2025-11-03 14:01:12,407] Trial 80 finished with value: -0.007575576644356755 and parameters: {'model_type': 'gcn', 'hidden_dims': '[512, 128]', 'dropout': 0.47401328727253655, 'batch_norm': False, 'lr': 0.00022715041716483538, 'weight_decay': 8.732943081446646e-06, 'epochs': 252, 'loss': 'mae', 'optimizer': 'adam', 'graph_mode': 'cutoff', 'cutoff': 0.4628833078922715, 'grm_norm': 'cosine', 'self_loops': True, 'use_snp_selection': True, 'num_snps': 15554}. Best is trial 47 with value: 0.08946651587739919.
[I 2025-11-03 14:01:14,875] Trial 81 finished with value: 0.0650288585713405 and parameters: {'model_type': 'gcn', 'hidden_dims': '[512, 128]', 'dropout': 0.4127691260450752, 'batch_norm': False, 'lr': 0.0003406597659720804, 'weight_decay': 1.4481868220533087e-05, 'epochs': 292, 'loss': 'mae', 'optimizer': 'adam', 'graph_mode': 'cutoff', 'cutoff': 0.4199496288389855, 'grm_norm': 'cosine', 'self_loops': True, 'use_snp_selection': True, 'num_snps': 20116}. Best is trial 47 with value: 0.08946651587739919.
[I 2025-11-03 14:01:17,346] Trial 82 finished with value: 0.030367264592881377 and parameters: {'model_type': 'gcn', 'hidden_dims': '[512, 128]', 'dropout': 0.42311329536429165, 'batch_norm': False, 'lr': 0.0004311837145702789, 'weight_decay': 1.512162521559391e-05, 'epochs': 293, 'loss': 'mae', 'optimizer': 'adam', 'graph_mode': 'cutoff', 'cutoff': 0.42295998007335645, 'grm_norm': 'cosine', 'self_loops': True, 'use_snp_selection': True, 'num_snps': 20318}. Best is trial 47 with value: 0.08946651587739919.
[I 2025-11-03 14:01:19,507] Trial 83 finished with value: 0.009147903365763255 and parameters: {'model_type': 'gcn', 'hidden_dims': '[512, 128]', 'dropout': 0.40916752031416026, 'batch_norm': False, 'lr': 0.0003248956865528457, 'weight_decay': 3.0320609060968503e-07, 'epochs': 311, 'loss': 'mae', 'optimizer': 'adam', 'graph_mode': 'cutoff', 'cutoff': 0.5143493790608453, 'grm_norm': 'cosine', 'self_loops': True, 'use_snp_selection': True, 'num_snps': 11991}. Best is trial 47 with value: 0.08946651587739919.
[I 2025-11-03 14:01:21,957] Trial 84 finished with value: 0.05794385489624031 and parameters: {'model_type': 'gcn', 'hidden_dims': '[512, 128]', 'dropout': 0.4509624681866777, 'batch_norm': False, 'lr': 0.00020945153074878388, 'weight_decay': 5.104943877358079e-07, 'epochs': 288, 'loss': 'mae', 'optimizer': 'adam', 'graph_mode': 'cutoff', 'cutoff': 0.4734300767487972, 'grm_norm': 'cosine', 'self_loops': True, 'use_snp_selection': True, 'num_snps': 19196}. Best is trial 47 with value: 0.08946651587739919.
