[I 2025-11-03 12:06:19,272] Trial 2 finished with value: 0.11102782017748078 and parameters: {'model_type': 'gcn', 'hidden_dims': '[256, 128]', 'dropout': 0.5105528289184642, 'batch_norm': False, 'lr': 0.0006804279372404962, 'weight_decay': 0.0008922815224257085, 'epochs': 160, 'loss': 'mse', 'optimizer': 'adam', 'graph_mode': 'cutoff', 'cutoff': 0.5741905641612706, 'grm_norm': 'gcn', 'self_loops': False, 'use_snp_selection': True, 'num_snps': 26910}. Best is trial 1 with value: 0.12529637793613801.
[I 2025-11-03 12:06:22,375] Trial 3 finished with value: 0.050461629099316646 and parameters: {'model_type': 'gcn', 'hidden_dims': '[256, 128, 64]', 'dropout': 0.5390483213624292, 'batch_norm': False, 'lr': 3.4705625989073525e-05, 'weight_decay': 2.4623319020131338e-05, 'epochs': 92, 'loss': 'mse', 'optimizer': 'adam', 'graph_mode': 'knn', 'source': 'grm', 'knn_k': 6, 'weighted_edges': False, 'symmetrize_mode': 'mutual', 'use_snp_selection': True, 'num_snps': 30713}. Best is trial 1 with value: 0.12529637793613801.
[I 2025-11-03 12:06:25,336] Trial 4 finished with value: -2.45104695275395e-06 and parameters: {'model_type': 'gcn', 'hidden_dims': '[128, 64]', 'dropout': 0.13404863676897502, 'batch_norm': False, 'lr': 0.0001431556295367288, 'weight_decay': 2.2084517750726675e-05, 'epochs': 13, 'loss': 'mae', 'optimizer': 'adam', 'graph_mode': 'cutoff', 'cutoff': 0.6714268476993044, 'grm_norm': 'none', 'self_loops': False, 'use_snp_selection': True, 'num_snps': 45645}. Best is trial 1 with value: 0.12529637793613801.
[I 2025-11-03 12:06:29,048] Trial 5 finished with value: 0.08964543007808684 and parameters: {'model_type': 'gcn', 'hidden_dims': '[256, 128]', 'dropout': 0.42253606323412096, 'batch_norm': False, 'lr': 4.238630400638805e-05, 'weight_decay': 8.074086040046576e-07, 'epochs': 134, 'loss': 'mae', 'optimizer': 'adam', 'graph_mode': 'knn', 'source': 'grm', 'knn_k': 1, 'weighted_edges': False, 'symmetrize_mode': 'mutual', 'use_snp_selection': True, 'num_snps': 43113}. Best is trial 1 with value: 0.12529637793613801.
[I 2025-11-03 12:06:32,859] Trial 6 finished with value: 0.1455563026694354 and parameters: {'model_type': 'gcn', 'hidden_dims': '[512, 256]', 'dropout': 0.3534893146320237, 'batch_norm': True, 'lr': 0.000251307964226932, 'weight_decay': 1.821819791794022e-05, 'epochs': 207, 'loss': 'mae', 'optimizer': 'adam', 'graph_mode': 'knn', 'source': 'grm', 'knn_k': 1, 'weighted_edges': True, 'symmetrize_mode': 'mutual', 'use_snp_selection': False}. Best is trial 6 with value: 0.1455563026694354.
[I 2025-11-03 12:06:36,115] Trial 7 finished with value: 0.08002502533899195 and parameters: {'model_type': 'gcn', 'hidden_dims': '[512, 256]', 'dropout': 0.1105825955860775, 'batch_norm': True, 'lr': 2.374338412754043e-05, 'weight_decay': 1.1284721123340274e-05, 'epochs': 170, 'loss': 'mse', 'optimizer': 'adam', 'graph_mode': 'cutoff', 'cutoff': 0.719872204109604, 'grm_norm': 'gcn', 'self_loops': False, 'use_snp_selection': False}. Best is trial 6 with value: 0.1455563026694354.
[I 2025-11-03 12:06:38,432] Trial 8 finished with value: 0.11667342729431177 and parameters: {'model_type': 'gcn', 'hidden_dims': '[512, 128]', 'dropout': 0.5066580418354021, 'batch_norm': True, 'lr': 0.00039213678276659976, 'weight_decay': 3.43655320802934e-06, 'epochs': 91, 'loss': 'mse', 'optimizer': 'adam', 'graph_mode': 'cutoff', 'cutoff': 0.34923059576505366, 'grm_norm': 'cosine', 'self_loops': True, 'use_snp_selection': False}. Best is trial 6 with value: 0.1455563026694354.
[I 2025-11-03 12:06:40,977] Trial 9 finished with value: 0.054466345042890975 and parameters: {'model_type': 'gcn', 'hidden_dims': '[512, 256]', 'dropout': 0.301734920240333, 'batch_norm': False, 'lr': 6.650961854953448e-06, 'weight_decay': 6.861575656590315e-05, 'epochs': 125, 'loss': 'mae', 'optimizer': 'adam', 'graph_mode': 'cutoff', 'cutoff': 0.2857569870061939, 'grm_norm': 'cosine_then_gcn', 'self_loops': False, 'use_snp_selection': True, 'num_snps': 12722}. Best is trial 6 with value: 0.1455563026694354.
[I 2025-11-03 12:06:45,448] Trial 10 finished with value: 0.1403217898321651 and parameters: {'model_type': 'gcn', 'hidden_dims': '[512, 64]', 'dropout': 0.2833599465317005, 'batch_norm': True, 'lr': 0.00016916760584270694, 'weight_decay': 1.7866650996308468e-07, 'epochs': 266, 'loss': 'mae', 'optimizer': 'adam', 'graph_mode': 'knn', 'source': 'grm', 'knn_k': 1, 'weighted_edges': True, 'symmetrize_mode': 'union', 'use_snp_selection': False}. Best is trial 6 with value: 0.1455563026694354.
[I 2025-11-03 12:06:49,906] Trial 11 finished with value: 0.14681127392633903 and parameters: {'model_type': 'gcn', 'hidden_dims': '[512, 64]', 'dropout': 0.2859699507705008, 'batch_norm': True, 'lr': 0.00012623783700890367, 'weight_decay': 1.6805209943987688e-07, 'epochs': 265, 'loss': 'mae', 'optimizer': 'adam', 'graph_mode': 'knn', 'source': 'grm', 'knn_k': 1, 'weighted_edges': True, 'symmetrize_mode': 'union', 'use_snp_selection': False}. Best is trial 11 with value: 0.14681127392633903.
[I 2025-11-03 12:06:54,102] Trial 12 finished with value: 0.13709699915450616 and parameters: {'model_type': 'gcn', 'hidden_dims': '[512, 64]', 'dropout': 0.2516138819478735, 'batch_norm': True, 'lr': 0.00011934893004304496, 'weight_decay': 1.0887150741139413e-07, 'epochs': 241, 'loss': 'mae', 'optimizer': 'adam', 'graph_mode': 'knn', 'source': 'grm', 'knn_k': 3, 'weighted_edges': True, 'symmetrize_mode': 'union', 'use_snp_selection': False}. Best is trial 11 with value: 0.14681127392633903.
[I 2025-11-03 12:06:58,260] Trial 13 finished with value: 0.12905006670578026 and parameters: {'model_type': 'gcn', 'hidden_dims': '[512, 64]', 'dropout': 0.3597295172492356, 'batch_norm': True, 'lr': 7.689848153447392e-05, 'weight_decay': 0.000399947667615736, 'epochs': 239, 'loss': 'mae', 'optimizer': 'adam', 'graph_mode': 'knn', 'source': 'grm', 'knn_k': 4, 'weighted_edges': True, 'symmetrize_mode': 'mutual', 'use_snp_selection': False}. Best is trial 11 with value: 0.14681127392633903.
[I 2025-11-03 12:07:03,140] Trial 14 finished with value: 0.10790603804347737 and parameters: {'model_type': 'gcn', 'hidden_dims': '[512, 256]', 'dropout': 0.4407696594275238, 'batch_norm': True, 'lr': 1.2586985041154999e-05, 'weight_decay': 8.665907472910647e-07, 'epochs': 297, 'loss': 'mae', 'optimizer': 'adam', 'graph_mode': 'knn', 'source': 'grm', 'knn_k': 3, 'weighted_edges': True, 'symmetrize_mode': 'union', 'use_snp_selection': False}. Best is trial 11 with value: 0.14681127392633903.
[I 2025-11-03 12:07:06,873] Trial 15 finished with value: 0.16114308596844565 and parameters: {'model_type': 'gcn', 'hidden_dims': '[512, 128]', 'dropout': 0.3355876786391346, 'batch_norm': True, 'lr': 0.0002980455072267111, 'weight_decay': 0.00013722890470534003, 'epochs': 205, 'loss': 'mae', 'optimizer': 'adam', 'graph_mode': 'knn', 'source': 'grm', 'knn_k': 1, 'weighted_edges': True, 'symmetrize_mode': 'union', 'use_snp_selection': False}. Best is trial 15 with value: 0.16114308596844565.
[I 2025-11-03 12:07:12,197] Trial 16 finished with value: 0.11929225392201483 and parameters: {'model_type': 'gcn', 'hidden_dims': '[512, 128]', 'dropout': 0.21908549744794692, 'batch_norm': True, 'lr': 0.0008000134635777176, 'weight_decay': 0.0002228306417504496, 'epochs': 326, 'loss': 'mae', 'optimizer': 'adam', 'graph_mode': 'knn', 'source': 'grm', 'knn_k': 10, 'weighted_edges': False, 'symmetrize_mode': 'union', 'use_snp_selection': False}. Best is trial 15 with value: 0.16114308596844565.
[I 2025-11-03 12:07:16,185] Trial 17 finished with value: 0.13288229512453953 and parameters: {'model_type': 'gcn', 'hidden_dims': '[512, 128]', 'dropout': 0.31419662738321497, 'batch_norm': True, 'lr': 5.889716026303138e-05, 'weight_decay': 0.00012051178806181512, 'epochs': 224, 'loss': 'mae', 'optimizer': 'adam', 'graph_mode': 'knn', 'source': 'grm', 'knn_k': 3, 'weighted_edges': True, 'symmetrize_mode': 'union', 'use_snp_selection': False}. Best is trial 15 with value: 0.16114308596844565.
[I 2025-11-03 12:07:19,709] Trial 18 finished with value: 0.12806596637484144 and parameters: {'model_type': 'gcn', 'hidden_dims': '[256, 128, 64]', 'dropout': 0.18425264722857748, 'batch_norm': True, 'lr': 0.0003050784308257012, 'weight_decay': 3.924658951752951e-06, 'epochs': 289, 'loss': 'mae', 'optimizer': 'adam', 'graph_mode': 'knn', 'source': 'grm', 'knn_k': 5, 'weighted_edges': True, 'symmetrize_mode': 'union', 'use_snp_selection': False}. Best is trial 15 with value: 0.16114308596844565.
[I 2025-11-03 12:07:23,479] Trial 19 finished with value: 0.0008009560658723029 and parameters: {'model_type': 'gcn', 'hidden_dims': '[512, 128]', 'dropout': 0.4514586801323087, 'batch_norm': True, 'lr': 1.3261425572023469e-06, 'weight_decay': 4.935187637101856e-07, 'epochs': 207, 'loss': 'mae', 'optimizer': 'adam', 'graph_mode': 'knn', 'source': 'grm', 'knn_k': 2, 'weighted_edges': True, 'symmetrize_mode': 'union', 'use_snp_selection': False}. Best is trial 15 with value: 0.16114308596844565.
[I 2025-11-03 12:07:28,020] Trial 20 finished with value: 0.058084903873959336 and parameters: {'model_type': 'gcn', 'hidden_dims': '[512, 64]', 'dropout': 0.253769840387702, 'batch_norm': True, 'lr': 1.8656871498059054e-05, 'weight_decay': 0.0009670518358472316, 'epochs': 271, 'loss': 'mae', 'optimizer': 'adam', 'graph_mode': 'knn', 'source': 'grm', 'knn_k': 2, 'weighted_edges': False, 'symmetrize_mode': 'union', 'use_snp_selection': False}. Best is trial 15 with value: 0.16114308596844565.
[I 2025-11-03 12:07:31,632] Trial 21 finished with value: 0.15878234331529917 and parameters: {'model_type': 'gcn', 'hidden_dims': '[512, 256]', 'dropout': 0.37334490395053427, 'batch_norm': True, 'lr': 0.0002356971812125406, 'weight_decay': 8.538706384783214e-06, 'epochs': 195, 'loss': 'mae', 'optimizer': 'adam', 'graph_mode': 'knn', 'source': 'grm', 'knn_k': 1, 'weighted_edges': True, 'symmetrize_mode': 'mutual', 'use_snp_selection': False}. Best is trial 15 with value: 0.16114308596844565.
[I 2025-11-03 12:07:35,203] Trial 22 finished with value: 0.12270466978053407 and parameters: {'model_type': 'gcn', 'hidden_dims': '[512, 128]', 'dropout': 0.38502981184603347, 'batch_norm': True, 'lr': 0.00010888174954232701, 'weight_decay': 3.385142208157625e-07, 'epochs': 192, 'loss': 'mae', 'optimizer': 'adam', 'graph_mode': 'knn', 'source': 'grm', 'knn_k': 1, 'weighted_edges': True, 'symmetrize_mode': 'mutual', 'use_snp_selection': False}. Best is trial 15 with value: 0.16114308596844565.
[I 2025-11-03 12:07:39,406] Trial 23 finished with value: 0.1548811503597583 and parameters: {'model_type': 'gcn', 'hidden_dims': '[512, 64]', 'dropout': 0.3153698664391284, 'batch_norm': True, 'lr': 0.00032856251442682136, 'weight_decay': 5.011163791802407e-06, 'epochs': 243, 'loss': 'mae', 'optimizer': 'adam', 'graph_mode': 'knn', 'source': 'grm', 'knn_k': 2, 'weighted_edges': True, 'symmetrize_mode': 'union', 'use_snp_selection': False}. Best is trial 15 with value: 0.16114308596844565.
[I 2025-11-03 12:07:42,457] Trial 24 finished with value: 0.12653531446894714 and parameters: {'model_type': 'gcn', 'hidden_dims': '[512, 256]', 'dropout': 0.32398171366696166, 'batch_norm': True, 'lr': 0.00025205908521913124, 'weight_decay': 4.098304921226546e-06, 'epochs': 148, 'loss': 'mae', 'optimizer': 'adam', 'graph_mode': 'knn', 'source': 'grm', 'knn_k': 2, 'weighted_edges': True, 'symmetrize_mode': 'mutual', 'use_snp_selection': False}. Best is trial 15 with value: 0.16114308596844565.
[I 2025-11-03 12:07:45,129] Trial 25 finished with value: 0.1238651032179331 and parameters: {'model_type': 'gcn', 'hidden_dims': '[256, 128, 64]', 'dropout': 0.476224524993363, 'batch_norm': True, 'lr': 0.0009781454116176084, 'weight_decay': 8.254273542187803e-06, 'epochs': 188, 'loss': 'mae', 'optimizer': 'adam', 'graph_mode': 'knn', 'source': 'grm', 'knn_k': 4, 'weighted_edges': True, 'symmetrize_mode': 'union', 'use_snp_selection': False}. Best is trial 15 with value: 0.16114308596844565.
[I 2025-11-03 12:07:51,400] Trial 26 finished with value: 0.0787988535823605 and parameters: {'model_type': 'gcn', 'hidden_dims': '[512, 256]', 'dropout': 0.5896027440730658, 'batch_norm': False, 'lr': 0.00044378418225775546, 'weight_decay': 3.773718480160285e-05, 'epochs': 233, 'loss': 'mae', 'optimizer': 'adam', 'graph_mode': 'cutoff', 'cutoff': 0.8765009073803762, 'grm_norm': 'none', 'self_loops': True, 'use_snp_selection': True, 'num_snps': 59005}. Best is trial 15 with value: 0.16114308596844565.
[I 2025-11-03 12:07:53,335] Trial 27 finished with value: 0.12424098953833711 and parameters: {'model_type': 'gcn', 'hidden_dims': '[256, 128]', 'dropout': 0.38929582764291715, 'batch_norm': True, 'lr': 0.00021197325136258595, 'weight_decay': 1.7673664060044523e-06, 'epochs': 107, 'loss': 'mse', 'optimizer': 'adam', 'graph_mode': 'knn', 'source': 'grm', 'knn_k': 2, 'weighted_edges': True, 'symmetrize_mode': 'mutual', 'use_snp_selection': False}. Best is trial 15 with value: 0.16114308596844565.
[I 2025-11-03 12:07:58,297] Trial 28 finished with value: 0.11838355102347317 and parameters: {'model_type': 'gcn', 'hidden_dims': '[512, 128]', 'dropout': 0.3348726706465554, 'batch_norm': True, 'lr': 5.799323691814563e-05, 'weight_decay': 7.790350905456737e-06, 'epochs': 303, 'loss': 'mae', 'optimizer': 'adam', 'graph_mode': 'knn', 'source': 'grm', 'knn_k': 4, 'weighted_edges': False, 'symmetrize_mode': 'union', 'use_snp_selection': False}. Best is trial 15 with value: 0.16114308596844565.
[I 2025-11-03 12:08:00,284] Trial 29 finished with value: 0.044268143987202864 and parameters: {'model_type': 'gcn', 'hidden_dims': '[128, 64]', 'dropout': 0.1881763221627632, 'batch_norm': True, 'lr': 4.960666673070062e-06, 'weight_decay': 8.223262292785812e-05, 'epochs': 207, 'loss': 'mae', 'optimizer': 'adam', 'graph_mode': 'knn', 'source': 'grm', 'knn_k': 3, 'weighted_edges': True, 'symmetrize_mode': 'mutual', 'use_snp_selection': False}. Best is trial 15 with value: 0.16114308596844565.
[I 2025-11-03 12:08:05,553] Trial 30 finished with value: 0.15109156176417207 and parameters: {'model_type': 'gcn', 'hidden_dims': '[512, 64]', 'dropout': 0.25546629671200227, 'batch_norm': True, 'lr': 0.0003931900763215109, 'weight_decay': 3.99572668639736e-05, 'epochs': 330, 'loss': 'mae', 'optimizer': 'adam', 'graph_mode': 'knn', 'source': 'grm', 'knn_k': 2, 'weighted_edges': True, 'symmetrize_mode': 'union', 'use_snp_selection': False}. Best is trial 15 with value: 0.16114308596844565.
[I 2025-11-03 12:08:10,868] Trial 31 finished with value: 0.16424899737975157 and parameters: {'model_type': 'gcn', 'hidden_dims': '[512, 64]', 'dropout': 0.23338822379160332, 'batch_norm': True, 'lr': 0.00039377613067991603, 'weight_decay': 0.00016807320533150001, 'epochs': 334, 'loss': 'mae', 'optimizer': 'adam', 'graph_mode': 'knn', 'source': 'grm', 'knn_k': 2, 'weighted_edges': True, 'symmetrize_mode': 'union', 'use_snp_selection': False}. Best is trial 31 with value: 0.16424899737975157.
[I 2025-11-03 12:08:16,277] Trial 32 finished with value: 0.14255783006638945 and parameters: {'model_type': 'gcn', 'hidden_dims': '[512, 64]', 'dropout': 0.22554544149166916, 'batch_norm': True, 'lr': 0.0005901224803799996, 'weight_decay': 0.00020073589756966864, 'epochs': 343, 'loss': 'mae', 'optimizer': 'adam', 'graph_mode': 'knn', 'source': 'grm', 'knn_k': 1, 'weighted_edges': True, 'symmetrize_mode': 'union', 'use_snp_selection': False}. Best is trial 31 with value: 0.16424899737975157.
[I 2025-11-03 12:08:19,592] Trial 33 finished with value: 0.151318028847016 and parameters: {'model_type': 'gcn', 'hidden_dims': '[512, 64]', 'dropout': 0.37168923921747554, 'batch_norm': True, 'lr': 0.0005563943093664801, 'weight_decay': 0.00045291024037486975, 'epochs': 169, 'loss': 'mae', 'optimizer': 'adam', 'graph_mode': 'knn', 'source': 'grm', 'knn_k': 2, 'weighted_edges': True, 'symmetrize_mode': 'union', 'use_snp_selection': False}. Best is trial 31 with value: 0.16424899737975157.
[I 2025-11-03 12:08:23,982] Trial 34 finished with value: 0.10554277701162576 and parameters: {'model_type': 'gcn', 'hidden_dims': '[512, 64]', 'dropout': 0.16108933310047552, 'batch_norm': True, 'lr': 0.00029025982422485673, 'weight_decay': 0.00013198256248540095, 'epochs': 257, 'loss': 'mse', 'optimizer': 'adam', 'graph_mode': 'knn', 'source': 'grm', 'knn_k': 3, 'weighted_edges': True, 'symmetrize_mode': 'union', 'use_snp_selection': False}. Best is trial 31 with value: 0.16424899737975157.
[I 2025-11-03 12:08:26,492] Trial 35 finished with value: 0.06526237356371313 and parameters: {'model_type': 'gcn', 'hidden_dims': '[128, 64]', 'dropout': 0.4114745266155284, 'batch_norm': False, 'lr': 0.00019224677177558347, 'weight_decay': 1.721559307055223e-06, 'epochs': 313, 'loss': 'mae', 'optimizer': 'adam', 'graph_mode': 'knn', 'source': 'grm', 'knn_k': 5, 'weighted_edges': True, 'symmetrize_mode': 'union', 'use_snp_selection': True, 'num_snps': 2074}. Best is trial 31 with value: 0.16424899737975157.
[I 2025-11-03 12:08:28,031] Trial 36 finished with value: 0.11998662967629742 and parameters: {'model_type': 'gcn', 'hidden_dims': '[256, 128]', 'dropout': 0.3404428692715002, 'batch_norm': True, 'lr': 8.438861291292723e-05, 'weight_decay': 1.3327706541315722e-05, 'epochs': 60, 'loss': 'mse', 'optimizer': 'adam', 'graph_mode': 'cutoff', 'cutoff': 0.42596163795855535, 'grm_norm': 'cosine', 'self_loops': True, 'use_snp_selection': False}. Best is trial 31 with value: 0.16424899737975157.
[I 2025-11-03 12:08:30,935] Trial 37 finished with value: 0.11713914224689644 and parameters: {'model_type': 'gcn', 'hidden_dims': '[256, 128, 64]', 'dropout': 0.2964182266483635, 'batch_norm': False, 'lr': 0.0006482062962046379, 'weight_decay': 0.0004481351695497408, 'epochs': 154, 'loss': 'mae', 'optimizer': 'adam', 'graph_mode': 'knn', 'source': 'grm', 'knn_k': 9, 'weighted_edges': True, 'symmetrize_mode': 'mutual', 'use_snp_selection': True, 'num_snps': 15344}. Best is trial 31 with value: 0.16424899737975157.
[I 2025-11-03 12:08:34,504] Trial 38 finished with value: 0.15770217500252792 and parameters: {'model_type': 'gcn', 'hidden_dims': '[512, 256]', 'dropout': 0.26865197671807484, 'batch_norm': True, 'lr': 0.0004109770718006187, 'weight_decay': 5.309491915877894e-06, 'epochs': 185, 'loss': 'mae', 'optimizer': 'adam', 'graph_mode': 'knn', 'source': 'grm', 'knn_k': 1, 'weighted_edges': True, 'symmetrize_mode': 'union', 'use_snp_selection': False}. Best is trial 31 with value: 0.16424899737975157.
[I 2025-11-03 12:08:40,433] Trial 39 finished with value: 0.05409321212390489 and parameters: {'model_type': 'gcn', 'hidden_dims': '[512, 256]', 'dropout': 0.22718822382560894, 'batch_norm': False, 'lr': 0.0009146269054838499, 'weight_decay': 4.42858990183397e-05, 'epochs': 188, 'loss': 'mse', 'optimizer': 'adam', 'graph_mode': 'cutoff', 'cutoff': 0.8982975816958216, 'grm_norm': 'cosine_then_gcn', 'self_loops': True, 'use_snp_selection': True, 'num_snps': 58379}. Best is trial 31 with value: 0.16424899737975157.
[I 2025-11-03 12:08:42,453] Trial 40 finished with value: 0.13098425872463076 and parameters: {'model_type': 'gcn', 'hidden_dims': '[512, 256]', 'dropout': 0.14517369746160438, 'batch_norm': True, 'lr': 0.00017377880405030957, 'weight_decay': 1.7505972620162194e-05, 'epochs': 47, 'loss': 'mae', 'optimizer': 'adam', 'graph_mode': 'knn', 'source': 'grm', 'knn_k': 7, 'weighted_edges': True, 'symmetrize_mode': 'mutual', 'use_snp_selection': False}. Best is trial 31 with value: 0.16424899737975157.
[I 2025-11-03 12:08:46,483] Trial 41 finished with value: 0.14752691934956777 and parameters: {'model_type': 'gcn', 'hidden_dims': '[512, 256]', 'dropout': 0.26506487048125016, 'batch_norm': True, 'lr': 0.00035694491380954896, 'weight_decay': 6.045093226361028e-06, 'epochs': 209, 'loss': 'mae', 'optimizer': 'adam', 'graph_mode': 'knn', 'source': 'grm', 'knn_k': 1, 'weighted_edges': True, 'symmetrize_mode': 'union', 'use_snp_selection': False}. Best is trial 31 with value: 0.16424899737975157.
[I 2025-11-03 12:08:49,657] Trial 42 finished with value: 0.14348539463120832 and parameters: {'model_type': 'gcn', 'hidden_dims': '[512, 256]', 'dropout': 0.35003554066065073, 'batch_norm': True, 'lr': 0.0004900918353642086, 'weight_decay': 3.1327116135845016e-06, 'epochs': 140, 'loss': 'mae', 'optimizer': 'adam', 'graph_mode': 'knn', 'source': 'grm', 'knn_k': 2, 'weighted_edges': True, 'symmetrize_mode': 'union', 'use_snp_selection': False}. Best is trial 31 with value: 0.16424899737975157.
[I 2025-11-03 12:08:51,631] Trial 43 finished with value: 0.08102801734966232 and parameters: {'model_type': 'gcn', 'hidden_dims': '[128, 64]', 'dropout': 0.2798336172015724, 'batch_norm': True, 'lr': 0.00024325968343562895, 'weight_decay': 2.4467684854137994e-05, 'epochs': 176, 'loss': 'mae', 'optimizer': 'adam', 'graph_mode': 'knn', 'source': 'grm', 'knn_k': 1, 'weighted_edges': False, 'symmetrize_mode': 'union', 'use_snp_selection': False}. Best is trial 31 with value: 0.16424899737975157.
[I 2025-11-03 12:08:54,613] Trial 44 finished with value: 0.14309049729483567 and parameters: {'model_type': 'gcn', 'hidden_dims': '[512, 64]', 'dropout': 0.20831359159956023, 'batch_norm': True, 'lr': 0.0003760194007912063, 'weight_decay': 1.177418632293212e-06, 'epochs': 124, 'loss': 'mae', 'optimizer': 'adam', 'graph_mode': 'knn', 'source': 'grm', 'knn_k': 1, 'weighted_edges': True, 'symmetrize_mode': 'union', 'use_snp_selection': False}. Best is trial 31 with value: 0.16424899737975157.
[I 2025-11-03 12:08:57,759] Trial 45 finished with value: 0.14452486656812472 and parameters: {'model_type': 'gcn', 'hidden_dims': '[256, 128]', 'dropout': 0.314248004642512, 'batch_norm': True, 'lr': 0.00014340168901536408, 'weight_decay': 5.997821943203879e-06, 'epochs': 224, 'loss': 'mae', 'optimizer': 'adam', 'graph_mode': 'cutoff', 'cutoff': 0.4585737354176531, 'grm_norm': 'cosine', 'self_loops': False, 'use_snp_selection': False}. Best is trial 31 with value: 0.16424899737975157.
