[I 2025-11-13 07:24:21,550] Trial 96 finished with value: 0.29218360960533274 and parameters: {'model_type': 'graphsage', 'hidden_dims': '[512, 128]', 'dropout': 0.5675020727727993, 'batch_norm': True, 'lr': 0.000992197574161769, 'weight_decay': 5.125809705021763e-07, 'epochs': 48, 'loss': 'mae', 'optimizer': 'adam', 'graph_mode': 'knn', 'source': 'grm', 'knn_k': 7, 'weighted_edges': False, 'symmetrize_mode': 'mutual', 'use_snp_selection': False}. Best is trial 93 with value: 0.3069511992074966.
[I 2025-11-13 07:25:29,382] Trial 97 finished with value: 0.3028207139616412 and parameters: {'model_type': 'graphsage', 'hidden_dims': '[512, 128]', 'dropout': 0.1491914167049027, 'batch_norm': True, 'lr': 0.000581175943706171, 'weight_decay': 2.528631214950886e-07, 'epochs': 65, 'loss': 'mae', 'optimizer': 'adam', 'graph_mode': 'cutoff', 'cutoff': 0.4229184904865318, 'grm_norm': 'none', 'self_loops': True, 'use_snp_selection': False}. Best is trial 93 with value: 0.3069511992074966.
[I 2025-11-13 07:26:11,180] Trial 98 finished with value: 0.2829632971282302 and parameters: {'model_type': 'graphsage', 'hidden_dims': '[256, 128, 64]', 'dropout': 0.15213669403335564, 'batch_norm': True, 'lr': 0.0007279714220118661, 'weight_decay': 4.0339625487819634e-07, 'epochs': 57, 'loss': 'mae', 'optimizer': 'adam', 'graph_mode': 'cutoff', 'cutoff': 0.4282950609889123, 'grm_norm': 'none', 'self_loops': True, 'use_snp_selection': False}. Best is trial 93 with value: 0.3069511992074966.
[I 2025-11-13 07:28:37,157] Trial 99 finished with value: 0.29660285056789887 and parameters: {'model_type': 'graphsage', 'hidden_dims': '[512, 128]', 'dropout': 0.20790831690701778, 'batch_norm': True, 'lr': 0.0005830219725991985, 'weight_decay': 2.52671351457778e-07, 'epochs': 177, 'loss': 'mae', 'optimizer': 'adam', 'graph_mode': 'cutoff', 'cutoff': 0.446498484186444, 'grm_norm': 'none', 'self_loops': True, 'use_snp_selection': False}. Best is trial 93 with value: 0.3069511992074966.
[I 2025-11-13 07:29:47,101] Trial 100 finished with value: 0.2965117551486583 and parameters: {'model_type': 'graphsage', 'hidden_dims': '[512, 128]', 'dropout': 0.35890837989694757, 'batch_norm': True, 'lr': 0.0008527198017720309, 'weight_decay': 3.196293623520679e-07, 'epochs': 66, 'loss': 'mae', 'optimizer': 'adam', 'graph_mode': 'cutoff', 'cutoff': 0.37917944101962037, 'grm_norm': 'gcn', 'self_loops': True, 'use_snp_selection': False}. Best is trial 93 with value: 0.3069511992074966.
[I 2025-11-13 07:30:41,622] Trial 101 finished with value: 0.29909646841920823 and parameters: {'model_type': 'graphsage', 'hidden_dims': '[512, 128]', 'dropout': 0.5886147055924984, 'batch_norm': True, 'lr': 0.000502899116921092, 'weight_decay': 1.2488712648165256e-07, 'epochs': 46, 'loss': 'mae', 'optimizer': 'adam', 'graph_mode': 'cutoff', 'cutoff': 0.42108807557632966, 'grm_norm': 'none', 'self_loops': True, 'use_snp_selection': False}. Best is trial 93 with value: 0.3069511992074966.
[I 2025-11-13 07:31:45,069] Trial 102 finished with value: 0.3069749962738771 and parameters: {'model_type': 'graphsage', 'hidden_dims': '[512, 128]', 'dropout': 0.1345146002433521, 'batch_norm': True, 'lr': 0.0006466735410277987, 'weight_decay': 1.7148102371271864e-07, 'epochs': 54, 'loss': 'mae', 'optimizer': 'adam', 'graph_mode': 'cutoff', 'cutoff': 0.33156422069484714, 'grm_norm': 'none', 'self_loops': True, 'use_snp_selection': False}. Best is trial 102 with value: 0.3069749962738771.
[I 2025-11-13 07:32:48,353] Trial 103 finished with value: 0.2850661305965633 and parameters: {'model_type': 'graphsage', 'hidden_dims': '[512, 128]', 'dropout': 0.13736073196970205, 'batch_norm': True, 'lr': 0.0006983026776290803, 'weight_decay': 1.7284048229008169e-07, 'epochs': 53, 'loss': 'mae', 'optimizer': 'adam', 'graph_mode': 'cutoff', 'cutoff': 0.32265684345890033, 'grm_norm': 'none', 'self_loops': True, 'use_snp_selection': False}. Best is trial 102 with value: 0.3069749962738771.
[I 2025-11-13 07:33:55,299] Trial 104 finished with value: 0.29327571525255747 and parameters: {'model_type': 'graphsage', 'hidden_dims': '[512, 128]', 'dropout': 0.12235675433767212, 'batch_norm': True, 'lr': 0.0005850238140186523, 'weight_decay': 2.5126561474012767e-07, 'epochs': 60, 'loss': 'mae', 'optimizer': 'adam', 'graph_mode': 'cutoff', 'cutoff': 0.34724245664278314, 'grm_norm': 'none', 'self_loops': True, 'use_snp_selection': False}. Best is trial 102 with value: 0.3069749962738771.
[I 2025-11-13 07:34:45,747] Trial 105 finished with value: 0.2952699765439644 and parameters: {'model_type': 'graphsage', 'hidden_dims': '[512, 128]', 'dropout': 0.17708711694078058, 'batch_norm': True, 'lr': 0.0007915455532069525, 'weight_decay': 5.014951639928123e-07, 'epochs': 40, 'loss': 'mae', 'optimizer': 'adam', 'graph_mode': 'cutoff', 'cutoff': 0.4006623206636278, 'grm_norm': 'none', 'self_loops': True, 'use_snp_selection': False}. Best is trial 102 with value: 0.3069749962738771.
[I 2025-11-13 07:36:18,511] Trial 106 finished with value: 0.20312097981862984 and parameters: {'model_type': 'graphsage', 'hidden_dims': '[128, 64]', 'dropout': 0.14248164122354012, 'batch_norm': False, 'lr': 0.0004953764084340131, 'weight_decay': 2.2479281663677628e-07, 'epochs': 234, 'loss': 'mse', 'optimizer': 'adam', 'graph_mode': 'cutoff', 'cutoff': 0.3717715988598085, 'grm_norm': 'none', 'self_loops': True, 'use_snp_selection': False}. Best is trial 102 with value: 0.3069749962738771.
[I 2025-11-13 07:37:57,730] Trial 107 finished with value: 0.2836905971600637 and parameters: {'model_type': 'graphsage', 'hidden_dims': '[512, 128]', 'dropout': 0.1642854327812583, 'batch_norm': True, 'lr': 0.0003927476317352667, 'weight_decay': 3.1837102830839007e-07, 'epochs': 83, 'loss': 'mae', 'optimizer': 'adam', 'graph_mode': 'knn', 'source': 'grm', 'knn_k': 5, 'weighted_edges': False, 'symmetrize_mode': 'mutual', 'use_snp_selection': True, 'num_snps': 34987}. Best is trial 102 with value: 0.3069749962738771.
[I 2025-11-13 07:39:33,060] Trial 108 finished with value: 0.3010134662237476 and parameters: {'model_type': 'graphsage', 'hidden_dims': '[512, 64]', 'dropout': 0.5799778471227599, 'batch_norm': True, 'lr': 0.0006715088113822471, 'weight_decay': 3.915268642964486e-07, 'epochs': 69, 'loss': 'mae', 'optimizer': 'adam', 'graph_mode': 'cutoff', 'cutoff': 0.25063144573637086, 'grm_norm': 'none', 'self_loops': True, 'use_snp_selection': False}. Best is trial 102 with value: 0.3069749962738771.
[I 2025-11-13 07:40:28,731] Trial 109 finished with value: 0.27706162525184486 and parameters: {'model_type': 'graphsage', 'hidden_dims': '[512, 128]', 'dropout': 0.12306579041741214, 'batch_norm': True, 'lr': 0.000861561882334207, 'weight_decay': 1.0554810437867988e-07, 'epochs': 53, 'loss': 'mae', 'optimizer': 'adam', 'graph_mode': 'cutoff', 'cutoff': 0.5068188533280054, 'grm_norm': 'none', 'self_loops': True, 'use_snp_selection': False}. Best is trial 102 with value: 0.3069749962738771.
[I 2025-11-13 07:41:45,967] Trial 110 finished with value: 0.28790473040714704 and parameters: {'model_type': 'graphsage', 'hidden_dims': '[512, 256]', 'dropout': 0.5451642029304204, 'batch_norm': True, 'lr': 0.0004638234532585921, 'weight_decay': 1.8958568161145302e-07, 'epochs': 62, 'loss': 'mae', 'optimizer': 'adam', 'graph_mode': 'cutoff', 'cutoff': 0.2756277775266638, 'grm_norm': 'none', 'self_loops': True, 'use_snp_selection': False}. Best is trial 102 with value: 0.3069749962738771.
[I 2025-11-13 07:42:43,117] Trial 111 finished with value: 0.29560588345947897 and parameters: {'model_type': 'graphsage', 'hidden_dims': '[512, 128]', 'dropout': 0.5524606019679217, 'batch_norm': True, 'lr': 0.0006149632543726923, 'weight_decay': 1.4822838986886017e-07, 'epochs': 46, 'loss': 'mae', 'optimizer': 'adam', 'graph_mode': 'cutoff', 'cutoff': 0.33363212757269634, 'grm_norm': 'none', 'self_loops': True, 'use_snp_selection': False}. Best is trial 102 with value: 0.3069749962738771.
[I 2025-11-13 07:43:54,898] Trial 112 finished with value: 0.310345912133288 and parameters: {'model_type': 'graphsage', 'hidden_dims': '[512, 128]', 'dropout': 0.5982347296334569, 'batch_norm': True, 'lr': 0.0009699132565740789, 'weight_decay': 1.2239174205686047e-07, 'epochs': 67, 'loss': 'mae', 'optimizer': 'adam', 'graph_mode': 'cutoff', 'cutoff': 0.35393123434001866, 'grm_norm': 'none', 'self_loops': True, 'use_snp_selection': False}. Best is trial 112 with value: 0.310345912133288.
[I 2025-11-13 07:45:04,326] Trial 113 finished with value: 0.2960501797139634 and parameters: {'model_type': 'graphsage', 'hidden_dims': '[512, 128]', 'dropout': 0.5924027042565594, 'batch_norm': True, 'lr': 0.0009090949223957827, 'weight_decay': 2.6661527530032517e-07, 'epochs': 66, 'loss': 'mae', 'optimizer': 'adam', 'graph_mode': 'cutoff', 'cutoff': 0.38779990010944476, 'grm_norm': 'none', 'self_loops': True, 'use_snp_selection': False}. Best is trial 112 with value: 0.310345912133288.
[I 2025-11-13 07:46:26,257] Trial 114 finished with value: 0.3075750660788716 and parameters: {'model_type': 'graphsage', 'hidden_dims': '[512, 128]', 'dropout': 0.5984217307966315, 'batch_norm': True, 'lr': 0.0007538332355420436, 'weight_decay': 2.9021590101970887e-05, 'epochs': 80, 'loss': 'mae', 'optimizer': 'adam', 'graph_mode': 'cutoff', 'cutoff': 0.3498462370900933, 'grm_norm': 'none', 'self_loops': True, 'use_snp_selection': False}. Best is trial 112 with value: 0.310345912133288.
[I 2025-11-13 07:48:00,433] Trial 115 finished with value: 0.29095189525873716 and parameters: {'model_type': 'graphsage', 'hidden_dims': '[512, 128]', 'dropout': 0.5986370530934583, 'batch_norm': True, 'lr': 0.0007087210303965413, 'weight_decay': 5.693710335659326e-05, 'epochs': 88, 'loss': 'mae', 'optimizer': 'adam', 'graph_mode': 'cutoff', 'cutoff': 0.30290505024424663, 'grm_norm': 'none', 'self_loops': True, 'use_snp_selection': False}. Best is trial 112 with value: 0.310345912133288.
[I 2025-11-13 07:49:20,773] Trial 116 finished with value: 0.29123513786272215 and parameters: {'model_type': 'graphsage', 'hidden_dims': '[512, 128]', 'dropout': 0.57792960401057, 'batch_norm': True, 'lr': 0.0005574550712463776, 'weight_decay': 4.295555779905886e-06, 'epochs': 79, 'loss': 'mae', 'optimizer': 'adam', 'graph_mode': 'cutoff', 'cutoff': 0.3581352835191591, 'grm_norm': 'cosine_then_gcn', 'self_loops': True, 'use_snp_selection': False}. Best is trial 112 with value: 0.310345912133288.
[I 2025-11-13 07:51:45,517] Trial 117 finished with value: 0.27930055286515604 and parameters: {'model_type': 'graphsage', 'hidden_dims': '[256, 128]', 'dropout': 0.5664611137724742, 'batch_norm': True, 'lr': 0.0007949972181162524, 'weight_decay': 9.461003965192189e-05, 'epochs': 294, 'loss': 'mae', 'optimizer': 'adam', 'graph_mode': 'knn', 'source': 'grm', 'knn_k': 2, 'weighted_edges': True, 'symmetrize_mode': 'union', 'use_snp_selection': False}. Best is trial 112 with value: 0.310345912133288.
[I 2025-11-13 07:53:22,142] Trial 118 finished with value: 0.30238173335013374 and parameters: {'model_type': 'graphsage', 'hidden_dims': '[512, 128]', 'dropout': 0.5994297226830709, 'batch_norm': True, 'lr': 0.0006101344082883237, 'weight_decay': 1.4242197066500193e-05, 'epochs': 95, 'loss': 'mae', 'optimizer': 'adam', 'graph_mode': 'cutoff', 'cutoff': 0.3244446183315287, 'grm_norm': 'none', 'self_loops': True, 'use_snp_selection': False}. Best is trial 112 with value: 0.310345912133288.
[I 2025-11-13 07:54:04,776] Trial 119 finished with value: 0.3186191315699354 and parameters: {'model_type': 'graphsage', 'hidden_dims': '[128, 64]', 'dropout': 0.5745901797510481, 'batch_norm': True, 'lr': 0.0007348236743617865, 'weight_decay': 3.300378508700061e-05, 'epochs': 79, 'loss': 'mae', 'optimizer': 'adam', 'graph_mode': 'cutoff', 'cutoff': 0.344143672974145, 'grm_norm': 'gcn', 'self_loops': True, 'use_snp_selection': False}. Best is trial 119 with value: 0.3186191315699354.
[I 2025-11-13 07:55:20,374] Trial 120 finished with value: 0.04212390732819352 and parameters: {'model_type': 'graphsage', 'hidden_dims': '[128, 64]', 'dropout': 0.5750286226977566, 'batch_norm': False, 'lr': 0.000719587098870839, 'weight_decay': 2.8103975330982738e-05, 'epochs': 147, 'loss': 'mse', 'optimizer': 'adam', 'graph_mode': 'cutoff', 'cutoff': 0.3489280722557052, 'grm_norm': 'gcn', 'self_loops': True, 'use_snp_selection': True, 'num_snps': 23535}. Best is trial 119 with value: 0.3186191315699354.
[I 2025-11-13 07:56:06,867] Trial 121 finished with value: 0.2994718206522607 and parameters: {'model_type': 'graphsage', 'hidden_dims': '[128, 64]', 'dropout': 0.5596724637331174, 'batch_norm': True, 'lr': 0.000982144055583191, 'weight_decay': 3.6515658273191245e-05, 'epochs': 72, 'loss': 'mae', 'optimizer': 'adam', 'graph_mode': 'cutoff', 'cutoff': 0.29032124646725005, 'grm_norm': 'gcn', 'self_loops': True, 'use_snp_selection': False}. Best is trial 119 with value: 0.3186191315699354.
[I 2025-11-13 07:58:31,430] Trial 122 finished with value: 0.2888645274777648 and parameters: {'model_type': 'graphsage', 'hidden_dims': '[128, 64]', 'dropout': 0.5900745811519456, 'batch_norm': True, 'lr': 0.0009915051980670852, 'weight_decay': 3.318421933824872e-05, 'epochs': 345, 'loss': 'mae', 'optimizer': 'adam', 'graph_mode': 'cutoff', 'cutoff': 0.334884050849841, 'grm_norm': 'gcn', 'self_loops': True, 'use_snp_selection': False}. Best is trial 119 with value: 0.3186191315699354.
[I 2025-11-13 07:59:05,663] Trial 123 finished with value: 0.2973473325531777 and parameters: {'model_type': 'graphsage', 'hidden_dims': '[128, 64]', 'dropout': 0.5778739302734712, 'batch_norm': True, 'lr': 0.0004969689069101414, 'weight_decay': 1.2115772050357117e-07, 'epochs': 61, 'loss': 'mae', 'optimizer': 'adam', 'graph_mode': 'cutoff', 'cutoff': 0.368157080632882, 'grm_norm': 'gcn', 'self_loops': True, 'use_snp_selection': False}. Best is trial 119 with value: 0.3186191315699354.
[I 2025-11-13 08:00:25,761] Trial 124 finished with value: 0.30968290442442636 and parameters: {'model_type': 'graphsage', 'hidden_dims': '[512, 128]', 'dropout': 0.5396854583299056, 'batch_norm': True, 'lr': 0.0007945175235272619, 'weight_decay': 2.142070350690815e-05, 'epochs': 81, 'loss': 'mae', 'optimizer': 'adam', 'graph_mode': 'cutoff', 'cutoff': 0.3932945303168628, 'grm_norm': 'none', 'self_loops': True, 'use_snp_selection': False}. Best is trial 119 with value: 0.3186191315699354.
[I 2025-11-13 08:01:46,815] Trial 125 finished with value: 0.2967831435134933 and parameters: {'model_type': 'graphsage', 'hidden_dims': '[512, 128]', 'dropout': 0.5385677131010886, 'batch_norm': True, 'lr': 0.0007644577691620629, 'weight_decay': 1.7650109615190536e-05, 'epochs': 82, 'loss': 'mae', 'optimizer': 'adam', 'graph_mode': 'cutoff', 'cutoff': 0.391276875794313, 'grm_norm': 'none', 'self_loops': True, 'use_snp_selection': False}. Best is trial 119 with value: 0.3186191315699354.
[I 2025-11-13 08:02:19,585] Trial 126 finished with value: 0.2864684658078431 and parameters: {'model_type': 'graphsage', 'hidden_dims': '[128, 64]', 'dropout': 0.5236658067583788, 'batch_norm': True, 'lr': 0.0006603472127804957, 'weight_decay': 2.1838392075705723e-05, 'epochs': 102, 'loss': 'mae', 'optimizer': 'adam', 'graph_mode': 'cutoff', 'cutoff': 0.7940791593746901, 'grm_norm': 'none', 'self_loops': True, 'use_snp_selection': False}. Best is trial 119 with value: 0.3186191315699354.
[I 2025-11-13 08:03:44,058] Trial 127 finished with value: 0.2634727129159775 and parameters: {'model_type': 'graphsage', 'hidden_dims': '[512, 128]', 'dropout': 0.5550523797347172, 'batch_norm': True, 'lr': 3.236971098399491e-05, 'weight_decay': 2.4044297984070025e-05, 'epochs': 78, 'loss': 'mae', 'optimizer': 'adam', 'graph_mode': 'cutoff', 'cutoff': 0.3122940919517114, 'grm_norm': 'none', 'self_loops': True, 'use_snp_selection': False}. Best is trial 119 with value: 0.3186191315699354.
[I 2025-11-13 08:04:49,128] Trial 128 finished with value: 0.2835512235491089 and parameters: {'model_type': 'graphsage', 'hidden_dims': '[256, 128, 64]', 'dropout': 0.5412806771739236, 'batch_norm': True, 'lr': 0.0008029182036820413, 'weight_decay': 5.4914370431253546e-05, 'epochs': 109, 'loss': 'mae', 'optimizer': 'adam', 'graph_mode': 'knn', 'source': 'grm', 'knn_k': 4, 'weighted_edges': False, 'symmetrize_mode': 'mutual', 'use_snp_selection': False}. Best is trial 119 with value: 0.3186191315699354.
[I 2025-11-13 08:06:17,738] Trial 129 finished with value: 0.29125119472035654 and parameters: {'model_type': 'graphsage', 'hidden_dims': '[512, 128]', 'dropout': 0.5691914194895347, 'batch_norm': True, 'lr': 0.00043987136573522855, 'weight_decay': 9.242011689839865e-05, 'epochs': 89, 'loss': 'mae', 'optimizer': 'adam', 'graph_mode': 'cutoff', 'cutoff': 0.3537450013227331, 'grm_norm': 'none', 'self_loops': True, 'use_snp_selection': False}. Best is trial 119 with value: 0.3186191315699354.
[I 2025-11-13 08:07:14,396] Trial 130 finished with value: 0.31262905253730566 and parameters: {'model_type': 'graphsage', 'hidden_dims': '[512, 128]', 'dropout': 0.5646310778520133, 'batch_norm': True, 'lr': 0.0009000836968747824, 'weight_decay': 3.155831400306179e-05, 'epochs': 47, 'loss': 'mae', 'optimizer': 'adam', 'graph_mode': 'cutoff', 'cutoff': 0.3765313722125154, 'grm_norm': 'gcn', 'self_loops': True, 'use_snp_selection': False}. Best is trial 119 with value: 0.3186191315699354.
[I 2025-11-13 08:08:11,562] Trial 131 finished with value: 0.298690071517039 and parameters: {'model_type': 'graphsage', 'hidden_dims': '[512, 128]', 'dropout': 0.5616729852097755, 'batch_norm': True, 'lr': 0.0008724413840500083, 'weight_decay': 3.876252334923735e-05, 'epochs': 48, 'loss': 'mae', 'optimizer': 'adam', 'graph_mode': 'cutoff', 'cutoff': 0.3745860052419982, 'grm_norm': 'gcn', 'self_loops': True, 'use_snp_selection': False}. Best is trial 119 with value: 0.3186191315699354.
[I 2025-11-13 08:09:16,091] Trial 132 finished with value: 0.30452771794887085 and parameters: {'model_type': 'graphsage', 'hidden_dims': '[512, 128]', 'dropout': 0.5832596251137345, 'batch_norm': True, 'lr': 0.0009069281334968818, 'weight_decay': 2.6765131457980747e-05, 'epochs': 56, 'loss': 'mae', 'optimizer': 'adam', 'graph_mode': 'cutoff', 'cutoff': 0.3425600598232914, 'grm_norm': 'gcn', 'self_loops': True, 'use_snp_selection': False}. Best is trial 119 with value: 0.3186191315699354.
[I 2025-11-13 08:10:28,891] Trial 133 finished with value: 0.3021110454413888 and parameters: {'model_type': 'graphsage', 'hidden_dims': '[512, 128]', 'dropout': 0.5502188537124144, 'batch_norm': True, 'lr': 0.0009905794177929512, 'weight_decay': 8.313438856294734e-06, 'epochs': 70, 'loss': 'mae', 'optimizer': 'adam', 'graph_mode': 'cutoff', 'cutoff': 0.40186645878863164, 'grm_norm': 'gcn', 'self_loops': True, 'use_snp_selection': False}. Best is trial 119 with value: 0.3186191315699354.
[I 2025-11-13 08:11:24,335] Trial 134 finished with value: 0.2787123356476758 and parameters: {'model_type': 'graphsage', 'hidden_dims': '[512, 128]', 'dropout': 0.24628062162895115, 'batch_norm': True, 'lr': 4.170631358034347e-05, 'weight_decay': 1.5464357137914904e-05, 'epochs': 40, 'loss': 'mae', 'optimizer': 'adam', 'graph_mode': 'cutoff', 'cutoff': 0.29722642074963734, 'grm_norm': 'gcn', 'self_loops': True, 'use_snp_selection': False}. Best is trial 119 with value: 0.3186191315699354.
[I 2025-11-13 08:12:31,210] Trial 135 finished with value: 0.3075558756132618 and parameters: {'model_type': 'graphsage', 'hidden_dims': '[512, 256]', 'dropout': 0.5999409995919389, 'batch_norm': True, 'lr': 0.0007457685445130658, 'weight_decay': 2.727870739341261e-05, 'epochs': 58, 'loss': 'mae', 'optimizer': 'adam', 'graph_mode': 'cutoff', 'cutoff': 0.32734722343987793, 'grm_norm': 'gcn', 'self_loops': True, 'use_snp_selection': False}. Best is trial 119 with value: 0.3186191315699354.
[I 2025-11-13 08:13:37,988] Trial 136 finished with value: 0.2956707805456486 and parameters: {'model_type': 'graphsage', 'hidden_dims': '[512, 256]', 'dropout': 0.5715767300750482, 'batch_norm': True, 'lr': 0.0007291240142730561, 'weight_decay': 3.0706952861863205e-05, 'epochs': 58, 'loss': 'mae', 'optimizer': 'adam', 'graph_mode': 'cutoff', 'cutoff': 0.3286186278850129, 'grm_norm': 'gcn', 'self_loops': True, 'use_snp_selection': False}. Best is trial 119 with value: 0.3186191315699354.
[I 2025-11-13 08:14:44,187] Trial 137 finished with value: 0.2999669790964326 and parameters: {'model_type': 'graphsage', 'hidden_dims': '[512, 256]', 'dropout': 0.5994904370747175, 'batch_norm': True, 'lr': 0.0006470293060989458, 'weight_decay': 4.5815455813449655e-05, 'epochs': 56, 'loss': 'mae', 'optimizer': 'adam', 'graph_mode': 'cutoff', 'cutoff': 0.31607717570172794, 'grm_norm': 'gcn', 'self_loops': True, 'use_snp_selection': False}. Best is trial 119 with value: 0.3186191315699354.
[I 2025-11-13 08:15:43,835] Trial 138 finished with value: 0.3032594452707428 and parameters: {'model_type': 'graphsage', 'hidden_dims': '[512, 256]', 'dropout': 0.587493968693101, 'batch_norm': True, 'lr': 0.0008790702077959451, 'weight_decay': 2.657467614362179e-05, 'epochs': 50, 'loss': 'mae', 'optimizer': 'adam', 'graph_mode': 'cutoff', 'cutoff': 0.3417980356142996, 'grm_norm': 'gcn', 'self_loops': True, 'use_snp_selection': False}. Best is trial 119 with value: 0.3186191315699354.
[I 2025-11-13 08:16:38,225] Trial 139 finished with value: 0.30656642451535643 and parameters: {'model_type': 'graphsage', 'hidden_dims': '[512, 256]', 'dropout': 0.5293928821781335, 'batch_norm': True, 'lr': 0.0005491008981892174, 'weight_decay': 2.2405219141182488e-05, 'epochs': 45, 'loss': 'mae', 'optimizer': 'adam', 'graph_mode': 'cutoff', 'cutoff': 0.3776907003763078, 'grm_norm': 'gcn', 'self_loops': True, 'use_snp_selection': False}. Best is trial 119 with value: 0.3186191315699354.
