[I 2025-11-03 12:50:25,834] Trial 60 finished with value: 0.07273710673377327 and parameters: {'model_type': 'graphsage', 'hidden_dims': '[128, 64]', 'dropout': 0.24459884454654868, 'batch_norm': True, 'lr': 2.646496790450514e-05, 'weight_decay': 1.3687785898155893e-06, 'epochs': 49, 'loss': 'mae', 'optimizer': 'adam', 'graph_mode': 'cutoff', 'cutoff': 0.8192705559455835, 'grm_norm': 'gcn', 'self_loops': False, 'use_snp_selection': True, 'num_snps': 33246}. Best is trial 18 with value: 0.12844001782559744.
[I 2025-11-03 12:50:30,570] Trial 61 finished with value: 0.1097059647328603 and parameters: {'model_type': 'graphsage', 'hidden_dims': '[256, 128]', 'dropout': 0.35535119516642705, 'batch_norm': True, 'lr': 0.000755088298703929, 'weight_decay': 2.2568008761346947e-06, 'epochs': 231, 'loss': 'mae', 'optimizer': 'adam', 'graph_mode': 'knn', 'source': 'grm', 'knn_k': 8, 'weighted_edges': True, 'symmetrize_mode': 'mutual', 'use_snp_selection': True, 'num_snps': 48612}. Best is trial 18 with value: 0.12844001782559744.
[I 2025-11-03 12:50:37,078] Trial 62 finished with value: 0.12145198616230204 and parameters: {'model_type': 'graphsage', 'hidden_dims': '[512, 64]', 'dropout': 0.2995632417818122, 'batch_norm': True, 'lr': 0.0004995978185448084, 'weight_decay': 4.106526053949988e-06, 'epochs': 316, 'loss': 'mae', 'optimizer': 'adam', 'graph_mode': 'knn', 'source': 'grm', 'knn_k': 7, 'weighted_edges': True, 'symmetrize_mode': 'mutual', 'use_snp_selection': True, 'num_snps': 45708}. Best is trial 18 with value: 0.12844001782559744.
[I 2025-11-03 12:50:42,682] Trial 63 finished with value: 0.11536141033672605 and parameters: {'model_type': 'graphsage', 'hidden_dims': '[512, 128]', 'dropout': 0.38256827710047314, 'batch_norm': True, 'lr': 0.00018488349604769597, 'weight_decay': 5.614639118333064e-07, 'epochs': 248, 'loss': 'mae', 'optimizer': 'adam', 'graph_mode': 'knn', 'source': 'grm', 'knn_k': 9, 'weighted_edges': True, 'symmetrize_mode': 'mutual', 'use_snp_selection': True, 'num_snps': 41762}. Best is trial 18 with value: 0.12844001782559744.
[I 2025-11-03 12:50:46,645] Trial 64 finished with value: 0.1004805832816009 and parameters: {'model_type': 'graphsage', 'hidden_dims': '[128, 64]', 'dropout': 0.4106473305876739, 'batch_norm': True, 'lr': 0.00032218214530114033, 'weight_decay': 9.061296949546983e-06, 'epochs': 272, 'loss': 'mae', 'optimizer': 'adam', 'graph_mode': 'cutoff', 'cutoff': 0.5812056562488601, 'grm_norm': 'cosine', 'self_loops': True, 'use_snp_selection': True, 'num_snps': 50488}. Best is trial 18 with value: 0.12844001782559744.
[I 2025-11-03 12:50:50,696] Trial 65 finished with value: 0.10836837974867722 and parameters: {'model_type': 'graphsage', 'hidden_dims': '[256, 128]', 'dropout': 0.20867291853313172, 'batch_norm': True, 'lr': 0.00043319381851177866, 'weight_decay': 3.2426493874307647e-07, 'epochs': 84, 'loss': 'mae', 'optimizer': 'adam', 'graph_mode': 'knn', 'source': 'grm', 'knn_k': 4, 'weighted_edges': True, 'symmetrize_mode': 'union', 'use_snp_selection': True, 'num_snps': 54761}. Best is trial 18 with value: 0.12844001782559744.
[I 2025-11-03 12:50:54,426] Trial 66 finished with value: 0.1204687410081064 and parameters: {'model_type': 'graphsage', 'hidden_dims': '[128, 64]', 'dropout': 0.4482465398221322, 'batch_norm': True, 'lr': 0.0002338458018042388, 'weight_decay': 4.7229316651768626e-07, 'epochs': 215, 'loss': 'mae', 'optimizer': 'adam', 'graph_mode': 'cutoff', 'cutoff': 0.22200835597410135, 'grm_norm': 'cosine_then_gcn', 'self_loops': False, 'use_snp_selection': True, 'num_snps': 37485}. Best is trial 18 with value: 0.12844001782559744.
[I 2025-11-03 12:50:59,961] Trial 67 finished with value: 0.11556770651584662 and parameters: {'model_type': 'graphsage', 'hidden_dims': '[512, 256]', 'dropout': 0.36131201538085633, 'batch_norm': True, 'lr': 0.0001454831209053523, 'weight_decay': 5.125861369869545e-06, 'epochs': 257, 'loss': 'mae', 'optimizer': 'adam', 'graph_mode': 'knn', 'source': 'grm', 'knn_k': 6, 'weighted_edges': False, 'symmetrize_mode': 'mutual', 'use_snp_selection': False}. Best is trial 18 with value: 0.12844001782559744.
[I 2025-11-03 12:51:04,337] Trial 68 finished with value: 0.09912307408385555 and parameters: {'model_type': 'graphsage', 'hidden_dims': '[256, 128]', 'dropout': 0.332280616988464, 'batch_norm': False, 'lr': 0.00010642068517916003, 'weight_decay': 1.4917603877943786e-07, 'epochs': 278, 'loss': 'mse', 'optimizer': 'adam', 'graph_mode': 'cutoff', 'cutoff': 0.6706550900045095, 'grm_norm': 'none', 'self_loops': False, 'use_snp_selection': True, 'num_snps': 48148}. Best is trial 18 with value: 0.12844001782559744.
[I 2025-11-03 12:51:08,056] Trial 69 finished with value: 0.10878221630039121 and parameters: {'model_type': 'graphsage', 'hidden_dims': '[128, 64]', 'dropout': 0.4780743148371972, 'batch_norm': True, 'lr': 0.0008588660591229101, 'weight_decay': 8.107668447521036e-07, 'epochs': 146, 'loss': 'mae', 'optimizer': 'adam', 'graph_mode': 'knn', 'source': 'grm', 'knn_k': 5, 'weighted_edges': True, 'symmetrize_mode': 'mutual', 'use_snp_selection': True, 'num_snps': 52623}. Best is trial 18 with value: 0.12844001782559744.
[I 2025-11-03 12:51:13,546] Trial 70 finished with value: 0.018443553298332804 and parameters: {'model_type': 'graphsage', 'hidden_dims': '[256, 128, 64]', 'dropout': 0.42149402686759707, 'batch_norm': True, 'lr': 1.749911206754197e-05, 'weight_decay': 1.6025631276893355e-05, 'epochs': 201, 'loss': 'mae', 'optimizer': 'adam', 'graph_mode': 'knn', 'source': 'grm', 'knn_k': 6, 'weighted_edges': False, 'symmetrize_mode': 'union', 'use_snp_selection': True, 'num_snps': 58020}. Best is trial 18 with value: 0.12844001782559744.
[I 2025-11-03 12:51:20,013] Trial 71 finished with value: 0.11960899134348361 and parameters: {'model_type': 'graphsage', 'hidden_dims': '[512, 64]', 'dropout': 0.30650378868755307, 'batch_norm': True, 'lr': 0.000497312570852757, 'weight_decay': 4.281401682870647e-06, 'epochs': 310, 'loss': 'mae', 'optimizer': 'adam', 'graph_mode': 'knn', 'source': 'grm', 'knn_k': 7, 'weighted_edges': True, 'symmetrize_mode': 'mutual', 'use_snp_selection': True, 'num_snps': 45755}. Best is trial 18 with value: 0.12844001782559744.
[I 2025-11-03 12:51:26,775] Trial 72 finished with value: 0.1111486866981294 and parameters: {'model_type': 'graphsage', 'hidden_dims': '[512, 64]', 'dropout': 0.2799399901684117, 'batch_norm': True, 'lr': 0.0006509002015800302, 'weight_decay': 4.075883394492963e-06, 'epochs': 322, 'loss': 'mae', 'optimizer': 'adam', 'graph_mode': 'knn', 'source': 'grm', 'knn_k': 7, 'weighted_edges': True, 'symmetrize_mode': 'mutual', 'use_snp_selection': True, 'num_snps': 47172}. Best is trial 18 with value: 0.12844001782559744.
[I 2025-11-03 12:51:33,279] Trial 73 finished with value: 0.11767329974583782 and parameters: {'model_type': 'graphsage', 'hidden_dims': '[512, 64]', 'dropout': 0.298958398130464, 'batch_norm': True, 'lr': 0.0004414439268841976, 'weight_decay': 2.2006518105640814e-06, 'epochs': 317, 'loss': 'mae', 'optimizer': 'adam', 'graph_mode': 'knn', 'source': 'grm', 'knn_k': 8, 'weighted_edges': True, 'symmetrize_mode': 'mutual', 'use_snp_selection': True, 'num_snps': 44539}. Best is trial 18 with value: 0.12844001782559744.
[I 2025-11-03 12:51:40,778] Trial 74 finished with value: 0.10780629462598518 and parameters: {'model_type': 'graphsage', 'hidden_dims': '[512, 64]', 'dropout': 0.3412781740283008, 'batch_norm': True, 'lr': 0.000269018302416519, 'weight_decay': 6.1509570304076205e-06, 'epochs': 347, 'loss': 'mae', 'optimizer': 'adam', 'graph_mode': 'knn', 'source': 'grm', 'knn_k': 9, 'weighted_edges': True, 'symmetrize_mode': 'mutual', 'use_snp_selection': True, 'num_snps': 49765}. Best is trial 18 with value: 0.12844001782559744.
[I 2025-11-03 12:51:44,358] Trial 75 finished with value: 0.08094273060474295 and parameters: {'model_type': 'graphsage', 'hidden_dims': '[256, 128]', 'dropout': 0.31850857707941777, 'batch_norm': True, 'lr': 5.554192574278583e-05, 'weight_decay': 9.858781281717789e-06, 'epochs': 126, 'loss': 'mae', 'optimizer': 'adam', 'graph_mode': 'knn', 'source': 'grm', 'knn_k': 6, 'weighted_edges': True, 'symmetrize_mode': 'mutual', 'use_snp_selection': True, 'num_snps': 41618}. Best is trial 18 with value: 0.12844001782559744.
[I 2025-11-03 12:51:47,625] Trial 76 finished with value: 0.008815739535409773 and parameters: {'model_type': 'graphsage', 'hidden_dims': '[512, 64]', 'dropout': 0.23672812767854817, 'batch_norm': False, 'lr': 0.0006042789062488067, 'weight_decay': 2.5246298305523863e-05, 'epochs': 40, 'loss': 'mse', 'optimizer': 'adam', 'graph_mode': 'knn', 'source': 'grm', 'knn_k': 8, 'weighted_edges': True, 'symmetrize_mode': 'mutual', 'use_snp_selection': True, 'num_snps': 35185}. Best is trial 18 with value: 0.12844001782559744.
[I 2025-11-03 12:51:51,122] Trial 77 finished with value: 0.038896366192821615 and parameters: {'model_type': 'graphsage', 'hidden_dims': '[256, 128]', 'dropout': 0.184354158544486, 'batch_norm': True, 'lr': 9.164969183816547e-06, 'weight_decay': 1.4723438745349212e-06, 'epochs': 299, 'loss': 'mae', 'optimizer': 'adam', 'graph_mode': 'cutoff', 'cutoff': 0.7324787960785397, 'grm_norm': 'gcn', 'self_loops': True, 'use_snp_selection': False}. Best is trial 18 with value: 0.12844001782559744.
[I 2025-11-03 12:51:55,876] Trial 78 finished with value: 0.12248252367431209 and parameters: {'model_type': 'graphsage', 'hidden_dims': '[128, 64]', 'dropout': 0.13251416754371748, 'batch_norm': False, 'lr': 0.00037629690791293947, 'weight_decay': 3.3904660603049324e-06, 'epochs': 338, 'loss': 'mae', 'optimizer': 'adam', 'graph_mode': 'knn', 'source': 'grm', 'knn_k': 7, 'weighted_edges': True, 'symmetrize_mode': 'mutual', 'use_snp_selection': True, 'num_snps': 53599}. Best is trial 18 with value: 0.12844001782559744.
[I 2025-11-03 12:52:00,084] Trial 79 finished with value: 0.07998921212448844 and parameters: {'model_type': 'graphsage', 'hidden_dims': '[128, 64]', 'dropout': 0.4414066862368493, 'batch_norm': False, 'lr': 0.00020234343812382233, 'weight_decay': 1.1490550768034324e-06, 'epochs': 337, 'loss': 'mse', 'optimizer': 'adam', 'graph_mode': 'cutoff', 'cutoff': 0.8152380872910133, 'grm_norm': 'cosine', 'self_loops': False, 'use_snp_selection': True, 'num_snps': 54324}. Best is trial 18 with value: 0.12844001782559744.
[I 2025-11-03 12:52:04,056] Trial 80 finished with value: 0.12439112937497805 and parameters: {'model_type': 'graphsage', 'hidden_dims': '[128, 64]', 'dropout': 0.12415852582877725, 'batch_norm': False, 'lr': 0.0003644817686182456, 'weight_decay': 3.254699703232309e-06, 'epochs': 164, 'loss': 'mae', 'optimizer': 'adam', 'graph_mode': 'knn', 'source': 'grm', 'knn_k': 5, 'weighted_edges': True, 'symmetrize_mode': 'mutual', 'use_snp_selection': True, 'num_snps': 56328}. Best is trial 18 with value: 0.12844001782559744.
[I 2025-11-03 12:52:07,931] Trial 81 finished with value: 0.08478278412569382 and parameters: {'model_type': 'graphsage', 'hidden_dims': '[128, 64]', 'dropout': 0.12596047668830412, 'batch_norm': False, 'lr': 0.0003278649786689287, 'weight_decay': 1.99909661703181e-06, 'epochs': 162, 'loss': 'mae', 'optimizer': 'adam', 'graph_mode': 'knn', 'source': 'grm', 'knn_k': 4, 'weighted_edges': True, 'symmetrize_mode': 'mutual', 'use_snp_selection': True, 'num_snps': 55956}. Best is trial 18 with value: 0.12844001782559744.
[I 2025-11-03 12:52:11,739] Trial 82 finished with value: 0.09201448298984861 and parameters: {'model_type': 'graphsage', 'hidden_dims': '[128, 64]', 'dropout': 0.1035538700016326, 'batch_norm': False, 'lr': 0.0001524137955502951, 'weight_decay': 3.4254368497868e-06, 'epochs': 180, 'loss': 'mae', 'optimizer': 'adam', 'graph_mode': 'knn', 'source': 'grm', 'knn_k': 5, 'weighted_edges': True, 'symmetrize_mode': 'mutual', 'use_snp_selection': True, 'num_snps': 51945}. Best is trial 18 with value: 0.12844001782559744.
[I 2025-11-03 12:52:15,717] Trial 83 finished with value: 0.130537436953886 and parameters: {'model_type': 'graphsage', 'hidden_dims': '[128, 64]', 'dropout': 0.16229881838906962, 'batch_norm': False, 'lr': 0.0002453944865360573, 'weight_decay': 2.8501422300677615e-06, 'epochs': 151, 'loss': 'mae', 'optimizer': 'adam', 'graph_mode': 'knn', 'source': 'grm', 'knn_k': 3, 'weighted_edges': True, 'symmetrize_mode': 'mutual', 'use_snp_selection': True, 'num_snps': 59652}. Best is trial 83 with value: 0.130537436953886.
[I 2025-11-03 12:52:19,636] Trial 84 finished with value: 0.09275802196384535 and parameters: {'model_type': 'graphsage', 'hidden_dims': '[128, 64]', 'dropout': 0.1591086738791932, 'batch_norm': False, 'lr': 0.00022934302260022043, 'weight_decay': 2.584600035062687e-06, 'epochs': 154, 'loss': 'mae', 'optimizer': 'adam', 'graph_mode': 'knn', 'source': 'grm', 'knn_k': 3, 'weighted_edges': True, 'symmetrize_mode': 'mutual', 'use_snp_selection': True, 'num_snps': 58722}. Best is trial 83 with value: 0.130537436953886.
[I 2025-11-03 12:52:23,535] Trial 85 finished with value: 0.10524437288309212 and parameters: {'model_type': 'graphsage', 'hidden_dims': '[128, 64]', 'dropout': 0.18484329071874178, 'batch_norm': False, 'lr': 2.8368643219688734e-05, 'weight_decay': 3.4181919157348445e-07, 'epochs': 165, 'loss': 'mae', 'optimizer': 'adam', 'graph_mode': 'knn', 'source': 'grm', 'knn_k': 2, 'weighted_edges': True, 'symmetrize_mode': 'mutual', 'use_snp_selection': True, 'num_snps': 59966}. Best is trial 83 with value: 0.130537436953886.
[I 2025-11-03 12:52:27,337] Trial 86 finished with value: 0.09972609808325278 and parameters: {'model_type': 'graphsage', 'hidden_dims': '[128, 64]', 'dropout': 0.11711497037663357, 'batch_norm': False, 'lr': 0.000257613727848171, 'weight_decay': 3.468701284917046e-05, 'epochs': 131, 'loss': 'mae', 'optimizer': 'adam', 'graph_mode': 'cutoff', 'cutoff': 0.3629297051069996, 'grm_norm': 'none', 'self_loops': False, 'use_snp_selection': True, 'num_snps': 56307}. Best is trial 83 with value: 0.130537436953886.
[I 2025-11-03 12:52:33,373] Trial 87 finished with value: 0.08665494446784795 and parameters: {'model_type': 'graphsage', 'hidden_dims': '[512, 128]', 'dropout': 0.16401775096851545, 'batch_norm': False, 'lr': 0.0002944653684990287, 'weight_decay': 1.6360754728305832e-06, 'epochs': 171, 'loss': 'mae', 'optimizer': 'adam', 'graph_mode': 'knn', 'source': 'grm', 'knn_k': 3, 'weighted_edges': False, 'symmetrize_mode': 'union', 'use_snp_selection': True, 'num_snps': 57777}. Best is trial 83 with value: 0.130537436953886.
[I 2025-11-03 12:52:36,057] Trial 88 finished with value: 0.10088380018202035 and parameters: {'model_type': 'graphsage', 'hidden_dims': '[128, 64]', 'dropout': 0.14007437693799057, 'batch_norm': False, 'lr': 0.00013859595593238851, 'weight_decay': 9.608289674437514e-07, 'epochs': 189, 'loss': 'mse', 'optimizer': 'adam', 'graph_mode': 'cutoff', 'cutoff': 0.592850960695816, 'grm_norm': 'cosine_then_gcn', 'self_loops': True, 'use_snp_selection': True, 'num_snps': 24230}. Best is trial 83 with value: 0.130537436953886.
[I 2025-11-03 12:52:39,929] Trial 89 finished with value: 0.0945398428729806 and parameters: {'model_type': 'graphsage', 'hidden_dims': '[256, 128]', 'dropout': 0.15031668654386635, 'batch_norm': False, 'lr': 0.00015999436400865834, 'weight_decay': 2.1994788671893283e-07, 'epochs': 112, 'loss': 'mae', 'optimizer': 'adam', 'graph_mode': 'knn', 'source': 'grm', 'knn_k': 4, 'weighted_edges': True, 'symmetrize_mode': 'mutual', 'use_snp_selection': True, 'num_snps': 49302}. Best is trial 83 with value: 0.130537436953886.
[I 2025-11-03 12:52:41,688] Trial 90 finished with value: 0.09081979487942737 and parameters: {'model_type': 'graphsage', 'hidden_dims': '[128, 64]', 'dropout': 0.21854141485942147, 'batch_norm': False, 'lr': 9.527383062242359e-05, 'weight_decay': 1.1474287110093458e-07, 'epochs': 147, 'loss': 'mae', 'optimizer': 'adam', 'graph_mode': 'cutoff', 'cutoff': 0.7089891644147948, 'grm_norm': 'none', 'self_loops': False, 'use_snp_selection': False}. Best is trial 83 with value: 0.130537436953886.
[I 2025-11-03 12:52:45,798] Trial 91 finished with value: 0.11075310917005575 and parameters: {'model_type': 'graphsage', 'hidden_dims': '[128, 64]', 'dropout': 0.11946027883916742, 'batch_norm': False, 'lr': 0.0003844718903541937, 'weight_decay': 3.087511575054715e-06, 'epochs': 226, 'loss': 'mae', 'optimizer': 'adam', 'graph_mode': 'knn', 'source': 'grm', 'knn_k': 5, 'weighted_edges': True, 'symmetrize_mode': 'mutual', 'use_snp_selection': True, 'num_snps': 54901}. Best is trial 83 with value: 0.130537436953886.
[I 2025-11-03 12:52:49,706] Trial 92 finished with value: 0.10884378767161969 and parameters: {'model_type': 'graphsage', 'hidden_dims': '[128, 64]', 'dropout': 0.17865574070381393, 'batch_norm': False, 'lr': 0.0003885498365365242, 'weight_decay': 5.912017541550698e-06, 'epochs': 202, 'loss': 'mae', 'optimizer': 'adam', 'graph_mode': 'knn', 'source': 'grm', 'knn_k': 4, 'weighted_edges': True, 'symmetrize_mode': 'mutual', 'use_snp_selection': True, 'num_snps': 53375}. Best is trial 83 with value: 0.130537436953886.
[I 2025-11-03 12:52:53,155] Trial 93 finished with value: 0.09420453802194342 and parameters: {'model_type': 'graphsage', 'hidden_dims': '[128, 64]', 'dropout': 0.14282285632939873, 'batch_norm': False, 'lr': 0.0005534523116092926, 'weight_decay': 2.0446158793138477e-06, 'epochs': 93, 'loss': 'mae', 'optimizer': 'adam', 'graph_mode': 'knn', 'source': 'grm', 'knn_k': 5, 'weighted_edges': True, 'symmetrize_mode': 'mutual', 'use_snp_selection': True, 'num_snps': 51446}. Best is trial 83 with value: 0.130537436953886.
[I 2025-11-03 12:52:57,266] Trial 94 finished with value: 0.1027829477168052 and parameters: {'model_type': 'graphsage', 'hidden_dims': '[128, 64]', 'dropout': 0.12942576482912452, 'batch_norm': False, 'lr': 0.0007117474332001341, 'weight_decay': 7.798859972447927e-06, 'epochs': 243, 'loss': 'mae', 'optimizer': 'adam', 'graph_mode': 'knn', 'source': 'grm', 'knn_k': 2, 'weighted_edges': True, 'symmetrize_mode': 'mutual', 'use_snp_selection': True, 'num_snps': 56496}. Best is trial 83 with value: 0.130537436953886.
[I 2025-11-03 12:53:01,315] Trial 95 finished with value: 0.10775621937076922 and parameters: {'model_type': 'graphsage', 'hidden_dims': '[256, 128]', 'dropout': 0.17044112647681378, 'batch_norm': False, 'lr': 0.0004289259682728787, 'weight_decay': 5.063394991559906e-07, 'epochs': 119, 'loss': 'mae', 'optimizer': 'adam', 'graph_mode': 'knn', 'source': 'grm', 'knn_k': 3, 'weighted_edges': True, 'symmetrize_mode': 'mutual', 'use_snp_selection': True, 'num_snps': 53726}. Best is trial 83 with value: 0.130537436953886.
[I 2025-11-03 12:53:04,005] Trial 96 finished with value: 0.11341503801709589 and parameters: {'model_type': 'graphsage', 'hidden_dims': '[128, 64]', 'dropout': 0.10712416538211675, 'batch_norm': False, 'lr': 0.0009578559970683846, 'weight_decay': 2.756641481461368e-06, 'epochs': 65, 'loss': 'mae', 'optimizer': 'adam', 'graph_mode': 'cutoff', 'cutoff': 0.5474458070705048, 'grm_norm': 'none', 'self_loops': False, 'use_snp_selection': True, 'num_snps': 37921}. Best is trial 83 with value: 0.130537436953886.
[I 2025-11-03 12:53:06,894] Trial 97 finished with value: 0.1004837555255473 and parameters: {'model_type': 'graphsage', 'hidden_dims': '[512, 256]', 'dropout': 0.1967973456504888, 'batch_norm': False, 'lr': 0.00032211047621543543, 'weight_decay': 7.171380771189319e-07, 'epochs': 289, 'loss': 'mse', 'optimizer': 'adam', 'graph_mode': 'knn', 'source': 'grm', 'knn_k': 6, 'weighted_edges': True, 'symmetrize_mode': 'mutual', 'use_snp_selection': True, 'num_snps': 13109}. Best is trial 83 with value: 0.130537436953886.
[I 2025-11-03 12:53:10,530] Trial 98 finished with value: 0.12278305271337679 and parameters: {'model_type': 'graphsage', 'hidden_dims': '[128, 64]', 'dropout': 0.3752531331133424, 'batch_norm': False, 'lr': 0.00019305960011784638, 'weight_decay': 1.2798411571540919e-05, 'epochs': 139, 'loss': 'mae', 'optimizer': 'adam', 'graph_mode': 'cutoff', 'cutoff': 0.7913988314139031, 'grm_norm': 'cosine', 'self_loops': True, 'use_snp_selection': True, 'num_snps': 58208}. Best is trial 83 with value: 0.130537436953886.
[I 2025-11-03 12:53:14,800] Trial 99 finished with value: 0.10360767182900993 and parameters: {'model_type': 'graphsage', 'hidden_dims': '[256, 128, 64]', 'dropout': 0.3726771306095565, 'batch_norm': True, 'lr': 0.00022114861367795354, 'weight_decay': 2.1081034150187507e-05, 'epochs': 137, 'loss': 'mae', 'optimizer': 'adam', 'graph_mode': 'cutoff', 'cutoff': 0.7949552131745259, 'grm_norm': 'cosine', 'self_loops': True, 'use_snp_selection': True, 'num_snps': 58100}. Best is trial 83 with value: 0.130537436953886.
[I 2025-11-03 12:53:18,881] Trial 100 finished with value: 0.10283837407998443 and parameters: {'model_type': 'graphsage', 'hidden_dims': '[256, 128]', 'dropout': 0.4165256528598459, 'batch_norm': False, 'lr': 0.0001892771356367473, 'weight_decay': 1.1254792257010665e-05, 'epochs': 104, 'loss': 'mae', 'optimizer': 'adam', 'graph_mode': 'cutoff', 'cutoff': 0.837413852746177, 'grm_norm': 'cosine', 'self_loops': True, 'use_snp_selection': True, 'num_snps': 59409}. Best is trial 83 with value: 0.130537436953886.
[I 2025-11-03 12:53:22,500] Trial 101 finished with value: 0.10791923350854722 and parameters: {'model_type': 'graphsage', 'hidden_dims': '[128, 64]', 'dropout': 0.3980572720161112, 'batch_norm': False, 'lr': 0.00012855932111435035, 'weight_decay': 1.4169600675563904e-05, 'epochs': 155, 'loss': 'mae', 'optimizer': 'adam', 'graph_mode': 'cutoff', 'cutoff': 0.7479335033065385, 'grm_norm': 'cosine', 'self_loops': True, 'use_snp_selection': True, 'num_snps': 55282}. Best is trial 83 with value: 0.130537436953886.
