[I 2025-11-03 12:11:02,824] Trial 23 finished with value: 0.04727700798786299 and parameters: {'model_type': 'graphsage', 'hidden_dims': '[256, 128]', 'dropout': 0.394003964033697, 'batch_norm': False, 'lr': 0.0001938480754094439, 'weight_decay': 5.2929091513826594e-06, 'epochs': 211, 'loss': 'mae', 'optimizer': 'adam', 'graph_mode': 'knn', 'source': 'grm', 'knn_k': 3, 'weighted_edges': False, 'symmetrize_mode': 'mutual', 'use_snp_selection': True, 'num_snps': 53374}. Best is trial 1 with value: 0.08222103821032176.
[I 2025-11-03 12:11:06,512] Trial 24 finished with value: 0.04661373606883598 and parameters: {'model_type': 'graphsage', 'hidden_dims': '[256, 128]', 'dropout': 0.46399909333611133, 'batch_norm': False, 'lr': 1.7371024677002605e-05, 'weight_decay': 1.0990594056613746e-07, 'epochs': 131, 'loss': 'mae', 'optimizer': 'adam', 'graph_mode': 'knn', 'source': 'grm', 'knn_k': 7, 'weighted_edges': True, 'symmetrize_mode': 'mutual', 'use_snp_selection': True, 'num_snps': 33638}. Best is trial 1 with value: 0.08222103821032176.
[I 2025-11-03 12:11:11,385] Trial 25 finished with value: 0.05804114197184718 and parameters: {'model_type': 'graphsage', 'hidden_dims': '[512, 64]', 'dropout': 0.46819797531061047, 'batch_norm': False, 'lr': 6.623631921369864e-05, 'weight_decay': 1.4185665487933214e-06, 'epochs': 72, 'loss': 'mae', 'optimizer': 'adam', 'graph_mode': 'knn', 'source': 'grm', 'knn_k': 3, 'weighted_edges': False, 'symmetrize_mode': 'union', 'use_snp_selection': True, 'num_snps': 49502}. Best is trial 1 with value: 0.08222103821032176.
[I 2025-11-03 12:11:18,043] Trial 26 finished with value: 0.053423326468046435 and parameters: {'model_type': 'graphsage', 'hidden_dims': '[512, 128]', 'dropout': 0.3184316967117844, 'batch_norm': True, 'lr': 0.000548123363523585, 'weight_decay': 3.5338603860371595e-07, 'epochs': 177, 'loss': 'mae', 'optimizer': 'adam', 'graph_mode': 'cutoff', 'cutoff': 0.21893296452969285, 'grm_norm': 'gcn', 'self_loops': True, 'use_snp_selection': False}. Best is trial 1 with value: 0.08222103821032176.
[I 2025-11-03 12:11:21,158] Trial 27 finished with value: 0.0592735606201003 and parameters: {'model_type': 'graphsage', 'hidden_dims': '[256, 128, 64]', 'dropout': 0.40161366423789685, 'batch_norm': False, 'lr': 5.4406711524342944e-05, 'weight_decay': 2.0802888662257024e-06, 'epochs': 95, 'loss': 'mse', 'optimizer': 'adam', 'graph_mode': 'knn', 'source': 'grm', 'knn_k': 7, 'weighted_edges': True, 'symmetrize_mode': 'union', 'use_snp_selection': True, 'num_snps': 26836}. Best is trial 1 with value: 0.08222103821032176.
[I 2025-11-03 12:11:23,069] Trial 28 finished with value: 0.0705985025937735 and parameters: {'model_type': 'graphsage', 'hidden_dims': '[128, 64]', 'dropout': 0.5082986059342639, 'batch_norm': True, 'lr': 0.000584557488244405, 'weight_decay': 8.006321916645954e-07, 'epochs': 141, 'loss': 'mae', 'optimizer': 'adam', 'graph_mode': 'cutoff', 'cutoff': 0.843321845085844, 'grm_norm': 'gcn', 'self_loops': False, 'use_snp_selection': False}. Best is trial 1 with value: 0.08222103821032176.
[I 2025-11-03 12:11:27,263] Trial 29 finished with value: 0.06527134176120566 and parameters: {'model_type': 'graphsage', 'hidden_dims': '[128, 64]', 'dropout': 0.33072721289002094, 'batch_norm': True, 'lr': 0.00018406831912293035, 'weight_decay': 5.1079515105789643e-05, 'epochs': 336, 'loss': 'mae', 'optimizer': 'adam', 'graph_mode': 'knn', 'source': 'grm', 'knn_k': 9, 'weighted_edges': False, 'symmetrize_mode': 'mutual', 'use_snp_selection': False}. Best is trial 1 with value: 0.08222103821032176.
[I 2025-11-03 12:11:31,724] Trial 30 finished with value: 0.035068997266039466 and parameters: {'model_type': 'graphsage', 'hidden_dims': '[256, 128]', 'dropout': 0.20380770388212888, 'batch_norm': False, 'lr': 1.8127306336078563e-06, 'weight_decay': 7.681742100004565e-06, 'epochs': 199, 'loss': 'mse', 'optimizer': 'adam', 'graph_mode': 'knn', 'source': 'grm', 'knn_k': 6, 'weighted_edges': False, 'symmetrize_mode': 'union', 'use_snp_selection': True, 'num_snps': 35107}. Best is trial 1 with value: 0.08222103821032176.
[I 2025-11-03 12:11:35,892] Trial 31 finished with value: 0.05407113635660995 and parameters: {'model_type': 'graphsage', 'hidden_dims': '[256, 128]', 'dropout': 0.4179749548444102, 'batch_norm': False, 'lr': 3.177424869691162e-05, 'weight_decay': 6.553670975289463e-07, 'epochs': 164, 'loss': 'mae', 'optimizer': 'adam', 'graph_mode': 'knn', 'source': 'grm', 'knn_k': 1, 'weighted_edges': False, 'symmetrize_mode': 'mutual', 'use_snp_selection': True, 'num_snps': 43114}. Best is trial 1 with value: 0.08222103821032176.
[I 2025-11-03 12:11:40,164] Trial 32 finished with value: 0.04436127350351124 and parameters: {'model_type': 'graphsage', 'hidden_dims': '[256, 128]', 'dropout': 0.43856809791038104, 'batch_norm': False, 'lr': 4.4080439984798254e-05, 'weight_decay': 2.1357275726282857e-07, 'epochs': 105, 'loss': 'mae', 'optimizer': 'adam', 'graph_mode': 'knn', 'source': 'grm', 'knn_k': 2, 'weighted_edges': False, 'symmetrize_mode': 'mutual', 'use_snp_selection': True, 'num_snps': 51724}. Best is trial 1 with value: 0.08222103821032176.
[I 2025-11-03 12:11:44,117] Trial 33 finished with value: 0.051579478860021344 and parameters: {'model_type': 'graphsage', 'hidden_dims': '[256, 128]', 'dropout': 0.5398934640306774, 'batch_norm': False, 'lr': 1.343901937957676e-05, 'weight_decay': 8.987187349826697e-07, 'epochs': 116, 'loss': 'mae', 'optimizer': 'adam', 'graph_mode': 'knn', 'source': 'grm', 'knn_k': 1, 'weighted_edges': False, 'symmetrize_mode': 'mutual', 'use_snp_selection': True, 'num_snps': 44772}. Best is trial 1 with value: 0.08222103821032176.
[I 2025-11-03 12:11:47,597] Trial 34 finished with value: 0.006799923041811933 and parameters: {'model_type': 'graphsage', 'hidden_dims': '[256, 128, 64]', 'dropout': 0.3770472239267776, 'batch_norm': False, 'lr': 1.0775369796266179e-06, 'weight_decay': 2.4493531718844005e-06, 'epochs': 162, 'loss': 'mae', 'optimizer': 'adam', 'graph_mode': 'knn', 'source': 'grm', 'knn_k': 3, 'weighted_edges': False, 'symmetrize_mode': 'mutual', 'use_snp_selection': True, 'num_snps': 30375}. Best is trial 1 with value: 0.08222103821032176.
[I 2025-11-03 12:11:50,011] Trial 35 finished with value: 0.020031582971860733 and parameters: {'model_type': 'graphsage', 'hidden_dims': '[256, 128]', 'dropout': 0.4491058444336928, 'batch_norm': False, 'lr': 0.00029318864434131343, 'weight_decay': 1.1015921874521126e-05, 'epochs': 60, 'loss': 'mae', 'optimizer': 'adam', 'graph_mode': 'knn', 'source': 'grm', 'knn_k': 2, 'weighted_edges': True, 'symmetrize_mode': 'mutual', 'use_snp_selection': True, 'num_snps': 18811}. Best is trial 1 with value: 0.08222103821032176.
[I 2025-11-03 12:11:55,263] Trial 36 finished with value: 0.063068481978194 and parameters: {'model_type': 'graphsage', 'hidden_dims': '[512, 256]', 'dropout': 0.5001059937418094, 'batch_norm': False, 'lr': 0.00012510759201423945, 'weight_decay': 5.698717635921322e-07, 'epochs': 206, 'loss': 'mae', 'optimizer': 'adam', 'graph_mode': 'knn', 'source': 'grm', 'knn_k': 4, 'weighted_edges': False, 'symmetrize_mode': 'mutual', 'use_snp_selection': True, 'num_snps': 36282}. Best is trial 1 with value: 0.08222103821032176.
[I 2025-11-03 12:11:57,162] Trial 37 finished with value: 0.03808118912366759 and parameters: {'model_type': 'graphsage', 'hidden_dims': '[128, 64]', 'dropout': 0.5411264114671275, 'batch_norm': True, 'lr': 2.359202049739883e-05, 'weight_decay': 2.8484501184018403e-05, 'epochs': 132, 'loss': 'mse', 'optimizer': 'adam', 'graph_mode': 'cutoff', 'cutoff': 0.6236472197825207, 'grm_norm': 'cosine', 'self_loops': False, 'use_snp_selection': False}. Best is trial 1 with value: 0.08222103821032176.
[I 2025-11-03 12:12:01,199] Trial 38 finished with value: 0.052585632598496364 and parameters: {'model_type': 'graphsage', 'hidden_dims': '[256, 128]', 'dropout': 0.3349897195180314, 'batch_norm': False, 'lr': 6.5312117104988666e-06, 'weight_decay': 1.0749558367069775e-06, 'epochs': 184, 'loss': 'mae', 'optimizer': 'adam', 'graph_mode': 'cutoff', 'cutoff': 0.7755176879941617, 'grm_norm': 'none', 'self_loops': True, 'use_snp_selection': True, 'num_snps': 41009}. Best is trial 1 with value: 0.08222103821032176.
[I 2025-11-03 12:12:07,621] Trial 39 finished with value: 0.06538824596559079 and parameters: {'model_type': 'graphsage', 'hidden_dims': '[512, 256]', 'dropout': 0.48593661399293986, 'batch_norm': True, 'lr': 0.0006498771163456438, 'weight_decay': 6.740669364733419e-06, 'epochs': 241, 'loss': 'mse', 'optimizer': 'adam', 'graph_mode': 'knn', 'source': 'grm', 'knn_k': 4, 'weighted_edges': False, 'symmetrize_mode': 'mutual', 'use_snp_selection': False}. Best is trial 1 with value: 0.08222103821032176.
[I 2025-11-03 12:12:15,007] Trial 40 finished with value: 0.07891894985540195 and parameters: {'model_type': 'graphsage', 'hidden_dims': '[512, 128]', 'dropout': 0.3818682243704575, 'batch_norm': False, 'lr': 4.1446658653809325e-05, 'weight_decay': 1.75103775265369e-05, 'epochs': 220, 'loss': 'mae', 'optimizer': 'adam', 'graph_mode': 'cutoff', 'cutoff': 0.596162491420265, 'grm_norm': 'cosine_then_gcn', 'self_loops': False, 'use_snp_selection': True, 'num_snps': 59493}. Best is trial 1 with value: 0.08222103821032176.
[I 2025-11-03 12:12:22,044] Trial 41 finished with value: 0.06272661572816797 and parameters: {'model_type': 'graphsage', 'hidden_dims': '[512, 128]', 'dropout': 0.3889975192657711, 'batch_norm': False, 'lr': 4.220186872277607e-05, 'weight_decay': 0.00027939501953647003, 'epochs': 220, 'loss': 'mae', 'optimizer': 'adam', 'graph_mode': 'cutoff', 'cutoff': 0.5850627745775594, 'grm_norm': 'cosine_then_gcn', 'self_loops': False, 'use_snp_selection': True, 'num_snps': 56370}. Best is trial 1 with value: 0.08222103821032176.
[I 2025-11-03 12:12:29,399] Trial 42 finished with value: 0.038389697300546304 and parameters: {'model_type': 'graphsage', 'hidden_dims': '[512, 128]', 'dropout': 0.43472444414283656, 'batch_norm': False, 'lr': 2.166447150256647e-05, 'weight_decay': 1.9057224129874088e-05, 'epochs': 258, 'loss': 'mae', 'optimizer': 'adam', 'graph_mode': 'cutoff', 'cutoff': 0.4592613234108678, 'grm_norm': 'cosine_then_gcn', 'self_loops': False, 'use_snp_selection': True, 'num_snps': 49006}. Best is trial 1 with value: 0.08222103821032176.
[I 2025-11-03 12:12:37,885] Trial 43 finished with value: 0.07641017559768289 and parameters: {'model_type': 'graphsage', 'hidden_dims': '[512, 128]', 'dropout': 0.36166120069440794, 'batch_norm': False, 'lr': 8.584080542381472e-05, 'weight_decay': 8.652714839759705e-05, 'epochs': 291, 'loss': 'mae', 'optimizer': 'adam', 'graph_mode': 'cutoff', 'cutoff': 0.5397632056004301, 'grm_norm': 'cosine_then_gcn', 'self_loops': False, 'use_snp_selection': True, 'num_snps': 59900}. Best is trial 1 with value: 0.08222103821032176.
[I 2025-11-03 12:12:46,387] Trial 44 finished with value: 0.09493597660634573 and parameters: {'model_type': 'graphsage', 'hidden_dims': '[512, 128]', 'dropout': 0.26337827409820014, 'batch_norm': False, 'lr': 8.250026821308266e-05, 'weight_decay': 0.0009248101721647486, 'epochs': 298, 'loss': 'mae', 'optimizer': 'adam', 'graph_mode': 'cutoff', 'cutoff': 0.5471402393948368, 'grm_norm': 'cosine_then_gcn', 'self_loops': False, 'use_snp_selection': True, 'num_snps': 59280}. Best is trial 44 with value: 0.09493597660634573.
[I 2025-11-03 12:12:54,930] Trial 45 finished with value: 0.09667724270876493 and parameters: {'model_type': 'graphsage', 'hidden_dims': '[512, 128]', 'dropout': 0.14082551590451087, 'batch_norm': False, 'lr': 0.0001386658820749056, 'weight_decay': 0.0008821587040612635, 'epochs': 346, 'loss': 'mae', 'optimizer': 'adam', 'graph_mode': 'cutoff', 'cutoff': 0.6021860385160439, 'grm_norm': 'cosine_then_gcn', 'self_loops': False, 'use_snp_selection': True, 'num_snps': 54868}. Best is trial 45 with value: 0.09667724270876493.
[I 2025-11-03 12:13:03,937] Trial 46 finished with value: 0.0698299233655847 and parameters: {'model_type': 'graphsage', 'hidden_dims': '[512, 128]', 'dropout': 0.15412750491722332, 'batch_norm': False, 'lr': 0.00015197697431096083, 'weight_decay': 0.0008550450633746047, 'epochs': 350, 'loss': 'mse', 'optimizer': 'adam', 'graph_mode': 'cutoff', 'cutoff': 0.4966524114963693, 'grm_norm': 'cosine_then_gcn', 'self_loops': False, 'use_snp_selection': True, 'num_snps': 54325}. Best is trial 45 with value: 0.09667724270876493.
[I 2025-11-03 12:13:11,085] Trial 47 finished with value: 0.06681715953021689 and parameters: {'model_type': 'graphsage', 'hidden_dims': '[512, 128]', 'dropout': 0.2650465024853026, 'batch_norm': True, 'lr': 0.0003438337391870345, 'weight_decay': 0.0005399932824255969, 'epochs': 316, 'loss': 'mae', 'optimizer': 'adam', 'graph_mode': 'cutoff', 'cutoff': 0.614494044162204, 'grm_norm': 'cosine_then_gcn', 'self_loops': False, 'use_snp_selection': False}. Best is trial 45 with value: 0.09667724270876493.
[I 2025-11-03 12:13:19,135] Trial 48 finished with value: 0.06758280297024605 and parameters: {'model_type': 'graphsage', 'hidden_dims': '[512, 64]', 'dropout': 0.19202323075788785, 'batch_norm': False, 'lr': 0.00019862230553846304, 'weight_decay': 0.0004353173220648906, 'epochs': 319, 'loss': 'mse', 'optimizer': 'adam', 'graph_mode': 'cutoff', 'cutoff': 0.43284316762688035, 'grm_norm': 'gcn', 'self_loops': False, 'use_snp_selection': True, 'num_snps': 47094}. Best is trial 45 with value: 0.09667724270876493.
[I 2025-11-03 12:13:25,915] Trial 49 finished with value: 0.06043209297059603 and parameters: {'model_type': 'graphsage', 'hidden_dims': '[512, 128]', 'dropout': 0.11233599751167718, 'batch_norm': True, 'lr': 0.00011957756342112273, 'weight_decay': 0.0006282123323576135, 'epochs': 294, 'loss': 'mse', 'optimizer': 'adam', 'graph_mode': 'cutoff', 'cutoff': 0.7512286883876327, 'grm_norm': 'cosine_then_gcn', 'self_loops': False, 'use_snp_selection': False}. Best is trial 45 with value: 0.09667724270876493.
[I 2025-11-03 12:13:31,846] Trial 50 finished with value: 0.06896734412756872 and parameters: {'model_type': 'graphsage', 'hidden_dims': '[128, 64]', 'dropout': 0.1537985374036154, 'batch_norm': False, 'lr': 6.430433383571378e-05, 'weight_decay': 0.0002647449867200536, 'epochs': 345, 'loss': 'mae', 'optimizer': 'adam', 'graph_mode': 'cutoff', 'cutoff': 0.3769477284743644, 'grm_norm': 'cosine_then_gcn', 'self_loops': False, 'use_snp_selection': True, 'num_snps': 55448}. Best is trial 45 with value: 0.09667724270876493.
[I 2025-11-03 12:13:40,468] Trial 51 finished with value: 0.0977954571379721 and parameters: {'model_type': 'graphsage', 'hidden_dims': '[512, 128]', 'dropout': 0.2963711492164266, 'batch_norm': False, 'lr': 4.592897414477881e-05, 'weight_decay': 0.0002859713625358815, 'epochs': 319, 'loss': 'mae', 'optimizer': 'adam', 'graph_mode': 'cutoff', 'cutoff': 0.585599246932589, 'grm_norm': 'cosine_then_gcn', 'self_loops': False, 'use_snp_selection': True, 'num_snps': 58370}. Best is trial 51 with value: 0.0977954571379721.
[I 2025-11-03 12:13:48,244] Trial 52 finished with value: 0.06906486797763413 and parameters: {'model_type': 'graphsage', 'hidden_dims': '[512, 128]', 'dropout': 0.29535683131310586, 'batch_norm': False, 'lr': 0.000712396294165394, 'weight_decay': 0.0009720977784991495, 'epochs': 328, 'loss': 'mae', 'optimizer': 'adam', 'graph_mode': 'cutoff', 'cutoff': 0.5501296370663096, 'grm_norm': 'cosine_then_gcn', 'self_loops': False, 'use_snp_selection': True, 'num_snps': 49900}. Best is trial 51 with value: 0.0977954571379721.
[I 2025-11-03 12:13:56,449] Trial 53 finished with value: 0.0848256094058962 and parameters: {'model_type': 'graphsage', 'hidden_dims': '[512, 128]', 'dropout': 0.24516120428164168, 'batch_norm': False, 'lr': 9.329902949930578e-05, 'weight_decay': 0.0003366987054384656, 'epochs': 305, 'loss': 'mae', 'optimizer': 'adam', 'graph_mode': 'cutoff', 'cutoff': 0.6713677550880542, 'grm_norm': 'cosine_then_gcn', 'self_loops': False, 'use_snp_selection': True, 'num_snps': 56542}. Best is trial 51 with value: 0.0977954571379721.
[I 2025-11-03 12:14:04,297] Trial 54 finished with value: 0.08380668471927681 and parameters: {'model_type': 'graphsage', 'hidden_dims': '[512, 128]', 'dropout': 0.23984179828473798, 'batch_norm': False, 'lr': 8.352030269563626e-05, 'weight_decay': 0.0003697946592722061, 'epochs': 279, 'loss': 'mae', 'optimizer': 'adam', 'graph_mode': 'cutoff', 'cutoff': 0.6572564506305489, 'grm_norm': 'cosine_then_gcn', 'self_loops': False, 'use_snp_selection': True, 'num_snps': 56585}. Best is trial 51 with value: 0.0977954571379721.
[I 2025-11-03 12:14:12,136] Trial 55 finished with value: 0.08533616999361529 and parameters: {'model_type': 'graphsage', 'hidden_dims': '[512, 128]', 'dropout': 0.2256312648461151, 'batch_norm': False, 'lr': 8.652723303731112e-05, 'weight_decay': 0.00031770287900798587, 'epochs': 280, 'loss': 'mae', 'optimizer': 'adam', 'graph_mode': 'cutoff', 'cutoff': 0.6572953231986298, 'grm_norm': 'cosine_then_gcn', 'self_loops': False, 'use_snp_selection': True, 'num_snps': 56655}. Best is trial 51 with value: 0.0977954571379721.
[I 2025-11-03 12:14:20,007] Trial 56 finished with value: 0.10286505916793648 and parameters: {'model_type': 'graphsage', 'hidden_dims': '[512, 128]', 'dropout': 0.22958941611262318, 'batch_norm': False, 'lr': 9.000269352840876e-05, 'weight_decay': 0.0003441484680385881, 'epochs': 280, 'loss': 'mae', 'optimizer': 'adam', 'graph_mode': 'cutoff', 'cutoff': 0.6563430751995486, 'grm_norm': 'cosine_then_gcn', 'self_loops': False, 'use_snp_selection': True, 'num_snps': 56886}. Best is trial 56 with value: 0.10286505916793648.
[I 2025-11-03 12:14:27,784] Trial 57 finished with value: 0.07762321748162043 and parameters: {'model_type': 'graphsage', 'hidden_dims': '[512, 128]', 'dropout': 0.21362387070974373, 'batch_norm': False, 'lr': 0.00015588161849488643, 'weight_decay': 0.00014546066539417344, 'epochs': 304, 'loss': 'mae', 'optimizer': 'adam', 'graph_mode': 'cutoff', 'cutoff': 0.6343126002621515, 'grm_norm': 'cosine_then_gcn', 'self_loops': False, 'use_snp_selection': True, 'num_snps': 52973}. Best is trial 56 with value: 0.10286505916793648.
[I 2025-11-03 12:14:36,235] Trial 58 finished with value: 0.08069693913761415 and parameters: {'model_type': 'graphsage', 'hidden_dims': '[512, 128]', 'dropout': 0.1784363334539892, 'batch_norm': False, 'lr': 5.410025585273926e-05, 'weight_decay': 0.0002399689654466905, 'epochs': 312, 'loss': 'mae', 'optimizer': 'adam', 'graph_mode': 'cutoff', 'cutoff': 0.7070680768986073, 'grm_norm': 'cosine_then_gcn', 'self_loops': False, 'use_snp_selection': True, 'num_snps': 57192}. Best is trial 56 with value: 0.10286505916793648.
[I 2025-11-03 12:14:43,669] Trial 59 finished with value: 0.09136703296374221 and parameters: {'model_type': 'graphsage', 'hidden_dims': '[512, 128]', 'dropout': 0.2682224415975758, 'batch_norm': False, 'lr': 0.00011061406730858394, 'weight_decay': 9.238129017266813e-05, 'epochs': 280, 'loss': 'mae', 'optimizer': 'adam', 'graph_mode': 'cutoff', 'cutoff': 0.5714293689331864, 'grm_norm': 'cosine_then_gcn', 'self_loops': False, 'use_snp_selection': True, 'num_snps': 52105}. Best is trial 56 with value: 0.10286505916793648.
[I 2025-11-03 12:14:51,080] Trial 60 finished with value: 0.09303029475396567 and parameters: {'model_type': 'graphsage', 'hidden_dims': '[512, 128]', 'dropout': 0.27388018499101197, 'batch_norm': False, 'lr': 0.0001089270131148122, 'weight_decay': 0.00010885541930295526, 'epochs': 279, 'loss': 'mae', 'optimizer': 'adam', 'graph_mode': 'cutoff', 'cutoff': 0.5677520903156553, 'grm_norm': 'cosine_then_gcn', 'self_loops': False, 'use_snp_selection': True, 'num_snps': 51914}. Best is trial 56 with value: 0.10286505916793648.
[I 2025-11-03 12:14:58,453] Trial 61 finished with value: 0.08614573054483858 and parameters: {'model_type': 'graphsage', 'hidden_dims': '[512, 128]', 'dropout': 0.26833099229530083, 'batch_norm': False, 'lr': 0.0001072513340892146, 'weight_decay': 0.00010206525407491938, 'epochs': 284, 'loss': 'mae', 'optimizer': 'adam', 'graph_mode': 'cutoff', 'cutoff': 0.5610497486842015, 'grm_norm': 'cosine_then_gcn', 'self_loops': False, 'use_snp_selection': True, 'num_snps': 51119}. Best is trial 56 with value: 0.10286505916793648.
[I 2025-11-03 12:15:05,674] Trial 62 finished with value: 0.08986468160713453 and parameters: {'model_type': 'graphsage', 'hidden_dims': '[512, 128]', 'dropout': 0.27593138982988397, 'batch_norm': False, 'lr': 0.0001100851177046468, 'weight_decay': 0.000128477948652463, 'epochs': 263, 'loss': 'mae', 'optimizer': 'adam', 'graph_mode': 'cutoff', 'cutoff': 0.5718539654740435, 'grm_norm': 'cosine_then_gcn', 'self_loops': False, 'use_snp_selection': True, 'num_snps': 51955}. Best is trial 56 with value: 0.10286505916793648.
[I 2025-11-03 12:15:12,493] Trial 63 finished with value: 0.0782086831345166 and parameters: {'model_type': 'graphsage', 'hidden_dims': '[512, 128]', 'dropout': 0.3080920009534414, 'batch_norm': False, 'lr': 5.868411076210443e-05, 'weight_decay': 5.47355749109274e-05, 'epochs': 259, 'loss': 'mae', 'optimizer': 'adam', 'graph_mode': 'cutoff', 'cutoff': 0.5185669947288624, 'grm_norm': 'cosine_then_gcn', 'self_loops': False, 'use_snp_selection': True, 'num_snps': 48029}. Best is trial 56 with value: 0.10286505916793648.
[I 2025-11-03 12:15:20,636] Trial 64 finished with value: 0.09996071419260925 and parameters: {'model_type': 'graphsage', 'hidden_dims': '[512, 128]', 'dropout': 0.27919482255970923, 'batch_norm': False, 'lr': 0.00023793534247171921, 'weight_decay': 0.00018833023558750364, 'epochs': 327, 'loss': 'mae', 'optimizer': 'adam', 'graph_mode': 'cutoff', 'cutoff': 0.5717025154787267, 'grm_norm': 'cosine_then_gcn', 'self_loops': False, 'use_snp_selection': True, 'num_snps': 52954}. Best is trial 56 with value: 0.10286505916793648.
