[I 2025-10-22 20:28:45,776] Trial 46 finished with value: 0.2057705054775656 and parameters: {'model_type': 'gat', 'hidden_dims': '[128, 64]', 'dropout': 0.22531962988973214, 'batch_norm': True, 'gat_heads': 5, 'gat_attn_dropout': 0.537590408893746, 'gat_concat_hidden': True, 'lr': 0.00017220727513007352, 'weight_decay': 9.826769260068886e-07, 'epochs': 331, 'loss': 'mae', 'optimizer': 'adam', 'graph_mode': 'cutoff', 'cutoff': 0.8313150028138873, 'grm_norm': 'cosine', 'self_loops': False}. Best is trial 22 with value: 0.22255691246714887.
[I 2025-10-22 20:34:18,465] Trial 47 finished with value: 0.20790564843666387 and parameters: {'model_type': 'gat', 'hidden_dims': '[256, 128, 64]', 'dropout': 0.16442682156285987, 'batch_norm': True, 'gat_heads': 8, 'gat_attn_dropout': 0.20410783560440693, 'gat_concat_hidden': True, 'lr': 0.0002729843301909086, 'weight_decay': 1.146901811350196e-07, 'epochs': 255, 'loss': 'mae', 'optimizer': 'adam', 'graph_mode': 'cutoff', 'cutoff': 0.779467905780707, 'grm_norm': 'none', 'self_loops': False}. Best is trial 22 with value: 0.22255691246714887.
[I 2025-10-22 20:36:06,442] Trial 48 finished with value: 0.03350576674127017 and parameters: {'model_type': 'gat', 'hidden_dims': '[512, 64]', 'dropout': 0.26972609525889807, 'batch_norm': False, 'gat_heads': 7, 'gat_attn_dropout': 0.3455823001332536, 'gat_concat_hidden': False, 'lr': 0.0007001827663592097, 'weight_decay': 2.579262776081411e-07, 'epochs': 40, 'loss': 'mse', 'optimizer': 'adam', 'graph_mode': 'cutoff', 'cutoff': 0.727582476397944, 'grm_norm': 'cosine_then_gcn', 'self_loops': True}. Best is trial 22 with value: 0.22255691246714887.
[I 2025-10-22 20:46:19,186] Trial 49 finished with value: 0.21658762044848795 and parameters: {'model_type': 'gat', 'hidden_dims': '[512, 128]', 'dropout': 0.23856206563774401, 'batch_norm': True, 'gat_heads': 6, 'gat_attn_dropout': 0.13601728499491106, 'gat_concat_hidden': True, 'lr': 0.00039639266177087103, 'weight_decay': 5.391706120344119e-07, 'epochs': 336, 'loss': 'mae', 'optimizer': 'adam', 'graph_mode': 'cutoff', 'cutoff': 0.846761272517959, 'grm_norm': 'gcn', 'self_loops': True}. Best is trial 22 with value: 0.22255691246714887.
[I 2025-10-22 20:50:27,600] Trial 50 finished with value: 0.15946424620054536 and parameters: {'model_type': 'gat', 'hidden_dims': '[256, 128]', 'dropout': 0.12531700442560728, 'batch_norm': True, 'gat_heads': 5, 'gat_attn_dropout': 0.3824253374028148, 'gat_concat_hidden': True, 'lr': 9.748279140983349e-05, 'weight_decay': 3.8141929531594802e-06, 'epochs': 279, 'loss': 'mae', 'optimizer': 'adam', 'graph_mode': 'knn', 'source': 'grm', 'knn_k': 7, 'weighted_edges': False, 'symmetrize_mode': 'union'}. Best is trial 22 with value: 0.22255691246714887.
[I 2025-10-22 21:00:42,123] Trial 51 finished with value: 0.2207268954356069 and parameters: {'model_type': 'gat', 'hidden_dims': '[512, 128]', 'dropout': 0.28264916440487037, 'batch_norm': True, 'gat_heads': 6, 'gat_attn_dropout': 0.1016715782678856, 'gat_concat_hidden': True, 'lr': 0.00040214592158683107, 'weight_decay': 5.000787206473008e-07, 'epochs': 337, 'loss': 'mae', 'optimizer': 'adam', 'graph_mode': 'cutoff', 'cutoff': 0.8931408870372635, 'grm_norm': 'gcn', 'self_loops': True}. Best is trial 22 with value: 0.22255691246714887.
[I 2025-10-22 21:10:11,665] Trial 52 finished with value: 0.22618212185242434 and parameters: {'model_type': 'gat', 'hidden_dims': '[512, 128]', 'dropout': 0.37778287270153593, 'batch_norm': True, 'gat_heads': 6, 'gat_attn_dropout': 0.04457552735550065, 'gat_concat_hidden': True, 'lr': 0.0001763512508112385, 'weight_decay': 1.4307536269155218e-07, 'epochs': 312, 'loss': 'mae', 'optimizer': 'adam', 'graph_mode': 'cutoff', 'cutoff': 0.8951470740588923, 'grm_norm': 'gcn', 'self_loops': True}. Best is trial 52 with value: 0.22618212185242434.
[I 2025-10-22 21:19:14,191] Trial 53 finished with value: 0.2294063807020604 and parameters: {'model_type': 'gat', 'hidden_dims': '[512, 128]', 'dropout': 0.3840911789887351, 'batch_norm': True, 'gat_heads': 6, 'gat_attn_dropout': 0.06042141975520572, 'gat_concat_hidden': True, 'lr': 0.00016798837993970282, 'weight_decay': 1.414661377827475e-07, 'epochs': 296, 'loss': 'mae', 'optimizer': 'adam', 'graph_mode': 'cutoff', 'cutoff': 0.8966519029854365, 'grm_norm': 'gcn', 'self_loops': True}. Best is trial 53 with value: 0.2294063807020604.
[I 2025-10-22 21:28:36,596] Trial 54 finished with value: 0.2218437941911998 and parameters: {'model_type': 'gat', 'hidden_dims': '[512, 128]', 'dropout': 0.3756084194783801, 'batch_norm': True, 'gat_heads': 6, 'gat_attn_dropout': 0.05554386156844925, 'gat_concat_hidden': True, 'lr': 0.0001796417871486053, 'weight_decay': 1.3468443172088472e-07, 'epochs': 307, 'loss': 'mae', 'optimizer': 'adam', 'graph_mode': 'cutoff', 'cutoff': 0.8677676001861439, 'grm_norm': 'gcn', 'self_loops': True}. Best is trial 53 with value: 0.2294063807020604.
[I 2025-10-22 21:37:33,293] Trial 55 finished with value: 0.23337091144217056 and parameters: {'model_type': 'gat', 'hidden_dims': '[512, 128]', 'dropout': 0.3949035763283571, 'batch_norm': True, 'gat_heads': 5, 'gat_attn_dropout': 0.004088746291357637, 'gat_concat_hidden': True, 'lr': 0.00012825395316108925, 'weight_decay': 1.3931929316361517e-07, 'epochs': 342, 'loss': 'mae', 'optimizer': 'adam', 'graph_mode': 'cutoff', 'cutoff': 0.8953431632585108, 'grm_norm': 'gcn', 'self_loops': True}. Best is trial 55 with value: 0.23337091144217056.
[I 2025-10-22 21:45:40,443] Trial 56 finished with value: 0.22624899340455945 and parameters: {'model_type': 'gat', 'hidden_dims': '[512, 128]', 'dropout': 0.38802523458391425, 'batch_norm': True, 'gat_heads': 5, 'gat_attn_dropout': 0.004014299052686696, 'gat_concat_hidden': True, 'lr': 0.00011037675092942575, 'weight_decay': 1.0404328356498313e-07, 'epochs': 310, 'loss': 'mae', 'optimizer': 'adam', 'graph_mode': 'cutoff', 'cutoff': 0.8660283704018296, 'grm_norm': 'gcn', 'self_loops': True}. Best is trial 55 with value: 0.23337091144217056.
[I 2025-10-22 21:53:41,221] Trial 57 finished with value: 0.22231253470482 and parameters: {'model_type': 'gat', 'hidden_dims': '[512, 128]', 'dropout': 0.3885893796292744, 'batch_norm': True, 'gat_heads': 5, 'gat_attn_dropout': 0.005260611051506062, 'gat_concat_hidden': True, 'lr': 0.00011329529147290409, 'weight_decay': 1.1140840123089655e-07, 'epochs': 306, 'loss': 'mae', 'optimizer': 'adam', 'graph_mode': 'cutoff', 'cutoff': 0.8991629347138234, 'grm_norm': 'gcn', 'self_loops': True}. Best is trial 55 with value: 0.23337091144217056.
[I 2025-10-22 22:01:50,641] Trial 58 finished with value: 0.21901094481198866 and parameters: {'model_type': 'gat', 'hidden_dims': '[512, 128]', 'dropout': 0.4413073064415255, 'batch_norm': True, 'gat_heads': 5, 'gat_attn_dropout': 0.009304152607620571, 'gat_concat_hidden': True, 'lr': 0.00011095804507932758, 'weight_decay': 1.0401650811362801e-07, 'epochs': 311, 'loss': 'mae', 'optimizer': 'adam', 'graph_mode': 'cutoff', 'cutoff': 0.8934660691518038, 'grm_norm': 'gcn', 'self_loops': True}. Best is trial 55 with value: 0.23337091144217056.
[I 2025-10-22 22:09:52,958] Trial 59 finished with value: 0.11088945435520128 and parameters: {'model_type': 'gat', 'hidden_dims': '[512, 128]', 'dropout': 0.3792498413844617, 'batch_norm': True, 'gat_heads': 5, 'gat_attn_dropout': 0.0031694871479716565, 'gat_concat_hidden': True, 'lr': 4.1674178747789764e-05, 'weight_decay': 1.3559546954341327e-07, 'epochs': 294, 'loss': 'mae', 'optimizer': 'adam', 'graph_mode': 'cutoff', 'cutoff': 0.2604108046240979, 'grm_norm': 'gcn', 'self_loops': True}. Best is trial 55 with value: 0.23337091144217056.
[I 2025-10-22 22:13:29,791] Trial 60 finished with value: 0.21688486883298777 and parameters: {'model_type': 'gat', 'hidden_dims': '[512, 128]', 'dropout': 0.48032379489840643, 'batch_norm': True, 'gat_heads': 5, 'gat_attn_dropout': 0.038218640249778, 'gat_concat_hidden': False, 'lr': 0.00014247891451951472, 'weight_decay': 1.4965758259286527e-07, 'epochs': 132, 'loss': 'mae', 'optimizer': 'adam', 'graph_mode': 'cutoff', 'cutoff': 0.8593603718376573, 'grm_norm': 'gcn', 'self_loops': True}. Best is trial 55 with value: 0.23337091144217056.
[I 2025-10-22 22:22:58,347] Trial 61 finished with value: 0.2228462573876609 and parameters: {'model_type': 'gat', 'hidden_dims': '[512, 128]', 'dropout': 0.38488759037707115, 'batch_norm': True, 'gat_heads': 6, 'gat_attn_dropout': 0.04038716911724538, 'gat_concat_hidden': True, 'lr': 0.0001897465088136999, 'weight_decay': 1.4698543886112627e-07, 'epochs': 310, 'loss': 'mae', 'optimizer': 'adam', 'graph_mode': 'cutoff', 'cutoff': 0.8653260942145997, 'grm_norm': 'gcn', 'self_loops': True}. Best is trial 55 with value: 0.23337091144217056.
[I 2025-10-22 22:31:31,598] Trial 62 finished with value: 0.2256331520400495 and parameters: {'model_type': 'gat', 'hidden_dims': '[512, 128]', 'dropout': 0.39579545712955005, 'batch_norm': True, 'gat_heads': 5, 'gat_attn_dropout': 0.0807194873186221, 'gat_concat_hidden': True, 'lr': 0.00024022287995888663, 'weight_decay': 1.0393486408470531e-07, 'epochs': 327, 'loss': 'mae', 'optimizer': 'adam', 'graph_mode': 'cutoff', 'cutoff': 0.8982148556666862, 'grm_norm': 'gcn', 'self_loops': True}. Best is trial 55 with value: 0.23337091144217056.
[I 2025-10-22 22:41:29,151] Trial 63 finished with value: 0.2265153494476771 and parameters: {'model_type': 'gat', 'hidden_dims': '[512, 128]', 'dropout': 0.4033380597201111, 'batch_norm': True, 'gat_heads': 6, 'gat_attn_dropout': 0.09341714622449049, 'gat_concat_hidden': True, 'lr': 0.00022497459605991092, 'weight_decay': 2.849609357204356e-07, 'epochs': 327, 'loss': 'mae', 'optimizer': 'adam', 'graph_mode': 'cutoff', 'cutoff': 0.8633951119982028, 'grm_norm': 'gcn', 'self_loops': True}. Best is trial 55 with value: 0.23337091144217056.
[I 2025-10-22 22:51:30,118] Trial 64 finished with value: 0.222493094554364 and parameters: {'model_type': 'gat', 'hidden_dims': '[512, 128]', 'dropout': 0.40735222910675295, 'batch_norm': True, 'gat_heads': 6, 'gat_attn_dropout': 0.08445323351160014, 'gat_concat_hidden': True, 'lr': 0.0002803843435597937, 'weight_decay': 3.0128503758329507e-07, 'epochs': 329, 'loss': 'mae', 'optimizer': 'adam', 'graph_mode': 'cutoff', 'cutoff': 0.8631187425442326, 'grm_norm': 'gcn', 'self_loops': True}. Best is trial 55 with value: 0.23337091144217056.
[I 2025-10-22 23:01:52,533] Trial 65 finished with value: 0.23233029353387752 and parameters: {'model_type': 'gat', 'hidden_dims': '[512, 128]', 'dropout': 0.4422197554191052, 'batch_norm': True, 'gat_heads': 6, 'gat_attn_dropout': 0.036394390725625315, 'gat_concat_hidden': True, 'lr': 0.00023215154212443477, 'weight_decay': 0.0001175125071558532, 'epochs': 341, 'loss': 'mae', 'optimizer': 'adam', 'graph_mode': 'cutoff', 'cutoff': 0.8455510203572096, 'grm_norm': 'cosine', 'self_loops': True}. Best is trial 55 with value: 0.23337091144217056.
[I 2025-10-22 23:10:40,252] Trial 66 finished with value: 0.22166942918080795 and parameters: {'model_type': 'gat', 'hidden_dims': '[512, 128]', 'dropout': 0.44625644671093956, 'batch_norm': True, 'gat_heads': 5, 'gat_attn_dropout': 0.06371845474144366, 'gat_concat_hidden': True, 'lr': 0.00024313811661569968, 'weight_decay': 0.000292520973471376, 'epochs': 337, 'loss': 'mae', 'optimizer': 'adam', 'graph_mode': 'cutoff', 'cutoff': 0.8455081145042286, 'grm_norm': 'cosine', 'self_loops': True}. Best is trial 55 with value: 0.23337091144217056.
[I 2025-10-22 23:17:26,793] Trial 67 finished with value: 0.2234290953777241 and parameters: {'model_type': 'gat', 'hidden_dims': '[512, 128]', 'dropout': 0.4834855026126703, 'batch_norm': True, 'gat_heads': 4, 'gat_attn_dropout': 0.02437758957619454, 'gat_concat_hidden': True, 'lr': 0.0005660292457420485, 'weight_decay': 0.00012728717256013612, 'epochs': 323, 'loss': 'mae', 'optimizer': 'adam', 'graph_mode': 'cutoff', 'cutoff': 0.8803148700752019, 'grm_norm': 'cosine', 'self_loops': True}. Best is trial 55 with value: 0.23337091144217056.
[I 2025-10-22 23:28:03,209] Trial 68 finished with value: 0.15126962148415085 and parameters: {'model_type': 'gat', 'hidden_dims': '[512, 128]', 'dropout': 0.34743757121402474, 'batch_norm': True, 'gat_heads': 6, 'gat_attn_dropout': 0.1011019356793221, 'gat_concat_hidden': True, 'lr': 0.00014411767520659924, 'weight_decay': 0.0006793669866409055, 'epochs': 344, 'loss': 'mae', 'optimizer': 'adam', 'graph_mode': 'knn', 'source': 'grm', 'knn_k': 3, 'weighted_edges': True, 'symmetrize_mode': 'mutual'}. Best is trial 55 with value: 0.23337091144217056.
[I 2025-10-22 23:36:39,327] Trial 69 finished with value: 0.19953202398660136 and parameters: {'model_type': 'gat', 'hidden_dims': '[512, 128]', 'dropout': 0.4294331363315397, 'batch_norm': True, 'gat_heads': 5, 'gat_attn_dropout': 0.08644564345409483, 'gat_concat_hidden': True, 'lr': 6.716135444088042e-05, 'weight_decay': 1.6579524850437818e-05, 'epochs': 328, 'loss': 'mae', 'optimizer': 'adam', 'graph_mode': 'cutoff', 'cutoff': 0.8429935213045477, 'grm_norm': 'cosine', 'self_loops': True}. Best is trial 55 with value: 0.23337091144217056.
[I 2025-10-22 23:39:57,900] Trial 70 finished with value: 0.22544954029313186 and parameters: {'model_type': 'gat', 'hidden_dims': '[512, 128]', 'dropout': 0.45647734813660557, 'batch_norm': True, 'gat_heads': 2, 'gat_attn_dropout': 0.04753555110012811, 'gat_concat_hidden': True, 'lr': 0.0004485322661481263, 'weight_decay': 5.543859718927721e-05, 'epochs': 319, 'loss': 'mae', 'optimizer': 'adam', 'graph_mode': 'cutoff', 'cutoff': 0.878709239618136, 'grm_norm': 'cosine', 'self_loops': True}. Best is trial 55 with value: 0.23337091144217056.
[I 2025-10-22 23:43:15,711] Trial 71 finished with value: 0.22086868427242523 and parameters: {'model_type': 'gat', 'hidden_dims': '[512, 128]', 'dropout': 0.4587005876735636, 'batch_norm': True, 'gat_heads': 2, 'gat_attn_dropout': 0.047189145621272216, 'gat_concat_hidden': True, 'lr': 0.000827215467669784, 'weight_decay': 4.4552401998054083e-05, 'epochs': 318, 'loss': 'mae', 'optimizer': 'adam', 'graph_mode': 'cutoff', 'cutoff': 0.8982020939742427, 'grm_norm': 'cosine', 'self_loops': True}. Best is trial 55 with value: 0.23337091144217056.
[I 2025-10-22 23:45:09,493] Trial 72 finished with value: 0.21915945243347318 and parameters: {'model_type': 'gat', 'hidden_dims': '[512, 128]', 'dropout': 0.3981119064345271, 'batch_norm': True, 'gat_heads': 1, 'gat_attn_dropout': 0.11982756481348024, 'gat_concat_hidden': True, 'lr': 0.00047656157034971247, 'weight_decay': 9.991276380217529e-05, 'epochs': 341, 'loss': 'mae', 'optimizer': 'adam', 'graph_mode': 'cutoff', 'cutoff': 0.8724818088403796, 'grm_norm': 'cosine', 'self_loops': True}. Best is trial 55 with value: 0.23337091144217056.
[I 2025-10-22 23:48:16,723] Trial 73 finished with value: 0.22938576747274073 and parameters: {'model_type': 'gat', 'hidden_dims': '[512, 128]', 'dropout': 0.5068439637869784, 'batch_norm': True, 'gat_heads': 2, 'gat_attn_dropout': 0.025319972489458664, 'gat_concat_hidden': True, 'lr': 0.0003770821921275556, 'weight_decay': 6.854941021315004e-05, 'epochs': 300, 'loss': 'mae', 'optimizer': 'adam', 'graph_mode': 'cutoff', 'cutoff': 0.8440385035944648, 'grm_norm': 'cosine', 'self_loops': True}. Best is trial 55 with value: 0.23337091144217056.
[I 2025-10-22 23:55:59,577] Trial 74 finished with value: 0.2347528881993936 and parameters: {'model_type': 'gat', 'hidden_dims': '[512, 128]', 'dropout': 0.3600712234682134, 'batch_norm': True, 'gat_heads': 5, 'gat_attn_dropout': 0.021254982384853335, 'gat_concat_hidden': True, 'lr': 0.00021323222907161616, 'weight_decay': 0.0002242436549264048, 'epochs': 293, 'loss': 'mae', 'optimizer': 'adam', 'graph_mode': 'cutoff', 'cutoff': 0.831364697714237, 'grm_norm': 'cosine', 'self_loops': True}. Best is trial 74 with value: 0.2347528881993936.
[I 2025-10-23 00:05:12,025] Trial 75 finished with value: 0.20788157160866566 and parameters: {'model_type': 'gat', 'hidden_dims': '[512, 256]', 'dropout': 0.5291610151026057, 'batch_norm': True, 'gat_heads': 6, 'gat_attn_dropout': 0.02181593355481039, 'gat_concat_hidden': True, 'lr': 0.0002118890694687245, 'weight_decay': 0.00023844859482649358, 'epochs': 295, 'loss': 'mae', 'optimizer': 'adam', 'graph_mode': 'cutoff', 'cutoff': 0.8106906000908435, 'grm_norm': 'cosine', 'self_loops': True}. Best is trial 74 with value: 0.2347528881993936.
[I 2025-10-23 00:13:46,113] Trial 76 finished with value: 0.21980102345127764 and parameters: {'model_type': 'gat', 'hidden_dims': '[512, 128]', 'dropout': 0.35981364328718596, 'batch_norm': True, 'gat_heads': 6, 'gat_attn_dropout': 0.022986417435853338, 'gat_concat_hidden': True, 'lr': 0.00036601175652200185, 'weight_decay': 7.930378893137334e-05, 'epochs': 279, 'loss': 'mae', 'optimizer': 'adam', 'graph_mode': 'cutoff', 'cutoff': 0.771067428654509, 'grm_norm': 'cosine', 'self_loops': True}. Best is trial 74 with value: 0.2347528881993936.
[I 2025-10-23 00:16:40,358] Trial 77 finished with value: 0.19301495158286303 and parameters: {'model_type': 'gat', 'hidden_dims': '[256, 128, 64]', 'dropout': 0.5088859596561888, 'batch_norm': True, 'gat_heads': 4, 'gat_attn_dropout': 0.06204795808158039, 'gat_concat_hidden': True, 'lr': 0.00015274488196384252, 'weight_decay': 0.0001489255733494015, 'epochs': 271, 'loss': 'mae', 'optimizer': 'adam', 'graph_mode': 'cutoff', 'cutoff': 0.8402398672940595, 'grm_norm': 'cosine', 'self_loops': True}. Best is trial 74 with value: 0.2347528881993936.
[I 2025-10-23 00:20:43,179] Trial 78 finished with value: 0.2249754633672924 and parameters: {'model_type': 'gat', 'hidden_dims': '[512, 128]', 'dropout': 0.32739098392815935, 'batch_norm': True, 'gat_heads': 3, 'gat_attn_dropout': 0.02965897903009841, 'gat_concat_hidden': True, 'lr': 0.00012089974538894761, 'weight_decay': 0.0005489023730593999, 'epochs': 261, 'loss': 'mae', 'optimizer': 'adam', 'graph_mode': 'cutoff', 'cutoff': 0.8165054552404348, 'grm_norm': 'cosine', 'self_loops': True}. Best is trial 74 with value: 0.2347528881993936.
[I 2025-10-23 00:28:36,982] Trial 79 finished with value: 0.1685486558266747 and parameters: {'model_type': 'gat', 'hidden_dims': '[512, 128]', 'dropout': 0.42731440437807355, 'batch_norm': True, 'gat_heads': 5, 'gat_attn_dropout': 0.00022943583230888073, 'gat_concat_hidden': False, 'lr': 5.103754126004973e-05, 'weight_decay': 0.00020159445866451236, 'epochs': 289, 'loss': 'mae', 'optimizer': 'adam', 'graph_mode': 'knn', 'source': 'grm', 'knn_k': 10, 'weighted_edges': False, 'symmetrize_mode': 'union'}. Best is trial 74 with value: 0.2347528881993936.
[I 2025-10-23 00:37:51,296] Trial 80 finished with value: 0.1947389646293443 and parameters: {'model_type': 'gat', 'hidden_dims': '[512, 128]', 'dropout': 0.36479500997594205, 'batch_norm': True, 'gat_heads': 6, 'gat_attn_dropout': 0.07229927297043781, 'gat_concat_hidden': True, 'lr': 0.00010102149879538548, 'weight_decay': 2.5476583617671986e-05, 'epochs': 300, 'loss': 'mae', 'optimizer': 'adam', 'graph_mode': 'cutoff', 'cutoff': 0.5152812595677267, 'grm_norm': 'cosine', 'self_loops': True}. Best is trial 74 with value: 0.2347528881993936.
[I 2025-10-23 00:46:31,549] Trial 81 finished with value: 0.22813045184235498 and parameters: {'model_type': 'gat', 'hidden_dims': '[512, 128]', 'dropout': 0.39713008106243347, 'batch_norm': True, 'gat_heads': 5, 'gat_attn_dropout': 0.08475592401627116, 'gat_concat_hidden': True, 'lr': 0.00028592778994321436, 'weight_decay': 2.5099885561584127e-07, 'epochs': 332, 'loss': 'mae', 'optimizer': 'adam', 'graph_mode': 'cutoff', 'cutoff': 0.8527075604115728, 'grm_norm': 'gcn', 'self_loops': True}. Best is trial 74 with value: 0.2347528881993936.
[I 2025-10-23 00:54:49,802] Trial 82 finished with value: 0.21725128603077093 and parameters: {'model_type': 'gat', 'hidden_dims': '[512, 128]', 'dropout': 0.417729615539474, 'batch_norm': True, 'gat_heads': 5, 'gat_attn_dropout': 0.09762614438076656, 'gat_concat_hidden': True, 'lr': 0.0002922432211293959, 'weight_decay': 0.0003579560747605617, 'epochs': 318, 'loss': 'mae', 'optimizer': 'adam', 'graph_mode': 'cutoff', 'cutoff': 0.8538774671160049, 'grm_norm': 'gcn', 'self_loops': True}. Best is trial 74 with value: 0.2347528881993936.
[I 2025-10-23 01:02:04,117] Trial 83 finished with value: 0.13049304178251722 and parameters: {'model_type': 'gat', 'hidden_dims': '[512, 128]', 'dropout': 0.3324146502768808, 'batch_norm': True, 'gat_heads': 4, 'gat_attn_dropout': 0.02060957655122172, 'gat_concat_hidden': True, 'lr': 0.00019545050332373188, 'weight_decay': 2.3207411225436333e-07, 'epochs': 342, 'loss': 'mae', 'optimizer': 'adam', 'graph_mode': 'cutoff', 'cutoff': 0.4390074066943471, 'grm_norm': 'gcn', 'self_loops': True}. Best is trial 74 with value: 0.2347528881993936.
[I 2025-10-23 01:10:45,720] Trial 84 finished with value: 0.2094714834925257 and parameters: {'model_type': 'gat', 'hidden_dims': '[512, 128]', 'dropout': 0.3586935036817446, 'batch_norm': True, 'gat_heads': 5, 'gat_attn_dropout': 0.05701642949240613, 'gat_concat_hidden': True, 'lr': 0.0002506606723197327, 'weight_decay': 7.518733156477104e-06, 'epochs': 333, 'loss': 'mae', 'optimizer': 'adam', 'graph_mode': 'cutoff', 'cutoff': 0.834984383410299, 'grm_norm': 'gcn', 'self_loops': True}. Best is trial 74 with value: 0.2347528881993936.
[I 2025-10-23 01:11:46,207] Trial 85 finished with value: 0.21811198768677204 and parameters: {'model_type': 'gat', 'hidden_dims': '[256, 128]', 'dropout': 0.3711844794253332, 'batch_norm': True, 'gat_heads': 1, 'gat_attn_dropout': 0.14212987686061876, 'gat_concat_hidden': True, 'lr': 0.0003503085977139916, 'weight_decay': 0.00011541026494338239, 'epochs': 302, 'loss': 'mae', 'optimizer': 'adam', 'graph_mode': 'cutoff', 'cutoff': 0.8713799943492803, 'grm_norm': 'cosine_then_gcn', 'self_loops': True}. Best is trial 74 with value: 0.2347528881993936.
