[I 2025-11-03 16:25:43,052] Trial 144 finished with value: 0.15110303474607797 and parameters: {'model_type': 'graphsage', 'hidden_dims': '[256, 128]', 'dropout': 0.5223516827097351, 'batch_norm': True, 'lr': 0.000819698114111091, 'weight_decay': 9.00729412481556e-06, 'epochs': 343, 'loss': 'mse', 'optimizer': 'adam', 'graph_mode': 'cutoff', 'cutoff': 0.23664939068073773, 'grm_norm': 'none', 'self_loops': True, 'use_snp_selection': False}. Best is trial 119 with value: 0.1621043463471061.
[I 2025-11-03 16:25:48,263] Trial 145 finished with value: 0.1393616137638192 and parameters: {'model_type': 'graphsage', 'hidden_dims': '[256, 128]', 'dropout': 0.5142497138079484, 'batch_norm': True, 'lr': 0.000870163644208382, 'weight_decay': 8.204361433466115e-06, 'epochs': 346, 'loss': 'mse', 'optimizer': 'adam', 'graph_mode': 'cutoff', 'cutoff': 0.23721472442623082, 'grm_norm': 'none', 'self_loops': True, 'use_snp_selection': False}. Best is trial 119 with value: 0.1621043463471061.
[I 2025-11-03 16:25:51,848] Trial 146 finished with value: 0.14106867676355464 and parameters: {'model_type': 'graphsage', 'hidden_dims': '[256, 128]', 'dropout': 0.5490889159859321, 'batch_norm': True, 'lr': 0.0006330294791128441, 'weight_decay': 5.412656972382468e-06, 'epochs': 338, 'loss': 'mse', 'optimizer': 'adam', 'graph_mode': 'cutoff', 'cutoff': 0.717584875829232, 'grm_norm': 'none', 'self_loops': True, 'use_snp_selection': False}. Best is trial 119 with value: 0.1621043463471061.
[I 2025-11-03 16:25:56,747] Trial 147 finished with value: 0.14590818546244194 and parameters: {'model_type': 'graphsage', 'hidden_dims': '[256, 128]', 'dropout': 0.522287220126484, 'batch_norm': True, 'lr': 0.0007552630920080124, 'weight_decay': 1.1134333153625373e-05, 'epochs': 333, 'loss': 'mse', 'optimizer': 'adam', 'graph_mode': 'cutoff', 'cutoff': 0.25243437071896724, 'grm_norm': 'none', 'self_loops': False, 'use_snp_selection': False}. Best is trial 119 with value: 0.1621043463471061.
[I 2025-11-03 16:26:02,244] Trial 148 finished with value: 0.1408351326600538 and parameters: {'model_type': 'graphsage', 'hidden_dims': '[256, 128]', 'dropout': 0.4683505919843632, 'batch_norm': True, 'lr': 0.0005265801550342656, 'weight_decay': 0.00046248025926113733, 'epochs': 344, 'loss': 'mse', 'optimizer': 'adam', 'graph_mode': 'cutoff', 'cutoff': 0.2174843166770865, 'grm_norm': 'gcn', 'self_loops': True, 'use_snp_selection': False}. Best is trial 119 with value: 0.1621043463471061.
[I 2025-11-03 16:26:06,916] Trial 149 finished with value: 0.12915736766080144 and parameters: {'model_type': 'graphsage', 'hidden_dims': '[256, 128]', 'dropout': 0.5383291108440427, 'batch_norm': True, 'lr': 0.0009953237470496513, 'weight_decay': 7.97219401042734e-06, 'epochs': 322, 'loss': 'mse', 'optimizer': 'adam', 'graph_mode': 'cutoff', 'cutoff': 0.2612021018157392, 'grm_norm': 'none', 'self_loops': True, 'use_snp_selection': False}. Best is trial 119 with value: 0.1621043463471061.
[I 2025-11-03 16:26:09,625] Trial 0 finished with value: -0.04676577900824714 and parameters: {'model_type': 'graphsage', 'hidden_dims': '[128, 64]', 'dropout': 0.199031432379812, 'batch_norm': True, 'lr': 1.8408544111075837e-06, 'weight_decay': 5.5136510071208614e-05, 'epochs': 336, 'loss': 'mae', 'optimizer': 'adam', 'graph_mode': 'knn', 'source': 'grm', 'knn_k': 8, 'weighted_edges': True, 'symmetrize_mode': 'mutual', 'use_snp_selection': False}. Best is trial 0 with value: -0.04676577900824714.
[I 2025-11-03 16:26:11,224] Trial 1 finished with value: 0.015197448991390836 and parameters: {'model_type': 'graphsage', 'hidden_dims': '[128, 64]', 'dropout': 0.40051947670227217, 'batch_norm': True, 'lr': 0.0005320428882732732, 'weight_decay': 1.89210117736594e-06, 'epochs': 68, 'loss': 'mse', 'optimizer': 'adam', 'graph_mode': 'knn', 'source': 'grm', 'knn_k': 7, 'weighted_edges': True, 'symmetrize_mode': 'union', 'use_snp_selection': False}. Best is trial 1 with value: 0.015197448991390836.
[I 2025-11-03 16:26:13,773] Trial 2 finished with value: 0.028018574512571268 and parameters: {'model_type': 'graphsage', 'hidden_dims': '[256, 128]', 'dropout': 0.5105528289184642, 'batch_norm': False, 'lr': 0.0006804279372404962, 'weight_decay': 0.0008922815224257085, 'epochs': 181, 'loss': 'mse', 'optimizer': 'adam', 'graph_mode': 'cutoff', 'cutoff': 0.5741905641612706, 'grm_norm': 'gcn', 'self_loops': False, 'use_snp_selection': True, 'num_snps': 26910}. Best is trial 2 with value: 0.028018574512571268.
[I 2025-11-03 16:26:16,478] Trial 3 finished with value: -0.015322845663348246 and parameters: {'model_type': 'graphsage', 'hidden_dims': '[256, 128, 64]', 'dropout': 0.5390483213624292, 'batch_norm': False, 'lr': 3.4705625989073525e-05, 'weight_decay': 2.4623319020131338e-05, 'epochs': 121, 'loss': 'mse', 'optimizer': 'adam', 'graph_mode': 'knn', 'source': 'grm', 'knn_k': 6, 'weighted_edges': False, 'symmetrize_mode': 'mutual', 'use_snp_selection': True, 'num_snps': 30713}. Best is trial 2 with value: 0.028018574512571268.
[I 2025-11-03 16:26:19,070] Trial 4 finished with value: -0.01896809015448207 and parameters: {'model_type': 'graphsage', 'hidden_dims': '[128, 64]', 'dropout': 0.13404863676897502, 'batch_norm': False, 'lr': 0.0001431556295367288, 'weight_decay': 2.2084517750726675e-05, 'epochs': 51, 'loss': 'mae', 'optimizer': 'adam', 'graph_mode': 'cutoff', 'cutoff': 0.6714268476993044, 'grm_norm': 'none', 'self_loops': False, 'use_snp_selection': True, 'num_snps': 45645}. Best is trial 2 with value: 0.028018574512571268.
[I 2025-11-03 16:26:22,364] Trial 5 finished with value: -0.0110878255110528 and parameters: {'model_type': 'graphsage', 'hidden_dims': '[256, 128]', 'dropout': 0.42253606323412096, 'batch_norm': False, 'lr': 4.238630400638805e-05, 'weight_decay': 8.074086040046576e-07, 'epochs': 158, 'loss': 'mae', 'optimizer': 'adam', 'graph_mode': 'knn', 'source': 'grm', 'knn_k': 1, 'weighted_edges': False, 'symmetrize_mode': 'mutual', 'use_snp_selection': True, 'num_snps': 43113}. Best is trial 2 with value: 0.028018574512571268.
[I 2025-11-03 16:26:26,691] Trial 6 finished with value: 0.004876874653264763 and parameters: {'model_type': 'graphsage', 'hidden_dims': '[512, 256]', 'dropout': 0.3534893146320237, 'batch_norm': True, 'lr': 0.000251307964226932, 'weight_decay': 1.821819791794022e-05, 'epochs': 223, 'loss': 'mae', 'optimizer': 'adam', 'graph_mode': 'knn', 'source': 'grm', 'knn_k': 1, 'weighted_edges': True, 'symmetrize_mode': 'mutual', 'use_snp_selection': False}. Best is trial 2 with value: 0.028018574512571268.
[I 2025-11-03 16:26:30,584] Trial 7 finished with value: -0.008975627327803591 and parameters: {'model_type': 'graphsage', 'hidden_dims': '[512, 256]', 'dropout': 0.1105825955860775, 'batch_norm': True, 'lr': 2.374338412754043e-05, 'weight_decay': 1.1284721123340274e-05, 'epochs': 190, 'loss': 'mse', 'optimizer': 'adam', 'graph_mode': 'cutoff', 'cutoff': 0.719872204109604, 'grm_norm': 'gcn', 'self_loops': False, 'use_snp_selection': False}. Best is trial 2 with value: 0.028018574512571268.
[I 2025-11-03 16:26:33,927] Trial 8 finished with value: -0.01741390013466261 and parameters: {'model_type': 'graphsage', 'hidden_dims': '[512, 128]', 'dropout': 0.5066580418354021, 'batch_norm': True, 'lr': 0.00039213678276659976, 'weight_decay': 3.43655320802934e-06, 'epochs': 120, 'loss': 'mse', 'optimizer': 'adam', 'graph_mode': 'cutoff', 'cutoff': 0.34923059576505366, 'grm_norm': 'cosine', 'self_loops': True, 'use_snp_selection': False}. Best is trial 2 with value: 0.028018574512571268.
[I 2025-11-03 16:26:36,061] Trial 9 finished with value: 0.009715455731956231 and parameters: {'model_type': 'graphsage', 'hidden_dims': '[512, 256]', 'dropout': 0.301734920240333, 'batch_norm': False, 'lr': 6.650961854953448e-06, 'weight_decay': 6.861575656590315e-05, 'epochs': 150, 'loss': 'mae', 'optimizer': 'adam', 'graph_mode': 'cutoff', 'cutoff': 0.2857569870061939, 'grm_norm': 'cosine_then_gcn', 'self_loops': False, 'use_snp_selection': True, 'num_snps': 12722}. Best is trial 2 with value: 0.028018574512571268.
[I 2025-11-03 16:26:38,618] Trial 10 finished with value: 0.007341783065054607 and parameters: {'model_type': 'graphsage', 'hidden_dims': '[256, 128]', 'dropout': 0.5885461262002587, 'batch_norm': False, 'lr': 9.558525641285997e-05, 'weight_decay': 0.0005507714381092994, 'epochs': 275, 'loss': 'mse', 'optimizer': 'adam', 'graph_mode': 'cutoff', 'cutoff': 0.8740100033033124, 'grm_norm': 'gcn', 'self_loops': True, 'use_snp_selection': True, 'num_snps': 16208}. Best is trial 2 with value: 0.028018574512571268.
[I 2025-11-03 16:26:41,650] Trial 11 finished with value: 0.012801932928595052 and parameters: {'model_type': 'graphsage', 'hidden_dims': '[512, 64]', 'dropout': 0.44863014119095845, 'batch_norm': True, 'lr': 0.0009964552026845912, 'weight_decay': 1.0655358607693621e-07, 'epochs': 62, 'loss': 'mse', 'optimizer': 'adam', 'graph_mode': 'knn', 'source': 'grm', 'knn_k': 10, 'weighted_edges': True, 'symmetrize_mode': 'union', 'use_snp_selection': False}. Best is trial 2 with value: 0.028018574512571268.
[I 2025-11-03 16:26:45,537] Trial 12 finished with value: 0.00856803534723604 and parameters: {'model_type': 'graphsage', 'hidden_dims': '[128, 64]', 'dropout': 0.35931659580116376, 'batch_norm': True, 'lr': 0.0008875187780684403, 'weight_decay': 0.0004898513914360714, 'epochs': 245, 'loss': 'mse', 'optimizer': 'adam', 'graph_mode': 'cutoff', 'cutoff': 0.48181782223539704, 'grm_norm': 'gcn', 'self_loops': False, 'use_snp_selection': True, 'num_snps': 58791}. Best is trial 2 with value: 0.028018574512571268.
[I 2025-11-03 16:26:47,699] Trial 13 finished with value: -0.030969073954426378 and parameters: {'model_type': 'graphsage', 'hidden_dims': '[256, 128]', 'dropout': 0.45176279717049383, 'batch_norm': False, 'lr': 0.00039532579999289856, 'weight_decay': 1.556479003340889e-06, 'epochs': 84, 'loss': 'mse', 'optimizer': 'adam', 'graph_mode': 'knn', 'source': 'grm', 'knn_k': 5, 'weighted_edges': True, 'symmetrize_mode': 'union', 'use_snp_selection': False}. Best is trial 2 with value: 0.028018574512571268.
[I 2025-11-03 16:26:50,841] Trial 14 finished with value: 0.011454061153802255 and parameters: {'model_type': 'graphsage', 'hidden_dims': '[256, 128, 64]', 'dropout': 0.27638046898513846, 'batch_norm': False, 'lr': 9.973894103804444e-05, 'weight_decay': 2.612499763810861e-07, 'epochs': 303, 'loss': 'mse', 'optimizer': 'adam', 'graph_mode': 'cutoff', 'cutoff': 0.531893423667369, 'grm_norm': 'none', 'self_loops': False, 'use_snp_selection': False}. Best is trial 2 with value: 0.028018574512571268.
[I 2025-11-03 16:26:54,047] Trial 15 finished with value: 0.004145170860539209 and parameters: {'model_type': 'graphsage', 'hidden_dims': '[512, 64]', 'dropout': 0.5135093900111631, 'batch_norm': True, 'lr': 0.0005361548603136552, 'weight_decay': 3.525194351311951e-06, 'epochs': 189, 'loss': 'mse', 'optimizer': 'adam', 'graph_mode': 'knn', 'source': 'grm', 'knn_k': 5, 'weighted_edges': True, 'symmetrize_mode': 'union', 'use_snp_selection': True, 'num_snps': 25832}. Best is trial 2 with value: 0.028018574512571268.
[I 2025-11-03 16:26:57,492] Trial 16 finished with value: 0.020370790479645472 and parameters: {'model_type': 'graphsage', 'hidden_dims': '[512, 128]', 'dropout': 0.4032901811114321, 'batch_norm': True, 'lr': 1.1967859941484413e-05, 'weight_decay': 0.00018183807869182438, 'epochs': 102, 'loss': 'mse', 'optimizer': 'adam', 'graph_mode': 'knn', 'source': 'grm', 'knn_k': 8, 'weighted_edges': False, 'symmetrize_mode': 'union', 'use_snp_selection': False}. Best is trial 2 with value: 0.028018574512571268.
[I 2025-11-03 16:26:59,158] Trial 17 finished with value: -0.018090224227644766 and parameters: {'model_type': 'graphsage', 'hidden_dims': '[512, 128]', 'dropout': 0.5928746349572604, 'batch_norm': False, 'lr': 9.254448425201585e-06, 'weight_decay': 0.00019968068860040972, 'epochs': 107, 'loss': 'mse', 'optimizer': 'adam', 'graph_mode': 'cutoff', 'cutoff': 0.6891673938283641, 'grm_norm': 'cosine_then_gcn', 'self_loops': True, 'use_snp_selection': True, 'num_snps': 5158}. Best is trial 2 with value: 0.028018574512571268.
[I 2025-11-03 16:27:03,735] Trial 18 finished with value: -0.021960290338938284 and parameters: {'model_type': 'graphsage', 'hidden_dims': '[512, 128]', 'dropout': 0.2712600230247997, 'batch_norm': True, 'lr': 2.344763933714866e-06, 'weight_decay': 0.0008954308761107001, 'epochs': 151, 'loss': 'mse', 'optimizer': 'adam', 'graph_mode': 'knn', 'source': 'grm', 'knn_k': 10, 'weighted_edges': False, 'symmetrize_mode': 'union', 'use_snp_selection': True, 'num_snps': 42324}. Best is trial 2 with value: 0.028018574512571268.
[I 2025-11-03 16:27:06,611] Trial 19 finished with value: -9.865279979612901e-05 and parameters: {'model_type': 'graphsage', 'hidden_dims': '[256, 128]', 'dropout': 0.4889423052857486, 'batch_norm': False, 'lr': 1.1598937362854942e-05, 'weight_decay': 0.00013971812845869872, 'epochs': 236, 'loss': 'mse', 'optimizer': 'adam', 'graph_mode': 'cutoff', 'cutoff': 0.41527777654278275, 'grm_norm': 'cosine', 'self_loops': False, 'use_snp_selection': False}. Best is trial 2 with value: 0.028018574512571268.
[I 2025-11-03 16:27:09,088] Trial 20 finished with value: -0.005798511020494239 and parameters: {'model_type': 'graphsage', 'hidden_dims': '[512, 128]', 'dropout': 0.40051499762582315, 'batch_norm': False, 'lr': 3.3578708944705104e-06, 'weight_decay': 0.0002294731706941064, 'epochs': 96, 'loss': 'mse', 'optimizer': 'adam', 'graph_mode': 'knn', 'source': 'grm', 'knn_k': 4, 'weighted_edges': False, 'symmetrize_mode': 'union', 'use_snp_selection': True, 'num_snps': 22145}. Best is trial 2 with value: 0.028018574512571268.
[I 2025-11-03 16:27:10,591] Trial 21 finished with value: -0.012295077805581207 and parameters: {'model_type': 'graphsage', 'hidden_dims': '[128, 64]', 'dropout': 0.39175345053879235, 'batch_norm': True, 'lr': 0.00020631788537749015, 'weight_decay': 4.881339110858778e-06, 'epochs': 44, 'loss': 'mse', 'optimizer': 'adam', 'graph_mode': 'knn', 'source': 'grm', 'knn_k': 8, 'weighted_edges': False, 'symmetrize_mode': 'union', 'use_snp_selection': False}. Best is trial 2 with value: 0.028018574512571268.
[I 2025-11-03 16:27:12,671] Trial 22 finished with value: 0.005755780052059323 and parameters: {'model_type': 'graphsage', 'hidden_dims': '[256, 128]', 'dropout': 0.3307509110936703, 'batch_norm': True, 'lr': 6.121094127511245e-05, 'weight_decay': 7.345892375260443e-07, 'epochs': 75, 'loss': 'mse', 'optimizer': 'adam', 'graph_mode': 'knn', 'source': 'grm', 'knn_k': 7, 'weighted_edges': False, 'symmetrize_mode': 'union', 'use_snp_selection': False}. Best is trial 2 with value: 0.028018574512571268.
[I 2025-11-03 16:27:14,738] Trial 23 finished with value: 0.005027278030583556 and parameters: {'model_type': 'graphsage', 'hidden_dims': '[128, 64]', 'dropout': 0.46731903628277444, 'batch_norm': True, 'lr': 2.1644561175212637e-05, 'weight_decay': 0.0008282362070511183, 'epochs': 133, 'loss': 'mse', 'optimizer': 'adam', 'graph_mode': 'knn', 'source': 'grm', 'knn_k': 8, 'weighted_edges': True, 'symmetrize_mode': 'union', 'use_snp_selection': False}. Best is trial 2 with value: 0.028018574512571268.
[I 2025-11-03 16:27:18,997] Trial 24 finished with value: 0.012891916432592831 and parameters: {'model_type': 'graphsage', 'hidden_dims': '[512, 128]', 'dropout': 0.5496601262939678, 'batch_norm': True, 'lr': 0.0006133752774057351, 'weight_decay': 6.950560817631993e-05, 'epochs': 163, 'loss': 'mse', 'optimizer': 'adam', 'graph_mode': 'knn', 'source': 'grm', 'knn_k': 9, 'weighted_edges': True, 'symmetrize_mode': 'union', 'use_snp_selection': False}. Best is trial 2 with value: 0.028018574512571268.
[I 2025-11-03 16:27:21,014] Trial 25 finished with value: -0.01355411973599067 and parameters: {'model_type': 'graphsage', 'hidden_dims': '[256, 128, 64]', 'dropout': 0.3883412188444888, 'batch_norm': True, 'lr': 5.039225320678739e-06, 'weight_decay': 0.0003367143198582827, 'epochs': 85, 'loss': 'mse', 'optimizer': 'adam', 'graph_mode': 'knn', 'source': 'grm', 'knn_k': 3, 'weighted_edges': False, 'symmetrize_mode': 'union', 'use_snp_selection': False}. Best is trial 2 with value: 0.028018574512571268.
[I 2025-11-03 16:27:24,753] Trial 26 finished with value: 0.00027886269100813504 and parameters: {'model_type': 'graphsage', 'hidden_dims': '[512, 64]', 'dropout': 0.21957724795861636, 'batch_norm': True, 'lr': 1.0693095775852576e-06, 'weight_decay': 0.0001316515617599832, 'epochs': 182, 'loss': 'mae', 'optimizer': 'adam', 'graph_mode': 'cutoff', 'cutoff': 0.8390716066193666, 'grm_norm': 'gcn', 'self_loops': True, 'use_snp_selection': False}. Best is trial 2 with value: 0.028018574512571268.
[I 2025-11-03 16:27:27,199] Trial 27 finished with value: 0.006001003518867164 and parameters: {'model_type': 'graphsage', 'hidden_dims': '[128, 64]', 'dropout': 0.4279074854104258, 'batch_norm': True, 'lr': 1.4408872372047635e-05, 'weight_decay': 8.523051129033495e-06, 'epochs': 207, 'loss': 'mse', 'optimizer': 'adam', 'graph_mode': 'knn', 'source': 'grm', 'knn_k': 7, 'weighted_edges': True, 'symmetrize_mode': 'union', 'use_snp_selection': False}. Best is trial 2 with value: 0.028018574512571268.
[I 2025-11-03 16:27:28,468] Trial 28 finished with value: 0.030607490341738944 and parameters: {'model_type': 'graphsage', 'hidden_dims': '[256, 128]', 'dropout': 0.48037600234187006, 'batch_norm': False, 'lr': 0.0001999493756137094, 'weight_decay': 1.7482188109245465e-06, 'epochs': 40, 'loss': 'mse', 'optimizer': 'adam', 'graph_mode': 'cutoff', 'cutoff': 0.2228718610229144, 'grm_norm': 'gcn', 'self_loops': False, 'use_snp_selection': True, 'num_snps': 3079}. Best is trial 28 with value: 0.030607490341738944.
[I 2025-11-03 16:27:30,747] Trial 29 finished with value: 0.04518093547498729 and parameters: {'model_type': 'graphsage', 'hidden_dims': '[256, 128]', 'dropout': 0.5469273977547648, 'batch_norm': False, 'lr': 0.00029119159639190423, 'weight_decay': 3.951186368675532e-05, 'epochs': 329, 'loss': 'mae', 'optimizer': 'adam', 'graph_mode': 'cutoff', 'cutoff': 0.24271756111917747, 'grm_norm': 'gcn', 'self_loops': False, 'use_snp_selection': True, 'num_snps': 3086}. Best is trial 29 with value: 0.04518093547498729.
[I 2025-11-03 16:27:32,958] Trial 30 finished with value: 0.03794950272981215 and parameters: {'model_type': 'graphsage', 'hidden_dims': '[256, 128]', 'dropout': 0.5524888037296644, 'batch_norm': False, 'lr': 0.0002787067280398708, 'weight_decay': 5.127198911566535e-05, 'epochs': 317, 'loss': 'mae', 'optimizer': 'adam', 'graph_mode': 'cutoff', 'cutoff': 0.21456184463181613, 'grm_norm': 'gcn', 'self_loops': False, 'use_snp_selection': True, 'num_snps': 2416}. Best is trial 29 with value: 0.04518093547498729.
[I 2025-11-03 16:27:35,275] Trial 31 finished with value: 0.019416684848109926 and parameters: {'model_type': 'graphsage', 'hidden_dims': '[256, 128]', 'dropout': 0.5584285907616043, 'batch_norm': False, 'lr': 0.0002481342306283922, 'weight_decay': 5.2639850918572564e-05, 'epochs': 348, 'loss': 'mae', 'optimizer': 'adam', 'graph_mode': 'cutoff', 'cutoff': 0.22269496810134767, 'grm_norm': 'gcn', 'self_loops': False, 'use_snp_selection': True, 'num_snps': 2230}. Best is trial 29 with value: 0.04518093547498729.
[I 2025-11-03 16:27:37,732] Trial 32 finished with value: 0.023232237414502702 and parameters: {'model_type': 'graphsage', 'hidden_dims': '[256, 128]', 'dropout': 0.4882750428019077, 'batch_norm': False, 'lr': 0.00015472374282116404, 'weight_decay': 4.044258877369232e-05, 'epochs': 327, 'loss': 'mae', 'optimizer': 'adam', 'graph_mode': 'cutoff', 'cutoff': 0.2078932298746233, 'grm_norm': 'gcn', 'self_loops': False, 'use_snp_selection': True, 'num_snps': 8366}. Best is trial 29 with value: 0.04518093547498729.
[I 2025-11-03 16:27:39,916] Trial 33 finished with value: 0.034477832622384144 and parameters: {'model_type': 'graphsage', 'hidden_dims': '[256, 128]', 'dropout': 0.5346819442004661, 'batch_norm': False, 'lr': 0.00037243110376451656, 'weight_decay': 8.866483351700938e-06, 'epochs': 309, 'loss': 'mae', 'optimizer': 'adam', 'graph_mode': 'cutoff', 'cutoff': 0.30002016150778915, 'grm_norm': 'gcn', 'self_loops': False, 'use_snp_selection': True, 'num_snps': 2417}. Best is trial 29 with value: 0.04518093547498729.
[I 2025-11-03 16:27:42,123] Trial 34 finished with value: 0.04338881048846199 and parameters: {'model_type': 'graphsage', 'hidden_dims': '[256, 128]', 'dropout': 0.5667778454300856, 'batch_norm': False, 'lr': 0.0003382361825834133, 'weight_decay': 1.0734285639888305e-05, 'epochs': 312, 'loss': 'mae', 'optimizer': 'adam', 'graph_mode': 'cutoff', 'cutoff': 0.30197998380760915, 'grm_norm': 'gcn', 'self_loops': False, 'use_snp_selection': True, 'num_snps': 2708}. Best is trial 29 with value: 0.04518093547498729.
[I 2025-11-03 16:27:44,625] Trial 35 finished with value: -0.01920826232216089 and parameters: {'model_type': 'graphsage', 'hidden_dims': '[256, 128]', 'dropout': 0.5701015234709536, 'batch_norm': False, 'lr': 0.00031444493195543095, 'weight_decay': 1.1222387545894253e-05, 'epochs': 309, 'loss': 'mae', 'optimizer': 'adam', 'graph_mode': 'cutoff', 'cutoff': 0.33170384380922047, 'grm_norm': 'gcn', 'self_loops': False, 'use_snp_selection': True, 'num_snps': 11359}. Best is trial 29 with value: 0.04518093547498729.
[I 2025-11-03 16:27:47,264] Trial 36 finished with value: -0.005980551520563417 and parameters: {'model_type': 'graphsage', 'hidden_dims': '[256, 128]', 'dropout': 0.5288773816827776, 'batch_norm': False, 'lr': 9.60670386564271e-05, 'weight_decay': 3.77672102441857e-05, 'epochs': 285, 'loss': 'mae', 'optimizer': 'adam', 'graph_mode': 'cutoff', 'cutoff': 0.3092986223207555, 'grm_norm': 'gcn', 'self_loops': False, 'use_snp_selection': True, 'num_snps': 17291}. Best is trial 29 with value: 0.04518093547498729.
