[I 2025-11-03 15:08:20,113] Trial 10 finished with value: 0.013701229365943528 and parameters: {'model_type': 'graphsage', 'hidden_dims': '[512, 64]', 'dropout': 0.2923745636750988, 'batch_norm': True, 'lr': 0.00010001966977255833, 'weight_decay': 1.2618827301366646e-07, 'epochs': 41, 'loss': 'mse', 'optimizer': 'adam', 'graph_mode': 'knn', 'source': 'grm', 'knn_k': 10, 'weighted_edges': True, 'symmetrize_mode': 'union', 'use_snp_selection': False}. Best is trial 1 with value: 0.04824765021144777.
[I 2025-11-03 15:08:23,439] Trial 11 finished with value: 0.039305882640385155 and parameters: {'model_type': 'graphsage', 'hidden_dims': '[512, 128]', 'dropout': 0.4214049075657615, 'batch_norm': True, 'lr': 0.0008079808143806397, 'weight_decay': 1.8187594072837697e-06, 'epochs': 97, 'loss': 'mse', 'optimizer': 'adam', 'graph_mode': 'cutoff', 'cutoff': 0.27687267525456005, 'grm_norm': 'cosine', 'self_loops': True, 'use_snp_selection': False}. Best is trial 1 with value: 0.04824765021144777.
[I 2025-11-03 15:08:26,260] Trial 12 finished with value: 0.05034492753444554 and parameters: {'model_type': 'graphsage', 'hidden_dims': '[512, 128]', 'dropout': 0.5982500509908173, 'batch_norm': True, 'lr': 0.0003345968813942026, 'weight_decay': 1.5741178562840553e-06, 'epochs': 84, 'loss': 'mse', 'optimizer': 'adam', 'graph_mode': 'cutoff', 'cutoff': 0.4198107830115015, 'grm_norm': 'cosine', 'self_loops': True, 'use_snp_selection': False}. Best is trial 12 with value: 0.05034492753444554.
[I 2025-11-03 15:08:30,706] Trial 13 finished with value: 0.049480995273310305 and parameters: {'model_type': 'graphsage', 'hidden_dims': '[512, 128]', 'dropout': 0.5952453400472515, 'batch_norm': True, 'lr': 0.0009920244500946143, 'weight_decay': 2.988812407507651e-07, 'epochs': 252, 'loss': 'mse', 'optimizer': 'adam', 'graph_mode': 'knn', 'source': 'grm', 'knn_k': 5, 'weighted_edges': True, 'symmetrize_mode': 'union', 'use_snp_selection': False}. Best is trial 12 with value: 0.05034492753444554.
[I 2025-11-03 15:08:35,134] Trial 14 finished with value: 0.0470947424639022 and parameters: {'model_type': 'graphsage', 'hidden_dims': '[512, 128]', 'dropout': 0.5670827807932382, 'batch_norm': True, 'lr': 0.00013588825811324158, 'weight_decay': 1.2989685499381173e-07, 'epochs': 258, 'loss': 'mse', 'optimizer': 'adam', 'graph_mode': 'knn', 'source': 'grm', 'knn_k': 4, 'weighted_edges': True, 'symmetrize_mode': 'union', 'use_snp_selection': False}. Best is trial 12 with value: 0.05034492753444554.
[I 2025-11-03 15:08:39,679] Trial 15 finished with value: 0.028858826091744307 and parameters: {'model_type': 'graphsage', 'hidden_dims': '[512, 128]', 'dropout': 0.5989570383993954, 'batch_norm': True, 'lr': 0.00094645867610948, 'weight_decay': 6.028960267768258e-07, 'epochs': 281, 'loss': 'mse', 'optimizer': 'adam', 'graph_mode': 'cutoff', 'cutoff': 0.4824114567335711, 'grm_norm': 'cosine', 'self_loops': True, 'use_snp_selection': False}. Best is trial 12 with value: 0.05034492753444554.
[I 2025-11-03 15:08:43,690] Trial 16 finished with value: 0.04944579433254321 and parameters: {'model_type': 'graphsage', 'hidden_dims': '[512, 128]', 'dropout': 0.47627753018274765, 'batch_norm': True, 'lr': 0.00030327510784459685, 'weight_decay': 3.939158144371285e-07, 'epochs': 243, 'loss': 'mse', 'optimizer': 'adam', 'graph_mode': 'cutoff', 'cutoff': 0.8611567108935678, 'grm_norm': 'none', 'self_loops': True, 'use_snp_selection': False}. Best is trial 12 with value: 0.05034492753444554.
[I 2025-11-03 15:08:46,907] Trial 17 finished with value: 0.04214772803134714 and parameters: {'model_type': 'graphsage', 'hidden_dims': '[256, 128, 64]', 'dropout': 0.5883350396030336, 'batch_norm': True, 'lr': 7.116135585703898e-05, 'weight_decay': 4.608508677068542e-06, 'epochs': 305, 'loss': 'mse', 'optimizer': 'adam', 'graph_mode': 'knn', 'source': 'grm', 'knn_k': 4, 'weighted_edges': False, 'symmetrize_mode': 'union', 'use_snp_selection': False}. Best is trial 12 with value: 0.05034492753444554.
[I 2025-11-03 15:08:50,979] Trial 18 finished with value: 0.0282766670112412 and parameters: {'model_type': 'graphsage', 'hidden_dims': '[512, 64]', 'dropout': 0.45670371409212673, 'batch_norm': True, 'lr': 1.6327118997610666e-05, 'weight_decay': 3.293863322548928e-07, 'epochs': 217, 'loss': 'mse', 'optimizer': 'adam', 'graph_mode': 'cutoff', 'cutoff': 0.44476470938456797, 'grm_norm': 'cosine_then_gcn', 'self_loops': True, 'use_snp_selection': False}. Best is trial 12 with value: 0.05034492753444554.
[I 2025-11-03 15:08:56,162] Trial 19 finished with value: 0.04776058081623181 and parameters: {'model_type': 'graphsage', 'hidden_dims': '[512, 128]', 'dropout': 0.5440380914991705, 'batch_norm': True, 'lr': 0.0002347931540030196, 'weight_decay': 1.1683190553996391e-06, 'epochs': 337, 'loss': 'mse', 'optimizer': 'adam', 'graph_mode': 'knn', 'source': 'grm', 'knn_k': 4, 'weighted_edges': True, 'symmetrize_mode': 'union', 'use_snp_selection': False}. Best is trial 12 with value: 0.05034492753444554.
[I 2025-11-03 15:09:03,306] Trial 20 finished with value: -0.013965465663767702 and parameters: {'model_type': 'graphsage', 'hidden_dims': '[512, 128]', 'dropout': 0.253769840387702, 'batch_norm': True, 'lr': 9.044624030207948e-06, 'weight_decay': 2.3402754091627478e-07, 'epochs': 294, 'loss': 'mse', 'optimizer': 'adam', 'graph_mode': 'cutoff', 'cutoff': 0.21218709727906532, 'grm_norm': 'cosine', 'self_loops': True, 'use_snp_selection': False}. Best is trial 12 with value: 0.05034492753444554.
[I 2025-11-03 15:09:07,340] Trial 21 finished with value: 0.04551782699136952 and parameters: {'model_type': 'graphsage', 'hidden_dims': '[512, 128]', 'dropout': 0.48606811363757885, 'batch_norm': True, 'lr': 0.00035522261059863316, 'weight_decay': 4.4009052728027735e-07, 'epochs': 247, 'loss': 'mse', 'optimizer': 'adam', 'graph_mode': 'cutoff', 'cutoff': 0.8711843999194891, 'grm_norm': 'none', 'self_loops': True, 'use_snp_selection': False}. Best is trial 12 with value: 0.05034492753444554.
[I 2025-11-03 15:09:11,313] Trial 22 finished with value: 0.03991721919271871 and parameters: {'model_type': 'graphsage', 'hidden_dims': '[512, 128]', 'dropout': 0.4724495213196751, 'batch_norm': True, 'lr': 0.00026819905609883, 'weight_decay': 2.6672091915159777e-07, 'epochs': 234, 'loss': 'mse', 'optimizer': 'adam', 'graph_mode': 'cutoff', 'cutoff': 0.8868806876161305, 'grm_norm': 'none', 'self_loops': True, 'use_snp_selection': False}. Best is trial 12 with value: 0.05034492753444554.
[I 2025-11-03 15:09:15,021] Trial 23 finished with value: 0.027992659831732762 and parameters: {'model_type': 'graphsage', 'hidden_dims': '[512, 128]', 'dropout': 0.5475405472624402, 'batch_norm': True, 'lr': 0.0004549041327640761, 'weight_decay': 3.0978399500788733e-06, 'epochs': 203, 'loss': 'mse', 'optimizer': 'adam', 'graph_mode': 'cutoff', 'cutoff': 0.7473040113769627, 'grm_norm': 'none', 'self_loops': True, 'use_snp_selection': False}. Best is trial 12 with value: 0.05034492753444554.
[I 2025-11-03 15:09:19,293] Trial 24 finished with value: 0.04335917971841774 and parameters: {'model_type': 'graphsage', 'hidden_dims': '[512, 128]', 'dropout': 0.37567915018881964, 'batch_norm': True, 'lr': 0.0008891974856044999, 'weight_decay': 9.730091684021232e-07, 'epochs': 266, 'loss': 'mse', 'optimizer': 'adam', 'graph_mode': 'cutoff', 'cutoff': 0.6149056254451863, 'grm_norm': 'cosine', 'self_loops': True, 'use_snp_selection': False}. Best is trial 12 with value: 0.05034492753444554.
[I 2025-11-03 15:09:23,041] Trial 25 finished with value: 0.028793252065322152 and parameters: {'model_type': 'graphsage', 'hidden_dims': '[512, 128]', 'dropout': 0.5164675423489733, 'batch_norm': True, 'lr': 0.00017411893846537907, 'weight_decay': 1.1556888214381824e-07, 'epochs': 170, 'loss': 'mse', 'optimizer': 'adam', 'graph_mode': 'cutoff', 'cutoff': 0.4362496400742217, 'grm_norm': 'none', 'self_loops': True, 'use_snp_selection': False}. Best is trial 12 with value: 0.05034492753444554.
[I 2025-11-03 15:09:29,913] Trial 26 finished with value: 0.047500481475543796 and parameters: {'model_type': 'graphsage', 'hidden_dims': '[512, 64]', 'dropout': 0.5991947668677615, 'batch_norm': False, 'lr': 7.764826667855315e-05, 'weight_decay': 6.050227088817315e-06, 'epochs': 301, 'loss': 'mae', 'optimizer': 'adam', 'graph_mode': 'knn', 'source': 'grm', 'knn_k': 10, 'weighted_edges': False, 'symmetrize_mode': 'union', 'use_snp_selection': True, 'num_snps': 59005}. Best is trial 12 with value: 0.05034492753444554.
[I 2025-11-03 15:09:31,970] Trial 27 finished with value: 0.028144239877289343 and parameters: {'model_type': 'graphsage', 'hidden_dims': '[256, 128]', 'dropout': 0.448394334445984, 'batch_norm': True, 'lr': 1.2930656788964772e-06, 'weight_decay': 5.144942867654386e-07, 'epochs': 134, 'loss': 'mse', 'optimizer': 'adam', 'graph_mode': 'cutoff', 'cutoff': 0.8005235003010104, 'grm_norm': 'gcn', 'self_loops': True, 'use_snp_selection': False}. Best is trial 12 with value: 0.05034492753444554.
[I 2025-11-03 15:09:34,562] Trial 28 finished with value: 0.016203786632542752 and parameters: {'model_type': 'graphsage', 'hidden_dims': '[256, 128, 64]', 'dropout': 0.5723161087873986, 'batch_norm': True, 'lr': 0.000517972243794138, 'weight_decay': 1.6704834427583558e-06, 'epochs': 205, 'loss': 'mse', 'optimizer': 'adam', 'graph_mode': 'knn', 'source': 'grm', 'knn_k': 3, 'weighted_edges': True, 'symmetrize_mode': 'union', 'use_snp_selection': False}. Best is trial 12 with value: 0.05034492753444554.
[I 2025-11-03 15:09:36,270] Trial 29 finished with value: -0.014328967800324135 and parameters: {'model_type': 'graphsage', 'hidden_dims': '[128, 64]', 'dropout': 0.5314315861599657, 'batch_norm': True, 'lr': 5.295216876367342e-06, 'weight_decay': 8.368908757919724e-05, 'epochs': 93, 'loss': 'mae', 'optimizer': 'adam', 'graph_mode': 'knn', 'source': 'grm', 'knn_k': 8, 'weighted_edges': True, 'symmetrize_mode': 'union', 'use_snp_selection': False}. Best is trial 12 with value: 0.05034492753444554.
[I 2025-11-03 15:09:40,323] Trial 30 finished with value: 0.04100538100335441 and parameters: {'model_type': 'graphsage', 'hidden_dims': '[512, 128]', 'dropout': 0.48405514147622436, 'batch_norm': True, 'lr': 5.0559727674431936e-05, 'weight_decay': 1.9593478931525112e-07, 'epochs': 235, 'loss': 'mse', 'optimizer': 'adam', 'graph_mode': 'cutoff', 'cutoff': 0.5156115763925885, 'grm_norm': 'cosine_then_gcn', 'self_loops': True, 'use_snp_selection': False}. Best is trial 12 with value: 0.05034492753444554.
[I 2025-11-03 15:09:41,900] Trial 31 finished with value: 0.058828505495271376 and parameters: {'model_type': 'graphsage', 'hidden_dims': '[128, 64]', 'dropout': 0.3872001216942384, 'batch_norm': True, 'lr': 0.0005988167296561029, 'weight_decay': 1.955675185281059e-06, 'epochs': 71, 'loss': 'mse', 'optimizer': 'adam', 'graph_mode': 'knn', 'source': 'grm', 'knn_k': 7, 'weighted_edges': True, 'symmetrize_mode': 'union', 'use_snp_selection': False}. Best is trial 31 with value: 0.058828505495271376.
[I 2025-11-03 15:09:43,492] Trial 32 finished with value: 0.04443741010489738 and parameters: {'model_type': 'graphsage', 'hidden_dims': '[128, 64]', 'dropout': 0.3137239636673354, 'batch_norm': True, 'lr': 0.0005850369940606298, 'weight_decay': 2.2813445020692373e-06, 'epochs': 81, 'loss': 'mse', 'optimizer': 'adam', 'graph_mode': 'knn', 'source': 'grm', 'knn_k': 6, 'weighted_edges': True, 'symmetrize_mode': 'union', 'use_snp_selection': False}. Best is trial 31 with value: 0.058828505495271376.
[I 2025-11-03 15:09:45,055] Trial 33 finished with value: 0.04579584052912673 and parameters: {'model_type': 'graphsage', 'hidden_dims': '[128, 64]', 'dropout': 0.4025679949440325, 'batch_norm': True, 'lr': 0.0003479673494669449, 'weight_decay': 1.0618043509265647e-06, 'epochs': 62, 'loss': 'mse', 'optimizer': 'adam', 'graph_mode': 'knn', 'source': 'grm', 'knn_k': 8, 'weighted_edges': True, 'symmetrize_mode': 'union', 'use_snp_selection': False}. Best is trial 31 with value: 0.058828505495271376.
[I 2025-11-03 15:09:46,616] Trial 34 finished with value: 0.05724862595676769 and parameters: {'model_type': 'graphsage', 'hidden_dims': '[128, 64]', 'dropout': 0.2133703361055859, 'batch_norm': True, 'lr': 0.0006038627323044482, 'weight_decay': 6.134920712898295e-06, 'epochs': 80, 'loss': 'mse', 'optimizer': 'adam', 'graph_mode': 'knn', 'source': 'grm', 'knn_k': 5, 'weighted_edges': True, 'symmetrize_mode': 'union', 'use_snp_selection': False}. Best is trial 31 with value: 0.058828505495271376.
[I 2025-11-03 15:09:48,056] Trial 35 finished with value: 0.018664699347984662 and parameters: {'model_type': 'graphsage', 'hidden_dims': '[128, 64]', 'dropout': 0.186305041045618, 'batch_norm': False, 'lr': 0.0005502750319650679, 'weight_decay': 8.558691926524074e-06, 'epochs': 109, 'loss': 'mse', 'optimizer': 'adam', 'graph_mode': 'knn', 'source': 'grm', 'knn_k': 5, 'weighted_edges': True, 'symmetrize_mode': 'union', 'use_snp_selection': True, 'num_snps': 2074}. Best is trial 31 with value: 0.058828505495271376.
[I 2025-11-03 15:09:49,643] Trial 36 finished with value: 0.0543615136289673 and parameters: {'model_type': 'graphsage', 'hidden_dims': '[128, 64]', 'dropout': 0.17895091681970252, 'batch_norm': True, 'lr': 0.000658553484228266, 'weight_decay': 1.239896619739445e-05, 'epochs': 70, 'loss': 'mse', 'optimizer': 'adam', 'graph_mode': 'knn', 'source': 'grm', 'knn_k': 5, 'weighted_edges': True, 'symmetrize_mode': 'union', 'use_snp_selection': False}. Best is trial 31 with value: 0.058828505495271376.
[I 2025-11-03 15:09:51,401] Trial 37 finished with value: 0.03689217866344338 and parameters: {'model_type': 'graphsage', 'hidden_dims': '[128, 64]', 'dropout': 0.1871779902634303, 'batch_norm': False, 'lr': 0.0001861699036294633, 'weight_decay': 0.00010596027803050161, 'epochs': 70, 'loss': 'mae', 'optimizer': 'adam', 'graph_mode': 'knn', 'source': 'grm', 'knn_k': 7, 'weighted_edges': True, 'symmetrize_mode': 'union', 'use_snp_selection': True, 'num_snps': 15344}. Best is trial 31 with value: 0.058828505495271376.
[I 2025-11-03 15:09:52,848] Trial 38 finished with value: 0.03690992844316543 and parameters: {'model_type': 'graphsage', 'hidden_dims': '[128, 64]', 'dropout': 0.22397718249868426, 'batch_norm': True, 'lr': 2.8602254084458333e-06, 'weight_decay': 0.00029814492190853386, 'epochs': 55, 'loss': 'mse', 'optimizer': 'adam', 'graph_mode': 'knn', 'source': 'grm', 'knn_k': 3, 'weighted_edges': True, 'symmetrize_mode': 'union', 'use_snp_selection': False}. Best is trial 31 with value: 0.058828505495271376.
[I 2025-11-03 15:09:56,252] Trial 39 finished with value: -0.024093145638972524 and parameters: {'model_type': 'graphsage', 'hidden_dims': '[128, 64]', 'dropout': 0.14756089389595442, 'batch_norm': False, 'lr': 0.0006393753732422718, 'weight_decay': 1.587524826635094e-05, 'epochs': 82, 'loss': 'mse', 'optimizer': 'adam', 'graph_mode': 'knn', 'source': 'grm', 'knn_k': 7, 'weighted_edges': True, 'symmetrize_mode': 'union', 'use_snp_selection': True, 'num_snps': 58379}. Best is trial 31 with value: 0.058828505495271376.
[I 2025-11-03 15:09:58,035] Trial 40 finished with value: 0.037031100290001895 and parameters: {'model_type': 'graphsage', 'hidden_dims': '[128, 64]', 'dropout': 0.2575739381397138, 'batch_norm': True, 'lr': 0.00020359769260209866, 'weight_decay': 4.714482086289806e-05, 'epochs': 140, 'loss': 'mae', 'optimizer': 'adam', 'graph_mode': 'knn', 'source': 'grm', 'knn_k': 6, 'weighted_edges': True, 'symmetrize_mode': 'mutual', 'use_snp_selection': False}. Best is trial 31 with value: 0.058828505495271376.
[I 2025-11-03 15:09:59,452] Trial 41 finished with value: 0.04102518583830583 and parameters: {'model_type': 'graphsage', 'hidden_dims': '[128, 64]', 'dropout': 0.2155979789119966, 'batch_norm': True, 'lr': 0.0009778832118652772, 'weight_decay': 3.2103602429193906e-05, 'epochs': 41, 'loss': 'mse', 'optimizer': 'adam', 'graph_mode': 'knn', 'source': 'grm', 'knn_k': 5, 'weighted_edges': True, 'symmetrize_mode': 'union', 'use_snp_selection': False}. Best is trial 31 with value: 0.058828505495271376.
[I 2025-11-03 15:10:01,395] Trial 42 finished with value: 0.038309788599440155 and parameters: {'model_type': 'graphsage', 'hidden_dims': '[256, 128]', 'dropout': 0.152780027081585, 'batch_norm': True, 'lr': 0.0006828717541766471, 'weight_decay': 7.923689285157626e-06, 'epochs': 75, 'loss': 'mse', 'optimizer': 'adam', 'graph_mode': 'knn', 'source': 'grm', 'knn_k': 5, 'weighted_edges': True, 'symmetrize_mode': 'union', 'use_snp_selection': False}. Best is trial 31 with value: 0.058828505495271376.
[I 2025-11-03 15:10:04,451] Trial 43 finished with value: 0.046368467259250465 and parameters: {'model_type': 'graphsage', 'hidden_dims': '[512, 256]', 'dropout': 0.11209931911508429, 'batch_norm': True, 'lr': 0.0004716297880085649, 'weight_decay': 3.264794113828323e-06, 'epochs': 111, 'loss': 'mse', 'optimizer': 'adam', 'graph_mode': 'knn', 'source': 'grm', 'knn_k': 3, 'weighted_edges': True, 'symmetrize_mode': 'union', 'use_snp_selection': False}. Best is trial 31 with value: 0.058828505495271376.
[I 2025-11-03 15:10:06,067] Trial 44 finished with value: 0.048070321315372165 and parameters: {'model_type': 'graphsage', 'hidden_dims': '[128, 64]', 'dropout': 0.33209519984408525, 'batch_norm': True, 'lr': 0.00012346317502514114, 'weight_decay': 1.4314500610847503e-05, 'epochs': 94, 'loss': 'mse', 'optimizer': 'adam', 'graph_mode': 'knn', 'source': 'grm', 'knn_k': 5, 'weighted_edges': True, 'symmetrize_mode': 'union', 'use_snp_selection': False}. Best is trial 31 with value: 0.058828505495271376.
[I 2025-11-03 15:10:07,553] Trial 45 finished with value: 0.055232163608019844 and parameters: {'model_type': 'graphsage', 'hidden_dims': '[128, 64]', 'dropout': 0.24077496873585666, 'batch_norm': True, 'lr': 0.0007200626833320523, 'weight_decay': 6.239222215365031e-06, 'epochs': 55, 'loss': 'mse', 'optimizer': 'adam', 'graph_mode': 'knn', 'source': 'grm', 'knn_k': 6, 'weighted_edges': False, 'symmetrize_mode': 'union', 'use_snp_selection': False}. Best is trial 31 with value: 0.058828505495271376.
[I 2025-11-03 15:10:09,059] Trial 46 finished with value: 0.05355749219646918 and parameters: {'model_type': 'graphsage', 'hidden_dims': '[128, 64]', 'dropout': 0.2740610622217744, 'batch_norm': True, 'lr': 0.0004283076621565966, 'weight_decay': 5.313138795689035e-06, 'epochs': 55, 'loss': 'mse', 'optimizer': 'adam', 'graph_mode': 'knn', 'source': 'grm', 'knn_k': 7, 'weighted_edges': False, 'symmetrize_mode': 'union', 'use_snp_selection': False}. Best is trial 31 with value: 0.058828505495271376.
[I 2025-11-03 15:10:10,579] Trial 47 finished with value: 0.05100501162604703 and parameters: {'model_type': 'graphsage', 'hidden_dims': '[128, 64]', 'dropout': 0.27131811546746487, 'batch_norm': True, 'lr': 0.0006919644205777023, 'weight_decay': 5.161696965762465e-06, 'epochs': 58, 'loss': 'mse', 'optimizer': 'adam', 'graph_mode': 'knn', 'source': 'grm', 'knn_k': 7, 'weighted_edges': False, 'symmetrize_mode': 'union', 'use_snp_selection': False}. Best is trial 31 with value: 0.058828505495271376.
[I 2025-11-03 15:10:13,228] Trial 48 finished with value: 0.021749122521307354 and parameters: {'model_type': 'graphsage', 'hidden_dims': '[128, 64]', 'dropout': 0.21825892360627439, 'batch_norm': False, 'lr': 0.00041726071378980187, 'weight_decay': 2.848295761408015e-05, 'epochs': 40, 'loss': 'mae', 'optimizer': 'adam', 'graph_mode': 'knn', 'source': 'grm', 'knn_k': 6, 'weighted_edges': False, 'symmetrize_mode': 'union', 'use_snp_selection': True, 'num_snps': 42595}. Best is trial 31 with value: 0.058828505495271376.
[I 2025-11-03 15:10:15,087] Trial 49 finished with value: 0.034896521147800855 and parameters: {'model_type': 'graphsage', 'hidden_dims': '[128, 64]', 'dropout': 0.1709973502262413, 'batch_norm': True, 'lr': 0.0002888028785588412, 'weight_decay': 1.0256279432680533e-05, 'epochs': 106, 'loss': 'mse', 'optimizer': 'adam', 'graph_mode': 'knn', 'source': 'grm', 'knn_k': 9, 'weighted_edges': False, 'symmetrize_mode': 'union', 'use_snp_selection': False}. Best is trial 31 with value: 0.058828505495271376.
[I 2025-11-03 15:10:16,658] Trial 50 finished with value: 0.041221164527065854 and parameters: {'model_type': 'graphsage', 'hidden_dims': '[128, 64]', 'dropout': 0.37009345035123764, 'batch_norm': True, 'lr': 0.0007309685888631653, 'weight_decay': 5.776701638897431e-06, 'epochs': 67, 'loss': 'mse', 'optimizer': 'adam', 'graph_mode': 'knn', 'source': 'grm', 'knn_k': 7, 'weighted_edges': False, 'symmetrize_mode': 'union', 'use_snp_selection': False}. Best is trial 31 with value: 0.058828505495271376.
[I 2025-11-03 15:10:18,177] Trial 51 finished with value: 0.03296522447796427 and parameters: {'model_type': 'graphsage', 'hidden_dims': '[128, 64]', 'dropout': 0.272892119222212, 'batch_norm': True, 'lr': 0.0006832694851777197, 'weight_decay': 4.563791693680555e-06, 'epochs': 57, 'loss': 'mse', 'optimizer': 'adam', 'graph_mode': 'knn', 'source': 'grm', 'knn_k': 7, 'weighted_edges': False, 'symmetrize_mode': 'union', 'use_snp_selection': False}. Best is trial 31 with value: 0.058828505495271376.
[I 2025-11-03 15:10:19,678] Trial 52 finished with value: 0.04136394668769207 and parameters: {'model_type': 'graphsage', 'hidden_dims': '[128, 64]', 'dropout': 0.2402254253564847, 'batch_norm': True, 'lr': 0.00045835562260944623, 'weight_decay': 2.493646985898861e-06, 'epochs': 48, 'loss': 'mse', 'optimizer': 'adam', 'graph_mode': 'knn', 'source': 'grm', 'knn_k': 8, 'weighted_edges': False, 'symmetrize_mode': 'union', 'use_snp_selection': False}. Best is trial 31 with value: 0.058828505495271376.
