[I 2025-11-03 11:46:15,857] Trial 23 finished with value: 0.0188773351525066 and parameters: {'model_type': 'gcn', 'hidden_dims': '[512, 256]', 'dropout': 0.2511404474624869, 'batch_norm': True, 'lr': 7.180948928883052e-05, 'weight_decay': 1.2999650678405716e-06, 'epochs': 119, 'loss': 'mse', 'optimizer': 'adam', 'graph_mode': 'cutoff', 'cutoff': 0.5989321935017206, 'grm_norm': 'gcn', 'self_loops': False, 'use_snp_selection': False}. Best is trial 2 with value: 0.06660239705815157.
[I 2025-11-03 11:46:17,663] Trial 24 finished with value: 0.055195529364956294 and parameters: {'model_type': 'gcn', 'hidden_dims': '[256, 128, 64]', 'dropout': 0.17347170111469717, 'batch_norm': True, 'lr': 3.67468312921871e-05, 'weight_decay': 5.233857174200877e-07, 'epochs': 144, 'loss': 'mse', 'optimizer': 'adam', 'graph_mode': 'cutoff', 'cutoff': 0.7602983474635094, 'grm_norm': 'gcn', 'self_loops': False, 'use_snp_selection': False}. Best is trial 2 with value: 0.06660239705815157.
[I 2025-11-03 11:46:19,735] Trial 25 finished with value: 0.027336351924814144 and parameters: {'model_type': 'gcn', 'hidden_dims': '[256, 128, 64]', 'dropout': 0.5523330790023019, 'batch_norm': True, 'lr': 0.00012889390024420054, 'weight_decay': 1.0061755449332778e-07, 'epochs': 194, 'loss': 'mse', 'optimizer': 'adam', 'graph_mode': 'cutoff', 'cutoff': 0.8075013800124555, 'grm_norm': 'gcn', 'self_loops': False, 'use_snp_selection': False}. Best is trial 2 with value: 0.06660239705815157.
[I 2025-11-03 11:46:21,143] Trial 26 finished with value: 0.002043706436302658 and parameters: {'model_type': 'gcn', 'hidden_dims': '[256, 128, 64]', 'dropout': 0.16182094070369174, 'batch_norm': True, 'lr': 4.375900637078784e-05, 'weight_decay': 3.391326634423389e-07, 'epochs': 55, 'loss': 'mae', 'optimizer': 'adam', 'graph_mode': 'knn', 'source': 'grm', 'knn_k': 10, 'weighted_edges': True, 'symmetrize_mode': 'union', 'use_snp_selection': False}. Best is trial 2 with value: 0.06660239705815157.
[I 2025-11-03 11:46:23,862] Trial 27 finished with value: 0.026709683147187007 and parameters: {'model_type': 'gcn', 'hidden_dims': '[256, 128, 64]', 'dropout': 0.4621092276650331, 'batch_norm': False, 'lr': 0.00021373521482973275, 'weight_decay': 4.7266750653816393e-07, 'epochs': 152, 'loss': 'mse', 'optimizer': 'adam', 'graph_mode': 'cutoff', 'cutoff': 0.5823269560997745, 'grm_norm': 'cosine_then_gcn', 'self_loops': False, 'use_snp_selection': True, 'num_snps': 36359}. Best is trial 2 with value: 0.06660239705815157.
[I 2025-11-03 11:46:25,621] Trial 28 finished with value: 0.017631662304797593 and parameters: {'model_type': 'gcn', 'hidden_dims': '[256, 128, 64]', 'dropout': 0.34095624035998956, 'batch_norm': True, 'lr': 1.467781385674591e-05, 'weight_decay': 1.885506560464768e-07, 'epochs': 102, 'loss': 'mse', 'optimizer': 'adam', 'graph_mode': 'knn', 'source': 'grm', 'knn_k': 3, 'weighted_edges': False, 'symmetrize_mode': 'mutual', 'use_snp_selection': False}. Best is trial 2 with value: 0.06660239705815157.
[I 2025-11-03 11:46:29,006] Trial 29 finished with value: 0.021801027308240864 and parameters: {'model_type': 'gcn', 'hidden_dims': '[512, 64]', 'dropout': 0.17303194857429358, 'batch_norm': True, 'lr': 0.00032662522122675706, 'weight_decay': 4.470434045898197e-05, 'epochs': 299, 'loss': 'mae', 'optimizer': 'adam', 'graph_mode': 'knn', 'source': 'grm', 'knn_k': 6, 'weighted_edges': False, 'symmetrize_mode': 'mutual', 'use_snp_selection': False}. Best is trial 2 with value: 0.06660239705815157.
[I 2025-11-03 11:46:31,832] Trial 30 finished with value: 0.05093888348917704 and parameters: {'model_type': 'gcn', 'hidden_dims': '[512, 128]', 'dropout': 0.436572230324775, 'batch_norm': False, 'lr': 3.7984979200504266e-06, 'weight_decay': 8.493751805172086e-05, 'epochs': 3, 'loss': 'mse', 'optimizer': 'adam', 'graph_mode': 'cutoff', 'cutoff': 0.2050220889252814, 'grm_norm': 'cosine', 'self_loops': False, 'use_snp_selection': True, 'num_snps': 50989}. Best is trial 2 with value: 0.06660239705815157.
[I 2025-11-03 11:46:33,334] Trial 31 finished with value: 0.062194058488972664 and parameters: {'model_type': 'gcn', 'hidden_dims': '[128, 64]', 'dropout': 0.22769670597729508, 'batch_norm': True, 'lr': 8.137764549859655e-05, 'weight_decay': 1.99194935958279e-06, 'epochs': 142, 'loss': 'mse', 'optimizer': 'adam', 'graph_mode': 'cutoff', 'cutoff': 0.7902699986690941, 'grm_norm': 'gcn', 'self_loops': False, 'use_snp_selection': False}. Best is trial 2 with value: 0.06660239705815157.
[I 2025-11-03 11:46:34,823] Trial 32 finished with value: 0.04054255921046251 and parameters: {'model_type': 'gcn', 'hidden_dims': '[128, 64]', 'dropout': 0.2114461839546929, 'batch_norm': True, 'lr': 9.190042175605148e-05, 'weight_decay': 2.535463768873436e-06, 'epochs': 165, 'loss': 'mse', 'optimizer': 'adam', 'graph_mode': 'cutoff', 'cutoff': 0.7818170017857102, 'grm_norm': 'gcn', 'self_loops': False, 'use_snp_selection': False}. Best is trial 2 with value: 0.06660239705815157.
[I 2025-11-03 11:46:36,283] Trial 33 finished with value: 0.053673379043844144 and parameters: {'model_type': 'gcn', 'hidden_dims': '[128, 64]', 'dropout': 0.16546852948045682, 'batch_norm': True, 'lr': 0.0006123968843384499, 'weight_decay': 7.140041448776723e-07, 'epochs': 144, 'loss': 'mse', 'optimizer': 'adam', 'graph_mode': 'cutoff', 'cutoff': 0.8053706837357908, 'grm_norm': 'gcn', 'self_loops': False, 'use_snp_selection': False}. Best is trial 2 with value: 0.06660239705815157.
[I 2025-11-03 11:46:37,886] Trial 34 finished with value: 0.07172418467526817 and parameters: {'model_type': 'gcn', 'hidden_dims': '[128, 64]', 'dropout': 0.2577310256444136, 'batch_norm': True, 'lr': 4.599137427250124e-05, 'weight_decay': 1.0550597050993514e-06, 'epochs': 190, 'loss': 'mse', 'optimizer': 'adam', 'graph_mode': 'cutoff', 'cutoff': 0.46823145727692345, 'grm_norm': 'none', 'self_loops': False, 'use_snp_selection': False}. Best is trial 34 with value: 0.07172418467526817.
[I 2025-11-03 11:46:39,944] Trial 35 finished with value: 0.006651882520028333 and parameters: {'model_type': 'gcn', 'hidden_dims': '[128, 64]', 'dropout': 0.2671251309011736, 'batch_norm': True, 'lr': 5.339813280954715e-05, 'weight_decay': 1.559015131065928e-06, 'epochs': 232, 'loss': 'mae', 'optimizer': 'adam', 'graph_mode': 'cutoff', 'cutoff': 0.43574944568238005, 'grm_norm': 'none', 'self_loops': True, 'use_snp_selection': False}. Best is trial 34 with value: 0.07172418467526817.
[I 2025-11-03 11:46:41,634] Trial 36 finished with value: 0.04226687624299494 and parameters: {'model_type': 'gcn', 'hidden_dims': '[128, 64]', 'dropout': 0.3947432653632936, 'batch_norm': True, 'lr': 0.00019643183324159614, 'weight_decay': 5.437545670957169e-06, 'epochs': 193, 'loss': 'mse', 'optimizer': 'adam', 'graph_mode': 'knn', 'source': 'grm', 'knn_k': 8, 'weighted_edges': True, 'symmetrize_mode': 'union', 'use_snp_selection': False}. Best is trial 34 with value: 0.07172418467526817.
[I 2025-11-03 11:46:42,705] Trial 37 finished with value: 0.03987501447513168 and parameters: {'model_type': 'gcn', 'hidden_dims': '[128, 64]', 'dropout': 0.23550040769447633, 'batch_norm': True, 'lr': 9.405542411030346e-05, 'weight_decay': 9.37337902093991e-07, 'epochs': 30, 'loss': 'mae', 'optimizer': 'adam', 'graph_mode': 'cutoff', 'cutoff': 0.4872278508576648, 'grm_norm': 'none', 'self_loops': False, 'use_snp_selection': False}. Best is trial 34 with value: 0.07172418467526817.
[I 2025-11-03 11:46:45,336] Trial 38 finished with value: 0.0282519696232473 and parameters: {'model_type': 'gcn', 'hidden_dims': '[128, 64]', 'dropout': 0.35857062243551396, 'batch_norm': False, 'lr': 0.0004152324737301467, 'weight_decay': 2.6421877029160402e-06, 'epochs': 341, 'loss': 'mse', 'optimizer': 'adam', 'graph_mode': 'knn', 'source': 'grm', 'knn_k': 5, 'weighted_edges': False, 'symmetrize_mode': 'mutual', 'use_snp_selection': True, 'num_snps': 23306}. Best is trial 34 with value: 0.07172418467526817.
[I 2025-11-03 11:46:47,227] Trial 39 finished with value: 0.06387242103786378 and parameters: {'model_type': 'gcn', 'hidden_dims': '[128, 64]', 'dropout': 0.11011462050063336, 'batch_norm': True, 'lr': 2.4556682592518065e-05, 'weight_decay': 1.6251566301615607e-05, 'epochs': 239, 'loss': 'mse', 'optimizer': 'adam', 'graph_mode': 'cutoff', 'cutoff': 0.6332316573650525, 'grm_norm': 'none', 'self_loops': False, 'use_snp_selection': False}. Best is trial 34 with value: 0.07172418467526817.
[I 2025-11-03 11:46:49,060] Trial 40 finished with value: 0.02373742992071594 and parameters: {'model_type': 'gcn', 'hidden_dims': '[128, 64]', 'dropout': 0.11033036141733715, 'batch_norm': True, 'lr': 2.0327382103495024e-05, 'weight_decay': 1.5386893819405905e-05, 'epochs': 235, 'loss': 'mse', 'optimizer': 'adam', 'graph_mode': 'cutoff', 'cutoff': 0.611867044479472, 'grm_norm': 'none', 'self_loops': False, 'use_snp_selection': False}. Best is trial 34 with value: 0.07172418467526817.
[I 2025-11-03 11:46:50,936] Trial 41 finished with value: 0.04746221071102796 and parameters: {'model_type': 'gcn', 'hidden_dims': '[128, 64]', 'dropout': 0.12293855088458575, 'batch_norm': True, 'lr': 2.968319527837488e-05, 'weight_decay': 3.0506640100248893e-05, 'epochs': 249, 'loss': 'mse', 'optimizer': 'adam', 'graph_mode': 'cutoff', 'cutoff': 0.565445564436432, 'grm_norm': 'none', 'self_loops': False, 'use_snp_selection': False}. Best is trial 34 with value: 0.07172418467526817.
[I 2025-11-03 11:46:52,626] Trial 42 finished with value: 0.03731633892161216 and parameters: {'model_type': 'gcn', 'hidden_dims': '[128, 64]', 'dropout': 0.14384148547648862, 'batch_norm': True, 'lr': 1.156934738130899e-05, 'weight_decay': 8.097503882052776e-06, 'epochs': 193, 'loss': 'mse', 'optimizer': 'adam', 'graph_mode': 'cutoff', 'cutoff': 0.45319072569304175, 'grm_norm': 'none', 'self_loops': False, 'use_snp_selection': False}. Best is trial 34 with value: 0.07172418467526817.
[I 2025-11-03 11:46:54,273] Trial 43 finished with value: 0.03467243634502489 and parameters: {'model_type': 'gcn', 'hidden_dims': '[256, 128]', 'dropout': 0.19940349985147188, 'batch_norm': True, 'lr': 6.458074715462704e-05, 'weight_decay': 1.2073586175265089e-05, 'epochs': 114, 'loss': 'mse', 'optimizer': 'adam', 'graph_mode': 'cutoff', 'cutoff': 0.6284602961907366, 'grm_norm': 'none', 'self_loops': False, 'use_snp_selection': False}. Best is trial 34 with value: 0.07172418467526817.
[I 2025-11-03 11:46:56,971] Trial 44 finished with value: 0.05087940930263513 and parameters: {'model_type': 'gcn', 'hidden_dims': '[128, 64]', 'dropout': 0.4847638626769793, 'batch_norm': False, 'lr': 4.303273517060903e-05, 'weight_decay': 2.230791624727671e-05, 'epochs': 209, 'loss': 'mse', 'optimizer': 'adam', 'graph_mode': 'cutoff', 'cutoff': 0.542723291406424, 'grm_norm': 'none', 'self_loops': False, 'use_snp_selection': True, 'num_snps': 33131}. Best is trial 34 with value: 0.07172418467526817.
[I 2025-11-03 11:46:59,513] Trial 45 finished with value: 0.03537687833577743 and parameters: {'model_type': 'gcn', 'hidden_dims': '[256, 128]', 'dropout': 0.5256621727383005, 'batch_norm': True, 'lr': 2.8430029531200677e-05, 'weight_decay': 2.7667865754117262e-06, 'epochs': 298, 'loss': 'mae', 'optimizer': 'adam', 'graph_mode': 'cutoff', 'cutoff': 0.6724120707468206, 'grm_norm': 'none', 'self_loops': False, 'use_snp_selection': False}. Best is trial 34 with value: 0.07172418467526817.
[I 2025-11-03 11:47:01,667] Trial 46 finished with value: 0.028436277549950675 and parameters: {'model_type': 'gcn', 'hidden_dims': '[128, 64]', 'dropout': 0.5790134855123525, 'batch_norm': False, 'lr': 0.00013039325206721443, 'weight_decay': 0.00015272402021693438, 'epochs': 184, 'loss': 'mse', 'optimizer': 'adam', 'graph_mode': 'knn', 'source': 'grm', 'knn_k': 9, 'weighted_edges': False, 'symmetrize_mode': 'mutual', 'use_snp_selection': True, 'num_snps': 13586}. Best is trial 34 with value: 0.07172418467526817.
[I 2025-11-03 11:47:04,069] Trial 47 finished with value: 0.03631364825289349 and parameters: {'model_type': 'gcn', 'hidden_dims': '[512, 128]', 'dropout': 0.33216498202770556, 'batch_norm': True, 'lr': 1.5716103085847618e-05, 'weight_decay': 0.0006300909061703473, 'epochs': 92, 'loss': 'mse', 'optimizer': 'adam', 'graph_mode': 'cutoff', 'cutoff': 0.386952975051282, 'grm_norm': 'none', 'self_loops': False, 'use_snp_selection': False}. Best is trial 34 with value: 0.07172418467526817.
[I 2025-11-03 11:47:07,183] Trial 48 finished with value: 0.018520028110485053 and parameters: {'model_type': 'gcn', 'hidden_dims': '[128, 64]', 'dropout': 0.2999654008797089, 'batch_norm': False, 'lr': 6.730450803525479e-06, 'weight_decay': 4.577596135738139e-05, 'epochs': 74, 'loss': 'mse', 'optimizer': 'adam', 'graph_mode': 'cutoff', 'cutoff': 0.535452411819491, 'grm_norm': 'cosine', 'self_loops': False, 'use_snp_selection': True, 'num_snps': 59917}. Best is trial 34 with value: 0.07172418467526817.
[I 2025-11-03 11:47:09,612] Trial 49 finished with value: 0.027325024394641403 and parameters: {'model_type': 'gcn', 'hidden_dims': '[256, 128]', 'dropout': 0.4125520245066142, 'batch_norm': False, 'lr': 0.00031127557241793983, 'weight_decay': 4.686660413936733e-06, 'epochs': 161, 'loss': 'mse', 'optimizer': 'adam', 'graph_mode': 'knn', 'source': 'grm', 'knn_k': 3, 'weighted_edges': True, 'symmetrize_mode': 'union', 'use_snp_selection': True, 'num_snps': 30211}. Best is trial 34 with value: 0.07172418467526817.
[I 2025-11-03 11:47:11,055] Trial 50 finished with value: 0.04153739197345249 and parameters: {'model_type': 'gcn', 'hidden_dims': '[128, 64]', 'dropout': 0.2740106847105779, 'batch_norm': True, 'lr': 7.53740748885916e-05, 'weight_decay': 0.00018018809806116706, 'epochs': 133, 'loss': 'mse', 'optimizer': 'adam', 'graph_mode': 'cutoff', 'cutoff': 0.6839438554289948, 'grm_norm': 'cosine_then_gcn', 'self_loops': True, 'use_snp_selection': False}. Best is trial 34 with value: 0.07172418467526817.
[I 2025-11-03 11:47:12,862] Trial 51 finished with value: 0.07825951436508155 and parameters: {'model_type': 'gcn', 'hidden_dims': '[256, 128, 64]', 'dropout': 0.18002550801796807, 'batch_norm': True, 'lr': 4.013261217383638e-05, 'weight_decay': 5.042407658780458e-07, 'epochs': 132, 'loss': 'mse', 'optimizer': 'adam', 'graph_mode': 'cutoff', 'cutoff': 0.7345391682445535, 'grm_norm': 'gcn', 'self_loops': False, 'use_snp_selection': False}. Best is trial 51 with value: 0.07825951436508155.
[I 2025-11-03 11:47:14,725] Trial 52 finished with value: 0.05771445795232252 and parameters: {'model_type': 'gcn', 'hidden_dims': '[256, 128, 64]', 'dropout': 0.1884766102702593, 'batch_norm': True, 'lr': 5.0626064425659475e-05, 'weight_decay': 1.631324805550631e-07, 'epochs': 143, 'loss': 'mse', 'optimizer': 'adam', 'graph_mode': 'cutoff', 'cutoff': 0.72354731773731, 'grm_norm': 'gcn', 'self_loops': False, 'use_snp_selection': False}. Best is trial 51 with value: 0.07825951436508155.
[I 2025-11-03 11:47:16,806] Trial 53 finished with value: 0.05585299617844566 and parameters: {'model_type': 'gcn', 'hidden_dims': '[512, 64]', 'dropout': 0.12990272298969857, 'batch_norm': True, 'lr': 2.1001686537371757e-05, 'weight_decay': 1.2418986552519544e-06, 'epochs': 123, 'loss': 'mse', 'optimizer': 'adam', 'graph_mode': 'cutoff', 'cutoff': 0.7456557503178172, 'grm_norm': 'gcn', 'self_loops': False, 'use_snp_selection': False}. Best is trial 51 with value: 0.07825951436508155.
[I 2025-11-03 11:47:18,403] Trial 54 finished with value: -0.012304375516994502 and parameters: {'model_type': 'gcn', 'hidden_dims': '[256, 128, 64]', 'dropout': 0.14845984743566698, 'batch_norm': True, 'lr': 3.503670622539861e-05, 'weight_decay': 8.541672074441114e-07, 'epochs': 94, 'loss': 'mse', 'optimizer': 'adam', 'graph_mode': 'cutoff', 'cutoff': 0.8211316324386033, 'grm_norm': 'gcn', 'self_loops': False, 'use_snp_selection': False}. Best is trial 51 with value: 0.07825951436508155.
[I 2025-11-03 11:47:21,680] Trial 55 finished with value: 0.05571982913867769 and parameters: {'model_type': 'gcn', 'hidden_dims': '[256, 128]', 'dropout': 0.23043720488696973, 'batch_norm': False, 'lr': 1.122382243306828e-05, 'weight_decay': 2.4681527870104873e-07, 'epochs': 174, 'loss': 'mse', 'optimizer': 'adam', 'graph_mode': 'cutoff', 'cutoff': 0.6389465141725026, 'grm_norm': 'gcn', 'self_loops': False, 'use_snp_selection': True, 'num_snps': 47245}. Best is trial 51 with value: 0.07825951436508155.
[I 2025-11-03 11:47:24,058] Trial 56 finished with value: 0.0312984009402002 and parameters: {'model_type': 'gcn', 'hidden_dims': '[256, 128, 64]', 'dropout': 0.19164755553993928, 'batch_norm': True, 'lr': 2.758974332535543e-05, 'weight_decay': 5.898231820796885e-07, 'epochs': 217, 'loss': 'mse', 'optimizer': 'adam', 'graph_mode': 'cutoff', 'cutoff': 0.8628091610374818, 'grm_norm': 'gcn', 'self_loops': True, 'use_snp_selection': False}. Best is trial 51 with value: 0.07825951436508155.
[I 2025-11-03 11:47:26,043] Trial 57 finished with value: 0.05179160121697676 and parameters: {'model_type': 'gcn', 'hidden_dims': '[512, 128]', 'dropout': 0.5151218785356434, 'batch_norm': False, 'lr': 0.00010850662039074577, 'weight_decay': 2.102428102303191e-06, 'epochs': 61, 'loss': 'mse', 'optimizer': 'adam', 'graph_mode': 'knn', 'source': 'grm', 'knn_k': 6, 'weighted_edges': False, 'symmetrize_mode': 'mutual', 'use_snp_selection': True, 'num_snps': 18843}. Best is trial 51 with value: 0.07825951436508155.
[I 2025-11-03 11:47:28,572] Trial 58 finished with value: 0.051814626744472445 and parameters: {'model_type': 'gcn', 'hidden_dims': '[256, 128, 64]', 'dropout': 0.47992865059250495, 'batch_norm': True, 'lr': 4.050927612335086e-05, 'weight_decay': 1.0704543827043598e-06, 'epochs': 249, 'loss': 'mae', 'optimizer': 'adam', 'graph_mode': 'cutoff', 'cutoff': 0.6997960617431727, 'grm_norm': 'cosine_then_gcn', 'self_loops': False, 'use_snp_selection': False}. Best is trial 51 with value: 0.07825951436508155.
[I 2025-11-03 11:47:31,295] Trial 59 finished with value: 0.0708562842316183 and parameters: {'model_type': 'gcn', 'hidden_dims': '[512, 256]', 'dropout': 0.22225541210370733, 'batch_norm': False, 'lr': 1.989511064015782e-05, 'weight_decay': 0.0009645019046097685, 'epochs': 203, 'loss': 'mse', 'optimizer': 'adam', 'graph_mode': 'cutoff', 'cutoff': 0.3168087641392716, 'grm_norm': 'cosine', 'self_loops': False, 'use_snp_selection': True, 'num_snps': 25000}. Best is trial 51 with value: 0.07825951436508155.
[I 2025-11-03 11:47:34,024] Trial 60 finished with value: 0.05253712152936408 and parameters: {'model_type': 'gcn', 'hidden_dims': '[512, 256]', 'dropout': 0.21696170184674923, 'batch_norm': True, 'lr': 1.8461958485469394e-05, 'weight_decay': 0.0008173786301413673, 'epochs': 199, 'loss': 'mse', 'optimizer': 'adam', 'graph_mode': 'cutoff', 'cutoff': 0.28899154833318286, 'grm_norm': 'cosine', 'self_loops': False, 'use_snp_selection': False}. Best is trial 51 with value: 0.07825951436508155.
[I 2025-11-03 11:47:37,192] Trial 61 finished with value: 0.04385533819437462 and parameters: {'model_type': 'gcn', 'hidden_dims': '[512, 256]', 'dropout': 0.2575522185302595, 'batch_norm': False, 'lr': 1.3677950828387526e-05, 'weight_decay': 0.0003425431760276869, 'epochs': 183, 'loss': 'mse', 'optimizer': 'adam', 'graph_mode': 'cutoff', 'cutoff': 0.321482145967812, 'grm_norm': 'cosine', 'self_loops': False, 'use_snp_selection': True, 'num_snps': 35542}. Best is trial 51 with value: 0.07825951436508155.
[I 2025-11-03 11:47:39,761] Trial 62 finished with value: 0.022942431889717937 and parameters: {'model_type': 'gcn', 'hidden_dims': '[512, 256]', 'dropout': 0.2923041286773129, 'batch_norm': False, 'lr': 9.305821038700621e-06, 'weight_decay': 0.0004259041421129081, 'epochs': 151, 'loss': 'mse', 'optimizer': 'adam', 'graph_mode': 'cutoff', 'cutoff': 0.24020000686064302, 'grm_norm': 'cosine', 'self_loops': False, 'use_snp_selection': True, 'num_snps': 25541}. Best is trial 51 with value: 0.07825951436508155.
[I 2025-11-03 11:47:42,470] Trial 63 finished with value: 0.043011043674243944 and parameters: {'model_type': 'gcn', 'hidden_dims': '[512, 256]', 'dropout': 0.5734007226363481, 'batch_norm': False, 'lr': 2.471840487229752e-05, 'weight_decay': 0.0009342919769985246, 'epochs': 108, 'loss': 'mse', 'optimizer': 'adam', 'graph_mode': 'cutoff', 'cutoff': 0.3782417397799057, 'grm_norm': 'cosine', 'self_loops': False, 'use_snp_selection': True, 'num_snps': 31923}. Best is trial 51 with value: 0.07825951436508155.
[I 2025-11-03 11:47:45,972] Trial 64 finished with value: 0.03509251192530585 and parameters: {'model_type': 'gcn', 'hidden_dims': '[512, 64]', 'dropout': 0.2305218074456789, 'batch_norm': False, 'lr': 5.5423878207059626e-05, 'weight_decay': 0.0002474336532344579, 'epochs': 159, 'loss': 'mse', 'optimizer': 'adam', 'graph_mode': 'cutoff', 'cutoff': 0.509953831002309, 'grm_norm': 'gcn', 'self_loops': False, 'use_snp_selection': True, 'num_snps': 43236}. Best is trial 51 with value: 0.07825951436508155.
[I 2025-11-03 11:47:47,928] Trial 65 finished with value: 0.06939528671845957 and parameters: {'model_type': 'gcn', 'hidden_dims': '[256, 128]', 'dropout': 0.10382131288353537, 'batch_norm': False, 'lr': 3.371413867680569e-05, 'weight_decay': 0.000576977401713455, 'epochs': 229, 'loss': 'mse', 'optimizer': 'adam', 'graph_mode': 'knn', 'source': 'grm', 'knn_k': 2, 'weighted_edges': True, 'symmetrize_mode': 'union', 'use_snp_selection': True, 'num_snps': 9265}. Best is trial 51 with value: 0.07825951436508155.
[I 2025-11-03 11:47:49,788] Trial 66 finished with value: 0.04675489395879111 and parameters: {'model_type': 'gcn', 'hidden_dims': '[256, 128]', 'dropout': 0.10431197809479155, 'batch_norm': False, 'lr': 8.1148350281304e-05, 'weight_decay': 0.0005673658167612815, 'epochs': 228, 'loss': 'mse', 'optimizer': 'adam', 'graph_mode': 'cutoff', 'cutoff': 0.44401203413551993, 'grm_norm': 'none', 'self_loops': True, 'use_snp_selection': True, 'num_snps': 8217}. Best is trial 51 with value: 0.07825951436508155.
