[I 2025-11-03 12:13:08,765] Trial 134 finished with value: 0.15908055156041112 and parameters: {'model_type': 'gcn', 'hidden_dims': '[512, 256]', 'dropout': 0.10589637976939867, 'batch_norm': True, 'lr': 0.0007506030500867863, 'weight_decay': 4.0115485409165396e-05, 'epochs': 136, 'loss': 'mae', 'optimizer': 'adam', 'graph_mode': 'knn', 'source': 'grm', 'knn_k': 1, 'weighted_edges': True, 'symmetrize_mode': 'mutual', 'use_snp_selection': False}. Best is trial 73 with value: 0.17893980951458158.
[I 2025-11-03 12:13:11,997] Trial 135 finished with value: 0.1600473557411768 and parameters: {'model_type': 'gcn', 'hidden_dims': '[512, 256]', 'dropout': 0.10353028730612834, 'batch_norm': True, 'lr': 0.0005753782554878188, 'weight_decay': 8.028511608554365e-05, 'epochs': 148, 'loss': 'mae', 'optimizer': 'adam', 'graph_mode': 'knn', 'source': 'grm', 'knn_k': 1, 'weighted_edges': True, 'symmetrize_mode': 'mutual', 'use_snp_selection': False}. Best is trial 73 with value: 0.17893980951458158.
[I 2025-11-03 12:13:15,490] Trial 136 finished with value: 0.15769250862438153 and parameters: {'model_type': 'gcn', 'hidden_dims': '[512, 256]', 'dropout': 0.11937743484810792, 'batch_norm': True, 'lr': 0.00047122285540917896, 'weight_decay': 4.846477851808517e-05, 'epochs': 159, 'loss': 'mae', 'optimizer': 'adam', 'graph_mode': 'knn', 'source': 'grm', 'knn_k': 1, 'weighted_edges': True, 'symmetrize_mode': 'mutual', 'use_snp_selection': False}. Best is trial 73 with value: 0.17893980951458158.
[I 2025-11-03 12:13:18,637] Trial 137 finished with value: 0.15987273587554218 and parameters: {'model_type': 'gcn', 'hidden_dims': '[512, 256]', 'dropout': 0.11434952732225609, 'batch_norm': True, 'lr': 0.0007750109063255011, 'weight_decay': 5.701476930866936e-05, 'epochs': 130, 'loss': 'mae', 'optimizer': 'adam', 'graph_mode': 'knn', 'source': 'grm', 'knn_k': 1, 'weighted_edges': True, 'symmetrize_mode': 'mutual', 'use_snp_selection': False}. Best is trial 73 with value: 0.17893980951458158.
[I 2025-11-03 12:13:21,906] Trial 138 finished with value: 0.16352628119668544 and parameters: {'model_type': 'gcn', 'hidden_dims': '[512, 256]', 'dropout': 0.1294667954992019, 'batch_norm': True, 'lr': 0.0008613080078249477, 'weight_decay': 6.503309611884597e-05, 'epochs': 139, 'loss': 'mae', 'optimizer': 'adam', 'graph_mode': 'knn', 'source': 'grm', 'knn_k': 1, 'weighted_edges': True, 'symmetrize_mode': 'mutual', 'use_snp_selection': False}. Best is trial 73 with value: 0.17893980951458158.
[I 2025-11-03 12:13:25,017] Trial 139 finished with value: 0.16452278877236795 and parameters: {'model_type': 'gcn', 'hidden_dims': '[512, 256]', 'dropout': 0.10247737137023326, 'batch_norm': True, 'lr': 0.0005181506050474839, 'weight_decay': 8.480391392280771e-05, 'epochs': 127, 'loss': 'mae', 'optimizer': 'adam', 'graph_mode': 'knn', 'source': 'grm', 'knn_k': 1, 'weighted_edges': True, 'symmetrize_mode': 'mutual', 'use_snp_selection': False}. Best is trial 73 with value: 0.17893980951458158.
[I 2025-11-03 12:13:28,164] Trial 140 finished with value: 0.16125782375182998 and parameters: {'model_type': 'gcn', 'hidden_dims': '[512, 256]', 'dropout': 0.1008288197928231, 'batch_norm': True, 'lr': 0.0006540088583063681, 'weight_decay': 9.325439754243415e-05, 'epochs': 127, 'loss': 'mae', 'optimizer': 'adam', 'graph_mode': 'knn', 'source': 'grm', 'knn_k': 1, 'weighted_edges': True, 'symmetrize_mode': 'mutual', 'use_snp_selection': False}. Best is trial 73 with value: 0.17893980951458158.
[I 2025-11-03 12:13:32,182] Trial 141 finished with value: 0.1585156633269945 and parameters: {'model_type': 'gcn', 'hidden_dims': '[512, 256]', 'dropout': 0.13005613328959117, 'batch_norm': True, 'lr': 0.0005143784536114912, 'weight_decay': 0.0009789769291636853, 'epochs': 155, 'loss': 'mae', 'optimizer': 'adam', 'graph_mode': 'knn', 'source': 'grm', 'knn_k': 1, 'weighted_edges': True, 'symmetrize_mode': 'mutual', 'use_snp_selection': False}. Best is trial 73 with value: 0.17893980951458158.
[I 2025-11-03 12:13:35,373] Trial 142 finished with value: 0.16741510702772056 and parameters: {'model_type': 'gcn', 'hidden_dims': '[512, 256]', 'dropout': 0.11017961637695438, 'batch_norm': True, 'lr': 0.00045100609575438136, 'weight_decay': 1.4790778074202965e-05, 'epochs': 136, 'loss': 'mae', 'optimizer': 'adam', 'graph_mode': 'knn', 'source': 'grm', 'knn_k': 1, 'weighted_edges': True, 'symmetrize_mode': 'mutual', 'use_snp_selection': False}. Best is trial 73 with value: 0.17893980951458158.
[I 2025-11-03 12:13:38,646] Trial 143 finished with value: 0.16868494424960928 and parameters: {'model_type': 'gcn', 'hidden_dims': '[512, 256]', 'dropout': 0.11315168107322643, 'batch_norm': True, 'lr': 0.0005914044063085853, 'weight_decay': 1.4390598768169808e-05, 'epochs': 147, 'loss': 'mae', 'optimizer': 'adam', 'graph_mode': 'knn', 'source': 'grm', 'knn_k': 1, 'weighted_edges': True, 'symmetrize_mode': 'mutual', 'use_snp_selection': False}. Best is trial 73 with value: 0.17893980951458158.
[I 2025-11-03 12:13:41,942] Trial 144 finished with value: 0.15708958395024467 and parameters: {'model_type': 'gcn', 'hidden_dims': '[512, 256]', 'dropout': 0.1147540766854931, 'batch_norm': True, 'lr': 0.0006143022077594964, 'weight_decay': 1.5824604253371514e-05, 'epochs': 149, 'loss': 'mae', 'optimizer': 'adam', 'graph_mode': 'knn', 'source': 'grm', 'knn_k': 1, 'weighted_edges': True, 'symmetrize_mode': 'mutual', 'use_snp_selection': False}. Best is trial 73 with value: 0.17893980951458158.
[I 2025-11-03 12:13:45,149] Trial 145 finished with value: 0.17027067409037247 and parameters: {'model_type': 'gcn', 'hidden_dims': '[512, 256]', 'dropout': 0.14147352216207215, 'batch_norm': True, 'lr': 0.00043161515260611236, 'weight_decay': 1.0018027946978971e-05, 'epochs': 142, 'loss': 'mae', 'optimizer': 'adam', 'graph_mode': 'knn', 'source': 'grm', 'knn_k': 1, 'weighted_edges': True, 'symmetrize_mode': 'mutual', 'use_snp_selection': False}. Best is trial 73 with value: 0.17893980951458158.
[I 2025-11-03 12:13:48,316] Trial 146 finished with value: 0.1586885483922168 and parameters: {'model_type': 'gcn', 'hidden_dims': '[512, 256]', 'dropout': 0.14201931065891105, 'batch_norm': True, 'lr': 0.0004150088045318987, 'weight_decay': 6.655566123127297e-06, 'epochs': 139, 'loss': 'mae', 'optimizer': 'adam', 'graph_mode': 'knn', 'source': 'grm', 'knn_k': 1, 'weighted_edges': True, 'symmetrize_mode': 'mutual', 'use_snp_selection': False}. Best is trial 73 with value: 0.17893980951458158.
[I 2025-11-03 12:13:51,419] Trial 147 finished with value: 0.12870598838803565 and parameters: {'model_type': 'gcn', 'hidden_dims': '[512, 256]', 'dropout': 0.1253630091640346, 'batch_norm': True, 'lr': 0.00010820790977779177, 'weight_decay': 1.1134333153625374e-05, 'epochs': 134, 'loss': 'mae', 'optimizer': 'adam', 'graph_mode': 'knn', 'source': 'grm', 'knn_k': 1, 'weighted_edges': True, 'symmetrize_mode': 'mutual', 'use_snp_selection': False}. Best is trial 73 with value: 0.17893980951458158.
[I 2025-11-03 12:13:55,018] Trial 148 finished with value: 0.15279625428657387 and parameters: {'model_type': 'gcn', 'hidden_dims': '[512, 256]', 'dropout': 0.11731581594710665, 'batch_norm': True, 'lr': 0.0004578635648408173, 'weight_decay': 2.6635655197823576e-05, 'epochs': 172, 'loss': 'mae', 'optimizer': 'adam', 'graph_mode': 'knn', 'source': 'grm', 'knn_k': 2, 'weighted_edges': False, 'symmetrize_mode': 'mutual', 'use_snp_selection': False}. Best is trial 73 with value: 0.17893980951458158.
[I 2025-11-03 12:13:58,243] Trial 149 finished with value: 0.16124569122228158 and parameters: {'model_type': 'gcn', 'hidden_dims': '[512, 256]', 'dropout': 0.14761786413886058, 'batch_norm': True, 'lr': 0.0003283893783518058, 'weight_decay': 8.866776335766078e-06, 'epochs': 143, 'loss': 'mae', 'optimizer': 'adam', 'graph_mode': 'knn', 'source': 'grm', 'knn_k': 1, 'weighted_edges': True, 'symmetrize_mode': 'mutual', 'use_snp_selection': False}. Best is trial 73 with value: 0.17893980951458158.
[I 2025-11-03 12:14:00,590] Trial 0 finished with value: -0.006039332202236191 and parameters: {'model_type': 'gcn', 'hidden_dims': '[128, 64]', 'dropout': 0.199031432379812, 'batch_norm': True, 'lr': 1.8408544111075837e-06, 'weight_decay': 5.5136510071208614e-05, 'epochs': 334, 'loss': 'mae', 'optimizer': 'adam', 'graph_mode': 'knn', 'source': 'grm', 'knn_k': 8, 'weighted_edges': True, 'symmetrize_mode': 'mutual', 'use_snp_selection': False}. Best is trial 0 with value: -0.006039332202236191.
[I 2025-11-03 12:14:01,822] Trial 1 finished with value: 0.06100595486730376 and parameters: {'model_type': 'gcn', 'hidden_dims': '[128, 64]', 'dropout': 0.40051947670227217, 'batch_norm': True, 'lr': 0.0005320428882732732, 'weight_decay': 1.89210117736594e-06, 'epochs': 32, 'loss': 'mse', 'optimizer': 'adam', 'graph_mode': 'knn', 'source': 'grm', 'knn_k': 7, 'weighted_edges': True, 'symmetrize_mode': 'union', 'use_snp_selection': False}. Best is trial 1 with value: 0.06100595486730376.
[I 2025-11-03 12:14:04,419] Trial 2 finished with value: 0.07166832598349875 and parameters: {'model_type': 'gcn', 'hidden_dims': '[256, 128]', 'dropout': 0.5105528289184642, 'batch_norm': False, 'lr': 0.0006804279372404962, 'weight_decay': 0.0008922815224257085, 'epochs': 160, 'loss': 'mse', 'optimizer': 'adam', 'graph_mode': 'cutoff', 'cutoff': 0.5741905641612706, 'grm_norm': 'gcn', 'self_loops': False, 'use_snp_selection': True, 'num_snps': 26910}. Best is trial 2 with value: 0.07166832598349875.
[I 2025-11-03 12:14:07,120] Trial 3 finished with value: 0.0638639921750137 and parameters: {'model_type': 'gcn', 'hidden_dims': '[256, 128, 64]', 'dropout': 0.5390483213624292, 'batch_norm': False, 'lr': 3.4705625989073525e-05, 'weight_decay': 2.4623319020131338e-05, 'epochs': 92, 'loss': 'mse', 'optimizer': 'adam', 'graph_mode': 'knn', 'source': 'grm', 'knn_k': 6, 'weighted_edges': False, 'symmetrize_mode': 'mutual', 'use_snp_selection': True, 'num_snps': 30713}. Best is trial 2 with value: 0.07166832598349875.
[I 2025-11-03 12:14:09,826] Trial 4 finished with value: 0.008256081580038566 and parameters: {'model_type': 'gcn', 'hidden_dims': '[128, 64]', 'dropout': 0.13404863676897502, 'batch_norm': False, 'lr': 0.0001431556295367288, 'weight_decay': 2.2084517750726675e-05, 'epochs': 13, 'loss': 'mae', 'optimizer': 'adam', 'graph_mode': 'cutoff', 'cutoff': 0.6714268476993044, 'grm_norm': 'none', 'self_loops': False, 'use_snp_selection': True, 'num_snps': 45645}. Best is trial 2 with value: 0.07166832598349875.
[I 2025-11-03 12:14:13,063] Trial 5 finished with value: 0.06688497638758578 and parameters: {'model_type': 'gcn', 'hidden_dims': '[256, 128]', 'dropout': 0.42253606323412096, 'batch_norm': False, 'lr': 4.238630400638805e-05, 'weight_decay': 8.074086040046576e-07, 'epochs': 134, 'loss': 'mae', 'optimizer': 'adam', 'graph_mode': 'knn', 'source': 'grm', 'knn_k': 1, 'weighted_edges': False, 'symmetrize_mode': 'mutual', 'use_snp_selection': True, 'num_snps': 43113}. Best is trial 2 with value: 0.07166832598349875.
[I 2025-11-03 12:14:16,060] Trial 6 finished with value: 0.08723560068532542 and parameters: {'model_type': 'gcn', 'hidden_dims': '[512, 256]', 'dropout': 0.3534893146320237, 'batch_norm': True, 'lr': 0.000251307964226932, 'weight_decay': 1.821819791794022e-05, 'epochs': 207, 'loss': 'mae', 'optimizer': 'adam', 'graph_mode': 'knn', 'source': 'grm', 'knn_k': 1, 'weighted_edges': True, 'symmetrize_mode': 'mutual', 'use_snp_selection': False}. Best is trial 6 with value: 0.08723560068532542.
[I 2025-11-03 12:14:18,686] Trial 7 finished with value: 0.05627368190298064 and parameters: {'model_type': 'gcn', 'hidden_dims': '[512, 256]', 'dropout': 0.1105825955860775, 'batch_norm': True, 'lr': 2.374338412754043e-05, 'weight_decay': 1.1284721123340274e-05, 'epochs': 170, 'loss': 'mse', 'optimizer': 'adam', 'graph_mode': 'cutoff', 'cutoff': 0.719872204109604, 'grm_norm': 'gcn', 'self_loops': False, 'use_snp_selection': False}. Best is trial 6 with value: 0.08723560068532542.
[I 2025-11-03 12:14:20,724] Trial 8 finished with value: 0.08011115535850676 and parameters: {'model_type': 'gcn', 'hidden_dims': '[512, 128]', 'dropout': 0.5066580418354021, 'batch_norm': True, 'lr': 0.00039213678276659976, 'weight_decay': 3.43655320802934e-06, 'epochs': 91, 'loss': 'mse', 'optimizer': 'adam', 'graph_mode': 'cutoff', 'cutoff': 0.34923059576505366, 'grm_norm': 'cosine', 'self_loops': True, 'use_snp_selection': False}. Best is trial 6 with value: 0.08723560068532542.
[I 2025-11-03 12:14:22,709] Trial 9 finished with value: 0.04514392969275029 and parameters: {'model_type': 'gcn', 'hidden_dims': '[512, 256]', 'dropout': 0.301734920240333, 'batch_norm': False, 'lr': 6.650961854953448e-06, 'weight_decay': 6.861575656590315e-05, 'epochs': 125, 'loss': 'mae', 'optimizer': 'adam', 'graph_mode': 'cutoff', 'cutoff': 0.2857569870061939, 'grm_norm': 'cosine_then_gcn', 'self_loops': False, 'use_snp_selection': True, 'num_snps': 12722}. Best is trial 6 with value: 0.08723560068532542.
[I 2025-11-03 12:14:26,118] Trial 10 finished with value: 0.09489977737476733 and parameters: {'model_type': 'gcn', 'hidden_dims': '[512, 64]', 'dropout': 0.2833599465317005, 'batch_norm': True, 'lr': 0.00016916760584270694, 'weight_decay': 1.7866650996308468e-07, 'epochs': 266, 'loss': 'mae', 'optimizer': 'adam', 'graph_mode': 'knn', 'source': 'grm', 'knn_k': 1, 'weighted_edges': True, 'symmetrize_mode': 'union', 'use_snp_selection': False}. Best is trial 10 with value: 0.09489977737476733.
[I 2025-11-03 12:14:29,525] Trial 11 finished with value: 0.09474535808048927 and parameters: {'model_type': 'gcn', 'hidden_dims': '[512, 64]', 'dropout': 0.2859699507705008, 'batch_norm': True, 'lr': 0.00012623783700890367, 'weight_decay': 1.6805209943987688e-07, 'epochs': 265, 'loss': 'mae', 'optimizer': 'adam', 'graph_mode': 'knn', 'source': 'grm', 'knn_k': 1, 'weighted_edges': True, 'symmetrize_mode': 'union', 'use_snp_selection': False}. Best is trial 10 with value: 0.09489977737476733.
[I 2025-11-03 12:14:32,980] Trial 12 finished with value: 0.07845450626612875 and parameters: {'model_type': 'gcn', 'hidden_dims': '[512, 64]', 'dropout': 0.26266132038870743, 'batch_norm': True, 'lr': 9.336280153487897e-05, 'weight_decay': 1.0551808429767219e-07, 'epochs': 270, 'loss': 'mae', 'optimizer': 'adam', 'graph_mode': 'knn', 'source': 'grm', 'knn_k': 3, 'weighted_edges': True, 'symmetrize_mode': 'union', 'use_snp_selection': False}. Best is trial 10 with value: 0.09489977737476733.
[I 2025-11-03 12:14:36,311] Trial 13 finished with value: 0.0838115253286535 and parameters: {'model_type': 'gcn', 'hidden_dims': '[512, 64]', 'dropout': 0.2687736708759205, 'batch_norm': True, 'lr': 8.732942663241711e-05, 'weight_decay': 1.1697174867672891e-07, 'epochs': 251, 'loss': 'mae', 'optimizer': 'adam', 'graph_mode': 'knn', 'source': 'grm', 'knn_k': 4, 'weighted_edges': True, 'symmetrize_mode': 'union', 'use_snp_selection': False}. Best is trial 10 with value: 0.09489977737476733.
[I 2025-11-03 12:14:40,364] Trial 14 finished with value: 0.027975607097402353 and parameters: {'model_type': 'gcn', 'hidden_dims': '[512, 64]', 'dropout': 0.19696847261698813, 'batch_norm': True, 'lr': 1.2586985041154999e-05, 'weight_decay': 3.8054513427732407e-07, 'epochs': 349, 'loss': 'mae', 'optimizer': 'adam', 'graph_mode': 'knn', 'source': 'grm', 'knn_k': 3, 'weighted_edges': True, 'symmetrize_mode': 'union', 'use_snp_selection': False}. Best is trial 10 with value: 0.09489977737476733.
[I 2025-11-03 12:14:43,895] Trial 15 finished with value: 0.10244797408842266 and parameters: {'model_type': 'gcn', 'hidden_dims': '[512, 64]', 'dropout': 0.32182199730807426, 'batch_norm': True, 'lr': 0.00016454300965981406, 'weight_decay': 4.3750989597912334e-07, 'epochs': 282, 'loss': 'mae', 'optimizer': 'adam', 'graph_mode': 'knn', 'source': 'grm', 'knn_k': 1, 'weighted_edges': True, 'symmetrize_mode': 'union', 'use_snp_selection': False}. Best is trial 15 with value: 0.10244797408842266.
[I 2025-11-03 12:14:47,692] Trial 16 finished with value: 0.06320804454587965 and parameters: {'model_type': 'gcn', 'hidden_dims': '[512, 64]', 'dropout': 0.3912763499396328, 'batch_norm': True, 'lr': 0.00022175979579337865, 'weight_decay': 6.858520331233435e-07, 'epochs': 310, 'loss': 'mae', 'optimizer': 'adam', 'graph_mode': 'knn', 'source': 'grm', 'knn_k': 10, 'weighted_edges': False, 'symmetrize_mode': 'union', 'use_snp_selection': False}. Best is trial 15 with value: 0.10244797408842266.
[I 2025-11-03 12:14:50,757] Trial 17 finished with value: 0.09172071120777703 and parameters: {'model_type': 'gcn', 'hidden_dims': '[512, 128]', 'dropout': 0.4645710388519043, 'batch_norm': True, 'lr': 5.4748967857163485e-05, 'weight_decay': 3.107383290096833e-06, 'epochs': 218, 'loss': 'mae', 'optimizer': 'adam', 'graph_mode': 'knn', 'source': 'grm', 'knn_k': 3, 'weighted_edges': True, 'symmetrize_mode': 'union', 'use_snp_selection': False}. Best is trial 15 with value: 0.10244797408842266.
[I 2025-11-03 12:14:53,865] Trial 18 finished with value: 0.07579829214400678 and parameters: {'model_type': 'gcn', 'hidden_dims': '[256, 128, 64]', 'dropout': 0.2041578063809699, 'batch_norm': True, 'lr': 0.0009438285356975068, 'weight_decay': 3.293863322548928e-07, 'epochs': 296, 'loss': 'mae', 'optimizer': 'adam', 'graph_mode': 'knn', 'source': 'grm', 'knn_k': 5, 'weighted_edges': True, 'symmetrize_mode': 'union', 'use_snp_selection': False}. Best is trial 15 with value: 0.10244797408842266.
[I 2025-11-03 12:14:57,016] Trial 19 finished with value: 0.08778383982517882 and parameters: {'model_type': 'gcn', 'hidden_dims': '[512, 64]', 'dropout': 0.34106987726006266, 'batch_norm': True, 'lr': 0.000264786797546097, 'weight_decay': 9.459696819638983e-07, 'epochs': 231, 'loss': 'mae', 'optimizer': 'adam', 'graph_mode': 'knn', 'source': 'grm', 'knn_k': 2, 'weighted_edges': True, 'symmetrize_mode': 'union', 'use_snp_selection': False}. Best is trial 15 with value: 0.10244797408842266.
[I 2025-11-03 12:15:00,722] Trial 20 finished with value: 0.06109018045451157 and parameters: {'model_type': 'gcn', 'hidden_dims': '[512, 64]', 'dropout': 0.5741974551696398, 'batch_norm': True, 'lr': 1.6139243140872594e-05, 'weight_decay': 0.0006285794524056533, 'epochs': 304, 'loss': 'mae', 'optimizer': 'adam', 'graph_mode': 'knn', 'source': 'grm', 'knn_k': 2, 'weighted_edges': False, 'symmetrize_mode': 'union', 'use_snp_selection': False}. Best is trial 15 with value: 0.10244797408842266.
[I 2025-11-03 12:15:04,166] Trial 21 finished with value: 0.09964292797608054 and parameters: {'model_type': 'gcn', 'hidden_dims': '[512, 64]', 'dropout': 0.3071086639429785, 'batch_norm': True, 'lr': 0.00011930311119171508, 'weight_decay': 2.648419205762322e-07, 'epochs': 270, 'loss': 'mae', 'optimizer': 'adam', 'graph_mode': 'knn', 'source': 'grm', 'knn_k': 1, 'weighted_edges': True, 'symmetrize_mode': 'union', 'use_snp_selection': False}. Best is trial 15 with value: 0.10244797408842266.
[I 2025-11-03 12:15:07,697] Trial 22 finished with value: 0.07228444637954373 and parameters: {'model_type': 'gcn', 'hidden_dims': '[512, 64]', 'dropout': 0.3368003616891646, 'batch_norm': True, 'lr': 6.765556423118847e-05, 'weight_decay': 2.684874134136915e-07, 'epochs': 282, 'loss': 'mae', 'optimizer': 'adam', 'graph_mode': 'knn', 'source': 'grm', 'knn_k': 1, 'weighted_edges': True, 'symmetrize_mode': 'union', 'use_snp_selection': False}. Best is trial 15 with value: 0.10244797408842266.
[I 2025-11-03 12:15:10,593] Trial 23 finished with value: 0.08607168585237397 and parameters: {'model_type': 'gcn', 'hidden_dims': '[512, 64]', 'dropout': 0.25320859782783744, 'batch_norm': True, 'lr': 0.00014225168590649233, 'weight_decay': 1.3549309827600186e-06, 'epochs': 197, 'loss': 'mae', 'optimizer': 'adam', 'graph_mode': 'knn', 'source': 'grm', 'knn_k': 2, 'weighted_edges': True, 'symmetrize_mode': 'union', 'use_snp_selection': False}. Best is trial 15 with value: 0.10244797408842266.
[I 2025-11-03 12:15:13,781] Trial 24 finished with value: 0.072735266679415 and parameters: {'model_type': 'gcn', 'hidden_dims': '[512, 64]', 'dropout': 0.23038698260721321, 'batch_norm': True, 'lr': 0.0003440845428106276, 'weight_decay': 4.3799120296010357e-07, 'epochs': 234, 'loss': 'mae', 'optimizer': 'adam', 'graph_mode': 'knn', 'source': 'grm', 'knn_k': 4, 'weighted_edges': True, 'symmetrize_mode': 'union', 'use_snp_selection': False}. Best is trial 15 with value: 0.10244797408842266.
[I 2025-11-03 12:15:17,537] Trial 25 finished with value: 0.09199742091189327 and parameters: {'model_type': 'gcn', 'hidden_dims': '[512, 64]', 'dropout': 0.32090019517021157, 'batch_norm': True, 'lr': 0.00016898200089181435, 'weight_decay': 2.173446953716572e-07, 'epochs': 311, 'loss': 'mae', 'optimizer': 'adam', 'graph_mode': 'knn', 'source': 'grm', 'knn_k': 2, 'weighted_edges': True, 'symmetrize_mode': 'union', 'use_snp_selection': False}. Best is trial 15 with value: 0.10244797408842266.
[I 2025-11-03 12:15:22,715] Trial 26 finished with value: 0.03081526832634193 and parameters: {'model_type': 'gcn', 'hidden_dims': '[512, 128]', 'dropout': 0.38499891575823997, 'batch_norm': False, 'lr': 1.2153807314991247e-06, 'weight_decay': 2.805240050341891e-06, 'epochs': 254, 'loss': 'mae', 'optimizer': 'adam', 'graph_mode': 'cutoff', 'cutoff': 0.8765009073803762, 'grm_norm': 'none', 'self_loops': True, 'use_snp_selection': True, 'num_snps': 59005}. Best is trial 15 with value: 0.10244797408842266.
[I 2025-11-03 12:15:24,921] Trial 27 finished with value: 0.07187285739255554 and parameters: {'model_type': 'gcn', 'hidden_dims': '[256, 128]', 'dropout': 0.4440172934506005, 'batch_norm': True, 'lr': 7.392619867157295e-05, 'weight_decay': 5.8197193193014716e-06, 'epochs': 187, 'loss': 'mse', 'optimizer': 'adam', 'graph_mode': 'knn', 'source': 'grm', 'knn_k': 4, 'weighted_edges': True, 'symmetrize_mode': 'union', 'use_snp_selection': False}. Best is trial 15 with value: 0.10244797408842266.
