[I 2025-11-03 11:56:13,164] Trial 66 finished with value: 0.055216491111860666 and parameters: {'model_type': 'graphsage', 'hidden_dims': '[512, 128]', 'dropout': 0.20463242849747812, 'batch_norm': False, 'lr': 1.078271423752842e-05, 'weight_decay': 0.00016549365293218747, 'epochs': 299, 'loss': 'mae', 'optimizer': 'adam', 'graph_mode': 'cutoff', 'cutoff': 0.7966553670127859, 'grm_norm': 'cosine', 'self_loops': False, 'use_snp_selection': True, 'num_snps': 33658}. Best is trial 30 with value: 0.06815677138062187.
[I 2025-11-03 11:56:16,358] Trial 67 finished with value: 0.059438671469205485 and parameters: {'model_type': 'graphsage', 'hidden_dims': '[512, 128]', 'dropout': 0.2968841057325859, 'batch_norm': False, 'lr': 5.227770826397412e-06, 'weight_decay': 8.7233672113116e-05, 'epochs': 169, 'loss': 'mae', 'optimizer': 'adam', 'graph_mode': 'cutoff', 'cutoff': 0.747328816622319, 'grm_norm': 'cosine', 'self_loops': True, 'use_snp_selection': True, 'num_snps': 26400}. Best is trial 30 with value: 0.06815677138062187.
[I 2025-11-03 11:56:20,515] Trial 68 finished with value: 0.07406577063682357 and parameters: {'model_type': 'graphsage', 'hidden_dims': '[512, 128]', 'dropout': 0.24696649745466445, 'batch_norm': False, 'lr': 2.1250303743222497e-05, 'weight_decay': 0.00019826233896827857, 'epochs': 278, 'loss': 'mae', 'optimizer': 'adam', 'graph_mode': 'cutoff', 'cutoff': 0.7035075687010208, 'grm_norm': 'cosine', 'self_loops': False, 'use_snp_selection': True, 'num_snps': 31506}. Best is trial 68 with value: 0.07406577063682357.
[I 2025-11-03 11:56:24,776] Trial 69 finished with value: 0.04731793294340388 and parameters: {'model_type': 'graphsage', 'hidden_dims': '[512, 128]', 'dropout': 0.3280375601451012, 'batch_norm': False, 'lr': 1.3127459186093896e-05, 'weight_decay': 0.00020428187771217822, 'epochs': 291, 'loss': 'mae', 'optimizer': 'adam', 'graph_mode': 'cutoff', 'cutoff': 0.7129205418147334, 'grm_norm': 'cosine', 'self_loops': False, 'use_snp_selection': True, 'num_snps': 31628}. Best is trial 68 with value: 0.07406577063682357.
[I 2025-11-03 11:56:28,169] Trial 70 finished with value: 0.05538835303968621 and parameters: {'model_type': 'graphsage', 'hidden_dims': '[512, 128]', 'dropout': 0.24223889888053707, 'batch_norm': False, 'lr': 6.9425491133737615e-06, 'weight_decay': 0.0002949973717150924, 'epochs': 277, 'loss': 'mae', 'optimizer': 'adam', 'graph_mode': 'cutoff', 'cutoff': 0.7684678438570184, 'grm_norm': 'cosine', 'self_loops': False, 'use_snp_selection': True, 'num_snps': 23048}. Best is trial 68 with value: 0.07406577063682357.
[I 2025-11-03 11:56:31,900] Trial 71 finished with value: 0.04491726044278651 and parameters: {'model_type': 'graphsage', 'hidden_dims': '[512, 128]', 'dropout': 0.21475313380465255, 'batch_norm': False, 'lr': 2.33822437714315e-05, 'weight_decay': 0.00010472908763573043, 'epochs': 259, 'loss': 'mae', 'optimizer': 'adam', 'graph_mode': 'cutoff', 'cutoff': 0.6889540383904534, 'grm_norm': 'cosine', 'self_loops': False, 'use_snp_selection': True, 'num_snps': 27965}. Best is trial 68 with value: 0.07406577063682357.
[I 2025-11-03 11:56:36,677] Trial 72 finished with value: 0.038696982991862784 and parameters: {'model_type': 'graphsage', 'hidden_dims': '[512, 128]', 'dropout': 0.18317897792029794, 'batch_norm': False, 'lr': 2.4244940658352357e-06, 'weight_decay': 0.0004881480973676732, 'epochs': 308, 'loss': 'mae', 'optimizer': 'adam', 'graph_mode': 'cutoff', 'cutoff': 0.7350386055422479, 'grm_norm': 'cosine', 'self_loops': False, 'use_snp_selection': True, 'num_snps': 36076}. Best is trial 68 with value: 0.07406577063682357.
[I 2025-11-03 11:56:40,689] Trial 73 finished with value: 0.04260646066946882 and parameters: {'model_type': 'graphsage', 'hidden_dims': '[512, 128]', 'dropout': 0.35939428111526767, 'batch_norm': False, 'lr': 2.007267045156814e-05, 'weight_decay': 0.00014358668203882813, 'epochs': 238, 'loss': 'mae', 'optimizer': 'adam', 'graph_mode': 'cutoff', 'cutoff': 0.23992122036945496, 'grm_norm': 'cosine', 'self_loops': False, 'use_snp_selection': True, 'num_snps': 30397}. Best is trial 68 with value: 0.07406577063682357.
[I 2025-11-03 11:56:46,087] Trial 74 finished with value: 0.03789202745438309 and parameters: {'model_type': 'graphsage', 'hidden_dims': '[512, 128]', 'dropout': 0.23443245553914496, 'batch_norm': False, 'lr': 1.6689684896596772e-05, 'weight_decay': 0.00021611957395434734, 'epochs': 321, 'loss': 'mae', 'optimizer': 'adam', 'graph_mode': 'knn', 'source': 'grm', 'knn_k': 7, 'weighted_edges': False, 'symmetrize_mode': 'union', 'use_snp_selection': True, 'num_snps': 34962}. Best is trial 68 with value: 0.07406577063682357.
[I 2025-11-03 11:56:50,221] Trial 75 finished with value: 0.052714881259180606 and parameters: {'model_type': 'graphsage', 'hidden_dims': '[512, 128]', 'dropout': 0.2641858780391394, 'batch_norm': True, 'lr': 2.973728225191215e-05, 'weight_decay': 0.000361015859920696, 'epochs': 185, 'loss': 'mae', 'optimizer': 'adam', 'graph_mode': 'cutoff', 'cutoff': 0.7835006798055304, 'grm_norm': 'cosine_then_gcn', 'self_loops': False, 'use_snp_selection': False}. Best is trial 68 with value: 0.07406577063682357.
[I 2025-11-03 11:56:52,360] Trial 76 finished with value: 0.026399790113532676 and parameters: {'model_type': 'graphsage', 'hidden_dims': '[256, 128]', 'dropout': 0.30286582996692674, 'batch_norm': False, 'lr': 8.445626848481059e-06, 'weight_decay': 6.98932550778299e-05, 'epochs': 287, 'loss': 'mse', 'optimizer': 'adam', 'graph_mode': 'cutoff', 'cutoff': 0.5807503372850766, 'grm_norm': 'cosine', 'self_loops': False, 'use_snp_selection': True, 'num_snps': 3857}. Best is trial 68 with value: 0.07406577063682357.
[I 2025-11-03 11:56:55,185] Trial 77 finished with value: 0.04972326770603172 and parameters: {'model_type': 'graphsage', 'hidden_dims': '[512, 128]', 'dropout': 0.19706595835864937, 'batch_norm': False, 'lr': 1.5727948184488362e-06, 'weight_decay': 0.00027010186283369644, 'epochs': 198, 'loss': 'mae', 'optimizer': 'adam', 'graph_mode': 'knn', 'source': 'grm', 'knn_k': 3, 'weighted_edges': False, 'symmetrize_mode': 'union', 'use_snp_selection': True, 'num_snps': 18396}. Best is trial 68 with value: 0.07406577063682357.
[I 2025-11-03 11:56:58,132] Trial 78 finished with value: 0.03870078849295604 and parameters: {'model_type': 'graphsage', 'hidden_dims': '[256, 128, 64]', 'dropout': 0.2822229424243138, 'batch_norm': True, 'lr': 3.775376551342716e-05, 'weight_decay': 0.00043093717480439773, 'epochs': 241, 'loss': 'mse', 'optimizer': 'adam', 'graph_mode': 'cutoff', 'cutoff': 0.8217931021200049, 'grm_norm': 'cosine', 'self_loops': False, 'use_snp_selection': False}. Best is trial 68 with value: 0.07406577063682357.
[I 2025-11-03 11:57:01,692] Trial 79 finished with value: 0.053305286154017674 and parameters: {'model_type': 'graphsage', 'hidden_dims': '[512, 256]', 'dropout': 0.24695905354111866, 'batch_norm': False, 'lr': 2.1271163885289014e-06, 'weight_decay': 0.00012641374875624678, 'epochs': 155, 'loss': 'mae', 'optimizer': 'adam', 'graph_mode': 'knn', 'source': 'grm', 'knn_k': 2, 'weighted_edges': False, 'symmetrize_mode': 'union', 'use_snp_selection': True, 'num_snps': 31747}. Best is trial 68 with value: 0.07406577063682357.
[I 2025-11-03 11:57:06,219] Trial 80 finished with value: 0.028923316951036535 and parameters: {'model_type': 'graphsage', 'hidden_dims': '[512, 128]', 'dropout': 0.16084691430047277, 'batch_norm': True, 'lr': 4.973694901946755e-06, 'weight_decay': 0.0001775031482046411, 'epochs': 221, 'loss': 'mse', 'optimizer': 'adam', 'graph_mode': 'cutoff', 'cutoff': 0.63626443886903, 'grm_norm': 'cosine_then_gcn', 'self_loops': True, 'use_snp_selection': False}. Best is trial 68 with value: 0.07406577063682357.
[I 2025-11-03 11:57:12,716] Trial 81 finished with value: 0.0363249953113481 and parameters: {'model_type': 'graphsage', 'hidden_dims': '[512, 64]', 'dropout': 0.23177207394374358, 'batch_norm': False, 'lr': 5.783797581787359e-05, 'weight_decay': 0.0006910227441203984, 'epochs': 338, 'loss': 'mae', 'optimizer': 'adam', 'graph_mode': 'cutoff', 'cutoff': 0.6596939182005319, 'grm_norm': 'cosine', 'self_loops': False, 'use_snp_selection': True, 'num_snps': 51764}. Best is trial 68 with value: 0.07406577063682357.
[I 2025-11-03 11:57:17,795] Trial 82 finished with value: 0.050862467458527315 and parameters: {'model_type': 'graphsage', 'hidden_dims': '[512, 64]', 'dropout': 0.21340495465987683, 'batch_norm': False, 'lr': 1.322602121333102e-06, 'weight_decay': 0.0008509636782993679, 'epochs': 306, 'loss': 'mae', 'optimizer': 'adam', 'graph_mode': 'cutoff', 'cutoff': 0.6870352749255966, 'grm_norm': 'cosine', 'self_loops': False, 'use_snp_selection': True, 'num_snps': 39679}. Best is trial 68 with value: 0.07406577063682357.
[I 2025-11-03 11:57:24,376] Trial 83 finished with value: 0.05987269312656364 and parameters: {'model_type': 'graphsage', 'hidden_dims': '[512, 64]', 'dropout': 0.1635818645103248, 'batch_norm': False, 'lr': 1.9168393215741106e-05, 'weight_decay': 0.0003177260542798922, 'epochs': 293, 'loss': 'mae', 'optimizer': 'adam', 'graph_mode': 'cutoff', 'cutoff': 0.7385308577965883, 'grm_norm': 'cosine_then_gcn', 'self_loops': False, 'use_snp_selection': True, 'num_snps': 56814}. Best is trial 68 with value: 0.07406577063682357.
[I 2025-11-03 11:57:29,675] Trial 84 finished with value: 0.04543440819949669 and parameters: {'model_type': 'graphsage', 'hidden_dims': '[512, 64]', 'dropout': 0.1804119897305555, 'batch_norm': False, 'lr': 1.3770681143056736e-05, 'weight_decay': 0.0003300258107142541, 'epochs': 165, 'loss': 'mae', 'optimizer': 'adam', 'graph_mode': 'cutoff', 'cutoff': 0.7234702062762843, 'grm_norm': 'cosine_then_gcn', 'self_loops': False, 'use_snp_selection': True, 'num_snps': 56465}. Best is trial 68 with value: 0.07406577063682357.
[I 2025-11-03 11:57:36,192] Trial 85 finished with value: 0.06275488307954355 and parameters: {'model_type': 'graphsage', 'hidden_dims': '[512, 64]', 'dropout': 0.20351981524243895, 'batch_norm': False, 'lr': 1.968173036752064e-05, 'weight_decay': 0.00023759019485348074, 'epochs': 277, 'loss': 'mae', 'optimizer': 'adam', 'graph_mode': 'cutoff', 'cutoff': 0.7513350793507173, 'grm_norm': 'cosine_then_gcn', 'self_loops': False, 'use_snp_selection': True, 'num_snps': 58024}. Best is trial 68 with value: 0.07406577063682357.
[I 2025-11-03 11:57:42,833] Trial 86 finished with value: 0.061214191075083316 and parameters: {'model_type': 'graphsage', 'hidden_dims': '[512, 64]', 'dropout': 0.27381233220867185, 'batch_norm': False, 'lr': 1.8958863332928558e-05, 'weight_decay': 0.0002376776847008926, 'epochs': 294, 'loss': 'mae', 'optimizer': 'adam', 'graph_mode': 'cutoff', 'cutoff': 0.743499178324707, 'grm_norm': 'cosine_then_gcn', 'self_loops': False, 'use_snp_selection': True, 'num_snps': 58126}. Best is trial 68 with value: 0.07406577063682357.
[I 2025-11-03 11:57:49,380] Trial 87 finished with value: 0.050995511271947555 and parameters: {'model_type': 'graphsage', 'hidden_dims': '[512, 128]', 'dropout': 0.2737587239904312, 'batch_norm': False, 'lr': 2.894656754805498e-05, 'weight_decay': 0.00020527872671000387, 'epochs': 279, 'loss': 'mae', 'optimizer': 'adam', 'graph_mode': 'cutoff', 'cutoff': 0.7596341394966701, 'grm_norm': 'cosine_then_gcn', 'self_loops': False, 'use_snp_selection': True, 'num_snps': 58450}. Best is trial 68 with value: 0.07406577063682357.
[I 2025-11-03 11:57:53,698] Trial 88 finished with value: 0.06645839754742375 and parameters: {'model_type': 'graphsage', 'hidden_dims': '[256, 128]', 'dropout': 0.30230042225432363, 'batch_norm': False, 'lr': 2.6311645306335985e-05, 'weight_decay': 0.0004973480925738964, 'epochs': 268, 'loss': 'mae', 'optimizer': 'adam', 'graph_mode': 'cutoff', 'cutoff': 0.7946237044173028, 'grm_norm': 'cosine_then_gcn', 'self_loops': False, 'use_snp_selection': True, 'num_snps': 51353}. Best is trial 68 with value: 0.07406577063682357.
[I 2025-11-03 11:57:58,048] Trial 89 finished with value: 0.06974354360885224 and parameters: {'model_type': 'graphsage', 'hidden_dims': '[256, 128]', 'dropout': 0.36581271146638916, 'batch_norm': False, 'lr': 9.873987672774421e-06, 'weight_decay': 0.0005273991732320921, 'epochs': 266, 'loss': 'mae', 'optimizer': 'adam', 'graph_mode': 'cutoff', 'cutoff': 0.7935418566588277, 'grm_norm': 'cosine_then_gcn', 'self_loops': False, 'use_snp_selection': True, 'num_snps': 51510}. Best is trial 68 with value: 0.07406577063682357.
[I 2025-11-03 11:58:02,319] Trial 90 finished with value: 0.0455598027984245 and parameters: {'model_type': 'graphsage', 'hidden_dims': '[256, 128]', 'dropout': 0.3857823646296286, 'batch_norm': False, 'lr': 1.0796688903703085e-05, 'weight_decay': 0.0005190055241522661, 'epochs': 256, 'loss': 'mae', 'optimizer': 'adam', 'graph_mode': 'cutoff', 'cutoff': 0.8112286803410906, 'grm_norm': 'cosine_then_gcn', 'self_loops': False, 'use_snp_selection': True, 'num_snps': 51651}. Best is trial 68 with value: 0.07406577063682357.
[I 2025-11-03 11:58:06,589] Trial 91 finished with value: 0.04265097040580679 and parameters: {'model_type': 'graphsage', 'hidden_dims': '[256, 128]', 'dropout': 0.3562196228105368, 'batch_norm': False, 'lr': 7.177916368019114e-06, 'weight_decay': 0.00042253629024198387, 'epochs': 269, 'loss': 'mae', 'optimizer': 'adam', 'graph_mode': 'cutoff', 'cutoff': 0.8385171643287586, 'grm_norm': 'cosine_then_gcn', 'self_loops': False, 'use_snp_selection': True, 'num_snps': 49990}. Best is trial 68 with value: 0.07406577063682357.
[I 2025-11-03 11:58:11,121] Trial 92 finished with value: 0.02604955116907661 and parameters: {'model_type': 'graphsage', 'hidden_dims': '[256, 128]', 'dropout': 0.4119061537811314, 'batch_norm': False, 'lr': 1.2632446188893803e-05, 'weight_decay': 0.0005979369267750034, 'epochs': 264, 'loss': 'mae', 'optimizer': 'adam', 'graph_mode': 'cutoff', 'cutoff': 0.7923279426641622, 'grm_norm': 'cosine_then_gcn', 'self_loops': False, 'use_snp_selection': True, 'num_snps': 55081}. Best is trial 68 with value: 0.07406577063682357.
[I 2025-11-03 11:58:15,053] Trial 93 finished with value: 0.035909304307455855 and parameters: {'model_type': 'graphsage', 'hidden_dims': '[256, 128]', 'dropout': 0.33897641872848083, 'batch_norm': False, 'lr': 2.703779315239676e-05, 'weight_decay': 5.121767177165202e-07, 'epochs': 248, 'loss': 'mae', 'optimizer': 'adam', 'graph_mode': 'cutoff', 'cutoff': 0.7034655557460369, 'grm_norm': 'cosine_then_gcn', 'self_loops': False, 'use_snp_selection': True, 'num_snps': 45928}. Best is trial 68 with value: 0.07406577063682357.
[I 2025-11-03 11:58:19,547] Trial 94 finished with value: 0.06449704335250704 and parameters: {'model_type': 'graphsage', 'hidden_dims': '[256, 128]', 'dropout': 0.32346542656966554, 'batch_norm': False, 'lr': 8.524478444828445e-06, 'weight_decay': 0.00028921494505089956, 'epochs': 282, 'loss': 'mae', 'optimizer': 'adam', 'graph_mode': 'cutoff', 'cutoff': 0.769148654091196, 'grm_norm': 'cosine_then_gcn', 'self_loops': False, 'use_snp_selection': True, 'num_snps': 52616}. Best is trial 68 with value: 0.07406577063682357.
[I 2025-11-03 11:58:23,969] Trial 95 finished with value: 0.08890736477236041 and parameters: {'model_type': 'graphsage', 'hidden_dims': '[256, 128]', 'dropout': 0.3157371033127059, 'batch_norm': False, 'lr': 9.167600048437583e-06, 'weight_decay': 0.00038205304655939987, 'epochs': 272, 'loss': 'mae', 'optimizer': 'adam', 'graph_mode': 'cutoff', 'cutoff': 0.8714684362862974, 'grm_norm': 'cosine_then_gcn', 'self_loops': False, 'use_snp_selection': True, 'num_snps': 52630}. Best is trial 95 with value: 0.08890736477236041.
[I 2025-11-03 11:58:28,362] Trial 96 finished with value: 0.02983125125392601 and parameters: {'model_type': 'graphsage', 'hidden_dims': '[256, 128]', 'dropout': 0.304630945783754, 'batch_norm': False, 'lr': 9.879992794381327e-06, 'weight_decay': 0.0005392411369819302, 'epochs': 273, 'loss': 'mae', 'optimizer': 'adam', 'graph_mode': 'cutoff', 'cutoff': 0.8692990607785728, 'grm_norm': 'cosine_then_gcn', 'self_loops': False, 'use_snp_selection': True, 'num_snps': 52061}. Best is trial 95 with value: 0.08890736477236041.
[I 2025-11-03 11:58:32,481] Trial 97 finished with value: 0.060287071259526565 and parameters: {'model_type': 'graphsage', 'hidden_dims': '[256, 128]', 'dropout': 0.324271105380369, 'batch_norm': False, 'lr': 5.818116235832165e-06, 'weight_decay': 0.0003894789351224165, 'epochs': 253, 'loss': 'mae', 'optimizer': 'adam', 'graph_mode': 'cutoff', 'cutoff': 0.8758470412573217, 'grm_norm': 'cosine_then_gcn', 'self_loops': False, 'use_snp_selection': True, 'num_snps': 48550}. Best is trial 95 with value: 0.08890736477236041.
[I 2025-11-03 11:58:36,873] Trial 98 finished with value: 0.0850799276404021 and parameters: {'model_type': 'graphsage', 'hidden_dims': '[256, 128]', 'dropout': 0.32122481894855404, 'batch_norm': False, 'lr': 8.526351545870574e-06, 'weight_decay': 0.000812130164712652, 'epochs': 231, 'loss': 'mae', 'optimizer': 'adam', 'graph_mode': 'cutoff', 'cutoff': 0.8129178102608681, 'grm_norm': 'cosine_then_gcn', 'self_loops': False, 'use_snp_selection': True, 'num_snps': 55223}. Best is trial 95 with value: 0.08890736477236041.
[I 2025-11-03 11:58:41,271] Trial 99 finished with value: 0.04549491289750352 and parameters: {'model_type': 'graphsage', 'hidden_dims': '[256, 128]', 'dropout': 0.3768764359457322, 'batch_norm': False, 'lr': 8.847436457270533e-06, 'weight_decay': 0.0008394794851819423, 'epochs': 243, 'loss': 'mae', 'optimizer': 'adam', 'graph_mode': 'cutoff', 'cutoff': 0.8260515409990616, 'grm_norm': 'cosine_then_gcn', 'self_loops': False, 'use_snp_selection': True, 'num_snps': 54615}. Best is trial 95 with value: 0.08890736477236041.
[I 2025-11-03 11:58:45,486] Trial 100 finished with value: 0.07020931523565681 and parameters: {'model_type': 'graphsage', 'hidden_dims': '[256, 128]', 'dropout': 0.3704377273420386, 'batch_norm': False, 'lr': 1.5006162385987166e-05, 'weight_decay': 0.0009865729180117391, 'epochs': 230, 'loss': 'mae', 'optimizer': 'adam', 'graph_mode': 'cutoff', 'cutoff': 0.8034389748347613, 'grm_norm': 'cosine_then_gcn', 'self_loops': False, 'use_snp_selection': True, 'num_snps': 52526}. Best is trial 95 with value: 0.08890736477236041.
[I 2025-11-03 11:58:49,898] Trial 101 finished with value: 0.054138469387242066 and parameters: {'model_type': 'graphsage', 'hidden_dims': '[256, 128]', 'dropout': 0.36928975374096784, 'batch_norm': False, 'lr': 1.611656426003715e-05, 'weight_decay': 0.0009140051271632299, 'epochs': 269, 'loss': 'mae', 'optimizer': 'adam', 'graph_mode': 'cutoff', 'cutoff': 0.7990015466126772, 'grm_norm': 'cosine_then_gcn', 'self_loops': False, 'use_snp_selection': True, 'num_snps': 52671}. Best is trial 95 with value: 0.08890736477236041.
[I 2025-11-03 11:58:54,301] Trial 102 finished with value: 0.041922767946334746 and parameters: {'model_type': 'graphsage', 'hidden_dims': '[256, 128]', 'dropout': 0.3446915620748244, 'batch_norm': False, 'lr': 1.170511491658652e-05, 'weight_decay': 0.0007218540620382003, 'epochs': 231, 'loss': 'mae', 'optimizer': 'adam', 'graph_mode': 'cutoff', 'cutoff': 0.7646406162681828, 'grm_norm': 'cosine_then_gcn', 'self_loops': False, 'use_snp_selection': True, 'num_snps': 55643}. Best is trial 95 with value: 0.08890736477236041.
[I 2025-11-03 11:58:58,361] Trial 103 finished with value: 0.061996822039447466 and parameters: {'model_type': 'graphsage', 'hidden_dims': '[256, 128]', 'dropout': 0.3985986228101452, 'batch_norm': False, 'lr': 1.3876423012810063e-05, 'weight_decay': 0.000977326928718045, 'epochs': 213, 'loss': 'mae', 'optimizer': 'adam', 'graph_mode': 'cutoff', 'cutoff': 0.8558141723867476, 'grm_norm': 'cosine_then_gcn', 'self_loops': False, 'use_snp_selection': True, 'num_snps': 50800}. Best is trial 95 with value: 0.08890736477236041.
[I 2025-11-03 11:59:03,018] Trial 104 finished with value: 0.0645051153839932 and parameters: {'model_type': 'graphsage', 'hidden_dims': '[256, 128]', 'dropout': 0.3117422325360775, 'batch_norm': False, 'lr': 8.02709029411547e-06, 'weight_decay': 0.0004901412988617756, 'epochs': 230, 'loss': 'mae', 'optimizer': 'adam', 'graph_mode': 'cutoff', 'cutoff': 0.8103619562441168, 'grm_norm': 'cosine_then_gcn', 'self_loops': False, 'use_snp_selection': True, 'num_snps': 59584}. Best is trial 95 with value: 0.08890736477236041.
[I 2025-11-03 11:59:07,263] Trial 105 finished with value: 0.07952531705035384 and parameters: {'model_type': 'graphsage', 'hidden_dims': '[256, 128]', 'dropout': 0.3240104898538382, 'batch_norm': False, 'lr': 6.087308709073875e-06, 'weight_decay': 0.0006437929296705687, 'epochs': 231, 'loss': 'mae', 'optimizer': 'adam', 'graph_mode': 'cutoff', 'cutoff': 0.8307427870270545, 'grm_norm': 'cosine_then_gcn', 'self_loops': False, 'use_snp_selection': True, 'num_snps': 53216}. Best is trial 95 with value: 0.08890736477236041.
[I 2025-11-03 11:59:11,519] Trial 106 finished with value: 0.067908540347073 and parameters: {'model_type': 'graphsage', 'hidden_dims': '[256, 128]', 'dropout': 0.31180486654153144, 'batch_norm': False, 'lr': 7.530777428091362e-06, 'weight_decay': 0.0004695141191139096, 'epochs': 230, 'loss': 'mae', 'optimizer': 'adam', 'graph_mode': 'cutoff', 'cutoff': 0.8964176476266736, 'grm_norm': 'cosine_then_gcn', 'self_loops': False, 'use_snp_selection': True, 'num_snps': 53408}. Best is trial 95 with value: 0.08890736477236041.
[I 2025-11-03 11:59:15,482] Trial 107 finished with value: 0.06472377795417356 and parameters: {'model_type': 'graphsage', 'hidden_dims': '[256, 128]', 'dropout': 0.3124450905018643, 'batch_norm': False, 'lr': 7.3717385952268714e-06, 'weight_decay': 0.0006081415570616189, 'epochs': 214, 'loss': 'mae', 'optimizer': 'adam', 'graph_mode': 'cutoff', 'cutoff': 0.8733613413090977, 'grm_norm': 'cosine_then_gcn', 'self_loops': False, 'use_snp_selection': True, 'num_snps': 49272}. Best is trial 95 with value: 0.08890736477236041.
