[I 2025-11-12 10:22:49,730] Trial 126 finished with value: 0.2444228073878152 and parameters: {'model_type': 'graphsage', 'hidden_dims': '[512, 128]', 'dropout': 0.21387742551910768, 'batch_norm': False, 'lr': 5.8809209497127354e-05, 'weight_decay': 3.339002776634144e-05, 'epochs': 346, 'loss': 'mae', 'optimizer': 'adam', 'graph_mode': 'cutoff', 'cutoff': 0.2953767905111647, 'grm_norm': 'cosine_then_gcn', 'self_loops': True, 'use_snp_selection': True, 'num_snps': 52881}. Best is trial 115 with value: 0.2828237894184916.
[I 2025-11-12 10:26:19,444] Trial 127 finished with value: 0.2641815163163121 and parameters: {'model_type': 'graphsage', 'hidden_dims': '[512, 128]', 'dropout': 0.23826072113788554, 'batch_norm': False, 'lr': 5.126878122530111e-05, 'weight_decay': 7.164654080252497e-05, 'epochs': 130, 'loss': 'mae', 'optimizer': 'adam', 'graph_mode': 'cutoff', 'cutoff': 0.3247346036187239, 'grm_norm': 'cosine_then_gcn', 'self_loops': True, 'use_snp_selection': True, 'num_snps': 58569}. Best is trial 115 with value: 0.2828237894184916.
[I 2025-11-12 10:27:12,965] Trial 128 finished with value: 0.2433681409147182 and parameters: {'model_type': 'graphsage', 'hidden_dims': '[512, 256]', 'dropout': 0.1685590243868691, 'batch_norm': False, 'lr': 2.1072248827898276e-05, 'weight_decay': 2.6055090949170613e-05, 'epochs': 141, 'loss': 'mae', 'optimizer': 'adam', 'graph_mode': 'cutoff', 'cutoff': 0.3098265809596732, 'grm_norm': 'cosine_then_gcn', 'self_loops': True, 'use_snp_selection': True, 'num_snps': 4224}. Best is trial 115 with value: 0.2828237894184916.
[I 2025-11-12 10:30:07,173] Trial 129 finished with value: 0.2601336524514707 and parameters: {'model_type': 'graphsage', 'hidden_dims': '[512, 128]', 'dropout': 0.14708002134942433, 'batch_norm': False, 'lr': 9.717079970802794e-05, 'weight_decay': 8.73796610287257e-05, 'epochs': 98, 'loss': 'mse', 'optimizer': 'adam', 'graph_mode': 'cutoff', 'cutoff': 0.35620086043369414, 'grm_norm': 'none', 'self_loops': True, 'use_snp_selection': True, 'num_snps': 59654}. Best is trial 115 with value: 0.2828237894184916.
[I 2025-11-12 10:32:13,481] Trial 130 finished with value: 0.25976477061076164 and parameters: {'model_type': 'graphsage', 'hidden_dims': '[512, 128]', 'dropout': 0.19999611124913072, 'batch_norm': True, 'lr': 0.00020173301724163862, 'weight_decay': 5.350354530502817e-05, 'epochs': 123, 'loss': 'mae', 'optimizer': 'adam', 'graph_mode': 'cutoff', 'cutoff': 0.2848531729000461, 'grm_norm': 'cosine_then_gcn', 'self_loops': True, 'use_snp_selection': False}. Best is trial 115 with value: 0.2828237894184916.
[I 2025-11-12 10:35:01,716] Trial 131 finished with value: 0.27505033646588806 and parameters: {'model_type': 'graphsage', 'hidden_dims': '[512, 64]', 'dropout': 0.15817281283553286, 'batch_norm': False, 'lr': 3.7106664118529864e-05, 'weight_decay': 1.2475306686535605e-05, 'epochs': 107, 'loss': 'mae', 'optimizer': 'adam', 'graph_mode': 'cutoff', 'cutoff': 0.3771780812761616, 'grm_norm': 'cosine_then_gcn', 'self_loops': True, 'use_snp_selection': True, 'num_snps': 57466}. Best is trial 115 with value: 0.2828237894184916.
[I 2025-11-12 10:37:49,573] Trial 132 finished with value: 0.2749691715807655 and parameters: {'model_type': 'graphsage', 'hidden_dims': '[512, 64]', 'dropout': 0.15357249789646737, 'batch_norm': False, 'lr': 3.651016035261989e-05, 'weight_decay': 1.360007808748376e-05, 'epochs': 105, 'loss': 'mae', 'optimizer': 'adam', 'graph_mode': 'cutoff', 'cutoff': 0.36222117974001994, 'grm_norm': 'cosine_then_gcn', 'self_loops': True, 'use_snp_selection': True, 'num_snps': 57190}. Best is trial 115 with value: 0.2828237894184916.
[I 2025-11-12 10:40:20,086] Trial 133 finished with value: 0.28125640367210336 and parameters: {'model_type': 'graphsage', 'hidden_dims': '[512, 64]', 'dropout': 0.15560724416418478, 'batch_norm': False, 'lr': 3.4947530471192095e-05, 'weight_decay': 1.3599013712601028e-05, 'epochs': 84, 'loss': 'mae', 'optimizer': 'adam', 'graph_mode': 'cutoff', 'cutoff': 0.33934557943445776, 'grm_norm': 'cosine_then_gcn', 'self_loops': True, 'use_snp_selection': True, 'num_snps': 56704}. Best is trial 115 with value: 0.2828237894184916.
[I 2025-11-12 10:42:56,629] Trial 134 finished with value: 0.26862172846480387 and parameters: {'model_type': 'graphsage', 'hidden_dims': '[512, 64]', 'dropout': 0.15335689637764804, 'batch_norm': False, 'lr': 2.0857857445940544e-05, 'weight_decay': 1.2824949259611899e-05, 'epochs': 85, 'loss': 'mae', 'optimizer': 'adam', 'graph_mode': 'cutoff', 'cutoff': 0.3596282711619142, 'grm_norm': 'cosine_then_gcn', 'self_loops': True, 'use_snp_selection': True, 'num_snps': 59975}. Best is trial 115 with value: 0.2828237894184916.
[I 2025-11-12 10:45:13,267] Trial 135 finished with value: 0.2596757689375023 and parameters: {'model_type': 'graphsage', 'hidden_dims': '[512, 64]', 'dropout': 0.14396140237720642, 'batch_norm': False, 'lr': 2.562690304188387e-05, 'weight_decay': 0.0005767249088818336, 'epochs': 79, 'loss': 'mae', 'optimizer': 'adam', 'graph_mode': 'cutoff', 'cutoff': 0.3860956113396697, 'grm_norm': 'cosine_then_gcn', 'self_loops': True, 'use_snp_selection': True, 'num_snps': 54867}. Best is trial 115 with value: 0.2828237894184916.
[I 2025-11-12 10:47:55,214] Trial 136 finished with value: 0.2741299431127871 and parameters: {'model_type': 'graphsage', 'hidden_dims': '[512, 64]', 'dropout': 0.16663803493930665, 'batch_norm': False, 'lr': 3.202355701416051e-05, 'weight_decay': 1.746946763330428e-05, 'epochs': 108, 'loss': 'mae', 'optimizer': 'adam', 'graph_mode': 'cutoff', 'cutoff': 0.3264569481337769, 'grm_norm': 'cosine_then_gcn', 'self_loops': True, 'use_snp_selection': True, 'num_snps': 50906}. Best is trial 115 with value: 0.2828237894184916.
[I 2025-11-12 10:50:22,429] Trial 137 finished with value: 0.26089966873091075 and parameters: {'model_type': 'graphsage', 'hidden_dims': '[512, 64]', 'dropout': 0.1551932969536084, 'batch_norm': False, 'lr': 3.6080368263832664e-05, 'weight_decay': 1.4200251294722923e-05, 'epochs': 71, 'loss': 'mae', 'optimizer': 'adam', 'graph_mode': 'cutoff', 'cutoff': 0.305019702736699, 'grm_norm': 'cosine_then_gcn', 'self_loops': True, 'use_snp_selection': True, 'num_snps': 56275}. Best is trial 115 with value: 0.2828237894184916.
[I 2025-11-12 10:53:31,796] Trial 138 finished with value: 0.2683578537414582 and parameters: {'model_type': 'graphsage', 'hidden_dims': '[512, 64]', 'dropout': 0.11721795996905371, 'batch_norm': False, 'lr': 4.558007946567141e-05, 'weight_decay': 9.40475752771618e-06, 'epochs': 89, 'loss': 'mae', 'optimizer': 'adam', 'graph_mode': 'cutoff', 'cutoff': 0.2798303955383076, 'grm_norm': 'cosine', 'self_loops': True, 'use_snp_selection': True, 'num_snps': 58005}. Best is trial 115 with value: 0.2828237894184916.
[I 2025-11-12 10:56:03,739] Trial 139 finished with value: 0.2727837229927348 and parameters: {'model_type': 'graphsage', 'hidden_dims': '[512, 64]', 'dropout': 0.13261962664095586, 'batch_norm': False, 'lr': 3.7014025416007815e-05, 'weight_decay': 1.642101117816885e-05, 'epochs': 95, 'loss': 'mae', 'optimizer': 'adam', 'graph_mode': 'cutoff', 'cutoff': 0.33842116147254464, 'grm_norm': 'cosine_then_gcn', 'self_loops': True, 'use_snp_selection': True, 'num_snps': 54400}. Best is trial 115 with value: 0.2828237894184916.
[I 2025-11-12 10:58:46,346] Trial 140 finished with value: 0.27575850569993593 and parameters: {'model_type': 'graphsage', 'hidden_dims': '[512, 64]', 'dropout': 0.17285443840044415, 'batch_norm': False, 'lr': 2.827805088714785e-05, 'weight_decay': 2.2986238550457077e-05, 'epochs': 113, 'loss': 'mae', 'optimizer': 'adam', 'graph_mode': 'cutoff', 'cutoff': 0.3673763611216303, 'grm_norm': 'cosine_then_gcn', 'self_loops': True, 'use_snp_selection': True, 'num_snps': 52236}. Best is trial 115 with value: 0.2828237894184916.
[I 2025-11-12 11:01:27,981] Trial 141 finished with value: 0.2745095107228374 and parameters: {'model_type': 'graphsage', 'hidden_dims': '[512, 64]', 'dropout': 0.15926369024448278, 'batch_norm': False, 'lr': 2.9328592347570873e-05, 'weight_decay': 2.3488530767482895e-05, 'epochs': 113, 'loss': 'mae', 'optimizer': 'adam', 'graph_mode': 'cutoff', 'cutoff': 0.3691017091553852, 'grm_norm': 'cosine_then_gcn', 'self_loops': True, 'use_snp_selection': True, 'num_snps': 52255}. Best is trial 115 with value: 0.2828237894184916.
[I 2025-11-12 11:03:54,892] Trial 142 finished with value: 0.2588793178343191 and parameters: {'model_type': 'graphsage', 'hidden_dims': '[512, 64]', 'dropout': 0.1580625652332686, 'batch_norm': False, 'lr': 1.5772091663479074e-05, 'weight_decay': 2.325212305673793e-05, 'epochs': 115, 'loss': 'mae', 'optimizer': 'adam', 'graph_mode': 'cutoff', 'cutoff': 0.3654003671842804, 'grm_norm': 'cosine_then_gcn', 'self_loops': True, 'use_snp_selection': True, 'num_snps': 46552}. Best is trial 115 with value: 0.2828237894184916.
[I 2025-11-12 11:06:38,864] Trial 143 finished with value: 0.2799668571154837 and parameters: {'model_type': 'graphsage', 'hidden_dims': '[512, 64]', 'dropout': 0.14037110196028085, 'batch_norm': False, 'lr': 2.460744927866204e-05, 'weight_decay': 3.324204258887058e-05, 'epochs': 106, 'loss': 'mae', 'optimizer': 'adam', 'graph_mode': 'cutoff', 'cutoff': 0.3257483232388584, 'grm_norm': 'cosine_then_gcn', 'self_loops': True, 'use_snp_selection': True, 'num_snps': 51792}. Best is trial 115 with value: 0.2828237894184916.
[I 2025-11-12 11:09:18,392] Trial 144 finished with value: 0.2718617730963942 and parameters: {'model_type': 'graphsage', 'hidden_dims': '[512, 64]', 'dropout': 0.14112601345205725, 'batch_norm': False, 'lr': 2.314755650023528e-05, 'weight_decay': 3.259724506317422e-05, 'epochs': 107, 'loss': 'mae', 'optimizer': 'adam', 'graph_mode': 'cutoff', 'cutoff': 0.32033557616813024, 'grm_norm': 'cosine_then_gcn', 'self_loops': True, 'use_snp_selection': True, 'num_snps': 49945}. Best is trial 115 with value: 0.2828237894184916.
[I 2025-11-12 11:12:05,613] Trial 145 finished with value: 0.2761464762473082 and parameters: {'model_type': 'graphsage', 'hidden_dims': '[512, 64]', 'dropout': 0.11061407908989658, 'batch_norm': False, 'lr': 2.7105214534528636e-05, 'weight_decay': 2.7313989869308036e-05, 'epochs': 121, 'loss': 'mae', 'optimizer': 'adam', 'graph_mode': 'cutoff', 'cutoff': 0.3482782127001377, 'grm_norm': 'cosine_then_gcn', 'self_loops': True, 'use_snp_selection': True, 'num_snps': 51296}. Best is trial 115 with value: 0.2828237894184916.
[I 2025-11-12 11:14:50,980] Trial 146 finished with value: 0.2748165839756857 and parameters: {'model_type': 'graphsage', 'hidden_dims': '[512, 64]', 'dropout': 0.10366768323239231, 'batch_norm': False, 'lr': 2.0700566077136434e-05, 'weight_decay': 2.039646426447298e-05, 'epochs': 120, 'loss': 'mae', 'optimizer': 'adam', 'graph_mode': 'cutoff', 'cutoff': 0.343263474071419, 'grm_norm': 'cosine_then_gcn', 'self_loops': True, 'use_snp_selection': True, 'num_snps': 50878}. Best is trial 115 with value: 0.2828237894184916.
[I 2025-11-12 11:18:02,030] Trial 147 finished with value: 0.22554458610040165 and parameters: {'model_type': 'graphsage', 'hidden_dims': '[512, 64]', 'dropout': 0.12024382157157042, 'batch_norm': False, 'lr': 2.5848400919310626e-05, 'weight_decay': 2.650518357349965e-05, 'epochs': 102, 'loss': 'mae', 'optimizer': 'adam', 'graph_mode': 'knn', 'source': 'grm', 'knn_k': 6, 'weighted_edges': True, 'symmetrize_mode': 'union', 'use_snp_selection': True, 'num_snps': 53502}. Best is trial 115 with value: 0.2828237894184916.
[I 2025-11-12 11:22:46,913] Trial 148 finished with value: 0.26772809626593747 and parameters: {'model_type': 'graphsage', 'hidden_dims': '[512, 64]', 'dropout': 0.14186958281409334, 'batch_norm': False, 'lr': 2.853072856733943e-05, 'weight_decay': 1.261933005792489e-05, 'epochs': 111, 'loss': 'mae', 'optimizer': 'adam', 'graph_mode': 'cutoff', 'cutoff': 0.20184002551623692, 'grm_norm': 'cosine_then_gcn', 'self_loops': True, 'use_snp_selection': True, 'num_snps': 52135}. Best is trial 115 with value: 0.2828237894184916.
[I 2025-11-12 11:25:58,909] Trial 149 finished with value: 0.27292484831975006 and parameters: {'model_type': 'graphsage', 'hidden_dims': '[512, 64]', 'dropout': 0.11225612610771372, 'batch_norm': False, 'lr': 3.515968480120465e-05, 'weight_decay': 3.4065393232337365e-05, 'epochs': 133, 'loss': 'mae', 'optimizer': 'adam', 'graph_mode': 'cutoff', 'cutoff': 0.32989441455374535, 'grm_norm': 'cosine_then_gcn', 'self_loops': True, 'use_snp_selection': True, 'num_snps': 54092}. Best is trial 115 with value: 0.2828237894184916.
[I 2025-11-12 11:28:43,000] Trial 0 finished with value: 0.13408460456552224 and parameters: {'model_type': 'graphsage', 'hidden_dims': '[128, 64]', 'dropout': 0.199031432379812, 'batch_norm': True, 'lr': 1.8408544111075837e-06, 'weight_decay': 5.5136510071208614e-05, 'epochs': 336, 'loss': 'mae', 'optimizer': 'adam', 'graph_mode': 'knn', 'source': 'grm', 'knn_k': 8, 'weighted_edges': True, 'symmetrize_mode': 'mutual', 'use_snp_selection': False}. Best is trial 0 with value: 0.13408460456552224.
[I 2025-11-12 11:29:35,089] Trial 1 finished with value: 0.22001403819458756 and parameters: {'model_type': 'graphsage', 'hidden_dims': '[128, 64]', 'dropout': 0.40051947670227217, 'batch_norm': True, 'lr': 0.0005320428882732732, 'weight_decay': 1.89210117736594e-06, 'epochs': 68, 'loss': 'mse', 'optimizer': 'adam', 'graph_mode': 'knn', 'source': 'grm', 'knn_k': 7, 'weighted_edges': True, 'symmetrize_mode': 'union', 'use_snp_selection': False}. Best is trial 1 with value: 0.22001403819458756.
[I 2025-11-12 11:30:56,509] Trial 2 finished with value: 0.173365255614305 and parameters: {'model_type': 'graphsage', 'hidden_dims': '[256, 128]', 'dropout': 0.5105528289184642, 'batch_norm': False, 'lr': 0.0006804279372404962, 'weight_decay': 0.0008922815224257085, 'epochs': 181, 'loss': 'mse', 'optimizer': 'adam', 'graph_mode': 'cutoff', 'cutoff': 0.5741905641612706, 'grm_norm': 'gcn', 'self_loops': False, 'use_snp_selection': True, 'num_snps': 26910}. Best is trial 1 with value: 0.22001403819458756.
[I 2025-11-12 11:32:28,970] Trial 3 finished with value: 0.23019222185784746 and parameters: {'model_type': 'graphsage', 'hidden_dims': '[256, 128, 64]', 'dropout': 0.5390483213624292, 'batch_norm': False, 'lr': 3.4705625989073525e-05, 'weight_decay': 2.4623319020131338e-05, 'epochs': 121, 'loss': 'mse', 'optimizer': 'adam', 'graph_mode': 'knn', 'source': 'grm', 'knn_k': 6, 'weighted_edges': False, 'symmetrize_mode': 'mutual', 'use_snp_selection': True, 'num_snps': 30713}. Best is trial 3 with value: 0.23019222185784746.
[I 2025-11-12 11:33:37,606] Trial 4 finished with value: 0.23271820287152162 and parameters: {'model_type': 'graphsage', 'hidden_dims': '[128, 64]', 'dropout': 0.13404863676897502, 'batch_norm': False, 'lr': 0.0001431556295367288, 'weight_decay': 2.2084517750726675e-05, 'epochs': 51, 'loss': 'mae', 'optimizer': 'adam', 'graph_mode': 'cutoff', 'cutoff': 0.6714268476993044, 'grm_norm': 'none', 'self_loops': False, 'use_snp_selection': True, 'num_snps': 45645}. Best is trial 4 with value: 0.23271820287152162.
[I 2025-11-12 11:35:20,177] Trial 5 finished with value: 0.24377663357771223 and parameters: {'model_type': 'graphsage', 'hidden_dims': '[256, 128]', 'dropout': 0.42253606323412096, 'batch_norm': False, 'lr': 4.238630400638805e-05, 'weight_decay': 8.074086040046576e-07, 'epochs': 158, 'loss': 'mae', 'optimizer': 'adam', 'graph_mode': 'knn', 'source': 'grm', 'knn_k': 1, 'weighted_edges': False, 'symmetrize_mode': 'mutual', 'use_snp_selection': True, 'num_snps': 43113}. Best is trial 5 with value: 0.24377663357771223.
[I 2025-11-12 11:37:59,988] Trial 6 finished with value: 0.22326463859889634 and parameters: {'model_type': 'graphsage', 'hidden_dims': '[512, 256]', 'dropout': 0.3534893146320237, 'batch_norm': True, 'lr': 0.000251307964226932, 'weight_decay': 1.821819791794022e-05, 'epochs': 223, 'loss': 'mae', 'optimizer': 'adam', 'graph_mode': 'knn', 'source': 'grm', 'knn_k': 1, 'weighted_edges': True, 'symmetrize_mode': 'mutual', 'use_snp_selection': False}. Best is trial 5 with value: 0.24377663357771223.
[I 2025-11-12 11:40:15,771] Trial 7 finished with value: 0.20773366887999517 and parameters: {'model_type': 'graphsage', 'hidden_dims': '[512, 256]', 'dropout': 0.1105825955860775, 'batch_norm': True, 'lr': 2.374338412754043e-05, 'weight_decay': 1.1284721123340274e-05, 'epochs': 190, 'loss': 'mse', 'optimizer': 'adam', 'graph_mode': 'cutoff', 'cutoff': 0.719872204109604, 'grm_norm': 'gcn', 'self_loops': False, 'use_snp_selection': False}. Best is trial 5 with value: 0.24377663357771223.
[I 2025-11-12 11:42:09,261] Trial 8 finished with value: 0.2293051823935993 and parameters: {'model_type': 'graphsage', 'hidden_dims': '[512, 128]', 'dropout': 0.5066580418354021, 'batch_norm': True, 'lr': 0.00039213678276659976, 'weight_decay': 3.43655320802934e-06, 'epochs': 120, 'loss': 'mse', 'optimizer': 'adam', 'graph_mode': 'cutoff', 'cutoff': 0.34923059576505366, 'grm_norm': 'cosine', 'self_loops': True, 'use_snp_selection': False}. Best is trial 5 with value: 0.24377663357771223.
[I 2025-11-12 11:43:27,053] Trial 9 finished with value: 0.22033083609922244 and parameters: {'model_type': 'graphsage', 'hidden_dims': '[512, 256]', 'dropout': 0.301734920240333, 'batch_norm': False, 'lr': 6.650961854953448e-06, 'weight_decay': 6.861575656590315e-05, 'epochs': 150, 'loss': 'mae', 'optimizer': 'adam', 'graph_mode': 'cutoff', 'cutoff': 0.2857569870061939, 'grm_norm': 'cosine_then_gcn', 'self_loops': False, 'use_snp_selection': True, 'num_snps': 12722}. Best is trial 5 with value: 0.24377663357771223.
[I 2025-11-12 11:46:45,825] Trial 10 finished with value: 0.22933469738872447 and parameters: {'model_type': 'graphsage', 'hidden_dims': '[256, 128]', 'dropout': 0.42081077970837905, 'batch_norm': False, 'lr': 6.10458015764876e-05, 'weight_decay': 1.1882920363656206e-07, 'epochs': 265, 'loss': 'mae', 'optimizer': 'adam', 'graph_mode': 'knn', 'source': 'grm', 'knn_k': 1, 'weighted_edges': False, 'symmetrize_mode': 'union', 'use_snp_selection': True, 'num_snps': 58960}. Best is trial 5 with value: 0.24377663357771223.
[I 2025-11-12 11:48:25,539] Trial 11 finished with value: 0.24119189133600613 and parameters: {'model_type': 'graphsage', 'hidden_dims': '[512, 64]', 'dropout': 0.26972854500749766, 'batch_norm': False, 'lr': 9.36720409438805e-05, 'weight_decay': 4.139423376842716e-07, 'epochs': 62, 'loss': 'mae', 'optimizer': 'adam', 'graph_mode': 'cutoff', 'cutoff': 0.8576830859783061, 'grm_norm': 'none', 'self_loops': True, 'use_snp_selection': True, 'num_snps': 51345}. Best is trial 5 with value: 0.24377663357771223.
[I 2025-11-12 11:50:15,279] Trial 12 finished with value: 0.23546103794544004 and parameters: {'model_type': 'graphsage', 'hidden_dims': '[512, 64]', 'dropout': 0.2461692757439603, 'batch_norm': False, 'lr': 1.1258530768955342e-05, 'weight_decay': 2.3473167056467352e-07, 'epochs': 95, 'loss': 'mae', 'optimizer': 'adam', 'graph_mode': 'cutoff', 'cutoff': 0.8997334580241522, 'grm_norm': 'none', 'self_loops': True, 'use_snp_selection': True, 'num_snps': 47458}. Best is trial 5 with value: 0.24377663357771223.
[I 2025-11-12 11:53:39,088] Trial 13 finished with value: 0.23338450729209725 and parameters: {'model_type': 'graphsage', 'hidden_dims': '[512, 64]', 'dropout': 0.4422970702110789, 'batch_norm': False, 'lr': 0.00010211123063502776, 'weight_decay': 6.870694187222418e-07, 'epochs': 252, 'loss': 'mae', 'optimizer': 'adam', 'graph_mode': 'knn', 'source': 'grm', 'knn_k': 3, 'weighted_edges': False, 'symmetrize_mode': 'mutual', 'use_snp_selection': True, 'num_snps': 46420}. Best is trial 5 with value: 0.24377663357771223.
[I 2025-11-12 11:55:16,417] Trial 14 finished with value: 0.214213652906881 and parameters: {'model_type': 'graphsage', 'hidden_dims': '[512, 64]', 'dropout': 0.5969856460298077, 'batch_norm': False, 'lr': 1.1823202310856283e-05, 'weight_decay': 5.990302732896675e-07, 'epochs': 41, 'loss': 'mae', 'optimizer': 'adam', 'graph_mode': 'cutoff', 'cutoff': 0.8652805735107408, 'grm_norm': 'none', 'self_loops': True, 'use_snp_selection': True, 'num_snps': 59073}. Best is trial 5 with value: 0.24377663357771223.
[I 2025-11-12 11:57:45,474] Trial 15 finished with value: 0.24590502067261824 and parameters: {'model_type': 'graphsage', 'hidden_dims': '[256, 128]', 'dropout': 0.29752941860750876, 'batch_norm': False, 'lr': 6.889772676230613e-05, 'weight_decay': 2.528732936839676e-06, 'epochs': 153, 'loss': 'mae', 'optimizer': 'adam', 'graph_mode': 'knn', 'source': 'grm', 'knn_k': 10, 'weighted_edges': False, 'symmetrize_mode': 'mutual', 'use_snp_selection': True, 'num_snps': 39896}. Best is trial 15 with value: 0.24590502067261824.
[I 2025-11-12 12:00:10,236] Trial 16 finished with value: 0.2118581448525632 and parameters: {'model_type': 'graphsage', 'hidden_dims': '[256, 128]', 'dropout': 0.3225190164399214, 'batch_norm': False, 'lr': 2.343388704248642e-06, 'weight_decay': 2.392832368867174e-06, 'epochs': 161, 'loss': 'mae', 'optimizer': 'adam', 'graph_mode': 'knn', 'source': 'grm', 'knn_k': 10, 'weighted_edges': False, 'symmetrize_mode': 'mutual', 'use_snp_selection': True, 'num_snps': 36329}. Best is trial 15 with value: 0.24590502067261824.
[I 2025-11-12 12:01:34,702] Trial 17 finished with value: 0.21201842401657983 and parameters: {'model_type': 'graphsage', 'hidden_dims': '[256, 128]', 'dropout': 0.37355782145587996, 'batch_norm': False, 'lr': 4.8774997002288986e-05, 'weight_decay': 5.623832385322728e-06, 'epochs': 220, 'loss': 'mae', 'optimizer': 'adam', 'graph_mode': 'knn', 'source': 'grm', 'knn_k': 4, 'weighted_edges': False, 'symmetrize_mode': 'mutual', 'use_snp_selection': True, 'num_snps': 20234}. Best is trial 15 with value: 0.24590502067261824.
