[I 2025-11-03 12:09:19,024] Trial 77 finished with value: 0.1110444247972812 and parameters: {'model_type': 'gcn', 'hidden_dims': '[128, 64]', 'dropout': 0.24602143279102034, 'batch_norm': True, 'lr': 0.0004779825108128261, 'weight_decay': 1.985490959194118e-07, 'epochs': 251, 'loss': 'mse', 'optimizer': 'adam', 'graph_mode': 'off', 'use_snp_selection': False}. Best is trial 22 with value: 0.13056895679760083.
[I 2025-11-03 12:09:20,283] Trial 78 finished with value: 0.016660259167512285 and parameters: {'model_type': 'gcn', 'hidden_dims': '[512, 256]', 'dropout': 0.271646346919599, 'batch_norm': True, 'lr': 1.0087771566710256e-06, 'weight_decay': 4.126967515864169e-07, 'epochs': 314, 'loss': 'mse', 'optimizer': 'adam', 'graph_mode': 'off', 'use_snp_selection': True, 'num_snps': 2246}. Best is trial 22 with value: 0.13056895679760083.
[I 2025-11-03 12:09:21,300] Trial 79 finished with value: 0.051685630795895186 and parameters: {'model_type': 'gcn', 'hidden_dims': '[128, 64]', 'dropout': 0.31666646253502384, 'batch_norm': True, 'lr': 5.129496790411772e-05, 'weight_decay': 1.3905187596759587e-07, 'epochs': 164, 'loss': 'mse', 'optimizer': 'adam', 'graph_mode': 'off', 'use_snp_selection': False}. Best is trial 22 with value: 0.13056895679760083.
[I 2025-11-03 12:09:22,519] Trial 80 finished with value: 0.1068189919416609 and parameters: {'model_type': 'gcn', 'hidden_dims': '[128, 64]', 'dropout': 0.2946967814110065, 'batch_norm': True, 'lr': 0.00019564065852011977, 'weight_decay': 5.513339020503485e-07, 'epochs': 227, 'loss': 'mse', 'optimizer': 'adam', 'graph_mode': 'off', 'use_snp_selection': False}. Best is trial 22 with value: 0.13056895679760083.
[I 2025-11-03 12:09:24,196] Trial 81 finished with value: 0.10715870170317082 and parameters: {'model_type': 'gcn', 'hidden_dims': '[256, 128, 64]', 'dropout': 0.3571988071164746, 'batch_norm': True, 'lr': 0.00034461211212666245, 'weight_decay': 1.260707483386822e-07, 'epochs': 209, 'loss': 'mse', 'optimizer': 'adam', 'graph_mode': 'off', 'use_snp_selection': False}. Best is trial 22 with value: 0.13056895679760083.
[I 2025-11-03 12:09:26,554] Trial 82 finished with value: 0.11977091098480426 and parameters: {'model_type': 'gcn', 'hidden_dims': '[512, 256]', 'dropout': 0.3298287213603077, 'batch_norm': True, 'lr': 0.0008292416110228538, 'weight_decay': 1.00970537426979e-07, 'epochs': 241, 'loss': 'mse', 'optimizer': 'adam', 'graph_mode': 'off', 'use_snp_selection': False}. Best is trial 22 with value: 0.13056895679760083.
[I 2025-11-03 12:09:27,860] Trial 83 finished with value: 0.10407071314640784 and parameters: {'model_type': 'gcn', 'hidden_dims': '[128, 64]', 'dropout': 0.11527029769321673, 'batch_norm': True, 'lr': 0.00042134913286325323, 'weight_decay': 3.0948929260203145e-07, 'epochs': 268, 'loss': 'mse', 'optimizer': 'adam', 'graph_mode': 'off', 'use_snp_selection': False}. Best is trial 22 with value: 0.13056895679760083.
[I 2025-11-03 12:09:29,800] Trial 84 finished with value: 0.12335177279170392 and parameters: {'model_type': 'gcn', 'hidden_dims': '[512, 64]', 'dropout': 0.34186943235366996, 'batch_norm': True, 'lr': 0.0006790627045984301, 'weight_decay': 2.1974707835605155e-07, 'epochs': 184, 'loss': 'mse', 'optimizer': 'adam', 'graph_mode': 'off', 'use_snp_selection': False}. Best is trial 22 with value: 0.13056895679760083.
[I 2025-11-03 12:09:31,831] Trial 85 finished with value: 0.11121182719573147 and parameters: {'model_type': 'gcn', 'hidden_dims': '[512, 64]', 'dropout': 0.33916254553390407, 'batch_norm': True, 'lr': 0.0006742217888775093, 'weight_decay': 2.3226334948430447e-07, 'epochs': 191, 'loss': 'mse', 'optimizer': 'adam', 'graph_mode': 'off', 'use_snp_selection': False}. Best is trial 22 with value: 0.13056895679760083.
[I 2025-11-03 12:09:33,633] Trial 86 finished with value: 0.020504135793519056 and parameters: {'model_type': 'gcn', 'hidden_dims': '[512, 64]', 'dropout': 0.39614705692535396, 'batch_norm': False, 'lr': 0.000561215471271424, 'weight_decay': 1.6729371104999443e-07, 'epochs': 151, 'loss': 'mse', 'optimizer': 'adam', 'graph_mode': 'off', 'use_snp_selection': False}. Best is trial 22 with value: 0.13056895679760083.
[I 2025-11-03 12:09:35,590] Trial 87 finished with value: 0.10950431712275956 and parameters: {'model_type': 'gcn', 'hidden_dims': '[512, 64]', 'dropout': 0.3769588194957366, 'batch_norm': True, 'lr': 0.0007548343592767735, 'weight_decay': 3.3936791497935676e-05, 'epochs': 180, 'loss': 'mse', 'optimizer': 'adam', 'graph_mode': 'off', 'use_snp_selection': False}. Best is trial 22 with value: 0.13056895679760083.
[I 2025-11-03 12:09:38,580] Trial 88 finished with value: 0.10813731499807674 and parameters: {'model_type': 'gcn', 'hidden_dims': '[512, 64]', 'dropout': 0.2164722487546254, 'batch_norm': True, 'lr': 0.0009028475260596282, 'weight_decay': 3.633564147489855e-07, 'epochs': 341, 'loss': 'mae', 'optimizer': 'adam', 'graph_mode': 'off', 'use_snp_selection': False}. Best is trial 22 with value: 0.13056895679760083.
[I 2025-11-03 12:09:41,555] Trial 89 finished with value: 0.12284000413220451 and parameters: {'model_type': 'gcn', 'hidden_dims': '[512, 256]', 'dropout': 0.35027490349393964, 'batch_norm': True, 'lr': 0.0005852317833906221, 'weight_decay': 2.068834481201476e-07, 'epochs': 304, 'loss': 'mse', 'optimizer': 'adam', 'graph_mode': 'off', 'use_snp_selection': True, 'num_snps': 45058}. Best is trial 22 with value: 0.13056895679760083.
[I 2025-11-03 12:09:42,853] Trial 90 finished with value: 0.052014620053522795 and parameters: {'model_type': 'gcn', 'hidden_dims': '[256, 128]', 'dropout': 0.28570498321352, 'batch_norm': True, 'lr': 2.5172414583174508e-05, 'weight_decay': 2.7909965869194977e-07, 'epochs': 163, 'loss': 'mse', 'optimizer': 'adam', 'graph_mode': 'off', 'use_snp_selection': False}. Best is trial 22 with value: 0.13056895679760083.
[I 2025-11-03 12:09:45,442] Trial 91 finished with value: 0.10219616048381092 and parameters: {'model_type': 'gcn', 'hidden_dims': '[512, 128]', 'dropout': 0.18599791121347667, 'batch_norm': True, 'lr': 0.00013113703315193072, 'weight_decay': 1.529581570708263e-07, 'epochs': 284, 'loss': 'mse', 'optimizer': 'adam', 'graph_mode': 'off', 'use_snp_selection': False}. Best is trial 22 with value: 0.13056895679760083.
[I 2025-11-03 12:09:46,958] Trial 92 finished with value: 0.11480704482518653 and parameters: {'model_type': 'gcn', 'hidden_dims': '[128, 64]', 'dropout': 0.36643033700240535, 'batch_norm': True, 'lr': 0.0005027364455992248, 'weight_decay': 1.230791614274972e-07, 'epochs': 290, 'loss': 'mse', 'optimizer': 'adam', 'graph_mode': 'off', 'use_snp_selection': False}. Best is trial 22 with value: 0.13056895679760083.
[I 2025-11-03 12:09:47,877] Trial 93 finished with value: 0.07806599523604918 and parameters: {'model_type': 'gcn', 'hidden_dims': '[128, 64]', 'dropout': 0.31145755025410926, 'batch_norm': True, 'lr': 8.803611577227169e-05, 'weight_decay': 1.7154848396721933e-07, 'epochs': 140, 'loss': 'mse', 'optimizer': 'adam', 'graph_mode': 'off', 'use_snp_selection': False}. Best is trial 22 with value: 0.13056895679760083.
[I 2025-11-03 12:09:49,964] Trial 94 finished with value: 0.11792766846550849 and parameters: {'model_type': 'gcn', 'hidden_dims': '[512, 128]', 'dropout': 0.3276080497975767, 'batch_norm': True, 'lr': 0.00040076803282695857, 'weight_decay': 2.521562409246864e-07, 'epochs': 195, 'loss': 'mse', 'optimizer': 'adam', 'graph_mode': 'off', 'use_snp_selection': False}. Best is trial 22 with value: 0.13056895679760083.
[I 2025-11-03 12:09:52,342] Trial 95 finished with value: 0.10405832566441142 and parameters: {'model_type': 'gcn', 'hidden_dims': '[512, 64]', 'dropout': 0.2522573069830385, 'batch_norm': True, 'lr': 0.0002413127915772431, 'weight_decay': 5.114972537852085e-07, 'epochs': 252, 'loss': 'mse', 'optimizer': 'adam', 'graph_mode': 'off', 'use_snp_selection': False}. Best is trial 22 with value: 0.13056895679760083.
[I 2025-11-03 12:09:54,530] Trial 96 finished with value: 0.12467509304162065 and parameters: {'model_type': 'gcn', 'hidden_dims': '[512, 256]', 'dropout': 0.3443063249302453, 'batch_norm': True, 'lr': 0.000326347368618102, 'weight_decay': 6.835893101117743e-06, 'epochs': 218, 'loss': 'mse', 'optimizer': 'adam', 'graph_mode': 'off', 'use_snp_selection': False}. Best is trial 22 with value: 0.13056895679760083.
[I 2025-11-03 12:09:56,629] Trial 97 finished with value: 0.1177849943536575 and parameters: {'model_type': 'gcn', 'hidden_dims': '[512, 256]', 'dropout': 0.3856329752481987, 'batch_norm': True, 'lr': 0.0009096810694194375, 'weight_decay': 1.8365715666980374e-06, 'epochs': 204, 'loss': 'mse', 'optimizer': 'adam', 'graph_mode': 'off', 'use_snp_selection': False}. Best is trial 22 with value: 0.13056895679760083.
[I 2025-11-03 12:09:58,874] Trial 98 finished with value: 0.1276935767339376 and parameters: {'model_type': 'gcn', 'hidden_dims': '[512, 256]', 'dropout': 0.36168625429340523, 'batch_norm': True, 'lr': 0.0006707142507370225, 'weight_decay': 8.272531565571638e-06, 'epochs': 229, 'loss': 'mse', 'optimizer': 'adam', 'graph_mode': 'off', 'use_snp_selection': False}. Best is trial 22 with value: 0.13056895679760083.
[I 2025-11-03 12:10:01,085] Trial 99 finished with value: 0.0528225612281014 and parameters: {'model_type': 'gcn', 'hidden_dims': '[512, 256]', 'dropout': 0.34299563404953176, 'batch_norm': False, 'lr': 0.0007366369889807291, 'weight_decay': 8.125664017747028e-06, 'epochs': 231, 'loss': 'mse', 'optimizer': 'adam', 'graph_mode': 'off', 'use_snp_selection': False}. Best is trial 22 with value: 0.13056895679760083.
[I 2025-11-03 12:10:03,382] Trial 100 finished with value: 0.11419619389784698 and parameters: {'model_type': 'gcn', 'hidden_dims': '[512, 256]', 'dropout': 0.40921010167741395, 'batch_norm': True, 'lr': 0.00027598203668104685, 'weight_decay': 4.940033288679243e-06, 'epochs': 237, 'loss': 'mse', 'optimizer': 'adam', 'graph_mode': 'off', 'use_snp_selection': False}. Best is trial 22 with value: 0.13056895679760083.
[I 2025-11-03 12:10:05,718] Trial 101 finished with value: 0.12275540959589001 and parameters: {'model_type': 'gcn', 'hidden_dims': '[512, 256]', 'dropout': 0.3640808362525841, 'batch_norm': True, 'lr': 0.0006430536904989601, 'weight_decay': 3.5401192674852964e-06, 'epochs': 248, 'loss': 'mse', 'optimizer': 'adam', 'graph_mode': 'off', 'use_snp_selection': False}. Best is trial 22 with value: 0.13056895679760083.
[I 2025-11-03 12:10:07,922] Trial 102 finished with value: 0.1148859275368326 and parameters: {'model_type': 'gcn', 'hidden_dims': '[512, 256]', 'dropout': 0.34982627909265185, 'batch_norm': True, 'lr': 0.0003298433418451, 'weight_decay': 1.7469130115443652e-05, 'epochs': 223, 'loss': 'mse', 'optimizer': 'adam', 'graph_mode': 'off', 'use_snp_selection': False}. Best is trial 22 with value: 0.13056895679760083.
[I 2025-11-03 12:10:09,849] Trial 103 finished with value: 0.11626253532621678 and parameters: {'model_type': 'gcn', 'hidden_dims': '[512, 256]', 'dropout': 0.37390736740277164, 'batch_norm': True, 'lr': 0.0005151498997960126, 'weight_decay': 2.5230755806173968e-06, 'epochs': 180, 'loss': 'mse', 'optimizer': 'adam', 'graph_mode': 'off', 'use_snp_selection': False}. Best is trial 22 with value: 0.13056895679760083.
[I 2025-11-03 12:10:12,302] Trial 104 finished with value: 0.11404574941945247 and parameters: {'model_type': 'gcn', 'hidden_dims': '[512, 256]', 'dropout': 0.4252239605351655, 'batch_norm': True, 'lr': 0.0004405841988645832, 'weight_decay': 1.0530003342687749e-05, 'epochs': 261, 'loss': 'mse', 'optimizer': 'adam', 'graph_mode': 'off', 'use_snp_selection': False}. Best is trial 22 with value: 0.13056895679760083.
[I 2025-11-03 12:10:13,463] Trial 105 finished with value: 0.10587937103305144 and parameters: {'model_type': 'gcn', 'hidden_dims': '[128, 64]', 'dropout': 0.2673156493749331, 'batch_norm': True, 'lr': 0.0009744355652443928, 'weight_decay': 6.093079027267291e-06, 'epochs': 215, 'loss': 'mse', 'optimizer': 'adam', 'graph_mode': 'off', 'use_snp_selection': False}. Best is trial 22 with value: 0.13056895679760083.
[I 2025-11-03 12:10:15,979] Trial 106 finished with value: 0.11683799053107366 and parameters: {'model_type': 'gcn', 'hidden_dims': '[512, 256]', 'dropout': 0.3209999279200212, 'batch_norm': True, 'lr': 0.0006535766084103891, 'weight_decay': 7.243233317578591e-05, 'epochs': 275, 'loss': 'mae', 'optimizer': 'adam', 'graph_mode': 'off', 'use_snp_selection': False}. Best is trial 22 with value: 0.13056895679760083.
[I 2025-11-03 12:10:17,732] Trial 107 finished with value: 0.10924638563094709 and parameters: {'model_type': 'gcn', 'hidden_dims': '[256, 128, 64]', 'dropout': 0.2889366468210582, 'batch_norm': True, 'lr': 0.0008561377127449032, 'weight_decay': 5.198050202572793e-06, 'epochs': 205, 'loss': 'mse', 'optimizer': 'adam', 'graph_mode': 'off', 'use_snp_selection': False}. Best is trial 22 with value: 0.13056895679760083.
[I 2025-11-03 12:10:18,815] Trial 108 finished with value: 0.09706216347680782 and parameters: {'model_type': 'gcn', 'hidden_dims': '[128, 64]', 'dropout': 0.3075532233596143, 'batch_norm': True, 'lr': 0.0007205532039083031, 'weight_decay': 1.3204605245912468e-05, 'epochs': 169, 'loss': 'mse', 'optimizer': 'adam', 'graph_mode': 'off', 'use_snp_selection': True, 'num_snps': 11322}. Best is trial 22 with value: 0.13056895679760083.
[I 2025-11-03 12:10:20,189] Trial 109 finished with value: 0.11342608282315478 and parameters: {'model_type': 'gcn', 'hidden_dims': '[128, 64]', 'dropout': 0.33059381464804377, 'batch_norm': True, 'lr': 0.0005645499486458283, 'weight_decay': 3.772199470292322e-07, 'epochs': 293, 'loss': 'mse', 'optimizer': 'adam', 'graph_mode': 'off', 'use_snp_selection': False}. Best is trial 22 with value: 0.13056895679760083.
[I 2025-11-03 12:10:22,582] Trial 110 finished with value: 0.11597066998225378 and parameters: {'model_type': 'gcn', 'hidden_dims': '[512, 256]', 'dropout': 0.34383946113297953, 'batch_norm': True, 'lr': 0.0004626800594756701, 'weight_decay': 1.4243797295242593e-06, 'epochs': 256, 'loss': 'mse', 'optimizer': 'adam', 'graph_mode': 'off', 'use_snp_selection': False}. Best is trial 22 with value: 0.13056895679760083.
[I 2025-11-03 12:10:24,783] Trial 111 finished with value: 0.10693621797150488 and parameters: {'model_type': 'gcn', 'hidden_dims': '[512, 128]', 'dropout': 0.390563807194533, 'batch_norm': True, 'lr': 0.00021487958637832146, 'weight_decay': 1.2031391577279904e-07, 'epochs': 220, 'loss': 'mse', 'optimizer': 'adam', 'graph_mode': 'off', 'use_snp_selection': False}. Best is trial 22 with value: 0.13056895679760083.
[I 2025-11-03 12:10:26,188] Trial 112 finished with value: 0.11310267612734395 and parameters: {'model_type': 'gcn', 'hidden_dims': '[128, 64]', 'dropout': 0.35865846004410645, 'batch_norm': True, 'lr': 0.00037733587007281416, 'weight_decay': 1.3063318121146393e-05, 'epochs': 305, 'loss': 'mse', 'optimizer': 'adam', 'graph_mode': 'off', 'use_snp_selection': False}. Best is trial 22 with value: 0.13056895679760083.
[I 2025-11-03 12:10:27,259] Trial 113 finished with value: 0.09827819647888376 and parameters: {'model_type': 'gcn', 'hidden_dims': '[128, 64]', 'dropout': 0.3712803647962533, 'batch_norm': True, 'lr': 6.35696049583747e-05, 'weight_decay': 1.0284539999734885e-06, 'epochs': 157, 'loss': 'mse', 'optimizer': 'adam', 'graph_mode': 'off', 'use_snp_selection': False}. Best is trial 22 with value: 0.13056895679760083.
[I 2025-11-03 12:10:29,283] Trial 114 finished with value: 0.12021437286455036 and parameters: {'model_type': 'gcn', 'hidden_dims': '[512, 256]', 'dropout': 0.1343975014947795, 'batch_norm': True, 'lr': 0.00031287743197915425, 'weight_decay': 1.4474397438387335e-07, 'epochs': 197, 'loss': 'mse', 'optimizer': 'adam', 'graph_mode': 'off', 'use_snp_selection': False}. Best is trial 22 with value: 0.13056895679760083.
[I 2025-11-03 12:10:30,845] Trial 115 finished with value: 0.12293642577259191 and parameters: {'model_type': 'gcn', 'hidden_dims': '[256, 128]', 'dropout': 0.33491350970630757, 'batch_norm': True, 'lr': 0.0007934579464377526, 'weight_decay': 1.986205524562336e-07, 'epochs': 227, 'loss': 'mse', 'optimizer': 'adam', 'graph_mode': 'off', 'use_snp_selection': False}. Best is trial 22 with value: 0.13056895679760083.
[I 2025-11-03 12:10:32,065] Trial 116 finished with value: 0.11712633433357898 and parameters: {'model_type': 'gcn', 'hidden_dims': '[128, 64]', 'dropout': 0.3146546033483118, 'batch_norm': True, 'lr': 0.0006239654351113879, 'weight_decay': 2.92783635419261e-05, 'epochs': 236, 'loss': 'mse', 'optimizer': 'adam', 'graph_mode': 'off', 'use_snp_selection': False}. Best is trial 22 with value: 0.13056895679760083.
[I 2025-11-03 12:10:34,934] Trial 117 finished with value: 0.10091584363466383 and parameters: {'model_type': 'gcn', 'hidden_dims': '[512, 64]', 'dropout': 0.16285330677081944, 'batch_norm': False, 'lr': 0.00014778401046686604, 'weight_decay': 8.544751079382602e-06, 'epochs': 320, 'loss': 'mse', 'optimizer': 'adam', 'graph_mode': 'off', 'use_snp_selection': False}. Best is trial 22 with value: 0.13056895679760083.
[I 2025-11-03 12:10:37,280] Trial 118 finished with value: 0.023049534717775728 and parameters: {'model_type': 'gcn', 'hidden_dims': '[512, 128]', 'dropout': 0.2991408990806062, 'batch_norm': True, 'lr': 2.978180605979617e-06, 'weight_decay': 1.0221218335761833e-07, 'epochs': 246, 'loss': 'mse', 'optimizer': 'adam', 'graph_mode': 'off', 'use_snp_selection': False}. Best is trial 22 with value: 0.13056895679760083.
[I 2025-11-03 12:10:38,412] Trial 119 finished with value: 0.0944909023954412 and parameters: {'model_type': 'gcn', 'hidden_dims': '[128, 64]', 'dropout': 0.4412174768196113, 'batch_norm': True, 'lr': 0.00017333436579654266, 'weight_decay': 7.573792786232308e-07, 'epochs': 188, 'loss': 'mae', 'optimizer': 'adam', 'graph_mode': 'off', 'use_snp_selection': False}. Best is trial 22 with value: 0.13056895679760083.
[I 2025-11-03 12:10:40,884] Trial 120 finished with value: 0.03810646542108087 and parameters: {'model_type': 'gcn', 'hidden_dims': '[512, 256]', 'dropout': 0.2238619978625431, 'batch_norm': True, 'lr': 1.046914909953278e-05, 'weight_decay': 3.1391285405803167e-07, 'epochs': 265, 'loss': 'mse', 'optimizer': 'adam', 'graph_mode': 'off', 'use_snp_selection': False}. Best is trial 22 with value: 0.13056895679760083.
[I 2025-11-03 12:10:42,447] Trial 121 finished with value: 0.12042779988042852 and parameters: {'model_type': 'gcn', 'hidden_dims': '[256, 128]', 'dropout': 0.3355265252009948, 'batch_norm': True, 'lr': 0.000781984055437045, 'weight_decay': 2.273557607317774e-07, 'epochs': 231, 'loss': 'mse', 'optimizer': 'adam', 'graph_mode': 'off', 'use_snp_selection': False}. Best is trial 22 with value: 0.13056895679760083.
[I 2025-11-03 12:10:44,007] Trial 122 finished with value: 0.11222630760465575 and parameters: {'model_type': 'gcn', 'hidden_dims': '[256, 128]', 'dropout': 0.3561744370540225, 'batch_norm': True, 'lr': 0.0008815264202265094, 'weight_decay': 1.7019137600455236e-07, 'epochs': 227, 'loss': 'mse', 'optimizer': 'adam', 'graph_mode': 'off', 'use_snp_selection': False}. Best is trial 22 with value: 0.13056895679760083.
[I 2025-11-03 12:10:45,524] Trial 123 finished with value: 0.11244710364398726 and parameters: {'model_type': 'gcn', 'hidden_dims': '[256, 128]', 'dropout': 0.3249885780761338, 'batch_norm': True, 'lr': 0.0005460841048452629, 'weight_decay': 1.9624551267415728e-07, 'epochs': 218, 'loss': 'mse', 'optimizer': 'adam', 'graph_mode': 'off', 'use_snp_selection': False}. Best is trial 22 with value: 0.13056895679760083.
[I 2025-11-03 12:10:47,337] Trial 124 finished with value: 0.11569910040764489 and parameters: {'model_type': 'gcn', 'hidden_dims': '[256, 128]', 'dropout': 0.33953053766986596, 'batch_norm': True, 'lr': 0.0007401970622160038, 'weight_decay': 1.4479479473852828e-07, 'epochs': 286, 'loss': 'mse', 'optimizer': 'adam', 'graph_mode': 'off', 'use_snp_selection': False}. Best is trial 22 with value: 0.13056895679760083.
[I 2025-11-03 12:10:48,961] Trial 125 finished with value: 0.12014718909220148 and parameters: {'model_type': 'gcn', 'hidden_dims': '[256, 128]', 'dropout': 0.2737569168817053, 'batch_norm': True, 'lr': 0.000988331943622733, 'weight_decay': 2.681947418080986e-07, 'epochs': 243, 'loss': 'mse', 'optimizer': 'adam', 'graph_mode': 'off', 'use_snp_selection': False}. Best is trial 22 with value: 0.13056895679760083.
[I 2025-11-03 12:10:50,086] Trial 126 finished with value: 0.09989339883397115 and parameters: {'model_type': 'gcn', 'hidden_dims': '[128, 64]', 'dropout': 0.5437196642319234, 'batch_norm': True, 'lr': 0.00042052009905605775, 'weight_decay': 1.9784837595195934e-07, 'epochs': 210, 'loss': 'mse', 'optimizer': 'adam', 'graph_mode': 'off', 'use_snp_selection': False}. Best is trial 22 with value: 0.13056895679760083.
[I 2025-11-03 12:10:51,407] Trial 127 finished with value: 0.11734828925657013 and parameters: {'model_type': 'gcn', 'hidden_dims': '[128, 64]', 'dropout': 0.35299311715868875, 'batch_norm': True, 'lr': 0.000645728315873658, 'weight_decay': 1.2614829042273664e-07, 'epochs': 272, 'loss': 'mse', 'optimizer': 'adam', 'graph_mode': 'off', 'use_snp_selection': False}. Best is trial 22 with value: 0.13056895679760083.
[I 2025-11-03 12:10:54,053] Trial 128 finished with value: 0.11422637663186114 and parameters: {'model_type': 'gcn', 'hidden_dims': '[256, 128, 64]', 'dropout': 0.20863293438100233, 'batch_norm': True, 'lr': 0.0005044128358914228, 'weight_decay': 3.4010654724646066e-07, 'epochs': 238, 'loss': 'mse', 'optimizer': 'adam', 'graph_mode': 'off', 'use_snp_selection': True, 'num_snps': 51726}. Best is trial 22 with value: 0.13056895679760083.
