[I 2025-10-23 19:58:54,078] Trial 94 finished with value: 0.2240428874314762 and parameters: {'model_type': 'gat', 'hidden_dims': '[256, 128]', 'dropout': 0.5484654639917665, 'batch_norm': True, 'gat_heads': 6, 'gat_attn_dropout': 0.5672744327142585, 'gat_concat_hidden': True, 'lr': 0.00016375185865733858, 'weight_decay': 3.3428545363317604e-06, 'epochs': 161, 'loss': 'mae', 'optimizer': 'adam', 'graph_mode': 'cutoff', 'cutoff': 0.7973154034519115, 'grm_norm': 'cosine_then_gcn', 'self_loops': False}. Best is trial 91 with value: 0.2392540303115429.
[I 2025-10-23 20:01:37,050] Trial 95 finished with value: 0.1802012451354636 and parameters: {'model_type': 'gat', 'hidden_dims': '[256, 128]', 'dropout': 0.5368994247017642, 'batch_norm': True, 'gat_heads': 7, 'gat_attn_dropout': 0.5349706447385109, 'gat_concat_hidden': True, 'lr': 0.0001993664739529259, 'weight_decay': 6.480591565632667e-07, 'epochs': 140, 'loss': 'mae', 'optimizer': 'adam', 'graph_mode': 'cutoff', 'cutoff': 0.3327060522544292, 'grm_norm': 'cosine_then_gcn', 'self_loops': False}. Best is trial 91 with value: 0.2392540303115429.
[I 2025-10-23 20:03:33,445] Trial 96 finished with value: 0.2187323871439161 and parameters: {'model_type': 'gat', 'hidden_dims': '[256, 128]', 'dropout': 0.5549297482447051, 'batch_norm': True, 'gat_heads': 7, 'gat_attn_dropout': 0.5990731301048932, 'gat_concat_hidden': False, 'lr': 0.00035594843130254405, 'weight_decay': 2.5918230329889525e-06, 'epochs': 101, 'loss': 'mae', 'optimizer': 'adam', 'graph_mode': 'cutoff', 'cutoff': 0.7510535860143992, 'grm_norm': 'cosine_then_gcn', 'self_loops': False}. Best is trial 91 with value: 0.2392540303115429.
[I 2025-10-23 20:09:37,511] Trial 97 finished with value: 0.21800512023271343 and parameters: {'model_type': 'gat', 'hidden_dims': '[512, 64]', 'dropout': 0.5283870312152797, 'batch_norm': True, 'gat_heads': 7, 'gat_attn_dropout': 0.5518232890077996, 'gat_concat_hidden': True, 'lr': 0.00016401773664844529, 'weight_decay': 9.663607923645262e-07, 'epochs': 167, 'loss': 'mae', 'optimizer': 'adam', 'graph_mode': 'cutoff', 'cutoff': 0.7106869961048987, 'grm_norm': 'cosine_then_gcn', 'self_loops': False}. Best is trial 91 with value: 0.2392540303115429.
[I 2025-10-23 20:11:47,588] Trial 98 finished with value: 0.1458096660223039 and parameters: {'model_type': 'gat', 'hidden_dims': '[256, 128]', 'dropout': 0.5917677267700086, 'batch_norm': True, 'gat_heads': 6, 'gat_attn_dropout': 0.5840775265829358, 'gat_concat_hidden': True, 'lr': 0.00044927586292281877, 'weight_decay': 1.6410430954133523e-06, 'epochs': 127, 'loss': 'mae', 'optimizer': 'adam', 'graph_mode': 'knn', 'source': 'grm', 'knn_k': 7, 'weighted_edges': False, 'symmetrize_mode': 'union'}. Best is trial 91 with value: 0.2392540303115429.
[I 2025-10-23 20:16:18,203] Trial 99 finished with value: 0.2135784692624906 and parameters: {'model_type': 'gat', 'hidden_dims': '[512, 128]', 'dropout': 0.4708092297835862, 'batch_norm': True, 'gat_heads': 7, 'gat_attn_dropout': 0.3696912709693865, 'gat_concat_hidden': True, 'lr': 0.00021571601551323265, 'weight_decay': 9.786573640562538e-07, 'epochs': 119, 'loss': 'mae', 'optimizer': 'adam', 'graph_mode': 'cutoff', 'cutoff': 0.8200862427229241, 'grm_norm': 'cosine_then_gcn', 'self_loops': False}. Best is trial 91 with value: 0.2392540303115429.
[I 2025-10-23 20:17:51,495] Trial 100 finished with value: 0.22985797730109034 and parameters: {'model_type': 'gat', 'hidden_dims': '[256, 128, 64]', 'dropout': 0.5752896081623873, 'batch_norm': True, 'gat_heads': 7, 'gat_attn_dropout': 0.47101764177957345, 'gat_concat_hidden': True, 'lr': 0.0002642853541884421, 'weight_decay': 7.303707281044186e-07, 'epochs': 75, 'loss': 'mae', 'optimizer': 'adam', 'graph_mode': 'cutoff', 'cutoff': 0.8730866691123841, 'grm_norm': 'cosine_then_gcn', 'self_loops': False}. Best is trial 91 with value: 0.2392540303115429.
[I 2025-10-23 20:20:35,327] Trial 101 finished with value: 0.23777909608446582 and parameters: {'model_type': 'gat', 'hidden_dims': '[256, 128, 64]', 'dropout': 0.5725291963532197, 'batch_norm': True, 'gat_heads': 7, 'gat_attn_dropout': 0.5699609899936886, 'gat_concat_hidden': True, 'lr': 0.0002643262449372926, 'weight_decay': 1.4373468943020876e-06, 'epochs': 143, 'loss': 'mae', 'optimizer': 'adam', 'graph_mode': 'cutoff', 'cutoff': 0.8753201434094924, 'grm_norm': 'cosine_then_gcn', 'self_loops': False}. Best is trial 91 with value: 0.2392540303115429.
[I 2025-10-23 20:22:01,354] Trial 102 finished with value: 0.23594232433473228 and parameters: {'model_type': 'gat', 'hidden_dims': '[256, 128, 64]', 'dropout': 0.5721056711343473, 'batch_norm': True, 'gat_heads': 7, 'gat_attn_dropout': 0.46710052348594355, 'gat_concat_hidden': True, 'lr': 0.00028479527721114847, 'weight_decay': 7.913032769801479e-07, 'epochs': 68, 'loss': 'mae', 'optimizer': 'adam', 'graph_mode': 'cutoff', 'cutoff': 0.8756293508541578, 'grm_norm': 'cosine_then_gcn', 'self_loops': False}. Best is trial 91 with value: 0.2392540303115429.
[I 2025-10-23 20:23:53,259] Trial 103 finished with value: 0.2150029371035965 and parameters: {'model_type': 'gat', 'hidden_dims': '[256, 128, 64]', 'dropout': 0.57401041646387, 'batch_norm': True, 'gat_heads': 7, 'gat_attn_dropout': 0.4653312339936903, 'gat_concat_hidden': True, 'lr': 0.00029180020576581383, 'weight_decay': 6.98817796321912e-07, 'epochs': 93, 'loss': 'mae', 'optimizer': 'adam', 'graph_mode': 'cutoff', 'cutoff': 0.8753688679107092, 'grm_norm': 'cosine_then_gcn', 'self_loops': False}. Best is trial 91 with value: 0.2392540303115429.
[I 2025-10-23 20:25:03,273] Trial 104 finished with value: 0.21896632367297078 and parameters: {'model_type': 'gat', 'hidden_dims': '[256, 128, 64]', 'dropout': 0.5901354298471969, 'batch_norm': True, 'gat_heads': 6, 'gat_attn_dropout': 0.4936868953516787, 'gat_concat_hidden': True, 'lr': 0.0003507225730245869, 'weight_decay': 1.342533210690405e-06, 'epochs': 64, 'loss': 'mae', 'optimizer': 'adam', 'graph_mode': 'cutoff', 'cutoff': 0.883228403276853, 'grm_norm': 'cosine_then_gcn', 'self_loops': False}. Best is trial 91 with value: 0.2392540303115429.
[I 2025-10-23 20:26:25,163] Trial 105 finished with value: 0.21230943244933337 and parameters: {'model_type': 'gat', 'hidden_dims': '[256, 128, 64]', 'dropout': 0.5994437117794942, 'batch_norm': True, 'gat_heads': 7, 'gat_attn_dropout': 0.5274962716544267, 'gat_concat_hidden': True, 'lr': 0.00025708143312083297, 'weight_decay': 5.857280088539367e-07, 'epochs': 64, 'loss': 'mae', 'optimizer': 'adam', 'graph_mode': 'cutoff', 'cutoff': 0.8705247748190837, 'grm_norm': 'cosine_then_gcn', 'self_loops': False}. Best is trial 91 with value: 0.2392540303115429.
[I 2025-10-23 20:27:58,575] Trial 106 finished with value: 0.22351238886345354 and parameters: {'model_type': 'gat', 'hidden_dims': '[256, 128, 64]', 'dropout': 0.5672713840399738, 'batch_norm': True, 'gat_heads': 7, 'gat_attn_dropout': 0.42022459888557373, 'gat_concat_hidden': True, 'lr': 0.0003222868037025686, 'weight_decay': 0.0005056077286899228, 'epochs': 75, 'loss': 'mae', 'optimizer': 'adam', 'graph_mode': 'cutoff', 'cutoff': 0.8998426305439449, 'grm_norm': 'cosine_then_gcn', 'self_loops': False}. Best is trial 91 with value: 0.2392540303115429.
[I 2025-10-23 20:30:08,291] Trial 107 finished with value: 0.22121827454599968 and parameters: {'model_type': 'gat', 'hidden_dims': '[256, 128, 64]', 'dropout': 0.5774833974952673, 'batch_norm': True, 'gat_heads': 7, 'gat_attn_dropout': 0.4293537246906139, 'gat_concat_hidden': True, 'lr': 0.0006120602772505407, 'weight_decay': 8.117615749977197e-07, 'epochs': 110, 'loss': 'mae', 'optimizer': 'adam', 'graph_mode': 'cutoff', 'cutoff': 0.8675902401255181, 'grm_norm': 'cosine_then_gcn', 'self_loops': False}. Best is trial 91 with value: 0.2392540303115429.
[I 2025-10-23 20:30:37,437] Trial 108 finished with value: 0.08225950281726457 and parameters: {'model_type': 'gat', 'hidden_dims': '[256, 128, 64]', 'dropout': 0.5534846955298229, 'batch_norm': True, 'gat_heads': 1, 'gat_attn_dropout': 0.5731092476523204, 'gat_concat_hidden': True, 'lr': 0.0005074175586473675, 'weight_decay': 4.991403157687262e-07, 'epochs': 130, 'loss': 'mae', 'optimizer': 'adam', 'graph_mode': 'cutoff', 'cutoff': 0.8327402054815899, 'grm_norm': 'cosine_then_gcn', 'self_loops': False}. Best is trial 91 with value: 0.2392540303115429.
[I 2025-10-23 20:33:27,620] Trial 109 finished with value: 0.2071370943341296 and parameters: {'model_type': 'gat', 'hidden_dims': '[256, 128, 64]', 'dropout': 0.5819357322512538, 'batch_norm': True, 'gat_heads': 6, 'gat_attn_dropout': 0.5458764866556188, 'gat_concat_hidden': True, 'lr': 0.00026719165705837614, 'weight_decay': 4.389684102755899e-07, 'epochs': 177, 'loss': 'mae', 'optimizer': 'adam', 'graph_mode': 'cutoff', 'cutoff': 0.8800788450910959, 'grm_norm': 'cosine_then_gcn', 'self_loops': False}. Best is trial 91 with value: 0.2392540303115429.
[I 2025-10-23 20:34:29,753] Trial 110 finished with value: 0.22739133668740513 and parameters: {'model_type': 'gat', 'hidden_dims': '[256, 128, 64]', 'dropout': 0.5641228923205772, 'batch_norm': True, 'gat_heads': 7, 'gat_attn_dropout': 0.5140155438675463, 'gat_concat_hidden': True, 'lr': 0.0003929145670115214, 'weight_decay': 7.421757627085492e-07, 'epochs': 45, 'loss': 'mae', 'optimizer': 'adam', 'graph_mode': 'cutoff', 'cutoff': 0.7764303244941129, 'grm_norm': 'cosine_then_gcn', 'self_loops': False}. Best is trial 91 with value: 0.2392540303115429.
[I 2025-10-23 20:37:18,681] Trial 111 finished with value: 0.2087677551883549 and parameters: {'model_type': 'gat', 'hidden_dims': '[256, 128, 64]', 'dropout': 0.3980370578291786, 'batch_norm': True, 'gat_heads': 7, 'gat_attn_dropout': 0.5652840726227024, 'gat_concat_hidden': True, 'lr': 0.000215737931984757, 'weight_decay': 2.1735977453247825e-06, 'epochs': 148, 'loss': 'mae', 'optimizer': 'adam', 'graph_mode': 'cutoff', 'cutoff': 0.8108493059220195, 'grm_norm': 'cosine_then_gcn', 'self_loops': False}. Best is trial 91 with value: 0.2392540303115429.
[I 2025-10-23 20:40:15,732] Trial 112 finished with value: 0.2352330630265067 and parameters: {'model_type': 'gat', 'hidden_dims': '[512, 128]', 'dropout': 0.5106358865426632, 'batch_norm': True, 'gat_heads': 7, 'gat_attn_dropout': 0.480788549839257, 'gat_concat_hidden': True, 'lr': 0.00018774477440339316, 'weight_decay': 4.2430031230275416e-06, 'epochs': 73, 'loss': 'mae', 'optimizer': 'adam', 'graph_mode': 'cutoff', 'cutoff': 0.8998579289426424, 'grm_norm': 'cosine_then_gcn', 'self_loops': False}. Best is trial 91 with value: 0.2392540303115429.
[I 2025-10-23 20:41:48,903] Trial 113 finished with value: 0.2147319757930799 and parameters: {'model_type': 'gat', 'hidden_dims': '[256, 128, 64]', 'dropout': 0.5923113603790735, 'batch_norm': True, 'gat_heads': 7, 'gat_attn_dropout': 0.4802577693266165, 'gat_concat_hidden': True, 'lr': 0.00018376437358233293, 'weight_decay': 1.0940631352365302e-06, 'epochs': 75, 'loss': 'mae', 'optimizer': 'adam', 'graph_mode': 'cutoff', 'cutoff': 0.8609853662781781, 'grm_norm': 'cosine_then_gcn', 'self_loops': False}. Best is trial 91 with value: 0.2392540303115429.
[I 2025-10-23 20:44:11,681] Trial 114 finished with value: 0.24059397362953808 and parameters: {'model_type': 'gat', 'hidden_dims': '[512, 128]', 'dropout': 0.5740844111121115, 'batch_norm': True, 'gat_heads': 7, 'gat_attn_dropout': 0.43515211114740876, 'gat_concat_hidden': True, 'lr': 0.00023409860578564072, 'weight_decay': 3.881236241680035e-06, 'epochs': 56, 'loss': 'mae', 'optimizer': 'adam', 'graph_mode': 'cutoff', 'cutoff': 0.8985863023989842, 'grm_norm': 'cosine_then_gcn', 'self_loops': False}. Best is trial 114 with value: 0.24059397362953808.
[I 2025-10-23 20:48:41,896] Trial 115 finished with value: 0.23260292433746993 and parameters: {'model_type': 'gat', 'hidden_dims': '[512, 128]', 'dropout': 0.5586345528793841, 'batch_norm': True, 'gat_heads': 7, 'gat_attn_dropout': 0.4583701575158255, 'gat_concat_hidden': True, 'lr': 0.00022827713533819232, 'weight_decay': 5.803636323040213e-06, 'epochs': 119, 'loss': 'mae', 'optimizer': 'adam', 'graph_mode': 'cutoff', 'cutoff': 0.8962592204806338, 'grm_norm': 'cosine_then_gcn', 'self_loops': False}. Best is trial 114 with value: 0.24059397362953808.
[I 2025-10-23 20:50:44,073] Trial 116 finished with value: 0.19474929253511963 and parameters: {'model_type': 'gat', 'hidden_dims': '[512, 128]', 'dropout': 0.5096907272811819, 'batch_norm': True, 'gat_heads': 6, 'gat_attn_dropout': 0.4391058447578153, 'gat_concat_hidden': False, 'lr': 0.00022538503616081012, 'weight_decay': 9.77361803077353e-06, 'epochs': 57, 'loss': 'mae', 'optimizer': 'adam', 'graph_mode': 'cutoff', 'cutoff': 0.8987747583802739, 'grm_norm': 'cosine_then_gcn', 'self_loops': False}. Best is trial 114 with value: 0.24059397362953808.
[I 2025-10-23 20:54:21,778] Trial 117 finished with value: 0.22986996219245054 and parameters: {'model_type': 'gat', 'hidden_dims': '[512, 128]', 'dropout': 0.5361003001933988, 'batch_norm': True, 'gat_heads': 7, 'gat_attn_dropout': 0.4551067356863661, 'gat_concat_hidden': True, 'lr': 0.0004363902063570649, 'weight_decay': 4.904814267484454e-06, 'epochs': 93, 'loss': 'mae', 'optimizer': 'adam', 'graph_mode': 'cutoff', 'cutoff': 0.8864892453788629, 'grm_norm': 'cosine_then_gcn', 'self_loops': False}. Best is trial 114 with value: 0.24059397362953808.
[I 2025-10-23 20:59:23,090] Trial 118 finished with value: 0.19952412519105983 and parameters: {'model_type': 'gat', 'hidden_dims': '[512, 128]', 'dropout': 0.5573365192073992, 'batch_norm': True, 'gat_heads': 7, 'gat_attn_dropout': 0.43926543763479714, 'gat_concat_hidden': True, 'lr': 0.00030212482816363155, 'weight_decay': 3.932624760275699e-06, 'epochs': 133, 'loss': 'mae', 'optimizer': 'adam', 'graph_mode': 'knn', 'source': 'grm', 'knn_k': 2, 'weighted_edges': True, 'symmetrize_mode': 'mutual'}. Best is trial 114 with value: 0.24059397362953808.
[I 2025-10-23 21:03:19,615] Trial 119 finished with value: 0.2320179166436584 and parameters: {'model_type': 'gat', 'hidden_dims': '[512, 128]', 'dropout': 0.5227050975879673, 'batch_norm': True, 'gat_heads': 6, 'gat_attn_dropout': 0.4914318034531838, 'gat_concat_hidden': True, 'lr': 0.00020826210269366446, 'weight_decay': 4.12937884540219e-06, 'epochs': 122, 'loss': 'mae', 'optimizer': 'adam', 'graph_mode': 'cutoff', 'cutoff': 0.8499934768059799, 'grm_norm': 'cosine_then_gcn', 'self_loops': False}. Best is trial 114 with value: 0.24059397362953808.
[I 2025-10-23 21:06:24,561] Trial 120 finished with value: 0.21650906361725442 and parameters: {'model_type': 'gat', 'hidden_dims': '[512, 64]', 'dropout': 0.5265512397490123, 'batch_norm': True, 'gat_heads': 5, 'gat_attn_dropout': 0.49054433966005934, 'gat_concat_hidden': True, 'lr': 0.00034665167122625, 'weight_decay': 6.575718751364267e-06, 'epochs': 111, 'loss': 'mae', 'optimizer': 'adam', 'graph_mode': 'cutoff', 'cutoff': 0.8460994058246472, 'grm_norm': 'cosine_then_gcn', 'self_loops': False}. Best is trial 114 with value: 0.24059397362953808.
[I 2025-10-23 21:10:59,579] Trial 121 finished with value: 0.22424171127812467 and parameters: {'model_type': 'gat', 'hidden_dims': '[512, 128]', 'dropout': 0.48702763685150463, 'batch_norm': True, 'gat_heads': 6, 'gat_attn_dropout': 0.40017477536905033, 'gat_concat_hidden': True, 'lr': 0.0001941148239825839, 'weight_decay': 3.790633551683679e-06, 'epochs': 144, 'loss': 'mae', 'optimizer': 'adam', 'graph_mode': 'cutoff', 'cutoff': 0.8575449725055745, 'grm_norm': 'cosine_then_gcn', 'self_loops': False}. Best is trial 114 with value: 0.24059397362953808.
[I 2025-10-23 21:15:37,866] Trial 122 finished with value: 0.2282750955875569 and parameters: {'model_type': 'gat', 'hidden_dims': '[512, 128]', 'dropout': 0.5668732734694232, 'batch_norm': True, 'gat_heads': 7, 'gat_attn_dropout': 0.4834984885412417, 'gat_concat_hidden': True, 'lr': 0.00024126066835968368, 'weight_decay': 5.500934136601701e-06, 'epochs': 123, 'loss': 'mae', 'optimizer': 'adam', 'graph_mode': 'cutoff', 'cutoff': 0.8874079449193435, 'grm_norm': 'cosine_then_gcn', 'self_loops': False}. Best is trial 114 with value: 0.24059397362953808.
[I 2025-10-23 21:19:29,175] Trial 123 finished with value: 0.20937448678963788 and parameters: {'model_type': 'gat', 'hidden_dims': '[512, 128]', 'dropout': 0.5492103371925751, 'batch_norm': True, 'gat_heads': 6, 'gat_attn_dropout': 0.45822474341728475, 'gat_concat_hidden': True, 'lr': 0.00014922330991396055, 'weight_decay': 2.9973614121358726e-06, 'epochs': 119, 'loss': 'mae', 'optimizer': 'adam', 'graph_mode': 'cutoff', 'cutoff': 0.8971670705147726, 'grm_norm': 'cosine_then_gcn', 'self_loops': False}. Best is trial 114 with value: 0.24059397362953808.
[I 2025-10-23 21:21:37,860] Trial 124 finished with value: 0.23919950387684716 and parameters: {'model_type': 'gat', 'hidden_dims': '[512, 128]', 'dropout': 0.5375413488969184, 'batch_norm': True, 'gat_heads': 7, 'gat_attn_dropout': 0.5029273184110099, 'gat_concat_hidden': True, 'lr': 0.00011163194813167753, 'weight_decay': 9.755372079259986e-06, 'epochs': 49, 'loss': 'mae', 'optimizer': 'adam', 'graph_mode': 'cutoff', 'cutoff': 0.8498483565287225, 'grm_norm': 'cosine_then_gcn', 'self_loops': False}. Best is trial 114 with value: 0.24059397362953808.
[I 2025-10-23 21:23:48,474] Trial 125 finished with value: 0.22888077276716906 and parameters: {'model_type': 'gat', 'hidden_dims': '[512, 128]', 'dropout': 0.513829974126565, 'batch_norm': True, 'gat_heads': 7, 'gat_attn_dropout': 0.5003047416951751, 'gat_concat_hidden': True, 'lr': 0.00010916530113717841, 'weight_decay': 8.249029899263888e-06, 'epochs': 50, 'loss': 'mae', 'optimizer': 'adam', 'graph_mode': 'cutoff', 'cutoff': 0.8478089999243491, 'grm_norm': 'cosine_then_gcn', 'self_loops': False}. Best is trial 114 with value: 0.24059397362953808.
[I 2025-10-23 21:26:27,420] Trial 126 finished with value: 0.24692329289560697 and parameters: {'model_type': 'gat', 'hidden_dims': '[512, 128]', 'dropout': 0.5341530112632655, 'batch_norm': True, 'gat_heads': 7, 'gat_attn_dropout': 0.5047068868434943, 'gat_concat_hidden': True, 'lr': 0.00013824172151610426, 'weight_decay': 1.477629161424905e-05, 'epochs': 64, 'loss': 'mae', 'optimizer': 'adam', 'graph_mode': 'cutoff', 'cutoff': 0.8331919103998704, 'grm_norm': 'cosine_then_gcn', 'self_loops': False}. Best is trial 126 with value: 0.24692329289560697.
[I 2025-10-23 21:28:52,299] Trial 127 finished with value: 0.23538573696911103 and parameters: {'model_type': 'gat', 'hidden_dims': '[512, 128]', 'dropout': 0.5370593777466923, 'batch_norm': True, 'gat_heads': 7, 'gat_attn_dropout': 0.5071096719516013, 'gat_concat_hidden': True, 'lr': 0.00013897248303274072, 'weight_decay': 2.1205748139750313e-05, 'epochs': 57, 'loss': 'mae', 'optimizer': 'adam', 'graph_mode': 'cutoff', 'cutoff': 0.828797230013307, 'grm_norm': 'cosine_then_gcn', 'self_loops': False}. Best is trial 126 with value: 0.24692329289560697.
[I 2025-10-23 21:31:14,961] Trial 128 finished with value: 0.2341071426650904 and parameters: {'model_type': 'gat', 'hidden_dims': '[512, 128]', 'dropout': 0.5367152932039465, 'batch_norm': True, 'gat_heads': 7, 'gat_attn_dropout': 0.5083537741340719, 'gat_concat_hidden': True, 'lr': 0.00013297460961050694, 'weight_decay': 1.5658872769327954e-05, 'epochs': 56, 'loss': 'mae', 'optimizer': 'adam', 'graph_mode': 'cutoff', 'cutoff': 0.826068954665096, 'grm_norm': 'cosine_then_gcn', 'self_loops': False}. Best is trial 126 with value: 0.24692329289560697.
[I 2025-10-23 21:33:37,690] Trial 129 finished with value: 0.23086170778266463 and parameters: {'model_type': 'gat', 'hidden_dims': '[512, 128]', 'dropout': 0.5378567532832927, 'batch_norm': True, 'gat_heads': 7, 'gat_attn_dropout': 0.507037655779043, 'gat_concat_hidden': True, 'lr': 0.0001274547694848574, 'weight_decay': 1.7240552198411607e-05, 'epochs': 56, 'loss': 'mae', 'optimizer': 'adam', 'graph_mode': 'cutoff', 'cutoff': 0.8299315643787342, 'grm_norm': 'cosine_then_gcn', 'self_loops': False}. Best is trial 126 with value: 0.24692329289560697.
[I 2025-10-23 21:36:24,787] Trial 130 finished with value: 0.21524653441315778 and parameters: {'model_type': 'gat', 'hidden_dims': '[512, 128]', 'dropout': 0.5439307454774188, 'batch_norm': True, 'gat_heads': 7, 'gat_attn_dropout': 0.5274908309131134, 'gat_concat_hidden': True, 'lr': 0.00010650263336106737, 'weight_decay': 4.706534482367389e-05, 'epochs': 68, 'loss': 'mae', 'optimizer': 'adam', 'graph_mode': 'cutoff', 'cutoff': 0.8251005492674763, 'grm_norm': 'cosine_then_gcn', 'self_loops': False}. Best is trial 126 with value: 0.24692329289560697.
[I 2025-10-23 21:38:29,472] Trial 131 finished with value: 0.24484400771413398 and parameters: {'model_type': 'gat', 'hidden_dims': '[512, 128]', 'dropout': 0.4972481413711268, 'batch_norm': True, 'gat_heads': 7, 'gat_attn_dropout': 0.5057260316944621, 'gat_concat_hidden': True, 'lr': 0.0001513363189516323, 'weight_decay': 2.177690287916801e-05, 'epochs': 47, 'loss': 'mae', 'optimizer': 'adam', 'graph_mode': 'cutoff', 'cutoff': 0.8644895787069419, 'grm_norm': 'cosine_then_gcn', 'self_loops': False}. Best is trial 126 with value: 0.24692329289560697.
[I 2025-10-23 21:40:34,120] Trial 132 finished with value: 0.22600459833796357 and parameters: {'model_type': 'gat', 'hidden_dims': '[512, 128]', 'dropout': 0.5004457472935748, 'batch_norm': True, 'gat_heads': 7, 'gat_attn_dropout': 0.5147320326873929, 'gat_concat_hidden': True, 'lr': 0.0001581372532061133, 'weight_decay': 2.9548560244591603e-05, 'epochs': 47, 'loss': 'mae', 'optimizer': 'adam', 'graph_mode': 'cutoff', 'cutoff': 0.866322685198145, 'grm_norm': 'cosine_then_gcn', 'self_loops': False}. Best is trial 126 with value: 0.24692329289560697.
