[I 2025-11-03 12:08:36,588] Trial 130 finished with value: 0.016829253482755012 and parameters: {'model_type': 'graphsage', 'hidden_dims': '[256, 128]', 'dropout': 0.23435156617453087, 'batch_norm': True, 'lr': 2.4933812938940465e-05, 'weight_decay': 3.8134001270748076e-07, 'epochs': 78, 'loss': 'mse', 'optimizer': 'adam', 'graph_mode': 'cutoff', 'cutoff': 0.5498348923135927, 'grm_norm': 'cosine', 'self_loops': True, 'use_snp_selection': False}. Best is trial 77 with value: 0.08732210053952931.
[I 2025-11-03 12:08:39,762] Trial 131 finished with value: 0.06282605389361708 and parameters: {'model_type': 'graphsage', 'hidden_dims': '[256, 128]', 'dropout': 0.259594973151303, 'batch_norm': True, 'lr': 0.0005885661244056265, 'weight_decay': 9.726506050032123e-07, 'epochs': 335, 'loss': 'mse', 'optimizer': 'adam', 'graph_mode': 'cutoff', 'cutoff': 0.4698443158153572, 'grm_norm': 'gcn', 'self_loops': False, 'use_snp_selection': False}. Best is trial 77 with value: 0.08732210053952931.
[I 2025-11-03 12:08:42,954] Trial 132 finished with value: 0.061726625907593084 and parameters: {'model_type': 'graphsage', 'hidden_dims': '[256, 128]', 'dropout': 0.29895956281979597, 'batch_norm': True, 'lr': 0.0007974579424709814, 'weight_decay': 5.645576150592061e-07, 'epochs': 338, 'loss': 'mse', 'optimizer': 'adam', 'graph_mode': 'cutoff', 'cutoff': 0.4312863891230029, 'grm_norm': 'gcn', 'self_loops': False, 'use_snp_selection': False}. Best is trial 77 with value: 0.08732210053952931.
[I 2025-11-03 12:08:46,207] Trial 133 finished with value: 0.054819637655168646 and parameters: {'model_type': 'graphsage', 'hidden_dims': '[256, 128]', 'dropout': 0.2700440460879554, 'batch_norm': True, 'lr': 0.0005198971390419067, 'weight_decay': 7.383866938185015e-07, 'epochs': 350, 'loss': 'mse', 'optimizer': 'adam', 'graph_mode': 'cutoff', 'cutoff': 0.4540547217289665, 'grm_norm': 'gcn', 'self_loops': False, 'use_snp_selection': False}. Best is trial 77 with value: 0.08732210053952931.
[I 2025-11-03 12:08:48,523] Trial 134 finished with value: 0.040350290898202704 and parameters: {'model_type': 'graphsage', 'hidden_dims': '[128, 64]', 'dropout': 0.20839917685216325, 'batch_norm': True, 'lr': 0.0006969300063626746, 'weight_decay': 8.378600875724684e-07, 'epochs': 301, 'loss': 'mse', 'optimizer': 'adam', 'graph_mode': 'cutoff', 'cutoff': 0.29349109610018165, 'grm_norm': 'gcn', 'self_loops': False, 'use_snp_selection': False}. Best is trial 77 with value: 0.08732210053952931.
[I 2025-11-03 12:08:50,715] Trial 135 finished with value: 0.04689815023252096 and parameters: {'model_type': 'graphsage', 'hidden_dims': '[128, 64]', 'dropout': 0.19380258005007658, 'batch_norm': True, 'lr': 0.0004111710072884135, 'weight_decay': 3.395383933627224e-05, 'epochs': 274, 'loss': 'mse', 'optimizer': 'adam', 'graph_mode': 'cutoff', 'cutoff': 0.6047683135363566, 'grm_norm': 'gcn', 'self_loops': False, 'use_snp_selection': False}. Best is trial 77 with value: 0.08732210053952931.
[I 2025-11-03 12:08:55,407] Trial 136 finished with value: 0.061995051428017506 and parameters: {'model_type': 'graphsage', 'hidden_dims': '[512, 64]', 'dropout': 0.2470144383418792, 'batch_norm': True, 'lr': 0.0005750441792140978, 'weight_decay': 1.1254512382941887e-06, 'epochs': 283, 'loss': 'mse', 'optimizer': 'adam', 'graph_mode': 'cutoff', 'cutoff': 0.403212691859771, 'grm_norm': 'cosine_then_gcn', 'self_loops': False, 'use_snp_selection': False}. Best is trial 77 with value: 0.08732210053952931.
[I 2025-11-03 12:08:57,723] Trial 137 finished with value: 0.03757987421599575 and parameters: {'model_type': 'graphsage', 'hidden_dims': '[128, 64]', 'dropout': 0.3084390156002818, 'batch_norm': True, 'lr': 0.00031645030969168226, 'weight_decay': 1.963317043686052e-06, 'epochs': 309, 'loss': 'mse', 'optimizer': 'adam', 'graph_mode': 'cutoff', 'cutoff': 0.4898692954275972, 'grm_norm': 'none', 'self_loops': False, 'use_snp_selection': False}. Best is trial 77 with value: 0.08732210053952931.
[I 2025-11-03 12:09:00,513] Trial 138 finished with value: 0.06940394251066058 and parameters: {'model_type': 'graphsage', 'hidden_dims': '[256, 128]', 'dropout': 0.279724519593643, 'batch_norm': True, 'lr': 0.0004775538691798464, 'weight_decay': 5.588884299099132e-07, 'epochs': 265, 'loss': 'mse', 'optimizer': 'adam', 'graph_mode': 'cutoff', 'cutoff': 0.5233089552984209, 'grm_norm': 'gcn', 'self_loops': True, 'use_snp_selection': False}. Best is trial 77 with value: 0.08732210053952931.
[I 2025-11-03 12:09:02,783] Trial 139 finished with value: 0.04952195305439728 and parameters: {'model_type': 'graphsage', 'hidden_dims': '[128, 64]', 'dropout': 0.17236094404943814, 'batch_norm': True, 'lr': 0.000639107833850011, 'weight_decay': 5.637022533100685e-05, 'epochs': 292, 'loss': 'mse', 'optimizer': 'adam', 'graph_mode': 'cutoff', 'cutoff': 0.37201002843464626, 'grm_norm': 'gcn', 'self_loops': False, 'use_snp_selection': False}. Best is trial 77 with value: 0.08732210053952931.
[I 2025-11-03 12:09:04,750] Trial 140 finished with value: 0.0364048881378122 and parameters: {'model_type': 'graphsage', 'hidden_dims': '[128, 64]', 'dropout': 0.15727767235272425, 'batch_norm': True, 'lr': 0.0007167363898303315, 'weight_decay': 2.5028096866989448e-05, 'epochs': 211, 'loss': 'mse', 'optimizer': 'adam', 'graph_mode': 'cutoff', 'cutoff': 0.7659306188833549, 'grm_norm': 'gcn', 'self_loops': False, 'use_snp_selection': False}. Best is trial 77 with value: 0.08732210053952931.
[I 2025-11-03 12:09:07,530] Trial 141 finished with value: 0.03229927439588701 and parameters: {'model_type': 'graphsage', 'hidden_dims': '[256, 128]', 'dropout': 0.29005344229628655, 'batch_norm': True, 'lr': 2.885067617897804e-05, 'weight_decay': 5.582042400569681e-07, 'epochs': 263, 'loss': 'mse', 'optimizer': 'adam', 'graph_mode': 'cutoff', 'cutoff': 0.5221348066578659, 'grm_norm': 'gcn', 'self_loops': True, 'use_snp_selection': False}. Best is trial 77 with value: 0.08732210053952931.
[I 2025-11-03 12:09:10,354] Trial 142 finished with value: 0.049327819733821214 and parameters: {'model_type': 'graphsage', 'hidden_dims': '[256, 128]', 'dropout': 0.2813692799945248, 'batch_norm': True, 'lr': 0.0005051710897600443, 'weight_decay': 3.8119951962245926e-07, 'epochs': 265, 'loss': 'mse', 'optimizer': 'adam', 'graph_mode': 'cutoff', 'cutoff': 0.4741819038518981, 'grm_norm': 'gcn', 'self_loops': True, 'use_snp_selection': False}. Best is trial 77 with value: 0.08732210053952931.
[I 2025-11-03 12:09:13,234] Trial 143 finished with value: 0.06285647955013553 and parameters: {'model_type': 'graphsage', 'hidden_dims': '[256, 128]', 'dropout': 0.22529501001707997, 'batch_norm': True, 'lr': 0.0008265645678501111, 'weight_decay': 9.777854920139293e-07, 'epochs': 275, 'loss': 'mse', 'optimizer': 'adam', 'graph_mode': 'cutoff', 'cutoff': 0.42370824995600176, 'grm_norm': 'gcn', 'self_loops': True, 'use_snp_selection': False}. Best is trial 77 with value: 0.08732210053952931.
[I 2025-11-03 12:09:15,994] Trial 144 finished with value: 0.06935533132768534 and parameters: {'model_type': 'graphsage', 'hidden_dims': '[256, 128]', 'dropout': 0.2575624388561199, 'batch_norm': True, 'lr': 0.0004665354624856532, 'weight_decay': 6.335695064853993e-07, 'epochs': 246, 'loss': 'mse', 'optimizer': 'adam', 'graph_mode': 'cutoff', 'cutoff': 0.3371248537237358, 'grm_norm': 'gcn', 'self_loops': True, 'use_snp_selection': False}. Best is trial 77 with value: 0.08732210053952931.
[I 2025-11-03 12:09:19,105] Trial 145 finished with value: 0.05662566616204148 and parameters: {'model_type': 'graphsage', 'hidden_dims': '[256, 128]', 'dropout': 0.2713048167920728, 'batch_norm': True, 'lr': 0.00036689978025915157, 'weight_decay': 7.60976285595139e-07, 'epochs': 321, 'loss': 'mse', 'optimizer': 'adam', 'graph_mode': 'cutoff', 'cutoff': 0.44645441636790106, 'grm_norm': 'gcn', 'self_loops': True, 'use_snp_selection': False}. Best is trial 77 with value: 0.08732210053952931.
[I 2025-11-03 12:09:24,224] Trial 146 finished with value: 0.054915682161863044 and parameters: {'model_type': 'graphsage', 'hidden_dims': '[512, 64]', 'dropout': 0.35583302647712767, 'batch_norm': True, 'lr': 0.0006146522587008361, 'weight_decay': 4.930572985331245e-07, 'epochs': 333, 'loss': 'mse', 'optimizer': 'adam', 'graph_mode': 'cutoff', 'cutoff': 0.38839760960327163, 'grm_norm': 'gcn', 'self_loops': False, 'use_snp_selection': False}. Best is trial 77 with value: 0.08732210053952931.
[I 2025-11-03 12:09:26,382] Trial 147 finished with value: 0.06394785525779678 and parameters: {'model_type': 'graphsage', 'hidden_dims': '[128, 64]', 'dropout': 0.21589654896449997, 'batch_norm': True, 'lr': 0.0004331421218159625, 'weight_decay': 4.574044626376761e-05, 'epochs': 258, 'loss': 'mse', 'optimizer': 'adam', 'graph_mode': 'cutoff', 'cutoff': 0.5349723452687032, 'grm_norm': 'cosine_then_gcn', 'self_loops': False, 'use_snp_selection': False}. Best is trial 77 with value: 0.08732210053952931.
[I 2025-11-03 12:09:27,758] Trial 148 finished with value: 0.0445933477867475 and parameters: {'model_type': 'graphsage', 'hidden_dims': '[128, 64]', 'dropout': 0.18529987089657957, 'batch_norm': True, 'lr': 1.5537351629771934e-05, 'weight_decay': 3.79819524427558e-05, 'epochs': 46, 'loss': 'mse', 'optimizer': 'adam', 'graph_mode': 'cutoff', 'cutoff': 0.5619310601955546, 'grm_norm': 'gcn', 'self_loops': False, 'use_snp_selection': False}. Best is trial 77 with value: 0.08732210053952931.
[I 2025-11-03 12:09:30,737] Trial 149 finished with value: 0.027510425401822473 and parameters: {'model_type': 'graphsage', 'hidden_dims': '[256, 128, 64]', 'dropout': 0.19781195512876834, 'batch_norm': True, 'lr': 0.0009277946771774898, 'weight_decay': 1.449805824207734e-06, 'epochs': 290, 'loss': 'mae', 'optimizer': 'adam', 'graph_mode': 'cutoff', 'cutoff': 0.5054658758229411, 'grm_norm': 'gcn', 'self_loops': True, 'use_snp_selection': False}. Best is trial 77 with value: 0.08732210053952931.
[I 2025-11-03 12:09:34,734] Trial 0 finished with value: -0.03024773061454472 and parameters: {'model_type': 'graphsage', 'hidden_dims': '[128, 64]', 'dropout': 0.199031432379812, 'batch_norm': True, 'lr': 1.8408544111075837e-06, 'weight_decay': 5.5136510071208614e-05, 'epochs': 336, 'loss': 'mae', 'optimizer': 'adam', 'graph_mode': 'knn', 'source': 'grm', 'knn_k': 8, 'weighted_edges': True, 'symmetrize_mode': 'mutual', 'use_snp_selection': False}. Best is trial 0 with value: -0.03024773061454472.
[I 2025-11-03 12:09:36,742] Trial 1 finished with value: 0.08222103821032176 and parameters: {'model_type': 'graphsage', 'hidden_dims': '[128, 64]', 'dropout': 0.40051947670227217, 'batch_norm': True, 'lr': 0.0005320428882732732, 'weight_decay': 1.89210117736594e-06, 'epochs': 68, 'loss': 'mse', 'optimizer': 'adam', 'graph_mode': 'knn', 'source': 'grm', 'knn_k': 7, 'weighted_edges': True, 'symmetrize_mode': 'union', 'use_snp_selection': False}. Best is trial 1 with value: 0.08222103821032176.
[I 2025-11-03 12:09:39,842] Trial 2 finished with value: 0.08089333698722417 and parameters: {'model_type': 'graphsage', 'hidden_dims': '[256, 128]', 'dropout': 0.5105528289184642, 'batch_norm': False, 'lr': 0.0006804279372404962, 'weight_decay': 0.0008922815224257085, 'epochs': 181, 'loss': 'mse', 'optimizer': 'adam', 'graph_mode': 'cutoff', 'cutoff': 0.5741905641612706, 'grm_norm': 'gcn', 'self_loops': False, 'use_snp_selection': True, 'num_snps': 26910}. Best is trial 1 with value: 0.08222103821032176.
[I 2025-11-03 12:09:43,173] Trial 3 finished with value: 0.010342593557129685 and parameters: {'model_type': 'graphsage', 'hidden_dims': '[256, 128, 64]', 'dropout': 0.5390483213624292, 'batch_norm': False, 'lr': 3.4705625989073525e-05, 'weight_decay': 2.4623319020131338e-05, 'epochs': 121, 'loss': 'mse', 'optimizer': 'adam', 'graph_mode': 'knn', 'source': 'grm', 'knn_k': 6, 'weighted_edges': False, 'symmetrize_mode': 'mutual', 'use_snp_selection': True, 'num_snps': 30713}. Best is trial 1 with value: 0.08222103821032176.
[I 2025-11-03 12:09:46,365] Trial 4 finished with value: 0.039987132476003856 and parameters: {'model_type': 'graphsage', 'hidden_dims': '[128, 64]', 'dropout': 0.13404863676897502, 'batch_norm': False, 'lr': 0.0001431556295367288, 'weight_decay': 2.2084517750726675e-05, 'epochs': 51, 'loss': 'mae', 'optimizer': 'adam', 'graph_mode': 'cutoff', 'cutoff': 0.6714268476993044, 'grm_norm': 'none', 'self_loops': False, 'use_snp_selection': True, 'num_snps': 45645}. Best is trial 1 with value: 0.08222103821032176.
[I 2025-11-03 12:09:50,490] Trial 5 finished with value: 0.07562191441342006 and parameters: {'model_type': 'graphsage', 'hidden_dims': '[256, 128]', 'dropout': 0.42253606323412096, 'batch_norm': False, 'lr': 4.238630400638805e-05, 'weight_decay': 8.074086040046576e-07, 'epochs': 158, 'loss': 'mae', 'optimizer': 'adam', 'graph_mode': 'knn', 'source': 'grm', 'knn_k': 1, 'weighted_edges': False, 'symmetrize_mode': 'mutual', 'use_snp_selection': True, 'num_snps': 43113}. Best is trial 1 with value: 0.08222103821032176.
[I 2025-11-03 12:09:56,216] Trial 6 finished with value: 0.0641291001836538 and parameters: {'model_type': 'graphsage', 'hidden_dims': '[512, 256]', 'dropout': 0.3534893146320237, 'batch_norm': True, 'lr': 0.000251307964226932, 'weight_decay': 1.821819791794022e-05, 'epochs': 223, 'loss': 'mae', 'optimizer': 'adam', 'graph_mode': 'knn', 'source': 'grm', 'knn_k': 1, 'weighted_edges': True, 'symmetrize_mode': 'mutual', 'use_snp_selection': False}. Best is trial 1 with value: 0.08222103821032176.
[I 2025-11-03 12:10:01,330] Trial 7 finished with value: 0.059570253336476885 and parameters: {'model_type': 'graphsage', 'hidden_dims': '[512, 256]', 'dropout': 0.1105825955860775, 'batch_norm': True, 'lr': 2.374338412754043e-05, 'weight_decay': 1.1284721123340274e-05, 'epochs': 190, 'loss': 'mse', 'optimizer': 'adam', 'graph_mode': 'cutoff', 'cutoff': 0.719872204109604, 'grm_norm': 'gcn', 'self_loops': False, 'use_snp_selection': False}. Best is trial 1 with value: 0.08222103821032176.
[I 2025-11-03 12:10:05,682] Trial 8 finished with value: 0.05113595601458325 and parameters: {'model_type': 'graphsage', 'hidden_dims': '[512, 128]', 'dropout': 0.5066580418354021, 'batch_norm': True, 'lr': 0.00039213678276659976, 'weight_decay': 3.43655320802934e-06, 'epochs': 120, 'loss': 'mse', 'optimizer': 'adam', 'graph_mode': 'cutoff', 'cutoff': 0.34923059576505366, 'grm_norm': 'cosine', 'self_loops': True, 'use_snp_selection': False}. Best is trial 1 with value: 0.08222103821032176.
[I 2025-11-03 12:10:08,418] Trial 9 finished with value: 0.03993844669872357 and parameters: {'model_type': 'graphsage', 'hidden_dims': '[512, 256]', 'dropout': 0.301734920240333, 'batch_norm': False, 'lr': 6.650961854953448e-06, 'weight_decay': 6.861575656590315e-05, 'epochs': 150, 'loss': 'mae', 'optimizer': 'adam', 'graph_mode': 'cutoff', 'cutoff': 0.2857569870061939, 'grm_norm': 'cosine_then_gcn', 'self_loops': False, 'use_snp_selection': True, 'num_snps': 12722}. Best is trial 1 with value: 0.08222103821032176.
[I 2025-11-03 12:10:11,618] Trial 10 finished with value: 0.06422186181526202 and parameters: {'model_type': 'graphsage', 'hidden_dims': '[512, 64]', 'dropout': 0.2923745636750988, 'batch_norm': True, 'lr': 0.00010001966977255833, 'weight_decay': 1.2618827301366646e-07, 'epochs': 41, 'loss': 'mse', 'optimizer': 'adam', 'graph_mode': 'knn', 'source': 'grm', 'knn_k': 10, 'weighted_edges': True, 'symmetrize_mode': 'union', 'use_snp_selection': False}. Best is trial 1 with value: 0.08222103821032176.
[I 2025-11-03 12:10:14,529] Trial 11 finished with value: 0.060910593367660075 and parameters: {'model_type': 'graphsage', 'hidden_dims': '[256, 128]', 'dropout': 0.4214049075657615, 'batch_norm': False, 'lr': 0.0008778492892841868, 'weight_decay': 0.000992538435964661, 'epochs': 274, 'loss': 'mse', 'optimizer': 'adam', 'graph_mode': 'cutoff', 'cutoff': 0.8773959711672632, 'grm_norm': 'gcn', 'self_loops': True, 'use_snp_selection': True, 'num_snps': 16589}. Best is trial 1 with value: 0.08222103821032176.
[I 2025-11-03 12:10:20,788] Trial 12 finished with value: 0.051115840862737426 and parameters: {'model_type': 'graphsage', 'hidden_dims': '[256, 128]', 'dropout': 0.568426629270592, 'batch_norm': True, 'lr': 0.0008875187780684403, 'weight_decay': 0.0004898513914360714, 'epochs': 245, 'loss': 'mse', 'optimizer': 'adam', 'graph_mode': 'cutoff', 'cutoff': 0.48181782223539704, 'grm_norm': 'gcn', 'self_loops': False, 'use_snp_selection': True, 'num_snps': 58791}. Best is trial 1 with value: 0.08222103821032176.
[I 2025-11-03 12:10:22,885] Trial 13 finished with value: 0.051405870304939955 and parameters: {'model_type': 'graphsage', 'hidden_dims': '[128, 64]', 'dropout': 0.463149119497691, 'batch_norm': False, 'lr': 0.0003914729386696084, 'weight_decay': 1.556479003340889e-06, 'epochs': 84, 'loss': 'mse', 'optimizer': 'adam', 'graph_mode': 'knn', 'source': 'grm', 'knn_k': 5, 'weighted_edges': True, 'symmetrize_mode': 'union', 'use_snp_selection': False}. Best is trial 1 with value: 0.08222103821032176.
[I 2025-11-03 12:10:27,041] Trial 14 finished with value: 0.023244486040169106 and parameters: {'model_type': 'graphsage', 'hidden_dims': '[256, 128, 64]', 'dropout': 0.37027437095992005, 'batch_norm': False, 'lr': 0.0009838853509145783, 'weight_decay': 2.612499763810861e-07, 'epochs': 303, 'loss': 'mse', 'optimizer': 'adam', 'graph_mode': 'cutoff', 'cutoff': 0.531893423667369, 'grm_norm': 'none', 'self_loops': False, 'use_snp_selection': False}. Best is trial 1 with value: 0.08222103821032176.
[I 2025-11-03 12:10:31,424] Trial 15 finished with value: 0.07081402290106514 and parameters: {'model_type': 'graphsage', 'hidden_dims': '[512, 64]', 'dropout': 0.5960169427877031, 'batch_norm': True, 'lr': 0.0001068912485398381, 'weight_decay': 3.525194351311951e-06, 'epochs': 189, 'loss': 'mse', 'optimizer': 'adam', 'graph_mode': 'knn', 'source': 'grm', 'knn_k': 5, 'weighted_edges': True, 'symmetrize_mode': 'union', 'use_snp_selection': True, 'num_snps': 25832}. Best is trial 1 with value: 0.08222103821032176.
[I 2025-11-03 12:10:35,947] Trial 16 finished with value: 0.02599797314078066 and parameters: {'model_type': 'graphsage', 'hidden_dims': '[512, 128]', 'dropout': 0.4728426501062484, 'batch_norm': True, 'lr': 1.1967859941484413e-05, 'weight_decay': 0.00018183807869182438, 'epochs': 102, 'loss': 'mse', 'optimizer': 'adam', 'graph_mode': 'knn', 'source': 'grm', 'knn_k': 8, 'weighted_edges': False, 'symmetrize_mode': 'union', 'use_snp_selection': False}. Best is trial 1 with value: 0.08222103821032176.
[I 2025-11-03 12:10:37,808] Trial 17 finished with value: 0.07205575271968992 and parameters: {'model_type': 'graphsage', 'hidden_dims': '[128, 64]', 'dropout': 0.2729234927491564, 'batch_norm': False, 'lr': 0.00025348377965585733, 'weight_decay': 6.429994613699539e-07, 'epochs': 74, 'loss': 'mse', 'optimizer': 'adam', 'graph_mode': 'cutoff', 'cutoff': 0.6891673938283641, 'grm_norm': 'cosine_then_gcn', 'self_loops': True, 'use_snp_selection': True, 'num_snps': 5158}. Best is trial 1 with value: 0.08222103821032176.
[I 2025-11-03 12:10:41,023] Trial 18 finished with value: -0.002042035353250454 and parameters: {'model_type': 'graphsage', 'hidden_dims': '[256, 128]', 'dropout': 0.42100440345875856, 'batch_norm': True, 'lr': 2.616555906440345e-06, 'weight_decay': 4.454261942658353e-06, 'epochs': 152, 'loss': 'mse', 'optimizer': 'adam', 'graph_mode': 'cutoff', 'cutoff': 0.40929277018780463, 'grm_norm': 'cosine', 'self_loops': False, 'use_snp_selection': False}. Best is trial 1 with value: 0.08222103821032176.
[I 2025-11-03 12:10:45,278] Trial 19 finished with value: 0.052850013058962406 and parameters: {'model_type': 'graphsage', 'hidden_dims': '[128, 64]', 'dropout': 0.5154793718107504, 'batch_norm': False, 'lr': 7.419984991805984e-05, 'weight_decay': 0.00014548204361409847, 'epochs': 231, 'loss': 'mse', 'optimizer': 'adam', 'graph_mode': 'knn', 'source': 'grm', 'knn_k': 4, 'weighted_edges': True, 'symmetrize_mode': 'union', 'use_snp_selection': True, 'num_snps': 40401}. Best is trial 1 with value: 0.08222103821032176.
[I 2025-11-03 12:10:49,418] Trial 20 finished with value: 0.06941585468867006 and parameters: {'model_type': 'graphsage', 'hidden_dims': '[256, 128]', 'dropout': 0.23639212262818265, 'batch_norm': False, 'lr': 0.0004562322428430398, 'weight_decay': 1.4336030734130194e-06, 'epochs': 267, 'loss': 'mse', 'optimizer': 'adam', 'graph_mode': 'knn', 'source': 'grm', 'knn_k': 10, 'weighted_edges': False, 'symmetrize_mode': 'union', 'use_snp_selection': True, 'num_snps': 22145}. Best is trial 1 with value: 0.08222103821032176.
[I 2025-11-03 12:10:53,538] Trial 21 finished with value: 0.08170423097110015 and parameters: {'model_type': 'graphsage', 'hidden_dims': '[256, 128]', 'dropout': 0.4053803761993914, 'batch_norm': False, 'lr': 4.159796634722114e-05, 'weight_decay': 6.285604578347279e-07, 'epochs': 164, 'loss': 'mae', 'optimizer': 'adam', 'graph_mode': 'knn', 'source': 'grm', 'knn_k': 1, 'weighted_edges': False, 'symmetrize_mode': 'mutual', 'use_snp_selection': True, 'num_snps': 42156}. Best is trial 1 with value: 0.08222103821032176.
[I 2025-11-03 12:10:57,497] Trial 22 finished with value: 0.03499352259850267 and parameters: {'model_type': 'graphsage', 'hidden_dims': '[256, 128]', 'dropout': 0.359432457449449, 'batch_norm': False, 'lr': 4.7842144811097486e-06, 'weight_decay': 3.527389810331297e-07, 'epochs': 172, 'loss': 'mae', 'optimizer': 'adam', 'graph_mode': 'knn', 'source': 'grm', 'knn_k': 2, 'weighted_edges': False, 'symmetrize_mode': 'mutual', 'use_snp_selection': True, 'num_snps': 37861}. Best is trial 1 with value: 0.08222103821032176.
