[I 2025-11-03 11:58:04,133] Trial 24 finished with value: 0.052021415787390016 and parameters: {'model_type': 'gcn', 'hidden_dims': '[512, 64]', 'dropout': 0.33918261844881226, 'batch_norm': True, 'lr': 6.714340284124602e-05, 'weight_decay': 2.1394356368701712e-06, 'epochs': 240, 'loss': 'mae', 'optimizer': 'adam', 'graph_mode': 'knn', 'source': 'grm', 'knn_k': 4, 'weighted_edges': True, 'symmetrize_mode': 'union', 'use_snp_selection': False}. Best is trial 11 with value: 0.08386365619448015.
[I 2025-11-03 11:58:07,911] Trial 25 finished with value: 0.025718508488739664 and parameters: {'model_type': 'gcn', 'hidden_dims': '[512, 64]', 'dropout': 0.2259325604638872, 'batch_norm': True, 'lr': 0.0002536957127283572, 'weight_decay': 2.173446953716572e-07, 'epochs': 289, 'loss': 'mae', 'optimizer': 'adam', 'graph_mode': 'knn', 'source': 'grm', 'knn_k': 2, 'weighted_edges': True, 'symmetrize_mode': 'union', 'use_snp_selection': False}. Best is trial 11 with value: 0.08386365619448015.
[I 2025-11-03 11:58:13,534] Trial 26 finished with value: 0.076678848520583 and parameters: {'model_type': 'gcn', 'hidden_dims': '[512, 128]', 'dropout': 0.17721616557244607, 'batch_norm': False, 'lr': 5.138474089601666e-05, 'weight_decay': 1.2480426102799778e-06, 'epochs': 320, 'loss': 'mae', 'optimizer': 'adam', 'graph_mode': 'cutoff', 'cutoff': 0.8765009073803762, 'grm_norm': 'none', 'self_loops': True, 'use_snp_selection': True, 'num_snps': 59005}. Best is trial 11 with value: 0.08386365619448015.
[I 2025-11-03 11:58:18,982] Trial 27 finished with value: 0.06888228015491128 and parameters: {'model_type': 'gcn', 'hidden_dims': '[512, 128]', 'dropout': 0.16088532626545804, 'batch_norm': False, 'lr': 1.9937354098458108e-05, 'weight_decay': 5.56561042229268e-06, 'epochs': 305, 'loss': 'mse', 'optimizer': 'adam', 'graph_mode': 'cutoff', 'cutoff': 0.8907049599927799, 'grm_norm': 'none', 'self_loops': True, 'use_snp_selection': True, 'num_snps': 58472}. Best is trial 11 with value: 0.08386365619448015.
[I 2025-11-03 11:58:24,688] Trial 28 finished with value: 0.03715766421961507 and parameters: {'model_type': 'gcn', 'hidden_dims': '[512, 128]', 'dropout': 0.16422651082979514, 'batch_norm': False, 'lr': 9.280317752869787e-06, 'weight_decay': 1.1477321413432746e-06, 'epochs': 324, 'loss': 'mae', 'optimizer': 'adam', 'graph_mode': 'cutoff', 'cutoff': 0.8091444867553712, 'grm_norm': 'none', 'self_loops': True, 'use_snp_selection': True, 'num_snps': 59610}. Best is trial 11 with value: 0.08386365619448015.
[I 2025-11-03 11:58:27,306] Trial 29 finished with value: 0.03460680746918024 and parameters: {'model_type': 'gcn', 'hidden_dims': '[512, 128]', 'dropout': 0.17649976246898474, 'batch_norm': False, 'lr': 4.0107782023369205e-05, 'weight_decay': 1.2840347377059986e-06, 'epochs': 326, 'loss': 'mae', 'optimizer': 'adam', 'graph_mode': 'cutoff', 'cutoff': 0.49003689705315706, 'grm_norm': 'cosine_then_gcn', 'self_loops': True, 'use_snp_selection': True, 'num_snps': 12210}. Best is trial 11 with value: 0.08386365619448015.
[I 2025-11-03 11:58:31,065] Trial 30 finished with value: -0.004951196916317309 and parameters: {'model_type': 'gcn', 'hidden_dims': '[256, 128]', 'dropout': 0.37337696725499286, 'batch_norm': False, 'lr': 3.2211467597109637e-06, 'weight_decay': 5.64105900761489e-06, 'epochs': 283, 'loss': 'mae', 'optimizer': 'adam', 'graph_mode': 'cutoff', 'cutoff': 0.4759751103017282, 'grm_norm': 'cosine', 'self_loops': True, 'use_snp_selection': True, 'num_snps': 44855}. Best is trial 11 with value: 0.08386365619448015.
[I 2025-11-03 11:58:34,409] Trial 31 finished with value: -0.0071386398979819314 and parameters: {'model_type': 'gcn', 'hidden_dims': '[256, 128, 64]', 'dropout': 0.23303405218878553, 'batch_norm': True, 'lr': 1.050807680032028e-06, 'weight_decay': 5.463952782947847e-07, 'epochs': 347, 'loss': 'mae', 'optimizer': 'adam', 'graph_mode': 'knn', 'source': 'grm', 'knn_k': 4, 'weighted_edges': True, 'symmetrize_mode': 'union', 'use_snp_selection': False}. Best is trial 11 with value: 0.08386365619448015.
[I 2025-11-03 11:58:36,267] Trial 32 finished with value: -0.02354053272466342 and parameters: {'model_type': 'gcn', 'hidden_dims': '[128, 64]', 'dropout': 0.3184117112549534, 'batch_norm': False, 'lr': 0.00014114652318430757, 'weight_decay': 1.6663960400418062e-07, 'epochs': 254, 'loss': 'mae', 'optimizer': 'adam', 'graph_mode': 'cutoff', 'cutoff': 0.20117387401769954, 'grm_norm': 'none', 'self_loops': True, 'use_snp_selection': True, 'num_snps': 2095}. Best is trial 11 with value: 0.08386365619448015.
[I 2025-11-03 11:58:40,424] Trial 33 finished with value: 0.061660681305458986 and parameters: {'model_type': 'gcn', 'hidden_dims': '[512, 128]', 'dropout': 0.4299396866264043, 'batch_norm': True, 'lr': 6.212164143619834e-05, 'weight_decay': 1.0035834453175251e-07, 'epochs': 324, 'loss': 'mae', 'optimizer': 'adam', 'graph_mode': 'knn', 'source': 'grm', 'knn_k': 1, 'weighted_edges': False, 'symmetrize_mode': 'mutual', 'use_snp_selection': False}. Best is trial 11 with value: 0.08386365619448015.
[I 2025-11-03 11:58:44,054] Trial 34 finished with value: 0.031071786909110506 and parameters: {'model_type': 'gcn', 'hidden_dims': '[512, 64]', 'dropout': 0.287097065978673, 'batch_norm': False, 'lr': 0.00039304817802044144, 'weight_decay': 2.886195694620603e-07, 'epochs': 197, 'loss': 'mse', 'optimizer': 'adam', 'graph_mode': 'knn', 'source': 'grm', 'knn_k': 3, 'weighted_edges': True, 'symmetrize_mode': 'union', 'use_snp_selection': True, 'num_snps': 38360}. Best is trial 11 with value: 0.08386365619448015.
[I 2025-11-03 11:58:45,837] Trial 35 finished with value: 0.014242291818696054 and parameters: {'model_type': 'gcn', 'hidden_dims': '[128, 64]', 'dropout': 0.20522359768906048, 'batch_norm': True, 'lr': 2.7977974916311715e-05, 'weight_decay': 4.6426139786611145e-07, 'epochs': 230, 'loss': 'mae', 'optimizer': 'adam', 'graph_mode': 'cutoff', 'cutoff': 0.8693154568850365, 'grm_norm': 'none', 'self_loops': True, 'use_snp_selection': False}. Best is trial 11 with value: 0.08386365619448015.
[I 2025-11-03 11:58:50,023] Trial 36 finished with value: 0.04620386393357596 and parameters: {'model_type': 'gcn', 'hidden_dims': '[256, 128]', 'dropout': 0.24744430921056332, 'batch_norm': False, 'lr': 5.0709610837869915e-05, 'weight_decay': 1.4976793974018212e-06, 'epochs': 279, 'loss': 'mse', 'optimizer': 'adam', 'graph_mode': 'knn', 'source': 'grm', 'knn_k': 10, 'weighted_edges': True, 'symmetrize_mode': 'union', 'use_snp_selection': True, 'num_snps': 52792}. Best is trial 11 with value: 0.08386365619448015.
[I 2025-11-03 11:58:52,708] Trial 37 finished with value: 0.06398387664643798 and parameters: {'model_type': 'gcn', 'hidden_dims': '[256, 128, 64]', 'dropout': 0.10269923677704018, 'batch_norm': True, 'lr': 0.00011090229767325606, 'weight_decay': 1.547570782962856e-07, 'epochs': 252, 'loss': 'mae', 'optimizer': 'adam', 'graph_mode': 'cutoff', 'cutoff': 0.7133517739980331, 'grm_norm': 'cosine', 'self_loops': True, 'use_snp_selection': False}. Best is trial 11 with value: 0.08386365619448015.
[I 2025-11-03 11:58:55,467] Trial 38 finished with value: 0.02594892083969436 and parameters: {'model_type': 'gcn', 'hidden_dims': '[512, 64]', 'dropout': 0.3215738539804613, 'batch_norm': False, 'lr': 0.0004221095105043032, 'weight_decay': 7.568042340962217e-07, 'epochs': 182, 'loss': 'mae', 'optimizer': 'adam', 'graph_mode': 'knn', 'source': 'grm', 'knn_k': 2, 'weighted_edges': True, 'symmetrize_mode': 'union', 'use_snp_selection': True, 'num_snps': 24288}. Best is trial 11 with value: 0.08386365619448015.
[I 2025-11-03 11:58:57,351] Trial 39 finished with value: 0.04533021176764662 and parameters: {'model_type': 'gcn', 'hidden_dims': '[512, 256]', 'dropout': 0.3647366795579274, 'batch_norm': True, 'lr': 0.0006953590297444277, 'weight_decay': 6.895962276168932e-05, 'epochs': 68, 'loss': 'mse', 'optimizer': 'adam', 'graph_mode': 'knn', 'source': 'grm', 'knn_k': 5, 'weighted_edges': True, 'symmetrize_mode': 'union', 'use_snp_selection': False}. Best is trial 11 with value: 0.08386365619448015.
[I 2025-11-03 11:58:59,987] Trial 40 finished with value: 0.10707079639337991 and parameters: {'model_type': 'gcn', 'hidden_dims': '[128, 64]', 'dropout': 0.136579879750087, 'batch_norm': False, 'lr': 0.00019001358602993514, 'weight_decay': 0.00025777232151560496, 'epochs': 155, 'loss': 'mae', 'optimizer': 'adam', 'graph_mode': 'cutoff', 'cutoff': 0.6075941631953943, 'grm_norm': 'gcn', 'self_loops': False, 'use_snp_selection': True, 'num_snps': 36315}. Best is trial 40 with value: 0.10707079639337991.
[I 2025-11-03 11:59:02,574] Trial 41 finished with value: 0.061907046616732346 and parameters: {'model_type': 'gcn', 'hidden_dims': '[128, 64]', 'dropout': 0.13509360235482262, 'batch_norm': False, 'lr': 0.0001656785452573043, 'weight_decay': 0.00035213297973038044, 'epochs': 123, 'loss': 'mae', 'optimizer': 'adam', 'graph_mode': 'cutoff', 'cutoff': 0.5960514205507387, 'grm_norm': 'gcn', 'self_loops': False, 'use_snp_selection': True, 'num_snps': 35891}. Best is trial 40 with value: 0.10707079639337991.
[I 2025-11-03 11:59:05,810] Trial 42 finished with value: 0.09506489637236075 and parameters: {'model_type': 'gcn', 'hidden_dims': '[128, 64]', 'dropout': 0.1349984969624693, 'batch_norm': False, 'lr': 0.00018868401156306932, 'weight_decay': 0.00018839404812702226, 'epochs': 157, 'loss': 'mae', 'optimizer': 'adam', 'graph_mode': 'cutoff', 'cutoff': 0.7845813638167085, 'grm_norm': 'gcn', 'self_loops': False, 'use_snp_selection': True, 'num_snps': 51474}. Best is trial 40 with value: 0.10707079639337991.
[I 2025-11-03 11:59:09,035] Trial 43 finished with value: 0.05309230066612522 and parameters: {'model_type': 'gcn', 'hidden_dims': '[128, 64]', 'dropout': 0.1328287106480823, 'batch_norm': False, 'lr': 0.00021608929957591484, 'weight_decay': 0.00011031045166223447, 'epochs': 149, 'loss': 'mae', 'optimizer': 'adam', 'graph_mode': 'cutoff', 'cutoff': 0.8011501533690062, 'grm_norm': 'gcn', 'self_loops': False, 'use_snp_selection': True, 'num_snps': 52001}. Best is trial 40 with value: 0.10707079639337991.
[I 2025-11-03 11:59:12,277] Trial 44 finished with value: 0.06915059620215251 and parameters: {'model_type': 'gcn', 'hidden_dims': '[128, 64]', 'dropout': 0.13465933006704928, 'batch_norm': False, 'lr': 0.0003052623750238078, 'weight_decay': 0.00019385804001574044, 'epochs': 147, 'loss': 'mae', 'optimizer': 'adam', 'graph_mode': 'cutoff', 'cutoff': 0.7837456981127627, 'grm_norm': 'gcn', 'self_loops': False, 'use_snp_selection': True, 'num_snps': 52506}. Best is trial 40 with value: 0.10707079639337991.
[I 2025-11-03 11:59:15,336] Trial 45 finished with value: 0.06708340394289983 and parameters: {'model_type': 'gcn', 'hidden_dims': '[128, 64]', 'dropout': 0.18546688292644564, 'batch_norm': False, 'lr': 0.00021469515808163962, 'weight_decay': 3.943571427419539e-05, 'epochs': 106, 'loss': 'mae', 'optimizer': 'adam', 'graph_mode': 'cutoff', 'cutoff': 0.6723204672298821, 'grm_norm': 'gcn', 'self_loops': False, 'use_snp_selection': True, 'num_snps': 51061}. Best is trial 40 with value: 0.10707079639337991.
[I 2025-11-03 11:59:18,168] Trial 46 finished with value: 0.04576594712263542 and parameters: {'model_type': 'gcn', 'hidden_dims': '[128, 64]', 'dropout': 0.156007597447742, 'batch_norm': False, 'lr': 0.0005233963875064525, 'weight_decay': 0.000282147935861987, 'epochs': 178, 'loss': 'mae', 'optimizer': 'adam', 'graph_mode': 'cutoff', 'cutoff': 0.8975243867873354, 'grm_norm': 'gcn', 'self_loops': False, 'use_snp_selection': True, 'num_snps': 38515}. Best is trial 40 with value: 0.10707079639337991.
[I 2025-11-03 11:59:21,698] Trial 47 finished with value: 0.09241448858408854 and parameters: {'model_type': 'gcn', 'hidden_dims': '[128, 64]', 'dropout': 0.12706828521582186, 'batch_norm': False, 'lr': 7.269071692565741e-05, 'weight_decay': 0.00013212958632481884, 'epochs': 161, 'loss': 'mse', 'optimizer': 'adam', 'graph_mode': 'cutoff', 'cutoff': 0.7677031760617021, 'grm_norm': 'gcn', 'self_loops': False, 'use_snp_selection': True, 'num_snps': 59045}. Best is trial 40 with value: 0.10707079639337991.
[I 2025-11-03 11:59:24,813] Trial 48 finished with value: 0.05769962877650646 and parameters: {'model_type': 'gcn', 'hidden_dims': '[128, 64]', 'dropout': 0.11371481070241882, 'batch_norm': False, 'lr': 0.0001195640918869196, 'weight_decay': 0.0008138568233487931, 'epochs': 161, 'loss': 'mse', 'optimizer': 'adam', 'graph_mode': 'cutoff', 'cutoff': 0.6334489292812663, 'grm_norm': 'gcn', 'self_loops': False, 'use_snp_selection': True, 'num_snps': 48245}. Best is trial 40 with value: 0.10707079639337991.
[I 2025-11-03 11:59:26,907] Trial 49 finished with value: 0.06616404991795116 and parameters: {'model_type': 'gcn', 'hidden_dims': '[128, 64]', 'dropout': 0.21960565323610476, 'batch_norm': False, 'lr': 7.666266746356496e-05, 'weight_decay': 0.00013681732401856284, 'epochs': 139, 'loss': 'mse', 'optimizer': 'adam', 'graph_mode': 'cutoff', 'cutoff': 0.7488061372342156, 'grm_norm': 'gcn', 'self_loops': False, 'use_snp_selection': True, 'num_snps': 20222}. Best is trial 40 with value: 0.10707079639337991.
[I 2025-11-03 11:59:29,457] Trial 50 finished with value: 0.05598941168211665 and parameters: {'model_type': 'gcn', 'hidden_dims': '[128, 64]', 'dropout': 0.41882381059560875, 'batch_norm': False, 'lr': 0.00020731654175393677, 'weight_decay': 3.7963947267930785e-05, 'epochs': 112, 'loss': 'mse', 'optimizer': 'adam', 'graph_mode': 'cutoff', 'cutoff': 0.45368970134289854, 'grm_norm': 'gcn', 'self_loops': False, 'use_snp_selection': True, 'num_snps': 35613}. Best is trial 40 with value: 0.10707079639337991.
[I 2025-11-03 11:59:33,206] Trial 51 finished with value: 0.0670163846686037 and parameters: {'model_type': 'gcn', 'hidden_dims': '[512, 256]', 'dropout': 0.11674721793162426, 'batch_norm': False, 'lr': 4.409602671302964e-05, 'weight_decay': 0.0003229871063425986, 'epochs': 74, 'loss': 'mse', 'optimizer': 'adam', 'graph_mode': 'cutoff', 'cutoff': 0.8151731809817987, 'grm_norm': 'cosine_then_gcn', 'self_loops': False, 'use_snp_selection': True, 'num_snps': 56811}. Best is trial 40 with value: 0.10707079639337991.
[I 2025-11-03 11:59:36,647] Trial 52 finished with value: 0.029620686529167724 and parameters: {'model_type': 'gcn', 'hidden_dims': '[128, 64]', 'dropout': 0.14870285078160111, 'batch_norm': False, 'lr': 0.00012816680435906298, 'weight_decay': 0.0004864932481681378, 'epochs': 162, 'loss': 'mse', 'optimizer': 'adam', 'graph_mode': 'cutoff', 'cutoff': 0.8421717617296397, 'grm_norm': 'gcn', 'self_loops': False, 'use_snp_selection': True, 'num_snps': 56661}. Best is trial 40 with value: 0.10707079639337991.
[I 2025-11-03 11:59:41,368] Trial 53 finished with value: 0.07999530366498184 and parameters: {'model_type': 'gcn', 'hidden_dims': '[512, 128]', 'dropout': 0.1781906480332122, 'batch_norm': False, 'lr': 2.9276230000373723e-05, 'weight_decay': 0.00010011454713956679, 'epochs': 192, 'loss': 'mae', 'optimizer': 'adam', 'graph_mode': 'cutoff', 'cutoff': 0.7609125482969386, 'grm_norm': 'none', 'self_loops': False, 'use_snp_selection': True, 'num_snps': 59750}. Best is trial 40 with value: 0.10707079639337991.
[I 2025-11-03 11:59:44,934] Trial 54 finished with value: 0.055361434184315085 and parameters: {'model_type': 'gcn', 'hidden_dims': '[128, 64]', 'dropout': 0.10167607550878544, 'batch_norm': False, 'lr': 2.9441526517570196e-05, 'weight_decay': 0.00018353600668671966, 'epochs': 211, 'loss': 'mae', 'optimizer': 'adam', 'graph_mode': 'cutoff', 'cutoff': 0.7508276210873447, 'grm_norm': 'gcn', 'self_loops': False, 'use_snp_selection': True, 'num_snps': 55103}. Best is trial 40 with value: 0.10707079639337991.
[I 2025-11-03 11:59:48,498] Trial 55 finished with value: 0.01992632617400668 and parameters: {'model_type': 'gcn', 'hidden_dims': '[256, 128]', 'dropout': 0.2901641213370167, 'batch_norm': False, 'lr': 8.225839740190489e-05, 'weight_decay': 9.553550917702557e-05, 'epochs': 192, 'loss': 'mae', 'optimizer': 'adam', 'graph_mode': 'cutoff', 'cutoff': 0.5256576756478168, 'grm_norm': 'gcn', 'self_loops': False, 'use_snp_selection': True, 'num_snps': 48829}. Best is trial 40 with value: 0.10707079639337991.
[I 2025-11-03 11:59:51,460] Trial 56 finished with value: 0.0454264639112535 and parameters: {'model_type': 'gcn', 'hidden_dims': '[128, 64]', 'dropout': 0.19569796130792383, 'batch_norm': False, 'lr': 0.0002873822360481846, 'weight_decay': 0.00022684506070150693, 'epochs': 170, 'loss': 'mae', 'optimizer': 'adam', 'graph_mode': 'cutoff', 'cutoff': 0.6619311348486362, 'grm_norm': 'none', 'self_loops': False, 'use_snp_selection': True, 'num_snps': 42986}. Best is trial 40 with value: 0.10707079639337991.
[I 2025-11-03 11:59:55,459] Trial 57 finished with value: 0.08614613836869589 and parameters: {'model_type': 'gcn', 'hidden_dims': '[512, 128]', 'dropout': 0.13760071343677815, 'batch_norm': False, 'lr': 2.193471267579885e-05, 'weight_decay': 1.0945893066259888e-05, 'epochs': 126, 'loss': 'mse', 'optimizer': 'adam', 'graph_mode': 'cutoff', 'cutoff': 0.5875134231170002, 'grm_norm': 'gcn', 'self_loops': False, 'use_snp_selection': True, 'num_snps': 54623}. Best is trial 40 with value: 0.10707079639337991.
[I 2025-11-03 11:59:58,076] Trial 58 finished with value: 0.03159051746590692 and parameters: {'model_type': 'gcn', 'hidden_dims': '[256, 128, 64]', 'dropout': 0.14274038870356195, 'batch_norm': False, 'lr': 1.8627394650745768e-05, 'weight_decay': 2.2111976811586528e-05, 'epochs': 122, 'loss': 'mse', 'optimizer': 'adam', 'graph_mode': 'cutoff', 'cutoff': 0.56941363979726, 'grm_norm': 'gcn', 'self_loops': False, 'use_snp_selection': True, 'num_snps': 29339}. Best is trial 40 with value: 0.10707079639337991.
[I 2025-11-03 12:00:00,201] Trial 59 finished with value: 0.04968401370173698 and parameters: {'model_type': 'gcn', 'hidden_dims': '[512, 256]', 'dropout': 0.11582834668534216, 'batch_norm': True, 'lr': 0.0001820420583768694, 'weight_decay': 0.00046313910433522714, 'epochs': 102, 'loss': 'mse', 'optimizer': 'adam', 'graph_mode': 'cutoff', 'cutoff': 0.5378480592284128, 'grm_norm': 'gcn', 'self_loops': False, 'use_snp_selection': False}. Best is trial 40 with value: 0.10707079639337991.
[I 2025-11-03 12:00:04,049] Trial 60 finished with value: 0.03763953395632994 and parameters: {'model_type': 'gcn', 'hidden_dims': '[512, 64]', 'dropout': 0.21441721446211254, 'batch_norm': False, 'lr': 9.940146290954915e-06, 'weight_decay': 1.3479654992717105e-05, 'epochs': 140, 'loss': 'mse', 'optimizer': 'adam', 'graph_mode': 'knn', 'source': 'grm', 'knn_k': 8, 'weighted_edges': False, 'symmetrize_mode': 'mutual', 'use_snp_selection': True, 'num_snps': 49071}. Best is trial 40 with value: 0.10707079639337991.
[I 2025-11-03 12:00:07,373] Trial 61 finished with value: 0.0013066761158525367 and parameters: {'model_type': 'gcn', 'hidden_dims': '[512, 128]', 'dropout': 0.16352592837369856, 'batch_norm': False, 'lr': 3.49246205622967e-05, 'weight_decay': 4.2962054992307894e-05, 'epochs': 30, 'loss': 'mse', 'optimizer': 'adam', 'graph_mode': 'cutoff', 'cutoff': 0.6218338150827456, 'grm_norm': 'gcn', 'self_loops': False, 'use_snp_selection': True, 'num_snps': 54330}. Best is trial 40 with value: 0.10707079639337991.
[I 2025-11-03 12:00:11,568] Trial 62 finished with value: 0.035809402195607895 and parameters: {'model_type': 'gcn', 'hidden_dims': '[512, 128]', 'dropout': 0.12475238593475396, 'batch_norm': False, 'lr': 2.214287423245712e-05, 'weight_decay': 0.00013058628824366933, 'epochs': 153, 'loss': 'mse', 'optimizer': 'adam', 'graph_mode': 'cutoff', 'cutoff': 0.6948725474571786, 'grm_norm': 'gcn', 'self_loops': False, 'use_snp_selection': True, 'num_snps': 54959}. Best is trial 40 with value: 0.10707079639337991.
[I 2025-11-03 12:00:16,254] Trial 63 finished with value: 0.0424363624931004 and parameters: {'model_type': 'gcn', 'hidden_dims': '[512, 128]', 'dropout': 0.18212133451440538, 'batch_norm': False, 'lr': 1.3407888724772367e-05, 'weight_decay': 6.791240786577327e-05, 'epochs': 185, 'loss': 'mae', 'optimizer': 'adam', 'graph_mode': 'cutoff', 'cutoff': 0.7602696312263889, 'grm_norm': 'cosine', 'self_loops': False, 'use_snp_selection': True, 'num_snps': 59707}. Best is trial 40 with value: 0.10707079639337991.
[I 2025-11-03 12:00:19,856] Trial 64 finished with value: 0.02277046980018308 and parameters: {'model_type': 'gcn', 'hidden_dims': '[512, 128]', 'dropout': 0.16692057179863146, 'batch_norm': False, 'lr': 7.276908978793828e-05, 'weight_decay': 0.000968096579888522, 'epochs': 130, 'loss': 'mae', 'optimizer': 'adam', 'graph_mode': 'cutoff', 'cutoff': 0.43047300519989007, 'grm_norm': 'gcn', 'self_loops': False, 'use_snp_selection': True, 'num_snps': 45997}. Best is trial 40 with value: 0.10707079639337991.
[I 2025-11-03 12:00:23,095] Trial 65 finished with value: 0.058076135055266924 and parameters: {'model_type': 'gcn', 'hidden_dims': '[512, 128]', 'dropout': 0.14821461084371212, 'batch_norm': True, 'lr': 9.467888855204022e-05, 'weight_decay': 2.9438741152302547e-05, 'epochs': 223, 'loss': 'mae', 'optimizer': 'adam', 'graph_mode': 'cutoff', 'cutoff': 0.6351308102931281, 'grm_norm': 'cosine_then_gcn', 'self_loops': False, 'use_snp_selection': False}. Best is trial 40 with value: 0.10707079639337991.
[I 2025-11-03 12:00:27,135] Trial 66 finished with value: -0.007449791651048112 and parameters: {'model_type': 'gcn', 'hidden_dims': '[512, 64]', 'dropout': 0.19314943266866544, 'batch_norm': False, 'lr': 1.6073375363515895e-05, 'weight_decay': 8.414740620269664e-06, 'epochs': 169, 'loss': 'mae', 'optimizer': 'adam', 'graph_mode': 'cutoff', 'cutoff': 0.39707440727523124, 'grm_norm': 'none', 'self_loops': False, 'use_snp_selection': True, 'num_snps': 50129}. Best is trial 40 with value: 0.10707079639337991.
