[I 2025-11-03 13:15:06,672] Trial 38 finished with value: 0.0032286823541275967 and parameters: {'model_type': 'gcn', 'hidden_dims': '[256, 128, 64]', 'dropout': 0.5386805278518921, 'batch_norm': False, 'lr': 0.0001555971452640603, 'weight_decay': 1.5017223657419984e-07, 'epochs': 146, 'loss': 'mse', 'optimizer': 'adam', 'graph_mode': 'off', 'use_snp_selection': False}. Best is trial 28 with value: 0.06973059670628973.
[I 2025-11-03 13:15:07,788] Trial 39 finished with value: 0.05105054906245496 and parameters: {'model_type': 'gcn', 'hidden_dims': '[512, 128]', 'dropout': 0.12166887871814704, 'batch_norm': True, 'lr': 0.0009263383707781101, 'weight_decay': 5.311995871122912e-07, 'epochs': 84, 'loss': 'mse', 'optimizer': 'adam', 'graph_mode': 'off', 'use_snp_selection': False}. Best is trial 28 with value: 0.06973059670628973.
[I 2025-11-03 13:15:09,330] Trial 40 finished with value: 0.060223794168767775 and parameters: {'model_type': 'gcn', 'hidden_dims': '[512, 256]', 'dropout': 0.25326773742174186, 'batch_norm': True, 'lr': 0.0002873110741493456, 'weight_decay': 2.580654242968e-07, 'epochs': 181, 'loss': 'mse', 'optimizer': 'adam', 'graph_mode': 'off', 'use_snp_selection': False}. Best is trial 28 with value: 0.06973059670628973.
[I 2025-11-03 13:15:10,904] Trial 41 finished with value: 0.059975184302623864 and parameters: {'model_type': 'gcn', 'hidden_dims': '[512, 256]', 'dropout': 0.25105630395762124, 'batch_norm': True, 'lr': 0.0003197027902798238, 'weight_decay': 2.3280204894842638e-07, 'epochs': 179, 'loss': 'mse', 'optimizer': 'adam', 'graph_mode': 'off', 'use_snp_selection': False}. Best is trial 28 with value: 0.06973059670628973.
[I 2025-11-03 13:15:12,646] Trial 42 finished with value: 0.05037759127134775 and parameters: {'model_type': 'gcn', 'hidden_dims': '[512, 256]', 'dropout': 0.3114733495088959, 'batch_norm': True, 'lr': 0.0006033327734504742, 'weight_decay': 1.4767986029619967e-07, 'epochs': 220, 'loss': 'mse', 'optimizer': 'adam', 'graph_mode': 'off', 'use_snp_selection': False}. Best is trial 28 with value: 0.06973059670628973.
[I 2025-11-03 13:15:14,664] Trial 43 finished with value: 0.059982652907885216 and parameters: {'model_type': 'gcn', 'hidden_dims': '[512, 256]', 'dropout': 0.35951213240457697, 'batch_norm': True, 'lr': 0.00031411900102849307, 'weight_decay': 6.672835331304862e-07, 'epochs': 289, 'loss': 'mse', 'optimizer': 'adam', 'graph_mode': 'off', 'use_snp_selection': False}. Best is trial 28 with value: 0.06973059670628973.
[I 2025-11-03 13:15:16,585] Trial 44 finished with value: 0.04825206215485565 and parameters: {'model_type': 'gcn', 'hidden_dims': '[512, 64]', 'dropout': 0.2611081892571071, 'batch_norm': True, 'lr': 0.00010273009795582215, 'weight_decay': 3.317641528072184e-07, 'epochs': 260, 'loss': 'mse', 'optimizer': 'adam', 'graph_mode': 'off', 'use_snp_selection': False}. Best is trial 28 with value: 0.06973059670628973.
[I 2025-11-03 13:15:18,065] Trial 45 finished with value: 0.04464171678884912 and parameters: {'model_type': 'gcn', 'hidden_dims': '[512, 256]', 'dropout': 0.21116024917275192, 'batch_norm': True, 'lr': 5.933565871542592e-05, 'weight_decay': 1.0133186920134618e-07, 'epochs': 163, 'loss': 'mse', 'optimizer': 'adam', 'graph_mode': 'off', 'use_snp_selection': False}. Best is trial 28 with value: 0.06973059670628973.
[I 2025-11-03 13:15:19,408] Trial 46 finished with value: 0.03884011629555368 and parameters: {'model_type': 'gcn', 'hidden_dims': '[512, 256]', 'dropout': 0.17852166646534837, 'batch_norm': False, 'lr': 0.00017537901736904558, 'weight_decay': 1.6011772457481513e-06, 'epochs': 132, 'loss': 'mse', 'optimizer': 'adam', 'graph_mode': 'off', 'use_snp_selection': False}. Best is trial 28 with value: 0.06973059670628973.
[I 2025-11-03 13:15:20,112] Trial 47 finished with value: 0.052537525765261536 and parameters: {'model_type': 'gcn', 'hidden_dims': '[256, 128]', 'dropout': 0.27913105741875666, 'batch_norm': True, 'lr': 0.0002980179538330225, 'weight_decay': 1.4693562314463247e-05, 'epochs': 40, 'loss': 'mae', 'optimizer': 'adam', 'graph_mode': 'off', 'use_snp_selection': False}. Best is trial 28 with value: 0.06973059670628973.
[I 2025-11-03 13:15:20,951] Trial 48 finished with value: 0.04422518839377387 and parameters: {'model_type': 'gcn', 'hidden_dims': '[512, 256]', 'dropout': 0.2199039906260729, 'batch_norm': True, 'lr': 5.4225318606953005e-05, 'weight_decay': 2.5189408946371933e-07, 'epochs': 182, 'loss': 'mse', 'optimizer': 'adam', 'graph_mode': 'off', 'use_snp_selection': True, 'num_snps': 2035}. Best is trial 28 with value: 0.06973059670628973.
[I 2025-11-03 13:15:22,041] Trial 49 finished with value: 0.057499870540437543 and parameters: {'model_type': 'gcn', 'hidden_dims': '[512, 128]', 'dropout': 0.1342859664897493, 'batch_norm': True, 'lr': 0.0006358970067066968, 'weight_decay': 1.4109034934771163e-07, 'epochs': 74, 'loss': 'mae', 'optimizer': 'adam', 'graph_mode': 'off', 'use_snp_selection': False}. Best is trial 28 with value: 0.06973059670628973.
[I 2025-11-03 13:15:23,256] Trial 50 finished with value: 0.049963768155804215 and parameters: {'model_type': 'gcn', 'hidden_dims': '[512, 256]', 'dropout': 0.18177334733675188, 'batch_norm': True, 'lr': 0.00023469730457665767, 'weight_decay': 8.911883256377486e-07, 'epochs': 111, 'loss': 'mse', 'optimizer': 'adam', 'graph_mode': 'off', 'use_snp_selection': False}. Best is trial 28 with value: 0.06973059670628973.
[I 2025-11-03 13:15:25,321] Trial 51 finished with value: 0.058695531027055506 and parameters: {'model_type': 'gcn', 'hidden_dims': '[512, 256]', 'dropout': 0.36180528087192443, 'batch_norm': True, 'lr': 0.00035647212074110417, 'weight_decay': 6.117648419945157e-07, 'epochs': 293, 'loss': 'mse', 'optimizer': 'adam', 'graph_mode': 'off', 'use_snp_selection': False}. Best is trial 28 with value: 0.06973059670628973.
[I 2025-11-03 13:15:27,016] Trial 52 finished with value: 0.0668283793888139 and parameters: {'model_type': 'gcn', 'hidden_dims': '[512, 256]', 'dropout': 0.3473146758536939, 'batch_norm': True, 'lr': 0.0002675569416587105, 'weight_decay': 4.059566644995098e-07, 'epochs': 209, 'loss': 'mse', 'optimizer': 'adam', 'graph_mode': 'off', 'use_snp_selection': False}. Best is trial 28 with value: 0.06973059670628973.
[I 2025-11-03 13:15:28,799] Trial 53 finished with value: 0.045370151895673214 and parameters: {'model_type': 'gcn', 'hidden_dims': '[512, 256]', 'dropout': 0.3135023670151631, 'batch_norm': True, 'lr': 0.00017388532787972254, 'weight_decay': 4.293669198378048e-07, 'epochs': 231, 'loss': 'mse', 'optimizer': 'adam', 'graph_mode': 'off', 'use_snp_selection': False}. Best is trial 28 with value: 0.06973059670628973.
[I 2025-11-03 13:15:30,101] Trial 54 finished with value: 0.05254653845024296 and parameters: {'model_type': 'gcn', 'hidden_dims': '[512, 256]', 'dropout': 0.4070369524606251, 'batch_norm': True, 'lr': 0.00010105952579074899, 'weight_decay': 2.996404809287743e-07, 'epochs': 194, 'loss': 'mse', 'optimizer': 'adam', 'graph_mode': 'off', 'use_snp_selection': True, 'num_snps': 20002}. Best is trial 28 with value: 0.06973059670628973.
[I 2025-11-03 13:15:31,772] Trial 55 finished with value: -0.037441383336794476 and parameters: {'model_type': 'gcn', 'hidden_dims': '[512, 64]', 'dropout': 0.3374811433685612, 'batch_norm': True, 'lr': 1.0579705559789618e-06, 'weight_decay': 1.880912228376896e-07, 'epochs': 203, 'loss': 'mse', 'optimizer': 'adam', 'graph_mode': 'off', 'use_snp_selection': False}. Best is trial 28 with value: 0.06973059670628973.
[I 2025-11-03 13:15:33,499] Trial 56 finished with value: 0.06306473432491555 and parameters: {'model_type': 'gcn', 'hidden_dims': '[512, 256]', 'dropout': 0.26289909761168295, 'batch_norm': True, 'lr': 0.0005612488752688291, 'weight_decay': 0.0008564468214857486, 'epochs': 221, 'loss': 'mse', 'optimizer': 'adam', 'graph_mode': 'off', 'use_snp_selection': False}. Best is trial 28 with value: 0.06973059670628973.
[I 2025-11-03 13:15:35,004] Trial 57 finished with value: 0.04996613532688496 and parameters: {'model_type': 'gcn', 'hidden_dims': '[256, 128, 64]', 'dropout': 0.3954078819840967, 'batch_norm': False, 'lr': 0.0005895386454697479, 'weight_decay': 0.000730826425349866, 'epochs': 253, 'loss': 'mae', 'optimizer': 'adam', 'graph_mode': 'off', 'use_snp_selection': False}. Best is trial 28 with value: 0.06973059670628973.
[I 2025-11-03 13:15:36,238] Trial 58 finished with value: 0.05416652548861484 and parameters: {'model_type': 'gcn', 'hidden_dims': '[128, 64]', 'dropout': 0.29148414962549696, 'batch_norm': True, 'lr': 0.0003979992999473876, 'weight_decay': 0.0001282273357865414, 'epochs': 225, 'loss': 'mse', 'optimizer': 'adam', 'graph_mode': 'off', 'use_snp_selection': True, 'num_snps': 19397}. Best is trial 28 with value: 0.06973059670628973.
[I 2025-11-03 13:15:38,107] Trial 59 finished with value: 0.06904803753631067 and parameters: {'model_type': 'gcn', 'hidden_dims': '[512, 256]', 'dropout': 0.3382111405331227, 'batch_norm': True, 'lr': 0.00012233990307311312, 'weight_decay': 9.300889372438055e-06, 'epochs': 247, 'loss': 'mse', 'optimizer': 'adam', 'graph_mode': 'off', 'use_snp_selection': False}. Best is trial 28 with value: 0.06973059670628973.
[I 2025-11-03 13:15:39,823] Trial 60 finished with value: 0.04683949168385272 and parameters: {'model_type': 'gcn', 'hidden_dims': '[512, 256]', 'dropout': 0.34359305001314117, 'batch_norm': True, 'lr': 0.00013479451808425853, 'weight_decay': 7.190541526647866e-06, 'epochs': 215, 'loss': 'mse', 'optimizer': 'adam', 'graph_mode': 'off', 'use_snp_selection': False}. Best is trial 28 with value: 0.06973059670628973.
[I 2025-11-03 13:15:41,702] Trial 61 finished with value: 0.05666844223181519 and parameters: {'model_type': 'gcn', 'hidden_dims': '[512, 256]', 'dropout': 0.32522169040150317, 'batch_norm': True, 'lr': 6.077816661482892e-05, 'weight_decay': 0.00046317970809067944, 'epochs': 247, 'loss': 'mse', 'optimizer': 'adam', 'graph_mode': 'off', 'use_snp_selection': False}. Best is trial 28 with value: 0.06973059670628973.
[I 2025-11-03 13:15:43,553] Trial 62 finished with value: 0.04820672721100717 and parameters: {'model_type': 'gcn', 'hidden_dims': '[512, 256]', 'dropout': 0.42831014791365296, 'batch_norm': True, 'lr': 7.398362890658747e-05, 'weight_decay': 2.4487149914721128e-05, 'epochs': 239, 'loss': 'mse', 'optimizer': 'adam', 'graph_mode': 'off', 'use_snp_selection': False}. Best is trial 28 with value: 0.06973059670628973.
[I 2025-11-03 13:15:45,485] Trial 63 finished with value: 0.060597080627887094 and parameters: {'model_type': 'gcn', 'hidden_dims': '[512, 256]', 'dropout': 0.27691452971197017, 'batch_norm': True, 'lr': 0.00024716645365232046, 'weight_decay': 3.646851463572918e-06, 'epochs': 262, 'loss': 'mse', 'optimizer': 'adam', 'graph_mode': 'off', 'use_snp_selection': False}. Best is trial 28 with value: 0.06973059670628973.
[I 2025-11-03 13:15:47,442] Trial 64 finished with value: 0.05778439889440618 and parameters: {'model_type': 'gcn', 'hidden_dims': '[512, 256]', 'dropout': 0.27626402015052076, 'batch_norm': True, 'lr': 0.000978978920146627, 'weight_decay': 3.4622555436278162e-06, 'epochs': 268, 'loss': 'mse', 'optimizer': 'adam', 'graph_mode': 'off', 'use_snp_selection': False}. Best is trial 28 with value: 0.06973059670628973.
[I 2025-11-03 13:15:49,486] Trial 65 finished with value: 0.06402635384553905 and parameters: {'model_type': 'gcn', 'hidden_dims': '[512, 256]', 'dropout': 0.3810957848014987, 'batch_norm': True, 'lr': 0.0002469957975955439, 'weight_decay': 3.072757000015056e-05, 'epochs': 288, 'loss': 'mse', 'optimizer': 'adam', 'graph_mode': 'off', 'use_snp_selection': False}. Best is trial 28 with value: 0.06973059670628973.
[I 2025-11-03 13:15:51,729] Trial 66 finished with value: 0.06120077779082256 and parameters: {'model_type': 'gcn', 'hidden_dims': '[512, 256]', 'dropout': 0.3683275439907166, 'batch_norm': True, 'lr': 0.0005086440367368692, 'weight_decay': 3.744385748303522e-05, 'epochs': 329, 'loss': 'mse', 'optimizer': 'adam', 'graph_mode': 'off', 'use_snp_selection': False}. Best is trial 28 with value: 0.06973059670628973.
[I 2025-11-03 13:15:53,869] Trial 67 finished with value: 0.05926214592483408 and parameters: {'model_type': 'gcn', 'hidden_dims': '[512, 256]', 'dropout': 0.39317847987925386, 'batch_norm': True, 'lr': 0.00020062275862773603, 'weight_decay': 0.0002640036023794336, 'epochs': 308, 'loss': 'mse', 'optimizer': 'adam', 'graph_mode': 'off', 'use_snp_selection': False}. Best is trial 28 with value: 0.06973059670628973.
[I 2025-11-03 13:15:55,891] Trial 68 finished with value: 0.055792183286989254 and parameters: {'model_type': 'gcn', 'hidden_dims': '[512, 256]', 'dropout': 0.29984674482858886, 'batch_norm': True, 'lr': 0.0007316035193857437, 'weight_decay': 9.1954069171663e-06, 'epochs': 281, 'loss': 'mae', 'optimizer': 'adam', 'graph_mode': 'off', 'use_snp_selection': False}. Best is trial 28 with value: 0.06973059670628973.
[I 2025-11-03 13:15:56,642] Trial 69 finished with value: 0.014616620200069423 and parameters: {'model_type': 'gcn', 'hidden_dims': '[256, 128]', 'dropout': 0.3525160103189969, 'batch_norm': False, 'lr': 0.00038255329280680554, 'weight_decay': 0.00011396127077428978, 'epochs': 49, 'loss': 'mse', 'optimizer': 'adam', 'graph_mode': 'off', 'use_snp_selection': False}. Best is trial 28 with value: 0.06973059670628973.
[I 2025-11-03 13:15:58,936] Trial 70 finished with value: 0.057834292980623 and parameters: {'model_type': 'gcn', 'hidden_dims': '[512, 128]', 'dropout': 0.33122818260652487, 'batch_norm': True, 'lr': 0.00014320590289841674, 'weight_decay': 0.0002188733701612543, 'epochs': 212, 'loss': 'mse', 'optimizer': 'adam', 'graph_mode': 'off', 'use_snp_selection': True, 'num_snps': 52353}. Best is trial 28 with value: 0.06973059670628973.
[I 2025-11-03 13:16:01,231] Trial 71 finished with value: 0.07153641871066653 and parameters: {'model_type': 'gcn', 'hidden_dims': '[512, 256]', 'dropout': 0.3756307092670691, 'batch_norm': True, 'lr': 0.0004884216493771381, 'weight_decay': 2.971109925714124e-05, 'epochs': 341, 'loss': 'mse', 'optimizer': 'adam', 'graph_mode': 'off', 'use_snp_selection': False}. Best is trial 71 with value: 0.07153641871066653.
[I 2025-11-03 13:16:03,325] Trial 72 finished with value: 0.044896238105866376 and parameters: {'model_type': 'gcn', 'hidden_dims': '[512, 256]', 'dropout': 0.3817693852778695, 'batch_norm': True, 'lr': 0.00025820170534117403, 'weight_decay': 2.2535609562398526e-05, 'epochs': 305, 'loss': 'mse', 'optimizer': 'adam', 'graph_mode': 'off', 'use_snp_selection': False}. Best is trial 71 with value: 0.07153641871066653.
[I 2025-11-03 13:16:05,628] Trial 73 finished with value: 0.05776383955775542 and parameters: {'model_type': 'gcn', 'hidden_dims': '[512, 256]', 'dropout': 0.4190820955931824, 'batch_norm': True, 'lr': 0.0005275028977891793, 'weight_decay': 3.629740059148072e-05, 'epochs': 344, 'loss': 'mse', 'optimizer': 'adam', 'graph_mode': 'off', 'use_snp_selection': False}. Best is trial 71 with value: 0.07153641871066653.
[I 2025-11-03 13:16:07,236] Trial 74 finished with value: 0.04321392335275433 and parameters: {'model_type': 'gcn', 'hidden_dims': '[512, 256]', 'dropout': 0.4572319355006472, 'batch_norm': True, 'lr': 0.0007115449519197757, 'weight_decay': 6.274545294618281e-05, 'epochs': 192, 'loss': 'mse', 'optimizer': 'adam', 'graph_mode': 'off', 'use_snp_selection': False}. Best is trial 71 with value: 0.07153641871066653.
[I 2025-11-03 13:16:09,397] Trial 75 finished with value: 0.06203950085672342 and parameters: {'model_type': 'gcn', 'hidden_dims': '[512, 256]', 'dropout': 0.4079930063502659, 'batch_norm': True, 'lr': 0.00043676484912876597, 'weight_decay': 8.44408227024737e-05, 'epochs': 318, 'loss': 'mse', 'optimizer': 'adam', 'graph_mode': 'off', 'use_snp_selection': False}. Best is trial 71 with value: 0.07153641871066653.
[I 2025-11-03 13:16:11,151] Trial 76 finished with value: 0.02045575638670278 and parameters: {'model_type': 'gcn', 'hidden_dims': '[256, 128, 64]', 'dropout': 0.3737537057224702, 'batch_norm': True, 'lr': 0.00010093827548294973, 'weight_decay': 4.6769221264849656e-05, 'epochs': 300, 'loss': 'mse', 'optimizer': 'adam', 'graph_mode': 'off', 'use_snp_selection': False}. Best is trial 71 with value: 0.07153641871066653.
[I 2025-11-03 13:16:12,482] Trial 77 finished with value: 0.05689715469186423 and parameters: {'model_type': 'gcn', 'hidden_dims': '[128, 64]', 'dropout': 0.10140997642964786, 'batch_norm': True, 'lr': 0.00011529764770427836, 'weight_decay': 1.2751076678661254e-05, 'epochs': 327, 'loss': 'mse', 'optimizer': 'adam', 'graph_mode': 'off', 'use_snp_selection': False}. Best is trial 71 with value: 0.07153641871066653.
[I 2025-11-03 13:16:14,354] Trial 78 finished with value: 0.06966729591750487 and parameters: {'model_type': 'gcn', 'hidden_dims': '[512, 256]', 'dropout': 0.3510684763270321, 'batch_norm': True, 'lr': 0.00018426539668095528, 'weight_decay': 1.863043442911421e-05, 'epochs': 247, 'loss': 'mse', 'optimizer': 'adam', 'graph_mode': 'off', 'use_snp_selection': False}. Best is trial 71 with value: 0.07153641871066653.
[I 2025-11-03 13:16:16,349] Trial 79 finished with value: 0.059828988395231195 and parameters: {'model_type': 'gcn', 'hidden_dims': '[512, 64]', 'dropout': 0.3467593229186012, 'batch_norm': True, 'lr': 0.0001678478294049072, 'weight_decay': 3.20510848002396e-05, 'epochs': 285, 'loss': 'mse', 'optimizer': 'adam', 'graph_mode': 'off', 'use_snp_selection': False}. Best is trial 71 with value: 0.07153641871066653.
[I 2025-11-03 13:16:18,296] Trial 80 finished with value: 0.0461458396517758 and parameters: {'model_type': 'gcn', 'hidden_dims': '[512, 256]', 'dropout': 0.3092804127072308, 'batch_norm': True, 'lr': 4.516542070646006e-05, 'weight_decay': 2.1765534070565397e-05, 'epochs': 273, 'loss': 'mse', 'optimizer': 'adam', 'graph_mode': 'off', 'use_snp_selection': False}. Best is trial 71 with value: 0.07153641871066653.
[I 2025-11-03 13:16:20,147] Trial 81 finished with value: 0.04989736736291002 and parameters: {'model_type': 'gcn', 'hidden_dims': '[512, 256]', 'dropout': 0.38362567744164416, 'batch_norm': True, 'lr': 0.00019850257827219042, 'weight_decay': 1.7195630438659502e-05, 'epochs': 243, 'loss': 'mse', 'optimizer': 'adam', 'graph_mode': 'off', 'use_snp_selection': False}. Best is trial 71 with value: 0.07153641871066653.
[I 2025-11-03 13:16:21,881] Trial 82 finished with value: 0.0490426480776382 and parameters: {'model_type': 'gcn', 'hidden_dims': '[512, 256]', 'dropout': 0.3523690088758129, 'batch_norm': True, 'lr': 0.00037126546973982925, 'weight_decay': 9.285224703556228e-06, 'epochs': 230, 'loss': 'mse', 'optimizer': 'adam', 'graph_mode': 'off', 'use_snp_selection': False}. Best is trial 71 with value: 0.07153641871066653.
[I 2025-11-03 13:16:23,750] Trial 83 finished with value: 0.061171866485198595 and parameters: {'model_type': 'gcn', 'hidden_dims': '[512, 256]', 'dropout': 0.31958728510898116, 'batch_norm': True, 'lr': 0.00026544312723327646, 'weight_decay': 2.4744791692686885e-06, 'epochs': 251, 'loss': 'mse', 'optimizer': 'adam', 'graph_mode': 'off', 'use_snp_selection': False}. Best is trial 71 with value: 0.07153641871066653.
[I 2025-11-03 13:16:25,459] Trial 84 finished with value: 0.04843513886197643 and parameters: {'model_type': 'gcn', 'hidden_dims': '[512, 256]', 'dropout': 0.3005786534205368, 'batch_norm': True, 'lr': 7.96839737511187e-05, 'weight_decay': 1.3734160588540527e-07, 'epochs': 220, 'loss': 'mse', 'optimizer': 'adam', 'graph_mode': 'off', 'use_snp_selection': False}. Best is trial 71 with value: 0.07153641871066653.
[I 2025-11-03 13:16:26,421] Trial 85 finished with value: 0.05589205266238037 and parameters: {'model_type': 'gcn', 'hidden_dims': '[512, 256]', 'dropout': 0.16830780335241174, 'batch_norm': True, 'lr': 0.0008491413136785101, 'weight_decay': 0.0004195737253774191, 'epochs': 49, 'loss': 'mse', 'optimizer': 'adam', 'graph_mode': 'off', 'use_snp_selection': False}. Best is trial 71 with value: 0.07153641871066653.
[I 2025-11-03 13:16:28,046] Trial 86 finished with value: 0.038147371517572096 and parameters: {'model_type': 'gcn', 'hidden_dims': '[512, 256]', 'dropout': 0.2653583685482258, 'batch_norm': True, 'lr': 0.00020686158631792547, 'weight_decay': 5.119409958036397e-05, 'epochs': 201, 'loss': 'mse', 'optimizer': 'adam', 'graph_mode': 'off', 'use_snp_selection': False}. Best is trial 71 with value: 0.07153641871066653.
[I 2025-11-03 13:16:29,085] Trial 87 finished with value: 0.009288492494837437 and parameters: {'model_type': 'gcn', 'hidden_dims': '[512, 256]', 'dropout': 0.24214108876619314, 'batch_norm': False, 'lr': 0.00011503171503869438, 'weight_decay': 2.876463813575947e-05, 'epochs': 67, 'loss': 'mae', 'optimizer': 'adam', 'graph_mode': 'off', 'use_snp_selection': False}. Best is trial 71 with value: 0.07153641871066653.
[I 2025-11-03 13:16:30,276] Trial 88 finished with value: 0.05431067758425026 and parameters: {'model_type': 'gcn', 'hidden_dims': '[256, 128]', 'dropout': 0.36393094713245033, 'batch_norm': True, 'lr': 0.0005188290021072656, 'weight_decay': 4.60944764701692e-06, 'epochs': 188, 'loss': 'mse', 'optimizer': 'adam', 'graph_mode': 'off', 'use_snp_selection': False}. Best is trial 71 with value: 0.07153641871066653.
[I 2025-11-03 13:16:30,899] Trial 89 finished with value: -0.046363513202634016 and parameters: {'model_type': 'gcn', 'hidden_dims': '[512, 256]', 'dropout': 0.12517402802141964, 'batch_norm': True, 'lr': 2.2324635553408726e-06, 'weight_decay': 0.0009211904090186689, 'epochs': 59, 'loss': 'mse', 'optimizer': 'adam', 'graph_mode': 'off', 'use_snp_selection': True, 'num_snps': 5201}. Best is trial 71 with value: 0.07153641871066653.
