[I 2025-11-03 13:32:56,221] Trial 6 finished with value: 0.08854466308305547 and parameters: {'model_type': 'gcn', 'hidden_dims': '[512, 256]', 'dropout': 0.3534893146320237, 'batch_norm': True, 'lr': 0.000251307964226932, 'weight_decay': 1.821819791794022e-05, 'epochs': 207, 'loss': 'mae', 'optimizer': 'adam', 'graph_mode': 'knn', 'source': 'grm', 'knn_k': 1, 'weighted_edges': True, 'symmetrize_mode': 'mutual', 'use_snp_selection': False}. Best is trial 5 with value: 0.11004804627476908.
[I 2025-11-03 13:32:58,423] Trial 7 finished with value: 0.10161795688682652 and parameters: {'model_type': 'gcn', 'hidden_dims': '[512, 256]', 'dropout': 0.1105825955860775, 'batch_norm': True, 'lr': 2.374338412754043e-05, 'weight_decay': 1.1284721123340274e-05, 'epochs': 170, 'loss': 'mse', 'optimizer': 'adam', 'graph_mode': 'cutoff', 'cutoff': 0.719872204109604, 'grm_norm': 'gcn', 'self_loops': False, 'use_snp_selection': False}. Best is trial 5 with value: 0.11004804627476908.
[I 2025-11-03 13:33:00,221] Trial 8 finished with value: 0.10165834801893789 and parameters: {'model_type': 'gcn', 'hidden_dims': '[512, 128]', 'dropout': 0.5066580418354021, 'batch_norm': True, 'lr': 0.00039213678276659976, 'weight_decay': 3.43655320802934e-06, 'epochs': 91, 'loss': 'mse', 'optimizer': 'adam', 'graph_mode': 'cutoff', 'cutoff': 0.34923059576505366, 'grm_norm': 'cosine', 'self_loops': True, 'use_snp_selection': False}. Best is trial 5 with value: 0.11004804627476908.
[I 2025-11-03 13:33:01,869] Trial 9 finished with value: 0.033576138138956414 and parameters: {'model_type': 'gcn', 'hidden_dims': '[512, 256]', 'dropout': 0.301734920240333, 'batch_norm': False, 'lr': 6.650961854953448e-06, 'weight_decay': 6.861575656590315e-05, 'epochs': 125, 'loss': 'mae', 'optimizer': 'adam', 'graph_mode': 'cutoff', 'cutoff': 0.2857569870061939, 'grm_norm': 'cosine_then_gcn', 'self_loops': False, 'use_snp_selection': True, 'num_snps': 12722}. Best is trial 5 with value: 0.11004804627476908.
[I 2025-11-03 13:33:05,630] Trial 10 finished with value: 0.07599317713235704 and parameters: {'model_type': 'gcn', 'hidden_dims': '[256, 128]', 'dropout': 0.42081077970837905, 'batch_norm': False, 'lr': 6.10458015764876e-05, 'weight_decay': 1.1882920363656207e-07, 'epochs': 255, 'loss': 'mae', 'optimizer': 'adam', 'graph_mode': 'knn', 'source': 'grm', 'knn_k': 1, 'weighted_edges': False, 'symmetrize_mode': 'union', 'use_snp_selection': True, 'num_snps': 58960}. Best is trial 5 with value: 0.11004804627476908.
[I 2025-11-03 13:33:07,417] Trial 11 finished with value: -0.010335690969268058 and parameters: {'model_type': 'gcn', 'hidden_dims': '[512, 128]', 'dropout': 0.5984993350797241, 'batch_norm': True, 'lr': 8.807069823561703e-06, 'weight_decay': 1.0705295993875854e-06, 'epochs': 84, 'loss': 'mse', 'optimizer': 'adam', 'graph_mode': 'cutoff', 'cutoff': 0.26571427357234195, 'grm_norm': 'cosine', 'self_loops': True, 'use_snp_selection': False}. Best is trial 5 with value: 0.11004804627476908.
[I 2025-11-03 13:33:10,365] Trial 12 finished with value: 0.08785444229828757 and parameters: {'model_type': 'gcn', 'hidden_dims': '[512, 128]', 'dropout': 0.4599947205431382, 'batch_norm': True, 'lr': 0.00012059085553112925, 'weight_decay': 2.1215328315431727e-06, 'epochs': 72, 'loss': 'mse', 'optimizer': 'adam', 'graph_mode': 'cutoff', 'cutoff': 0.421678803879304, 'grm_norm': 'cosine', 'self_loops': True, 'use_snp_selection': True, 'num_snps': 47202}. Best is trial 5 with value: 0.11004804627476908.
[I 2025-11-03 13:33:12,915] Trial 13 finished with value: -0.01606966792996974 and parameters: {'model_type': 'gcn', 'hidden_dims': '[512, 64]', 'dropout': 0.33212846078805314, 'batch_norm': False, 'lr': 0.0009511944508019283, 'weight_decay': 3.5747956999090315e-07, 'epochs': 219, 'loss': 'mae', 'optimizer': 'adam', 'graph_mode': 'knn', 'source': 'grm', 'knn_k': 3, 'weighted_edges': False, 'symmetrize_mode': 'mutual', 'use_snp_selection': False}. Best is trial 5 with value: 0.11004804627476908.
[I 2025-11-03 13:33:14,189] Trial 14 finished with value: 0.06000664046343804 and parameters: {'model_type': 'gcn', 'hidden_dims': '[256, 128]', 'dropout': 0.4954985374764213, 'batch_norm': False, 'lr': 1.3016112233830318e-05, 'weight_decay': 3.3027094595086673e-06, 'epochs': 127, 'loss': 'mse', 'optimizer': 'adam', 'graph_mode': 'cutoff', 'cutoff': 0.8580286026410489, 'grm_norm': 'cosine', 'self_loops': True, 'use_snp_selection': True, 'num_snps': 3235}. Best is trial 5 with value: 0.11004804627476908.
[I 2025-11-03 13:33:15,897] Trial 15 finished with value: 0.05874768129366475 and parameters: {'model_type': 'gcn', 'hidden_dims': '[512, 128]', 'dropout': 0.5886626138803472, 'batch_norm': True, 'lr': 2.5184171235839736e-06, 'weight_decay': 5.975753425933883e-07, 'epochs': 55, 'loss': 'mae', 'optimizer': 'adam', 'graph_mode': 'knn', 'source': 'grm', 'knn_k': 10, 'weighted_edges': False, 'symmetrize_mode': 'mutual', 'use_snp_selection': False}. Best is trial 5 with value: 0.11004804627476908.
[I 2025-11-03 13:33:17,910] Trial 16 finished with value: 0.07627491383156154 and parameters: {'model_type': 'gcn', 'hidden_dims': '[512, 64]', 'dropout': 0.26975994233841055, 'batch_norm': True, 'lr': 0.0003339196196763792, 'weight_decay': 4.593023431210687e-06, 'epochs': 120, 'loss': 'mae', 'optimizer': 'adam', 'graph_mode': 'knn', 'source': 'grm', 'knn_k': 4, 'weighted_edges': False, 'symmetrize_mode': 'union', 'use_snp_selection': False}. Best is trial 5 with value: 0.11004804627476908.
[I 2025-11-03 13:33:21,243] Trial 17 finished with value: 0.0849512174698904 and parameters: {'model_type': 'gcn', 'hidden_dims': '[256, 128, 64]', 'dropout': 0.4115989001707498, 'batch_norm': False, 'lr': 7.192653988838788e-05, 'weight_decay': 1.81558493676973e-07, 'epochs': 261, 'loss': 'mse', 'optimizer': 'adam', 'graph_mode': 'cutoff', 'cutoff': 0.41461087487564086, 'grm_norm': 'cosine_then_gcn', 'self_loops': True, 'use_snp_selection': True, 'num_snps': 42598}. Best is trial 5 with value: 0.11004804627476908.
[I 2025-11-03 13:33:24,673] Trial 18 finished with value: -0.004861587158864376 and parameters: {'model_type': 'gcn', 'hidden_dims': '[256, 128]', 'dropout': 0.4702373868591425, 'batch_norm': True, 'lr': 4.558649580263114e-06, 'weight_decay': 0.0003308610372813585, 'epochs': 139, 'loss': 'mse', 'optimizer': 'adam', 'graph_mode': 'cutoff', 'cutoff': 0.413489159736516, 'grm_norm': 'none', 'self_loops': True, 'use_snp_selection': True, 'num_snps': 59609}. Best is trial 5 with value: 0.11004804627476908.
[I 2025-11-03 13:33:27,090] Trial 19 finished with value: 0.03371543998061719 and parameters: {'model_type': 'gcn', 'hidden_dims': '[512, 128]', 'dropout': 0.5436801176542189, 'batch_norm': False, 'lr': 2.7013005792357815e-05, 'weight_decay': 5.479057326207408e-06, 'epochs': 199, 'loss': 'mae', 'optimizer': 'adam', 'graph_mode': 'knn', 'source': 'grm', 'knn_k': 4, 'weighted_edges': False, 'symmetrize_mode': 'mutual', 'use_snp_selection': False}. Best is trial 5 with value: 0.11004804627476908.
[I 2025-11-03 13:33:28,653] Trial 20 finished with value: -0.01639917713901446 and parameters: {'model_type': 'gcn', 'hidden_dims': '[256, 128]', 'dropout': 0.24857610355091198, 'batch_norm': False, 'lr': 1.1277956545809076e-06, 'weight_decay': 6.339175500454725e-07, 'epochs': 2, 'loss': 'mae', 'optimizer': 'adam', 'graph_mode': 'knn', 'source': 'grm', 'knn_k': 3, 'weighted_edges': True, 'symmetrize_mode': 'union', 'use_snp_selection': True, 'num_snps': 20304}. Best is trial 5 with value: 0.11004804627476908.
[I 2025-11-03 13:33:30,873] Trial 21 finished with value: 0.07334537470849395 and parameters: {'model_type': 'gcn', 'hidden_dims': '[512, 256]', 'dropout': 0.11675642375236583, 'batch_norm': True, 'lr': 2.7538032453043592e-05, 'weight_decay': 5.862709679424951e-06, 'epochs': 165, 'loss': 'mse', 'optimizer': 'adam', 'graph_mode': 'cutoff', 'cutoff': 0.767864873190189, 'grm_norm': 'gcn', 'self_loops': False, 'use_snp_selection': False}. Best is trial 5 with value: 0.11004804627476908.
[I 2025-11-03 13:33:32,719] Trial 22 finished with value: 0.05326478205204207 and parameters: {'model_type': 'gcn', 'hidden_dims': '[512, 256]', 'dropout': 0.1873323158021188, 'batch_norm': True, 'lr': 1.4832129670056981e-05, 'weight_decay': 1.0535169127567442e-05, 'epochs': 103, 'loss': 'mse', 'optimizer': 'adam', 'graph_mode': 'cutoff', 'cutoff': 0.6176313858450819, 'grm_norm': 'gcn', 'self_loops': False, 'use_snp_selection': False}. Best is trial 5 with value: 0.11004804627476908.
[I 2025-11-03 13:33:34,954] Trial 23 finished with value: 0.056252219351355666 and parameters: {'model_type': 'gcn', 'hidden_dims': '[512, 256]', 'dropout': 0.3732092808163304, 'batch_norm': True, 'lr': 5.385313962092665e-05, 'weight_decay': 1.2502997027807794e-06, 'epochs': 174, 'loss': 'mse', 'optimizer': 'adam', 'graph_mode': 'cutoff', 'cutoff': 0.7376760313765204, 'grm_norm': 'cosine', 'self_loops': True, 'use_snp_selection': False}. Best is trial 5 with value: 0.11004804627476908.
[I 2025-11-03 13:33:36,534] Trial 24 finished with value: 0.05901860304214945 and parameters: {'model_type': 'gcn', 'hidden_dims': '[512, 128]', 'dropout': 0.4548782332359678, 'batch_norm': True, 'lr': 0.00013708780526326198, 'weight_decay': 6.950560817631993e-05, 'epochs': 54, 'loss': 'mse', 'optimizer': 'adam', 'graph_mode': 'cutoff', 'cutoff': 0.4940201660035215, 'grm_norm': 'gcn', 'self_loops': False, 'use_snp_selection': False}. Best is trial 5 with value: 0.11004804627476908.
[I 2025-11-03 13:33:38,730] Trial 25 finished with value: 0.057076947890146154 and parameters: {'model_type': 'gcn', 'hidden_dims': '[256, 128, 64]', 'dropout': 0.19872258695238082, 'batch_norm': True, 'lr': 1.822254920065117e-05, 'weight_decay': 1.0829518188583388e-05, 'epochs': 239, 'loss': 'mse', 'optimizer': 'adam', 'graph_mode': 'cutoff', 'cutoff': 0.8917570851956294, 'grm_norm': 'gcn', 'self_loops': False, 'use_snp_selection': False}. Best is trial 5 with value: 0.11004804627476908.
[I 2025-11-03 13:33:41,637] Trial 26 finished with value: 0.07419897832489601 and parameters: {'model_type': 'gcn', 'hidden_dims': '[512, 64]', 'dropout': 0.5460889589623693, 'batch_norm': True, 'lr': 0.00029627268573990067, 'weight_decay': 3.3475893201616213e-07, 'epochs': 297, 'loss': 'mse', 'optimizer': 'adam', 'graph_mode': 'cutoff', 'cutoff': 0.31485629483458405, 'grm_norm': 'cosine', 'self_loops': True, 'use_snp_selection': False}. Best is trial 5 with value: 0.11004804627476908.
[I 2025-11-03 13:33:43,760] Trial 27 finished with value: 0.08261335972387665 and parameters: {'model_type': 'gcn', 'hidden_dims': '[512, 256]', 'dropout': 0.434039497107621, 'batch_norm': True, 'lr': 8.133060169010774e-05, 'weight_decay': 2.253883026196471e-06, 'epochs': 155, 'loss': 'mse', 'optimizer': 'adam', 'graph_mode': 'cutoff', 'cutoff': 0.5030982617552886, 'grm_norm': 'none', 'self_loops': True, 'use_snp_selection': False}. Best is trial 5 with value: 0.11004804627476908.
[I 2025-11-03 13:33:46,571] Trial 28 finished with value: 0.03828546999535003 and parameters: {'model_type': 'gcn', 'hidden_dims': '[256, 128]', 'dropout': 0.3730906829284106, 'batch_norm': False, 'lr': 3.872171923733156e-05, 'weight_decay': 0.0001342154225322901, 'epochs': 193, 'loss': 'mae', 'optimizer': 'adam', 'graph_mode': 'knn', 'source': 'grm', 'knn_k': 10, 'weighted_edges': False, 'symmetrize_mode': 'mutual', 'use_snp_selection': True, 'num_snps': 39596}. Best is trial 5 with value: 0.11004804627476908.
[I 2025-11-03 13:33:48,557] Trial 29 finished with value: 0.01054882899114424 and parameters: {'model_type': 'gcn', 'hidden_dims': '[128, 64]', 'dropout': 0.3069144185862068, 'batch_norm': True, 'lr': 3.0360712122447534e-06, 'weight_decay': 9.094200641913522e-07, 'epochs': 305, 'loss': 'mae', 'optimizer': 'adam', 'graph_mode': 'knn', 'source': 'grm', 'knn_k': 1, 'weighted_edges': False, 'symmetrize_mode': 'mutual', 'use_snp_selection': False}. Best is trial 5 with value: 0.11004804627476908.
[I 2025-11-03 13:33:50,432] Trial 30 finished with value: 0.02582541220592852 and parameters: {'model_type': 'gcn', 'hidden_dims': '[512, 128]', 'dropout': 0.24422796199122015, 'batch_norm': True, 'lr': 8.248713386646181e-06, 'weight_decay': 3.463499614239718e-05, 'epochs': 108, 'loss': 'mse', 'optimizer': 'adam', 'graph_mode': 'cutoff', 'cutoff': 0.7211370851251874, 'grm_norm': 'cosine_then_gcn', 'self_loops': False, 'use_snp_selection': False}. Best is trial 5 with value: 0.11004804627476908.
[I 2025-11-03 13:33:52,844] Trial 31 finished with value: 0.099682406211678 and parameters: {'model_type': 'gcn', 'hidden_dims': '[512, 256]', 'dropout': 0.3646628212599849, 'batch_norm': True, 'lr': 0.0002611590265619302, 'weight_decay': 1.2011509881627975e-05, 'epochs': 200, 'loss': 'mae', 'optimizer': 'adam', 'graph_mode': 'knn', 'source': 'grm', 'knn_k': 1, 'weighted_edges': True, 'symmetrize_mode': 'mutual', 'use_snp_selection': False}. Best is trial 5 with value: 0.11004804627476908.
[I 2025-11-03 13:33:55,177] Trial 32 finished with value: 0.09281103811934527 and parameters: {'model_type': 'gcn', 'hidden_dims': '[512, 256]', 'dropout': 0.38850606893769624, 'batch_norm': True, 'lr': 0.0005162565613436763, 'weight_decay': 6.792768278923063e-06, 'epochs': 183, 'loss': 'mae', 'optimizer': 'adam', 'graph_mode': 'knn', 'source': 'grm', 'knn_k': 2, 'weighted_edges': True, 'symmetrize_mode': 'mutual', 'use_snp_selection': False}. Best is trial 5 with value: 0.11004804627476908.
[I 2025-11-03 13:33:57,302] Trial 33 finished with value: 0.09461117732443196 and parameters: {'model_type': 'gcn', 'hidden_dims': '[512, 256]', 'dropout': 0.49379511905230034, 'batch_norm': True, 'lr': 0.00023697267630424818, 'weight_decay': 1.2969243227534917e-05, 'epochs': 145, 'loss': 'mae', 'optimizer': 'adam', 'graph_mode': 'knn', 'source': 'grm', 'knn_k': 4, 'weighted_edges': True, 'symmetrize_mode': 'mutual', 'use_snp_selection': False}. Best is trial 5 with value: 0.11004804627476908.
[I 2025-11-03 13:33:59,814] Trial 34 finished with value: 0.08323755225005383 and parameters: {'model_type': 'gcn', 'hidden_dims': '[512, 256]', 'dropout': 0.16851207668165813, 'batch_norm': True, 'lr': 0.00047061747790596605, 'weight_decay': 4.276549023709026e-05, 'epochs': 216, 'loss': 'mae', 'optimizer': 'adam', 'graph_mode': 'knn', 'source': 'grm', 'knn_k': 2, 'weighted_edges': True, 'symmetrize_mode': 'mutual', 'use_snp_selection': False}. Best is trial 5 with value: 0.11004804627476908.
[I 2025-11-03 13:34:01,567] Trial 35 finished with value: 0.09820519290552575 and parameters: {'model_type': 'gcn', 'hidden_dims': '[128, 64]', 'dropout': 0.33635707323075587, 'batch_norm': True, 'lr': 0.000971600094268512, 'weight_decay': 2.001887877511669e-06, 'epochs': 230, 'loss': 'mae', 'optimizer': 'adam', 'graph_mode': 'knn', 'source': 'grm', 'knn_k': 5, 'weighted_edges': True, 'symmetrize_mode': 'mutual', 'use_snp_selection': False}. Best is trial 5 with value: 0.11004804627476908.
[I 2025-11-03 13:34:03,743] Trial 36 finished with value: 0.023732840133388333 and parameters: {'model_type': 'gcn', 'hidden_dims': '[256, 128]', 'dropout': 0.5215607431512098, 'batch_norm': False, 'lr': 0.00017107661461794967, 'weight_decay': 2.8718905211496667e-06, 'epochs': 30, 'loss': 'mse', 'optimizer': 'adam', 'graph_mode': 'knn', 'source': 'grm', 'knn_k': 2, 'weighted_edges': False, 'symmetrize_mode': 'union', 'use_snp_selection': True, 'num_snps': 35153}. Best is trial 5 with value: 0.11004804627476908.
[I 2025-11-03 13:34:05,730] Trial 37 finished with value: 0.06264123279259542 and parameters: {'model_type': 'gcn', 'hidden_dims': '[256, 128, 64]', 'dropout': 0.4309158365854506, 'batch_norm': True, 'lr': 4.2693044446625484e-05, 'weight_decay': 2.087910036369287e-05, 'epochs': 172, 'loss': 'mae', 'optimizer': 'adam', 'graph_mode': 'knn', 'source': 'grm', 'knn_k': 3, 'weighted_edges': True, 'symmetrize_mode': 'mutual', 'use_snp_selection': False}. Best is trial 5 with value: 0.11004804627476908.
[I 2025-11-03 13:34:09,061] Trial 38 finished with value: 0.06777842585365151 and parameters: {'model_type': 'gcn', 'hidden_dims': '[512, 256]', 'dropout': 0.30516275061261766, 'batch_norm': False, 'lr': 8.950211959589095e-05, 'weight_decay': 0.0001335183860660517, 'epochs': 140, 'loss': 'mse', 'optimizer': 'adam', 'graph_mode': 'cutoff', 'cutoff': 0.20756425904903214, 'grm_norm': 'gcn', 'self_loops': False, 'use_snp_selection': True, 'num_snps': 49705}. Best is trial 5 with value: 0.11004804627476908.
[I 2025-11-03 13:34:10,394] Trial 39 finished with value: 0.08794566547363984 and parameters: {'model_type': 'gcn', 'hidden_dims': '[128, 64]', 'dropout': 0.15005240622512123, 'batch_norm': True, 'lr': 0.0004069396433146434, 'weight_decay': 4.030547219671232e-06, 'epochs': 84, 'loss': 'mae', 'optimizer': 'adam', 'graph_mode': 'knn', 'source': 'grm', 'knn_k': 8, 'weighted_edges': True, 'symmetrize_mode': 'mutual', 'use_snp_selection': False}. Best is trial 5 with value: 0.11004804627476908.
[I 2025-11-03 13:34:12,257] Trial 40 finished with value: 0.08089760580367406 and parameters: {'model_type': 'gcn', 'hidden_dims': '[512, 128]', 'dropout': 0.22501792123128356, 'batch_norm': False, 'lr': 0.00020646516420877879, 'weight_decay': 8.367597900324028e-06, 'epochs': 60, 'loss': 'mae', 'optimizer': 'adam', 'graph_mode': 'cutoff', 'cutoff': 0.8278023814287108, 'grm_norm': 'cosine', 'self_loops': True, 'use_snp_selection': True, 'num_snps': 22189}. Best is trial 5 with value: 0.11004804627476908.
[I 2025-11-03 13:34:14,042] Trial 41 finished with value: 0.08813047518541667 and parameters: {'model_type': 'gcn', 'hidden_dims': '[128, 64]', 'dropout': 0.34345769875979276, 'batch_norm': True, 'lr': 0.000797450817028174, 'weight_decay': 1.5394108483360118e-06, 'epochs': 236, 'loss': 'mae', 'optimizer': 'adam', 'graph_mode': 'knn', 'source': 'grm', 'knn_k': 5, 'weighted_edges': True, 'symmetrize_mode': 'mutual', 'use_snp_selection': False}. Best is trial 5 with value: 0.11004804627476908.
[I 2025-11-03 13:34:15,959] Trial 42 finished with value: 0.10119533058931315 and parameters: {'model_type': 'gcn', 'hidden_dims': '[128, 64]', 'dropout': 0.5705615600478042, 'batch_norm': True, 'lr': 0.0009493353135804404, 'weight_decay': 1.5506979006365752e-05, 'epochs': 284, 'loss': 'mae', 'optimizer': 'adam', 'graph_mode': 'knn', 'source': 'grm', 'knn_k': 6, 'weighted_edges': True, 'symmetrize_mode': 'mutual', 'use_snp_selection': False}. Best is trial 5 with value: 0.11004804627476908.
[I 2025-11-03 13:34:18,038] Trial 43 finished with value: 0.08747481624115988 and parameters: {'model_type': 'gcn', 'hidden_dims': '[128, 64]', 'dropout': 0.5779117875046005, 'batch_norm': True, 'lr': 0.000663236405293571, 'weight_decay': 1.6648162735557997e-05, 'epochs': 334, 'loss': 'mae', 'optimizer': 'adam', 'graph_mode': 'knn', 'source': 'grm', 'knn_k': 6, 'weighted_edges': True, 'symmetrize_mode': 'mutual', 'use_snp_selection': False}. Best is trial 5 with value: 0.11004804627476908.
[I 2025-11-03 13:34:19,921] Trial 44 finished with value: 0.07379503430499922 and parameters: {'model_type': 'gcn', 'hidden_dims': '[128, 64]', 'dropout': 0.5715443601959398, 'batch_norm': True, 'lr': 0.000638522340601467, 'weight_decay': 2.9721762058793583e-05, 'epochs': 270, 'loss': 'mae', 'optimizer': 'adam', 'graph_mode': 'knn', 'source': 'grm', 'knn_k': 7, 'weighted_edges': True, 'symmetrize_mode': 'mutual', 'use_snp_selection': False}. Best is trial 5 with value: 0.11004804627476908.
[I 2025-11-03 13:34:22,362] Trial 45 finished with value: 0.08897737601861687 and parameters: {'model_type': 'gcn', 'hidden_dims': '[256, 128]', 'dropout': 0.4824597521705724, 'batch_norm': True, 'lr': 0.00038772952291758755, 'weight_decay': 1.4424168923531926e-05, 'epochs': 350, 'loss': 'mae', 'optimizer': 'adam', 'graph_mode': 'knn', 'source': 'grm', 'knn_k': 2, 'weighted_edges': True, 'symmetrize_mode': 'mutual', 'use_snp_selection': False}. Best is trial 5 with value: 0.11004804627476908.
[I 2025-11-03 13:34:26,564] Trial 46 finished with value: 0.01581270123410584 and parameters: {'model_type': 'gcn', 'hidden_dims': '[512, 64]', 'dropout': 0.3932348208033324, 'batch_norm': True, 'lr': 0.00011371868946455974, 'weight_decay': 7.044656335792664e-05, 'epochs': 281, 'loss': 'mse', 'optimizer': 'adam', 'graph_mode': 'knn', 'source': 'grm', 'knn_k': 8, 'weighted_edges': False, 'symmetrize_mode': 'union', 'use_snp_selection': True, 'num_snps': 52735}. Best is trial 5 with value: 0.11004804627476908.
[I 2025-11-03 13:34:28,511] Trial 47 finished with value: 0.09224864311886437 and parameters: {'model_type': 'gcn', 'hidden_dims': '[512, 256]', 'dropout': 0.5246165188577545, 'batch_norm': False, 'lr': 0.00018286826290006097, 'weight_decay': 8.072882360672923e-06, 'epochs': 114, 'loss': 'mae', 'optimizer': 'adam', 'graph_mode': 'cutoff', 'cutoff': 0.6206394624475431, 'grm_norm': 'gcn', 'self_loops': True, 'use_snp_selection': False}. Best is trial 5 with value: 0.11004804627476908.
[I 2025-11-03 13:34:30,374] Trial 48 finished with value: 0.06468013311966396 and parameters: {'model_type': 'gcn', 'hidden_dims': '[512, 128]', 'dropout': 0.45136895491138196, 'batch_norm': True, 'lr': 2.268084088249921e-05, 'weight_decay': 3.0459828315874434e-06, 'epochs': 94, 'loss': 'mae', 'optimizer': 'adam', 'graph_mode': 'knn', 'source': 'grm', 'knn_k': 1, 'weighted_edges': True, 'symmetrize_mode': 'mutual', 'use_snp_selection': False}. Best is trial 5 with value: 0.11004804627476908.
[I 2025-11-03 13:34:32,862] Trial 49 finished with value: 0.03516559177287679 and parameters: {'model_type': 'gcn', 'hidden_dims': '[256, 128]', 'dropout': 0.5614711718709352, 'batch_norm': False, 'lr': 1.1943819963970778e-05, 'weight_decay': 2.960955931070086e-07, 'epochs': 129, 'loss': 'mse', 'optimizer': 'adam', 'graph_mode': 'cutoff', 'cutoff': 0.3434405718959245, 'grm_norm': 'cosine', 'self_loops': False, 'use_snp_selection': True, 'num_snps': 36971}. Best is trial 5 with value: 0.11004804627476908.
