[I 2025-11-13 12:25:05,802] Trial 117 finished with value: 0.2356005632493829 and parameters: {'model_type': 'graphsage', 'hidden_dims': '[512, 128]', 'dropout': 0.3518209322362401, 'batch_norm': False, 'lr': 0.00011475354284355796, 'weight_decay': 4.1474804170713476e-05, 'epochs': 63, 'loss': 'mae', 'optimizer': 'adam', 'graph_mode': 'cutoff', 'cutoff': 0.4620278088937513, 'grm_norm': 'cosine_then_gcn', 'self_loops': True, 'use_snp_selection': True, 'num_snps': 38164}. Best is trial 95 with value: 0.2647045825331954.
[I 2025-11-13 12:26:32,804] Trial 118 finished with value: 0.23141536101027693 and parameters: {'model_type': 'graphsage', 'hidden_dims': '[512, 128]', 'dropout': 0.3140103171960019, 'batch_norm': False, 'lr': 8.043624947417155e-05, 'weight_decay': 3.9426902031279096e-05, 'epochs': 110, 'loss': 'mae', 'optimizer': 'adam', 'graph_mode': 'cutoff', 'cutoff': 0.5255680507598505, 'grm_norm': 'none', 'self_loops': True, 'use_snp_selection': True, 'num_snps': 27050}. Best is trial 95 with value: 0.2647045825331954.
[I 2025-11-13 12:28:16,275] Trial 119 finished with value: 0.26374169843385403 and parameters: {'model_type': 'graphsage', 'hidden_dims': '[512, 128]', 'dropout': 0.36590079000241416, 'batch_norm': False, 'lr': 0.00017066456213748408, 'weight_decay': 1.2236938796566764e-05, 'epochs': 89, 'loss': 'mae', 'optimizer': 'adam', 'graph_mode': 'cutoff', 'cutoff': 0.4324749612556484, 'grm_norm': 'cosine_then_gcn', 'self_loops': True, 'use_snp_selection': True, 'num_snps': 35622}. Best is trial 95 with value: 0.2647045825331954.
[I 2025-11-13 12:29:51,449] Trial 120 finished with value: 0.2510994194644457 and parameters: {'model_type': 'graphsage', 'hidden_dims': '[512, 128]', 'dropout': 0.23106060132041675, 'batch_norm': False, 'lr': 0.00015571235669669802, 'weight_decay': 1.6180278445128334e-05, 'epochs': 88, 'loss': 'mae', 'optimizer': 'adam', 'graph_mode': 'cutoff', 'cutoff': 0.4938639692581911, 'grm_norm': 'cosine_then_gcn', 'self_loops': False, 'use_snp_selection': True, 'num_snps': 32813}. Best is trial 95 with value: 0.2647045825331954.
[I 2025-11-13 12:31:52,778] Trial 121 finished with value: 0.24509280467691658 and parameters: {'model_type': 'graphsage', 'hidden_dims': '[512, 128]', 'dropout': 0.36170721939141054, 'batch_norm': False, 'lr': 0.00012979297137876136, 'weight_decay': 1.0949403183409888e-05, 'epochs': 118, 'loss': 'mae', 'optimizer': 'adam', 'graph_mode': 'cutoff', 'cutoff': 0.4309164445565306, 'grm_norm': 'cosine_then_gcn', 'self_loops': True, 'use_snp_selection': True, 'num_snps': 36252}. Best is trial 95 with value: 0.2647045825331954.
[I 2025-11-13 12:33:30,716] Trial 122 finished with value: 0.24210547196162735 and parameters: {'model_type': 'graphsage', 'hidden_dims': '[512, 128]', 'dropout': 0.32256611410046243, 'batch_norm': False, 'lr': 0.00017373768688592675, 'weight_decay': 8.28858407662073e-05, 'epochs': 91, 'loss': 'mae', 'optimizer': 'adam', 'graph_mode': 'cutoff', 'cutoff': 0.5287793248468646, 'grm_norm': 'cosine_then_gcn', 'self_loops': True, 'use_snp_selection': True, 'num_snps': 37565}. Best is trial 95 with value: 0.2647045825331954.
[I 2025-11-13 12:34:55,692] Trial 123 finished with value: 0.2137850329062418 and parameters: {'model_type': 'graphsage', 'hidden_dims': '[512, 128]', 'dropout': 0.3425998826345204, 'batch_norm': False, 'lr': 0.00023128000311703635, 'weight_decay': 3.100105199404949e-05, 'epochs': 48, 'loss': 'mae', 'optimizer': 'adam', 'graph_mode': 'cutoff', 'cutoff': 0.7103556979582568, 'grm_norm': 'cosine_then_gcn', 'self_loops': True, 'use_snp_selection': True, 'num_snps': 41276}. Best is trial 95 with value: 0.2647045825331954.
[I 2025-11-13 12:36:43,881] Trial 124 finished with value: 0.2493934516624917 and parameters: {'model_type': 'graphsage', 'hidden_dims': '[512, 128]', 'dropout': 0.3669959103161033, 'batch_norm': False, 'lr': 9.866820456002822e-05, 'weight_decay': 5.1683106488057846e-05, 'epochs': 103, 'loss': 'mae', 'optimizer': 'adam', 'graph_mode': 'cutoff', 'cutoff': 0.4784871525899451, 'grm_norm': 'cosine_then_gcn', 'self_loops': True, 'use_snp_selection': True, 'num_snps': 35430}. Best is trial 95 with value: 0.2647045825331954.
[I 2025-11-13 12:37:58,966] Trial 125 finished with value: 0.25824678690612435 and parameters: {'model_type': 'graphsage', 'hidden_dims': '[128, 64]', 'dropout': 0.2034443417572418, 'batch_norm': False, 'lr': 0.0004614988578299846, 'weight_decay': 1.2056840595641596e-05, 'epochs': 77, 'loss': 'mae', 'optimizer': 'adam', 'graph_mode': 'cutoff', 'cutoff': 0.44906620320709906, 'grm_norm': 'none', 'self_loops': True, 'use_snp_selection': True, 'num_snps': 33640}. Best is trial 95 with value: 0.2647045825331954.
[I 2025-11-13 12:39:10,683] Trial 126 finished with value: 0.25740910898024816 and parameters: {'model_type': 'graphsage', 'hidden_dims': '[128, 64]', 'dropout': 0.21150409624254893, 'batch_norm': True, 'lr': 0.0002874528843794021, 'weight_decay': 1.781027174143758e-05, 'epochs': 66, 'loss': 'mae', 'optimizer': 'adam', 'graph_mode': 'cutoff', 'cutoff': 0.45368037273905415, 'grm_norm': 'none', 'self_loops': True, 'use_snp_selection': True, 'num_snps': 33379}. Best is trial 95 with value: 0.2647045825331954.
[I 2025-11-13 12:39:48,444] Trial 127 finished with value: 0.2437528097495995 and parameters: {'model_type': 'graphsage', 'hidden_dims': '[128, 64]', 'dropout': 0.21459416583983368, 'batch_norm': True, 'lr': 0.00035889310213636755, 'weight_decay': 1.2690337747199554e-05, 'epochs': 68, 'loss': 'mae', 'optimizer': 'adam', 'graph_mode': 'cutoff', 'cutoff': 0.36564259100352414, 'grm_norm': 'none', 'self_loops': True, 'use_snp_selection': False}. Best is trial 95 with value: 0.2647045825331954.
[I 2025-11-13 12:40:58,832] Trial 128 finished with value: 0.2582842127828969 and parameters: {'model_type': 'graphsage', 'hidden_dims': '[128, 64]', 'dropout': 0.20132178698709455, 'batch_norm': True, 'lr': 0.0006896424768064204, 'weight_decay': 1.7522119560134677e-05, 'epochs': 58, 'loss': 'mae', 'optimizer': 'adam', 'graph_mode': 'cutoff', 'cutoff': 0.42224771873504324, 'grm_norm': 'none', 'self_loops': True, 'use_snp_selection': True, 'num_snps': 33824}. Best is trial 95 with value: 0.2647045825331954.
[I 2025-11-13 12:42:10,089] Trial 129 finished with value: 0.25108389366272427 and parameters: {'model_type': 'graphsage', 'hidden_dims': '[128, 64]', 'dropout': 0.19824765784897874, 'batch_norm': True, 'lr': 0.0007950232824116328, 'weight_decay': 1.850641165486587e-05, 'epochs': 58, 'loss': 'mae', 'optimizer': 'adam', 'graph_mode': 'cutoff', 'cutoff': 0.42281329196655826, 'grm_norm': 'none', 'self_loops': True, 'use_snp_selection': True, 'num_snps': 33699}. Best is trial 95 with value: 0.2647045825331954.
[I 2025-11-13 12:43:23,500] Trial 130 finished with value: 0.23375918011674002 and parameters: {'model_type': 'graphsage', 'hidden_dims': '[128, 64]', 'dropout': 0.18583629320565853, 'batch_norm': True, 'lr': 0.0004882351005375414, 'weight_decay': 1.2662848805751556e-05, 'epochs': 77, 'loss': 'mse', 'optimizer': 'adam', 'graph_mode': 'cutoff', 'cutoff': 0.4559814265584305, 'grm_norm': 'none', 'self_loops': False, 'use_snp_selection': True, 'num_snps': 32520}. Best is trial 95 with value: 0.2647045825331954.
[I 2025-11-13 12:44:29,333] Trial 131 finished with value: 0.22175057467251552 and parameters: {'model_type': 'graphsage', 'hidden_dims': '[128, 64]', 'dropout': 0.2391770685918518, 'batch_norm': True, 'lr': 0.0009177096650140069, 'weight_decay': 8.932587597440018e-06, 'epochs': 56, 'loss': 'mae', 'optimizer': 'adam', 'graph_mode': 'cutoff', 'cutoff': 0.4515872207482944, 'grm_norm': 'none', 'self_loops': True, 'use_snp_selection': True, 'num_snps': 29655}. Best is trial 95 with value: 0.2647045825331954.
[I 2025-11-13 12:45:31,133] Trial 132 finished with value: 0.2371932605430085 and parameters: {'model_type': 'graphsage', 'hidden_dims': '[128, 64]', 'dropout': 0.20690260328756685, 'batch_norm': True, 'lr': 0.00046966066748545243, 'weight_decay': 2.2052835413081484e-05, 'epochs': 40, 'loss': 'mae', 'optimizer': 'adam', 'graph_mode': 'cutoff', 'cutoff': 0.4309856618412587, 'grm_norm': 'none', 'self_loops': True, 'use_snp_selection': True, 'num_snps': 27942}. Best is trial 95 with value: 0.2647045825331954.
[I 2025-11-13 12:46:43,500] Trial 133 finished with value: 0.24487909716087936 and parameters: {'model_type': 'graphsage', 'hidden_dims': '[128, 64]', 'dropout': 0.25376505117954473, 'batch_norm': True, 'lr': 0.0003015477844569459, 'weight_decay': 1.6473980716010967e-05, 'epochs': 65, 'loss': 'mae', 'optimizer': 'adam', 'graph_mode': 'cutoff', 'cutoff': 0.41415278409787376, 'grm_norm': 'none', 'self_loops': True, 'use_snp_selection': True, 'num_snps': 33812}. Best is trial 95 with value: 0.2647045825331954.
[I 2025-11-13 12:47:45,964] Trial 134 finished with value: 0.23367132755065714 and parameters: {'model_type': 'graphsage', 'hidden_dims': '[128, 64]', 'dropout': 0.17474991313629373, 'batch_norm': True, 'lr': 0.0006427900290026468, 'weight_decay': 2.6990952172473603e-05, 'epochs': 77, 'loss': 'mae', 'optimizer': 'adam', 'graph_mode': 'cutoff', 'cutoff': 0.49831458606689055, 'grm_norm': 'none', 'self_loops': True, 'use_snp_selection': True, 'num_snps': 25191}. Best is trial 95 with value: 0.2647045825331954.
[I 2025-11-13 12:48:46,868] Trial 135 finished with value: 0.22067959220797206 and parameters: {'model_type': 'graphsage', 'hidden_dims': '[128, 64]', 'dropout': 0.21644150766826548, 'batch_norm': True, 'lr': 0.0002924400766962353, 'weight_decay': 1.0296860124092965e-05, 'epochs': 47, 'loss': 'mae', 'optimizer': 'adam', 'graph_mode': 'cutoff', 'cutoff': 0.6589381384109386, 'grm_norm': 'none', 'self_loops': True, 'use_snp_selection': True, 'num_snps': 31775}. Best is trial 95 with value: 0.2647045825331954.
[I 2025-11-13 12:49:54,759] Trial 136 finished with value: 0.22109311723800595 and parameters: {'model_type': 'graphsage', 'hidden_dims': '[128, 64]', 'dropout': 0.26665690557292887, 'batch_norm': True, 'lr': 0.000651783628747882, 'weight_decay': 1.3075615303689135e-05, 'epochs': 84, 'loss': 'mae', 'optimizer': 'adam', 'graph_mode': 'cutoff', 'cutoff': 0.5909526123548482, 'grm_norm': 'none', 'self_loops': True, 'use_snp_selection': True, 'num_snps': 35220}. Best is trial 95 with value: 0.2647045825331954.
[I 2025-11-13 12:51:19,788] Trial 137 finished with value: 0.24901661401802536 and parameters: {'model_type': 'graphsage', 'hidden_dims': '[128, 64]', 'dropout': 0.2805924547177353, 'batch_norm': True, 'lr': 0.00025531793110827796, 'weight_decay': 1.7659790418541874e-07, 'epochs': 70, 'loss': 'mae', 'optimizer': 'adam', 'graph_mode': 'cutoff', 'cutoff': 0.3708118936153351, 'grm_norm': 'none', 'self_loops': True, 'use_snp_selection': True, 'num_snps': 39498}. Best is trial 95 with value: 0.2647045825331954.
[I 2025-11-13 12:52:26,785] Trial 138 finished with value: 0.2425183169409979 and parameters: {'model_type': 'graphsage', 'hidden_dims': '[128, 64]', 'dropout': 0.3020830812830267, 'batch_norm': False, 'lr': 0.00043120496177348873, 'weight_decay': 1.6790382126560656e-05, 'epochs': 60, 'loss': 'mae', 'optimizer': 'adam', 'graph_mode': 'cutoff', 'cutoff': 0.4013735859796534, 'grm_norm': 'none', 'self_loops': True, 'use_snp_selection': True, 'num_snps': 28790}. Best is trial 95 with value: 0.2647045825331954.
[I 2025-11-13 12:53:44,666] Trial 139 finished with value: 0.220138427882718 and parameters: {'model_type': 'graphsage', 'hidden_dims': '[128, 64]', 'dropout': 0.2517075983383105, 'batch_norm': False, 'lr': 0.000595673407181877, 'weight_decay': 2.320122938998956e-05, 'epochs': 94, 'loss': 'mae', 'optimizer': 'adam', 'graph_mode': 'cutoff', 'cutoff': 0.44427791770964414, 'grm_norm': 'none', 'self_loops': False, 'use_snp_selection': True, 'num_snps': 33736}. Best is trial 95 with value: 0.2647045825331954.
[I 2025-11-13 12:54:36,639] Trial 140 finished with value: 0.2068053053516926 and parameters: {'model_type': 'graphsage', 'hidden_dims': '[128, 64]', 'dropout': 0.15565690297250767, 'batch_norm': True, 'lr': 0.0001730232838927162, 'weight_decay': 2.9833047320775923e-05, 'epochs': 86, 'loss': 'mae', 'optimizer': 'adam', 'graph_mode': 'cutoff', 'cutoff': 0.5588012710557374, 'grm_norm': 'none', 'self_loops': True, 'use_snp_selection': True, 'num_snps': 12827}. Best is trial 95 with value: 0.2647045825331954.
[I 2025-11-13 12:56:44,515] Trial 141 finished with value: 0.25104154073473495 and parameters: {'model_type': 'graphsage', 'hidden_dims': '[512, 128]', 'dropout': 0.27402487905999456, 'batch_norm': False, 'lr': 0.00014449577224577475, 'weight_decay': 3.5549520688642533e-07, 'epochs': 101, 'loss': 'mae', 'optimizer': 'adam', 'graph_mode': 'cutoff', 'cutoff': 0.4768329779700651, 'grm_norm': 'cosine_then_gcn', 'self_loops': True, 'use_snp_selection': True, 'num_snps': 44595}. Best is trial 95 with value: 0.2647045825331954.
[I 2025-11-13 12:58:52,567] Trial 142 finished with value: 0.24431736073881724 and parameters: {'model_type': 'graphsage', 'hidden_dims': '[512, 128]', 'dropout': 0.19348018251785165, 'batch_norm': False, 'lr': 0.00020740124256652987, 'weight_decay': 1.9906022228993977e-05, 'epochs': 118, 'loss': 'mae', 'optimizer': 'adam', 'graph_mode': 'cutoff', 'cutoff': 0.38904276173499913, 'grm_norm': 'cosine_then_gcn', 'self_loops': True, 'use_snp_selection': True, 'num_snps': 38251}. Best is trial 95 with value: 0.2647045825331954.
[I 2025-11-13 13:00:31,438] Trial 143 finished with value: 0.24436910896167569 and parameters: {'model_type': 'graphsage', 'hidden_dims': '[512, 128]', 'dropout': 0.28929219502242437, 'batch_norm': False, 'lr': 0.00010150158679378116, 'weight_decay': 3.3832417049506716e-05, 'epochs': 80, 'loss': 'mae', 'optimizer': 'adam', 'graph_mode': 'cutoff', 'cutoff': 0.4705165912473012, 'grm_norm': 'cosine_then_gcn', 'self_loops': True, 'use_snp_selection': True, 'num_snps': 35589}. Best is trial 95 with value: 0.2647045825331954.
[I 2025-11-13 13:01:47,043] Trial 144 finished with value: 0.23626248602485583 and parameters: {'model_type': 'graphsage', 'hidden_dims': '[128, 64]', 'dropout': 0.23848107034929567, 'batch_norm': False, 'lr': 0.00035774095172377455, 'weight_decay': 1.550112391562595e-05, 'epochs': 96, 'loss': 'mae', 'optimizer': 'adam', 'graph_mode': 'cutoff', 'cutoff': 0.42577591891034694, 'grm_norm': 'cosine_then_gcn', 'self_loops': True, 'use_snp_selection': True, 'num_snps': 30325}. Best is trial 95 with value: 0.2647045825331954.
[I 2025-11-13 13:03:27,322] Trial 145 finished with value: 0.24623779367755608 and parameters: {'model_type': 'graphsage', 'hidden_dims': '[512, 128]', 'dropout': 0.13410407119568837, 'batch_norm': False, 'lr': 6.127007671299872e-05, 'weight_decay': 2.460167194339781e-07, 'epochs': 90, 'loss': 'mae', 'optimizer': 'adam', 'graph_mode': 'cutoff', 'cutoff': 0.45989080114921554, 'grm_norm': 'gcn', 'self_loops': True, 'use_snp_selection': True, 'num_snps': 34496}. Best is trial 95 with value: 0.2647045825331954.
[I 2025-11-13 13:04:51,470] Trial 146 finished with value: 0.24413779623230156 and parameters: {'model_type': 'graphsage', 'hidden_dims': '[512, 128]', 'dropout': 0.309486007158387, 'batch_norm': False, 'lr': 0.00011544952154694003, 'weight_decay': 4.524436539591389e-05, 'epochs': 71, 'loss': 'mae', 'optimizer': 'adam', 'graph_mode': 'cutoff', 'cutoff': 0.5361457232247466, 'grm_norm': 'cosine_then_gcn', 'self_loops': True, 'use_snp_selection': True, 'num_snps': 32522}. Best is trial 95 with value: 0.2647045825331954.
[I 2025-11-13 13:06:21,401] Trial 147 finished with value: 0.23119268689840103 and parameters: {'model_type': 'graphsage', 'hidden_dims': '[256, 128, 64]', 'dropout': 0.5946596936075623, 'batch_norm': False, 'lr': 0.0002310607234370294, 'weight_decay': 7.74587098108311e-06, 'epochs': 124, 'loss': 'mae', 'optimizer': 'adam', 'graph_mode': 'cutoff', 'cutoff': 0.5048640885874244, 'grm_norm': 'cosine_then_gcn', 'self_loops': True, 'use_snp_selection': True, 'num_snps': 36374}. Best is trial 95 with value: 0.2647045825331954.
[I 2025-11-13 13:07:05,303] Trial 148 finished with value: 0.1851820036251349 and parameters: {'model_type': 'graphsage', 'hidden_dims': '[128, 64]', 'dropout': 0.21848646941700087, 'batch_norm': False, 'lr': 0.00032155406975812673, 'weight_decay': 8.068884424308001e-05, 'epochs': 105, 'loss': 'mae', 'optimizer': 'adam', 'graph_mode': 'cutoff', 'cutoff': 0.4876971722588355, 'grm_norm': 'none', 'self_loops': True, 'use_snp_selection': False}. Best is trial 95 with value: 0.2647045825331954.
[I 2025-11-13 13:08:15,205] Trial 149 finished with value: 0.2380191890399152 and parameters: {'model_type': 'graphsage', 'hidden_dims': '[512, 128]', 'dropout': 0.32014462453417064, 'batch_norm': False, 'lr': 0.0001384613919124435, 'weight_decay': 2.485447887588758e-05, 'epochs': 52, 'loss': 'mae', 'optimizer': 'adam', 'graph_mode': 'cutoff', 'cutoff': 0.41347543607463705, 'grm_norm': 'cosine_then_gcn', 'self_loops': False, 'use_snp_selection': True, 'num_snps': 23696}. Best is trial 95 with value: 0.2647045825331954.
[I 2025-11-13 13:10:52,907] Trial 0 finished with value: 0.19769466850474288 and parameters: {'model_type': 'graphsage', 'hidden_dims': '[128, 64]', 'dropout': 0.199031432379812, 'batch_norm': True, 'lr': 1.8408544111075837e-06, 'weight_decay': 5.5136510071208614e-05, 'epochs': 336, 'loss': 'mae', 'optimizer': 'adam', 'graph_mode': 'knn', 'source': 'grm', 'knn_k': 8, 'weighted_edges': True, 'symmetrize_mode': 'mutual', 'use_snp_selection': False}. Best is trial 0 with value: 0.19769466850474288.
[I 2025-11-13 13:11:45,127] Trial 1 finished with value: 0.2551752332188159 and parameters: {'model_type': 'graphsage', 'hidden_dims': '[128, 64]', 'dropout': 0.40051947670227217, 'batch_norm': True, 'lr': 0.0005320428882732732, 'weight_decay': 1.89210117736594e-06, 'epochs': 68, 'loss': 'mse', 'optimizer': 'adam', 'graph_mode': 'knn', 'source': 'grm', 'knn_k': 7, 'weighted_edges': True, 'symmetrize_mode': 'union', 'use_snp_selection': False}. Best is trial 1 with value: 0.2551752332188159.
[I 2025-11-13 13:13:05,447] Trial 2 finished with value: 0.16988267270573834 and parameters: {'model_type': 'graphsage', 'hidden_dims': '[256, 128]', 'dropout': 0.5105528289184642, 'batch_norm': False, 'lr': 0.0006804279372404962, 'weight_decay': 0.0008922815224257085, 'epochs': 181, 'loss': 'mse', 'optimizer': 'adam', 'graph_mode': 'cutoff', 'cutoff': 0.5741905641612706, 'grm_norm': 'gcn', 'self_loops': False, 'use_snp_selection': True, 'num_snps': 26910}. Best is trial 1 with value: 0.2551752332188159.
[I 2025-11-13 13:14:36,902] Trial 3 finished with value: 0.2530783123579463 and parameters: {'model_type': 'graphsage', 'hidden_dims': '[256, 128, 64]', 'dropout': 0.5390483213624292, 'batch_norm': False, 'lr': 3.4705625989073525e-05, 'weight_decay': 2.4623319020131338e-05, 'epochs': 121, 'loss': 'mse', 'optimizer': 'adam', 'graph_mode': 'knn', 'source': 'grm', 'knn_k': 6, 'weighted_edges': False, 'symmetrize_mode': 'mutual', 'use_snp_selection': True, 'num_snps': 30713}. Best is trial 1 with value: 0.2551752332188159.
[I 2025-11-13 13:15:44,409] Trial 4 finished with value: 0.2561760939752571 and parameters: {'model_type': 'graphsage', 'hidden_dims': '[128, 64]', 'dropout': 0.13404863676897502, 'batch_norm': False, 'lr': 0.0001431556295367288, 'weight_decay': 2.2084517750726675e-05, 'epochs': 51, 'loss': 'mae', 'optimizer': 'adam', 'graph_mode': 'cutoff', 'cutoff': 0.6714268476993044, 'grm_norm': 'none', 'self_loops': False, 'use_snp_selection': True, 'num_snps': 45645}. Best is trial 4 with value: 0.2561760939752571.
[I 2025-11-13 13:17:27,092] Trial 5 finished with value: 0.2580086282447281 and parameters: {'model_type': 'graphsage', 'hidden_dims': '[256, 128]', 'dropout': 0.42253606323412096, 'batch_norm': False, 'lr': 4.238630400638805e-05, 'weight_decay': 8.074086040046576e-07, 'epochs': 158, 'loss': 'mae', 'optimizer': 'adam', 'graph_mode': 'knn', 'source': 'grm', 'knn_k': 1, 'weighted_edges': False, 'symmetrize_mode': 'mutual', 'use_snp_selection': True, 'num_snps': 43113}. Best is trial 5 with value: 0.2580086282447281.
[I 2025-11-13 13:20:08,357] Trial 6 finished with value: 0.2618158551094839 and parameters: {'model_type': 'graphsage', 'hidden_dims': '[512, 256]', 'dropout': 0.3534893146320237, 'batch_norm': True, 'lr': 0.000251307964226932, 'weight_decay': 1.821819791794022e-05, 'epochs': 223, 'loss': 'mae', 'optimizer': 'adam', 'graph_mode': 'knn', 'source': 'grm', 'knn_k': 1, 'weighted_edges': True, 'symmetrize_mode': 'mutual', 'use_snp_selection': False}. Best is trial 6 with value: 0.2618158551094839.
[I 2025-11-13 13:22:25,398] Trial 7 finished with value: 0.22416671451046494 and parameters: {'model_type': 'graphsage', 'hidden_dims': '[512, 256]', 'dropout': 0.1105825955860775, 'batch_norm': True, 'lr': 2.374338412754043e-05, 'weight_decay': 1.1284721123340274e-05, 'epochs': 190, 'loss': 'mse', 'optimizer': 'adam', 'graph_mode': 'cutoff', 'cutoff': 0.719872204109604, 'grm_norm': 'gcn', 'self_loops': False, 'use_snp_selection': False}. Best is trial 6 with value: 0.2618158551094839.
[I 2025-11-13 13:24:19,745] Trial 8 finished with value: 0.2624569334116308 and parameters: {'model_type': 'graphsage', 'hidden_dims': '[512, 128]', 'dropout': 0.5066580418354021, 'batch_norm': True, 'lr': 0.00039213678276659976, 'weight_decay': 3.43655320802934e-06, 'epochs': 120, 'loss': 'mse', 'optimizer': 'adam', 'graph_mode': 'cutoff', 'cutoff': 0.34923059576505366, 'grm_norm': 'cosine', 'self_loops': True, 'use_snp_selection': False}. Best is trial 8 with value: 0.2624569334116308.
