[I 2025-11-03 12:46:22,498] Trial 125 finished with value: 0.08208467416391316 and parameters: {'model_type': 'gcn', 'hidden_dims': '[512, 256]', 'dropout': 0.2869961442674478, 'batch_norm': True, 'lr': 0.0003433292114205363, 'weight_decay': 1.8149969188576646e-07, 'epochs': 258, 'loss': 'mae', 'optimizer': 'adam', 'graph_mode': 'knn', 'source': 'grm', 'knn_k': 1, 'weighted_edges': True, 'symmetrize_mode': 'union', 'use_snp_selection': False}. Best is trial 46 with value: 0.09113089337527672.
[I 2025-11-03 12:46:25,282] Trial 126 finished with value: 0.08820618802876375 and parameters: {'model_type': 'gcn', 'hidden_dims': '[512, 256]', 'dropout': 0.28449143795870424, 'batch_norm': True, 'lr': 0.0004767293404304924, 'weight_decay': 2.148218242135368e-07, 'epochs': 258, 'loss': 'mae', 'optimizer': 'adam', 'graph_mode': 'knn', 'source': 'grm', 'knn_k': 1, 'weighted_edges': True, 'symmetrize_mode': 'union', 'use_snp_selection': False}. Best is trial 46 with value: 0.09113089337527672.
[I 2025-11-03 12:46:28,167] Trial 127 finished with value: 0.010487174733676309 and parameters: {'model_type': 'gcn', 'hidden_dims': '[512, 256]', 'dropout': 0.2689147834267149, 'batch_norm': True, 'lr': 0.0003597725852281879, 'weight_decay': 2.818544560651603e-07, 'epochs': 274, 'loss': 'mae', 'optimizer': 'adam', 'graph_mode': 'knn', 'source': 'grm', 'knn_k': 2, 'weighted_edges': True, 'symmetrize_mode': 'union', 'use_snp_selection': False}. Best is trial 46 with value: 0.09113089337527672.
[I 2025-11-03 12:46:31,061] Trial 128 finished with value: 0.009856134036345082 and parameters: {'model_type': 'gcn', 'hidden_dims': '[512, 256]', 'dropout': 0.28310899104514964, 'batch_norm': False, 'lr': 0.000454165824750922, 'weight_decay': 4.713875728402086e-06, 'epochs': 232, 'loss': 'mae', 'optimizer': 'adam', 'graph_mode': 'knn', 'source': 'grm', 'knn_k': 5, 'weighted_edges': True, 'symmetrize_mode': 'union', 'use_snp_selection': True, 'num_snps': 23993}. Best is trial 46 with value: 0.09113089337527672.
[I 2025-11-03 12:46:33,994] Trial 129 finished with value: 0.03562934252606072 and parameters: {'model_type': 'gcn', 'hidden_dims': '[512, 256]', 'dropout': 0.23809988902577361, 'batch_norm': True, 'lr': 0.00020330968252241853, 'weight_decay': 1.9046943518158364e-07, 'epochs': 260, 'loss': 'mae', 'optimizer': 'adam', 'graph_mode': 'knn', 'source': 'grm', 'knn_k': 1, 'weighted_edges': True, 'symmetrize_mode': 'mutual', 'use_snp_selection': False}. Best is trial 46 with value: 0.09113089337527672.
[I 2025-11-03 12:46:36,768] Trial 130 finished with value: 0.057542407081450336 and parameters: {'model_type': 'gcn', 'hidden_dims': '[512, 256]', 'dropout': 0.2221510293525585, 'batch_norm': True, 'lr': 0.0001700694160814342, 'weight_decay': 3.2772363279582644e-07, 'epochs': 256, 'loss': 'mae', 'optimizer': 'adam', 'graph_mode': 'knn', 'source': 'grm', 'knn_k': 1, 'weighted_edges': True, 'symmetrize_mode': 'union', 'use_snp_selection': False}. Best is trial 46 with value: 0.09113089337527672.
[I 2025-11-03 12:46:39,599] Trial 131 finished with value: 0.07700009338772583 and parameters: {'model_type': 'gcn', 'hidden_dims': '[512, 256]', 'dropout': 0.252984784926004, 'batch_norm': True, 'lr': 0.0004960598776929092, 'weight_decay': 1.6717267842687994e-07, 'epochs': 266, 'loss': 'mae', 'optimizer': 'adam', 'graph_mode': 'knn', 'source': 'grm', 'knn_k': 1, 'weighted_edges': True, 'symmetrize_mode': 'union', 'use_snp_selection': False}. Best is trial 46 with value: 0.09113089337527672.
[I 2025-11-03 12:46:42,472] Trial 132 finished with value: 0.06983398916046217 and parameters: {'model_type': 'gcn', 'hidden_dims': '[512, 256]', 'dropout': 0.2520857523933102, 'batch_norm': True, 'lr': 0.000610844823308435, 'weight_decay': 2.3961189669120626e-07, 'epochs': 273, 'loss': 'mae', 'optimizer': 'adam', 'graph_mode': 'knn', 'source': 'grm', 'knn_k': 1, 'weighted_edges': True, 'symmetrize_mode': 'union', 'use_snp_selection': False}. Best is trial 46 with value: 0.09113089337527672.
[I 2025-11-03 12:46:45,298] Trial 133 finished with value: 0.0864143198425662 and parameters: {'model_type': 'gcn', 'hidden_dims': '[512, 256]', 'dropout': 0.29716302353991453, 'batch_norm': True, 'lr': 0.00039459063167640986, 'weight_decay': 1.74666321965677e-07, 'epochs': 265, 'loss': 'mae', 'optimizer': 'adam', 'graph_mode': 'knn', 'source': 'grm', 'knn_k': 1, 'weighted_edges': True, 'symmetrize_mode': 'union', 'use_snp_selection': False}. Best is trial 46 with value: 0.09113089337527672.
[I 2025-11-03 12:46:48,223] Trial 134 finished with value: 0.0975439838772551 and parameters: {'model_type': 'gcn', 'hidden_dims': '[512, 256]', 'dropout': 0.2953476242914508, 'batch_norm': True, 'lr': 0.00039750159207659004, 'weight_decay': 1.3619096803534716e-07, 'epochs': 282, 'loss': 'mae', 'optimizer': 'adam', 'graph_mode': 'knn', 'source': 'grm', 'knn_k': 1, 'weighted_edges': True, 'symmetrize_mode': 'union', 'use_snp_selection': False}. Best is trial 134 with value: 0.0975439838772551.
[I 2025-11-03 12:46:51,225] Trial 135 finished with value: 0.021734057964861317 and parameters: {'model_type': 'gcn', 'hidden_dims': '[512, 256]', 'dropout': 0.3213335720610388, 'batch_norm': True, 'lr': 0.000406644626837788, 'weight_decay': 2.0895157660663097e-07, 'epochs': 294, 'loss': 'mae', 'optimizer': 'adam', 'graph_mode': 'knn', 'source': 'grm', 'knn_k': 2, 'weighted_edges': True, 'symmetrize_mode': 'union', 'use_snp_selection': False}. Best is trial 134 with value: 0.0975439838772551.
[I 2025-11-03 12:46:54,141] Trial 136 finished with value: 0.07438738443597492 and parameters: {'model_type': 'gcn', 'hidden_dims': '[512, 256]', 'dropout': 0.3003862656250382, 'batch_norm': True, 'lr': 0.0003444677273999658, 'weight_decay': 1.1828427397658178e-07, 'epochs': 280, 'loss': 'mae', 'optimizer': 'adam', 'graph_mode': 'knn', 'source': 'grm', 'knn_k': 1, 'weighted_edges': True, 'symmetrize_mode': 'union', 'use_snp_selection': False}. Best is trial 134 with value: 0.0975439838772551.
[I 2025-11-03 12:46:57,175] Trial 137 finished with value: -0.04774438535574264 and parameters: {'model_type': 'gcn', 'hidden_dims': '[512, 256]', 'dropout': 0.2926712042822644, 'batch_norm': True, 'lr': 6.6915946341276e-06, 'weight_decay': 1.6805909858371848e-07, 'epochs': 301, 'loss': 'mae', 'optimizer': 'adam', 'graph_mode': 'knn', 'source': 'grm', 'knn_k': 1, 'weighted_edges': True, 'symmetrize_mode': 'union', 'use_snp_selection': False}. Best is trial 134 with value: 0.0975439838772551.
[I 2025-11-03 12:47:00,079] Trial 138 finished with value: 0.042477399477853936 and parameters: {'model_type': 'gcn', 'hidden_dims': '[512, 256]', 'dropout': 0.30896177985149986, 'batch_norm': True, 'lr': 0.000756144329377377, 'weight_decay': 3.937005255537568e-07, 'epochs': 284, 'loss': 'mae', 'optimizer': 'adam', 'graph_mode': 'cutoff', 'cutoff': 0.6459490985460641, 'grm_norm': 'gcn', 'self_loops': True, 'use_snp_selection': False}. Best is trial 134 with value: 0.0975439838772551.
[I 2025-11-03 12:47:02,463] Trial 139 finished with value: 0.09261644175584106 and parameters: {'model_type': 'gcn', 'hidden_dims': '[256, 128, 64]', 'dropout': 0.28453763549363115, 'batch_norm': True, 'lr': 0.000414241892747897, 'weight_decay': 2.9530593726792737e-07, 'epochs': 257, 'loss': 'mae', 'optimizer': 'adam', 'graph_mode': 'knn', 'source': 'grm', 'knn_k': 1, 'weighted_edges': True, 'symmetrize_mode': 'union', 'use_snp_selection': False}. Best is trial 134 with value: 0.0975439838772551.
[I 2025-11-03 12:47:04,836] Trial 140 finished with value: 0.08010761031444574 and parameters: {'model_type': 'gcn', 'hidden_dims': '[256, 128, 64]', 'dropout': 0.2874755139343821, 'batch_norm': True, 'lr': 0.0005968922278953608, 'weight_decay': 2.892457729142582e-07, 'epochs': 255, 'loss': 'mae', 'optimizer': 'adam', 'graph_mode': 'knn', 'source': 'grm', 'knn_k': 1, 'weighted_edges': True, 'symmetrize_mode': 'union', 'use_snp_selection': False}. Best is trial 134 with value: 0.0975439838772551.
[I 2025-11-03 12:47:07,219] Trial 141 finished with value: 0.06966067967468612 and parameters: {'model_type': 'gcn', 'hidden_dims': '[256, 128, 64]', 'dropout': 0.284695931360315, 'batch_norm': True, 'lr': 0.000572573280744146, 'weight_decay': 2.9093657534954567e-07, 'epochs': 257, 'loss': 'mae', 'optimizer': 'adam', 'graph_mode': 'knn', 'source': 'grm', 'knn_k': 1, 'weighted_edges': True, 'symmetrize_mode': 'union', 'use_snp_selection': False}. Best is trial 134 with value: 0.0975439838772551.
[I 2025-11-03 12:47:09,649] Trial 142 finished with value: 0.06502918595375867 and parameters: {'model_type': 'gcn', 'hidden_dims': '[256, 128, 64]', 'dropout': 0.3267213099847523, 'batch_norm': True, 'lr': 0.0008815061194128553, 'weight_decay': 2.5274536518652217e-07, 'epochs': 266, 'loss': 'mae', 'optimizer': 'adam', 'graph_mode': 'knn', 'source': 'grm', 'knn_k': 1, 'weighted_edges': True, 'symmetrize_mode': 'union', 'use_snp_selection': False}. Best is trial 134 with value: 0.0975439838772551.
[I 2025-11-03 12:47:11,996] Trial 143 finished with value: 0.05442938357496114 and parameters: {'model_type': 'gcn', 'hidden_dims': '[256, 128, 64]', 'dropout': 0.2990810445433243, 'batch_norm': True, 'lr': 0.0006362973256541345, 'weight_decay': 4.836670805538736e-07, 'epochs': 250, 'loss': 'mae', 'optimizer': 'adam', 'graph_mode': 'knn', 'source': 'grm', 'knn_k': 1, 'weighted_edges': True, 'symmetrize_mode': 'union', 'use_snp_selection': False}. Best is trial 134 with value: 0.0975439838772551.
[I 2025-11-03 12:47:14,455] Trial 144 finished with value: 0.06462948146048525 and parameters: {'model_type': 'gcn', 'hidden_dims': '[256, 128, 64]', 'dropout': 0.3124266630730656, 'batch_norm': True, 'lr': 0.00041659553838305154, 'weight_decay': 1.9850598190429746e-07, 'epochs': 272, 'loss': 'mae', 'optimizer': 'adam', 'graph_mode': 'knn', 'source': 'grm', 'knn_k': 1, 'weighted_edges': True, 'symmetrize_mode': 'union', 'use_snp_selection': False}. Best is trial 134 with value: 0.0975439838772551.
[I 2025-11-03 12:47:16,949] Trial 145 finished with value: 0.06647448541731531 and parameters: {'model_type': 'gcn', 'hidden_dims': '[256, 128, 64]', 'dropout': 0.2807316415320908, 'batch_norm': True, 'lr': 0.0003733364124454326, 'weight_decay': 1.518017470254471e-07, 'epochs': 279, 'loss': 'mae', 'optimizer': 'adam', 'graph_mode': 'knn', 'source': 'grm', 'knn_k': 1, 'weighted_edges': True, 'symmetrize_mode': 'union', 'use_snp_selection': False}. Best is trial 134 with value: 0.0975439838772551.
[I 2025-11-03 12:47:19,518] Trial 146 finished with value: 0.014452787597661375 and parameters: {'model_type': 'gcn', 'hidden_dims': '[256, 128, 64]', 'dropout': 0.289873134121028, 'batch_norm': True, 'lr': 0.0005192996397425049, 'weight_decay': 2.1765417983714136e-07, 'epochs': 288, 'loss': 'mae', 'optimizer': 'adam', 'graph_mode': 'knn', 'source': 'grm', 'knn_k': 2, 'weighted_edges': True, 'symmetrize_mode': 'union', 'use_snp_selection': False}. Best is trial 134 with value: 0.0975439838772551.
[I 2025-11-03 12:47:21,926] Trial 147 finished with value: 0.07099801022520562 and parameters: {'model_type': 'gcn', 'hidden_dims': '[256, 128, 64]', 'dropout': 0.26115183782141876, 'batch_norm': True, 'lr': 0.00044709396276809894, 'weight_decay': 3.0849768386420967e-07, 'epochs': 262, 'loss': 'mae', 'optimizer': 'adam', 'graph_mode': 'knn', 'source': 'grm', 'knn_k': 1, 'weighted_edges': True, 'symmetrize_mode': 'union', 'use_snp_selection': False}. Best is trial 134 with value: 0.0975439838772551.
[I 2025-11-03 12:47:24,286] Trial 148 finished with value: 0.09890902299107213 and parameters: {'model_type': 'gcn', 'hidden_dims': '[256, 128, 64]', 'dropout': 0.27901550861423147, 'batch_norm': True, 'lr': 0.00032245004771930497, 'weight_decay': 1.2156840232899193e-07, 'epochs': 252, 'loss': 'mae', 'optimizer': 'adam', 'graph_mode': 'knn', 'source': 'grm', 'knn_k': 1, 'weighted_edges': True, 'symmetrize_mode': 'union', 'use_snp_selection': False}. Best is trial 148 with value: 0.09890902299107213.
[I 2025-11-03 12:47:26,603] Trial 149 finished with value: 0.01340017260443787 and parameters: {'model_type': 'gcn', 'hidden_dims': '[256, 128, 64]', 'dropout': 0.30330795823492246, 'batch_norm': True, 'lr': 0.0009580651921209332, 'weight_decay': 1.1717912773274629e-07, 'epochs': 242, 'loss': 'mae', 'optimizer': 'adam', 'graph_mode': 'knn', 'source': 'grm', 'knn_k': 2, 'weighted_edges': True, 'symmetrize_mode': 'union', 'use_snp_selection': False}. Best is trial 148 with value: 0.09890902299107213.
[I 2025-11-03 12:47:43,897] Trial 0 finished with value: 0.04547505881843614 and parameters: {'model_type': 'gcn', 'hidden_dims': '[128, 64]', 'dropout': 0.199031432379812, 'batch_norm': True, 'lr': 1.8408544111075837e-06, 'weight_decay': 5.5136510071208614e-05, 'epochs': 334, 'loss': 'mae', 'optimizer': 'adam', 'graph_mode': 'knn', 'source': 'grm', 'knn_k': 8, 'weighted_edges': True, 'symmetrize_mode': 'mutual', 'use_snp_selection': False}. Best is trial 0 with value: 0.04547505881843614.
[I 2025-11-03 12:47:44,991] Trial 1 finished with value: 0.04209213924709418 and parameters: {'model_type': 'gcn', 'hidden_dims': '[128, 64]', 'dropout': 0.40051947670227217, 'batch_norm': True, 'lr': 0.0005320428882732732, 'weight_decay': 1.89210117736594e-06, 'epochs': 32, 'loss': 'mse', 'optimizer': 'adam', 'graph_mode': 'knn', 'source': 'grm', 'knn_k': 7, 'weighted_edges': True, 'symmetrize_mode': 'union', 'use_snp_selection': False}. Best is trial 0 with value: 0.04547505881843614.
[I 2025-11-03 12:47:47,047] Trial 2 finished with value: 0.03962483395420087 and parameters: {'model_type': 'gcn', 'hidden_dims': '[256, 128]', 'dropout': 0.5105528289184642, 'batch_norm': False, 'lr': 0.0006804279372404962, 'weight_decay': 0.0008922815224257085, 'epochs': 160, 'loss': 'mse', 'optimizer': 'adam', 'graph_mode': 'cutoff', 'cutoff': 0.5741905641612706, 'grm_norm': 'gcn', 'self_loops': False, 'use_snp_selection': True, 'num_snps': 26910}. Best is trial 0 with value: 0.04547505881843614.
[I 2025-11-03 12:47:49,193] Trial 3 finished with value: 0.005199824471264162 and parameters: {'model_type': 'gcn', 'hidden_dims': '[256, 128, 64]', 'dropout': 0.5390483213624292, 'batch_norm': False, 'lr': 3.4705625989073525e-05, 'weight_decay': 2.4623319020131338e-05, 'epochs': 92, 'loss': 'mse', 'optimizer': 'adam', 'graph_mode': 'knn', 'source': 'grm', 'knn_k': 6, 'weighted_edges': False, 'symmetrize_mode': 'mutual', 'use_snp_selection': True, 'num_snps': 30713}. Best is trial 0 with value: 0.04547505881843614.
[I 2025-11-03 12:47:51,351] Trial 4 finished with value: -0.018260985048652603 and parameters: {'model_type': 'gcn', 'hidden_dims': '[128, 64]', 'dropout': 0.13404863676897502, 'batch_norm': False, 'lr': 0.0001431556295367288, 'weight_decay': 2.2084517750726675e-05, 'epochs': 13, 'loss': 'mae', 'optimizer': 'adam', 'graph_mode': 'cutoff', 'cutoff': 0.6714268476993044, 'grm_norm': 'none', 'self_loops': False, 'use_snp_selection': True, 'num_snps': 45645}. Best is trial 0 with value: 0.04547505881843614.
[I 2025-11-03 12:47:53,943] Trial 5 finished with value: 0.04591995869942686 and parameters: {'model_type': 'gcn', 'hidden_dims': '[256, 128]', 'dropout': 0.42253606323412096, 'batch_norm': False, 'lr': 4.238630400638805e-05, 'weight_decay': 8.074086040046576e-07, 'epochs': 134, 'loss': 'mae', 'optimizer': 'adam', 'graph_mode': 'knn', 'source': 'grm', 'knn_k': 1, 'weighted_edges': False, 'symmetrize_mode': 'mutual', 'use_snp_selection': True, 'num_snps': 43113}. Best is trial 5 with value: 0.04591995869942686.
[I 2025-11-03 12:47:56,351] Trial 6 finished with value: 0.027115498203492187 and parameters: {'model_type': 'gcn', 'hidden_dims': '[512, 256]', 'dropout': 0.3534893146320237, 'batch_norm': True, 'lr': 0.000251307964226932, 'weight_decay': 1.821819791794022e-05, 'epochs': 207, 'loss': 'mae', 'optimizer': 'adam', 'graph_mode': 'knn', 'source': 'grm', 'knn_k': 1, 'weighted_edges': True, 'symmetrize_mode': 'mutual', 'use_snp_selection': False}. Best is trial 5 with value: 0.04591995869942686.
[I 2025-11-03 12:47:58,485] Trial 7 finished with value: 0.05159298989352853 and parameters: {'model_type': 'gcn', 'hidden_dims': '[512, 256]', 'dropout': 0.1105825955860775, 'batch_norm': True, 'lr': 2.374338412754043e-05, 'weight_decay': 1.1284721123340274e-05, 'epochs': 170, 'loss': 'mse', 'optimizer': 'adam', 'graph_mode': 'cutoff', 'cutoff': 0.719872204109604, 'grm_norm': 'gcn', 'self_loops': False, 'use_snp_selection': False}. Best is trial 7 with value: 0.05159298989352853.
[I 2025-11-03 12:48:00,204] Trial 8 finished with value: 0.003000696785576469 and parameters: {'model_type': 'gcn', 'hidden_dims': '[512, 128]', 'dropout': 0.5066580418354021, 'batch_norm': True, 'lr': 0.00039213678276659976, 'weight_decay': 3.43655320802934e-06, 'epochs': 91, 'loss': 'mse', 'optimizer': 'adam', 'graph_mode': 'cutoff', 'cutoff': 0.34923059576505366, 'grm_norm': 'cosine', 'self_loops': True, 'use_snp_selection': False}. Best is trial 7 with value: 0.05159298989352853.
[I 2025-11-03 12:48:01,763] Trial 9 finished with value: 0.06659124926087946 and parameters: {'model_type': 'gcn', 'hidden_dims': '[512, 256]', 'dropout': 0.301734920240333, 'batch_norm': False, 'lr': 6.650961854953448e-06, 'weight_decay': 6.861575656590315e-05, 'epochs': 125, 'loss': 'mae', 'optimizer': 'adam', 'graph_mode': 'cutoff', 'cutoff': 0.2857569870061939, 'grm_norm': 'cosine_then_gcn', 'self_loops': False, 'use_snp_selection': True, 'num_snps': 12722}. Best is trial 9 with value: 0.06659124926087946.
[I 2025-11-03 12:48:03,360] Trial 10 finished with value: 2.087172213774259e-05 and parameters: {'model_type': 'gcn', 'hidden_dims': '[512, 64]', 'dropout': 0.2549147281275221, 'batch_norm': False, 'lr': 2.3453406095863302e-06, 'weight_decay': 0.000250012967435051, 'epochs': 249, 'loss': 'mae', 'optimizer': 'adam', 'graph_mode': 'cutoff', 'cutoff': 0.22502730798645276, 'grm_norm': 'cosine_then_gcn', 'self_loops': True, 'use_snp_selection': True, 'num_snps': 3859}. Best is trial 9 with value: 0.06659124926087946.
[I 2025-11-03 12:48:05,904] Trial 11 finished with value: 0.008758006507958585 and parameters: {'model_type': 'gcn', 'hidden_dims': '[512, 256]', 'dropout': 0.11010512794988106, 'batch_norm': True, 'lr': 8.807069823561703e-06, 'weight_decay': 1.0655358607693621e-07, 'epochs': 236, 'loss': 'mse', 'optimizer': 'adam', 'graph_mode': 'cutoff', 'cutoff': 0.8576830859783061, 'grm_norm': 'cosine_then_gcn', 'self_loops': False, 'use_snp_selection': False}. Best is trial 9 with value: 0.06659124926087946.
[I 2025-11-03 12:48:07,231] Trial 12 finished with value: 0.0031661425360870804 and parameters: {'model_type': 'gcn', 'hidden_dims': '[512, 256]', 'dropout': 0.2563823662453917, 'batch_norm': True, 'lr': 7.902744370633635e-06, 'weight_decay': 0.00014423479097099525, 'epochs': 112, 'loss': 'mae', 'optimizer': 'adam', 'graph_mode': 'cutoff', 'cutoff': 0.7506449451098667, 'grm_norm': 'gcn', 'self_loops': False, 'use_snp_selection': True, 'num_snps': 6176}. Best is trial 9 with value: 0.06659124926087946.
[I 2025-11-03 12:48:09,453] Trial 13 finished with value: 0.024723591632438535 and parameters: {'model_type': 'gcn', 'hidden_dims': '[512, 256]', 'dropout': 0.2715962303148582, 'batch_norm': False, 'lr': 8.807307999037535e-06, 'weight_decay': 6.170619169543884e-06, 'epochs': 183, 'loss': 'mse', 'optimizer': 'adam', 'graph_mode': 'cutoff', 'cutoff': 0.4344199938662549, 'grm_norm': 'cosine_then_gcn', 'self_loops': False, 'use_snp_selection': False}. Best is trial 9 with value: 0.06659124926087946.
[I 2025-11-03 12:48:12,218] Trial 14 finished with value: 0.02970381613196283 and parameters: {'model_type': 'gcn', 'hidden_dims': '[512, 256]', 'dropout': 0.17392839051517764, 'batch_norm': False, 'lr': 8.589510603311415e-05, 'weight_decay': 0.00013861313568948457, 'epochs': 298, 'loss': 'mse', 'optimizer': 'adam', 'graph_mode': 'cutoff', 'cutoff': 0.5095784446612142, 'grm_norm': 'gcn', 'self_loops': False, 'use_snp_selection': False}. Best is trial 9 with value: 0.06659124926087946.
[I 2025-11-03 12:48:13,794] Trial 15 finished with value: 0.013532422699594909 and parameters: {'model_type': 'gcn', 'hidden_dims': '[512, 64]', 'dropout': 0.5960169427877031, 'batch_norm': True, 'lr': 1.6018489596291638e-05, 'weight_decay': 4.2460098143578764e-07, 'epochs': 62, 'loss': 'mae', 'optimizer': 'adam', 'graph_mode': 'cutoff', 'cutoff': 0.2570366467567345, 'grm_norm': 'none', 'self_loops': False, 'use_snp_selection': True, 'num_snps': 17634}. Best is trial 9 with value: 0.06659124926087946.
[I 2025-11-03 12:48:15,824] Trial 16 finished with value: 0.015132031642155645 and parameters: {'model_type': 'gcn', 'hidden_dims': '[512, 128]', 'dropout': 0.32232550461790044, 'batch_norm': True, 'lr': 4.250481093432877e-06, 'weight_decay': 0.0005337083112122797, 'epochs': 147, 'loss': 'mae', 'optimizer': 'adam', 'graph_mode': 'cutoff', 'cutoff': 0.6895417933793272, 'grm_norm': 'cosine', 'self_loops': True, 'use_snp_selection': False}. Best is trial 9 with value: 0.06659124926087946.
[I 2025-11-03 12:48:19,319] Trial 17 finished with value: 0.008905019705670557 and parameters: {'model_type': 'gcn', 'hidden_dims': '[256, 128, 64]', 'dropout': 0.19831389195434396, 'batch_norm': False, 'lr': 1.0664013201561952e-06, 'weight_decay': 6.789414512354813e-05, 'epochs': 201, 'loss': 'mse', 'optimizer': 'adam', 'graph_mode': 'cutoff', 'cutoff': 0.8951818133429486, 'grm_norm': 'cosine_then_gcn', 'self_loops': False, 'use_snp_selection': True, 'num_snps': 58012}. Best is trial 9 with value: 0.06659124926087946.
