[I 2025-11-03 12:45:51,134] Trial 15 finished with value: 0.14051277486336491 and parameters: {'model_type': 'gcn', 'hidden_dims': '[128, 64]', 'dropout': 0.10515697852451877, 'batch_norm': True, 'lr': 0.0001637201916360417, 'weight_decay': 1.232049712459595e-07, 'epochs': 302, 'loss': 'mae', 'optimizer': 'adam', 'graph_mode': 'off', 'use_snp_selection': False}. Best is trial 15 with value: 0.14051277486336491.
[I 2025-11-03 12:45:52,724] Trial 16 finished with value: 0.07941640471572407 and parameters: {'model_type': 'gcn', 'hidden_dims': '[128, 64]', 'dropout': 0.189726241825382, 'batch_norm': True, 'lr': 2.1517090787442848e-05, 'weight_decay': 1.0590314199196095e-07, 'epochs': 240, 'loss': 'mae', 'optimizer': 'adam', 'graph_mode': 'off', 'use_snp_selection': False}. Best is trial 15 with value: 0.14051277486336491.
[I 2025-11-03 12:45:54,789] Trial 17 finished with value: 0.11703672204284225 and parameters: {'model_type': 'gcn', 'hidden_dims': '[128, 64]', 'dropout': 0.5019861492125737, 'batch_norm': True, 'lr': 0.00015314873022812502, 'weight_decay': 3.53946548624492e-07, 'epochs': 350, 'loss': 'mae', 'optimizer': 'adam', 'graph_mode': 'off', 'use_snp_selection': False}. Best is trial 15 with value: 0.14051277486336491.
[I 2025-11-03 12:45:59,252] Trial 18 finished with value: 0.10103352999400365 and parameters: {'model_type': 'gcn', 'hidden_dims': '[512, 256]', 'dropout': 0.2046842361032689, 'batch_norm': False, 'lr': 0.00099450959026762, 'weight_decay': 1.0815722596945956e-06, 'epochs': 246, 'loss': 'mae', 'optimizer': 'adam', 'graph_mode': 'off', 'use_snp_selection': True, 'num_snps': 58241}. Best is trial 15 with value: 0.14051277486336491.
[I 2025-11-03 12:46:02,209] Trial 19 finished with value: 0.06913455887248242 and parameters: {'model_type': 'gcn', 'hidden_dims': '[256, 128, 64]', 'dropout': 0.3129747392024047, 'batch_norm': True, 'lr': 1.711240857018964e-05, 'weight_decay': 2.52995647434787e-07, 'epochs': 297, 'loss': 'mae', 'optimizer': 'adam', 'graph_mode': 'off', 'use_snp_selection': False}. Best is trial 15 with value: 0.14051277486336491.
[I 2025-11-03 12:46:03,715] Trial 20 finished with value: 0.13560097424269263 and parameters: {'model_type': 'gcn', 'hidden_dims': '[128, 64]', 'dropout': 0.15184468352870642, 'batch_norm': True, 'lr': 0.0005330495239978539, 'weight_decay': 1.7430279529399676e-07, 'epochs': 222, 'loss': 'mae', 'optimizer': 'adam', 'graph_mode': 'off', 'use_snp_selection': False}. Best is trial 15 with value: 0.14051277486336491.
[I 2025-11-03 12:46:08,029] Trial 21 finished with value: 0.1406951494058418 and parameters: {'model_type': 'gcn', 'hidden_dims': '[512, 128]', 'dropout': 0.10125817542847075, 'batch_norm': True, 'lr': 0.0001573993532868966, 'weight_decay': 9.379600410328288e-06, 'epochs': 309, 'loss': 'mae', 'optimizer': 'adam', 'graph_mode': 'off', 'use_snp_selection': False}. Best is trial 21 with value: 0.1406951494058418.
[I 2025-11-03 12:46:11,827] Trial 22 finished with value: 0.13158155896039256 and parameters: {'model_type': 'gcn', 'hidden_dims': '[512, 128]', 'dropout': 0.10427896583906489, 'batch_norm': True, 'lr': 0.0001210396949333345, 'weight_decay': 1.52391770991326e-06, 'epochs': 271, 'loss': 'mae', 'optimizer': 'adam', 'graph_mode': 'off', 'use_snp_selection': False}. Best is trial 21 with value: 0.1406951494058418.
[I 2025-11-03 12:46:13,737] Trial 23 finished with value: 0.12179712804838388 and parameters: {'model_type': 'gcn', 'hidden_dims': '[128, 64]', 'dropout': 0.16094833050161866, 'batch_norm': True, 'lr': 0.00012490297956936882, 'weight_decay': 6.759311409270804e-07, 'epochs': 312, 'loss': 'mae', 'optimizer': 'adam', 'graph_mode': 'off', 'use_snp_selection': False}. Best is trial 21 with value: 0.1406951494058418.
[I 2025-11-03 12:46:17,486] Trial 24 finished with value: 0.13853696140777857 and parameters: {'model_type': 'gcn', 'hidden_dims': '[512, 128]', 'dropout': 0.22826341608525963, 'batch_norm': True, 'lr': 0.00046999179962940583, 'weight_decay': 4.404843582735991e-06, 'epochs': 258, 'loss': 'mae', 'optimizer': 'adam', 'graph_mode': 'off', 'use_snp_selection': False}. Best is trial 21 with value: 0.1406951494058418.
[I 2025-11-03 12:46:22,001] Trial 25 finished with value: 0.13770204278444376 and parameters: {'model_type': 'gcn', 'hidden_dims': '[512, 256]', 'dropout': 0.21417931477273006, 'batch_norm': True, 'lr': 0.0003254665004248633, 'weight_decay': 4.454841632250041e-06, 'epochs': 330, 'loss': 'mae', 'optimizer': 'adam', 'graph_mode': 'off', 'use_snp_selection': False}. Best is trial 21 with value: 0.1406951494058418.
[I 2025-11-03 12:46:23,378] Trial 26 finished with value: 0.10452026051700386 and parameters: {'model_type': 'gcn', 'hidden_dims': '[256, 128]', 'dropout': 0.2814934940969189, 'batch_norm': False, 'lr': 9.25350388910494e-05, 'weight_decay': 5.0603047558382345e-05, 'epochs': 291, 'loss': 'mae', 'optimizer': 'adam', 'graph_mode': 'off', 'use_snp_selection': True, 'num_snps': 3842}. Best is trial 21 with value: 0.1406951494058418.
[I 2025-11-03 12:46:26,278] Trial 27 finished with value: 0.11910956016003522 and parameters: {'model_type': 'gcn', 'hidden_dims': '[256, 128, 64]', 'dropout': 0.23257075553844642, 'batch_norm': True, 'lr': 3.7020335428421226e-05, 'weight_decay': 3.052909549394234e-06, 'epochs': 299, 'loss': 'mae', 'optimizer': 'adam', 'graph_mode': 'off', 'use_snp_selection': False}. Best is trial 21 with value: 0.1406951494058418.
[I 2025-11-03 12:46:28,364] Trial 28 finished with value: 0.12791205302012193 and parameters: {'model_type': 'gcn', 'hidden_dims': '[128, 64]', 'dropout': 0.17610450553201173, 'batch_norm': True, 'lr': 0.0003245074402526371, 'weight_decay': 8.312192903381175e-06, 'epochs': 350, 'loss': 'mae', 'optimizer': 'adam', 'graph_mode': 'off', 'use_snp_selection': False}. Best is trial 21 with value: 0.1406951494058418.
[I 2025-11-03 12:46:30,091] Trial 29 finished with value: 0.0737817607255348 and parameters: {'model_type': 'gcn', 'hidden_dims': '[128, 64]', 'dropout': 0.13607006989918055, 'batch_norm': True, 'lr': 1.9483831259540862e-05, 'weight_decay': 5.522710335772481e-05, 'epochs': 263, 'loss': 'mae', 'optimizer': 'adam', 'graph_mode': 'off', 'use_snp_selection': True, 'num_snps': 19468}. Best is trial 21 with value: 0.1406951494058418.
[I 2025-11-03 12:46:33,322] Trial 30 finished with value: 0.08954885290228759 and parameters: {'model_type': 'gcn', 'hidden_dims': '[512, 128]', 'dropout': 0.19216212121070803, 'batch_norm': True, 'lr': 9.648700847063526e-06, 'weight_decay': 0.00013735959124467717, 'epochs': 220, 'loss': 'mae', 'optimizer': 'adam', 'graph_mode': 'off', 'use_snp_selection': False}. Best is trial 21 with value: 0.1406951494058418.
[I 2025-11-03 12:46:36,994] Trial 31 finished with value: 0.1450267081186218 and parameters: {'model_type': 'gcn', 'hidden_dims': '[512, 128]', 'dropout': 0.1202273725173509, 'batch_norm': True, 'lr': 0.0006065451035512783, 'weight_decay': 2.306768064291122e-07, 'epochs': 259, 'loss': 'mae', 'optimizer': 'adam', 'graph_mode': 'off', 'use_snp_selection': False}. Best is trial 31 with value: 0.1450267081186218.
[I 2025-11-03 12:46:41,508] Trial 32 finished with value: 0.13522663917203703 and parameters: {'model_type': 'gcn', 'hidden_dims': '[512, 128]', 'dropout': 0.13041424859217424, 'batch_norm': True, 'lr': 0.00019688548620029215, 'weight_decay': 7.968879192010965e-06, 'epochs': 331, 'loss': 'mae', 'optimizer': 'adam', 'graph_mode': 'off', 'use_snp_selection': False}. Best is trial 31 with value: 0.1450267081186218.
[I 2025-11-03 12:46:45,022] Trial 33 finished with value: 0.1365127288788362 and parameters: {'model_type': 'gcn', 'hidden_dims': '[512, 128]', 'dropout': 0.1745313866552075, 'batch_norm': True, 'lr': 0.0004718846314226632, 'weight_decay': 2.636819028230266e-05, 'epochs': 242, 'loss': 'mae', 'optimizer': 'adam', 'graph_mode': 'off', 'use_snp_selection': False}. Best is trial 31 with value: 0.1450267081186218.
[I 2025-11-03 12:46:46,884] Trial 34 finished with value: 0.14196367898143408 and parameters: {'model_type': 'gcn', 'hidden_dims': '[256, 128]', 'dropout': 0.1307477880381344, 'batch_norm': True, 'lr': 0.0006943753209864556, 'weight_decay': 2.4820107315178157e-07, 'epochs': 184, 'loss': 'mae', 'optimizer': 'adam', 'graph_mode': 'off', 'use_snp_selection': False}. Best is trial 31 with value: 0.1450267081186218.
[I 2025-11-03 12:46:48,582] Trial 35 finished with value: 0.0960464660942041 and parameters: {'model_type': 'gcn', 'hidden_dims': '[256, 128]', 'dropout': 0.4765625079717057, 'batch_norm': False, 'lr': 0.000765679186712463, 'weight_decay': 2.2624036045686043e-07, 'epochs': 166, 'loss': 'mae', 'optimizer': 'adam', 'graph_mode': 'off', 'use_snp_selection': False}. Best is trial 31 with value: 0.1450267081186218.
[I 2025-11-03 12:46:51,242] Trial 36 finished with value: 0.11888777197091938 and parameters: {'model_type': 'gcn', 'hidden_dims': '[256, 128]', 'dropout': 0.12824891604326016, 'batch_norm': True, 'lr': 7.979969018373242e-05, 'weight_decay': 5.839605599746252e-07, 'epochs': 120, 'loss': 'mse', 'optimizer': 'adam', 'graph_mode': 'off', 'use_snp_selection': True, 'num_snps': 58661}. Best is trial 31 with value: 0.1450267081186218.
[I 2025-11-03 12:46:53,162] Trial 37 finished with value: 0.13723411971495772 and parameters: {'model_type': 'gcn', 'hidden_dims': '[256, 128]', 'dropout': 0.12775879473902796, 'batch_norm': True, 'lr': 0.00027077334464762997, 'weight_decay': 3.32574315450492e-07, 'epochs': 190, 'loss': 'mae', 'optimizer': 'adam', 'graph_mode': 'off', 'use_snp_selection': False}. Best is trial 31 with value: 0.1450267081186218.
[I 2025-11-03 12:46:55,199] Trial 38 finished with value: 0.05854045684115347 and parameters: {'model_type': 'gcn', 'hidden_dims': '[512, 64]', 'dropout': 0.574982269382311, 'batch_norm': False, 'lr': 0.00016503391806366548, 'weight_decay': 1.1690776204022014e-06, 'epochs': 199, 'loss': 'mse', 'optimizer': 'adam', 'graph_mode': 'off', 'use_snp_selection': True, 'num_snps': 19911}. Best is trial 31 with value: 0.1450267081186218.
[I 2025-11-03 12:46:56,857] Trial 39 finished with value: 0.13578905134550007 and parameters: {'model_type': 'gcn', 'hidden_dims': '[256, 128]', 'dropout': 0.18198092581569036, 'batch_norm': True, 'lr': 0.0006686492578414426, 'weight_decay': 0.000494866061743946, 'epochs': 146, 'loss': 'mae', 'optimizer': 'adam', 'graph_mode': 'off', 'use_snp_selection': False}. Best is trial 31 with value: 0.1450267081186218.
[I 2025-11-03 12:46:59,594] Trial 40 finished with value: 0.04547044667872232 and parameters: {'model_type': 'gcn', 'hidden_dims': '[256, 128]', 'dropout': 0.15803741855220454, 'batch_norm': True, 'lr': 4.767147905519569e-06, 'weight_decay': 1.8396749523162157e-07, 'epochs': 312, 'loss': 'mae', 'optimizer': 'adam', 'graph_mode': 'off', 'use_snp_selection': False}. Best is trial 31 with value: 0.1450267081186218.
[I 2025-11-03 12:47:03,010] Trial 41 finished with value: 0.08859832113024481 and parameters: {'model_type': 'gcn', 'hidden_dims': '[512, 128]', 'dropout': 0.22009225172911073, 'batch_norm': True, 'lr': 2.320370617557869e-06, 'weight_decay': 1.1922862819068451e-05, 'epochs': 235, 'loss': 'mae', 'optimizer': 'adam', 'graph_mode': 'off', 'use_snp_selection': False}. Best is trial 31 with value: 0.1450267081186218.
[I 2025-11-03 12:47:05,949] Trial 42 finished with value: 0.12728697293279384 and parameters: {'model_type': 'gcn', 'hidden_dims': '[256, 128, 64]', 'dropout': 0.12406541790441106, 'batch_norm': True, 'lr': 0.0004350955701065192, 'weight_decay': 2.4879018819447254e-06, 'epochs': 299, 'loss': 'mae', 'optimizer': 'adam', 'graph_mode': 'off', 'use_snp_selection': False}. Best is trial 31 with value: 0.1450267081186218.
[I 2025-11-03 12:47:10,077] Trial 43 finished with value: 0.12850170378607803 and parameters: {'model_type': 'gcn', 'hidden_dims': '[512, 128]', 'dropout': 0.35105342748695323, 'batch_norm': True, 'lr': 0.00039685137768653866, 'weight_decay': 5.513298536606661e-07, 'epochs': 278, 'loss': 'mae', 'optimizer': 'adam', 'graph_mode': 'off', 'use_snp_selection': False}. Best is trial 31 with value: 0.1450267081186218.
[I 2025-11-03 12:47:13,659] Trial 44 finished with value: 0.1353909058891506 and parameters: {'model_type': 'gcn', 'hidden_dims': '[512, 64]', 'dropout': 0.15783868072032917, 'batch_norm': True, 'lr': 0.00024104997939617697, 'weight_decay': 2.4873860708804878e-05, 'epochs': 185, 'loss': 'mse', 'optimizer': 'adam', 'graph_mode': 'off', 'use_snp_selection': False}. Best is trial 31 with value: 0.1450267081186218.
[I 2025-11-03 12:47:16,760] Trial 45 finished with value: 0.12900253110231805 and parameters: {'model_type': 'gcn', 'hidden_dims': '[512, 128]', 'dropout': 0.2669800006628815, 'batch_norm': True, 'lr': 0.0006024030728798982, 'weight_decay': 1.4192429350174057e-05, 'epochs': 206, 'loss': 'mae', 'optimizer': 'adam', 'graph_mode': 'off', 'use_snp_selection': False}. Best is trial 31 with value: 0.1450267081186218.
[I 2025-11-03 12:47:20,505] Trial 46 finished with value: 0.1377597946286771 and parameters: {'model_type': 'gcn', 'hidden_dims': '[512, 256]', 'dropout': 0.1124746948403939, 'batch_norm': True, 'lr': 0.00011792609463633923, 'weight_decay': 1.014457586697854e-06, 'epochs': 257, 'loss': 'mae', 'optimizer': 'adam', 'graph_mode': 'off', 'use_snp_selection': False}. Best is trial 31 with value: 0.1450267081186218.
[I 2025-11-03 12:47:22,703] Trial 47 finished with value: 0.11027302059685412 and parameters: {'model_type': 'gcn', 'hidden_dims': '[512, 128]', 'dropout': 0.10035794565692883, 'batch_norm': False, 'lr': 4.708787366173013e-05, 'weight_decay': 1.554037900560284e-07, 'epochs': 127, 'loss': 'mae', 'optimizer': 'adam', 'graph_mode': 'off', 'use_snp_selection': False}. Best is trial 31 with value: 0.1450267081186218.
[I 2025-11-03 12:47:24,174] Trial 48 finished with value: 0.13378039452922097 and parameters: {'model_type': 'gcn', 'hidden_dims': '[128, 64]', 'dropout': 0.24580147350219891, 'batch_norm': True, 'lr': 0.0007363544624688081, 'weight_decay': 1.0034953351198983e-07, 'epochs': 167, 'loss': 'mse', 'optimizer': 'adam', 'graph_mode': 'off', 'use_snp_selection': False}. Best is trial 31 with value: 0.1450267081186218.
[I 2025-11-03 12:47:26,518] Trial 49 finished with value: 0.1453007329103937 and parameters: {'model_type': 'gcn', 'hidden_dims': '[512, 128]', 'dropout': 0.13983733815970265, 'batch_norm': True, 'lr': 0.0002734832349465893, 'weight_decay': 2.7355800068439777e-07, 'epochs': 48, 'loss': 'mae', 'optimizer': 'adam', 'graph_mode': 'off', 'use_snp_selection': True, 'num_snps': 46888}. Best is trial 49 with value: 0.1453007329103937.
[I 2025-11-03 12:47:28,880] Trial 50 finished with value: 0.1359023426151759 and parameters: {'model_type': 'gcn', 'hidden_dims': '[512, 128]', 'dropout': 0.1446790151065904, 'batch_norm': True, 'lr': 0.000285455630815544, 'weight_decay': 2.860608520405501e-07, 'epochs': 72, 'loss': 'mae', 'optimizer': 'adam', 'graph_mode': 'off', 'use_snp_selection': True, 'num_snps': 46345}. Best is trial 49 with value: 0.1453007329103937.
[I 2025-11-03 12:47:30,928] Trial 51 finished with value: 0.13356479666400375 and parameters: {'model_type': 'gcn', 'hidden_dims': '[512, 128]', 'dropout': 0.17007873370890683, 'batch_norm': True, 'lr': 0.000388509522507232, 'weight_decay': 3.9318032237569546e-07, 'epochs': 42, 'loss': 'mae', 'optimizer': 'adam', 'graph_mode': 'off', 'use_snp_selection': True, 'num_snps': 47105}. Best is trial 49 with value: 0.1453007329103937.
[I 2025-11-03 12:47:32,630] Trial 52 finished with value: 0.11190528150158362 and parameters: {'model_type': 'gcn', 'hidden_dims': '[512, 128]', 'dropout': 0.13645116026806361, 'batch_norm': True, 'lr': 0.00018300247771600145, 'weight_decay': 4.660081559108898e-07, 'epochs': 95, 'loss': 'mae', 'optimizer': 'adam', 'graph_mode': 'off', 'use_snp_selection': True, 'num_snps': 22057}. Best is trial 49 with value: 0.1453007329103937.
[I 2025-11-03 12:47:36,519] Trial 53 finished with value: 0.1348675936163847 and parameters: {'model_type': 'gcn', 'hidden_dims': '[512, 128]', 'dropout': 0.1983287970166155, 'batch_norm': True, 'lr': 0.0008762198929676791, 'weight_decay': 8.288987661147761e-07, 'epochs': 323, 'loss': 'mae', 'optimizer': 'adam', 'graph_mode': 'off', 'use_snp_selection': True, 'num_snps': 37397}. Best is trial 49 with value: 0.1453007329103937.
[I 2025-11-03 12:47:41,245] Trial 54 finished with value: 0.1394364065227342 and parameters: {'model_type': 'gcn', 'hidden_dims': '[512, 128]', 'dropout': 0.11674431417727545, 'batch_norm': True, 'lr': 0.0005456097373802749, 'weight_decay': 1.8140564860097773e-07, 'epochs': 308, 'loss': 'mae', 'optimizer': 'adam', 'graph_mode': 'off', 'use_snp_selection': True, 'num_snps': 51553}. Best is trial 49 with value: 0.1453007329103937.
[I 2025-11-03 12:47:45,847] Trial 55 finished with value: 0.12706608874312703 and parameters: {'model_type': 'gcn', 'hidden_dims': '[512, 64]', 'dropout': 0.11466404618459067, 'batch_norm': True, 'lr': 0.0005796572938946488, 'weight_decay': 2.372223981316617e-07, 'epochs': 285, 'loss': 'mae', 'optimizer': 'adam', 'graph_mode': 'off', 'use_snp_selection': True, 'num_snps': 53498}. Best is trial 49 with value: 0.1453007329103937.
[I 2025-11-03 12:47:48,737] Trial 56 finished with value: 0.1313312829526877 and parameters: {'model_type': 'gcn', 'hidden_dims': '[128, 64]', 'dropout': 0.14771029300497557, 'batch_norm': True, 'lr': 0.0002352028621648254, 'weight_decay': 1.4949613600358506e-07, 'epochs': 341, 'loss': 'mae', 'optimizer': 'adam', 'graph_mode': 'off', 'use_snp_selection': True, 'num_snps': 49601}. Best is trial 49 with value: 0.1453007329103937.
[I 2025-11-03 12:47:52,748] Trial 57 finished with value: 0.14353376688680894 and parameters: {'model_type': 'gcn', 'hidden_dims': '[512, 128]', 'dropout': 0.11701090800813371, 'batch_norm': True, 'lr': 0.0009649965179708873, 'weight_decay': 2.089911945197305e-07, 'epochs': 308, 'loss': 'mae', 'optimizer': 'adam', 'graph_mode': 'off', 'use_snp_selection': True, 'num_snps': 39903}. Best is trial 49 with value: 0.1453007329103937.
[I 2025-11-03 12:47:56,009] Trial 58 finished with value: 0.12098573415840606 and parameters: {'model_type': 'gcn', 'hidden_dims': '[256, 128, 64]', 'dropout': 0.10291258880191925, 'batch_norm': False, 'lr': 0.000972587320816831, 'weight_decay': 0.00014144043448895884, 'epochs': 320, 'loss': 'mse', 'optimizer': 'adam', 'graph_mode': 'off', 'use_snp_selection': True, 'num_snps': 40345}. Best is trial 49 with value: 0.1453007329103937.
[I 2025-11-03 12:47:57,827] Trial 59 finished with value: 0.11530376466207033 and parameters: {'model_type': 'gcn', 'hidden_dims': '[512, 256]', 'dropout': 0.14519994169731332, 'batch_norm': True, 'lr': 0.0001387141389111794, 'weight_decay': 1.203964754001281e-07, 'epochs': 81, 'loss': 'mae', 'optimizer': 'adam', 'graph_mode': 'off', 'use_snp_selection': True, 'num_snps': 28180}. Best is trial 49 with value: 0.1453007329103937.
[I 2025-11-03 12:47:59,637] Trial 60 finished with value: 0.06692250004152926 and parameters: {'model_type': 'gcn', 'hidden_dims': '[256, 128]', 'dropout': 0.16834610875776534, 'batch_norm': True, 'lr': 9.93217928767715e-05, 'weight_decay': 2.3536806088726246e-07, 'epochs': 129, 'loss': 'mae', 'optimizer': 'adam', 'graph_mode': 'off', 'use_snp_selection': True, 'num_snps': 28623}. Best is trial 49 with value: 0.1453007329103937.
[I 2025-11-03 12:48:04,358] Trial 61 finished with value: 0.14183865099023926 and parameters: {'model_type': 'gcn', 'hidden_dims': '[512, 128]', 'dropout': 0.12038963987193699, 'batch_norm': True, 'lr': 0.0005507323138614152, 'weight_decay': 1.9579397684620712e-07, 'epochs': 300, 'loss': 'mae', 'optimizer': 'adam', 'graph_mode': 'off', 'use_snp_selection': True, 'num_snps': 52506}. Best is trial 49 with value: 0.1453007329103937.
[I 2025-11-03 12:48:08,524] Trial 62 finished with value: 0.1371316839753233 and parameters: {'model_type': 'gcn', 'hidden_dims': '[512, 128]', 'dropout': 0.12054341607093927, 'batch_norm': True, 'lr': 0.00035282593946134723, 'weight_decay': 4.146115180863159e-07, 'epochs': 303, 'loss': 'mae', 'optimizer': 'adam', 'graph_mode': 'off', 'use_snp_selection': True, 'num_snps': 43042}. Best is trial 49 with value: 0.1453007329103937.
[I 2025-11-03 12:48:13,283] Trial 63 finished with value: 0.13353654945264698 and parameters: {'model_type': 'gcn', 'hidden_dims': '[512, 128]', 'dropout': 0.40917714191741517, 'batch_norm': True, 'lr': 0.0007293169911068153, 'weight_decay': 2.9719350741272394e-07, 'epochs': 287, 'loss': 'mae', 'optimizer': 'adam', 'graph_mode': 'off', 'use_snp_selection': True, 'num_snps': 54215}. Best is trial 49 with value: 0.1453007329103937.
[I 2025-11-03 12:48:16,688] Trial 64 finished with value: 0.1341098971101313 and parameters: {'model_type': 'gcn', 'hidden_dims': '[512, 128]', 'dropout': 0.1343785290136466, 'batch_norm': True, 'lr': 0.00047235574608947355, 'weight_decay': 1.3626376029986164e-07, 'epochs': 272, 'loss': 'mae', 'optimizer': 'adam', 'graph_mode': 'off', 'use_snp_selection': True, 'num_snps': 34737}. Best is trial 49 with value: 0.1453007329103937.
[I 2025-11-03 12:48:20,909] Trial 65 finished with value: 0.13636961272436537 and parameters: {'model_type': 'gcn', 'hidden_dims': '[512, 128]', 'dropout': 0.2052310988695722, 'batch_norm': True, 'lr': 0.000832678363231534, 'weight_decay': 7.384402273935623e-07, 'epochs': 336, 'loss': 'mae', 'optimizer': 'adam', 'graph_mode': 'off', 'use_snp_selection': True, 'num_snps': 41018}. Best is trial 49 with value: 0.1453007329103937.
[I 2025-11-03 12:48:23,668] Trial 66 finished with value: 0.1328546274436267 and parameters: {'model_type': 'gcn', 'hidden_dims': '[128, 64]', 'dropout': 0.10039335824090187, 'batch_norm': True, 'lr': 0.0003050052003057213, 'weight_decay': 1.9038077440255489e-07, 'epochs': 321, 'loss': 'mae', 'optimizer': 'adam', 'graph_mode': 'off', 'use_snp_selection': True, 'num_snps': 48522}. Best is trial 49 with value: 0.1453007329103937.
