[I 2025-11-03 12:02:04,207] Trial 0 finished with value: 0.013565608055520572 and parameters: {'model_type': 'graphsage', 'hidden_dims': '[128, 64]', 'dropout': 0.199031432379812, 'batch_norm': True, 'lr': 1.8408544111075837e-06, 'weight_decay': 5.5136510071208614e-05, 'epochs': 336, 'loss': 'mae', 'optimizer': 'adam', 'graph_mode': 'knn', 'source': 'grm', 'knn_k': 8, 'weighted_edges': True, 'symmetrize_mode': 'mutual', 'use_snp_selection': False}. Best is trial 0 with value: 0.013565608055520572.
[I 2025-11-03 12:02:05,761] Trial 1 finished with value: 0.04435100514151452 and parameters: {'model_type': 'graphsage', 'hidden_dims': '[128, 64]', 'dropout': 0.40051947670227217, 'batch_norm': True, 'lr': 0.0005320428882732732, 'weight_decay': 1.89210117736594e-06, 'epochs': 68, 'loss': 'mse', 'optimizer': 'adam', 'graph_mode': 'knn', 'source': 'grm', 'knn_k': 7, 'weighted_edges': True, 'symmetrize_mode': 'union', 'use_snp_selection': False}. Best is trial 1 with value: 0.04435100514151452.
[I 2025-11-03 12:02:08,272] Trial 2 finished with value: 0.052094141625683404 and parameters: {'model_type': 'graphsage', 'hidden_dims': '[256, 128]', 'dropout': 0.5105528289184642, 'batch_norm': False, 'lr': 0.0006804279372404962, 'weight_decay': 0.0008922815224257085, 'epochs': 181, 'loss': 'mse', 'optimizer': 'adam', 'graph_mode': 'cutoff', 'cutoff': 0.5741905641612706, 'grm_norm': 'gcn', 'self_loops': False, 'use_snp_selection': True, 'num_snps': 26910}. Best is trial 2 with value: 0.052094141625683404.
[I 2025-11-03 12:02:10,949] Trial 3 finished with value: 0.06232190732502791 and parameters: {'model_type': 'graphsage', 'hidden_dims': '[256, 128, 64]', 'dropout': 0.5390483213624292, 'batch_norm': False, 'lr': 3.4705625989073525e-05, 'weight_decay': 2.4623319020131338e-05, 'epochs': 121, 'loss': 'mse', 'optimizer': 'adam', 'graph_mode': 'knn', 'source': 'grm', 'knn_k': 6, 'weighted_edges': False, 'symmetrize_mode': 'mutual', 'use_snp_selection': True, 'num_snps': 30713}. Best is trial 3 with value: 0.06232190732502791.
[I 2025-11-03 12:02:13,546] Trial 4 finished with value: 0.054783295479107555 and parameters: {'model_type': 'graphsage', 'hidden_dims': '[128, 64]', 'dropout': 0.13404863676897502, 'batch_norm': False, 'lr': 0.0001431556295367288, 'weight_decay': 2.2084517750726675e-05, 'epochs': 51, 'loss': 'mae', 'optimizer': 'adam', 'graph_mode': 'cutoff', 'cutoff': 0.6714268476993044, 'grm_norm': 'none', 'self_loops': False, 'use_snp_selection': True, 'num_snps': 45645}. Best is trial 3 with value: 0.06232190732502791.
[I 2025-11-03 12:02:16,757] Trial 5 finished with value: 0.025916869508914944 and parameters: {'model_type': 'graphsage', 'hidden_dims': '[256, 128]', 'dropout': 0.42253606323412096, 'batch_norm': False, 'lr': 4.238630400638805e-05, 'weight_decay': 8.074086040046576e-07, 'epochs': 158, 'loss': 'mae', 'optimizer': 'adam', 'graph_mode': 'knn', 'source': 'grm', 'knn_k': 1, 'weighted_edges': False, 'symmetrize_mode': 'mutual', 'use_snp_selection': True, 'num_snps': 43113}. Best is trial 3 with value: 0.06232190732502791.
[I 2025-11-03 12:02:20,815] Trial 6 finished with value: 0.03769172381087014 and parameters: {'model_type': 'graphsage', 'hidden_dims': '[512, 256]', 'dropout': 0.3534893146320237, 'batch_norm': True, 'lr': 0.000251307964226932, 'weight_decay': 1.821819791794022e-05, 'epochs': 223, 'loss': 'mae', 'optimizer': 'adam', 'graph_mode': 'knn', 'source': 'grm', 'knn_k': 1, 'weighted_edges': True, 'symmetrize_mode': 'mutual', 'use_snp_selection': False}. Best is trial 3 with value: 0.06232190732502791.
[I 2025-11-03 12:02:24,464] Trial 7 finished with value: 0.05094971837721328 and parameters: {'model_type': 'graphsage', 'hidden_dims': '[512, 256]', 'dropout': 0.1105825955860775, 'batch_norm': True, 'lr': 2.374338412754043e-05, 'weight_decay': 1.1284721123340274e-05, 'epochs': 190, 'loss': 'mse', 'optimizer': 'adam', 'graph_mode': 'cutoff', 'cutoff': 0.719872204109604, 'grm_norm': 'gcn', 'self_loops': False, 'use_snp_selection': False}. Best is trial 3 with value: 0.06232190732502791.
[I 2025-11-03 12:02:27,545] Trial 8 finished with value: 0.05155348323394568 and parameters: {'model_type': 'graphsage', 'hidden_dims': '[512, 128]', 'dropout': 0.5066580418354021, 'batch_norm': True, 'lr': 0.00039213678276659976, 'weight_decay': 3.43655320802934e-06, 'epochs': 120, 'loss': 'mse', 'optimizer': 'adam', 'graph_mode': 'cutoff', 'cutoff': 0.34923059576505366, 'grm_norm': 'cosine', 'self_loops': True, 'use_snp_selection': False}. Best is trial 3 with value: 0.06232190732502791.
[I 2025-11-03 12:02:29,558] Trial 9 finished with value: 0.0348681188918495 and parameters: {'model_type': 'graphsage', 'hidden_dims': '[512, 256]', 'dropout': 0.301734920240333, 'batch_norm': False, 'lr': 6.650961854953448e-06, 'weight_decay': 6.861575656590315e-05, 'epochs': 150, 'loss': 'mae', 'optimizer': 'adam', 'graph_mode': 'cutoff', 'cutoff': 0.2857569870061939, 'grm_norm': 'cosine_then_gcn', 'self_loops': False, 'use_snp_selection': True, 'num_snps': 12722}. Best is trial 3 with value: 0.06232190732502791.
[I 2025-11-03 12:02:34,405] Trial 10 finished with value: 0.01071991132234609 and parameters: {'model_type': 'graphsage', 'hidden_dims': '[256, 128, 64]', 'dropout': 0.5885461262002587, 'batch_norm': False, 'lr': 3.449757039592288e-05, 'weight_decay': 1.934048928990265e-07, 'epochs': 258, 'loss': 'mse', 'optimizer': 'adam', 'graph_mode': 'knn', 'source': 'grm', 'knn_k': 5, 'weighted_edges': False, 'symmetrize_mode': 'union', 'use_snp_selection': True, 'num_snps': 58960}. Best is trial 3 with value: 0.06232190732502791.
[I 2025-11-03 12:02:37,466] Trial 11 finished with value: 0.03728412305355704 and parameters: {'model_type': 'graphsage', 'hidden_dims': '[512, 64]', 'dropout': 0.21793782338681206, 'batch_norm': False, 'lr': 0.00012254459911509725, 'weight_decay': 0.0002205522163250003, 'epochs': 62, 'loss': 'mae', 'optimizer': 'adam', 'graph_mode': 'cutoff', 'cutoff': 0.8576830859783061, 'grm_norm': 'none', 'self_loops': True, 'use_snp_selection': True, 'num_snps': 38963}. Best is trial 3 with value: 0.06232190732502791.
[I 2025-11-03 12:02:39,779] Trial 12 finished with value: 0.042805382301179286 and parameters: {'model_type': 'graphsage', 'hidden_dims': '[256, 128, 64]', 'dropout': 0.10852296509461337, 'batch_norm': False, 'lr': 0.00010101956064977682, 'weight_decay': 4.159401756974887e-05, 'epochs': 43, 'loss': 'mae', 'optimizer': 'adam', 'graph_mode': 'cutoff', 'cutoff': 0.5157485749757096, 'grm_norm': 'none', 'self_loops': False, 'use_snp_selection': True, 'num_snps': 30790}. Best is trial 3 with value: 0.06232190732502791.
[I 2025-11-03 12:02:43,398] Trial 13 finished with value: 0.023877029953395898 and parameters: {'model_type': 'graphsage', 'hidden_dims': '[256, 128, 64]', 'dropout': 0.284904253685612, 'batch_norm': False, 'lr': 1.0211992581467313e-05, 'weight_decay': 4.973467440708404e-06, 'epochs': 106, 'loss': 'mse', 'optimizer': 'adam', 'graph_mode': 'knn', 'source': 'grm', 'knn_k': 10, 'weighted_edges': False, 'symmetrize_mode': 'mutual', 'use_snp_selection': True, 'num_snps': 51436}. Best is trial 3 with value: 0.06232190732502791.
[I 2025-11-03 12:02:45,424] Trial 14 finished with value: 0.022104887864007532 and parameters: {'model_type': 'graphsage', 'hidden_dims': '[128, 64]', 'dropout': 0.5988030903941239, 'batch_norm': False, 'lr': 0.0001177742391685898, 'weight_decay': 0.00022828589047768893, 'epochs': 103, 'loss': 'mae', 'optimizer': 'adam', 'graph_mode': 'cutoff', 'cutoff': 0.6574352283386461, 'grm_norm': 'none', 'self_loops': False, 'use_snp_selection': True, 'num_snps': 22268}. Best is trial 3 with value: 0.06232190732502791.
[I 2025-11-03 12:02:46,895] Trial 15 finished with value: 0.06634918723526631 and parameters: {'model_type': 'graphsage', 'hidden_dims': '[512, 128]', 'dropout': 0.47025822868335876, 'batch_norm': False, 'lr': 9.200208285142282e-06, 'weight_decay': 2.2787397405608774e-05, 'epochs': 95, 'loss': 'mse', 'optimizer': 'adam', 'graph_mode': 'knn', 'source': 'grm', 'knn_k': 4, 'weighted_edges': False, 'symmetrize_mode': 'mutual', 'use_snp_selection': True, 'num_snps': 2799}. Best is trial 15 with value: 0.06634918723526631.
[I 2025-11-03 12:02:48,443] Trial 16 finished with value: 0.03232466032184653 and parameters: {'model_type': 'graphsage', 'hidden_dims': '[512, 128]', 'dropout': 0.48530503278205905, 'batch_norm': False, 'lr': 2.343388704248642e-06, 'weight_decay': 0.0001182712499048136, 'epochs': 128, 'loss': 'mse', 'optimizer': 'adam', 'graph_mode': 'knn', 'source': 'grm', 'knn_k': 4, 'weighted_edges': False, 'symmetrize_mode': 'mutual', 'use_snp_selection': True, 'num_snps': 2331}. Best is trial 15 with value: 0.06634918723526631.
[I 2025-11-03 12:02:50,902] Trial 17 finished with value: 0.011730196572000447 and parameters: {'model_type': 'graphsage', 'hidden_dims': '[512, 128]', 'dropout': 0.45740226079890056, 'batch_norm': False, 'lr': 1.11913094725579e-05, 'weight_decay': 8.470072240219284e-07, 'epochs': 231, 'loss': 'mse', 'optimizer': 'adam', 'graph_mode': 'knn', 'source': 'grm', 'knn_k': 4, 'weighted_edges': False, 'symmetrize_mode': 'mutual', 'use_snp_selection': True, 'num_snps': 14737}. Best is trial 15 with value: 0.06634918723526631.
[I 2025-11-03 12:02:52,404] Trial 18 finished with value: 0.056502764817216736 and parameters: {'model_type': 'graphsage', 'hidden_dims': '[512, 64]', 'dropout': 0.5548221389562965, 'batch_norm': False, 'lr': 3.37848638514423e-06, 'weight_decay': 0.0007805871620966975, 'epochs': 89, 'loss': 'mse', 'optimizer': 'adam', 'graph_mode': 'knn', 'source': 'grm', 'knn_k': 3, 'weighted_edges': False, 'symmetrize_mode': 'mutual', 'use_snp_selection': True, 'num_snps': 3693}. Best is trial 15 with value: 0.06634918723526631.
[I 2025-11-03 12:02:55,289] Trial 19 finished with value: 0.047561123936382926 and parameters: {'model_type': 'graphsage', 'hidden_dims': '[512, 128]', 'dropout': 0.5462056751935317, 'batch_norm': False, 'lr': 1.864516034849023e-05, 'weight_decay': 5.49806409904948e-06, 'epochs': 290, 'loss': 'mse', 'optimizer': 'adam', 'graph_mode': 'knn', 'source': 'grm', 'knn_k': 7, 'weighted_edges': False, 'symmetrize_mode': 'union', 'use_snp_selection': True, 'num_snps': 17760}. Best is trial 15 with value: 0.06634918723526631.
[I 2025-11-03 12:02:58,454] Trial 20 finished with value: 0.03655936757353795 and parameters: {'model_type': 'graphsage', 'hidden_dims': '[256, 128, 64]', 'dropout': 0.4208412425024435, 'batch_norm': False, 'lr': 1.0031850713966547e-06, 'weight_decay': 1.3374659870229144e-07, 'epochs': 152, 'loss': 'mse', 'optimizer': 'adam', 'graph_mode': 'knn', 'source': 'grm', 'knn_k': 6, 'weighted_edges': False, 'symmetrize_mode': 'mutual', 'use_snp_selection': True, 'num_snps': 37038}. Best is trial 15 with value: 0.06634918723526631.
[I 2025-11-03 12:02:59,969] Trial 21 finished with value: 0.018306675293110107 and parameters: {'model_type': 'graphsage', 'hidden_dims': '[512, 64]', 'dropout': 0.5492638293792487, 'batch_norm': False, 'lr': 4.578258736964318e-06, 'weight_decay': 0.0009853346720920886, 'epochs': 90, 'loss': 'mse', 'optimizer': 'adam', 'graph_mode': 'knn', 'source': 'grm', 'knn_k': 3, 'weighted_edges': False, 'symmetrize_mode': 'mutual', 'use_snp_selection': True, 'num_snps': 2874}. Best is trial 15 with value: 0.06634918723526631.
[I 2025-11-03 12:03:01,689] Trial 22 finished with value: 0.016343212084143535 and parameters: {'model_type': 'graphsage', 'hidden_dims': '[512, 64]', 'dropout': 0.5552454565256397, 'batch_norm': False, 'lr': 3.8335345800048225e-06, 'weight_decay': 0.00025407137440581053, 'epochs': 81, 'loss': 'mse', 'optimizer': 'adam', 'graph_mode': 'knn', 'source': 'grm', 'knn_k': 3, 'weighted_edges': False, 'symmetrize_mode': 'mutual', 'use_snp_selection': True, 'num_snps': 7962}. Best is trial 15 with value: 0.06634918723526631.
[I 2025-11-03 12:03:03,663] Trial 23 finished with value: 0.05875011998519496 and parameters: {'model_type': 'graphsage', 'hidden_dims': '[512, 64]', 'dropout': 0.465833257675135, 'batch_norm': False, 'lr': 5.725990409015195e-05, 'weight_decay': 2.744423818834789e-05, 'epochs': 129, 'loss': 'mse', 'optimizer': 'adam', 'graph_mode': 'knn', 'source': 'grm', 'knn_k': 3, 'weighted_edges': False, 'symmetrize_mode': 'mutual', 'use_snp_selection': True, 'num_snps': 9616}. Best is trial 15 with value: 0.06634918723526631.
[I 2025-11-03 12:03:05,646] Trial 24 finished with value: 0.04377637425180214 and parameters: {'model_type': 'graphsage', 'hidden_dims': '[256, 128, 64]', 'dropout': 0.47015566276164267, 'batch_norm': False, 'lr': 6.375463936882003e-05, 'weight_decay': 2.3438109805461925e-05, 'epochs': 127, 'loss': 'mse', 'optimizer': 'adam', 'graph_mode': 'knn', 'source': 'grm', 'knn_k': 5, 'weighted_edges': False, 'symmetrize_mode': 'mutual', 'use_snp_selection': True, 'num_snps': 9667}. Best is trial 15 with value: 0.06634918723526631.
[I 2025-11-03 12:03:08,235] Trial 25 finished with value: 0.033701468912037624 and parameters: {'model_type': 'graphsage', 'hidden_dims': '[512, 64]', 'dropout': 0.3685687117236634, 'batch_norm': False, 'lr': 1.4355328360673378e-05, 'weight_decay': 1.1107602862801237e-05, 'epochs': 177, 'loss': 'mse', 'optimizer': 'adam', 'graph_mode': 'knn', 'source': 'grm', 'knn_k': 2, 'weighted_edges': False, 'symmetrize_mode': 'mutual', 'use_snp_selection': True, 'num_snps': 20424}. Best is trial 15 with value: 0.06634918723526631.
[I 2025-11-03 12:03:11,893] Trial 26 finished with value: 0.060355824826040134 and parameters: {'model_type': 'graphsage', 'hidden_dims': '[512, 128]', 'dropout': 0.44531101711844306, 'batch_norm': True, 'lr': 5.386553834227075e-05, 'weight_decay': 3.472052764795375e-05, 'epochs': 142, 'loss': 'mse', 'optimizer': 'adam', 'graph_mode': 'knn', 'source': 'grm', 'knn_k': 6, 'weighted_edges': True, 'symmetrize_mode': 'union', 'use_snp_selection': False}. Best is trial 15 with value: 0.06634918723526631.
[I 2025-11-03 12:03:16,278] Trial 27 finished with value: 0.04202424799043364 and parameters: {'model_type': 'graphsage', 'hidden_dims': '[512, 128]', 'dropout': 0.3974885416149257, 'batch_norm': True, 'lr': 2.6027123290934875e-05, 'weight_decay': 9.208486210649677e-05, 'epochs': 218, 'loss': 'mse', 'optimizer': 'adam', 'graph_mode': 'knn', 'source': 'grm', 'knn_k': 6, 'weighted_edges': True, 'symmetrize_mode': 'union', 'use_snp_selection': False}. Best is trial 15 with value: 0.06634918723526631.
[I 2025-11-03 12:03:20,210] Trial 28 finished with value: 0.06048200760557438 and parameters: {'model_type': 'graphsage', 'hidden_dims': '[512, 128]', 'dropout': 0.5125917531932658, 'batch_norm': True, 'lr': 6.247722199824691e-05, 'weight_decay': 8.082547161431548e-06, 'epochs': 164, 'loss': 'mse', 'optimizer': 'adam', 'graph_mode': 'knn', 'source': 'grm', 'knn_k': 8, 'weighted_edges': True, 'symmetrize_mode': 'union', 'use_snp_selection': False}. Best is trial 15 with value: 0.06634918723526631.
[I 2025-11-03 12:03:24,244] Trial 29 finished with value: 0.01796512492400741 and parameters: {'model_type': 'graphsage', 'hidden_dims': '[512, 128]', 'dropout': 0.5139995783152544, 'batch_norm': True, 'lr': 7.356414453984166e-06, 'weight_decay': 2.061603391364092e-06, 'epochs': 168, 'loss': 'mse', 'optimizer': 'adam', 'graph_mode': 'knn', 'source': 'grm', 'knn_k': 9, 'weighted_edges': True, 'symmetrize_mode': 'union', 'use_snp_selection': False}. Best is trial 15 with value: 0.06634918723526631.
[I 2025-11-03 12:03:28,587] Trial 30 finished with value: 0.059624295967199176 and parameters: {'model_type': 'graphsage', 'hidden_dims': '[512, 128]', 'dropout': 0.30272503275192747, 'batch_norm': True, 'lr': 0.0002250377735070629, 'weight_decay': 7.1740044892959685e-06, 'epochs': 200, 'loss': 'mse', 'optimizer': 'adam', 'graph_mode': 'knn', 'source': 'grm', 'knn_k': 8, 'weighted_edges': True, 'symmetrize_mode': 'union', 'use_snp_selection': False}. Best is trial 15 with value: 0.06634918723526631.
[I 2025-11-03 12:03:34,394] Trial 31 finished with value: 0.03695376695666486 and parameters: {'model_type': 'graphsage', 'hidden_dims': '[512, 128]', 'dropout': 0.4436583991493406, 'batch_norm': True, 'lr': 7.244445226206077e-05, 'weight_decay': 4.4403451395289536e-05, 'epochs': 343, 'loss': 'mse', 'optimizer': 'adam', 'graph_mode': 'knn', 'source': 'grm', 'knn_k': 7, 'weighted_edges': True, 'symmetrize_mode': 'union', 'use_snp_selection': False}. Best is trial 15 with value: 0.06634918723526631.
[I 2025-11-03 12:03:37,883] Trial 32 finished with value: 0.002043812319415393 and parameters: {'model_type': 'graphsage', 'hidden_dims': '[512, 128]', 'dropout': 0.5036886369024164, 'batch_norm': True, 'lr': 4.1337177489937265e-05, 'weight_decay': 1.32468623391763e-05, 'epochs': 137, 'loss': 'mse', 'optimizer': 'adam', 'graph_mode': 'knn', 'source': 'grm', 'knn_k': 5, 'weighted_edges': True, 'symmetrize_mode': 'union', 'use_snp_selection': False}. Best is trial 15 with value: 0.06634918723526631.
[I 2025-11-03 12:03:40,108] Trial 33 finished with value: 0.07432236831946168 and parameters: {'model_type': 'graphsage', 'hidden_dims': '[256, 128]', 'dropout': 0.4036223956382286, 'batch_norm': True, 'lr': 2.7750992753756734e-05, 'weight_decay': 4.3154253069997494e-05, 'epochs': 105, 'loss': 'mse', 'optimizer': 'adam', 'graph_mode': 'knn', 'source': 'grm', 'knn_k': 6, 'weighted_edges': True, 'symmetrize_mode': 'union', 'use_snp_selection': False}. Best is trial 33 with value: 0.07432236831946168.
[I 2025-11-03 12:03:42,460] Trial 34 finished with value: 0.05907087762432506 and parameters: {'model_type': 'graphsage', 'hidden_dims': '[256, 128]', 'dropout': 0.39695126411855886, 'batch_norm': True, 'lr': 1.8721320338433313e-05, 'weight_decay': 0.00010823473242885943, 'epochs': 112, 'loss': 'mse', 'optimizer': 'adam', 'graph_mode': 'knn', 'source': 'grm', 'knn_k': 8, 'weighted_edges': True, 'symmetrize_mode': 'union', 'use_snp_selection': False}. Best is trial 33 with value: 0.07432236831946168.
[I 2025-11-03 12:03:44,615] Trial 35 finished with value: 0.0779451337096595 and parameters: {'model_type': 'graphsage', 'hidden_dims': '[256, 128]', 'dropout': 0.5243996819536548, 'batch_norm': True, 'lr': 3.162550052286626e-05, 'weight_decay': 3.3347851805072515e-06, 'epochs': 80, 'loss': 'mse', 'optimizer': 'adam', 'graph_mode': 'knn', 'source': 'grm', 'knn_k': 9, 'weighted_edges': True, 'symmetrize_mode': 'union', 'use_snp_selection': False}. Best is trial 35 with value: 0.0779451337096595.
[I 2025-11-03 12:03:46,569] Trial 36 finished with value: 0.04203820267910105 and parameters: {'model_type': 'graphsage', 'hidden_dims': '[256, 128]', 'dropout': 0.37182803890067795, 'batch_norm': True, 'lr': 3.1040556663333065e-05, 'weight_decay': 2.156376171571648e-06, 'epochs': 70, 'loss': 'mse', 'optimizer': 'adam', 'graph_mode': 'knn', 'source': 'grm', 'knn_k': 4, 'weighted_edges': True, 'symmetrize_mode': 'union', 'use_snp_selection': False}. Best is trial 35 with value: 0.0779451337096595.
[I 2025-11-03 12:03:48,587] Trial 37 finished with value: -0.019729227667271303 and parameters: {'model_type': 'graphsage', 'hidden_dims': '[256, 128]', 'dropout': 0.33261866851866095, 'batch_norm': True, 'lr': 7.606204659099371e-06, 'weight_decay': 9.94174130100213e-07, 'epochs': 58, 'loss': 'mse', 'optimizer': 'adam', 'graph_mode': 'knn', 'source': 'grm', 'knn_k': 10, 'weighted_edges': True, 'symmetrize_mode': 'union', 'use_snp_selection': False}. Best is trial 35 with value: 0.0779451337096595.
[I 2025-11-03 12:03:50,626] Trial 38 finished with value: 0.03246352806628369 and parameters: {'model_type': 'graphsage', 'hidden_dims': '[256, 128]', 'dropout': 0.5356890193109058, 'batch_norm': True, 'lr': 1.4122283761150903e-05, 'weight_decay': 1.7747837317475075e-05, 'epochs': 78, 'loss': 'mse', 'optimizer': 'adam', 'graph_mode': 'knn', 'source': 'grm', 'knn_k': 9, 'weighted_edges': True, 'symmetrize_mode': 'mutual', 'use_snp_selection': False}. Best is trial 35 with value: 0.0779451337096595.
[I 2025-11-03 12:03:52,922] Trial 39 finished with value: 0.041596129317956004 and parameters: {'model_type': 'graphsage', 'hidden_dims': '[256, 128]', 'dropout': 0.5747355860484427, 'batch_norm': True, 'lr': 2.357195384319428e-05, 'weight_decay': 4.067274679465231e-07, 'epochs': 100, 'loss': 'mae', 'optimizer': 'adam', 'graph_mode': 'knn', 'source': 'grm', 'knn_k': 9, 'weighted_edges': False, 'symmetrize_mode': 'union', 'use_snp_selection': False}. Best is trial 35 with value: 0.0779451337096595.
[I 2025-11-03 12:03:54,593] Trial 40 finished with value: 0.020849778124397356 and parameters: {'model_type': 'graphsage', 'hidden_dims': '[256, 128]', 'dropout': 0.424914682623007, 'batch_norm': True, 'lr': 3.863881875787212e-05, 'weight_decay': 7.165979416469214e-05, 'epochs': 41, 'loss': 'mse', 'optimizer': 'adam', 'graph_mode': 'cutoff', 'cutoff': 0.8822241721039532, 'grm_norm': 'cosine', 'self_loops': True, 'use_snp_selection': False}. Best is trial 35 with value: 0.0779451337096595.
[I 2025-11-03 12:03:56,431] Trial 41 finished with value: 0.012757186539366713 and parameters: {'model_type': 'graphsage', 'hidden_dims': '[128, 64]', 'dropout': 0.4906636235675737, 'batch_norm': True, 'lr': 8.385148986534482e-05, 'weight_decay': 7.836946092283073e-06, 'epochs': 116, 'loss': 'mse', 'optimizer': 'adam', 'graph_mode': 'knn', 'source': 'grm', 'knn_k': 7, 'weighted_edges': True, 'symmetrize_mode': 'union', 'use_snp_selection': False}. Best is trial 35 with value: 0.0779451337096595.
[I 2025-11-03 12:04:00,360] Trial 42 finished with value: 0.04753929892031293 and parameters: {'model_type': 'graphsage', 'hidden_dims': '[512, 256]', 'dropout': 0.5253550613420648, 'batch_norm': True, 'lr': 0.00017939547565105945, 'weight_decay': 3.6562458178240766e-06, 'epochs': 161, 'loss': 'mse', 'optimizer': 'adam', 'graph_mode': 'knn', 'source': 'grm', 'knn_k': 8, 'weighted_edges': True, 'symmetrize_mode': 'union', 'use_snp_selection': False}. Best is trial 35 with value: 0.0779451337096595.
