[I 2025-11-13 21:31:36,886] Trial 71 finished with value: 0.2676391676749962 and parameters: {'model_type': 'graphsage', 'hidden_dims': '[128, 64]', 'dropout': 0.5659833393265904, 'batch_norm': True, 'lr': 0.0005232881109430606, 'weight_decay': 1.0384269442751076e-06, 'epochs': 54, 'loss': 'mse', 'optimizer': 'adam', 'graph_mode': 'cutoff', 'cutoff': 0.3550968940806129, 'grm_norm': 'none', 'self_loops': False, 'use_snp_selection': False}. Best is trial 61 with value: 0.28362455932970543.
[I 2025-11-13 21:32:08,298] Trial 72 finished with value: 0.2699878636143521 and parameters: {'model_type': 'graphsage', 'hidden_dims': '[128, 64]', 'dropout': 0.5274949326104525, 'batch_norm': True, 'lr': 0.0005752345193164953, 'weight_decay': 3.45372875000432e-07, 'epochs': 54, 'loss': 'mse', 'optimizer': 'adam', 'graph_mode': 'cutoff', 'cutoff': 0.35782627094343183, 'grm_norm': 'none', 'self_loops': False, 'use_snp_selection': False}. Best is trial 61 with value: 0.28362455932970543.
[I 2025-11-13 21:32:38,904] Trial 73 finished with value: 0.26064704298956815 and parameters: {'model_type': 'graphsage', 'hidden_dims': '[128, 64]', 'dropout': 0.562974680457946, 'batch_norm': True, 'lr': 0.0005621324622976199, 'weight_decay': 4.866157182663523e-07, 'epochs': 51, 'loss': 'mse', 'optimizer': 'adam', 'graph_mode': 'cutoff', 'cutoff': 0.35220612196093903, 'grm_norm': 'none', 'self_loops': False, 'use_snp_selection': False}. Best is trial 61 with value: 0.28362455932970543.
[I 2025-11-13 21:33:14,975] Trial 74 finished with value: 0.2588324764229534 and parameters: {'model_type': 'graphsage', 'hidden_dims': '[128, 64]', 'dropout': 0.5828056353378389, 'batch_norm': True, 'lr': 0.0007899329055334942, 'weight_decay': 3.5014003562232003e-07, 'epochs': 72, 'loss': 'mse', 'optimizer': 'adam', 'graph_mode': 'cutoff', 'cutoff': 0.40633841107285, 'grm_norm': 'none', 'self_loops': False, 'use_snp_selection': False}. Best is trial 61 with value: 0.28362455932970543.
[I 2025-11-13 21:33:50,944] Trial 75 finished with value: 0.2677802890858095 and parameters: {'model_type': 'graphsage', 'hidden_dims': '[128, 64]', 'dropout': 0.5995469196219891, 'batch_norm': True, 'lr': 0.0006471745245097895, 'weight_decay': 1.9349709230647404e-07, 'epochs': 58, 'loss': 'mse', 'optimizer': 'adam', 'graph_mode': 'cutoff', 'cutoff': 0.3085498991299649, 'grm_norm': 'none', 'self_loops': False, 'use_snp_selection': False}. Best is trial 61 with value: 0.28362455932970543.
[I 2025-11-13 21:34:50,594] Trial 76 finished with value: 0.2724140553872478 and parameters: {'model_type': 'graphsage', 'hidden_dims': '[128, 64]', 'dropout': 0.5976433550295067, 'batch_norm': True, 'lr': 0.0009844907686459678, 'weight_decay': 1.8037428913660644e-07, 'epochs': 64, 'loss': 'mse', 'optimizer': 'adam', 'graph_mode': 'cutoff', 'cutoff': 0.22852992154569152, 'grm_norm': 'none', 'self_loops': False, 'use_snp_selection': False}. Best is trial 61 with value: 0.28362455932970543.
[I 2025-11-13 21:35:46,346] Trial 77 finished with value: 0.2518161500019831 and parameters: {'model_type': 'graphsage', 'hidden_dims': '[128, 64]', 'dropout': 0.5210052121795951, 'batch_norm': True, 'lr': 0.0009270963289439699, 'weight_decay': 1.1125973173924109e-07, 'epochs': 65, 'loss': 'mse', 'optimizer': 'adam', 'graph_mode': 'cutoff', 'cutoff': 0.24266595129343793, 'grm_norm': 'none', 'self_loops': False, 'use_snp_selection': False}. Best is trial 61 with value: 0.28362455932970543.
[I 2025-11-13 21:37:28,655] Trial 78 finished with value: 0.14699016431322728 and parameters: {'model_type': 'graphsage', 'hidden_dims': '[128, 64]', 'dropout': 0.5532724835571174, 'batch_norm': True, 'lr': 3.575908676146856e-06, 'weight_decay': 1.9093249619647586e-07, 'epochs': 112, 'loss': 'mse', 'optimizer': 'adam', 'graph_mode': 'cutoff', 'cutoff': 0.21560434703907808, 'grm_norm': 'none', 'self_loops': False, 'use_snp_selection': False}. Best is trial 61 with value: 0.28362455932970543.
[I 2025-11-13 21:38:52,992] Trial 79 finished with value: 0.23146531841596807 and parameters: {'model_type': 'graphsage', 'hidden_dims': '[128, 64]', 'dropout': 0.4987935916754728, 'batch_norm': True, 'lr': 0.0002987012011099817, 'weight_decay': 1.3425778922373153e-06, 'epochs': 100, 'loss': 'mse', 'optimizer': 'adam', 'graph_mode': 'knn', 'source': 'grm', 'knn_k': 8, 'weighted_edges': True, 'symmetrize_mode': 'union', 'use_snp_selection': False}. Best is trial 61 with value: 0.28362455932970543.
[I 2025-11-13 21:39:42,351] Trial 80 finished with value: 0.26826806485993665 and parameters: {'model_type': 'graphsage', 'hidden_dims': '[128, 64]', 'dropout': 0.5422883949810906, 'batch_norm': True, 'lr': 0.0009921091552245857, 'weight_decay': 5.398889526498227e-07, 'epochs': 77, 'loss': 'mse', 'optimizer': 'adam', 'graph_mode': 'cutoff', 'cutoff': 0.2743728665701895, 'grm_norm': 'none', 'self_loops': False, 'use_snp_selection': False}. Best is trial 61 with value: 0.28362455932970543.
[I 2025-11-13 21:40:31,560] Trial 81 finished with value: 0.2635278692925362 and parameters: {'model_type': 'graphsage', 'hidden_dims': '[128, 64]', 'dropout': 0.5867100871853325, 'batch_norm': True, 'lr': 0.0007252759455953548, 'weight_decay': 3.563108312140406e-07, 'epochs': 77, 'loss': 'mse', 'optimizer': 'adam', 'graph_mode': 'cutoff', 'cutoff': 0.2751603318503429, 'grm_norm': 'none', 'self_loops': False, 'use_snp_selection': False}. Best is trial 61 with value: 0.28362455932970543.
[I 2025-11-13 21:42:02,776] Trial 82 finished with value: 0.24916845992390843 and parameters: {'model_type': 'graphsage', 'hidden_dims': '[128, 64]', 'dropout': 0.543250384719665, 'batch_norm': True, 'lr': 0.000897409952393501, 'weight_decay': 5.820237920667493e-07, 'epochs': 90, 'loss': 'mse', 'optimizer': 'adam', 'graph_mode': 'cutoff', 'cutoff': 0.20119144185612073, 'grm_norm': 'none', 'self_loops': False, 'use_snp_selection': False}. Best is trial 61 with value: 0.28362455932970543.
[I 2025-11-13 21:42:35,775] Trial 83 finished with value: 0.25297105826426136 and parameters: {'model_type': 'graphsage', 'hidden_dims': '[128, 64]', 'dropout': 0.5694529386406737, 'batch_norm': True, 'lr': 0.000992683519008631, 'weight_decay': 1.504847679497579e-07, 'epochs': 47, 'loss': 'mse', 'optimizer': 'adam', 'graph_mode': 'cutoff', 'cutoff': 0.29407087831799783, 'grm_norm': 'none', 'self_loops': False, 'use_snp_selection': False}. Best is trial 61 with value: 0.28362455932970543.
[I 2025-11-13 21:43:33,400] Trial 84 finished with value: 0.24846296880295887 and parameters: {'model_type': 'graphsage', 'hidden_dims': '[128, 64]', 'dropout': 0.5180708863148008, 'batch_norm': True, 'lr': 0.000687968933890837, 'weight_decay': 2.9734565519530416e-07, 'epochs': 64, 'loss': 'mse', 'optimizer': 'adam', 'graph_mode': 'cutoff', 'cutoff': 0.23357264894945623, 'grm_norm': 'cosine_then_gcn', 'self_loops': False, 'use_snp_selection': False}. Best is trial 61 with value: 0.28362455932970543.
[I 2025-11-13 21:44:29,537] Trial 85 finished with value: 0.26586212442182583 and parameters: {'model_type': 'graphsage', 'hidden_dims': '[256, 128, 64]', 'dropout': 0.5524736945838802, 'batch_norm': True, 'lr': 0.00048545075882257824, 'weight_decay': 2.4846912169093255e-07, 'epochs': 79, 'loss': 'mse', 'optimizer': 'adam', 'graph_mode': 'cutoff', 'cutoff': 0.3252645031859887, 'grm_norm': 'none', 'self_loops': False, 'use_snp_selection': False}. Best is trial 61 with value: 0.28362455932970543.
[I 2025-11-13 21:46:24,696] Trial 86 finished with value: 0.25583585289515376 and parameters: {'model_type': 'graphsage', 'hidden_dims': '[512, 64]', 'dropout': 0.5865912592604278, 'batch_norm': True, 'lr': 0.0003567042669371953, 'weight_decay': 4.0031924415612023e-07, 'epochs': 102, 'loss': 'mse', 'optimizer': 'adam', 'graph_mode': 'cutoff', 'cutoff': 0.25996607464710403, 'grm_norm': 'none', 'self_loops': False, 'use_snp_selection': False}. Best is trial 61 with value: 0.28362455932970543.
[I 2025-11-13 21:47:00,954] Trial 87 finished with value: 0.2639970155900774 and parameters: {'model_type': 'graphsage', 'hidden_dims': '[128, 64]', 'dropout': 0.5379469166934809, 'batch_norm': True, 'lr': 0.0006023742151288369, 'weight_decay': 5.058622853765057e-07, 'epochs': 69, 'loss': 'mse', 'optimizer': 'adam', 'graph_mode': 'cutoff', 'cutoff': 0.3989717360545439, 'grm_norm': 'cosine_then_gcn', 'self_loops': False, 'use_snp_selection': False}. Best is trial 61 with value: 0.28362455932970543.
[I 2025-11-13 21:47:46,445] Trial 88 finished with value: 0.2582497192766302 and parameters: {'model_type': 'graphsage', 'hidden_dims': '[128, 64]', 'dropout': 0.4968858286149468, 'batch_norm': True, 'lr': 0.0007809807649113258, 'weight_decay': 8.458219708488946e-07, 'epochs': 93, 'loss': 'mse', 'optimizer': 'adam', 'graph_mode': 'cutoff', 'cutoff': 0.342438398816565, 'grm_norm': 'none', 'self_loops': False, 'use_snp_selection': False}. Best is trial 61 with value: 0.28362455932970543.
[I 2025-11-13 21:49:32,362] Trial 89 finished with value: 0.24180287594696132 and parameters: {'model_type': 'graphsage', 'hidden_dims': '[128, 64]', 'dropout': 0.5672100058773496, 'batch_norm': True, 'lr': 0.0004538705669565621, 'weight_decay': 4.541556546323123e-06, 'epochs': 119, 'loss': 'mse', 'optimizer': 'adam', 'graph_mode': 'knn', 'source': 'grm', 'knn_k': 9, 'weighted_edges': True, 'symmetrize_mode': 'union', 'use_snp_selection': False}. Best is trial 61 with value: 0.28362455932970543.
[I 2025-11-13 21:50:12,807] Trial 90 finished with value: 0.2696867902242749 and parameters: {'model_type': 'graphsage', 'hidden_dims': '[128, 64]', 'dropout': 0.5567665691120485, 'batch_norm': True, 'lr': 0.0005635507257995307, 'weight_decay': 1.9044814770646925e-07, 'epochs': 82, 'loss': 'mse', 'optimizer': 'adam', 'graph_mode': 'cutoff', 'cutoff': 0.3652859419352048, 'grm_norm': 'none', 'self_loops': False, 'use_snp_selection': False}. Best is trial 61 with value: 0.28362455932970543.
[I 2025-11-13 21:50:56,626] Trial 91 finished with value: 0.2660158492748777 and parameters: {'model_type': 'graphsage', 'hidden_dims': '[128, 64]', 'dropout': 0.5770230299812007, 'batch_norm': True, 'lr': 0.000584184794509066, 'weight_decay': 1.7476374593377726e-07, 'epochs': 84, 'loss': 'mse', 'optimizer': 'adam', 'graph_mode': 'cutoff', 'cutoff': 0.3269235434198455, 'grm_norm': 'none', 'self_loops': False, 'use_snp_selection': False}. Best is trial 61 with value: 0.28362455932970543.
[I 2025-11-13 21:51:30,136] Trial 92 finished with value: 0.269678779814494 and parameters: {'model_type': 'graphsage', 'hidden_dims': '[128, 64]', 'dropout': 0.5556808076467038, 'batch_norm': True, 'lr': 0.0007044559038091148, 'weight_decay': 2.687356709542672e-06, 'epochs': 62, 'loss': 'mse', 'optimizer': 'adam', 'graph_mode': 'cutoff', 'cutoff': 0.37011983407706317, 'grm_norm': 'none', 'self_loops': False, 'use_snp_selection': False}. Best is trial 61 with value: 0.28362455932970543.
[I 2025-11-13 21:52:03,448] Trial 93 finished with value: 0.25832278042000123 and parameters: {'model_type': 'graphsage', 'hidden_dims': '[128, 64]', 'dropout': 0.5593032437545337, 'batch_norm': True, 'lr': 0.00035317517038974003, 'weight_decay': 2.8682615590244044e-06, 'epochs': 62, 'loss': 'mse', 'optimizer': 'adam', 'graph_mode': 'cutoff', 'cutoff': 0.37416633711251923, 'grm_norm': 'none', 'self_loops': False, 'use_snp_selection': False}. Best is trial 61 with value: 0.28362455932970543.
[I 2025-11-13 21:52:30,290] Trial 94 finished with value: 0.26167989095732275 and parameters: {'model_type': 'graphsage', 'hidden_dims': '[128, 64]', 'dropout': 0.5907278088226422, 'batch_norm': True, 'lr': 0.0002660870517569686, 'weight_decay': 1.8778859037912364e-06, 'epochs': 45, 'loss': 'mse', 'optimizer': 'adam', 'graph_mode': 'cutoff', 'cutoff': 0.43889537674416307, 'grm_norm': 'none', 'self_loops': False, 'use_snp_selection': False}. Best is trial 61 with value: 0.28362455932970543.
[I 2025-11-13 21:53:01,777] Trial 95 finished with value: 0.25787952444953766 and parameters: {'model_type': 'graphsage', 'hidden_dims': '[128, 64]', 'dropout': 0.27714993431758145, 'batch_norm': True, 'lr': 0.0006843462642424925, 'weight_decay': 1.2044818009360538e-07, 'epochs': 53, 'loss': 'mse', 'optimizer': 'adam', 'graph_mode': 'cutoff', 'cutoff': 0.36819713904235685, 'grm_norm': 'cosine_then_gcn', 'self_loops': False, 'use_snp_selection': False}. Best is trial 61 with value: 0.28362455932970543.
[I 2025-11-13 21:53:50,447] Trial 96 finished with value: 0.26427097148035444 and parameters: {'model_type': 'graphsage', 'hidden_dims': '[256, 128, 64]', 'dropout': 0.5236340601442608, 'batch_norm': True, 'lr': 0.0004890798183867127, 'weight_decay': 4.273439056970439e-06, 'epochs': 72, 'loss': 'mse', 'optimizer': 'adam', 'graph_mode': 'cutoff', 'cutoff': 0.4123317838450101, 'grm_norm': 'none', 'self_loops': False, 'use_snp_selection': False}. Best is trial 61 with value: 0.28362455932970543.
[I 2025-11-13 21:54:48,425] Trial 97 finished with value: 0.27300945202830296 and parameters: {'model_type': 'graphsage', 'hidden_dims': '[128, 64]', 'dropout': 0.5773227744360957, 'batch_norm': True, 'lr': 0.0003987111351793354, 'weight_decay': 2.27331498516591e-07, 'epochs': 139, 'loss': 'mse', 'optimizer': 'adam', 'graph_mode': 'cutoff', 'cutoff': 0.38839659523164627, 'grm_norm': 'none', 'self_loops': False, 'use_snp_selection': False}. Best is trial 61 with value: 0.28362455932970543.
[I 2025-11-13 21:56:25,126] Trial 98 finished with value: 0.26691067361292053 and parameters: {'model_type': 'graphsage', 'hidden_dims': '[512, 64]', 'dropout': 0.5326406859798959, 'batch_norm': True, 'lr': 0.0003784097024518987, 'weight_decay': 2.328781761859432e-06, 'epochs': 102, 'loss': 'mse', 'optimizer': 'adam', 'graph_mode': 'cutoff', 'cutoff': 0.39254375007426684, 'grm_norm': 'cosine_then_gcn', 'self_loops': False, 'use_snp_selection': False}. Best is trial 61 with value: 0.28362455932970543.
[I 2025-11-13 21:57:41,046] Trial 99 finished with value: 0.27318233824322447 and parameters: {'model_type': 'graphsage', 'hidden_dims': '[256, 128]', 'dropout': 0.5711964081007621, 'batch_norm': True, 'lr': 0.0008398158655442915, 'weight_decay': 2.1035477865783935e-07, 'epochs': 134, 'loss': 'mse', 'optimizer': 'adam', 'graph_mode': 'cutoff', 'cutoff': 0.44745961407464163, 'grm_norm': 'none', 'self_loops': False, 'use_snp_selection': False}. Best is trial 61 with value: 0.28362455932970543.
[I 2025-11-13 21:59:06,253] Trial 100 finished with value: 0.27329505204324733 and parameters: {'model_type': 'graphsage', 'hidden_dims': '[256, 128]', 'dropout': 0.5747062786761182, 'batch_norm': True, 'lr': 0.00023755905052724488, 'weight_decay': 2.2066010181030932e-07, 'epochs': 153, 'loss': 'mse', 'optimizer': 'adam', 'graph_mode': 'cutoff', 'cutoff': 0.4318750853346155, 'grm_norm': 'none', 'self_loops': False, 'use_snp_selection': False}. Best is trial 61 with value: 0.28362455932970543.
[I 2025-11-13 22:00:25,426] Trial 101 finished with value: 0.2683610288298438 and parameters: {'model_type': 'graphsage', 'hidden_dims': '[256, 128]', 'dropout': 0.5741120621366002, 'batch_norm': True, 'lr': 0.0003079742378874753, 'weight_decay': 2.248793752662887e-07, 'epochs': 142, 'loss': 'mse', 'optimizer': 'adam', 'graph_mode': 'cutoff', 'cutoff': 0.45729107482360976, 'grm_norm': 'none', 'self_loops': False, 'use_snp_selection': False}. Best is trial 61 with value: 0.28362455932970543.
[I 2025-11-13 22:02:01,750] Trial 102 finished with value: 0.26729519574612537 and parameters: {'model_type': 'graphsage', 'hidden_dims': '[256, 128]', 'dropout': 0.33444076315632876, 'batch_norm': True, 'lr': 0.0004092469182098284, 'weight_decay': 1.6683161818306593e-07, 'epochs': 177, 'loss': 'mse', 'optimizer': 'adam', 'graph_mode': 'cutoff', 'cutoff': 0.4279512266337939, 'grm_norm': 'none', 'self_loops': False, 'use_snp_selection': False}. Best is trial 61 with value: 0.28362455932970543.
[I 2025-11-13 22:03:27,377] Trial 103 finished with value: 0.26157714942850807 and parameters: {'model_type': 'graphsage', 'hidden_dims': '[256, 128]', 'dropout': 0.5844320536849728, 'batch_norm': True, 'lr': 0.0005578611392501675, 'weight_decay': 2.2400284576312398e-07, 'epochs': 150, 'loss': 'mse', 'optimizer': 'adam', 'graph_mode': 'cutoff', 'cutoff': 0.3881532847146336, 'grm_norm': 'none', 'self_loops': False, 'use_snp_selection': False}. Best is trial 61 with value: 0.28362455932970543.
[I 2025-11-13 22:04:35,744] Trial 104 finished with value: 0.25759694671182604 and parameters: {'model_type': 'graphsage', 'hidden_dims': '[256, 128]', 'dropout': 0.5625685551812455, 'batch_norm': True, 'lr': 0.00022702574665714378, 'weight_decay': 1.2361010022462295e-07, 'epochs': 133, 'loss': 'mse', 'optimizer': 'adam', 'graph_mode': 'cutoff', 'cutoff': 0.5035784153654033, 'grm_norm': 'none', 'self_loops': False, 'use_snp_selection': False}. Best is trial 61 with value: 0.28362455932970543.
[I 2025-11-13 22:05:52,353] Trial 105 finished with value: 0.26755438140665755 and parameters: {'model_type': 'graphsage', 'hidden_dims': '[256, 128]', 'dropout': 0.5709388999896995, 'batch_norm': True, 'lr': 0.0007550571193084422, 'weight_decay': 3.252059069262043e-06, 'epochs': 133, 'loss': 'mse', 'optimizer': 'adam', 'graph_mode': 'cutoff', 'cutoff': 0.4442032584221008, 'grm_norm': 'cosine_then_gcn', 'self_loops': False, 'use_snp_selection': False}. Best is trial 61 with value: 0.28362455932970543.
[I 2025-11-13 22:07:25,028] Trial 106 finished with value: 0.2695587411479123 and parameters: {'model_type': 'graphsage', 'hidden_dims': '[256, 128]', 'dropout': 0.5906054160838873, 'batch_norm': True, 'lr': 0.0006454977146021964, 'weight_decay': 2.0818719131231072e-07, 'epochs': 168, 'loss': 'mse', 'optimizer': 'adam', 'graph_mode': 'cutoff', 'cutoff': 0.41598738105842825, 'grm_norm': 'none', 'self_loops': False, 'use_snp_selection': False}. Best is trial 61 with value: 0.28362455932970543.
[I 2025-11-13 22:08:43,135] Trial 107 finished with value: 0.25818995969637715 and parameters: {'model_type': 'graphsage', 'hidden_dims': '[256, 128]', 'dropout': 0.5451252194159504, 'batch_norm': True, 'lr': 0.0008384816731285223, 'weight_decay': 6.271696385943998e-06, 'epochs': 184, 'loss': 'mae', 'optimizer': 'adam', 'graph_mode': 'cutoff', 'cutoff': 0.8958430820886536, 'grm_norm': 'none', 'self_loops': False, 'use_snp_selection': False}. Best is trial 61 with value: 0.28362455932970543.
[I 2025-11-13 22:10:40,581] Trial 108 finished with value: 0.2456899635681562 and parameters: {'model_type': 'graphsage', 'hidden_dims': '[256, 128]', 'dropout': 0.4131677060853945, 'batch_norm': True, 'lr': 0.000178245814899185, 'weight_decay': 1.0306707859875679e-07, 'epochs': 157, 'loss': 'mse', 'optimizer': 'adam', 'graph_mode': 'knn', 'source': 'grm', 'knn_k': 6, 'weighted_edges': True, 'symmetrize_mode': 'union', 'use_snp_selection': False}. Best is trial 61 with value: 0.28362455932970543.
[I 2025-11-13 22:11:24,786] Trial 109 finished with value: 0.15017888824446685 and parameters: {'model_type': 'graphsage', 'hidden_dims': '[128, 64]', 'dropout': 0.5792297006531733, 'batch_norm': True, 'lr': 1.0950950018417724e-05, 'weight_decay': 1.4808133353336895e-07, 'epochs': 41, 'loss': 'mse', 'optimizer': 'adam', 'graph_mode': 'cutoff', 'cutoff': 0.3809688333755141, 'grm_norm': 'none', 'self_loops': False, 'use_snp_selection': True, 'num_snps': 5012}. Best is trial 61 with value: 0.28362455932970543.
[I 2025-11-13 22:12:20,230] Trial 110 finished with value: 0.11411716953132504 and parameters: {'model_type': 'graphsage', 'hidden_dims': '[128, 64]', 'dropout': 0.5528581009522688, 'batch_norm': False, 'lr': 0.00012224011542665884, 'weight_decay': 3.1110360288099787e-07, 'epochs': 127, 'loss': 'mse', 'optimizer': 'adam', 'graph_mode': 'cutoff', 'cutoff': 0.36062354788755935, 'grm_norm': 'cosine_then_gcn', 'self_loops': False, 'use_snp_selection': False}. Best is trial 61 with value: 0.28362455932970543.
[I 2025-11-13 22:13:51,918] Trial 111 finished with value: 0.2701981234887648 and parameters: {'model_type': 'graphsage', 'hidden_dims': '[256, 128]', 'dropout': 0.5915273973259535, 'batch_norm': True, 'lr': 0.0006201661937939863, 'weight_decay': 2.023530139047062e-07, 'epochs': 167, 'loss': 'mse', 'optimizer': 'adam', 'graph_mode': 'cutoff', 'cutoff': 0.42121574728786443, 'grm_norm': 'none', 'self_loops': False, 'use_snp_selection': False}. Best is trial 61 with value: 0.28362455932970543.
[I 2025-11-13 22:15:07,794] Trial 112 finished with value: 0.2690589256308036 and parameters: {'model_type': 'graphsage', 'hidden_dims': '[256, 128]', 'dropout': 0.5925290733136981, 'batch_norm': True, 'lr': 0.0005266126889781307, 'weight_decay': 2.3453516394297892e-07, 'epochs': 142, 'loss': 'mse', 'optimizer': 'adam', 'graph_mode': 'cutoff', 'cutoff': 0.49034132200731684, 'grm_norm': 'none', 'self_loops': False, 'use_snp_selection': False}. Best is trial 61 with value: 0.28362455932970543.
[I 2025-11-13 22:16:37,206] Trial 113 finished with value: 0.2607130393665689 and parameters: {'model_type': 'graphsage', 'hidden_dims': '[256, 128]', 'dropout': 0.5345870049945625, 'batch_norm': True, 'lr': 0.00041304590341851064, 'weight_decay': 1.7515718217955736e-07, 'epochs': 162, 'loss': 'mse', 'optimizer': 'adam', 'graph_mode': 'cutoff', 'cutoff': 0.4279324647951387, 'grm_norm': 'none', 'self_loops': False, 'use_snp_selection': False}. Best is trial 61 with value: 0.28362455932970543.
[I 2025-11-13 22:18:05,101] Trial 114 finished with value: 0.25588229754942426 and parameters: {'model_type': 'graphsage', 'hidden_dims': '[256, 128]', 'dropout': 0.5687312474718987, 'batch_norm': True, 'lr': 0.0007389054893894386, 'weight_decay': 2.7829328592452316e-07, 'epochs': 157, 'loss': 'mse', 'optimizer': 'adam', 'graph_mode': 'cutoff', 'cutoff': 0.408223790523803, 'grm_norm': 'none', 'self_loops': False, 'use_snp_selection': False}. Best is trial 61 with value: 0.28362455932970543.
