[I 2025-11-03 12:38:27,271] Trial 99 finished with value: 0.07872221435374077 and parameters: {'model_type': 'gcn', 'hidden_dims': '[512, 256]', 'dropout': 0.38977328589284577, 'batch_norm': True, 'lr': 0.0008558368023302767, 'weight_decay': 0.00010274087903636796, 'epochs': 320, 'loss': 'mae', 'optimizer': 'adam', 'graph_mode': 'knn', 'source': 'grm', 'knn_k': 5, 'weighted_edges': True, 'symmetrize_mode': 'mutual', 'use_snp_selection': False}. Best is trial 55 with value: 0.09212367301916334.
[I 2025-11-03 12:38:30,312] Trial 100 finished with value: 0.0663861758377838 and parameters: {'model_type': 'gcn', 'hidden_dims': '[512, 256]', 'dropout': 0.3182497020395686, 'batch_norm': True, 'lr': 0.0005425472290455315, 'weight_decay': 9.223986885364133e-06, 'epochs': 277, 'loss': 'mae', 'optimizer': 'adam', 'graph_mode': 'knn', 'source': 'grm', 'knn_k': 6, 'weighted_edges': True, 'symmetrize_mode': 'mutual', 'use_snp_selection': False}. Best is trial 55 with value: 0.09212367301916334.
[I 2025-11-03 12:38:33,382] Trial 101 finished with value: 0.05751866383775455 and parameters: {'model_type': 'gcn', 'hidden_dims': '[512, 256]', 'dropout': 0.3512857125163836, 'batch_norm': True, 'lr': 0.0003824405069649857, 'weight_decay': 1.2073712100443564e-05, 'epochs': 282, 'loss': 'mae', 'optimizer': 'adam', 'graph_mode': 'knn', 'source': 'grm', 'knn_k': 6, 'weighted_edges': True, 'symmetrize_mode': 'mutual', 'use_snp_selection': False}. Best is trial 55 with value: 0.09212367301916334.
[I 2025-11-03 12:38:36,490] Trial 102 finished with value: 0.06624931042924145 and parameters: {'model_type': 'gcn', 'hidden_dims': '[512, 256]', 'dropout': 0.36214192664145944, 'batch_norm': True, 'lr': 0.00044189098613993204, 'weight_decay': 1.2797111340573246e-05, 'epochs': 288, 'loss': 'mae', 'optimizer': 'adam', 'graph_mode': 'knn', 'source': 'grm', 'knn_k': 7, 'weighted_edges': True, 'symmetrize_mode': 'mutual', 'use_snp_selection': False}. Best is trial 55 with value: 0.09212367301916334.
[I 2025-11-03 12:38:39,834] Trial 103 finished with value: 0.07219265321476354 and parameters: {'model_type': 'gcn', 'hidden_dims': '[512, 256]', 'dropout': 0.3708904033592029, 'batch_norm': True, 'lr': 0.0007080064206150161, 'weight_decay': 1.7076873869241374e-05, 'epochs': 329, 'loss': 'mae', 'optimizer': 'adam', 'graph_mode': 'knn', 'source': 'grm', 'knn_k': 6, 'weighted_edges': True, 'symmetrize_mode': 'mutual', 'use_snp_selection': False}. Best is trial 55 with value: 0.09212367301916334.
[I 2025-11-03 12:38:42,980] Trial 104 finished with value: 0.07920569872751382 and parameters: {'model_type': 'gcn', 'hidden_dims': '[512, 256]', 'dropout': 0.28953371237766307, 'batch_norm': True, 'lr': 0.000455027830962948, 'weight_decay': 8.066831299486871e-06, 'epochs': 295, 'loss': 'mae', 'optimizer': 'adam', 'graph_mode': 'knn', 'source': 'grm', 'knn_k': 6, 'weighted_edges': True, 'symmetrize_mode': 'mutual', 'use_snp_selection': False}. Best is trial 55 with value: 0.09212367301916334.
[I 2025-11-03 12:38:45,892] Trial 105 finished with value: 0.08260375645661269 and parameters: {'model_type': 'gcn', 'hidden_dims': '[512, 256]', 'dropout': 0.41986195578754504, 'batch_norm': True, 'lr': 0.0008258539796710298, 'weight_decay': 4.626108325194481e-05, 'epochs': 256, 'loss': 'mae', 'optimizer': 'adam', 'graph_mode': 'knn', 'source': 'grm', 'knn_k': 5, 'weighted_edges': True, 'symmetrize_mode': 'mutual', 'use_snp_selection': False}. Best is trial 55 with value: 0.09212367301916334.
[I 2025-11-03 12:38:48,823] Trial 106 finished with value: 0.07726469404787174 and parameters: {'model_type': 'gcn', 'hidden_dims': '[512, 128]', 'dropout': 0.43277020963758533, 'batch_norm': True, 'lr': 0.0008640648265990315, 'weight_decay': 4.588497234227637e-05, 'epochs': 260, 'loss': 'mae', 'optimizer': 'adam', 'graph_mode': 'knn', 'source': 'grm', 'knn_k': 5, 'weighted_edges': True, 'symmetrize_mode': 'mutual', 'use_snp_selection': False}. Best is trial 55 with value: 0.09212367301916334.
[I 2025-11-03 12:38:51,713] Trial 107 finished with value: 0.08551248889883999 and parameters: {'model_type': 'gcn', 'hidden_dims': '[512, 256]', 'dropout': 0.2711664688184748, 'batch_norm': True, 'lr': 0.0007159520511450509, 'weight_decay': 8.218309572188484e-05, 'epochs': 252, 'loss': 'mae', 'optimizer': 'adam', 'graph_mode': 'knn', 'source': 'grm', 'knn_k': 4, 'weighted_edges': True, 'symmetrize_mode': 'union', 'use_snp_selection': False}. Best is trial 55 with value: 0.09212367301916334.
[I 2025-11-03 12:38:54,711] Trial 108 finished with value: 0.0415210889655147 and parameters: {'model_type': 'gcn', 'hidden_dims': '[512, 256]', 'dropout': 0.41050718864060326, 'batch_norm': True, 'lr': 0.0006425527628220125, 'weight_decay': 0.00013946088302567382, 'epochs': 271, 'loss': 'mae', 'optimizer': 'adam', 'graph_mode': 'knn', 'source': 'grm', 'knn_k': 4, 'weighted_edges': False, 'symmetrize_mode': 'union', 'use_snp_selection': False}. Best is trial 55 with value: 0.09212367301916334.
[I 2025-11-03 12:38:57,526] Trial 109 finished with value: 0.06471582311172991 and parameters: {'model_type': 'gcn', 'hidden_dims': '[512, 64]', 'dropout': 0.10246132341805703, 'batch_norm': True, 'lr': 9.62695718375305e-05, 'weight_decay': 8.830020562086973e-05, 'epochs': 241, 'loss': 'mae', 'optimizer': 'adam', 'graph_mode': 'knn', 'source': 'grm', 'knn_k': 3, 'weighted_edges': True, 'symmetrize_mode': 'union', 'use_snp_selection': False}. Best is trial 55 with value: 0.09212367301916334.
[I 2025-11-03 12:39:00,426] Trial 110 finished with value: 0.0644744799015965 and parameters: {'model_type': 'gcn', 'hidden_dims': '[512, 256]', 'dropout': 0.32487275386955644, 'batch_norm': True, 'lr': 0.0009923296196652127, 'weight_decay': 5.671963905811707e-05, 'epochs': 254, 'loss': 'mae', 'optimizer': 'adam', 'graph_mode': 'knn', 'source': 'grm', 'knn_k': 4, 'weighted_edges': True, 'symmetrize_mode': 'union', 'use_snp_selection': False}. Best is trial 55 with value: 0.09212367301916334.
[I 2025-11-03 12:39:03,847] Trial 111 finished with value: 0.08551324321617657 and parameters: {'model_type': 'gcn', 'hidden_dims': '[512, 256]', 'dropout': 0.27497616275290476, 'batch_norm': True, 'lr': 0.0007351765186176171, 'weight_decay': 3.504001669997256e-05, 'epochs': 342, 'loss': 'mae', 'optimizer': 'adam', 'graph_mode': 'knn', 'source': 'grm', 'knn_k': 5, 'weighted_edges': True, 'symmetrize_mode': 'union', 'use_snp_selection': False}. Best is trial 55 with value: 0.09212367301916334.
[I 2025-11-03 12:39:07,247] Trial 112 finished with value: 0.08377056287414181 and parameters: {'model_type': 'gcn', 'hidden_dims': '[512, 256]', 'dropout': 0.2735382098505144, 'batch_norm': True, 'lr': 2.6453998733429396e-05, 'weight_decay': 3.1633523100424136e-05, 'epochs': 339, 'loss': 'mae', 'optimizer': 'adam', 'graph_mode': 'knn', 'source': 'grm', 'knn_k': 5, 'weighted_edges': True, 'symmetrize_mode': 'union', 'use_snp_selection': False}. Best is trial 55 with value: 0.09212367301916334.
[I 2025-11-03 12:39:10,668] Trial 113 finished with value: 0.073340980324607 and parameters: {'model_type': 'gcn', 'hidden_dims': '[512, 256]', 'dropout': 0.27616604857175614, 'batch_norm': True, 'lr': 2.6332631666557522e-05, 'weight_decay': 3.2183499348142114e-05, 'epochs': 342, 'loss': 'mae', 'optimizer': 'adam', 'graph_mode': 'knn', 'source': 'grm', 'knn_k': 5, 'weighted_edges': True, 'symmetrize_mode': 'union', 'use_snp_selection': False}. Best is trial 55 with value: 0.09212367301916334.
[I 2025-11-03 12:39:14,018] Trial 114 finished with value: 0.04148165333597245 and parameters: {'model_type': 'gcn', 'hidden_dims': '[512, 256]', 'dropout': 0.2489351673181751, 'batch_norm': True, 'lr': 2.1826185286109207e-05, 'weight_decay': 7.577638975585137e-05, 'epochs': 330, 'loss': 'mae', 'optimizer': 'adam', 'graph_mode': 'knn', 'source': 'grm', 'knn_k': 5, 'weighted_edges': True, 'symmetrize_mode': 'union', 'use_snp_selection': False}. Best is trial 55 with value: 0.09212367301916334.
[I 2025-11-03 12:39:17,406] Trial 115 finished with value: 0.05433535154376946 and parameters: {'model_type': 'gcn', 'hidden_dims': '[512, 256]', 'dropout': 0.2262778802542325, 'batch_norm': True, 'lr': 3.2847917872948416e-05, 'weight_decay': 5.180824257521418e-05, 'epochs': 337, 'loss': 'mae', 'optimizer': 'adam', 'graph_mode': 'knn', 'source': 'grm', 'knn_k': 4, 'weighted_edges': True, 'symmetrize_mode': 'union', 'use_snp_selection': False}. Best is trial 55 with value: 0.09212367301916334.
[I 2025-11-03 12:39:20,869] Trial 116 finished with value: -0.0006480718531102029 and parameters: {'model_type': 'gcn', 'hidden_dims': '[512, 256]', 'dropout': 0.29521450185179815, 'batch_norm': True, 'lr': 1.0865205392263391e-05, 'weight_decay': 3.814591012974394e-05, 'epochs': 349, 'loss': 'mae', 'optimizer': 'adam', 'graph_mode': 'knn', 'source': 'grm', 'knn_k': 5, 'weighted_edges': True, 'symmetrize_mode': 'union', 'use_snp_selection': False}. Best is trial 55 with value: 0.09212367301916334.
[I 2025-11-03 12:39:23,280] Trial 117 finished with value: 0.04106662162306881 and parameters: {'model_type': 'gcn', 'hidden_dims': '[256, 128, 64]', 'dropout': 0.2584762008646319, 'batch_norm': True, 'lr': 6.790980403852806e-05, 'weight_decay': 0.00017787618740772022, 'epochs': 237, 'loss': 'mae', 'optimizer': 'adam', 'graph_mode': 'knn', 'source': 'grm', 'knn_k': 6, 'weighted_edges': True, 'symmetrize_mode': 'union', 'use_snp_selection': False}. Best is trial 55 with value: 0.09212367301916334.
[I 2025-11-03 12:39:26,669] Trial 118 finished with value: 0.07648891705599241 and parameters: {'model_type': 'gcn', 'hidden_dims': '[512, 256]', 'dropout': 0.3100057647556747, 'batch_norm': True, 'lr': 0.0005569191750483791, 'weight_decay': 2.784551230799264e-05, 'epochs': 342, 'loss': 'mae', 'optimizer': 'adam', 'graph_mode': 'knn', 'source': 'grm', 'knn_k': 4, 'weighted_edges': True, 'symmetrize_mode': 'union', 'use_snp_selection': False}. Best is trial 55 with value: 0.09212367301916334.
[I 2025-11-03 12:39:28,793] Trial 119 finished with value: 0.025475440089947485 and parameters: {'model_type': 'gcn', 'hidden_dims': '[128, 64]', 'dropout': 0.28348232693710906, 'batch_norm': True, 'lr': 1.5218558074958035e-05, 'weight_decay': 4.878222603795461e-05, 'epochs': 318, 'loss': 'mae', 'optimizer': 'adam', 'graph_mode': 'knn', 'source': 'grm', 'knn_k': 3, 'weighted_edges': True, 'symmetrize_mode': 'union', 'use_snp_selection': False}. Best is trial 55 with value: 0.09212367301916334.
[I 2025-11-03 12:39:31,459] Trial 120 finished with value: 0.07270724735780391 and parameters: {'model_type': 'gcn', 'hidden_dims': '[512, 64]', 'dropout': 0.2671203628689808, 'batch_norm': True, 'lr': 0.0007136971678315088, 'weight_decay': 3.3484564087600747e-05, 'epochs': 219, 'loss': 'mae', 'optimizer': 'adam', 'graph_mode': 'knn', 'source': 'grm', 'knn_k': 5, 'weighted_edges': False, 'symmetrize_mode': 'union', 'use_snp_selection': False}. Best is trial 55 with value: 0.09212367301916334.
[I 2025-11-03 12:39:34,642] Trial 121 finished with value: 0.02064400856194537 and parameters: {'model_type': 'gcn', 'hidden_dims': '[512, 256]', 'dropout': 0.240709774293549, 'batch_norm': True, 'lr': 1.774695911550002e-05, 'weight_decay': 1.8804001497672986e-05, 'epochs': 306, 'loss': 'mae', 'optimizer': 'adam', 'graph_mode': 'knn', 'source': 'grm', 'knn_k': 6, 'weighted_edges': True, 'symmetrize_mode': 'mutual', 'use_snp_selection': False}. Best is trial 55 with value: 0.09212367301916334.
[I 2025-11-03 12:39:37,968] Trial 122 finished with value: 0.06168876431245998 and parameters: {'model_type': 'gcn', 'hidden_dims': '[512, 256]', 'dropout': 0.34379838751835906, 'batch_norm': True, 'lr': 4.07886176116233e-05, 'weight_decay': 6.026398419191102e-05, 'epochs': 332, 'loss': 'mae', 'optimizer': 'adam', 'graph_mode': 'knn', 'source': 'grm', 'knn_k': 5, 'weighted_edges': True, 'symmetrize_mode': 'mutual', 'use_snp_selection': False}. Best is trial 55 with value: 0.09212367301916334.
[I 2025-11-03 12:39:40,392] Trial 123 finished with value: 0.07678628627617196 and parameters: {'model_type': 'gcn', 'hidden_dims': '[512, 256]', 'dropout': 0.30209840779250774, 'batch_norm': True, 'lr': 0.0007522827448434902, 'weight_decay': 7.899366387701127e-05, 'epochs': 176, 'loss': 'mae', 'optimizer': 'adam', 'graph_mode': 'knn', 'source': 'grm', 'knn_k': 6, 'weighted_edges': True, 'symmetrize_mode': 'mutual', 'use_snp_selection': False}. Best is trial 55 with value: 0.09212367301916334.
[I 2025-11-03 12:39:43,683] Trial 124 finished with value: 0.07809061328970825 and parameters: {'model_type': 'gcn', 'hidden_dims': '[512, 256]', 'dropout': 0.3291776758843449, 'batch_norm': True, 'lr': 0.0005846726927826221, 'weight_decay': 2.2851830554783127e-05, 'epochs': 325, 'loss': 'mae', 'optimizer': 'adam', 'graph_mode': 'knn', 'source': 'grm', 'knn_k': 5, 'weighted_edges': True, 'symmetrize_mode': 'mutual', 'use_snp_selection': False}. Best is trial 55 with value: 0.09212367301916334.
[I 2025-11-03 12:39:47,094] Trial 125 finished with value: 0.039774197024737175 and parameters: {'model_type': 'gcn', 'hidden_dims': '[512, 256]', 'dropout': 0.27312858629465797, 'batch_norm': True, 'lr': 0.0007882620734434859, 'weight_decay': 4.1700934093263205e-05, 'epochs': 343, 'loss': 'mae', 'optimizer': 'adam', 'graph_mode': 'knn', 'source': 'grm', 'knn_k': 9, 'weighted_edges': True, 'symmetrize_mode': 'union', 'use_snp_selection': False}. Best is trial 55 with value: 0.09212367301916334.
[I 2025-11-03 12:39:50,319] Trial 126 finished with value: 0.0915551309522184 and parameters: {'model_type': 'gcn', 'hidden_dims': '[512, 256]', 'dropout': 0.3162869477066129, 'batch_norm': True, 'lr': 0.0009906828223706008, 'weight_decay': 6.279090672432304e-06, 'epochs': 314, 'loss': 'mae', 'optimizer': 'adam', 'graph_mode': 'knn', 'source': 'grm', 'knn_k': 7, 'weighted_edges': True, 'symmetrize_mode': 'mutual', 'use_snp_selection': False}. Best is trial 55 with value: 0.09212367301916334.
[I 2025-11-03 12:39:53,496] Trial 127 finished with value: 0.07702432464949119 and parameters: {'model_type': 'gcn', 'hidden_dims': '[512, 256]', 'dropout': 0.2954187158563453, 'batch_norm': True, 'lr': 0.0009777632503108207, 'weight_decay': 2.7615743382812022e-05, 'epochs': 314, 'loss': 'mae', 'optimizer': 'adam', 'graph_mode': 'knn', 'source': 'grm', 'knn_k': 4, 'weighted_edges': True, 'symmetrize_mode': 'mutual', 'use_snp_selection': False}. Best is trial 55 with value: 0.09212367301916334.
[I 2025-11-03 12:39:56,768] Trial 128 finished with value: 0.08274427031895859 and parameters: {'model_type': 'gcn', 'hidden_dims': '[512, 256]', 'dropout': 0.310594850822429, 'batch_norm': True, 'lr': 0.0006548744795409029, 'weight_decay': 3.555995081669081e-05, 'epochs': 337, 'loss': 'mae', 'optimizer': 'adam', 'graph_mode': 'knn', 'source': 'grm', 'knn_k': 5, 'weighted_edges': True, 'symmetrize_mode': 'mutual', 'use_snp_selection': False}. Best is trial 55 with value: 0.09212367301916334.
[I 2025-11-03 12:40:00,010] Trial 129 finished with value: 0.08012853888462973 and parameters: {'model_type': 'gcn', 'hidden_dims': '[512, 128]', 'dropout': 0.3182828356287736, 'batch_norm': True, 'lr': 0.0006707571288743387, 'weight_decay': 2.747199810686597e-06, 'epochs': 334, 'loss': 'mae', 'optimizer': 'adam', 'graph_mode': 'knn', 'source': 'grm', 'knn_k': 6, 'weighted_edges': True, 'symmetrize_mode': 'mutual', 'use_snp_selection': False}. Best is trial 55 with value: 0.09212367301916334.
[I 2025-11-03 12:40:03,129] Trial 130 finished with value: 0.04618881865251174 and parameters: {'model_type': 'gcn', 'hidden_dims': '[512, 64]', 'dropout': 0.33319338943083937, 'batch_norm': False, 'lr': 2.7770982913870917e-05, 'weight_decay': 2.163852836357127e-05, 'epochs': 324, 'loss': 'mae', 'optimizer': 'adam', 'graph_mode': 'knn', 'source': 'grm', 'knn_k': 7, 'weighted_edges': True, 'symmetrize_mode': 'union', 'use_snp_selection': False}. Best is trial 55 with value: 0.09212367301916334.
[I 2025-11-03 12:40:06,386] Trial 131 finished with value: 0.07689480497680565 and parameters: {'model_type': 'gcn', 'hidden_dims': '[512, 256]', 'dropout': 0.28422169198562874, 'batch_norm': True, 'lr': 0.0005187673852988063, 'weight_decay': 5.925662230333529e-06, 'epochs': 336, 'loss': 'mae', 'optimizer': 'adam', 'graph_mode': 'knn', 'source': 'grm', 'knn_k': 5, 'weighted_edges': True, 'symmetrize_mode': 'mutual', 'use_snp_selection': False}. Best is trial 55 with value: 0.09212367301916334.
[I 2025-11-03 12:40:09,718] Trial 132 finished with value: 0.07286162319486858 and parameters: {'model_type': 'gcn', 'hidden_dims': '[512, 256]', 'dropout': 0.3070066357751166, 'batch_norm': True, 'lr': 0.0006254775085947696, 'weight_decay': 3.540204481506332e-05, 'epochs': 349, 'loss': 'mae', 'optimizer': 'adam', 'graph_mode': 'knn', 'source': 'grm', 'knn_k': 5, 'weighted_edges': True, 'symmetrize_mode': 'mutual', 'use_snp_selection': False}. Best is trial 55 with value: 0.09212367301916334.
[I 2025-11-03 12:40:12,464] Trial 133 finished with value: 0.07672344561660384 and parameters: {'model_type': 'gcn', 'hidden_dims': '[512, 256]', 'dropout': 0.44476690664392116, 'batch_norm': True, 'lr': 0.0008956768111094269, 'weight_decay': 9.927820892087834e-05, 'epochs': 248, 'loss': 'mae', 'optimizer': 'adam', 'graph_mode': 'knn', 'source': 'grm', 'knn_k': 5, 'weighted_edges': True, 'symmetrize_mode': 'mutual', 'use_snp_selection': False}. Best is trial 55 with value: 0.09212367301916334.
[I 2025-11-03 12:40:15,632] Trial 134 finished with value: 0.07405088295460324 and parameters: {'model_type': 'gcn', 'hidden_dims': '[512, 256]', 'dropout': 0.25708230116588426, 'batch_norm': True, 'lr': 0.0007163380823264333, 'weight_decay': 3.127306603620453e-07, 'epochs': 321, 'loss': 'mae', 'optimizer': 'adam', 'graph_mode': 'knn', 'source': 'grm', 'knn_k': 4, 'weighted_edges': True, 'symmetrize_mode': 'mutual', 'use_snp_selection': False}. Best is trial 55 with value: 0.09212367301916334.
[I 2025-11-03 12:40:20,139] Trial 135 finished with value: 0.07031383199256937 and parameters: {'model_type': 'gcn', 'hidden_dims': '[512, 256]', 'dropout': 0.2738262804878005, 'batch_norm': True, 'lr': 0.0008678667727914007, 'weight_decay': 4.308333859811382e-05, 'epochs': 305, 'loss': 'mae', 'optimizer': 'adam', 'graph_mode': 'knn', 'source': 'grm', 'knn_k': 5, 'weighted_edges': True, 'symmetrize_mode': 'mutual', 'use_snp_selection': True, 'num_snps': 56557}. Best is trial 55 with value: 0.09212367301916334.
[I 2025-11-03 12:40:23,470] Trial 136 finished with value: 0.06907537075110393 and parameters: {'model_type': 'gcn', 'hidden_dims': '[512, 256]', 'dropout': 0.2496978773165896, 'batch_norm': True, 'lr': 0.00014276874597482966, 'weight_decay': 6.325306983048377e-05, 'epochs': 341, 'loss': 'mae', 'optimizer': 'adam', 'graph_mode': 'knn', 'source': 'grm', 'knn_k': 6, 'weighted_edges': True, 'symmetrize_mode': 'mutual', 'use_snp_selection': False}. Best is trial 55 with value: 0.09212367301916334.
[I 2025-11-03 12:40:26,695] Trial 137 finished with value: 0.02283247505327285 and parameters: {'model_type': 'gcn', 'hidden_dims': '[512, 256]', 'dropout': 0.289075158183234, 'batch_norm': True, 'lr': 1.1649898445318383e-06, 'weight_decay': 5.0167598041362616e-05, 'epochs': 330, 'loss': 'mae', 'optimizer': 'adam', 'graph_mode': 'knn', 'source': 'grm', 'knn_k': 6, 'weighted_edges': True, 'symmetrize_mode': 'mutual', 'use_snp_selection': False}. Best is trial 55 with value: 0.09212367301916334.
[I 2025-11-03 12:40:29,831] Trial 138 finished with value: 0.06910909619279368 and parameters: {'model_type': 'gcn', 'hidden_dims': '[512, 256]', 'dropout': 0.31624427970355745, 'batch_norm': True, 'lr': 0.0003865552751918058, 'weight_decay': 2.9905072906215833e-05, 'epochs': 314, 'loss': 'mae', 'optimizer': 'adam', 'graph_mode': 'knn', 'source': 'grm', 'knn_k': 8, 'weighted_edges': True, 'symmetrize_mode': 'mutual', 'use_snp_selection': False}. Best is trial 55 with value: 0.09212367301916334.
[I 2025-11-03 12:40:32,622] Trial 139 finished with value: 0.06937955178545158 and parameters: {'model_type': 'gcn', 'hidden_dims': '[512, 64]', 'dropout': 0.26574291752926826, 'batch_norm': True, 'lr': 0.0005014324292102357, 'weight_decay': 1.5894765554217696e-05, 'epochs': 257, 'loss': 'mae', 'optimizer': 'adam', 'graph_mode': 'knn', 'source': 'grm', 'knn_k': 5, 'weighted_edges': True, 'symmetrize_mode': 'mutual', 'use_snp_selection': False}. Best is trial 55 with value: 0.09212367301916334.
[I 2025-11-03 12:40:35,131] Trial 140 finished with value: 0.09061145623978134 and parameters: {'model_type': 'gcn', 'hidden_dims': '[256, 128, 64]', 'dropout': 0.23182440198171866, 'batch_norm': True, 'lr': 0.0007533738402839799, 'weight_decay': 3.6202486601047986e-05, 'epochs': 277, 'loss': 'mae', 'optimizer': 'adam', 'graph_mode': 'knn', 'source': 'grm', 'knn_k': 6, 'weighted_edges': True, 'symmetrize_mode': 'mutual', 'use_snp_selection': False}. Best is trial 55 with value: 0.09212367301916334.
[I 2025-11-03 12:40:37,633] Trial 141 finished with value: 0.08213802365603164 and parameters: {'model_type': 'gcn', 'hidden_dims': '[256, 128, 64]', 'dropout': 0.22226658993031106, 'batch_norm': True, 'lr': 0.0007467820967530114, 'weight_decay': 3.673204112391456e-05, 'epochs': 275, 'loss': 'mae', 'optimizer': 'adam', 'graph_mode': 'knn', 'source': 'grm', 'knn_k': 6, 'weighted_edges': True, 'symmetrize_mode': 'mutual', 'use_snp_selection': False}. Best is trial 55 with value: 0.09212367301916334.
[I 2025-11-03 12:40:40,473] Trial 142 finished with value: 0.09723403236236733 and parameters: {'model_type': 'gcn', 'hidden_dims': '[512, 256]', 'dropout': 0.23932275515400964, 'batch_norm': True, 'lr': 0.000620177984822347, 'weight_decay': 2.5641789489031994e-05, 'epochs': 264, 'loss': 'mae', 'optimizer': 'adam', 'graph_mode': 'knn', 'source': 'grm', 'knn_k': 6, 'weighted_edges': True, 'symmetrize_mode': 'mutual', 'use_snp_selection': False}. Best is trial 142 with value: 0.09723403236236733.
