[I 2025-11-03 15:27:19,386] Trial 97 finished with value: 0.10574204544197227 and parameters: {'model_type': 'graphsage', 'hidden_dims': '[512, 256]', 'dropout': 0.1617208259455141, 'batch_norm': True, 'lr': 0.0003653723702643045, 'weight_decay': 7.439352167628144e-06, 'epochs': 304, 'loss': 'mse', 'optimizer': 'adam', 'graph_mode': 'cutoff', 'cutoff': 0.7864264008407802, 'grm_norm': 'cosine_then_gcn', 'self_loops': True, 'use_snp_selection': False}. Best is trial 41 with value: 0.11551663568743284.
[I 2025-11-03 15:27:23,300] Trial 98 finished with value: 0.09355017793122374 and parameters: {'model_type': 'graphsage', 'hidden_dims': '[512, 64]', 'dropout': 0.5633719114379925, 'batch_norm': True, 'lr': 0.00026196989442039216, 'weight_decay': 0.0004132746640539107, 'epochs': 274, 'loss': 'mse', 'optimizer': 'adam', 'graph_mode': 'knn', 'source': 'grm', 'knn_k': 6, 'weighted_edges': False, 'symmetrize_mode': 'mutual', 'use_snp_selection': False}. Best is trial 41 with value: 0.11551663568743284.
[I 2025-11-03 15:27:25,279] Trial 99 finished with value: 0.10545556786927672 and parameters: {'model_type': 'graphsage', 'hidden_dims': '[128, 64]', 'dropout': 0.2895287278236995, 'batch_norm': True, 'lr': 0.0005155650935611385, 'weight_decay': 8.847191604478728e-06, 'epochs': 219, 'loss': 'mse', 'optimizer': 'adam', 'graph_mode': 'knn', 'source': 'grm', 'knn_k': 5, 'weighted_edges': False, 'symmetrize_mode': 'mutual', 'use_snp_selection': False}. Best is trial 41 with value: 0.11551663568743284.
[I 2025-11-03 15:27:28,640] Trial 100 finished with value: 0.0888823709631174 and parameters: {'model_type': 'graphsage', 'hidden_dims': '[512, 64]', 'dropout': 0.3300993416727366, 'batch_norm': True, 'lr': 0.0006037900073186844, 'weight_decay': 4.2888684829794695e-06, 'epochs': 197, 'loss': 'mse', 'optimizer': 'adam', 'graph_mode': 'knn', 'source': 'grm', 'knn_k': 6, 'weighted_edges': False, 'symmetrize_mode': 'mutual', 'use_snp_selection': False}. Best is trial 41 with value: 0.11551663568743284.
[I 2025-11-03 15:27:32,631] Trial 101 finished with value: 0.1032279377067455 and parameters: {'model_type': 'graphsage', 'hidden_dims': '[512, 64]', 'dropout': 0.21849587208831195, 'batch_norm': True, 'lr': 0.0004055704547382681, 'weight_decay': 2.2959227503201477e-05, 'epochs': 288, 'loss': 'mse', 'optimizer': 'adam', 'graph_mode': 'knn', 'source': 'grm', 'knn_k': 7, 'weighted_edges': False, 'symmetrize_mode': 'mutual', 'use_snp_selection': False}. Best is trial 41 with value: 0.11551663568743284.
[I 2025-11-03 15:27:36,514] Trial 102 finished with value: 0.10705547447193234 and parameters: {'model_type': 'graphsage', 'hidden_dims': '[512, 64]', 'dropout': 0.25628355290038474, 'batch_norm': True, 'lr': 0.00048088439967317677, 'weight_decay': 5.9708674837458885e-06, 'epochs': 266, 'loss': 'mse', 'optimizer': 'adam', 'graph_mode': 'knn', 'source': 'grm', 'knn_k': 7, 'weighted_edges': False, 'symmetrize_mode': 'mutual', 'use_snp_selection': False}. Best is trial 41 with value: 0.11551663568743284.
[I 2025-11-03 15:27:40,558] Trial 103 finished with value: 0.08762442009452781 and parameters: {'model_type': 'graphsage', 'hidden_dims': '[512, 64]', 'dropout': 0.26888158502847104, 'batch_norm': True, 'lr': 0.00035004988172401185, 'weight_decay': 6.27314531214628e-05, 'epochs': 298, 'loss': 'mae', 'optimizer': 'adam', 'graph_mode': 'knn', 'source': 'grm', 'knn_k': 6, 'weighted_edges': False, 'symmetrize_mode': 'mutual', 'use_snp_selection': False}. Best is trial 41 with value: 0.11551663568743284.
[I 2025-11-03 15:27:44,775] Trial 104 finished with value: 0.11368905432085036 and parameters: {'model_type': 'graphsage', 'hidden_dims': '[512, 64]', 'dropout': 0.23830609995451185, 'batch_norm': True, 'lr': 0.0007890477970982337, 'weight_decay': 0.00019722036749247312, 'epochs': 321, 'loss': 'mse', 'optimizer': 'adam', 'graph_mode': 'knn', 'source': 'grm', 'knn_k': 7, 'weighted_edges': False, 'symmetrize_mode': 'mutual', 'use_snp_selection': False}. Best is trial 41 with value: 0.11551663568743284.
[I 2025-11-03 15:27:49,225] Trial 105 finished with value: 0.09307188021181144 and parameters: {'model_type': 'graphsage', 'hidden_dims': '[512, 64]', 'dropout': 0.1993915272487764, 'batch_norm': True, 'lr': 0.0008416151962919911, 'weight_decay': 0.0002032381571387452, 'epochs': 332, 'loss': 'mse', 'optimizer': 'adam', 'graph_mode': 'knn', 'source': 'grm', 'knn_k': 6, 'weighted_edges': False, 'symmetrize_mode': 'union', 'use_snp_selection': False}. Best is trial 41 with value: 0.11551663568743284.
[I 2025-11-03 15:27:53,500] Trial 106 finished with value: 0.1065697812461127 and parameters: {'model_type': 'graphsage', 'hidden_dims': '[512, 64]', 'dropout': 0.24892182907661461, 'batch_norm': True, 'lr': 0.0007253587440842634, 'weight_decay': 0.0001405593543974715, 'epochs': 325, 'loss': 'mse', 'optimizer': 'adam', 'graph_mode': 'knn', 'source': 'grm', 'knn_k': 8, 'weighted_edges': True, 'symmetrize_mode': 'mutual', 'use_snp_selection': False}. Best is trial 41 with value: 0.11551663568743284.
[I 2025-11-03 15:27:56,509] Trial 107 finished with value: 0.10270105882749268 and parameters: {'model_type': 'graphsage', 'hidden_dims': '[256, 128, 64]', 'dropout': 0.22071751717668425, 'batch_norm': True, 'lr': 0.0005805052951066224, 'weight_decay': 0.00032313514329711235, 'epochs': 316, 'loss': 'mse', 'optimizer': 'adam', 'graph_mode': 'knn', 'source': 'grm', 'knn_k': 7, 'weighted_edges': False, 'symmetrize_mode': 'mutual', 'use_snp_selection': False}. Best is trial 41 with value: 0.11551663568743284.
[I 2025-11-03 15:27:58,719] Trial 108 finished with value: 0.10890790213591671 and parameters: {'model_type': 'graphsage', 'hidden_dims': '[128, 64]', 'dropout': 0.27512288245166894, 'batch_norm': True, 'lr': 0.0008550845891132058, 'weight_decay': 8.651486246396036e-05, 'epochs': 283, 'loss': 'mse', 'optimizer': 'adam', 'graph_mode': 'knn', 'source': 'grm', 'knn_k': 7, 'weighted_edges': False, 'symmetrize_mode': 'mutual', 'use_snp_selection': False}. Best is trial 41 with value: 0.11551663568743284.
[I 2025-11-03 15:28:01,575] Trial 109 finished with value: 0.0683000673788941 and parameters: {'model_type': 'graphsage', 'hidden_dims': '[512, 64]', 'dropout': 0.1938949775396494, 'batch_norm': False, 'lr': 0.0006727820857846199, 'weight_decay': 0.00011415526680664933, 'epochs': 310, 'loss': 'mse', 'optimizer': 'adam', 'graph_mode': 'knn', 'source': 'grm', 'knn_k': 4, 'weighted_edges': False, 'symmetrize_mode': 'mutual', 'use_snp_selection': True, 'num_snps': 23428}. Best is trial 41 with value: 0.11551663568743284.
[I 2025-11-03 15:28:05,941] Trial 110 finished with value: 0.10015920513889179 and parameters: {'model_type': 'graphsage', 'hidden_dims': '[512, 64]', 'dropout': 0.4702166478105332, 'batch_norm': True, 'lr': 0.0002779930386016672, 'weight_decay': 1.4272035163358953e-05, 'epochs': 342, 'loss': 'mse', 'optimizer': 'adam', 'graph_mode': 'knn', 'source': 'grm', 'knn_k': 5, 'weighted_edges': False, 'symmetrize_mode': 'mutual', 'use_snp_selection': False}. Best is trial 41 with value: 0.11551663568743284.
[I 2025-11-03 15:28:08,141] Trial 111 finished with value: 0.0897571448672646 and parameters: {'model_type': 'graphsage', 'hidden_dims': '[128, 64]', 'dropout': 0.28268162274719444, 'batch_norm': True, 'lr': 0.0007674928338748837, 'weight_decay': 8.61723528676324e-05, 'epochs': 280, 'loss': 'mse', 'optimizer': 'adam', 'graph_mode': 'knn', 'source': 'grm', 'knn_k': 7, 'weighted_edges': False, 'symmetrize_mode': 'mutual', 'use_snp_selection': False}. Best is trial 41 with value: 0.11551663568743284.
[I 2025-11-03 15:28:10,252] Trial 112 finished with value: 0.09452649752022896 and parameters: {'model_type': 'graphsage', 'hidden_dims': '[128, 64]', 'dropout': 0.2716111026599794, 'batch_norm': True, 'lr': 0.0008952174974018034, 'weight_decay': 4.378495162995981e-05, 'epochs': 253, 'loss': 'mse', 'optimizer': 'adam', 'graph_mode': 'knn', 'source': 'grm', 'knn_k': 8, 'weighted_edges': False, 'symmetrize_mode': 'mutual', 'use_snp_selection': False}. Best is trial 41 with value: 0.11551663568743284.
[I 2025-11-03 15:28:12,493] Trial 113 finished with value: 0.11609847124088127 and parameters: {'model_type': 'graphsage', 'hidden_dims': '[128, 64]', 'dropout': 0.2594063219448215, 'batch_norm': True, 'lr': 0.0005102618968592898, 'weight_decay': 0.00018024757575569393, 'epochs': 292, 'loss': 'mse', 'optimizer': 'adam', 'graph_mode': 'knn', 'source': 'grm', 'knn_k': 7, 'weighted_edges': False, 'symmetrize_mode': 'mutual', 'use_snp_selection': False}. Best is trial 113 with value: 0.11609847124088127.
[I 2025-11-03 15:28:14,835] Trial 114 finished with value: 0.058898891560666716 and parameters: {'model_type': 'graphsage', 'hidden_dims': '[128, 64]', 'dropout': 0.24070823109670442, 'batch_norm': True, 'lr': 1.823118745314268e-05, 'weight_decay': 0.00018555742152708156, 'epochs': 322, 'loss': 'mse', 'optimizer': 'adam', 'graph_mode': 'knn', 'source': 'grm', 'knn_k': 6, 'weighted_edges': False, 'symmetrize_mode': 'mutual', 'use_snp_selection': False}. Best is trial 113 with value: 0.11609847124088127.
[I 2025-11-03 15:28:17,108] Trial 115 finished with value: 0.12111497427682057 and parameters: {'model_type': 'graphsage', 'hidden_dims': '[128, 64]', 'dropout': 0.2568010588148856, 'batch_norm': True, 'lr': 0.0005140172558626149, 'weight_decay': 0.0001571320924406034, 'epochs': 301, 'loss': 'mse', 'optimizer': 'adam', 'graph_mode': 'knn', 'source': 'grm', 'knn_k': 7, 'weighted_edges': False, 'symmetrize_mode': 'mutual', 'use_snp_selection': False}. Best is trial 115 with value: 0.12111497427682057.
[I 2025-11-03 15:28:19,319] Trial 116 finished with value: 0.11245630899634754 and parameters: {'model_type': 'graphsage', 'hidden_dims': '[128, 64]', 'dropout': 0.22693423231983212, 'batch_norm': True, 'lr': 0.000524421965571484, 'weight_decay': 0.00042196318525142534, 'epochs': 301, 'loss': 'mse', 'optimizer': 'adam', 'graph_mode': 'cutoff', 'cutoff': 0.4630355692636521, 'grm_norm': 'cosine', 'self_loops': False, 'use_snp_selection': False}. Best is trial 115 with value: 0.12111497427682057.
[I 2025-11-03 15:28:21,547] Trial 117 finished with value: 0.11238810726727246 and parameters: {'model_type': 'graphsage', 'hidden_dims': '[128, 64]', 'dropout': 0.23065870267766767, 'batch_norm': True, 'lr': 0.0004767117359482907, 'weight_decay': 0.0005798581746194724, 'epochs': 306, 'loss': 'mse', 'optimizer': 'adam', 'graph_mode': 'cutoff', 'cutoff': 0.4706466584199334, 'grm_norm': 'cosine', 'self_loops': False, 'use_snp_selection': False}. Best is trial 115 with value: 0.12111497427682057.
[I 2025-11-03 15:28:23,763] Trial 118 finished with value: 0.09713942444841314 and parameters: {'model_type': 'graphsage', 'hidden_dims': '[128, 64]', 'dropout': 0.22687317166524767, 'batch_norm': True, 'lr': 0.00041686666988272736, 'weight_decay': 0.0007865367777485035, 'epochs': 302, 'loss': 'mse', 'optimizer': 'adam', 'graph_mode': 'cutoff', 'cutoff': 0.48452146497322357, 'grm_norm': 'cosine', 'self_loops': False, 'use_snp_selection': False}. Best is trial 115 with value: 0.12111497427682057.
[I 2025-11-03 15:28:26,011] Trial 119 finished with value: 0.10028002257654325 and parameters: {'model_type': 'graphsage', 'hidden_dims': '[128, 64]', 'dropout': 0.26068100732620236, 'batch_norm': True, 'lr': 0.0004984614042867541, 'weight_decay': 0.00043869460265324675, 'epochs': 310, 'loss': 'mse', 'optimizer': 'adam', 'graph_mode': 'cutoff', 'cutoff': 0.3826721529799296, 'grm_norm': 'cosine', 'self_loops': False, 'use_snp_selection': False}. Best is trial 115 with value: 0.12111497427682057.
[I 2025-11-03 15:28:28,192] Trial 120 finished with value: 0.11467002942894866 and parameters: {'model_type': 'graphsage', 'hidden_dims': '[128, 64]', 'dropout': 0.2074166317410578, 'batch_norm': True, 'lr': 0.00031860061199147745, 'weight_decay': 0.0005270546917109297, 'epochs': 294, 'loss': 'mse', 'optimizer': 'adam', 'graph_mode': 'cutoff', 'cutoff': 0.51913285849886, 'grm_norm': 'cosine', 'self_loops': False, 'use_snp_selection': False}. Best is trial 115 with value: 0.12111497427682057.
[I 2025-11-03 15:28:30,379] Trial 121 finished with value: 0.09337583762912553 and parameters: {'model_type': 'graphsage', 'hidden_dims': '[128, 64]', 'dropout': 0.2297702258968147, 'batch_norm': True, 'lr': 0.0003361660670507174, 'weight_decay': 0.0005419335248155622, 'epochs': 295, 'loss': 'mse', 'optimizer': 'adam', 'graph_mode': 'cutoff', 'cutoff': 0.5336310410804315, 'grm_norm': 'cosine', 'self_loops': False, 'use_snp_selection': False}. Best is trial 115 with value: 0.12111497427682057.
[I 2025-11-03 15:28:32,602] Trial 122 finished with value: 0.10821084243326157 and parameters: {'model_type': 'graphsage', 'hidden_dims': '[128, 64]', 'dropout': 0.21125427225443347, 'batch_norm': True, 'lr': 0.0004659628364198626, 'weight_decay': 0.0003409863084762487, 'epochs': 306, 'loss': 'mse', 'optimizer': 'adam', 'graph_mode': 'cutoff', 'cutoff': 0.6126532738285166, 'grm_norm': 'cosine', 'self_loops': False, 'use_snp_selection': False}. Best is trial 115 with value: 0.12111497427682057.
[I 2025-11-03 15:28:34,869] Trial 123 finished with value: 0.08405001977846074 and parameters: {'model_type': 'graphsage', 'hidden_dims': '[128, 64]', 'dropout': 0.17568609925619055, 'batch_norm': True, 'lr': 0.0003043670095102491, 'weight_decay': 0.00023950812593202922, 'epochs': 317, 'loss': 'mse', 'optimizer': 'adam', 'graph_mode': 'cutoff', 'cutoff': 0.49354878612389724, 'grm_norm': 'cosine', 'self_loops': False, 'use_snp_selection': False}. Best is trial 115 with value: 0.12111497427682057.
[I 2025-11-03 15:28:37,184] Trial 124 finished with value: 0.1021811509108616 and parameters: {'model_type': 'graphsage', 'hidden_dims': '[128, 64]', 'dropout': 0.24255643969089896, 'batch_norm': True, 'lr': 0.0005534249397814828, 'weight_decay': 0.0005103064316370486, 'epochs': 329, 'loss': 'mse', 'optimizer': 'adam', 'graph_mode': 'cutoff', 'cutoff': 0.34875577799257207, 'grm_norm': 'cosine', 'self_loops': False, 'use_snp_selection': False}. Best is trial 115 with value: 0.12111497427682057.
[I 2025-11-03 15:28:39,387] Trial 125 finished with value: 0.11143524186252532 and parameters: {'model_type': 'graphsage', 'hidden_dims': '[128, 64]', 'dropout': 0.2072164637344699, 'batch_norm': True, 'lr': 0.0004054018971204098, 'weight_decay': 0.0006126776109156296, 'epochs': 299, 'loss': 'mse', 'optimizer': 'adam', 'graph_mode': 'cutoff', 'cutoff': 0.6328930285320975, 'grm_norm': 'cosine', 'self_loops': False, 'use_snp_selection': False}. Best is trial 115 with value: 0.12111497427682057.
[I 2025-11-03 15:28:41,582] Trial 126 finished with value: 0.10934096743158819 and parameters: {'model_type': 'graphsage', 'hidden_dims': '[128, 64]', 'dropout': 0.21177091242695567, 'batch_norm': True, 'lr': 0.000653084317764461, 'weight_decay': 0.0006751694282799269, 'epochs': 298, 'loss': 'mse', 'optimizer': 'adam', 'graph_mode': 'cutoff', 'cutoff': 0.6371899821021648, 'grm_norm': 'cosine', 'self_loops': False, 'use_snp_selection': False}. Best is trial 115 with value: 0.12111497427682057.
[I 2025-11-03 15:28:43,754] Trial 127 finished with value: 0.09335033105805357 and parameters: {'model_type': 'graphsage', 'hidden_dims': '[128, 64]', 'dropout': 0.19160915144846216, 'batch_norm': True, 'lr': 0.00041246294764781894, 'weight_decay': 0.0006172244321540584, 'epochs': 291, 'loss': 'mse', 'optimizer': 'adam', 'graph_mode': 'cutoff', 'cutoff': 0.5268811932109996, 'grm_norm': 'cosine', 'self_loops': False, 'use_snp_selection': False}. Best is trial 115 with value: 0.12111497427682057.
[I 2025-11-03 15:28:46,009] Trial 128 finished with value: 0.09692403303033569 and parameters: {'model_type': 'graphsage', 'hidden_dims': '[128, 64]', 'dropout': 0.22589260932365282, 'batch_norm': True, 'lr': 0.000496757773126225, 'weight_decay': 0.0008916027163992401, 'epochs': 312, 'loss': 'mse', 'optimizer': 'adam', 'graph_mode': 'cutoff', 'cutoff': 0.40302377423304553, 'grm_norm': 'cosine', 'self_loops': False, 'use_snp_selection': False}. Best is trial 115 with value: 0.12111497427682057.
[I 2025-11-03 15:28:48,221] Trial 129 finished with value: 0.12163089581621105 and parameters: {'model_type': 'graphsage', 'hidden_dims': '[128, 64]', 'dropout': 0.13858225385414516, 'batch_norm': True, 'lr': 0.0007095464495675439, 'weight_decay': 0.0003753505791166909, 'epochs': 300, 'loss': 'mse', 'optimizer': 'adam', 'graph_mode': 'cutoff', 'cutoff': 0.4676549484813526, 'grm_norm': 'cosine', 'self_loops': False, 'use_snp_selection': False}. Best is trial 129 with value: 0.12163089581621105.
[I 2025-11-03 15:28:51,251] Trial 130 finished with value: 0.03511335940318013 and parameters: {'model_type': 'graphsage', 'hidden_dims': '[128, 64]', 'dropout': 0.14072753420722023, 'batch_norm': False, 'lr': 0.0006867420152954615, 'weight_decay': 0.00028608840636075927, 'epochs': 321, 'loss': 'mse', 'optimizer': 'adam', 'graph_mode': 'cutoff', 'cutoff': 0.44809016508958205, 'grm_norm': 'cosine', 'self_loops': False, 'use_snp_selection': True, 'num_snps': 39251}. Best is trial 129 with value: 0.12163089581621105.
[I 2025-11-03 15:28:53,465] Trial 131 finished with value: 0.09658212658963511 and parameters: {'model_type': 'graphsage', 'hidden_dims': '[128, 64]', 'dropout': 0.18117401948570347, 'batch_norm': True, 'lr': 0.0005773687582670599, 'weight_decay': 0.0003766984678266701, 'epochs': 302, 'loss': 'mse', 'optimizer': 'adam', 'graph_mode': 'cutoff', 'cutoff': 0.504471886391487, 'grm_norm': 'cosine', 'self_loops': False, 'use_snp_selection': False}. Best is trial 129 with value: 0.12163089581621105.
[I 2025-11-03 15:28:55,687] Trial 132 finished with value: 0.1060983433499955 and parameters: {'model_type': 'graphsage', 'hidden_dims': '[128, 64]', 'dropout': 0.1146332752790121, 'batch_norm': True, 'lr': 0.0004210944246921767, 'weight_decay': 0.0004644133793442666, 'epochs': 305, 'loss': 'mse', 'optimizer': 'adam', 'graph_mode': 'cutoff', 'cutoff': 0.5849576147845805, 'grm_norm': 'cosine', 'self_loops': False, 'use_snp_selection': False}. Best is trial 129 with value: 0.12163089581621105.
[I 2025-11-03 15:28:57,868] Trial 133 finished with value: 0.10988771055820613 and parameters: {'model_type': 'graphsage', 'hidden_dims': '[128, 64]', 'dropout': 0.16011930818345774, 'batch_norm': True, 'lr': 0.0007477390826583997, 'weight_decay': 0.00026732408572211294, 'epochs': 293, 'loss': 'mse', 'optimizer': 'adam', 'graph_mode': 'cutoff', 'cutoff': 0.5451803043134605, 'grm_norm': 'cosine', 'self_loops': False, 'use_snp_selection': False}. Best is trial 129 with value: 0.12163089581621105.
[I 2025-11-03 15:29:00,030] Trial 134 finished with value: 0.11259576241468958 and parameters: {'model_type': 'graphsage', 'hidden_dims': '[128, 64]', 'dropout': 0.13198599517644255, 'batch_norm': True, 'lr': 0.0003859944194597878, 'weight_decay': 0.000747093606571699, 'epochs': 288, 'loss': 'mse', 'optimizer': 'adam', 'graph_mode': 'cutoff', 'cutoff': 0.4600119833501156, 'grm_norm': 'gcn', 'self_loops': False, 'use_snp_selection': False}. Best is trial 129 with value: 0.12163089581621105.
[I 2025-11-03 15:29:02,175] Trial 135 finished with value: 0.10556373741659361 and parameters: {'model_type': 'graphsage', 'hidden_dims': '[128, 64]', 'dropout': 0.24957636385749135, 'batch_norm': True, 'lr': 0.000501209158276907, 'weight_decay': 0.0007273691329167105, 'epochs': 283, 'loss': 'mse', 'optimizer': 'adam', 'graph_mode': 'cutoff', 'cutoff': 0.4463802839391998, 'grm_norm': 'gcn', 'self_loops': False, 'use_snp_selection': False}. Best is trial 129 with value: 0.12163089581621105.
[I 2025-11-03 15:29:04,438] Trial 136 finished with value: 0.08449865226425543 and parameters: {'model_type': 'graphsage', 'hidden_dims': '[128, 64]', 'dropout': 0.12967075310396972, 'batch_norm': True, 'lr': 0.00023324355888976466, 'weight_decay': 0.000991006193048081, 'epochs': 316, 'loss': 'mse', 'optimizer': 'adam', 'graph_mode': 'cutoff', 'cutoff': 0.3994036978065865, 'grm_norm': 'gcn', 'self_loops': False, 'use_snp_selection': False}. Best is trial 129 with value: 0.12163089581621105.
[I 2025-11-03 15:29:06,596] Trial 137 finished with value: 0.11033762037234283 and parameters: {'model_type': 'graphsage', 'hidden_dims': '[128, 64]', 'dropout': 0.13412529709994223, 'batch_norm': True, 'lr': 0.0005858947014691353, 'weight_decay': 0.00016302683766414766, 'epochs': 287, 'loss': 'mse', 'optimizer': 'adam', 'graph_mode': 'cutoff', 'cutoff': 0.4804609749259265, 'grm_norm': 'gcn', 'self_loops': False, 'use_snp_selection': False}. Best is trial 129 with value: 0.12163089581621105.
[I 2025-11-03 15:29:10,672] Trial 138 finished with value: 0.08903974651639504 and parameters: {'model_type': 'graphsage', 'hidden_dims': '[512, 128]', 'dropout': 0.2370441631971461, 'batch_norm': True, 'lr': 0.0003668461278393247, 'weight_decay': 0.00034279683414384604, 'epochs': 311, 'loss': 'mse', 'optimizer': 'adam', 'graph_mode': 'cutoff', 'cutoff': 0.3108045987315933, 'grm_norm': 'gcn', 'self_loops': False, 'use_snp_selection': False}. Best is trial 129 with value: 0.12163089581621105.
[I 2025-11-03 15:29:12,840] Trial 139 finished with value: 0.11398721584870862 and parameters: {'model_type': 'graphsage', 'hidden_dims': '[128, 64]', 'dropout': 0.10729555866898993, 'batch_norm': True, 'lr': 0.00028165353583368215, 'weight_decay': 0.00020855511214816366, 'epochs': 291, 'loss': 'mse', 'optimizer': 'adam', 'graph_mode': 'cutoff', 'cutoff': 0.35013833396079297, 'grm_norm': 'none', 'self_loops': False, 'use_snp_selection': False}. Best is trial 129 with value: 0.12163089581621105.
