[I 2025-11-03 11:53:25,683] Trial 24 finished with value: 0.056228678357628986 and parameters: {'model_type': 'graphsage', 'hidden_dims': '[128, 64]', 'dropout': 0.5984005703393165, 'batch_norm': False, 'lr': 0.00012625636799986156, 'weight_decay': 1.0138724499080315e-07, 'epochs': 212, 'loss': 'mae', 'optimizer': 'adam', 'graph_mode': 'cutoff', 'cutoff': 0.6636501492322161, 'grm_norm': 'none', 'self_loops': False, 'use_snp_selection': True, 'num_snps': 53893}. Best is trial 13 with value: 0.06581675801211566.
[I 2025-11-03 11:53:29,455] Trial 25 finished with value: 0.054539534322197006 and parameters: {'model_type': 'graphsage', 'hidden_dims': '[512, 64]', 'dropout': 0.20572498444905432, 'batch_norm': False, 'lr': 0.00031861167755602377, 'weight_decay': 5.835211738859763e-07, 'epochs': 79, 'loss': 'mae', 'optimizer': 'adam', 'graph_mode': 'cutoff', 'cutoff': 0.7950305769513614, 'grm_norm': 'gcn', 'self_loops': False, 'use_snp_selection': True, 'num_snps': 44289}. Best is trial 13 with value: 0.06581675801211566.
[I 2025-11-03 11:53:36,255] Trial 26 finished with value: 0.03543803307305663 and parameters: {'model_type': 'graphsage', 'hidden_dims': '[512, 128]', 'dropout': 0.15456007395505056, 'batch_norm': True, 'lr': 1.554499671120712e-05, 'weight_decay': 0.0003496411667264479, 'epochs': 296, 'loss': 'mse', 'optimizer': 'adam', 'graph_mode': 'knn', 'source': 'grm', 'knn_k': 10, 'weighted_edges': False, 'symmetrize_mode': 'union', 'use_snp_selection': False}. Best is trial 13 with value: 0.06581675801211566.
[I 2025-11-03 11:53:40,142] Trial 27 finished with value: 0.042298846971504885 and parameters: {'model_type': 'graphsage', 'hidden_dims': '[256, 128, 64]', 'dropout': 0.42472021708814856, 'batch_norm': False, 'lr': 4.964877204803178e-05, 'weight_decay': 0.00011449369994485733, 'epochs': 251, 'loss': 'mae', 'optimizer': 'adam', 'graph_mode': 'cutoff', 'cutoff': 0.6013551331645379, 'grm_norm': 'cosine', 'self_loops': False, 'use_snp_selection': True, 'num_snps': 45462}. Best is trial 13 with value: 0.06581675801211566.
[I 2025-11-03 11:53:43,990] Trial 28 finished with value: 0.045714163488063 and parameters: {'model_type': 'graphsage', 'hidden_dims': '[256, 128]', 'dropout': 0.25683396299197025, 'batch_norm': False, 'lr': 0.00010732097252822272, 'weight_decay': 8.88437955685736e-06, 'epochs': 335, 'loss': 'mae', 'optimizer': 'adam', 'graph_mode': 'cutoff', 'cutoff': 0.4432184798554731, 'grm_norm': 'cosine_then_gcn', 'self_loops': True, 'use_snp_selection': True, 'num_snps': 38211}. Best is trial 13 with value: 0.06581675801211566.
[I 2025-11-03 11:53:47,043] Trial 29 finished with value: 0.03120382790383833 and parameters: {'model_type': 'graphsage', 'hidden_dims': '[128, 64]', 'dropout': 0.19603289987693753, 'batch_norm': True, 'lr': 1.0893781950163453e-06, 'weight_decay': 4.6278096066208265e-05, 'epochs': 329, 'loss': 'mae', 'optimizer': 'adam', 'graph_mode': 'knn', 'source': 'grm', 'knn_k': 4, 'weighted_edges': True, 'symmetrize_mode': 'union', 'use_snp_selection': False}. Best is trial 13 with value: 0.06581675801211566.
[I 2025-11-03 11:53:50,455] Trial 30 finished with value: 0.06815677138062187 and parameters: {'model_type': 'graphsage', 'hidden_dims': '[128, 64]', 'dropout': 0.3249334771247313, 'batch_norm': False, 'lr': 0.00017415211954943652, 'weight_decay': 0.000501764393991972, 'epochs': 164, 'loss': 'mae', 'optimizer': 'adam', 'graph_mode': 'cutoff', 'cutoff': 0.718408108723464, 'grm_norm': 'none', 'self_loops': False, 'use_snp_selection': True, 'num_snps': 54567}. Best is trial 30 with value: 0.06815677138062187.
[I 2025-11-03 11:53:53,829] Trial 31 finished with value: 0.032049523875409165 and parameters: {'model_type': 'graphsage', 'hidden_dims': '[128, 64]', 'dropout': 0.38404285175191655, 'batch_norm': False, 'lr': 0.00019169668424078365, 'weight_decay': 0.0005980699081252122, 'epochs': 160, 'loss': 'mae', 'optimizer': 'adam', 'graph_mode': 'cutoff', 'cutoff': 0.6891200261914876, 'grm_norm': 'none', 'self_loops': False, 'use_snp_selection': True, 'num_snps': 53690}. Best is trial 30 with value: 0.06815677138062187.
[I 2025-11-03 11:53:56,979] Trial 32 finished with value: 0.004841711920756194 and parameters: {'model_type': 'graphsage', 'hidden_dims': '[128, 64]', 'dropout': 0.3155199186639206, 'batch_norm': False, 'lr': 0.0005262372640106429, 'weight_decay': 0.000217512288132546, 'epochs': 75, 'loss': 'mae', 'optimizer': 'adam', 'graph_mode': 'cutoff', 'cutoff': 0.8158508496429482, 'grm_norm': 'none', 'self_loops': False, 'use_snp_selection': True, 'num_snps': 53799}. Best is trial 30 with value: 0.06815677138062187.
[I 2025-11-03 11:53:59,792] Trial 33 finished with value: 0.049361026100876705 and parameters: {'model_type': 'graphsage', 'hidden_dims': '[128, 64]', 'dropout': 0.4582205413832403, 'batch_norm': False, 'lr': 6.166948972342011e-05, 'weight_decay': 0.0005002646764455879, 'epochs': 40, 'loss': 'mae', 'optimizer': 'adam', 'graph_mode': 'cutoff', 'cutoff': 0.6137246740592217, 'grm_norm': 'none', 'self_loops': False, 'use_snp_selection': True, 'num_snps': 47765}. Best is trial 30 with value: 0.06815677138062187.
[I 2025-11-03 11:54:03,704] Trial 34 finished with value: 0.05193731507076708 and parameters: {'model_type': 'graphsage', 'hidden_dims': '[128, 64]', 'dropout': 0.12661376853290357, 'batch_norm': False, 'lr': 0.00033534519351321356, 'weight_decay': 1.4775693827028097e-06, 'epochs': 137, 'loss': 'mse', 'optimizer': 'adam', 'graph_mode': 'knn', 'source': 'grm', 'knn_k': 4, 'weighted_edges': False, 'symmetrize_mode': 'union', 'use_snp_selection': True, 'num_snps': 59846}. Best is trial 30 with value: 0.06815677138062187.
[I 2025-11-03 11:54:06,707] Trial 35 finished with value: 0.04920373906438815 and parameters: {'model_type': 'graphsage', 'hidden_dims': '[256, 128]', 'dropout': 0.2730775713044035, 'batch_norm': False, 'lr': 2.978697990131756e-05, 'weight_decay': 0.0009899993087850803, 'epochs': 97, 'loss': 'mae', 'optimizer': 'adam', 'graph_mode': 'cutoff', 'cutoff': 0.7589519432791146, 'grm_norm': 'none', 'self_loops': False, 'use_snp_selection': True, 'num_snps': 40690}. Best is trial 30 with value: 0.06815677138062187.
[I 2025-11-03 11:54:11,519] Trial 36 finished with value: 0.059827411748653775 and parameters: {'model_type': 'graphsage', 'hidden_dims': '[512, 64]', 'dropout': 0.19763026460759167, 'batch_norm': True, 'lr': 0.00012586758025653932, 'weight_decay': 2.1998082552356422e-05, 'epochs': 169, 'loss': 'mse', 'optimizer': 'adam', 'graph_mode': 'knn', 'source': 'grm', 'knn_k': 10, 'weighted_edges': False, 'symmetrize_mode': 'union', 'use_snp_selection': False}. Best is trial 30 with value: 0.06815677138062187.
[I 2025-11-03 11:54:16,341] Trial 37 finished with value: 0.04672376362973654 and parameters: {'model_type': 'graphsage', 'hidden_dims': '[512, 64]', 'dropout': 0.20780445997093194, 'batch_norm': True, 'lr': 0.00010714645205014064, 'weight_decay': 0.00025984994130148054, 'epochs': 174, 'loss': 'mse', 'optimizer': 'adam', 'graph_mode': 'knn', 'source': 'grm', 'knn_k': 10, 'weighted_edges': False, 'symmetrize_mode': 'union', 'use_snp_selection': False}. Best is trial 30 with value: 0.06815677138062187.
[I 2025-11-03 11:54:21,395] Trial 38 finished with value: 0.03391300055892671 and parameters: {'model_type': 'graphsage', 'hidden_dims': '[512, 64]', 'dropout': 0.3425344538623255, 'batch_norm': True, 'lr': 3.62855417482591e-05, 'weight_decay': 9.216787174867973e-05, 'epochs': 202, 'loss': 'mse', 'optimizer': 'adam', 'graph_mode': 'knn', 'source': 'grm', 'knn_k': 8, 'weighted_edges': False, 'symmetrize_mode': 'union', 'use_snp_selection': False}. Best is trial 30 with value: 0.06815677138062187.
[I 2025-11-03 11:54:25,767] Trial 39 finished with value: 0.06240438677248672 and parameters: {'model_type': 'graphsage', 'hidden_dims': '[512, 64]', 'dropout': 0.1866414944906805, 'batch_norm': True, 'lr': 0.0004796670577853519, 'weight_decay': 3.158540271089119e-05, 'epochs': 179, 'loss': 'mse', 'optimizer': 'adam', 'graph_mode': 'knn', 'source': 'grm', 'knn_k': 4, 'weighted_edges': False, 'symmetrize_mode': 'union', 'use_snp_selection': False}. Best is trial 30 with value: 0.06815677138062187.
[I 2025-11-03 11:54:28,668] Trial 40 finished with value: 0.03923100683774565 and parameters: {'model_type': 'graphsage', 'hidden_dims': '[256, 128, 64]', 'dropout': 0.3785481838860978, 'batch_norm': True, 'lr': 0.0007389348778886649, 'weight_decay': 1.4159761121758787e-05, 'epochs': 179, 'loss': 'mse', 'optimizer': 'adam', 'graph_mode': 'knn', 'source': 'grm', 'knn_k': 4, 'weighted_edges': False, 'symmetrize_mode': 'union', 'use_snp_selection': False}. Best is trial 30 with value: 0.06815677138062187.
[I 2025-11-03 11:54:32,575] Trial 41 finished with value: 0.048438026755602555 and parameters: {'model_type': 'graphsage', 'hidden_dims': '[512, 64]', 'dropout': 0.16897962823992968, 'batch_norm': True, 'lr': 0.00022308350933909394, 'weight_decay': 2.2426150332337516e-05, 'epochs': 145, 'loss': 'mse', 'optimizer': 'adam', 'graph_mode': 'knn', 'source': 'grm', 'knn_k': 3, 'weighted_edges': False, 'symmetrize_mode': 'union', 'use_snp_selection': False}. Best is trial 30 with value: 0.06815677138062187.
[I 2025-11-03 11:54:37,103] Trial 42 finished with value: 0.034840477568622095 and parameters: {'model_type': 'graphsage', 'hidden_dims': '[512, 64]', 'dropout': 0.19157760368853738, 'batch_norm': True, 'lr': 0.00044145310971319075, 'weight_decay': 4.241162812449203e-05, 'epochs': 172, 'loss': 'mse', 'optimizer': 'adam', 'graph_mode': 'knn', 'source': 'grm', 'knn_k': 6, 'weighted_edges': False, 'symmetrize_mode': 'union', 'use_snp_selection': False}. Best is trial 30 with value: 0.06815677138062187.
[I 2025-11-03 11:54:41,742] Trial 43 finished with value: 0.04817190841016958 and parameters: {'model_type': 'graphsage', 'hidden_dims': '[512, 64]', 'dropout': 0.2237485684329257, 'batch_norm': True, 'lr': 0.0003083988977143306, 'weight_decay': 7.17868192124729e-06, 'epochs': 207, 'loss': 'mse', 'optimizer': 'adam', 'graph_mode': 'knn', 'source': 'grm', 'knn_k': 3, 'weighted_edges': False, 'symmetrize_mode': 'union', 'use_snp_selection': False}. Best is trial 30 with value: 0.06815677138062187.
[I 2025-11-03 11:54:45,848] Trial 44 finished with value: 0.0501780725706748 and parameters: {'model_type': 'graphsage', 'hidden_dims': '[512, 64]', 'dropout': 0.33307622765799305, 'batch_norm': True, 'lr': 0.0001494948817382624, 'weight_decay': 4.133109155711791e-06, 'epochs': 130, 'loss': 'mse', 'optimizer': 'adam', 'graph_mode': 'knn', 'source': 'grm', 'knn_k': 9, 'weighted_edges': False, 'symmetrize_mode': 'union', 'use_snp_selection': False}. Best is trial 30 with value: 0.06815677138062187.
[I 2025-11-03 11:54:50,069] Trial 45 finished with value: 0.0434612587579663 and parameters: {'model_type': 'graphsage', 'hidden_dims': '[512, 64]', 'dropout': 0.2756871524016562, 'batch_norm': True, 'lr': 0.0006049393670755438, 'weight_decay': 3.12831420980963e-05, 'epochs': 161, 'loss': 'mse', 'optimizer': 'adam', 'graph_mode': 'knn', 'source': 'grm', 'knn_k': 5, 'weighted_edges': False, 'symmetrize_mode': 'union', 'use_snp_selection': False}. Best is trial 30 with value: 0.06815677138062187.
[I 2025-11-03 11:54:54,266] Trial 46 finished with value: 0.048880490565537504 and parameters: {'model_type': 'graphsage', 'hidden_dims': '[512, 256]', 'dropout': 0.24556447834096595, 'batch_norm': True, 'lr': 0.0002547763671986191, 'weight_decay': 6.612703011995517e-05, 'epochs': 187, 'loss': 'mse', 'optimizer': 'adam', 'graph_mode': 'knn', 'source': 'grm', 'knn_k': 2, 'weighted_edges': True, 'symmetrize_mode': 'mutual', 'use_snp_selection': False}. Best is trial 30 with value: 0.06815677138062187.
[I 2025-11-03 11:54:59,808] Trial 47 finished with value: 0.03514698089718939 and parameters: {'model_type': 'graphsage', 'hidden_dims': '[512, 64]', 'dropout': 0.11088189194816558, 'batch_norm': True, 'lr': 0.00011083407086817106, 'weight_decay': 0.0006621663639361061, 'epochs': 238, 'loss': 'mse', 'optimizer': 'adam', 'graph_mode': 'knn', 'source': 'grm', 'knn_k': 7, 'weighted_edges': False, 'symmetrize_mode': 'union', 'use_snp_selection': False}. Best is trial 30 with value: 0.06815677138062187.
[I 2025-11-03 11:55:03,475] Trial 48 finished with value: 0.03209275479528072 and parameters: {'model_type': 'graphsage', 'hidden_dims': '[256, 128]', 'dropout': 0.2879364424724842, 'batch_norm': True, 'lr': 6.938788778608045e-05, 'weight_decay': 0.00015820426953128383, 'epochs': 267, 'loss': 'mse', 'optimizer': 'adam', 'graph_mode': 'knn', 'source': 'grm', 'knn_k': 5, 'weighted_edges': False, 'symmetrize_mode': 'union', 'use_snp_selection': False}. Best is trial 30 with value: 0.06815677138062187.
[I 2025-11-03 11:55:08,094] Trial 49 finished with value: 0.044055196276797964 and parameters: {'model_type': 'graphsage', 'hidden_dims': '[512, 128]', 'dropout': 0.21929190490319636, 'batch_norm': True, 'lr': 0.00018747468197387746, 'weight_decay': 1.2661357899740676e-05, 'epochs': 194, 'loss': 'mse', 'optimizer': 'adam', 'graph_mode': 'knn', 'source': 'grm', 'knn_k': 9, 'weighted_edges': True, 'symmetrize_mode': 'mutual', 'use_snp_selection': False}. Best is trial 30 with value: 0.06815677138062187.
[I 2025-11-03 11:55:12,550] Trial 50 finished with value: 0.0508761511597606 and parameters: {'model_type': 'graphsage', 'hidden_dims': '[512, 64]', 'dropout': 0.1906362033558114, 'batch_norm': True, 'lr': 0.0008661275530714479, 'weight_decay': 2.796279561487135e-06, 'epochs': 220, 'loss': 'mse', 'optimizer': 'adam', 'graph_mode': 'cutoff', 'cutoff': 0.8972930923214948, 'grm_norm': 'cosine_then_gcn', 'self_loops': True, 'use_snp_selection': False}. Best is trial 30 with value: 0.06815677138062187.
[I 2025-11-03 11:55:15,607] Trial 51 finished with value: 0.011529965491565413 and parameters: {'model_type': 'graphsage', 'hidden_dims': '[128, 64]', 'dropout': 0.14984540147939976, 'batch_norm': False, 'lr': 9.460909822071426e-05, 'weight_decay': 1.9435788243002573e-05, 'epochs': 54, 'loss': 'mae', 'optimizer': 'adam', 'graph_mode': 'cutoff', 'cutoff': 0.6899792672511578, 'grm_norm': 'none', 'self_loops': False, 'use_snp_selection': True, 'num_snps': 53925}. Best is trial 30 with value: 0.06815677138062187.
[I 2025-11-03 11:55:18,095] Trial 52 finished with value: 0.05031879428711545 and parameters: {'model_type': 'graphsage', 'hidden_dims': '[128, 64]', 'dropout': 0.12085963376907448, 'batch_norm': False, 'lr': 0.0001481475459914698, 'weight_decay': 2.708522962868601e-05, 'epochs': 92, 'loss': 'mae', 'optimizer': 'adam', 'graph_mode': 'cutoff', 'cutoff': 0.5562187997853514, 'grm_norm': 'none', 'self_loops': False, 'use_snp_selection': True, 'num_snps': 33406}. Best is trial 30 with value: 0.06815677138062187.
[I 2025-11-03 11:55:20,932] Trial 53 finished with value: 0.04508538000838919 and parameters: {'model_type': 'graphsage', 'hidden_dims': '[512, 64]', 'dropout': 0.16973882470883891, 'batch_norm': False, 'lr': 4.656933644709268e-05, 'weight_decay': 0.0003350931990219483, 'epochs': 127, 'loss': 'mae', 'optimizer': 'adam', 'graph_mode': 'cutoff', 'cutoff': 0.7036884644819095, 'grm_norm': 'gcn', 'self_loops': False, 'use_snp_selection': True, 'num_snps': 24683}. Best is trial 30 with value: 0.06815677138062187.
[I 2025-11-03 11:55:25,172] Trial 54 finished with value: 0.04620822761337179 and parameters: {'model_type': 'graphsage', 'hidden_dims': '[512, 256]', 'dropout': 0.1415583795583469, 'batch_norm': False, 'lr': 0.0003908702490293861, 'weight_decay': 5.7826392195223195e-05, 'epochs': 108, 'loss': 'mae', 'optimizer': 'adam', 'graph_mode': 'cutoff', 'cutoff': 0.6038943018278289, 'grm_norm': 'gcn', 'self_loops': False, 'use_snp_selection': True, 'num_snps': 47845}. Best is trial 30 with value: 0.06815677138062187.
[I 2025-11-03 11:55:29,693] Trial 55 finished with value: 0.05178686385109929 and parameters: {'model_type': 'graphsage', 'hidden_dims': '[512, 64]', 'dropout': 0.3134539117713512, 'batch_norm': False, 'lr': 7.852827624933991e-05, 'weight_decay': 0.0006466266205664845, 'epochs': 314, 'loss': 'mae', 'optimizer': 'adam', 'graph_mode': 'cutoff', 'cutoff': 0.725772481185702, 'grm_norm': 'cosine', 'self_loops': False, 'use_snp_selection': True, 'num_snps': 33220}. Best is trial 30 with value: 0.06815677138062187.
[I 2025-11-03 11:55:32,662] Trial 56 finished with value: 0.030380852329965853 and parameters: {'model_type': 'graphsage', 'hidden_dims': '[128, 64]', 'dropout': 0.10475992155092605, 'batch_norm': False, 'lr': 0.0002568262301294635, 'weight_decay': 1.5806425443027915e-05, 'epochs': 149, 'loss': 'mae', 'optimizer': 'adam', 'graph_mode': 'cutoff', 'cutoff': 0.5110742692974428, 'grm_norm': 'cosine_then_gcn', 'self_loops': False, 'use_snp_selection': True, 'num_snps': 41629}. Best is trial 30 with value: 0.06815677138062187.
[I 2025-11-03 11:55:36,033] Trial 57 finished with value: 0.048097155420302656 and parameters: {'model_type': 'graphsage', 'hidden_dims': '[256, 128, 64]', 'dropout': 0.2587312750687401, 'batch_norm': False, 'lr': 0.00012532920203898134, 'weight_decay': 0.000126792048695802, 'epochs': 349, 'loss': 'mae', 'optimizer': 'adam', 'graph_mode': 'cutoff', 'cutoff': 0.8459051534035025, 'grm_norm': 'none', 'self_loops': False, 'use_snp_selection': True, 'num_snps': 21520}. Best is trial 30 with value: 0.06815677138062187.
[I 2025-11-03 11:55:42,267] Trial 58 finished with value: 0.018310731743257674 and parameters: {'model_type': 'graphsage', 'hidden_dims': '[512, 64]', 'dropout': 0.17887007200037638, 'batch_norm': False, 'lr': 0.00047225293154800105, 'weight_decay': 7.566747596291186e-06, 'epochs': 262, 'loss': 'mae', 'optimizer': 'adam', 'graph_mode': 'cutoff', 'cutoff': 0.7776805707893305, 'grm_norm': 'gcn', 'self_loops': True, 'use_snp_selection': True, 'num_snps': 56517}. Best is trial 30 with value: 0.06815677138062187.
[I 2025-11-03 11:55:46,304] Trial 59 finished with value: 0.06221368001985009 and parameters: {'model_type': 'graphsage', 'hidden_dims': '[512, 128]', 'dropout': 0.22831949444828337, 'batch_norm': False, 'lr': 3.166351566704878e-06, 'weight_decay': 0.0002467280446530467, 'epochs': 284, 'loss': 'mae', 'optimizer': 'adam', 'graph_mode': 'cutoff', 'cutoff': 0.7182781077120864, 'grm_norm': 'cosine', 'self_loops': False, 'use_snp_selection': True, 'num_snps': 30158}. Best is trial 30 with value: 0.06815677138062187.
[I 2025-11-03 11:55:50,329] Trial 60 finished with value: 0.06272691392578063 and parameters: {'model_type': 'graphsage', 'hidden_dims': '[512, 128]', 'dropout': 0.23539700719646042, 'batch_norm': False, 'lr': 4.829103120495013e-06, 'weight_decay': 0.00022953728274458838, 'epochs': 298, 'loss': 'mae', 'optimizer': 'adam', 'graph_mode': 'cutoff', 'cutoff': 0.7390587570622901, 'grm_norm': 'cosine', 'self_loops': False, 'use_snp_selection': True, 'num_snps': 29112}. Best is trial 30 with value: 0.06815677138062187.
[I 2025-11-03 11:55:54,325] Trial 61 finished with value: 0.04535127504489758 and parameters: {'model_type': 'graphsage', 'hidden_dims': '[512, 128]', 'dropout': 0.22301873341163392, 'batch_norm': False, 'lr': 3.839104591504781e-06, 'weight_decay': 0.0002517889256432458, 'epochs': 285, 'loss': 'mae', 'optimizer': 'adam', 'graph_mode': 'cutoff', 'cutoff': 0.7204077143977631, 'grm_norm': 'cosine', 'self_loops': False, 'use_snp_selection': True, 'num_snps': 29481}. Best is trial 30 with value: 0.06815677138062187.
[I 2025-11-03 11:55:57,443] Trial 62 finished with value: 0.055166986363329805 and parameters: {'model_type': 'graphsage', 'hidden_dims': '[512, 128]', 'dropout': 0.2358071479411471, 'batch_norm': False, 'lr': 2.9283201594701905e-06, 'weight_decay': 0.0005267009787759243, 'epochs': 299, 'loss': 'mae', 'optimizer': 'adam', 'graph_mode': 'cutoff', 'cutoff': 0.6624963312391958, 'grm_norm': 'cosine', 'self_loops': False, 'use_snp_selection': True, 'num_snps': 19664}. Best is trial 30 with value: 0.06815677138062187.
[I 2025-11-03 11:56:01,347] Trial 63 finished with value: 0.05823809514308177 and parameters: {'model_type': 'graphsage', 'hidden_dims': '[512, 128]', 'dropout': 0.28688850845671643, 'batch_norm': False, 'lr': 4.4597923526405e-06, 'weight_decay': 0.00040513678470218334, 'epochs': 274, 'loss': 'mae', 'optimizer': 'adam', 'graph_mode': 'cutoff', 'cutoff': 0.6292515698265352, 'grm_norm': 'cosine', 'self_loops': False, 'use_snp_selection': True, 'num_snps': 28653}. Best is trial 30 with value: 0.06815677138062187.
[I 2025-11-03 11:56:04,310] Trial 64 finished with value: 0.04574989157906789 and parameters: {'model_type': 'graphsage', 'hidden_dims': '[512, 128]', 'dropout': 0.25702359323323565, 'batch_norm': False, 'lr': 1.6910528924560694e-06, 'weight_decay': 0.0007816051643870005, 'epochs': 328, 'loss': 'mae', 'optimizer': 'adam', 'graph_mode': 'cutoff', 'cutoff': 0.850220043276842, 'grm_norm': 'cosine', 'self_loops': False, 'use_snp_selection': True, 'num_snps': 16875}. Best is trial 30 with value: 0.06815677138062187.
[I 2025-11-03 11:56:08,689] Trial 65 finished with value: 0.06402403312832476 and parameters: {'model_type': 'graphsage', 'hidden_dims': '[512, 128]', 'dropout': 0.20812533458668445, 'batch_norm': False, 'lr': 1.3041899161066756e-05, 'weight_decay': 0.00021359077935132612, 'epochs': 303, 'loss': 'mae', 'optimizer': 'adam', 'graph_mode': 'cutoff', 'cutoff': 0.7355597331618061, 'grm_norm': 'cosine', 'self_loops': False, 'use_snp_selection': True, 'num_snps': 32587}. Best is trial 30 with value: 0.06815677138062187.
