[I 2025-11-03 13:41:51,341] Trial 118 finished with value: 0.06920737076069229 and parameters: {'model_type': 'gcn', 'hidden_dims': '[512, 256]', 'dropout': 0.11236963296304472, 'batch_norm': True, 'lr': 1.0734192924881945e-06, 'weight_decay': 0.000431847482622672, 'epochs': 150, 'loss': 'mse', 'optimizer': 'adam', 'graph_mode': 'knn', 'source': 'grm', 'knn_k': 8, 'weighted_edges': True, 'symmetrize_mode': 'mutual', 'use_snp_selection': False}. Best is trial 45 with value: 0.09999459353692468.
[I 2025-11-03 13:41:52,773] Trial 119 finished with value: 0.04814309297909163 and parameters: {'model_type': 'gcn', 'hidden_dims': '[128, 64]', 'dropout': 0.15735650520352565, 'batch_norm': True, 'lr': 0.000555111177890551, 'weight_decay': 0.0008223462334845251, 'epochs': 141, 'loss': 'mae', 'optimizer': 'adam', 'graph_mode': 'cutoff', 'cutoff': 0.4020828257981472, 'grm_norm': 'cosine', 'self_loops': True, 'use_snp_selection': False}. Best is trial 45 with value: 0.09999459353692468.
[I 2025-11-03 13:41:54,815] Trial 120 finished with value: 0.0832839942448303 and parameters: {'model_type': 'gcn', 'hidden_dims': '[512, 256]', 'dropout': 0.24432856729639307, 'batch_norm': True, 'lr': 0.0007118169915515087, 'weight_decay': 0.0003675265829633807, 'epochs': 133, 'loss': 'mse', 'optimizer': 'adam', 'graph_mode': 'cutoff', 'cutoff': 0.32428560809176676, 'grm_norm': 'cosine', 'self_loops': True, 'use_snp_selection': False}. Best is trial 45 with value: 0.09999459353692468.
[I 2025-11-03 13:41:56,764] Trial 121 finished with value: 0.08224753447680563 and parameters: {'model_type': 'gcn', 'hidden_dims': '[512, 256]', 'dropout': 0.16566496963050004, 'batch_norm': True, 'lr': 0.00039617677995179774, 'weight_decay': 0.0002659786985493735, 'epochs': 114, 'loss': 'mse', 'optimizer': 'adam', 'graph_mode': 'cutoff', 'cutoff': 0.45672672569298783, 'grm_norm': 'cosine', 'self_loops': True, 'use_snp_selection': False}. Best is trial 45 with value: 0.09999459353692468.
[I 2025-11-03 13:41:58,957] Trial 122 finished with value: 0.015199998291772996 and parameters: {'model_type': 'gcn', 'hidden_dims': '[512, 256]', 'dropout': 0.17667547535196082, 'batch_norm': True, 'lr': 6.128468010933144e-06, 'weight_decay': 0.00016594238658300463, 'epochs': 156, 'loss': 'mse', 'optimizer': 'adam', 'graph_mode': 'cutoff', 'cutoff': 0.48156959297179097, 'grm_norm': 'cosine', 'self_loops': True, 'use_snp_selection': False}. Best is trial 45 with value: 0.09999459353692468.
[I 2025-11-03 13:42:00,658] Trial 123 finished with value: 0.08934950269437618 and parameters: {'model_type': 'gcn', 'hidden_dims': '[512, 256]', 'dropout': 0.20765640507727598, 'batch_norm': True, 'lr': 0.0002956655713605834, 'weight_decay': 0.00011624774129089632, 'epochs': 66, 'loss': 'mse', 'optimizer': 'adam', 'graph_mode': 'cutoff', 'cutoff': 0.44241104106561735, 'grm_norm': 'cosine_then_gcn', 'self_loops': True, 'use_snp_selection': False}. Best is trial 45 with value: 0.09999459353692468.
[I 2025-11-03 13:42:03,737] Trial 124 finished with value: 0.07440154664403364 and parameters: {'model_type': 'gcn', 'hidden_dims': '[512, 256]', 'dropout': 0.14160501143852977, 'batch_norm': True, 'lr': 0.0004829260214767827, 'weight_decay': 4.8565450747816954e-05, 'epochs': 313, 'loss': 'mse', 'optimizer': 'adam', 'graph_mode': 'cutoff', 'cutoff': 0.44127010986350806, 'grm_norm': 'cosine_then_gcn', 'self_loops': True, 'use_snp_selection': False}. Best is trial 45 with value: 0.09999459353692468.
[I 2025-11-03 13:42:05,105] Trial 125 finished with value: 0.08398771828307744 and parameters: {'model_type': 'gcn', 'hidden_dims': '[512, 256]', 'dropout': 0.11943762383720406, 'batch_norm': True, 'lr': 0.00031191305434977233, 'weight_decay': 0.00011557793284121734, 'epochs': 7, 'loss': 'mse', 'optimizer': 'adam', 'graph_mode': 'cutoff', 'cutoff': 0.40962572040691586, 'grm_norm': 'cosine_then_gcn', 'self_loops': True, 'use_snp_selection': False}. Best is trial 45 with value: 0.09999459353692468.
[I 2025-11-03 13:42:08,373] Trial 126 finished with value: 0.06905124914346984 and parameters: {'model_type': 'gcn', 'hidden_dims': '[512, 256]', 'dropout': 0.10079362737987002, 'batch_norm': True, 'lr': 0.00061658837451591, 'weight_decay': 0.00012937953945177315, 'epochs': 340, 'loss': 'mse', 'optimizer': 'adam', 'graph_mode': 'cutoff', 'cutoff': 0.4318423758013852, 'grm_norm': 'cosine', 'self_loops': True, 'use_snp_selection': False}. Best is trial 45 with value: 0.09999459353692468.
[I 2025-11-03 13:42:10,685] Trial 127 finished with value: 0.050399356222760976 and parameters: {'model_type': 'gcn', 'hidden_dims': '[512, 128]', 'dropout': 0.12740435889354687, 'batch_norm': False, 'lr': 0.00041864869772582165, 'weight_decay': 7.833784043380662e-05, 'epochs': 187, 'loss': 'mse', 'optimizer': 'adam', 'graph_mode': 'cutoff', 'cutoff': 0.3884253460153917, 'grm_norm': 'cosine_then_gcn', 'self_loops': True, 'use_snp_selection': True, 'num_snps': 23439}. Best is trial 45 with value: 0.09999459353692468.
[I 2025-11-03 13:42:12,941] Trial 128 finished with value: 0.08557870288617804 and parameters: {'model_type': 'gcn', 'hidden_dims': '[256, 128, 64]', 'dropout': 0.2819748257163462, 'batch_norm': True, 'lr': 0.0008787622564400089, 'weight_decay': 0.0001055980111578535, 'epochs': 235, 'loss': 'mse', 'optimizer': 'adam', 'graph_mode': 'cutoff', 'cutoff': 0.37025274449383877, 'grm_norm': 'cosine_then_gcn', 'self_loops': True, 'use_snp_selection': False}. Best is trial 45 with value: 0.09999459353692468.
[I 2025-11-03 13:42:15,304] Trial 129 finished with value: 0.06427540320777785 and parameters: {'model_type': 'gcn', 'hidden_dims': '[512, 64]', 'dropout': 0.1565654525422766, 'batch_norm': True, 'lr': 0.0003468017580847951, 'weight_decay': 6.522606306184462e-05, 'epochs': 179, 'loss': 'mse', 'optimizer': 'adam', 'graph_mode': 'knn', 'source': 'grm', 'knn_k': 4, 'weighted_edges': True, 'symmetrize_mode': 'union', 'use_snp_selection': False}. Best is trial 45 with value: 0.09999459353692468.
[I 2025-11-03 13:42:17,138] Trial 130 finished with value: 0.08335263425091471 and parameters: {'model_type': 'gcn', 'hidden_dims': '[512, 256]', 'dropout': 0.21302571133181805, 'batch_norm': True, 'lr': 0.0005234205083457656, 'weight_decay': 0.0006551251156077058, 'epochs': 93, 'loss': 'mae', 'optimizer': 'adam', 'graph_mode': 'cutoff', 'cutoff': 0.6416669751444778, 'grm_norm': 'gcn', 'self_loops': True, 'use_snp_selection': False}. Best is trial 45 with value: 0.09999459353692468.
[I 2025-11-03 13:42:18,746] Trial 131 finished with value: 0.06204251273699102 and parameters: {'model_type': 'gcn', 'hidden_dims': '[512, 256]', 'dropout': 0.18225855423914059, 'batch_norm': True, 'lr': 0.0002840578320265562, 'weight_decay': 0.000206090097567868, 'epochs': 49, 'loss': 'mse', 'optimizer': 'adam', 'graph_mode': 'cutoff', 'cutoff': 0.6092926545692916, 'grm_norm': 'cosine_then_gcn', 'self_loops': True, 'use_snp_selection': False}. Best is trial 45 with value: 0.09999459353692468.
[I 2025-11-03 13:42:21,226] Trial 132 finished with value: 0.09294949297919657 and parameters: {'model_type': 'gcn', 'hidden_dims': '[512, 256]', 'dropout': 0.17073980839256367, 'batch_norm': True, 'lr': 0.0007433173612254283, 'weight_decay': 0.00017364953022347394, 'epochs': 207, 'loss': 'mse', 'optimizer': 'adam', 'graph_mode': 'cutoff', 'cutoff': 0.5643002184296071, 'grm_norm': 'cosine_then_gcn', 'self_loops': True, 'use_snp_selection': False}. Best is trial 45 with value: 0.09999459353692468.
[I 2025-11-03 13:42:23,697] Trial 133 finished with value: 0.09718408224538805 and parameters: {'model_type': 'gcn', 'hidden_dims': '[512, 256]', 'dropout': 0.13602164097180625, 'batch_norm': True, 'lr': 0.0007092046657450373, 'weight_decay': 0.00017110975347650126, 'epochs': 205, 'loss': 'mse', 'optimizer': 'adam', 'graph_mode': 'cutoff', 'cutoff': 0.5438949069868628, 'grm_norm': 'cosine_then_gcn', 'self_loops': True, 'use_snp_selection': False}. Best is trial 45 with value: 0.09999459353692468.
[I 2025-11-03 13:42:26,102] Trial 134 finished with value: 0.08599960029189153 and parameters: {'model_type': 'gcn', 'hidden_dims': '[512, 256]', 'dropout': 0.43073528789836146, 'batch_norm': True, 'lr': 0.0007279358188597238, 'weight_decay': 0.00017149475301255821, 'epochs': 192, 'loss': 'mse', 'optimizer': 'adam', 'graph_mode': 'cutoff', 'cutoff': 0.547751904556629, 'grm_norm': 'cosine_then_gcn', 'self_loops': False, 'use_snp_selection': False}. Best is trial 45 with value: 0.09999459353692468.
[I 2025-11-03 13:42:28,582] Trial 135 finished with value: 0.08300718862928717 and parameters: {'model_type': 'gcn', 'hidden_dims': '[512, 256]', 'dropout': 0.17065815713185636, 'batch_norm': True, 'lr': 0.0006238771223338438, 'weight_decay': 0.00015959302794215887, 'epochs': 207, 'loss': 'mse', 'optimizer': 'adam', 'graph_mode': 'cutoff', 'cutoff': 0.5365171762676462, 'grm_norm': 'cosine_then_gcn', 'self_loops': True, 'use_snp_selection': False}. Best is trial 45 with value: 0.09999459353692468.
[I 2025-11-03 13:42:30,270] Trial 136 finished with value: 0.08020084095012672 and parameters: {'model_type': 'gcn', 'hidden_dims': '[128, 64]', 'dropout': 0.13285515313002538, 'batch_norm': True, 'lr': 0.00044898368733245736, 'weight_decay': 0.0001285712222584259, 'epochs': 218, 'loss': 'mse', 'optimizer': 'adam', 'graph_mode': 'cutoff', 'cutoff': 0.4952076834231732, 'grm_norm': 'cosine_then_gcn', 'self_loops': True, 'use_snp_selection': False}. Best is trial 45 with value: 0.09999459353692468.
[I 2025-11-03 13:42:32,712] Trial 137 finished with value: 0.061669728106686326 and parameters: {'model_type': 'gcn', 'hidden_dims': '[512, 256]', 'dropout': 0.5823058856791585, 'batch_norm': True, 'lr': 0.0005699440632883706, 'weight_decay': 9.599577699342502e-05, 'epochs': 200, 'loss': 'mse', 'optimizer': 'adam', 'graph_mode': 'cutoff', 'cutoff': 0.5904836048115611, 'grm_norm': 'cosine_then_gcn', 'self_loops': True, 'use_snp_selection': False}. Best is trial 45 with value: 0.09999459353692468.
[I 2025-11-03 13:42:34,977] Trial 138 finished with value: 0.09170187476329689 and parameters: {'model_type': 'gcn', 'hidden_dims': '[512, 256]', 'dropout': 0.14843506644076743, 'batch_norm': True, 'lr': 0.00037118327747049496, 'weight_decay': 0.00028949174815728635, 'epochs': 169, 'loss': 'mse', 'optimizer': 'adam', 'graph_mode': 'cutoff', 'cutoff': 0.5233857612410137, 'grm_norm': 'cosine', 'self_loops': True, 'use_snp_selection': False}. Best is trial 45 with value: 0.09999459353692468.
[I 2025-11-03 13:42:37,249] Trial 139 finished with value: 0.0698926796352225 and parameters: {'model_type': 'gcn', 'hidden_dims': '[512, 256]', 'dropout': 0.3668371050105948, 'batch_norm': True, 'lr': 0.0003692095751244723, 'weight_decay': 0.00025058948840343473, 'epochs': 172, 'loss': 'mse', 'optimizer': 'adam', 'graph_mode': 'cutoff', 'cutoff': 0.5132037227699817, 'grm_norm': 'cosine', 'self_loops': True, 'use_snp_selection': False}. Best is trial 45 with value: 0.09999459353692468.
[I 2025-11-03 13:42:39,580] Trial 140 finished with value: 0.08671642196655513 and parameters: {'model_type': 'gcn', 'hidden_dims': '[512, 256]', 'dropout': 0.20264948340130284, 'batch_norm': True, 'lr': 0.00020203301259659844, 'weight_decay': 0.0003148279514179392, 'epochs': 181, 'loss': 'mse', 'optimizer': 'adam', 'graph_mode': 'cutoff', 'cutoff': 0.5640163003748, 'grm_norm': 'cosine', 'self_loops': True, 'use_snp_selection': False}. Best is trial 45 with value: 0.09999459353692468.
[I 2025-11-03 13:42:41,934] Trial 141 finished with value: 0.0816283232481369 and parameters: {'model_type': 'gcn', 'hidden_dims': '[512, 256]', 'dropout': 0.15031227149556597, 'batch_norm': True, 'lr': 0.00020958264694612892, 'weight_decay': 0.00030717522582965974, 'epochs': 185, 'loss': 'mse', 'optimizer': 'adam', 'graph_mode': 'cutoff', 'cutoff': 0.5612210194548922, 'grm_norm': 'cosine', 'self_loops': True, 'use_snp_selection': False}. Best is trial 45 with value: 0.09999459353692468.
[I 2025-11-03 13:42:44,324] Trial 142 finished with value: 0.08993350033667023 and parameters: {'model_type': 'gcn', 'hidden_dims': '[512, 256]', 'dropout': 0.16036385640292894, 'batch_norm': True, 'lr': 0.0001651914247432888, 'weight_decay': 0.00018400697720224337, 'epochs': 192, 'loss': 'mse', 'optimizer': 'adam', 'graph_mode': 'cutoff', 'cutoff': 0.5277853530173459, 'grm_norm': 'cosine', 'self_loops': True, 'use_snp_selection': False}. Best is trial 45 with value: 0.09999459353692468.
[I 2025-11-03 13:42:46,788] Trial 143 finished with value: 0.09042146424592577 and parameters: {'model_type': 'gcn', 'hidden_dims': '[512, 256]', 'dropout': 0.166401441866039, 'batch_norm': True, 'lr': 0.00015963632109939049, 'weight_decay': 0.00018643854879920953, 'epochs': 204, 'loss': 'mse', 'optimizer': 'adam', 'graph_mode': 'cutoff', 'cutoff': 0.5253164632315845, 'grm_norm': 'cosine', 'self_loops': True, 'use_snp_selection': False}. Best is trial 45 with value: 0.09999459353692468.
[I 2025-11-03 13:42:49,224] Trial 144 finished with value: 0.07392792129656169 and parameters: {'model_type': 'gcn', 'hidden_dims': '[512, 256]', 'dropout': 0.15959696436861756, 'batch_norm': True, 'lr': 0.00014387877862209422, 'weight_decay': 0.0002048612903061346, 'epochs': 205, 'loss': 'mse', 'optimizer': 'adam', 'graph_mode': 'cutoff', 'cutoff': 0.5281452611759586, 'grm_norm': 'cosine', 'self_loops': True, 'use_snp_selection': False}. Best is trial 45 with value: 0.09999459353692468.
[I 2025-11-03 13:42:51,727] Trial 145 finished with value: 0.08730471214883373 and parameters: {'model_type': 'gcn', 'hidden_dims': '[512, 256]', 'dropout': 0.17392367442248113, 'batch_norm': True, 'lr': 0.0009839484950929904, 'weight_decay': 0.00019089254331500433, 'epochs': 217, 'loss': 'mse', 'optimizer': 'adam', 'graph_mode': 'cutoff', 'cutoff': 0.5456485245412924, 'grm_norm': 'cosine', 'self_loops': True, 'use_snp_selection': False}. Best is trial 45 with value: 0.09999459353692468.
[I 2025-11-03 13:42:54,095] Trial 146 finished with value: 0.08276512228145763 and parameters: {'model_type': 'gcn', 'hidden_dims': '[512, 128]', 'dropout': 0.19539729763460123, 'batch_norm': True, 'lr': 0.00023555200497130886, 'weight_decay': 0.00014920566634339487, 'epochs': 193, 'loss': 'mse', 'optimizer': 'adam', 'graph_mode': 'cutoff', 'cutoff': 0.583038815368327, 'grm_norm': 'cosine', 'self_loops': True, 'use_snp_selection': False}. Best is trial 45 with value: 0.09999459353692468.
[I 2025-11-03 13:42:56,548] Trial 147 finished with value: 0.007370138521813331 and parameters: {'model_type': 'gcn', 'hidden_dims': '[512, 256]', 'dropout': 0.12321829000190813, 'batch_norm': True, 'lr': 2.0449311302084903e-05, 'weight_decay': 0.0002594747143519154, 'epochs': 199, 'loss': 'mse', 'optimizer': 'adam', 'graph_mode': 'knn', 'source': 'grm', 'knn_k': 6, 'weighted_edges': False, 'symmetrize_mode': 'mutual', 'use_snp_selection': False}. Best is trial 45 with value: 0.09999459353692468.
[I 2025-11-03 13:42:58,572] Trial 148 finished with value: 0.05931970242858516 and parameters: {'model_type': 'gcn', 'hidden_dims': '[256, 128]', 'dropout': 0.1488279980070319, 'batch_norm': True, 'lr': 0.00015731767811385638, 'weight_decay': 0.0002183242595363615, 'epochs': 251, 'loss': 'mse', 'optimizer': 'adam', 'graph_mode': 'cutoff', 'cutoff': 0.4717172960779047, 'grm_norm': 'cosine', 'self_loops': True, 'use_snp_selection': False}. Best is trial 45 with value: 0.09999459353692468.
[I 2025-11-03 13:43:01,204] Trial 149 finished with value: 0.07432233920285536 and parameters: {'model_type': 'gcn', 'hidden_dims': '[512, 256]', 'dropout': 0.16890960653765405, 'batch_norm': True, 'lr': 0.0002897814327191588, 'weight_decay': 0.00017823763898765528, 'epochs': 241, 'loss': 'mse', 'optimizer': 'adam', 'graph_mode': 'cutoff', 'cutoff': 0.521852902700374, 'grm_norm': 'cosine', 'self_loops': True, 'use_snp_selection': False}. Best is trial 45 with value: 0.09999459353692468.
[I 2025-11-03 13:43:03,228] Trial 0 finished with value: -0.006742303844198149 and parameters: {'model_type': 'gcn', 'hidden_dims': '[128, 64]', 'dropout': 0.199031432379812, 'batch_norm': True, 'lr': 1.8408544111075837e-06, 'weight_decay': 5.5136510071208614e-05, 'epochs': 334, 'loss': 'mae', 'optimizer': 'adam', 'graph_mode': 'knn', 'source': 'grm', 'knn_k': 8, 'weighted_edges': True, 'symmetrize_mode': 'mutual', 'use_snp_selection': False}. Best is trial 0 with value: -0.006742303844198149.
[I 2025-11-03 13:43:04,349] Trial 1 finished with value: -0.020505561388114914 and parameters: {'model_type': 'gcn', 'hidden_dims': '[128, 64]', 'dropout': 0.40051947670227217, 'batch_norm': True, 'lr': 0.0005320428882732732, 'weight_decay': 1.89210117736594e-06, 'epochs': 32, 'loss': 'mse', 'optimizer': 'adam', 'graph_mode': 'knn', 'source': 'grm', 'knn_k': 7, 'weighted_edges': True, 'symmetrize_mode': 'union', 'use_snp_selection': False}. Best is trial 0 with value: -0.006742303844198149.
[I 2025-11-03 13:43:06,489] Trial 2 finished with value: -0.0177346145546836 and parameters: {'model_type': 'gcn', 'hidden_dims': '[256, 128]', 'dropout': 0.5105528289184642, 'batch_norm': False, 'lr': 0.0006804279372404962, 'weight_decay': 0.0008922815224257085, 'epochs': 160, 'loss': 'mse', 'optimizer': 'adam', 'graph_mode': 'cutoff', 'cutoff': 0.5741905641612706, 'grm_norm': 'gcn', 'self_loops': False, 'use_snp_selection': True, 'num_snps': 26910}. Best is trial 0 with value: -0.006742303844198149.
[I 2025-11-03 13:43:08,708] Trial 3 finished with value: 0.04364984953624081 and parameters: {'model_type': 'gcn', 'hidden_dims': '[256, 128, 64]', 'dropout': 0.5390483213624292, 'batch_norm': False, 'lr': 3.4705625989073525e-05, 'weight_decay': 2.4623319020131338e-05, 'epochs': 92, 'loss': 'mse', 'optimizer': 'adam', 'graph_mode': 'knn', 'source': 'grm', 'knn_k': 6, 'weighted_edges': False, 'symmetrize_mode': 'mutual', 'use_snp_selection': True, 'num_snps': 30713}. Best is trial 3 with value: 0.04364984953624081.
[I 2025-11-03 13:43:10,986] Trial 4 finished with value: -0.03320751027500668 and parameters: {'model_type': 'gcn', 'hidden_dims': '[128, 64]', 'dropout': 0.13404863676897502, 'batch_norm': False, 'lr': 0.0001431556295367288, 'weight_decay': 2.2084517750726675e-05, 'epochs': 13, 'loss': 'mae', 'optimizer': 'adam', 'graph_mode': 'cutoff', 'cutoff': 0.6714268476993044, 'grm_norm': 'none', 'self_loops': False, 'use_snp_selection': True, 'num_snps': 45645}. Best is trial 3 with value: 0.04364984953624081.
[I 2025-11-03 13:43:13,682] Trial 5 finished with value: 0.008493570449564967 and parameters: {'model_type': 'gcn', 'hidden_dims': '[256, 128]', 'dropout': 0.42253606323412096, 'batch_norm': False, 'lr': 4.238630400638805e-05, 'weight_decay': 8.074086040046576e-07, 'epochs': 134, 'loss': 'mae', 'optimizer': 'adam', 'graph_mode': 'knn', 'source': 'grm', 'knn_k': 1, 'weighted_edges': False, 'symmetrize_mode': 'mutual', 'use_snp_selection': True, 'num_snps': 43113}. Best is trial 3 with value: 0.04364984953624081.
[I 2025-11-03 13:43:16,209] Trial 6 finished with value: 0.044566246447544394 and parameters: {'model_type': 'gcn', 'hidden_dims': '[512, 256]', 'dropout': 0.3534893146320237, 'batch_norm': True, 'lr': 0.000251307964226932, 'weight_decay': 1.821819791794022e-05, 'epochs': 207, 'loss': 'mae', 'optimizer': 'adam', 'graph_mode': 'knn', 'source': 'grm', 'knn_k': 1, 'weighted_edges': True, 'symmetrize_mode': 'mutual', 'use_snp_selection': False}. Best is trial 6 with value: 0.044566246447544394.
[I 2025-11-03 13:43:18,427] Trial 7 finished with value: -0.01743194507980433 and parameters: {'model_type': 'gcn', 'hidden_dims': '[512, 256]', 'dropout': 0.1105825955860775, 'batch_norm': True, 'lr': 2.374338412754043e-05, 'weight_decay': 1.1284721123340274e-05, 'epochs': 170, 'loss': 'mse', 'optimizer': 'adam', 'graph_mode': 'cutoff', 'cutoff': 0.719872204109604, 'grm_norm': 'gcn', 'self_loops': False, 'use_snp_selection': False}. Best is trial 6 with value: 0.044566246447544394.
[I 2025-11-03 13:43:20,200] Trial 8 finished with value: 0.022850599196099917 and parameters: {'model_type': 'gcn', 'hidden_dims': '[512, 128]', 'dropout': 0.5066580418354021, 'batch_norm': True, 'lr': 0.00039213678276659976, 'weight_decay': 3.43655320802934e-06, 'epochs': 91, 'loss': 'mse', 'optimizer': 'adam', 'graph_mode': 'cutoff', 'cutoff': 0.34923059576505366, 'grm_norm': 'cosine', 'self_loops': True, 'use_snp_selection': False}. Best is trial 6 with value: 0.044566246447544394.
[I 2025-11-03 13:43:21,830] Trial 9 finished with value: -0.002561902845349425 and parameters: {'model_type': 'gcn', 'hidden_dims': '[512, 256]', 'dropout': 0.301734920240333, 'batch_norm': False, 'lr': 6.650961854953448e-06, 'weight_decay': 6.861575656590315e-05, 'epochs': 125, 'loss': 'mae', 'optimizer': 'adam', 'graph_mode': 'cutoff', 'cutoff': 0.2857569870061939, 'grm_norm': 'cosine_then_gcn', 'self_loops': False, 'use_snp_selection': True, 'num_snps': 12722}. Best is trial 6 with value: 0.044566246447544394.
[I 2025-11-03 13:43:24,640] Trial 10 finished with value: 0.05333011221906296 and parameters: {'model_type': 'gcn', 'hidden_dims': '[512, 64]', 'dropout': 0.2833599465317005, 'batch_norm': True, 'lr': 0.00016916760584270694, 'weight_decay': 1.7866650996308468e-07, 'epochs': 266, 'loss': 'mae', 'optimizer': 'adam', 'graph_mode': 'knn', 'source': 'grm', 'knn_k': 1, 'weighted_edges': True, 'symmetrize_mode': 'union', 'use_snp_selection': False}. Best is trial 10 with value: 0.05333011221906296.
[I 2025-11-03 13:43:27,449] Trial 11 finished with value: 0.04439924883335609 and parameters: {'model_type': 'gcn', 'hidden_dims': '[512, 64]', 'dropout': 0.2859699507705008, 'batch_norm': True, 'lr': 0.00012623783700890367, 'weight_decay': 1.6805209943987688e-07, 'epochs': 265, 'loss': 'mae', 'optimizer': 'adam', 'graph_mode': 'knn', 'source': 'grm', 'knn_k': 1, 'weighted_edges': True, 'symmetrize_mode': 'union', 'use_snp_selection': False}. Best is trial 10 with value: 0.05333011221906296.
