[I 2025-11-03 13:48:50,445] Trial 143 finished with value: -0.001393180789940403 and parameters: {'model_type': 'graphsage', 'hidden_dims': '[512, 128]', 'dropout': 0.3804556013177883, 'batch_norm': False, 'lr': 4.075576668015264e-06, 'weight_decay': 1.2159935861441378e-06, 'epochs': 58, 'loss': 'mse', 'optimizer': 'adam', 'graph_mode': 'cutoff', 'cutoff': 0.7213821042345832, 'grm_norm': 'none', 'self_loops': True, 'use_snp_selection': True, 'num_snps': 3383}. Best is trial 14 with value: 0.07089940486947045.
[I 2025-11-03 13:48:53,373] Trial 144 finished with value: 0.04733307610052814 and parameters: {'model_type': 'graphsage', 'hidden_dims': '[512, 128]', 'dropout': 0.3361839303872266, 'batch_norm': False, 'lr': 3.3996668167021566e-06, 'weight_decay': 1.5079444096255792e-06, 'epochs': 286, 'loss': 'mse', 'optimizer': 'adam', 'graph_mode': 'cutoff', 'cutoff': 0.746386103167315, 'grm_norm': 'none', 'self_loops': True, 'use_snp_selection': True, 'num_snps': 16952}. Best is trial 14 with value: 0.07089940486947045.
[I 2025-11-03 13:48:59,172] Trial 145 finished with value: 0.01620272079240203 and parameters: {'model_type': 'graphsage', 'hidden_dims': '[512, 128]', 'dropout': 0.41446962192161885, 'batch_norm': False, 'lr': 8.769803208106574e-05, 'weight_decay': 2.118204987521018e-06, 'epochs': 295, 'loss': 'mse', 'optimizer': 'adam', 'graph_mode': 'cutoff', 'cutoff': 0.7660050753488038, 'grm_norm': 'none', 'self_loops': True, 'use_snp_selection': True, 'num_snps': 48076}. Best is trial 14 with value: 0.07089940486947045.
[I 2025-11-03 13:49:01,607] Trial 146 finished with value: 0.04041492999937084 and parameters: {'model_type': 'graphsage', 'hidden_dims': '[512, 64]', 'dropout': 0.22970644806870094, 'batch_norm': False, 'lr': 5.807300643425136e-06, 'weight_decay': 1.1366861590241439e-07, 'epochs': 273, 'loss': 'mse', 'optimizer': 'adam', 'graph_mode': 'cutoff', 'cutoff': 0.6831355864135843, 'grm_norm': 'none', 'self_loops': False, 'use_snp_selection': True, 'num_snps': 7490}. Best is trial 14 with value: 0.07089940486947045.
[I 2025-11-03 13:49:04,362] Trial 147 finished with value: 0.030573475904618824 and parameters: {'model_type': 'graphsage', 'hidden_dims': '[512, 128]', 'dropout': 0.35814091299119044, 'batch_norm': False, 'lr': 8.133121343562502e-06, 'weight_decay': 5.997674184919959e-07, 'epochs': 102, 'loss': 'mse', 'optimizer': 'adam', 'graph_mode': 'knn', 'source': 'grm', 'knn_k': 7, 'weighted_edges': False, 'symmetrize_mode': 'mutual', 'use_snp_selection': True, 'num_snps': 20868}. Best is trial 14 with value: 0.07089940486947045.
[I 2025-11-03 13:49:06,078] Trial 148 finished with value: 0.005201666514330288 and parameters: {'model_type': 'graphsage', 'hidden_dims': '[512, 256]', 'dropout': 0.3735962657932195, 'batch_norm': False, 'lr': 2.938812035007681e-06, 'weight_decay': 2.534924972138345e-07, 'epochs': 117, 'loss': 'mse', 'optimizer': 'adam', 'graph_mode': 'cutoff', 'cutoff': 0.42213788325151147, 'grm_norm': 'none', 'self_loops': True, 'use_snp_selection': True, 'num_snps': 3431}. Best is trial 14 with value: 0.07089940486947045.
[I 2025-11-03 13:49:09,540] Trial 149 finished with value: -0.03454547910498327 and parameters: {'model_type': 'graphsage', 'hidden_dims': '[512, 128]', 'dropout': 0.2398617312134546, 'batch_norm': False, 'lr': 0.0001954536625043789, 'weight_decay': 3.586423970713337e-07, 'epochs': 46, 'loss': 'mse', 'optimizer': 'adam', 'graph_mode': 'cutoff', 'cutoff': 0.7355134045713069, 'grm_norm': 'none', 'self_loops': False, 'use_snp_selection': True, 'num_snps': 42021}. Best is trial 14 with value: 0.07089940486947045.
[I 2025-11-03 13:49:12,200] Trial 0 finished with value: 0.02735091593516066 and parameters: {'model_type': 'graphsage', 'hidden_dims': '[128, 64]', 'dropout': 0.199031432379812, 'batch_norm': True, 'lr': 1.8408544111075837e-06, 'weight_decay': 5.5136510071208614e-05, 'epochs': 336, 'loss': 'mae', 'optimizer': 'adam', 'graph_mode': 'knn', 'source': 'grm', 'knn_k': 8, 'weighted_edges': True, 'symmetrize_mode': 'mutual', 'use_snp_selection': False}. Best is trial 0 with value: 0.02735091593516066.
[I 2025-11-03 13:49:13,765] Trial 1 finished with value: 0.05621664092768359 and parameters: {'model_type': 'graphsage', 'hidden_dims': '[128, 64]', 'dropout': 0.40051947670227217, 'batch_norm': True, 'lr': 0.0005320428882732732, 'weight_decay': 1.89210117736594e-06, 'epochs': 68, 'loss': 'mse', 'optimizer': 'adam', 'graph_mode': 'knn', 'source': 'grm', 'knn_k': 7, 'weighted_edges': True, 'symmetrize_mode': 'union', 'use_snp_selection': False}. Best is trial 1 with value: 0.05621664092768359.
[I 2025-11-03 13:49:16,403] Trial 2 finished with value: 0.013971744632692832 and parameters: {'model_type': 'graphsage', 'hidden_dims': '[256, 128]', 'dropout': 0.5105528289184642, 'batch_norm': False, 'lr': 0.0006804279372404962, 'weight_decay': 0.0008922815224257085, 'epochs': 181, 'loss': 'mse', 'optimizer': 'adam', 'graph_mode': 'cutoff', 'cutoff': 0.5741905641612706, 'grm_norm': 'gcn', 'self_loops': False, 'use_snp_selection': True, 'num_snps': 26910}. Best is trial 1 with value: 0.05621664092768359.
[I 2025-11-03 13:49:19,211] Trial 3 finished with value: 0.03399189745719008 and parameters: {'model_type': 'graphsage', 'hidden_dims': '[256, 128, 64]', 'dropout': 0.5390483213624292, 'batch_norm': False, 'lr': 3.4705625989073525e-05, 'weight_decay': 2.4623319020131338e-05, 'epochs': 121, 'loss': 'mse', 'optimizer': 'adam', 'graph_mode': 'knn', 'source': 'grm', 'knn_k': 6, 'weighted_edges': False, 'symmetrize_mode': 'mutual', 'use_snp_selection': True, 'num_snps': 30713}. Best is trial 1 with value: 0.05621664092768359.
[I 2025-11-03 13:49:21,898] Trial 4 finished with value: 0.009263970143604177 and parameters: {'model_type': 'graphsage', 'hidden_dims': '[128, 64]', 'dropout': 0.13404863676897502, 'batch_norm': False, 'lr': 0.0001431556295367288, 'weight_decay': 2.2084517750726675e-05, 'epochs': 51, 'loss': 'mae', 'optimizer': 'adam', 'graph_mode': 'cutoff', 'cutoff': 0.6714268476993044, 'grm_norm': 'none', 'self_loops': False, 'use_snp_selection': True, 'num_snps': 45645}. Best is trial 1 with value: 0.05621664092768359.
[I 2025-11-03 13:49:25,152] Trial 5 finished with value: 0.009099593642173116 and parameters: {'model_type': 'graphsage', 'hidden_dims': '[256, 128]', 'dropout': 0.42253606323412096, 'batch_norm': False, 'lr': 4.238630400638805e-05, 'weight_decay': 8.074086040046576e-07, 'epochs': 158, 'loss': 'mae', 'optimizer': 'adam', 'graph_mode': 'knn', 'source': 'grm', 'knn_k': 1, 'weighted_edges': False, 'symmetrize_mode': 'mutual', 'use_snp_selection': True, 'num_snps': 43113}. Best is trial 1 with value: 0.05621664092768359.
[I 2025-11-03 13:49:29,251] Trial 6 finished with value: 0.0243539860456417 and parameters: {'model_type': 'graphsage', 'hidden_dims': '[512, 256]', 'dropout': 0.3534893146320237, 'batch_norm': True, 'lr': 0.000251307964226932, 'weight_decay': 1.821819791794022e-05, 'epochs': 223, 'loss': 'mae', 'optimizer': 'adam', 'graph_mode': 'knn', 'source': 'grm', 'knn_k': 1, 'weighted_edges': True, 'symmetrize_mode': 'mutual', 'use_snp_selection': False}. Best is trial 1 with value: 0.05621664092768359.
[I 2025-11-03 13:49:32,987] Trial 7 finished with value: 0.03347920539015589 and parameters: {'model_type': 'graphsage', 'hidden_dims': '[512, 256]', 'dropout': 0.1105825955860775, 'batch_norm': True, 'lr': 2.374338412754043e-05, 'weight_decay': 1.1284721123340274e-05, 'epochs': 190, 'loss': 'mse', 'optimizer': 'adam', 'graph_mode': 'cutoff', 'cutoff': 0.719872204109604, 'grm_norm': 'gcn', 'self_loops': False, 'use_snp_selection': False}. Best is trial 1 with value: 0.05621664092768359.
[I 2025-11-03 13:49:36,138] Trial 8 finished with value: 0.06056973258173749 and parameters: {'model_type': 'graphsage', 'hidden_dims': '[512, 128]', 'dropout': 0.5066580418354021, 'batch_norm': True, 'lr': 0.00039213678276659976, 'weight_decay': 3.43655320802934e-06, 'epochs': 120, 'loss': 'mse', 'optimizer': 'adam', 'graph_mode': 'cutoff', 'cutoff': 0.34923059576505366, 'grm_norm': 'cosine', 'self_loops': True, 'use_snp_selection': False}. Best is trial 8 with value: 0.06056973258173749.
[I 2025-11-03 13:49:38,291] Trial 9 finished with value: 0.04339916918163713 and parameters: {'model_type': 'graphsage', 'hidden_dims': '[512, 256]', 'dropout': 0.301734920240333, 'batch_norm': False, 'lr': 6.650961854953448e-06, 'weight_decay': 6.861575656590315e-05, 'epochs': 150, 'loss': 'mae', 'optimizer': 'adam', 'graph_mode': 'cutoff', 'cutoff': 0.2857569870061939, 'grm_norm': 'cosine_then_gcn', 'self_loops': False, 'use_snp_selection': True, 'num_snps': 12722}. Best is trial 8 with value: 0.06056973258173749.
[I 2025-11-03 13:49:42,794] Trial 10 finished with value: 0.03392239985017263 and parameters: {'model_type': 'graphsage', 'hidden_dims': '[512, 128]', 'dropout': 0.5885461262002587, 'batch_norm': True, 'lr': 0.0001051230339774825, 'weight_decay': 1.3387352389235743e-07, 'epochs': 258, 'loss': 'mse', 'optimizer': 'adam', 'graph_mode': 'cutoff', 'cutoff': 0.2684196492120865, 'grm_norm': 'cosine', 'self_loops': True, 'use_snp_selection': False}. Best is trial 8 with value: 0.06056973258173749.
[I 2025-11-03 13:49:45,637] Trial 11 finished with value: 0.07265357940871359 and parameters: {'model_type': 'graphsage', 'hidden_dims': '[512, 64]', 'dropout': 0.4214049075657615, 'batch_norm': True, 'lr': 0.0008079808143806397, 'weight_decay': 1.8187594072837697e-06, 'epochs': 60, 'loss': 'mse', 'optimizer': 'adam', 'graph_mode': 'knn', 'source': 'grm', 'knn_k': 10, 'weighted_edges': True, 'symmetrize_mode': 'union', 'use_snp_selection': False}. Best is trial 11 with value: 0.07265357940871359.
[I 2025-11-03 13:49:48,944] Trial 12 finished with value: 0.043987075896533355 and parameters: {'model_type': 'graphsage', 'hidden_dims': '[512, 64]', 'dropout': 0.4711513540165387, 'batch_norm': True, 'lr': 0.0005941284936785953, 'weight_decay': 1.5741178562840553e-06, 'epochs': 98, 'loss': 'mse', 'optimizer': 'adam', 'graph_mode': 'knn', 'source': 'grm', 'knn_k': 10, 'weighted_edges': True, 'symmetrize_mode': 'union', 'use_snp_selection': False}. Best is trial 11 with value: 0.07265357940871359.
[I 2025-11-03 13:49:51,905] Trial 13 finished with value: 0.06217520247040585 and parameters: {'model_type': 'graphsage', 'hidden_dims': '[512, 64]', 'dropout': 0.28845157379465514, 'batch_norm': True, 'lr': 0.0009956721055247285, 'weight_decay': 3.87720151008303e-07, 'epochs': 100, 'loss': 'mse', 'optimizer': 'adam', 'graph_mode': 'cutoff', 'cutoff': 0.420546049563004, 'grm_norm': 'cosine', 'self_loops': True, 'use_snp_selection': False}. Best is trial 11 with value: 0.07265357940871359.
[I 2025-11-03 13:49:54,582] Trial 14 finished with value: 0.054801152353508464 and parameters: {'model_type': 'graphsage', 'hidden_dims': '[512, 64]', 'dropout': 0.2701641409826525, 'batch_norm': True, 'lr': 0.0008771854001626236, 'weight_decay': 1.3375124728893317e-07, 'epochs': 46, 'loss': 'mse', 'optimizer': 'adam', 'graph_mode': 'knn', 'source': 'grm', 'knn_k': 10, 'weighted_edges': True, 'symmetrize_mode': 'union', 'use_snp_selection': False}. Best is trial 11 with value: 0.07265357940871359.
[I 2025-11-03 13:49:57,511] Trial 15 finished with value: 0.05640442987728089 and parameters: {'model_type': 'graphsage', 'hidden_dims': '[512, 64]', 'dropout': 0.23505378091596188, 'batch_norm': True, 'lr': 0.00013271420569930736, 'weight_decay': 6.266150011769369e-07, 'epochs': 97, 'loss': 'mse', 'optimizer': 'adam', 'graph_mode': 'cutoff', 'cutoff': 0.4824114567335711, 'grm_norm': 'cosine', 'self_loops': True, 'use_snp_selection': False}. Best is trial 11 with value: 0.07265357940871359.
[I 2025-11-03 13:50:00,315] Trial 16 finished with value: 0.06457596729450499 and parameters: {'model_type': 'graphsage', 'hidden_dims': '[512, 64]', 'dropout': 0.353937621100347, 'batch_norm': True, 'lr': 9.17962440186086e-06, 'weight_decay': 3.939158144371285e-07, 'epochs': 85, 'loss': 'mse', 'optimizer': 'adam', 'graph_mode': 'cutoff', 'cutoff': 0.861335372465932, 'grm_norm': 'none', 'self_loops': True, 'use_snp_selection': False}. Best is trial 11 with value: 0.07265357940871359.
[I 2025-11-03 13:50:05,357] Trial 17 finished with value: 0.03950102189780433 and parameters: {'model_type': 'graphsage', 'hidden_dims': '[512, 64]', 'dropout': 0.3654747521278408, 'batch_norm': True, 'lr': 8.052336691989891e-06, 'weight_decay': 5.170296782239028e-06, 'epochs': 292, 'loss': 'mse', 'optimizer': 'adam', 'graph_mode': 'knn', 'source': 'grm', 'knn_k': 4, 'weighted_edges': False, 'symmetrize_mode': 'union', 'use_snp_selection': False}. Best is trial 11 with value: 0.07265357940871359.
[I 2025-11-03 13:50:07,204] Trial 18 finished with value: 0.0002589344065454185 and parameters: {'model_type': 'graphsage', 'hidden_dims': '[256, 128, 64]', 'dropout': 0.4327697433540432, 'batch_norm': True, 'lr': 1.8618683647382806e-06, 'weight_decay': 3.293863322548928e-07, 'epochs': 69, 'loss': 'mse', 'optimizer': 'adam', 'graph_mode': 'cutoff', 'cutoff': 0.8924592825697552, 'grm_norm': 'none', 'self_loops': True, 'use_snp_selection': False}. Best is trial 11 with value: 0.07265357940871359.
[I 2025-11-03 13:50:11,620] Trial 19 finished with value: 0.02658895145880072 and parameters: {'model_type': 'graphsage', 'hidden_dims': '[512, 64]', 'dropout': 0.3516424210035888, 'batch_norm': True, 'lr': 7.74108904593527e-06, 'weight_decay': 0.0004088863535682676, 'epochs': 224, 'loss': 'mse', 'optimizer': 'adam', 'graph_mode': 'knn', 'source': 'grm', 'knn_k': 4, 'weighted_edges': True, 'symmetrize_mode': 'union', 'use_snp_selection': False}. Best is trial 11 with value: 0.07265357940871359.
[I 2025-11-03 13:50:14,819] Trial 20 finished with value: 0.03749045019730827 and parameters: {'model_type': 'graphsage', 'hidden_dims': '[512, 64]', 'dropout': 0.46201114806835597, 'batch_norm': True, 'lr': 1.722172827116342e-05, 'weight_decay': 4.303705038788151e-06, 'epochs': 136, 'loss': 'mse', 'optimizer': 'adam', 'graph_mode': 'cutoff', 'cutoff': 0.8925446729019432, 'grm_norm': 'none', 'self_loops': True, 'use_snp_selection': False}. Best is trial 11 with value: 0.07265357940871359.
[I 2025-11-03 13:50:17,698] Trial 21 finished with value: 0.0426626788708017 and parameters: {'model_type': 'graphsage', 'hidden_dims': '[512, 64]', 'dropout': 0.2870023551244396, 'batch_norm': True, 'lr': 0.00025869753876340136, 'weight_decay': 4.861581582978914e-07, 'epochs': 84, 'loss': 'mse', 'optimizer': 'adam', 'graph_mode': 'cutoff', 'cutoff': 0.4106750178262556, 'grm_norm': 'cosine_then_gcn', 'self_loops': True, 'use_snp_selection': False}. Best is trial 11 with value: 0.07265357940871359.
[I 2025-11-03 13:50:20,140] Trial 22 finished with value: 0.05696459354638909 and parameters: {'model_type': 'graphsage', 'hidden_dims': '[512, 64]', 'dropout': 0.3152199043014962, 'batch_norm': True, 'lr': 3.777138440480303e-06, 'weight_decay': 2.89547975032696e-07, 'epochs': 41, 'loss': 'mse', 'optimizer': 'adam', 'graph_mode': 'cutoff', 'cutoff': 0.74249588167834, 'grm_norm': 'cosine', 'self_loops': True, 'use_snp_selection': False}. Best is trial 11 with value: 0.07265357940871359.
[I 2025-11-03 13:50:23,149] Trial 23 finished with value: 0.04361603938003624 and parameters: {'model_type': 'graphsage', 'hidden_dims': '[512, 64]', 'dropout': 0.18389395269743358, 'batch_norm': True, 'lr': 6.621046769665844e-05, 'weight_decay': 1.1376350683959151e-06, 'epochs': 108, 'loss': 'mse', 'optimizer': 'adam', 'graph_mode': 'cutoff', 'cutoff': 0.5442181429012798, 'grm_norm': 'none', 'self_loops': True, 'use_snp_selection': False}. Best is trial 11 with value: 0.07265357940871359.
[I 2025-11-03 13:50:25,921] Trial 24 finished with value: 0.0315405944841308 and parameters: {'model_type': 'graphsage', 'hidden_dims': '[512, 64]', 'dropout': 0.37567915018881964, 'batch_norm': True, 'lr': 0.0002636387678944316, 'weight_decay': 1.0553963070318878e-07, 'epochs': 76, 'loss': 'mse', 'optimizer': 'adam', 'graph_mode': 'cutoff', 'cutoff': 0.41403061137493136, 'grm_norm': 'cosine', 'self_loops': True, 'use_snp_selection': False}. Best is trial 11 with value: 0.07265357940871359.
[I 2025-11-03 13:50:29,270] Trial 25 finished with value: 0.033558418429338314 and parameters: {'model_type': 'graphsage', 'hidden_dims': '[512, 64]', 'dropout': 0.24354217626069352, 'batch_norm': True, 'lr': 0.0009781454116176084, 'weight_decay': 3.183987813969035e-07, 'epochs': 153, 'loss': 'mse', 'optimizer': 'adam', 'graph_mode': 'cutoff', 'cutoff': 0.7960249846475541, 'grm_norm': 'none', 'self_loops': True, 'use_snp_selection': False}. Best is trial 11 with value: 0.07265357940871359.
[I 2025-11-03 13:50:34,070] Trial 26 finished with value: 0.06254572507129671 and parameters: {'model_type': 'graphsage', 'hidden_dims': '[512, 128]', 'dropout': 0.3211723900663851, 'batch_norm': False, 'lr': 1.2752654892572062e-05, 'weight_decay': 2.596143875036438e-06, 'epochs': 87, 'loss': 'mae', 'optimizer': 'adam', 'graph_mode': 'knn', 'source': 'grm', 'knn_k': 8, 'weighted_edges': False, 'symmetrize_mode': 'union', 'use_snp_selection': True, 'num_snps': 59005}. Best is trial 11 with value: 0.07265357940871359.
[I 2025-11-03 13:50:38,566] Trial 27 finished with value: 0.08246652821033469 and parameters: {'model_type': 'graphsage', 'hidden_dims': '[512, 128]', 'dropout': 0.3184969027292452, 'batch_norm': False, 'lr': 1.5363646563168174e-05, 'weight_decay': 2.084472908693989e-06, 'epochs': 65, 'loss': 'mae', 'optimizer': 'adam', 'graph_mode': 'knn', 'source': 'grm', 'knn_k': 9, 'weighted_edges': False, 'symmetrize_mode': 'union', 'use_snp_selection': True, 'num_snps': 58472}. Best is trial 27 with value: 0.08246652821033469.
[I 2025-11-03 13:50:43,096] Trial 28 finished with value: 0.03243589398738174 and parameters: {'model_type': 'graphsage', 'hidden_dims': '[512, 128]', 'dropout': 0.4001580358583474, 'batch_norm': False, 'lr': 3.6419559793592984e-06, 'weight_decay': 7.126170743221581e-06, 'epochs': 59, 'loss': 'mae', 'optimizer': 'adam', 'graph_mode': 'knn', 'source': 'grm', 'knn_k': 10, 'weighted_edges': False, 'symmetrize_mode': 'union', 'use_snp_selection': True, 'num_snps': 59610}. Best is trial 27 with value: 0.08246652821033469.
[I 2025-11-03 13:50:45,898] Trial 29 finished with value: 0.05632295354555523 and parameters: {'model_type': 'graphsage', 'hidden_dims': '[512, 128]', 'dropout': 0.17494602249336066, 'batch_norm': False, 'lr': 1.16581331616947e-06, 'weight_decay': 1.0876940016115069e-06, 'epochs': 325, 'loss': 'mae', 'optimizer': 'adam', 'graph_mode': 'knn', 'source': 'grm', 'knn_k': 8, 'weighted_edges': False, 'symmetrize_mode': 'union', 'use_snp_selection': True, 'num_snps': 12210}. Best is trial 27 with value: 0.08246652821033469.
[I 2025-11-03 13:50:49,514] Trial 30 finished with value: 0.04385965305325696 and parameters: {'model_type': 'graphsage', 'hidden_dims': '[256, 128, 64]', 'dropout': 0.22795604218289928, 'batch_norm': False, 'lr': 1.4293814857867083e-05, 'weight_decay': 4.8280732057018105e-05, 'epochs': 129, 'loss': 'mae', 'optimizer': 'adam', 'graph_mode': 'knn', 'source': 'grm', 'knn_k': 9, 'weighted_edges': True, 'symmetrize_mode': 'union', 'use_snp_selection': True, 'num_snps': 44921}. Best is trial 27 with value: 0.08246652821033469.
[I 2025-11-03 13:50:54,126] Trial 31 finished with value: 0.06563449310960272 and parameters: {'model_type': 'graphsage', 'hidden_dims': '[512, 128]', 'dropout': 0.3228460928224035, 'batch_norm': False, 'lr': 1.3549296877878768e-05, 'weight_decay': 2.37460466502089e-06, 'epochs': 86, 'loss': 'mae', 'optimizer': 'adam', 'graph_mode': 'knn', 'source': 'grm', 'knn_k': 8, 'weighted_edges': False, 'symmetrize_mode': 'union', 'use_snp_selection': True, 'num_snps': 56841}. Best is trial 27 with value: 0.08246652821033469.
[I 2025-11-03 13:50:58,307] Trial 32 finished with value: 0.03596994391245577 and parameters: {'model_type': 'graphsage', 'hidden_dims': '[512, 128]', 'dropout': 0.33478185737888555, 'batch_norm': False, 'lr': 2.3872561213038526e-05, 'weight_decay': 1.9930851003526408e-06, 'epochs': 70, 'loss': 'mae', 'optimizer': 'adam', 'graph_mode': 'knn', 'source': 'grm', 'knn_k': 9, 'weighted_edges': False, 'symmetrize_mode': 'union', 'use_snp_selection': True, 'num_snps': 52026}. Best is trial 27 with value: 0.08246652821033469.
[I 2025-11-03 13:51:01,386] Trial 33 finished with value: 0.04876679258322658 and parameters: {'model_type': 'graphsage', 'hidden_dims': '[128, 64]', 'dropout': 0.391064867305567, 'batch_norm': False, 'lr': 5.679648240337735e-05, 'weight_decay': 1.7379705951656043e-06, 'epochs': 67, 'loss': 'mae', 'optimizer': 'adam', 'graph_mode': 'knn', 'source': 'grm', 'knn_k': 6, 'weighted_edges': False, 'symmetrize_mode': 'union', 'use_snp_selection': True, 'num_snps': 51014}. Best is trial 27 with value: 0.08246652821033469.
[I 2025-11-03 13:51:04,112] Trial 34 finished with value: 0.005883447092423396 and parameters: {'model_type': 'graphsage', 'hidden_dims': '[256, 128]', 'dropout': 0.44352455005937275, 'batch_norm': False, 'lr': 4.239562408333577e-06, 'weight_decay': 9.336374360035676e-06, 'epochs': 42, 'loss': 'mae', 'optimizer': 'adam', 'graph_mode': 'knn', 'source': 'grm', 'knn_k': 9, 'weighted_edges': False, 'symmetrize_mode': 'union', 'use_snp_selection': True, 'num_snps': 37446}. Best is trial 27 with value: 0.08246652821033469.
[I 2025-11-03 13:51:05,714] Trial 35 finished with value: 0.04397565753858327 and parameters: {'model_type': 'graphsage', 'hidden_dims': '[512, 128]', 'dropout': 0.2641790682644905, 'batch_norm': False, 'lr': 1.0467197854482025e-05, 'weight_decay': 1.9974271697195683e-07, 'epochs': 110, 'loss': 'mae', 'optimizer': 'adam', 'graph_mode': 'knn', 'source': 'grm', 'knn_k': 7, 'weighted_edges': False, 'symmetrize_mode': 'union', 'use_snp_selection': True, 'num_snps': 2220}. Best is trial 27 with value: 0.08246652821033469.
