[I 2025-11-03 13:18:13,579] Trial 114 finished with value: 0.08392772010273042 and parameters: {'model_type': 'gcn', 'hidden_dims': '[512, 128]', 'dropout': 0.2463359766349791, 'batch_norm': True, 'lr': 1.823118745314268e-05, 'weight_decay': 1.0930056692159497e-06, 'epochs': 208, 'loss': 'mae', 'optimizer': 'adam', 'graph_mode': 'knn', 'source': 'grm', 'knn_k': 5, 'weighted_edges': False, 'symmetrize_mode': 'union', 'use_snp_selection': False}. Best is trial 111 with value: 0.15667204282550012.
[I 2025-11-03 13:18:17,739] Trial 115 finished with value: 0.12160990847375285 and parameters: {'model_type': 'gcn', 'hidden_dims': '[512, 128]', 'dropout': 0.26492814159026135, 'batch_norm': True, 'lr': 0.0006090630503641721, 'weight_decay': 5.01629656749608e-07, 'epochs': 222, 'loss': 'mae', 'optimizer': 'adam', 'graph_mode': 'knn', 'source': 'grm', 'knn_k': 7, 'weighted_edges': False, 'symmetrize_mode': 'union', 'use_snp_selection': False}. Best is trial 111 with value: 0.15667204282550012.
[I 2025-11-03 13:18:21,012] Trial 116 finished with value: 0.13672811363691972 and parameters: {'model_type': 'gcn', 'hidden_dims': '[512, 128]', 'dropout': 0.2569516120493487, 'batch_norm': True, 'lr': 0.0003851241586892844, 'weight_decay': 1.6544781603073209e-06, 'epochs': 158, 'loss': 'mae', 'optimizer': 'adam', 'graph_mode': 'cutoff', 'cutoff': 0.8000328009838027, 'grm_norm': 'cosine_then_gcn', 'self_loops': True, 'use_snp_selection': False}. Best is trial 111 with value: 0.15667204282550012.
[I 2025-11-03 13:18:25,314] Trial 117 finished with value: 0.1625202501315478 and parameters: {'model_type': 'gcn', 'hidden_dims': '[512, 128]', 'dropout': 0.23302152106494523, 'batch_norm': True, 'lr': 0.00046906006762092333, 'weight_decay': 6.898693011129051e-07, 'epochs': 234, 'loss': 'mae', 'optimizer': 'adam', 'graph_mode': 'knn', 'source': 'grm', 'knn_k': 6, 'weighted_edges': False, 'symmetrize_mode': 'union', 'use_snp_selection': False}. Best is trial 117 with value: 0.1625202501315478.
[I 2025-11-03 13:18:29,064] Trial 118 finished with value: 0.16361088804629464 and parameters: {'model_type': 'gcn', 'hidden_dims': '[512, 128]', 'dropout': 0.23328808979348098, 'batch_norm': True, 'lr': 0.0004902170898216587, 'weight_decay': 8.105560782186324e-07, 'epochs': 191, 'loss': 'mae', 'optimizer': 'adam', 'graph_mode': 'knn', 'source': 'grm', 'knn_k': 6, 'weighted_edges': False, 'symmetrize_mode': 'union', 'use_snp_selection': False}. Best is trial 118 with value: 0.16361088804629464.
[I 2025-11-03 13:18:32,864] Trial 119 finished with value: 0.14991570231783027 and parameters: {'model_type': 'gcn', 'hidden_dims': '[512, 128]', 'dropout': 0.2005077413930707, 'batch_norm': True, 'lr': 0.00032004271836935243, 'weight_decay': 7.122425804907354e-07, 'epochs': 194, 'loss': 'mae', 'optimizer': 'adam', 'graph_mode': 'knn', 'source': 'grm', 'knn_k': 6, 'weighted_edges': False, 'symmetrize_mode': 'union', 'use_snp_selection': False}. Best is trial 118 with value: 0.16361088804629464.
[I 2025-11-03 13:18:36,630] Trial 120 finished with value: 0.12569482001466378 and parameters: {'model_type': 'gcn', 'hidden_dims': '[512, 128]', 'dropout': 0.21249726467660685, 'batch_norm': True, 'lr': 0.0004627922604469176, 'weight_decay': 7.815191108223046e-07, 'epochs': 192, 'loss': 'mae', 'optimizer': 'adam', 'graph_mode': 'knn', 'source': 'grm', 'knn_k': 6, 'weighted_edges': False, 'symmetrize_mode': 'union', 'use_snp_selection': False}. Best is trial 118 with value: 0.16361088804629464.
[I 2025-11-03 13:18:40,227] Trial 121 finished with value: 0.1464899671265228 and parameters: {'model_type': 'gcn', 'hidden_dims': '[512, 128]', 'dropout': 0.1891896882387112, 'batch_norm': True, 'lr': 0.00031971453464040993, 'weight_decay': 3.843792234851284e-07, 'epochs': 179, 'loss': 'mae', 'optimizer': 'adam', 'graph_mode': 'knn', 'source': 'grm', 'knn_k': 6, 'weighted_edges': False, 'symmetrize_mode': 'union', 'use_snp_selection': False}. Best is trial 118 with value: 0.16361088804629464.
[I 2025-11-03 13:18:43,800] Trial 122 finished with value: 0.16936609731244123 and parameters: {'model_type': 'gcn', 'hidden_dims': '[512, 128]', 'dropout': 0.1544843907737006, 'batch_norm': True, 'lr': 0.00037155461085696935, 'weight_decay': 4.246227475784393e-07, 'epochs': 177, 'loss': 'mae', 'optimizer': 'adam', 'graph_mode': 'knn', 'source': 'grm', 'knn_k': 6, 'weighted_edges': False, 'symmetrize_mode': 'union', 'use_snp_selection': False}. Best is trial 122 with value: 0.16936609731244123.
[I 2025-11-03 13:18:47,301] Trial 123 finished with value: 0.1406733334651717 and parameters: {'model_type': 'gcn', 'hidden_dims': '[512, 128]', 'dropout': 0.1571330997232824, 'batch_norm': True, 'lr': 0.0003585985798258805, 'weight_decay': 3.831947923554364e-07, 'epochs': 173, 'loss': 'mae', 'optimizer': 'adam', 'graph_mode': 'knn', 'source': 'grm', 'knn_k': 6, 'weighted_edges': False, 'symmetrize_mode': 'union', 'use_snp_selection': False}. Best is trial 122 with value: 0.16936609731244123.
[I 2025-11-03 13:18:50,417] Trial 124 finished with value: 0.1455395754467449 and parameters: {'model_type': 'gcn', 'hidden_dims': '[512, 128]', 'dropout': 0.12218210085146475, 'batch_norm': True, 'lr': 0.00030405574947202433, 'weight_decay': 3.222488056426781e-07, 'epochs': 142, 'loss': 'mae', 'optimizer': 'adam', 'graph_mode': 'knn', 'source': 'grm', 'knn_k': 6, 'weighted_edges': False, 'symmetrize_mode': 'union', 'use_snp_selection': False}. Best is trial 122 with value: 0.16936609731244123.
[I 2025-11-03 13:18:54,061] Trial 125 finished with value: 0.13490299548871548 and parameters: {'model_type': 'gcn', 'hidden_dims': '[512, 128]', 'dropout': 0.18189163390592278, 'batch_norm': True, 'lr': 0.000684659487344568, 'weight_decay': 6.278094491714755e-07, 'epochs': 183, 'loss': 'mae', 'optimizer': 'adam', 'graph_mode': 'knn', 'source': 'grm', 'knn_k': 7, 'weighted_edges': False, 'symmetrize_mode': 'union', 'use_snp_selection': False}. Best is trial 122 with value: 0.16936609731244123.
[I 2025-11-03 13:18:57,503] Trial 126 finished with value: 0.16702484234831041 and parameters: {'model_type': 'gcn', 'hidden_dims': '[512, 128]', 'dropout': 0.19779197279479915, 'batch_norm': True, 'lr': 0.0003949814907472588, 'weight_decay': 1.8889325665590054e-07, 'epochs': 166, 'loss': 'mae', 'optimizer': 'adam', 'graph_mode': 'knn', 'source': 'grm', 'knn_k': 6, 'weighted_edges': False, 'symmetrize_mode': 'union', 'use_snp_selection': False}. Best is trial 122 with value: 0.16936609731244123.
[I 2025-11-03 13:19:00,903] Trial 127 finished with value: 0.12509678070859648 and parameters: {'model_type': 'gcn', 'hidden_dims': '[512, 128]', 'dropout': 0.16371189830416225, 'batch_norm': True, 'lr': 0.0004041499718930248, 'weight_decay': 1.612760034540239e-07, 'epochs': 163, 'loss': 'mae', 'optimizer': 'adam', 'graph_mode': 'knn', 'source': 'grm', 'knn_k': 5, 'weighted_edges': False, 'symmetrize_mode': 'union', 'use_snp_selection': False}. Best is trial 122 with value: 0.16936609731244123.
[I 2025-11-03 13:19:04,111] Trial 128 finished with value: 0.1251505631245706 and parameters: {'model_type': 'gcn', 'hidden_dims': '[512, 128]', 'dropout': 0.170680710932253, 'batch_norm': True, 'lr': 0.000790781087897321, 'weight_decay': 2.597980102430074e-07, 'epochs': 148, 'loss': 'mse', 'optimizer': 'adam', 'graph_mode': 'knn', 'source': 'grm', 'knn_k': 7, 'weighted_edges': False, 'symmetrize_mode': 'union', 'use_snp_selection': False}. Best is trial 122 with value: 0.16936609731244123.
[I 2025-11-03 13:19:08,151] Trial 129 finished with value: 0.09336508574535185 and parameters: {'model_type': 'gcn', 'hidden_dims': '[512, 128]', 'dropout': 0.13858225385414516, 'batch_norm': False, 'lr': 0.0005481206850529747, 'weight_decay': 2.0115812888974413e-07, 'epochs': 195, 'loss': 'mae', 'optimizer': 'adam', 'graph_mode': 'knn', 'source': 'grm', 'knn_k': 6, 'weighted_edges': False, 'symmetrize_mode': 'union', 'use_snp_selection': True, 'num_snps': 27400}. Best is trial 122 with value: 0.16936609731244123.
[I 2025-11-03 13:19:12,166] Trial 130 finished with value: 0.11751239425481251 and parameters: {'model_type': 'gcn', 'hidden_dims': '[512, 128]', 'dropout': 0.1998337100521001, 'batch_norm': True, 'lr': 0.00023425811836690148, 'weight_decay': 1.1293175860602381e-07, 'epochs': 208, 'loss': 'mae', 'optimizer': 'adam', 'graph_mode': 'knn', 'source': 'grm', 'knn_k': 5, 'weighted_edges': False, 'symmetrize_mode': 'mutual', 'use_snp_selection': False}. Best is trial 122 with value: 0.16936609731244123.
[I 2025-11-03 13:19:15,769] Trial 131 finished with value: 0.14837554241585507 and parameters: {'model_type': 'gcn', 'hidden_dims': '[512, 128]', 'dropout': 0.19376361053984437, 'batch_norm': True, 'lr': 0.0003275680145053775, 'weight_decay': 4.264290541470989e-07, 'epochs': 180, 'loss': 'mae', 'optimizer': 'adam', 'graph_mode': 'knn', 'source': 'grm', 'knn_k': 6, 'weighted_edges': False, 'symmetrize_mode': 'union', 'use_snp_selection': False}. Best is trial 122 with value: 0.16936609731244123.
[I 2025-11-03 13:19:19,281] Trial 132 finished with value: 0.14746724691902702 and parameters: {'model_type': 'gcn', 'hidden_dims': '[512, 128]', 'dropout': 0.14936202313380298, 'batch_norm': True, 'lr': 0.00046578954118815205, 'weight_decay': 9.025407642807867e-07, 'epochs': 172, 'loss': 'mae', 'optimizer': 'adam', 'graph_mode': 'knn', 'source': 'grm', 'knn_k': 6, 'weighted_edges': False, 'symmetrize_mode': 'union', 'use_snp_selection': False}. Best is trial 122 with value: 0.16936609731244123.
[I 2025-11-03 13:19:22,670] Trial 133 finished with value: 0.14227222981425502 and parameters: {'model_type': 'gcn', 'hidden_dims': '[512, 128]', 'dropout': 0.15137202721351178, 'batch_norm': True, 'lr': 0.0004813442015951116, 'weight_decay': 8.901253452011392e-07, 'epochs': 163, 'loss': 'mae', 'optimizer': 'adam', 'graph_mode': 'knn', 'source': 'grm', 'knn_k': 6, 'weighted_edges': False, 'symmetrize_mode': 'union', 'use_snp_selection': False}. Best is trial 122 with value: 0.16936609731244123.
[I 2025-11-03 13:19:26,378] Trial 134 finished with value: 0.15269287329567002 and parameters: {'model_type': 'gcn', 'hidden_dims': '[512, 128]', 'dropout': 0.13762983966302217, 'batch_norm': True, 'lr': 0.0003838497045828603, 'weight_decay': 6.812259483905989e-07, 'epochs': 192, 'loss': 'mae', 'optimizer': 'adam', 'graph_mode': 'knn', 'source': 'grm', 'knn_k': 6, 'weighted_edges': False, 'symmetrize_mode': 'union', 'use_snp_selection': False}. Best is trial 122 with value: 0.16936609731244123.
[I 2025-11-03 13:19:30,090] Trial 135 finished with value: 0.12375364297193332 and parameters: {'model_type': 'gcn', 'hidden_dims': '[512, 128]', 'dropout': 0.14178501161767637, 'batch_norm': True, 'lr': 0.00039336022031394806, 'weight_decay': 4.421932238650031e-07, 'epochs': 192, 'loss': 'mae', 'optimizer': 'adam', 'graph_mode': 'knn', 'source': 'grm', 'knn_k': 7, 'weighted_edges': False, 'symmetrize_mode': 'union', 'use_snp_selection': False}. Best is trial 122 with value: 0.16936609731244123.
[I 2025-11-03 13:19:33,604] Trial 136 finished with value: 0.1428255621733725 and parameters: {'model_type': 'gcn', 'hidden_dims': '[512, 128]', 'dropout': 0.12967075310396972, 'batch_norm': True, 'lr': 0.0006120687197155924, 'weight_decay': 6.771307039487064e-07, 'epochs': 177, 'loss': 'mae', 'optimizer': 'adam', 'graph_mode': 'knn', 'source': 'grm', 'knn_k': 6, 'weighted_edges': False, 'symmetrize_mode': 'union', 'use_snp_selection': False}. Best is trial 122 with value: 0.16936609731244123.
[I 2025-11-03 13:19:37,356] Trial 137 finished with value: 0.1372256434222876 and parameters: {'model_type': 'gcn', 'hidden_dims': '[512, 128]', 'dropout': 0.20448430577615337, 'batch_norm': True, 'lr': 0.00027675136450514714, 'weight_decay': 1.0971975378442607e-06, 'epochs': 202, 'loss': 'mae', 'optimizer': 'adam', 'graph_mode': 'cutoff', 'cutoff': 0.6258023954590719, 'grm_norm': 'cosine', 'self_loops': True, 'use_snp_selection': False}. Best is trial 122 with value: 0.16936609731244123.
[I 2025-11-03 13:19:39,544] Trial 138 finished with value: 0.12566463376973164 and parameters: {'model_type': 'gcn', 'hidden_dims': '[128, 64]', 'dropout': 0.11746371865390934, 'batch_norm': True, 'lr': 0.000351316610371645, 'weight_decay': 5.327796668094646e-07, 'epochs': 233, 'loss': 'mae', 'optimizer': 'adam', 'graph_mode': 'knn', 'source': 'grm', 'knn_k': 6, 'weighted_edges': False, 'symmetrize_mode': 'union', 'use_snp_selection': False}. Best is trial 122 with value: 0.16936609731244123.
[I 2025-11-03 13:19:43,203] Trial 139 finished with value: 0.11737443470988865 and parameters: {'model_type': 'gcn', 'hidden_dims': '[512, 128]', 'dropout': 0.21572208342770557, 'batch_norm': True, 'lr': 0.00041424756572963005, 'weight_decay': 3.37372336043218e-05, 'epochs': 189, 'loss': 'mae', 'optimizer': 'adam', 'graph_mode': 'knn', 'source': 'grm', 'knn_k': 5, 'weighted_edges': False, 'symmetrize_mode': 'union', 'use_snp_selection': False}. Best is trial 122 with value: 0.16936609731244123.
[I 2025-11-03 13:19:45,901] Trial 140 finished with value: 0.11512087467844416 and parameters: {'model_type': 'gcn', 'hidden_dims': '[256, 128]', 'dropout': 0.19368066251867877, 'batch_norm': True, 'lr': 0.0005535153928286378, 'weight_decay': 2.984914566401945e-07, 'epochs': 210, 'loss': 'mae', 'optimizer': 'adam', 'graph_mode': 'knn', 'source': 'grm', 'knn_k': 6, 'weighted_edges': False, 'symmetrize_mode': 'union', 'use_snp_selection': False}. Best is trial 122 with value: 0.16936609731244123.
[I 2025-11-03 13:19:49,284] Trial 141 finished with value: 0.17388391759784705 and parameters: {'model_type': 'gcn', 'hidden_dims': '[512, 128]', 'dropout': 0.14554315127675674, 'batch_norm': True, 'lr': 0.0004569128640115971, 'weight_decay': 8.167072345071293e-07, 'epochs': 166, 'loss': 'mae', 'optimizer': 'adam', 'graph_mode': 'knn', 'source': 'grm', 'knn_k': 6, 'weighted_edges': False, 'symmetrize_mode': 'union', 'use_snp_selection': False}. Best is trial 141 with value: 0.17388391759784705.
[I 2025-11-03 13:19:52,639] Trial 142 finished with value: 0.14814399671368983 and parameters: {'model_type': 'gcn', 'hidden_dims': '[512, 128]', 'dropout': 0.23159309775919712, 'batch_norm': True, 'lr': 0.00036052003693615663, 'weight_decay': 6.310167101732343e-07, 'epochs': 163, 'loss': 'mae', 'optimizer': 'adam', 'graph_mode': 'knn', 'source': 'grm', 'knn_k': 6, 'weighted_edges': False, 'symmetrize_mode': 'union', 'use_snp_selection': False}. Best is trial 141 with value: 0.17388391759784705.
[I 2025-11-03 13:19:56,063] Trial 143 finished with value: 0.13764361790227245 and parameters: {'model_type': 'gcn', 'hidden_dims': '[512, 128]', 'dropout': 0.17201563012320606, 'batch_norm': True, 'lr': 0.0006840410129496579, 'weight_decay': 4.421858116683819e-07, 'epochs': 168, 'loss': 'mae', 'optimizer': 'adam', 'graph_mode': 'knn', 'source': 'grm', 'knn_k': 7, 'weighted_edges': False, 'symmetrize_mode': 'union', 'use_snp_selection': False}. Best is trial 141 with value: 0.17388391759784705.
[I 2025-11-03 13:19:59,288] Trial 144 finished with value: 0.15686571338881172 and parameters: {'model_type': 'gcn', 'hidden_dims': '[512, 128]', 'dropout': 0.1286101210842637, 'batch_norm': True, 'lr': 0.0002506753022920046, 'weight_decay': 1.0530989040490978e-06, 'epochs': 152, 'loss': 'mae', 'optimizer': 'adam', 'graph_mode': 'knn', 'source': 'grm', 'knn_k': 6, 'weighted_edges': False, 'symmetrize_mode': 'union', 'use_snp_selection': False}. Best is trial 141 with value: 0.17388391759784705.
[I 2025-11-03 13:20:02,310] Trial 145 finished with value: 0.14315115867320508 and parameters: {'model_type': 'gcn', 'hidden_dims': '[512, 128]', 'dropout': 0.11626863975517514, 'batch_norm': True, 'lr': 0.0002240951754405028, 'weight_decay': 1.1746548152320259e-06, 'epochs': 136, 'loss': 'mae', 'optimizer': 'adam', 'graph_mode': 'knn', 'source': 'grm', 'knn_k': 6, 'weighted_edges': False, 'symmetrize_mode': 'union', 'use_snp_selection': False}. Best is trial 141 with value: 0.17388391759784705.
[I 2025-11-03 13:20:05,185] Trial 146 finished with value: 0.14577431301949645 and parameters: {'model_type': 'gcn', 'hidden_dims': '[512, 128]', 'dropout': 0.13256315497255025, 'batch_norm': True, 'lr': 0.00025774378122781047, 'weight_decay': 7.544624415603031e-07, 'epochs': 124, 'loss': 'mae', 'optimizer': 'adam', 'graph_mode': 'knn', 'source': 'grm', 'knn_k': 6, 'weighted_edges': False, 'symmetrize_mode': 'union', 'use_snp_selection': False}. Best is trial 141 with value: 0.17388391759784705.
[I 2025-11-03 13:20:08,428] Trial 147 finished with value: 0.10236028449564746 and parameters: {'model_type': 'gcn', 'hidden_dims': '[512, 128]', 'dropout': 0.1422112796163758, 'batch_norm': True, 'lr': 0.00043241331830413753, 'weight_decay': 9.903576068054557e-07, 'epochs': 156, 'loss': 'mae', 'optimizer': 'adam', 'graph_mode': 'knn', 'source': 'grm', 'knn_k': 5, 'weighted_edges': False, 'symmetrize_mode': 'union', 'use_snp_selection': False}. Best is trial 141 with value: 0.17388391759784705.
[I 2025-11-03 13:20:10,815] Trial 148 finished with value: 0.14131760327035414 and parameters: {'model_type': 'gcn', 'hidden_dims': '[256, 128, 64]', 'dropout': 0.14958745517667438, 'batch_norm': True, 'lr': 0.0003294698793689949, 'weight_decay': 1.393415728644932e-06, 'epochs': 146, 'loss': 'mae', 'optimizer': 'adam', 'graph_mode': 'knn', 'source': 'grm', 'knn_k': 6, 'weighted_edges': False, 'symmetrize_mode': 'union', 'use_snp_selection': False}. Best is trial 141 with value: 0.17388391759784705.
[I 2025-11-03 13:20:14,389] Trial 149 finished with value: 0.15328272468884482 and parameters: {'model_type': 'gcn', 'hidden_dims': '[512, 128]', 'dropout': 0.10225931999484555, 'batch_norm': True, 'lr': 0.000522977207804813, 'weight_decay': 5.589646665318429e-07, 'epochs': 181, 'loss': 'mae', 'optimizer': 'adam', 'graph_mode': 'knn', 'source': 'grm', 'knn_k': 6, 'weighted_edges': False, 'symmetrize_mode': 'union', 'use_snp_selection': False}. Best is trial 141 with value: 0.17388391759784705.
[I 2025-11-03 13:20:16,520] Trial 0 finished with value: 0.029817367198982505 and parameters: {'model_type': 'gcn', 'hidden_dims': '[128, 64]', 'dropout': 0.199031432379812, 'batch_norm': True, 'lr': 1.8408544111075837e-06, 'weight_decay': 5.5136510071208614e-05, 'epochs': 334, 'loss': 'mae', 'optimizer': 'adam', 'graph_mode': 'knn', 'source': 'grm', 'knn_k': 8, 'weighted_edges': True, 'symmetrize_mode': 'mutual', 'use_snp_selection': False}. Best is trial 0 with value: 0.029817367198982505.
[I 2025-11-03 13:20:17,664] Trial 1 finished with value: 0.0820990171760938 and parameters: {'model_type': 'gcn', 'hidden_dims': '[128, 64]', 'dropout': 0.40051947670227217, 'batch_norm': True, 'lr': 0.0005320428882732732, 'weight_decay': 1.89210117736594e-06, 'epochs': 32, 'loss': 'mse', 'optimizer': 'adam', 'graph_mode': 'knn', 'source': 'grm', 'knn_k': 7, 'weighted_edges': True, 'symmetrize_mode': 'union', 'use_snp_selection': False}. Best is trial 1 with value: 0.0820990171760938.
[I 2025-11-03 13:20:20,036] Trial 2 finished with value: 0.08977082530375655 and parameters: {'model_type': 'gcn', 'hidden_dims': '[256, 128]', 'dropout': 0.5105528289184642, 'batch_norm': False, 'lr': 0.0006804279372404962, 'weight_decay': 0.0008922815224257085, 'epochs': 160, 'loss': 'mse', 'optimizer': 'adam', 'graph_mode': 'cutoff', 'cutoff': 0.5741905641612706, 'grm_norm': 'gcn', 'self_loops': False, 'use_snp_selection': True, 'num_snps': 26910}. Best is trial 2 with value: 0.08977082530375655.
[I 2025-11-03 13:20:22,511] Trial 3 finished with value: 0.052811548207617943 and parameters: {'model_type': 'gcn', 'hidden_dims': '[256, 128, 64]', 'dropout': 0.5390483213624292, 'batch_norm': False, 'lr': 3.4705625989073525e-05, 'weight_decay': 2.4623319020131338e-05, 'epochs': 92, 'loss': 'mse', 'optimizer': 'adam', 'graph_mode': 'knn', 'source': 'grm', 'knn_k': 6, 'weighted_edges': False, 'symmetrize_mode': 'mutual', 'use_snp_selection': True, 'num_snps': 30713}. Best is trial 2 with value: 0.08977082530375655.
[I 2025-11-03 13:20:24,975] Trial 4 finished with value: -0.0086963409173798 and parameters: {'model_type': 'gcn', 'hidden_dims': '[128, 64]', 'dropout': 0.13404863676897502, 'batch_norm': False, 'lr': 0.0001431556295367288, 'weight_decay': 2.2084517750726675e-05, 'epochs': 13, 'loss': 'mae', 'optimizer': 'adam', 'graph_mode': 'cutoff', 'cutoff': 0.6714268476993044, 'grm_norm': 'none', 'self_loops': False, 'use_snp_selection': True, 'num_snps': 45645}. Best is trial 2 with value: 0.08977082530375655.
[I 2025-11-03 13:20:27,938] Trial 5 finished with value: 0.10109969080807474 and parameters: {'model_type': 'gcn', 'hidden_dims': '[256, 128]', 'dropout': 0.42253606323412096, 'batch_norm': False, 'lr': 4.238630400638805e-05, 'weight_decay': 8.074086040046576e-07, 'epochs': 134, 'loss': 'mae', 'optimizer': 'adam', 'graph_mode': 'knn', 'source': 'grm', 'knn_k': 1, 'weighted_edges': False, 'symmetrize_mode': 'mutual', 'use_snp_selection': True, 'num_snps': 43113}. Best is trial 5 with value: 0.10109969080807474.
[I 2025-11-03 13:20:30,770] Trial 6 finished with value: 0.08246531170698446 and parameters: {'model_type': 'gcn', 'hidden_dims': '[512, 256]', 'dropout': 0.3534893146320237, 'batch_norm': True, 'lr': 0.000251307964226932, 'weight_decay': 1.821819791794022e-05, 'epochs': 207, 'loss': 'mae', 'optimizer': 'adam', 'graph_mode': 'knn', 'source': 'grm', 'knn_k': 1, 'weighted_edges': True, 'symmetrize_mode': 'mutual', 'use_snp_selection': False}. Best is trial 5 with value: 0.10109969080807474.
