[I 2025-11-12 18:45:19,054] Trial 120 finished with value: 0.23367156868292419 and parameters: {'model_type': 'graphsage', 'hidden_dims': '[512, 256]', 'dropout': 0.1298124203309944, 'batch_norm': False, 'lr': 2.300059351783168e-05, 'weight_decay': 6.373882424502703e-05, 'epochs': 68, 'loss': 'mae', 'optimizer': 'adam', 'graph_mode': 'cutoff', 'cutoff': 0.7563266051248608, 'grm_norm': 'none', 'self_loops': True, 'use_snp_selection': True, 'num_snps': 31736}. Best is trial 112 with value: 0.2786953703733425.
[I 2025-11-12 18:46:30,692] Trial 121 finished with value: 0.26434802836363736 and parameters: {'model_type': 'graphsage', 'hidden_dims': '[512, 128]', 'dropout': 0.19556127910150192, 'batch_norm': False, 'lr': 0.00023923647422806885, 'weight_decay': 2.2146226528059753e-05, 'epochs': 80, 'loss': 'mae', 'optimizer': 'adam', 'graph_mode': 'cutoff', 'cutoff': 0.36016064991990226, 'grm_norm': 'none', 'self_loops': True, 'use_snp_selection': True, 'num_snps': 24813}. Best is trial 112 with value: 0.2786953703733425.
[I 2025-11-12 18:47:31,562] Trial 122 finished with value: 0.2490060302290876 and parameters: {'model_type': 'graphsage', 'hidden_dims': '[512, 128]', 'dropout': 0.19747488634884794, 'batch_norm': False, 'lr': 0.0002365173660786064, 'weight_decay': 2.3185104217699553e-05, 'epochs': 54, 'loss': 'mae', 'optimizer': 'adam', 'graph_mode': 'cutoff', 'cutoff': 0.731039786114811, 'grm_norm': 'none', 'self_loops': True, 'use_snp_selection': True, 'num_snps': 24985}. Best is trial 112 with value: 0.2786953703733425.
[I 2025-11-12 18:48:36,950] Trial 123 finished with value: 0.24899614390200905 and parameters: {'model_type': 'graphsage', 'hidden_dims': '[512, 128]', 'dropout': 0.16760667797079076, 'batch_norm': False, 'lr': 0.00014801741248936945, 'weight_decay': 3.0468144077049177e-05, 'epochs': 60, 'loss': 'mae', 'optimizer': 'adam', 'graph_mode': 'cutoff', 'cutoff': 0.586275675722004, 'grm_norm': 'none', 'self_loops': True, 'use_snp_selection': True, 'num_snps': 28063}. Best is trial 112 with value: 0.2786953703733425.
[I 2025-11-12 18:49:52,600] Trial 124 finished with value: 0.2504472963311965 and parameters: {'model_type': 'graphsage', 'hidden_dims': '[512, 128]', 'dropout': 0.1511093380098711, 'batch_norm': False, 'lr': 9.466284704322081e-05, 'weight_decay': 4.6650500134622196e-05, 'epochs': 49, 'loss': 'mae', 'optimizer': 'adam', 'graph_mode': 'cutoff', 'cutoff': 0.33667459830677154, 'grm_norm': 'none', 'self_loops': True, 'use_snp_selection': True, 'num_snps': 33629}. Best is trial 112 with value: 0.2786953703733425.
[I 2025-11-12 18:51:10,346] Trial 125 finished with value: 0.2659300431717593 and parameters: {'model_type': 'graphsage', 'hidden_dims': '[256, 128, 64]', 'dropout': 0.18938742636189876, 'batch_norm': False, 'lr': 3.1985632462297906e-05, 'weight_decay': 2.104866472623309e-06, 'epochs': 94, 'loss': 'mae', 'optimizer': 'adam', 'graph_mode': 'cutoff', 'cutoff': 0.4090701178353279, 'grm_norm': 'none', 'self_loops': True, 'use_snp_selection': True, 'num_snps': 35628}. Best is trial 112 with value: 0.2786953703733425.
[I 2025-11-12 18:52:37,472] Trial 126 finished with value: 0.20838497658866112 and parameters: {'model_type': 'graphsage', 'hidden_dims': '[256, 128, 64]', 'dropout': 0.20554410872204087, 'batch_norm': True, 'lr': 3.453868446775871e-05, 'weight_decay': 2.3774227465410084e-06, 'epochs': 94, 'loss': 'mae', 'optimizer': 'adam', 'graph_mode': 'cutoff', 'cutoff': 0.3635604132815795, 'grm_norm': 'none', 'self_loops': True, 'use_snp_selection': True, 'num_snps': 38463}. Best is trial 112 with value: 0.2786953703733425.
[I 2025-11-12 18:53:35,934] Trial 127 finished with value: 0.2683717442620075 and parameters: {'model_type': 'graphsage', 'hidden_dims': '[256, 128, 64]', 'dropout': 0.1920105956419871, 'batch_norm': False, 'lr': 3.115067503094119e-05, 'weight_decay': 2.086529944454161e-06, 'epochs': 110, 'loss': 'mae', 'optimizer': 'adam', 'graph_mode': 'cutoff', 'cutoff': 0.4268726055944966, 'grm_norm': 'none', 'self_loops': False, 'use_snp_selection': False}. Best is trial 112 with value: 0.2786953703733425.
[I 2025-11-12 18:54:36,187] Trial 128 finished with value: 0.25833415409048976 and parameters: {'model_type': 'graphsage', 'hidden_dims': '[256, 128, 64]', 'dropout': 0.19610243586246612, 'batch_norm': False, 'lr': 3.156798366885719e-05, 'weight_decay': 1.9761057837348595e-06, 'epochs': 113, 'loss': 'mae', 'optimizer': 'adam', 'graph_mode': 'cutoff', 'cutoff': 0.41826369173775513, 'grm_norm': 'none', 'self_loops': False, 'use_snp_selection': False}. Best is trial 112 with value: 0.2786953703733425.
[I 2025-11-12 18:55:38,401] Trial 129 finished with value: 0.2673419402832621 and parameters: {'model_type': 'graphsage', 'hidden_dims': '[256, 128, 64]', 'dropout': 0.17282024154500522, 'batch_norm': False, 'lr': 5.887106496932089e-05, 'weight_decay': 4.698489666891796e-06, 'epochs': 117, 'loss': 'mae', 'optimizer': 'adam', 'graph_mode': 'cutoff', 'cutoff': 0.404791620122488, 'grm_norm': 'cosine', 'self_loops': True, 'use_snp_selection': False}. Best is trial 112 with value: 0.2786953703733425.
[I 2025-11-12 18:56:40,763] Trial 130 finished with value: 0.2677424411561192 and parameters: {'model_type': 'graphsage', 'hidden_dims': '[256, 128, 64]', 'dropout': 0.2100512546802861, 'batch_norm': False, 'lr': 6.0522569145460186e-05, 'weight_decay': 5.093147768968578e-06, 'epochs': 118, 'loss': 'mae', 'optimizer': 'adam', 'graph_mode': 'cutoff', 'cutoff': 0.41126207403280135, 'grm_norm': 'cosine', 'self_loops': True, 'use_snp_selection': False}. Best is trial 112 with value: 0.2786953703733425.
[I 2025-11-12 18:57:43,713] Trial 131 finished with value: 0.25261711277698645 and parameters: {'model_type': 'graphsage', 'hidden_dims': '[256, 128, 64]', 'dropout': 0.18881718475737252, 'batch_norm': False, 'lr': 6.062818825311737e-05, 'weight_decay': 4.588275346061315e-06, 'epochs': 123, 'loss': 'mae', 'optimizer': 'adam', 'graph_mode': 'cutoff', 'cutoff': 0.4571572915138039, 'grm_norm': 'cosine', 'self_loops': True, 'use_snp_selection': False}. Best is trial 112 with value: 0.2786953703733425.
[I 2025-11-12 18:58:51,265] Trial 132 finished with value: 0.2584460721617199 and parameters: {'model_type': 'graphsage', 'hidden_dims': '[256, 128, 64]', 'dropout': 0.21275161808461102, 'batch_norm': False, 'lr': 5.069372510889764e-05, 'weight_decay': 5.2064354051148935e-06, 'epochs': 131, 'loss': 'mae', 'optimizer': 'adam', 'graph_mode': 'cutoff', 'cutoff': 0.41118518525010644, 'grm_norm': 'cosine', 'self_loops': True, 'use_snp_selection': False}. Best is trial 112 with value: 0.2786953703733425.
[I 2025-11-12 18:59:53,101] Trial 133 finished with value: 0.2555588208359044 and parameters: {'model_type': 'graphsage', 'hidden_dims': '[256, 128, 64]', 'dropout': 0.17382253232233166, 'batch_norm': False, 'lr': 8.028602060884218e-05, 'weight_decay': 3.2552268874547097e-06, 'epochs': 118, 'loss': 'mae', 'optimizer': 'adam', 'graph_mode': 'cutoff', 'cutoff': 0.43070724050137, 'grm_norm': 'cosine', 'self_loops': True, 'use_snp_selection': False}. Best is trial 112 with value: 0.2786953703733425.
[I 2025-11-12 19:01:04,912] Trial 134 finished with value: 0.2712231530322843 and parameters: {'model_type': 'graphsage', 'hidden_dims': '[256, 128, 64]', 'dropout': 0.20124953553529618, 'batch_norm': False, 'lr': 4.241914470664412e-05, 'weight_decay': 2.0976660084300147e-06, 'epochs': 140, 'loss': 'mae', 'optimizer': 'adam', 'graph_mode': 'cutoff', 'cutoff': 0.3958919480582404, 'grm_norm': 'cosine', 'self_loops': True, 'use_snp_selection': False}. Best is trial 112 with value: 0.2786953703733425.
[I 2025-11-12 19:02:03,122] Trial 135 finished with value: 0.25993939519652703 and parameters: {'model_type': 'graphsage', 'hidden_dims': '[256, 128, 64]', 'dropout': 0.20678137372810187, 'batch_norm': False, 'lr': 4.412390868515019e-05, 'weight_decay': 2.166914285505197e-06, 'epochs': 106, 'loss': 'mae', 'optimizer': 'adam', 'graph_mode': 'cutoff', 'cutoff': 0.3963957622360132, 'grm_norm': 'cosine', 'self_loops': True, 'use_snp_selection': False}. Best is trial 112 with value: 0.2786953703733425.
[I 2025-11-12 19:03:04,186] Trial 136 finished with value: 0.2620862519436492 and parameters: {'model_type': 'graphsage', 'hidden_dims': '[256, 128, 64]', 'dropout': 0.24667094018493135, 'batch_norm': False, 'lr': 5.983698640447015e-05, 'weight_decay': 1.7030643092656537e-06, 'epochs': 114, 'loss': 'mae', 'optimizer': 'adam', 'graph_mode': 'cutoff', 'cutoff': 0.4046403538493929, 'grm_norm': 'cosine', 'self_loops': True, 'use_snp_selection': False}. Best is trial 112 with value: 0.2786953703733425.
[I 2025-11-12 19:04:11,955] Trial 137 finished with value: 0.20569261510125428 and parameters: {'model_type': 'graphsage', 'hidden_dims': '[256, 128, 64]', 'dropout': 0.18221310348083233, 'batch_norm': False, 'lr': 2.966200367135454e-05, 'weight_decay': 1.4685143434847329e-06, 'epochs': 134, 'loss': 'mse', 'optimizer': 'adam', 'graph_mode': 'knn', 'source': 'grm', 'knn_k': 2, 'weighted_edges': True, 'symmetrize_mode': 'union', 'use_snp_selection': False}. Best is trial 112 with value: 0.2786953703733425.
[I 2025-11-12 19:05:22,620] Trial 138 finished with value: 0.24895279534410988 and parameters: {'model_type': 'graphsage', 'hidden_dims': '[256, 128, 64]', 'dropout': 0.161520531468811, 'batch_norm': False, 'lr': 4.072104547244119e-05, 'weight_decay': 2.6328200120991467e-06, 'epochs': 142, 'loss': 'mae', 'optimizer': 'adam', 'graph_mode': 'cutoff', 'cutoff': 0.44933445237030845, 'grm_norm': 'cosine', 'self_loops': True, 'use_snp_selection': False}. Best is trial 112 with value: 0.2786953703733425.
[I 2025-11-12 19:06:21,705] Trial 139 finished with value: 0.26542973845144235 and parameters: {'model_type': 'graphsage', 'hidden_dims': '[256, 128, 64]', 'dropout': 0.21374995196783284, 'batch_norm': False, 'lr': 5.112967963485107e-05, 'weight_decay': 1.1843474505838346e-06, 'epochs': 107, 'loss': 'mae', 'optimizer': 'adam', 'graph_mode': 'cutoff', 'cutoff': 0.38201197746825255, 'grm_norm': 'cosine', 'self_loops': True, 'use_snp_selection': False}. Best is trial 112 with value: 0.2786953703733425.
[I 2025-11-12 19:07:39,493] Trial 140 finished with value: 0.26291172380860334 and parameters: {'model_type': 'graphsage', 'hidden_dims': '[256, 128, 64]', 'dropout': 0.23437204237868006, 'batch_norm': False, 'lr': 2.1131863527769193e-05, 'weight_decay': 5.938796866409551e-06, 'epochs': 157, 'loss': 'mae', 'optimizer': 'adam', 'graph_mode': 'cutoff', 'cutoff': 0.4282378145753314, 'grm_norm': 'cosine', 'self_loops': False, 'use_snp_selection': False}. Best is trial 112 with value: 0.2786953703733425.
[I 2025-11-12 19:08:38,525] Trial 141 finished with value: 0.27033737608592634 and parameters: {'model_type': 'graphsage', 'hidden_dims': '[256, 128, 64]', 'dropout': 0.21577197626340477, 'batch_norm': False, 'lr': 4.854743473660881e-05, 'weight_decay': 1.1439831172253741e-06, 'epochs': 103, 'loss': 'mae', 'optimizer': 'adam', 'graph_mode': 'cutoff', 'cutoff': 0.3850704983210438, 'grm_norm': 'cosine', 'self_loops': True, 'use_snp_selection': False}. Best is trial 112 with value: 0.2786953703733425.
[I 2025-11-12 19:09:33,963] Trial 142 finished with value: 0.2733219561605786 and parameters: {'model_type': 'graphsage', 'hidden_dims': '[256, 128, 64]', 'dropout': 0.1707627709288809, 'batch_norm': False, 'lr': 7.120891058641526e-05, 'weight_decay': 9.126737079349003e-07, 'epochs': 98, 'loss': 'mae', 'optimizer': 'adam', 'graph_mode': 'cutoff', 'cutoff': 0.38918282240386126, 'grm_norm': 'cosine', 'self_loops': True, 'use_snp_selection': False}. Best is trial 112 with value: 0.2786953703733425.
[I 2025-11-12 19:10:40,373] Trial 143 finished with value: 0.2628370579640449 and parameters: {'model_type': 'graphsage', 'hidden_dims': '[256, 128, 64]', 'dropout': 0.1727678015314678, 'batch_norm': False, 'lr': 6.459586926260352e-05, 'weight_decay': 9.552485456599928e-07, 'epochs': 126, 'loss': 'mae', 'optimizer': 'adam', 'graph_mode': 'cutoff', 'cutoff': 0.3894472482451029, 'grm_norm': 'cosine', 'self_loops': True, 'use_snp_selection': False}. Best is trial 112 with value: 0.2786953703733425.
[I 2025-11-12 19:11:44,830] Trial 144 finished with value: 0.2734913362077415 and parameters: {'model_type': 'graphsage', 'hidden_dims': '[256, 128, 64]', 'dropout': 0.17838156218028098, 'batch_norm': False, 'lr': 5.494269806765258e-05, 'weight_decay': 7.399122076324523e-07, 'epochs': 115, 'loss': 'mae', 'optimizer': 'adam', 'graph_mode': 'cutoff', 'cutoff': 0.34631637040383134, 'grm_norm': 'cosine', 'self_loops': True, 'use_snp_selection': False}. Best is trial 112 with value: 0.2786953703733425.
[I 2025-11-12 19:12:43,335] Trial 145 finished with value: 0.2632335488829898 and parameters: {'model_type': 'graphsage', 'hidden_dims': '[256, 128, 64]', 'dropout': 0.3495517170551739, 'batch_norm': False, 'lr': 5.385975665626973e-05, 'weight_decay': 7.259763063490165e-07, 'epochs': 101, 'loss': 'mae', 'optimizer': 'adam', 'graph_mode': 'cutoff', 'cutoff': 0.34563823914938296, 'grm_norm': 'cosine', 'self_loops': True, 'use_snp_selection': False}. Best is trial 112 with value: 0.2786953703733425.
[I 2025-11-12 19:13:48,364] Trial 146 finished with value: 0.26958563844481204 and parameters: {'model_type': 'graphsage', 'hidden_dims': '[256, 128, 64]', 'dropout': 0.20039210842676705, 'batch_norm': False, 'lr': 7.3170237493571e-05, 'weight_decay': 1.2138422477295704e-06, 'epochs': 119, 'loss': 'mae', 'optimizer': 'adam', 'graph_mode': 'cutoff', 'cutoff': 0.35955920469666536, 'grm_norm': 'cosine', 'self_loops': True, 'use_snp_selection': False}. Best is trial 112 with value: 0.2786953703733425.
[I 2025-11-12 19:15:05,756] Trial 147 finished with value: 0.25466883433470106 and parameters: {'model_type': 'graphsage', 'hidden_dims': '[256, 128, 64]', 'dropout': 0.21820989681149475, 'batch_norm': False, 'lr': 7.105194911854211e-05, 'weight_decay': 5.900697764509767e-07, 'epochs': 127, 'loss': 'mae', 'optimizer': 'adam', 'graph_mode': 'cutoff', 'cutoff': 0.2977159428560468, 'grm_norm': 'cosine', 'self_loops': True, 'use_snp_selection': False}. Best is trial 112 with value: 0.2786953703733425.
[I 2025-11-12 19:16:04,134] Trial 148 finished with value: 0.2728611495249554 and parameters: {'model_type': 'graphsage', 'hidden_dims': '[256, 128, 64]', 'dropout': 0.2030064949907902, 'batch_norm': False, 'lr': 8.776732764932842e-05, 'weight_decay': 8.716504206511867e-07, 'epochs': 100, 'loss': 'mae', 'optimizer': 'adam', 'graph_mode': 'cutoff', 'cutoff': 0.3418063581303221, 'grm_norm': 'cosine', 'self_loops': True, 'use_snp_selection': False}. Best is trial 112 with value: 0.2786953703733425.
[I 2025-11-12 19:17:08,980] Trial 149 finished with value: 0.23167077488394838 and parameters: {'model_type': 'graphsage', 'hidden_dims': '[256, 128, 64]', 'dropout': 0.26590284323411295, 'batch_norm': True, 'lr': 8.424600210714326e-05, 'weight_decay': 9.652392516597237e-07, 'epochs': 112, 'loss': 'mse', 'optimizer': 'adam', 'graph_mode': 'cutoff', 'cutoff': 0.33842230552527, 'grm_norm': 'cosine', 'self_loops': True, 'use_snp_selection': False}. Best is trial 112 with value: 0.2786953703733425.
[I 2025-11-12 19:19:00,976] Trial 0 finished with value: 0.14783276468569256 and parameters: {'model_type': 'graphsage', 'hidden_dims': '[128, 64]', 'dropout': 0.199031432379812, 'batch_norm': True, 'lr': 1.8408544111075837e-06, 'weight_decay': 5.5136510071208614e-05, 'epochs': 336, 'loss': 'mae', 'optimizer': 'adam', 'graph_mode': 'knn', 'source': 'grm', 'knn_k': 8, 'weighted_edges': True, 'symmetrize_mode': 'mutual', 'use_snp_selection': False}. Best is trial 0 with value: 0.14783276468569256.
[I 2025-11-12 19:19:38,382] Trial 1 finished with value: 0.21316744175754793 and parameters: {'model_type': 'graphsage', 'hidden_dims': '[128, 64]', 'dropout': 0.40051947670227217, 'batch_norm': True, 'lr': 0.0005320428882732732, 'weight_decay': 1.89210117736594e-06, 'epochs': 68, 'loss': 'mse', 'optimizer': 'adam', 'graph_mode': 'knn', 'source': 'grm', 'knn_k': 7, 'weighted_edges': True, 'symmetrize_mode': 'union', 'use_snp_selection': False}. Best is trial 1 with value: 0.21316744175754793.
[I 2025-11-12 19:20:37,691] Trial 2 finished with value: 0.16301708460963 and parameters: {'model_type': 'graphsage', 'hidden_dims': '[256, 128]', 'dropout': 0.5105528289184642, 'batch_norm': False, 'lr': 0.0006804279372404962, 'weight_decay': 0.0008922815224257085, 'epochs': 181, 'loss': 'mse', 'optimizer': 'adam', 'graph_mode': 'cutoff', 'cutoff': 0.5741905641612706, 'grm_norm': 'gcn', 'self_loops': False, 'use_snp_selection': True, 'num_snps': 26910}. Best is trial 1 with value: 0.21316744175754793.
[I 2025-11-12 19:21:42,365] Trial 3 finished with value: 0.1903448501339112 and parameters: {'model_type': 'graphsage', 'hidden_dims': '[256, 128, 64]', 'dropout': 0.5390483213624292, 'batch_norm': False, 'lr': 3.4705625989073525e-05, 'weight_decay': 2.4623319020131338e-05, 'epochs': 121, 'loss': 'mse', 'optimizer': 'adam', 'graph_mode': 'knn', 'source': 'grm', 'knn_k': 6, 'weighted_edges': False, 'symmetrize_mode': 'mutual', 'use_snp_selection': True, 'num_snps': 30713}. Best is trial 1 with value: 0.21316744175754793.
[I 2025-11-12 19:22:32,506] Trial 4 finished with value: 0.22769278779740576 and parameters: {'model_type': 'graphsage', 'hidden_dims': '[128, 64]', 'dropout': 0.13404863676897502, 'batch_norm': False, 'lr': 0.0001431556295367288, 'weight_decay': 2.2084517750726675e-05, 'epochs': 51, 'loss': 'mae', 'optimizer': 'adam', 'graph_mode': 'cutoff', 'cutoff': 0.6714268476993044, 'grm_norm': 'none', 'self_loops': False, 'use_snp_selection': True, 'num_snps': 45645}. Best is trial 4 with value: 0.22769278779740576.
[I 2025-11-12 19:23:47,657] Trial 5 finished with value: 0.21812427569522122 and parameters: {'model_type': 'graphsage', 'hidden_dims': '[256, 128]', 'dropout': 0.42253606323412096, 'batch_norm': False, 'lr': 4.238630400638805e-05, 'weight_decay': 8.074086040046576e-07, 'epochs': 158, 'loss': 'mae', 'optimizer': 'adam', 'graph_mode': 'knn', 'source': 'grm', 'knn_k': 1, 'weighted_edges': False, 'symmetrize_mode': 'mutual', 'use_snp_selection': True, 'num_snps': 43113}. Best is trial 4 with value: 0.22769278779740576.
[I 2025-11-12 19:25:48,325] Trial 6 finished with value: 0.21240917691539862 and parameters: {'model_type': 'graphsage', 'hidden_dims': '[512, 256]', 'dropout': 0.3534893146320237, 'batch_norm': True, 'lr': 0.000251307964226932, 'weight_decay': 1.821819791794022e-05, 'epochs': 223, 'loss': 'mae', 'optimizer': 'adam', 'graph_mode': 'knn', 'source': 'grm', 'knn_k': 1, 'weighted_edges': True, 'symmetrize_mode': 'mutual', 'use_snp_selection': False}. Best is trial 4 with value: 0.22769278779740576.
[I 2025-11-12 19:27:31,422] Trial 7 finished with value: 0.2106398050030359 and parameters: {'model_type': 'graphsage', 'hidden_dims': '[512, 256]', 'dropout': 0.1105825955860775, 'batch_norm': True, 'lr': 2.374338412754043e-05, 'weight_decay': 1.1284721123340274e-05, 'epochs': 190, 'loss': 'mse', 'optimizer': 'adam', 'graph_mode': 'cutoff', 'cutoff': 0.719872204109604, 'grm_norm': 'gcn', 'self_loops': False, 'use_snp_selection': False}. Best is trial 4 with value: 0.22769278779740576.
[I 2025-11-12 19:28:56,650] Trial 8 finished with value: 0.22221766913273272 and parameters: {'model_type': 'graphsage', 'hidden_dims': '[512, 128]', 'dropout': 0.5066580418354021, 'batch_norm': True, 'lr': 0.00039213678276659976, 'weight_decay': 3.43655320802934e-06, 'epochs': 120, 'loss': 'mse', 'optimizer': 'adam', 'graph_mode': 'cutoff', 'cutoff': 0.34923059576505366, 'grm_norm': 'cosine', 'self_loops': True, 'use_snp_selection': False}. Best is trial 4 with value: 0.22769278779740576.
[I 2025-11-12 19:29:54,102] Trial 9 finished with value: 0.2235047452874408 and parameters: {'model_type': 'graphsage', 'hidden_dims': '[512, 256]', 'dropout': 0.301734920240333, 'batch_norm': False, 'lr': 6.650961854953448e-06, 'weight_decay': 6.861575656590315e-05, 'epochs': 150, 'loss': 'mae', 'optimizer': 'adam', 'graph_mode': 'cutoff', 'cutoff': 0.2857569870061939, 'grm_norm': 'cosine_then_gcn', 'self_loops': False, 'use_snp_selection': True, 'num_snps': 12722}. Best is trial 4 with value: 0.22769278779740576.
[I 2025-11-12 19:31:07,392] Trial 10 finished with value: 0.12867933728213424 and parameters: {'model_type': 'graphsage', 'hidden_dims': '[512, 64]', 'dropout': 0.22492338276159776, 'batch_norm': False, 'lr': 0.00014233761188460356, 'weight_decay': 1.8772904431456567e-07, 'epochs': 41, 'loss': 'mae', 'optimizer': 'adam', 'graph_mode': 'cutoff', 'cutoff': 0.8740100033033124, 'grm_norm': 'none', 'self_loops': True, 'use_snp_selection': True, 'num_snps': 58960}. Best is trial 4 with value: 0.22769278779740576.
[I 2025-11-12 19:32:06,647] Trial 11 finished with value: 0.18210447813870934 and parameters: {'model_type': 'graphsage', 'hidden_dims': '[128, 64]', 'dropout': 0.23879924216512757, 'batch_norm': False, 'lr': 3.1730969601519765e-06, 'weight_decay': 0.00018467653946554991, 'epochs': 254, 'loss': 'mae', 'optimizer': 'adam', 'graph_mode': 'cutoff', 'cutoff': 0.20190156779348867, 'grm_norm': 'cosine_then_gcn', 'self_loops': False, 'use_snp_selection': True, 'num_snps': 10369}. Best is trial 4 with value: 0.22769278779740576.
[I 2025-11-12 19:32:41,951] Trial 12 finished with value: 0.2148859368099833 and parameters: {'model_type': 'graphsage', 'hidden_dims': '[512, 256]', 'dropout': 0.10070859634525933, 'batch_norm': False, 'lr': 8.313753911922747e-06, 'weight_decay': 0.000133333526948601, 'epochs': 107, 'loss': 'mae', 'optimizer': 'adam', 'graph_mode': 'cutoff', 'cutoff': 0.5012009858727229, 'grm_norm': 'none', 'self_loops': False, 'use_snp_selection': True, 'num_snps': 3222}. Best is trial 4 with value: 0.22769278779740576.
