[I 2025-11-03 15:15:56,592] Trial 32 finished with value: 0.0652384974414424 and parameters: {'model_type': 'graphsage', 'hidden_dims': '[128, 64]', 'dropout': 0.48214388291491245, 'batch_norm': True, 'lr': 0.0002690859008396983, 'weight_decay': 4.588651012742765e-06, 'epochs': 207, 'loss': 'mse', 'optimizer': 'adam', 'graph_mode': 'knn', 'source': 'grm', 'knn_k': 5, 'weighted_edges': False, 'symmetrize_mode': 'union', 'use_snp_selection': False}. Best is trial 32 with value: 0.0652384974414424.
[I 2025-11-03 15:15:58,674] Trial 33 finished with value: 0.03648401323721437 and parameters: {'model_type': 'graphsage', 'hidden_dims': '[128, 64]', 'dropout': 0.48861105791493986, 'batch_norm': True, 'lr': 0.0002769535427314753, 'weight_decay': 3.779011812981435e-06, 'epochs': 220, 'loss': 'mse', 'optimizer': 'adam', 'graph_mode': 'knn', 'source': 'grm', 'knn_k': 5, 'weighted_edges': False, 'symmetrize_mode': 'union', 'use_snp_selection': False}. Best is trial 32 with value: 0.0652384974414424.
[I 2025-11-03 15:16:01,036] Trial 34 finished with value: 0.05974937222733065 and parameters: {'model_type': 'graphsage', 'hidden_dims': '[256, 128]', 'dropout': 0.543542472496069, 'batch_norm': True, 'lr': 0.0002209403591954082, 'weight_decay': 1.244817609169522e-05, 'epochs': 205, 'loss': 'mse', 'optimizer': 'adam', 'graph_mode': 'knn', 'source': 'grm', 'knn_k': 4, 'weighted_edges': False, 'symmetrize_mode': 'union', 'use_snp_selection': False}. Best is trial 32 with value: 0.0652384974414424.
[I 2025-11-03 15:16:02,848] Trial 35 finished with value: 0.025446704703773262 and parameters: {'model_type': 'graphsage', 'hidden_dims': '[256, 128]', 'dropout': 0.5485360196904409, 'batch_norm': False, 'lr': 0.00021943148282986156, 'weight_decay': 3.184998275725864e-05, 'epochs': 250, 'loss': 'mse', 'optimizer': 'adam', 'graph_mode': 'knn', 'source': 'grm', 'knn_k': 2, 'weighted_edges': False, 'symmetrize_mode': 'union', 'use_snp_selection': True, 'num_snps': 2074}. Best is trial 32 with value: 0.0652384974414424.
[I 2025-11-03 15:16:05,147] Trial 36 finished with value: -0.00545985470821202 and parameters: {'model_type': 'graphsage', 'hidden_dims': '[256, 128]', 'dropout': 0.5922025096482298, 'batch_norm': True, 'lr': 4.786997291765421e-05, 'weight_decay': 1.600164621857413e-05, 'epochs': 203, 'loss': 'mse', 'optimizer': 'adam', 'graph_mode': 'cutoff', 'cutoff': 0.42596163795855535, 'grm_norm': 'cosine', 'self_loops': True, 'use_snp_selection': False}. Best is trial 32 with value: 0.0652384974414424.
[I 2025-11-03 15:16:07,414] Trial 37 finished with value: 0.0493746739343732 and parameters: {'model_type': 'graphsage', 'hidden_dims': '[256, 128]', 'dropout': 0.5288773816827776, 'batch_norm': False, 'lr': 0.00011828876648283413, 'weight_decay': 6.00626475916736e-06, 'epochs': 245, 'loss': 'mse', 'optimizer': 'adam', 'graph_mode': 'knn', 'source': 'grm', 'knn_k': 6, 'weighted_edges': False, 'symmetrize_mode': 'mutual', 'use_snp_selection': True, 'num_snps': 15344}. Best is trial 32 with value: 0.0652384974414424.
[I 2025-11-03 15:16:09,942] Trial 38 finished with value: 0.03608005861871377 and parameters: {'model_type': 'graphsage', 'hidden_dims': '[256, 128]', 'dropout': 0.33515463685730995, 'batch_norm': True, 'lr': 5.768410177829182e-05, 'weight_decay': 1.369443491619705e-05, 'epochs': 211, 'loss': 'mse', 'optimizer': 'adam', 'graph_mode': 'cutoff', 'cutoff': 0.2236606579884875, 'grm_norm': 'cosine_then_gcn', 'self_loops': True, 'use_snp_selection': False}. Best is trial 32 with value: 0.0652384974414424.
[I 2025-11-03 15:16:14,652] Trial 39 finished with value: -0.004360123438165119 and parameters: {'model_type': 'graphsage', 'hidden_dims': '[512, 128]', 'dropout': 0.5071458724775424, 'batch_norm': False, 'lr': 2.6261471768220783e-05, 'weight_decay': 2.0010368299618708e-05, 'epochs': 179, 'loss': 'mae', 'optimizer': 'adam', 'graph_mode': 'knn', 'source': 'grm', 'knn_k': 3, 'weighted_edges': False, 'symmetrize_mode': 'union', 'use_snp_selection': True, 'num_snps': 58379}. Best is trial 32 with value: 0.0652384974414424.
[I 2025-11-03 15:16:18,297] Trial 40 finished with value: 0.05083440904111543 and parameters: {'model_type': 'graphsage', 'hidden_dims': '[512, 256]', 'dropout': 0.44579208837049056, 'batch_norm': True, 'lr': 1.7411160941637492e-05, 'weight_decay': 0.00010920338164921508, 'epochs': 234, 'loss': 'mse', 'optimizer': 'adam', 'graph_mode': 'cutoff', 'cutoff': 0.8775832147217085, 'grm_norm': 'cosine', 'self_loops': True, 'use_snp_selection': False}. Best is trial 32 with value: 0.0652384974414424.
[I 2025-11-03 15:16:20,699] Trial 41 finished with value: 0.0570499021176008 and parameters: {'model_type': 'graphsage', 'hidden_dims': '[256, 128, 64]', 'dropout': 0.4795706908923568, 'batch_norm': True, 'lr': 0.00045836207832427694, 'weight_decay': 9.23146552727559e-06, 'epochs': 172, 'loss': 'mse', 'optimizer': 'adam', 'graph_mode': 'knn', 'source': 'grm', 'knn_k': 4, 'weighted_edges': False, 'symmetrize_mode': 'union', 'use_snp_selection': False}. Best is trial 32 with value: 0.0652384974414424.
[I 2025-11-03 15:16:22,649] Trial 42 finished with value: 0.04050676015139594 and parameters: {'model_type': 'graphsage', 'hidden_dims': '[128, 64]', 'dropout': 0.5517855277421778, 'batch_norm': True, 'lr': 0.00043661244744140106, 'weight_decay': 9.791236840254048e-06, 'epochs': 186, 'loss': 'mse', 'optimizer': 'adam', 'graph_mode': 'knn', 'source': 'grm', 'knn_k': 5, 'weighted_edges': False, 'symmetrize_mode': 'union', 'use_snp_selection': False}. Best is trial 32 with value: 0.0652384974414424.
[I 2025-11-03 15:16:24,693] Trial 43 finished with value: 0.05610466582915979 and parameters: {'model_type': 'graphsage', 'hidden_dims': '[256, 128]', 'dropout': 0.5224577385256993, 'batch_norm': True, 'lr': 0.0007312283361247297, 'weight_decay': 4.835529326997452e-06, 'epochs': 133, 'loss': 'mse', 'optimizer': 'adam', 'graph_mode': 'knn', 'source': 'grm', 'knn_k': 4, 'weighted_edges': False, 'symmetrize_mode': 'union', 'use_snp_selection': False}. Best is trial 32 with value: 0.0652384974414424.
[I 2025-11-03 15:16:28,067] Trial 44 finished with value: 0.05100801128857648 and parameters: {'model_type': 'graphsage', 'hidden_dims': '[512, 256]', 'dropout': 0.4995411464232956, 'batch_norm': True, 'lr': 0.00019810871399710976, 'weight_decay': 2.8766591148662978e-05, 'epochs': 163, 'loss': 'mse', 'optimizer': 'adam', 'graph_mode': 'knn', 'source': 'grm', 'knn_k': 5, 'weighted_edges': False, 'symmetrize_mode': 'union', 'use_snp_selection': False}. Best is trial 32 with value: 0.0652384974414424.
[I 2025-11-03 15:16:30,935] Trial 45 finished with value: 0.07154365845590925 and parameters: {'model_type': 'graphsage', 'hidden_dims': '[256, 128, 64]', 'dropout': 0.5628178345790349, 'batch_norm': True, 'lr': 0.00033094907625716403, 'weight_decay': 1.164853199468847e-05, 'epochs': 259, 'loss': 'mse', 'optimizer': 'adam', 'graph_mode': 'knn', 'source': 'grm', 'knn_k': 3, 'weighted_edges': False, 'symmetrize_mode': 'mutual', 'use_snp_selection': False}. Best is trial 45 with value: 0.07154365845590925.
[I 2025-11-03 15:16:33,818] Trial 46 finished with value: 0.04877287583591998 and parameters: {'model_type': 'graphsage', 'hidden_dims': '[256, 128, 64]', 'dropout': 0.5747781409148716, 'batch_norm': True, 'lr': 0.0003122109494826367, 'weight_decay': 4.343426990082708e-05, 'epochs': 264, 'loss': 'mse', 'optimizer': 'adam', 'graph_mode': 'knn', 'source': 'grm', 'knn_k': 2, 'weighted_edges': False, 'symmetrize_mode': 'mutual', 'use_snp_selection': False}. Best is trial 45 with value: 0.07154365845590925.
[I 2025-11-03 15:16:37,172] Trial 47 finished with value: 0.04876861325094472 and parameters: {'model_type': 'graphsage', 'hidden_dims': '[256, 128, 64]', 'dropout': 0.572912631160041, 'batch_norm': False, 'lr': 0.0001583431397169055, 'weight_decay': 9.872974455272546e-06, 'epochs': 193, 'loss': 'mse', 'optimizer': 'adam', 'graph_mode': 'knn', 'source': 'grm', 'knn_k': 1, 'weighted_edges': False, 'symmetrize_mode': 'mutual', 'use_snp_selection': True, 'num_snps': 43485}. Best is trial 45 with value: 0.07154365845590925.
[I 2025-11-03 15:16:40,256] Trial 48 finished with value: 0.041962513043118786 and parameters: {'model_type': 'graphsage', 'hidden_dims': '[256, 128, 64]', 'dropout': 0.5253083353364905, 'batch_norm': True, 'lr': 0.00011695163353526533, 'weight_decay': 2.2722692571248303e-05, 'epochs': 299, 'loss': 'mse', 'optimizer': 'adam', 'graph_mode': 'knn', 'source': 'grm', 'knn_k': 3, 'weighted_edges': False, 'symmetrize_mode': 'mutual', 'use_snp_selection': False}. Best is trial 45 with value: 0.07154365845590925.
[I 2025-11-03 15:16:42,322] Trial 49 finished with value: 0.05469771090084871 and parameters: {'model_type': 'graphsage', 'hidden_dims': '[128, 64]', 'dropout': 0.17197506862574322, 'batch_norm': True, 'lr': 0.00023484956938105966, 'weight_decay': 0.0007982115875512224, 'epochs': 236, 'loss': 'mse', 'optimizer': 'adam', 'graph_mode': 'cutoff', 'cutoff': 0.5358834616354312, 'grm_norm': 'gcn', 'self_loops': False, 'use_snp_selection': False}. Best is trial 45 with value: 0.07154365845590925.
[I 2025-11-03 15:16:45,428] Trial 50 finished with value: 0.05715825987060368 and parameters: {'model_type': 'graphsage', 'hidden_dims': '[512, 128]', 'dropout': 0.5998964232388712, 'batch_norm': True, 'lr': 0.0004289087267214615, 'weight_decay': 1.1277174676671714e-05, 'epochs': 145, 'loss': 'mse', 'optimizer': 'adam', 'graph_mode': 'knn', 'source': 'grm', 'knn_k': 2, 'weighted_edges': False, 'symmetrize_mode': 'mutual', 'use_snp_selection': False}. Best is trial 45 with value: 0.07154365845590925.
[I 2025-11-03 15:16:48,508] Trial 51 finished with value: 0.025228106663159063 and parameters: {'model_type': 'graphsage', 'hidden_dims': '[512, 128]', 'dropout': 0.5674270430877901, 'batch_norm': True, 'lr': 0.0003570511650943968, 'weight_decay': 1.2351524618788335e-05, 'epochs': 145, 'loss': 'mse', 'optimizer': 'adam', 'graph_mode': 'knn', 'source': 'grm', 'knn_k': 2, 'weighted_edges': False, 'symmetrize_mode': 'mutual', 'use_snp_selection': False}. Best is trial 45 with value: 0.07154365845590925.
[I 2025-11-03 15:16:51,724] Trial 52 finished with value: 0.06347198554952942 and parameters: {'model_type': 'graphsage', 'hidden_dims': '[512, 128]', 'dropout': 0.598572814068896, 'batch_norm': True, 'lr': 0.0006929512360759747, 'weight_decay': 8.746104545116508e-06, 'epochs': 165, 'loss': 'mse', 'optimizer': 'adam', 'graph_mode': 'knn', 'source': 'grm', 'knn_k': 1, 'weighted_edges': False, 'symmetrize_mode': 'mutual', 'use_snp_selection': False}. Best is trial 45 with value: 0.07154365845590925.
[I 2025-11-03 15:16:54,563] Trial 53 finished with value: 0.053783135918374 and parameters: {'model_type': 'graphsage', 'hidden_dims': '[512, 128]', 'dropout': 0.5961314504310191, 'batch_norm': True, 'lr': 0.0007067301613107766, 'weight_decay': 3.4600628780689438e-06, 'epochs': 113, 'loss': 'mse', 'optimizer': 'adam', 'graph_mode': 'knn', 'source': 'grm', 'knn_k': 1, 'weighted_edges': False, 'symmetrize_mode': 'mutual', 'use_snp_selection': False}. Best is trial 45 with value: 0.07154365845590925.
[I 2025-11-03 15:16:58,460] Trial 54 finished with value: 0.05227820260400958 and parameters: {'model_type': 'graphsage', 'hidden_dims': '[512, 128]', 'dropout': 0.5806711482154838, 'batch_norm': True, 'lr': 0.00036148905481925747, 'weight_decay': 1.87687438470139e-05, 'epochs': 258, 'loss': 'mse', 'optimizer': 'adam', 'graph_mode': 'knn', 'source': 'grm', 'knn_k': 1, 'weighted_edges': False, 'symmetrize_mode': 'mutual', 'use_snp_selection': False}. Best is trial 45 with value: 0.07154365845590925.
[I 2025-11-03 15:17:01,293] Trial 55 finished with value: 0.04935867312775736 and parameters: {'model_type': 'graphsage', 'hidden_dims': '[512, 128]', 'dropout': 0.5407873392075679, 'batch_norm': True, 'lr': 0.00014070843054547397, 'weight_decay': 6.240414816594991e-05, 'epochs': 110, 'loss': 'mse', 'optimizer': 'adam', 'graph_mode': 'knn', 'source': 'grm', 'knn_k': 2, 'weighted_edges': False, 'symmetrize_mode': 'mutual', 'use_snp_selection': False}. Best is trial 45 with value: 0.07154365845590925.
[I 2025-11-03 15:17:05,387] Trial 56 finished with value: 0.04823467104970062 and parameters: {'model_type': 'graphsage', 'hidden_dims': '[512, 128]', 'dropout': 0.599198400102662, 'batch_norm': True, 'lr': 0.0006314947335027413, 'weight_decay': 6.81690188242538e-06, 'epochs': 288, 'loss': 'mse', 'optimizer': 'adam', 'graph_mode': 'knn', 'source': 'grm', 'knn_k': 1, 'weighted_edges': False, 'symmetrize_mode': 'mutual', 'use_snp_selection': False}. Best is trial 45 with value: 0.07154365845590925.
[I 2025-11-03 15:17:08,544] Trial 57 finished with value: 0.07680158261884067 and parameters: {'model_type': 'graphsage', 'hidden_dims': '[512, 256]', 'dropout': 0.5552988644036942, 'batch_norm': True, 'lr': 0.0002653131488430407, 'weight_decay': 2.344239914284981e-06, 'epochs': 150, 'loss': 'mse', 'optimizer': 'adam', 'graph_mode': 'knn', 'source': 'grm', 'knn_k': 3, 'weighted_edges': False, 'symmetrize_mode': 'mutual', 'use_snp_selection': False}. Best is trial 57 with value: 0.07680158261884067.
[I 2025-11-03 15:17:11,755] Trial 58 finished with value: 0.08637900504762047 and parameters: {'model_type': 'graphsage', 'hidden_dims': '[512, 256]', 'dropout': 0.5558994132231556, 'batch_norm': True, 'lr': 0.0002129228416224135, 'weight_decay': 1.198853724876981e-06, 'epochs': 159, 'loss': 'mse', 'optimizer': 'adam', 'graph_mode': 'knn', 'source': 'grm', 'knn_k': 3, 'weighted_edges': False, 'symmetrize_mode': 'mutual', 'use_snp_selection': False}. Best is trial 58 with value: 0.08637900504762047.
[I 2025-11-03 15:17:14,946] Trial 59 finished with value: 0.029204684875025404 and parameters: {'model_type': 'graphsage', 'hidden_dims': '[512, 256]', 'dropout': 0.5571812309435616, 'batch_norm': True, 'lr': 7.838213514421157e-05, 'weight_decay': 1.2905506979893368e-06, 'epochs': 156, 'loss': 'mse', 'optimizer': 'adam', 'graph_mode': 'knn', 'source': 'grm', 'knn_k': 3, 'weighted_edges': False, 'symmetrize_mode': 'mutual', 'use_snp_selection': False}. Best is trial 58 with value: 0.08637900504762047.
[I 2025-11-03 15:17:17,973] Trial 60 finished with value: 0.05195482070610809 and parameters: {'model_type': 'graphsage', 'hidden_dims': '[512, 256]', 'dropout': 0.5204351463801555, 'batch_norm': True, 'lr': 0.0002811130488768277, 'weight_decay': 2.6512155852997482e-06, 'epochs': 127, 'loss': 'mse', 'optimizer': 'adam', 'graph_mode': 'knn', 'source': 'grm', 'knn_k': 6, 'weighted_edges': False, 'symmetrize_mode': 'mutual', 'use_snp_selection': False}. Best is trial 58 with value: 0.08637900504762047.
[I 2025-11-03 15:17:21,173] Trial 61 finished with value: 0.04402746046500933 and parameters: {'model_type': 'graphsage', 'hidden_dims': '[512, 256]', 'dropout': 0.5325283959776412, 'batch_norm': True, 'lr': 0.00022769643066153635, 'weight_decay': 2.105653578692689e-06, 'epochs': 162, 'loss': 'mse', 'optimizer': 'adam', 'graph_mode': 'knn', 'source': 'grm', 'knn_k': 3, 'weighted_edges': False, 'symmetrize_mode': 'mutual', 'use_snp_selection': False}. Best is trial 58 with value: 0.08637900504762047.
[I 2025-11-03 15:17:24,605] Trial 62 finished with value: 0.05916790627992769 and parameters: {'model_type': 'graphsage', 'hidden_dims': '[512, 256]', 'dropout': 0.5680701981003261, 'batch_norm': True, 'lr': 0.00018548722312510782, 'weight_decay': 1.4339026316582105e-06, 'epochs': 188, 'loss': 'mse', 'optimizer': 'adam', 'graph_mode': 'knn', 'source': 'grm', 'knn_k': 3, 'weighted_edges': False, 'symmetrize_mode': 'mutual', 'use_snp_selection': False}. Best is trial 58 with value: 0.08637900504762047.
[I 2025-11-03 15:17:28,170] Trial 63 finished with value: 0.06041570215269416 and parameters: {'model_type': 'graphsage', 'hidden_dims': '[512, 256]', 'dropout': 0.22187702461875722, 'batch_norm': True, 'lr': 0.00010101809404377495, 'weight_decay': 4.535398001365761e-07, 'epochs': 204, 'loss': 'mse', 'optimizer': 'adam', 'graph_mode': 'knn', 'source': 'grm', 'knn_k': 4, 'weighted_edges': False, 'symmetrize_mode': 'mutual', 'use_snp_selection': False}. Best is trial 58 with value: 0.08637900504762047.
[I 2025-11-03 15:17:31,734] Trial 64 finished with value: 0.02327113653630368 and parameters: {'model_type': 'graphsage', 'hidden_dims': '[512, 256]', 'dropout': 0.1336435669709088, 'batch_norm': True, 'lr': 9.762734652800221e-05, 'weight_decay': 4.0014340521439944e-07, 'epochs': 202, 'loss': 'mse', 'optimizer': 'adam', 'graph_mode': 'knn', 'source': 'grm', 'knn_k': 4, 'weighted_edges': False, 'symmetrize_mode': 'mutual', 'use_snp_selection': False}. Best is trial 58 with value: 0.08637900504762047.
[I 2025-11-03 15:17:35,010] Trial 65 finished with value: 0.04598430271640774 and parameters: {'model_type': 'graphsage', 'hidden_dims': '[512, 256]', 'dropout': 0.3159120377966791, 'batch_norm': True, 'lr': 0.00013749029236969856, 'weight_decay': 1.0328744089782672e-06, 'epochs': 168, 'loss': 'mse', 'optimizer': 'adam', 'graph_mode': 'knn', 'source': 'grm', 'knn_k': 5, 'weighted_edges': False, 'symmetrize_mode': 'mutual', 'use_snp_selection': False}. Best is trial 58 with value: 0.08637900504762047.
[I 2025-11-03 15:17:36,808] Trial 66 finished with value: 0.04114169467511191 and parameters: {'model_type': 'graphsage', 'hidden_dims': '[128, 64]', 'dropout': 0.22085481523942918, 'batch_norm': True, 'lr': 0.00031579111974988237, 'weight_decay': 3.2464384239463216e-07, 'epochs': 151, 'loss': 'mse', 'optimizer': 'adam', 'graph_mode': 'knn', 'source': 'grm', 'knn_k': 4, 'weighted_edges': False, 'symmetrize_mode': 'mutual', 'use_snp_selection': False}. Best is trial 58 with value: 0.08637900504762047.
[I 2025-11-03 15:17:39,265] Trial 67 finished with value: -0.04371623579695989 and parameters: {'model_type': 'graphsage', 'hidden_dims': '[512, 256]', 'dropout': 0.543625632076926, 'batch_norm': False, 'lr': 3.212076671454049e-06, 'weight_decay': 5.657193865374677e-07, 'epochs': 214, 'loss': 'mse', 'optimizer': 'adam', 'graph_mode': 'knn', 'source': 'grm', 'knn_k': 3, 'weighted_edges': False, 'symmetrize_mode': 'mutual', 'use_snp_selection': True, 'num_snps': 17897}. Best is trial 58 with value: 0.08637900504762047.
[I 2025-11-03 15:17:42,577] Trial 68 finished with value: 0.0462476621186845 and parameters: {'model_type': 'graphsage', 'hidden_dims': '[512, 256]', 'dropout': 0.5829611372198497, 'batch_norm': True, 'lr': 6.140975422987904e-05, 'weight_decay': 2.0053068307108536e-07, 'epochs': 183, 'loss': 'mse', 'optimizer': 'adam', 'graph_mode': 'cutoff', 'cutoff': 0.7364324640933693, 'grm_norm': 'cosine_then_gcn', 'self_loops': True, 'use_snp_selection': False}. Best is trial 58 with value: 0.08637900504762047.
[I 2025-11-03 15:17:45,154] Trial 69 finished with value: 0.06195506866798898 and parameters: {'model_type': 'graphsage', 'hidden_dims': '[128, 64]', 'dropout': 0.5023476677780265, 'batch_norm': True, 'lr': 0.00019208141934445034, 'weight_decay': 4.533480540159773e-06, 'epochs': 348, 'loss': 'mse', 'optimizer': 'adam', 'graph_mode': 'knn', 'source': 'grm', 'knn_k': 5, 'weighted_edges': False, 'symmetrize_mode': 'mutual', 'use_snp_selection': False}. Best is trial 58 with value: 0.08637900504762047.
[I 2025-11-03 15:17:47,707] Trial 70 finished with value: 0.048577972438959956 and parameters: {'model_type': 'graphsage', 'hidden_dims': '[128, 64]', 'dropout': 0.49921123888502017, 'batch_norm': True, 'lr': 0.00016957673111403645, 'weight_decay': 4.390317952621752e-06, 'epochs': 342, 'loss': 'mse', 'optimizer': 'adam', 'graph_mode': 'knn', 'source': 'grm', 'knn_k': 5, 'weighted_edges': False, 'symmetrize_mode': 'mutual', 'use_snp_selection': False}. Best is trial 58 with value: 0.08637900504762047.
[I 2025-11-03 15:17:50,142] Trial 71 finished with value: 0.04218742924597897 and parameters: {'model_type': 'graphsage', 'hidden_dims': '[128, 64]', 'dropout': 0.5575465381443935, 'batch_norm': True, 'lr': 0.00021785676548240706, 'weight_decay': 2.814280098152844e-06, 'epochs': 311, 'loss': 'mse', 'optimizer': 'adam', 'graph_mode': 'knn', 'source': 'grm', 'knn_k': 6, 'weighted_edges': False, 'symmetrize_mode': 'mutual', 'use_snp_selection': False}. Best is trial 58 with value: 0.08637900504762047.
[I 2025-11-03 15:17:52,120] Trial 72 finished with value: 0.03701866756681112 and parameters: {'model_type': 'graphsage', 'hidden_dims': '[128, 64]', 'dropout': 0.5089496762004732, 'batch_norm': True, 'lr': 0.00013116638104538163, 'weight_decay': 1.8825091443149843e-06, 'epochs': 196, 'loss': 'mse', 'optimizer': 'adam', 'graph_mode': 'knn', 'source': 'grm', 'knn_k': 5, 'weighted_edges': False, 'symmetrize_mode': 'mutual', 'use_snp_selection': False}. Best is trial 58 with value: 0.08637900504762047.
[I 2025-11-03 15:17:54,612] Trial 73 finished with value: 0.01244079679787408 and parameters: {'model_type': 'graphsage', 'hidden_dims': '[128, 64]', 'dropout': 0.45964855630144125, 'batch_norm': True, 'lr': 9.273595666303153e-05, 'weight_decay': 5.9727179609129824e-06, 'epochs': 327, 'loss': 'mse', 'optimizer': 'adam', 'graph_mode': 'knn', 'source': 'grm', 'knn_k': 4, 'weighted_edges': False, 'symmetrize_mode': 'mutual', 'use_snp_selection': False}. Best is trial 58 with value: 0.08637900504762047.
[I 2025-11-03 15:17:57,701] Trial 74 finished with value: 0.06234059730881235 and parameters: {'model_type': 'graphsage', 'hidden_dims': '[512, 256]', 'dropout': 0.5415744619852224, 'batch_norm': True, 'lr': 0.00031248673547796597, 'weight_decay': 5.700482317341937e-07, 'epochs': 141, 'loss': 'mse', 'optimizer': 'adam', 'graph_mode': 'knn', 'source': 'grm', 'knn_k': 3, 'weighted_edges': False, 'symmetrize_mode': 'mutual', 'use_snp_selection': False}. Best is trial 58 with value: 0.08637900504762047.
