[I 2025-11-03 12:25:35,536] Trial 95 finished with value: -0.002121056805431696 and parameters: {'model_type': 'gcn', 'hidden_dims': '[256, 128, 64]', 'dropout': 0.15359252449356342, 'batch_norm': True, 'lr': 9.364285183009622e-05, 'weight_decay': 0.00038501723556532384, 'epochs': 224, 'loss': 'mse', 'optimizer': 'adam', 'graph_mode': 'knn', 'source': 'grm', 'knn_k': 9, 'weighted_edges': False, 'symmetrize_mode': 'mutual', 'use_snp_selection': False}. Best is trial 32 with value: 0.058217567068497234.
[I 2025-11-03 12:25:38,712] Trial 96 finished with value: -0.008503186524737543 and parameters: {'model_type': 'gcn', 'hidden_dims': '[256, 128, 64]', 'dropout': 0.17541185842664359, 'batch_norm': False, 'lr': 0.00010962615990602684, 'weight_decay': 2.4709042305236817e-06, 'epochs': 181, 'loss': 'mse', 'optimizer': 'adam', 'graph_mode': 'knn', 'source': 'grm', 'knn_k': 7, 'weighted_edges': False, 'symmetrize_mode': 'mutual', 'use_snp_selection': True, 'num_snps': 39338}. Best is trial 32 with value: 0.058217567068497234.
[I 2025-11-03 12:25:40,917] Trial 97 finished with value: 0.03674605197692646 and parameters: {'model_type': 'gcn', 'hidden_dims': '[256, 128, 64]', 'dropout': 0.14322567812671474, 'batch_norm': False, 'lr': 0.00024442416640376054, 'weight_decay': 0.00021038024221305127, 'epochs': 184, 'loss': 'mse', 'optimizer': 'adam', 'graph_mode': 'knn', 'source': 'grm', 'knn_k': 8, 'weighted_edges': False, 'symmetrize_mode': 'mutual', 'use_snp_selection': True, 'num_snps': 14619}. Best is trial 32 with value: 0.058217567068497234.
[I 2025-11-03 12:25:43,902] Trial 98 finished with value: 0.01915192217596114 and parameters: {'model_type': 'gcn', 'hidden_dims': '[512, 256]', 'dropout': 0.11899344878912359, 'batch_norm': True, 'lr': 0.0001690878838105367, 'weight_decay': 8.604102869008195e-07, 'epochs': 237, 'loss': 'mse', 'optimizer': 'adam', 'graph_mode': 'knn', 'source': 'grm', 'knn_k': 7, 'weighted_edges': False, 'symmetrize_mode': 'mutual', 'use_snp_selection': False}. Best is trial 32 with value: 0.058217567068497234.
[I 2025-11-03 12:25:46,111] Trial 99 finished with value: 0.023994204728981755 and parameters: {'model_type': 'gcn', 'hidden_dims': '[256, 128, 64]', 'dropout': 0.18408578237651974, 'batch_norm': False, 'lr': 5.4966549250313344e-05, 'weight_decay': 1.526091087886543e-07, 'epochs': 168, 'loss': 'mse', 'optimizer': 'adam', 'graph_mode': 'knn', 'source': 'grm', 'knn_k': 10, 'weighted_edges': False, 'symmetrize_mode': 'mutual', 'use_snp_selection': True, 'num_snps': 16651}. Best is trial 32 with value: 0.058217567068497234.
[I 2025-11-03 12:25:47,639] Trial 100 finished with value: 0.019909942773923696 and parameters: {'model_type': 'gcn', 'hidden_dims': '[128, 64]', 'dropout': 0.16274102146928382, 'batch_norm': False, 'lr': 0.00034085765557389554, 'weight_decay': 5.7812452546818275e-06, 'epochs': 51, 'loss': 'mse', 'optimizer': 'adam', 'graph_mode': 'knn', 'source': 'grm', 'knn_k': 6, 'weighted_edges': False, 'symmetrize_mode': 'mutual', 'use_snp_selection': True, 'num_snps': 12741}. Best is trial 32 with value: 0.058217567068497234.
[I 2025-11-03 12:25:49,233] Trial 101 finished with value: 0.0032399420589102118 and parameters: {'model_type': 'gcn', 'hidden_dims': '[512, 128]', 'dropout': 0.5983576959879795, 'batch_norm': False, 'lr': 0.00020349605033416585, 'weight_decay': 0.0009966741287423802, 'epochs': 148, 'loss': 'mae', 'optimizer': 'adam', 'graph_mode': 'cutoff', 'cutoff': 0.5749204303915381, 'grm_norm': 'none', 'self_loops': True, 'use_snp_selection': True, 'num_snps': 8580}. Best is trial 32 with value: 0.058217567068497234.
[I 2025-11-03 12:25:50,739] Trial 102 finished with value: 0.01890473714340635 and parameters: {'model_type': 'gcn', 'hidden_dims': '[512, 128]', 'dropout': 0.30386281575882707, 'batch_norm': False, 'lr': 0.0002531143674309422, 'weight_decay': 0.0005771422921431192, 'epochs': 156, 'loss': 'mae', 'optimizer': 'adam', 'graph_mode': 'cutoff', 'cutoff': 0.3803779357863929, 'grm_norm': 'cosine', 'self_loops': True, 'use_snp_selection': True, 'num_snps': 5969}. Best is trial 32 with value: 0.058217567068497234.
[I 2025-11-03 12:25:53,117] Trial 103 finished with value: 0.017816334803786145 and parameters: {'model_type': 'gcn', 'hidden_dims': '[256, 128]', 'dropout': 0.13731816889986279, 'batch_norm': False, 'lr': 8.12853240909623e-05, 'weight_decay': 0.000808303671399057, 'epochs': 140, 'loss': 'mae', 'optimizer': 'adam', 'graph_mode': 'cutoff', 'cutoff': 0.6151814122082856, 'grm_norm': 'cosine_then_gcn', 'self_loops': True, 'use_snp_selection': True, 'num_snps': 33438}. Best is trial 32 with value: 0.058217567068497234.
[I 2025-11-03 12:25:54,953] Trial 104 finished with value: 0.026049977239656567 and parameters: {'model_type': 'gcn', 'hidden_dims': '[128, 64]', 'dropout': 0.10937605377256254, 'batch_norm': False, 'lr': 0.0003204638684646145, 'weight_decay': 1.1824446446657648e-05, 'epochs': 252, 'loss': 'mae', 'optimizer': 'adam', 'graph_mode': 'cutoff', 'cutoff': 0.4846730643479466, 'grm_norm': 'none', 'self_loops': True, 'use_snp_selection': True, 'num_snps': 10280}. Best is trial 32 with value: 0.058217567068497234.
[I 2025-11-03 12:25:56,447] Trial 105 finished with value: 0.05102261286448716 and parameters: {'model_type': 'gcn', 'hidden_dims': '[512, 128]', 'dropout': 0.19664020538724097, 'batch_norm': False, 'lr': 0.0005485641825620414, 'weight_decay': 1.6792344528434032e-05, 'epochs': 134, 'loss': 'mae', 'optimizer': 'adam', 'graph_mode': 'cutoff', 'cutoff': 0.6451035699261439, 'grm_norm': 'cosine', 'self_loops': False, 'use_snp_selection': True, 'num_snps': 7349}. Best is trial 32 with value: 0.058217567068497234.
[I 2025-11-03 12:25:58,077] Trial 106 finished with value: 0.07318840908067875 and parameters: {'model_type': 'gcn', 'hidden_dims': '[512, 128]', 'dropout': 0.214637294234187, 'batch_norm': False, 'lr': 0.00015419844480708974, 'weight_decay': 1.4319879672262538e-05, 'epochs': 111, 'loss': 'mae', 'optimizer': 'adam', 'graph_mode': 'knn', 'source': 'grm', 'knn_k': 9, 'weighted_edges': False, 'symmetrize_mode': 'mutual', 'use_snp_selection': True, 'num_snps': 11541}. Best is trial 106 with value: 0.07318840908067875.
[I 2025-11-03 12:25:59,702] Trial 107 finished with value: 0.009072106115009427 and parameters: {'model_type': 'gcn', 'hidden_dims': '[512, 128]', 'dropout': 0.19446575990918785, 'batch_norm': False, 'lr': 0.00012125495954919405, 'weight_decay': 1.6569838791167715e-05, 'epochs': 111, 'loss': 'mse', 'optimizer': 'adam', 'graph_mode': 'knn', 'source': 'grm', 'knn_k': 9, 'weighted_edges': False, 'symmetrize_mode': 'mutual', 'use_snp_selection': True, 'num_snps': 11526}. Best is trial 106 with value: 0.07318840908067875.
[I 2025-11-03 12:26:01,526] Trial 108 finished with value: -0.00015575831840549607 and parameters: {'model_type': 'gcn', 'hidden_dims': '[512, 128]', 'dropout': 0.21709643559887515, 'batch_norm': False, 'lr': 0.0001592558388969912, 'weight_decay': 2.955305145323291e-05, 'epochs': 129, 'loss': 'mae', 'optimizer': 'adam', 'graph_mode': 'knn', 'source': 'grm', 'knn_k': 8, 'weighted_edges': False, 'symmetrize_mode': 'mutual', 'use_snp_selection': True, 'num_snps': 15084}. Best is trial 106 with value: 0.07318840908067875.
[I 2025-11-03 12:26:03,748] Trial 109 finished with value: 0.06705010848602297 and parameters: {'model_type': 'gcn', 'hidden_dims': '[512, 128]', 'dropout': 0.17070709690280156, 'batch_norm': False, 'lr': 2.6431488922064738e-05, 'weight_decay': 1.0622141330965971e-05, 'epochs': 290, 'loss': 'mae', 'optimizer': 'adam', 'graph_mode': 'knn', 'source': 'grm', 'knn_k': 10, 'weighted_edges': False, 'symmetrize_mode': 'mutual', 'use_snp_selection': True, 'num_snps': 13938}. Best is trial 106 with value: 0.07318840908067875.
[I 2025-11-03 12:26:06,988] Trial 110 finished with value: 0.022317055577936385 and parameters: {'model_type': 'gcn', 'hidden_dims': '[512, 128]', 'dropout': 0.15281788594613324, 'batch_norm': True, 'lr': 1.3533505680451416e-05, 'weight_decay': 1.1410128299083223e-05, 'epochs': 301, 'loss': 'mae', 'optimizer': 'adam', 'graph_mode': 'knn', 'source': 'grm', 'knn_k': 10, 'weighted_edges': False, 'symmetrize_mode': 'mutual', 'use_snp_selection': False}. Best is trial 106 with value: 0.07318840908067875.
[I 2025-11-03 12:26:09,222] Trial 111 finished with value: 0.05088376856374953 and parameters: {'model_type': 'gcn', 'hidden_dims': '[512, 128]', 'dropout': 0.16891817314501384, 'batch_norm': False, 'lr': 0.0001414678400648012, 'weight_decay': 6.904326782443187e-06, 'epochs': 293, 'loss': 'mae', 'optimizer': 'adam', 'graph_mode': 'knn', 'source': 'grm', 'knn_k': 9, 'weighted_edges': False, 'symmetrize_mode': 'mutual', 'use_snp_selection': True, 'num_snps': 14090}. Best is trial 106 with value: 0.07318840908067875.
[I 2025-11-03 12:26:11,343] Trial 112 finished with value: 0.01784387010157225 and parameters: {'model_type': 'gcn', 'hidden_dims': '[512, 128]', 'dropout': 0.16941794491505452, 'batch_norm': False, 'lr': 2.522384916611138e-05, 'weight_decay': 1.0733216276543208e-06, 'epochs': 276, 'loss': 'mae', 'optimizer': 'adam', 'graph_mode': 'knn', 'source': 'grm', 'knn_k': 9, 'weighted_edges': False, 'symmetrize_mode': 'mutual', 'use_snp_selection': True, 'num_snps': 13538}. Best is trial 106 with value: 0.07318840908067875.
[I 2025-11-03 12:26:13,995] Trial 113 finished with value: 0.05385625754536254 and parameters: {'model_type': 'gcn', 'hidden_dims': '[512, 128]', 'dropout': 0.18431058638956102, 'batch_norm': False, 'lr': 0.00013609702932773445, 'weight_decay': 1.0000147518114661e-05, 'epochs': 332, 'loss': 'mae', 'optimizer': 'adam', 'graph_mode': 'knn', 'source': 'grm', 'knn_k': 10, 'weighted_edges': False, 'symmetrize_mode': 'mutual', 'use_snp_selection': True, 'num_snps': 19635}. Best is trial 106 with value: 0.07318840908067875.
[I 2025-11-03 12:26:16,633] Trial 114 finished with value: 0.022728537485952677 and parameters: {'model_type': 'gcn', 'hidden_dims': '[512, 128]', 'dropout': 0.19275765981022433, 'batch_norm': False, 'lr': 3.859380440634411e-05, 'weight_decay': 7.0430840073751395e-06, 'epochs': 337, 'loss': 'mae', 'optimizer': 'adam', 'graph_mode': 'knn', 'source': 'grm', 'knn_k': 10, 'weighted_edges': False, 'symmetrize_mode': 'mutual', 'use_snp_selection': True, 'num_snps': 19136}. Best is trial 106 with value: 0.07318840908067875.
[I 2025-11-03 12:26:19,392] Trial 115 finished with value: 0.039493331578705576 and parameters: {'model_type': 'gcn', 'hidden_dims': '[512, 128]', 'dropout': 0.17804935545003048, 'batch_norm': False, 'lr': 7.697187643790702e-05, 'weight_decay': 3.606737996129674e-06, 'epochs': 311, 'loss': 'mae', 'optimizer': 'adam', 'graph_mode': 'knn', 'source': 'grm', 'knn_k': 9, 'weighted_edges': False, 'symmetrize_mode': 'mutual', 'use_snp_selection': True, 'num_snps': 23148}. Best is trial 106 with value: 0.07318840908067875.
[I 2025-11-03 12:26:21,798] Trial 116 finished with value: 0.024434794814116114 and parameters: {'model_type': 'gcn', 'hidden_dims': '[512, 128]', 'dropout': 0.21359490193523673, 'batch_norm': False, 'lr': 1.5712072022146898e-05, 'weight_decay': 1.4933244269718526e-05, 'epochs': 295, 'loss': 'mae', 'optimizer': 'adam', 'graph_mode': 'knn', 'source': 'grm', 'knn_k': 10, 'weighted_edges': False, 'symmetrize_mode': 'mutual', 'use_snp_selection': True, 'num_snps': 17692}. Best is trial 106 with value: 0.07318840908067875.
[I 2025-11-03 12:26:24,141] Trial 117 finished with value: 0.00393764117387919 and parameters: {'model_type': 'gcn', 'hidden_dims': '[512, 128]', 'dropout': 0.19989663175607825, 'batch_norm': False, 'lr': 2.9988207207986495e-05, 'weight_decay': 6.083453970364166e-06, 'epochs': 342, 'loss': 'mae', 'optimizer': 'adam', 'graph_mode': 'knn', 'source': 'grm', 'knn_k': 9, 'weighted_edges': False, 'symmetrize_mode': 'mutual', 'use_snp_selection': True, 'num_snps': 13822}. Best is trial 106 with value: 0.07318840908067875.
[I 2025-11-03 12:26:26,776] Trial 118 finished with value: 0.03955102547570565 and parameters: {'model_type': 'gcn', 'hidden_dims': '[512, 128]', 'dropout': 0.1593241506994638, 'batch_norm': False, 'lr': 6.393259236338191e-05, 'weight_decay': 4.7203098390869235e-06, 'epochs': 314, 'loss': 'mae', 'optimizer': 'adam', 'graph_mode': 'knn', 'source': 'grm', 'knn_k': 10, 'weighted_edges': False, 'symmetrize_mode': 'mutual', 'use_snp_selection': True, 'num_snps': 20492}. Best is trial 106 with value: 0.07318840908067875.
[I 2025-11-03 12:26:28,997] Trial 119 finished with value: 0.006232682662638233 and parameters: {'model_type': 'gcn', 'hidden_dims': '[512, 128]', 'dropout': 0.22930515800416787, 'batch_norm': False, 'lr': 0.0001378947029116789, 'weight_decay': 1.02435270511506e-05, 'epochs': 268, 'loss': 'mae', 'optimizer': 'adam', 'graph_mode': 'knn', 'source': 'grm', 'knn_k': 8, 'weighted_edges': False, 'symmetrize_mode': 'mutual', 'use_snp_selection': True, 'num_snps': 15234}. Best is trial 106 with value: 0.07318840908067875.
[I 2025-11-03 12:26:31,984] Trial 120 finished with value: 0.0507166323582979 and parameters: {'model_type': 'gcn', 'hidden_dims': '[512, 128]', 'dropout': 0.23944365066173492, 'batch_norm': False, 'lr': 0.00010537375081132003, 'weight_decay': 2.3588222044764454e-05, 'epochs': 295, 'loss': 'mse', 'optimizer': 'adam', 'graph_mode': 'knn', 'source': 'grm', 'knn_k': 8, 'weighted_edges': False, 'symmetrize_mode': 'mutual', 'use_snp_selection': True, 'num_snps': 28956}. Best is trial 106 with value: 0.07318840908067875.
[I 2025-11-03 12:26:34,636] Trial 121 finished with value: 0.042702973334364236 and parameters: {'model_type': 'gcn', 'hidden_dims': '[512, 128]', 'dropout': 0.24270638489146995, 'batch_norm': False, 'lr': 8.70242694057356e-05, 'weight_decay': 1.7621121508753135e-05, 'epochs': 289, 'loss': 'mse', 'optimizer': 'adam', 'graph_mode': 'knn', 'source': 'grm', 'knn_k': 8, 'weighted_edges': False, 'symmetrize_mode': 'mutual', 'use_snp_selection': True, 'num_snps': 22063}. Best is trial 106 with value: 0.07318840908067875.
[I 2025-11-03 12:26:37,501] Trial 122 finished with value: 0.03993902400177504 and parameters: {'model_type': 'gcn', 'hidden_dims': '[512, 128]', 'dropout': 0.18556819063642008, 'batch_norm': False, 'lr': 0.00010894002459027855, 'weight_decay': 2.3338167336665506e-05, 'epochs': 270, 'loss': 'mse', 'optimizer': 'adam', 'graph_mode': 'knn', 'source': 'grm', 'knn_k': 9, 'weighted_edges': False, 'symmetrize_mode': 'mutual', 'use_snp_selection': True, 'num_snps': 28324}. Best is trial 106 with value: 0.07318840908067875.
[I 2025-11-03 12:26:40,435] Trial 123 finished with value: 0.04258471388801233 and parameters: {'model_type': 'gcn', 'hidden_dims': '[512, 128]', 'dropout': 0.2601697606807434, 'batch_norm': False, 'lr': 0.00013251838306239602, 'weight_decay': 2.086725871034993e-05, 'epochs': 296, 'loss': 'mse', 'optimizer': 'adam', 'graph_mode': 'knn', 'source': 'grm', 'knn_k': 10, 'weighted_edges': False, 'symmetrize_mode': 'mutual', 'use_snp_selection': True, 'num_snps': 26978}. Best is trial 106 with value: 0.07318840908067875.
[I 2025-11-03 12:26:42,873] Trial 124 finished with value: 0.025038641596394896 and parameters: {'model_type': 'gcn', 'hidden_dims': '[512, 128]', 'dropout': 0.17116800298306786, 'batch_norm': False, 'lr': 2.2593113132997594e-05, 'weight_decay': 8.409851651914122e-06, 'epochs': 324, 'loss': 'mse', 'optimizer': 'adam', 'graph_mode': 'knn', 'source': 'grm', 'knn_k': 10, 'weighted_edges': False, 'symmetrize_mode': 'mutual', 'use_snp_selection': True, 'num_snps': 15847}. Best is trial 106 with value: 0.07318840908067875.
[I 2025-11-03 12:26:45,277] Trial 125 finished with value: 0.07002746140544745 and parameters: {'model_type': 'gcn', 'hidden_dims': '[512, 64]', 'dropout': 0.22275374985453553, 'batch_norm': False, 'lr': 0.00011142935518080306, 'weight_decay': 3.6312920185112014e-05, 'epochs': 290, 'loss': 'mse', 'optimizer': 'adam', 'graph_mode': 'knn', 'source': 'grm', 'knn_k': 9, 'weighted_edges': False, 'symmetrize_mode': 'mutual', 'use_snp_selection': True, 'num_snps': 17658}. Best is trial 106 with value: 0.07318840908067875.
[I 2025-11-03 12:26:47,786] Trial 126 finished with value: -0.0033220580802742544 and parameters: {'model_type': 'gcn', 'hidden_dims': '[512, 64]', 'dropout': 0.2223094992112776, 'batch_norm': False, 'lr': 0.00045926290244021744, 'weight_decay': 3.8612835281596876e-05, 'epochs': 306, 'loss': 'mae', 'optimizer': 'adam', 'graph_mode': 'knn', 'source': 'grm', 'knn_k': 8, 'weighted_edges': False, 'symmetrize_mode': 'mutual', 'use_snp_selection': True, 'num_snps': 19114}. Best is trial 106 with value: 0.07318840908067875.
[I 2025-11-03 12:26:50,193] Trial 127 finished with value: 0.022227676262474717 and parameters: {'model_type': 'gcn', 'hidden_dims': '[512, 64]', 'dropout': 0.23223720791861424, 'batch_norm': False, 'lr': 0.00018053414710549658, 'weight_decay': 5.392601784473102e-05, 'epochs': 286, 'loss': 'mae', 'optimizer': 'adam', 'graph_mode': 'knn', 'source': 'grm', 'knn_k': 10, 'weighted_edges': False, 'symmetrize_mode': 'mutual', 'use_snp_selection': True, 'num_snps': 17641}. Best is trial 106 with value: 0.07318840908067875.
[I 2025-11-03 12:26:52,277] Trial 128 finished with value: 0.041864229862778136 and parameters: {'model_type': 'gcn', 'hidden_dims': '[512, 128]', 'dropout': 0.21074662611994482, 'batch_norm': False, 'lr': 0.00011531134216285195, 'weight_decay': 1.3187064379614242e-05, 'epochs': 330, 'loss': 'mae', 'optimizer': 'adam', 'graph_mode': 'knn', 'source': 'grm', 'knn_k': 9, 'weighted_edges': False, 'symmetrize_mode': 'mutual', 'use_snp_selection': True, 'num_snps': 9432}. Best is trial 106 with value: 0.07318840908067875.
[I 2025-11-03 12:26:54,189] Trial 129 finished with value: 0.020866365818124812 and parameters: {'model_type': 'gcn', 'hidden_dims': '[512, 64]', 'dropout': 0.20440451028197054, 'batch_norm': False, 'lr': 1.9451001732668297e-05, 'weight_decay': 1.0454038783591085e-05, 'epochs': 290, 'loss': 'mse', 'optimizer': 'adam', 'graph_mode': 'knn', 'source': 'grm', 'knn_k': 10, 'weighted_edges': False, 'symmetrize_mode': 'mutual', 'use_snp_selection': True, 'num_snps': 7476}. Best is trial 106 with value: 0.07318840908067875.
[I 2025-11-03 12:26:57,279] Trial 130 finished with value: 0.02308343257939971 and parameters: {'model_type': 'gcn', 'hidden_dims': '[512, 64]', 'dropout': 0.24305506136543512, 'batch_norm': True, 'lr': 6.217304161941641e-05, 'weight_decay': 1.983445638548546e-05, 'epochs': 278, 'loss': 'mae', 'optimizer': 'adam', 'graph_mode': 'knn', 'source': 'grm', 'knn_k': 9, 'weighted_edges': False, 'symmetrize_mode': 'mutual', 'use_snp_selection': False}. Best is trial 106 with value: 0.07318840908067875.
[I 2025-11-03 12:27:00,228] Trial 131 finished with value: 0.024236082126893366 and parameters: {'model_type': 'gcn', 'hidden_dims': '[256, 128, 64]', 'dropout': 0.145115187507301, 'batch_norm': False, 'lr': 9.734909434340052e-05, 'weight_decay': 1.5106348800413026e-05, 'epochs': 258, 'loss': 'mse', 'optimizer': 'adam', 'graph_mode': 'knn', 'source': 'grm', 'knn_k': 7, 'weighted_edges': False, 'symmetrize_mode': 'mutual', 'use_snp_selection': True, 'num_snps': 32788}. Best is trial 106 with value: 0.07318840908067875.
[I 2025-11-03 12:27:02,546] Trial 132 finished with value: 0.010051370453144111 and parameters: {'model_type': 'gcn', 'hidden_dims': '[512, 128]', 'dropout': 0.4527682588990982, 'batch_norm': False, 'lr': 0.00015655826438938476, 'weight_decay': 3.196353483873024e-05, 'epochs': 137, 'loss': 'mse', 'optimizer': 'adam', 'graph_mode': 'knn', 'source': 'grm', 'knn_k': 9, 'weighted_edges': False, 'symmetrize_mode': 'mutual', 'use_snp_selection': True, 'num_snps': 25412}. Best is trial 106 with value: 0.07318840908067875.
[I 2025-11-03 12:27:04,747] Trial 133 finished with value: 0.008890871197972248 and parameters: {'model_type': 'gcn', 'hidden_dims': '[512, 256]', 'dropout': 0.19005879706045126, 'batch_norm': False, 'lr': 9.111949369856585e-05, 'weight_decay': 1.1454768301303743e-05, 'epochs': 318, 'loss': 'mse', 'optimizer': 'adam', 'graph_mode': 'knn', 'source': 'grm', 'knn_k': 9, 'weighted_edges': False, 'symmetrize_mode': 'mutual', 'use_snp_selection': True, 'num_snps': 12434}. Best is trial 106 with value: 0.07318840908067875.
[I 2025-11-03 12:27:07,352] Trial 134 finished with value: 0.0559746946591349 and parameters: {'model_type': 'gcn', 'hidden_dims': '[512, 128]', 'dropout': 0.19743070667957108, 'batch_norm': False, 'lr': 0.00011759324976353543, 'weight_decay': 7.216922022292909e-07, 'epochs': 294, 'loss': 'mse', 'optimizer': 'adam', 'graph_mode': 'knn', 'source': 'grm', 'knn_k': 10, 'weighted_edges': False, 'symmetrize_mode': 'mutual', 'use_snp_selection': True, 'num_snps': 21402}. Best is trial 106 with value: 0.07318840908067875.
[I 2025-11-03 12:27:10,769] Trial 135 finished with value: 0.029829398827130413 and parameters: {'model_type': 'gcn', 'hidden_dims': '[512, 128]', 'dropout': 0.1973665238732309, 'batch_norm': False, 'lr': 0.00015196577902765507, 'weight_decay': 6.690860241350908e-07, 'epochs': 304, 'loss': 'mse', 'optimizer': 'adam', 'graph_mode': 'knn', 'source': 'grm', 'knn_k': 10, 'weighted_edges': False, 'symmetrize_mode': 'mutual', 'use_snp_selection': True, 'num_snps': 35170}. Best is trial 106 with value: 0.07318840908067875.
[I 2025-11-03 12:27:13,866] Trial 136 finished with value: 0.017967931400631142 and parameters: {'model_type': 'gcn', 'hidden_dims': '[512, 128]', 'dropout': 0.20989002854597294, 'batch_norm': False, 'lr': 0.000125493363612387, 'weight_decay': 7.740899766617881e-07, 'epochs': 295, 'loss': 'mae', 'optimizer': 'adam', 'graph_mode': 'knn', 'source': 'grm', 'knn_k': 10, 'weighted_edges': False, 'symmetrize_mode': 'mutual', 'use_snp_selection': True, 'num_snps': 29815}. Best is trial 106 with value: 0.07318840908067875.
