[I 2025-11-12 06:31:29,167] Trial 0 finished with value: 0.1805352264732585 and parameters: {'model_type': 'graphsage', 'hidden_dims': '[128, 64]', 'dropout': 0.199031432379812, 'batch_norm': True, 'lr': 1.8408544111075837e-06, 'weight_decay': 5.5136510071208614e-05, 'epochs': 336, 'loss': 'mae', 'optimizer': 'adam', 'graph_mode': 'knn', 'source': 'grm', 'knn_k': 8, 'weighted_edges': True, 'symmetrize_mode': 'mutual', 'use_snp_selection': False}. Best is trial 0 with value: 0.1805352264732585.
[I 2025-11-12 06:32:19,972] Trial 1 finished with value: 0.2339779033042185 and parameters: {'model_type': 'graphsage', 'hidden_dims': '[128, 64]', 'dropout': 0.40051947670227217, 'batch_norm': True, 'lr': 0.0005320428882732732, 'weight_decay': 1.89210117736594e-06, 'epochs': 68, 'loss': 'mse', 'optimizer': 'adam', 'graph_mode': 'knn', 'source': 'grm', 'knn_k': 7, 'weighted_edges': True, 'symmetrize_mode': 'union', 'use_snp_selection': False}. Best is trial 1 with value: 0.2339779033042185.
[I 2025-11-12 06:33:39,475] Trial 2 finished with value: 0.20422728580885377 and parameters: {'model_type': 'graphsage', 'hidden_dims': '[256, 128]', 'dropout': 0.5105528289184642, 'batch_norm': False, 'lr': 0.0006804279372404962, 'weight_decay': 0.0008922815224257085, 'epochs': 181, 'loss': 'mse', 'optimizer': 'adam', 'graph_mode': 'cutoff', 'cutoff': 0.5741905641612706, 'grm_norm': 'gcn', 'self_loops': False, 'use_snp_selection': True, 'num_snps': 26910}. Best is trial 1 with value: 0.2339779033042185.
[I 2025-11-12 06:35:08,943] Trial 3 finished with value: 0.2504338947529116 and parameters: {'model_type': 'graphsage', 'hidden_dims': '[256, 128, 64]', 'dropout': 0.5390483213624292, 'batch_norm': False, 'lr': 3.4705625989073525e-05, 'weight_decay': 2.4623319020131338e-05, 'epochs': 121, 'loss': 'mse', 'optimizer': 'adam', 'graph_mode': 'knn', 'source': 'grm', 'knn_k': 6, 'weighted_edges': False, 'symmetrize_mode': 'mutual', 'use_snp_selection': True, 'num_snps': 30713}. Best is trial 3 with value: 0.2504338947529116.
[I 2025-11-12 06:36:16,378] Trial 4 finished with value: 0.2547499171481157 and parameters: {'model_type': 'graphsage', 'hidden_dims': '[128, 64]', 'dropout': 0.13404863676897502, 'batch_norm': False, 'lr': 0.0001431556295367288, 'weight_decay': 2.2084517750726675e-05, 'epochs': 51, 'loss': 'mae', 'optimizer': 'adam', 'graph_mode': 'cutoff', 'cutoff': 0.6714268476993044, 'grm_norm': 'none', 'self_loops': False, 'use_snp_selection': True, 'num_snps': 45645}. Best is trial 4 with value: 0.2547499171481157.
[I 2025-11-12 06:37:56,326] Trial 5 finished with value: 0.2501359714624804 and parameters: {'model_type': 'graphsage', 'hidden_dims': '[256, 128]', 'dropout': 0.42253606323412096, 'batch_norm': False, 'lr': 4.238630400638805e-05, 'weight_decay': 8.074086040046576e-07, 'epochs': 158, 'loss': 'mae', 'optimizer': 'adam', 'graph_mode': 'knn', 'source': 'grm', 'knn_k': 1, 'weighted_edges': False, 'symmetrize_mode': 'mutual', 'use_snp_selection': True, 'num_snps': 43113}. Best is trial 4 with value: 0.2547499171481157.
[I 2025-11-12 06:40:32,207] Trial 6 finished with value: 0.23978774835704758 and parameters: {'model_type': 'graphsage', 'hidden_dims': '[512, 256]', 'dropout': 0.3534893146320237, 'batch_norm': True, 'lr': 0.000251307964226932, 'weight_decay': 1.821819791794022e-05, 'epochs': 223, 'loss': 'mae', 'optimizer': 'adam', 'graph_mode': 'knn', 'source': 'grm', 'knn_k': 1, 'weighted_edges': True, 'symmetrize_mode': 'mutual', 'use_snp_selection': False}. Best is trial 4 with value: 0.2547499171481157.
[I 2025-11-12 06:42:44,954] Trial 7 finished with value: 0.21895451868091068 and parameters: {'model_type': 'graphsage', 'hidden_dims': '[512, 256]', 'dropout': 0.1105825955860775, 'batch_norm': True, 'lr': 2.374338412754043e-05, 'weight_decay': 1.1284721123340274e-05, 'epochs': 190, 'loss': 'mse', 'optimizer': 'adam', 'graph_mode': 'cutoff', 'cutoff': 0.719872204109604, 'grm_norm': 'gcn', 'self_loops': False, 'use_snp_selection': False}. Best is trial 4 with value: 0.2547499171481157.
[I 2025-11-12 06:44:36,065] Trial 8 finished with value: 0.2500502458322061 and parameters: {'model_type': 'graphsage', 'hidden_dims': '[512, 128]', 'dropout': 0.5066580418354021, 'batch_norm': True, 'lr': 0.00039213678276659976, 'weight_decay': 3.43655320802934e-06, 'epochs': 120, 'loss': 'mse', 'optimizer': 'adam', 'graph_mode': 'cutoff', 'cutoff': 0.34923059576505366, 'grm_norm': 'cosine', 'self_loops': True, 'use_snp_selection': False}. Best is trial 4 with value: 0.2547499171481157.
[I 2025-11-12 06:45:52,305] Trial 9 finished with value: 0.2520212088307898 and parameters: {'model_type': 'graphsage', 'hidden_dims': '[512, 256]', 'dropout': 0.301734920240333, 'batch_norm': False, 'lr': 6.650961854953448e-06, 'weight_decay': 6.861575656590315e-05, 'epochs': 150, 'loss': 'mae', 'optimizer': 'adam', 'graph_mode': 'cutoff', 'cutoff': 0.2857569870061939, 'grm_norm': 'cosine_then_gcn', 'self_loops': False, 'use_snp_selection': True, 'num_snps': 12722}. Best is trial 4 with value: 0.2547499171481157.
[I 2025-11-12 06:47:27,262] Trial 10 finished with value: 0.1418706111658552 and parameters: {'model_type': 'graphsage', 'hidden_dims': '[512, 64]', 'dropout': 0.22492338276159776, 'batch_norm': False, 'lr': 0.00014233761188460356, 'weight_decay': 1.8772904431456567e-07, 'epochs': 41, 'loss': 'mae', 'optimizer': 'adam', 'graph_mode': 'cutoff', 'cutoff': 0.8740100033033124, 'grm_norm': 'none', 'self_loops': True, 'use_snp_selection': True, 'num_snps': 58960}. Best is trial 4 with value: 0.2547499171481157.
[I 2025-11-12 06:48:48,196] Trial 11 finished with value: 0.20631738355248702 and parameters: {'model_type': 'graphsage', 'hidden_dims': '[128, 64]', 'dropout': 0.23879924216512757, 'batch_norm': False, 'lr': 3.1730969601519765e-06, 'weight_decay': 0.00018467653946554991, 'epochs': 254, 'loss': 'mae', 'optimizer': 'adam', 'graph_mode': 'cutoff', 'cutoff': 0.20190156779348867, 'grm_norm': 'cosine_then_gcn', 'self_loops': False, 'use_snp_selection': True, 'num_snps': 10369}. Best is trial 4 with value: 0.2547499171481157.
[I 2025-11-12 06:49:34,795] Trial 12 finished with value: 0.1967739705421579 and parameters: {'model_type': 'graphsage', 'hidden_dims': '[512, 256]', 'dropout': 0.10070859634525933, 'batch_norm': False, 'lr': 8.313753911922747e-06, 'weight_decay': 0.000133333526948601, 'epochs': 107, 'loss': 'mae', 'optimizer': 'adam', 'graph_mode': 'cutoff', 'cutoff': 0.5012009858727229, 'grm_norm': 'none', 'self_loops': False, 'use_snp_selection': True, 'num_snps': 3222}. Best is trial 4 with value: 0.2547499171481157.
[I 2025-11-12 06:52:35,069] Trial 13 finished with value: 0.24078769254115834 and parameters: {'model_type': 'graphsage', 'hidden_dims': '[512, 64]', 'dropout': 0.29043694625393646, 'batch_norm': False, 'lr': 9.358496046614984e-05, 'weight_decay': 0.0004398078832163521, 'epochs': 277, 'loss': 'mae', 'optimizer': 'adam', 'graph_mode': 'cutoff', 'cutoff': 0.6413515058900656, 'grm_norm': 'cosine_then_gcn', 'self_loops': False, 'use_snp_selection': True, 'num_snps': 45389}. Best is trial 4 with value: 0.2547499171481157.
[I 2025-11-12 06:53:40,973] Trial 14 finished with value: 0.24268220535941243 and parameters: {'model_type': 'graphsage', 'hidden_dims': '[512, 128]', 'dropout': 0.15859826720011727, 'batch_norm': False, 'lr': 1.0458019545480193e-05, 'weight_decay': 6.719896347015955e-05, 'epochs': 82, 'loss': 'mae', 'optimizer': 'adam', 'graph_mode': 'cutoff', 'cutoff': 0.39723224435083626, 'grm_norm': 'none', 'self_loops': False, 'use_snp_selection': True, 'num_snps': 17175}. Best is trial 4 with value: 0.2547499171481157.
[I 2025-11-12 06:55:18,863] Trial 15 finished with value: 0.25933380471678763 and parameters: {'model_type': 'graphsage', 'hidden_dims': '[256, 128, 64]', 'dropout': 0.3166335484868066, 'batch_norm': False, 'lr': 6.9082542699866905e-06, 'weight_decay': 4.734211958324838e-06, 'epochs': 156, 'loss': 'mae', 'optimizer': 'adam', 'graph_mode': 'cutoff', 'cutoff': 0.7444247917328474, 'grm_norm': 'cosine_then_gcn', 'self_loops': False, 'use_snp_selection': True, 'num_snps': 44226}. Best is trial 15 with value: 0.25933380471678763.
[I 2025-11-12 06:56:31,552] Trial 16 finished with value: 0.05746299646274957 and parameters: {'model_type': 'graphsage', 'hidden_dims': '[256, 128, 64]', 'dropout': 0.45888706612159014, 'batch_norm': False, 'lr': 1.0614361104305858e-06, 'weight_decay': 4.750582389587588e-06, 'epochs': 41, 'loss': 'mae', 'optimizer': 'adam', 'graph_mode': 'cutoff', 'cutoff': 0.7683094650930375, 'grm_norm': 'cosine', 'self_loops': True, 'use_snp_selection': True, 'num_snps': 46202}. Best is trial 15 with value: 0.25933380471678763.
[I 2025-11-12 06:58:46,723] Trial 17 finished with value: 0.22849191262749727 and parameters: {'model_type': 'graphsage', 'hidden_dims': '[256, 128, 64]', 'dropout': 0.2915680488206245, 'batch_norm': False, 'lr': 0.00012788021761198608, 'weight_decay': 5.75212296692497e-07, 'epochs': 223, 'loss': 'mae', 'optimizer': 'adam', 'graph_mode': 'cutoff', 'cutoff': 0.8915096983047559, 'grm_norm': 'none', 'self_loops': False, 'use_snp_selection': True, 'num_snps': 56938}. Best is trial 15 with value: 0.25933380471678763.
[I 2025-11-12 07:00:03,270] Trial 18 finished with value: 0.25041540995586387 and parameters: {'model_type': 'graphsage', 'hidden_dims': '[256, 128, 64]', 'dropout': 0.16889985278784186, 'batch_norm': False, 'lr': 1.8310772363863654e-05, 'weight_decay': 5.4206502712183754e-06, 'epochs': 87, 'loss': 'mae', 'optimizer': 'adam', 'graph_mode': 'cutoff', 'cutoff': 0.7373226460997507, 'grm_norm': 'cosine_then_gcn', 'self_loops': False, 'use_snp_selection': True, 'num_snps': 38108}. Best is trial 15 with value: 0.25933380471678763.
[I 2025-11-12 07:02:06,211] Trial 19 finished with value: 0.2085606289141703 and parameters: {'model_type': 'graphsage', 'hidden_dims': '[128, 64]', 'dropout': 0.590086706833771, 'batch_norm': False, 'lr': 7.883834861563871e-05, 'weight_decay': 1.088097971313289e-07, 'epochs': 314, 'loss': 'mae', 'optimizer': 'adam', 'graph_mode': 'cutoff', 'cutoff': 0.6383496584278348, 'grm_norm': 'none', 'self_loops': True, 'use_snp_selection': True, 'num_snps': 52890}. Best is trial 15 with value: 0.25933380471678763.
[I 2025-11-12 07:03:27,743] Trial 20 finished with value: 0.23994504269141453 and parameters: {'model_type': 'graphsage', 'hidden_dims': '[128, 64]', 'dropout': 0.35170831748483783, 'batch_norm': False, 'lr': 3.93692482201822e-06, 'weight_decay': 1.0193475496882375e-06, 'epochs': 152, 'loss': 'mae', 'optimizer': 'adam', 'graph_mode': 'cutoff', 'cutoff': 0.5051306861842828, 'grm_norm': 'cosine_then_gcn', 'self_loops': False, 'use_snp_selection': True, 'num_snps': 37038}. Best is trial 15 with value: 0.25933380471678763.
[I 2025-11-12 07:05:13,413] Trial 21 finished with value: 0.2627915359089957 and parameters: {'model_type': 'graphsage', 'hidden_dims': '[512, 256]', 'dropout': 0.2868425796308494, 'batch_norm': False, 'lr': 6.809802613508192e-06, 'weight_decay': 3.7160553086805206e-05, 'epochs': 150, 'loss': 'mae', 'optimizer': 'adam', 'graph_mode': 'cutoff', 'cutoff': 0.22491862589382988, 'grm_norm': 'cosine_then_gcn', 'self_loops': False, 'use_snp_selection': True, 'num_snps': 18886}. Best is trial 21 with value: 0.2627915359089957.
[I 2025-11-12 07:06:28,556] Trial 22 finished with value: 0.23798832999176517 and parameters: {'model_type': 'graphsage', 'hidden_dims': '[256, 128, 64]', 'dropout': 0.25704039716024274, 'batch_norm': False, 'lr': 1.40478653359876e-05, 'weight_decay': 2.7066927096739288e-05, 'epochs': 222, 'loss': 'mae', 'optimizer': 'adam', 'graph_mode': 'cutoff', 'cutoff': 0.7891525263090108, 'grm_norm': 'cosine_then_gcn', 'self_loops': False, 'use_snp_selection': True, 'num_snps': 20428}. Best is trial 21 with value: 0.2627915359089957.
[I 2025-11-12 07:07:55,686] Trial 23 finished with value: 0.21412814018030862 and parameters: {'model_type': 'graphsage', 'hidden_dims': '[512, 256]', 'dropout': 0.39366089624578077, 'batch_norm': False, 'lr': 4.859197358504028e-06, 'weight_decay': 9.39039723557944e-06, 'epochs': 138, 'loss': 'mae', 'optimizer': 'adam', 'graph_mode': 'cutoff', 'cutoff': 0.6139411158513288, 'grm_norm': 'cosine_then_gcn', 'self_loops': False, 'use_snp_selection': True, 'num_snps': 24807}. Best is trial 21 with value: 0.2627915359089957.
[I 2025-11-12 07:09:51,404] Trial 24 finished with value: 0.24671051872250196 and parameters: {'model_type': 'graphsage', 'hidden_dims': '[256, 128]', 'dropout': 0.3314373418778945, 'batch_norm': False, 'lr': 4.072129564795236e-05, 'weight_decay': 3.815214987535173e-05, 'epochs': 182, 'loss': 'mae', 'optimizer': 'adam', 'graph_mode': 'cutoff', 'cutoff': 0.6862297014032264, 'grm_norm': 'cosine_then_gcn', 'self_loops': False, 'use_snp_selection': True, 'num_snps': 51014}. Best is trial 21 with value: 0.2627915359089957.
[I 2025-11-12 07:11:26,884] Trial 25 finished with value: 0.23224278467683496 and parameters: {'model_type': 'graphsage', 'hidden_dims': '[512, 64]', 'dropout': 0.16459839072056745, 'batch_norm': False, 'lr': 2.0249380943588987e-06, 'weight_decay': 1.0602277914784618e-05, 'epochs': 105, 'loss': 'mae', 'optimizer': 'adam', 'graph_mode': 'cutoff', 'cutoff': 0.8187722022805302, 'grm_norm': 'gcn', 'self_loops': False, 'use_snp_selection': True, 'num_snps': 36354}. Best is trial 21 with value: 0.2627915359089957.
[I 2025-11-12 07:15:09,954] Trial 26 finished with value: 0.22331518395432548 and parameters: {'model_type': 'graphsage', 'hidden_dims': '[512, 128]', 'dropout': 0.2472454688379642, 'batch_norm': True, 'lr': 5.739173694199335e-05, 'weight_decay': 0.00016099891799621887, 'epochs': 167, 'loss': 'mse', 'optimizer': 'adam', 'graph_mode': 'knn', 'source': 'grm', 'knn_k': 10, 'weighted_edges': False, 'symmetrize_mode': 'union', 'use_snp_selection': False}. Best is trial 21 with value: 0.2627915359089957.
[I 2025-11-12 07:16:21,719] Trial 27 finished with value: 0.2500145974999746 and parameters: {'model_type': 'graphsage', 'hidden_dims': '[128, 64]', 'dropout': 0.20756871511263536, 'batch_norm': False, 'lr': 0.00022100964693208707, 'weight_decay': 1.727903861171117e-06, 'epochs': 71, 'loss': 'mae', 'optimizer': 'adam', 'graph_mode': 'cutoff', 'cutoff': 0.4371097002298907, 'grm_norm': 'cosine', 'self_loops': False, 'use_snp_selection': True, 'num_snps': 33434}. Best is trial 21 with value: 0.2627915359089957.
[I 2025-11-12 07:19:04,236] Trial 28 finished with value: 0.22813742519493796 and parameters: {'model_type': 'graphsage', 'hidden_dims': '[512, 256]', 'dropout': 0.272657008489861, 'batch_norm': False, 'lr': 1.5199448921374329e-05, 'weight_decay': 1.5650315401370817e-05, 'epochs': 264, 'loss': 'mae', 'optimizer': 'adam', 'graph_mode': 'cutoff', 'cutoff': 0.6844713768190855, 'grm_norm': 'none', 'self_loops': False, 'use_snp_selection': True, 'num_snps': 40748}. Best is trial 21 with value: 0.2627915359089957.
[I 2025-11-12 07:22:17,315] Trial 29 finished with value: 0.1729612935215956 and parameters: {'model_type': 'graphsage', 'hidden_dims': '[256, 128, 64]', 'dropout': 0.3279843363702551, 'batch_norm': True, 'lr': 1.987755773209055e-06, 'weight_decay': 4.6278096066208265e-05, 'epochs': 336, 'loss': 'mae', 'optimizer': 'adam', 'graph_mode': 'knn', 'source': 'grm', 'knn_k': 4, 'weighted_edges': True, 'symmetrize_mode': 'union', 'use_snp_selection': False}. Best is trial 21 with value: 0.2627915359089957.
[I 2025-11-12 07:24:04,441] Trial 30 finished with value: 0.24107868730488274 and parameters: {'model_type': 'graphsage', 'hidden_dims': '[128, 64]', 'dropout': 0.19571274465215094, 'batch_norm': False, 'lr': 6.155901041816263e-06, 'weight_decay': 6.6571263210095345e-06, 'epochs': 209, 'loss': 'mae', 'optimizer': 'adam', 'graph_mode': 'cutoff', 'cutoff': 0.5416442413955177, 'grm_norm': 'cosine_then_gcn', 'self_loops': True, 'use_snp_selection': True, 'num_snps': 51070}. Best is trial 21 with value: 0.2627915359089957.
[I 2025-11-12 07:25:22,280] Trial 31 finished with value: 0.22962612264246746 and parameters: {'model_type': 'graphsage', 'hidden_dims': '[512, 256]', 'dropout': 0.3049116033353171, 'batch_norm': False, 'lr': 7.716695545147105e-06, 'weight_decay': 9.36132353146692e-05, 'epochs': 142, 'loss': 'mae', 'optimizer': 'adam', 'graph_mode': 'cutoff', 'cutoff': 0.24840277658802928, 'grm_norm': 'cosine_then_gcn', 'self_loops': False, 'use_snp_selection': True, 'num_snps': 12234}. Best is trial 21 with value: 0.2627915359089957.
[I 2025-11-12 07:26:24,535] Trial 32 finished with value: 0.2253172107641297 and parameters: {'model_type': 'graphsage', 'hidden_dims': '[512, 256]', 'dropout': 0.3889667740098601, 'batch_norm': False, 'lr': 3.5434468703493945e-06, 'weight_decay': 0.00030023101438856085, 'epochs': 126, 'loss': 'mae', 'optimizer': 'adam', 'graph_mode': 'cutoff', 'cutoff': 0.2889607560591306, 'grm_norm': 'cosine_then_gcn', 'self_loops': False, 'use_snp_selection': True, 'num_snps': 8495}. Best is trial 21 with value: 0.2627915359089957.
[I 2025-11-12 07:27:50,870] Trial 33 finished with value: 0.2518389557683998 and parameters: {'model_type': 'graphsage', 'hidden_dims': '[512, 256]', 'dropout': 0.42570057008531503, 'batch_norm': False, 'lr': 2.307171142266647e-05, 'weight_decay': 6.567822975922088e-05, 'epochs': 170, 'loss': 'mae', 'optimizer': 'adam', 'graph_mode': 'cutoff', 'cutoff': 0.31275481290030893, 'grm_norm': 'cosine_then_gcn', 'self_loops': False, 'use_snp_selection': True, 'num_snps': 15866}. Best is trial 21 with value: 0.2627915359089957.
[I 2025-11-12 07:28:41,591] Trial 34 finished with value: 0.09773689827854044 and parameters: {'model_type': 'graphsage', 'hidden_dims': '[512, 256]', 'dropout': 0.13540742808182837, 'batch_norm': False, 'lr': 1.0128872800499e-06, 'weight_decay': 3.193904569947595e-05, 'epochs': 100, 'loss': 'mse', 'optimizer': 'adam', 'graph_mode': 'knn', 'source': 'grm', 'knn_k': 4, 'weighted_edges': False, 'symmetrize_mode': 'union', 'use_snp_selection': True, 'num_snps': 3521}. Best is trial 21 with value: 0.2627915359089957.
[I 2025-11-12 07:30:52,001] Trial 35 finished with value: 0.23211300735712603 and parameters: {'model_type': 'graphsage', 'hidden_dims': '[256, 128]', 'dropout': 0.37054126102967727, 'batch_norm': False, 'lr': 2.4787987177678254e-06, 'weight_decay': 2.5296558703676376e-06, 'epochs': 202, 'loss': 'mae', 'optimizer': 'adam', 'graph_mode': 'cutoff', 'cutoff': 0.22556177018810394, 'grm_norm': 'cosine_then_gcn', 'self_loops': False, 'use_snp_selection': True, 'num_snps': 23100}. Best is trial 21 with value: 0.2627915359089957.
[I 2025-11-12 07:31:57,481] Trial 36 finished with value: 0.18098681208424955 and parameters: {'model_type': 'graphsage', 'hidden_dims': '[128, 64]', 'dropout': 0.3194493080804421, 'batch_norm': True, 'lr': 5.785643327922184e-06, 'weight_decay': 0.0009709528483568253, 'epochs': 63, 'loss': 'mse', 'optimizer': 'adam', 'graph_mode': 'knn', 'source': 'grm', 'knn_k': 10, 'weighted_edges': False, 'symmetrize_mode': 'union', 'use_snp_selection': False}. Best is trial 21 with value: 0.2627915359089957.
[I 2025-11-12 07:33:04,222] Trial 37 finished with value: 0.27261143821280315 and parameters: {'model_type': 'graphsage', 'hidden_dims': '[256, 128, 64]', 'dropout': 0.2710535275872409, 'batch_norm': False, 'lr': 9.805424614559635e-06, 'weight_decay': 1.984213864044483e-05, 'epochs': 145, 'loss': 'mae', 'optimizer': 'adam', 'graph_mode': 'cutoff', 'cutoff': 0.39319853790721515, 'grm_norm': 'cosine_then_gcn', 'self_loops': False, 'use_snp_selection': True, 'num_snps': 15184}. Best is trial 37 with value: 0.27261143821280315.
[I 2025-11-12 07:34:19,230] Trial 38 finished with value: 0.20376743962687457 and parameters: {'model_type': 'graphsage', 'hidden_dims': '[256, 128, 64]', 'dropout': 0.19635030154958635, 'batch_norm': True, 'lr': 1.0818348230288684e-05, 'weight_decay': 1.664000534175962e-05, 'epochs': 125, 'loss': 'mse', 'optimizer': 'adam', 'graph_mode': 'cutoff', 'cutoff': 0.3866110548052176, 'grm_norm': 'none', 'self_loops': False, 'use_snp_selection': False}. Best is trial 37 with value: 0.27261143821280315.
[I 2025-11-12 07:35:49,628] Trial 39 finished with value: 0.19837629725800252 and parameters: {'model_type': 'graphsage', 'hidden_dims': '[256, 128, 64]', 'dropout': 0.44087663568479407, 'batch_norm': False, 'lr': 0.0009856797314608228, 'weight_decay': 2.145458671313673e-05, 'epochs': 167, 'loss': 'mae', 'optimizer': 'adam', 'graph_mode': 'knn', 'source': 'grm', 'knn_k': 3, 'weighted_edges': True, 'symmetrize_mode': 'mutual', 'use_snp_selection': True, 'num_snps': 30455}. Best is trial 37 with value: 0.27261143821280315.
[I 2025-11-12 07:36:52,466] Trial 40 finished with value: 0.253364031631767 and parameters: {'model_type': 'graphsage', 'hidden_dims': '[256, 128, 64]', 'dropout': 0.27551110046408755, 'batch_norm': False, 'lr': 1.0223150664236416e-05, 'weight_decay': 7.355254720333966e-06, 'epochs': 60, 'loss': 'mae', 'optimizer': 'adam', 'graph_mode': 'cutoff', 'cutoff': 0.577383026607865, 'grm_norm': 'gcn', 'self_loops': False, 'use_snp_selection': True, 'num_snps': 27647}. Best is trial 37 with value: 0.27261143821280315.
[I 2025-11-12 07:37:49,220] Trial 41 finished with value: 0.25738081011218966 and parameters: {'model_type': 'graphsage', 'hidden_dims': '[256, 128, 64]', 'dropout': 0.27408539085012534, 'batch_norm': False, 'lr': 2.588977033574959e-05, 'weight_decay': 8.195781939733024e-06, 'epochs': 58, 'loss': 'mae', 'optimizer': 'adam', 'graph_mode': 'cutoff', 'cutoff': 0.5793041440047919, 'grm_norm': 'gcn', 'self_loops': False, 'use_snp_selection': True, 'num_snps': 19637}. Best is trial 37 with value: 0.27261143821280315.
