[I 2025-11-03 14:12:17,339] Trial 32 finished with value: 0.14090167904521692 and parameters: {'model_type': 'graphsage', 'hidden_dims': '[512, 64]', 'dropout': 0.29556870330501417, 'batch_norm': True, 'lr': 4.8672510568021446e-05, 'weight_decay': 1.8507630414447118e-07, 'epochs': 312, 'loss': 'mse', 'optimizer': 'adam', 'graph_mode': 'knn', 'source': 'grm', 'knn_k': 10, 'weighted_edges': True, 'symmetrize_mode': 'union', 'use_snp_selection': False}. Best is trial 16 with value: 0.15497727454342672.
[I 2025-11-03 14:12:22,175] Trial 33 finished with value: 0.1176790559247354 and parameters: {'model_type': 'graphsage', 'hidden_dims': '[512, 64]', 'dropout': 0.3291970600255043, 'batch_norm': True, 'lr': 0.00018236878568365653, 'weight_decay': 1.18138478036819e-06, 'epochs': 67, 'loss': 'mse', 'optimizer': 'adam', 'graph_mode': 'knn', 'source': 'grm', 'knn_k': 9, 'weighted_edges': True, 'symmetrize_mode': 'union', 'use_snp_selection': False}. Best is trial 16 with value: 0.15497727454342672.
[I 2025-11-03 14:12:24,327] Trial 34 finished with value: 0.1466937679388402 and parameters: {'model_type': 'graphsage', 'hidden_dims': '[128, 64]', 'dropout': 0.25221849506861405, 'batch_norm': True, 'lr': 0.00019486630982081947, 'weight_decay': 9.955630978031257e-05, 'epochs': 43, 'loss': 'mse', 'optimizer': 'adam', 'graph_mode': 'knn', 'source': 'grm', 'knn_k': 7, 'weighted_edges': True, 'symmetrize_mode': 'union', 'use_snp_selection': False}. Best is trial 16 with value: 0.15497727454342672.
[I 2025-11-03 14:12:26,793] Trial 35 finished with value: 0.03487359197970606 and parameters: {'model_type': 'graphsage', 'hidden_dims': '[128, 64]', 'dropout': 0.2540626189512314, 'batch_norm': False, 'lr': 0.0005961754720098586, 'weight_decay': 0.00013421340926176995, 'epochs': 112, 'loss': 'mse', 'optimizer': 'adam', 'graph_mode': 'knn', 'source': 'grm', 'knn_k': 7, 'weighted_edges': True, 'symmetrize_mode': 'union', 'use_snp_selection': True, 'num_snps': 2074}. Best is trial 16 with value: 0.15497727454342672.
[I 2025-11-03 14:12:30,233] Trial 36 finished with value: 0.10651911366523165 and parameters: {'model_type': 'graphsage', 'hidden_dims': '[128, 64]', 'dropout': 0.14391633284800315, 'batch_norm': True, 'lr': 0.0001853682809969258, 'weight_decay': 0.0003332317038486973, 'epochs': 176, 'loss': 'mse', 'optimizer': 'adam', 'graph_mode': 'cutoff', 'cutoff': 0.42596163795855535, 'grm_norm': 'cosine', 'self_loops': True, 'use_snp_selection': False}. Best is trial 16 with value: 0.15497727454342672.
[I 2025-11-03 14:12:33,343] Trial 37 finished with value: 0.12612332594943534 and parameters: {'model_type': 'graphsage', 'hidden_dims': '[128, 64]', 'dropout': 0.2135479476447833, 'batch_norm': False, 'lr': 0.00029917800153863786, 'weight_decay': 0.0005678080703837454, 'epochs': 141, 'loss': 'mae', 'optimizer': 'adam', 'graph_mode': 'knn', 'source': 'grm', 'knn_k': 6, 'weighted_edges': True, 'symmetrize_mode': 'mutual', 'use_snp_selection': True, 'num_snps': 15344}. Best is trial 16 with value: 0.15497727454342672.
[I 2025-11-03 14:12:36,454] Trial 38 finished with value: 0.14056517424681056 and parameters: {'model_type': 'graphsage', 'hidden_dims': '[256, 128]', 'dropout': 0.10436832089269113, 'batch_norm': True, 'lr': 3.2454294657057066e-05, 'weight_decay': 3.633249814928876e-05, 'epochs': 69, 'loss': 'mse', 'optimizer': 'adam', 'graph_mode': 'knn', 'source': 'grm', 'knn_k': 5, 'weighted_edges': False, 'symmetrize_mode': 'union', 'use_snp_selection': False}. Best is trial 16 with value: 0.15497727454342672.
[I 2025-11-03 14:12:42,057] Trial 39 finished with value: 0.07334988198181738 and parameters: {'model_type': 'graphsage', 'hidden_dims': '[128, 64]', 'dropout': 0.4054266937741693, 'batch_norm': False, 'lr': 0.0004903483556238769, 'weight_decay': 1.1195012175201138e-05, 'epochs': 199, 'loss': 'mse', 'optimizer': 'adam', 'graph_mode': 'cutoff', 'cutoff': 0.8982975816958216, 'grm_norm': 'cosine_then_gcn', 'self_loops': True, 'use_snp_selection': True, 'num_snps': 58379}. Best is trial 16 with value: 0.15497727454342672.
[I 2025-11-03 14:12:55,986] Trial 40 finished with value: 0.1456723257718181 and parameters: {'model_type': 'graphsage', 'hidden_dims': '[512, 256]', 'dropout': 0.24182684427146994, 'batch_norm': True, 'lr': 0.00018320867581455604, 'weight_decay': 0.00010920338164921508, 'epochs': 314, 'loss': 'mae', 'optimizer': 'adam', 'graph_mode': 'knn', 'source': 'grm', 'knn_k': 7, 'weighted_edges': True, 'symmetrize_mode': 'union', 'use_snp_selection': False}. Best is trial 16 with value: 0.15497727454342672.
[I 2025-11-03 14:13:11,156] Trial 41 finished with value: 0.15579043491231107 and parameters: {'model_type': 'graphsage', 'hidden_dims': '[512, 256]', 'dropout': 0.2707186424626558, 'batch_norm': True, 'lr': 0.00017603686442765434, 'weight_decay': 7.204656313700877e-05, 'epochs': 349, 'loss': 'mae', 'optimizer': 'adam', 'graph_mode': 'knn', 'source': 'grm', 'knn_k': 7, 'weighted_edges': True, 'symmetrize_mode': 'union', 'use_snp_selection': False}. Best is trial 41 with value: 0.15579043491231107.
[I 2025-11-03 14:13:25,754] Trial 42 finished with value: 0.14752284115173547 and parameters: {'model_type': 'graphsage', 'hidden_dims': '[512, 256]', 'dropout': 0.2741734486853099, 'batch_norm': True, 'lr': 0.00014527567583182954, 'weight_decay': 2.7410107410242603e-05, 'epochs': 350, 'loss': 'mae', 'optimizer': 'adam', 'graph_mode': 'knn', 'source': 'grm', 'knn_k': 6, 'weighted_edges': True, 'symmetrize_mode': 'union', 'use_snp_selection': False}. Best is trial 41 with value: 0.15579043491231107.
[I 2025-11-03 14:13:40,285] Trial 43 finished with value: 0.14126892958241072 and parameters: {'model_type': 'graphsage', 'hidden_dims': '[512, 256]', 'dropout': 0.3474185592309134, 'batch_norm': True, 'lr': 0.0006483297150041882, 'weight_decay': 3.014488112140185e-05, 'epochs': 346, 'loss': 'mae', 'optimizer': 'adam', 'graph_mode': 'knn', 'source': 'grm', 'knn_k': 6, 'weighted_edges': True, 'symmetrize_mode': 'union', 'use_snp_selection': False}. Best is trial 41 with value: 0.15579043491231107.
[I 2025-11-03 14:13:52,460] Trial 44 finished with value: 0.15036025933074082 and parameters: {'model_type': 'graphsage', 'hidden_dims': '[512, 256]', 'dropout': 0.263466252100786, 'batch_norm': True, 'lr': 7.237459332501683e-05, 'weight_decay': 1.714320623751356e-05, 'epochs': 321, 'loss': 'mae', 'optimizer': 'adam', 'graph_mode': 'knn', 'source': 'grm', 'knn_k': 7, 'weighted_edges': True, 'symmetrize_mode': 'mutual', 'use_snp_selection': False}. Best is trial 41 with value: 0.15579043491231107.
[I 2025-11-03 14:14:04,140] Trial 45 finished with value: 0.11170206865356687 and parameters: {'model_type': 'graphsage', 'hidden_dims': '[512, 256]', 'dropout': 0.27022317171308186, 'batch_norm': True, 'lr': 6.721706508307878e-05, 'weight_decay': 1.8720481180557568e-05, 'epochs': 328, 'loss': 'mae', 'optimizer': 'adam', 'graph_mode': 'cutoff', 'cutoff': 0.4585737354176531, 'grm_norm': 'cosine', 'self_loops': False, 'use_snp_selection': False}. Best is trial 41 with value: 0.15579043491231107.
[I 2025-11-03 14:14:17,110] Trial 46 finished with value: 0.14667678100472964 and parameters: {'model_type': 'graphsage', 'hidden_dims': '[512, 256]', 'dropout': 0.18554996554242031, 'batch_norm': True, 'lr': 9.250638380755071e-05, 'weight_decay': 8.836481396276005e-05, 'epochs': 347, 'loss': 'mae', 'optimizer': 'adam', 'graph_mode': 'knn', 'source': 'grm', 'knn_k': 7, 'weighted_edges': True, 'symmetrize_mode': 'mutual', 'use_snp_selection': False}. Best is trial 41 with value: 0.15579043491231107.
[I 2025-11-03 14:14:29,787] Trial 47 finished with value: 0.1270342621480368 and parameters: {'model_type': 'graphsage', 'hidden_dims': '[512, 256]', 'dropout': 0.2229652096643931, 'batch_norm': True, 'lr': 3.846088206711225e-05, 'weight_decay': 4.695137116175952e-05, 'epochs': 328, 'loss': 'mae', 'optimizer': 'adam', 'graph_mode': 'knn', 'source': 'grm', 'knn_k': 8, 'weighted_edges': True, 'symmetrize_mode': 'mutual', 'use_snp_selection': False}. Best is trial 41 with value: 0.15579043491231107.
[I 2025-11-03 14:14:40,651] Trial 48 finished with value: 0.11410468264644696 and parameters: {'model_type': 'graphsage', 'hidden_dims': '[512, 256]', 'dropout': 0.34012659254499783, 'batch_norm': False, 'lr': 0.00012790695570939748, 'weight_decay': 0.00015501482100848074, 'epochs': 305, 'loss': 'mae', 'optimizer': 'adam', 'graph_mode': 'knn', 'source': 'grm', 'knn_k': 7, 'weighted_edges': True, 'symmetrize_mode': 'mutual', 'use_snp_selection': True, 'num_snps': 42595}. Best is trial 41 with value: 0.15579043491231107.
[I 2025-11-03 14:14:52,448] Trial 49 finished with value: 0.12932076704095172 and parameters: {'model_type': 'graphsage', 'hidden_dims': '[512, 256]', 'dropout': 0.30763577909902806, 'batch_norm': True, 'lr': 2.5312871709161063e-05, 'weight_decay': 1.5921718221150836e-05, 'epochs': 301, 'loss': 'mae', 'optimizer': 'adam', 'graph_mode': 'knn', 'source': 'grm', 'knn_k': 8, 'weighted_edges': True, 'symmetrize_mode': 'mutual', 'use_snp_selection': False}. Best is trial 41 with value: 0.15579043491231107.
[I 2025-11-03 14:15:08,444] Trial 50 finished with value: 0.14625176291737355 and parameters: {'model_type': 'graphsage', 'hidden_dims': '[512, 256]', 'dropout': 0.36826340157303405, 'batch_norm': True, 'lr': 0.0003416824877997861, 'weight_decay': 2.717199540827055e-05, 'epochs': 327, 'loss': 'mae', 'optimizer': 'adam', 'graph_mode': 'cutoff', 'cutoff': 0.20628834676422192, 'grm_norm': 'none', 'self_loops': True, 'use_snp_selection': False}. Best is trial 41 with value: 0.15579043491231107.
[I 2025-11-03 14:15:21,460] Trial 51 finished with value: 0.1504379738849149 and parameters: {'model_type': 'graphsage', 'hidden_dims': '[512, 256]', 'dropout': 0.18178436318526822, 'batch_norm': True, 'lr': 9.942385740740309e-05, 'weight_decay': 9.053829984703563e-05, 'epochs': 350, 'loss': 'mae', 'optimizer': 'adam', 'graph_mode': 'knn', 'source': 'grm', 'knn_k': 7, 'weighted_edges': True, 'symmetrize_mode': 'mutual', 'use_snp_selection': False}. Best is trial 41 with value: 0.15579043491231107.
[I 2025-11-03 14:15:34,114] Trial 52 finished with value: 0.14297549963225248 and parameters: {'model_type': 'graphsage', 'hidden_dims': '[512, 256]', 'dropout': 0.1313871985873864, 'batch_norm': True, 'lr': 8.753284294503443e-05, 'weight_decay': 8.424825168250968e-05, 'epochs': 347, 'loss': 'mae', 'optimizer': 'adam', 'graph_mode': 'knn', 'source': 'grm', 'knn_k': 6, 'weighted_edges': True, 'symmetrize_mode': 'mutual', 'use_snp_selection': False}. Best is trial 41 with value: 0.15579043491231107.
[I 2025-11-03 14:15:46,692] Trial 53 finished with value: 0.14348044973740987 and parameters: {'model_type': 'graphsage', 'hidden_dims': '[512, 256]', 'dropout': 0.2762742778401705, 'batch_norm': True, 'lr': 5.807729871071246e-05, 'weight_decay': 0.0002183614702813564, 'epochs': 334, 'loss': 'mae', 'optimizer': 'adam', 'graph_mode': 'knn', 'source': 'grm', 'knn_k': 7, 'weighted_edges': True, 'symmetrize_mode': 'mutual', 'use_snp_selection': False}. Best is trial 41 with value: 0.15579043491231107.
[I 2025-11-03 14:15:58,336] Trial 54 finished with value: 0.14423025406522047 and parameters: {'model_type': 'graphsage', 'hidden_dims': '[512, 256]', 'dropout': 0.15996832859930565, 'batch_norm': True, 'lr': 0.00014254684376403668, 'weight_decay': 6.195559113070003e-05, 'epochs': 323, 'loss': 'mae', 'optimizer': 'adam', 'graph_mode': 'knn', 'source': 'grm', 'knn_k': 5, 'weighted_edges': True, 'symmetrize_mode': 'mutual', 'use_snp_selection': False}. Best is trial 41 with value: 0.15579043491231107.
[I 2025-11-03 14:16:07,391] Trial 55 finished with value: 0.15949987873804383 and parameters: {'model_type': 'graphsage', 'hidden_dims': '[256, 128, 64]', 'dropout': 0.19443983356123734, 'batch_norm': True, 'lr': 0.00021822118855133817, 'weight_decay': 3.986702137847402e-05, 'epochs': 350, 'loss': 'mae', 'optimizer': 'adam', 'graph_mode': 'knn', 'source': 'grm', 'knn_k': 8, 'weighted_edges': True, 'symmetrize_mode': 'mutual', 'use_snp_selection': False}. Best is trial 55 with value: 0.15949987873804383.
[I 2025-11-03 14:16:16,455] Trial 56 finished with value: 0.14527845977717038 and parameters: {'model_type': 'graphsage', 'hidden_dims': '[256, 128, 64]', 'dropout': 0.19610171667474577, 'batch_norm': True, 'lr': 0.00011312717563443694, 'weight_decay': 7.414480941018435e-06, 'epochs': 350, 'loss': 'mae', 'optimizer': 'adam', 'graph_mode': 'knn', 'source': 'grm', 'knn_k': 8, 'weighted_edges': True, 'symmetrize_mode': 'mutual', 'use_snp_selection': False}. Best is trial 55 with value: 0.15949987873804383.
[I 2025-11-03 14:16:23,800] Trial 57 finished with value: 0.13431021420863523 and parameters: {'model_type': 'graphsage', 'hidden_dims': '[256, 128, 64]', 'dropout': 0.1284195731627617, 'batch_norm': True, 'lr': 0.0002644675417936285, 'weight_decay': 4.245226947499136e-05, 'epochs': 294, 'loss': 'mae', 'optimizer': 'adam', 'graph_mode': 'knn', 'source': 'grm', 'knn_k': 6, 'weighted_edges': True, 'symmetrize_mode': 'mutual', 'use_snp_selection': False}. Best is trial 55 with value: 0.15949987873804383.
[I 2025-11-03 14:16:32,923] Trial 58 finished with value: 0.15600553635914413 and parameters: {'model_type': 'graphsage', 'hidden_dims': '[256, 128, 64]', 'dropout': 0.2307797556705368, 'batch_norm': True, 'lr': 0.00014490400500673318, 'weight_decay': 1.4447986768493203e-05, 'epochs': 339, 'loss': 'mae', 'optimizer': 'adam', 'graph_mode': 'knn', 'source': 'grm', 'knn_k': 9, 'weighted_edges': True, 'symmetrize_mode': 'mutual', 'use_snp_selection': False}. Best is trial 55 with value: 0.15949987873804383.
[I 2025-11-03 14:16:40,640] Trial 59 finished with value: 0.14728072537889803 and parameters: {'model_type': 'graphsage', 'hidden_dims': '[256, 128, 64]', 'dropout': 0.17986725473449813, 'batch_norm': True, 'lr': 4.552071171472378e-05, 'weight_decay': 1.3359862686013683e-05, 'epochs': 276, 'loss': 'mae', 'optimizer': 'adam', 'graph_mode': 'knn', 'source': 'grm', 'knn_k': 9, 'weighted_edges': True, 'symmetrize_mode': 'mutual', 'use_snp_selection': False}. Best is trial 55 with value: 0.15949987873804383.
[I 2025-11-03 14:16:46,066] Trial 60 finished with value: 0.14088460792803564 and parameters: {'model_type': 'graphsage', 'hidden_dims': '[256, 128, 64]', 'dropout': 0.2120899125851953, 'batch_norm': False, 'lr': 7.30504621548889e-05, 'weight_decay': 2.0071733235662777e-05, 'epochs': 336, 'loss': 'mae', 'optimizer': 'adam', 'graph_mode': 'knn', 'source': 'grm', 'knn_k': 9, 'weighted_edges': True, 'symmetrize_mode': 'mutual', 'use_snp_selection': True, 'num_snps': 19019}. Best is trial 55 with value: 0.15949987873804383.
[I 2025-11-03 14:16:54,483] Trial 61 finished with value: 0.14321867552252784 and parameters: {'model_type': 'graphsage', 'hidden_dims': '[256, 128, 64]', 'dropout': 0.2289468568559662, 'batch_norm': True, 'lr': 0.00015021956608125787, 'weight_decay': 6.7470835419225185e-06, 'epochs': 319, 'loss': 'mae', 'optimizer': 'adam', 'graph_mode': 'knn', 'source': 'grm', 'knn_k': 8, 'weighted_edges': True, 'symmetrize_mode': 'mutual', 'use_snp_selection': False}. Best is trial 55 with value: 0.15949987873804383.
[I 2025-11-03 14:17:07,521] Trial 62 finished with value: 0.14255307426295585 and parameters: {'model_type': 'graphsage', 'hidden_dims': '[512, 128]', 'dropout': 0.20105779489401587, 'batch_norm': True, 'lr': 0.00022095075895022393, 'weight_decay': 3.257765287092715e-05, 'epochs': 340, 'loss': 'mae', 'optimizer': 'adam', 'graph_mode': 'knn', 'source': 'grm', 'knn_k': 8, 'weighted_edges': True, 'symmetrize_mode': 'mutual', 'use_snp_selection': False}. Best is trial 55 with value: 0.15949987873804383.
[I 2025-11-03 14:17:15,987] Trial 63 finished with value: 0.09286501813444246 and parameters: {'model_type': 'graphsage', 'hidden_dims': '[256, 128, 64]', 'dropout': 0.15030706858168336, 'batch_norm': True, 'lr': 3.1078607612904156e-06, 'weight_decay': 7.221979772312141e-05, 'epochs': 338, 'loss': 'mae', 'optimizer': 'adam', 'graph_mode': 'knn', 'source': 'grm', 'knn_k': 7, 'weighted_edges': True, 'symmetrize_mode': 'mutual', 'use_snp_selection': False}. Best is trial 55 with value: 0.15949987873804383.
[I 2025-11-03 14:17:27,230] Trial 64 finished with value: 0.14173572745696755 and parameters: {'model_type': 'graphsage', 'hidden_dims': '[512, 256]', 'dropout': 0.23425895769536526, 'batch_norm': True, 'lr': 0.0001500885441380108, 'weight_decay': 2.136077573795399e-05, 'epochs': 320, 'loss': 'mae', 'optimizer': 'adam', 'graph_mode': 'knn', 'source': 'grm', 'knn_k': 4, 'weighted_edges': True, 'symmetrize_mode': 'mutual', 'use_snp_selection': False}. Best is trial 55 with value: 0.15949987873804383.
[I 2025-11-03 14:17:34,541] Trial 65 finished with value: 0.14396120191342723 and parameters: {'model_type': 'graphsage', 'hidden_dims': '[256, 128]', 'dropout': 0.2619413878150259, 'batch_norm': True, 'lr': 0.00032654230202426425, 'weight_decay': 9.441405147159741e-06, 'epochs': 297, 'loss': 'mae', 'optimizer': 'adam', 'graph_mode': 'knn', 'source': 'grm', 'knn_k': 6, 'weighted_edges': True, 'symmetrize_mode': 'mutual', 'use_snp_selection': False}. Best is trial 55 with value: 0.15949987873804383.
[I 2025-11-03 14:17:46,248] Trial 66 finished with value: 0.15400176006856472 and parameters: {'model_type': 'graphsage', 'hidden_dims': '[512, 256]', 'dropout': 0.4616851279488884, 'batch_norm': True, 'lr': 0.00011316242955301745, 'weight_decay': 4.8640941509131375e-05, 'epochs': 307, 'loss': 'mae', 'optimizer': 'adam', 'graph_mode': 'knn', 'source': 'grm', 'knn_k': 7, 'weighted_edges': True, 'symmetrize_mode': 'mutual', 'use_snp_selection': False}. Best is trial 55 with value: 0.15949987873804383.
[I 2025-11-03 14:17:54,670] Trial 67 finished with value: 0.14986072933776595 and parameters: {'model_type': 'graphsage', 'hidden_dims': '[256, 128, 64]', 'dropout': 0.44938875710112053, 'batch_norm': True, 'lr': 0.00011392601770024826, 'weight_decay': 4.496664679835893e-05, 'epochs': 309, 'loss': 'mae', 'optimizer': 'adam', 'graph_mode': 'knn', 'source': 'grm', 'knn_k': 9, 'weighted_edges': True, 'symmetrize_mode': 'mutual', 'use_snp_selection': False}. Best is trial 55 with value: 0.15949987873804383.
[I 2025-11-03 14:18:03,961] Trial 68 finished with value: 0.12513499385025284 and parameters: {'model_type': 'graphsage', 'hidden_dims': '[512, 256]', 'dropout': 0.45248318654285746, 'batch_norm': True, 'lr': 8.273315174087514e-05, 'weight_decay': 1.4962989308988628e-05, 'epochs': 286, 'loss': 'mae', 'optimizer': 'adam', 'graph_mode': 'cutoff', 'cutoff': 0.7364324640933693, 'grm_norm': 'cosine_then_gcn', 'self_loops': True, 'use_snp_selection': False}. Best is trial 55 with value: 0.15949987873804383.
[I 2025-11-03 14:18:14,667] Trial 69 finished with value: 0.15318334942629422 and parameters: {'model_type': 'graphsage', 'hidden_dims': '[512, 128]', 'dropout': 0.5176389997979268, 'batch_norm': True, 'lr': 0.0004080681062668111, 'weight_decay': 4.855423020893879e-06, 'epochs': 268, 'loss': 'mae', 'optimizer': 'adam', 'graph_mode': 'knn', 'source': 'grm', 'knn_k': 8, 'weighted_edges': True, 'symmetrize_mode': 'mutual', 'use_snp_selection': False}. Best is trial 55 with value: 0.15949987873804383.
[I 2025-11-03 14:18:25,148] Trial 70 finished with value: 0.1419876894856329 and parameters: {'model_type': 'graphsage', 'hidden_dims': '[512, 128]', 'dropout': 0.5519281635101178, 'batch_norm': True, 'lr': 0.0007812726960078945, 'weight_decay': 3.0430570634617464e-06, 'epochs': 263, 'loss': 'mae', 'optimizer': 'adam', 'graph_mode': 'knn', 'source': 'grm', 'knn_k': 8, 'weighted_edges': False, 'symmetrize_mode': 'mutual', 'use_snp_selection': False}. Best is trial 55 with value: 0.15949987873804383.
[I 2025-11-03 14:18:35,771] Trial 71 finished with value: 0.1526718023148466 and parameters: {'model_type': 'graphsage', 'hidden_dims': '[512, 128]', 'dropout': 0.5190034258417047, 'batch_norm': True, 'lr': 0.0002531391421535693, 'weight_decay': 4.144170923112407e-06, 'epochs': 265, 'loss': 'mae', 'optimizer': 'adam', 'graph_mode': 'knn', 'source': 'grm', 'knn_k': 8, 'weighted_edges': True, 'symmetrize_mode': 'mutual', 'use_snp_selection': False}. Best is trial 55 with value: 0.15949987873804383.
[I 2025-11-03 14:18:45,840] Trial 72 finished with value: 0.1358968657856611 and parameters: {'model_type': 'graphsage', 'hidden_dims': '[512, 128]', 'dropout': 0.4978163783200512, 'batch_norm': True, 'lr': 0.0004042278747520947, 'weight_decay': 4.44815127916105e-06, 'epochs': 247, 'loss': 'mae', 'optimizer': 'adam', 'graph_mode': 'knn', 'source': 'grm', 'knn_k': 8, 'weighted_edges': True, 'symmetrize_mode': 'mutual', 'use_snp_selection': False}. Best is trial 55 with value: 0.15949987873804383.
[I 2025-11-03 14:18:56,878] Trial 73 finished with value: 0.15273952845347538 and parameters: {'model_type': 'graphsage', 'hidden_dims': '[512, 128]', 'dropout': 0.525045519879685, 'batch_norm': True, 'lr': 0.0004907913591025274, 'weight_decay': 2.897664576055718e-06, 'epochs': 270, 'loss': 'mae', 'optimizer': 'adam', 'graph_mode': 'knn', 'source': 'grm', 'knn_k': 9, 'weighted_edges': True, 'symmetrize_mode': 'mutual', 'use_snp_selection': False}. Best is trial 55 with value: 0.15949987873804383.
[I 2025-11-03 14:19:07,874] Trial 74 finished with value: 0.1510114436864807 and parameters: {'model_type': 'graphsage', 'hidden_dims': '[512, 128]', 'dropout': 0.5268077383329375, 'batch_norm': True, 'lr': 0.0005322656248011137, 'weight_decay': 2.0137355127301203e-06, 'epochs': 263, 'loss': 'mae', 'optimizer': 'adam', 'graph_mode': 'knn', 'source': 'grm', 'knn_k': 10, 'weighted_edges': True, 'symmetrize_mode': 'mutual', 'use_snp_selection': False}. Best is trial 55 with value: 0.15949987873804383.
