[I 2025-11-03 12:52:59,463] Trial 146 finished with value: -0.0070704748758119475 and parameters: {'model_type': 'gcn', 'hidden_dims': '[512, 256]', 'dropout': 0.4836825347556323, 'batch_norm': False, 'lr': 5.6929318480216656e-05, 'weight_decay': 5.098729459713184e-06, 'epochs': 258, 'loss': 'mae', 'optimizer': 'adam', 'graph_mode': 'cutoff', 'cutoff': 0.42081318504749765, 'grm_norm': 'cosine', 'self_loops': False, 'use_snp_selection': True, 'num_snps': 20130}. Best is trial 109 with value: 0.09816236567521958.
[I 2025-11-03 12:53:01,429] Trial 147 finished with value: 0.06300539216243692 and parameters: {'model_type': 'gcn', 'hidden_dims': '[512, 128]', 'dropout': 0.41165171152422275, 'batch_norm': False, 'lr': 4.520503188663853e-05, 'weight_decay': 6.783185346793848e-07, 'epochs': 292, 'loss': 'mse', 'optimizer': 'adam', 'graph_mode': 'knn', 'source': 'grm', 'knn_k': 4, 'weighted_edges': False, 'symmetrize_mode': 'union', 'use_snp_selection': True, 'num_snps': 10982}. Best is trial 109 with value: 0.09816236567521958.
[I 2025-11-03 12:53:03,253] Trial 148 finished with value: 0.033849383183878895 and parameters: {'model_type': 'gcn', 'hidden_dims': '[512, 128]', 'dropout': 0.4164345417126057, 'batch_norm': False, 'lr': 4.5100698129700275e-05, 'weight_decay': 5.072715474893305e-07, 'epochs': 240, 'loss': 'mse', 'optimizer': 'adam', 'graph_mode': 'knn', 'source': 'grm', 'knn_k': 4, 'weighted_edges': False, 'symmetrize_mode': 'union', 'use_snp_selection': True, 'num_snps': 10617}. Best is trial 109 with value: 0.09816236567521958.
[I 2025-11-03 12:53:06,178] Trial 149 finished with value: 0.0493805825117155 and parameters: {'model_type': 'gcn', 'hidden_dims': '[512, 128]', 'dropout': 0.4321741672480967, 'batch_norm': True, 'lr': 3.481920238381186e-05, 'weight_decay': 7.56490836802811e-07, 'epochs': 308, 'loss': 'mse', 'optimizer': 'adam', 'graph_mode': 'knn', 'source': 'grm', 'knn_k': 5, 'weighted_edges': False, 'symmetrize_mode': 'union', 'use_snp_selection': False}. Best is trial 109 with value: 0.09816236567521958.
[I 2025-11-03 12:53:08,299] Trial 0 finished with value: -0.0001314236299647379 and parameters: {'model_type': 'gcn', 'hidden_dims': '[128, 64]', 'dropout': 0.199031432379812, 'batch_norm': True, 'lr': 1.8408544111075837e-06, 'weight_decay': 5.5136510071208614e-05, 'epochs': 334, 'loss': 'mae', 'optimizer': 'adam', 'graph_mode': 'knn', 'source': 'grm', 'knn_k': 8, 'weighted_edges': True, 'symmetrize_mode': 'mutual', 'use_snp_selection': False}. Best is trial 0 with value: -0.0001314236299647379.
[I 2025-11-03 12:53:09,401] Trial 1 finished with value: 0.04661593226793236 and parameters: {'model_type': 'gcn', 'hidden_dims': '[128, 64]', 'dropout': 0.40051947670227217, 'batch_norm': True, 'lr': 0.0005320428882732732, 'weight_decay': 1.89210117736594e-06, 'epochs': 32, 'loss': 'mse', 'optimizer': 'adam', 'graph_mode': 'knn', 'source': 'grm', 'knn_k': 7, 'weighted_edges': True, 'symmetrize_mode': 'union', 'use_snp_selection': False}. Best is trial 1 with value: 0.04661593226793236.
[I 2025-11-03 12:53:11,645] Trial 2 finished with value: 0.007520986906487186 and parameters: {'model_type': 'gcn', 'hidden_dims': '[256, 128]', 'dropout': 0.5105528289184642, 'batch_norm': False, 'lr': 0.0006804279372404962, 'weight_decay': 0.0008922815224257085, 'epochs': 160, 'loss': 'mse', 'optimizer': 'adam', 'graph_mode': 'cutoff', 'cutoff': 0.5741905641612706, 'grm_norm': 'gcn', 'self_loops': False, 'use_snp_selection': True, 'num_snps': 26910}. Best is trial 1 with value: 0.04661593226793236.
[I 2025-11-03 12:53:13,979] Trial 3 finished with value: -0.01577738385171054 and parameters: {'model_type': 'gcn', 'hidden_dims': '[256, 128, 64]', 'dropout': 0.5390483213624292, 'batch_norm': False, 'lr': 3.4705625989073525e-05, 'weight_decay': 2.4623319020131338e-05, 'epochs': 92, 'loss': 'mse', 'optimizer': 'adam', 'graph_mode': 'knn', 'source': 'grm', 'knn_k': 6, 'weighted_edges': False, 'symmetrize_mode': 'mutual', 'use_snp_selection': True, 'num_snps': 30713}. Best is trial 1 with value: 0.04661593226793236.
[I 2025-11-03 12:53:16,295] Trial 4 finished with value: 0.019347211656292676 and parameters: {'model_type': 'gcn', 'hidden_dims': '[128, 64]', 'dropout': 0.13404863676897502, 'batch_norm': False, 'lr': 0.0001431556295367288, 'weight_decay': 2.2084517750726675e-05, 'epochs': 13, 'loss': 'mae', 'optimizer': 'adam', 'graph_mode': 'cutoff', 'cutoff': 0.6714268476993044, 'grm_norm': 'none', 'self_loops': False, 'use_snp_selection': True, 'num_snps': 45645}. Best is trial 1 with value: 0.04661593226793236.
[I 2025-11-03 12:53:19,113] Trial 5 finished with value: 0.02137476017447444 and parameters: {'model_type': 'gcn', 'hidden_dims': '[256, 128]', 'dropout': 0.42253606323412096, 'batch_norm': False, 'lr': 4.238630400638805e-05, 'weight_decay': 8.074086040046576e-07, 'epochs': 134, 'loss': 'mae', 'optimizer': 'adam', 'graph_mode': 'knn', 'source': 'grm', 'knn_k': 1, 'weighted_edges': False, 'symmetrize_mode': 'mutual', 'use_snp_selection': True, 'num_snps': 43113}. Best is trial 1 with value: 0.04661593226793236.
[I 2025-11-03 12:53:21,843] Trial 6 finished with value: 0.024917290197895268 and parameters: {'model_type': 'gcn', 'hidden_dims': '[512, 256]', 'dropout': 0.3534893146320237, 'batch_norm': True, 'lr': 0.000251307964226932, 'weight_decay': 1.821819791794022e-05, 'epochs': 207, 'loss': 'mae', 'optimizer': 'adam', 'graph_mode': 'knn', 'source': 'grm', 'knn_k': 1, 'weighted_edges': True, 'symmetrize_mode': 'mutual', 'use_snp_selection': False}. Best is trial 1 with value: 0.04661593226793236.
[I 2025-11-03 12:53:24,221] Trial 7 finished with value: 0.06251962894159929 and parameters: {'model_type': 'gcn', 'hidden_dims': '[512, 256]', 'dropout': 0.1105825955860775, 'batch_norm': True, 'lr': 2.374338412754043e-05, 'weight_decay': 1.1284721123340274e-05, 'epochs': 170, 'loss': 'mse', 'optimizer': 'adam', 'graph_mode': 'cutoff', 'cutoff': 0.719872204109604, 'grm_norm': 'gcn', 'self_loops': False, 'use_snp_selection': False}. Best is trial 7 with value: 0.06251962894159929.
[I 2025-11-03 12:53:26,070] Trial 8 finished with value: 0.043049809356749874 and parameters: {'model_type': 'gcn', 'hidden_dims': '[512, 128]', 'dropout': 0.5066580418354021, 'batch_norm': True, 'lr': 0.00039213678276659976, 'weight_decay': 3.43655320802934e-06, 'epochs': 91, 'loss': 'mse', 'optimizer': 'adam', 'graph_mode': 'cutoff', 'cutoff': 0.34923059576505366, 'grm_norm': 'cosine', 'self_loops': True, 'use_snp_selection': False}. Best is trial 7 with value: 0.06251962894159929.
[I 2025-11-03 12:53:27,786] Trial 9 finished with value: 0.011342803816498836 and parameters: {'model_type': 'gcn', 'hidden_dims': '[512, 256]', 'dropout': 0.301734920240333, 'batch_norm': False, 'lr': 6.650961854953448e-06, 'weight_decay': 6.861575656590315e-05, 'epochs': 125, 'loss': 'mae', 'optimizer': 'adam', 'graph_mode': 'cutoff', 'cutoff': 0.2857569870061939, 'grm_norm': 'cosine_then_gcn', 'self_loops': False, 'use_snp_selection': True, 'num_snps': 12722}. Best is trial 7 with value: 0.06251962894159929.
[I 2025-11-03 12:53:30,817] Trial 10 finished with value: 0.02263617265841675 and parameters: {'model_type': 'gcn', 'hidden_dims': '[512, 64]', 'dropout': 0.2491228540815774, 'batch_norm': True, 'lr': 1.080428984628536e-05, 'weight_decay': 1.6060239611529646e-07, 'epochs': 266, 'loss': 'mse', 'optimizer': 'adam', 'graph_mode': 'cutoff', 'cutoff': 0.8740100033033126, 'grm_norm': 'gcn', 'self_loops': True, 'use_snp_selection': False}. Best is trial 7 with value: 0.06251962894159929.
[I 2025-11-03 12:53:32,146] Trial 11 finished with value: 0.02697437449826757 and parameters: {'model_type': 'gcn', 'hidden_dims': '[512, 256]', 'dropout': 0.4214049075657615, 'batch_norm': True, 'lr': 0.0001113083271410056, 'weight_decay': 2.204499469040496e-06, 'epochs': 3, 'loss': 'mse', 'optimizer': 'adam', 'graph_mode': 'knn', 'source': 'grm', 'knn_k': 10, 'weighted_edges': True, 'symmetrize_mode': 'union', 'use_snp_selection': False}. Best is trial 7 with value: 0.06251962894159929.
[I 2025-11-03 12:53:33,867] Trial 12 finished with value: 0.013754276851720768 and parameters: {'model_type': 'gcn', 'hidden_dims': '[128, 64]', 'dropout': 0.38018633523546363, 'batch_norm': True, 'lr': 1.0835479002658625e-05, 'weight_decay': 4.2872520334625766e-07, 'epochs': 223, 'loss': 'mse', 'optimizer': 'adam', 'graph_mode': 'cutoff', 'cutoff': 0.823146584864209, 'grm_norm': 'gcn', 'self_loops': False, 'use_snp_selection': False}. Best is trial 7 with value: 0.06251962894159929.
[I 2025-11-03 12:53:35,504] Trial 13 finished with value: 0.018121782030205574 and parameters: {'model_type': 'gcn', 'hidden_dims': '[512, 64]', 'dropout': 0.10325172884852192, 'batch_norm': True, 'lr': 0.0009283598235713637, 'weight_decay': 3.4829222552152862e-06, 'epochs': 51, 'loss': 'mse', 'optimizer': 'adam', 'graph_mode': 'knn', 'source': 'grm', 'knn_k': 5, 'weighted_edges': True, 'symmetrize_mode': 'union', 'use_snp_selection': False}. Best is trial 7 with value: 0.06251962894159929.
[I 2025-11-03 12:53:38,425] Trial 14 finished with value: 0.006952541756784549 and parameters: {'model_type': 'gcn', 'hidden_dims': '[256, 128, 64]', 'dropout': 0.2702522093855072, 'batch_norm': True, 'lr': 8.396027725580842e-05, 'weight_decay': 0.00022640784955374533, 'epochs': 323, 'loss': 'mse', 'optimizer': 'adam', 'graph_mode': 'knn', 'source': 'grm', 'knn_k': 5, 'weighted_edges': True, 'symmetrize_mode': 'union', 'use_snp_selection': False}. Best is trial 7 with value: 0.06251962894159929.
[I 2025-11-03 12:53:41,446] Trial 15 finished with value: 0.0168752340126264 and parameters: {'model_type': 'gcn', 'hidden_dims': '[512, 128]', 'dropout': 0.5933810085595006, 'batch_norm': True, 'lr': 3.5359691119433927e-06, 'weight_decay': 6.064276000702049e-06, 'epochs': 263, 'loss': 'mse', 'optimizer': 'adam', 'graph_mode': 'cutoff', 'cutoff': 0.7000082431955479, 'grm_norm': 'cosine_then_gcn', 'self_loops': False, 'use_snp_selection': False}. Best is trial 7 with value: 0.06251962894159929.
[I 2025-11-03 12:53:42,582] Trial 16 finished with value: -0.010924361402654178 and parameters: {'model_type': 'gcn', 'hidden_dims': '[128, 64]', 'dropout': 0.18056155537749746, 'batch_norm': True, 'lr': 1.620239870213878e-05, 'weight_decay': 1.0343901278764551e-06, 'epochs': 58, 'loss': 'mse', 'optimizer': 'adam', 'graph_mode': 'cutoff', 'cutoff': 0.44543870555027765, 'grm_norm': 'none', 'self_loops': True, 'use_snp_selection': False}. Best is trial 7 with value: 0.06251962894159929.
[I 2025-11-03 12:53:45,140] Trial 17 finished with value: 0.009017853221007892 and parameters: {'model_type': 'gcn', 'hidden_dims': '[512, 256]', 'dropout': 0.4337768631587977, 'batch_norm': True, 'lr': 5.4748967857163485e-05, 'weight_decay': 1.3538364361707143e-07, 'epochs': 181, 'loss': 'mse', 'optimizer': 'adam', 'graph_mode': 'knn', 'source': 'grm', 'knn_k': 8, 'weighted_edges': False, 'symmetrize_mode': 'union', 'use_snp_selection': False}. Best is trial 7 with value: 0.06251962894159929.
[I 2025-11-03 12:53:46,984] Trial 18 finished with value: 0.055676247011422784 and parameters: {'model_type': 'gcn', 'hidden_dims': '[128, 64]', 'dropout': 0.31482132115107053, 'batch_norm': True, 'lr': 2.1347712798692498e-05, 'weight_decay': 8.921413225344443e-06, 'epochs': 271, 'loss': 'mse', 'optimizer': 'adam', 'graph_mode': 'cutoff', 'cutoff': 0.7074628960861822, 'grm_norm': 'cosine', 'self_loops': False, 'use_snp_selection': False}. Best is trial 7 with value: 0.06251962894159929.
[I 2025-11-03 12:53:50,049] Trial 19 finished with value: 0.008721035288751199 and parameters: {'model_type': 'gcn', 'hidden_dims': '[512, 256]', 'dropout': 0.2114808855585357, 'batch_norm': True, 'lr': 1.8483186288302363e-05, 'weight_decay': 9.20656049639438e-06, 'epochs': 270, 'loss': 'mse', 'optimizer': 'adam', 'graph_mode': 'cutoff', 'cutoff': 0.7220891015790726, 'grm_norm': 'cosine', 'self_loops': False, 'use_snp_selection': False}. Best is trial 7 with value: 0.06251962894159929.
[I 2025-11-03 12:53:53,350] Trial 20 finished with value: 0.007096725294186469 and parameters: {'model_type': 'gcn', 'hidden_dims': '[512, 64]', 'dropout': 0.3118102322638349, 'batch_norm': True, 'lr': 1.0818981879418793e-06, 'weight_decay': 0.0001465674808038524, 'epochs': 305, 'loss': 'mse', 'optimizer': 'adam', 'graph_mode': 'cutoff', 'cutoff': 0.5662575026093968, 'grm_norm': 'cosine', 'self_loops': False, 'use_snp_selection': False}. Best is trial 7 with value: 0.06251962894159929.
[I 2025-11-03 12:53:55,038] Trial 21 finished with value: 0.03626091699922414 and parameters: {'model_type': 'gcn', 'hidden_dims': '[128, 64]', 'dropout': 0.47231055671098787, 'batch_norm': True, 'lr': 2.4448271232117702e-05, 'weight_decay': 1.988313802525731e-06, 'epochs': 223, 'loss': 'mse', 'optimizer': 'adam', 'graph_mode': 'cutoff', 'cutoff': 0.7851922687070864, 'grm_norm': 'cosine', 'self_loops': False, 'use_snp_selection': False}. Best is trial 7 with value: 0.06251962894159929.
[I 2025-11-03 12:53:56,570] Trial 22 finished with value: -0.007621517747977964 and parameters: {'model_type': 'gcn', 'hidden_dims': '[128, 64]', 'dropout': 0.3646484621162938, 'batch_norm': True, 'lr': 5.190170384469151e-06, 'weight_decay': 8.398319313651327e-06, 'epochs': 176, 'loss': 'mse', 'optimizer': 'adam', 'graph_mode': 'cutoff', 'cutoff': 0.6121220671045007, 'grm_norm': 'gcn', 'self_loops': False, 'use_snp_selection': False}. Best is trial 7 with value: 0.06251962894159929.
[I 2025-11-03 12:53:58,552] Trial 23 finished with value: 0.008961320251190709 and parameters: {'model_type': 'gcn', 'hidden_dims': '[128, 64]', 'dropout': 0.31198343720211413, 'batch_norm': True, 'lr': 5.702648242403974e-05, 'weight_decay': 5.506999509477454e-07, 'epochs': 297, 'loss': 'mse', 'optimizer': 'adam', 'graph_mode': 'knn', 'source': 'grm', 'knn_k': 4, 'weighted_edges': True, 'symmetrize_mode': 'union', 'use_snp_selection': False}. Best is trial 7 with value: 0.06251962894159929.
[I 2025-11-03 12:54:00,665] Trial 24 finished with value: -8.176012640725173e-05 and parameters: {'model_type': 'gcn', 'hidden_dims': '[128, 64]', 'dropout': 0.15334197055037926, 'batch_norm': True, 'lr': 0.00019055631184938487, 'weight_decay': 5.3438908761894145e-06, 'epochs': 350, 'loss': 'mse', 'optimizer': 'adam', 'graph_mode': 'cutoff', 'cutoff': 0.47112400749267597, 'grm_norm': 'cosine', 'self_loops': False, 'use_snp_selection': False}. Best is trial 7 with value: 0.06251962894159929.
[I 2025-11-03 12:54:02,418] Trial 25 finished with value: 0.038637067989841824 and parameters: {'model_type': 'gcn', 'hidden_dims': '[256, 128, 64]', 'dropout': 0.22931395239188201, 'batch_norm': True, 'lr': 0.0003489652547681969, 'weight_decay': 1.4707389388306526e-06, 'epochs': 125, 'loss': 'mse', 'optimizer': 'adam', 'graph_mode': 'cutoff', 'cutoff': 0.7638607685430128, 'grm_norm': 'gcn', 'self_loops': True, 'use_snp_selection': False}. Best is trial 7 with value: 0.06251962894159929.
[I 2025-11-03 12:54:05,696] Trial 26 finished with value: -0.004476408957105253 and parameters: {'model_type': 'gcn', 'hidden_dims': '[512, 128]', 'dropout': 0.38835173671429746, 'batch_norm': False, 'lr': 8.42690852855836e-05, 'weight_decay': 1.4078283087439993e-05, 'epochs': 38, 'loss': 'mae', 'optimizer': 'adam', 'graph_mode': 'knn', 'source': 'grm', 'knn_k': 10, 'weighted_edges': False, 'symmetrize_mode': 'union', 'use_snp_selection': True, 'num_snps': 59005}. Best is trial 7 with value: 0.06251962894159929.
[I 2025-11-03 12:54:07,873] Trial 27 finished with value: -0.007629521906118956 and parameters: {'model_type': 'gcn', 'hidden_dims': '[256, 128]', 'dropout': 0.2698601425955874, 'batch_norm': True, 'lr': 2.6161266209108626e-05, 'weight_decay': 4.322035874307223e-05, 'epochs': 245, 'loss': 'mse', 'optimizer': 'adam', 'graph_mode': 'cutoff', 'cutoff': 0.8917271235232904, 'grm_norm': 'none', 'self_loops': False, 'use_snp_selection': False}. Best is trial 7 with value: 0.06251962894159929.
[I 2025-11-03 12:54:09,732] Trial 28 finished with value: 0.007675416899030069 and parameters: {'model_type': 'gcn', 'hidden_dims': '[512, 256]', 'dropout': 0.47665069595857895, 'batch_norm': True, 'lr': 1.0370086283072662e-05, 'weight_decay': 4.0644083333824655e-07, 'epochs': 87, 'loss': 'mse', 'optimizer': 'adam', 'graph_mode': 'knn', 'source': 'grm', 'knn_k': 3, 'weighted_edges': True, 'symmetrize_mode': 'union', 'use_snp_selection': False}. Best is trial 7 with value: 0.06251962894159929.
[I 2025-11-03 12:54:11,704] Trial 29 finished with value: -0.014882094212556972 and parameters: {'model_type': 'gcn', 'hidden_dims': '[128, 64]', 'dropout': 0.18494675235288924, 'batch_norm': True, 'lr': 2.6203079482381155e-06, 'weight_decay': 5.224906176093864e-05, 'epochs': 287, 'loss': 'mae', 'optimizer': 'adam', 'graph_mode': 'knn', 'source': 'grm', 'knn_k': 7, 'weighted_edges': True, 'symmetrize_mode': 'union', 'use_snp_selection': False}. Best is trial 7 with value: 0.06251962894159929.
[I 2025-11-03 12:54:13,157] Trial 30 finished with value: 0.0013726865166233883 and parameters: {'model_type': 'gcn', 'hidden_dims': '[128, 64]', 'dropout': 0.31683199791263456, 'batch_norm': True, 'lr': 1.691735092231927e-05, 'weight_decay': 3.6375191768668912e-06, 'epochs': 149, 'loss': 'mse', 'optimizer': 'adam', 'graph_mode': 'cutoff', 'cutoff': 0.6567411799067597, 'grm_norm': 'cosine_then_gcn', 'self_loops': False, 'use_snp_selection': False}. Best is trial 7 with value: 0.06251962894159929.
[I 2025-11-03 12:54:15,036] Trial 31 finished with value: -0.0009237609607786267 and parameters: {'model_type': 'gcn', 'hidden_dims': '[512, 128]', 'dropout': 0.5804472428198517, 'batch_norm': True, 'lr': 0.0005089089593143393, 'weight_decay': 4.186010005023668e-06, 'epochs': 96, 'loss': 'mse', 'optimizer': 'adam', 'graph_mode': 'cutoff', 'cutoff': 0.24570568313118152, 'grm_norm': 'cosine', 'self_loops': True, 'use_snp_selection': False}. Best is trial 7 with value: 0.06251962894159929.
[I 2025-11-03 12:54:16,749] Trial 32 finished with value: 0.01865053286994412 and parameters: {'model_type': 'gcn', 'hidden_dims': '[512, 128]', 'dropout': 0.517553108289266, 'batch_norm': True, 'lr': 0.0003564968758049821, 'weight_decay': 2.7034102718422086e-06, 'epochs': 72, 'loss': 'mse', 'optimizer': 'adam', 'graph_mode': 'cutoff', 'cutoff': 0.3645776546126782, 'grm_norm': 'cosine', 'self_loops': True, 'use_snp_selection': False}. Best is trial 7 with value: 0.06251962894159929.
[I 2025-11-03 12:54:18,177] Trial 33 finished with value: 0.014916782753250023 and parameters: {'model_type': 'gcn', 'hidden_dims': '[512, 128]', 'dropout': 0.5536007685128056, 'batch_norm': True, 'lr': 0.0006145525252676201, 'weight_decay': 1.098582875502145e-05, 'epochs': 30, 'loss': 'mse', 'optimizer': 'adam', 'graph_mode': 'cutoff', 'cutoff': 0.4950461823260164, 'grm_norm': 'cosine', 'self_loops': True, 'use_snp_selection': False}. Best is trial 7 with value: 0.06251962894159929.
[I 2025-11-03 12:54:19,495] Trial 34 finished with value: 0.015344893907201935 and parameters: {'model_type': 'gcn', 'hidden_dims': '[512, 128]', 'dropout': 0.45720003078597327, 'batch_norm': False, 'lr': 0.0009474169274028327, 'weight_decay': 2.5044886802760402e-05, 'epochs': 105, 'loss': 'mse', 'optimizer': 'adam', 'graph_mode': 'cutoff', 'cutoff': 0.3659123146569229, 'grm_norm': 'cosine', 'self_loops': True, 'use_snp_selection': True, 'num_snps': 3631}. Best is trial 7 with value: 0.06251962894159929.
[I 2025-11-03 12:54:21,474] Trial 35 finished with value: 0.03512565023834035 and parameters: {'model_type': 'gcn', 'hidden_dims': '[256, 128]', 'dropout': 0.5005119449714643, 'batch_norm': False, 'lr': 3.713301360138766e-05, 'weight_decay': 1.2515001561429494e-06, 'epochs': 190, 'loss': 'mse', 'optimizer': 'adam', 'graph_mode': 'cutoff', 'cutoff': 0.3754962535098204, 'grm_norm': 'gcn', 'self_loops': True, 'use_snp_selection': True, 'num_snps': 17571}. Best is trial 7 with value: 0.06251962894159929.
[I 2025-11-03 12:54:23,414] Trial 36 finished with value: 0.032812230651165314 and parameters: {'model_type': 'gcn', 'hidden_dims': '[256, 128, 64]', 'dropout': 0.4034608892160001, 'batch_norm': True, 'lr': 0.00017342683313180008, 'weight_decay': 3.193482319360242e-05, 'epochs': 159, 'loss': 'mae', 'optimizer': 'adam', 'graph_mode': 'cutoff', 'cutoff': 0.6318187873274845, 'grm_norm': 'cosine', 'self_loops': True, 'use_snp_selection': False}. Best is trial 7 with value: 0.06251962894159929.
[I 2025-11-03 12:54:26,205] Trial 37 finished with value: 0.0352313630630806 and parameters: {'model_type': 'gcn', 'hidden_dims': '[128, 64]', 'dropout': 0.33365842421817915, 'batch_norm': False, 'lr': 0.00037413095268708376, 'weight_decay': 6.849772593536714e-06, 'epochs': 26, 'loss': 'mse', 'optimizer': 'adam', 'graph_mode': 'knn', 'source': 'grm', 'knn_k': 3, 'weighted_edges': False, 'symmetrize_mode': 'mutual', 'use_snp_selection': True, 'num_snps': 56058}. Best is trial 7 with value: 0.06251962894159929.
[I 2025-11-03 12:54:27,998] Trial 38 finished with value: 0.04116973085301767 and parameters: {'model_type': 'gcn', 'hidden_dims': '[512, 256]', 'dropout': 0.5444306569907507, 'batch_norm': True, 'lr': 0.00025674154173498565, 'weight_decay': 0.00012392366124379769, 'epochs': 74, 'loss': 'mae', 'optimizer': 'adam', 'graph_mode': 'cutoff', 'cutoff': 0.5145997536895657, 'grm_norm': 'cosine', 'self_loops': False, 'use_snp_selection': False}. Best is trial 7 with value: 0.06251962894159929.
[I 2025-11-03 12:54:29,615] Trial 39 finished with value: 0.000771688799477917 and parameters: {'model_type': 'gcn', 'hidden_dims': '[256, 128]', 'dropout': 0.12734738110096477, 'batch_norm': True, 'lr': 7.091111014416778e-06, 'weight_decay': 0.0008356601475880457, 'epochs': 117, 'loss': 'mse', 'optimizer': 'adam', 'graph_mode': 'knn', 'source': 'grm', 'knn_k': 8, 'weighted_edges': True, 'symmetrize_mode': 'union', 'use_snp_selection': False}. Best is trial 7 with value: 0.06251962894159929.
