[I 2025-11-03 16:04:33,716] Trial 79 finished with value: 0.16166801404739148 and parameters: {'model_type': 'graphsage', 'hidden_dims': '[256, 128]', 'dropout': 0.32983317887643454, 'batch_norm': True, 'lr': 0.0009704713062116277, 'weight_decay': 1.9244951149362617e-05, 'epochs': 274, 'loss': 'mae', 'optimizer': 'adam', 'graph_mode': 'knn', 'source': 'grm', 'knn_k': 4, 'weighted_edges': False, 'symmetrize_mode': 'mutual', 'use_snp_selection': False}. Best is trial 48 with value: 0.18074188677385775.
[I 2025-11-03 16:04:40,453] Trial 80 finished with value: 0.1756404836692072 and parameters: {'model_type': 'graphsage', 'hidden_dims': '[256, 128]', 'dropout': 0.35989890452053186, 'batch_norm': True, 'lr': 0.0007158440130095123, 'weight_decay': 1.5428177570274284e-06, 'epochs': 294, 'loss': 'mse', 'optimizer': 'adam', 'graph_mode': 'knn', 'source': 'grm', 'knn_k': 2, 'weighted_edges': False, 'symmetrize_mode': 'union', 'use_snp_selection': False}. Best is trial 48 with value: 0.18074188677385775.
[I 2025-11-03 16:04:47,297] Trial 81 finished with value: 0.1524328519586019 and parameters: {'model_type': 'graphsage', 'hidden_dims': '[256, 128]', 'dropout': 0.3530875662571469, 'batch_norm': True, 'lr': 0.0006570080101005857, 'weight_decay': 1.5766987781692563e-06, 'epochs': 293, 'loss': 'mse', 'optimizer': 'adam', 'graph_mode': 'knn', 'source': 'grm', 'knn_k': 2, 'weighted_edges': False, 'symmetrize_mode': 'union', 'use_snp_selection': False}. Best is trial 48 with value: 0.18074188677385775.
[I 2025-11-03 16:04:53,433] Trial 82 finished with value: 0.1736649756731815 and parameters: {'model_type': 'graphsage', 'hidden_dims': '[256, 128]', 'dropout': 0.42512382785374714, 'batch_norm': True, 'lr': 0.000549160651263354, 'weight_decay': 3.7920019455717545e-06, 'epochs': 282, 'loss': 'mse', 'optimizer': 'adam', 'graph_mode': 'knn', 'source': 'grm', 'knn_k': 1, 'weighted_edges': False, 'symmetrize_mode': 'union', 'use_snp_selection': False}. Best is trial 48 with value: 0.18074188677385775.
[I 2025-11-03 16:05:00,443] Trial 83 finished with value: 0.1546772915664362 and parameters: {'model_type': 'graphsage', 'hidden_dims': '[256, 128]', 'dropout': 0.39659761798896326, 'batch_norm': True, 'lr': 0.00041547428180476457, 'weight_decay': 2.017920643667756e-06, 'epochs': 308, 'loss': 'mse', 'optimizer': 'adam', 'graph_mode': 'knn', 'source': 'grm', 'knn_k': 2, 'weighted_edges': False, 'symmetrize_mode': 'union', 'use_snp_selection': False}. Best is trial 48 with value: 0.18074188677385775.
[I 2025-11-03 16:05:07,736] Trial 84 finished with value: 0.1567044247702433 and parameters: {'model_type': 'graphsage', 'hidden_dims': '[256, 128, 64]', 'dropout': 0.3744107057956192, 'batch_norm': True, 'lr': 0.0007321850380323128, 'weight_decay': 5.049268939466892e-06, 'epochs': 295, 'loss': 'mse', 'optimizer': 'adam', 'graph_mode': 'knn', 'source': 'grm', 'knn_k': 3, 'weighted_edges': False, 'symmetrize_mode': 'union', 'use_snp_selection': False}. Best is trial 48 with value: 0.18074188677385775.
[I 2025-11-03 16:05:14,714] Trial 85 finished with value: 0.18104777428467558 and parameters: {'model_type': 'graphsage', 'hidden_dims': '[256, 128]', 'dropout': 0.36266765314953764, 'batch_norm': True, 'lr': 0.000843074987333166, 'weight_decay': 2.9047446049838655e-06, 'epochs': 341, 'loss': 'mse', 'optimizer': 'adam', 'graph_mode': 'knn', 'source': 'grm', 'knn_k': 1, 'weighted_edges': True, 'symmetrize_mode': 'union', 'use_snp_selection': False}. Best is trial 85 with value: 0.18104777428467558.
[I 2025-11-03 16:05:21,121] Trial 86 finished with value: 0.17222001740968745 and parameters: {'model_type': 'graphsage', 'hidden_dims': '[128, 64]', 'dropout': 0.3181512939504595, 'batch_norm': True, 'lr': 0.0005095034110529843, 'weight_decay': 3.095869333503319e-06, 'epochs': 341, 'loss': 'mse', 'optimizer': 'adam', 'graph_mode': 'knn', 'source': 'grm', 'knn_k': 4, 'weighted_edges': True, 'symmetrize_mode': 'union', 'use_snp_selection': False}. Best is trial 85 with value: 0.18104777428467558.
[I 2025-11-03 16:05:32,045] Trial 87 finished with value: 0.15687544460446326 and parameters: {'model_type': 'graphsage', 'hidden_dims': '[512, 128]', 'dropout': 0.14026385052202797, 'batch_norm': False, 'lr': 0.0008298813199648852, 'weight_decay': 7.865777863210826e-06, 'epochs': 332, 'loss': 'mae', 'optimizer': 'adam', 'graph_mode': 'knn', 'source': 'grm', 'knn_k': 1, 'weighted_edges': True, 'symmetrize_mode': 'mutual', 'use_snp_selection': True, 'num_snps': 50914}. Best is trial 85 with value: 0.18104777428467558.
[I 2025-11-03 16:05:42,142] Trial 88 finished with value: 0.1656898953622643 and parameters: {'model_type': 'graphsage', 'hidden_dims': '[256, 128]', 'dropout': 0.34052255450031893, 'batch_norm': True, 'lr': 0.00041087760684183896, 'weight_decay': 2.178295990828314e-06, 'epochs': 322, 'loss': 'mse', 'optimizer': 'adam', 'graph_mode': 'knn', 'source': 'grm', 'knn_k': 7, 'weighted_edges': True, 'symmetrize_mode': 'union', 'use_snp_selection': False}. Best is trial 85 with value: 0.18104777428467558.
[I 2025-11-03 16:05:54,015] Trial 89 finished with value: 0.17483297942573126 and parameters: {'model_type': 'graphsage', 'hidden_dims': '[512, 64]', 'dropout': 0.43815948684190864, 'batch_norm': True, 'lr': 0.00034733443950027323, 'weight_decay': 9.774112507313218e-07, 'epochs': 339, 'loss': 'mae', 'optimizer': 'adam', 'graph_mode': 'cutoff', 'cutoff': 0.45514746035566844, 'grm_norm': 'cosine_then_gcn', 'self_loops': True, 'use_snp_selection': False}. Best is trial 85 with value: 0.18104777428467558.
[I 2025-11-03 16:06:00,131] Trial 90 finished with value: 0.17287932899512062 and parameters: {'model_type': 'graphsage', 'hidden_dims': '[256, 128]', 'dropout': 0.2937423063946577, 'batch_norm': True, 'lr': 0.0005847554264454044, 'weight_decay': 4.576963827523641e-06, 'epochs': 315, 'loss': 'mae', 'optimizer': 'adam', 'graph_mode': 'knn', 'source': 'grm', 'knn_k': 1, 'weighted_edges': True, 'symmetrize_mode': 'mutual', 'use_snp_selection': False}. Best is trial 85 with value: 0.18104777428467558.
[I 2025-11-03 16:06:06,468] Trial 91 finished with value: 0.15194641346635515 and parameters: {'model_type': 'graphsage', 'hidden_dims': '[256, 128]', 'dropout': 0.36178649208649494, 'batch_norm': True, 'lr': 0.0006815561281221743, 'weight_decay': 1.410224511121325e-06, 'epochs': 302, 'loss': 'mse', 'optimizer': 'adam', 'graph_mode': 'knn', 'source': 'grm', 'knn_k': 1, 'weighted_edges': True, 'symmetrize_mode': 'union', 'use_snp_selection': False}. Best is trial 85 with value: 0.18104777428467558.
[I 2025-11-03 16:06:13,593] Trial 92 finished with value: 0.15198288523148376 and parameters: {'model_type': 'graphsage', 'hidden_dims': '[256, 128]', 'dropout': 0.3748032777916285, 'batch_norm': True, 'lr': 0.0009996554014278336, 'weight_decay': 2.863481369557106e-06, 'epochs': 290, 'loss': 'mse', 'optimizer': 'adam', 'graph_mode': 'knn', 'source': 'grm', 'knn_k': 3, 'weighted_edges': True, 'symmetrize_mode': 'union', 'use_snp_selection': False}. Best is trial 85 with value: 0.18104777428467558.
[I 2025-11-03 16:06:19,899] Trial 93 finished with value: 0.1629501923032916 and parameters: {'model_type': 'graphsage', 'hidden_dims': '[256, 128]', 'dropout': 0.40782870671448346, 'batch_norm': True, 'lr': 0.000842407981359316, 'weight_decay': 1.5153105206110557e-06, 'epochs': 272, 'loss': 'mse', 'optimizer': 'adam', 'graph_mode': 'knn', 'source': 'grm', 'knn_k': 2, 'weighted_edges': False, 'symmetrize_mode': 'union', 'use_snp_selection': False}. Best is trial 85 with value: 0.18104777428467558.
[I 2025-11-03 16:06:24,560] Trial 94 finished with value: 0.16548851620672758 and parameters: {'model_type': 'graphsage', 'hidden_dims': '[128, 64]', 'dropout': 0.39457079937263084, 'batch_norm': True, 'lr': 0.00045932617267289863, 'weight_decay': 8.748783581107275e-07, 'epochs': 258, 'loss': 'mse', 'optimizer': 'adam', 'graph_mode': 'knn', 'source': 'grm', 'knn_k': 3, 'weighted_edges': True, 'symmetrize_mode': 'union', 'use_snp_selection': False}. Best is trial 85 with value: 0.18104777428467558.
[I 2025-11-03 16:06:31,350] Trial 95 finished with value: 0.16124059329196586 and parameters: {'model_type': 'graphsage', 'hidden_dims': '[256, 128]', 'dropout': 0.36314691098305735, 'batch_norm': True, 'lr': 0.0007471927608541931, 'weight_decay': 3.865386677161079e-06, 'epochs': 299, 'loss': 'mse', 'optimizer': 'adam', 'graph_mode': 'knn', 'source': 'grm', 'knn_k': 2, 'weighted_edges': False, 'symmetrize_mode': 'union', 'use_snp_selection': False}. Best is trial 85 with value: 0.18104777428467558.
[I 2025-11-03 16:06:38,065] Trial 96 finished with value: 0.17611822386551693 and parameters: {'model_type': 'graphsage', 'hidden_dims': '[256, 128]', 'dropout': 0.3844480971617623, 'batch_norm': True, 'lr': 0.0005699640138119443, 'weight_decay': 1.9465483857443827e-06, 'epochs': 325, 'loss': 'mse', 'optimizer': 'adam', 'graph_mode': 'knn', 'source': 'grm', 'knn_k': 1, 'weighted_edges': True, 'symmetrize_mode': 'union', 'use_snp_selection': False}. Best is trial 85 with value: 0.18104777428467558.
[I 2025-11-03 16:06:48,473] Trial 97 finished with value: 0.16945735803423745 and parameters: {'model_type': 'graphsage', 'hidden_dims': '[512, 64]', 'dropout': 0.4251684906330333, 'batch_norm': True, 'lr': 0.0005647974213275076, 'weight_decay': 6.372084295810605e-06, 'epochs': 327, 'loss': 'mae', 'optimizer': 'adam', 'graph_mode': 'knn', 'source': 'grm', 'knn_k': 1, 'weighted_edges': True, 'symmetrize_mode': 'mutual', 'use_snp_selection': False}. Best is trial 85 with value: 0.18104777428467558.
[I 2025-11-03 16:06:55,174] Trial 98 finished with value: 0.07254729911435523 and parameters: {'model_type': 'graphsage', 'hidden_dims': '[256, 128, 64]', 'dropout': 0.3828153280650859, 'batch_norm': True, 'lr': 1.2189814811696432e-05, 'weight_decay': 2.5323770773648944e-06, 'epochs': 350, 'loss': 'mse', 'optimizer': 'adam', 'graph_mode': 'knn', 'source': 'grm', 'knn_k': 1, 'weighted_edges': True, 'symmetrize_mode': 'mutual', 'use_snp_selection': False}. Best is trial 85 with value: 0.18104777428467558.
[I 2025-11-03 16:06:58,957] Trial 99 finished with value: 0.16121198796672662 and parameters: {'model_type': 'graphsage', 'hidden_dims': '[512, 128]', 'dropout': 0.41329087514113416, 'batch_norm': True, 'lr': 0.0003754951319357591, 'weight_decay': 1.991103181712867e-06, 'epochs': 46, 'loss': 'mae', 'optimizer': 'adam', 'graph_mode': 'knn', 'source': 'grm', 'knn_k': 7, 'weighted_edges': True, 'symmetrize_mode': 'union', 'use_snp_selection': False}. Best is trial 85 with value: 0.18104777428467558.
[I 2025-11-03 16:07:04,244] Trial 100 finished with value: 0.11690468190600087 and parameters: {'model_type': 'graphsage', 'hidden_dims': '[128, 64]', 'dropout': 0.39542548757950474, 'batch_norm': False, 'lr': 0.0005126272065917504, 'weight_decay': 3.505620071496704e-06, 'epochs': 309, 'loss': 'mse', 'optimizer': 'adam', 'graph_mode': 'knn', 'source': 'grm', 'knn_k': 4, 'weighted_edges': True, 'symmetrize_mode': 'mutual', 'use_snp_selection': True, 'num_snps': 36175}. Best is trial 85 with value: 0.18104777428467558.
[I 2025-11-03 16:07:11,770] Trial 101 finished with value: 0.16307902635079496 and parameters: {'model_type': 'graphsage', 'hidden_dims': '[256, 128]', 'dropout': 0.35326610207723336, 'batch_norm': True, 'lr': 0.000721378129271964, 'weight_decay': 1.7205772738154718e-06, 'epochs': 340, 'loss': 'mse', 'optimizer': 'adam', 'graph_mode': 'knn', 'source': 'grm', 'knn_k': 2, 'weighted_edges': True, 'symmetrize_mode': 'union', 'use_snp_selection': False}. Best is trial 85 with value: 0.18104777428467558.
[I 2025-11-03 16:07:18,433] Trial 102 finished with value: 0.16280558323367933 and parameters: {'model_type': 'graphsage', 'hidden_dims': '[256, 128]', 'dropout': 0.33842380412871886, 'batch_norm': True, 'lr': 0.000893774750919427, 'weight_decay': 1.4020538993552808e-06, 'epochs': 322, 'loss': 'mse', 'optimizer': 'adam', 'graph_mode': 'knn', 'source': 'grm', 'knn_k': 1, 'weighted_edges': True, 'symmetrize_mode': 'union', 'use_snp_selection': False}. Best is trial 85 with value: 0.18104777428467558.
[I 2025-11-03 16:07:20,934] Trial 103 finished with value: 0.14360998703660274 and parameters: {'model_type': 'graphsage', 'hidden_dims': '[256, 128]', 'dropout': 0.36558650882487387, 'batch_norm': True, 'lr': 0.0006129564105322605, 'weight_decay': 7.582533511319051e-07, 'epochs': 61, 'loss': 'mse', 'optimizer': 'adam', 'graph_mode': 'knn', 'source': 'grm', 'knn_k': 2, 'weighted_edges': False, 'symmetrize_mode': 'union', 'use_snp_selection': False}. Best is trial 85 with value: 0.18104777428467558.
[I 2025-11-03 16:07:27,940] Trial 104 finished with value: 0.16181816111145314 and parameters: {'model_type': 'graphsage', 'hidden_dims': '[256, 128]', 'dropout': 0.38123119539073125, 'batch_norm': True, 'lr': 0.0007614921092648239, 'weight_decay': 5.227232881713552e-06, 'epochs': 284, 'loss': 'mse', 'optimizer': 'adam', 'graph_mode': 'knn', 'source': 'grm', 'knn_k': 3, 'weighted_edges': True, 'symmetrize_mode': 'union', 'use_snp_selection': False}. Best is trial 85 with value: 0.18104777428467558.
[I 2025-11-03 16:07:34,505] Trial 105 finished with value: 0.07704626936456191 and parameters: {'model_type': 'graphsage', 'hidden_dims': '[256, 128]', 'dropout': 0.35281835617126567, 'batch_norm': True, 'lr': 2.032486766715951e-06, 'weight_decay': 2.310474839862447e-06, 'epochs': 316, 'loss': 'mae', 'optimizer': 'adam', 'graph_mode': 'knn', 'source': 'grm', 'knn_k': 1, 'weighted_edges': False, 'symmetrize_mode': 'union', 'use_snp_selection': False}. Best is trial 85 with value: 0.18104777428467558.
[I 2025-11-03 16:07:39,212] Trial 106 finished with value: 0.16730945367707326 and parameters: {'model_type': 'graphsage', 'hidden_dims': '[512, 64]', 'dropout': 0.3265447681048412, 'batch_norm': True, 'lr': 0.0004401627800756738, 'weight_decay': 1.8585566357824266e-06, 'epochs': 100, 'loss': 'mse', 'optimizer': 'adam', 'graph_mode': 'knn', 'source': 'grm', 'knn_k': 2, 'weighted_edges': True, 'symmetrize_mode': 'mutual', 'use_snp_selection': False}. Best is trial 85 with value: 0.18104777428467558.
[I 2025-11-03 16:07:44,974] Trial 107 finished with value: 0.16117171041081288 and parameters: {'model_type': 'graphsage', 'hidden_dims': '[256, 128]', 'dropout': 0.4332697199864772, 'batch_norm': True, 'lr': 0.00030694336228555307, 'weight_decay': 2.855492520169952e-06, 'epochs': 267, 'loss': 'mae', 'optimizer': 'adam', 'graph_mode': 'knn', 'source': 'grm', 'knn_k': 1, 'weighted_edges': False, 'symmetrize_mode': 'union', 'use_snp_selection': False}. Best is trial 85 with value: 0.18104777428467558.
[I 2025-11-03 16:07:54,589] Trial 108 finished with value: 0.15213971776808222 and parameters: {'model_type': 'graphsage', 'hidden_dims': '[512, 256]', 'dropout': 0.3896816044489489, 'batch_norm': True, 'lr': 0.000669903385321543, 'weight_decay': 7.25041076592598e-06, 'epochs': 304, 'loss': 'mse', 'optimizer': 'adam', 'graph_mode': 'cutoff', 'cutoff': 0.6578643008984942, 'grm_norm': 'none', 'self_loops': False, 'use_snp_selection': False}. Best is trial 85 with value: 0.18104777428467558.
[I 2025-11-03 16:08:00,899] Trial 109 finished with value: 0.17112466343727073 and parameters: {'model_type': 'graphsage', 'hidden_dims': '[256, 128]', 'dropout': 0.3722112164610488, 'batch_norm': True, 'lr': 0.0005043188725893212, 'weight_decay': 1.0186923176348926e-05, 'epochs': 291, 'loss': 'mae', 'optimizer': 'adam', 'graph_mode': 'knn', 'source': 'grm', 'knn_k': 3, 'weighted_edges': True, 'symmetrize_mode': 'mutual', 'use_snp_selection': False}. Best is trial 85 with value: 0.18104777428467558.
[I 2025-11-03 16:08:03,239] Trial 110 finished with value: 0.17227137047499527 and parameters: {'model_type': 'graphsage', 'hidden_dims': '[128, 64]', 'dropout': 0.40348767153963216, 'batch_norm': True, 'lr': 0.0008947782020274766, 'weight_decay': 6.578298297757762e-07, 'epochs': 77, 'loss': 'mae', 'optimizer': 'adam', 'graph_mode': 'knn', 'source': 'grm', 'knn_k': 8, 'weighted_edges': False, 'symmetrize_mode': 'mutual', 'use_snp_selection': False}. Best is trial 85 with value: 0.18104777428467558.
[I 2025-11-03 16:08:14,045] Trial 111 finished with value: 0.1647039741144697 and parameters: {'model_type': 'graphsage', 'hidden_dims': '[512, 256]', 'dropout': 0.4762931804880561, 'batch_norm': True, 'lr': 0.0003558892619256696, 'weight_decay': 1.2191807819841502e-06, 'epochs': 299, 'loss': 'mae', 'optimizer': 'adam', 'graph_mode': 'knn', 'source': 'grm', 'knn_k': 5, 'weighted_edges': False, 'symmetrize_mode': 'mutual', 'use_snp_selection': False}. Best is trial 85 with value: 0.18104777428467558.
[I 2025-11-03 16:08:20,472] Trial 112 finished with value: 0.15925924363954072 and parameters: {'model_type': 'graphsage', 'hidden_dims': '[512, 256]', 'dropout': 0.5398690804286571, 'batch_norm': True, 'lr': 0.0005736850493280312, 'weight_decay': 1.312859476980647e-06, 'epochs': 144, 'loss': 'mae', 'optimizer': 'adam', 'graph_mode': 'knn', 'source': 'grm', 'knn_k': 6, 'weighted_edges': False, 'symmetrize_mode': 'mutual', 'use_snp_selection': False}. Best is trial 85 with value: 0.18104777428467558.
[I 2025-11-03 16:08:32,420] Trial 113 finished with value: 0.16563701719574372 and parameters: {'model_type': 'graphsage', 'hidden_dims': '[512, 256]', 'dropout': 0.34558267901320616, 'batch_norm': True, 'lr': 0.00038364023605026883, 'weight_decay': 9.61203893793725e-07, 'epochs': 327, 'loss': 'mae', 'optimizer': 'adam', 'graph_mode': 'knn', 'source': 'grm', 'knn_k': 6, 'weighted_edges': False, 'symmetrize_mode': 'mutual', 'use_snp_selection': False}. Best is trial 85 with value: 0.18104777428467558.
[I 2025-11-03 16:08:42,604] Trial 114 finished with value: 0.16893713801081664 and parameters: {'model_type': 'graphsage', 'hidden_dims': '[512, 256]', 'dropout': 0.40946941329233133, 'batch_norm': True, 'lr': 0.0002200663252944524, 'weight_decay': 1.6444314866373632e-06, 'epochs': 277, 'loss': 'mae', 'optimizer': 'adam', 'graph_mode': 'knn', 'source': 'grm', 'knn_k': 5, 'weighted_edges': False, 'symmetrize_mode': 'mutual', 'use_snp_selection': False}. Best is trial 85 with value: 0.18104777428467558.
[I 2025-11-03 16:08:53,117] Trial 115 finished with value: 0.17074662802469043 and parameters: {'model_type': 'graphsage', 'hidden_dims': '[512, 256]', 'dropout': 0.5605821502677003, 'batch_norm': True, 'lr': 0.00045334609054585345, 'weight_decay': 2.477734499459117e-06, 'epochs': 308, 'loss': 'mae', 'optimizer': 'adam', 'graph_mode': 'knn', 'source': 'grm', 'knn_k': 3, 'weighted_edges': False, 'symmetrize_mode': 'mutual', 'use_snp_selection': False}. Best is trial 85 with value: 0.18104777428467558.
[I 2025-11-03 16:09:00,180] Trial 116 finished with value: 0.14139148347245323 and parameters: {'model_type': 'graphsage', 'hidden_dims': '[256, 128]', 'dropout': 0.505192560966332, 'batch_norm': True, 'lr': 3.19351075845258e-05, 'weight_decay': 3.4639322171309723e-06, 'epochs': 319, 'loss': 'mae', 'optimizer': 'adam', 'graph_mode': 'knn', 'source': 'grm', 'knn_k': 4, 'weighted_edges': True, 'symmetrize_mode': 'mutual', 'use_snp_selection': False}. Best is trial 85 with value: 0.18104777428467558.
[I 2025-11-03 16:09:12,426] Trial 117 finished with value: 0.18305314054348443 and parameters: {'model_type': 'graphsage', 'hidden_dims': '[512, 256]', 'dropout': 0.46089467444065846, 'batch_norm': True, 'lr': 0.0006120018126815765, 'weight_decay': 4.800777574874787e-07, 'epochs': 285, 'loss': 'mse', 'optimizer': 'adam', 'graph_mode': 'knn', 'source': 'grm', 'knn_k': 6, 'weighted_edges': False, 'symmetrize_mode': 'union', 'use_snp_selection': False}. Best is trial 117 with value: 0.18305314054348443.
[I 2025-11-03 16:09:24,640] Trial 118 finished with value: 0.17566722418520914 and parameters: {'model_type': 'graphsage', 'hidden_dims': '[512, 64]', 'dropout': 0.4520028896376329, 'batch_norm': True, 'lr': 0.0006162657610968871, 'weight_decay': 3.5678705554558193e-07, 'epochs': 287, 'loss': 'mse', 'optimizer': 'adam', 'graph_mode': 'knn', 'source': 'grm', 'knn_k': 6, 'weighted_edges': False, 'symmetrize_mode': 'union', 'use_snp_selection': False}. Best is trial 117 with value: 0.18305314054348443.
[I 2025-11-03 16:09:35,761] Trial 119 finished with value: 0.17165702275031883 and parameters: {'model_type': 'graphsage', 'hidden_dims': '[512, 64]', 'dropout': 0.45961072788710045, 'batch_norm': True, 'lr': 0.000872527128347873, 'weight_decay': 3.2146548755259754e-07, 'epochs': 254, 'loss': 'mse', 'optimizer': 'adam', 'graph_mode': 'knn', 'source': 'grm', 'knn_k': 6, 'weighted_edges': True, 'symmetrize_mode': 'union', 'use_snp_selection': False}. Best is trial 117 with value: 0.18305314054348443.
[I 2025-11-03 16:09:39,931] Trial 120 finished with value: 0.09515498552836264 and parameters: {'model_type': 'graphsage', 'hidden_dims': '[512, 64]', 'dropout': 0.4423943054161201, 'batch_norm': False, 'lr': 0.0006198446199693068, 'weight_decay': 4.714299978464229e-07, 'epochs': 223, 'loss': 'mse', 'optimizer': 'adam', 'graph_mode': 'knn', 'source': 'grm', 'knn_k': 6, 'weighted_edges': False, 'symmetrize_mode': 'union', 'use_snp_selection': True, 'num_snps': 12273}. Best is trial 117 with value: 0.18305314054348443.
[I 2025-11-03 16:09:52,381] Trial 121 finished with value: 0.16707884848120064 and parameters: {'model_type': 'graphsage', 'hidden_dims': '[512, 64]', 'dropout': 0.42405007636825914, 'batch_norm': True, 'lr': 0.0007531659036066928, 'weight_decay': 2.719429655017194e-07, 'epochs': 280, 'loss': 'mse', 'optimizer': 'adam', 'graph_mode': 'knn', 'source': 'grm', 'knn_k': 7, 'weighted_edges': False, 'symmetrize_mode': 'union', 'use_snp_selection': False}. Best is trial 117 with value: 0.18305314054348443.
