[I 2025-11-13 00:34:35,354] Trial 139 finished with value: 0.2425308732837596 and parameters: {'model_type': 'graphsage', 'hidden_dims': '[512, 256]', 'dropout': 0.5618965493302831, 'batch_norm': False, 'lr': 1.513294069287627e-05, 'weight_decay': 1.4959048633468815e-07, 'epochs': 251, 'loss': 'mae', 'optimizer': 'adam', 'graph_mode': 'cutoff', 'cutoff': 0.3546648704084098, 'grm_norm': 'cosine', 'self_loops': True, 'use_snp_selection': False}. Best is trial 98 with value: 0.25308949405017456.
[I 2025-11-13 00:36:55,299] Trial 140 finished with value: 0.24409392355887408 and parameters: {'model_type': 'graphsage', 'hidden_dims': '[512, 256]', 'dropout': 0.5821924111483783, 'batch_norm': False, 'lr': 2.0847266796931687e-05, 'weight_decay': 4.259645574322782e-07, 'epochs': 230, 'loss': 'mae', 'optimizer': 'adam', 'graph_mode': 'cutoff', 'cutoff': 0.38879704836732054, 'grm_norm': 'cosine_then_gcn', 'self_loops': True, 'use_snp_selection': False}. Best is trial 98 with value: 0.25308949405017456.
[I 2025-11-13 00:39:16,523] Trial 141 finished with value: 0.24596426501363983 and parameters: {'model_type': 'graphsage', 'hidden_dims': '[512, 256]', 'dropout': 0.595180710856142, 'batch_norm': False, 'lr': 2.806789963629402e-05, 'weight_decay': 4.165698280413901e-07, 'epochs': 231, 'loss': 'mae', 'optimizer': 'adam', 'graph_mode': 'cutoff', 'cutoff': 0.37462675893343755, 'grm_norm': 'cosine_then_gcn', 'self_loops': True, 'use_snp_selection': False}. Best is trial 98 with value: 0.25308949405017456.
[I 2025-11-13 00:41:38,086] Trial 142 finished with value: 0.24199219095858301 and parameters: {'model_type': 'graphsage', 'hidden_dims': '[512, 256]', 'dropout': 0.5840579443706514, 'batch_norm': False, 'lr': 1.9951616014961317e-05, 'weight_decay': 4.0983992366649127e-07, 'epochs': 231, 'loss': 'mae', 'optimizer': 'adam', 'graph_mode': 'cutoff', 'cutoff': 0.3733088292321783, 'grm_norm': 'cosine_then_gcn', 'self_loops': True, 'use_snp_selection': False}. Best is trial 98 with value: 0.25308949405017456.
[I 2025-11-13 00:44:02,915] Trial 143 finished with value: 0.24684176793320875 and parameters: {'model_type': 'graphsage', 'hidden_dims': '[512, 256]', 'dropout': 0.5842170216676272, 'batch_norm': False, 'lr': 2.8841823591330345e-05, 'weight_decay': 4.2629169824842307e-07, 'epochs': 240, 'loss': 'mae', 'optimizer': 'adam', 'graph_mode': 'cutoff', 'cutoff': 0.38892874102541247, 'grm_norm': 'cosine_then_gcn', 'self_loops': True, 'use_snp_selection': False}. Best is trial 98 with value: 0.25308949405017456.
[I 2025-11-13 00:46:37,983] Trial 144 finished with value: 0.241527200946289 and parameters: {'model_type': 'graphsage', 'hidden_dims': '[512, 256]', 'dropout': 0.5865697001755243, 'batch_norm': False, 'lr': 2.6253470316354287e-05, 'weight_decay': 4.44778678244503e-07, 'epochs': 241, 'loss': 'mae', 'optimizer': 'adam', 'graph_mode': 'cutoff', 'cutoff': 0.32383176471571595, 'grm_norm': 'cosine_then_gcn', 'self_loops': True, 'use_snp_selection': False}. Best is trial 98 with value: 0.25308949405017456.
[I 2025-11-13 00:47:28,969] Trial 145 finished with value: 0.21726681339139559 and parameters: {'model_type': 'graphsage', 'hidden_dims': '[512, 256]', 'dropout': 0.5999700481412877, 'batch_norm': False, 'lr': 2.757148061552441e-05, 'weight_decay': 8.131317707220772e-07, 'epochs': 60, 'loss': 'mae', 'optimizer': 'adam', 'graph_mode': 'cutoff', 'cutoff': 0.38787027875469865, 'grm_norm': 'cosine_then_gcn', 'self_loops': True, 'use_snp_selection': False}. Best is trial 98 with value: 0.25308949405017456.
[I 2025-11-13 00:50:08,095] Trial 146 finished with value: 0.24754106589680386 and parameters: {'model_type': 'graphsage', 'hidden_dims': '[512, 256]', 'dropout': 0.5810616112912256, 'batch_norm': False, 'lr': 2.2029622708034183e-05, 'weight_decay': 6.738363608741741e-07, 'epochs': 235, 'loss': 'mae', 'optimizer': 'adam', 'graph_mode': 'cutoff', 'cutoff': 0.2982310627053939, 'grm_norm': 'cosine_then_gcn', 'self_loops': True, 'use_snp_selection': False}. Best is trial 98 with value: 0.25308949405017456.
[I 2025-11-13 00:53:06,917] Trial 147 finished with value: 0.2333140036101516 and parameters: {'model_type': 'graphsage', 'hidden_dims': '[512, 256]', 'dropout': 0.5671482471515114, 'batch_norm': False, 'lr': 1.7629396217079572e-05, 'weight_decay': 6.460568992371828e-07, 'epochs': 257, 'loss': 'mae', 'optimizer': 'adam', 'graph_mode': 'cutoff', 'cutoff': 0.28387893895809985, 'grm_norm': 'cosine_then_gcn', 'self_loops': True, 'use_snp_selection': False}. Best is trial 98 with value: 0.25308949405017456.
[I 2025-11-13 00:55:57,536] Trial 148 finished with value: 0.21675364676785067 and parameters: {'model_type': 'graphsage', 'hidden_dims': '[512, 256]', 'dropout': 0.5907497436105803, 'batch_norm': False, 'lr': 3.171975222433692e-05, 'weight_decay': 4.4273731040653467e-07, 'epochs': 233, 'loss': 'mae', 'optimizer': 'adam', 'graph_mode': 'knn', 'source': 'grm', 'knn_k': 6, 'weighted_edges': False, 'symmetrize_mode': 'union', 'use_snp_selection': False}. Best is trial 98 with value: 0.25308949405017456.
[I 2025-11-13 00:58:58,617] Trial 149 finished with value: 0.237201223690789 and parameters: {'model_type': 'graphsage', 'hidden_dims': '[512, 256]', 'dropout': 0.5554772180366224, 'batch_norm': False, 'lr': 1.0340256190104386e-05, 'weight_decay': 3.341445275495824e-07, 'epochs': 248, 'loss': 'mae', 'optimizer': 'adam', 'graph_mode': 'cutoff', 'cutoff': 0.26884484595076985, 'grm_norm': 'cosine_then_gcn', 'self_loops': True, 'use_snp_selection': False}. Best is trial 98 with value: 0.25308949405017456.
[I 2025-11-13 01:01:33,626] Trial 0 finished with value: 0.13816020080838104 and parameters: {'model_type': 'graphsage', 'hidden_dims': '[128, 64]', 'dropout': 0.199031432379812, 'batch_norm': True, 'lr': 1.8408544111075837e-06, 'weight_decay': 5.5136510071208614e-05, 'epochs': 336, 'loss': 'mae', 'optimizer': 'adam', 'graph_mode': 'knn', 'source': 'grm', 'knn_k': 8, 'weighted_edges': True, 'symmetrize_mode': 'mutual', 'use_snp_selection': False}. Best is trial 0 with value: 0.13816020080838104.
[I 2025-11-13 01:02:23,205] Trial 1 finished with value: 0.2238646263385898 and parameters: {'model_type': 'graphsage', 'hidden_dims': '[128, 64]', 'dropout': 0.40051947670227217, 'batch_norm': True, 'lr': 0.0005320428882732732, 'weight_decay': 1.89210117736594e-06, 'epochs': 68, 'loss': 'mse', 'optimizer': 'adam', 'graph_mode': 'knn', 'source': 'grm', 'knn_k': 7, 'weighted_edges': True, 'symmetrize_mode': 'union', 'use_snp_selection': False}. Best is trial 1 with value: 0.2238646263385898.
[I 2025-11-13 01:03:40,563] Trial 2 finished with value: 0.1530883370169011 and parameters: {'model_type': 'graphsage', 'hidden_dims': '[256, 128]', 'dropout': 0.5105528289184642, 'batch_norm': False, 'lr': 0.0006804279372404962, 'weight_decay': 0.0008922815224257085, 'epochs': 181, 'loss': 'mse', 'optimizer': 'adam', 'graph_mode': 'cutoff', 'cutoff': 0.5741905641612706, 'grm_norm': 'gcn', 'self_loops': False, 'use_snp_selection': True, 'num_snps': 26910}. Best is trial 1 with value: 0.2238646263385898.
[I 2025-11-13 01:05:07,963] Trial 3 finished with value: 0.21221885135983162 and parameters: {'model_type': 'graphsage', 'hidden_dims': '[256, 128, 64]', 'dropout': 0.5390483213624292, 'batch_norm': False, 'lr': 3.4705625989073525e-05, 'weight_decay': 2.4623319020131338e-05, 'epochs': 121, 'loss': 'mse', 'optimizer': 'adam', 'graph_mode': 'knn', 'source': 'grm', 'knn_k': 6, 'weighted_edges': False, 'symmetrize_mode': 'mutual', 'use_snp_selection': True, 'num_snps': 30713}. Best is trial 1 with value: 0.2238646263385898.
[I 2025-11-13 01:06:13,472] Trial 4 finished with value: 0.237436111271741 and parameters: {'model_type': 'graphsage', 'hidden_dims': '[128, 64]', 'dropout': 0.13404863676897502, 'batch_norm': False, 'lr': 0.0001431556295367288, 'weight_decay': 2.2084517750726675e-05, 'epochs': 51, 'loss': 'mae', 'optimizer': 'adam', 'graph_mode': 'cutoff', 'cutoff': 0.6714268476993044, 'grm_norm': 'none', 'self_loops': False, 'use_snp_selection': True, 'num_snps': 45645}. Best is trial 4 with value: 0.237436111271741.
[I 2025-11-13 01:07:50,962] Trial 5 finished with value: 0.2282257284969252 and parameters: {'model_type': 'graphsage', 'hidden_dims': '[256, 128]', 'dropout': 0.42253606323412096, 'batch_norm': False, 'lr': 4.238630400638805e-05, 'weight_decay': 8.074086040046576e-07, 'epochs': 158, 'loss': 'mae', 'optimizer': 'adam', 'graph_mode': 'knn', 'source': 'grm', 'knn_k': 1, 'weighted_edges': False, 'symmetrize_mode': 'mutual', 'use_snp_selection': True, 'num_snps': 43113}. Best is trial 4 with value: 0.237436111271741.
[I 2025-11-13 01:10:25,009] Trial 6 finished with value: 0.21203229633858983 and parameters: {'model_type': 'graphsage', 'hidden_dims': '[512, 256]', 'dropout': 0.3534893146320237, 'batch_norm': True, 'lr': 0.000251307964226932, 'weight_decay': 1.821819791794022e-05, 'epochs': 223, 'loss': 'mae', 'optimizer': 'adam', 'graph_mode': 'knn', 'source': 'grm', 'knn_k': 1, 'weighted_edges': True, 'symmetrize_mode': 'mutual', 'use_snp_selection': False}. Best is trial 4 with value: 0.237436111271741.
[I 2025-11-13 01:12:36,051] Trial 7 finished with value: 0.212925021221512 and parameters: {'model_type': 'graphsage', 'hidden_dims': '[512, 256]', 'dropout': 0.1105825955860775, 'batch_norm': True, 'lr': 2.374338412754043e-05, 'weight_decay': 1.1284721123340274e-05, 'epochs': 190, 'loss': 'mse', 'optimizer': 'adam', 'graph_mode': 'cutoff', 'cutoff': 0.719872204109604, 'grm_norm': 'gcn', 'self_loops': False, 'use_snp_selection': False}. Best is trial 4 with value: 0.237436111271741.
[I 2025-11-13 01:14:24,371] Trial 8 finished with value: 0.22722812380319354 and parameters: {'model_type': 'graphsage', 'hidden_dims': '[512, 128]', 'dropout': 0.5066580418354021, 'batch_norm': True, 'lr': 0.00039213678276659976, 'weight_decay': 3.43655320802934e-06, 'epochs': 120, 'loss': 'mse', 'optimizer': 'adam', 'graph_mode': 'cutoff', 'cutoff': 0.34923059576505366, 'grm_norm': 'cosine', 'self_loops': True, 'use_snp_selection': False}. Best is trial 4 with value: 0.237436111271741.
[I 2025-11-13 01:15:38,068] Trial 9 finished with value: 0.21348220945429822 and parameters: {'model_type': 'graphsage', 'hidden_dims': '[512, 256]', 'dropout': 0.301734920240333, 'batch_norm': False, 'lr': 6.650961854953448e-06, 'weight_decay': 6.861575656590315e-05, 'epochs': 150, 'loss': 'mae', 'optimizer': 'adam', 'graph_mode': 'cutoff', 'cutoff': 0.2857569870061939, 'grm_norm': 'cosine_then_gcn', 'self_loops': False, 'use_snp_selection': True, 'num_snps': 12722}. Best is trial 4 with value: 0.237436111271741.
[I 2025-11-13 01:17:10,991] Trial 10 finished with value: 0.1634115630585477 and parameters: {'model_type': 'graphsage', 'hidden_dims': '[512, 64]', 'dropout': 0.22492338276159776, 'batch_norm': False, 'lr': 0.00014233761188460356, 'weight_decay': 1.8772904431456567e-07, 'epochs': 41, 'loss': 'mae', 'optimizer': 'adam', 'graph_mode': 'cutoff', 'cutoff': 0.8740100033033124, 'grm_norm': 'none', 'self_loops': True, 'use_snp_selection': True, 'num_snps': 58960}. Best is trial 4 with value: 0.237436111271741.
[I 2025-11-13 01:19:55,862] Trial 11 finished with value: 0.22095327801212958 and parameters: {'model_type': 'graphsage', 'hidden_dims': '[256, 128]', 'dropout': 0.42220860806405436, 'batch_norm': False, 'lr': 6.262647579580582e-05, 'weight_decay': 4.139423376842716e-07, 'epochs': 265, 'loss': 'mae', 'optimizer': 'adam', 'graph_mode': 'knn', 'source': 'grm', 'knn_k': 1, 'weighted_edges': False, 'symmetrize_mode': 'union', 'use_snp_selection': True, 'num_snps': 51345}. Best is trial 4 with value: 0.237436111271741.
[I 2025-11-13 01:21:13,926] Trial 12 finished with value: 0.23781438417698325 and parameters: {'model_type': 'graphsage', 'hidden_dims': '[256, 128]', 'dropout': 0.10085733521439913, 'batch_norm': False, 'lr': 1.09190189634402e-05, 'weight_decay': 1.082336638541815e-06, 'epochs': 65, 'loss': 'mae', 'optimizer': 'adam', 'graph_mode': 'cutoff', 'cutoff': 0.5157485749757096, 'grm_norm': 'none', 'self_loops': False, 'use_snp_selection': True, 'num_snps': 44729}. Best is trial 12 with value: 0.23781438417698325.
[I 2025-11-13 01:22:24,746] Trial 13 finished with value: 0.22139941605254912 and parameters: {'model_type': 'graphsage', 'hidden_dims': '[128, 64]', 'dropout': 0.10851671118583908, 'batch_norm': False, 'lr': 8.323375167637386e-06, 'weight_decay': 0.00036922279098827336, 'epochs': 86, 'loss': 'mae', 'optimizer': 'adam', 'graph_mode': 'cutoff', 'cutoff': 0.52761796921019, 'grm_norm': 'none', 'self_loops': False, 'use_snp_selection': True, 'num_snps': 42008}. Best is trial 12 with value: 0.23781438417698325.
[I 2025-11-13 01:23:42,934] Trial 14 finished with value: 0.23600829147981014 and parameters: {'model_type': 'graphsage', 'hidden_dims': '[512, 64]', 'dropout': 0.19354227952587097, 'batch_norm': False, 'lr': 1.0954453323538706e-05, 'weight_decay': 3.047822920964661e-06, 'epochs': 41, 'loss': 'mae', 'optimizer': 'adam', 'graph_mode': 'cutoff', 'cutoff': 0.5622929142330101, 'grm_norm': 'none', 'self_loops': False, 'use_snp_selection': True, 'num_snps': 42407}. Best is trial 12 with value: 0.23781438417698325.
[I 2025-11-13 01:25:33,479] Trial 15 finished with value: 0.21249348876170315 and parameters: {'model_type': 'graphsage', 'hidden_dims': '[512, 128]', 'dropout': 0.2675418122434625, 'batch_norm': False, 'lr': 1.944831542515634e-06, 'weight_decay': 0.000133683300025728, 'epochs': 95, 'loss': 'mae', 'optimizer': 'adam', 'graph_mode': 'cutoff', 'cutoff': 0.7206484418789363, 'grm_norm': 'none', 'self_loops': False, 'use_snp_selection': True, 'num_snps': 50873}. Best is trial 12 with value: 0.23781438417698325.
[I 2025-11-13 01:27:00,693] Trial 16 finished with value: 0.22886166133726218 and parameters: {'model_type': 'graphsage', 'hidden_dims': '[256, 128, 64]', 'dropout': 0.14434691541618178, 'batch_norm': False, 'lr': 0.00013847822027307613, 'weight_decay': 5.98078292453286e-06, 'epochs': 234, 'loss': 'mae', 'optimizer': 'adam', 'graph_mode': 'cutoff', 'cutoff': 0.4369939356897894, 'grm_norm': 'none', 'self_loops': False, 'use_snp_selection': True, 'num_snps': 21808}. Best is trial 12 with value: 0.23781438417698325.
[I 2025-11-13 01:28:10,034] Trial 17 finished with value: 0.21989502779472475 and parameters: {'model_type': 'graphsage', 'hidden_dims': '[128, 64]', 'dropout': 0.164558845335464, 'batch_norm': False, 'lr': 1.8899183812352973e-05, 'weight_decay': 1.0577187298209603e-07, 'epochs': 119, 'loss': 'mae', 'optimizer': 'adam', 'graph_mode': 'cutoff', 'cutoff': 0.689446088204793, 'grm_norm': 'cosine', 'self_loops': True, 'use_snp_selection': True, 'num_snps': 36976}. Best is trial 12 with value: 0.23781438417698325.
[I 2025-11-13 01:29:35,931] Trial 18 finished with value: 0.19790770685391484 and parameters: {'model_type': 'graphsage', 'hidden_dims': '[256, 128]', 'dropout': 0.2527577331012929, 'batch_norm': False, 'lr': 3.37848638514423e-06, 'weight_decay': 8.524462612720505e-07, 'epochs': 76, 'loss': 'mae', 'optimizer': 'adam', 'graph_mode': 'cutoff', 'cutoff': 0.8936413628145267, 'grm_norm': 'cosine_then_gcn', 'self_loops': False, 'use_snp_selection': True, 'num_snps': 53787}. Best is trial 12 with value: 0.23781438417698325.
[I 2025-11-13 01:30:31,767] Trial 19 finished with value: 0.2211452394368143 and parameters: {'model_type': 'graphsage', 'hidden_dims': '[128, 64]', 'dropout': 0.30743469495371856, 'batch_norm': False, 'lr': 8.572441266454076e-05, 'weight_decay': 8.897651603094925e-07, 'epochs': 309, 'loss': 'mae', 'optimizer': 'adam', 'graph_mode': 'cutoff', 'cutoff': 0.4497638283633368, 'grm_norm': 'none', 'self_loops': False, 'use_snp_selection': True, 'num_snps': 8182}. Best is trial 12 with value: 0.23781438417698325.
[I 2025-11-13 01:31:56,435] Trial 20 finished with value: 0.20496804465453966 and parameters: {'model_type': 'graphsage', 'hidden_dims': '[256, 128]', 'dropout': 0.15311807090042745, 'batch_norm': False, 'lr': 1.0031850713966547e-06, 'weight_decay': 7.8045241951255e-06, 'epochs': 150, 'loss': 'mae', 'optimizer': 'adam', 'graph_mode': 'cutoff', 'cutoff': 0.6320279881646863, 'grm_norm': 'none', 'self_loops': True, 'use_snp_selection': True, 'num_snps': 37038}. Best is trial 12 with value: 0.23781438417698325.
[I 2025-11-13 01:33:18,038] Trial 21 finished with value: 0.23317707841767196 and parameters: {'model_type': 'graphsage', 'hidden_dims': '[512, 64]', 'dropout': 0.20591509472386857, 'batch_norm': False, 'lr': 1.1406203279470023e-05, 'weight_decay': 2.1571862825229127e-06, 'epochs': 44, 'loss': 'mae', 'optimizer': 'adam', 'graph_mode': 'cutoff', 'cutoff': 0.512916483436637, 'grm_norm': 'none', 'self_loops': False, 'use_snp_selection': True, 'num_snps': 43066}. Best is trial 12 with value: 0.23781438417698325.
[I 2025-11-13 01:34:45,692] Trial 22 finished with value: 0.24422455944019061 and parameters: {'model_type': 'graphsage', 'hidden_dims': '[512, 64]', 'dropout': 0.1751934720574605, 'batch_norm': False, 'lr': 1.40478653359876e-05, 'weight_decay': 3.4942807341977406e-06, 'epochs': 53, 'loss': 'mae', 'optimizer': 'adam', 'graph_mode': 'cutoff', 'cutoff': 0.610803000049484, 'grm_norm': 'none', 'self_loops': False, 'use_snp_selection': True, 'num_snps': 47425}. Best is trial 22 with value: 0.24422455944019061.
[I 2025-11-13 01:36:22,467] Trial 23 finished with value: 0.24588175498575632 and parameters: {'model_type': 'graphsage', 'hidden_dims': '[512, 64]', 'dropout': 0.10400942173620376, 'batch_norm': False, 'lr': 1.7153923222146193e-05, 'weight_decay': 2.744423818834789e-05, 'epochs': 69, 'loss': 'mae', 'optimizer': 'adam', 'graph_mode': 'cutoff', 'cutoff': 0.6552089028098674, 'grm_norm': 'none', 'self_loops': False, 'use_snp_selection': True, 'num_snps': 49416}. Best is trial 23 with value: 0.24588175498575632.
[I 2025-11-13 01:38:32,584] Trial 24 finished with value: 0.23549265330618777 and parameters: {'model_type': 'graphsage', 'hidden_dims': '[512, 64]', 'dropout': 0.5984005703393165, 'batch_norm': False, 'lr': 1.621743981072016e-05, 'weight_decay': 3.0378767090636587e-07, 'epochs': 107, 'loss': 'mae', 'optimizer': 'adam', 'graph_mode': 'cutoff', 'cutoff': 0.7998010843759705, 'grm_norm': 'none', 'self_loops': False, 'use_snp_selection': True, 'num_snps': 59414}. Best is trial 23 with value: 0.24588175498575632.
[I 2025-11-13 01:40:25,580] Trial 25 finished with value: 0.20786402981493643 and parameters: {'model_type': 'graphsage', 'hidden_dims': '[512, 64]', 'dropout': 0.17169469789204872, 'batch_norm': False, 'lr': 4.882156065879792e-06, 'weight_decay': 5.420499693860713e-06, 'epochs': 70, 'loss': 'mae', 'optimizer': 'adam', 'graph_mode': 'cutoff', 'cutoff': 0.45137589565709185, 'grm_norm': 'cosine_then_gcn', 'self_loops': False, 'use_snp_selection': True, 'num_snps': 47827}. Best is trial 23 with value: 0.24588175498575632.
[I 2025-11-13 01:41:42,304] Trial 26 finished with value: 0.17955601022253975 and parameters: {'model_type': 'graphsage', 'hidden_dims': '[512, 64]', 'dropout': 0.10114583088892892, 'batch_norm': True, 'lr': 4.792126077965082e-06, 'weight_decay': 1.3640564430442694e-06, 'epochs': 94, 'loss': 'mse', 'optimizer': 'adam', 'graph_mode': 'cutoff', 'cutoff': 0.6131786361686448, 'grm_norm': 'cosine', 'self_loops': False, 'use_snp_selection': False}. Best is trial 23 with value: 0.24588175498575632.
[I 2025-11-13 01:43:01,149] Trial 27 finished with value: 0.2408324023542087 and parameters: {'model_type': 'graphsage', 'hidden_dims': '[512, 64]', 'dropout': 0.23554198810709928, 'batch_norm': False, 'lr': 1.5089498649010225e-05, 'weight_decay': 9.096918760018813e-05, 'epochs': 66, 'loss': 'mae', 'optimizer': 'adam', 'graph_mode': 'cutoff', 'cutoff': 0.8032293831899493, 'grm_norm': 'gcn', 'self_loops': False, 'use_snp_selection': True, 'num_snps': 35208}. Best is trial 23 with value: 0.24588175498575632.
[I 2025-11-13 01:44:35,378] Trial 28 finished with value: 0.2370559664342487 and parameters: {'model_type': 'graphsage', 'hidden_dims': '[512, 64]', 'dropout': 0.23277622698093958, 'batch_norm': False, 'lr': 4.925542193675628e-05, 'weight_decay': 0.0001137496134397672, 'epochs': 121, 'loss': 'mae', 'optimizer': 'adam', 'graph_mode': 'cutoff', 'cutoff': 0.7850109434921815, 'grm_norm': 'gcn', 'self_loops': False, 'use_snp_selection': True, 'num_snps': 34473}. Best is trial 23 with value: 0.24588175498575632.
[I 2025-11-13 01:51:33,419] Trial 29 finished with value: 0.2138826268410238 and parameters: {'model_type': 'graphsage', 'hidden_dims': '[512, 64]', 'dropout': 0.28239630879609645, 'batch_norm': True, 'lr': 2.5394959114133764e-05, 'weight_decay': 4.6278096066208265e-05, 'epochs': 336, 'loss': 'mae', 'optimizer': 'adam', 'graph_mode': 'knn', 'source': 'grm', 'knn_k': 10, 'weighted_edges': True, 'symmetrize_mode': 'union', 'use_snp_selection': False}. Best is trial 23 with value: 0.24588175498575632.
[I 2025-11-13 01:52:55,503] Trial 30 finished with value: 0.22996763973383189 and parameters: {'model_type': 'graphsage', 'hidden_dims': '[512, 64]', 'dropout': 0.19015163920759626, 'batch_norm': False, 'lr': 1.5893966654698478e-05, 'weight_decay': 0.00024257276958197942, 'epochs': 160, 'loss': 'mae', 'optimizer': 'adam', 'graph_mode': 'cutoff', 'cutoff': 0.7845743516049724, 'grm_norm': 'gcn', 'self_loops': True, 'use_snp_selection': True, 'num_snps': 22277}. Best is trial 23 with value: 0.24588175498575632.
[I 2025-11-13 01:54:33,289] Trial 31 finished with value: 0.23303657269392053 and parameters: {'model_type': 'graphsage', 'hidden_dims': '[512, 64]', 'dropout': 0.13793301430098698, 'batch_norm': False, 'lr': 1.20021830813101e-05, 'weight_decay': 1.3573790295389528e-05, 'epochs': 61, 'loss': 'mae', 'optimizer': 'adam', 'graph_mode': 'cutoff', 'cutoff': 0.629832775826888, 'grm_norm': 'gcn', 'self_loops': False, 'use_snp_selection': True, 'num_snps': 53122}. Best is trial 23 with value: 0.24588175498575632.
